results/pipeline_repro_20260304T064729Z/bucket_torch_case_compare_eval.csv
workload,shape_id,M,N,K,dtype,gpu,BLOCK_M,BLOCK_N,BLOCK_K,bucket_key,shape,runtime_cost_us_TORCH,runtime_cost_us_BUCKET,runtime_cost_us_FULL_TUNE,config_id_TORCH,config_id_BUCKET,config_id_FULL_TUNE,config_desc_TORCH,config_desc_BUCKET,config_desc_FULL_TUNE,invalid_config_TORCH,invalid_config_BUCKET,invalid_config_FULL_TUNE,timing_source_TORCH,timing_source_BUCKET,timing_source_FULL_TUNE,speed_BUCKET_over_TORCH,speed_FULL_TUNE_over_TORCH,speed_BUCKET_over_FULL_TUNE
bucket_torch_npu,bucket_torch_eval_000,32,1536,1024,fp16,Ascend910B2,16,128,128,3,32x1536x1024,5.98,6.41,6.05,torch_mm_npu,c24,c18,,"BM=16,BN=128,BK=128","BM=64,BN=128,BK=128",0,0,0,npu_profiler_batch_offline_kernel_step,npu_profiler_batch_offline_kernel_step,npu_profiler_batch_offline_kernel_step,0.932917,0.988430,0.943838
bucket_torch_npu,bucket_torch_eval_001,32,2048,8192,fp16,Ascend910B2,16,128,128,2,32x2048x8192,21.41,61.260000000000005,33.471000000000004,torch_mm_npu,c24,c23,,"BM=16,BN=128,BK=128","BM=128,BN=128,BK=128",0,0,0,npu_profiler_batch_offline_kernel_step,npu_profiler_batch_offline_kernel_step,npu_profiler_batch_offline_kernel_step,0.349494,0.639658,0.546376
bucket_torch_npu,bucket_torch_eval_002,16,2048,4096,fp16,Ascend910B2,16,128,128,2,16x2048x4096,11.370000000000001,17.38,17.500999999999998,torch_mm_npu,c24,c24,,"BM=16,BN=128,BK=128","BM=16,BN=128,BK=128",0,0,0,npu_profiler_batch_offline_kernel_step,npu_profiler_batch_offline_kernel_step,npu_profiler_batch_offline_kernel_step,0.654200,0.649677,1.006962
bucket_torch_npu,bucket_torch_eval_003,16,2048,1536,fp16,Ascend910B2,16,128,128,3,16x2048x1536,6.1899999999999995,8.120000000000001,8.15,torch_mm_npu,c24,c24,,"BM=16,BN=128,BK=128","BM=16,BN=128,BK=128",0,0,0,npu_profiler_batch_offline_kernel_step,npu_profiler_batch_offline_kernel_step,npu_profiler_batch_offline_kernel_step,0.762315,0.759509,1.003695
bucket_torch_npu,bucket_torch_eval_004,64,8192,2048,fp16,Ascend910B2,64,128,128,1,64x8192x2048,21.68,29.861,29.131,torch_mm_npu,c18,c18,,"BM=64,BN=128,BK=128","BM=64,BN=128,BK=128",0,0,0,npu_profiler_batch_offline_kernel_step,npu_profiler_batch_offline_kernel_step,npu_profiler_batch_offline_kernel_step,0.726031,0.744224,0.975553
bucket_torch_npu,bucket_torch_eval_005,64,3072,8192,fp16,Ascend910B2,64,128,128,0,64x3072x8192,26.02,39.7,39.351,torch_mm_npu,c18,c18,,"BM=64,BN=128,BK=128","BM=64,BN=128,BK=128",0,0,0,npu_profiler_batch_offline_kernel_step,npu_profiler_batch_offline_kernel_step,npu_profiler_batch_offline_kernel_step,0.655416,0.661228,0.991209
bucket_torch_npu,bucket_torch_eval_006,32,2048,2048,fp16,Ascend910B2,16,128,128,3,32x2048x2048,7.52,17.3,10.350999999999999,torch_mm_npu,c24,c18,,"BM=16,BN=128,BK=128","BM=64,BN=128,BK=128",0,0,0,npu_profiler_batch_offline_kernel_step,npu_profiler_batch_offline_kernel_step,npu_profiler_batch_offline_kernel_step,0.434682,0.726500,0.598324
bucket_torch_npu,bucket_torch_eval_007,8,8192,2048,fp16,Ascend910B2,64,128,128,1,8x8192x2048,19.810000000000002,25.891,23.201,torch_mm_npu,c18,c29,,"BM=64,BN=128,BK=128","BM=16,BN=256,BK=128",0,0,0,npu_profiler_batch_offline_kernel_step,npu_profiler_batch_offline_kernel_step,npu_profiler_batch_offline_kernel_step,0.765131,0.853843,0.896103
