results/pipeline_repro_20260304T061739Z/prototype_best.csv
shape,picked_config_id,BLOCK_M,BLOCK_N,BLOCK_K,runtime_cost_us,invalid_config,score,notes
8x2048x4096,c24,16,128,128,17.1,0,17.1,"path_reordered;launch=fixed_cores(16),swizzle2d_g=4,dir=1;timing=npu_profiler_batch_offline_kernel_step"
64x6144x1024,c18,64,128,128,13.361,0,13.361,"path_reordered;launch=fixed_cores(24),swizzle2d_g=4,dir=1;timing=npu_profiler_batch_offline_kernel_step"
4x6144x1024,c29,16,256,128,8.161,0,8.161,"path_reordered;launch=fixed_cores(24),swizzle2d_g=4,dir=1;timing=npu_profiler_batch_offline_kernel_step"
64x8192x8192,c18,64,128,128,105.12100000000001,0,105.12100000000001,"path_reordered;launch=fixed_cores(24),swizzle2d_g=4,dir=1;timing=npu_profiler_batch_offline_kernel_step"
