results/pipeline_repro_20260304T095957Z/bucket_torch_case_compare_eval.csv
workload,shape_id,M,N,K,dtype,gpu,BLOCK_M,BLOCK_N,BLOCK_K,bucket_key,shape,runtime_cost_us_TORCH,runtime_cost_us_BUCKET,config_id_BUCKET,config_desc_BUCKET,invalid_config_TORCH,invalid_config_BUCKET,timing_source_TORCH,timing_source_BUCKET,speedup_BUCKET_vs_TORCH
bucket_torch_npu,bucket_torch_eval_000,32,1536,1024,fp16,Ascend910B2,64,64,512,7,32x1536x1024,6.08,5.9,c5,"c5 BM=64,BN=64,BK=512",0,0,npu_profiler_batch_offline_kernel_step,npu_profiler_batch_offline_kernel_step,1.030508
bucket_torch_npu,bucket_torch_eval_001,32,2048,8192,fp16,Ascend910B2,64,128,256,6,32x2048x8192,21.622,27.06,c4,"c4 BM=64,BN=128,BK=256",0,0,npu_profiler_batch_offline_kernel_step,npu_profiler_batch_offline_kernel_step,0.799039
bucket_torch_npu,bucket_torch_eval_002,16,2048,4096,fp16,Ascend910B2,64,128,256,6,16x2048x4096,12.04,14.2,c4,"c4 BM=64,BN=128,BK=256",0,0,npu_profiler_batch_offline_kernel_step,npu_profiler_batch_offline_kernel_step,0.847887
bucket_torch_npu,bucket_torch_eval_003,16,2048,1536,fp16,Ascend910B2,64,64,512,7,16x2048x1536,6.28,10.84,c5,"c5 BM=64,BN=64,BK=512",0,0,npu_profiler_batch_offline_kernel_step,npu_profiler_batch_offline_kernel_step,0.579336
