results/pipeline_repro_20260304T094132Z/prototype_best.csv
shape,picked_config_id,BLOCK_M,BLOCK_N,BLOCK_K,runtime_cost_us,invalid_config,score,notes
8x2048x4096,c24,16,128,128,17.26,0,17.26,"path_reordered;launch=fixed_cores(16),swizzle2d_g=4,dir=1;timing=npu_profiler_batch_offline_kernel_step"
64x6144x1024,c23,128,128,128,13.3,0,13.3,"path_reordered;launch=fixed_cores(24),swizzle2d_g=4,dir=1;timing=npu_profiler_batch_offline_kernel_step"
4x6144x1024,c29,16,256,128,8.54,0,8.54,"path_reordered;launch=fixed_cores(24),swizzle2d_g=4,dir=1;timing=npu_profiler_batch_offline_kernel_step"
64x8192x8192,c18,64,128,128,103.784,0,103.784,"path_reordered;launch=fixed_cores(24),swizzle2d_g=4,dir=1;timing=npu_profiler_batch_offline_kernel_step"
