results/pipeline_repro_20260304T041309Z/bucket_torch_case_compare_eval.csv
workload,shape_id,M,N,K,dtype,gpu,BLOCK_M,BLOCK_N,BLOCK_K,bucket_key,shape,runtime_cost_us_TORCH,runtime_cost_us_BUCKET,config_id_TORCH,config_id_BUCKET,config_desc_TORCH,config_desc_BUCKET,invalid_config_TORCH,invalid_config_BUCKET,timing_source_TORCH,timing_source_BUCKET,ratio_BUCKET_over_TORCH,delta_us_BUCKET_minus_TORCH
bucket_torch_npu,bucket_torch_eval_000,32,1536,1024,fp16,Ascend910B2,16,256,128,7,32x1536x1024,6.04,7.52,torch_mm_npu,c29,"torch.mm(dtype=fp16,device=npu)","BM=16,BN=256,BK=128",0,0,npu_profiler_batch_offline_kernel_step,npu_profiler_batch_offline_kernel_step,1.245033,1.480000
bucket_torch_npu,bucket_torch_eval_001,32,2048,8192,fp16,Ascend910B2,16,256,128,6,32x2048x8192,23.92,39.94,torch_mm_npu,c29,"torch.mm(dtype=fp16,device=npu)","BM=16,BN=256,BK=128",0,0,npu_profiler_batch_offline_kernel_step,npu_profiler_batch_offline_kernel_step,1.669732,16.020000
bucket_torch_npu,bucket_torch_eval_002,16,2048,4096,fp16,Ascend910B2,16,256,128,6,16x2048x4096,13.46,22.06,torch_mm_npu,c29,"torch.mm(dtype=fp16,device=npu)","BM=16,BN=256,BK=128",0,0,npu_profiler_batch_offline_kernel_step,npu_profiler_batch_offline_kernel_step,1.638930,8.600000
bucket_torch_npu,bucket_torch_eval_003,16,2048,1536,fp16,Ascend910B2,16,256,128,7,16x2048x1536,6.86,9.26,torch_mm_npu,c29,"torch.mm(dtype=fp16,device=npu)","BM=16,BN=256,BK=128",0,0,npu_profiler_batch_offline_kernel_step,npu_profiler_batch_offline_kernel_step,1.349854,2.400000
