results/pipeline_repro_20260304T094514Z/bucket_torch.csv
timestamp,method,workload,split,shape_id,M,N,K,dtype,gpu,config_id,BLOCK_M,BLOCK_N,BLOCK_K,compile_time_ms,tune_time_ms,runtime_cost_us,bucket_key,cache_key,invalid_config,notes
2026-03-04T09:45:48.506674+00:00,BUCKET,bucket_torch_npu,tune,bucket_torch_tune_000,8,2048,4096,fp16,Ascend910B2,c18,64,128,128,3.726057708263397,26183.436,17.22,2,bucket_g2,0,"batch_tune;path_reordered;launch=fixed_cores(16),swizzle2d_g=4,dir=1;timing=npu_profiler_batch_offline_kernel_step"
2026-03-04T09:45:48.506752+00:00,BUCKET,bucket_torch_npu,tune,bucket_torch_tune_001,32,2048,8192,fp16,Ascend910B2,c18,64,128,128,3.726057708263397,0.0,17.22,2,bucket_g2,0,"batch_tune;path_reordered;launch=fixed_cores(16),swizzle2d_g=4,dir=1;timing=npu_profiler_batch_offline_kernel_step"
2026-03-04T09:45:48.506778+00:00,BUCKET,bucket_torch_npu,tune,bucket_torch_tune_002,64,8192,8192,fp16,Ascend910B2,c18,64,128,128,0.0,0.0,104.742,0,bucket_g0,0,"batch_tune;path_reordered;launch=fixed_cores(24),swizzle2d_g=4,dir=1;timing=npu_profiler_batch_offline_kernel_step"
2026-03-04T09:45:48.506800+00:00,BUCKET,bucket_torch_npu,tune,bucket_torch_tune_003,1,3072,1536,fp16,Ascend910B2,c30,32,128,128,0.0,0.0,8.4,5,bucket_g5,0,"batch_tune;path_reordered;launch=fixed_cores(24),swizzle2d_g=4,dir=1;timing=npu_profiler_batch_offline_kernel_step"
2026-03-04T09:45:48.506820+00:00,BUCKET,bucket_torch_npu,tune,bucket_torch_tune_004,8,1024,1536,fp16,Ascend910B2,c30,32,128,128,0.0,0.0,7.8,3,bucket_g3,0,"batch_tune;path_reordered;launch=fixed_cores(8),swizzle2d_g=4,dir=1;timing=npu_profiler_batch_offline_kernel_step"
2026-03-04T09:45:48.506839+00:00,BUCKET,bucket_torch_npu,tune,bucket_torch_tune_005,1,4096,8192,fp16,Ascend910B2,c22,64,256,64,0.0,0.0,56.78,4,bucket_g4,0,"batch_tune;path_reordered;launch=fixed_cores(16),swizzle2d_g=4,dir=1;timing=npu_profiler_batch_offline_kernel_step"
2026-03-04T09:45:48.506857+00:00,BUCKET,bucket_torch_npu,tune,bucket_torch_tune_006,4,6144,1024,fp16,Ascend910B2,c30,32,128,128,0.0,0.0,8.4,5,bucket_g5,0,"batch_tune;path_reordered;launch=fixed_cores(24),swizzle2d_g=4,dir=1;timing=npu_profiler_batch_offline_kernel_step"
2026-03-04T09:45:48.506874+00:00,BUCKET,bucket_torch_npu,tune,bucket_torch_tune_007,64,6144,1024,fp16,Ascend910B2,c18,64,128,128,0.0,0.0,13.26,1,bucket_g1,0,"batch_tune;path_reordered;launch=fixed_cores(24),swizzle2d_g=4,dir=1;timing=npu_profiler_batch_offline_kernel_step"
2026-03-04T09:45:48.506892+00:00,BUCKET,bucket_torch_npu,tune,bucket_torch_tune_008,64,1536,3072,fp16,Ascend910B2,c30,32,128,128,0.0,0.0,7.8,3,bucket_g3,0,"batch_tune;path_reordered;launch=fixed_cores(8),swizzle2d_g=4,dir=1;timing=npu_profiler_batch_offline_kernel_step"
2026-03-04T09:45:48.506910+00:00,BUCKET,bucket_torch_npu,tune,bucket_torch_tune_009,2,4096,3072,fp16,Ascend910B2,c30,32,128,128,0.0,0.0,8.4,5,bucket_g5,0,"batch_tune;path_reordered;launch=fixed_cores(24),swizzle2d_g=4,dir=1;timing=npu_profiler_batch_offline_kernel_step"
2026-03-04T09:45:48.506927+00:00,BUCKET,bucket_torch_npu,tune,bucket_torch_tune_010,32,3072,1536,fp16,Ascend910B2,c18,64,128,128,0.0,0.0,13.26,1,bucket_g1,0,"batch_tune;path_reordered;launch=fixed_cores(24),swizzle2d_g=4,dir=1;timing=npu_profiler_batch_offline_kernel_step"
2026-03-04T09:45:48.506945+00:00,BUCKET,bucket_torch_npu,tune,bucket_torch_tune_011,2,1536,1024,fp16,Ascend910B2,c18,64,128,128,0.0,0.0,5.74,7,bucket_g7,0,"batch_tune;path_reordered;launch=fixed_cores(12),swizzle2d_g=4,dir=1;timing=npu_profiler_batch_offline_kernel_step"
2026-03-04T09:45:48.506963+00:00,BUCKET,bucket_torch_npu,tune,bucket_torch_tune_012,4,1536,4096,fp16,Ascend910B2,c30,32,128,128,0.0,0.0,16.8,6,bucket_g6,0,"batch_tune;path_reordered;launch=fixed_cores(12),swizzle2d_g=4,dir=1;timing=npu_profiler_batch_offline_kernel_step"
2026-03-04T09:45:48.506981+00:00,BUCKET,bucket_torch_npu,tune,bucket_torch_tune_013,64,6144,1024,fp16,Ascend910B2,c18,64,128,128,0.0,0.0,13.26,1,bucket_g1,0,"batch_tune;path_reordered;launch=fixed_cores(24),swizzle2d_g=4,dir=1;timing=npu_profiler_batch_offline_kernel_step"
2026-03-04T09:45:48.507000+00:00,BUCKET,bucket_torch_npu,tune,bucket_torch_tune_014,32,4096,2048,fp16,Ascend910B2,c18,64,128,128,0.0,0.0,13.26,1,bucket_g1,0,"batch_tune;path_reordered;launch=fixed_cores(24),swizzle2d_g=4,dir=1;timing=npu_profiler_batch_offline_kernel_step"
2026-03-04T09:45:48.507017+00:00,BUCKET,bucket_torch_npu,tune,bucket_torch_tune_015,32,1536,3072,fp16,Ascend910B2,c30,32,128,128,0.0,0.0,7.8,3,bucket_g3,0,"batch_tune;path_reordered;launch=fixed_cores(8),swizzle2d_g=4,dir=1;timing=npu_profiler_batch_offline_kernel_step"
2026-03-04T09:45:48.507040+00:00,BUCKET,bucket_torch_npu,eval,bucket_torch_eval_000,32,1536,1024,fp16,Ascend910B2,c30,32,128,128,0.0,0.0,6.24,3,bucket_g3,0,"batch_tune;path_reordered;launch=fixed_cores(12),swizzle2d_g=4,dir=1;timing=npu_profiler_batch_offline_kernel_step"
2026-03-04T09:45:48.507057+00:00,BUCKET,bucket_torch_npu,eval,bucket_torch_eval_001,32,2048,8192,fp16,Ascend910B2,c18,64,128,128,0.0,0.0,33.88,2,bucket_g2,0,"batch_tune;path_reordered;launch=fixed_cores(16),swizzle2d_g=4,dir=1;timing=npu_profiler_batch_offline_kernel_step"
2026-03-04T09:45:48.507074+00:00,BUCKET,bucket_torch_npu,eval,bucket_torch_eval_002,16,2048,4096,fp16,Ascend910B2,c18,64,128,128,0.0,0.0,17.72,2,bucket_g2,0,"batch_tune;path_reordered;launch=fixed_cores(16),swizzle2d_g=4,dir=1;timing=npu_profiler_batch_offline_kernel_step"
2026-03-04T09:45:48.507091+00:00,BUCKET,bucket_torch_npu,eval,bucket_torch_eval_003,16,2048,1536,fp16,Ascend910B2,c30,32,128,128,0.0,0.0,8.08,3,bucket_g3,0,"batch_tune;path_reordered;launch=fixed_cores(16),swizzle2d_g=4,dir=1;timing=npu_profiler_batch_offline_kernel_step"
2026-03-04T09:45:48.507107+00:00,BUCKET,bucket_torch_npu,eval,bucket_torch_eval_004,64,8192,2048,fp16,Ascend910B2,c18,64,128,128,0.0,0.0,29.98,1,bucket_g1,0,"batch_tune;path_reordered;launch=fixed_cores(24),swizzle2d_g=4,dir=1;timing=npu_profiler_batch_offline_kernel_step"
2026-03-04T09:45:48.507123+00:00,BUCKET,bucket_torch_npu,eval,bucket_torch_eval_005,64,3072,8192,fp16,Ascend910B2,c18,64,128,128,0.0,0.0,39.3,0,bucket_g0,0,"batch_tune;path_reordered;launch=fixed_cores(24),swizzle2d_g=4,dir=1;timing=npu_profiler_batch_offline_kernel_step"
2026-03-04T09:45:48.507140+00:00,BUCKET,bucket_torch_npu,eval,bucket_torch_eval_006,32,2048,2048,fp16,Ascend910B2,c30,32,128,128,0.0,0.0,10.42,3,bucket_g3,0,"batch_tune;path_reordered;launch=fixed_cores(16),swizzle2d_g=4,dir=1;timing=npu_profiler_batch_offline_kernel_step"
2026-03-04T09:45:48.507156+00:00,BUCKET,bucket_torch_npu,eval,bucket_torch_eval_007,8,8192,2048,fp16,Ascend910B2,c18,64,128,128,0.0,0.0,26.14,1,bucket_g1,0,"batch_tune;path_reordered;launch=fixed_cores(24),swizzle2d_g=4,dir=1;timing=npu_profiler_batch_offline_kernel_step"
2026-03-04T09:45:48.507173+00:00,BUCKET,bucket_torch_npu,eval,bucket_torch_eval_008,64,1536,8192,fp16,Ascend910B2,c18,64,128,128,0.0,0.0,34.44,2,bucket_g2,0,"batch_tune;path_reordered;launch=fixed_cores(12),swizzle2d_g=4,dir=1;timing=npu_profiler_batch_offline_kernel_step"
2026-03-04T09:45:48.507189+00:00,BUCKET,bucket_torch_npu,eval,bucket_torch_eval_009,64,4096,6144,fp16,Ascend910B2,c18,64,128,128,0.0,0.0,53.982,0,bucket_g0,0,"batch_tune;path_reordered;launch=fixed_cores(24),swizzle2d_g=4,dir=1;timing=npu_profiler_batch_offline_kernel_step"
2026-03-04T09:45:48.507206+00:00,BUCKET,bucket_torch_npu,eval,bucket_torch_eval_010,64,2048,4096,fp16,Ascend910B2,c18,64,128,128,0.0,0.0,19.88,2,bucket_g2,0,"batch_tune;path_reordered;launch=fixed_cores(16),swizzle2d_g=4,dir=1;timing=npu_profiler_batch_offline_kernel_step"
2026-03-04T09:45:48.507222+00:00,BUCKET,bucket_torch_npu,eval,bucket_torch_eval_011,32,3072,6144,fp16,Ascend910B2,c18,64,128,128,0.0,0.0,28.2,0,bucket_g0,0,"batch_tune;path_reordered;launch=fixed_cores(24),swizzle2d_g=4,dir=1;timing=npu_profiler_batch_offline_kernel_step"
2026-03-04T09:45:48.507238+00:00,BUCKET,bucket_torch_npu,eval,bucket_torch_eval_012,16,1536,1536,fp16,Ascend910B2,c30,32,128,128,0.0,0.0,7.9,3,bucket_g3,0,"batch_tune;path_reordered;launch=fixed_cores(12),swizzle2d_g=4,dir=1;timing=npu_profiler_batch_offline_kernel_step"
2026-03-04T09:45:48.507254+00:00,BUCKET,bucket_torch_npu,eval,bucket_torch_eval_013,64,2048,3072,fp16,Ascend910B2,c30,32,128,128,0.0,0.0,25.38,3,bucket_g3,0,"batch_tune;path_reordered;launch=fixed_cores(24),swizzle2d_g=4,dir=1;timing=npu_profiler_batch_offline_kernel_step"
2026-03-04T09:45:48.507270+00:00,BUCKET,bucket_torch_npu,eval,bucket_torch_eval_014,16,8192,6144,fp16,Ascend910B2,c18,64,128,128,0.0,0.0,71.822,0,bucket_g0,0,"batch_tune;path_reordered;launch=fixed_cores(24),swizzle2d_g=4,dir=1;timing=npu_profiler_batch_offline_kernel_step"
2026-03-04T09:45:48.507286+00:00,BUCKET,bucket_torch_npu,eval,bucket_torch_eval_015,64,6144,1536,fp16,Ascend910B2,c18,64,128,128,0.0,0.0,17.2,1,bucket_g1,0,"batch_tune;path_reordered;launch=fixed_cores(24),swizzle2d_g=4,dir=1;timing=npu_profiler_batch_offline_kernel_step"
2026-03-04T09:45:48.360198+00:00,TORCH,bucket_torch_npu,eval,bucket_torch_eval_000,32,1536,1024,fp16,Ascend910B2,torch_mm_npu,-1,-1,-1,564.8905448615551,0.0,5.92,3,torch_mm_npu,0,torch_mm_npu;timing=npu_profiler_batch_offline_kernel_step
2026-03-04T09:45:48.360259+00:00,TORCH,bucket_torch_npu,eval,bucket_torch_eval_001,32,2048,8192,fp16,Ascend910B2,torch_mm_npu,-1,-1,-1,0.0,0.0,21.78,2,torch_mm_npu,0,torch_mm_npu;timing=npu_profiler_batch_offline_kernel_step
2026-03-04T09:45:48.360275+00:00,TORCH,bucket_torch_npu,eval,bucket_torch_eval_002,16,2048,4096,fp16,Ascend910B2,torch_mm_npu,-1,-1,-1,0.0,0.0,11.76,2,torch_mm_npu,0,torch_mm_npu;timing=npu_profiler_batch_offline_kernel_step
2026-03-04T09:45:48.360288+00:00,TORCH,bucket_torch_npu,eval,bucket_torch_eval_003,16,2048,1536,fp16,Ascend910B2,torch_mm_npu,-1,-1,-1,0.0,0.0,6.182,3,torch_mm_npu,0,torch_mm_npu;timing=npu_profiler_batch_offline_kernel_step
2026-03-04T09:45:48.360300+00:00,TORCH,bucket_torch_npu,eval,bucket_torch_eval_004,64,8192,2048,fp16,Ascend910B2,torch_mm_npu,-1,-1,-1,0.0,0.0,21.76,1,torch_mm_npu,0,torch_mm_npu;timing=npu_profiler_batch_offline_kernel_step
2026-03-04T09:45:48.360312+00:00,TORCH,bucket_torch_npu,eval,bucket_torch_eval_005,64,3072,8192,fp16,Ascend910B2,torch_mm_npu,-1,-1,-1,0.0,0.0,25.94,0,torch_mm_npu,0,torch_mm_npu;timing=npu_profiler_batch_offline_kernel_step
2026-03-04T09:45:48.360324+00:00,TORCH,bucket_torch_npu,eval,bucket_torch_eval_006,32,2048,2048,fp16,Ascend910B2,torch_mm_npu,-1,-1,-1,0.0,0.0,7.48,3,torch_mm_npu,0,torch_mm_npu;timing=npu_profiler_batch_offline_kernel_step
2026-03-04T09:45:48.360335+00:00,TORCH,bucket_torch_npu,eval,bucket_torch_eval_007,8,8192,2048,fp16,Ascend910B2,torch_mm_npu,-1,-1,-1,0.0,0.0,20.42,1,torch_mm_npu,0,torch_mm_npu;timing=npu_profiler_batch_offline_kernel_step
2026-03-04T09:45:48.360346+00:00,TORCH,bucket_torch_npu,eval,bucket_torch_eval_008,64,1536,8192,fp16,Ascend910B2,torch_mm_npu,-1,-1,-1,0.0,0.0,24.9,2,torch_mm_npu,0,torch_mm_npu;timing=npu_profiler_batch_offline_kernel_step
2026-03-04T09:45:48.360357+00:00,TORCH,bucket_torch_npu,eval,bucket_torch_eval_009,64,4096,6144,fp16,Ascend910B2,torch_mm_npu,-1,-1,-1,0.0,0.0,29.36,0,torch_mm_npu,0,torch_mm_npu;timing=npu_profiler_batch_offline_kernel_step
2026-03-04T09:45:48.360368+00:00,TORCH,bucket_torch_npu,eval,bucket_torch_eval_010,64,2048,4096,fp16,Ascend910B2,torch_mm_npu,-1,-1,-1,0.0,0.0,13.6,2,torch_mm_npu,0,torch_mm_npu;timing=npu_profiler_batch_offline_kernel_step
2026-03-04T09:45:48.360378+00:00,TORCH,bucket_torch_npu,eval,bucket_torch_eval_011,32,3072,6144,fp16,Ascend910B2,torch_mm_npu,-1,-1,-1,0.0,0.0,18.1,0,torch_mm_npu,0,torch_mm_npu;timing=npu_profiler_batch_offline_kernel_step
2026-03-04T09:45:48.360389+00:00,TORCH,bucket_torch_npu,eval,bucket_torch_eval_012,16,1536,1536,fp16,Ascend910B2,torch_mm_npu,-1,-1,-1,0.0,0.0,6.84,3,torch_mm_npu,0,torch_mm_npu;timing=npu_profiler_batch_offline_kernel_step
2026-03-04T09:45:48.360399+00:00,TORCH,bucket_torch_npu,eval,bucket_torch_eval_013,64,2048,3072,fp16,Ascend910B2,torch_mm_npu,-1,-1,-1,0.0,0.0,10.96,3,torch_mm_npu,0,torch_mm_npu;timing=npu_profiler_batch_offline_kernel_step
2026-03-04T09:45:48.360410+00:00,TORCH,bucket_torch_npu,eval,bucket_torch_eval_014,16,8192,6144,fp16,Ascend910B2,torch_mm_npu,-1,-1,-1,0.0,0.0,58.002,0,torch_mm_npu,0,torch_mm_npu;timing=npu_profiler_batch_offline_kernel_step
2026-03-04T09:45:48.360421+00:00,TORCH,bucket_torch_npu,eval,bucket_torch_eval_015,64,6144,1536,fp16,Ascend910B2,torch_mm_npu,-1,-1,-1,0.0,0.0,11.1,1,torch_mm_npu,0,torch_mm_npu;timing=npu_profiler_batch_offline_kernel_step
