results/pipeline_repro_20260304T093731Z/bucket_torch.csv
timestamp,method,workload,split,shape_id,M,N,K,dtype,gpu,config_id,BLOCK_M,BLOCK_N,BLOCK_K,compile_time_ms,tune_time_ms,runtime_cost_us,bucket_key,cache_key,invalid_config,notes
2026-03-04T09:38:24.883179+00:00,BUCKET,bucket_torch_npu,tune,bucket_torch_tune_000,8,2048,4096,fp16,Ascend910B2,c18,64,128,128,0.0,18521.36,17.52,2,bucket_g2,0,"batch_tune;path_reordered;launch=fixed_cores(16),swizzle2d_g=4,dir=1;timing=npu_profiler_batch_offline_kernel_step"
2026-03-04T09:38:24.883257+00:00,BUCKET,bucket_torch_npu,tune,bucket_torch_tune_001,32,2048,8192,fp16,Ascend910B2,c18,64,128,128,0.0,0.0,17.52,2,bucket_g2,0,"batch_tune;path_reordered;launch=fixed_cores(16),swizzle2d_g=4,dir=1;timing=npu_profiler_batch_offline_kernel_step"
2026-03-04T09:38:24.883281+00:00,BUCKET,bucket_torch_npu,tune,bucket_torch_tune_002,64,8192,8192,fp16,Ascend910B2,c18,64,128,128,0.0,0.0,104.044,0,bucket_g0,0,"batch_tune;path_reordered;launch=fixed_cores(24),swizzle2d_g=4,dir=1;timing=npu_profiler_batch_offline_kernel_step"
2026-03-04T09:38:24.883305+00:00,BUCKET,bucket_torch_npu,tune,bucket_torch_tune_003,1,3072,1536,fp16,Ascend910B2,c16,96,128,128,0.0,0.0,8.3,5,bucket_g5,0,"batch_tune;path_reordered;launch=fixed_cores(24),swizzle2d_g=4,dir=1;timing=npu_profiler_batch_offline_kernel_step"
2026-03-04T09:38:24.883326+00:00,BUCKET,bucket_torch_npu,tune,bucket_torch_tune_004,8,1024,1536,fp16,Ascend910B2,c18,64,128,128,0.0,0.0,7.72,3,bucket_g3,0,"batch_tune;path_reordered;launch=fixed_cores(8),swizzle2d_g=4,dir=1;timing=npu_profiler_batch_offline_kernel_step"
2026-03-04T09:38:24.883344+00:00,BUCKET,bucket_torch_npu,tune,bucket_torch_tune_005,1,4096,8192,fp16,Ascend910B2,c29,16,256,128,0.0,0.0,39.222,4,bucket_g4,0,"batch_tune;path_reordered;launch=fixed_cores(16),swizzle2d_g=4,dir=1;timing=npu_profiler_batch_offline_kernel_step"
2026-03-04T09:38:24.883364+00:00,BUCKET,bucket_torch_npu,tune,bucket_torch_tune_006,4,6144,1024,fp16,Ascend910B2,c16,96,128,128,0.0,0.0,8.3,5,bucket_g5,0,"batch_tune;path_reordered;launch=fixed_cores(24),swizzle2d_g=4,dir=1;timing=npu_profiler_batch_offline_kernel_step"
2026-03-04T09:38:24.883383+00:00,BUCKET,bucket_torch_npu,tune,bucket_torch_tune_007,64,6144,1024,fp16,Ascend910B2,c18,64,128,128,0.0,0.0,13.342,1,bucket_g1,0,"batch_tune;path_reordered;launch=fixed_cores(24),swizzle2d_g=4,dir=1;timing=npu_profiler_batch_offline_kernel_step"
2026-03-04T09:38:24.883403+00:00,BUCKET,bucket_torch_npu,tune,bucket_torch_tune_008,64,1536,3072,fp16,Ascend910B2,c18,64,128,128,0.0,0.0,7.72,3,bucket_g3,0,"batch_tune;path_reordered;launch=fixed_cores(8),swizzle2d_g=4,dir=1;timing=npu_profiler_batch_offline_kernel_step"
2026-03-04T09:38:24.883422+00:00,BUCKET,bucket_torch_npu,tune,bucket_torch_tune_009,2,4096,3072,fp16,Ascend910B2,c16,96,128,128,0.0,0.0,8.3,5,bucket_g5,0,"batch_tune;path_reordered;launch=fixed_cores(24),swizzle2d_g=4,dir=1;timing=npu_profiler_batch_offline_kernel_step"
2026-03-04T09:38:24.883440+00:00,BUCKET,bucket_torch_npu,tune,bucket_torch_tune_010,32,3072,1536,fp16,Ascend910B2,c18,64,128,128,0.0,0.0,13.342,1,bucket_g1,0,"batch_tune;path_reordered;launch=fixed_cores(24),swizzle2d_g=4,dir=1;timing=npu_profiler_batch_offline_kernel_step"
2026-03-04T09:38:24.883459+00:00,BUCKET,bucket_torch_npu,tune,bucket_torch_tune_011,2,1536,1024,fp16,Ascend910B2,c18,64,128,128,0.0,0.0,5.76,7,bucket_g7,0,"batch_tune;path_reordered;launch=fixed_cores(12),swizzle2d_g=4,dir=1;timing=npu_profiler_batch_offline_kernel_step"
2026-03-04T09:38:24.883479+00:00,BUCKET,bucket_torch_npu,tune,bucket_torch_tune_012,4,1536,4096,fp16,Ascend910B2,c16,96,128,128,0.0,0.0,16.622,6,bucket_g6,0,"batch_tune;path_reordered;launch=fixed_cores(12),swizzle2d_g=4,dir=1;timing=npu_profiler_batch_offline_kernel_step"
2026-03-04T09:38:24.883496+00:00,BUCKET,bucket_torch_npu,tune,bucket_torch_tune_013,64,6144,1024,fp16,Ascend910B2,c18,64,128,128,0.0,0.0,13.342,1,bucket_g1,0,"batch_tune;path_reordered;launch=fixed_cores(24),swizzle2d_g=4,dir=1;timing=npu_profiler_batch_offline_kernel_step"
2026-03-04T09:38:24.883512+00:00,BUCKET,bucket_torch_npu,tune,bucket_torch_tune_014,32,4096,2048,fp16,Ascend910B2,c18,64,128,128,0.0,0.0,13.342,1,bucket_g1,0,"batch_tune;path_reordered;launch=fixed_cores(24),swizzle2d_g=4,dir=1;timing=npu_profiler_batch_offline_kernel_step"
2026-03-04T09:38:24.883529+00:00,BUCKET,bucket_torch_npu,tune,bucket_torch_tune_015,32,1536,3072,fp16,Ascend910B2,c18,64,128,128,0.0,0.0,7.72,3,bucket_g3,0,"batch_tune;path_reordered;launch=fixed_cores(8),swizzle2d_g=4,dir=1;timing=npu_profiler_batch_offline_kernel_step"
2026-03-04T09:38:24.883555+00:00,BUCKET,bucket_torch_npu,eval,bucket_torch_eval_000,32,1536,1024,fp16,Ascend910B2,c18,64,128,128,0.0,0.0,6.04,3,bucket_g3,0,"batch_tune;path_reordered;launch=fixed_cores(12),swizzle2d_g=4,dir=1;timing=npu_profiler_batch_offline_kernel_step"
2026-03-04T09:38:24.883572+00:00,BUCKET,bucket_torch_npu,eval,bucket_torch_eval_001,32,2048,8192,fp16,Ascend910B2,c18,64,128,128,0.0,0.0,33.78,2,bucket_g2,0,"batch_tune;path_reordered;launch=fixed_cores(16),swizzle2d_g=4,dir=1;timing=npu_profiler_batch_offline_kernel_step"
2026-03-04T09:38:24.883589+00:00,BUCKET,bucket_torch_npu,eval,bucket_torch_eval_002,16,2048,4096,fp16,Ascend910B2,c18,64,128,128,0.0,0.0,17.682,2,bucket_g2,0,"batch_tune;path_reordered;launch=fixed_cores(16),swizzle2d_g=4,dir=1;timing=npu_profiler_batch_offline_kernel_step"
2026-03-04T09:38:24.883608+00:00,BUCKET,bucket_torch_npu,eval,bucket_torch_eval_003,16,2048,1536,fp16,Ascend910B2,c18,64,128,128,0.0,0.0,8.28,3,bucket_g3,0,"batch_tune;path_reordered;launch=fixed_cores(16),swizzle2d_g=4,dir=1;timing=npu_profiler_batch_offline_kernel_step"
2026-03-04T09:38:24.883624+00:00,BUCKET,bucket_torch_npu,eval,bucket_torch_eval_004,64,8192,2048,fp16,Ascend910B2,c18,64,128,128,0.0,0.0,30.92,1,bucket_g1,0,"batch_tune;path_reordered;launch=fixed_cores(24),swizzle2d_g=4,dir=1;timing=npu_profiler_batch_offline_kernel_step"
2026-03-04T09:38:24.883640+00:00,BUCKET,bucket_torch_npu,eval,bucket_torch_eval_005,64,3072,8192,fp16,Ascend910B2,c18,64,128,128,0.0,0.0,39.6,0,bucket_g0,0,"batch_tune;path_reordered;launch=fixed_cores(24),swizzle2d_g=4,dir=1;timing=npu_profiler_batch_offline_kernel_step"
2026-03-04T09:38:24.883656+00:00,BUCKET,bucket_torch_npu,eval,bucket_torch_eval_006,32,2048,2048,fp16,Ascend910B2,c18,64,128,128,0.0,0.0,10.362,3,bucket_g3,0,"batch_tune;path_reordered;launch=fixed_cores(16),swizzle2d_g=4,dir=1;timing=npu_profiler_batch_offline_kernel_step"
2026-03-04T09:38:24.883674+00:00,BUCKET,bucket_torch_npu,eval,bucket_torch_eval_007,8,8192,2048,fp16,Ascend910B2,c18,64,128,128,0.0,0.0,26.002,1,bucket_g1,0,"batch_tune;path_reordered;launch=fixed_cores(24),swizzle2d_g=4,dir=1;timing=npu_profiler_batch_offline_kernel_step"
2026-03-04T09:38:24.883690+00:00,BUCKET,bucket_torch_npu,eval,bucket_torch_eval_008,64,1536,8192,fp16,Ascend910B2,c18,64,128,128,0.0,0.0,35.282,2,bucket_g2,0,"batch_tune;path_reordered;launch=fixed_cores(12),swizzle2d_g=4,dir=1;timing=npu_profiler_batch_offline_kernel_step"
2026-03-04T09:38:24.883707+00:00,BUCKET,bucket_torch_npu,eval,bucket_torch_eval_009,64,4096,6144,fp16,Ascend910B2,c18,64,128,128,0.0,0.0,53.142,0,bucket_g0,0,"batch_tune;path_reordered;launch=fixed_cores(24),swizzle2d_g=4,dir=1;timing=npu_profiler_batch_offline_kernel_step"
2026-03-04T09:38:24.883723+00:00,BUCKET,bucket_torch_npu,eval,bucket_torch_eval_010,64,2048,4096,fp16,Ascend910B2,c18,64,128,128,0.0,0.0,19.52,2,bucket_g2,0,"batch_tune;path_reordered;launch=fixed_cores(16),swizzle2d_g=4,dir=1;timing=npu_profiler_batch_offline_kernel_step"
2026-03-04T09:38:24.883738+00:00,BUCKET,bucket_torch_npu,eval,bucket_torch_eval_011,32,3072,6144,fp16,Ascend910B2,c18,64,128,128,0.0,0.0,28.1,0,bucket_g0,0,"batch_tune;path_reordered;launch=fixed_cores(24),swizzle2d_g=4,dir=1;timing=npu_profiler_batch_offline_kernel_step"
2026-03-04T09:38:24.883755+00:00,BUCKET,bucket_torch_npu,eval,bucket_torch_eval_012,16,1536,1536,fp16,Ascend910B2,c18,64,128,128,0.0,0.0,8.02,3,bucket_g3,0,"batch_tune;path_reordered;launch=fixed_cores(12),swizzle2d_g=4,dir=1;timing=npu_profiler_batch_offline_kernel_step"
2026-03-04T09:38:24.883772+00:00,BUCKET,bucket_torch_npu,eval,bucket_torch_eval_013,64,2048,3072,fp16,Ascend910B2,c18,64,128,128,0.0,0.0,15.56,3,bucket_g3,0,"batch_tune;path_reordered;launch=fixed_cores(16),swizzle2d_g=4,dir=1;timing=npu_profiler_batch_offline_kernel_step"
2026-03-04T09:38:24.883787+00:00,BUCKET,bucket_torch_npu,eval,bucket_torch_eval_014,16,8192,6144,fp16,Ascend910B2,c18,64,128,128,0.0,0.0,71.92,0,bucket_g0,0,"batch_tune;path_reordered;launch=fixed_cores(24),swizzle2d_g=4,dir=1;timing=npu_profiler_batch_offline_kernel_step"
2026-03-04T09:38:24.883802+00:00,BUCKET,bucket_torch_npu,eval,bucket_torch_eval_015,64,6144,1536,fp16,Ascend910B2,c18,64,128,128,0.0,0.0,17.82,1,bucket_g1,0,"batch_tune;path_reordered;launch=fixed_cores(24),swizzle2d_g=4,dir=1;timing=npu_profiler_batch_offline_kernel_step"
2026-03-04T09:38:07.859137+00:00,TORCH,bucket_torch_npu,eval,bucket_torch_eval_000,32,1536,1024,fp16,Ascend910B2,torch_mm_npu,-1,-1,-1,548.7202368676662,0.0,6.28,3,torch_mm_npu,0,torch_mm_npu;timing=npu_profiler_batch_offline_kernel_step
2026-03-04T09:38:07.859198+00:00,TORCH,bucket_torch_npu,eval,bucket_torch_eval_001,32,2048,8192,fp16,Ascend910B2,torch_mm_npu,-1,-1,-1,0.0,0.0,21.9,2,torch_mm_npu,0,torch_mm_npu;timing=npu_profiler_batch_offline_kernel_step
2026-03-04T09:38:07.859214+00:00,TORCH,bucket_torch_npu,eval,bucket_torch_eval_002,16,2048,4096,fp16,Ascend910B2,torch_mm_npu,-1,-1,-1,0.0,0.0,11.602,2,torch_mm_npu,0,torch_mm_npu;timing=npu_profiler_batch_offline_kernel_step
2026-03-04T09:38:07.859227+00:00,TORCH,bucket_torch_npu,eval,bucket_torch_eval_003,16,2048,1536,fp16,Ascend910B2,torch_mm_npu,-1,-1,-1,0.0,0.0,6.48,3,torch_mm_npu,0,torch_mm_npu;timing=npu_profiler_batch_offline_kernel_step
2026-03-04T09:38:07.859239+00:00,TORCH,bucket_torch_npu,eval,bucket_torch_eval_004,64,8192,2048,fp16,Ascend910B2,torch_mm_npu,-1,-1,-1,0.0,0.0,21.36,1,torch_mm_npu,0,torch_mm_npu;timing=npu_profiler_batch_offline_kernel_step
2026-03-04T09:38:07.859252+00:00,TORCH,bucket_torch_npu,eval,bucket_torch_eval_005,64,3072,8192,fp16,Ascend910B2,torch_mm_npu,-1,-1,-1,0.0,0.0,25.902,0,torch_mm_npu,0,torch_mm_npu;timing=npu_profiler_batch_offline_kernel_step
2026-03-04T09:38:07.859263+00:00,TORCH,bucket_torch_npu,eval,bucket_torch_eval_006,32,2048,2048,fp16,Ascend910B2,torch_mm_npu,-1,-1,-1,0.0,0.0,7.56,3,torch_mm_npu,0,torch_mm_npu;timing=npu_profiler_batch_offline_kernel_step
2026-03-04T09:38:07.859274+00:00,TORCH,bucket_torch_npu,eval,bucket_torch_eval_007,8,8192,2048,fp16,Ascend910B2,torch_mm_npu,-1,-1,-1,0.0,0.0,19.362,1,torch_mm_npu,0,torch_mm_npu;timing=npu_profiler_batch_offline_kernel_step
2026-03-04T09:38:07.859285+00:00,TORCH,bucket_torch_npu,eval,bucket_torch_eval_008,64,1536,8192,fp16,Ascend910B2,torch_mm_npu,-1,-1,-1,0.0,0.0,25.042,2,torch_mm_npu,0,torch_mm_npu;timing=npu_profiler_batch_offline_kernel_step
2026-03-04T09:38:07.859296+00:00,TORCH,bucket_torch_npu,eval,bucket_torch_eval_009,64,4096,6144,fp16,Ascend910B2,torch_mm_npu,-1,-1,-1,0.0,0.0,28.84,0,torch_mm_npu,0,torch_mm_npu;timing=npu_profiler_batch_offline_kernel_step
2026-03-04T09:38:07.859307+00:00,TORCH,bucket_torch_npu,eval,bucket_torch_eval_010,64,2048,4096,fp16,Ascend910B2,torch_mm_npu,-1,-1,-1,0.0,0.0,13.56,2,torch_mm_npu,0,torch_mm_npu;timing=npu_profiler_batch_offline_kernel_step
2026-03-04T09:38:07.859317+00:00,TORCH,bucket_torch_npu,eval,bucket_torch_eval_011,32,3072,6144,fp16,Ascend910B2,torch_mm_npu,-1,-1,-1,0.0,0.0,17.92,0,torch_mm_npu,0,torch_mm_npu;timing=npu_profiler_batch_offline_kernel_step
2026-03-04T09:38:07.859328+00:00,TORCH,bucket_torch_npu,eval,bucket_torch_eval_012,16,1536,1536,fp16,Ascend910B2,torch_mm_npu,-1,-1,-1,0.0,0.0,6.86,3,torch_mm_npu,0,torch_mm_npu;timing=npu_profiler_batch_offline_kernel_step
2026-03-04T09:38:07.859339+00:00,TORCH,bucket_torch_npu,eval,bucket_torch_eval_013,64,2048,3072,fp16,Ascend910B2,torch_mm_npu,-1,-1,-1,0.0,0.0,11.38,3,torch_mm_npu,0,torch_mm_npu;timing=npu_profiler_batch_offline_kernel_step
2026-03-04T09:38:07.859353+00:00,TORCH,bucket_torch_npu,eval,bucket_torch_eval_014,16,8192,6144,fp16,Ascend910B2,torch_mm_npu,-1,-1,-1,0.0,0.0,54.38,0,torch_mm_npu,0,torch_mm_npu;timing=npu_profiler_batch_offline_kernel_step
2026-03-04T09:38:07.859364+00:00,TORCH,bucket_torch_npu,eval,bucket_torch_eval_015,64,6144,1536,fp16,Ascend910B2,torch_mm_npu,-1,-1,-1,0.0,0.0,11.1,1,torch_mm_npu,0,torch_mm_npu;timing=npu_profiler_batch_offline_kernel_step
