results/pipeline_repro_20260304T060620Z/bucket_torch.csv
timestamp,method,workload,split,shape_id,M,N,K,dtype,gpu,config_id,BLOCK_M,BLOCK_N,BLOCK_K,compile_time_ms,tune_time_ms,runtime_cost_us,bucket_key,cache_key,invalid_config,notes
2026-03-04T06:07:14.381621+00:00,BUCKET,bucket_torch_npu,tune,bucket_torch_tune_000,8,2048,4096,fp16,Ascend910B2,c24,16,128,128,0.0,17433.537,17.051000000000002,2,bucket_g2,0,"batch_tune;path_reordered;launch=fixed_cores(16),swizzle2d_g=4,dir=1;timing=npu_profiler_batch_offline_kernel_step"
2026-03-04T06:07:14.381697+00:00,BUCKET,bucket_torch_npu,tune,bucket_torch_tune_001,32,2048,8192,fp16,Ascend910B2,c24,16,128,128,0.0,0.0,17.051000000000002,2,bucket_g2,0,"batch_tune;path_reordered;launch=fixed_cores(16),swizzle2d_g=4,dir=1;timing=npu_profiler_batch_offline_kernel_step"
2026-03-04T06:07:14.381724+00:00,BUCKET,bucket_torch_npu,tune,bucket_torch_tune_002,64,8192,8192,fp16,Ascend910B2,c12,128,128,128,0.0,0.0,103.713,0,bucket_g0,0,"batch_tune;path_reordered;launch=fixed_cores(24),swizzle2d_g=4,dir=1;timing=npu_profiler_batch_offline_kernel_step"
2026-03-04T06:07:14.381746+00:00,BUCKET,bucket_torch_npu,tune,bucket_torch_tune_003,1,3072,1536,fp16,Ascend910B2,c24,16,128,128,0.0,0.0,8.1,5,bucket_g5,0,"batch_tune;path_reordered;launch=fixed_cores(24),swizzle2d_g=4,dir=1;timing=npu_profiler_batch_offline_kernel_step"
2026-03-04T06:07:14.381766+00:00,BUCKET,bucket_torch_npu,tune,bucket_torch_tune_004,8,1024,1536,fp16,Ascend910B2,c24,16,128,128,0.0,0.0,7.18,3,bucket_g3,0,"batch_tune;path_reordered;launch=fixed_cores(8),swizzle2d_g=4,dir=1;timing=npu_profiler_batch_offline_kernel_step"
2026-03-04T06:07:14.381788+00:00,BUCKET,bucket_torch_npu,tune,bucket_torch_tune_005,1,4096,8192,fp16,Ascend910B2,c29,16,256,128,0.0,0.0,39.111000000000004,4,bucket_g4,0,"batch_tune;path_reordered;launch=fixed_cores(16),swizzle2d_g=4,dir=1;timing=npu_profiler_batch_offline_kernel_step"
2026-03-04T06:07:14.381806+00:00,BUCKET,bucket_torch_npu,tune,bucket_torch_tune_006,4,6144,1024,fp16,Ascend910B2,c24,16,128,128,0.0,0.0,8.1,5,bucket_g5,0,"batch_tune;path_reordered;launch=fixed_cores(24),swizzle2d_g=4,dir=1;timing=npu_profiler_batch_offline_kernel_step"
2026-03-04T06:07:14.381824+00:00,BUCKET,bucket_torch_npu,tune,bucket_torch_tune_007,64,6144,1024,fp16,Ascend910B2,c18,64,128,128,0.0,0.0,13.350000000000001,1,bucket_g1,0,"batch_tune;path_reordered;launch=fixed_cores(24),swizzle2d_g=4,dir=1;timing=npu_profiler_batch_offline_kernel_step"
2026-03-04T06:07:14.381841+00:00,BUCKET,bucket_torch_npu,tune,bucket_torch_tune_008,64,1536,3072,fp16,Ascend910B2,c24,16,128,128,0.0,0.0,7.18,3,bucket_g3,0,"batch_tune;path_reordered;launch=fixed_cores(8),swizzle2d_g=4,dir=1;timing=npu_profiler_batch_offline_kernel_step"
2026-03-04T06:07:14.381861+00:00,BUCKET,bucket_torch_npu,tune,bucket_torch_tune_009,2,4096,3072,fp16,Ascend910B2,c24,16,128,128,0.0,0.0,8.1,5,bucket_g5,0,"batch_tune;path_reordered;launch=fixed_cores(24),swizzle2d_g=4,dir=1;timing=npu_profiler_batch_offline_kernel_step"
2026-03-04T06:07:14.381878+00:00,BUCKET,bucket_torch_npu,tune,bucket_torch_tune_010,32,3072,1536,fp16,Ascend910B2,c18,64,128,128,0.0,0.0,13.350000000000001,1,bucket_g1,0,"batch_tune;path_reordered;launch=fixed_cores(24),swizzle2d_g=4,dir=1;timing=npu_profiler_batch_offline_kernel_step"
2026-03-04T06:07:14.381898+00:00,BUCKET,bucket_torch_npu,tune,bucket_torch_tune_011,2,1536,1024,fp16,Ascend910B2,c24,16,128,128,0.0,0.0,5.58,7,bucket_g7,0,"batch_tune;path_reordered;launch=fixed_cores(12),swizzle2d_g=4,dir=1;timing=npu_profiler_batch_offline_kernel_step"
2026-03-04T06:07:14.381916+00:00,BUCKET,bucket_torch_npu,tune,bucket_torch_tune_012,4,1536,4096,fp16,Ascend910B2,c24,16,128,128,0.0,0.0,16.5,6,bucket_g6,0,"batch_tune;path_reordered;launch=fixed_cores(12),swizzle2d_g=4,dir=1;timing=npu_profiler_batch_offline_kernel_step"
2026-03-04T06:07:14.381932+00:00,BUCKET,bucket_torch_npu,tune,bucket_torch_tune_013,64,6144,1024,fp16,Ascend910B2,c18,64,128,128,0.0,0.0,13.350000000000001,1,bucket_g1,0,"batch_tune;path_reordered;launch=fixed_cores(24),swizzle2d_g=4,dir=1;timing=npu_profiler_batch_offline_kernel_step"
2026-03-04T06:07:14.381951+00:00,BUCKET,bucket_torch_npu,tune,bucket_torch_tune_014,32,4096,2048,fp16,Ascend910B2,c18,64,128,128,0.0,0.0,13.350000000000001,1,bucket_g1,0,"batch_tune;path_reordered;launch=fixed_cores(24),swizzle2d_g=4,dir=1;timing=npu_profiler_batch_offline_kernel_step"
2026-03-04T06:07:14.381968+00:00,BUCKET,bucket_torch_npu,tune,bucket_torch_tune_015,32,1536,3072,fp16,Ascend910B2,c24,16,128,128,0.0,0.0,7.18,3,bucket_g3,0,"batch_tune;path_reordered;launch=fixed_cores(8),swizzle2d_g=4,dir=1;timing=npu_profiler_batch_offline_kernel_step"
2026-03-04T06:07:14.381991+00:00,BUCKET,bucket_torch_npu,eval,bucket_torch_eval_000,32,1536,1024,fp16,Ascend910B2,c24,16,128,128,0.0,0.0,6.529999999999999,3,bucket_g3,0,"batch_tune;path_reordered;launch=fixed_cores(24),swizzle2d_g=4,dir=1;timing=npu_profiler_batch_offline_kernel_step"
2026-03-04T06:07:14.382010+00:00,BUCKET,bucket_torch_npu,eval,bucket_torch_eval_001,32,2048,8192,fp16,Ascend910B2,c24,16,128,128,0.0,0.0,61.242000000000004,2,bucket_g2,0,"batch_tune;path_reordered;launch=fixed_cores(24),swizzle2d_g=4,dir=1;timing=npu_profiler_batch_offline_kernel_step"
2026-03-04T06:07:14.382028+00:00,BUCKET,bucket_torch_npu,eval,bucket_torch_eval_002,16,2048,4096,fp16,Ascend910B2,c24,16,128,128,0.0,0.0,17.5,2,bucket_g2,0,"batch_tune;path_reordered;launch=fixed_cores(16),swizzle2d_g=4,dir=1;timing=npu_profiler_batch_offline_kernel_step"
2026-03-04T06:07:14.382045+00:00,BUCKET,bucket_torch_npu,eval,bucket_torch_eval_003,16,2048,1536,fp16,Ascend910B2,c24,16,128,128,0.0,0.0,8.12,3,bucket_g3,0,"batch_tune;path_reordered;launch=fixed_cores(16),swizzle2d_g=4,dir=1;timing=npu_profiler_batch_offline_kernel_step"
2026-03-04T06:07:14.382062+00:00,BUCKET,bucket_torch_npu,eval,bucket_torch_eval_004,64,8192,2048,fp16,Ascend910B2,c18,64,128,128,0.0,0.0,30.181,1,bucket_g1,0,"batch_tune;path_reordered;launch=fixed_cores(24),swizzle2d_g=4,dir=1;timing=npu_profiler_batch_offline_kernel_step"
2026-03-04T06:07:14.382078+00:00,BUCKET,bucket_torch_npu,eval,bucket_torch_eval_005,64,3072,8192,fp16,Ascend910B2,c12,128,128,128,0.0,0.0,40.122,0,bucket_g0,0,"batch_tune;path_reordered;launch=fixed_cores(24),swizzle2d_g=4,dir=1;timing=npu_profiler_batch_offline_kernel_step"
2026-03-04T06:07:14.382097+00:00,BUCKET,bucket_torch_npu,eval,bucket_torch_eval_006,32,2048,2048,fp16,Ascend910B2,c24,16,128,128,0.0,0.0,17.439999999999998,3,bucket_g3,0,"batch_tune;path_reordered;launch=fixed_cores(24),swizzle2d_g=4,dir=1;timing=npu_profiler_batch_offline_kernel_step"
2026-03-04T06:07:14.382114+00:00,BUCKET,bucket_torch_npu,eval,bucket_torch_eval_007,8,8192,2048,fp16,Ascend910B2,c18,64,128,128,0.0,0.0,26.06,1,bucket_g1,0,"batch_tune;path_reordered;launch=fixed_cores(24),swizzle2d_g=4,dir=1;timing=npu_profiler_batch_offline_kernel_step"
2026-03-04T06:07:14.382130+00:00,BUCKET,bucket_torch_npu,eval,bucket_torch_eval_008,64,1536,8192,fp16,Ascend910B2,c24,16,128,128,0.0,0.0,62.351,2,bucket_g2,0,"batch_tune;path_reordered;launch=fixed_cores(24),swizzle2d_g=4,dir=1;timing=npu_profiler_batch_offline_kernel_step"
2026-03-04T06:07:14.382146+00:00,BUCKET,bucket_torch_npu,eval,bucket_torch_eval_009,64,4096,6144,fp16,Ascend910B2,c12,128,128,128,0.0,0.0,53.671,0,bucket_g0,0,"batch_tune;path_reordered;launch=fixed_cores(24),swizzle2d_g=4,dir=1;timing=npu_profiler_batch_offline_kernel_step"
2026-03-04T06:07:14.382161+00:00,BUCKET,bucket_torch_npu,eval,bucket_torch_eval_010,64,2048,4096,fp16,Ascend910B2,c24,16,128,128,0.0,0.0,47.271,2,bucket_g2,0,"batch_tune;path_reordered;launch=fixed_cores(24),swizzle2d_g=4,dir=1;timing=npu_profiler_batch_offline_kernel_step"
2026-03-04T06:07:14.382179+00:00,BUCKET,bucket_torch_npu,eval,bucket_torch_eval_011,32,3072,6144,fp16,Ascend910B2,c12,128,128,128,0.0,0.0,27.971,0,bucket_g0,0,"batch_tune;path_reordered;launch=fixed_cores(24),swizzle2d_g=4,dir=1;timing=npu_profiler_batch_offline_kernel_step"
2026-03-04T06:07:14.382196+00:00,BUCKET,bucket_torch_npu,eval,bucket_torch_eval_012,16,1536,1536,fp16,Ascend910B2,c24,16,128,128,0.0,0.0,7.63,3,bucket_g3,0,"batch_tune;path_reordered;launch=fixed_cores(12),swizzle2d_g=4,dir=1;timing=npu_profiler_batch_offline_kernel_step"
2026-03-04T06:07:14.382211+00:00,BUCKET,bucket_torch_npu,eval,bucket_torch_eval_013,64,2048,3072,fp16,Ascend910B2,c24,16,128,128,0.0,0.0,36.232,3,bucket_g3,0,"batch_tune;path_reordered;launch=fixed_cores(24),swizzle2d_g=4,dir=1;timing=npu_profiler_batch_offline_kernel_step"
2026-03-04T06:07:14.382227+00:00,BUCKET,bucket_torch_npu,eval,bucket_torch_eval_014,16,8192,6144,fp16,Ascend910B2,c12,128,128,128,0.0,0.0,71.452,0,bucket_g0,0,"batch_tune;path_reordered;launch=fixed_cores(24),swizzle2d_g=4,dir=1;timing=npu_profiler_batch_offline_kernel_step"
2026-03-04T06:07:14.382243+00:00,BUCKET,bucket_torch_npu,eval,bucket_torch_eval_015,64,6144,1536,fp16,Ascend910B2,c18,64,128,128,0.0,0.0,17.5,1,bucket_g1,0,"batch_tune;path_reordered;launch=fixed_cores(24),swizzle2d_g=4,dir=1;timing=npu_profiler_batch_offline_kernel_step"
2026-03-04T06:09:43.199448+00:00,FULL_TUNE,bucket_torch_npu,eval,bucket_torch_eval_000,32,1536,1024,fp16,Ascend910B2,c12,128,128,128,3.4380070865154266,121327.952,6.23,3,full_tune:32x1536x1024,0,"full_tune_batch_all;no_change;launch=fixed_cores(12),swizzle2d_g=4,dir=1;timing=npu_profiler_batch_offline_kernel_step"
2026-03-04T06:09:43.199567+00:00,FULL_TUNE,bucket_torch_npu,eval,bucket_torch_eval_001,32,2048,8192,fp16,Ascend910B2,c16,96,128,128,0.0,0.0,33.56,2,full_tune:32x2048x8192,0,"full_tune_batch_all;no_change;launch=fixed_cores(16),swizzle2d_g=4,dir=1;timing=npu_profiler_batch_offline_kernel_step"
2026-03-04T06:09:43.199626+00:00,FULL_TUNE,bucket_torch_npu,eval,bucket_torch_eval_002,16,2048,4096,fp16,Ascend910B2,c24,16,128,128,0.0,0.0,17.451,2,full_tune:16x2048x4096,0,"full_tune_batch_all;no_change;launch=fixed_cores(16),swizzle2d_g=4,dir=1;timing=npu_profiler_batch_offline_kernel_step"
2026-03-04T06:09:43.199677+00:00,FULL_TUNE,bucket_torch_npu,eval,bucket_torch_eval_003,16,2048,1536,fp16,Ascend910B2,c24,16,128,128,0.0,0.0,8.15,3,full_tune:16x2048x1536,0,"full_tune_batch_all;no_change;launch=fixed_cores(16),swizzle2d_g=4,dir=1;timing=npu_profiler_batch_offline_kernel_step"
2026-03-04T06:09:43.199735+00:00,FULL_TUNE,bucket_torch_npu,eval,bucket_torch_eval_004,64,8192,2048,fp16,Ascend910B2,c16,96,128,128,0.0,0.0,29.869999999999997,1,full_tune:64x8192x2048,0,"full_tune_batch_all;no_change;launch=fixed_cores(24),swizzle2d_g=4,dir=1;timing=npu_profiler_batch_offline_kernel_step"
2026-03-04T06:09:43.199781+00:00,FULL_TUNE,bucket_torch_npu,eval,bucket_torch_eval_005,64,3072,8192,fp16,Ascend910B2,c18,64,128,128,0.0,0.0,39.29,0,full_tune:64x3072x8192,0,"full_tune_batch_all;no_change;launch=fixed_cores(24),swizzle2d_g=4,dir=1;timing=npu_profiler_batch_offline_kernel_step"
2026-03-04T06:09:43.199827+00:00,FULL_TUNE,bucket_torch_npu,eval,bucket_torch_eval_006,32,2048,2048,fp16,Ascend910B2,c18,64,128,128,0.0,0.0,10.421,3,full_tune:32x2048x2048,0,"full_tune_batch_all;no_change;launch=fixed_cores(16),swizzle2d_g=4,dir=1;timing=npu_profiler_batch_offline_kernel_step"
2026-03-04T06:09:43.199873+00:00,FULL_TUNE,bucket_torch_npu,eval,bucket_torch_eval_007,8,8192,2048,fp16,Ascend910B2,c29,16,256,128,0.0,0.0,23.431,1,full_tune:8x8192x2048,0,"full_tune_batch_all;no_change;launch=fixed_cores(24),swizzle2d_g=4,dir=1;timing=npu_profiler_batch_offline_kernel_step"
2026-03-04T06:09:43.199920+00:00,FULL_TUNE,bucket_torch_npu,eval,bucket_torch_eval_008,64,1536,8192,fp16,Ascend910B2,c18,64,128,128,0.0,0.0,34.931,2,full_tune:64x1536x8192,0,"full_tune_batch_all;no_change;launch=fixed_cores(12),swizzle2d_g=4,dir=1;timing=npu_profiler_batch_offline_kernel_step"
2026-03-04T06:09:43.199966+00:00,FULL_TUNE,bucket_torch_npu,eval,bucket_torch_eval_009,64,4096,6144,fp16,Ascend910B2,c22,64,256,64,0.0,0.0,52.22,0,full_tune:64x4096x6144,0,"full_tune_batch_all;no_change;launch=fixed_cores(16),swizzle2d_g=4,dir=1;timing=npu_profiler_batch_offline_kernel_step"
2026-03-04T06:09:43.200011+00:00,FULL_TUNE,bucket_torch_npu,eval,bucket_torch_eval_010,64,2048,4096,fp16,Ascend910B2,c16,96,128,128,0.0,0.0,19.301000000000002,2,full_tune:64x2048x4096,0,"full_tune_batch_all;no_change;launch=fixed_cores(16),swizzle2d_g=4,dir=1;timing=npu_profiler_batch_offline_kernel_step"
2026-03-04T06:09:43.200057+00:00,FULL_TUNE,bucket_torch_npu,eval,bucket_torch_eval_011,32,3072,6144,fp16,Ascend910B2,c23,128,128,128,0.0,0.0,28.012,0,full_tune:32x3072x6144,0,"full_tune_batch_all;no_change;launch=fixed_cores(24),swizzle2d_g=4,dir=1;timing=npu_profiler_batch_offline_kernel_step"
2026-03-04T06:09:43.200100+00:00,FULL_TUNE,bucket_torch_npu,eval,bucket_torch_eval_012,16,1536,1536,fp16,Ascend910B2,c24,16,128,128,0.0,0.0,7.7,3,full_tune:16x1536x1536,0,"full_tune_batch_all;no_change;launch=fixed_cores(12),swizzle2d_g=4,dir=1;timing=npu_profiler_batch_offline_kernel_step"
2026-03-04T06:09:43.200144+00:00,FULL_TUNE,bucket_torch_npu,eval,bucket_torch_eval_013,64,2048,3072,fp16,Ascend910B2,c18,64,128,128,0.0,0.0,15.100999999999999,3,full_tune:64x2048x3072,0,"full_tune_batch_all;no_change;launch=fixed_cores(16),swizzle2d_g=4,dir=1;timing=npu_profiler_batch_offline_kernel_step"
2026-03-04T06:09:43.200187+00:00,FULL_TUNE,bucket_torch_npu,eval,bucket_torch_eval_014,16,8192,6144,fp16,Ascend910B2,c29,16,256,128,0.0,0.0,64.251,0,full_tune:16x8192x6144,0,"full_tune_batch_all;no_change;launch=fixed_cores(24),swizzle2d_g=4,dir=1;timing=npu_profiler_batch_offline_kernel_step"
2026-03-04T06:09:43.200232+00:00,FULL_TUNE,bucket_torch_npu,eval,bucket_torch_eval_015,64,6144,1536,fp16,Ascend910B2,c16,96,128,128,0.0,0.0,17.461,1,full_tune:64x6144x1536,0,"full_tune_batch_all;no_change;launch=fixed_cores(24),swizzle2d_g=4,dir=1;timing=npu_profiler_batch_offline_kernel_step"
2026-03-04T06:10:09.525439+00:00,TORCH,bucket_torch_npu,eval,bucket_torch_eval_000,32,1536,1024,fp16,Ascend910B2,torch_mm_npu,-1,-1,-1,534.739201888442,0.0,6.02,3,torch_mm_npu,0,torch_mm_npu;timing=npu_profiler_batch_offline_kernel_step
2026-03-04T06:10:09.525501+00:00,TORCH,bucket_torch_npu,eval,bucket_torch_eval_001,32,2048,8192,fp16,Ascend910B2,torch_mm_npu,-1,-1,-1,0.0,0.0,21.5,2,torch_mm_npu,0,torch_mm_npu;timing=npu_profiler_batch_offline_kernel_step
2026-03-04T06:10:09.525517+00:00,TORCH,bucket_torch_npu,eval,bucket_torch_eval_002,16,2048,4096,fp16,Ascend910B2,torch_mm_npu,-1,-1,-1,0.0,0.0,11.47,2,torch_mm_npu,0,torch_mm_npu;timing=npu_profiler_batch_offline_kernel_step
2026-03-04T06:10:09.525530+00:00,TORCH,bucket_torch_npu,eval,bucket_torch_eval_003,16,2048,1536,fp16,Ascend910B2,torch_mm_npu,-1,-1,-1,0.0,0.0,6.05,3,torch_mm_npu,0,torch_mm_npu;timing=npu_profiler_batch_offline_kernel_step
2026-03-04T06:10:09.525545+00:00,TORCH,bucket_torch_npu,eval,bucket_torch_eval_004,64,8192,2048,fp16,Ascend910B2,torch_mm_npu,-1,-1,-1,0.0,0.0,21.631,1,torch_mm_npu,0,torch_mm_npu;timing=npu_profiler_batch_offline_kernel_step
2026-03-04T06:10:09.525563+00:00,TORCH,bucket_torch_npu,eval,bucket_torch_eval_005,64,3072,8192,fp16,Ascend910B2,torch_mm_npu,-1,-1,-1,0.0,0.0,25.82,0,torch_mm_npu,0,torch_mm_npu;timing=npu_profiler_batch_offline_kernel_step
2026-03-04T06:10:09.525575+00:00,TORCH,bucket_torch_npu,eval,bucket_torch_eval_006,32,2048,2048,fp16,Ascend910B2,torch_mm_npu,-1,-1,-1,0.0,0.0,7.470000000000001,3,torch_mm_npu,0,torch_mm_npu;timing=npu_profiler_batch_offline_kernel_step
2026-03-04T06:10:09.525586+00:00,TORCH,bucket_torch_npu,eval,bucket_torch_eval_007,8,8192,2048,fp16,Ascend910B2,torch_mm_npu,-1,-1,-1,0.0,0.0,19.9,1,torch_mm_npu,0,torch_mm_npu;timing=npu_profiler_batch_offline_kernel_step
2026-03-04T06:10:09.525598+00:00,TORCH,bucket_torch_npu,eval,bucket_torch_eval_008,64,1536,8192,fp16,Ascend910B2,torch_mm_npu,-1,-1,-1,0.0,0.0,24.96,2,torch_mm_npu,0,torch_mm_npu;timing=npu_profiler_batch_offline_kernel_step
2026-03-04T06:10:09.525611+00:00,TORCH,bucket_torch_npu,eval,bucket_torch_eval_009,64,4096,6144,fp16,Ascend910B2,torch_mm_npu,-1,-1,-1,0.0,0.0,28.38,0,torch_mm_npu,0,torch_mm_npu;timing=npu_profiler_batch_offline_kernel_step
2026-03-04T06:10:09.525624+00:00,TORCH,bucket_torch_npu,eval,bucket_torch_eval_010,64,2048,4096,fp16,Ascend910B2,torch_mm_npu,-1,-1,-1,0.0,0.0,13.370000000000001,2,torch_mm_npu,0,torch_mm_npu;timing=npu_profiler_batch_offline_kernel_step
2026-03-04T06:10:09.525635+00:00,TORCH,bucket_torch_npu,eval,bucket_torch_eval_011,32,3072,6144,fp16,Ascend910B2,torch_mm_npu,-1,-1,-1,0.0,0.0,17.78,0,torch_mm_npu,0,torch_mm_npu;timing=npu_profiler_batch_offline_kernel_step
2026-03-04T06:10:09.525649+00:00,TORCH,bucket_torch_npu,eval,bucket_torch_eval_012,16,1536,1536,fp16,Ascend910B2,torch_mm_npu,-1,-1,-1,0.0,0.0,6.78,3,torch_mm_npu,0,torch_mm_npu;timing=npu_profiler_batch_offline_kernel_step
2026-03-04T06:10:09.525660+00:00,TORCH,bucket_torch_npu,eval,bucket_torch_eval_013,64,2048,3072,fp16,Ascend910B2,torch_mm_npu,-1,-1,-1,0.0,0.0,11.32,3,torch_mm_npu,0,torch_mm_npu;timing=npu_profiler_batch_offline_kernel_step
2026-03-04T06:10:09.525672+00:00,TORCH,bucket_torch_npu,eval,bucket_torch_eval_014,16,8192,6144,fp16,Ascend910B2,torch_mm_npu,-1,-1,-1,0.0,0.0,55.602000000000004,0,torch_mm_npu,0,torch_mm_npu;timing=npu_profiler_batch_offline_kernel_step
2026-03-04T06:10:09.525683+00:00,TORCH,bucket_torch_npu,eval,bucket_torch_eval_015,64,6144,1536,fp16,Ascend910B2,torch_mm_npu,-1,-1,-1,0.0,0.0,10.73,1,torch_mm_npu,0,torch_mm_npu;timing=npu_profiler_batch_offline_kernel_step
