results/pipeline_repro_20260304T065930Z/bucket_torch_case_compare_eval.csv
workload,shape_id,M,N,K,dtype,gpu,BLOCK_M,BLOCK_N,BLOCK_K,bucket_key,shape,runtime_cost_us_TORCH,runtime_cost_us_BUCKET,runtime_cost_us_FULL_TUNE,config_id_TORCH,config_id_BUCKET,config_id_FULL_TUNE,config_desc_TORCH,config_desc_BUCKET,config_desc_FULL_TUNE,invalid_config_TORCH,invalid_config_BUCKET,invalid_config_FULL_TUNE,timing_source_TORCH,timing_source_BUCKET,timing_source_FULL_TUNE,speed_BUCKET_over_TORCH,speed_FULL_TUNE_over_TORCH,speed_BUCKET_over_FULL_TUNE
bucket_torch_npu,bucket_torch_eval_000,32,1536,1024,fp16,Ascend910B2,16,128,128,3,32x1536x1024,5.68,6.64,6.16,torch_mm_npu,c24,c16,,"BM=16,BN=128,BK=128","BM=96,BN=128,BK=128",0,0,0,npu_profiler_batch_offline_kernel_step,npu_profiler_batch_offline_kernel_step,npu_profiler_batch_offline_kernel_step,0.855422,0.922078,0.927711
bucket_torch_npu,bucket_torch_eval_001,32,2048,8192,fp16,Ascend910B2,16,128,128,2,32x2048x8192,22.84,62.14,33.38,torch_mm_npu,c24,c18,,"BM=16,BN=128,BK=128","BM=64,BN=128,BK=128",0,0,0,npu_profiler_batch_offline_kernel_step,npu_profiler_batch_offline_kernel_step,npu_profiler_batch_offline_kernel_step,0.367557,0.684242,0.537174
bucket_torch_npu,bucket_torch_eval_002,16,2048,4096,fp16,Ascend910B2,16,128,128,2,16x2048x4096,12.04,17.522,17.54,torch_mm_npu,c24,c24,,"BM=16,BN=128,BK=128","BM=16,BN=128,BK=128",0,0,0,npu_profiler_batch_offline_kernel_step,npu_profiler_batch_offline_kernel_step,npu_profiler_batch_offline_kernel_step,0.687136,0.686431,1.001027
bucket_torch_npu,bucket_torch_eval_003,16,2048,1536,fp16,Ascend910B2,16,128,128,3,16x2048x1536,6.3,8.3,8.1,torch_mm_npu,c24,c24,,"BM=16,BN=128,BK=128","BM=16,BN=128,BK=128",0,0,0,npu_profiler_batch_offline_kernel_step,npu_profiler_batch_offline_kernel_step,npu_profiler_batch_offline_kernel_step,0.759036,0.777778,0.975904
bucket_torch_npu,bucket_torch_eval_004,64,8192,2048,fp16,Ascend910B2,64,128,128,1,64x8192x2048,21.942,29.96,29.462,torch_mm_npu,c18,c18,,"BM=64,BN=128,BK=128","BM=64,BN=128,BK=128",0,0,0,npu_profiler_batch_offline_kernel_step,npu_profiler_batch_offline_kernel_step,npu_profiler_batch_offline_kernel_step,0.732377,0.744756,0.983378
bucket_torch_npu,bucket_torch_eval_005,64,3072,8192,fp16,Ascend910B2,64,128,128,0,64x3072x8192,27.28,39.74,39.6,torch_mm_npu,c18,c16,,"BM=64,BN=128,BK=128","BM=96,BN=128,BK=128",0,0,0,npu_profiler_batch_offline_kernel_step,npu_profiler_batch_offline_kernel_step,npu_profiler_batch_offline_kernel_step,0.686462,0.688889,0.996477
bucket_torch_npu,bucket_torch_eval_006,32,2048,2048,fp16,Ascend910B2,16,128,128,3,32x2048x2048,7.8,17.3,10.4,torch_mm_npu,c24,c18,,"BM=16,BN=128,BK=128","BM=64,BN=128,BK=128",0,0,0,npu_profiler_batch_offline_kernel_step,npu_profiler_batch_offline_kernel_step,npu_profiler_batch_offline_kernel_step,0.450867,0.750000,0.601156
bucket_torch_npu,bucket_torch_eval_007,8,8192,2048,fp16,Ascend910B2,64,128,128,1,8x8192x2048,20.38,26.0,23.1,torch_mm_npu,c18,c29,,"BM=64,BN=128,BK=128","BM=16,BN=256,BK=128",0,0,0,npu_profiler_batch_offline_kernel_step,npu_profiler_batch_offline_kernel_step,npu_profiler_batch_offline_kernel_step,0.783846,0.882251,0.888462
