results/pipeline_repro_20260304T040605Z/prototype_best.csv
shape,picked_config_id,BLOCK_M,BLOCK_N,BLOCK_K,runtime_cost_us,invalid_config,score,notes
8x2048x4096,c24,16,128,128,17.17,0,17.17,"path_reordered,ASCEND_HOME_PATH_set,ASCEND_TOOLKIT_HOME_set;launch=fixed_cores(16),swizzle2d_g=4,dir=1;timing=npu_profiler_batch_offline_kernel_step"
64x6144x1024,c18,64,128,128,13.35,0,13.35,"path_reordered,ASCEND_HOME_PATH_set,ASCEND_TOOLKIT_HOME_set;launch=fixed_cores(24),swizzle2d_g=4,dir=1;timing=npu_profiler_batch_offline_kernel_step"
4x6144x1024,c29,16,256,128,8.43,0,8.43,"path_reordered,ASCEND_HOME_PATH_set,ASCEND_TOOLKIT_HOME_set;launch=fixed_cores(24),swizzle2d_g=4,dir=1;timing=npu_profiler_batch_offline_kernel_step"
64x8192x8192,c23,128,128,128,105.423,0,105.423,"path_reordered,ASCEND_HOME_PATH_set,ASCEND_TOOLKIT_HOME_set;launch=fixed_cores(24),swizzle2d_g=4,dir=1;timing=npu_profiler_batch_offline_kernel_step"
