results/ascend_profiler_eval_full_bucket_64_128_r10.csv
timestamp,method,workload,split,shape_id,M,N,K,dtype,gpu,config_id,BLOCK_M,BLOCK_N,BLOCK_K,num_warps,num_stages,GROUP_M,compile_time_ms,tune_time_ms,runtime_cost_us,p99_us,runtime_perf_tflops,bucket_m,bucket_n,bucket_k,cache_key,invalid_config,notes
2026-03-03T10:02:09.511013+00:00,FULL,llm_style,tune,llm_style_tune_000,64,6144,6144,fp16,Ascend910B2,c08,128,128,64,8,4,8,3.719216212630272,1498.134,266.4400041103363,287.29600340127945,18.134807586923294,1,-1,-1,64x6144x6144,0,"path_reordered,ASCEND_HOME_PATH_set,ASCEND_TOOLKIT_HOME_set;timing=event"
2026-03-03T10:02:09.884530+00:00,FULL,llm_style,tune,llm_style_tune_001,64,8192,1536,fp16,Ascend910B2,c09,128,64,64,8,3,8,0.0,373.393,252.32000648975372,255.88919699192047,6.383214547299103,1,-1,-1,64x8192x1536,0,"path_reordered,ASCEND_HOME_PATH_set,ASCEND_TOOLKIT_HOME_set;timing=event"
2026-03-03T10:02:10.569773+00:00,FULL,llm_style,tune,llm_style_tune_002,32,3072,8192,fp16,Ascend910B2,c10,64,128,64,8,3,8,0.0,685.149,246.89000099897385,265.01861333847046,6.523604558641863,2,-1,-1,32x3072x8192,0,"path_reordered,ASCEND_HOME_PATH_set,ASCEND_TOOLKIT_HOME_set;timing=event"
2026-03-03T10:02:11.127534+00:00,FULL,llm_style,tune,llm_style_tune_003,4,6144,3072,fp16,Ascend910B2,c04,64,64,64,4,3,8,0.0,557.678,261.8799954652786,308.55400919914246,0.5765806728831246,5,-1,-1,4x6144x3072,0,"path_reordered,ASCEND_HOME_PATH_set,ASCEND_TOOLKIT_HOME_set;timing=event"
2026-03-03T10:02:11.401902+00:00,FULL,llm_style,tune,llm_style_tune_004,8,8192,1024,fp16,Ascend910B2,c08,128,128,64,8,4,8,0.0,274.285,249.84000623226166,271.3310122489929,0.537214716026006,5,-1,-1,8x8192x1024,0,"path_reordered,ASCEND_HOME_PATH_set,ASCEND_TOOLKIT_HOME_set;timing=event"
2026-03-03T10:02:12.058896+00:00,FULL,llm_style,tune,llm_style_tune_005,32,8192,3072,fp16,Ascend910B2,c10,64,128,64,8,3,8,0.0,656.898,247.70000576972961,260.21781384944916,6.502271693514938,1,-1,-1,32x8192x3072,0,"path_reordered,ASCEND_HOME_PATH_set,ASCEND_TOOLKIT_HOME_set;timing=event"
2026-03-03T10:02:13.298054+00:00,FULL,llm_style,tune,llm_style_tune_006,32,6144,8192,fp16,Ascend910B2,c10,64,128,64,8,3,8,0.0,1239.062,265.48999547958374,299.1767969727516,12.133133175813827,0,-1,-1,32x6144x8192,0,"path_reordered,ASCEND_HOME_PATH_set,ASCEND_TOOLKIT_HOME_set;timing=event"
2026-03-03T10:02:13.450754+00:00,FULL,llm_style,tune,llm_style_tune_007,8,1536,2048,fp16,Ascend910B2,c11,32,128,32,4,2,8,0.0,152.612,247.639998793602,317.89318680763245,0.203245227932461,7,-1,-1,8x1536x2048,0,"path_reordered,ASCEND_HOME_PATH_set,ASCEND_TOOLKIT_HOME_set;timing=event"
2026-03-03T10:02:13.668226+00:00,FULL,llm_style,tune,llm_style_tune_008,16,1536,4096,fp16,Ascend910B2,c08,128,128,64,8,4,8,0.0,217.392,245.53000181913376,257.004796564579,0.8199673787658114,7,-1,-1,16x1536x4096,0,"path_reordered,ASCEND_HOME_PATH_set,ASCEND_TOOLKIT_HOME_set;timing=event"
2026-03-03T10:02:13.815954+00:00,FULL,llm_style,tune,llm_style_tune_009,64,1536,2048,fp16,Ascend910B2,c02,32,64,32,2,2,8,0.0,147.638,260.78999042510986,268.97761046886444,1.5439748409961636,3,-1,-1,64x1536x2048,0,"path_reordered,ASCEND_HOME_PATH_set,ASCEND_TOOLKIT_HOME_set;timing=event"
2026-03-03T10:02:13.935348+00:00,FULL,llm_style,tune,llm_style_tune_010,2,2048,1024,fp16,Ascend910B2,c06,64,128,32,4,3,8,0.0,119.311,269.40999925136566,272.88960844278336,0.031136958625552866,7,-1,-1,2x2048x1024,0,"path_reordered,ASCEND_HOME_PATH_set,ASCEND_TOOLKIT_HOME_set;timing=event"
2026-03-03T10:02:14.583967+00:00,FULL,llm_style,tune,llm_style_tune_011,2,3072,8192,fp16,Ascend910B2,c08,128,128,64,8,4,8,0.0,648.516,246.89999967813492,253.27740639448166,0.40770877331400246,6,-1,-1,2x3072x8192,0,"path_reordered,ASCEND_HOME_PATH_set,ASCEND_TOOLKIT_HOME_set;timing=event"
2026-03-03T10:02:14.733976+00:00,FULL,llm_style,tune,llm_style_tune_012,64,2048,1536,fp16,Ascend910B2,c03,64,64,32,4,2,8,0.0,149.916,255.02000749111176,275.79120367765427,1.5789082117960245,3,-1,-1,64x2048x1536,0,"path_reordered,ASCEND_HOME_PATH_set,ASCEND_TOOLKIT_HOME_set;timing=event"
2026-03-03T10:02:15.598223+00:00,FULL,llm_style,tune,llm_style_tune_013,16,8192,4096,fp16,Ascend910B2,c10,64,128,64,8,3,8,0.0,864.16,245.35000324249268,261.55761271715164,4.376367678050377,5,-1,-1,16x8192x4096,0,"path_reordered,ASCEND_HOME_PATH_set,ASCEND_TOOLKIT_HOME_set;timing=event"
2026-03-03T10:02:16.451482+00:00,FULL,llm_style,tune,llm_style_tune_014,4,8192,4096,fp16,Ascend910B2,c10,64,128,64,8,3,8,0.0,853.161,246.61999940872192,259.8319920897484,1.0884577757018135,5,-1,-1,4x8192x4096,0,"path_reordered,ASCEND_HOME_PATH_set,ASCEND_TOOLKIT_HOME_set;timing=event"
2026-03-03T10:02:16.668611+00:00,FULL,llm_style,tune,llm_style_tune_015,4,3072,2048,fp16,Ascend910B2,c10,64,128,64,8,3,8,0.0,217.032,246.24000489711761,252.39059329032898,0.20440077566205883,7,-1,-1,4x3072x2048,0,"path_reordered,ASCEND_HOME_PATH_set,ASCEND_TOOLKIT_HOME_set;timing=event"
2026-03-03T10:02:16.783100+00:00,FULL,llm_style,tune,llm_style_tune_016,16,1536,1024,fp16,Ascend910B2,c06,64,128,32,4,3,8,0.0,114.385,265.2900069952011,279.49120461940765,0.18972312063345248,7,-1,-1,16x1536x1024,0,"path_reordered,ASCEND_HOME_PATH_set,ASCEND_TOOLKIT_HOME_set;timing=event"
2026-03-03T10:02:16.903455+00:00,FULL,llm_style,tune,llm_style_tune_017,32,1024,2048,fp16,Ascend910B2,c06,64,128,32,4,3,8,0.0,120.278,272.6299911737442,278.94560277462006,0.4923072748605434,3,-1,-1,32x1024x2048,0,"path_reordered,ASCEND_HOME_PATH_set,ASCEND_TOOLKIT_HOME_set;timing=event"
2026-03-03T10:02:16.990911+00:00,FULL,llm_style,tune,llm_style_tune_018,64,1536,2048,fp16,Ascend910B2,c02,32,64,32,2,2,8,0.0,0.0,277.1500051021576,281.72620087862015,1.452834842458624,3,-1,-1,64x1536x2048,0,"path_reordered,ASCEND_HOME_PATH_set,ASCEND_TOOLKIT_HOME_set;timing=event"
2026-03-03T10:02:17.220483+00:00,FULL,llm_style,tune,llm_style_tune_019,4,4096,1536,fp16,Ascend910B2,c09,128,64,64,8,3,8,0.0,229.497,259.40001010894775,287.0340049266815,0.19403101788184493,7,-1,-1,4x4096x1536,0,"path_reordered,ASCEND_HOME_PATH_set,ASCEND_TOOLKIT_HOME_set;timing=event"
2026-03-03T10:02:17.640762+00:00,FULL,llm_style,tune,llm_style_tune_020,1,8192,1536,fp16,Ascend910B2,c11,32,128,32,4,2,8,0.0,420.186,254.1399896144867,262.25040793418884,0.09902347142681035,5,-1,-1,1x8192x1536,0,"path_reordered,ASCEND_HOME_PATH_set,ASCEND_TOOLKIT_HOME_set;timing=event"
2026-03-03T10:02:17.867118+00:00,FULL,llm_style,tune,llm_style_tune_021,64,1536,4096,fp16,Ascend910B2,c10,64,128,64,8,3,8,0.0,226.264,245.4100027680397,252.0652037858963,3.2814732851829658,3,-1,-1,64x1536x4096,0,"path_reordered,ASCEND_HOME_PATH_set,ASCEND_TOOLKIT_HOME_set;timing=event"
2026-03-03T10:02:18.110038+00:00,FULL,llm_style,tune,llm_style_tune_022,64,1024,6144,fp16,Ascend910B2,c11,32,128,32,4,2,8,0.0,242.821,246.57999724149704,251.5729981660843,3.2659030619231215,3,-1,-1,64x1024x6144,0,"path_reordered,ASCEND_HOME_PATH_set,ASCEND_TOOLKIT_HOME_set;timing=event"
2026-03-03T10:02:18.281758+00:00,FULL,llm_style,tune,llm_style_tune_023,8,4096,1024,fp16,Ascend910B2,c00,32,32,32,2,2,8,0.0,171.627,251.86000764369965,287.4119931459427,0.2664530372560669,7,-1,-1,8x4096x1024,0,"path_reordered,ASCEND_HOME_PATH_set,ASCEND_TOOLKIT_HOME_set;timing=event"
2026-03-03T10:02:18.755280+00:00,FULL,llm_style,tune,llm_style_tune_024,8,4096,4096,fp16,Ascend910B2,c08,128,128,64,8,4,8,0.0,473.393,245.88000029325485,283.8547910749912,1.0917335923208225,7,-1,-1,8x4096x4096,0,"path_reordered,ASCEND_HOME_PATH_set,ASCEND_TOOLKIT_HOME_set;timing=event"
2026-03-03T10:02:18.984324+00:00,FULL,llm_style,tune,llm_style_tune_025,32,6144,1024,fp16,Ascend910B2,c11,32,128,32,4,2,8,0.0,228.94,245.62999606132507,249.41300466656685,1.6392671516367725,1,-1,-1,32x6144x1024,0,"path_reordered,ASCEND_HOME_PATH_set,ASCEND_TOOLKIT_HOME_set;timing=event"
2026-03-03T10:02:19.166677+00:00,FULL,llm_style,tune,llm_style_tune_026,1,3072,1536,fp16,Ascend910B2,c07,128,128,32,8,3,8,0.0,182.261,252.64999270439148,255.68621307611465,0.037352797437211115,7,-1,-1,1x3072x1536,0,"path_reordered,ASCEND_HOME_PATH_set,ASCEND_TOOLKIT_HOME_set;timing=event"
2026-03-03T10:02:19.476899+00:00,FULL,llm_style,tune,llm_style_tune_027,1,6144,1536,fp16,Ascend910B2,c09,128,64,64,8,3,8,0.0,310.124,246.18999660015106,266.8484118580818,0.07666586076060093,5,-1,-1,1x6144x1536,0,"path_reordered,ASCEND_HOME_PATH_set,ASCEND_TOOLKIT_HOME_set;timing=event"
2026-03-03T10:02:19.631798+00:00,FULL,llm_style,tune,llm_style_tune_028,4,4096,1536,fp16,Ascend910B2,c09,128,64,64,8,3,8,0.0,0.0,250.0300034880638,270.3725937008858,0.20130243289942915,7,-1,-1,4x4096x1536,0,"path_reordered,ASCEND_HOME_PATH_set,ASCEND_TOOLKIT_HOME_set;timing=event"
2026-03-03T10:02:19.846492+00:00,FULL,llm_style,tune,llm_style_tune_029,16,1024,6144,fp16,Ascend910B2,c11,32,128,32,4,2,8,0.0,214.596,246.22999876737595,251.27239763736725,0.8176363278554125,7,-1,-1,16x1024x6144,0,"path_reordered,ASCEND_HOME_PATH_set,ASCEND_TOOLKIT_HOME_set;timing=event"
2026-03-03T10:02:20.743890+00:00,FULL,llm_style,tune,llm_style_tune_030,64,4096,8192,fp16,Ascend910B2,c10,64,128,64,8,3,8,0.0,897.303,272.9700058698654,278.09540361166,15.734209633448025,2,-1,-1,64x4096x8192,0,"path_reordered,ASCEND_HOME_PATH_set,ASCEND_TOOLKIT_HOME_set;timing=event"
2026-03-03T10:02:20.960246+00:00,FULL,llm_style,tune,llm_style_tune_031,1,6144,1024,fp16,Ascend910B2,c11,32,128,32,4,2,8,0.0,216.221,247.809998691082,253.78940641880035,0.050776449967564696,5,-1,-1,1x6144x1024,0,"path_reordered,ASCEND_HOME_PATH_set,ASCEND_TOOLKIT_HOME_set;timing=event"
2026-03-03T10:02:21.132574+00:00,FULL,llm_style,tune,llm_style_tune_032,64,1024,4096,fp16,Ascend910B2,c05,128,64,32,4,3,8,0.0,172.231,248.5099956393242,253.40720266103745,2.160359427872629,3,-1,-1,64x1024x4096,0,"path_reordered,ASCEND_HOME_PATH_set,ASCEND_TOOLKIT_HOME_set;timing=event"
2026-03-03T10:02:22.003292+00:00,FULL,llm_style,tune,llm_style_tune_033,2,4096,8192,fp16,Ascend910B2,c08,128,128,64,8,4,8,0.0,870.626,255.02000749111176,256.69840663671494,0.5263027372653415,6,-1,-1,2x4096x8192,0,"path_reordered,ASCEND_HOME_PATH_set,ASCEND_TOOLKIT_HOME_set;timing=event"
2026-03-03T10:02:23.260669+00:00,FULL,llm_style,tune,llm_style_tune_034,1,8192,6144,fp16,Ascend910B2,c10,64,128,64,8,3,8,0.0,1257.282,259.05999541282654,271.6131994128227,0.388571364866997,5,-1,-1,1x8192x6144,0,"path_reordered,ASCEND_HOME_PATH_set,ASCEND_TOOLKIT_HOME_set;timing=event"
2026-03-03T10:02:23.369320+00:00,FULL,llm_style,tune,llm_style_tune_035,64,1536,1024,fp16,Ascend910B2,c08,128,128,64,8,4,8,0.0,108.56,265.2600109577179,269.5327886939049,0.7589782993415136,3,-1,-1,64x1536x1024,0,"path_reordered,ASCEND_HOME_PATH_set,ASCEND_TOOLKIT_HOME_set;timing=event"
2026-03-03T10:02:23.588157+00:00,FULL,llm_style,tune,llm_style_tune_036,32,3072,2048,fp16,Ascend910B2,c04,64,64,64,4,3,8,0.0,218.764,254.07001376152039,258.6457934975624,1.5848119108536176,3,-1,-1,32x3072x2048,0,"path_reordered,ASCEND_HOME_PATH_set,ASCEND_TOOLKIT_HOME_set;timing=event"
2026-03-03T10:02:23.905206+00:00,FULL,llm_style,tune,llm_style_tune_037,4,1536,6144,fp16,Ascend910B2,c10,64,128,64,8,3,8,0.0,316.949,247.76000529527664,271.98820531368256,0.30472017430748455,7,-1,-1,4x1536x6144,0,"path_reordered,ASCEND_HOME_PATH_set,ASCEND_TOOLKIT_HOME_set;timing=event"
2026-03-03T10:02:24.128139+00:00,FULL,llm_style,tune,llm_style_tune_038,1,4096,1536,fp16,Ascend910B2,c08,128,128,64,8,4,8,0.0,222.835,248.62000346183777,252.43159860372543,0.05061102013029064,7,-1,-1,1x4096x1536,0,"path_reordered,ASCEND_HOME_PATH_set,ASCEND_TOOLKIT_HOME_set;timing=event"
2026-03-03T10:02:24.349611+00:00,FULL,llm_style,tune,llm_style_tune_039,4,1536,4096,fp16,Ascend910B2,c06,64,128,32,4,3,8,0.0,221.376,244.9200004339218,250.98759174346924,0.20550240041984333,7,-1,-1,4x1536x4096,0,"path_reordered,ASCEND_HOME_PATH_set,ASCEND_TOOLKIT_HOME_set;timing=event"
2026-03-03T10:02:25.617714+00:00,FULL,llm_style,tune,llm_style_tune_040,2,6144,8192,fp16,Ascend910B2,c10,64,128,64,8,3,8,0.0,1267.994,256.80001080036163,271.901613175869,0.7839820231024557,4,-1,-1,2x6144x8192,0,"path_reordered,ASCEND_HOME_PATH_set,ASCEND_TOOLKIT_HOME_set;timing=event"
2026-03-03T10:02:25.730454+00:00,FULL,llm_style,tune,llm_style_tune_041,16,1024,1536,fp16,Ascend910B2,c08,128,128,64,8,4,8,0.0,112.652,268.09999346733093,289.6427968144417,0.18773461106455835,7,-1,-1,16x1024x1536,0,"path_reordered,ASCEND_HOME_PATH_set,ASCEND_TOOLKIT_HOME_set;timing=event"
2026-03-03T10:02:25.894161+00:00,FULL,llm_style,tune,llm_style_tune_042,32,3072,2048,fp16,Ascend910B2,c04,64,64,64,4,3,8,0.0,0.0,258.449986577034,284.7577878832817,1.557953975284826,3,-1,-1,32x3072x2048,0,"path_reordered,ASCEND_HOME_PATH_set,ASCEND_TOOLKIT_HOME_set;timing=event"
2026-03-03T10:02:26.185077+00:00,FULL,llm_style,tune,llm_style_tune_043,2,2048,4096,fp16,Ascend910B2,c11,32,128,32,4,2,8,0.0,290.812,248.79000335931778,263.2512038946152,0.1348704994048279,7,-1,-1,2x2048x4096,0,"path_reordered,ASCEND_HOME_PATH_set,ASCEND_TOOLKIT_HOME_set;timing=event"
2026-03-03T10:02:26.676115+00:00,FULL,llm_style,tune,llm_style_tune_044,64,2048,8192,fp16,Ascend910B2,c08,128,128,64,8,4,8,0.0,490.925,244.73999440670013,266.0175910592079,8.77455134869125,2,-1,-1,64x2048x8192,0,"path_reordered,ASCEND_HOME_PATH_set,ASCEND_TOOLKIT_HOME_set;timing=event"
2026-03-03T10:02:27.276099+00:00,FULL,llm_style,tune,llm_style_tune_045,2,3072,8192,fp16,Ascend910B2,c08,128,128,64,8,4,8,0.0,0.0,249.50000643730164,263.523405790329,0.40346009379882036,6,-1,-1,2x3072x8192,0,"path_reordered,ASCEND_HOME_PATH_set,ASCEND_TOOLKIT_HOME_set;timing=event"
2026-03-03T10:02:28.552320+00:00,FULL,llm_style,tune,llm_style_tune_046,4,8192,6144,fp16,Ascend910B2,c10,64,128,64,8,3,8,0.0,1276.113,264.41000401973724,267.94179290533066,1.5228364202511164,5,-1,-1,4x8192x6144,0,"path_reordered,ASCEND_HOME_PATH_set,ASCEND_TOOLKIT_HOME_set;timing=event"
2026-03-03T10:02:28.769302+00:00,FULL,llm_style,tune,llm_style_tune_047,1,1024,6144,fp16,Ascend910B2,c06,64,128,32,4,3,8,0.0,216.89,246.61999940872192,254.8485991358757,0.051021458236022506,7,-1,-1,1x1024x6144,0,"path_reordered,ASCEND_HOME_PATH_set,ASCEND_TOOLKIT_HOME_set;timing=event"
2026-03-03T10:02:29.141872+00:00,FULL,llm_style,tune,llm_style_tune_048,32,4096,3072,fp16,Ascend910B2,c10,64,128,64,8,3,8,0.0,372.476,247.23000079393387,249.89299654960632,3.2573165287946693,3,-1,-1,32x4096x3072,0,"path_reordered,ASCEND_HOME_PATH_set,ASCEND_TOOLKIT_HOME_set;timing=event"
2026-03-03T10:02:29.264480+00:00,FULL,llm_style,tune,llm_style_tune_049,16,2048,1024,fp16,Ascend910B2,c06,64,128,32,4,3,8,0.0,122.505,260.6399953365326,263.5443910956383,0.2574772298984679,7,-1,-1,16x2048x1024,0,"path_reordered,ASCEND_HOME_PATH_set,ASCEND_TOOLKIT_HOME_set;timing=event"
2026-03-03T10:02:29.375721+00:00,FULL,llm_style,tune,llm_style_tune_050,4,1024,1536,fp16,Ascend910B2,c09,128,64,64,8,3,8,0.0,111.108,271.6500014066696,291.48418724536896,0.046320308981566825,7,-1,-1,4x1024x1536,0,"path_reordered,ASCEND_HOME_PATH_set,ASCEND_TOOLKIT_HOME_set;timing=event"
2026-03-03T10:02:30.165242+00:00,FULL,llm_style,tune,llm_style_tune_051,64,4096,8192,fp16,Ascend910B2,c10,64,128,64,8,3,8,0.0,0.0,275.35000443458557,277.260400056839,15.598210375262035,2,-1,-1,64x4096x8192,0,"path_reordered,ASCEND_HOME_PATH_set,ASCEND_TOOLKIT_HOME_set;timing=event"
2026-03-03T10:02:30.310931+00:00,FULL,llm_style,tune,llm_style_tune_052,16,2048,1536,fp16,Ascend910B2,c09,128,64,64,8,3,8,0.0,145.583,245.25000154972076,276.3206136226654,0.4104517649904766,7,-1,-1,16x2048x1536,0,"path_reordered,ASCEND_HOME_PATH_set,ASCEND_TOOLKIT_HOME_set;timing=event"
2026-03-03T10:02:30.406350+00:00,FULL,llm_style,tune,llm_style_tune_053,64,1024,1024,fp16,Ascend910B2,c01,64,32,32,2,2,8,0.0,95.324,254.8699975013733,283.4734094142914,0.5266125056531097,3,-1,-1,64x1024x1024,0,"path_reordered,ASCEND_HOME_PATH_set,ASCEND_TOOLKIT_HOME_set;timing=event"
2026-03-03T10:02:31.260827+00:00,FULL,llm_style,tune,llm_style_tune_054,4,4096,8192,fp16,Ascend910B2,c10,64,128,64,8,3,8,0.0,854.336,255.82000613212585,276.5263995528221,1.0493137736122111,6,-1,-1,4x4096x8192,0,"path_reordered,ASCEND_HOME_PATH_set,ASCEND_TOOLKIT_HOME_set;timing=event"
2026-03-03T10:02:31.619470+00:00,FULL,llm_style,tune,llm_style_tune_055,1,4096,3072,fp16,Ascend910B2,c06,64,128,32,4,3,8,0.0,358.541,242.81000345945358,246.70719489455223,0.10364409884868026,7,-1,-1,1x4096x3072,0,"path_reordered,ASCEND_HOME_PATH_set,ASCEND_TOOLKIT_HOME_set;timing=event"
2026-03-03T10:02:31.707012+00:00,FULL,llm_style,tune,llm_style_tune_056,64,1536,2048,fp16,Ascend910B2,c02,32,64,32,2,2,8,0.0,0.0,256.9900006055832,280.77059388160706,1.5668048680928024,3,-1,-1,64x1536x2048,0,"path_reordered,ASCEND_HOME_PATH_set,ASCEND_TOOLKIT_HOME_set;timing=event"
2026-03-03T10:02:31.980979+00:00,FULL,llm_style,tune,llm_style_tune_057,2,4096,2048,fp16,Ascend910B2,c06,64,128,32,4,3,8,0.0,273.884,244.92999911308289,250.8989967405796,0.13699600751849145,7,-1,-1,2x4096x2048,0,"path_reordered,ASCEND_HOME_PATH_set,ASCEND_TOOLKIT_HOME_set;timing=event"
2026-03-03T10:02:32.361835+00:00,FULL,llm_style,tune,llm_style_tune_058,4,8192,1536,fp16,Ascend910B2,c11,32,128,32,4,2,8,0.0,380.762,246.3800013065338,272.70799085497856,0.4085692648193459,5,-1,-1,4x8192x1536,0,"path_reordered,ASCEND_HOME_PATH_set,ASCEND_TOOLKIT_HOME_set;timing=event"
2026-03-03T10:02:32.586882+00:00,FULL,llm_style,tune,llm_style_tune_059,1,1536,4096,fp16,Ascend910B2,c06,64,128,32,4,3,8,0.0,224.944,245.85000425577164,250.9684106707573,0.05118125597797138,7,-1,-1,1x1536x4096,0,"path_reordered,ASCEND_HOME_PATH_set,ASCEND_TOOLKIT_HOME_set;timing=event"
2026-03-03T10:02:32.755582+00:00,FULL,llm_style,tune,llm_style_tune_060,64,1536,4096,fp16,Ascend910B2,c10,64,128,64,8,3,8,0.0,0.0,249.49000030755997,283.89520198106766,3.2278102008387304,3,-1,-1,64x1536x4096,0,"path_reordered,ASCEND_HOME_PATH_set,ASCEND_TOOLKIT_HOME_set;timing=event"
2026-03-03T10:02:34.055484+00:00,FULL,llm_style,tune,llm_style_tune_061,8,8192,6144,fp16,Ascend910B2,c08,128,128,64,8,4,8,0.0,1299.805,265.49001038074493,270.97719579935074,3.0332831237043263,5,-1,-1,8x8192x6144,0,"path_reordered,ASCEND_HOME_PATH_set,ASCEND_TOOLKIT_HOME_set;timing=event"
2026-03-03T10:02:34.377390+00:00,FULL,llm_style,tune,llm_style_tune_062,64,6144,1536,fp16,Ascend910B2,c08,128,128,64,8,4,8,0.0,321.803,245.73999643325806,272.03060299158096,4.915600103901185,1,-1,-1,64x6144x1536,0,"path_reordered,ASCEND_HOME_PATH_set,ASCEND_TOOLKIT_HOME_set;timing=event"
2026-03-03T10:02:34.484503+00:00,FULL,llm_style,tune,llm_style_tune_063,2,1536,1024,fp16,Ascend910B2,c03,64,64,32,4,2,8,0.0,107.023,264.16000723838806,310.7534033060074,0.023816837627212626,7,-1,-1,2x1536x1024,0,"path_reordered,ASCEND_HOME_PATH_set,ASCEND_TOOLKIT_HOME_set;timing=event"
2026-03-03T10:02:34.595405+00:00,FULL,llm_style,eval,llm_style_eval_000,32,1536,1024,fp16,Ascend910B2,c10,64,128,64,8,3,8,0.0,110.828,8.65,11.4626,11.637375260115608,3,-1,-1,32x1536x1024,0,"path_reordered,ASCEND_HOME_PATH_set,ASCEND_TOOLKIT_HOME_set;timing=npu_profiler_batch_offline_kernel_step"
2026-03-03T10:02:35.083311+00:00,FULL,llm_style,eval,llm_style_eval_001,32,2048,8192,fp16,Ascend910B2,c08,128,128,64,8,4,8,0.0,487.826,50.56,83.09642000000001,21.236982278481012,2,-1,-1,32x2048x8192,0,"path_reordered,ASCEND_HOME_PATH_set,ASCEND_TOOLKIT_HOME_set;timing=npu_profiler_batch_offline_kernel_step"
2026-03-03T10:02:35.353246+00:00,FULL,llm_style,eval,llm_style_eval_002,16,2048,4096,fp16,Ascend910B2,c09,128,64,64,8,3,8,0.0,269.832,51.061,79.23162,5.257152347192574,7,-1,-1,16x2048x4096,0,"path_reordered,ASCEND_HOME_PATH_set,ASCEND_TOOLKIT_HOME_set;timing=npu_profiler_batch_offline_kernel_step"
2026-03-03T10:02:35.353333+00:00,FULL,llm_style,eval,llm_style_eval_003,16,2048,1536,fp16,Ascend910B2,c09,128,64,64,8,3,8,0.0,0.0,24.142,32.466,4.169633667467484,7,-1,-1,16x2048x1536,0,"path_reordered,ASCEND_HOME_PATH_set,ASCEND_TOOLKIT_HOME_set;timing=npu_profiler_batch_offline_kernel_step"
2026-03-03T10:02:35.839933+00:00,FULL,llm_style,eval,llm_style_eval_004,64,8192,2048,fp16,Ascend910B2,c04,64,64,64,4,3,8,0.0,486.515,84.15100000000001,121.79144000000001,25.519407351071287,1,-1,-1,64x8192x2048,0,"path_reordered,ASCEND_HOME_PATH_set,ASCEND_TOOLKIT_HOME_set;timing=npu_profiler_batch_offline_kernel_step"
2026-03-03T10:02:36.589788+00:00,FULL,llm_style,eval,llm_style_eval_005,64,3072,8192,fp16,Ascend910B2,c10,64,128,64,8,3,8,0.0,749.75,62.18,94.13198,51.80484837568349,2,-1,-1,64x3072x8192,0,"path_reordered,ASCEND_HOME_PATH_set,ASCEND_TOOLKIT_HOME_set;timing=npu_profiler_batch_offline_kernel_step"
2026-03-03T10:02:36.779255+00:00,FULL,llm_style,eval,llm_style_eval_006,32,2048,2048,fp16,Ascend910B2,c02,32,64,32,2,2,8,0.0,189.323,69.68100000000001,87.43002000000001,3.8523479284166404,3,-1,-1,32x2048x2048,0,"path_reordered,ASCEND_HOME_PATH_set,ASCEND_TOOLKIT_HOME_set;timing=npu_profiler_batch_offline_kernel_step"
2026-03-03T10:02:37.264938+00:00,FULL,llm_style,eval,llm_style_eval_007,8,8192,2048,fp16,Ascend910B2,c04,64,64,64,4,3,8,0.0,485.58,66.832,109.8724,4.0165707445535075,5,-1,-1,8x8192x2048,0,"path_reordered,ASCEND_HOME_PATH_set,ASCEND_TOOLKIT_HOME_set;timing=npu_profiler_batch_offline_kernel_step"
2026-03-03T10:02:37.669726+00:00,FULL,llm_style,eval,llm_style_eval_008,64,1536,8192,fp16,Ascend910B2,c10,64,128,64,8,3,8,0.0,404.693,52.031,84.00600000000001,30.954867982548866,2,-1,-1,64x1536x8192,0,"path_reordered,ASCEND_HOME_PATH_set,ASCEND_TOOLKIT_HOME_set;timing=npu_profiler_batch_offline_kernel_step"
2026-03-03T10:02:38.386057+00:00,FULL,llm_style,eval,llm_style_eval_009,64,4096,6144,fp16,Ascend910B2,c08,128,128,64,8,4,8,0.0,716.227,90.40100000000001,135.03242,35.63263096647161,3,-1,-1,64x4096x6144,0,"path_reordered,ASCEND_HOME_PATH_set,ASCEND_TOOLKIT_HOME_set;timing=npu_profiler_batch_offline_kernel_step"
2026-03-03T10:02:38.667779+00:00,FULL,llm_style,eval,llm_style_eval_010,64,2048,4096,fp16,Ascend910B2,c08,128,128,64,8,4,8,0.0,281.621,29.741,44.6608,36.103084092666684,3,-1,-1,64x2048x4096,0,"path_reordered,ASCEND_HOME_PATH_set,ASCEND_TOOLKIT_HOME_set;timing=npu_profiler_batch_offline_kernel_step"
2026-03-03T10:02:39.206244+00:00,FULL,llm_style,eval,llm_style_eval_011,32,3072,6144,fp16,Ascend910B2,c08,128,128,64,8,4,8,0.0,538.362,47.601,72.0198,25.376768387218753,3,-1,-1,32x3072x6144,0,"path_reordered,ASCEND_HOME_PATH_set,ASCEND_TOOLKIT_HOME_set;timing=npu_profiler_batch_offline_kernel_step"
2026-03-03T10:02:39.334174+00:00,FULL,llm_style,eval,llm_style_eval_012,16,1536,1536,fp16,Ascend910B2,c08,128,128,64,8,4,8,0.0,127.836,11.611,15.693,6.502236844371716,7,-1,-1,16x1536x1536,0,"path_reordered,ASCEND_HOME_PATH_set,ASCEND_TOOLKIT_HOME_set;timing=npu_profiler_batch_offline_kernel_step"
2026-03-03T10:02:39.561100+00:00,FULL,llm_style,eval,llm_style_eval_013,64,2048,3072,fp16,Ascend910B2,c09,128,64,64,8,3,8,0.0,226.834,48.78,70.08820000000001,16.508945633456335,3,-1,-1,64x2048x3072,0,"path_reordered,ASCEND_HOME_PATH_set,ASCEND_TOOLKIT_HOME_set;timing=npu_profiler_batch_offline_kernel_step"
2026-03-03T10:02:40.859162+00:00,FULL,llm_style,eval,llm_style_eval_014,16,8192,6144,fp16,Ascend910B2,c10,64,128,64,8,3,8,0.0,1297.961,105.60300000000001,181.48884,15.251581261895966,5,-1,-1,16x8192x6144,0,"path_reordered,ASCEND_HOME_PATH_set,ASCEND_TOOLKIT_HOME_set;timing=npu_profiler_batch_offline_kernel_step"
2026-03-03T10:02:40.859249+00:00,FULL,llm_style,eval,llm_style_eval_015,64,6144,1536,fp16,Ascend910B2,c08,128,128,64,8,4,8,0.0,0.0,30.11,39.373999999999995,40.11821826635669,1,-1,-1,64x6144x1536,0,"path_reordered,ASCEND_HOME_PATH_set,ASCEND_TOOLKIT_HOME_set;timing=npu_profiler_batch_offline_kernel_step"
2026-03-03T10:02:41.333879+00:00,FULL,llm_style,eval,llm_style_eval_016,16,4096,4096,fp16,Ascend910B2,c04,64,64,64,4,3,8,0.0,474.585,71.372,114.16600000000001,7.5221503110463495,7,-1,-1,16x4096x4096,0,"path_reordered,ASCEND_HOME_PATH_set,ASCEND_TOOLKIT_HOME_set;timing=npu_profiler_batch_offline_kernel_step"
2026-03-03T10:02:42.224893+00:00,FULL,llm_style,eval,llm_style_eval_017,64,8192,4096,fp16,Ascend910B2,c08,128,128,64,8,4,8,0.0,890.919,86.453,133.12062,49.67979475553191,1,-1,-1,64x8192x4096,0,"path_reordered,ASCEND_HOME_PATH_set,ASCEND_TOOLKIT_HOME_set;timing=npu_profiler_batch_offline_kernel_step"
2026-03-03T10:02:42.921338+00:00,FULL,llm_style,eval,llm_style_eval_018,32,4096,6144,fp16,Ascend910B2,c08,128,128,64,8,4,8,0.0,696.343,78.681,120.76062,20.47016097914363,3,-1,-1,32x4096x6144,0,"path_reordered,ASCEND_HOME_PATH_set,ASCEND_TOOLKIT_HOME_set;timing=npu_profiler_batch_offline_kernel_step"
2026-03-03T10:02:43.616975+00:00,FULL,llm_style,eval,llm_style_eval_019,16,3072,8192,fp16,Ascend910B2,c08,128,128,64,8,4,8,0.0,695.52,52.900999999999996,88.0326,15.222894992533224,6,-1,-1,16x3072x8192,0,"path_reordered,ASCEND_HOME_PATH_set,ASCEND_TOOLKIT_HOME_set;timing=npu_profiler_batch_offline_kernel_step"
2026-03-03T10:02:43.747516+00:00,FULL,llm_style,eval,llm_style_eval_020,4,1536,1536,fp16,Ascend910B2,c11,32,128,32,4,2,8,0.0,130.439,21.31,28.095599999999997,0.8857047395588927,7,-1,-1,4x1536x1536,0,"path_reordered,ASCEND_HOME_PATH_set,ASCEND_TOOLKIT_HOME_set;timing=npu_profiler_batch_offline_kernel_step"
2026-03-03T10:02:44.048737+00:00,FULL,llm_style,eval,llm_style_eval_021,4,6144,1536,fp16,Ascend910B2,c11,32,128,32,4,2,8,0.0,301.138,48.31,66.6672,1.562771103291244,5,-1,-1,4x6144x1536,0,"path_reordered,ASCEND_HOME_PATH_set,ASCEND_TOOLKIT_HOME_set;timing=npu_profiler_batch_offline_kernel_step"
2026-03-03T10:02:44.048828+00:00,FULL,llm_style,eval,llm_style_eval_022,32,6144,1024,fp16,Ascend910B2,c11,32,128,32,4,2,8,0.0,0.0,48.431,58.111019999999996,8.313955606945965,1,-1,-1,32x6144x1024,0,"path_reordered,ASCEND_HOME_PATH_set,ASCEND_TOOLKIT_HOME_set;timing=npu_profiler_batch_offline_kernel_step"
2026-03-03T10:02:44.048856+00:00,FULL,llm_style,eval,llm_style_eval_023,16,1024,1536,fp16,Ascend910B2,c08,128,128,64,8,4,8,0.0,0.0,10.100000000000001,14.6212,4.983331485148514,7,-1,-1,16x1024x1536,0,"path_reordered,ASCEND_HOME_PATH_set,ASCEND_TOOLKIT_HOME_set;timing=npu_profiler_batch_offline_kernel_step"
2026-03-03T10:02:44.315733+00:00,FULL,llm_style,eval,llm_style_eval_024,32,8192,1024,fp16,Ascend910B2,c06,64,128,32,4,3,8,0.0,266.838,54.711,70.73718000000001,9.812851382720112,1,-1,-1,32x8192x1024,0,"path_reordered,ASCEND_HOME_PATH_set,ASCEND_TOOLKIT_HOME_set;timing=npu_profiler_batch_offline_kernel_step"
2026-03-03T10:02:45.321449+00:00,FULL,llm_style,eval,llm_style_eval_025,32,6144,6144,fp16,Ascend910B2,c08,128,128,64,8,4,8,0.0,1005.61,82.021,127.344,29.454884773411685,1,-1,-1,32x6144x6144,0,"path_reordered,ASCEND_HOME_PATH_set,ASCEND_TOOLKIT_HOME_set;timing=npu_profiler_batch_offline_kernel_step"
2026-03-03T10:02:45.684239+00:00,FULL,llm_style,eval,llm_style_eval_026,1,6144,2048,fp16,Ascend910B2,c11,32,128,32,4,2,8,0.0,362.687,59.061,85.64838,0.42609884695484324,5,-1,-1,1x6144x2048,0,"path_reordered,ASCEND_HOME_PATH_set,ASCEND_TOOLKIT_HOME_set;timing=npu_profiler_batch_offline_kernel_step"
2026-03-03T10:02:45.684312+00:00,FULL,llm_style,eval,llm_style_eval_027,32,4096,3072,fp16,Ascend910B2,c10,64,128,64,8,3,8,0.0,0.0,43.192,64.15182,18.64480385256529,3,-1,-1,32x4096x3072,0,"path_reordered,ASCEND_HOME_PATH_set,ASCEND_TOOLKIT_HOME_set;timing=npu_profiler_batch_offline_kernel_step"
2026-03-03T10:02:45.812660+00:00,FULL,llm_style,eval,llm_style_eval_028,64,1536,1536,fp16,Ascend910B2,c02,32,64,32,2,2,8,0.0,128.306,39.730000000000004,54.6678,7.601054316637302,3,-1,-1,64x1536x1536,0,"path_reordered,ASCEND_HOME_PATH_set,ASCEND_TOOLKIT_HOME_set;timing=npu_profiler_batch_offline_kernel_step"
2026-03-03T10:02:45.958852+00:00,FULL,llm_style,eval,llm_style_eval_029,2,3072,1024,fp16,Ascend910B2,c04,64,64,64,4,3,8,0.0,146.108,17.281,24.852800000000002,0.7281356402985939,7,-1,-1,2x3072x1024,0,"path_reordered,ASCEND_HOME_PATH_set,ASCEND_TOOLKIT_HOME_set;timing=npu_profiler_batch_offline_kernel_step"
2026-03-03T10:02:46.333122+00:00,FULL,llm_style,eval,llm_style_eval_030,32,1536,8192,fp16,Ascend910B2,c04,64,64,64,4,3,8,0.0,374.189,54.491,89.4254,14.778704152979392,2,-1,-1,32x1536x8192,0,"path_reordered,ASCEND_HOME_PATH_set,ASCEND_TOOLKIT_HOME_set;timing=npu_profiler_batch_offline_kernel_step"
2026-03-03T10:02:46.556570+00:00,FULL,llm_style,eval,llm_style_eval_031,8,3072,2048,fp16,Ascend910B2,c07,128,128,32,8,3,8,0.0,223.358,39.870000000000005,50.259,2.5247879608728363,7,-1,-1,8x3072x2048,0,"path_reordered,ASCEND_HOME_PATH_set,ASCEND_TOOLKIT_HOME_set;timing=npu_profiler_batch_offline_kernel_step"
2026-03-03T10:02:46.777794+00:00,FULL,llm_style,eval,llm_style_eval_032,8,2048,3072,fp16,Ascend910B2,c10,64,128,64,8,3,8,0.0,221.13,20.43,31.94322,4.927229368575624,7,-1,-1,8x2048x3072,0,"path_reordered,ASCEND_HOME_PATH_set,ASCEND_TOOLKIT_HOME_set;timing=npu_profiler_batch_offline_kernel_step"
2026-03-03T10:02:46.777874+00:00,FULL,llm_style,eval,llm_style_eval_033,64,1536,8192,fp16,Ascend910B2,c10,64,128,64,8,3,8,0.0,0.0,51.941,85.03222,31.008504572495713,2,-1,-1,64x1536x8192,0,"path_reordered,ASCEND_HOME_PATH_set,ASCEND_TOOLKIT_HOME_set;timing=npu_profiler_batch_offline_kernel_step"
2026-03-03T10:02:47.164206+00:00,FULL,llm_style,eval,llm_style_eval_034,64,6144,2048,fp16,Ascend910B2,c09,128,64,64,8,3,8,0.0,386.283,64.732,91.9398,24.881244763022927,1,-1,-1,64x6144x2048,0,"path_reordered,ASCEND_HOME_PATH_set,ASCEND_TOOLKIT_HOME_set;timing=npu_profiler_batch_offline_kernel_step"
2026-03-03T10:02:47.447374+00:00,FULL,llm_style,eval,llm_style_eval_035,4,4096,2048,fp16,Ascend910B2,c11,32,128,32,4,2,8,0.0,283.078,62.561,81.40398,1.072694873803168,7,-1,-1,4x4096x2048,0,"path_reordered,ASCEND_HOME_PATH_set,ASCEND_TOOLKIT_HOME_set;timing=npu_profiler_batch_offline_kernel_step"
2026-03-03T10:02:47.447463+00:00,FULL,llm_style,eval,llm_style_eval_036,64,8192,4096,fp16,Ascend910B2,c08,128,128,64,8,4,8,0.0,0.0,90.22999999999999,133.25900000000001,47.60021385348554,1,-1,-1,64x8192x4096,0,"path_reordered,ASCEND_HOME_PATH_set,ASCEND_TOOLKIT_HOME_set;timing=npu_profiler_batch_offline_kernel_step"
2026-03-03T10:02:47.447491+00:00,FULL,llm_style,eval,llm_style_eval_037,32,6144,1024,fp16,Ascend910B2,c11,32,128,32,4,2,8,0.0,0.0,48.71,55.97962,8.266335126257442,1,-1,-1,32x6144x1024,0,"path_reordered,ASCEND_HOME_PATH_set,ASCEND_TOOLKIT_HOME_set;timing=npu_profiler_batch_offline_kernel_step"
2026-03-03T10:02:47.447513+00:00,FULL,llm_style,eval,llm_style_eval_038,64,6144,2048,fp16,Ascend910B2,c09,128,64,64,8,3,8,0.0,0.0,63.991,71.75859999999999,25.169363441733992,1,-1,-1,64x6144x2048,0,"path_reordered,ASCEND_HOME_PATH_set,ASCEND_TOOLKIT_HOME_set;timing=npu_profiler_batch_offline_kernel_step"
2026-03-03T10:02:47.595267+00:00,FULL,llm_style,eval,llm_style_eval_039,8,1024,3072,fp16,Ascend910B2,c04,64,64,64,4,3,8,0.0,147.704,20.451,30.4462,2.4610849347220185,7,-1,-1,8x1024x3072,0,"path_reordered,ASCEND_HOME_PATH_set,ASCEND_TOOLKIT_HOME_set;timing=npu_profiler_batch_offline_kernel_step"
2026-03-03T10:02:48.082427+00:00,FULL,llm_style,eval,llm_style_eval_040,32,8192,2048,fp16,Ascend910B2,c04,64,64,64,4,3,8,0.0,487.068,76.44200000000001,114.3456,14.046490463357838,1,-1,-1,32x8192x2048,0,"path_reordered,ASCEND_HOME_PATH_set,ASCEND_TOOLKIT_HOME_set;timing=npu_profiler_batch_offline_kernel_step"
2026-03-03T10:02:48.229282+00:00,FULL,llm_style,eval,llm_style_eval_041,32,3072,1024,fp16,Ascend910B2,c05,128,64,32,4,3,8,0.0,146.762,47.302,53.99422,4.256196186207771,3,-1,-1,32x3072x1024,0,"path_reordered,ASCEND_HOME_PATH_set,ASCEND_TOOLKIT_HOME_set;timing=npu_profiler_batch_offline_kernel_step"
2026-03-03T10:02:48.229358+00:00,FULL,llm_style,eval,llm_style_eval_042,64,1024,4096,fp16,Ascend910B2,c05,128,64,32,4,3,8,0.0,0.0,60.671,82.046,8.848888464010813,3,-1,-1,64x1024x4096,0,"path_reordered,ASCEND_HOME_PATH_set,ASCEND_TOOLKIT_HOME_set;timing=npu_profiler_batch_offline_kernel_step"
2026-03-03T10:02:48.229384+00:00,FULL,llm_style,eval,llm_style_eval_043,2,1536,1024,fp16,Ascend910B2,c03,64,64,32,4,2,8,0.0,0.0,22.48,28.088820000000002,0.2798690391459075,7,-1,-1,2x1536x1024,0,"path_reordered,ASCEND_HOME_PATH_set,ASCEND_TOOLKIT_HOME_set;timing=npu_profiler_batch_offline_kernel_step"
2026-03-03T10:02:48.786139+00:00,FULL,llm_style,eval,llm_style_eval_044,64,6144,3072,fp16,Ascend910B2,c10,64,128,64,8,3,8,0.0,556.717,50.900999999999996,70.64882,47.463097070784464,1,-1,-1,64x6144x3072,0,"path_reordered,ASCEND_HOME_PATH_set,ASCEND_TOOLKIT_HOME_set;timing=npu_profiler_batch_offline_kernel_step"
2026-03-03T10:02:49.106749+00:00,FULL,llm_style,eval,llm_style_eval_045,64,1536,6144,fp16,Ascend910B2,c08,128,128,64,8,4,8,0.0,320.518,40.301,65.46542000000001,29.97343867397831,3,-1,-1,64x1536x6144,0,"path_reordered,ASCEND_HOME_PATH_set,ASCEND_TOOLKIT_HOME_set;timing=npu_profiler_batch_offline_kernel_step"
2026-03-03T10:02:49.652526+00:00,FULL,llm_style,eval,llm_style_eval_046,2,6144,3072,fp16,Ascend910B2,c07,128,128,32,8,3,8,0.0,545.681,78.072,116.21584000000001,0.9670236704580387,5,-1,-1,2x6144x3072,0,"path_reordered,ASCEND_HOME_PATH_set,ASCEND_TOOLKIT_HOME_set;timing=npu_profiler_batch_offline_kernel_step"
2026-03-03T10:02:50.553371+00:00,FULL,llm_style,eval,llm_style_eval_047,16,4096,8192,fp16,Ascend910B2,c08,128,128,64,8,4,8,0.0,900.76,94.67,154.73182,11.341943847047638,6,-1,-1,16x4096x8192,0,"path_reordered,ASCEND_HOME_PATH_set,ASCEND_TOOLKIT_HOME_set;timing=npu_profiler_batch_offline_kernel_step"
2026-03-03T10:02:50.553443+00:00,FULL,llm_style,eval,llm_style_eval_048,16,1024,6144,fp16,Ascend910B2,c11,32,128,32,4,2,8,0.0,0.0,62.471000000000004,95.77158,3.222720814457908,7,-1,-1,16x1024x6144,0,"path_reordered,ASCEND_HOME_PATH_set,ASCEND_TOOLKIT_HOME_set;timing=npu_profiler_batch_offline_kernel_step"
2026-03-03T10:02:50.922980+00:00,FULL,llm_style,eval,llm_style_eval_049,16,8192,1536,fp16,Ascend910B2,c06,64,128,32,4,3,8,0.0,369.494,68.08099999999999,94.27738,5.914325347747537,5,-1,-1,16x8192x1536,0,"path_reordered,ASCEND_HOME_PATH_set,ASCEND_TOOLKIT_HOME_set;timing=npu_profiler_batch_offline_kernel_step"
2026-03-03T10:02:51.023464+00:00,FULL,llm_style,eval,llm_style_eval_050,1,1024,1024,fp16,Ascend910B2,c11,32,128,32,4,2,8,0.0,100.37,10.68,16.907000000000004,0.1963625468164794,7,-1,-1,1x1024x1024,0,"path_reordered,ASCEND_HOME_PATH_set,ASCEND_TOOLKIT_HOME_set;timing=npu_profiler_batch_offline_kernel_step"
2026-03-03T10:02:51.248738+00:00,FULL,llm_style,eval,llm_style_eval_051,16,6144,1024,fp16,Ascend910B2,c06,64,128,32,4,3,8,0.0,225.182,42.092,51.086200000000005,4.7830132091608855,5,-1,-1,16x6144x1024,0,"path_reordered,ASCEND_HOME_PATH_set,ASCEND_TOOLKIT_HOME_set;timing=npu_profiler_batch_offline_kernel_step"
2026-03-03T10:02:52.946757+00:00,FULL,llm_style,eval,llm_style_eval_052,16,8192,8192,fp16,Ascend910B2,c08,128,128,64,8,4,8,0.0,1697.918,134.88299999999998,238.98122,15.92108455476228,4,-1,-1,16x8192x8192,0,"path_reordered,ASCEND_HOME_PATH_set,ASCEND_TOOLKIT_HOME_set;timing=npu_profiler_batch_offline_kernel_step"
2026-03-03T10:02:54.244290+00:00,FULL,llm_style,eval,llm_style_eval_053,1,6144,8192,fp16,Ascend910B2,c08,128,128,64,8,4,8,0.0,1297.441,87.65100000000001,154.34800000000004,1.148455762056337,4,-1,-1,1x6144x8192,0,"path_reordered,ASCEND_HOME_PATH_set,ASCEND_TOOLKIT_HOME_set;timing=npu_profiler_batch_offline_kernel_step"
2026-03-03T10:02:54.627036+00:00,FULL,llm_style,eval,llm_style_eval_054,64,4096,3072,fp16,Ascend910B2,c10,64,128,64,8,3,8,0.0,382.642,50.001000000000005,69.76100000000001,32.21161048779024,3,-1,-1,64x4096x3072,0,"path_reordered,ASCEND_HOME_PATH_set,ASCEND_TOOLKIT_HOME_set;timing=npu_profiler_batch_offline_kernel_step"
2026-03-03T10:02:54.917607+00:00,FULL,llm_style,eval,llm_style_eval_055,4,8192,1024,fp16,Ascend910B2,c11,32,128,32,4,2,8,0.0,290.469,43.84,59.648179999999996,1.5307678832116787,5,-1,-1,4x8192x1024,0,"path_reordered,ASCEND_HOME_PATH_set,ASCEND_TOOLKIT_HOME_set;timing=npu_profiler_batch_offline_kernel_step"
2026-03-03T10:02:55.070245+00:00,FULL,llm_style,eval,llm_style_eval_056,64,1024,3072,fp16,Ascend910B2,c11,32,128,32,4,2,8,0.0,152.542,34.221999999999994,50.10282000000001,11.765916194261004,3,-1,-1,64x1024x3072,0,"path_reordered,ASCEND_HOME_PATH_set,ASCEND_TOOLKIT_HOME_set;timing=npu_profiler_batch_offline_kernel_step"
2026-03-03T10:02:55.070329+00:00,FULL,llm_style,eval,llm_style_eval_057,64,1024,3072,fp16,Ascend910B2,c11,32,128,32,4,2,8,0.0,0.0,33.870000000000005,34.4566,11.888195571302035,3,-1,-1,64x1024x3072,0,"path_reordered,ASCEND_HOME_PATH_set,ASCEND_TOOLKIT_HOME_set;timing=npu_profiler_batch_offline_kernel_step"
2026-03-03T10:02:55.353715+00:00,FULL,llm_style,eval,llm_style_eval_058,32,2048,4096,fp16,Ascend910B2,c09,128,64,64,8,3,8,0.0,283.33,52.271,82.03818,10.27091335539783,3,-1,-1,32x2048x4096,0,"path_reordered,ASCEND_HOME_PATH_set,ASCEND_TOOLKIT_HOME_set;timing=npu_profiler_batch_offline_kernel_step"
2026-03-03T10:02:55.353799+00:00,FULL,llm_style,eval,llm_style_eval_059,64,8192,2048,fp16,Ascend910B2,c04,64,64,64,4,3,8,0.0,0.0,81.31200000000001,121.7146,26.410414797323888,1,-1,-1,64x8192x2048,0,"path_reordered,ASCEND_HOME_PATH_set,ASCEND_TOOLKIT_HOME_set;timing=npu_profiler_batch_offline_kernel_step"
2026-03-03T10:02:55.887748+00:00,FULL,llm_style,eval,llm_style_eval_060,1,3072,6144,fp16,Ascend910B2,c04,64,64,64,4,3,8,0.0,533.902,66.571,111.70302,0.5670447492151238,7,-1,-1,1x3072x6144,0,"path_reordered,ASCEND_HOME_PATH_set,ASCEND_TOOLKIT_HOME_set;timing=npu_profiler_batch_offline_kernel_step"
2026-03-03T10:02:55.887827+00:00,FULL,llm_style,eval,llm_style_eval_061,64,1536,4096,fp16,Ascend910B2,c10,64,128,64,8,3,8,0.0,0.0,27.511,43.922419999999995,29.27215906364727,3,-1,-1,64x1536x4096,0,"path_reordered,ASCEND_HOME_PATH_set,ASCEND_TOOLKIT_HOME_set;timing=npu_profiler_batch_offline_kernel_step"
2026-03-03T10:02:56.267085+00:00,FULL,llm_style,eval,llm_style_eval_062,16,6144,2048,fp16,Ascend910B2,c09,128,64,64,8,3,8,0.0,379.199,54.861000000000004,83.62738,7.339515940285448,5,-1,-1,16x6144x2048,0,"path_reordered,ASCEND_HOME_PATH_set,ASCEND_TOOLKIT_HOME_set;timing=npu_profiler_batch_offline_kernel_step"
2026-03-03T10:02:56.267178+00:00,FULL,llm_style,eval,llm_style_eval_063,64,1536,6144,fp16,Ascend910B2,c08,128,128,64,8,4,8,0.0,0.0,40.291,64.5888,29.980877913181605,3,-1,-1,64x1536x6144,0,"path_reordered,ASCEND_HOME_PATH_set,ASCEND_TOOLKIT_HOME_set;timing=npu_profiler_batch_offline_kernel_step"
2026-03-03T10:02:56.267206+00:00,FULL,llm_style,eval,llm_style_eval_064,1,6144,2048,fp16,Ascend910B2,c11,32,128,32,4,2,8,0.0,0.0,60.251000000000005,85.053,0.4176830923968066,5,-1,-1,1x6144x2048,0,"path_reordered,ASCEND_HOME_PATH_set,ASCEND_TOOLKIT_HOME_set;timing=npu_profiler_batch_offline_kernel_step"
2026-03-03T10:02:56.568366+00:00,FULL,llm_style,eval,llm_style_eval_065,8,1536,6144,fp16,Ascend910B2,c08,128,128,64,8,4,8,0.0,301.119,35.8,59.24222,4.217735865921788,7,-1,-1,8x1536x6144,0,"path_reordered,ASCEND_HOME_PATH_set,ASCEND_TOOLKIT_HOME_set;timing=npu_profiler_batch_offline_kernel_step"
2026-03-03T10:02:56.568450+00:00,FULL,llm_style,eval,llm_style_eval_066,64,1536,4096,fp16,Ascend910B2,c10,64,128,64,8,3,8,0.0,0.0,27.79,28.10002,28.978278805325655,3,-1,-1,64x1536x4096,0,"path_reordered,ASCEND_HOME_PATH_set,ASCEND_TOOLKIT_HOME_set;timing=npu_profiler_batch_offline_kernel_step"
2026-03-03T10:02:56.568477+00:00,FULL,llm_style,eval,llm_style_eval_067,64,8192,2048,fp16,Ascend910B2,c04,64,64,64,4,3,8,0.0,0.0,82.021,100.98462,26.182119798588165,1,-1,-1,64x8192x2048,0,"path_reordered,ASCEND_HOME_PATH_set,ASCEND_TOOLKIT_HOME_set;timing=npu_profiler_batch_offline_kernel_step"
2026-03-03T10:02:56.568502+00:00,FULL,llm_style,eval,llm_style_eval_068,64,1024,4096,fp16,Ascend910B2,c05,128,64,32,4,3,8,0.0,0.0,59.082,83.42938,9.086877763108898,3,-1,-1,64x1024x4096,0,"path_reordered,ASCEND_HOME_PATH_set,ASCEND_TOOLKIT_HOME_set;timing=npu_profiler_batch_offline_kernel_step"
2026-03-03T10:02:56.568522+00:00,FULL,llm_style,eval,llm_style_eval_069,64,2048,4096,fp16,Ascend910B2,c08,128,128,64,8,4,8,0.0,0.0,29.53,44.746779999999994,36.36105059261768,3,-1,-1,64x2048x4096,0,"path_reordered,ASCEND_HOME_PATH_set,ASCEND_TOOLKIT_HOME_set;timing=npu_profiler_batch_offline_kernel_step"
2026-03-03T10:02:56.852974+00:00,FULL,llm_style,eval,llm_style_eval_070,64,8192,1024,fp16,Ascend910B2,c09,128,64,64,8,3,8,0.0,284.414,47.902,67.21478,22.415386079913155,1,-1,-1,64x8192x1024,0,"path_reordered,ASCEND_HOME_PATH_set,ASCEND_TOOLKIT_HOME_set;timing=npu_profiler_batch_offline_kernel_step"
2026-03-03T10:02:56.853060+00:00,FULL,llm_style,eval,llm_style_eval_071,64,6144,2048,fp16,Ascend910B2,c09,128,64,64,8,3,8,0.0,0.0,65.721,95.4402,24.50682028575341,1,-1,-1,64x6144x2048,0,"path_reordered,ASCEND_HOME_PATH_set,ASCEND_TOOLKIT_HOME_set;timing=npu_profiler_batch_offline_kernel_step"
2026-03-03T10:02:56.853088+00:00,FULL,llm_style,eval,llm_style_eval_072,64,1536,1024,fp16,Ascend910B2,c08,128,128,64,8,4,8,0.0,0.0,9.17,12.3212,21.9549173391494,3,-1,-1,64x1536x1024,0,"path_reordered,ASCEND_HOME_PATH_set,ASCEND_TOOLKIT_HOME_set;timing=npu_profiler_batch_offline_kernel_step"
2026-03-03T10:02:56.853118+00:00,FULL,llm_style,eval,llm_style_eval_073,1,4096,1536,fp16,Ascend910B2,c08,128,128,64,8,4,8,0.0,0.0,22.1,33.357600000000005,0.5693625339366515,7,-1,-1,1x4096x1536,0,"path_reordered,ASCEND_HOME_PATH_set,ASCEND_TOOLKIT_HOME_set;timing=npu_profiler_batch_offline_kernel_step"
2026-03-03T10:02:56.976567+00:00,FULL,llm_style,eval,llm_style_eval_074,8,1024,2048,fp16,Ascend910B2,c11,32,128,32,4,2,8,0.0,123.412,21.66,31.56398,1.5491427516158818,7,-1,-1,8x1024x2048,0,"path_reordered,ASCEND_HOME_PATH_set,ASCEND_TOOLKIT_HOME_set;timing=npu_profiler_batch_offline_kernel_step"
2026-03-03T10:02:57.205625+00:00,FULL,llm_style,eval,llm_style_eval_075,2,6144,1024,fp16,Ascend910B2,c08,128,128,64,8,4,8,0.0,228.975,18.011,28.309820000000002,1.3972474598856255,5,-1,-1,2x6144x1024,0,"path_reordered,ASCEND_HOME_PATH_set,ASCEND_TOOLKIT_HOME_set;timing=npu_profiler_batch_offline_kernel_step"
2026-03-03T10:02:57.205702+00:00,FULL,llm_style,eval,llm_style_eval_076,64,1024,6144,fp16,Ascend910B2,c11,32,128,32,4,2,8,0.0,0.0,64.602,99.66802000000001,12.465656914646605,3,-1,-1,64x1024x6144,0,"path_reordered,ASCEND_HOME_PATH_set,ASCEND_TOOLKIT_HOME_set;timing=npu_profiler_batch_offline_kernel_step"
2026-03-03T10:02:58.094651+00:00,FULL,llm_style,eval,llm_style_eval_077,1,4096,8192,fp16,Ascend910B2,c08,128,128,64,8,4,8,0.0,888.904,85.613,145.40442,0.7838630114585402,6,-1,-1,1x4096x8192,0,"path_reordered,ASCEND_HOME_PATH_set,ASCEND_TOOLKIT_HOME_set;timing=npu_profiler_batch_offline_kernel_step"
2026-03-03T10:02:58.094730+00:00,FULL,llm_style,eval,llm_style_eval_078,64,6144,3072,fp16,Ascend910B2,c10,64,128,64,8,3,8,0.0,0.0,50.302,77.90042000000001,48.02829120114509,1,-1,-1,64x6144x3072,0,"path_reordered,ASCEND_HOME_PATH_set,ASCEND_TOOLKIT_HOME_set;timing=npu_profiler_batch_offline_kernel_step"
2026-03-03T10:02:58.463962+00:00,FULL,llm_style,eval,llm_style_eval_079,2,3072,4096,fp16,Ascend910B2,c10,64,128,64,8,3,8,0.0,369.188,27.281,46.44542,1.8449341299805728,7,-1,-1,2x3072x4096,0,"path_reordered,ASCEND_HOME_PATH_set,ASCEND_TOOLKIT_HOME_set;timing=npu_profiler_batch_offline_kernel_step"
2026-03-03T10:02:58.574219+00:00,FULL,llm_style,eval,llm_style_eval_080,4,1536,1024,fp16,Ascend910B2,c10,64,128,64,8,3,8,0.0,110.167,8.02,11.5416,1.568941645885287,7,-1,-1,4x1536x1024,0,"path_reordered,ASCEND_HOME_PATH_set,ASCEND_TOOLKIT_HOME_set;timing=npu_profiler_batch_offline_kernel_step"
2026-03-03T10:02:59.271248+00:00,FULL,llm_style,eval,llm_style_eval_081,4,4096,6144,fp16,Ascend910B2,c08,128,128,64,8,4,8,0.0,696.956,71.312,115.1026,2.8231797172986313,7,-1,-1,4x4096x6144,0,"path_reordered,ASCEND_HOME_PATH_set,ASCEND_TOOLKIT_HOME_set;timing=npu_profiler_batch_offline_kernel_step"
2026-03-03T10:02:59.496404+00:00,FULL,llm_style,eval,llm_style_eval_082,64,6144,1024,fp16,Ascend910B2,c08,128,128,64,8,4,8,0.0,225.063,25.671,32.412580000000005,31.370276498772938,1,-1,-1,64x6144x1024,0,"path_reordered,ASCEND_HOME_PATH_set,ASCEND_TOOLKIT_HOME_set;timing=npu_profiler_batch_offline_kernel_step"
2026-03-03T10:02:59.496485+00:00,FULL,llm_style,eval,llm_style_eval_083,8,4096,4096,fp16,Ascend910B2,c08,128,128,64,8,4,8,0.0,0.0,50.900999999999996,80.05142000000002,5.273677452309385,7,-1,-1,8x4096x4096,0,"path_reordered,ASCEND_HOME_PATH_set,ASCEND_TOOLKIT_HOME_set;timing=npu_profiler_batch_offline_kernel_step"
2026-03-03T10:02:59.790998+00:00,FULL,llm_style,eval,llm_style_eval_084,64,1024,8192,fp16,Ascend910B2,c04,64,64,64,4,3,8,0.0,294.47,53.631,86.7632,20.020917454457308,2,-1,-1,64x1024x8192,0,"path_reordered,ASCEND_HOME_PATH_set,ASCEND_TOOLKIT_HOME_set;timing=npu_profiler_batch_offline_kernel_step"
2026-03-03T10:03:00.482880+00:00,FULL,llm_style,eval,llm_style_eval_085,1,3072,8192,fp16,Ascend910B2,c08,128,128,64,8,4,8,0.0,691.79,48.881,81.04581999999999,1.0296771342648472,6,-1,-1,1x3072x8192,0,"path_reordered,ASCEND_HOME_PATH_set,ASCEND_TOOLKIT_HOME_set;timing=npu_profiler_batch_offline_kernel_step"
2026-03-03T10:03:00.588226+00:00,FULL,llm_style,eval,llm_style_eval_086,8,1536,1024,fp16,Ascend910B2,c09,128,64,64,8,3,8,0.0,105.263,12.21,15.7028,2.0610830466830463,7,-1,-1,8x1536x1024,0,"path_reordered,ASCEND_HOME_PATH_set,ASCEND_TOOLKIT_HOME_set;timing=npu_profiler_batch_offline_kernel_step"
2026-03-03T10:03:00.735034+00:00,FULL,llm_style,eval,llm_style_eval_087,16,1024,3072,fp16,Ascend910B2,c08,128,128,64,8,4,8,0.0,146.738,18.241,28.626020000000004,5.518518502275095,7,-1,-1,16x1024x3072,0,"path_reordered,ASCEND_HOME_PATH_set,ASCEND_TOOLKIT_HOME_set;timing=npu_profiler_batch_offline_kernel_step"
2026-03-03T10:03:00.955606+00:00,FULL,llm_style,eval,llm_style_eval_088,8,4096,1536,fp16,Ascend910B2,c04,64,64,64,4,3,8,0.0,220.493,31.521,47.824020000000004,3.193531169696393,7,-1,-1,8x4096x1536,0,"path_reordered,ASCEND_HOME_PATH_set,ASCEND_TOOLKIT_HOME_set;timing=npu_profiler_batch_offline_kernel_step"
2026-03-03T10:03:01.483430+00:00,FULL,llm_style,eval,llm_style_eval_089,16,6144,3072,fp16,Ascend910B2,c08,128,128,64,8,4,8,0.0,527.724,42.452,66.40642000000001,14.227357391877886,5,-1,-1,16x6144x3072,0,"path_reordered,ASCEND_HOME_PATH_set,ASCEND_TOOLKIT_HOME_set;timing=npu_profiler_batch_offline_kernel_step"
2026-03-03T10:03:01.676503+00:00,FULL,llm_style,eval,llm_style_eval_090,32,1536,3072,fp16,Ascend910B2,c06,64,128,32,4,3,8,0.0,192.977,40.391,56.43122,7.476662820925454,3,-1,-1,32x1536x3072,0,"path_reordered,ASCEND_HOME_PATH_set,ASCEND_TOOLKIT_HOME_set;timing=npu_profiler_batch_offline_kernel_step"
2026-03-03T10:03:01.853645+00:00,FULL,llm_style,eval,llm_style_eval_091,16,1024,4096,fp16,Ascend910B2,c06,64,128,32,4,3,8,0.0,177.047,42.269999999999996,64.17662000000001,3.1752478826590966,7,-1,-1,16x1024x4096,0,"path_reordered,ASCEND_HOME_PATH_set,ASCEND_TOOLKIT_HOME_set;timing=npu_profiler_batch_offline_kernel_step"
2026-03-03T10:03:02.553006+00:00,FULL,llm_style,eval,llm_style_eval_092,1,4096,6144,fp16,Ascend910B2,c10,64,128,64,8,3,8,0.0,699.267,66.02199999999999,111.82884000000001,0.7623466117354823,7,-1,-1,1x4096x6144,0,"path_reordered,ASCEND_HOME_PATH_set,ASCEND_TOOLKIT_HOME_set;timing=npu_profiler_batch_offline_kernel_step"
2026-03-03T10:03:02.776967+00:00,FULL,llm_style,eval,llm_style_eval_093,32,2048,3072,fp16,Ascend910B2,c07,128,128,32,8,3,8,0.0,223.863,45.340999999999994,63.771620000000006,8.880553671070336,3,-1,-1,32x2048x3072,0,"path_reordered,ASCEND_HOME_PATH_set,ASCEND_TOOLKIT_HOME_set;timing=npu_profiler_batch_offline_kernel_step"
2026-03-03T10:03:02.777045+00:00,FULL,llm_style,eval,llm_style_eval_094,32,1024,2048,fp16,Ascend910B2,c06,64,128,32,4,3,8,0.0,0.0,22.479999999999997,34.1636,5.970539501779361,3,-1,-1,32x1024x2048,0,"path_reordered,ASCEND_HOME_PATH_set,ASCEND_TOOLKIT_HOME_set;timing=npu_profiler_batch_offline_kernel_step"
2026-03-03T10:03:03.155242+00:00,FULL,llm_style,eval,llm_style_eval_095,8,6144,2048,fp16,Ascend910B2,c11,32,128,32,4,2,8,0.0,378.152,64.822,85.14738,3.1058374008824163,5,-1,-1,8x6144x2048,0,"path_reordered,ASCEND_HOME_PATH_set,ASCEND_TOOLKIT_HOME_set;timing=npu_profiler_batch_offline_kernel_step"
2026-03-03T10:03:03.155317+00:00,FULL,llm_style,eval,llm_style_eval_096,64,2048,3072,fp16,Ascend910B2,c09,128,64,64,8,3,8,0.0,0.0,48.631,67.884,16.55952721515083,3,-1,-1,64x2048x3072,0,"path_reordered,ASCEND_HOME_PATH_set,ASCEND_TOOLKIT_HOME_set;timing=npu_profiler_batch_offline_kernel_step"
2026-03-03T10:03:03.155344+00:00,FULL,llm_style,eval,llm_style_eval_097,64,6144,1024,fp16,Ascend910B2,c08,128,128,64,8,4,8,0.0,0.0,24.511,32.5212,32.85489649545102,1,-1,-1,64x6144x1024,0,"path_reordered,ASCEND_HOME_PATH_set,ASCEND_TOOLKIT_HOME_set;timing=npu_profiler_batch_offline_kernel_step"
2026-03-03T10:03:03.155365+00:00,FULL,llm_style,eval,llm_style_eval_098,32,6144,1024,fp16,Ascend910B2,c11,32,128,32,4,2,8,0.0,0.0,49.79,59.534580000000005,8.087029202651136,1,-1,-1,32x6144x1024,0,"path_reordered,ASCEND_HOME_PATH_set,ASCEND_TOOLKIT_HOME_set;timing=npu_profiler_batch_offline_kernel_step"
2026-03-03T10:03:03.330389+00:00,FULL,llm_style,eval,llm_style_eval_099,1,2048,2048,fp16,Ascend910B2,c01,64,32,32,2,2,8,0.0,174.986,71.97200000000001,104.69156,0.11655377091090979,7,-1,-1,1x2048x2048,0,"path_reordered,ASCEND_HOME_PATH_set,ASCEND_TOOLKIT_HOME_set;timing=npu_profiler_batch_offline_kernel_step"
2026-03-03T10:03:03.330481+00:00,FULL,llm_style,eval,llm_style_eval_100,64,8192,1024,fp16,Ascend910B2,c09,128,64,64,8,3,8,0.0,0.0,47.620000000000005,71.62998,22.54812734145317,1,-1,-1,64x8192x1024,0,"path_reordered,ASCEND_HOME_PATH_set,ASCEND_TOOLKIT_HOME_set;timing=npu_profiler_batch_offline_kernel_step"
2026-03-03T10:03:03.330508+00:00,FULL,llm_style,eval,llm_style_eval_101,64,8192,1536,fp16,Ascend910B2,c09,128,64,64,8,3,8,0.0,0.0,64.911,91.9168,24.81263169570643,1,-1,-1,64x8192x1536,0,"path_reordered,ASCEND_HOME_PATH_set,ASCEND_TOOLKIT_HOME_set;timing=npu_profiler_batch_offline_kernel_step"
2026-03-03T10:03:03.330541+00:00,FULL,llm_style,eval,llm_style_eval_102,32,3072,2048,fp16,Ascend910B2,c04,64,64,64,4,3,8,0.0,0.0,33.120999999999995,49.22,12.157035838289909,3,-1,-1,32x3072x2048,0,"path_reordered,ASCEND_HOME_PATH_set,ASCEND_TOOLKIT_HOME_set;timing=npu_profiler_batch_offline_kernel_step"
2026-03-03T10:03:03.330566+00:00,FULL,llm_style,eval,llm_style_eval_103,64,2048,3072,fp16,Ascend910B2,c09,128,64,64,8,3,8,0.0,0.0,49.162,52.719179999999994,16.380667344697123,3,-1,-1,64x2048x3072,0,"path_reordered,ASCEND_HOME_PATH_set,ASCEND_TOOLKIT_HOME_set;timing=npu_profiler_batch_offline_kernel_step"
2026-03-03T10:03:03.330586+00:00,FULL,llm_style,eval,llm_style_eval_104,16,6144,2048,fp16,Ascend910B2,c09,128,64,64,8,3,8,0.0,0.0,54.721999999999994,83.11404,7.358159131610687,5,-1,-1,16x6144x2048,0,"path_reordered,ASCEND_HOME_PATH_set,ASCEND_TOOLKIT_HOME_set;timing=npu_profiler_batch_offline_kernel_step"
2026-03-03T10:03:03.614706+00:00,FULL,llm_style,eval,llm_style_eval_105,1,1024,8192,fp16,Ascend910B2,c04,64,64,64,4,3,8,0.0,284.083,42.791,72.01182000000001,0.392073473393938,6,-1,-1,1x1024x8192,0,"path_reordered,ASCEND_HOME_PATH_set,ASCEND_TOOLKIT_HOME_set;timing=npu_profiler_batch_offline_kernel_step"
2026-03-03T10:03:04.516247+00:00,FULL,llm_style,eval,llm_style_eval_106,32,4096,8192,fp16,Ascend910B2,c08,128,128,64,8,4,8,0.0,901.446,99.001,158.71744,21.691534913788747,2,-1,-1,32x4096x8192,0,"path_reordered,ASCEND_HOME_PATH_set,ASCEND_TOOLKIT_HOME_set;timing=npu_profiler_batch_offline_kernel_step"
2026-03-03T10:03:04.516328+00:00,FULL,llm_style,eval,llm_style_eval_107,64,6144,1536,fp16,Ascend910B2,c08,128,128,64,8,4,8,0.0,0.0,32.91,39.45358000000001,36.704939288969925,1,-1,-1,64x6144x1536,0,"path_reordered,ASCEND_HOME_PATH_set,ASCEND_TOOLKIT_HOME_set;timing=npu_profiler_batch_offline_kernel_step"
2026-03-03T10:03:04.707660+00:00,FULL,llm_style,eval,llm_style_eval_108,8,3072,1536,fp16,Ascend910B2,c03,64,64,32,4,2,8,0.0,191.289,53.402,69.87922,1.413757387363769,7,-1,-1,8x3072x1536,0,"path_reordered,ASCEND_HOME_PATH_set,ASCEND_TOOLKIT_HOME_set;timing=npu_profiler_batch_offline_kernel_step"
2026-03-03T10:03:04.707748+00:00,FULL,llm_style,eval,llm_style_eval_109,16,2048,1024,fp16,Ascend910B2,c06,64,128,32,4,3,8,0.0,0.0,19.35,22.571780000000004,3.4681583462532295,7,-1,-1,16x2048x1024,0,"path_reordered,ASCEND_HOME_PATH_set,ASCEND_TOOLKIT_HOME_set;timing=npu_profiler_batch_offline_kernel_step"
2026-03-03T10:03:06.358071+00:00,FULL,llm_style,eval,llm_style_eval_110,1,8192,8192,fp16,Ascend910B2,c08,128,128,64,8,4,8,0.0,1650.277,124.021,230.6938,1.082217753444981,4,-1,-1,1x8192x8192,0,"path_reordered,ASCEND_HOME_PATH_set,ASCEND_TOOLKIT_HOME_set;timing=npu_profiler_batch_offline_kernel_step"
2026-03-03T10:03:06.652835+00:00,FULL,llm_style,eval,llm_style_eval_111,8,6144,1536,fp16,Ascend910B2,c04,64,64,64,4,3,8,0.0,294.668,41.592,66.5086,3.630384304673976,5,-1,-1,8x6144x1536,0,"path_reordered,ASCEND_HOME_PATH_set,ASCEND_TOOLKIT_HOME_set;timing=npu_profiler_batch_offline_kernel_step"
2026-03-03T10:03:06.652915+00:00,FULL,llm_style,eval,llm_style_eval_112,2,6144,3072,fp16,Ascend910B2,c07,128,128,32,8,3,8,0.0,0.0,78.71199999999999,117.73060000000001,0.9591608903343837,5,-1,-1,2x6144x3072,0,"path_reordered,ASCEND_HOME_PATH_set,ASCEND_TOOLKIT_HOME_set;timing=npu_profiler_batch_offline_kernel_step"
2026-03-03T10:03:06.652942+00:00,FULL,llm_style,eval,llm_style_eval_113,1,8192,8192,fp16,Ascend910B2,c08,128,128,64,8,4,8,0.0,0.0,124.542,133.50339999999997,1.077690481925776,4,-1,-1,1x8192x8192,0,"path_reordered,ASCEND_HOME_PATH_set,ASCEND_TOOLKIT_HOME_set;timing=npu_profiler_batch_offline_kernel_step"
2026-03-03T10:03:06.798128+00:00,FULL,llm_style,eval,llm_style_eval_114,1,3072,1024,fp16,Ascend910B2,c03,64,64,32,4,2,8,0.0,145.147,33.851,42.0838,0.18585731588431656,7,-1,-1,1x3072x1024,0,"path_reordered,ASCEND_HOME_PATH_set,ASCEND_TOOLKIT_HOME_set;timing=npu_profiler_batch_offline_kernel_step"
2026-03-03T10:03:06.993256+00:00,FULL,llm_style,eval,llm_style_eval_115,16,3072,1536,fp16,Ascend910B2,c06,64,128,32,4,3,8,0.0,195.04,35.7,42.995,4.22955025210084,7,-1,-1,16x3072x1536,0,"path_reordered,ASCEND_HOME_PATH_set,ASCEND_TOOLKIT_HOME_set;timing=npu_profiler_batch_offline_kernel_step"
2026-03-03T10:03:07.140814+00:00,FULL,llm_style,eval,llm_style_eval_116,8,3072,1024,fp16,Ascend910B2,c09,128,64,64,8,3,8,0.0,147.464,18.811,25.855800000000002,2.6756497793844027,7,-1,-1,8x3072x1024,0,"path_reordered,ASCEND_HOME_PATH_set,ASCEND_TOOLKIT_HOME_set;timing=npu_profiler_batch_offline_kernel_step"
2026-03-03T10:03:07.326641+00:00,FULL,llm_style,eval,llm_style_eval_117,4,1024,4096,fp16,Ascend910B2,c11,32,128,32,4,2,8,0.0,185.743,41.131,60.75882000000001,0.8157942184726849,7,-1,-1,4x1024x4096,0,"path_reordered,ASCEND_HOME_PATH_set,ASCEND_TOOLKIT_HOME_set;timing=npu_profiler_batch_offline_kernel_step"
2026-03-03T10:03:07.326716+00:00,FULL,llm_style,eval,llm_style_eval_118,64,6144,3072,fp16,Ascend910B2,c10,64,128,64,8,3,8,0.0,0.0,50.730999999999995,73.48602000000001,47.62214630107824,1,-1,-1,64x6144x3072,0,"path_reordered,ASCEND_HOME_PATH_set,ASCEND_TOOLKIT_HOME_set;timing=npu_profiler_batch_offline_kernel_step"
2026-03-03T10:03:08.650222+00:00,FULL,llm_style,eval,llm_style_eval_119,64,8192,6144,fp16,Ascend910B2,c08,128,128,64,8,4,8,0.0,1323.464,125.041,189.73642,51.52270810374198,1,-1,-1,64x8192x6144,0,"path_reordered,ASCEND_HOME_PATH_set,ASCEND_TOOLKIT_HOME_set;timing=npu_profiler_batch_offline_kernel_step"
2026-03-03T10:03:08.820255+00:00,FULL,llm_style,eval,llm_style_eval_120,8,1024,4096,fp16,Ascend910B2,c08,128,128,64,8,4,8,0.0,169.936,22.941000000000003,36.60560000000001,2.925280676518024,7,-1,-1,8x1024x4096,0,"path_reordered,ASCEND_HOME_PATH_set,ASCEND_TOOLKIT_HOME_set;timing=npu_profiler_batch_offline_kernel_step"
2026-03-03T10:03:08.943117+00:00,FULL,llm_style,eval,llm_style_eval_121,4,1024,2048,fp16,Ascend910B2,c10,64,128,64,8,3,8,0.0,122.771,11.821,19.427000000000003,1.4192721427967179,7,-1,-1,4x1024x2048,0,"path_reordered,ASCEND_HOME_PATH_set,ASCEND_TOOLKIT_HOME_set;timing=npu_profiler_batch_offline_kernel_step"
2026-03-03T10:03:09.608771+00:00,FULL,llm_style,eval,llm_style_eval_122,4,6144,4096,fp16,Ascend910B2,c08,128,128,64,8,4,8,0.0,665.57,50.402,82.42600000000002,3.9944167294948607,5,-1,-1,4x6144x4096,0,"path_reordered,ASCEND_HOME_PATH_set,ASCEND_TOOLKIT_HOME_set;timing=npu_profiler_batch_offline_kernel_step"
2026-03-03T10:03:10.283004+00:00,FULL,llm_style,eval,llm_style_eval_123,4,3072,8192,fp16,Ascend910B2,c08,128,128,64,8,4,8,0.0,674.135,51.07,82.17058000000002,3.942169414529078,6,-1,-1,4x3072x8192,0,"path_reordered,ASCEND_HOME_PATH_set,ASCEND_TOOLKIT_HOME_set;timing=npu_profiler_batch_offline_kernel_step"
2026-03-03T10:03:10.283074+00:00,FULL,llm_style,eval,llm_style_eval_124,64,6144,1024,fp16,Ascend910B2,c08,128,128,64,8,4,8,0.0,0.0,23.619999999999997,31.84062,34.09425774767147,1,-1,-1,64x6144x1024,0,"path_reordered,ASCEND_HOME_PATH_set,ASCEND_TOOLKIT_HOME_set;timing=npu_profiler_batch_offline_kernel_step"
2026-03-03T10:03:10.283101+00:00,FULL,llm_style,eval,llm_style_eval_125,64,1536,8192,fp16,Ascend910B2,c10,64,128,64,8,3,8,0.0,0.0,53.071,85.24882000000001,30.348264325149326,2,-1,-1,64x1536x8192,0,"path_reordered,ASCEND_HOME_PATH_set,ASCEND_TOOLKIT_HOME_set;timing=npu_profiler_batch_offline_kernel_step"
2026-03-03T10:03:10.283123+00:00,FULL,llm_style,eval,llm_style_eval_126,64,2048,8192,fp16,Ascend910B2,c08,128,128,64,8,4,8,0.0,0.0,55.041,87.6656,39.01607252775204,2,-1,-1,64x2048x8192,0,"path_reordered,ASCEND_HOME_PATH_set,ASCEND_TOOLKIT_HOME_set;timing=npu_profiler_batch_offline_kernel_step"
2026-03-03T10:03:10.655022+00:00,FULL,llm_style,eval,llm_style_eval_127,2,8192,1536,fp16,Ascend910B2,c08,128,128,64,8,4,8,0.0,371.859,30.741,49.784800000000004,1.637280765101981,5,-1,-1,2x8192x1536,0,"path_reordered,ASCEND_HOME_PATH_set,ASCEND_TOOLKIT_HOME_set;timing=npu_profiler_batch_offline_kernel_step"
2026-03-03T10:03:56.048894+00:00,BUCKET,llm_style,tune,llm_style_tune_000,64,6144,6144,fp16,Ascend910B2,c08,128,128,64,8,4,8,0.0,1024.1,258.33000242710114,267.3231905698776,18.704131005315613,1,-1,-1,llm8_g1,0,"path_reordered,ASCEND_HOME_PATH_set,ASCEND_TOOLKIT_HOME_set;timing=event"
2026-03-03T10:03:56.368253+00:00,BUCKET,llm_style,tune,llm_style_tune_001,64,8192,1536,fp16,Ascend910B2,c08,128,128,64,8,4,8,0.0,0.0,251.46999955177307,262.5336083769798,6.404790785663497,1,-1,-1,llm8_g1,0,"path_reordered,ASCEND_HOME_PATH_set,ASCEND_TOOLKIT_HOME_set;timing=event"
2026-03-03T10:03:57.081441+00:00,BUCKET,llm_style,tune,llm_style_tune_002,32,3072,8192,fp16,Ascend910B2,c10,64,128,64,8,3,8,0.0,713.077,248.54999780654907,277.40660786628723,6.480035205043811,2,-1,-1,llm8_g2,0,"path_reordered,ASCEND_HOME_PATH_set,ASCEND_TOOLKIT_HOME_set;timing=event"
2026-03-03T10:03:57.615827+00:00,BUCKET,llm_style,tune,llm_style_tune_003,4,6144,3072,fp16,Ascend910B2,c07,128,128,32,8,3,8,0.0,534.278,250.0699982047081,258.0278044939041,0.6038107133363317,5,-1,-1,llm8_g5,0,"path_reordered,ASCEND_HOME_PATH_set,ASCEND_TOOLKIT_HOME_set;timing=event"
2026-03-03T10:03:57.836566+00:00,BUCKET,llm_style,tune,llm_style_tune_004,8,8192,1024,fp16,Ascend910B2,c07,128,128,32,8,3,8,0.0,0.0,249.83999878168106,278.26379746198654,0.5372147320465053,5,-1,-1,llm8_g5,0,"path_reordered,ASCEND_HOME_PATH_set,ASCEND_TOOLKIT_HOME_set;timing=event"
2026-03-03T10:03:58.467106+00:00,BUCKET,llm_style,tune,llm_style_tune_005,32,8192,3072,fp16,Ascend910B2,c08,128,128,64,8,4,8,0.0,0.0,250.43999403715134,274.21701192855835,6.431132304535492,1,-1,-1,llm8_g1,0,"path_reordered,ASCEND_HOME_PATH_set,ASCEND_TOOLKIT_HOME_set;timing=event"
2026-03-03T10:03:59.768118+00:00,BUCKET,llm_style,tune,llm_style_tune_006,32,6144,8192,fp16,Ascend910B2,c10,64,128,64,8,3,8,0.0,1300.906,267.6900029182434,272.536798119545,12.033417150000222,0,-1,-1,llm8_g0,0,"path_reordered,ASCEND_HOME_PATH_set,ASCEND_TOOLKIT_HOME_set;timing=event"
2026-03-03T10:03:59.911602+00:00,BUCKET,llm_style,tune,llm_style_tune_007,8,1536,2048,fp16,Ascend910B2,c05,128,64,32,4,3,8,0.0,143.377,247.85999953746796,283.33119362592697,0.2030648272973614,7,-1,-1,llm8_g7,0,"path_reordered,ASCEND_HOME_PATH_set,ASCEND_TOOLKIT_HOME_set;timing=event"
2026-03-03T10:04:00.070768+00:00,BUCKET,llm_style,tune,llm_style_tune_008,16,1536,4096,fp16,Ascend910B2,c05,128,64,32,4,3,8,0.0,0.0,254.7599971294403,289.7252130508423,0.7902598299124197,7,-1,-1,llm8_g7,0,"path_reordered,ASCEND_HOME_PATH_set,ASCEND_TOOLKIT_HOME_set;timing=event"
2026-03-03T10:04:00.222095+00:00,BUCKET,llm_style,tune,llm_style_tune_009,64,1536,2048,fp16,Ascend910B2,c04,64,64,64,4,3,8,0.0,151.224,264.51000571250916,271.2691920995712,1.5222606907265204,3,-1,-1,llm8_g3,0,"path_reordered,ASCEND_HOME_PATH_set,ASCEND_TOOLKIT_HOME_set;timing=event"
2026-03-03T10:04:00.279651+00:00,BUCKET,llm_style,tune,llm_style_tune_010,2,2048,1024,fp16,Ascend910B2,c05,128,64,32,4,3,8,0.0,0.0,277.37000584602356,296.7389917373657,0.030243385453352763,7,-1,-1,llm8_g7,0,"path_reordered,ASCEND_HOME_PATH_set,ASCEND_TOOLKIT_HOME_set;timing=event"
2026-03-03T10:04:00.973416+00:00,BUCKET,llm_style,tune,llm_style_tune_011,2,3072,8192,fp16,Ascend910B2,c10,64,128,64,8,3,8,0.0,693.668,251.71999633312225,265.61041235923767,0.39990186503413017,6,-1,-1,llm8_g6,0,"path_reordered,ASCEND_HOME_PATH_set,ASCEND_TOOLKIT_HOME_set;timing=event"
2026-03-03T10:04:01.059854+00:00,BUCKET,llm_style,tune,llm_style_tune_012,64,2048,1536,fp16,Ascend910B2,c04,64,64,64,4,3,8,0.0,0.0,260.50999760627747,264.55120980739594,1.545634285439406,3,-1,-1,llm8_g3,0,"path_reordered,ASCEND_HOME_PATH_set,ASCEND_TOOLKIT_HOME_set;timing=event"
2026-03-03T10:04:01.888107+00:00,BUCKET,llm_style,tune,llm_style_tune_013,16,8192,4096,fp16,Ascend910B2,c07,128,128,32,8,3,8,0.0,0.0,311.37000024318695,316.7830142378807,3.448443405470609,5,-1,-1,llm8_g5,0,"path_reordered,ASCEND_HOME_PATH_set,ASCEND_TOOLKIT_HOME_set;timing=event"
2026-03-03T10:04:02.714427+00:00,BUCKET,llm_style,tune,llm_style_tune_014,4,8192,4096,fp16,Ascend910B2,c07,128,128,32,8,3,8,0.0,0.0,298.7799942493439,302.6488009095192,0.8984385205388947,5,-1,-1,llm8_g5,0,"path_reordered,ASCEND_HOME_PATH_set,ASCEND_TOOLKIT_HOME_set;timing=event"
2026-03-03T10:04:02.871233+00:00,BUCKET,llm_style,tune,llm_style_tune_015,4,3072,2048,fp16,Ascend910B2,c05,128,64,32,4,3,8,0.0,0.0,257.6500028371811,267.45518684387207,0.19534891304389584,7,-1,-1,llm8_g7,0,"path_reordered,ASCEND_HOME_PATH_set,ASCEND_TOOLKIT_HOME_set;timing=event"
2026-03-03T10:04:02.916434+00:00,BUCKET,llm_style,tune,llm_style_tune_016,16,1536,1024,fp16,Ascend910B2,c05,128,64,32,4,3,8,0.0,0.0,276.529997587204,283.8894084095955,0.182011530174508,7,-1,-1,llm8_g7,0,"path_reordered,ASCEND_HOME_PATH_set,ASCEND_TOOLKIT_HOME_set;timing=event"
2026-03-03T10:04:02.974917+00:00,BUCKET,llm_style,tune,llm_style_tune_017,32,1024,2048,fp16,Ascend910B2,c04,64,64,64,4,3,8,0.0,0.0,280.91000020504,309.3873891234398,0.4777961906020885,3,-1,-1,llm8_g3,0,"path_reordered,ASCEND_HOME_PATH_set,ASCEND_TOOLKIT_HOME_set;timing=event"
2026-03-03T10:04:03.058650+00:00,BUCKET,llm_style,tune,llm_style_tune_018,64,1536,2048,fp16,Ascend910B2,c04,64,64,64,4,3,8,0.0,0.0,282.14000165462494,296.6972130537033,1.4271396527915896,3,-1,-1,llm8_g3,0,"path_reordered,ASCEND_HOME_PATH_set,ASCEND_TOOLKIT_HOME_set;timing=event"
2026-03-03T10:04:03.218142+00:00,BUCKET,llm_style,tune,llm_style_tune_019,4,4096,1536,fp16,Ascend910B2,c05,128,64,32,4,3,8,0.0,0.0,268.60998570919037,283.7748050689697,0.18737817161604473,7,-1,-1,llm8_g7,0,"path_reordered,ASCEND_HOME_PATH_set,ASCEND_TOOLKIT_HOME_set;timing=event"
2026-03-03T10:04:03.530211+00:00,BUCKET,llm_style,tune,llm_style_tune_020,1,8192,1536,fp16,Ascend910B2,c07,128,128,32,8,3,8,0.0,0.0,250.7300078868866,260.2286010980606,0.1003702118150661,5,-1,-1,llm8_g5,0,"path_reordered,ASCEND_HOME_PATH_set,ASCEND_TOOLKIT_HOME_set;timing=event"
2026-03-03T10:04:03.697592+00:00,BUCKET,llm_style,tune,llm_style_tune_021,64,1536,4096,fp16,Ascend910B2,c04,64,64,64,4,3,8,0.0,0.0,253.48000228405,290.19921243190765,3.1770015809672145,3,-1,-1,llm8_g3,0,"path_reordered,ASCEND_HOME_PATH_set,ASCEND_TOOLKIT_HOME_set;timing=event"
2026-03-03T10:04:03.867818+00:00,BUCKET,llm_style,tune,llm_style_tune_022,64,1024,6144,fp16,Ascend910B2,c04,64,64,64,4,3,8,0.0,0.0,255.49998879432678,261.42040610313416,3.151884161718137,3,-1,-1,llm8_g3,0,"path_reordered,ASCEND_HOME_PATH_set,ASCEND_TOOLKIT_HOME_set;timing=event"
2026-03-03T10:04:03.985313+00:00,BUCKET,llm_style,tune,llm_style_tune_023,8,4096,1024,fp16,Ascend910B2,c05,128,64,32,4,3,8,0.0,0.0,255.7699978351593,257.49721229076385,0.2623797340110659,7,-1,-1,llm8_g7,0,"path_reordered,ASCEND_HOME_PATH_set,ASCEND_TOOLKIT_HOME_set;timing=event"
2026-03-03T10:04:04.405869+00:00,BUCKET,llm_style,tune,llm_style_tune_024,8,4096,4096,fp16,Ascend910B2,c05,128,64,32,4,3,8,0.0,0.0,305.3400069475174,313.5820034146309,0.8791362084633062,7,-1,-1,llm8_g7,0,"path_reordered,ASCEND_HOME_PATH_set,ASCEND_TOOLKIT_HOME_set;timing=event"
2026-03-03T10:04:04.571556+00:00,BUCKET,llm_style,tune,llm_style_tune_025,32,6144,1024,fp16,Ascend910B2,c08,128,128,64,8,4,8,0.0,0.0,253.27999889850616,271.95800572633743,1.58975515536602,1,-1,-1,llm8_g1,0,"path_reordered,ASCEND_HOME_PATH_set,ASCEND_TOOLKIT_HOME_set;timing=event"
2026-03-03T10:04:04.695317+00:00,BUCKET,llm_style,tune,llm_style_tune_026,1,3072,1536,fp16,Ascend910B2,c05,128,64,32,4,3,8,0.0,0.0,262.36000657081604,285.5919939279556,0.03597036043469042,7,-1,-1,llm8_g7,0,"path_reordered,ASCEND_HOME_PATH_set,ASCEND_TOOLKIT_HOME_set;timing=event"
2026-03-03T10:04:04.931783+00:00,BUCKET,llm_style,tune,llm_style_tune_027,1,6144,1536,fp16,Ascend910B2,c07,128,128,32,8,3,8,0.0,0.0,253.82000207901,281.11060857772827,0.07436123176031147,5,-1,-1,llm8_g5,0,"path_reordered,ASCEND_HOME_PATH_set,ASCEND_TOOLKIT_HOME_set;timing=event"
2026-03-03T10:04:05.092456+00:00,BUCKET,llm_style,tune,llm_style_tune_028,4,4096,1536,fp16,Ascend910B2,c05,128,64,32,4,3,8,0.0,0.0,250.72000175714493,257.22540497779846,0.20074843509594725,7,-1,-1,llm8_g7,0,"path_reordered,ASCEND_HOME_PATH_set,ASCEND_TOOLKIT_HOME_set;timing=event"
2026-03-03T10:04:05.255456+00:00,BUCKET,llm_style,tune,llm_style_tune_029,16,1024,6144,fp16,Ascend910B2,c05,128,64,32,4,3,8,0.0,0.0,253.1300038099289,263.10459822416306,0.7953485915133663,7,-1,-1,llm8_g7,0,"path_reordered,ASCEND_HOME_PATH_set,ASCEND_TOOLKIT_HOME_set;timing=event"
2026-03-03T10:04:06.089381+00:00,BUCKET,llm_style,tune,llm_style_tune_030,64,4096,8192,fp16,Ascend910B2,c10,64,128,64,8,3,8,0.0,0.0,276.2500047683716,292.08460211753845,15.547392658332143,2,-1,-1,llm8_g2,0,"path_reordered,ASCEND_HOME_PATH_set,ASCEND_TOOLKIT_HOME_set;timing=event"
2026-03-03T10:04:06.245087+00:00,BUCKET,llm_style,tune,llm_style_tune_031,1,6144,1024,fp16,Ascend910B2,c07,128,128,32,8,3,8,0.0,0.0,255.75999915599823,280.17800986766815,0.04919812340289062,5,-1,-1,llm8_g5,0,"path_reordered,ASCEND_HOME_PATH_set,ASCEND_TOOLKIT_HOME_set;timing=event"
2026-03-03T10:04:06.365310+00:00,BUCKET,llm_style,tune,llm_style_tune_032,64,1024,4096,fp16,Ascend910B2,c04,64,64,64,4,3,8,0.0,0.0,254.28999960422516,259.4476041197777,2.11125452371537,3,-1,-1,llm8_g3,0,"path_reordered,ASCEND_HOME_PATH_set,ASCEND_TOOLKIT_HOME_set;timing=event"
2026-03-03T10:04:07.191606+00:00,BUCKET,llm_style,tune,llm_style_tune_033,2,4096,8192,fp16,Ascend910B2,c10,64,128,64,8,3,8,0.0,0.0,256.9500058889389,273.126600086689,0.5223495813345602,6,-1,-1,llm8_g6,0,"path_reordered,ASCEND_HOME_PATH_set,ASCEND_TOOLKIT_HOME_set;timing=event"
2026-03-03T10:04:08.400012+00:00,BUCKET,llm_style,tune,llm_style_tune_034,1,8192,6144,fp16,Ascend910B2,c07,128,128,32,8,3,8,0.0,0.0,341.48000180721283,349.8254042863846,0.2947853328665227,5,-1,-1,llm8_g5,0,"path_reordered,ASCEND_HOME_PATH_set,ASCEND_TOOLKIT_HOME_set;timing=event"
2026-03-03T10:04:08.445134+00:00,BUCKET,llm_style,tune,llm_style_tune_035,64,1536,1024,fp16,Ascend910B2,c04,64,64,64,4,3,8,0.0,0.0,265.6800001859665,311.57199770212173,0.7577784999212533,3,-1,-1,llm8_g3,0,"path_reordered,ASCEND_HOME_PATH_set,ASCEND_TOOLKIT_HOME_set;timing=event"
2026-03-03T10:04:08.608132+00:00,BUCKET,llm_style,tune,llm_style_tune_036,32,3072,2048,fp16,Ascend910B2,c04,64,64,64,4,3,8,0.0,0.0,252.6400089263916,275.4040065407753,1.593782337607959,3,-1,-1,llm8_g3,0,"path_reordered,ASCEND_HOME_PATH_set,ASCEND_TOOLKIT_HOME_set;timing=event"
2026-03-03T10:04:08.839855+00:00,BUCKET,llm_style,tune,llm_style_tune_037,4,1536,6144,fp16,Ascend910B2,c05,128,64,32,4,3,8,0.0,0.0,250.01998990774155,252.76919186115265,0.3019657429306309,7,-1,-1,llm8_g7,0,"path_reordered,ASCEND_HOME_PATH_set,ASCEND_TOOLKIT_HOME_set;timing=event"
2026-03-03T10:04:09.002660+00:00,BUCKET,llm_style,tune,llm_style_tune_038,1,4096,1536,fp16,Ascend910B2,c05,128,64,32,4,3,8,0.0,0.0,251.79000198841095,266.4459964632988,0.04997383494432456,7,-1,-1,llm8_g7,0,"path_reordered,ASCEND_HOME_PATH_set,ASCEND_TOOLKIT_HOME_set;timing=event"
2026-03-03T10:04:09.165670+00:00,BUCKET,llm_style,tune,llm_style_tune_039,4,1536,4096,fp16,Ascend910B2,c05,128,64,32,4,3,8,0.0,0.0,249.88000094890594,253.23560625314713,0.20142327440718846,7,-1,-1,llm8_g7,0,"path_reordered,ASCEND_HOME_PATH_set,ASCEND_TOOLKIT_HOME_set;timing=event"
2026-03-03T10:04:10.506812+00:00,BUCKET,llm_style,tune,llm_style_tune_040,2,6144,8192,fp16,Ascend910B2,c10,64,128,64,8,3,8,0.0,1341.009,256.6100060939789,286.32319539785385,0.7845625159537531,4,-1,-1,llm8_g4,0,"path_reordered,ASCEND_HOME_PATH_set,ASCEND_TOOLKIT_HOME_set;timing=event"
2026-03-03T10:04:10.560195+00:00,BUCKET,llm_style,tune,llm_style_tune_041,16,1024,1536,fp16,Ascend910B2,c05,128,64,32,4,3,8,0.0,0.0,266.98000729084015,293.03258925676346,0.18852216130614677,7,-1,-1,llm8_g7,0,"path_reordered,ASCEND_HOME_PATH_set,ASCEND_TOOLKIT_HOME_set;timing=event"
2026-03-03T10:04:10.733184+00:00,BUCKET,llm_style,tune,llm_style_tune_042,32,3072,2048,fp16,Ascend910B2,c04,64,64,64,4,3,8,0.0,0.0,255.2099972963333,284.9509981274605,1.577732801479815,3,-1,-1,llm8_g3,0,"path_reordered,ASCEND_HOME_PATH_set,ASCEND_TOOLKIT_HOME_set;timing=event"
2026-03-03T10:04:10.949783+00:00,BUCKET,llm_style,tune,llm_style_tune_043,2,2048,4096,fp16,Ascend910B2,c05,128,64,32,4,3,8,0.0,0.0,258.46000015735626,267.28898972272873,0.1298244679237457,7,-1,-1,llm8_g7,0,"path_reordered,ASCEND_HOME_PATH_set,ASCEND_TOOLKIT_HOME_set;timing=event"
2026-03-03T10:04:11.394988+00:00,BUCKET,llm_style,tune,llm_style_tune_044,64,2048,8192,fp16,Ascend910B2,c10,64,128,64,8,3,8,0.0,0.0,249.06999617815018,260.58578699827194,8.622008595784408,2,-1,-1,llm8_g2,0,"path_reordered,ASCEND_HOME_PATH_set,ASCEND_TOOLKIT_HOME_set;timing=event"
2026-03-03T10:04:12.006496+00:00,BUCKET,llm_style,tune,llm_style_tune_045,2,3072,8192,fp16,Ascend910B2,c10,64,128,64,8,3,8,0.0,0.0,251.48999691009521,279.07599329948425,0.40026759408640006,6,-1,-1,llm8_g6,0,"path_reordered,ASCEND_HOME_PATH_set,ASCEND_TOOLKIT_HOME_set;timing=event"
2026-03-03T10:04:13.188943+00:00,BUCKET,llm_style,tune,llm_style_tune_046,4,8192,6144,fp16,Ascend910B2,c07,128,128,32,8,3,8,0.0,0.0,351.92999243736267,364.3350026011467,1.1441286410724576,5,-1,-1,llm8_g5,0,"path_reordered,ASCEND_HOME_PATH_set,ASCEND_TOOLKIT_HOME_set;timing=event"
2026-03-03T10:04:13.345656+00:00,BUCKET,llm_style,tune,llm_style_tune_047,1,1024,6144,fp16,Ascend910B2,c05,128,64,32,4,3,8,0.0,0.0,251.66000425815582,293.35299402475357,0.04999964947585513,7,-1,-1,llm8_g7,0,"path_reordered,ASCEND_HOME_PATH_set,ASCEND_TOOLKIT_HOME_set;timing=event"
2026-03-03T10:04:13.671112+00:00,BUCKET,llm_style,tune,llm_style_tune_048,32,4096,3072,fp16,Ascend910B2,c04,64,64,64,4,3,8,0.0,0.0,248.67000430822372,264.4425916671753,3.238453991426451,3,-1,-1,llm8_g3,0,"path_reordered,ASCEND_HOME_PATH_set,ASCEND_TOOLKIT_HOME_set;timing=event"
2026-03-03T10:04:13.733120+00:00,BUCKET,llm_style,tune,llm_style_tune_049,16,2048,1024,fp16,Ascend910B2,c05,128,64,32,4,3,8,0.0,0.0,261.5000009536743,287.72419422864914,0.2566304541310062,7,-1,-1,llm8_g7,0,"path_reordered,ASCEND_HOME_PATH_set,ASCEND_TOOLKIT_HOME_set;timing=event"
2026-03-03T10:04:13.775518+00:00,BUCKET,llm_style,tune,llm_style_tune_050,4,1024,1536,fp16,Ascend910B2,c05,128,64,32,4,3,8,0.0,0.0,268.2400047779083,279.0106052160263,0.04690915514417073,7,-1,-1,llm8_g7,0,"path_reordered,ASCEND_HOME_PATH_set,ASCEND_TOOLKIT_HOME_set;timing=event"
2026-03-03T10:04:14.616735+00:00,BUCKET,llm_style,tune,llm_style_tune_051,64,4096,8192,fp16,Ascend910B2,c10,64,128,64,8,3,8,0.0,0.0,273.27999472618103,281.69459730386734,15.716361895803747,2,-1,-1,llm8_g2,0,"path_reordered,ASCEND_HOME_PATH_set,ASCEND_TOOLKIT_HOME_set;timing=event"
2026-03-03T10:04:14.701490+00:00,BUCKET,llm_style,tune,llm_style_tune_052,16,2048,1536,fp16,Ascend910B2,c05,128,64,32,4,3,8,0.0,0.0,257.2699934244156,275.0527873635292,0.391274919628644,7,-1,-1,llm8_g7,0,"path_reordered,ASCEND_HOME_PATH_set,ASCEND_TOOLKIT_HOME_set;timing=event"
2026-03-03T10:04:14.734144+00:00,BUCKET,llm_style,tune,llm_style_tune_053,64,1024,1024,fp16,Ascend910B2,c04,64,64,64,4,3,8,0.0,0.0,264.8399919271469,277.53258913755417,0.506787993094793,3,-1,-1,llm8_g3,0,"path_reordered,ASCEND_HOME_PATH_set,ASCEND_TOOLKIT_HOME_set;timing=event"
2026-03-03T10:04:15.555468+00:00,BUCKET,llm_style,tune,llm_style_tune_054,4,4096,8192,fp16,Ascend910B2,c10,64,128,64,8,3,8,0.0,0.0,257.13999569416046,271.55460119247437,1.0439272788947007,6,-1,-1,llm8_g6,0,"path_reordered,ASCEND_HOME_PATH_set,ASCEND_TOOLKIT_HOME_set;timing=event"
2026-03-03T10:04:15.880616+00:00,BUCKET,llm_style,tune,llm_style_tune_055,1,4096,3072,fp16,Ascend910B2,c05,128,64,32,4,3,8,0.0,0.0,266.20998978614807,309.3616008758545,0.09453373263796833,7,-1,-1,llm8_g7,0,"path_reordered,ASCEND_HOME_PATH_set,ASCEND_TOOLKIT_HOME_set;timing=event"
2026-03-03T10:04:15.977264+00:00,BUCKET,llm_style,tune,llm_style_tune_056,64,1536,2048,fp16,Ascend910B2,c04,64,64,64,4,3,8,0.0,0.0,253.7499964237213,260.43941140174866,1.5868105997039486,3,-1,-1,llm8_g3,0,"path_reordered,ASCEND_HOME_PATH_set,ASCEND_TOOLKIT_HOME_set;timing=event"
2026-03-03T10:04:16.188307+00:00,BUCKET,llm_style,tune,llm_style_tune_057,2,4096,2048,fp16,Ascend910B2,c05,128,64,32,4,3,8,0.0,0.0,246.65000289678574,255.7086020708084,0.13604067142071488,7,-1,-1,llm8_g7,0,"path_reordered,ASCEND_HOME_PATH_set,ASCEND_TOOLKIT_HOME_set;timing=event"
2026-03-03T10:04:16.504123+00:00,BUCKET,llm_style,tune,llm_style_tune_058,4,8192,1536,fp16,Ascend910B2,c07,128,128,32,8,3,8,0.0,0.0,247.92999774217606,268.2448062300682,0.40601499179893663,5,-1,-1,llm8_g5,0,"path_reordered,ASCEND_HOME_PATH_set,ASCEND_TOOLKIT_HOME_set;timing=event"
2026-03-03T10:04:16.673623+00:00,BUCKET,llm_style,tune,llm_style_tune_059,1,1536,4096,fp16,Ascend910B2,c05,128,64,32,4,3,8,0.0,0.0,251.37999653816223,259.77139115333557,0.05005534319867721,7,-1,-1,llm8_g7,0,"path_reordered,ASCEND_HOME_PATH_set,ASCEND_TOOLKIT_HOME_set;timing=event"
2026-03-03T10:04:16.841605+00:00,BUCKET,llm_style,tune,llm_style_tune_060,64,1536,4096,fp16,Ascend910B2,c04,64,64,64,4,3,8,0.0,0.0,248.42999875545502,255.31219750642776,3.2415826270349615,3,-1,-1,llm8_g3,0,"path_reordered,ASCEND_HOME_PATH_set,ASCEND_TOOLKIT_HOME_set;timing=event"
2026-03-03T10:04:18.063952+00:00,BUCKET,llm_style,tune,llm_style_tune_061,8,8192,6144,fp16,Ascend910B2,c07,128,128,32,8,3,8,0.0,0.0,357.07999765872955,366.1512067914009,2.255254770023976,5,-1,-1,llm8_g5,0,"path_reordered,ASCEND_HOME_PATH_set,ASCEND_TOOLKIT_HOME_set;timing=event"
2026-03-03T10:04:18.296992+00:00,BUCKET,llm_style,tune,llm_style_tune_062,64,6144,1536,fp16,Ascend910B2,c08,128,128,64,8,4,8,0.0,0.0,248.5099956393242,259.06759172677994,4.860808712713416,1,-1,-1,llm8_g1,0,"path_reordered,ASCEND_HOME_PATH_set,ASCEND_TOOLKIT_HOME_set;timing=event"
2026-03-03T10:04:18.345241+00:00,BUCKET,llm_style,tune,llm_style_tune_063,2,1536,1024,fp16,Ascend910B2,c05,128,64,32,4,3,8,0.0,0.0,267.2699987888336,295.1416116952896,0.023539701532197758,7,-1,-1,llm8_g7,0,"path_reordered,ASCEND_HOME_PATH_set,ASCEND_TOOLKIT_HOME_set;timing=event"
2026-03-03T10:04:18.345333+00:00,BUCKET,llm_style,eval,llm_style_eval_000,32,1536,1024,fp16,Ascend910B2,c04,64,64,64,4,3,8,0.0,0.0,13.91,14.947400000000002,7.23675744069015,3,-1,-1,llm8_g3,0,"path_reordered,ASCEND_HOME_PATH_set,ASCEND_TOOLKIT_HOME_set;timing=npu_profiler_batch_offline_kernel_step"
2026-03-03T10:04:18.345363+00:00,BUCKET,llm_style,eval,llm_style_eval_001,32,2048,8192,fp16,Ascend910B2,c10,64,128,64,8,3,8,0.0,0.0,50.55,83.42622,21.241183461918894,2,-1,-1,llm8_g2,0,"path_reordered,ASCEND_HOME_PATH_set,ASCEND_TOOLKIT_HOME_set;timing=npu_profiler_batch_offline_kernel_step"
2026-03-03T10:04:18.345391+00:00,BUCKET,llm_style,eval,llm_style_eval_002,16,2048,4096,fp16,Ascend910B2,c05,128,64,32,4,3,8,0.0,0.0,102.083,135.69420000000002,2.6295804002625314,7,-1,-1,llm8_g7,0,"path_reordered,ASCEND_HOME_PATH_set,ASCEND_TOOLKIT_HOME_set;timing=npu_profiler_batch_offline_kernel_step"
2026-03-03T10:04:18.345414+00:00,BUCKET,llm_style,eval,llm_style_eval_003,16,2048,1536,fp16,Ascend910B2,c05,128,64,32,4,3,8,0.0,0.0,49.72,66.58380000000001,2.0246037007240547,7,-1,-1,llm8_g7,0,"path_reordered,ASCEND_HOME_PATH_set,ASCEND_TOOLKIT_HOME_set;timing=npu_profiler_batch_offline_kernel_step"
2026-03-03T10:04:18.345434+00:00,BUCKET,llm_style,eval,llm_style_eval_004,64,8192,2048,fp16,Ascend910B2,c08,128,128,64,8,4,8,0.0,0.0,51.682,68.25962000000001,41.55186811655895,1,-1,-1,llm8_g1,0,"path_reordered,ASCEND_HOME_PATH_set,ASCEND_TOOLKIT_HOME_set;timing=npu_profiler_batch_offline_kernel_step"
2026-03-03T10:04:18.345455+00:00,BUCKET,llm_style,eval,llm_style_eval_005,64,3072,8192,fp16,Ascend910B2,c10,64,128,64,8,3,8,0.0,0.0,63.772,91.70660000000001,50.511595559179575,2,-1,-1,llm8_g2,0,"path_reordered,ASCEND_HOME_PATH_set,ASCEND_TOOLKIT_HOME_set;timing=npu_profiler_batch_offline_kernel_step"
2026-03-03T10:04:18.345476+00:00,BUCKET,llm_style,eval,llm_style_eval_006,32,2048,2048,fp16,Ascend910B2,c04,64,64,64,4,3,8,0.0,0.0,33.001000000000005,45.3114,8.134161267840367,3,-1,-1,llm8_g3,0,"path_reordered,ASCEND_HOME_PATH_set,ASCEND_TOOLKIT_HOME_set;timing=npu_profiler_batch_offline_kernel_step"
2026-03-03T10:04:18.345499+00:00,BUCKET,llm_style,eval,llm_style_eval_007,8,8192,2048,fp16,Ascend910B2,c07,128,128,32,8,3,8,0.0,0.0,80.081,113.70860000000002,3.3520492501342387,5,-1,-1,llm8_g5,0,"path_reordered,ASCEND_HOME_PATH_set,ASCEND_TOOLKIT_HOME_set;timing=npu_profiler_batch_offline_kernel_step"
2026-03-03T10:04:18.345519+00:00,BUCKET,llm_style,eval,llm_style_eval_008,64,1536,8192,fp16,Ascend910B2,c10,64,128,64,8,3,8,0.0,0.0,52.211,83.374,30.84814954703032,2,-1,-1,llm8_g2,0,"path_reordered,ASCEND_HOME_PATH_set,ASCEND_TOOLKIT_HOME_set;timing=npu_profiler_batch_offline_kernel_step"
2026-03-03T10:04:18.345538+00:00,BUCKET,llm_style,eval,llm_style_eval_009,64,4096,6144,fp16,Ascend910B2,c04,64,64,64,4,3,8,0.0,0.0,125.582,199.71302,25.65037562708031,3,-1,-1,llm8_g3,0,"path_reordered,ASCEND_HOME_PATH_set,ASCEND_TOOLKIT_HOME_set;timing=npu_profiler_batch_offline_kernel_step"
2026-03-03T10:04:18.345560+00:00,BUCKET,llm_style,eval,llm_style_eval_010,64,2048,4096,fp16,Ascend910B2,c04,64,64,64,4,3,8,0.0,0.0,61.762,89.45100000000001,17.385153071467894,3,-1,-1,llm8_g3,0,"path_reordered,ASCEND_HOME_PATH_set,ASCEND_TOOLKIT_HOME_set;timing=npu_profiler_batch_offline_kernel_step"
2026-03-03T10:04:18.345579+00:00,BUCKET,llm_style,eval,llm_style_eval_011,32,3072,6144,fp16,Ascend910B2,c04,64,64,64,4,3,8,0.0,0.0,80.57,125.52402000000001,14.992671614744943,3,-1,-1,llm8_g3,0,"path_reordered,ASCEND_HOME_PATH_set,ASCEND_TOOLKIT_HOME_set;timing=npu_profiler_batch_offline_kernel_step"
2026-03-03T10:04:18.345598+00:00,BUCKET,llm_style,eval,llm_style_eval_012,16,1536,1536,fp16,Ascend910B2,c05,128,64,32,4,3,8,0.0,0.0,35.66,44.596019999999996,2.117147279865396,7,-1,-1,llm8_g7,0,"path_reordered,ASCEND_HOME_PATH_set,ASCEND_TOOLKIT_HOME_set;timing=npu_profiler_batch_offline_kernel_step"
2026-03-03T10:04:18.345618+00:00,BUCKET,llm_style,eval,llm_style_eval_013,64,2048,3072,fp16,Ascend910B2,c04,64,64,64,4,3,8,0.0,0.0,49.691,71.8772,16.20628218389648,3,-1,-1,llm8_g3,0,"path_reordered,ASCEND_HOME_PATH_set,ASCEND_TOOLKIT_HOME_set;timing=npu_profiler_batch_offline_kernel_step"
2026-03-03T10:04:18.345637+00:00,BUCKET,llm_style,eval,llm_style_eval_014,16,8192,6144,fp16,Ascend910B2,c07,128,128,32,8,3,8,0.0,0.0,198.774,304.34782,8.102733435962449,5,-1,-1,llm8_g5,0,"path_reordered,ASCEND_HOME_PATH_set,ASCEND_TOOLKIT_HOME_set;timing=npu_profiler_batch_offline_kernel_step"
2026-03-03T10:04:18.345656+00:00,BUCKET,llm_style,eval,llm_style_eval_015,64,6144,1536,fp16,Ascend910B2,c08,128,128,64,8,4,8,0.0,0.0,31.971000000000004,43.19662,37.78297682274561,1,-1,-1,llm8_g1,0,"path_reordered,ASCEND_HOME_PATH_set,ASCEND_TOOLKIT_HOME_set;timing=npu_profiler_batch_offline_kernel_step"
2026-03-03T10:04:18.345676+00:00,BUCKET,llm_style,eval,llm_style_eval_016,16,4096,4096,fp16,Ascend910B2,c05,128,64,32,4,3,8,0.0,0.0,138.53300000000002,229.26362,3.8754008936498883,7,-1,-1,llm8_g7,0,"path_reordered,ASCEND_HOME_PATH_set,ASCEND_TOOLKIT_HOME_set;timing=npu_profiler_batch_offline_kernel_step"
2026-03-03T10:04:18.345695+00:00,BUCKET,llm_style,eval,llm_style_eval_017,64,8192,4096,fp16,Ascend910B2,c08,128,128,64,8,4,8,0.0,0.0,85.362,132.16182,50.314745390220466,1,-1,-1,llm8_g1,0,"path_reordered,ASCEND_HOME_PATH_set,ASCEND_TOOLKIT_HOME_set;timing=npu_profiler_batch_offline_kernel_step"
2026-03-03T10:04:18.345714+00:00,BUCKET,llm_style,eval,llm_style_eval_018,32,4096,6144,fp16,Ascend910B2,c04,64,64,64,4,3,8,0.0,0.0,107.74199999999999,174.5172,14.948791891741385,3,-1,-1,llm8_g3,0,"path_reordered,ASCEND_HOME_PATH_set,ASCEND_TOOLKIT_HOME_set;timing=npu_profiler_batch_offline_kernel_step"
2026-03-03T10:04:18.345733+00:00,BUCKET,llm_style,eval,llm_style_eval_019,16,3072,8192,fp16,Ascend910B2,c10,64,128,64,8,3,8,0.0,0.0,52.931,84.68737999999999,15.214267026884057,6,-1,-1,llm8_g6,0,"path_reordered,ASCEND_HOME_PATH_set,ASCEND_TOOLKIT_HOME_set;timing=npu_profiler_batch_offline_kernel_step"
2026-03-03T10:04:18.345754+00:00,BUCKET,llm_style,eval,llm_style_eval_020,4,1536,1536,fp16,Ascend910B2,c05,128,64,32,4,3,8,0.0,0.0,33.840999999999994,41.8908,0.5577367099080998,7,-1,-1,llm8_g7,0,"path_reordered,ASCEND_HOME_PATH_set,ASCEND_TOOLKIT_HOME_set;timing=npu_profiler_batch_offline_kernel_step"
2026-03-03T10:04:18.345773+00:00,BUCKET,llm_style,eval,llm_style_eval_021,4,6144,1536,fp16,Ascend910B2,c07,128,128,32,8,3,8,0.0,0.0,50.322,65.6246,1.5002875879337068,5,-1,-1,llm8_g5,0,"path_reordered,ASCEND_HOME_PATH_set,ASCEND_TOOLKIT_HOME_set;timing=npu_profiler_batch_offline_kernel_step"
2026-03-03T10:04:18.345791+00:00,BUCKET,llm_style,eval,llm_style_eval_022,32,6144,1024,fp16,Ascend910B2,c08,128,128,64,8,4,8,0.0,0.0,21.55,28.64698,18.68460250580046,1,-1,-1,llm8_g1,0,"path_reordered,ASCEND_HOME_PATH_set,ASCEND_TOOLKIT_HOME_set;timing=npu_profiler_batch_offline_kernel_step"
2026-03-03T10:04:18.345810+00:00,BUCKET,llm_style,eval,llm_style_eval_023,16,1024,1536,fp16,Ascend910B2,c05,128,64,32,4,3,8,0.0,0.0,25.72,32.83898,1.9569069984447902,7,-1,-1,llm8_g7,0,"path_reordered,ASCEND_HOME_PATH_set,ASCEND_TOOLKIT_HOME_set;timing=npu_profiler_batch_offline_kernel_step"
2026-03-03T10:04:18.345828+00:00,BUCKET,llm_style,eval,llm_style_eval_024,32,8192,1024,fp16,Ascend910B2,c08,128,128,64,8,4,8,0.0,0.0,25.991999999999997,36.031800000000004,20.655236688211758,1,-1,-1,llm8_g1,0,"path_reordered,ASCEND_HOME_PATH_set,ASCEND_TOOLKIT_HOME_set;timing=npu_profiler_batch_offline_kernel_step"
2026-03-03T10:04:18.345846+00:00,BUCKET,llm_style,eval,llm_style_eval_025,32,6144,6144,fp16,Ascend910B2,c08,128,128,64,8,4,8,0.0,0.0,81.792,134.16242,29.537352112676054,1,-1,-1,llm8_g1,0,"path_reordered,ASCEND_HOME_PATH_set,ASCEND_TOOLKIT_HOME_set;timing=npu_profiler_batch_offline_kernel_step"
2026-03-03T10:04:18.345864+00:00,BUCKET,llm_style,eval,llm_style_eval_026,1,6144,2048,fp16,Ascend910B2,c07,128,128,32,8,3,8,0.0,0.0,59.681,85.05544,0.4216722910138905,5,-1,-1,llm8_g5,0,"path_reordered,ASCEND_HOME_PATH_set,ASCEND_TOOLKIT_HOME_set;timing=npu_profiler_batch_offline_kernel_step"
2026-03-03T10:04:18.345883+00:00,BUCKET,llm_style,eval,llm_style_eval_027,32,4096,3072,fp16,Ascend910B2,c04,64,64,64,4,3,8,0.0,0.0,58.082,96.041,13.864990324024655,3,-1,-1,llm8_g3,0,"path_reordered,ASCEND_HOME_PATH_set,ASCEND_TOOLKIT_HOME_set;timing=npu_profiler_batch_offline_kernel_step"
2026-03-03T10:04:18.345901+00:00,BUCKET,llm_style,eval,llm_style_eval_028,64,1536,1536,fp16,Ascend910B2,c04,64,64,64,4,3,8,0.0,0.0,17.991,23.334180000000003,16.785608804402198,3,-1,-1,llm8_g3,0,"path_reordered,ASCEND_HOME_PATH_set,ASCEND_TOOLKIT_HOME_set;timing=npu_profiler_batch_offline_kernel_step"
2026-03-03T10:04:18.345920+00:00,BUCKET,llm_style,eval,llm_style_eval_029,2,3072,1024,fp16,Ascend910B2,c05,128,64,32,4,3,8,0.0,0.0,38.162000000000006,49.96278,0.32972359939206536,7,-1,-1,llm8_g7,0,"path_reordered,ASCEND_HOME_PATH_set,ASCEND_TOOLKIT_HOME_set;timing=npu_profiler_batch_offline_kernel_step"
2026-03-03T10:04:18.345939+00:00,BUCKET,llm_style,eval,llm_style_eval_030,32,1536,8192,fp16,Ascend910B2,c10,64,128,64,8,3,8,0.0,0.0,48.521,79.0446,16.597068650687334,2,-1,-1,llm8_g2,0,"path_reordered,ASCEND_HOME_PATH_set,ASCEND_TOOLKIT_HOME_set;timing=npu_profiler_batch_offline_kernel_step"
2026-03-03T10:04:18.345958+00:00,BUCKET,llm_style,eval,llm_style_eval_031,8,3072,2048,fp16,Ascend910B2,c05,128,64,32,4,3,8,0.0,0.0,63.992999999999995,92.85062,1.5730360508180583,7,-1,-1,llm8_g7,0,"path_reordered,ASCEND_HOME_PATH_set,ASCEND_TOOLKIT_HOME_set;timing=npu_profiler_batch_offline_kernel_step"
2026-03-03T10:04:18.345976+00:00,BUCKET,llm_style,eval,llm_style_eval_032,8,2048,3072,fp16,Ascend910B2,c05,128,64,32,4,3,8,0.0,0.0,79.893,108.55438000000001,1.2599764184596898,7,-1,-1,llm8_g7,0,"path_reordered,ASCEND_HOME_PATH_set,ASCEND_TOOLKIT_HOME_set;timing=npu_profiler_batch_offline_kernel_step"
2026-03-03T10:04:18.345995+00:00,BUCKET,llm_style,eval,llm_style_eval_033,64,1536,8192,fp16,Ascend910B2,c10,64,128,64,8,3,8,0.0,0.0,51.760999999999996,82.98700000000001,31.116337319603566,2,-1,-1,llm8_g2,0,"path_reordered,ASCEND_HOME_PATH_set,ASCEND_TOOLKIT_HOME_set;timing=npu_profiler_batch_offline_kernel_step"
2026-03-03T10:04:18.346013+00:00,BUCKET,llm_style,eval,llm_style_eval_034,64,6144,2048,fp16,Ascend910B2,c08,128,128,64,8,4,8,0.0,0.0,40.241,50.095819999999996,40.024172759126266,1,-1,-1,llm8_g1,0,"path_reordered,ASCEND_HOME_PATH_set,ASCEND_TOOLKIT_HOME_set;timing=npu_profiler_batch_offline_kernel_step"
2026-03-03T10:04:18.346032+00:00,BUCKET,llm_style,eval,llm_style_eval_035,4,4096,2048,fp16,Ascend910B2,c05,128,64,32,4,3,8,0.0,0.0,82.561,108.748,0.8128397669601869,7,-1,-1,llm8_g7,0,"path_reordered,ASCEND_HOME_PATH_set,ASCEND_TOOLKIT_HOME_set;timing=npu_profiler_batch_offline_kernel_step"
2026-03-03T10:04:18.346057+00:00,BUCKET,llm_style,eval,llm_style_eval_036,64,8192,4096,fp16,Ascend910B2,c08,128,128,64,8,4,8,0.0,0.0,87.964,143.50718,48.82642099040516,1,-1,-1,llm8_g1,0,"path_reordered,ASCEND_HOME_PATH_set,ASCEND_TOOLKIT_HOME_set;timing=npu_profiler_batch_offline_kernel_step"
2026-03-03T10:04:18.346082+00:00,BUCKET,llm_style,eval,llm_style_eval_037,32,6144,1024,fp16,Ascend910B2,c08,128,128,64,8,4,8,0.0,0.0,21.93,29.520220000000002,18.36083830369357,1,-1,-1,llm8_g1,0,"path_reordered,ASCEND_HOME_PATH_set,ASCEND_TOOLKIT_HOME_set;timing=npu_profiler_batch_offline_kernel_step"
2026-03-03T10:04:18.346102+00:00,BUCKET,llm_style,eval,llm_style_eval_038,64,6144,2048,fp16,Ascend910B2,c08,128,128,64,8,4,8,0.0,0.0,39.78,40.8484,40.488002413273,1,-1,-1,llm8_g1,0,"path_reordered,ASCEND_HOME_PATH_set,ASCEND_TOOLKIT_HOME_set;timing=npu_profiler_batch_offline_kernel_step"
2026-03-03T10:04:18.346122+00:00,BUCKET,llm_style,eval,llm_style_eval_039,8,1024,3072,fp16,Ascend910B2,c05,128,64,32,4,3,8,0.0,0.0,41.96,61.784620000000004,1.1995149666348903,7,-1,-1,llm8_g7,0,"path_reordered,ASCEND_HOME_PATH_set,ASCEND_TOOLKIT_HOME_set;timing=npu_profiler_batch_offline_kernel_step"
2026-03-03T10:04:18.346140+00:00,BUCKET,llm_style,eval,llm_style_eval_040,32,8192,2048,fp16,Ascend910B2,c08,128,128,64,8,4,8,0.0,0.0,45.851,66.13740000000001,23.41806774116159,1,-1,-1,llm8_g1,0,"path_reordered,ASCEND_HOME_PATH_set,ASCEND_TOOLKIT_HOME_set;timing=npu_profiler_batch_offline_kernel_step"
2026-03-03T10:04:18.346160+00:00,BUCKET,llm_style,eval,llm_style_eval_041,32,3072,1024,fp16,Ascend910B2,c04,64,64,64,4,3,8,0.0,0.0,21.47,29.118000000000002,9.377111877037727,3,-1,-1,llm8_g3,0,"path_reordered,ASCEND_HOME_PATH_set,ASCEND_TOOLKIT_HOME_set;timing=npu_profiler_batch_offline_kernel_step"
2026-03-03T10:04:18.346180+00:00,BUCKET,llm_style,eval,llm_style_eval_042,64,1024,4096,fp16,Ascend910B2,c04,64,64,64,4,3,8,0.0,0.0,28.79,42.84242,18.64782605071205,3,-1,-1,llm8_g3,0,"path_reordered,ASCEND_HOME_PATH_set,ASCEND_TOOLKIT_HOME_set;timing=npu_profiler_batch_offline_kernel_step"
2026-03-03T10:04:18.346200+00:00,BUCKET,llm_style,eval,llm_style_eval_043,2,1536,1024,fp16,Ascend910B2,c05,128,64,32,4,3,8,0.0,0.0,22.53,27.29042,0.27924793608521964,7,-1,-1,llm8_g7,0,"path_reordered,ASCEND_HOME_PATH_set,ASCEND_TOOLKIT_HOME_set;timing=npu_profiler_batch_offline_kernel_step"
2026-03-03T10:04:18.346220+00:00,BUCKET,llm_style,eval,llm_style_eval_044,64,6144,3072,fp16,Ascend910B2,c08,128,128,64,8,4,8,0.0,0.0,52.061,73.27879999999999,46.405545494708136,1,-1,-1,llm8_g1,0,"path_reordered,ASCEND_HOME_PATH_set,ASCEND_TOOLKIT_HOME_set;timing=npu_profiler_batch_offline_kernel_step"
2026-03-03T10:04:18.346240+00:00,BUCKET,llm_style,eval,llm_style_eval_045,64,1536,6144,fp16,Ascend910B2,c04,64,64,64,4,3,8,0.0,0.0,52.62,84.18258,22.956281870011406,3,-1,-1,llm8_g3,0,"path_reordered,ASCEND_HOME_PATH_set,ASCEND_TOOLKIT_HOME_set;timing=npu_profiler_batch_offline_kernel_step"
2026-03-03T10:04:18.346258+00:00,BUCKET,llm_style,eval,llm_style_eval_046,2,6144,3072,fp16,Ascend910B2,c07,128,128,32,8,3,8,0.0,0.0,78.191,111.701,0.9655519433182848,5,-1,-1,llm8_g5,0,"path_reordered,ASCEND_HOME_PATH_set,ASCEND_TOOLKIT_HOME_set;timing=npu_profiler_batch_offline_kernel_step"
2026-03-03T10:04:18.346281+00:00,BUCKET,llm_style,eval,llm_style_eval_047,16,4096,8192,fp16,Ascend910B2,c10,64,128,64,8,3,8,0.0,0.0,94.394,152.686,11.375106722884928,6,-1,-1,llm8_g6,0,"path_reordered,ASCEND_HOME_PATH_set,ASCEND_TOOLKIT_HOME_set;timing=npu_profiler_batch_offline_kernel_step"
2026-03-03T10:04:18.346301+00:00,BUCKET,llm_style,eval,llm_style_eval_048,16,1024,6144,fp16,Ascend910B2,c05,128,64,32,4,3,8,0.0,0.0,73.871,115.23402,2.725380622977894,7,-1,-1,llm8_g7,0,"path_reordered,ASCEND_HOME_PATH_set,ASCEND_TOOLKIT_HOME_set;timing=npu_profiler_batch_offline_kernel_step"
2026-03-03T10:04:18.346320+00:00,BUCKET,llm_style,eval,llm_style_eval_049,16,8192,1536,fp16,Ascend910B2,c07,128,128,32,8,3,8,0.0,0.0,65.632,91.62178000000002,6.135013164310092,5,-1,-1,llm8_g5,0,"path_reordered,ASCEND_HOME_PATH_set,ASCEND_TOOLKIT_HOME_set;timing=npu_profiler_batch_offline_kernel_step"
2026-03-03T10:04:18.346340+00:00,BUCKET,llm_style,eval,llm_style_eval_050,1,1024,1024,fp16,Ascend910B2,c05,128,64,32,4,3,8,0.0,0.0,15.98,20.2438,0.13123604505632042,7,-1,-1,llm8_g7,0,"path_reordered,ASCEND_HOME_PATH_set,ASCEND_TOOLKIT_HOME_set;timing=npu_profiler_batch_offline_kernel_step"
2026-03-03T10:04:18.346360+00:00,BUCKET,llm_style,eval,llm_style_eval_051,16,6144,1024,fp16,Ascend910B2,c07,128,128,32,8,3,8,0.0,0.0,42.06,52.39822,4.786652211126962,5,-1,-1,llm8_g5,0,"path_reordered,ASCEND_HOME_PATH_set,ASCEND_TOOLKIT_HOME_set;timing=npu_profiler_batch_offline_kernel_step"
2026-03-03T10:04:18.346382+00:00,BUCKET,llm_style,eval,llm_style_eval_052,16,8192,8192,fp16,Ascend910B2,c10,64,128,64,8,3,8,0.0,0.0,134.632,229.16662000000002,15.950766890486658,4,-1,-1,llm8_g4,0,"path_reordered,ASCEND_HOME_PATH_set,ASCEND_TOOLKIT_HOME_set;timing=npu_profiler_batch_offline_kernel_step"
2026-03-03T10:04:18.346415+00:00,BUCKET,llm_style,eval,llm_style_eval_053,1,6144,8192,fp16,Ascend910B2,c10,64,128,64,8,3,8,0.0,0.0,88.39,150.10782,1.1388538974997173,4,-1,-1,llm8_g4,0,"path_reordered,ASCEND_HOME_PATH_set,ASCEND_TOOLKIT_HOME_set;timing=npu_profiler_batch_offline_kernel_step"
2026-03-03T10:04:18.346436+00:00,BUCKET,llm_style,eval,llm_style_eval_054,64,4096,3072,fp16,Ascend910B2,c04,64,64,64,4,3,8,0.0,0.0,67.351,107.37460000000002,23.913716737687636,3,-1,-1,llm8_g3,0,"path_reordered,ASCEND_HOME_PATH_set,ASCEND_TOOLKIT_HOME_set;timing=npu_profiler_batch_offline_kernel_step"
2026-03-03T10:04:18.346455+00:00,BUCKET,llm_style,eval,llm_style_eval_055,4,8192,1024,fp16,Ascend910B2,c07,128,128,32,8,3,8,0.0,0.0,44.452,60.013000000000005,1.5096927922253218,5,-1,-1,llm8_g5,0,"path_reordered,ASCEND_HOME_PATH_set,ASCEND_TOOLKIT_HOME_set;timing=npu_profiler_batch_offline_kernel_step"
2026-03-03T10:04:18.346474+00:00,BUCKET,llm_style,eval,llm_style_eval_056,64,1024,3072,fp16,Ascend910B2,c04,64,64,64,4,3,8,0.0,0.0,23.341,35.4712,17.250896876740498,3,-1,-1,llm8_g3,0,"path_reordered,ASCEND_HOME_PATH_set,ASCEND_TOOLKIT_HOME_set;timing=npu_profiler_batch_offline_kernel_step"
2026-03-03T10:04:18.346492+00:00,BUCKET,llm_style,eval,llm_style_eval_057,64,1024,3072,fp16,Ascend910B2,c04,64,64,64,4,3,8,0.0,0.0,23.77,24.15462,16.939553386621792,3,-1,-1,llm8_g3,0,"path_reordered,ASCEND_HOME_PATH_set,ASCEND_TOOLKIT_HOME_set;timing=npu_profiler_batch_offline_kernel_step"
2026-03-03T10:04:18.346511+00:00,BUCKET,llm_style,eval,llm_style_eval_058,32,2048,4096,fp16,Ascend910B2,c04,64,64,64,4,3,8,0.0,0.0,52.741,83.42302000000001,10.179384387857645,3,-1,-1,llm8_g3,0,"path_reordered,ASCEND_HOME_PATH_set,ASCEND_TOOLKIT_HOME_set;timing=npu_profiler_batch_offline_kernel_step"
2026-03-03T10:04:18.346529+00:00,BUCKET,llm_style,eval,llm_style_eval_059,64,8192,2048,fp16,Ascend910B2,c08,128,128,64,8,4,8,0.0,0.0,49.94,66.999,43.001274489387264,1,-1,-1,llm8_g1,0,"path_reordered,ASCEND_HOME_PATH_set,ASCEND_TOOLKIT_HOME_set;timing=npu_profiler_batch_offline_kernel_step"
2026-03-03T10:04:18.346548+00:00,BUCKET,llm_style,eval,llm_style_eval_060,1,3072,6144,fp16,Ascend910B2,c05,128,64,32,4,3,8,0.0,0.0,132.583,206.81524000000002,0.2847177692464343,7,-1,-1,llm8_g7,0,"path_reordered,ASCEND_HOME_PATH_set,ASCEND_TOOLKIT_HOME_set;timing=npu_profiler_batch_offline_kernel_step"
2026-03-03T10:04:18.346566+00:00,BUCKET,llm_style,eval,llm_style_eval_061,64,1536,4096,fp16,Ascend910B2,c04,64,64,64,4,3,8,0.0,0.0,39.141000000000005,57.360400000000006,20.574496512608263,3,-1,-1,llm8_g3,0,"path_reordered,ASCEND_HOME_PATH_set,ASCEND_TOOLKIT_HOME_set;timing=npu_profiler_batch_offline_kernel_step"
2026-03-03T10:04:18.346584+00:00,BUCKET,llm_style,eval,llm_style_eval_062,16,6144,2048,fp16,Ascend910B2,c07,128,128,32,8,3,8,0.0,0.0,70.72,89.24176,5.693625339366515,5,-1,-1,llm8_g5,0,"path_reordered,ASCEND_HOME_PATH_set,ASCEND_TOOLKIT_HOME_set;timing=npu_profiler_batch_offline_kernel_step"
2026-03-03T10:04:18.346602+00:00,BUCKET,llm_style,eval,llm_style_eval_063,64,1536,6144,fp16,Ascend910B2,c04,64,64,64,4,3,8,0.0,0.0,51.92,84.00338,23.265784899845915,3,-1,-1,llm8_g3,0,"path_reordered,ASCEND_HOME_PATH_set,ASCEND_TOOLKIT_HOME_set;timing=npu_profiler_batch_offline_kernel_step"
2026-03-03T10:04:18.346621+00:00,BUCKET,llm_style,eval,llm_style_eval_064,1,6144,2048,fp16,Ascend910B2,c07,128,128,32,8,3,8,0.0,0.0,59.531,83.8408,0.4227347768389579,5,-1,-1,llm8_g5,0,"path_reordered,ASCEND_HOME_PATH_set,ASCEND_TOOLKIT_HOME_set;timing=npu_profiler_batch_offline_kernel_step"
2026-03-03T10:04:18.346643+00:00,BUCKET,llm_style,eval,llm_style_eval_065,8,1536,6144,fp16,Ascend910B2,c05,128,64,32,4,3,8,0.0,0.0,82.12299999999999,113.40822000000001,1.8386437904119433,7,-1,-1,llm8_g7,0,"path_reordered,ASCEND_HOME_PATH_set,ASCEND_TOOLKIT_HOME_set;timing=npu_profiler_batch_offline_kernel_step"
2026-03-03T10:04:18.346661+00:00,BUCKET,llm_style,eval,llm_style_eval_066,64,1536,4096,fp16,Ascend910B2,c04,64,64,64,4,3,8,0.0,0.0,37.461,39.58622,21.497193561303757,3,-1,-1,llm8_g3,0,"path_reordered,ASCEND_HOME_PATH_set,ASCEND_TOOLKIT_HOME_set;timing=npu_profiler_batch_offline_kernel_step"
2026-03-03T10:04:18.346680+00:00,BUCKET,llm_style,eval,llm_style_eval_067,64,8192,2048,fp16,Ascend910B2,c08,128,128,64,8,4,8,0.0,0.0,49.69,56.12078,43.21762221775005,1,-1,-1,llm8_g1,0,"path_reordered,ASCEND_HOME_PATH_set,ASCEND_TOOLKIT_HOME_set;timing=npu_profiler_batch_offline_kernel_step"
2026-03-03T10:04:18.346701+00:00,BUCKET,llm_style,eval,llm_style_eval_068,64,1024,4096,fp16,Ascend910B2,c04,64,64,64,4,3,8,0.0,0.0,29.0,43.29842,18.512790068965515,3,-1,-1,llm8_g3,0,"path_reordered,ASCEND_HOME_PATH_set,ASCEND_TOOLKIT_HOME_set;timing=npu_profiler_batch_offline_kernel_step"
2026-03-03T10:04:18.346720+00:00,BUCKET,llm_style,eval,llm_style_eval_069,64,2048,4096,fp16,Ascend910B2,c04,64,64,64,4,3,8,0.0,0.0,61.101,93.30279999999999,17.57322832686863,3,-1,-1,llm8_g3,0,"path_reordered,ASCEND_HOME_PATH_set,ASCEND_TOOLKIT_HOME_set;timing=npu_profiler_batch_offline_kernel_step"
2026-03-03T10:04:18.346739+00:00,BUCKET,llm_style,eval,llm_style_eval_070,64,8192,1024,fp16,Ascend910B2,c08,128,128,64,8,4,8,0.0,0.0,30.570999999999998,37.677580000000006,35.122888489090975,1,-1,-1,llm8_g1,0,"path_reordered,ASCEND_HOME_PATH_set,ASCEND_TOOLKIT_HOME_set;timing=npu_profiler_batch_offline_kernel_step"
2026-03-03T10:04:18.346757+00:00,BUCKET,llm_style,eval,llm_style_eval_071,64,6144,2048,fp16,Ascend910B2,c08,128,128,64,8,4,8,0.0,0.0,40.591,49.9532,39.679060284299474,1,-1,-1,llm8_g1,0,"path_reordered,ASCEND_HOME_PATH_set,ASCEND_TOOLKIT_HOME_set;timing=npu_profiler_batch_offline_kernel_step"
2026-03-03T10:04:18.346776+00:00,BUCKET,llm_style,eval,llm_style_eval_072,64,1536,1024,fp16,Ascend910B2,c04,64,64,64,4,3,8,0.0,0.0,15.32,16.124,13.141422454308096,3,-1,-1,llm8_g3,0,"path_reordered,ASCEND_HOME_PATH_set,ASCEND_TOOLKIT_HOME_set;timing=npu_profiler_batch_offline_kernel_step"
2026-03-03T10:04:18.346794+00:00,BUCKET,llm_style,eval,llm_style_eval_073,1,4096,1536,fp16,Ascend910B2,c05,128,64,32,4,3,8,0.0,0.0,56.622,89.2376,0.22222655504927413,7,-1,-1,llm8_g7,0,"path_reordered,ASCEND_HOME_PATH_set,ASCEND_TOOLKIT_HOME_set;timing=npu_profiler_batch_offline_kernel_step"
2026-03-03T10:04:18.346812+00:00,BUCKET,llm_style,eval,llm_style_eval_074,8,1024,2048,fp16,Ascend910B2,c05,128,64,32,4,3,8,0.0,0.0,30.061,40.3748,1.1162114367452847,7,-1,-1,llm8_g7,0,"path_reordered,ASCEND_HOME_PATH_set,ASCEND_TOOLKIT_HOME_set;timing=npu_profiler_batch_offline_kernel_step"
2026-03-03T10:04:18.346831+00:00,BUCKET,llm_style,eval,llm_style_eval_075,2,6144,1024,fp16,Ascend910B2,c07,128,128,32,8,3,8,0.0,0.0,38.89,51.378980000000006,0.6471026999228593,5,-1,-1,llm8_g5,0,"path_reordered,ASCEND_HOME_PATH_set,ASCEND_TOOLKIT_HOME_set;timing=npu_profiler_batch_offline_kernel_step"
2026-03-03T10:04:18.346849+00:00,BUCKET,llm_style,eval,llm_style_eval_076,64,1024,6144,fp16,Ascend910B2,c04,64,64,64,4,3,8,0.0,0.0,41.641,64.5256,19.339265819744966,3,-1,-1,llm8_g3,0,"path_reordered,ASCEND_HOME_PATH_set,ASCEND_TOOLKIT_HOME_set;timing=npu_profiler_batch_offline_kernel_step"
2026-03-03T10:04:18.346870+00:00,BUCKET,llm_style,eval,llm_style_eval_077,1,4096,8192,fp16,Ascend910B2,c10,64,128,64,8,3,8,0.0,0.0,84.50200000000001,141.80682000000002,0.7941689427469171,6,-1,-1,llm8_g6,0,"path_reordered,ASCEND_HOME_PATH_set,ASCEND_TOOLKIT_HOME_set;timing=npu_profiler_batch_offline_kernel_step"
2026-03-03T10:04:18.346891+00:00,BUCKET,llm_style,eval,llm_style_eval_078,64,6144,3072,fp16,Ascend910B2,c08,128,128,64,8,4,8,0.0,0.0,50.760999999999996,76.20642000000001,47.594001379011445,1,-1,-1,llm8_g1,0,"path_reordered,ASCEND_HOME_PATH_set,ASCEND_TOOLKIT_HOME_set;timing=npu_profiler_batch_offline_kernel_step"
2026-03-03T10:04:18.346913+00:00,BUCKET,llm_style,eval,llm_style_eval_079,2,3072,4096,fp16,Ascend910B2,c05,128,64,32,4,3,8,0.0,0.0,96.162,145.534,0.5234047544768203,7,-1,-1,llm8_g7,0,"path_reordered,ASCEND_HOME_PATH_set,ASCEND_TOOLKIT_HOME_set;timing=npu_profiler_batch_offline_kernel_step"
2026-03-03T10:04:18.346934+00:00,BUCKET,llm_style,eval,llm_style_eval_080,4,1536,1024,fp16,Ascend910B2,c05,128,64,32,4,3,8,0.0,0.0,25.310000000000002,29.991600000000002,0.4971517977084156,7,-1,-1,llm8_g7,0,"path_reordered,ASCEND_HOME_PATH_set,ASCEND_TOOLKIT_HOME_set;timing=npu_profiler_batch_offline_kernel_step"
2026-03-03T10:04:18.346953+00:00,BUCKET,llm_style,eval,llm_style_eval_081,4,4096,6144,fp16,Ascend910B2,c05,128,64,32,4,3,8,0.0,0.0,187.344,300.51882,1.0746359210863439,7,-1,-1,llm8_g7,0,"path_reordered,ASCEND_HOME_PATH_set,ASCEND_TOOLKIT_HOME_set;timing=npu_profiler_batch_offline_kernel_step"
2026-03-03T10:04:18.346971+00:00,BUCKET,llm_style,eval,llm_style_eval_082,64,6144,1024,fp16,Ascend910B2,c08,128,128,64,8,4,8,0.0,0.0,25.07,28.38838,32.12231224571201,1,-1,-1,llm8_g1,0,"path_reordered,ASCEND_HOME_PATH_set,ASCEND_TOOLKIT_HOME_set;timing=npu_profiler_batch_offline_kernel_step"
2026-03-03T10:04:18.346990+00:00,BUCKET,llm_style,eval,llm_style_eval_083,8,4096,4096,fp16,Ascend910B2,c05,128,64,32,4,3,8,0.0,0.0,131.942,227.14204,2.034495884555335,7,-1,-1,llm8_g7,0,"path_reordered,ASCEND_HOME_PATH_set,ASCEND_TOOLKIT_HOME_set;timing=npu_profiler_batch_offline_kernel_step"
2026-03-03T10:04:18.347008+00:00,BUCKET,llm_style,eval,llm_style_eval_084,64,1024,8192,fp16,Ascend910B2,c10,64,128,64,8,3,8,0.0,0.0,48.891,76.31542,21.961952588410956,2,-1,-1,llm8_g2,0,"path_reordered,ASCEND_HOME_PATH_set,ASCEND_TOOLKIT_HOME_set;timing=npu_profiler_batch_offline_kernel_step"
2026-03-03T10:04:18.347029+00:00,BUCKET,llm_style,eval,llm_style_eval_085,1,3072,8192,fp16,Ascend910B2,c10,64,128,64,8,3,8,0.0,0.0,49.031,78.928,1.0265270543125777,6,-1,-1,llm8_g6,0,"path_reordered,ASCEND_HOME_PATH_set,ASCEND_TOOLKIT_HOME_set;timing=npu_profiler_batch_offline_kernel_step"
2026-03-03T10:04:18.347048+00:00,BUCKET,llm_style,eval,llm_style_eval_086,8,1536,1024,fp16,Ascend910B2,c05,128,64,32,4,3,8,0.0,0.0,26.27,30.9974,0.9579681766273316,7,-1,-1,llm8_g7,0,"path_reordered,ASCEND_HOME_PATH_set,ASCEND_TOOLKIT_HOME_set;timing=npu_profiler_batch_offline_kernel_step"
2026-03-03T10:04:18.347066+00:00,BUCKET,llm_style,eval,llm_style_eval_087,16,1024,3072,fp16,Ascend910B2,c05,128,64,32,4,3,8,0.0,0.0,43.379999999999995,63.439220000000006,2.3205001383125867,7,-1,-1,llm8_g7,0,"path_reordered,ASCEND_HOME_PATH_set,ASCEND_TOOLKIT_HOME_set;timing=npu_profiler_batch_offline_kernel_step"
2026-03-03T10:04:18.347084+00:00,BUCKET,llm_style,eval,llm_style_eval_088,8,4096,1536,fp16,Ascend910B2,c05,128,64,32,4,3,8,0.0,0.0,62.723,93.61102,1.6048865009645583,7,-1,-1,llm8_g7,0,"path_reordered,ASCEND_HOME_PATH_set,ASCEND_TOOLKIT_HOME_set;timing=npu_profiler_batch_offline_kernel_step"
2026-03-03T10:04:18.347103+00:00,BUCKET,llm_style,eval,llm_style_eval_089,16,6144,3072,fp16,Ascend910B2,c07,128,128,32,8,3,8,0.0,0.0,87.931,124.2884,6.868792303055805,5,-1,-1,llm8_g5,0,"path_reordered,ASCEND_HOME_PATH_set,ASCEND_TOOLKIT_HOME_set;timing=npu_profiler_batch_offline_kernel_step"
2026-03-03T10:04:18.347121+00:00,BUCKET,llm_style,eval,llm_style_eval_090,32,1536,3072,fp16,Ascend910B2,c04,64,64,64,4,3,8,0.0,0.0,26.481,43.707800000000006,11.404021298289338,3,-1,-1,llm8_g3,0,"path_reordered,ASCEND_HOME_PATH_set,ASCEND_TOOLKIT_HOME_set;timing=npu_profiler_batch_offline_kernel_step"
2026-03-03T10:04:18.347141+00:00,BUCKET,llm_style,eval,llm_style_eval_091,16,1024,4096,fp16,Ascend910B2,c05,128,64,32,4,3,8,0.0,0.0,53.381,75.65298000000001,2.5143352129034673,7,-1,-1,llm8_g7,0,"path_reordered,ASCEND_HOME_PATH_set,ASCEND_TOOLKIT_HOME_set;timing=npu_profiler_batch_offline_kernel_step"
2026-03-03T10:04:18.347160+00:00,BUCKET,llm_style,eval,llm_style_eval_092,1,4096,6144,fp16,Ascend910B2,c05,128,64,32,4,3,8,0.0,0.0,174.183,282.31022,0.28895844026110473,7,-1,-1,llm8_g7,0,"path_reordered,ASCEND_HOME_PATH_set,ASCEND_TOOLKIT_HOME_set;timing=npu_profiler_batch_offline_kernel_step"
2026-03-03T10:04:18.347178+00:00,BUCKET,llm_style,eval,llm_style_eval_093,32,2048,3072,fp16,Ascend910B2,c04,64,64,64,4,3,8,0.0,0.0,42.989999999999995,62.78022000000001,9.366205722260991,3,-1,-1,llm8_g3,0,"path_reordered,ASCEND_HOME_PATH_set,ASCEND_TOOLKIT_HOME_set;timing=npu_profiler_batch_offline_kernel_step"
2026-03-03T10:04:18.347196+00:00,BUCKET,llm_style,eval,llm_style_eval_094,32,1024,2048,fp16,Ascend910B2,c04,64,64,64,4,3,8,0.0,0.0,15.350000000000001,21.7036,8.743825928338762,3,-1,-1,llm8_g3,0,"path_reordered,ASCEND_HOME_PATH_set,ASCEND_TOOLKIT_HOME_set;timing=npu_profiler_batch_offline_kernel_step"
2026-03-03T10:04:18.347217+00:00,BUCKET,llm_style,eval,llm_style_eval_095,8,6144,2048,fp16,Ascend910B2,c07,128,128,32,8,3,8,0.0,0.0,64.201,91.8512,3.1358793788258756,5,-1,-1,llm8_g5,0,"path_reordered,ASCEND_HOME_PATH_set,ASCEND_TOOLKIT_HOME_set;timing=npu_profiler_batch_offline_kernel_step"
2026-03-03T10:04:18.347235+00:00,BUCKET,llm_style,eval,llm_style_eval_096,64,2048,3072,fp16,Ascend910B2,c04,64,64,64,4,3,8,0.0,0.0,49.611000000000004,73.3406,16.232415553002358,3,-1,-1,llm8_g3,0,"path_reordered,ASCEND_HOME_PATH_set,ASCEND_TOOLKIT_HOME_set;timing=npu_profiler_batch_offline_kernel_step"
2026-03-03T10:04:18.347254+00:00,BUCKET,llm_style,eval,llm_style_eval_097,64,6144,1024,fp16,Ascend910B2,c08,128,128,64,8,4,8,0.0,0.0,23.841,31.8598,33.77821265886498,1,-1,-1,llm8_g1,0,"path_reordered,ASCEND_HOME_PATH_set,ASCEND_TOOLKIT_HOME_set;timing=npu_profiler_batch_offline_kernel_step"
2026-03-03T10:04:18.347272+00:00,BUCKET,llm_style,eval,llm_style_eval_098,32,6144,1024,fp16,Ascend910B2,c08,128,128,64,8,4,8,0.0,0.0,20.841,28.155600000000003,19.320242982582407,1,-1,-1,llm8_g1,0,"path_reordered,ASCEND_HOME_PATH_set,ASCEND_TOOLKIT_HOME_set;timing=npu_profiler_batch_offline_kernel_step"
2026-03-03T10:04:18.347291+00:00,BUCKET,llm_style,eval,llm_style_eval_099,1,2048,2048,fp16,Ascend910B2,c05,128,64,32,4,3,8,0.0,0.0,55.461,70.33544,0.1512523755431745,7,-1,-1,llm8_g7,0,"path_reordered,ASCEND_HOME_PATH_set,ASCEND_TOOLKIT_HOME_set;timing=npu_profiler_batch_offline_kernel_step"
2026-03-03T10:04:18.347309+00:00,BUCKET,llm_style,eval,llm_style_eval_100,64,8192,1024,fp16,Ascend910B2,c08,128,128,64,8,4,8,0.0,0.0,30.491,41.99578,35.21504129087272,1,-1,-1,llm8_g1,0,"path_reordered,ASCEND_HOME_PATH_set,ASCEND_TOOLKIT_HOME_set;timing=npu_profiler_batch_offline_kernel_step"
2026-03-03T10:04:18.347329+00:00,BUCKET,llm_style,eval,llm_style_eval_101,64,8192,1536,fp16,Ascend910B2,c08,128,128,64,8,4,8,0.0,0.0,39.411,54.77082,40.867086244956994,1,-1,-1,llm8_g1,0,"path_reordered,ASCEND_HOME_PATH_set,ASCEND_TOOLKIT_HOME_set;timing=npu_profiler_batch_offline_kernel_step"
2026-03-03T10:04:18.347348+00:00,BUCKET,llm_style,eval,llm_style_eval_102,32,3072,2048,fp16,Ascend910B2,c04,64,64,64,4,3,8,0.0,0.0,34.741,53.010020000000004,11.590143749460292,3,-1,-1,llm8_g3,0,"path_reordered,ASCEND_HOME_PATH_set,ASCEND_TOOLKIT_HOME_set;timing=npu_profiler_batch_offline_kernel_step"
2026-03-03T10:04:18.347368+00:00,BUCKET,llm_style,eval,llm_style_eval_103,64,2048,3072,fp16,Ascend910B2,c04,64,64,64,4,3,8,0.0,0.0,49.251999999999995,50.976780000000005,16.35073434581337,3,-1,-1,llm8_g3,0,"path_reordered,ASCEND_HOME_PATH_set,ASCEND_TOOLKIT_HOME_set;timing=npu_profiler_batch_offline_kernel_step"
2026-03-03T10:04:18.347388+00:00,BUCKET,llm_style,eval,llm_style_eval_104,16,6144,2048,fp16,Ascend910B2,c07,128,128,32,8,3,8,0.0,0.0,70.411,95.7826,5.71861192143273,5,-1,-1,llm8_g5,0,"path_reordered,ASCEND_HOME_PATH_set,ASCEND_TOOLKIT_HOME_set;timing=npu_profiler_batch_offline_kernel_step"
2026-03-03T10:04:18.347407+00:00,BUCKET,llm_style,eval,llm_style_eval_105,1,1024,8192,fp16,Ascend910B2,c10,64,128,64,8,3,8,0.0,0.0,41.191,66.0972,0.407302954528902,6,-1,-1,llm8_g6,0,"path_reordered,ASCEND_HOME_PATH_set,ASCEND_TOOLKIT_HOME_set;timing=npu_profiler_batch_offline_kernel_step"
2026-03-03T10:04:18.347426+00:00,BUCKET,llm_style,eval,llm_style_eval_106,32,4096,8192,fp16,Ascend910B2,c10,64,128,64,8,3,8,0.0,0.0,99.102,158.0272,21.669427942927488,2,-1,-1,llm8_g2,0,"path_reordered,ASCEND_HOME_PATH_set,ASCEND_TOOLKIT_HOME_set;timing=npu_profiler_batch_offline_kernel_step"
2026-03-03T10:04:18.347445+00:00,BUCKET,llm_style,eval,llm_style_eval_107,64,6144,1536,fp16,Ascend910B2,c08,128,128,64,8,4,8,0.0,0.0,31.84,41.934619999999995,37.938428140703515,1,-1,-1,llm8_g1,0,"path_reordered,ASCEND_HOME_PATH_set,ASCEND_TOOLKIT_HOME_set;timing=npu_profiler_batch_offline_kernel_step"
2026-03-03T10:04:18.347463+00:00,BUCKET,llm_style,eval,llm_style_eval_108,8,3072,1536,fp16,Ascend910B2,c05,128,64,32,4,3,8,0.0,0.0,52.120999999999995,73.00242,1.448503904376355,7,-1,-1,llm8_g7,0,"path_reordered,ASCEND_HOME_PATH_set,ASCEND_TOOLKIT_HOME_set;timing=npu_profiler_batch_offline_kernel_step"
2026-03-03T10:04:18.347483+00:00,BUCKET,llm_style,eval,llm_style_eval_109,16,2048,1024,fp16,Ascend910B2,c05,128,64,32,4,3,8,0.0,0.0,37.281000000000006,46.07402,1.8000821866366243,7,-1,-1,llm8_g7,0,"path_reordered,ASCEND_HOME_PATH_set,ASCEND_TOOLKIT_HOME_set;timing=npu_profiler_batch_offline_kernel_step"
2026-03-03T10:04:18.347501+00:00,BUCKET,llm_style,eval,llm_style_eval_110,1,8192,8192,fp16,Ascend910B2,c10,64,128,64,8,3,8,0.0,0.0,123.72,215.53602,1.0848506951180086,4,-1,-1,llm8_g4,0,"path_reordered,ASCEND_HOME_PATH_set,ASCEND_TOOLKIT_HOME_set;timing=npu_profiler_batch_offline_kernel_step"
2026-03-03T10:04:18.347521+00:00,BUCKET,llm_style,eval,llm_style_eval_111,8,6144,1536,fp16,Ascend910B2,c07,128,128,32,8,3,8,0.0,0.0,52.441,69.62522,2.879329989893404,5,-1,-1,llm8_g5,0,"path_reordered,ASCEND_HOME_PATH_set,ASCEND_TOOLKIT_HOME_set;timing=npu_profiler_batch_offline_kernel_step"
2026-03-03T10:04:18.347542+00:00,BUCKET,llm_style,eval,llm_style_eval_112,2,6144,3072,fp16,Ascend910B2,c07,128,128,32,8,3,8,0.0,0.0,76.74100000000001,126.82404000000001,0.9837957806127101,5,-1,-1,llm8_g5,0,"path_reordered,ASCEND_HOME_PATH_set,ASCEND_TOOLKIT_HOME_set;timing=npu_profiler_batch_offline_kernel_step"
2026-03-03T10:04:18.347560+00:00,BUCKET,llm_style,eval,llm_style_eval_113,1,8192,8192,fp16,Ascend910B2,c10,64,128,64,8,3,8,0.0,0.0,124.99199999999999,132.962,1.0738105478750641,4,-1,-1,llm8_g4,0,"path_reordered,ASCEND_HOME_PATH_set,ASCEND_TOOLKIT_HOME_set;timing=npu_profiler_batch_offline_kernel_step"
2026-03-03T10:04:18.347581+00:00,BUCKET,llm_style,eval,llm_style_eval_114,1,3072,1024,fp16,Ascend910B2,c05,128,64,32,4,3,8,0.0,0.0,33.821,43.49362,0.18602217557139056,7,-1,-1,llm8_g7,0,"path_reordered,ASCEND_HOME_PATH_set,ASCEND_TOOLKIT_HOME_set;timing=npu_profiler_batch_offline_kernel_step"
2026-03-03T10:04:18.347601+00:00,BUCKET,llm_style,eval,llm_style_eval_115,16,3072,1536,fp16,Ascend910B2,c05,128,64,32,4,3,8,0.0,0.0,52.821,69.01379999999999,2.8586157778156416,7,-1,-1,llm8_g7,0,"path_reordered,ASCEND_HOME_PATH_set,ASCEND_TOOLKIT_HOME_set;timing=npu_profiler_batch_offline_kernel_step"
2026-03-03T10:04:18.347619+00:00,BUCKET,llm_style,eval,llm_style_eval_116,8,3072,1024,fp16,Ascend910B2,c05,128,64,32,4,3,8,0.0,0.0,40.8,47.35222,1.2336188235294119,7,-1,-1,llm8_g7,0,"path_reordered,ASCEND_HOME_PATH_set,ASCEND_TOOLKIT_HOME_set;timing=npu_profiler_batch_offline_kernel_step"
2026-03-03T10:04:18.347638+00:00,BUCKET,llm_style,eval,llm_style_eval_117,4,1024,4096,fp16,Ascend910B2,c05,128,64,32,4,3,8,0.0,0.0,49.730999999999995,76.28762,0.6747186262090045,7,-1,-1,llm8_g7,0,"path_reordered,ASCEND_HOME_PATH_set,ASCEND_TOOLKIT_HOME_set;timing=npu_profiler_batch_offline_kernel_step"
2026-03-03T10:04:18.347655+00:00,BUCKET,llm_style,eval,llm_style_eval_118,64,6144,3072,fp16,Ascend910B2,c08,128,128,64,8,4,8,0.0,0.0,51.032,80.8436,47.34125850446779,1,-1,-1,llm8_g1,0,"path_reordered,ASCEND_HOME_PATH_set,ASCEND_TOOLKIT_HOME_set;timing=npu_profiler_batch_offline_kernel_step"
2026-03-03T10:04:18.347674+00:00,BUCKET,llm_style,eval,llm_style_eval_119,64,8192,6144,fp16,Ascend910B2,c08,128,128,64,8,4,8,0.0,0.0,126.332,194.46942,50.99619212867682,1,-1,-1,llm8_g1,0,"path_reordered,ASCEND_HOME_PATH_set,ASCEND_TOOLKIT_HOME_set;timing=npu_profiler_batch_offline_kernel_step"
2026-03-03T10:04:18.347692+00:00,BUCKET,llm_style,eval,llm_style_eval_120,8,1024,4096,fp16,Ascend910B2,c05,128,64,32,4,3,8,0.0,0.0,52.172,78.938,1.2863003910143374,7,-1,-1,llm8_g7,0,"path_reordered,ASCEND_HOME_PATH_set,ASCEND_TOOLKIT_HOME_set;timing=npu_profiler_batch_offline_kernel_step"
2026-03-03T10:04:18.347710+00:00,BUCKET,llm_style,eval,llm_style_eval_121,4,1024,2048,fp16,Ascend910B2,c05,128,64,32,4,3,8,0.0,0.0,27.299999999999997,36.4266,0.6145500366300367,7,-1,-1,llm8_g7,0,"path_reordered,ASCEND_HOME_PATH_set,ASCEND_TOOLKIT_HOME_set;timing=npu_profiler_batch_offline_kernel_step"
2026-03-03T10:04:18.347729+00:00,BUCKET,llm_style,eval,llm_style_eval_122,4,6144,4096,fp16,Ascend910B2,c07,128,128,32,8,3,8,0.0,0.0,99.884,149.32458000000003,2.0156040206639703,5,-1,-1,llm8_g5,0,"path_reordered,ASCEND_HOME_PATH_set,ASCEND_TOOLKIT_HOME_set;timing=npu_profiler_batch_offline_kernel_step"
2026-03-03T10:04:18.347750+00:00,BUCKET,llm_style,eval,llm_style_eval_123,4,3072,8192,fp16,Ascend910B2,c10,64,128,64,8,3,8,0.0,0.0,51.301,84.30002,3.9244184713748265,6,-1,-1,llm8_g6,0,"path_reordered,ASCEND_HOME_PATH_set,ASCEND_TOOLKIT_HOME_set;timing=npu_profiler_batch_offline_kernel_step"
2026-03-03T10:04:18.347768+00:00,BUCKET,llm_style,eval,llm_style_eval_124,64,6144,1024,fp16,Ascend910B2,c08,128,128,64,8,4,8,0.0,0.0,24.421,32.6126,32.97597837926375,1,-1,-1,llm8_g1,0,"path_reordered,ASCEND_HOME_PATH_set,ASCEND_TOOLKIT_HOME_set;timing=npu_profiler_batch_offline_kernel_step"
2026-03-03T10:04:18.347786+00:00,BUCKET,llm_style,eval,llm_style_eval_125,64,1536,8192,fp16,Ascend910B2,c10,64,128,64,8,3,8,0.0,0.0,51.721000000000004,83.21142,31.140402080392874,2,-1,-1,llm8_g2,0,"path_reordered,ASCEND_HOME_PATH_set,ASCEND_TOOLKIT_HOME_set;timing=npu_profiler_batch_offline_kernel_step"
2026-03-03T10:04:18.347804+00:00,BUCKET,llm_style,eval,llm_style_eval_126,64,2048,8192,fp16,Ascend910B2,c10,64,128,64,8,3,8,0.0,0.0,55.16,86.43362,38.93190079767948,2,-1,-1,llm8_g2,0,"path_reordered,ASCEND_HOME_PATH_set,ASCEND_TOOLKIT_HOME_set;timing=npu_profiler_batch_offline_kernel_step"
2026-03-03T10:04:18.347824+00:00,BUCKET,llm_style,eval,llm_style_eval_127,2,8192,1536,fp16,Ascend910B2,c07,128,128,32,8,3,8,0.0,0.0,61.282,87.556,0.8213120981691198,5,-1,-1,llm8_g5,0,"path_reordered,ASCEND_HOME_PATH_set,ASCEND_TOOLKIT_HOME_set;timing=npu_profiler_batch_offline_kernel_step"
