results/ascend_profiler_eval_chunk_stress.csv
timestamp,method,workload,split,shape_id,M,N,K,dtype,gpu,config_id,BLOCK_M,BLOCK_N,BLOCK_K,num_warps,num_stages,GROUP_M,compile_time_ms,tune_time_ms,runtime_cost_us,p99_us,runtime_perf_tflops,bucket_m,bucket_n,bucket_k,cache_key,invalid_config,notes
2026-03-03T10:11:24.302859+00:00,FULL,llm_style,tune,llm_style_tune_000,1,3072,1536,fp16,Ascend910B2,c00,32,32,32,2,2,8,186.25527992844582,650.625,259.05999541282654,282.14059323072433,0.03642856545628097,7,-1,-1,1x3072x1536,0,"path_reordered,ASCEND_HOME_PATH_set,ASCEND_TOOLKIT_HOME_set;timing=event"
2026-03-03T10:11:24.614848+00:00,FULL,llm_style,tune,llm_style_tune_001,16,1024,8192,fp16,Ascend910B2,c02,32,64,32,2,2,8,0.0,311.9,290.4199957847595,330.4803994297981,0.9243008742378295,6,-1,-1,16x1024x8192,0,"path_reordered,ASCEND_HOME_PATH_set,ASCEND_TOOLKIT_HOME_set;timing=event"
2026-03-03T10:11:26.322182+00:00,FULL,llm_style,tune,llm_style_tune_002,16,8192,8192,fp16,Ascend910B2,c02,32,64,32,2,2,8,0.0,1707.235,636.0100209712982,812.4592000246046,3.3764934154974755,4,-1,-1,16x8192x8192,0,"path_reordered,ASCEND_HOME_PATH_set,ASCEND_TOOLKIT_HOME_set;timing=event"
2026-03-03T10:11:26.859190+00:00,FULL,llm_style,tune,llm_style_tune_003,64,6144,3072,fp16,Ascend910B2,c02,32,64,32,2,2,8,0.0,536.912,429.0600121021271,450.1365867257118,5.630725390053246,1,-1,-1,64x6144x3072,0,"path_reordered,ASCEND_HOME_PATH_set,ASCEND_TOOLKIT_HOME_set;timing=event"
2026-03-03T10:11:28.619908+00:00,FULL,llm_style,tune,llm_style_tune_004,64,8192,8192,fp16,Ascend910B2,c02,32,64,32,2,2,8,0.0,1760.612,1034.0700149536133,1048.4416115283966,8.306917779049353,0,-1,-1,64x8192x8192,0,"path_reordered,ASCEND_HOME_PATH_set,ASCEND_TOOLKIT_HOME_set;timing=event"
2026-03-03T10:11:29.125516+00:00,FULL,llm_style,tune,llm_style_tune_005,64,2048,8192,fp16,Ascend910B2,c02,32,64,32,2,2,8,0.0,505.507,422.92000353336334,476.5238094329834,5.077753783359621,2,-1,-1,64x2048x8192,0,"path_reordered,ASCEND_HOME_PATH_set,ASCEND_TOOLKIT_HOME_set;timing=event"
2026-03-03T10:11:29.237421+00:00,FULL,llm_style,tune,llm_style_tune_006,32,1024,1536,fp16,Ascend910B2,c02,32,64,32,2,2,8,0.0,111.81,261.62999868392944,305.22680163383484,0.3847544108334822,3,-1,-1,32x1024x1536,0,"path_reordered,ASCEND_HOME_PATH_set,ASCEND_TOOLKIT_HOME_set;timing=event"
2026-03-03T10:11:29.953859+00:00,FULL,llm_style,tune,llm_style_tune_007,16,6144,4096,fp16,Ascend910B2,c02,32,64,32,2,2,8,0.0,716.34,355.3700000047684,376.5313994884491,2.2661067844477425,5,-1,-1,16x6144x4096,0,"path_reordered,ASCEND_HOME_PATH_set,ASCEND_TOOLKIT_HOME_set;timing=event"
2026-03-03T10:11:30.070403+00:00,FULL,llm_style,eval,llm_style_eval_000,32,1536,1024,fp16,Ascend910B2,c02,32,64,32,2,2,8,0.0,116.417,28.22,29.4824,3.56709057406095,3,-1,-1,32x1536x1024,0,"path_reordered,ASCEND_HOME_PATH_set,ASCEND_TOOLKIT_HOME_set;timing=npu_profiler_batch_chunked(max_steps=2048);npu_profiler_batch_offline_kernel_step"
2026-03-03T10:11:30.575457+00:00,FULL,llm_style,eval,llm_style_eval_001,32,2048,8192,fp16,Ascend910B2,c02,32,64,32,2,2,8,0.0,504.951,194.214,248.79419999999982,5.528653052818026,2,-1,-1,32x2048x8192,0,"path_reordered,ASCEND_HOME_PATH_set,ASCEND_TOOLKIT_HOME_set;timing=npu_profiler_batch_chunked(max_steps=2048);npu_profiler_batch_offline_kernel_step"
2026-03-03T10:11:30.855929+00:00,FULL,llm_style,eval,llm_style_eval_002,16,2048,4096,fp16,Ascend910B2,c02,32,64,32,2,2,8,0.0,280.38,104.38300000000001,127.55361999999992,2.5716395964860177,7,-1,-1,16x2048x4096,0,"path_reordered,ASCEND_HOME_PATH_set,ASCEND_TOOLKIT_HOME_set;timing=npu_profiler_batch_chunked(max_steps=2048);npu_profiler_batch_offline_kernel_step"
2026-03-03T10:11:31.010650+00:00,FULL,llm_style,eval,llm_style_eval_003,16,2048,1536,fp16,Ascend910B2,c02,32,64,32,2,2,8,0.0,154.623,49.512,58.320199999999986,2.0331090644692194,7,-1,-1,16x2048x1536,0,"path_reordered,ASCEND_HOME_PATH_set,ASCEND_TOOLKIT_HOME_set;timing=npu_profiler_batch_chunked(max_steps=2048);npu_profiler_batch_offline_kernel_step"
2026-03-03T10:11:31.518878+00:00,FULL,llm_style,eval,llm_style_eval_004,64,8192,2048,fp16,Ascend910B2,c02,32,64,32,2,2,8,0.0,508.14,230.994,295.33821999999975,9.29670748157961,1,-1,-1,64x8192x2048,0,"path_reordered,ASCEND_HOME_PATH_set,ASCEND_TOOLKIT_HOME_set;timing=npu_profiler_batch_chunked(max_steps=2048);npu_profiler_batch_offline_kernel_step"
2026-03-03T10:11:32.243138+00:00,FULL,llm_style,eval,llm_style_eval_005,64,3072,8192,fp16,Ascend910B2,c02,32,64,32,2,2,8,0.0,724.16,333.446,442.3242399999996,9.660411197015408,2,-1,-1,64x3072x8192,0,"path_reordered,ASCEND_HOME_PATH_set,ASCEND_TOOLKIT_HOME_set;timing=npu_profiler_batch_chunked(max_steps=2048);npu_profiler_batch_offline_kernel_step"
2026-03-03T10:11:32.430126+00:00,FULL,llm_style,eval,llm_style_eval_006,32,2048,2048,fp16,Ascend910B2,c02,32,64,32,2,2,8,0.0,186.879,66.22999999999999,81.56821999999995,4.053079510795713,3,-1,-1,32x2048x2048,0,"path_reordered,ASCEND_HOME_PATH_set,ASCEND_TOOLKIT_HOME_set;timing=npu_profiler_batch_chunked(max_steps=2048);npu_profiler_batch_offline_kernel_step"
2026-03-03T10:11:32.919802+00:00,FULL,llm_style,eval,llm_style_eval_007,8,8192,2048,fp16,Ascend910B2,c02,32,64,32,2,2,8,0.0,489.579,128.911,168.36023999999986,2.0823316551729487,5,-1,-1,8x8192x2048,0,"path_reordered,ASCEND_HOME_PATH_set,ASCEND_TOOLKIT_HOME_set;timing=npu_profiler_batch_chunked(max_steps=2048);npu_profiler_batch_offline_kernel_step"
2026-03-03T10:11:33.325487+00:00,FULL,llm_style,eval,llm_style_eval_008,64,1536,8192,fp16,Ascend910B2,c02,32,64,32,2,2,8,0.0,405.592,172.44299999999998,230.38019999999977,9.339971677597816,2,-1,-1,64x1536x8192,0,"path_reordered,ASCEND_HOME_PATH_set,ASCEND_TOOLKIT_HOME_set;timing=npu_profiler_batch_chunked(max_steps=2048);npu_profiler_batch_offline_kernel_step"
2026-03-03T10:11:34.043802+00:00,FULL,llm_style,eval,llm_style_eval_009,64,4096,6144,fp16,Ascend910B2,c02,32,64,32,2,2,8,0.0,718.217,354.377,480.4850399999996,9.089826574523743,3,-1,-1,64x4096x6144,0,"path_reordered,ASCEND_HOME_PATH_set,ASCEND_TOOLKIT_HOME_set;timing=npu_profiler_batch_chunked(max_steps=2048);npu_profiler_batch_offline_kernel_step"
2026-03-03T10:11:34.325370+00:00,FULL,llm_style,eval,llm_style_eval_010,64,2048,4096,fp16,Ascend910B2,c02,32,64,32,2,2,8,0.0,281.475,131.873,164.9683999999999,8.142241580914972,3,-1,-1,64x2048x4096,0,"path_reordered,ASCEND_HOME_PATH_set,ASCEND_TOOLKIT_HOME_set;timing=npu_profiler_batch_chunked(max_steps=2048);npu_profiler_batch_offline_kernel_step"
2026-03-03T10:11:34.860271+00:00,FULL,llm_style,eval,llm_style_eval_011,32,3072,6144,fp16,Ascend910B2,c02,32,64,32,2,2,8,0.0,534.806,161.82299999999998,211.66661999999982,7.464696316345638,3,-1,-1,32x3072x6144,0,"path_reordered,ASCEND_HOME_PATH_set,ASCEND_TOOLKIT_HOME_set;timing=npu_profiler_batch_chunked(max_steps=2048);npu_profiler_batch_offline_kernel_step"
2026-03-03T10:11:34.990316+00:00,FULL,llm_style,eval,llm_style_eval_012,16,1536,1536,fp16,Ascend910B2,c00,32,32,32,2,2,8,0.0,129.947,55.231,66.63497999999997,1.366940160417157,7,-1,-1,16x1536x1536,0,"path_reordered,ASCEND_HOME_PATH_set,ASCEND_TOOLKIT_HOME_set;timing=npu_profiler_batch_chunked(max_steps=2048);npu_profiler_batch_offline_kernel_step"
2026-03-03T10:11:35.225798+00:00,FULL,llm_style,eval,llm_style_eval_013,64,2048,3072,fp16,Ascend910B2,c02,32,64,32,2,2,8,0.0,235.396,102.363,129.57899999999992,7.867162627121128,3,-1,-1,64x2048x3072,0,"path_reordered,ASCEND_HOME_PATH_set,ASCEND_TOOLKIT_HOME_set;timing=npu_profiler_batch_chunked(max_steps=2048);npu_profiler_batch_offline_kernel_step"
2026-03-03T10:11:36.498513+00:00,FULL,llm_style,eval,llm_style_eval_014,16,8192,6144,fp16,Ascend910B2,c02,32,64,32,2,2,8,0.0,1272.624,358.687,475.66443999999956,4.4903013936942235,5,-1,-1,16x8192x6144,0,"path_reordered,ASCEND_HOME_PATH_set,ASCEND_TOOLKIT_HOME_set;timing=npu_profiler_batch_chunked(max_steps=2048);npu_profiler_batch_offline_kernel_step"
2026-03-03T10:11:36.805474+00:00,FULL,llm_style,eval,llm_style_eval_015,64,6144,1536,fp16,Ascend910B2,c02,32,64,32,2,2,8,0.0,306.863,136.674,178.83439999999985,8.838254181482943,1,-1,-1,64x6144x1536,0,"path_reordered,ASCEND_HOME_PATH_set,ASCEND_TOOLKIT_HOME_set;timing=npu_profiler_batch_chunked(max_steps=2048);npu_profiler_batch_offline_kernel_step"
2026-03-03T10:11:37.292041+00:00,FULL,llm_style,eval,llm_style_eval_016,16,4096,4096,fp16,Ascend910B2,c02,32,64,32,2,2,8,0.0,486.461,140.302,186.61539999999985,3.8265378398027114,7,-1,-1,16x4096x4096,0,"path_reordered,ASCEND_HOME_PATH_set,ASCEND_TOOLKIT_HOME_set;timing=npu_profiler_batch_chunked(max_steps=2048);npu_profiler_batch_offline_kernel_step"
2026-03-03T10:11:38.214011+00:00,FULL,llm_style,eval,llm_style_eval_017,64,8192,4096,fp16,Ascend910B2,c02,32,64,32,2,2,8,0.0,921.85,444.249,571.4138599999995,9.667927887288435,1,-1,-1,64x8192x4096,0,"path_reordered,ASCEND_HOME_PATH_set,ASCEND_TOOLKIT_HOME_set;timing=npu_profiler_batch_chunked(max_steps=2048);npu_profiler_batch_offline_kernel_step"
2026-03-03T10:11:38.894410+00:00,FULL,llm_style,eval,llm_style_eval_018,32,4096,6144,fp16,Ascend910B2,c02,32,64,32,2,2,8,0.0,680.28,212.014,282.6116199999998,7.596728216061203,3,-1,-1,32x4096x6144,0,"path_reordered,ASCEND_HOME_PATH_set,ASCEND_TOOLKIT_HOME_set;timing=npu_profiler_batch_chunked(max_steps=2048);npu_profiler_batch_offline_kernel_step"
2026-03-03T10:11:39.564108+00:00,FULL,llm_style,eval,llm_style_eval_019,16,3072,8192,fp16,Ascend910B2,c02,32,64,32,2,2,8,0.0,669.595,183.774,243.5751999999998,4.382047340755493,6,-1,-1,16x3072x8192,0,"path_reordered,ASCEND_HOME_PATH_set,ASCEND_TOOLKIT_HOME_set;timing=npu_profiler_batch_chunked(max_steps=2048);npu_profiler_batch_offline_kernel_step"
2026-03-03T10:11:39.690961+00:00,FULL,llm_style,eval,llm_style_eval_020,4,1536,1536,fp16,Ascend910B2,c01,64,32,32,2,2,8,0.0,126.749,46.811,58.88217999999996,0.40320369144004614,7,-1,-1,4x1536x1536,0,"path_reordered,ASCEND_HOME_PATH_set,ASCEND_TOOLKIT_HOME_set;timing=npu_profiler_batch_chunked(max_steps=2048);npu_profiler_batch_offline_kernel_step"
2026-03-03T10:11:39.995670+00:00,FULL,llm_style,eval,llm_style_eval_021,4,6144,1536,fp16,Ascend910B2,c02,32,64,32,2,2,8,0.0,304.623,80.622,102.37735999999992,0.9364375976780531,5,-1,-1,4x6144x1536,0,"path_reordered,ASCEND_HOME_PATH_set,ASCEND_TOOLKIT_HOME_set;timing=npu_profiler_batch_chunked(max_steps=2048);npu_profiler_batch_offline_kernel_step"
2026-03-03T10:11:40.230533+00:00,FULL,llm_style,eval,llm_style_eval_022,32,6144,1024,fp16,Ascend910B2,c02,32,64,32,2,2,8,0.0,234.76,78.512,91.33579999999998,5.128555940493173,1,-1,-1,32x6144x1024,0,"path_reordered,ASCEND_HOME_PATH_set,ASCEND_TOOLKIT_HOME_set;timing=npu_profiler_batch_chunked(max_steps=2048);npu_profiler_batch_offline_kernel_step"
2026-03-03T10:11:40.345017+00:00,FULL,llm_style,eval,llm_style_eval_023,16,1024,1536,fp16,Ascend910B2,c02,32,64,32,2,2,8,0.0,114.396,25.509999999999998,29.65199999999999,1.9730163857310858,7,-1,-1,16x1024x1536,0,"path_reordered,ASCEND_HOME_PATH_set,ASCEND_TOOLKIT_HOME_set;timing=npu_profiler_batch_chunked(max_steps=2048);npu_profiler_batch_offline_kernel_step"
2026-03-03T10:11:40.630201+00:00,FULL,llm_style,eval,llm_style_eval_024,32,8192,1024,fp16,Ascend910B2,c02,32,64,32,2,2,8,0.0,285.106,92.85,111.98659999999998,5.782131523963382,1,-1,-1,32x8192x1024,0,"path_reordered,ASCEND_HOME_PATH_set,ASCEND_TOOLKIT_HOME_set;timing=npu_profiler_batch_chunked(max_steps=2048);npu_profiler_batch_offline_kernel_step"
2026-03-03T10:11:41.628351+00:00,FULL,llm_style,eval,llm_style_eval_025,32,6144,6144,fp16,Ascend910B2,c02,32,64,32,2,2,8,0.0,998.054,288.565,381.2922399999997,8.372183404085735,1,-1,-1,32x6144x6144,0,"path_reordered,ASCEND_HOME_PATH_set,ASCEND_TOOLKIT_HOME_set;timing=npu_profiler_batch_chunked(max_steps=2048);npu_profiler_batch_offline_kernel_step"
2026-03-03T10:11:42.001110+00:00,FULL,llm_style,eval,llm_style_eval_026,1,6144,2048,fp16,Ascend910B2,c02,32,64,32,2,2,8,0.0,372.661,94.061,124.93903999999989,0.2675479103985711,5,-1,-1,1x6144x2048,0,"path_reordered,ASCEND_HOME_PATH_set,ASCEND_TOOLKIT_HOME_set;timing=npu_profiler_batch_chunked(max_steps=2048);npu_profiler_batch_offline_kernel_step"
2026-03-03T10:11:42.376025+00:00,FULL,llm_style,eval,llm_style_eval_027,32,4096,3072,fp16,Ascend910B2,c02,32,64,32,2,2,8,0.0,374.82,119.691,159.0755999999999,6.728211544727674,3,-1,-1,32x4096x3072,0,"path_reordered,ASCEND_HOME_PATH_set,ASCEND_TOOLKIT_HOME_set;timing=npu_profiler_batch_chunked(max_steps=2048);npu_profiler_batch_offline_kernel_step"
2026-03-03T10:11:42.511189+00:00,FULL,llm_style,eval,llm_style_eval_028,64,1536,1536,fp16,Ascend910B2,c01,64,32,32,2,2,8,0.0,135.066,69.042,84.18103999999997,4.374002607108716,3,-1,-1,64x1536x1536,0,"path_reordered,ASCEND_HOME_PATH_set,ASCEND_TOOLKIT_HOME_set;timing=npu_profiler_batch_chunked(max_steps=2048);npu_profiler_batch_offline_kernel_step"
2026-03-03T10:11:42.661167+00:00,FULL,llm_style,eval,llm_style_eval_029,2,3072,1024,fp16,Ascend910B2,c01,64,32,32,2,2,8,0.0,149.878,57.412,76.76877999999994,0.21916867553821504,7,-1,-1,2x3072x1024,0,"path_reordered,ASCEND_HOME_PATH_set,ASCEND_TOOLKIT_HOME_set;timing=npu_profiler_batch_chunked(max_steps=2048);npu_profiler_batch_offline_kernel_step"
2026-03-03T10:11:43.037876+00:00,FULL,llm_style,eval,llm_style_eval_030,32,1536,8192,fp16,Ascend910B2,c02,32,64,32,2,2,8,0.0,376.614,113.43100000000001,141.5376199999999,7.099526302333577,2,-1,-1,32x1536x8192,0,"path_reordered,ASCEND_HOME_PATH_set,ASCEND_TOOLKIT_HOME_set;timing=npu_profiler_batch_chunked(max_steps=2048);npu_profiler_batch_offline_kernel_step"
2026-03-03T10:11:43.265629+00:00,FULL,llm_style,eval,llm_style_eval_031,8,3072,2048,fp16,Ascend910B2,c02,32,64,32,2,2,8,0.0,227.661,63.242999999999995,79.22317999999996,1.5916907167591672,7,-1,-1,8x3072x2048,0,"path_reordered,ASCEND_HOME_PATH_set,ASCEND_TOOLKIT_HOME_set;timing=npu_profiler_batch_chunked(max_steps=2048);npu_profiler_batch_offline_kernel_step"
2026-03-03T10:11:43.503039+00:00,FULL,llm_style,eval,llm_style_eval_032,8,2048,3072,fp16,Ascend910B2,c02,32,64,32,2,2,8,0.0,237.316,80.971,95.11599999999996,1.243201837694977,7,-1,-1,8x2048x3072,0,"path_reordered,ASCEND_HOME_PATH_set,ASCEND_TOOLKIT_HOME_set;timing=npu_profiler_batch_chunked(max_steps=2048);npu_profiler_batch_offline_kernel_step"
2026-03-03T10:11:43.503137+00:00,FULL,llm_style,eval,llm_style_eval_033,64,1536,8192,fp16,Ascend910B2,c02,32,64,32,2,2,8,0.0,0.0,175.19299999999998,230.1399999999998,9.193362383200244,2,-1,-1,64x1536x8192,0,"path_reordered,ASCEND_HOME_PATH_set,ASCEND_TOOLKIT_HOME_set;timing=npu_profiler_batch_chunked(max_steps=2048);npu_profiler_batch_offline_kernel_step"
2026-03-03T10:11:43.900099+00:00,FULL,llm_style,eval,llm_style_eval_034,64,6144,2048,fp16,Ascend910B2,c02,32,64,32,2,2,8,0.0,396.915,176.703,231.5942199999998,9.114801310673842,1,-1,-1,64x6144x2048,0,"path_reordered,ASCEND_HOME_PATH_set,ASCEND_TOOLKIT_HOME_set;timing=npu_profiler_batch_chunked(max_steps=2048);npu_profiler_batch_offline_kernel_step"
2026-03-03T10:11:44.182489+00:00,FULL,llm_style,eval,llm_style_eval_035,4,4096,2048,fp16,Ascend910B2,c02,32,64,32,2,2,8,0.0,282.299,75.152,100.08539999999992,0.8929750904832873,7,-1,-1,4x4096x2048,0,"path_reordered,ASCEND_HOME_PATH_set,ASCEND_TOOLKIT_HOME_set;timing=npu_profiler_batch_chunked(max_steps=2048);npu_profiler_batch_offline_kernel_step"
2026-03-03T10:11:44.182567+00:00,FULL,llm_style,eval,llm_style_eval_036,64,8192,4096,fp16,Ascend910B2,c02,32,64,32,2,2,8,0.0,0.0,443.118,582.3090399999994,9.692603992615963,1,-1,-1,64x8192x4096,0,"path_reordered,ASCEND_HOME_PATH_set,ASCEND_TOOLKIT_HOME_set;timing=npu_profiler_batch_chunked(max_steps=2048);npu_profiler_batch_offline_kernel_step"
2026-03-03T10:11:44.182593+00:00,FULL,llm_style,eval,llm_style_eval_037,32,6144,1024,fp16,Ascend910B2,c02,32,64,32,2,2,8,0.0,0.0,78.74199999999999,95.85899999999997,5.113575779126769,1,-1,-1,32x6144x1024,0,"path_reordered,ASCEND_HOME_PATH_set,ASCEND_TOOLKIT_HOME_set;timing=npu_profiler_batch_chunked(max_steps=2048);npu_profiler_batch_offline_kernel_step"
2026-03-03T10:11:44.182615+00:00,FULL,llm_style,eval,llm_style_eval_038,64,6144,2048,fp16,Ascend910B2,c02,32,64,32,2,2,8,0.0,0.0,176.804,181.8936,9.109594443564625,1,-1,-1,64x6144x2048,0,"path_reordered,ASCEND_HOME_PATH_set,ASCEND_TOOLKIT_HOME_set;timing=npu_profiler_batch_chunked(max_steps=2048);npu_profiler_batch_offline_kernel_step"
2026-03-03T10:11:44.330667+00:00,FULL,llm_style,eval,llm_style_eval_039,8,1024,3072,fp16,Ascend910B2,c01,64,32,32,2,2,8,0.0,148.013,80.751,98.55021999999994,0.6232944235984693,7,-1,-1,8x1024x3072,0,"path_reordered,ASCEND_HOME_PATH_set,ASCEND_TOOLKIT_HOME_set;timing=npu_profiler_batch_chunked(max_steps=2048);npu_profiler_batch_offline_kernel_step"
2026-03-03T10:11:44.837071+00:00,FULL,llm_style,eval,llm_style_eval_040,32,8192,2048,fp16,Ascend910B2,c02,32,64,32,2,2,8,0.0,506.29,146.103,187.0430199999999,7.349211337207311,1,-1,-1,32x8192x2048,0,"path_reordered,ASCEND_HOME_PATH_set,ASCEND_TOOLKIT_HOME_set;timing=npu_profiler_batch_chunked(max_steps=2048);npu_profiler_batch_offline_kernel_step"
2026-03-03T10:11:44.994548+00:00,FULL,llm_style,eval,llm_style_eval_041,32,3072,1024,fp16,Ascend910B2,c00,32,32,32,2,2,8,0.0,157.363,73.87100000000001,81.10578000000001,2.7253806229778936,3,-1,-1,32x3072x1024,0,"path_reordered,ASCEND_HOME_PATH_set,ASCEND_TOOLKIT_HOME_set;timing=npu_profiler_batch_chunked(max_steps=2048);npu_profiler_batch_offline_kernel_step"
2026-03-03T10:11:45.192430+00:00,FULL,llm_style,eval,llm_style_eval_042,64,1024,4096,fp16,Ascend910B2,c02,32,64,32,2,2,8,0.0,197.785,89.75200000000001,112.17321999999992,5.981715304394331,3,-1,-1,64x1024x4096,0,"path_reordered,ASCEND_HOME_PATH_set,ASCEND_TOOLKIT_HOME_set;timing=npu_profiler_batch_chunked(max_steps=2048);npu_profiler_batch_offline_kernel_step"
2026-03-03T10:11:45.307736+00:00,FULL,llm_style,eval,llm_style_eval_043,2,1536,1024,fp16,Ascend910B2,c02,32,64,32,2,2,8,0.0,115.209,26.041,29.41597999999999,0.24159809531123996,7,-1,-1,2x1536x1024,0,"path_reordered,ASCEND_HOME_PATH_set,ASCEND_TOOLKIT_HOME_set;timing=npu_profiler_batch_chunked(max_steps=2048);npu_profiler_batch_offline_kernel_step"
2026-03-03T10:11:45.307816+00:00,FULL,llm_style,eval,llm_style_eval_044,64,6144,3072,fp16,Ascend910B2,c02,32,64,32,2,2,8,0.0,0.0,257.655,340.7888399999997,9.376565966117484,1,-1,-1,64x6144x3072,0,"path_reordered,ASCEND_HOME_PATH_set,ASCEND_TOOLKIT_HOME_set;timing=npu_profiler_batch_chunked(max_steps=2048);npu_profiler_batch_offline_kernel_step"
2026-03-03T10:11:45.644427+00:00,FULL,llm_style,eval,llm_style_eval_045,64,1536,6144,fp16,Ascend910B2,c02,32,64,32,2,2,8,0.0,336.563,134.642,176.47581999999986,8.971639993464148,3,-1,-1,64x1536x6144,0,"path_reordered,ASCEND_HOME_PATH_set,ASCEND_TOOLKIT_HOME_set;timing=npu_profiler_batch_chunked(max_steps=2048);npu_profiler_batch_offline_kernel_step"
2026-03-03T10:11:46.176902+00:00,FULL,llm_style,eval,llm_style_eval_046,2,6144,3072,fp16,Ascend910B2,c02,32,64,32,2,2,8,0.0,532.379,133.304,175.45199999999986,0.566355638240413,5,-1,-1,2x6144x3072,0,"path_reordered,ASCEND_HOME_PATH_set,ASCEND_TOOLKIT_HOME_set;timing=npu_profiler_batch_chunked(max_steps=2048);npu_profiler_batch_offline_kernel_step"
2026-03-03T10:11:47.091524+00:00,FULL,llm_style,eval,llm_style_eval_047,16,4096,8192,fp16,Ascend910B2,c02,32,64,32,2,2,8,0.0,914.53,250.496,335.9810199999997,4.286462953500255,6,-1,-1,16x4096x8192,0,"path_reordered,ASCEND_HOME_PATH_set,ASCEND_TOOLKIT_HOME_set;timing=npu_profiler_batch_chunked(max_steps=2048);npu_profiler_batch_offline_kernel_step"
2026-03-03T10:11:47.339267+00:00,FULL,llm_style,eval,llm_style_eval_048,16,1024,6144,fp16,Ascend910B2,c02,32,64,32,2,2,8,0.0,247.647,73.7,93.11079999999995,2.7317040976933518,7,-1,-1,16x1024x6144,0,"path_reordered,ASCEND_HOME_PATH_set,ASCEND_TOOLKIT_HOME_set;timing=npu_profiler_batch_chunked(max_steps=2048);npu_profiler_batch_offline_kernel_step"
2026-03-03T10:11:47.745208+00:00,FULL,llm_style,eval,llm_style_eval_049,16,8192,1536,fp16,Ascend910B2,c02,32,64,32,2,2,8,0.0,405.838,105.482,137.2556199999999,3.817269145446616,5,-1,-1,16x8192x1536,0,"path_reordered,ASCEND_HOME_PATH_set,ASCEND_TOOLKIT_HOME_set;timing=npu_profiler_batch_chunked(max_steps=2048);npu_profiler_batch_offline_kernel_step"
2026-03-03T10:11:47.844404+00:00,FULL,llm_style,eval,llm_style_eval_050,1,1024,1024,fp16,Ascend910B2,c02,32,64,32,2,2,8,0.0,99.102,17.310000000000002,19.990199999999994,0.12115262853841709,7,-1,-1,1x1024x1024,0,"path_reordered,ASCEND_HOME_PATH_set,ASCEND_TOOLKIT_HOME_set;timing=npu_profiler_batch_chunked(max_steps=2048);npu_profiler_batch_offline_kernel_step"
2026-03-03T10:11:48.085295+00:00,FULL,llm_style,eval,llm_style_eval_051,16,6144,1024,fp16,Ascend910B2,c02,32,64,32,2,2,8,0.0,240.816,77.68,90.60037999999999,2.5917429454170957,5,-1,-1,16x6144x1024,0,"path_reordered,ASCEND_HOME_PATH_set,ASCEND_TOOLKIT_HOME_set;timing=npu_profiler_batch_chunked(max_steps=2048);npu_profiler_batch_offline_kernel_step"
2026-03-03T10:11:48.085384+00:00,FULL,llm_style,eval,llm_style_eval_052,16,8192,8192,fp16,Ascend910B2,c02,32,64,32,2,2,8,0.0,0.0,460.299,621.0624599999994,4.665410196415809,4,-1,-1,16x8192x8192,0,"path_reordered,ASCEND_HOME_PATH_set,ASCEND_TOOLKIT_HOME_set;timing=npu_profiler_batch_chunked(max_steps=2048);npu_profiler_batch_offline_kernel_step"
2026-03-03T10:11:49.389492+00:00,FULL,llm_style,eval,llm_style_eval_053,1,6144,8192,fp16,Ascend910B2,c02,32,64,32,2,2,8,0.0,1304.064,306.145,417.6494599999995,0.3288092113214327,4,-1,-1,1x6144x8192,0,"path_reordered,ASCEND_HOME_PATH_set,ASCEND_TOOLKIT_HOME_set;timing=npu_profiler_batch_chunked(max_steps=2048);npu_profiler_batch_offline_kernel_step"
2026-03-03T10:11:49.785934+00:00,FULL,llm_style,eval,llm_style_eval_054,64,4096,3072,fp16,Ascend910B2,c02,32,64,32,2,2,8,0.0,396.341,184.663,251.1152199999998,8.72190279590389,3,-1,-1,64x4096x3072,0,"path_reordered,ASCEND_HOME_PATH_set,ASCEND_TOOLKIT_HOME_set;timing=npu_profiler_batch_chunked(max_steps=2048);npu_profiler_batch_offline_kernel_step"
2026-03-03T10:11:50.066727+00:00,FULL,llm_style,eval,llm_style_eval_055,4,8192,1024,fp16,Ascend910B2,c02,32,64,32,2,2,8,0.0,280.688,76.672,92.30077999999995,0.8752721202003338,5,-1,-1,4x8192x1024,0,"path_reordered,ASCEND_HOME_PATH_set,ASCEND_TOOLKIT_HOME_set;timing=npu_profiler_batch_chunked(max_steps=2048);npu_profiler_batch_offline_kernel_step"
2026-03-03T10:11:50.231583+00:00,FULL,llm_style,eval,llm_style_eval_056,64,1024,3072,fp16,Ascend910B2,c02,32,64,32,2,2,8,0.0,164.766,69.811,86.00623999999995,5.7677612983627204,3,-1,-1,64x1024x3072,0,"path_reordered,ASCEND_HOME_PATH_set,ASCEND_TOOLKIT_HOME_set;timing=npu_profiler_batch_chunked(max_steps=2048);npu_profiler_batch_offline_kernel_step"
2026-03-03T10:11:50.231674+00:00,FULL,llm_style,eval,llm_style_eval_057,64,1024,3072,fp16,Ascend910B2,c02,32,64,32,2,2,8,0.0,0.0,69.842,72.3032,5.765201225623551,3,-1,-1,64x1024x3072,0,"path_reordered,ASCEND_HOME_PATH_set,ASCEND_TOOLKIT_HOME_set;timing=npu_profiler_batch_chunked(max_steps=2048);npu_profiler_batch_offline_kernel_step"
2026-03-03T10:11:50.521828+00:00,FULL,llm_style,eval,llm_style_eval_058,32,2048,4096,fp16,Ascend910B2,c02,32,64,32,2,2,8,0.0,290.107,107.05199999999999,134.1340199999999,5.01504793931921,3,-1,-1,32x2048x4096,0,"path_reordered,ASCEND_HOME_PATH_set,ASCEND_TOOLKIT_HOME_set;timing=npu_profiler_batch_chunked(max_steps=2048);npu_profiler_batch_offline_kernel_step"
2026-03-03T10:11:50.521908+00:00,FULL,llm_style,eval,llm_style_eval_059,64,8192,2048,fp16,Ascend910B2,c02,32,64,32,2,2,8,0.0,0.0,230.655,291.43583999999976,9.310371108365308,1,-1,-1,64x8192x2048,0,"path_reordered,ASCEND_HOME_PATH_set,ASCEND_TOOLKIT_HOME_set;timing=npu_profiler_batch_chunked(max_steps=2048);npu_profiler_batch_offline_kernel_step"
2026-03-03T10:11:51.065250+00:00,FULL,llm_style,eval,llm_style_eval_060,1,3072,6144,fp16,Ascend910B2,c02,32,64,32,2,2,8,0.0,543.297,128.28300000000002,173.45661999999982,0.2942614064217394,7,-1,-1,1x3072x6144,0,"path_reordered,ASCEND_HOME_PATH_set,ASCEND_TOOLKIT_HOME_set;timing=npu_profiler_batch_chunked(max_steps=2048);npu_profiler_batch_offline_kernel_step"
2026-03-03T10:11:51.327644+00:00,FULL,llm_style,eval,llm_style_eval_061,64,1536,4096,fp16,Ascend910B2,c02,32,64,32,2,2,8,0.0,262.286,90.814,120.3129799999999,8.867645605303148,3,-1,-1,64x1536x4096,0,"path_reordered,ASCEND_HOME_PATH_set,ASCEND_TOOLKIT_HOME_set;timing=npu_profiler_batch_chunked(max_steps=2048);npu_profiler_batch_offline_kernel_step"
2026-03-03T10:11:51.732111+00:00,FULL,llm_style,eval,llm_style_eval_062,16,6144,2048,fp16,Ascend910B2,c02,32,64,32,2,2,8,0.0,404.357,113.892,144.8121999999999,3.5353947950690126,5,-1,-1,16x6144x2048,0,"path_reordered,ASCEND_HOME_PATH_set,ASCEND_TOOLKIT_HOME_set;timing=npu_profiler_batch_chunked(max_steps=2048);npu_profiler_batch_offline_kernel_step"
2026-03-03T10:11:51.732198+00:00,FULL,llm_style,eval,llm_style_eval_063,64,1536,6144,fp16,Ascend910B2,c02,32,64,32,2,2,8,0.0,0.0,134.403,177.48503999999986,8.987593669784157,3,-1,-1,64x1536x6144,0,"path_reordered,ASCEND_HOME_PATH_set,ASCEND_TOOLKIT_HOME_set;timing=npu_profiler_batch_chunked(max_steps=2048);npu_profiler_batch_offline_kernel_step"
2026-03-03T10:11:51.732226+00:00,FULL,llm_style,eval,llm_style_eval_064,1,6144,2048,fp16,Ascend910B2,c02,32,64,32,2,2,8,0.0,0.0,93.852,125.86903999999988,0.2681437156373865,5,-1,-1,1x6144x2048,0,"path_reordered,ASCEND_HOME_PATH_set,ASCEND_TOOLKIT_HOME_set;timing=npu_profiler_batch_chunked(max_steps=2048);npu_profiler_batch_offline_kernel_step"
2026-03-03T10:11:52.052922+00:00,FULL,llm_style,eval,llm_style_eval_065,8,1536,6144,fp16,Ascend910B2,c02,32,64,32,2,2,8,0.0,320.658,84.981,106.67699999999994,1.7768082747908356,7,-1,-1,8x1536x6144,0,"path_reordered,ASCEND_HOME_PATH_set,ASCEND_TOOLKIT_HOME_set;timing=npu_profiler_batch_chunked(max_steps=2048);npu_profiler_batch_offline_kernel_step"
2026-03-03T10:11:52.053009+00:00,FULL,llm_style,eval,llm_style_eval_066,64,1536,4096,fp16,Ascend910B2,c02,32,64,32,2,2,8,0.0,0.0,95.871,99.4716,8.39989535938918,3,-1,-1,64x1536x4096,0,"path_reordered,ASCEND_HOME_PATH_set,ASCEND_TOOLKIT_HOME_set;timing=npu_profiler_batch_chunked(max_steps=2048);npu_profiler_batch_offline_kernel_step"
2026-03-03T10:11:52.053036+00:00,FULL,llm_style,eval,llm_style_eval_067,64,8192,2048,fp16,Ascend910B2,c02,32,64,32,2,2,8,0.0,0.0,230.54500000000002,240.95621999999997,9.314813368322886,1,-1,-1,64x8192x2048,0,"path_reordered,ASCEND_HOME_PATH_set,ASCEND_TOOLKIT_HOME_set;timing=npu_profiler_batch_chunked(max_steps=2048);npu_profiler_batch_offline_kernel_step"
2026-03-03T10:11:52.053058+00:00,FULL,llm_style,eval,llm_style_eval_068,64,1024,4096,fp16,Ascend910B2,c02,32,64,32,2,2,8,0.0,0.0,89.881,112.02419999999992,5.973130160990642,3,-1,-1,64x1024x4096,0,"path_reordered,ASCEND_HOME_PATH_set,ASCEND_TOOLKIT_HOME_set;timing=npu_profiler_batch_chunked(max_steps=2048);npu_profiler_batch_offline_kernel_step"
2026-03-03T10:11:52.053082+00:00,FULL,llm_style,eval,llm_style_eval_069,64,2048,4096,fp16,Ascend910B2,c02,32,64,32,2,2,8,0.0,0.0,132.612,168.7984199999999,8.09686773444334,3,-1,-1,64x2048x4096,0,"path_reordered,ASCEND_HOME_PATH_set,ASCEND_TOOLKIT_HOME_set;timing=npu_profiler_batch_chunked(max_steps=2048);npu_profiler_batch_offline_kernel_step"
2026-03-03T10:11:52.338610+00:00,FULL,llm_style,eval,llm_style_eval_070,64,8192,1024,fp16,Ascend910B2,c02,32,64,32,2,2,8,0.0,285.489,124.033,157.18981999999988,8.656904404473003,1,-1,-1,64x8192x1024,0,"path_reordered,ASCEND_HOME_PATH_set,ASCEND_TOOLKIT_HOME_set;timing=npu_profiler_batch_chunked(max_steps=2048);npu_profiler_batch_offline_kernel_step"
2026-03-03T10:11:52.338689+00:00,FULL,llm_style,eval,llm_style_eval_071,64,6144,2048,fp16,Ascend910B2,c02,32,64,32,2,2,8,0.0,0.0,176.524,233.02363999999983,9.124043960028098,1,-1,-1,64x6144x2048,0,"path_reordered,ASCEND_HOME_PATH_set,ASCEND_TOOLKIT_HOME_set;timing=npu_profiler_batch_chunked(max_steps=2048);npu_profiler_batch_offline_kernel_step"
2026-03-03T10:11:52.456573+00:00,FULL,llm_style,eval,llm_style_eval_072,64,1536,1024,fp16,Ascend910B2,c01,64,32,32,2,2,8,0.0,117.841,54.611000000000004,61.15121999999999,3.686557506729413,3,-1,-1,64x1536x1024,0,"path_reordered,ASCEND_HOME_PATH_set,ASCEND_TOOLKIT_HOME_set;timing=npu_profiler_batch_chunked(max_steps=2048);npu_profiler_batch_offline_kernel_step"
2026-03-03T10:11:52.700176+00:00,FULL,llm_style,eval,llm_style_eval_073,1,4096,1536,fp16,Ascend910B2,c02,32,64,32,2,2,8,0.0,243.513,60.552,77.84957999999995,0.20780340864050734,7,-1,-1,1x4096x1536,0,"path_reordered,ASCEND_HOME_PATH_set,ASCEND_TOOLKIT_HOME_set;timing=npu_profiler_batch_chunked(max_steps=2048);npu_profiler_batch_offline_kernel_step"
2026-03-03T10:11:52.837681+00:00,FULL,llm_style,eval,llm_style_eval_074,8,1024,2048,fp16,Ascend910B2,c02,32,64,32,2,2,8,0.0,137.417,30.012,36.576599999999985,1.1180338531254166,7,-1,-1,8x1024x2048,0,"path_reordered,ASCEND_HOME_PATH_set,ASCEND_TOOLKIT_HOME_set;timing=npu_profiler_batch_chunked(max_steps=2048);npu_profiler_batch_offline_kernel_step"
2026-03-03T10:11:53.083527+00:00,FULL,llm_style,eval,llm_style_eval_075,2,6144,1024,fp16,Ascend910B2,c02,32,64,32,2,2,8,0.0,245.75,56.5,71.43937999999994,0.44541281415929207,5,-1,-1,2x6144x1024,0,"path_reordered,ASCEND_HOME_PATH_set,ASCEND_TOOLKIT_HOME_set;timing=npu_profiler_batch_chunked(max_steps=2048);npu_profiler_batch_offline_kernel_step"
2026-03-03T10:11:53.340061+00:00,FULL,llm_style,eval,llm_style_eval_076,64,1024,6144,fp16,Ascend910B2,c02,32,64,32,2,2,8,0.0,256.428,132.102,164.8830199999999,6.0960951991642816,3,-1,-1,64x1024x6144,0,"path_reordered,ASCEND_HOME_PATH_set,ASCEND_TOOLKIT_HOME_set;timing=npu_profiler_batch_chunked(max_steps=2048);npu_profiler_batch_offline_kernel_step"
2026-03-03T10:11:54.235409+00:00,FULL,llm_style,eval,llm_style_eval_077,1,4096,8192,fp16,Ascend910B2,c02,32,64,32,2,2,8,0.0,895.25,227.125,320.6966199999997,0.2954710577875619,6,-1,-1,1x4096x8192,0,"path_reordered,ASCEND_HOME_PATH_set,ASCEND_TOOLKIT_HOME_set;timing=npu_profiler_batch_chunked(max_steps=2048);npu_profiler_batch_offline_kernel_step"
2026-03-03T10:11:54.235493+00:00,FULL,llm_style,eval,llm_style_eval_078,64,6144,3072,fp16,Ascend910B2,c02,32,64,32,2,2,8,0.0,0.0,258.19500000000005,343.8918199999997,9.356955417417067,1,-1,-1,64x6144x3072,0,"path_reordered,ASCEND_HOME_PATH_set,ASCEND_TOOLKIT_HOME_set;timing=npu_profiler_batch_chunked(max_steps=2048);npu_profiler_batch_offline_kernel_step"
2026-03-03T10:11:54.631933+00:00,FULL,llm_style,eval,llm_style_eval_079,2,3072,4096,fp16,Ascend910B2,c02,32,64,32,2,2,8,0.0,396.389,97.382,126.6136199999999,0.5168475488283255,7,-1,-1,2x3072x4096,0,"path_reordered,ASCEND_HOME_PATH_set,ASCEND_TOOLKIT_HOME_set;timing=npu_profiler_batch_chunked(max_steps=2048);npu_profiler_batch_offline_kernel_step"
2026-03-03T10:11:54.753452+00:00,FULL,llm_style,eval,llm_style_eval_080,4,1536,1024,fp16,Ascend910B2,c02,32,64,32,2,2,8,0.0,121.418,25.542,28.001619999999996,0.49263612872915197,7,-1,-1,4x1536x1024,0,"path_reordered,ASCEND_HOME_PATH_set,ASCEND_TOOLKIT_HOME_set;timing=npu_profiler_batch_chunked(max_steps=2048);npu_profiler_batch_offline_kernel_step"
2026-03-03T10:11:55.448162+00:00,FULL,llm_style,eval,llm_style_eval_081,4,4096,6144,fp16,Ascend910B2,c02,32,64,32,2,2,8,0.0,694.62,184.674,253.49503999999973,1.090172910101043,7,-1,-1,4x4096x6144,0,"path_reordered,ASCEND_HOME_PATH_set,ASCEND_TOOLKIT_HOME_set;timing=npu_profiler_batch_chunked(max_steps=2048);npu_profiler_batch_offline_kernel_step"
2026-03-03T10:11:55.688545+00:00,FULL,llm_style,eval,llm_style_eval_082,64,6144,1024,fp16,Ascend910B2,c02,32,64,32,2,2,8,0.0,240.281,96.404,124.24999999999991,8.353453881581677,1,-1,-1,64x6144x1024,0,"path_reordered,ASCEND_HOME_PATH_set,ASCEND_TOOLKIT_HOME_set;timing=npu_profiler_batch_chunked(max_steps=2048);npu_profiler_batch_offline_kernel_step"
2026-03-03T10:11:56.190646+00:00,FULL,llm_style,eval,llm_style_eval_083,8,4096,4096,fp16,Ascend910B2,c02,32,64,32,2,2,8,0.0,502.009,133.524,180.80061999999987,2.01039106078308,7,-1,-1,8x4096x4096,0,"path_reordered,ASCEND_HOME_PATH_set,ASCEND_TOOLKIT_HOME_set;timing=npu_profiler_batch_chunked(max_steps=2048);npu_profiler_batch_offline_kernel_step"
2026-03-03T10:11:56.491699+00:00,FULL,llm_style,eval,llm_style_eval_084,64,1024,8192,fp16,Ascend910B2,c02,32,64,32,2,2,8,0.0,300.961,168.78300000000002,214.57363999999987,6.361670452592974,2,-1,-1,64x1024x8192,0,"path_reordered,ASCEND_HOME_PATH_set,ASCEND_TOOLKIT_HOME_set;timing=npu_profiler_batch_chunked(max_steps=2048);npu_profiler_batch_offline_kernel_step"
2026-03-03T10:11:57.172640+00:00,FULL,llm_style,eval,llm_style_eval_085,1,3072,8192,fp16,Ascend910B2,c02,32,64,32,2,2,8,0.0,680.835,162.12400000000002,218.1994399999998,0.3104515555994177,6,-1,-1,1x3072x8192,0,"path_reordered,ASCEND_HOME_PATH_set,ASCEND_TOOLKIT_HOME_set;timing=npu_profiler_batch_chunked(max_steps=2048);npu_profiler_batch_offline_kernel_step"
2026-03-03T10:11:57.299947+00:00,FULL,llm_style,eval,llm_style_eval_086,8,1536,1024,fp16,Ascend910B2,c02,32,64,32,2,2,8,0.0,127.207,26.691000000000003,29.674779999999995,0.9428580420366415,7,-1,-1,8x1536x1024,0,"path_reordered,ASCEND_HOME_PATH_set,ASCEND_TOOLKIT_HOME_set;timing=npu_profiler_batch_chunked(max_steps=2048);npu_profiler_batch_offline_kernel_step"
2026-03-03T10:11:57.453498+00:00,FULL,llm_style,eval,llm_style_eval_087,16,1024,3072,fp16,Ascend910B2,c00,32,32,32,2,2,8,0.0,153.461,83.232,104.47381999999993,1.2094302191464819,7,-1,-1,16x1024x3072,0,"path_reordered,ASCEND_HOME_PATH_set,ASCEND_TOOLKIT_HOME_set;timing=npu_profiler_batch_chunked(max_steps=2048);npu_profiler_batch_offline_kernel_step"
2026-03-03T10:11:57.680443+00:00,FULL,llm_style,eval,llm_style_eval_088,8,4096,1536,fp16,Ascend910B2,c02,32,64,32,2,2,8,0.0,226.852,63.581999999999994,79.49301999999994,1.5832043031046525,7,-1,-1,8x4096x1536,0,"path_reordered,ASCEND_HOME_PATH_set,ASCEND_TOOLKIT_HOME_set;timing=npu_profiler_batch_chunked(max_steps=2048);npu_profiler_batch_offline_kernel_step"
2026-03-03T10:11:58.232656+00:00,FULL,llm_style,eval,llm_style_eval_089,16,6144,3072,fp16,Ascend910B2,c02,32,64,32,2,2,8,0.0,552.118,150.29399999999998,197.78959999999984,4.018655275659707,5,-1,-1,16x6144x3072,0,"path_reordered,ASCEND_HOME_PATH_set,ASCEND_TOOLKIT_HOME_set;timing=npu_profiler_batch_chunked(max_steps=2048);npu_profiler_batch_offline_kernel_step"
2026-03-03T10:11:58.419448+00:00,FULL,llm_style,eval,llm_style_eval_090,32,1536,3072,fp16,Ascend910B2,c02,32,64,32,2,2,8,0.0,186.694,60.421,72.03959999999998,4.998094834577383,3,-1,-1,32x1536x3072,0,"path_reordered,ASCEND_HOME_PATH_set,ASCEND_TOOLKIT_HOME_set;timing=npu_profiler_batch_chunked(max_steps=2048);npu_profiler_batch_offline_kernel_step"
2026-03-03T10:11:58.604351+00:00,FULL,llm_style,eval,llm_style_eval_091,16,1024,4096,fp16,Ascend910B2,c02,32,64,32,2,2,8,0.0,184.805,53.471000000000004,66.82419999999996,2.510103196125002,7,-1,-1,16x1024x4096,0,"path_reordered,ASCEND_HOME_PATH_set,ASCEND_TOOLKIT_HOME_set;timing=npu_profiler_batch_chunked(max_steps=2048);npu_profiler_batch_offline_kernel_step"
2026-03-03T10:11:59.286852+00:00,FULL,llm_style,eval,llm_style_eval_092,1,4096,6144,fp16,Ascend910B2,c02,32,64,32,2,2,8,0.0,682.388,174.594,239.84241999999978,0.288278222619334,7,-1,-1,1x4096x6144,0,"path_reordered,ASCEND_HOME_PATH_set,ASCEND_TOOLKIT_HOME_set;timing=npu_profiler_batch_chunked(max_steps=2048);npu_profiler_batch_offline_kernel_step"
2026-03-03T10:11:59.523788+00:00,FULL,llm_style,eval,llm_style_eval_093,32,2048,3072,fp16,Ascend910B2,c02,32,64,32,2,2,8,0.0,236.795,87.713,107.07915999999994,4.5905759009496885,3,-1,-1,32x2048x3072,0,"path_reordered,ASCEND_HOME_PATH_set,ASCEND_TOOLKIT_HOME_set;timing=npu_profiler_batch_chunked(max_steps=2048);npu_profiler_batch_offline_kernel_step"
2026-03-03T10:11:59.652427+00:00,FULL,llm_style,eval,llm_style_eval_094,32,1024,2048,fp16,Ascend910B2,c01,64,32,32,2,2,8,0.0,128.546,67.661,82.84579999999997,1.9836793426050456,3,-1,-1,32x1024x2048,0,"path_reordered,ASCEND_HOME_PATH_set,ASCEND_TOOLKIT_HOME_set;timing=npu_profiler_batch_chunked(max_steps=2048);npu_profiler_batch_offline_kernel_step"
2026-03-03T10:12:00.056392+00:00,FULL,llm_style,eval,llm_style_eval_095,8,6144,2048,fp16,Ascend910B2,c02,32,64,32,2,2,8,0.0,403.884,108.21100000000001,135.0707999999999,1.860500244891924,5,-1,-1,8x6144x2048,0,"path_reordered,ASCEND_HOME_PATH_set,ASCEND_TOOLKIT_HOME_set;timing=npu_profiler_batch_chunked(max_steps=2048);npu_profiler_batch_offline_kernel_step"
2026-03-03T10:12:00.056464+00:00,FULL,llm_style,eval,llm_style_eval_096,64,2048,3072,fp16,Ascend910B2,c02,32,64,32,2,2,8,0.0,0.0,102.872,126.40663999999992,7.82823672136247,3,-1,-1,64x2048x3072,0,"path_reordered,ASCEND_HOME_PATH_set,ASCEND_TOOLKIT_HOME_set;timing=npu_profiler_batch_chunked(max_steps=2048);npu_profiler_batch_offline_kernel_step"
2026-03-03T10:12:00.056491+00:00,FULL,llm_style,eval,llm_style_eval_097,64,6144,1024,fp16,Ascend910B2,c02,32,64,32,2,2,8,0.0,0.0,96.111,122.6375999999999,8.378919873895807,1,-1,-1,64x6144x1024,0,"path_reordered,ASCEND_HOME_PATH_set,ASCEND_TOOLKIT_HOME_set;timing=npu_profiler_batch_chunked(max_steps=2048);npu_profiler_batch_offline_kernel_step"
2026-03-03T10:12:00.056513+00:00,FULL,llm_style,eval,llm_style_eval_098,32,6144,1024,fp16,Ascend910B2,c02,32,64,32,2,2,8,0.0,0.0,77.001,97.02659999999996,5.229194218256906,1,-1,-1,32x6144x1024,0,"path_reordered,ASCEND_HOME_PATH_set,ASCEND_TOOLKIT_HOME_set;timing=npu_profiler_batch_chunked(max_steps=2048);npu_profiler_batch_offline_kernel_step"
2026-03-03T10:12:00.233675+00:00,FULL,llm_style,eval,llm_style_eval_099,1,2048,2048,fp16,Ascend910B2,c00,32,32,32,2,2,8,0.0,177.122,70.362,86.84861999999995,0.11922071572723915,7,-1,-1,1x2048x2048,0,"path_reordered,ASCEND_HOME_PATH_set,ASCEND_TOOLKIT_HOME_set;timing=npu_profiler_batch_chunked(max_steps=2048);npu_profiler_batch_offline_kernel_step"
2026-03-03T10:12:00.233756+00:00,FULL,llm_style,eval,llm_style_eval_100,64,8192,1024,fp16,Ascend910B2,c02,32,64,32,2,2,8,0.0,0.0,123.971,159.22019999999986,8.661233869211348,1,-1,-1,64x8192x1024,0,"path_reordered,ASCEND_HOME_PATH_set,ASCEND_TOOLKIT_HOME_set;timing=npu_profiler_batch_chunked(max_steps=2048);npu_profiler_batch_offline_kernel_step"
2026-03-03T10:12:00.623849+00:00,FULL,llm_style,eval,llm_style_eval_101,64,8192,1536,fp16,Ascend910B2,c02,32,64,32,2,2,8,0.0,390.047,178.644,233.47121999999985,9.015767313763687,1,-1,-1,64x8192x1536,0,"path_reordered,ASCEND_HOME_PATH_set,ASCEND_TOOLKIT_HOME_set;timing=npu_profiler_batch_chunked(max_steps=2048);npu_profiler_batch_offline_kernel_step"
2026-03-03T10:12:00.842506+00:00,FULL,llm_style,eval,llm_style_eval_102,32,3072,2048,fp16,Ascend910B2,c02,32,64,32,2,2,8,0.0,218.552,76.812,91.89919999999998,5.242060927980003,3,-1,-1,32x3072x2048,0,"path_reordered,ASCEND_HOME_PATH_set,ASCEND_TOOLKIT_HOME_set;timing=npu_profiler_batch_chunked(max_steps=2048);npu_profiler_batch_offline_kernel_step"
2026-03-03T10:12:00.842585+00:00,FULL,llm_style,eval,llm_style_eval_103,64,2048,3072,fp16,Ascend910B2,c02,32,64,32,2,2,8,0.0,0.0,102.91300000000001,106.77138,7.825117992867762,3,-1,-1,64x2048x3072,0,"path_reordered,ASCEND_HOME_PATH_set,ASCEND_TOOLKIT_HOME_set;timing=npu_profiler_batch_chunked(max_steps=2048);npu_profiler_batch_offline_kernel_step"
2026-03-03T10:12:00.842611+00:00,FULL,llm_style,eval,llm_style_eval_104,16,6144,2048,fp16,Ascend910B2,c02,32,64,32,2,2,8,0.0,0.0,112.454,148.27201999999988,3.580603482312768,5,-1,-1,16x6144x2048,0,"path_reordered,ASCEND_HOME_PATH_set,ASCEND_TOOLKIT_HOME_set;timing=npu_profiler_batch_chunked(max_steps=2048);npu_profiler_batch_offline_kernel_step"
2026-03-03T10:12:01.123060+00:00,FULL,llm_style,eval,llm_style_eval_105,1,1024,8192,fp16,Ascend910B2,c02,32,64,32,2,2,8,0.0,280.409,83.63300000000001,110.3256199999999,0.2006052156445422,6,-1,-1,1x1024x8192,0,"path_reordered,ASCEND_HOME_PATH_set,ASCEND_TOOLKIT_HOME_set;timing=npu_profiler_batch_chunked(max_steps=2048);npu_profiler_batch_offline_kernel_step"
2026-03-03T10:12:02.048466+00:00,FULL,llm_style,eval,llm_style_eval_106,32,4096,8192,fp16,Ascend910B2,c02,32,64,32,2,2,8,0.0,925.312,264.746,351.8476599999997,8.11148666268801,2,-1,-1,32x4096x8192,0,"path_reordered,ASCEND_HOME_PATH_set,ASCEND_TOOLKIT_HOME_set;timing=npu_profiler_batch_chunked(max_steps=2048);npu_profiler_batch_offline_kernel_step"
2026-03-03T10:12:02.048548+00:00,FULL,llm_style,eval,llm_style_eval_107,64,6144,1536,fp16,Ascend910B2,c02,32,64,32,2,2,8,0.0,0.0,137.101,178.70699999999988,8.810727507458006,1,-1,-1,64x6144x1536,0,"path_reordered,ASCEND_HOME_PATH_set,ASCEND_TOOLKIT_HOME_set;timing=npu_profiler_batch_chunked(max_steps=2048);npu_profiler_batch_offline_kernel_step"
2026-03-03T10:12:02.244697+00:00,FULL,llm_style,eval,llm_style_eval_108,8,3072,1536,fp16,Ascend910B2,c02,32,64,32,2,2,8,0.0,196.105,55.051,68.29339999999996,1.3714096383353618,7,-1,-1,8x3072x1536,0,"path_reordered,ASCEND_HOME_PATH_set,ASCEND_TOOLKIT_HOME_set;timing=npu_profiler_batch_chunked(max_steps=2048);npu_profiler_batch_offline_kernel_step"
2026-03-03T10:12:02.367105+00:00,FULL,llm_style,eval,llm_style_eval_109,16,2048,1024,fp16,Ascend910B2,c00,32,32,32,2,2,8,0.0,122.312,52.58,63.58601999999998,1.2763192088246482,7,-1,-1,16x2048x1024,0,"path_reordered,ASCEND_HOME_PATH_set,ASCEND_TOOLKIT_HOME_set;timing=npu_profiler_batch_chunked(max_steps=2048);npu_profiler_batch_offline_kernel_step"
2026-03-03T10:12:04.110734+00:00,FULL,llm_style,eval,llm_style_eval_110,1,8192,8192,fp16,Ascend910B2,c02,32,64,32,2,2,8,0.0,1743.504,412.058,559.0166799999995,0.3257253299292818,4,-1,-1,1x8192x8192,0,"path_reordered,ASCEND_HOME_PATH_set,ASCEND_TOOLKIT_HOME_set;timing=npu_profiler_batch_chunked(max_steps=2048);npu_profiler_batch_offline_kernel_step"
2026-03-03T10:12:04.437256+00:00,FULL,llm_style,eval,llm_style_eval_111,8,6144,1536,fp16,Ascend910B2,c02,32,64,32,2,2,8,0.0,326.411,84.44200000000001,104.02039999999994,1.7881497832832003,5,-1,-1,8x6144x1536,0,"path_reordered,ASCEND_HOME_PATH_set,ASCEND_TOOLKIT_HOME_set;timing=npu_profiler_batch_chunked(max_steps=2048);npu_profiler_batch_offline_kernel_step"
2026-03-03T10:12:04.437348+00:00,FULL,llm_style,eval,llm_style_eval_112,2,6144,3072,fp16,Ascend910B2,c02,32,64,32,2,2,8,0.0,0.0,133.562,177.49201999999985,0.5652616163279974,5,-1,-1,2x6144x3072,0,"path_reordered,ASCEND_HOME_PATH_set,ASCEND_TOOLKIT_HOME_set;timing=npu_profiler_batch_chunked(max_steps=2048);npu_profiler_batch_offline_kernel_step"
2026-03-03T10:12:04.437378+00:00,FULL,llm_style,eval,llm_style_eval_113,1,8192,8192,fp16,Ascend910B2,c02,32,64,32,2,2,8,0.0,0.0,411.51800000000003,453.02161999999987,0.3261527515199821,4,-1,-1,1x8192x8192,0,"path_reordered,ASCEND_HOME_PATH_set,ASCEND_TOOLKIT_HOME_set;timing=npu_profiler_batch_chunked(max_steps=2048);npu_profiler_batch_offline_kernel_step"
2026-03-03T10:12:04.592857+00:00,FULL,llm_style,eval,llm_style_eval_114,1,3072,1024,fp16,Ascend910B2,c01,64,32,32,2,2,8,0.0,155.435,58.291,70.77761999999996,0.10793185912061898,7,-1,-1,1x3072x1024,0,"path_reordered,ASCEND_HOME_PATH_set,ASCEND_TOOLKIT_HOME_set;timing=npu_profiler_batch_chunked(max_steps=2048);npu_profiler_batch_offline_kernel_step"
2026-03-03T10:12:04.782207+00:00,FULL,llm_style,eval,llm_style_eval_115,16,3072,1536,fp16,Ascend910B2,c02,32,64,32,2,2,8,0.0,189.252,53.75,67.24141999999995,2.809208260465116,7,-1,-1,16x3072x1536,0,"path_reordered,ASCEND_HOME_PATH_set,ASCEND_TOOLKIT_HOME_set;timing=npu_profiler_batch_chunked(max_steps=2048);npu_profiler_batch_offline_kernel_step"
2026-03-03T10:12:04.948385+00:00,FULL,llm_style,eval,llm_style_eval_116,8,3072,1024,fp16,Ascend910B2,c02,32,64,32,2,2,8,0.0,166.057,42.010000000000005,48.79721999999998,1.198087312544632,7,-1,-1,8x3072x1024,0,"path_reordered,ASCEND_HOME_PATH_set,ASCEND_TOOLKIT_HOME_set;timing=npu_profiler_batch_chunked(max_steps=2048);npu_profiler_batch_offline_kernel_step"
2026-03-03T10:12:05.127644+00:00,FULL,llm_style,eval,llm_style_eval_117,4,1024,4096,fp16,Ascend910B2,c02,32,64,32,2,2,8,0.0,179.165,50.971000000000004,65.01579999999996,0.6583043691510858,7,-1,-1,4x1024x4096,0,"path_reordered,ASCEND_HOME_PATH_set,ASCEND_TOOLKIT_HOME_set;timing=npu_profiler_batch_chunked(max_steps=2048);npu_profiler_batch_offline_kernel_step"
2026-03-03T10:12:05.127730+00:00,FULL,llm_style,eval,llm_style_eval_118,64,6144,3072,fp16,Ascend910B2,c02,32,64,32,2,2,8,0.0,0.0,258.586,342.57703999999967,9.342807050652395,1,-1,-1,64x6144x3072,0,"path_reordered,ASCEND_HOME_PATH_set,ASCEND_TOOLKIT_HOME_set;timing=npu_profiler_batch_chunked(max_steps=2048);npu_profiler_batch_offline_kernel_step"
2026-03-03T10:12:06.496688+00:00,FULL,llm_style,eval,llm_style_eval_119,64,8192,6144,fp16,Ascend910B2,c02,32,64,32,2,2,8,0.0,1368.905,660.463,843.2916599999994,9.754446417134648,1,-1,-1,64x8192x6144,0,"path_reordered,ASCEND_HOME_PATH_set,ASCEND_TOOLKIT_HOME_set;timing=npu_profiler_batch_chunked(max_steps=2048);npu_profiler_batch_offline_kernel_step"
2026-03-03T10:12:06.677580+00:00,FULL,llm_style,eval,llm_style_eval_120,8,1024,4096,fp16,Ascend910B2,c02,32,64,32,2,2,8,0.0,180.794,51.472,68.09077999999994,1.3037935965184955,7,-1,-1,8x1024x4096,0,"path_reordered,ASCEND_HOME_PATH_set,ASCEND_TOOLKIT_HOME_set;timing=npu_profiler_batch_chunked(max_steps=2048);npu_profiler_batch_offline_kernel_step"
2026-03-03T10:12:06.808963+00:00,FULL,llm_style,eval,llm_style_eval_121,4,1024,2048,fp16,Ascend910B2,c02,32,64,32,2,2,8,0.0,131.287,29.729999999999997,35.91499999999998,0.5643194080053818,7,-1,-1,4x1024x2048,0,"path_reordered,ASCEND_HOME_PATH_set,ASCEND_TOOLKIT_HOME_set;timing=npu_profiler_batch_chunked(max_steps=2048);npu_profiler_batch_offline_kernel_step"
2026-03-03T10:12:07.516440+00:00,FULL,llm_style,eval,llm_style_eval_122,4,6144,4096,fp16,Ascend910B2,c02,32,64,32,2,2,8,0.0,707.39,176.964,234.6238199999998,1.1376697633416966,5,-1,-1,4x6144x4096,0,"path_reordered,ASCEND_HOME_PATH_set,ASCEND_TOOLKIT_HOME_set;timing=npu_profiler_batch_chunked(max_steps=2048);npu_profiler_batch_offline_kernel_step"
2026-03-03T10:12:08.206848+00:00,FULL,llm_style,eval,llm_style_eval_123,4,3072,8192,fp16,Ascend910B2,c02,32,64,32,2,2,8,0.0,690.307,175.723,231.6653999999998,1.145704273202711,6,-1,-1,4x3072x8192,0,"path_reordered,ASCEND_HOME_PATH_set,ASCEND_TOOLKIT_HOME_set;timing=npu_profiler_batch_chunked(max_steps=2048);npu_profiler_batch_offline_kernel_step"
2026-03-03T10:12:08.206930+00:00,FULL,llm_style,eval,llm_style_eval_124,64,6144,1024,fp16,Ascend910B2,c02,32,64,32,2,2,8,0.0,0.0,96.411,123.82223999999991,8.35284737218782,1,-1,-1,64x6144x1024,0,"path_reordered,ASCEND_HOME_PATH_set,ASCEND_TOOLKIT_HOME_set;timing=npu_profiler_batch_chunked(max_steps=2048);npu_profiler_batch_offline_kernel_step"
2026-03-03T10:12:08.206966+00:00,FULL,llm_style,eval,llm_style_eval_125,64,1536,8192,fp16,Ascend910B2,c02,32,64,32,2,2,8,0.0,0.0,171.904,232.78583999999978,9.369256887565154,2,-1,-1,64x1536x8192,0,"path_reordered,ASCEND_HOME_PATH_set,ASCEND_TOOLKIT_HOME_set;timing=npu_profiler_batch_chunked(max_steps=2048);npu_profiler_batch_offline_kernel_step"
2026-03-03T10:12:08.206988+00:00,FULL,llm_style,eval,llm_style_eval_126,64,2048,8192,fp16,Ascend910B2,c02,32,64,32,2,2,8,0.0,0.0,249.995,318.87319999999977,8.590106394127883,2,-1,-1,64x2048x8192,0,"path_reordered,ASCEND_HOME_PATH_set,ASCEND_TOOLKIT_HOME_set;timing=npu_profiler_batch_chunked(max_steps=2048);npu_profiler_batch_offline_kernel_step"
2026-03-03T10:12:08.598820+00:00,FULL,llm_style,eval,llm_style_eval_127,2,8192,1536,fp16,Ascend910B2,c02,32,64,32,2,2,8,0.0,391.789,92.87299999999999,118.9822199999999,0.5419405855307786,5,-1,-1,2x8192x1536,0,"path_reordered,ASCEND_HOME_PATH_set,ASCEND_TOOLKIT_HOME_set;timing=npu_profiler_batch_chunked(max_steps=2048);npu_profiler_batch_offline_kernel_step"
2026-03-03T10:12:08.772289+00:00,FULL,llm_style,eval,llm_style_eval_128,8,2048,2048,fp16,Ascend910B2,c02,32,64,32,2,2,8,0.0,173.366,58.801,73.15501999999996,1.1412878012278704,7,-1,-1,8x2048x2048,0,"path_reordered,ASCEND_HOME_PATH_set,ASCEND_TOOLKIT_HOME_set;timing=npu_profiler_batch_chunked(max_steps=2048);npu_profiler_batch_offline_kernel_step"
2026-03-03T10:12:08.772374+00:00,FULL,llm_style,eval,llm_style_eval_129,64,8192,6144,fp16,Ascend910B2,c02,32,64,32,2,2,8,0.0,0.0,658.223,843.5656599999993,9.7876417931309,1,-1,-1,64x8192x6144,0,"path_reordered,ASCEND_HOME_PATH_set,ASCEND_TOOLKIT_HOME_set;timing=npu_profiler_batch_chunked(max_steps=2048);npu_profiler_batch_offline_kernel_step"
2026-03-03T10:12:08.772403+00:00,FULL,llm_style,eval,llm_style_eval_130,16,3072,1536,fp16,Ascend910B2,c02,32,64,32,2,2,8,0.0,0.0,53.489999999999995,69.65499999999994,2.822863039820527,7,-1,-1,16x3072x1536,0,"path_reordered,ASCEND_HOME_PATH_set,ASCEND_TOOLKIT_HOME_set;timing=npu_profiler_batch_chunked(max_steps=2048);npu_profiler_batch_offline_kernel_step"
2026-03-03T10:12:10.494789+00:00,FULL,llm_style,eval,llm_style_eval_131,32,8192,8192,fp16,Ascend910B2,c02,32,64,32,2,2,8,0.0,1722.305,484.089,627.7100599999994,8.872267901150408,0,-1,-1,32x8192x8192,0,"path_reordered,ASCEND_HOME_PATH_set,ASCEND_TOOLKIT_HOME_set;timing=npu_profiler_batch_chunked(max_steps=2048);npu_profiler_batch_offline_kernel_step"
2026-03-03T10:12:11.419781+00:00,FULL,llm_style,eval,llm_style_eval_132,32,8192,4096,fp16,Ascend910B2,c02,32,64,32,2,2,8,0.0,924.892,254.865,328.75103999999976,8.425965307123379,1,-1,-1,32x8192x4096,0,"path_reordered,ASCEND_HOME_PATH_set,ASCEND_TOOLKIT_HOME_set;timing=npu_profiler_batch_chunked(max_steps=2048);npu_profiler_batch_offline_kernel_step"
2026-03-03T10:12:13.098581+00:00,FULL,llm_style,eval,llm_style_eval_133,2,8192,8192,fp16,Ascend910B2,c02,32,64,32,2,2,8,0.0,1678.694,431.469,576.5224399999995,0.6221430879159338,4,-1,-1,2x8192x8192,0,"path_reordered,ASCEND_HOME_PATH_set,ASCEND_TOOLKIT_HOME_set;timing=npu_profiler_batch_chunked(max_steps=2048);npu_profiler_batch_offline_kernel_step"
2026-03-03T10:12:13.405660+00:00,FULL,llm_style,eval,llm_style_eval_134,64,3072,3072,fp16,Ascend910B2,c02,32,64,32,2,2,8,0.0,306.972,135.562,176.71241999999984,8.91075339696965,3,-1,-1,64x3072x3072,0,"path_reordered,ASCEND_HOME_PATH_set,ASCEND_TOOLKIT_HOME_set;timing=npu_profiler_batch_chunked(max_steps=2048);npu_profiler_batch_offline_kernel_step"
2026-03-03T10:12:13.731700+00:00,FULL,llm_style,eval,llm_style_eval_135,8,3072,3072,fp16,Ascend910B2,c02,32,64,32,2,2,8,0.0,325.939,87.872,111.54523999999994,1.7183510560815733,7,-1,-1,8x3072x3072,0,"path_reordered,ASCEND_HOME_PATH_set,ASCEND_TOOLKIT_HOME_set;timing=npu_profiler_batch_chunked(max_steps=2048);npu_profiler_batch_offline_kernel_step"
2026-03-03T10:12:14.026527+00:00,FULL,llm_style,eval,llm_style_eval_136,4,2048,4096,fp16,Ascend910B2,c02,32,64,32,2,2,8,0.0,294.714,95.503,115.91419999999994,0.7026885438153776,7,-1,-1,4x2048x4096,0,"path_reordered,ASCEND_HOME_PATH_set,ASCEND_TOOLKIT_HOME_set;timing=npu_profiler_batch_chunked(max_steps=2048);npu_profiler_batch_offline_kernel_step"
2026-03-03T10:12:15.743968+00:00,FULL,llm_style,eval,llm_style_eval_137,4,8192,8192,fp16,Ascend910B2,c02,32,64,32,2,2,8,0.0,1717.329,443.279,593.9624599999994,1.2111354519388466,4,-1,-1,4x8192x8192,0,"path_reordered,ASCEND_HOME_PATH_set,ASCEND_TOOLKIT_HOME_set;timing=npu_profiler_batch_chunked(max_steps=2048);npu_profiler_batch_offline_kernel_step"
2026-03-03T10:12:15.842759+00:00,FULL,llm_style,eval,llm_style_eval_138,16,1024,1024,fp16,Ascend910B2,c02,32,64,32,2,2,8,0.0,98.698,18.741,21.007579999999994,1.7904291126407343,7,-1,-1,16x1024x1024,0,"path_reordered,ASCEND_HOME_PATH_set,ASCEND_TOOLKIT_HOME_set;timing=npu_profiler_batch_chunked(max_steps=2048);npu_profiler_batch_offline_kernel_step"
2026-03-03T10:12:15.951184+00:00,FULL,llm_style,eval,llm_style_eval_139,4,1024,1024,fp16,Ascend910B2,c01,64,32,32,2,2,8,0.0,108.36,35.032,40.59201999999999,0.23945558346654489,7,-1,-1,4x1024x1024,0,"path_reordered,ASCEND_HOME_PATH_set,ASCEND_TOOLKIT_HOME_set;timing=npu_profiler_batch_chunked(max_steps=2048);npu_profiler_batch_offline_kernel_step"
2026-03-03T10:12:15.951249+00:00,FULL,llm_style,eval,llm_style_eval_140,64,4096,6144,fp16,Ascend910B2,c02,32,64,32,2,2,8,0.0,0.0,353.957,483.1220599999995,9.100612424673052,3,-1,-1,64x4096x6144,0,"path_reordered,ASCEND_HOME_PATH_set,ASCEND_TOOLKIT_HOME_set;timing=npu_profiler_batch_chunked(max_steps=2048);npu_profiler_batch_offline_kernel_step"
2026-03-03T10:12:15.951282+00:00,FULL,llm_style,eval,llm_style_eval_141,4,6144,4096,fp16,Ascend910B2,c02,32,64,32,2,2,8,0.0,0.0,176.30200000000002,240.91561999999976,1.1419416228970742,5,-1,-1,4x6144x4096,0,"path_reordered,ASCEND_HOME_PATH_set,ASCEND_TOOLKIT_HOME_set;timing=npu_profiler_batch_chunked(max_steps=2048);npu_profiler_batch_offline_kernel_step"
2026-03-03T10:12:16.335848+00:00,FULL,llm_style,eval,llm_style_eval_142,4,2048,6144,fp16,Ascend910B2,c02,32,64,32,2,2,8,0.0,384.526,136.34199999999998,169.8479999999999,0.7383146499244547,7,-1,-1,4x2048x6144,0,"path_reordered,ASCEND_HOME_PATH_set,ASCEND_TOOLKIT_HOME_set;timing=npu_profiler_batch_chunked(max_steps=2048);npu_profiler_batch_offline_kernel_step"
2026-03-03T10:12:16.335938+00:00,FULL,llm_style,eval,llm_style_eval_143,64,1536,8192,fp16,Ascend910B2,c02,32,64,32,2,2,8,0.0,0.0,175.983,228.9249999999998,9.152092736230205,2,-1,-1,64x1536x8192,0,"path_reordered,ASCEND_HOME_PATH_set,ASCEND_TOOLKIT_HOME_set;timing=npu_profiler_batch_chunked(max_steps=2048);npu_profiler_batch_offline_kernel_step"
2026-03-03T10:12:16.644881+00:00,FULL,llm_style,eval,llm_style_eval_144,1,3072,3072,fp16,Ascend910B2,c02,32,64,32,2,2,8,0.0,308.895,76.642,93.73521999999994,0.2462666423110044,7,-1,-1,1x3072x3072,0,"path_reordered,ASCEND_HOME_PATH_set,ASCEND_TOOLKIT_HOME_set;timing=npu_profiler_batch_chunked(max_steps=2048);npu_profiler_batch_offline_kernel_step"
2026-03-03T10:12:16.644962+00:00,FULL,llm_style,eval,llm_style_eval_145,32,1024,2048,fp16,Ascend910B2,c01,64,32,32,2,2,8,0.0,0.0,67.66,80.49737999999998,1.983708660951818,3,-1,-1,32x1024x2048,0,"path_reordered,ASCEND_HOME_PATH_set,ASCEND_TOOLKIT_HOME_set;timing=npu_profiler_batch_chunked(max_steps=2048);npu_profiler_batch_offline_kernel_step"
2026-03-03T10:12:16.644989+00:00,FULL,llm_style,eval,llm_style_eval_146,64,8192,4096,fp16,Ascend910B2,c02,32,64,32,2,2,8,0.0,0.0,443.459,565.0488399999996,9.685150816648212,1,-1,-1,64x8192x4096,0,"path_reordered,ASCEND_HOME_PATH_set,ASCEND_TOOLKIT_HOME_set;timing=npu_profiler_batch_chunked(max_steps=2048);npu_profiler_batch_offline_kernel_step"
2026-03-03T10:12:16.645011+00:00,FULL,llm_style,eval,llm_style_eval_147,64,2048,4096,fp16,Ascend910B2,c02,32,64,32,2,2,8,0.0,0.0,132.512,167.0628199999999,8.102978024631732,3,-1,-1,64x2048x4096,0,"path_reordered,ASCEND_HOME_PATH_set,ASCEND_TOOLKIT_HOME_set;timing=npu_profiler_batch_chunked(max_steps=2048);npu_profiler_batch_offline_kernel_step"
2026-03-03T10:12:16.645031+00:00,FULL,llm_style,eval,llm_style_eval_148,64,1024,6144,fp16,Ascend910B2,c02,32,64,32,2,2,8,0.0,0.0,132.361,165.98559999999986,6.084166544525955,3,-1,-1,64x1024x6144,0,"path_reordered,ASCEND_HOME_PATH_set,ASCEND_TOOLKIT_HOME_set;timing=npu_profiler_batch_chunked(max_steps=2048);npu_profiler_batch_offline_kernel_step"
2026-03-03T10:12:17.580876+00:00,FULL,llm_style,eval,llm_style_eval_149,64,4096,8192,fp16,Ascend910B2,c02,32,64,32,2,2,8,0.0,935.783,464.099,642.9888599999994,9.25442049217947,2,-1,-1,64x4096x8192,0,"path_reordered,ASCEND_HOME_PATH_set,ASCEND_TOOLKIT_HOME_set;timing=npu_profiler_batch_chunked(max_steps=2048);npu_profiler_batch_offline_kernel_step"
2026-03-03T10:12:17.808700+00:00,FULL,llm_style,eval,llm_style_eval_150,2,2048,3072,fp16,Ascend910B2,c02,32,64,32,2,2,8,0.0,227.722,72.37100000000001,86.63897999999996,0.34773353967749504,7,-1,-1,2x2048x3072,0,"path_reordered,ASCEND_HOME_PATH_set,ASCEND_TOOLKIT_HOME_set;timing=npu_profiler_batch_chunked(max_steps=2048);npu_profiler_batch_offline_kernel_step"
2026-03-03T10:12:18.100640+00:00,FULL,llm_style,eval,llm_style_eval_151,64,4096,2048,fp16,Ascend910B2,c02,32,64,32,2,2,8,0.0,291.838,126.102,164.52339999999987,8.514867519944172,3,-1,-1,64x4096x2048,0,"path_reordered,ASCEND_HOME_PATH_set,ASCEND_TOOLKIT_HOME_set;timing=npu_profiler_batch_chunked(max_steps=2048);npu_profiler_batch_offline_kernel_step"
2026-03-03T10:12:19.810965+00:00,FULL,llm_style,eval,llm_style_eval_152,8,8192,8192,fp16,Ascend910B2,c02,32,64,32,2,2,8,0.0,1710.23,452.79999999999995,608.3014399999995,2.3713379505300356,4,-1,-1,8x8192x8192,0,"path_reordered,ASCEND_HOME_PATH_set,ASCEND_TOOLKIT_HOME_set;timing=npu_profiler_batch_chunked(max_steps=2048);npu_profiler_batch_offline_kernel_step"
2026-03-03T10:12:19.811051+00:00,FULL,llm_style,eval,llm_style_eval_153,64,8192,2048,fp16,Ascend910B2,c02,32,64,32,2,2,8,0.0,0.0,230.885,294.02301999999975,9.30109642462698,1,-1,-1,64x8192x2048,0,"path_reordered,ASCEND_HOME_PATH_set,ASCEND_TOOLKIT_HOME_set;timing=npu_profiler_batch_chunked(max_steps=2048);npu_profiler_batch_offline_kernel_step"
2026-03-03T10:12:20.300285+00:00,FULL,llm_style,eval,llm_style_eval_154,16,2048,8192,fp16,Ascend910B2,c02,32,64,32,2,2,8,0.0,489.188,183.143,229.26039999999983,2.9314301502104914,6,-1,-1,16x2048x8192,0,"path_reordered,ASCEND_HOME_PATH_set,ASCEND_TOOLKIT_HOME_set;timing=npu_profiler_batch_chunked(max_steps=2048);npu_profiler_batch_offline_kernel_step"
2026-03-03T10:12:20.453535+00:00,FULL,llm_style,eval,llm_style_eval_155,4,2048,1536,fp16,Ascend910B2,c02,32,64,32,2,2,8,0.0,153.153,46.341,53.93981999999998,0.5430574221531689,7,-1,-1,4x2048x1536,0,"path_reordered,ASCEND_HOME_PATH_set,ASCEND_TOOLKIT_HOME_set;timing=npu_profiler_batch_chunked(max_steps=2048);npu_profiler_batch_offline_kernel_step"
2026-03-03T10:12:20.453615+00:00,FULL,llm_style,eval,llm_style_eval_156,1,4096,6144,fp16,Ascend910B2,c02,32,64,32,2,2,8,0.0,0.0,173.574,240.83663999999976,0.28997227695392164,7,-1,-1,1x4096x6144,0,"path_reordered,ASCEND_HOME_PATH_set,ASCEND_TOOLKIT_HOME_set;timing=npu_profiler_batch_chunked(max_steps=2048);npu_profiler_batch_offline_kernel_step"
2026-03-03T10:12:20.831366+00:00,FULL,llm_style,eval,llm_style_eval_157,1,1536,8192,fp16,Ascend910B2,c02,32,64,32,2,2,8,0.0,377.706,93.182,120.83379999999991,0.27007173059174516,6,-1,-1,1x1536x8192,0,"path_reordered,ASCEND_HOME_PATH_set,ASCEND_TOOLKIT_HOME_set;timing=npu_profiler_batch_chunked(max_steps=2048);npu_profiler_batch_offline_kernel_step"
2026-03-03T10:12:20.831448+00:00,FULL,llm_style,eval,llm_style_eval_158,64,1536,8192,fp16,Ascend910B2,c02,32,64,32,2,2,8,0.0,0.0,172.69299999999998,229.20723999999979,9.326450614674595,2,-1,-1,64x1536x8192,0,"path_reordered,ASCEND_HOME_PATH_set,ASCEND_TOOLKIT_HOME_set;timing=npu_profiler_batch_chunked(max_steps=2048);npu_profiler_batch_offline_kernel_step"
2026-03-03T10:12:21.137404+00:00,FULL,llm_style,eval,llm_style_eval_159,16,6144,1536,fp16,Ascend910B2,c02,32,64,32,2,2,8,0.0,305.911,86.342,109.92117999999994,3.4976012601051636,5,-1,-1,16x6144x1536,0,"path_reordered,ASCEND_HOME_PATH_set,ASCEND_TOOLKIT_HOME_set;timing=npu_profiler_batch_chunked(max_steps=2048);npu_profiler_batch_offline_kernel_step"
2026-03-03T10:12:21.137485+00:00,FULL,llm_style,eval,llm_style_eval_160,32,6144,6144,fp16,Ascend910B2,c02,32,64,32,2,2,8,0.0,0.0,287.79600000000005,374.76223999999974,8.394554142517615,1,-1,-1,32x6144x6144,0,"path_reordered,ASCEND_HOME_PATH_set,ASCEND_TOOLKIT_HOME_set;timing=npu_profiler_batch_chunked(max_steps=2048);npu_profiler_batch_offline_kernel_step"
2026-03-03T10:12:21.376111+00:00,FULL,llm_style,eval,llm_style_eval_161,2,1536,4096,fp16,Ascend910B2,c02,32,64,32,2,2,8,0.0,238.579,61.0,78.07139999999994,0.4125544918032787,7,-1,-1,2x1536x4096,0,"path_reordered,ASCEND_HOME_PATH_set,ASCEND_TOOLKIT_HOME_set;timing=npu_profiler_batch_chunked(max_steps=2048);npu_profiler_batch_offline_kernel_step"
2026-03-03T10:12:21.567309+00:00,FULL,llm_style,eval,llm_style_eval_162,64,1536,3072,fp16,Ascend910B2,c02,32,64,32,2,2,8,0.0,191.086,73.543,93.81957999999995,8.212607263777652,3,-1,-1,64x1536x3072,0,"path_reordered,ASCEND_HOME_PATH_set,ASCEND_TOOLKIT_HOME_set;timing=npu_profiler_batch_chunked(max_steps=2048);npu_profiler_batch_offline_kernel_step"
2026-03-03T10:12:21.567386+00:00,FULL,llm_style,eval,llm_style_eval_163,64,1024,8192,fp16,Ascend910B2,c02,32,64,32,2,2,8,0.0,0.0,168.733,218.98463999999984,6.363555581895657,2,-1,-1,64x1024x8192,0,"path_reordered,ASCEND_HOME_PATH_set,ASCEND_TOOLKIT_HOME_set;timing=npu_profiler_batch_chunked(max_steps=2048);npu_profiler_batch_offline_kernel_step"
2026-03-03T10:12:21.567413+00:00,FULL,llm_style,eval,llm_style_eval_164,64,4096,8192,fp16,Ascend910B2,c02,32,64,32,2,2,8,0.0,0.0,463.71,643.0576599999994,9.262183899419897,2,-1,-1,64x4096x8192,0,"path_reordered,ASCEND_HOME_PATH_set,ASCEND_TOOLKIT_HOME_set;timing=npu_profiler_batch_chunked(max_steps=2048);npu_profiler_batch_offline_kernel_step"
2026-03-03T10:12:22.249612+00:00,FULL,llm_style,eval,llm_style_eval_165,4,8192,3072,fp16,Ascend910B2,c02,32,64,32,2,2,8,0.0,682.158,174.114,227.2773999999998,1.1562918088149143,5,-1,-1,4x8192x3072,0,"path_reordered,ASCEND_HOME_PATH_set,ASCEND_TOOLKIT_HOME_set;timing=npu_profiler_batch_chunked(max_steps=2048);npu_profiler_batch_offline_kernel_step"
2026-03-03T10:12:22.249695+00:00,FULL,llm_style,eval,llm_style_eval_166,64,1024,6144,fp16,Ascend910B2,c02,32,64,32,2,2,8,0.0,0.0,131.122,166.62999999999988,6.141657143728741,3,-1,-1,64x1024x6144,0,"path_reordered,ASCEND_HOME_PATH_set,ASCEND_TOOLKIT_HOME_set;timing=npu_profiler_batch_chunked(max_steps=2048);npu_profiler_batch_offline_kernel_step"
2026-03-03T10:12:22.377943+00:00,FULL,llm_style,eval,llm_style_eval_167,2,2048,1024,fp16,Ascend910B2,c00,32,32,32,2,2,8,0.0,128.204,43.22,53.88599999999998,0.19409088385006942,7,-1,-1,2x2048x1024,0,"path_reordered,ASCEND_HOME_PATH_set,ASCEND_TOOLKIT_HOME_set;timing=npu_profiler_batch_chunked(max_steps=2048);npu_profiler_batch_offline_kernel_step"
2026-03-03T10:12:22.555241+00:00,FULL,llm_style,eval,llm_style_eval_168,64,4096,1024,fp16,Ascend910B2,c02,32,64,32,2,2,8,0.0,177.201,69.301,88.14879999999994,7.746943218712572,3,-1,-1,64x4096x1024,0,"path_reordered,ASCEND_HOME_PATH_set,ASCEND_TOOLKIT_HOME_set;timing=npu_profiler_batch_chunked(max_steps=2048);npu_profiler_batch_offline_kernel_step"
2026-03-03T10:12:22.866555+00:00,FULL,llm_style,eval,llm_style_eval_169,4,1536,6144,fp16,Ascend910B2,c02,32,64,32,2,2,8,0.0,311.218,83.21199999999999,105.55979999999994,0.9072906792289576,7,-1,-1,4x1536x6144,0,"path_reordered,ASCEND_HOME_PATH_set,ASCEND_TOOLKIT_HOME_set;timing=npu_profiler_batch_chunked(max_steps=2048);npu_profiler_batch_offline_kernel_step"
2026-03-03T10:12:22.866635+00:00,FULL,llm_style,eval,llm_style_eval_170,16,1536,1536,fp16,Ascend910B2,c00,32,32,32,2,2,8,0.0,0.0,57.322,68.42281999999997,1.3170767244687902,7,-1,-1,16x1536x1536,0,"path_reordered,ASCEND_HOME_PATH_set,ASCEND_TOOLKIT_HOME_set;timing=npu_profiler_batch_chunked(max_steps=2048);npu_profiler_batch_offline_kernel_step"
2026-03-03T10:12:23.102816+00:00,FULL,llm_style,eval,llm_style_eval_171,1,2048,3072,fp16,Ascend910B2,c02,32,64,32,2,2,8,0.0,236.137,72.661,89.44519999999994,0.1731728437538707,7,-1,-1,1x2048x3072,0,"path_reordered,ASCEND_HOME_PATH_set,ASCEND_TOOLKIT_HOME_set;timing=npu_profiler_batch_chunked(max_steps=2048);npu_profiler_batch_offline_kernel_step"
2026-03-03T10:12:23.327073+00:00,FULL,llm_style,eval,llm_style_eval_172,64,3072,2048,fp16,Ascend910B2,c02,32,64,32,2,2,8,0.0,224.153,93.472,120.8240199999999,8.615482369051696,3,-1,-1,64x3072x2048,0,"path_reordered,ASCEND_HOME_PATH_set,ASCEND_TOOLKIT_HOME_set;timing=npu_profiler_batch_chunked(max_steps=2048);npu_profiler_batch_offline_kernel_step"
2026-03-03T10:12:23.327154+00:00,FULL,llm_style,eval,llm_style_eval_173,64,8192,6144,fp16,Ascend910B2,c02,32,64,32,2,2,8,0.0,0.0,659.783,850.9816599999992,9.76449975825385,1,-1,-1,64x8192x6144,0,"path_reordered,ASCEND_HOME_PATH_set,ASCEND_TOOLKIT_HOME_set;timing=npu_profiler_batch_chunked(max_steps=2048);npu_profiler_batch_offline_kernel_step"
2026-03-03T10:12:23.807859+00:00,FULL,llm_style,eval,llm_style_eval_174,2,4096,4096,fp16,Ascend910B2,c02,32,64,32,2,2,8,0.0,480.66,126.782,174.96501999999984,0.5293248568408765,7,-1,-1,2x4096x4096,0,"path_reordered,ASCEND_HOME_PATH_set,ASCEND_TOOLKIT_HOME_set;timing=npu_profiler_batch_chunked(max_steps=2048);npu_profiler_batch_offline_kernel_step"
2026-03-03T10:12:23.807942+00:00,FULL,llm_style,eval,llm_style_eval_175,64,4096,2048,fp16,Ascend910B2,c02,32,64,32,2,2,8,0.0,0.0,125.892,167.02719999999985,8.529071140342516,3,-1,-1,64x4096x2048,0,"path_reordered,ASCEND_HOME_PATH_set,ASCEND_TOOLKIT_HOME_set;timing=npu_profiler_batch_chunked(max_steps=2048);npu_profiler_batch_offline_kernel_step"
2026-03-03T10:12:23.807968+00:00,FULL,llm_style,eval,llm_style_eval_176,16,6144,2048,fp16,Ascend910B2,c02,32,64,32,2,2,8,0.0,0.0,112.022,136.63079999999994,3.5944116691364196,5,-1,-1,16x6144x2048,0,"path_reordered,ASCEND_HOME_PATH_set,ASCEND_TOOLKIT_HOME_set;timing=npu_profiler_batch_chunked(max_steps=2048);npu_profiler_batch_offline_kernel_step"
2026-03-03T10:12:24.126718+00:00,FULL,llm_style,eval,llm_style_eval_177,1,6144,1536,fp16,Ascend910B2,c02,32,64,32,2,2,8,0.0,318.709,77.112,98.80061999999992,0.24476563958916903,5,-1,-1,1x6144x1536,0,"path_reordered,ASCEND_HOME_PATH_set,ASCEND_TOOLKIT_HOME_set;timing=npu_profiler_batch_chunked(max_steps=2048);npu_profiler_batch_offline_kernel_step"
2026-03-03T10:12:25.429938+00:00,FULL,llm_style,eval,llm_style_eval_178,32,6144,8192,fp16,Ascend910B2,c02,32,64,32,2,2,8,0.0,1303.123,358.796,475.99023999999963,8.977874535948004,0,-1,-1,32x6144x8192,0,"path_reordered,ASCEND_HOME_PATH_set,ASCEND_TOOLKIT_HOME_set;timing=npu_profiler_batch_chunked(max_steps=2048);npu_profiler_batch_offline_kernel_step"
2026-03-03T10:12:25.430020+00:00,FULL,llm_style,eval,llm_style_eval_179,64,4096,6144,fp16,Ascend910B2,c02,32,64,32,2,2,8,0.0,0.0,354.126,479.71523999999954,9.096269327866354,3,-1,-1,64x4096x6144,0,"path_reordered,ASCEND_HOME_PATH_set,ASCEND_TOOLKIT_HOME_set;timing=npu_profiler_batch_chunked(max_steps=2048);npu_profiler_batch_offline_kernel_step"
2026-03-03T10:12:25.591587+00:00,FULL,llm_style,eval,llm_style_eval_180,64,2048,1536,fp16,Ascend910B2,c02,32,64,32,2,2,8,0.0,161.521,55.902,68.34623999999997,7.202840399270151,3,-1,-1,64x2048x1536,0,"path_reordered,ASCEND_HOME_PATH_set,ASCEND_TOOLKIT_HOME_set;timing=npu_profiler_batch_chunked(max_steps=2048);npu_profiler_batch_offline_kernel_step"
2026-03-03T10:12:25.591663+00:00,FULL,llm_style,eval,llm_style_eval_181,64,2048,3072,fp16,Ascend910B2,c02,32,64,32,2,2,8,0.0,0.0,102.411,128.69439999999992,7.863475290740252,3,-1,-1,64x2048x3072,0,"path_reordered,ASCEND_HOME_PATH_set,ASCEND_TOOLKIT_HOME_set;timing=npu_profiler_batch_chunked(max_steps=2048);npu_profiler_batch_offline_kernel_step"
2026-03-03T10:12:25.776463+00:00,FULL,llm_style,eval,llm_style_eval_182,32,3072,1536,fp16,Ascend910B2,c02,32,64,32,2,2,8,0.0,184.757,56.811,65.83659999999998,5.315693932513069,3,-1,-1,32x3072x1536,0,"path_reordered,ASCEND_HOME_PATH_set,ASCEND_TOOLKIT_HOME_set;timing=npu_profiler_batch_chunked(max_steps=2048);npu_profiler_batch_offline_kernel_step"
2026-03-03T10:12:25.776539+00:00,FULL,llm_style,eval,llm_style_eval_183,8,8192,2048,fp16,Ascend910B2,c02,32,64,32,2,2,8,0.0,0.0,129.143,164.96339999999987,2.07859083341722,5,-1,-1,8x8192x2048,0,"path_reordered,ASCEND_HOME_PATH_set,ASCEND_TOOLKIT_HOME_set;timing=npu_profiler_batch_chunked(max_steps=2048);npu_profiler_batch_offline_kernel_step"
2026-03-03T10:12:25.776565+00:00,FULL,llm_style,eval,llm_style_eval_184,64,8192,1024,fp16,Ascend910B2,c02,32,64,32,2,2,8,0.0,0.0,124.251,161.10919999999987,8.641715752790722,1,-1,-1,64x8192x1024,0,"path_reordered,ASCEND_HOME_PATH_set,ASCEND_TOOLKIT_HOME_set;timing=npu_profiler_batch_chunked(max_steps=2048);npu_profiler_batch_offline_kernel_step"
2026-03-03T10:12:26.149395+00:00,FULL,llm_style,eval,llm_style_eval_185,1,8192,1536,fp16,Ascend910B2,c02,32,64,32,2,2,8,0.0,372.789,95.292,119.63401999999992,0.264091676111321,5,-1,-1,1x8192x1536,0,"path_reordered,ASCEND_HOME_PATH_set,ASCEND_TOOLKIT_HOME_set;timing=npu_profiler_batch_chunked(max_steps=2048);npu_profiler_batch_offline_kernel_step"
2026-03-03T10:12:26.149475+00:00,FULL,llm_style,eval,llm_style_eval_186,16,6144,1024,fp16,Ascend910B2,c02,32,64,32,2,2,8,0.0,0.0,77.702,95.83301999999998,2.591009137473939,5,-1,-1,16x6144x1024,0,"path_reordered,ASCEND_HOME_PATH_set,ASCEND_TOOLKIT_HOME_set;timing=npu_profiler_batch_chunked(max_steps=2048);npu_profiler_batch_offline_kernel_step"
2026-03-03T10:12:26.375288+00:00,FULL,llm_style,eval,llm_style_eval_187,1,1024,6144,fp16,Ascend910B2,c02,32,64,32,2,2,8,0.0,225.768,65.781,86.82223999999992,0.1912848998951065,7,-1,-1,1x1024x6144,0,"path_reordered,ASCEND_HOME_PATH_set,ASCEND_TOOLKIT_HOME_set;timing=npu_profiler_batch_chunked(max_steps=2048);npu_profiler_batch_offline_kernel_step"
2026-03-03T10:12:27.268800+00:00,FULL,llm_style,eval,llm_style_eval_188,8,8192,4096,fp16,Ascend910B2,c02,32,64,32,2,2,8,0.0,893.373,233.286,306.5236399999998,2.3013421808423993,5,-1,-1,8x8192x4096,0,"path_reordered,ASCEND_HOME_PATH_set,ASCEND_TOOLKIT_HOME_set;timing=npu_profiler_batch_chunked(max_steps=2048);npu_profiler_batch_offline_kernel_step"
2026-03-03T10:12:27.747844+00:00,FULL,llm_style,eval,llm_style_eval_189,8,2048,8192,fp16,Ascend910B2,c02,32,64,32,2,2,8,0.0,478.923,175.574,220.63599999999985,1.5289020925649583,6,-1,-1,8x2048x8192,0,"path_reordered,ASCEND_HOME_PATH_set,ASCEND_TOOLKIT_HOME_set;timing=npu_profiler_batch_chunked(max_steps=2048);npu_profiler_batch_offline_kernel_step"
2026-03-03T10:12:28.223755+00:00,FULL,llm_style,eval,llm_style_eval_190,4,8192,2048,fp16,Ascend910B2,c02,32,64,32,2,2,8,0.0,475.82,123.802,163.70379999999986,1.084132146491979,5,-1,-1,4x8192x2048,0,"path_reordered,ASCEND_HOME_PATH_set,ASCEND_TOOLKIT_HOME_set;timing=npu_profiler_batch_chunked(max_steps=2048);npu_profiler_batch_offline_kernel_step"
2026-03-03T10:12:28.223837+00:00,FULL,llm_style,eval,llm_style_eval_191,4,8192,8192,fp16,Ascend910B2,c02,32,64,32,2,2,8,0.0,0.0,441.88800000000003,590.5194599999995,1.2149479325077848,4,-1,-1,4x8192x8192,0,"path_reordered,ASCEND_HOME_PATH_set,ASCEND_TOOLKIT_HOME_set;timing=npu_profiler_batch_chunked(max_steps=2048);npu_profiler_batch_offline_kernel_step"
2026-03-03T10:12:28.223865+00:00,FULL,llm_style,eval,llm_style_eval_192,64,1536,1024,fp16,Ascend910B2,c01,64,32,32,2,2,8,0.0,0.0,55.171,60.93397999999999,3.6491379891609728,3,-1,-1,64x1536x1024,0,"path_reordered,ASCEND_HOME_PATH_set,ASCEND_TOOLKIT_HOME_set;timing=npu_profiler_batch_chunked(max_steps=2048);npu_profiler_batch_offline_kernel_step"
2026-03-03T10:12:28.223903+00:00,FULL,llm_style,eval,llm_style_eval_193,32,2048,2048,fp16,Ascend910B2,c02,32,64,32,2,2,8,0.0,0.0,66.442,80.17479999999996,4.040147135847807,3,-1,-1,32x2048x2048,0,"path_reordered,ASCEND_HOME_PATH_set,ASCEND_TOOLKIT_HOME_set;timing=npu_profiler_batch_chunked(max_steps=2048);npu_profiler_batch_offline_kernel_step"
2026-03-03T10:12:28.223923+00:00,FULL,llm_style,eval,llm_style_eval_194,8,1024,2048,fp16,Ascend910B2,c02,32,64,32,2,2,8,0.0,0.0,30.581,37.50521999999998,1.097231352800759,7,-1,-1,8x1024x2048,0,"path_reordered,ASCEND_HOME_PATH_set,ASCEND_TOOLKIT_HOME_set;timing=npu_profiler_batch_chunked(max_steps=2048);npu_profiler_batch_offline_kernel_step"
2026-03-03T10:12:28.507770+00:00,FULL,llm_style,eval,llm_style_eval_195,2,4096,2048,fp16,Ascend910B2,c02,32,64,32,2,2,8,0.0,283.807,72.632,94.23019999999994,0.4619786320079304,7,-1,-1,2x4096x2048,0,"path_reordered,ASCEND_HOME_PATH_set,ASCEND_TOOLKIT_HOME_set;timing=npu_profiler_batch_chunked(max_steps=2048);npu_profiler_batch_offline_kernel_step"
2026-03-03T10:12:28.507850+00:00,FULL,llm_style,eval,llm_style_eval_196,32,2048,4096,fp16,Ascend910B2,c02,32,64,32,2,2,8,0.0,0.0,106.92099999999999,126.30619999999996,5.02119239438464,3,-1,-1,32x2048x4096,0,"path_reordered,ASCEND_HOME_PATH_set,ASCEND_TOOLKIT_HOME_set;timing=npu_profiler_batch_chunked(max_steps=2048);npu_profiler_batch_offline_kernel_step"
2026-03-03T10:12:28.902276+00:00,FULL,llm_style,eval,llm_style_eval_197,32,8192,1536,fp16,Ascend910B2,c02,32,64,32,2,2,8,0.0,394.381,112.50200000000001,142.91559999999993,7.1581515706387435,1,-1,-1,32x8192x1536,0,"path_reordered,ASCEND_HOME_PATH_set,ASCEND_TOOLKIT_HOME_set;timing=npu_profiler_batch_chunked(max_steps=2048);npu_profiler_batch_offline_kernel_step"
2026-03-03T10:12:28.902350+00:00,FULL,llm_style,eval,llm_style_eval_198,64,4096,8192,fp16,Ascend910B2,c02,32,64,32,2,2,8,0.0,0.0,464.158,646.0130999999993,9.253244145312587,2,-1,-1,64x4096x8192,0,"path_reordered,ASCEND_HOME_PATH_set,ASCEND_TOOLKIT_HOME_set;timing=npu_profiler_batch_chunked(max_steps=2048);npu_profiler_batch_offline_kernel_step"
2026-03-03T10:12:29.786320+00:00,FULL,llm_style,eval,llm_style_eval_199,2,8192,4096,fp16,Ascend910B2,c02,32,64,32,2,2,8,0.0,883.919,218.575,294.5150399999998,0.6140580029738076,5,-1,-1,2x8192x4096,0,"path_reordered,ASCEND_HOME_PATH_set,ASCEND_TOOLKIT_HOME_set;timing=npu_profiler_batch_chunked(max_steps=2048);npu_profiler_batch_offline_kernel_step"
2026-03-03T10:12:29.979924+00:00,FULL,llm_style,eval,llm_style_eval_200,1,4096,1024,fp16,Ascend910B2,c02,32,64,32,2,2,8,0.0,193.515,40.451,50.516399999999976,0.20737702405379346,7,-1,-1,1x4096x1024,0,"path_reordered,ASCEND_HOME_PATH_set,ASCEND_TOOLKIT_HOME_set;timing=npu_profiler_batch_chunked(max_steps=2048);npu_profiler_batch_offline_kernel_step"
2026-03-03T10:12:30.373954+00:00,FULL,llm_style,eval,llm_style_eval_201,4,1536,8192,fp16,Ascend910B2,c02,32,64,32,2,2,8,0.0,393.936,101.184,129.3087999999999,0.994853889943074,6,-1,-1,4x1536x8192,0,"path_reordered,ASCEND_HOME_PATH_set,ASCEND_TOOLKIT_HOME_set;timing=npu_profiler_batch_chunked(max_steps=2048);npu_profiler_batch_offline_kernel_step"
2026-03-03T10:12:30.920895+00:00,FULL,llm_style,eval,llm_style_eval_202,1,6144,3072,fp16,Ascend910B2,c02,32,64,32,2,2,8,0.0,546.825,133.85399999999998,178.02641999999986,0.28201425433681476,5,-1,-1,1x6144x3072,0,"path_reordered,ASCEND_HOME_PATH_set,ASCEND_TOOLKIT_HOME_set;timing=npu_profiler_batch_chunked(max_steps=2048);npu_profiler_batch_offline_kernel_step"
2026-03-03T10:12:31.307047+00:00,FULL,llm_style,eval,llm_style_eval_203,16,2048,6144,fp16,Ascend910B2,c02,32,64,32,2,2,8,0.0,386.052,144.463,185.48021999999986,2.7872409128981124,7,-1,-1,16x2048x6144,0,"path_reordered,ASCEND_HOME_PATH_set,ASCEND_TOOLKIT_HOME_set;timing=npu_profiler_batch_chunked(max_steps=2048);npu_profiler_batch_offline_kernel_step"
2026-03-03T10:12:31.427948+00:00,FULL,llm_style,eval,llm_style_eval_204,16,1536,1024,fp16,Ascend910B2,c02,32,64,32,2,2,8,0.0,120.811,26.689999999999998,30.029780000000002,1.8857867366054704,7,-1,-1,16x1536x1024,0,"path_reordered,ASCEND_HOME_PATH_set,ASCEND_TOOLKIT_HOME_set;timing=npu_profiler_batch_chunked(max_steps=2048);npu_profiler_batch_offline_kernel_step"
2026-03-03T10:12:31.428019+00:00,FULL,llm_style,eval,llm_style_eval_205,64,6144,2048,fp16,Ascend910B2,c02,32,64,32,2,2,8,0.0,0.0,177.102,231.0641999999998,9.094266219466748,1,-1,-1,64x6144x2048,0,"path_reordered,ASCEND_HOME_PATH_set,ASCEND_TOOLKIT_HOME_set;timing=npu_profiler_batch_chunked(max_steps=2048);npu_profiler_batch_offline_kernel_step"
2026-03-03T10:12:31.428046+00:00,FULL,llm_style,eval,llm_style_eval_206,4,2048,6144,fp16,Ascend910B2,c02,32,64,32,2,2,8,0.0,0.0,136.183,166.5381999999999,0.7391766666911437,7,-1,-1,4x2048x6144,0,"path_reordered,ASCEND_HOME_PATH_set,ASCEND_TOOLKIT_HOME_set;timing=npu_profiler_batch_chunked(max_steps=2048);npu_profiler_batch_offline_kernel_step"
2026-03-03T10:12:31.742480+00:00,FULL,llm_style,eval,llm_style_eval_207,32,6144,1536,fp16,Ascend910B2,c02,32,64,32,2,2,8,0.0,314.392,94.161,117.38197999999994,6.414330519004683,1,-1,-1,32x6144x1536,0,"path_reordered,ASCEND_HOME_PATH_set,ASCEND_TOOLKIT_HOME_set;timing=npu_profiler_batch_chunked(max_steps=2048);npu_profiler_batch_offline_kernel_step"
2026-03-03T10:12:31.872993+00:00,FULL,llm_style,eval,llm_style_eval_208,4,2048,1024,fp16,Ascend910B2,c02,32,64,32,2,2,8,0.0,130.403,34.971000000000004,40.146979999999985,0.47974653284149726,7,-1,-1,4x2048x1024,0,"path_reordered,ASCEND_HOME_PATH_set,ASCEND_TOOLKIT_HOME_set;timing=npu_profiler_batch_chunked(max_steps=2048);npu_profiler_batch_offline_kernel_step"
2026-03-03T10:12:31.995161+00:00,FULL,llm_style,eval,llm_style_eval_209,1,1024,1536,fp16,Ascend910B2,c02,32,64,32,2,2,8,0.0,122.076,22.98,27.56297999999999,0.13688981723237598,7,-1,-1,1x1024x1536,0,"path_reordered,ASCEND_HOME_PATH_set,ASCEND_TOOLKIT_HOME_set;timing=npu_profiler_batch_chunked(max_steps=2048);npu_profiler_batch_offline_kernel_step"
2026-03-03T10:12:32.686991+00:00,FULL,llm_style,eval,llm_style_eval_210,8,6144,4096,fp16,Ascend910B2,c02,32,64,32,2,2,8,0.0,691.744,182.423,242.9444199999998,2.207250094560445,5,-1,-1,8x6144x4096,0,"path_reordered,ASCEND_HOME_PATH_set,ASCEND_TOOLKIT_HOME_set;timing=npu_profiler_batch_chunked(max_steps=2048);npu_profiler_batch_offline_kernel_step"
2026-03-03T10:12:33.176175+00:00,FULL,llm_style,eval,llm_style_eval_211,4,2048,8192,fp16,Ascend910B2,c02,32,64,32,2,2,8,0.0,489.088,173.244,217.31261999999984,0.7747323312784281,6,-1,-1,4x2048x8192,0,"path_reordered,ASCEND_HOME_PATH_set,ASCEND_TOOLKIT_HOME_set;timing=npu_profiler_batch_chunked(max_steps=2048);npu_profiler_batch_offline_kernel_step"
2026-03-03T10:12:33.277362+00:00,FULL,llm_style,eval,llm_style_eval_212,32,1024,1024,fp16,Ascend910B2,c00,32,32,32,2,2,8,0.0,101.092,39.111000000000004,45.92857999999998,1.715856510955997,3,-1,-1,32x1024x1024,0,"path_reordered,ASCEND_HOME_PATH_set,ASCEND_TOOLKIT_HOME_set;timing=npu_profiler_batch_chunked(max_steps=2048);npu_profiler_batch_offline_kernel_step"
2026-03-03T10:12:33.669482+00:00,FULL,llm_style,eval,llm_style_eval_213,16,3072,4096,fp16,Ascend910B2,c02,32,64,32,2,2,8,0.0,392.037,107.031,134.4431999999999,3.762023936990217,7,-1,-1,16x3072x4096,0,"path_reordered,ASCEND_HOME_PATH_set,ASCEND_TOOLKIT_HOME_set;timing=npu_profiler_batch_chunked(max_steps=2048);npu_profiler_batch_offline_kernel_step"
2026-03-03T10:12:33.669563+00:00,FULL,llm_style,eval,llm_style_eval_214,64,1024,8192,fp16,Ascend910B2,c02,32,64,32,2,2,8,0.0,0.0,170.334,219.08181999999982,6.303743374781312,2,-1,-1,64x1024x8192,0,"path_reordered,ASCEND_HOME_PATH_set,ASCEND_TOOLKIT_HOME_set;timing=npu_profiler_batch_chunked(max_steps=2048);npu_profiler_batch_offline_kernel_step"
2026-03-03T10:12:33.907133+00:00,FULL,llm_style,eval,llm_style_eval_215,4,4096,1536,fp16,Ascend910B2,c02,32,64,32,2,2,8,0.0,237.526,61.031,78.23317999999995,0.8246898789139945,7,-1,-1,4x4096x1536,0,"path_reordered,ASCEND_HOME_PATH_set,ASCEND_TOOLKIT_HOME_set;timing=npu_profiler_batch_chunked(max_steps=2048);npu_profiler_batch_offline_kernel_step"
2026-03-03T10:12:34.105454+00:00,FULL,llm_style,eval,llm_style_eval_216,16,1536,3072,fp16,Ascend910B2,c02,32,64,32,2,2,8,0.0,198.222,51.730999999999995,63.27641999999997,2.918848350118884,7,-1,-1,16x1536x3072,0,"path_reordered,ASCEND_HOME_PATH_set,ASCEND_TOOLKIT_HOME_set;timing=npu_profiler_batch_chunked(max_steps=2048);npu_profiler_batch_offline_kernel_step"
2026-03-03T10:12:34.105535+00:00,FULL,llm_style,eval,llm_style_eval_217,8,6144,2048,fp16,Ascend910B2,c02,32,64,32,2,2,8,0.0,0.0,108.501,132.97677999999993,1.8555275250919345,5,-1,-1,8x6144x2048,0,"path_reordered,ASCEND_HOME_PATH_set,ASCEND_TOOLKIT_HOME_set;timing=npu_profiler_batch_chunked(max_steps=2048);npu_profiler_batch_offline_kernel_step"
2026-03-03T10:12:34.490022+00:00,FULL,llm_style,eval,llm_style_eval_218,8,3072,4096,fp16,Ascend910B2,c02,32,64,32,2,2,8,0.0,384.419,102.771,130.9045999999999,1.9589825145225794,7,-1,-1,8x3072x4096,0,"path_reordered,ASCEND_HOME_PATH_set,ASCEND_TOOLKIT_HOME_set;timing=npu_profiler_batch_chunked(max_steps=2048);npu_profiler_batch_offline_kernel_step"
2026-03-03T10:12:35.234499+00:00,FULL,llm_style,eval,llm_style_eval_219,64,8192,3072,fp16,Ascend910B2,c02,32,64,32,2,2,8,0.0,744.37,338.027,429.32765999999964,9.529491644158604,1,-1,-1,64x8192x3072,0,"path_reordered,ASCEND_HOME_PATH_set,ASCEND_TOOLKIT_HOME_set;timing=npu_profiler_batch_chunked(max_steps=2048);npu_profiler_batch_offline_kernel_step"
2026-03-03T10:12:35.234577+00:00,FULL,llm_style,eval,llm_style_eval_220,2,4096,2048,fp16,Ascend910B2,c02,32,64,32,2,2,8,0.0,0.0,72.66,99.05279999999992,0.46180060556014313,7,-1,-1,2x4096x2048,0,"path_reordered,ASCEND_HOME_PATH_set,ASCEND_TOOLKIT_HOME_set;timing=npu_profiler_batch_chunked(max_steps=2048);npu_profiler_batch_offline_kernel_step"
2026-03-03T10:12:35.528084+00:00,FULL,llm_style,eval,llm_style_eval_221,4,1024,8192,fp16,Ascend910B2,c02,32,64,32,2,2,8,0.0,293.463,89.643,119.29021999999989,0.7486235846636101,6,-1,-1,4x1024x8192,0,"path_reordered,ASCEND_HOME_PATH_set,ASCEND_TOOLKIT_HOME_set;timing=npu_profiler_batch_chunked(max_steps=2048);npu_profiler_batch_offline_kernel_step"
2026-03-03T10:12:35.528165+00:00,FULL,llm_style,eval,llm_style_eval_222,64,6144,2048,fp16,Ascend910B2,c02,32,64,32,2,2,8,0.0,0.0,176.65300000000002,229.1202199999998,9.117381170996246,1,-1,-1,64x6144x2048,0,"path_reordered,ASCEND_HOME_PATH_set,ASCEND_TOOLKIT_HOME_set;timing=npu_profiler_batch_chunked(max_steps=2048);npu_profiler_batch_offline_kernel_step"
2026-03-03T10:12:35.701745+00:00,FULL,llm_style,eval,llm_style_eval_223,4,2048,2048,fp16,Ascend910B2,c02,32,64,32,2,2,8,0.0,173.537,56.141999999999996,68.94901999999996,0.5976707634213244,7,-1,-1,4x2048x2048,0,"path_reordered,ASCEND_HOME_PATH_set,ASCEND_TOOLKIT_HOME_set;timing=npu_profiler_batch_chunked(max_steps=2048);npu_profiler_batch_offline_kernel_step"
2026-03-03T10:12:35.701830+00:00,FULL,llm_style,eval,llm_style_eval_224,16,3072,1536,fp16,Ascend910B2,c02,32,64,32,2,2,8,0.0,0.0,53.480999999999995,64.42181999999997,2.8233380826835703,7,-1,-1,16x3072x1536,0,"path_reordered,ASCEND_HOME_PATH_set,ASCEND_TOOLKIT_HOME_set;timing=npu_profiler_batch_chunked(max_steps=2048);npu_profiler_batch_offline_kernel_step"
2026-03-03T10:12:35.701863+00:00,FULL,llm_style,eval,llm_style_eval_225,1,2048,2048,fp16,Ascend910B2,c00,32,32,32,2,2,8,0.0,0.0,69.77199999999999,83.77079999999995,0.12022885971449866,7,-1,-1,1x2048x2048,0,"path_reordered,ASCEND_HOME_PATH_set,ASCEND_TOOLKIT_HOME_set;timing=npu_profiler_batch_chunked(max_steps=2048);npu_profiler_batch_offline_kernel_step"
2026-03-03T10:12:35.701892+00:00,FULL,llm_style,eval,llm_style_eval_226,8,1536,1024,fp16,Ascend910B2,c02,32,64,32,2,2,8,0.0,0.0,26.52,29.559799999999996,0.9489375565610859,7,-1,-1,8x1536x1024,0,"path_reordered,ASCEND_HOME_PATH_set,ASCEND_TOOLKIT_HOME_set;timing=npu_profiler_batch_chunked(max_steps=2048);npu_profiler_batch_offline_kernel_step"
2026-03-03T10:12:36.769520+00:00,FULL,llm_style,eval,llm_style_eval_227,64,6144,6144,fp16,Ascend910B2,c02,32,64,32,2,2,8,0.0,1067.58,500.731,658.0744599999994,9.649568746492626,1,-1,-1,64x6144x6144,0,"path_reordered,ASCEND_HOME_PATH_set,ASCEND_TOOLKIT_HOME_set;timing=npu_profiler_batch_chunked(max_steps=2048);npu_profiler_batch_offline_kernel_step"
2026-03-03T10:12:36.769605+00:00,FULL,llm_style,eval,llm_style_eval_228,64,6144,2048,fp16,Ascend910B2,c02,32,64,32,2,2,8,0.0,0.0,176.623,182.1696,9.118929788306167,1,-1,-1,64x6144x2048,0,"path_reordered,ASCEND_HOME_PATH_set,ASCEND_TOOLKIT_HOME_set;timing=npu_profiler_batch_chunked(max_steps=2048);npu_profiler_batch_offline_kernel_step"
2026-03-03T10:12:37.159792+00:00,FULL,llm_style,eval,llm_style_eval_229,16,1536,8192,fp16,Ascend910B2,c02,32,64,32,2,2,8,0.0,390.14,106.652,137.6376199999999,3.7753927164985184,6,-1,-1,16x1536x8192,0,"path_reordered,ASCEND_HOME_PATH_set,ASCEND_TOOLKIT_HOME_set;timing=npu_profiler_batch_chunked(max_steps=2048);npu_profiler_batch_offline_kernel_step"
2026-03-03T10:12:37.159872+00:00,FULL,llm_style,eval,llm_style_eval_230,64,2048,1536,fp16,Ascend910B2,c02,32,64,32,2,2,8,0.0,0.0,55.521,68.07839999999996,7.252268222834603,3,-1,-1,64x2048x1536,0,"path_reordered,ASCEND_HOME_PATH_set,ASCEND_TOOLKIT_HOME_set;timing=npu_profiler_batch_chunked(max_steps=2048);npu_profiler_batch_offline_kernel_step"
2026-03-03T10:12:37.159900+00:00,FULL,llm_style,eval,llm_style_eval_231,4,1024,8192,fp16,Ascend910B2,c02,32,64,32,2,2,8,0.0,0.0,89.422,93.81322,0.7504737536624096,6,-1,-1,4x1024x8192,0,"path_reordered,ASCEND_HOME_PATH_set,ASCEND_TOOLKIT_HOME_set;timing=npu_profiler_batch_chunked(max_steps=2048);npu_profiler_batch_offline_kernel_step"
2026-03-03T10:12:37.159922+00:00,FULL,llm_style,eval,llm_style_eval_232,16,3072,1536,fp16,Ascend910B2,c02,32,64,32,2,2,8,0.0,0.0,54.111999999999995,55.91158,2.7904151389710234,7,-1,-1,16x3072x1536,0,"path_reordered,ASCEND_HOME_PATH_set,ASCEND_TOOLKIT_HOME_set;timing=npu_profiler_batch_chunked(max_steps=2048);npu_profiler_batch_offline_kernel_step"
2026-03-03T10:12:37.159943+00:00,FULL,llm_style,eval,llm_style_eval_233,64,3072,3072,fp16,Ascend910B2,c02,32,64,32,2,2,8,0.0,0.0,135.324,177.29219999999984,8.926425113061985,3,-1,-1,64x3072x3072,0,"path_reordered,ASCEND_HOME_PATH_set,ASCEND_TOOLKIT_HOME_set;timing=npu_profiler_batch_chunked(max_steps=2048);npu_profiler_batch_offline_kernel_step"
2026-03-03T10:12:37.159969+00:00,FULL,llm_style,eval,llm_style_eval_234,32,8192,4096,fp16,Ascend910B2,c02,32,64,32,2,2,8,0.0,0.0,253.894,329.42921999999976,8.458189827250742,1,-1,-1,32x8192x4096,0,"path_reordered,ASCEND_HOME_PATH_set,ASCEND_TOOLKIT_HOME_set;timing=npu_profiler_batch_chunked(max_steps=2048);npu_profiler_batch_offline_kernel_step"
2026-03-03T10:12:37.159990+00:00,FULL,llm_style,eval,llm_style_eval_235,4,2048,1024,fp16,Ascend910B2,c02,32,64,32,2,2,8,0.0,0.0,34.811,40.24481999999998,0.4819515670334089,7,-1,-1,4x2048x1024,0,"path_reordered,ASCEND_HOME_PATH_set,ASCEND_TOOLKIT_HOME_set;timing=npu_profiler_batch_chunked(max_steps=2048);npu_profiler_batch_offline_kernel_step"
2026-03-03T10:12:37.160009+00:00,FULL,llm_style,eval,llm_style_eval_236,4,8192,3072,fp16,Ascend910B2,c02,32,64,32,2,2,8,0.0,0.0,173.94400000000002,231.47721999999982,1.1574218829048428,5,-1,-1,4x8192x3072,0,"path_reordered,ASCEND_HOME_PATH_set,ASCEND_TOOLKIT_HOME_set;timing=npu_profiler_batch_chunked(max_steps=2048);npu_profiler_batch_offline_kernel_step"
2026-03-03T10:12:37.160030+00:00,FULL,llm_style,eval,llm_style_eval_237,64,1024,4096,fp16,Ascend910B2,c02,32,64,32,2,2,8,0.0,0.0,89.662,113.57181999999993,5.987719569048203,3,-1,-1,64x1024x4096,0,"path_reordered,ASCEND_HOME_PATH_set,ASCEND_TOOLKIT_HOME_set;timing=npu_profiler_batch_chunked(max_steps=2048);npu_profiler_batch_offline_kernel_step"
2026-03-03T10:12:37.556337+00:00,FULL,llm_style,eval,llm_style_eval_238,32,2048,6144,fp16,Ascend910B2,c02,32,64,32,2,2,8,0.0,396.26,155.663,190.33499999999987,5.173396169931197,3,-1,-1,32x2048x6144,0,"path_reordered,ASCEND_HOME_PATH_set,ASCEND_TOOLKIT_HOME_set;timing=npu_profiler_batch_chunked(max_steps=2048);npu_profiler_batch_offline_kernel_step"
2026-03-03T10:12:37.556424+00:00,FULL,llm_style,eval,llm_style_eval_239,32,2048,6144,fp16,Ascend910B2,c02,32,64,32,2,2,8,0.0,0.0,157.383,163.309,5.116857398829606,3,-1,-1,32x2048x6144,0,"path_reordered,ASCEND_HOME_PATH_set,ASCEND_TOOLKIT_HOME_set;timing=npu_profiler_batch_chunked(max_steps=2048);npu_profiler_batch_offline_kernel_step"
2026-03-03T10:12:37.945967+00:00,FULL,llm_style,eval,llm_style_eval_240,8,8192,1536,fp16,Ascend910B2,c02,32,64,32,2,2,8,0.0,389.474,101.753,128.96441999999993,1.9785813882637369,5,-1,-1,8x8192x1536,0,"path_reordered,ASCEND_HOME_PATH_set,ASCEND_TOOLKIT_HOME_set;timing=npu_profiler_batch_chunked(max_steps=2048);npu_profiler_batch_offline_kernel_step"
2026-03-03T10:12:37.946056+00:00,FULL,llm_style,eval,llm_style_eval_241,16,1536,1536,fp16,Ascend910B2,c00,32,32,32,2,2,8,0.0,0.0,55.811,71.17301999999995,1.3527346222070917,7,-1,-1,16x1536x1536,0,"path_reordered,ASCEND_HOME_PATH_set,ASCEND_TOOLKIT_HOME_set;timing=npu_profiler_batch_chunked(max_steps=2048);npu_profiler_batch_offline_kernel_step"
2026-03-03T10:12:37.946083+00:00,FULL,llm_style,eval,llm_style_eval_242,1,2048,3072,fp16,Ascend910B2,c02,32,64,32,2,2,8,0.0,0.0,72.71000000000001,92.30337999999993,0.17305614083344792,7,-1,-1,1x2048x3072,0,"path_reordered,ASCEND_HOME_PATH_set,ASCEND_TOOLKIT_HOME_set;timing=npu_profiler_batch_chunked(max_steps=2048);npu_profiler_batch_offline_kernel_step"
2026-03-03T10:12:37.946121+00:00,FULL,llm_style,eval,llm_style_eval_243,8,1536,6144,fp16,Ascend910B2,c02,32,64,32,2,2,8,0.0,0.0,82.762,108.78979999999991,1.8244477417172131,7,-1,-1,8x1536x6144,0,"path_reordered,ASCEND_HOME_PATH_set,ASCEND_TOOLKIT_HOME_set;timing=npu_profiler_batch_chunked(max_steps=2048);npu_profiler_batch_offline_kernel_step"
2026-03-03T10:12:37.946142+00:00,FULL,llm_style,eval,llm_style_eval_244,32,8192,1024,fp16,Ascend910B2,c02,32,64,32,2,2,8,0.0,0.0,92.413,110.53719999999998,5.8094739051865,1,-1,-1,32x8192x1024,0,"path_reordered,ASCEND_HOME_PATH_set,ASCEND_TOOLKIT_HOME_set;timing=npu_profiler_batch_chunked(max_steps=2048);npu_profiler_batch_offline_kernel_step"
2026-03-03T10:12:37.946163+00:00,FULL,llm_style,eval,llm_style_eval_245,4,6144,4096,fp16,Ascend910B2,c02,32,64,32,2,2,8,0.0,0.0,176.454,239.10623999999976,1.1409579380461763,5,-1,-1,4x6144x4096,0,"path_reordered,ASCEND_HOME_PATH_set,ASCEND_TOOLKIT_HOME_set;timing=npu_profiler_batch_chunked(max_steps=2048);npu_profiler_batch_offline_kernel_step"
2026-03-03T10:12:37.946183+00:00,FULL,llm_style,eval,llm_style_eval_246,32,2048,6144,fp16,Ascend910B2,c02,32,64,32,2,2,8,0.0,0.0,156.003,161.777,5.162121036133921,3,-1,-1,32x2048x6144,0,"path_reordered,ASCEND_HOME_PATH_set,ASCEND_TOOLKIT_HOME_set;timing=npu_profiler_batch_chunked(max_steps=2048);npu_profiler_batch_offline_kernel_step"
2026-03-03T10:12:37.946201+00:00,FULL,llm_style,eval,llm_style_eval_247,64,6144,2048,fp16,Ascend910B2,c02,32,64,32,2,2,8,0.0,0.0,176.764,227.84021999999982,9.11165585752755,1,-1,-1,64x6144x2048,0,"path_reordered,ASCEND_HOME_PATH_set,ASCEND_TOOLKIT_HOME_set;timing=npu_profiler_batch_chunked(max_steps=2048);npu_profiler_batch_offline_kernel_step"
2026-03-03T10:12:38.048928+00:00,FULL,llm_style,eval,llm_style_eval_248,64,1024,1024,fp16,Ascend910B2,c01,64,32,32,2,2,8,0.0,102.682,40.8,45.48219999999999,3.2896501960784317,3,-1,-1,64x1024x1024,0,"path_reordered,ASCEND_HOME_PATH_set,ASCEND_TOOLKIT_HOME_set;timing=npu_profiler_batch_chunked(max_steps=2048);npu_profiler_batch_offline_kernel_step"
2026-03-03T10:12:38.333065+00:00,FULL,llm_style,eval,llm_style_eval_249,2,8192,1024,fp16,Ascend910B2,c02,32,64,32,2,2,8,0.0,284.053,68.93,84.74461999999994,0.48678996082982734,5,-1,-1,2x8192x1024,0,"path_reordered,ASCEND_HOME_PATH_set,ASCEND_TOOLKIT_HOME_set;timing=npu_profiler_batch_chunked(max_steps=2048);npu_profiler_batch_offline_kernel_step"
2026-03-03T10:12:38.333151+00:00,FULL,llm_style,eval,llm_style_eval_250,64,3072,3072,fp16,Ascend910B2,c02,32,64,32,2,2,8,0.0,0.0,135.422,176.15461999999985,8.919965382286483,3,-1,-1,64x3072x3072,0,"path_reordered,ASCEND_HOME_PATH_set,ASCEND_TOOLKIT_HOME_set;timing=npu_profiler_batch_chunked(max_steps=2048);npu_profiler_batch_offline_kernel_step"
2026-03-03T10:12:38.333179+00:00,FULL,llm_style,eval,llm_style_eval_251,64,1024,8192,fp16,Ascend910B2,c02,32,64,32,2,2,8,0.0,0.0,168.77300000000002,217.04703999999984,6.362047389096596,2,-1,-1,64x1024x8192,0,"path_reordered,ASCEND_HOME_PATH_set,ASCEND_TOOLKIT_HOME_set;timing=npu_profiler_batch_chunked(max_steps=2048);npu_profiler_batch_offline_kernel_step"
2026-03-03T10:12:38.333200+00:00,FULL,llm_style,eval,llm_style_eval_252,64,4096,3072,fp16,Ascend910B2,c02,32,64,32,2,2,8,0.0,0.0,185.60399999999998,251.64843999999977,8.677683325790392,3,-1,-1,64x4096x3072,0,"path_reordered,ASCEND_HOME_PATH_set,ASCEND_TOOLKIT_HOME_set;timing=npu_profiler_batch_chunked(max_steps=2048);npu_profiler_batch_offline_kernel_step"
2026-03-03T10:12:38.333220+00:00,FULL,llm_style,eval,llm_style_eval_253,8,6144,4096,fp16,Ascend910B2,c02,32,64,32,2,2,8,0.0,0.0,182.264,239.97323999999983,2.2091756133959533,5,-1,-1,8x6144x4096,0,"path_reordered,ASCEND_HOME_PATH_set,ASCEND_TOOLKIT_HOME_set;timing=npu_profiler_batch_chunked(max_steps=2048);npu_profiler_batch_offline_kernel_step"
2026-03-03T10:12:38.527883+00:00,FULL,llm_style,eval,llm_style_eval_254,4,1536,3072,fp16,Ascend910B2,c02,32,64,32,2,2,8,0.0,194.623,51.701,60.524979999999985,0.7301355099514517,7,-1,-1,4x1536x3072,0,"path_reordered,ASCEND_HOME_PATH_set,ASCEND_TOOLKIT_HOME_set;timing=npu_profiler_batch_chunked(max_steps=2048);npu_profiler_batch_offline_kernel_step"
2026-03-03T10:12:38.527975+00:00,FULL,llm_style,eval,llm_style_eval_255,1,3072,1536,fp16,Ascend910B2,c00,32,32,32,2,2,8,0.0,0.0,73.812,95.64099999999992,0.12785433262884083,7,-1,-1,1x3072x1536,0,"path_reordered,ASCEND_HOME_PATH_set,ASCEND_TOOLKIT_HOME_set;timing=npu_profiler_batch_chunked(max_steps=2048);npu_profiler_batch_offline_kernel_step"
