results/ascend_profiler_all_c00_c03_t16_e16.csv
timestamp,method,workload,split,shape_id,M,N,K,dtype,gpu,config_id,BLOCK_M,BLOCK_N,BLOCK_K,num_warps,num_stages,GROUP_M,compile_time_ms,tune_time_ms,runtime_cost_us,p99_us,runtime_perf_tflops,bucket_m,bucket_n,bucket_k,cache_key,invalid_config,notes
2026-03-03T11:48:01.896226+00:00,FULL,llm_style,tune,llm_style_tune_000,8,2048,4096,fp16,Ascend910B2,c03,64,64,32,4,2,8,3.7902239710092545,5067.167,98.28200000000001,100.4308,1.3656389572861765,7,-1,-1,8x2048x4096,0,"batch_tune;path_reordered,ASCEND_HOME_PATH_set,ASCEND_TOOLKIT_HOME_set;timing=npu_profiler_batch_offline_kernel_step"
2026-03-03T11:48:06.430444+00:00,FULL,llm_style,tune,llm_style_tune_001,32,1536,3072,fp16,Ascend910B2,c03,64,64,32,4,2,8,0.0,4534.021,58.891000000000005,63.259,5.127946341546246,3,-1,-1,32x1536x3072,0,"batch_tune;path_reordered,ASCEND_HOME_PATH_set,ASCEND_TOOLKIT_HOME_set;timing=npu_profiler_batch_offline_kernel_step"
2026-03-03T11:48:11.061861+00:00,FULL,llm_style,tune,llm_style_tune_002,32,4096,2048,fp16,Ascend910B2,c03,64,64,32,4,2,8,0.0,4631.24,92.811,101.6166,5.784561226578746,3,-1,-1,32x4096x2048,0,"batch_tune;path_reordered,ASCEND_HOME_PATH_set,ASCEND_TOOLKIT_HOME_set;timing=npu_profiler_batch_offline_kernel_step"
2026-03-03T11:48:15.564490+00:00,FULL,llm_style,tune,llm_style_tune_003,1,3072,1536,fp16,Ascend910B2,c02,32,64,32,2,2,8,0.0,4502.468,45.71,47.3966,0.2064577554145701,7,-1,-1,1x3072x1536,0,"batch_tune;path_reordered,ASCEND_HOME_PATH_set,ASCEND_TOOLKIT_HOME_set;timing=npu_profiler_batch_offline_kernel_flat_fallback"
2026-03-03T11:48:20.002899+00:00,FULL,llm_style,tune,llm_style_tune_004,8,1024,1536,fp16,Ascend910B2,c02,32,64,32,2,2,8,0.0,4438.242,24.88,26.304180000000002,1.0114881028938907,7,-1,-1,8x1024x1536,0,"batch_tune;path_reordered,ASCEND_HOME_PATH_set,ASCEND_TOOLKIT_HOME_set;timing=npu_profiler_batch_offline_kernel_step"
2026-03-03T11:48:25.241384+00:00,FULL,llm_style,tune,llm_style_tune_005,1,4096,8192,fp16,Ascend910B2,c03,64,64,32,4,2,8,0.0,5238.31,225.744,233.20358,0.29727861648593096,6,-1,-1,1x4096x8192,0,"batch_tune;path_reordered,ASCEND_HOME_PATH_set,ASCEND_TOOLKIT_HOME_set;timing=npu_profiler_batch_offline_kernel_flat_fallback"
2026-03-03T11:48:29.784139+00:00,FULL,llm_style,tune,llm_style_tune_006,4,6144,1024,fp16,Ascend910B2,c03,64,64,32,4,2,8,0.0,4542.594,66.101,72.73939999999999,0.7614355002193613,5,-1,-1,4x6144x1024,0,"batch_tune;path_reordered,ASCEND_HOME_PATH_set,ASCEND_TOOLKIT_HOME_set;timing=npu_profiler_batch_offline_kernel_step"
2026-03-03T11:48:35.927143+00:00,FULL,llm_style,tune,llm_style_tune_007,4,8192,8192,fp16,Ascend910B2,c03,64,64,32,4,2,8,0.0,6142.805,443.028,454.59062,1.2118216275269282,4,-1,-1,4x8192x8192,0,"batch_tune;path_reordered,ASCEND_HOME_PATH_set,ASCEND_TOOLKIT_HOME_set;timing=npu_profiler_batch_offline_kernel_step"
2026-03-03T11:48:40.486162+00:00,FULL,llm_style,tune,llm_style_tune_008,64,6144,1024,fp16,Ascend910B2,c03,64,64,32,4,2,8,0.0,4558.852,85.413,93.87762000000001,9.42838172175196,1,-1,-1,64x6144x1024,0,"batch_tune;path_reordered,ASCEND_HOME_PATH_set,ASCEND_TOOLKIT_HOME_set;timing=npu_profiler_batch_offline_kernel_step"
2026-03-03T11:48:45.224899+00:00,FULL,llm_style,tune,llm_style_tune_009,2,4096,3072,fp16,Ascend910B2,c02,32,64,32,2,2,8,0.0,4738.572,101.44200000000001,110.07242,0.49616182646241197,7,-1,-1,2x4096x3072,0,"batch_tune;path_reordered,ASCEND_HOME_PATH_set,ASCEND_TOOLKIT_HOME_set;timing=npu_profiler_batch_offline_kernel_step"
2026-03-03T11:48:50.043041+00:00,FULL,llm_style,tune,llm_style_tune_010,32,2048,8192,fp16,Ascend910B2,c03,64,64,32,4,2,8,0.0,4817.976,190.624,199.70600000000002,5.632773543730066,2,-1,-1,32x2048x8192,0,"batch_tune;path_reordered,ASCEND_HOME_PATH_set,ASCEND_TOOLKIT_HOME_set;timing=npu_profiler_batch_offline_kernel_step"
2026-03-03T11:48:54.557207+00:00,FULL,llm_style,tune,llm_style_tune_011,32,3072,1536,fp16,Ascend910B2,c02,32,64,32,2,2,8,0.0,4513.998,57.051,60.26138,5.293332071304622,3,-1,-1,32x3072x1536,0,"batch_tune;path_reordered,ASCEND_HOME_PATH_set,ASCEND_TOOLKIT_HOME_set;timing=npu_profiler_batch_offline_kernel_step"
2026-03-03T11:48:58.977344+00:00,FULL,llm_style,tune,llm_style_tune_012,2,1536,1024,fp16,Ascend910B2,c03,64,64,32,4,2,8,0.0,4419.976,24.041,25.384,0.261696934403727,7,-1,-1,2x1536x1024,0,"batch_tune;path_reordered,ASCEND_HOME_PATH_set,ASCEND_TOOLKIT_HOME_set;timing=npu_profiler_batch_offline_kernel_step"
2026-03-03T11:49:03.457865+00:00,FULL,llm_style,tune,llm_style_tune_013,64,6144,1024,fp16,Ascend910B2,c03,64,64,32,4,2,8,0.0,0.0,85.672,94.01182,9.399878233261742,1,-1,-1,64x6144x1024,0,"path_reordered,ASCEND_HOME_PATH_set,ASCEND_TOOLKIT_HOME_set;timing=npu_profiler_offline_kernel_details"
2026-03-03T11:49:10.703981+00:00,FULL,llm_style,tune,llm_style_tune_014,64,8192,8192,fp16,Ascend910B2,c03,64,64,32,4,2,8,0.0,7245.927,524.8109999999999,538.509,16.367672537351545,0,-1,-1,64x8192x8192,0,"batch_tune;path_reordered,ASCEND_HOME_PATH_set,ASCEND_TOOLKIT_HOME_set;timing=npu_profiler_batch_offline_kernel_step"
2026-03-03T11:49:15.218806+00:00,FULL,llm_style,tune,llm_style_tune_015,64,1536,3072,fp16,Ascend910B2,c03,64,64,32,4,2,8,0.0,4514.669,68.21199999999999,73.0876,8.854450477921775,3,-1,-1,64x1536x3072,0,"batch_tune;path_reordered,ASCEND_HOME_PATH_set,ASCEND_TOOLKIT_HOME_set;timing=npu_profiler_batch_offline_kernel_step"
2026-03-03T11:49:19.643100+00:00,FULL,llm_style,eval,llm_style_eval_000,32,1536,1024,fp16,Ascend910B2,c03,64,64,32,4,2,8,0.0,4424.122,29.112000000000002,30.6404,3.457793899422918,3,-1,-1,32x1536x1024,0,"batch_tune;path_reordered,ASCEND_HOME_PATH_set,ASCEND_TOOLKIT_HOME_set;timing=npu_profiler_batch_offline_kernel_step"
2026-03-03T11:49:19.643211+00:00,FULL,llm_style,eval,llm_style_eval_001,32,2048,8192,fp16,Ascend910B2,c03,64,64,32,4,2,8,0.0,0.0,192.564,260.6512399999998,5.576025757670178,2,-1,-1,32x2048x8192,0,"path_reordered,ASCEND_HOME_PATH_set,ASCEND_TOOLKIT_HOME_set;timing=npu_profiler_batch_offline_kernel_step"
2026-03-03T11:49:24.278265+00:00,FULL,llm_style,eval,llm_style_eval_002,16,2048,4096,fp16,Ascend910B2,c02,32,64,32,2,2,8,0.0,4634.966,103.901,125.32701999999995,2.5835695132866867,7,-1,-1,16x2048x4096,0,"batch_tune;path_reordered,ASCEND_HOME_PATH_set,ASCEND_TOOLKIT_HOME_set;timing=npu_profiler_batch_offline_kernel_step"
2026-03-03T11:49:28.752220+00:00,FULL,llm_style,eval,llm_style_eval_003,16,2048,1536,fp16,Ascend910B2,c02,32,64,32,2,2,8,0.0,4473.797,49.19,60.51181999999997,2.0464178898150034,7,-1,-1,16x2048x1536,0,"batch_tune;path_reordered,ASCEND_HOME_PATH_set,ASCEND_TOOLKIT_HOME_set;timing=npu_profiler_batch_offline_kernel_step"
2026-03-03T11:49:33.593350+00:00,FULL,llm_style,eval,llm_style_eval_004,64,8192,2048,fp16,Ascend910B2,c03,64,64,32,4,2,8,0.0,4840.962,164.31400000000002,209.6733999999999,13.069389388609611,1,-1,-1,64x8192x2048,0,"batch_tune;path_reordered,ASCEND_HOME_PATH_set,ASCEND_TOOLKIT_HOME_set;timing=npu_profiler_batch_offline_kernel_step"
2026-03-03T11:49:38.706561+00:00,FULL,llm_style,eval,llm_style_eval_005,64,3072,8192,fp16,Ascend910B2,c03,64,64,32,4,2,8,0.0,5113.053,220.664,302.13043999999974,14.597874922959795,2,-1,-1,64x3072x8192,0,"batch_tune;path_reordered,ASCEND_HOME_PATH_set,ASCEND_TOOLKIT_HOME_set;timing=npu_profiler_batch_offline_kernel_step"
2026-03-03T11:49:43.209545+00:00,FULL,llm_style,eval,llm_style_eval_006,32,2048,2048,fp16,Ascend910B2,c02,32,64,32,2,2,8,0.0,4502.826,65.761,81.36919999999996,4.081985614573988,3,-1,-1,32x2048x2048,0,"batch_tune;path_reordered,ASCEND_HOME_PATH_set,ASCEND_TOOLKIT_HOME_set;timing=npu_profiler_batch_offline_kernel_step"
2026-03-03T11:49:48.035024+00:00,FULL,llm_style,eval,llm_style_eval_007,8,8192,2048,fp16,Ascend910B2,c03,64,64,32,4,2,8,0.0,4825.308,128.681,170.35799999999983,2.086053543258134,5,-1,-1,8x8192x2048,0,"batch_tune;path_reordered,ASCEND_HOME_PATH_set,ASCEND_TOOLKIT_HOME_set;timing=npu_profiler_batch_offline_kernel_step"
2026-03-03T11:49:52.776105+00:00,FULL,llm_style,eval,llm_style_eval_008,64,1536,8192,fp16,Ascend910B2,c03,64,64,32,4,2,8,0.0,4740.92,129.114,187.36439999999982,12.474346205678703,2,-1,-1,64x1536x8192,0,"batch_tune;path_reordered,ASCEND_HOME_PATH_set,ASCEND_TOOLKIT_HOME_set;timing=npu_profiler_batch_offline_kernel_step"
2026-03-03T11:49:57.868881+00:00,FULL,llm_style,eval,llm_style_eval_009,64,4096,6144,fp16,Ascend910B2,c03,64,64,32,4,2,8,0.0,5092.624,246.195,339.86963999999966,13.084040991896668,3,-1,-1,64x4096x6144,0,"batch_tune;path_reordered,ASCEND_HOME_PATH_set,ASCEND_TOOLKIT_HOME_set;timing=npu_profiler_batch_offline_kernel_step"
2026-03-03T11:50:02.509628+00:00,FULL,llm_style,eval,llm_style_eval_010,64,2048,4096,fp16,Ascend910B2,c03,64,64,32,4,2,8,0.0,4640.58,129.373,161.4952199999999,8.299582014794433,3,-1,-1,64x2048x4096,0,"batch_tune;path_reordered,ASCEND_HOME_PATH_set,ASCEND_TOOLKIT_HOME_set;timing=npu_profiler_batch_offline_kernel_step"
2026-03-03T11:50:07.390504+00:00,FULL,llm_style,eval,llm_style_eval_011,32,3072,6144,fp16,Ascend910B2,c02,32,64,32,2,2,8,0.0,4880.708,161.154,211.65599999999984,7.495684575002793,3,-1,-1,32x3072x6144,0,"batch_tune;path_reordered,ASCEND_HOME_PATH_set,ASCEND_TOOLKIT_HOME_set;timing=npu_profiler_batch_offline_kernel_step"
2026-03-03T11:50:11.823793+00:00,FULL,llm_style,eval,llm_style_eval_012,16,1536,1536,fp16,Ascend910B2,c02,32,64,32,2,2,8,0.0,4433.132,33.152,39.97241999999998,2.277312741312741,7,-1,-1,16x1536x1536,0,"batch_tune;path_reordered,ASCEND_HOME_PATH_set,ASCEND_TOOLKIT_HOME_set;timing=npu_profiler_batch_offline_kernel_step"
2026-03-03T11:50:17.390269+00:00,FULL,llm_style,eval,llm_style_eval_013,64,2048,3072,fp16,Ascend910B2,c03,64,64,32,4,2,8,0.0,5566.311,103.893,123.70141999999996,7.751305362247697,3,-1,-1,64x2048x3072,0,"batch_tune;path_reordered,ASCEND_HOME_PATH_set,ASCEND_TOOLKIT_HOME_set;timing=npu_profiler_batch_offline_kernel_step"
2026-03-03T11:50:23.102918+00:00,FULL,llm_style,eval,llm_style_eval_014,16,8192,6144,fp16,Ascend910B2,c03,64,64,32,4,2,8,0.0,5712.462,357.02700000000004,467.66541999999964,4.511179087295918,5,-1,-1,16x8192x6144,0,"batch_tune;path_reordered,ASCEND_HOME_PATH_set,ASCEND_TOOLKIT_HOME_set;timing=npu_profiler_batch_offline_kernel_step"
2026-03-03T11:50:27.783508+00:00,FULL,llm_style,eval,llm_style_eval_015,64,6144,1536,fp16,Ascend910B2,c03,64,64,32,4,2,8,0.0,4680.404,106.273,131.70299999999992,11.366570549434005,1,-1,-1,64x6144x1536,0,"batch_tune;path_reordered,ASCEND_HOME_PATH_set,ASCEND_TOOLKIT_HOME_set;timing=npu_profiler_batch_offline_kernel_step"
2026-03-03T11:50:46.007626+00:00,BUCKET,llm_style,tune,llm_style_tune_000,8,2048,4096,fp16,Ascend910B2,c02,32,64,32,2,2,8,0.0,4634.828,98.283,100.87620000000001,1.365625062320035,7,-1,-1,llm8_g7,0,"batch_tune;path_reordered,ASCEND_HOME_PATH_set,ASCEND_TOOLKIT_HOME_set;timing=npu_profiler_batch_offline_kernel_step"
2026-03-03T11:50:50.517769+00:00,BUCKET,llm_style,tune,llm_style_tune_001,32,1536,3072,fp16,Ascend910B2,c02,32,64,32,2,2,8,0.0,4509.967,59.592,64.884,5.067624647603705,3,-1,-1,llm8_g3,0,"batch_tune;path_reordered,ASCEND_HOME_PATH_set,ASCEND_TOOLKIT_HOME_set;timing=npu_profiler_batch_offline_kernel_step"
2026-03-03T11:50:55.063676+00:00,BUCKET,llm_style,tune,llm_style_tune_002,32,4096,2048,fp16,Ascend910B2,c02,32,64,32,2,2,8,0.0,0.0,93.773,101.10278,5.725218474400947,3,-1,-1,llm8_g3,0,"path_reordered,ASCEND_HOME_PATH_set,ASCEND_TOOLKIT_HOME_set;timing=npu_profiler_offline_kernel_details"
2026-03-03T11:50:59.471873+00:00,BUCKET,llm_style,tune,llm_style_tune_003,1,3072,1536,fp16,Ascend910B2,c02,32,64,32,2,2,8,0.0,0.0,45.861000000000004,47.642799999999994,0.2057779812912932,7,-1,-1,llm8_g7,0,"path_reordered,ASCEND_HOME_PATH_set,ASCEND_TOOLKIT_HOME_set;timing=npu_profiler_offline_kernel_details"
2026-03-03T11:51:03.837601+00:00,BUCKET,llm_style,tune,llm_style_tune_004,8,1024,1536,fp16,Ascend910B2,c02,32,64,32,2,2,8,0.0,0.0,25.1,26.2378,1.0026224701195219,7,-1,-1,llm8_g7,0,"path_reordered,ASCEND_HOME_PATH_set,ASCEND_TOOLKIT_HOME_set;timing=npu_profiler_offline_kernel_details"
2026-03-03T11:51:09.132621+00:00,BUCKET,llm_style,tune,llm_style_tune_005,1,4096,8192,fp16,Ascend910B2,c02,32,64,32,2,2,8,0.0,5294.808,225.114,232.05878,0.2981105750864007,6,-1,-1,llm8_g6,0,"batch_tune;path_reordered,ASCEND_HOME_PATH_set,ASCEND_TOOLKIT_HOME_set;timing=npu_profiler_batch_offline_kernel_flat_fallback"
2026-03-03T11:51:13.694388+00:00,BUCKET,llm_style,tune,llm_style_tune_006,4,6144,1024,fp16,Ascend910B2,c02,32,64,32,2,2,8,0.0,4561.57,64.77099999999999,71.0532,0.7770707260965558,5,-1,-1,llm8_g5,0,"batch_tune;path_reordered,ASCEND_HOME_PATH_set,ASCEND_TOOLKIT_HOME_set;timing=npu_profiler_batch_offline_kernel_step"
2026-03-03T11:51:19.886183+00:00,BUCKET,llm_style,tune,llm_style_tune_007,4,8192,8192,fp16,Ascend910B2,c02,32,64,32,2,2,8,0.0,6191.583,443.02,452.35702,1.2118435104509957,4,-1,-1,llm8_g4,0,"batch_tune;path_reordered,ASCEND_HOME_PATH_set,ASCEND_TOOLKIT_HOME_set;timing=npu_profiler_batch_offline_kernel_step"
2026-03-03T11:51:24.440128+00:00,BUCKET,llm_style,tune,llm_style_tune_008,64,6144,1024,fp16,Ascend910B2,c03,64,64,32,4,2,8,0.0,4553.762,86.041,94.6236,9.359565416487488,1,-1,-1,llm8_g1,0,"batch_tune;path_reordered,ASCEND_HOME_PATH_set,ASCEND_TOOLKIT_HOME_set;timing=npu_profiler_batch_offline_kernel_step"
2026-03-03T11:51:29.040724+00:00,BUCKET,llm_style,tune,llm_style_tune_009,2,4096,3072,fp16,Ascend910B2,c02,32,64,32,2,2,8,0.0,0.0,101.99199999999999,106.10702,0.49348623421444826,7,-1,-1,llm8_g7,0,"path_reordered,ASCEND_HOME_PATH_set,ASCEND_TOOLKIT_HOME_set;timing=npu_profiler_offline_kernel_details"
2026-03-03T11:51:34.866276+00:00,BUCKET,llm_style,tune,llm_style_tune_010,32,2048,8192,fp16,Ascend910B2,c02,32,64,32,2,2,8,0.0,5825.351,190.494,199.8216,5.636617552258863,2,-1,-1,llm8_g2,0,"batch_tune;path_reordered,ASCEND_HOME_PATH_set,ASCEND_TOOLKIT_HOME_set;timing=npu_profiler_batch_offline_kernel_step"
2026-03-03T11:51:39.320248+00:00,BUCKET,llm_style,tune,llm_style_tune_011,32,3072,1536,fp16,Ascend910B2,c02,32,64,32,2,2,8,0.0,0.0,59.112,63.47058,5.108774665042631,3,-1,-1,llm8_g3,0,"path_reordered,ASCEND_HOME_PATH_set,ASCEND_TOOLKIT_HOME_set;timing=npu_profiler_offline_kernel_details"
2026-03-03T11:51:43.672422+00:00,BUCKET,llm_style,tune,llm_style_tune_012,2,1536,1024,fp16,Ascend910B2,c02,32,64,32,2,2,8,0.0,0.0,23.93,25.5398,0.26291082323443377,7,-1,-1,llm8_g7,0,"path_reordered,ASCEND_HOME_PATH_set,ASCEND_TOOLKIT_HOME_set;timing=npu_profiler_offline_kernel_details"
2026-03-03T11:51:48.144507+00:00,BUCKET,llm_style,tune,llm_style_tune_013,64,6144,1024,fp16,Ascend910B2,c03,64,64,32,4,2,8,0.0,0.0,86.72200000000001,95.03801999999999,9.286067756739925,1,-1,-1,llm8_g1,0,"path_reordered,ASCEND_HOME_PATH_set,ASCEND_TOOLKIT_HOME_set;timing=npu_profiler_offline_kernel_details"
2026-03-03T11:51:54.406375+00:00,BUCKET,llm_style,tune,llm_style_tune_014,64,8192,8192,fp16,Ascend910B2,c03,64,64,32,4,2,8,0.0,6261.642,526.231,539.6466,16.32350544152663,0,-1,-1,llm8_g0,0,"batch_tune;path_reordered,ASCEND_HOME_PATH_set,ASCEND_TOOLKIT_HOME_set;timing=npu_profiler_batch_offline_kernel_step"
2026-03-03T11:51:58.841161+00:00,BUCKET,llm_style,tune,llm_style_tune_015,64,1536,3072,fp16,Ascend910B2,c02,32,64,32,2,2,8,0.0,0.0,71.771,75.15522,8.415373563138315,3,-1,-1,llm8_g3,0,"path_reordered,ASCEND_HOME_PATH_set,ASCEND_TOOLKIT_HOME_set;timing=npu_profiler_offline_kernel_details"
2026-03-03T11:51:58.841321+00:00,BUCKET,llm_style,eval,llm_style_eval_000,32,1536,1024,fp16,Ascend910B2,c02,32,64,32,2,2,8,0.0,0.0,29.939999999999998,31.7942,3.3621675350701405,3,-1,-1,llm8_g3,0,"path_reordered,ASCEND_HOME_PATH_set,ASCEND_TOOLKIT_HOME_set;timing=npu_profiler_batch_offline_kernel_step"
2026-03-03T11:51:58.841353+00:00,BUCKET,llm_style,eval,llm_style_eval_001,32,2048,8192,fp16,Ascend910B2,c02,32,64,32,2,2,8,0.0,0.0,191.224,249.6206199999998,5.615099694599005,2,-1,-1,llm8_g2,0,"path_reordered,ASCEND_HOME_PATH_set,ASCEND_TOOLKIT_HOME_set;timing=npu_profiler_batch_offline_kernel_step"
2026-03-03T11:51:58.841385+00:00,BUCKET,llm_style,eval,llm_style_eval_002,16,2048,4096,fp16,Ascend910B2,c02,32,64,32,2,2,8,0.0,0.0,102.74199999999999,131.72039999999993,2.6127139436647138,7,-1,-1,llm8_g7,0,"path_reordered,ASCEND_HOME_PATH_set,ASCEND_TOOLKIT_HOME_set;timing=npu_profiler_batch_offline_kernel_step"
2026-03-03T11:51:58.841413+00:00,BUCKET,llm_style,eval,llm_style_eval_003,16,2048,1536,fp16,Ascend910B2,c02,32,64,32,2,2,8,0.0,0.0,49.311,59.419799999999974,2.0413963618665205,7,-1,-1,llm8_g7,0,"path_reordered,ASCEND_HOME_PATH_set,ASCEND_TOOLKIT_HOME_set;timing=npu_profiler_batch_offline_kernel_step"
2026-03-03T11:51:58.841436+00:00,BUCKET,llm_style,eval,llm_style_eval_004,64,8192,2048,fp16,Ascend910B2,c03,64,64,32,4,2,8,0.0,0.0,162.94299999999998,212.74979999999985,13.179355038264916,1,-1,-1,llm8_g1,0,"path_reordered,ASCEND_HOME_PATH_set,ASCEND_TOOLKIT_HOME_set;timing=npu_profiler_batch_offline_kernel_step"
2026-03-03T11:51:58.841464+00:00,BUCKET,llm_style,eval,llm_style_eval_005,64,3072,8192,fp16,Ascend910B2,c02,32,64,32,2,2,8,0.0,0.0,333.51599999999996,447.11721999999963,9.658383621775268,2,-1,-1,llm8_g2,0,"path_reordered,ASCEND_HOME_PATH_set,ASCEND_TOOLKIT_HOME_set;timing=npu_profiler_batch_offline_kernel_step"
2026-03-03T11:51:58.841487+00:00,BUCKET,llm_style,eval,llm_style_eval_006,32,2048,2048,fp16,Ascend910B2,c02,32,64,32,2,2,8,0.0,0.0,65.721,81.64421999999996,4.084470047625568,3,-1,-1,llm8_g3,0,"path_reordered,ASCEND_HOME_PATH_set,ASCEND_TOOLKIT_HOME_set;timing=npu_profiler_batch_offline_kernel_step"
2026-03-03T11:51:58.841507+00:00,BUCKET,llm_style,eval,llm_style_eval_007,8,8192,2048,fp16,Ascend910B2,c02,32,64,32,2,2,8,0.0,0.0,129.123,165.9178199999999,2.07891278858143,5,-1,-1,llm8_g5,0,"path_reordered,ASCEND_HOME_PATH_set,ASCEND_TOOLKIT_HOME_set;timing=npu_profiler_batch_offline_kernel_step"
2026-03-03T11:51:58.841527+00:00,BUCKET,llm_style,eval,llm_style_eval_008,64,1536,8192,fp16,Ascend910B2,c02,32,64,32,2,2,8,0.0,0.0,174.35399999999998,231.2618399999998,9.237601293919267,2,-1,-1,llm8_g2,0,"path_reordered,ASCEND_HOME_PATH_set,ASCEND_TOOLKIT_HOME_set;timing=npu_profiler_batch_offline_kernel_step"
2026-03-03T11:51:58.841546+00:00,BUCKET,llm_style,eval,llm_style_eval_009,64,4096,6144,fp16,Ascend910B2,c02,32,64,32,2,2,8,0.0,0.0,355.90700000000004,487.6058599999996,9.05075053876434,3,-1,-1,llm8_g3,0,"path_reordered,ASCEND_HOME_PATH_set,ASCEND_TOOLKIT_HOME_set;timing=npu_profiler_batch_offline_kernel_step"
2026-03-03T11:51:58.841565+00:00,BUCKET,llm_style,eval,llm_style_eval_010,64,2048,4096,fp16,Ascend910B2,c02,32,64,32,2,2,8,0.0,0.0,131.364,167.4994199999999,8.173790566669712,3,-1,-1,llm8_g3,0,"path_reordered,ASCEND_HOME_PATH_set,ASCEND_TOOLKIT_HOME_set;timing=npu_profiler_batch_offline_kernel_step"
2026-03-03T11:51:58.841587+00:00,BUCKET,llm_style,eval,llm_style_eval_011,32,3072,6144,fp16,Ascend910B2,c02,32,64,32,2,2,8,0.0,0.0,163.71300000000002,220.8448199999998,7.378519433398691,3,-1,-1,llm8_g3,0,"path_reordered,ASCEND_HOME_PATH_set,ASCEND_TOOLKIT_HOME_set;timing=npu_profiler_batch_offline_kernel_step"
2026-03-03T11:51:58.841607+00:00,BUCKET,llm_style,eval,llm_style_eval_012,16,1536,1536,fp16,Ascend910B2,c02,32,64,32,2,2,8,0.0,0.0,34.35,41.49899999999998,2.197888558951965,7,-1,-1,llm8_g7,0,"path_reordered,ASCEND_HOME_PATH_set,ASCEND_TOOLKIT_HOME_set;timing=npu_profiler_batch_offline_kernel_step"
2026-03-03T11:51:58.841629+00:00,BUCKET,llm_style,eval,llm_style_eval_013,64,2048,3072,fp16,Ascend910B2,c02,32,64,32,2,2,8,0.0,0.0,102.072,129.2205999999999,7.889591347284269,3,-1,-1,llm8_g3,0,"path_reordered,ASCEND_HOME_PATH_set,ASCEND_TOOLKIT_HOME_set;timing=npu_profiler_batch_offline_kernel_step"
2026-03-03T11:51:58.841648+00:00,BUCKET,llm_style,eval,llm_style_eval_014,16,8192,6144,fp16,Ascend910B2,c02,32,64,32,2,2,8,0.0,0.0,357.867,466.3590399999996,4.500590263980753,5,-1,-1,llm8_g5,0,"path_reordered,ASCEND_HOME_PATH_set,ASCEND_TOOLKIT_HOME_set;timing=npu_profiler_batch_offline_kernel_step"
2026-03-03T11:51:58.841669+00:00,BUCKET,llm_style,eval,llm_style_eval_015,64,6144,1536,fp16,Ascend910B2,c03,64,64,32,4,2,8,0.0,0.0,109.773,137.08677999999992,11.004159055505452,1,-1,-1,llm8_g1,0,"path_reordered,ASCEND_HOME_PATH_set,ASCEND_TOOLKIT_HOME_set;timing=npu_profiler_batch_offline_kernel_step"
2026-03-03T11:52:26.834297+00:00,TORCH,llm_style,tune,llm_style_tune_000,8,2048,4096,fp16,Ascend910B2,torch_mm_npu,-1,-1,-1,-1,-1,-1,482.02335461974144,0.0,11.061,11.570599999999999,12.134321309104061,7,-1,-1,torch_mm_npu,0,torch_mm_npu;timing=npu_profiler_batch_offline_kernel_step
2026-03-03T11:52:26.834406+00:00,TORCH,llm_style,tune,llm_style_tune_001,32,1536,3072,fp16,Ascend910B2,torch_mm_npu,-1,-1,-1,-1,-1,-1,0.0,0.0,10.701,15.887199999999982,28.220716568544997,3,-1,-1,torch_mm_npu,0,torch_mm_npu;timing=npu_profiler_batch_offline_kernel_step
2026-03-03T11:52:26.834429+00:00,TORCH,llm_style,tune,llm_style_tune_002,32,4096,2048,fp16,Ascend910B2,torch_mm_npu,-1,-1,-1,-1,-1,-1,0.0,0.0,11.431000000000001,14.63479999999999,46.96622447729857,3,-1,-1,torch_mm_npu,0,torch_mm_npu;timing=npu_profiler_batch_offline_kernel_step
2026-03-03T11:52:26.834447+00:00,TORCH,llm_style,tune,llm_style_tune_003,1,3072,1536,fp16,Ascend910B2,torch_mm_npu,-1,-1,-1,-1,-1,-1,0.0,0.0,6.92,9.960999999999991,1.3637549132947977,7,-1,-1,torch_mm_npu,0,torch_mm_npu;timing=npu_profiler_batch_offline_kernel_step
2026-03-03T11:52:26.834461+00:00,TORCH,llm_style,tune,llm_style_tune_004,8,1024,1536,fp16,Ascend910B2,torch_mm_npu,-1,-1,-1,-1,-1,-1,0.0,0.0,9.731,10.962799999999998,2.5861498304388038,7,-1,-1,torch_mm_npu,0,torch_mm_npu;timing=npu_profiler_batch_offline_kernel_step
2026-03-03T11:52:26.834474+00:00,TORCH,llm_style,tune,llm_style_tune_005,1,4096,8192,fp16,Ascend910B2,torch_mm_npu,-1,-1,-1,-1,-1,-1,0.0,0.0,34.971000000000004,45.90461999999996,1.918986131365989,6,-1,-1,torch_mm_npu,0,torch_mm_npu;timing=npu_profiler_batch_offline_kernel_step
2026-03-03T11:52:26.834486+00:00,TORCH,llm_style,tune,llm_style_tune_006,4,6144,1024,fp16,Ascend910B2,torch_mm_npu,-1,-1,-1,-1,-1,-1,0.0,0.0,7.79,10.48479999999999,6.461058793324775,5,-1,-1,torch_mm_npu,0,torch_mm_npu;timing=npu_profiler_batch_offline_kernel_step
2026-03-03T11:52:26.834498+00:00,TORCH,llm_style,tune,llm_style_tune_007,4,8192,8192,fp16,Ascend910B2,torch_mm_npu,-1,-1,-1,-1,-1,-1,0.0,0.0,70.292,92.12343999999993,7.6377242360439315,4,-1,-1,torch_mm_npu,0,torch_mm_npu;timing=npu_profiler_batch_offline_kernel_step
2026-03-03T11:52:26.834513+00:00,TORCH,llm_style,tune,llm_style_tune_008,64,6144,1024,fp16,Ascend910B2,torch_mm_npu,-1,-1,-1,-1,-1,-1,0.0,0.0,8.6,11.241999999999992,93.64027534883722,1,-1,-1,torch_mm_npu,0,torch_mm_npu;timing=npu_profiler_batch_offline_kernel_step
2026-03-03T11:52:26.834525+00:00,TORCH,llm_style,tune,llm_style_tune_009,2,4096,3072,fp16,Ascend910B2,torch_mm_npu,-1,-1,-1,-1,-1,-1,0.0,0.0,14.76,19.026599999999984,3.4100032520325203,7,-1,-1,torch_mm_npu,0,torch_mm_npu;timing=npu_profiler_batch_offline_kernel_step
2026-03-03T11:52:26.834537+00:00,TORCH,llm_style,tune,llm_style_tune_010,32,2048,8192,fp16,Ascend910B2,torch_mm_npu,-1,-1,-1,-1,-1,-1,0.0,0.0,21.46,30.261819999999968,50.03456775396085,2,-1,-1,torch_mm_npu,0,torch_mm_npu;timing=npu_profiler_batch_offline_kernel_step
2026-03-03T11:52:26.834549+00:00,TORCH,llm_style,tune,llm_style_tune_011,32,3072,1536,fp16,Ascend910B2,torch_mm_npu,-1,-1,-1,-1,-1,-1,0.0,0.0,7.32,10.950199999999988,41.255449180327865,3,-1,-1,torch_mm_npu,0,torch_mm_npu;timing=npu_profiler_batch_offline_kernel_step
2026-03-03T11:52:26.834560+00:00,TORCH,llm_style,tune,llm_style_tune_012,2,1536,1024,fp16,Ascend910B2,torch_mm_npu,-1,-1,-1,-1,-1,-1,0.0,0.0,5.73,7.4035999999999955,1.0979853403141362,7,-1,-1,torch_mm_npu,0,torch_mm_npu;timing=npu_profiler_batch_offline_kernel_step
2026-03-03T11:52:26.834571+00:00,TORCH,llm_style,tune,llm_style_tune_013,64,6144,1024,fp16,Ascend910B2,torch_mm_npu,-1,-1,-1,-1,-1,-1,0.0,0.0,8.68,9.130600000000001,92.77723133640553,1,-1,-1,torch_mm_npu,0,torch_mm_npu;timing=npu_profiler_batch_offline_kernel_step
2026-03-03T11:52:26.834589+00:00,TORCH,llm_style,tune,llm_style_tune_014,64,8192,8192,fp16,Ascend910B2,torch_mm_npu,-1,-1,-1,-1,-1,-1,0.0,0.0,76.602,98.27539999999992,112.13721041226077,0,-1,-1,torch_mm_npu,0,torch_mm_npu;timing=npu_profiler_batch_offline_kernel_step
2026-03-03T11:52:26.834601+00:00,TORCH,llm_style,tune,llm_style_tune_015,64,1536,3072,fp16,Ascend910B2,torch_mm_npu,-1,-1,-1,-1,-1,-1,0.0,0.0,12.25,18.43679999999998,49.30447151020409,3,-1,-1,torch_mm_npu,0,torch_mm_npu;timing=npu_profiler_batch_offline_kernel_step
2026-03-03T11:52:40.275261+00:00,TORCH,llm_style,eval,llm_style_eval_000,32,1536,1024,fp16,Ascend910B2,torch_mm_npu,-1,-1,-1,-1,-1,-1,0.0,0.0,6.25,6.66102,16.10612736,3,-1,-1,torch_mm_npu,0,torch_mm_npu;timing=npu_profiler_batch_offline_kernel_step
2026-03-03T11:52:40.275414+00:00,TORCH,llm_style,eval,llm_style_eval_001,32,2048,8192,fp16,Ascend910B2,torch_mm_npu,-1,-1,-1,-1,-1,-1,0.0,0.0,21.611,30.362799999999968,49.68496710008792,2,-1,-1,torch_mm_npu,0,torch_mm_npu;timing=npu_profiler_batch_offline_kernel_step
2026-03-03T11:52:40.275459+00:00,TORCH,llm_style,eval,llm_style_eval_002,16,2048,4096,fp16,Ascend910B2,torch_mm_npu,-1,-1,-1,-1,-1,-1,0.0,0.0,11.41,17.81339999999998,23.526332690622258,7,-1,-1,torch_mm_npu,0,torch_mm_npu;timing=npu_profiler_batch_offline_kernel_step
2026-03-03T11:52:40.275475+00:00,TORCH,llm_style,eval,llm_style_eval_003,16,2048,1536,fp16,Ascend910B2,torch_mm_npu,-1,-1,-1,-1,-1,-1,0.0,0.0,6.07,8.603419999999993,16.583739044481053,7,-1,-1,torch_mm_npu,0,torch_mm_npu;timing=npu_profiler_batch_offline_kernel_step
2026-03-03T11:52:40.275488+00:00,TORCH,llm_style,eval,llm_style_eval_004,64,8192,2048,fp16,Ascend910B2,torch_mm_npu,-1,-1,-1,-1,-1,-1,0.0,0.0,21.62,27.921599999999977,99.32856836262721,1,-1,-1,torch_mm_npu,0,torch_mm_npu;timing=npu_profiler_batch_offline_kernel_step
2026-03-03T11:52:40.275501+00:00,TORCH,llm_style,eval,llm_style_eval_005,64,3072,8192,fp16,Ascend910B2,torch_mm_npu,-1,-1,-1,-1,-1,-1,0.0,0.0,25.680999999999997,40.633599999999944,125.43224453876408,2,-1,-1,torch_mm_npu,0,torch_mm_npu;timing=npu_profiler_batch_offline_kernel_step
2026-03-03T11:52:40.275513+00:00,TORCH,llm_style,eval,llm_style_eval_006,32,2048,2048,fp16,Ascend910B2,torch_mm_npu,-1,-1,-1,-1,-1,-1,0.0,0.0,7.551,10.74619999999999,35.549656469341805,3,-1,-1,torch_mm_npu,0,torch_mm_npu;timing=npu_profiler_batch_offline_kernel_step
2026-03-03T11:52:40.275525+00:00,TORCH,llm_style,eval,llm_style_eval_007,8,8192,2048,fp16,Ascend910B2,torch_mm_npu,-1,-1,-1,-1,-1,-1,0.0,0.0,19.411,26.864999999999974,13.82903796816238,5,-1,-1,torch_mm_npu,0,torch_mm_npu;timing=npu_profiler_batch_offline_kernel_step
2026-03-03T11:52:40.275537+00:00,TORCH,llm_style,eval,llm_style_eval_008,64,1536,8192,fp16,Ascend910B2,torch_mm_npu,-1,-1,-1,-1,-1,-1,0.0,0.0,24.509999999999998,33.084579999999974,65.71247392900858,2,-1,-1,torch_mm_npu,0,torch_mm_npu;timing=npu_profiler_batch_offline_kernel_step
2026-03-03T11:52:40.275549+00:00,TORCH,llm_style,eval,llm_style_eval_009,64,4096,6144,fp16,Ascend910B2,torch_mm_npu,-1,-1,-1,-1,-1,-1,0.0,0.0,28.32,37.59837999999996,113.7438372881356,3,-1,-1,torch_mm_npu,0,torch_mm_npu;timing=npu_profiler_batch_offline_kernel_step
2026-03-03T11:52:40.275563+00:00,TORCH,llm_style,eval,llm_style_eval_010,64,2048,4096,fp16,Ascend910B2,torch_mm_npu,-1,-1,-1,-1,-1,-1,0.0,0.0,13.291,18.613999999999983,80.78713595666241,3,-1,-1,torch_mm_npu,0,torch_mm_npu;timing=npu_profiler_batch_offline_kernel_step
2026-03-03T11:52:40.275575+00:00,TORCH,llm_style,eval,llm_style_eval_011,32,3072,6144,fp16,Ascend910B2,torch_mm_npu,-1,-1,-1,-1,-1,-1,0.0,0.0,17.89,30.942199999999957,67.52149536053662,3,-1,-1,torch_mm_npu,0,torch_mm_npu;timing=npu_profiler_batch_offline_kernel_step
2026-03-03T11:52:40.275586+00:00,TORCH,llm_style,eval,llm_style_eval_012,16,1536,1536,fp16,Ascend910B2,torch_mm_npu,-1,-1,-1,-1,-1,-1,0.0,0.0,6.82,9.134799999999993,11.07001055718475,7,-1,-1,torch_mm_npu,0,torch_mm_npu;timing=npu_profiler_batch_offline_kernel_step
2026-03-03T11:52:40.275598+00:00,TORCH,llm_style,eval,llm_style_eval_013,64,2048,3072,fp16,Ascend910B2,torch_mm_npu,-1,-1,-1,-1,-1,-1,0.0,0.0,11.06,16.76159999999998,72.81251066907775,3,-1,-1,torch_mm_npu,0,torch_mm_npu;timing=npu_profiler_batch_offline_kernel_step
2026-03-03T11:52:40.275609+00:00,TORCH,llm_style,eval,llm_style_eval_014,16,8192,6144,fp16,Ascend910B2,torch_mm_npu,-1,-1,-1,-1,-1,-1,0.0,0.0,54.840999999999994,71.21641999999994,29.368770372531504,5,-1,-1,torch_mm_npu,0,torch_mm_npu;timing=npu_profiler_batch_offline_kernel_step
2026-03-03T11:52:40.275621+00:00,TORCH,llm_style,eval,llm_style_eval_015,64,6144,1536,fp16,Ascend910B2,torch_mm_npu,-1,-1,-1,-1,-1,-1,0.0,0.0,10.870000000000001,15.531399999999984,111.12783367065317,1,-1,-1,torch_mm_npu,0,torch_mm_npu;timing=npu_profiler_batch_offline_kernel_step
2026-03-03T11:52:50.461467+00:00,ONEKEY,llm_style,tune,llm_style_tune_000,8,2048,4096,fp16,Ascend910B2,c02,32,64,32,2,2,8,0.0,0.0,99.91999999999999,104.6264,1.3432518815052044,7,-1,-1,onekey:32x4096x2048,0,"onekey_rep_shape=32x4096x2048;batch_tune;path_reordered,ASCEND_HOME_PATH_set,ASCEND_TOOLKIT_HOME_set;timing=npu_profiler_offline_kernel_details"
2026-03-03T11:52:54.906085+00:00,ONEKEY,llm_style,tune,llm_style_tune_001,32,1536,3072,fp16,Ascend910B2,c02,32,64,32,2,2,8,0.0,0.0,57.209999999999994,61.861419999999995,5.27862066072365,3,-1,-1,onekey:32x4096x2048,0,"onekey_rep_shape=32x4096x2048;batch_tune;path_reordered,ASCEND_HOME_PATH_set,ASCEND_TOOLKIT_HOME_set;timing=npu_profiler_offline_kernel_details"
2026-03-03T11:52:54.906211+00:00,ONEKEY,llm_style,tune,llm_style_tune_002,32,4096,2048,fp16,Ascend910B2,c02,32,64,32,2,2,8,0.0,4639.119,92.572,100.1716,5.799495657434213,3,-1,-1,onekey:32x4096x2048,0,"onekey_rep_shape=32x4096x2048;batch_tune;path_reordered,ASCEND_HOME_PATH_set,ASCEND_TOOLKIT_HOME_set;timing=npu_profiler_batch_offline_kernel_step"
2026-03-03T11:52:59.346212+00:00,ONEKEY,llm_style,tune,llm_style_tune_003,1,3072,1536,fp16,Ascend910B2,c02,32,64,32,2,2,8,0.0,0.0,43.821,45.2394,0.21535756828917643,7,-1,-1,onekey:32x4096x2048,0,"onekey_rep_shape=32x4096x2048;batch_tune;path_reordered,ASCEND_HOME_PATH_set,ASCEND_TOOLKIT_HOME_set;timing=npu_profiler_offline_kernel_details"
2026-03-03T11:53:03.711708+00:00,ONEKEY,llm_style,tune,llm_style_tune_004,8,1024,1536,fp16,Ascend910B2,c02,32,64,32,2,2,8,0.0,0.0,24.22,25.41162,1.0390513625103222,7,-1,-1,onekey:32x4096x2048,0,"onekey_rep_shape=32x4096x2048;batch_tune;path_reordered,ASCEND_HOME_PATH_set,ASCEND_TOOLKIT_HOME_set;timing=npu_profiler_offline_kernel_details"
2026-03-03T11:53:08.888372+00:00,ONEKEY,llm_style,tune,llm_style_tune_005,1,4096,8192,fp16,Ascend910B2,c02,32,64,32,2,2,8,0.0,0.0,221.485,231.72082,0.3029950741585209,6,-1,-1,onekey:32x4096x2048,0,"onekey_rep_shape=32x4096x2048;batch_tune;path_reordered,ASCEND_HOME_PATH_set,ASCEND_TOOLKIT_HOME_set;timing=npu_profiler_offline_kernel_details"
2026-03-03T11:53:13.388046+00:00,ONEKEY,llm_style,tune,llm_style_tune_006,4,6144,1024,fp16,Ascend910B2,c02,32,64,32,2,2,8,0.0,0.0,61.372,66.75838,0.8201076712507333,5,-1,-1,onekey:32x4096x2048,0,"onekey_rep_shape=32x4096x2048;batch_tune;path_reordered,ASCEND_HOME_PATH_set,ASCEND_TOOLKIT_HOME_set;timing=npu_profiler_offline_kernel_details"
2026-03-03T11:53:19.468909+00:00,ONEKEY,llm_style,tune,llm_style_tune_007,4,8192,8192,fp16,Ascend910B2,c02,32,64,32,2,2,8,0.0,0.0,444.81899999999996,458.61338,1.206942401291312,4,-1,-1,onekey:32x4096x2048,0,"onekey_rep_shape=32x4096x2048;batch_tune;path_reordered,ASCEND_HOME_PATH_set,ASCEND_TOOLKIT_HOME_set;timing=npu_profiler_offline_kernel_details"
2026-03-03T11:53:23.961530+00:00,ONEKEY,llm_style,tune,llm_style_tune_008,64,6144,1024,fp16,Ascend910B2,c02,32,64,32,2,2,8,0.0,0.0,95.712,98.27398,8.413849548645938,1,-1,-1,onekey:32x4096x2048,0,"onekey_rep_shape=32x4096x2048;batch_tune;path_reordered,ASCEND_HOME_PATH_set,ASCEND_TOOLKIT_HOME_set;timing=npu_profiler_offline_kernel_details"
2026-03-03T11:53:28.611559+00:00,ONEKEY,llm_style,tune,llm_style_tune_009,2,4096,3072,fp16,Ascend910B2,c02,32,64,32,2,2,8,0.0,0.0,99.451,106.1252,0.5060949412273381,7,-1,-1,onekey:32x4096x2048,0,"onekey_rep_shape=32x4096x2048;batch_tune;path_reordered,ASCEND_HOME_PATH_set,ASCEND_TOOLKIT_HOME_set;timing=npu_profiler_offline_kernel_details"
2026-03-03T11:53:33.366826+00:00,ONEKEY,llm_style,tune,llm_style_tune_010,32,2048,8192,fp16,Ascend910B2,c02,32,64,32,2,2,8,0.0,0.0,191.632,199.5644,5.6031446939968275,2,-1,-1,onekey:32x4096x2048,0,"onekey_rep_shape=32x4096x2048;batch_tune;path_reordered,ASCEND_HOME_PATH_set,ASCEND_TOOLKIT_HOME_set;timing=npu_profiler_offline_kernel_details"
2026-03-03T11:53:37.833206+00:00,ONEKEY,llm_style,tune,llm_style_tune_011,32,3072,1536,fp16,Ascend910B2,c02,32,64,32,2,2,8,0.0,0.0,60.791,63.5852,4.9676742938921885,3,-1,-1,onekey:32x4096x2048,0,"onekey_rep_shape=32x4096x2048;batch_tune;path_reordered,ASCEND_HOME_PATH_set,ASCEND_TOOLKIT_HOME_set;timing=npu_profiler_offline_kernel_details"
2026-03-03T11:53:42.202933+00:00,ONEKEY,llm_style,tune,llm_style_tune_012,2,1536,1024,fp16,Ascend910B2,c02,32,64,32,2,2,8,0.0,0.0,22.97,24.1432,0.2738988245537658,7,-1,-1,onekey:32x4096x2048,0,"onekey_rep_shape=32x4096x2048;batch_tune;path_reordered,ASCEND_HOME_PATH_set,ASCEND_TOOLKIT_HOME_set;timing=npu_profiler_offline_kernel_details"
2026-03-03T11:53:46.688279+00:00,ONEKEY,llm_style,tune,llm_style_tune_013,64,6144,1024,fp16,Ascend910B2,c02,32,64,32,2,2,8,0.0,0.0,95.583,100.3882,8.425204984149902,1,-1,-1,onekey:32x4096x2048,0,"onekey_rep_shape=32x4096x2048;batch_tune;path_reordered,ASCEND_HOME_PATH_set,ASCEND_TOOLKIT_HOME_set;timing=npu_profiler_offline_kernel_details"
2026-03-03T11:53:53.264504+00:00,ONEKEY,llm_style,tune,llm_style_tune_014,64,8192,8192,fp16,Ascend910B2,c02,32,64,32,2,2,8,0.0,0.0,863.607,871.711,9.946578237554814,0,-1,-1,onekey:32x4096x2048,0,"onekey_rep_shape=32x4096x2048;batch_tune;path_reordered,ASCEND_HOME_PATH_set,ASCEND_TOOLKIT_HOME_set;timing=npu_profiler_offline_kernel_details"
2026-03-03T11:53:57.727406+00:00,ONEKEY,llm_style,tune,llm_style_tune_015,64,1536,3072,fp16,Ascend910B2,c02,32,64,32,2,2,8,0.0,0.0,72.631,76.05619999999999,8.315729867411987,3,-1,-1,onekey:32x4096x2048,0,"onekey_rep_shape=32x4096x2048;batch_tune;path_reordered,ASCEND_HOME_PATH_set,ASCEND_TOOLKIT_HOME_set;timing=npu_profiler_offline_kernel_details"
2026-03-03T11:53:57.727556+00:00,ONEKEY,llm_style,eval,llm_style_eval_000,32,1536,1024,fp16,Ascend910B2,c02,32,64,32,2,2,8,0.0,0.0,28.070999999999998,29.58,3.586024580527947,3,-1,-1,onekey:32x4096x2048,0,"onekey_rep_shape=32x4096x2048;batch_tune;path_reordered,ASCEND_HOME_PATH_set,ASCEND_TOOLKIT_HOME_set;timing=npu_profiler_batch_offline_kernel_step"
2026-03-03T11:53:57.727592+00:00,ONEKEY,llm_style,eval,llm_style_eval_001,32,2048,8192,fp16,Ascend910B2,c02,32,64,32,2,2,8,0.0,0.0,194.604,252.2230199999998,5.517573246181989,2,-1,-1,onekey:32x4096x2048,0,"onekey_rep_shape=32x4096x2048;batch_tune;path_reordered,ASCEND_HOME_PATH_set,ASCEND_TOOLKIT_HOME_set;timing=npu_profiler_batch_offline_kernel_step"
2026-03-03T11:53:57.727617+00:00,ONEKEY,llm_style,eval,llm_style_eval_002,16,2048,4096,fp16,Ascend910B2,c02,32,64,32,2,2,8,0.0,0.0,102.162,130.6367999999999,2.6275469939899376,7,-1,-1,onekey:32x4096x2048,0,"onekey_rep_shape=32x4096x2048;batch_tune;path_reordered,ASCEND_HOME_PATH_set,ASCEND_TOOLKIT_HOME_set;timing=npu_profiler_batch_offline_kernel_step"
2026-03-03T11:53:57.727640+00:00,ONEKEY,llm_style,eval,llm_style_eval_003,16,2048,1536,fp16,Ascend910B2,c02,32,64,32,2,2,8,0.0,0.0,50.042,61.186579999999964,2.011576195995364,7,-1,-1,onekey:32x4096x2048,0,"onekey_rep_shape=32x4096x2048;batch_tune;path_reordered,ASCEND_HOME_PATH_set,ASCEND_TOOLKIT_HOME_set;timing=npu_profiler_batch_offline_kernel_step"
2026-03-03T11:53:57.727664+00:00,ONEKEY,llm_style,eval,llm_style_eval_004,64,8192,2048,fp16,Ascend910B2,c02,32,64,32,2,2,8,0.0,0.0,230.38600000000002,291.5075999999998,9.32124195046574,1,-1,-1,onekey:32x4096x2048,0,"onekey_rep_shape=32x4096x2048;batch_tune;path_reordered,ASCEND_HOME_PATH_set,ASCEND_TOOLKIT_HOME_set;timing=npu_profiler_batch_offline_kernel_step"
2026-03-03T11:53:57.727684+00:00,ONEKEY,llm_style,eval,llm_style_eval_005,64,3072,8192,fp16,Ascend910B2,c02,32,64,32,2,2,8,0.0,0.0,333.587,451.11305999999956,9.656327950429723,2,-1,-1,onekey:32x4096x2048,0,"onekey_rep_shape=32x4096x2048;batch_tune;path_reordered,ASCEND_HOME_PATH_set,ASCEND_TOOLKIT_HOME_set;timing=npu_profiler_batch_offline_kernel_step"
2026-03-03T11:53:57.727708+00:00,ONEKEY,llm_style,eval,llm_style_eval_006,32,2048,2048,fp16,Ascend910B2,c02,32,64,32,2,2,8,0.0,0.0,65.413,80.70639999999997,4.103701955268831,3,-1,-1,onekey:32x4096x2048,0,"onekey_rep_shape=32x4096x2048;batch_tune;path_reordered,ASCEND_HOME_PATH_set,ASCEND_TOOLKIT_HOME_set;timing=npu_profiler_batch_offline_kernel_step"
2026-03-03T11:53:57.727731+00:00,ONEKEY,llm_style,eval,llm_style_eval_007,8,8192,2048,fp16,Ascend910B2,c02,32,64,32,2,2,8,0.0,0.0,128.743,166.53861999999987,2.0850489424667753,5,-1,-1,onekey:32x4096x2048,0,"onekey_rep_shape=32x4096x2048;batch_tune;path_reordered,ASCEND_HOME_PATH_set,ASCEND_TOOLKIT_HOME_set;timing=npu_profiler_batch_offline_kernel_step"
2026-03-03T11:53:57.727748+00:00,ONEKEY,llm_style,eval,llm_style_eval_008,64,1536,8192,fp16,Ascend910B2,c02,32,64,32,2,2,8,0.0,0.0,175.12400000000002,231.42341999999982,9.19698462803499,2,-1,-1,onekey:32x4096x2048,0,"onekey_rep_shape=32x4096x2048;batch_tune;path_reordered,ASCEND_HOME_PATH_set,ASCEND_TOOLKIT_HOME_set;timing=npu_profiler_batch_offline_kernel_step"
2026-03-03T11:53:57.727768+00:00,ONEKEY,llm_style,eval,llm_style_eval_009,64,4096,6144,fp16,Ascend910B2,c02,32,64,32,2,2,8,0.0,0.0,354.767,480.9088399999995,9.079834009363893,3,-1,-1,onekey:32x4096x2048,0,"onekey_rep_shape=32x4096x2048;batch_tune;path_reordered,ASCEND_HOME_PATH_set,ASCEND_TOOLKIT_HOME_set;timing=npu_profiler_batch_offline_kernel_step"
2026-03-03T11:53:57.727793+00:00,ONEKEY,llm_style,eval,llm_style_eval_010,64,2048,4096,fp16,Ascend910B2,c02,32,64,32,2,2,8,0.0,0.0,132.293,166.73501999999988,8.116391827231977,3,-1,-1,onekey:32x4096x2048,0,"onekey_rep_shape=32x4096x2048;batch_tune;path_reordered,ASCEND_HOME_PATH_set,ASCEND_TOOLKIT_HOME_set;timing=npu_profiler_batch_offline_kernel_step"
2026-03-03T11:53:57.727812+00:00,ONEKEY,llm_style,eval,llm_style_eval_011,32,3072,6144,fp16,Ascend910B2,c02,32,64,32,2,2,8,0.0,0.0,154.433,206.00801999999982,7.821900448738288,3,-1,-1,onekey:32x4096x2048,0,"onekey_rep_shape=32x4096x2048;batch_tune;path_reordered,ASCEND_HOME_PATH_set,ASCEND_TOOLKIT_HOME_set;timing=npu_profiler_batch_offline_kernel_step"
2026-03-03T11:53:57.727832+00:00,ONEKEY,llm_style,eval,llm_style_eval_012,16,1536,1536,fp16,Ascend910B2,c02,32,64,32,2,2,8,0.0,0.0,35.061,40.91017999999999,2.1533177034311626,7,-1,-1,onekey:32x4096x2048,0,"onekey_rep_shape=32x4096x2048;batch_tune;path_reordered,ASCEND_HOME_PATH_set,ASCEND_TOOLKIT_HOME_set;timing=npu_profiler_batch_offline_kernel_step"
2026-03-03T11:53:57.727848+00:00,ONEKEY,llm_style,eval,llm_style_eval_013,64,2048,3072,fp16,Ascend910B2,c02,32,64,32,2,2,8,0.0,0.0,102.03,128.82461999999992,7.892839047339018,3,-1,-1,onekey:32x4096x2048,0,"onekey_rep_shape=32x4096x2048;batch_tune;path_reordered,ASCEND_HOME_PATH_set,ASCEND_TOOLKIT_HOME_set;timing=npu_profiler_batch_offline_kernel_step"
2026-03-03T11:53:57.727867+00:00,ONEKEY,llm_style,eval,llm_style_eval_014,16,8192,6144,fp16,Ascend910B2,c02,32,64,32,2,2,8,0.0,0.0,356.217,463.80363999999963,4.521437034167376,5,-1,-1,onekey:32x4096x2048,0,"onekey_rep_shape=32x4096x2048;batch_tune;path_reordered,ASCEND_HOME_PATH_set,ASCEND_TOOLKIT_HOME_set;timing=npu_profiler_batch_offline_kernel_step"
2026-03-03T11:53:57.727888+00:00,ONEKEY,llm_style,eval,llm_style_eval_015,64,6144,1536,fp16,Ascend910B2,c02,32,64,32,2,2,8,0.0,0.0,136.594,178.14421999999985,8.843430545997629,1,-1,-1,onekey:32x4096x2048,0,"onekey_rep_shape=32x4096x2048;batch_tune;path_reordered,ASCEND_HOME_PATH_set,ASCEND_TOOLKIT_HOME_set;timing=npu_profiler_batch_offline_kernel_step"
