results/ascend_full_vs_bucket_with_torch.csv
timestamp,method,workload,split,shape_id,M,N,K,dtype,gpu,config_id,BLOCK_M,BLOCK_N,BLOCK_K,num_warps,num_stages,GROUP_M,compile_time_ms,tune_time_ms,runtime_cost_us,p99_us,runtime_perf_tflops,bucket_m,bucket_n,bucket_k,cache_key,invalid_config,notes
2026-03-03T08:25:15.584121+00:00,FULL,llm_style,tune,llm_style_tune_000,8,2048,4096,fp16,Ascend910B2,c07,128,128,32,8,3,8,707.1832697838545,9418.94,248.5700026154518,272.2595927119255,0.539959474545448,7,-1,-1,8x2048x4096,0,"path_reordered,ASCEND_HOME_PATH_set,ASCEND_TOOLKIT_HOME_set"
2026-03-03T08:25:24.099954+00:00,FULL,llm_style,tune,llm_style_tune_001,32,1536,3072,fp16,Ascend910B2,c11,32,128,32,4,2,8,0.0,8515.743,250.67999213933945,278.73598873615265,1.2046828525195585,3,-1,-1,32x1536x3072,0,"path_reordered,ASCEND_HOME_PATH_set,ASCEND_TOOLKIT_HOME_set"
2026-03-03T08:25:24.364208+00:00,FULL,llm_style,tune,llm_style_tune_002,32,4096,2048,fp16,Ascend910B2,c08,128,128,64,8,4,8,0.0,264.17,246.91999703645706,263.67900162935257,2.1742706886584506,3,-1,-1,32x4096x2048,0,"path_reordered,ASCEND_HOME_PATH_set,ASCEND_TOOLKIT_HOME_set"
2026-03-03T08:25:36.248343+00:00,FULL,llm_style,tune,llm_style_tune_003,1,3072,1536,fp16,Ascend910B2,c02,32,64,32,2,2,8,0.0,11884.039,243.0500015616417,300.34580409526825,0.03882815856558045,7,-1,-1,1x3072x1536,0,"path_reordered,ASCEND_HOME_PATH_set,ASCEND_TOOLKIT_HOME_set"
2026-03-03T08:25:36.348820+00:00,FULL,llm_style,tune,llm_style_tune_004,8,1024,1536,fp16,Ascend910B2,c10,64,128,64,8,3,8,0.0,100.369,255.78999519348145,272.3265936970711,0.09838470805304321,7,-1,-1,8x1024x1536,0,"path_reordered,ASCEND_HOME_PATH_set,ASCEND_TOOLKIT_HOME_set"
2026-03-03T08:25:37.229477+00:00,FULL,llm_style,tune,llm_style_tune_005,1,4096,8192,fp16,Ascend910B2,c10,64,128,64,8,3,8,0.0,880.515,247.83000349998474,263.4163874387741,0.27078587359179107,6,-1,-1,1x4096x8192,0,"path_reordered,ASCEND_HOME_PATH_set,ASCEND_TOOLKIT_HOME_set"
2026-03-03T08:25:37.446021+00:00,FULL,llm_style,tune,llm_style_tune_006,4,6144,1024,fp16,Ascend910B2,c06,64,128,32,4,3,8,0.0,216.393,235.8499988913536,243.05220618844032,0.21340533490180646,5,-1,-1,4x6144x1024,0,"path_reordered,ASCEND_HOME_PATH_set,ASCEND_TOOLKIT_HOME_set"
2026-03-03T08:25:39.159287+00:00,FULL,llm_style,tune,llm_style_tune_007,4,8192,8192,fp16,Ascend910B2,c08,128,128,64,8,4,8,0.0,1713.167,289.19999301433563,305.566611289978,1.8564001554916612,4,-1,-1,4x8192x8192,0,"path_reordered,ASCEND_HOME_PATH_set,ASCEND_TOOLKIT_HOME_set"
2026-03-03T08:25:39.380311+00:00,FULL,llm_style,tune,llm_style_tune_008,64,6144,1024,fp16,Ascend910B2,c07,128,128,32,8,3,8,0.0,220.94,236.80999875068665,249.59999442100525,3.4006434367149585,1,-1,-1,64x6144x1024,0,"path_reordered,ASCEND_HOME_PATH_set,ASCEND_TOOLKIT_HOME_set"
2026-03-03T08:25:39.748307+00:00,FULL,llm_style,tune,llm_style_tune_009,2,4096,3072,fp16,Ascend910B2,c06,64,128,32,4,3,8,0.0,367.912,237.6900017261505,260.26799499988556,0.21175332422265092,7,-1,-1,2x4096x3072,0,"path_reordered,ASCEND_HOME_PATH_set,ASCEND_TOOLKIT_HOME_set"
2026-03-03T08:25:40.235150+00:00,FULL,llm_style,tune,llm_style_tune_010,32,2048,8192,fp16,Ascend910B2,c08,128,128,64,8,4,8,0.0,486.758,233.58000069856644,236.38940557837486,4.5968910899424875,2,-1,-1,32x2048x8192,0,"path_reordered,ASCEND_HOME_PATH_set,ASCEND_TOOLKIT_HOME_set"
2026-03-03T08:25:40.411192+00:00,FULL,llm_style,tune,llm_style_tune_011,32,3072,1536,fp16,Ascend910B2,c08,128,128,64,8,4,8,0.0,175.957,232.7900007367134,244.19280350208282,1.2972631429369341,3,-1,-1,32x3072x1536,0,"path_reordered,ASCEND_HOME_PATH_set,ASCEND_TOOLKIT_HOME_set"
2026-03-03T08:25:40.508625+00:00,FULL,llm_style,tune,llm_style_tune_012,2,1536,1024,fp16,Ascend910B2,c05,128,64,32,4,3,8,0.0,97.315,239.5699992775917,243.73999804258347,0.02626145184694031,7,-1,-1,2x1536x1024,0,"path_reordered,ASCEND_HOME_PATH_set,ASCEND_TOOLKIT_HOME_set"
2026-03-03T08:25:40.667464+00:00,FULL,llm_style,tune,llm_style_tune_013,64,6144,1024,fp16,Ascend910B2,c07,128,128,32,8,3,8,0.0,0.0,238.8100028038025,246.63260474801064,3.3721634711491126,1,-1,-1,64x6144x1024,0,"path_reordered,ASCEND_HOME_PATH_set,ASCEND_TOOLKIT_HOME_set"
2026-03-03T08:25:42.404198+00:00,FULL,llm_style,tune,llm_style_tune_014,64,8192,8192,fp16,Ascend910B2,c08,128,128,64,8,4,8,0.0,1736.647,312.8200024366379,316.73778772354126,27.459671776391293,0,-1,-1,64x8192x8192,0,"path_reordered,ASCEND_HOME_PATH_set,ASCEND_TOOLKIT_HOME_set"
2026-03-03T08:25:42.586246+00:00,FULL,llm_style,tune,llm_style_tune_015,64,1536,3072,fp16,Ascend910B2,c07,128,128,32,8,3,8,0.0,181.966,236.32999509572983,252.25541204214096,2.5556627958095075,3,-1,-1,64x1536x3072,0,"path_reordered,ASCEND_HOME_PATH_set,ASCEND_TOOLKIT_HOME_set"
2026-03-03T08:25:42.686187+00:00,FULL,llm_style,eval,llm_style_eval_000,32,1536,1024,fp16,Ascend910B2,c00,32,32,32,2,2,8,0.0,99.812,246.88000231981277,251.529401242733,0.4077417978536753,3,-1,-1,32x1536x1024,0,"path_reordered,ASCEND_HOME_PATH_set,ASCEND_TOOLKIT_HOME_set"
2026-03-03T08:25:43.102803+00:00,FULL,llm_style,eval,llm_style_eval_001,32,2048,8192,fp16,Ascend910B2,c08,128,128,64,8,4,8,0.0,0.0,238.0800023674965,260.8579944074154,4.510004256227237,2,-1,-1,32x2048x8192,0,"path_reordered,ASCEND_HOME_PATH_set,ASCEND_TOOLKIT_HOME_set"
2026-03-03T08:25:43.372104+00:00,FULL,llm_style,eval,llm_style_eval_002,16,2048,4096,fp16,Ascend910B2,c11,32,128,32,4,2,8,0.0,269.202,233.0000028014183,239.05339807271957,1.1520834882941295,7,-1,-1,16x2048x4096,0,"path_reordered,ASCEND_HOME_PATH_set,ASCEND_TOOLKIT_HOME_set"
2026-03-03T08:25:43.511348+00:00,FULL,llm_style,eval,llm_style_eval_003,16,2048,1536,fp16,Ascend910B2,c05,128,64,32,4,3,8,0.0,139.16,236.86999827623367,257.98921033740044,0.42497275607951085,7,-1,-1,16x2048x1536,0,"path_reordered,ASCEND_HOME_PATH_set,ASCEND_TOOLKIT_HOME_set"
2026-03-03T08:25:44.009363+00:00,FULL,llm_style,eval,llm_style_eval_004,64,8192,2048,fp16,Ascend910B2,c09,128,64,64,8,3,8,0.0,497.9,236.6899996995926,268.83339032530785,9.072980061369684,1,-1,-1,64x8192x2048,0,"path_reordered,ASCEND_HOME_PATH_set,ASCEND_TOOLKIT_HOME_set"
2026-03-03T08:25:44.712716+00:00,FULL,llm_style,eval,llm_style_eval_005,64,3072,8192,fp16,Ascend910B2,c10,64,128,64,8,3,8,0.0,703.264,239.6399974822998,253.08399438858032,13.441935844778685,2,-1,-1,64x3072x8192,0,"path_reordered,ASCEND_HOME_PATH_set,ASCEND_TOOLKIT_HOME_set"
2026-03-03T08:25:44.885283+00:00,FULL,llm_style,eval,llm_style_eval_006,32,2048,2048,fp16,Ascend910B2,c10,64,128,64,8,3,8,0.0,172.479,238.68999630212784,249.08500477671623,1.1246196328237446,3,-1,-1,32x2048x2048,0,"path_reordered,ASCEND_HOME_PATH_set,ASCEND_TOOLKIT_HOME_set"
2026-03-03T08:25:45.363506+00:00,FULL,llm_style,eval,llm_style_eval_007,8,8192,2048,fp16,Ascend910B2,c10,64,128,64,8,3,8,0.0,478.102,237.32999712228775,257.6270040869713,1.1310641691100038,5,-1,-1,8x8192x2048,0,"path_reordered,ASCEND_HOME_PATH_set,ASCEND_TOOLKIT_HOME_set"
2026-03-03T08:25:45.751051+00:00,FULL,llm_style,eval,llm_style_eval_008,64,1536,8192,fp16,Ascend910B2,c10,64,128,64,8,3,8,0.0,387.462,237.59999871253967,249.50719758868217,6.778673168044077,2,-1,-1,64x1536x8192,0,"path_reordered,ASCEND_HOME_PATH_set,ASCEND_TOOLKIT_HOME_set"
2026-03-03T08:25:46.453425+00:00,FULL,llm_style,eval,llm_style_eval_009,64,4096,6144,fp16,Ascend910B2,c10,64,128,64,8,3,8,0.0,702.279,243.5699999332428,248.02280142903328,13.22505018221812,3,-1,-1,64x4096x6144,0,"path_reordered,ASCEND_HOME_PATH_set,ASCEND_TOOLKIT_HOME_set"
2026-03-03T08:25:46.723770+00:00,FULL,llm_style,eval,llm_style_eval_010,64,2048,4096,fp16,Ascend910B2,c08,128,128,64,8,4,8,0.0,270.259,234.07000303268433,270.3102084994316,4.58726795440793,3,-1,-1,64x2048x4096,0,"path_reordered,ASCEND_HOME_PATH_set,ASCEND_TOOLKIT_HOME_set"
2026-03-03T08:25:47.256780+00:00,FULL,llm_style,eval,llm_style_eval_011,32,3072,6144,fp16,Ascend910B2,c04,64,64,64,4,3,8,0.0,532.917,237.94999718666077,258.73779624700546,5.076526859768826,3,-1,-1,32x3072x6144,0,"path_reordered,ASCEND_HOME_PATH_set,ASCEND_TOOLKIT_HOME_set"
2026-03-03T08:25:47.374970+00:00,FULL,llm_style,eval,llm_style_eval_012,16,1536,1536,fp16,Ascend910B2,c11,32,128,32,4,2,8,0.0,118.104,243.41999739408493,248.53799849748611,0.3101531213878593,7,-1,-1,16x1536x1536,0,"path_reordered,ASCEND_HOME_PATH_set,ASCEND_TOOLKIT_HOME_set"
2026-03-03T08:25:47.594884+00:00,FULL,llm_style,eval,llm_style_eval_013,64,2048,3072,fp16,Ascend910B2,c09,128,64,64,8,3,8,0.0,219.786,234.9499985575676,245.18099501729012,3.427564898676444,3,-1,-1,64x2048x3072,0,"path_reordered,ASCEND_HOME_PATH_set,ASCEND_TOOLKIT_HOME_set"
2026-03-03T08:25:48.896152+00:00,FULL,llm_style,eval,llm_style_eval_014,16,8192,6144,fp16,Ascend910B2,c10,64,128,64,8,3,8,0.0,1301.176,260.0700110197067,264.5397952198982,6.192996761468035,5,-1,-1,16x8192x6144,0,"path_reordered,ASCEND_HOME_PATH_set,ASCEND_TOOLKIT_HOME_set"
2026-03-03T08:25:49.200932+00:00,FULL,llm_style,eval,llm_style_eval_015,64,6144,1536,fp16,Ascend910B2,c07,128,128,32,8,3,8,0.0,304.689,232.4799969792366,238.52319344878197,5.195971987679808,1,-1,-1,64x6144x1536,0,"path_reordered,ASCEND_HOME_PATH_set,ASCEND_TOOLKIT_HOME_set"
2026-03-03T08:25:49.679266+00:00,FULL,llm_style,eval,llm_style_eval_016,16,4096,4096,fp16,Ascend910B2,c08,128,128,64,8,4,8,0.0,478.231,234.72999781370163,244.18099865317345,2.287184923105136,7,-1,-1,16x4096x4096,0,"path_reordered,ASCEND_HOME_PATH_set,ASCEND_TOOLKIT_HOME_set"
2026-03-03T08:25:50.581246+00:00,FULL,llm_style,eval,llm_style_eval_017,64,8192,4096,fp16,Ascend910B2,c10,64,128,64,8,3,8,0.0,901.862,241.20000004768372,262.99999862909317,17.806663744406766,1,-1,-1,64x8192x4096,0,"path_reordered,ASCEND_HOME_PATH_set,ASCEND_TOOLKIT_HOME_set"
2026-03-03T08:25:51.274666+00:00,FULL,llm_style,eval,llm_style_eval_018,32,4096,6144,fp16,Ascend910B2,c10,64,128,64,8,3,8,0.0,693.321,236.67000234127045,246.40979498624802,6.805310010000967,3,-1,-1,32x4096x6144,0,"path_reordered,ASCEND_HOME_PATH_set,ASCEND_TOOLKIT_HOME_set"
2026-03-03T08:25:51.951066+00:00,FULL,llm_style,eval,llm_style_eval_019,16,3072,8192,fp16,Ascend910B2,c08,128,128,64,8,4,8,0.0,676.315,233.75999927520752,249.30780664086342,3.44501356304295,6,-1,-1,16x3072x8192,0,"path_reordered,ASCEND_HOME_PATH_set,ASCEND_TOOLKIT_HOME_set"
2026-03-03T08:25:52.072480+00:00,FULL,llm_style,eval,llm_style_eval_020,4,1536,1536,fp16,Ascend910B2,c04,64,64,64,4,3,8,0.0,121.325,236.88999563455582,253.64798679947853,0.07967566527848229,7,-1,-1,4x1536x1536,0,"path_reordered,ASCEND_HOME_PATH_set,ASCEND_TOOLKIT_HOME_set"
2026-03-03T08:25:52.361798+00:00,FULL,llm_style,eval,llm_style_eval_021,4,6144,1536,fp16,Ascend910B2,c09,128,64,64,8,3,8,0.0,289.21,233.50000381469727,300.24099946022034,0.3233296392573675,5,-1,-1,4x6144x1536,0,"path_reordered,ASCEND_HOME_PATH_set,ASCEND_TOOLKIT_HOME_set"
2026-03-03T08:25:52.577424+00:00,FULL,llm_style,eval,llm_style_eval_022,32,6144,1024,fp16,Ascend910B2,c08,128,128,64,8,4,8,0.0,215.542,233.70999842882156,245.42120531201363,1.7228753014716722,1,-1,-1,32x6144x1024,0,"path_reordered,ASCEND_HOME_PATH_set,ASCEND_TOOLKIT_HOME_set"
2026-03-03T08:25:52.676621+00:00,FULL,llm_style,eval,llm_style_eval_023,16,1024,1536,fp16,Ascend910B2,c06,64,128,32,4,3,8,0.0,99.113,245.899997651577,279.8400104045868,0.20468340171078978,7,-1,-1,16x1024x1536,0,"path_reordered,ASCEND_HOME_PATH_set,ASCEND_TOOLKIT_HOME_set"
2026-03-03T08:25:52.946052+00:00,FULL,llm_style,eval,llm_style_eval_024,32,8192,1024,fp16,Ascend910B2,c04,64,64,64,4,3,8,0.0,269.344,233.8000014424324,254.29459869861603,2.296282757432709,1,-1,-1,32x8192x1024,0,"path_reordered,ASCEND_HOME_PATH_set,ASCEND_TOOLKIT_HOME_set"
2026-03-03T08:25:53.945099+00:00,FULL,llm_style,eval,llm_style_eval_025,32,6144,6144,fp16,Ascend910B2,c08,128,128,64,8,4,8,0.0,998.946,236.29000037908554,256.85119196772575,10.224381480909413,1,-1,-1,32x6144x6144,0,"path_reordered,ASCEND_HOME_PATH_set,ASCEND_TOOLKIT_HOME_set"
2026-03-03T08:25:54.313385+00:00,FULL,llm_style,eval,llm_style_eval_026,1,6144,2048,fp16,Ascend910B2,c08,128,128,64,8,4,8,0.0,368.196,234.62999612092972,246.5464048087597,0.10725748802821179,5,-1,-1,1x6144x2048,0,"path_reordered,ASCEND_HOME_PATH_set,ASCEND_TOOLKIT_HOME_set"
2026-03-03T08:25:54.681968+00:00,FULL,llm_style,eval,llm_style_eval_027,32,4096,3072,fp16,Ascend910B2,c10,64,128,64,8,3,8,0.0,368.454,236.34999990463257,255.59921026229858,3.4072619772580572,3,-1,-1,32x4096x3072,0,"path_reordered,ASCEND_HOME_PATH_set,ASCEND_TOOLKIT_HOME_set"
2026-03-03T08:25:54.804572+00:00,FULL,llm_style,eval,llm_style_eval_028,64,1536,1536,fp16,Ascend910B2,c06,64,128,32,4,3,8,0.0,122.515,238.50999772548676,246.7725932598114,1.266151905076849,3,-1,-1,64x1536x1536,0,"path_reordered,ASCEND_HOME_PATH_set,ASCEND_TOOLKIT_HOME_set"
2026-03-03T08:25:54.940207+00:00,FULL,llm_style,eval,llm_style_eval_029,2,3072,1024,fp16,Ascend910B2,c11,32,128,32,4,2,8,0.0,135.548,244.04000490903854,246.7115941643715,0.05156085783841076,7,-1,-1,2x3072x1024,0,"path_reordered,ASCEND_HOME_PATH_set,ASCEND_TOOLKIT_HOME_set"
2026-03-03T08:25:55.315224+00:00,FULL,llm_style,eval,llm_style_eval_030,32,1536,8192,fp16,Ascend910B2,c10,64,128,64,8,3,8,0.0,374.938,233.34000259637833,256.4969991147518,3.4512143611868593,2,-1,-1,32x1536x8192,0,"path_reordered,ASCEND_HOME_PATH_set,ASCEND_TOOLKIT_HOME_set"
2026-03-03T08:25:55.535953+00:00,FULL,llm_style,eval,llm_style_eval_031,8,3072,2048,fp16,Ascend910B2,c05,128,64,32,4,3,8,0.0,220.636,231.96999728679657,241.34440138936043,0.43394963649348467,7,-1,-1,8x3072x2048,0,"path_reordered,ASCEND_HOME_PATH_set,ASCEND_TOOLKIT_HOME_set"
2026-03-03T08:25:55.752701+00:00,FULL,llm_style,eval,llm_style_eval_032,8,2048,3072,fp16,Ascend910B2,c04,64,64,64,4,3,8,0.0,216.666,232.4099987745285,243.97739574313164,0.43312807766785466,7,-1,-1,8x2048x3072,0,"path_reordered,ASCEND_HOME_PATH_set,ASCEND_TOOLKIT_HOME_set"
2026-03-03T08:25:56.078349+00:00,FULL,llm_style,eval,llm_style_eval_033,64,1536,8192,fp16,Ascend910B2,c10,64,128,64,8,3,8,0.0,0.0,236.63999885320663,241.70179903507233,6.806172852456363,2,-1,-1,64x1536x8192,0,"path_reordered,ASCEND_HOME_PATH_set,ASCEND_TOOLKIT_HOME_set"
2026-03-03T08:25:56.450530+00:00,FULL,llm_style,eval,llm_style_eval_034,64,6144,2048,fp16,Ascend910B2,c09,128,64,64,8,3,8,0.0,372.074,232.9300045967102,235.59520214796066,6.914578217557583,1,-1,-1,64x6144x2048,0,"path_reordered,ASCEND_HOME_PATH_set,ASCEND_TOOLKIT_HOME_set"
2026-03-03T08:25:56.725626+00:00,FULL,llm_style,eval,llm_style_eval_035,4,4096,2048,fp16,Ascend910B2,c09,128,64,64,8,3,8,0.0,275.002,234.3600019812584,249.0102058649063,0.2863494770125776,7,-1,-1,4x4096x2048,0,"path_reordered,ASCEND_HOME_PATH_set,ASCEND_TOOLKIT_HOME_set"
2026-03-03T08:25:57.555161+00:00,FULL,llm_style,eval,llm_style_eval_036,64,8192,4096,fp16,Ascend910B2,c10,64,128,64,8,3,8,0.0,0.0,244.51999366283417,260.893000215292,17.564892063273494,1,-1,-1,64x8192x4096,0,"path_reordered,ASCEND_HOME_PATH_set,ASCEND_TOOLKIT_HOME_set"
2026-03-03T08:25:57.716588+00:00,FULL,llm_style,eval,llm_style_eval_037,32,6144,1024,fp16,Ascend910B2,c08,128,128,64,8,4,8,0.0,0.0,236.9600012898445,248.9358051121235,1.6992453654972892,1,-1,-1,32x6144x1024,0,"path_reordered,ASCEND_HOME_PATH_set,ASCEND_TOOLKIT_HOME_set"
2026-03-03T08:25:58.028270+00:00,FULL,llm_style,eval,llm_style_eval_038,64,6144,2048,fp16,Ascend910B2,c09,128,64,64,8,3,8,0.0,0.0,235.9899953007698,259.86639708280563,6.82491956469286,1,-1,-1,64x6144x2048,0,"path_reordered,ASCEND_HOME_PATH_set,ASCEND_TOOLKIT_HOME_set"
2026-03-03T08:25:58.167253+00:00,FULL,llm_style,eval,llm_style_eval_039,8,1024,3072,fp16,Ascend910B2,c03,64,64,32,4,2,8,0.0,138.878,237.64000087976456,242.38400220870972,0.2117978783608304,7,-1,-1,8x1024x3072,0,"path_reordered,ASCEND_HOME_PATH_set,ASCEND_TOOLKIT_HOME_set"
2026-03-03T08:25:58.663581+00:00,FULL,llm_style,eval,llm_style_eval_040,32,8192,2048,fp16,Ascend910B2,c10,64,128,64,8,3,8,0.0,496.192,239.1899973154068,281.52038872241974,4.4890749448193485,1,-1,-1,32x8192x2048,0,"path_reordered,ASCEND_HOME_PATH_set,ASCEND_TOOLKIT_HOME_set"
2026-03-03T08:25:58.806648+00:00,FULL,llm_style,eval,llm_style_eval_041,32,3072,1024,fp16,Ascend910B2,c02,32,64,32,2,2,8,0.0,142.947,237.80999332666397,265.28820633888245,0.846585920060352,3,-1,-1,32x3072x1024,0,"path_reordered,ASCEND_HOME_PATH_set,ASCEND_TOOLKIT_HOME_set"
2026-03-03T08:25:58.985012+00:00,FULL,llm_style,eval,llm_style_eval_042,64,1024,4096,fp16,Ascend910B2,c09,128,64,64,8,3,8,0.0,178.28,229.90000247955322,253.11120092868805,2.3352366516296494,3,-1,-1,64x1024x4096,0,"path_reordered,ASCEND_HOME_PATH_set,ASCEND_TOOLKIT_HOME_set"
2026-03-03T08:25:59.034471+00:00,FULL,llm_style,eval,llm_style_eval_043,2,1536,1024,fp16,Ascend910B2,c05,128,64,32,4,3,8,0.0,0.0,242.03000217676163,297.3621994256973,0.025994529369979365,7,-1,-1,2x1536x1024,0,"path_reordered,ASCEND_HOME_PATH_set,ASCEND_TOOLKIT_HOME_set"
2026-03-03T08:25:59.562431+00:00,FULL,llm_style,eval,llm_style_eval_044,64,6144,3072,fp16,Ascend910B2,c10,64,128,64,8,3,8,0.0,527.859,238.23000490665436,251.52119860053062,10.141120153805268,1,-1,-1,64x6144x3072,0,"path_reordered,ASCEND_HOME_PATH_set,ASCEND_TOOLKIT_HOME_set"
2026-03-03T08:25:59.882376+00:00,FULL,llm_style,eval,llm_style_eval_045,64,1536,6144,fp16,Ascend910B2,c04,64,64,64,4,3,8,0.0,319.83,229.1800007224083,260.0799924135208,5.270789546174788,3,-1,-1,64x1536x6144,0,"path_reordered,ASCEND_HOME_PATH_set,ASCEND_TOOLKIT_HOME_set"
2026-03-03T08:26:00.408711+00:00,FULL,llm_style,eval,llm_style_eval_046,2,6144,3072,fp16,Ascend910B2,c10,64,128,64,8,3,8,0.0,526.237,231.34000599384308,260.39039373397827,0.3263485348142046,5,-1,-1,2x6144x3072,0,"path_reordered,ASCEND_HOME_PATH_set,ASCEND_TOOLKIT_HOME_set"
2026-03-03T08:26:01.314338+00:00,FULL,llm_style,eval,llm_style_eval_047,16,4096,8192,fp16,Ascend910B2,c10,64,128,64,8,3,8,0.0,905.525,247.63000011444092,268.8764029741287,4.336073268601444,6,-1,-1,16x4096x8192,0,"path_reordered,ASCEND_HOME_PATH_set,ASCEND_TOOLKIT_HOME_set"
2026-03-03T08:26:01.533046+00:00,FULL,llm_style,eval,llm_style_eval_048,16,1024,6144,fp16,Ascend910B2,c06,64,128,32,4,3,8,0.0,218.61,228.97999733686447,265.91780722141266,0.8792322226461462,7,-1,-1,16x1024x6144,0,"path_reordered,ASCEND_HOME_PATH_set,ASCEND_TOOLKIT_HOME_set"
2026-03-03T08:26:01.899938+00:00,FULL,llm_style,eval,llm_style_eval_049,16,8192,1536,fp16,Ascend910B2,c11,32,128,32,4,2,8,0.0,366.776,226.97000205516815,247.19139635562897,1.7740370108563055,5,-1,-1,16x8192x1536,0,"path_reordered,ASCEND_HOME_PATH_set,ASCEND_TOOLKIT_HOME_set"
2026-03-03T08:26:01.984103+00:00,FULL,llm_style,eval,llm_style_eval_050,1,1024,1024,fp16,Ascend910B2,c07,128,128,32,8,3,8,0.0,84.087,234.44999754428864,242.6310034096241,0.008944986231462164,7,-1,-1,1x1024x1024,0,"path_reordered,ASCEND_HOME_PATH_set,ASCEND_TOOLKIT_HOME_set"
2026-03-03T08:26:02.197133+00:00,FULL,llm_style,eval,llm_style_eval_051,16,6144,1024,fp16,Ascend910B2,c03,64,64,32,4,2,8,0.0,212.934,228.52999716997147,233.15300658345222,0.880963525546545,5,-1,-1,16x6144x1024,0,"path_reordered,ASCEND_HOME_PATH_set,ASCEND_TOOLKIT_HOME_set"
2026-03-03T08:26:03.910548+00:00,FULL,llm_style,eval,llm_style_eval_052,16,8192,8192,fp16,Ascend910B2,c08,128,128,64,8,4,8,0.0,1713.333,285.02000868320465,304.88701313734055,7.534501377364335,4,-1,-1,16x8192x8192,0,"path_reordered,ASCEND_HOME_PATH_set,ASCEND_TOOLKIT_HOME_set"
2026-03-03T08:26:05.182673+00:00,FULL,llm_style,eval,llm_style_eval_053,1,6144,8192,fp16,Ascend910B2,c10,64,128,64,8,3,8,0.0,1272.043,236.33000254631042,238.61639857292175,0.4259437858732065,4,-1,-1,1x6144x8192,0,"path_reordered,ASCEND_HOME_PATH_set,ASCEND_TOOLKIT_HOME_set"
2026-03-03T08:26:05.553191+00:00,FULL,llm_style,eval,llm_style_eval_054,64,4096,3072,fp16,Ascend910B2,c09,128,64,64,8,3,8,0.0,370.387,225.81999748945236,232.203199416399,7.132285687299367,3,-1,-1,64x4096x3072,0,"path_reordered,ASCEND_HOME_PATH_set,ASCEND_TOOLKIT_HOME_set"
2026-03-03T08:26:05.825994+00:00,FULL,llm_style,eval,llm_style_eval_055,4,8192,1024,fp16,Ascend910B2,c11,32,128,32,4,2,8,0.0,272.672,226.80000215768814,248.1217958033085,0.29589445926610247,5,-1,-1,4x8192x1024,0,"path_reordered,ASCEND_HOME_PATH_set,ASCEND_TOOLKIT_HOME_set"
2026-03-03T08:26:05.963536+00:00,FULL,llm_style,eval,llm_style_eval_056,64,1024,3072,fp16,Ascend910B2,c08,128,128,64,8,4,8,0.0,137.461,226.51000320911407,230.6229965388775,1.7776397434786602,3,-1,-1,64x1024x3072,0,"path_reordered,ASCEND_HOME_PATH_set,ASCEND_TOOLKIT_HOME_set"
2026-03-03T08:26:05.968260+00:00,FULL,llm_style,eval,llm_style_eval_057,64,1024,3072,fp16,Ascend910B2,c08,128,128,64,8,4,8,0.0,0.0,229.6300008893013,241.04239344596863,1.753486837262648,3,-1,-1,64x1024x3072,0,"path_reordered,ASCEND_HOME_PATH_set,ASCEND_TOOLKIT_HOME_set"
2026-03-03T08:26:06.234834+00:00,FULL,llm_style,eval,llm_style_eval_058,32,2048,4096,fp16,Ascend910B2,c11,32,128,32,4,2,8,0.0,266.512,227.61999815702438,230.26759460568428,2.3586280482685793,3,-1,-1,32x2048x4096,0,"path_reordered,ASCEND_HOME_PATH_set,ASCEND_TOOLKIT_HOME_set"
2026-03-03T08:26:06.659943+00:00,FULL,llm_style,eval,llm_style_eval_059,64,8192,2048,fp16,Ascend910B2,c09,128,64,64,8,3,8,0.0,0.0,241.2400022149086,257.2475878894329,8.901855530936842,1,-1,-1,64x8192x2048,0,"path_reordered,ASCEND_HOME_PATH_set,ASCEND_TOOLKIT_HOME_set"
2026-03-03T08:26:07.185640+00:00,FULL,llm_style,eval,llm_style_eval_060,1,3072,6144,fp16,Ascend910B2,c08,128,128,64,8,4,8,0.0,525.59,235.57999730110168,278.1032022833824,0.1602374413467381,7,-1,-1,1x3072x6144,0,"path_reordered,ASCEND_HOME_PATH_set,ASCEND_TOOLKIT_HOME_set"
2026-03-03T08:26:07.406335+00:00,FULL,llm_style,eval,llm_style_eval_061,64,1536,4096,fp16,Ascend910B2,c04,64,64,64,4,3,8,0.0,220.603,235.24999618530273,244.19919848442078,3.4231939683674755,3,-1,-1,64x1536x4096,0,"path_reordered,ASCEND_HOME_PATH_set,ASCEND_TOOLKIT_HOME_set"
2026-03-03T08:26:07.775638+00:00,FULL,llm_style,eval,llm_style_eval_062,16,6144,2048,fp16,Ascend910B2,c10,64,128,64,8,3,8,0.0,369.204,234.09000039100647,238.6581987142563,1.7200785310241282,5,-1,-1,16x6144x2048,0,"path_reordered,ASCEND_HOME_PATH_set,ASCEND_TOOLKIT_HOME_set"
2026-03-03T08:26:08.034644+00:00,FULL,llm_style,eval,llm_style_eval_063,64,1536,6144,fp16,Ascend910B2,c04,64,64,64,4,3,8,0.0,0.0,238.05999755859375,257.5297877192497,5.074181149240266,3,-1,-1,64x1536x6144,0,"path_reordered,ASCEND_HOME_PATH_set,ASCEND_TOOLKIT_HOME_set"
2026-03-03T08:26:08.309609+00:00,BUCKET,llm_style,tune,llm_style_tune_000,8,2048,4096,fp16,Ascend910B2,c06,64,128,32,4,3,8,0.0,270.72,236.80000007152557,262.1715933084488,0.5667978376666363,7,-1,-1,llm8_g7,0,"path_reordered,ASCEND_HOME_PATH_set,ASCEND_TOOLKIT_HOME_set"
2026-03-03T08:26:08.493697+00:00,BUCKET,llm_style,tune,llm_style_tune_001,32,1536,3072,fp16,Ascend910B2,c11,32,128,32,4,2,8,0.0,184.0,234.68999564647675,240.421804189682,1.2867608061781204,3,-1,-1,llm8_g3,0,"path_reordered,ASCEND_HOME_PATH_set,ASCEND_TOOLKIT_HOME_set"
2026-03-03T08:26:08.707846+00:00,BUCKET,llm_style,tune,llm_style_tune_002,32,4096,2048,fp16,Ascend910B2,c11,32,128,32,4,2,8,0.0,0.0,239.05999958515167,252.85820975899696,2.2457580228045213,3,-1,-1,llm8_g3,0,"path_reordered,ASCEND_HOME_PATH_set,ASCEND_TOOLKIT_HOME_set"
2026-03-03T08:26:08.835028+00:00,BUCKET,llm_style,tune,llm_style_tune_003,1,3072,1536,fp16,Ascend910B2,c06,64,128,32,4,3,8,0.0,0.0,237.08000034093857,279.9607864022255,0.039805905122442344,7,-1,-1,llm8_g7,0,"path_reordered,ASCEND_HOME_PATH_set,ASCEND_TOOLKIT_HOME_set"
2026-03-03T08:26:08.882787+00:00,BUCKET,llm_style,tune,llm_style_tune_004,8,1024,1536,fp16,Ascend910B2,c06,64,128,32,4,3,8,0.0,0.0,248.27999621629715,266.87698632478714,0.10136065886707997,7,-1,-1,llm8_g7,0,"path_reordered,ASCEND_HOME_PATH_set,ASCEND_TOOLKIT_HOME_set"
2026-03-03T08:26:09.750476+00:00,BUCKET,llm_style,tune,llm_style_tune_005,1,4096,8192,fp16,Ascend910B2,c10,64,128,64,8,3,8,0.0,867.601,241.82000011205673,246.28659889101982,0.27751577193326643,6,-1,-1,llm8_g6,0,"path_reordered,ASCEND_HOME_PATH_set,ASCEND_TOOLKIT_HOME_set"
2026-03-03T08:26:09.968275+00:00,BUCKET,llm_style,tune,llm_style_tune_006,4,6144,1024,fp16,Ascend910B2,c02,32,64,32,2,2,8,0.0,217.709,235.00999808311462,255.9243954718113,0.21416811374212041,5,-1,-1,llm8_g5,0,"path_reordered,ASCEND_HOME_PATH_set,ASCEND_TOOLKIT_HOME_set"
2026-03-03T08:26:11.685840+00:00,BUCKET,llm_style,tune,llm_style_tune_007,4,8192,8192,fp16,Ascend910B2,c10,64,128,64,8,3,8,0.0,1717.465,287.0499938726425,293.4053972363472,1.8703045583000337,4,-1,-1,llm8_g4,0,"path_reordered,ASCEND_HOME_PATH_set,ASCEND_TOOLKIT_HOME_set"
2026-03-03T08:26:11.907825+00:00,BUCKET,llm_style,tune,llm_style_tune_008,64,6144,1024,fp16,Ascend910B2,c09,128,64,64,8,3,8,0.0,221.898,232.98999667167664,251.35838642716408,3.4563988991116066,1,-1,-1,llm8_g1,0,"path_reordered,ASCEND_HOME_PATH_set,ASCEND_TOOLKIT_HOME_set"
2026-03-03T08:26:12.221057+00:00,BUCKET,llm_style,tune,llm_style_tune_009,2,4096,3072,fp16,Ascend910B2,c06,64,128,32,4,3,8,0.0,0.0,234.8100021481514,259.87499564886093,0.21435052825494064,7,-1,-1,llm8_g7,0,"path_reordered,ASCEND_HOME_PATH_set,ASCEND_TOOLKIT_HOME_set"
2026-03-03T08:26:12.710793+00:00,BUCKET,llm_style,tune,llm_style_tune_010,32,2048,8192,fp16,Ascend910B2,c10,64,128,64,8,3,8,0.0,489.643,237.3799979686737,244.54359754920006,4.5233037037168495,2,-1,-1,llm8_g2,0,"path_reordered,ASCEND_HOME_PATH_set,ASCEND_TOOLKIT_HOME_set"
2026-03-03T08:26:12.839520+00:00,BUCKET,llm_style,tune,llm_style_tune_011,32,3072,1536,fp16,Ascend910B2,c11,32,128,32,4,2,8,0.0,0.0,241.1400005221367,275.198587924242,1.2523425700676205,3,-1,-1,llm8_g3,0,"path_reordered,ASCEND_HOME_PATH_set,ASCEND_TOOLKIT_HOME_set"
2026-03-03T08:26:12.885780+00:00,BUCKET,llm_style,tune,llm_style_tune_012,2,1536,1024,fp16,Ascend910B2,c06,64,128,32,4,3,8,0.0,0.0,249.10999834537506,276.41640305519104,0.025255734582267944,7,-1,-1,llm8_g7,0,"path_reordered,ASCEND_HOME_PATH_set,ASCEND_TOOLKIT_HOME_set"
2026-03-03T08:26:13.050537+00:00,BUCKET,llm_style,tune,llm_style_tune_013,64,6144,1024,fp16,Ascend910B2,c09,128,64,64,8,3,8,0.0,0.0,240.4400035738945,264.42859798669815,3.34930276172827,1,-1,-1,llm8_g1,0,"path_reordered,ASCEND_HOME_PATH_set,ASCEND_TOOLKIT_HOME_set"
2026-03-03T08:26:14.802751+00:00,BUCKET,llm_style,tune,llm_style_tune_014,64,8192,8192,fp16,Ascend910B2,c08,128,128,64,8,4,8,0.0,1752.123,311.58000230789185,316.2889903783798,27.568953489870456,0,-1,-1,llm8_g0,0,"path_reordered,ASCEND_HOME_PATH_set,ASCEND_TOOLKIT_HOME_set"
2026-03-03T08:26:14.936172+00:00,BUCKET,llm_style,tune,llm_style_tune_015,64,1536,3072,fp16,Ascend910B2,c11,32,128,32,4,2,8,0.0,0.0,241.2099987268448,248.15319657325745,2.503958290236423,3,-1,-1,llm8_g3,0,"path_reordered,ASCEND_HOME_PATH_set,ASCEND_TOOLKIT_HOME_set"
2026-03-03T08:26:14.981855+00:00,BUCKET,llm_style,eval,llm_style_eval_000,32,1536,1024,fp16,Ascend910B2,c11,32,128,32,4,2,8,0.0,0.0,245.8599954843521,257.8994134068489,0.40943340864254907,3,-1,-1,llm8_g3,0,"path_reordered,ASCEND_HOME_PATH_set,ASCEND_TOOLKIT_HOME_set"
2026-03-03T08:26:15.406248+00:00,BUCKET,llm_style,eval,llm_style_eval_001,32,2048,8192,fp16,Ascend910B2,c10,64,128,64,8,3,8,0.0,0.0,238.5600060224533,245.89559569954872,4.5009297321150274,2,-1,-1,llm8_g2,0,"path_reordered,ASCEND_HOME_PATH_set,ASCEND_TOOLKIT_HOME_set"
2026-03-03T08:26:15.631821+00:00,BUCKET,llm_style,eval,llm_style_eval_002,16,2048,4096,fp16,Ascend910B2,c06,64,128,32,4,3,8,0.0,0.0,242.08999425172806,273.4244129061699,1.1088250748640096,7,-1,-1,llm8_g7,0,"path_reordered,ASCEND_HOME_PATH_set,ASCEND_TOOLKIT_HOME_set"
2026-03-03T08:26:15.717871+00:00,BUCKET,llm_style,eval,llm_style_eval_003,16,2048,1536,fp16,Ascend910B2,c06,64,128,32,4,3,8,0.0,0.0,240.1599958539009,254.83820378780365,0.41915097325883355,7,-1,-1,llm8_g7,0,"path_reordered,ASCEND_HOME_PATH_set,ASCEND_TOOLKIT_HOME_set"
2026-03-03T08:26:16.144999+00:00,BUCKET,llm_style,eval,llm_style_eval_004,64,8192,2048,fp16,Ascend910B2,c09,128,64,64,8,3,8,0.0,0.0,240.04000425338745,247.06919610500336,8.946357315229445,1,-1,-1,llm8_g1,0,"path_reordered,ASCEND_HOME_PATH_set,ASCEND_TOOLKIT_HOME_set"
2026-03-03T08:26:16.781995+00:00,BUCKET,llm_style,eval,llm_style_eval_005,64,3072,8192,fp16,Ascend910B2,c10,64,128,64,8,3,8,0.0,0.0,238.76000195741653,263.60380232334137,13.491478663057281,2,-1,-1,llm8_g2,0,"path_reordered,ASCEND_HOME_PATH_set,ASCEND_TOOLKIT_HOME_set"
2026-03-03T08:26:16.895462+00:00,BUCKET,llm_style,eval,llm_style_eval_006,32,2048,2048,fp16,Ascend910B2,c11,32,128,32,4,2,8,0.0,0.0,237.41000145673752,258.5806092619896,1.1306830139964266,3,-1,-1,llm8_g3,0,"path_reordered,ASCEND_HOME_PATH_set,ASCEND_TOOLKIT_HOME_set"
2026-03-03T08:26:17.318067+00:00,BUCKET,llm_style,eval,llm_style_eval_007,8,8192,2048,fp16,Ascend910B2,c02,32,64,32,2,2,8,0.0,0.0,281.89998865127563,297.01519787311554,0.9522364909778981,5,-1,-1,llm8_g5,0,"path_reordered,ASCEND_HOME_PATH_set,ASCEND_TOOLKIT_HOME_set"
2026-03-03T08:26:17.644176+00:00,BUCKET,llm_style,eval,llm_style_eval_008,64,1536,8192,fp16,Ascend910B2,c10,64,128,64,8,3,8,0.0,0.0,237.40000277757645,247.08039849996567,6.784383812787933,2,-1,-1,llm8_g2,0,"path_reordered,ASCEND_HOME_PATH_set,ASCEND_TOOLKIT_HOME_set"
2026-03-03T08:26:18.276264+00:00,BUCKET,llm_style,eval,llm_style_eval_009,64,4096,6144,fp16,Ascend910B2,c11,32,128,32,4,2,8,0.0,0.0,356.1200052499771,372.2176107764244,9.045337033899212,3,-1,-1,llm8_g3,0,"path_reordered,ASCEND_HOME_PATH_set,ASCEND_TOOLKIT_HOME_set"
2026-03-03T08:26:18.499021+00:00,BUCKET,llm_style,eval,llm_style_eval_010,64,2048,4096,fp16,Ascend910B2,c11,32,128,32,4,2,8,0.0,0.0,247.7400004863739,266.21500849723816,4.334147985355548,3,-1,-1,llm8_g3,0,"path_reordered,ASCEND_HOME_PATH_set,ASCEND_TOOLKIT_HOME_set"
2026-03-03T08:26:18.981060+00:00,BUCKET,llm_style,eval,llm_style_eval_011,32,3072,6144,fp16,Ascend910B2,c11,32,128,32,4,2,8,0.0,0.0,258.2799941301346,265.80040514469147,4.676938127044283,3,-1,-1,llm8_g3,0,"path_reordered,ASCEND_HOME_PATH_set,ASCEND_TOOLKIT_HOME_set"
2026-03-03T08:26:19.048881+00:00,BUCKET,llm_style,eval,llm_style_eval_012,16,1536,1536,fp16,Ascend910B2,c06,64,128,32,4,3,8,0.0,0.0,245.47000229358673,273.9636132121086,0.30756292538631097,7,-1,-1,llm8_g7,0,"path_reordered,ASCEND_HOME_PATH_set,ASCEND_TOOLKIT_HOME_set"
2026-03-03T08:26:19.216045+00:00,BUCKET,llm_style,eval,llm_style_eval_013,64,2048,3072,fp16,Ascend910B2,c11,32,128,32,4,2,8,0.0,0.0,240.46000093221664,266.72801047563553,3.3490242238957992,3,-1,-1,llm8_g3,0,"path_reordered,ASCEND_HOME_PATH_set,ASCEND_TOOLKIT_HOME_set"
2026-03-03T08:26:20.455739+00:00,BUCKET,llm_style,eval,llm_style_eval_014,16,8192,6144,fp16,Ascend910B2,c02,32,64,32,2,2,8,0.0,0.0,513.590008020401,524.8436051607132,3.1359892343077336,5,-1,-1,llm8_g5,0,"path_reordered,ASCEND_HOME_PATH_set,ASCEND_TOOLKIT_HOME_set"
2026-03-03T08:26:20.710601+00:00,BUCKET,llm_style,eval,llm_style_eval_015,64,6144,1536,fp16,Ascend910B2,c09,128,64,64,8,3,8,0.0,0.0,241.10999703407288,314.1238045692444,5.009993641322533,1,-1,-1,llm8_g1,0,"path_reordered,ASCEND_HOME_PATH_set,ASCEND_TOOLKIT_HOME_set"
2026-03-03T08:26:21.131814+00:00,BUCKET,llm_style,eval,llm_style_eval_016,16,4096,4096,fp16,Ascend910B2,c06,64,128,32,4,3,8,0.0,0.0,258.17999243736267,283.3631932735443,2.079444293617178,7,-1,-1,llm8_g7,0,"path_reordered,ASCEND_HOME_PATH_set,ASCEND_TOOLKIT_HOME_set"
2026-03-03T08:26:21.956733+00:00,BUCKET,llm_style,eval,llm_style_eval_017,64,8192,4096,fp16,Ascend910B2,c09,128,64,64,8,3,8,0.0,0.0,305.9599995613098,309.53480154275894,14.037675847032913,1,-1,-1,llm8_g1,0,"path_reordered,ASCEND_HOME_PATH_set,ASCEND_TOOLKIT_HOME_set"
2026-03-03T08:26:22.579300+00:00,BUCKET,llm_style,eval,llm_style_eval_018,32,4096,6144,fp16,Ascend910B2,c11,32,128,32,4,2,8,0.0,0.0,316.31000339984894,324.62319761514664,5.091880492834167,3,-1,-1,llm8_g3,0,"path_reordered,ASCEND_HOME_PATH_set,ASCEND_TOOLKIT_HOME_set"
2026-03-03T08:26:23.201877+00:00,BUCKET,llm_style,eval,llm_style_eval_019,16,3072,8192,fp16,Ascend910B2,c10,64,128,64,8,3,8,0.0,0.0,236.00000143051147,279.6252128481865,3.4123150979603563,6,-1,-1,llm8_g6,0,"path_reordered,ASCEND_HOME_PATH_set,ASCEND_TOOLKIT_HOME_set"
2026-03-03T08:26:23.267584+00:00,BUCKET,llm_style,eval,llm_style_eval_020,4,1536,1536,fp16,Ascend910B2,c06,64,128,32,4,3,8,0.0,0.0,244.2300021648407,256.80319637060165,0.07728111957048146,7,-1,-1,llm8_g7,0,"path_reordered,ASCEND_HOME_PATH_set,ASCEND_TOOLKIT_HOME_set"
2026-03-03T08:26:23.505794+00:00,BUCKET,llm_style,eval,llm_style_eval_021,4,6144,1536,fp16,Ascend910B2,c02,32,64,32,2,2,8,0.0,0.0,239.67000097036362,243.13180103898048,0.31500593188271253,5,-1,-1,llm8_g5,0,"path_reordered,ASCEND_HOME_PATH_set,ASCEND_TOOLKIT_HOME_set"
2026-03-03T08:26:23.662358+00:00,BUCKET,llm_style,eval,llm_style_eval_022,32,6144,1024,fp16,Ascend910B2,c09,128,64,64,8,3,8,0.0,0.0,233.6300015449524,243.74120593070984,1.7234652285122984,1,-1,-1,llm8_g1,0,"path_reordered,ASCEND_HOME_PATH_set,ASCEND_TOOLKIT_HOME_set"
2026-03-03T08:26:23.705836+00:00,BUCKET,llm_style,eval,llm_style_eval_023,16,1024,1536,fp16,Ascend910B2,c06,64,128,32,4,3,8,0.0,0.0,247.33000248670578,251.68221086263657,0.20349996965170197,7,-1,-1,llm8_g7,0,"path_reordered,ASCEND_HOME_PATH_set,ASCEND_TOOLKIT_HOME_set"
2026-03-03T08:26:23.922368+00:00,BUCKET,llm_style,eval,llm_style_eval_024,32,8192,1024,fp16,Ascend910B2,c09,128,64,64,8,3,8,0.0,0.0,235.35999655723572,241.36659309267998,2.2810627118166265,1,-1,-1,llm8_g1,0,"path_reordered,ASCEND_HOME_PATH_set,ASCEND_TOOLKIT_HOME_set"
2026-03-03T08:26:24.843000+00:00,BUCKET,llm_style,eval,llm_style_eval_025,32,6144,6144,fp16,Ascend910B2,c09,128,64,64,8,3,8,0.0,0.0,301.90999805927277,309.52260076999664,8.002116920704601,1,-1,-1,llm8_g1,0,"path_reordered,ASCEND_HOME_PATH_set,ASCEND_TOOLKIT_HOME_set"
2026-03-03T08:26:25.153876+00:00,BUCKET,llm_style,eval,llm_style_eval_026,1,6144,2048,fp16,Ascend910B2,c02,32,64,32,2,2,8,0.0,0.0,253.7200003862381,258.5976105928421,0.09918738752045582,5,-1,-1,llm8_g5,0,"path_reordered,ASCEND_HOME_PATH_set,ASCEND_TOOLKIT_HOME_set"
2026-03-03T08:26:25.460654+00:00,BUCKET,llm_style,eval,llm_style_eval_027,32,4096,3072,fp16,Ascend910B2,c11,32,128,32,4,2,8,0.0,0.0,245.47000229358673,250.34719228744507,3.2806712041206505,3,-1,-1,llm8_g3,0,"path_reordered,ASCEND_HOME_PATH_set,ASCEND_TOOLKIT_HOME_set"
2026-03-03T08:26:25.524233+00:00,BUCKET,llm_style,eval,llm_style_eval_028,64,1536,1536,fp16,Ascend910B2,c11,32,128,32,4,2,8,0.0,0.0,246.10000103712082,252.5118124485016,1.227102343467479,3,-1,-1,llm8_g3,0,"path_reordered,ASCEND_HOME_PATH_set,ASCEND_TOOLKIT_HOME_set"
2026-03-03T08:26:25.603193+00:00,BUCKET,llm_style,eval,llm_style_eval_029,2,3072,1024,fp16,Ascend910B2,c06,64,128,32,4,3,8,0.0,0.0,252.42000818252563,266.76880568265915,0.049849107012552116,7,-1,-1,llm8_g7,0,"path_reordered,ASCEND_HOME_PATH_set,ASCEND_TOOLKIT_HOME_set"
2026-03-03T08:26:25.917087+00:00,BUCKET,llm_style,eval,llm_style_eval_030,32,1536,8192,fp16,Ascend910B2,c10,64,128,64,8,3,8,0.0,0.0,239.48999494314194,252.88959458470345,3.36258877199104,2,-1,-1,llm8_g2,0,"path_reordered,ASCEND_HOME_PATH_set,ASCEND_TOOLKIT_HOME_set"
2026-03-03T08:26:26.080921+00:00,BUCKET,llm_style,eval,llm_style_eval_031,8,3072,2048,fp16,Ascend910B2,c06,64,128,32,4,3,8,0.0,0.0,239.3599972128868,249.97779116034508,0.42055187655466947,7,-1,-1,llm8_g7,0,"path_reordered,ASCEND_HOME_PATH_set,ASCEND_TOOLKIT_HOME_set"
2026-03-03T08:26:26.239960+00:00,BUCKET,llm_style,eval,llm_style_eval_032,8,2048,3072,fp16,Ascend910B2,c06,64,128,32,4,3,8,0.0,0.0,239.87000435590744,269.3274015188217,0.4196577069746524,7,-1,-1,llm8_g7,0,"path_reordered,ASCEND_HOME_PATH_set,ASCEND_TOOLKIT_HOME_set"
2026-03-03T08:26:26.558885+00:00,BUCKET,llm_style,eval,llm_style_eval_033,64,1536,8192,fp16,Ascend910B2,c10,64,128,64,8,3,8,0.0,0.0,235.76000332832336,244.63459685444832,6.831577507899139,2,-1,-1,llm8_g2,0,"path_reordered,ASCEND_HOME_PATH_set,ASCEND_TOOLKIT_HOME_set"
2026-03-03T08:26:26.868950+00:00,BUCKET,llm_style,eval,llm_style_eval_034,64,6144,2048,fp16,Ascend910B2,c09,128,64,64,8,3,8,0.0,0.0,235.7800006866455,242.75820285081863,6.83099809699519,1,-1,-1,llm8_g1,0,"path_reordered,ASCEND_HOME_PATH_set,ASCEND_TOOLKIT_HOME_set"
2026-03-03T08:26:27.086839+00:00,BUCKET,llm_style,eval,llm_style_eval_035,4,4096,2048,fp16,Ascend910B2,c06,64,128,32,4,3,8,0.0,0.0,236.84000223875046,239.62379828095436,0.28335105288653817,7,-1,-1,llm8_g7,0,"path_reordered,ASCEND_HOME_PATH_set,ASCEND_TOOLKIT_HOME_set"
2026-03-03T08:26:27.890897+00:00,BUCKET,llm_style,eval,llm_style_eval_036,64,8192,4096,fp16,Ascend910B2,c09,128,64,64,8,3,8,0.0,0.0,309.90999937057495,317.22640216350555,13.858756751066595,1,-1,-1,llm8_g1,0,"path_reordered,ASCEND_HOME_PATH_set,ASCEND_TOOLKIT_HOME_set"
2026-03-03T08:26:28.049988+00:00,BUCKET,llm_style,eval,llm_style_eval_037,32,6144,1024,fp16,Ascend910B2,c09,128,64,64,8,3,8,0.0,0.0,237.92999982833862,264.77859914302826,1.6923178426028902,1,-1,-1,llm8_g1,0,"path_reordered,ASCEND_HOME_PATH_set,ASCEND_TOOLKIT_HOME_set"
2026-03-03T08:26:28.360904+00:00,BUCKET,llm_style,eval,llm_style_eval_038,64,6144,2048,fp16,Ascend910B2,c09,128,64,64,8,3,8,0.0,0.0,237.29000240564346,243.06020498275757,6.78752884517521,1,-1,-1,llm8_g1,0,"path_reordered,ASCEND_HOME_PATH_set,ASCEND_TOOLKIT_HOME_set"
2026-03-03T08:26:28.443919+00:00,BUCKET,llm_style,eval,llm_style_eval_039,8,1024,3072,fp16,Ascend910B2,c06,64,128,32,4,3,8,0.0,0.0,244.5099949836731,264.7669976949692,0.2058469961661929,7,-1,-1,llm8_g7,0,"path_reordered,ASCEND_HOME_PATH_set,ASCEND_TOOLKIT_HOME_set"
2026-03-03T08:26:28.847305+00:00,BUCKET,llm_style,eval,llm_style_eval_040,32,8192,2048,fp16,Ascend910B2,c09,128,64,64,8,3,8,0.0,0.0,237.67999559640884,243.88439372181892,4.5175944290375245,1,-1,-1,llm8_g1,0,"path_reordered,ASCEND_HOME_PATH_set,ASCEND_TOOLKIT_HOME_set"
2026-03-03T08:26:28.929096+00:00,BUCKET,llm_style,eval,llm_style_eval_041,32,3072,1024,fp16,Ascend910B2,c11,32,128,32,4,2,8,0.0,0.0,246.45999819040298,255.05060523748398,0.8168732998385599,3,-1,-1,llm8_g3,0,"path_reordered,ASCEND_HOME_PATH_set,ASCEND_TOOLKIT_HOME_set"
2026-03-03T08:26:29.039838+00:00,BUCKET,llm_style,eval,llm_style_eval_042,64,1024,4096,fp16,Ascend910B2,c11,32,128,32,4,2,8,0.0,0.0,243.7399998307228,259.75220561027527,2.2026376974352027,3,-1,-1,llm8_g3,0,"path_reordered,ASCEND_HOME_PATH_set,ASCEND_TOOLKIT_HOME_set"
2026-03-03T08:26:29.082195+00:00,BUCKET,llm_style,eval,llm_style_eval_043,2,1536,1024,fp16,Ascend910B2,c06,64,128,32,4,3,8,0.0,0.0,251.51000916957855,286.8358126282692,0.02501473408860654,7,-1,-1,llm8_g7,0,"path_reordered,ASCEND_HOME_PATH_set,ASCEND_TOOLKIT_HOME_set"
2026-03-03T08:26:29.539696+00:00,BUCKET,llm_style,eval,llm_style_eval_044,64,6144,3072,fp16,Ascend910B2,c09,128,64,64,8,3,8,0.0,0.0,243.55000257492065,254.57440584897995,9.919602046634417,1,-1,-1,llm8_g1,0,"path_reordered,ASCEND_HOME_PATH_set,ASCEND_TOOLKIT_HOME_set"
2026-03-03T08:26:29.792409+00:00,BUCKET,llm_style,eval,llm_style_eval_045,64,1536,6144,fp16,Ascend910B2,c11,32,128,32,4,2,8,0.0,0.0,236.42000555992126,261.4255876839161,5.109379593910209,3,-1,-1,llm8_g3,0,"path_reordered,ASCEND_HOME_PATH_set,ASCEND_TOOLKIT_HOME_set"
2026-03-03T08:26:30.256718+00:00,BUCKET,llm_style,eval,llm_style_eval_046,2,6144,3072,fp16,Ascend910B2,c02,32,64,32,2,2,8,0.0,0.0,296.9000041484833,314.5184114575386,0.25428585700606054,5,-1,-1,llm8_g5,0,"path_reordered,ASCEND_HOME_PATH_set,ASCEND_TOOLKIT_HOME_set"
2026-03-03T08:26:31.075646+00:00,BUCKET,llm_style,eval,llm_style_eval_047,16,4096,8192,fp16,Ascend910B2,c10,64,128,64,8,3,8,0.0,0.0,250.78999996185303,276.10820323228836,4.281437952722692,6,-1,-1,llm8_g6,0,"path_reordered,ASCEND_HOME_PATH_set,ASCEND_TOOLKIT_HOME_set"
2026-03-03T08:26:31.239369+00:00,BUCKET,llm_style,eval,llm_style_eval_048,16,1024,6144,fp16,Ascend910B2,c06,64,128,32,4,3,8,0.0,0.0,238.7399971485138,244.38600331544876,0.8432880723993647,7,-1,-1,llm8_g7,0,"path_reordered,ASCEND_HOME_PATH_set,ASCEND_TOOLKIT_HOME_set"
2026-03-03T08:26:31.571429+00:00,BUCKET,llm_style,eval,llm_style_eval_049,16,8192,1536,fp16,Ascend910B2,c02,32,64,32,2,2,8,0.0,0.0,269.27000284194946,284.82540786266327,1.4953510593467072,5,-1,-1,llm8_g5,0,"path_reordered,ASCEND_HOME_PATH_set,ASCEND_TOOLKIT_HOME_set"
2026-03-03T08:26:31.602033+00:00,BUCKET,llm_style,eval,llm_style_eval_050,1,1024,1024,fp16,Ascend910B2,c06,64,128,32,4,3,8,0.0,0.0,262.22001016139984,294.65360909700394,0.007997681026360937,7,-1,-1,llm8_g7,0,"path_reordered,ASCEND_HOME_PATH_set,ASCEND_TOOLKIT_HOME_set"
2026-03-03T08:26:31.764374+00:00,BUCKET,llm_style,eval,llm_style_eval_051,16,6144,1024,fp16,Ascend910B2,c02,32,64,32,2,2,8,0.0,0.0,264.0499919652939,302.25100070238113,0.7624563458667398,5,-1,-1,llm8_g5,0,"path_reordered,ASCEND_HOME_PATH_set,ASCEND_TOOLKIT_HOME_set"
2026-03-03T08:26:33.347034+00:00,BUCKET,llm_style,eval,llm_style_eval_052,16,8192,8192,fp16,Ascend910B2,c10,64,128,64,8,3,8,0.0,0.0,299.5599955320358,396.3489928841591,7.168793163406032,4,-1,-1,llm8_g4,0,"path_reordered,ASCEND_HOME_PATH_set,ASCEND_TOOLKIT_HOME_set"
2026-03-03T08:26:34.552943+00:00,BUCKET,llm_style,eval,llm_style_eval_053,1,6144,8192,fp16,Ascend910B2,c10,64,128,64,8,3,8,0.0,0.0,254.39000129699707,286.48458778858185,0.3957046090128239,4,-1,-1,llm8_g4,0,"path_reordered,ASCEND_HOME_PATH_set,ASCEND_TOOLKIT_HOME_set"
2026-03-03T08:26:34.872057+00:00,BUCKET,llm_style,eval,llm_style_eval_054,64,4096,3072,fp16,Ascend910B2,c11,32,128,32,4,2,8,0.0,0.0,265.68999886512756,288.80979180336,6.061999860286788,3,-1,-1,llm8_g3,0,"path_reordered,ASCEND_HOME_PATH_set,ASCEND_TOOLKIT_HOME_set"
2026-03-03T08:26:35.090247+00:00,BUCKET,llm_style,eval,llm_style_eval_055,4,8192,1024,fp16,Ascend910B2,c02,32,64,32,2,2,8,0.0,0.0,241.22999608516693,290.12218952178955,0.2781945242676497,5,-1,-1,llm8_g5,0,"path_reordered,ASCEND_HOME_PATH_set,ASCEND_TOOLKIT_HOME_set"
2026-03-03T08:26:35.181405+00:00,BUCKET,llm_style,eval,llm_style_eval_056,64,1024,3072,fp16,Ascend910B2,c11,32,128,32,4,2,8,0.0,0.0,256.8899989128113,290.34659057855606,1.567414791171613,3,-1,-1,llm8_g3,0,"path_reordered,ASCEND_HOME_PATH_set,ASCEND_TOOLKIT_HOME_set"
2026-03-03T08:26:35.186662+00:00,BUCKET,llm_style,eval,llm_style_eval_057,64,1024,3072,fp16,Ascend910B2,c11,32,128,32,4,2,8,0.0,0.0,265.47999680042267,287.06800043582916,1.5166987677143098,3,-1,-1,llm8_g3,0,"path_reordered,ASCEND_HOME_PATH_set,ASCEND_TOOLKIT_HOME_set"
2026-03-03T08:26:35.408551+00:00,BUCKET,llm_style,eval,llm_style_eval_058,32,2048,4096,fp16,Ascend910B2,c11,32,128,32,4,2,8,0.0,0.0,250.46000629663467,280.4774025082588,2.1435394813659463,3,-1,-1,llm8_g3,0,"path_reordered,ASCEND_HOME_PATH_set,ASCEND_TOOLKIT_HOME_set"
2026-03-03T08:26:35.824606+00:00,BUCKET,llm_style,eval,llm_style_eval_059,64,8192,2048,fp16,Ascend910B2,c09,128,64,64,8,3,8,0.0,0.0,249.94000047445297,277.2374075651169,8.591996654891181,1,-1,-1,llm8_g1,0,"path_reordered,ASCEND_HOME_PATH_set,ASCEND_TOOLKIT_HOME_set"
2026-03-03T08:26:36.290998+00:00,BUCKET,llm_style,eval,llm_style_eval_060,1,3072,6144,fp16,Ascend910B2,c06,64,128,32,4,3,8,0.0,0.0,244.7200044989586,266.67939752340317,0.15425275950483502,7,-1,-1,llm8_g7,0,"path_reordered,ASCEND_HOME_PATH_set,ASCEND_TOOLKIT_HOME_set"
2026-03-03T08:26:36.458117+00:00,BUCKET,llm_style,eval,llm_style_eval_061,64,1536,4096,fp16,Ascend910B2,c11,32,128,32,4,2,8,0.0,0.0,257.58999586105347,292.67039716243744,3.1263107299958572,3,-1,-1,llm8_g3,0,"path_reordered,ASCEND_HOME_PATH_set,ASCEND_TOOLKIT_HOME_set"
2026-03-03T08:26:36.764637+00:00,BUCKET,llm_style,eval,llm_style_eval_062,16,6144,2048,fp16,Ascend910B2,c02,32,64,32,2,2,8,0.0,0.0,271.6199904680252,290.0790002942085,1.4824136592678359,5,-1,-1,llm8_g5,0,"path_reordered,ASCEND_HOME_PATH_set,ASCEND_TOOLKIT_HOME_set"
2026-03-03T08:26:37.010186+00:00,BUCKET,llm_style,eval,llm_style_eval_063,64,1536,6144,fp16,Ascend910B2,c11,32,128,32,4,2,8,0.0,0.0,249.46000427007675,273.73639523983,4.842297487865863,3,-1,-1,llm8_g3,0,"path_reordered,ASCEND_HOME_PATH_set,ASCEND_TOOLKIT_HOME_set"
2026-03-03T08:26:37.681778+00:00,TORCH,llm_style,tune,llm_style_tune_000,8,2048,4096,fp16,Ascend910B2,torch_mm_npu,-1,-1,-1,-1,-1,-1,458.50271731615067,0.0,107.63999819755554,125.74740290641785,1.2469131386797816,7,-1,-1,torch_mm_npu,0,torch_mm_npu
2026-03-03T08:26:37.802485+00:00,TORCH,llm_style,tune,llm_style_tune_001,32,1536,3072,fp16,Ascend910B2,torch_mm_npu,-1,-1,-1,-1,-1,-1,0.0,0.0,105.22999987006187,133.38520348072052,2.8698079290401735,3,-1,-1,torch_mm_npu,0,torch_mm_npu
2026-03-03T08:26:38.012553+00:00,TORCH,llm_style,tune,llm_style_tune_002,32,4096,2048,fp16,Ascend910B2,torch_mm_npu,-1,-1,-1,-1,-1,-1,0.0,0.0,103.48999872803688,143.8683945685625,5.1876598569766355,3,-1,-1,torch_mm_npu,0,torch_mm_npu
2026-03-03T08:26:38.131978+00:00,TORCH,llm_style,tune,llm_style_tune_003,1,3072,1536,fp16,Ascend910B2,torch_mm_npu,-1,-1,-1,-1,-1,-1,0.0,0.0,105.04000261425972,125.94920381903648,0.08984371444330919,7,-1,-1,torch_mm_npu,0,torch_mm_npu
2026-03-03T08:26:38.174288+00:00,TORCH,llm_style,tune,llm_style_tune_004,8,1024,1536,fp16,Ascend910B2,torch_mm_npu,-1,-1,-1,-1,-1,-1,0.0,0.0,110.69000139832497,128.81699442863464,0.22735408512137598,7,-1,-1,torch_mm_npu,0,torch_mm_npu
2026-03-03T08:26:38.998612+00:00,TORCH,llm_style,tune,llm_style_tune_005,1,4096,8192,fp16,Ascend910B2,torch_mm_npu,-1,-1,-1,-1,-1,-1,0.0,0.0,107.82000049948692,131.36780366301537,0.6224157270368343,6,-1,-1,torch_mm_npu,0,torch_mm_npu
2026-03-03T08:26:39.158837+00:00,TORCH,llm_style,tune,llm_style_tune_006,4,6144,1024,fp16,Ascend910B2,torch_mm_npu,-1,-1,-1,-1,-1,-1,0.0,0.0,104.29999977350235,136.39879822731018,0.48256613719367303,5,-1,-1,torch_mm_npu,0,torch_mm_npu
2026-03-03T08:26:40.729752+00:00,TORCH,llm_style,tune,llm_style_tune_007,4,8192,8192,fp16,Ascend910B2,torch_mm_npu,-1,-1,-1,-1,-1,-1,0.0,0.0,106.94000124931335,122.84279651939869,5.020300221882101,4,-1,-1,torch_mm_npu,0,torch_mm_npu
2026-03-03T08:26:40.890215+00:00,TORCH,llm_style,tune,llm_style_tune_008,64,6144,1024,fp16,Ascend910B2,torch_mm_npu,-1,-1,-1,-1,-1,-1,0.0,0.0,104.86999899148941,123.33940207958221,7.679091978110476,1,-1,-1,torch_mm_npu,0,torch_mm_npu
2026-03-03T08:26:41.199913+00:00,TORCH,llm_style,tune,llm_style_tune_009,2,4096,3072,fp16,Ascend910B2,torch_mm_npu,-1,-1,-1,-1,-1,-1,0.0,0.0,106.37999698519707,133.2005999982357,0.4731307522691857,7,-1,-1,torch_mm_npu,0,torch_mm_npu
2026-03-03T08:26:41.624108+00:00,TORCH,llm_style,tune,llm_style_tune_010,32,2048,8192,fp16,Ascend910B2,torch_mm_npu,-1,-1,-1,-1,-1,-1,0.0,0.0,102.0600013434887,123.57700042426586,10.520691846615415,2,-1,-1,torch_mm_npu,0,torch_mm_npu
2026-03-03T08:26:41.746944+00:00,TORCH,llm_style,tune,llm_style_tune_011,32,3072,1536,fp16,Ascend910B2,torch_mm_npu,-1,-1,-1,-1,-1,-1,0.0,0.0,107.54000023007393,131.85919299721718,2.8081633564619195,3,-1,-1,torch_mm_npu,0,torch_mm_npu
2026-03-03T08:26:41.788297+00:00,TORCH,llm_style,tune,llm_style_tune_012,2,1536,1024,fp16,Ascend910B2,torch_mm_npu,-1,-1,-1,-1,-1,-1,0.0,0.0,107.81999677419662,137.12500169873238,0.058351476425805876,7,-1,-1,torch_mm_npu,0,torch_mm_npu
2026-03-03T08:26:41.947422+00:00,TORCH,llm_style,tune,llm_style_tune_013,64,6144,1024,fp16,Ascend910B2,torch_mm_npu,-1,-1,-1,-1,-1,-1,0.0,0.0,116.22999981045723,132.36199483275414,6.928558627834967,1,-1,-1,torch_mm_npu,0,torch_mm_npu
2026-03-03T08:26:43.604080+00:00,TORCH,llm_style,tune,llm_style_tune_014,64,8192,8192,fp16,Ascend910B2,torch_mm_npu,-1,-1,-1,-1,-1,-1,0.0,0.0,107.91999846696854,173.27139720320702,79.595392086937,0,-1,-1,torch_mm_npu,0,torch_mm_npu
2026-03-03T08:26:43.731932+00:00,TORCH,llm_style,tune,llm_style_tune_015,64,1536,3072,fp16,Ascend910B2,torch_mm_npu,-1,-1,-1,-1,-1,-1,0.0,0.0,104.23000156879425,112.52259887754917,5.794682595311669,3,-1,-1,torch_mm_npu,0,torch_mm_npu
2026-03-03T08:26:43.775550+00:00,TORCH,llm_style,eval,llm_style_eval_000,32,1536,1024,fp16,Ascend910B2,torch_mm_npu,-1,-1,-1,-1,-1,-1,0.0,0.0,105.07000237703323,113.1789980083704,0.958059329234426,3,-1,-1,torch_mm_npu,0,torch_mm_npu
2026-03-03T08:26:44.197269+00:00,TORCH,llm_style,eval,llm_style_eval_001,32,2048,8192,fp16,Ascend910B2,torch_mm_npu,-1,-1,-1,-1,-1,-1,0.0,0.0,103.70000079274178,109.93699789047241,10.354308734731985,2,-1,-1,torch_mm_npu,0,torch_mm_npu
2026-03-03T08:26:44.411018+00:00,TORCH,llm_style,eval,llm_style_eval_002,16,2048,4096,fp16,Ascend910B2,torch_mm_npu,-1,-1,-1,-1,-1,-1,0.0,0.0,103.39000076055527,110.70499882102013,2.5963386596899207,7,-1,-1,torch_mm_npu,0,torch_mm_npu
2026-03-03T08:26:44.490720+00:00,TORCH,llm_style,eval,llm_style_eval_003,16,2048,1536,fp16,Ascend910B2,torch_mm_npu,-1,-1,-1,-1,-1,-1,0.0,0.0,106.36000335216522,113.04380044341087,0.9464393834841934,7,-1,-1,torch_mm_npu,0,torch_mm_npu
2026-03-03T08:26:44.895482+00:00,TORCH,llm_style,eval,llm_style_eval_004,64,8192,2048,fp16,Ascend910B2,torch_mm_npu,-1,-1,-1,-1,-1,-1,0.0,0.0,104.60999980568886,128.79140242934227,20.528473874284593,1,-1,-1,torch_mm_npu,0,torch_mm_npu
2026-03-03T08:26:45.507007+00:00,TORCH,llm_style,eval,llm_style_eval_005,64,3072,8192,fp16,Ascend910B2,torch_mm_npu,-1,-1,-1,-1,-1,-1,0.0,0.0,102.48000174760818,107.09719955921173,31.432722648984356,2,-1,-1,torch_mm_npu,0,torch_mm_npu
2026-03-03T08:26:45.621110+00:00,TORCH,llm_style,eval,llm_style_eval_006,32,2048,2048,fp16,Ascend910B2,torch_mm_npu,-1,-1,-1,-1,-1,-1,0.0,0.0,104.32000085711479,110.05519829690456,2.573192616894924,3,-1,-1,torch_mm_npu,0,torch_mm_npu
2026-03-03T08:26:46.042332+00:00,TORCH,llm_style,eval,llm_style_eval_007,8,8192,2048,fp16,Ascend910B2,torch_mm_npu,-1,-1,-1,-1,-1,-1,0.0,0.0,101.5000008046627,111.62779718637466,2.644684274600209,5,-1,-1,torch_mm_npu,0,torch_mm_npu
2026-03-03T08:26:46.363598+00:00,TORCH,llm_style,eval,llm_style_eval_008,64,1536,8192,fp16,Ascend910B2,torch_mm_npu,-1,-1,-1,-1,-1,-1,0.0,0.0,104.7699972987175,110.03719866275787,15.372843156689818,2,-1,-1,torch_mm_npu,0,torch_mm_npu
2026-03-03T08:26:46.988411+00:00,TORCH,llm_style,eval,llm_style_eval_009,64,4096,6144,fp16,Ascend910B2,torch_mm_npu,-1,-1,-1,-1,-1,-1,0.0,0.0,105.11000081896782,109.0758004039526,30.64623201314549,3,-1,-1,torch_mm_npu,0,torch_mm_npu
2026-03-03T08:26:47.203582+00:00,TORCH,llm_style,eval,llm_style_eval_010,64,2048,4096,fp16,Ascend910B2,torch_mm_npu,-1,-1,-1,-1,-1,-1,0.0,0.0,105.0800010561943,113.58499951660633,10.218327114650371,3,-1,-1,torch_mm_npu,0,torch_mm_npu
2026-03-03T08:26:47.658207+00:00,TORCH,llm_style,eval,llm_style_eval_011,32,3072,6144,fp16,Ascend910B2,torch_mm_npu,-1,-1,-1,-1,-1,-1,0.0,0.0,102.80000045895576,124.40600551664829,11.750579247149844,3,-1,-1,torch_mm_npu,0,torch_mm_npu
2026-03-03T08:26:47.719076+00:00,TORCH,llm_style,eval,llm_style_eval_012,16,1536,1536,fp16,Ascend910B2,torch_mm_npu,-1,-1,-1,-1,-1,-1,0.0,0.0,109.13999751210213,112.25380055606365,0.6917488887758897,7,-1,-1,torch_mm_npu,0,torch_mm_npu
2026-03-03T08:26:47.873240+00:00,TORCH,llm_style,eval,llm_style_eval_013,64,2048,3072,fp16,Ascend910B2,torch_mm_npu,-1,-1,-1,-1,-1,-1,0.0,0.0,105.02000153064728,133.85339446365833,7.66812375036,3,-1,-1,torch_mm_npu,0,torch_mm_npu
2026-03-03T08:26:49.052402+00:00,TORCH,llm_style,eval,llm_style_eval_014,16,8192,6144,fp16,Ascend910B2,torch_mm_npu,-1,-1,-1,-1,-1,-1,0.0,0.0,104.9799993634224,112.09340184926987,15.342091310406094,5,-1,-1,torch_mm_npu,0,torch_mm_npu
2026-03-03T08:26:49.280429+00:00,TORCH,llm_style,eval,llm_style_eval_015,64,6144,1536,fp16,Ascend910B2,torch_mm_npu,-1,-1,-1,-1,-1,-1,0.0,0.0,103.58000174164772,107.91579782962799,11.662092408657497,1,-1,-1,torch_mm_npu,0,torch_mm_npu
2026-03-03T08:26:49.692953+00:00,TORCH,llm_style,eval,llm_style_eval_016,16,4096,4096,fp16,Ascend910B2,torch_mm_npu,-1,-1,-1,-1,-1,-1,0.0,0.0,104.94000092148781,110.8564019203186,5.115979676821871,7,-1,-1,torch_mm_npu,0,torch_mm_npu
2026-03-03T08:26:50.517037+00:00,TORCH,llm_style,eval,llm_style_eval_017,64,8192,4096,fp16,Ascend910B2,torch_mm_npu,-1,-1,-1,-1,-1,-1,0.0,0.0,105.80999776721,123.10680150985718,40.591318274566575,1,-1,-1,torch_mm_npu,0,torch_mm_npu
2026-03-03T08:26:51.129896+00:00,TORCH,llm_style,eval,llm_style_eval_018,32,4096,6144,fp16,Ascend910B2,torch_mm_npu,-1,-1,-1,-1,-1,-1,0.0,0.0,105.2899993956089,110.12260116636753,15.296920365137453,3,-1,-1,torch_mm_npu,0,torch_mm_npu
2026-03-03T08:26:51.738448+00:00,TORCH,llm_style,eval,llm_style_eval_019,16,3072,8192,fp16,Ascend910B2,torch_mm_npu,-1,-1,-1,-1,-1,-1,0.0,0.0,103.99999842047691,111.3777969032526,7.743330579142014,6,-1,-1,torch_mm_npu,0,torch_mm_npu
2026-03-03T08:26:51.805978+00:00,TORCH,llm_style,eval,llm_style_eval_020,4,1536,1536,fp16,Ascend910B2,torch_mm_npu,-1,-1,-1,-1,-1,-1,0.0,0.0,109.59000140428543,132.83259600400925,0.1722270988059494,7,-1,-1,torch_mm_npu,0,torch_mm_npu
2026-03-03T08:26:52.037448+00:00,TORCH,llm_style,eval,llm_style_eval_021,4,6144,1536,fp16,Ascend910B2,torch_mm_npu,-1,-1,-1,-1,-1,-1,0.0,0.0,108.77999663352966,117.28699915111065,0.694038190259781,5,-1,-1,torch_mm_npu,0,torch_mm_npu
2026-03-03T08:26:52.202555+00:00,TORCH,llm_style,eval,llm_style_eval_022,32,6144,1024,fp16,Ascend910B2,torch_mm_npu,-1,-1,-1,-1,-1,-1,0.0,0.0,104.77999970316887,112.08439715206623,3.8428439123943092,1,-1,-1,torch_mm_npu,0,torch_mm_npu
2026-03-03T08:26:52.251242+00:00,TORCH,llm_style,eval,llm_style_eval_023,16,1024,1536,fp16,Ascend910B2,torch_mm_npu,-1,-1,-1,-1,-1,-1,0.0,0.0,112.98999935388565,143.73800113797188,0.4454522372582802,7,-1,-1,torch_mm_npu,0,torch_mm_npu
2026-03-03T08:26:52.455314+00:00,TORCH,llm_style,eval,llm_style_eval_024,32,8192,1024,fp16,Ascend910B2,torch_mm_npu,-1,-1,-1,-1,-1,-1,0.0,0.0,108.83999988436699,133.8705985993147,4.932661820749527,1,-1,-1,torch_mm_npu,0,torch_mm_npu
2026-03-03T08:26:53.368799+00:00,TORCH,llm_style,eval,llm_style_eval_025,32,6144,6144,fp16,Ascend910B2,torch_mm_npu,-1,-1,-1,-1,-1,-1,0.0,0.0,105.9499979019165,148.76620270311832,22.8024459824581,1,-1,-1,torch_mm_npu,0,torch_mm_npu
2026-03-03T08:26:53.678891+00:00,TORCH,llm_style,eval,llm_style_eval_026,1,6144,2048,fp16,Ascend910B2,torch_mm_npu,-1,-1,-1,-1,-1,-1,0.0,0.0,105.58000206947327,123.3796015381813,0.23835786613681348,5,-1,-1,torch_mm_npu,0,torch_mm_npu
2026-03-03T08:26:53.988532+00:00,TORCH,llm_style,eval,llm_style_eval_027,32,4096,3072,fp16,Ascend910B2,torch_mm_npu,-1,-1,-1,-1,-1,-1,0.0,0.0,104.65000197291374,129.07980628311634,7.695235096206067,3,-1,-1,torch_mm_npu,0,torch_mm_npu
2026-03-03T08:26:54.052241+00:00,TORCH,llm_style,eval,llm_style_eval_028,64,1536,1536,fp16,Ascend910B2,torch_mm_npu,-1,-1,-1,-1,-1,-1,0.0,0.0,107.09000006318092,111.71840071678162,2.8199634683148016,3,-1,-1,torch_mm_npu,0,torch_mm_npu
2026-03-03T08:26:54.129239+00:00,TORCH,llm_style,eval,llm_style_eval_029,2,3072,1024,fp16,Ascend910B2,torch_mm_npu,-1,-1,-1,-1,-1,-1,0.0,0.0,106.06000199913979,115.65740257501602,0.1186395602755321,7,-1,-1,torch_mm_npu,0,torch_mm_npu
2026-03-03T08:26:54.440043+00:00,TORCH,llm_style,eval,llm_style_eval_030,32,1536,8192,fp16,Ascend910B2,torch_mm_npu,-1,-1,-1,-1,-1,-1,0.0,0.0,107.30999708175659,119.30299945175648,7.504485974279347,2,-1,-1,torch_mm_npu,0,torch_mm_npu
2026-03-03T08:26:54.591452+00:00,TORCH,llm_style,eval,llm_style_eval_031,8,3072,2048,fp16,Ascend910B2,torch_mm_npu,-1,-1,-1,-1,-1,-1,0.0,0.0,106.26000165939331,126.95820361375809,0.9473300811971278,7,-1,-1,torch_mm_npu,0,torch_mm_npu
2026-03-03T08:26:54.751967+00:00,TORCH,llm_style,eval,llm_style_eval_032,8,2048,3072,fp16,Ascend910B2,torch_mm_npu,-1,-1,-1,-1,-1,-1,0.0,0.0,105.93999922275543,138.00499714910984,0.9501915871109236,7,-1,-1,torch_mm_npu,0,torch_mm_npu
2026-03-03T08:26:55.065687+00:00,TORCH,llm_style,eval,llm_style_eval_033,64,1536,8192,fp16,Ascend910B2,torch_mm_npu,-1,-1,-1,-1,-1,-1,0.0,0.0,105.2899993956089,107.77820162475109,15.296920365137453,2,-1,-1,torch_mm_npu,0,torch_mm_npu
2026-03-03T08:26:55.389489+00:00,TORCH,llm_style,eval,llm_style_eval_034,64,6144,2048,fp16,Ascend910B2,torch_mm_npu,-1,-1,-1,-1,-1,-1,0.0,0.0,107.099998742342,110.91079853475094,15.038401072952059,1,-1,-1,torch_mm_npu,0,torch_mm_npu
2026-03-03T08:26:55.592867+00:00,TORCH,llm_style,eval,llm_style_eval_035,4,4096,2048,fp16,Ascend910B2,torch_mm_npu,-1,-1,-1,-1,-1,-1,0.0,0.0,104.4199988245964,108.2491983473301,0.6426820987876926,7,-1,-1,torch_mm_npu,0,torch_mm_npu
2026-03-03T08:26:56.398477+00:00,TORCH,llm_style,eval,llm_style_eval_036,64,8192,4096,fp16,Ascend910B2,torch_mm_npu,-1,-1,-1,-1,-1,-1,0.0,0.0,104.5599989593029,111.62040062248707,41.07658128106617,1,-1,-1,torch_mm_npu,0,torch_mm_npu
2026-03-03T08:26:56.552905+00:00,TORCH,llm_style,eval,llm_style_eval_037,32,6144,1024,fp16,Ascend910B2,torch_mm_npu,-1,-1,-1,-1,-1,-1,0.0,0.0,104.11999747157097,110.11079989373684,3.867203167287253,1,-1,-1,torch_mm_npu,0,torch_mm_npu
2026-03-03T08:26:56.856798+00:00,TORCH,llm_style,eval,llm_style_eval_038,64,6144,2048,fp16,Ascend910B2,torch_mm_npu,-1,-1,-1,-1,-1,-1,0.0,0.0,106.07999935746193,159.3372056633234,15.183000996942459,1,-1,-1,torch_mm_npu,0,torch_mm_npu
2026-03-03T08:26:56.940716+00:00,TORCH,llm_style,eval,llm_style_eval_039,8,1024,3072,fp16,Ascend910B2,torch_mm_npu,-1,-1,-1,-1,-1,-1,0.0,0.0,106.92999884486198,110.38499817252159,0.47069717145534645,7,-1,-1,torch_mm_npu,0,torch_mm_npu
2026-03-03T08:26:57.347026+00:00,TORCH,llm_style,eval,llm_style_eval_040,32,8192,2048,fp16,Ascend910B2,torch_mm_npu,-1,-1,-1,-1,-1,-1,0.0,0.0,105.65999895334244,110.280202627182,10.162235800079321,1,-1,-1,torch_mm_npu,0,torch_mm_npu
2026-03-03T08:26:57.431166+00:00,TORCH,llm_style,eval,llm_style_eval_041,32,3072,1024,fp16,Ascend910B2,torch_mm_npu,-1,-1,-1,-1,-1,-1,0.0,0.0,108.47999900579453,131.39339946210384,1.8558867426726842,3,-1,-1,torch_mm_npu,0,torch_mm_npu
2026-03-03T08:26:57.553773+00:00,TORCH,llm_style,eval,llm_style_eval_042,64,1024,4096,fp16,Ascend910B2,torch_mm_npu,-1,-1,-1,-1,-1,-1,0.0,0.0,106.369998306036,111.17099985480309,5.0472024118621714,3,-1,-1,torch_mm_npu,0,torch_mm_npu
2026-03-03T08:26:57.595861+00:00,TORCH,llm_style,eval,llm_style_eval_043,2,1536,1024,fp16,Ascend910B2,torch_mm_npu,-1,-1,-1,-1,-1,-1,0.0,0.0,109.27000269293785,112.66920246183872,0.05757715608079342,7,-1,-1,torch_mm_npu,0,torch_mm_npu
2026-03-03T08:26:58.060926+00:00,TORCH,llm_style,eval,llm_style_eval_044,64,6144,3072,fp16,Ascend910B2,torch_mm_npu,-1,-1,-1,-1,-1,-1,0.0,0.0,104.26000133156776,108.4750010818243,23.172060935592086,1,-1,-1,torch_mm_npu,0,torch_mm_npu
2026-03-03T08:26:58.307124+00:00,TORCH,llm_style,eval,llm_style_eval_045,64,1536,6144,fp16,Ascend910B2,torch_mm_npu,-1,-1,-1,-1,-1,-1,0.0,0.0,105.37999868392944,118.58959749341011,11.462892077111167,3,-1,-1,torch_mm_npu,0,torch_mm_npu
2026-03-03T08:26:58.783554+00:00,TORCH,llm_style,eval,llm_style_eval_046,2,6144,3072,fp16,Ascend910B2,torch_mm_npu,-1,-1,-1,-1,-1,-1,0.0,0.0,105.6400015950203,131.67460069060326,0.7146674636509929,5,-1,-1,torch_mm_npu,0,torch_mm_npu
2026-03-03T08:26:59.613712+00:00,TORCH,llm_style,eval,llm_style_eval_047,16,4096,8192,fp16,Ascend910B2,torch_mm_npu,-1,-1,-1,-1,-1,-1,0.0,0.0,105.4299995303154,109.63059894740582,10.184405091373028,6,-1,-1,torch_mm_npu,0,torch_mm_npu
2026-03-03T08:26:59.778168+00:00,TORCH,llm_style,eval,llm_style_eval_048,16,1024,6144,fp16,Ascend910B2,torch_mm_npu,-1,-1,-1,-1,-1,-1,0.0,0.0,105.53999990224838,125.60420550405979,1.9075856754450404,7,-1,-1,torch_mm_npu,0,torch_mm_npu
2026-03-03T08:27:00.094943+00:00,TORCH,llm_style,eval,llm_style_eval_049,16,8192,1536,fp16,Ascend910B2,torch_mm_npu,-1,-1,-1,-1,-1,-1,0.0,0.0,105.16000166535378,126.03620253503323,3.8289575658371158,5,-1,-1,torch_mm_npu,0,torch_mm_npu
2026-03-03T08:27:00.124767+00:00,TORCH,llm_style,eval,llm_style_eval_050,1,1024,1024,fp16,Ascend910B2,torch_mm_npu,-1,-1,-1,-1,-1,-1,0.0,0.0,107.45999962091446,138.9581936597824,0.019515652404598002,7,-1,-1,torch_mm_npu,0,torch_mm_npu
2026-03-03T08:27:00.284665+00:00,TORCH,llm_style,eval,llm_style_eval_051,16,6144,1024,fp16,Ascend910B2,torch_mm_npu,-1,-1,-1,-1,-1,-1,0.0,0.0,106.35000094771385,111.09820157289505,1.8930567955423023,5,-1,-1,torch_mm_npu,0,torch_mm_npu
2026-03-03T08:27:01.912460+00:00,TORCH,llm_style,eval,llm_style_eval_052,16,8192,8192,fp16,Ascend910B2,torch_mm_npu,-1,-1,-1,-1,-1,-1,0.0,0.0,105.85999861359596,113.76180060207844,20.28607288989886,4,-1,-1,torch_mm_npu,0,torch_mm_npu
2026-03-03T08:27:03.131452+00:00,TORCH,llm_style,eval,llm_style_eval_053,1,6144,8192,fp16,Ascend910B2,torch_mm_npu,-1,-1,-1,-1,-1,-1,0.0,0.0,105.05000129342079,144.7377945482731,0.9582417397485979,4,-1,-1,torch_mm_npu,0,torch_mm_npu
2026-03-03T08:27:03.451812+00:00,TORCH,llm_style,eval,llm_style_eval_054,64,4096,3072,fp16,Ascend910B2,torch_mm_npu,-1,-1,-1,-1,-1,-1,0.0,0.0,103.39000076055527,113.08119878172874,15.578031958139528,3,-1,-1,torch_mm_npu,0,torch_mm_npu
2026-03-03T08:27:03.662099+00:00,TORCH,llm_style,eval,llm_style_eval_055,4,8192,1024,fp16,Ascend910B2,torch_mm_npu,-1,-1,-1,-1,-1,-1,0.0,0.0,103.00000011920929,105.8110000193119,0.6515423681779622,5,-1,-1,torch_mm_npu,0,torch_mm_npu
2026-03-03T08:27:03.750712+00:00,TORCH,llm_style,eval,llm_style_eval_056,64,1024,3072,fp16,Ascend910B2,torch_mm_npu,-1,-1,-1,-1,-1,-1,0.0,0.0,105.48999905586243,115.08219741284847,3.8169796910015537,3,-1,-1,torch_mm_npu,0,torch_mm_npu
2026-03-03T08:27:03.753769+00:00,TORCH,llm_style,eval,llm_style_eval_057,64,1024,3072,fp16,Ascend910B2,torch_mm_npu,-1,-1,-1,-1,-1,-1,0.0,0.0,106.40000179409981,111.97900295257568,3.7843343722793836,3,-1,-1,torch_mm_npu,0,torch_mm_npu
2026-03-03T08:27:03.970055+00:00,TORCH,llm_style,eval,llm_style_eval_058,32,2048,4096,fp16,Ascend910B2,torch_mm_npu,-1,-1,-1,-1,-1,-1,0.0,0.0,103.47000136971474,116.88079744577408,5.188662461515536,3,-1,-1,torch_mm_npu,0,torch_mm_npu
2026-03-03T08:27:04.393006+00:00,TORCH,llm_style,eval,llm_style_eval_059,64,8192,2048,fp16,Ascend910B2,torch_mm_npu,-1,-1,-1,-1,-1,-1,0.0,0.0,103.3799983561039,109.96639743447304,20.772718921920987,1,-1,-1,torch_mm_npu,0,torch_mm_npu
2026-03-03T08:27:04.865572+00:00,TORCH,llm_style,eval,llm_style_eval_060,1,3072,6144,fp16,Ascend910B2,torch_mm_npu,-1,-1,-1,-1,-1,-1,0.0,0.0,106.1599999666214,114.85400170087814,0.3555834213627438,7,-1,-1,torch_mm_npu,0,torch_mm_npu
2026-03-03T08:27:05.031735+00:00,TORCH,llm_style,eval,llm_style_eval_061,64,1536,4096,fp16,Ascend910B2,torch_mm_npu,-1,-1,-1,-1,-1,-1,0.0,0.0,108.17000269889832,126.43620364367962,7.444821557799608,3,-1,-1,torch_mm_npu,0,torch_mm_npu
2026-03-03T08:27:05.347799+00:00,TORCH,llm_style,eval,llm_style_eval_062,16,6144,2048,fp16,Ascend910B2,torch_mm_npu,-1,-1,-1,-1,-1,-1,0.0,0.0,108.85000228881836,125.59639900922775,3.69915641280021,5,-1,-1,torch_mm_npu,0,torch_mm_npu
2026-03-03T08:27:05.596708+00:00,TORCH,llm_style,eval,llm_style_eval_063,64,1536,6144,fp16,Ascend910B2,torch_mm_npu,-1,-1,-1,-1,-1,-1,0.0,0.0,105.60999810695648,109.00039941072464,11.437927977014443,3,-1,-1,torch_mm_npu,0,torch_mm_npu
2026-03-03T08:27:06.086926+00:00,ONEKEY,llm_style,tune,llm_style_tune_000,8,2048,4096,fp16,Ascend910B2,c06,64,128,32,4,3,8,0.0,0.0,241.0300001502037,247.84059539437294,0.5568507153315311,7,-1,-1,onekey:32x4096x2048,0,"onekey_rep_shape=32x4096x2048;path_reordered,ASCEND_HOME_PATH_set,ASCEND_TOOLKIT_HOME_set"
2026-03-03T08:27:06.215060+00:00,ONEKEY,llm_style,tune,llm_style_tune_001,32,1536,3072,fp16,Ascend910B2,c06,64,128,32,4,3,8,0.0,0.0,242.30000376701355,268.14120277762413,1.246347021481609,3,-1,-1,onekey:32x4096x2048,0,"onekey_rep_shape=32x4096x2048;path_reordered,ASCEND_HOME_PATH_set,ASCEND_TOOLKIT_HOME_set"
2026-03-03T08:27:06.215178+00:00,ONEKEY,llm_style,tune,llm_style_tune_002,32,4096,2048,fp16,Ascend910B2,c06,64,128,32,4,3,8,0.0,272.2,234.70000177621841,250.6395873427391,2.287477238759867,3,-1,-1,onekey:32x4096x2048,0,"onekey_rep_shape=32x4096x2048;path_reordered,ASCEND_HOME_PATH_set,ASCEND_TOOLKIT_HOME_set"
2026-03-03T08:27:06.336766+00:00,ONEKEY,llm_style,tune,llm_style_tune_003,1,3072,1536,fp16,Ascend910B2,c06,64,128,32,4,3,8,0.0,0.0,246.05000019073486,264.1016048192978,0.038354740876587745,7,-1,-1,onekey:32x4096x2048,0,"onekey_rep_shape=32x4096x2048;path_reordered,ASCEND_HOME_PATH_set,ASCEND_TOOLKIT_HOME_set"
2026-03-03T08:27:06.382348+00:00,ONEKEY,llm_style,tune,llm_style_tune_004,8,1024,1536,fp16,Ascend910B2,c06,64,128,32,4,3,8,0.0,0.0,255.72000443935394,273.02220046520233,0.09841163602031876,7,-1,-1,onekey:32x4096x2048,0,"onekey_rep_shape=32x4096x2048;path_reordered,ASCEND_HOME_PATH_set,ASCEND_TOOLKIT_HOME_set"
2026-03-03T08:27:07.207115+00:00,ONEKEY,llm_style,tune,llm_style_tune_005,1,4096,8192,fp16,Ascend910B2,c06,64,128,32,4,3,8,0.0,0.0,329.52000200748444,333.42940747737885,0.20365642022081484,6,-1,-1,onekey:32x4096x2048,0,"onekey_rep_shape=32x4096x2048;path_reordered,ASCEND_HOME_PATH_set,ASCEND_TOOLKIT_HOME_set"
2026-03-03T08:27:07.368765+00:00,ONEKEY,llm_style,tune,llm_style_tune_006,4,6144,1024,fp16,Ascend910B2,c06,64,128,32,4,3,8,0.0,0.0,243.35000663995743,261.257012039423,0.20682821708103327,5,-1,-1,onekey:32x4096x2048,0,"onekey_rep_shape=32x4096x2048;path_reordered,ASCEND_HOME_PATH_set,ASCEND_TOOLKIT_HOME_set"
2026-03-03T08:27:09.016360+00:00,ONEKEY,llm_style,tune,llm_style_tune_007,4,8192,8192,fp16,Ascend910B2,c06,64,128,32,4,3,8,0.0,0.0,401.5199989080429,405.31639486551285,1.337096317643086,4,-1,-1,onekey:32x4096x2048,0,"onekey_rep_shape=32x4096x2048;path_reordered,ASCEND_HOME_PATH_set,ASCEND_TOOLKIT_HOME_set"
2026-03-03T08:27:09.178644+00:00,ONEKEY,llm_style,tune,llm_style_tune_008,64,6144,1024,fp16,Ascend910B2,c06,64,128,32,4,3,8,0.0,0.0,240.70999771356583,277.42760866880417,3.345545991647089,1,-1,-1,onekey:32x4096x2048,0,"onekey_rep_shape=32x4096x2048;path_reordered,ASCEND_HOME_PATH_set,ASCEND_TOOLKIT_HOME_set"
2026-03-03T08:27:09.490250+00:00,ONEKEY,llm_style,tune,llm_style_tune_009,2,4096,3072,fp16,Ascend910B2,c06,64,128,32,4,3,8,0.0,0.0,241.28000438213348,249.57660496234894,0.2086026487312473,7,-1,-1,onekey:32x4096x2048,0,"onekey_rep_shape=32x4096x2048;path_reordered,ASCEND_HOME_PATH_set,ASCEND_TOOLKIT_HOME_set"
2026-03-03T08:27:09.918688+00:00,ONEKEY,llm_style,tune,llm_style_tune_010,32,2048,8192,fp16,Ascend910B2,c06,64,128,32,4,3,8,0.0,0.0,258.84999334812164,277.58260011672974,4.148123823035793,2,-1,-1,onekey:32x4096x2048,0,"onekey_rep_shape=32x4096x2048;path_reordered,ASCEND_HOME_PATH_set,ASCEND_TOOLKIT_HOME_set"
2026-03-03T08:27:10.042608+00:00,ONEKEY,llm_style,tune,llm_style_tune_011,32,3072,1536,fp16,Ascend910B2,c06,64,128,32,4,3,8,0.0,0.0,243.70000511407852,274.92019206285477,1.2391870400603209,3,-1,-1,onekey:32x4096x2048,0,"onekey_rep_shape=32x4096x2048;path_reordered,ASCEND_HOME_PATH_set,ASCEND_TOOLKIT_HOME_set"
2026-03-03T08:27:10.085454+00:00,ONEKEY,llm_style,tune,llm_style_tune_012,2,1536,1024,fp16,Ascend910B2,c06,64,128,32,4,3,8,0.0,0.0,255.7699978351593,276.2299942970276,0.024598100063537427,7,-1,-1,onekey:32x4096x2048,0,"onekey_rep_shape=32x4096x2048;path_reordered,ASCEND_HOME_PATH_set,ASCEND_TOOLKIT_HOME_set"
2026-03-03T08:27:10.247234+00:00,ONEKEY,llm_style,tune,llm_style_tune_013,64,6144,1024,fp16,Ascend910B2,c06,64,128,32,4,3,8,0.0,0.0,246.65000289678574,259.61600959300995,3.264976114097157,1,-1,-1,onekey:32x4096x2048,0,"onekey_rep_shape=32x4096x2048;path_reordered,ASCEND_HOME_PATH_set,ASCEND_TOOLKIT_HOME_set"
2026-03-03T08:27:11.842619+00:00,ONEKEY,llm_style,tune,llm_style_tune_014,64,8192,8192,fp16,Ascend910B2,c06,64,128,32,4,3,8,0.0,0.0,450.0399976968765,457.71220207214355,19.087047009065476,0,-1,-1,onekey:32x4096x2048,0,"onekey_rep_shape=32x4096x2048;path_reordered,ASCEND_HOME_PATH_set,ASCEND_TOOLKIT_HOME_set"
2026-03-03T08:27:11.969633+00:00,ONEKEY,llm_style,tune,llm_style_tune_015,64,1536,3072,fp16,Ascend910B2,c06,64,128,32,4,3,8,0.0,0.0,240.29000103473663,304.24339935183525,2.513545188726716,3,-1,-1,onekey:32x4096x2048,0,"onekey_rep_shape=32x4096x2048;path_reordered,ASCEND_HOME_PATH_set,ASCEND_TOOLKIT_HOME_set"
2026-03-03T08:27:12.013456+00:00,ONEKEY,llm_style,eval,llm_style_eval_000,32,1536,1024,fp16,Ascend910B2,c06,64,128,32,4,3,8,0.0,0.0,257.7900141477585,288.2818052172661,0.3904856296811499,3,-1,-1,onekey:32x4096x2048,0,"onekey_rep_shape=32x4096x2048;path_reordered,ASCEND_HOME_PATH_set,ASCEND_TOOLKIT_HOME_set"
2026-03-03T08:27:12.427706+00:00,ONEKEY,llm_style,eval,llm_style_eval_001,32,2048,8192,fp16,Ascend910B2,c06,64,128,32,4,3,8,0.0,0.0,256.7500025033951,261.44940227270126,4.182051854062987,2,-1,-1,onekey:32x4096x2048,0,"onekey_rep_shape=32x4096x2048;path_reordered,ASCEND_HOME_PATH_set,ASCEND_TOOLKIT_HOME_set"
2026-03-03T08:27:12.640552+00:00,ONEKEY,llm_style,eval,llm_style_eval_002,16,2048,4096,fp16,Ascend910B2,c06,64,128,32,4,3,8,0.0,0.0,239.64999616146088,249.60741356015205,1.1201145850181669,7,-1,-1,onekey:32x4096x2048,0,"onekey_rep_shape=32x4096x2048;path_reordered,ASCEND_HOME_PATH_set,ASCEND_TOOLKIT_HOME_set"
2026-03-03T08:27:12.722715+00:00,ONEKEY,llm_style,eval,llm_style_eval_003,16,2048,1536,fp16,Ascend910B2,c06,64,128,32,4,3,8,0.0,0.0,250.6600022315979,277.58500903844833,0.40159297496132595,7,-1,-1,onekey:32x4096x2048,0,"onekey_rep_shape=32x4096x2048;path_reordered,ASCEND_HOME_PATH_set,ASCEND_TOOLKIT_HOME_set"
2026-03-03T08:27:13.160245+00:00,ONEKEY,llm_style,eval,llm_style_eval_004,64,8192,2048,fp16,Ascend910B2,c06,64,128,32,4,3,8,0.0,0.0,266.83999598026276,276.5652060508728,8.047832710051614,1,-1,-1,onekey:32x4096x2048,0,"onekey_rep_shape=32x4096x2048;path_reordered,ASCEND_HOME_PATH_set,ASCEND_TOOLKIT_HOME_set"
2026-03-03T08:27:13.788641+00:00,ONEKEY,llm_style,eval,llm_style_eval_005,64,3072,8192,fp16,Ascend910B2,c06,64,128,32,4,3,8,0.0,0.0,290.8799946308136,297.90359646081924,11.074070171406584,2,-1,-1,onekey:32x4096x2048,0,"onekey_rep_shape=32x4096x2048;path_reordered,ASCEND_HOME_PATH_set,ASCEND_TOOLKIT_HOME_set"
2026-03-03T08:27:13.911677+00:00,ONEKEY,llm_style,eval,llm_style_eval_006,32,2048,2048,fp16,Ascend910B2,c06,64,128,32,4,3,8,0.0,0.0,241.5200024843216,262.73020803928375,1.111441922982862,3,-1,-1,onekey:32x4096x2048,0,"onekey_rep_shape=32x4096x2048;path_reordered,ASCEND_HOME_PATH_set,ASCEND_TOOLKIT_HOME_set"
2026-03-03T08:27:14.308732+00:00,ONEKEY,llm_style,eval,llm_style_eval_007,8,8192,2048,fp16,Ascend910B2,c06,64,128,32,4,3,8,0.0,0.0,239.8100048303604,284.83439192175865,1.119367209845515,5,-1,-1,onekey:32x4096x2048,0,"onekey_rep_shape=32x4096x2048;path_reordered,ASCEND_HOME_PATH_set,ASCEND_TOOLKIT_HOME_set"
2026-03-03T08:27:14.625262+00:00,ONEKEY,llm_style,eval,llm_style_eval_008,64,1536,8192,fp16,Ascend910B2,c06,64,128,32,4,3,8,0.0,0.0,255.09999692440033,282.98900187015533,6.313652510459693,2,-1,-1,onekey:32x4096x2048,0,"onekey_rep_shape=32x4096x2048;path_reordered,ASCEND_HOME_PATH_set,ASCEND_TOOLKIT_HOME_set"
2026-03-03T08:27:15.243441+00:00,ONEKEY,llm_style,eval,llm_style_eval_009,64,4096,6144,fp16,Ascend910B2,c06,64,128,32,4,3,8,0.0,0.0,350.51000118255615,363.29199463129044,9.190110014356735,3,-1,-1,onekey:32x4096x2048,0,"onekey_rep_shape=32x4096x2048;path_reordered,ASCEND_HOME_PATH_set,ASCEND_TOOLKIT_HOME_set"
2026-03-03T08:27:15.460144+00:00,ONEKEY,llm_style,eval,llm_style_eval_010,64,2048,4096,fp16,Ascend910B2,c06,64,128,32,4,3,8,0.0,0.0,238.92000317573547,279.3563875555992,4.49414787262588,3,-1,-1,onekey:32x4096x2048,0,"onekey_rep_shape=32x4096x2048;path_reordered,ASCEND_HOME_PATH_set,ASCEND_TOOLKIT_HOME_set"
2026-03-03T08:27:15.910070+00:00,ONEKEY,llm_style,eval,llm_style_eval_011,32,3072,6144,fp16,Ascend910B2,c06,64,128,32,4,3,8,0.0,0.0,260.5300098657608,285.409392118454,4.636546678911985,3,-1,-1,onekey:32x4096x2048,0,"onekey_rep_shape=32x4096x2048;path_reordered,ASCEND_HOME_PATH_set,ASCEND_TOOLKIT_HOME_set"
2026-03-03T08:27:15.983154+00:00,ONEKEY,llm_style,eval,llm_style_eval_012,16,1536,1536,fp16,Ascend910B2,c06,64,128,32,4,3,8,0.0,0.0,247.809998691082,271.2024110555649,0.3046586998053882,7,-1,-1,onekey:32x4096x2048,0,"onekey_rep_shape=32x4096x2048;path_reordered,ASCEND_HOME_PATH_set,ASCEND_TOOLKIT_HOME_set"
2026-03-03T08:27:16.145646+00:00,ONEKEY,llm_style,eval,llm_style_eval_013,64,2048,3072,fp16,Ascend910B2,c06,64,128,32,4,3,8,0.0,0.0,237.18000203371048,263.44520330429077,3.39533839739803,3,-1,-1,onekey:32x4096x2048,0,"onekey_rep_shape=32x4096x2048;path_reordered,ASCEND_HOME_PATH_set,ASCEND_TOOLKIT_HOME_set"
2026-03-03T08:27:17.348056+00:00,ONEKEY,llm_style,eval,llm_style_eval_014,16,8192,6144,fp16,Ascend910B2,c06,64,128,32,4,3,8,0.0,0.0,360.5399876832962,376.2915986776352,4.467223584127891,5,-1,-1,onekey:32x4096x2048,0,"onekey_rep_shape=32x4096x2048;path_reordered,ASCEND_HOME_PATH_set,ASCEND_TOOLKIT_HOME_set"
2026-03-03T08:27:17.579252+00:00,ONEKEY,llm_style,eval,llm_style_eval_015,64,6144,1536,fp16,Ascend910B2,c06,64,128,32,4,3,8,0.0,0.0,239.66000229120255,291.5781971812248,5.0403051842261535,1,-1,-1,onekey:32x4096x2048,0,"onekey_rep_shape=32x4096x2048;path_reordered,ASCEND_HOME_PATH_set,ASCEND_TOOLKIT_HOME_set"
2026-03-03T08:27:17.976155+00:00,ONEKEY,llm_style,eval,llm_style_eval_016,16,4096,4096,fp16,Ascend910B2,c06,64,128,32,4,3,8,0.0,0.0,266.170009970665,301.9578084349632,2.0170225490812035,7,-1,-1,onekey:32x4096x2048,0,"onekey_rep_shape=32x4096x2048;path_reordered,ASCEND_HOME_PATH_set,ASCEND_TOOLKIT_HOME_set"
2026-03-03T08:27:18.772018+00:00,ONEKEY,llm_style,eval,llm_style_eval_017,64,8192,4096,fp16,Ascend910B2,c06,64,128,32,4,3,8,0.0,0.0,333.15999805927277,357.6007926464081,12.891605597968212,1,-1,-1,onekey:32x4096x2048,0,"onekey_rep_shape=32x4096x2048;path_reordered,ASCEND_HOME_PATH_set,ASCEND_TOOLKIT_HOME_set"
2026-03-03T08:27:19.384068+00:00,ONEKEY,llm_style,eval,llm_style_eval_018,32,4096,6144,fp16,Ascend910B2,c06,64,128,32,4,3,8,0.0,0.0,321.83000445365906,375.2666038274765,5.004544988694226,3,-1,-1,onekey:32x4096x2048,0,"onekey_rep_shape=32x4096x2048;path_reordered,ASCEND_HOME_PATH_set,ASCEND_TOOLKIT_HOME_set"
2026-03-03T08:27:19.983614+00:00,ONEKEY,llm_style,eval,llm_style_eval_019,16,3072,8192,fp16,Ascend910B2,c06,64,128,32,4,3,8,0.0,0.0,269.2199945449829,318.66800904273987,2.9912576491990253,6,-1,-1,onekey:32x4096x2048,0,"onekey_rep_shape=32x4096x2048;path_reordered,ASCEND_HOME_PATH_set,ASCEND_TOOLKIT_HOME_set"
2026-03-03T08:27:20.047494+00:00,ONEKEY,llm_style,eval,llm_style_eval_020,4,1536,1536,fp16,Ascend910B2,c06,64,128,32,4,3,8,0.0,0.0,239.67000097036362,255.3616039454937,0.07875148297067813,7,-1,-1,onekey:32x4096x2048,0,"onekey_rep_shape=32x4096x2048;path_reordered,ASCEND_HOME_PATH_set,ASCEND_TOOLKIT_HOME_set"
2026-03-03T08:27:20.280909+00:00,ONEKEY,llm_style,eval,llm_style_eval_021,4,6144,1536,fp16,Ascend910B2,c06,64,128,32,4,3,8,0.0,0.0,240.84000289440155,248.9933942258358,0.31347563150919966,5,-1,-1,onekey:32x4096x2048,0,"onekey_rep_shape=32x4096x2048;path_reordered,ASCEND_HOME_PATH_set,ASCEND_TOOLKIT_HOME_set"
2026-03-03T08:27:20.436289+00:00,ONEKEY,llm_style,eval,llm_style_eval_022,32,6144,1024,fp16,Ascend910B2,c06,64,128,32,4,3,8,0.0,0.0,241.5900006890297,264.5262087881565,1.6666798412666424,1,-1,-1,onekey:32x4096x2048,0,"onekey_rep_shape=32x4096x2048;path_reordered,ASCEND_HOME_PATH_set,ASCEND_TOOLKIT_HOME_set"
2026-03-03T08:27:20.481466+00:00,ONEKEY,llm_style,eval,llm_style_eval_023,16,1024,1536,fp16,Ascend910B2,c06,64,128,32,4,3,8,0.0,0.0,251.92999839782715,259.6768093109131,0.1997842588024011,7,-1,-1,onekey:32x4096x2048,0,"onekey_rep_shape=32x4096x2048;path_reordered,ASCEND_HOME_PATH_set,ASCEND_TOOLKIT_HOME_set"
2026-03-03T08:27:20.686961+00:00,ONEKEY,llm_style,eval,llm_style_eval_024,32,8192,1024,fp16,Ascend910B2,c06,64,128,32,4,3,8,0.0,0.0,238.93000185489655,263.0804067850113,2.246979901360586,1,-1,-1,onekey:32x4096x2048,0,"onekey_rep_shape=32x4096x2048;path_reordered,ASCEND_HOME_PATH_set,ASCEND_TOOLKIT_HOME_set"
2026-03-03T08:27:21.595453+00:00,ONEKEY,llm_style,eval,llm_style_eval_025,32,6144,6144,fp16,Ascend910B2,c06,64,128,32,4,3,8,0.0,0.0,330.38999140262604,341.59061044454575,7.312325333293367,1,-1,-1,onekey:32x4096x2048,0,"onekey_rep_shape=32x4096x2048;path_reordered,ASCEND_HOME_PATH_set,ASCEND_TOOLKIT_HOME_set"
2026-03-03T08:27:21.900582+00:00,ONEKEY,llm_style,eval,llm_style_eval_026,1,6144,2048,fp16,Ascend910B2,c06,64,128,32,4,3,8,0.0,0.0,239.56000059843063,256.89841002225876,0.1050501917562813,5,-1,-1,onekey:32x4096x2048,0,"onekey_rep_shape=32x4096x2048;path_reordered,ASCEND_HOME_PATH_set,ASCEND_TOOLKIT_HOME_set"
2026-03-03T08:27:22.209487+00:00,ONEKEY,llm_style,eval,llm_style_eval_027,32,4096,3072,fp16,Ascend910B2,c06,64,128,32,4,3,8,0.0,0.0,245.88000029325485,264.05120611190796,3.275200776962467,3,-1,-1,onekey:32x4096x2048,0,"onekey_rep_shape=32x4096x2048;path_reordered,ASCEND_HOME_PATH_set,ASCEND_TOOLKIT_HOME_set"
2026-03-03T08:27:22.280143+00:00,ONEKEY,llm_style,eval,llm_style_eval_028,64,1536,1536,fp16,Ascend910B2,c06,64,128,32,4,3,8,0.0,0.0,253.24000418186188,281.97820097208023,1.1925046715096752,3,-1,-1,onekey:32x4096x2048,0,"onekey_rep_shape=32x4096x2048;path_reordered,ASCEND_HOME_PATH_set,ASCEND_TOOLKIT_HOME_set"
2026-03-03T08:27:22.377857+00:00,ONEKEY,llm_style,eval,llm_style_eval_029,2,3072,1024,fp16,Ascend910B2,c06,64,128,32,4,3,8,0.0,0.0,246.26000225543976,266.4888072013855,0.051096044362689635,7,-1,-1,onekey:32x4096x2048,0,"onekey_rep_shape=32x4096x2048;path_reordered,ASCEND_HOME_PATH_set,ASCEND_TOOLKIT_HOME_set"
2026-03-03T08:27:22.704158+00:00,ONEKEY,llm_style,eval,llm_style_eval_030,32,1536,8192,fp16,Ascend910B2,c06,64,128,32,4,3,8,0.0,0.0,267.26000010967255,280.81239998340607,3.01319452095164,2,-1,-1,onekey:32x4096x2048,0,"onekey_rep_shape=32x4096x2048;path_reordered,ASCEND_HOME_PATH_set,ASCEND_TOOLKIT_HOME_set"
2026-03-03T08:27:22.864137+00:00,ONEKEY,llm_style,eval,llm_style_eval_031,8,3072,2048,fp16,Ascend910B2,c06,64,128,32,4,3,8,0.0,0.0,246.79000675678253,264.78840321302414,0.4078904868267462,7,-1,-1,onekey:32x4096x2048,0,"onekey_rep_shape=32x4096x2048;path_reordered,ASCEND_HOME_PATH_set,ASCEND_TOOLKIT_HOME_set"
2026-03-03T08:27:23.030804+00:00,ONEKEY,llm_style,eval,llm_style_eval_032,8,2048,3072,fp16,Ascend910B2,c06,64,128,32,4,3,8,0.0,0.0,247.80000001192093,303.3100003004074,0.40622799029522755,7,-1,-1,onekey:32x4096x2048,0,"onekey_rep_shape=32x4096x2048;path_reordered,ASCEND_HOME_PATH_set,ASCEND_TOOLKIT_HOME_set"
2026-03-03T08:27:23.375229+00:00,ONEKEY,llm_style,eval,llm_style_eval_033,64,1536,8192,fp16,Ascend910B2,c06,64,128,32,4,3,8,0.0,0.0,258.7500065565109,276.3323900103569,6.224590126332007,2,-1,-1,onekey:32x4096x2048,0,"onekey_rep_shape=32x4096x2048;path_reordered,ASCEND_HOME_PATH_set,ASCEND_TOOLKIT_HOME_set"
2026-03-03T08:27:23.689105+00:00,ONEKEY,llm_style,eval,llm_style_eval_034,64,6144,2048,fp16,Ascend910B2,c06,64,128,32,4,3,8,0.0,0.0,253.5099983215332,280.3225901722908,6.353251337871175,1,-1,-1,onekey:32x4096x2048,0,"onekey_rep_shape=32x4096x2048;path_reordered,ASCEND_HOME_PATH_set,ASCEND_TOOLKIT_HOME_set"
2026-03-03T08:27:23.901969+00:00,ONEKEY,llm_style,eval,llm_style_eval_035,4,4096,2048,fp16,Ascend910B2,c06,64,128,32,4,3,8,0.0,0.0,239.79000002145767,269.62199956178665,0.27986514864671064,7,-1,-1,onekey:32x4096x2048,0,"onekey_rep_shape=32x4096x2048;path_reordered,ASCEND_HOME_PATH_set,ASCEND_TOOLKIT_HOME_set"
2026-03-03T08:27:24.727383+00:00,ONEKEY,llm_style,eval,llm_style_eval_036,64,8192,4096,fp16,Ascend910B2,c06,64,128,32,4,3,8,0.0,0.0,332.0799916982651,361.7452132701874,12.933532291528419,1,-1,-1,onekey:32x4096x2048,0,"onekey_rep_shape=32x4096x2048;path_reordered,ASCEND_HOME_PATH_set,ASCEND_TOOLKIT_HOME_set"
2026-03-03T08:27:24.890092+00:00,ONEKEY,llm_style,eval,llm_style_eval_037,32,6144,1024,fp16,Ascend910B2,c06,64,128,32,4,3,8,0.0,0.0,242.09000170230865,264.99459207057953,1.663237561108085,1,-1,-1,onekey:32x4096x2048,0,"onekey_rep_shape=32x4096x2048;path_reordered,ASCEND_HOME_PATH_set,ASCEND_TOOLKIT_HOME_set"
2026-03-03T08:27:25.208803+00:00,ONEKEY,llm_style,eval,llm_style_eval_038,64,6144,2048,fp16,Ascend910B2,c06,64,128,32,4,3,8,0.0,0.0,250.99999457597733,267.35280126333237,6.416783947429409,1,-1,-1,onekey:32x4096x2048,0,"onekey_rep_shape=32x4096x2048;path_reordered,ASCEND_HOME_PATH_set,ASCEND_TOOLKIT_HOME_set"
2026-03-03T08:27:25.294270+00:00,ONEKEY,llm_style,eval,llm_style_eval_039,8,1024,3072,fp16,Ascend910B2,c06,64,128,32,4,3,8,0.0,0.0,243.97999793291092,299.17679250240326,0.20629415700642842,7,-1,-1,onekey:32x4096x2048,0,"onekey_rep_shape=32x4096x2048;path_reordered,ASCEND_HOME_PATH_set,ASCEND_TOOLKIT_HOME_set"
2026-03-03T08:27:25.721358+00:00,ONEKEY,llm_style,eval,llm_style_eval_040,32,8192,2048,fp16,Ascend910B2,c06,64,128,32,4,3,8,0.0,0.0,257.21000134944916,283.5280093550682,4.174572599691405,1,-1,-1,onekey:32x4096x2048,0,"onekey_rep_shape=32x4096x2048;path_reordered,ASCEND_HOME_PATH_set,ASCEND_TOOLKIT_HOME_set"
2026-03-03T08:27:25.805690+00:00,ONEKEY,llm_style,eval,llm_style_eval_041,32,3072,1024,fp16,Ascend910B2,c06,64,128,32,4,3,8,0.0,0.0,249.7600093483925,265.6356132030487,0.8060801748256172,3,-1,-1,onekey:32x4096x2048,0,"onekey_rep_shape=32x4096x2048;path_reordered,ASCEND_HOME_PATH_set,ASCEND_TOOLKIT_HOME_set"
2026-03-03T08:27:25.926897+00:00,ONEKEY,llm_style,eval,llm_style_eval_042,64,1024,4096,fp16,Ascend910B2,c06,64,128,32,4,3,8,0.0,0.0,244.13999915122986,267.6276049017906,2.1990288927110266,3,-1,-1,onekey:32x4096x2048,0,"onekey_rep_shape=32x4096x2048;path_reordered,ASCEND_HOME_PATH_set,ASCEND_TOOLKIT_HOME_set"
2026-03-03T08:27:25.969007+00:00,ONEKEY,llm_style,eval,llm_style_eval_043,2,1536,1024,fp16,Ascend910B2,c06,64,128,32,4,3,8,0.0,0.0,257.8499913215637,286.09321266412735,0.024399675050420882,7,-1,-1,onekey:32x4096x2048,0,"onekey_rep_shape=32x4096x2048;path_reordered,ASCEND_HOME_PATH_set,ASCEND_TOOLKIT_HOME_set"
2026-03-03T08:27:26.449966+00:00,ONEKEY,llm_style,eval,llm_style_eval_044,64,6144,3072,fp16,Ascend910B2,c06,64,128,32,4,3,8,0.0,0.0,272.85999059677124,291.9705978035927,8.854061376738123,1,-1,-1,onekey:32x4096x2048,0,"onekey_rep_shape=32x4096x2048;path_reordered,ASCEND_HOME_PATH_set,ASCEND_TOOLKIT_HOME_set"
2026-03-03T08:27:26.698072+00:00,ONEKEY,llm_style,eval,llm_style_eval_045,64,1536,6144,fp16,Ascend910B2,c06,64,128,32,4,3,8,0.0,0.0,243.14000457525253,273.32880914211273,4.968164552395297,3,-1,-1,onekey:32x4096x2048,0,"onekey_rep_shape=32x4096x2048;path_reordered,ASCEND_HOME_PATH_set,ASCEND_TOOLKIT_HOME_set"
2026-03-03T08:27:27.155039+00:00,ONEKEY,llm_style,eval,llm_style_eval_046,2,6144,3072,fp16,Ascend910B2,c06,64,128,32,4,3,8,0.0,0.0,249.0600049495697,269.04839664697647,0.3031296494806018,5,-1,-1,onekey:32x4096x2048,0,"onekey_rep_shape=32x4096x2048;path_reordered,ASCEND_HOME_PATH_set,ASCEND_TOOLKIT_HOME_set"
2026-03-03T08:27:27.970412+00:00,ONEKEY,llm_style,eval,llm_style_eval_047,16,4096,8192,fp16,Ascend910B2,c06,64,128,32,4,3,8,0.0,0.0,342.4700051546097,371.99919670820236,3.135287201328053,6,-1,-1,onekey:32x4096x2048,0,"onekey_rep_shape=32x4096x2048;path_reordered,ASCEND_HOME_PATH_set,ASCEND_TOOLKIT_HOME_set"
2026-03-03T08:27:28.131142+00:00,ONEKEY,llm_style,eval,llm_style_eval_048,16,1024,6144,fp16,Ascend910B2,c06,64,128,32,4,3,8,0.0,0.0,244.10999566316605,260.91538935899734,0.8247371905155392,7,-1,-1,onekey:32x4096x2048,0,"onekey_rep_shape=32x4096x2048;path_reordered,ASCEND_HOME_PATH_set,ASCEND_TOOLKIT_HOME_set"
2026-03-03T08:27:28.432347+00:00,ONEKEY,llm_style,eval,llm_style_eval_049,16,8192,1536,fp16,Ascend910B2,c06,64,128,32,4,3,8,0.0,0.0,238.84999752044678,300.66579312086105,1.685799406238348,5,-1,-1,onekey:32x4096x2048,0,"onekey_rep_shape=32x4096x2048;path_reordered,ASCEND_HOME_PATH_set,ASCEND_TOOLKIT_HOME_set"
2026-03-03T08:27:28.463718+00:00,ONEKEY,llm_style,eval,llm_style_eval_050,1,1024,1024,fp16,Ascend910B2,c06,64,128,32,4,3,8,0.0,0.0,253.63999605178833,279.43219900131226,0.008268222806515905,7,-1,-1,onekey:32x4096x2048,0,"onekey_rep_shape=32x4096x2048;path_reordered,ASCEND_HOME_PATH_set,ASCEND_TOOLKIT_HOME_set"
2026-03-03T08:27:28.624597+00:00,ONEKEY,llm_style,eval,llm_style_eval_051,16,6144,1024,fp16,Ascend910B2,c06,64,128,32,4,3,8,0.0,0.0,244.41999942064285,269.67501133680344,0.8236911565224259,5,-1,-1,onekey:32x4096x2048,0,"onekey_rep_shape=32x4096x2048;path_reordered,ASCEND_HOME_PATH_set,ASCEND_TOOLKIT_HOME_set"
2026-03-03T08:27:30.230270+00:00,ONEKEY,llm_style,eval,llm_style_eval_052,16,8192,8192,fp16,Ascend910B2,c06,64,128,32,4,3,8,0.0,0.0,413.99000585079193,444.0317904949188,5.187283793449798,4,-1,-1,onekey:32x4096x2048,0,"onekey_rep_shape=32x4096x2048;path_reordered,ASCEND_HOME_PATH_set,ASCEND_TOOLKIT_HOME_set"
2026-03-03T08:27:31.437919+00:00,ONEKEY,llm_style,eval,llm_style_eval_053,1,6144,8192,fp16,Ascend910B2,c06,64,128,32,4,3,8,0.0,0.0,332.49999582767487,436.09760880470276,0.3027467586861892,4,-1,-1,onekey:32x4096x2048,0,"onekey_rep_shape=32x4096x2048;path_reordered,ASCEND_HOME_PATH_set,ASCEND_TOOLKIT_HOME_set"
2026-03-03T08:27:31.756421+00:00,ONEKEY,llm_style,eval,llm_style_eval_054,64,4096,3072,fp16,Ascend910B2,c06,64,128,32,4,3,8,0.0,0.0,263.36000859737396,286.3638037443161,6.115631392093065,3,-1,-1,onekey:32x4096x2048,0,"onekey_rep_shape=32x4096x2048;path_reordered,ASCEND_HOME_PATH_set,ASCEND_TOOLKIT_HOME_set"
2026-03-03T08:27:31.966382+00:00,ONEKEY,llm_style,eval,llm_style_eval_055,4,8192,1024,fp16,Ascend910B2,c06,64,128,32,4,3,8,0.0,0.0,242.49999970197678,251.58260717988014,0.2767375838452546,5,-1,-1,onekey:32x4096x2048,0,"onekey_rep_shape=32x4096x2048;path_reordered,ASCEND_HOME_PATH_set,ASCEND_TOOLKIT_HOME_set"
2026-03-03T08:27:32.055002+00:00,ONEKEY,llm_style,eval,llm_style_eval_056,64,1024,3072,fp16,Ascend910B2,c06,64,128,32,4,3,8,0.0,0.0,242.96999722719193,268.52759927511215,1.6572136008360507,3,-1,-1,onekey:32x4096x2048,0,"onekey_rep_shape=32x4096x2048;path_reordered,ASCEND_HOME_PATH_set,ASCEND_TOOLKIT_HOME_set"
2026-03-03T08:27:32.059932+00:00,ONEKEY,llm_style,eval,llm_style_eval_057,64,1024,3072,fp16,Ascend910B2,c06,64,128,32,4,3,8,0.0,0.0,243.04000288248062,258.303195387125,1.6567362542153137,3,-1,-1,onekey:32x4096x2048,0,"onekey_rep_shape=32x4096x2048;path_reordered,ASCEND_HOME_PATH_set,ASCEND_TOOLKIT_HOME_set"
2026-03-03T08:27:32.288596+00:00,ONEKEY,llm_style,eval,llm_style_eval_058,32,2048,4096,fp16,Ascend910B2,c06,64,128,32,4,3,8,0.0,0.0,248.5799938440323,254.37360763549805,2.1597510873576233,3,-1,-1,onekey:32x4096x2048,0,"onekey_rep_shape=32x4096x2048;path_reordered,ASCEND_HOME_PATH_set,ASCEND_TOOLKIT_HOME_set"
2026-03-03T08:27:32.711240+00:00,ONEKEY,llm_style,eval,llm_style_eval_059,64,8192,2048,fp16,Ascend910B2,c06,64,128,32,4,3,8,0.0,0.0,260.1500004529953,286.5318074822426,8.254790099022175,1,-1,-1,onekey:32x4096x2048,0,"onekey_rep_shape=32x4096x2048;path_reordered,ASCEND_HOME_PATH_set,ASCEND_TOOLKIT_HOME_set"
2026-03-03T08:27:33.177413+00:00,ONEKEY,llm_style,eval,llm_style_eval_060,1,3072,6144,fp16,Ascend910B2,c06,64,128,32,4,3,8,0.0,0.0,239.79000002145767,246.1151984333992,0.15742414611377475,7,-1,-1,onekey:32x4096x2048,0,"onekey_rep_shape=32x4096x2048;path_reordered,ASCEND_HOME_PATH_set,ASCEND_TOOLKIT_HOME_set"
2026-03-03T08:27:33.344999+00:00,ONEKEY,llm_style,eval,llm_style_eval_061,64,1536,4096,fp16,Ascend910B2,c06,64,128,32,4,3,8,0.0,0.0,239.14999514818192,246.66000545024872,3.367369367919145,3,-1,-1,onekey:32x4096x2048,0,"onekey_rep_shape=32x4096x2048;path_reordered,ASCEND_HOME_PATH_set,ASCEND_TOOLKIT_HOME_set"
2026-03-03T08:27:33.657614+00:00,ONEKEY,llm_style,eval,llm_style_eval_062,16,6144,2048,fp16,Ascend910B2,c06,64,128,32,4,3,8,0.0,0.0,241.99000000953674,269.04939591884613,1.6639248893926673,5,-1,-1,onekey:32x4096x2048,0,"onekey_rep_shape=32x4096x2048;path_reordered,ASCEND_HOME_PATH_set,ASCEND_TOOLKIT_HOME_set"
2026-03-03T08:27:33.904207+00:00,ONEKEY,llm_style,eval,llm_style_eval_063,64,1536,6144,fp16,Ascend910B2,c06,64,128,32,4,3,8,0.0,0.0,238.2800057530403,242.37819343805313,5.069496066958975,3,-1,-1,onekey:32x4096x2048,0,"onekey_rep_shape=32x4096x2048;path_reordered,ASCEND_HOME_PATH_set,ASCEND_TOOLKIT_HOME_set"
