results/B2_sweep_a01_k4.csv
timestamp,method,workload,split,shape_id,M,N,K,dtype,gpu,config_id,BLOCK_M,BLOCK_N,BLOCK_K,num_warps,num_stages,GROUP_M,compile_time_ms,tune_time_ms,runtime_cost_us,p99_us,runtime_perf_tflops,bucket_m,bucket_n,bucket_k,cache_key,invalid_config,notes
2026-03-02T09:31:03.636281+00:00,B2,uniform,tune,uniform_tune_000,1536,512,1024,bf16,NVIDIA GeForce RTX 4060,c07,128,128,32,8,3,8,174.18974405154586,2668.232,87.0399996638298,202.71967709064484,18.504282424409332,3,2,3,4_3_3_r2,0,
2026-03-02T09:31:05.162012+00:00,B2,uniform,tune,uniform_tune_001,1536,1536,2048,bf16,NVIDIA GeForce RTX 4060,c11,32,128,32,4,2,8,0.0,1525.677,330.23999631404877,445.1062446832656,29.26258637312399,3,3,3,4_4_4_r1,0,
2026-03-02T09:31:05.660789+00:00,B2,uniform,tune,uniform_tune_002,384,2048,1536,bf16,NVIDIA GeForce RTX 4060,c09,128,64,64,8,3,8,0.0,498.722,103.42399775981903,121.18976168334481,23.359366842601418,2,3,3,3_4_4_r0,0,
2026-03-02T09:31:05.749127+00:00,B2,uniform,tune,uniform_tune_003,1536,64,3072,bf16,NVIDIA GeForce RTX 4060,c04,64,64,64,4,3,8,0.0,88.289,54.016001522541046,67.91423924267292,11.181497315160533,3,1,3,4_1_4_r2,0,anchor_skipped
2026-03-02T09:31:05.860412+00:00,B2,uniform,tune,uniform_tune_004,768,128,2048,bf16,NVIDIA GeForce RTX 4060,c04,64,64,64,4,3,8,0.0,111.233,43.3920007199049,52.70400058478117,9.279433474366021,3,1,3,3_2_4_r2,0,
2026-03-02T09:31:05.876618+00:00,B2,uniform,tune,uniform_tune_005,512,128,4096,bf16,NVIDIA GeForce RTX 4060,c04,64,64,64,4,3,8,0.0,0.0,79.3599970638752,136.45824149250979,6.765006701901512,2,1,3,3_2_4_r2,0,
2026-03-02T09:31:06.769680+00:00,B2,uniform,tune,uniform_tune_006,2048,1024,4096,bf16,NVIDIA GeForce RTX 4060,c04,64,64,64,4,3,8,0.0,893.001,571.3919997215271,637.4864178895949,30.06669535515506,3,3,3,4_3_4_r2,0,
2026-03-02T09:31:06.853975+00:00,B2,uniform,tune,uniform_tune_007,128,768,512,bf16,NVIDIA GeForce RTX 4060,c04,64,64,64,4,3,8,0.0,84.246,35.840000957250595,326.3775976002209,2.808685639268526,1,3,2,2_3_3_r0,0,
2026-03-02T09:31:06.899694+00:00,B2,uniform,tune,uniform_tune_008,2048,256,64,bf16,NVIDIA GeForce RTX 4060,c03,64,64,32,4,2,8,0.0,45.674,31.74399957060814,41.094719842076294,2.1140645447253688,3,2,1,4_2_1_r2,0,anchor_skipped
2026-03-02T09:31:07.024495+00:00,B2,uniform,tune,uniform_tune_009,192,768,2048,bf16,NVIDIA GeForce RTX 4060,c11,32,128,32,4,2,8,0.0,124.75,52.60800011456013,60.24831850081682,11.480759099086884,2,3,3,2_3_4_r0,0,
2026-03-02T09:31:07.275764+00:00,B2,uniform,tune,uniform_tune_010,1024,1024,1536,bf16,NVIDIA GeForce RTX 4060,c07,128,128,32,8,3,8,0.0,251.216,138.2399946451187,158.32063764333722,23.30168979150595,3,3,3,3_3_4_r1,0,
2026-03-02T09:31:07.352339+00:00,B2,uniform,tune,uniform_tune_011,256,384,768,bf16,NVIDIA GeForce RTX 4060,c04,64,64,64,4,3,8,0.0,76.519,34.81600061058998,42.00447931885719,4.336941100410938,2,2,3,2_3_3_r1,0,
2026-03-02T09:31:07.438553+00:00,B2,uniform,tune,uniform_tune_012,64,192,2048,bf16,NVIDIA GeForce RTX 4060,c04,64,64,64,4,3,8,0.0,86.171,45.05600035190582,106.42592027783388,1.1170909003659715,1,2,3,1_2_4_r0,0,
2026-03-02T09:31:07.495666+00:00,B2,uniform,tune,uniform_tune_013,192,128,512,bf16,NVIDIA GeForce RTX 4060,c04,64,64,64,4,3,8,0.0,57.078,30.767999589443207,39.43423844873905,0.8179220077939234,2,1,2,2_2_3_r1,0,
2026-03-02T09:31:07.500128+00:00,B2,uniform,tune,uniform_tune_014,128,128,1024,bf16,NVIDIA GeForce RTX 4060,c04,64,64,64,4,3,8,0.0,0.0,33.7119996547699,50.43359920382497,0.9953260661965034,1,1,3,2_2_3_r1,0,
2026-03-02T09:31:08.233296+00:00,B2,uniform,tune,uniform_tune_015,3072,3072,768,bf16,NVIDIA GeForce RTX 4060,c05,128,64,32,4,3,8,0.0,733.132,499.60000813007355,608.6515200138092,29.014240168358874,3,3,3,4_4_3_r1,0,
2026-03-02T09:31:08.354846+00:00,B2,uniform,tune,uniform_tune_016,256,128,3072,bf16,NVIDIA GeForce RTX 4060,c00,32,32,32,2,2,8,0.0,121.502,35.80800071358681,142.3894393444061,5.622391308867732,2,1,3,2_2_4_r2,0,
2026-03-02T09:31:08.396201+00:00,B2,uniform,tune,uniform_tune_017,96,1024,192,bf16,NVIDIA GeForce RTX 4060,c00,32,32,32,2,2,8,0.0,41.316,28.831999748945236,178.44224415719484,1.3092652722217426,1,3,2,2_3_2_r0,0,anchor_skipped
2026-03-02T09:31:08.443736+00:00,B2,uniform,tune,uniform_tune_018,64,64,192,bf16,NVIDIA GeForce RTX 4060,c04,64,64,64,4,3,8,0.0,47.5,27.68000029027462,34.13472097367048,0.05682312079139054,1,1,2,1_1_2_r1,0,
2026-03-02T09:31:08.482347+00:00,B2,uniform,tune,uniform_tune_019,4096,64,64,bf16,NVIDIA GeForce RTX 4060,c01,64,32,32,2,2,8,0.0,38.584,26.623999699950218,39.82591953128576,1.2603077065112325,3,1,1,4_1_1_r2,0,anchor_skipped
2026-03-02T09:31:08.673258+00:00,B2,uniform,tune,uniform_tune_020,128,4096,3072,bf16,NVIDIA GeForce RTX 4060,c06,64,128,32,4,3,8,0.0,190.876,137.2160017490387,143.34783613681793,23.47558179031818,1,3,3,2_4_4_r0,0,anchor_skipped
2026-03-02T09:31:08.713944+00:00,B2,uniform,tune,uniform_tune_021,192,2048,3072,bf16,NVIDIA GeForce RTX 4060,c06,64,128,32,4,3,8,0.0,0.0,98.84800016880035,177.93920382857317,24.440748420548648,2,3,3,2_4_4_r0,0,
2026-03-02T09:31:08.766975+00:00,B2,uniform,tune,uniform_tune_022,1536,2048,2048,bf16,NVIDIA GeForce RTX 4060,c11,32,128,32,4,2,8,0.0,0.0,425.9840101003647,554.1900902986524,30.247383898198972,3,3,3,4_4_4_r1,0,
2026-03-02T09:31:08.776518+00:00,B2,uniform,tune,uniform_tune_023,256,1024,1024,bf16,NVIDIA GeForce RTX 4060,c04,64,64,64,4,3,8,0.0,0.0,47.15200141072273,130.10943934321404,11.385962333253394,2,3,3,2_3_3_r0,0,
2026-03-02T09:31:08.841671+00:00,B2,uniform,tune,uniform_tune_024,768,128,384,bf16,NVIDIA GeForce RTX 4060,c00,32,32,32,2,2,8,0.0,65.12,29.5200003311038,39.84191972762346,2.557502410338795,3,1,2,3_2_3_r2,0,
2026-03-02T09:31:08.898576+00:00,B2,uniform,tune,uniform_tune_025,256,96,384,bf16,NVIDIA GeForce RTX 4060,c00,32,32,32,2,2,8,0.0,56.87,29.69600073993206,45.081280246376984,0.6355861910597185,2,1,2,2_2_3_r2,0,
2026-03-02T09:31:08.914847+00:00,B2,uniform,tune,uniform_tune_026,96,1024,3072,bf16,NVIDIA GeForce RTX 4060,c11,32,128,32,4,2,8,0.0,0.0,73.53600114583969,113.77663731575001,8.213388905961338,1,3,3,2_3_4_r0,0,
2026-03-02T09:31:08.961483+00:00,B2,uniform,tune,uniform_tune_027,1536,512,4096,bf16,NVIDIA GeForce RTX 4060,c04,64,64,64,4,3,8,0.0,0.0,223.95199537277222,316.66175544261927,28.7671066885402,3,2,3,4_3_4_r2,0,
2026-03-02T09:31:09.016301+00:00,B2,uniform,tune,uniform_tune_028,128,64,192,bf16,NVIDIA GeForce RTX 4060,c04,64,64,64,4,3,8,0.0,54.759,28.672000393271446,39.43840015679597,0.1097142842094205,1,1,2,2_1_2_r2,0,
2026-03-02T09:31:09.099693+00:00,B2,uniform,tune,uniform_tune_029,192,256,1536,bf16,NVIDIA GeForce RTX 4060,c04,64,64,64,4,3,8,0.0,83.352,39.93599861860275,53.268800638616064,3.780923207706253,2,2,3,2_2_4_r1,0,
2026-03-02T09:31:09.167565+00:00,B2,uniform,tune,uniform_tune_030,4096,64,3072,bf16,NVIDIA GeForce RTX 4060,c04,64,64,64,4,3,8,0.0,0.0,88.95999938249588,162.35519915819168,18.104909478190827,3,1,3,4_1_4_r2,0,
2026-03-02T09:31:09.232435+00:00,B2,uniform,tune,uniform_tune_031,384,128,96,bf16,NVIDIA GeForce RTX 4060,c11,32,128,32,4,2,8,0.0,64.81,29.69600073993206,39.981760345399366,0.31779309552985924,2,1,1,3_2_2_r2,0,
2026-03-02T09:31:09.366138+00:00,B2,uniform,eval,uniform_eval_000,512,4096,768,bf16,NVIDIA GeForce RTX 4060,c06,64,128,32,4,3,8,0.0,133.179,126.96000188589096,148.78719806671137,25.37197088965997,2,3,3,3_4_3_r0,0,anchor_skipped
2026-03-02T09:31:09.426976+00:00,B2,uniform,eval,uniform_eval_001,384,512,64,bf16,NVIDIA GeForce RTX 4060,c05,128,64,32,4,3,8,0.0,60.795,28.528000228106976,38.05568028241394,0.8821446928903759,2,2,1,3_3_1_r1,0,
2026-03-02T09:31:09.491780+00:00,B2,uniform,eval,uniform_eval_002,256,4096,384,bf16,NVIDIA GeForce RTX 4060,c03,64,64,32,4,2,8,0.0,64.766,55.26399984955788,61.24383848160504,14.571988458892605,2,3,2,2_4_3_r0,0,anchor_skipped
2026-03-02T09:31:09.588267+00:00,B2,uniform,eval,uniform_eval_003,384,768,512,bf16,NVIDIA GeForce RTX 4060,c06,64,128,32,4,3,8,0.0,96.443,40.95999896526337,53.39136127382514,7.372800186252599,2,3,2,3_3_3_r0,0,
2026-03-02T09:31:09.651065+00:00,B2,uniform,eval,uniform_eval_004,768,1024,96,bf16,NVIDIA GeForce RTX 4060,c06,64,128,32,4,3,8,0.0,62.751,34.81600061058998,69.41792134195556,4.336941100410938,3,3,1,3_3_2_r1,0,
2026-03-02T09:31:09.848647+00:00,B2,uniform,eval,uniform_eval_005,3072,3072,128,bf16,NVIDIA GeForce RTX 4060,c11,32,128,32,4,2,8,0.0,197.541,111.61600053310394,119.14816193282604,21.64491732781151,3,3,1,4_4_2_r1,0,
2026-03-02T09:31:09.858978+00:00,B2,uniform,eval,uniform_eval_006,256,96,512,bf16,NVIDIA GeForce RTX 4060,c00,32,32,32,2,2,8,0.0,0.0,33.79200026392937,460.73184549808434,0.7447272669106476,2,1,2,2_2_3_r2,0,
2026-03-02T09:31:10.293366+00:00,B2,uniform,eval,uniform_eval_007,4096,4096,4096,bf16,NVIDIA GeForce RTX 4060,c11,32,128,32,4,2,8,0.0,0.0,4774.399995803833,4912.765264511108,28.786644100367287,3,3,3,4_4_4_r1,0,
2026-03-02T09:31:10.353263+00:00,B2,uniform,eval,uniform_eval_008,128,96,64,bf16,NVIDIA GeForce RTX 4060,c08,128,128,64,8,4,8,0.0,59.842,35.840000957250595,80.43872050940988,0.04388571311357072,1,1,1,2_2_1_r1,0,
2026-03-02T09:31:10.421106+00:00,B2,uniform,eval,uniform_eval_009,3072,384,96,bf16,NVIDIA GeForce RTX 4060,c11,32,128,32,4,2,8,0.0,67.806,37.88800165057182,47.152961418032646,5.977945685519724,3,2,1,4_3_2_r2,0,anchor_skipped
2026-03-02T09:31:10.443147+00:00,B2,uniform,eval,uniform_eval_010,768,768,2048,bf16,NVIDIA GeForce RTX 4060,c07,128,128,32,8,3,8,0.0,0.0,127.42400169372559,167.1903976798057,18.95968633764043,3,3,3,3_3_4_r1,0,
2026-03-02T09:31:10.506353+00:00,B2,uniform,eval,uniform_eval_011,4096,96,512,bf16,NVIDIA GeForce RTX 4060,c01,64,32,32,2,2,8,0.0,63.167,46.751998364925385,116.84864215552794,8.612534182112766,3,1,2,4_2_3_r2,0,anchor_skipped
2026-03-02T09:31:10.511959+00:00,B2,uniform,eval,uniform_eval_012,384,384,256,bf16,NVIDIA GeForce RTX 4060,c06,64,128,32,4,3,8,0.0,0.0,30.719999223947525,93.00511799752707,2.4576000620842,2,2,2,3_3_2_r1,0,
2026-03-02T09:31:11.204587+00:00,B2,uniform,eval,uniform_eval_013,4096,2048,768,bf16,NVIDIA GeForce RTX 4060,c03,64,64,32,4,2,8,0.0,692.591,450.5600035190582,515.6700605154037,28.597527049368868,3,3,3,4_4_3_r2,0,
2026-03-02T09:31:11.227356+00:00,B2,uniform,eval,uniform_eval_014,192,384,3072,bf16,NVIDIA GeForce RTX 4060,c11,32,128,32,4,2,8,0.0,0.0,84.79999750852585,116.14208191633216,5.341802421096258,2,2,3,2_3_4_r0,0,
2026-03-02T09:31:11.239021+00:00,B2,uniform,eval,uniform_eval_015,128,96,4096,bf16,NVIDIA GeForce RTX 4060,c04,64,64,64,4,3,8,0.0,0.0,84.06399935483932,144.65824082493776,1.1974602299742367,1,1,3,2_2_4_r1,0,
2026-03-02T09:31:11.359412+00:00,B2,uniform,eval,uniform_eval_016,64,4096,2048,bf16,NVIDIA GeForce RTX 4060,c04,64,64,64,4,3,8,0.0,120.351,65.5680000782013,73.67104187607765,16.376003884812334,1,3,3,1_4_4_r0,0,anchor_skipped
2026-03-02T09:31:11.369319+00:00,B2,uniform,eval,uniform_eval_017,96,128,3072,bf16,NVIDIA GeForce RTX 4060,c04,64,64,64,4,3,8,0.0,0.0,60.416001826524734,252.90752291679343,1.249627080864758,1,1,3,2_2_4_r1,0,
2026-03-02T09:31:11.379705+00:00,B2,uniform,eval,uniform_eval_018,512,768,64,bf16,NVIDIA GeForce RTX 4060,c05,128,64,32,4,3,8,0.0,0.0,37.88800165057182,120.98784387111652,1.3284323745599385,2,3,1,3_3_1_r1,0,
2026-03-02T09:31:11.443327+00:00,B2,uniform,eval,uniform_eval_019,64,128,384,bf16,NVIDIA GeForce RTX 4060,c04,64,64,64,4,3,8,0.0,63.593,32.6399989426136,41.502719148993485,0.1927529474207826,1,1,2,1_2_3_r0,0,
2026-03-02T09:31:11.447287+00:00,B2,uniform,eval,uniform_eval_020,512,512,96,bf16,NVIDIA GeForce RTX 4060,c06,64,128,32,4,3,8,0.0,0.0,29.69600073993206,53.26560113579034,1.6948965094925827,2,2,1,3_3_2_r1,0,
2026-03-02T09:31:11.469712+00:00,B2,uniform,eval,uniform_eval_021,256,3072,1536,bf16,NVIDIA GeForce RTX 4060,c06,64,128,32,4,3,8,0.0,0.0,104.44799810647964,142.03648231923574,23.130353360502784,2,3,3,2_4_4_r0,0,
2026-03-02T09:31:11.476918+00:00,B2,uniform,eval,uniform_eval_022,2048,96,512,bf16,NVIDIA GeForce RTX 4060,c01,64,32,32,2,2,8,0.0,0.0,33.63199904561043,85.77279813587657,5.986161920585468,3,1,2,4_2_3_r2,0,
2026-03-02T09:31:11.506120+00:00,B2,uniform,eval,uniform_eval_023,1536,512,3072,bf16,NVIDIA GeForce RTX 4060,c04,64,64,64,4,3,8,0.0,0.0,172.03199863433838,250.84927916526786,28.086857365822308,3,2,3,4_3_4_r2,0,
2026-03-02T09:31:11.509787+00:00,B2,uniform,eval,uniform_eval_024,128,192,64,bf16,NVIDIA GeForce RTX 4060,c08,128,128,64,8,4,8,0.0,0.0,36.86400130391121,58.70592121034859,0.08533333031502047,1,2,1,2_2_1_r1,0,
2026-03-02T09:31:11.516302+00:00,B2,uniform,eval,uniform_eval_025,1536,96,384,bf16,NVIDIA GeForce RTX 4060,c01,64,32,32,2,2,8,0.0,0.0,36.43199987709522,76.74016024917351,3.108426887956756,3,1,2,4_2_3_r2,0,
2026-03-02T09:31:11.616887+00:00,B2,uniform,eval,uniform_eval_026,1536,2048,64,bf16,NVIDIA GeForce RTX 4060,c02,32,64,32,2,2,8,0.0,100.544,45.77599838376045,93.15136104822157,8.796163889739338,3,3,1,4_4_1_r1,0,
2026-03-02T09:31:11.624782+00:00,B2,uniform,eval,uniform_eval_027,256,1024,96,bf16,NVIDIA GeForce RTX 4060,c00,32,32,32,2,2,8,0.0,0.0,32.48000144958496,154.23775747418392,1.5496196352738512,2,3,1,2_3_2_r0,0,
2026-03-02T09:31:11.629047+00:00,B2,uniform,eval,uniform_eval_028,2048,256,64,bf16,NVIDIA GeForce RTX 4060,c03,64,64,32,4,2,8,0.0,0.0,33.12000073492527,50.10239947587251,2.026233771463454,3,2,1,4_2_1_r2,0,
2026-03-02T09:31:11.633170+00:00,B2,uniform,eval,uniform_eval_029,192,768,192,bf16,NVIDIA GeForce RTX 4060,c00,32,32,32,2,2,8,0.0,0.0,32.75199979543686,48.56480069458484,1.7288441729866204,2,3,2,2_3_2_r0,0,
2026-03-02T09:31:11.687883+00:00,B2,uniform,eval,uniform_eval_030,1024,2048,3072,bf16,NVIDIA GeForce RTX 4060,c09,128,64,64,8,3,8,0.0,0.0,425.9839951992035,497.0931270718572,30.247384956269578,3,3,3,3_4_4_r0,0,
2026-03-02T09:31:11.866441+00:00,B2,uniform,eval,uniform_eval_031,1536,1024,512,bf16,NVIDIA GeForce RTX 4060,c04,64,64,64,4,3,8,0.0,178.49,80.89599758386612,146.92096062004555,19.90967148072132,3,3,2,4_3_3_r1,0,
2026-03-02T09:31:11.968726+00:00,B2,uniform,eval,uniform_eval_032,512,768,768,bf16,NVIDIA GeForce RTX 4060,c05,128,64,32,4,3,8,0.0,102.238,49.1040013730526,61.37471932917832,12.30001138627072,2,3,3,3_3_3_r1,0,
2026-03-02T09:31:12.050931+00:00,B2,uniform,eval,uniform_eval_033,64,512,4096,bf16,NVIDIA GeForce RTX 4060,c04,64,64,64,4,3,8,0.0,82.162,56.32000043988228,66.3631983846426,4.766254508228145,1,2,3,1_3_4_r0,0,anchor_skipped
2026-03-02T09:31:12.060120+00:00,B2,uniform,eval,uniform_eval_034,1024,256,512,bf16,NVIDIA GeForce RTX 4060,c00,32,32,32,2,2,8,0.0,0.0,68.60800087451935,196.11711695790274,3.9125969650530297,3,2,2,3_2_3_r2,0,
2026-03-02T09:31:12.067489+00:00,B2,uniform,eval,uniform_eval_035,1024,768,96,bf16,NVIDIA GeForce RTX 4060,c06,64,128,32,4,3,8,0.0,0.0,61.39199994504452,122.27360308170319,2.4595215033744493,3,3,1,3_3_2_r1,0,
2026-03-02T09:31:12.127339+00:00,B2,uniform,eval,uniform_eval_036,768,64,1536,bf16,NVIDIA GeForce RTX 4060,c04,64,64,64,4,3,8,0.0,59.824,44.943999499082565,118.38719964027385,3.359624102947986,3,1,3,3_1_4_r2,0,anchor_skipped
2026-03-02T09:31:12.133772+00:00,B2,uniform,eval,uniform_eval_037,512,256,512,bf16,NVIDIA GeForce RTX 4060,c00,32,32,32,2,2,8,0.0,0.0,34.671999514102936,53.61760009080171,3.8710697358370276,2,2,2,3_2_3_r2,0,
2026-03-02T09:31:12.174111+00:00,B2,uniform,eval,uniform_eval_038,64,1024,64,bf16,NVIDIA GeForce RTX 4060,c04,64,64,64,4,3,8,0.0,40.288,28.672000393271446,148.4713616222142,0.29257142455845464,1,3,1,1_3_1_r0,0,anchor_skipped
2026-03-02T09:31:12.183724+00:00,B2,uniform,eval,uniform_eval_039,512,128,2048,bf16,NVIDIA GeForce RTX 4060,c04,64,64,64,4,3,8,0.0,0.0,43.007999658584595,129.02399897575378,6.241523859071624,2,1,3,3_2_4_r2,0,
2026-03-02T09:31:12.190897+00:00,B2,uniform,eval,uniform_eval_040,4096,768,96,bf16,NVIDIA GeForce RTX 4060,c11,32,128,32,4,2,8,0.0,0.0,52.22399905323982,88.18816050887106,11.565176680251392,3,3,1,4_3_2_r2,0,
2026-03-02T09:31:12.195860+00:00,B2,uniform,eval,uniform_eval_041,4096,192,64,bf16,NVIDIA GeForce RTX 4060,c03,64,64,32,4,2,8,0.0,0.0,33.79200026392937,65.19456028938292,2.9789090676425904,3,2,1,4_2_1_r2,0,
2026-03-02T09:31:12.237571+00:00,B2,uniform,eval,uniform_eval_042,96,1536,128,bf16,NVIDIA GeForce RTX 4060,c11,32,128,32,4,2,8,0.0,41.69,30.7839997112751,43.9897595345974,1.2262453337463475,1,3,1,2_4_2_r0,0,anchor_skipped
2026-03-02T09:31:12.251295+00:00,B2,uniform,eval,uniform_eval_043,192,2048,192,bf16,NVIDIA GeForce RTX 4060,c11,32,128,32,4,2,8,0.0,0.0,37.80800104141235,106.49599879980087,3.99372989422557,2,3,2,2_4_2_r0,0,
2026-03-02T09:31:12.337876+00:00,B2,uniform,eval,uniform_eval_044,384,4096,3072,bf16,NVIDIA GeForce RTX 4060,c09,128,64,64,8,3,8,0.0,0.0,319.12000477313995,348.82655709981907,30.282264575891556,2,3,3,3_4_4_r0,0,
2026-03-02T09:31:12.353970+00:00,B2,uniform,eval,uniform_eval_045,4096,96,768,bf16,NVIDIA GeForce RTX 4060,c01,64,32,32,2,2,8,0.0,0.0,54.30399999022484,159.72191765904427,11.12219681991605,3,1,3,4_2_3_r2,0,
2026-03-02T09:31:12.360797+00:00,B2,uniform,eval,uniform_eval_046,96,96,1536,bf16,NVIDIA GeForce RTX 4060,c04,64,64,64,4,3,8,0.0,0.0,43.376000598073006,187.95744284987444,0.6527008393959159,1,1,3,2_2_4_r1,0,
2026-03-02T09:31:12.417037+00:00,B2,uniform,eval,uniform_eval_047,2048,512,4096,bf16,NVIDIA GeForce RTX 4060,c04,64,64,64,4,3,8,0.0,0.0,290.6239926815033,363.70591491460783,29.556866632872133,3,2,3,4_3_4_r2,0,
2026-03-02T09:31:12.479758+00:00,B2,uniform,eval,uniform_eval_048,96,256,768,bf16,NVIDIA GeForce RTX 4060,c04,64,64,64,4,3,8,0.0,62.662,33.79200026392937,42.468160726129994,1.1170909003659715,1,2,3,2_2_3_r0,0,
2026-03-02T09:31:12.519721+00:00,B2,uniform,eval,uniform_eval_049,64,768,384,bf16,NVIDIA GeForce RTX 4060,c04,64,64,64,4,3,8,0.0,39.928,29.69600073993206,48.1654384359717,1.271172382119437,1,3,2,1_3_3_r0,0,anchor_skipped
2026-03-02T09:31:12.524370+00:00,B2,uniform,eval,uniform_eval_050,128,1024,96,bf16,NVIDIA GeForce RTX 4060,c00,32,32,32,2,2,8,0.0,0.0,28.44800055027008,77.72224277257918,0.8846254047109501,1,3,1,2_3_2_r0,0,
2026-03-02T09:31:12.531502+00:00,B2,uniform,eval,uniform_eval_051,384,768,768,bf16,NVIDIA GeForce RTX 4060,c06,64,128,32,4,3,8,0.0,0.0,42.81600005924702,58.759680315852165,10.579802675943064,2,3,3,3_3_3_r0,0,
2026-03-02T09:31:12.548976+00:00,B2,uniform,eval,uniform_eval_052,768,64,4096,bf16,NVIDIA GeForce RTX 4060,c04,64,64,64,4,3,8,0.0,0.0,71.98400050401688,154.59743604063988,5.59364832713807,3,1,3,3_1_4_r2,0,
2026-03-02T09:31:12.556010+00:00,B2,uniform,eval,uniform_eval_053,384,96,512,bf16,NVIDIA GeForce RTX 4060,c00,32,32,32,2,2,8,0.0,0.0,56.2559999525547,153.22239592671392,0.6710170654123401,2,1,2,3_2_3_r2,0,
2026-03-02T09:31:12.564719+00:00,B2,uniform,eval,uniform_eval_054,768,192,768,bf16,NVIDIA GeForce RTX 4060,c00,32,32,32,2,2,8,0.0,0.0,62.12799996137619,106.05920173227784,3.6455771333506,3,2,3,3_2_3_r2,0,
2026-03-02T09:31:12.575613+00:00,B2,uniform,eval,uniform_eval_055,512,2048,512,bf16,NVIDIA GeForce RTX 4060,c06,64,128,32,4,3,8,0.0,0.0,70.49600034952164,125.312957689166,15.231244590847004,2,3,2,3_4_3_r0,0,
2026-03-02T09:31:12.581568+00:00,B2,uniform,eval,uniform_eval_056,384,512,512,bf16,NVIDIA GeForce RTX 4060,c05,128,64,32,4,3,8,0.0,0.0,40.95999896526337,50.01792088150978,4.9152001241684,2,2,2,3_3_3_r1,0,
2026-03-02T09:31:12.591364+00:00,B2,uniform,eval,uniform_eval_057,2048,512,512,bf16,NVIDIA GeForce RTX 4060,c07,128,128,32,8,3,8,0.0,0.0,68.60800087451935,80.84895722568035,15.650387860212119,3,2,2,4_3_3_r2,0,
2026-03-02T09:31:12.808972+00:00,B2,uniform,eval,uniform_eval_058,1024,512,2048,bf16,NVIDIA GeForce RTX 4060,c04,64,64,64,4,3,8,0.0,217.574,102.39999741315842,112.09120035171509,20.971520529785167,3,2,3,3_3_4_r2,0,
2026-03-02T09:31:12.855734+00:00,B2,uniform,eval,uniform_eval_059,2048,64,4096,bf16,NVIDIA GeForce RTX 4060,c04,64,64,64,4,3,8,0.0,0.0,86.5119993686676,222.91520848870263,12.411478544430468,3,1,3,4_1_4_r2,0,
2026-03-02T09:31:12.912025+00:00,B2,uniform,eval,uniform_eval_060,64,1536,1024,bf16,NVIDIA GeForce RTX 4060,c04,64,64,64,4,3,8,0.0,56.213,35.840000957250595,52.370880283415275,5.617371278537052,1,3,3,1_4_3_r0,0,anchor_skipped
2026-03-02T09:31:12.931192+00:00,B2,uniform,eval,uniform_eval_061,768,1024,1536,bf16,NVIDIA GeForce RTX 4060,c07,128,128,32,8,3,8,0.0,0.0,108.5439994931221,243.7299251556396,22.2575095379002,3,3,3,3_3_4_r1,0,
2026-03-02T09:31:13.023425+00:00,B2,uniform,eval,uniform_eval_062,384,2048,192,bf16,NVIDIA GeForce RTX 4060,c04,64,64,64,4,3,8,0.0,92.187,40.95999896526337,56.08640033751726,7.372800186252599,2,3,2,3_4_2_r0,0,
2026-03-02T09:31:13.030190+00:00,B2,uniform,eval,uniform_eval_063,256,2048,192,bf16,NVIDIA GeForce RTX 4060,c11,32,128,32,4,2,8,0.0,0.0,41.360000148415565,109.8137597739696,4.867664199167381,2,3,2,2_4_2_r0,0,
2026-03-02T09:31:15.077557+00:00,B2,llm_style,tune,llm_style_tune_000,8,4096,1024,bf16,NVIDIA GeForce RTX 4060,c00,32,32,32,2,2,8,0.0,2046.688,40.84799997508526,49.88991990685463,1.642892284589998,0,3,3,0_4_3_r0,0,anchor_skipped
2026-03-02T09:31:15.099535+00:00,B2,llm_style,tune,llm_style_tune_001,32,1024,2048,bf16,NVIDIA GeForce RTX 4060,c04,64,64,64,4,3,8,0.0,0.0,83.96799862384796,142.78656348586074,1.5984390505870707,0,3,3,1_3_4_r0,0,
2026-03-02T09:31:15.117259+00:00,B2,llm_style,tune,llm_style_tune_002,16,2048,1024,bf16,NVIDIA GeForce RTX 4060,c00,32,32,32,2,2,8,0.0,0.0,62.463998794555664,147.03232079744333,1.0743606764709592,0,3,3,0_4_3_r0,0,
2026-03-02T09:31:17.467582+00:00,B2,llm_style,tune,llm_style_tune_003,1,1024,4096,bf16,NVIDIA GeForce RTX 4060,c00,32,32,32,2,2,8,0.0,2350.279,139.26400244235992,158.25919777154922,0.060235293061263025,0,3,3,0_3_4_r0,0,anchor_skipped
2026-03-02T09:31:17.507873+00:00,B2,llm_style,tune,llm_style_tune_004,64,2048,2048,bf16,NVIDIA GeForce RTX 4060,c04,64,64,64,4,3,8,0.0,0.0,243.19999665021896,320.17407298088074,2.207528451458622,1,3,3,1_4_4_r0,0,
2026-03-02T09:31:18.040057+00:00,B2,llm_style,tune,llm_style_tune_005,32,8192,8192,bf16,NVIDIA GeForce RTX 4060,c04,64,64,64,4,3,8,0.0,0.0,577.8879821300507,7351.17329120636,7.432179641751816,0,3,3,1_4_4_r0,0,
2026-03-02T09:31:18.780925+00:00,B2,llm_style,tune,llm_style_tune_006,16,8192,8192,bf16,NVIDIA GeForce RTX 4060,c11,32,128,32,4,2,8,0.0,740.809,558.0480098724365,620.602895617485,3.848205907034577,0,3,3,0_4_4_r0,0,anchor_skipped
2026-03-02T09:31:18.831807+00:00,B2,llm_style,tune,llm_style_tune_007,2,1024,8192,bf16,NVIDIA GeForce RTX 4060,c00,32,32,32,2,2,8,0.0,0.0,92.0800007879734,170.15231713652605,0.36440520973999113,0,3,3,0_3_4_r0,0,
2026-03-02T09:31:18.919517+00:00,B2,llm_style,tune,llm_style_tune_008,16,2048,8192,bf16,NVIDIA GeForce RTX 4060,c11,32,128,32,4,2,8,0.0,0.0,175.10400712490082,276.58943563699717,3.0660115711518388,0,3,3,0_4_4_r0,0,
2026-03-02T09:31:18.958443+00:00,B2,llm_style,tune,llm_style_tune_009,4,4096,2048,bf16,NVIDIA GeForce RTX 4060,c11,32,128,32,4,2,8,0.0,0.0,52.97599919140339,93.42976048588744,1.2667786360675195,0,3,3,0_4_4_r0,0,
2026-03-02T09:31:19.159709+00:00,B2,llm_style,tune,llm_style_tune_010,64,8192,4096,bf16,NVIDIA GeForce RTX 4060,c04,64,64,64,4,3,8,0.0,0.0,304.9760013818741,392.49919831752754,14.082968091059989,1,3,3,1_4_4_r0,0,
2026-03-02T09:31:19.201251+00:00,B2,llm_style,tune,llm_style_tune_011,16,8192,1024,bf16,NVIDIA GeForce RTX 4060,c00,32,32,32,2,2,8,0.0,0.0,77.79200002551079,166.919043213129,3.4506820227268915,0,3,3,0_4_3_r0,0,
2026-03-02T09:31:19.240674+00:00,B2,llm_style,tune,llm_style_tune_012,2,8192,1024,bf16,NVIDIA GeForce RTX 4060,c00,32,32,32,2,2,8,0.0,0.0,54.27199974656105,100.54656028747544,0.6182641538305611,0,3,3,0_4_3_r0,0,
2026-03-02T09:31:19.323109+00:00,B2,llm_style,tune,llm_style_tune_013,16,8192,2048,bf16,NVIDIA GeForce RTX 4060,c11,32,128,32,4,2,8,0.0,0.0,166.9120043516159,311.64831727743143,3.216490713687859,0,3,3,0_4_4_r0,0,
2026-03-02T09:31:19.405341+00:00,B2,llm_style,tune,llm_style_tune_014,8,4096,4096,bf16,NVIDIA GeForce RTX 4060,c11,32,128,32,4,2,8,0.0,0.0,162.6719981431961,226.16319343447685,1.6501638823155227,0,3,3,0_4_4_r0,0,
2026-03-02T09:31:19.415811+00:00,B2,llm_style,tune,llm_style_tune_015,64,1024,1024,bf16,NVIDIA GeForce RTX 4060,c04,64,64,64,4,3,8,0.0,0.0,66.99199974536896,198.65568041801444,2.0034889018114175,1,3,3,1_3_3_r0,0,
2026-03-02T09:31:19.579765+00:00,B2,llm_style,tune,llm_style_tune_016,16,4096,8192,bf16,NVIDIA GeForce RTX 4060,c11,32,128,32,4,2,8,0.0,0.0,294.9120104312897,318.00319224596024,3.6408887601075395,0,3,3,0_4_4_r0,0,
2026-03-02T09:31:19.662677+00:00,B2,llm_style,tune,llm_style_tune_017,1,4096,4096,bf16,NVIDIA GeForce RTX 4060,c11,32,128,32,4,2,8,0.0,0.0,158.720001578331,171.57952189445493,0.21140644951065177,0,3,3,0_4_4_r0,0,
2026-03-02T09:31:19.746020+00:00,B2,llm_style,tune,llm_style_tune_018,64,4096,4096,bf16,NVIDIA GeForce RTX 4060,c04,64,64,64,4,3,8,0.0,0.0,168.96000504493713,254.94207784533484,12.710011741706852,1,3,3,1_4_4_r0,0,
2026-03-02T09:31:19.828299+00:00,B2,llm_style,tune,llm_style_tune_019,64,8192,2048,bf16,NVIDIA GeForce RTX 4060,c04,64,64,64,4,3,8,0.0,0.0,167.88800060749054,184.36096280813217,12.791168161092434,1,3,3,1_4_4_r0,0,
2026-03-02T09:31:19.868709+00:00,B2,llm_style,tune,llm_style_tune_020,8,2048,4096,bf16,NVIDIA GeForce RTX 4060,c11,32,128,32,4,2,8,0.0,0.0,74.49600100517273,156.3238368183373,1.8016769516350337,0,3,3,0_4_4_r0,0,
2026-03-02T09:31:19.879919+00:00,B2,llm_style,tune,llm_style_tune_021,8,1024,2048,bf16,NVIDIA GeForce RTX 4060,c00,32,32,32,2,2,8,0.0,0.0,38.91199827194214,130.28096199035627,0.8623158277685969,0,3,3,0_3_4_r0,0,
2026-03-02T09:31:19.919211+00:00,B2,llm_style,tune,llm_style_tune_022,8,8192,1024,bf16,NVIDIA GeForce RTX 4060,c00,32,32,32,2,2,8,0.0,0.0,50.12800171971321,139.90944206714624,2.6775000677359513,0,3,3,0_4_3_r0,0,
2026-03-02T09:31:20.077710+00:00,B2,llm_style,tune,llm_style_tune_023,1,4096,8192,bf16,NVIDIA GeForce RTX 4060,c11,32,128,32,4,2,8,0.0,0.0,294.9120104312897,401.1788806319233,0.22755554750672122,0,3,3,0_4_4_r0,0,
2026-03-02T09:31:20.235320+00:00,B2,llm_style,tune,llm_style_tune_024,2,8192,4096,bf16,NVIDIA GeForce RTX 4060,c11,32,128,32,4,2,8,0.0,0.0,295.9359884262085,409.24160093069077,0.4535363499173306,0,3,3,0_4_4_r0,0,
2026-03-02T09:31:20.319156+00:00,B2,llm_style,tune,llm_style_tune_025,2,4096,4096,bf16,NVIDIA GeForce RTX 4060,c11,32,128,32,4,2,8,0.0,0.0,160.87999939918518,236.20640441775296,0.4171361527263897,0,3,3,0_4_4_r0,0,
2026-03-02T09:31:20.333280+00:00,B2,llm_style,tune,llm_style_tune_026,4,2048,1024,bf16,NVIDIA GeForce RTX 4060,c00,32,32,32,2,2,8,0.0,0.0,47.839999198913574,174.45824652910224,0.3506943202536885,0,3,3,0_4_3_r0,0,
2026-03-02T09:31:20.376839+00:00,B2,llm_style,tune,llm_style_tune_027,64,2048,4096,bf16,NVIDIA GeForce RTX 4060,c04,64,64,64,4,3,8,0.0,0.0,91.77599847316742,138.1760011613369,11.699592942199699,1,3,3,1_4_4_r0,0,
2026-03-02T09:31:20.399000+00:00,B2,llm_style,tune,llm_style_tune_028,32,1024,4096,bf16,NVIDIA GeForce RTX 4060,c04,64,64,64,4,3,8,0.0,0.0,69.12000104784966,249.11135017871848,3.883614755939752,0,3,3,1_3_4_r0,0,
2026-03-02T09:31:20.412701+00:00,B2,llm_style,tune,llm_style_tune_029,32,2048,1024,bf16,NVIDIA GeForce RTX 4060,c04,64,64,64,4,3,8,0.0,0.0,51.69599875807762,221.60319760441766,2.5962885179586195,0,3,3,1_4_3_r0,0,
2026-03-02T09:31:20.432156+00:00,B2,llm_style,tune,llm_style_tune_030,4,2048,2048,bf16,NVIDIA GeForce RTX 4060,c11,32,128,32,4,2,8,0.0,0.0,60.38400158286095,144.1689603030681,0.5556841401766904,0,3,3,0_4_4_r0,0,
2026-03-02T09:31:20.753669+00:00,B2,llm_style,tune,llm_style_tune_031,1,8192,8192,bf16,NVIDIA GeForce RTX 4060,c11,32,128,32,4,2,8,0.0,0.0,560.1279735565186,589.3222570419312,0.23961975537088048,0,3,3,0_4_4_r0,0,
2026-03-02T09:31:20.775526+00:00,B2,llm_style,eval,llm_style_eval_000,2,1024,4096,bf16,NVIDIA GeForce RTX 4060,c00,32,32,32,2,2,8,0.0,0.0,84.99199897050858,229.33535873889923,0.1973975927524841,0,3,3,0_3_4_r0,0,
2026-03-02T09:31:21.086144+00:00,B2,llm_style,eval,llm_style_eval_001,2,8192,8192,bf16,NVIDIA GeForce RTX 4060,c11,32,128,32,4,2,8,0.0,0.0,562.175989151001,640.7552146911619,0.47749363398709294,0,3,3,0_4_4_r0,0,
2026-03-02T09:31:21.106232+00:00,B2,llm_style,eval,llm_style_eval_002,2,2048,2048,bf16,NVIDIA GeForce RTX 4060,c11,32,128,32,4,2,8,0.0,0.0,74.75200295448303,129.45663988590235,0.2244383472937274,0,3,3,0_4_4_r0,0,
2026-03-02T09:31:21.157004+00:00,B2,llm_style,eval,llm_style_eval_003,8,1024,8192,bf16,NVIDIA GeForce RTX 4060,c00,32,32,32,2,2,8,0.0,0.0,152.5759994983673,245.65599635243416,0.8796778552411597,0,3,3,0_3_4_r0,0,
2026-03-02T09:31:21.252566+00:00,B2,llm_style,eval,llm_style_eval_004,64,2048,8192,bf16,NVIDIA GeForce RTX 4060,c04,64,64,64,4,3,8,0.0,0.0,241.66400730609894,288.9011242985724,8.886237019482724,1,3,3,1_4_4_r0,0,
2026-03-02T09:31:21.621544+00:00,B2,llm_style,eval,llm_style_eval_005,1,8192,8192,bf16,NVIDIA GeForce RTX 4060,c11,32,128,32,4,2,8,0.0,0.0,906.2239825725555,943.6802959442139,0.14810657252635007,0,3,3,0_4_4_r0,0,
2026-03-02T09:31:21.679605+00:00,B2,llm_style,eval,llm_style_eval_006,1,1024,8192,bf16,NVIDIA GeForce RTX 4060,c00,32,32,32,2,2,8,0.0,0.0,162.1759980916977,290.7587249577043,0.10345067209337483,0,3,3,0_3_4_r0,0,
2026-03-02T09:31:21.857997+00:00,B2,llm_style,eval,llm_style_eval_007,2,8192,4096,bf16,NVIDIA GeForce RTX 4060,c11,32,128,32,4,2,8,0.0,0.0,470.0160026550293,551.536628603935,0.28555991124095786,0,3,3,0_4_4_r0,0,
2026-03-02T09:31:21.909886+00:00,B2,llm_style,eval,llm_style_eval_008,16,2048,4096,bf16,NVIDIA GeForce RTX 4060,c11,32,128,32,4,2,8,0.0,0.0,142.31999963521957,251.0540789365767,1.8861400835302629,0,3,3,0_4_4_r0,0,
2026-03-02T09:31:22.001835+00:00,B2,llm_style,eval,llm_style_eval_009,32,2048,8192,bf16,NVIDIA GeForce RTX 4060,c04,64,64,64,4,3,8,0.0,0.0,289.247989654541,407.662715613842,3.712184223933267,0,3,3,1_4_4_r0,0,
2026-03-02T09:31:22.066980+00:00,B2,llm_style,eval,llm_style_eval_010,1,1024,1024,bf16,NVIDIA GeForce RTX 4060,c00,32,32,32,2,2,8,0.0,65.083,46.08000069856644,156.17023706436157,0.04551111042116896,0,3,3,0_3_3_r0,0,anchor_skipped
2026-03-02T09:31:22.158351+00:00,B2,llm_style,eval,llm_style_eval_011,16,2048,8192,bf16,NVIDIA GeForce RTX 4060,c11,32,128,32,4,2,8,0.0,0.0,319.487988948822,364.0320113301276,1.6804103145361124,0,3,3,0_4_4_r0,0,
2026-03-02T09:31:22.494467+00:00,B2,llm_style,eval,llm_style_eval_012,8,8192,8192,bf16,NVIDIA GeForce RTX 4060,c11,32,128,32,4,2,8,0.0,0.0,910.8160138130188,944.1062313318253,1.1788789477963968,0,3,3,0_4_4_r0,0,
2026-03-02T09:31:22.668895+00:00,B2,llm_style,eval,llm_style_eval_013,32,4096,8192,bf16,NVIDIA GeForce RTX 4060,c04,64,64,64,4,3,8,0.0,0.0,495.61598896980286,584.9481707811353,4.332958774118247,0,3,3,1_4_4_r0,0,
2026-03-02T09:31:22.679805+00:00,B2,llm_style,eval,llm_style_eval_014,64,1024,1024,bf16,NVIDIA GeForce RTX 4060,c04,64,64,64,4,3,8,0.0,0.0,53.247999399900436,191.42432540655128,2.520615413022465,1,3,3,1_3_3_r0,0,
2026-03-02T09:31:22.692966+00:00,B2,llm_style,eval,llm_style_eval_015,16,2048,1024,bf16,NVIDIA GeForce RTX 4060,c00,32,32,32,2,2,8,0.0,0.0,66.56000018119812,137.67936080694187,1.0082461511013776,0,3,3,0_4_3_r0,0,
2026-03-02T09:31:22.746142+00:00,B2,llm_style,eval,llm_style_eval_016,2,1024,8192,bf16,NVIDIA GeForce RTX 4060,c00,32,32,32,2,2,8,0.0,0.0,188.38400393724442,197.67295986413956,0.17811720368348177,0,3,3,0_3_4_r0,0,
2026-03-02T09:31:23.084471+00:00,B2,llm_style,eval,llm_style_eval_017,4,8192,8192,bf16,NVIDIA GeForce RTX 4060,c11,32,128,32,4,2,8,0.0,0.0,916.4000153541565,1018.0540579557418,0.5858477771767804,0,3,3,0_4_4_r0,0,
2026-03-02T09:31:23.113482+00:00,B2,llm_style,eval,llm_style_eval_018,4,1024,4096,bf16,NVIDIA GeForce RTX 4060,c00,32,32,32,2,2,8,0.0,0.0,119.24800276756287,190.99647745490063,0.2813835973874044,0,3,3,0_3_4_r0,0,
2026-03-02T09:31:23.159759+00:00,B2,llm_style,eval,llm_style_eval_019,8,4096,2048,bf16,NVIDIA GeForce RTX 4060,c11,32,128,32,4,2,8,0.0,0.0,112.64000087976456,230.8649669587611,1.1915636270570362,0,3,3,0_4_4_r0,0,
2026-03-02T09:31:23.210983+00:00,B2,llm_style,eval,llm_style_eval_020,64,4096,2048,bf16,NVIDIA GeForce RTX 4060,c04,64,64,64,4,3,8,0.0,0.0,164.8320034146309,541.1097487807265,6.514158669169533,1,3,3,1_4_4_r0,0,
2026-03-02T09:31:23.394917+00:00,B2,llm_style,eval,llm_style_eval_021,1,4096,8192,bf16,NVIDIA GeForce RTX 4060,c11,32,128,32,4,2,8,0.0,0.0,475.6480008363724,591.5545624494553,0.14108934313188906,0,3,3,0_4_4_r0,0,
2026-03-02T09:31:23.418689+00:00,B2,llm_style,eval,llm_style_eval_022,32,1024,4096,bf16,NVIDIA GeForce RTX 4060,c04,64,64,64,4,3,8,0.0,0.0,125.95200538635254,163.4144058823585,2.131251941377078,0,3,3,1_3_4_r0,0,
2026-03-02T09:31:23.427162+00:00,B2,llm_style,eval,llm_style_eval_023,4,1024,1024,bf16,NVIDIA GeForce RTX 4060,c00,32,32,32,2,2,8,0.0,0.0,56.32000043988228,107.11040250957001,0.14894545338212953,0,3,3,0_3_3_r0,0,
2026-03-02T09:31:23.450275+00:00,B2,llm_style,eval,llm_style_eval_024,64,2048,2048,bf16,NVIDIA GeForce RTX 4060,c04,64,64,64,4,3,8,0.0,0.0,117.74400249123573,140.76127514243126,4.559645507548989,1,3,3,1_4_4_r0,0,
2026-03-02T09:31:23.808150+00:00,B2,llm_style,eval,llm_style_eval_025,32,8192,8192,bf16,NVIDIA GeForce RTX 4060,c04,64,64,64,4,3,8,0.0,0.0,1109.8399758338928,1152.9180335998535,3.869897813667164,0,3,3,1_4_4_r0,0,
2026-03-02T09:31:23.859536+00:00,B2,llm_style,eval,llm_style_eval_026,4,2048,4096,bf16,NVIDIA GeForce RTX 4060,c11,32,128,32,4,2,8,0.0,0.0,193.42400133609772,289.31071758270264,0.34695210282301103,0,3,3,0_4_4_r0,0,
2026-03-02T09:31:23.947722+00:00,B2,llm_style,eval,llm_style_eval_027,8,8192,2048,bf16,NVIDIA GeForce RTX 4060,c11,32,128,32,4,2,8,0.0,0.0,253.9519965648651,409.7497600317,1.0570322723626844,0,3,3,0_4_4_r0,0,
2026-03-02T09:31:24.125449+00:00,B2,llm_style,eval,llm_style_eval_028,8,4096,8192,bf16,NVIDIA GeForce RTX 4060,c11,32,128,32,4,2,8,0.0,0.0,482.7200025320053,520.2534371614456,1.1121787147496636,0,3,3,0_4_4_r0,0,
2026-03-02T09:31:24.148011+00:00,B2,llm_style,eval,llm_style_eval_029,8,2048,2048,bf16,NVIDIA GeForce RTX 4060,c11,32,128,32,4,2,8,0.0,0.0,114.68800157308578,216.26879855990404,0.5851428491169093,0,3,3,0_4_4_r0,0,
2026-03-02T09:31:24.195596+00:00,B2,llm_style,eval,llm_style_eval_030,1,4096,2048,bf16,NVIDIA GeForce RTX 4060,c11,32,128,32,4,2,8,0.0,0.0,129.02399897575378,225.94560563564298,0.13003174706399215,0,3,3,0_4_4_r0,0,
2026-03-02T09:31:24.282846+00:00,B2,llm_style,eval,llm_style_eval_031,16,8192,2048,bf16,NVIDIA GeForce RTX 4060,c11,32,128,32,4,2,8,0.0,0.0,257.02399015426636,405.2889594435691,2.0887968927638583,0,3,3,0_4_4_r0,0,
2026-03-02T09:31:24.310548+00:00,B2,llm_style,eval,llm_style_eval_032,1,2048,2048,bf16,NVIDIA GeForce RTX 4060,c11,32,128,32,4,2,8,0.0,0.0,115.7120019197464,226.7955221235751,0.07249557401848453,0,3,3,0_4_4_r0,0,
2026-03-02T09:31:24.489339+00:00,B2,llm_style,eval,llm_style_eval_033,16,8192,4096,bf16,NVIDIA GeForce RTX 4060,c11,32,128,32,4,2,8,0.0,0.0,475.0720113515854,520.5811172723769,2.2601664554920675,0,3,3,0_4_4_r0,0,
2026-03-02T09:31:24.516739+00:00,B2,llm_style,eval,llm_style_eval_034,16,1024,4096,bf16,NVIDIA GeForce RTX 4060,c00,32,32,32,2,2,8,0.0,0.0,154.08000349998474,243.11807259917254,0.8710911536292462,0,3,3,0_3_4_r0,0,
2026-03-02T09:31:24.613766+00:00,B2,llm_style,eval,llm_style_eval_035,4,8192,2048,bf16,NVIDIA GeForce RTX 4060,c11,32,128,32,4,2,8,0.0,0.0,256.00001215934753,348.38527858257294,0.5242879750976575,0,3,3,0_4_4_r0,0,
2026-03-02T09:31:24.664588+00:00,B2,llm_style,eval,llm_style_eval_036,2,2048,4096,bf16,NVIDIA GeForce RTX 4060,c11,32,128,32,4,2,8,0.0,0.0,222.20799326896667,357.0054298639295,0.1510046128691005,0,3,3,0_4_4_r0,0,
2026-03-02T09:31:24.677938+00:00,B2,llm_style,eval,llm_style_eval_037,2,1024,1024,bf16,NVIDIA GeForce RTX 4060,c00,32,32,32,2,2,8,0.0,0.0,66.56000018119812,130.85823826491824,0.0630153844438361,0,3,3,0_3_3_r0,0,
2026-03-02T09:31:24.867242+00:00,B2,llm_style,eval,llm_style_eval_038,64,4096,8192,bf16,NVIDIA GeForce RTX 4060,c04,64,64,64,4,3,8,0.0,0.0,736.2399995326996,770.5907160043716,5.833651117469938,1,3,3,1_4_4_r0,0,
2026-03-02T09:31:24.882828+00:00,B2,llm_style,eval,llm_style_eval_039,4,1024,2048,bf16,NVIDIA GeForce RTX 4060,c00,32,32,32,2,2,8,0.0,0.0,92.57600083947182,171.00192174315453,0.18122640692906952,0,3,3,0_3_4_r0,0,
2026-03-02T09:31:24.932462+00:00,B2,llm_style,eval,llm_style_eval_040,64,8192,1024,bf16,NVIDIA GeForce RTX 4060,c04,64,64,64,4,3,8,0.0,0.0,208.3519995212555,272.50688284635544,5.153499013530992,1,3,3,1_4_3_r0,0,
2026-03-02T09:31:24.947279+00:00,B2,llm_style,eval,llm_style_eval_041,2,2048,1024,bf16,NVIDIA GeForce RTX 4060,c00,32,32,32,2,2,8,0.0,0.0,77.82400026917458,263.33760693669296,0.10778947331139255,0,3,3,0_4_3_r0,0,
2026-03-02T09:31:24.995123+00:00,B2,llm_style,eval,llm_style_eval_042,2,4096,2048,bf16,NVIDIA GeForce RTX 4060,c11,32,128,32,4,2,8,0.0,0.0,146.83199673891068,312.85600438713993,0.22852261595042409,0,3,3,0_4_4_r0,0,
2026-03-02T09:31:25.007734+00:00,B2,llm_style,eval,llm_style_eval_043,1,2048,1024,bf16,NVIDIA GeForce RTX 4060,c00,32,32,32,2,2,8,0.0,0.0,62.97599896788597,77.32224002480507,0.0666016271077946,0,3,3,0_4_3_r0,0,
2026-03-02T09:31:25.117091+00:00,B2,llm_style,eval,llm_style_eval_044,8,2048,8192,bf16,NVIDIA GeForce RTX 4060,c11,32,128,32,4,2,8,0.0,0.0,508.6880028247833,613.8342344760895,0.5277015665975163,0,3,3,0_4_4_r0,0,
2026-03-02T09:31:25.162053+00:00,B2,llm_style,eval,llm_style_eval_045,1,8192,1024,bf16,NVIDIA GeForce RTX 4060,c00,32,32,32,2,2,8,0.0,0.0,121.75999954342842,264.47423532605154,0.13778922522101383,0,3,3,0_4_3_r0,0,
2026-03-02T09:31:25.184141+00:00,B2,llm_style,eval,llm_style_eval_046,64,4096,1024,bf16,NVIDIA GeForce RTX 4060,c04,64,64,64,4,3,8,0.0,0.0,121.23200297355652,130.0889591872692,4.42845864814346,1,3,3,1_4_3_r0,0,
2026-03-02T09:31:25.207654+00:00,B2,llm_style,eval,llm_style_eval_047,16,2048,2048,bf16,NVIDIA GeForce RTX 4060,c11,32,128,32,4,2,8,0.0,0.0,122.8800043463707,239.56480264663688,1.092266628032262,0,3,3,0_4_4_r0,0,
2026-03-02T09:31:25.418221+00:00,B2,llm_style,eval,llm_style_eval_048,8,8192,4096,bf16,NVIDIA GeForce RTX 4060,c11,32,128,32,4,2,8,0.0,0.0,480.6720018386841,536.3475400209426,1.1169173780589297,0,3,3,0_4_4_r0,0,
2026-03-02T09:31:25.594921+00:00,B2,llm_style,eval,llm_style_eval_049,4,4096,8192,bf16,NVIDIA GeForce RTX 4060,c11,32,128,32,4,2,8,0.0,0.0,575.8719742298126,649.8860865831375,0.4661373847182147,0,3,3,0_4_4_r0,0,
2026-03-02T09:31:25.708444+00:00,B2,llm_style,eval,llm_style_eval_050,4,2048,8192,bf16,NVIDIA GeForce RTX 4060,c11,32,128,32,4,2,8,0.0,0.0,564.5759999752045,720.609277486801,0.2377319050152587,0,3,3,0_4_4_r0,0,
2026-03-02T09:31:25.719217+00:00,B2,llm_style,eval,llm_style_eval_051,16,1024,1024,bf16,NVIDIA GeForce RTX 4060,c00,32,32,32,2,2,8,0.0,0.0,66.56000018119812,165.10975614190096,0.5041230755506888,0,3,3,0_3_3_r0,0,
2026-03-02T09:31:25.921549+00:00,B2,llm_style,eval,llm_style_eval_052,32,8192,4096,bf16,NVIDIA GeForce RTX 4060,c04,64,64,64,4,3,8,0.0,0.0,868.3359920978546,1026.2220507860181,2.473102194936998,0,3,3,1_4_4_r0,0,
2026-03-02T09:31:25.938138+00:00,B2,llm_style,eval,llm_style_eval_053,32,1024,2048,bf16,NVIDIA GeForce RTX 4060,c04,64,64,64,4,3,8,0.0,0.0,113.0560003221035,200.2108798921108,1.1871791644636767,0,3,3,1_3_4_r0,0,
2026-03-02T09:31:26.039324+00:00,B2,llm_style,eval,llm_style_eval_054,64,8192,2048,bf16,NVIDIA GeForce RTX 4060,c04,64,64,64,4,3,8,0.0,0.0,453.6319971084595,547.2166150808333,4.733977456811882,1,3,3,1_4_4_r0,0,
2026-03-02T09:31:26.061830+00:00,B2,llm_style,eval,llm_style_eval_055,1,4096,1024,bf16,NVIDIA GeForce RTX 4060,c00,32,32,32,2,2,8,0.0,0.0,91.60000085830688,102.39808060228823,0.09157868909822468,0,3,3,0_4_3_r0,0,
2026-03-02T09:31:26.085494+00:00,B2,llm_style,eval,llm_style_eval_056,4,2048,2048,bf16,NVIDIA GeForce RTX 4060,c11,32,128,32,4,2,8,0.0,0.0,153.60000729560852,210.58560058474535,0.21845332295735723,0,3,3,0_4_4_r0,0,
2026-03-02T09:31:26.143190+00:00,B2,llm_style,eval,llm_style_eval_057,16,1024,8192,bf16,NVIDIA GeForce RTX 4060,c00,32,32,32,2,2,8,0.0,0.0,331.64799213409424,378.91071021556843,0.8093987069623635,0,3,3,0_3_4_r0,0,
2026-03-02T09:31:26.313953+00:00,B2,llm_style,eval,llm_style_eval_058,1,8192,4096,bf16,NVIDIA GeForce RTX 4060,c11,32,128,32,4,2,8,0.0,0.0,488.41600120067596,606.2284761667252,0.13740103484534882,0,3,3,0_4_4_r0,0,
2026-03-02T09:31:26.337933+00:00,B2,llm_style,eval,llm_style_eval_059,8,4096,1024,bf16,NVIDIA GeForce RTX 4060,c00,32,32,32,2,2,8,0.0,0.0,95.23200243711472,158.12607377767554,0.704688154009095,0,3,3,0_4_3_r0,0,
2026-03-02T09:31:26.510743+00:00,B2,llm_style,eval,llm_style_eval_060,4,8192,4096,bf16,NVIDIA GeForce RTX 4060,c11,32,128,32,4,2,8,0.0,0.0,496.11200392246246,628.2240116596221,0.5410783328716914,0,3,3,0_4_4_r0,0,
2026-03-02T09:31:26.540823+00:00,B2,llm_style,eval,llm_style_eval_061,32,2048,2048,bf16,NVIDIA GeForce RTX 4060,c04,64,64,64,4,3,8,0.0,0.0,184.22400206327438,204.20896127820015,1.4571144530222613,0,3,3,1_4_4_r0,0,
2026-03-02T09:31:26.554076+00:00,B2,llm_style,eval,llm_style_eval_062,8,2048,1024,bf16,NVIDIA GeForce RTX 4060,c00,32,32,32,2,2,8,0.0,0.0,75.77600330114365,158.8982374966144,0.44281079151997954,0,3,3,0_4_3_r0,0,
2026-03-02T09:31:26.739840+00:00,B2,llm_style,eval,llm_style_eval_063,16,4096,8192,bf16,NVIDIA GeForce RTX 4060,c11,32,128,32,4,2,8,0.0,0.0,658.4320068359375,795.9551787376404,1.630755815106579,0,3,3,0_4_4_r0,0,
2026-03-02T09:31:26.964683+00:00,B2,training_style,tune,training_style_tune_000,4096,2048,1024,bf16,NVIDIA GeForce RTX 4060,c03,64,64,32,4,2,8,0.0,0.0,3304.431915283203,3441.1097168922424,5.1990386318876896,3,3,3,4_4_3_r2,0,
2026-03-02T09:31:27.017011+00:00,B2,training_style,tune,training_style_tune_001,1536,2048,1536,bf16,NVIDIA GeForce RTX 4060,c11,32,128,32,4,2,8,0.0,0.0,373.072013258934,390.1644852757454,25.902978708008416,3,3,3,4_4_4_r1,0,
2026-03-02T09:31:27.220625+00:00,B2,training_style,tune,training_style_tune_002,3072,2048,4096,bf16,NVIDIA GeForce RTX 4060,c11,32,128,32,4,2,8,0.0,0.0,1815.551996231079,1962.5164592266083,28.38784439057187,3,3,3,4_4_4_r1,0,
2026-03-02T09:31:27.274622+00:00,B2,training_style,tune,training_style_tune_003,2048,1536,2048,bf16,NVIDIA GeForce RTX 4060,c11,32,128,32,4,2,8,0.0,0.0,433.0559968948364,790.3436702489844,29.753431381597927,3,3,3,4_4_4_r1,0,
2026-03-02T09:31:27.285468+00:00,B2,training_style,tune,training_style_tune_004,512,512,1024,bf16,NVIDIA GeForce RTX 4060,c05,128,64,32,4,3,8,0.0,0.0,58.36800113320351,146.0326410830021,9.198034909141219,2,2,3,3_3_3_r1,0,
2026-03-02T09:31:27.831560+00:00,B2,training_style,tune,training_style_tune_005,1024,1536,1536,bf16,NVIDIA GeForce RTX 4060,c09,128,64,64,8,3,8,0.0,546.039,174.8960018157959,181.02719992399216,27.62692204415852,3,3,3,3_4_4_r1,0,
2026-03-02T09:31:28.017882+00:00,B2,training_style,tune,training_style_tune_006,1024,1536,512,bf16,NVIDIA GeForce RTX 4060,c11,32,128,32,4,2,8,0.0,186.272,81.91999793052673,97.90911883115764,19.6608004966736,3,3,2,3_4_3_r1,0,
2026-03-02T09:31:28.041797+00:00,B2,training_style,tune,training_style_tune_007,2048,1536,512,bf16,NVIDIA GeForce RTX 4060,c05,128,64,32,4,3,8,0.0,0.0,131.071999669075,144.91456046700478,24.576000062048433,3,3,2,4_4_3_r1,0,
2026-03-02T09:31:28.133753+00:00,B2,training_style,tune,training_style_tune_008,3072,3072,1536,bf16,NVIDIA GeForce RTX 4060,c11,32,128,32,4,2,8,0.0,0.0,953.8559913635254,1018.3270114660263,30.393507521567987,3,3,3,4_4_4_r1,0,
2026-03-02T09:31:28.161046+00:00,B2,training_style,tune,training_style_tune_009,1024,1536,1024,bf16,NVIDIA GeForce RTX 4060,c11,32,128,32,4,2,8,0.0,0.0,154.11199629306793,268.81023049354553,20.9018476788422,3,3,3,3_4_3_r1,0,
2026-03-02T09:31:28.259424+00:00,B2,training_style,tune,training_style_tune_010,1536,2048,4096,bf16,NVIDIA GeForce RTX 4060,c11,32,128,32,4,2,8,0.0,0.0,850.4320085048676,948.4467124938965,30.30201535018129,3,3,3,4_4_4_r1,0,
2026-03-02T09:31:28.316512+00:00,B2,training_style,tune,training_style_tune_011,1024,1024,4096,bf16,NVIDIA GeForce RTX 4060,c07,128,128,32,8,3,8,0.0,0.0,315.42399525642395,434.7091197967529,27.232977583131596,3,3,3,3_3_4_r1,0,
2026-03-02T09:31:28.658157+00:00,B2,training_style,tune,training_style_tune_012,3072,4096,4096,bf16,NVIDIA GeForce RTX 4060,c11,32,128,32,4,2,8,0.0,0.0,3538.831949234009,3659.4175696372986,29.1280333688385,3,3,3,4_4_4_r1,0,
2026-03-02T09:31:28.926510+00:00,B2,training_style,tune,training_style_tune_013,512,1024,3072,bf16,NVIDIA GeForce RTX 4060,c04,64,64,64,4,3,8,0.0,268.291,140.28799533843994,150.36032482981682,22.96151901115206,2,3,3,3_3_4_r0,0,
2026-03-02T09:31:28.944693+00:00,B2,training_style,tune,training_style_tune_014,1536,1024,1024,bf16,NVIDIA GeForce RTX 4060,c04,64,64,64,4,3,8,0.0,0.0,125.35999715328217,227.22559452056868,25.695800455876626,3,3,3,4_3_3_r1,0,
2026-03-02T09:31:29.015367+00:00,B2,training_style,tune,training_style_tune_015,2048,3072,1536,bf16,NVIDIA GeForce RTX 4060,c11,32,128,32,4,2,8,0.0,0.0,639.8879885673523,909.2403256893157,30.20427508769478,3,3,3,4_4_4_r1,0,
2026-03-02T09:31:31.059746+00:00,B2,training_style,tune,training_style_tune_016,1536,3072,3072,bf16,NVIDIA GeForce RTX 4060,c05,128,64,32,4,3,8,0.0,2044.312,931.8400025367737,976.4352136850357,31.11159551969965,3,3,3,4_4_4_r0,0,
2026-03-02T09:31:31.088130+00:00,B2,training_style,tune,training_style_tune_017,1024,1024,2048,bf16,NVIDIA GeForce RTX 4060,c07,128,128,32,8,3,8,0.0,0.0,179.55200374126434,190.8271962404251,23.920464302860562,3,3,3,3_3_4_r1,0,
2026-03-02T09:31:31.122198+00:00,B2,training_style,tune,training_style_tune_018,1536,1536,1536,bf16,NVIDIA GeForce RTX 4060,c11,32,128,32,4,2,8,0.0,0.0,254.97600436210632,377.3119920492171,28.425252525751542,3,3,3,4_4_4_r1,0,
2026-03-02T09:31:31.166042+00:00,B2,training_style,tune,training_style_tune_019,1536,1536,2048,bf16,NVIDIA GeForce RTX 4060,c11,32,128,32,4,2,8,0.0,0.0,308.03200602531433,404.3878313899039,31.37231270443316,3,3,3,4_4_4_r1,0,
2026-03-02T09:31:31.191415+00:00,B2,training_style,tune,training_style_tune_020,1536,1536,1024,bf16,NVIDIA GeForce RTX 4060,c05,128,64,32,4,3,8,0.0,0.0,174.0799993276596,231.50336295366282,27.756423636614,3,3,3,4_4_3_r1,0,
2026-03-02T09:31:31.222840+00:00,B2,training_style,tune,training_style_tune_021,1024,2048,1536,bf16,NVIDIA GeForce RTX 4060,c09,128,64,64,8,3,8,0.0,0.0,206.84799551963806,269.0355104207992,31.14582245680189,3,3,3,3_4_4_r0,0,
2026-03-02T09:31:31.237539+00:00,B2,training_style,tune,training_style_tune_022,512,1024,1536,bf16,NVIDIA GeForce RTX 4060,c04,64,64,64,4,3,8,0.0,0.0,87.95199915766716,186.60351961851106,18.312406215039353,2,3,3,3_3_4_r0,0,
2026-03-02T09:31:31.288586+00:00,B2,training_style,tune,training_style_tune_023,1536,2048,2048,bf16,NVIDIA GeForce RTX 4060,c11,32,128,32,4,2,8,0.0,0.0,437.75999546051025,480.5727985501288,29.433712585923875,3,3,3,4_4_4_r1,0,
2026-03-02T09:31:31.307962+00:00,B2,training_style,tune,training_style_tune_024,1024,1024,1024,bf16,NVIDIA GeForce RTX 4060,c05,128,64,32,4,3,8,0.0,0.0,131.071999669075,194.76479873061174,16.384000041365624,3,3,3,3_3_3_r1,0,
2026-03-02T09:31:32.077768+00:00,B2,training_style,tune,training_style_tune_025,1536,1024,4096,bf16,NVIDIA GeForce RTX 4060,c05,128,64,32,4,3,8,0.0,769.759,431.61600828170776,586.3916915655134,29.852696936092936,3,3,3,4_3_4_r1,0,
2026-03-02T09:31:32.660097+00:00,B2,training_style,tune,training_style_tune_026,2048,4096,512,bf16,NVIDIA GeForce RTX 4060,c03,64,64,32,4,2,8,0.0,582.279,300.79999566078186,392.0588743686673,28.556963816206434,3,3,2,4_4_3_r0,0,
2026-03-02T09:31:32.806810+00:00,B2,training_style,tune,training_style_tune_027,4096,4096,1536,bf16,NVIDIA GeForce RTX 4060,c11,32,128,32,4,2,8,0.0,0.0,1646.0800170898438,1754.6835219860077,31.31051165004632,3,3,3,4_4_4_r1,0,
2026-03-02T09:31:32.890456+00:00,B2,training_style,tune,training_style_tune_028,1536,1536,4096,bf16,NVIDIA GeForce RTX 4060,c11,32,128,32,4,2,8,0.0,0.0,628.7360191345215,648.0508637428284,30.740012093795453,3,3,3,4_4_4_r1,0,
2026-03-02T09:31:35.089564+00:00,B2,training_style,tune,training_style_tune_029,4096,2048,2048,bf16,NVIDIA GeForce RTX 4060,c03,64,64,32,4,2,8,0.0,2199.042,1097.7280139923096,1257.3187053203583,31.300775720424237,3,3,3,4_4_4_r2,0,
2026-03-02T09:31:35.114267+00:00,B2,training_style,tune,training_style_tune_030,2048,2048,512,bf16,NVIDIA GeForce RTX 4060,c05,128,64,32,4,3,8,0.0,0.0,177.15199291706085,268.36990654468536,24.244532761258977,3,3,2,4_4_3_r1,0,
2026-03-02T09:31:35.132782+00:00,B2,training_style,tune,training_style_tune_031,512,512,1536,bf16,NVIDIA GeForce RTX 4060,c07,128,128,32,8,3,8,0.0,0.0,69.34399902820587,169.54784512519836,11.613209207511083,2,2,3,3_3_4_r1,0,
2026-03-02T09:31:35.210773+00:00,B2,training_style,eval,training_style_eval_000,2048,1536,3072,bf16,NVIDIA GeForce RTX 4060,c11,32,128,32,4,2,8,0.0,0.0,626.0319948196411,676.8265390396118,30.872787640139993,3,3,3,4_4_4_r1,0,
2026-03-02T09:31:35.264087+00:00,B2,training_style,eval,training_style_eval_001,1024,2048,2048,bf16,NVIDIA GeForce RTX 4060,c09,128,64,64,8,3,8,0.0,0.0,280.0639867782593,389.22720015048975,30.671328687472702,3,3,3,3_4_4_r0,0,
2026-03-02T09:31:35.313507+00:00,B2,training_style,eval,training_style_eval_002,1536,1024,3072,bf16,NVIDIA GeForce RTX 4060,c05,128,64,32,4,3,8,0.0,0.0,293.7919944524765,379.82144027948357,32.89291947525543,3,3,3,4_3_4_r1,0,
2026-03-02T09:31:35.431328+00:00,B2,training_style,eval,training_style_eval_003,1024,512,1024,bf16,NVIDIA GeForce RTX 4060,c09,128,64,64,8,3,8,0.0,117.76,66.56000018119812,78.32799933850762,16.13193841762204,3,2,3,3_3_3_r2,0,
2026-03-02T09:31:35.452342+00:00,B2,training_style,eval,training_style_eval_004,1024,2048,1024,bf16,NVIDIA GeForce RTX 4060,c06,64,128,32,4,3,8,0.0,0.0,159.743994474411,195.70048317313183,26.8865650325778,3,3,3,3_4_3_r0,0,
2026-03-02T09:31:35.466635+00:00,B2,training_style,eval,training_style_eval_005,1024,512,1536,bf16,NVIDIA GeForce RTX 4060,c04,64,64,64,4,3,8,0.0,0.0,91.13600105047226,187.03360006213185,17.672629009780916,3,2,3,3_3_4_r2,0,
2026-03-02T09:31:35.518671+00:00,B2,training_style,eval,training_style_eval_006,2048,1536,2048,bf16,NVIDIA GeForce RTX 4060,c11,32,128,32,4,2,8,0.0,0.0,412.1600091457367,524.8499071598053,31.261892474007578,3,3,3,4_4_4_r1,0,
2026-03-02T09:31:35.546174+00:00,B2,training_style,eval,training_style_eval_007,1536,2048,1024,bf16,NVIDIA GeForce RTX 4060,c05,128,64,32,4,3,8,0.0,0.0,208.28799903392792,290.32672852277756,30.930495150373947,3,3,3,4_4_3_r1,0,
2026-03-02T09:31:35.559464+00:00,B2,training_style,eval,training_style_eval_008,512,512,2048,bf16,NVIDIA GeForce RTX 4060,c07,128,128,32,8,3,8,0.0,0.0,81.67999982833862,167.07584440708155,13.145712858185739,2,2,3,3_3_4_r1,0,
2026-03-02T09:31:35.577704+00:00,B2,training_style,eval,training_style_eval_009,1024,512,2048,bf16,NVIDIA GeForce RTX 4060,c04,64,64,64,4,3,8,0.0,0.0,106.28800094127655,243.23136255145067,20.20438458699088,3,2,3,3_3_4_r2,0,
2026-03-02T09:31:35.619378+00:00,B2,training_style,eval,training_style_eval_010,2048,3072,1024,bf16,NVIDIA GeForce RTX 4060,c05,128,64,32,4,3,8,0.0,0.0,414.71999883651733,489.99776154756546,31.0689186056813,3,3,3,4_4_3_r1,0,
2026-03-02T09:31:35.697294+00:00,B2,training_style,eval,training_style_eval_011,2048,4096,1536,bf16,NVIDIA GeForce RTX 4060,c05,128,64,32,4,3,8,0.0,0.0,798.7200021743774,904.0995359420776,32.26387683524408,3,3,3,4_4_4_r0,0,
2026-03-02T09:31:35.832485+00:00,B2,training_style,eval,training_style_eval_012,2048,3072,3072,bf16,NVIDIA GeForce RTX 4060,c11,32,128,32,4,2,8,0.0,0.0,1267.0720219612122,1390.6124591827393,30.50711008847712,3,3,3,4_4_4_r1,0,
2026-03-02T09:31:35.893674+00:00,B2,training_style,eval,training_style_eval_013,3072,1536,1536,bf16,NVIDIA GeForce RTX 4060,c03,64,64,32,4,2,8,0.0,0.0,461.2800031900406,530.3849637508392,31.42454588049433,3,3,3,4_4_4_r2,0,
2026-03-02T09:31:35.931716+00:00,B2,training_style,eval,training_style_eval_014,2048,1536,1536,bf16,NVIDIA GeForce RTX 4060,c11,32,128,32,4,2,8,0.0,0.0,322.86399602890015,378.4790441393851,29.93110577475163,3,3,3,4_4_4_r1,0,
2026-03-02T09:31:35.984166+00:00,B2,training_style,eval,training_style_eval_015,4096,2048,1024,bf16,NVIDIA GeForce RTX 4060,c03,64,64,32,4,2,8,0.0,0.0,544.7679758071899,627.575362920761,31.536121701251542,3,3,3,4_4_3_r2,0,
2026-03-02T09:31:35.998224+00:00,B2,training_style,eval,training_style_eval_016,2048,1024,512,bf16,NVIDIA GeForce RTX 4060,c07,128,128,32,8,3,8,0.0,0.0,113.66400122642517,130.52191853523252,18.893261057404533,3,3,2,4_3_3_r2,0,
2026-03-02T09:31:36.113910+00:00,B2,training_style,eval,training_style_eval_017,2048,4096,2048,bf16,NVIDIA GeForce RTX 4060,c05,128,64,32,4,3,8,0.0,0.0,1046.5279817581177,1097.267210483551,32.83212581691056,3,3,3,4_4_4_r0,0,
2026-03-02T09:31:36.199784+00:00,B2,training_style,eval,training_style_eval_018,1536,2048,3072,bf16,NVIDIA GeForce RTX 4060,c11,32,128,32,4,2,8,0.0,0.0,634.9279880523682,691.8806242942809,30.44022817656276,3,3,3,4_4_4_r1,0,
2026-03-02T09:31:36.260043+00:00,B2,training_style,eval,training_style_eval_019,1536,1536,3072,bf16,NVIDIA GeForce RTX 4060,c11,32,128,32,4,2,8,0.0,0.0,457.056000828743,562.1395456790924,31.714964025669605,3,3,3,4_4_4_r1,0,
2026-03-02T09:31:36.330802+00:00,B2,training_style,eval,training_style_eval_020,3072,1536,2048,bf16,NVIDIA GeForce RTX 4060,c03,64,64,32,4,2,8,0.0,0.0,580.6080102920532,694.419858455658,33.28812639405042,3,3,3,4_4_4_r2,0,
2026-03-02T09:31:36.412734+00:00,B2,training_style,eval,training_style_eval_021,2048,1024,4096,bf16,NVIDIA GeForce RTX 4060,c04,64,64,64,4,3,8,0.0,0.0,556.0959875583649,640.8208066225052,30.893711820204228,3,3,3,4_3_4_r2,0,
2026-03-02T09:31:36.424642+00:00,B2,training_style,eval,training_style_eval_022,512,512,1536,bf16,NVIDIA GeForce RTX 4060,c07,128,128,32,8,3,8,0.0,0.0,69.63200122117996,128.3276785910129,11.565176267762501,2,2,3,3_3_4_r1,0,
2026-03-02T09:31:36.776855+00:00,B2,training_style,eval,training_style_eval_023,3072,4096,4096,bf16,NVIDIA GeForce RTX 4060,c11,32,128,32,4,2,8,0.0,0.0,3653.6319255828857,3815.005416870117,28.21280774952588,3,3,3,4_4_4_r1,0,
2026-03-02T09:31:36.842310+00:00,B2,training_style,eval,training_style_eval_024,1536,1024,4096,bf16,NVIDIA GeForce RTX 4060,c05,128,64,32,4,3,8,0.0,0.0,439.7279918193817,561.577935218811,29.30198242483611,3,3,3,4_3_4_r1,0,
2026-03-02T09:31:36.998151+00:00,B2,training_style,eval,training_style_eval_025,4096,3072,2048,bf16,NVIDIA GeForce RTX 4060,c11,32,128,32,4,2,8,0.0,0.0,1624.4800090789795,1713.4604740142822,31.726833980075302,3,3,3,4_4_4_r1,0,
2026-03-02T09:31:37.010370+00:00,B2,training_style,eval,training_style_eval_026,1024,512,512,bf16,NVIDIA GeForce RTX 4060,c09,128,64,64,8,3,8,0.0,0.0,29.440000653266907,104.89919967949376,18.236103943171084,3,2,2,3_3_3_r2,0,
2026-03-02T09:31:37.065270+00:00,B2,training_style,eval,training_style_eval_027,2048,4096,1024,bf16,NVIDIA GeForce RTX 4060,c03,64,64,32,4,2,8,0.0,0.0,554.7039806842804,687.4230438470839,30.971238322117305,3,3,3,4_4_3_r0,0,
2026-03-02T09:31:37.087788+00:00,B2,training_style,eval,training_style_eval_028,1536,1536,1024,bf16,NVIDIA GeForce RTX 4060,c05,128,64,32,4,3,8,0.0,0.0,175.10400712490082,208.5507151484489,27.59410414036655,3,3,3,4_4_3_r1,0,
2026-03-02T09:31:37.117799+00:00,B2,training_style,eval,training_style_eval_029,1024,512,4096,bf16,NVIDIA GeForce RTX 4060,c04,64,64,64,4,3,8,0.0,0.0,175.61600357294083,237.62144193053246,24.456582592805198,3,2,3,3_3_4_r2,0,
2026-03-02T09:31:37.154906+00:00,B2,training_style,eval,training_style_eval_030,1024,1024,3072,bf16,NVIDIA GeForce RTX 4060,c07,128,128,32,8,3,8,0.0,0.0,252.4159997701645,311.01953208446497,25.523148096262226,3,3,3,3_3_4_r1,0,
2026-03-02T09:31:37.166477+00:00,B2,training_style,eval,training_style_eval_031,1024,1024,512,bf16,NVIDIA GeForce RTX 4060,c05,128,64,32,4,3,8,0.0,0.0,70.14400139451027,223.46752479672418,15.307678527789763,3,3,2,3_3_3_r1,0,
2026-03-02T09:31:37.177124+00:00,B2,training_style,eval,training_style_eval_032,512,1024,1024,bf16,NVIDIA GeForce RTX 4060,c06,64,128,32,4,3,8,0.0,0.0,66.56000018119812,71.1987217515707,16.13193841762204,2,3,3,3_3_3_r0,0,
2026-03-02T09:31:37.265052+00:00,B2,training_style,eval,training_style_eval_033,3072,2048,2048,bf16,NVIDIA GeForce RTX 4060,c11,32,128,32,4,2,8,0.0,0.0,851.8719971179962,914.3193751573561,30.250793385840716,3,3,3,4_4_4_r1,0,
2026-03-02T09:31:37.285203+00:00,B2,training_style,eval,training_style_eval_034,1536,1024,512,bf16,NVIDIA GeForce RTX 4060,c04,64,64,64,4,3,8,0.0,0.0,91.13600105047226,179.96543645858756,17.672629009780916,3,3,2,4_3_3_r1,0,
2026-03-02T09:31:37.719950+00:00,B2,training_style,eval,training_style_eval_035,4096,4096,4096,bf16,NVIDIA GeForce RTX 4060,c11,32,128,32,4,2,8,0.0,0.0,4727.151870727539,4931.438765525818,29.074368082624613,3,3,3,4_4_4_r1,0,
2026-03-02T09:31:37.954497+00:00,B2,training_style,eval,training_style_eval_036,2048,4096,4096,bf16,NVIDIA GeForce RTX 4060,c05,128,64,32,4,3,8,0.0,0.0,2094.0799713134766,2214.0290880203247,32.81607086519091,3,3,3,4_4_4_r0,0,
2026-03-02T09:31:37.992354+00:00,B2,training_style,eval,training_style_eval_037,4096,2048,512,bf16,NVIDIA GeForce RTX 4060,c03,64,64,32,4,2,8,0.0,0.0,295.21600902080536,323.6249652504921,29.097116448703918,3,3,2,4_4_3_r2,0,
2026-03-02T09:31:38.009861+00:00,B2,training_style,eval,training_style_eval_038,2048,1536,512,bf16,NVIDIA GeForce RTX 4060,c05,128,64,32,4,3,8,0.0,0.0,129.40800189971924,256.63648366928095,24.892011504019585,3,3,2,4_4_3_r1,0,
2026-03-02T09:31:38.103113+00:00,B2,training_style,eval,training_style_eval_039,3072,3072,1536,bf16,NVIDIA GeForce RTX 4060,c11,32,128,32,4,2,8,0.0,0.0,927.7440011501312,1016.4556652307509,31.248953603644544,3,3,3,4_4_4_r1,0,
2026-03-02T09:31:38.125519+00:00,B2,training_style,eval,training_style_eval_040,1536,1536,512,bf16,NVIDIA GeForce RTX 4060,c05,128,64,32,4,3,8,0.0,0.0,107.87199810147285,263.70751559734344,22.39616533038905,3,3,2,4_4_3_r1,0,
2026-03-02T09:31:38.247768+00:00,B2,training_style,eval,training_style_eval_041,3072,3072,2048,bf16,NVIDIA GeForce RTX 4060,c11,32,128,32,4,2,8,0.0,0.0,1261.5679502487183,1415.16739487648,30.640209000537165,3,3,3,4_4_4_r1,0,
2026-03-02T09:31:38.368159+00:00,B2,training_style,eval,training_style_eval_042,3072,4096,1536,bf16,NVIDIA GeForce RTX 4060,c11,32,128,32,4,2,8,0.0,0.0,1296.3839769363403,1345.5222249031067,29.817327544690997,3,3,3,4_4_4_r1,0,
2026-03-02T09:31:38.435501+00:00,B2,training_style,eval,training_style_eval_043,2048,3072,1536,bf16,NVIDIA GeForce RTX 4060,c11,32,128,32,4,2,8,0.0,0.0,637.9520297050476,757.7820819616315,30.295934383868737,3,3,3,4_4_4_r1,0,
2026-03-02T09:31:38.460569+00:00,B2,training_style,eval,training_style_eval_044,512,512,4096,bf16,NVIDIA GeForce RTX 4060,c07,128,128,32,8,3,8,0.0,0.0,128.00000607967377,318.1676855683324,16.77721520312504,2,2,3,3_3_4_r1,0,
2026-03-02T09:31:38.517637+00:00,B2,training_style,eval,training_style_eval_045,2048,1024,3072,bf16,NVIDIA GeForce RTX 4060,c04,64,64,64,4,3,8,0.0,0.0,428.51200699806213,538.1337672472,30.06894014070945,3,3,3,4_3_4_r2,0,
2026-03-02T09:31:38.851508+00:00,B2,training_style,eval,training_style_eval_046,4096,3072,4096,bf16,NVIDIA GeForce RTX 4060,c11,32,128,32,4,2,8,0.0,0.0,3530.2239656448364,3680.4403281211853,29.19905822042409,3,3,3,4_4_4_r1,0,
2026-03-02T09:31:38.895525+00:00,B2,training_style,eval,training_style_eval_047,1536,3072,1024,bf16,NVIDIA GeForce RTX 4060,c03,64,64,32,4,2,8,0.0,0.0,321.3599920272827,463.1983947753903,30.07118700444695,3,3,3,4_4_3_r0,0,
2026-03-02T09:31:38.917155+00:00,B2,training_style,eval,training_style_eval_048,512,512,3072,bf16,NVIDIA GeForce RTX 4060,c07,128,128,32,8,3,8,0.0,0.0,109.47199910879135,173.33279639482495,14.71255434368565,2,2,3,3_3_4_r1,0,
2026-03-02T09:31:38.949584+00:00,B2,training_style,eval,training_style_eval_049,512,1024,4096,bf16,NVIDIA GeForce RTX 4060,c04,64,64,64,4,3,8,0.0,0.0,180.2240014076233,192.48064532876015,23.831272541140724,2,3,3,3_3_4_r0,0,
2026-03-02T09:31:38.972929+00:00,B2,training_style,eval,training_style_eval_050,3072,2048,512,bf16,NVIDIA GeForce RTX 4060,c05,128,64,32,4,3,8,0.0,0.0,226.19199752807617,260.4851262271403,28.482223130817562,3,3,2,4_4_3_r1,0,
2026-03-02T09:31:38.981404+00:00,B2,training_style,eval,training_style_eval_051,512,512,1024,bf16,NVIDIA GeForce RTX 4060,c05,128,64,32,4,3,8,0.0,0.0,58.3840012550354,70.09152092039585,9.195514189834615,2,2,3,3_3_3_r1,0,
2026-03-02T09:31:39.019473+00:00,B2,training_style,eval,training_style_eval_052,1536,2048,1536,bf16,NVIDIA GeForce RTX 4060,c11,32,128,32,4,2,8,0.0,0.0,332.8000009059906,353.84319692850113,29.037489151719672,3,3,3,4_4_4_r1,0,
2026-03-02T09:31:39.122283+00:00,B2,training_style,eval,training_style_eval_053,1536,3072,3072,bf16,NVIDIA GeForce RTX 4060,c05,128,64,32,4,3,8,0.0,0.0,880.975991487503,927.4265569448471,32.907853934872236,3,3,3,4_4_4_r0,0,
2026-03-02T09:31:39.164526+00:00,B2,training_style,eval,training_style_eval_054,4096,3072,512,bf16,NVIDIA GeForce RTX 4060,c05,128,64,32,4,3,8,0.0,0.0,419.840008020401,467.33152478933323,30.69002868200663,3,3,2,4_4_3_r1,0,
2026-03-02T09:31:39.180322+00:00,B2,training_style,eval,training_style_eval_055,1024,1024,1024,bf16,NVIDIA GeForce RTX 4060,c05,128,64,32,4,3,8,0.0,0.0,101.3759970664978,112.18400061130522,21.1833541483331,3,3,3,3_3_3_r1,0,
2026-03-02T09:31:39.205509+00:00,B2,training_style,eval,training_style_eval_056,512,1024,3072,bf16,NVIDIA GeForce RTX 4060,c04,64,64,64,4,3,8,0.0,0.0,135.53600013256073,156.25216439366338,23.766567324175767,2,3,3,3_3_4_r0,0,
2026-03-02T09:31:39.223002+00:00,B2,training_style,eval,training_style_eval_057,1024,1536,1024,bf16,NVIDIA GeForce RTX 4060,c11,32,128,32,4,2,8,0.0,0.0,131.071999669075,155.3641594946384,24.576000062048433,3,3,3,3_4_3_r1,0,
2026-03-02T09:31:39.340153+00:00,B2,training_style,eval,training_style_eval_058,4096,2048,2048,bf16,NVIDIA GeForce RTX 4060,c03,64,64,32,4,2,8,0.0,0.0,1104.864001274109,1129.5744180679321,31.098613339177472,3,3,3,4_4_4_r2,0,
2026-03-02T09:31:39.366802+00:00,B2,training_style,eval,training_style_eval_059,2048,3072,512,bf16,NVIDIA GeForce RTX 4060,c05,128,64,32,4,3,8,0.0,0.0,233.8239997625351,340.36991119384766,27.55256496571253,3,3,2,4_4_3_r1,0,
2026-03-02T09:31:39.399938+00:00,B2,training_style,eval,training_style_eval_060,3072,3072,512,bf16,NVIDIA GeForce RTX 4060,c05,128,64,32,4,3,8,0.0,0.0,327.32801139354706,335.3926306962967,29.522913040220516,3,3,2,4_4_3_r1,0,
2026-03-02T09:31:39.473294+00:00,B2,training_style,eval,training_style_eval_061,2048,2048,2048,bf16,NVIDIA GeForce RTX 4060,c11,32,128,32,4,2,8,0.0,0.0,577.023983001709,700.018553137779,29.77323246536378,3,3,3,4_4_4_r1,0,
2026-03-02T09:31:39.486271+00:00,B2,training_style,eval,training_style_eval_062,1024,2048,512,bf16,NVIDIA GeForce RTX 4060,c06,64,128,32,4,3,8,0.0,0.0,95.23200243711472,155.86720392107958,22.55002092829104,3,3,2,3_4_3_r0,0,
2026-03-02T09:31:39.598927+00:00,B2,training_style,eval,training_style_eval_063,3072,1536,3072,bf16,NVIDIA GeForce RTX 4060,c03,64,64,32,4,2,8,0.0,0.0,887.8080248832703,1009.4591915607451,32.65461500171928,3,3,3,4_4_4_r2,0,
2026-03-02T09:31:39.608499+00:00,B2,adversarial,tune,adversarial_tune_000,1,1024,1024,bf16,NVIDIA GeForce RTX 4060,c00,32,32,32,2,2,8,0.0,0.0,17.823999747633934,72.02847946435205,0.11765888855998154,0,3,3,0_3_3_r0,0,
2026-03-02T09:31:39.626359+00:00,B2,adversarial,tune,adversarial_tune_001,1,1024,4096,bf16,NVIDIA GeForce RTX 4060,c00,32,32,32,2,2,8,0.0,0.0,60.256000608205795,98.68704311549655,0.13921614304513966,0,3,3,0_3_4_r0,0,
2026-03-02T09:31:39.641684+00:00,B2,adversarial,tune,adversarial_tune_002,1,4096,1024,bf16,NVIDIA GeForce RTX 4060,c00,32,32,32,2,2,8,0.0,0.0,39.31199945509434,94.99647855758661,0.21338543234317586,0,3,3,0_4_3_r0,0,
2026-03-02T09:31:39.733994+00:00,B2,adversarial,tune,adversarial_tune_003,1,4096,4096,bf16,NVIDIA GeForce RTX 4060,c11,32,128,32,4,2,8,0.0,0.0,161.27999871969223,250.4806466400623,0.2080507953023875,0,3,3,0_4_4_r0,0,
2026-03-02T09:31:39.776601+00:00,B2,adversarial,tune,adversarial_tune_004,1,8192,1024,bf16,NVIDIA GeForce RTX 4060,c00,32,32,32,2,2,8,0.0,0.0,47.10400104522705,82.18367878347628,0.3561739051400603,0,3,3,0_4_3_r0,0,
2026-03-02T09:31:39.942298+00:00,B2,adversarial,tune,adversarial_tune_005,1,8192,4096,bf16,NVIDIA GeForce RTX 4060,c11,32,128,32,4,2,8,0.0,0.0,294.9120104312897,399.45215702056873,0.22755554750672122,0,3,3,0_4_4_r0,0,
2026-03-02T09:31:39.951193+00:00,B2,adversarial,tune,adversarial_tune_006,2,1024,1024,bf16,NVIDIA GeForce RTX 4060,c00,32,32,32,2,2,8,0.0,0.0,26.623999699950218,130.10943934321404,0.15753846331390406,0,3,3,0_3_3_r0,0,
2026-03-02T09:31:39.970390+00:00,B2,adversarial,tune,adversarial_tune_007,2,1024,4096,bf16,NVIDIA GeForce RTX 4060,c00,32,32,32,2,2,8,0.0,0.0,67.99999997019768,177.8588800132274,0.2467237648140138,0,3,3,0_3_4_r0,0,
2026-03-02T09:31:39.987275+00:00,B2,adversarial,tune,adversarial_tune_008,2,4096,1024,bf16,NVIDIA GeForce RTX 4060,c00,32,32,32,2,2,8,0.0,0.0,41.9359989464283,67.68032204359767,0.40006715999378667,0,3,3,0_4_3_r0,0,
2026-03-02T09:31:40.075052+00:00,B2,adversarial,tune,adversarial_tune_009,2,4096,4096,bf16,NVIDIA GeForce RTX 4060,c11,32,128,32,4,2,8,0.0,0.0,163.83999586105347,270.0902342796324,0.4096000103473666,0,3,3,0_4_4_r0,0,
2026-03-02T09:31:40.114140+00:00,B2,adversarial,tune,adversarial_tune_010,2,8192,1024,bf16,NVIDIA GeForce RTX 4060,c00,32,32,32,2,2,8,0.0,0.0,49.15200173854828,131.02752223610875,0.6826666425201637,0,3,3,0_4_3_r0,0,
2026-03-02T09:31:40.280355+00:00,B2,adversarial,tune,adversarial_tune_011,2,8192,4096,bf16,NVIDIA GeForce RTX 4060,c11,32,128,32,4,2,8,0.0,0.0,292.86399483680725,413.3507248759269,0.4582937143734251,0,3,3,0_4_4_r0,0,
2026-03-02T09:31:40.288156+00:00,B2,adversarial,tune,adversarial_tune_012,4,1024,1024,bf16,NVIDIA GeForce RTX 4060,c00,32,32,32,2,2,8,0.0,0.0,37.88800165057182,89.40383948385707,0.22140539575998977,0,3,3,0_3_3_r0,0,
2026-03-02T09:31:40.307125+00:00,B2,adversarial,tune,adversarial_tune_013,4,1024,4096,bf16,NVIDIA GeForce RTX 4060,c00,32,32,32,2,2,8,0.0,0.0,64.51199948787689,166.50367707014072,0.5201269882559686,0,3,3,0_3_4_r0,0,
2026-03-02T09:31:40.324770+00:00,B2,adversarial,tune,adversarial_tune_014,4,4096,1024,bf16,NVIDIA GeForce RTX 4060,c00,32,32,32,2,2,8,0.0,0.0,39.824001491069794,103.27904053032388,0.8425680680914073,0,3,3,0_4_3_r0,0,
2026-03-02T09:31:40.410613+00:00,B2,adversarial,tune,adversarial_tune_015,4,4096,4096,bf16,NVIDIA GeForce RTX 4060,c11,32,128,32,4,2,8,0.0,0.0,159.743994474411,238.9737617969512,0.8402051572680562,0,3,3,0_4_4_r0,0,
2026-03-02T09:31:40.449798+00:00,B2,adversarial,tune,adversarial_tune_016,4,8192,1024,bf16,NVIDIA GeForce RTX 4060,c00,32,32,32,2,2,8,0.0,0.0,48.01600053906441,155.65632000565506,1.3976354391574575,0,3,3,0_4_3_r0,0,
2026-03-02T09:31:40.607920+00:00,B2,adversarial,tune,adversarial_tune_017,4,8192,4096,bf16,NVIDIA GeForce RTX 4060,c11,32,128,32,4,2,8,0.0,0.0,292.86399483680725,394.4182392954825,0.9165874287468502,0,3,3,0_4_4_r0,0,
2026-03-02T09:31:40.616173+00:00,B2,adversarial,tune,adversarial_tune_018,8,1024,1024,bf16,NVIDIA GeForce RTX 4060,c00,32,32,32,2,2,8,0.0,0.0,44.97599974274635,107.038718983531,0.3730259715395387,0,3,3,0_3_3_r0,0,
2026-03-02T09:31:40.635586+00:00,B2,adversarial,tune,adversarial_tune_019,8,1024,4096,bf16,NVIDIA GeForce RTX 4060,c00,32,32,32,2,2,8,0.0,0.0,64.495999366045,150.3129623830318,1.0405120419814844,0,3,3,0_3_4_r0,0,
2026-03-02T09:31:40.652364+00:00,B2,adversarial,tune,adversarial_tune_020,8,4096,1024,bf16,NVIDIA GeForce RTX 4060,c00,32,32,32,2,2,8,0.0,0.0,44.95999962091446,100.14719817787392,1.492634888030167,0,3,3,0_4_3_r0,0,
2026-03-02T09:31:40.735355+00:00,B2,adversarial,tune,adversarial_tune_021,8,4096,4096,bf16,NVIDIA GeForce RTX 4060,c11,32,128,32,4,2,8,0.0,0.0,160.73600202798843,295.89120239019394,1.6700393976033958,0,3,3,0_4_4_r0,0,
2026-03-02T09:31:40.776858+00:00,B2,adversarial,tune,adversarial_tune_022,8,8192,1024,bf16,NVIDIA GeForce RTX 4060,c00,32,32,32,2,2,8,0.0,0.0,53.247999399900436,155.26559352874756,2.520615413022465,0,3,3,0_4_3_r0,0,
2026-03-02T09:31:40.945045+00:00,B2,adversarial,tune,adversarial_tune_023,8,8192,4096,bf16,NVIDIA GeForce RTX 4060,c11,32,128,32,4,2,8,0.0,0.0,293.63200068473816,353.42976361513126,1.8283801177938315,0,3,3,0_4_4_r0,0,
2026-03-02T09:31:40.954537+00:00,B2,adversarial,tune,adversarial_tune_024,16,1024,1024,bf16,NVIDIA GeForce RTX 4060,c00,32,32,32,2,2,8,0.0,0.0,63.48799914121628,125.14848142862316,0.5285161361813422,0,3,3,0_3_3_r0,0,
2026-03-02T09:31:40.975499+00:00,B2,adversarial,tune,adversarial_tune_025,16,1024,4096,bf16,NVIDIA GeForce RTX 4060,c00,32,32,32,2,2,8,0.0,0.0,81.91999793052673,127.75680124759666,1.6384000413894664,0,3,3,0_3_4_r0,0,
2026-03-02T09:31:40.995982+00:00,B2,adversarial,tune,adversarial_tune_026,16,4096,1024,bf16,NVIDIA GeForce RTX 4060,c00,32,32,32,2,2,8,0.0,0.0,57.77600035071373,159.0355134010314,2.3230706034558852,0,3,3,0_4_3_r0,0,
2026-03-02T09:31:41.078662+00:00,B2,adversarial,tune,adversarial_tune_027,16,4096,4096,bf16,NVIDIA GeForce RTX 4060,c11,32,128,32,4,2,8,0.0,0.0,161.79199516773224,210.10431662201876,3.3182785801202197,0,3,3,0_4_4_r0,0,
2026-03-02T09:31:41.118168+00:00,B2,adversarial,tune,adversarial_tune_028,16,8192,1024,bf16,NVIDIA GeForce RTX 4060,c00,32,32,32,2,2,8,0.0,0.0,57.18399956822395,142.03903958201403,4.694240662193283,0,3,3,0_4_3_r0,0,
2026-03-02T09:31:41.283365+00:00,B2,adversarial,tune,adversarial_tune_029,16,8192,4096,bf16,NVIDIA GeForce RTX 4060,c11,32,128,32,4,2,8,0.0,0.0,295.3280061483383,398.11840325593937,3.6357602450364204,0,3,3,0_4_4_r0,0,
2026-03-02T09:31:41.292006+00:00,B2,adversarial,tune,adversarial_tune_030,32,1024,1024,bf16,NVIDIA GeForce RTX 4060,c04,64,64,64,4,3,8,0.0,0.0,33.663999289274216,70.21152153611183,1.993490536383826,0,3,3,1_3_3_r0,0,
2026-03-02T09:31:41.310204+00:00,B2,adversarial,tune,adversarial_tune_031,32,1024,4096,bf16,NVIDIA GeForce RTX 4060,c04,64,64,64,4,3,8,0.0,0.0,57.071998715400696,68.60800087451935,4.7034528672913565,0,3,3,1_3_4_r0,0,
2026-03-02T09:31:41.318595+00:00,B2,adversarial,eval,adversarial_eval_000,1,1024,1024,bf16,NVIDIA GeForce RTX 4060,c00,32,32,32,2,2,8,0.0,0.0,31.74399957060814,114.58431761711813,0.06606451702266777,0,3,3,0_3_3_r0,0,
2026-03-02T09:31:41.337502+00:00,B2,adversarial,eval,adversarial_eval_001,1,1024,4096,bf16,NVIDIA GeForce RTX 4060,c00,32,32,32,2,2,8,0.0,0.0,82.39999786019325,177.53503620624534,0.10180349778931812,0,3,3,0_3_4_r0,0,
2026-03-02T09:31:41.353425+00:00,B2,adversarial,eval,adversarial_eval_002,1,4096,1024,bf16,NVIDIA GeForce RTX 4060,c00,32,32,32,2,2,8,0.0,0.0,41.999999433755875,75.12768097221849,0.19972876459750571,0,3,3,0_4_3_r0,0,
2026-03-02T09:31:41.438428+00:00,B2,adversarial,eval,adversarial_eval_003,1,4096,4096,bf16,NVIDIA GeForce RTX 4060,c11,32,128,32,4,2,8,0.0,0.0,165.76000303030014,194.24256235361094,0.20242779552716592,0,3,3,0_4_4_r0,0,
2026-03-02T09:31:41.479556+00:00,B2,adversarial,eval,adversarial_eval_004,1,8192,1024,bf16,NVIDIA GeForce RTX 4060,c00,32,32,32,2,2,8,0.0,0.0,63.40799853205681,108.9375987648963,0.2645914772332396,0,3,3,0_4_3_r0,0,
2026-03-02T09:31:41.651428+00:00,B2,adversarial,eval,adversarial_eval_005,1,8192,4096,bf16,NVIDIA GeForce RTX 4060,c11,32,128,32,4,2,8,0.0,0.0,295.29599845409393,337.1295946836471,0.22725964574976318,0,3,3,0_4_4_r0,0,
2026-03-02T09:31:41.661335+00:00,B2,adversarial,eval,adversarial_eval_006,2,1024,1024,bf16,NVIDIA GeForce RTX 4060,c00,32,32,32,2,2,8,0.0,0.0,53.60000021755695,194.3449549376964,0.07825193998089079,0,3,3,0_3_3_r0,0,
2026-03-02T09:31:41.683090+00:00,B2,adversarial,eval,adversarial_eval_007,2,1024,4096,bf16,NVIDIA GeForce RTX 4060,c00,32,32,32,2,2,8,0.0,0.0,88.06400001049042,618.0966185033303,0.1905116278842825,0,3,3,0_3_4_r0,0,
2026-03-02T09:31:41.702192+00:00,B2,adversarial,eval,adversarial_eval_008,2,4096,1024,bf16,NVIDIA GeForce RTX 4060,c00,32,32,32,2,2,8,0.0,0.0,65.96799939870834,140.3324784338474,0.25432355313064864,0,3,3,0_4_3_r0,0,
2026-03-02T09:31:41.788071+00:00,B2,adversarial,eval,adversarial_eval_009,2,4096,4096,bf16,NVIDIA GeForce RTX 4060,c11,32,128,32,4,2,8,0.0,0.0,170.912005007267,416.20287120342226,0.3926515518739986,0,3,3,0_4_4_r0,0,
2026-03-02T09:31:41.830884+00:00,B2,adversarial,eval,adversarial_eval_010,2,8192,1024,bf16,NVIDIA GeForce RTX 4060,c00,32,32,32,2,2,8,0.0,0.0,69.60000097751617,101.80607706308356,0.4821039012749373,0,3,3,0_4_3_r0,0,
2026-03-02T09:31:42.007899+00:00,B2,adversarial,eval,adversarial_eval_011,2,8192,4096,bf16,NVIDIA GeForce RTX 4060,c11,32,128,32,4,2,8,0.0,0.0,470.5120027065277,501.3811218738556,0.28525888229830254,0,3,3,0_4_4_r0,0,
2026-03-02T09:31:42.017228+00:00,B2,adversarial,eval,adversarial_eval_012,4,1024,1024,bf16,NVIDIA GeForce RTX 4060,c00,32,32,32,2,2,8,0.0,0.0,44.03200000524521,60.900799520313726,0.1905116278842825,0,3,3,0_3_3_r0,0,
2026-03-02T09:31:42.038772+00:00,B2,adversarial,eval,adversarial_eval_013,4,1024,4096,bf16,NVIDIA GeForce RTX 4060,c00,32,32,32,2,2,8,0.0,0.0,95.60000151395798,239.23711478710152,0.3509877768684022,0,3,3,0_3_4_r0,0,
2026-03-02T09:31:42.057948+00:00,B2,adversarial,eval,adversarial_eval_014,4,4096,1024,bf16,NVIDIA GeForce RTX 4060,c00,32,32,32,2,2,8,0.0,0.0,56.19199946522713,155.85887715220449,0.5971389578469127,0,3,3,0_4_3_r0,0,
2026-03-02T09:31:42.145964+00:00,B2,adversarial,eval,adversarial_eval_015,4,4096,4096,bf16,NVIDIA GeForce RTX 4060,c11,32,128,32,4,2,8,0.0,0.0,250.83200633525848,296.28032267093647,0.5350901185258092,0,3,3,0_4_4_r0,0,
2026-03-02T09:31:42.187186+00:00,B2,adversarial,eval,adversarial_eval_016,4,8192,1024,bf16,NVIDIA GeForce RTX 4060,c00,32,32,32,2,2,8,0.0,0.0,73.12000170350075,116.54143460094923,0.9177907882459342,0,3,3,0_4_3_r0,0,
2026-03-02T09:31:42.358193+00:00,B2,adversarial,eval,adversarial_eval_017,4,8192,4096,bf16,NVIDIA GeForce RTX 4060,c11,32,128,32,4,2,8,0.0,0.0,470.0160026550293,609.0240162611008,0.5711198224819157,0,3,3,0_4_4_r0,0,
2026-03-02T09:31:42.368885+00:00,B2,adversarial,eval,adversarial_eval_018,8,1024,1024,bf16,NVIDIA GeForce RTX 4060,c00,32,32,32,2,2,8,0.0,0.0,60.815999284386635,146.51776537299156,0.2758684589156662,0,3,3,0_3_3_r0,0,
2026-03-02T09:31:42.390959+00:00,B2,adversarial,eval,adversarial_eval_019,8,1024,4096,bf16,NVIDIA GeForce RTX 4060,c00,32,32,32,2,2,8,0.0,0.0,95.61600163578987,200.94976082444185,0.7018580870555937,0,3,3,0_3_4_r0,0,
2026-03-02T09:31:42.410597+00:00,B2,adversarial,eval,adversarial_eval_020,8,4096,1024,bf16,NVIDIA GeForce RTX 4060,c00,32,32,32,2,2,8,0.0,0.0,69.63199935853481,129.5462429523468,0.9637647147607641,0,3,3,0_4_3_r0,0,
2026-03-02T09:31:42.502838+00:00,B2,adversarial,eval,adversarial_eval_021,8,4096,4096,bf16,NVIDIA GeForce RTX 4060,c11,32,128,32,4,2,8,0.0,0.0,251.77600979804993,394.1888031363486,1.0661677266841771,0,3,3,0_4_4_r0,0,
2026-03-02T09:31:42.545127+00:00,B2,adversarial,eval,adversarial_eval_022,8,8192,1024,bf16,NVIDIA GeForce RTX 4060,c00,32,32,32,2,2,8,0.0,0.0,58.36800113320351,179.80416491627693,2.2995087272853048,0,3,3,0_4_3_r0,0,
2026-03-02T09:31:42.715447+00:00,B2,adversarial,eval,adversarial_eval_023,8,8192,4096,bf16,NVIDIA GeForce RTX 4060,c11,32,128,32,4,2,8,0.0,0.0,456.7039906978607,562.4447804689407,1.1755336562302452,0,3,3,0_4_4_r0,0,
2026-03-02T09:31:42.724889+00:00,B2,adversarial,eval,adversarial_eval_024,16,1024,1024,bf16,NVIDIA GeForce RTX 4060,c00,32,32,32,2,2,8,0.0,0.0,40.95999896526337,121.44640371203411,0.8192000206947332,0,3,3,0_3_3_r0,0,
2026-03-02T09:31:42.748640+00:00,B2,adversarial,eval,adversarial_eval_025,16,1024,4096,bf16,NVIDIA GeForce RTX 4060,c00,32,32,32,2,2,8,0.0,0.0,102.83199697732925,192.01024174690247,1.3052136683642366,0,3,3,0_3_4_r0,0,
2026-03-02T09:31:42.767472+00:00,B2,adversarial,eval,adversarial_eval_026,16,4096,1024,bf16,NVIDIA GeForce RTX 4060,c00,32,32,32,2,2,8,0.0,0.0,61.43999844789505,235.07968127727509,2.1845333885192884,0,3,3,0_4_3_r0,0,
2026-03-02T09:31:42.859633+00:00,B2,adversarial,eval,adversarial_eval_027,16,4096,4096,bf16,NVIDIA GeForce RTX 4060,c11,32,128,32,4,2,8,0.0,0.0,257.02399015426636,349.8092818260193,2.0887968927638583,0,3,3,0_4_4_r0,0,
2026-03-02T09:31:42.901592+00:00,B2,adversarial,eval,adversarial_eval_028,16,8192,1024,bf16,NVIDIA GeForce RTX 4060,c00,32,32,32,2,2,8,0.0,0.0,88.06400001049042,134.0431959182023,3.04818604614852,0,3,3,0_4_3_r0,0,
2026-03-02T09:31:43.076649+00:00,B2,adversarial,eval,adversarial_eval_029,16,8192,4096,bf16,NVIDIA GeForce RTX 4060,c11,32,128,32,4,2,8,0.0,0.0,477.1520048379898,602.026874423027,2.2503139735618922,0,3,3,0_4_4_r0,0,
2026-03-02T09:31:43.087641+00:00,B2,adversarial,eval,adversarial_eval_030,32,1024,1024,bf16,NVIDIA GeForce RTX 4060,c04,64,64,64,4,3,8,0.0,0.0,75.68000257015228,122.4288001656532,0.8867450015979164,0,3,3,1_3_3_r0,0,
2026-03-02T09:31:43.111952+00:00,B2,adversarial,eval,adversarial_eval_031,32,1024,4096,bf16,NVIDIA GeForce RTX 4060,c04,64,64,64,4,3,8,0.0,0.0,118.24000254273415,289.5769572257995,2.270259220461217,0,3,3,1_3_4_r0,0,
2026-03-02T09:31:43.134011+00:00,B2,adversarial,eval,adversarial_eval_032,32,4096,1024,bf16,NVIDIA GeForce RTX 4060,c04,64,64,64,4,3,8,0.0,0.0,88.06400001049042,194.11968231201172,3.04818604614852,0,3,3,1_4_3_r0,0,
2026-03-02T09:31:43.226285+00:00,B2,adversarial,eval,adversarial_eval_033,32,4096,4096,bf16,NVIDIA GeForce RTX 4060,c04,64,64,64,4,3,8,0.0,0.0,266.2400007247925,358.0620855093,4.03298460440551,0,3,3,1_4_4_r0,0,
2026-03-02T09:31:43.271159+00:00,B2,adversarial,eval,adversarial_eval_034,32,8192,1024,bf16,NVIDIA GeForce RTX 4060,c04,64,64,64,4,3,8,0.0,0.0,137.2159942984581,253.53215187787967,3.9125971774999764,0,3,3,1_4_3_r0,0,
2026-03-02T09:31:43.442771+00:00,B2,adversarial,eval,adversarial_eval_035,32,8192,4096,bf16,NVIDIA GeForce RTX 4060,c04,64,64,64,4,3,8,0.0,0.0,519.1360116004944,620.2879828214645,4.136649355877501,0,3,3,1_4_4_r0,0,
2026-03-02T09:31:45.779744+00:00,B2,adversarial,eval,adversarial_eval_036,1024,1,512,bf16,NVIDIA GeForce RTX 4060,c00,32,32,32,2,2,8,0.0,2336.913,49.15200173854828,88.95744081586588,0.021333332578755117,3,0,2,3_0_3_r2,0,anchor_skipped
2026-03-02T09:31:46.015870+00:00,B2,adversarial,eval,adversarial_eval_037,1024,1,2048,bf16,NVIDIA GeForce RTX 4060,c09,128,64,64,8,3,8,0.0,236.08,68.64000111818314,117.18656226992599,0.06110582651038018,3,0,3,3_0_4_r2,0,anchor_skipped
2026-03-02T09:31:46.080815+00:00,B2,adversarial,eval,adversarial_eval_038,2048,1,512,bf16,NVIDIA GeForce RTX 4060,c00,32,32,32,2,2,8,0.0,64.89,37.96800039708614,105.97471803426741,0.055234723400417636,3,0,2,4_0_3_r2,0,anchor_skipped
2026-03-02T09:31:46.177554+00:00,B2,adversarial,eval,adversarial_eval_039,2048,1,2048,bf16,NVIDIA GeForce RTX 4060,c00,32,32,32,2,2,8,0.0,96.695,59.39200147986412,62.38560002297163,0.14124137579104856,3,0,3,4_0_4_r2,0,anchor_skipped
2026-03-02T09:31:46.194502+00:00,B2,adversarial,eval,adversarial_eval_040,4096,1,512,bf16,NVIDIA GeForce RTX 4060,c00,32,32,32,2,2,8,0.0,0.0,37.88800165057182,134.60095673799515,0.11070269787999489,3,0,2,4_0_3_r2,0,
2026-03-02T09:31:46.241999+00:00,B2,adversarial,eval,adversarial_eval_041,4096,1,2048,bf16,NVIDIA GeForce RTX 4060,c00,32,32,32,2,2,8,0.0,0.0,65.42399898171425,258.8262333720917,0.25643825295193534,3,0,3,4_0_4_r2,0,
2026-03-02T09:31:46.377338+00:00,B2,adversarial,eval,adversarial_eval_042,1024,2,512,bf16,NVIDIA GeForce RTX 4060,c00,32,32,32,2,2,8,0.0,0.0,40.95999896526337,148.89376506209354,0.051200001293420824,3,0,2,3_0_3_r2,0,
2026-03-02T09:31:46.568440+00:00,B2,adversarial,eval,adversarial_eval_043,1024,2,2048,bf16,NVIDIA GeForce RTX 4060,c09,128,64,64,8,3,8,0.0,0.0,87.0399996638298,145.52736148238182,0.09637647096046527,3,0,3,3_0_4_r2,0,
2026-03-02T09:31:46.585551+00:00,B2,adversarial,eval,adversarial_eval_044,2048,2,512,bf16,NVIDIA GeForce RTX 4060,c00,32,32,32,2,2,8,0.0,0.0,43.83999854326248,128.51839728653428,0.09567299587980024,3,0,2,4_0_3_r2,0,
2026-03-02T09:31:46.607315+00:00,B2,adversarial,eval,adversarial_eval_045,2048,2,2048,bf16,NVIDIA GeForce RTX 4060,c00,32,32,32,2,2,8,0.0,0.0,74.73600283265114,118.88639919459817,0.22448639697211986,3,0,3,4_0_4_r2,0,
2026-03-02T09:31:46.618476+00:00,B2,adversarial,eval,adversarial_eval_046,4096,2,512,bf16,NVIDIA GeForce RTX 4060,c00,32,32,32,2,2,8,0.0,0.0,36.639999598264694,46.10048070549965,0.22894672740109126,3,0,2,4_0_3_r2,0,
2026-03-02T09:31:46.663746+00:00,B2,adversarial,eval,adversarial_eval_047,4096,2,2048,bf16,NVIDIA GeForce RTX 4060,c00,32,32,32,2,2,8,0.0,0.0,58.36800113320351,169.53024029731745,0.5748771818213262,3,0,3,4_0_4_r2,0,
2026-03-02T09:31:46.671338+00:00,B2,adversarial,eval,adversarial_eval_048,1024,4,512,bf16,NVIDIA GeForce RTX 4060,c00,32,32,32,2,2,8,0.0,0.0,38.7520007789135,98.77152241766441,0.10823451475264956,3,0,2,3_0_3_r2,0,
2026-03-02T09:31:46.686217+00:00,B2,adversarial,eval,adversarial_eval_049,1024,4,2048,bf16,NVIDIA GeForce RTX 4060,c09,128,64,64,8,3,8,0.0,0.0,110.59200018644333,195.16416266560555,0.15170370344795153,3,0,3,3_0_4_r2,0,
2026-03-02T09:31:46.694413+00:00,B2,adversarial,eval,adversarial_eval_050,2048,4,512,bf16,NVIDIA GeForce RTX 4060,c00,32,32,32,2,2,8,0.0,0.0,42.79999993741512,99.02431722730383,0.19599551430528867,3,0,2,4_0_3_r2,0,
2026-03-02T09:31:46.714065+00:00,B2,adversarial,eval,adversarial_eval_051,2048,4,2048,bf16,NVIDIA GeForce RTX 4060,c00,32,32,32,2,2,8,0.0,0.0,75.77600330114365,132.47264191508282,0.44281079151997954,3,0,3,4_0_4_r2,0,
2026-03-02T09:31:46.727097+00:00,B2,adversarial,eval,adversarial_eval_052,4096,4,512,bf16,NVIDIA GeForce RTX 4060,c00,32,32,32,2,2,8,0.0,0.0,56.32000043988228,177.87904426455492,0.29789090676425906,3,0,2,4_0_3_r2,0,
2026-03-02T09:31:46.768839+00:00,B2,adversarial,eval,adversarial_eval_053,4096,4,2048,bf16,NVIDIA GeForce RTX 4060,c00,32,32,32,2,2,8,0.0,0.0,80.89599758386612,128.26368145644656,0.8295696450300549,3,0,3,4_0_4_r2,0,
2026-03-02T09:31:46.775551+00:00,B2,adversarial,eval,adversarial_eval_054,1024,8,512,bf16,NVIDIA GeForce RTX 4060,c00,32,32,32,2,2,8,0.0,0.0,45.05600035190582,149.75999824702726,0.1861818167276619,3,0,2,3_0_3_r2,0,
2026-03-02T09:31:46.789029+00:00,B2,adversarial,eval,adversarial_eval_055,1024,8,2048,bf16,NVIDIA GeForce RTX 4060,c09,128,64,64,8,3,8,0.0,0.0,88.06400001049042,134.79328408837304,0.381023255768565,3,0,3,3_0_4_r2,0,
2026-03-02T09:31:46.796034+00:00,B2,adversarial,eval,adversarial_eval_056,2048,8,512,bf16,NVIDIA GeForce RTX 4060,c00,32,32,32,2,2,8,0.0,0.0,39.93599861860275,54.81824118643996,0.4201025786340281,3,0,2,4_0_3_r2,0,
2026-03-02T09:31:46.816048+00:00,B2,adversarial,eval,adversarial_eval_057,2048,8,2048,bf16,NVIDIA GeForce RTX 4060,c00,32,32,32,2,2,8,0.0,0.0,99.66399893164635,179.72671672701833,0.6733511069129989,3,0,3,4_0_4_r2,0,
2026-03-02T09:31:46.828939+00:00,B2,adversarial,eval,adversarial_eval_058,4096,8,512,bf16,NVIDIA GeForce RTX 4060,c00,32,32,32,2,2,8,0.0,0.0,50.00000074505806,115.03840051591388,0.6710886300000003,3,0,2,4_0_3_r2,0,
2026-03-02T09:31:46.874392+00:00,B2,adversarial,eval,adversarial_eval_059,4096,8,2048,bf16,NVIDIA GeForce RTX 4060,c00,32,32,32,2,2,8,0.0,0.0,87.0399996638298,201.17855042219134,1.5420235353674443,3,0,3,4_0_4_r2,0,
2026-03-02T09:31:47.020343+00:00,B2,adversarial,eval,adversarial_eval_060,64,64,8192,bf16,NVIDIA GeForce RTX 4060,c04,64,64,64,4,3,8,0.0,145.892,90.11200070381165,107.09888219833371,0.7447272669106476,1,1,3,1_1_4_r1,0,
2026-03-02T09:31:47.037056+00:00,B2,adversarial,eval,adversarial_eval_061,128,128,8192,bf16,NVIDIA GeForce RTX 4060,c04,64,64,64,4,3,8,0.0,0.0,84.99199897050858,101.31808012723923,3.158361484039746,1,1,3,2_2_4_r1,0,
2026-03-02T09:31:47.304036+00:00,B2,adversarial,eval,adversarial_eval_062,2048,128,8192,bf16,NVIDIA GeForce RTX 4060,c04,64,64,64,4,3,8,0.0,266.938,183.05599689483643,198.6582428216934,23.462587234808865,3,1,3,4_2_4_r2,0,anchor_skipped
2026-03-02T09:31:47.408190+00:00,B2,adversarial,eval,adversarial_eval_063,128,2048,8192,bf16,NVIDIA GeForce RTX 4060,c06,64,128,32,4,3,8,0.0,0.0,223.9520028233528,324.1369503736495,19.17807048766495,1,3,3,2_4_4_r0,0,
