results/B2_sweep_a02_k4.csv
timestamp,method,workload,split,shape_id,M,N,K,dtype,gpu,config_id,BLOCK_M,BLOCK_N,BLOCK_K,num_warps,num_stages,GROUP_M,compile_time_ms,tune_time_ms,runtime_cost_us,p99_us,runtime_perf_tflops,bucket_m,bucket_n,bucket_k,cache_key,invalid_config,notes
2026-03-02T09:30:14.944663+00:00,B2,uniform,tune,uniform_tune_000,1536,512,1024,bf16,NVIDIA GeForce RTX 4060,c09,128,64,64,8,3,8,161.16275393869728,2711.67,89.91999924182892,215.69823756813997,17.911618656362005,3,2,3,4_3_3_r2,0,
2026-03-02T09:30:16.493751+00:00,B2,uniform,tune,uniform_tune_001,1536,1536,2048,bf16,NVIDIA GeForce RTX 4060,c11,32,128,32,4,2,8,0.0,1549.033,333.8240087032318,376.94881170988083,28.948416423190725,3,3,3,4_4_4_r1,0,
2026-03-02T09:30:17.019444+00:00,B2,uniform,tune,uniform_tune_002,384,2048,1536,bf16,NVIDIA GeForce RTX 4060,c05,128,64,32,4,3,8,0.0,525.627,126.96000188589096,198.1235197186469,19.028978167244976,2,3,3,3_4_4_r0,0,
2026-03-02T09:30:17.106334+00:00,B2,uniform,tune,uniform_tune_003,1536,64,3072,bf16,NVIDIA GeForce RTX 4060,c04,64,64,64,4,3,8,0.0,86.842,53.247999399900436,145.57567536830894,11.342769358601092,3,1,3,4_1_4_r2,0,anchor_skipped
2026-03-02T09:30:17.224133+00:00,B2,uniform,tune,uniform_tune_004,768,128,2048,bf16,NVIDIA GeForce RTX 4060,c02,32,64,32,2,2,8,0.0,117.748,52.22399905323982,117.44416095316392,7.710117786834262,3,1,3,3_2_4_r2,0,
2026-03-02T09:30:17.239493+00:00,B2,uniform,tune,uniform_tune_005,512,128,4096,bf16,NVIDIA GeForce RTX 4060,c02,32,64,32,2,2,8,0.0,0.0,73.55200126767159,161.36064469814295,7.299201962516438,2,1,3,3_2_4_r2,0,
2026-03-02T09:30:18.137557+00:00,B2,uniform,tune,uniform_tune_006,2048,1024,4096,bf16,NVIDIA GeForce RTX 4060,c04,64,64,64,4,3,8,0.0,898.017,572.8960037231445,673.4233570098875,29.98776230302049,3,3,3,4_3_4_r2,0,
2026-03-02T09:30:18.211290+00:00,B2,uniform,tune,uniform_tune_007,128,768,512,bf16,NVIDIA GeForce RTX 4060,c09,128,64,64,8,3,8,0.0,73.682,36.86400130391121,59.41248148679733,2.730666570080655,1,3,2,2_3_3_r0,0,
2026-03-02T09:30:18.255460+00:00,B2,uniform,tune,uniform_tune_008,2048,256,64,bf16,NVIDIA GeForce RTX 4060,c05,128,64,32,4,3,8,0.0,44.134,31.10400028526783,44.994879737496376,2.157563766220308,3,2,1,4_2_1_r2,0,anchor_skipped
2026-03-02T09:30:18.368528+00:00,B2,uniform,tune,uniform_tune_009,192,768,2048,bf16,NVIDIA GeForce RTX 4060,c04,64,64,64,4,3,8,0.0,113.028,53.31199988722801,58.68640158325434,11.329152484949187,2,3,3,2_3_4_r0,0,
2026-03-02T09:30:18.619135+00:00,B2,uniform,tune,uniform_tune_010,1024,1024,1536,bf16,NVIDIA GeForce RTX 4060,c05,128,64,32,4,3,8,0.0,250.556,138.39999586343765,158.32544133067128,23.274751215877597,3,3,3,3_3_4_r1,0,
2026-03-02T09:30:18.695033+00:00,B2,uniform,tune,uniform_tune_011,256,384,768,bf16,NVIDIA GeForce RTX 4060,c11,32,128,32,4,2,8,0.0,75.842,35.840000957250595,45.40800090879202,4.21302845890279,2,2,3,2_3_3_r1,0,
2026-03-02T09:30:18.786290+00:00,B2,uniform,tune,uniform_tune_012,64,192,2048,bf16,NVIDIA GeForce RTX 4060,c04,64,64,64,4,3,8,0.0,91.211,45.05600035190582,53.72319921851158,1.1170909003659715,1,2,3,1_2_4_r0,0,
2026-03-02T09:30:18.853713+00:00,B2,uniform,tune,uniform_tune_013,192,128,512,bf16,NVIDIA GeForce RTX 4060,c11,32,128,32,4,2,8,0.0,67.38,35.66399961709976,50.18047947436569,0.7056366159204921,2,1,2,2_2_3_r1,0,
2026-03-02T09:30:18.860405+00:00,B2,uniform,tune,uniform_tune_014,128,128,1024,bf16,NVIDIA GeForce RTX 4060,c11,32,128,32,4,2,8,0.0,0.0,43.07200014591217,248.9401663839814,0.7790312009270494,1,1,3,2_2_3_r1,0,
2026-03-02T09:30:19.589462+00:00,B2,uniform,tune,uniform_tune_015,3072,3072,768,bf16,NVIDIA GeForce RTX 4060,c03,64,64,32,4,2,8,0.0,729.01,488.48000168800354,525.3324866294861,29.67473504321352,3,3,3,4_4_3_r1,0,
2026-03-02T09:30:19.703138+00:00,B2,uniform,tune,uniform_tune_016,256,128,3072,bf16,NVIDIA GeForce RTX 4060,c04,64,64,64,4,3,8,0.0,113.625,56.32000043988228,65.43583877384661,3.5746908811711084,2,1,3,2_2_4_r2,0,
2026-03-02T09:30:19.746033+00:00,B2,uniform,tune,uniform_tune_017,96,1024,192,bf16,NVIDIA GeForce RTX 4060,c03,64,64,32,4,2,8,0.0,42.853,31.74399957060814,39.64191980659961,1.18916130640802,1,3,2,2_3_2_r0,0,anchor_skipped
2026-03-02T09:30:19.795291+00:00,B2,uniform,tune,uniform_tune_018,64,64,192,bf16,NVIDIA GeForce RTX 4060,c04,64,64,64,4,3,8,0.0,49.223,30.719999223947525,40.89888025075197,0.05120000129342083,1,1,2,1_1_2_r1,0,
2026-03-02T09:30:19.839881+00:00,B2,uniform,tune,uniform_tune_019,4096,64,64,bf16,NVIDIA GeForce RTX 4060,c03,64,64,32,4,2,8,0.0,44.561,30.719999223947525,57.676159925758796,1.0922666942596442,3,1,1,4_1_1_r2,0,anchor_skipped
2026-03-02T09:30:20.033970+00:00,B2,uniform,tune,uniform_tune_020,128,4096,3072,bf16,NVIDIA GeForce RTX 4060,c06,64,128,32,4,3,8,0.0,194.037,140.00000059604645,204.35967847704887,23.008753273469388,1,3,3,2_4_4_r0,0,anchor_skipped
2026-03-02T09:30:20.074899+00:00,B2,uniform,tune,uniform_tune_021,192,2048,3072,bf16,NVIDIA GeForce RTX 4060,c06,64,128,32,4,3,8,0.0,0.0,103.42399775981903,147.6710375398396,23.359366842601418,2,3,3,2_4_4_r0,0,
2026-03-02T09:30:20.129387+00:00,B2,uniform,tune,uniform_tune_022,1536,2048,2048,bf16,NVIDIA GeForce RTX 4060,c11,32,128,32,4,2,8,0.0,0.0,408.4480106830597,450.16225069761276,31.546002308720265,3,3,3,4_4_4_r1,0,
2026-03-02T09:30:20.141184+00:00,B2,uniform,tune,uniform_tune_023,256,1024,1024,bf16,NVIDIA GeForce RTX 4060,c09,128,64,64,8,3,8,0.0,0.0,58.22400003671646,167.8656013309955,9.220783725979757,2,3,3,2_3_3_r0,0,
2026-03-02T09:30:20.215763+00:00,B2,uniform,tune,uniform_tune_024,768,128,384,bf16,NVIDIA GeForce RTX 4060,c06,64,128,32,4,3,8,0.0,74.536,35.74400022625923,38.91679998487234,2.1121718756183308,3,1,2,3_2_3_r2,0,
2026-03-02T09:30:20.284176+00:00,B2,uniform,tune,uniform_tune_025,256,96,384,bf16,NVIDIA GeForce RTX 4060,c11,32,128,32,4,2,8,0.0,68.374,34.81600061058998,59.79679904878135,0.5421176375513672,2,1,2,2_2_3_r2,0,
2026-03-02T09:30:20.300320+00:00,B2,uniform,tune,uniform_tune_026,96,1024,3072,bf16,NVIDIA GeForce RTX 4060,c04,64,64,64,4,3,8,0.0,0.0,74.75200295448303,110.54463669657699,8.079780502574186,1,3,3,2_3_4_r0,0,
2026-03-02T09:30:20.346728+00:00,B2,uniform,tune,uniform_tune_027,1536,512,4096,bf16,NVIDIA GeForce RTX 4060,c04,64,64,64,4,3,8,0.0,0.0,201.7280012369156,231.3507191836834,31.936324677275653,3,2,3,4_3_4_r2,0,
2026-03-02T09:30:20.407082+00:00,B2,uniform,tune,uniform_tune_028,128,64,192,bf16,NVIDIA GeForce RTX 4060,c02,32,64,32,2,2,8,0.0,60.287,30.719999223947525,61.06240060180424,0.10240000258684166,1,1,2,2_1_2_r2,0,
2026-03-02T09:30:20.497689+00:00,B2,uniform,tune,uniform_tune_029,192,256,1536,bf16,NVIDIA GeForce RTX 4060,c04,64,64,64,4,3,8,0.0,90.564,42.95999929308891,47.66719933599232,3.5147799461042113,2,2,3,2_2_4_r1,0,
2026-03-02T09:30:20.567713+00:00,B2,uniform,tune,uniform_tune_030,4096,64,3072,bf16,NVIDIA GeForce RTX 4060,c04,64,64,64,4,3,8,0.0,0.0,117.69600212574005,209.94752272963518,13.684515250393199,3,1,3,4_1_4_r2,0,
2026-03-02T09:30:20.644579+00:00,B2,uniform,tune,uniform_tune_031,384,128,96,bf16,NVIDIA GeForce RTX 4060,c02,32,64,32,2,2,8,0.0,76.8,34.81600061058998,109.12383817136282,0.2710588187756836,2,1,1,3_2_2_r2,0,
2026-03-02T09:30:20.776859+00:00,B2,uniform,eval,uniform_eval_000,512,4096,768,bf16,NVIDIA GeForce RTX 4060,c06,64,128,32,4,3,8,0.0,131.731,130.048006772995,146.09408095479006,24.76951052100939,2,3,3,3_4_3_r0,0,anchor_skipped
2026-03-02T09:30:20.841247+00:00,B2,uniform,eval,uniform_eval_001,384,512,64,bf16,NVIDIA GeForce RTX 4060,c10,64,128,64,8,3,8,0.0,64.336,29.69600073993206,42.92864080518484,0.8474482547462914,2,2,1,3_3_1_r1,0,
2026-03-02T09:30:20.914078+00:00,B2,uniform,eval,uniform_eval_002,256,4096,384,bf16,NVIDIA GeForce RTX 4060,c06,64,128,32,4,3,8,0.0,72.794,59.39200147986412,74.60000164806843,13.559172075940662,2,3,2,2_4_3_r0,0,anchor_skipped
2026-03-02T09:30:21.012862+00:00,B2,uniform,eval,uniform_eval_003,384,768,512,bf16,NVIDIA GeForce RTX 4060,c03,64,64,32,4,2,8,0.0,98.739,41.98399931192398,47.51200035214424,7.1929757276418185,2,3,2,3_3_3_r0,0,
2026-03-02T09:30:21.078873+00:00,B2,uniform,eval,uniform_eval_004,768,1024,96,bf16,NVIDIA GeForce RTX 4060,c09,128,64,64,8,3,8,0.0,65.959,36.639999598264694,44.90112077444791,4.121041093219643,3,3,1,3_3_2_r1,0,
2026-03-02T09:30:21.267805+00:00,B2,uniform,eval,uniform_eval_005,3072,3072,128,bf16,NVIDIA GeForce RTX 4060,c09,128,64,64,8,3,8,0.0,188.884,113.66400122642517,120.87295986711979,21.2549186895801,3,3,1,4_4_2_r1,0,
2026-03-02T09:30:21.275879+00:00,B2,uniform,eval,uniform_eval_006,256,96,512,bf16,NVIDIA GeForce RTX 4060,c11,32,128,32,4,2,8,0.0,0.0,66.54400005936623,166.36992424726478,0.3781832167821094,2,1,2,2_2_3_r2,0,
2026-03-02T09:30:21.707079+00:00,B2,uniform,eval,uniform_eval_007,4096,4096,4096,bf16,NVIDIA GeForce RTX 4060,c11,32,128,32,4,2,8,0.0,0.0,4792.831897735596,4908.861503601074,28.6759386526646,3,3,3,4_4_4_r1,0,
2026-03-02T09:30:21.763469+00:00,B2,uniform,eval,uniform_eval_008,128,96,64,bf16,NVIDIA GeForce RTX 4060,c04,64,64,64,4,3,8,0.0,56.333,29.008000157773495,83.45951955765474,0.05422173164110755,1,1,1,2_2_1_r1,0,
2026-03-02T09:30:21.827997+00:00,B2,uniform,eval,uniform_eval_009,3072,384,96,bf16,NVIDIA GeForce RTX 4060,c05,128,64,32,4,3,8,0.0,64.49,49.15200173854828,58.258240297436714,4.607999837011104,3,2,1,4_3_2_r2,0,anchor_skipped
2026-03-02T09:30:21.845762+00:00,B2,uniform,eval,uniform_eval_010,768,768,2048,bf16,NVIDIA GeForce RTX 4060,c05,128,64,32,4,3,8,0.0,0.0,109.47199910879135,175.13760253787035,22.068831515528476,3,3,3,3_3_4_r1,0,
2026-03-02T09:30:21.919043+00:00,B2,uniform,eval,uniform_eval_011,4096,96,512,bf16,NVIDIA GeForce RTX 4060,c06,64,128,32,4,3,8,0.0,73.241,46.08000069856644,164.9350360035896,8.738133200864441,3,1,2,4_2_3_r2,0,anchor_skipped
2026-03-02T09:30:21.926978+00:00,B2,uniform,eval,uniform_eval_012,384,384,256,bf16,NVIDIA GeForce RTX 4060,c09,128,64,64,8,3,8,0.0,0.0,64.51199948787689,219.21791926026322,1.1702857235759294,2,2,2,3_3_2_r1,0,
2026-03-02T09:30:22.632223+00:00,B2,uniform,eval,uniform_eval_013,4096,2048,768,bf16,NVIDIA GeForce RTX 4060,c04,64,64,64,4,3,8,0.0,705.206,443.34399700164795,531.1283209919928,29.062989405836266,3,3,3,4_4_3_r2,0,
2026-03-02T09:30:22.651150+00:00,B2,uniform,eval,uniform_eval_014,192,384,3072,bf16,NVIDIA GeForce RTX 4060,c04,64,64,64,4,3,8,0.0,0.0,59.887999668717384,181.05152115225775,7.563866459153377,2,2,3,2_3_4_r0,0,
2026-03-02T09:30:22.662009+00:00,B2,uniform,eval,uniform_eval_015,128,96,4096,bf16,NVIDIA GeForce RTX 4060,c04,64,64,64,4,3,8,0.0,0.0,59.39200147986412,177.500160485506,1.6948965094925827,1,1,3,2_2_4_r1,0,
2026-03-02T09:30:22.783997+00:00,B2,uniform,eval,uniform_eval_016,64,4096,2048,bf16,NVIDIA GeForce RTX 4060,c04,64,64,64,4,3,8,0.0,121.947,68.4639997780323,113.9104037731885,15.683305496044449,1,3,3,1_4_4_r0,0,anchor_skipped
2026-03-02T09:30:22.792936+00:00,B2,uniform,eval,uniform_eval_017,96,128,3072,bf16,NVIDIA GeForce RTX 4060,c04,64,64,64,4,3,8,0.0,0.0,71.77600264549255,155.95936417579645,1.051848378529633,1,1,3,2_2_4_r1,0,
2026-03-02T09:30:22.797209+00:00,B2,uniform,eval,uniform_eval_018,512,768,64,bf16,NVIDIA GeForce RTX 4060,c10,64,128,64,8,3,8,0.0,0.0,31.74399957060814,90.06720021367073,1.5855484085440266,2,3,1,3_3_1_r1,0,
2026-03-02T09:30:22.859338+00:00,B2,uniform,eval,uniform_eval_019,64,128,384,bf16,NVIDIA GeForce RTX 4060,c01,64,32,32,2,2,8,0.0,62.099,32.62399882078171,45.53056016564369,0.19284748122269732,1,1,2,1_2_3_r0,0,
2026-03-02T09:30:22.866254+00:00,B2,uniform,eval,uniform_eval_020,512,512,96,bf16,NVIDIA GeForce RTX 4060,c09,128,64,64,8,3,8,0.0,0.0,68.83200258016586,140.862399637699,0.7312245193125211,2,2,1,3_3_2_r1,0,
2026-03-02T09:30:22.891485+00:00,B2,uniform,eval,uniform_eval_021,256,3072,1536,bf16,NVIDIA GeForce RTX 4060,c06,64,128,32,4,3,8,0.0,0.0,94.25600245594978,169.48672086000443,25.631461562663574,2,3,3,2_4_4_r0,0,
2026-03-02T09:30:22.900150+00:00,B2,uniform,eval,uniform_eval_022,2048,96,512,bf16,NVIDIA GeForce RTX 4060,c06,64,128,32,4,3,8,0.0,0.0,46.08000069856644,131.11295968294144,4.3690666004322205,3,1,2,4_2_3_r2,0,
2026-03-02T09:30:22.935767+00:00,B2,uniform,eval,uniform_eval_023,1536,512,3072,bf16,NVIDIA GeForce RTX 4060,c04,64,64,64,4,3,8,0.0,0.0,178.17600071430206,190.50111696124077,27.1183447188696,3,2,3,4_3_4_r2,0,
2026-03-02T09:30:22.940426+00:00,B2,uniform,eval,uniform_eval_024,128,192,64,bf16,NVIDIA GeForce RTX 4060,c04,64,64,64,4,3,8,0.0,0.0,49.18400011956692,129.33664008975015,0.06395836028693673,1,2,1,2_2_1_r1,0,
2026-03-02T09:30:22.947624+00:00,B2,uniform,eval,uniform_eval_025,1536,96,384,bf16,NVIDIA GeForce RTX 4060,c06,64,128,32,4,3,8,0.0,0.0,41.96799919009209,89.51231986284246,2.698394257182874,3,1,2,4_2_3_r2,0,
2026-03-02T09:30:23.052235+00:00,B2,uniform,eval,uniform_eval_026,1536,2048,64,bf16,NVIDIA GeForce RTX 4060,c02,32,64,32,2,2,8,0.0,104.571,48.06400090456009,72.21952162683009,8.377437924893975,3,3,1,4_4_1_r1,0,
2026-03-02T09:30:23.057657+00:00,B2,uniform,eval,uniform_eval_027,256,1024,96,bf16,NVIDIA GeForce RTX 4060,c03,64,64,32,4,2,8,0.0,0.0,40.33599980175495,127.43647873401625,1.2478096054981176,2,3,1,2_3_2_r0,0,
2026-03-02T09:30:23.062754+00:00,B2,uniform,eval,uniform_eval_028,2048,256,64,bf16,NVIDIA GeForce RTX 4060,c05,128,64,32,4,3,8,0.0,0.0,38.72000053524971,109.51551839709279,1.7331834471155492,3,2,1,4_2_1_r2,0,
2026-03-02T09:30:23.067905+00:00,B2,uniform,eval,uniform_eval_029,192,768,192,bf16,NVIDIA GeForce RTX 4060,c03,64,64,32,4,2,8,0.0,0.0,37.776000797748566,50.739200375974164,1.498917376224079,2,3,2,2_3_2_r0,0,
2026-03-02T09:30:23.125627+00:00,B2,uniform,eval,uniform_eval_030,1024,2048,3072,bf16,NVIDIA GeForce RTX 4060,c05,128,64,32,4,3,8,0.0,0.0,422.91200160980225,547.9036748409271,30.46709915763562,3,3,3,3_4_4_r0,0,
2026-03-02T09:30:23.309740+00:00,B2,uniform,eval,uniform_eval_031,1536,1024,512,bf16,NVIDIA GeForce RTX 4060,c10,64,128,64,8,3,8,0.0,184.044,79.8719972372055,86.5871998667717,20.164923774433348,3,3,2,4_3_3_r1,0,
2026-03-02T09:30:23.428905+00:00,B2,uniform,eval,uniform_eval_032,512,768,768,bf16,NVIDIA GeForce RTX 4060,c06,64,128,32,4,3,8,0.0,119.115,51.59999988973141,121.95040367543695,11.705034443618171,2,3,3,3_3_3_r1,0,
2026-03-02T09:30:23.509694+00:00,B2,uniform,eval,uniform_eval_033,64,512,4096,bf16,NVIDIA GeForce RTX 4060,c04,64,64,64,4,3,8,0.0,80.744,56.32000043988228,64.5324794948101,4.766254508228145,1,2,3,1_3_4_r0,0,anchor_skipped
2026-03-02T09:30:23.521832+00:00,B2,uniform,eval,uniform_eval_034,1024,256,512,bf16,NVIDIA GeForce RTX 4060,c06,64,128,32,4,3,8,0.0,0.0,47.10400104522705,115.59008039534089,5.698782482240965,3,2,2,3_2_3_r2,0,
2026-03-02T09:30:23.533722+00:00,B2,uniform,eval,uniform_eval_035,1024,768,96,bf16,NVIDIA GeForce RTX 4060,c09,128,64,64,8,3,8,0.0,0.0,43.99999976158142,206.83200255036354,3.431703291322314,3,3,1,3_3_2_r1,0,
2026-03-02T09:30:23.593530+00:00,B2,uniform,eval,uniform_eval_036,768,64,1536,bf16,NVIDIA GeForce RTX 4060,c04,64,64,64,4,3,8,0.0,59.766,43.535999953746796,85.09567946195602,3.468277842714511,3,1,3,3_1_4_r2,0,anchor_skipped
2026-03-02T09:30:23.599108+00:00,B2,uniform,eval,uniform_eval_037,512,256,512,bf16,NVIDIA GeForce RTX 4060,c06,64,128,32,4,3,8,0.0,0.0,35.631999373435974,41.306879557669156,3.7667750999137226,2,2,2,3_2_3_r2,0,
2026-03-02T09:30:23.640243+00:00,B2,uniform,eval,uniform_eval_038,64,1024,64,bf16,NVIDIA GeForce RTX 4060,c11,32,128,32,4,2,8,0.0,41.109,29.664000496268272,50.335040353238554,0.2827874817847069,1,3,1,1_3_1_r0,0,anchor_skipped
2026-03-02T09:30:23.657731+00:00,B2,uniform,eval,uniform_eval_039,512,128,2048,bf16,NVIDIA GeForce RTX 4060,c02,32,64,32,2,2,8,0.0,0.0,51.231998950242996,66.60096019506454,5.239605354081676,2,1,3,3_2_4_r2,0,
2026-03-02T09:30:23.664280+00:00,B2,uniform,eval,uniform_eval_040,4096,768,96,bf16,NVIDIA GeForce RTX 4060,c05,128,64,32,4,3,8,0.0,0.0,48.128001391887665,104.22272153198703,12.549446445573892,3,3,1,4_3_2_r2,0,
2026-03-02T09:30:23.669278+00:00,B2,uniform,eval,uniform_eval_041,4096,192,64,bf16,NVIDIA GeForce RTX 4060,c05,128,64,32,4,3,8,0.0,0.0,31.50399960577488,170.32832428812932,3.1952544838639407,3,2,1,4_2_1_r2,0,
2026-03-02T09:30:23.713084+00:00,B2,uniform,eval,uniform_eval_042,96,1536,128,bf16,NVIDIA GeForce RTX 4060,c09,128,64,64,8,3,8,0.0,43.782,30.719999223947525,43.075520023703575,1.2288000310421,1,3,1,2_4_2_r0,0,anchor_skipped
2026-03-02T09:30:23.720908+00:00,B2,uniform,eval,uniform_eval_043,192,2048,192,bf16,NVIDIA GeForce RTX 4060,c09,128,64,64,8,3,8,0.0,0.0,54.27199974656105,158.3267143368721,2.782188692237525,2,3,2,2_4_2_r0,0,
2026-03-02T09:30:23.803393+00:00,B2,uniform,eval,uniform_eval_044,384,4096,3072,bf16,NVIDIA GeForce RTX 4060,c05,128,64,32,4,3,8,0.0,0.0,316.1439895629883,339.8262310028076,30.567326076191677,2,3,3,3_4_4_r0,0,
2026-03-02T09:30:23.819880+00:00,B2,uniform,eval,uniform_eval_045,4096,96,768,bf16,NVIDIA GeForce RTX 4060,c06,64,128,32,4,3,8,0.0,0.0,62.463998794555664,201.7225609719752,9.669246088238634,3,1,3,4_2_3_r2,0,
2026-03-02T09:30:23.825246+00:00,B2,uniform,eval,uniform_eval_046,96,96,1536,bf16,NVIDIA GeForce RTX 4060,c04,64,64,64,4,3,8,0.0,0.0,39.93599861860275,93.76768194139002,0.7089231014449224,1,1,3,2_2_4_r1,0,
2026-03-02T09:30:23.880693+00:00,B2,uniform,eval,uniform_eval_047,2048,512,4096,bf16,NVIDIA GeForce RTX 4060,c04,64,64,64,4,3,8,0.0,0.0,288.1440073251724,304.20575499534607,29.811255391843712,3,2,3,4_3_4_r2,0,
2026-03-02T09:30:23.944816+00:00,B2,uniform,eval,uniform_eval_048,96,256,768,bf16,NVIDIA GeForce RTX 4060,c04,64,64,64,4,3,8,0.0,64.065,34.511998295784,41.502719148993485,1.093785867641614,1,2,3,2_2_3_r0,0,
2026-03-02T09:30:23.991434+00:00,B2,uniform,eval,uniform_eval_049,64,768,384,bf16,NVIDIA GeForce RTX 4060,c00,32,32,32,2,2,8,0.0,46.582,28.048000298440456,161.15520142018775,1.3458619366208053,1,3,2,1_3_3_r0,0,anchor_skipped
2026-03-02T09:30:24.003083+00:00,B2,uniform,eval,uniform_eval_050,128,1024,96,bf16,NVIDIA GeForce RTX 4060,c03,64,64,32,4,2,8,0.0,0.0,65.5359998345375,191.29952467977964,0.38400000096950676,1,3,1,2_3_2_r0,0,
2026-03-02T09:30:24.016141+00:00,B2,uniform,eval,uniform_eval_051,384,768,768,bf16,NVIDIA GeForce RTX 4060,c03,64,64,32,4,2,8,0.0,0.0,82.94399827718735,155.13184398412693,5.46133344676956,2,3,3,3_3_3_r0,0,
2026-03-02T09:30:24.035402+00:00,B2,uniform,eval,uniform_eval_052,768,64,4096,bf16,NVIDIA GeForce RTX 4060,c04,64,64,64,4,3,8,0.0,0.0,59.39200147986412,289.460803568363,6.779586037970331,3,1,3,3_1_4_r2,0,
2026-03-02T09:30:24.040728+00:00,B2,uniform,eval,uniform_eval_053,384,96,512,bf16,NVIDIA GeForce RTX 4060,c06,64,128,32,4,3,8,0.0,0.0,39.93599861860275,54.74431917071341,0.9452308019265633,2,1,2,3_2_3_r2,0,
2026-03-02T09:30:24.047136+00:00,B2,uniform,eval,uniform_eval_054,768,192,768,bf16,NVIDIA GeForce RTX 4060,c06,64,128,32,4,3,8,0.0,0.0,40.672000497579575,50.69823853671551,5.568755242650991,3,2,3,3_2_3_r2,0,
2026-03-02T09:30:24.060176+00:00,B2,uniform,eval,uniform_eval_055,512,2048,512,bf16,NVIDIA GeForce RTX 4060,c06,64,128,32,4,3,8,0.0,0.0,68.09600070118904,234.0121604502201,15.768059988011176,2,3,2,3_4_3_r0,0,
2026-03-02T09:30:24.065659+00:00,B2,uniform,eval,uniform_eval_056,384,512,512,bf16,NVIDIA GeForce RTX 4060,c06,64,128,32,4,3,8,0.0,0.0,33.79200026392937,42.57151998579502,5.957818135285181,2,2,2,3_3_3_r1,0,
2026-03-02T09:30:24.075106+00:00,B2,uniform,eval,uniform_eval_057,2048,512,512,bf16,NVIDIA GeForce RTX 4060,c09,128,64,64,8,3,8,0.0,0.0,64.51199948787689,73.12544137239456,16.644063624190995,3,2,2,4_3_3_r2,0,
2026-03-02T09:30:24.318105+00:00,B2,uniform,eval,uniform_eval_058,1024,512,2048,bf16,NVIDIA GeForce RTX 4060,c10,64,128,64,8,3,8,0.0,242.964,125.95200538635254,144.62143704295153,17.050015531016623,3,2,3,3_3_4_r2,0,
2026-03-02T09:30:24.374220+00:00,B2,uniform,eval,uniform_eval_059,2048,64,4096,bf16,NVIDIA GeForce RTX 4060,c04,64,64,64,4,3,8,0.0,0.0,87.61600032448769,805.2819201350189,12.255088340296004,3,1,3,4_1_4_r2,0,
2026-03-02T09:30:24.440946+00:00,B2,uniform,eval,uniform_eval_060,64,1536,1024,bf16,NVIDIA GeForce RTX 4060,c00,32,32,32,2,2,8,0.0,66.669,32.11200051009655,161.50784522294992,6.269512605939936,1,3,3,1_4_3_r0,0,anchor_skipped
2026-03-02T09:30:24.458878+00:00,B2,uniform,eval,uniform_eval_061,768,1024,1536,bf16,NVIDIA GeForce RTX 4060,c05,128,64,32,4,3,8,0.0,0.0,107.5039990246296,211.24287769198412,22.472830089292806,3,3,3,3_3_4_r1,0,
2026-03-02T09:30:24.550388+00:00,B2,uniform,eval,uniform_eval_062,384,2048,192,bf16,NVIDIA GeForce RTX 4060,c10,64,128,64,8,3,8,0.0,91.466,43.007999658584595,65.30431825667615,7.021714341455577,2,3,2,3_4_2_r0,0,
2026-03-02T09:30:24.560103+00:00,B2,uniform,eval,uniform_eval_063,256,2048,192,bf16,NVIDIA GeForce RTX 4060,c09,128,64,64,8,3,8,0.0,0.0,37.88800165057182,53.288959413766854,5.313729498239754,2,3,2,2_4_2_r0,0,
2026-03-02T09:30:26.619435+00:00,B2,llm_style,tune,llm_style_tune_000,8,4096,1024,bf16,NVIDIA GeForce RTX 4060,c00,32,32,32,2,2,8,0.0,2058.694,39.824001491069794,104.92287859320632,1.6851361361828145,0,3,3,0_4_3_r0,0,anchor_skipped
2026-03-02T09:30:26.638895+00:00,B2,llm_style,tune,llm_style_tune_001,32,1024,2048,bf16,NVIDIA GeForce RTX 4060,c04,64,64,64,4,3,8,0.0,0.0,72.7040022611618,86.0364793241024,1.8460844496273157,0,3,3,1_3_4_r0,0,
2026-03-02T09:30:26.651494+00:00,B2,llm_style,tune,llm_style_tune_002,16,2048,1024,bf16,NVIDIA GeForce RTX 4060,c00,32,32,32,2,2,8,0.0,0.0,60.416001826524734,181.47328183054918,1.1107796274353405,0,3,3,0_4_3_r0,0,
2026-03-02T09:30:28.948441+00:00,B2,llm_style,tune,llm_style_tune_003,1,1024,4096,bf16,NVIDIA GeForce RTX 4060,c00,32,32,32,2,2,8,0.0,2296.907,121.8240037560463,178.7516804039478,0.06885841657936531,0,3,3,0_3_4_r0,0,anchor_skipped
2026-03-02T09:30:28.989909+00:00,B2,llm_style,tune,llm_style_tune_004,64,2048,2048,bf16,NVIDIA GeForce RTX 4060,c04,64,64,64,4,3,8,0.0,0.0,194.5600062608719,207.37023949623108,2.7594104375189388,1,3,3,1_4_4_r0,0,
2026-03-02T09:30:29.642182+00:00,B2,llm_style,tune,llm_style_tune_005,32,8192,8192,bf16,NVIDIA GeForce RTX 4060,c04,64,64,64,4,3,8,0.0,0.0,6949.887990951538,7404.6053075790405,0.617990865693356,0,3,3,1_4_4_r0,0,
2026-03-02T09:30:30.398292+00:00,B2,llm_style,tune,llm_style_tune_006,16,8192,8192,bf16,NVIDIA GeForce RTX 4060,c11,32,128,32,4,2,8,0.0,756.052,560.016006231308,647.2684931755064,3.8346826235409552,0,3,3,0_4_4_r0,0,anchor_skipped
2026-03-02T09:30:30.473978+00:00,B2,llm_style,tune,llm_style_tune_007,2,1024,8192,bf16,NVIDIA GeForce RTX 4060,c00,32,32,32,2,2,8,0.0,0.0,93.07200089097023,253.00223648548126,0.36052122742378284,0,3,3,0_3_4_r0,0,
2026-03-02T09:30:30.563911+00:00,B2,llm_style,tune,llm_style_tune_008,16,2048,8192,bf16,NVIDIA GeForce RTX 4060,c11,32,128,32,4,2,8,0.0,0.0,177.10400372743607,242.02207803726174,3.0313877761128825,0,3,3,0_4_4_r0,0,
2026-03-02T09:30:30.604319+00:00,B2,llm_style,tune,llm_style_tune_009,4,4096,2048,bf16,NVIDIA GeForce RTX 4060,c11,32,128,32,4,2,8,0.0,0.0,52.22399905323982,147.5583977997303,1.2850196311390436,0,3,3,0_4_4_r0,0,
2026-03-02T09:30:30.783314+00:00,B2,llm_style,tune,llm_style_tune_010,64,8192,4096,bf16,NVIDIA GeForce RTX 4060,c04,64,64,64,4,3,8,0.0,0.0,306.5280020236969,388.4332770109176,14.011663755495874,1,3,3,1_4_4_r0,0,
2026-03-02T09:30:30.823305+00:00,B2,llm_style,tune,llm_style_tune_011,16,8192,1024,bf16,NVIDIA GeForce RTX 4060,c00,32,32,32,2,2,8,0.0,0.0,55.296000093221664,76.96383990347383,4.854518510334449,0,3,3,0_4_3_r0,0,
2026-03-02T09:30:30.863541+00:00,B2,llm_style,tune,llm_style_tune_012,2,8192,1024,bf16,NVIDIA GeForce RTX 4060,c00,32,32,32,2,2,8,0.0,0.0,48.54399897158146,92.08640094846473,0.6912168900556251,0,3,3,0_4_3_r0,0,
2026-03-02T09:30:30.944113+00:00,B2,llm_style,tune,llm_style_tune_013,16,8192,2048,bf16,NVIDIA GeForce RTX 4060,c11,32,128,32,4,2,8,0.0,0.0,162.73599863052368,255.65823152661295,3.2990298183434716,0,3,3,0_4_4_r0,0,
2026-03-02T09:30:31.034338+00:00,B2,llm_style,tune,llm_style_tune_014,8,4096,4096,bf16,NVIDIA GeForce RTX 4060,c11,32,128,32,4,2,8,0.0,0.0,185.8079954981804,308.14527809619904,1.4446927070080189,0,3,3,0_4_4_r0,0,
2026-03-02T09:30:31.046853+00:00,B2,llm_style,tune,llm_style_tune_015,64,1024,1024,bf16,NVIDIA GeForce RTX 4060,c00,32,32,32,2,2,8,0.0,0.0,61.39199994504452,404.3312016129489,2.186241336332844,1,3,3,1_3_3_r0,0,
2026-03-02T09:30:31.211498+00:00,B2,llm_style,tune,llm_style_tune_016,16,4096,8192,bf16,NVIDIA GeForce RTX 4060,c11,32,128,32,4,2,8,0.0,0.0,323.5839903354645,455.6800127029419,3.3182785801202197,0,3,3,0_4_4_r0,0,
2026-03-02T09:30:31.297305+00:00,B2,llm_style,tune,llm_style_tune_017,1,4096,4096,bf16,NVIDIA GeForce RTX 4060,c11,32,128,32,4,2,8,0.0,0.0,188.4160041809082,267.2640085220337,0.17808695257003015,0,3,3,0_4_4_r0,0,
2026-03-02T09:30:31.383937+00:00,B2,llm_style,tune,llm_style_tune_018,64,4096,4096,bf16,NVIDIA GeForce RTX 4060,c04,64,64,64,4,3,8,0.0,0.0,166.9600009918213,214.61823761463154,12.862264226419098,1,3,3,1_4_4_r0,0,
2026-03-02T09:30:31.465272+00:00,B2,llm_style,tune,llm_style_tune_019,64,8192,2048,bf16,NVIDIA GeForce RTX 4060,c04,64,64,64,4,3,8,0.0,0.0,168.96000504493713,251.85536205768562,12.710011741706852,1,3,3,1_4_4_r0,0,
2026-03-02T09:30:31.506743+00:00,B2,llm_style,tune,llm_style_tune_020,8,2048,4096,bf16,NVIDIA GeForce RTX 4060,c11,32,128,32,4,2,8,0.0,0.0,70.65600156784058,151.4787219464779,1.899594160746988,0,3,3,0_4_4_r0,0,
2026-03-02T09:30:31.526744+00:00,B2,llm_style,tune,llm_style_tune_021,8,1024,2048,bf16,NVIDIA GeForce RTX 4060,c00,32,32,32,2,2,8,0.0,0.0,63.919998705387115,289.6387197077269,0.524944190857314,0,3,3,0_3_4_r0,0,
2026-03-02T09:30:31.568222+00:00,B2,llm_style,tune,llm_style_tune_022,8,8192,1024,bf16,NVIDIA GeForce RTX 4060,c00,32,32,32,2,2,8,0.0,0.0,51.19999870657921,110.98271906375884,2.621440066223146,0,3,3,0_4_3_r0,0,
2026-03-02T09:30:31.735399+00:00,B2,llm_style,tune,llm_style_tune_023,1,4096,8192,bf16,NVIDIA GeForce RTX 4060,c11,32,128,32,4,2,8,0.0,0.0,292.86399483680725,423.76064509153355,0.22914685718671254,0,3,3,0_4_4_r0,0,
2026-03-02T09:30:31.902678+00:00,B2,llm_style,tune,llm_style_tune_024,2,8192,4096,bf16,NVIDIA GeForce RTX 4060,c11,32,128,32,4,2,8,0.0,0.0,296.9599962234497,386.61120027303673,0.4519724195410041,0,3,3,0_4_4_r0,0,
2026-03-02T09:30:31.985660+00:00,B2,llm_style,tune,llm_style_tune_025,2,4096,4096,bf16,NVIDIA GeForce RTX 4060,c11,32,128,32,4,2,8,0.0,0.0,163.83999586105347,215.119357407093,0.4096000103473666,0,3,3,0_4_4_r0,0,
2026-03-02T09:30:31.996553+00:00,B2,llm_style,tune,llm_style_tune_026,4,2048,1024,bf16,NVIDIA GeForce RTX 4060,c00,32,32,32,2,2,8,0.0,0.0,35.61599925160408,85.70880271494374,0.47105841061708764,0,3,3,0_4_3_r0,0,
2026-03-02T09:30:32.038510+00:00,B2,llm_style,tune,llm_style_tune_027,64,2048,4096,bf16,NVIDIA GeForce RTX 4060,c04,64,64,64,4,3,8,0.0,0.0,87.0399996638298,155.0659230351447,12.336188282939554,1,3,3,1_4_4_r0,0,
2026-03-02T09:30:32.062646+00:00,B2,llm_style,tune,llm_style_tune_028,32,1024,4096,bf16,NVIDIA GeForce RTX 4060,c04,64,64,64,4,3,8,0.0,0.0,91.13600105047226,172.48512148857117,2.9454381682968194,0,3,3,1_3_4_r0,0,
2026-03-02T09:30:32.074889+00:00,B2,llm_style,tune,llm_style_tune_029,32,2048,1024,bf16,NVIDIA GeForce RTX 4060,c00,32,32,32,2,2,8,0.0,0.0,43.03999990224838,182.22079813480366,3.118441642770277,0,3,3,1_4_3_r0,0,
2026-03-02T09:30:32.094020+00:00,B2,llm_style,tune,llm_style_tune_030,4,2048,2048,bf16,NVIDIA GeForce RTX 4060,c11,32,128,32,4,2,8,0.0,0.0,58.36800113320351,236.66719377040857,0.5748771818213262,0,3,3,0_4_4_r0,0,
2026-03-02T09:30:32.424264+00:00,B2,llm_style,tune,llm_style_tune_031,1,8192,8192,bf16,NVIDIA GeForce RTX 4060,c11,32,128,32,4,2,8,0.0,0.0,584.5759809017181,653.7932735681532,0.22959843097379218,0,3,3,0_4_4_r0,0,
2026-03-02T09:30:32.448971+00:00,B2,llm_style,eval,llm_style_eval_000,2,1024,4096,bf16,NVIDIA GeForce RTX 4060,c00,32,32,32,2,2,8,0.0,0.0,121.34400010108948,258.0889728665352,0.1382616032603442,0,3,3,0_3_4_r0,0,
2026-03-02T09:30:32.841552+00:00,B2,llm_style,eval,llm_style_eval_001,2,8192,8192,bf16,NVIDIA GeForce RTX 4060,c11,32,128,32,4,2,8,0.0,0.0,902.0000100135803,979.8041641712186,0.2976002805099287,0,3,3,0_4_4_r0,0,
2026-03-02T09:30:32.862518+00:00,B2,llm_style,eval,llm_style_eval_002,2,2048,2048,bf16,NVIDIA GeForce RTX 4060,c11,32,128,32,4,2,8,0.0,0.0,77.82399654388428,183.34719851613033,0.21557895694214924,0,3,3,0_4_4_r0,0,
2026-03-02T09:30:32.908665+00:00,B2,llm_style,eval,llm_style_eval_003,8,1024,8192,bf16,NVIDIA GeForce RTX 4060,c00,32,32,32,2,2,8,0.0,0.0,155.64800053834915,194.3257610499858,0.8623157864911404,0,3,3,0_3_4_r0,0,
2026-03-02T09:30:33.000485+00:00,B2,llm_style,eval,llm_style_eval_004,64,2048,8192,bf16,NVIDIA GeForce RTX 4060,c04,64,64,64,4,3,8,0.0,0.0,281.5999984741211,301.66016161441803,7.626007314049587,1,3,3,1_4_4_r0,0,
2026-03-02T09:30:33.341011+00:00,B2,llm_style,eval,llm_style_eval_005,1,8192,8192,bf16,NVIDIA GeForce RTX 4060,c11,32,128,32,4,2,8,0.0,0.0,927.1200001239777,1064.8908519744873,0.14476845282385445,0,3,3,0_4_4_r0,0,
2026-03-02T09:30:33.395809+00:00,B2,llm_style,eval,llm_style_eval_006,1,1024,8192,bf16,NVIDIA GeForce RTX 4060,c00,32,32,32,2,2,8,0.0,0.0,173.0560064315796,272.25087910890574,0.09694674195913064,0,3,3,0_3_4_r0,0,
2026-03-02T09:30:33.569148+00:00,B2,llm_style,eval,llm_style_eval_007,2,8192,4096,bf16,NVIDIA GeForce RTX 4060,c11,32,128,32,4,2,8,0.0,0.0,471.8240052461624,555.7145583629608,0.28446566200033685,0,3,3,0_4_4_r0,0,
2026-03-02T09:30:33.619956+00:00,B2,llm_style,eval,llm_style_eval_008,16,2048,4096,bf16,NVIDIA GeForce RTX 4060,c11,32,128,32,4,2,8,0.0,0.0,152.46400237083435,280.7859176397323,1.7606480993926108,0,3,3,0_4_4_r0,0,
2026-03-02T09:30:33.718318+00:00,B2,llm_style,eval,llm_style_eval_009,32,2048,8192,bf16,NVIDIA GeForce RTX 4060,c04,64,64,64,4,3,8,0.0,0.0,311.2959861755371,381.5321585536003,3.4492633110743878,0,3,3,1_4_4_r0,0,
2026-03-02T09:30:33.787780+00:00,B2,llm_style,eval,llm_style_eval_010,1,1024,1024,bf16,NVIDIA GeForce RTX 4060,c00,32,32,32,2,2,8,0.0,69.4,50.175998359918594,959.4208015501467,0.04179591973351225,0,3,3,0_3_3_r0,0,anchor_skipped
2026-03-02T09:30:33.889485+00:00,B2,llm_style,eval,llm_style_eval_011,16,2048,8192,bf16,NVIDIA GeForce RTX 4060,c11,32,128,32,4,2,8,0.0,0.0,338.9439880847931,488.270399570465,1.583951717313516,0,3,3,0_4_4_r0,0,
2026-03-02T09:30:34.227272+00:00,B2,llm_style,eval,llm_style_eval_012,8,8192,8192,bf16,NVIDIA GeForce RTX 4060,c11,32,128,32,4,2,8,0.0,0.0,911.7920100688934,1039.9641501903534,1.17761705755556,0,3,3,0_4_4_r0,0,
2026-03-02T09:30:34.412441+00:00,B2,llm_style,eval,llm_style_eval_013,32,4096,8192,bf16,NVIDIA GeForce RTX 4060,c04,64,64,64,4,3,8,0.0,0.0,512.0000243186951,601.9993811845778,4.19430380078126,0,3,3,1_4_4_r0,0,
2026-03-02T09:30:34.422244+00:00,B2,llm_style,eval,llm_style_eval_014,64,1024,1024,bf16,NVIDIA GeForce RTX 4060,c00,32,32,32,2,2,8,0.0,0.0,56.671999394893646,87.91039980947963,2.368325265264834,1,3,3,1_3_3_r0,0,
2026-03-02T09:30:34.434248+00:00,B2,llm_style,eval,llm_style_eval_015,16,2048,1024,bf16,NVIDIA GeForce RTX 4060,c00,32,32,32,2,2,8,0.0,0.0,53.247999399900436,150.39936155080787,1.2603077065112325,0,3,3,0_4_3_r0,0,
2026-03-02T09:30:34.491057+00:00,B2,llm_style,eval,llm_style_eval_016,2,1024,8192,bf16,NVIDIA GeForce RTX 4060,c00,32,32,32,2,2,8,0.0,0.0,239.48800563812256,328.878075480461,0.14010902930438318,0,3,3,0_3_4_r0,0,
2026-03-02T09:30:34.902257+00:00,B2,llm_style,eval,llm_style_eval_017,4,8192,8192,bf16,NVIDIA GeForce RTX 4060,c11,32,128,32,4,2,8,0.0,0.0,928.7039935588837,1049.7436952590942,0.5780861455571636,0,3,3,0_4_4_r0,0,
2026-03-02T09:30:34.935469+00:00,B2,llm_style,eval,llm_style_eval_018,4,1024,4096,bf16,NVIDIA GeForce RTX 4060,c00,32,32,32,2,2,8,0.0,0.0,158.03200006484985,377.93792098760605,0.2123268197974501,0,3,3,0_3_4_r0,0,
2026-03-02T09:30:34.981252+00:00,B2,llm_style,eval,llm_style_eval_019,8,4096,2048,bf16,NVIDIA GeForce RTX 4060,c11,32,128,32,4,2,8,0.0,0.0,115.58400094509125,203.1513600051402,1.1612137225095782,0,3,3,0_4_4_r0,0,
2026-03-02T09:30:35.031132+00:00,B2,llm_style,eval,llm_style_eval_020,64,4096,2048,bf16,NVIDIA GeForce RTX 4060,c04,64,64,64,4,3,8,0.0,0.0,171.52000218629837,286.9043126702308,6.260155144084846,1,3,3,1_4_4_r0,0,
2026-03-02T09:30:35.202689+00:00,B2,llm_style,eval,llm_style_eval_021,1,4096,8192,bf16,NVIDIA GeForce RTX 4060,c11,32,128,32,4,2,8,0.0,0.0,481.2159985303879,633.9071941375731,0.139456843091143,0,3,3,0_4_4_r0,0,
2026-03-02T09:30:35.226727+00:00,B2,llm_style,eval,llm_style_eval_022,32,1024,4096,bf16,NVIDIA GeForce RTX 4060,c04,64,64,64,4,3,8,0.0,0.0,140.79999923706055,179.88608494400975,1.9065018285123967,0,3,3,1_3_4_r0,0,
2026-03-02T09:30:35.236019+00:00,B2,llm_style,eval,llm_style_eval_023,4,1024,1024,bf16,NVIDIA GeForce RTX 4060,c00,32,32,32,2,2,8,0.0,0.0,61.24800071120262,151.73631921410555,0.1369613359226871,0,3,3,0_3_3_r0,0,
2026-03-02T09:30:35.259156+00:00,B2,llm_style,eval,llm_style_eval_024,64,2048,2048,bf16,NVIDIA GeForce RTX 4060,c04,64,64,64,4,3,8,0.0,0.0,130.048006772995,142.75071889162064,4.128251753501565,1,3,3,1_4_4_r0,0,
2026-03-02T09:30:35.621212+00:00,B2,llm_style,eval,llm_style_eval_025,32,8192,8192,bf16,NVIDIA GeForce RTX 4060,c04,64,64,64,4,3,8,0.0,0.0,1249.7439980506897,1365.022737979889,3.436677673746905,0,3,3,1_4_4_r0,0,
2026-03-02T09:30:35.674775+00:00,B2,llm_style,eval,llm_style_eval_026,4,2048,4096,bf16,NVIDIA GeForce RTX 4060,c11,32,128,32,4,2,8,0.0,0.0,217.95199811458588,310.9420838952064,0.30790662430503735,0,3,3,0_4_4_r0,0,
2026-03-02T09:30:35.763724+00:00,B2,llm_style,eval,llm_style_eval_027,8,8192,2048,bf16,NVIDIA GeForce RTX 4060,c11,32,128,32,4,2,8,0.0,0.0,257.02399015426636,345.9379139542579,1.0443984463819291,0,3,3,0_4_4_r0,0,
2026-03-02T09:30:35.939458+00:00,B2,llm_style,eval,llm_style_eval_028,8,4096,8192,bf16,NVIDIA GeForce RTX 4060,c11,32,128,32,4,2,8,0.0,0.0,482.2880029678345,636.3712018728254,1.113174925970128,0,3,3,0_4_4_r0,0,
2026-03-02T09:30:35.965567+00:00,B2,llm_style,eval,llm_style_eval_029,8,2048,2048,bf16,NVIDIA GeForce RTX 4060,c11,32,128,32,4,2,8,0.0,0.0,125.29599666595459,179.65056106448165,0.5356026192833248,0,3,3,0_4_4_r0,0,
2026-03-02T09:30:36.018781+00:00,B2,llm_style,eval,llm_style_eval_030,1,4096,2048,bf16,NVIDIA GeForce RTX 4060,c11,32,128,32,4,2,8,0.0,0.0,151.48800611495972,338.5855993628502,0.11074946743485602,0,3,3,0_4_4_r0,0,
2026-03-02T09:30:36.105827+00:00,B2,llm_style,eval,llm_style_eval_031,16,8192,2048,bf16,NVIDIA GeForce RTX 4060,c11,32,128,32,4,2,8,0.0,0.0,258.04799795150757,415.98271787166567,2.0805079530238744,0,3,3,0_4_4_r0,0,
2026-03-02T09:30:36.129789+00:00,B2,llm_style,eval,llm_style_eval_032,1,2048,2048,bf16,NVIDIA GeForce RTX 4060,c11,32,128,32,4,2,8,0.0,0.0,122.8799968957901,206.2732821702956,0.06826666839122776,0,3,3,0_4_4_r0,0,
2026-03-02T09:30:36.306422+00:00,B2,llm_style,eval,llm_style_eval_033,16,8192,4096,bf16,NVIDIA GeForce RTX 4060,c11,32,128,32,4,2,8,0.0,0.0,479.2320132255554,517.7651274204254,2.2405469467137467,0,3,3,0_4_4_r0,0,
2026-03-02T09:30:36.333076+00:00,B2,llm_style,eval,llm_style_eval_034,16,1024,4096,bf16,NVIDIA GeForce RTX 4060,c00,32,32,32,2,2,8,0.0,0.0,155.96800297498703,305.7808062434194,0.860546557241775,0,3,3,0_3_4_r0,0,
2026-03-02T09:30:36.420412+00:00,B2,llm_style,eval,llm_style_eval_035,4,8192,2048,bf16,NVIDIA GeForce RTX 4060,c11,32,128,32,4,2,8,0.0,0.0,258.5600018501282,385.5772867798804,0.5190970259885672,0,3,3,0_4_4_r0,0,
2026-03-02T09:30:36.472786+00:00,B2,llm_style,eval,llm_style_eval_036,2,2048,4096,bf16,NVIDIA GeForce RTX 4060,c11,32,128,32,4,2,8,0.0,0.0,238.52799832820892,333.1238326430318,0.14067292827330857,0,3,3,0_4_4_r0,0,
2026-03-02T09:30:36.483180+00:00,B2,llm_style,eval,llm_style_eval_037,2,1024,1024,bf16,NVIDIA GeForce RTX 4060,c00,32,32,32,2,2,8,0.0,0.0,69.05600056052208,104.78527784347527,0.060737719618210825,0,3,3,0_3_3_r0,0,
2026-03-02T09:30:36.711777+00:00,B2,llm_style,eval,llm_style_eval_038,64,4096,8192,bf16,NVIDIA GeForce RTX 4060,c04,64,64,64,4,3,8,0.0,0.0,813.5679960250854,949.1353422403336,5.279174349266769,1,3,3,1_4_4_r0,0,
2026-03-02T09:30:36.729068+00:00,B2,llm_style,eval,llm_style_eval_039,4,1024,2048,bf16,NVIDIA GeForce RTX 4060,c00,32,32,32,2,2,8,0.0,0.0,100.35199671983719,113.68448123335838,0.167183678934049,0,3,3,0_3_4_r0,0,
2026-03-02T09:30:36.783023+00:00,B2,llm_style,eval,llm_style_eval_040,64,8192,1024,bf16,NVIDIA GeForce RTX 4060,c00,32,32,32,2,2,8,0.0,0.0,279.55201268196106,361.4515227079389,3.8409375546924345,1,3,3,1_4_3_r0,0,
2026-03-02T09:30:36.797761+00:00,B2,llm_style,eval,llm_style_eval_041,2,2048,1024,bf16,NVIDIA GeForce RTX 4060,c00,32,32,32,2,2,8,0.0,0.0,90.11200070381165,253.8518463075159,0.09309090836383095,0,3,3,0_4_3_r0,0,
2026-03-02T09:30:36.845565+00:00,B2,llm_style,eval,llm_style_eval_042,2,4096,2048,bf16,NVIDIA GeForce RTX 4060,c11,32,128,32,4,2,8,0.0,0.0,160.76800227165222,291.5580850839613,0.2087133728470579,0,3,3,0_4_4_r0,0,
2026-03-02T09:30:36.860149+00:00,B2,llm_style,eval,llm_style_eval_043,1,2048,1024,bf16,NVIDIA GeForce RTX 4060,c00,32,32,32,2,2,8,0.0,0.0,67.07200035452843,738.7750475108598,0.0625343508144948,0,3,3,0_4_3_r0,0,
2026-03-02T09:30:36.967128+00:00,B2,llm_style,eval,llm_style_eval_044,8,2048,8192,bf16,NVIDIA GeForce RTX 4060,c11,32,128,32,4,2,8,0.0,0.0,538.4959876537323,630.2105575799941,0.49849109771382616,0,3,3,0_4_4_r0,0,
2026-03-02T09:30:37.013322+00:00,B2,llm_style,eval,llm_style_eval_045,1,8192,1024,bf16,NVIDIA GeForce RTX 4060,c00,32,32,32,2,2,8,0.0,0.0,139.26400244235992,338.85952204465866,0.12047058612252605,0,3,3,0_4_3_r0,0,
2026-03-02T09:30:37.038338+00:00,B2,llm_style,eval,llm_style_eval_046,64,4096,1024,bf16,NVIDIA GeForce RTX 4060,c00,32,32,32,2,2,8,0.0,0.0,136.07999682426453,201.30816474556923,3.9452595864866313,1,3,3,1_4_3_r0,0,
2026-03-02T09:30:37.060934+00:00,B2,llm_style,eval,llm_style_eval_047,16,2048,2048,bf16,NVIDIA GeForce RTX 4060,c11,32,128,32,4,2,8,0.0,0.0,142.70399510860443,156.69247344136238,0.940532378913807,0,3,3,0_4_4_r0,0,
2026-03-02T09:30:37.233171+00:00,B2,llm_style,eval,llm_style_eval_048,8,8192,4096,bf16,NVIDIA GeForce RTX 4060,c11,32,128,32,4,2,8,0.0,0.0,512.5119984149933,585.3183817863462,1.0475284747680829,0,3,3,0_4_4_r0,0,
2026-03-02T09:30:37.423397+00:00,B2,llm_style,eval,llm_style_eval_049,4,4096,8192,bf16,NVIDIA GeForce RTX 4060,c11,32,128,32,4,2,8,0.0,0.0,612.7360165119171,626.6819417476654,0.4380931571937051,0,3,3,0_4_4_r0,0,
2026-03-02T09:30:37.533296+00:00,B2,llm_style,eval,llm_style_eval_050,4,2048,8192,bf16,NVIDIA GeForce RTX 4060,c11,32,128,32,4,2,8,0.0,0.0,591.8560028076172,600.5372822284698,0.2267742953747273,0,3,3,0_4_4_r0,0,
2026-03-02T09:30:37.544263+00:00,B2,llm_style,eval,llm_style_eval_051,16,1024,1024,bf16,NVIDIA GeForce RTX 4060,c00,32,32,32,2,2,8,0.0,0.0,72.68800213932991,207.14911818504285,0.4616227026804527,0,3,3,0_3_3_r0,0,
2026-03-02T09:30:37.740795+00:00,B2,llm_style,eval,llm_style_eval_052,32,8192,4096,bf16,NVIDIA GeForce RTX 4060,c04,64,64,64,4,3,8,0.0,0.0,917.5040125846863,933.7820935249329,2.340571396467637,0,3,3,1_4_4_r0,0,
2026-03-02T09:30:37.757140+00:00,B2,llm_style,eval,llm_style_eval_053,32,1024,2048,bf16,NVIDIA GeForce RTX 4060,c04,64,64,64,4,3,8,0.0,0.0,115.47200009226799,125.45024156570435,1.1623400295548119,0,3,3,1_3_4_r0,0,
2026-03-02T09:30:37.860797+00:00,B2,llm_style,eval,llm_style_eval_054,64,8192,2048,bf16,NVIDIA GeForce RTX 4060,c04,64,64,64,4,3,8,0.0,0.0,483.3280146121979,530.9644955396651,4.443118509741362,1,3,3,1_4_4_r0,0,
2026-03-02T09:30:37.884389+00:00,B2,llm_style,eval,llm_style_eval_055,1,4096,1024,bf16,NVIDIA GeForce RTX 4060,c00,32,32,32,2,2,8,0.0,0.0,117.74400249123573,233.65440785884843,0.07124446105545296,0,3,3,0_4_3_r0,0,
2026-03-02T09:30:37.909704+00:00,B2,llm_style,eval,llm_style_eval_056,4,2048,2048,bf16,NVIDIA GeForce RTX 4060,c11,32,128,32,4,2,8,0.0,0.0,165.3600037097931,332.0815920829771,0.20291746037263067,0,3,3,0_4_4_r0,0,
2026-03-02T09:30:37.969694+00:00,B2,llm_style,eval,llm_style_eval_057,16,1024,8192,bf16,NVIDIA GeForce RTX 4060,c00,32,32,32,2,2,8,0.0,0.0,353.7919968366623,450.0889778137204,0.7587380675655321,0,3,3,0_3_4_r0,0,
2026-03-02T09:30:38.146231+00:00,B2,llm_style,eval,llm_style_eval_058,1,8192,4096,bf16,NVIDIA GeForce RTX 4060,c11,32,128,32,4,2,8,0.0,0.0,553.9839863777161,594.5241558551788,0.12113863514142086,0,3,3,0_4_4_r0,0,
2026-03-02T09:30:38.168552+00:00,B2,llm_style,eval,llm_style_eval_059,8,4096,1024,bf16,NVIDIA GeForce RTX 4060,c00,32,32,32,2,2,8,0.0,0.0,114.56000059843063,169.08735692501062,0.5857966449846486,0,3,3,0_4_3_r0,0,
2026-03-02T09:30:38.346200+00:00,B2,llm_style,eval,llm_style_eval_060,4,8192,4096,bf16,NVIDIA GeForce RTX 4060,c11,32,128,32,4,2,8,0.0,0.0,558.0800175666809,649.5436763763428,0.4809981499972387,0,3,3,0_4_4_r0,0,
2026-03-02T09:30:38.373917+00:00,B2,llm_style,eval,llm_style_eval_061,32,2048,2048,bf16,NVIDIA GeForce RTX 4060,c04,64,64,64,4,3,8,0.0,0.0,196.60800695419312,228.44223514199254,1.3653332850403275,0,3,3,1_4_4_r0,0,
2026-03-02T09:30:38.387018+00:00,B2,llm_style,eval,llm_style_eval_062,8,2048,1024,bf16,NVIDIA GeForce RTX 4060,c00,32,32,32,2,2,8,0.0,0.0,80.78400045633316,190.00544041395176,0.41535987089593873,0,3,3,0_4_3_r0,0,
2026-03-02T09:30:38.578795+00:00,B2,llm_style,eval,llm_style_eval_063,16,4096,8192,bf16,NVIDIA GeForce RTX 4060,c11,32,128,32,4,2,8,0.0,0.0,698.3680129051208,798.730238676071,1.5375014378642178,0,3,3,0_4_4_r0,0,
2026-03-02T09:30:38.811351+00:00,B2,training_style,tune,training_style_tune_000,4096,2048,1024,bf16,NVIDIA GeForce RTX 4060,c04,64,64,64,4,3,8,0.0,0.0,3594.048023223877,3714.590632915497,4.7800889339785675,3,3,3,4_4_3_r2,0,
2026-03-02T09:30:38.861963+00:00,B2,training_style,tune,training_style_tune_001,1536,2048,1536,bf16,NVIDIA GeForce RTX 4060,c11,32,128,32,4,2,8,0.0,0.0,395.26399970054626,515.8953472971914,24.44866323095765,3,3,3,4_4_4_r1,0,
2026-03-02T09:30:39.077070+00:00,B2,training_style,tune,training_style_tune_002,3072,2048,4096,bf16,NVIDIA GeForce RTX 4060,c11,32,128,32,4,2,8,0.0,0.0,1841.1519527435303,1971.7961120605469,27.99313086309905,3,3,3,4_4_4_r1,0,
2026-03-02T09:30:39.140623+00:00,B2,training_style,tune,training_style_tune_003,2048,1536,2048,bf16,NVIDIA GeForce RTX 4060,c11,32,128,32,4,2,8,0.0,0.0,478.5280078649521,594.2476725578308,26.926118589147066,3,3,3,4_4_4_r1,0,
2026-03-02T09:30:39.152316+00:00,B2,training_style,tune,training_style_tune_004,512,512,1024,bf16,NVIDIA GeForce RTX 4060,c06,64,128,32,4,3,8,0.0,0.0,60.20800024271011,161.35167881846428,8.916936450899703,2,2,3,3_3_3_r1,0,
2026-03-02T09:30:39.697789+00:00,B2,training_style,tune,training_style_tune_005,1024,1536,1536,bf16,NVIDIA GeForce RTX 4060,c07,128,128,32,8,3,8,0.0,545.425,178.51199954748154,185.4092761874199,27.06730203150743,3,3,3,3_4_4_r1,0,
2026-03-02T09:30:39.881230+00:00,B2,training_style,tune,training_style_tune_006,1024,1536,512,bf16,NVIDIA GeForce RTX 4060,c10,64,128,64,8,3,8,0.0,183.389,80.89599758386612,96.88095860183235,19.90967148072132,3,3,2,3_4_3_r1,0,
2026-03-02T09:30:39.906070+00:00,B2,training_style,tune,training_style_tune_007,2048,1536,512,bf16,NVIDIA GeForce RTX 4060,c03,64,64,32,4,2,8,0.0,0.0,137.1999979019165,256.7065611481666,23.47832012579793,3,3,2,4_4_3_r1,0,
2026-03-02T09:30:39.999915+00:00,B2,training_style,tune,training_style_tune_008,3072,3072,1536,bf16,NVIDIA GeForce RTX 4060,c11,32,128,32,4,2,8,0.0,0.0,932.3520064353943,989.2351883649825,31.094510493777634,3,3,3,4_4_4_r1,0,
2026-03-02T09:30:40.018460+00:00,B2,training_style,tune,training_style_tune_009,1024,1536,1024,bf16,NVIDIA GeForce RTX 4060,c10,64,128,64,8,3,8,0.0,0.0,127.71199643611908,137.02784031629562,25.22257549713618,3,3,3,3_4_3_r1,0,
2026-03-02T09:30:40.122710+00:00,B2,training_style,tune,training_style_tune_010,1536,2048,4096,bf16,NVIDIA GeForce RTX 4060,c11,32,128,32,4,2,8,0.0,0.0,845.440000295639,999.6902203559875,30.48093746095364,3,3,3,4_4_4_r1,0,
2026-03-02T09:30:40.175469+00:00,B2,training_style,tune,training_style_tune_011,1024,1024,4096,bf16,NVIDIA GeForce RTX 4060,c05,128,64,32,4,3,8,0.0,0.0,315.90400636196136,506.7612984776495,27.19159750749629,3,3,3,3_3_4_r1,0,
2026-03-02T09:30:40.512856+00:00,B2,training_style,tune,training_style_tune_012,3072,4096,4096,bf16,NVIDIA GeForce RTX 4060,c11,32,128,32,4,2,8,0.0,0.0,3499.519944190979,3610.7558703422546,29.455244361474815,3,3,3,4_4_4_r1,0,
2026-03-02T09:30:40.810586+00:00,B2,training_style,tune,training_style_tune_013,512,1024,3072,bf16,NVIDIA GeForce RTX 4060,c05,128,64,32,4,3,8,0.0,297.661,163.83999586105347,277.3059234023093,19.6608004966736,2,3,3,3_3_4_r0,0,
2026-03-02T09:30:40.829434+00:00,B2,training_style,tune,training_style_tune_014,1536,1024,1024,bf16,NVIDIA GeForce RTX 4060,c10,64,128,64,8,3,8,0.0,0.0,139.68000560998917,222.95039787888524,23.061464365875107,3,3,3,4_3_3_r1,0,
2026-03-02T09:30:40.898431+00:00,B2,training_style,tune,training_style_tune_015,2048,3072,1536,bf16,NVIDIA GeForce RTX 4060,c11,32,128,32,4,2,8,0.0,0.0,642.0480012893677,717.1174401044843,30.102660226628856,3,3,3,4_4_4_r1,0,
2026-03-02T09:30:42.970895+00:00,B2,training_style,tune,training_style_tune_016,1536,3072,3072,bf16,NVIDIA GeForce RTX 4060,c10,64,128,64,8,3,8,0.0,2072.396,940.4480159282684,988.7231880426407,30.82682801918023,3,3,3,4_4_4_r0,0,
2026-03-02T09:30:43.002654+00:00,B2,training_style,tune,training_style_tune_017,1024,1024,2048,bf16,NVIDIA GeForce RTX 4060,c05,128,64,32,4,3,8,0.0,0.0,159.743994474411,257.02623710036266,26.8865650325778,3,3,3,3_3_4_r1,0,
2026-03-02T09:30:43.039119+00:00,B2,training_style,tune,training_style_tune_018,1536,1536,1536,bf16,NVIDIA GeForce RTX 4060,c11,32,128,32,4,2,8,0.0,0.0,253.88799607753754,274.4729486107826,28.547065729671328,3,3,3,4_4_4_r1,0,
2026-03-02T09:30:43.078670+00:00,B2,training_style,tune,training_style_tune_019,1536,1536,2048,bf16,NVIDIA GeForce RTX 4060,c11,32,128,32,4,2,8,0.0,0.0,329.6000063419342,463.6969631910324,29.31940603779811,3,3,3,4_4_4_r1,0,
2026-03-02T09:30:43.100999+00:00,B2,training_style,tune,training_style_tune_020,1536,1536,1024,bf16,NVIDIA GeForce RTX 4060,c03,64,64,32,4,2,8,0.0,0.0,173.0560064315796,299.0694370865822,27.920661684229625,3,3,3,4_4_3_r1,0,
2026-03-02T09:30:43.130365+00:00,B2,training_style,tune,training_style_tune_021,1024,2048,1536,bf16,NVIDIA GeForce RTX 4060,c05,128,64,32,4,3,8,0.0,0.0,204.73599433898926,241.66400730609894,31.467114343035284,3,3,3,3_4_4_r0,0,
2026-03-02T09:30:43.144792+00:00,B2,training_style,tune,training_style_tune_022,512,1024,1536,bf16,NVIDIA GeForce RTX 4060,c05,128,64,32,4,3,8,0.0,0.0,92.96000003814697,203.47391709685297,17.32586849547193,2,3,3,3_3_4_r0,0,
2026-03-02T09:30:43.196815+00:00,B2,training_style,tune,training_style_tune_023,1536,2048,2048,bf16,NVIDIA GeForce RTX 4060,c11,32,128,32,4,2,8,0.0,0.0,438.62399458885193,482.9987189173698,29.375734221010358,3,3,3,4_4_4_r1,0,
2026-03-02T09:30:43.211914+00:00,B2,training_style,tune,training_style_tune_024,1024,1024,1024,bf16,NVIDIA GeForce RTX 4060,c06,64,128,32,4,3,8,0.0,0.0,102.12800279259682,147.9968012124299,21.027373387112487,3,3,3,3_3_3_r1,0,
2026-03-02T09:30:43.978973+00:00,B2,training_style,tune,training_style_tune_025,1536,1024,4096,bf16,NVIDIA GeForce RTX 4060,c05,128,64,32,4,3,8,0.0,767.009,427.39200592041016,463.85600715875626,30.147737228382915,3,3,3,4_3_4_r1,0,
2026-03-02T09:30:44.574718+00:00,B2,training_style,tune,training_style_tune_026,2048,4096,512,bf16,NVIDIA GeForce RTX 4060,c04,64,64,64,4,3,8,0.0,595.695,306.17600679397583,361.5875187516212,28.05554452795552,3,3,2,4_4_3_r0,0,
2026-03-02T09:30:44.722870+00:00,B2,training_style,tune,training_style_tune_027,4096,4096,1536,bf16,NVIDIA GeForce RTX 4060,c11,32,128,32,4,2,8,0.0,0.0,1645.9199786186218,1795.8876883983612,31.313556078987425,3,3,3,4_4_4_r1,0,
2026-03-02T09:30:44.808541+00:00,B2,training_style,tune,training_style_tune_028,1536,1536,4096,bf16,NVIDIA GeForce RTX 4060,c11,32,128,32,4,2,8,0.0,0.0,624.3680119514465,825.3440260887146,30.955065701705067,3,3,3,4_4_4_r1,0,
2026-03-02T09:30:46.990770+00:00,B2,training_style,tune,training_style_tune_029,4096,2048,2048,bf16,NVIDIA GeForce RTX 4060,c07,128,128,32,8,3,8,0.0,2182.155,1108.415961265564,1172.6310229301453,30.99895668118027,3,3,3,4_4_4_r2,0,
2026-03-02T09:30:47.024054+00:00,B2,training_style,tune,training_style_tune_030,2048,2048,512,bf16,NVIDIA GeForce RTX 4060,c03,64,64,32,4,2,8,0.0,0.0,162.1280014514923,345.71743667125696,26.4912122369252,3,3,2,4_4_3_r1,0,
2026-03-02T09:30:47.041537+00:00,B2,training_style,tune,training_style_tune_031,512,512,1536,bf16,NVIDIA GeForce RTX 4060,c05,128,64,32,4,3,8,0.0,0.0,72.62400165200233,135.45344054698938,11.08870827386853,2,2,3,3_3_4_r1,0,
2026-03-02T09:30:47.121414+00:00,B2,training_style,eval,training_style_eval_000,2048,1536,3072,bf16,NVIDIA GeForce RTX 4060,c11,32,128,32,4,2,8,0.0,0.0,623.6159801483154,730.9993600845336,30.99239507525665,3,3,3,4_4_4_r1,0,
2026-03-02T09:30:47.161068+00:00,B2,training_style,eval,training_style_eval_001,1024,2048,2048,bf16,NVIDIA GeForce RTX 4060,c05,128,64,32,4,3,8,0.0,0.0,296.9599962234497,402.88064539432526,28.92623485062426,3,3,3,3_4_4_r0,0,
2026-03-02T09:30:47.206658+00:00,B2,training_style,eval,training_style_eval_002,1536,1024,3072,bf16,NVIDIA GeForce RTX 4060,c05,128,64,32,4,3,8,0.0,0.0,319.9999928474426,422.379513978958,30.198989475000015,3,3,3,4_3_4_r1,0,
2026-03-02T09:30:47.322960+00:00,B2,training_style,eval,training_style_eval_003,1024,512,1024,bf16,NVIDIA GeForce RTX 4060,c10,64,128,64,8,3,8,0.0,116.246,67.26399809122086,132.750082463026,15.963098454894585,3,2,3,3_3_3_r2,0,
2026-03-02T09:30:47.343664+00:00,B2,training_style,eval,training_style_eval_004,1024,2048,1024,bf16,NVIDIA GeForce RTX 4060,c06,64,128,32,4,3,8,0.0,0.0,158.720001578331,169.5641614496708,27.060025537363426,3,3,3,3_4_3_r0,0,
2026-03-02T09:30:47.357230+00:00,B2,training_style,eval,training_style_eval_005,1024,512,1536,bf16,NVIDIA GeForce RTX 4060,c10,64,128,64,8,3,8,0.0,0.0,83.96799862384796,123.332482650876,19.18126860704485,3,2,3,3_3_4_r2,0,
2026-03-02T09:30:47.405182+00:00,B2,training_style,eval,training_style_eval_006,2048,1536,2048,bf16,NVIDIA GeForce RTX 4060,c11,32,128,32,4,2,8,0.0,0.0,418.0639982223511,445.08159041404724,30.820405351304732,3,3,3,4_4_4_r1,0,
2026-03-02T09:30:47.433551+00:00,B2,training_style,eval,training_style_eval_007,1536,2048,1024,bf16,NVIDIA GeForce RTX 4060,c03,64,64,32,4,2,8,0.0,0.0,206.84799551963806,323.65663588047016,31.14582245680189,3,3,3,4_4_3_r1,0,
2026-03-02T09:30:47.446749+00:00,B2,training_style,eval,training_style_eval_008,512,512,2048,bf16,NVIDIA GeForce RTX 4060,c05,128,64,32,4,3,8,0.0,0.0,74.89600032567978,166.41856029629707,14.336437451010898,2,2,3,3_3_4_r1,0,
2026-03-02T09:30:47.465958+00:00,B2,training_style,eval,training_style_eval_009,1024,512,2048,bf16,NVIDIA GeForce RTX 4060,c10,64,128,64,8,3,8,0.0,0.0,104.27199676632881,234.13887351751325,20.595017977956847,3,2,3,3_3_4_r2,0,
2026-03-02T09:30:47.512097+00:00,B2,training_style,eval,training_style_eval_010,2048,3072,1024,bf16,NVIDIA GeForce RTX 4060,c03,64,64,32,4,2,8,0.0,0.0,416.7200028896332,737.7100598812094,30.91980658152501,3,3,3,4_4_3_r1,0,
2026-03-02T09:30:47.593146+00:00,B2,training_style,eval,training_style_eval_011,2048,4096,1536,bf16,NVIDIA GeForce RTX 4060,c10,64,128,64,8,3,8,0.0,0.0,809.8400235176086,926.7609530687332,31.82085724050372,3,3,3,4_4_4_r0,0,
2026-03-02T09:30:47.735187+00:00,B2,training_style,eval,training_style_eval_012,2048,3072,3072,bf16,NVIDIA GeForce RTX 4060,c11,32,128,32,4,2,8,0.0,0.0,1259.5199942588806,1439.8054361343384,30.69002940818337,3,3,3,4_4_4_r1,0,
2026-03-02T09:30:47.803989+00:00,B2,training_style,eval,training_style_eval_013,3072,1536,1536,bf16,NVIDIA GeForce RTX 4060,c07,128,128,32,8,3,8,0.0,0.0,477.9040068387985,739.2870289087293,30.331435636800325,3,3,3,4_4_4_r2,0,
2026-03-02T09:30:47.843627+00:00,B2,training_style,eval,training_style_eval_014,2048,1536,1536,bf16,NVIDIA GeForce RTX 4060,c11,32,128,32,4,2,8,0.0,0.0,326.6720026731491,429.5910316705704,29.582199689359264,3,3,3,4_4_4_r1,0,
2026-03-02T09:30:47.898790+00:00,B2,training_style,eval,training_style_eval_015,4096,2048,1024,bf16,NVIDIA GeForce RTX 4060,c04,64,64,64,4,3,8,0.0,0.0,549.8239994049072,637.6761472225189,31.246124582765294,3,3,3,4_4_3_r2,0,
2026-03-02T09:30:47.913097+00:00,B2,training_style,eval,training_style_eval_016,2048,1024,512,bf16,NVIDIA GeForce RTX 4060,c09,128,64,64,8,3,8,0.0,0.0,101.07200220227242,282.51968145370455,21.247067449028112,3,3,2,4_3_3_r2,0,
2026-03-02T09:30:48.029528+00:00,B2,training_style,eval,training_style_eval_017,2048,4096,2048,bf16,NVIDIA GeForce RTX 4060,c10,64,128,64,8,3,8,0.0,0.0,1061.2639784812927,1218.8383877277374,32.37624103398858,3,3,3,4_4_4_r0,0,
2026-03-02T09:30:48.103869+00:00,B2,training_style,eval,training_style_eval_018,1536,2048,3072,bf16,NVIDIA GeForce RTX 4060,c11,32,128,32,4,2,8,0.0,0.0,644.9440121650696,694.6486335992813,29.967489374958767,3,3,3,4_4_4_r1,0,
2026-03-02T09:30:48.175580+00:00,B2,training_style,eval,training_style_eval_019,1536,1536,3072,bf16,NVIDIA GeForce RTX 4060,c11,32,128,32,4,2,8,0.0,0.0,480.76799511909485,511.28320187330246,30.150747909933568,3,3,3,4_4_4_r1,0,
2026-03-02T09:30:48.243455+00:00,B2,training_style,eval,training_style_eval_020,3072,1536,2048,bf16,NVIDIA GeForce RTX 4060,c07,128,128,32,8,3,8,0.0,0.0,613.8560175895691,638.0748802423477,31.48515658100542,3,3,3,4_4_4_r2,0,
2026-03-02T09:30:48.323380+00:00,B2,training_style,eval,training_style_eval_021,2048,1024,4096,bf16,NVIDIA GeForce RTX 4060,c04,64,64,64,4,3,8,0.0,0.0,558.0800175666809,597.6985496282578,30.783881599823278,3,3,3,4_3_4_r2,0,
2026-03-02T09:30:48.339778+00:00,B2,training_style,eval,training_style_eval_022,512,512,1536,bf16,NVIDIA GeForce RTX 4060,c05,128,64,32,4,3,8,0.0,0.0,87.07199990749359,172.24096223711962,9.248740913905364,2,2,3,3_3_4_r1,0,
2026-03-02T09:30:48.683086+00:00,B2,training_style,eval,training_style_eval_023,3072,4096,4096,bf16,NVIDIA GeForce RTX 4060,c11,32,128,32,4,2,8,0.0,0.0,3544.416069984436,3651.3833022117615,29.082143029684612,3,3,3,4_4_4_r1,0,
2026-03-02T09:30:48.752908+00:00,B2,training_style,eval,training_style_eval_024,1536,1024,4096,bf16,NVIDIA GeForce RTX 4060,c05,128,64,32,4,3,8,0.0,0.0,418.8160002231598,462.4259164929389,30.765065998277226,3,3,3,4_3_4_r1,0,
2026-03-02T09:30:48.911400+00:00,B2,training_style,eval,training_style_eval_025,4096,3072,2048,bf16,NVIDIA GeForce RTX 4060,c11,32,128,32,4,2,8,0.0,0.0,1742.303967475891,1807.2588789463043,29.58129494858834,3,3,3,4_4_4_r1,0,
2026-03-02T09:30:48.921853+00:00,B2,training_style,eval,training_style_eval_026,1024,512,512,bf16,NVIDIA GeForce RTX 4060,c10,64,128,64,8,3,8,0.0,0.0,55.215999484062195,625.5145864188653,9.723104118670621,3,2,2,3_3_3_r2,0,
2026-03-02T09:30:48.978760+00:00,B2,training_style,eval,training_style_eval_027,2048,4096,1024,bf16,NVIDIA GeForce RTX 4060,c04,64,64,64,4,3,8,0.0,0.0,583.5199952125549,720.3616088628769,29.441783186439057,3,3,3,4_4_3_r0,0,
2026-03-02T09:30:49.002689+00:00,B2,training_style,eval,training_style_eval_028,1536,1536,1024,bf16,NVIDIA GeForce RTX 4060,c03,64,64,32,4,2,8,0.0,0.0,162.81600296497345,271.8355217576026,29.676678704853547,3,3,3,4_4_3_r1,0,
2026-03-02T09:30:49.035880+00:00,B2,training_style,eval,training_style_eval_029,1024,512,4096,bf16,NVIDIA GeForce RTX 4060,c10,64,128,64,8,3,8,0.0,0.0,175.4240021109581,180.7462377846241,24.48335030735061,3,2,3,3_3_4_r2,0,
2026-03-02T09:30:49.069949+00:00,B2,training_style,eval,training_style_eval_030,1024,1024,3072,bf16,NVIDIA GeForce RTX 4060,c05,128,64,32,4,3,8,0.0,0.0,240.62400311231613,258.6112016439438,26.77393302692606,3,3,3,3_3_4_r1,0,
2026-03-02T09:30:49.079220+00:00,B2,training_style,eval,training_style_eval_031,1024,1024,512,bf16,NVIDIA GeForce RTX 4060,c06,64,128,32,4,3,8,0.0,0.0,66.56000018119812,120.33024348318577,16.13193841762204,3,3,2,3_3_3_r1,0,
2026-03-02T09:30:49.091779+00:00,B2,training_style,eval,training_style_eval_032,512,1024,1024,bf16,NVIDIA GeForce RTX 4060,c03,64,64,32,4,2,8,0.0,0.0,83.29599723219872,143.7286363542079,12.890677339594138,2,3,3,3_3_3_r0,0,
2026-03-02T09:30:49.178479+00:00,B2,training_style,eval,training_style_eval_033,3072,2048,2048,bf16,NVIDIA GeForce RTX 4060,c11,32,128,32,4,2,8,0.0,0.0,850.3679931163788,886.7212820053101,30.304296474706593,3,3,3,4_4_4_r1,0,
2026-03-02T09:30:49.190599+00:00,B2,training_style,eval,training_style_eval_034,1536,1024,512,bf16,NVIDIA GeForce RTX 4060,c10,64,128,64,8,3,8,0.0,0.0,85.64799651503563,124.86592084169378,18.80502523742344,3,3,2,4_3_3_r1,0,
2026-03-02T09:30:49.627453+00:00,B2,training_style,eval,training_style_eval_035,4096,4096,4096,bf16,NVIDIA GeForce RTX 4060,c11,32,128,32,4,2,8,0.0,0.0,4734.463930130005,4844.124207496643,29.029464687087824,3,3,3,4_4_4_r1,0,
2026-03-02T09:30:49.868216+00:00,B2,training_style,eval,training_style_eval_036,2048,4096,4096,bf16,NVIDIA GeForce RTX 4060,c10,64,128,64,8,3,8,0.0,0.0,2048.5119819641113,2306.9219160079956,33.54604578398015,3,3,3,4_4_4_r0,0,
2026-03-02T09:30:49.909990+00:00,B2,training_style,eval,training_style_eval_037,4096,2048,512,bf16,NVIDIA GeForce RTX 4060,c04,64,64,64,4,3,8,0.0,0.0,292.86399483680725,354.3347316980361,29.330797719899206,3,3,2,4_4_3_r2,0,
2026-03-02T09:30:49.930449+00:00,B2,training_style,eval,training_style_eval_038,2048,1536,512,bf16,NVIDIA GeForce RTX 4060,c03,64,64,32,4,2,8,0.0,0.0,128.4479945898056,209.82784003019324,25.078051878403212,3,3,2,4_4_3_r1,0,
2026-03-02T09:30:50.029370+00:00,B2,training_style,eval,training_style_eval_039,3072,3072,1536,bf16,NVIDIA GeForce RTX 4060,c11,32,128,32,4,2,8,0.0,0.0,956.8320214748383,1030.4310274124146,30.298974738861595,3,3,3,4_4_4_r1,0,
2026-03-02T09:30:50.043611+00:00,B2,training_style,eval,training_style_eval_040,1536,1536,512,bf16,NVIDIA GeForce RTX 4060,c03,64,64,32,4,2,8,0.0,0.0,108.5439994931221,118.7888028472662,22.2575095379002,3,3,2,4_4_3_r1,0,
2026-03-02T09:30:50.159475+00:00,B2,training_style,eval,training_style_eval_041,3072,3072,2048,bf16,NVIDIA GeForce RTX 4060,c11,32,128,32,4,2,8,0.0,0.0,1278.943955898285,1334.1798031330109,30.22392457912693,3,3,3,4_4_4_r1,0,
2026-03-02T09:30:50.284043+00:00,B2,training_style,eval,training_style_eval_042,3072,4096,1536,bf16,NVIDIA GeForce RTX 4060,c11,32,128,32,4,2,8,0.0,0.0,1286.080002784729,1430.956186056137,30.05622168162289,3,3,3,4_4_4_r1,0,
2026-03-02T09:30:50.358408+00:00,B2,training_style,eval,training_style_eval_043,2048,3072,1536,bf16,NVIDIA GeForce RTX 4060,c11,32,128,32,4,2,8,0.0,0.0,640.8639848232269,758.6320132017136,30.158275842776792,3,3,3,4_4_4_r1,0,
2026-03-02T09:30:50.382395+00:00,B2,training_style,eval,training_style_eval_044,512,512,4096,bf16,NVIDIA GeForce RTX 4060,c05,128,64,32,4,3,8,0.0,0.0,125.44000148773193,171.23871818184838,17.119607960224908,2,2,3,3_3_4_r1,0,
2026-03-02T09:30:50.438833+00:00,B2,training_style,eval,training_style_eval_045,2048,1024,3072,bf16,NVIDIA GeForce RTX 4060,c04,64,64,64,4,3,8,0.0,0.0,401.39199793338776,503.13088864088036,32.10054498928574,3,3,3,4_3_4_r2,0,
2026-03-02T09:30:50.782208+00:00,B2,training_style,eval,training_style_eval_046,4096,3072,4096,bf16,NVIDIA GeForce RTX 4060,c11,32,128,32,4,2,8,0.0,0.0,3592.703938484192,3708.1094431877136,28.691263424141333,3,3,3,4_4_4_r1,0,
2026-03-02T09:30:50.830002+00:00,B2,training_style,eval,training_style_eval_047,1536,3072,1024,bf16,NVIDIA GeForce RTX 4060,c04,64,64,64,4,3,8,0.0,0.0,323.61599802970886,453.66686940193165,29.861553430102198,3,3,3,4_4_3_r0,0,
2026-03-02T09:30:50.848604+00:00,B2,training_style,eval,training_style_eval_048,512,512,3072,bf16,NVIDIA GeForce RTX 4060,c05,128,64,32,4,3,8,0.0,0.0,102.91199758648872,172.17535853385922,15.6503884267373,2,2,3,3_3_4_r1,0,
2026-03-02T09:30:50.878788+00:00,B2,training_style,eval,training_style_eval_049,512,1024,4096,bf16,NVIDIA GeForce RTX 4060,c05,128,64,32,4,3,8,0.0,0.0,172.83200472593307,193.48031774163246,24.850532184769303,2,3,3,3_3_4_r0,0,
2026-03-02T09:30:50.903162+00:00,B2,training_style,eval,training_style_eval_050,3072,2048,512,bf16,NVIDIA GeForce RTX 4060,c03,64,64,32,4,2,8,0.0,0.0,223.23200106620789,243.8694408535957,28.859889770415343,3,3,2,4_4_3_r1,0,
2026-03-02T09:30:50.914071+00:00,B2,training_style,eval,training_style_eval_051,512,512,1024,bf16,NVIDIA GeForce RTX 4060,c06,64,128,32,4,3,8,0.0,0.0,76.4480009675026,152.10431531071663,7.022693925354822,2,2,3,3_3_3_r1,0,
2026-03-02T09:30:50.955217+00:00,B2,training_style,eval,training_style_eval_052,1536,2048,1536,bf16,NVIDIA GeForce RTX 4060,c11,32,128,32,4,2,8,0.0,0.0,342.38401055336,380.13664454221714,28.22467205866768,3,3,3,4_4_4_r1,0,
2026-03-02T09:30:51.065771+00:00,B2,training_style,eval,training_style_eval_053,1536,3072,3072,bf16,NVIDIA GeForce RTX 4060,c10,64,128,64,8,3,8,0.0,0.0,918.4480011463165,969.7139197587967,31.565237456901478,3,3,3,4_4_4_r0,0,
2026-03-02T09:30:51.116065+00:00,B2,training_style,eval,training_style_eval_054,4096,3072,512,bf16,NVIDIA GeForce RTX 4060,c03,64,64,32,4,2,8,0.0,0.0,416.7040139436722,503.23618054389954,30.920992975464145,3,3,2,4_4_3_r1,0,
2026-03-02T09:30:51.132462+00:00,B2,training_style,eval,training_style_eval_055,1024,1024,1024,bf16,NVIDIA GeForce RTX 4060,c06,64,128,32,4,3,8,0.0,0.0,107.51999914646149,153.62047985196114,19.972876349029196,3,3,3,3_3_3_r1,0,
2026-03-02T09:30:51.160197+00:00,B2,training_style,eval,training_style_eval_056,512,1024,3072,bf16,NVIDIA GeForce RTX 4060,c05,128,64,32,4,3,8,0.0,0.0,142.33599603176117,178.46272081136698,22.631137321589463,2,3,3,3_3_4_r0,0,
2026-03-02T09:30:51.180083+00:00,B2,training_style,eval,training_style_eval_057,1024,1536,1024,bf16,NVIDIA GeForce RTX 4060,c10,64,128,64,8,3,8,0.0,0.0,142.33599603176117,148.44863787293434,22.631137321589463,3,3,3,3_4_3_r1,0,
2026-03-02T09:30:51.301097+00:00,B2,training_style,eval,training_style_eval_058,4096,2048,2048,bf16,NVIDIA GeForce RTX 4060,c07,128,128,32,8,3,8,0.0,0.0,1079.1680216789246,1173.8515651226044,31.8390998229771,3,3,3,4_4_4_r2,0,
2026-03-02T09:30:51.326395+00:00,B2,training_style,eval,training_style_eval_059,2048,3072,512,bf16,NVIDIA GeForce RTX 4060,c03,64,64,32,4,2,8,0.0,0.0,223.60000014305115,259.8499245941638,28.812392396593715,3,3,2,4_4_3_r1,0,
2026-03-02T09:30:51.360355+00:00,B2,training_style,eval,training_style_eval_060,3072,3072,512,bf16,NVIDIA GeForce RTX 4060,c03,64,64,32,4,2,8,0.0,0.0,315.7919943332672,359.94432151317585,30.601397721949716,3,3,2,4_4_3_r1,0,
2026-03-02T09:30:51.425608+00:00,B2,training_style,eval,training_style_eval_061,2048,2048,2048,bf16,NVIDIA GeForce RTX 4060,c11,32,128,32,4,2,8,0.0,0.0,570.3679919242859,701.7881661653519,30.120675471355273,3,3,3,4_4_4_r1,0,
2026-03-02T09:30:51.443114+00:00,B2,training_style,eval,training_style_eval_062,1024,2048,512,bf16,NVIDIA GeForce RTX 4060,c06,64,128,32,4,3,8,0.0,0.0,101.3759970664978,155.62623992562294,21.1833541483331,3,3,2,3_4_3_r0,0,
2026-03-02T09:30:51.563570+00:00,B2,training_style,eval,training_style_eval_063,3072,1536,3072,bf16,NVIDIA GeForce RTX 4060,c07,128,128,32,8,3,8,0.0,0.0,905.4720103740692,1015.3964883089064,32.01758741943134,3,3,3,4_4_4_r2,0,
2026-03-02T09:30:51.574991+00:00,B2,adversarial,tune,adversarial_tune_000,1,1024,1024,bf16,NVIDIA GeForce RTX 4060,c00,32,32,32,2,2,8,0.0,0.0,61.43999844789505,103.8988782465457,0.03413333419561388,0,3,3,0_3_3_r0,0,
2026-03-02T09:30:51.598854+00:00,B2,adversarial,tune,adversarial_tune_001,1,1024,4096,bf16,NVIDIA GeForce RTX 4060,c00,32,32,32,2,2,8,0.0,0.0,82.31999725103378,179.86176446080202,0.10190243294614122,0,3,3,0_3_4_r0,0,
2026-03-02T09:30:51.616125+00:00,B2,adversarial,tune,adversarial_tune_002,1,4096,1024,bf16,NVIDIA GeForce RTX 4060,c00,32,32,32,2,2,8,0.0,0.0,44.03200000524521,110.59200018644333,0.1905116278842825,0,3,3,0_4_3_r0,0,
2026-03-02T09:30:51.708374+00:00,B2,adversarial,tune,adversarial_tune_003,1,4096,4096,bf16,NVIDIA GeForce RTX 4060,c11,32,128,32,4,2,8,0.0,0.0,164.86400365829468,228.13311830162996,0.20352794579432015,0,3,3,0_4_4_r0,0,
2026-03-02T09:30:51.748083+00:00,B2,adversarial,tune,adversarial_tune_004,1,8192,1024,bf16,NVIDIA GeForce RTX 4060,c00,32,32,32,2,2,8,0.0,0.0,49.15200173854828,117.66016140580176,0.34133332126008187,0,3,3,0_4_3_r0,0,
2026-03-02T09:30:51.917664+00:00,B2,adversarial,tune,adversarial_tune_005,1,8192,4096,bf16,NVIDIA GeForce RTX 4060,c11,32,128,32,4,2,8,0.0,0.0,294.9120104312897,315.2028766274452,0.22755554750672122,0,3,3,0_4_4_r0,0,
2026-03-02T09:30:51.930336+00:00,B2,adversarial,tune,adversarial_tune_006,2,1024,1024,bf16,NVIDIA GeForce RTX 4060,c00,32,32,32,2,2,8,0.0,0.0,37.88800165057182,540.1628783345211,0.11070269787999489,0,3,3,0_3_3_r0,0,
2026-03-02T09:30:51.952599+00:00,B2,adversarial,tune,adversarial_tune_007,2,1024,4096,bf16,NVIDIA GeForce RTX 4060,c00,32,32,32,2,2,8,0.0,0.0,59.167999774217606,102.54336111247537,0.28355219145519694,0,3,3,0_3_4_r0,0,
2026-03-02T09:30:51.971771+00:00,B2,adversarial,tune,adversarial_tune_008,2,4096,1024,bf16,NVIDIA GeForce RTX 4060,c00,32,32,32,2,2,8,0.0,0.0,68.88000294566154,164.1468802094459,0.24357165044309462,0,3,3,0_4_3_r0,0,
2026-03-02T09:30:52.057633+00:00,B2,adversarial,tune,adversarial_tune_009,2,4096,4096,bf16,NVIDIA GeForce RTX 4060,c11,32,128,32,4,2,8,0.0,0.0,160.76800227165222,261.7740814387798,0.4174267456941158,0,3,3,0_4_4_r0,0,
2026-03-02T09:30:52.099510+00:00,B2,adversarial,tune,adversarial_tune_010,2,8192,1024,bf16,NVIDIA GeForce RTX 4060,c00,32,32,32,2,2,8,0.0,0.0,61.35999970138073,222.7142436802385,0.5468453742388946,0,3,3,0_4_3_r0,0,
2026-03-02T09:30:52.269642+00:00,B2,adversarial,tune,adversarial_tune_011,2,8192,4096,bf16,NVIDIA GeForce RTX 4060,c11,32,128,32,4,2,8,0.0,0.0,295.9359884262085,329.09343510866154,0.4535363499173306,0,3,3,0_4_4_r0,0,
2026-03-02T09:30:52.280335+00:00,B2,adversarial,tune,adversarial_tune_012,4,1024,1024,bf16,NVIDIA GeForce RTX 4060,c00,32,32,32,2,2,8,0.0,0.0,66.39999896287918,195.0150455534457,0.1263344598045798,0,3,3,0_3_3_r0,0,
2026-03-02T09:30:52.301793+00:00,B2,adversarial,tune,adversarial_tune_013,4,1024,4096,bf16,NVIDIA GeForce RTX 4060,c00,32,32,32,2,2,8,0.0,0.0,83.75999704003334,151.62656202912325,0.40060211539838714,0,3,3,0_3_4_r0,0,
2026-03-02T09:30:52.322109+00:00,B2,adversarial,tune,adversarial_tune_014,4,4096,1024,bf16,NVIDIA GeForce RTX 4060,c00,32,32,32,2,2,8,0.0,0.0,66.6080005466938,231.06208235025377,0.5037597844793065,0,3,3,0_4_3_r0,0,
2026-03-02T09:30:52.408352+00:00,B2,adversarial,tune,adversarial_tune_015,4,4096,4096,bf16,NVIDIA GeForce RTX 4060,c11,32,128,32,4,2,8,0.0,0.0,163.61600160598755,270.8908787369728,0.8203215252944323,0,3,3,0_4_4_r0,0,
2026-03-02T09:30:52.449572+00:00,B2,adversarial,tune,adversarial_tune_016,4,8192,1024,bf16,NVIDIA GeForce RTX 4060,c00,32,32,32,2,2,8,0.0,0.0,52.1440003067255,122.92096056044102,1.2869910939944578,0,3,3,0_4_3_r0,0,
2026-03-02T09:30:52.613667+00:00,B2,adversarial,tune,adversarial_tune_017,4,8192,4096,bf16,NVIDIA GeForce RTX 4060,c11,32,128,32,4,2,8,0.0,0.0,297.7280020713806,330.5356758832931,0.9016130633746782,0,3,3,0_4_4_r0,0,
2026-03-02T09:30:52.626079+00:00,B2,adversarial,tune,adversarial_tune_018,8,1024,1024,bf16,NVIDIA GeForce RTX 4060,c00,32,32,32,2,2,8,0.0,0.0,35.2960005402565,348.7616057693949,0.47532909517226785,0,3,3,0_3_3_r0,0,
2026-03-02T09:30:52.648677+00:00,B2,adversarial,tune,adversarial_tune_019,8,1024,4096,bf16,NVIDIA GeForce RTX 4060,c00,32,32,32,2,2,8,0.0,0.0,60.416001826524734,117.23808184266089,1.1107796274353405,0,3,3,0_3_4_r0,0,
2026-03-02T09:30:52.667860+00:00,B2,adversarial,tune,adversarial_tune_020,8,4096,1024,bf16,NVIDIA GeForce RTX 4060,c00,32,32,32,2,2,8,0.0,0.0,52.22399905323982,173.97983878850926,1.2850196311390436,0,3,3,0_4_3_r0,0,
2026-03-02T09:30:52.764587+00:00,B2,adversarial,tune,adversarial_tune_021,8,4096,4096,bf16,NVIDIA GeForce RTX 4060,c11,32,128,32,4,2,8,0.0,0.0,162.81600296497345,254.27968397736544,1.6487043724918637,0,3,3,0_4_4_r0,0,
2026-03-02T09:30:52.806562+00:00,B2,adversarial,tune,adversarial_tune_022,8,8192,1024,bf16,NVIDIA GeForce RTX 4060,c00,32,32,32,2,2,8,0.0,0.0,78.23999971151352,107.3459189385175,1.715461765016456,0,3,3,0_4_3_r0,0,
2026-03-02T09:30:52.976067+00:00,B2,adversarial,tune,adversarial_tune_023,8,8192,4096,bf16,NVIDIA GeForce RTX 4060,c11,32,128,32,4,2,8,0.0,0.0,296.9599962234497,315.2918377518654,1.8078896781640164,0,3,3,0_4_4_r0,0,
2026-03-02T09:30:52.987214+00:00,B2,adversarial,tune,adversarial_tune_024,16,1024,1024,bf16,NVIDIA GeForce RTX 4060,c00,32,32,32,2,2,8,0.0,0.0,65.15199691057205,177.5395192205904,0.5150177061503882,0,3,3,0_3_3_r0,0,
2026-03-02T09:30:53.011581+00:00,B2,adversarial,tune,adversarial_tune_025,16,1024,4096,bf16,NVIDIA GeForce RTX 4060,c00,32,32,32,2,2,8,0.0,0.0,72.31999933719635,404.3852978944773,1.8558867426726842,0,3,3,0_3_4_r0,0,
2026-03-02T09:30:53.033570+00:00,B2,adversarial,tune,adversarial_tune_026,16,4096,1024,bf16,NVIDIA GeForce RTX 4060,c00,32,32,32,2,2,8,0.0,0.0,47.439999878406525,153.64095970988274,2.829210125295394,0,3,3,0_4_3_r0,0,
2026-03-02T09:30:53.121322+00:00,B2,adversarial,tune,adversarial_tune_027,16,4096,4096,bf16,NVIDIA GeForce RTX 4060,c11,32,128,32,4,2,8,0.0,0.0,170.415997505188,427.31521725654557,3.1503551301494213,0,3,3,0_4_4_r0,0,
2026-03-02T09:30:53.164149+00:00,B2,adversarial,tune,adversarial_tune_028,16,8192,1024,bf16,NVIDIA GeForce RTX 4060,c00,32,32,32,2,2,8,0.0,0.0,60.22400036454201,226.74239441752422,4.457283713720989,0,3,3,0_4_3_r0,0,
2026-03-02T09:30:53.330388+00:00,B2,adversarial,tune,adversarial_tune_029,16,8192,4096,bf16,NVIDIA GeForce RTX 4060,c11,32,128,32,4,2,8,0.0,0.0,295.29599845409393,311.6457524895668,3.636154331996211,0,3,3,0_4_4_r0,0,
2026-03-02T09:30:53.342957+00:00,B2,adversarial,tune,adversarial_tune_030,32,1024,1024,bf16,NVIDIA GeForce RTX 4060,c00,32,32,32,2,2,8,0.0,0.0,37.88800165057182,158.1337559223171,1.7712431660799182,0,3,3,1_3_3_r0,0,
2026-03-02T09:30:53.366244+00:00,B2,adversarial,tune,adversarial_tune_031,32,1024,4096,bf16,NVIDIA GeForce RTX 4060,c04,64,64,64,4,3,8,0.0,0.0,64.57599997520447,119.29599918425073,4.156891973845892,0,3,3,1_3_4_r0,0,
2026-03-02T09:30:53.376080+00:00,B2,adversarial,eval,adversarial_eval_000,1,1024,1024,bf16,NVIDIA GeForce RTX 4060,c00,32,32,32,2,2,8,0.0,0.0,46.08000069856644,93.23104172945011,0.04551111042116896,0,3,3,0_3_3_r0,0,
2026-03-02T09:30:53.395621+00:00,B2,adversarial,eval,adversarial_eval_001,1,1024,4096,bf16,NVIDIA GeForce RTX 4060,c00,32,32,32,2,2,8,0.0,0.0,59.36000123620033,350.6300812959662,0.14131751727262867,0,3,3,0_3_4_r0,0,
2026-03-02T09:30:53.411747+00:00,B2,adversarial,eval,adversarial_eval_002,1,4096,1024,bf16,NVIDIA GeForce RTX 4060,c00,32,32,32,2,2,8,0.0,0.0,49.92000013589859,76.38015970587728,0.16804102518356293,0,3,3,0_4_3_r0,0,
2026-03-02T09:30:53.493282+00:00,B2,adversarial,eval,adversarial_eval_003,1,4096,4096,bf16,NVIDIA GeForce RTX 4060,c11,32,128,32,4,2,8,0.0,0.0,165.8879965543747,239.3804751336574,0.2022716091396133,0,3,3,0_4_4_r0,0,
2026-03-02T09:30:53.535072+00:00,B2,adversarial,eval,adversarial_eval_004,1,8192,1024,bf16,NVIDIA GeForce RTX 4060,c00,32,32,32,2,2,8,0.0,0.0,74.16000217199326,126.4233610033988,0.22622998258670446,0,3,3,0_4_3_r0,0,
2026-03-02T09:30:53.708131+00:00,B2,adversarial,eval,adversarial_eval_005,1,8192,4096,bf16,NVIDIA GeForce RTX 4060,c11,32,128,32,4,2,8,0.0,0.0,493.5680031776428,556.1344015598297,0.13596680410388448,0,3,3,0_4_4_r0,0,
2026-03-02T09:30:53.719424+00:00,B2,adversarial,eval,adversarial_eval_006,2,1024,1024,bf16,NVIDIA GeForce RTX 4060,c00,32,32,32,2,2,8,0.0,0.0,70.39999961853027,164.47487592697132,0.0595781821410124,0,3,3,0_3_3_r0,0,
2026-03-02T09:30:53.739554+00:00,B2,adversarial,eval,adversarial_eval_007,2,1024,4096,bf16,NVIDIA GeForce RTX 4060,c00,32,32,32,2,2,8,0.0,0.0,86.99199929833412,144.0841554105281,0.19285929896223547,0,3,3,0_3_4_r0,0,
2026-03-02T09:30:53.755916+00:00,B2,adversarial,eval,adversarial_eval_008,2,4096,1024,bf16,NVIDIA GeForce RTX 4060,c00,32,32,32,2,2,8,0.0,0.0,55.15199899673462,150.59936128556714,0.3041995993833937,0,3,3,0_4_3_r0,0,
2026-03-02T09:30:53.851174+00:00,B2,adversarial,eval,adversarial_eval_009,2,4096,4096,bf16,NVIDIA GeForce RTX 4060,c11,32,128,32,4,2,8,0.0,0.0,265.0880068540573,544.3788692355149,0.2531569224742272,0,3,3,0_4_4_r0,0,
2026-03-02T09:30:53.894186+00:00,B2,adversarial,eval,adversarial_eval_010,2,8192,1024,bf16,NVIDIA GeForce RTX 4060,c00,32,32,32,2,2,8,0.0,0.0,96.25600278377533,238.17216232419014,0.3485957345992748,0,3,3,0_4_3_r0,0,
2026-03-02T09:30:54.076616+00:00,B2,adversarial,eval,adversarial_eval_011,2,8192,4096,bf16,NVIDIA GeForce RTX 4060,c11,32,128,32,4,2,8,0.0,0.0,493.5680031776428,589.1462409496305,0.27193360820776896,0,3,3,0_4_4_r0,0,
2026-03-02T09:30:54.087929+00:00,B2,adversarial,eval,adversarial_eval_012,4,1024,1024,bf16,NVIDIA GeForce RTX 4060,c00,32,32,32,2,2,8,0.0,0.0,71.60000130534172,131.80384345352644,0.1171593274730034,0,3,3,0_3_3_r0,0,
2026-03-02T09:30:54.110240+00:00,B2,adversarial,eval,adversarial_eval_013,4,1024,4096,bf16,NVIDIA GeForce RTX 4060,c00,32,32,32,2,2,8,0.0,0.0,118.78400295972824,217.67168283462524,0.2824827515820971,0,3,3,0_3_4_r0,0,
2026-03-02T09:30:54.129725+00:00,B2,adversarial,eval,adversarial_eval_014,4,4096,1024,bf16,NVIDIA GeForce RTX 4060,c00,32,32,32,2,2,8,0.0,0.0,77.7439996600151,169.26943704485876,0.4316015659952924,0,3,3,0_4_3_r0,0,
2026-03-02T09:30:54.222496+00:00,B2,adversarial,eval,adversarial_eval_015,4,4096,4096,bf16,NVIDIA GeForce RTX 4060,c11,32,128,32,4,2,8,0.0,0.0,280.4799973964691,314.13247078657145,0.4785286981098982,0,3,3,0_4_4_r0,0,
2026-03-02T09:30:54.270432+00:00,B2,adversarial,eval,adversarial_eval_016,4,8192,1024,bf16,NVIDIA GeForce RTX 4060,c00,32,32,32,2,2,8,0.0,0.0,104.44799810647964,180.6995205581187,0.6425098155695218,0,3,3,0_4_3_r0,0,
2026-03-02T09:30:54.439742+00:00,B2,adversarial,eval,adversarial_eval_017,4,8192,4096,bf16,NVIDIA GeForce RTX 4060,c11,32,128,32,4,2,8,0.0,0.0,472.9599952697754,588.8614231348038,0.5675648229971014,0,3,3,0_4_4_r0,0,
2026-03-02T09:30:54.450913+00:00,B2,adversarial,eval,adversarial_eval_018,8,1024,1024,bf16,NVIDIA GeForce RTX 4060,c00,32,32,32,2,2,8,0.0,0.0,72.7040022611618,146.75968483090395,0.23076055620341446,0,3,3,0_3_3_r0,0,
2026-03-02T09:30:54.473614+00:00,B2,adversarial,eval,adversarial_eval_019,8,1024,4096,bf16,NVIDIA GeForce RTX 4060,c00,32,32,32,2,2,8,0.0,0.0,116.2240020930767,279.79776501655556,0.5774096812313915,0,3,3,0_3_4_r0,0,
2026-03-02T09:30:54.492064+00:00,B2,adversarial,eval,adversarial_eval_020,8,4096,1024,bf16,NVIDIA GeForce RTX 4060,c00,32,32,32,2,2,8,0.0,0.0,59.856001287698746,119.69792231917381,1.1211718550566094,0,3,3,0_4_3_r0,0,
2026-03-02T09:30:54.581638+00:00,B2,adversarial,eval,adversarial_eval_021,8,4096,4096,bf16,NVIDIA GeForce RTX 4060,c11,32,128,32,4,2,8,0.0,0.0,256.00001215934753,324.59776908159245,1.048575950195315,0,3,3,0_4_4_r0,0,
2026-03-02T09:30:54.623377+00:00,B2,adversarial,eval,adversarial_eval_022,8,8192,1024,bf16,NVIDIA GeForce RTX 4060,c00,32,32,32,2,2,8,0.0,0.0,81.87199756503105,89.57791969180106,1.639360611586283,0,3,3,0_4_3_r0,0,
2026-03-02T09:30:54.792853+00:00,B2,adversarial,eval,adversarial_eval_023,8,8192,4096,bf16,NVIDIA GeForce RTX 4060,c11,32,128,32,4,2,8,0.0,0.0,477.183997631073,584.908804297447,1.1250815506497203,0,3,3,0_4_4_r0,0,
2026-03-02T09:30:54.802310+00:00,B2,adversarial,eval,adversarial_eval_024,16,1024,1024,bf16,NVIDIA GeForce RTX 4060,c00,32,32,32,2,2,8,0.0,0.0,49.15200173854828,166.66623651981337,0.6826666425201637,0,3,3,0_3_3_r0,0,
2026-03-02T09:30:54.823112+00:00,B2,adversarial,eval,adversarial_eval_025,16,1024,4096,bf16,NVIDIA GeForce RTX 4060,c00,32,32,32,2,2,8,0.0,0.0,110.01599952578545,175.55455967783917,1.2199837167187866,0,3,3,0_3_4_r0,0,
2026-03-02T09:30:54.840101+00:00,B2,adversarial,eval,adversarial_eval_026,16,4096,1024,bf16,NVIDIA GeForce RTX 4060,c00,32,32,32,2,2,8,0.0,0.0,63.999999314546585,78.42816039919852,2.097152022460938,0,3,3,0_4_3_r0,0,
2026-03-02T09:30:54.941749+00:00,B2,adversarial,eval,adversarial_eval_027,16,4096,4096,bf16,NVIDIA GeForce RTX 4060,c11,32,128,32,4,2,8,0.0,0.0,256.00001215934753,305.23135781288147,2.09715190039063,0,3,3,0_4_4_r0,0,
2026-03-02T09:30:54.985371+00:00,B2,adversarial,eval,adversarial_eval_028,16,8192,1024,bf16,NVIDIA GeForce RTX 4060,c00,32,32,32,2,2,8,0.0,0.0,94.2080020904541,146.10432080924497,2.8493912411204825,0,3,3,0_4_3_r0,0,
2026-03-02T09:30:55.167746+00:00,B2,adversarial,eval,adversarial_eval_029,16,8192,4096,bf16,NVIDIA GeForce RTX 4060,c11,32,128,32,4,2,8,0.0,0.0,477.183997631073,574.3228608369825,2.2501631012994405,0,3,3,0_4_4_r0,0,
2026-03-02T09:30:55.178203+00:00,B2,adversarial,eval,adversarial_eval_030,32,1024,1024,bf16,NVIDIA GeForce RTX 4060,c00,32,32,32,2,2,8,0.0,0.0,55.71199953556061,153.67807939648628,1.2045674999901028,0,3,3,1_3_3_r0,0,
2026-03-02T09:30:55.199356+00:00,B2,adversarial,eval,adversarial_eval_031,32,1024,4096,bf16,NVIDIA GeForce RTX 4060,c04,64,64,64,4,3,8,0.0,0.0,123.64800274372101,172.72831857204423,2.170964755139415,0,3,3,1_3_4_r0,0,
2026-03-02T09:30:55.219107+00:00,B2,adversarial,eval,adversarial_eval_032,32,4096,1024,bf16,NVIDIA GeForce RTX 4060,c00,32,32,32,2,2,8,0.0,0.0,68.52800026535988,113.28512109816072,3.917164589080984,0,3,3,1_4_3_r0,0,
2026-03-02T09:30:55.309131+00:00,B2,adversarial,eval,adversarial_eval_033,32,4096,4096,bf16,NVIDIA GeForce RTX 4060,c04,64,64,64,4,3,8,0.0,0.0,271.36000990867615,279.50975716114044,3.9568904215523815,0,3,3,1_4_4_r0,0,
2026-03-02T09:30:55.355934+00:00,B2,adversarial,eval,adversarial_eval_034,32,8192,1024,bf16,NVIDIA GeForce RTX 4060,c00,32,32,32,2,2,8,0.0,0.0,105.47199845314026,119.74879845976827,5.090174831934414,0,3,3,1_4_3_r0,0,
2026-03-02T09:30:55.541602+00:00,B2,adversarial,eval,adversarial_eval_035,32,8192,4096,bf16,NVIDIA GeForce RTX 4060,c04,64,64,64,4,3,8,0.0,0.0,557.8240156173706,623.5801649093627,3.84975115426552,0,3,3,1_4_4_r0,0,
2026-03-02T09:30:57.886208+00:00,B2,adversarial,eval,adversarial_eval_036,1024,1,512,bf16,NVIDIA GeForce RTX 4060,c00,32,32,32,2,2,8,0.0,2344.538,51.072001457214355,63.988480679690824,0.020531327734990886,3,0,2,3_0_3_r2,0,anchor_skipped
2026-03-02T09:30:58.206797+00:00,B2,adversarial,eval,adversarial_eval_037,1024,1,2048,bf16,NVIDIA GeForce RTX 4060,c11,32,128,32,4,2,8,0.0,320.543,89.91999924182892,747.6326417922967,0.04664484025094272,3,0,3,3_0_4_r2,0,anchor_skipped
2026-03-02T09:30:58.267351+00:00,B2,adversarial,eval,adversarial_eval_038,2048,1,512,bf16,NVIDIA GeForce RTX 4060,c04,64,64,64,4,3,8,0.0,60.512,39.69600051641464,41.98399931192398,0.05283030967144434,3,0,2,4_0_3_r2,0,anchor_skipped
2026-03-02T09:30:58.362536+00:00,B2,adversarial,eval,adversarial_eval_039,2048,1,2048,bf16,NVIDIA GeForce RTX 4060,c00,32,32,32,2,2,8,0.0,95.144,58.400001376867294,559.8310294747338,0.14364054455866496,3,0,3,4_0_4_r2,0,anchor_skipped
2026-03-02T09:30:58.377485+00:00,B2,adversarial,eval,adversarial_eval_040,4096,1,512,bf16,NVIDIA GeForce RTX 4060,c04,64,64,64,4,3,8,0.0,0.0,45.1200008392334,81.46943945437658,0.0929588635191892,3,0,2,4_0_3_r2,0,
2026-03-02T09:30:58.421151+00:00,B2,adversarial,eval,adversarial_eval_041,4096,1,2048,bf16,NVIDIA GeForce RTX 4060,c00,32,32,32,2,2,8,0.0,0.0,69.63200122117996,203.7587274610994,0.2409411722450521,3,0,3,4_0_4_r2,0,
2026-03-02T09:30:58.561370+00:00,B2,adversarial,eval,adversarial_eval_042,1024,2,512,bf16,NVIDIA GeForce RTX 4060,c00,32,32,32,2,2,8,0.0,0.0,40.65600037574768,238.38719770312252,0.051582840924288345,3,0,2,3_0_3_r2,0,
2026-03-02T09:30:58.746376+00:00,B2,adversarial,eval,adversarial_eval_043,1024,2,2048,bf16,NVIDIA GeForce RTX 4060,c11,32,128,32,4,2,8,0.0,0.0,112.64000087976456,174.60224330425262,0.07447272669106476,3,0,3,3_0_4_r2,0,
2026-03-02T09:30:58.967840+00:00,B2,adversarial,eval,adversarial_eval_044,2048,2,512,bf16,NVIDIA GeForce RTX 4060,c04,64,64,64,4,3,8,0.0,0.0,48.08000102639198,237.1072021126747,0.08723593823755682,3,0,2,4_0_3_r2,0,
2026-03-02T09:30:58.994339+00:00,B2,adversarial,eval,adversarial_eval_045,2048,2,2048,bf16,NVIDIA GeForce RTX 4060,c00,32,32,32,2,2,8,0.0,0.0,82.76800066232681,266.6598404943942,0.2027017188496184,3,0,3,4_0_4_r2,0,
2026-03-02T09:30:59.014283+00:00,B2,adversarial,eval,adversarial_eval_046,4096,2,512,bf16,NVIDIA GeForce RTX 4060,c04,64,64,64,4,3,8,0.0,0.0,71.6640017926693,153.59615936875343,0.11705469678164265,3,0,2,4_0_3_r2,0,
2026-03-02T09:30:59.068152+00:00,B2,adversarial,eval,adversarial_eval_047,4096,2,2048,bf16,NVIDIA GeForce RTX 4060,c00,32,32,32,2,2,8,0.0,0.0,84.99199897050858,190.22848099470133,0.3947951855049682,3,0,3,4_0_4_r2,0,
2026-03-02T09:30:59.076988+00:00,B2,adversarial,eval,adversarial_eval_048,1024,4,512,bf16,NVIDIA GeForce RTX 4060,c00,32,32,32,2,2,8,0.0,0.0,64.91199880838394,207.07328304648394,0.0646152341169052,3,0,2,3_0_3_r2,0,
2026-03-02T09:30:59.095001+00:00,B2,adversarial,eval,adversarial_eval_049,1024,4,2048,bf16,NVIDIA GeForce RTX 4060,c11,32,128,32,4,2,8,0.0,0.0,141.29599928855896,212.77696117758745,0.11873808235530478,3,0,3,3_0_4_r2,0,
2026-03-02T09:30:59.104034+00:00,B2,adversarial,eval,adversarial_eval_050,2048,4,512,bf16,NVIDIA GeForce RTX 4060,c04,64,64,64,4,3,8,0.0,0.0,60.416001826524734,104.45856101810921,0.13884745342941757,3,0,2,4_0_3_r2,0,
2026-03-02T09:30:59.125876+00:00,B2,adversarial,eval,adversarial_eval_051,2048,4,2048,bf16,NVIDIA GeForce RTX 4060,c00,32,32,32,2,2,8,0.0,0.0,91.13600105047226,182.63743728399277,0.3681797710371024,3,0,3,4_0_4_r2,0,
2026-03-02T09:30:59.140691+00:00,B2,adversarial,eval,adversarial_eval_052,4096,4,512,bf16,NVIDIA GeForce RTX 4060,c04,64,64,64,4,3,8,0.0,0.0,66.04800000786781,121.05727612972257,0.25401550384571,3,0,2,4_0_3_r2,0,
2026-03-02T09:30:59.184095+00:00,B2,adversarial,eval,adversarial_eval_053,4096,4,2048,bf16,NVIDIA GeForce RTX 4060,c00,32,32,32,2,2,8,0.0,0.0,62.87999823689461,169.52320143580437,1.0672529561335788,3,0,3,4_0_4_r2,0,
2026-03-02T09:30:59.191460+00:00,B2,adversarial,eval,adversarial_eval_054,1024,8,512,bf16,NVIDIA GeForce RTX 4060,c00,32,32,32,2,2,8,0.0,0.0,44.03200000524521,122.96192057430741,0.1905116278842825,3,0,2,3_0_3_r2,0,
2026-03-02T09:30:59.209560+00:00,B2,adversarial,eval,adversarial_eval_055,1024,8,2048,bf16,NVIDIA GeForce RTX 4060,c11,32,128,32,4,2,8,0.0,0.0,151.5520066022873,177.59583994746208,0.22140539575998977,3,0,3,3_0_4_r2,0,
2026-03-02T09:30:59.217910+00:00,B2,adversarial,eval,adversarial_eval_056,2048,8,512,bf16,NVIDIA GeForce RTX 4060,c04,64,64,64,4,3,8,0.0,0.0,59.28000062704086,68.65856066346167,0.28301646124387847,3,0,2,4_0_3_r2,0,
2026-03-02T09:30:59.236678+00:00,B2,adversarial,eval,adversarial_eval_057,2048,8,2048,bf16,NVIDIA GeForce RTX 4060,c00,32,32,32,2,2,8,0.0,0.0,76.688002794981,94.57120090723038,0.8750894736352696,3,0,3,4_0_4_r2,0,
2026-03-02T09:30:59.251350+00:00,B2,adversarial,eval,adversarial_eval_058,4096,8,512,bf16,NVIDIA GeForce RTX 4060,c04,64,64,64,4,3,8,0.0,0.0,103.42399775981903,146.95424139499664,0.32443565059168633,3,0,2,4_0_3_r2,0,
2026-03-02T09:30:59.296680+00:00,B2,adversarial,eval,adversarial_eval_059,4096,8,2048,bf16,NVIDIA GeForce RTX 4060,c00,32,32,32,2,2,8,0.0,0.0,88.06400001049042,171.749438047409,1.52409302307426,3,0,3,4_0_4_r2,0,
2026-03-02T09:30:59.461180+00:00,B2,adversarial,eval,adversarial_eval_060,64,64,8192,bf16,NVIDIA GeForce RTX 4060,c04,64,64,64,4,3,8,0.0,164.44,93.18400174379349,101.85119688510895,0.7201758106988551,1,1,3,1_1_4_r1,0,
2026-03-02T09:30:59.478845+00:00,B2,adversarial,eval,adversarial_eval_061,128,128,8192,bf16,NVIDIA GeForce RTX 4060,c04,64,64,64,4,3,8,0.0,0.0,90.04800021648407,126.89344167709342,2.981026289919324,1,1,3,2_2_4_r1,0,
2026-03-02T09:30:59.741591+00:00,B2,adversarial,eval,adversarial_eval_062,2048,128,8192,bf16,NVIDIA GeForce RTX 4060,c04,64,64,64,4,3,8,0.0,262.701,184.32000279426575,243.14079970121367,23.301688535638508,3,1,3,4_2_4_r2,0,anchor_skipped
2026-03-02T09:30:59.840941+00:00,B2,adversarial,eval,adversarial_eval_063,128,2048,8192,bf16,NVIDIA GeForce RTX 4060,c06,64,128,32,4,3,8,0.0,0.0,224.2559939622879,266.8982475996017,19.152073574997797,1,3,3,2_4_4_r0,0,
