results/B2_sweep_a03_k4.csv
timestamp,method,workload,split,shape_id,M,N,K,dtype,gpu,config_id,BLOCK_M,BLOCK_N,BLOCK_K,num_warps,num_stages,GROUP_M,compile_time_ms,tune_time_ms,runtime_cost_us,p99_us,runtime_perf_tflops,bucket_m,bucket_n,bucket_k,cache_key,invalid_config,notes
2026-03-02T09:29:26.483386+00:00,B2,uniform,tune,uniform_tune_000,1536,512,1024,bf16,NVIDIA GeForce RTX 4060,c07,128,128,32,8,3,8,175.4091940820217,2696.686,87.0399996638298,99.85023654997349,18.504282424409332,3,2,3,4_3_3_r2,0,
2026-03-02T09:29:28.011582+00:00,B2,uniform,tune,uniform_tune_001,1536,1536,2048,bf16,NVIDIA GeForce RTX 4060,c05,128,64,32,4,3,8,0.0,1528.142,323.88798892498016,357.3795250058174,29.836476641430277,3,3,3,4_4_4_r1,0,
2026-03-02T09:29:28.513481+00:00,B2,uniform,tune,uniform_tune_002,384,2048,1536,bf16,NVIDIA GeForce RTX 4060,c04,64,64,64,4,3,8,0.0,501.84,105.15200346708298,122.48128302395338,22.975492851700963,2,3,3,3_4_4_r0,0,
2026-03-02T09:29:28.607594+00:00,B2,uniform,tune,uniform_tune_003,1536,64,3072,bf16,NVIDIA GeForce RTX 4060,c04,64,64,64,4,3,8,0.0,94.062,54.27199974656105,59.85152117908001,11.1287547689501,3,1,3,4_1_4_r2,0,anchor_skipped
2026-03-02T09:29:28.734030+00:00,B2,uniform,tune,uniform_tune_004,768,128,2048,bf16,NVIDIA GeForce RTX 4060,c11,32,128,32,4,2,8,0.0,126.383,51.19999870657921,76.1388822644949,7.864320198669438,3,1,3,3_2_4_r2,0,
2026-03-02T09:29:28.749070+00:00,B2,uniform,tune,uniform_tune_005,512,128,4096,bf16,NVIDIA GeForce RTX 4060,c11,32,128,32,4,2,8,0.0,0.0,81.90399780869484,151.99935868382443,6.554880425421753,2,1,3,3_2_4_r2,0,
2026-03-02T09:29:29.654959+00:00,B2,uniform,tune,uniform_tune_006,2048,1024,4096,bf16,NVIDIA GeForce RTX 4060,c03,64,64,32,4,2,8,0.0,905.839,582.6560258865356,652.4051129817962,29.48543981478627,3,3,3,4_3_4_r2,0,
2026-03-02T09:29:29.738890+00:00,B2,uniform,tune,uniform_tune_007,128,768,512,bf16,NVIDIA GeForce RTX 4060,c04,64,64,64,4,3,8,0.0,83.879,39.96799886226654,82.3795193433761,2.518597349516926,1,3,2,2_3_3_r0,0,
2026-03-02T09:29:29.783171+00:00,B2,uniform,tune,uniform_tune_008,2048,256,64,bf16,NVIDIA GeForce RTX 4060,c10,64,128,64,8,3,8,0.0,44.24,32.76799991726875,53.056000173091846,2.048000005170703,3,2,1,4_2_1_r2,0,anchor_skipped
2026-03-02T09:29:29.909864+00:00,B2,uniform,tune,uniform_tune_009,192,768,2048,bf16,NVIDIA GeForce RTX 4060,c03,64,64,32,4,2,8,0.0,126.655,56.28800019621849,72.92447984218597,10.730169377034933,2,3,3,2_3_4_r0,0,
2026-03-02T09:29:30.157270+00:00,B2,uniform,tune,uniform_tune_010,1024,1024,1536,bf16,NVIDIA GeForce RTX 4060,c09,128,64,64,8,3,8,0.0,247.354,138.2399946451187,234.79935675859443,23.30168979150595,3,3,3,3_3_4_r1,0,
2026-03-02T09:29:30.228036+00:00,B2,uniform,tune,uniform_tune_011,256,384,768,bf16,NVIDIA GeForce RTX 4060,c04,64,64,64,4,3,8,0.0,70.71,33.79200026392937,53.296318054199176,4.468363601463886,2,2,3,2_3_3_r1,0,
2026-03-02T09:29:30.315455+00:00,B2,uniform,tune,uniform_tune_012,64,192,2048,bf16,NVIDIA GeForce RTX 4060,c00,32,32,32,2,2,8,0.0,87.373,45.56800052523613,130.28191842138762,1.1045393131113073,1,2,3,1_2_4_r0,0,
2026-03-02T09:29:30.385561+00:00,B2,uniform,tune,uniform_tune_013,192,128,512,bf16,NVIDIA GeForce RTX 4060,c01,64,32,32,2,2,8,0.0,70.062,34.47999991476536,100.72703912854193,0.7298672871870642,2,1,2,2_2_3_r1,0,
2026-03-02T09:29:30.391878+00:00,B2,uniform,tune,uniform_tune_014,128,128,1024,bf16,NVIDIA GeForce RTX 4060,c01,64,32,32,2,2,8,0.0,0.0,47.50399850308895,102.07648061215872,0.7063496349221661,1,1,3,2_2_3_r1,0,
2026-03-02T09:29:31.125114+00:00,B2,uniform,tune,uniform_tune_015,3072,3072,768,bf16,NVIDIA GeForce RTX 4060,c03,64,64,32,4,2,8,0.0,733.186,493.53599548339844,597.1152186393736,29.370734367211117,3,3,3,4_4_3_r1,0,
2026-03-02T09:29:31.233707+00:00,B2,uniform,tune,uniform_tune_016,256,128,3072,bf16,NVIDIA GeForce RTX 4060,c04,64,64,64,4,3,8,0.0,108.544,52.22399905323982,60.742400512099266,3.855058893417131,2,1,3,2_2_4_r2,0,
2026-03-02T09:29:31.276037+00:00,B2,uniform,tune,uniform_tune_017,96,1024,192,bf16,NVIDIA GeForce RTX 4060,c11,32,128,32,4,2,8,0.0,42.288,29.64800037443638,50.997120179235864,1.273230421048847,1,3,2,2_3_2_r0,0,anchor_skipped
2026-03-02T09:29:31.327251+00:00,B2,uniform,tune,uniform_tune_018,64,64,192,bf16,NVIDIA GeForce RTX 4060,c00,32,32,32,2,2,8,0.0,51.178,28.575999662280083,54.47072036564347,0.05504143402115722,1,1,2,1_1_2_r1,0,
2026-03-02T09:29:31.376805+00:00,B2,uniform,tune,uniform_tune_019,4096,64,64,bf16,NVIDIA GeForce RTX 4060,c02,32,64,32,2,2,8,0.0,49.522,31.74399957060814,47.77216035872697,1.0570322723626844,3,1,1,4_1_1_r2,0,anchor_skipped
2026-03-02T09:29:31.576865+00:00,B2,uniform,tune,uniform_tune_020,128,4096,3072,bf16,NVIDIA GeForce RTX 4060,c06,64,128,32,4,3,8,0.0,200.016,139.21599835157394,203.37663799524307,23.138328282250768,1,3,3,2_4_4_r0,0,anchor_skipped
2026-03-02T09:29:31.621855+00:00,B2,uniform,tune,uniform_tune_021,192,2048,3072,bf16,NVIDIA GeForce RTX 4060,c06,64,128,32,4,3,8,0.0,0.0,87.0399996638298,221.47072046995157,27.756423636614,2,3,3,2_4_4_r0,0,
2026-03-02T09:29:31.678215+00:00,B2,uniform,tune,uniform_tune_022,1536,2048,2048,bf16,NVIDIA GeForce RTX 4060,c05,128,64,32,4,3,8,0.0,0.0,386.03200018405914,447.3836776614188,33.37780775131727,3,3,3,4_4_4_r1,0,
2026-03-02T09:29:31.689410+00:00,B2,uniform,tune,uniform_tune_023,256,1024,1024,bf16,NVIDIA GeForce RTX 4060,c04,64,64,64,4,3,8,0.0,0.0,71.52000069618225,143.56480389833445,7.506584266974962,2,3,3,2_3_3_r0,0,
2026-03-02T09:29:31.762378+00:00,B2,uniform,tune,uniform_tune_024,768,128,384,bf16,NVIDIA GeForce RTX 4060,c04,64,64,64,4,3,8,0.0,72.926,32.896000891923904,54.370878636836956,2.295034957228948,3,1,2,3_2_3_r2,0,
2026-03-02T09:29:31.829436+00:00,B2,uniform,tune,uniform_tune_025,256,96,384,bf16,NVIDIA GeForce RTX 4060,c02,32,64,32,2,2,8,0.0,67.02,34.44799967110157,59.41599901765583,0.5479089694672085,2,1,2,2_2_3_r2,0,
2026-03-02T09:29:31.846541+00:00,B2,uniform,tune,uniform_tune_026,96,1024,3072,bf16,NVIDIA GeForce RTX 4060,c03,64,64,32,4,2,8,0.0,0.0,76.80000364780426,110.43424390256398,7.864319626464861,1,3,3,2_3_4_r0,0,
2026-03-02T09:29:31.892780+00:00,B2,uniform,tune,uniform_tune_027,1536,512,4096,bf16,NVIDIA GeForce RTX 4060,c03,64,64,32,4,2,8,0.0,0.0,231.29600286483765,263.69023591279984,27.853706351184858,3,2,3,4_3_4_r2,0,
2026-03-02T09:29:31.951220+00:00,B2,uniform,tune,uniform_tune_028,128,64,192,bf16,NVIDIA GeForce RTX 4060,c02,32,64,32,2,2,8,0.0,58.384,29.69600073993206,71.33183967322098,0.10593103184328642,1,1,2,2_1_2_r2,0,
2026-03-02T09:29:32.042492+00:00,B2,uniform,tune,uniform_tune_029,192,256,1536,bf16,NVIDIA GeForce RTX 4060,c04,64,64,64,4,3,8,0.0,91.229,42.927999049425125,53.126720152795315,3.517400003344019,2,2,3,2_2_4_r1,0,
2026-03-02T09:29:32.109029+00:00,B2,uniform,tune,uniform_tune_030,4096,64,3072,bf16,NVIDIA GeForce RTX 4060,c04,64,64,64,4,3,8,0.0,0.0,116.62400141358376,171.43680080771443,13.81030248043268,3,1,3,4_1_4_r2,0,
2026-03-02T09:29:32.183321+00:00,B2,uniform,tune,uniform_tune_031,384,128,96,bf16,NVIDIA GeForce RTX 4060,c06,64,128,32,4,3,8,0.0,74.235,34.81600061058998,49.11935914307831,0.2710588187756836,2,1,1,3_2_2_r2,0,
2026-03-02T09:29:32.316875+00:00,B2,uniform,eval,uniform_eval_000,512,4096,768,bf16,NVIDIA GeForce RTX 4060,c06,64,128,32,4,3,8,0.0,132.995,126.97599828243256,177.2140792012214,25.368774536704425,2,3,3,3_4_3_r0,0,anchor_skipped
2026-03-02T09:29:32.377782+00:00,B2,uniform,eval,uniform_eval_001,384,512,64,bf16,NVIDIA GeForce RTX 4060,c06,64,128,32,4,3,8,0.0,60.865,29.551999643445015,67.78623942285765,0.8515777038316958,2,2,1,3_3_1_r1,0,
2026-03-02T09:29:32.444726+00:00,B2,uniform,eval,uniform_eval_002,256,4096,384,bf16,NVIDIA GeForce RTX 4060,c04,64,64,64,4,3,8,0.0,66.91,56.15999922156334,79.23712249845258,14.33950105346142,2,3,2,2_4_3_r0,0,anchor_skipped
2026-03-02T09:29:32.531425+00:00,B2,uniform,eval,uniform_eval_003,384,768,512,bf16,NVIDIA GeForce RTX 4060,c02,32,64,32,2,2,8,0.0,86.662,39.88800011575222,101.06879666447625,7.57094582640509,2,3,2,3_3_3_r0,0,
2026-03-02T09:29:32.600432+00:00,B2,uniform,eval,uniform_eval_004,768,1024,96,bf16,NVIDIA GeForce RTX 4060,c11,32,128,32,4,2,8,0.0,68.97,33.695999532938,52.7820801362395,4.481094079206694,3,3,1,3_3_2_r1,0,
2026-03-02T09:29:32.799684+00:00,B2,uniform,eval,uniform_eval_005,3072,3072,128,bf16,NVIDIA GeForce RTX 4060,c09,128,64,64,8,3,8,0.0,199.207,112.64000087976456,127.91520453989503,21.44814528702665,3,3,1,4_4_2_r1,0,
2026-03-02T09:29:32.811638+00:00,B2,uniform,eval,uniform_eval_006,256,96,512,bf16,NVIDIA GeForce RTX 4060,c02,32,64,32,2,2,8,0.0,0.0,31.55199997127056,46.506240144371986,0.7975983780081946,2,1,2,2_2_3_r2,0,
2026-03-02T09:29:33.230687+00:00,B2,uniform,eval,uniform_eval_007,4096,4096,4096,bf16,NVIDIA GeForce RTX 4060,c05,128,64,32,4,3,8,0.0,0.0,4383.967876434326,4512.460823059082,31.350355966518887,3,3,3,4_4_4_r1,0,
2026-03-02T09:29:33.282722+00:00,B2,uniform,eval,uniform_eval_008,128,96,64,bf16,NVIDIA GeForce RTX 4060,c11,32,128,32,4,2,8,0.0,51.976,29.69600073993206,79.30560216307626,0.05296551592164321,1,1,1,2_2_1_r1,0,
2026-03-02T09:29:33.337007+00:00,B2,uniform,eval,uniform_eval_009,3072,384,96,bf16,NVIDIA GeForce RTX 4060,c06,64,128,32,4,3,8,0.0,54.247,38.91199827194214,64.77823760360474,5.82063183743803,3,2,1,4_3_2_r2,0,anchor_skipped
2026-03-02T09:29:33.355122+00:00,B2,uniform,eval,uniform_eval_010,768,768,2048,bf16,NVIDIA GeForce RTX 4060,c09,128,64,64,8,3,8,0.0,0.0,106.30399733781815,193.17759454250333,22.726512309058066,3,3,3,3_3_4_r1,0,
2026-03-02T09:29:33.415441+00:00,B2,uniform,eval,uniform_eval_011,4096,96,512,bf16,NVIDIA GeForce RTX 4060,c06,64,128,32,4,3,8,0.0,60.283,48.128001391887665,64.07040070742366,8.366297630382595,3,1,2,4_2_3_r2,0,anchor_skipped
2026-03-02T09:29:33.431332+00:00,B2,uniform,eval,uniform_eval_012,384,384,256,bf16,NVIDIA GeForce RTX 4060,c11,32,128,32,4,2,8,0.0,0.0,37.58399933576584,70.05632065236568,2.0087663190264795,2,2,2,3_3_2_r1,0,
2026-03-02T09:29:34.128089+00:00,B2,uniform,eval,uniform_eval_013,4096,2048,768,bf16,NVIDIA GeForce RTX 4060,c03,64,64,32,4,2,8,0.0,696.717,441.8559968471527,473.1699162721634,29.160862316998625,3,3,3,4_4_3_r2,0,
2026-03-02T09:29:34.141256+00:00,B2,uniform,eval,uniform_eval_014,192,384,3072,bf16,NVIDIA GeForce RTX 4060,c03,64,64,32,4,2,8,0.0,0.0,66.56000018119812,73.74848261475563,6.8056615199343,2,2,3,2_3_4_r0,0,
2026-03-02T09:29:34.150194+00:00,B2,uniform,eval,uniform_eval_015,128,96,4096,bf16,NVIDIA GeForce RTX 4060,c04,64,64,64,4,3,8,0.0,0.0,61.43999844789505,125.36991618573653,1.6384000413894666,1,1,3,2_2_4_r1,0,
2026-03-02T09:29:34.269023+00:00,B2,uniform,eval,uniform_eval_016,64,4096,2048,bf16,NVIDIA GeForce RTX 4060,c04,64,64,64,4,3,8,0.0,118.791,67.35999882221222,75.2620828896761,15.940348022184486,1,3,3,1_4_4_r0,0,anchor_skipped
2026-03-02T09:29:34.279065+00:00,B2,uniform,eval,uniform_eval_017,96,128,3072,bf16,NVIDIA GeForce RTX 4060,c04,64,64,64,4,3,8,0.0,0.0,50.175998359918594,125.12448154389855,1.5046531104064411,1,1,3,2_2_4_r1,0,
2026-03-02T09:29:34.286405+00:00,B2,uniform,eval,uniform_eval_018,512,768,64,bf16,NVIDIA GeForce RTX 4060,c06,64,128,32,4,3,8,0.0,0.0,32.84800052642822,117.53824040293682,1.53225910841986,2,3,1,3_3_1_r1,0,
2026-03-02T09:29:34.354023+00:00,B2,uniform,eval,uniform_eval_019,64,128,384,bf16,NVIDIA GeForce RTX 4060,c03,64,64,32,4,2,8,0.0,67.589,35.79200059175491,111.2448013573885,0.17577827156857243,1,1,2,1_2_3_r0,0,
2026-03-02T09:29:34.361432+00:00,B2,uniform,eval,uniform_eval_020,512,512,96,bf16,NVIDIA GeForce RTX 4060,c11,32,128,32,4,2,8,0.0,0.0,68.08000057935715,137.3139224946499,0.7393015213231547,2,2,1,3_3_2_r1,0,
2026-03-02T09:29:34.387235+00:00,B2,uniform,eval,uniform_eval_021,256,3072,1536,bf16,NVIDIA GeForce RTX 4060,c06,64,128,32,4,3,8,0.0,0.0,122.75199964642525,237.8377641737459,19.68130141226873,2,3,3,2_4_4_r0,0,
2026-03-02T09:29:34.396578+00:00,B2,uniform,eval,uniform_eval_022,2048,96,512,bf16,NVIDIA GeForce RTX 4060,c06,64,128,32,4,3,8,0.0,0.0,51.183998584747314,142.9504035413264,3.9333892928794105,3,1,2,4_2_3_r2,0,
2026-03-02T09:29:34.429939+00:00,B2,uniform,eval,uniform_eval_023,1536,512,3072,bf16,NVIDIA GeForce RTX 4060,c03,64,64,32,4,2,8,0.0,0.0,182.0640042424202,205.77088192105293,26.539228487836372,3,2,3,4_3_4_r2,0,
2026-03-02T09:29:34.434196+00:00,B2,uniform,eval,uniform_eval_024,128,192,64,bf16,NVIDIA GeForce RTX 4060,c11,32,128,32,4,2,8,0.0,0.0,28.672000393271446,98.66720229387283,0.1097142842094205,1,2,1,2_2_1_r1,0,
2026-03-02T09:29:34.441776+00:00,B2,uniform,eval,uniform_eval_025,1536,96,384,bf16,NVIDIA GeForce RTX 4060,c06,64,128,32,4,3,8,0.0,0.0,42.927999049425125,244.12032008171053,2.6380500025080145,3,1,2,4_2_3_r2,0,
2026-03-02T09:29:34.549333+00:00,B2,uniform,eval,uniform_eval_026,1536,2048,64,bf16,NVIDIA GeForce RTX 4060,c09,128,64,64,8,3,8,0.0,107.523,52.22399905323982,77.04575993120665,7.710117786834262,3,3,1,4_4_1_r1,0,
2026-03-02T09:29:34.559676+00:00,B2,uniform,eval,uniform_eval_027,256,1024,96,bf16,NVIDIA GeForce RTX 4060,c11,32,128,32,4,2,8,0.0,0.0,58.30400064587593,570.3782257437692,0.8632623395039728,2,3,1,2_3_2_r0,0,
2026-03-02T09:29:34.565762+00:00,B2,uniform,eval,uniform_eval_028,2048,256,64,bf16,NVIDIA GeForce RTX 4060,c10,64,128,64,8,3,8,0.0,0.0,60.59199944138527,129.84128274023516,1.1075532185551813,3,2,1,4_2_1_r2,0,
2026-03-02T09:29:34.571020+00:00,B2,uniform,eval,uniform_eval_029,192,768,192,bf16,NVIDIA GeForce RTX 4060,c11,32,128,32,4,2,8,0.0,0.0,33.79200026392937,116.8771212548017,1.6756363505489573,2,3,2,2_3_2_r0,0,
2026-03-02T09:29:34.630291+00:00,B2,uniform,eval,uniform_eval_030,1024,2048,3072,bf16,NVIDIA GeForce RTX 4060,c04,64,64,64,4,3,8,0.0,0.0,409.08800065517426,509.1417595744132,31.496650763073486,3,3,3,3_4_4_r0,0,
2026-03-02T09:29:34.806550+00:00,B2,uniform,eval,uniform_eval_031,1536,1024,512,bf16,NVIDIA GeForce RTX 4060,c09,128,64,64,8,3,8,0.0,176.198,78.84799689054489,89.05951999127865,20.42680600035811,3,3,2,4_3_3_r1,0,
2026-03-02T09:29:34.896952+00:00,B2,uniform,eval,uniform_eval_032,512,768,768,bf16,NVIDIA GeForce RTX 4060,c03,64,64,32,4,2,8,0.0,90.35,47.10400104522705,62.48095955699679,12.82226058504217,2,3,3,3_3_3_r1,0,
2026-03-02T09:29:34.978168+00:00,B2,uniform,eval,uniform_eval_033,64,512,4096,bf16,NVIDIA GeForce RTX 4060,c04,64,64,64,4,3,8,0.0,81.173,55.93600124120712,81.88863769173622,4.798974721887128,1,2,3,1_3_4_r0,0,anchor_skipped
2026-03-02T09:29:34.991077+00:00,B2,uniform,eval,uniform_eval_034,1024,256,512,bf16,NVIDIA GeForce RTX 4060,c04,64,64,64,4,3,8,0.0,0.0,43.007999658584595,101.76864191889757,6.241523859071624,3,2,2,3_2_3_r2,0,
2026-03-02T09:29:34.996221+00:00,B2,uniform,eval,uniform_eval_035,1024,768,96,bf16,NVIDIA GeForce RTX 4060,c11,32,128,32,4,2,8,0.0,0.0,37.80800104141235,89.00255925953387,3.99372989422557,3,3,1,3_3_2_r1,0,
2026-03-02T09:29:35.059443+00:00,B2,uniform,eval,uniform_eval_036,768,64,1536,bf16,NVIDIA GeForce RTX 4060,c04,64,64,64,4,3,8,0.0,63.19,37.88800165057182,57.047040611505466,3.985297123679816,3,1,3,3_1_4_r2,0,anchor_skipped
2026-03-02T09:29:35.068344+00:00,B2,uniform,eval,uniform_eval_037,512,256,512,bf16,NVIDIA GeForce RTX 4060,c04,64,64,64,4,3,8,0.0,0.0,63.48799914121628,127.75199554860589,2.1140645447253688,2,2,2,3_2_3_r2,0,
2026-03-02T09:29:35.114305+00:00,B2,uniform,eval,uniform_eval_038,64,1024,64,bf16,NVIDIA GeForce RTX 4060,c11,32,128,32,4,2,8,0.0,45.926,30.719999223947525,47.76096019893884,0.27306667356491104,1,3,1,1_3_1_r0,0,anchor_skipped
2026-03-02T09:29:35.125936+00:00,B2,uniform,eval,uniform_eval_039,512,128,2048,bf16,NVIDIA GeForce RTX 4060,c11,32,128,32,4,2,8,0.0,0.0,74.14399832487106,161.8556778132915,3.620461022668578,2,1,3,3_2_4_r2,0,
2026-03-02T09:29:35.133194+00:00,B2,uniform,eval,uniform_eval_040,4096,768,96,bf16,NVIDIA GeForce RTX 4060,c06,64,128,32,4,3,8,0.0,0.0,68.60800087451935,136.02079555392262,8.803343171369317,3,3,1,4_3_2_r2,0,
2026-03-02T09:29:35.139455+00:00,B2,uniform,eval,uniform_eval_041,4096,192,64,bf16,NVIDIA GeForce RTX 4060,c10,64,128,64,8,3,8,0.0,0.0,53.0879981815815,104.5913618057966,1.8961591969562044,3,2,1,4_2_1_r2,0,
2026-03-02T09:29:35.184362+00:00,B2,uniform,eval,uniform_eval_042,96,1536,128,bf16,NVIDIA GeForce RTX 4060,c11,32,128,32,4,2,8,0.0,44.882,31.74399957060814,83.28224111348376,1.18916130640802,1,3,1,2_4_2_r0,0,anchor_skipped
2026-03-02T09:29:35.191907+00:00,B2,uniform,eval,uniform_eval_043,192,2048,192,bf16,NVIDIA GeForce RTX 4060,c11,32,128,32,4,2,8,0.0,0.0,60.92800013720989,147.63552203774452,2.478252095259311,2,3,2,2_4_2_r0,0,
2026-03-02T09:29:35.287325+00:00,B2,uniform,eval,uniform_eval_044,384,4096,3072,bf16,NVIDIA GeForce RTX 4060,c04,64,64,64,4,3,8,0.0,0.0,291.83998703956604,441.19680643081665,33.112927786314124,2,3,3,3_4_4_r0,0,
2026-03-02T09:29:35.304114+00:00,B2,uniform,eval,uniform_eval_045,4096,96,768,bf16,NVIDIA GeForce RTX 4060,c06,64,128,32,4,3,8,0.0,0.0,71.47200033068657,189.8496045172214,8.450578872922362,3,1,3,4_2_3_r2,0,
2026-03-02T09:29:35.310419+00:00,B2,uniform,eval,uniform_eval_046,96,96,1536,bf16,NVIDIA GeForce RTX 4060,c04,64,64,64,4,3,8,0.0,0.0,46.08000069856644,58.44991926103829,0.614399990685781,1,1,3,2_2_4_r1,0,
2026-03-02T09:29:35.370725+00:00,B2,uniform,eval,uniform_eval_047,2048,512,4096,bf16,NVIDIA GeForce RTX 4060,c03,64,64,32,4,2,8,0.0,0.0,307.69601464271545,430.68863242864603,27.91695109205199,3,2,3,4_3_4_r2,0,
2026-03-02T09:29:35.451158+00:00,B2,uniform,eval,uniform_eval_048,96,256,768,bf16,NVIDIA GeForce RTX 4060,c04,64,64,64,4,3,8,0.0,80.376,37.76000067591667,72.04256154596797,0.9997016770202588,1,2,3,2_2_3_r0,0,
2026-03-02T09:29:35.499584+00:00,B2,uniform,eval,uniform_eval_049,64,768,384,bf16,NVIDIA GeForce RTX 4060,c04,64,64,64,4,3,8,0.0,48.389,32.76799991726875,73.39839845895763,1.1520000029085202,1,3,2,1_3_3_r0,0,anchor_skipped
2026-03-02T09:29:35.506385+00:00,B2,uniform,eval,uniform_eval_050,128,1024,96,bf16,NVIDIA GeForce RTX 4060,c11,32,128,32,4,2,8,0.0,0.0,62.463998794555664,346.4687994122496,0.40288525367660966,1,3,1,2_3_2_r0,0,
2026-03-02T09:29:35.514569+00:00,B2,uniform,eval,uniform_eval_051,384,768,768,bf16,NVIDIA GeForce RTX 4060,c02,32,64,32,2,2,8,0.0,0.0,52.191998809576035,114.05664063990108,8.67920068845663,2,3,3,3_3_3_r0,0,
2026-03-02T09:29:35.530947+00:00,B2,uniform,eval,uniform_eval_052,768,64,4096,bf16,NVIDIA GeForce RTX 4060,c04,64,64,64,4,3,8,0.0,0.0,52.62400023639202,90.39487928152076,7.651512279401861,3,1,3,3_1_4_r2,0,
2026-03-02T09:29:35.535294+00:00,B2,uniform,eval,uniform_eval_053,384,96,512,bf16,NVIDIA GeForce RTX 4060,c04,64,64,64,4,3,8,0.0,0.0,32.62399882078171,39.93151996284722,1.1570848873361839,2,1,2,3_2_3_r2,0,
2026-03-02T09:29:35.542736+00:00,B2,uniform,eval,uniform_eval_054,768,192,768,bf16,NVIDIA GeForce RTX 4060,c04,64,64,64,4,3,8,0.0,0.0,46.08000069856644,103.02464127540586,4.915199925486248,3,2,3,3_2_3_r2,0,
2026-03-02T09:29:35.553393+00:00,B2,uniform,eval,uniform_eval_055,512,2048,512,bf16,NVIDIA GeForce RTX 4060,c06,64,128,32,4,3,8,0.0,0.0,61.375999823212624,113.29536095261561,17.49449014423887,2,3,2,3_4_3_r0,0,
2026-03-02T09:29:35.561709+00:00,B2,uniform,eval,uniform_eval_056,384,512,512,bf16,NVIDIA GeForce RTX 4060,c03,64,64,32,4,2,8,0.0,0.0,64.44799900054932,191.43008098006248,3.1238610216320915,2,2,2,3_3_3_r1,0,
2026-03-02T09:29:35.575302+00:00,B2,uniform,eval,uniform_eval_057,2048,512,512,bf16,NVIDIA GeForce RTX 4060,c07,128,128,32,8,3,8,0.0,0.0,80.89599758386612,214.1183979809284,13.273114320480879,3,2,2,4_3_3_r2,0,
2026-03-02T09:29:35.805632+00:00,B2,uniform,eval,uniform_eval_058,1024,512,2048,bf16,NVIDIA GeForce RTX 4060,c03,64,64,32,4,2,8,0.0,230.288,107.51999914646149,358.48160505294715,19.972876349029196,3,2,3,3_3_4_r2,0,
2026-03-02T09:29:35.854509+00:00,B2,uniform,eval,uniform_eval_059,2048,64,4096,bf16,NVIDIA GeForce RTX 4060,c04,64,64,64,4,3,8,0.0,0.0,75.77600330114365,187.9347202181816,14.169945328639345,3,1,3,4_1_4_r2,0,
2026-03-02T09:29:35.912218+00:00,B2,uniform,eval,uniform_eval_060,64,1536,1024,bf16,NVIDIA GeForce RTX 4060,c04,64,64,64,4,3,8,0.0,57.65,40.95999896526337,67.9401590302586,4.9152001241684,1,3,3,1_4_3_r0,0,anchor_skipped
2026-03-02T09:29:35.936217+00:00,B2,uniform,eval,uniform_eval_061,768,1024,1536,bf16,NVIDIA GeForce RTX 4060,c09,128,64,64,8,3,8,0.0,0.0,134.88000631332397,249.5795185863971,17.911617666949546,3,3,3,3_3_4_r1,0,
2026-03-02T09:29:36.040220+00:00,B2,uniform,eval,uniform_eval_062,384,2048,192,bf16,NVIDIA GeForce RTX 4060,c11,32,128,32,4,2,8,0.0,103.92,45.04000023007393,125.07776066660867,6.704926431113925,2,3,2,3_4_2_r0,0,
2026-03-02T09:29:36.050680+00:00,B2,uniform,eval,uniform_eval_063,256,2048,192,bf16,NVIDIA GeForce RTX 4060,c11,32,128,32,4,2,8,0.0,0.0,38.91199827194214,48.65024156868458,5.173894966611581,2,3,2,2_4_2_r0,0,
2026-03-02T09:29:38.110966+00:00,B2,llm_style,tune,llm_style_tune_000,8,4096,1024,bf16,NVIDIA GeForce RTX 4060,c00,32,32,32,2,2,8,0.0,2059.65,39.5519994199276,76.79839961230743,1.6967249439781382,0,3,3,0_4_3_r0,0,anchor_skipped
2026-03-02T09:29:38.132737+00:00,B2,llm_style,tune,llm_style_tune_001,32,1024,2048,bf16,NVIDIA GeForce RTX 4060,c04,64,64,64,4,3,8,0.0,0.0,97.28000313043594,167.557120770216,1.3797052187594694,0,3,3,1_3_4_r0,0,
2026-03-02T09:29:38.146374+00:00,B2,llm_style,tune,llm_style_tune_002,16,2048,1024,bf16,NVIDIA GeForce RTX 4060,c00,32,32,32,2,2,8,0.0,0.0,73.72800260782242,159.3084815144539,0.9102221900268849,0,3,3,0_4_3_r0,0,
2026-03-02T09:29:40.550439+00:00,B2,llm_style,tune,llm_style_tune_003,1,1024,4096,bf16,NVIDIA GeForce RTX 4060,c00,32,32,32,2,2,8,0.0,2404.017,146.30400389432907,215.4291182756423,0.05733683136969263,0,3,3,0_3_4_r0,0,anchor_skipped
2026-03-02T09:29:40.599902+00:00,B2,llm_style,tune,llm_style_tune_004,64,2048,2048,bf16,NVIDIA GeForce RTX 4060,c04,64,64,64,4,3,8,0.0,0.0,308.22399258613586,415.3036826848984,1.7418206399035165,1,3,3,1_4_4_r0,0,
2026-03-02T09:29:41.297171+00:00,B2,llm_style,tune,llm_style_tune_005,32,8192,8192,bf16,NVIDIA GeForce RTX 4060,c04,64,64,64,4,3,8,0.0,0.0,581.6320180892944,18074.183597564697,7.384337798509263,0,3,3,1_4_4_r0,0,
2026-03-02T09:29:42.057847+00:00,B2,llm_style,tune,llm_style_tune_006,16,8192,8192,bf16,NVIDIA GeForce RTX 4060,c02,32,64,32,2,2,8,0.0,760.617,560.1279735565186,577.6179367303848,3.8339160859340877,0,3,3,0_4_4_r0,0,anchor_skipped
2026-03-02T09:29:42.107168+00:00,B2,llm_style,tune,llm_style_tune_007,2,1024,8192,bf16,NVIDIA GeForce RTX 4060,c00,32,32,32,2,2,8,0.0,0.0,94.2080020904541,186.28480181097981,0.3561739051400603,0,3,3,0_3_4_r0,0,
2026-03-02T09:29:42.196014+00:00,B2,llm_style,tune,llm_style_tune_008,16,2048,8192,bf16,NVIDIA GeForce RTX 4060,c02,32,64,32,2,2,8,0.0,0.0,173.08800667524338,291.91456466913223,3.101722195040959,0,3,3,0_4_4_r0,0,
2026-03-02T09:29:42.235168+00:00,B2,llm_style,tune,llm_style_tune_009,4,4096,2048,bf16,NVIDIA GeForce RTX 4060,c02,32,64,32,2,2,8,0.0,0.0,51.68000049889088,79.7798388823866,1.298546117495495,0,3,3,0_4_4_r0,0,
2026-03-02T09:29:42.401159+00:00,B2,llm_style,tune,llm_style_tune_010,64,8192,4096,bf16,NVIDIA GeForce RTX 4060,c04,64,64,64,4,3,8,0.0,0.0,306.17600679397583,336.8585577607155,14.02777226397776,1,3,3,1_4_4_r0,0,
2026-03-02T09:29:42.441821+00:00,B2,llm_style,tune,llm_style_tune_011,16,8192,1024,bf16,NVIDIA GeForce RTX 4060,c00,32,32,32,2,2,8,0.0,0.0,59.39200147986412,138.42432215809816,4.519724025313554,0,3,3,0_4_3_r0,0,
2026-03-02T09:29:42.481352+00:00,B2,llm_style,tune,llm_style_tune_012,2,8192,1024,bf16,NVIDIA GeForce RTX 4060,c00,32,32,32,2,2,8,0.0,0.0,55.296000093221664,135.01792326569557,0.6068148137918061,0,3,3,0_4_3_r0,0,
2026-03-02T09:29:42.563415+00:00,B2,llm_style,tune,llm_style_tune_013,16,8192,2048,bf16,NVIDIA GeForce RTX 4060,c02,32,64,32,2,2,8,0.0,0.0,161.6319939494133,184.41631868481633,3.3215633791415513,0,3,3,0_4_4_r0,0,
2026-03-02T09:29:42.644332+00:00,B2,llm_style,tune,llm_style_tune_014,8,4096,4096,bf16,NVIDIA GeForce RTX 4060,c02,32,64,32,2,2,8,0.0,0.0,160.73600202798843,208.95263999700546,1.6700393976033958,0,3,3,0_4_4_r0,0,
2026-03-02T09:29:42.653605+00:00,B2,llm_style,tune,llm_style_tune_015,64,1024,1024,bf16,NVIDIA GeForce RTX 4060,c04,64,64,64,4,3,8,0.0,0.0,14.671999961137772,141.75168290734283,9.147882248875893,1,3,3,1_3_3_r0,0,
2026-03-02T09:29:42.811011+00:00,B2,llm_style,tune,llm_style_tune_016,16,4096,8192,bf16,NVIDIA GeForce RTX 4060,c02,32,64,32,2,2,8,0.0,0.0,296.27199470996857,369.36158686876286,3.6241759031295717,0,3,3,0_4_4_r0,0,
2026-03-02T09:29:42.895966+00:00,B2,llm_style,tune,llm_style_tune_017,1,4096,4096,bf16,NVIDIA GeForce RTX 4060,c02,32,64,32,2,2,8,0.0,0.0,162.81600296497345,223.60064119100565,0.20608804656148297,0,3,3,0_4_4_r0,0,
2026-03-02T09:29:42.982144+00:00,B2,llm_style,tune,llm_style_tune_018,64,4096,4096,bf16,NVIDIA GeForce RTX 4060,c04,64,64,64,4,3,8,0.0,0.0,169.42399740219116,261.8880029022693,12.67520351855555,1,3,3,1_4_4_r0,0,
2026-03-02T09:29:43.068053+00:00,B2,llm_style,tune,llm_style_tune_019,64,8192,2048,bf16,NVIDIA GeForce RTX 4060,c04,64,64,64,4,3,8,0.0,0.0,170.80000042915344,269.30240720510477,12.57308924241344,1,3,3,1_4_4_r0,0,
2026-03-02T09:29:43.109293+00:00,B2,llm_style,tune,llm_style_tune_020,8,2048,4096,bf16,NVIDIA GeForce RTX 4060,c02,32,64,32,2,2,8,0.0,0.0,77.82399654388428,150.80928005278088,1.7246316555371939,0,3,3,0_4_4_r0,0,
2026-03-02T09:29:43.122295+00:00,B2,llm_style,tune,llm_style_tune_021,8,1024,2048,bf16,NVIDIA GeForce RTX 4060,c00,32,32,32,2,2,8,0.0,0.0,67.63200089335442,176.24063611030567,0.49613247511204545,0,3,3,0_3_4_r0,0,
2026-03-02T09:29:43.164258+00:00,B2,llm_style,tune,llm_style_tune_022,8,8192,1024,bf16,NVIDIA GeForce RTX 4060,c00,32,32,32,2,2,8,0.0,0.0,54.27199974656105,169.38464388251305,2.4730566153222444,0,3,3,0_4_3_r0,0,
2026-03-02T09:29:43.323305+00:00,B2,llm_style,tune,llm_style_tune_023,1,4096,8192,bf16,NVIDIA GeForce RTX 4060,c02,32,64,32,2,2,8,0.0,0.0,292.2559976577759,410.1427283883095,0.22962356474402526,0,3,3,0_4_4_r0,0,
2026-03-02T09:29:43.482257+00:00,B2,llm_style,tune,llm_style_tune_024,2,8192,4096,bf16,NVIDIA GeForce RTX 4060,c02,32,64,32,2,2,8,0.0,0.0,292.7839905023575,400.17280548810953,0.45841894486686174,0,3,3,0_4_4_r0,0,
2026-03-02T09:29:43.562544+00:00,B2,llm_style,tune,llm_style_tune_025,2,4096,4096,bf16,NVIDIA GeForce RTX 4060,c02,32,64,32,2,2,8,0.0,0.0,160.70400178432465,219.24863576889027,0.4175929862036946,0,3,3,0_4_4_r0,0,
2026-03-02T09:29:43.575926+00:00,B2,llm_style,tune,llm_style_tune_026,4,2048,1024,bf16,NVIDIA GeForce RTX 4060,c00,32,32,32,2,2,8,0.0,0.0,80.20799979567528,387.2518254816525,0.20917135501120687,0,3,3,0_4_3_r0,0,
2026-03-02T09:29:43.625865+00:00,B2,llm_style,tune,llm_style_tune_027,64,2048,4096,bf16,NVIDIA GeForce RTX 4060,c04,64,64,64,4,3,8,0.0,0.0,111.37599870562553,217.95840293169016,9.64069311591965,1,3,3,1_4_4_r0,0,
2026-03-02T09:29:43.648095+00:00,B2,llm_style,tune,llm_style_tune_028,32,1024,4096,bf16,NVIDIA GeForce RTX 4060,c04,64,64,64,4,3,8,0.0,0.0,59.21600013971329,161.9545622169971,4.533157514297785,0,3,3,1_3_4_r0,0,
2026-03-02T09:29:43.659512+00:00,B2,llm_style,tune,llm_style_tune_029,32,2048,1024,bf16,NVIDIA GeForce RTX 4060,c04,64,64,64,4,3,8,0.0,0.0,52.22399905323982,116.87552079558365,2.570039262278087,0,3,3,1_4_3_r0,0,
2026-03-02T09:29:43.678148+00:00,B2,llm_style,tune,llm_style_tune_030,4,2048,2048,bf16,NVIDIA GeForce RTX 4060,c02,32,64,32,2,2,8,0.0,0.0,47.10400104522705,118.61696161329736,0.7123478102801206,0,3,3,0_4_4_r0,0,
2026-03-02T09:29:44.040303+00:00,B2,llm_style,tune,llm_style_tune_031,1,8192,8192,bf16,NVIDIA GeForce RTX 4060,c02,32,64,32,2,2,8,0.0,0.0,564.736008644104,661.7651200294493,0.23766454758613392,0,3,3,0_4_4_r0,0,
2026-03-02T09:29:44.063406+00:00,B2,llm_style,eval,llm_style_eval_000,2,1024,4096,bf16,NVIDIA GeForce RTX 4060,c00,32,32,32,2,2,8,0.0,0.0,109.56799983978271,195.04479840397835,0.15312149555100676,0,3,3,0_3_4_r0,0,
2026-03-02T09:29:44.397754+00:00,B2,llm_style,eval,llm_style_eval_001,2,8192,8192,bf16,NVIDIA GeForce RTX 4060,c02,32,64,32,2,2,8,0.0,0.0,906.7039787769318,1193.35679769516,0.2960563340221547,0,3,3,0_4_4_r0,0,
2026-03-02T09:29:44.417788+00:00,B2,llm_style,eval,llm_style_eval_002,2,2048,2048,bf16,NVIDIA GeForce RTX 4060,c02,32,64,32,2,2,8,0.0,0.0,78.84799689054489,124.37504105269899,0.21277922917039696,0,3,3,0_4_4_r0,0,
2026-03-02T09:29:44.463594+00:00,B2,llm_style,eval,llm_style_eval_003,8,1024,8192,bf16,NVIDIA GeForce RTX 4060,c00,32,32,32,2,2,8,0.0,0.0,147.45600521564484,200.8499234914778,0.9102221900268849,0,3,3,0_3_4_r0,0,
2026-03-02T09:29:44.556160+00:00,B2,llm_style,eval,llm_style_eval_004,64,2048,8192,bf16,NVIDIA GeForce RTX 4060,c04,64,64,64,4,3,8,0.0,0.0,269.18400824069977,359.83808159828175,7.977753440983598,1,3,3,1_4_4_r0,0,
2026-03-02T09:29:44.894477+00:00,B2,llm_style,eval,llm_style_eval_005,1,8192,8192,bf16,NVIDIA GeForce RTX 4060,c02,32,64,32,2,2,8,0.0,0.0,912.8639996051788,1008.4044975042343,0.1470292705792432,0,3,3,0_4_4_r0,0,
2026-03-02T09:29:44.952168+00:00,B2,llm_style,eval,llm_style_eval_006,1,1024,8192,bf16,NVIDIA GeForce RTX 4060,c00,32,32,32,2,2,8,0.0,0.0,171.52000218629837,353.28832030296326,0.09781492412632573,0,3,3,0_3_4_r0,0,
2026-03-02T09:29:45.126742+00:00,B2,llm_style,eval,llm_style_eval_007,2,8192,4096,bf16,NVIDIA GeForce RTX 4060,c02,32,64,32,2,2,8,0.0,0.0,494.59201097488403,640.6793802976607,0.2713705943924269,0,3,3,0_4_4_r0,0,
2026-03-02T09:29:45.174296+00:00,B2,llm_style,eval,llm_style_eval_008,16,2048,4096,bf16,NVIDIA GeForce RTX 4060,c02,32,64,32,2,2,8,0.0,0.0,141.31200313568115,254.76096034049982,1.899594160746988,0,3,3,0_4_4_r0,0,
2026-03-02T09:29:45.266562+00:00,B2,llm_style,eval,llm_style_eval_009,32,2048,8192,bf16,NVIDIA GeForce RTX 4060,c04,64,64,64,4,3,8,0.0,0.0,294.7839945554733,402.84929245710373,3.6424698892461076,0,3,3,1_4_4_r0,0,
2026-03-02T09:29:45.331072+00:00,B2,llm_style,eval,llm_style_eval_010,1,1024,1024,bf16,NVIDIA GeForce RTX 4060,c00,32,32,32,2,2,8,0.0,64.445,45.05600035190582,95.50048135220996,0.046545454181915476,0,3,3,0_3_3_r0,0,anchor_skipped
2026-03-02T09:29:45.423647+00:00,B2,llm_style,eval,llm_style_eval_011,16,2048,8192,bf16,NVIDIA GeForce RTX 4060,c02,32,64,32,2,2,8,0.0,0.0,312.3199939727783,410.63424855470646,1.7189770823535346,0,3,3,0_4_4_r0,0,
2026-03-02T09:29:45.776885+00:00,B2,llm_style,eval,llm_style_eval_012,8,8192,8192,bf16,NVIDIA GeForce RTX 4060,c02,32,64,32,2,2,8,0.0,0.0,935.4240000247955,1041.4284813404083,1.1478664476980898,0,3,3,0_4_4_r0,0,
2026-03-02T09:29:45.951654+00:00,B2,llm_style,eval,llm_style_eval_013,32,4096,8192,bf16,NVIDIA GeForce RTX 4060,c04,64,64,64,4,3,8,0.0,0.0,500.544011592865,598.8863974809645,4.290299350832572,0,3,3,1_4_4_r0,0,
2026-03-02T09:29:45.962520+00:00,B2,llm_style,eval,llm_style_eval_014,64,1024,1024,bf16,NVIDIA GeForce RTX 4060,c04,64,64,64,4,3,8,0.0,0.0,55.056000128388405,99.89120021462439,2.437840157058442,1,3,3,1_3_3_r0,0,
2026-03-02T09:29:45.976805+00:00,B2,llm_style,eval,llm_style_eval_015,16,2048,1024,bf16,NVIDIA GeForce RTX 4060,c00,32,32,32,2,2,8,0.0,0.0,77.2320032119751,251.35872378945322,0.8689255905457923,0,3,3,0_4_3_r0,0,
2026-03-02T09:29:46.028069+00:00,B2,llm_style,eval,llm_style_eval_016,2,1024,8192,bf16,NVIDIA GeForce RTX 4060,c00,32,32,32,2,2,8,0.0,0.0,194.5600062608719,271.4214420318601,0.17246315234493367,0,3,3,0_3_4_r0,0,
2026-03-02T09:29:46.369917+00:00,B2,llm_style,eval,llm_style_eval_017,4,8192,8192,bf16,NVIDIA GeForce RTX 4060,c02,32,64,32,2,2,8,0.0,0.0,917.5040125846863,980.7359856367111,0.5851428491169093,0,3,3,0_4_4_r0,0,
2026-03-02T09:29:46.401833+00:00,B2,llm_style,eval,llm_style_eval_018,4,1024,4096,bf16,NVIDIA GeForce RTX 4060,c00,32,32,32,2,2,8,0.0,0.0,132.47999548912048,210.6348797678947,0.25327923567717475,0,3,3,0_3_4_r0,0,
2026-03-02T09:29:46.450495+00:00,B2,llm_style,eval,llm_style_eval_019,8,4096,2048,bf16,NVIDIA GeForce RTX 4060,c02,32,64,32,2,2,8,0.0,0.0,113.66400122642517,203.0182416737079,1.1808288160877833,0,3,3,0_4_4_r0,0,
2026-03-02T09:29:46.501619+00:00,B2,llm_style,eval,llm_style_eval_020,64,4096,2048,bf16,NVIDIA GeForce RTX 4060,c04,64,64,64,4,3,8,0.0,0.0,163.83999586105347,249.91743505001068,6.5536001655578655,1,3,3,1_4_4_r0,0,
2026-03-02T09:29:46.676668+00:00,B2,llm_style,eval,llm_style_eval_021,1,4096,8192,bf16,NVIDIA GeForce RTX 4060,c02,32,64,32,2,2,8,0.0,0.0,455.1680088043213,517.283843755722,0.147437567451825,0,3,3,0_4_4_r0,0,
2026-03-02T09:29:46.703376+00:00,B2,llm_style,eval,llm_style_eval_022,32,1024,4096,bf16,NVIDIA GeForce RTX 4060,c04,64,64,64,4,3,8,0.0,0.0,155.58400005102158,208.4351997077465,1.7253410113634458,0,3,3,1_3_4_r0,0,
2026-03-02T09:29:46.714372+00:00,B2,llm_style,eval,llm_style_eval_023,4,1024,1024,bf16,NVIDIA GeForce RTX 4060,c00,32,32,32,2,2,8,0.0,0.0,76.80000364780426,86.00031919777393,0.10922666147867861,0,3,3,0_3_3_r0,0,
2026-03-02T09:29:46.738384+00:00,B2,llm_style,eval,llm_style_eval_024,64,2048,2048,bf16,NVIDIA GeForce RTX 4060,c04,64,64,64,4,3,8,0.0,0.0,146.32000029087067,222.41919621825204,3.6691560342588168,1,3,3,1_4_4_r0,0,
2026-03-02T09:29:47.110180+00:00,B2,llm_style,eval,llm_style_eval_025,32,8192,8192,bf16,NVIDIA GeForce RTX 4060,c04,64,64,64,4,3,8,0.0,0.0,1213.4400010108948,1351.1702680587769,3.5394970434648116,0,3,3,1_4_4_r0,0,
2026-03-02T09:29:47.164769+00:00,B2,llm_style,eval,llm_style_eval_026,4,2048,4096,bf16,NVIDIA GeForce RTX 4060,c02,32,64,32,2,2,8,0.0,0.0,198.65599274635315,262.4444860219954,0.33781444532451416,0,3,3,0_4_4_r0,0,
2026-03-02T09:29:47.251304+00:00,B2,llm_style,eval,llm_style_eval_027,8,8192,2048,bf16,NVIDIA GeForce RTX 4060,c02,32,64,32,2,2,8,0.0,0.0,254.92800772190094,312.8652691841125,1.0529853443676311,0,3,3,0_4_4_r0,0,
2026-03-02T09:29:47.433555+00:00,B2,llm_style,eval,llm_style_eval_028,8,4096,8192,bf16,NVIDIA GeForce RTX 4060,c02,32,64,32,2,2,8,0.0,0.0,482.30400681495667,622.2745579481125,1.113137988517642,0,3,3,0_4_4_r0,0,
2026-03-02T09:29:47.456359+00:00,B2,llm_style,eval,llm_style_eval_029,8,2048,2048,bf16,NVIDIA GeForce RTX 4060,c02,32,64,32,2,2,8,0.0,0.0,105.47199845314026,137.90207818150515,0.6362718539918018,0,3,3,0_4_4_r0,0,
2026-03-02T09:29:47.508938+00:00,B2,llm_style,eval,llm_style_eval_030,1,4096,2048,bf16,NVIDIA GeForce RTX 4060,c02,32,64,32,2,2,8,0.0,0.0,118.78400295972824,203.00224095582956,0.14124137579104856,0,3,3,0_4_4_r0,0,
2026-03-02T09:29:47.601662+00:00,B2,llm_style,eval,llm_style_eval_031,16,8192,2048,bf16,NVIDIA GeForce RTX 4060,c02,32,64,32,2,2,8,0.0,0.0,258.04799795150757,378.93407702445984,2.0805079530238744,0,3,3,0_4_4_r0,0,
2026-03-02T09:29:47.623394+00:00,B2,llm_style,eval,llm_style_eval_032,1,2048,2048,bf16,NVIDIA GeForce RTX 4060,c02,32,64,32,2,2,8,0.0,0.0,107.51999914646149,160.53247839212412,0.0780190482383953,0,3,3,0_4_4_r0,0,
2026-03-02T09:29:47.822912+00:00,B2,llm_style,eval,llm_style_eval_033,16,8192,4096,bf16,NVIDIA GeForce RTX 4060,c02,32,64,32,2,2,8,0.0,0.0,476.03200376033783,610.3859478235245,2.2556084790899567,0,3,3,0_4_4_r0,0,
2026-03-02T09:29:47.847863+00:00,B2,llm_style,eval,llm_style_eval_034,16,1024,4096,bf16,NVIDIA GeForce RTX 4060,c00,32,32,32,2,2,8,0.0,0.0,136.19199395179749,223.39584112167356,0.9855038031641107,0,3,3,0_3_4_r0,0,
2026-03-02T09:29:47.935024+00:00,B2,llm_style,eval,llm_style_eval_035,4,8192,2048,bf16,NVIDIA GeForce RTX 4060,c02,32,64,32,2,2,8,0.0,0.0,252.9279887676239,360.015354156494,0.5306558940114443,0,3,3,0_4_4_r0,0,
2026-03-02T09:29:47.983423+00:00,B2,llm_style,eval,llm_style_eval_036,2,2048,4096,bf16,NVIDIA GeForce RTX 4060,c02,32,64,32,2,2,8,0.0,0.0,188.30399960279465,360.15103101730324,0.17819287997482353,0,3,3,0_4_4_r0,0,
2026-03-02T09:29:47.996609+00:00,B2,llm_style,eval,llm_style_eval_037,2,1024,1024,bf16,NVIDIA GeForce RTX 4060,c00,32,32,32,2,2,8,0.0,0.0,56.32000043988228,114.0870364755391,0.07447272669106476,0,3,3,0_3_3_r0,0,
2026-03-02T09:29:48.176595+00:00,B2,llm_style,eval,llm_style_eval_038,64,4096,8192,bf16,NVIDIA GeForce RTX 4060,c04,64,64,64,4,3,8,0.0,0.0,585.7279896736145,655.3539216518402,7.332699429974801,1,3,3,1_4_4_r0,0,
2026-03-02T09:29:48.192273+00:00,B2,llm_style,eval,llm_style_eval_039,4,1024,2048,bf16,NVIDIA GeForce RTX 4060,c00,32,32,32,2,2,8,0.0,0.0,103.35999727249146,176.69119641184807,0.16231827053719494,0,3,3,0_3_4_r0,0,
2026-03-02T09:29:48.241757+00:00,B2,llm_style,eval,llm_style_eval_040,64,8192,1024,bf16,NVIDIA GeForce RTX 4060,c04,64,64,64,4,3,8,0.0,0.0,143.36000382900238,245.24607717990875,7.489828371382737,1,3,3,1_4_3_r0,0,
2026-03-02T09:29:48.255838+00:00,B2,llm_style,eval,llm_style_eval_041,2,2048,1024,bf16,NVIDIA GeForce RTX 4060,c00,32,32,32,2,2,8,0.0,0.0,68.01600009202957,151.0707226395607,0.12333286268892217,0,3,3,0_4_3_r0,0,
2026-03-02T09:29:48.301778+00:00,B2,llm_style,eval,llm_style_eval_042,2,4096,2048,bf16,NVIDIA GeForce RTX 4060,c02,32,64,32,2,2,8,0.0,0.0,122.22399935126305,252.07807943224893,0.2745322700787017,0,3,3,0_4_4_r0,0,
2026-03-02T09:29:48.317711+00:00,B2,llm_style,eval,llm_style_eval_043,1,2048,1024,bf16,NVIDIA GeForce RTX 4060,c00,32,32,32,2,2,8,0.0,0.0,78.33599671721458,182.97856599092478,0.05354248590390742,0,3,3,0_4_3_r0,0,
2026-03-02T09:29:48.419229+00:00,B2,llm_style,eval,llm_style_eval_044,8,2048,8192,bf16,NVIDIA GeForce RTX 4060,c02,32,64,32,2,2,8,0.0,0.0,404.4800102710724,519.1100805997849,0.6636556793501397,0,3,3,0_4_4_r0,0,
2026-03-02T09:29:48.464787+00:00,B2,llm_style,eval,llm_style_eval_045,1,8192,1024,bf16,NVIDIA GeForce RTX 4060,c00,32,32,32,2,2,8,0.0,0.0,79.74399998784065,141.09695911407465,0.2103884430497365,0,3,3,0_4_3_r0,0,
2026-03-02T09:29:48.486644+00:00,B2,llm_style,eval,llm_style_eval_046,64,4096,1024,bf16,NVIDIA GeForce RTX 4060,c04,64,64,64,4,3,8,0.0,0.0,110.54399982094765,186.97215989232063,4.856626437161586,1,3,3,1_4_3_r0,0,
2026-03-02T09:29:48.508813+00:00,B2,llm_style,eval,llm_style_eval_047,16,2048,2048,bf16,NVIDIA GeForce RTX 4060,c02,32,64,32,2,2,8,0.0,0.0,109.56799983978271,196.29056304693216,1.2249719644080541,0,3,3,0_4_4_r0,0,
2026-03-02T09:29:48.682922+00:00,B2,llm_style,eval,llm_style_eval_048,8,8192,4096,bf16,NVIDIA GeForce RTX 4060,c02,32,64,32,2,2,8,0.0,0.0,479.64800894260406,601.567365527153,1.1193018671828645,0,3,3,0_4_4_r0,0,
2026-03-02T09:29:48.857527+00:00,B2,llm_style,eval,llm_style_eval_049,4,4096,8192,bf16,NVIDIA GeForce RTX 4060,c02,32,64,32,2,2,8,0.0,0.0,504.32002544403076,613.5807913541794,0.532272054364002,0,3,3,0_4_4_r0,0,
2026-03-02T09:29:48.956481+00:00,B2,llm_style,eval,llm_style_eval_050,4,2048,8192,bf16,NVIDIA GeForce RTX 4060,c02,32,64,32,2,2,8,0.0,0.0,402.43199467658997,514.5702242851257,0.33351654385199314,0,3,3,0_4_4_r0,0,
2026-03-02T09:29:48.966555+00:00,B2,llm_style,eval,llm_style_eval_051,16,1024,1024,bf16,NVIDIA GeForce RTX 4060,c00,32,32,32,2,2,8,0.0,0.0,72.7040022611618,115.83487816154954,0.4615211124068289,0,3,3,0_3_3_r0,0,
2026-03-02T09:29:49.159536+00:00,B2,llm_style,eval,llm_style_eval_052,32,8192,4096,bf16,NVIDIA GeForce RTX 4060,c04,64,64,64,4,3,8,0.0,0.0,741.8719828128815,922.673617005348,2.894682233257552,0,3,3,1_4_4_r0,0,
2026-03-02T09:29:49.178139+00:00,B2,llm_style,eval,llm_style_eval_053,32,1024,2048,bf16,NVIDIA GeForce RTX 4060,c04,64,64,64,4,3,8,0.0,0.0,129.02399897575378,216.42304122447968,1.0402539765119372,0,3,3,1_3_4_r0,0,
2026-03-02T09:29:49.283588+00:00,B2,llm_style,eval,llm_style_eval_054,64,8192,2048,bf16,NVIDIA GeForce RTX 4060,c04,64,64,64,4,3,8,0.0,0.0,415.74400663375854,499.1580992937088,5.165398932357389,1,3,3,1_4_4_r0,0,
2026-03-02T09:29:49.305912+00:00,B2,llm_style,eval,llm_style_eval_055,1,4096,1024,bf16,NVIDIA GeForce RTX 4060,c00,32,32,32,2,2,8,0.0,0.0,105.47199845314026,221.5321603417396,0.07953398174897522,0,3,3,0_4_3_r0,0,
2026-03-02T09:29:49.328689+00:00,B2,llm_style,eval,llm_style_eval_056,4,2048,2048,bf16,NVIDIA GeForce RTX 4060,c02,32,64,32,2,2,8,0.0,0.0,134.14399325847626,252.60032340884194,0.2501374171510268,0,3,3,0_4_4_r0,0,
2026-03-02T09:29:49.385539+00:00,B2,llm_style,eval,llm_style_eval_057,16,1024,8192,bf16,NVIDIA GeForce RTX 4060,c00,32,32,32,2,2,8,0.0,0.0,289.72800076007843,360.50207138061523,0.9265085020977637,0,3,3,0_3_4_r0,0,
2026-03-02T09:29:49.562782+00:00,B2,llm_style,eval,llm_style_eval_058,1,8192,4096,bf16,NVIDIA GeForce RTX 4060,c02,32,64,32,2,2,8,0.0,0.0,478.57600450515747,527.5900685787201,0.1402261362213299,0,3,3,0_4_4_r0,0,
2026-03-02T09:29:49.583069+00:00,B2,llm_style,eval,llm_style_eval_059,8,4096,1024,bf16,NVIDIA GeForce RTX 4060,c00,32,32,32,2,2,8,0.0,0.0,82.68799632787704,93.69440108537671,0.8115913673116207,0,3,3,0_4_3_r0,0,
2026-03-02T09:29:49.752356+00:00,B2,llm_style,eval,llm_style_eval_060,4,8192,4096,bf16,NVIDIA GeForce RTX 4060,c02,32,64,32,2,2,8,0.0,0.0,480.25599122047424,567.265304327011,0.5589424409216117,0,3,3,0_4_4_r0,0,
2026-03-02T09:29:49.781240+00:00,B2,llm_style,eval,llm_style_eval_061,32,2048,2048,bf16,NVIDIA GeForce RTX 4060,c04,64,64,64,4,3,8,0.0,0.0,167.42400079965591,297.91232734918566,1.603327209467519,0,3,3,1_4_4_r0,0,
2026-03-02T09:29:49.797420+00:00,B2,llm_style,eval,llm_style_eval_062,8,2048,1024,bf16,NVIDIA GeForce RTX 4060,c00,32,32,32,2,2,8,0.0,0.0,101.18399932980537,186.73311859369267,0.33161796551083744,0,3,3,0_4_3_r0,0,
2026-03-02T09:29:50.017893+00:00,B2,llm_style,eval,llm_style_eval_063,16,4096,8192,bf16,NVIDIA GeForce RTX 4060,c02,32,64,32,2,2,8,0.0,0.0,583.6799740791321,678.4041583538055,1.8396070992396736,0,3,3,0_4_4_r0,0,
2026-03-02T09:29:50.222667+00:00,B2,training_style,tune,training_style_tune_000,4096,2048,1024,bf16,NVIDIA GeForce RTX 4060,c03,64,64,32,4,2,8,0.0,0.0,2902.0159244537354,3105.0137805938716,5.919977571189198,3,3,3,4_4_3_r2,0,
2026-03-02T09:29:50.279249+00:00,B2,training_style,tune,training_style_tune_001,1536,2048,1536,bf16,NVIDIA GeForce RTX 4060,c05,128,64,32,4,3,8,0.0,0.0,336.89600229263306,446.9456088542936,28.68444965282189,3,3,3,4_4_4_r1,0,
2026-03-02T09:29:50.481741+00:00,B2,training_style,tune,training_style_tune_002,3072,2048,4096,bf16,NVIDIA GeForce RTX 4060,c05,128,64,32,4,3,8,0.0,0.0,1763.327956199646,1863.7824058532715,29.228600029162486,3,3,3,4_4_4_r1,0,
2026-03-02T09:29:50.545846+00:00,B2,training_style,tune,training_style_tune_003,2048,1536,2048,bf16,NVIDIA GeForce RTX 4060,c05,128,64,32,4,3,8,0.0,0.0,471.1199998855591,541.7164921760559,27.349511570576293,3,3,3,4_4_4_r1,0,
2026-03-02T09:29:50.557240+00:00,B2,training_style,tune,training_style_tune_004,512,512,1024,bf16,NVIDIA GeForce RTX 4060,c03,64,64,32,4,2,8,0.0,0.0,58.86400118470192,374.27166268229405,9.120530395401095,2,2,3,3_3_3_r1,0,
2026-03-02T09:29:51.108155+00:00,B2,training_style,tune,training_style_tune_005,1024,1536,1536,bf16,NVIDIA GeForce RTX 4060,c03,64,64,32,4,2,8,0.0,550.87,175.10400712490082,203.3526423573494,27.59410414036655,3,3,3,3_4_4_r1,0,
2026-03-02T09:29:51.297666+00:00,B2,training_style,tune,training_style_tune_006,1024,1536,512,bf16,NVIDIA GeForce RTX 4060,c11,32,128,32,4,2,8,0.0,189.454,82.32000097632408,107.34751783311367,19.56526624025704,3,3,2,3_4_3_r1,0,
2026-03-02T09:29:51.318629+00:00,B2,training_style,tune,training_style_tune_007,2048,1536,512,bf16,NVIDIA GeForce RTX 4060,c03,64,64,32,4,2,8,0.0,0.0,130.048006772995,224.45216372609133,24.76951052100939,3,3,2,4_4_3_r1,0,
2026-03-02T09:29:51.409697+00:00,B2,training_style,tune,training_style_tune_008,3072,3072,1536,bf16,NVIDIA GeForce RTX 4060,c05,128,64,32,4,3,8,0.0,0.0,888.1440162658691,1028.5465800762177,32.642261521831195,3,3,3,4_4_4_r1,0,
2026-03-02T09:29:51.436018+00:00,B2,training_style,tune,training_style_tune_009,1024,1536,1024,bf16,NVIDIA GeForce RTX 4060,c11,32,128,32,4,2,8,0.0,0.0,143.3280035853386,242.98048153519628,22.47450178207539,3,3,3,3_4_3_r1,0,
2026-03-02T09:29:51.537966+00:00,B2,training_style,tune,training_style_tune_010,1536,2048,4096,bf16,NVIDIA GeForce RTX 4060,c05,128,64,32,4,3,8,0.0,0.0,791.375994682312,986.2499111890791,32.563287172167726,3,3,3,4_4_4_r1,0,
2026-03-02T09:29:51.594643+00:00,B2,training_style,tune,training_style_tune_011,1024,1024,4096,bf16,NVIDIA GeForce RTX 4060,c09,128,64,64,8,3,8,0.0,0.0,293.88800263404846,342.03647643327713,29.228599041166884,3,3,3,3_3_4_r1,0,
2026-03-02T09:29:51.913925+00:00,B2,training_style,tune,training_style_tune_012,3072,4096,4096,bf16,NVIDIA GeForce RTX 4060,c05,128,64,32,4,3,8,0.0,0.0,3126.271963119507,3278.7833094596863,32.9719283286998,3,3,3,4_4_4_r1,0,
2026-03-02T09:29:52.194476+00:00,B2,training_style,tune,training_style_tune_013,512,1024,3072,bf16,NVIDIA GeForce RTX 4060,c11,32,128,32,4,2,8,0.0,280.494,156.16000443696976,198.46144378185267,20.627724004068984,2,3,3,3_3_4_r0,0,
2026-03-02T09:29:52.221179+00:00,B2,training_style,tune,training_style_tune_014,1536,1024,1024,bf16,NVIDIA GeForce RTX 4060,c09,128,64,64,8,3,8,0.0,0.0,140.62399417161942,190.98080098628986,22.906656086505215,3,3,3,4_3_3_r1,0,
2026-03-02T09:29:52.293449+00:00,B2,training_style,tune,training_style_tune_015,2048,3072,1536,bf16,NVIDIA GeForce RTX 4060,c05,128,64,32,4,3,8,0.0,0.0,623.9520013332367,714.3321448564529,30.975704526473276,3,3,3,4_4_4_r1,0,
2026-03-02T09:29:54.359527+00:00,B2,training_style,tune,training_style_tune_016,1536,3072,3072,bf16,NVIDIA GeForce RTX 4060,c10,64,128,64,8,3,8,0.0,2066.011,931.1679899692535,981.9961488246918,31.13404837827089,3,3,3,4_4_4_r0,0,
2026-03-02T09:29:54.396344+00:00,B2,training_style,tune,training_style_tune_017,1024,1024,2048,bf16,NVIDIA GeForce RTX 4060,c09,128,64,64,8,3,8,0.0,0.0,176.04800313711166,261.7654460668563,24.396569228081194,3,3,3,3_3_4_r1,0,
2026-03-02T09:29:54.429362+00:00,B2,training_style,tune,training_style_tune_018,1536,1536,1536,bf16,NVIDIA GeForce RTX 4060,c05,128,64,32,4,3,8,0.0,0.0,223.23200106620789,259.62911784648895,32.46737599171726,3,3,3,4_4_4_r1,0,
2026-03-02T09:29:54.470159+00:00,B2,training_style,tune,training_style_tune_019,1536,1536,2048,bf16,NVIDIA GeForce RTX 4060,c05,128,64,32,4,3,8,0.0,0.0,315.0240033864975,349.429766535759,30.676000279711396,3,3,3,4_4_4_r1,0,
2026-03-02T09:29:54.492490+00:00,B2,training_style,tune,training_style_tune_020,1536,1536,1024,bf16,NVIDIA GeForce RTX 4060,c03,64,64,32,4,2,8,0.0,0.0,172.03199863433838,265.1084864139557,28.086857365822308,3,3,3,4_4_3_r1,0,
2026-03-02T09:29:54.521479+00:00,B2,training_style,tune,training_style_tune_021,1024,2048,1536,bf16,NVIDIA GeForce RTX 4060,c04,64,64,64,4,3,8,0.0,0.0,227.32800245285034,287.64191582798935,28.339891586106802,3,3,3,3_4_4_r0,0,
2026-03-02T09:29:54.537896+00:00,B2,training_style,tune,training_style_tune_022,512,1024,1536,bf16,NVIDIA GeForce RTX 4060,c11,32,128,32,4,2,8,0.0,0.0,102.89599746465683,122.33952313661572,15.652822030839639,2,3,3,3_3_4_r0,0,
2026-03-02T09:29:54.586517+00:00,B2,training_style,tune,training_style_tune_023,1536,2048,2048,bf16,NVIDIA GeForce RTX 4060,c05,128,64,32,4,3,8,0.0,0.0,414.67200219631195,483.03135156631464,31.072514709831058,3,3,3,4_4_4_r1,0,
2026-03-02T09:29:54.602121+00:00,B2,training_style,tune,training_style_tune_024,1024,1024,1024,bf16,NVIDIA GeForce RTX 4060,c03,64,64,32,4,2,8,0.0,0.0,112.70400136709213,187.3638428747654,19.054191705273677,3,3,3,3_3_3_r1,0,
2026-03-02T09:29:55.369765+00:00,B2,training_style,tune,training_style_tune_025,1536,1024,4096,bf16,NVIDIA GeForce RTX 4060,c04,64,64,64,4,3,8,0.0,767.594,432.17600882053375,486.9196766614914,29.81401471859723,3,3,3,4_3_4_r1,0,
2026-03-02T09:29:55.963276+00:00,B2,training_style,tune,training_style_tune_026,2048,4096,512,bf16,NVIDIA GeForce RTX 4060,c10,64,128,64,8,3,8,0.0,593.454,321.3279992341995,350.28991907835007,26.732605351764683,3,3,2,4_4_3_r0,0,
2026-03-02T09:29:56.114388+00:00,B2,training_style,tune,training_style_tune_027,4096,4096,1536,bf16,NVIDIA GeForce RTX 4060,c05,128,64,32,4,3,8,0.0,0.0,1579.0079832077026,1588.8076770305634,32.64049840159705,3,3,3,4_4_4_r1,0,
2026-03-02T09:29:56.200012+00:00,B2,training_style,tune,training_style_tune_028,1536,1536,4096,bf16,NVIDIA GeForce RTX 4060,c05,128,64,32,4,3,8,0.0,0.0,601.0879874229431,620.1241427659988,32.153949565458056,3,3,3,4_4_4_r1,0,
2026-03-02T09:29:58.394928+00:00,B2,training_style,tune,training_style_tune_029,4096,2048,2048,bf16,NVIDIA GeForce RTX 4060,c05,128,64,32,4,3,8,0.0,2194.85,1116.6720390319824,1162.9260528087616,30.769766920810227,3,3,3,4_4_4_r2,0,
2026-03-02T09:29:58.418545+00:00,B2,training_style,tune,training_style_tune_030,2048,2048,512,bf16,NVIDIA GeForce RTX 4060,c03,64,64,32,4,2,8,0.0,0.0,173.74400049448013,225.62751755118353,24.720089809008694,3,3,2,4_4_3_r1,0,
2026-03-02T09:29:58.439599+00:00,B2,training_style,tune,training_style_tune_031,512,512,1536,bf16,NVIDIA GeForce RTX 4060,c09,128,64,64,8,3,8,0.0,0.0,99.32799637317657,188.47743675112724,8.107546687788341,2,2,3,3_3_4_r1,0,
2026-03-02T09:29:58.523908+00:00,B2,training_style,eval,training_style_eval_000,2048,1536,3072,bf16,NVIDIA GeForce RTX 4060,c05,128,64,32,4,3,8,0.0,0.0,624.6399879455566,708.1657600402831,30.941587482363627,3,3,3,4_4_4_r1,0,
2026-03-02T09:29:58.568849+00:00,B2,training_style,eval,training_style_eval_001,1024,2048,2048,bf16,NVIDIA GeForce RTX 4060,c04,64,64,64,4,3,8,0.0,0.0,288.06400299072266,304.1811338067055,29.81953490480602,3,3,3,3_4_4_r0,0,
2026-03-02T09:29:58.613847+00:00,B2,training_style,eval,training_style_eval_002,1536,1024,3072,bf16,NVIDIA GeForce RTX 4060,c04,64,64,64,4,3,8,0.0,0.0,317.440003156662,385.1775923371314,30.442528729533855,3,3,3,4_3_4_r1,0,
2026-03-02T09:29:58.725512+00:00,B2,training_style,eval,training_style_eval_003,1024,512,1024,bf16,NVIDIA GeForce RTX 4060,c09,128,64,64,8,3,8,0.0,111.602,65.5359998345375,73.1264016777277,16.384000041365624,3,2,3,3_3_3_r2,0,
2026-03-02T09:29:58.747706+00:00,B2,training_style,eval,training_style_eval_004,1024,2048,1024,bf16,NVIDIA GeForce RTX 4060,c06,64,128,32,4,3,8,0.0,0.0,157.69599378108978,173.90752166509628,27.23574133381081,3,3,3,3_4_3_r0,0,
2026-03-02T09:29:58.764042+00:00,B2,training_style,eval,training_style_eval_005,1024,512,1536,bf16,NVIDIA GeForce RTX 4060,c03,64,64,32,4,2,8,0.0,0.0,84.99199897050858,95.15360184013844,18.950168904238474,3,2,3,3_3_4_r2,0,
2026-03-02T09:29:58.811789+00:00,B2,training_style,eval,training_style_eval_006,2048,1536,2048,bf16,NVIDIA GeForce RTX 4060,c05,128,64,32,4,3,8,0.0,0.0,409.07199680805206,448.50719451904286,31.49788298524368,3,3,3,4_4_4_r1,0,
2026-03-02T09:29:58.838863+00:00,B2,training_style,eval,training_style_eval_007,1536,2048,1024,bf16,NVIDIA GeForce RTX 4060,c03,64,64,32,4,2,8,0.0,0.0,227.80799865722656,273.922558426857,28.280178843472896,3,3,3,4_4_3_r1,0,
2026-03-02T09:29:58.851908+00:00,B2,training_style,eval,training_style_eval_008,512,512,2048,bf16,NVIDIA GeForce RTX 4060,c09,128,64,64,8,3,8,0.0,0.0,75.77600330114365,122.24735915660847,14.169945328639345,2,2,3,3_3_4_r1,0,
2026-03-02T09:29:58.869017+00:00,B2,training_style,eval,training_style_eval_009,1024,512,2048,bf16,NVIDIA GeForce RTX 4060,c03,64,64,32,4,2,8,0.0,0.0,105.47199845314026,141.22591584920877,20.360699327737656,3,2,3,3_3_4_r2,0,
2026-03-02T09:29:58.910267+00:00,B2,training_style,eval,training_style_eval_010,2048,3072,1024,bf16,NVIDIA GeForce RTX 4060,c03,64,64,32,4,2,8,0.0,0.0,409.60000455379486,438.5689541697502,31.457279650268557,3,3,3,4_4_3_r1,0,
2026-03-02T09:29:58.989053+00:00,B2,training_style,eval,training_style_eval_011,2048,4096,1536,bf16,NVIDIA GeForce RTX 4060,c10,64,128,64,8,3,8,0.0,0.0,806.9120049476624,865.0809633731841,31.936324677275653,3,3,3,4_4_4_r0,0,
2026-03-02T09:29:59.122175+00:00,B2,training_style,eval,training_style_eval_012,2048,3072,3072,bf16,NVIDIA GeForce RTX 4060,c05,128,64,32,4,3,8,0.0,0.0,1179.6480417251587,1303.4563422203064,32.767998840967856,3,3,3,4_4_4_r1,0,
2026-03-02T09:29:59.185860+00:00,B2,training_style,eval,training_style_eval_013,3072,1536,1536,bf16,NVIDIA GeForce RTX 4060,c05,128,64,32,4,3,8,0.0,0.0,485.8880043029785,643.0326330661771,29.83303661672872,3,3,3,4_4_4_r2,0,
2026-03-02T09:29:59.225901+00:00,B2,training_style,eval,training_style_eval_014,2048,1536,1536,bf16,NVIDIA GeForce RTX 4060,c05,128,64,32,4,3,8,0.0,0.0,335.7599973678589,428.57471972703934,28.781500154148702,3,3,3,4_4_4_r1,0,
2026-03-02T09:29:59.280860+00:00,B2,training_style,eval,training_style_eval_015,4096,2048,1024,bf16,NVIDIA GeForce RTX 4060,c03,64,64,32,4,2,8,0.0,0.0,546.207994222641,610.2268666028974,31.452980120604526,3,3,3,4_4_3_r2,0,
2026-03-02T09:29:59.296673+00:00,B2,training_style,eval,training_style_eval_016,2048,1024,512,bf16,NVIDIA GeForce RTX 4060,c07,128,128,32,8,3,8,0.0,0.0,110.59200018644333,223.74207735061646,19.418074041337796,3,3,2,4_3_3_r2,0,
2026-03-02T09:29:59.413957+00:00,B2,training_style,eval,training_style_eval_017,2048,4096,2048,bf16,NVIDIA GeForce RTX 4060,c10,64,128,64,8,3,8,0.0,0.0,1075.711965560913,1231.412444114685,31.941392740838065,3,3,3,4_4_4_r0,0,
2026-03-02T09:29:59.498598+00:00,B2,training_style,eval,training_style_eval_018,1536,2048,3072,bf16,NVIDIA GeForce RTX 4060,c05,128,64,32,4,3,8,0.0,0.0,622.5919723510742,834.9923038482661,31.043369799669488,3,3,3,4_4_4_r1,0,
2026-03-02T09:29:59.558733+00:00,B2,training_style,eval,training_style_eval_019,1536,1536,3072,bf16,NVIDIA GeForce RTX 4060,c05,128,64,32,4,3,8,0.0,0.0,483.2320064306259,632.282553911209,29.99700854061912,3,3,3,4_4_4_r1,0,
2026-03-02T09:29:59.638027+00:00,B2,training_style,eval,training_style_eval_020,3072,1536,2048,bf16,NVIDIA GeForce RTX 4060,c05,128,64,32,4,3,8,0.0,0.0,598.5279977321625,714.2563223838806,32.2914765979734,3,3,3,4_4_4_r2,0,
2026-03-02T09:29:59.720241+00:00,B2,training_style,eval,training_style_eval_021,2048,1024,4096,bf16,NVIDIA GeForce RTX 4060,c03,64,64,32,4,2,8,0.0,0.0,560.9759986400604,674.9593722820282,30.624962967485416,3,3,3,4_3_4_r2,0,
2026-03-02T09:29:59.733974+00:00,B2,training_style,eval,training_style_eval_022,512,512,1536,bf16,NVIDIA GeForce RTX 4060,c09,128,64,64,8,3,8,0.0,0.0,84.99199897050858,275.7753634452815,9.475084452119237,2,2,3,3_3_4_r1,0,
2026-03-02T09:30:00.069315+00:00,B2,training_style,eval,training_style_eval_023,3072,4096,4096,bf16,NVIDIA GeForce RTX 4060,c05,128,64,32,4,3,8,0.0,0.0,3208.0479860305786,3330.3039598464966,32.13144427790908,3,3,3,4_4_4_r1,0,
2026-03-02T09:30:00.138264+00:00,B2,training_style,eval,training_style_eval_024,1536,1024,4096,bf16,NVIDIA GeForce RTX 4060,c04,64,64,64,4,3,8,0.0,0.0,414.20799493789673,458.3283218741417,31.107323000686808,3,3,3,4_3_4_r1,0,
2026-03-02T09:30:00.290533+00:00,B2,training_style,eval,training_style_eval_025,4096,3072,2048,bf16,NVIDIA GeForce RTX 4060,c05,128,64,32,4,3,8,0.0,0.0,1513.4719610214233,1579.5916676521301,34.05388991628002,3,3,3,4_4_4_r1,0,
2026-03-02T09:30:00.304463+00:00,B2,training_style,eval,training_style_eval_026,1024,512,512,bf16,NVIDIA GeForce RTX 4060,c09,128,64,64,8,3,8,0.0,0.0,47.00800031423569,128.52224245667458,11.42084131235458,3,2,2,3_3_3_r2,0,
2026-03-02T09:30:00.366161+00:00,B2,training_style,eval,training_style_eval_027,2048,4096,1024,bf16,NVIDIA GeForce RTX 4060,c10,64,128,64,8,3,8,0.0,0.0,551.0240197181702,559.5296061038971,31.17807676113087,3,3,3,4_4_3_r0,0,
2026-03-02T09:30:00.390924+00:00,B2,training_style,eval,training_style_eval_028,1536,1536,1024,bf16,NVIDIA GeForce RTX 4060,c03,64,64,32,4,2,8,0.0,0.0,176.95999890565872,209.09695476293555,27.304691669759556,3,3,3,4_4_3_r1,0,
2026-03-02T09:30:00.424495+00:00,B2,training_style,eval,training_style_eval_029,1024,512,4096,bf16,NVIDIA GeForce RTX 4060,c03,64,64,32,4,2,8,0.0,0.0,175.4240021109581,278.0160120129584,24.48335030735061,3,2,3,3_3_4_r2,0,
2026-03-02T09:30:00.462249+00:00,B2,training_style,eval,training_style_eval_030,1024,1024,3072,bf16,NVIDIA GeForce RTX 4060,c09,128,64,64,8,3,8,0.0,0.0,248.6719936132431,370.2684852480886,25.90742467774588,3,3,3,3_3_4_r1,0,
2026-03-02T09:30:00.473974+00:00,B2,training_style,eval,training_style_eval_031,1024,1024,512,bf16,NVIDIA GeForce RTX 4060,c03,64,64,32,4,2,8,0.0,0.0,69.5360004901886,270.2131219208239,15.441524051293445,3,3,2,3_3_3_r1,0,
2026-03-02T09:30:00.485836+00:00,B2,training_style,eval,training_style_eval_032,512,1024,1024,bf16,NVIDIA GeForce RTX 4060,c02,32,64,32,2,2,8,0.0,0.0,76.65600255131721,179.15551617741582,14.00727651146674,2,3,3,3_3_3_r0,0,
2026-03-02T09:30:00.570057+00:00,B2,training_style,eval,training_style_eval_033,3072,2048,2048,bf16,NVIDIA GeForce RTX 4060,c05,128,64,32,4,3,8,0.0,0.0,791.0400032997131,923.4431922435758,32.57711831071103,3,3,3,4_4_4_r1,0,
2026-03-02T09:30:00.588479+00:00,B2,training_style,eval,training_style_eval_034,1536,1024,512,bf16,NVIDIA GeForce RTX 4060,c09,128,64,64,8,3,8,0.0,0.0,85.90399846434593,176.9984039664268,18.7489845035383,3,3,2,4_3_3_r1,0,
2026-03-02T09:30:01.011579+00:00,B2,training_style,eval,training_style_eval_035,4096,4096,4096,bf16,NVIDIA GeForce RTX 4060,c05,128,64,32,4,3,8,0.0,0.0,4319.295883178711,6642.528257369987,31.81975886561728,3,3,3,4_4_4_r1,0,
2026-03-02T09:30:01.253851+00:00,B2,training_style,eval,training_style_eval_036,2048,4096,4096,bf16,NVIDIA GeForce RTX 4060,c10,64,128,64,8,3,8,0.0,0.0,2083.807945251465,2182.184998989105,32.97783602975333,3,3,3,4_4_4_r0,0,
2026-03-02T09:30:01.293021+00:00,B2,training_style,eval,training_style_eval_037,4096,2048,512,bf16,NVIDIA GeForce RTX 4060,c03,64,64,32,4,2,8,0.0,0.0,297.8239953517914,319.9811151623726,28.84231870522562,3,3,2,4_4_3_r2,0,
2026-03-02T09:30:01.309318+00:00,B2,training_style,eval,training_style_eval_038,2048,1536,512,bf16,NVIDIA GeForce RTX 4060,c03,64,64,32,4,2,8,0.0,0.0,123.37599694728851,205.60512468218792,26.109012706711866,3,3,2,4_4_3_r1,0,
2026-03-02T09:30:01.395841+00:00,B2,training_style,eval,training_style_eval_039,3072,3072,1536,bf16,NVIDIA GeForce RTX 4060,c05,128,64,32,4,3,8,0.0,0.0,857.6000034809113,913.5462146997452,33.804838071744825,3,3,3,4_4_4_r1,0,
2026-03-02T09:30:01.414807+00:00,B2,training_style,eval,training_style_eval_040,1536,1536,512,bf16,NVIDIA GeForce RTX 4060,c03,64,64,32,4,2,8,0.0,0.0,108.5439994931221,223.5286451876163,22.2575095379002,3,3,2,4_4_3_r1,0,
2026-03-02T09:30:01.529934+00:00,B2,training_style,eval,training_style_eval_041,3072,3072,2048,bf16,NVIDIA GeForce RTX 4060,c05,128,64,32,4,3,8,0.0,0.0,1166.8480038642883,1334.3986928462982,33.12745579200201,3,3,3,4_4_4_r1,0,
2026-03-02T09:30:01.637774+00:00,B2,training_style,eval,training_style_eval_042,3072,4096,1536,bf16,NVIDIA GeForce RTX 4060,c05,128,64,32,4,3,8,0.0,0.0,1173.5360026359558,1324.8143708705902,32.93866193893936,3,3,3,4_4_4_r1,0,
2026-03-02T09:30:01.706642+00:00,B2,training_style,eval,training_style_eval_043,2048,3072,1536,bf16,NVIDIA GeForce RTX 4060,c05,128,64,32,4,3,8,0.0,0.0,600.9759902954102,665.2457726001737,32.1599417349429,3,3,3,4_4_4_r1,0,
2026-03-02T09:30:01.729454+00:00,B2,training_style,eval,training_style_eval_044,512,512,4096,bf16,NVIDIA GeForce RTX 4060,c09,128,64,64,8,3,8,0.0,0.0,124.51199814677238,212.6540811359882,17.24720251833552,2,2,3,3_3_4_r1,0,
2026-03-02T09:30:01.787337+00:00,B2,training_style,eval,training_style_eval_045,2048,1024,3072,bf16,NVIDIA GeForce RTX 4060,c03,64,64,32,4,2,8,0.0,0.0,412.992000579834,467.00576454401016,31.198913949688638,3,3,3,4_3_4_r2,0,
2026-03-02T09:30:02.109332+00:00,B2,training_style,eval,training_style_eval_046,4096,3072,4096,bf16,NVIDIA GeForce RTX 4060,c05,128,64,32,4,3,8,0.0,0.0,3194.815993309021,3279.190363883972,32.26452331523357,3,3,3,4_4_4_r1,0,
2026-03-02T09:30:02.151183+00:00,B2,training_style,eval,training_style_eval_047,1536,3072,1024,bf16,NVIDIA GeForce RTX 4060,c10,64,128,64,8,3,8,0.0,0.0,314.06401097774506,438.4268757700919,30.769766920810227,3,3,3,4_4_3_r0,0,
2026-03-02T09:30:02.172642+00:00,B2,training_style,eval,training_style_eval_048,512,512,3072,bf16,NVIDIA GeForce RTX 4060,c09,128,64,64,8,3,8,0.0,0.0,130.36800175905228,263.11615899205185,12.354356239783089,2,2,3,3_3_4_r1,0,
2026-03-02T09:30:02.207304+00:00,B2,training_style,eval,training_style_eval_049,512,1024,4096,bf16,NVIDIA GeForce RTX 4060,c11,32,128,32,4,2,8,0.0,0.0,198.4959989786148,237.14816212654114,21.63755097382453,2,3,3,3_3_4_r0,0,
2026-03-02T09:30:02.232575+00:00,B2,training_style,eval,training_style_eval_050,3072,2048,512,bf16,NVIDIA GeForce RTX 4060,c03,64,64,32,4,2,8,0.0,0.0,223.23200106620789,269.3631978332995,28.859889770415343,3,3,2,4_4_3_r1,0,
2026-03-02T09:30:02.242163+00:00,B2,training_style,eval,training_style_eval_051,512,512,1024,bf16,NVIDIA GeForce RTX 4060,c03,64,64,32,4,2,8,0.0,0.0,52.160000428557396,126.58112108707424,10.292770467579697,2,2,3,3_3_3_r1,0,
2026-03-02T09:30:02.279559+00:00,B2,training_style,eval,training_style_eval_052,1536,2048,1536,bf16,NVIDIA GeForce RTX 4060,c05,128,64,32,4,3,8,0.0,0.0,313.728004693985,319.487988948822,30.802721693353753,3,3,3,4_4_4_r1,0,
2026-03-02T09:30:02.386913+00:00,B2,training_style,eval,training_style_eval_053,1536,3072,3072,bf16,NVIDIA GeForce RTX 4060,c10,64,128,64,8,3,8,0.0,0.0,889.8240029811859,1045.0726497173307,32.580632968846736,3,3,3,4_4_4_r0,0,
2026-03-02T09:30:02.439177+00:00,B2,training_style,eval,training_style_eval_054,4096,3072,512,bf16,NVIDIA GeForce RTX 4060,c03,64,64,32,4,2,8,0.0,0.0,443.77601146698,616.9907093048096,29.034696682695127,3,3,2,4_4_3_r1,0,
2026-03-02T09:30:02.456316+00:00,B2,training_style,eval,training_style_eval_055,1024,1024,1024,bf16,NVIDIA GeForce RTX 4060,c03,64,64,32,4,2,8,0.0,0.0,121.85599654912949,148.50048556923866,17.62312654949389,3,3,3,3_3_3_r1,0,
2026-03-02T09:30:02.483665+00:00,B2,training_style,eval,training_style_eval_056,512,1024,3072,bf16,NVIDIA GeForce RTX 4060,c11,32,128,32,4,2,8,0.0,0.0,161.69600188732147,267.1939158439636,19.92149115872837,2,3,3,3_3_4_r0,0,
2026-03-02T09:30:02.504976+00:00,B2,training_style,eval,training_style_eval_057,1024,1536,1024,bf16,NVIDIA GeForce RTX 4060,c11,32,128,32,4,2,8,0.0,0.0,137.2160017490387,203.27423810958862,23.47558179031818,3,3,3,3_4_3_r1,0,
2026-03-02T09:30:02.622819+00:00,B2,training_style,eval,training_style_eval_058,4096,2048,2048,bf16,NVIDIA GeForce RTX 4060,c05,128,64,32,4,3,8,0.0,0.0,1053.6960363388062,1179.77086186409,32.60877632926005,3,3,3,4_4_4_r2,0,
2026-03-02T09:30:02.651410+00:00,B2,training_style,eval,training_style_eval_059,2048,3072,512,bf16,NVIDIA GeForce RTX 4060,c03,64,64,32,4,2,8,0.0,0.0,227.7119979262352,308.2415959239006,28.292101438093574,3,3,2,4_4_3_r1,0,
2026-03-02T09:30:02.681771+00:00,B2,training_style,eval,training_style_eval_060,3072,3072,512,bf16,NVIDIA GeForce RTX 4060,c03,64,64,32,4,2,8,0.0,0.0,320.19199430942535,403.67679595947266,30.18088080822305,3,3,2,4_4_3_r1,0,
2026-03-02T09:30:02.742442+00:00,B2,training_style,eval,training_style_eval_061,2048,2048,2048,bf16,NVIDIA GeForce RTX 4060,c05,128,64,32,4,3,8,0.0,0.0,546.0799932479858,711.9692701101301,31.460352689021292,3,3,3,4_4_4_r1,0,
2026-03-02T09:30:02.755620+00:00,B2,training_style,eval,training_style_eval_062,1024,2048,512,bf16,NVIDIA GeForce RTX 4060,c06,64,128,32,4,3,8,0.0,0.0,104.33599725365639,119.19200226664543,20.582384838658765,3,3,2,3_4_3_r0,0,
2026-03-02T09:30:02.870538+00:00,B2,training_style,eval,training_style_eval_063,3072,1536,3072,bf16,NVIDIA GeForce RTX 4060,c05,128,64,32,4,3,8,0.0,0.0,884.5599889755249,945.3420841693877,32.77452022397789,3,3,3,4_4_4_r2,0,
2026-03-02T09:30:02.881009+00:00,B2,adversarial,tune,adversarial_tune_000,1,1024,1024,bf16,NVIDIA GeForce RTX 4060,c00,32,32,32,2,2,8,0.0,0.0,37.84000128507614,131.17855578660962,0.05542156259986977,0,3,3,0_3_3_r0,0,
2026-03-02T09:30:02.900692+00:00,B2,adversarial,tune,adversarial_tune_001,1,1024,4096,bf16,NVIDIA GeForce RTX 4060,c00,32,32,32,2,2,8,0.0,0.0,59.39200147986412,80.4355204850435,0.14124137579104856,0,3,3,0_3_4_r0,0,
2026-03-02T09:30:02.916539+00:00,B2,adversarial,tune,adversarial_tune_002,1,4096,1024,bf16,NVIDIA GeForce RTX 4060,c00,32,32,32,2,2,8,0.0,0.0,39.983998984098434,73.82688321173191,0.20979912497837283,0,3,3,0_4_3_r0,0,
2026-03-02T09:30:03.010539+00:00,B2,adversarial,tune,adversarial_tune_003,1,4096,4096,bf16,NVIDIA GeForce RTX 4060,c02,32,64,32,2,2,8,0.0,0.0,159.08800065517426,175.68767607212067,0.21091742847865538,0,3,3,0_4_4_r0,0,
2026-03-02T09:30:03.050588+00:00,B2,adversarial,tune,adversarial_tune_004,1,8192,1024,bf16,NVIDIA GeForce RTX 4060,c00,32,32,32,2,2,8,0.0,0.0,48.79999905824661,57.968639098107786,0.3437954164707069,0,3,3,0_4_3_r0,0,
2026-03-02T09:30:03.223326+00:00,B2,adversarial,tune,adversarial_tune_005,1,8192,4096,bf16,NVIDIA GeForce RTX 4060,c02,32,64,32,2,2,8,0.0,0.0,294.73599791526794,333.1196841597556,0.22769144072890873,0,3,3,0_4_4_r0,0,
2026-03-02T09:30:03.234418+00:00,B2,adversarial,tune,adversarial_tune_006,2,1024,1024,bf16,NVIDIA GeForce RTX 4060,c00,32,32,32,2,2,8,0.0,0.0,35.551998764276505,985.6575758755173,0.1179766017604202,0,3,3,0_3_3_r0,0,
2026-03-02T09:30:03.252342+00:00,B2,adversarial,tune,adversarial_tune_007,2,1024,4096,bf16,NVIDIA GeForce RTX 4060,c00,32,32,32,2,2,8,0.0,0.0,59.28000062704086,148.50080117583275,0.28301646124387847,0,3,3,0_3_4_r0,0,
2026-03-02T09:30:03.268538+00:00,B2,adversarial,tune,adversarial_tune_008,2,4096,1024,bf16,NVIDIA GeForce RTX 4060,c00,32,32,32,2,2,8,0.0,0.0,39.35999982059002,87.2329578548669,0.42625040844699125,0,3,3,0_4_3_r0,0,
2026-03-02T09:30:03.350033+00:00,B2,adversarial,tune,adversarial_tune_009,2,4096,4096,bf16,NVIDIA GeForce RTX 4060,c02,32,64,32,2,2,8,0.0,0.0,161.79199516773224,197.46655881404865,0.41478482251502746,0,3,3,0_4_4_r0,0,
2026-03-02T09:30:03.388792+00:00,B2,adversarial,tune,adversarial_tune_010,2,8192,1024,bf16,NVIDIA GeForce RTX 4060,c00,32,32,32,2,2,8,0.0,0.0,45.05600035190582,61.0694399103522,0.7447272669106476,0,3,3,0_4_3_r0,0,
2026-03-02T09:30:03.545784+00:00,B2,adversarial,tune,adversarial_tune_011,2,8192,4096,bf16,NVIDIA GeForce RTX 4060,c02,32,64,32,2,2,8,0.0,0.0,293.88800263404846,358.30783814191807,0.45669686001823256,0,3,3,0_4_4_r0,0,
2026-03-02T09:30:03.555125+00:00,B2,adversarial,tune,adversarial_tune_012,4,1024,1024,bf16,NVIDIA GeForce RTX 4060,c00,32,32,32,2,2,8,0.0,0.0,31.232000328600407,116.29568211734293,0.2685901611085157,0,3,3,0_3_3_r0,0,
2026-03-02T09:30:03.575561+00:00,B2,adversarial,tune,adversarial_tune_013,4,1024,4096,bf16,NVIDIA GeForce RTX 4060,c00,32,32,32,2,2,8,0.0,0.0,58.36800113320351,155.24863995611645,0.5748771818213262,0,3,3,0_3_4_r0,0,
2026-03-02T09:30:03.593878+00:00,B2,adversarial,tune,adversarial_tune_014,4,4096,1024,bf16,NVIDIA GeForce RTX 4060,c00,32,32,32,2,2,8,0.0,0.0,40.95999896526337,196.33727982640255,0.8192000206947332,0,3,3,0_4_3_r0,0,
2026-03-02T09:30:03.677976+00:00,B2,adversarial,tune,adversarial_tune_015,4,4096,4096,bf16,NVIDIA GeForce RTX 4060,c02,32,64,32,2,2,8,0.0,0.0,162.6560017466545,270.0083142518996,0.8251630838009368,0,3,3,0_4_4_r0,0,
2026-03-02T09:30:03.717597+00:00,B2,adversarial,tune,adversarial_tune_016,4,8192,1024,bf16,NVIDIA GeForce RTX 4060,c00,32,32,32,2,2,8,0.0,0.0,48.54399897158146,118.73439714312549,1.3824337801112503,0,3,3,0_4_3_r0,0,
2026-03-02T09:30:03.880088+00:00,B2,adversarial,tune,adversarial_tune_017,4,8192,4096,bf16,NVIDIA GeForce RTX 4060,c02,32,64,32,2,2,8,0.0,0.0,321.9680041074753,397.1475237607955,0.8337333293229793,0,3,3,0_4_4_r0,0,
2026-03-02T09:30:03.890775+00:00,B2,adversarial,tune,adversarial_tune_018,8,1024,1024,bf16,NVIDIA GeForce RTX 4060,c00,32,32,32,2,2,8,0.0,0.0,55.27999997138977,129.22880269587037,0.3034952244696648,0,3,3,0_3_3_r0,0,
2026-03-02T09:30:03.911196+00:00,B2,adversarial,tune,adversarial_tune_019,8,1024,4096,bf16,NVIDIA GeForce RTX 4060,c00,32,32,32,2,2,8,0.0,0.0,70.65600156784058,234.13695663213716,0.949797080373494,0,3,3,0_3_4_r0,0,
2026-03-02T09:30:03.930043+00:00,B2,adversarial,tune,adversarial_tune_020,8,4096,1024,bf16,NVIDIA GeForce RTX 4060,c00,32,32,32,2,2,8,0.0,0.0,62.463998794555664,158.73856157064438,1.0743606764709592,0,3,3,0_4_3_r0,0,
2026-03-02T09:30:04.012136+00:00,B2,adversarial,tune,adversarial_tune_021,8,4096,4096,bf16,NVIDIA GeForce RTX 4060,c02,32,64,32,2,2,8,0.0,0.0,161.79199516773224,204.65024068951607,1.6591392900601099,0,3,3,0_4_4_r0,0,
2026-03-02T09:30:04.053187+00:00,B2,adversarial,tune,adversarial_tune_022,8,8192,1024,bf16,NVIDIA GeForce RTX 4060,c00,32,32,32,2,2,8,0.0,0.0,51.16799846291542,92.28512026369566,2.6230795034375984,0,3,3,0_4_3_r0,0,
2026-03-02T09:30:04.234017+00:00,B2,adversarial,tune,adversarial_tune_023,8,8192,4096,bf16,NVIDIA GeForce RTX 4060,c02,32,64,32,2,2,8,0.0,0.0,318.81600618362427,434.7254329919814,1.6839521905646904,0,3,3,0_4_4_r0,0,
2026-03-02T09:30:04.244624+00:00,B2,adversarial,tune,adversarial_tune_024,16,1024,1024,bf16,NVIDIA GeForce RTX 4060,c00,32,32,32,2,2,8,0.0,0.0,60.30400097370148,272.28159792721215,0.5564213229339967,0,3,3,0_3_3_r0,0,
2026-03-02T09:30:04.264709+00:00,B2,adversarial,tune,adversarial_tune_025,16,1024,4096,bf16,NVIDIA GeForce RTX 4060,c00,32,32,32,2,2,8,0.0,0.0,81.91999793052673,150.57663813233373,1.6384000413894664,0,3,3,0_3_4_r0,0,
2026-03-02T09:30:04.284412+00:00,B2,adversarial,tune,adversarial_tune_026,16,4096,1024,bf16,NVIDIA GeForce RTX 4060,c00,32,32,32,2,2,8,0.0,0.0,22.351999767124653,138.93568575382227,6.004730198566287,0,3,3,0_4_3_r0,0,
2026-03-02T09:30:04.370071+00:00,B2,adversarial,tune,adversarial_tune_027,16,4096,4096,bf16,NVIDIA GeForce RTX 4060,c02,32,64,32,2,2,8,0.0,0.0,150.36799758672714,256.8908886611461,3.5703801381697002,0,3,3,0_4_4_r0,0,
2026-03-02T09:30:04.413421+00:00,B2,adversarial,tune,adversarial_tune_028,16,8192,1024,bf16,NVIDIA GeForce RTX 4060,c00,32,32,32,2,2,8,0.0,0.0,56.32000043988228,108.94336313009244,4.766254508228145,0,3,3,0_4_3_r0,0,
2026-03-02T09:30:04.580339+00:00,B2,adversarial,tune,adversarial_tune_029,16,8192,4096,bf16,NVIDIA GeForce RTX 4060,c02,32,64,32,2,2,8,0.0,0.0,301.05599761009216,420.4646369814873,3.566585062326642,0,3,3,0_4_4_r0,0,
2026-03-02T09:30:04.591375+00:00,B2,adversarial,tune,adversarial_tune_030,32,1024,1024,bf16,NVIDIA GeForce RTX 4060,c04,64,64,64,4,3,8,0.0,0.0,66.27199798822403,183.64320144057257,1.0126277468188702,0,3,3,1_3_3_r0,0,
2026-03-02T09:30:04.612335+00:00,B2,adversarial,tune,adversarial_tune_031,32,1024,4096,bf16,NVIDIA GeForce RTX 4060,c04,64,64,64,4,3,8,0.0,0.0,93.18400174379349,226.9491186738014,2.8807032427954202,0,3,3,1_3_4_r0,0,
2026-03-02T09:30:04.622561+00:00,B2,adversarial,eval,adversarial_eval_000,1,1024,1024,bf16,NVIDIA GeForce RTX 4060,c00,32,32,32,2,2,8,0.0,0.0,58.36800113320351,152.71935939788816,0.03592982386383289,0,3,3,0_3_3_r0,0,
2026-03-02T09:30:04.647071+00:00,B2,adversarial,eval,adversarial_eval_001,1,1024,4096,bf16,NVIDIA GeForce RTX 4060,c00,32,32,32,2,2,8,0.0,0.0,113.66400122642517,216.39167860150332,0.07380180100548646,0,3,3,0_3_4_r0,0,
2026-03-02T09:30:04.667091+00:00,B2,adversarial,eval,adversarial_eval_002,1,4096,1024,bf16,NVIDIA GeForce RTX 4060,c00,32,32,32,2,2,8,0.0,0.0,72.7040022611618,123.14623683691019,0.11538027810170723,0,3,3,0_4_3_r0,0,
2026-03-02T09:30:04.749619+00:00,B2,adversarial,eval,adversarial_eval_003,1,4096,4096,bf16,NVIDIA GeForce RTX 4060,c02,32,64,32,2,2,8,0.0,0.0,168.96000504493713,248.01280185580248,0.19859393346416956,0,3,3,0_4_4_r0,0,
2026-03-02T09:30:04.794316+00:00,B2,adversarial,eval,adversarial_eval_004,1,8192,1024,bf16,NVIDIA GeForce RTX 4060,c00,32,32,32,2,2,8,0.0,0.0,68.4799998998642,200.48895701766008,0.24499439288161085,0,3,3,0_4_3_r0,0,
2026-03-02T09:30:04.974343+00:00,B2,adversarial,eval,adversarial_eval_005,1,8192,4096,bf16,NVIDIA GeForce RTX 4060,c02,32,64,32,2,2,8,0.0,0.0,487.93599009513855,530.09406208992,0.13753620426096258,0,3,3,0_4_4_r0,0,
2026-03-02T09:30:04.985627+00:00,B2,adversarial,eval,adversarial_eval_006,2,1024,1024,bf16,NVIDIA GeForce RTX 4060,c00,32,32,32,2,2,8,0.0,0.0,68.51200014352798,151.82368114590633,0.06121999053031905,0,3,3,0_3_3_r0,0,
2026-03-02T09:30:05.007240+00:00,B2,adversarial,eval,adversarial_eval_007,2,1024,4096,bf16,NVIDIA GeForce RTX 4060,c00,32,32,32,2,2,8,0.0,0.0,109.56799983978271,186.3884760439396,0.15312149555100676,0,3,3,0_3_4_r0,0,
2026-03-02T09:30:05.026498+00:00,B2,adversarial,eval,adversarial_eval_008,2,4096,1024,bf16,NVIDIA GeForce RTX 4060,c00,32,32,32,2,2,8,0.0,0.0,74.75200295448303,142.54079610109324,0.2244383472937274,0,3,3,0_4_3_r0,0,
2026-03-02T09:30:05.117464+00:00,B2,adversarial,eval,adversarial_eval_009,2,4096,4096,bf16,NVIDIA GeForce RTX 4060,c02,32,64,32,2,2,8,0.0,0.0,274.4320034980774,299.85792070627207,0.24453731031581435,0,3,3,0_4_4_r0,0,
2026-03-02T09:30:05.163980+00:00,B2,adversarial,eval,adversarial_eval_010,2,8192,1024,bf16,NVIDIA GeForce RTX 4060,c00,32,32,32,2,2,8,0.0,0.0,96.09600156545639,154.86175611615175,0.3491761514878867,0,3,3,0_4_3_r0,0,
2026-03-02T09:30:05.332716+00:00,B2,adversarial,eval,adversarial_eval_011,2,8192,4096,bf16,NVIDIA GeForce RTX 4060,c02,32,64,32,2,2,8,0.0,0.0,473.4880030155182,599.0604811906815,0.28346595298128624,0,3,3,0_4_4_r0,0,
2026-03-02T09:30:05.342600+00:00,B2,adversarial,eval,adversarial_eval_012,4,1024,1024,bf16,NVIDIA GeForce RTX 4060,c00,32,32,32,2,2,8,0.0,0.0,44.97599974274635,158.85760061442838,0.18651298576976935,0,3,3,0_3_3_r0,0,
2026-03-02T09:30:05.363883+00:00,B2,adversarial,eval,adversarial_eval_013,4,1024,4096,bf16,NVIDIA GeForce RTX 4060,c00,32,32,32,2,2,8,0.0,0.0,95.23200243711472,178.70655685663223,0.3523440770045475,0,3,3,0_3_4_r0,0,
2026-03-02T09:30:05.381585+00:00,B2,adversarial,eval,adversarial_eval_014,4,4096,1024,bf16,NVIDIA GeForce RTX 4060,c00,32,32,32,2,2,8,0.0,0.0,55.215999484062195,133.6457598209381,0.6076940074169138,0,3,3,0_4_3_r0,0,
2026-03-02T09:30:05.474942+00:00,B2,adversarial,eval,adversarial_eval_015,4,4096,4096,bf16,NVIDIA GeForce RTX 4060,c02,32,64,32,2,2,8,0.0,0.0,251.90401077270508,365.05536019802094,0.5328129853442695,0,3,3,0_4_4_r0,0,
2026-03-02T09:30:05.517694+00:00,B2,adversarial,eval,adversarial_eval_016,4,8192,1024,bf16,NVIDIA GeForce RTX 4060,c00,32,32,32,2,2,8,0.0,0.0,72.7040022611618,140.3699153661728,0.9230422248136578,0,3,3,0_4_3_r0,0,
2026-03-02T09:30:05.689848+00:00,B2,adversarial,eval,adversarial_eval_017,4,8192,4096,bf16,NVIDIA GeForce RTX 4060,c02,32,64,32,2,2,8,0.0,0.0,470.97600996494293,563.4035015106201,0.5699556884436237,0,3,3,0_4_4_r0,0,
2026-03-02T09:30:05.703420+00:00,B2,adversarial,eval,adversarial_eval_018,8,1024,1024,bf16,NVIDIA GeForce RTX 4060,c00,32,32,32,2,2,8,0.0,0.0,49.15200173854828,143.42143639922142,0.34133332126008187,0,3,3,0_3_3_r0,0,
2026-03-02T09:30:05.726307+00:00,B2,adversarial,eval,adversarial_eval_019,8,1024,4096,bf16,NVIDIA GeForce RTX 4060,c00,32,32,32,2,2,8,0.0,0.0,101.3759970664978,154.12224367260933,0.6619798171354093,0,3,3,0_3_4_r0,0,
2026-03-02T09:30:05.746427+00:00,B2,adversarial,eval,adversarial_eval_020,8,4096,1024,bf16,NVIDIA GeForce RTX 4060,c00,32,32,32,2,2,8,0.0,0.0,80.86399734020233,138.46880525350565,0.8298979299485627,0,3,3,0_4_3_r0,0,
2026-03-02T09:30:05.834699+00:00,B2,adversarial,eval,adversarial_eval_021,8,4096,4096,bf16,NVIDIA GeForce RTX 4060,c02,32,64,32,2,2,8,0.0,0.0,252.27200984954834,258.53888899087906,1.0640715002829342,0,3,3,0_4_4_r0,0,
2026-03-02T09:30:05.876213+00:00,B2,adversarial,eval,adversarial_eval_022,8,8192,1024,bf16,NVIDIA GeForce RTX 4060,c00,32,32,32,2,2,8,0.0,0.0,80.30399680137634,199.7782368957996,1.6713704590815537,0,3,3,0_4_3_r0,0,
2026-03-02T09:30:06.046038+00:00,B2,adversarial,eval,adversarial_eval_023,8,8192,4096,bf16,NVIDIA GeForce RTX 4060,c02,32,64,32,2,2,8,0.0,0.0,481.6319942474365,604.0678465366362,1.1146911301830682,0,3,3,0_4_4_r0,0,
2026-03-02T09:30:06.061904+00:00,B2,adversarial,eval,adversarial_eval_024,16,1024,1024,bf16,NVIDIA GeForce RTX 4060,c00,32,32,32,2,2,8,0.0,0.0,79.6320028603077,187.26655542850494,0.42136868086643464,0,3,3,0_3_3_r0,0,
2026-03-02T09:30:06.083073+00:00,B2,adversarial,eval,adversarial_eval_025,16,1024,4096,bf16,NVIDIA GeForce RTX 4060,c00,32,32,32,2,2,8,0.0,0.0,105.47199845314026,122.82304361462593,1.2725437079836035,0,3,3,0_3_4_r0,0,
2026-03-02T09:30:06.100903+00:00,B2,adversarial,eval,adversarial_eval_026,16,4096,1024,bf16,NVIDIA GeForce RTX 4060,c00,32,32,32,2,2,8,0.0,0.0,59.39200147986412,156.31359696388242,2.259862012656777,0,3,3,0_4_3_r0,0,
2026-03-02T09:30:06.200372+00:00,B2,adversarial,eval,adversarial_eval_027,16,4096,4096,bf16,NVIDIA GeForce RTX 4060,c02,32,64,32,2,2,8,0.0,0.0,257.53599405288696,273.48607510328293,2.0846441833282126,0,3,3,0_4_4_r0,0,
2026-03-02T09:30:06.242937+00:00,B2,adversarial,eval,adversarial_eval_028,16,8192,1024,bf16,NVIDIA GeForce RTX 4060,c00,32,32,32,2,2,8,0.0,0.0,92.52800047397614,140.30848279595375,2.9011267359603057,0,3,3,0_4_3_r0,0,
2026-03-02T09:30:06.423137+00:00,B2,adversarial,eval,adversarial_eval_029,16,8192,4096,bf16,NVIDIA GeForce RTX 4060,c02,32,64,32,2,2,8,0.0,0.0,475.13601183891296,503.80802154541016,2.259862012656777,0,3,3,0_4_4_r0,0,
2026-03-02T09:30:06.432557+00:00,B2,adversarial,eval,adversarial_eval_030,32,1024,1024,bf16,NVIDIA GeForce RTX 4060,c04,64,64,64,4,3,8,0.0,0.0,59.1839998960495,146.9958402216434,1.133902137703935,0,3,3,1_3_3_r0,0,
2026-03-02T09:30:06.456676+00:00,B2,adversarial,eval,adversarial_eval_031,32,1024,4096,bf16,NVIDIA GeForce RTX 4060,c04,64,64,64,4,3,8,0.0,0.0,118.67200210690498,135.2908810973167,2.261994836475258,0,3,3,1_3_4_r0,0,
2026-03-02T09:30:06.475785+00:00,B2,adversarial,eval,adversarial_eval_032,32,4096,1024,bf16,NVIDIA GeForce RTX 4060,c04,64,64,64,4,3,8,0.0,0.0,84.99199897050858,101.39647707343102,3.158361484039746,0,3,3,1_4_3_r0,0,
2026-03-02T09:30:06.570077+00:00,B2,adversarial,eval,adversarial_eval_033,32,4096,4096,bf16,NVIDIA GeForce RTX 4060,c04,64,64,64,4,3,8,0.0,0.0,295.9359884262085,432.8550413250923,3.628290799338645,0,3,3,1_4_4_r0,0,
2026-03-02T09:30:06.617813+00:00,B2,adversarial,eval,adversarial_eval_034,32,8192,1024,bf16,NVIDIA GeForce RTX 4060,c04,64,64,64,4,3,8,0.0,0.0,166.9120043516159,275.6633472442626,3.216490713687859,0,3,3,1_4_3_r0,0,
2026-03-02T09:30:06.793334+00:00,B2,adversarial,eval,adversarial_eval_035,32,8192,4096,bf16,NVIDIA GeForce RTX 4060,c04,64,64,64,4,3,8,0.0,0.0,524.2080092430115,550.3961551189423,4.096625023148918,0,3,3,1_4_4_r0,0,
2026-03-02T09:30:09.145802+00:00,B2,adversarial,eval,adversarial_eval_036,1024,1,512,bf16,NVIDIA GeForce RTX 4060,c01,64,32,32,2,2,8,0.0,2352.398,57.34400078654289,113.21984060108659,0.018285714034903415,3,0,2,3_0_3_r2,0,anchor_skipped
2026-03-02T09:30:09.437812+00:00,B2,adversarial,eval,adversarial_eval_037,1024,1,2048,bf16,NVIDIA GeForce RTX 4060,c09,128,64,64,8,3,8,0.0,291.966,69.45599988102913,344.5596846938133,0.060387929152044516,3,0,3,3_0_4_r2,0,anchor_skipped
2026-03-02T09:30:09.530731+00:00,B2,adversarial,eval,adversarial_eval_038,2048,1,512,bf16,NVIDIA GeForce RTX 4060,c09,128,64,64,8,3,8,0.0,92.871,62.44799867272377,80.46367779374123,0.03358237324771146,3,0,2,4_0_3_r2,0,anchor_skipped
2026-03-02T09:30:09.644009+00:00,B2,adversarial,eval,adversarial_eval_039,2048,1,2048,bf16,NVIDIA GeForce RTX 4060,c00,32,32,32,2,2,8,0.0,113.231,61.904000118374825,162.79424250125885,0.1355099506325768,3,0,3,4_0_4_r2,0,anchor_skipped
2026-03-02T09:30:09.666421+00:00,B2,adversarial,eval,adversarial_eval_040,4096,1,512,bf16,NVIDIA GeForce RTX 4060,c09,128,64,64,8,3,8,0.0,0.0,53.61600033938885,90.20960085093974,0.0782285879858641,3,0,2,4_0_3_r2,0,
2026-03-02T09:30:09.712521+00:00,B2,adversarial,eval,adversarial_eval_041,4096,1,2048,bf16,NVIDIA GeForce RTX 4060,c00,32,32,32,2,2,8,0.0,0.0,65.5680000782013,172.4335977435112,0.2558750607001927,3,0,3,4_0_4_r2,0,
2026-03-02T09:30:09.876707+00:00,B2,adversarial,eval,adversarial_eval_042,1024,2,512,bf16,NVIDIA GeForce RTX 4060,c01,64,32,32,2,2,8,0.0,0.0,41.98399931192398,103.51391814649104,0.04995122033084596,3,0,2,3_0_3_r2,0,
2026-03-02T09:30:10.070506+00:00,B2,adversarial,eval,adversarial_eval_043,1024,2,2048,bf16,NVIDIA GeForce RTX 4060,c09,128,64,64,8,3,8,0.0,0.0,112.64000087976456,144.58879679441446,0.07447272669106476,3,0,3,3_0_4_r2,0,
2026-03-02T09:30:10.090095+00:00,B2,adversarial,eval,adversarial_eval_044,2048,2,512,bf16,NVIDIA GeForce RTX 4060,c09,128,64,64,8,3,8,0.0,0.0,86.43199875950813,586.4953404664984,0.04852721284012418,3,0,2,4_0_3_r2,0,
2026-03-02T09:30:10.248506+00:00,B2,adversarial,eval,adversarial_eval_045,2048,2,2048,bf16,NVIDIA GeForce RTX 4060,c00,32,32,32,2,2,8,0.0,0.0,101.13600268959999,119.84544225037095,0.16588767158903378,3,0,3,4_0_4_r2,0,
2026-03-02T09:30:10.273037+00:00,B2,adversarial,eval,adversarial_eval_046,4096,2,512,bf16,NVIDIA GeForce RTX 4060,c09,128,64,64,8,3,8,0.0,0.0,89.56800028681755,458.60863029956784,0.09365630552359915,3,0,2,4_0_3_r2,0,
2026-03-02T09:30:10.321194+00:00,B2,adversarial,eval,adversarial_eval_047,4096,2,2048,bf16,NVIDIA GeForce RTX 4060,c00,32,32,32,2,2,8,0.0,0.0,102.35199704766273,229.96831506490702,0.3278336814901086,3,0,3,4_0_4_r2,0,
2026-03-02T09:30:10.330070+00:00,B2,adversarial,eval,adversarial_eval_048,1024,4,512,bf16,NVIDIA GeForce RTX 4060,c01,64,32,32,2,2,8,0.0,0.0,73.5200010240078,104.04031865298748,0.05704983598450113,3,0,2,3_0_3_r2,0,
2026-03-02T09:30:10.347178+00:00,B2,adversarial,eval,adversarial_eval_049,1024,4,2048,bf16,NVIDIA GeForce RTX 4060,c09,128,64,64,8,3,8,0.0,0.0,117.552001029253,179.626876860857,0.14272165384768704,3,0,3,3_0_4_r2,0,
2026-03-02T09:30:10.357041+00:00,B2,adversarial,eval,adversarial_eval_050,2048,4,512,bf16,NVIDIA GeForce RTX 4060,c09,128,64,64,8,3,8,0.0,0.0,68.60800087451935,164.89727862179257,0.12226865515790718,3,0,2,4_0_3_r2,0,
2026-03-02T09:30:10.379492+00:00,B2,adversarial,eval,adversarial_eval_051,2048,4,2048,bf16,NVIDIA GeForce RTX 4060,c00,32,32,32,2,2,8,0.0,0.0,83.71200039982796,204.5235258340835,0.40083180236687976,3,0,3,4_0_4_r2,0,
2026-03-02T09:30:10.394238+00:00,B2,adversarial,eval,adversarial_eval_052,4096,4,512,bf16,NVIDIA GeForce RTX 4060,c09,128,64,64,8,3,8,0.0,0.0,73.64800199866295,209.45503622293452,0.22780273116308822,3,0,2,4_0_3_r2,0,
2026-03-02T09:30:10.439168+00:00,B2,adversarial,eval,adversarial_eval_053,4096,4,2048,bf16,NVIDIA GeForce RTX 4060,c00,32,32,32,2,2,8,0.0,0.0,84.99199897050858,92.18048140406609,0.7895903710099365,3,0,3,4_0_4_r2,0,
2026-03-02T09:30:10.448712+00:00,B2,adversarial,eval,adversarial_eval_054,1024,8,512,bf16,NVIDIA GeForce RTX 4060,c01,64,32,32,2,2,8,0.0,0.0,74.75200295448303,248.67968633770937,0.1122191736468637,3,0,2,3_0_3_r2,0,
2026-03-02T09:30:10.463451+00:00,B2,adversarial,eval,adversarial_eval_055,1024,8,2048,bf16,NVIDIA GeForce RTX 4060,c09,128,64,64,8,3,8,0.0,0.0,96.25600278377533,145.16223669052107,0.3485957345992748,3,0,3,3_0_4_r2,0,
2026-03-02T09:30:10.474382+00:00,B2,adversarial,eval,adversarial_eval_056,2048,8,512,bf16,NVIDIA GeForce RTX 4060,c09,128,64,64,8,3,8,0.0,0.0,56.671999394893646,98.42656031250954,0.29604065815810426,3,0,2,4_0_3_r2,0,
2026-03-02T09:30:10.495786+00:00,B2,adversarial,eval,adversarial_eval_057,2048,8,2048,bf16,NVIDIA GeForce RTX 4060,c00,32,32,32,2,2,8,0.0,0.0,82.94399827718735,254.72896739840482,0.8090864365584532,3,0,3,4_0_4_r2,0,
2026-03-02T09:30:10.508897+00:00,B2,adversarial,eval,adversarial_eval_058,4096,8,512,bf16,NVIDIA GeForce RTX 4060,c09,128,64,64,8,3,8,0.0,0.0,72.54400104284286,138.7587212026119,0.4625390317275649,3,0,2,4_0_3_r2,0,
2026-03-02T09:30:10.553435+00:00,B2,adversarial,eval,adversarial_eval_059,4096,8,2048,bf16,NVIDIA GeForce RTX 4060,c00,32,32,32,2,2,8,0.0,0.0,88.97599950432777,116.37759834527967,1.5084711466879523,3,0,3,4_0_4_r2,0,
2026-03-02T09:30:10.722313+00:00,B2,adversarial,eval,adversarial_eval_060,64,64,8192,bf16,NVIDIA GeForce RTX 4060,c04,64,64,64,4,3,8,0.0,168.817,93.18400174379349,101.71871967613697,0.7201758106988551,1,1,3,1_1_4_r1,0,
2026-03-02T09:30:10.738368+00:00,B2,adversarial,eval,adversarial_eval_061,128,128,8192,bf16,NVIDIA GeForce RTX 4060,c04,64,64,64,4,3,8,0.0,0.0,116.46400019526482,208.76928225159645,2.3048792377896876,1,1,3,2_2_4_r1,0,
2026-03-02T09:30:11.021703+00:00,B2,adversarial,eval,adversarial_eval_062,2048,128,8192,bf16,NVIDIA GeForce RTX 4060,c02,32,64,32,2,2,8,0.0,283.296,223.23200106620789,241.14815473556516,19.239926513610232,3,1,3,4_2_4_r2,0,anchor_skipped
2026-03-02T09:30:11.128453+00:00,B2,adversarial,eval,adversarial_eval_063,128,2048,8192,bf16,NVIDIA GeForce RTX 4060,c06,64,128,32,4,3,8,0.0,0.0,249.7279942035675,323.23583751916874,17.198581639585537,1,3,3,2_4_4_r0,0,
