results/B2_sweep_no_anchor.csv
timestamp,method,workload,split,shape_id,M,N,K,dtype,gpu,config_id,BLOCK_M,BLOCK_N,BLOCK_K,num_warps,num_stages,GROUP_M,compile_time_ms,tune_time_ms,runtime_cost_us,p99_us,runtime_perf_tflops,bucket_m,bucket_n,bucket_k,cache_key,invalid_config,notes
2026-03-02T09:32:38.025230+00:00,B2,uniform,tune,uniform_tune_000,1536,512,1024,bf16,NVIDIA GeForce RTX 4060,c06,64,128,32,4,3,8,186.85220391489565,2562.381,84.99199897050858,114.57535758614532,18.950168904238474,3,2,3,4_3_3_r2,0,anchor_skipped
2026-03-02T09:32:38.343451+00:00,B2,uniform,tune,uniform_tune_001,1536,1536,2048,bf16,NVIDIA GeForce RTX 4060,c06,64,128,32,4,3,8,0.0,318.176,319.487988948822,332.3023933172226,30.247385661650025,3,3,3,4_4_4_r1,0,anchor_skipped
2026-03-02T09:32:38.464957+00:00,B2,uniform,tune,uniform_tune_002,384,2048,1536,bf16,NVIDIA GeForce RTX 4060,c06,64,128,32,4,3,8,0.0,121.452,101.3759970664978,113.67232099175453,23.831273416874733,2,3,3,3_4_4_r0,0,anchor_skipped
2026-03-02T09:32:38.550098+00:00,B2,uniform,tune,uniform_tune_003,1536,64,3072,bf16,NVIDIA GeForce RTX 4060,c04,64,64,64,4,3,8,0.0,85.096,53.63200046122074,95.22592216730106,11.26155598907251,3,1,3,4_1_4_r2,0,anchor_skipped
2026-03-02T09:32:38.612604+00:00,B2,uniform,tune,uniform_tune_004,768,128,2048,bf16,NVIDIA GeForce RTX 4060,c04,64,64,64,4,3,8,0.0,62.461,43.007999658584595,58.89503993093964,9.362285788607435,3,1,3,3_2_4_r2,0,anchor_skipped
2026-03-02T09:32:38.633199+00:00,B2,uniform,tune,uniform_tune_005,512,128,4096,bf16,NVIDIA GeForce RTX 4060,c04,64,64,64,4,3,8,0.0,0.0,64.97599929571152,151.7385616898536,8.262603389239972,2,1,3,3_2_4_r2,0,
2026-03-02T09:32:39.176028+00:00,B2,uniform,tune,uniform_tune_006,2048,1024,4096,bf16,NVIDIA GeForce RTX 4060,c09,128,64,64,8,3,8,0.0,542.782,556.7519962787628,604.2790353298187,30.85731043413831,3,3,3,4_3_4_r2,0,anchor_skipped
2026-03-02T09:32:39.231176+00:00,B2,uniform,tune,uniform_tune_007,128,768,512,bf16,NVIDIA GeForce RTX 4060,c01,64,32,32,2,2,8,0.0,55.106,36.81600093841553,62.0716811716556,2.7342267881942397,1,3,2,2_3_3_r0,0,anchor_skipped
2026-03-02T09:32:39.277474+00:00,B2,uniform,tune,uniform_tune_008,2048,256,64,bf16,NVIDIA GeForce RTX 4060,c11,32,128,32,4,2,8,0.0,46.269,32.6399989426136,39.76831901818514,2.0560314391550145,3,2,1,4_2_1_r2,0,anchor_skipped
2026-03-02T09:32:39.345920+00:00,B2,uniform,tune,uniform_tune_009,192,768,2048,bf16,NVIDIA GeForce RTX 4060,c11,32,128,32,4,2,8,0.0,68.417,54.27199974656105,62.98623897135258,11.1287547689501,2,3,3,2_3_4_r0,0,anchor_skipped
2026-03-02T09:32:39.476897+00:00,B2,uniform,tune,uniform_tune_010,1024,1024,1536,bf16,NVIDIA GeForce RTX 4060,c04,64,64,64,4,3,8,0.0,130.941,130.048006772995,137.7382381260395,24.76951052100939,3,3,3,3_3_4_r1,0,anchor_skipped
2026-03-02T09:32:39.535496+00:00,B2,uniform,tune,uniform_tune_011,256,384,768,bf16,NVIDIA GeForce RTX 4060,c04,64,64,64,4,3,8,0.0,58.562,39.64800015091896,159.16832000017143,3.8083873947044524,2,2,3,2_3_3_r1,0,anchor_skipped
2026-03-02T09:32:39.593389+00:00,B2,uniform,tune,uniform_tune_012,64,192,2048,bf16,NVIDIA GeForce RTX 4060,c04,64,64,64,4,3,8,0.0,57.863,43.855998665094376,69.13504093885422,1.1476570944001714,1,2,3,1_2_4_r0,0,anchor_skipped
2026-03-02T09:32:39.635669+00:00,B2,uniform,tune,uniform_tune_013,192,128,512,bf16,NVIDIA GeForce RTX 4060,c04,64,64,64,4,3,8,0.0,42.25,32.44800120592117,47.532480359077454,0.7755739356730451,2,1,2,2_2_3_r1,0,anchor_skipped
2026-03-02T09:32:39.642093+00:00,B2,uniform,tune,uniform_tune_014,128,128,1024,bf16,NVIDIA GeForce RTX 4060,c04,64,64,64,4,3,8,0.0,0.0,26.623999699950218,86.56896118074644,1.2603077065112325,1,1,3,2_2_3_r1,0,
2026-03-02T09:32:40.066565+00:00,B2,uniform,tune,uniform_tune_015,3072,3072,768,bf16,NVIDIA GeForce RTX 4060,c06,64,128,32,4,3,8,0.0,424.438,471.5519994497299,572.9791814088821,30.740013065187526,3,3,3,4_4_3_r1,0,anchor_skipped
2026-03-02T09:32:40.143728+00:00,B2,uniform,tune,uniform_tune_016,256,128,3072,bf16,NVIDIA GeForce RTX 4060,c04,64,64,64,4,3,8,0.0,77.107,54.27199974656105,69.6934412419796,3.709584922983367,2,1,3,2_2_4_r2,0,anchor_skipped
2026-03-02T09:32:40.187838+00:00,B2,uniform,tune,uniform_tune_017,96,1024,192,bf16,NVIDIA GeForce RTX 4060,c11,32,128,32,4,2,8,0.0,44.073,30.687999911606312,48.772479705512495,1.2300813382667957,1,3,2,2_3_2_r0,0,anchor_skipped
2026-03-02T09:32:40.226248+00:00,B2,uniform,tune,uniform_tune_018,64,64,192,bf16,NVIDIA GeForce RTX 4060,c00,32,32,32,2,2,8,0.0,38.383,29.503999277949333,47.76160083711143,0.05331019653242486,1,1,2,1_1_2_r1,0,anchor_skipped
2026-03-02T09:32:40.282204+00:00,B2,uniform,tune,uniform_tune_019,4096,64,64,bf16,NVIDIA GeForce RTX 4060,c09,128,64,64,8,3,8,0.0,55.932,33.79200026392937,45.65344065427779,0.9929696892141969,3,1,1,4_1_1_r2,0,anchor_skipped
2026-03-02T09:32:40.486795+00:00,B2,uniform,tune,uniform_tune_020,128,4096,3072,bf16,NVIDIA GeForce RTX 4060,c06,64,128,32,4,3,8,0.0,204.56,138.2399946451187,146.7452834546566,23.30168979150595,1,3,3,2_4_4_r0,0,anchor_skipped
2026-03-02T09:32:40.528723+00:00,B2,uniform,tune,uniform_tune_021,192,2048,3072,bf16,NVIDIA GeForce RTX 4060,c06,64,128,32,4,3,8,0.0,0.0,103.88799756765366,177.17504292726505,23.255035813224833,2,3,3,2_4_4_r0,0,
2026-03-02T09:32:40.582009+00:00,B2,uniform,tune,uniform_tune_022,1536,2048,2048,bf16,NVIDIA GeForce RTX 4060,c06,64,128,32,4,3,8,0.0,0.0,384.880006313324,525.0502437353134,33.47771169363012,3,3,3,4_4_4_r1,0,
2026-03-02T09:32:40.593162+00:00,B2,uniform,tune,uniform_tune_023,256,1024,1024,bf16,NVIDIA GeForce RTX 4060,c01,64,32,32,2,2,8,0.0,0.0,54.64000068604946,213.98368075489995,9.825602219237753,2,3,3,2_3_3_r0,0,
2026-03-02T09:32:40.637305+00:00,B2,uniform,tune,uniform_tune_024,768,128,384,bf16,NVIDIA GeForce RTX 4060,c04,64,64,64,4,3,8,0.0,44.104,33.79200026392937,88.65184154361474,2.234181800731943,3,1,2,3_2_3_r2,0,anchor_skipped
2026-03-02T09:32:40.686248+00:00,B2,uniform,tune,uniform_tune_025,256,96,384,bf16,NVIDIA GeForce RTX 4060,c11,32,128,32,4,2,8,0.0,48.909,33.79200026392937,44.4915197044611,0.5585454501829857,2,1,2,2_2_3_r2,0,anchor_skipped
2026-03-02T09:32:40.703042+00:00,B2,uniform,tune,uniform_tune_026,96,1024,3072,bf16,NVIDIA GeForce RTX 4060,c11,32,128,32,4,2,8,0.0,0.0,71.29599899053574,148.64736124873156,8.47143997631867,1,3,3,2_3_4_r0,0,
2026-03-02T09:32:40.750564+00:00,B2,uniform,tune,uniform_tune_027,1536,512,4096,bf16,NVIDIA GeForce RTX 4060,c09,128,64,64,8,3,8,0.0,0.0,200.70399343967438,252.79488727450365,32.09926635533741,3,2,3,4_3_4_r2,0,
2026-03-02T09:32:40.790536+00:00,B2,uniform,tune,uniform_tune_028,128,64,192,bf16,NVIDIA GeForce RTX 4060,c04,64,64,64,4,3,8,0.0,39.914,29.69600073993206,40.15744008123875,0.10593103184328642,1,1,2,2_1_2_r2,0,anchor_skipped
2026-03-02T09:32:40.846847+00:00,B2,uniform,tune,uniform_tune_029,192,256,1536,bf16,NVIDIA GeForce RTX 4060,c04,64,64,64,4,3,8,0.0,56.265,38.91199827194214,44.49631959199905,3.880421224958686,2,2,3,2_2_4_r1,0,anchor_skipped
2026-03-02T09:32:40.909510+00:00,B2,uniform,tune,uniform_tune_030,4096,64,3072,bf16,NVIDIA GeForce RTX 4060,c04,64,64,64,4,3,8,0.0,0.0,91.15200117230415,132.75424309074873,17.669526892289145,3,1,3,4_1_4_r2,0,
2026-03-02T09:32:40.953096+00:00,B2,uniform,tune,uniform_tune_031,384,128,96,bf16,NVIDIA GeForce RTX 4060,c11,32,128,32,4,2,8,0.0,43.53,30.719999223947525,62.12608050554987,0.307200007760525,2,1,1,3_2_2_r2,0,anchor_skipped
2026-03-02T09:32:41.083062+00:00,B2,uniform,eval,uniform_eval_000,512,4096,768,bf16,NVIDIA GeForce RTX 4060,c06,64,128,32,4,3,8,0.0,129.466,128.9760023355484,141.35296314954758,24.975386224326826,2,3,3,3_4_3_r0,0,anchor_skipped
2026-03-02T09:32:41.121900+00:00,B2,uniform,eval,uniform_eval_001,384,512,64,bf16,NVIDIA GeForce RTX 4060,c03,64,64,32,4,2,8,0.0,38.796,28.68800051510334,48.32832027226684,0.877224747216209,2,2,1,3_3_1_r1,0,anchor_skipped
2026-03-02T09:32:41.197640+00:00,B2,uniform,eval,uniform_eval_002,256,4096,384,bf16,NVIDIA GeForce RTX 4060,c11,32,128,32,4,2,8,0.0,75.7,58.27200040221214,118.17248165607431,13.819782441678948,2,3,2,2_4_3_r0,0,anchor_skipped
2026-03-02T09:32:41.248158+00:00,B2,uniform,eval,uniform_eval_003,384,768,512,bf16,NVIDIA GeForce RTX 4060,c04,64,64,64,4,3,8,0.0,50.473,38.91199827194214,115.90591568499778,7.760842449917372,2,3,2,3_3_3_r0,0,anchor_skipped
2026-03-02T09:32:41.304079+00:00,B2,uniform,eval,uniform_eval_004,768,1024,96,bf16,NVIDIA GeForce RTX 4060,c11,32,128,32,4,2,8,0.0,55.892,35.840000957250595,72.13120192289344,4.21302845890279,3,3,1,3_3_2_r1,0,anchor_skipped
2026-03-02T09:32:41.416075+00:00,B2,uniform,eval,uniform_eval_005,3072,3072,128,bf16,NVIDIA GeForce RTX 4060,c06,64,128,32,4,3,8,0.0,111.965,106.49599879980087,111.8953588604927,22.685538717202185,3,3,1,4_4_2_r1,0,anchor_skipped
2026-03-02T09:32:41.430027+00:00,B2,uniform,eval,uniform_eval_006,256,96,512,bf16,NVIDIA GeForce RTX 4060,c11,32,128,32,4,2,8,0.0,0.0,46.560000628232956,172.27775871753687,0.5405030854905101,2,1,2,2_2_3_r2,0,
2026-03-02T09:32:41.838213+00:00,B2,uniform,eval,uniform_eval_007,4096,4096,4096,bf16,NVIDIA GeForce RTX 4060,c06,64,128,32,4,3,8,0.0,0.0,4361.727952957153,4457.410855293274,31.51020764117567,3,3,3,4_4_4_r1,0,
2026-03-02T09:32:41.882254+00:00,B2,uniform,eval,uniform_eval_008,128,96,64,bf16,NVIDIA GeForce RTX 4060,c11,32,128,32,4,2,8,0.0,43.982,28.624000027775764,37.54976022988556,0.05494913354086591,1,1,1,2_2_1_r1,0,anchor_skipped
2026-03-02T09:32:41.937882+00:00,B2,uniform,eval,uniform_eval_009,3072,384,96,bf16,NVIDIA GeForce RTX 4060,c06,64,128,32,4,3,8,0.0,55.591,38.91199827194214,58.34976002573964,5.82063183743803,3,2,1,4_3_2_r2,0,anchor_skipped
2026-03-02T09:32:41.958551+00:00,B2,uniform,eval,uniform_eval_010,768,768,2048,bf16,NVIDIA GeForce RTX 4060,c04,64,64,64,4,3,8,0.0,0.0,102.39999741315842,230.99392369389523,23.592960596008318,3,3,3,3_3_4_r1,0,
2026-03-02T09:32:42.016086+00:00,B2,uniform,eval,uniform_eval_011,4096,96,512,bf16,NVIDIA GeForce RTX 4060,c01,64,32,32,2,2,8,0.0,57.492,44.72000151872635,131.58208325505257,9.003872323917305,3,1,2,4_2_3_r2,0,anchor_skipped
2026-03-02T09:32:42.021182+00:00,B2,uniform,eval,uniform_eval_012,384,384,256,bf16,NVIDIA GeForce RTX 4060,c11,32,128,32,4,2,8,0.0,0.0,34.32000055909157,69.5750404894352,2.1998097543736863,2,2,2,3_3_2_r1,0,
2026-03-02T09:32:42.402933+00:00,B2,uniform,eval,uniform_eval_013,4096,2048,768,bf16,NVIDIA GeForce RTX 4060,c09,128,64,64,8,3,8,0.0,381.714,429.05598878860474,483.19359838962555,30.03081701383353,3,3,3,4_4_3_r2,0,anchor_skipped
2026-03-02T09:32:42.423581+00:00,B2,uniform,eval,uniform_eval_014,192,384,3072,bf16,NVIDIA GeForce RTX 4060,c11,32,128,32,4,2,8,0.0,0.0,71.68000191450119,131.35872341692442,6.3195426883541845,2,2,3,2_3_4_r0,0,
2026-03-02T09:32:42.433871+00:00,B2,uniform,eval,uniform_eval_015,128,96,4096,bf16,NVIDIA GeForce RTX 4060,c04,64,64,64,4,3,8,0.0,0.0,54.62400056421757,271.4435149729247,1.8428400512638632,1,1,3,2_2_4_r1,0,
2026-03-02T09:32:42.557748+00:00,B2,uniform,eval,uniform_eval_016,64,4096,2048,bf16,NVIDIA GeForce RTX 4060,c04,64,64,64,4,3,8,0.0,123.835,67.58400052785873,76.47744074463844,15.88751502742715,1,3,3,1_4_4_r0,0,anchor_skipped
2026-03-02T09:32:42.573477+00:00,B2,uniform,eval,uniform_eval_017,96,128,3072,bf16,NVIDIA GeForce RTX 4060,c04,64,64,64,4,3,8,0.0,0.0,72.7040022611618,136.50591984391212,1.038422502915365,1,1,3,2_2_4_r1,0,
2026-03-02T09:32:42.579429+00:00,B2,uniform,eval,uniform_eval_018,512,768,64,bf16,NVIDIA GeForce RTX 4060,c03,64,64,32,4,2,8,0.0,0.0,35.77600046992302,91.82719796895978,1.4068550799107336,2,3,1,3_3_1_r1,0,
2026-03-02T09:32:42.630476+00:00,B2,uniform,eval,uniform_eval_019,64,128,384,bf16,NVIDIA GeForce RTX 4060,c11,32,128,32,4,2,8,0.0,51.013,36.896001547575,48.13632115721702,0.1705186398555295,1,1,2,1_2_3_r0,0,anchor_skipped
2026-03-02T09:32:42.635162+00:00,B2,uniform,eval,uniform_eval_020,512,512,96,bf16,NVIDIA GeForce RTX 4060,c11,32,128,32,4,2,8,0.0,0.0,37.376001477241516,48.049600794911385,1.3466300837623646,2,2,1,3_3_2_r1,0,
2026-03-02T09:32:42.660140+00:00,B2,uniform,eval,uniform_eval_021,256,3072,1536,bf16,NVIDIA GeForce RTX 4060,c06,64,128,32,4,3,8,0.0,0.0,108.5439994931221,176.1916826665401,22.2575095379002,2,3,3,2_4_4_r0,0,
2026-03-02T09:32:42.669531+00:00,B2,uniform,eval,uniform_eval_022,2048,96,512,bf16,NVIDIA GeForce RTX 4060,c01,64,32,32,2,2,8,0.0,0.0,39.93599861860275,195.70335566997505,5.041230943608337,3,1,2,4_2_3_r2,0,
2026-03-02T09:32:42.703336+00:00,B2,uniform,eval,uniform_eval_023,1536,512,3072,bf16,NVIDIA GeForce RTX 4060,c09,128,64,64,8,3,8,0.0,0.0,175.9840026497841,186.39647960662842,27.4561217795209,3,2,3,4_3_4_r2,0,
2026-03-02T09:32:42.706796+00:00,B2,uniform,eval,uniform_eval_024,128,192,64,bf16,NVIDIA GeForce RTX 4060,c11,32,128,32,4,2,8,0.0,0.0,28.719999827444553,38.451199941337094,0.10953091987813916,1,2,1,2_2_1_r1,0,
2026-03-02T09:32:42.712885+00:00,B2,uniform,eval,uniform_eval_025,1536,96,384,bf16,NVIDIA GeForce RTX 4060,c01,64,32,32,2,2,8,0.0,0.0,39.93599861860275,53.147840164601796,2.8356924057796897,3,1,2,4_2_3_r2,0,
2026-03-02T09:32:42.771116+00:00,B2,uniform,eval,uniform_eval_026,1536,2048,64,bf16,NVIDIA GeForce RTX 4060,c11,32,128,32,4,2,8,0.0,58.2,48.8319993019104,54.655680470168576,8.24568294880868,3,3,1,4_4_1_r1,0,anchor_skipped
2026-03-02T09:32:42.787874+00:00,B2,uniform,eval,uniform_eval_027,256,1024,96,bf16,NVIDIA GeForce RTX 4060,c11,32,128,32,4,2,8,0.0,0.0,90.03200009465218,694.3491283059107,0.5590417623410063,2,3,1,2_3_2_r0,0,
2026-03-02T09:32:42.800877+00:00,B2,uniform,eval,uniform_eval_028,2048,256,64,bf16,NVIDIA GeForce RTX 4060,c11,32,128,32,4,2,8,0.0,0.0,47.808000817894936,800.2662539482117,1.4037161741111874,3,2,1,4_2_1_r2,0,
2026-03-02T09:32:42.809043+00:00,B2,uniform,eval,uniform_eval_029,192,768,192,bf16,NVIDIA GeForce RTX 4060,c11,32,128,32,4,2,8,0.0,0.0,43.007999658584595,150.0524778664111,1.3165714390229206,2,3,2,2_3_2_r0,0,
2026-03-02T09:32:42.867039+00:00,B2,uniform,eval,uniform_eval_030,1024,2048,3072,bf16,NVIDIA GeForce RTX 4060,c06,64,128,32,4,3,8,0.0,0.0,422.1919924020767,535.1424169540404,30.519057963868242,3,3,3,3_4_4_r0,0,
2026-03-02T09:32:42.948168+00:00,B2,uniform,eval,uniform_eval_031,1536,1024,512,bf16,NVIDIA GeForce RTX 4060,c06,64,128,32,4,3,8,0.0,81.071,77.63200253248215,91.05471983551976,20.746762719744357,3,3,2,4_3_3_r1,0,anchor_skipped
2026-03-02T09:32:43.007227+00:00,B2,uniform,eval,uniform_eval_032,512,768,768,bf16,NVIDIA GeForce RTX 4060,c06,64,128,32,4,3,8,0.0,59.015,47.93599992990494,53.790719583630555,12.599711633911413,2,3,3,3_3_3_r1,0,anchor_skipped
2026-03-02T09:32:43.090633+00:00,B2,uniform,eval,uniform_eval_033,64,512,4096,bf16,NVIDIA GeForce RTX 4060,c00,32,32,32,2,2,8,0.0,83.364,52.031999453902245,95.60960099101055,5.159045564601461,1,2,3,1_3_4_r0,0,anchor_skipped
2026-03-02T09:32:43.099231+00:00,B2,uniform,eval,uniform_eval_034,1024,256,512,bf16,NVIDIA GeForce RTX 4060,c04,64,64,64,4,3,8,0.0,0.0,50.176000222563744,137.2051140666008,5.349877527290163,3,2,2,3_2_3_r2,0,
2026-03-02T09:32:43.106704+00:00,B2,uniform,eval,uniform_eval_035,1024,768,96,bf16,NVIDIA GeForce RTX 4060,c11,32,128,32,4,2,8,0.0,0.0,62.28800117969513,120.77983818948256,2.424141747050022,3,3,1,3_3_2_r1,0,
2026-03-02T09:32:43.169669+00:00,B2,uniform,eval,uniform_eval_036,768,64,1536,bf16,NVIDIA GeForce RTX 4060,c04,64,64,64,4,3,8,0.0,62.935,44.03200000524521,76.7984011024236,3.429209301917085,3,1,3,3_1_4_r2,0,anchor_skipped
2026-03-02T09:32:43.175485+00:00,B2,uniform,eval,uniform_eval_037,512,256,512,bf16,NVIDIA GeForce RTX 4060,c04,64,64,64,4,3,8,0.0,0.0,35.840000957250595,43.53023983538151,3.7449141856913686,2,2,2,3_2_3_r2,0,
2026-03-02T09:32:43.219381+00:00,B2,uniform,eval,uniform_eval_038,64,1024,64,bf16,NVIDIA GeForce RTX 4060,c11,32,128,32,4,2,8,0.0,43.867,29.680000618100166,39.98495899140835,0.28263503454525735,1,3,1,1_3_1_r0,0,anchor_skipped
2026-03-02T09:32:43.236522+00:00,B2,uniform,eval,uniform_eval_039,512,128,2048,bf16,NVIDIA GeForce RTX 4060,c04,64,64,64,4,3,8,0.0,0.0,80.36799728870392,265.37087231874443,3.3400789500291532,2,1,3,3_2_4_r2,0,
2026-03-02T09:32:43.252428+00:00,B2,uniform,eval,uniform_eval_040,4096,768,96,bf16,NVIDIA GeForce RTX 4060,c06,64,128,32,4,3,8,0.0,0.0,65.31199812889099,207.55488261580462,9.247608300209507,3,3,1,4_3_2_r2,0,
2026-03-02T09:32:43.258449+00:00,B2,uniform,eval,uniform_eval_041,4096,192,64,bf16,NVIDIA GeForce RTX 4060,c11,32,128,32,4,2,8,0.0,0.0,38.91199827194214,78.56416072696439,2.5869474833057904,3,2,1,4_2_1_r2,0,
2026-03-02T09:32:43.307804+00:00,B2,uniform,eval,uniform_eval_042,96,1536,128,bf16,NVIDIA GeForce RTX 4060,c03,64,64,32,4,2,8,0.0,49.329,32.76799991726875,49.0783991292119,1.1520000029085202,1,3,1,2_4_2_r0,0,anchor_skipped
2026-03-02T09:32:43.315644+00:00,B2,uniform,eval,uniform_eval_043,192,2048,192,bf16,NVIDIA GeForce RTX 4060,c03,64,64,32,4,2,8,0.0,0.0,38.91199827194214,173.45311567187304,3.880421224958686,2,3,2,2_4_2_r0,0,
2026-03-02T09:32:43.393593+00:00,B2,uniform,eval,uniform_eval_044,384,4096,3072,bf16,NVIDIA GeForce RTX 4060,c06,64,128,32,4,3,8,0.0,0.0,317.3599988222122,457.42367744445795,30.450203087546875,2,3,3,3_4_4_r0,0,
2026-03-02T09:32:43.412409+00:00,B2,uniform,eval,uniform_eval_045,4096,96,768,bf16,NVIDIA GeForce RTX 4060,c01,64,32,32,2,2,8,0.0,0.0,49.056001007556915,95.31391866505145,12.312046713855842,3,1,3,4_2_3_r2,0,
2026-03-02T09:32:43.424308+00:00,B2,uniform,eval,uniform_eval_046,96,96,1536,bf16,NVIDIA GeForce RTX 4060,c04,64,64,64,4,3,8,0.0,0.0,59.39200147986412,163.86048331856728,0.47668964329478886,1,1,3,2_2_4_r1,0,
2026-03-02T09:32:43.485339+00:00,B2,uniform,eval,uniform_eval_047,2048,512,4096,bf16,NVIDIA GeForce RTX 4060,c09,128,64,64,8,3,8,0.0,0.0,312.1279925107956,373.55519205331785,27.520551818827652,3,2,3,4_3_4_r2,0,
2026-03-02T09:32:43.533794+00:00,B2,uniform,eval,uniform_eval_048,96,256,768,bf16,NVIDIA GeForce RTX 4060,c04,64,64,64,4,3,8,0.0,48.397,33.79200026392937,40.55711939930915,1.1170909003659715,1,2,3,2_2_3_r0,0,anchor_skipped
2026-03-02T09:32:43.582878+00:00,B2,uniform,eval,uniform_eval_049,64,768,384,bf16,NVIDIA GeForce RTX 4060,c04,64,64,64,4,3,8,0.0,49.05,30.719999223947525,39.43423844873905,1.2288000310421,1,3,2,1_3_3_r0,0,anchor_skipped
2026-03-02T09:32:43.593472+00:00,B2,uniform,eval,uniform_eval_050,128,1024,96,bf16,NVIDIA GeForce RTX 4060,c11,32,128,32,4,2,8,0.0,0.0,60.416001826524734,725.4880062490678,0.4165423602882527,1,3,1,2_3_2_r0,0,
2026-03-02T09:32:43.603305+00:00,B2,uniform,eval,uniform_eval_051,384,768,768,bf16,NVIDIA GeForce RTX 4060,c04,64,64,64,4,3,8,0.0,0.0,66.56000018119812,113.32607731223104,6.8056615199343,2,3,3,3_3_3_r0,0,
2026-03-02T09:32:43.620552+00:00,B2,uniform,eval,uniform_eval_052,768,64,4096,bf16,NVIDIA GeForce RTX 4060,c04,64,64,64,4,3,8,0.0,0.0,61.31199933588505,127.48480096459386,6.567281908295768,3,1,3,3_1_4_r2,0,
2026-03-02T09:32:43.628052+00:00,B2,uniform,eval,uniform_eval_053,384,96,512,bf16,NVIDIA GeForce RTX 4060,c04,64,64,64,4,3,8,0.0,0.0,56.49599991738796,195.0393660366534,0.6681665260407569,2,1,2,3_2_3_r2,0,
2026-03-02T09:32:43.636168+00:00,B2,uniform,eval,uniform_eval_054,768,192,768,bf16,NVIDIA GeForce RTX 4060,c04,64,64,64,4,3,8,0.0,0.0,48.128001391887665,92.67264205962405,4.706042417090209,3,2,3,3_2_3_r2,0,
2026-03-02T09:32:43.647465+00:00,B2,uniform,eval,uniform_eval_055,512,2048,512,bf16,NVIDIA GeForce RTX 4060,c06,64,128,32,4,3,8,0.0,0.0,69.63200122117996,172.01439768075932,15.420235023683334,2,3,2,3_4_3_r0,0,
2026-03-02T09:32:43.653375+00:00,B2,uniform,eval,uniform_eval_056,384,512,512,bf16,NVIDIA GeForce RTX 4060,c06,64,128,32,4,3,8,0.0,0.0,40.591999888420105,52.75872070342301,4.959760360499841,2,2,2,3_3_3_r1,0,
2026-03-02T09:32:43.663310+00:00,B2,uniform,eval,uniform_eval_057,2048,512,512,bf16,NVIDIA GeForce RTX 4060,c06,64,128,32,4,3,8,0.0,0.0,69.61600109934807,115.91680198907848,15.423779117500263,3,2,2,4_3_3_r2,0,
2026-03-02T09:32:43.771420+00:00,B2,uniform,eval,uniform_eval_058,1024,512,2048,bf16,NVIDIA GeForce RTX 4060,c10,64,128,64,8,3,8,0.0,108.083,101.3759970664978,106.89279802143574,21.1833541483331,3,2,3,3_3_4_r2,0,anchor_skipped
2026-03-02T09:32:43.821386+00:00,B2,uniform,eval,uniform_eval_059,2048,64,4096,bf16,NVIDIA GeForce RTX 4060,c04,64,64,64,4,3,8,0.0,0.0,80.86399734020233,165.80608367919902,13.278366879177003,3,1,3,4_1_4_r2,0,
2026-03-02T09:32:43.878919+00:00,B2,uniform,eval,uniform_eval_060,64,1536,1024,bf16,NVIDIA GeForce RTX 4060,c04,64,64,64,4,3,8,0.0,57.47,39.824001491069794,46.02303996682166,5.055408408548443,1,3,3,1_4_3_r0,0,anchor_skipped
2026-03-02T09:32:43.895100+00:00,B2,uniform,eval,uniform_eval_061,768,1024,1536,bf16,NVIDIA GeForce RTX 4060,c04,64,64,64,4,3,8,0.0,0.0,102.01600193977356,158.0236811935901,23.681766174548464,3,3,3,3_3_4_r1,0,
2026-03-02T09:32:43.942334+00:00,B2,uniform,eval,uniform_eval_062,384,2048,192,bf16,NVIDIA GeForce RTX 4060,c05,128,64,32,4,3,8,0.0,47.193,38.864001631736755,46.60224087536335,7.770427010104688,2,3,2,3_4_2_r0,0,anchor_skipped
2026-03-02T09:32:43.958844+00:00,B2,uniform,eval,uniform_eval_063,256,2048,192,bf16,NVIDIA GeForce RTX 4060,c03,64,64,32,4,2,8,0.0,0.0,71.68000191450119,203.96032184362406,2.808685639268526,2,3,2,2_4_2_r0,0,
2026-03-02T09:32:46.027458+00:00,B2,llm_style,tune,llm_style_tune_000,8,4096,1024,bf16,NVIDIA GeForce RTX 4060,c00,32,32,32,2,2,8,0.0,2067.894,39.93599861860275,129.46975685656056,1.6804103145361124,0,3,3,0_4_3_r0,0,anchor_skipped
2026-03-02T09:32:46.050061+00:00,B2,llm_style,tune,llm_style_tune_001,32,1024,2048,bf16,NVIDIA GeForce RTX 4060,c00,32,32,32,2,2,8,0.0,0.0,60.92800013720989,173.4611216187477,2.20289075134161,0,3,3,1_3_4_r0,0,
2026-03-02T09:32:46.066220+00:00,B2,llm_style,tune,llm_style_tune_002,16,2048,1024,bf16,NVIDIA GeForce RTX 4060,c00,32,32,32,2,2,8,0.0,0.0,77.7759999036789,179.86559748649594,0.8628479747365573,0,3,3,0_4_3_r0,0,
2026-03-02T09:32:48.369736+00:00,B2,llm_style,tune,llm_style_tune_003,1,1024,4096,bf16,NVIDIA GeForce RTX 4060,c00,32,32,32,2,2,8,0.0,2303.474,130.94399869441986,266.8556752800939,0.06406256173355639,0,3,3,0_3_4_r0,0,anchor_skipped
2026-03-02T09:32:48.413508+00:00,B2,llm_style,tune,llm_style_tune_004,64,2048,2048,bf16,NVIDIA GeForce RTX 4060,c04,64,64,64,4,3,8,0.0,0.0,217.0879989862442,329.5539304614064,2.4730566153222444,1,3,3,1_4_4_r0,0,
2026-03-02T09:32:49.003015+00:00,B2,llm_style,tune,llm_style_tune_005,32,8192,8192,bf16,NVIDIA GeForce RTX 4060,c04,64,64,64,4,3,8,0.0,0.0,579.4880092144012,7416.852688789368,7.411658615374267,0,3,3,1_4_4_r0,0,
2026-03-02T09:32:49.765967+00:00,B2,llm_style,tune,llm_style_tune_006,16,8192,8192,bf16,NVIDIA GeForce RTX 4060,c11,32,128,32,4,2,8,0.0,762.895,559.4080090522766,654.0268796682357,3.8388503797758786,0,3,3,0_4_4_r0,0,anchor_skipped
2026-03-02T09:32:49.813928+00:00,B2,llm_style,tune,llm_style_tune_007,2,1024,8192,bf16,NVIDIA GeForce RTX 4060,c00,32,32,32,2,2,8,0.0,0.0,95.58400139212608,176.4521627128123,0.3510465298721436,0,3,3,0_3_4_r0,0,
2026-03-02T09:32:49.905266+00:00,B2,llm_style,tune,llm_style_tune_008,16,2048,8192,bf16,NVIDIA GeForce RTX 4060,c11,32,128,32,4,2,8,0.0,0.0,203.12000066041946,243.394556492567,2.643121850405824,0,3,3,0_4_4_r0,0,
2026-03-02T09:32:49.950069+00:00,B2,llm_style,tune,llm_style_tune_009,4,4096,2048,bf16,NVIDIA GeForce RTX 4060,c11,32,128,32,4,2,8,0.0,0.0,55.296000093221664,196.5158429741859,1.2136296275836123,0,3,3,0_4_4_r0,0,
2026-03-02T09:32:50.121118+00:00,B2,llm_style,tune,llm_style_tune_010,64,8192,4096,bf16,NVIDIA GeForce RTX 4060,c04,64,64,64,4,3,8,0.0,0.0,331.4239978790283,440.668160021305,12.959131877854203,1,3,3,1_4_4_r0,0,
2026-03-02T09:32:50.163238+00:00,B2,llm_style,tune,llm_style_tune_011,16,8192,1024,bf16,NVIDIA GeForce RTX 4060,c00,32,32,32,2,2,8,0.0,0.0,81.88799768686295,137.62559793889514,3.2780805927932017,0,3,3,0_4_3_r0,0,
2026-03-02T09:32:50.205188+00:00,B2,llm_style,tune,llm_style_tune_012,2,8192,1024,bf16,NVIDIA GeForce RTX 4060,c00,32,32,32,2,2,8,0.0,0.0,58.36800113320351,196.66943952441216,0.5748771818213262,0,3,3,0_4_3_r0,0,
2026-03-02T09:32:50.289379+00:00,B2,llm_style,tune,llm_style_tune_013,16,8192,2048,bf16,NVIDIA GeForce RTX 4060,c11,32,128,32,4,2,8,0.0,0.0,189.13599848747253,290.05152627825714,2.8385443082933772,0,3,3,0_4_4_r0,0,
2026-03-02T09:32:50.375072+00:00,B2,llm_style,tune,llm_style_tune_014,8,4096,4096,bf16,NVIDIA GeForce RTX 4060,c11,32,128,32,4,2,8,0.0,0.0,186.36800348758698,270.47519117593765,1.4403516213977101,0,3,3,0_4_4_r0,0,
2026-03-02T09:32:50.385700+00:00,B2,llm_style,tune,llm_style_tune_015,64,1024,1024,bf16,NVIDIA GeForce RTX 4060,c04,64,64,64,4,3,8,0.0,0.0,59.20000001788139,150.85727721452693,2.267191350666545,1,3,3,1_3_3_r0,0,
2026-03-02T09:32:50.584286+00:00,B2,llm_style,tune,llm_style_tune_016,16,4096,8192,bf16,NVIDIA GeForce RTX 4060,c11,32,128,32,4,2,8,0.0,0.0,297.60000109672546,429.6192076802254,3.60800342756388,0,3,3,0_4_4_r0,0,
2026-03-02T09:32:50.671137+00:00,B2,llm_style,tune,llm_style_tune_017,1,4096,4096,bf16,NVIDIA GeForce RTX 4060,c11,32,128,32,4,2,8,0.0,0.0,165.23200273513794,280.2380737662313,0.203074655300201,0,3,3,0_4_4_r0,0,
2026-03-02T09:32:50.754432+00:00,B2,llm_style,tune,llm_style_tune_018,64,4096,4096,bf16,NVIDIA GeForce RTX 4060,c04,64,64,64,4,3,8,0.0,0.0,167.93599724769592,216.40032157301894,12.787512404696566,1,3,3,1_4_4_r0,0,
2026-03-02T09:32:50.839394+00:00,B2,llm_style,tune,llm_style_tune_019,64,8192,2048,bf16,NVIDIA GeForce RTX 4060,c04,64,64,64,4,3,8,0.0,0.0,169.5999950170517,228.04511696100218,12.662050183339277,1,3,3,1_4_4_r0,0,
2026-03-02T09:32:50.882290+00:00,B2,llm_style,tune,llm_style_tune_020,8,2048,4096,bf16,NVIDIA GeForce RTX 4060,c11,32,128,32,4,2,8,0.0,0.0,80.78400045633316,94.87359851598737,1.661439483583755,0,3,3,0_4_4_r0,0,
2026-03-02T09:32:50.893650+00:00,B2,llm_style,tune,llm_style_tune_021,8,1024,2048,bf16,NVIDIA GeForce RTX 4060,c00,32,32,32,2,2,8,0.0,0.0,48.128001391887665,73.86271942406887,0.6971914691985496,0,3,3,0_3_4_r0,0,
2026-03-02T09:32:50.934956+00:00,B2,llm_style,tune,llm_style_tune_022,8,8192,1024,bf16,NVIDIA GeForce RTX 4060,c00,32,32,32,2,2,8,0.0,0.0,54.30399999022484,164.64928284287444,2.471599293314678,0,3,3,0_4_3_r0,0,
2026-03-02T09:32:51.102533+00:00,B2,llm_style,tune,llm_style_tune_023,1,4096,8192,bf16,NVIDIA GeForce RTX 4060,c11,32,128,32,4,2,8,0.0,0.0,319.487988948822,362.75840282440174,0.21005128931701406,0,3,3,0_4_4_r0,0,
2026-03-02T09:32:51.260294+00:00,B2,llm_style,tune,llm_style_tune_024,2,8192,4096,bf16,NVIDIA GeForce RTX 4060,c11,32,128,32,4,2,8,0.0,0.0,293.18399727344513,327.72096663713455,0.45779349912750733,0,3,3,0_4_4_r0,0,
2026-03-02T09:32:51.343006+00:00,B2,llm_style,tune,llm_style_tune_025,2,4096,4096,bf16,NVIDIA GeForce RTX 4060,c11,32,128,32,4,2,8,0.0,0.0,164.7839993238449,169.48224142193794,0.40725352143027566,0,3,3,0_4_4_r0,0,
2026-03-02T09:32:51.357386+00:00,B2,llm_style,tune,llm_style_tune_026,4,2048,1024,bf16,NVIDIA GeForce RTX 4060,c00,32,32,32,2,2,8,0.0,0.0,36.17599979043007,46.02687999606132,0.46376647769768653,0,3,3,0_4_3_r0,0,
2026-03-02T09:32:51.404436+00:00,B2,llm_style,tune,llm_style_tune_027,64,2048,4096,bf16,NVIDIA GeForce RTX 4060,c04,64,64,64,4,3,8,0.0,0.0,78.84799689054489,129.78176273405538,13.617870666905405,1,3,3,1_4_4_r0,0,
2026-03-02T09:32:51.425991+00:00,B2,llm_style,tune,llm_style_tune_028,32,1024,4096,bf16,NVIDIA GeForce RTX 4060,c00,32,32,32,2,2,8,0.0,0.0,65.87199866771698,136.38432390987856,4.075107199253038,0,3,3,1_3_4_r0,0,
2026-03-02T09:32:51.438046+00:00,B2,llm_style,tune,llm_style_tune_029,32,2048,1024,bf16,NVIDIA GeForce RTX 4060,c04,64,64,64,4,3,8,0.0,0.0,35.51999852061272,131.6044759005307,3.7786524096309213,0,3,3,1_4_3_r0,0,
2026-03-02T09:32:51.458393+00:00,B2,llm_style,tune,llm_style_tune_030,4,2048,2048,bf16,NVIDIA GeForce RTX 4060,c11,32,128,32,4,2,8,0.0,0.0,88.06400001049042,175.23903995752335,0.381023255768565,0,3,3,0_4_4_r0,0,
2026-03-02T09:32:51.808065+00:00,B2,llm_style,tune,llm_style_tune_031,1,8192,8192,bf16,NVIDIA GeForce RTX 4060,c11,32,128,32,4,2,8,0.0,0.0,911.8399918079376,1063.4335792064667,0.1471943863022302,0,3,3,0_4_4_r0,0,
2026-03-02T09:32:51.831182+00:00,B2,llm_style,eval,llm_style_eval_000,2,1024,4096,bf16,NVIDIA GeForce RTX 4060,c00,32,32,32,2,2,8,0.0,0.0,75.26399940252304,192.5734381377697,0.22291156639541512,0,3,3,0_3_4_r0,0,
2026-03-02T09:32:52.172012+00:00,B2,llm_style,eval,llm_style_eval_001,2,8192,8192,bf16,NVIDIA GeForce RTX 4060,c11,32,128,32,4,2,8,0.0,0.0,906.2399864196777,967.1769481897354,0.29620791404329866,0,3,3,0_4_4_r0,0,
2026-03-02T09:32:52.192933+00:00,B2,llm_style,eval,llm_style_eval_002,2,2048,2048,bf16,NVIDIA GeForce RTX 4060,c11,32,128,32,4,2,8,0.0,0.0,77.18400284647942,128.08480136096463,0.21736649281289844,0,3,3,0_4_4_r0,0,
2026-03-02T09:32:52.242806+00:00,B2,llm_style,eval,llm_style_eval_003,8,1024,8192,bf16,NVIDIA GeForce RTX 4060,c00,32,32,32,2,2,8,0.0,0.0,161.79199516773224,256.4799928665159,0.8295696450300549,0,3,3,0_3_4_r0,0,
2026-03-02T09:32:52.337697+00:00,B2,llm_style,eval,llm_style_eval_004,64,2048,8192,bf16,NVIDIA GeForce RTX 4060,c04,64,64,64,4,3,8,0.0,0.0,273.4079957008362,355.77855348587025,7.854501996166135,1,3,3,1_4_4_r0,0,
2026-03-02T09:32:52.704582+00:00,B2,llm_style,eval,llm_style_eval_005,1,8192,8192,bf16,NVIDIA GeForce RTX 4060,c11,32,128,32,4,2,8,0.0,0.0,907.2159826755524,1023.7413942813873,0.147944624613167,0,3,3,0_4_4_r0,0,
2026-03-02T09:32:52.758911+00:00,B2,llm_style,eval,llm_style_eval_006,1,1024,8192,bf16,NVIDIA GeForce RTX 4060,c00,32,32,32,2,2,8,0.0,0.0,172.97600209712982,859.7606247663473,0.09699158147139524,0,3,3,0_3_4_r0,0,
2026-03-02T09:32:52.932402+00:00,B2,llm_style,eval,llm_style_eval_007,2,8192,4096,bf16,NVIDIA GeForce RTX 4060,c11,32,128,32,4,2,8,0.0,0.0,498.6880123615265,527.5443118810654,0.2691416771067241,0,3,3,0_4_4_r0,0,
2026-03-02T09:32:52.987677+00:00,B2,llm_style,eval,llm_style_eval_008,16,2048,4096,bf16,NVIDIA GeForce RTX 4060,c11,32,128,32,4,2,8,0.0,0.0,148.99200201034546,346.9414269924163,1.8016769516350337,0,3,3,0_4_4_r0,0,
2026-03-02T09:32:53.082726+00:00,B2,llm_style,eval,llm_style_eval_009,32,2048,8192,bf16,NVIDIA GeForce RTX 4060,c04,64,64,64,4,3,8,0.0,0.0,309.2480003833771,373.20927917957306,3.472105955960505,0,3,3,1_4_4_r0,0,
2026-03-02T09:32:53.157428+00:00,B2,llm_style,eval,llm_style_eval_010,1,1024,1024,bf16,NVIDIA GeForce RTX 4060,c04,64,64,64,4,3,8,0.0,74.599,51.663998514413834,179.88608494400975,0.040592134954767614,0,3,3,0_3_3_r0,0,anchor_skipped
2026-03-02T09:32:53.255637+00:00,B2,llm_style,eval,llm_style_eval_011,16,2048,8192,bf16,NVIDIA GeForce RTX 4060,c11,32,128,32,4,2,8,0.0,0.0,334.84798669815063,436.7872026562691,1.6033272808176187,0,3,3,0_4_4_r0,0,
2026-03-02T09:32:53.595040+00:00,B2,llm_style,eval,llm_style_eval_012,8,8192,8192,bf16,NVIDIA GeForce RTX 4060,c11,32,128,32,4,2,8,0.0,0.0,912.3839735984802,1017.4972468614577,1.1768530082407276,0,3,3,0_4_4_r0,0,
2026-03-02T09:32:53.779937+00:00,B2,llm_style,eval,llm_style_eval_013,32,4096,8192,bf16,NVIDIA GeForce RTX 4060,c04,64,64,64,4,3,8,0.0,0.0,510.97601652145386,615.2908831834793,4.202709282950927,0,3,3,1_4_4_r0,0,
2026-03-02T09:32:53.792363+00:00,B2,llm_style,eval,llm_style_eval_014,64,1024,1024,bf16,NVIDIA GeForce RTX 4060,c04,64,64,64,4,3,8,0.0,0.0,56.32000043988228,134.28736031055428,2.3831272541140724,1,3,3,1_3_3_r0,0,
2026-03-02T09:32:53.805631+00:00,B2,llm_style,eval,llm_style_eval_015,16,2048,1024,bf16,NVIDIA GeForce RTX 4060,c00,32,32,32,2,2,8,0.0,0.0,50.175998359918594,154.347516298294,1.337469431472392,0,3,3,0_4_3_r0,0,
2026-03-02T09:32:53.856547+00:00,B2,llm_style,eval,llm_style_eval_016,2,1024,8192,bf16,NVIDIA GeForce RTX 4060,c00,32,32,32,2,2,8,0.0,0.0,199.68000054359436,297.6665604114532,0.16804102518356293,0,3,3,0_3_4_r0,0,
2026-03-02T09:32:54.198295+00:00,B2,llm_style,eval,llm_style_eval_017,4,8192,8192,bf16,NVIDIA GeForce RTX 4060,c11,32,128,32,4,2,8,0.0,0.0,909.824013710022,951.2022441625595,0.5900821520535408,0,3,3,0_4_4_r0,0,
2026-03-02T09:32:54.227275+00:00,B2,llm_style,eval,llm_style_eval_018,4,1024,4096,bf16,NVIDIA GeForce RTX 4060,c00,32,32,32,2,2,8,0.0,0.0,123.90399724245071,188.53888422250748,0.27080992338239046,0,3,3,0_3_4_r0,0,
2026-03-02T09:32:54.274063+00:00,B2,llm_style,eval,llm_style_eval_019,8,4096,2048,bf16,NVIDIA GeForce RTX 4060,c11,32,128,32,4,2,8,0.0,0.0,118.78400295972824,199.24319967627522,1.1299310063283885,0,3,3,0_4_4_r0,0,
2026-03-02T09:32:54.323121+00:00,B2,llm_style,eval,llm_style_eval_020,64,4096,2048,bf16,NVIDIA GeForce RTX 4060,c04,64,64,64,4,3,8,0.0,0.0,145.79199999570847,226.908158659935,7.364888498899848,1,3,3,1_4_4_r0,0,
2026-03-02T09:32:54.495365+00:00,B2,llm_style,eval,llm_style_eval_021,1,4096,8192,bf16,NVIDIA GeForce RTX 4060,c11,32,128,32,4,2,8,0.0,0.0,500.7359981536865,604.7267156839371,0.13402045039191063,0,3,3,0_4_4_r0,0,
2026-03-02T09:32:54.521960+00:00,B2,llm_style,eval,llm_style_eval_022,32,1024,4096,bf16,NVIDIA GeForce RTX 4060,c00,32,32,32,2,2,8,0.0,0.0,137.56800442934036,146.47295743227005,1.951292795977699,0,3,3,1_3_4_r0,0,
2026-03-02T09:32:54.532007+00:00,B2,llm_style,eval,llm_style_eval_023,4,1024,1024,bf16,NVIDIA GeForce RTX 4060,c04,64,64,64,4,3,8,0.0,0.0,61.904000118374825,159.44480285048485,0.1355099506325768,0,3,3,0_3_3_r0,0,
2026-03-02T09:32:54.558390+00:00,B2,llm_style,eval,llm_style_eval_024,64,2048,2048,bf16,NVIDIA GeForce RTX 4060,c04,64,64,64,4,3,8,0.0,0.0,119.80800330638885,321.8742436170574,4.481093893427493,1,3,3,1_4_4_r0,0,
2026-03-02T09:32:54.976242+00:00,B2,llm_style,eval,llm_style_eval_025,32,8192,8192,bf16,NVIDIA GeForce RTX 4060,c04,64,64,64,4,3,8,0.0,0.0,1221.119999885559,1298.9161550998688,3.5172360590298384,0,3,3,1_4_4_r0,0,
2026-03-02T09:32:55.030223+00:00,B2,llm_style,eval,llm_style_eval_026,4,2048,4096,bf16,NVIDIA GeForce RTX 4060,c11,32,128,32,4,2,8,0.0,0.0,208.8959962129593,221.1683166027069,0.3212549077847609,0,3,3,0_4_4_r0,0,
2026-03-02T09:32:55.118678+00:00,B2,llm_style,eval,llm_style_eval_027,8,8192,2048,bf16,NVIDIA GeForce RTX 4060,c11,32,128,32,4,2,8,0.0,0.0,255.96800446510315,439.5520031452178,1.0487070700924128,0,3,3,0_4_4_r0,0,
2026-03-02T09:32:55.295074+00:00,B2,llm_style,eval,llm_style_eval_028,8,4096,8192,bf16,NVIDIA GeForce RTX 4060,c11,32,128,32,4,2,8,0.0,0.0,496.63999676704407,669.886714220047,1.0810061926039896,0,3,3,0_4_4_r0,0,
2026-03-02T09:32:55.321161+00:00,B2,llm_style,eval,llm_style_eval_029,8,2048,2048,bf16,NVIDIA GeForce RTX 4060,c11,32,128,32,4,2,8,0.0,0.0,125.32799690961838,285.766067802906,0.5354658628143261,0,3,3,0_4_4_r0,0,
2026-03-02T09:32:55.371203+00:00,B2,llm_style,eval,llm_style_eval_030,1,4096,2048,bf16,NVIDIA GeForce RTX 4060,c11,32,128,32,4,2,8,0.0,0.0,139.26400244235992,257.47935369610775,0.12047058612252605,0,3,3,0_4_4_r0,0,
2026-03-02T09:32:55.458834+00:00,B2,llm_style,eval,llm_style_eval_031,16,8192,2048,bf16,NVIDIA GeForce RTX 4060,c11,32,128,32,4,2,8,0.0,0.0,256.8800002336502,307.13664293289173,2.089967734006846,0,3,3,0_4_4_r0,0,
2026-03-02T09:32:55.481284+00:00,B2,llm_style,eval,llm_style_eval_032,1,2048,2048,bf16,NVIDIA GeForce RTX 4060,c11,32,128,32,4,2,8,0.0,0.0,126.94399803876877,160.23552194237698,0.06608117067053548,0,3,3,0_4_4_r0,0,
2026-03-02T09:32:55.653504+00:00,B2,llm_style,eval,llm_style_eval_033,16,8192,4096,bf16,NVIDIA GeForce RTX 4060,c11,32,128,32,4,2,8,0.0,0.0,478.2080054283142,574.9555128812789,2.245344728259593,0,3,3,0_4_4_r0,0,
2026-03-02T09:32:55.679029+00:00,B2,llm_style,eval,llm_style_eval_034,16,1024,4096,bf16,NVIDIA GeForce RTX 4060,c00,32,32,32,2,2,8,0.0,0.0,154.62400019168854,162.81600296497345,0.8680264889901262,0,3,3,0_3_4_r0,0,
2026-03-02T09:32:55.769458+00:00,B2,llm_style,eval,llm_style_eval_035,4,8192,2048,bf16,NVIDIA GeForce RTX 4060,c11,32,128,32,4,2,8,0.0,0.0,253.9519965648651,298.49569410085667,0.5285161361813422,0,3,3,0_4_4_r0,0,
2026-03-02T09:32:55.822772+00:00,B2,llm_style,eval,llm_style_eval_036,2,2048,4096,bf16,NVIDIA GeForce RTX 4060,c11,32,128,32,4,2,8,0.0,0.0,241.66400730609894,416.06143474578823,0.13884745342941757,0,3,3,0_4_4_r0,0,
2026-03-02T09:32:55.834435+00:00,B2,llm_style,eval,llm_style_eval_037,2,1024,1024,bf16,NVIDIA GeForce RTX 4060,c04,64,64,64,4,3,8,0.0,0.0,62.24000081419945,152.96511948108667,0.0673892022032736,0,3,3,0_3_3_r0,0,
2026-03-02T09:32:56.034269+00:00,B2,llm_style,eval,llm_style_eval_038,64,4096,8192,bf16,NVIDIA GeForce RTX 4060,c04,64,64,64,4,3,8,0.0,0.0,799.1999983787537,911.1615908145903,5.374083214104996,1,3,3,1_4_4_r0,0,
2026-03-02T09:32:56.053279+00:00,B2,llm_style,eval,llm_style_eval_039,4,1024,2048,bf16,NVIDIA GeForce RTX 4060,c00,32,32,32,2,2,8,0.0,0.0,100.35199671983719,131.67615607380867,0.167183678934049,0,3,3,0_3_4_r0,0,
2026-03-02T09:32:56.104512+00:00,B2,llm_style,eval,llm_style_eval_040,64,8192,1024,bf16,NVIDIA GeForce RTX 4060,c04,64,64,64,4,3,8,0.0,0.0,228.2399982213974,291.02079421281815,4.704441957445376,1,3,3,1_4_3_r0,0,
2026-03-02T09:32:56.118285+00:00,B2,llm_style,eval,llm_style_eval_041,2,2048,1024,bf16,NVIDIA GeForce RTX 4060,c00,32,32,32,2,2,8,0.0,0.0,69.12000104784966,164.88448336720447,0.12136296112311724,0,3,3,0_4_3_r0,0,
2026-03-02T09:32:56.165186+00:00,B2,llm_style,eval,llm_style_eval_042,2,4096,2048,bf16,NVIDIA GeForce RTX 4060,c11,32,128,32,4,2,8,0.0,0.0,158.720001578331,190.37184089422217,0.21140644951065177,0,3,3,0_4_4_r0,0,
2026-03-02T09:32:56.181062+00:00,B2,llm_style,eval,llm_style_eval_043,1,2048,1024,bf16,NVIDIA GeForce RTX 4060,c00,32,32,32,2,2,8,0.0,0.0,66.56000018119812,86.03999875485894,0.0630153844438361,0,3,3,0_4_3_r0,0,
2026-03-02T09:32:56.288271+00:00,B2,llm_style,eval,llm_style_eval_044,8,2048,8192,bf16,NVIDIA GeForce RTX 4060,c11,32,128,32,4,2,8,0.0,0.0,538.6239886283875,628.4799855947495,0.4983726340959565,0,3,3,0_4_4_r0,0,
2026-03-02T09:32:56.334034+00:00,B2,llm_style,eval,llm_style_eval_045,1,8192,1024,bf16,NVIDIA GeForce RTX 4060,c00,32,32,32,2,2,8,0.0,0.0,120.83200365304947,256.9113536179065,0.13884745342941757,0,3,3,0_4_3_r0,0,
2026-03-02T09:32:56.358537+00:00,B2,llm_style,eval,llm_style_eval_046,64,4096,1024,bf16,NVIDIA GeForce RTX 4060,c04,64,64,64,4,3,8,0.0,0.0,149.50400590896606,226.91744148731226,3.5910135566996386,1,3,3,1_4_3_r0,0,
2026-03-02T09:32:56.383657+00:00,B2,llm_style,eval,llm_style_eval_047,16,2048,2048,bf16,NVIDIA GeForce RTX 4060,c11,32,128,32,4,2,8,0.0,0.0,148.47999811172485,198.3593595027923,0.9039448390820082,0,3,3,0_4_4_r0,0,
2026-03-02T09:32:56.556452+00:00,B2,llm_style,eval,llm_style_eval_048,8,8192,4096,bf16,NVIDIA GeForce RTX 4060,c11,32,128,32,4,2,8,0.0,0.0,481.27999901771545,579.4713509082791,1.1155063852554536,0,3,3,0_4_4_r0,0,
2026-03-02T09:32:56.750283+00:00,B2,llm_style,eval,llm_style_eval_049,4,4096,8192,bf16,NVIDIA GeForce RTX 4060,c11,32,128,32,4,2,8,0.0,0.0,589.5520150661469,677.3558491468428,0.4553210728486476,0,3,3,0_4_4_r0,0,
2026-03-02T09:32:56.858071+00:00,B2,llm_style,eval,llm_style_eval_050,4,2048,8192,bf16,NVIDIA GeForce RTX 4060,c11,32,128,32,4,2,8,0.0,0.0,579.0079832077026,628.643825650215,0.23180635136744432,0,3,3,0_4_4_r0,0,
2026-03-02T09:32:56.868655+00:00,B2,llm_style,eval,llm_style_eval_051,16,1024,1024,bf16,NVIDIA GeForce RTX 4060,c04,64,64,64,4,3,8,0.0,0.0,73.72800260782242,103.92800055444238,0.45511109501344243,0,3,3,0_3_3_r0,0,
2026-03-02T09:32:57.068055+00:00,B2,llm_style,eval,llm_style_eval_052,32,8192,4096,bf16,NVIDIA GeForce RTX 4060,c04,64,64,64,4,3,8,0.0,0.0,918.0160164833069,1009.3260973691938,2.339265992576557,0,3,3,1_4_4_r0,0,
2026-03-02T09:32:57.087965+00:00,B2,llm_style,eval,llm_style_eval_053,32,1024,2048,bf16,NVIDIA GeForce RTX 4060,c00,32,32,32,2,2,8,0.0,0.0,152.44799852371216,258.7136018276214,0.8804164652848718,0,3,3,1_3_4_r0,0,
2026-03-02T09:32:57.192854+00:00,B2,llm_style,eval,llm_style_eval_054,64,8192,2048,bf16,NVIDIA GeForce RTX 4060,c04,64,64,64,4,3,8,0.0,0.0,484.3039959669113,499.6480044722557,4.4341646277614455,1,3,3,1_4_4_r0,0,
2026-03-02T09:32:57.218172+00:00,B2,llm_style,eval,llm_style_eval_055,1,4096,1024,bf16,NVIDIA GeForce RTX 4060,c00,32,32,32,2,2,8,0.0,0.0,95.07200121879578,168.397124260664,0.08823426342625014,0,3,3,0_4_3_r0,0,
2026-03-02T09:32:57.245673+00:00,B2,llm_style,eval,llm_style_eval_056,4,2048,2048,bf16,NVIDIA GeForce RTX 4060,c11,32,128,32,4,2,8,0.0,0.0,160.25599837303162,241.38400569558138,0.2093801938189831,0,3,3,0_4_4_r0,0,
2026-03-02T09:32:57.304215+00:00,B2,llm_style,eval,llm_style_eval_057,16,1024,8192,bf16,NVIDIA GeForce RTX 4060,c00,32,32,32,2,2,8,0.0,0.0,350.5920022726059,370.87712258100504,0.7656633758327313,0,3,3,0_3_4_r0,0,
2026-03-02T09:32:57.478894+00:00,B2,llm_style,eval,llm_style_eval_058,1,8192,4096,bf16,NVIDIA GeForce RTX 4060,c11,32,128,32,4,2,8,0.0,0.0,526.3040065765381,546.856951713562,0.12750969622390793,0,3,3,0_4_4_r0,0,
2026-03-02T09:32:57.500443+00:00,B2,llm_style,eval,llm_style_eval_059,8,4096,1024,bf16,NVIDIA GeForce RTX 4060,c00,32,32,32,2,2,8,0.0,0.0,89.56800028681755,178.33984076976773,0.7492504441887932,0,3,3,0_4_3_r0,0,
2026-03-02T09:32:57.675938+00:00,B2,llm_style,eval,llm_style_eval_060,4,8192,4096,bf16,NVIDIA GeForce RTX 4060,c11,32,128,32,4,2,8,0.0,0.0,561.1359775066376,623.4624058008194,0.4783786225805219,0,3,3,0_4_4_r0,0,
2026-03-02T09:32:57.704095+00:00,B2,llm_style,eval,llm_style_eval_061,32,2048,2048,bf16,NVIDIA GeForce RTX 4060,c04,64,64,64,4,3,8,0.0,0.0,188.4160041809082,219.545601606369,1.4246956205602412,0,3,3,1_4_4_r0,0,
2026-03-02T09:32:57.717652+00:00,B2,llm_style,eval,llm_style_eval_062,8,2048,1024,bf16,NVIDIA GeForce RTX 4060,c00,32,32,32,2,2,8,0.0,0.0,75.23200288414955,160.78847482800484,0.4460127434287609,0,3,3,0_4_3_r0,0,
2026-03-02T09:32:57.901875+00:00,B2,llm_style,eval,llm_style_eval_063,16,4096,8192,bf16,NVIDIA GeForce RTX 4060,c11,32,128,32,4,2,8,0.0,0.0,696.287989616394,716.7225706577301,1.5420944207174343,0,3,3,0_4_4_r0,0,
2026-03-02T09:32:58.137234+00:00,B2,training_style,tune,training_style_tune_000,4096,2048,1024,bf16,NVIDIA GeForce RTX 4060,c09,128,64,64,8,3,8,0.0,0.0,3507.64799118042,3613.143012523651,4.8978316031702205,3,3,3,4_4_3_r2,0,
2026-03-02T09:32:58.187461+00:00,B2,training_style,tune,training_style_tune_001,1536,2048,1536,bf16,NVIDIA GeForce RTX 4060,c06,64,128,32,4,3,8,0.0,0.0,356.3520014286041,402.07712113857264,27.1183447188696,3,3,3,4_4_4_r1,0,
2026-03-02T09:32:58.382574+00:00,B2,training_style,tune,training_style_tune_002,3072,2048,4096,bf16,NVIDIA GeForce RTX 4060,c06,64,128,32,4,3,8,0.0,0.0,1734.4639897346497,1832.608666419983,29.71500582141512,3,3,3,4_4_4_r1,0,
2026-03-02T09:32:58.441784+00:00,B2,training_style,tune,training_style_tune_003,2048,1536,2048,bf16,NVIDIA GeForce RTX 4060,c06,64,128,32,4,3,8,0.0,0.0,424.8479902744293,508.8262325525284,30.32826371539862,3,3,3,4_4_4_r1,0,
2026-03-02T09:32:58.453320+00:00,B2,training_style,tune,training_style_tune_004,512,512,1024,bf16,NVIDIA GeForce RTX 4060,c06,64,128,32,4,3,8,0.0,0.0,32.495999708771706,123.75872060656539,16.521138503551914,2,2,3,3_3_3_r1,0,
2026-03-02T09:32:58.622316+00:00,B2,training_style,tune,training_style_tune_005,1024,1536,1536,bf16,NVIDIA GeForce RTX 4060,c06,64,128,32,4,3,8,0.0,168.95,174.0799993276596,204.05696034431446,27.756423636614,3,3,3,3_4_4_r1,0,anchor_skipped
2026-03-02T09:32:58.709250+00:00,B2,training_style,tune,training_style_tune_006,1024,1536,512,bf16,NVIDIA GeForce RTX 4060,c06,64,128,32,4,3,8,0.0,86.89,77.66400277614594,93.30559752881523,20.73821433904628,3,3,2,3_4_3_r1,0,anchor_skipped
2026-03-02T09:32:58.725055+00:00,B2,training_style,tune,training_style_tune_007,2048,1536,512,bf16,NVIDIA GeForce RTX 4060,c06,64,128,32,4,3,8,0.0,0.0,126.97599828243256,211.93664446473122,25.368774536704425,3,3,2,4_4_3_r1,0,
2026-03-02T09:32:58.809096+00:00,B2,training_style,tune,training_style_tune_008,3072,3072,1536,bf16,NVIDIA GeForce RTX 4060,c06,64,128,32,4,3,8,0.0,0.0,875.5199909210205,1025.0227010250092,33.11292665916436,3,3,3,4_4_4_r1,0,
2026-03-02T09:32:58.834383+00:00,B2,training_style,tune,training_style_tune_009,1024,1536,1024,bf16,NVIDIA GeForce RTX 4060,c06,64,128,32,4,3,8,0.0,0.0,156.67200088500977,237.0576031506061,20.56031360934897,3,3,3,3_4_3_r1,0,
2026-03-02T09:32:58.933228+00:00,B2,training_style,tune,training_style_tune_010,1536,2048,4096,bf16,NVIDIA GeForce RTX 4060,c06,64,128,32,4,3,8,0.0,0.0,787.8399789333344,913.526085615158,32.70943905498428,3,3,3,4_4_4_r1,0,
2026-03-02T09:32:58.995765+00:00,B2,training_style,tune,training_style_tune_011,1024,1024,4096,bf16,NVIDIA GeForce RTX 4060,c04,64,64,64,4,3,8,0.0,0.0,319.43999230861664,396.53376758098597,26.890604804739386,3,3,3,3_3_4_r1,0,
2026-03-02T09:32:59.321403+00:00,B2,training_style,tune,training_style_tune_012,3072,4096,4096,bf16,NVIDIA GeForce RTX 4060,c06,64,128,32,4,3,8,0.0,0.0,3190.0320053100586,3287.995264530182,32.312909379096055,3,3,3,4_4_4_r1,0,
2026-03-02T09:32:59.478021+00:00,B2,training_style,tune,training_style_tune_013,512,1024,3072,bf16,NVIDIA GeForce RTX 4060,c06,64,128,32,4,3,8,0.0,156.541,138.22399824857712,177.94047683477396,23.304386451092686,2,3,3,3_3_4_r0,0,anchor_skipped
2026-03-02T09:32:59.502350+00:00,B2,training_style,tune,training_style_tune_014,1536,1024,1024,bf16,NVIDIA GeForce RTX 4060,c06,64,128,32,4,3,8,0.0,0.0,127.72800028324127,183.29824507236478,25.219415201497092,3,3,3,4_3_3_r1,0,
2026-03-02T09:32:59.567391+00:00,B2,training_style,tune,training_style_tune_015,2048,3072,1536,bf16,NVIDIA GeForce RTX 4060,c06,64,128,32,4,3,8,0.0,0.0,593.8239991664886,740.2393609285353,32.54727471292592,3,3,3,4_4_4_r1,0,
2026-03-02T09:33:00.412566+00:00,B2,training_style,tune,training_style_tune_016,1536,3072,3072,bf16,NVIDIA GeForce RTX 4060,c09,128,64,64,8,3,8,0.0,845.114,884.7360014915466,924.2112040519714,32.767999944757534,3,3,3,4_4_4_r0,0,anchor_skipped
2026-03-02T09:33:00.445703+00:00,B2,training_style,tune,training_style_tune_017,1024,1024,2048,bf16,NVIDIA GeForce RTX 4060,c04,64,64,64,4,3,8,0.0,0.0,170.49600183963776,331.6223964095113,25.191014743206047,3,3,3,3_3_4_r1,0,
2026-03-02T09:33:00.477513+00:00,B2,training_style,tune,training_style_tune_018,1536,1536,1536,bf16,NVIDIA GeForce RTX 4060,c06,64,128,32,4,3,8,0.0,0.0,239.18399959802628,286.21824383735657,30.302015704146655,3,3,3,4_4_4_r1,0,
2026-03-02T09:33:00.518322+00:00,B2,training_style,tune,training_style_tune_019,1536,1536,2048,bf16,NVIDIA GeForce RTX 4060,c06,64,128,32,4,3,8,0.0,0.0,288.1599962711334,436.3964816927909,33.53580143340689,3,3,3,4_4_4_r1,0,
2026-03-02T09:33:00.541169+00:00,B2,training_style,tune,training_style_tune_020,1536,1536,1024,bf16,NVIDIA GeForce RTX 4060,c06,64,128,32,4,3,8,0.0,0.0,172.54400253295898,317.3952016234398,28.003512942022034,3,3,3,4_4_3_r1,0,
2026-03-02T09:33:00.571258+00:00,B2,training_style,tune,training_style_tune_021,1024,2048,1536,bf16,NVIDIA GeForce RTX 4060,c06,64,128,32,4,3,8,0.0,0.0,232.96000063419342,304.06880110502243,27.654751573066356,3,3,3,3_4_4_r0,0,
2026-03-02T09:33:00.586089+00:00,B2,training_style,tune,training_style_tune_022,512,1024,1536,bf16,NVIDIA GeForce RTX 4060,c06,64,128,32,4,3,8,0.0,0.0,80.89599758386612,164.8844762146473,19.90967148072132,2,3,3,3_3_4_r0,0,
2026-03-02T09:33:00.633012+00:00,B2,training_style,tune,training_style_tune_023,1536,2048,2048,bf16,NVIDIA GeForce RTX 4060,c06,64,128,32,4,3,8,0.0,0.0,415.74400663375854,462.4556750059127,30.99239359414434,3,3,3,4_4_4_r1,0,
2026-03-02T09:33:00.650129+00:00,B2,training_style,tune,training_style_tune_024,1024,1024,1024,bf16,NVIDIA GeForce RTX 4060,c06,64,128,32,4,3,8,0.0,0.0,98.75200316309929,168.65599960088724,21.746228726653833,3,3,3,3_3_3_r1,0,
2026-03-02T09:33:01.041289+00:00,B2,training_style,tune,training_style_tune_025,1536,1024,4096,bf16,NVIDIA GeForce RTX 4060,c06,64,128,32,4,3,8,0.0,391.116,411.6320013999939,434.3193578720093,31.301992663780762,3,3,3,4_3_4_r1,0,anchor_skipped
2026-03-02T09:33:01.316833+00:00,B2,training_style,tune,training_style_tune_026,2048,4096,512,bf16,NVIDIA GeForce RTX 4060,c06,64,128,32,4,3,8,0.0,275.495,296.9119995832443,395.8675268292426,28.93091085593415,3,3,2,4_4_3_r0,0,anchor_skipped
2026-03-02T09:33:01.463376+00:00,B2,training_style,tune,training_style_tune_027,4096,4096,1536,bf16,NVIDIA GeForce RTX 4060,c06,64,128,32,4,3,8,0.0,0.0,1606.0799956321716,1665.669106245041,32.09031162343406,3,3,3,4_4_4_r1,0,
2026-03-02T09:33:01.548276+00:00,B2,training_style,tune,training_style_tune_028,1536,1536,4096,bf16,NVIDIA GeForce RTX 4060,c06,64,128,32,4,3,8,0.0,0.0,577.5359869003296,744.4582426548003,33.46519224841912,3,3,3,4_4_4_r1,0,
2026-03-02T09:33:02.529505+00:00,B2,training_style,tune,training_style_tune_029,4096,2048,2048,bf16,NVIDIA GeForce RTX 4060,c03,64,64,32,4,2,8,0.0,981.163,1047.439992427826,1053.194272518158,32.80353873863334,3,3,3,4_4_4_r2,0,anchor_skipped
2026-03-02T09:33:02.557398+00:00,B2,training_style,tune,training_style_tune_030,2048,2048,512,bf16,NVIDIA GeForce RTX 4060,c06,64,128,32,4,3,8,0.0,0.0,161.47200018167496,249.91904526948926,26.598836276058126,3,3,2,4_4_3_r1,0,
2026-03-02T09:33:02.572788+00:00,B2,training_style,tune,training_style_tune_031,512,512,1536,bf16,NVIDIA GeForce RTX 4060,c04,64,64,64,4,3,8,0.0,0.0,85.39199829101562,139.7929576039313,9.43070058221988,2,2,3,3_3_4_r1,0,
2026-03-02T09:33:02.646949+00:00,B2,training_style,eval,training_style_eval_000,2048,1536,3072,bf16,NVIDIA GeForce RTX 4060,c06,64,128,32,4,3,8,0.0,0.0,595.2959954738617,732.3033624887466,32.46679463485258,3,3,3,4_4_4_r1,0,
2026-03-02T09:33:02.684570+00:00,B2,training_style,eval,training_style_eval_001,1024,2048,2048,bf16,NVIDIA GeForce RTX 4060,c06,64,128,32,4,3,8,0.0,0.0,288.5279953479767,310.9091204404831,29.77158102679147,3,3,3,3_4_4_r0,0,
2026-03-02T09:33:02.731445+00:00,B2,training_style,eval,training_style_eval_002,1536,1024,3072,bf16,NVIDIA GeForce RTX 4060,c06,64,128,32,4,3,8,0.0,0.0,290.8160090446472,375.2736032009125,33.22952009329168,3,3,3,4_3_4_r1,0,
2026-03-02T09:33:02.807933+00:00,B2,training_style,eval,training_style_eval_003,1024,512,1024,bf16,NVIDIA GeForce RTX 4060,c10,64,128,64,8,3,8,0.0,76.43,65.5359998345375,71.91359989345074,16.384000041365624,3,2,3,3_3_3_r2,0,anchor_skipped
2026-03-02T09:33:02.832224+00:00,B2,training_style,eval,training_style_eval_004,1024,2048,1024,bf16,NVIDIA GeForce RTX 4060,c06,64,128,32,4,3,8,0.0,0.0,163.83999586105347,206.4691190421581,26.214400662231462,3,3,3,3_4_3_r0,0,
2026-03-02T09:33:02.855946+00:00,B2,training_style,eval,training_style_eval_005,1024,512,1536,bf16,NVIDIA GeForce RTX 4060,c10,64,128,64,8,3,8,0.0,0.0,112.12800070643425,211.99264079332352,14.364054704023436,3,2,3,3_3_4_r2,0,
2026-03-02T09:33:02.909419+00:00,B2,training_style,eval,training_style_eval_006,2048,1536,2048,bf16,NVIDIA GeForce RTX 4060,c06,64,128,32,4,3,8,0.0,0.0,406.8639874458313,473.8332930207251,31.668818783612444,3,3,3,4_4_4_r1,0,
2026-03-02T09:33:02.936720+00:00,B2,training_style,eval,training_style_eval_007,1536,2048,1024,bf16,NVIDIA GeForce RTX 4060,c06,64,128,32,4,3,8,0.0,0.0,228.03200036287308,268.2982449233531,28.252398495596953,3,3,3,4_4_3_r1,0,
2026-03-02T09:33:02.949455+00:00,B2,training_style,eval,training_style_eval_008,512,512,2048,bf16,NVIDIA GeForce RTX 4060,c04,64,64,64,4,3,8,0.0,0.0,67.52000004053116,99.10431854426852,15.902574398036883,2,2,3,3_3_4_r1,0,
2026-03-02T09:33:02.967834+00:00,B2,training_style,eval,training_style_eval_009,1024,512,2048,bf16,NVIDIA GeForce RTX 4060,c10,64,128,64,8,3,8,0.0,0.0,120.75200304389,215.36960035562515,17.784248657303426,3,2,3,3_3_4_r2,0,
2026-03-02T09:33:03.011706+00:00,B2,training_style,eval,training_style_eval_010,2048,3072,1024,bf16,NVIDIA GeForce RTX 4060,c06,64,128,32,4,3,8,0.0,0.0,414.5919978618622,498.72735649347294,31.078510811714022,3,3,3,4_4_3_r1,0,
2026-03-02T09:33:03.100458+00:00,B2,training_style,eval,training_style_eval_011,2048,4096,1536,bf16,NVIDIA GeForce RTX 4060,c09,128,64,64,8,3,8,0.0,0.0,809.984028339386,847.5340950489044,31.815199898240913,3,3,3,4_4_4_r0,0,
2026-03-02T09:33:03.230022+00:00,B2,training_style,eval,training_style_eval_012,2048,3072,3072,bf16,NVIDIA GeForce RTX 4060,c06,64,128,32,4,3,8,0.0,0.0,1179.0560483932495,1293.8341975212097,32.78445135553686,3,3,3,4_4_4_r1,0,
2026-03-02T09:33:03.291195+00:00,B2,training_style,eval,training_style_eval_013,3072,1536,1536,bf16,NVIDIA GeForce RTX 4060,c03,64,64,32,4,2,8,0.0,0.0,460.28800308704376,559.8352140188215,31.49227120146947,3,3,3,4_4_4_r2,0,
2026-03-02T09:33:03.338153+00:00,B2,training_style,eval,training_style_eval_014,2048,1536,1536,bf16,NVIDIA GeForce RTX 4060,c06,64,128,32,4,3,8,0.0,0.0,291.83998703956604,360.26623785495747,33.112927786314124,3,3,3,4_4_4_r1,0,
2026-03-02T09:33:03.391818+00:00,B2,training_style,eval,training_style_eval_015,4096,2048,1024,bf16,NVIDIA GeForce RTX 4060,c09,128,64,64,8,3,8,0.0,0.0,528.2719731330872,561.5017622709274,32.52087950475443,3,3,3,4_4_3_r2,0,
2026-03-02T09:33:03.405141+00:00,B2,training_style,eval,training_style_eval_016,2048,1024,512,bf16,NVIDIA GeForce RTX 4060,c06,64,128,32,4,3,8,0.0,0.0,100.3200002014637,126.47424176335335,21.406336161158297,3,3,2,4_3_3_r2,0,
2026-03-02T09:33:03.522390+00:00,B2,training_style,eval,training_style_eval_017,2048,4096,2048,bf16,NVIDIA GeForce RTX 4060,c09,128,64,64,8,3,8,0.0,0.0,1061.3759756088257,1110.7977712154388,32.37282467062682,3,3,3,4_4_4_r0,0,
2026-03-02T09:33:03.593306+00:00,B2,training_style,eval,training_style_eval_018,1536,2048,3072,bf16,NVIDIA GeForce RTX 4060,c06,64,128,32,4,3,8,0.0,0.0,597.9680120944977,674.4780802726743,32.321716949878706,3,3,3,4_4_4_r1,0,
2026-03-02T09:33:03.664490+00:00,B2,training_style,eval,training_style_eval_019,1536,1536,3072,bf16,NVIDIA GeForce RTX 4060,c06,64,128,32,4,3,8,0.0,0.0,457.72799849510193,553.4633558988569,31.668402788681746,3,3,3,4_4_4_r1,0,
2026-03-02T09:33:03.736472+00:00,B2,training_style,eval,training_style_eval_020,3072,1536,2048,bf16,NVIDIA GeForce RTX 4060,c03,64,64,32,4,2,8,0.0,0.0,581.6320180892944,724.6902465820312,33.22952009329168,3,3,3,4_4_4_r2,0,
2026-03-02T09:33:03.830052+00:00,B2,training_style,eval,training_style_eval_021,2048,1024,4096,bf16,NVIDIA GeForce RTX 4060,c09,128,64,64,8,3,8,0.0,0.0,559.1040253639221,798.1609565019604,30.727500437539476,3,3,3,4_3_4_r2,0,
2026-03-02T09:33:03.845661+00:00,B2,training_style,eval,training_style_eval_022,512,512,1536,bf16,NVIDIA GeForce RTX 4060,c04,64,64,64,4,3,8,0.0,0.0,52.99200117588043,104.22592118382447,15.196753285975904,2,2,3,3_3_4_r1,0,
2026-03-02T09:33:04.184421+00:00,B2,training_style,eval,training_style_eval_023,3072,4096,4096,bf16,NVIDIA GeForce RTX 4060,c06,64,128,32,4,3,8,0.0,0.0,3262.3679637908936,3367.473204135895,31.59644045309385,3,3,3,4_4_4_r1,0,
2026-03-02T09:33:04.257955+00:00,B2,training_style,eval,training_style_eval_024,1536,1024,4096,bf16,NVIDIA GeForce RTX 4060,c06,64,128,32,4,3,8,0.0,0.0,416.2079989910126,598.8460987806319,30.957842999740695,3,3,3,4_3_4_r1,0,
2026-03-02T09:33:04.412726+00:00,B2,training_style,eval,training_style_eval_025,4096,3072,2048,bf16,NVIDIA GeForce RTX 4060,c06,64,128,32,4,3,8,0.0,0.0,1547.2639799118042,1612.1571350097656,33.31015794404897,3,3,3,4_4_4_r1,0,
2026-03-02T09:33:04.427537+00:00,B2,training_style,eval,training_style_eval_026,1024,512,512,bf16,NVIDIA GeForce RTX 4060,c10,64,128,64,8,3,8,0.0,0.0,47.040000557899475,258.20160076022097,11.413071973483273,3,2,2,3_3_3_r2,0,
2026-03-02T09:33:04.484149+00:00,B2,training_style,eval,training_style_eval_027,2048,4096,1024,bf16,NVIDIA GeForce RTX 4060,c06,64,128,32,4,3,8,0.0,0.0,518.0480182170868,610.9846550226209,33.16269646803439,3,3,3,4_4_3_r0,0,
2026-03-02T09:33:04.508864+00:00,B2,training_style,eval,training_style_eval_028,1536,1536,1024,bf16,NVIDIA GeForce RTX 4060,c06,64,128,32,4,3,8,0.0,0.0,168.272003531456,260.1347139477729,28.714451047091494,3,3,3,4_4_3_r1,0,
2026-03-02T09:33:04.540180+00:00,B2,training_style,eval,training_style_eval_029,1024,512,4096,bf16,NVIDIA GeForce RTX 4060,c10,64,128,64,8,3,8,0.0,0.0,174.47999864816666,184.9651192128658,24.61581458778358,3,2,3,3_3_4_r2,0,
2026-03-02T09:33:04.574962+00:00,B2,training_style,eval,training_style_eval_030,1024,1024,3072,bf16,NVIDIA GeForce RTX 4060,c04,64,64,64,4,3,8,0.0,0.0,222.71999716758728,239.13472265005112,28.92623485062426,3,3,3,3_3_4_r1,0,
2026-03-02T09:33:04.585572+00:00,B2,training_style,eval,training_style_eval_031,1024,1024,512,bf16,NVIDIA GeForce RTX 4060,c06,64,128,32,4,3,8,0.0,0.0,71.68000191450119,143.21887910366058,14.979656742765474,3,3,2,3_3_3_r1,0,
2026-03-02T09:33:04.596777+00:00,B2,training_style,eval,training_style_eval_032,512,1024,1024,bf16,NVIDIA GeForce RTX 4060,c04,64,64,64,4,3,8,0.0,0.0,68.60800087451935,113.7561611086129,15.650387860212119,2,3,3,3_3_3_r0,0,
2026-03-02T09:33:04.680046+00:00,B2,training_style,eval,training_style_eval_033,3072,2048,2048,bf16,NVIDIA GeForce RTX 4060,c06,64,128,32,4,3,8,0.0,0.0,790.5279994010925,845.0937467813492,32.59821764127686,3,3,3,4_4_4_r1,0,
2026-03-02T09:33:04.697652+00:00,B2,training_style,eval,training_style_eval_034,1536,1024,512,bf16,NVIDIA GeForce RTX 4060,c06,64,128,32,4,3,8,0.0,0.0,84.99199897050858,141.20288237929336,18.950168904238474,3,3,2,4_3_3_r1,0,
2026-03-02T09:33:05.107832+00:00,B2,training_style,eval,training_style_eval_035,4096,4096,4096,bf16,NVIDIA GeForce RTX 4060,c06,64,128,32,4,3,8,0.0,0.0,4307.503938674927,4438.618807792664,31.906866581828112,3,3,3,4_4_4_r1,0,
2026-03-02T09:33:05.344700+00:00,B2,training_style,eval,training_style_eval_036,2048,4096,4096,bf16,NVIDIA GeForce RTX 4060,c09,128,64,64,8,3,8,0.0,0.0,2106.8800687789917,2228.4696793556213,32.61670075782968,3,3,3,4_4_4_r0,0,
2026-03-02T09:33:05.386522+00:00,B2,training_style,eval,training_style_eval_037,4096,2048,512,bf16,NVIDIA GeForce RTX 4060,c09,128,64,64,8,3,8,0.0,0.0,290.22400081157684,318.4844759106636,29.59760243115411,3,3,2,4_4_3_r2,0,
2026-03-02T09:33:05.404457+00:00,B2,training_style,eval,training_style_eval_038,2048,1536,512,bf16,NVIDIA GeForce RTX 4060,c06,64,128,32,4,3,8,0.0,0.0,126.96000188589096,199.88095909357062,25.37197088965997,3,3,2,4_4_3_r1,0,
2026-03-02T09:33:05.496787+00:00,B2,training_style,eval,training_style_eval_039,3072,3072,1536,bf16,NVIDIA GeForce RTX 4060,c06,64,128,32,4,3,8,0.0,0.0,857.088029384613,1071.6339010000227,33.82503109839894,3,3,3,4_4_4_r1,0,
2026-03-02T09:33:05.510423+00:00,B2,training_style,eval,training_style_eval_040,1536,1536,512,bf16,NVIDIA GeForce RTX 4060,c06,64,128,32,4,3,8,0.0,0.0,101.3759970664978,157.42848038673384,23.831273416874733,3,3,2,4_4_3_r1,0,
2026-03-02T09:33:05.625322+00:00,B2,training_style,eval,training_style_eval_041,3072,3072,2048,bf16,NVIDIA GeForce RTX 4060,c06,64,128,32,4,3,8,0.0,0.0,1183.743953704834,1360.9881472587585,32.6546171940478,3,3,3,4_4_4_r1,0,
2026-03-02T09:33:05.744077+00:00,B2,training_style,eval,training_style_eval_042,3072,4096,1536,bf16,NVIDIA GeForce RTX 4060,c06,64,128,32,4,3,8,0.0,0.0,1154.047966003418,1169.991706609726,33.494886523534255,3,3,3,4_4_4_r1,0,
2026-03-02T09:33:05.807917+00:00,B2,training_style,eval,training_style_eval_043,2048,3072,1536,bf16,NVIDIA GeForce RTX 4060,c06,64,128,32,4,3,8,0.0,0.0,602.512001991272,814.8160141706464,32.07795490898781,3,3,3,4_4_4_r1,0,
2026-03-02T09:33:05.831957+00:00,B2,training_style,eval,training_style_eval_044,512,512,4096,bf16,NVIDIA GeForce RTX 4060,c04,64,64,64,4,3,8,0.0,0.0,104.8160009086132,177.66624003648758,20.488128047094115,2,2,3,3_3_4_r1,0,
2026-03-02T09:33:05.890239+00:00,B2,training_style,eval,training_style_eval_045,2048,1024,3072,bf16,NVIDIA GeForce RTX 4060,c09,128,64,64,8,3,8,0.0,0.0,433.0720007419586,554.6326410770416,29.75233186612157,3,3,3,4_3_4_r2,0,
2026-03-02T09:33:06.223952+00:00,B2,training_style,eval,training_style_eval_046,4096,3072,4096,bf16,NVIDIA GeForce RTX 4060,c06,64,128,32,4,3,8,0.0,0.0,3213.2160663604736,3246.0188126564026,32.079764626832315,3,3,3,4_4_4_r1,0,
2026-03-02T09:33:06.270861+00:00,B2,training_style,eval,training_style_eval_047,1536,3072,1024,bf16,NVIDIA GeForce RTX 4060,c06,64,128,32,4,3,8,0.0,0.0,320.41600346565247,632.6313614845272,30.159780758378734,3,3,3,4_4_3_r0,0,
2026-03-02T09:33:06.289511+00:00,B2,training_style,eval,training_style_eval_048,512,512,3072,bf16,NVIDIA GeForce RTX 4060,c04,64,64,64,4,3,8,0.0,0.0,90.43199941515923,204.59744170308107,17.810208183122523,2,2,3,3_3_4_r1,0,
2026-03-02T09:33:06.324036+00:00,B2,training_style,eval,training_style_eval_049,512,1024,4096,bf16,NVIDIA GeForce RTX 4060,c06,64,128,32,4,3,8,0.0,0.0,175.61600357294083,273.8569623231888,24.456582592805198,2,3,3,3_3_4_r0,0,
2026-03-02T09:33:06.347974+00:00,B2,training_style,eval,training_style_eval_050,3072,2048,512,bf16,NVIDIA GeForce RTX 4060,c06,64,128,32,4,3,8,0.0,0.0,223.23200106620789,250.7263915240764,28.859889770415343,3,3,2,4_4_3_r1,0,
2026-03-02T09:33:06.356690+00:00,B2,training_style,eval,training_style_eval_051,512,512,1024,bf16,NVIDIA GeForce RTX 4060,c06,64,128,32,4,3,8,0.0,0.0,56.23999983072281,109.01184216141698,9.546068876527947,2,2,3,3_3_3_r1,0,
2026-03-02T09:33:06.392822+00:00,B2,training_style,eval,training_style_eval_052,1536,2048,1536,bf16,NVIDIA GeForce RTX 4060,c06,64,128,32,4,3,8,0.0,0.0,311.0720068216324,326.70111507177353,31.06572177528375,3,3,3,4_4_4_r1,0,
2026-03-02T09:33:06.491736+00:00,B2,training_style,eval,training_style_eval_053,1536,3072,3072,bf16,NVIDIA GeForce RTX 4060,c09,128,64,64,8,3,8,0.0,0.0,892.2080099582672,1025.8172678947449,32.49357652522762,3,3,3,4_4_4_r0,0,
2026-03-02T09:33:06.535583+00:00,B2,training_style,eval,training_style_eval_054,4096,3072,512,bf16,NVIDIA GeForce RTX 4060,c06,64,128,32,4,3,8,0.0,0.0,415.74400663375854,442.9177713394165,30.99239359414434,3,3,2,4_4_3_r1,0,
2026-03-02T09:33:06.552639+00:00,B2,training_style,eval,training_style_eval_055,1024,1024,1024,bf16,NVIDIA GeForce RTX 4060,c06,64,128,32,4,3,8,0.0,0.0,99.2639996111393,192.84991979598996,21.63406326979204,3,3,3,3_3_3_r1,0,
2026-03-02T09:33:06.575634+00:00,B2,training_style,eval,training_style_eval_056,512,1024,3072,bf16,NVIDIA GeForce RTX 4060,c06,64,128,32,4,3,8,0.0,0.0,134.14399325847626,149.00224208831787,24.01319204649857,2,3,3,3_3_4_r0,0,
2026-03-02T09:33:06.592538+00:00,B2,training_style,eval,training_style_eval_057,1024,1536,1024,bf16,NVIDIA GeForce RTX 4060,c06,64,128,32,4,3,8,0.0,0.0,120.83200365304947,141.393923163414,26.658711058448173,3,3,3,3_4_3_r1,0,
2026-03-02T09:33:06.709149+00:00,B2,training_style,eval,training_style_eval_058,4096,2048,2048,bf16,NVIDIA GeForce RTX 4060,c03,64,64,32,4,2,8,0.0,0.0,1109.7760200500488,1182.7081680297852,30.96096667005874,3,3,3,4_4_4_r2,0,
2026-03-02T09:33:06.745467+00:00,B2,training_style,eval,training_style_eval_059,2048,3072,512,bf16,NVIDIA GeForce RTX 4060,c06,64,128,32,4,3,8,0.0,0.0,239.96800184249878,325.1712018251419,26.847125010560596,3,3,2,4_4_3_r1,0,
2026-03-02T09:33:06.776471+00:00,B2,training_style,eval,training_style_eval_060,3072,3072,512,bf16,NVIDIA GeForce RTX 4060,c06,64,128,32,4,3,8,0.0,0.0,321.53600454330444,428.7795194983482,30.054725689976337,3,3,2,4_4_3_r1,0,
2026-03-02T09:33:06.835834+00:00,B2,training_style,eval,training_style_eval_061,2048,2048,2048,bf16,NVIDIA GeForce RTX 4060,c06,64,128,32,4,3,8,0.0,0.0,546.6559827327728,594.7420787811278,31.427204177143715,3,3,3,4_4_4_r1,0,
2026-03-02T09:33:06.853265+00:00,B2,training_style,eval,training_style_eval_062,1024,2048,512,bf16,NVIDIA GeForce RTX 4060,c06,64,128,32,4,3,8,0.0,0.0,99.98400136828423,209.66399997472757,21.478272709749742,3,3,2,3_4_3_r0,0,
2026-03-02T09:33:06.968139+00:00,B2,training_style,eval,training_style_eval_063,3072,1536,3072,bf16,NVIDIA GeForce RTX 4060,c03,64,64,32,4,2,8,0.0,0.0,907.6640009880066,1014.8044586181641,31.94026557893979,3,3,3,4_4_4_r2,0,
2026-03-02T09:33:06.985154+00:00,B2,adversarial,tune,adversarial_tune_000,1,1024,1024,bf16,NVIDIA GeForce RTX 4060,c04,64,64,64,4,3,8,0.0,0.0,39.93599861860275,213.75776514410967,0.052512822329253514,0,3,3,0_3_3_r0,0,
2026-03-02T09:33:07.007240+00:00,B2,adversarial,tune,adversarial_tune_001,1,1024,4096,bf16,NVIDIA GeForce RTX 4060,c00,32,32,32,2,2,8,0.0,0.0,61.43999844789505,173.0764789879322,0.13653333678245552,0,3,3,0_3_4_r0,0,
2026-03-02T09:33:07.028190+00:00,B2,adversarial,tune,adversarial_tune_002,1,4096,1024,bf16,NVIDIA GeForce RTX 4060,c00,32,32,32,2,2,8,0.0,0.0,40.94399884343147,53.80287982523441,0.2048800370495751,0,3,3,0_4_3_r0,0,
2026-03-02T09:33:07.118855+00:00,B2,adversarial,tune,adversarial_tune_003,1,4096,4096,bf16,NVIDIA GeForce RTX 4060,c11,32,128,32,4,2,8,0.0,0.0,160.76800227165222,273.625293970108,0.2087133728470579,0,3,3,0_4_4_r0,0,
2026-03-02T09:33:07.159473+00:00,B2,adversarial,tune,adversarial_tune_004,1,8192,1024,bf16,NVIDIA GeForce RTX 4060,c00,32,32,32,2,2,8,0.0,0.0,48.46399836242199,111.1823970079421,0.34617894864012533,0,3,3,0_4_3_r0,0,
2026-03-02T09:33:07.331333+00:00,B2,adversarial,tune,adversarial_tune_005,1,8192,4096,bf16,NVIDIA GeForce RTX 4060,c11,32,128,32,4,2,8,0.0,0.0,294.9120104312897,323.70304465293884,0.22755554750672122,0,3,3,0_4_4_r0,0,
2026-03-02T09:33:07.340317+00:00,B2,adversarial,tune,adversarial_tune_006,2,1024,1024,bf16,NVIDIA GeForce RTX 4060,c04,64,64,64,4,3,8,0.0,0.0,38.39999996125698,121.25696308910847,0.10922666677686903,0,3,3,0_3_3_r0,0,
2026-03-02T09:33:07.359549+00:00,B2,adversarial,tune,adversarial_tune_007,2,1024,4096,bf16,NVIDIA GeForce RTX 4060,c00,32,32,32,2,2,8,0.0,0.0,62.463998794555664,113.39776083827005,0.2685901691177398,0,3,3,0_3_4_r0,0,
2026-03-02T09:33:07.376173+00:00,B2,adversarial,tune,adversarial_tune_008,2,4096,1024,bf16,NVIDIA GeForce RTX 4060,c00,32,32,32,2,2,8,0.0,0.0,37.376001477241516,111.73888057470319,0.4488766945874548,0,3,3,0_4_3_r0,0,
2026-03-02T09:33:07.464116+00:00,B2,adversarial,tune,adversarial_tune_009,2,4096,4096,bf16,NVIDIA GeForce RTX 4060,c11,32,128,32,4,2,8,0.0,0.0,164.63999450206757,214.6713580191134,0.4076097317845649,0,3,3,0_4_4_r0,0,
2026-03-02T09:33:07.506031+00:00,B2,adversarial,tune,adversarial_tune_010,2,8192,1024,bf16,NVIDIA GeForce RTX 4060,c00,32,32,32,2,2,8,0.0,0.0,54.25599962472916,230.6902404129503,0.618446480243382,0,3,3,0_4_3_r0,0,
2026-03-02T09:33:07.667279+00:00,B2,adversarial,tune,adversarial_tune_011,2,8192,4096,bf16,NVIDIA GeForce RTX 4060,c11,32,128,32,4,2,8,0.0,0.0,292.86399483680725,328.4688061475753,0.4582937143734251,0,3,3,0_4_4_r0,0,
2026-03-02T09:33:07.675547+00:00,B2,adversarial,tune,adversarial_tune_012,4,1024,1024,bf16,NVIDIA GeForce RTX 4060,c04,64,64,64,4,3,8,0.0,0.0,45.05600035190582,160.69248132407634,0.1861818167276619,0,3,3,0_3_3_r0,0,
2026-03-02T09:33:07.695982+00:00,B2,adversarial,tune,adversarial_tune_013,4,1024,4096,bf16,NVIDIA GeForce RTX 4060,c00,32,32,32,2,2,8,0.0,0.0,69.45599988102913,148.1795242428779,0.4831034332163561,0,3,3,0_3_4_r0,0,
2026-03-02T09:33:07.714665+00:00,B2,adversarial,tune,adversarial_tune_014,4,4096,1024,bf16,NVIDIA GeForce RTX 4060,c00,32,32,32,2,2,8,0.0,0.0,53.21599915623665,144.4044841825962,0.6305327820959947,0,3,3,0_4_3_r0,0,
2026-03-02T09:33:07.800599+00:00,B2,adversarial,tune,adversarial_tune_015,4,4096,4096,bf16,NVIDIA GeForce RTX 4060,c11,32,128,32,4,2,8,0.0,0.0,161.79199516773224,267.7513647079465,0.8295696450300549,0,3,3,0_4_4_r0,0,
2026-03-02T09:33:07.841729+00:00,B2,adversarial,tune,adversarial_tune_016,4,8192,1024,bf16,NVIDIA GeForce RTX 4060,c00,32,32,32,2,2,8,0.0,0.0,48.128001391887665,105.612160861492,1.3943829383970991,0,3,3,0_4_3_r0,0,
2026-03-02T09:33:08.004663+00:00,B2,adversarial,tune,adversarial_tune_017,4,8192,4096,bf16,NVIDIA GeForce RTX 4060,c11,32,128,32,4,2,8,0.0,0.0,319.18399035930634,407.9772800207135,0.8410053890792625,0,3,3,0_4_4_r0,0,
2026-03-02T09:33:08.015621+00:00,B2,adversarial,tune,adversarial_tune_018,8,1024,1024,bf16,NVIDIA GeForce RTX 4060,c04,64,64,64,4,3,8,0.0,0.0,61.20000034570694,160.47104582190508,0.2741375147913196,0,3,3,0_3_3_r0,0,
2026-03-02T09:33:08.036879+00:00,B2,adversarial,tune,adversarial_tune_019,8,1024,4096,bf16,NVIDIA GeForce RTX 4060,c00,32,32,32,2,2,8,0.0,0.0,66.04800000786781,192.38720342516896,1.01606201538284,0,3,3,0_3_4_r0,0,
2026-03-02T09:33:08.056202+00:00,B2,adversarial,tune,adversarial_tune_020,8,4096,1024,bf16,NVIDIA GeForce RTX 4060,c00,32,32,32,2,2,8,0.0,0.0,64.19199705123901,114.2272014170885,1.045439728981055,0,3,3,0_4_3_r0,0,
2026-03-02T09:33:08.145271+00:00,B2,adversarial,tune,adversarial_tune_021,8,4096,4096,bf16,NVIDIA GeForce RTX 4060,c11,32,128,32,4,2,8,0.0,0.0,161.79199516773224,168.47872108221054,1.6591392900601099,0,3,3,0_4_4_r0,0,
2026-03-02T09:33:08.188341+00:00,B2,adversarial,tune,adversarial_tune_022,8,8192,1024,bf16,NVIDIA GeForce RTX 4060,c00,32,32,32,2,2,8,0.0,0.0,53.23199927806854,148.52703765034644,2.521373042911379,0,3,3,0_4_3_r0,0,
2026-03-02T09:33:08.351064+00:00,B2,adversarial,tune,adversarial_tune_023,8,8192,4096,bf16,NVIDIA GeForce RTX 4060,c11,32,128,32,4,2,8,0.0,0.0,318.4640109539032,422.95136034488667,1.6858134468378299,0,3,3,0_4_4_r0,0,
2026-03-02T09:33:08.361683+00:00,B2,adversarial,tune,adversarial_tune_024,16,1024,1024,bf16,NVIDIA GeForce RTX 4060,c04,64,64,64,4,3,8,0.0,0.0,59.39200147986412,126.19296178221698,0.5649655031641942,0,3,3,0_3_3_r0,0,
2026-03-02T09:33:08.380557+00:00,B2,adversarial,tune,adversarial_tune_025,16,1024,4096,bf16,NVIDIA GeForce RTX 4060,c00,32,32,32,2,2,8,0.0,0.0,57.312000542879105,122.04032026231286,2.3418782581072586,0,3,3,0_3_4_r0,0,
2026-03-02T09:33:08.396790+00:00,B2,adversarial,tune,adversarial_tune_026,16,4096,1024,bf16,NVIDIA GeForce RTX 4060,c00,32,32,32,2,2,8,0.0,0.0,42.41599887609482,94.67904210090629,3.1643184542718292,0,3,3,0_4_3_r0,0,
2026-03-02T09:33:08.484168+00:00,B2,adversarial,tune,adversarial_tune_027,16,4096,4096,bf16,NVIDIA GeForce RTX 4060,c11,32,128,32,4,2,8,0.0,0.0,168.91200095415115,272.1504005789757,3.1784059685950097,0,3,3,0_4_4_r0,0,
2026-03-02T09:33:08.524444+00:00,B2,adversarial,tune,adversarial_tune_028,16,8192,1024,bf16,NVIDIA GeForce RTX 4060,c00,32,32,32,2,2,8,0.0,0.0,56.32000043988228,97.81247936189163,4.766254508228145,0,3,3,0_4_3_r0,0,
2026-03-02T09:33:08.691732+00:00,B2,adversarial,tune,adversarial_tune_029,16,8192,4096,bf16,NVIDIA GeForce RTX 4060,c11,32,128,32,4,2,8,0.0,0.0,297.36000299453735,381.2083140015601,3.6109154331012205,0,3,3,0_4_4_r0,0,
2026-03-02T09:33:08.699894+00:00,B2,adversarial,tune,adversarial_tune_030,32,1024,1024,bf16,NVIDIA GeForce RTX 4060,c04,64,64,64,4,3,8,0.0,0.0,43.96799951791763,112.05247793346624,1.526311516007275,0,3,3,1_3_3_r0,0,
2026-03-02T09:33:08.718064+00:00,B2,adversarial,tune,adversarial_tune_031,32,1024,4096,bf16,NVIDIA GeForce RTX 4060,c00,32,32,32,2,2,8,0.0,0.0,63.29599767923355,145.4102402180432,4.240954654990288,0,3,3,1_3_4_r0,0,
2026-03-02T09:33:08.726182+00:00,B2,adversarial,eval,adversarial_eval_000,1,1024,1024,bf16,NVIDIA GeForce RTX 4060,c04,64,64,64,4,3,8,0.0,0.0,30.719999223947525,50.649280063807964,0.06826666839122776,0,3,3,0_3_3_r0,0,
2026-03-02T09:33:08.742480+00:00,B2,adversarial,eval,adversarial_eval_001,1,1024,4096,bf16,NVIDIA GeForce RTX 4060,c00,32,32,32,2,2,8,0.0,0.0,58.36800113320351,132.11648002266884,0.14371929545533155,0,3,3,0_3_4_r0,0,
2026-03-02T09:33:08.758535+00:00,B2,adversarial,eval,adversarial_eval_002,1,4096,1024,bf16,NVIDIA GeForce RTX 4060,c00,32,32,32,2,2,8,0.0,0.0,41.98399931192398,124.267841130495,0.19980488132338384,0,3,3,0_4_3_r0,0,
2026-03-02T09:33:08.845842+00:00,B2,adversarial,eval,adversarial_eval_003,1,4096,4096,bf16,NVIDIA GeForce RTX 4060,c11,32,128,32,4,2,8,0.0,0.0,165.8879965543747,222.55423605442027,0.2022716091396133,0,3,3,0_4_4_r0,0,
2026-03-02T09:33:08.895502+00:00,B2,adversarial,eval,adversarial_eval_004,1,8192,1024,bf16,NVIDIA GeForce RTX 4060,c00,32,32,32,2,2,8,0.0,0.0,109.53599959611893,290.433594584465,0.15316622901932644,0,3,3,0_4_3_r0,0,
2026-03-02T09:33:09.060186+00:00,B2,adversarial,eval,adversarial_eval_005,1,8192,4096,bf16,NVIDIA GeForce RTX 4060,c11,32,128,32,4,2,8,0.0,0.0,321.29599153995514,377.82752752304066,0.2088692849180927,0,3,3,0_4_4_r0,0,
2026-03-02T09:33:09.071233+00:00,B2,adversarial,eval,adversarial_eval_006,2,1024,1024,bf16,NVIDIA GeForce RTX 4060,c04,64,64,64,4,3,8,0.0,0.0,67.58400052785873,142.23583862185478,0.06206060557588731,0,3,3,0_3_3_r0,0,
2026-03-02T09:33:09.092426+00:00,B2,adversarial,eval,adversarial_eval_007,2,1024,4096,bf16,NVIDIA GeForce RTX 4060,c00,32,32,32,2,2,8,0.0,0.0,110.31999811530113,124.04736094176766,0.15207774008902053,0,3,3,0_3_4_r0,0,
2026-03-02T09:33:09.111827+00:00,B2,adversarial,eval,adversarial_eval_008,2,4096,1024,bf16,NVIDIA GeForce RTX 4060,c00,32,32,32,2,2,8,0.0,0.0,73.72800260782242,132.88448013365263,0.22755554750672122,0,3,3,0_4_3_r0,0,
2026-03-02T09:33:09.208823+00:00,B2,adversarial,eval,adversarial_eval_009,2,4096,4096,bf16,NVIDIA GeForce RTX 4060,c11,32,128,32,4,2,8,0.0,0.0,252.78399884700775,339.84575420618035,0.26547908216538757,0,3,3,0_4_4_r0,0,
2026-03-02T09:33:09.249629+00:00,B2,adversarial,eval,adversarial_eval_010,2,8192,1024,bf16,NVIDIA GeForce RTX 4060,c00,32,32,32,2,2,8,0.0,0.0,69.63200122117996,111.03167615830888,0.4818823444901042,0,3,3,0_4_3_r0,0,
2026-03-02T09:33:09.425006+00:00,B2,adversarial,eval,adversarial_eval_011,2,8192,4096,bf16,NVIDIA GeForce RTX 4060,c11,32,128,32,4,2,8,0.0,0.0,472.06398844718933,501.78048610687256,0.2843210481729326,0,3,3,0_4_4_r0,0,
2026-03-02T09:33:09.434860+00:00,B2,adversarial,eval,adversarial_eval_012,4,1024,1024,bf16,NVIDIA GeForce RTX 4060,c04,64,64,64,4,3,8,0.0,0.0,48.128001391887665,134.45120446383947,0.1742978672996374,0,3,3,0_3_3_r0,0,
2026-03-02T09:33:09.455740+00:00,B2,adversarial,eval,adversarial_eval_013,4,1024,4096,bf16,NVIDIA GeForce RTX 4060,c00,32,32,32,2,2,8,0.0,0.0,78.11199873685837,156.76640421152112,0.4295682166966087,0,3,3,0_3_4_r0,0,
2026-03-02T09:33:09.472983+00:00,B2,adversarial,eval,adversarial_eval_014,4,4096,1024,bf16,NVIDIA GeForce RTX 4060,c00,32,32,32,2,2,8,0.0,0.0,53.247999399900436,142.33599603176117,0.6301538532556162,0,3,3,0_4_3_r0,0,
2026-03-02T09:33:09.562886+00:00,B2,adversarial,eval,adversarial_eval_015,4,4096,4096,bf16,NVIDIA GeForce RTX 4060,c11,32,128,32,4,2,8,0.0,0.0,257.02399015426636,324.13152545690536,0.5221992231909646,0,3,3,0_4_4_r0,0,
2026-03-02T09:33:09.606031+00:00,B2,adversarial,eval,adversarial_eval_016,4,8192,1024,bf16,NVIDIA GeForce RTX 4060,c00,32,32,32,2,2,8,0.0,0.0,74.73600283265114,116.8521615862845,0.8979455878884794,0,3,3,0_4_3_r0,0,
2026-03-02T09:33:09.783659+00:00,B2,adversarial,eval,adversarial_eval_017,4,8192,4096,bf16,NVIDIA GeForce RTX 4060,c11,32,128,32,4,2,8,0.0,0.0,467.9679870605469,558.5395264625549,0.5736192718782475,0,3,3,0_4_4_r0,0,
2026-03-02T09:33:09.793434+00:00,B2,adversarial,eval,adversarial_eval_018,8,1024,1024,bf16,NVIDIA GeForce RTX 4060,c04,64,64,64,4,3,8,0.0,0.0,47.10400104522705,84.2364775389432,0.3561739051400603,0,3,3,0_3_3_r0,0,
2026-03-02T09:33:09.814028+00:00,B2,adversarial,eval,adversarial_eval_019,8,1024,4096,bf16,NVIDIA GeForce RTX 4060,c00,32,32,32,2,2,8,0.0,0.0,95.74400261044502,144.92896385490883,0.7009197669857901,0,3,3,0_3_4_r0,0,
2026-03-02T09:33:09.830551+00:00,B2,adversarial,eval,adversarial_eval_020,8,4096,1024,bf16,NVIDIA GeForce RTX 4060,c00,32,32,32,2,2,8,0.0,0.0,58.320000767707825,101.60128079354757,1.1507006707235612,0,3,3,0_4_3_r0,0,
2026-03-02T09:33:09.920108+00:00,B2,adversarial,eval,adversarial_eval_021,8,4096,4096,bf16,NVIDIA GeForce RTX 4060,c11,32,128,32,4,2,8,0.0,0.0,254.97600436210632,313.5488015413284,1.0527871305833905,0,3,3,0_4_4_r0,0,
2026-03-02T09:33:09.965470+00:00,B2,adversarial,eval,adversarial_eval_022,8,8192,1024,bf16,NVIDIA GeForce RTX 4060,c00,32,32,32,2,2,8,0.0,0.0,84.36799794435501,183.097913712263,1.5908606494197413,0,3,3,0_4_3_r0,0,
2026-03-02T09:33:10.138376+00:00,B2,adversarial,eval,adversarial_eval_023,8,8192,4096,bf16,NVIDIA GeForce RTX 4060,c11,32,128,32,4,2,8,0.0,0.0,471.5360105037689,588.699848651886,1.1385576075651784,0,3,3,0_4_4_r0,0,
2026-03-02T09:33:10.147773+00:00,B2,adversarial,eval,adversarial_eval_024,16,1024,1024,bf16,NVIDIA GeForce RTX 4060,c04,64,64,64,4,3,8,0.0,0.0,47.47200012207031,95.9590388834476,0.7068257480981961,0,3,3,0_3_3_r0,0,
2026-03-02T09:33:10.171419+00:00,B2,adversarial,eval,adversarial_eval_025,16,1024,4096,bf16,NVIDIA GeForce RTX 4060,c00,32,32,32,2,2,8,0.0,0.0,109.56799983978271,166.8671964108944,1.2249719644080541,0,3,3,0_3_4_r0,0,
2026-03-02T09:33:10.191314+00:00,B2,adversarial,eval,adversarial_eval_026,16,4096,1024,bf16,NVIDIA GeForce RTX 4060,c00,32,32,32,2,2,8,0.0,0.0,66.56000018119812,200.3046444058418,2.016492302202755,0,3,3,0_4_3_r0,0,
2026-03-02T09:33:10.285642+00:00,B2,adversarial,eval,adversarial_eval_027,16,4096,4096,bf16,NVIDIA GeForce RTX 4060,c11,32,128,32,4,2,8,0.0,0.0,252.71999835968018,369.05630975961685,2.124370510781288,0,3,3,0_4_4_r0,0,
2026-03-02T09:33:10.333434+00:00,B2,adversarial,eval,adversarial_eval_028,16,8192,1024,bf16,NVIDIA GeForce RTX 4060,c00,32,32,32,2,2,8,0.0,0.0,96.20800241827965,222.9164829850196,2.7901572556608545,0,3,3,0_4_3_r0,0,
2026-03-02T09:33:10.515762+00:00,B2,adversarial,eval,adversarial_eval_029,16,8192,4096,bf16,NVIDIA GeForce RTX 4060,c11,32,128,32,4,2,8,0.0,0.0,498.6880123615265,589.0124583244321,2.153133416853793,0,3,3,0_4_4_r0,0,
2026-03-02T09:33:10.527428+00:00,B2,adversarial,eval,adversarial_eval_030,32,1024,1024,bf16,NVIDIA GeForce RTX 4060,c04,64,64,64,4,3,8,0.0,0.0,75.77600330114365,104.37632173299781,0.8856215830399591,0,3,3,1_3_3_r0,0,
2026-03-02T09:33:10.551708+00:00,B2,adversarial,eval,adversarial_eval_031,32,1024,4096,bf16,NVIDIA GeForce RTX 4060,c00,32,32,32,2,2,8,0.0,0.0,116.73600226640701,266.38336062431335,2.2995087272853048,0,3,3,1_3_4_r0,0,
2026-03-02T09:33:10.574842+00:00,B2,adversarial,eval,adversarial_eval_032,32,4096,1024,bf16,NVIDIA GeForce RTX 4060,c04,64,64,64,4,3,8,0.0,0.0,111.61600053310394,133.70368421077728,2.404990814201279,0,3,3,1_4_3_r0,0,
2026-03-02T09:33:10.669272+00:00,B2,adversarial,eval,adversarial_eval_033,32,4096,4096,bf16,NVIDIA GeForce RTX 4060,c04,64,64,64,4,3,8,0.0,0.0,269.3119943141937,345.3878355026245,3.986981072767652,0,3,3,1_4_4_r0,0,
2026-03-02T09:33:10.716116+00:00,B2,adversarial,eval,adversarial_eval_034,32,8192,1024,bf16,NVIDIA GeForce RTX 4060,c04,64,64,64,4,3,8,0.0,0.0,142.84799993038177,184.0867140889167,3.7583369193943823,0,3,3,1_4_3_r0,0,
2026-03-02T09:33:10.906022+00:00,B2,adversarial,eval,adversarial_eval_035,32,8192,4096,bf16,NVIDIA GeForce RTX 4060,c04,64,64,64,4,3,8,0.0,0.0,521.0560262203217,641.3999956846235,4.121406413006276,0,3,3,1_4_4_r0,0,
2026-03-02T09:33:13.247133+00:00,B2,adversarial,eval,adversarial_eval_036,1024,1,512,bf16,NVIDIA GeForce RTX 4060,c04,64,64,64,4,3,8,0.0,2341.049,64.51199948787689,415.0707125663747,0.01625396838299902,3,0,2,3_0_3_r2,0,anchor_skipped
2026-03-02T09:33:13.564635+00:00,B2,adversarial,eval,adversarial_eval_037,1024,1,2048,bf16,NVIDIA GeForce RTX 4060,c11,32,128,32,4,2,8,0.0,317.454,89.05600011348724,97.20160253345966,0.04709737687135116,3,0,3,3_0_4_r2,0,anchor_skipped
2026-03-02T09:33:13.627152+00:00,B2,adversarial,eval,adversarial_eval_038,2048,1,512,bf16,NVIDIA GeForce RTX 4060,c04,64,64,64,4,3,8,0.0,62.475,40.95999896526337,46.57376050949096,0.051200001293420824,3,0,2,4_0_3_r2,0,anchor_skipped
2026-03-02T09:33:13.720341+00:00,B2,adversarial,eval,adversarial_eval_039,2048,1,2048,bf16,NVIDIA GeForce RTX 4060,c00,32,32,32,2,2,8,0.0,93.142,58.36800113320351,72.22272209823132,0.14371929545533155,3,0,3,4_0_4_r2,0,anchor_skipped
2026-03-02T09:33:13.735278+00:00,B2,adversarial,eval,adversarial_eval_040,4096,1,512,bf16,NVIDIA GeForce RTX 4060,c04,64,64,64,4,3,8,0.0,0.0,42.91199892759323,51.63775976747273,0.09774198603698656,3,0,2,4_0_3_r2,0,
2026-03-02T09:33:13.777798+00:00,B2,adversarial,eval,adversarial_eval_041,4096,1,2048,bf16,NVIDIA GeForce RTX 4060,c00,32,32,32,2,2,8,0.0,0.0,68.59200075268745,137.10336156189433,0.24459435234279361,3,0,3,4_0_4_r2,0,
2026-03-02T09:33:13.990692+00:00,B2,adversarial,eval,adversarial_eval_042,1024,2,512,bf16,NVIDIA GeForce RTX 4060,c04,64,64,64,4,3,8,0.0,0.0,42.30399988591671,121.449281349778,0.04957337380993508,3,0,2,3_0_3_r2,0,
2026-03-02T09:33:14.168524+00:00,B2,adversarial,eval,adversarial_eval_043,1024,2,2048,bf16,NVIDIA GeForce RTX 4060,c11,32,128,32,4,2,8,0.0,0.0,110.59200018644333,152.24832288920865,0.07585185172397577,3,0,3,3_0_4_r2,0,
2026-03-02T09:33:14.186132+00:00,B2,adversarial,eval,adversarial_eval_044,2048,2,512,bf16,NVIDIA GeForce RTX 4060,c04,64,64,64,4,3,8,0.0,0.0,55.15199899673462,150.2601578831672,0.07604989984584842,3,0,2,4_0_3_r2,0,
2026-03-02T09:33:14.341632+00:00,B2,adversarial,eval,adversarial_eval_045,2048,2,2048,bf16,NVIDIA GeForce RTX 4060,c00,32,32,32,2,2,8,0.0,0.0,75.72800293564796,96.54271908104414,0.22154573406956105,3,0,3,4_0_4_r2,0,
2026-03-02T09:33:14.362796+00:00,B2,adversarial,eval,adversarial_eval_046,4096,2,512,bf16,NVIDIA GeForce RTX 4060,c04,64,64,64,4,3,8,0.0,0.0,61.43999844789505,140.9456026554107,0.13653333678245552,3,0,2,4_0_3_r2,0,
2026-03-02T09:33:14.410316+00:00,B2,adversarial,eval,adversarial_eval_047,4096,2,2048,bf16,NVIDIA GeForce RTX 4060,c00,32,32,32,2,2,8,0.0,0.0,85.95199882984161,93.68992179632187,0.3903857089632948,3,0,3,4_0_4_r2,0,
2026-03-02T09:33:14.419914+00:00,B2,adversarial,eval,adversarial_eval_048,1024,4,512,bf16,NVIDIA GeForce RTX 4060,c04,64,64,64,4,3,8,0.0,0.0,76.22400298714638,165.86943507194516,0.05502602639102126,3,0,2,3_0_3_r2,0,
2026-03-02T09:33:14.438083+00:00,B2,adversarial,eval,adversarial_eval_049,1024,4,2048,bf16,NVIDIA GeForce RTX 4060,c11,32,128,32,4,2,8,0.0,0.0,139.26400244235992,280.78080520033814,0.12047058612252605,3,0,3,3_0_4_r2,0,
2026-03-02T09:33:14.447405+00:00,B2,adversarial,eval,adversarial_eval_050,2048,4,512,bf16,NVIDIA GeForce RTX 4060,c04,64,64,64,4,3,8,0.0,0.0,56.32000043988228,111.68767660856236,0.14894545338212953,3,0,2,4_0_3_r2,0,
2026-03-02T09:33:14.468377+00:00,B2,adversarial,eval,adversarial_eval_051,2048,4,2048,bf16,NVIDIA GeForce RTX 4060,c00,32,32,32,2,2,8,0.0,0.0,84.47999879717827,163.73823799192883,0.39718788444301867,3,0,3,4_0_4_r2,0,
2026-03-02T09:33:14.480971+00:00,B2,adversarial,eval,adversarial_eval_052,4096,4,512,bf16,NVIDIA GeForce RTX 4060,c04,64,64,64,4,3,8,0.0,0.0,67.98399984836578,147.30112284421915,0.24678183156949532,3,0,2,4_0_3_r2,0,
2026-03-02T09:33:14.527114+00:00,B2,adversarial,eval,adversarial_eval_053,4096,4,2048,bf16,NVIDIA GeForce RTX 4060,c00,32,32,32,2,2,8,0.0,0.0,85.35999804735184,292.6947221159934,0.7861863347603714,3,0,3,4_0_4_r2,0,
2026-03-02T09:33:14.538835+00:00,B2,adversarial,eval,adversarial_eval_054,1024,8,512,bf16,NVIDIA GeForce RTX 4060,c04,64,64,64,4,3,8,0.0,0.0,57.08799883723259,101.21055983006946,0.14694170702878065,3,0,2,3_0_3_r2,0,
2026-03-02T09:33:14.559535+00:00,B2,adversarial,eval,adversarial_eval_055,1024,8,2048,bf16,NVIDIA GeForce RTX 4060,c11,32,128,32,4,2,8,0.0,0.0,162.81599551439285,267.88863748311996,0.2060880559922247,3,0,3,3_0_4_r2,0,
2026-03-02T09:33:14.570471+00:00,B2,adversarial,eval,adversarial_eval_056,2048,8,512,bf16,NVIDIA GeForce RTX 4060,c04,64,64,64,4,3,8,0.0,0.0,61.43999844789505,144.9145598709583,0.27306667356491104,3,0,2,4_0_3_r2,0,
2026-03-02T09:33:14.589798+00:00,B2,adversarial,eval,adversarial_eval_057,2048,8,2048,bf16,NVIDIA GeForce RTX 4060,c00,32,32,32,2,2,8,0.0,0.0,81.26400038599968,115.37215799093244,0.8258129513835951,3,0,3,4_0_4_r2,0,
2026-03-02T09:33:14.602709+00:00,B2,adversarial,eval,adversarial_eval_058,4096,8,512,bf16,NVIDIA GeForce RTX 4060,c04,64,64,64,4,3,8,0.0,0.0,86.91199868917465,168.49920123815536,0.3860736435253489,3,0,2,4_0_3_r2,0,
2026-03-02T09:33:14.647618+00:00,B2,adversarial,eval,adversarial_eval_059,4096,8,2048,bf16,NVIDIA GeForce RTX 4060,c00,32,32,32,2,2,8,0.0,0.0,86.01599931716919,101.89823724329472,1.560380964767906,3,0,3,4_0_4_r2,0,
2026-03-02T09:33:14.773151+00:00,B2,adversarial,eval,adversarial_eval_060,64,64,8192,bf16,NVIDIA GeForce RTX 4060,c04,64,64,64,4,3,8,0.0,125.474,93.18400174379349,106.53568200767037,0.7201758106988551,1,1,3,1_1_4_r1,0,anchor_skipped
2026-03-02T09:33:14.793244+00:00,B2,adversarial,eval,adversarial_eval_061,128,128,8192,bf16,NVIDIA GeForce RTX 4060,c04,64,64,64,4,3,8,0.0,0.0,87.0399996638298,156.16480410099018,3.0840470707348886,1,1,3,2_2_4_r1,0,
2026-03-02T09:33:15.046390+00:00,B2,adversarial,eval,adversarial_eval_062,2048,128,8192,bf16,NVIDIA GeForce RTX 4060,c04,64,64,64,4,3,8,0.0,253.095,183.6479976773262,251.25920221209506,23.38695412049282,3,1,3,4_2_4_r2,0,anchor_skipped
2026-03-02T09:33:15.155422+00:00,B2,adversarial,eval,adversarial_eval_063,128,2048,8192,bf16,NVIDIA GeForce RTX 4060,c06,64,128,32,4,3,8,0.0,0.0,221.18400037288666,322.1711997687813,19.418074041337796,1,3,3,2_4_4_r0,0,
