results/B2_sweep_a02_k3.csv
timestamp,method,workload,split,shape_id,M,N,K,dtype,gpu,config_id,BLOCK_M,BLOCK_N,BLOCK_K,num_warps,num_stages,GROUP_M,compile_time_ms,tune_time_ms,runtime_cost_us,p99_us,runtime_perf_tflops,bucket_m,bucket_n,bucket_k,cache_key,invalid_config,notes
2026-03-02T09:31:51.185405+00:00,B2,uniform,tune,uniform_tune_000,1536,512,1024,bf16,NVIDIA GeForce RTX 4060,c05,128,64,32,4,3,8,181.01036502048373,2671.379,87.0399996638298,129.01663638651365,18.504282424409332,3,2,3,4_3_3_r2,0,
2026-03-02T09:31:52.454397+00:00,B2,uniform,tune,uniform_tune_001,1536,1536,2048,bf16,NVIDIA GeForce RTX 4060,c11,32,128,32,4,2,8,0.0,1268.934,331.63200318813324,399.8310410976409,29.139758295636632,3,3,3,4_4_4_r1,0,
2026-03-02T09:31:52.896254+00:00,B2,uniform,tune,uniform_tune_002,384,2048,1536,bf16,NVIDIA GeForce RTX 4060,c09,128,64,64,8,3,8,0.0,441.798,126.78399682044983,234.64960113167749,19.055394723211,2,3,3,3_4_4_r0,0,
2026-03-02T09:31:52.989497+00:00,B2,uniform,tune,uniform_tune_003,1536,64,3072,bf16,NVIDIA GeForce RTX 4060,c00,32,32,32,2,2,8,0.0,93.19,46.592000871896744,172.5542426109314,12.963164592579393,3,1,3,4_1_4_r2,0,anchor_skipped
2026-03-02T09:31:53.100668+00:00,B2,uniform,tune,uniform_tune_004,768,128,2048,bf16,NVIDIA GeForce RTX 4060,c03,64,64,32,4,2,8,0.0,111.122,51.19999870657921,66.9868791848421,7.864320198669438,3,1,3,3_2_4_r2,0,
2026-03-02T09:31:53.116241+00:00,B2,uniform,tune,uniform_tune_005,512,128,4096,bf16,NVIDIA GeForce RTX 4060,c03,64,64,32,4,2,8,0.0,0.0,68.09600070118904,167.48383961617924,7.884029994005588,2,1,3,3_2_4_r2,0,
2026-03-02T09:31:53.969958+00:00,B2,uniform,tune,uniform_tune_006,2048,1024,4096,bf16,NVIDIA GeForce RTX 4060,c05,128,64,32,4,3,8,0.0,853.667,580.6080102920532,726.7942249774931,29.589445683600378,3,3,3,4_3_4_r2,0,
2026-03-02T09:31:54.041118+00:00,B2,uniform,tune,uniform_tune_007,128,768,512,bf16,NVIDIA GeForce RTX 4060,c04,64,64,64,4,3,8,0.0,71.107,34.463999792933464,52.28127919137477,2.920824530083711,1,3,2,2_3_3_r0,0,
2026-03-02T09:31:54.085171+00:00,B2,uniform,tune,uniform_tune_008,2048,256,64,bf16,NVIDIA GeForce RTX 4060,c03,64,64,32,4,2,8,0.0,44.006,31.74399957060814,45.72415966540575,2.1140645447253688,3,2,1,4_2_1_r2,0,anchor_skipped
2026-03-02T09:31:54.200146+00:00,B2,uniform,tune,uniform_tune_009,192,768,2048,bf16,NVIDIA GeForce RTX 4060,c03,64,64,32,4,2,8,0.0,114.933,53.93600091338158,57.266560047864914,11.198082278475933,2,3,3,2_3_4_r0,0,
2026-03-02T09:31:54.442521+00:00,B2,uniform,tune,uniform_tune_010,1024,1024,1536,bf16,NVIDIA GeForce RTX 4060,c10,64,128,64,8,3,8,0.0,242.325,137.66400516033173,167.47520074248314,23.399184618000675,3,3,3,3_3_4_r1,0,
2026-03-02T09:31:54.527910+00:00,B2,uniform,tune,uniform_tune_011,256,384,768,bf16,NVIDIA GeForce RTX 4060,c04,64,64,64,4,3,8,0.0,85.322,33.79200026392937,135.82560077309606,4.468363601463886,2,2,3,2_3_3_r1,0,
2026-03-02T09:31:54.612660+00:00,B2,uniform,tune,uniform_tune_012,64,192,2048,bf16,NVIDIA GeForce RTX 4060,c00,32,32,32,2,2,8,0.0,84.704,41.34400002658367,167.505921125412,1.2173869961212602,1,2,3,1_2_4_r0,0,
2026-03-02T09:31:54.678017+00:00,B2,uniform,tune,uniform_tune_013,192,128,512,bf16,NVIDIA GeForce RTX 4060,c04,64,64,64,4,3,8,0.0,65.313,33.55199843645096,51.83808024972674,0.7500543983293644,2,1,2,2_2_3_r1,0,
2026-03-02T09:31:54.684891+00:00,B2,uniform,tune,uniform_tune_014,128,128,1024,bf16,NVIDIA GeForce RTX 4060,c04,64,64,64,4,3,8,0.0,0.0,37.37599961459637,130.3375971317291,0.897753433914743,1,1,3,2_2_3_r1,0,
2026-03-02T09:31:55.344925+00:00,B2,uniform,tune,uniform_tune_015,3072,3072,768,bf16,NVIDIA GeForce RTX 4060,c10,64,128,64,8,3,8,0.0,659.99,487.42398619651794,637.1622431278226,29.73902605227094,3,3,3,4_4_3_r1,0,
2026-03-02T09:31:55.485316+00:00,B2,uniform,tune,uniform_tune_016,256,128,3072,bf16,NVIDIA GeForce RTX 4060,c00,32,32,32,2,2,8,0.0,140.344,64.97599929571152,206.91712558269487,3.0984762709649893,2,1,3,2_2_4_r2,0,
2026-03-02T09:31:55.528297+00:00,B2,uniform,tune,uniform_tune_017,96,1024,192,bf16,NVIDIA GeForce RTX 4060,c00,32,32,32,2,2,8,0.0,42.942,25.679999962449074,55.25119960308075,1.469966357289665,1,3,2,2_3_2_r0,0,anchor_skipped
2026-03-02T09:31:55.573110+00:00,B2,uniform,tune,uniform_tune_018,64,64,192,bf16,NVIDIA GeForce RTX 4060,c04,64,64,64,4,3,8,0.0,44.783,28.672000393271446,42.639040350913994,0.05485714210471025,1,1,2,1_1_2_r1,0,
2026-03-02T09:31:55.613380+00:00,B2,uniform,tune,uniform_tune_019,4096,64,64,bf16,NVIDIA GeForce RTX 4060,c01,64,32,32,2,2,8,0.0,40.244,28.672000393271446,118.03455866873259,1.1702856982338186,3,1,1,4_1_1_r2,0,anchor_skipped
2026-03-02T09:31:55.802773+00:00,B2,uniform,tune,uniform_tune_020,128,4096,3072,bf16,NVIDIA GeForce RTX 4060,c06,64,128,32,4,3,8,0.0,189.362,138.2399946451187,149.3872009217739,23.30168979150595,1,3,3,2_4_4_r0,0,anchor_skipped
2026-03-02T09:31:55.846676+00:00,B2,uniform,tune,uniform_tune_021,192,2048,3072,bf16,NVIDIA GeForce RTX 4060,c06,64,128,32,4,3,8,0.0,0.0,105.00799864530563,230.48191606998444,23.007000753918316,2,3,3,2_4_4_r0,0,
2026-03-02T09:31:55.903910+00:00,B2,uniform,tune,uniform_tune_022,1536,2048,2048,bf16,NVIDIA GeForce RTX 4060,c11,32,128,32,4,2,8,0.0,0.0,422.62400686740875,467.148794233799,30.48786079027078,3,3,3,4_4_4_r1,0,
2026-03-02T09:31:55.914904+00:00,B2,uniform,tune,uniform_tune_023,256,1024,1024,bf16,NVIDIA GeForce RTX 4060,c04,64,64,64,4,3,8,0.0,0.0,51.58399976789951,155.0950402021407,10.407702280079729,2,3,3,2_3_3_r0,0,
2026-03-02T09:31:55.977345+00:00,B2,uniform,tune,uniform_tune_024,768,128,384,bf16,NVIDIA GeForce RTX 4060,c11,32,128,32,4,2,8,0.0,62.398,31.74399957060814,43.007999658584595,2.37832261281604,3,1,2,3_2_3_r2,0,
2026-03-02T09:31:56.040174+00:00,B2,uniform,tune,uniform_tune_025,256,96,384,bf16,NVIDIA GeForce RTX 4060,c02,32,64,32,2,2,8,0.0,62.794,32.71999955177307,54.8486394435167,0.576844995677184,2,1,2,2_2_3_r2,0,
2026-03-02T09:31:56.056474+00:00,B2,uniform,tune,uniform_tune_026,96,1024,3072,bf16,NVIDIA GeForce RTX 4060,c03,64,64,32,4,2,8,0.0,0.0,63.48799914121628,79.66175884008406,9.51329045126416,1,3,3,2_3_4_r0,0,
2026-03-02T09:31:56.100855+00:00,B2,uniform,tune,uniform_tune_027,1536,512,4096,bf16,NVIDIA GeForce RTX 4060,c05,128,64,32,4,3,8,0.0,0.0,201.7280012369156,272.4454429745674,31.936324677275653,3,2,3,4_3_4_r2,0,
2026-03-02T09:31:56.152525+00:00,B2,uniform,tune,uniform_tune_028,128,64,192,bf16,NVIDIA GeForce RTX 4060,c04,64,64,64,4,3,8,0.0,51.613,29.69600073993206,39.91583984345196,0.10593103184328642,1,1,2,2_1_2_r2,0,
2026-03-02T09:31:56.226004+00:00,B2,uniform,tune,uniform_tune_029,192,256,1536,bf16,NVIDIA GeForce RTX 4060,c04,64,64,64,4,3,8,0.0,73.444,37.88800165057182,59.501440301537464,3.985297123679816,2,2,3,2_2_4_r1,0,
2026-03-02T09:31:56.292795+00:00,B2,uniform,tune,uniform_tune_030,4096,64,3072,bf16,NVIDIA GeForce RTX 4060,c00,32,32,32,2,2,8,0.0,0.0,113.66400122642517,195.04960149526593,14.169945793053401,3,1,3,4_1_4_r2,0,
2026-03-02T09:31:56.354738+00:00,B2,uniform,tune,uniform_tune_031,384,128,96,bf16,NVIDIA GeForce RTX 4060,c11,32,128,32,4,2,8,0.0,61.888,32.6399989426136,52.69919887185097,0.28912942113117396,2,1,1,3_2_2_r2,0,
2026-03-02T09:31:56.483123+00:00,B2,uniform,eval,uniform_eval_000,512,4096,768,bf16,NVIDIA GeForce RTX 4060,c06,64,128,32,4,3,8,0.0,127.907,128.78400087356567,169.6358375251292,25.012621522470432,2,3,3,3_4_3_r0,0,anchor_skipped
2026-03-02T09:31:56.557736+00:00,B2,uniform,eval,uniform_eval_001,384,512,64,bf16,NVIDIA GeForce RTX 4060,c11,32,128,32,4,2,8,0.0,74.57,28.672000393271446,271.0649576038115,0.877714273675364,2,2,1,3_3_1_r1,0,
2026-03-02T09:31:56.626505+00:00,B2,uniform,eval,uniform_eval_002,256,4096,384,bf16,NVIDIA GeForce RTX 4060,c11,32,128,32,4,2,8,0.0,68.731,59.29600074887276,67.52128005027771,13.581124491187701,2,3,2,2_4_3_r0,0,anchor_skipped
2026-03-02T09:31:56.712933+00:00,B2,uniform,eval,uniform_eval_003,384,768,512,bf16,NVIDIA GeForce RTX 4060,c10,64,128,64,8,3,8,0.0,86.386,40.95999896526337,58.59328113496299,7.372800186252599,2,3,2,3_3_3_r0,0,
2026-03-02T09:31:56.784941+00:00,B2,uniform,eval,uniform_eval_004,768,1024,96,bf16,NVIDIA GeForce RTX 4060,c05,128,64,32,4,3,8,0.0,71.965,35.74400022625923,47.756800316274166,4.2243437512366615,3,3,1,3_3_2_r1,0,
2026-03-02T09:31:56.961646+00:00,B2,uniform,eval,uniform_eval_005,3072,3072,128,bf16,NVIDIA GeForce RTX 4060,c09,128,64,64,8,3,8,0.0,176.662,112.64000087976456,142.57407881319517,21.44814528702665,3,3,1,4_4_2_r1,0,
2026-03-02T09:31:56.972477+00:00,B2,uniform,eval,uniform_eval_006,256,96,512,bf16,NVIDIA GeForce RTX 4060,c02,32,64,32,2,2,8,0.0,0.0,35.679999738931656,70.12160114943981,0.7053201845329813,2,1,2,2_2_3_r2,0,
2026-03-02T09:31:57.406955+00:00,B2,uniform,eval,uniform_eval_007,4096,4096,4096,bf16,NVIDIA GeForce RTX 4060,c11,32,128,32,4,2,8,0.0,0.0,4664.83211517334,4798.8034772872925,29.46278667241874,3,3,3,4_4_4_r1,0,
2026-03-02T09:31:57.480075+00:00,B2,uniform,eval,uniform_eval_008,128,96,64,bf16,NVIDIA GeForce RTX 4060,c00,32,32,32,2,2,8,0.0,73.055,30.54399974644184,57.18015857040879,0.0514950240000322,1,1,1,2_2_1_r1,0,
2026-03-02T09:31:57.564506+00:00,B2,uniform,eval,uniform_eval_009,3072,384,96,bf16,NVIDIA GeForce RTX 4060,c11,32,128,32,4,2,8,0.0,84.394,37.88800165057182,96.24639764428126,5.977945685519724,3,2,1,4_3_2_r2,0,anchor_skipped
2026-03-02T09:31:57.587278+00:00,B2,uniform,eval,uniform_eval_010,768,768,2048,bf16,NVIDIA GeForce RTX 4060,c10,64,128,64,8,3,8,0.0,0.0,107.51999914646149,165.56383937597258,22.469485892657843,3,3,3,3_3_4_r1,0,
2026-03-02T09:31:57.650939+00:00,B2,uniform,eval,uniform_eval_011,4096,96,512,bf16,NVIDIA GeForce RTX 4060,c01,64,32,32,2,2,8,0.0,63.618,48.86399954557419,59.41248148679733,8.240282984295131,3,1,2,4_2_3_r2,0,anchor_skipped
2026-03-02T09:31:57.659130+00:00,B2,uniform,eval,uniform_eval_012,384,384,256,bf16,NVIDIA GeForce RTX 4060,c05,128,64,32,4,3,8,0.0,0.0,76.83200016617775,149.65344250202176,0.9826305684702814,2,2,2,3_3_2_r1,0,
2026-03-02T09:31:58.290572+00:00,B2,uniform,eval,uniform_eval_013,4096,2048,768,bf16,NVIDIA GeForce RTX 4060,c11,32,128,32,4,2,8,0.0,631.399,442.3680007457733,487.9507166147232,29.127111062006694,3,3,3,4_4_3_r2,0,
2026-03-02T09:31:58.312587+00:00,B2,uniform,eval,uniform_eval_014,192,384,3072,bf16,NVIDIA GeForce RTX 4060,c03,64,64,32,4,2,8,0.0,0.0,65.5359998345375,144.93567503988717,6.912000017451122,2,2,3,2_3_4_r0,0,
2026-03-02T09:31:58.321094+00:00,B2,uniform,eval,uniform_eval_015,128,96,4096,bf16,NVIDIA GeForce RTX 4060,c04,64,64,64,4,3,8,0.0,0.0,60.416001826524734,126.51519812643528,1.6661694411530108,1,1,3,2_2_4_r1,0,
2026-03-02T09:31:58.439913+00:00,B2,uniform,eval,uniform_eval_016,64,4096,2048,bf16,NVIDIA GeForce RTX 4060,c04,64,64,64,4,3,8,0.0,118.778,67.29599833488464,76.03264130651951,15.955507765212804,1,3,3,1_4_4_r0,0,anchor_skipped
2026-03-02T09:31:58.455193+00:00,B2,uniform,eval,uniform_eval_017,96,128,3072,bf16,NVIDIA GeForce RTX 4060,c04,64,64,64,4,3,8,0.0,0.0,54.287999868392944,117.88287885487077,1.3906843535039763,1,1,3,2_2_4_r1,0,
2026-03-02T09:31:58.461987+00:00,B2,uniform,eval,uniform_eval_018,512,768,64,bf16,NVIDIA GeForce RTX 4060,c11,32,128,32,4,2,8,0.0,0.0,34.81600061058998,101.7571198195219,1.4456470334703126,2,3,1,3_3_1_r1,0,
2026-03-02T09:31:58.525762+00:00,B2,uniform,eval,uniform_eval_019,64,128,384,bf16,NVIDIA GeForce RTX 4060,c05,128,64,32,4,3,8,0.0,63.741,34.80000048875809,60.48128042370081,0.18078896297810151,1,1,2,1_2_3_r0,0,
2026-03-02T09:31:58.530733+00:00,B2,uniform,eval,uniform_eval_020,512,512,96,bf16,NVIDIA GeForce RTX 4060,c05,128,64,32,4,3,8,0.0,0.0,37.88800165057182,88.16383957862851,1.3284323745599385,2,2,1,3_3_2_r1,0,
2026-03-02T09:31:58.556912+00:00,B2,uniform,eval,uniform_eval_021,256,3072,1536,bf16,NVIDIA GeForce RTX 4060,c06,64,128,32,4,3,8,0.0,0.0,100.35199671983719,189.45248007774353,24.074449766503058,2,3,3,2_4_4_r0,0,
2026-03-02T09:31:58.565340+00:00,B2,uniform,eval,uniform_eval_022,2048,96,512,bf16,NVIDIA GeForce RTX 4060,c01,64,32,32,2,2,8,0.0,0.0,35.32800078392029,92.6595195382832,5.698782482240964,3,1,2,4_2_3_r2,0,
2026-03-02T09:31:58.596401+00:00,B2,uniform,eval,uniform_eval_023,1536,512,3072,bf16,NVIDIA GeForce RTX 4060,c05,128,64,32,4,3,8,0.0,0.0,170.70399969816208,298.2707238197326,28.3053602525051,3,2,3,4_3_4_r2,0,
2026-03-02T09:31:58.601264+00:00,B2,uniform,eval,uniform_eval_024,128,192,64,bf16,NVIDIA GeForce RTX 4060,c00,32,32,32,2,2,8,0.0,0.0,41.32799990475178,109.22591984272,0.07611614419400715,1,2,1,2_2_1_r1,0,
2026-03-02T09:31:58.612118+00:00,B2,uniform,eval,uniform_eval_025,1536,96,384,bf16,NVIDIA GeForce RTX 4060,c01,64,32,32,2,2,8,0.0,0.0,71.68000191450119,205.11103630065915,1.5798856720885461,3,1,2,4_2_3_r2,0,
2026-03-02T09:31:58.715411+00:00,B2,uniform,eval,uniform_eval_026,1536,2048,64,bf16,NVIDIA GeForce RTX 4060,c05,128,64,32,4,3,8,0.0,103.256,50.175998359918594,83.39456010609857,8.024816588834353,3,3,1,4_4_1_r1,0,
2026-03-02T09:31:58.723487+00:00,B2,uniform,eval,uniform_eval_027,256,1024,96,bf16,NVIDIA GeForce RTX 4060,c00,32,32,32,2,2,8,0.0,0.0,67.951999604702,163.13344277441485,0.7406941413467583,2,3,1,2_3_2_r0,0,
2026-03-02T09:31:58.728153+00:00,B2,uniform,eval,uniform_eval_028,2048,256,64,bf16,NVIDIA GeForce RTX 4060,c03,64,64,32,4,2,8,0.0,0.0,34.92799960076809,96.19232296943656,1.9213486248014109,3,2,1,4_2_1_r2,0,
2026-03-02T09:31:58.732383+00:00,B2,uniform,eval,uniform_eval_029,192,768,192,bf16,NVIDIA GeForce RTX 4060,c00,32,32,32,2,2,8,0.0,0.0,32.76799991726875,58.552321121096575,1.7280000043627806,2,3,2,2_3_2_r0,0,
2026-03-02T09:31:58.788294+00:00,B2,uniform,eval,uniform_eval_030,1024,2048,3072,bf16,NVIDIA GeForce RTX 4060,c09,128,64,64,8,3,8,0.0,0.0,423.8079935312271,539.3100726604462,30.402687265620465,3,3,3,3_4_4_r0,0,
2026-03-02T09:31:58.961414+00:00,B2,uniform,eval,uniform_eval_031,1536,1024,512,bf16,NVIDIA GeForce RTX 4060,c09,128,64,64,8,3,8,0.0,173.06,80.89599758386612,191.00671686232047,19.90967148072132,3,3,2,4_3_3_r1,0,
2026-03-02T09:31:59.048737+00:00,B2,uniform,eval,uniform_eval_032,512,768,768,bf16,NVIDIA GeForce RTX 4060,c10,64,128,64,8,3,8,0.0,87.267,49.15200173854828,56.826560497283936,12.287999565362945,2,3,3,3_3_3_r1,0,
2026-03-02T09:31:59.130572+00:00,B2,uniform,eval,uniform_eval_033,64,512,4096,bf16,NVIDIA GeForce RTX 4060,c04,64,64,64,4,3,8,0.0,81.789,56.32000043988228,77.96736024320123,4.766254508228145,1,2,3,1_3_4_r0,0,anchor_skipped
2026-03-02T09:31:59.145449+00:00,B2,uniform,eval,uniform_eval_034,1024,256,512,bf16,NVIDIA GeForce RTX 4060,c11,32,128,32,4,2,8,0.0,0.0,57.85599909722805,165.02720490098,4.639716886556386,3,2,2,3_2_3_r2,0,
2026-03-02T09:31:59.151915+00:00,B2,uniform,eval,uniform_eval_035,1024,768,96,bf16,NVIDIA GeForce RTX 4060,c05,128,64,32,4,3,8,0.0,0.0,38.91199827194214,90.83583861589432,3.880421224958686,3,3,1,3_3_2_r1,0,
2026-03-02T09:31:59.214731+00:00,B2,uniform,eval,uniform_eval_036,768,64,1536,bf16,NVIDIA GeForce RTX 4060,c04,64,64,64,4,3,8,0.0,62.784,45.93599960207939,63.12512155622243,3.287072128787742,3,1,3,3_1_4_r2,0,anchor_skipped
2026-03-02T09:31:59.222828+00:00,B2,uniform,eval,uniform_eval_037,512,256,512,bf16,NVIDIA GeForce RTX 4060,c11,32,128,32,4,2,8,0.0,0.0,40.44799879193306,137.9622413963079,3.3182785801202197,2,2,2,3_2_3_r2,0,
2026-03-02T09:31:59.264252+00:00,B2,uniform,eval,uniform_eval_038,64,1024,64,bf16,NVIDIA GeForce RTX 4060,c09,128,64,64,8,3,8,0.0,41.383,29.69600073993206,60.48128042370081,0.2824827515820971,1,3,1,1_3_1_r0,0,anchor_skipped
2026-03-02T09:31:59.273609+00:00,B2,uniform,eval,uniform_eval_039,512,128,2048,bf16,NVIDIA GeForce RTX 4060,c03,64,64,32,4,2,8,0.0,0.0,48.128001391887665,92.28223908692586,5.577531753588397,2,1,3,3_2_4_r2,0,
2026-03-02T09:31:59.280903+00:00,B2,uniform,eval,uniform_eval_040,4096,768,96,bf16,NVIDIA GeForce RTX 4060,c11,32,128,32,4,2,8,0.0,0.0,46.592000871896744,170.75360491871828,12.963164592579393,3,3,1,4_3_2_r2,0,
2026-03-02T09:31:59.286196+00:00,B2,uniform,eval,uniform_eval_041,4096,192,64,bf16,NVIDIA GeForce RTX 4060,c03,64,64,32,4,2,8,0.0,0.0,37.88800165057182,68.66079948842521,2.656864749119877,3,2,1,4_2_1_r2,0,
2026-03-02T09:31:59.330382+00:00,B2,uniform,eval,uniform_eval_042,96,1536,128,bf16,NVIDIA GeForce RTX 4060,c09,128,64,64,8,3,8,0.0,44.161,33.79200026392937,44.072960019111626,1.1170909003659715,1,3,1,2_4_2_r0,0,anchor_skipped
2026-03-02T09:31:59.337901+00:00,B2,uniform,eval,uniform_eval_043,192,2048,192,bf16,NVIDIA GeForce RTX 4060,c09,128,64,64,8,3,8,0.0,0.0,35.9519999474287,150.47680243849746,4.199903877970471,2,3,2,2_4_2_r0,0,
2026-03-02T09:31:59.422470+00:00,B2,uniform,eval,uniform_eval_044,384,4096,3072,bf16,NVIDIA GeForce RTX 4060,c09,128,64,64,8,3,8,0.0,0.0,320.51199674606323,496.22017502784706,30.150747909933568,2,3,3,3_4_4_r0,0,
2026-03-02T09:31:59.440390+00:00,B2,uniform,eval,uniform_eval_045,4096,96,768,bf16,NVIDIA GeForce RTX 4060,c01,64,32,32,2,2,8,0.0,0.0,79.32800054550171,161.7967988550663,7.613702246958355,3,1,3,4_2_3_r2,0,
2026-03-02T09:31:59.448926+00:00,B2,uniform,eval,uniform_eval_046,96,96,1536,bf16,NVIDIA GeForce RTX 4060,c04,64,64,64,4,3,8,0.0,0.0,67.58400052785873,156.3459193706512,0.41890908763723933,1,1,3,2_2_4_r1,0,
2026-03-02T09:31:59.508989+00:00,B2,uniform,eval,uniform_eval_047,2048,512,4096,bf16,NVIDIA GeForce RTX 4060,c05,128,64,32,4,3,8,0.0,0.0,315.43999910354614,326.1542499065399,27.231595918120306,3,2,3,4_3_4_r2,0,
2026-03-02T09:31:59.577141+00:00,B2,uniform,eval,uniform_eval_048,96,256,768,bf16,NVIDIA GeForce RTX 4060,c03,64,64,32,4,2,8,0.0,68.097,36.86400130391121,53.84031869471069,1.0239999637802455,1,2,3,2_2_3_r0,0,
2026-03-02T09:31:59.623390+00:00,B2,uniform,eval,uniform_eval_049,64,768,384,bf16,NVIDIA GeForce RTX 4060,c04,64,64,64,4,3,8,0.0,46.204,32.76799991726875,54.48896050453183,1.1520000029085202,1,3,2,1_3_3_r0,0,anchor_skipped
2026-03-02T09:31:59.627809+00:00,B2,uniform,eval,uniform_eval_050,128,1024,96,bf16,NVIDIA GeForce RTX 4060,c00,32,32,32,2,2,8,0.0,0.0,29.47199996560812,51.22047871351242,0.8538892518107647,1,3,1,2_3_2_r0,0,
2026-03-02T09:31:59.637319+00:00,B2,uniform,eval,uniform_eval_051,384,768,768,bf16,NVIDIA GeForce RTX 4060,c10,64,128,64,8,3,8,0.0,0.0,51.19999870657921,135.2294336259365,8.847360223503117,2,3,3,3_3_3_r0,0,
2026-03-02T09:31:59.655344+00:00,B2,uniform,eval,uniform_eval_052,768,64,4096,bf16,NVIDIA GeForce RTX 4060,c04,64,64,64,4,3,8,0.0,0.0,81.77600055932999,146.58847942948336,4.923855180565694,3,1,3,3_1_4_r2,0,
2026-03-02T09:31:59.661349+00:00,B2,uniform,eval,uniform_eval_053,384,96,512,bf16,NVIDIA GeForce RTX 4060,c11,32,128,32,4,2,8,0.0,0.0,38.71999867260456,134.20416012406346,0.9749157359013094,2,1,2,3_2_3_r2,0,
2026-03-02T09:31:59.668011+00:00,B2,uniform,eval,uniform_eval_054,768,192,768,bf16,NVIDIA GeForce RTX 4060,c11,32,128,32,4,2,8,0.0,0.0,40.752001106739044,64.90367867052555,5.557823170615924,3,2,3,3_2_3_r2,0,
2026-03-02T09:31:59.678280+00:00,B2,uniform,eval,uniform_eval_055,512,2048,512,bf16,NVIDIA GeForce RTX 4060,c06,64,128,32,4,3,8,0.0,0.0,68.70400160551071,166.65759801864624,15.628519429847529,2,3,2,3_4_3_r0,0,
2026-03-02T09:31:59.683966+00:00,B2,uniform,eval,uniform_eval_056,384,512,512,bf16,NVIDIA GeForce RTX 4060,c10,64,128,64,8,3,8,0.0,0.0,38.91199827194214,49.67295955866574,5.173894966611581,2,2,2,3_3_3_r1,0,
2026-03-02T09:31:59.693555+00:00,B2,uniform,eval,uniform_eval_057,2048,512,512,bf16,NVIDIA GeForce RTX 4060,c05,128,64,32,4,3,8,0.0,0.0,67.52000004053116,133.2940839231013,15.902574398036883,3,2,2,4_3_3_r2,0,
2026-03-02T09:31:59.901027+00:00,B2,uniform,eval,uniform_eval_058,1024,512,2048,bf16,NVIDIA GeForce RTX 4060,c05,128,64,32,4,3,8,0.0,207.441,104.44799810647964,110.59200018644333,20.560314098224698,3,2,3,3_3_4_r2,0,
2026-03-02T09:31:59.952036+00:00,B2,uniform,eval,uniform_eval_059,2048,64,4096,bf16,NVIDIA GeForce RTX 4060,c00,32,32,32,2,2,8,0.0,0.0,90.92799946665764,163.79104219377018,11.808703922862946,3,1,3,4_1_4_r2,0,
2026-03-02T09:32:00.016497+00:00,B2,uniform,eval,uniform_eval_060,64,1536,1024,bf16,NVIDIA GeForce RTX 4060,c04,64,64,64,4,3,8,0.0,64.398,44.03200000524521,47.02560044825077,4.57227906922278,1,3,3,1_4_3_r0,0,anchor_skipped
2026-03-02T09:32:00.035531+00:00,B2,uniform,eval,uniform_eval_061,768,1024,1536,bf16,NVIDIA GeForce RTX 4060,c10,64,128,64,8,3,8,0.0,0.0,107.91999846696854,215.0108732283115,22.386204024451033,3,3,3,3_3_4_r1,0,
2026-03-02T09:32:00.114298+00:00,B2,uniform,eval,uniform_eval_062,384,2048,192,bf16,NVIDIA GeForce RTX 4060,c10,64,128,64,8,3,8,0.0,78.706,41.9359989464283,54.16704062372446,7.20120887988816,2,3,2,3_4_2_r0,0,
2026-03-02T09:32:00.120196+00:00,B2,uniform,eval,uniform_eval_063,256,2048,192,bf16,NVIDIA GeForce RTX 4060,c09,128,64,64,8,3,8,0.0,0.0,37.59999945759773,162.43520230054844,5.354430715538706,2,3,2,2_4_2_r0,0,
2026-03-02T09:32:02.192671+00:00,B2,llm_style,tune,llm_style_tune_000,8,4096,1024,bf16,NVIDIA GeForce RTX 4060,c00,32,32,32,2,2,8,0.0,2071.537,38.2240004837513,131.77855990827078,1.7556734813387056,0,3,3,0_4_3_r0,0,anchor_skipped
2026-03-02T09:32:02.217614+00:00,B2,llm_style,tune,llm_style_tune_001,32,1024,2048,bf16,NVIDIA GeForce RTX 4060,c04,64,64,64,4,3,8,0.0,0.0,123.79200011491776,245.7599937915802,1.08421972240051,0,3,3,1_3_4_r0,0,
2026-03-02T09:32:02.231385+00:00,B2,llm_style,tune,llm_style_tune_002,16,2048,1024,bf16,NVIDIA GeForce RTX 4060,c00,32,32,32,2,2,8,0.0,0.0,79.8719972372055,205.86752519011483,0.8402051572680562,0,3,3,0_4_3_r0,0,
2026-03-02T09:32:04.609341+00:00,B2,llm_style,tune,llm_style_tune_003,1,1024,4096,bf16,NVIDIA GeForce RTX 4060,c00,32,32,32,2,2,8,0.0,2377.899,172.39999771118164,360.05887418985316,0.048657819671513405,0,3,3,0_3_4_r0,0,anchor_skipped
2026-03-02T09:32:04.652207+00:00,B2,llm_style,tune,llm_style_tune_004,64,2048,2048,bf16,NVIDIA GeForce RTX 4060,c04,64,64,64,4,3,8,0.0,0.0,284.1600030660629,389.652477800846,1.8893261057404536,1,3,3,1_4_4_r0,0,
2026-03-02T09:32:05.221150+00:00,B2,llm_style,tune,llm_style_tune_005,32,8192,8192,bf16,NVIDIA GeForce RTX 4060,c04,64,64,64,4,3,8,0.0,0.0,578.5599946975708,7693.986563682555,7.423546970690737,0,3,3,1_4_4_r0,0,
2026-03-02T09:32:05.980849+00:00,B2,llm_style,tune,llm_style_tune_006,16,8192,8192,bf16,NVIDIA GeForce RTX 4060,c11,32,128,32,4,2,8,0.0,759.641,557.1039915084839,665.4182589054105,3.8547267309738826,0,3,3,0_4_4_r0,0,anchor_skipped
2026-03-02T09:32:06.029929+00:00,B2,llm_style,tune,llm_style_tune_007,2,1024,8192,bf16,NVIDIA GeForce RTX 4060,c00,32,32,32,2,2,8,0.0,0.0,89.02399986982346,171.69535994529716,0.37691445058709355,0,3,3,0_3_4_r0,0,
2026-03-02T09:32:06.119220+00:00,B2,llm_style,tune,llm_style_tune_008,16,2048,8192,bf16,NVIDIA GeForce RTX 4060,c11,32,128,32,4,2,8,0.0,0.0,176.12800002098083,278.2208044826983,3.04818604614852,0,3,3,0_4_4_r0,0,
2026-03-02T09:32:06.165009+00:00,B2,llm_style,tune,llm_style_tune_009,4,4096,2048,bf16,NVIDIA GeForce RTX 4060,c11,32,128,32,4,2,8,0.0,0.0,70.41599974036217,172.73856252431864,0.9530343138980312,0,3,3,0_4_4_r0,0,
2026-03-02T09:32:06.356056+00:00,B2,llm_style,tune,llm_style_tune_010,64,8192,4096,bf16,NVIDIA GeForce RTX 4060,c04,64,64,64,4,3,8,0.0,0.0,331.8080008029938,492.60543525218964,12.944134214985596,1,3,3,1_4_4_r0,0,
2026-03-02T09:32:06.398040+00:00,B2,llm_style,tune,llm_style_tune_011,16,8192,1024,bf16,NVIDIA GeForce RTX 4060,c00,32,32,32,2,2,8,0.0,0.0,81.87199756503105,244.25855666398962,3.278721223172566,0,3,3,0_4_3_r0,0,
2026-03-02T09:32:06.442522+00:00,B2,llm_style,tune,llm_style_tune_012,2,8192,1024,bf16,NVIDIA GeForce RTX 4060,c00,32,32,32,2,2,8,0.0,0.0,74.75200295448303,150.5881583690643,0.4488766945874548,0,3,3,0_4_3_r0,0,
2026-03-02T09:32:06.525330+00:00,B2,llm_style,tune,llm_style_tune_013,16,8192,2048,bf16,NVIDIA GeForce RTX 4060,c11,32,128,32,4,2,8,0.0,0.0,164.94400054216385,216.4163222908973,3.254867774731596,0,3,3,0_4_4_r0,0,
2026-03-02T09:32:06.615528+00:00,B2,llm_style,tune,llm_style_tune_014,8,4096,4096,bf16,NVIDIA GeForce RTX 4060,c11,32,128,32,4,2,8,0.0,0.0,161.1040011048317,195.18463522195816,1.6662246384888162,0,3,3,0_4_4_r0,0,
2026-03-02T09:32:06.631014+00:00,B2,llm_style,tune,llm_style_tune_015,64,1024,1024,bf16,NVIDIA GeForce RTX 4060,c04,64,64,64,4,3,8,0.0,0.0,44.97599974274635,136.2902382016182,2.9842077723163096,1,3,3,1_3_3_r0,0,
2026-03-02T09:32:06.794339+00:00,B2,llm_style,tune,llm_style_tune_016,16,4096,8192,bf16,NVIDIA GeForce RTX 4060,c11,32,128,32,4,2,8,0.0,0.0,294.20800507068634,454.7708788514136,3.649600981258219,0,3,3,0_4_4_r0,0,
2026-03-02T09:32:06.876850+00:00,B2,llm_style,tune,llm_style_tune_017,1,4096,4096,bf16,NVIDIA GeForce RTX 4060,c11,32,128,32,4,2,8,0.0,0.0,161.19999438524246,272.12799876928324,0.20815405191522662,0,3,3,0_4_4_r0,0,
2026-03-02T09:32:06.959655+00:00,B2,llm_style,tune,llm_style_tune_018,64,4096,4096,bf16,NVIDIA GeForce RTX 4060,c04,64,64,64,4,3,8,0.0,0.0,166.78400337696075,184.2019242048263,12.875837037838183,1,3,3,1_4_4_r0,0,
2026-03-02T09:32:07.045279+00:00,B2,llm_style,tune,llm_style_tune_019,64,8192,2048,bf16,NVIDIA GeForce RTX 4060,c04,64,64,64,4,3,8,0.0,0.0,169.00800168514252,292.6080057024956,12.706402221125044,1,3,3,1_4_4_r0,0,
2026-03-02T09:32:07.093817+00:00,B2,llm_style,tune,llm_style_tune_020,8,2048,4096,bf16,NVIDIA GeForce RTX 4060,c11,32,128,32,4,2,8,0.0,0.0,77.64800265431404,191.01952031254766,1.728540637388089,0,3,3,0_4_4_r0,0,
2026-03-02T09:32:07.107961+00:00,B2,llm_style,tune,llm_style_tune_021,8,1024,2048,bf16,NVIDIA GeForce RTX 4060,c00,32,32,32,2,2,8,0.0,0.0,47.759998589754105,136.11903980374333,0.7025635048322298,0,3,3,0_3_4_r0,0,
2026-03-02T09:32:07.147521+00:00,B2,llm_style,tune,llm_style_tune_022,8,8192,1024,bf16,NVIDIA GeForce RTX 4060,c00,32,32,32,2,2,8,0.0,0.0,50.175998359918594,126.1670377105473,2.674938862944784,0,3,3,0_4_3_r0,0,
2026-03-02T09:32:07.305275+00:00,B2,llm_style,tune,llm_style_tune_023,1,4096,8192,bf16,NVIDIA GeForce RTX 4060,c11,32,128,32,4,2,8,0.0,0.0,295.8879917860031,309.2684805393219,0.2268049595217624,0,3,3,0_4_4_r0,0,
2026-03-02T09:32:07.466218+00:00,B2,llm_style,tune,llm_style_tune_024,2,8192,4096,bf16,NVIDIA GeForce RTX 4060,c11,32,128,32,4,2,8,0.0,0.0,293.88800263404846,382.6723182201384,0.45669686001823256,0,3,3,0_4_4_r0,0,
2026-03-02T09:32:07.549047+00:00,B2,llm_style,tune,llm_style_tune_025,2,4096,4096,bf16,NVIDIA GeForce RTX 4060,c11,32,128,32,4,2,8,0.0,0.0,164.86400365829468,233.43775734305373,0.4070558915886403,0,3,3,0_4_4_r0,0,
2026-03-02T09:32:07.560736+00:00,B2,llm_style,tune,llm_style_tune_026,4,2048,1024,bf16,NVIDIA GeForce RTX 4060,c00,32,32,32,2,2,8,0.0,0.0,35.711999982595444,84.06976010650384,0.4697921149242978,0,3,3,0_4_3_r0,0,
2026-03-02T09:32:07.603043+00:00,B2,llm_style,tune,llm_style_tune_027,64,2048,4096,bf16,NVIDIA GeForce RTX 4060,c04,64,64,64,4,3,8,0.0,0.0,82.94399827718735,194.52063724398602,12.945382984935252,1,3,3,1_4_4_r0,0,
2026-03-02T09:32:07.623560+00:00,B2,llm_style,tune,llm_style_tune_028,32,1024,4096,bf16,NVIDIA GeForce RTX 4060,c04,64,64,64,4,3,8,0.0,0.0,61.40800006687641,124.93824109435072,4.371343403264399,0,3,3,1_3_4_r0,0,
2026-03-02T09:32:07.634509+00:00,B2,llm_style,tune,llm_style_tune_029,32,2048,1024,bf16,NVIDIA GeForce RTX 4060,c04,64,64,64,4,3,8,0.0,0.0,42.49599948525429,55.9513586387038,3.158361484039746,0,3,3,1_4_3_r0,0,
2026-03-02T09:32:07.652423+00:00,B2,llm_style,tune,llm_style_tune_030,4,2048,2048,bf16,NVIDIA GeForce RTX 4060,c11,32,128,32,4,2,8,0.0,0.0,66.8799988925457,203.55904132127745,0.5017110130924345,0,3,3,0_4_4_r0,0,
2026-03-02T09:32:07.989331+00:00,B2,llm_style,tune,llm_style_tune_031,1,8192,8192,bf16,NVIDIA GeForce RTX 4060,c11,32,128,32,4,2,8,0.0,0.0,563.6000037193298,1031.3727980852123,0.2381435896278663,0,3,3,0_4_4_r0,0,
2026-03-02T09:32:08.018178+00:00,B2,llm_style,eval,llm_style_eval_000,2,1024,4096,bf16,NVIDIA GeForce RTX 4060,c00,32,32,32,2,2,8,0.0,0.0,89.90399911999702,193.46655711531628,0.18661256633986936,0,3,3,0_3_4_r0,0,
2026-03-02T09:32:08.358966+00:00,B2,llm_style,eval,llm_style_eval_001,2,8192,8192,bf16,NVIDIA GeForce RTX 4060,c11,32,128,32,4,2,8,0.0,0.0,913.919985294342,980.9676837921143,0.29371877223315807,0,3,3,0_4_4_r0,0,
2026-03-02T09:32:08.386724+00:00,B2,llm_style,eval,llm_style_eval_002,2,2048,2048,bf16,NVIDIA GeForce RTX 4060,c11,32,128,32,4,2,8,0.0,0.0,81.31199702620506,268.54400500655163,0.206331373150177,0,3,3,0_4_4_r0,0,
2026-03-02T09:32:08.434123+00:00,B2,llm_style,eval,llm_style_eval_003,8,1024,8192,bf16,NVIDIA GeForce RTX 4060,c00,32,32,32,2,2,8,0.0,0.0,151.5519991517067,187.88352385163296,0.8856216265787776,0,3,3,0_3_4_r0,0,
2026-03-02T09:32:08.527386+00:00,B2,llm_style,eval,llm_style_eval_004,64,2048,8192,bf16,NVIDIA GeForce RTX 4060,c04,64,64,64,4,3,8,0.0,0.0,276.94399654865265,383.08863162994373,7.754216284745269,1,3,3,1_4_4_r0,0,
2026-03-02T09:32:08.864077+00:00,B2,llm_style,eval,llm_style_eval_005,1,8192,8192,bf16,NVIDIA GeForce RTX 4060,c11,32,128,32,4,2,8,0.0,0.0,909.2160165309906,1066.097617149353,0.147619185715725,0,3,3,0_4_4_r0,0,
2026-03-02T09:32:08.915797+00:00,B2,llm_style,eval,llm_style_eval_006,1,1024,8192,bf16,NVIDIA GeForce RTX 4060,c00,32,32,32,2,2,8,0.0,0.0,169.40800100564957,193.17567408084864,0.09903437795385175,0,3,3,0_3_4_r0,0,
2026-03-02T09:32:09.089118+00:00,B2,llm_style,eval,llm_style_eval_007,2,8192,4096,bf16,NVIDIA GeForce RTX 4060,c11,32,128,32,4,2,8,0.0,0.0,471.4079946279526,498.88895690441126,0.28471669876097055,0,3,3,0_4_4_r0,0,
2026-03-02T09:32:09.135539+00:00,B2,llm_style,eval,llm_style_eval_008,16,2048,4096,bf16,NVIDIA GeForce RTX 4060,c11,32,128,32,4,2,8,0.0,0.0,144.3839967250824,190.02591609954828,1.859177347134396,0,3,3,0_4_4_r0,0,
2026-03-02T09:32:09.227647+00:00,B2,llm_style,eval,llm_style_eval_009,32,2048,8192,bf16,NVIDIA GeForce RTX 4060,c04,64,64,64,4,3,8,0.0,0.0,306.5280020236969,314.89023834466934,3.5029159388739686,0,3,3,1_4_4_r0,0,
2026-03-02T09:32:09.300020+00:00,B2,llm_style,eval,llm_style_eval_010,1,1024,1024,bf16,NVIDIA GeForce RTX 4060,c04,64,64,64,4,3,8,0.0,72.316,51.19999870657921,89.64512210339296,0.040960001034736654,0,3,3,0_3_3_r0,0,anchor_skipped
2026-03-02T09:32:09.403766+00:00,B2,llm_style,eval,llm_style_eval_011,16,2048,8192,bf16,NVIDIA GeForce RTX 4060,c11,32,128,32,4,2,8,0.0,0.0,367.6159977912903,457.167049050331,1.4604122650418554,0,3,3,0_4_4_r0,0,
2026-03-02T09:32:09.754578+00:00,B2,llm_style,eval,llm_style_eval_012,8,8192,8192,bf16,NVIDIA GeForce RTX 4060,c11,32,128,32,4,2,8,0.0,0.0,904.0800034999847,1038.8271856307983,1.1876623969595608,0,3,3,0_4_4_r0,0,
2026-03-02T09:32:09.931658+00:00,B2,llm_style,eval,llm_style_eval_013,32,4096,8192,bf16,NVIDIA GeForce RTX 4060,c04,64,64,64,4,3,8,0.0,0.0,503.80802154541016,603.7334412336348,4.262503882754156,0,3,3,1_4_4_r0,0,
2026-03-02T09:32:09.942049+00:00,B2,llm_style,eval,llm_style_eval_014,64,1024,1024,bf16,NVIDIA GeForce RTX 4060,c04,64,64,64,4,3,8,0.0,0.0,53.247999399900436,105.61951786279664,2.520615413022465,1,3,3,1_3_3_r0,0,
2026-03-02T09:32:09.955616+00:00,B2,llm_style,eval,llm_style_eval_015,16,2048,1024,bf16,NVIDIA GeForce RTX 4060,c00,32,32,32,2,2,8,0.0,0.0,69.55200061202049,148.41568067669868,0.9648732374263543,0,3,3,0_4_3_r0,0,
2026-03-02T09:32:10.016679+00:00,B2,llm_style,eval,llm_style_eval_016,2,1024,8192,bf16,NVIDIA GeForce RTX 4060,c00,32,32,32,2,2,8,0.0,0.0,173.0239987373352,280.8217507600784,0.19392935225672606,0,3,3,0_3_4_r0,0,
2026-03-02T09:32:10.387546+00:00,B2,llm_style,eval,llm_style_eval_017,4,8192,8192,bf16,NVIDIA GeForce RTX 4060,c11,32,128,32,4,2,8,0.0,0.0,917.5040125846863,1057.2901844978333,0.5851428491169093,0,3,3,0_4_4_r0,0,
2026-03-02T09:32:10.414613+00:00,B2,llm_style,eval,llm_style_eval_018,4,1024,4096,bf16,NVIDIA GeForce RTX 4060,c00,32,32,32,2,2,8,0.0,0.0,126.97599828243256,230.11967912316317,0.2642580680906711,0,3,3,0_3_4_r0,0,
2026-03-02T09:32:10.462042+00:00,B2,llm_style,eval,llm_style_eval_019,8,4096,2048,bf16,NVIDIA GeForce RTX 4060,c11,32,128,32,4,2,8,0.0,0.0,116.56000092625618,216.1216056346893,1.151490450698566,0,3,3,0_4_4_r0,0,
2026-03-02T09:32:10.513078+00:00,B2,llm_style,eval,llm_style_eval_020,64,4096,2048,bf16,NVIDIA GeForce RTX 4060,c04,64,64,64,4,3,8,0.0,0.0,166.9120043516159,279.6339327096939,6.432981427375718,1,3,3,1_4_4_r0,0,
2026-03-02T09:32:10.684839+00:00,B2,llm_style,eval,llm_style_eval_021,1,4096,8192,bf16,NVIDIA GeForce RTX 4060,c11,32,128,32,4,2,8,0.0,0.0,478.7200093269348,559.1360086202621,0.14018395448803767,0,3,3,0_4_4_r0,0,
2026-03-02T09:32:10.708482+00:00,B2,llm_style,eval,llm_style_eval_022,32,1024,4096,bf16,NVIDIA GeForce RTX 4060,c04,64,64,64,4,3,8,0.0,0.0,131.071999669075,194.6419185400007,2.048000005170703,0,3,3,1_3_4_r0,0,
2026-03-02T09:32:10.719082+00:00,B2,llm_style,eval,llm_style_eval_023,4,1024,1024,bf16,NVIDIA GeForce RTX 4060,c04,64,64,64,4,3,8,0.0,0.0,75.77600330114365,199.87711966037745,0.11070269787999489,0,3,3,0_3_3_r0,0,
2026-03-02T09:32:10.742354+00:00,B2,llm_style,eval,llm_style_eval_024,64,2048,2048,bf16,NVIDIA GeForce RTX 4060,c04,64,64,64,4,3,8,0.0,0.0,139.26400244235992,244.2752043902874,3.8550587559208336,1,3,3,1_4_4_r0,0,
2026-03-02T09:32:11.121694+00:00,B2,llm_style,eval,llm_style_eval_025,32,8192,8192,bf16,NVIDIA GeForce RTX 4060,c04,64,64,64,4,3,8,0.0,0.0,1241.0719990730286,1281.8335855007172,3.4606914822088983,0,3,3,1_4_4_r0,0,
2026-03-02T09:32:11.178990+00:00,B2,llm_style,eval,llm_style_eval_026,4,2048,4096,bf16,NVIDIA GeForce RTX 4060,c11,32,128,32,4,2,8,0.0,0.0,239.53600227832794,364.95007902383793,0.28016191036712346,0,3,3,0_4_4_r0,0,
2026-03-02T09:32:11.268234+00:00,B2,llm_style,eval,llm_style_eval_027,8,8192,2048,bf16,NVIDIA GeForce RTX 4060,c11,32,128,32,4,2,8,0.0,0.0,263.16800713539124,292.4236708879471,1.020015536546199,0,3,3,0_4_4_r0,0,
2026-03-02T09:32:11.437757+00:00,B2,llm_style,eval,llm_style_eval_028,8,4096,8192,bf16,NVIDIA GeForce RTX 4060,c11,32,128,32,4,2,8,0.0,0.0,480.76799511909485,587.1104234457014,1.1166943670345764,0,3,3,0_4_4_r0,0,
2026-03-02T09:32:11.459976+00:00,B2,llm_style,eval,llm_style_eval_029,8,2048,2048,bf16,NVIDIA GeForce RTX 4060,c11,32,128,32,4,2,8,0.0,0.0,109.56799983978271,136.83712527155873,0.6124859822040271,0,3,3,0_4_4_r0,0,
2026-03-02T09:32:11.503635+00:00,B2,llm_style,eval,llm_style_eval_030,1,4096,2048,bf16,NVIDIA GeForce RTX 4060,c11,32,128,32,4,2,8,0.0,0.0,115.6960017979145,120.33024348318577,0.1450111995166839,0,3,3,0_4_4_r0,0,
2026-03-02T09:32:11.592191+00:00,B2,llm_style,eval,llm_style_eval_031,16,8192,2048,bf16,NVIDIA GeForce RTX 4060,c11,32,128,32,4,2,8,0.0,0.0,257.4079930782318,348.3830338716506,2.085680811927365,0,3,3,0_4_4_r0,0,
2026-03-02T09:32:11.621196+00:00,B2,llm_style,eval,llm_style_eval_032,1,2048,2048,bf16,NVIDIA GeForce RTX 4060,c11,32,128,32,4,2,8,0.0,0.0,103.93599793314934,120.37119969725609,0.08070936121088167,0,3,3,0_4_4_r0,0,
2026-03-02T09:32:11.807346+00:00,B2,llm_style,eval,llm_style_eval_033,16,8192,4096,bf16,NVIDIA GeForce RTX 4060,c11,32,128,32,4,2,8,0.0,0.0,473.60000014305115,599.8489660024642,2.267191350666545,0,3,3,0_4_4_r0,0,
2026-03-02T09:32:11.831324+00:00,B2,llm_style,eval,llm_style_eval_034,16,1024,4096,bf16,NVIDIA GeForce RTX 4060,c00,32,32,32,2,2,8,0.0,0.0,131.3760057091713,156.83584094047544,1.0216304512798133,0,3,3,0_3_4_r0,0,
2026-03-02T09:32:11.926525+00:00,B2,llm_style,eval,llm_style_eval_035,4,8192,2048,bf16,NVIDIA GeForce RTX 4060,c11,32,128,32,4,2,8,0.0,0.0,256.00001215934753,395.02849072217936,0.5242879750976575,0,3,3,0_4_4_r0,0,
2026-03-02T09:32:11.975824+00:00,B2,llm_style,eval,llm_style_eval_036,2,2048,4096,bf16,NVIDIA GeForce RTX 4060,c11,32,128,32,4,2,8,0.0,0.0,189.43999707698822,300.3315237164496,0.17712432705730838,0,3,3,0_4_4_r0,0,
2026-03-02T09:32:11.985426+00:00,B2,llm_style,eval,llm_style_eval_037,2,1024,1024,bf16,NVIDIA GeForce RTX 4060,c04,64,64,64,4,3,8,0.0,0.0,43.008001521229744,103.07583734393106,0.09752380607430909,0,3,3,0_3_3_r0,0,
2026-03-02T09:32:12.198469+00:00,B2,llm_style,eval,llm_style_eval_038,64,4096,8192,bf16,NVIDIA GeForce RTX 4060,c04,64,64,64,4,3,8,0.0,0.0,575.4239857196808,722.4831873178482,7.464004634127823,1,3,3,1_4_4_r0,0,
2026-03-02T09:32:12.212536+00:00,B2,llm_style,eval,llm_style_eval_039,4,1024,2048,bf16,NVIDIA GeForce RTX 4060,c00,32,32,32,2,2,8,0.0,0.0,77.82399654388428,150.1081623136997,0.21557895694214924,0,3,3,0_3_4_r0,0,
2026-03-02T09:32:12.262902+00:00,B2,llm_style,eval,llm_style_eval_040,64,8192,1024,bf16,NVIDIA GeForce RTX 4060,c04,64,64,64,4,3,8,0.0,0.0,145.4080045223236,278.43423277139664,7.384337798509263,1,3,3,1_4_3_r0,0,
2026-03-02T09:32:12.278693+00:00,B2,llm_style,eval,llm_style_eval_041,2,2048,1024,bf16,NVIDIA GeForce RTX 4060,c00,32,32,32,2,2,8,0.0,0.0,58.36800113320351,114.8211176693438,0.14371929545533155,0,3,3,0_4_3_r0,0,
2026-03-02T09:32:12.322031+00:00,B2,llm_style,eval,llm_style_eval_042,2,4096,2048,bf16,NVIDIA GeForce RTX 4060,c11,32,128,32,4,2,8,0.0,0.0,114.68800157308578,134.13664355874062,0.29257142455845464,0,3,3,0_4_4_r0,0,
2026-03-02T09:32:12.334549+00:00,B2,llm_style,eval,llm_style_eval_043,1,2048,1024,bf16,NVIDIA GeForce RTX 4060,c00,32,32,32,2,2,8,0.0,0.0,58.36800113320351,230.68672329187365,0.07185964772766577,0,3,3,0_4_3_r0,0,
2026-03-02T09:32:12.434658+00:00,B2,llm_style,eval,llm_style_eval_044,8,2048,8192,bf16,NVIDIA GeForce RTX 4060,c11,32,128,32,4,2,8,0.0,0.0,406.5279960632324,533.4959977865219,0.6603123489636538,0,3,3,0_4_4_r0,0,
2026-03-02T09:32:12.479680+00:00,B2,llm_style,eval,llm_style_eval_045,1,8192,1024,bf16,NVIDIA GeForce RTX 4060,c00,32,32,32,2,2,8,0.0,0.0,102.14400291442871,158.46207670867426,0.1642506218799271,0,3,3,0_4_3_r0,0,
2026-03-02T09:32:12.502419+00:00,B2,llm_style,eval,llm_style_eval_046,64,4096,1024,bf16,NVIDIA GeForce RTX 4060,c04,64,64,64,4,3,8,0.0,0.0,111.9839996099472,249.47520151734338,4.794175184579775,1,3,3,1_4_3_r0,0,
2026-03-02T09:32:12.526445+00:00,B2,llm_style,eval,llm_style_eval_047,16,2048,2048,bf16,NVIDIA GeForce RTX 4060,c11,32,128,32,4,2,8,0.0,0.0,111.96799948811531,174.00832280516616,1.1987150669262994,0,3,3,0_4_4_r0,0,
2026-03-02T09:32:12.705357+00:00,B2,llm_style,eval,llm_style_eval_048,8,8192,4096,bf16,NVIDIA GeForce RTX 4060,c11,32,128,32,4,2,8,0.0,0.0,451.4399915933609,505.93535155057907,1.1892409223762166,0,3,3,0_4_4_r0,0,
2026-03-02T09:32:12.880283+00:00,B2,llm_style,eval,llm_style_eval_049,4,4096,8192,bf16,NVIDIA GeForce RTX 4060,c11,32,128,32,4,2,8,0.0,0.0,504.7680139541626,538.1718277931213,0.5317996556421586,0,3,3,0_4_4_r0,0,
2026-03-02T09:32:12.983942+00:00,B2,llm_style,eval,llm_style_eval_050,4,2048,8192,bf16,NVIDIA GeForce RTX 4060,c11,32,128,32,4,2,8,0.0,0.0,408.51201117038727,563.3228766918182,0.3285527091736326,0,3,3,0_4_4_r0,0,
2026-03-02T09:32:12.995609+00:00,B2,llm_style,eval,llm_style_eval_051,16,1024,1024,bf16,NVIDIA GeForce RTX 4060,c04,64,64,64,4,3,8,0.0,0.0,69.63200122117996,256.4710448682307,0.4818823444901042,0,3,3,0_3_3_r0,0,
2026-03-02T09:32:13.195897+00:00,B2,llm_style,eval,llm_style_eval_052,32,8192,4096,bf16,NVIDIA GeForce RTX 4060,c04,64,64,64,4,3,8,0.0,0.0,809.9839985370636,860.631033182144,2.651266755736699,0,3,3,1_4_4_r0,0,
2026-03-02T09:32:13.212701+00:00,B2,llm_style,eval,llm_style_eval_053,32,1024,2048,bf16,NVIDIA GeForce RTX 4060,c04,64,64,64,4,3,8,0.0,0.0,111.58400028944016,221.42399564385397,1.2028402607170359,0,3,3,1_3_4_r0,0,
2026-03-02T09:32:13.317464+00:00,B2,llm_style,eval,llm_style_eval_054,64,8192,2048,bf16,NVIDIA GeForce RTX 4060,c04,64,64,64,4,3,8,0.0,0.0,433.00800025463104,549.0278470516205,4.959454898609653,1,3,3,1_4_4_r0,0,
2026-03-02T09:32:13.338784+00:00,B2,llm_style,eval,llm_style_eval_055,1,4096,1024,bf16,NVIDIA GeForce RTX 4060,c00,32,32,32,2,2,8,0.0,0.0,86.01599931716919,142.60223597288126,0.09752381029799413,0,3,3,0_4_3_r0,0,
2026-03-02T09:32:13.365634+00:00,B2,llm_style,eval,llm_style_eval_056,4,2048,2048,bf16,NVIDIA GeForce RTX 4060,c11,32,128,32,4,2,8,0.0,0.0,175.04000663757324,1055.1167741417853,0.19169578797763462,0,3,3,0_4_4_r0,0,
2026-03-02T09:32:13.425157+00:00,B2,llm_style,eval,llm_style_eval_057,16,1024,8192,bf16,NVIDIA GeForce RTX 4060,c00,32,32,32,2,2,8,0.0,0.0,326.6560137271881,422.96319782733906,0.8217679905449041,0,3,3,0_3_4_r0,0,
2026-03-02T09:32:13.595661+00:00,B2,llm_style,eval,llm_style_eval_058,1,8192,4096,bf16,NVIDIA GeForce RTX 4060,c11,32,128,32,4,2,8,0.0,0.0,485.3760004043579,605.573108792305,0.1382616032603442,0,3,3,0_4_4_r0,0,
2026-03-02T09:32:13.615920+00:00,B2,llm_style,eval,llm_style_eval_059,8,4096,1024,bf16,NVIDIA GeForce RTX 4060,c00,32,32,32,2,2,8,0.0,0.0,92.91199967265129,151.03999882936466,0.7222841423759987,0,3,3,0_4_3_r0,0,
2026-03-02T09:32:13.787542+00:00,B2,llm_style,eval,llm_style_eval_060,4,8192,4096,bf16,NVIDIA GeForce RTX 4060,c11,32,128,32,4,2,8,0.0,0.0,490.9120053052902,543.0195093154906,0.5468097196626193,0,3,3,0_4_4_r0,0,
2026-03-02T09:32:13.818639+00:00,B2,llm_style,eval,llm_style_eval_061,32,2048,2048,bf16,NVIDIA GeForce RTX 4060,c04,64,64,64,4,3,8,0.0,0.0,189.36000019311905,294.21983897685993,1.4175932389429433,0,3,3,1_4_4_r0,0,
2026-03-02T09:32:13.833064+00:00,B2,llm_style,eval,llm_style_eval_062,8,2048,1024,bf16,NVIDIA GeForce RTX 4060,c00,32,32,32,2,2,8,0.0,0.0,85.40799841284752,153.09824347496033,0.39287224409362304,0,3,3,0_4_3_r0,0,
2026-03-02T09:32:14.025701+00:00,B2,llm_style,eval,llm_style_eval_063,16,4096,8192,bf16,NVIDIA GeForce RTX 4060,c11,32,128,32,4,2,8,0.0,0.0,684.799998998642,712.4835246801376,1.5679641144423093,0,3,3,0_4_4_r0,0,
2026-03-02T09:32:14.193482+00:00,B2,training_style,tune,training_style_tune_000,4096,2048,1024,bf16,NVIDIA GeForce RTX 4060,c11,32,128,32,4,2,8,0.0,0.0,3215.791940689087,3280.7834243774414,5.342344747688701,3,3,3,4_4_3_r2,0,
2026-03-02T09:32:14.241397+00:00,B2,training_style,tune,training_style_tune_001,1536,2048,1536,bf16,NVIDIA GeForce RTX 4060,c11,32,128,32,4,2,8,0.0,0.0,361.4720106124878,412.3049715161323,26.734231509724946,3,3,3,4_4_4_r1,0,
2026-03-02T09:32:14.444335+00:00,B2,training_style,tune,training_style_tune_002,3072,2048,4096,bf16,NVIDIA GeForce RTX 4060,c11,32,128,32,4,2,8,0.0,0.0,1817.6000118255615,1883.3612549304962,28.355857843681807,3,3,3,4_4_4_r1,0,
2026-03-02T09:32:14.504413+00:00,B2,training_style,tune,training_style_tune_003,2048,1536,2048,bf16,NVIDIA GeForce RTX 4060,c11,32,128,32,4,2,8,0.0,0.0,472.57600724697113,686.202889084816,27.265247685895048,3,3,3,4_4_4_r1,0,
2026-03-02T09:32:14.514483+00:00,B2,training_style,tune,training_style_tune_004,512,512,1024,bf16,NVIDIA GeForce RTX 4060,c10,64,128,64,8,3,8,0.0,0.0,64.94399905204773,79.39071707427502,8.266674671046024,2,2,3,3_3_3_r1,0,
2026-03-02T09:32:14.981365+00:00,B2,training_style,tune,training_style_tune_005,1024,1536,1536,bf16,NVIDIA GeForce RTX 4060,c09,128,64,64,8,3,8,0.0,466.816,177.15199291706085,193.47071707248685,27.27509935641635,3,3,3,3_4_4_r1,0,
2026-03-02T09:32:15.151778+00:00,B2,training_style,tune,training_style_tune_006,1024,1536,512,bf16,NVIDIA GeForce RTX 4060,c05,128,64,32,4,3,8,0.0,170.358,83.77599716186523,90.15296071767807,19.225229069945936,3,3,2,3_4_3_r1,0,
2026-03-02T09:32:15.172089+00:00,B2,training_style,tune,training_style_tune_007,2048,1536,512,bf16,NVIDIA GeForce RTX 4060,c10,64,128,64,8,3,8,0.0,0.0,135.6479972600937,207.74976208806038,23.746944570243596,3,3,2,4_4_3_r1,0,
2026-03-02T09:32:15.265336+00:00,B2,training_style,tune,training_style_tune_008,3072,3072,1536,bf16,NVIDIA GeForce RTX 4060,c11,32,128,32,4,2,8,0.0,0.0,932.7200055122375,1076.7565095424652,31.082242341396448,3,3,3,4_4_4_r1,0,
2026-03-02T09:32:15.283907+00:00,B2,training_style,tune,training_style_tune_009,1024,1536,1024,bf16,NVIDIA GeForce RTX 4060,c05,128,64,32,4,3,8,0.0,0.0,128.83199751377106,137.57056415081024,25.003303016051415,3,3,3,3_4_3_r1,0,
2026-03-02T09:32:15.390148+00:00,B2,training_style,tune,training_style_tune_010,1536,2048,4096,bf16,NVIDIA GeForce RTX 4060,c11,32,128,32,4,2,8,0.0,0.0,863.0879819393158,995.7913792133331,29.85767884068613,3,3,3,4_4_4_r1,0,
2026-03-02T09:32:15.441313+00:00,B2,training_style,tune,training_style_tune_011,1024,1024,4096,bf16,NVIDIA GeForce RTX 4060,c10,64,128,64,8,3,8,0.0,0.0,320.51199674606323,409.36448067426676,26.800664808829836,3,3,3,3_3_4_r1,0,
2026-03-02T09:32:15.789666+00:00,B2,training_style,tune,training_style_tune_012,3072,4096,4096,bf16,NVIDIA GeForce RTX 4060,c11,32,128,32,4,2,8,0.0,0.0,3578.368067741394,3680.7356333732605,28.806208068210793,3,3,3,4_4_4_r1,0,
2026-03-02T09:32:16.047609+00:00,B2,training_style,tune,training_style_tune_013,512,1024,3072,bf16,NVIDIA GeForce RTX 4060,c05,128,64,32,4,3,8,0.0,257.882,141.9999971985817,202.75199368596054,22.68468687006547,2,3,3,3_3_4_r0,0,
2026-03-02T09:32:16.069961+00:00,B2,training_style,tune,training_style_tune_014,1536,1024,1024,bf16,NVIDIA GeForce RTX 4060,c09,128,64,64,8,3,8,0.0,0.0,132.9759955406189,227.80960202217102,24.224112471608027,3,3,3,4_3_3_r1,0,
2026-03-02T09:32:16.140074+00:00,B2,training_style,tune,training_style_tune_015,2048,3072,1536,bf16,NVIDIA GeForce RTX 4060,c11,32,128,32,4,2,8,0.0,0.0,635.2960169315338,798.4396928548813,30.42259406150648,3,3,3,4_4_4_r1,0,
2026-03-02T09:32:17.930254+00:00,B2,training_style,tune,training_style_tune_016,1536,3072,3072,bf16,NVIDIA GeForce RTX 4060,c03,64,64,32,4,2,8,0.0,1790.116,934.9120259284973,1172.2288298606873,31.009366062232314,3,3,3,4_4_4_r0,0,
2026-03-02T09:32:17.967611+00:00,B2,training_style,tune,training_style_tune_017,1024,1024,2048,bf16,NVIDIA GeForce RTX 4060,c10,64,128,64,8,3,8,0.0,0.0,156.70400112867355,375.74336558580353,27.408153365996668,3,3,3,3_3_4_r1,0,
2026-03-02T09:32:18.000475+00:00,B2,training_style,tune,training_style_tune_018,1536,1536,1536,bf16,NVIDIA GeForce RTX 4060,c11,32,128,32,4,2,8,0.0,0.0,262.07999885082245,338.2476750016212,27.65475176961317,3,3,3,4_4_4_r1,0,
2026-03-02T09:32:18.045383+00:00,B2,training_style,tune,training_style_tune_019,1536,1536,2048,bf16,NVIDIA GeForce RTX 4060,c11,32,128,32,4,2,8,0.0,0.0,337.92001008987427,422.5910422205925,28.597526418840417,3,3,3,4_4_4_r1,0,
2026-03-02T09:32:18.070860+00:00,B2,training_style,tune,training_style_tune_020,1536,1536,1024,bf16,NVIDIA GeForce RTX 4060,c10,64,128,64,8,3,8,0.0,0.0,180.976003408432,220.20095989108086,26.698778384973863,3,3,3,4_4_3_r1,0,
2026-03-02T09:32:18.105788+00:00,B2,training_style,tune,training_style_tune_021,1024,2048,1536,bf16,NVIDIA GeForce RTX 4060,c09,128,64,64,8,3,8,0.0,0.0,228.83199900388718,292.7072009444237,28.153627866925035,3,3,3,3_4_4_r0,0,
2026-03-02T09:32:18.122152+00:00,B2,training_style,tune,training_style_tune_022,512,1024,1536,bf16,NVIDIA GeForce RTX 4060,c05,128,64,32,4,3,8,0.0,0.0,85.90399846434593,95.06080083549023,18.7489845035383,2,3,3,3_3_4_r0,0,
2026-03-02T09:32:18.171350+00:00,B2,training_style,tune,training_style_tune_023,1536,2048,2048,bf16,NVIDIA GeForce RTX 4060,c11,32,128,32,4,2,8,0.0,0.0,440.6399875879288,503.7715184688568,29.24133589993088,3,3,3,4_4_4_r1,0,
2026-03-02T09:32:18.187450+00:00,B2,training_style,tune,training_style_tune_024,1024,1024,1024,bf16,NVIDIA GeForce RTX 4060,c10,64,128,64,8,3,8,0.0,0.0,102.33599692583084,179.2899177968502,20.984636027500787,3,3,3,3_3_3_r1,0,
2026-03-02T09:32:18.886069+00:00,B2,training_style,tune,training_style_tune_025,1536,1024,4096,bf16,NVIDIA GeForce RTX 4060,c05,128,64,32,4,3,8,0.0,698.574,427.0080029964447,481.8227231502533,30.17484870911724,3,3,3,4_3_4_r1,0,
2026-03-02T09:32:19.403529+00:00,B2,training_style,tune,training_style_tune_026,2048,4096,512,bf16,NVIDIA GeForce RTX 4060,c05,128,64,32,4,3,8,0.0,517.407,300.03198981285095,331.0838362574577,28.630062405539118,3,3,2,4_4_3_r0,0,
2026-03-02T09:32:19.553855+00:00,B2,training_style,tune,training_style_tune_027,4096,4096,1536,bf16,NVIDIA GeForce RTX 4060,c11,32,128,32,4,2,8,0.0,0.0,1658.3679914474487,1732.5737118721008,31.078510811714022,3,3,3,4_4_4_r1,0,
2026-03-02T09:32:19.640985+00:00,B2,training_style,tune,training_style_tune_028,1536,1536,4096,bf16,NVIDIA GeForce RTX 4060,c11,32,128,32,4,2,8,0.0,0.0,631.2800049781799,669.5507264137268,30.61613337914615,3,3,3,4_4_4_r1,0,
2026-03-02T09:32:21.568075+00:00,B2,training_style,tune,training_style_tune_029,4096,2048,2048,bf16,NVIDIA GeForce RTX 4060,c07,128,128,32,8,3,8,0.0,1927.024,1121.1999654769897,1226.2707591056824,30.645504304294555,3,3,3,4_4_4_r2,0,
2026-03-02T09:32:21.594603+00:00,B2,training_style,tune,training_style_tune_030,2048,2048,512,bf16,NVIDIA GeForce RTX 4060,c10,64,128,64,8,3,8,0.0,0.0,182.608000934124,327.4022492766378,23.52014848215448,3,3,2,4_4_3_r1,0,
2026-03-02T09:32:21.610210+00:00,B2,training_style,tune,training_style_tune_031,512,512,1536,bf16,NVIDIA GeForce RTX 4060,c10,64,128,64,8,3,8,0.0,0.0,69.55200061202049,88.08927990496159,11.578478849116252,2,2,3,3_3_4_r1,0,
2026-03-02T09:32:21.688683+00:00,B2,training_style,eval,training_style_eval_000,2048,1536,3072,bf16,NVIDIA GeForce RTX 4060,c11,32,128,32,4,2,8,0.0,0.0,654.3359756469727,720.7590252161025,29.537353211995015,3,3,3,4_4_4_r1,0,
2026-03-02T09:32:21.733042+00:00,B2,training_style,eval,training_style_eval_001,1024,2048,2048,bf16,NVIDIA GeForce RTX 4060,c09,128,64,64,8,3,8,0.0,0.0,295.9839999675751,419.7369563579558,29.021618036586517,3,3,3,3_4_4_r0,0,
2026-03-02T09:32:21.777472+00:00,B2,training_style,eval,training_style_eval_002,1536,1024,3072,bf16,NVIDIA GeForce RTX 4060,c05,128,64,32,4,3,8,0.0,0.0,319.8559880256653,394.0454280376433,30.21258559406612,3,3,3,4_3_4_r1,0,
2026-03-02T09:32:21.891921+00:00,B2,training_style,eval,training_style_eval_003,1024,512,1024,bf16,NVIDIA GeForce RTX 4060,c05,128,64,32,4,3,8,0.0,114.386,66.65600091218948,73.19360218942165,16.10870453231231,3,2,3,3_3_3_r2,0,
2026-03-02T09:32:21.914533+00:00,B2,training_style,eval,training_style_eval_004,1024,2048,1024,bf16,NVIDIA GeForce RTX 4060,c06,64,128,32,4,3,8,0.0,0.0,161.1040011048317,222.8553636372088,26.65959421582106,3,3,3,3_4_3_r0,0,
2026-03-02T09:32:21.933279+00:00,B2,training_style,eval,training_style_eval_005,1024,512,1536,bf16,NVIDIA GeForce RTX 4060,c05,128,64,32,4,3,8,0.0,0.0,90.11200070381165,225.9804855287074,17.873454405855544,3,2,3,3_3_4_r2,0,
2026-03-02T09:32:21.985099+00:00,B2,training_style,eval,training_style_eval_006,2048,1536,2048,bf16,NVIDIA GeForce RTX 4060,c11,32,128,32,4,2,8,0.0,0.0,433.1519901752472,492.3392024636267,29.746837554150336,3,3,3,4_4_4_r1,0,
2026-03-02T09:32:22.015090+00:00,B2,training_style,eval,training_style_eval_007,1536,2048,1024,bf16,NVIDIA GeForce RTX 4060,c10,64,128,64,8,3,8,0.0,0.0,231.21599853038788,345.9571135044097,27.863344167135097,3,3,3,4_4_3_r1,0,
2026-03-02T09:32:22.031490+00:00,B2,training_style,eval,training_style_eval_008,512,512,2048,bf16,NVIDIA GeForce RTX 4060,c10,64,128,64,8,3,8,0.0,0.0,106.01599887013435,248.05727005004877,10.128111185513553,2,2,3,3_3_4_r1,0,
2026-03-02T09:32:22.050654+00:00,B2,training_style,eval,training_style_eval_009,1024,512,2048,bf16,NVIDIA GeForce RTX 4060,c05,128,64,32,4,3,8,0.0,0.0,117.72800236940384,248.48032206296898,18.24106079080219,3,2,3,3_3_4_r2,0,
2026-03-02T09:32:22.096470+00:00,B2,training_style,eval,training_style_eval_010,2048,3072,1024,bf16,NVIDIA GeForce RTX 4060,c10,64,128,64,8,3,8,0.0,0.0,426.7519861459732,456.55424237251276,30.19295119013843,3,3,3,4_4_3_r1,0,
2026-03-02T09:32:22.181458+00:00,B2,training_style,eval,training_style_eval_011,2048,4096,1536,bf16,NVIDIA GeForce RTX 4060,c03,64,64,32,4,2,8,0.0,0.0,799.7440099716187,829.3452841043472,32.222565539333665,3,3,3,4_4_4_r0,0,
2026-03-02T09:32:22.316250+00:00,B2,training_style,eval,training_style_eval_012,2048,3072,3072,bf16,NVIDIA GeForce RTX 4060,c11,32,128,32,4,2,8,0.0,0.0,1287.168025970459,1389.6745562553406,30.0308156232022,3,3,3,4_4_4_r1,0,
2026-03-02T09:32:22.381742+00:00,B2,training_style,eval,training_style_eval_013,3072,1536,1536,bf16,NVIDIA GeForce RTX 4060,c07,128,128,32,8,3,8,0.0,0.0,468.04800629615784,603.740137219429,30.970145004373652,3,3,3,4_4_4_r2,0,
2026-03-02T09:32:22.421707+00:00,B2,training_style,eval,training_style_eval_014,2048,1536,1536,bf16,NVIDIA GeForce RTX 4060,c11,32,128,32,4,2,8,0.0,0.0,334.84798669815063,482.2528180480002,28.859891054717135,3,3,3,4_4_4_r1,0,
2026-03-02T09:32:22.480683+00:00,B2,training_style,eval,training_style_eval_015,4096,2048,1024,bf16,NVIDIA GeForce RTX 4060,c11,32,128,32,4,2,8,0.0,0.0,570.8159804344177,594.0019422769547,30.097036125241825,3,3,3,4_4_3_r2,0,
2026-03-02T09:32:22.496507+00:00,B2,training_style,eval,training_style_eval_016,2048,1024,512,bf16,NVIDIA GeForce RTX 4060,c05,128,64,32,4,3,8,0.0,0.0,125.95200538635254,190.35551905632013,17.050015531016623,3,3,2,4_3_3_r2,0,
2026-03-02T09:32:22.621713+00:00,B2,training_style,eval,training_style_eval_017,2048,4096,2048,bf16,NVIDIA GeForce RTX 4060,c03,64,64,32,4,2,8,0.0,0.0,1083.3920240402222,1253.4579277038574,31.714963379427978,3,3,3,4_4_4_r0,0,
2026-03-02T09:32:22.706194+00:00,B2,training_style,eval,training_style_eval_018,1536,2048,3072,bf16,NVIDIA GeForce RTX 4060,c11,32,128,32,4,2,8,0.0,0.0,643.1680023670197,668.2294356822968,30.050240000855908,3,3,3,4_4_4_r1,0,
2026-03-02T09:32:22.765646+00:00,B2,training_style,eval,training_style_eval_019,1536,1536,3072,bf16,NVIDIA GeForce RTX 4060,c11,32,128,32,4,2,8,0.0,0.0,481.32799565792084,603.2384026050568,30.115669054708263,3,3,3,4_4_4_r1,0,
2026-03-02T09:32:22.834672+00:00,B2,training_style,eval,training_style_eval_020,3072,1536,2048,bf16,NVIDIA GeForce RTX 4060,c07,128,128,32,8,3,8,0.0,0.0,617.4719929695129,713.2979226112365,31.300776475791135,3,3,3,4_4_4_r2,0,
2026-03-02T09:32:22.915597+00:00,B2,training_style,eval,training_style_eval_021,2048,1024,4096,bf16,NVIDIA GeForce RTX 4060,c05,128,64,32,4,3,8,0.0,0.0,557.8719973564148,629.1737520694733,30.795360343251062,3,3,3,4_3_4_r2,0,
2026-03-02T09:32:22.928633+00:00,B2,training_style,eval,training_style_eval_022,512,512,1536,bf16,NVIDIA GeForce RTX 4060,c10,64,128,64,8,3,8,0.0,0.0,71.63200154900551,201.39584504067864,11.242270920617328,2,2,3,3_3_4_r1,0,
2026-03-02T09:32:23.274497+00:00,B2,training_style,eval,training_style_eval_023,3072,4096,4096,bf16,NVIDIA GeForce RTX 4060,c11,32,128,32,4,2,8,0.0,0.0,3501.055955886841,3592.1919345855713,29.442321517506095,3,3,3,4_4_4_r1,0,
2026-03-02T09:32:23.340524+00:00,B2,training_style,eval,training_style_eval_024,1536,1024,4096,bf16,NVIDIA GeForce RTX 4060,c05,128,64,32,4,3,8,0.0,0.0,392.64000952243805,539.4636836647986,32.8160696197815,3,3,3,4_3_4_r1,0,
2026-03-02T09:32:23.501126+00:00,B2,training_style,eval,training_style_eval_025,4096,3072,2048,bf16,NVIDIA GeForce RTX 4060,c11,32,128,32,4,2,8,0.0,0.0,1700.8639574050903,1785.6035351753235,30.30201641207742,3,3,3,4_4_4_r1,0,
2026-03-02T09:32:23.518745+00:00,B2,training_style,eval,training_style_eval_026,1024,512,512,bf16,NVIDIA GeForce RTX 4060,c05,128,64,32,4,3,8,0.0,0.0,81.91999793052673,191.01696491241444,6.5536001655578655,3,2,2,3_3_3_r2,0,
2026-03-02T09:32:23.576991+00:00,B2,training_style,eval,training_style_eval_027,2048,4096,1024,bf16,NVIDIA GeForce RTX 4060,c05,128,64,32,4,3,8,0.0,0.0,535.5519950389862,634.9011147022246,32.07880718052291,3,3,3,4_4_3_r0,0,
2026-03-02T09:32:23.601631+00:00,B2,training_style,eval,training_style_eval_028,1536,1536,1024,bf16,NVIDIA GeForce RTX 4060,c10,64,128,64,8,3,8,0.0,0.0,178.25599759817123,193.5769584774971,27.106174676332856,3,3,3,4_4_3_r1,0,
2026-03-02T09:32:23.635728+00:00,B2,training_style,eval,training_style_eval_029,1024,512,4096,bf16,NVIDIA GeForce RTX 4060,c05,128,64,32,4,3,8,0.0,0.0,156.67199343442917,304.3225473165511,27.4137527828006,3,2,3,3_3_4_r2,0,
2026-03-02T09:32:23.675849+00:00,B2,training_style,eval,training_style_eval_030,1024,1024,3072,bf16,NVIDIA GeForce RTX 4060,c10,64,128,64,8,3,8,0.0,0.0,248.75199794769287,307.3945707082747,25.899092257159303,3,3,3,3_3_4_r1,0,
2026-03-02T09:32:23.688221+00:00,B2,training_style,eval,training_style_eval_031,1024,1024,512,bf16,NVIDIA GeForce RTX 4060,c10,64,128,64,8,3,8,0.0,0.0,73.00800085067749,223.12608376145363,14.707180192430044,3,3,2,3_3_3_r1,0,
2026-03-02T09:32:23.699804+00:00,B2,training_style,eval,training_style_eval_032,512,1024,1024,bf16,NVIDIA GeForce RTX 4060,c10,64,128,64,8,3,8,0.0,0.0,75.77600330114365,96.162561327219,14.169945328639345,2,3,3,3_3_3_r0,0,
2026-03-02T09:32:23.784379+00:00,B2,training_style,eval,training_style_eval_033,3072,2048,2048,bf16,NVIDIA GeForce RTX 4060,c11,32,128,32,4,2,8,0.0,0.0,843.2639837265015,973.8649541139603,30.559592575173948,3,3,3,4_4_4_r1,0,
2026-03-02T09:32:23.795930+00:00,B2,training_style,eval,training_style_eval_034,1536,1024,512,bf16,NVIDIA GeForce RTX 4060,c09,128,64,64,8,3,8,0.0,0.0,82.71999657154083,117.86847874522206,19.470657673529434,3,3,2,4_3_3_r1,0,
2026-03-02T09:32:24.227224+00:00,B2,training_style,eval,training_style_eval_035,4096,4096,4096,bf16,NVIDIA GeForce RTX 4060,c11,32,128,32,4,2,8,0.0,0.0,4896.111965179443,5059.043998718262,28.071039724877462,3,3,3,4_4_4_r1,0,
2026-03-02T09:32:24.475544+00:00,B2,training_style,eval,training_style_eval_036,2048,4096,4096,bf16,NVIDIA GeForce RTX 4060,c03,64,64,32,4,2,8,0.0,0.0,2199.0400552749634,2349.654166698456,31.249761263401574,3,3,3,4_4_4_r0,0,
2026-03-02T09:32:24.521374+00:00,B2,training_style,eval,training_style_eval_037,4096,2048,512,bf16,NVIDIA GeForce RTX 4060,c11,32,128,32,4,2,8,0.0,0.0,310.2720081806183,343.03998947143555,27.68517418754563,3,3,2,4_4_3_r2,0,
2026-03-02T09:32:24.537246+00:00,B2,training_style,eval,training_style_eval_038,2048,1536,512,bf16,NVIDIA GeForce RTX 4060,c10,64,128,64,8,3,8,0.0,0.0,134.14399325847626,144.89408031105995,24.01319204649857,3,3,2,4_4_3_r1,0,
2026-03-02T09:32:24.626449+00:00,B2,training_style,eval,training_style_eval_039,3072,3072,1536,bf16,NVIDIA GeForce RTX 4060,c11,32,128,32,4,2,8,0.0,0.0,941.0560131072998,1012.9331105947495,30.806911431630613,3,3,3,4_4_4_r1,0,
2026-03-02T09:32:24.645132+00:00,B2,training_style,eval,training_style_eval_040,1536,1536,512,bf16,NVIDIA GeForce RTX 4060,c10,64,128,64,8,3,8,0.0,0.0,117.44000017642975,205.77119812369347,20.57151822522626,3,3,2,4_4_3_r1,0,
2026-03-02T09:32:24.765157+00:00,B2,training_style,eval,training_style_eval_041,3072,3072,2048,bf16,NVIDIA GeForce RTX 4060,c11,32,128,32,4,2,8,0.0,0.0,1238.0160093307495,1445.2735674381252,31.223106464427772,3,3,3,4_4_4_r1,0,
2026-03-02T09:32:24.889425+00:00,B2,training_style,eval,training_style_eval_042,3072,4096,1536,bf16,NVIDIA GeForce RTX 4060,c11,32,128,32,4,2,8,0.0,0.0,1290.063977241516,1404.3136203289032,29.963402083866846,3,3,3,4_4_4_r1,0,
2026-03-02T09:32:24.964742+00:00,B2,training_style,eval,training_style_eval_043,2048,3072,1536,bf16,NVIDIA GeForce RTX 4060,c11,32,128,32,4,2,8,0.0,0.0,641.0239934921265,718.7148958444594,30.150747909933568,3,3,3,4_4_4_r1,0,
2026-03-02T09:32:24.993600+00:00,B2,training_style,eval,training_style_eval_044,512,512,4096,bf16,NVIDIA GeForce RTX 4060,c10,64,128,64,8,3,8,0.0,0.0,156.97599947452545,250.283842086792,13.680331102771543,2,2,3,3_3_4_r1,0,
2026-03-02T09:32:25.052650+00:00,B2,training_style,eval,training_style_eval_045,2048,1024,3072,bf16,NVIDIA GeForce RTX 4060,c05,128,64,32,4,3,8,0.0,0.0,432.12801218032837,511.6621005535126,29.817326173761426,3,3,3,4_3_4_r2,0,
2026-03-02T09:32:25.398539+00:00,B2,training_style,eval,training_style_eval_046,4096,3072,4096,bf16,NVIDIA GeForce RTX 4060,c11,32,128,32,4,2,8,0.0,0.0,3515.920042991638,3698.800666332245,29.31784962216934,3,3,3,4_4_4_r1,0,
2026-03-02T09:32:25.444687+00:00,B2,training_style,eval,training_style_eval_047,1536,3072,1024,bf16,NVIDIA GeForce RTX 4060,c05,128,64,32,4,3,8,0.0,0.0,335.6480002403259,460.9913590550422,28.791103802438126,3,3,3,4_4_3_r0,0,
2026-03-02T09:32:25.465487+00:00,B2,training_style,eval,training_style_eval_048,512,512,3072,bf16,NVIDIA GeForce RTX 4060,c10,64,128,64,8,3,8,0.0,0.0,107.42399841547012,170.44704452157018,14.99304401024842,2,2,3,3_3_4_r1,0,
2026-03-02T09:32:25.495427+00:00,B2,training_style,eval,training_style_eval_049,512,1024,4096,bf16,NVIDIA GeForce RTX 4060,c05,128,64,32,4,3,8,0.0,0.0,172.03199863433838,247.14464023709274,24.966095436286498,2,3,3,3_3_4_r0,0,
2026-03-02T09:32:25.520228+00:00,B2,training_style,eval,training_style_eval_050,3072,2048,512,bf16,NVIDIA GeForce RTX 4060,c10,64,128,64,8,3,8,0.0,0.0,244.73600089550018,260.09601354599,26.324083585687344,3,3,2,4_4_3_r1,0,
2026-03-02T09:32:25.529684+00:00,B2,training_style,eval,training_style_eval_051,512,512,1024,bf16,NVIDIA GeForce RTX 4060,c10,64,128,64,8,3,8,0.0,0.0,67.58400052785873,113.24416108429429,7.943757513713575,2,2,3,3_3_3_r1,0,
2026-03-02T09:32:25.571600+00:00,B2,training_style,eval,training_style_eval_052,1536,2048,1536,bf16,NVIDIA GeForce RTX 4060,c11,32,128,32,4,2,8,0.0,0.0,340.4479920864105,396.0284787416457,28.385176710183742,3,3,3,4_4_4_r1,0,
2026-03-02T09:32:25.671705+00:00,B2,training_style,eval,training_style_eval_053,1536,3072,3072,bf16,NVIDIA GeForce RTX 4060,c03,64,64,32,4,2,8,0.0,0.0,897.0239758491516,977.0086544752119,32.31912415780879,3,3,3,4_4_4_r0,0,
2026-03-02T09:32:25.721194+00:00,B2,training_style,eval,training_style_eval_054,4096,3072,512,bf16,NVIDIA GeForce RTX 4060,c10,64,128,64,8,3,8,0.0,0.0,439.7120028734207,684.9523293972014,29.303047912724725,3,3,2,4_4_3_r1,0,
2026-03-02T09:32:25.742759+00:00,B2,training_style,eval,training_style_eval_055,1024,1024,1024,bf16,NVIDIA GeForce RTX 4060,c10,64,128,64,8,3,8,0.0,0.0,112.12800070643425,233.56416076421726,19.152072938697913,3,3,3,3_3_3_r1,0,
2026-03-02T09:32:25.774455+00:00,B2,training_style,eval,training_style_eval_056,512,1024,3072,bf16,NVIDIA GeForce RTX 4060,c05,128,64,32,4,3,8,0.0,0.0,138.2399946451187,257.7612777054308,23.30168979150595,2,3,3,3_3_4_r0,0,
2026-03-02T09:32:25.795272+00:00,B2,training_style,eval,training_style_eval_057,1024,1536,1024,bf16,NVIDIA GeForce RTX 4060,c05,128,64,32,4,3,8,0.0,0.0,135.16800105571747,199.09439489245412,23.831272541140724,3,3,3,3_4_3_r1,0,
2026-03-02T09:32:25.915384+00:00,B2,training_style,eval,training_style_eval_058,4096,2048,2048,bf16,NVIDIA GeForce RTX 4060,c07,128,128,32,8,3,8,0.0,0.0,1098.2239842414856,1138.4102475643158,31.28663993960337,3,3,3,4_4_4_r2,0,
2026-03-02T09:32:25.949339+00:00,B2,training_style,eval,training_style_eval_059,2048,3072,512,bf16,NVIDIA GeForce RTX 4060,c10,64,128,64,8,3,8,0.0,0.0,243.71200054883957,377.5180771946907,26.434689016099316,3,3,2,4_4_3_r1,0,
2026-03-02T09:32:25.982630+00:00,B2,training_style,eval,training_style_eval_060,3072,3072,512,bf16,NVIDIA GeForce RTX 4060,c10,64,128,64,8,3,8,0.0,0.0,329.72800731658936,424.30463463067997,29.308024194382106,3,3,2,4_4_3_r1,0,
2026-03-02T09:32:26.042712+00:00,B2,training_style,eval,training_style_eval_061,2048,2048,2048,bf16,NVIDIA GeForce RTX 4060,c11,32,128,32,4,2,8,0.0,0.0,572.9280114173889,665.5161499977111,29.986086980627903,3,3,3,4_4_4_r1,0,
2026-03-02T09:32:26.059615+00:00,B2,training_style,eval,training_style_eval_062,1024,2048,512,bf16,NVIDIA GeForce RTX 4060,c06,64,128,32,4,3,8,0.0,0.0,99.34399649500847,191.9168001413345,21.61664241188344,3,3,2,3_4_3_r0,0,
2026-03-02T09:32:26.174979+00:00,B2,training_style,eval,training_style_eval_063,3072,1536,3072,bf16,NVIDIA GeForce RTX 4060,c07,128,128,32,8,3,8,0.0,0.0,881.8720281124115,1062.6771235466003,32.87441751617111,3,3,3,4_4_4_r2,0,
2026-03-02T09:32:26.187019+00:00,B2,adversarial,tune,adversarial_tune_000,1,1024,1024,bf16,NVIDIA GeForce RTX 4060,c04,64,64,64,4,3,8,0.0,0.0,34.352000802755356,117.12768144905567,0.06104890402284191,0,3,3,0_3_3_r0,0,
2026-03-02T09:32:26.205362+00:00,B2,adversarial,tune,adversarial_tune_001,1,1024,4096,bf16,NVIDIA GeForce RTX 4060,c00,32,32,32,2,2,8,0.0,0.0,57.42399953305721,103.1187183409929,0.1460819181563788,0,3,3,0_3_4_r0,0,
2026-03-02T09:32:26.221283+00:00,B2,adversarial,tune,adversarial_tune_002,1,4096,1024,bf16,NVIDIA GeForce RTX 4060,c00,32,32,32,2,2,8,0.0,0.0,38.91199827194214,72.99072038382286,0.21557895694214924,0,3,3,0_4_3_r0,0,
2026-03-02T09:32:26.311462+00:00,B2,adversarial,tune,adversarial_tune_003,1,4096,4096,bf16,NVIDIA GeForce RTX 4060,c11,32,128,32,4,2,8,0.0,0.0,164.8319959640503,325.6764814257622,0.20356746761301242,0,3,3,0_4_4_r0,0,
2026-03-02T09:32:26.351532+00:00,B2,adversarial,tune,adversarial_tune_004,1,8192,1024,bf16,NVIDIA GeForce RTX 4060,c00,32,32,32,2,2,8,0.0,0.0,50.863999873399734,149.00544092059133,0.32984460604274957,0,3,3,0_4_3_r0,0,
2026-03-02T09:32:26.519852+00:00,B2,adversarial,tune,adversarial_tune_005,1,8192,4096,bf16,NVIDIA GeForce RTX 4060,c11,32,128,32,4,2,8,0.0,0.0,295.4239994287491,319.5084837079048,0.2271611789487856,0,3,3,0_4_4_r0,0,
2026-03-02T09:32:26.528488+00:00,B2,adversarial,tune,adversarial_tune_006,2,1024,1024,bf16,NVIDIA GeForce RTX 4060,c04,64,64,64,4,3,8,0.0,0.0,36.86400130391121,157.69151948392357,0.11377777375336061,0,3,3,0_3_3_r0,0,
2026-03-02T09:32:26.548645+00:00,B2,adversarial,tune,adversarial_tune_007,2,1024,4096,bf16,NVIDIA GeForce RTX 4060,c00,32,32,32,2,2,8,0.0,0.0,81.37599751353264,170.28096154332144,0.20616909792362284,0,3,3,0_3_4_r0,0,
2026-03-02T09:32:26.567147+00:00,B2,adversarial,tune,adversarial_tune_008,2,4096,1024,bf16,NVIDIA GeForce RTX 4060,c00,32,32,32,2,2,8,0.0,0.0,58.320000767707825,153.80479976534838,0.2876751676808903,0,3,3,0_4_3_r0,0,
2026-03-02T09:32:26.655648+00:00,B2,adversarial,tune,adversarial_tune_009,2,4096,4096,bf16,NVIDIA GeForce RTX 4060,c11,32,128,32,4,2,8,0.0,0.0,164.86400365829468,196.75647825002665,0.4070558915886403,0,3,3,0_4_4_r0,0,
2026-03-02T09:32:26.695055+00:00,B2,adversarial,tune,adversarial_tune_010,2,8192,1024,bf16,NVIDIA GeForce RTX 4060,c00,32,32,32,2,2,8,0.0,0.0,47.42399975657463,123.64799700677389,0.7075411642255708,0,3,3,0_4_3_r0,0,
2026-03-02T09:32:26.856350+00:00,B2,adversarial,tune,adversarial_tune_011,2,8192,4096,bf16,NVIDIA GeForce RTX 4060,c11,32,128,32,4,2,8,0.0,0.0,293.88800263404846,385.35167604684824,0.45669686001823256,0,3,3,0_4_4_r0,0,
2026-03-02T09:32:26.864307+00:00,B2,adversarial,tune,adversarial_tune_012,4,1024,1024,bf16,NVIDIA GeForce RTX 4060,c04,64,64,64,4,3,8,0.0,0.0,34.832000732421875,61.08576003462073,0.24083049562501369,0,3,3,0_3_3_r0,0,
2026-03-02T09:32:26.883394+00:00,B2,adversarial,tune,adversarial_tune_013,4,1024,4096,bf16,NVIDIA GeForce RTX 4060,c00,32,32,32,2,2,8,0.0,0.0,62.00000084936619,125.09663738310333,0.5412005087148803,0,3,3,0_3_4_r0,0,
2026-03-02T09:32:26.901604+00:00,B2,adversarial,tune,adversarial_tune_014,4,4096,1024,bf16,NVIDIA GeForce RTX 4060,c00,32,32,32,2,2,8,0.0,0.0,46.81599885225296,144.16831612586958,0.7167300244067148,0,3,3,0_4_3_r0,0,
2026-03-02T09:32:26.987575+00:00,B2,adversarial,tune,adversarial_tune_015,4,4096,4096,bf16,NVIDIA GeForce RTX 4060,c11,32,128,32,4,2,8,0.0,0.0,164.86400365829468,312.15039625763865,0.8141117831772806,0,3,3,0_4_4_r0,0,
2026-03-02T09:32:27.028615+00:00,B2,adversarial,tune,adversarial_tune_016,4,8192,1024,bf16,NVIDIA GeForce RTX 4060,c00,32,32,32,2,2,8,0.0,0.0,64.38399851322174,150.43040126562119,1.0423220916641063,0,3,3,0_4_3_r0,0,
2026-03-02T09:32:27.191079+00:00,B2,adversarial,tune,adversarial_tune_017,4,8192,4096,bf16,NVIDIA GeForce RTX 4060,c11,32,128,32,4,2,8,0.0,0.0,293.5519963502884,350.39487451314915,0.9144392112383477,0,3,3,0_4_4_r0,0,
2026-03-02T09:32:27.199426+00:00,B2,adversarial,tune,adversarial_tune_018,8,1024,1024,bf16,NVIDIA GeForce RTX 4060,c04,64,64,64,4,3,8,0.0,0.0,34.88000109791756,65.40415965020648,0.4809981499972387,0,3,3,0_3_3_r0,0,
2026-03-02T09:32:27.218649+00:00,B2,adversarial,tune,adversarial_tune_019,8,1024,4096,bf16,NVIDIA GeForce RTX 4060,c00,32,32,32,2,2,8,0.0,0.0,64.51199948787689,126.93664051592337,1.0402539765119372,0,3,3,0_3_4_r0,0,
2026-03-02T09:32:27.235476+00:00,B2,adversarial,tune,adversarial_tune_020,8,4096,1024,bf16,NVIDIA GeForce RTX 4060,c00,32,32,32,2,2,8,0.0,0.0,40.73600098490715,66.68288204818961,1.64740922961152,0,3,3,0_4_3_r0,0,
2026-03-02T09:32:27.316530+00:00,B2,adversarial,tune,adversarial_tune_021,8,4096,4096,bf16,NVIDIA GeForce RTX 4060,c11,32,128,32,4,2,8,0.0,0.0,161.79199516773224,256.4812807738779,1.6591392900601099,0,3,3,0_4_4_r0,0,
2026-03-02T09:32:27.357657+00:00,B2,adversarial,tune,adversarial_tune_022,8,8192,1024,bf16,NVIDIA GeForce RTX 4060,c00,32,32,32,2,2,8,0.0,0.0,52.97600105404854,128.51968154311177,2.5335571830547368,0,3,3,0_4_3_r0,0,
2026-03-02T09:32:27.525121+00:00,B2,adversarial,tune,adversarial_tune_023,8,8192,4096,bf16,NVIDIA GeForce RTX 4060,c11,32,128,32,4,2,8,0.0,0.0,319.487988948822,348.205129802227,1.6804103145361124,0,3,3,0_4_4_r0,0,
2026-03-02T09:32:27.535866+00:00,B2,adversarial,tune,adversarial_tune_024,16,1024,1024,bf16,NVIDIA GeForce RTX 4060,c04,64,64,64,4,3,8,0.0,0.0,57.82400071620941,131.71711608767507,0.580285548983018,0,3,3,0_3_3_r0,0,
2026-03-02T09:32:27.554890+00:00,B2,adversarial,tune,adversarial_tune_025,16,1024,4096,bf16,NVIDIA GeForce RTX 4060,c00,32,32,32,2,2,8,0.0,0.0,64.51199948787689,190.69759666919703,2.0805079530238744,0,3,3,0_3_4_r0,0,
2026-03-02T09:32:27.575345+00:00,B2,adversarial,tune,adversarial_tune_026,16,4096,1024,bf16,NVIDIA GeForce RTX 4060,c00,32,32,32,2,2,8,0.0,0.0,66.56000018119812,152.63359904289246,2.016492302202755,0,3,3,0_4_3_r0,0,
2026-03-02T09:32:27.663342+00:00,B2,adversarial,tune,adversarial_tune_027,16,4096,4096,bf16,NVIDIA GeForce RTX 4060,c11,32,128,32,4,2,8,0.0,0.0,188.1759986281395,314.87168222665775,2.8530254438076743,0,3,3,0_4_4_r0,0,
2026-03-02T09:32:27.704371+00:00,B2,adversarial,tune,adversarial_tune_028,16,8192,1024,bf16,NVIDIA GeForce RTX 4060,c00,32,32,32,2,2,8,0.0,0.0,60.11199951171875,187.6752012968063,4.465588537737276,0,3,3,0_4_3_r0,0,
2026-03-02T09:32:27.866743+00:00,B2,adversarial,tune,adversarial_tune_029,16,8192,4096,bf16,NVIDIA GeForce RTX 4060,c11,32,128,32,4,2,8,0.0,0.0,296.9599962234497,321.03424072265625,3.6157793563280327,0,3,3,0_4_4_r0,0,
2026-03-02T09:32:27.878070+00:00,B2,adversarial,tune,adversarial_tune_030,32,1024,1024,bf16,NVIDIA GeForce RTX 4060,c04,64,64,64,4,3,8,0.0,0.0,61.343999579548836,162.0857629179954,1.093976011671288,0,3,3,1_3_3_r0,0,
2026-03-02T09:32:27.899069+00:00,B2,adversarial,tune,adversarial_tune_031,32,1024,4096,bf16,NVIDIA GeForce RTX 4060,c04,64,64,64,4,3,8,0.0,0.0,79.31199669837952,197.53567799925793,3.384550473755563,0,3,3,1_3_4_r0,0,
2026-03-02T09:32:27.908265+00:00,B2,adversarial,eval,adversarial_eval_000,1,1024,1024,bf16,NVIDIA GeForce RTX 4060,c04,64,64,64,4,3,8,0.0,0.0,43.98399963974953,57.87456072866915,0.04767988398455576,0,3,3,0_3_3_r0,0,
2026-03-02T09:32:27.928375+00:00,B2,adversarial,eval,adversarial_eval_001,1,1024,4096,bf16,NVIDIA GeForce RTX 4060,c00,32,32,32,2,2,8,0.0,0.0,61.43999844789505,74.08096119761467,0.13653333678245552,0,3,3,0_3_4_r0,0,
2026-03-02T09:32:27.946185+00:00,B2,adversarial,eval,adversarial_eval_002,1,4096,1024,bf16,NVIDIA GeForce RTX 4060,c00,32,32,32,2,2,8,0.0,0.0,43.007999658584595,151.48032277822486,0.19504762059598826,0,3,3,0_4_3_r0,0,
2026-03-02T09:32:28.032146+00:00,B2,adversarial,eval,adversarial_eval_003,1,4096,4096,bf16,NVIDIA GeForce RTX 4060,c11,32,128,32,4,2,8,0.0,0.0,166.9120043516159,179.7427174448967,0.20103066960549118,0,3,3,0_4_4_r0,0,
2026-03-02T09:32:28.077094+00:00,B2,adversarial,eval,adversarial_eval_004,1,8192,1024,bf16,NVIDIA GeForce RTX 4060,c00,32,32,32,2,2,8,0.0,0.0,95.07200121879578,185.6716831028461,0.17646852685250028,0,3,3,0_4_3_r0,0,
2026-03-02T09:32:28.260946+00:00,B2,adversarial,eval,adversarial_eval_005,1,8192,4096,bf16,NVIDIA GeForce RTX 4060,c11,32,128,32,4,2,8,0.0,0.0,494.4639950990677,620.1139283180236,0.13572042588571992,0,3,3,0_4_4_r0,0,
2026-03-02T09:32:28.272266+00:00,B2,adversarial,eval,adversarial_eval_006,2,1024,1024,bf16,NVIDIA GeForce RTX 4060,c04,64,64,64,4,3,8,0.0,0.0,69.50400024652481,134.7932808101177,0.06034622446367344,0,3,3,0_3_3_r0,0,
2026-03-02T09:32:28.294536+00:00,B2,adversarial,eval,adversarial_eval_007,2,1024,4096,bf16,NVIDIA GeForce RTX 4060,c00,32,32,32,2,2,8,0.0,0.0,110.08000001311302,180.86911782622334,0.152409302307426,0,3,3,0_3_4_r0,0,
2026-03-02T09:32:28.313413+00:00,B2,adversarial,eval,adversarial_eval_008,2,4096,1024,bf16,NVIDIA GeForce RTX 4060,c00,32,32,32,2,2,8,0.0,0.0,73.72800260782242,173.61120626330376,0.22755554750672122,0,3,3,0_4_3_r0,0,
2026-03-02T09:32:28.402233+00:00,B2,adversarial,eval,adversarial_eval_009,2,4096,4096,bf16,NVIDIA GeForce RTX 4060,c11,32,128,32,4,2,8,0.0,0.0,254.96000051498413,372.8179270029068,0.26321330351603905,0,3,3,0_4_4_r0,0,
2026-03-02T09:32:28.450292+00:00,B2,adversarial,eval,adversarial_eval_010,2,8192,1024,bf16,NVIDIA GeForce RTX 4060,c00,32,32,32,2,2,8,0.0,0.0,75.77600330114365,189.45503875613207,0.44281079151997954,0,3,3,0_4_3_r0,0,
2026-03-02T09:32:28.621898+00:00,B2,adversarial,eval,adversarial_eval_011,2,8192,4096,bf16,NVIDIA GeForce RTX 4060,c11,32,128,32,4,2,8,0.0,0.0,493.5680031776428,531.9865500926971,0.27193360820776896,0,3,3,0_4_4_r0,0,
2026-03-02T09:32:28.635739+00:00,B2,adversarial,eval,adversarial_eval_012,4,1024,1024,bf16,NVIDIA GeForce RTX 4060,c04,64,64,64,4,3,8,0.0,0.0,71.68000191450119,981.2070278823346,0.11702856830285527,0,3,3,0_3_3_r0,0,
2026-03-02T09:32:28.658288+00:00,B2,adversarial,eval,adversarial_eval_013,4,1024,4096,bf16,NVIDIA GeForce RTX 4060,c00,32,32,32,2,2,8,0.0,0.0,105.34399747848511,172.44416147470474,0.31852248636048747,0,3,3,0_3_4_r0,0,
2026-03-02T09:32:28.676491+00:00,B2,adversarial,eval,adversarial_eval_014,4,4096,1024,bf16,NVIDIA GeForce RTX 4060,c00,32,32,32,2,2,8,0.0,0.0,54.25599962472916,109.78304341435418,0.618446480243382,0,3,3,0_4_3_r0,0,
2026-03-02T09:32:28.766154+00:00,B2,adversarial,eval,adversarial_eval_015,4,4096,4096,bf16,NVIDIA GeForce RTX 4060,c11,32,128,32,4,2,8,0.0,0.0,253.83999943733215,333.27104091644276,0.5287493235798544,0,3,3,0_4_4_r0,0,
2026-03-02T09:32:28.807082+00:00,B2,adversarial,eval,adversarial_eval_016,4,8192,1024,bf16,NVIDIA GeForce RTX 4060,c00,32,32,32,2,2,8,0.0,0.0,74.75200295448303,146.13504096865648,0.8977533891749097,0,3,3,0_4_3_r0,0,
2026-03-02T09:32:28.979951+00:00,B2,adversarial,eval,adversarial_eval_017,4,8192,4096,bf16,NVIDIA GeForce RTX 4060,c11,32,128,32,4,2,8,0.0,0.0,471.0400104522705,516.8025600910187,0.5698782482240964,0,3,3,0_4_4_r0,0,
2026-03-02T09:32:28.991823+00:00,B2,adversarial,eval,adversarial_eval_018,8,1024,1024,bf16,NVIDIA GeForce RTX 4060,c04,64,64,64,4,3,8,0.0,0.0,28.51200010627508,989.9827326089107,0.5884264848998643,0,3,3,0_3_3_r0,0,
2026-03-02T09:32:29.017483+00:00,B2,adversarial,eval,adversarial_eval_019,8,1024,4096,bf16,NVIDIA GeForce RTX 4060,c00,32,32,32,2,2,8,0.0,0.0,74.73600283265114,179.74272459745387,0.8979455878884794,0,3,3,0_3_4_r0,0,
2026-03-02T09:32:29.036559+00:00,B2,adversarial,eval,adversarial_eval_020,8,4096,1024,bf16,NVIDIA GeForce RTX 4060,c00,32,32,32,2,2,8,0.0,0.0,77.82399654388428,180.039681047201,0.8623158277685969,0,3,3,0_4_3_r0,0,
2026-03-02T09:32:29.125679+00:00,B2,adversarial,eval,adversarial_eval_021,8,4096,4096,bf16,NVIDIA GeForce RTX 4060,c11,32,128,32,4,2,8,0.0,0.0,257.02399015426636,331.02303653955454,1.0443984463819291,0,3,3,0_4_4_r0,0,
2026-03-02T09:32:29.174121+00:00,B2,adversarial,eval,adversarial_eval_022,8,8192,1024,bf16,NVIDIA GeForce RTX 4060,c00,32,32,32,2,2,8,0.0,0.0,86.5279994904995,182.26175814867008,1.5511479381276656,0,3,3,0_4_3_r0,0,
2026-03-02T09:32:29.346056+00:00,B2,adversarial,eval,adversarial_eval_023,8,8192,4096,bf16,NVIDIA GeForce RTX 4060,c11,32,128,32,4,2,8,0.0,0.0,473.08799624443054,516.4076676964759,1.1348225198312043,0,3,3,0_4_4_r0,0,
2026-03-02T09:32:29.358163+00:00,B2,adversarial,eval,adversarial_eval_024,16,1024,1024,bf16,NVIDIA GeForce RTX 4060,c04,64,64,64,4,3,8,0.0,0.0,29.503999277949333,204.01152111589852,1.1372841926917303,0,3,3,0_3_3_r0,0,
2026-03-02T09:32:29.381253+00:00,B2,adversarial,eval,adversarial_eval_025,16,1024,4096,bf16,NVIDIA GeForce RTX 4060,c00,32,32,32,2,2,8,0.0,0.0,103.26400026679039,196.60032600164413,1.2997533279094193,0,3,3,0_3_4_r0,0,
2026-03-02T09:32:29.402497+00:00,B2,adversarial,eval,adversarial_eval_026,16,4096,1024,bf16,NVIDIA GeForce RTX 4060,c00,32,32,32,2,2,8,0.0,0.0,60.15999987721443,119.62368294596655,2.2310127705109073,0,3,3,0_4_3_r0,0,
2026-03-02T09:32:29.497852+00:00,B2,adversarial,eval,adversarial_eval_027,16,4096,4096,bf16,NVIDIA GeForce RTX 4060,c11,32,128,32,4,2,8,0.0,0.0,285.18399596214294,476.7232087254524,1.8825422169597046,0,3,3,0_4_4_r0,0,
2026-03-02T09:32:29.542258+00:00,B2,adversarial,eval,adversarial_eval_028,16,8192,1024,bf16,NVIDIA GeForce RTX 4060,c00,32,32,32,2,2,8,0.0,0.0,94.2080020904541,197.21216335892677,2.8493912411204825,0,3,3,0_4_3_r0,0,
2026-03-02T09:32:29.714315+00:00,B2,adversarial,eval,adversarial_eval_029,16,8192,4096,bf16,NVIDIA GeForce RTX 4060,c11,32,128,32,4,2,8,0.0,0.0,471.5519994497299,538.7184071540833,2.277038004828706,0,3,3,0_4_4_r0,0,
2026-03-02T09:32:29.723841+00:00,B2,adversarial,eval,adversarial_eval_030,32,1024,1024,bf16,NVIDIA GeForce RTX 4060,c04,64,64,64,4,3,8,0.0,0.0,50.175998359918594,131.41247868537891,1.337469431472392,0,3,3,1_3_3_r0,0,
2026-03-02T09:32:29.746842+00:00,B2,adversarial,eval,adversarial_eval_031,32,1024,4096,bf16,NVIDIA GeForce RTX 4060,c04,64,64,64,4,3,8,0.0,0.0,125.95200166106224,224.36864495277393,2.1312520044132506,0,3,3,1_3_4_r0,0,
2026-03-02T09:32:29.766833+00:00,B2,adversarial,eval,adversarial_eval_032,32,4096,1024,bf16,NVIDIA GeForce RTX 4060,c04,64,64,64,4,3,8,0.0,0.0,82.7840007841587,139.24576193094242,3.2426006650715893,0,3,3,1_4_3_r0,0,
2026-03-02T09:32:29.860936+00:00,B2,adversarial,eval,adversarial_eval_033,32,4096,4096,bf16,NVIDIA GeForce RTX 4060,c04,64,64,64,4,3,8,0.0,0.0,271.36000990867615,304.5625579357146,3.9568904215523815,0,3,3,1_4_4_r0,0,
2026-03-02T09:32:29.907039+00:00,B2,adversarial,eval,adversarial_eval_034,32,8192,1024,bf16,NVIDIA GeForce RTX 4060,c04,64,64,64,4,3,8,0.0,0.0,142.33599603176117,238.8582463562488,3.771856220264911,0,3,3,1_4_3_r0,0,
2026-03-02T09:32:30.079254+00:00,B2,adversarial,eval,adversarial_eval_035,32,8192,4096,bf16,NVIDIA GeForce RTX 4060,c04,64,64,64,4,3,8,0.0,0.0,521.1839973926544,614.3488252162933,4.120394445614778,0,3,3,1_4_4_r0,0,
2026-03-02T09:32:32.432225+00:00,B2,adversarial,eval,adversarial_eval_036,1024,1,512,bf16,NVIDIA GeForce RTX 4060,c04,64,64,64,4,3,8,0.0,2352.912,62.40000016987324,207.741434574127,0.016804102518356293,3,0,2,3_0_3_r2,0,anchor_skipped
2026-03-02T09:32:32.726353+00:00,B2,adversarial,eval,adversarial_eval_037,1024,1,2048,bf16,NVIDIA GeForce RTX 4060,c04,64,64,64,4,3,8,0.0,294.085,248.83200228214264,273.9302396774292,0.016855966923596158,3,0,3,3_0_4_r2,0,anchor_skipped
2026-03-02T09:32:32.799834+00:00,B2,adversarial,eval,adversarial_eval_038,2048,1,512,bf16,NVIDIA GeForce RTX 4060,c09,128,64,64,8,3,8,0.0,73.435,38.91199827194214,48.71167968958615,0.05389473923553731,3,0,2,4_0_3_r2,0,anchor_skipped
2026-03-02T09:32:32.894102+00:00,B2,adversarial,eval,adversarial_eval_039,2048,1,2048,bf16,NVIDIA GeForce RTX 4060,c00,32,32,32,2,2,8,0.0,94.222,61.423998326063156,223.92224088311173,0.13656890187235798,3,0,3,4_0_4_r2,0,anchor_skipped
2026-03-02T09:32:32.910961+00:00,B2,adversarial,eval,adversarial_eval_040,4096,1,512,bf16,NVIDIA GeForce RTX 4060,c09,128,64,64,8,3,8,0.0,0.0,56.384000927209854,133.02623584866524,0.07438819400940928,3,0,2,4_0_3_r2,0,
2026-03-02T09:32:32.954410+00:00,B2,adversarial,eval,adversarial_eval_041,4096,1,2048,bf16,NVIDIA GeForce RTX 4060,c00,32,32,32,2,2,8,0.0,0.0,72.60800153017044,177.3904033005237,0.2310656628254483,3,0,3,4_0_4_r2,0,
2026-03-02T09:32:33.165279+00:00,B2,adversarial,eval,adversarial_eval_042,1024,2,512,bf16,NVIDIA GeForce RTX 4060,c04,64,64,64,4,3,8,0.0,0.0,43.007999658584595,55.72447940707206,0.048761905148997066,3,0,2,3_0_3_r2,0,
2026-03-02T09:32:33.187585+00:00,B2,adversarial,eval,adversarial_eval_043,1024,2,2048,bf16,NVIDIA GeForce RTX 4060,c04,64,64,64,4,3,8,0.0,0.0,92.99200028181076,997.6524460315688,0.09020784556282754,3,0,3,3_0_4_r2,0,
2026-03-02T09:32:33.372374+00:00,B2,adversarial,eval,adversarial_eval_044,2048,2,512,bf16,NVIDIA GeForce RTX 4060,c09,128,64,64,8,3,8,0.0,0.0,44.03200000524521,51.72223888337612,0.09525581394214125,3,0,2,4_0_3_r2,0,
2026-03-02T09:32:33.527006+00:00,B2,adversarial,eval,adversarial_eval_045,2048,2,2048,bf16,NVIDIA GeForce RTX 4060,c00,32,32,32,2,2,8,0.0,0.0,75.1200020313263,153.323523402214,0.22333886510018494,3,0,3,4_0_4_r2,0,
2026-03-02T09:32:33.553291+00:00,B2,adversarial,eval,adversarial_eval_046,4096,2,512,bf16,NVIDIA GeForce RTX 4060,c09,128,64,64,8,3,8,0.0,0.0,64.51199948787689,206.1728021502494,0.13003174706399215,3,0,2,4_0_3_r2,0,
2026-03-02T09:32:33.601822+00:00,B2,adversarial,eval,adversarial_eval_047,4096,2,2048,bf16,NVIDIA GeForce RTX 4060,c00,32,32,32,2,2,8,0.0,0.0,88.01599964499474,186.88831999897957,0.38123105043786387,3,0,3,4_0_4_r2,0,
2026-03-02T09:32:33.611388+00:00,B2,adversarial,eval,adversarial_eval_048,1024,4,512,bf16,NVIDIA GeForce RTX 4060,c04,64,64,64,4,3,8,0.0,0.0,75.74400305747986,112.67072074115266,0.05537473371742801,3,0,2,3_0_3_r2,0,
2026-03-02T09:32:33.627408+00:00,B2,adversarial,eval,adversarial_eval_049,1024,4,2048,bf16,NVIDIA GeForce RTX 4060,c04,64,64,64,4,3,8,0.0,0.0,117.76000261306763,133.04031550884247,0.1424695620560241,3,0,3,3_0_4_r2,0,
2026-03-02T09:32:33.635643+00:00,B2,adversarial,eval,adversarial_eval_050,2048,4,512,bf16,NVIDIA GeForce RTX 4060,c09,128,64,64,8,3,8,0.0,0.0,46.81599885225296,91.41727946698657,0.1791825061016787,3,0,2,4_0_3_r2,0,
2026-03-02T09:32:33.656438+00:00,B2,adversarial,eval,adversarial_eval_051,2048,4,2048,bf16,NVIDIA GeForce RTX 4060,c00,32,32,32,2,2,8,0.0,0.0,101.88799723982811,165.73824062943453,0.32932664208737183,3,0,3,4_0_4_r2,0,
2026-03-02T09:32:33.670445+00:00,B2,adversarial,eval,adversarial_eval_052,4096,4,512,bf16,NVIDIA GeForce RTX 4060,c09,128,64,64,8,3,8,0.0,0.0,80.89599758386612,191.8857607245444,0.20739241125751373,3,0,2,4_0_3_r2,0,
2026-03-02T09:32:33.714649+00:00,B2,adversarial,eval,adversarial_eval_053,4096,4,2048,bf16,NVIDIA GeForce RTX 4060,c00,32,32,32,2,2,8,0.0,0.0,80.57600259780884,88.99167947471142,0.8328641510670441,3,0,3,4_0_4_r2,0,
2026-03-02T09:32:33.723078+00:00,B2,adversarial,eval,adversarial_eval_054,1024,8,512,bf16,NVIDIA GeForce RTX 4060,c04,64,64,64,4,3,8,0.0,0.0,58.159999549388885,149.08160150051114,0.1442332886002944,3,0,2,3_0_3_r2,0,
2026-03-02T09:32:33.742188+00:00,B2,adversarial,eval,adversarial_eval_055,1024,8,2048,bf16,NVIDIA GeForce RTX 4060,c04,64,64,64,4,3,8,0.0,0.0,137.26399838924408,230.5715233087539,0.2444518037777727,3,0,3,3_0_4_r2,0,
2026-03-02T09:32:33.751154+00:00,B2,adversarial,eval,adversarial_eval_056,2048,8,512,bf16,NVIDIA GeForce RTX 4060,c09,128,64,64,8,3,8,0.0,0.0,54.047999903559685,96.51968181133262,0.3104132628392606,3,0,2,4_0_3_r2,0,
2026-03-02T09:32:33.770295+00:00,B2,adversarial,eval,adversarial_eval_057,2048,8,2048,bf16,NVIDIA GeForce RTX 4060,c00,32,32,32,2,2,8,0.0,0.0,80.89599758386612,91.21312119066715,0.8295696450300549,3,0,3,4_0_4_r2,0,
2026-03-02T09:32:33.781598+00:00,B2,adversarial,eval,adversarial_eval_058,4096,8,512,bf16,NVIDIA GeForce RTX 4060,c09,128,64,64,8,3,8,0.0,0.0,61.43999844789505,89.41568031907074,0.5461333471298221,3,0,2,4_0_3_r2,0,
2026-03-02T09:32:33.824172+00:00,B2,adversarial,eval,adversarial_eval_059,4096,8,2048,bf16,NVIDIA GeForce RTX 4060,c00,32,32,32,2,2,8,0.0,0.0,70.14400139451027,115.8643237501382,1.9134598159737204,3,0,3,4_0_4_r2,0,
2026-03-02T09:32:33.980158+00:00,B2,adversarial,eval,adversarial_eval_060,64,64,8192,bf16,NVIDIA GeForce RTX 4060,c04,64,64,64,4,3,8,0.0,155.925,94.2080020904541,105.48863798379895,0.7123478102801206,1,1,3,1_1_4_r1,0,
2026-03-02T09:32:33.994190+00:00,B2,adversarial,eval,adversarial_eval_061,128,128,8192,bf16,NVIDIA GeForce RTX 4060,c04,64,64,64,4,3,8,0.0,0.0,84.54399928450584,156.7334407567978,3.175097680163747,1,1,3,2_2_4_r1,0,
2026-03-02T09:32:34.253199+00:00,B2,adversarial,eval,adversarial_eval_062,2048,128,8192,bf16,NVIDIA GeForce RTX 4060,c04,64,64,64,4,3,8,0.0,258.964,184.14399772882462,199.34208407998082,23.32396031895041,3,1,3,4_2_4_r2,0,anchor_skipped
2026-03-02T09:32:34.359280+00:00,B2,adversarial,eval,adversarial_eval_063,128,2048,8192,bf16,NVIDIA GeForce RTX 4060,c06,64,128,32,4,3,8,0.0,0.0,220.15999257564545,278.9801561832428,19.50839135554694,1,3,3,2_4_4_r0,0,
