results/B_sweep_baseline.csv
timestamp,method,workload,split,shape_id,M,N,K,dtype,gpu,config_id,BLOCK_M,BLOCK_N,BLOCK_K,num_warps,num_stages,GROUP_M,compile_time_ms,tune_time_ms,runtime_cost_us,p99_us,runtime_perf_tflops,bucket_m,bucket_n,bucket_k,cache_key,invalid_config,notes
2026-03-02T09:28:52.930429+00:00,B,uniform,tune,uniform_tune_000,1536,512,1024,bf16,NVIDIA GeForce RTX 4060,c06,64,128,32,4,3,8,185.65352691803128,2602.145,84.89599823951721,192.54272162914265,18.971597830276707,3,2,3,3_2_3,0,
2026-03-02T09:28:53.269737+00:00,B,uniform,tune,uniform_tune_001,1536,1536,2048,bf16,NVIDIA GeForce RTX 4060,c11,32,128,32,4,2,8,0.0,339.264,330.7519853115082,453.6777594685554,29.217289223218344,3,3,3,3_3_3,0,
2026-03-02T09:28:53.386368+00:00,B,uniform,tune,uniform_tune_002,384,2048,1536,bf16,NVIDIA GeForce RTX 4060,c06,64,128,32,4,3,8,0.0,116.587,100.35199671983719,103.86463731527328,24.074449766503058,2,3,3,2_3_3,0,
2026-03-02T09:28:53.472978+00:00,B,uniform,tune,uniform_tune_003,1536,64,3072,bf16,NVIDIA GeForce RTX 4060,c04,64,64,64,4,3,8,0.0,86.571,55.16799911856651,58.38848114013672,10.948009455661655,3,1,3,3_1_3,0,
2026-03-02T09:28:53.485923+00:00,B,uniform,tune,uniform_tune_004,768,128,2048,bf16,NVIDIA GeForce RTX 4060,c04,64,64,64,4,3,8,0.0,0.0,38.39999996125698,151.48032277822486,10.485760010579426,3,1,3,3_1_3,0,
2026-03-02T09:28:53.571618+00:00,B,uniform,tune,uniform_tune_005,512,128,4096,bf16,NVIDIA GeForce RTX 4060,c04,64,64,64,4,3,8,0.0,85.656,58.36800113320351,96.30719885230053,9.198034909141219,2,1,3,2_1_3,0,
2026-03-02T09:28:53.671725+00:00,B,uniform,tune,uniform_tune_006,2048,1024,4096,bf16,NVIDIA GeForce RTX 4060,c11,32,128,32,4,2,8,0.0,0.0,570.8160102367401,697.1369725465775,30.097034553874593,3,3,3,3_3_3,0,
2026-03-02T09:28:53.724018+00:00,B,uniform,tune,uniform_tune_007,128,768,512,bf16,NVIDIA GeForce RTX 4060,c11,32,128,32,4,2,8,0.0,52.241,34.81600061058998,76.08320143073792,2.8912940669406253,1,3,2,1_3_2,0,
2026-03-02T09:28:53.768916+00:00,B,uniform,tune,uniform_tune_008,2048,256,64,bf16,NVIDIA GeForce RTX 4060,c05,128,64,32,4,3,8,0.0,44.864,32.43200108408928,51.302400566637495,2.0692174937340746,3,2,1,3_2_1,0,
2026-03-02T09:28:53.782872+00:00,B,uniform,tune,uniform_tune_009,192,768,2048,bf16,NVIDIA GeForce RTX 4060,c06,64,128,32,4,3,8,0.0,0.0,32.6399989426136,128.76800253987307,18.504282952395133,2,3,3,2_3_3,0,
2026-03-02T09:28:53.803682+00:00,B,uniform,tune,uniform_tune_010,1024,1024,1536,bf16,NVIDIA GeForce RTX 4060,c11,32,128,32,4,2,8,0.0,0.0,139.3280029296875,198.37952375411982,23.119727580001314,3,3,3,3_3_3,0,
2026-03-02T09:28:53.853501+00:00,B,uniform,tune,uniform_tune_011,256,384,768,bf16,NVIDIA GeForce RTX 4060,c04,64,64,64,4,3,8,0.0,49.784,35.93599982559681,46.14144071936606,4.201773840516551,2,2,3,2_2_3,0,
2026-03-02T09:28:53.914887+00:00,B,uniform,tune,uniform_tune_012,64,192,2048,bf16,NVIDIA GeForce RTX 4060,c00,32,32,32,2,2,8,0.0,61.357,39.93599861860275,51.559039540588856,1.2603077359020842,1,2,3,1_2_3,0,
2026-03-02T09:28:53.964935+00:00,B,uniform,tune,uniform_tune_013,192,128,512,bf16,NVIDIA GeForce RTX 4060,c00,32,32,32,2,2,8,0.0,50.022,31.120000407099724,1212.7641770243606,0.8086704264392832,2,1,2,2_1_2,0,
2026-03-02T09:28:54.013817+00:00,B,uniform,tune,uniform_tune_014,128,128,1024,bf16,NVIDIA GeForce RTX 4060,c04,64,64,64,4,3,8,0.0,48.857,36.559998989105225,47.89055943489075,0.9177908350051958,1,1,3,1_1_3,0,
2026-03-02T09:28:54.058401+00:00,B,uniform,tune,uniform_tune_015,3072,3072,768,bf16,NVIDIA GeForce RTX 4060,c11,32,128,32,4,2,8,0.0,0.0,481.6319942474365,503.7945434451103,30.09666051494284,3,3,3,3_3_3,0,
2026-03-02T09:28:54.070771+00:00,B,uniform,tune,uniform_tune_016,256,128,3072,bf16,NVIDIA GeForce RTX 4060,c04,64,64,64,4,3,8,0.0,0.0,54.128000512719154,160.4633648693561,3.7194537040527056,2,1,3,2_1_3,0,
2026-03-02T09:28:54.075716+00:00,B,uniform,tune,uniform_tune_017,96,1024,192,bf16,NVIDIA GeForce RTX 4060,c11,32,128,32,4,2,8,0.0,0.0,33.47200155258179,110.19295945763584,1.1277705021822437,1,3,2,1_3_2,0,
2026-03-02T09:28:54.121612+00:00,B,uniform,tune,uniform_tune_018,64,64,192,bf16,NVIDIA GeForce RTX 4060,c11,32,128,32,4,2,8,0.0,45.872,30.719999223947525,41.01663909852504,0.05120000129342083,1,1,2,1_1_2,0,
2026-03-02T09:28:54.162373+00:00,B,uniform,tune,uniform_tune_019,4096,64,64,bf16,NVIDIA GeForce RTX 4060,c03,64,64,32,4,2,8,0.0,40.737,29.69600073993206,121.9788799434898,1.1299310063283885,3,1,1,3_1_1,0,
2026-03-02T09:28:54.355314+00:00,B,uniform,tune,uniform_tune_020,128,4096,3072,bf16,NVIDIA GeForce RTX 4060,c06,64,128,32,4,3,8,0.0,192.913,138.2399946451187,143.8688001036644,23.30168979150595,1,3,3,1_3_3,0,
2026-03-02T09:28:54.408313+00:00,B,uniform,tune,uniform_tune_021,192,2048,3072,bf16,NVIDIA GeForce RTX 4060,c06,64,128,32,4,3,8,0.0,0.0,127.29600071907043,199.24800336360929,18.978751024014432,2,3,3,2_3_3,0,
2026-03-02T09:28:54.468037+00:00,B,uniform,tune,uniform_tune_022,1536,2048,2048,bf16,NVIDIA GeForce RTX 4060,c11,32,128,32,4,2,8,0.0,0.0,457.37600326538086,510.76095789670944,28.171355287574766,3,3,3,3_3_3,0,
2026-03-02T09:28:54.480990+00:00,B,uniform,tune,uniform_tune_023,256,1024,1024,bf16,NVIDIA GeForce RTX 4060,c06,64,128,32,4,3,8,0.0,0.0,77.82399654388428,140.76575778424717,6.8985266221487755,2,3,3,2_3_3,0,
2026-03-02T09:28:54.531057+00:00,B,uniform,tune,uniform_tune_024,768,128,384,bf16,NVIDIA GeForce RTX 4060,c04,64,64,64,4,3,8,0.0,50.035,30.719999223947525,38.549120686948285,2.4576000620842,3,1,2,3_1_2,0,
2026-03-02T09:28:54.535357+00:00,B,uniform,tune,uniform_tune_025,256,96,384,bf16,NVIDIA GeForce RTX 4060,c00,32,32,32,2,2,8,0.0,0.0,27.535999193787575,49.92000002413983,0.6854433669600871,2,1,2,2_1_2,0,
2026-03-02T09:28:54.550661+00:00,B,uniform,tune,uniform_tune_026,96,1024,3072,bf16,NVIDIA GeForce RTX 4060,c06,64,128,32,4,3,8,0.0,0.0,59.39200147986412,74.27904255688189,10.169379056955496,1,3,3,1_3_3,0,
2026-03-02T09:28:54.595875+00:00,B,uniform,tune,uniform_tune_027,1536,512,4096,bf16,NVIDIA GeForce RTX 4060,c06,64,128,32,4,3,8,0.0,0.0,218.54400634765625,344.26143199205393,29.47896422174788,3,2,3,3_2_3,0,
2026-03-02T09:28:54.599535+00:00,B,uniform,tune,uniform_tune_028,128,64,192,bf16,NVIDIA GeForce RTX 4060,c11,32,128,32,4,2,8,0.0,0.0,30.719999223947525,42.0454393327236,0.10240000258684166,1,1,2,1_1_2,0,
2026-03-02T09:28:54.606900+00:00,B,uniform,tune,uniform_tune_029,192,256,1536,bf16,NVIDIA GeForce RTX 4060,c04,64,64,64,4,3,8,0.0,0.0,35.840000957250595,99.72384288907051,4.21302845890279,2,2,3,2_2_3,0,
2026-03-02T09:28:54.684852+00:00,B,uniform,tune,uniform_tune_030,4096,64,3072,bf16,NVIDIA GeForce RTX 4060,c04,64,64,64,4,3,8,0.0,0.0,107.24799707531929,346.3052806258198,15.017648626751336,3,1,3,3_1_3,0,
2026-03-02T09:28:54.737475+00:00,B,uniform,tune,uniform_tune_031,384,128,96,bf16,NVIDIA GeForce RTX 4060,c03,64,64,32,4,2,8,0.0,52.573,36.6239994764328,169.2022401094436,0.25767759215027125,2,1,1,2_1_1,0,
2026-03-02T09:28:54.763122+00:00,B,uniform,eval,uniform_eval_000,512,4096,768,bf16,NVIDIA GeForce RTX 4060,c06,64,128,32,4,3,8,0.0,0.0,136.19199395179749,286.4483112096786,23.65209127593866,2,3,3,2_3_3,0,
2026-03-02T09:28:54.824351+00:00,B,uniform,eval,uniform_eval_001,384,512,64,bf16,NVIDIA GeForce RTX 4060,c11,32,128,32,4,2,8,0.0,61.18,31.42400085926056,51.95136032998561,0.8008472286107293,2,2,1,2_2_1,0,
2026-03-02T09:28:54.922534+00:00,B,uniform,eval,uniform_eval_002,256,4096,384,bf16,NVIDIA GeForce RTX 4060,c01,64,32,32,2,2,8,0.0,98.147,67.35999882221222,123.11359658837313,11.955261016638365,2,3,2,2_3_2,0,
2026-03-02T09:28:54.931626+00:00,B,uniform,eval,uniform_eval_003,384,768,512,bf16,NVIDIA GeForce RTX 4060,c01,64,32,32,2,2,8,0.0,0.0,63.231997191905975,121.15359961986536,4.775903046102999,2,3,2,2_3_2,0,
2026-03-02T09:28:54.979104+00:00,B,uniform,eval,uniform_eval_004,768,1024,96,bf16,NVIDIA GeForce RTX 4060,c11,32,128,32,4,2,8,0.0,47.451,36.86400130391121,39.352639727294445,4.095999855120982,3,3,1,3_3_1,0,
2026-03-02T09:28:54.991336+00:00,B,uniform,eval,uniform_eval_005,3072,3072,128,bf16,NVIDIA GeForce RTX 4060,c11,32,128,32,4,2,8,0.0,0.0,108.5439994931221,120.85247986018658,22.2575095379002,3,3,1,3_3_1,0,
2026-03-02T09:28:54.997554+00:00,B,uniform,eval,uniform_eval_006,256,96,512,bf16,NVIDIA GeForce RTX 4060,c00,32,32,32,2,2,8,0.0,0.0,45.56800052523613,159.56991806626314,0.5522696565556536,2,1,2,2_1_2,0,
2026-03-02T09:28:55.445825+00:00,B,uniform,eval,uniform_eval_007,4096,4096,4096,bf16,NVIDIA GeForce RTX 4060,c11,32,128,32,4,2,8,0.0,0.0,4695.552110671997,4872.417178153992,29.270030495376748,3,3,3,3_3_3,0,
2026-03-02T09:28:55.494150+00:00,B,uniform,eval,uniform_eval_008,128,96,64,bf16,NVIDIA GeForce RTX 4060,c03,64,64,32,4,2,8,0.0,48.273,27.98399981111288,109.53376024961463,0.05620583228332467,1,1,1,1_1_1,0,
2026-03-02T09:28:55.510151+00:00,B,uniform,eval,uniform_eval_009,3072,384,96,bf16,NVIDIA GeForce RTX 4060,c05,128,64,32,4,3,8,0.0,0.0,58.079998940229416,141.84447936713684,3.899662881073485,3,2,1,3_2_1,0,
2026-03-02T09:28:55.533194+00:00,B,uniform,eval,uniform_eval_010,768,768,2048,bf16,NVIDIA GeForce RTX 4060,c11,32,128,32,4,2,8,0.0,0.0,120.2239990234375,143.94368037581444,20.095148419817747,3,3,3,3_3_3,0,
2026-03-02T09:28:55.545189+00:00,B,uniform,eval,uniform_eval_011,4096,96,512,bf16,NVIDIA GeForce RTX 4060,c04,64,64,64,4,3,8,0.0,0.0,45.871999114751816,188.3011175692081,8.77775531414571,3,1,2,3_1_2,0,
2026-03-02T09:28:55.593591+00:00,B,uniform,eval,uniform_eval_012,384,384,256,bf16,NVIDIA GeForce RTX 4060,c03,64,64,32,4,2,8,0.0,48.368,30.719999223947525,75.73343805968749,2.4576000620842,2,2,2,2_2_2,0,
2026-03-02T09:28:55.641862+00:00,B,uniform,eval,uniform_eval_013,4096,2048,768,bf16,NVIDIA GeForce RTX 4060,c11,32,128,32,4,2,8,0.0,0.0,459.7280025482178,524.8172742128372,28.027228745215687,3,3,3,3_3_3,0,
2026-03-02T09:28:55.656593+00:00,B,uniform,eval,uniform_eval_014,192,384,3072,bf16,NVIDIA GeForce RTX 4060,c04,64,64,64,4,3,8,0.0,0.0,53.247999399900436,115.81247843801974,8.507077018950818,2,2,3,2_2_3,0,
2026-03-02T09:28:55.665425+00:00,B,uniform,eval,uniform_eval_015,128,96,4096,bf16,NVIDIA GeForce RTX 4060,c04,64,64,64,4,3,8,0.0,0.0,62.192000448703766,87.26528339087957,1.6185891316203525,1,1,3,1_1_3,0,
2026-03-02T09:28:55.709465+00:00,B,uniform,eval,uniform_eval_016,64,4096,2048,bf16,NVIDIA GeForce RTX 4060,c06,64,128,32,4,3,8,0.0,0.0,88.0960002541542,208.7350441515445,12.188315257245373,1,3,3,1_3_3,0,
2026-03-02T09:28:55.717268+00:00,B,uniform,eval,uniform_eval_017,96,128,3072,bf16,NVIDIA GeForce RTX 4060,c04,64,64,64,4,3,8,0.0,0.0,50.97600072622299,115.67103780806045,1.4810395269231609,1,1,3,1_1_3,0,
2026-03-02T09:28:55.761139+00:00,B,uniform,eval,uniform_eval_018,512,768,64,bf16,NVIDIA GeForce RTX 4060,c11,32,128,32,4,2,8,0.0,43.835,31.072000041604042,40.49920063465832,1.6198393387167913,2,3,1,2_3_1,0,
2026-03-02T09:28:55.771066+00:00,B,uniform,eval,uniform_eval_019,64,128,384,bf16,NVIDIA GeForce RTX 4060,c11,32,128,32,4,2,8,0.0,0.0,39.871999993920326,194.14528444409353,0.15779133228730235,1,1,2,1_1_2,0,
2026-03-02T09:28:55.775918+00:00,B,uniform,eval,uniform_eval_020,512,512,96,bf16,NVIDIA GeForce RTX 4060,c11,32,128,32,4,2,8,0.0,0.0,35.840000957250595,65.66624067723751,1.404342819634263,2,2,1,2_2_1,0,
2026-03-02T09:28:55.804180+00:00,B,uniform,eval,uniform_eval_021,256,3072,1536,bf16,NVIDIA GeForce RTX 4060,c06,64,128,32,4,3,8,0.0,0.0,110.08000001311302,278.76351341605175,21.946939532269344,2,3,3,2_3_3,0,
2026-03-02T09:28:55.816631+00:00,B,uniform,eval,uniform_eval_022,2048,96,512,bf16,NVIDIA GeForce RTX 4060,c04,64,64,64,4,3,8,0.0,0.0,78.78400012850761,193.1503961980342,2.555424853670903,3,1,2,3_1_2,0,
2026-03-02T09:28:55.849504+00:00,B,uniform,eval,uniform_eval_023,1536,512,3072,bf16,NVIDIA GeForce RTX 4060,c06,64,128,32,4,3,8,0.0,0.0,163.32799941301346,174.10048678517342,29.583649009142363,3,2,3,3_2_3,0,
2026-03-02T09:28:55.888694+00:00,B,uniform,eval,uniform_eval_024,128,192,64,bf16,NVIDIA GeForce RTX 4060,c04,64,64,64,4,3,8,0.0,39.145,28.68800051510334,38.43903969973324,0.10965309340202613,1,2,1,1_2_1,0,
2026-03-02T09:28:55.903116+00:00,B,uniform,eval,uniform_eval_025,1536,96,384,bf16,NVIDIA GeForce RTX 4060,c04,64,64,64,4,3,8,0.0,0.0,72.96000048518181,517.1200111508367,1.5521684107307583,3,1,2,3_1_2,0,
2026-03-02T09:28:55.912302+00:00,B,uniform,eval,uniform_eval_026,1536,2048,64,bf16,NVIDIA GeForce RTX 4060,c11,32,128,32,4,2,8,0.0,0.0,59.37600135803223,126.86592474579811,6.781412941097795,3,3,1,3_3_1,0,
2026-03-02T09:28:55.918018+00:00,B,uniform,eval,uniform_eval_027,256,1024,96,bf16,NVIDIA GeForce RTX 4060,c11,32,128,32,4,2,8,0.0,0.0,42.847998440265656,92.54784010350703,1.17465575597813,2,3,1,2_3_1,0,
2026-03-02T09:28:55.923858+00:00,B,uniform,eval,uniform_eval_028,2048,256,64,bf16,NVIDIA GeForce RTX 4060,c05,128,64,32,4,3,8,0.0,0.0,40.95999896526337,288.7891186773771,1.6384000413894664,3,2,1,3_2_1,0,
2026-03-02T09:28:55.929169+00:00,B,uniform,eval,uniform_eval_029,192,768,192,bf16,NVIDIA GeForce RTX 4060,c01,64,32,32,2,2,8,0.0,0.0,39.95199874043465,65.56512039154764,1.4172783786832885,2,3,2,2_3_2,0,
2026-03-02T09:28:55.992196+00:00,B,uniform,eval,uniform_eval_030,1024,2048,3072,bf16,NVIDIA GeForce RTX 4060,c11,32,128,32,4,2,8,0.0,0.0,466.94400906562805,549.68386054039,27.59410472742365,3,3,3,3_3_3,0,
2026-03-02T09:28:56.081748+00:00,B,uniform,eval,uniform_eval_031,1536,1024,512,bf16,NVIDIA GeForce RTX 4060,c06,64,128,32,4,3,8,0.0,89.499,78.84799689054489,103.1257608532905,20.42680600035811,3,3,2,3_3_2,0,
2026-03-02T09:28:56.094139+00:00,B,uniform,eval,uniform_eval_032,512,768,768,bf16,NVIDIA GeForce RTX 4060,c06,64,128,32,4,3,8,0.0,0.0,51.19999870657921,97.1641581505537,11.796480298004159,2,3,3,2_3_3,0,
2026-03-02T09:28:56.110525+00:00,B,uniform,eval,uniform_eval_033,64,512,4096,bf16,NVIDIA GeForce RTX 4060,c00,32,32,32,2,2,8,0.0,0.0,74.3199996650219,702.0364645123461,3.6118872068070926,1,2,3,1_2_3,0,
2026-03-02T09:28:56.164324+00:00,B,uniform,eval,uniform_eval_034,1024,256,512,bf16,NVIDIA GeForce RTX 4060,c11,32,128,32,4,2,8,0.0,53.764,41.98399931192398,53.288959413766854,6.393756202348283,3,2,2,3_2_2,0,
2026-03-02T09:28:56.169338+00:00,B,uniform,eval,uniform_eval_035,1024,768,96,bf16,NVIDIA GeForce RTX 4060,c11,32,128,32,4,2,8,0.0,0.0,36.67199984192848,68.27391944825642,4.117445043925905,3,3,1,3_3_1,0,
2026-03-02T09:28:56.178713+00:00,B,uniform,eval,uniform_eval_036,768,64,1536,bf16,NVIDIA GeForce RTX 4060,c04,64,64,64,4,3,8,0.0,0.0,45.08800059556961,167.57312148809433,3.3488942070063072,3,1,3,3_1_3,0,
2026-03-02T09:28:56.184453+00:00,B,uniform,eval,uniform_eval_037,512,256,512,bf16,NVIDIA GeForce RTX 4060,c03,64,64,32,4,2,8,0.0,0.0,38.59199956059456,51.22047871351242,3.4778640528656823,2,2,2,2_2_2,0,
2026-03-02T09:28:56.226217+00:00,B,uniform,eval,uniform_eval_038,64,1024,64,bf16,NVIDIA GeForce RTX 4060,c11,32,128,32,4,2,8,0.0,41.743,31.74399957060814,40.503360517323,0.2642580680906711,1,3,1,1_3_1,0,
2026-03-02T09:28:56.237005+00:00,B,uniform,eval,uniform_eval_039,512,128,2048,bf16,NVIDIA GeForce RTX 4060,c04,64,64,64,4,3,8,0.0,0.0,59.199998155236244,157.6803235709667,4.5343828440011,2,1,3,2_1_3,0,
2026-03-02T09:28:56.246516+00:00,B,uniform,eval,uniform_eval_040,4096,768,96,bf16,NVIDIA GeForce RTX 4060,c11,32,128,32,4,2,8,0.0,0.0,84.99199897050858,96.2153621762991,7.106313339089427,3,3,1,3_3_1,0,
2026-03-02T09:28:56.253390+00:00,B,uniform,eval,uniform_eval_041,4096,192,64,bf16,NVIDIA GeForce RTX 4060,c05,128,64,32,4,3,8,0.0,0.0,59.31200087070465,146.34112134575838,1.69718260254679,3,2,1,3_2_1,0,
2026-03-02T09:28:56.260719+00:00,B,uniform,eval,uniform_eval_042,96,1536,128,bf16,NVIDIA GeForce RTX 4060,c11,32,128,32,4,2,8,0.0,0.0,59.13599953055382,88.41503784060475,0.6383376674050524,1,3,1,1_3_1,0,
2026-03-02T09:28:56.267836+00:00,B,uniform,eval,uniform_eval_043,192,2048,192,bf16,NVIDIA GeForce RTX 4060,c01,64,32,32,2,2,8,0.0,0.0,60.416001826524734,158.88256102800364,2.499254161729516,2,3,2,2_3_2,0,
2026-03-02T09:28:56.345573+00:00,B,uniform,eval,uniform_eval_044,384,4096,3072,bf16,NVIDIA GeForce RTX 4060,c06,64,128,32,4,3,8,0.0,0.0,313.4080022573471,377.8799968957901,30.83417253674625,2,3,3,2_3_3,0,
2026-03-02T09:28:56.361813+00:00,B,uniform,eval,uniform_eval_045,4096,96,768,bf16,NVIDIA GeForce RTX 4060,c04,64,64,64,4,3,8,0.0,0.0,58.36800113320351,136.58111691474915,10.34778927278387,3,1,3,3_1_3,0,
2026-03-02T09:28:56.367639+00:00,B,uniform,eval,uniform_eval_046,96,96,1536,bf16,NVIDIA GeForce RTX 4060,c04,64,64,64,4,3,8,0.0,0.0,40.97599908709526,150.91392144560814,0.6909301208208068,1,1,3,1_1_3,0,
2026-03-02T09:28:56.427813+00:00,B,uniform,eval,uniform_eval_047,2048,512,4096,bf16,NVIDIA GeForce RTX 4060,c06,64,128,32,4,3,8,0.0,0.0,311.71199679374695,460.7673534750937,27.55727941290554,3,2,3,3_2_3,0,
2026-03-02T09:28:56.435779+00:00,B,uniform,eval,uniform_eval_048,96,256,768,bf16,NVIDIA GeForce RTX 4060,c00,32,32,32,2,2,8,0.0,0.0,36.927999928593636,97.3215981572866,1.0222253052695351,1,2,3,1_2_3,0,
2026-03-02T09:28:56.440840+00:00,B,uniform,eval,uniform_eval_049,64,768,384,bf16,NVIDIA GeForce RTX 4060,c11,32,128,32,4,2,8,0.0,0.0,38.896000012755394,75.30239872634398,0.9705043188919383,1,3,2,1_3_2,0,
2026-03-02T09:28:56.446126+00:00,B,uniform,eval,uniform_eval_050,128,1024,96,bf16,NVIDIA GeForce RTX 4060,c11,32,128,32,4,2,8,0.0,0.0,43.90399903059006,131.3152024894952,0.5732011788371657,1,3,1,1_3_1,0,
2026-03-02T09:28:56.454762+00:00,B,uniform,eval,uniform_eval_051,384,768,768,bf16,NVIDIA GeForce RTX 4060,c06,64,128,32,4,3,8,0.0,0.0,58.36800113320351,67.63296090066433,7.760841954587902,2,3,3,2_3_3,0,
2026-03-02T09:28:56.472239+00:00,B,uniform,eval,uniform_eval_052,768,64,4096,bf16,NVIDIA GeForce RTX 4060,c04,64,64,64,4,3,8,0.0,0.0,60.736000537872314,158.1692735850811,6.629563692606382,3,1,3,3_1_3,0,
2026-03-02T09:28:56.477842+00:00,B,uniform,eval,uniform_eval_053,384,96,512,bf16,NVIDIA GeForce RTX 4060,c00,32,32,32,2,2,8,0.0,0.0,40.97599908709526,57.89152085781096,0.9212401610944092,2,1,2,2_1_2,0,
2026-03-02T09:28:56.485153+00:00,B,uniform,eval,uniform_eval_054,768,192,768,bf16,NVIDIA GeForce RTX 4060,c06,64,128,32,4,3,8,0.0,0.0,43.007999658584595,77.68288161605588,5.2662857560916825,3,2,3,3_2_3,0,
2026-03-02T09:28:56.498862+00:00,B,uniform,eval,uniform_eval_055,512,2048,512,bf16,NVIDIA GeForce RTX 4060,c01,64,32,32,2,2,8,0.0,0.0,81.87199756503105,151.63391903042793,13.114884892690265,2,3,2,2_3_2,0,
2026-03-02T09:28:56.505710+00:00,B,uniform,eval,uniform_eval_056,384,512,512,bf16,NVIDIA GeForce RTX 4060,c03,64,64,32,4,2,8,0.0,0.0,45.40800116956234,114.708481580019,4.433725044364036,2,2,2,2_2_2,0,
2026-03-02T09:28:56.516306+00:00,B,uniform,eval,uniform_eval_057,2048,512,512,bf16,NVIDIA GeForce RTX 4060,c11,32,128,32,4,2,8,0.0,0.0,70.5760009586811,80.95743760466574,15.21397938980171,3,2,2,3_2_2,0,
2026-03-02T09:28:56.535514+00:00,B,uniform,eval,uniform_eval_058,1024,512,2048,bf16,NVIDIA GeForce RTX 4060,c06,64,128,32,4,3,8,0.0,0.0,108.5439994931221,118.68384189903736,19.784452922577955,3,2,3,3_2_3,0,
2026-03-02T09:28:56.577828+00:00,B,uniform,eval,uniform_eval_059,2048,64,4096,bf16,NVIDIA GeForce RTX 4060,c04,64,64,64,4,3,8,0.0,0.0,83.96799862384796,110.10336287319657,12.787512404696566,3,1,3,3_1_3,0,
2026-03-02T09:28:56.588328+00:00,B,uniform,eval,uniform_eval_060,64,1536,1024,bf16,NVIDIA GeForce RTX 4060,c06,64,128,32,4,3,8,0.0,0.0,45.05600035190582,115.93887954950333,4.468363601463886,1,3,3,1_3_3,0,
2026-03-02T09:28:56.606740+00:00,B,uniform,eval,uniform_eval_061,768,1024,1536,bf16,NVIDIA GeForce RTX 4060,c11,32,128,32,4,2,8,0.0,0.0,124.89599734544754,198.21919947862622,19.343446990681805,3,3,3,3_3_3,0,
2026-03-02T09:28:56.613410+00:00,B,uniform,eval,uniform_eval_062,384,2048,192,bf16,NVIDIA GeForce RTX 4060,c01,64,32,32,2,2,8,0.0,0.0,45.72799988090992,55.15807874500751,6.6040476029232975,2,3,2,2_3_2,0,
2026-03-02T09:28:56.619237+00:00,B,uniform,eval,uniform_eval_063,256,2048,192,bf16,NVIDIA GeForce RTX 4060,c01,64,32,32,2,2,8,0.0,0.0,40.68800061941147,57.45600052177903,4.948058123651101,2,3,2,2_3_2,0,
2026-03-02T09:28:58.709982+00:00,B,llm_style,tune,llm_style_tune_000,8,4096,1024,bf16,NVIDIA GeForce RTX 4060,c02,32,64,32,2,2,8,0.0,2090.063,40.94399884343147,103.73120151460165,1.6390402963966009,0,3,3,0_3_3,0,
2026-03-02T09:28:58.736674+00:00,B,llm_style,tune,llm_style_tune_001,32,1024,2048,bf16,NVIDIA GeForce RTX 4060,c02,32,64,32,2,2,8,0.0,0.0,94.2080020904541,168.4761601686477,1.4246956205602412,0,3,3,0_3_3,0,
2026-03-02T09:28:58.748595+00:00,B,llm_style,tune,llm_style_tune_002,16,2048,1024,bf16,NVIDIA GeForce RTX 4060,c02,32,64,32,2,2,8,0.0,0.0,61.28000095486641,122.58304044604296,1.0951185207948453,0,3,3,0_3_3,0,
2026-03-02T09:28:58.986712+00:00,B,llm_style,tune,llm_style_tune_003,1,1024,4096,bf16,NVIDIA GeForce RTX 4060,c02,32,64,32,2,2,8,0.0,0.0,167.93599724769592,244.48480054736132,0.04995122033084596,0,3,3,0_3_3,0,
2026-03-02T09:28:59.015028+00:00,B,llm_style,tune,llm_style_tune_004,64,2048,2048,bf16,NVIDIA GeForce RTX 4060,c06,64,128,32,4,3,8,0.0,0.0,123.90399724245071,215.55872485041616,4.332958774118247,1,3,3,1_3_3,0,
2026-03-02T09:28:59.411217+00:00,B,llm_style,tune,llm_style_tune_005,32,8192,8192,bf16,NVIDIA GeForce RTX 4060,c02,32,64,32,2,2,8,0.0,0.0,924.1600036621094,966.5705543756485,4.64742823643158,0,3,3,0_3_3,0,
2026-03-02T09:28:59.752660+00:00,B,llm_style,tune,llm_style_tune_006,16,8192,8192,bf16,NVIDIA GeForce RTX 4060,c02,32,64,32,2,2,8,0.0,0.0,923.6479997634888,1010.0429052114486,2.325002217890245,0,3,3,0_3_3,0,
2026-03-02T09:28:59.820112+00:00,B,llm_style,tune,llm_style_tune_007,2,1024,8192,bf16,NVIDIA GeForce RTX 4060,c02,32,64,32,2,2,8,0.0,0.0,374.7840076684952,518.717436492443,0.08953005281292484,0,3,3,0_3_3,0,
2026-03-02T09:28:59.920390+00:00,B,llm_style,tune,llm_style_tune_008,16,2048,8192,bf16,NVIDIA GeForce RTX 4060,c02,32,64,32,2,2,8,0.0,0.0,431.4720034599304,494.5715382695196,1.2442775144039158,0,3,3,0_3_3,0,
2026-03-02T09:28:59.965889+00:00,B,llm_style,tune,llm_style_tune_009,4,4096,2048,bf16,NVIDIA GeForce RTX 4060,c02,32,64,32,2,2,8,0.0,0.0,133.12000036239624,208.45920294523236,0.5041230755506888,0,3,3,0_3_3,0,
2026-03-02T09:29:00.150958+00:00,B,llm_style,tune,llm_style_tune_010,64,8192,4096,bf16,NVIDIA GeForce RTX 4060,c06,64,128,32,4,3,8,0.0,0.0,622.4000155925751,740.3145456314087,6.9006542230093695,1,3,3,1_3_3,0,
2026-03-02T09:29:00.199586+00:00,B,llm_style,tune,llm_style_tune_011,16,8192,1024,bf16,NVIDIA GeForce RTX 4060,c02,32,64,32,2,2,8,0.0,0.0,120.25600299239159,215.00800147652615,2.23220005089462,0,3,3,0_3_3,0,
2026-03-02T09:29:00.242692+00:00,B,llm_style,tune,llm_style_tune_012,2,8192,1024,bf16,NVIDIA GeForce RTX 4060,c02,32,64,32,2,2,8,0.0,0.0,117.60000139474869,192.69631817936894,0.2853267993370818,0,3,3,0_3_3,0,
2026-03-02T09:29:00.331941+00:00,B,llm_style,tune,llm_style_tune_013,16,8192,2048,bf16,NVIDIA GeForce RTX 4060,c02,32,64,32,2,2,8,0.0,0.0,261.1199915409088,392.55648791789974,2.0560314391550145,0,3,3,0_3_3,0,
2026-03-02T09:29:00.423267+00:00,B,llm_style,tune,llm_style_tune_014,8,4096,4096,bf16,NVIDIA GeForce RTX 4060,c02,32,64,32,2,2,8,0.0,0.0,283.6480140686035,302.5020843744278,0.9463681841081948,0,3,3,0_3_3,0,
2026-03-02T09:29:00.436291+00:00,B,llm_style,tune,llm_style_tune_015,64,1024,1024,bf16,NVIDIA GeForce RTX 4060,c06,64,128,32,4,3,8,0.0,0.0,106.49599879980087,132.96640016138548,1.2603077065112325,1,3,3,1_3_3,0,
2026-03-02T09:29:00.614189+00:00,B,llm_style,tune,llm_style_tune_016,16,4096,8192,bf16,NVIDIA GeForce RTX 4060,c02,32,64,32,2,2,8,0.0,0.0,486.91199719905853,653.19745182991,2.205207163053398,0,3,3,0_3_3,0,
2026-03-02T09:29:00.703388+00:00,B,llm_style,tune,llm_style_tune_017,1,4096,4096,bf16,NVIDIA GeForce RTX 4060,c02,32,64,32,2,2,8,0.0,0.0,260.97600162029266,411.9552052021026,0.12857286413951602,0,3,3,0_3_3,0,
2026-03-02T09:29:00.806635+00:00,B,llm_style,tune,llm_style_tune_018,64,4096,4096,bf16,NVIDIA GeForce RTX 4060,c06,64,128,32,4,3,8,0.0,0.0,422.8319972753525,517.2639948129653,5.078810643087488,1,3,3,1_3_3,0,
2026-03-02T09:29:00.905719+00:00,B,llm_style,tune,llm_style_tune_019,64,8192,2048,bf16,NVIDIA GeForce RTX 4060,c06,64,128,32,4,3,8,0.0,0.0,330.51200211048126,432.7814328670501,6.49744527970925,1,3,3,1_3_3,0,
2026-03-02T09:29:01.002065+00:00,B,llm_style,tune,llm_style_tune_020,8,2048,4096,bf16,NVIDIA GeForce RTX 4060,c02,32,64,32,2,2,8,0.0,0.0,202.7519941329956,297.07519531249994,0.6619798171354093,0,3,3,0_3_3,0,
2026-03-02T09:29:01.019820+00:00,B,llm_style,tune,llm_style_tune_021,8,1024,2048,bf16,NVIDIA GeForce RTX 4060,c02,32,64,32,2,2,8,0.0,0.0,112.49599978327751,355.09503901004734,0.29827222358699246,0,3,3,0_3_3,0,
2026-03-02T09:29:01.066063+00:00,B,llm_style,tune,llm_style_tune_022,8,8192,1024,bf16,NVIDIA GeForce RTX 4060,c02,32,64,32,2,2,8,0.0,0.0,121.34400010108948,226.11968189477903,1.1060928260827536,0,3,3,0_3_3,0,
2026-03-02T09:29:01.259993+00:00,B,llm_style,tune,llm_style_tune_023,1,4096,8192,bf16,NVIDIA GeForce RTX 4060,c02,32,64,32,2,2,8,0.0,0.0,504.83202934265137,546.8646377325058,0.13293305515377732,0,3,3,0_3_3,0,
2026-03-02T09:29:01.435501+00:00,B,llm_style,tune,llm_style_tune_024,2,8192,4096,bf16,NVIDIA GeForce RTX 4060,c02,32,64,32,2,2,8,0.0,0.0,479.0880084037781,499.7939255833626,0.28015255160985064,0,3,3,0_3_3,0,
2026-03-02T09:29:01.527358+00:00,B,llm_style,tune,llm_style_tune_025,2,4096,4096,bf16,NVIDIA GeForce RTX 4060,c02,32,64,32,2,2,8,0.0,0.0,262.14399933815,342.2822365164756,0.2560000006463379,0,3,3,0_3_3,0,
2026-03-02T09:29:01.541071+00:00,B,llm_style,tune,llm_style_tune_026,4,2048,1024,bf16,NVIDIA GeForce RTX 4060,c02,32,64,32,2,2,8,0.0,0.0,72.7040022611618,118.02623890340323,0.23076055620341446,0,3,3,0_3_3,0,
2026-03-02T09:29:01.594092+00:00,B,llm_style,tune,llm_style_tune_027,64,2048,4096,bf16,NVIDIA GeForce RTX 4060,c06,64,128,32,4,3,8,0.0,0.0,234.49599742889404,288.7593561410904,4.5789345480218255,1,3,3,1_3_3,0,
2026-03-02T09:29:01.620479+00:00,B,llm_style,tune,llm_style_tune_028,32,1024,4096,bf16,NVIDIA GeForce RTX 4060,c02,32,64,32,2,2,8,0.0,0.0,181.2479943037033,268.229432851076,1.4810395945689936,0,3,3,0_3_3,0,
2026-03-02T09:29:01.633137+00:00,B,llm_style,tune,llm_style_tune_029,32,2048,1024,bf16,NVIDIA GeForce RTX 4060,c02,32,64,32,2,2,8,0.0,0.0,71.407999843359,79.35391694307327,1.8795895179030473,0,3,3,0_3_3,0,
2026-03-02T09:29:01.655754+00:00,B,llm_style,tune,llm_style_tune_030,4,2048,2048,bf16,NVIDIA GeForce RTX 4060,c02,32,64,32,2,2,8,0.0,0.0,142.11200177669525,148.50048556923866,0.23611258430322485,0,3,3,0_3_3,0,
2026-03-02T09:29:02.000890+00:00,B,llm_style,tune,llm_style_tune_031,1,8192,8192,bf16,NVIDIA GeForce RTX 4060,c02,32,64,32,2,2,8,0.0,0.0,951.2959718704224,1073.625248670578,0.14108934755195413,0,3,3,0_3_3,0,
2026-03-02T09:29:02.043032+00:00,B,llm_style,eval,llm_style_eval_000,2,1024,4096,bf16,NVIDIA GeForce RTX 4060,c02,32,64,32,2,2,8,0.0,0.0,262.14399933815,374.2207881808277,0.06400000016158447,0,3,3,0_3_3,0,
2026-03-02T09:29:02.392751+00:00,B,llm_style,eval,llm_style_eval_001,2,8192,8192,bf16,NVIDIA GeForce RTX 4060,c02,32,64,32,2,2,8,0.0,0.0,1092.464029788971,1217.6998722553253,0.2457156013199383,0,3,3,0_3_3,0,
2026-03-02T09:29:02.423747+00:00,B,llm_style,eval,llm_style_eval_002,2,2048,2048,bf16,NVIDIA GeForce RTX 4060,c02,32,64,32,2,2,8,0.0,0.0,176.08000338077545,335.0787205994126,0.09528177917920093,0,3,3,0_3_3,0,
2026-03-02T09:29:02.493227+00:00,B,llm_style,eval,llm_style_eval_003,8,1024,8192,bf16,NVIDIA GeForce RTX 4060,c02,32,64,32,2,2,8,0.0,0.0,486.7679923772812,600.6272131204605,0.27573244359085003,0,3,3,0_3_3,0,
2026-03-02T09:29:02.613837+00:00,B,llm_style,eval,llm_style_eval_004,64,2048,8192,bf16,NVIDIA GeForce RTX 4060,c06,64,128,32,4,3,8,0.0,0.0,639.9999856948853,762.6409488916397,3.355443275000002,1,3,3,1_3_3,0,
2026-03-02T09:29:02.957047+00:00,B,llm_style,eval,llm_style_eval_005,1,8192,8192,bf16,NVIDIA GeForce RTX 4060,c02,32,64,32,2,2,8,0.0,0.0,954.367995262146,1091.156826019287,0.14063519383121503,0,3,3,0_3_3,0,
2026-03-02T09:29:03.038869+00:00,B,llm_style,eval,llm_style_eval_006,1,1024,8192,bf16,NVIDIA GeForce RTX 4060,c02,32,64,32,2,2,8,0.0,0.0,532.9920053482056,572.7846479415892,0.031477425236499344,0,3,3,0_3_3,0,
2026-03-02T09:29:03.222840+00:00,B,llm_style,eval,llm_style_eval_007,2,8192,4096,bf16,NVIDIA GeForce RTX 4060,c02,32,64,32,2,2,8,0.0,0.0,483.2960069179535,577.5257432460784,0.277713298017762,0,3,3,0_3_3,0,
2026-03-02T09:29:03.278160+00:00,B,llm_style,eval,llm_style_eval_008,16,2048,4096,bf16,NVIDIA GeForce RTX 4060,c02,32,64,32,2,2,8,0.0,0.0,232.44799673557281,261.16096645593643,1.1548193994778353,0,3,3,0_3_3,0,
2026-03-02T09:29:03.389164+00:00,B,llm_style,eval,llm_style_eval_009,32,2048,8192,bf16,NVIDIA GeForce RTX 4060,c02,32,64,32,2,2,8,0.0,0.0,533.376008272171,596.9228649139404,2.013104840388867,0,3,3,0_3_3,0,
2026-03-02T09:29:03.406140+00:00,B,llm_style,eval,llm_style_eval_010,1,1024,1024,bf16,NVIDIA GeForce RTX 4060,c02,32,64,32,2,2,8,0.0,0.0,90.11200070381165,193.23552459478373,0.023272727090957738,0,3,3,0_3_3,0,
2026-03-02T09:29:03.514645+00:00,B,llm_style,eval,llm_style_eval_011,16,2048,8192,bf16,NVIDIA GeForce RTX 4060,c02,32,64,32,2,2,8,0.0,0.0,532.480001449585,596.439048051834,1.0082461511013776,0,3,3,0_3_3,0,
2026-03-02T09:29:03.883798+00:00,B,llm_style,eval,llm_style_eval_012,8,8192,8192,bf16,NVIDIA GeForce RTX 4060,c02,32,64,32,2,2,8,0.0,0.0,905.7279825210571,1064.4991993904114,1.185501436105886,0,3,3,0_3_3,0,
2026-03-02T09:29:04.075853+00:00,B,llm_style,eval,llm_style_eval_013,32,4096,8192,bf16,NVIDIA GeForce RTX 4060,c02,32,64,32,2,2,8,0.0,0.0,566.2720203399658,659.7324907779692,3.792318127797911,0,3,3,0_3_3,0,
2026-03-02T09:29:04.089959+00:00,B,llm_style,eval,llm_style_eval_014,64,1024,1024,bf16,NVIDIA GeForce RTX 4060,c06,64,128,32,4,3,8,0.0,0.0,93.6960019171238,199.2396765947342,1.4324808450067974,1,3,3,1_3_3,0,
2026-03-02T09:29:04.104446+00:00,B,llm_style,eval,llm_style_eval_015,16,2048,1024,bf16,NVIDIA GeForce RTX 4060,c02,32,64,32,2,2,8,0.0,0.0,89.4399993121624,131.73759989440438,0.7503227249116747,0,3,3,0_3_3,0,
2026-03-02T09:29:04.171764+00:00,B,llm_style,eval,llm_style_eval_016,2,1024,8192,bf16,NVIDIA GeForce RTX 4060,c02,32,64,32,2,2,8,0.0,0.0,436.73600256443024,1066.3878405094135,0.07683001127219831,0,3,3,0_3_3,0,
2026-03-02T09:29:04.512775+00:00,B,llm_style,eval,llm_style_eval_017,4,8192,8192,bf16,NVIDIA GeForce RTX 4060,c02,32,64,32,2,2,8,0.0,0.0,948.1120109558105,1079.6812582015991,0.5662526218381833,0,3,3,0_3_3,0,
2026-03-02T09:29:04.547671+00:00,B,llm_style,eval,llm_style_eval_018,4,1024,4096,bf16,NVIDIA GeForce RTX 4060,c02,32,64,32,2,2,8,0.0,0.0,237.47199773788452,324.73087787628174,0.14129847864014905,0,3,3,0_3_3,0,
2026-03-02T09:29:04.599636+00:00,B,llm_style,eval,llm_style_eval_019,8,4096,2048,bf16,NVIDIA GeForce RTX 4060,c02,32,64,32,2,2,8,0.0,0.0,165.6000018119812,244.6467162668705,0.8104935177016968,0,3,3,0_3_3,0,
2026-03-02T09:29:04.661420+00:00,B,llm_style,eval,llm_style_eval_020,64,4096,2048,bf16,NVIDIA GeForce RTX 4060,c06,64,128,32,4,3,8,0.0,0.0,272.7679908275604,329.77792292833317,3.9364656415231742,1,3,3,1_3_3,0,
2026-03-02T09:29:04.843761+00:00,B,llm_style,eval,llm_style_eval_021,1,4096,8192,bf16,NVIDIA GeForce RTX 4060,c02,32,64,32,2,2,8,0.0,0.0,524.2879986763,599.1628736257551,0.12800000032316894,0,3,3,0_3_3,0,
2026-03-02T09:29:04.873140+00:00,B,llm_style,eval,llm_style_eval_022,32,1024,4096,bf16,NVIDIA GeForce RTX 4060,c02,32,64,32,2,2,8,0.0,0.0,211.37599647045135,265.3823955357073,1.2699429475547148,0,3,3,0_3_3,0,
2026-03-02T09:29:04.885112+00:00,B,llm_style,eval,llm_style_eval_023,4,1024,1024,bf16,NVIDIA GeForce RTX 4060,c02,32,64,32,2,2,8,0.0,0.0,84.99199897050858,208.56832325458512,0.09869879637624206,0,3,3,0_3_3,0,
2026-03-02T09:29:04.909315+00:00,B,llm_style,eval,llm_style_eval_024,64,2048,2048,bf16,NVIDIA GeForce RTX 4060,c06,64,128,32,4,3,8,0.0,0.0,165.8399999141693,261.9289553165435,3.23728239434309,1,3,3,1_3_3,0,
2026-03-02T09:29:05.281927+00:00,B,llm_style,eval,llm_style_eval_025,32,8192,8192,bf16,NVIDIA GeForce RTX 4060,c02,32,64,32,2,2,8,0.0,0.0,923.1359958648682,1054.4435012340546,4.6525834928320915,0,3,3,0_3_3,0,
2026-03-02T09:29:05.341891+00:00,B,llm_style,eval,llm_style_eval_026,4,2048,4096,bf16,NVIDIA GeForce RTX 4060,c02,32,64,32,2,2,8,0.0,0.0,241.64800345897675,344.01440024375916,0.277713298017762,0,3,3,0_3_3,0,
2026-03-02T09:29:05.431598+00:00,B,llm_style,eval,llm_style_eval_027,8,8192,2048,bf16,NVIDIA GeForce RTX 4060,c02,32,64,32,2,2,8,0.0,0.0,258.8160037994385,338.28895092010487,1.037167146000816,0,3,3,0_3_3,0,
2026-03-02T09:29:05.609888+00:00,B,llm_style,eval,llm_style_eval_028,8,4096,8192,bf16,NVIDIA GeForce RTX 4060,c02,32,64,32,2,2,8,0.0,0.0,521.0559964179993,551.5776264667511,1.0303516621835664,0,3,3,0_3_3,0,
2026-03-02T09:29:05.634024+00:00,B,llm_style,eval,llm_style_eval_029,8,2048,2048,bf16,NVIDIA GeForce RTX 4060,c02,32,64,32,2,2,8,0.0,0.0,144.3839967250824,190.53568094968784,0.464794336783599,0,3,3,0_3_3,0,
2026-03-02T09:29:05.687322+00:00,B,llm_style,eval,llm_style_eval_030,1,4096,2048,bf16,NVIDIA GeForce RTX 4060,c02,32,64,32,2,2,8,0.0,0.0,158.2079976797104,301.0252737998961,0.10604530899863364,0,3,3,0_3_3,0,
2026-03-02T09:29:05.776675+00:00,B,llm_style,eval,llm_style_eval_031,16,8192,2048,bf16,NVIDIA GeForce RTX 4060,c02,32,64,32,2,2,8,0.0,0.0,262.5119984149933,305.45919895172113,2.04512904264012,0,3,3,0_3_3,0,
2026-03-02T09:29:05.800228+00:00,B,llm_style,eval,llm_style_eval_032,1,2048,2048,bf16,NVIDIA GeForce RTX 4060,c02,32,64,32,2,2,8,0.0,0.0,136.06400042772293,191.10912129282949,0.06165192831042786,0,3,3,0_3_3,0,
2026-03-02T09:29:05.971816+00:00,B,llm_style,eval,llm_style_eval_033,16,8192,4096,bf16,NVIDIA GeForce RTX 4060,c02,32,64,32,2,2,8,0.0,0.0,490.4960095882416,624.4079947471619,2.189093902927728,0,3,3,0_3_3,0,
2026-03-02T09:29:06.000886+00:00,B,llm_style,eval,llm_style_eval_034,16,1024,4096,bf16,NVIDIA GeForce RTX 4060,c02,32,64,32,2,2,8,0.0,0.0,221.69599682092667,265.9932798147201,0.6054134036006676,0,3,3,0_3_3,0,
2026-03-02T09:29:06.094310+00:00,B,llm_style,eval,llm_style_eval_035,4,8192,2048,bf16,NVIDIA GeForce RTX 4060,c02,32,64,32,2,2,8,0.0,0.0,260.8320116996765,315.2383986115455,0.5145753664413671,0,3,3,0_3_3,0,
2026-03-02T09:29:06.147233+00:00,B,llm_style,eval,llm_style_eval_036,2,2048,4096,bf16,NVIDIA GeForce RTX 4060,c02,32,64,32,2,2,8,0.0,0.0,236.54399812221527,275.0054436922072,0.14185281497890054,0,3,3,0_3_3,0,
2026-03-02T09:29:06.158545+00:00,B,llm_style,eval,llm_style_eval_037,2,1024,1024,bf16,NVIDIA GeForce RTX 4060,c02,32,64,32,2,2,8,0.0,0.0,78.84799689054489,221.0918439924716,0.05319480729259924,0,3,3,0_3_3,0,
2026-03-02T09:29:06.366181+00:00,B,llm_style,eval,llm_style_eval_038,64,4096,8192,bf16,NVIDIA GeForce RTX 4060,c06,64,128,32,4,3,8,0.0,0.0,945.1519846916199,1085.5567979812622,4.54420809093613,1,3,3,1_3_3,0,
2026-03-02T09:29:06.383377+00:00,B,llm_style,eval,llm_style_eval_039,4,1024,2048,bf16,NVIDIA GeForce RTX 4060,c02,32,64,32,2,2,8,0.0,0.0,124.89599734544754,186.60351961851106,0.13432949299084584,0,3,3,0_3_3,0,
2026-03-02T09:29:06.434647+00:00,B,llm_style,eval,llm_style_eval_040,64,8192,1024,bf16,NVIDIA GeForce RTX 4060,c06,64,128,32,4,3,8,0.0,0.0,208.8959962129593,221.26592040061948,5.140078524556174,1,3,3,1_3_3,0,
2026-03-02T09:29:06.448968+00:00,B,llm_style,eval,llm_style_eval_041,2,2048,1024,bf16,NVIDIA GeForce RTX 4060,c02,32,64,32,2,2,8,0.0,0.0,88.06400001049042,161.29023864865303,0.09525581394214125,0,3,3,0_3_3,0,
2026-03-02T09:29:06.496013+00:00,B,llm_style,eval,llm_style_eval_042,2,4096,2048,bf16,NVIDIA GeForce RTX 4060,c02,32,64,32,2,2,8,0.0,0.0,150.52799880504608,214.01600539684296,0.22291156639541512,0,3,3,0_3_3,0,
2026-03-02T09:29:06.510690+00:00,B,llm_style,eval,llm_style_eval_043,1,2048,1024,bf16,NVIDIA GeForce RTX 4060,c02,32,64,32,2,2,8,0.0,0.0,86.7839977145195,148.50048556923866,0.048330384753619934,0,3,3,0_3_3,0,
2026-03-02T09:29:06.623611+00:00,B,llm_style,eval,llm_style_eval_044,8,2048,8192,bf16,NVIDIA GeForce RTX 4060,c02,32,64,32,2,2,8,0.0,0.0,506.75198435783386,640.3046244382858,0.5297176218069806,0,3,3,0_3_3,0,
2026-03-02T09:29:06.670262+00:00,B,llm_style,eval,llm_style_eval_045,1,8192,1024,bf16,NVIDIA GeForce RTX 4060,c02,32,64,32,2,2,8,0.0,0.0,143.36000382900238,166.44384324550626,0.11702856830285527,0,3,3,0_3_3,0,
2026-03-02T09:29:06.695442+00:00,B,llm_style,eval,llm_style_eval_046,64,4096,1024,bf16,NVIDIA GeForce RTX 4060,c06,64,128,32,4,3,8,0.0,0.0,157.69599378108978,245.698883831501,3.4044676667263514,1,3,3,1_3_3,0,
2026-03-02T09:29:06.719827+00:00,B,llm_style,eval,llm_style_eval_047,16,2048,2048,bf16,NVIDIA GeForce RTX 4060,c02,32,64,32,2,2,8,0.0,0.0,117.10400134325027,202.49024048447592,1.146141262983719,0,3,3,0_3_3,0,
2026-03-02T09:29:06.893484+00:00,B,llm_style,eval,llm_style_eval_048,8,8192,4096,bf16,NVIDIA GeForce RTX 4060,c02,32,64,32,2,2,8,0.0,0.0,492.5439953804016,543.6313539743422,1.0899958522189757,0,3,3,0_3_3,0,
2026-03-02T09:29:07.080705+00:00,B,llm_style,eval,llm_style_eval_049,4,4096,8192,bf16,NVIDIA GeForce RTX 4060,c02,32,64,32,2,2,8,0.0,0.0,587.7760052680969,650.9874981641769,0.45669686001823256,0,3,3,0_3_3,0,
2026-03-02T09:29:07.191745+00:00,B,llm_style,eval,llm_style_eval_050,4,2048,8192,bf16,NVIDIA GeForce RTX 4060,c02,32,64,32,2,2,8,0.0,0.0,569.2320168018341,586.336339712143,0.23578738377030717,0,3,3,0_3_3,0,
2026-03-02T09:29:07.207617+00:00,B,llm_style,eval,llm_style_eval_051,16,1024,1024,bf16,NVIDIA GeForce RTX 4060,c02,32,64,32,2,2,8,0.0,0.0,85.37599816918373,128.496005386114,0.3930194986828441,0,3,3,0_3_3,0,
2026-03-02T09:29:07.444508+00:00,B,llm_style,eval,llm_style_eval_052,32,8192,4096,bf16,NVIDIA GeForce RTX 4060,c02,32,64,32,2,2,8,0.0,0.0,503.29601764678955,542.1087849140167,4.266840135236461,0,3,3,0_3_3,0,
2026-03-02T09:29:07.462679+00:00,B,llm_style,eval,llm_style_eval_053,32,1024,2048,bf16,NVIDIA GeForce RTX 4060,c02,32,64,32,2,2,8,0.0,0.0,141.80800318717957,179.6751971542834,0.9464749871898218,0,3,3,0_3_3,0,
2026-03-02T09:29:07.564992+00:00,B,llm_style,eval,llm_style_eval_054,64,8192,2048,bf16,NVIDIA GeForce RTX 4060,c06,64,128,32,4,3,8,0.0,0.0,474.11200404167175,563.5481572151184,4.5294859225105135,1,3,3,1_3_3,0,
2026-03-02T09:29:07.586445+00:00,B,llm_style,eval,llm_style_eval_055,1,4096,1024,bf16,NVIDIA GeForce RTX 4060,c02,32,64,32,2,2,8,0.0,0.0,103.29600051045418,168.47871698439099,0.08120941719472499,0,3,3,0_3_3,0,
2026-03-02T09:29:07.612029+00:00,B,llm_style,eval,llm_style_eval_056,4,2048,2048,bf16,NVIDIA GeForce RTX 4060,c02,32,64,32,2,2,8,0.0,0.0,158.11199694871902,272.39423900842655,0.2122193928831524,0,3,3,0_3_3,0,
2026-03-02T09:29:07.683617+00:00,B,llm_style,eval,llm_style_eval_057,16,1024,8192,bf16,NVIDIA GeForce RTX 4060,c02,32,64,32,2,2,8,0.0,0.0,500.7359981536865,573.4400153160095,0.5360818015676425,0,3,3,0_3_3,0,
2026-03-02T09:29:07.861643+00:00,B,llm_style,eval,llm_style_eval_058,1,8192,4096,bf16,NVIDIA GeForce RTX 4060,c02,32,64,32,2,2,8,0.0,0.0,577.5199830532074,661.2828987836835,0.11620180421327032,0,3,3,0_3_3,0,
2026-03-02T09:29:07.886452+00:00,B,llm_style,eval,llm_style_eval_059,8,4096,1024,bf16,NVIDIA GeForce RTX 4060,c02,32,64,32,2,2,8,0.0,0.0,109.56799983978271,193.54303732514379,0.6124859822040271,0,3,3,0_3_3,0,
2026-03-02T09:29:08.062300+00:00,B,llm_style,eval,llm_style_eval_060,4,8192,4096,bf16,NVIDIA GeForce RTX 4060,c02,32,64,32,2,2,8,0.0,0.0,592.3359990119934,622.0732885599136,0.4531810601546181,0,3,3,0_3_3,0,
2026-03-02T09:29:08.088050+00:00,B,llm_style,eval,llm_style_eval_061,32,2048,2048,bf16,NVIDIA GeForce RTX 4060,c02,32,64,32,2,2,8,0.0,0.0,166.73599928617477,199.5660760998725,1.6099430066045601,0,3,3,0_3_3,0,
2026-03-02T09:29:08.103946+00:00,B,llm_style,eval,llm_style_eval_062,8,2048,1024,bf16,NVIDIA GeForce RTX 4060,c02,32,64,32,2,2,8,0.0,0.0,106.87999799847603,217.47711896896357,0.3139449160588349,0,3,3,0_3_3,0,
2026-03-02T09:29:08.289600+00:00,B,llm_style,eval,llm_style_eval_063,16,4096,8192,bf16,NVIDIA GeForce RTX 4060,c02,32,64,32,2,2,8,0.0,0.0,705.375999212265,718.706865310669,1.5222261959566399,0,3,3,0_3_3,0,
2026-03-02T09:29:08.459036+00:00,B,training_style,tune,training_style_tune_000,4096,2048,1024,bf16,NVIDIA GeForce RTX 4060,c11,32,128,32,4,2,8,0.0,0.0,753.6320090293884,3689.973709583282,22.796098066649474,3,3,3,3_3_3,0,
2026-03-02T09:29:08.509776+00:00,B,training_style,tune,training_style_tune_001,1536,2048,1536,bf16,NVIDIA GeForce RTX 4060,c11,32,128,32,4,2,8,0.0,0.0,378.87999415397644,411.4124664664268,25.505903096252407,3,3,3,3_3_3,0,
2026-03-02T09:29:08.717883+00:00,B,training_style,tune,training_style_tune_002,3072,2048,4096,bf16,NVIDIA GeForce RTX 4060,c11,32,128,32,4,2,8,0.0,0.0,1832.7679634094238,2015.9590542316432,28.121185322403257,3,3,3,3_3_3,0,
2026-03-02T09:29:08.779489+00:00,B,training_style,tune,training_style_tune_003,2048,1536,2048,bf16,NVIDIA GeForce RTX 4060,c11,32,128,32,4,2,8,0.0,0.0,475.13599693775177,543.0169761180877,27.118345002363753,3,3,3,3_3_3,0,
2026-03-02T09:29:08.790808+00:00,B,training_style,tune,training_style_tune_004,512,512,1024,bf16,NVIDIA GeForce RTX 4060,c04,64,64,64,4,3,8,0.0,0.0,51.19999870657921,198.52414891123746,10.485760264892583,2,2,3,2_2_3,0,
2026-03-02T09:29:08.818590+00:00,B,training_style,tune,training_style_tune_005,1024,1536,1536,bf16,NVIDIA GeForce RTX 4060,c11,32,128,32,4,2,8,0.0,0.0,205.21599799394608,323.82975041866297,23.545134176832256,3,3,3,3_3_3,0,
2026-03-02T09:29:08.831389+00:00,B,training_style,tune,training_style_tune_006,1024,1536,512,bf16,NVIDIA GeForce RTX 4060,c06,64,128,32,4,3,8,0.0,0.0,92.12800115346909,172.5753533840179,17.482336703658664,3,3,2,3_3_2,0,
2026-03-02T09:29:08.847309+00:00,B,training_style,tune,training_style_tune_007,2048,1536,512,bf16,NVIDIA GeForce RTX 4060,c06,64,128,32,4,3,8,0.0,0.0,132.09599256515503,192.64800086617464,24.385489744597383,3,3,2,3_3_2,0,
2026-03-02T09:29:08.936848+00:00,B,training_style,tune,training_style_tune_008,3072,3072,1536,bf16,NVIDIA GeForce RTX 4060,c11,32,128,32,4,2,8,0.0,0.0,924.9919950962067,1069.406076669693,31.34192447252984,3,3,3,3_3_3,0,
2026-03-02T09:29:08.955951+00:00,B,training_style,tune,training_style_tune_009,1024,1536,1024,bf16,NVIDIA GeForce RTX 4060,c11,32,128,32,4,2,8,0.0,0.0,139.26400244235992,211.62143573164934,23.130352535525002,3,3,3,3_3_3,0,
2026-03-02T09:29:09.053387+00:00,B,training_style,tune,training_style_tune_010,1536,2048,4096,bf16,NVIDIA GeForce RTX 4060,c11,32,128,32,4,2,8,0.0,0.0,839.680016040802,973.9270257949829,30.69002868200663,3,3,3,3_3_3,0,
2026-03-02T09:29:09.109489+00:00,B,training_style,tune,training_style_tune_011,1024,1024,4096,bf16,NVIDIA GeForce RTX 4060,c11,32,128,32,4,2,8,0.0,0.0,318.91199946403503,442.46783971786493,26.935125070352587,3,3,3,3_3_3,0,
2026-03-02T09:29:09.454273+00:00,B,training_style,tune,training_style_tune_012,3072,4096,4096,bf16,NVIDIA GeForce RTX 4060,c11,32,128,32,4,2,8,0.0,0.0,3534.6879959106445,3653.683121204376,29.162182128452223,3,3,3,3_3_3,0,
2026-03-02T09:29:09.488477+00:00,B,training_style,tune,training_style_tune_013,512,1024,3072,bf16,NVIDIA GeForce RTX 4060,c06,64,128,32,4,3,8,0.0,0.0,118.78400295972824,150.5689588189125,27.118344151881324,2,3,3,2_3_3,0,
2026-03-02T09:29:09.508598+00:00,B,training_style,tune,training_style_tune_014,1536,1024,1024,bf16,NVIDIA GeForce RTX 4060,c11,32,128,32,4,2,8,0.0,0.0,140.28799533843994,452.8947386145587,22.96151901115206,3,3,3,3_3_3,0,
2026-03-02T09:29:09.578498+00:00,B,training_style,tune,training_style_tune_015,2048,3072,1536,bf16,NVIDIA GeForce RTX 4060,c11,32,128,32,4,2,8,0.0,0.0,655.2799940109253,727.2425776720047,29.494800709080952,3,3,3,3_3_3,0,
2026-03-02T09:29:09.702371+00:00,B,training_style,tune,training_style_tune_016,1536,3072,3072,bf16,NVIDIA GeForce RTX 4060,c11,32,128,32,4,2,8,0.0,0.0,929.6000003814697,1089.0201175212858,31.186563291849474,3,3,3,3_3_3,0,
2026-03-02T09:29:09.729724+00:00,B,training_style,tune,training_style_tune_017,1024,1024,2048,bf16,NVIDIA GeForce RTX 4060,c11,32,128,32,4,2,8,0.0,0.0,179.19999361038208,238.7641586363315,23.967452283163297,3,3,3,3_3_3,0,
2026-03-02T09:29:09.762255+00:00,B,training_style,tune,training_style_tune_018,1536,1536,1536,bf16,NVIDIA GeForce RTX 4060,c11,32,128,32,4,2,8,0.0,0.0,255.42399287223816,273.1376034021377,28.3753974342782,3,3,3,3_3_3,0,
2026-03-02T09:29:09.802122+00:00,B,training_style,tune,training_style_tune_019,1536,1536,2048,bf16,NVIDIA GeForce RTX 4060,c11,32,128,32,4,2,8,0.0,0.0,326.447993516922,341.4979237318039,29.60249904399877,3,3,3,3_3_3,0,
2026-03-02T09:29:09.824537+00:00,B,training_style,tune,training_style_tune_020,1536,1536,1024,bf16,NVIDIA GeForce RTX 4060,c11,32,128,32,4,2,8,0.0,0.0,181.2959983944893,223.34143981337542,26.651653929427656,3,3,3,3_3_3,0,
2026-03-02T09:29:09.854142+00:00,B,training_style,tune,training_style_tune_021,1024,2048,1536,bf16,NVIDIA GeForce RTX 4060,c11,32,128,32,4,2,8,0.0,0.0,240.63999950885773,250.75936570763588,26.772153246130888,3,3,3,3_3_3,0,
2026-03-02T09:29:09.868276+00:00,B,training_style,tune,training_style_tune_022,512,1024,1536,bf16,NVIDIA GeForce RTX 4060,c06,64,128,32,4,3,8,0.0,0.0,80.17599955201149,86.92991867661476,20.08846469017414,2,3,3,2_3_3,0,
2026-03-02T09:29:09.915628+00:00,B,training_style,tune,training_style_tune_023,1536,2048,2048,bf16,NVIDIA GeForce RTX 4060,c11,32,128,32,4,2,8,0.0,0.0,432.3839992284775,455.9881556034088,29.799673232569013,3,3,3,3_3_3,0,
2026-03-02T09:29:09.932981+00:00,B,training_style,tune,training_style_tune_024,1024,1024,1024,bf16,NVIDIA GeForce RTX 4060,c11,32,128,32,4,2,8,0.0,0.0,109.58399996161461,214.05695766210533,19.596689742592226,3,3,3,3_3_3,0,
2026-03-02T09:29:09.994229+00:00,B,training_style,tune,training_style_tune_025,1536,1024,4096,bf16,NVIDIA GeForce RTX 4060,c11,32,128,32,4,2,8,0.0,0.0,443.90399754047394,513.1289723515509,29.026325420340896,3,3,3,3_3_3,0,
2026-03-02T09:29:10.025543+00:00,B,training_style,tune,training_style_tune_026,2048,4096,512,bf16,NVIDIA GeForce RTX 4060,c06,64,128,32,4,3,8,0.0,0.0,287.7439856529236,351.60127729177464,29.852698997369032,3,3,2,3_3_2,0,
2026-03-02T09:29:10.178598+00:00,B,training_style,tune,training_style_tune_027,4096,4096,1536,bf16,NVIDIA GeForce RTX 4060,c11,32,128,32,4,2,8,0.0,0.0,1717.7599668502808,1792.5427186489105,30.003963619261697,3,3,3,3_3_3,0,
2026-03-02T09:29:10.274297+00:00,B,training_style,tune,training_style_tune_028,1536,1536,4096,bf16,NVIDIA GeForce RTX 4060,c11,32,128,32,4,2,8,0.0,0.0,596.992015838623,692.6153701543806,32.37455831775229,3,3,3,3_3_3,0,
2026-03-02T09:29:10.391765+00:00,B,training_style,tune,training_style_tune_029,4096,2048,2048,bf16,NVIDIA GeForce RTX 4060,c11,32,128,32,4,2,8,0.0,0.0,1109.9199652671814,1271.0912203788757,30.95695135074796,3,3,3,3_3_3,0,
2026-03-02T09:29:10.412940+00:00,B,training_style,tune,training_style_tune_030,2048,2048,512,bf16,NVIDIA GeForce RTX 4060,c06,64,128,32,4,3,8,0.0,0.0,167.2319993376732,336.6195183992386,25.682688199688656,3,3,2,3_3_2,0,
2026-03-02T09:29:10.427543+00:00,B,training_style,tune,training_style_tune_031,512,512,1536,bf16,NVIDIA GeForce RTX 4060,c04,64,64,64,4,3,8,0.0,0.0,54.576000198721886,110.1062427461147,14.75568684161027,2,2,3,2_2_3,0,
2026-03-02T09:29:10.506834+00:00,B,training_style,eval,training_style_eval_000,2048,1536,3072,bf16,NVIDIA GeForce RTX 4060,c11,32,128,32,4,2,8,0.0,0.0,645.5680131912231,775.485438108444,29.938523032545387,3,3,3,3_3_3,0,
2026-03-02T09:29:10.547926+00:00,B,training_style,eval,training_style_eval_001,1024,2048,2048,bf16,NVIDIA GeForce RTX 4060,c11,32,128,32,4,2,8,0.0,0.0,311.93599104881287,349.964478611946,27.53749114720083,3,3,3,3_3_3,0,
2026-03-02T09:29:10.594781+00:00,B,training_style,eval,training_style_eval_002,1536,1024,3072,bf16,NVIDIA GeForce RTX 4060,c11,32,128,32,4,2,8,0.0,0.0,339.7600054740906,409.26208049058914,28.44265440399792,3,3,3,3_3_3,0,
2026-03-02T09:29:10.606923+00:00,B,training_style,eval,training_style_eval_003,1024,512,1024,bf16,NVIDIA GeForce RTX 4060,c06,64,128,32,4,3,8,0.0,0.0,69.50400024652481,212.11135685443855,15.4486334627004,3,2,3,3_2_3,0,
2026-03-02T09:29:10.629327+00:00,B,training_style,eval,training_style_eval_004,1024,2048,1024,bf16,NVIDIA GeForce RTX 4060,c11,32,128,32,4,2,8,0.0,0.0,170.30400037765503,302.7660742402077,25.219415201497092,3,3,3,3_3_3,0,
2026-03-02T09:29:10.646411+00:00,B,training_style,eval,training_style_eval_005,1024,512,1536,bf16,NVIDIA GeForce RTX 4060,c06,64,128,32,4,3,8,0.0,0.0,94.97600048780441,172.0934461057186,16.958102338777827,3,2,3,3_2_3,0,
2026-03-02T09:29:10.700160+00:00,B,training_style,eval,training_style_eval_006,2048,1536,2048,bf16,NVIDIA GeForce RTX 4060,c11,32,128,32,4,2,8,0.0,0.0,427.96801030635834,518.021108806133,30.10716123099112,3,3,3,3_3_3,0,
2026-03-02T09:29:10.728744+00:00,B,training_style,eval,training_style_eval_007,1536,2048,1024,bf16,NVIDIA GeForce RTX 4060,c11,32,128,32,4,2,8,0.0,0.0,236.38399690389633,308.52992713451374,27.254175529569483,3,3,3,3_3_3,0,
2026-03-02T09:29:10.741899+00:00,B,training_style,eval,training_style_eval_008,512,512,2048,bf16,NVIDIA GeForce RTX 4060,c04,64,64,64,4,3,8,0.0,0.0,72.7040022611618,168.9632032811641,14.768675597018525,2,2,3,2_2_3,0,
2026-03-02T09:29:10.761871+00:00,B,training_style,eval,training_style_eval_009,1024,512,2048,bf16,NVIDIA GeForce RTX 4060,c06,64,128,32,4,3,8,0.0,0.0,105.8880016207695,177.49887987971297,20.28070806068343,3,2,3,3_2_3,0,
2026-03-02T09:29:10.805220+00:00,B,training_style,eval,training_style_eval_010,2048,3072,1024,bf16,NVIDIA GeForce RTX 4060,c11,32,128,32,4,2,8,0.0,0.0,430.9439957141876,458.67455810308456,29.89924912782768,3,3,3,3_3_3,0,
2026-03-02T09:29:10.884769+00:00,B,training_style,eval,training_style_eval_011,2048,4096,1536,bf16,NVIDIA GeForce RTX 4060,c11,32,128,32,4,2,8,0.0,0.0,840.6879901885986,911.3293015956878,30.653231730143833,3,3,3,3_3_3,0,
2026-03-02T09:29:11.018419+00:00,B,training_style,eval,training_style_eval_012,2048,3072,3072,bf16,NVIDIA GeForce RTX 4060,c11,32,128,32,4,2,8,0.0,0.0,1222.656011581421,1333.3068680763245,31.615356484447997,3,3,3,3_3_3,0,
2026-03-02T09:29:11.087781+00:00,B,training_style,eval,training_style_eval_013,3072,1536,1536,bf16,NVIDIA GeForce RTX 4060,c11,32,128,32,4,2,8,0.0,0.0,501.0719895362854,626.5753591060637,28.929006064407634,3,3,3,3_3_3,0,
2026-03-02T09:29:11.128658+00:00,B,training_style,eval,training_style_eval_014,2048,1536,1536,bf16,NVIDIA GeForce RTX 4060,c11,32,128,32,4,2,8,0.0,0.0,351.23199224472046,392.0384019613265,27.513656584183952,3,3,3,3_3_3,0,
2026-03-02T09:29:11.185449+00:00,B,training_style,eval,training_style_eval_015,4096,2048,1024,bf16,NVIDIA GeForce RTX 4060,c11,32,128,32,4,2,8,0.0,0.0,586.2399935722351,654.2425459623336,29.30518110733968,3,3,3,3_3_3,0,
2026-03-02T09:29:11.198606+00:00,B,training_style,eval,training_style_eval_016,2048,1024,512,bf16,NVIDIA GeForce RTX 4060,c06,64,128,32,4,3,8,0.0,0.0,96.11200168728828,156.25951945781702,22.343553461586318,3,3,2,3_3_2,0,
2026-03-02T09:29:11.318197+00:00,B,training_style,eval,training_style_eval_017,2048,4096,2048,bf16,NVIDIA GeForce RTX 4060,c11,32,128,32,4,2,8,0.0,0.0,1120.192050933838,1280.5426955223083,30.673078191687143,3,3,3,3_3_3,0,
2026-03-02T09:29:11.402126+00:00,B,training_style,eval,training_style_eval_018,1536,2048,3072,bf16,NVIDIA GeForce RTX 4060,c11,32,128,32,4,2,8,0.0,0.0,644.5600092411041,786.9916766881943,29.985342799587816,3,3,3,3_3_3,0,
2026-03-02T09:29:11.462426+00:00,B,training_style,eval,training_style_eval_019,1536,1536,3072,bf16,NVIDIA GeForce RTX 4060,c11,32,128,32,4,2,8,0.0,0.0,459.77601408958435,576.2457615137099,31.527339791100204,3,3,3,3_3_3,0,
2026-03-02T09:29:11.530234+00:00,B,training_style,eval,training_style_eval_020,3072,1536,2048,bf16,NVIDIA GeForce RTX 4060,c11,32,128,32,4,2,8,0.0,0.0,629.2480230331421,690.7340818643569,30.71499968937056,3,3,3,3_3_3,0,
2026-03-02T09:29:11.615566+00:00,B,training_style,eval,training_style_eval_021,2048,1024,4096,bf16,NVIDIA GeForce RTX 4060,c11,32,128,32,4,2,8,0.0,0.0,570.2399909496307,644.7091239690781,30.127436617326786,3,3,3,3_3_3,0,
2026-03-02T09:29:11.626802+00:00,B,training_style,eval,training_style_eval_022,512,512,1536,bf16,NVIDIA GeForce RTX 4060,c04,64,64,64,4,3,8,0.0,0.0,57.28000029921532,264.76544693112317,14.059119479631567,2,2,3,2_2_3,0,
2026-03-02T09:29:11.976286+00:00,B,training_style,eval,training_style_eval_023,3072,4096,4096,bf16,NVIDIA GeForce RTX 4060,c11,32,128,32,4,2,8,0.0,0.0,3526.5599489212036,3639.531562328338,29.229395387290257,3,3,3,3_3_3,0,
2026-03-02T09:29:12.054286+00:00,B,training_style,eval,training_style_eval_024,1536,1024,4096,bf16,NVIDIA GeForce RTX 4060,c11,32,128,32,4,2,8,0.0,0.0,425.7600009441376,557.6070380210874,30.263298241796512,3,3,3,3_3_3,0,
2026-03-02T09:29:12.215154+00:00,B,training_style,eval,training_style_eval_025,4096,3072,2048,bf16,NVIDIA GeForce RTX 4060,c11,32,128,32,4,2,8,0.0,0.0,1707.0239782333374,1843.0873835086823,30.192667595296612,3,3,3,3_3_3,0,
2026-03-02T09:29:12.233658+00:00,B,training_style,eval,training_style_eval_026,1024,512,512,bf16,NVIDIA GeForce RTX 4060,c11,32,128,32,4,2,8,0.0,0.0,56.2720000743866,168.15104082226736,9.540640305841345,3,2,2,3_2_2,0,
2026-03-02T09:29:12.295258+00:00,B,training_style,eval,training_style_eval_027,2048,4096,1024,bf16,NVIDIA GeForce RTX 4060,c11,32,128,32,4,2,8,0.0,0.0,592.2240018844604,660.1337420940399,29.009072799031358,3,3,3,3_3_3,0,
2026-03-02T09:29:12.319288+00:00,B,training_style,eval,training_style_eval_028,1536,1536,1024,bf16,NVIDIA GeForce RTX 4060,c11,32,128,32,4,2,8,0.0,0.0,189.43999707698822,352.20159888267494,25.505903096252407,3,3,3,3_3_3,0,
2026-03-02T09:29:12.350229+00:00,B,training_style,eval,training_style_eval_029,1024,512,4096,bf16,NVIDIA GeForce RTX 4060,c06,64,128,32,4,3,8,0.0,0.0,171.00800573825836,266.2604808807373,25.1155919716051,3,2,3,3_2_3,0,
2026-03-02T09:29:12.385870+00:00,B,training_style,eval,training_style_eval_030,1024,1024,3072,bf16,NVIDIA GeForce RTX 4060,c11,32,128,32,4,2,8,0.0,0.0,253.34399938583374,383.16032260656334,25.429656749786997,3,3,3,3_3_3,0,
2026-03-02T09:29:12.396690+00:00,B,training_style,eval,training_style_eval_031,1024,1024,512,bf16,NVIDIA GeForce RTX 4060,c06,64,128,32,4,3,8,0.0,0.0,69.61600109934807,111.52639918029297,15.423779117500263,3,3,2,3_3_2,0,
2026-03-02T09:29:12.408066+00:00,B,training_style,eval,training_style_eval_032,512,1024,1024,bf16,NVIDIA GeForce RTX 4060,c06,64,128,32,4,3,8,0.0,0.0,68.60800087451935,81.80416040122508,15.650387860212119,2,3,3,2_3_3,0,
2026-03-02T09:29:12.494749+00:00,B,training_style,eval,training_style_eval_033,3072,2048,2048,bf16,NVIDIA GeForce RTX 4060,c11,32,128,32,4,2,8,0.0,0.0,844.2879915237427,964.4953399896622,30.522527898912223,3,3,3,3_3_3,0,
2026-03-02T09:29:12.507120+00:00,B,training_style,eval,training_style_eval_034,1536,1024,512,bf16,NVIDIA GeForce RTX 4060,c06,64,128,32,4,3,8,0.0,0.0,82.94399827718735,183.3984024822712,19.41807447740288,3,3,2,3_3_2,0,
2026-03-02T09:29:12.935543+00:00,B,training_style,eval,training_style_eval_035,4096,4096,4096,bf16,NVIDIA GeForce RTX 4060,c11,32,128,32,4,2,8,0.0,0.0,4681.72812461853,4820.449595451355,29.356457661282626,3,3,3,3_3_3,0,
2026-03-02T09:29:13.186051+00:00,B,training_style,eval,training_style_eval_036,2048,4096,4096,bf16,NVIDIA GeForce RTX 4060,c11,32,128,32,4,2,8,0.0,0.0,2327.5680541992188,2485.5640840530396,29.524153595432633,3,3,3,3_3_3,0,
2026-03-02T09:29:13.236397+00:00,B,training_style,eval,training_style_eval_037,4096,2048,512,bf16,NVIDIA GeForce RTX 4060,c06,64,128,32,4,3,8,0.0,0.0,331.1839997768402,536.3814303278916,25.937045865102498,3,3,2,3_3_2,0,
2026-03-02T09:29:13.253841+00:00,B,training_style,eval,training_style_eval_038,2048,1536,512,bf16,NVIDIA GeForce RTX 4060,c06,64,128,32,4,3,8,0.0,0.0,129.02399897575378,146.72703966498375,24.96609543628649,3,3,2,3_3_2,0,
2026-03-02T09:29:13.347204+00:00,B,training_style,eval,training_style_eval_039,3072,3072,1536,bf16,NVIDIA GeForce RTX 4060,c11,32,128,32,4,2,8,0.0,0.0,932.1440160274506,993.423353433609,31.101448649053225,3,3,3,3_3_3,0,
2026-03-02T09:29:13.361015+00:00,B,training_style,eval,training_style_eval_040,1536,1536,512,bf16,NVIDIA GeForce RTX 4060,c06,64,128,32,4,3,8,0.0,0.0,102.39999741315842,148.803521990776,23.592960596008318,3,3,2,3_3_2,0,
2026-03-02T09:29:13.479479+00:00,B,training_style,eval,training_style_eval_041,3072,3072,2048,bf16,NVIDIA GeForce RTX 4060,c11,32,128,32,4,2,8,0.0,0.0,1289.2640233039856,1364.5925986766815,29.981993575636995,3,3,3,3_3_3,0,
2026-03-02T09:29:13.612116+00:00,B,training_style,eval,training_style_eval_042,3072,4096,1536,bf16,NVIDIA GeForce RTX 4060,c11,32,128,32,4,2,8,0.0,0.0,1285.1359844207764,1362.7241373062134,30.078299987391652,3,3,3,3_3_3,0,
2026-03-02T09:29:13.693814+00:00,B,training_style,eval,training_style_eval_043,2048,3072,1536,bf16,NVIDIA GeForce RTX 4060,c11,32,128,32,4,2,8,0.0,0.0,661.5039706230164,762.2723084688187,29.217289223218344,3,3,3,3_3_3,0,
2026-03-02T09:29:13.717903+00:00,B,training_style,eval,training_style_eval_044,512,512,4096,bf16,NVIDIA GeForce RTX 4060,c04,64,64,64,4,3,8,0.0,0.0,110.33599823713303,132.0511995255947,19.463127921176273,2,2,3,2_2_3,0,
2026-03-02T09:29:13.775942+00:00,B,training_style,eval,training_style_eval_045,2048,1024,3072,bf16,NVIDIA GeForce RTX 4060,c11,32,128,32,4,2,8,0.0,0.0,437.1199905872345,460.29824286699295,29.476807662560116,3,3,3,3_3_3,0,
2026-03-02T09:29:14.127599+00:00,B,training_style,eval,training_style_eval_046,4096,3072,4096,bf16,NVIDIA GeForce RTX 4060,c11,32,128,32,4,2,8,0.0,0.0,3481.600046157837,3590.9299325942993,29.60685137218859,3,3,3,3_3_3,0,
2026-03-02T09:29:14.172314+00:00,B,training_style,eval,training_style_eval_047,1536,3072,1024,bf16,NVIDIA GeForce RTX 4060,c11,32,128,32,4,2,8,0.0,0.0,339.27999436855316,416.9215956330298,28.48289488446094,3,3,3,3_3_3,0,
2026-03-02T09:29:14.191494+00:00,B,training_style,eval,training_style_eval_048,512,512,3072,bf16,NVIDIA GeForce RTX 4060,c04,64,64,64,4,3,8,0.0,0.0,109.3279980123043,116.10752113163471,14.731932947484632,2,2,3,2_2_3,0,
2026-03-02T09:29:14.222334+00:00,B,training_style,eval,training_style_eval_049,512,1024,4096,bf16,NVIDIA GeForce RTX 4060,c06,64,128,32,4,3,8,0.0,0.0,182.14399367570877,270.9401661157608,23.580065470875798,2,3,3,2_3_3,0,
2026-03-02T09:29:14.247190+00:00,B,training_style,eval,training_style_eval_050,3072,2048,512,bf16,NVIDIA GeForce RTX 4060,c06,64,128,32,4,3,8,0.0,0.0,200.70399343967438,300.7804834842681,32.09926635533741,3,3,2,3_3_2,0,
2026-03-02T09:29:14.261001+00:00,B,training_style,eval,training_style_eval_051,512,512,1024,bf16,NVIDIA GeForce RTX 4060,c04,64,64,64,4,3,8,0.0,0.0,71.10400125384331,198.21568369865417,7.55050211707996,2,2,3,2_2_3,0,
2026-03-02T09:29:14.304139+00:00,B,training_style,eval,training_style_eval_052,1536,2048,1536,bf16,NVIDIA GeForce RTX 4060,c11,32,128,32,4,2,8,0.0,0.0,329.1520029306412,351.2934321165085,29.3593122021388,3,3,3,3_3_3,0,
2026-03-02T09:29:14.408573+00:00,B,training_style,eval,training_style_eval_053,1536,3072,3072,bf16,NVIDIA GeForce RTX 4060,c11,32,128,32,4,2,8,0.0,0.0,915.4559969902039,1004.3177509307859,31.668402788681746,3,3,3,3_3_3,0,
2026-03-02T09:29:14.450724+00:00,B,training_style,eval,training_style_eval_054,4096,3072,512,bf16,NVIDIA GeForce RTX 4060,c06,64,128,32,4,3,8,0.0,0.0,413.5040044784546,469.1516837477683,31.160283209957065,3,3,2,3_3_2,0,
2026-03-02T09:29:14.467572+00:00,B,training_style,eval,training_style_eval_055,1024,1024,1024,bf16,NVIDIA GeForce RTX 4060,c11,32,128,32,4,2,8,0.0,0.0,107.51999914646149,185.87455943226814,19.972876349029196,3,3,3,3_3_3,0,
2026-03-02T09:29:14.493392+00:00,B,training_style,eval,training_style_eval_056,512,1024,3072,bf16,NVIDIA GeForce RTX 4060,c06,64,128,32,4,3,8,0.0,0.0,141.31200313568115,226.969598531723,22.795129928963856,2,3,3,2_3_3,0,
2026-03-02T09:29:14.514699+00:00,B,training_style,eval,training_style_eval_057,1024,1536,1024,bf16,NVIDIA GeForce RTX 4060,c11,32,128,32,4,2,8,0.0,0.0,165.3119996190071,277.54305094480515,19.48573291366583,3,3,3,3_3_3,0,
2026-03-02T09:29:14.635832+00:00,B,training_style,eval,training_style_eval_058,4096,2048,2048,bf16,NVIDIA GeForce RTX 4060,c11,32,128,32,4,2,8,0.0,0.0,1132.8319907188416,1266.5564572811127,30.3308333888037,3,3,3,3_3_3,0,
2026-03-02T09:29:14.661015+00:00,B,training_style,eval,training_style_eval_059,2048,3072,512,bf16,NVIDIA GeForce RTX 4060,c06,64,128,32,4,3,8,0.0,0.0,228.33599895238876,298.66143524646753,28.214784237080988,3,3,2,3_3_2,0,
2026-03-02T09:29:14.694052+00:00,B,training_style,eval,training_style_eval_060,3072,3072,512,bf16,NVIDIA GeForce RTX 4060,c06,64,128,32,4,3,8,0.0,0.0,323.5519975423813,412.6924780011177,29.867460220931505,3,3,2,3_3_2,0,
2026-03-02T09:29:14.761015+00:00,B,training_style,eval,training_style_eval_061,2048,2048,2048,bf16,NVIDIA GeForce RTX 4060,c11,32,128,32,4,2,8,0.0,0.0,567.7600204944611,767.5596529245377,30.259032978472284,3,3,3,3_3_3,0,
2026-03-02T09:29:14.775972+00:00,B,training_style,eval,training_style_eval_062,1024,2048,512,bf16,NVIDIA GeForce RTX 4060,c06,64,128,32,4,3,8,0.0,0.0,103.93599793314934,235.70431783795354,20.661596469985707,3,3,2,3_3_2,0,
2026-03-02T09:29:14.889176+00:00,B,training_style,eval,training_style_eval_063,3072,1536,3072,bf16,NVIDIA GeForce RTX 4060,c11,32,128,32,4,2,8,0.0,0.0,923.6479997634888,1032.7756762504578,31.38752994151831,3,3,3,3_3_3,0,
2026-03-02T09:29:14.905521+00:00,B,adversarial,tune,adversarial_tune_000,1,1024,1024,bf16,NVIDIA GeForce RTX 4060,c02,32,64,32,2,2,8,0.0,0.0,47.488000243902206,126.07487782835959,0.04416172484056726,0,3,3,0_3_3,0,
2026-03-02T09:29:14.927748+00:00,B,adversarial,tune,adversarial_tune_001,1,1024,4096,bf16,NVIDIA GeForce RTX 4060,c02,32,64,32,2,2,8,0.0,0.0,68.95999982953072,74.06208135187626,0.1216445478645107,0,3,3,0_3_3,0,
2026-03-02T09:29:14.944144+00:00,B,adversarial,tune,adversarial_tune_002,1,4096,1024,bf16,NVIDIA GeForce RTX 4060,c02,32,64,32,2,2,8,0.0,0.0,36.86400130391121,127.94720157980919,0.22755554750672122,0,3,3,0_3_3,0,
2026-03-02T09:29:15.027865+00:00,B,adversarial,tune,adversarial_tune_003,1,4096,4096,bf16,NVIDIA GeForce RTX 4060,c02,32,64,32,2,2,8,0.0,0.0,167.93599724769592,243.64704310894012,0.19980488132338384,0,3,3,0_3_3,0,
2026-03-02T09:29:15.079796+00:00,B,adversarial,tune,adversarial_tune_004,1,8192,1024,bf16,NVIDIA GeForce RTX 4060,c02,32,64,32,2,2,8,0.0,0.0,93.75999867916107,254.2246320843695,0.17893788647982214,0,3,3,0_3_3,0,
2026-03-02T09:29:15.253736+00:00,B,adversarial,tune,adversarial_tune_005,1,8192,4096,bf16,NVIDIA GeForce RTX 4060,c02,32,64,32,2,2,8,0.0,0.0,298.38401079177856,380.6860855221747,0.22490770809710245,0,3,3,0_3_3,0,
2026-03-02T09:29:15.264422+00:00,B,adversarial,tune,adversarial_tune_006,2,1024,1024,bf16,NVIDIA GeForce RTX 4060,c02,32,64,32,2,2,8,0.0,0.0,40.95999896526337,152.72800236940378,0.10240000258684165,0,3,3,0_3_3,0,
2026-03-02T09:29:15.285216+00:00,B,adversarial,tune,adversarial_tune_007,2,1024,4096,bf16,NVIDIA GeForce RTX 4060,c02,32,64,32,2,2,8,0.0,0.0,92.0960009098053,275.23232862353314,0.18217095025038987,0,3,3,0_3_3,0,
2026-03-02T09:29:15.302115+00:00,B,adversarial,tune,adversarial_tune_008,2,4096,1024,bf16,NVIDIA GeForce RTX 4060,c02,32,64,32,2,2,8,0.0,0.0,37.55199909210205,81.3033625856041,0.44677291237814787,0,3,3,0_3_3,0,
2026-03-02T09:29:15.384763+00:00,B,adversarial,tune,adversarial_tune_009,2,4096,4096,bf16,NVIDIA GeForce RTX 4060,c02,32,64,32,2,2,8,0.0,0.0,162.81600296497345,228.9151993393898,0.41217609312296594,0,3,3,0_3_3,0,
2026-03-02T09:29:15.426345+00:00,B,adversarial,tune,adversarial_tune_010,2,8192,1024,bf16,NVIDIA GeForce RTX 4060,c02,32,64,32,2,2,8,0.0,0.0,52.22399905323982,242.79039949178656,0.6425098155695218,0,3,3,0_3_3,0,
2026-03-02T09:29:15.586229+00:00,B,adversarial,tune,adversarial_tune_011,2,8192,4096,bf16,NVIDIA GeForce RTX 4060,c02,32,64,32,2,2,8,0.0,0.0,293.88800263404846,380.1376086473464,0.45669686001823256,0,3,3,0_3_3,0,
2026-03-02T09:29:15.594530+00:00,B,adversarial,tune,adversarial_tune_012,4,1024,1024,bf16,NVIDIA GeForce RTX 4060,c02,32,64,32,2,2,8,0.0,0.0,39.84000161290169,89.61599886417375,0.21055742119456777,0,3,3,0_3_3,0,
2026-03-02T09:29:15.614782+00:00,B,adversarial,tune,adversarial_tune_013,4,1024,4096,bf16,NVIDIA GeForce RTX 4060,c02,32,64,32,2,2,8,0.0,0.0,71.72800227999687,146.44480392336843,0.46780101122874135,0,3,3,0_3_3,0,
2026-03-02T09:29:15.631744+00:00,B,adversarial,tune,adversarial_tune_014,4,4096,1024,bf16,NVIDIA GeForce RTX 4060,c02,32,64,32,2,2,8,0.0,0.0,46.879999339580536,109.47296172380445,0.7157515459192886,0,3,3,0_3_3,0,
2026-03-02T09:29:15.717950+00:00,B,adversarial,tune,adversarial_tune_015,4,4096,4096,bf16,NVIDIA GeForce RTX 4060,c02,32,64,32,2,2,8,0.0,0.0,162.59200125932693,226.55520007014275,0.825487889689781,0,3,3,0_3_3,0,
2026-03-02T09:29:15.757532+00:00,B,adversarial,tune,adversarial_tune_016,4,8192,1024,bf16,NVIDIA GeForce RTX 4060,c02,32,64,32,2,2,8,0.0,0.0,55.296000093221664,158.89408148825154,1.2136296275836123,0,3,3,0_3_3,0,
2026-03-02T09:29:15.920072+00:00,B,adversarial,tune,adversarial_tune_017,4,8192,4096,bf16,NVIDIA GeForce RTX 4060,c02,32,64,32,2,2,8,0.0,0.0,295.9359884262085,391.9974422454833,0.9070726998346612,0,3,3,0_3_3,0,
2026-03-02T09:29:15.930967+00:00,B,adversarial,tune,adversarial_tune_018,8,1024,1024,bf16,NVIDIA GeForce RTX 4060,c02,32,64,32,2,2,8,0.0,0.0,67.60000064969063,169.5846416056156,0.24818366625380764,0,3,3,0_3_3,0,
2026-03-02T09:29:15.949084+00:00,B,adversarial,tune,adversarial_tune_019,8,1024,4096,bf16,NVIDIA GeForce RTX 4060,c02,32,64,32,2,2,8,0.0,0.0,66.27199798822403,119.90048252046105,1.0126277468188702,0,3,3,0_3_3,0,
2026-03-02T09:29:15.965913+00:00,B,adversarial,tune,adversarial_tune_020,8,4096,1024,bf16,NVIDIA GeForce RTX 4060,c02,32,64,32,2,2,8,0.0,0.0,36.91199980676174,95.84640249609934,1.8180771659981054,0,3,3,0_3_3,0,
2026-03-02T09:29:16.052747+00:00,B,adversarial,tune,adversarial_tune_021,8,4096,4096,bf16,NVIDIA GeForce RTX 4060,c02,32,64,32,2,2,8,0.0,0.0,165.8879965543747,244.24320369958875,1.6181728731169065,0,3,3,0_3_3,0,
2026-03-02T09:29:16.094572+00:00,B,adversarial,tune,adversarial_tune_022,8,8192,1024,bf16,NVIDIA GeForce RTX 4060,c02,32,64,32,2,2,8,0.0,0.0,49.0880012512207,183.27359825372685,2.7342267881942397,0,3,3,0_3_3,0,
2026-03-02T09:29:16.254713+00:00,B,adversarial,tune,adversarial_tune_023,8,8192,4096,bf16,NVIDIA GeForce RTX 4060,c02,32,64,32,2,2,8,0.0,0.0,295.9359884262085,325.8764725923538,1.8141453996693224,0,3,3,0_3_3,0,
2026-03-02T09:29:16.263093+00:00,B,adversarial,tune,adversarial_tune_024,16,1024,1024,bf16,NVIDIA GeForce RTX 4060,c02,32,64,32,2,2,8,0.0,0.0,39.64800015091896,104.81696128845206,0.8463083099343227,0,3,3,0_3_3,0,
2026-03-02T09:29:16.281385+00:00,B,adversarial,tune,adversarial_tune_025,16,1024,4096,bf16,NVIDIA GeForce RTX 4060,c02,32,64,32,2,2,8,0.0,0.0,72.7040022611618,86.57919950783253,1.8460844496273157,0,3,3,0_3_3,0,
2026-03-02T09:29:16.297688+00:00,B,adversarial,tune,adversarial_tune_026,16,4096,1024,bf16,NVIDIA GeForce RTX 4060,c02,32,64,32,2,2,8,0.0,0.0,36.3520011305809,64.27679866552346,3.6921688992546313,0,3,3,0_3_3,0,
2026-03-02T09:29:16.386162+00:00,B,adversarial,tune,adversarial_tune_027,16,4096,4096,bf16,NVIDIA GeForce RTX 4060,c02,32,64,32,2,2,8,0.0,0.0,164.2879992723465,254.67551723122597,3.267864447664303,0,3,3,0_3_3,0,
2026-03-02T09:29:16.427869+00:00,B,adversarial,tune,adversarial_tune_028,16,8192,1024,bf16,NVIDIA GeForce RTX 4060,c02,32,64,32,2,2,8,0.0,0.0,52.22399905323982,172.28607848286623,5.140078524556174,0,3,3,0_3_3,0,
2026-03-02T09:29:16.588454+00:00,B,adversarial,tune,adversarial_tune_029,16,8192,4096,bf16,NVIDIA GeForce RTX 4060,c02,32,64,32,2,2,8,0.0,0.0,298.75199496746063,388.9852875471113,3.5940908917342944,0,3,3,0_3_3,0,
2026-03-02T09:29:16.596558+00:00,B,adversarial,tune,adversarial_tune_030,32,1024,1024,bf16,NVIDIA GeForce RTX 4060,c02,32,64,32,2,2,8,0.0,0.0,38.91199827194214,48.44640001654625,1.7246316555371939,0,3,3,0_3_3,0,
2026-03-02T09:29:16.615837+00:00,B,adversarial,tune,adversarial_tune_031,32,1024,4096,bf16,NVIDIA GeForce RTX 4060,c02,32,64,32,2,2,8,0.0,0.0,66.56000018119812,143.321278989315,4.03298460440551,0,3,3,0_3_3,0,
2026-03-02T09:29:16.626466+00:00,B,adversarial,eval,adversarial_eval_000,1,1024,1024,bf16,NVIDIA GeForce RTX 4060,c02,32,64,32,2,2,8,0.0,0.0,47.98400029540062,93.88672046363345,0.0437052348092999,0,3,3,0_3_3,0,
2026-03-02T09:29:16.649559+00:00,B,adversarial,eval,adversarial_eval_001,1,1024,4096,bf16,NVIDIA GeForce RTX 4060,c02,32,64,32,2,2,8,0.0,0.0,98.7360030412674,191.6441568732261,0.08495997145533554,0,3,3,0_3_3,0,
2026-03-02T09:29:16.666745+00:00,B,adversarial,eval,adversarial_eval_002,1,4096,1024,bf16,NVIDIA GeForce RTX 4060,c02,32,64,32,2,2,8,0.0,0.0,51.59999988973141,85.99615812301633,0.16256992282803015,0,3,3,0_3_3,0,
2026-03-02T09:29:16.748247+00:00,B,adversarial,eval,adversarial_eval_003,1,4096,4096,bf16,NVIDIA GeForce RTX 4060,c02,32,64,32,2,2,8,0.0,0.0,163.66399824619293,186.11199945211405,0.2050202387792425,0,3,3,0_3_3,0,
2026-03-02T09:29:16.796630+00:00,B,adversarial,eval,adversarial_eval_004,1,8192,1024,bf16,NVIDIA GeForce RTX 4060,c02,32,64,32,2,2,8,0.0,0.0,68.60800087451935,209.67423617839796,0.24453731031581435,0,3,3,0_3_3,0,
2026-03-02T09:29:16.961049+00:00,B,adversarial,eval,adversarial_eval_005,1,8192,4096,bf16,NVIDIA GeForce RTX 4060,c02,32,64,32,2,2,8,0.0,0.0,300.03198981285095,319.8614424467087,0.22367236254327436,0,3,3,0_3_3,0,
2026-03-02T09:29:16.970189+00:00,B,adversarial,eval,adversarial_eval_006,2,1024,1024,bf16,NVIDIA GeForce RTX 4060,c02,32,64,32,2,2,8,0.0,0.0,46.08000069856644,85.77375818043934,0.09102222084233792,0,3,3,0_3_3,0,
2026-03-02T09:29:16.992350+00:00,B,adversarial,eval,adversarial_eval_007,2,1024,4096,bf16,NVIDIA GeForce RTX 4060,c02,32,64,32,2,2,8,0.0,0.0,98.30400347709656,226.3392050564288,0.17066666063004093,0,3,3,0_3_3,0,
2026-03-02T09:29:17.011568+00:00,B,adversarial,eval,adversarial_eval_008,2,4096,1024,bf16,NVIDIA GeForce RTX 4060,c02,32,64,32,2,2,8,0.0,0.0,50.175998359918594,213.95455747842772,0.334367357868098,0,3,3,0_3_3,0,
2026-03-02T09:29:17.097043+00:00,B,adversarial,eval,adversarial_eval_009,2,4096,4096,bf16,NVIDIA GeForce RTX 4060,c02,32,64,32,2,2,8,0.0,0.0,170.8960011601448,352.8703999519347,0.3926883223973918,0,3,3,0_3_3,0,
2026-03-02T09:29:17.138606+00:00,B,adversarial,eval,adversarial_eval_010,2,8192,1024,bf16,NVIDIA GeForce RTX 4060,c02,32,64,32,2,2,8,0.0,0.0,70.65600156784058,86.59232236444947,0.474898540186747,0,3,3,0_3_3,0,
2026-03-02T09:29:17.312797+00:00,B,adversarial,eval,adversarial_eval_011,2,8192,4096,bf16,NVIDIA GeForce RTX 4060,c02,32,64,32,2,2,8,0.0,0.0,476.1599898338318,625.2854347229002,0.28187527483533154,0,3,3,0_3_3,0,
2026-03-02T09:29:17.324592+00:00,B,adversarial,eval,adversarial_eval_012,4,1024,1024,bf16,NVIDIA GeForce RTX 4060,c02,32,64,32,2,2,8,0.0,0.0,55.695999413728714,211.52768075466156,0.15061419290973815,0,3,3,0_3_3,0,
2026-03-02T09:29:17.349561+00:00,B,adversarial,eval,adversarial_eval_013,4,1024,4096,bf16,NVIDIA GeForce RTX 4060,c02,32,64,32,2,2,8,0.0,0.0,127.47200578451157,224.83967781066895,0.263229811074935,0,3,3,0_3_3,0,
2026-03-02T09:29:17.368162+00:00,B,adversarial,eval,adversarial_eval_014,4,4096,1024,bf16,NVIDIA GeForce RTX 4060,c02,32,64,32,2,2,8,0.0,0.0,51.19999870657921,169.44000110030174,0.6553600165557865,0,3,3,0_3_3,0,
2026-03-02T09:29:17.461707+00:00,B,adversarial,eval,adversarial_eval_015,4,4096,4096,bf16,NVIDIA GeForce RTX 4060,c02,32,64,32,2,2,8,0.0,0.0,256.3680112361908,328.06560188531864,0.5235353948911582,0,3,3,0_3_3,0,
2026-03-02T09:29:17.503315+00:00,B,adversarial,eval,adversarial_eval_016,4,8192,1024,bf16,NVIDIA GeForce RTX 4060,c02,32,64,32,2,2,8,0.0,0.0,58.88000130653381,112.51936033368102,1.1397564964481928,0,3,3,0_3_3,0,
2026-03-02T09:29:17.674771+00:00,B,adversarial,eval,adversarial_eval_017,4,8192,4096,bf16,NVIDIA GeForce RTX 4060,c02,32,64,32,2,2,8,0.0,0.0,472.4319875240326,591.0726571083067,0.5681991547753626,0,3,3,0_3_3,0,
2026-03-02T09:29:17.686295+00:00,B,adversarial,eval,adversarial_eval_018,8,1024,1024,bf16,NVIDIA GeForce RTX 4060,c02,32,64,32,2,2,8,0.0,0.0,50.175998359918594,199.54687610268564,0.334367357868098,0,3,3,0_3_3,0,
2026-03-02T09:29:17.708568+00:00,B,adversarial,eval,adversarial_eval_019,8,1024,4096,bf16,NVIDIA GeForce RTX 4060,c02,32,64,32,2,2,8,0.0,0.0,124.92799758911133,156.1190330982207,0.5371803382354796,0,3,3,0_3_3,0,
2026-03-02T09:29:17.728594+00:00,B,adversarial,eval,adversarial_eval_020,8,4096,1024,bf16,NVIDIA GeForce RTX 4060,c02,32,64,32,2,2,8,0.0,0.0,82.73600041866302,216.72223225235916,0.8111204754933021,0,3,3,0_3_3,0,
2026-03-02T09:29:17.817284+00:00,B,adversarial,eval,adversarial_eval_021,8,4096,4096,bf16,NVIDIA GeForce RTX 4060,c02,32,64,32,2,2,8,0.0,0.0,252.25599110126495,406.0876941680906,1.0641390709021454,0,3,3,0_3_3,0,
2026-03-02T09:29:17.861614+00:00,B,adversarial,eval,adversarial_eval_022,8,8192,1024,bf16,NVIDIA GeForce RTX 4060,c02,32,64,32,2,2,8,0.0,0.0,108.92799869179726,182.26432114839554,1.2321692274890492,0,3,3,0_3_3,0,
2026-03-02T09:29:18.064623+00:00,B,adversarial,eval,adversarial_eval_023,8,8192,4096,bf16,NVIDIA GeForce RTX 4060,c02,32,64,32,2,2,8,0.0,0.0,478.2080054283142,586.2313485145569,1.1226723641297964,0,3,3,0_3_3,0,
2026-03-02T09:29:18.075875+00:00,B,adversarial,eval,adversarial_eval_024,16,1024,1024,bf16,NVIDIA GeForce RTX 4060,c02,32,64,32,2,2,8,0.0,0.0,70.14400139451027,140.81023931503296,0.4783649539934301,0,3,3,0_3_3,0,
2026-03-02T09:29:18.099542+00:00,B,adversarial,eval,adversarial_eval_025,16,1024,4096,bf16,NVIDIA GeForce RTX 4060,c02,32,64,32,2,2,8,0.0,0.0,134.5440000295639,229.8288057744502,0.9975749789697631,0,3,3,0_3_3,0,
2026-03-02T09:29:18.119124+00:00,B,adversarial,eval,adversarial_eval_026,16,4096,1024,bf16,NVIDIA GeForce RTX 4060,c02,32,64,32,2,2,8,0.0,0.0,60.336001217365265,131.8399997800588,2.224504860977941,0,3,3,0_3_3,0,
2026-03-02T09:29:18.213301+00:00,B,adversarial,eval,adversarial_eval_027,16,4096,4096,bf16,NVIDIA GeForce RTX 4060,c02,32,64,32,2,2,8,0.0,0.0,257.02399015426636,356.0447937250136,2.0887968927638583,0,3,3,0_3_3,0,
2026-03-02T09:29:18.258628+00:00,B,adversarial,eval,adversarial_eval_028,16,8192,1024,bf16,NVIDIA GeForce RTX 4060,c02,32,64,32,2,2,8,0.0,0.0,82.94399827718735,101.8560004234314,3.236345746233813,0,3,3,0_3_3,0,
2026-03-02T09:29:18.426813+00:00,B,adversarial,eval,adversarial_eval_029,16,8192,4096,bf16,NVIDIA GeForce RTX 4060,c02,32,64,32,2,2,8,0.0,0.0,478.1600087881088,510.95168113708496,2.2455701109789308,0,3,3,0_3_3,0,
2026-03-02T09:29:18.441192+00:00,B,adversarial,eval,adversarial_eval_030,32,1024,1024,bf16,NVIDIA GeForce RTX 4060,c02,32,64,32,2,2,8,0.0,0.0,55.24799972772598,148.1488035619258,1.214684048847504,0,3,3,0_3_3,0,
2026-03-02T09:29:18.464839+00:00,B,adversarial,eval,adversarial_eval_031,32,1024,4096,bf16,NVIDIA GeForce RTX 4060,c02,32,64,32,2,2,8,0.0,0.0,134.14399325847626,195.9014426171778,2.001099337208214,0,3,3,0_3_3,0,
2026-03-02T09:29:18.487261+00:00,B,adversarial,eval,adversarial_eval_032,32,4096,1024,bf16,NVIDIA GeForce RTX 4060,c02,32,64,32,2,2,8,0.0,0.0,70.48000022768974,95.42111858725544,3.8086755836095865,0,3,3,0_3_3,0,
2026-03-02T09:29:18.575131+00:00,B,adversarial,eval,adversarial_eval_033,32,4096,4096,bf16,NVIDIA GeForce RTX 4060,c02,32,64,32,2,2,8,0.0,0.0,253.9519965648651,270.0390380620956,4.2281290894507375,0,3,3,0_3_3,0,
2026-03-02T09:29:18.617232+00:00,B,adversarial,eval,adversarial_eval_034,32,8192,1024,bf16,NVIDIA GeForce RTX 4060,c02,32,64,32,2,2,8,0.0,0.0,92.0960009098053,147.42208033800114,5.829470408012476,0,3,3,0_3_3,0,
2026-03-02T09:29:18.788852+00:00,B,adversarial,eval,adversarial_eval_035,32,8192,4096,bf16,NVIDIA GeForce RTX 4060,c02,32,64,32,2,2,8,0.0,0.0,482.30400681495667,604.7027349472046,4.452551954070568,0,3,3,0_3_3,0,
2026-03-02T09:29:21.065711+00:00,B,adversarial,eval,adversarial_eval_036,1024,1,512,bf16,NVIDIA GeForce RTX 4060,c00,32,32,32,2,2,8,0.0,2276.806,47.10400104522705,104.29312314838153,0.02226086907125377,3,0,2,3_0_2,0,
2026-03-02T09:29:21.322565+00:00,B,adversarial,eval,adversarial_eval_037,1024,1,2048,bf16,NVIDIA GeForce RTX 4060,c09,128,64,64,8,3,8,0.0,256.809,195.5839991569519,282.3987258970736,0.02144502627044742,3,0,3,3_0_3,0,
2026-03-02T09:29:21.338787+00:00,B,adversarial,eval,adversarial_eval_038,2048,1,512,bf16,NVIDIA GeForce RTX 4060,c00,32,32,32,2,2,8,0.0,0.0,63.48799914121628,191.15776389837248,0.03303225851133389,3,0,2,3_0_2,0,
2026-03-02T09:29:21.369582+00:00,B,adversarial,eval,adversarial_eval_039,2048,1,2048,bf16,NVIDIA GeForce RTX 4060,c09,128,64,64,8,3,8,0.0,0.0,194.43200528621674,325.2326491475103,0.04314417262554802,3,0,3,3_0_3,0,
2026-03-02T09:29:21.383422+00:00,B,adversarial,eval,adversarial_eval_040,4096,1,512,bf16,NVIDIA GeForce RTX 4060,c00,32,32,32,2,2,8,0.0,0.0,88.06400001049042,124.34463679790497,0.047627906971070624,3,0,2,3_0_2,0,
2026-03-02T09:29:21.440648+00:00,B,adversarial,eval,adversarial_eval_041,4096,1,2048,bf16,NVIDIA GeForce RTX 4060,c09,128,64,64,8,3,8,0.0,0.0,298.92800748348236,590.0697493553153,0.05612460385106954,3,0,3,3_0_3,0,
2026-03-02T09:29:21.575734+00:00,B,adversarial,eval,adversarial_eval_042,1024,2,512,bf16,NVIDIA GeForce RTX 4060,c00,32,32,32,2,2,8,0.0,0.0,58.36800113320351,88.99584017693988,0.03592982386383289,3,0,2,3_0_2,0,
2026-03-02T09:29:21.777748+00:00,B,adversarial,eval,adversarial_eval_043,1024,2,2048,bf16,NVIDIA GeForce RTX 4060,c09,128,64,64,8,3,8,0.0,0.0,221.18400037288666,318.8531309366225,0.03792592586198788,3,0,3,3_0_3,0,
2026-03-02T09:29:21.796823+00:00,B,adversarial,eval,adversarial_eval_044,2048,2,512,bf16,NVIDIA GeForce RTX 4060,c00,32,32,32,2,2,8,0.0,0.0,86.5279994904995,205.0214417278766,0.04847337306648955,3,0,2,3_0_2,0,
2026-03-02T09:29:21.827769+00:00,B,adversarial,eval,adversarial_eval_045,2048,2,2048,bf16,NVIDIA GeForce RTX 4060,c09,128,64,64,8,3,8,0.0,0.0,210.94399690628052,300.9536048769949,0.07953398174897522,3,0,3,3_0_3,0,
2026-03-02T09:29:21.841794+00:00,B,adversarial,eval,adversarial_eval_046,4096,2,512,bf16,NVIDIA GeForce RTX 4060,c00,32,32,32,2,2,8,0.0,0.0,67.02399998903275,93.5008014738559,0.12515827168436147,3,0,2,3_0_2,0,
2026-03-02T09:29:21.904108+00:00,B,adversarial,eval,adversarial_eval_047,4096,2,2048,bf16,NVIDIA GeForce RTX 4060,c09,128,64,64,8,3,8,0.0,0.0,340.9920036792755,362.1375998854637,0.09840240134064862,3,0,3,3_0_3,0,
2026-03-02T09:29:21.913249+00:00,B,adversarial,eval,adversarial_eval_048,1024,4,512,bf16,NVIDIA GeForce RTX 4060,c00,32,32,32,2,2,8,0.0,0.0,60.416001826524734,118.84543918073176,0.06942372671470878,3,0,2,3_0_2,0,
2026-03-02T09:29:21.936671+00:00,B,adversarial,eval,adversarial_eval_049,1024,4,2048,bf16,NVIDIA GeForce RTX 4060,c09,128,64,64,8,3,8,0.0,0.0,209.9040001630783,329.9007880687712,0.07992804323388535,3,0,3,3_0_3,0,
2026-03-02T09:29:21.949952+00:00,B,adversarial,eval,adversarial_eval_050,2048,4,512,bf16,NVIDIA GeForce RTX 4060,c00,32,32,32,2,2,8,0.0,0.0,96.75200283527374,200.97503706812853,0.0867021638227182,3,0,2,3_0_2,0,
2026-03-02T09:29:21.979734+00:00,B,adversarial,eval,adversarial_eval_051,2048,4,2048,bf16,NVIDIA GeForce RTX 4060,c09,128,64,64,8,3,8,0.0,0.0,207.87200331687927,302.7094453573227,0.1614187166361684,3,0,3,3_0_3,0,
2026-03-02T09:29:21.993376+00:00,B,adversarial,eval,adversarial_eval_052,4096,4,512,bf16,NVIDIA GeForce RTX 4060,c00,32,32,32,2,2,8,0.0,0.0,67.07200035452843,137.86528170108792,0.2501374032579792,3,0,2,3_0_2,0,
2026-03-02T09:29:22.058726+00:00,B,adversarial,eval,adversarial_eval_053,4096,4,2048,bf16,NVIDIA GeForce RTX 4060,c09,128,64,64,8,3,8,0.0,0.0,342.51201152801514,351.8156760931015,0.19593141770594796,3,0,3,3_0_3,0,
2026-03-02T09:29:22.068304+00:00,B,adversarial,eval,adversarial_eval_054,1024,8,512,bf16,NVIDIA GeForce RTX 4060,c00,32,32,32,2,2,8,0.0,0.0,62.463998794555664,140.85119932889938,0.1342950845588699,3,0,2,3_0_2,0,
2026-03-02T09:29:22.091051+00:00,B,adversarial,eval,adversarial_eval_055,1024,8,2048,bf16,NVIDIA GeForce RTX 4060,c09,128,64,64,8,3,8,0.0,0.0,206.27199858427048,293.2735949754714,0.16267080471560785,3,0,3,3_0_3,0,
2026-03-02T09:29:22.101911+00:00,B,adversarial,eval,adversarial_eval_056,2048,8,512,bf16,NVIDIA GeForce RTX 4060,c00,32,32,32,2,2,8,0.0,0.0,72.67200201749802,140.85119932889938,0.23086216884406696,3,0,2,3_0_2,0,
2026-03-02T09:29:22.131128+00:00,B,adversarial,eval,adversarial_eval_057,2048,8,2048,bf16,NVIDIA GeForce RTX 4060,c09,128,64,64,8,3,8,0.0,0.0,205.31199872493744,241.70495972037315,0.3268628449227058,3,0,3,3_0_3,0,
2026-03-02T09:29:22.148603+00:00,B,adversarial,eval,adversarial_eval_058,4096,8,512,bf16,NVIDIA GeForce RTX 4060,c00,32,32,32,2,2,8,0.0,0.0,98.30400347709656,193.1878380477427,0.34133332126008187,3,0,2,3_0_2,0,
2026-03-02T09:29:22.210192+00:00,B,adversarial,eval,adversarial_eval_059,4096,8,2048,bf16,NVIDIA GeForce RTX 4060,c09,128,64,64,8,3,8,0.0,0.0,343.03998947143555,400.4147249460219,0.3912597135010585,3,0,3,3_0_3,0,
2026-03-02T09:29:22.232100+00:00,B,adversarial,eval,adversarial_eval_060,64,64,8192,bf16,NVIDIA GeForce RTX 4060,c04,64,64,64,4,3,8,0.0,0.0,237.4880015850067,257.6281541585922,0.2825779136297923,1,1,3,1_1_3,0,
2026-03-02T09:29:22.259368+00:00,B,adversarial,eval,adversarial_eval_061,128,128,8192,bf16,NVIDIA GeForce RTX 4060,c04,64,64,64,4,3,8,0.0,0.0,252.9279887676239,332.8716918826102,1.0613117880228886,1,1,3,1_1_3,0,
2026-03-02T09:29:22.474321+00:00,B,adversarial,eval,adversarial_eval_062,2048,128,8192,bf16,NVIDIA GeForce RTX 4060,c04,64,64,64,4,3,8,0.0,0.0,1922.0479726791382,2077.214801311493,2.234578614608279,3,1,3,3_1_3,0,
2026-03-02T09:29:22.687404+00:00,B,adversarial,eval,adversarial_eval_063,128,2048,8192,bf16,NVIDIA GeForce RTX 4060,c06,64,128,32,4,3,8,0.0,0.0,1882.6240301132202,2090.997703075409,2.2813728218170586,1,3,3,1_3_3,0,
