results/llm_hp2_m32_n4096_k6144.csv
timestamp,method,workload,split,shape_id,M,N,K,dtype,gpu,config_id,BLOCK_M,BLOCK_N,BLOCK_K,num_warps,num_stages,GROUP_M,compile_time_ms,tune_time_ms,runtime_cost_us,p99_us,runtime_perf_tflops,bucket_m,bucket_n,bucket_k,cache_key,invalid_config,notes
2026-03-03T03:41:35.823628+00:00,FULL,llm_style,tune,llm_style_tune_000,32,1024,2048,bf16,NVIDIA GeForce RTX 4060,c04,64,64,64,4,3,8,0.7077479967847466,465.201,44.36800070106983,55.26463985443115,3.02510200773513,7,-1,-1,32x1024x2048,0,
2026-03-03T03:41:35.939500+00:00,FULL,llm_style,tune,llm_style_tune_001,4,4096,1536,bf16,NVIDIA GeForce RTX 4060,c11,32,128,32,4,2,8,0.0,115.84,50.175998359918594,68.20864073932168,1.0031020736042942,7,-1,-1,4x4096x1536,0,
2026-03-03T03:41:36.057160+00:00,FULL,llm_style,tune,llm_style_tune_002,8,8192,1024,bf16,NVIDIA GeForce RTX 4060,c11,32,128,32,4,2,8,0.0,117.625,53.247999399900436,82.15360097587102,2.520615413022465,5,-1,-1,8x8192x1024,0,
2026-03-03T03:41:36.367892+00:00,FULL,llm_style,tune,llm_style_tune_003,2,3072,8192,bf16,NVIDIA GeForce RTX 4060,c06,64,128,32,4,3,8,0.0,310.685,228.35199534893036,258.1299179792404,0.44082512108634186,6,-1,-1,2x3072x8192,0,
2026-03-03T03:41:36.428609+00:00,FULL,llm_style,tune,llm_style_tune_004,16,1536,1024,bf16,NVIDIA GeForce RTX 4060,c04,64,64,64,4,3,8,0.0,60.672,37.88800165057182,48.16895950585603,1.3284323745599385,7,-1,-1,16x1536x1024,0,
2026-03-03T03:41:36.546464+00:00,FULL,llm_style,tune,llm_style_tune_005,16,1024,6144,bf16,NVIDIA GeForce RTX 4060,c04,64,64,64,4,3,8,0.0,117.812,70.03200054168701,80.22144339978695,2.8747799640559895,7,-1,-1,16x1024x6144,0,
2026-03-03T03:41:36.609641+00:00,FULL,llm_style,tune,llm_style_tune_006,2,2048,1024,bf16,NVIDIA GeForce RTX 4060,c00,32,32,32,2,2,8,0.0,63.136,32.62399882078171,133.16096037626266,0.2571299749635964,7,-1,-1,2x2048x1024,0,
2026-03-03T03:41:36.668356+00:00,FULL,llm_style,tune,llm_style_tune_007,16,1024,1536,bf16,NVIDIA GeForce RTX 4060,c00,32,32,32,2,2,8,0.0,58.675,38.255998864769936,151.73631876707051,1.315653740421625,7,-1,-1,16x1024x1536,0,
2026-03-03T03:41:36.733791+00:00,FULL,llm_style,tune,llm_style_tune_008,8,1536,2048,bf16,NVIDIA GeForce RTX 4060,c04,64,64,64,4,3,8,0.0,65.4,41.98399931192398,49.12768125534056,1.198829287940303,7,-1,-1,8x1536x2048,0,
2026-03-03T03:41:36.966435+00:00,FULL,llm_style,tune,llm_style_tune_009,64,2048,8192,bf16,NVIDIA GeForce RTX 4060,c06,64,128,32,4,3,8,0.0,232.596,166.9120043516159,202.71967709064484,12.865962854751436,2,-1,-1,64x2048x8192,0,
2026-03-03T03:41:37.037606+00:00,FULL,llm_style,tune,llm_style_tune_010,64,1536,2048,bf16,NVIDIA GeForce RTX 4060,c04,64,64,64,4,3,8,0.0,71.127,42.79999993741512,52.688320465385914,9.407784686653855,3,-1,-1,64x1536x2048,0,
2026-03-03T03:41:37.345848+00:00,FULL,llm_style,tune,llm_style_tune_011,32,3072,8192,bf16,NVIDIA GeForce RTX 4060,c06,64,128,32,4,3,8,0.0,308.201,230.48000037670135,287.679999768734,6.98808023849176,6,-1,-1,32x3072x8192,0,
2026-03-03T03:41:37.427699+00:00,FULL,llm_style,tune,llm_style_tune_012,32,6144,1024,bf16,NVIDIA GeForce RTX 4060,c00,32,32,32,2,2,8,0.0,81.808,29.504000209271908,131.13343954086304,13.647409881506931,5,-1,-1,32x6144x1024,0,
2026-03-03T03:41:37.527057+00:00,FULL,llm_style,tune,llm_style_tune_013,64,1536,4096,bf16,NVIDIA GeForce RTX 4060,c04,64,64,64,4,3,8,0.0,99.315,61.43999844789505,69.49759975075722,13.107200331115733,3,-1,-1,64x1536x4096,0,
2026-03-03T03:41:37.761907+00:00,FULL,llm_style,tune,llm_style_tune_014,4,6144,3072,bf16,NVIDIA GeForce RTX 4060,c06,64,128,32,4,3,8,0.0,234.802,179.1519969701767,200.25952085852623,0.8428314869698942,5,-1,-1,4x6144x3072,0,
2026-03-03T03:41:37.855208+00:00,FULL,llm_style,tune,llm_style_tune_015,1,6144,1024,bf16,NVIDIA GeForce RTX 4060,c11,32,128,32,4,2,8,0.0,93.263,41.6640006005764,67.12320037186146,0.3020092122364726,5,-1,-1,1x6144x1024,0,
2026-03-03T03:41:37.998451+00:00,FULL,llm_style,tune,llm_style_tune_016,1,8192,1536,bf16,NVIDIA GeForce RTX 4060,c11,32,128,32,4,2,8,0.0,143.212,65.5359998345375,152.58559927344322,0.38400000096950676,5,-1,-1,1x8192x1536,0,
2026-03-03T03:41:38.405697+00:00,FULL,llm_style,tune,llm_style_tune_017,64,4096,8192,bf16,NVIDIA GeForce RTX 4060,c11,32,128,32,4,2,8,0.0,407.204,300.4480004310608,332.12448358535755,14.295210119015255,2,-1,-1,64x4096x8192,0,
2026-03-03T03:41:38.564545+00:00,FULL,llm_style,tune,llm_style_tune_018,64,8192,1536,bf16,NVIDIA GeForce RTX 4060,c06,64,128,32,4,3,8,0.0,158.806,98.30400347709656,201.84063732624043,16.383999420483928,1,-1,-1,64x8192x1536,0,
2026-03-03T03:41:38.624601+00:00,FULL,llm_style,tune,llm_style_tune_019,2,1536,1024,bf16,NVIDIA GeForce RTX 4060,c04,64,64,64,4,3,8,0.0,60.017,40.95999896526337,102.28895977139472,0.1536000038802625,7,-1,-1,2x1536x1024,0,
2026-03-03T03:41:39.005731+00:00,FULL,llm_style,tune,llm_style_tune_020,4,8192,4096,bf16,NVIDIA GeForce RTX 4060,c11,32,128,32,4,2,8,0.0,381.084,292.7359938621521,309.3094402551651,0.9169882133674512,5,-1,-1,4x8192x4096,0,
2026-03-03T03:41:39.119489+00:00,FULL,llm_style,tune,llm_style_tune_021,1,6144,1536,bf16,NVIDIA GeForce RTX 4060,c11,32,128,32,4,2,8,0.0,113.715,45.96799984574318,63.52928038686512,0.41059798258217756,5,-1,-1,1x6144x1536,0,
2026-03-03T03:41:39.341711+00:00,FULL,llm_style,tune,llm_style_tune_022,8,4096,4096,bf16,NVIDIA GeForce RTX 4060,c00,32,32,32,2,2,8,0.0,222.12,161.79199516773224,252.92031377553914,1.6591392900601099,7,-1,-1,8x4096x4096,0,
2026-03-03T03:41:39.488748+00:00,FULL,llm_style,tune,llm_style_tune_023,16,3072,4096,bf16,NVIDIA GeForce RTX 4060,c04,64,64,64,4,3,8,0.0,146.991,80.89599758386612,109.39135491847983,4.97741787018033,7,-1,-1,16x3072x4096,0,
2026-03-03T03:41:39.557207+00:00,FULL,llm_style,tune,llm_style_tune_024,64,2048,1536,bf16,NVIDIA GeForce RTX 4060,c11,32,128,32,4,2,8,0.0,68.416,48.895999789237976,58.89024131000042,8.23489008785181,3,-1,-1,64x2048x1536,0,
2026-03-03T03:41:39.580689+00:00,FULL,llm_style,tune,llm_style_tune_025,4,4096,1536,bf16,NVIDIA GeForce RTX 4060,c11,32,128,32,4,2,8,0.0,0.0,46.112000942230225,129.14751946926117,1.0915086522282174,7,-1,-1,4x4096x1536,0,
2026-03-03T03:41:39.657948+00:00,FULL,llm_style,tune,llm_style_tune_026,4,3072,2048,bf16,NVIDIA GeForce RTX 4060,c00,32,32,32,2,2,8,0.0,77.207,42.447999119758606,104.04864162206647,1.1857248643922942,7,-1,-1,4x3072x2048,0,
2026-03-03T03:41:40.230005+00:00,FULL,llm_style,tune,llm_style_tune_027,64,6144,8192,bf16,NVIDIA GeForce RTX 4060,c11,32,128,32,4,2,8,0.0,572.016,434.1759979724884,511.12961292266834,14.838339691933468,0,-1,-1,64x6144x8192,0,
2026-03-03T03:41:40.294987+00:00,FULL,llm_style,tune,llm_style_tune_028,64,1536,1024,bf16,NVIDIA GeForce RTX 4060,c00,32,32,32,2,2,8,0.0,64.941,39.31199945509434,114.13792110979549,5.121250376236221,3,-1,-1,64x1536x1024,0,
2026-03-03T03:41:40.599172+00:00,FULL,llm_style,tune,llm_style_tune_029,32,8192,3072,bf16,NVIDIA GeForce RTX 4060,c11,32,128,32,4,2,8,0.0,304.143,231.1680018901825,242.26816371083257,6.967282335057469,5,-1,-1,32x8192x3072,0,
2026-03-03T03:41:40.636834+00:00,FULL,llm_style,tune,llm_style_tune_030,64,1536,4096,bf16,NVIDIA GeForce RTX 4060,c04,64,64,64,4,3,8,0.0,0.0,60.416001826524734,65.96031926572323,13.329355529224086,3,-1,-1,64x1536x4096,0,
2026-03-03T03:41:41.026973+00:00,FULL,llm_style,tune,llm_style_tune_031,2,4096,8192,bf16,NVIDIA GeForce RTX 4060,c00,32,32,32,2,2,8,0.0,390.09,291.79199039936066,337.30399399995804,0.45997742369933836,6,-1,-1,2x4096x8192,0,
2026-03-03T03:41:41.601984+00:00,FULL,llm_style,tune,llm_style_tune_032,1,8192,6144,bf16,NVIDIA GeForce RTX 4060,c11,32,128,32,4,2,8,0.0,574.97,424.79999363422394,539.0847995877264,0.2369663312346389,5,-1,-1,1x8192x6144,0,
2026-03-03T03:41:42.167900+00:00,FULL,llm_style,tune,llm_style_tune_033,32,6144,8192,bf16,NVIDIA GeForce RTX 4060,c11,32,128,32,4,2,8,0.0,565.874,428.6080002784729,460.1932820677757,7.5155514360607425,4,-1,-1,32x6144x8192,0,
2026-03-03T03:41:42.260135+00:00,FULL,llm_style,tune,llm_style_tune_034,32,3072,2048,bf16,NVIDIA GeForce RTX 4060,c02,32,64,32,2,2,8,0.0,92.195,52.78399959206581,95.4163186997175,7.628318943464916,7,-1,-1,32x3072x2048,0,
2026-03-03T03:41:42.388097+00:00,FULL,llm_style,tune,llm_style_tune_035,4,1536,6144,bf16,NVIDIA GeForce RTX 4060,c04,64,64,64,4,3,8,0.0,127.918,72.54400104284286,76.18816249072552,1.040712821387021,7,-1,-1,4x1536x6144,0,
2026-03-03T03:41:42.487025+00:00,FULL,llm_style,tune,llm_style_tune_036,1,4096,1536,bf16,NVIDIA GeForce RTX 4060,c11,32,128,32,4,2,8,0.0,98.881,46.08000069856644,64.64960224926466,0.2730666625270138,7,-1,-1,1x4096x1536,0,
2026-03-03T03:41:42.579738+00:00,FULL,llm_style,tune,llm_style_tune_037,4,1536,4096,bf16,NVIDIA GeForce RTX 4060,c04,64,64,64,4,3,8,0.0,92.671,56.32000043988228,71.78111769258973,0.8936727202927771,7,-1,-1,4x1536x4096,0,
2026-03-03T03:41:42.672472+00:00,FULL,llm_style,tune,llm_style_tune_038,16,1536,4096,bf16,NVIDIA GeForce RTX 4060,c04,64,64,64,4,3,8,0.0,92.688,56.432001292705536,65.0342396646738,3.5675961757185406,7,-1,-1,16x1536x4096,0,
2026-03-03T03:41:42.702430+00:00,FULL,llm_style,tune,llm_style_tune_039,32,3072,2048,bf16,NVIDIA GeForce RTX 4060,c02,32,64,32,2,2,8,0.0,0.0,55.296000093221664,161.8988817930221,7.2817777655016735,7,-1,-1,32x3072x2048,0,
2026-03-03T03:41:42.814453+00:00,FULL,llm_style,tune,llm_style_tune_040,2,2048,4096,bf16,NVIDIA GeForce RTX 4060,c00,32,32,32,2,2,8,0.0,111.974,56.832000613212585,129.7353589534759,0.5904144080438917,7,-1,-1,2x2048x4096,0,
2026-03-03T03:41:43.250972+00:00,FULL,llm_style,tune,llm_style_tune_041,64,6144,6144,bf16,NVIDIA GeForce RTX 4060,c06,64,128,32,4,3,8,0.0,436.477,332.7520042657852,384.8876675963402,14.520838781005736,1,-1,-1,64x6144x6144,0,
2026-03-03T03:41:43.379499+00:00,FULL,llm_style,tune,llm_style_tune_042,2,3072,8192,bf16,NVIDIA GeForce RTX 4060,c06,64,128,32,4,3,8,0.0,0.0,226.30399465560913,278.41536104679096,0.4448144901427394,6,-1,-1,2x3072x8192,0,
2026-03-03T03:41:43.940851+00:00,FULL,llm_style,tune,llm_style_tune_043,4,8192,6144,bf16,NVIDIA GeForce RTX 4060,c11,32,128,32,4,2,8,0.0,561.301,425.9839951992035,477.5404694676398,0.9452307798834243,5,-1,-1,4x8192x6144,0,
2026-03-03T03:41:44.068558+00:00,FULL,llm_style,tune,llm_style_tune_044,1,1024,6144,bf16,NVIDIA GeForce RTX 4060,c04,64,64,64,4,3,8,0.0,127.668,72.80000299215317,78.8684768974781,0.17284219069821005,7,-1,-1,1x1024x6144,0,
2026-03-03T03:41:44.223279+00:00,FULL,llm_style,tune,llm_style_tune_045,32,4096,3072,bf16,NVIDIA GeForce RTX 4060,c00,32,32,32,2,2,8,0.0,154.682,87.0399996638298,126.44351795315733,9.252141212204666,7,-1,-1,32x4096x3072,0,
2026-03-03T03:41:44.290003+00:00,FULL,llm_style,tune,llm_style_tune_046,16,2048,1024,bf16,NVIDIA GeForce RTX 4060,c00,32,32,32,2,2,8,0.0,66.675,40.84799997508526,490.92895440757127,1.642892284589998,7,-1,-1,16x2048x1024,0,
2026-03-03T03:41:44.348159+00:00,FULL,llm_style,tune,llm_style_tune_047,4,1024,1536,bf16,NVIDIA GeForce RTX 4060,c04,64,64,64,4,3,8,0.0,58.115,39.24799896776676,70.56384138762942,0.32060008996468786,7,-1,-1,4x1024x1536,0,
2026-03-03T03:41:44.366702+00:00,FULL,llm_style,tune,llm_style_tune_048,64,1536,2048,bf16,NVIDIA GeForce RTX 4060,c04,64,64,64,4,3,8,0.0,0.0,75.18400251865387,174.6697598695755,5.355569941891533,3,-1,-1,64x1536x2048,0,
2026-03-03T03:41:44.434613+00:00,FULL,llm_style,tune,llm_style_tune_049,16,2048,1536,bf16,NVIDIA GeForce RTX 4060,c11,32,128,32,4,2,8,0.0,67.858,45.903999358415604,52.64448173344134,2.1929090581852613,7,-1,-1,16x2048x1536,0,
2026-03-03T03:41:44.550071+00:00,FULL,llm_style,tune,llm_style_tune_050,64,1024,6144,bf16,NVIDIA GeForce RTX 4060,c04,64,64,64,4,3,8,0.0,115.413,72.7040022611618,83.28672088682652,11.076506697763895,3,-1,-1,64x1024x6144,0,
2026-03-03T03:41:44.953556+00:00,FULL,llm_style,tune,llm_style_tune_051,4,4096,8192,bf16,NVIDIA GeForce RTX 4060,c11,32,128,32,4,2,8,0.0,403.442,293.5680001974106,334.6739175915717,0.9143893606233986,6,-1,-1,4x4096x8192,0,
2026-03-03T03:41:45.109351+00:00,FULL,llm_style,tune,llm_style_tune_052,1,4096,3072,bf16,NVIDIA GeForce RTX 4060,c11,32,128,32,4,2,8,0.0,155.758,81.71200007200241,88.12544003129004,0.3079819852386988,7,-1,-1,1x4096x3072,0,
2026-03-03T03:41:45.126944+00:00,FULL,llm_style,tune,llm_style_tune_053,64,1536,2048,bf16,NVIDIA GeForce RTX 4060,c04,64,64,64,4,3,8,0.0,0.0,48.46400022506714,132.74112388491628,8.308294448045476,3,-1,-1,64x1536x2048,0,
2026-03-03T03:41:45.237047+00:00,FULL,llm_style,tune,llm_style_tune_054,2,4096,2048,bf16,NVIDIA GeForce RTX 4060,c11,32,128,32,4,2,8,0.0,110.066,52.079999819397926,56.1782393604517,0.6442863309592827,7,-1,-1,2x4096x2048,0,
2026-03-03T03:41:45.401474+00:00,FULL,llm_style,tune,llm_style_tune_055,4,8192,1536,bf16,NVIDIA GeForce RTX 4060,c11,32,128,32,4,2,8,0.0,164.387,64.51199948787689,100.82720018923283,1.5603809647679057,5,-1,-1,4x8192x1536,0,
2026-03-03T03:41:45.526096+00:00,FULL,llm_style,tune,llm_style_tune_056,1,1536,4096,bf16,NVIDIA GeForce RTX 4060,c04,64,64,64,4,3,8,0.0,124.58,80.28800040483475,139.75360207259632,0.1567221992894755,7,-1,-1,1x1536x4096,0,
2026-03-03T03:41:46.108523+00:00,FULL,llm_style,tune,llm_style_tune_057,8,8192,6144,bf16,NVIDIA GeForce RTX 4060,c11,32,128,32,4,2,8,0.0,582.384,428.0320107936859,484.14527565240854,1.881416220498898,5,-1,-1,8x8192x6144,0,
2026-03-03T03:41:46.248197+00:00,FULL,llm_style,tune,llm_style_tune_058,64,6144,1536,bf16,NVIDIA GeForce RTX 4060,c10,64,128,64,8,3,8,0.0,139.632,64.27199766039848,93.2044817507267,18.79449209565008,1,-1,-1,64x6144x1536,0,
2026-03-03T03:41:46.329954+00:00,FULL,llm_style,tune,llm_style_tune_059,1,3072,1536,bf16,NVIDIA GeForce RTX 4060,c00,32,32,32,2,2,8,0.0,81.718,39.93599861860275,332.9081569612021,0.23630770048164082,7,-1,-1,1x3072x1536,0,
2026-03-03T03:41:46.380156+00:00,FULL,llm_style,tune,llm_style_tune_060,64,1024,1024,bf16,NVIDIA GeForce RTX 4060,c04,64,64,64,4,3,8,0.0,50.16,35.631999373435974,41.98399931192398,3.7667750999137226,3,-1,-1,64x1024x1024,0,
2026-03-03T03:41:46.772972+00:00,FULL,llm_style,tune,llm_style_tune_061,16,8192,4096,bf16,NVIDIA GeForce RTX 4060,c11,32,128,32,4,2,8,0.0,392.775,296.2399870157242,336.33855015039444,3.6245674826572505,5,-1,-1,16x8192x4096,0,
2026-03-03T03:41:47.090231+00:00,FULL,llm_style,tune,llm_style_tune_062,16,4096,6144,bf16,NVIDIA GeForce RTX 4060,c11,32,128,32,4,2,8,0.0,317.219,229.37600314617157,448.1312090158459,3.510857094701456,7,-1,-1,16x4096x6144,0,
2026-03-03T03:41:47.166591+00:00,FULL,llm_style,tune,llm_style_tune_063,8,4096,1024,bf16,NVIDIA GeForce RTX 4060,c11,32,128,32,4,2,8,0.0,76.322,39.84000161290169,54.983358420431586,1.6844593695565422,7,-1,-1,8x4096x1024,0,
2026-03-03T03:41:47.220478+00:00,FULL,llm_style,eval,llm_style_eval_000,32,1536,1024,bf16,NVIDIA GeForce RTX 4060,c04,64,64,64,4,3,8,0.0,53.848,34.81600061058998,51.20831985026596,2.8912940669406253,7,-1,-1,32x1536x1024,0,
2026-03-03T03:41:47.464188+00:00,FULL,llm_style,eval,llm_style_eval_001,32,2048,8192,bf16,NVIDIA GeForce RTX 4060,c10,64,128,64,8,3,8,0.0,243.672,166.23999923467636,228.77247750759102,6.458985977762359,6,-1,-1,32x2048x8192,0,
2026-03-03T03:41:47.608896+00:00,FULL,llm_style,eval,llm_style_eval_002,16,2048,4096,bf16,NVIDIA GeForce RTX 4060,c11,32,128,32,4,2,8,0.0,144.66,73.64800199866295,110.88895447552193,3.6448436986094115,7,-1,-1,16x2048x4096,0,
2026-03-03T03:41:47.627667+00:00,FULL,llm_style,eval,llm_style_eval_003,16,2048,1536,bf16,NVIDIA GeForce RTX 4060,c11,32,128,32,4,2,8,0.0,0.0,49.12000149488449,159.63903889060015,2.049334139586364,7,-1,-1,16x2048x1536,0,
2026-03-03T03:41:47.855314+00:00,FULL,llm_style,eval,llm_style_eval_004,64,8192,2048,bf16,NVIDIA GeForce RTX 4060,c04,64,64,64,4,3,8,0.0,227.598,168.96000504493713,307.61088013648975,12.710011741706852,1,-1,-1,64x8192x2048,0,
2026-03-03T03:41:48.160235+00:00,FULL,llm_style,eval,llm_style_eval_005,64,3072,8192,bf16,NVIDIA GeForce RTX 4060,c04,64,64,64,4,3,8,0.0,304.878,235.52000522613525,249.87648263573647,13.677077957378314,2,-1,-1,64x3072x8192,0,
2026-03-03T03:41:48.242217+00:00,FULL,llm_style,eval,llm_style_eval_006,32,2048,2048,bf16,NVIDIA GeForce RTX 4060,c00,32,32,32,2,2,8,0.0,81.941,41.82399995625019,113.42847734689707,6.418215767999133,7,-1,-1,32x2048x2048,0,
2026-03-03T03:41:48.458011+00:00,FULL,llm_style,eval,llm_style_eval_007,8,8192,2048,bf16,NVIDIA GeForce RTX 4060,c11,32,128,32,4,2,8,0.0,215.754,162.59200125932693,290.3055924177165,1.650975779379562,5,-1,-1,8x8192x2048,0,
2026-03-03T03:41:48.652678+00:00,FULL,llm_style,eval,llm_style_eval_008,64,1536,8192,bf16,NVIDIA GeForce RTX 4060,c04,64,64,64,4,3,8,0.0,194.627,111.7120012640953,244.5209644734859,14.41754437996679,2,-1,-1,64x1536x8192,0,
2026-03-03T03:41:48.966369+00:00,FULL,llm_style,eval,llm_style_eval_009,64,4096,6144,bf16,NVIDIA GeForce RTX 4060,c03,64,64,32,4,2,8,0.0,313.65,232.91200399398804,250.79615384340283,13.830225221380804,3,-1,-1,64x4096x6144,0,
2026-03-03T03:41:49.100621+00:00,FULL,llm_style,eval,llm_style_eval_010,64,2048,4096,bf16,NVIDIA GeForce RTX 4060,c11,32,128,32,4,2,8,0.0,134.214,76.80000364780426,107.26400271058077,13.981012669270863,3,-1,-1,64x2048x4096,0,
2026-03-03T03:41:49.332241+00:00,FULL,llm_style,eval,llm_style_eval_011,32,3072,6144,bf16,NVIDIA GeForce RTX 4060,c10,64,128,64,8,3,8,0.0,231.579,178.17600071430206,183.29599499702454,6.7795861797174,7,-1,-1,32x3072x6144,0,
2026-03-03T03:41:49.401114+00:00,FULL,llm_style,eval,llm_style_eval_012,16,1536,1536,bf16,NVIDIA GeForce RTX 4060,c00,32,32,32,2,2,8,0.0,68.831,34.911999478936195,81.57184131443486,2.162507823292981,7,-1,-1,16x1536x1536,0,
2026-03-03T03:41:49.499064+00:00,FULL,llm_style,eval,llm_style_eval_013,64,2048,3072,bf16,NVIDIA GeForce RTX 4060,c11,32,128,32,4,2,8,0.0,97.909,66.3359984755516,111.21184051036833,12.139809251485056,3,-1,-1,64x2048x3072,0,
2026-03-03T03:41:50.089879+00:00,FULL,llm_style,eval,llm_style_eval_014,16,8192,6144,bf16,NVIDIA GeForce RTX 4060,c11,32,128,32,4,2,8,0.0,590.774,428.0320107936859,453.07615518569946,3.762832440997796,5,-1,-1,16x8192x6144,0,
2026-03-03T03:41:50.137102+00:00,FULL,llm_style,eval,llm_style_eval_015,64,6144,1536,bf16,NVIDIA GeForce RTX 4060,c10,64,128,64,8,3,8,0.0,0.0,48.448000103235245,97.08511762320985,24.933114874216145,1,-1,-1,64x6144x1536,0,
2026-03-03T03:41:50.354845+00:00,FULL,llm_style,eval,llm_style_eval_016,16,4096,4096,bf16,NVIDIA GeForce RTX 4060,c00,32,32,32,2,2,8,0.0,217.688,161.79199516773224,170.96384525299072,3.3182785801202197,7,-1,-1,16x4096x4096,0,
2026-03-03T03:41:50.764025+00:00,FULL,llm_style,eval,llm_style_eval_017,64,8192,4096,bf16,NVIDIA GeForce RTX 4060,c10,64,128,64,8,3,8,0.0,409.135,304.1599988937378,386.6086468100547,14.120749972452828,1,-1,-1,64x8192x4096,0,
2026-03-03T03:41:51.082481+00:00,FULL,llm_style,eval,llm_style_eval_018,32,4096,6144,bf16,NVIDIA GeForce RTX 4060,c11,32,128,32,4,2,8,0.0,318.407,229.21600192785263,254.11583662033078,7.026615604729691,7,-1,-1,32x4096x6144,0,
2026-03-03T03:41:51.377927+00:00,FULL,llm_style,eval,llm_style_eval_019,16,3072,8192,bf16,NVIDIA GeForce RTX 4060,c08,128,128,64,8,4,8,0.0,295.406,228.28800231218338,256.0374474525451,3.527589535339423,6,-1,-1,16x3072x8192,0,
2026-03-03T03:41:51.448389+00:00,FULL,llm_style,eval,llm_style_eval_020,4,1536,1536,bf16,NVIDIA GeForce RTX 4060,c04,64,64,64,4,3,8,0.0,70.418,42.91199892759323,61.66528034955259,0.4398389371664395,7,-1,-1,4x1536x1536,0,
2026-03-03T03:41:51.560411+00:00,FULL,llm_style,eval,llm_style_eval_021,4,6144,1536,bf16,NVIDIA GeForce RTX 4060,c00,32,32,32,2,2,8,0.0,111.982,47.10400104522705,82.66272194683548,1.6027825731302712,5,-1,-1,4x6144x1536,0,
2026-03-03T03:41:51.585768+00:00,FULL,llm_style,eval,llm_style_eval_022,32,6144,1024,bf16,NVIDIA GeForce RTX 4060,c00,32,32,32,2,2,8,0.0,0.0,50.175998359918594,103.12927700579151,8.024816588834353,5,-1,-1,32x6144x1024,0,
2026-03-03T03:41:51.596481+00:00,FULL,llm_style,eval,llm_style_eval_023,16,1024,1536,bf16,NVIDIA GeForce RTX 4060,c00,32,32,32,2,2,8,0.0,0.0,40.01599922776222,128.5148778557777,1.2577881090391716,7,-1,-1,16x1024x1536,0,
2026-03-03T03:41:51.692471+00:00,FULL,llm_style,eval,llm_style_eval_024,32,8192,1024,bf16,NVIDIA GeForce RTX 4060,c11,32,128,32,4,2,8,0.0,95.952,49.58399944007397,130.59071570634842,10.827503187774301,5,-1,-1,32x8192x1024,0,
2026-03-03T03:41:52.120292+00:00,FULL,llm_style,eval,llm_style_eval_025,32,6144,6144,bf16,NVIDIA GeForce RTX 4060,c11,32,128,32,4,2,8,0.0,427.781,330.55999875068665,375.95136046409607,7.308564596837752,5,-1,-1,32x6144x6144,0,
2026-03-03T03:41:52.261335+00:00,FULL,llm_style,eval,llm_style_eval_026,1,6144,2048,bf16,NVIDIA GeForce RTX 4060,c11,32,128,32,4,2,8,0.0,141.004,68.4639997780323,99.93216022849082,0.36757747256354173,5,-1,-1,1x6144x2048,0,
2026-03-03T03:41:52.323668+00:00,FULL,llm_style,eval,llm_style_eval_027,32,4096,3072,bf16,NVIDIA GeForce RTX 4060,c00,32,32,32,2,2,8,0.0,0.0,92.03200042247772,180.13855665922165,8.750286468871685,7,-1,-1,32x4096x3072,0,
2026-03-03T03:41:52.385808+00:00,FULL,llm_style,eval,llm_style_eval_028,64,1536,1536,bf16,NVIDIA GeForce RTX 4060,c04,64,64,64,4,3,8,0.0,62.084,38.94399851560593,55.76383903622625,7.754465373630917,3,-1,-1,64x1536x1536,0,
2026-03-03T03:41:52.443333+00:00,FULL,llm_style,eval,llm_style_eval_029,2,3072,1024,bf16,NVIDIA GeForce RTX 4060,c03,64,64,32,4,2,8,0.0,57.484,39.93599861860275,45.578240528702736,0.31507693397552106,7,-1,-1,2x3072x1024,0,
2026-03-03T03:41:52.641796+00:00,FULL,llm_style,eval,llm_style_eval_030,32,1536,8192,bf16,NVIDIA GeForce RTX 4060,c04,64,64,64,4,3,8,0.0,198.423,108.87999832630157,145.7206393778323,7.396274617736345,6,-1,-1,32x1536x8192,0,
2026-03-03T03:41:52.728265+00:00,FULL,llm_style,eval,llm_style_eval_031,8,3072,2048,bf16,NVIDIA GeForce RTX 4060,c00,32,32,32,2,2,8,0.0,86.426,51.56799964606762,150.37503741681564,1.9520496565872942,7,-1,-1,8x3072x2048,0,
2026-03-03T03:41:52.818153+00:00,FULL,llm_style,eval,llm_style_eval_032,8,2048,3072,bf16,NVIDIA GeForce RTX 4060,c00,32,32,32,2,2,8,0.0,89.844,52.20799893140793,92.09312174469221,1.9281201743099514,7,-1,-1,8x2048x3072,0,
2026-03-03T03:41:52.892887+00:00,FULL,llm_style,eval,llm_style_eval_033,64,1536,8192,bf16,NVIDIA GeForce RTX 4060,c04,64,64,64,4,3,8,0.0,0.0,93.18400174379349,162.6995176076888,17.284219456772522,2,-1,-1,64x1536x8192,0,
2026-03-03T03:41:53.048085+00:00,FULL,llm_style,eval,llm_style_eval_034,64,6144,2048,bf16,NVIDIA GeForce RTX 4060,c06,64,128,32,4,3,8,0.0,155.142,98.30400347709656,115.30175775289533,16.383999420483928,1,-1,-1,64x6144x2048,0,
2026-03-03T03:41:53.154622+00:00,FULL,llm_style,eval,llm_style_eval_035,4,4096,2048,bf16,NVIDIA GeForce RTX 4060,c11,32,128,32,4,2,8,0.0,106.497,55.93600124120712,68.26176099479196,1.199743680471782,7,-1,-1,4x4096x2048,0,
2026-03-03T03:41:53.322886+00:00,FULL,llm_style,eval,llm_style_eval_036,64,8192,4096,bf16,NVIDIA GeForce RTX 4060,c10,64,128,64,8,3,8,0.0,0.0,311.19999289512634,377.1871995925902,13.801309106865546,1,-1,-1,64x8192x4096,0,
2026-03-03T03:41:53.359175+00:00,FULL,llm_style,eval,llm_style_eval_037,32,6144,1024,bf16,NVIDIA GeForce RTX 4060,c00,32,32,32,2,2,8,0.0,0.0,55.296000093221664,187.99680650234217,7.2817777655016735,5,-1,-1,32x6144x1024,0,
2026-03-03T03:41:53.429977+00:00,FULL,llm_style,eval,llm_style_eval_038,64,6144,2048,bf16,NVIDIA GeForce RTX 4060,c06,64,128,32,4,3,8,0.0,0.0,103.42399775981903,270.91487452387787,15.572911228400946,1,-1,-1,64x6144x2048,0,
2026-03-03T03:41:53.507096+00:00,FULL,llm_style,eval,llm_style_eval_039,8,1024,3072,bf16,NVIDIA GeForce RTX 4060,c04,64,64,64,4,3,8,0.0,77.068,50.00000074505806,86.36640008538951,1.0066329450000002,7,-1,-1,8x1024x3072,0,
2026-03-03T03:41:53.726920+00:00,FULL,llm_style,eval,llm_style_eval_040,32,8192,2048,bf16,NVIDIA GeForce RTX 4060,c00,32,32,32,2,2,8,0.0,219.778,164.86400365829468,223.41504067182535,6.512894265418245,5,-1,-1,32x8192x2048,0,
2026-03-03T03:41:53.796860+00:00,FULL,llm_style,eval,llm_style_eval_041,32,3072,1024,bf16,NVIDIA GeForce RTX 4060,c11,32,128,32,4,2,8,0.0,69.894,41.98399931192398,87.16095872223363,4.795317151761212,7,-1,-1,32x3072x1024,0,
2026-03-03T03:41:53.886927+00:00,FULL,llm_style,eval,llm_style_eval_042,64,1024,4096,bf16,NVIDIA GeForce RTX 4060,c04,64,64,64,4,3,8,0.0,90.018,57.34400078654289,99.87008363008488,9.362285585870548,3,-1,-1,64x1024x4096,0,
2026-03-03T03:41:53.900158+00:00,FULL,llm_style,eval,llm_style_eval_043,2,1536,1024,bf16,NVIDIA GeForce RTX 4060,c04,64,64,64,4,3,8,0.0,0.0,44.544000178575516,61.551039479672866,0.14124137874411252,7,-1,-1,2x1536x1024,0,
2026-03-03T03:41:54.139975+00:00,FULL,llm_style,eval,llm_style_eval_044,64,6144,3072,bf16,NVIDIA GeForce RTX 4060,c11,32,128,32,4,2,8,0.0,239.778,184.23999845981598,226.57024219632143,13.112891468716162,1,-1,-1,64x6144x3072,0,
2026-03-03T03:41:54.282639+00:00,FULL,llm_style,eval,llm_style_eval_045,64,1536,6144,bf16,NVIDIA GeForce RTX 4060,c04,64,64,64,4,3,8,0.0,142.623,82.94399827718735,95.58176130056381,14.563555858052158,3,-1,-1,64x1536x6144,0,
2026-03-03T03:41:54.515544+00:00,FULL,llm_style,eval,llm_style_eval_046,2,6144,3072,bf16,NVIDIA GeForce RTX 4060,c00,32,32,32,2,2,8,0.0,232.865,178.1120002269745,244.18943643569946,0.4238763918421604,5,-1,-1,2x6144x3072,0,
2026-03-03T03:41:54.916668+00:00,FULL,llm_style,eval,llm_style_eval_047,16,4096,8192,bf16,NVIDIA GeForce RTX 4060,c00,32,32,32,2,2,8,0.0,401.08,295.0719892978668,329.0339148044585,3.6389147833211912,6,-1,-1,16x4096x8192,0,
2026-03-03T03:41:54.958038+00:00,FULL,llm_style,eval,llm_style_eval_048,16,1024,6144,bf16,NVIDIA GeForce RTX 4060,c04,64,64,64,4,3,8,0.0,0.0,81.91999793052673,147.72223785519594,2.4576000620842,7,-1,-1,16x1024x6144,0,
2026-03-03T03:41:55.098124+00:00,FULL,llm_style,eval,llm_style_eval_049,16,8192,1536,bf16,NVIDIA GeForce RTX 4060,c02,32,64,32,2,2,8,0.0,140.029,69.56800073385239,77.79168315231799,5.787907942624913,5,-1,-1,16x8192x1536,0,
2026-03-03T03:41:55.156360+00:00,FULL,llm_style,eval,llm_style_eval_050,1,1024,1024,bf16,NVIDIA GeForce RTX 4060,c04,64,64,64,4,3,8,0.0,58.201,37.856001406908035,46.60224087536335,0.05539813826236037,7,-1,-1,1x1024x1024,0,
2026-03-03T03:41:55.237163+00:00,FULL,llm_style,eval,llm_style_eval_051,16,6144,1024,bf16,NVIDIA GeForce RTX 4060,c11,32,128,32,4,2,8,0.0,80.766,41.98399931192398,117.13184133172035,4.795317151761212,5,-1,-1,16x6144x1024,0,
2026-03-03T03:41:56.014018+00:00,FULL,llm_style,eval,llm_style_eval_052,16,8192,8192,bf16,NVIDIA GeForce RTX 4060,c11,32,128,32,4,2,8,0.0,776.815,561.6320073604584,625.4774433374405,3.8236489727369367,4,-1,-1,16x8192x8192,0,
2026-03-03T03:41:56.566005+00:00,FULL,llm_style,eval,llm_style_eval_053,1,6144,8192,bf16,NVIDIA GeForce RTX 4060,c10,64,128,64,8,3,8,0.0,551.946,425.9839951992035,472.0844832062721,0.23630769497085607,4,-1,-1,1x6144x8192,0,
2026-03-03T03:41:56.737752+00:00,FULL,llm_style,eval,llm_style_eval_054,64,4096,3072,bf16,NVIDIA GeForce RTX 4060,c04,64,64,64,4,3,8,0.0,171.701,97.936000674963,140.11871501803392,16.44556368342441,3,-1,-1,64x4096x3072,0,
2026-03-03T03:41:56.845190+00:00,FULL,llm_style,eval,llm_style_eval_055,4,8192,1024,bf16,NVIDIA GeForce RTX 4060,c11,32,128,32,4,2,8,0.0,107.398,50.175998359918594,57.83360071480274,1.337469431472392,5,-1,-1,4x8192x1024,0,
2026-03-03T03:41:56.929628+00:00,FULL,llm_style,eval,llm_style_eval_056,64,1024,3072,bf16,NVIDIA GeForce RTX 4060,c04,64,64,64,4,3,8,0.0,84.396,50.175998359918594,68.64928167313333,8.024816588834353,3,-1,-1,64x1024x3072,0,
2026-03-03T03:41:56.933811+00:00,FULL,llm_style,eval,llm_style_eval_057,64,1024,3072,bf16,NVIDIA GeForce RTX 4060,c04,64,64,64,4,3,8,0.0,0.0,50.175998359918594,65.94208005815742,8.024816588834353,3,-1,-1,64x1024x3072,0,
2026-03-03T03:41:57.059731+00:00,FULL,llm_style,eval,llm_style_eval_058,32,2048,4096,bf16,NVIDIA GeForce RTX 4060,c00,32,32,32,2,2,8,0.0,125.891,66.04800000786781,157.16192021965978,8.12849612306272,7,-1,-1,32x2048x4096,0,
2026-03-03T03:41:57.157163+00:00,FULL,llm_style,eval,llm_style_eval_059,64,8192,2048,bf16,NVIDIA GeForce RTX 4060,c04,64,64,64,4,3,8,0.0,0.0,172.06399887800217,177.15199291706085,12.480726136805767,1,-1,-1,64x8192x2048,0,
2026-03-03T03:41:57.384407+00:00,FULL,llm_style,eval,llm_style_eval_060,1,3072,6144,bf16,NVIDIA GeForce RTX 4060,c10,64,128,64,8,3,8,0.0,227.189,177.15199291706085,201.69919967651364,0.21308671372200275,7,-1,-1,1x3072x6144,0,
2026-03-03T03:41:57.420902+00:00,FULL,llm_style,eval,llm_style_eval_061,64,1536,4096,bf16,NVIDIA GeForce RTX 4060,c04,64,64,64,4,3,8,0.0,0.0,60.416001826524734,146.67775750160212,13.329355529224086,3,-1,-1,64x1536x4096,0,
2026-03-03T03:41:57.559243+00:00,FULL,llm_style,eval,llm_style_eval_062,16,6144,2048,bf16,NVIDIA GeForce RTX 4060,c00,32,32,32,2,2,8,0.0,138.288,65.5519999563694,145.46943709254265,6.142500370209925,5,-1,-1,16x6144x2048,0,
2026-03-03T03:41:57.616368+00:00,FULL,llm_style,eval,llm_style_eval_063,64,1536,6144,bf16,NVIDIA GeForce RTX 4060,c04,64,64,64,4,3,8,0.0,0.0,74.75200295448303,169.00096505880356,16.159561005148372,3,-1,-1,64x1536x6144,0,
2026-03-03T03:41:57.685614+00:00,FULL,llm_style,eval,llm_style_eval_064,1,6144,2048,bf16,NVIDIA GeForce RTX 4060,c11,32,128,32,4,2,8,0.0,0.0,72.1920020878315,180.97152531146997,0.3485957345992748,5,-1,-1,1x6144x2048,0,
2026-03-03T03:41:57.818967+00:00,FULL,llm_style,eval,llm_style_eval_065,8,1536,6144,bf16,NVIDIA GeForce RTX 4060,c04,64,64,64,4,3,8,0.0,133.287,70.3199990093708,94.8086428642273,2.147254637757866,7,-1,-1,8x1536x6144,0,
2026-03-03T03:41:57.854444+00:00,FULL,llm_style,eval,llm_style_eval_066,64,1536,4096,bf16,NVIDIA GeForce RTX 4060,c04,64,64,64,4,3,8,0.0,0.0,59.37600135803223,87.06111848354337,13.56282588219559,3,-1,-1,64x1536x4096,0,
2026-03-03T03:41:57.937442+00:00,FULL,llm_style,eval,llm_style_eval_067,64,8192,2048,bf16,NVIDIA GeForce RTX 4060,c04,64,64,64,4,3,8,0.0,0.0,171.32800072431564,295.23967534303654,12.534341373979622,1,-1,-1,64x8192x2048,0,
2026-03-03T03:41:57.957551+00:00,FULL,llm_style,eval,llm_style_eval_068,64,1024,4096,bf16,NVIDIA GeForce RTX 4060,c04,64,64,64,4,3,8,0.0,0.0,54.07999828457832,112.71136127412319,9.927347060458327,3,-1,-1,64x1024x4096,0,
2026-03-03T03:41:57.995794+00:00,FULL,llm_style,eval,llm_style_eval_069,64,2048,4096,bf16,NVIDIA GeForce RTX 4060,c11,32,128,32,4,2,8,0.0,0.0,84.9439986050129,192.44895711541164,12.64058487513483,3,-1,-1,64x2048x4096,0,
2026-03-03T03:41:58.103853+00:00,FULL,llm_style,eval,llm_style_eval_070,64,8192,1024,bf16,NVIDIA GeForce RTX 4060,c06,64,128,32,4,3,8,0.0,108.008,64.51199948787689,73.29568281769753,16.644063624190995,1,-1,-1,64x8192x1024,0,
2026-03-03T03:41:58.172864+00:00,FULL,llm_style,eval,llm_style_eval_071,64,6144,2048,bf16,NVIDIA GeForce RTX 4060,c06,64,128,32,4,3,8,0.0,0.0,99.32799637317657,185.46816363930702,16.215093375576682,1,-1,-1,64x6144x2048,0,
2026-03-03T03:41:58.187509+00:00,FULL,llm_style,eval,llm_style_eval_072,64,1536,1024,bf16,NVIDIA GeForce RTX 4060,c00,32,32,32,2,2,8,0.0,0.0,40.12800008058548,115.50655767321581,5.0171100377714755,3,-1,-1,64x1536x1024,0,
2026-03-03T03:41:58.212114+00:00,FULL,llm_style,eval,llm_style_eval_073,1,4096,1536,bf16,NVIDIA GeForce RTX 4060,c11,32,128,32,4,2,8,0.0,0.0,52.22399905323982,142.8787198662758,0.2409411808385707,7,-1,-1,1x4096x1536,0,
2026-03-03T03:41:58.273711+00:00,FULL,llm_style,eval,llm_style_eval_074,8,1024,2048,bf16,NVIDIA GeForce RTX 4060,c00,32,32,32,2,2,8,0.0,61.545,40.23999907076359,76.32575854659078,0.833857673331285,7,-1,-1,8x1024x2048,0,
2026-03-03T03:41:58.358692+00:00,FULL,llm_style,eval,llm_style_eval_075,2,6144,1024,bf16,NVIDIA GeForce RTX 4060,c00,32,32,32,2,2,8,0.0,84.941,40.95999896526337,142.419203966856,0.61440001552105,5,-1,-1,2x6144x1024,0,
2026-03-03T03:41:58.386801+00:00,FULL,llm_style,eval,llm_style_eval_076,64,1024,6144,bf16,NVIDIA GeForce RTX 4060,c04,64,64,64,4,3,8,0.0,0.0,89.48799967765808,240.33919468522046,8.999043121991427,3,-1,-1,64x1024x6144,0,
2026-03-03T03:41:58.786383+00:00,FULL,llm_style,eval,llm_style_eval_077,1,4096,8192,bf16,NVIDIA GeForce RTX 4060,c00,32,32,32,2,2,8,0.0,399.53,292.1919971704483,361.2467229366301,0.229673860509097,6,-1,-1,1x4096x8192,0,
2026-03-03T03:41:58.888668+00:00,FULL,llm_style,eval,llm_style_eval_078,64,6144,3072,bf16,NVIDIA GeForce RTX 4060,c11,32,128,32,4,2,8,0.0,0.0,186.3039955496788,239.05695453286162,12.967618310449945,1,-1,-1,64x6144x3072,0,
2026-03-03T03:41:59.039911+00:00,FULL,llm_style,eval,llm_style_eval_079,2,3072,4096,bf16,NVIDIA GeForce RTX 4060,c04,64,64,64,4,3,8,0.0,151.192,82.94399827718735,145.97120091319084,0.60681482741884,7,-1,-1,2x3072x4096,0,
2026-03-03T03:41:59.091491+00:00,FULL,llm_style,eval,llm_style_eval_080,4,1536,1024,bf16,NVIDIA GeForce RTX 4060,c00,32,32,32,2,2,8,0.0,51.537,15.12000011280179,263.04319471120783,0.8322031683945762,7,-1,-1,4x1536x1024,0,
2026-03-03T03:41:59.394681+00:00,FULL,llm_style,eval,llm_style_eval_081,4,4096,6144,bf16,NVIDIA GeForce RTX 4060,c02,32,64,32,2,2,8,0.0,303.152,228.35199534893036,301.5372887253759,0.8816502421726837,7,-1,-1,4x4096x6144,0,
2026-03-03T03:41:59.484330+00:00,FULL,llm_style,eval,llm_style_eval_082,64,6144,1024,bf16,NVIDIA GeForce RTX 4060,c06,64,128,32,4,3,8,0.0,89.607,53.05599980056286,103.65951754152759,15.178422252471748,1,-1,-1,64x6144x1024,0,
2026-03-03T03:41:59.570370+00:00,FULL,llm_style,eval,llm_style_eval_083,8,4096,4096,bf16,NVIDIA GeForce RTX 4060,c00,32,32,32,2,2,8,0.0,0.0,188.7200027704239,338.7494388222694,1.4224006573725478,7,-1,-1,8x4096x4096,0,
2026-03-03T03:41:59.719772+00:00,FULL,llm_style,eval,llm_style_eval_084,64,1024,8192,bf16,NVIDIA GeForce RTX 4060,c04,64,64,64,4,3,8,0.0,149.351,84.79999750852585,106.45248152315615,12.662050183339277,2,-1,-1,64x1024x8192,0,
2026-03-03T03:42:00.021848+00:00,FULL,llm_style,eval,llm_style_eval_085,1,3072,8192,bf16,NVIDIA GeForce RTX 4060,c06,64,128,32,4,3,8,0.0,302.032,228.35199534893036,272.0137616991996,0.22041256054317093,6,-1,-1,1x3072x8192,0,
2026-03-03T03:42:00.086050+00:00,FULL,llm_style,eval,llm_style_eval_086,8,1536,1024,bf16,NVIDIA GeForce RTX 4060,c04,64,64,64,4,3,8,0.0,64.154,38.91199827194214,187.8883261978625,0.6467368708264476,7,-1,-1,8x1536x1024,0,
2026-03-03T03:42:00.162788+00:00,FULL,llm_style,eval,llm_style_eval_087,16,1024,3072,bf16,NVIDIA GeForce RTX 4060,c04,64,64,64,4,3,8,0.0,76.694,50.175998359918594,56.25663995742798,2.0062041472085883,7,-1,-1,16x1024x3072,0,
2026-03-03T03:42:00.256166+00:00,FULL,llm_style,eval,llm_style_eval_088,8,4096,1536,bf16,NVIDIA GeForce RTX 4060,c11,32,128,32,4,2,8,0.0,93.34,48.128001391887665,52.26495906710624,2.091574407595649,7,-1,-1,8x4096x1536,0,
2026-03-03T03:42:00.486618+00:00,FULL,llm_style,eval,llm_style_eval_089,16,6144,3072,bf16,NVIDIA GeForce RTX 4060,c11,32,128,32,4,2,8,0.0,230.412,179.19999361038208,263.50047573447216,3.370422977319839,5,-1,-1,16x6144x3072,0,
2026-03-03T03:42:00.575744+00:00,FULL,llm_style,eval,llm_style_eval_090,32,1536,3072,bf16,NVIDIA GeForce RTX 4060,c04,64,64,64,4,3,8,0.0,89.084,53.10400016605854,110.4668810218571,5.686763465194041,7,-1,-1,32x1536x3072,0,
2026-03-03T03:42:00.665080+00:00,FULL,llm_style,eval,llm_style_eval_091,16,1024,4096,bf16,NVIDIA GeForce RTX 4060,c04,64,64,64,4,3,8,0.0,89.292,56.32000043988228,72.20288090407846,2.3831272541140724,7,-1,-1,16x1024x4096,0,
2026-03-03T03:42:00.981697+00:00,FULL,llm_style,eval,llm_style_eval_092,1,4096,6144,bf16,NVIDIA GeForce RTX 4060,c02,32,64,32,2,2,8,0.0,316.573,227.32800245285034,272.8441551327704,0.2214054030164594,7,-1,-1,1x4096x6144,0,
2026-03-03T03:42:01.084950+00:00,FULL,llm_style,eval,llm_style_eval_093,32,2048,3072,bf16,NVIDIA GeForce RTX 4060,c00,32,32,32,2,2,8,0.0,103.209,33.79200026392937,130.07807910442352,11.915636270570362,7,-1,-1,32x2048x3072,0,
2026-03-03T03:42:01.096868+00:00,FULL,llm_style,eval,llm_style_eval_094,32,1024,2048,bf16,NVIDIA GeForce RTX 4060,c04,64,64,64,4,3,8,0.0,0.0,39.93599861860275,128.563202470541,3.360820629072225,7,-1,-1,32x1024x2048,0,
2026-03-03T03:42:01.237283+00:00,FULL,llm_style,eval,llm_style_eval_095,8,6144,2048,bf16,NVIDIA GeForce RTX 4060,c02,32,64,32,2,2,8,0.0,140.378,70.36799937486649,79.8611170053482,2.861053231419683,5,-1,-1,8x6144x2048,0,
2026-03-03T03:42:01.269449+00:00,FULL,llm_style,eval,llm_style_eval_096,64,2048,3072,bf16,NVIDIA GeForce RTX 4060,c11,32,128,32,4,2,8,0.0,0.0,68.60800087451935,78.83583664894104,11.73779089515909,3,-1,-1,64x2048x3072,0,
2026-03-03T03:42:01.294865+00:00,FULL,llm_style,eval,llm_style_eval_097,64,6144,1024,bf16,NVIDIA GeForce RTX 4060,c06,64,128,32,4,3,8,0.0,0.0,54.27199974656105,178.39104428887353,14.838339691933468,1,-1,-1,64x6144x1024,0,
2026-03-03T03:42:01.319898+00:00,FULL,llm_style,eval,llm_style_eval_098,32,6144,1024,bf16,NVIDIA GeForce RTX 4060,c00,32,32,32,2,2,8,0.0,0.0,54.08000014722347,165.5315195024013,7.445510038902481,5,-1,-1,32x6144x1024,0,
2026-03-03T03:42:01.394470+00:00,FULL,llm_style,eval,llm_style_eval_099,1,2048,2048,bf16,NVIDIA GeForce RTX 4060,c00,32,32,32,2,2,8,0.0,74.52,43.3920007199049,111.67744055390357,0.19332153071595878,7,-1,-1,1x2048x2048,0,
2026-03-03T03:42:01.429755+00:00,FULL,llm_style,eval,llm_style_eval_100,64,8192,1024,bf16,NVIDIA GeForce RTX 4060,c06,64,128,32,4,3,8,0.0,0.0,72.43200019001961,151.0707226395607,14.82413603356422,1,-1,-1,64x8192x1024,0,
2026-03-03T03:42:01.492383+00:00,FULL,llm_style,eval,llm_style_eval_101,64,8192,1536,bf16,NVIDIA GeForce RTX 4060,c06,64,128,32,4,3,8,0.0,0.0,98.30400347709656,176.86815932393068,16.383999420483928,1,-1,-1,64x8192x1536,0,
2026-03-03T03:42:01.519942+00:00,FULL,llm_style,eval,llm_style_eval_102,32,3072,2048,bf16,NVIDIA GeForce RTX 4060,c02,32,64,32,2,2,8,0.0,0.0,82.7840007841587,242.14399576187134,4.8639009976073835,7,-1,-1,32x3072x2048,0,
2026-03-03T03:42:01.546845+00:00,FULL,llm_style,eval,llm_style_eval_103,64,2048,3072,bf16,NVIDIA GeForce RTX 4060,c11,32,128,32,4,2,8,0.0,0.0,73.69600236415863,113.12992021441457,10.927409115364084,3,-1,-1,64x2048x3072,0,
2026-03-03T03:42:01.609580+00:00,FULL,llm_style,eval,llm_style_eval_104,16,6144,2048,bf16,NVIDIA GeForce RTX 4060,c00,32,32,32,2,2,8,0.0,0.0,76.80000364780426,124.53504323959334,5.2428797509765745,5,-1,-1,16x6144x2048,0,
2026-03-03T03:42:01.754665+00:00,FULL,llm_style,eval,llm_style_eval_105,1,1024,8192,bf16,NVIDIA GeForce RTX 4060,c04,64,64,64,4,3,8,0.0,145.035,86.01599931716919,131.4864021539687,0.19504762059598826,6,-1,-1,1x1024x8192,0,
2026-03-03T03:42:02.165019+00:00,FULL,llm_style,eval,llm_style_eval_106,32,4096,8192,bf16,NVIDIA GeForce RTX 4060,c03,64,64,32,4,2,8,0.0,410.31,297.7440059185028,323.0652919411659,7.212516810792827,6,-1,-1,32x4096x8192,0,
2026-03-03T03:42:02.220545+00:00,FULL,llm_style,eval,llm_style_eval_107,64,6144,1536,bf16,NVIDIA GeForce RTX 4060,c10,64,128,64,8,3,8,0.0,0.0,66.54400005936623,156.1023959517479,18.152794405541254,1,-1,-1,64x6144x1536,0,
2026-03-03T03:42:02.291251+00:00,FULL,llm_style,eval,llm_style_eval_108,8,3072,1536,bf16,NVIDIA GeForce RTX 4060,c00,32,32,32,2,2,8,0.0,70.654,37.88800165057182,61.74720220267766,1.992648561839908,7,-1,-1,8x3072x1536,0,
2026-03-03T03:42:02.304879+00:00,FULL,llm_style,eval,llm_style_eval_109,16,2048,1024,bf16,NVIDIA GeForce RTX 4060,c00,32,32,32,2,2,8,0.0,0.0,69.07200068235397,163.54303941130632,0.9715784013354126,7,-1,-1,16x2048x1024,0,
2026-03-03T03:42:03.065087+00:00,FULL,llm_style,eval,llm_style_eval_110,1,8192,8192,bf16,NVIDIA GeForce RTX 4060,c10,64,128,64,8,3,8,0.0,760.165,557.0720136165619,618.3235085010529,0.24093425036495078,4,-1,-1,1x8192x8192,0,
2026-03-03T03:42:03.183534+00:00,FULL,llm_style,eval,llm_style_eval_111,8,6144,1536,bf16,NVIDIA GeForce RTX 4060,c11,32,128,32,4,2,8,0.0,118.399,48.81599918007851,166.5900762379168,3.0931445947258225,5,-1,-1,8x6144x1536,0,
2026-03-03T03:42:03.281000+00:00,FULL,llm_style,eval,llm_style_eval_112,2,6144,3072,bf16,NVIDIA GeForce RTX 4060,c00,32,32,32,2,2,8,0.0,0.0,179.19999361038208,316.0131159424782,0.42130287216497986,5,-1,-1,2x6144x3072,0,
2026-03-03T03:42:03.601224+00:00,FULL,llm_style,eval,llm_style_eval_113,1,8192,8192,bf16,NVIDIA GeForce RTX 4060,c10,64,128,64,8,3,8,0.0,0.0,582.6560258865356,667.134085893631,0.23035499855301775,4,-1,-1,1x8192x8192,0,
2026-03-03T03:42:03.661638+00:00,FULL,llm_style,eval,llm_style_eval_114,1,3072,1024,bf16,NVIDIA GeForce RTX 4060,c00,32,32,32,2,2,8,0.0,60.363,36.687999963760376,164.07551929354653,0.17148539048774983,7,-1,-1,1x3072x1024,0,
2026-03-03T03:42:03.738942+00:00,FULL,llm_style,eval,llm_style_eval_115,16,3072,1536,bf16,NVIDIA GeForce RTX 4060,c11,32,128,32,4,2,8,0.0,77.262,47.00800031423569,52.734078988432884,3.2121116190997254,7,-1,-1,16x3072x1536,0,
2026-03-03T03:42:03.798522+00:00,FULL,llm_style,eval,llm_style_eval_116,8,3072,1024,bf16,NVIDIA GeForce RTX 4060,c02,32,64,32,2,2,8,0.0,59.539,40.800001472234726,87.97183983027927,1.2336187790152842,7,-1,-1,8x3072x1024,0,
2026-03-03T03:42:03.892944+00:00,FULL,llm_style,eval,llm_style_eval_117,4,1024,4096,bf16,NVIDIA GeForce RTX 4060,c04,64,64,64,4,3,8,0.0,94.38,57.34400078654289,66.42559871077538,0.5851428491169093,7,-1,-1,4x1024x4096,0,
2026-03-03T03:42:03.989873+00:00,FULL,llm_style,eval,llm_style_eval_118,64,6144,3072,bf16,NVIDIA GeForce RTX 4060,c11,32,128,32,4,2,8,0.0,0.0,187.391996383667,214.54304546117783,12.892328117651509,1,-1,-1,64x6144x3072,0,
2026-03-03T03:42:04.575016+00:00,FULL,llm_style,eval,llm_style_eval_119,64,8192,6144,bf16,NVIDIA GeForce RTX 4060,c00,32,32,32,2,2,8,0.0,585.092,442.3680007457733,559.5340758562088,14.563555531003347,1,-1,-1,64x8192x6144,0,
2026-03-03T03:42:04.674854+00:00,FULL,llm_style,eval,llm_style_eval_120,8,1024,4096,bf16,NVIDIA GeForce RTX 4060,c04,64,64,64,4,3,8,0.0,99.794,62.81600147485733,105.50623759627331,1.068340270382554,7,-1,-1,8x1024x4096,0,
2026-03-03T03:42:04.739494+00:00,FULL,llm_style,eval,llm_style_eval_121,4,1024,2048,bf16,NVIDIA GeForce RTX 4060,c04,64,64,64,4,3,8,0.0,64.599,43.007999658584595,56.74335829913612,0.3900952411919765,7,-1,-1,4x1024x2048,0,
2026-03-03T03:42:05.039698+00:00,FULL,llm_style,eval,llm_style_eval_122,4,6144,4096,bf16,NVIDIA GeForce RTX 4060,c11,32,128,32,4,2,8,0.0,300.163,228.30399870872498,276.8281641602515,0.8818355926251501,5,-1,-1,4x6144x4096,0,
2026-03-03T03:42:05.332191+00:00,FULL,llm_style,eval,llm_style_eval_123,4,3072,8192,bf16,NVIDIA GeForce RTX 4060,c10,64,128,64,8,3,8,0.0,292.449,227.4240031838417,271.55456602573383,0.885247771481951,6,-1,-1,4x3072x8192,0,
2026-03-03T03:42:05.370804+00:00,FULL,llm_style,eval,llm_style_eval_124,64,6144,1024,bf16,NVIDIA GeForce RTX 4060,c06,64,128,32,4,3,8,0.0,0.0,61.39199994504452,165.65247997641558,13.117448017997065,1,-1,-1,64x6144x1024,0,
2026-03-03T03:42:05.435985+00:00,FULL,llm_style,eval,llm_style_eval_125,64,1536,8192,bf16,NVIDIA GeForce RTX 4060,c04,64,64,64,4,3,8,0.0,0.0,117.76000261306763,243.16255405545218,13.677077957378314,2,-1,-1,64x1536x8192,0,
2026-03-03T03:42:05.526799+00:00,FULL,llm_style,eval,llm_style_eval_126,64,2048,8192,bf16,NVIDIA GeForce RTX 4060,c06,64,128,32,4,3,8,0.0,0.0,168.96000504493713,285.4713633656501,12.710011741706852,2,-1,-1,64x2048x8192,0,
2026-03-03T03:42:05.668986+00:00,FULL,llm_style,eval,llm_style_eval_127,2,8192,1536,bf16,NVIDIA GeForce RTX 4060,c11,32,128,32,4,2,8,0.0,142.137,65.5359998345375,119.17184248566619,0.7680000019390135,5,-1,-1,2x8192x1536,0,
2026-03-03T03:42:05.747118+00:00,FULL,llm_style,eval,llm_style_eval_128,8,2048,2048,bf16,NVIDIA GeForce RTX 4060,c00,32,32,32,2,2,8,0.0,78.095,40.95999896526337,98.4575995802878,1.6384000413894664,7,-1,-1,8x2048x2048,0,
2026-03-03T03:42:05.995910+00:00,FULL,llm_style,eval,llm_style_eval_129,64,8192,6144,bf16,NVIDIA GeForce RTX 4060,c00,32,32,32,2,2,8,0.0,0.0,442.3680007457733,471.55135184526443,14.563555531003347,1,-1,-1,64x8192x6144,0,
2026-03-03T03:42:06.015871+00:00,FULL,llm_style,eval,llm_style_eval_130,16,3072,1536,bf16,NVIDIA GeForce RTX 4060,c11,32,128,32,4,2,8,0.0,0.0,45.05600035190582,124.99968491494644,3.351272701097914,7,-1,-1,16x3072x1536,0,
2026-03-03T03:42:06.758153+00:00,FULL,llm_style,eval,llm_style_eval_131,32,8192,8192,bf16,NVIDIA GeForce RTX 4060,c11,32,128,32,4,2,8,0.0,742.23,563.18399310112,607.6070320606232,7.626224020235668,4,-1,-1,32x8192x8192,0,
2026-03-03T03:42:07.165769+00:00,FULL,llm_style,eval,llm_style_eval_132,32,8192,4096,bf16,NVIDIA GeForce RTX 4060,c00,32,32,32,2,2,8,0.0,407.574,297.9840040206909,345.72352409362776,7.206707806540135,5,-1,-1,32x8192x4096,0,
2026-03-03T03:42:07.895030+00:00,FULL,llm_style,eval,llm_style_eval_133,2,8192,8192,bf16,NVIDIA GeForce RTX 4060,c10,64,128,64,8,3,8,0.0,729.216,558.0800175666809,602.3782348632812,0.4809981499972387,4,-1,-1,2x8192x8192,0,
2026-03-03T03:42:08.011110+00:00,FULL,llm_style,eval,llm_style_eval_134,64,3072,3072,bf16,NVIDIA GeForce RTX 4060,c03,64,64,32,4,2,8,0.0,116.033,65.50399959087372,73.74848261475563,18.441004511857287,3,-1,-1,64x3072x3072,0,
2026-03-03T03:42:08.128921+00:00,FULL,llm_style,eval,llm_style_eval_135,8,3072,3072,bf16,NVIDIA GeForce RTX 4060,c00,32,32,32,2,2,8,0.0,117.767,58.19199979305267,259.79231640696514,2.594771524212624,7,-1,-1,8x3072x3072,0,
2026-03-03T03:42:08.256038+00:00,FULL,llm_style,eval,llm_style_eval_136,4,2048,4096,bf16,NVIDIA GeForce RTX 4060,c11,32,128,32,4,2,8,0.0,127.074,75.53600147366524,79.76703993976116,0.888435483620307,7,-1,-1,4x2048x4096,0,
2026-03-03T03:42:09.019571+00:00,FULL,llm_style,eval,llm_style_eval_137,4,8192,8192,bf16,NVIDIA GeForce RTX 4060,c02,32,64,32,2,2,8,0.0,763.489,558.5280060768127,679.7619301080701,0.961224694480523,4,-1,-1,4x8192x8192,0,
2026-03-03T03:42:09.097343+00:00,FULL,llm_style,eval,llm_style_eval_138,16,1024,1024,bf16,NVIDIA GeForce RTX 4060,c04,64,64,64,4,3,8,0.0,77.729,40.031999349594116,113.19168046116818,0.8381902614199609,7,-1,-1,16x1024x1024,0,
2026-03-03T03:42:09.169177+00:00,FULL,llm_style,eval,llm_style_eval_139,4,1024,1024,bf16,NVIDIA GeForce RTX 4060,c09,128,64,64,8,3,8,0.0,71.791,41.760001331567764,331.56639672815714,0.20087662194729802,7,-1,-1,4x1024x1024,0,
2026-03-03T03:42:09.307087+00:00,FULL,llm_style,eval,llm_style_eval_140,64,4096,6144,bf16,NVIDIA GeForce RTX 4060,c03,64,64,32,4,2,8,0.0,0.0,232.44799673557281,247.30272054672238,13.857832793734023,3,-1,-1,64x4096x6144,0,
2026-03-03T03:42:09.433103+00:00,FULL,llm_style,eval,llm_style_eval_141,4,6144,4096,bf16,NVIDIA GeForce RTX 4060,c11,32,128,32,4,2,8,0.0,0.0,254.8000067472458,275.67358911037445,0.7901357404582415,5,-1,-1,4x6144x4096,0,
2026-03-03T03:42:09.600613+00:00,FULL,llm_style,eval,llm_style_eval_142,4,2048,6144,bf16,NVIDIA GeForce RTX 4060,c00,32,32,32,2,2,8,0.0,167.458,98.75200316309929,214.28703412413591,1.0193544715618985,7,-1,-1,4x2048x6144,0,
2026-03-03T03:42:09.677552+00:00,FULL,llm_style,eval,llm_style_eval_143,64,1536,8192,bf16,NVIDIA GeForce RTX 4060,c04,64,64,64,4,3,8,0.0,0.0,90.11200070381165,124.46719743311404,17.873454405855544,2,-1,-1,64x1536x8192,0,
2026-03-03T03:42:09.790838+00:00,FULL,llm_style,eval,llm_style_eval_144,1,3072,3072,bf16,NVIDIA GeForce RTX 4060,c00,32,32,32,2,2,8,0.0,113.232,62.463998794555664,84.89823810756207,0.3021639402574573,7,-1,-1,1x3072x3072,0,
2026-03-03T03:42:09.807770+00:00,FULL,llm_style,eval,llm_style_eval_145,32,1024,2048,bf16,NVIDIA GeForce RTX 4060,c04,64,64,64,4,3,8,0.0,0.0,45.951999723911285,73.22591897100206,2.920824530083711,7,-1,-1,32x1024x2048,0,
2026-03-03T03:42:09.991621+00:00,FULL,llm_style,eval,llm_style_eval_146,64,8192,4096,bf16,NVIDIA GeForce RTX 4060,c10,64,128,64,8,3,8,0.0,0.0,302.94400453567505,430.60224056243896,14.177429596545192,1,-1,-1,64x8192x4096,0,
2026-03-03T03:42:10.036867+00:00,FULL,llm_style,eval,llm_style_eval_147,64,2048,4096,bf16,NVIDIA GeForce RTX 4060,c11,32,128,32,4,2,8,0.0,0.0,82.43199810385704,176.7731164395809,13.025789119501631,3,-1,-1,64x2048x4096,0,
2026-03-03T03:42:10.065508+00:00,FULL,llm_style,eval,llm_style_eval_148,64,1024,6144,bf16,NVIDIA GeForce RTX 4060,c04,64,64,64,4,3,8,0.0,0.0,71.6480016708374,124.60032097995267,11.239760345301864,3,-1,-1,64x1024x6144,0,
2026-03-03T03:42:10.230857+00:00,FULL,llm_style,eval,llm_style_eval_149,64,4096,8192,bf16,NVIDIA GeForce RTX 4060,c11,32,128,32,4,2,8,0.0,0.0,305.1519989967346,344.41823393106455,14.074845683858555,2,-1,-1,64x4096x8192,0,
2026-03-03T03:42:10.320434+00:00,FULL,llm_style,eval,llm_style_eval_150,2,2048,3072,bf16,NVIDIA GeForce RTX 4060,c00,32,32,32,2,2,8,0.0,89.521,55.18399924039841,141.7667192220687,0.45603479897080235,7,-1,-1,2x2048x3072,0,
2026-03-03T03:42:10.455712+00:00,FULL,llm_style,eval,llm_style_eval_151,64,4096,2048,bf16,NVIDIA GeForce RTX 4060,c11,32,128,32,4,2,8,0.0,135.236,68.60800087451935,185.6374377757307,15.650387860212119,3,-1,-1,64x4096x2048,0,
2026-03-03T03:42:11.214902+00:00,FULL,llm_style,eval,llm_style_eval_152,8,8192,8192,bf16,NVIDIA GeForce RTX 4060,c11,32,128,32,4,2,8,0.0,759.146,558.5920214653015,696.8220841884611,1.9222290737045522,4,-1,-1,8x8192x8192,0,
2026-03-03T03:42:11.305349+00:00,FULL,llm_style,eval,llm_style_eval_153,64,8192,2048,bf16,NVIDIA GeForce RTX 4060,c04,64,64,64,4,3,8,0.0,0.0,191.48799777030945,250.57280257344232,11.21471670812452,1,-1,-1,64x8192x2048,0,
2026-03-03T03:42:11.536290+00:00,FULL,llm_style,eval,llm_style_eval_154,16,2048,8192,bf16,NVIDIA GeForce RTX 4060,c04,64,64,64,4,3,8,0.0,230.89,162.84800320863724,268.8982361555098,3.2967607917929023,6,-1,-1,16x2048x8192,0,
2026-03-03T03:42:11.636402+00:00,FULL,llm_style,eval,llm_style_eval_155,4,2048,1536,bf16,NVIDIA GeForce RTX 4060,c00,32,32,32,2,2,8,0.0,100.068,44.943999499082565,102.04544141888616,0.5599373504913311,7,-1,-1,4x2048x1536,0,
2026-03-03T03:42:11.758144+00:00,FULL,llm_style,eval,llm_style_eval_156,1,4096,6144,bf16,NVIDIA GeForce RTX 4060,c02,32,64,32,2,2,8,0.0,0.0,228.35199534893036,298.32608729600895,0.22041256054317093,7,-1,-1,1x4096x6144,0,
2026-03-03T03:42:11.930687+00:00,FULL,llm_style,eval,llm_style_eval_157,1,1536,8192,bf16,NVIDIA GeForce RTX 4060,c04,64,64,64,4,3,8,0.0,172.488,96.25600278377533,109.27104339003559,0.2614468009494561,6,-1,-1,1x1536x8192,0,
2026-03-03T03:42:12.007937+00:00,FULL,llm_style,eval,llm_style_eval_158,64,1536,8192,bf16,NVIDIA GeForce RTX 4060,c04,64,64,64,4,3,8,0.0,0.0,140.99200069904327,191.6227169334887,11.423433443135254,2,-1,-1,64x1536x8192,0,
2026-03-03T03:42:12.120558+00:00,FULL,llm_style,eval,llm_style_eval_159,16,6144,1536,bf16,NVIDIA GeForce RTX 4060,c11,32,128,32,4,2,8,0.0,112.567,48.96000027656555,55.703999400138855,6.16809408280469,5,-1,-1,16x6144x1536,0,
2026-03-03T03:42:12.311661+00:00,FULL,llm_style,eval,llm_style_eval_160,32,6144,6144,bf16,NVIDIA GeForce RTX 4060,c11,32,128,32,4,2,8,0.0,0.0,330.7519853115082,418.7395203113555,7.304322305804586,5,-1,-1,32x6144x6144,0,
2026-03-03T03:42:12.412040+00:00,FULL,llm_style,eval,llm_style_eval_161,2,1536,4096,bf16,NVIDIA GeForce RTX 4060,c04,64,64,64,4,3,8,0.0,100.327,55.616000667214394,126.09535753726936,0.4524925147096246,7,-1,-1,2x1536x4096,0,
2026-03-03T03:42:12.500946+00:00,FULL,llm_style,eval,llm_style_eval_162,64,1536,3072,bf16,NVIDIA GeForce RTX 4060,c04,64,64,64,4,3,8,0.0,88.866,54.047999903559685,63.02720081061124,11.174877462213379,3,-1,-1,64x1536x3072,0,
2026-03-03T03:42:12.537139+00:00,FULL,llm_style,eval,llm_style_eval_163,64,1024,8192,bf16,NVIDIA GeForce RTX 4060,c04,64,64,64,4,3,8,0.0,0.0,82.24000036716461,193.51904168725014,13.056199163499826,2,-1,-1,64x1024x8192,0,
2026-03-03T03:42:12.703837+00:00,FULL,llm_style,eval,llm_style_eval_164,64,4096,8192,bf16,NVIDIA GeForce RTX 4060,c11,32,128,32,4,2,8,0.0,0.0,328.62401008605957,359.9135911464691,13.06954806763888,2,-1,-1,64x4096x8192,0,
2026-03-03T03:42:13.012211+00:00,FULL,llm_style,eval,llm_style_eval_165,4,8192,3072,bf16,NVIDIA GeForce RTX 4060,c10,64,128,64,8,3,8,0.0,308.324,229.0560007095337,304.620161652565,0.8789404834466773,5,-1,-1,4x8192x3072,0,
2026-03-03T03:42:13.053628+00:00,FULL,llm_style,eval,llm_style_eval_166,64,1024,6144,bf16,NVIDIA GeForce RTX 4060,c04,64,64,64,4,3,8,0.0,0.0,75.77600330114365,194.24960121512407,10.627458996479508,3,-1,-1,64x1024x6144,0,
2026-03-03T03:42:13.066572+00:00,FULL,llm_style,eval,llm_style_eval_167,2,2048,1024,bf16,NVIDIA GeForce RTX 4060,c00,32,32,32,2,2,8,0.0,0.0,42.94399917125702,166.0265612602232,0.19533830481290168,7,-1,-1,2x2048x1024,0,
2026-03-03T03:42:13.141992+00:00,FULL,llm_style,eval,llm_style_eval_168,64,4096,1024,bf16,NVIDIA GeForce RTX 4060,c11,32,128,32,4,2,8,0.0,75.377,51.19999870657921,81.15839798003427,10.485760264892583,3,-1,-1,64x4096x1024,0,
2026-03-03T03:42:13.180801+00:00,FULL,llm_style,eval,llm_style_eval_169,4,1536,6144,bf16,NVIDIA GeForce RTX 4060,c04,64,64,64,4,3,8,0.0,0.0,71.68000191450119,147.1590338647365,1.0532571147256975,7,-1,-1,4x1536x6144,0,
2026-03-03T03:42:13.200723+00:00,FULL,llm_style,eval,llm_style_eval_170,16,1536,1536,bf16,NVIDIA GeForce RTX 4060,c00,32,32,32,2,2,8,0.0,0.0,42.927999049425125,264.4927966594695,1.7587000016720096,7,-1,-1,16x1536x1536,0,
2026-03-03T03:42:13.294114+00:00,FULL,llm_style,eval,llm_style_eval_171,1,2048,3072,bf16,NVIDIA GeForce RTX 4060,c00,32,32,32,2,2,8,0.0,93.345,52.15999856591225,217.07136660814268,0.24123681644851921,7,-1,-1,1x2048x3072,0,
2026-03-03T03:42:13.376992+00:00,FULL,llm_style,eval,llm_style_eval_172,64,3072,2048,bf16,NVIDIA GeForce RTX 4060,c03,64,64,32,4,2,8,0.0,82.834,52.22399905323982,56.553598418831825,15.420235573668524,3,-1,-1,64x3072x2048,0,
2026-03-03T03:42:13.631251+00:00,FULL,llm_style,eval,llm_style_eval_173,64,8192,6144,bf16,NVIDIA GeForce RTX 4060,c00,32,32,32,2,2,8,0.0,0.0,465.56800603866577,504.55551564693445,13.837830049397658,1,-1,-1,64x8192x6144,0,
2026-03-03T03:42:13.865052+00:00,FULL,llm_style,eval,llm_style_eval_174,2,4096,4096,bf16,NVIDIA GeForce RTX 4060,c11,32,128,32,4,2,8,0.0,233.748,161.6479977965355,178.2169607281685,0.41515431625988447,7,-1,-1,2x4096x4096,0,
2026-03-03T03:42:13.902675+00:00,FULL,llm_style,eval,llm_style_eval_175,64,4096,2048,bf16,NVIDIA GeForce RTX 4060,c11,32,128,32,4,2,8,0.0,0.0,69.29599866271019,135.0131195783615,15.495004686003691,3,-1,-1,64x4096x2048,0,
2026-03-03T03:42:13.968272+00:00,FULL,llm_style,eval,llm_style_eval_176,16,6144,2048,bf16,NVIDIA GeForce RTX 4060,c00,32,32,32,2,2,8,0.0,0.0,73.72800260782242,109.51679587364188,5.46133314016131,5,-1,-1,16x6144x2048,0,
2026-03-03T03:42:14.017595+00:00,FULL,llm_style,eval,llm_style_eval_177,1,6144,1536,bf16,NVIDIA GeForce RTX 4060,c11,32,128,32,4,2,8,0.0,0.0,74.09600168466568,149.4672016799448,0.2547285625521963,5,-1,-1,1x6144x1536,0,
2026-03-03T03:42:14.271730+00:00,FULL,llm_style,eval,llm_style_eval_178,32,6144,8192,bf16,NVIDIA GeForce RTX 4060,c11,32,128,32,4,2,8,0.0,0.0,428.9279878139496,549.6115010976791,7.509944707541977,4,-1,-1,32x6144x8192,0,
2026-03-03T03:42:14.397528+00:00,FULL,llm_style,eval,llm_style_eval_179,64,4096,6144,bf16,NVIDIA GeForce RTX 4060,c03,64,64,32,4,2,8,0.0,0.0,235.52000522613525,351.6825672984122,13.677077957378314,3,-1,-1,64x4096x6144,0,
2026-03-03T03:42:14.417166+00:00,FULL,llm_style,eval,llm_style_eval_180,64,2048,1536,bf16,NVIDIA GeForce RTX 4060,c11,32,128,32,4,2,8,0.0,0.0,38.91199827194214,81.94527782499789,10.347789933223162,3,-1,-1,64x2048x1536,0,
2026-03-03T03:42:14.443755+00:00,FULL,llm_style,eval,llm_style_eval_181,64,2048,3072,bf16,NVIDIA GeForce RTX 4060,c11,32,128,32,4,2,8,0.0,0.0,73.64800199866295,97.82271951436996,10.934531095828234,3,-1,-1,64x2048x3072,0,
2026-03-03T03:42:14.515065+00:00,FULL,llm_style,eval,llm_style_eval_182,32,3072,1536,bf16,NVIDIA GeForce RTX 4060,c11,32,128,32,4,2,8,0.0,71.255,47.95200005173683,64.10784129053353,6.297753746958921,7,-1,-1,32x3072x1536,0,
2026-03-03T03:42:14.600696+00:00,FULL,llm_style,eval,llm_style_eval_183,8,8192,2048,bf16,NVIDIA GeForce RTX 4060,c11,32,128,32,4,2,8,0.0,0.0,165.8879965543747,262.5788749754426,1.6181728731169065,5,-1,-1,8x8192x2048,0,
2026-03-03T03:42:14.643817+00:00,FULL,llm_style,eval,llm_style_eval_184,64,8192,1024,bf16,NVIDIA GeForce RTX 4060,c06,64,128,32,4,3,8,0.0,0.0,44.03200000524521,120.82207910716522,24.38548836918816,1,-1,-1,64x8192x1024,0,
2026-03-03T03:42:14.705750+00:00,FULL,llm_style,eval,llm_style_eval_185,1,8192,1536,bf16,NVIDIA GeForce RTX 4060,c11,32,128,32,4,2,8,0.0,0.0,93.18400174379349,214.691837877035,0.27006592901207066,5,-1,-1,1x8192x1536,0,
2026-03-03T03:42:14.732051+00:00,FULL,llm_style,eval,llm_style_eval_186,16,6144,1024,bf16,NVIDIA GeForce RTX 4060,c11,32,128,32,4,2,8,0.0,0.0,52.73599922657013,178.5126349329948,3.8176311239508105,5,-1,-1,16x6144x1024,0,
2026-03-03T03:42:14.759651+00:00,FULL,llm_style,eval,llm_style_eval_187,1,1024,6144,bf16,NVIDIA GeForce RTX 4060,c04,64,64,64,4,3,8,0.0,0.0,78.2880000770092,154.67520371079434,0.16072593485109626,7,-1,-1,1x1024x6144,0,
2026-03-03T03:42:15.149458+00:00,FULL,llm_style,eval,llm_style_eval_188,8,8192,4096,bf16,NVIDIA GeForce RTX 4060,c11,32,128,32,4,2,8,0.0,389.752,295.75999081134796,343.1347236037254,1.815224941437214,5,-1,-1,8x8192x4096,0,
2026-03-03T03:42:15.385467+00:00,FULL,llm_style,eval,llm_style_eval_189,8,2048,8192,bf16,NVIDIA GeForce RTX 4060,c10,64,128,64,8,3,8,0.0,235.965,162.81600296497345,309.4902502000329,1.6487043724918637,6,-1,-1,8x2048x8192,0,
2026-03-03T03:42:15.595616+00:00,FULL,llm_style,eval,llm_style_eval_190,4,8192,2048,bf16,NVIDIA GeForce RTX 4060,c11,32,128,32,4,2,8,0.0,210.104,161.920003592968,211.17728099226946,0.8289138155986858,5,-1,-1,4x8192x2048,0,
2026-03-03T03:42:15.912134+00:00,FULL,llm_style,eval,llm_style_eval_191,4,8192,8192,bf16,NVIDIA GeForce RTX 4060,c02,32,64,32,2,2,8,0.0,0.0,560.1279735565186,631.5539026260375,0.9584790214835219,4,-1,-1,4x8192x8192,0,
2026-03-03T03:42:15.923291+00:00,FULL,llm_style,eval,llm_style_eval_192,64,1536,1024,bf16,NVIDIA GeForce RTX 4060,c00,32,32,32,2,2,8,0.0,0.0,37.88800165057182,117.8092823922634,5.313729498239754,3,-1,-1,64x1536x1024,0,
2026-03-03T03:42:15.942181+00:00,FULL,llm_style,eval,llm_style_eval_193,32,2048,2048,bf16,NVIDIA GeForce RTX 4060,c00,32,32,32,2,2,8,0.0,0.0,51.05600133538246,149.5871989428997,5.257667051453377,7,-1,-1,32x2048x2048,0,
2026-03-03T03:42:15.954174+00:00,FULL,llm_style,eval,llm_style_eval_194,8,1024,2048,bf16,NVIDIA GeForce RTX 4060,c00,32,32,32,2,2,8,0.0,0.0,57.8560009598732,122.18367651104921,0.5799645921478762,7,-1,-1,8x1024x2048,0,
2026-03-03T03:42:16.002994+00:00,FULL,llm_style,eval,llm_style_eval_195,2,4096,2048,bf16,NVIDIA GeForce RTX 4060,c11,32,128,32,4,2,8,0.0,0.0,58.04799869656563,164.94592368602753,0.5780463194846582,7,-1,-1,2x4096x2048,0,
2026-03-03T03:42:16.050329+00:00,FULL,llm_style,eval,llm_style_eval_196,32,2048,4096,bf16,NVIDIA GeForce RTX 4060,c00,32,32,32,2,2,8,0.0,0.0,62.863998115062714,105.00095799565305,8.540196743728291,7,-1,-1,32x2048x4096,0,
2026-03-03T03:42:16.198907+00:00,FULL,llm_style,eval,llm_style_eval_197,32,8192,1536,bf16,NVIDIA GeForce RTX 4060,c06,64,128,32,4,3,8,0.0,148.526,87.0399996638298,99.77663949131966,9.252141212204666,5,-1,-1,32x8192x1536,0,
2026-03-03T03:42:16.375133+00:00,FULL,llm_style,eval,llm_style_eval_198,64,4096,8192,bf16,NVIDIA GeForce RTX 4060,c11,32,128,32,4,2,8,0.0,0.0,302.496001124382,437.7664089202881,14.198426690057206,2,-1,-1,64x4096x8192,0,
2026-03-03T03:42:16.764531+00:00,FULL,llm_style,eval,llm_style_eval_199,2,8192,4096,bf16,NVIDIA GeForce RTX 4060,c11,32,128,32,4,2,8,0.0,389.343,292.86399483680725,334.59199756383896,0.4582937143734251,5,-1,-1,2x8192x4096,0,
2026-03-03T03:42:16.873587+00:00,FULL,llm_style,eval,llm_style_eval_200,1,4096,1024,bf16,NVIDIA GeForce RTX 4060,c11,32,128,32,4,2,8,0.0,109.01,62.463998794555664,78.02880026400085,0.1342950845588699,7,-1,-1,1x4096x1024,0,
2026-03-03T03:42:17.072103+00:00,FULL,llm_style,eval,llm_style_eval_201,4,1536,8192,bf16,NVIDIA GeForce RTX 4060,c04,64,64,64,4,3,8,0.0,198.471,118.78400295972824,154.833920970559,0.8474482547462914,6,-1,-1,4x1536x8192,0,
2026-03-03T03:42:17.313264+00:00,FULL,llm_style,eval,llm_style_eval_202,1,6144,3072,bf16,NVIDIA GeForce RTX 4060,c11,32,128,32,4,2,8,0.0,241.116,177.85600572824478,304.8278489708897,0.21224324613293188,5,-1,-1,1x6144x3072,0,
2026-03-03T03:42:17.493481+00:00,FULL,llm_style,eval,llm_style_eval_203,16,2048,6144,bf16,NVIDIA GeForce RTX 4060,c00,32,32,32,2,2,8,0.0,180.178,78.84799689054489,162.41952478885634,5.106701500089527,7,-1,-1,16x2048x6144,0,
2026-03-03T03:42:17.512989+00:00,FULL,llm_style,eval,llm_style_eval_204,16,1536,1024,bf16,NVIDIA GeForce RTX 4060,c04,64,64,64,4,3,8,0.0,0.0,65.5359998345375,358.4000158309928,0.7680000019390135,7,-1,-1,16x1536x1024,0,
2026-03-03T03:42:17.579228+00:00,FULL,llm_style,eval,llm_style_eval_205,64,6144,2048,bf16,NVIDIA GeForce RTX 4060,c06,64,128,32,4,3,8,0.0,0.0,93.60000118613243,199.66592356562603,17.207400807582733,1,-1,-1,64x6144x2048,0,
2026-03-03T03:42:17.639771+00:00,FULL,llm_style,eval,llm_style_eval_206,4,2048,6144,bf16,NVIDIA GeForce RTX 4060,c00,32,32,32,2,2,8,0.0,0.0,94.11200135946274,133.4307177364826,1.069611681251092,7,-1,-1,4x2048x6144,0,
2026-03-03T03:42:17.751134+00:00,FULL,llm_style,eval,llm_style_eval_207,32,6144,1536,bf16,NVIDIA GeForce RTX 4060,c11,32,128,32,4,2,8,0.0,111.305,50.175998359918594,54.0185596421361,12.037224883251529,5,-1,-1,32x6144x1536,0,
2026-03-03T03:42:17.815105+00:00,FULL,llm_style,eval,llm_style_eval_208,4,2048,1024,bf16,NVIDIA GeForce RTX 4060,c00,32,32,32,2,2,8,0.0,63.928,40.95999896526337,123.59007760882375,0.4096000103473666,7,-1,-1,4x2048x1024,0,
2026-03-03T03:42:17.871088+00:00,FULL,llm_style,eval,llm_style_eval_209,1,1024,1536,bf16,NVIDIA GeForce RTX 4060,c00,32,32,32,2,2,8,0.0,55.949,37.63199970126152,96.43679797649378,0.08359183739828067,7,-1,-1,1x1024x1536,0,
2026-03-03T03:42:18.175775+00:00,FULL,llm_style,eval,llm_style_eval_210,8,6144,4096,bf16,NVIDIA GeForce RTX 4060,c11,32,128,32,4,2,8,0.0,304.639,228.07999700307846,239.52639773488045,1.7654033202857562,5,-1,-1,8x6144x4096,0,
2026-03-03T03:42:18.411334+00:00,FULL,llm_style,eval,llm_style_eval_211,4,2048,8192,bf16,NVIDIA GeForce RTX 4060,c10,64,128,64,8,3,8,0.0,235.516,162.81600296497345,193.28000202774996,0.8243521862459319,6,-1,-1,4x2048x8192,0,
2026-03-03T03:42:18.467459+00:00,FULL,llm_style,eval,llm_style_eval_212,32,1024,1024,bf16,NVIDIA GeForce RTX 4060,c04,64,64,64,4,3,8,0.0,56.079,37.80800104141235,56.926399543881374,1.7749910641002533,7,-1,-1,32x1024x1024,0,
2026-03-03T03:42:18.527587+00:00,FULL,llm_style,eval,llm_style_eval_213,16,3072,4096,bf16,NVIDIA GeForce RTX 4060,c04,64,64,64,4,3,8,0.0,0.0,80.89599758386612,172.0729586482048,4.97741787018033,7,-1,-1,16x3072x4096,0,
2026-03-03T03:42:18.575371+00:00,FULL,llm_style,eval,llm_style_eval_214,64,1024,8192,bf16,NVIDIA GeForce RTX 4060,c04,64,64,64,4,3,8,0.0,0.0,86.7679975926876,157.7398426830768,12.374860015099506,2,-1,-1,64x1024x8192,0,
2026-03-03T03:42:18.600210+00:00,FULL,llm_style,eval,llm_style_eval_215,4,4096,1536,bf16,NVIDIA GeForce RTX 4060,c11,32,128,32,4,2,8,0.0,0.0,48.128001391887665,126.48031808435907,1.0457872037978244,7,-1,-1,4x4096x1536,0,
2026-03-03T03:42:18.687413+00:00,FULL,llm_style,eval,llm_style_eval_216,16,1536,3072,bf16,NVIDIA GeForce RTX 4060,c04,64,64,64,4,3,8,0.0,87.151,53.247999399900436,66.09920002520084,2.835692339650273,7,-1,-1,16x1536x3072,0,
2026-03-03T03:42:18.749482+00:00,FULL,llm_style,eval,llm_style_eval_217,8,6144,2048,bf16,NVIDIA GeForce RTX 4060,c02,32,64,32,2,2,8,0.0,0.0,75.71200281381607,114.6057567745446,2.6591106365932977,5,-1,-1,8x6144x2048,0,
2026-03-03T03:42:18.897261+00:00,FULL,llm_style,eval,llm_style_eval_218,8,3072,4096,bf16,NVIDIA GeForce RTX 4060,c04,64,64,64,4,3,8,0.0,147.723,82.94399827718735,93.04288066923618,2.42725930967536,7,-1,-1,8x3072x4096,0,
2026-03-03T03:42:19.217750+00:00,FULL,llm_style,eval,llm_style_eval_219,64,8192,3072,bf16,NVIDIA GeForce RTX 4060,c10,64,128,64,8,3,8,0.0,320.444,235.48800498247147,281.70239865779877,13.678936522646966,1,-1,-1,64x8192x3072,0,
2026-03-03T03:42:19.255248+00:00,FULL,llm_style,eval,llm_style_eval_220,2,4096,2048,bf16,NVIDIA GeForce RTX 4060,c11,32,128,32,4,2,8,0.0,0.0,56.32000043988228,137.31839433312413,0.5957818135285181,7,-1,-1,2x4096x2048,0,
2026-03-03T03:42:19.404020+00:00,FULL,llm_style,eval,llm_style_eval_221,4,1024,8192,bf16,NVIDIA GeForce RTX 4060,c04,64,64,64,4,3,8,0.0,148.719,85.83999797701836,103.0345609039068,0.7817901395799989,6,-1,-1,4x1024x8192,0,
2026-03-03T03:42:19.480104+00:00,FULL,llm_style,eval,llm_style_eval_222,64,6144,2048,bf16,NVIDIA GeForce RTX 4060,c06,64,128,32,4,3,8,0.0,0.0,123.71199950575829,178.83071690797803,13.019050233078099,1,-1,-1,64x6144x2048,0,
2026-03-03T03:42:19.553620+00:00,FULL,llm_style,eval,llm_style_eval_223,4,2048,2048,bf16,NVIDIA GeForce RTX 4060,c11,32,128,32,4,2,8,0.0,73.464,52.191998809576035,112.14752215892055,0.6429037547004912,7,-1,-1,4x2048x2048,0,
2026-03-03T03:42:19.574121+00:00,FULL,llm_style,eval,llm_style_eval_224,16,3072,1536,bf16,NVIDIA GeForce RTX 4060,c11,32,128,32,4,2,8,0.0,0.0,50.176000222563744,134.38975699245924,3.009306109100717,7,-1,-1,16x3072x1536,0,
2026-03-03T03:42:19.592845+00:00,FULL,llm_style,eval,llm_style_eval_225,1,2048,2048,bf16,NVIDIA GeForce RTX 4060,c00,32,32,32,2,2,8,0.0,0.0,68.54400038719177,226.79008096456525,0.12238281910326768,7,-1,-1,1x2048x2048,0,
2026-03-03T03:42:19.602712+00:00,FULL,llm_style,eval,llm_style_eval_226,8,1536,1024,bf16,NVIDIA GeForce RTX 4060,c04,64,64,64,4,3,8,0.0,0.0,42.287999764084816,111.0531197488308,0.5951055651814804,7,-1,-1,8x1536x1024,0,
2026-03-03T03:42:19.791597+00:00,FULL,llm_style,eval,llm_style_eval_227,64,6144,6144,bf16,NVIDIA GeForce RTX 4060,c06,64,128,32,4,3,8,0.0,0.0,332.8000009059906,451.24224692583084,14.518744575859836,1,-1,-1,64x6144x6144,0,
2026-03-03T03:42:19.855989+00:00,FULL,llm_style,eval,llm_style_eval_228,64,6144,2048,bf16,NVIDIA GeForce RTX 4060,c06,64,128,32,4,3,8,0.0,0.0,97.28000313043594,183.82240191102028,16.556462625113635,1,-1,-1,64x6144x2048,0,
2026-03-03T03:42:20.034322+00:00,FULL,llm_style,eval,llm_style_eval_229,16,1536,8192,bf16,NVIDIA GeForce RTX 4060,c04,64,64,64,4,3,8,0.0,178.28,98.00000116229057,146.90303742885578,4.108705910453978,6,-1,-1,16x1536x8192,0,
2026-03-03T03:42:20.061842+00:00,FULL,llm_style,eval,llm_style_eval_230,64,2048,1536,bf16,NVIDIA GeForce RTX 4060,c11,32,128,32,4,2,8,0.0,0.0,46.08000069856644,195.48447966575617,8.738133200864441,3,-1,-1,64x2048x1536,0,
2026-03-03T03:42:20.112159+00:00,FULL,llm_style,eval,llm_style_eval_231,4,1024,8192,bf16,NVIDIA GeForce RTX 4060,c04,64,64,64,4,3,8,0.0,0.0,83.47199857234955,266.7584095895288,0.8039685780595421,6,-1,-1,4x1024x8192,0,
2026-03-03T03:42:20.136577+00:00,FULL,llm_style,eval,llm_style_eval_232,16,3072,1536,bf16,NVIDIA GeForce RTX 4060,c11,32,128,32,4,2,8,0.0,0.0,56.32000043988228,117.90335886180398,2.6810181608783314,7,-1,-1,16x3072x1536,0,
2026-03-03T03:42:20.186732+00:00,FULL,llm_style,eval,llm_style_eval_233,64,3072,3072,bf16,NVIDIA GeForce RTX 4060,c03,64,64,32,4,2,8,0.0,0.0,65.5359998345375,129.44031804800034,18.432000046536324,3,-1,-1,64x3072x3072,0,
2026-03-03T03:42:20.358706+00:00,FULL,llm_style,eval,llm_style_eval_234,32,8192,4096,bf16,NVIDIA GeForce RTX 4060,c00,32,32,32,2,2,8,0.0,0.0,323.183998465538,423.3567973971367,6.644770960802974,5,-1,-1,32x8192x4096,0,
2026-03-03T03:42:20.369834+00:00,FULL,llm_style,eval,llm_style_eval_235,4,2048,1024,bf16,NVIDIA GeForce RTX 4060,c00,32,32,32,2,2,8,0.0,0.0,37.88800165057182,44.50527980923653,0.44281079151997954,7,-1,-1,4x2048x1024,0,
2026-03-03T03:42:20.495105+00:00,FULL,llm_style,eval,llm_style_eval_236,4,8192,3072,bf16,NVIDIA GeForce RTX 4060,c10,64,128,64,8,3,8,0.0,0.0,230.44800013303757,305.7356750965116,0.8736313263025681,5,-1,-1,4x8192x3072,0,
2026-03-03T03:42:20.516735+00:00,FULL,llm_style,eval,llm_style_eval_237,64,1024,4096,bf16,NVIDIA GeForce RTX 4060,c04,64,64,64,4,3,8,0.0,0.0,65.40799885988235,91.21887989342207,8.20803145422764,3,-1,-1,64x1024x4096,0,
2026-03-03T03:42:20.684122+00:00,FULL,llm_style,eval,llm_style_eval_238,32,2048,6144,bf16,NVIDIA GeForce RTX 4060,c04,64,64,64,4,3,8,0.0,167.339,107.51999914646149,128.43168117105958,7.489828630885948,7,-1,-1,32x2048x6144,0,
2026-03-03T03:42:20.691848+00:00,FULL,llm_style,eval,llm_style_eval_239,32,2048,6144,bf16,NVIDIA GeForce RTX 4060,c04,64,64,64,4,3,8,0.0,0.0,106.49599879980087,207.66175523400278,7.561846239067394,7,-1,-1,32x2048x6144,0,
2026-03-03T03:42:20.835262+00:00,FULL,llm_style,eval,llm_style_eval_240,8,8192,1536,bf16,NVIDIA GeForce RTX 4060,c00,32,32,32,2,2,8,0.0,143.378,65.5359998345375,221.60832360386848,3.072000007756054,5,-1,-1,8x8192x1536,0,
2026-03-03T03:42:20.853308+00:00,FULL,llm_style,eval,llm_style_eval_241,16,1536,1536,bf16,NVIDIA GeForce RTX 4060,c00,32,32,32,2,2,8,0.0,0.0,48.49599860608578,258.75679567456234,1.556777345966968,7,-1,-1,16x1536x1536,0,
2026-03-03T03:42:20.881669+00:00,FULL,llm_style,eval,llm_style_eval_242,1,2048,3072,bf16,NVIDIA GeForce RTX 4060,c00,32,32,32,2,2,8,0.0,0.0,64.41599875688553,184.6031998097896,0.19533830481290168,7,-1,-1,1x2048x3072,0,
2026-03-03T03:42:20.919678+00:00,FULL,llm_style,eval,llm_style_eval_243,8,1536,6144,bf16,NVIDIA GeForce RTX 4060,c04,64,64,64,4,3,8,0.0,0.0,80.81599697470665,174.72064390778542,1.8683794007671226,7,-1,-1,8x1536x6144,0,
2026-03-03T03:42:20.963940+00:00,FULL,llm_style,eval,llm_style_eval_244,32,8192,1024,bf16,NVIDIA GeForce RTX 4060,c11,32,128,32,4,2,8,0.0,0.0,57.05600045621395,127.70303837954995,9.409543390830676,5,-1,-1,32x8192x1024,0,
2026-03-03T03:42:21.092347+00:00,FULL,llm_style,eval,llm_style_eval_245,4,6144,4096,bf16,NVIDIA GeForce RTX 4060,c11,32,128,32,4,2,8,0.0,0.0,231.10399395227432,372.1625590324401,0.8711515043810809,5,-1,-1,4x6144x4096,0,
2026-03-03T03:42:21.155736+00:00,FULL,llm_style,eval,llm_style_eval_246,32,2048,6144,bf16,NVIDIA GeForce RTX 4060,c04,64,64,64,4,3,8,0.0,0.0,86.01599931716919,214.20448154211041,9.362285788607435,7,-1,-1,32x2048x6144,0,
2026-03-03T03:42:21.219299+00:00,FULL,llm_style,eval,llm_style_eval_247,64,6144,2048,bf16,NVIDIA GeForce RTX 4060,c06,64,128,32,4,3,8,0.0,0.0,102.1759994328022,203.52032110095018,15.763121916504934,1,-1,-1,64x6144x2048,0,
2026-03-03T03:42:21.236717+00:00,FULL,llm_style,eval,llm_style_eval_248,64,1024,1024,bf16,NVIDIA GeForce RTX 4060,c04,64,64,64,4,3,8,0.0,0.0,45.05600035190582,92.17632159590713,2.9789090676425904,3,-1,-1,64x1024x1024,0,
2026-03-03T03:42:21.347245+00:00,FULL,llm_style,eval,llm_style_eval_249,2,8192,1024,bf16,NVIDIA GeForce RTX 4060,c00,32,32,32,2,2,8,0.0,110.485,50.143999978899956,134.11967918276784,0.6691614552911482,5,-1,-1,2x8192x1024,0,
2026-03-03T03:42:21.403342+00:00,FULL,llm_style,eval,llm_style_eval_250,64,3072,3072,bf16,NVIDIA GeForce RTX 4060,c03,64,64,32,4,2,8,0.0,0.0,90.11200070381165,163.140796124935,13.405090804391657,3,-1,-1,64x3072x3072,0,
2026-03-03T03:42:21.455632+00:00,FULL,llm_style,eval,llm_style_eval_251,64,1024,8192,bf16,NVIDIA GeForce RTX 4060,c04,64,64,64,4,3,8,0.0,0.0,86.49599924683571,172.88192227482767,12.413774432917263,2,-1,-1,64x1024x8192,0,
2026-03-03T03:42:21.520649+00:00,FULL,llm_style,eval,llm_style_eval_252,64,4096,3072,bf16,NVIDIA GeForce RTX 4060,c04,64,64,64,4,3,8,0.0,0.0,99.71199929714203,242.7084794640537,16.152647097170018,3,-1,-1,64x4096x3072,0,
2026-03-03T03:42:21.644149+00:00,FULL,llm_style,eval,llm_style_eval_253,8,6144,4096,bf16,NVIDIA GeForce RTX 4060,c11,32,128,32,4,2,8,0.0,0.0,230.3999960422516,327.47966885566706,1.7476266966869218,5,-1,-1,8x6144x4096,0,
2026-03-03T03:42:21.732330+00:00,FULL,llm_style,eval,llm_style_eval_254,4,1536,3072,bf16,NVIDIA GeForce RTX 4060,c04,64,64,64,4,3,8,0.0,88.128,52.22399905323982,59.41248148679733,0.722823542515712,7,-1,-1,4x1536x3072,0,
2026-03-03T03:42:21.752185+00:00,FULL,llm_style,eval,llm_style_eval_255,1,3072,1536,bf16,NVIDIA GeForce RTX 4060,c00,32,32,32,2,2,8,0.0,0.0,60.127997770905495,191.51615843176825,0.15695157580261931,7,-1,-1,1x3072x1536,0,
2026-03-03T03:42:21.818029+00:00,BUCKET,llm_style,tune,llm_style_tune_000,32,1024,2048,bf16,NVIDIA GeForce RTX 4060,c04,64,64,64,4,3,8,0.0,63.663,41.98399931192398,60.94687927514312,3.1968781011741414,7,-1,-1,llm8_g7,0,
2026-03-03T03:42:21.856506+00:00,BUCKET,llm_style,tune,llm_style_tune_001,4,4096,1536,bf16,NVIDIA GeForce RTX 4060,c04,64,64,64,4,3,8,0.0,0.0,69.63200122117996,302.37696126103367,0.7228235167351563,7,-1,-1,llm8_g7,0,
2026-03-03T03:42:21.961215+00:00,BUCKET,llm_style,tune,llm_style_tune_002,8,8192,1024,bf16,NVIDIA GeForce RTX 4060,c11,32,128,32,4,2,8,0.0,104.654,51.0879997164011,94.92383845150465,2.6271869860841557,5,-1,-1,llm8_g5,0,
2026-03-03T03:42:22.262893+00:00,BUCKET,llm_style,tune,llm_style_tune_003,2,3072,8192,bf16,NVIDIA GeForce RTX 4060,c04,64,64,64,4,3,8,0.0,301.634,227.32800245285034,233.49247708916664,0.4428108060329188,6,-1,-1,llm8_g6,0,
2026-03-03T03:42:22.281534+00:00,BUCKET,llm_style,tune,llm_style_tune_004,16,1536,1024,bf16,NVIDIA GeForce RTX 4060,c04,64,64,64,4,3,8,0.0,0.0,70.65600156784058,202.768004387617,0.7123478102801205,7,-1,-1,llm8_g7,0,
2026-03-03T03:42:22.319750+00:00,BUCKET,llm_style,tune,llm_style_tune_005,16,1024,6144,bf16,NVIDIA GeForce RTX 4060,c04,64,64,64,4,3,8,0.0,0.0,91.71200171113014,254.56927537918068,2.19520442519757,7,-1,-1,llm8_g7,0,
2026-03-03T03:42:22.336728+00:00,BUCKET,llm_style,tune,llm_style_tune_006,2,2048,1024,bf16,NVIDIA GeForce RTX 4060,c04,64,64,64,4,3,8,0.0,0.0,67.52000004053116,121.32287979125977,0.12423886248466315,7,-1,-1,llm8_g7,0,
2026-03-03T03:42:22.352562+00:00,BUCKET,llm_style,tune,llm_style_tune_007,16,1024,1536,bf16,NVIDIA GeForce RTX 4060,c04,64,64,64,4,3,8,0.0,0.0,64.33599814772606,346.56191632151535,0.7823248173507815,7,-1,-1,llm8_g7,0,
2026-03-03T03:42:22.372770+00:00,BUCKET,llm_style,tune,llm_style_tune_008,8,1536,2048,bf16,NVIDIA GeForce RTX 4060,c04,64,64,64,4,3,8,0.0,0.0,48.96000027656555,107.74719975888718,1.0280156804674483,7,-1,-1,llm8_g7,0,
2026-03-03T03:42:22.612129+00:00,BUCKET,llm_style,tune,llm_style_tune_009,64,2048,8192,bf16,NVIDIA GeForce RTX 4060,c10,64,128,64,8,3,8,0.0,239.314,167.93599724769592,206.10911726951588,12.787512404696566,2,-1,-1,llm8_g2,0,
2026-03-03T03:42:22.694010+00:00,BUCKET,llm_style,tune,llm_style_tune_010,64,1536,2048,bf16,NVIDIA GeForce RTX 4060,c00,32,32,32,2,2,8,0.0,81.834,48.86399954557419,105.49247846007347,8.240282984295131,3,-1,-1,llm8_g3,0,
2026-03-03T03:42:22.819741+00:00,BUCKET,llm_style,tune,llm_style_tune_011,32,3072,8192,bf16,NVIDIA GeForce RTX 4060,c04,64,64,64,4,3,8,0.0,0.0,235.23199558258057,256.1023971438408,6.846911841270241,6,-1,-1,llm8_g6,0,
2026-03-03T03:42:22.844182+00:00,BUCKET,llm_style,tune,llm_style_tune_012,32,6144,1024,bf16,NVIDIA GeForce RTX 4060,c11,32,128,32,4,2,8,0.0,0.0,42.128000408411026,117.40160401910519,9.557851787325959,5,-1,-1,llm8_g5,0,
2026-03-03T03:42:22.868774+00:00,BUCKET,llm_style,tune,llm_style_tune_013,64,1536,4096,bf16,NVIDIA GeForce RTX 4060,c00,32,32,32,2,2,8,0.0,0.0,68.60800087451935,100.73312014341346,11.73779089515909,3,-1,-1,llm8_g3,0,
2026-03-03T03:42:22.964452+00:00,BUCKET,llm_style,tune,llm_style_tune_014,4,6144,3072,bf16,NVIDIA GeForce RTX 4060,c11,32,128,32,4,2,8,0.0,0.0,201.7280012369156,276.826232075691,0.748507609623648,5,-1,-1,llm8_g5,0,
2026-03-03T03:42:22.989968+00:00,BUCKET,llm_style,tune,llm_style_tune_015,1,6144,1024,bf16,NVIDIA GeForce RTX 4060,c11,32,128,32,4,2,8,0.0,0.0,44.39999908208847,148.97152192890636,0.2833989247778185,5,-1,-1,llm8_g5,0,
2026-03-03T03:42:23.056630+00:00,BUCKET,llm_style,tune,llm_style_tune_016,1,8192,1536,bf16,NVIDIA GeForce RTX 4060,c11,32,128,32,4,2,8,0.0,0.0,73.48800078034401,538.1750324368472,0.3424480695184616,5,-1,-1,llm8_g5,0,
2026-03-03T03:42:23.230963+00:00,BUCKET,llm_style,tune,llm_style_tune_017,64,4096,8192,bf16,NVIDIA GeForce RTX 4060,c10,64,128,64,8,3,8,0.0,0.0,329.72800731658936,414.4537660479544,13.02578853083649,2,-1,-1,llm8_g2,0,
2026-03-03T03:42:23.381454+00:00,BUCKET,llm_style,tune,llm_style_tune_018,64,8192,1536,bf16,NVIDIA GeForce RTX 4060,c06,64,128,32,4,3,8,0.0,150.438,99.04000163078308,112.14816309511659,16.26224464337446,1,-1,-1,llm8_g1,0,
2026-03-03T03:42:23.394633+00:00,BUCKET,llm_style,tune,llm_style_tune_019,2,1536,1024,bf16,NVIDIA GeForce RTX 4060,c04,64,64,64,4,3,8,0.0,0.0,64.51199948787689,215.64415469765663,0.0975238102979941,7,-1,-1,llm8_g7,0,
2026-03-03T03:42:23.554644+00:00,BUCKET,llm_style,tune,llm_style_tune_020,4,8192,4096,bf16,NVIDIA GeForce RTX 4060,c11,32,128,32,4,2,8,0.0,0.0,296.7839986085892,360.2015912532806,0.9044808926980716,5,-1,-1,llm8_g5,0,
2026-03-03T03:42:23.591602+00:00,BUCKET,llm_style,tune,llm_style_tune_021,1,6144,1536,bf16,NVIDIA GeForce RTX 4060,c11,32,128,32,4,2,8,0.0,0.0,47.520000487565994,158.13535660505283,0.397187874712641,5,-1,-1,llm8_g5,0,
2026-03-03T03:42:23.673798+00:00,BUCKET,llm_style,tune,llm_style_tune_022,8,4096,4096,bf16,NVIDIA GeForce RTX 4060,c04,64,64,64,4,3,8,0.0,0.0,165.79199582338333,195.03391861915588,1.6191098651466975,7,-1,-1,llm8_g7,0,
2026-03-03T03:42:23.739088+00:00,BUCKET,llm_style,tune,llm_style_tune_023,16,3072,4096,bf16,NVIDIA GeForce RTX 4060,c04,64,64,64,4,3,8,0.0,0.0,60.416001826524734,184.64767530560488,6.664677764612043,7,-1,-1,llm8_g7,0,
2026-03-03T03:42:23.757196+00:00,BUCKET,llm_style,tune,llm_style_tune_024,64,2048,1536,bf16,NVIDIA GeForce RTX 4060,c00,32,32,32,2,2,8,0.0,0.0,52.22399905323982,148.1625542044639,7.710117786834262,3,-1,-1,llm8_g3,0,
2026-03-03T03:42:23.784645+00:00,BUCKET,llm_style,tune,llm_style_tune_025,4,4096,1536,bf16,NVIDIA GeForce RTX 4060,c04,64,64,64,4,3,8,0.0,0.0,58.36800113320351,187.71807894110668,0.8623157727319891,7,-1,-1,llm8_g7,0,
2026-03-03T03:42:23.807909+00:00,BUCKET,llm_style,tune,llm_style_tune_026,4,3072,2048,bf16,NVIDIA GeForce RTX 4060,c04,64,64,64,4,3,8,0.0,0.0,53.999999538064,72.80639849603173,0.9320675635288066,7,-1,-1,llm8_g7,0,
2026-03-03T03:42:24.361174+00:00,BUCKET,llm_style,tune,llm_style_tune_027,64,6144,8192,bf16,NVIDIA GeForce RTX 4060,c02,32,64,32,2,2,8,0.0,553.215,434.1759979724884,524.6710485219954,14.838339691933468,0,-1,-1,llm8_g0,0,
2026-03-03T03:42:24.377890+00:00,BUCKET,llm_style,tune,llm_style_tune_028,64,1536,1024,bf16,NVIDIA GeForce RTX 4060,c00,32,32,32,2,2,8,0.0,0.0,48.128001391887665,122.08128027617926,4.183148815191298,3,-1,-1,llm8_g3,0,
2026-03-03T03:42:24.504809+00:00,BUCKET,llm_style,tune,llm_style_tune_029,32,8192,3072,bf16,NVIDIA GeForce RTX 4060,c11,32,128,32,4,2,8,0.0,0.0,230.31999915838242,298.1833475828169,6.992934794570063,5,-1,-1,llm8_g5,0,
2026-03-03T03:42:24.533354+00:00,BUCKET,llm_style,tune,llm_style_tune_030,64,1536,4096,bf16,NVIDIA GeForce RTX 4060,c00,32,32,32,2,2,8,0.0,0.0,103.26399654150009,222.05056279897678,7.798520248791268,3,-1,-1,llm8_g3,0,
2026-03-03T03:42:24.698533+00:00,BUCKET,llm_style,tune,llm_style_tune_031,2,4096,8192,bf16,NVIDIA GeForce RTX 4060,c04,64,64,64,4,3,8,0.0,0.0,296.4159995317459,313.8396739959717,0.45280190074768684,6,-1,-1,llm8_g6,0,
2026-03-03T03:42:24.928919+00:00,BUCKET,llm_style,tune,llm_style_tune_032,1,8192,6144,bf16,NVIDIA GeForce RTX 4060,c11,32,128,32,4,2,8,0.0,0.0,426.831990480423,557.3715221881866,0.23583821795244986,5,-1,-1,llm8_g5,0,
2026-03-03T03:42:25.472102+00:00,BUCKET,llm_style,tune,llm_style_tune_033,32,6144,8192,bf16,NVIDIA GeForce RTX 4060,c06,64,128,32,4,3,8,0.0,543.127,430.7679980993271,472.0300894975662,7.477866244040825,4,-1,-1,llm8_g4,0,
2026-03-03T03:42:25.506827+00:00,BUCKET,llm_style,tune,llm_style_tune_034,32,3072,2048,bf16,NVIDIA GeForce RTX 4060,c04,64,64,64,4,3,8,0.0,0.0,55.16799911856651,136.05824008584023,7.298672970441102,7,-1,-1,llm8_g7,0,
2026-03-03T03:42:25.547189+00:00,BUCKET,llm_style,tune,llm_style_tune_035,4,1536,6144,bf16,NVIDIA GeForce RTX 4060,c04,64,64,64,4,3,8,0.0,0.0,71.71200215816498,159.42112132906908,1.0527871169108616,7,-1,-1,llm8_g7,0,
2026-03-03T03:42:25.578989+00:00,BUCKET,llm_style,tune,llm_style_tune_036,1,4096,1536,bf16,NVIDIA GeForce RTX 4060,c04,64,64,64,4,3,8,0.0,0.0,56.32000043988228,245.99615976214398,0.22341818007319428,7,-1,-1,llm8_g7,0,
2026-03-03T03:42:25.605550+00:00,BUCKET,llm_style,tune,llm_style_tune_037,4,1536,4096,bf16,NVIDIA GeForce RTX 4060,c04,64,64,64,4,3,8,0.0,0.0,63.9679990708828,172.57279947400085,0.7868254241347711,7,-1,-1,llm8_g7,0,
2026-03-03T03:42:25.631436+00:00,BUCKET,llm_style,tune,llm_style_tune_038,16,1536,4096,bf16,NVIDIA GeForce RTX 4060,c04,64,64,64,4,3,8,0.0,0.0,65.47199934720993,574.5043067634092,3.0750029632107068,7,-1,-1,llm8_g7,0,
2026-03-03T03:42:25.659061+00:00,BUCKET,llm_style,tune,llm_style_tune_039,32,3072,2048,bf16,NVIDIA GeForce RTX 4060,c04,64,64,64,4,3,8,0.0,0.0,56.32000043988228,203.2111960649489,7.149381762342217,7,-1,-1,llm8_g7,0,
2026-03-03T03:42:25.694674+00:00,BUCKET,llm_style,tune,llm_style_tune_040,2,2048,4096,bf16,NVIDIA GeForce RTX 4060,c04,64,64,64,4,3,8,0.0,0.0,84.99199897050858,160.47104582190508,0.3947951855049682,7,-1,-1,llm8_g7,0,
2026-03-03T03:42:25.872808+00:00,BUCKET,llm_style,tune,llm_style_tune_041,64,6144,6144,bf16,NVIDIA GeForce RTX 4060,c06,64,128,32,4,3,8,0.0,0.0,335.87199449539185,420.60799688100815,14.385951455283637,1,-1,-1,llm8_g1,0,
2026-03-03T03:42:26.006221+00:00,BUCKET,llm_style,tune,llm_style_tune_042,2,3072,8192,bf16,NVIDIA GeForce RTX 4060,c04,64,64,64,4,3,8,0.0,0.0,233.35999995470047,251.38047888875008,0.4313648269606643,6,-1,-1,llm8_g6,0,
2026-03-03T03:42:26.247741+00:00,BUCKET,llm_style,tune,llm_style_tune_043,4,8192,6144,bf16,NVIDIA GeForce RTX 4060,c11,32,128,32,4,2,8,0.0,0.0,428.8640022277832,491.8495914340018,0.9388831468912566,5,-1,-1,llm8_g5,0,
2026-03-03T03:42:26.280180+00:00,BUCKET,llm_style,tune,llm_style_tune_044,1,1024,6144,bf16,NVIDIA GeForce RTX 4060,c04,64,64,64,4,3,8,0.0,0.0,84.71999689936638,89.61024053394794,0.1485235181836286,7,-1,-1,llm8_g7,0,
2026-03-03T03:42:26.342767+00:00,BUCKET,llm_style,tune,llm_style_tune_045,32,4096,3072,bf16,NVIDIA GeForce RTX 4060,c04,64,64,64,4,3,8,0.0,0.0,86.46399900317192,121.70687928795806,9.313776569256962,7,-1,-1,llm8_g7,0,
2026-03-03T03:42:26.353986+00:00,BUCKET,llm_style,tune,llm_style_tune_046,16,2048,1024,bf16,NVIDIA GeForce RTX 4060,c04,64,64,64,4,3,8,0.0,0.0,42.86399856209755,119.96287979185578,1.5656230461742537,7,-1,-1,llm8_g7,0,
2026-03-03T03:42:26.363354+00:00,BUCKET,llm_style,tune,llm_style_tune_047,4,1024,1536,bf16,NVIDIA GeForce RTX 4060,c04,64,64,64,4,3,8,0.0,0.0,41.87199845910072,57.8624004870653,0.30050899080660315,7,-1,-1,llm8_g7,0,
2026-03-03T03:42:26.377608+00:00,BUCKET,llm_style,tune,llm_style_tune_048,64,1536,2048,bf16,NVIDIA GeForce RTX 4060,c00,32,32,32,2,2,8,0.0,0.0,48.128001391887665,109.99679856002328,8.366297630382595,3,-1,-1,llm8_g3,0,
2026-03-03T03:42:26.393593+00:00,BUCKET,llm_style,tune,llm_style_tune_049,16,2048,1536,bf16,NVIDIA GeForce RTX 4060,c04,64,64,64,4,3,8,0.0,0.0,53.247999399900436,171.59168183803536,1.8904615597668486,7,-1,-1,llm8_g7,0,
2026-03-03T03:42:26.421043+00:00,BUCKET,llm_style,tune,llm_style_tune_050,64,1024,6144,bf16,NVIDIA GeForce RTX 4060,c00,32,32,32,2,2,8,0.0,0.0,92.16000139713287,189.83520105481142,8.738133200864441,3,-1,-1,llm8_g3,0,
2026-03-03T03:42:26.583268+00:00,BUCKET,llm_style,tune,llm_style_tune_051,4,4096,8192,bf16,NVIDIA GeForce RTX 4060,c04,64,64,64,4,3,8,0.0,0.0,298.68800938129425,416.8499192595482,0.8987152063989453,6,-1,-1,llm8_g6,0,
2026-03-03T03:42:26.641422+00:00,BUCKET,llm_style,tune,llm_style_tune_052,1,4096,3072,bf16,NVIDIA GeForce RTX 4060,c04,64,64,64,4,3,8,0.0,0.0,84.99199897050858,101.88736066222191,0.29609638912872616,7,-1,-1,llm8_g7,0,
2026-03-03T03:42:26.658229+00:00,BUCKET,llm_style,tune,llm_style_tune_053,64,1536,2048,bf16,NVIDIA GeForce RTX 4060,c00,32,32,32,2,2,8,0.0,0.0,66.56000018119812,187.3347233235835,6.049476906608265,3,-1,-1,llm8_g3,0,
2026-03-03T03:42:26.693057+00:00,BUCKET,llm_style,tune,llm_style_tune_054,2,4096,2048,bf16,NVIDIA GeForce RTX 4060,c04,64,64,64,4,3,8,0.0,0.0,67.58400052785873,99.70528297126283,0.49648484460709846,7,-1,-1,llm8_g7,0,
2026-03-03T03:42:26.755797+00:00,BUCKET,llm_style,tune,llm_style_tune_055,4,8192,1536,bf16,NVIDIA GeForce RTX 4060,c11,32,128,32,4,2,8,0.0,0.0,75.60000196099281,185.39519920945156,1.3315250448265734,5,-1,-1,llm8_g5,0,
2026-03-03T03:42:26.784959+00:00,BUCKET,llm_style,tune,llm_style_tune_056,1,1536,4096,bf16,NVIDIA GeForce RTX 4060,c04,64,64,64,4,3,8,0.0,0.0,59.39200147986412,136.322878152132,0.21186206368657284,7,-1,-1,llm8_g7,0,
2026-03-03T03:42:27.018981+00:00,BUCKET,llm_style,tune,llm_style_tune_057,8,8192,6144,bf16,NVIDIA GeForce RTX 4060,c11,32,128,32,4,2,8,0.0,0.0,425.9839951992035,460.25375813245773,1.8904615597668486,5,-1,-1,llm8_g5,0,
2026-03-03T03:42:27.061195+00:00,BUCKET,llm_style,tune,llm_style_tune_058,64,6144,1536,bf16,NVIDIA GeForce RTX 4060,c06,64,128,32,4,3,8,0.0,0.0,89.08800035715103,294.00288939476,13.5591723594348,1,-1,-1,llm8_g1,0,
2026-03-03T03:42:27.084951+00:00,BUCKET,llm_style,tune,llm_style_tune_059,1,3072,1536,bf16,NVIDIA GeForce RTX 4060,c04,64,64,64,4,3,8,0.0,0.0,48.1759998947382,111.33600100874898,0.19588973805670265,7,-1,-1,llm8_g7,0,
2026-03-03T03:42:27.092659+00:00,BUCKET,llm_style,tune,llm_style_tune_060,64,1024,1024,bf16,NVIDIA GeForce RTX 4060,c00,32,32,32,2,2,8,0.0,0.0,37.88800165057182,93.55264171957963,3.5424863321598363,3,-1,-1,llm8_g3,0,
2026-03-03T03:42:27.259186+00:00,BUCKET,llm_style,tune,llm_style_tune_061,16,8192,4096,bf16,NVIDIA GeForce RTX 4060,c11,32,128,32,4,2,8,0.0,0.0,320.46400010585785,430.2233564853668,3.3505848508578633,5,-1,-1,llm8_g5,0,
2026-03-03T03:42:27.383748+00:00,BUCKET,llm_style,tune,llm_style_tune_062,16,4096,6144,bf16,NVIDIA GeForce RTX 4060,c04,64,64,64,4,3,8,0.0,0.0,268.2879865169525,339.7939267754554,3.0016490058123213,7,-1,-1,llm8_g7,0,
2026-03-03T03:42:27.404595+00:00,BUCKET,llm_style,tune,llm_style_tune_063,8,4096,1024,bf16,NVIDIA GeForce RTX 4060,c04,64,64,64,4,3,8,0.0,0.0,83.96799862384796,136.2739139795303,0.7992195252935353,7,-1,-1,llm8_g7,0,
2026-03-03T03:42:27.416411+00:00,BUCKET,llm_style,eval,llm_style_eval_000,32,1536,1024,bf16,NVIDIA GeForce RTX 4060,c04,64,64,64,4,3,8,0.0,0.0,65.5359998345375,129.96415838599205,1.536000003878027,7,-1,-1,llm8_g7,0,
2026-03-03T03:42:27.510313+00:00,BUCKET,llm_style,eval,llm_style_eval_001,32,2048,8192,bf16,NVIDIA GeForce RTX 4060,c04,64,64,64,4,3,8,0.0,0.0,183.1359937787056,238.63295882940292,5.863084595469898,6,-1,-1,llm8_g6,0,
2026-03-03T03:42:27.564352+00:00,BUCKET,llm_style,eval,llm_style_eval_002,16,2048,4096,bf16,NVIDIA GeForce RTX 4060,c04,64,64,64,4,3,8,0.0,0.0,143.36000382900238,164.92543622851372,1.8724570928456843,7,-1,-1,llm8_g7,0,
2026-03-03T03:42:27.581380+00:00,BUCKET,llm_style,eval,llm_style_eval_003,16,2048,1536,bf16,NVIDIA GeForce RTX 4060,c04,64,64,64,4,3,8,0.0,0.0,65.40799885988235,164.97663974761952,1.5390058976676824,7,-1,-1,llm8_g7,0,
2026-03-03T03:42:27.670500+00:00,BUCKET,llm_style,eval,llm_style_eval_004,64,8192,2048,bf16,NVIDIA GeForce RTX 4060,c06,64,128,32,4,3,8,0.0,0.0,200.19199699163437,383.88159453868826,10.72712036580433,1,-1,-1,llm8_g1,0,
2026-03-03T03:42:27.795468+00:00,BUCKET,llm_style,eval,llm_style_eval_005,64,3072,8192,bf16,NVIDIA GeForce RTX 4060,c10,64,128,64,8,3,8,0.0,0.0,252.27200239896774,389.9391975998877,12.768858380509611,2,-1,-1,llm8_g2,0,
2026-03-03T03:42:27.816047+00:00,BUCKET,llm_style,eval,llm_style_eval_006,32,2048,2048,bf16,NVIDIA GeForce RTX 4060,c04,64,64,64,4,3,8,0.0,0.0,85.50399914383888,149.33247715234737,3.1394491332320626,7,-1,-1,llm8_g7,0,
2026-03-03T03:42:27.896933+00:00,BUCKET,llm_style,eval,llm_style_eval_007,8,8192,2048,bf16,NVIDIA GeForce RTX 4060,c11,32,128,32,4,2,8,0.0,0.0,164.86400365829468,297.44417399168003,1.6282235663545612,5,-1,-1,llm8_g5,0,
2026-03-03T03:42:27.978265+00:00,BUCKET,llm_style,eval,llm_style_eval_008,64,1536,8192,bf16,NVIDIA GeForce RTX 4060,c10,64,128,64,8,3,8,0.0,0.0,241.60000681877136,325.3964671492576,6.666443255558971,2,-1,-1,llm8_g2,0,
2026-03-03T03:42:28.108666+00:00,BUCKET,llm_style,eval,llm_style_eval_009,64,4096,6144,bf16,NVIDIA GeForce RTX 4060,c00,32,32,32,2,2,8,0.0,0.0,372.5920021533966,421.90847396850586,8.645449857707407,3,-1,-1,llm8_g3,0,
2026-03-03T03:42:28.161961+00:00,BUCKET,llm_style,eval,llm_style_eval_010,64,2048,4096,bf16,NVIDIA GeForce RTX 4060,c00,32,32,32,2,2,8,0.0,0.0,133.04000347852707,211.66111990809424,8.07081927183882,3,-1,-1,llm8_g3,0,
2026-03-03T03:42:28.278587+00:00,BUCKET,llm_style,eval,llm_style_eval_011,32,3072,6144,bf16,NVIDIA GeForce RTX 4060,c04,64,64,64,4,3,8,0.0,0.0,282.6240062713623,409.9855998158454,4.274086861680723,7,-1,-1,llm8_g7,0,
2026-03-03T03:42:28.291437+00:00,BUCKET,llm_style,eval,llm_style_eval_012,16,1536,1536,bf16,NVIDIA GeForce RTX 4060,c04,64,64,64,4,3,8,0.0,0.0,50.175998359918594,60.795200914144516,1.5046531104064411,7,-1,-1,llm8_g7,0,
2026-03-03T03:42:28.320132+00:00,BUCKET,llm_style,eval,llm_style_eval_013,64,2048,3072,bf16,NVIDIA GeForce RTX 4060,c00,32,32,32,2,2,8,0.0,0.0,103.21599990129471,210.00192403793335,7.802146651392354,3,-1,-1,llm8_g3,0,
2026-03-03T03:42:28.578713+00:00,BUCKET,llm_style,eval,llm_style_eval_014,16,8192,6144,bf16,NVIDIA GeForce RTX 4060,c11,32,128,32,4,2,8,0.0,0.0,696.6879963874817,811.0332822799683,2.3118135296595734,5,-1,-1,llm8_g5,0,
2026-03-03T03:42:28.625276+00:00,BUCKET,llm_style,eval,llm_style_eval_015,64,6144,1536,bf16,NVIDIA GeForce RTX 4060,c06,64,128,32,4,3,8,0.0,0.0,142.33599603176117,218.4089554846285,8.486676495596049,1,-1,-1,llm8_g1,0,
2026-03-03T03:42:28.717869+00:00,BUCKET,llm_style,eval,llm_style_eval_016,16,4096,4096,bf16,NVIDIA GeForce RTX 4060,c04,64,64,64,4,3,8,0.0,0.0,286.72000765800476,446.68927431106545,1.8724570928456843,7,-1,-1,llm8_g7,0,
2026-03-03T03:42:28.891404+00:00,BUCKET,llm_style,eval,llm_style_eval_017,64,8192,4096,bf16,NVIDIA GeForce RTX 4060,c06,64,128,32,4,3,8,0.0,0.0,490.9280091524124,514.1913402080536,8.748670305887138,1,-1,-1,llm8_g1,0,
2026-03-03T03:42:29.022772+00:00,BUCKET,llm_style,eval,llm_style_eval_018,32,4096,6144,bf16,NVIDIA GeForce RTX 4060,c04,64,64,64,4,3,8,0.0,0.0,375.5359947681427,451.8169665336607,4.2888371778966174,7,-1,-1,llm8_g7,0,
2026-03-03T03:42:29.151834+00:00,BUCKET,llm_style,eval,llm_style_eval_019,16,3072,8192,bf16,NVIDIA GeForce RTX 4060,c04,64,64,64,4,3,8,0.0,0.0,367.48799681663513,496.1382329463959,2.191381419191828,6,-1,-1,llm8_g6,0,
2026-03-03T03:42:29.168877+00:00,BUCKET,llm_style,eval,llm_style_eval_020,4,1536,1536,bf16,NVIDIA GeForce RTX 4060,c04,64,64,64,4,3,8,0.0,0.0,61.83999963104725,160.28671830892563,0.305212938431584,7,-1,-1,llm8_g7,0,
2026-03-03T03:42:29.214315+00:00,BUCKET,llm_style,eval,llm_style_eval_021,4,6144,1536,bf16,NVIDIA GeForce RTX 4060,c11,32,128,32,4,2,8,0.0,0.0,78.84799689054489,92.702721580863,0.9575065312667864,5,-1,-1,llm8_g5,0,
2026-03-03T03:42:29.240239+00:00,BUCKET,llm_style,eval,llm_style_eval_022,32,6144,1024,bf16,NVIDIA GeForce RTX 4060,c11,32,128,32,4,2,8,0.0,0.0,63.919998705387115,69.03232030570507,6.299330290287768,5,-1,-1,llm8_g5,0,
2026-03-03T03:42:29.250960+00:00,BUCKET,llm_style,eval,llm_style_eval_023,16,1024,1536,bf16,NVIDIA GeForce RTX 4060,c04,64,64,64,4,3,8,0.0,0.0,56.32000043988228,116.94528162479395,0.8936727202927771,7,-1,-1,llm8_g7,0,
2026-03-03T03:42:29.284726+00:00,BUCKET,llm_style,eval,llm_style_eval_024,32,8192,1024,bf16,NVIDIA GeForce RTX 4060,c11,32,128,32,4,2,8,0.0,0.0,84.927998483181,191.51808500289917,6.321483157363246,5,-1,-1,llm8_g5,0,
2026-03-03T03:42:29.479706+00:00,BUCKET,llm_style,eval,llm_style_eval_025,32,6144,6144,bf16,NVIDIA GeForce RTX 4060,c11,32,128,32,4,2,8,0.0,0.0,531.4559936523438,558.7913477420807,4.545849765277824,5,-1,-1,llm8_g5,0,
2026-03-03T03:42:29.543360+00:00,BUCKET,llm_style,eval,llm_style_eval_026,1,6144,2048,bf16,NVIDIA GeForce RTX 4060,c11,32,128,32,4,2,8,0.0,0.0,116.73600226640701,178.18463608622548,0.21557894318299728,5,-1,-1,llm8_g5,0,
2026-03-03T03:42:29.611743+00:00,BUCKET,llm_style,eval,llm_style_eval_027,32,4096,3072,bf16,NVIDIA GeForce RTX 4060,c04,64,64,64,4,3,8,0.0,0.0,199.68000054359436,273.7868793308733,4.03298460440551,7,-1,-1,llm8_g7,0,
2026-03-03T03:42:29.627764+00:00,BUCKET,llm_style,eval,llm_style_eval_028,64,1536,1536,bf16,NVIDIA GeForce RTX 4060,c00,32,32,32,2,2,8,0.0,0.0,78.84799689054489,237.72000148892397,3.8300261250671457,3,-1,-1,llm8_g3,0,
2026-03-03T03:42:29.645377+00:00,BUCKET,llm_style,eval,llm_style_eval_029,2,3072,1024,bf16,NVIDIA GeForce RTX 4060,c04,64,64,64,4,3,8,0.0,0.0,92.99200028181076,234.8796847462652,0.13531176834424133,7,-1,-1,llm8_g7,0,
2026-03-03T03:42:29.720283+00:00,BUCKET,llm_style,eval,llm_style_eval_030,32,1536,8192,bf16,NVIDIA GeForce RTX 4060,c04,64,64,64,4,3,8,0.0,0.0,211.93600445985794,320.98750859498966,3.799761961410999,6,-1,-1,llm8_g6,0,
2026-03-03T03:42:29.752334+00:00,BUCKET,llm_style,eval,llm_style_eval_031,8,3072,2048,bf16,NVIDIA GeForce RTX 4060,c04,64,64,64,4,3,8,0.0,0.0,113.56800049543381,223.04192394018165,0.8863702412727372,7,-1,-1,llm8_g7,0,
2026-03-03T03:42:29.782478+00:00,BUCKET,llm_style,eval,llm_style_eval_032,8,2048,3072,bf16,NVIDIA GeForce RTX 4060,c04,64,64,64,4,3,8,0.0,0.0,152.5600031018257,242.76992022991178,0.6598275691749468,7,-1,-1,llm8_g7,0,
2026-03-03T03:42:29.866845+00:00,BUCKET,llm_style,eval,llm_style_eval_033,64,1536,8192,bf16,NVIDIA GeForce RTX 4060,c10,64,128,64,8,3,8,0.0,0.0,359.8719984292984,467.37088441848755,4.475515580622275,2,-1,-1,llm8_g2,0,
2026-03-03T03:42:29.932270+00:00,BUCKET,llm_style,eval,llm_style_eval_034,64,6144,2048,bf16,NVIDIA GeForce RTX 4060,c06,64,128,32,4,3,8,0.0,0.0,191.42399728298187,196.05920642614365,8.41384966806974,1,-1,-1,llm8_g1,0,
2026-03-03T03:42:29.973722+00:00,BUCKET,llm_style,eval,llm_style_eval_035,4,4096,2048,bf16,NVIDIA GeForce RTX 4060,c04,64,64,64,4,3,8,0.0,0.0,154.62400019168854,172.50944197177887,0.4340132444950631,7,-1,-1,llm8_g7,0,
2026-03-03T03:42:30.154473+00:00,BUCKET,llm_style,eval,llm_style_eval_036,64,8192,4096,bf16,NVIDIA GeForce RTX 4060,c06,64,128,32,4,3,8,0.0,0.0,533.5040092468262,583.5504108667374,8.050487384459242,1,-1,-1,llm8_g1,0,
2026-03-03T03:42:30.186803+00:00,BUCKET,llm_style,eval,llm_style_eval_037,32,6144,1024,bf16,NVIDIA GeForce RTX 4060,c11,32,128,32,4,2,8,0.0,0.0,76.76800340414047,225.7472014427184,5.245065211351881,5,-1,-1,llm8_g5,0,
2026-03-03T03:42:30.254323+00:00,BUCKET,llm_style,eval,llm_style_eval_038,64,6144,2048,bf16,NVIDIA GeForce RTX 4060,c06,64,128,32,4,3,8,0.0,0.0,199.68000054359436,266.135999560356,8.06596920881102,1,-1,-1,llm8_g1,0,
2026-03-03T03:42:30.273129+00:00,BUCKET,llm_style,eval,llm_style_eval_039,8,1024,3072,bf16,NVIDIA GeForce RTX 4060,c04,64,64,64,4,3,8,0.0,0.0,111.56800016760826,162.31423914432526,0.4511297856409268,7,-1,-1,llm8_g7,0,
2026-03-03T03:42:30.371136+00:00,BUCKET,llm_style,eval,llm_style_eval_040,32,8192,2048,bf16,NVIDIA GeForce RTX 4060,c11,32,128,32,4,2,8,0.0,0.0,258.04799795150757,288.3276695013046,4.161015906047749,5,-1,-1,llm8_g5,0,
2026-03-03T03:42:30.388899+00:00,BUCKET,llm_style,eval,llm_style_eval_041,32,3072,1024,bf16,NVIDIA GeForce RTX 4060,c04,64,64,64,4,3,8,0.0,0.0,75.77600330114365,193.28256458044035,2.656864749119877,7,-1,-1,llm8_g7,0,
2026-03-03T03:42:30.411866+00:00,BUCKET,llm_style,eval,llm_style_eval_042,64,1024,4096,bf16,NVIDIA GeForce RTX 4060,c00,32,32,32,2,2,8,0.0,0.0,139.64799791574478,193.48735749721527,3.844458352520855,3,-1,-1,llm8_g3,0,
2026-03-03T03:42:30.422759+00:00,BUCKET,llm_style,eval,llm_style_eval_043,2,1536,1024,bf16,NVIDIA GeForce RTX 4060,c04,64,64,64,4,3,8,0.0,0.0,67.04000011086464,159.15008157491675,0.09384630056079599,7,-1,-1,llm8_g7,0,
2026-03-03T03:42:30.522252+00:00,BUCKET,llm_style,eval,llm_style_eval_044,64,6144,3072,bf16,NVIDIA GeForce RTX 4060,c06,64,128,32,4,3,8,0.0,0.0,304.1279911994934,400.0460773706434,7.9437578056249105,1,-1,-1,llm8_g1,0,
2026-03-03T03:42:30.570477+00:00,BUCKET,llm_style,eval,llm_style_eval_045,64,1536,6144,bf16,NVIDIA GeForce RTX 4060,c00,32,32,32,2,2,8,0.0,0.0,221.02399915456772,286.9452875852584,5.465286831387225,3,-1,-1,llm8_g3,0,
2026-03-03T03:42:30.674255+00:00,BUCKET,llm_style,eval,llm_style_eval_046,2,6144,3072,bf16,NVIDIA GeForce RTX 4060,c11,32,128,32,4,2,8,0.0,0.0,305.08799850940704,393.3798462152479,0.2474612976218798,5,-1,-1,llm8_g5,0,
2026-03-03T03:42:30.858918+00:00,BUCKET,llm_style,eval,llm_style_eval_047,16,4096,8192,bf16,NVIDIA GeForce RTX 4060,c04,64,64,64,4,3,8,0.0,0.0,617.935985326767,741.0585683584213,1.7376263067641238,6,-1,-1,llm8_g6,0,
2026-03-03T03:42:30.900396+00:00,BUCKET,llm_style,eval,llm_style_eval_048,16,1024,6144,bf16,NVIDIA GeForce RTX 4060,c04,64,64,64,4,3,8,0.0,0.0,209.83999967575073,292.75135099887837,0.9594290521878296,7,-1,-1,llm8_g7,0,
2026-03-03T03:42:30.965516+00:00,BUCKET,llm_style,eval,llm_style_eval_049,16,8192,1536,bf16,NVIDIA GeForce RTX 4060,c11,32,128,32,4,2,8,0.0,0.0,165.8879965543747,196.12447828054422,2.42725930967536,5,-1,-1,llm8_g5,0,
2026-03-03T03:42:30.974589+00:00,BUCKET,llm_style,eval,llm_style_eval_050,1,1024,1024,bf16,NVIDIA GeForce RTX 4060,c04,64,64,64,4,3,8,0.0,0.0,58.25600028038025,81.10080130398269,0.035998901227455006,7,-1,-1,llm8_g7,0,
2026-03-03T03:42:30.999971+00:00,BUCKET,llm_style,eval,llm_style_eval_051,16,6144,1024,bf16,NVIDIA GeForce RTX 4060,c11,32,128,32,4,2,8,0.0,0.0,77.69599929451942,99.52479973435396,2.5912092492283745,5,-1,-1,llm8_g5,0,
2026-03-03T03:42:31.373883+00:00,BUCKET,llm_style,eval,llm_style_eval_052,16,8192,8192,bf16,NVIDIA GeForce RTX 4060,c06,64,128,32,4,3,8,0.0,0.0,1387.5199556350708,1530.142686367035,1.5477137026235361,4,-1,-1,llm8_g4,0,
2026-03-03T03:42:31.643576+00:00,BUCKET,llm_style,eval,llm_style_eval_053,1,6144,8192,bf16,NVIDIA GeForce RTX 4060,c06,64,128,32,4,3,8,0.0,0.0,862.2080087661743,938.7724733352661,0.11675059263721045,4,-1,-1,llm8_g4,0,
2026-03-03T03:42:31.721174+00:00,BUCKET,llm_style,eval,llm_style_eval_054,64,4096,3072,bf16,NVIDIA GeForce RTX 4060,c00,32,32,32,2,2,8,0.0,0.0,330.7359963655472,340.9920036792755,4.869783615025273,3,-1,-1,llm8_g3,0,
2026-03-03T03:42:31.759597+00:00,BUCKET,llm_style,eval,llm_style_eval_055,4,8192,1024,bf16,NVIDIA GeForce RTX 4060,c11,32,128,32,4,2,8,0.0,0.0,132.60799646377563,245.88288873434064,0.5060695115647271,5,-1,-1,llm8_g5,0,
2026-03-03T03:42:31.785651+00:00,BUCKET,llm_style,eval,llm_style_eval_056,64,1024,3072,bf16,NVIDIA GeForce RTX 4060,c00,32,32,32,2,2,8,0.0,0.0,140.20799845457077,228.5452784597872,2.8718274880050076,3,-1,-1,llm8_g3,0,
2026-03-03T03:42:31.794893+00:00,BUCKET,llm_style,eval,llm_style_eval_057,64,1024,3072,bf16,NVIDIA GeForce RTX 4060,c00,32,32,32,2,2,8,0.0,0.0,130.048006772995,166.15423649549479,3.096188815126174,3,-1,-1,llm8_g3,0,
2026-03-03T03:42:31.847274+00:00,BUCKET,llm_style,eval,llm_style_eval_058,32,2048,4096,bf16,NVIDIA GeForce RTX 4060,c04,64,64,64,4,3,8,0.0,0.0,253.9519965648651,307.3785623908042,2.1140645447253688,7,-1,-1,llm8_g7,0,
2026-03-03T03:42:31.942961+00:00,BUCKET,llm_style,eval,llm_style_eval_059,64,8192,2048,bf16,NVIDIA GeForce RTX 4060,c06,64,128,32,4,3,8,0.0,0.0,349.0400016307831,366.01535230875015,6.152543083791361,1,-1,-1,llm8_g1,0,
2026-03-03T03:42:32.046377+00:00,BUCKET,llm_style,eval,llm_style_eval_060,1,3072,6144,bf16,NVIDIA GeForce RTX 4060,c04,64,64,64,4,3,8,0.0,0.0,367.5040006637573,442.05056399106957,0.10271653079101492,7,-1,-1,llm8_g7,0,
2026-03-03T03:42:32.085718+00:00,BUCKET,llm_style,eval,llm_style_eval_061,64,1536,4096,bf16,NVIDIA GeForce RTX 4060,c00,32,32,32,2,2,8,0.0,0.0,188.78400325775146,232.1136033535003,4.265755329388239,3,-1,-1,llm8_g3,0,
2026-03-03T03:42:32.151529+00:00,BUCKET,llm_style,eval,llm_style_eval_062,16,6144,2048,bf16,NVIDIA GeForce RTX 4060,c11,32,128,32,4,2,8,0.0,0.0,146.43200486898422,154.5164866745472,2.7497621463303887,5,-1,-1,llm8_g5,0,
2026-03-03T03:42:32.200857+00:00,BUCKET,llm_style,eval,llm_style_eval_063,64,1536,6144,bf16,NVIDIA GeForce RTX 4060,c00,32,32,32,2,2,8,0.0,0.0,263.16800713539124,270.39744198322296,4.590069914457896,3,-1,-1,llm8_g3,0,
2026-03-03T03:42:32.267779+00:00,BUCKET,llm_style,eval,llm_style_eval_064,1,6144,2048,bf16,NVIDIA GeForce RTX 4060,c11,32,128,32,4,2,8,0.0,0.0,148.92800152301788,263.8233521580695,0.16897980059250609,5,-1,-1,llm8_g5,0,
2026-03-03T03:42:32.326885+00:00,BUCKET,llm_style,eval,llm_style_eval_065,8,1536,6144,bf16,NVIDIA GeForce RTX 4060,c04,64,64,64,4,3,8,0.0,0.0,242.0480027794838,317.5424101948736,0.6238223090713247,7,-1,-1,llm8_g7,0,
2026-03-03T03:42:32.366549+00:00,BUCKET,llm_style,eval,llm_style_eval_066,64,1536,4096,bf16,NVIDIA GeForce RTX 4060,c00,32,32,32,2,2,8,0.0,0.0,187.9040002822876,284.03711944818485,4.285732963588805,3,-1,-1,llm8_g3,0,
2026-03-03T03:42:32.474289+00:00,BUCKET,llm_style,eval,llm_style_eval_067,64,8192,2048,bf16,NVIDIA GeForce RTX 4060,c06,64,128,32,4,3,8,0.0,0.0,353.7440001964569,426.2710458040237,6.070728116398762,1,-1,-1,llm8_g1,0,
2026-03-03T03:42:32.506220+00:00,BUCKET,llm_style,eval,llm_style_eval_068,64,1024,4096,bf16,NVIDIA GeForce RTX 4060,c00,32,32,32,2,2,8,0.0,0.0,182.24000185728073,258.1523242592811,2.9459553694498126,3,-1,-1,llm8_g3,0,
2026-03-03T03:42:32.553412+00:00,BUCKET,llm_style,eval,llm_style_eval_069,64,2048,4096,bf16,NVIDIA GeForce RTX 4060,c00,32,32,32,2,2,8,0.0,0.0,262.12799549102783,349.0303876996039,4.096250085721013,3,-1,-1,llm8_g3,0,
2026-03-03T03:42:32.606732+00:00,BUCKET,llm_style,eval,llm_style_eval_070,64,8192,1024,bf16,NVIDIA GeForce RTX 4060,c06,64,128,32,4,3,8,0.0,0.0,188.81600350141525,266.29278868436813,5.686709834380918,1,-1,-1,llm8_g1,0,
2026-03-03T03:42:32.683466+00:00,BUCKET,llm_style,eval,llm_style_eval_071,64,6144,2048,bf16,NVIDIA GeForce RTX 4060,c06,64,128,32,4,3,8,0.0,0.0,247.18400090932846,358.41376543045044,6.515845402918297,1,-1,-1,llm8_g1,0,
2026-03-03T03:42:32.700211+00:00,BUCKET,llm_style,eval,llm_style_eval_072,64,1536,1024,bf16,NVIDIA GeForce RTX 4060,c00,32,32,32,2,2,8,0.0,0.0,63.35999816656113,74.64608184993267,3.1775031222499646,3,-1,-1,llm8_g3,0,
2026-03-03T03:42:32.731561+00:00,BUCKET,llm_style,eval,llm_style_eval_073,1,4096,1536,bf16,NVIDIA GeForce RTX 4060,c04,64,64,64,4,3,8,0.0,0.0,158.720001578331,267.84767776727676,0.07927741856649441,7,-1,-1,llm8_g7,0,
2026-03-03T03:42:32.746950+00:00,BUCKET,llm_style,eval,llm_style_eval_074,8,1024,2048,bf16,NVIDIA GeForce RTX 4060,c04,64,64,64,4,3,8,0.0,0.0,97.79200330376625,152.38143563270563,0.3431204072563234,7,-1,-1,llm8_g7,0,
2026-03-03T03:42:32.771505+00:00,BUCKET,llm_style,eval,llm_style_eval_075,2,6144,1024,bf16,NVIDIA GeForce RTX 4060,c11,32,128,32,4,2,8,0.0,0.0,81.91999793052673,95.59712082147595,0.307200007760525,5,-1,-1,llm8_g5,0,
2026-03-03T03:42:32.806894+00:00,BUCKET,llm_style,eval,llm_style_eval_076,64,1024,6144,bf16,NVIDIA GeForce RTX 4060,c00,32,32,32,2,2,8,0.0,0.0,230.3679957985878,289.85344111919403,3.495738916373108,3,-1,-1,llm8_g3,0,
2026-03-03T03:42:32.996501+00:00,BUCKET,llm_style,eval,llm_style_eval_077,1,4096,8192,bf16,NVIDIA GeForce RTX 4060,c04,64,64,64,4,3,8,0.0,0.0,686.9440078735352,827.9142260551453,0.09769189807439821,6,-1,-1,llm8_g6,0,
2026-03-03T03:42:33.107160+00:00,BUCKET,llm_style,eval,llm_style_eval_078,64,6144,3072,bf16,NVIDIA GeForce RTX 4060,c06,64,128,32,4,3,8,0.0,0.0,352.25600004196167,519.283210635185,6.85841860383417,1,-1,-1,llm8_g1,0,
2026-03-03T03:42:33.178903+00:00,BUCKET,llm_style,eval,llm_style_eval_079,2,3072,4096,bf16,NVIDIA GeForce RTX 4060,c04,64,64,64,4,3,8,0.0,0.0,250.2400055527687,393.0905729532242,0.20113349937321054,7,-1,-1,llm8_g7,0,
2026-03-03T03:42:33.190594+00:00,BUCKET,llm_style,eval,llm_style_eval_080,4,1536,1024,bf16,NVIDIA GeForce RTX 4060,c04,64,64,64,4,3,8,0.0,0.0,63.439998775720596,126.26399978995312,0.19834350950233093,7,-1,-1,llm8_g7,0,
2026-03-03T03:42:33.345188+00:00,BUCKET,llm_style,eval,llm_style_eval_081,4,4096,6144,bf16,NVIDIA GeForce RTX 4060,c04,64,64,64,4,3,8,0.0,0.0,736.2560033798218,847.9129487276077,0.27344645215224017,7,-1,-1,llm8_g7,0,
2026-03-03T03:42:33.378261+00:00,BUCKET,llm_style,eval,llm_style_eval_082,64,6144,1024,bf16,NVIDIA GeForce RTX 4060,c06,64,128,32,4,3,8,0.0,0.0,170.33600062131882,196.5766467154026,4.727752002292872,1,-1,-1,llm8_g1,0,
2026-03-03T03:42:33.480297+00:00,BUCKET,llm_style,eval,llm_style_eval_083,8,4096,4096,bf16,NVIDIA GeForce RTX 4060,c04,64,64,64,4,3,8,0.0,0.0,505.8559775352478,652.0934557914734,0.5306558940114443,7,-1,-1,llm8_g7,0,
2026-03-03T03:42:33.553497+00:00,BUCKET,llm_style,eval,llm_style_eval_084,64,1024,8192,bf16,NVIDIA GeForce RTX 4060,c10,64,128,64,8,3,8,0.0,0.0,675.3120124340057,784.4249725341797,1.5899936684525222,2,-1,-1,llm8_g2,0,
2026-03-03T03:42:33.706041+00:00,BUCKET,llm_style,eval,llm_style_eval_085,1,3072,8192,bf16,NVIDIA GeForce RTX 4060,c04,64,64,64,4,3,8,0.0,0.0,694.271981716156,843.8272136449814,0.0724955771304299,6,-1,-1,llm8_g6,0,
2026-03-03T03:42:33.721844+00:00,BUCKET,llm_style,eval,llm_style_eval_086,8,1536,1024,bf16,NVIDIA GeForce RTX 4060,c04,64,64,64,4,3,8,0.0,0.0,99.20000284910202,190.22848099470133,0.2536877346493726,7,-1,-1,llm8_g7,0,
2026-03-03T03:42:33.744760+00:00,BUCKET,llm_style,eval,llm_style_eval_087,16,1024,3072,bf16,NVIDIA GeForce RTX 4060,c04,64,64,64,4,3,8,0.0,0.0,150.52799880504608,245.95455721020681,0.6687346991862454,7,-1,-1,llm8_g7,0,
2026-03-03T03:42:33.783380+00:00,BUCKET,llm_style,eval,llm_style_eval_088,8,4096,1536,bf16,NVIDIA GeForce RTX 4060,c04,64,64,64,4,3,8,0.0,0.0,196.60800695419312,364.0067219734192,0.5119999818901227,7,-1,-1,llm8_g7,0,
2026-03-03T03:42:33.884777+00:00,BUCKET,llm_style,eval,llm_style_eval_089,16,6144,3072,bf16,NVIDIA GeForce RTX 4060,c11,32,128,32,4,2,8,0.0,0.0,316.76800549030304,398.95039319992054,1.90669438052982,5,-1,-1,llm8_g5,0,
2026-03-03T03:42:33.914449+00:00,BUCKET,llm_style,eval,llm_style_eval_090,32,1536,3072,bf16,NVIDIA GeForce RTX 4060,c04,64,64,64,4,3,8,0.0,0.0,151.5520066022873,263.71071606874466,1.992648561839908,7,-1,-1,llm8_g7,0,
2026-03-03T03:42:33.943385+00:00,BUCKET,llm_style,eval,llm_style_eval_091,16,1024,4096,bf16,NVIDIA GeForce RTX 4060,c04,64,64,64,4,3,8,0.0,0.0,205.1520049571991,281.69599771499634,0.6542355168695615,7,-1,-1,llm8_g7,0,
2026-03-03T03:42:34.104718+00:00,BUCKET,llm_style,eval,llm_style_eval_092,1,4096,6144,bf16,NVIDIA GeForce RTX 4060,c04,64,64,64,4,3,8,0.0,0.0,785.8560085296631,816.8140995502472,0.06404690866227584,7,-1,-1,llm8_g7,0,
2026-03-03T03:42:34.144716+00:00,BUCKET,llm_style,eval,llm_style_eval_093,32,2048,3072,bf16,NVIDIA GeForce RTX 4060,c04,64,64,64,4,3,8,0.0,0.0,276.9920080900192,345.24414926767344,1.4536635434952416,7,-1,-1,llm8_g7,0,
2026-03-03T03:42:34.162789+00:00,BUCKET,llm_style,eval,llm_style_eval_094,32,1024,2048,bf16,NVIDIA GeForce RTX 4060,c04,64,64,64,4,3,8,0.0,0.0,133.55199992656708,214.70208182930944,1.0049847855052636,7,-1,-1,llm8_g7,0,
2026-03-03T03:42:34.230473+00:00,BUCKET,llm_style,eval,llm_style_eval_095,8,6144,2048,bf16,NVIDIA GeForce RTX 4060,c11,32,128,32,4,2,8,0.0,0.0,198.60800355672836,288.4099203348159,1.0136882119279504,5,-1,-1,llm8_g5,0,
2026-03-03T03:42:34.273223+00:00,BUCKET,llm_style,eval,llm_style_eval_096,64,2048,3072,bf16,NVIDIA GeForce RTX 4060,c00,32,32,32,2,2,8,0.0,0.0,263.67999613285065,385.4233524203299,3.0541048991606483,3,-1,-1,llm8_g3,0,
2026-03-03T03:42:34.309443+00:00,BUCKET,llm_style,eval,llm_style_eval_097,64,6144,1024,bf16,NVIDIA GeForce RTX 4060,c06,64,128,32,4,3,8,0.0,0.0,203.13599705696106,350.4265511035918,3.9643705678328653,1,-1,-1,llm8_g1,0,
2026-03-03T03:42:34.339004+00:00,BUCKET,llm_style,eval,llm_style_eval_098,32,6144,1024,bf16,NVIDIA GeForce RTX 4060,c11,32,128,32,4,2,8,0.0,0.0,110.59200018644333,224.68607395887366,3.6408888827508368,5,-1,-1,llm8_g5,0,
2026-03-03T03:42:34.366179+00:00,BUCKET,llm_style,eval,llm_style_eval_099,1,2048,2048,bf16,NVIDIA GeForce RTX 4060,c04,64,64,64,4,3,8,0.0,0.0,201.7280012369156,283.6057585477829,0.041583756090202664,7,-1,-1,llm8_g7,0,
2026-03-03T03:42:34.413876+00:00,BUCKET,llm_style,eval,llm_style_eval_100,64,8192,1024,bf16,NVIDIA GeForce RTX 4060,c06,64,128,32,4,3,8,0.0,0.0,268.2879865169525,288.3926403522491,4.002198674416428,1,-1,-1,llm8_g1,0,
2026-03-03T03:42:34.497691+00:00,BUCKET,llm_style,eval,llm_style_eval_101,64,8192,1536,bf16,NVIDIA GeForce RTX 4060,c06,64,128,32,4,3,8,0.0,0.0,389.5360082387924,513.0281579494476,4.134695386139158,1,-1,-1,llm8_g1,0,
2026-03-03T03:42:34.534063+00:00,BUCKET,llm_style,eval,llm_style_eval_102,32,3072,2048,bf16,NVIDIA GeForce RTX 4060,c04,64,64,64,4,3,8,0.0,0.0,202.65599340200424,384.82944726943964,1.986880216275004,7,-1,-1,llm8_g7,0,
2026-03-03T03:42:34.572066+00:00,BUCKET,llm_style,eval,llm_style_eval_103,64,2048,3072,bf16,NVIDIA GeForce RTX 4060,c00,32,32,32,2,2,8,0.0,0.0,263.16800713539124,355.373120307922,3.060046609638597,3,-1,-1,llm8_g3,0,
2026-03-03T03:42:34.638333+00:00,BUCKET,llm_style,eval,llm_style_eval_104,16,6144,2048,bf16,NVIDIA GeForce RTX 4060,c11,32,128,32,4,2,8,0.0,0.0,190.92800468206406,243.97472321987146,2.108926789815374,5,-1,-1,llm8_g5,0,
2026-03-03T03:42:34.698011+00:00,BUCKET,llm_style,eval,llm_style_eval_105,1,1024,8192,bf16,NVIDIA GeForce RTX 4060,c04,64,64,64,4,3,8,0.0,0.0,404.4800102710724,523.3254605531693,0.04147847995938373,6,-1,-1,llm8_g6,0,
2026-03-03T03:42:34.910123+00:00,BUCKET,llm_style,eval,llm_style_eval_106,32,4096,8192,bf16,NVIDIA GeForce RTX 4060,c04,64,64,64,4,3,8,0.0,0.0,1000.9599924087524,1049.640965461731,2.145424057191541,6,-1,-1,llm8_g6,0,
2026-03-03T03:42:34.971995+00:00,BUCKET,llm_style,eval,llm_style_eval_107,64,6144,1536,bf16,NVIDIA GeForce RTX 4060,c06,64,128,32,4,3,8,0.0,0.0,272.8959918022156,378.060164451599,4.426446662050947,1,-1,-1,llm8_g1,0,
2026-03-03T03:42:35.000384+00:00,BUCKET,llm_style,eval,llm_style_eval_108,8,3072,1536,bf16,NVIDIA GeForce RTX 4060,c04,64,64,64,4,3,8,0.0,0.0,156.67200088500977,306.5673619508742,0.48188235021911646,7,-1,-1,llm8_g7,0,
2026-03-03T03:42:35.016749+00:00,BUCKET,llm_style,eval,llm_style_eval_109,16,2048,1024,bf16,NVIDIA GeForce RTX 4060,c04,64,64,64,4,3,8,0.0,0.0,117.76000261306763,168.4870408475399,0.5698782482240964,7,-1,-1,llm8_g7,0,
2026-03-03T03:42:35.413717+00:00,BUCKET,llm_style,eval,llm_style_eval_110,1,8192,8192,bf16,NVIDIA GeForce RTX 4060,c06,64,128,32,4,3,8,0.0,0.0,1653.663992881775,1727.508521080017,0.08116384499979591,4,-1,-1,llm8_g4,0,
2026-03-03T03:42:35.466276+00:00,BUCKET,llm_style,eval,llm_style_eval_111,8,6144,1536,bf16,NVIDIA GeForce RTX 4060,c11,32,128,32,4,2,8,0.0,0.0,108.5439994931221,270.18239796161646,1.3910943461187626,5,-1,-1,llm8_g5,0,
2026-03-03T03:42:35.564497+00:00,BUCKET,llm_style,eval,llm_style_eval_112,2,6144,3072,bf16,NVIDIA GeForce RTX 4060,c11,32,128,32,4,2,8,0.0,0.0,282.1120023727417,393.23647886514664,0.26761524275825965,5,-1,-1,llm8_g5,0,
2026-03-03T03:42:35.921568+00:00,BUCKET,llm_style,eval,llm_style_eval_113,1,8192,8192,bf16,NVIDIA GeForce RTX 4060,c06,64,128,32,4,3,8,0.0,0.0,1217.0239686965942,1329.9609518051147,0.1102835535307856,4,-1,-1,llm8_g4,0,
2026-03-03T03:42:35.945921+00:00,BUCKET,llm_style,eval,llm_style_eval_114,1,3072,1024,bf16,NVIDIA GeForce RTX 4060,c04,64,64,64,4,3,8,0.0,0.0,81.91999793052673,118.14943820238103,0.07680000194013124,7,-1,-1,llm8_g7,0,
2026-03-03T03:42:35.974778+00:00,BUCKET,llm_style,eval,llm_style_eval_115,16,3072,1536,bf16,NVIDIA GeForce RTX 4060,c04,64,64,64,4,3,8,0.0,0.0,103.85600104928017,257.0137533545491,1.4538875219001757,7,-1,-1,llm8_g7,0,
2026-03-03T03:42:35.993626+00:00,BUCKET,llm_style,eval,llm_style_eval_116,8,3072,1024,bf16,NVIDIA GeForce RTX 4060,c04,64,64,64,4,3,8,0.0,0.0,107.51999914646149,209.5504024624824,0.46811428943037175,7,-1,-1,llm8_g7,0,
2026-03-03T03:42:36.018673+00:00,BUCKET,llm_style,eval,llm_style_eval_117,4,1024,4096,bf16,NVIDIA GeForce RTX 4060,c04,64,64,64,4,3,8,0.0,0.0,171.36000096797943,258.1299179792404,0.19581251056522828,7,-1,-1,llm8_g7,0,
2026-03-03T03:42:36.121618+00:00,BUCKET,llm_style,eval,llm_style_eval_118,64,6144,3072,bf16,NVIDIA GeForce RTX 4060,c06,64,128,32,4,3,8,0.0,0.0,295.9359884262085,324.8127979040146,8.16365429851195,1,-1,-1,llm8_g1,0,
2026-03-03T03:42:36.397195+00:00,BUCKET,llm_style,eval,llm_style_eval_119,64,8192,6144,bf16,NVIDIA GeForce RTX 4060,c06,64,128,32,4,3,8,0.0,0.0,804.8639893531799,874.7212928533554,8.004397052447835,1,-1,-1,llm8_g1,0,
2026-03-03T03:42:36.423752+00:00,BUCKET,llm_style,eval,llm_style_eval_120,8,1024,4096,bf16,NVIDIA GeForce RTX 4060,c04,64,64,64,4,3,8,0.0,0.0,155.03999590873718,260.78208237886423,0.43284872143251985,7,-1,-1,llm8_g7,0,
2026-03-03T03:42:36.442765+00:00,BUCKET,llm_style,eval,llm_style_eval_121,4,1024,2048,bf16,NVIDIA GeForce RTX 4060,c04,64,64,64,4,3,8,0.0,0.0,109.05599966645241,171.0694383084774,0.153840376057375,7,-1,-1,llm8_g7,0,
2026-03-03T03:42:36.574992+00:00,BUCKET,llm_style,eval,llm_style_eval_122,4,6144,4096,bf16,NVIDIA GeForce RTX 4060,c11,32,128,32,4,2,8,0.0,0.0,360.9600067138672,417.6998433470725,0.5577531811151353,5,-1,-1,llm8_g5,0,
2026-03-03T03:42:36.707229+00:00,BUCKET,llm_style,eval,llm_style_eval_123,4,3072,8192,bf16,NVIDIA GeForce RTX 4060,c04,64,64,64,4,3,8,0.0,0.0,388.09600472450256,544.0102380514145,0.5187546110991674,6,-1,-1,llm8_g6,0,
2026-03-03T03:42:36.738194+00:00,BUCKET,llm_style,eval,llm_style_eval_124,64,6144,1024,bf16,NVIDIA GeForce RTX 4060,c06,64,128,32,4,3,8,0.0,0.0,123.90399724245071,219.92287501692755,6.4994381611773715,1,-1,-1,llm8_g1,0,
2026-03-03T03:42:36.818666+00:00,BUCKET,llm_style,eval,llm_style_eval_125,64,1536,8192,bf16,NVIDIA GeForce RTX 4060,c10,64,128,64,8,3,8,0.0,0.0,388.09600472450256,497.4080008268356,4.150036888793339,2,-1,-1,llm8_g2,0,
2026-03-03T03:42:36.915985+00:00,BUCKET,llm_style,eval,llm_style_eval_126,64,2048,8192,bf16,NVIDIA GeForce RTX 4060,c10,64,128,64,8,3,8,0.0,0.0,389.1040086746216,495.630407333374,5.519047864129766,2,-1,-1,llm8_g2,0,
2026-03-03T03:42:36.984704+00:00,BUCKET,llm_style,eval,llm_style_eval_127,2,8192,1536,bf16,NVIDIA GeForce RTX 4060,c11,32,128,32,4,2,8,0.0,0.0,149.50400590896606,207.68223553895945,0.33665752094059115,5,-1,-1,llm8_g5,0,
2026-03-03T03:42:37.011708+00:00,BUCKET,llm_style,eval,llm_style_eval_128,8,2048,2048,bf16,NVIDIA GeForce RTX 4060,c04,64,64,64,4,3,8,0.0,0.0,129.02400642633438,234.43903669714928,0.5201269582208755,7,-1,-1,llm8_g7,0,
2026-03-03T03:42:37.283995+00:00,BUCKET,llm_style,eval,llm_style_eval_129,64,8192,6144,bf16,NVIDIA GeForce RTX 4060,c06,64,128,32,4,3,8,0.0,0.0,804.3519854545593,915.2944111824035,8.0094921881236,1,-1,-1,llm8_g1,0,
2026-03-03T03:42:37.308011+00:00,BUCKET,llm_style,eval,llm_style_eval_130,16,3072,1536,bf16,NVIDIA GeForce RTX 4060,c04,64,64,64,4,3,8,0.0,0.0,100.8479967713356,191.50208368897432,1.4972527847267845,7,-1,-1,llm8_g7,0,
2026-03-03T03:42:37.653518+00:00,BUCKET,llm_style,eval,llm_style_eval_131,32,8192,8192,bf16,NVIDIA GeForce RTX 4060,c06,64,128,32,4,3,8,0.0,0.0,1022.9760408401489,1090.2425754070282,4.198502334886195,4,-1,-1,llm8_g4,0,
2026-03-03T03:42:37.831049+00:00,BUCKET,llm_style,eval,llm_style_eval_132,32,8192,4096,bf16,NVIDIA GeForce RTX 4060,c11,32,128,32,4,2,8,0.0,0.0,461.7279917001724,593.0496102571486,4.650971322081962,5,-1,-1,llm8_g5,0,
2026-03-03T03:42:38.215092+00:00,BUCKET,llm_style,eval,llm_style_eval_133,2,8192,8192,bf16,NVIDIA GeForce RTX 4060,c06,64,128,32,4,3,8,0.0,0.0,1493.9520359039307,1802.2502183914175,0.17968144193972094,4,-1,-1,llm8_g4,0,
2026-03-03T03:42:38.273966+00:00,BUCKET,llm_style,eval,llm_style_eval_134,64,3072,3072,bf16,NVIDIA GeForce RTX 4060,c00,32,32,32,2,2,8,0.0,0.0,241.15200340747833,360.1919990777969,5.0091209483293895,3,-1,-1,llm8_g3,0,
2026-03-03T03:42:38.329245+00:00,BUCKET,llm_style,eval,llm_style_eval_135,8,3072,3072,bf16,NVIDIA GeForce RTX 4060,c04,64,64,64,4,3,8,0.0,0.0,188.4160041809082,213.59616160392758,0.8013912865651356,7,-1,-1,llm8_g7,0,
2026-03-03T03:42:38.380612+00:00,BUCKET,llm_style,eval,llm_style_eval_136,4,2048,4096,bf16,NVIDIA GeForce RTX 4060,c04,64,64,64,4,3,8,0.0,0.0,240.03200232982635,343.1219094991684,0.279582986221088,7,-1,-1,llm8_g7,0,
2026-03-03T03:42:38.765218+00:00,BUCKET,llm_style,eval,llm_style_eval_137,4,8192,8192,bf16,NVIDIA GeForce RTX 4060,c06,64,128,32,4,3,8,0.0,0.0,1199.6159553527832,1324.6156919002533,0.4475356547271972,4,-1,-1,llm8_g4,0,
2026-03-03T03:42:38.781226+00:00,BUCKET,llm_style,eval,llm_style_eval_138,16,1024,1024,bf16,NVIDIA GeForce RTX 4060,c04,64,64,64,4,3,8,0.0,0.0,70.592001080513,149.93408590555183,0.47532909517226785,7,-1,-1,llm8_g7,0,
2026-03-03T03:42:38.792037+00:00,BUCKET,llm_style,eval,llm_style_eval_139,4,1024,1024,bf16,NVIDIA GeForce RTX 4060,c04,64,64,64,4,3,8,0.0,0.0,65.98399952054024,163.8809558749199,0.12713094175791362,7,-1,-1,llm8_g7,0,
2026-03-03T03:42:38.937838+00:00,BUCKET,llm_style,eval,llm_style_eval_140,64,4096,6144,bf16,NVIDIA GeForce RTX 4060,c00,32,32,32,2,2,8,0.0,0.0,552.9439747333527,695.8694595098494,5.825591052969477,3,-1,-1,llm8_g3,0,
2026-03-03T03:42:39.070333+00:00,BUCKET,llm_style,eval,llm_style_eval_141,4,6144,4096,bf16,NVIDIA GeForce RTX 4060,c11,32,128,32,4,2,8,0.0,0.0,365.56801199913025,477.82912135124207,0.5507226709991218,5,-1,-1,llm8_g5,0,
2026-03-03T03:42:39.144962+00:00,BUCKET,llm_style,eval,llm_style_eval_142,4,2048,6144,bf16,NVIDIA GeForce RTX 4060,c04,64,64,64,4,3,8,0.0,0.0,319.487988948822,336.9164824485779,0.31507693397552106,7,-1,-1,llm8_g7,0,
2026-03-03T03:42:39.227839+00:00,BUCKET,llm_style,eval,llm_style_eval_143,64,1536,8192,bf16,NVIDIA GeForce RTX 4060,c10,64,128,64,8,3,8,0.0,0.0,416.76801443099976,465.68449229001993,3.86453057871756,2,-1,-1,llm8_g2,0,
2026-03-03T03:42:39.283041+00:00,BUCKET,llm_style,eval,llm_style_eval_144,1,3072,3072,bf16,NVIDIA GeForce RTX 4060,c04,64,64,64,4,3,8,0.0,0.0,175.10400712490082,199.41311642527575,0.10778946929830684,7,-1,-1,llm8_g7,0,
2026-03-03T03:42:39.301515+00:00,BUCKET,llm_style,eval,llm_style_eval_145,32,1024,2048,bf16,NVIDIA GeForce RTX 4060,c04,64,64,64,4,3,8,0.0,0.0,84.99199897050858,102.42047742009163,1.579180742019873,7,-1,-1,llm8_g7,0,
2026-03-03T03:42:39.486806+00:00,BUCKET,llm_style,eval,llm_style_eval_146,64,8192,4096,bf16,NVIDIA GeForce RTX 4060,c06,64,128,32,4,3,8,0.0,0.0,598.0000197887421,637.0102423429489,7.182219320857717,1,-1,-1,llm8_g1,0,
2026-03-03T03:42:39.548552+00:00,BUCKET,llm_style,eval,llm_style_eval_147,64,2048,4096,bf16,NVIDIA GeForce RTX 4060,c00,32,32,32,2,2,8,0.0,0.0,234.3679964542389,308.9545521140098,4.581435350579752,3,-1,-1,llm8_g3,0,
2026-03-03T03:42:39.584843+00:00,BUCKET,llm_style,eval,llm_style_eval_148,64,1024,6144,bf16,NVIDIA GeForce RTX 4060,c00,32,32,32,2,2,8,0.0,0.0,202.7519941329956,316.2713471055029,3.9718789028124557,3,-1,-1,llm8_g3,0,
2026-03-03T03:42:39.777530+00:00,BUCKET,llm_style,eval,llm_style_eval_149,64,4096,8192,bf16,NVIDIA GeForce RTX 4060,c10,64,128,64,8,3,8,0.0,0.0,768.0000066757202,813.8671910762787,5.592405284722223,2,-1,-1,llm8_g2,0,
2026-03-03T03:42:39.810207+00:00,BUCKET,llm_style,eval,llm_style_eval_150,2,2048,3072,bf16,NVIDIA GeForce RTX 4060,c04,64,64,64,4,3,8,0.0,0.0,174.0799993276596,270.79071819782246,0.1445647064406979,7,-1,-1,llm8_g7,0,
2026-03-03T03:42:39.854838+00:00,BUCKET,llm_style,eval,llm_style_eval_151,64,4096,2048,bf16,NVIDIA GeForce RTX 4060,c00,32,32,32,2,2,8,0.0,0.0,205.74399828910828,287.805440723896,5.218824524306147,3,-1,-1,llm8_g3,0,
2026-03-03T03:42:40.201279+00:00,BUCKET,llm_style,eval,llm_style_eval_152,8,8192,8192,bf16,NVIDIA GeForce RTX 4060,c06,64,128,32,4,3,8,0.0,0.0,1105.9199571609497,1201.0598623752594,0.9709037413127478,4,-1,-1,llm8_g4,0,
2026-03-03T03:42:40.294857+00:00,BUCKET,llm_style,eval,llm_style_eval_153,64,8192,2048,bf16,NVIDIA GeForce RTX 4060,c06,64,128,32,4,3,8,0.0,0.0,303.1040132045746,381.32735103368736,7.084972664319673,1,-1,-1,llm8_g1,0,
2026-03-03T03:42:40.393407+00:00,BUCKET,llm_style,eval,llm_style_eval_154,16,2048,8192,bf16,NVIDIA GeForce RTX 4060,c04,64,64,64,4,3,8,0.0,0.0,414.71999883651733,538.9231771230698,1.294538275236721,6,-1,-1,llm8_g6,0,
2026-03-03T03:42:40.420927+00:00,BUCKET,llm_style,eval,llm_style_eval_155,4,2048,1536,bf16,NVIDIA GeForce RTX 4060,c04,64,64,64,4,3,8,0.0,0.0,124.32000041007996,230.56383609771726,0.20242779856007412,7,-1,-1,llm8_g7,0,
2026-03-03T03:42:40.556623+00:00,BUCKET,llm_style,eval,llm_style_eval_156,1,4096,6144,bf16,NVIDIA GeForce RTX 4060,c04,64,64,64,4,3,8,0.0,0.0,452.60798931121826,586.7254555225372,0.11120362253568485,7,-1,-1,llm8_g7,0,
2026-03-03T03:42:40.637957+00:00,BUCKET,llm_style,eval,llm_style_eval_157,1,1536,8192,bf16,NVIDIA GeForce RTX 4060,c04,64,64,64,4,3,8,0.0,0.0,275.34399926662445,335.09376138448715,0.09139775723105961,6,-1,-1,llm8_g6,0,
2026-03-03T03:42:40.728869+00:00,BUCKET,llm_style,eval,llm_style_eval_158,64,1536,8192,bf16,NVIDIA GeForce RTX 4060,c10,64,128,64,8,3,8,0.0,0.0,486.30398511886597,663.2754945755003,3.3119464065389517,2,-1,-1,llm8_g2,0,
2026-03-03T03:42:40.783873+00:00,BUCKET,llm_style,eval,llm_style_eval_159,16,6144,1536,bf16,NVIDIA GeForce RTX 4060,c11,32,128,32,4,2,8,0.0,0.0,106.49599879980087,194.76127400994295,2.835692339650273,5,-1,-1,llm8_g5,0,
2026-03-03T03:42:40.980351+00:00,BUCKET,llm_style,eval,llm_style_eval_160,32,6144,6144,bf16,NVIDIA GeForce RTX 4060,c11,32,128,32,4,2,8,0.0,0.0,536.5279912948608,571.9491118192673,4.502876165266611,5,-1,-1,llm8_g5,0,
2026-03-03T03:42:41.013792+00:00,BUCKET,llm_style,eval,llm_style_eval_161,2,1536,4096,bf16,NVIDIA GeForce RTX 4060,c04,64,64,64,4,3,8,0.0,0.0,155.64799308776855,313.38494688272476,0.1616842177066119,7,-1,-1,llm8_g7,0,
2026-03-03T03:42:41.039214+00:00,BUCKET,llm_style,eval,llm_style_eval_162,64,1536,3072,bf16,NVIDIA GeForce RTX 4060,c00,32,32,32,2,2,8,0.0,0.0,143.2960033416748,160.78847482800484,4.214910129488199,3,-1,-1,llm8_g3,0,
2026-03-03T03:42:41.101429+00:00,BUCKET,llm_style,eval,llm_style_eval_163,64,1024,8192,bf16,NVIDIA GeForce RTX 4060,c10,64,128,64,8,3,8,0.0,0.0,488.44799399375916,627.8656077384948,2.1982725637188696,2,-1,-1,llm8_g2,0,
2026-03-03T03:42:41.307114+00:00,BUCKET,llm_style,eval,llm_style_eval_164,64,4096,8192,bf16,NVIDIA GeForce RTX 4060,c10,64,128,64,8,3,8,0.0,0.0,921.5680062770844,1032.212471961975,4.660499568936476,2,-1,-1,llm8_g2,0,
2026-03-03T03:42:41.443217+00:00,BUCKET,llm_style,eval,llm_style_eval_165,4,8192,3072,bf16,NVIDIA GeForce RTX 4060,c11,32,128,32,4,2,8,0.0,0.0,367.1039938926697,417.9932823777198,0.5484184191656108,5,-1,-1,llm8_g5,0,
2026-03-03T03:42:41.487571+00:00,BUCKET,llm_style,eval,llm_style_eval_166,64,1024,6144,bf16,NVIDIA GeForce RTX 4060,c00,32,32,32,2,2,8,0.0,0.0,223.23200106620789,260.7411226630211,3.607486221301918,3,-1,-1,llm8_g3,0,
2026-03-03T03:42:41.501714+00:00,BUCKET,llm_style,eval,llm_style_eval_167,2,2048,1024,bf16,NVIDIA GeForce RTX 4060,c04,64,64,64,4,3,8,0.0,0.0,92.16000139713287,154.01792272925377,0.09102222084233792,7,-1,-1,llm8_g7,0,
2026-03-03T03:42:41.525456+00:00,BUCKET,llm_style,eval,llm_style_eval_168,64,4096,1024,bf16,NVIDIA GeForce RTX 4060,c00,32,32,32,2,2,8,0.0,0.0,136.19199395179749,189.66943651437742,3.9420152126564427,3,-1,-1,llm8_g3,0,
2026-03-03T03:42:41.576110+00:00,BUCKET,llm_style,eval,llm_style_eval_169,4,1536,6144,bf16,NVIDIA GeForce RTX 4060,c04,64,64,64,4,3,8,0.0,0.0,231.4240038394928,347.8015947341919,0.3262300830831804,7,-1,-1,llm8_g7,0,
2026-03-03T03:42:41.597623+00:00,BUCKET,llm_style,eval,llm_style_eval_170,16,1536,1536,bf16,NVIDIA GeForce RTX 4060,c04,64,64,64,4,3,8,0.0,0.0,101.31199657917023,678.8402964174728,0.7451977509988417,7,-1,-1,llm8_g7,0,
2026-03-03T03:42:41.637006+00:00,BUCKET,llm_style,eval,llm_style_eval_171,1,2048,3072,bf16,NVIDIA GeForce RTX 4060,c04,64,64,64,4,3,8,0.0,0.0,190.46400487422943,307.7939197421073,0.06606451443835265,7,-1,-1,llm8_g7,0,
2026-03-03T03:42:41.673163+00:00,BUCKET,llm_style,eval,llm_style_eval_172,64,3072,2048,bf16,NVIDIA GeForce RTX 4060,c00,32,32,32,2,2,8,0.0,0.0,197.04000651836395,315.5766379833221,4.087019596829673,3,-1,-1,llm8_g3,0,
2026-03-03T03:42:41.965919+00:00,BUCKET,llm_style,eval,llm_style_eval_173,64,8192,6144,bf16,NVIDIA GeForce RTX 4060,c06,64,128,32,4,3,8,0.0,0.0,1152.5119543075562,1298.0223846435547,5.589921145651549,1,-1,-1,llm8_g1,0,
2026-03-03T03:42:42.065699+00:00,BUCKET,llm_style,eval,llm_style_eval_174,2,4096,4096,bf16,NVIDIA GeForce RTX 4060,c04,64,64,64,4,3,8,0.0,0.0,415.74400663375854,524.2310458421707,0.1614187166361684,7,-1,-1,llm8_g7,0,
2026-03-03T03:42:42.117106+00:00,BUCKET,llm_style,eval,llm_style_eval_175,64,4096,2048,bf16,NVIDIA GeForce RTX 4060,c00,32,32,32,2,2,8,0.0,0.0,295.9359884262085,435.9270417690275,3.628290799338645,3,-1,-1,llm8_g3,0,
2026-03-03T03:42:42.186194+00:00,BUCKET,llm_style,eval,llm_style_eval_176,16,6144,2048,bf16,NVIDIA GeForce RTX 4060,c11,32,128,32,4,2,8,0.0,0.0,162.81600296497345,222.14879587292668,2.4730565587377953,5,-1,-1,llm8_g5,0,
2026-03-03T03:42:42.236809+00:00,BUCKET,llm_style,eval,llm_style_eval_177,1,6144,1536,bf16,NVIDIA GeForce RTX 4060,c11,32,128,32,4,2,8,0.0,0.0,123.23199957609177,127.76096060872078,0.1531612573432738,5,-1,-1,llm8_g5,0,
2026-03-03T03:42:42.516596+00:00,BUCKET,llm_style,eval,llm_style_eval_178,32,6144,8192,bf16,NVIDIA GeForce RTX 4060,c06,64,128,32,4,3,8,0.0,0.0,974.8480021953583,1083.0233764648435,3.3043361270124145,4,-1,-1,llm8_g4,0,
2026-03-03T03:42:42.696003+00:00,BUCKET,llm_style,eval,llm_style_eval_179,64,4096,6144,bf16,NVIDIA GeForce RTX 4060,c00,32,32,32,2,2,8,0.0,0.0,735.2319955825806,852.490234375,4.381236795125567,3,-1,-1,llm8_g3,0,
2026-03-03T03:42:42.720826+00:00,BUCKET,llm_style,eval,llm_style_eval_180,64,2048,1536,bf16,NVIDIA GeForce RTX 4060,c00,32,32,32,2,2,8,0.0,0.0,121.85599654912949,135.64800441265106,3.304336228030105,3,-1,-1,llm8_g3,0,
2026-03-03T03:42:42.757106+00:00,BUCKET,llm_style,eval,llm_style_eval_181,64,2048,3072,bf16,NVIDIA GeForce RTX 4060,c00,32,32,32,2,2,8,0.0,0.0,209.3759998679161,255.2422367036342,3.8462210019678658,3,-1,-1,llm8_g3,0,
2026-03-03T03:42:42.783637+00:00,BUCKET,llm_style,eval,llm_style_eval_182,32,3072,1536,bf16,NVIDIA GeForce RTX 4060,c04,64,64,64,4,3,8,0.0,0.0,132.09599256515503,191.01696491241444,2.2861396635560043,7,-1,-1,llm8_g7,0,
2026-03-03T03:42:42.873978+00:00,BUCKET,llm_style,eval,llm_style_eval_183,8,8192,2048,bf16,NVIDIA GeForce RTX 4060,c11,32,128,32,4,2,8,0.0,0.0,258.88000428676605,384.5727998018265,1.0369107368472121,5,-1,-1,llm8_g5,0,
2026-03-03T03:42:42.919259+00:00,BUCKET,llm_style,eval,llm_style_eval_184,64,8192,1024,bf16,NVIDIA GeForce RTX 4060,c06,64,128,32,4,3,8,0.0,0.0,219.12000328302383,340.76927453279495,4.900245563674594,1,-1,-1,llm8_g1,0,
2026-03-03T03:42:42.994181+00:00,BUCKET,llm_style,eval,llm_style_eval_185,1,8192,1536,bf16,NVIDIA GeForce RTX 4060,c11,32,128,32,4,2,8,0.0,0.0,225.2800017595291,251.06687426567072,0.11170909003659714,5,-1,-1,llm8_g5,0,
2026-03-03T03:42:43.028472+00:00,BUCKET,llm_style,eval,llm_style_eval_186,16,6144,1024,bf16,NVIDIA GeForce RTX 4060,c11,32,128,32,4,2,8,0.0,0.0,117.76000261306763,249.1596743464467,1.7096347446722893,5,-1,-1,llm8_g5,0,
2026-03-03T03:42:43.070641+00:00,BUCKET,llm_style,eval,llm_style_eval_187,1,1024,6144,bf16,NVIDIA GeForce RTX 4060,c04,64,64,64,4,3,8,0.0,0.0,271.8240022659302,314.4806456565856,0.046290658275607015,7,-1,-1,llm8_g7,0,
2026-03-03T03:42:43.246418+00:00,BUCKET,llm_style,eval,llm_style_eval_188,8,8192,4096,bf16,NVIDIA GeForce RTX 4060,c11,32,128,32,4,2,8,0.0,0.0,479.2320132255554,611.512326002121,1.1202734733568733,5,-1,-1,llm8_g5,0,
2026-03-03T03:42:43.356999+00:00,BUCKET,llm_style,eval,llm_style_eval_189,8,2048,8192,bf16,NVIDIA GeForce RTX 4060,c04,64,64,64,4,3,8,0.0,0.0,550.9120225906372,631.5030401945112,0.487256485595822,6,-1,-1,llm8_g6,0,
2026-03-03T03:42:43.448535+00:00,BUCKET,llm_style,eval,llm_style_eval_190,4,8192,2048,bf16,NVIDIA GeForce RTX 4060,c11,32,128,32,4,2,8,0.0,0.0,256.78400695323944,356.52606964111294,0.522687256081494,5,-1,-1,llm8_g5,0,
2026-03-03T03:42:43.844285+00:00,BUCKET,llm_style,eval,llm_style_eval_191,4,8192,8192,bf16,NVIDIA GeForce RTX 4060,c06,64,128,32,4,3,8,0.0,0.0,1483.6480021476746,1604.5552015304565,0.3618586829374928,4,-1,-1,llm8_g4,0,
2026-03-03T03:42:43.862891+00:00,BUCKET,llm_style,eval,llm_style_eval_192,64,1536,1024,bf16,NVIDIA GeForce RTX 4060,c00,32,32,32,2,2,8,0.0,0.0,81.77600055932999,177.96096429228777,2.461927590282847,3,-1,-1,llm8_g3,0,
2026-03-03T03:42:43.887706+00:00,BUCKET,llm_style,eval,llm_style_eval_193,32,2048,2048,bf16,NVIDIA GeForce RTX 4060,c04,64,64,64,4,3,8,0.0,0.0,129.02399897575378,182.60991811752302,2.0805079530238744,7,-1,-1,llm8_g7,0,
2026-03-03T03:42:43.901203+00:00,BUCKET,llm_style,eval,llm_style_eval_194,8,1024,2048,bf16,NVIDIA GeForce RTX 4060,c04,64,64,64,4,3,8,0.0,0.0,83.35999771952629,91.15648105740547,0.40252438721144773,7,-1,-1,llm8_g7,0,
2026-03-03T03:42:43.943779+00:00,BUCKET,llm_style,eval,llm_style_eval_195,2,4096,2048,bf16,NVIDIA GeForce RTX 4060,c04,64,64,64,4,3,8,0.0,0.0,181.2479943037033,265.3001481294632,0.1851299493211242,7,-1,-1,llm8_g7,0,
2026-03-03T03:42:43.998713+00:00,BUCKET,llm_style,eval,llm_style_eval_196,32,2048,4096,bf16,NVIDIA GeForce RTX 4060,c04,64,64,64,4,3,8,0.0,0.0,232.44799673557281,316.8972864747045,2.3096387989556706,7,-1,-1,llm8_g7,0,
2026-03-03T03:42:44.063664+00:00,BUCKET,llm_style,eval,llm_style_eval_197,32,8192,1536,bf16,NVIDIA GeForce RTX 4060,c11,32,128,32,4,2,8,0.0,0.0,155.45600652694702,210.54495945572836,5.180284673403126,5,-1,-1,llm8_g5,0,
2026-03-03T03:42:44.260345+00:00,BUCKET,llm_style,eval,llm_style_eval_198,64,4096,8192,bf16,NVIDIA GeForce RTX 4060,c10,64,128,64,8,3,8,0.0,0.0,800.7200062274933,1045.4511827230447,5.363881584819241,2,-1,-1,llm8_g2,0,
2026-03-03T03:42:44.444815+00:00,BUCKET,llm_style,eval,llm_style_eval_199,2,8192,4096,bf16,NVIDIA GeForce RTX 4060,c11,32,128,32,4,2,8,0.0,0.0,472.57599234580994,586.6479969024658,0.2840130056835081,5,-1,-1,llm8_g5,0,
2026-03-03T03:42:44.467228+00:00,BUCKET,llm_style,eval,llm_style_eval_200,1,4096,1024,bf16,NVIDIA GeForce RTX 4060,c04,64,64,64,4,3,8,0.0,0.0,110.36799848079681,234.67007339000688,0.07600579982846707,7,-1,-1,llm8_g7,0,
2026-03-03T03:42:44.544094+00:00,BUCKET,llm_style,eval,llm_style_eval_201,4,1536,8192,bf16,NVIDIA GeForce RTX 4060,c04,64,64,64,4,3,8,0.0,0.0,256.00001215934753,305.37727892398834,0.3932159813232431,6,-1,-1,llm8_g6,0,
2026-03-03T03:42:44.646947+00:00,BUCKET,llm_style,eval,llm_style_eval_202,1,6144,3072,bf16,NVIDIA GeForce RTX 4060,c11,32,128,32,4,2,8,0.0,0.0,280.41599690914154,366.90944105386717,0.13461691350023475,5,-1,-1,llm8_g5,0,
2026-03-03T03:42:44.725609+00:00,BUCKET,llm_style,eval,llm_style_eval_203,16,2048,6144,bf16,NVIDIA GeForce RTX 4060,c04,64,64,64,4,3,8,0.0,0.0,330.7519853115082,348.3238387107849,1.2173870509674312,7,-1,-1,llm8_g7,0,
2026-03-03T03:42:44.737009+00:00,BUCKET,llm_style,eval,llm_style_eval_204,16,1536,1024,bf16,NVIDIA GeForce RTX 4060,c04,64,64,64,4,3,8,0.0,0.0,59.39200147986412,116.94079853594299,0.8474482547462914,7,-1,-1,llm8_g7,0,
2026-03-03T03:42:44.810710+00:00,BUCKET,llm_style,eval,llm_style_eval_205,64,6144,2048,bf16,NVIDIA GeForce RTX 4060,c06,64,128,32,4,3,8,0.0,0.0,227.13600099086761,357.24159002304066,7.090961930181898,1,-1,-1,llm8_g1,0,
2026-03-03T03:42:44.891191+00:00,BUCKET,llm_style,eval,llm_style_eval_206,4,2048,6144,bf16,NVIDIA GeForce RTX 4060,c04,64,64,64,4,3,8,0.0,0.0,332.8000009059906,370.6777623295783,0.30247384533041327,7,-1,-1,llm8_g7,0,
2026-03-03T03:42:44.940618+00:00,BUCKET,llm_style,eval,llm_style_eval_207,32,6144,1536,bf16,NVIDIA GeForce RTX 4060,c11,32,128,32,4,2,8,0.0,0.0,105.359997600317,136.8992003053426,5.732534071338882,5,-1,-1,llm8_g5,0,
2026-03-03T03:42:44.956444+00:00,BUCKET,llm_style,eval,llm_style_eval_208,4,2048,1024,bf16,NVIDIA GeForce RTX 4060,c04,64,64,64,4,3,8,0.0,0.0,90.5120000243187,177.83808425068852,0.18535902416798114,7,-1,-1,llm8_g7,0,
2026-03-03T03:42:44.968645+00:00,BUCKET,llm_style,eval,llm_style_eval_209,1,1024,1536,bf16,NVIDIA GeForce RTX 4060,c04,64,64,64,4,3,8,0.0,0.0,75.77600330114365,155.74015662074078,0.04151351170499808,7,-1,-1,llm8_g7,0,
2026-03-03T03:42:45.109369+00:00,BUCKET,llm_style,eval,llm_style_eval_210,8,6144,4096,bf16,NVIDIA GeForce RTX 4060,c11,32,128,32,4,2,8,0.0,0.0,366.36799573898315,463.0323126912117,1.0990402783076827,5,-1,-1,llm8_g5,0,
2026-03-03T03:42:45.220973+00:00,BUCKET,llm_style,eval,llm_style_eval_211,4,2048,8192,bf16,NVIDIA GeForce RTX 4060,c04,64,64,64,4,3,8,0.0,0.0,452.60798931121826,609.4335865974425,0.29654299342849294,6,-1,-1,llm8_g6,0,
2026-03-03T03:42:45.232639+00:00,BUCKET,llm_style,eval,llm_style_eval_212,32,1024,1024,bf16,NVIDIA GeForce RTX 4060,c04,64,64,64,4,3,8,0.0,0.0,82.76799693703651,100.25823965668678,0.8108069118919384,7,-1,-1,llm8_g7,0,
2026-03-03T03:42:45.304055+00:00,BUCKET,llm_style,eval,llm_style_eval_213,16,3072,4096,bf16,NVIDIA GeForce RTX 4060,c04,64,64,64,4,3,8,0.0,0.0,234.49599742889404,349.70625042915344,1.7171004555081844,7,-1,-1,llm8_g7,0,
2026-03-03T03:42:45.376268+00:00,BUCKET,llm_style,eval,llm_style_eval_214,64,1024,8192,bf16,NVIDIA GeForce RTX 4060,c10,64,128,64,8,3,8,0.0,0.0,435.12000143527985,548.3084899187088,2.4676912586370943,2,-1,-1,llm8_g2,0,
2026-03-03T03:42:45.413867+00:00,BUCKET,llm_style,eval,llm_style_eval_215,4,4096,1536,bf16,NVIDIA GeForce RTX 4060,c04,64,64,64,4,3,8,0.0,0.0,149.50400590896606,286.1670398712157,0.33665752094059115,7,-1,-1,llm8_g7,0,
2026-03-03T03:42:45.442101+00:00,BUCKET,llm_style,eval,llm_style_eval_216,16,1536,3072,bf16,NVIDIA GeForce RTX 4060,c04,64,64,64,4,3,8,0.0,0.0,121.85599654912949,198.63168716430664,1.2391260855112893,7,-1,-1,llm8_g7,0,
2026-03-03T03:42:45.508374+00:00,BUCKET,llm_style,eval,llm_style_eval_217,8,6144,2048,bf16,NVIDIA GeForce RTX 4060,c11,32,128,32,4,2,8,0.0,0.0,118.78399923443794,199.5776002109049,1.6948965626477346,5,-1,-1,llm8_g5,0,
2026-03-03T03:42:45.582652+00:00,BUCKET,llm_style,eval,llm_style_eval_218,8,3072,4096,bf16,NVIDIA GeForce RTX 4060,c04,64,64,64,4,3,8,0.0,0.0,235.52000522613525,296.94976717233646,0.8548173723361446,7,-1,-1,llm8_g7,0,
2026-03-03T03:42:45.736698+00:00,BUCKET,llm_style,eval,llm_style_eval_219,64,8192,3072,bf16,NVIDIA GeForce RTX 4060,c06,64,128,32,4,3,8,0.0,0.0,628.1599998474121,733.5670387744904,5.128033419483055,1,-1,-1,llm8_g1,0,
2026-03-03T03:42:45.781832+00:00,BUCKET,llm_style,eval,llm_style_eval_220,2,4096,2048,bf16,NVIDIA GeForce RTX 4060,c04,64,64,64,4,3,8,0.0,0.0,240.63999950885773,268.19391310214996,0.1394382981569317,7,-1,-1,llm8_g7,0,
2026-03-03T03:42:45.846646+00:00,BUCKET,llm_style,eval,llm_style_eval_221,4,1024,8192,bf16,NVIDIA GeForce RTX 4060,c04,64,64,64,4,3,8,0.0,0.0,350.20801424980164,515.1471948623656,0.19162572319698992,6,-1,-1,llm8_g6,0,
2026-03-03T03:42:45.931576+00:00,BUCKET,llm_style,eval,llm_style_eval_222,64,6144,2048,bf16,NVIDIA GeForce RTX 4060,c06,64,128,32,4,3,8,0.0,0.0,325.6320059299469,465.01343280076946,4.946113117475591,1,-1,-1,llm8_g1,0,
2026-03-03T03:42:45.959686+00:00,BUCKET,llm_style,eval,llm_style_eval_223,4,2048,2048,bf16,NVIDIA GeForce RTX 4060,c04,64,64,64,4,3,8,0.0,0.0,196.60800695419312,216.67039766907686,0.17066666063004093,7,-1,-1,llm8_g7,0,
2026-03-03T03:42:45.984900+00:00,BUCKET,llm_style,eval,llm_style_eval_224,16,3072,1536,bf16,NVIDIA GeForce RTX 4060,c04,64,64,64,4,3,8,0.0,0.0,136.19199395179749,237.1072021126747,1.1086917785596244,7,-1,-1,llm8_g7,0,
2026-03-03T03:42:46.010424+00:00,BUCKET,llm_style,eval,llm_style_eval_225,1,2048,2048,bf16,NVIDIA GeForce RTX 4060,c04,64,64,64,4,3,8,0.0,0.0,174.97600615024567,300.05088359117497,0.047941476003269846,7,-1,-1,llm8_g7,0,
2026-03-03T03:42:46.024663+00:00,BUCKET,llm_style,eval,llm_style_eval_226,8,1536,1024,bf16,NVIDIA GeForce RTX 4060,c04,64,64,64,4,3,8,0.0,0.0,88.57600018382072,182.1593582630157,0.28411560634679445,7,-1,-1,llm8_g7,0,
2026-03-03T03:42:46.245623+00:00,BUCKET,llm_style,eval,llm_style_eval_227,64,6144,6144,bf16,NVIDIA GeForce RTX 4060,c06,64,128,32,4,3,8,0.0,0.0,850.30397772789,989.9929565191268,5.682483364256659,1,-1,-1,llm8_g1,0,
2026-03-03T03:42:46.324471+00:00,BUCKET,llm_style,eval,llm_style_eval_228,64,6144,2048,bf16,NVIDIA GeForce RTX 4060,c06,64,128,32,4,3,8,0.0,0.0,321.3919997215271,433.30976843833923,5.011365365023178,1,-1,-1,llm8_g1,0,
2026-03-03T03:42:46.405533+00:00,BUCKET,llm_style,eval,llm_style_eval_229,16,1536,8192,bf16,NVIDIA GeForce RTX 4060,c04,64,64,64,4,3,8,0.0,0.0,370.6879913806915,467.93536871671677,1.0862320694561713,6,-1,-1,llm8_g6,0,
2026-03-03T03:42:46.430284+00:00,BUCKET,llm_style,eval,llm_style_eval_230,64,2048,1536,bf16,NVIDIA GeForce RTX 4060,c00,32,32,32,2,2,8,0.0,0.0,146.43199741840363,216.7545543611049,2.749762286240551,3,-1,-1,llm8_g3,0,
2026-03-03T03:42:46.494137+00:00,BUCKET,llm_style,eval,llm_style_eval_231,4,1024,8192,bf16,NVIDIA GeForce RTX 4060,c04,64,64,64,4,3,8,0.0,0.0,364.54400420188904,431.1654442548752,0.1840898855185512,6,-1,-1,llm8_g6,0,
2026-03-03T03:42:46.520273+00:00,BUCKET,llm_style,eval,llm_style_eval_232,16,3072,1536,bf16,NVIDIA GeForce RTX 4060,c04,64,64,64,4,3,8,0.0,0.0,151.5520066022873,166.91423952579495,0.996324280919954,7,-1,-1,llm8_g7,0,
2026-03-03T03:42:46.584776+00:00,BUCKET,llm_style,eval,llm_style_eval_233,64,3072,3072,bf16,NVIDIA GeForce RTX 4060,c00,32,32,32,2,2,8,0.0,0.0,331.7759931087494,486.97216778993595,3.6408889645130396,3,-1,-1,llm8_g3,0,
2026-03-03T03:42:46.780816+00:00,BUCKET,llm_style,eval,llm_style_eval_234,32,8192,4096,bf16,NVIDIA GeForce RTX 4060,c11,32,128,32,4,2,8,0.0,0.0,529.2799770832062,562.2374588251114,4.05736801122632,5,-1,-1,llm8_g5,0,
2026-03-03T03:42:46.798174+00:00,BUCKET,llm_style,eval,llm_style_eval_235,4,2048,1024,bf16,NVIDIA GeForce RTX 4060,c04,64,64,64,4,3,8,0.0,0.0,114.08000066876411,225.99424496293062,0.14706535678162666,7,-1,-1,llm8_g7,0,
2026-03-03T03:42:46.934668+00:00,BUCKET,llm_style,eval,llm_style_eval_236,4,8192,3072,bf16,NVIDIA GeForce RTX 4060,c11,32,128,32,4,2,8,0.0,0.0,444.35200095176697,536.3199907541273,0.4530790714766093,5,-1,-1,llm8_g5,0,
2026-03-03T03:42:46.966841+00:00,BUCKET,llm_style,eval,llm_style_eval_237,64,1024,4096,bf16,NVIDIA GeForce RTX 4060,c00,32,32,32,2,2,8,0.0,0.0,215.96800535917282,312.7910339832305,2.4858816985744663,3,-1,-1,llm8_g3,0,
2026-03-03T03:42:47.061723+00:00,BUCKET,llm_style,eval,llm_style_eval_238,32,2048,6144,bf16,NVIDIA GeForce RTX 4060,c04,64,64,64,4,3,8,0.0,0.0,531.4559936523438,655.5443036556244,1.515283255092608,7,-1,-1,llm8_g7,0,
2026-03-03T03:42:47.096668+00:00,BUCKET,llm_style,eval,llm_style_eval_239,32,2048,6144,bf16,NVIDIA GeForce RTX 4060,c04,64,64,64,4,3,8,0.0,0.0,532.480001449585,642.0851355791092,1.5123692266520663,7,-1,-1,llm8_g7,0,
2026-03-03T03:42:47.167419+00:00,BUCKET,llm_style,eval,llm_style_eval_240,8,8192,1536,bf16,NVIDIA GeForce RTX 4060,c11,32,128,32,4,2,8,0.0,0.0,213.9200046658516,288.2662296295166,0.9411302711706517,5,-1,-1,llm8_g5,0,
2026-03-03T03:42:47.183115+00:00,BUCKET,llm_style,eval,llm_style_eval_241,16,1536,1536,bf16,NVIDIA GeForce RTX 4060,c04,64,64,64,4,3,8,0.0,0.0,91.13600105047226,143.70528079569326,0.8284044848334805,7,-1,-1,llm8_g7,0,
2026-03-03T03:42:47.220302+00:00,BUCKET,llm_style,eval,llm_style_eval_242,1,2048,3072,bf16,NVIDIA GeForce RTX 4060,c04,64,64,64,4,3,8,0.0,0.0,244.22399699687958,347.4227258563041,0.051522013212161,7,-1,-1,llm8_g7,0,
2026-03-03T03:42:47.272917+00:00,BUCKET,llm_style,eval,llm_style_eval_243,8,1536,6144,bf16,NVIDIA GeForce RTX 4060,c04,64,64,64,4,3,8,0.0,0.0,267.2640085220337,378.92096906900406,0.5649654992267757,7,-1,-1,llm8_g7,0,
2026-03-03T03:42:47.323720+00:00,BUCKET,llm_style,eval,llm_style_eval_244,32,8192,1024,bf16,NVIDIA GeForce RTX 4060,c11,32,128,32,4,2,8,0.0,0.0,159.72799807786942,230.52287608385083,3.3611572076316176,5,-1,-1,llm8_g5,0,
2026-03-03T03:42:47.454293+00:00,BUCKET,llm_style,eval,llm_style_eval_245,4,6144,4096,bf16,NVIDIA GeForce RTX 4060,c11,32,128,32,4,2,8,0.0,0.0,369.6640133857727,448.7782427668571,0.5446204788938984,5,-1,-1,llm8_g5,0,
2026-03-03T03:42:47.541065+00:00,BUCKET,llm_style,eval,llm_style_eval_246,32,2048,6144,bf16,NVIDIA GeForce RTX 4060,c04,64,64,64,4,3,8,0.0,0.0,456.6880017518997,540.0575959682463,1.7633622186498579,7,-1,-1,llm8_g7,0,
2026-03-03T03:42:47.620695+00:00,BUCKET,llm_style,eval,llm_style_eval_247,64,6144,2048,bf16,NVIDIA GeForce RTX 4060,c06,64,128,32,4,3,8,0.0,0.0,302.0800054073334,376.08447670936573,5.33174227744138,1,-1,-1,llm8_g1,0,
2026-03-03T03:42:47.636985+00:00,BUCKET,llm_style,eval,llm_style_eval_248,64,1024,1024,bf16,NVIDIA GeForce RTX 4060,c00,32,32,32,2,2,8,0.0,0.0,101.23199969530106,197.7958399057388,1.3258428995177702,3,-1,-1,llm8_g3,0,
2026-03-03T03:42:47.685500+00:00,BUCKET,llm_style,eval,llm_style_eval_249,2,8192,1024,bf16,NVIDIA GeForce RTX 4060,c11,32,128,32,4,2,8,0.0,0.0,155.64799308776855,198.1523141264915,0.21557895694214924,5,-1,-1,llm8_g5,0,
2026-03-03T03:42:47.750050+00:00,BUCKET,llm_style,eval,llm_style_eval_250,64,3072,3072,bf16,NVIDIA GeForce RTX 4060,c00,32,32,32,2,2,8,0.0,0.0,313.34400177001953,407.7302470803261,3.8550588017529317,3,-1,-1,llm8_g3,0,
2026-03-03T03:42:47.828931+00:00,BUCKET,llm_style,eval,llm_style_eval_251,64,1024,8192,bf16,NVIDIA GeForce RTX 4060,c10,64,128,64,8,3,8,0.0,0.0,601.0879874229431,807.4857676029202,1.7863305314143365,2,-1,-1,llm8_g2,0,
2026-03-03T03:42:47.911433+00:00,BUCKET,llm_style,eval,llm_style_eval_252,64,4096,3072,bf16,NVIDIA GeForce RTX 4060,c00,32,32,32,2,2,8,0.0,0.0,415.23200273513794,533.461754322052,3.878826115017329,3,-1,-1,llm8_g3,0,
2026-03-03T03:42:48.044374+00:00,BUCKET,llm_style,eval,llm_style_eval_253,8,6144,4096,bf16,NVIDIA GeForce RTX 4060,c11,32,128,32,4,2,8,0.0,0.0,369.1200017929077,474.0227270126343,1.0908462885896546,5,-1,-1,llm8_g5,0,
2026-03-03T03:42:48.072861+00:00,BUCKET,llm_style,eval,llm_style_eval_254,4,1536,3072,bf16,NVIDIA GeForce RTX 4060,c04,64,64,64,4,3,8,0.0,0.0,150.88000148534775,246.1532773077487,0.2501904535285006,7,-1,-1,llm8_g7,0,
2026-03-03T03:42:48.098200+00:00,BUCKET,llm_style,eval,llm_style_eval_255,1,3072,1536,bf16,NVIDIA GeForce RTX 4060,c04,64,64,64,4,3,8,0.0,0.0,138.08000087738037,235.34592881798739,0.06834577013350784,7,-1,-1,llm8_g7,0,
