results/llm_full_vs_bucket_v2.csv
timestamp,method,workload,split,shape_id,M,N,K,dtype,gpu,config_id,BLOCK_M,BLOCK_N,BLOCK_K,num_warps,num_stages,GROUP_M,compile_time_ms,tune_time_ms,runtime_cost_us,p99_us,runtime_perf_tflops,bucket_m,bucket_n,bucket_k,cache_key,invalid_config,notes
2026-03-03T03:09:04.810806+00:00,FULL,llm_style,tune,llm_style_tune_000,64,4096,1536,bf16,NVIDIA GeForce RTX 4060,c04,64,64,64,4,3,8,1.8610750557854772,556.479,64.35199826955795,108.66912260651584,12.514084871564188,2,-1,-1,64x4096x1536,0,
2026-03-03T03:09:04.896833+00:00,FULL,llm_style,tune,llm_style_tune_001,32,3072,1536,bf16,NVIDIA GeForce RTX 4060,c11,32,128,32,4,2,8,0.0,85.991,48.928000032901764,53.790719583630555,6.17212818420794,3,-1,-1,32x3072x1536,0,
2026-03-03T03:09:05.020265+00:00,FULL,llm_style,tune,llm_style_tune_002,1,4096,1536,bf16,NVIDIA GeForce RTX 4060,c11,32,128,32,4,2,8,0.0,123.394,49.15200173854828,53.75391945242882,0.2559999909450614,6,-1,-1,1x4096x1536,0,
2026-03-03T03:09:05.178407+00:00,FULL,llm_style,tune,llm_style_tune_003,32,6144,2048,bf16,NVIDIA GeForce RTX 4060,c11,32,128,32,4,2,8,0.0,158.106,76.7040029168129,86.01823918521404,10.498883205265985,0,-1,-1,32x6144x2048,0,
2026-03-03T03:09:05.210815+00:00,FULL,llm_style,tune,llm_style_tune_004,64,4096,1536,bf16,NVIDIA GeForce RTX 4060,c04,64,64,64,4,3,8,0.0,0.0,73.72800260782242,184.92064177989954,10.92266628032262,2,-1,-1,64x4096x1536,0,
2026-03-03T03:09:05.641609+00:00,FULL,llm_style,tune,llm_style_tune_005,64,8192,4096,bf16,NVIDIA GeForce RTX 4060,c10,64,128,64,8,3,8,0.0,430.739,303.1040132045746,348.2336062192917,14.169945328639345,1,-1,-1,64x8192x4096,0,
2026-03-03T03:09:06.207934+00:00,FULL,llm_style,tune,llm_style_tune_006,16,6144,8192,bf16,NVIDIA GeForce RTX 4060,c06,64,128,32,4,3,8,0.0,566.286,425.00799894332886,472.9763188958168,3.789605701550011,5,-1,-1,16x6144x8192,0,
2026-03-03T03:09:06.463305+00:00,FULL,llm_style,tune,llm_style_tune_007,8,8192,2048,bf16,NVIDIA GeForce RTX 4060,c06,64,128,32,4,3,8,0.0,255.325,163.83999586105347,175.49983873963356,1.6384000413894664,4,-1,-1,8x8192x2048,0,
2026-03-03T03:09:06.551104+00:00,FULL,llm_style,tune,llm_style_tune_008,16,1536,3072,bf16,NVIDIA GeForce RTX 4060,c04,64,64,64,4,3,8,0.0,87.761,51.16799846291542,61.48096028715371,2.9509644413672986,7,-1,-1,16x1536x3072,0,
2026-03-03T03:09:06.866841+00:00,FULL,llm_style,tune,llm_style_tune_009,2,6144,4096,bf16,NVIDIA GeForce RTX 4060,c11,32,128,32,4,2,8,0.0,315.698,226.6559973359108,258.72639343142504,0.4441236816284815,5,-1,-1,2x6144x4096,0,
2026-03-03T03:09:07.253430+00:00,FULL,llm_style,tune,llm_style_tune_010,4,8192,4096,bf16,NVIDIA GeForce RTX 4060,c11,32,128,32,4,2,8,0.0,386.547,290.8160090446472,305.5008015036583,0.9230422248136578,5,-1,-1,4x8192x4096,0,
2026-03-03T03:09:07.321116+00:00,FULL,llm_style,tune,llm_style_tune_011,1,1024,1536,bf16,NVIDIA GeForce RTX 4060,c04,64,64,64,4,3,8,0.0,67.645,41.919998824596405,127.54943817853916,0.07504122347814225,7,-1,-1,1x1024x1536,0,
2026-03-03T03:09:07.407335+00:00,FULL,llm_style,tune,llm_style_tune_012,64,6144,1024,bf16,NVIDIA GeForce RTX 4060,c10,64,128,64,8,3,8,0.0,86.18,54.127998650074005,63.00671897828578,14.877815328184113,0,-1,-1,64x6144x1024,0,
2026-03-03T03:09:07.705576+00:00,FULL,llm_style,tune,llm_style_tune_013,4,8192,3072,bf16,NVIDIA GeForce RTX 4060,c11,32,128,32,4,2,8,0.0,298.199,225.93600302934647,328.25343877077074,0.891077957034807,4,-1,-1,4x8192x3072,0,
2026-03-03T03:09:07.814664+00:00,FULL,llm_style,tune,llm_style_tune_014,8,4096,2048,bf16,NVIDIA GeForce RTX 4060,c11,32,128,32,4,2,8,0.0,109.05,53.247999399900436,60.477439947426305,2.520615413022465,7,-1,-1,8x4096x2048,0,
2026-03-03T03:09:07.892244+00:00,FULL,llm_style,tune,llm_style_tune_015,16,4096,1024,bf16,NVIDIA GeForce RTX 4060,c11,32,128,32,4,2,8,0.0,77.538,40.95999896526337,56.30784019827843,3.2768000827789328,6,-1,-1,16x4096x1024,0,
2026-03-03T03:09:07.994668+00:00,FULL,llm_style,tune,llm_style_tune_016,32,8192,1024,bf16,NVIDIA GeForce RTX 4060,c02,32,64,32,2,2,8,0.0,102.378,49.15200173854828,53.247999399900436,10.92266628032262,0,-1,-1,32x8192x1024,0,
2026-03-03T03:09:08.123854+00:00,FULL,llm_style,tune,llm_style_tune_017,32,2048,4096,bf16,NVIDIA GeForce RTX 4060,c00,32,32,32,2,2,8,0.0,129.143,69.7920024394989,118.94815810024723,7.692441730202557,3,-1,-1,32x2048x4096,0,
2026-03-03T03:09:08.190600+00:00,FULL,llm_style,tune,llm_style_tune_018,32,3072,1024,bf16,NVIDIA GeForce RTX 4060,c11,32,128,32,4,2,8,0.0,66.704,41.96799919009209,55.96160024404523,4.797145346102886,2,-1,-1,32x3072x1024,0,
2026-03-03T03:09:08.269415+00:00,FULL,llm_style,tune,llm_style_tune_019,4,6144,1024,bf16,NVIDIA GeForce RTX 4060,c02,32,64,32,2,2,8,0.0,78.772,40.89600034058094,104.28416311740872,1.230722994445403,4,-1,-1,4x6144x1024,0,
2026-03-03T03:09:08.412390+00:00,FULL,llm_style,tune,llm_style_tune_020,32,3072,4096,bf16,NVIDIA GeForce RTX 4060,c04,64,64,64,4,3,8,0.0,142.928,80.89599758386612,85.37311807274818,9.95483574036066,3,-1,-1,32x3072x4096,0,
2026-03-03T03:09:08.717171+00:00,FULL,llm_style,tune,llm_style_tune_021,1,4096,6144,bf16,NVIDIA GeForce RTX 4060,c03,64,64,32,4,2,8,0.0,304.708,227.32800245285034,252.98944383859634,0.2214054030164594,7,-1,-1,1x4096x6144,0,
2026-03-03T03:09:08.946002+00:00,FULL,llm_style,tune,llm_style_tune_022,64,4096,4096,bf16,NVIDIA GeForce RTX 4060,c11,32,128,32,4,2,8,0.0,228.787,164.86400365829468,421.7116975784296,13.02578853083649,3,-1,-1,64x4096x4096,0,
2026-03-03T03:09:09.538606+00:00,FULL,llm_style,tune,llm_style_tune_023,1,8192,6144,bf16,NVIDIA GeForce RTX 4060,c11,32,128,32,4,2,8,0.0,592.561,424.9599874019623,489.8249489068984,0.23687711545601195,5,-1,-1,1x8192x6144,0,
2026-03-03T03:09:09.618717+00:00,FULL,llm_style,tune,llm_style_tune_024,4,4096,1024,bf16,NVIDIA GeForce RTX 4060,c11,32,128,32,4,2,8,0.0,80.069,40.271999314427376,56.76960114389656,0.8331950876841414,6,-1,-1,4x4096x1024,0,
2026-03-03T03:09:09.922802+00:00,FULL,llm_style,tune,llm_style_tune_025,64,8192,3072,bf16,NVIDIA GeForce RTX 4060,c10,64,128,64,8,3,8,0.0,304.042,236.41599714756012,284.6003231406211,13.625243261307133,0,-1,-1,64x8192x3072,0,
2026-03-03T03:09:10.020788+00:00,FULL,llm_style,tune,llm_style_tune_026,32,4096,1536,bf16,NVIDIA GeForce RTX 4060,c11,32,128,32,4,2,8,0.0,97.946,47.10400104522705,55.31648010015487,8.548173723361447,2,-1,-1,32x4096x1536,0,
2026-03-03T03:09:10.081657+00:00,FULL,llm_style,tune,llm_style_tune_027,64,3072,1024,bf16,NVIDIA GeForce RTX 4060,c06,64,128,32,4,3,8,0.0,60.825,40.95999896526337,84.07392054796213,9.8304002483368,2,-1,-1,64x3072x1024,0,
2026-03-03T03:09:10.151769+00:00,FULL,llm_style,tune,llm_style_tune_028,32,6144,2048,bf16,NVIDIA GeForce RTX 4060,c11,32,128,32,4,2,8,0.0,0.0,54.27199974656105,142.53600105643272,14.838339691933468,0,-1,-1,32x6144x2048,0,
2026-03-03T03:09:10.234357+00:00,FULL,llm_style,tune,llm_style_tune_029,2,4096,1536,bf16,NVIDIA GeForce RTX 4060,c00,32,32,32,2,2,8,0.0,82.537,44.03200000524521,141.08671911060793,0.5715348836528475,6,-1,-1,2x4096x1536,0,
2026-03-03T03:09:10.325731+00:00,FULL,llm_style,tune,llm_style_tune_030,1,2048,3072,bf16,NVIDIA GeForce RTX 4060,c11,32,128,32,4,2,8,0.0,91.333,61.216000467538834,66.56000018119812,0.20554939728008487,7,-1,-1,1x2048x3072,0,
2026-03-03T03:09:10.350210+00:00,FULL,llm_style,tune,llm_style_tune_031,16,4096,1024,bf16,NVIDIA GeForce RTX 4060,c11,32,128,32,4,2,8,0.0,0.0,45.392001047730446,534.0160077810278,2.9568585852575175,6,-1,-1,16x4096x1024,0,
2026-03-03T03:09:10.365887+00:00,FULL,llm_style,tune,llm_style_tune_032,32,3072,1024,bf16,NVIDIA GeForce RTX 4060,c11,32,128,32,4,2,8,0.0,0.0,49.55199919641018,154.68544006347656,4.062935810157691,2,-1,-1,32x3072x1024,0,
2026-03-03T03:09:10.809693+00:00,FULL,llm_style,tune,llm_style_tune_033,64,6144,6144,bf16,NVIDIA GeForce RTX 4060,c09,128,64,64,8,3,8,0.0,443.761,316.880002617836,481.3619190454483,15.248163873020726,1,-1,-1,64x6144x6144,0,
2026-03-03T03:09:10.931379+00:00,FULL,llm_style,tune,llm_style_tune_034,64,2048,4096,bf16,NVIDIA GeForce RTX 4060,c03,64,64,32,4,2,8,0.0,121.645,76.80000364780426,82.48319812119006,13.981012669270863,3,-1,-1,64x2048x4096,0,
2026-03-03T03:09:10.975348+00:00,FULL,llm_style,tune,llm_style_tune_035,64,4096,1536,bf16,NVIDIA GeForce RTX 4060,c04,64,64,64,4,3,8,0.0,0.0,58.70399996638298,76.90239988267419,13.718083409327493,2,-1,-1,64x4096x1536,0,
2026-03-03T03:09:11.772184+00:00,FULL,llm_style,tune,llm_style_tune_036,32,8192,8192,bf16,NVIDIA GeForce RTX 4060,c11,32,128,32,4,2,8,0.0,796.755,560.1279735565186,641.5577685832977,7.6678321718681755,1,-1,-1,32x8192x8192,0,
2026-03-03T03:09:11.850019+00:00,FULL,llm_style,tune,llm_style_tune_037,32,6144,2048,bf16,NVIDIA GeForce RTX 4060,c11,32,128,32,4,2,8,0.0,0.0,75.69600269198418,332.37599223852095,10.638690807451024,0,-1,-1,32x6144x2048,0,
2026-03-03T03:09:12.153146+00:00,FULL,llm_style,tune,llm_style_tune_038,32,8192,3072,bf16,NVIDIA GeForce RTX 4060,c11,32,128,32,4,2,8,0.0,303.078,231.36000335216522,259.6761545538902,6.961500314072876,0,-1,-1,32x8192x3072,0,
2026-03-03T03:09:12.383343+00:00,FULL,llm_style,tune,llm_style_tune_039,4,6144,3072,bf16,NVIDIA GeForce RTX 4060,c11,32,128,32,4,2,8,0.0,230.158,178.01599949598312,229.75712656974784,0.8482099610569396,5,-1,-1,4x6144x3072,0,
2026-03-03T03:09:12.447996+00:00,FULL,llm_style,tune,llm_style_tune_040,8,3072,1024,bf16,NVIDIA GeForce RTX 4060,c00,32,32,32,2,2,8,0.0,64.614,37.6800000667572,687.2809749841671,1.3357656027289817,6,-1,-1,8x3072x1024,0,
2026-03-03T03:09:12.869855+00:00,FULL,llm_style,tune,llm_style_tune_041,8,6144,6144,bf16,NVIDIA GeForce RTX 4060,c06,64,128,32,4,3,8,0.0,421.817,325.9679973125458,402.0019218325614,1.852880592510712,5,-1,-1,8x6144x6144,0,
2026-03-03T03:09:12.949235+00:00,FULL,llm_style,tune,llm_style_tune_042,1,4096,1024,bf16,NVIDIA GeForce RTX 4060,c11,32,128,32,4,2,8,0.0,79.334,40.95999896526337,52.656319774687276,0.2048000051736833,6,-1,-1,1x4096x1024,0,
2026-03-03T03:09:13.282225+00:00,FULL,llm_style,tune,llm_style_tune_043,64,6144,4096,bf16,NVIDIA GeForce RTX 4060,c06,64,128,32,4,3,8,0.0,332.948,232.44799673557281,298.34655642509443,13.857832793734023,1,-1,-1,64x6144x4096,0,
2026-03-03T03:09:13.419102+00:00,FULL,llm_style,tune,llm_style_tune_044,8,6144,2048,bf16,NVIDIA GeForce RTX 4060,c11,32,128,32,4,2,8,0.0,136.834,58.36800113320351,63.916158601641655,3.4492630909279565,4,-1,-1,8x6144x2048,0,
2026-03-03T03:09:13.531381+00:00,FULL,llm_style,tune,llm_style_tune_045,2,3072,3072,bf16,NVIDIA GeForce RTX 4060,c00,32,32,32,2,2,8,0.0,112.236,54.27199974656105,179.35424119234082,0.6955471730593813,7,-1,-1,2x3072x3072,0,
2026-03-03T03:09:14.116905+00:00,FULL,llm_style,tune,llm_style_tune_046,16,8192,6144,bf16,NVIDIA GeForce RTX 4060,c11,32,128,32,4,2,8,0.0,585.48,425.82398653030396,463.8886398077011,3.782343848507886,5,-1,-1,16x8192x6144,0,
2026-03-03T03:09:14.224642+00:00,FULL,llm_style,tune,llm_style_tune_047,16,8192,1024,bf16,NVIDIA GeForce RTX 4060,c11,32,128,32,4,2,8,0.0,107.699,49.215998500585556,111.56416181474904,5.45423163560943,4,-1,-1,16x8192x1024,0,
2026-03-03T03:09:14.287663+00:00,FULL,llm_style,tune,llm_style_tune_048,32,2048,1024,bf16,NVIDIA GeForce RTX 4060,c11,32,128,32,4,2,8,0.0,62.977,41.63200035691261,94.03968080878238,3.2239077356203563,3,-1,-1,32x2048x1024,0,
2026-03-03T03:09:14.392921+00:00,FULL,llm_style,tune,llm_style_tune_049,8,8192,1024,bf16,NVIDIA GeForce RTX 4060,c11,32,128,32,4,2,8,0.0,105.216,48.128001391887665,129.46655765175797,2.7887658767941983,4,-1,-1,8x8192x1024,0,
2026-03-03T03:09:14.559168+00:00,FULL,llm_style,tune,llm_style_tune_050,64,8192,4096,bf16,NVIDIA GeForce RTX 4060,c10,64,128,64,8,3,8,0.0,0.0,304.1279911994934,386.34303569793695,14.122236098888731,1,-1,-1,64x8192x4096,0,
2026-03-03T03:09:14.676880+00:00,FULL,llm_style,tune,llm_style_tune_051,16,2048,4096,bf16,NVIDIA GeForce RTX 4060,c00,32,32,32,2,2,8,0.0,117.659,60.75200065970421,125.66720172762867,4.418545119256439,7,-1,-1,16x2048x4096,0,
2026-03-03T03:09:14.787695+00:00,FULL,llm_style,tune,llm_style_tune_052,32,3072,3072,bf16,NVIDIA GeForce RTX 4060,c00,32,32,32,2,2,8,0.0,110.771,60.32000109553337,67.65632078051567,10.01292713909987,3,-1,-1,32x3072x3072,0,
2026-03-03T03:09:15.170757+00:00,FULL,llm_style,tune,llm_style_tune_053,32,8192,8192,bf16,NVIDIA GeForce RTX 4060,c11,32,128,32,4,2,8,0.0,0.0,565.7120048999786,671.1484682559967,7.592144516642132,1,-1,-1,32x8192x8192,0,
2026-03-03T03:09:15.288239+00:00,FULL,llm_style,tune,llm_style_tune_054,4,4096,2048,bf16,NVIDIA GeForce RTX 4060,c11,32,128,32,4,2,8,0.0,117.43,52.91200056672096,139.14751708507526,1.2683108421760971,7,-1,-1,4x4096x2048,0,
2026-03-03T03:09:15.340496+00:00,FULL,llm_style,tune,llm_style_tune_055,16,8192,1024,bf16,NVIDIA GeForce RTX 4060,c11,32,128,32,4,2,8,0.0,0.0,56.68799951672554,819.163841605185,4.735313616434803,4,-1,-1,16x8192x1024,0,
2026-03-03T03:09:15.555175+00:00,FULL,llm_style,tune,llm_style_tune_056,32,8192,2048,bf16,NVIDIA GeForce RTX 4060,c02,32,64,32,2,2,8,0.0,214.626,162.89599984884262,180.66464096307755,6.591578829414877,0,-1,-1,32x8192x2048,0,
2026-03-03T03:09:15.587837+00:00,FULL,llm_style,tune,llm_style_tune_057,2,4096,1536,bf16,NVIDIA GeForce RTX 4060,c00,32,32,32,2,2,8,0.0,0.0,45.80800049006939,133.66751924157137,0.5493761729559805,6,-1,-1,2x4096x1536,0,
2026-03-03T03:09:16.305444+00:00,FULL,llm_style,tune,llm_style_tune_058,1,8192,8192,bf16,NVIDIA GeForce RTX 4060,c11,32,128,32,4,2,8,0.0,717.556,553.9360046386719,595.4096215963364,0.2422982562535345,5,-1,-1,1x8192x8192,0,
2026-03-03T03:09:16.862577+00:00,FULL,llm_style,tune,llm_style_tune_059,64,8192,6144,bf16,NVIDIA GeForce RTX 4060,c00,32,32,32,2,2,8,0.0,557.094,440.7519996166229,462.3462438583374,14.616952276118553,1,-1,-1,64x8192x6144,0,
2026-03-03T03:09:16.939746+00:00,FULL,llm_style,tune,llm_style_tune_060,64,2048,1536,bf16,NVIDIA GeForce RTX 4060,c11,32,128,32,4,2,8,0.0,77.127,47.85599932074547,58.92640143632888,8.41384966806974,3,-1,-1,64x2048x1536,0,
2026-03-03T03:09:16.952729+00:00,FULL,llm_style,tune,llm_style_tune_061,32,3072,1024,bf16,NVIDIA GeForce RTX 4060,c11,32,128,32,4,2,8,0.0,0.0,39.93599861860275,143.57280045747754,5.041230943608337,2,-1,-1,32x3072x1024,0,
2026-03-03T03:09:16.984764+00:00,FULL,llm_style,tune,llm_style_tune_062,16,8192,1024,bf16,NVIDIA GeForce RTX 4060,c11,32,128,32,4,2,8,0.0,0.0,52.22399905323982,148.17760139703736,5.140078524556174,4,-1,-1,16x8192x1024,0,
2026-03-03T03:09:17.185592+00:00,FULL,llm_style,tune,llm_style_tune_063,64,6144,6144,bf16,NVIDIA GeForce RTX 4060,c09,128,64,64,8,3,8,0.0,0.0,344.60800886154175,439.90623623132694,14.02125918072136,1,-1,-1,64x6144x6144,0,
2026-03-03T03:09:17.321803+00:00,FULL,llm_style,eval,llm_style_eval_000,4,8192,1536,bf16,NVIDIA GeForce RTX 4060,c11,32,128,32,4,2,8,0.0,136.157,59.807999059557915,67.47776277363299,1.683107570607029,4,-1,-1,4x8192x1536,0,
2026-03-03T03:09:17.386644+00:00,FULL,llm_style,eval,llm_style_eval_001,32,1024,1024,bf16,NVIDIA GeForce RTX 4060,c04,64,64,64,4,3,8,0.0,64.801,40.95999896526337,101.29023976624012,1.6384000413894664,3,-1,-1,32x1024x1024,0,
2026-03-03T03:09:17.768624+00:00,FULL,llm_style,eval,llm_style_eval_002,8,8192,4096,bf16,NVIDIA GeForce RTX 4060,c11,32,128,32,4,2,8,0.0,381.941,293.8079982995987,340.57215988636017,1.8272848768825818,5,-1,-1,8x8192x4096,0,
2026-03-03T03:09:18.066012+00:00,FULL,llm_style,eval,llm_style_eval_003,8,8192,3072,bf16,NVIDIA GeForce RTX 4060,c11,32,128,32,4,2,8,0.0,297.347,226.30399465560913,274.8908868432045,1.7792579605709575,4,-1,-1,8x8192x3072,0,
2026-03-03T03:09:18.614943+00:00,FULL,llm_style,eval,llm_style_eval_004,2,6144,8192,bf16,NVIDIA GeForce RTX 4060,c11,32,128,32,4,2,8,0.0,548.888,425.9839951992035,462.868472635746,0.47261538994171215,5,-1,-1,2x6144x8192,0,
2026-03-03T03:09:19.035632+00:00,FULL,llm_style,eval,llm_style_eval_005,2,6144,6144,bf16,NVIDIA GeForce RTX 4060,c00,32,32,32,2,2,8,0.0,420.642,325.6320059299469,386.0275164246557,0.46369810476333667,5,-1,-1,2x6144x6144,0,
2026-03-03T03:09:19.181250+00:00,FULL,llm_style,eval,llm_style_eval_006,1,6144,2048,bf16,NVIDIA GeForce RTX 4060,c11,32,128,32,4,2,8,0.0,145.575,58.240000158548355,65.87871864438057,0.4321054933291618,4,-1,-1,1x6144x2048,0,
2026-03-03T03:09:19.324936+00:00,FULL,llm_style,eval,llm_style_eval_007,8,8192,1536,bf16,NVIDIA GeForce RTX 4060,c11,32,128,32,4,2,8,0.0,143.642,60.35200133919716,71.096960529685,3.3358726725312966,4,-1,-1,8x8192x1536,0,
2026-03-03T03:09:19.409630+00:00,FULL,llm_style,eval,llm_style_eval_008,16,4096,1536,bf16,NVIDIA GeForce RTX 4060,c02,32,64,32,2,2,8,0.0,84.651,46.08000069856644,67.06240098923442,4.3690666004322205,6,-1,-1,16x4096x1536,0,
2026-03-03T03:09:19.833503+00:00,FULL,llm_style,eval,llm_style_eval_009,64,4096,8192,bf16,NVIDIA GeForce RTX 4060,c11,32,128,32,4,2,8,0.0,423.831,300.03198981285095,338.85056138038635,14.315031202769559,3,-1,-1,64x4096x8192,0,
2026-03-03T03:09:19.859342+00:00,FULL,llm_style,eval,llm_style_eval_010,4,4096,1024,bf16,NVIDIA GeForce RTX 4060,c11,32,128,32,4,2,8,0.0,0.0,53.119998425245285,603.8735958933812,0.6316723078826986,6,-1,-1,4x4096x1024,0,
2026-03-03T03:09:19.923905+00:00,FULL,llm_style,eval,llm_style_eval_011,4,1536,2048,bf16,NVIDIA GeForce RTX 4060,c04,64,64,64,4,3,8,0.0,64.506,41.98399931192398,47.626241222023964,0.5994146439701515,7,-1,-1,4x1536x2048,0,
2026-03-03T03:09:20.082857+00:00,FULL,llm_style,eval,llm_style_eval_012,4,8192,4096,bf16,NVIDIA GeForce RTX 4060,c11,32,128,32,4,2,8,0.0,0.0,296.4479923248291,404.358088672161,0.9055060683489645,5,-1,-1,4x8192x4096,0,
2026-03-03T03:09:20.153356+00:00,FULL,llm_style,eval,llm_style_eval_013,64,4096,1024,bf16,NVIDIA GeForce RTX 4060,c04,64,64,64,4,3,8,0.0,70.447,47.93599992990494,75.63488092273465,11.199743674587923,2,-1,-1,64x4096x1024,0,
2026-03-03T03:09:20.293639+00:00,FULL,llm_style,eval,llm_style_eval_014,16,6144,2048,bf16,NVIDIA GeForce RTX 4060,c11,32,128,32,4,2,8,0.0,140.237,63.48799914121628,78.32223929464814,6.342193634176106,4,-1,-1,16x6144x2048,0,
2026-03-03T03:09:20.505368+00:00,FULL,llm_style,eval,llm_style_eval_015,2,8192,2048,bf16,NVIDIA GeForce RTX 4060,c10,64,128,64,8,3,8,0.0,211.685,161.69599443674088,182.6934398710727,0.41503108493052066,4,-1,-1,2x8192x2048,0,
2026-03-03T03:09:20.590789+00:00,FULL,llm_style,eval,llm_style_eval_016,8,3072,2048,bf16,NVIDIA GeForce RTX 4060,c00,32,32,32,2,2,8,0.0,85.378,49.15200173854828,140.1958426088094,2.047999927560491,7,-1,-1,8x3072x2048,0,
2026-03-03T03:09:20.610199+00:00,FULL,llm_style,eval,llm_style_eval_017,64,4096,1024,bf16,NVIDIA GeForce RTX 4060,c04,64,64,64,4,3,8,0.0,0.0,55.296000093221664,152.4784019589424,9.709037020668898,2,-1,-1,64x4096x1024,0,
2026-03-03T03:09:21.007842+00:00,FULL,llm_style,eval,llm_style_eval_018,16,8192,4096,bf16,NVIDIA GeForce RTX 4060,c11,32,128,32,4,2,8,0.0,397.597,294.71999406814575,368.71168404817575,3.6432608768027026,5,-1,-1,16x8192x4096,0,
2026-03-03T03:09:21.076798+00:00,FULL,llm_style,eval,llm_style_eval_019,1,1024,2048,bf16,NVIDIA GeForce RTX 4060,c04,64,64,64,4,3,8,0.0,68.913,45.05600035190582,53.70495907962322,0.09309090836383095,7,-1,-1,1x1024x2048,0,
2026-03-03T03:09:21.210357+00:00,FULL,llm_style,eval,llm_style_eval_020,2,6144,4096,bf16,NVIDIA GeForce RTX 4060,c11,32,128,32,4,2,8,0.0,0.0,230.79999536275864,353.105924129486,0.4361494715014314,5,-1,-1,2x6144x4096,0,
2026-03-03T03:09:21.629073+00:00,FULL,llm_style,eval,llm_style_eval_021,16,6144,6144,bf16,NVIDIA GeForce RTX 4060,c06,64,128,32,4,3,8,0.0,418.665,326.6240060329437,415.7228749990462,3.698318340624857,5,-1,-1,16x6144x6144,0,
2026-03-03T03:09:21.851295+00:00,FULL,llm_style,eval,llm_style_eval_022,16,4096,4096,bf16,NVIDIA GeForce RTX 4060,c00,32,32,32,2,2,8,0.0,222.183,159.32799875736237,317.18080133199675,3.3695955273849307,7,-1,-1,16x4096x4096,0,
2026-03-03T03:09:21.991180+00:00,FULL,llm_style,eval,llm_style_eval_023,4,6144,2048,bf16,NVIDIA GeForce RTX 4060,c11,32,128,32,4,2,8,0.0,139.844,59.28000062704086,64.5324794948101,1.6980987674632708,4,-1,-1,4x6144x2048,0,
2026-03-03T03:09:22.063645+00:00,FULL,llm_style,eval,llm_style_eval_024,32,4096,1024,bf16,NVIDIA GeForce RTX 4060,c11,32,128,32,4,2,8,0.0,72.425,40.84799997508526,76.13504223525524,6.571569138359992,2,-1,-1,32x4096x1024,0,
2026-03-03T03:09:22.259052+00:00,FULL,llm_style,eval,llm_style_eval_025,16,6144,6144,bf16,NVIDIA GeForce RTX 4060,c06,64,128,32,4,3,8,0.0,0.0,329.74399626255035,433.6198404431343,3.6633253848182052,5,-1,-1,16x6144x6144,0,
2026-03-03T03:09:22.317608+00:00,FULL,llm_style,eval,llm_style_eval_026,4,6144,2048,bf16,NVIDIA GeForce RTX 4060,c11,32,128,32,4,2,8,0.0,0.0,63.48799914121628,154.7740755975246,1.5855484085440266,4,-1,-1,4x6144x2048,0,
2026-03-03T03:09:22.401014+00:00,FULL,llm_style,eval,llm_style_eval_027,32,8192,2048,bf16,NVIDIA GeForce RTX 4060,c02,32,64,32,2,2,8,0.0,0.0,168.84800046682358,343.0604764819143,6.359221436033388,0,-1,-1,32x8192x2048,0,
2026-03-03T03:09:22.527879+00:00,FULL,llm_style,eval,llm_style_eval_028,64,8192,3072,bf16,NVIDIA GeForce RTX 4060,c10,64,128,64,8,3,8,0.0,0.0,234.99199748039246,381.8880018591881,13.707809229838887,0,-1,-1,64x8192x3072,0,
2026-03-03T03:09:22.612598+00:00,FULL,llm_style,eval,llm_style_eval_029,8,8192,2048,bf16,NVIDIA GeForce RTX 4060,c06,64,128,32,4,3,8,0.0,0.0,164.86400365829468,241.51040345430368,1.6282235663545612,4,-1,-1,8x8192x2048,0,
2026-03-03T03:09:22.838557+00:00,FULL,llm_style,eval,llm_style_eval_030,8,6144,3072,bf16,NVIDIA GeForce RTX 4060,c11,32,128,32,4,2,8,0.0,225.899,177.15199291706085,209.89663630723942,1.704693709776022,5,-1,-1,8x6144x3072,0,
2026-03-03T03:09:22.937433+00:00,FULL,llm_style,eval,llm_style_eval_031,4,6144,3072,bf16,NVIDIA GeForce RTX 4060,c11,32,128,32,4,2,8,0.0,0.0,185.34399569034576,284.7007992863655,0.8146740520921285,5,-1,-1,4x6144x3072,0,
2026-03-03T03:09:23.098282+00:00,FULL,llm_style,eval,llm_style_eval_032,64,4096,3072,bf16,NVIDIA GeForce RTX 4060,c04,64,64,64,4,3,8,0.0,160.8,91.0400003194809,112.52191953361034,17.691264612785357,3,-1,-1,64x4096x3072,0,
2026-03-03T03:09:23.303640+00:00,FULL,llm_style,eval,llm_style_eval_033,2,6144,6144,bf16,NVIDIA GeForce RTX 4060,c00,32,32,32,2,2,8,0.0,0.0,327.4720013141632,397.84863263368607,0.461092683936486,5,-1,-1,2x6144x6144,0,
2026-03-03T03:09:23.858479+00:00,FULL,llm_style,eval,llm_style_eval_034,4,8192,6144,bf16,NVIDIA GeForce RTX 4060,c11,32,128,32,4,2,8,0.0,554.788,423.3119934797287,511.0067173838614,0.9511972025410662,5,-1,-1,4x8192x6144,0,
2026-03-03T03:09:23.964085+00:00,FULL,llm_style,eval,llm_style_eval_035,8,6144,1536,bf16,NVIDIA GeForce RTX 4060,c11,32,128,32,4,2,8,0.0,105.565,48.06400090456009,50.649280063807964,3.1415392218352403,4,-1,-1,8x6144x1536,0,
2026-03-03T03:09:23.981975+00:00,FULL,llm_style,eval,llm_style_eval_036,64,3072,1024,bf16,NVIDIA GeForce RTX 4060,c06,64,128,32,4,3,8,0.0,0.0,44.495999813079834,126.49215705692765,9.049199606514696,2,-1,-1,64x3072x1024,0,
2026-03-03T03:09:24.049501+00:00,FULL,llm_style,eval,llm_style_eval_037,2,1024,2048,bf16,NVIDIA GeForce RTX 4060,c04,64,64,64,4,3,8,0.0,67.483,43.007999658584595,50.68736013025045,0.19504762059598826,7,-1,-1,2x1024x2048,0,
2026-03-03T03:09:24.090193+00:00,FULL,llm_style,eval,llm_style_eval_038,32,8192,1024,bf16,NVIDIA GeForce RTX 4060,c02,32,64,32,2,2,8,0.0,0.0,51.19999870657921,122.98240438103673,10.485760264892583,0,-1,-1,32x8192x1024,0,
2026-03-03T03:09:24.150467+00:00,FULL,llm_style,eval,llm_style_eval_039,16,3072,1024,bf16,NVIDIA GeForce RTX 4060,c11,32,128,32,4,2,8,0.0,60.194,39.93599861860275,46.29664044827223,2.5206154718041685,6,-1,-1,16x3072x1024,0,
2026-03-03T03:09:24.177098+00:00,FULL,llm_style,eval,llm_style_eval_040,32,4096,1024,bf16,NVIDIA GeForce RTX 4060,c11,32,128,32,4,2,8,0.0,0.0,51.19999870657921,92.12768055498599,5.242880132446292,2,-1,-1,32x4096x1024,0,
2026-03-03T03:09:24.384958+00:00,FULL,llm_style,eval,llm_style_eval_041,4,8192,2048,bf16,NVIDIA GeForce RTX 4060,c00,32,32,32,2,2,8,0.0,207.811,160.76800227165222,203.32544162869442,0.8348534913882316,4,-1,-1,4x8192x2048,0,
2026-03-03T03:09:24.469008+00:00,FULL,llm_style,eval,llm_style_eval_042,2,8192,2048,bf16,NVIDIA GeForce RTX 4060,c10,64,128,64,8,3,8,0.0,0.0,165.16800224781036,186.95168003439903,0.406306688261041,4,-1,-1,2x8192x2048,0,
2026-03-03T03:09:24.602462+00:00,FULL,llm_style,eval,llm_style_eval_043,2,6144,2048,bf16,NVIDIA GeForce RTX 4060,c11,32,128,32,4,2,8,0.0,133.407,56.33600056171417,61.982720457017415,0.8934189061728546,4,-1,-1,2x6144x2048,0,
2026-03-03T03:09:25.364730+00:00,FULL,llm_style,eval,llm_style_eval_044,64,8192,8192,bf16,NVIDIA GeForce RTX 4060,c04,64,64,64,4,3,8,0.0,762.231,574.2720067501068,641.3094478845596,14.957954577329573,1,-1,-1,64x8192x8192,0,
2026-03-03T03:09:25.431288+00:00,FULL,llm_style,eval,llm_style_eval_045,4,1536,1536,bf16,NVIDIA GeForce RTX 4060,c04,64,64,64,4,3,8,0.0,66.519,41.9359989464283,55.982080250978434,0.45007555499301,7,-1,-1,4x1536x1536,0,
2026-03-03T03:09:25.448748+00:00,FULL,llm_style,eval,llm_style_eval_046,16,4096,1024,bf16,NVIDIA GeForce RTX 4060,c11,32,128,32,4,2,8,0.0,0.0,39.93599861860275,303.36960434913567,3.360820629072225,6,-1,-1,16x4096x1024,0,
2026-03-03T03:09:25.540890+00:00,FULL,llm_style,eval,llm_style_eval_047,32,8192,2048,bf16,NVIDIA GeForce RTX 4060,c02,32,64,32,2,2,8,0.0,0.0,162.81600296497345,198.01983922719944,6.594817489967455,0,-1,-1,32x8192x2048,0,
2026-03-03T03:09:25.847601+00:00,FULL,llm_style,eval,llm_style_eval_048,16,8192,3072,bf16,NVIDIA GeForce RTX 4060,c11,32,128,32,4,2,8,0.0,306.662,228.28800231218338,255.58399379253387,3.527589535339423,4,-1,-1,16x8192x3072,0,
2026-03-03T03:09:26.079488+00:00,FULL,llm_style,eval,llm_style_eval_049,1,6144,3072,bf16,NVIDIA GeForce RTX 4060,c00,32,32,32,2,2,8,0.0,231.813,177.15199291706085,510.33086985349644,0.21308671372200275,5,-1,-1,1x6144x3072,0,
2026-03-03T03:09:26.114176+00:00,FULL,llm_style,eval,llm_style_eval_050,64,4096,1536,bf16,NVIDIA GeForce RTX 4060,c04,64,64,64,4,3,8,0.0,0.0,58.41599963605404,137.7100773155689,13.785715780218702,2,-1,-1,64x4096x1536,0,
2026-03-03T03:09:26.409160+00:00,FULL,llm_style,eval,llm_style_eval_051,8,6144,4096,bf16,NVIDIA GeForce RTX 4060,c06,64,128,32,4,3,8,0.0,294.933,226.30399465560913,310.1449647545813,1.7792579605709575,5,-1,-1,8x6144x4096,0,
2026-03-03T03:09:26.538670+00:00,FULL,llm_style,eval,llm_style_eval_052,32,8192,3072,bf16,NVIDIA GeForce RTX 4060,c11,32,128,32,4,2,8,0.0,0.0,234.49599742889404,398.3974406123159,6.868401822032737,0,-1,-1,32x8192x3072,0,
2026-03-03T03:09:26.596574+00:00,FULL,llm_style,eval,llm_style_eval_053,2,3072,1024,bf16,NVIDIA GeForce RTX 4060,c00,32,32,32,2,2,8,0.0,57.85,36.65599972009659,46.64320088922976,0.34327019031215894,6,-1,-1,2x3072x1024,0,
2026-03-03T03:09:27.011789+00:00,FULL,llm_style,eval,llm_style_eval_054,1,6144,6144,bf16,NVIDIA GeForce RTX 4060,c00,32,32,32,2,2,8,0.0,415.173,325.6320059299469,427.40640223026276,0.23184905238166834,5,-1,-1,1x6144x6144,0,
2026-03-03T03:09:27.080385+00:00,FULL,llm_style,eval,llm_style_eval_055,4,3072,1024,bf16,NVIDIA GeForce RTX 4060,c11,32,128,32,4,2,8,0.0,68.554,40.95999896526337,61.12256016582246,0.61440001552105,6,-1,-1,4x3072x1024,0,
2026-03-03T03:09:27.187666+00:00,FULL,llm_style,eval,llm_style_eval_056,32,8192,2048,bf16,NVIDIA GeForce RTX 4060,c02,32,64,32,2,2,8,0.0,0.0,170.80000042915344,204.22655448317516,6.28654462120672,0,-1,-1,32x8192x2048,0,
2026-03-03T03:09:27.587502+00:00,FULL,llm_style,eval,llm_style_eval_057,2,8192,4096,bf16,NVIDIA GeForce RTX 4060,c02,32,64,32,2,2,8,0.0,399.786,294.8320060968399,401.86110973358154,0.4552345919863094,5,-1,-1,2x8192x4096,0,
2026-03-03T03:09:27.617611+00:00,FULL,llm_style,eval,llm_style_eval_058,1,4096,1536,bf16,NVIDIA GeForce RTX 4060,c11,32,128,32,4,2,8,0.0,0.0,45.40800116956234,124.95200447738169,0.27710781527275224,6,-1,-1,1x4096x1536,0,
2026-03-03T03:09:27.684220+00:00,FULL,llm_style,eval,llm_style_eval_059,8,1536,2048,bf16,NVIDIA GeForce RTX 4060,c04,64,64,64,4,3,8,0.0,66.558,44.03200000524521,50.70304024964571,1.143069767305695,7,-1,-1,8x1536x2048,0,
2026-03-03T03:09:27.747312+00:00,FULL,llm_style,eval,llm_style_eval_060,64,1536,1536,bf16,NVIDIA GeForce RTX 4060,c00,32,32,32,2,2,8,0.0,63.044,24.384000338613987,91.77087914198624,12.384755733528072,3,-1,-1,64x1536x1536,0,
2026-03-03T03:09:27.849529+00:00,FULL,llm_style,eval,llm_style_eval_061,1,8192,1024,bf16,NVIDIA GeForce RTX 4060,c11,32,128,32,4,2,8,0.0,102.174,50.175998359918594,53.790719583630555,0.334367357868098,4,-1,-1,1x8192x1024,0,
2026-03-03T03:09:27.933112+00:00,FULL,llm_style,eval,llm_style_eval_062,1,3072,1536,bf16,NVIDIA GeForce RTX 4060,c00,32,32,32,2,2,8,0.0,83.541,19.45599913597107,828.1807771325086,0.48505265311983575,7,-1,-1,1x3072x1536,0,
2026-03-03T03:09:28.242607+00:00,FULL,llm_style,eval,llm_style_eval_063,64,4096,6144,bf16,NVIDIA GeForce RTX 4060,c03,64,64,32,4,2,8,0.0,309.451,233.47200453281403,254.50687319040298,13.797052363711826,3,-1,-1,64x4096x6144,0,
2026-03-03T03:09:28.262822+00:00,FULL,llm_style,eval,llm_style_eval_064,4,3072,1024,bf16,NVIDIA GeForce RTX 4060,c11,32,128,32,4,2,8,0.0,0.0,50.00000074505806,170.95936477184296,0.5033164725000001,6,-1,-1,4x3072x1024,0,
2026-03-03T03:09:28.284426+00:00,FULL,llm_style,eval,llm_style_eval_065,32,4096,1024,bf16,NVIDIA GeForce RTX 4060,c11,32,128,32,4,2,8,0.0,0.0,61.2960010766983,148.52896228432655,4.379330646123435,2,-1,-1,32x4096x1024,0,
2026-03-03T03:09:28.407500+00:00,FULL,llm_style,eval,llm_style_eval_066,1,4096,6144,bf16,NVIDIA GeForce RTX 4060,c03,64,64,32,4,2,8,0.0,0.0,231.4240038394928,366.71488493680954,0.2174867220554536,7,-1,-1,1x4096x6144,0,
2026-03-03T03:09:28.557488+00:00,FULL,llm_style,eval,llm_style_eval_067,64,1024,8192,bf16,NVIDIA GeForce RTX 4060,c04,64,64,64,4,3,8,0.0,149.941,83.96799862384796,146.92992091178894,12.787512404696566,3,-1,-1,64x1024x8192,0,
2026-03-03T03:09:28.631214+00:00,FULL,llm_style,eval,llm_style_eval_068,8,4096,1024,bf16,NVIDIA GeForce RTX 4060,c11,32,128,32,4,2,8,0.0,73.681,40.95999896526337,60.5676797404885,1.6384000413894664,6,-1,-1,8x4096x1024,0,
2026-03-03T03:09:28.742132+00:00,FULL,llm_style,eval,llm_style_eval_069,64,6144,1536,bf16,NVIDIA GeForce RTX 4060,c06,64,128,32,4,3,8,0.0,110.88,66.23999774456024,68.60800087451935,18.236104968756585,0,-1,-1,64x6144x1536,0,
2026-03-03T03:09:28.769998+00:00,FULL,llm_style,eval,llm_style_eval_070,1,4096,1024,bf16,NVIDIA GeForce RTX 4060,c11,32,128,32,4,2,8,0.0,0.0,64.51199948787689,158.3622413873671,0.13003174706399215,6,-1,-1,1x4096x1024,0,
2026-03-03T03:09:28.994538+00:00,FULL,llm_style,eval,llm_style_eval_071,64,2048,8192,bf16,NVIDIA GeForce RTX 4060,c10,64,128,64,8,3,8,0.0,224.493,167.05600172281265,190.4889641702175,12.854872772324626,3,-1,-1,64x2048x8192,0,
2026-03-03T03:09:29.104200+00:00,FULL,llm_style,eval,llm_style_eval_072,64,8192,1024,bf16,NVIDIA GeForce RTX 4060,c06,64,128,32,4,3,8,0.0,109.623,65.35999849438667,79.01184059679505,16.428118860685352,0,-1,-1,64x8192x1024,0,
2026-03-03T03:09:29.258543+00:00,FULL,llm_style,eval,llm_style_eval_073,32,8192,1536,bf16,NVIDIA GeForce RTX 4060,c02,32,64,32,2,2,8,0.0,154.302,70.64000144600868,110.83648346364492,11.40014653900466,0,-1,-1,32x8192x1536,0,
2026-03-03T03:09:29.279402+00:00,FULL,llm_style,eval,llm_style_eval_074,16,3072,1024,bf16,NVIDIA GeForce RTX 4060,c11,32,128,32,4,2,8,0.0,0.0,62.463998794555664,151.26943863928304,1.6115410147064386,6,-1,-1,16x3072x1024,0,
2026-03-03T03:09:29.322877+00:00,FULL,llm_style,eval,llm_style_eval_075,16,8192,1024,bf16,NVIDIA GeForce RTX 4060,c11,32,128,32,4,2,8,0.0,0.0,51.19999870657921,180.84319636225683,5.242880132446292,4,-1,-1,16x8192x1024,0,
2026-03-03T03:09:29.349983+00:00,FULL,llm_style,eval,llm_style_eval_076,1,4096,1536,bf16,NVIDIA GeForce RTX 4060,c11,32,128,32,4,2,8,0.0,0.0,77.82399654388428,176.56064301729202,0.1616842177066119,6,-1,-1,1x4096x1536,0,
2026-03-03T03:09:29.426967+00:00,FULL,llm_style,eval,llm_style_eval_077,4,1024,3072,bf16,NVIDIA GeForce RTX 4060,c04,64,64,64,4,3,8,0.0,76.937,51.19999870657921,63.59040100127457,0.4915200124168399,7,-1,-1,4x1024x3072,0,
2026-03-03T03:09:30.006453+00:00,FULL,llm_style,eval,llm_style_eval_078,32,6144,8192,bf16,NVIDIA GeForce RTX 4060,c11,32,128,32,4,2,8,0.0,579.445,425.9519875049591,491.0092708468437,7.562414465697258,1,-1,-1,32x6144x8192,0,
2026-03-03T03:09:30.050304+00:00,FULL,llm_style,eval,llm_style_eval_079,64,8192,1024,bf16,NVIDIA GeForce RTX 4060,c06,64,128,32,4,3,8,0.0,0.0,68.60800087451935,214.8864017426967,15.650387860212119,0,-1,-1,64x8192x1024,0,
2026-03-03T03:09:30.069854+00:00,FULL,llm_style,eval,llm_style_eval_080,2,3072,1024,bf16,NVIDIA GeForce RTX 4060,c00,32,32,32,2,2,8,0.0,0.0,64.59200009703636,144.45919960737223,0.19480604379949112,6,-1,-1,2x3072x1024,0,
2026-03-03T03:09:30.097561+00:00,FULL,llm_style,eval,llm_style_eval_081,64,4096,1536,bf16,NVIDIA GeForce RTX 4060,c04,64,64,64,4,3,8,0.0,0.0,52.112000063061714,117.31232166290279,15.453376708349008,2,-1,-1,64x4096x1536,0,
2026-03-03T03:09:30.154860+00:00,FULL,llm_style,eval,llm_style_eval_082,8,1536,1024,bf16,NVIDIA GeForce RTX 4060,c04,64,64,64,4,3,8,0.0,57.255,35.840000957250595,53.704961836338015,0.7021714098171316,7,-1,-1,8x1536x1024,0,
2026-03-03T03:09:30.283991+00:00,FULL,llm_style,eval,llm_style_eval_083,64,6144,4096,bf16,NVIDIA GeForce RTX 4060,c06,64,128,32,4,3,8,0.0,0.0,235.58400571346283,253.76383513212204,13.673362341575627,1,-1,-1,64x6144x4096,0,
2026-03-03T03:09:30.295875+00:00,FULL,llm_style,eval,llm_style_eval_084,1,1024,2048,bf16,NVIDIA GeForce RTX 4060,c04,64,64,64,4,3,8,0.0,0.0,45.05600035190582,120.75103878974913,0.09309090836383095,7,-1,-1,1x1024x2048,0,
2026-03-03T03:09:30.323340+00:00,FULL,llm_style,eval,llm_style_eval_085,32,4096,1536,bf16,NVIDIA GeForce RTX 4060,c11,32,128,32,4,2,8,0.0,0.0,70.65600156784058,218.47808092832543,5.698782482240964,2,-1,-1,32x4096x1536,0,
2026-03-03T03:09:30.878313+00:00,FULL,llm_style,eval,llm_style_eval_086,32,8192,6144,bf16,NVIDIA GeForce RTX 4060,c02,32,64,32,2,2,8,0.0,554.914,432.12801218032837,498.2886487245559,7.4543315434403565,1,-1,-1,32x8192x6144,0,
2026-03-03T03:09:31.442090+00:00,FULL,llm_style,eval,llm_style_eval_087,64,6144,8192,bf16,NVIDIA GeForce RTX 4060,c06,64,128,32,4,3,8,0.0,563.734,433.03999304771423,491.12063854932785,14.877265489171904,1,-1,-1,64x6144x8192,0,
2026-03-03T03:09:31.744272+00:00,FULL,llm_style,eval,llm_style_eval_088,1,6144,4096,bf16,NVIDIA GeForce RTX 4060,c11,32,128,32,4,2,8,0.0,302.141,226.6719937324524,249.5795185863971,0.22204616975932157,5,-1,-1,1x6144x4096,0,
2026-03-03T03:09:31.765189+00:00,FULL,llm_style,eval,llm_style_eval_089,8,3072,1024,bf16,NVIDIA GeForce RTX 4060,c00,32,32,32,2,2,8,0.0,0.0,43.71200129389763,428.5747106373302,1.1514377404410103,6,-1,-1,8x3072x1024,0,
2026-03-03T03:09:32.023521+00:00,FULL,llm_style,eval,llm_style_eval_090,16,8192,6144,bf16,NVIDIA GeForce RTX 4060,c11,32,128,32,4,2,8,0.0,0.0,429.3919950723648,546.2652862071991,3.7509146758280063,5,-1,-1,16x8192x6144,0,
2026-03-03T03:09:32.248597+00:00,FULL,llm_style,eval,llm_style_eval_091,32,6144,3072,bf16,NVIDIA GeForce RTX 4060,c00,32,32,32,2,2,8,0.0,225.025,178.54399979114532,332.55296438932413,6.76561269722326,1,-1,-1,32x6144x3072,0,
2026-03-03T03:09:32.351200+00:00,FULL,llm_style,eval,llm_style_eval_092,4,8192,1024,bf16,NVIDIA GeForce RTX 4060,c11,32,128,32,4,2,8,0.0,102.562,50.175998359918594,56.257279962301254,1.337469431472392,4,-1,-1,4x8192x1024,0,
2026-03-03T03:09:32.477214+00:00,FULL,llm_style,eval,llm_style_eval_093,64,8192,3072,bf16,NVIDIA GeForce RTX 4060,c10,64,128,64,8,3,8,0.0,0.0,238.01600188016891,360.4912129044533,13.533650874539738,0,-1,-1,64x8192x3072,0,
2026-03-03T03:09:32.576440+00:00,FULL,llm_style,eval,llm_style_eval_094,1,6144,3072,bf16,NVIDIA GeForce RTX 4060,c00,32,32,32,2,2,8,0.0,0.0,181.2639981508255,249.6841639280319,0.20825280466665072,5,-1,-1,1x6144x3072,0,
2026-03-03T03:09:32.633635+00:00,FULL,llm_style,eval,llm_style_eval_095,32,1536,1024,bf16,NVIDIA GeForce RTX 4060,c04,64,64,64,4,3,8,0.0,57.149,37.647999823093414,90.51136054098588,2.6738019675152245,3,-1,-1,32x1536x1024,0,
2026-03-03T03:09:32.663272+00:00,FULL,llm_style,eval,llm_style_eval_096,32,4096,1536,bf16,NVIDIA GeForce RTX 4060,c11,32,128,32,4,2,8,0.0,0.0,55.0720002502203,144.64928261935702,7.311395666954902,2,-1,-1,32x4096x1536,0,
2026-03-03T03:09:32.803577+00:00,FULL,llm_style,eval,llm_style_eval_097,32,1024,8192,bf16,NVIDIA GeForce RTX 4060,c04,64,64,64,4,3,8,0.0,140.258,86.01599931716919,138.44416543841345,6.241523859071624,3,-1,-1,32x1024x8192,0,
2026-03-03T03:09:33.132639+00:00,FULL,llm_style,eval,llm_style_eval_098,1,8192,8192,bf16,NVIDIA GeForce RTX 4060,c11,32,128,32,4,2,8,0.0,0.0,559.1040253639221,632.0537728071213,0.24005859716827715,5,-1,-1,1x8192x8192,0,
2026-03-03T03:09:33.154310+00:00,FULL,llm_style,eval,llm_style_eval_099,8,3072,1024,bf16,NVIDIA GeForce RTX 4060,c00,32,32,32,2,2,8,0.0,0.0,65.72800129652023,177.8374381363392,0.7657565574364219,6,-1,-1,8x3072x1024,0,
2026-03-03T03:09:33.392933+00:00,FULL,llm_style,eval,llm_style_eval_100,64,6144,8192,bf16,NVIDIA GeForce RTX 4060,c06,64,128,32,4,3,8,0.0,0.0,434.7839951515198,566.7305624485015,14.817589920150676,1,-1,-1,64x6144x8192,0,
2026-03-03T03:09:33.552549+00:00,FULL,llm_style,eval,llm_style_eval_101,64,8192,1536,bf16,NVIDIA GeForce RTX 4060,c04,64,64,64,4,3,8,0.0,159.561,110.59200018644333,174.2793577909468,14.563555531003347,0,-1,-1,64x8192x1536,0,
2026-03-03T03:09:33.573110+00:00,FULL,llm_style,eval,llm_style_eval_102,16,3072,1024,bf16,NVIDIA GeForce RTX 4060,c11,32,128,32,4,2,8,0.0,0.0,42.927999049425125,855.7603098452063,2.3449333355626796,6,-1,-1,16x3072x1024,0,
2026-03-03T03:09:33.648018+00:00,FULL,llm_style,eval,llm_style_eval_103,2,1024,3072,bf16,NVIDIA GeForce RTX 4060,c04,64,64,64,4,3,8,0.0,74.865,51.024001091718674,70.25696266442534,0.24660770874047036,7,-1,-1,2x1024x3072,0,
2026-03-03T03:09:33.718650+00:00,FULL,llm_style,eval,llm_style_eval_104,32,6144,2048,bf16,NVIDIA GeForce RTX 4060,c11,32,128,32,4,2,8,0.0,0.0,84.6719965338707,129.79520291090006,9.510893813373816,0,-1,-1,32x6144x2048,0,
2026-03-03T03:09:34.038120+00:00,FULL,llm_style,eval,llm_style_eval_105,64,8192,8192,bf16,NVIDIA GeForce RTX 4060,c04,64,64,64,4,3,8,0.0,0.0,578.1599879264832,650.3452825546262,14.857366077522933,1,-1,-1,64x8192x8192,0,
2026-03-03T03:09:34.079981+00:00,FULL,llm_style,eval,llm_style_eval_106,64,8192,1024,bf16,NVIDIA GeForce RTX 4060,c06,64,128,32,4,3,8,0.0,0.0,64.35199826955795,125.8803215622901,16.68544649541892,0,-1,-1,64x8192x1024,0,
2026-03-03T03:09:34.197740+00:00,FULL,llm_style,eval,llm_style_eval_107,1,2048,4096,bf16,NVIDIA GeForce RTX 4060,c00,32,32,32,2,2,8,0.0,117.71,61.99999898672104,151.1833587288855,0.2706002624869928,7,-1,-1,1x2048x4096,0,
2026-03-03T03:09:34.385443+00:00,FULL,llm_style,eval,llm_style_eval_108,64,6144,6144,bf16,NVIDIA GeForce RTX 4060,c09,128,64,64,8,3,8,0.0,0.0,344.06399726867676,407.2748830914496,14.043428682911154,1,-1,-1,64x6144x6144,0,
2026-03-03T03:09:34.617808+00:00,FULL,llm_style,eval,llm_style_eval_109,64,6144,3072,bf16,NVIDIA GeForce RTX 4060,c02,32,64,32,2,2,8,0.0,232.315,182.27200210094452,197.27359592914578,13.254471757335688,1,-1,-1,64x6144x3072,0,
2026-03-03T03:09:34.755813+00:00,FULL,llm_style,eval,llm_style_eval_110,1,8192,1536,bf16,NVIDIA GeForce RTX 4060,c11,32,128,32,4,2,8,0.0,137.966,61.135999858379364,72.24320210516451,0.41163674526132327,4,-1,-1,1x8192x1536,0,
2026-03-03T03:09:34.848148+00:00,FULL,llm_style,eval,llm_style_eval_111,32,8192,2048,bf16,NVIDIA GeForce RTX 4060,c02,32,64,32,2,2,8,0.0,0.0,165.8879965543747,282.62208968400944,6.472691492467626,0,-1,-1,32x8192x2048,0,
2026-03-03T03:09:34.925917+00:00,FULL,llm_style,eval,llm_style_eval_112,8,6144,1024,bf16,NVIDIA GeForce RTX 4060,c11,32,128,32,4,2,8,0.0,77.71,40.95999896526337,66.05824001133442,2.4576000620842,4,-1,-1,8x6144x1024,0,
2026-03-03T03:09:35.033139+00:00,FULL,llm_style,eval,llm_style_eval_113,64,3072,3072,bf16,NVIDIA GeForce RTX 4060,c03,64,64,32,4,2,8,0.0,107.172,64.51199948787689,105.20544245839106,18.72457157721487,3,-1,-1,64x3072x3072,0,
2026-03-03T03:09:35.773417+00:00,FULL,llm_style,eval,llm_style_eval_114,16,8192,8192,bf16,NVIDIA GeForce RTX 4060,c11,32,128,32,4,2,8,0.0,740.234,558.0800175666809,590.8684784173965,3.8479851999779098,5,-1,-1,16x8192x8192,0,
2026-03-03T03:09:36.215870+00:00,FULL,llm_style,eval,llm_style_eval_115,32,6144,6144,bf16,NVIDIA GeForce RTX 4060,c06,64,128,32,4,3,8,0.0,442.41,329.1199952363968,367.25759387016296,7.34054186608966,1,-1,-1,32x6144x6144,0,
2026-03-03T03:09:36.239041+00:00,FULL,llm_style,eval,llm_style_eval_116,8,3072,1024,bf16,NVIDIA GeForce RTX 4060,c00,32,32,32,2,2,8,0.0,0.0,36.73600032925606,93.32960061728949,1.3700905800546979,6,-1,-1,8x3072x1024,0,
2026-03-03T03:09:36.534625+00:00,FULL,llm_style,eval,llm_style_eval_117,16,6144,4096,bf16,NVIDIA GeForce RTX 4060,c00,32,32,32,2,2,8,0.0,295.54,229.37600314617157,325.9603250026702,3.510857094701456,5,-1,-1,16x6144x4096,0,
2026-03-03T03:09:36.729528+00:00,FULL,llm_style,eval,llm_style_eval_118,32,6144,6144,bf16,NVIDIA GeForce RTX 4060,c06,64,128,32,4,3,8,0.0,0.0,333.5680067539215,442.5113606452942,7.242658333783979,1,-1,-1,32x6144x6144,0,
2026-03-03T03:09:36.758233+00:00,FULL,llm_style,eval,llm_style_eval_119,32,4096,1536,bf16,NVIDIA GeForce RTX 4060,c11,32,128,32,4,2,8,0.0,0.0,47.61600121855736,129.8364809155464,8.45625784810914,2,-1,-1,32x4096x1536,0,
2026-03-03T03:09:36.823489+00:00,FULL,llm_style,eval,llm_style_eval_120,64,8192,1536,bf16,NVIDIA GeForce RTX 4060,c04,64,64,64,4,3,8,0.0,0.0,115.61600118875504,227.2895973920821,13.930707855658394,0,-1,-1,64x8192x1536,0,
2026-03-03T03:09:36.897234+00:00,FULL,llm_style,eval,llm_style_eval_121,8,3072,1536,bf16,NVIDIA GeForce RTX 4060,c00,32,32,32,2,2,8,0.0,73.691,44.7199996560812,166.48191660642613,1.688226131051268,7,-1,-1,8x3072x1536,0,
2026-03-03T03:09:36.956496+00:00,FULL,llm_style,eval,llm_style_eval_122,64,1024,1536,bf16,NVIDIA GeForce RTX 4060,c04,64,64,64,4,3,8,0.0,59.212,39.93599861860275,45.619200542569146,5.041230943608337,3,-1,-1,64x1024x1536,0,
2026-03-03T03:09:37.088853+00:00,FULL,llm_style,eval,llm_style_eval_123,64,8192,3072,bf16,NVIDIA GeForce RTX 4060,c10,64,128,64,8,3,8,0.0,0.0,235.88799685239792,367.6576039195061,13.655741347515939,0,-1,-1,64x8192x3072,0,
2026-03-03T03:09:37.154304+00:00,FULL,llm_style,eval,llm_style_eval_124,64,8192,1536,bf16,NVIDIA GeForce RTX 4060,c04,64,64,64,4,3,8,0.0,0.0,111.93599924445152,137.55615964531896,14.388693064531116,0,-1,-1,64x8192x1536,0,
2026-03-03T03:09:37.215516+00:00,FULL,llm_style,eval,llm_style_eval_125,64,4096,3072,bf16,NVIDIA GeForce RTX 4060,c04,64,64,64,4,3,8,0.0,0.0,90.11200070381165,210.19007697701448,17.873454405855544,3,-1,-1,64x4096x3072,0,
2026-03-03T03:09:37.240049+00:00,FULL,llm_style,eval,llm_style_eval_126,64,4096,1024,bf16,NVIDIA GeForce RTX 4060,c04,64,64,64,4,3,8,0.0,0.0,60.30400097370148,243.47647652029985,8.902741166943947,2,-1,-1,64x4096x1024,0,
2026-03-03T03:09:37.422419+00:00,FULL,llm_style,eval,llm_style_eval_127,16,6144,6144,bf16,NVIDIA GeForce RTX 4060,c06,64,128,32,4,3,8,0.0,0.0,331.7759931087494,436.7872026562691,3.6408889645130396,5,-1,-1,16x6144x6144,0,
2026-03-03T03:09:37.635925+00:00,FULL,llm_style,eval,llm_style_eval_128,32,6144,6144,bf16,NVIDIA GeForce RTX 4060,c06,64,128,32,4,3,8,0.0,0.0,332.8000009059906,401.0966494679451,7.259372287929918,1,-1,-1,32x6144x6144,0,
2026-03-03T03:09:37.722626+00:00,FULL,llm_style,eval,llm_style_eval_129,64,2048,8192,bf16,NVIDIA GeForce RTX 4060,c10,64,128,64,8,3,8,0.0,0.0,186.2879991531372,313.90463411808,11.527761625882679,3,-1,-1,64x2048x8192,0,
2026-03-03T03:09:37.968390+00:00,FULL,llm_style,eval,llm_style_eval_130,64,8192,6144,bf16,NVIDIA GeForce RTX 4060,c00,32,32,32,2,2,8,0.0,0.0,442.8800046443939,518.5638475418089,14.546718922595979,1,-1,-1,64x8192x6144,0,
2026-03-03T03:09:38.039220+00:00,FULL,llm_style,eval,llm_style_eval_131,2,2048,2048,bf16,NVIDIA GeForce RTX 4060,c00,32,32,32,2,2,8,0.0,70.779,43.007999658584595,120.24575874209404,0.3900952411919765,7,-1,-1,2x2048x2048,0,
2026-03-03T03:09:38.108193+00:00,FULL,llm_style,eval,llm_style_eval_132,32,6144,2048,bf16,NVIDIA GeForce RTX 4060,c11,32,128,32,4,2,8,0.0,0.0,79.8719972372055,187.02815949916825,10.082461887216674,0,-1,-1,32x6144x2048,0,
2026-03-03T03:09:38.235191+00:00,FULL,llm_style,eval,llm_style_eval_133,4,1536,6144,bf16,NVIDIA GeForce RTX 4060,c04,64,64,64,4,3,8,0.0,126.949,71.68000191450119,124.85631741583339,1.0532571147256975,7,-1,-1,4x1536x6144,0,
2026-03-03T03:09:38.398088+00:00,FULL,llm_style,eval,llm_style_eval_134,2,8192,4096,bf16,NVIDIA GeForce RTX 4060,c02,32,64,32,2,2,8,0.0,0.0,299.99999701976776,453.5939273238182,0.44739243111111116,5,-1,-1,2x8192x4096,0,
2026-03-03T03:09:38.421240+00:00,FULL,llm_style,eval,llm_style_eval_135,2,3072,1024,bf16,NVIDIA GeForce RTX 4060,c00,32,32,32,2,2,8,0.0,0.0,72.81600311398506,235.54047778248787,0.17280421146300629,6,-1,-1,2x3072x1024,0,
2026-03-03T03:09:38.740409+00:00,FULL,llm_style,eval,llm_style_eval_136,32,8192,8192,bf16,NVIDIA GeForce RTX 4060,c11,32,128,32,4,2,8,0.0,0.0,567.0879781246185,681.0009598731995,7.573723058287394,1,-1,-1,32x8192x8192,0,
2026-03-03T03:09:38.784089+00:00,FULL,llm_style,eval,llm_style_eval_137,64,8192,1024,bf16,NVIDIA GeForce RTX 4060,c06,64,128,32,4,3,8,0.0,0.0,73.72800260782242,191.7465563118455,14.563555040430158,0,-1,-1,64x8192x1024,0,
2026-03-03T03:09:38.797503+00:00,FULL,llm_style,eval,llm_style_eval_138,2,3072,1024,bf16,NVIDIA GeForce RTX 4060,c00,32,32,32,2,2,8,0.0,0.0,41.999999433755875,102.43488080799568,0.29959314689625854,6,-1,-1,2x3072x1024,0,
2026-03-03T03:09:38.811170+00:00,FULL,llm_style,eval,llm_style_eval_139,32,3072,1024,bf16,NVIDIA GeForce RTX 4060,c11,32,128,32,4,2,8,0.0,0.0,42.3360001295805,58.910721316933625,4.75544669746284,2,-1,-1,32x3072x1024,0,
2026-03-03T03:09:38.900857+00:00,FULL,llm_style,eval,llm_style_eval_140,32,6144,1024,bf16,NVIDIA GeForce RTX 4060,c11,32,128,32,4,2,8,0.0,89.651,46.08000069856644,151.9260806217786,8.738133200864441,0,-1,-1,32x6144x1024,0,
2026-03-03T03:09:38.920932+00:00,FULL,llm_style,eval,llm_style_eval_141,8,3072,1024,bf16,NVIDIA GeForce RTX 4060,c00,32,32,32,2,2,8,0.0,0.0,41.98399931192398,98.59071977436537,1.198829287940303,6,-1,-1,8x3072x1024,0,
2026-03-03T03:09:38.946236+00:00,FULL,llm_style,eval,llm_style_eval_142,32,4096,1536,bf16,NVIDIA GeForce RTX 4060,c11,32,128,32,4,2,8,0.0,0.0,59.84000116586685,172.31263831257803,6.728829815425809,2,-1,-1,32x4096x1536,0,
2026-03-03T03:09:38.989709+00:00,FULL,llm_style,eval,llm_style_eval_143,64,6144,1536,bf16,NVIDIA GeForce RTX 4060,c06,64,128,32,4,3,8,0.0,0.0,79.8719972372055,144.9369604140519,15.123692830825012,0,-1,-1,64x6144x1536,0,
2026-03-03T03:09:39.075858+00:00,FULL,llm_style,eval,llm_style_eval_144,32,8192,2048,bf16,NVIDIA GeForce RTX 4060,c02,32,64,32,2,2,8,0.0,0.0,167.7599996328354,180.28543397784233,6.400463914818931,0,-1,-1,32x8192x2048,0,
2026-03-03T03:09:39.111955+00:00,FULL,llm_style,eval,llm_style_eval_145,64,4096,1536,bf16,NVIDIA GeForce RTX 4060,c04,64,64,64,4,3,8,0.0,0.0,104.33599725365639,169.4105575978755,7.718394314497038,2,-1,-1,64x4096x1536,0,
2026-03-03T03:09:39.168284+00:00,FULL,llm_style,eval,llm_style_eval_146,1,1024,1024,bf16,NVIDIA GeForce RTX 4060,c04,64,64,64,4,3,8,0.0,56.279,39.93599861860275,65.00192064791916,0.052512822329253514,7,-1,-1,1x1024x1024,0,
2026-03-03T03:09:39.578553+00:00,FULL,llm_style,eval,llm_style_eval_147,32,8192,4096,bf16,NVIDIA GeForce RTX 4060,c11,32,128,32,4,2,8,0.0,410.23,296.9920039176941,328.5206410288811,7.23077934648751,1,-1,-1,32x8192x4096,0,
2026-03-03T03:09:39.854204+00:00,FULL,llm_style,eval,llm_style_eval_148,32,6144,8192,bf16,NVIDIA GeForce RTX 4060,c11,32,128,32,4,2,8,0.0,0.0,428.0320107936859,559.6262389421463,7.525664881995592,1,-1,-1,32x6144x8192,0,
2026-03-03T03:09:39.872581+00:00,FULL,llm_style,eval,llm_style_eval_149,4,4096,1024,bf16,NVIDIA GeForce RTX 4060,c11,32,128,32,4,2,8,0.0,0.0,42.9919995367527,91.8937591835855,0.7804808420533039,6,-1,-1,4x4096x1024,0,
2026-03-03T03:09:39.934602+00:00,FULL,llm_style,eval,llm_style_eval_150,64,8192,1536,bf16,NVIDIA GeForce RTX 4060,c04,64,64,64,4,3,8,0.0,0.0,109.45599898695946,159.41760212182987,14.714705003897391,0,-1,-1,64x8192x1536,0,
2026-03-03T03:09:40.115396+00:00,FULL,llm_style,eval,llm_style_eval_151,64,6144,6144,bf16,NVIDIA GeForce RTX 4060,c09,128,64,64,8,3,8,0.0,0.0,344.57600116729736,387.7379164099693,14.022561616686886,1,-1,-1,64x6144x6144,0,
2026-03-03T03:09:40.434306+00:00,FULL,llm_style,eval,llm_style_eval_152,32,8192,8192,bf16,NVIDIA GeForce RTX 4060,c11,32,128,32,4,2,8,0.0,0.0,561.8560016155243,687.609281539917,7.64424920913994,1,-1,-1,32x8192x8192,0,
2026-03-03T03:09:40.523260+00:00,FULL,llm_style,eval,llm_style_eval_153,8,4096,1536,bf16,NVIDIA GeForce RTX 4060,c11,32,128,32,4,2,8,0.0,88.903,47.10400104522705,69.3759991601109,2.137043430840362,6,-1,-1,8x4096x1536,0,
2026-03-03T03:09:40.553024+00:00,FULL,llm_style,eval,llm_style_eval_154,32,4096,1024,bf16,NVIDIA GeForce RTX 4060,c11,32,128,32,4,2,8,0.0,0.0,53.18399891257286,1245.3865894675223,5.047297335449912,2,-1,-1,32x4096x1024,0,
2026-03-03T03:09:40.960075+00:00,FULL,llm_style,eval,llm_style_eval_155,32,4096,8192,bf16,NVIDIA GeForce RTX 4060,c03,64,64,32,4,2,8,0.0,406.995,294.9120104312897,317.3302459716797,7.281777520215079,3,-1,-1,32x4096x8192,0,
2026-03-03T03:09:41.266388+00:00,FULL,llm_style,eval,llm_style_eval_156,32,3072,8192,bf16,NVIDIA GeForce RTX 4060,c06,64,128,32,4,3,8,0.0,306.264,228.35199534893036,279.57247763872147,7.05320193738147,3,-1,-1,32x3072x8192,0,
2026-03-03T03:09:41.456183+00:00,FULL,llm_style,eval,llm_style_eval_157,64,6144,6144,bf16,NVIDIA GeForce RTX 4060,c09,128,64,64,8,3,8,0.0,0.0,344.543993473053,434.96640205383295,14.02386429464167,1,-1,-1,64x6144x6144,0,
2026-03-03T03:09:41.516895+00:00,FULL,llm_style,eval,llm_style_eval_158,8,8192,1536,bf16,NVIDIA GeForce RTX 4060,c11,32,128,32,4,2,8,0.0,0.0,62.78400123119354,158.7699180841443,3.2066543713683076,4,-1,-1,8x8192x1536,0,
2026-03-03T03:09:41.544882+00:00,FULL,llm_style,eval,llm_style_eval_159,64,4096,1536,bf16,NVIDIA GeForce RTX 4060,c04,64,64,64,4,3,8,0.0,0.0,56.32000043988228,152.46207803487778,14.298763524684434,2,-1,-1,64x4096x1536,0,
2026-03-03T03:09:41.696020+00:00,FULL,llm_style,eval,llm_style_eval_160,64,6144,4096,bf16,NVIDIA GeForce RTX 4060,c06,64,128,32,4,3,8,0.0,0.0,232.86399990320206,343.103679716587,13.833076273442925,1,-1,-1,64x6144x4096,0,
2026-03-03T03:09:41.829607+00:00,FULL,llm_style,eval,llm_style_eval_161,64,1536,6144,bf16,NVIDIA GeForce RTX 4060,c04,64,64,64,4,3,8,0.0,133.531,72.68800213932991,206.06495901942247,16.618417296496297,3,-1,-1,64x1536x6144,0,
2026-03-03T03:09:41.860472+00:00,FULL,llm_style,eval,llm_style_eval_162,64,4096,1024,bf16,NVIDIA GeForce RTX 4060,c04,64,64,64,4,3,8,0.0,0.0,32.19199925661087,276.70175939798344,16.6771534666257,2,-1,-1,64x4096x1024,0,
2026-03-03T03:09:42.008135+00:00,FULL,llm_style,eval,llm_style_eval_163,1,1024,8192,bf16,NVIDIA GeForce RTX 4060,c04,64,64,64,4,3,8,0.0,147.609,84.63999629020691,204.27007690072054,0.1982185342078184,7,-1,-1,1x1024x8192,0,
2026-03-03T03:09:42.114240+00:00,FULL,llm_style,eval,llm_style_eval_164,64,6144,3072,bf16,NVIDIA GeForce RTX 4060,c02,32,64,32,2,2,8,0.0,0.0,183.3759993314743,239.4316786527632,13.174674509246621,1,-1,-1,64x6144x3072,0,
2026-03-03T03:09:42.366492+00:00,FULL,llm_style,eval,llm_style_eval_165,32,6144,8192,bf16,NVIDIA GeForce RTX 4060,c11,32,128,32,4,2,8,0.0,0.0,428.3679872751236,549.8284703493118,7.519762371811262,1,-1,-1,32x6144x8192,0,
2026-03-03T03:09:42.442804+00:00,FULL,llm_style,eval,llm_style_eval_166,8,2048,2048,bf16,NVIDIA GeForce RTX 4060,c11,32,128,32,4,2,8,0.0,76.262,51.19999870657921,104.74847972393025,1.310720033111573,7,-1,-1,8x2048x2048,0,
2026-03-03T03:09:42.467773+00:00,FULL,llm_style,eval,llm_style_eval_167,32,4096,1536,bf16,NVIDIA GeForce RTX 4060,c11,32,128,32,4,2,8,0.0,0.0,43.007999658584595,73.03648028522723,9.362285788607435,2,-1,-1,32x4096x1536,0,
2026-03-03T03:09:42.483980+00:00,FULL,llm_style,eval,llm_style_eval_168,32,4096,1024,bf16,NVIDIA GeForce RTX 4060,c11,32,128,32,4,2,8,0.0,0.0,42.95999929308891,50.69823853671551,6.248497681963043,2,-1,-1,32x4096x1024,0,
2026-03-03T03:09:42.724775+00:00,FULL,llm_style,eval,llm_style_eval_169,2,6144,8192,bf16,NVIDIA GeForce RTX 4060,c11,32,128,32,4,2,8,0.0,0.0,425.7439970970154,534.1081434488297,0.47288181013183656,5,-1,-1,2x6144x8192,0,
2026-03-03T03:09:42.823377+00:00,FULL,llm_style,eval,llm_style_eval_170,32,6144,3072,bf16,NVIDIA GeForce RTX 4060,c00,32,32,32,2,2,8,0.0,0.0,184.32000279426575,228.1008026003837,6.553599900648331,1,-1,-1,32x6144x3072,0,
2026-03-03T03:09:42.842578+00:00,FULL,llm_style,eval,llm_style_eval_171,64,4096,1024,bf16,NVIDIA GeForce RTX 4060,c04,64,64,64,4,3,8,0.0,0.0,61.423998326063156,163.39296378195257,8.740409719830911,2,-1,-1,64x4096x1024,0,
2026-03-03T03:09:42.988152+00:00,FULL,llm_style,eval,llm_style_eval_172,16,8192,1536,bf16,NVIDIA GeForce RTX 4060,c11,32,128,32,4,2,8,0.0,145.52,62.463998794555664,70.27840189635752,6.4461640588257545,4,-1,-1,16x8192x1536,0,
2026-03-03T03:09:43.290972+00:00,FULL,llm_style,eval,llm_style_eval_173,4,4096,6144,bf16,NVIDIA GeForce RTX 4060,c03,64,64,32,4,2,8,0.0,302.776,226.30399465560913,246.56447842717165,0.8896289802854788,7,-1,-1,4x4096x6144,0,
2026-03-03T03:09:43.332356+00:00,FULL,llm_style,eval,llm_style_eval_174,64,4096,1536,bf16,NVIDIA GeForce RTX 4060,c04,64,64,64,4,3,8,0.0,0.0,64.51199948787689,137.18208059668538,12.483047718143245,2,-1,-1,64x4096x1536,0,
2026-03-03T03:09:43.576779+00:00,FULL,llm_style,eval,llm_style_eval_175,32,8192,6144,bf16,NVIDIA GeForce RTX 4060,c02,32,64,32,2,2,8,0.0,0.0,432.8639954328537,494.2336070537567,7.441657208700971,1,-1,-1,32x8192x6144,0,
2026-03-03T03:09:43.851746+00:00,FULL,llm_style,eval,llm_style_eval_176,2,6144,8192,bf16,NVIDIA GeForce RTX 4060,c11,32,128,32,4,2,8,0.0,0.0,425.9040057659149,496.6812720894813,0.4727041522841487,5,-1,-1,2x6144x8192,0,
2026-03-03T03:09:43.941072+00:00,FULL,llm_style,eval,llm_style_eval_177,32,8192,2048,bf16,NVIDIA GeForce RTX 4060,c02,32,64,32,2,2,8,0.0,0.0,167.52000153064728,242.79040008783338,6.4096335613008115,0,-1,-1,32x8192x2048,0,
2026-03-03T03:09:44.024713+00:00,FULL,llm_style,eval,llm_style_eval_178,32,1536,3072,bf16,NVIDIA GeForce RTX 4060,c04,64,64,64,4,3,8,0.0,83.59,51.04000121355057,56.8832006305456,5.916729639885372,3,-1,-1,32x1536x3072,0,
2026-03-03T03:09:44.099241+00:00,FULL,llm_style,eval,llm_style_eval_179,32,1536,2048,bf16,NVIDIA GeForce RTX 4060,c04,64,64,64,4,3,8,0.0,74.484,45.45599967241287,60.477439947426305,4.429043326533298,3,-1,-1,32x1536x2048,0,
2026-03-03T03:09:44.218352+00:00,FULL,llm_style,eval,llm_style_eval_180,64,1024,6144,bf16,NVIDIA GeForce RTX 4060,c04,64,64,64,4,3,8,0.0,119.063,73.35999980568886,135.06783954799155,10.97745869865107,3,-1,-1,64x1024x6144,0,
2026-03-03T03:09:44.781733+00:00,FULL,llm_style,eval,llm_style_eval_181,8,6144,8192,bf16,NVIDIA GeForce RTX 4060,c02,32,64,32,2,2,8,0.0,563.334,425.9839951992035,450.62144339084625,1.8904615597668486,5,-1,-1,8x6144x8192,0,
2026-03-03T03:09:44.823708+00:00,FULL,llm_style,eval,llm_style_eval_182,1,8192,1024,bf16,NVIDIA GeForce RTX 4060,c11,32,128,32,4,2,8,0.0,0.0,52.22399905323982,140.1983943581581,0.3212549077847609,4,-1,-1,1x8192x1024,0,
2026-03-03T03:09:44.870427+00:00,FULL,llm_style,eval,llm_style_eval_183,4,8192,1024,bf16,NVIDIA GeForce RTX 4060,c11,32,128,32,4,2,8,0.0,0.0,62.352001667022705,148.11776116490358,1.0762904510809497,4,-1,-1,4x8192x1024,0,
2026-03-03T03:09:45.200998+00:00,FULL,llm_style,eval,llm_style_eval_184,64,8192,8192,bf16,NVIDIA GeForce RTX 4060,c04,64,64,64,4,3,8,0.0,0.0,597.7599918842316,648.8595175743103,14.370206619086707,1,-1,-1,64x8192x8192,0,
2026-03-03T03:09:45.222861+00:00,FULL,llm_style,eval,llm_style_eval_185,64,4096,1024,bf16,NVIDIA GeForce RTX 4060,c04,64,64,64,4,3,8,0.0,0.0,71.68000191450119,182.07968071103085,7.489828371382737,2,-1,-1,64x4096x1024,0,
2026-03-03T03:09:45.313066+00:00,FULL,llm_style,eval,llm_style_eval_186,16,6144,1024,bf16,NVIDIA GeForce RTX 4060,c11,32,128,32,4,2,8,0.0,90.158,40.57599976658821,53.17727994173763,4.961716116870146,4,-1,-1,16x6144x1024,0,
2026-03-03T03:09:45.344891+00:00,FULL,llm_style,eval,llm_style_eval_187,32,4096,1536,bf16,NVIDIA GeForce RTX 4060,c11,32,128,32,4,2,8,0.0,0.0,52.97600105404854,170.84480039775352,7.600671549164211,2,-1,-1,32x4096x1536,0,
2026-03-03T03:09:45.475145+00:00,FULL,llm_style,eval,llm_style_eval_188,32,8192,3072,bf16,NVIDIA GeForce RTX 4060,c11,32,128,32,4,2,8,0.0,0.0,259.0560019016266,385.11615246534336,6.217237679023591,0,-1,-1,32x8192x3072,0,
2026-03-03T03:09:45.506173+00:00,FULL,llm_style,eval,llm_style_eval_189,64,4096,1536,bf16,NVIDIA GeForce RTX 4060,c04,64,64,64,4,3,8,0.0,0.0,80.78399673104286,162.8099189698696,9.96863736119836,2,-1,-1,64x4096x1536,0,
2026-03-03T03:09:45.586204+00:00,FULL,llm_style,eval,llm_style_eval_190,64,1024,2048,bf16,NVIDIA GeForce RTX 4060,c11,32,128,32,4,2,8,0.0,79.981,50.175998359918594,58.827520832419395,5.349877725889568,3,-1,-1,64x1024x2048,0,
2026-03-03T03:09:45.932577+00:00,FULL,llm_style,eval,llm_style_eval_191,1,8192,3072,bf16,NVIDIA GeForce RTX 4060,c11,32,128,32,4,2,8,0.0,346.33,226.30399465560913,295.4185554385185,0.2224072450713697,4,-1,-1,1x8192x3072,0,
2026-03-03T03:09:45.971181+00:00,FULL,llm_style,eval,llm_style_eval_192,32,8192,1024,bf16,NVIDIA GeForce RTX 4060,c02,32,64,32,2,2,8,0.0,0.0,54.207999259233475,142.62272343039507,9.903905684335923,0,-1,-1,32x8192x1024,0,
2026-03-03T03:09:46.740440+00:00,FULL,llm_style,eval,llm_style_eval_193,8,8192,8192,bf16,NVIDIA GeForce RTX 4060,c11,32,128,32,4,2,8,0.0,769.208,558.0800175666809,573.8963383436203,1.9239925999889549,5,-1,-1,8x8192x8192,0,
2026-03-03T03:09:47.053733+00:00,FULL,llm_style,eval,llm_style_eval_194,2,8192,3072,bf16,NVIDIA GeForce RTX 4060,c11,32,128,32,4,2,8,0.0,313.251,227.32800245285034,284.18720692396164,0.4428108060329188,4,-1,-1,2x8192x3072,0,
2026-03-03T03:09:47.081304+00:00,FULL,llm_style,eval,llm_style_eval_195,4,4096,1024,bf16,NVIDIA GeForce RTX 4060,c11,32,128,32,4,2,8,0.0,0.0,42.49599948525429,471.06656759977227,0.7895903710099365,6,-1,-1,4x4096x1024,0,
2026-03-03T03:09:47.138504+00:00,FULL,llm_style,eval,llm_style_eval_196,16,8192,1536,bf16,NVIDIA GeForce RTX 4060,c11,32,128,32,4,2,8,0.0,0.0,63.37599828839302,104.44608010351654,6.353401837833357,4,-1,-1,16x8192x1536,0,
2026-03-03T03:09:47.179323+00:00,FULL,llm_style,eval,llm_style_eval_197,16,8192,1024,bf16,NVIDIA GeForce RTX 4060,c11,32,128,32,4,2,8,0.0,0.0,56.784000247716904,167.7225682139393,4.7273079534545985,4,-1,-1,16x8192x1024,0,
2026-03-03T03:09:47.220390+00:00,FULL,llm_style,eval,llm_style_eval_198,8,4096,2048,bf16,NVIDIA GeForce RTX 4060,c11,32,128,32,4,2,8,0.0,0.0,54.27199974656105,122.84799911081788,2.4730566153222444,7,-1,-1,8x4096x2048,0,
2026-03-03T03:09:47.263007+00:00,FULL,llm_style,eval,llm_style_eval_199,8,6144,1536,bf16,NVIDIA GeForce RTX 4060,c11,32,128,32,4,2,8,0.0,0.0,46.52800038456917,53.05631969124079,3.2452489415400905,4,-1,-1,8x6144x1536,0,
2026-03-03T03:09:47.422464+00:00,FULL,llm_style,eval,llm_style_eval_200,64,8192,4096,bf16,NVIDIA GeForce RTX 4060,c10,64,128,64,8,3,8,0.0,0.0,303.99999022483826,366.85440421104425,14.128182349030485,1,-1,-1,64x8192x4096,0,
2026-03-03T03:09:47.498420+00:00,FULL,llm_style,eval,llm_style_eval_201,2,6144,1024,bf16,NVIDIA GeForce RTX 4060,c02,32,64,32,2,2,8,0.0,75.899,40.031999349594116,49.6041605621576,0.6286426960649707,4,-1,-1,2x6144x1024,0,
2026-03-03T03:09:47.808642+00:00,FULL,llm_style,eval,llm_style_eval_202,32,6144,4096,bf16,NVIDIA GeForce RTX 4060,c11,32,128,32,4,2,8,0.0,310.179,229.37600314617157,342.60384708642925,7.021714189402912,1,-1,-1,32x6144x4096,0,
2026-03-03T03:09:48.021057+00:00,FULL,llm_style,eval,llm_style_eval_203,64,6144,6144,bf16,NVIDIA GeForce RTX 4060,c09,128,64,64,8,3,8,0.0,0.0,342.5600081682205,405.36096602678276,14.105085511403992,1,-1,-1,64x6144x6144,0,
2026-03-03T03:09:48.037257+00:00,FULL,llm_style,eval,llm_style_eval_204,8,3072,1024,bf16,NVIDIA GeForce RTX 4060,c00,32,32,32,2,2,8,0.0,0.0,39.35999982059002,146.10687986016268,1.2787512253409739,6,-1,-1,8x3072x1024,0,
2026-03-03T03:09:48.467252+00:00,FULL,llm_style,eval,llm_style_eval_205,4,6144,6144,bf16,NVIDIA GeForce RTX 4060,c00,32,32,32,2,2,8,0.0,429.943,326.56000554561615,414.76097375154495,0.9247607878234678,5,-1,-1,4x6144x6144,0,
2026-03-03T03:09:48.491698+00:00,FULL,llm_style,eval,llm_style_eval_206,4,3072,1024,bf16,NVIDIA GeForce RTX 4060,c11,32,128,32,4,2,8,0.0,0.0,69.10400092601776,269.5884777605532,0.3641731833579701,6,-1,-1,4x3072x1024,0,
2026-03-03T03:09:48.808429+00:00,FULL,llm_style,eval,llm_style_eval_207,4,3072,8192,bf16,NVIDIA GeForce RTX 4060,c06,64,128,32,4,3,8,0.0,316.683,230.17599433660507,310.75999706983555,0.8746637223410177,7,-1,-1,4x3072x8192,0,
2026-03-03T03:09:48.852061+00:00,FULL,llm_style,eval,llm_style_eval_208,32,4096,1536,bf16,NVIDIA GeForce RTX 4060,c11,32,128,32,4,2,8,0.0,0.0,74.75200295448303,218.90271812677355,5.386520335049458,2,-1,-1,32x4096x1536,0,
2026-03-03T03:09:48.941231+00:00,FULL,llm_style,eval,llm_style_eval_209,8,2048,1024,bf16,NVIDIA GeForce RTX 4060,c00,32,32,32,2,2,8,0.0,89.112,61.2960010766983,123.02944250404826,0.5474163307654294,7,-1,-1,8x2048x1024,0,
2026-03-03T03:09:48.999629+00:00,FULL,llm_style,eval,llm_style_eval_210,1,6144,2048,bf16,NVIDIA GeForce RTX 4060,c11,32,128,32,4,2,8,0.0,0.0,62.52799928188324,73.28352257609367,0.4024728807737737,4,-1,-1,1x6144x2048,0,
2026-03-03T03:09:49.096344+00:00,FULL,llm_style,eval,llm_style_eval_211,4,6144,3072,bf16,NVIDIA GeForce RTX 4060,c11,32,128,32,4,2,8,0.0,0.0,201.05599611997604,295.5107225477693,0.7510094049117385,5,-1,-1,4x6144x3072,0,
2026-03-03T03:09:49.342340+00:00,FULL,llm_style,eval,llm_style_eval_212,32,6144,8192,bf16,NVIDIA GeForce RTX 4060,c11,32,128,32,4,2,8,0.0,0.0,451.58401131629944,599.7241538763045,7.133169889276222,1,-1,-1,32x6144x8192,0,
2026-03-03T03:09:49.433150+00:00,FULL,llm_style,eval,llm_style_eval_213,2,1536,3072,bf16,NVIDIA GeForce RTX 4060,c04,64,64,64,4,3,8,0.0,90.755,60.416001826524734,69.17120106518269,0.3124067702161895,7,-1,-1,2x1536x3072,0,
2026-03-03T03:09:49.533730+00:00,FULL,llm_style,eval,llm_style_eval_214,8,6144,3072,bf16,NVIDIA GeForce RTX 4060,c11,32,128,32,4,2,8,0.0,0.0,203.74400168657303,328.37023526430113,1.4822025949238116,5,-1,-1,8x6144x3072,0,
2026-03-03T03:09:49.658660+00:00,FULL,llm_style,eval,llm_style_eval_215,64,6144,4096,bf16,NVIDIA GeForce RTX 4060,c06,64,128,32,4,3,8,0.0,0.0,234.27199572324753,351.2121585011482,13.749938237625846,1,-1,-1,64x6144x4096,0,
2026-03-03T03:09:50.042335+00:00,FULL,llm_style,eval,llm_style_eval_216,1,8192,8192,bf16,NVIDIA GeForce RTX 4060,c11,32,128,32,4,2,8,0.0,0.0,558.0800175666809,650.1398283243178,0.24049907499861936,5,-1,-1,1x8192x8192,0,
2026-03-03T03:09:50.303442+00:00,FULL,llm_style,eval,llm_style_eval_217,64,6144,8192,bf16,NVIDIA GeForce RTX 4060,c06,64,128,32,4,3,8,0.0,0.0,457.72799849510193,580.1759910583494,14.074845683858555,1,-1,-1,64x6144x8192,0,
2026-03-03T03:09:50.430819+00:00,FULL,llm_style,eval,llm_style_eval_218,64,8192,3072,bf16,NVIDIA GeForce RTX 4060,c10,64,128,64,8,3,8,0.0,0.0,238.0320057272911,377.5612840056416,13.532740952872105,0,-1,-1,64x8192x3072,0,
2026-03-03T03:09:50.490334+00:00,FULL,llm_style,eval,llm_style_eval_219,1,3072,1024,bf16,NVIDIA GeForce RTX 4060,c00,32,32,32,2,2,8,0.0,59.458,35.61599925160408,136.23839952051634,0.17664690398140787,6,-1,-1,1x3072x1024,0,
2026-03-03T03:09:50.824139+00:00,FULL,llm_style,eval,llm_style_eval_220,32,8192,8192,bf16,NVIDIA GeForce RTX 4060,c11,32,128,32,4,2,8,0.0,0.0,590.7360017299652,674.9593722820282,7.270535879686062,1,-1,-1,32x8192x8192,0,
2026-03-03T03:09:50.884222+00:00,FULL,llm_style,eval,llm_style_eval_221,64,1024,1024,bf16,NVIDIA GeForce RTX 4060,c00,32,32,32,2,2,8,0.0,60.03,40.95999896526337,76.58976148813957,3.2768000827789328,3,-1,-1,64x1024x1024,0,
2026-03-03T03:09:50.977981+00:00,FULL,llm_style,eval,llm_style_eval_222,64,6144,3072,bf16,NVIDIA GeForce RTX 4060,c02,32,64,32,2,2,8,0.0,0.0,190.46400487422943,268.36800426244724,12.684386772163709,1,-1,-1,64x6144x3072,0,
2026-03-03T03:09:51.167788+00:00,FULL,llm_style,eval,llm_style_eval_223,2,8192,1536,bf16,NVIDIA GeForce RTX 4060,c00,32,32,32,2,2,8,0.0,189.756,87.0399996638298,167.06783615052674,0.5782588257627916,4,-1,-1,2x8192x1536,0,
2026-03-03T03:09:51.190627+00:00,FULL,llm_style,eval,llm_style_eval_224,4,3072,1024,bf16,NVIDIA GeForce RTX 4060,c11,32,128,32,4,2,8,0.0,0.0,26.496000587940216,130.0787191838025,0.949797080373494,6,-1,-1,4x3072x1024,0,
2026-03-03T03:09:51.361732+00:00,FULL,llm_style,eval,llm_style_eval_225,32,4096,8192,bf16,NVIDIA GeForce RTX 4060,c03,64,64,32,4,2,8,0.0,0.0,300.54399371147156,398.82752805948246,7.145322125657346,3,-1,-1,32x4096x8192,0,
2026-03-03T03:09:51.461440+00:00,FULL,llm_style,eval,llm_style_eval_226,32,6144,3072,bf16,NVIDIA GeForce RTX 4060,c00,32,32,32,2,2,8,0.0,0.0,187.391996383667,267.36639350652695,6.4461640588257545,1,-1,-1,32x6144x3072,0,
2026-03-03T03:09:51.479018+00:00,FULL,llm_style,eval,llm_style_eval_227,64,3072,1024,bf16,NVIDIA GeForce RTX 4060,c06,64,128,32,4,3,8,0.0,0.0,58.75200033187866,184.74688544869423,6.853437869782989,2,-1,-1,64x3072x1024,0,
2026-03-03T03:09:51.547066+00:00,FULL,llm_style,eval,llm_style_eval_228,64,8192,1536,bf16,NVIDIA GeForce RTX 4060,c04,64,64,64,4,3,8,0.0,0.0,119.66400220990181,198.6457636952399,13.459459037437467,0,-1,-1,64x8192x1536,0,
2026-03-03T03:09:51.572405+00:00,FULL,llm_style,eval,llm_style_eval_229,64,6144,1024,bf16,NVIDIA GeForce RTX 4060,c10,64,128,64,8,3,8,0.0,0.0,66.56000018119812,132.2319991141557,12.09895381321653,0,-1,-1,64x6144x1024,0,
2026-03-03T03:09:51.700662+00:00,FULL,llm_style,eval,llm_style_eval_230,64,8192,3072,bf16,NVIDIA GeForce RTX 4060,c10,64,128,64,8,3,8,0.0,0.0,245.7599937915802,402.450888454914,13.107200331115733,0,-1,-1,64x8192x3072,0,
2026-03-03T03:09:51.726856+00:00,FULL,llm_style,eval,llm_style_eval_231,4,6144,1024,bf16,NVIDIA GeForce RTX 4060,c02,32,64,32,2,2,8,0.0,0.0,58.73600021004677,215.2031995356083,0.8569130996323918,4,-1,-1,4x6144x1024,0,
2026-03-03T03:09:51.741940+00:00,FULL,llm_style,eval,llm_style_eval_232,1,3072,1024,bf16,NVIDIA GeForce RTX 4060,c00,32,32,32,2,2,8,0.0,0.0,43.935999274253845,138.83615449070928,0.1431959237054782,6,-1,-1,1x3072x1024,0,
2026-03-03T03:09:51.761526+00:00,FULL,llm_style,eval,llm_style_eval_233,64,4096,1024,bf16,NVIDIA GeForce RTX 4060,c04,64,64,64,4,3,8,0.0,0.0,54.27199974656105,78.88959936797615,9.892226461288978,2,-1,-1,64x4096x1024,0,
2026-03-03T03:09:51.776567+00:00,FULL,llm_style,eval,llm_style_eval_234,32,3072,1024,bf16,NVIDIA GeForce RTX 4060,c11,32,128,32,4,2,8,0.0,0.0,65.5359998345375,108.03999572992316,3.072000007756054,2,-1,-1,32x3072x1024,0,
2026-03-03T03:09:51.947921+00:00,FULL,llm_style,eval,llm_style_eval_235,64,8192,4096,bf16,NVIDIA GeForce RTX 4060,c10,64,128,64,8,3,8,0.0,0.0,337.92001008987427,467.087684571743,12.710011741706852,1,-1,-1,64x8192x4096,0,
2026-03-03T03:09:51.985410+00:00,FULL,llm_style,eval,llm_style_eval_236,32,2048,4096,bf16,NVIDIA GeForce RTX 4060,c00,32,32,32,2,2,8,0.0,0.0,83.8559977710247,165.92895656824112,6.402295915266164,3,-1,-1,32x2048x4096,0,
2026-03-03T03:09:52.020460+00:00,FULL,llm_style,eval,llm_style_eval_237,64,4096,1536,bf16,NVIDIA GeForce RTX 4060,c04,64,64,64,4,3,8,0.0,0.0,67.07200035452843,226.50079771876312,12.006595356383,2,-1,-1,64x4096x1536,0,
2026-03-03T03:09:52.046554+00:00,FULL,llm_style,eval,llm_style_eval_238,32,3072,1536,bf16,NVIDIA GeForce RTX 4060,c11,32,128,32,4,2,8,0.0,0.0,77.82399654388428,137.42080181837076,3.880421224958686,3,-1,-1,32x3072x1536,0,
2026-03-03T03:09:52.259019+00:00,FULL,llm_style,eval,llm_style_eval_239,8,2048,6144,bf16,NVIDIA GeForce RTX 4060,c00,32,32,32,2,2,8,0.0,212.413,106.49599879980087,243.70175644755352,1.8904615597668486,7,-1,-1,8x2048x6144,0,
2026-03-03T03:09:52.285864+00:00,FULL,llm_style,eval,llm_style_eval_240,16,4096,1024,bf16,NVIDIA GeForce RTX 4060,c11,32,128,32,4,2,8,0.0,0.0,69.63200122117996,196.98016256093968,1.9275293779604168,6,-1,-1,16x4096x1024,0,
2026-03-03T03:09:52.348790+00:00,FULL,llm_style,eval,llm_style_eval_241,2,6144,2048,bf16,NVIDIA GeForce RTX 4060,c11,32,128,32,4,2,8,0.0,0.0,71.68000191450119,86.4793615043163,0.7021714098171316,4,-1,-1,2x6144x2048,0,
2026-03-03T03:09:52.463176+00:00,FULL,llm_style,eval,llm_style_eval_242,4,1536,4096,bf16,NVIDIA GeForce RTX 4060,c04,64,64,64,4,3,8,0.0,114.328,70.65600156784058,81.45919777452944,0.7123478102801205,7,-1,-1,4x1536x4096,0,
2026-03-03T03:09:52.577134+00:00,FULL,llm_style,eval,llm_style_eval_243,64,2048,3072,bf16,NVIDIA GeForce RTX 4060,c03,64,64,32,4,2,8,0.0,113.915,81.90399780869484,99.4431991130113,9.832320638132629,3,-1,-1,64x2048x3072,0,
2026-03-03T03:09:52.671155+00:00,FULL,llm_style,eval,llm_style_eval_244,1,1536,3072,bf16,NVIDIA GeForce RTX 4060,c04,64,64,64,4,3,8,0.0,93.977,55.95200136303902,67.64544054865836,0.16866570935984518,7,-1,-1,1x1536x3072,0,
2026-03-03T03:09:53.043974+00:00,FULL,llm_style,eval,llm_style_eval_245,8,8192,8192,bf16,NVIDIA GeForce RTX 4060,c11,32,128,32,4,2,8,0.0,0.0,561.1519813537598,580.561289191246,1.913459917596005,5,-1,-1,8x8192x8192,0,
2026-03-03T03:09:53.170231+00:00,FULL,llm_style,eval,llm_style_eval_246,64,8192,3072,bf16,NVIDIA GeForce RTX 4060,c10,64,128,64,8,3,8,0.0,0.0,235.52000522613525,268.32896143198013,13.677077957378314,0,-1,-1,64x8192x3072,0,
2026-03-03T03:09:53.195002+00:00,FULL,llm_style,eval,llm_style_eval_247,8,6144,1024,bf16,NVIDIA GeForce RTX 4060,c11,32,128,32,4,2,8,0.0,0.0,48.128001391887665,194.32448238134378,2.091574407595649,4,-1,-1,8x6144x1024,0,
2026-03-03T03:09:53.223817+00:00,FULL,llm_style,eval,llm_style_eval_248,64,4096,1536,bf16,NVIDIA GeForce RTX 4060,c04,64,64,64,4,3,8,0.0,0.0,97.28000313043594,216.71935871243465,8.278231312556818,2,-1,-1,64x4096x1536,0,
2026-03-03T03:09:53.296978+00:00,FULL,llm_style,eval,llm_style_eval_249,2,4096,1024,bf16,NVIDIA GeForce RTX 4060,c00,32,32,32,2,2,8,0.0,73.109,41.98399931192398,75.91935954988,0.3996097626467677,6,-1,-1,2x4096x1024,0,
2026-03-03T03:09:53.321814+00:00,FULL,llm_style,eval,llm_style_eval_250,1,1536,3072,bf16,NVIDIA GeForce RTX 4060,c04,64,64,64,4,3,8,0.0,0.0,58.36800113320351,72.78592228889462,0.16168420738724798,7,-1,-1,1x1536x3072,0,
2026-03-03T03:09:53.484322+00:00,FULL,llm_style,eval,llm_style_eval_251,16,8192,4096,bf16,NVIDIA GeForce RTX 4060,c11,32,128,32,4,2,8,0.0,0.0,296.9599962234497,308.7667313218117,3.6157793563280327,5,-1,-1,16x8192x4096,0,
2026-03-03T03:09:53.545334+00:00,FULL,llm_style,eval,llm_style_eval_252,16,8192,1536,bf16,NVIDIA GeForce RTX 4060,c11,32,128,32,4,2,8,0.0,0.0,69.63200122117996,178.25792074203488,5.782588133881251,4,-1,-1,16x8192x1536,0,
2026-03-03T03:09:53.572862+00:00,FULL,llm_style,eval,llm_style_eval_253,64,6144,1024,bf16,NVIDIA GeForce RTX 4060,c10,64,128,64,8,3,8,0.0,0.0,75.50400123000145,229.35552284121496,10.665744263629994,0,-1,-1,64x6144x1024,0,
2026-03-03T03:09:53.765445+00:00,FULL,llm_style,eval,llm_style_eval_254,8,6144,6144,bf16,NVIDIA GeForce RTX 4060,c06,64,128,32,4,3,8,0.0,0.0,329.6159952878952,424.6220856904981,1.8323739886241515,5,-1,-1,8x6144x6144,0,
2026-03-03T03:09:53.790865+00:00,FULL,llm_style,eval,llm_style_eval_255,16,6144,1024,bf16,NVIDIA GeForce RTX 4060,c11,32,128,32,4,2,8,0.0,0.0,46.560000628232956,104.43231798708439,4.324024683924081,4,-1,-1,16x6144x1024,0,
2026-03-03T03:09:53.890150+00:00,BUCKET,llm_style,tune,llm_style_tune_000,64,4096,1536,bf16,NVIDIA GeForce RTX 4060,c04,64,64,64,4,3,8,0.0,97.03,61.535999178886414,67.08224035799503,13.086752124702775,2,-1,-1,llm8_g2,0,
2026-03-03T03:09:53.976922+00:00,BUCKET,llm_style,tune,llm_style_tune_001,32,3072,1536,bf16,NVIDIA GeForce RTX 4060,c11,32,128,32,4,2,8,0.0,86.726,50.31999945640564,62.231038697063916,6.001388936055667,3,-1,-1,llm8_g3,0,
2026-03-03T03:09:54.065587+00:00,BUCKET,llm_style,tune,llm_style_tune_002,1,4096,1536,bf16,NVIDIA GeForce RTX 4060,c02,32,64,32,2,2,8,0.0,88.619,49.15200173854828,115.23072175681591,0.2559999909450614,6,-1,-1,llm8_g6,0,
2026-03-03T03:09:54.268479+00:00,BUCKET,llm_style,tune,llm_style_tune_003,32,6144,2048,bf16,NVIDIA GeForce RTX 4060,c00,32,32,32,2,2,8,0.0,202.846,67.07200221717358,204.67455938458437,12.006595022949886,0,-1,-1,llm8_g0,0,
2026-03-03T03:09:54.301370+00:00,BUCKET,llm_style,tune,llm_style_tune_004,64,4096,1536,bf16,NVIDIA GeForce RTX 4060,c04,64,64,64,4,3,8,0.0,0.0,67.56800040602684,77.2751996666193,11.918457896649096,2,-1,-1,llm8_g2,0,
2026-03-03T03:09:54.732363+00:00,BUCKET,llm_style,tune,llm_style_tune_005,64,8192,4096,bf16,NVIDIA GeForce RTX 4060,c10,64,128,64,8,3,8,0.0,430.938,306.2720000743866,359.54688996076584,14.023375610427491,1,-1,-1,llm8_g1,0,
2026-03-03T03:09:55.300243+00:00,BUCKET,llm_style,tune,llm_style_tune_006,16,6144,8192,bf16,NVIDIA GeForce RTX 4060,c06,64,128,32,4,3,8,0.0,567.84,427.7600049972534,491.34654968976963,3.7652251664115757,5,-1,-1,llm8_g5,0,
2026-03-03T03:09:55.517325+00:00,BUCKET,llm_style,tune,llm_style_tune_007,8,8192,2048,bf16,NVIDIA GeForce RTX 4060,c11,32,128,32,4,2,8,0.0,217.038,160.76800227165222,227.37376481294626,1.6697069827764632,4,-1,-1,llm8_g4,0,
2026-03-03T03:09:55.608587+00:00,BUCKET,llm_style,tune,llm_style_tune_008,16,1536,3072,bf16,NVIDIA GeForce RTX 4060,c00,32,32,32,2,2,8,0.0,91.219,39.9360004812479,149.0204779803753,3.780923031361146,7,-1,-1,llm8_g7,0,
2026-03-03T03:09:55.732570+00:00,BUCKET,llm_style,tune,llm_style_tune_009,2,6144,4096,bf16,NVIDIA GeForce RTX 4060,c06,64,128,32,4,3,8,0.0,0.0,256.1279982328415,364.7532710433003,0.3930194929665157,5,-1,-1,llm8_g5,0,
2026-03-03T03:09:55.900637+00:00,BUCKET,llm_style,tune,llm_style_tune_010,4,8192,4096,bf16,NVIDIA GeForce RTX 4060,c06,64,128,32,4,3,8,0.0,0.0,324.6079981327057,382.67711758613575,0.8269526861450243,5,-1,-1,llm8_g5,0,
2026-03-03T03:09:55.914547+00:00,BUCKET,llm_style,tune,llm_style_tune_011,1,1024,1536,bf16,NVIDIA GeForce RTX 4060,c00,32,32,32,2,2,8,0.0,0.0,45.37600092589855,1031.014413833616,0.06932580958681535,7,-1,-1,llm8_g7,0,
2026-03-03T03:09:55.945038+00:00,BUCKET,llm_style,tune,llm_style_tune_012,64,6144,1024,bf16,NVIDIA GeForce RTX 4060,c00,32,32,32,2,2,8,0.0,0.0,81.216000020504,554.6377585828292,9.915612290640887,0,-1,-1,llm8_g0,0,
2026-03-03T03:09:56.068953+00:00,BUCKET,llm_style,tune,llm_style_tune_013,4,8192,3072,bf16,NVIDIA GeForce RTX 4060,c11,32,128,32,4,2,8,0.0,0.0,226.30399465560913,283.23584765195835,0.8896289802854788,4,-1,-1,llm8_g4,0,
2026-03-03T03:09:56.101088+00:00,BUCKET,llm_style,tune,llm_style_tune_014,8,4096,2048,bf16,NVIDIA GeForce RTX 4060,c00,32,32,32,2,2,8,0.0,0.0,52.22399905323982,100.19840031862252,2.570039262278087,7,-1,-1,llm8_g7,0,
2026-03-03T03:09:56.128305+00:00,BUCKET,llm_style,tune,llm_style_tune_015,16,4096,1024,bf16,NVIDIA GeForce RTX 4060,c02,32,64,32,2,2,8,0.0,0.0,50.84799975156784,142.49567985534665,2.6395871746333843,6,-1,-1,llm8_g6,0,
2026-03-03T03:09:56.177205+00:00,BUCKET,llm_style,tune,llm_style_tune_016,32,8192,1024,bf16,NVIDIA GeForce RTX 4060,c00,32,32,32,2,2,8,0.0,0.0,58.70399996638298,129.43360276520244,9.14538893955166,0,-1,-1,llm8_g0,0,
2026-03-03T03:09:56.225371+00:00,BUCKET,llm_style,tune,llm_style_tune_017,32,2048,4096,bf16,NVIDIA GeForce RTX 4060,c11,32,128,32,4,2,8,0.0,0.0,75.69600269198418,139.585602134466,7.092460538300681,3,-1,-1,llm8_g3,0,
2026-03-03T03:09:56.240472+00:00,BUCKET,llm_style,tune,llm_style_tune_018,32,3072,1024,bf16,NVIDIA GeForce RTX 4060,c04,64,64,64,4,3,8,0.0,0.0,38.91199827194214,115.67456133663654,5.173894966611581,2,-1,-1,llm8_g2,0,
2026-03-03T03:09:56.264034+00:00,BUCKET,llm_style,tune,llm_style_tune_019,4,6144,1024,bf16,NVIDIA GeForce RTX 4060,c11,32,128,32,4,2,8,0.0,0.0,38.83199952542782,127.65023753046984,1.2961384583619502,4,-1,-1,llm8_g4,0,
2026-03-03T03:09:56.324242+00:00,BUCKET,llm_style,tune,llm_style_tune_020,32,3072,4096,bf16,NVIDIA GeForce RTX 4060,c11,32,128,32,4,2,8,0.0,0.0,90.97599983215332,97.34143935143946,8.851855098990441,3,-1,-1,llm8_g3,0,
2026-03-03T03:09:56.452749+00:00,BUCKET,llm_style,tune,llm_style_tune_021,1,4096,6144,bf16,NVIDIA GeForce RTX 4060,c00,32,32,32,2,2,8,0.0,0.0,231.80799931287766,351.9180762767792,0.21712645011903142,7,-1,-1,llm8_g7,0,
2026-03-03T03:09:56.538470+00:00,BUCKET,llm_style,tune,llm_style_tune_022,64,4096,4096,bf16,NVIDIA GeForce RTX 4060,c11,32,128,32,4,2,8,0.0,0.0,166.8960005044937,270.73760092258453,12.867196586548392,3,-1,-1,llm8_g3,0,
2026-03-03T03:09:56.784413+00:00,BUCKET,llm_style,tune,llm_style_tune_023,1,8192,6144,bf16,NVIDIA GeForce RTX 4060,c06,64,128,32,4,3,8,0.0,0.0,453.6319971084595,476.64960116147995,0.22190519328805697,5,-1,-1,llm8_g5,0,
2026-03-03T03:09:56.803287+00:00,BUCKET,llm_style,tune,llm_style_tune_024,4,4096,1024,bf16,NVIDIA GeForce RTX 4060,c02,32,64,32,2,2,8,0.0,0.0,41.98399931192398,131.63519605994225,0.7992195252935353,6,-1,-1,llm8_g6,0,
2026-03-03T03:09:56.927932+00:00,BUCKET,llm_style,tune,llm_style_tune_025,64,8192,3072,bf16,NVIDIA GeForce RTX 4060,c00,32,32,32,2,2,8,0.0,0.0,239.21599984169006,288.6758443713187,13.465760961356112,0,-1,-1,llm8_g0,0,
2026-03-03T03:09:56.955956+00:00,BUCKET,llm_style,tune,llm_style_tune_026,32,4096,1536,bf16,NVIDIA GeForce RTX 4060,c04,64,64,64,4,3,8,0.0,0.0,79.8719972372055,162.34495520591724,5.041230943608337,2,-1,-1,llm8_g2,0,
2026-03-03T03:09:56.973385+00:00,BUCKET,llm_style,tune,llm_style_tune_027,64,3072,1024,bf16,NVIDIA GeForce RTX 4060,c04,64,64,64,4,3,8,0.0,0.0,66.15999713540077,198.65695655345897,6.08605201683948,2,-1,-1,llm8_g2,0,
2026-03-03T03:09:57.037409+00:00,BUCKET,llm_style,tune,llm_style_tune_028,32,6144,2048,bf16,NVIDIA GeForce RTX 4060,c00,32,32,32,2,2,8,0.0,0.0,77.82399654388428,84.51487869024277,10.347789933223162,0,-1,-1,llm8_g0,0,
2026-03-03T03:09:57.061177+00:00,BUCKET,llm_style,tune,llm_style_tune_029,2,4096,1536,bf16,NVIDIA GeForce RTX 4060,c02,32,64,32,2,2,8,0.0,0.0,43.68000105023384,51.60000137984752,0.5761406454880401,6,-1,-1,llm8_g6,0,
2026-03-03T03:09:57.087068+00:00,BUCKET,llm_style,tune,llm_style_tune_030,1,2048,3072,bf16,NVIDIA GeForce RTX 4060,c00,32,32,32,2,2,8,0.0,0.0,79.82399687170982,208.4643159806728,0.15763319920227487,7,-1,-1,llm8_g7,0,
2026-03-03T03:09:57.105068+00:00,BUCKET,llm_style,tune,llm_style_tune_031,16,4096,1024,bf16,NVIDIA GeForce RTX 4060,c02,32,64,32,2,2,8,0.0,0.0,43.007999658584595,235.99104523658744,3.120761929535812,6,-1,-1,llm8_g6,0,
2026-03-03T03:09:57.121390+00:00,BUCKET,llm_style,tune,llm_style_tune_032,32,3072,1024,bf16,NVIDIA GeForce RTX 4060,c04,64,64,64,4,3,8,0.0,0.0,65.95199927687645,133.47296401858324,3.05262303201455,2,-1,-1,llm8_g2,0,
2026-03-03T03:09:57.304778+00:00,BUCKET,llm_style,tune,llm_style_tune_033,64,6144,6144,bf16,NVIDIA GeForce RTX 4060,c10,64,128,64,8,3,8,0.0,0.0,335.55200695991516,448.07039856910706,14.399670119026315,1,-1,-1,llm8_g1,0,
2026-03-03T03:09:57.340508+00:00,BUCKET,llm_style,tune,llm_style_tune_034,64,2048,4096,bf16,NVIDIA GeForce RTX 4060,c11,32,128,32,4,2,8,0.0,0.0,77.56800204515457,123.11551667749868,13.842587093772815,3,-1,-1,llm8_g3,0,
2026-03-03T03:09:57.372106+00:00,BUCKET,llm_style,tune,llm_style_tune_035,64,4096,1536,bf16,NVIDIA GeForce RTX 4060,c04,64,64,64,4,3,8,0.0,0.0,51.711998879909515,141.33952185511583,15.572911228400946,2,-1,-1,llm8_g2,0,
2026-03-03T03:09:57.691777+00:00,BUCKET,llm_style,tune,llm_style_tune_036,32,8192,8192,bf16,NVIDIA GeForce RTX 4060,c10,64,128,64,8,3,8,0.0,0.0,652.288019657135,689.6947264671326,6.584464479751724,1,-1,-1,llm8_g1,0,
2026-03-03T03:09:57.761657+00:00,BUCKET,llm_style,tune,llm_style_tune_037,32,6144,2048,bf16,NVIDIA GeForce RTX 4060,c00,32,32,32,2,2,8,0.0,0.0,107.87199810147285,196.20864301919937,7.465388443463016,0,-1,-1,llm8_g0,0,
2026-03-03T03:09:57.890645+00:00,BUCKET,llm_style,tune,llm_style_tune_038,32,8192,3072,bf16,NVIDIA GeForce RTX 4060,c00,32,32,32,2,2,8,0.0,0.0,234.49599742889404,376.5744003653525,6.868401822032737,0,-1,-1,llm8_g0,0,
2026-03-03T03:09:57.987786+00:00,BUCKET,llm_style,tune,llm_style_tune_039,4,6144,3072,bf16,NVIDIA GeForce RTX 4060,c06,64,128,32,4,3,8,0.0,0.0,187.72800266742706,223.49824100732798,0.8043282933526855,5,-1,-1,llm8_g5,0,
2026-03-03T03:09:58.004479+00:00,BUCKET,llm_style,tune,llm_style_tune_040,8,3072,1024,bf16,NVIDIA GeForce RTX 4060,c02,32,64,32,2,2,8,0.0,0.0,54.09600026905537,109.99615930020809,0.9304134825064193,6,-1,-1,llm8_g6,0,
2026-03-03T03:09:58.197933+00:00,BUCKET,llm_style,tune,llm_style_tune_041,8,6144,6144,bf16,NVIDIA GeForce RTX 4060,c06,64,128,32,4,3,8,0.0,0.0,531.9679975509644,606.0236686468122,1.1353686289035398,5,-1,-1,llm8_g5,0,
2026-03-03T03:09:58.216848+00:00,BUCKET,llm_style,tune,llm_style_tune_042,1,4096,1024,bf16,NVIDIA GeForce RTX 4060,c02,32,64,32,2,2,8,0.0,0.0,55.296000093221664,94.14048179984084,0.15170370344795153,6,-1,-1,llm8_g6,0,
2026-03-03T03:09:58.354136+00:00,BUCKET,llm_style,tune,llm_style_tune_043,64,6144,4096,bf16,NVIDIA GeForce RTX 4060,c10,64,128,64,8,3,8,0.0,0.0,376.8320083618164,487.0246371626854,8.548173723361447,1,-1,-1,llm8_g1,0,
2026-03-03T03:09:58.415058+00:00,BUCKET,llm_style,tune,llm_style_tune_044,8,6144,2048,bf16,NVIDIA GeForce RTX 4060,c11,32,128,32,4,2,8,0.0,0.0,98.30400347709656,164.4223994016647,2.047999927560491,4,-1,-1,llm8_g4,0,
2026-03-03T03:09:58.452894+00:00,BUCKET,llm_style,tune,llm_style_tune_045,2,3072,3072,bf16,NVIDIA GeForce RTX 4060,c00,32,32,32,2,2,8,0.0,0.0,81.91999793052673,200.5180798470973,0.46080001164078743,7,-1,-1,llm8_g7,0,
2026-03-03T03:09:58.719227+00:00,BUCKET,llm_style,tune,llm_style_tune_046,16,8192,6144,bf16,NVIDIA GeForce RTX 4060,c06,64,128,32,4,3,8,0.0,0.0,739.3280267715454,824.442860484123,2.1784819155755937,5,-1,-1,llm8_g5,0,
2026-03-03T03:09:58.772818+00:00,BUCKET,llm_style,tune,llm_style_tune_047,16,8192,1024,bf16,NVIDIA GeForce RTX 4060,c11,32,128,32,4,2,8,0.0,0.0,94.04800087213516,189.41152036190033,2.85423883028579,4,-1,-1,llm8_g4,0,
2026-03-03T03:09:58.789834+00:00,BUCKET,llm_style,tune,llm_style_tune_048,32,2048,1024,bf16,NVIDIA GeForce RTX 4060,c11,32,128,32,4,2,8,0.0,0.0,60.416001826524734,126.03392176330088,2.221559254870681,3,-1,-1,llm8_g3,0,
2026-03-03T03:09:58.833982+00:00,BUCKET,llm_style,tune,llm_style_tune_049,8,8192,1024,bf16,NVIDIA GeForce RTX 4060,c11,32,128,32,4,2,8,0.0,0.0,92.16000139713287,104.48895812034607,1.4563555334774068,4,-1,-1,llm8_g4,0,
2026-03-03T03:09:59.014338+00:00,BUCKET,llm_style,tune,llm_style_tune_050,64,8192,4096,bf16,NVIDIA GeForce RTX 4060,c10,64,128,64,8,3,8,0.0,0.0,542.7200198173523,630.876161456108,7.913780843104763,1,-1,-1,llm8_g1,0,
2026-03-03T03:09:59.063139+00:00,BUCKET,llm_style,tune,llm_style_tune_051,16,2048,4096,bf16,NVIDIA GeForce RTX 4060,c00,32,32,32,2,2,8,0.0,0.0,140.28799533843994,215.99487766623497,1.913459917596005,7,-1,-1,llm8_g7,0,
2026-03-03T03:09:59.119495+00:00,BUCKET,llm_style,tune,llm_style_tune_052,32,3072,3072,bf16,NVIDIA GeForce RTX 4060,c11,32,128,32,4,2,8,0.0,0.0,128.35200130939484,264.7859200835227,4.705651410484014,3,-1,-1,llm8_g3,0,
2026-03-03T03:09:59.488240+00:00,BUCKET,llm_style,tune,llm_style_tune_053,32,8192,8192,bf16,NVIDIA GeForce RTX 4060,c10,64,128,64,8,3,8,0.0,0.0,1016.6720151901245,1152.583693265915,4.224535771447208,1,-1,-1,llm8_g1,0,
2026-03-03T03:09:59.539620+00:00,BUCKET,llm_style,tune,llm_style_tune_054,4,4096,2048,bf16,NVIDIA GeForce RTX 4060,c00,32,32,32,2,2,8,0.0,0.0,113.15200105309486,227.38943502306938,0.5930859673308843,7,-1,-1,llm8_g7,0,
2026-03-03T03:09:59.586405+00:00,BUCKET,llm_style,tune,llm_style_tune_055,16,8192,1024,bf16,NVIDIA GeForce RTX 4060,c11,32,128,32,4,2,8,0.0,0.0,100.35199671983719,108.58495950698853,2.674938862944784,4,-1,-1,llm8_g4,0,
2026-03-03T03:09:59.680536+00:00,BUCKET,llm_style,tune,llm_style_tune_056,32,8192,2048,bf16,NVIDIA GeForce RTX 4060,c00,32,32,32,2,2,8,0.0,0.0,258.7999999523163,283.16671520471573,4.148925132140016,0,-1,-1,llm8_g0,0,
2026-03-03T03:09:59.710339+00:00,BUCKET,llm_style,tune,llm_style_tune_057,2,4096,1536,bf16,NVIDIA GeForce RTX 4060,c02,32,64,32,2,2,8,0.0,0.0,94.2080020904541,194.76351842284197,0.26713042885504523,6,-1,-1,llm8_g6,0,
2026-03-03T03:10:00.071695+00:00,BUCKET,llm_style,tune,llm_style_tune_058,1,8192,8192,bf16,NVIDIA GeForce RTX 4060,c06,64,128,32,4,3,8,0.0,0.0,1075.6799578666687,1170.5472004413605,0.1247747780540468,5,-1,-1,llm8_g5,0,
2026-03-03T03:10:00.336901+00:00,BUCKET,llm_style,tune,llm_style_tune_059,64,8192,6144,bf16,NVIDIA GeForce RTX 4060,c10,64,128,64,8,3,8,0.0,0.0,889.8559808731079,968.4829008579253,7.239880477826089,1,-1,-1,llm8_g1,0,
2026-03-03T03:10:00.356311+00:00,BUCKET,llm_style,tune,llm_style_tune_060,64,2048,1536,bf16,NVIDIA GeForce RTX 4060,c11,32,128,32,4,2,8,0.0,0.0,109.02399942278862,238.00672128796566,3.6932527345519106,3,-1,-1,llm8_g3,0,
2026-03-03T03:10:00.375023+00:00,BUCKET,llm_style,tune,llm_style_tune_061,32,3072,1024,bf16,NVIDIA GeForce RTX 4060,c04,64,64,64,4,3,8,0.0,0.0,107.00799897313118,285.1123155653475,1.881416285997007,2,-1,-1,llm8_g2,0,
2026-03-03T03:10:00.412344+00:00,BUCKET,llm_style,tune,llm_style_tune_062,16,8192,1024,bf16,NVIDIA GeForce RTX 4060,c11,32,128,32,4,2,8,0.0,0.0,117.71200224757195,194.19135838747013,2.280442528158058,4,-1,-1,llm8_g4,0,
2026-03-03T03:10:00.615112+00:00,BUCKET,llm_style,tune,llm_style_tune_063,64,6144,6144,bf16,NVIDIA GeForce RTX 4060,c10,64,128,64,8,3,8,0.0,0.0,610.2240085601807,714.3164610862732,7.918138487210112,1,-1,-1,llm8_g1,0,
2026-03-03T03:10:00.681138+00:00,BUCKET,llm_style,eval,llm_style_eval_000,4,8192,1536,bf16,NVIDIA GeForce RTX 4060,c11,32,128,32,4,2,8,0.0,0.0,142.84799993038177,266.65438935160626,0.7046881723864467,4,-1,-1,llm8_g4,0,
2026-03-03T03:10:00.691129+00:00,BUCKET,llm_style,eval,llm_style_eval_001,32,1024,1024,bf16,NVIDIA GeForce RTX 4060,c11,32,128,32,4,2,8,0.0,0.0,75.77600330114365,133.5363194346428,0.8856215830399591,3,-1,-1,llm8_g3,0,
2026-03-03T03:10:00.873426+00:00,BUCKET,llm_style,eval,llm_style_eval_002,8,8192,4096,bf16,NVIDIA GeForce RTX 4060,c06,64,128,32,4,3,8,0.0,0.0,657.9200029373169,957.2665423154824,0.8160124477187392,5,-1,-1,llm8_g5,0,
2026-03-03T03:10:01.004142+00:00,BUCKET,llm_style,eval,llm_style_eval_003,8,8192,3072,bf16,NVIDIA GeForce RTX 4060,c11,32,128,32,4,2,8,0.0,0.0,363.98400366306305,487.44448095560074,1.1062386806776616,4,-1,-1,llm8_g4,0,
2026-03-03T03:10:01.275921+00:00,BUCKET,llm_style,eval,llm_style_eval_004,2,6144,8192,bf16,NVIDIA GeForce RTX 4060,c06,64,128,32,4,3,8,0.0,0.0,952.3199796676636,977.9404759407043,0.21140645612649864,5,-1,-1,llm8_g5,0,
2026-03-03T03:10:01.487070+00:00,BUCKET,llm_style,eval,llm_style_eval_005,2,6144,6144,bf16,NVIDIA GeForce RTX 4060,c06,64,128,32,4,3,8,0.0,0.0,727.5519967079163,816.300159692764,0.20753835421142905,5,-1,-1,llm8_g5,0,
2026-03-03T03:10:01.554998+00:00,BUCKET,llm_style,eval,llm_style_eval_006,1,6144,2048,bf16,NVIDIA GeForce RTX 4060,c11,32,128,32,4,2,8,0.0,0.0,155.64799308776855,245.5244848132133,0.1616842177066119,4,-1,-1,llm8_g4,0,
2026-03-03T03:10:01.623273+00:00,BUCKET,llm_style,eval,llm_style_eval_007,8,8192,1536,bf16,NVIDIA GeForce RTX 4060,c11,32,128,32,4,2,8,0.0,0.0,200.1280039548874,224.40896123647684,1.0059891070786016,4,-1,-1,llm8_g4,0,
2026-03-03T03:10:01.652365+00:00,BUCKET,llm_style,eval,llm_style_eval_008,16,4096,1536,bf16,NVIDIA GeForce RTX 4060,c02,32,64,32,2,2,8,0.0,0.0,137.2160017490387,218.30591917037958,1.4672238618948863,6,-1,-1,llm8_g6,0,
2026-03-03T03:10:01.856676+00:00,BUCKET,llm_style,eval,llm_style_eval_009,64,4096,8192,bf16,NVIDIA GeForce RTX 4060,c11,32,128,32,4,2,8,0.0,0.0,948.1440186500549,1061.358379125595,4.529868049070302,3,-1,-1,llm8_g3,0,
2026-03-03T03:10:01.882695+00:00,BUCKET,llm_style,eval,llm_style_eval_010,4,4096,1024,bf16,NVIDIA GeForce RTX 4060,c02,32,64,32,2,2,8,0.0,0.0,118.22400242090225,128.52224245667458,0.2838208089127213,6,-1,-1,llm8_g6,0,
2026-03-03T03:10:01.903704+00:00,BUCKET,llm_style,eval,llm_style_eval_011,4,1536,2048,bf16,NVIDIA GeForce RTX 4060,c00,32,32,32,2,2,8,0.0,0.0,122.8799968957901,157.82368481159207,0.20480000517368332,7,-1,-1,llm8_g7,0,
2026-03-03T03:10:02.107133+00:00,BUCKET,llm_style,eval,llm_style_eval_012,4,8192,4096,bf16,NVIDIA GeForce RTX 4060,c06,64,128,32,4,3,8,0.0,0.0,828.4159898757935,960.4403287172318,0.3240346145904876,5,-1,-1,llm8_g5,0,
2026-03-03T03:10:02.132620+00:00,BUCKET,llm_style,eval,llm_style_eval_013,64,4096,1024,bf16,NVIDIA GeForce RTX 4060,c04,64,64,64,4,3,8,0.0,0.0,116.73600226640701,200.22271707654,4.5990174545706095,2,-1,-1,llm8_g2,0,
2026-03-03T03:10:02.199236+00:00,BUCKET,llm_style,eval,llm_style_eval_014,16,6144,2048,bf16,NVIDIA GeForce RTX 4060,c11,32,128,32,4,2,8,0.0,0.0,172.03199863433838,351.3548794388769,2.340571447151859,4,-1,-1,llm8_g4,0,
2026-03-03T03:10:02.289475+00:00,BUCKET,llm_style,eval,llm_style_eval_015,2,8192,2048,bf16,NVIDIA GeForce RTX 4060,c11,32,128,32,4,2,8,0.0,0.0,240.12799561023712,376.20383977890015,0.27947122046080586,4,-1,-1,llm8_g4,0,
2026-03-03T03:10:02.317666+00:00,BUCKET,llm_style,eval,llm_style_eval_016,8,3072,2048,bf16,NVIDIA GeForce RTX 4060,c00,32,32,32,2,2,8,0.0,0.0,114.68800157308578,120.37119969725609,0.877714273675364,7,-1,-1,llm8_g7,0,
2026-03-03T03:10:02.340526+00:00,BUCKET,llm_style,eval,llm_style_eval_017,64,4096,1024,bf16,NVIDIA GeForce RTX 4060,c04,64,64,64,4,3,8,0.0,0.0,143.3280035853386,155.67327663302422,3.745750297012565,2,-1,-1,llm8_g2,0,
2026-03-03T03:10:02.536452+00:00,BUCKET,llm_style,eval,llm_style_eval_018,16,8192,4096,bf16,NVIDIA GeForce RTX 4060,c06,64,128,32,4,3,8,0.0,0.0,857.9359948635101,995.9936130046844,1.2515407098297846,5,-1,-1,llm8_g5,0,
2026-03-03T03:10:02.552576+00:00,BUCKET,llm_style,eval,llm_style_eval_019,1,1024,2048,bf16,NVIDIA GeForce RTX 4060,c00,32,32,32,2,2,8,0.0,0.0,108.47999900579453,311.9785594940181,0.03866430713901425,7,-1,-1,llm8_g7,0,
2026-03-03T03:10:02.701560+00:00,BUCKET,llm_style,eval,llm_style_eval_020,2,6144,4096,bf16,NVIDIA GeForce RTX 4060,c06,64,128,32,4,3,8,0.0,0.0,620.9760010242462,721.136317849159,0.16210496997301763,5,-1,-1,llm8_g5,0,
2026-03-03T03:10:02.923778+00:00,BUCKET,llm_style,eval,llm_style_eval_021,16,6144,6144,bf16,NVIDIA GeForce RTX 4060,c06,64,128,32,4,3,8,0.0,0.0,931.8400025367737,1040.4863941669464,1.2963164799874853,5,-1,-1,llm8_g5,0,
2026-03-03T03:10:03.030725+00:00,BUCKET,llm_style,eval,llm_style_eval_022,16,4096,4096,bf16,NVIDIA GeForce RTX 4060,c00,32,32,32,2,2,8,0.0,0.0,298.4960079193115,394.3808057904243,1.7985865732084607,7,-1,-1,llm8_g7,0,
2026-03-03T03:10:03.103718+00:00,BUCKET,llm_style,eval,llm_style_eval_023,4,6144,2048,bf16,NVIDIA GeForce RTX 4060,c11,32,128,32,4,2,8,0.0,0.0,184.32000279426575,188.95872071385384,0.5461333250540276,4,-1,-1,llm8_g4,0,
2026-03-03T03:10:03.127375+00:00,BUCKET,llm_style,eval,llm_style_eval_024,32,4096,1024,bf16,NVIDIA GeForce RTX 4060,c04,64,64,64,4,3,8,0.0,0.0,147.45600521564484,164.38271969556808,1.8204443800537697,2,-1,-1,llm8_g2,0,
2026-03-03T03:10:03.347932+00:00,BUCKET,llm_style,eval,llm_style_eval_025,16,6144,6144,bf16,NVIDIA GeForce RTX 4060,c06,64,128,32,4,3,8,0.0,0.0,962.5439941883087,1037.4690973758695,1.2549655488928013,5,-1,-1,llm8_g5,0,
2026-03-03T03:10:03.423725+00:00,BUCKET,llm_style,eval,llm_style_eval_026,4,6144,2048,bf16,NVIDIA GeForce RTX 4060,c11,32,128,32,4,2,8,0.0,0.0,203.2639980316162,319.21983182430256,0.4952342617227403,4,-1,-1,llm8_g4,0,
2026-03-03T03:10:03.517829+00:00,BUCKET,llm_style,eval,llm_style_eval_027,32,8192,2048,bf16,NVIDIA GeForce RTX 4060,c00,32,32,32,2,2,8,0.0,0.0,368.6400055885315,409.1366395354271,2.9127110669548135,0,-1,-1,llm8_g0,0,
2026-03-03T03:10:03.694342+00:00,BUCKET,llm_style,eval,llm_style_eval_028,64,8192,3072,bf16,NVIDIA GeForce RTX 4060,c00,32,32,32,2,2,8,0.0,0.0,1053.1839728355408,1200.5580985546112,3.0585591454903467,0,-1,-1,llm8_g0,0,
2026-03-03T03:10:03.793321+00:00,BUCKET,llm_style,eval,llm_style_eval_029,8,8192,2048,bf16,NVIDIA GeForce RTX 4060,c11,32,128,32,4,2,8,0.0,0.0,337.72800862789154,408.8729527592658,0.7948273437272475,4,-1,-1,llm8_g4,0,
2026-03-03T03:10:03.907613+00:00,BUCKET,llm_style,eval,llm_style_eval_030,8,6144,3072,bf16,NVIDIA GeForce RTX 4060,c06,64,128,32,4,3,8,0.0,0.0,555.9999942779541,662.8428947925566,0.5431472861653125,5,-1,-1,llm8_g5,0,
2026-03-03T03:10:04.024114+00:00,BUCKET,llm_style,eval,llm_style_eval_031,4,6144,3072,bf16,NVIDIA GeForce RTX 4060,c06,64,128,32,4,3,8,0.0,0.0,556.0320019721985,641.3721537590027,0.27155801008653047,5,-1,-1,llm8_g5,0,
2026-03-03T03:10:04.113797+00:00,BUCKET,llm_style,eval,llm_style_eval_032,64,4096,3072,bf16,NVIDIA GeForce RTX 4060,c11,32,128,32,4,2,8,0.0,0.0,495.58399617671967,521.2604957818985,3.2499288686184165,3,-1,-1,llm8_g3,0,
2026-03-03T03:10:04.344926+00:00,BUCKET,llm_style,eval,llm_style_eval_033,2,6144,6144,bf16,NVIDIA GeForce RTX 4060,c06,64,128,32,4,3,8,0.0,0.0,1111.5520000457764,1228.0217516422272,0.13584154766828874,5,-1,-1,llm8_g5,0,
2026-03-03T03:10:04.698418+00:00,BUCKET,llm_style,eval,llm_style_eval_034,4,8192,6144,bf16,NVIDIA GeForce RTX 4060,c06,64,128,32,4,3,8,0.0,0.0,1749.9039769172668,1811.9500768184662,0.2301001593866524,5,-1,-1,llm8_g5,0,
2026-03-03T03:10:04.751197+00:00,BUCKET,llm_style,eval,llm_style_eval_035,8,6144,1536,bf16,NVIDIA GeForce RTX 4060,c11,32,128,32,4,2,8,0.0,0.0,162.81600296497345,228.9459154009818,0.9273962095266733,4,-1,-1,llm8_g4,0,
2026-03-03T03:10:04.777966+00:00,BUCKET,llm_style,eval,llm_style_eval_036,64,3072,1024,bf16,NVIDIA GeForce RTX 4060,c04,64,64,64,4,3,8,0.0,0.0,141.695998609066,155.66848054528236,2.841669404588517,2,-1,-1,llm8_g2,0,
2026-03-03T03:10:04.792384+00:00,BUCKET,llm_style,eval,llm_style_eval_037,2,1024,2048,bf16,NVIDIA GeForce RTX 4060,c00,32,32,32,2,2,8,0.0,0.0,96.25600278377533,163.79167884588242,0.0871489336498187,7,-1,-1,llm8_g7,0,
2026-03-03T03:10:04.843412+00:00,BUCKET,llm_style,eval,llm_style_eval_038,32,8192,1024,bf16,NVIDIA GeForce RTX 4060,c00,32,32,32,2,2,8,0.0,0.0,152.5759994983673,246.50144860148424,3.518711420964639,0,-1,-1,llm8_g0,0,
2026-03-03T03:10:04.862134+00:00,BUCKET,llm_style,eval,llm_style_eval_039,16,3072,1024,bf16,NVIDIA GeForce RTX 4060,c02,32,64,32,2,2,8,0.0,0.0,86.97599917650223,677.4886471033082,1.15736866437972,6,-1,-1,llm8_g6,0,
2026-03-03T03:10:04.884010+00:00,BUCKET,llm_style,eval,llm_style_eval_040,32,4096,1024,bf16,NVIDIA GeForce RTX 4060,c04,64,64,64,4,3,8,0.0,0.0,129.02399897575378,137.25696176290512,2.0805079530238744,2,-1,-1,llm8_g2,0,
2026-03-03T03:10:04.975968+00:00,BUCKET,llm_style,eval,llm_style_eval_041,4,8192,2048,bf16,NVIDIA GeForce RTX 4060,c11,32,128,32,4,2,8,0.0,0.0,256.00001215934753,322.01343297958374,0.5242879750976575,4,-1,-1,llm8_g4,0,
2026-03-03T03:10:05.066319+00:00,BUCKET,llm_style,eval,llm_style_eval_042,2,8192,2048,bf16,NVIDIA GeForce RTX 4060,c11,32,128,32,4,2,8,0.0,0.0,260.09601354599,375.0911927223205,0.2580157345938478,4,-1,-1,llm8_g4,0,
2026-03-03T03:10:05.138865+00:00,BUCKET,llm_style,eval,llm_style_eval_043,2,6144,2048,bf16,NVIDIA GeForce RTX 4060,c11,32,128,32,4,2,8,0.0,0.0,160.15999764204025,264.8473599553107,0.314258546085221,4,-1,-1,llm8_g4,0,
2026-03-03T03:10:05.525694+00:00,BUCKET,llm_style,eval,llm_style_eval_044,64,8192,8192,bf16,NVIDIA GeForce RTX 4060,c10,64,128,64,8,3,8,0.0,0.0,1514.4959688186646,1621.1045813560486,5.671810799668428,1,-1,-1,llm8_g1,0,
2026-03-03T03:10:05.546722+00:00,BUCKET,llm_style,eval,llm_style_eval_045,4,1536,1536,bf16,NVIDIA GeForce RTX 4060,c00,32,32,32,2,2,8,0.0,0.0,89.08800035715103,124.93280127644539,0.21186206811616876,7,-1,-1,llm8_g7,0,
2026-03-03T03:10:05.569179+00:00,BUCKET,llm_style,eval,llm_style_eval_046,16,4096,1024,bf16,NVIDIA GeForce RTX 4060,c02,32,64,32,2,2,8,0.0,0.0,98.25600311160088,159.38016153872,1.3660002824209445,6,-1,-1,llm8_g6,0,
2026-03-03T03:10:05.661580+00:00,BUCKET,llm_style,eval,llm_style_eval_047,32,8192,2048,bf16,NVIDIA GeForce RTX 4060,c00,32,32,32,2,2,8,0.0,0.0,263.16800713539124,379.40223813056946,4.080062146184796,0,-1,-1,llm8_g0,0,
2026-03-03T03:10:05.794256+00:00,BUCKET,llm_style,eval,llm_style_eval_048,16,8192,3072,bf16,NVIDIA GeForce RTX 4060,c11,32,128,32,4,2,8,0.0,0.0,364.54400420188904,483.4099194407463,2.2090786262226145,4,-1,-1,llm8_g4,0,
2026-03-03T03:10:05.895909+00:00,BUCKET,llm_style,eval,llm_style_eval_049,1,6144,3072,bf16,NVIDIA GeForce RTX 4060,c06,64,128,32,4,3,8,0.0,0.0,293.88800263404846,418.0787274241447,0.1284459918801279,5,-1,-1,llm8_g5,0,
2026-03-03T03:10:05.932044+00:00,BUCKET,llm_style,eval,llm_style_eval_050,64,4096,1536,bf16,NVIDIA GeForce RTX 4060,c04,64,64,64,4,3,8,0.0,0.0,116.73600226640701,214.0364775061605,6.898526181855913,2,-1,-1,llm8_g2,0,
2026-03-03T03:10:06.078945+00:00,BUCKET,llm_style,eval,llm_style_eval_051,8,6144,4096,bf16,NVIDIA GeForce RTX 4060,c06,64,128,32,4,3,8,0.0,0.0,388.08000087738037,596.2159925699232,1.0375520075491451,5,-1,-1,llm8_g5,0,
2026-03-03T03:10:06.214792+00:00,BUCKET,llm_style,eval,llm_style_eval_052,32,8192,3072,bf16,NVIDIA GeForce RTX 4060,c00,32,32,32,2,2,8,0.0,0.0,379.90400195121765,502.40511506795883,4.239525584694457,0,-1,-1,llm8_g0,0,
2026-03-03T03:10:06.235631+00:00,BUCKET,llm_style,eval,llm_style_eval_053,2,3072,1024,bf16,NVIDIA GeForce RTX 4060,c02,32,64,32,2,2,8,0.0,0.0,71.68000191450119,194.22207489609715,0.1755428524542829,6,-1,-1,llm8_g6,0,
2026-03-03T03:10:06.455405+00:00,BUCKET,llm_style,eval,llm_style_eval_054,1,6144,6144,bf16,NVIDIA GeForce RTX 4060,c06,64,128,32,4,3,8,0.0,0.0,561.9519948959351,730.0188690423965,0.1343486146249574,5,-1,-1,llm8_g5,0,
2026-03-03T03:10:06.473692+00:00,BUCKET,llm_style,eval,llm_style_eval_055,4,3072,1024,bf16,NVIDIA GeForce RTX 4060,c02,32,64,32,2,2,8,0.0,0.0,70.44799998402596,250.85951507091502,0.3572255281300581,6,-1,-1,llm8_g6,0,
2026-03-03T03:10:06.566191+00:00,BUCKET,llm_style,eval,llm_style_eval_056,32,8192,2048,bf16,NVIDIA GeForce RTX 4060,c00,32,32,32,2,2,8,0.0,0.0,259.0399980545044,345.73759287595726,4.145081192341867,0,-1,-1,llm8_g0,0,
2026-03-03T03:10:06.756959+00:00,BUCKET,llm_style,eval,llm_style_eval_057,2,8192,4096,bf16,NVIDIA GeForce RTX 4060,c06,64,128,32,4,3,8,0.0,0.0,563.1999969482422,664.3916958570478,0.2383127285640496,5,-1,-1,llm8_g5,0,
2026-03-03T03:10:06.786442+00:00,BUCKET,llm_style,eval,llm_style_eval_058,1,4096,1536,bf16,NVIDIA GeForce RTX 4060,c02,32,64,32,2,2,8,0.0,0.0,98.30400347709656,233.83039310574515,0.1279999954725307,6,-1,-1,llm8_g6,0,
2026-03-03T03:10:06.804951+00:00,BUCKET,llm_style,eval,llm_style_eval_059,8,1536,2048,bf16,NVIDIA GeForce RTX 4060,c00,32,32,32,2,2,8,0.0,0.0,81.82399719953537,107.9894384741783,0.6151208657927286,7,-1,-1,llm8_g7,0,
2026-03-03T03:10:06.822469+00:00,BUCKET,llm_style,eval,llm_style_eval_060,64,1536,1536,bf16,NVIDIA GeForce RTX 4060,c11,32,128,32,4,2,8,0.0,0.0,98.30400347709656,176.6467189788818,3.0719998913407363,3,-1,-1,llm8_g3,0,
2026-03-03T03:10:06.864387+00:00,BUCKET,llm_style,eval,llm_style_eval_061,1,8192,1024,bf16,NVIDIA GeForce RTX 4060,c11,32,128,32,4,2,8,0.0,0.0,98.27199950814247,218.6649592220782,0.1707222411670773,4,-1,-1,llm8_g4,0,
2026-03-03T03:10:06.890851+00:00,BUCKET,llm_style,eval,llm_style_eval_062,1,3072,1536,bf16,NVIDIA GeForce RTX 4060,c00,32,32,32,2,2,8,0.0,0.0,68.35199892520905,110.69311976432797,0.13806741790135785,7,-1,-1,llm8_g7,0,
2026-03-03T03:10:07.038410+00:00,BUCKET,llm_style,eval,llm_style_eval_063,64,4096,6144,bf16,NVIDIA GeForce RTX 4060,c11,32,128,32,4,2,8,0.0,0.0,490.4960095882416,668.8358277082441,6.5672817087831845,3,-1,-1,llm8_g3,0,
2026-03-03T03:10:07.056367+00:00,BUCKET,llm_style,eval,llm_style_eval_064,4,3072,1024,bf16,NVIDIA GeForce RTX 4060,c02,32,64,32,2,2,8,0.0,0.0,71.02400064468384,144.4044841825962,0.3543284491378995,6,-1,-1,llm8_g6,0,
2026-03-03T03:10:07.078153+00:00,BUCKET,llm_style,eval,llm_style_eval_065,32,4096,1024,bf16,NVIDIA GeForce RTX 4060,c04,64,64,64,4,3,8,0.0,0.0,92.16000139713287,207.09376290440554,2.9127110669548135,2,-1,-1,llm8_g2,0,
2026-03-03T03:10:07.212269+00:00,BUCKET,llm_style,eval,llm_style_eval_066,1,4096,6144,bf16,NVIDIA GeForce RTX 4060,c00,32,32,32,2,2,8,0.0,0.0,363.5199964046478,483.3484795689583,0.1384563393975553,7,-1,-1,llm8_g7,0,
2026-03-03T03:10:07.275914+00:00,BUCKET,llm_style,eval,llm_style_eval_067,64,1024,8192,bf16,NVIDIA GeForce RTX 4060,c11,32,128,32,4,2,8,0.0,0.0,348.1599986553192,461.6975951194763,3.0840470707348886,3,-1,-1,llm8_g3,0,
2026-03-03T03:10:07.296203+00:00,BUCKET,llm_style,eval,llm_style_eval_068,8,4096,1024,bf16,NVIDIA GeForce RTX 4060,c02,32,64,32,2,2,8,0.0,0.0,77.82399654388428,134.67648074030865,0.8623158277685969,6,-1,-1,llm8_g6,0,
2026-03-03T03:10:07.358406+00:00,BUCKET,llm_style,eval,llm_style_eval_069,64,6144,1536,bf16,NVIDIA GeForce RTX 4060,c00,32,32,32,2,2,8,0.0,0.0,248.83200228214264,359.3875217437744,4.854518473995693,0,-1,-1,llm8_g0,0,
2026-03-03T03:10:07.379795+00:00,BUCKET,llm_style,eval,llm_style_eval_070,1,4096,1024,bf16,NVIDIA GeForce RTX 4060,c02,32,64,32,2,2,8,0.0,0.0,72.59200140833855,141.55392259359354,0.11555829619317276,6,-1,-1,llm8_g6,0,
2026-03-03T03:10:07.493576+00:00,BUCKET,llm_style,eval,llm_style_eval_071,64,2048,8192,bf16,NVIDIA GeForce RTX 4060,c11,32,128,32,4,2,8,0.0,0.0,526.8320143222809,606.1849558353424,4.076220862854231,3,-1,-1,llm8_g3,0,
2026-03-03T03:10:07.549661+00:00,BUCKET,llm_style,eval,llm_style_eval_072,64,8192,1024,bf16,NVIDIA GeForce RTX 4060,c00,32,32,32,2,2,8,0.0,0.0,257.4719935655594,427.19232320785517,4.170324737578094,0,-1,-1,llm8_g0,0,
2026-03-03T03:10:07.618188+00:00,BUCKET,llm_style,eval,llm_style_eval_073,32,8192,1536,bf16,NVIDIA GeForce RTX 4060,c00,32,32,32,2,2,8,0.0,0.0,205.61599731445312,249.82527866959563,3.9165550274204928,0,-1,-1,llm8_g0,0,
2026-03-03T03:10:07.635802+00:00,BUCKET,llm_style,eval,llm_style_eval_074,16,3072,1024,bf16,NVIDIA GeForce RTX 4060,c02,32,64,32,2,2,8,0.0,0.0,88.03199976682663,166.95296436548233,1.1434852811094867,6,-1,-1,llm8_g6,0,
2026-03-03T03:10:07.682496+00:00,BUCKET,llm_style,eval,llm_style_eval_075,16,8192,1024,bf16,NVIDIA GeForce RTX 4060,c11,32,128,32,4,2,8,0.0,0.0,136.19199395179749,197.41696342825884,1.9710076063282214,4,-1,-1,llm8_g4,0,
2026-03-03T03:10:07.712730+00:00,BUCKET,llm_style,eval,llm_style_eval_076,1,4096,1536,bf16,NVIDIA GeForce RTX 4060,c02,32,64,32,2,2,8,0.0,0.0,117.71200224757195,366.5132750570768,0.10689574350740898,6,-1,-1,llm8_g6,0,
2026-03-03T03:10:07.733869+00:00,BUCKET,llm_style,eval,llm_style_eval_077,4,1024,3072,bf16,NVIDIA GeForce RTX 4060,c00,32,32,32,2,2,8,0.0,0.0,122.76799976825714,182.59775742888434,0.2049868373477147,7,-1,-1,llm8_g7,0,
2026-03-03T03:10:08.009274+00:00,BUCKET,llm_style,eval,llm_style_eval_078,32,6144,8192,bf16,NVIDIA GeForce RTX 4060,c10,64,128,64,8,3,8,0.0,0.0,1062.399983406067,1091.082203388214,3.0320270353099152,1,-1,-1,llm8_g1,0,
2026-03-03T03:10:08.060154+00:00,BUCKET,llm_style,eval,llm_style_eval_079,64,8192,1024,bf16,NVIDIA GeForce RTX 4060,c00,32,32,32,2,2,8,0.0,0.0,277.50399708747864,401.95072561502457,3.8692841734510957,0,-1,-1,llm8_g0,0,
2026-03-03T03:10:08.084331+00:00,BUCKET,llm_style,eval,llm_style_eval_080,2,3072,1024,bf16,NVIDIA GeForce RTX 4060,c02,32,64,32,2,2,8,0.0,0.0,82.94399827718735,156.21120437979698,0.15170370685471,6,-1,-1,llm8_g6,0,
2026-03-03T03:10:08.122668+00:00,BUCKET,llm_style,eval,llm_style_eval_081,64,4096,1536,bf16,NVIDIA GeForce RTX 4060,c04,64,64,64,4,3,8,0.0,0.0,161.79199516773224,255.6825533509254,4.97741787018033,2,-1,-1,llm8_g2,0,
2026-03-03T03:10:08.135851+00:00,BUCKET,llm_style,eval,llm_style_eval_082,8,1536,1024,bf16,NVIDIA GeForce RTX 4060,c00,32,32,32,2,2,8,0.0,0.0,77.31200009584427,187.84256383776656,0.3255099333712973,7,-1,-1,llm8_g7,0,
2026-03-03T03:10:08.282629+00:00,BUCKET,llm_style,eval,llm_style_eval_083,64,6144,4096,bf16,NVIDIA GeForce RTX 4060,c10,64,128,64,8,3,8,0.0,0.0,582.1280181407928,672.0921492576599,5.5335345003457945,1,-1,-1,llm8_g1,0,
2026-03-03T03:10:08.298333+00:00,BUCKET,llm_style,eval,llm_style_eval_084,1,1024,2048,bf16,NVIDIA GeForce RTX 4060,c00,32,32,32,2,2,8,0.0,0.0,102.39999741315842,154.4908837974071,0.040960001034736654,7,-1,-1,llm8_g7,0,
2026-03-03T03:10:08.330282+00:00,BUCKET,llm_style,eval,llm_style_eval_085,32,4096,1536,bf16,NVIDIA GeForce RTX 4060,c04,64,64,64,4,3,8,0.0,0.0,192.30400025844574,237.6806344091891,2.093836755651764,2,-1,-1,llm8_g2,0,
2026-03-03T03:10:08.659346+00:00,BUCKET,llm_style,eval,llm_style_eval_086,32,8192,6144,bf16,NVIDIA GeForce RTX 4060,c10,64,128,64,8,3,8,0.0,0.0,1307.5679540634155,1422.284837961197,2.4635243330869936,1,-1,-1,llm8_g1,0,
2026-03-03T03:10:08.965920+00:00,BUCKET,llm_style,eval,llm_style_eval_087,64,6144,8192,bf16,NVIDIA GeForce RTX 4060,c10,64,128,64,8,3,8,0.0,0.0,1206.7840099334717,1383.895024061203,5.338528594155936,1,-1,-1,llm8_g1,0,
2026-03-03T03:10:09.112156+00:00,BUCKET,llm_style,eval,llm_style_eval_088,1,6144,4096,bf16,NVIDIA GeForce RTX 4060,c06,64,128,32,4,3,8,0.0,0.0,617.4719929695129,673.4995120763779,0.08151243873903942,5,-1,-1,llm8_g5,0,
2026-03-03T03:10:09.132827+00:00,BUCKET,llm_style,eval,llm_style_eval_089,8,3072,1024,bf16,NVIDIA GeForce RTX 4060,c02,32,64,32,2,2,8,0.0,0.0,91.50400012731552,268.1036806106564,0.5500486091315163,6,-1,-1,llm8_g6,0,
2026-03-03T03:10:09.439348+00:00,BUCKET,llm_style,eval,llm_style_eval_090,16,8192,6144,bf16,NVIDIA GeForce RTX 4060,c06,64,128,32,4,3,8,0.0,0.0,1258.4960460662842,1373.593624830246,1.2797916537237735,5,-1,-1,llm8_g5,0,
2026-03-03T03:10:09.559768+00:00,BUCKET,llm_style,eval,llm_style_eval_091,32,6144,3072,bf16,NVIDIA GeForce RTX 4060,c10,64,128,64,8,3,8,0.0,0.0,492.5439953804016,636.1292642354965,2.452490667492695,1,-1,-1,llm8_g1,0,
2026-03-03T03:10:09.599274+00:00,BUCKET,llm_style,eval,llm_style_eval_092,4,8192,1024,bf16,NVIDIA GeForce RTX 4060,c11,32,128,32,4,2,8,0.0,0.0,162.81600296497345,276.06016010046005,0.41217609312296594,4,-1,-1,llm8_g4,0,
2026-03-03T03:10:09.763330+00:00,BUCKET,llm_style,eval,llm_style_eval_093,64,8192,3072,bf16,NVIDIA GeForce RTX 4060,c00,32,32,32,2,2,8,0.0,0.0,901.0080099105835,1052.7417814731598,3.5751352225155864,0,-1,-1,llm8_g0,0,
2026-03-03T03:10:09.878363+00:00,BUCKET,llm_style,eval,llm_style_eval_094,1,6144,3072,bf16,NVIDIA GeForce RTX 4060,c06,64,128,32,4,3,8,0.0,0.0,451.07199251651764,602.1987330913541,0.08368672102517581,5,-1,-1,llm8_g5,0,
2026-03-03T03:10:09.896139+00:00,BUCKET,llm_style,eval,llm_style_eval_095,32,1536,1024,bf16,NVIDIA GeForce RTX 4060,c11,32,128,32,4,2,8,0.0,0.0,116.67200177907944,187.41247609257678,0.8627887964981332,3,-1,-1,llm8_g3,0,
2026-03-03T03:10:09.935510+00:00,BUCKET,llm_style,eval,llm_style_eval_096,32,4096,1536,bf16,NVIDIA GeForce RTX 4060,c04,64,64,64,4,3,8,0.0,0.0,202.7519941329956,352.36671179533005,1.9859394514062279,2,-1,-1,llm8_g2,0,
2026-03-03T03:10:10.002320+00:00,BUCKET,llm_style,eval,llm_style_eval_097,32,1024,8192,bf16,NVIDIA GeForce RTX 4060,c11,32,128,32,4,2,8,0.0,0.0,530.4319858551025,540.618891119957,1.0121390231294543,3,-1,-1,llm8_g3,0,
2026-03-03T03:10:10.395705+00:00,BUCKET,llm_style,eval,llm_style_eval_098,1,8192,8192,bf16,NVIDIA GeForce RTX 4060,c06,64,128,32,4,3,8,0.0,0.0,1700.8639574050903,1777.6377391815186,0.07891150107311828,5,-1,-1,llm8_g5,0,
2026-03-03T03:10:10.424033+00:00,BUCKET,llm_style,eval,llm_style_eval_099,8,3072,1024,bf16,NVIDIA GeForce RTX 4060,c02,32,64,32,2,2,8,0.0,0.0,83.90399813652039,562.8297613561141,0.599871866869863,6,-1,-1,llm8_g6,0,
2026-03-03T03:10:10.724809+00:00,BUCKET,llm_style,eval,llm_style_eval_100,64,6144,8192,bf16,NVIDIA GeForce RTX 4060,c10,64,128,64,8,3,8,0.0,0.0,871.936023235321,903.1680226325989,7.3886739076283,1,-1,-1,llm8_g1,0,
2026-03-03T03:10:10.804366+00:00,BUCKET,llm_style,eval,llm_style_eval_101,64,8192,1536,bf16,NVIDIA GeForce RTX 4060,c00,32,32,32,2,2,8,0.0,0.0,337.40800619125366,385.6383964419364,4.7734870140783,0,-1,-1,llm8_g0,0,
2026-03-03T03:10:10.823575+00:00,BUCKET,llm_style,eval,llm_style_eval_102,16,3072,1024,bf16,NVIDIA GeForce RTX 4060,c02,32,64,32,2,2,8,0.0,0.0,72.7040022611618,90.6016006320715,1.3845633372204869,6,-1,-1,llm8_g6,0,
2026-03-03T03:10:10.845466+00:00,BUCKET,llm_style,eval,llm_style_eval_103,2,1024,3072,bf16,NVIDIA GeForce RTX 4060,c00,32,32,32,2,2,8,0.0,0.0,113.66400122642517,156.06112360954273,0.1107027015082297,7,-1,-1,llm8_g7,0,
2026-03-03T03:10:10.911141+00:00,BUCKET,llm_style,eval,llm_style_eval_104,32,6144,2048,bf16,NVIDIA GeForce RTX 4060,c00,32,32,32,2,2,8,0.0,0.0,182.15999752283096,271.4502424001694,4.420873841410034,0,-1,-1,llm8_g0,0,
2026-03-03T03:10:11.270234+00:00,BUCKET,llm_style,eval,llm_style_eval_105,64,8192,8192,bf16,NVIDIA GeForce RTX 4060,c10,64,128,64,8,3,8,0.0,0.0,1241.5040135383606,1313.9558899402618,6.918974484438575,1,-1,-1,llm8_g1,0,
2026-03-03T03:10:11.331648+00:00,BUCKET,llm_style,eval,llm_style_eval_106,64,8192,1024,bf16,NVIDIA GeForce RTX 4060,c00,32,32,32,2,2,8,0.0,0.0,227.32800245285034,338.16607028245915,4.723315264351133,0,-1,-1,llm8_g0,0,
2026-03-03T03:10:11.376735+00:00,BUCKET,llm_style,eval,llm_style_eval_107,1,2048,4096,bf16,NVIDIA GeForce RTX 4060,c00,32,32,32,2,2,8,0.0,0.0,146.41600102186203,230.64991965889925,0.11458594609133546,7,-1,-1,llm8_g7,0,
2026-03-03T03:10:11.568915+00:00,BUCKET,llm_style,eval,llm_style_eval_108,64,6144,6144,bf16,NVIDIA GeForce RTX 4060,c10,64,128,64,8,3,8,0.0,0.0,564.2240047454834,617.960963845253,8.563687768264309,1,-1,-1,llm8_g1,0,
2026-03-03T03:10:11.672845+00:00,BUCKET,llm_style,eval,llm_style_eval_109,64,6144,3072,bf16,NVIDIA GeForce RTX 4060,c10,64,128,64,8,3,8,0.0,0.0,325.6320059299469,382.9500827193259,7.419169676213387,1,-1,-1,llm8_g1,0,
2026-03-03T03:10:11.741733+00:00,BUCKET,llm_style,eval,llm_style_eval_110,1,8192,1536,bf16,NVIDIA GeForce RTX 4060,c11,32,128,32,4,2,8,0.0,0.0,170.33600062131882,262.7788794040679,0.14774225007165226,4,-1,-1,llm8_g4,0,
2026-03-03T03:10:11.832498+00:00,BUCKET,llm_style,eval,llm_style_eval_111,32,8192,2048,bf16,NVIDIA GeForce RTX 4060,c00,32,32,32,2,2,8,0.0,0.0,258.04799795150757,342.4051314592361,4.161015906047749,0,-1,-1,llm8_g0,0,
2026-03-03T03:10:11.858614+00:00,BUCKET,llm_style,eval,llm_style_eval_112,8,6144,1024,bf16,NVIDIA GeForce RTX 4060,c11,32,128,32,4,2,8,0.0,0.0,70.0800009071827,95.35839810967441,1.4364054608578456,4,-1,-1,llm8_g4,0,
2026-03-03T03:10:11.904680+00:00,BUCKET,llm_style,eval,llm_style_eval_113,64,3072,3072,bf16,NVIDIA GeForce RTX 4060,c11,32,128,32,4,2,8,0.0,0.0,159.743994474411,194.033921957016,7.561846415412506,3,-1,-1,llm8_g3,0,
2026-03-03T03:10:12.255089+00:00,BUCKET,llm_style,eval,llm_style_eval_114,16,8192,8192,bf16,NVIDIA GeForce RTX 4060,c06,64,128,32,4,3,8,0.0,0.0,994.3040013313293,1096.7625617980957,2.1597857849557216,5,-1,-1,llm8_g5,0,
2026-03-03T03:10:12.458574+00:00,BUCKET,llm_style,eval,llm_style_eval_115,32,6144,6144,bf16,NVIDIA GeForce RTX 4060,c10,64,128,64,8,3,8,0.0,0.0,552.9599785804749,627.1065741777418,4.369066835907366,1,-1,-1,llm8_g1,0,
2026-03-03T03:10:12.481273+00:00,BUCKET,llm_style,eval,llm_style_eval_116,8,3072,1024,bf16,NVIDIA GeForce RTX 4060,c02,32,64,32,2,2,8,0.0,0.0,67.58400052785873,138.47040146589273,0.7447272669106476,6,-1,-1,llm8_g6,0,
2026-03-03T03:10:12.633362+00:00,BUCKET,llm_style,eval,llm_style_eval_117,16,6144,4096,bf16,NVIDIA GeForce RTX 4060,c06,64,128,32,4,3,8,0.0,0.0,367.6159977912903,431.1142402887343,2.1906183975627833,5,-1,-1,llm8_g5,0,
2026-03-03T03:10:12.843382+00:00,BUCKET,llm_style,eval,llm_style_eval_118,32,6144,6144,bf16,NVIDIA GeForce RTX 4060,c10,64,128,64,8,3,8,0.0,0.0,549.888014793396,680.3334540128707,4.393474742139468,1,-1,-1,llm8_g1,0,
2026-03-03T03:10:12.877719+00:00,BUCKET,llm_style,eval,llm_style_eval_119,32,4096,1536,bf16,NVIDIA GeForce RTX 4060,c04,64,64,64,4,3,8,0.0,0.0,134.14399325847626,209.03231471776957,3.0016490058123213,2,-1,-1,llm8_g2,0,
2026-03-03T03:10:12.957716+00:00,BUCKET,llm_style,eval,llm_style_eval_120,64,8192,1536,bf16,NVIDIA GeForce RTX 4060,c00,32,32,32,2,2,8,0.0,0.0,273.77599477767944,468.40480118989944,5.882958209348861,0,-1,-1,llm8_g0,0,
2026-03-03T03:10:12.981422+00:00,BUCKET,llm_style,eval,llm_style_eval_121,8,3072,1536,bf16,NVIDIA GeForce RTX 4060,c00,32,32,32,2,2,8,0.0,0.0,69.63200122117996,152.3200030624866,1.0842352751027344,7,-1,-1,llm8_g7,0,
2026-03-03T03:10:12.994576+00:00,BUCKET,llm_style,eval,llm_style_eval_122,64,1024,1536,bf16,NVIDIA GeForce RTX 4060,c11,32,128,32,4,2,8,0.0,0.0,102.39999741315842,106.91231787204741,1.9660800496673596,3,-1,-1,llm8_g3,0,
2026-03-03T03:10:13.135993+00:00,BUCKET,llm_style,eval,llm_style_eval_123,64,8192,3072,bf16,NVIDIA GeForce RTX 4060,c00,32,32,32,2,2,8,0.0,0.0,543.7440276145935,612.0959800481796,5.924157891225996,0,-1,-1,llm8_g0,0,
2026-03-03T03:10:13.222977+00:00,BUCKET,llm_style,eval,llm_style_eval_124,64,8192,1536,bf16,NVIDIA GeForce RTX 4060,c00,32,32,32,2,2,8,0.0,0.0,321.53600454330444,341.05344355106354,5.009120948329389,0,-1,-1,llm8_g0,0,
2026-03-03T03:10:13.295612+00:00,BUCKET,llm_style,eval,llm_style_eval_125,64,4096,3072,bf16,NVIDIA GeForce RTX 4060,c11,32,128,32,4,2,8,0.0,0.0,283.6480140686035,295.387187898159,5.678209104649169,3,-1,-1,llm8_g3,0,
2026-03-03T03:10:13.320529+00:00,BUCKET,llm_style,eval,llm_style_eval_126,64,4096,1024,bf16,NVIDIA GeForce RTX 4060,c04,64,64,64,4,3,8,0.0,0.0,105.85599765181541,157.93152481317506,5.071709906942553,2,-1,-1,llm8_g2,0,
2026-03-03T03:10:13.522303+00:00,BUCKET,llm_style,eval,llm_style_eval_127,16,6144,6144,bf16,NVIDIA GeForce RTX 4060,c06,64,128,32,4,3,8,0.0,0.0,642.0480012893677,706.3961380720136,1.8814162641643035,5,-1,-1,llm8_g5,0,
2026-03-03T03:10:13.723731+00:00,BUCKET,llm_style,eval,llm_style_eval_128,32,6144,6144,bf16,NVIDIA GeForce RTX 4060,c10,64,128,64,8,3,8,0.0,0.0,646.1279988288879,727.4185818433762,3.73907199251367,1,-1,-1,llm8_g1,0,
2026-03-03T03:10:13.831678+00:00,BUCKET,llm_style,eval,llm_style_eval_129,64,2048,8192,bf16,NVIDIA GeForce RTX 4060,c11,32,128,32,4,2,8,0.0,0.0,501.24800205230713,523.3500969409943,4.284273731181679,3,-1,-1,llm8_g3,0,
2026-03-03T03:10:14.111321+00:00,BUCKET,llm_style,eval,llm_style_eval_130,64,8192,6144,bf16,NVIDIA GeForce RTX 4060,c10,64,128,64,8,3,8,0.0,0.0,1057.58398771286,1181.194293498993,6.091668386482003,1,-1,-1,llm8_g1,0,
2026-03-03T03:10:14.134026+00:00,BUCKET,llm_style,eval,llm_style_eval_131,2,2048,2048,bf16,NVIDIA GeForce RTX 4060,c00,32,32,32,2,2,8,0.0,0.0,96.70400246977806,127.60927751660343,0.1734903992752856,7,-1,-1,llm8_g7,0,
2026-03-03T03:10:14.201560+00:00,BUCKET,llm_style,eval,llm_style_eval_132,32,6144,2048,bf16,NVIDIA GeForce RTX 4060,c00,32,32,32,2,2,8,0.0,0.0,202.59200036525726,310.3459167480469,3.975015630173436,0,-1,-1,llm8_g0,0,
2026-03-03T03:10:14.252304+00:00,BUCKET,llm_style,eval,llm_style_eval_133,4,1536,6144,bf16,NVIDIA GeForce RTX 4060,c00,32,32,32,2,2,8,0.0,0.0,205.82400262355804,244.6563160419464,0.3668059654737216,7,-1,-1,llm8_g7,0,
2026-03-03T03:10:14.439290+00:00,BUCKET,llm_style,eval,llm_style_eval_134,2,8192,4096,bf16,NVIDIA GeForce RTX 4060,c06,64,128,32,4,3,8,0.0,0.0,628.6559998989105,742.6172888278961,0.21349947828634827,5,-1,-1,llm8_g5,0,
2026-03-03T03:10:14.459862+00:00,BUCKET,llm_style,eval,llm_style_eval_135,2,3072,1024,bf16,NVIDIA GeForce RTX 4060,c02,32,64,32,2,2,8,0.0,0.0,72.09600135684013,108.97408328950397,0.17452995676862448,6,-1,-1,llm8_g6,0,
2026-03-03T03:10:14.842473+00:00,BUCKET,llm_style,eval,llm_style_eval_136,32,8192,8192,bf16,NVIDIA GeForce RTX 4060,c10,64,128,64,8,3,8,0.0,0.0,1243.5359954833984,1364.9920225143433,3.453834317301303,1,-1,-1,llm8_g1,0,
2026-03-03T03:10:14.900871+00:00,BUCKET,llm_style,eval,llm_style_eval_137,64,8192,1024,bf16,NVIDIA GeForce RTX 4060,c00,32,32,32,2,2,8,0.0,0.0,227.32800245285034,337.4953648447989,4.723315264351133,0,-1,-1,llm8_g0,0,
2026-03-03T03:10:14.919907+00:00,BUCKET,llm_style,eval,llm_style_eval_138,2,3072,1024,bf16,NVIDIA GeForce RTX 4060,c02,32,64,32,2,2,8,0.0,0.0,74.09600168466568,149.8111985623836,0.16981904170146417,6,-1,-1,llm8_g6,0,
2026-03-03T03:10:14.939886+00:00,BUCKET,llm_style,eval,llm_style_eval_139,32,3072,1024,bf16,NVIDIA GeForce RTX 4060,c04,64,64,64,4,3,8,0.0,0.0,82.94399827718735,92.572480738163,2.42725930967536,2,-1,-1,llm8_g2,0,
2026-03-03T03:10:14.972567+00:00,BUCKET,llm_style,eval,llm_style_eval_140,32,6144,1024,bf16,NVIDIA GeForce RTX 4060,c00,32,32,32,2,2,8,0.0,0.0,105.45599833130836,220.3961598873138,3.8182103471724287,0,-1,-1,llm8_g0,0,
2026-03-03T03:10:14.990334+00:00,BUCKET,llm_style,eval,llm_style_eval_141,8,3072,1024,bf16,NVIDIA GeForce RTX 4060,c02,32,64,32,2,2,8,0.0,0.0,77.61600241065025,141.96672022342682,0.6484699860436722,6,-1,-1,llm8_g6,0,
2026-03-03T03:10:15.022335+00:00,BUCKET,llm_style,eval,llm_style_eval_142,32,4096,1536,bf16,NVIDIA GeForce RTX 4060,c04,64,64,64,4,3,8,0.0,0.0,148.44800531864166,226.7737540602683,2.7124189586495984,2,-1,-1,llm8_g2,0,
2026-03-03T03:10:15.075195+00:00,BUCKET,llm_style,eval,llm_style_eval_143,64,6144,1536,bf16,NVIDIA GeForce RTX 4060,c00,32,32,32,2,2,8,0.0,0.0,274.399995803833,398.7686511874199,4.402185023587112,0,-1,-1,llm8_g0,0,
2026-03-03T03:10:15.169023+00:00,BUCKET,llm_style,eval,llm_style_eval_144,32,8192,2048,bf16,NVIDIA GeForce RTX 4060,c00,32,32,32,2,2,8,0.0,0.0,263.16800713539124,374.40512388944626,4.080062146184796,0,-1,-1,llm8_g0,0,
2026-03-03T03:10:15.213582+00:00,BUCKET,llm_style,eval,llm_style_eval_145,64,4096,1536,bf16,NVIDIA GeForce RTX 4060,c04,64,64,64,4,3,8,0.0,0.0,151.5520066022873,233.1712001562118,5.313729498239754,2,-1,-1,llm8_g2,0,
2026-03-03T03:10:15.227064+00:00,BUCKET,llm_style,eval,llm_style_eval_146,1,1024,1024,bf16,NVIDIA GeForce RTX 4060,c00,32,32,32,2,2,8,0.0,0.0,80.89599758386612,139.80512276291847,0.025924051407189216,7,-1,-1,llm8_g7,0,
2026-03-03T03:10:15.413327+00:00,BUCKET,llm_style,eval,llm_style_eval_147,32,8192,4096,bf16,NVIDIA GeForce RTX 4060,c10,64,128,64,8,3,8,0.0,0.0,646.1440026760101,728.3507204055786,3.3235372287078127,1,-1,-1,llm8_g1,0,
2026-03-03T03:10:15.686565+00:00,BUCKET,llm_style,eval,llm_style_eval_148,32,6144,8192,bf16,NVIDIA GeForce RTX 4060,c10,64,128,64,8,3,8,0.0,0.0,819.599986076355,962.0057648420333,3.9302410038107376,1,-1,-1,llm8_g1,0,
2026-03-03T03:10:15.707408+00:00,BUCKET,llm_style,eval,llm_style_eval_149,4,4096,1024,bf16,NVIDIA GeForce RTX 4060,c02,32,64,32,2,2,8,0.0,0.0,78.84799689054489,89.63488042354582,0.4255584583407939,6,-1,-1,llm8_g6,0,
2026-03-03T03:10:15.785892+00:00,BUCKET,llm_style,eval,llm_style_eval_150,64,8192,1536,bf16,NVIDIA GeForce RTX 4060,c00,32,32,32,2,2,8,0.0,0.0,333.296000957489,417.1596822142601,4.832379420614258,0,-1,-1,llm8_g0,0,
2026-03-03T03:10:15.996913+00:00,BUCKET,llm_style,eval,llm_style_eval_151,64,6144,6144,bf16,NVIDIA GeForce RTX 4060,c10,64,128,64,8,3,8,0.0,0.0,654.2719900608063,757.0822387933729,7.385060466291614,1,-1,-1,llm8_g1,0,
2026-03-03T03:10:16.379051+00:00,BUCKET,llm_style,eval,llm_style_eval_152,32,8192,8192,bf16,NVIDIA GeForce RTX 4060,c10,64,128,64,8,3,8,0.0,0.0,1397.5840210914612,1490.117108821869,3.0731370931429156,1,-1,-1,llm8_g1,0,
2026-03-03T03:10:16.414725+00:00,BUCKET,llm_style,eval,llm_style_eval_153,8,4096,1536,bf16,NVIDIA GeForce RTX 4060,c02,32,64,32,2,2,8,0.0,0.0,122.84799665212631,253.27104210853565,0.8194134112341478,6,-1,-1,llm8_g6,0,
2026-03-03T03:10:16.438107+00:00,BUCKET,llm_style,eval,llm_style_eval_154,32,4096,1024,bf16,NVIDIA GeForce RTX 4060,c04,64,64,64,4,3,8,0.0,0.0,129.02399897575378,201.99424117803568,2.0805079530238744,2,-1,-1,llm8_g2,0,
2026-03-03T03:10:16.619602+00:00,BUCKET,llm_style,eval,llm_style_eval_155,32,4096,8192,bf16,NVIDIA GeForce RTX 4060,c11,32,128,32,4,2,8,0.0,0.0,512.4960243701935,622.9510378837585,4.19024450119207,3,-1,-1,llm8_g3,0,
2026-03-03T03:10:16.766999+00:00,BUCKET,llm_style,eval,llm_style_eval_156,32,3072,8192,bf16,NVIDIA GeForce RTX 4060,c11,32,128,32,4,2,8,0.0,0.0,427.0080029964447,575.5289608240128,3.771856088639655,3,-1,-1,llm8_g3,0,
2026-03-03T03:10:16.963790+00:00,BUCKET,llm_style,eval,llm_style_eval_157,64,6144,6144,bf16,NVIDIA GeForce RTX 4060,c10,64,128,64,8,3,8,0.0,0.0,577.5039792060852,654.0271967649458,8.366761757455759,1,-1,-1,llm8_g1,0,
2026-03-03T03:10:17.030125+00:00,BUCKET,llm_style,eval,llm_style_eval_158,8,8192,1536,bf16,NVIDIA GeForce RTX 4060,c11,32,128,32,4,2,8,0.0,0.0,157.50400722026825,239.90271911025042,1.2782315545689333,4,-1,-1,llm8_g4,0,
2026-03-03T03:10:17.067518+00:00,BUCKET,llm_style,eval,llm_style_eval_159,64,4096,1536,bf16,NVIDIA GeForce RTX 4060,c04,64,64,64,4,3,8,0.0,0.0,139.77599889039993,250.6384024024009,5.761406639143037,2,-1,-1,llm8_g2,0,
2026-03-03T03:10:17.204123+00:00,BUCKET,llm_style,eval,llm_style_eval_160,64,6144,4096,bf16,NVIDIA GeForce RTX 4060,c10,64,128,64,8,3,8,0.0,0.0,397.71199226379395,493.7011194229125,8.099392360951061,1,-1,-1,llm8_g1,0,
2026-03-03T03:10:17.256385+00:00,BUCKET,llm_style,eval,llm_style_eval_161,64,1536,6144,bf16,NVIDIA GeForce RTX 4060,c11,32,128,32,4,2,8,0.0,0.0,276.4799892902374,329.1750395298003,4.369066835907366,3,-1,-1,llm8_g3,0,
2026-03-03T03:10:17.282163+00:00,BUCKET,llm_style,eval,llm_style_eval_162,64,4096,1024,bf16,NVIDIA GeForce RTX 4060,c04,64,64,64,4,3,8,0.0,0.0,99.07200187444687,135.9865609556436,5.41899731349299,2,-1,-1,llm8_g2,0,
2026-03-03T03:10:17.335880+00:00,BUCKET,llm_style,eval,llm_style_eval_163,1,1024,8192,bf16,NVIDIA GeForce RTX 4060,c00,32,32,32,2,2,8,0.0,0.0,226.30399465560913,329.7689524292946,0.07413574835712324,7,-1,-1,llm8_g7,0,
2026-03-03T03:10:17.441802+00:00,BUCKET,llm_style,eval,llm_style_eval_164,64,6144,3072,bf16,NVIDIA GeForce RTX 4060,c10,64,128,64,8,3,8,0.0,0.0,307.0400059223175,377.354237139225,7.868417982675647,1,-1,-1,llm8_g1,0,
2026-03-03T03:10:17.697845+00:00,BUCKET,llm_style,eval,llm_style_eval_165,32,6144,8192,bf16,NVIDIA GeForce RTX 4060,c10,64,128,64,8,3,8,0.0,0.0,754.688024520874,834.4473630189894,4.2682875139632,1,-1,-1,llm8_g1,0,
2026-03-03T03:10:17.722257+00:00,BUCKET,llm_style,eval,llm_style_eval_166,8,2048,2048,bf16,NVIDIA GeForce RTX 4060,c00,32,32,32,2,2,8,0.0,0.0,64.36799839138985,90.56096002459526,1.0425811843945234,7,-1,-1,llm8_g7,0,
2026-03-03T03:10:17.756935+00:00,BUCKET,llm_style,eval,llm_style_eval_167,32,4096,1536,bf16,NVIDIA GeForce RTX 4060,c04,64,64,64,4,3,8,0.0,0.0,135.0720003247261,215.48671782016743,2.981026289919324,2,-1,-1,llm8_g2,0,
2026-03-03T03:10:17.777821+00:00,BUCKET,llm_style,eval,llm_style_eval_168,32,4096,1024,bf16,NVIDIA GeForce RTX 4060,c04,64,64,64,4,3,8,0.0,0.0,106.4319983124733,166.12351998686776,2.522131128383979,2,-1,-1,llm8_g2,0,
2026-03-03T03:10:18.035653+00:00,BUCKET,llm_style,eval,llm_style_eval_169,2,6144,8192,bf16,NVIDIA GeForce RTX 4060,c06,64,128,32,4,3,8,0.0,0.0,742.3200011253357,830.5644738674163,0.2712126733683515,5,-1,-1,llm8_g5,0,
2026-03-03T03:10:18.137653+00:00,BUCKET,llm_style,eval,llm_style_eval_170,32,6144,3072,bf16,NVIDIA GeForce RTX 4060,c10,64,128,64,8,3,8,0.0,0.0,283.488005399704,408.9964720606804,4.26106053516034,1,-1,-1,llm8_g1,0,
2026-03-03T03:10:18.159352+00:00,BUCKET,llm_style,eval,llm_style_eval_171,64,4096,1024,bf16,NVIDIA GeForce RTX 4060,c04,64,64,64,4,3,8,0.0,0.0,107.4719987809658,168.83711725473387,4.995449215513096,2,-1,-1,llm8_g2,0,
2026-03-03T03:10:18.223179+00:00,BUCKET,llm_style,eval,llm_style_eval_172,16,8192,1536,bf16,NVIDIA GeForce RTX 4060,c11,32,128,32,4,2,8,0.0,0.0,147.77600020170212,192.2499175369739,2.724753569256249,4,-1,-1,llm8_g4,0,
2026-03-03T03:10:18.355569+00:00,BUCKET,llm_style,eval,llm_style_eval_173,4,4096,6144,bf16,NVIDIA GeForce RTX 4060,c00,32,32,32,2,2,8,0.0,0.0,369.6640133857727,492.9126504063605,0.5446204788938984,7,-1,-1,llm8_g7,0,
2026-03-03T03:10:18.389175+00:00,BUCKET,llm_style,eval,llm_style_eval_174,64,4096,1536,bf16,NVIDIA GeForce RTX 4060,c04,64,64,64,4,3,8,0.0,0.0,154.62400019168854,177.75616422295568,5.208158933940757,2,-1,-1,llm8_g2,0,
2026-03-03T03:10:18.669694+00:00,BUCKET,llm_style,eval,llm_style_eval_175,32,8192,6144,bf16,NVIDIA GeForce RTX 4060,c10,64,128,64,8,3,8,0.0,0.0,1054.2080402374268,1134.5081889629364,3.055588032960289,1,-1,-1,llm8_g1,0,
2026-03-03T03:10:18.957297+00:00,BUCKET,llm_style,eval,llm_style_eval_176,2,6144,8192,bf16,NVIDIA GeForce RTX 4060,c06,64,128,32,4,3,8,0.0,0.0,1013.759970664978,1144.5904290676117,0.19859394514062279,5,-1,-1,llm8_g5,0,
2026-03-03T03:10:19.054122+00:00,BUCKET,llm_style,eval,llm_style_eval_177,32,8192,2048,bf16,NVIDIA GeForce RTX 4060,c00,32,32,32,2,2,8,0.0,0.0,285.69599986076355,301.6083139181137,3.7583369193943823,0,-1,-1,llm8_g0,0,
2026-03-03T03:10:19.083168+00:00,BUCKET,llm_style,eval,llm_style_eval_178,32,1536,3072,bf16,NVIDIA GeForce RTX 4060,c11,32,128,32,4,2,8,0.0,0.0,200.6719931960106,237.0643179118632,1.5048930505465454,3,-1,-1,llm8_g3,0,
2026-03-03T03:10:19.104301+00:00,BUCKET,llm_style,eval,llm_style_eval_179,32,1536,2048,bf16,NVIDIA GeForce RTX 4060,c11,32,128,32,4,2,8,0.0,0.0,148.99200201034546,228.9561593532562,1.3512577137262753,3,-1,-1,llm8_g3,0,
2026-03-03T03:10:19.148393+00:00,BUCKET,llm_style,eval,llm_style_eval_180,64,1024,6144,bf16,NVIDIA GeForce RTX 4060,c11,32,128,32,4,2,8,0.0,0.0,363.5199964046478,412.92800903320295,2.215301430360885,3,-1,-1,llm8_g3,0,
2026-03-03T03:10:19.431369+00:00,BUCKET,llm_style,eval,llm_style_eval_181,8,6144,8192,bf16,NVIDIA GeForce RTX 4060,c06,64,128,32,4,3,8,0.0,0.0,997.376024723053,1057.2496140003204,0.8074250313201724,5,-1,-1,llm8_g5,0,
2026-03-03T03:10:19.481449+00:00,BUCKET,llm_style,eval,llm_style_eval_182,1,8192,1024,bf16,NVIDIA GeForce RTX 4060,c11,32,128,32,4,2,8,0.0,0.0,148.99200201034546,238.47936227917666,0.11260480947718961,4,-1,-1,llm8_g4,0,
2026-03-03T03:10:19.528345+00:00,BUCKET,llm_style,eval,llm_style_eval_183,4,8192,1024,bf16,NVIDIA GeForce RTX 4060,c11,32,128,32,4,2,8,0.0,0.0,151.93600207567215,186.33151531219482,0.4416916536120007,4,-1,-1,llm8_g4,0,
2026-03-03T03:10:19.919015+00:00,BUCKET,llm_style,eval,llm_style_eval_184,64,8192,8192,bf16,NVIDIA GeForce RTX 4060,c10,64,128,64,8,3,8,0.0,0.0,1786.8800163269043,1869.338845014572,4.807225170975609,1,-1,-1,llm8_g1,0,
2026-03-03T03:10:19.957355+00:00,BUCKET,llm_style,eval,llm_style_eval_185,64,4096,1024,bf16,NVIDIA GeForce RTX 4060,c04,64,64,64,4,3,8,0.0,0.0,139.77599889039993,184.2368005216121,3.8409377594286913,2,-1,-1,llm8_g2,0,
2026-03-03T03:10:19.990265+00:00,BUCKET,llm_style,eval,llm_style_eval_186,16,6144,1024,bf16,NVIDIA GeForce RTX 4060,c11,32,128,32,4,2,8,0.0,0.0,107.95199871063232,119.2687987536192,1.8649640062678254,4,-1,-1,llm8_g4,0,
2026-03-03T03:10:20.023514+00:00,BUCKET,llm_style,eval,llm_style_eval_187,32,4096,1536,bf16,NVIDIA GeForce RTX 4060,c04,64,64,64,4,3,8,0.0,0.0,203.72799783945084,253.2351960241794,1.976425372409115,2,-1,-1,llm8_g2,0,
2026-03-03T03:10:20.160005+00:00,BUCKET,llm_style,eval,llm_style_eval_188,32,8192,3072,bf16,NVIDIA GeForce RTX 4060,c00,32,32,32,2,2,8,0.0,0.0,372.6560026407242,462.94496744871105,4.32198253774751,0,-1,-1,llm8_g0,0,
2026-03-03T03:10:20.191906+00:00,BUCKET,llm_style,eval,llm_style_eval_189,64,4096,1536,bf16,NVIDIA GeForce RTX 4060,c04,64,64,64,4,3,8,0.0,0.0,147.45599776506424,272.40448266267776,5.461333416108733,2,-1,-1,llm8_g2,0,
2026-03-03T03:10:20.208348+00:00,BUCKET,llm_style,eval,llm_style_eval_190,64,1024,2048,bf16,NVIDIA GeForce RTX 4060,c11,32,128,32,4,2,8,0.0,0.0,126.96000188589096,210.51488324999804,2.114330907471664,3,-1,-1,llm8_g3,0,
2026-03-03T03:10:20.339827+00:00,BUCKET,llm_style,eval,llm_style_eval_191,1,8192,3072,bf16,NVIDIA GeForce RTX 4060,c11,32,128,32,4,2,8,0.0,0.0,363.0079925060272,491.16161346435547,0.13865162486515864,4,-1,-1,llm8_g4,0,
2026-03-03T03:10:20.380525+00:00,BUCKET,llm_style,eval,llm_style_eval_192,32,8192,1024,bf16,NVIDIA GeForce RTX 4060,c00,32,32,32,2,2,8,0.0,0.0,131.071999669075,240.15872314572334,4.096000010341406,0,-1,-1,llm8_g0,0,
2026-03-03T03:10:20.743021+00:00,BUCKET,llm_style,eval,llm_style_eval_193,8,8192,8192,bf16,NVIDIA GeForce RTX 4060,c06,64,128,32,4,3,8,0.0,0.0,1182.7199459075928,1296.9664251804352,0.9078580501794401,5,-1,-1,llm8_g5,0,
2026-03-03T03:10:20.884243+00:00,BUCKET,llm_style,eval,llm_style_eval_194,2,8192,3072,bf16,NVIDIA GeForce RTX 4060,c11,32,128,32,4,2,8,0.0,0.0,363.8239949941635,480.7961541414261,0.2766813002578757,4,-1,-1,llm8_g4,0,
2026-03-03T03:10:20.912368+00:00,BUCKET,llm_style,eval,llm_style_eval_195,4,4096,1024,bf16,NVIDIA GeForce RTX 4060,c02,32,64,32,2,2,8,0.0,0.0,80.89599758386612,167.43455983698345,0.41478482251502746,6,-1,-1,llm8_g6,0,
2026-03-03T03:10:20.978676+00:00,BUCKET,llm_style,eval,llm_style_eval_196,16,8192,1536,bf16,NVIDIA GeForce RTX 4060,c11,32,128,32,4,2,8,0.0,0.0,163.83999586105347,254.96415227651596,2.4576000620842,4,-1,-1,llm8_g4,0,
2026-03-03T03:10:21.023219+00:00,BUCKET,llm_style,eval,llm_style_eval_197,16,8192,1024,bf16,NVIDIA GeForce RTX 4060,c11,32,128,32,4,2,8,0.0,0.0,117.10400134325027,174.09312218427655,2.292282525967438,4,-1,-1,llm8_g4,0,
2026-03-03T03:10:21.066540+00:00,BUCKET,llm_style,eval,llm_style_eval_198,8,4096,2048,bf16,NVIDIA GeForce RTX 4060,c00,32,32,32,2,2,8,0.0,0.0,113.66400122642517,164.52415876090512,1.1808288160877833,7,-1,-1,llm8_g7,0,
2026-03-03T03:10:21.116208+00:00,BUCKET,llm_style,eval,llm_style_eval_199,8,6144,1536,bf16,NVIDIA GeForce RTX 4060,c11,32,128,32,4,2,8,0.0,0.0,103.42399775981903,199.46496412158007,1.4599604276625886,4,-1,-1,llm8_g4,0,
2026-03-03T03:10:21.298940+00:00,BUCKET,llm_style,eval,llm_style_eval_200,64,8192,4096,bf16,NVIDIA GeForce RTX 4060,c10,64,128,64,8,3,8,0.0,0.0,617.4719929695129,737.6963305473328,6.955728105731365,1,-1,-1,llm8_g1,0,
2026-03-03T03:10:21.326219+00:00,BUCKET,llm_style,eval,llm_style_eval_201,2,6144,1024,bf16,NVIDIA GeForce RTX 4060,c11,32,128,32,4,2,8,0.0,0.0,78.84799689054489,189.74719703197474,0.31916884375559545,4,-1,-1,llm8_g4,0,
2026-03-03T03:10:21.459058+00:00,BUCKET,llm_style,eval,llm_style_eval_202,32,6144,4096,bf16,NVIDIA GeForce RTX 4060,c10,64,128,64,8,3,8,0.0,0.0,424.9599874019623,488.7833487987516,3.790033847296191,1,-1,-1,llm8_g1,0,
2026-03-03T03:10:21.662805+00:00,BUCKET,llm_style,eval,llm_style_eval_203,64,6144,6144,bf16,NVIDIA GeForce RTX 4060,c10,64,128,64,8,3,8,0.0,0.0,623.6159801483154,645.4995399713516,7.748098768814162,1,-1,-1,llm8_g1,0,
2026-03-03T03:10:21.679910+00:00,BUCKET,llm_style,eval,llm_style_eval_204,8,3072,1024,bf16,NVIDIA GeForce RTX 4060,c02,32,64,32,2,2,8,0.0,0.0,69.63200122117996,139.7555186599492,0.7228235167351563,6,-1,-1,llm8_g6,0,
2026-03-03T03:10:21.883737+00:00,BUCKET,llm_style,eval,llm_style_eval_205,4,6144,6144,bf16,NVIDIA GeForce RTX 4060,c06,64,128,32,4,3,8,0.0,0.0,607.2319746017456,651.8886262178421,0.4973221118635275,5,-1,-1,llm8_g5,0,
2026-03-03T03:10:21.903354+00:00,BUCKET,llm_style,eval,llm_style_eval_206,4,3072,1024,bf16,NVIDIA GeForce RTX 4060,c02,32,64,32,2,2,8,0.0,0.0,73.72800260782242,80.439360961318,0.34133332126008187,6,-1,-1,llm8_g6,0,
2026-03-03T03:10:22.043591+00:00,BUCKET,llm_style,eval,llm_style_eval_207,4,3072,8192,bf16,NVIDIA GeForce RTX 4060,c00,32,32,32,2,2,8,0.0,0.0,379.88799810409546,473.99999141693104,0.5299630233246623,7,-1,-1,llm8_g7,0,
2026-03-03T03:10:22.075233+00:00,BUCKET,llm_style,eval,llm_style_eval_208,32,4096,1536,bf16,NVIDIA GeForce RTX 4060,c04,64,64,64,4,3,8,0.0,0.0,135.53600013256073,232.20512315630907,2.970820915521971,2,-1,-1,llm8_g2,0,
2026-03-03T03:10:22.087629+00:00,BUCKET,llm_style,eval,llm_style_eval_209,8,2048,1024,bf16,NVIDIA GeForce RTX 4060,c00,32,32,32,2,2,8,0.0,0.0,57.34400078654289,116.87744513154014,0.5851428491169093,7,-1,-1,llm8_g7,0,
2026-03-03T03:10:22.155048+00:00,BUCKET,llm_style,eval,llm_style_eval_210,1,6144,2048,bf16,NVIDIA GeForce RTX 4060,c11,32,128,32,4,2,8,0.0,0.0,131.85600191354752,257.16735005378723,0.19085838820215542,4,-1,-1,llm8_g4,0,
2026-03-03T03:10:22.256122+00:00,BUCKET,llm_style,eval,llm_style_eval_211,4,6144,3072,bf16,NVIDIA GeForce RTX 4060,c06,64,128,32,4,3,8,0.0,0.0,319.40799951553345,341.93632662296295,0.4727337581683104,5,-1,-1,llm8_g5,0,
2026-03-03T03:10:22.520672+00:00,BUCKET,llm_style,eval,llm_style_eval_212,32,6144,8192,bf16,NVIDIA GeForce RTX 4060,c10,64,128,64,8,3,8,0.0,0.0,815.9680068492889,836.4969551563263,3.947735015295725,1,-1,-1,llm8_g1,0,
2026-03-03T03:10:22.544349+00:00,BUCKET,llm_style,eval,llm_style_eval_213,2,1536,3072,bf16,NVIDIA GeForce RTX 4060,c00,32,32,32,2,2,8,0.0,0.0,113.48799988627434,167.20896035432798,0.16631157495870835,7,-1,-1,llm8_g7,0,
2026-03-03T03:10:22.645234+00:00,BUCKET,llm_style,eval,llm_style_eval_214,8,6144,3072,bf16,NVIDIA GeForce RTX 4060,c06,64,128,32,4,3,8,0.0,0.0,321.47200405597687,334.9094417691231,0.9393971611519102,5,-1,-1,llm8_g5,0,
2026-03-03T03:10:22.785089+00:00,BUCKET,llm_style,eval,llm_style_eval_215,64,6144,4096,bf16,NVIDIA GeForce RTX 4060,c10,64,128,64,8,3,8,0.0,0.0,427.0080029964447,485.95775246620167,7.54371217727931,1,-1,-1,llm8_g1,0,
2026-03-03T03:10:23.173151+00:00,BUCKET,llm_style,eval,llm_style_eval_216,1,8192,8192,bf16,NVIDIA GeForce RTX 4060,c06,64,128,32,4,3,8,0.0,0.0,1335.0720405578613,1413.0176234245298,0.10053219895453505,5,-1,-1,llm8_g5,0,
2026-03-03T03:10:23.444428+00:00,BUCKET,llm_style,eval,llm_style_eval_217,64,6144,8192,bf16,NVIDIA GeForce RTX 4060,c10,64,128,64,8,3,8,0.0,0.0,814.079999923706,843.3766537904739,7.913781132817136,1,-1,-1,llm8_g1,0,
2026-03-03T03:10:23.592709+00:00,BUCKET,llm_style,eval,llm_style_eval_218,64,8192,3072,bf16,NVIDIA GeForce RTX 4060,c00,32,32,32,2,2,8,0.0,0.0,624.6079802513123,650.2134329080582,5.157195511181162,0,-1,-1,llm8_g0,0,
2026-03-03T03:10:23.610670+00:00,BUCKET,llm_style,eval,llm_style_eval_219,1,3072,1024,bf16,NVIDIA GeForce RTX 4060,c02,32,64,32,2,2,8,0.0,0.0,72.1920020878315,157.83936128020284,0.0871489336498187,6,-1,-1,llm8_g6,0,
2026-03-03T03:10:23.972532+00:00,BUCKET,llm_style,eval,llm_style_eval_220,32,8192,8192,bf16,NVIDIA GeForce RTX 4060,c10,64,128,64,8,3,8,0.0,0.0,1191.9360160827637,1222.946857213974,3.6033539032700674,1,-1,-1,llm8_g1,0,
2026-03-03T03:10:23.985887+00:00,BUCKET,llm_style,eval,llm_style_eval_221,64,1024,1024,bf16,NVIDIA GeForce RTX 4060,c11,32,128,32,4,2,8,0.0,0.0,69.63200122117996,130.49280256032944,1.9275293779604168,3,-1,-1,llm8_g3,0,
2026-03-03T03:10:24.089946+00:00,BUCKET,llm_style,eval,llm_style_eval_222,64,6144,3072,bf16,NVIDIA GeForce RTX 4060,c10,64,128,64,8,3,8,0.0,0.0,312.3199939727783,363.48672688007343,7.735396870590907,1,-1,-1,llm8_g1,0,
2026-03-03T03:10:24.158199+00:00,BUCKET,llm_style,eval,llm_style_eval_223,2,8192,1536,bf16,NVIDIA GeForce RTX 4060,c11,32,128,32,4,2,8,0.0,0.0,155.4880067706108,160.64159750938416,0.3237011589855515,4,-1,-1,llm8_g4,0,
2026-03-03T03:10:24.179056+00:00,BUCKET,llm_style,eval,llm_style_eval_224,4,3072,1024,bf16,NVIDIA GeForce RTX 4060,c02,32,64,32,2,2,8,0.0,0.0,71.44000008702278,116.85696132481084,0.3522651731431258,6,-1,-1,llm8_g6,0,
2026-03-03T03:10:24.352771+00:00,BUCKET,llm_style,eval,llm_style_eval_225,32,4096,8192,bf16,NVIDIA GeForce RTX 4060,c11,32,128,32,4,2,8,0.0,0.0,486.4000082015991,550.7590502500533,4.415056767659281,3,-1,-1,llm8_g3,0,
2026-03-03T03:10:24.455933+00:00,BUCKET,llm_style,eval,llm_style_eval_226,32,6144,3072,bf16,NVIDIA GeForce RTX 4060,c10,64,128,64,8,3,8,0.0,0.0,316.22400879859924,409.80416774749744,3.8199488918924573,1,-1,-1,llm8_g1,0,
2026-03-03T03:10:24.473183+00:00,BUCKET,llm_style,eval,llm_style_eval_227,64,3072,1024,bf16,NVIDIA GeForce RTX 4060,c04,64,64,64,4,3,8,0.0,0.0,77.82399654388428,143.44063594937322,5.173894966611581,2,-1,-1,llm8_g2,0,
2026-03-03T03:10:24.547520+00:00,BUCKET,llm_style,eval,llm_style_eval_228,64,8192,1536,bf16,NVIDIA GeForce RTX 4060,c00,32,32,32,2,2,8,0.0,0.0,306.07999861240387,344.66304004192347,5.262064634414599,0,-1,-1,llm8_g0,0,
2026-03-03T03:10:24.587397+00:00,BUCKET,llm_style,eval,llm_style_eval_229,64,6144,1024,bf16,NVIDIA GeForce RTX 4060,c00,32,32,32,2,2,8,0.0,0.0,159.5200002193451,245.3606370091436,5.048309722245976,0,-1,-1,llm8_g0,0,
2026-03-03T03:10:24.737926+00:00,BUCKET,llm_style,eval,llm_style_eval_230,64,8192,3072,bf16,NVIDIA GeForce RTX 4060,c00,32,32,32,2,2,8,0.0,0.0,579.5199871063232,686.8684929609299,5.558437230240013,0,-1,-1,llm8_g0,0,
2026-03-03T03:10:24.765470+00:00,BUCKET,llm_style,eval,llm_style_eval_231,4,6144,1024,bf16,NVIDIA GeForce RTX 4060,c11,32,128,32,4,2,8,0.0,0.0,72.7040022611618,138.36287468671796,0.6922816686102434,4,-1,-1,llm8_g4,0,
2026-03-03T03:10:24.784097+00:00,BUCKET,llm_style,eval,llm_style_eval_232,1,3072,1024,bf16,NVIDIA GeForce RTX 4060,c02,32,64,32,2,2,8,0.0,0.0,67.58400052785873,79.97440092265603,0.09309090836383095,6,-1,-1,llm8_g6,0,
2026-03-03T03:10:24.806057+00:00,BUCKET,llm_style,eval,llm_style_eval_233,64,4096,1024,bf16,NVIDIA GeForce RTX 4060,c04,64,64,64,4,3,8,0.0,0.0,106.39999806880951,206.92991554737088,5.045779339702642,2,-1,-1,llm8_g2,0,
2026-03-03T03:10:24.824856+00:00,BUCKET,llm_style,eval,llm_style_eval_234,32,3072,1024,bf16,NVIDIA GeForce RTX 4060,c04,64,64,64,4,3,8,0.0,0.0,105.91999813914299,182.36224189400673,1.900742027350917,2,-1,-1,llm8_g2,0,
2026-03-03T03:10:25.021687+00:00,BUCKET,llm_style,eval,llm_style_eval_235,64,8192,4096,bf16,NVIDIA GeForce RTX 4060,c10,64,128,64,8,3,8,0.0,0.0,584.5440030097961,669.8495990037916,7.347551722172097,1,-1,-1,llm8_g1,0,
2026-03-03T03:10:25.064884+00:00,BUCKET,llm_style,eval,llm_style_eval_236,32,2048,4096,bf16,NVIDIA GeForce RTX 4060,c11,32,128,32,4,2,8,0.0,0.0,195.28000056743622,309.34879541397095,2.7492365344120424,3,-1,-1,llm8_g3,0,
2026-03-03T03:10:25.102099+00:00,BUCKET,llm_style,eval,llm_style_eval_237,64,4096,1536,bf16,NVIDIA GeForce RTX 4060,c04,64,64,64,4,3,8,0.0,0.0,131.58399611711502,155.20768404006958,6.12009356581058,2,-1,-1,llm8_g2,0,
2026-03-03T03:10:25.123934+00:00,BUCKET,llm_style,eval,llm_style_eval_238,32,3072,1536,bf16,NVIDIA GeForce RTX 4060,c11,32,128,32,4,2,8,0.0,0.0,90.11200070381165,106.07615865766999,3.351272701097914,3,-1,-1,llm8_g3,0,
2026-03-03T03:10:25.194830+00:00,BUCKET,llm_style,eval,llm_style_eval_239,8,2048,6144,bf16,NVIDIA GeForce RTX 4060,c00,32,32,32,2,2,8,0.0,0.0,196.60800695419312,284.897271990776,1.0239999637802455,7,-1,-1,llm8_g7,0,
2026-03-03T03:10:25.215731+00:00,BUCKET,llm_style,eval,llm_style_eval_240,16,4096,1024,bf16,NVIDIA GeForce RTX 4060,c02,32,64,32,2,2,8,0.0,0.0,77.82399654388428,152.3404756188392,1.7246316555371939,6,-1,-1,llm8_g6,0,
2026-03-03T03:10:25.278986+00:00,BUCKET,llm_style,eval,llm_style_eval_241,2,6144,2048,bf16,NVIDIA GeForce RTX 4060,c11,32,128,32,4,2,8,0.0,0.0,124.92799758911133,186.89023986458778,0.40288525367660966,4,-1,-1,llm8_g4,0,
2026-03-03T03:10:25.309295+00:00,BUCKET,llm_style,eval,llm_style_eval_242,4,1536,4096,bf16,NVIDIA GeForce RTX 4060,c00,32,32,32,2,2,8,0.0,0.0,126.97599828243256,200.78624397516248,0.39638710213600664,7,-1,-1,llm8_g7,0,
2026-03-03T03:10:25.343363+00:00,BUCKET,llm_style,eval,llm_style_eval_243,64,2048,3072,bf16,NVIDIA GeForce RTX 4060,c11,32,128,32,4,2,8,0.0,0.0,172.03199863433838,253.59359219670273,4.681142894303718,3,-1,-1,llm8_g3,0,
2026-03-03T03:10:25.366509+00:00,BUCKET,llm_style,eval,llm_style_eval_244,1,1536,3072,bf16,NVIDIA GeForce RTX 4060,c00,32,32,32,2,2,8,0.0,0.0,102.83199697732925,187.95520037412643,0.09177283605686039,7,-1,-1,llm8_g7,0,
2026-03-03T03:10:25.727418+00:00,BUCKET,llm_style,eval,llm_style_eval_245,8,8192,8192,bf16,NVIDIA GeForce RTX 4060,c06,64,128,32,4,3,8,0.0,0.0,1105.3279638290405,1218.5804605484009,0.9714237395029608,5,-1,-1,llm8_g5,0,
2026-03-03T03:10:25.871313+00:00,BUCKET,llm_style,eval,llm_style_eval_246,64,8192,3072,bf16,NVIDIA GeForce RTX 4060,c00,32,32,32,2,2,8,0.0,0.0,580.6080102920532,694.8352152109146,5.548021065675071,0,-1,-1,llm8_g0,0,
2026-03-03T03:10:25.897590+00:00,BUCKET,llm_style,eval,llm_style_eval_247,8,6144,1024,bf16,NVIDIA GeForce RTX 4060,c11,32,128,32,4,2,8,0.0,0.0,68.60800087451935,138.56767840683455,1.4672238618948863,4,-1,-1,llm8_g4,0,
2026-03-03T03:10:25.929411+00:00,BUCKET,llm_style,eval,llm_style_eval_248,64,4096,1536,bf16,NVIDIA GeForce RTX 4060,c04,64,64,64,4,3,8,0.0,0.0,161.27999871969223,280.4496005177498,4.9932190872573,2,-1,-1,llm8_g2,0,
2026-03-03T03:10:25.949511+00:00,BUCKET,llm_style,eval,llm_style_eval_249,2,4096,1024,bf16,NVIDIA GeForce RTX 4060,c02,32,64,32,2,2,8,0.0,0.0,67.9359994828701,87.10975944995877,0.24695619594483678,6,-1,-1,llm8_g6,0,
2026-03-03T03:10:25.971901+00:00,BUCKET,llm_style,eval,llm_style_eval_250,1,1536,3072,bf16,NVIDIA GeForce RTX 4060,c00,32,32,32,2,2,8,0.0,0.0,110.08000001311302,192.1536016464233,0.08573023254792712,7,-1,-1,llm8_g7,0,
2026-03-03T03:10:26.149365+00:00,BUCKET,llm_style,eval,llm_style_eval_251,16,8192,4096,bf16,NVIDIA GeForce RTX 4060,c06,64,128,32,4,3,8,0.0,0.0,506.303995847702,637.5526362657547,2.120745308759098,5,-1,-1,llm8_g5,0,
2026-03-03T03:10:26.213304+00:00,BUCKET,llm_style,eval,llm_style_eval_252,16,8192,1536,bf16,NVIDIA GeForce RTX 4060,c11,32,128,32,4,2,8,0.0,0.0,140.6559944152832,364.2880143225187,2.862680582323259,4,-1,-1,llm8_g4,0,
2026-03-03T03:10:26.250277+00:00,BUCKET,llm_style,eval,llm_style_eval_253,64,6144,1024,bf16,NVIDIA GeForce RTX 4060,c00,32,32,32,2,2,8,0.0,0.0,152.0640030503273,215.8489547669887,5.295838277606533,0,-1,-1,llm8_g0,0,
2026-03-03T03:10:26.448183+00:00,BUCKET,llm_style,eval,llm_style_eval_254,8,6144,6144,bf16,NVIDIA GeForce RTX 4060,c06,64,128,32,4,3,8,0.0,0.0,533.3600044250488,660.6643122434616,1.1324054503319532,5,-1,-1,llm8_g5,0,
2026-03-03T03:10:26.475546+00:00,BUCKET,llm_style,eval,llm_style_eval_255,16,6144,1024,bf16,NVIDIA GeForce RTX 4060,c11,32,128,32,4,2,8,0.0,0.0,92.67200157046318,156.9996809959411,2.172464051582195,4,-1,-1,llm8_g4,0,
