results/llm_bestsplit_with_onekey.csv
timestamp,method,workload,split,shape_id,M,N,K,dtype,gpu,config_id,BLOCK_M,BLOCK_N,BLOCK_K,num_warps,num_stages,GROUP_M,compile_time_ms,tune_time_ms,runtime_cost_us,p99_us,runtime_perf_tflops,bucket_m,bucket_n,bucket_k,cache_key,invalid_config,notes
2026-03-03T06:14:39.344581+00:00,FULL,llm_style,tune,llm_style_tune_000,64,6144,6144,bf16,NVIDIA GeForce RTX 4060,c10,64,128,64,8,3,8,1.1603239690884948,871.536,333.8240087032318,399.45889025926584,14.474208211595363,1,-1,-1,64x6144x6144,0,
2026-03-03T06:14:39.507005+00:00,FULL,llm_style,tune,llm_style_tune_001,64,8192,1536,bf16,NVIDIA GeForce RTX 4060,c06,64,128,32,4,3,8,0.0,162.39,94.2080020904541,129.43231850862495,17.096347446722895,1,-1,-1,64x8192x1536,0,
2026-03-03T06:14:39.803558+00:00,FULL,llm_style,tune,llm_style_tune_002,32,3072,8192,bf16,NVIDIA GeForce RTX 4060,c06,64,128,32,4,3,8,0.0,296.509,229.37600314617157,397.99422889947886,7.021714189402912,2,-1,-1,32x3072x8192,0,
2026-03-03T06:14:40.044323+00:00,FULL,llm_style,tune,llm_style_tune_003,4,6144,3072,bf16,NVIDIA GeForce RTX 4060,c11,32,128,32,4,2,8,0.0,240.723,176.12800002098083,222.88224115967748,0.8573023254792712,5,-1,-1,4x6144x3072,0,
2026-03-03T06:14:40.160166+00:00,FULL,llm_style,tune,llm_style_tune_004,8,8192,1024,bf16,NVIDIA GeForce RTX 4060,c11,32,128,32,4,2,8,0.0,115.812,50.11200159788132,80.04800118505952,2.678354959297307,5,-1,-1,8x8192x1024,0,
2026-03-03T06:14:40.469366+00:00,FULL,llm_style,tune,llm_style_tune_005,32,8192,3072,bf16,NVIDIA GeForce RTX 4060,c11,32,128,32,4,2,8,0.0,309.158,231.4079999923706,266.44704356789583,6.96005642005938,1,-1,-1,32x8192x3072,0,
2026-03-03T06:14:41.023409+00:00,FULL,llm_style,tune,llm_style_tune_006,32,6144,8192,bf16,NVIDIA GeForce RTX 4060,c11,32,128,32,4,2,8,0.0,554.001,428.70399355888367,466.0428810119629,7.513868590910516,0,-1,-1,32x6144x8192,0,
2026-03-03T06:14:41.095678+00:00,FULL,llm_style,tune,llm_style_tune_007,8,1536,2048,bf16,NVIDIA GeForce RTX 4060,c00,32,32,32,2,2,8,0.0,72.225,36.3520011305809,451.8982297182079,1.3845633372204869,7,-1,-1,8x1536x2048,0,
2026-03-03T06:14:41.194284+00:00,FULL,llm_style,tune,llm_style_tune_008,16,1536,4096,bf16,NVIDIA GeForce RTX 4060,c04,64,64,64,4,3,8,0.0,98.566,58.14399942755699,71.86431817710395,3.4625514925377234,7,-1,-1,16x1536x4096,0,
2026-03-03T06:14:41.257889+00:00,FULL,llm_style,tune,llm_style_tune_009,64,1536,2048,bf16,NVIDIA GeForce RTX 4060,c04,64,64,64,4,3,8,0.0,63.564,41.98399931192398,47.07264080643654,9.590634303522425,3,-1,-1,64x1536x2048,0,
2026-03-03T06:14:41.316988+00:00,FULL,llm_style,tune,llm_style_tune_010,2,2048,1024,bf16,NVIDIA GeForce RTX 4060,c11,32,128,32,4,2,8,0.0,59.056,39.93599861860275,46.622720882296555,0.21005128931701406,7,-1,-1,2x2048x1024,0,
2026-03-03T06:14:41.617208+00:00,FULL,llm_style,tune,llm_style_tune_011,2,3072,8192,bf16,NVIDIA GeForce RTX 4060,c10,64,128,64,8,3,8,0.0,300.177,226.27199441194534,290.77120825648285,0.44487739749504673,6,-1,-1,2x3072x8192,0,
2026-03-03T06:14:41.691504+00:00,FULL,llm_style,tune,llm_style_tune_012,64,2048,1536,bf16,NVIDIA GeForce RTX 4060,c11,32,128,32,4,2,8,0.0,74.257,47.74399846792221,67.70399995148178,8.433587401996313,3,-1,-1,64x2048x1536,0,
2026-03-03T06:14:42.083733+00:00,FULL,llm_style,tune,llm_style_tune_013,16,8192,4096,bf16,NVIDIA GeForce RTX 4060,c00,32,32,32,2,2,8,0.0,392.188,273.4079957008362,375.6531310081481,3.9272509980830677,5,-1,-1,16x8192x4096,0,
2026-03-03T06:14:42.468159+00:00,FULL,llm_style,tune,llm_style_tune_014,4,8192,4096,bf16,NVIDIA GeForce RTX 4060,c11,32,128,32,4,2,8,0.0,384.385,291.83998703956604,386.1971208453177,0.9198035496198368,5,-1,-1,4x8192x4096,0,
2026-03-03T06:14:42.553468+00:00,FULL,llm_style,tune,llm_style_tune_015,4,3072,2048,bf16,NVIDIA GeForce RTX 4060,c00,32,32,32,2,2,8,0.0,85.267,44.015999883413315,126.99648573994637,1.1434852811094867,7,-1,-1,4x3072x2048,0,
2026-03-03T06:14:42.604221+00:00,FULL,llm_style,tune,llm_style_tune_016,16,1536,1024,bf16,NVIDIA GeForce RTX 4060,c04,64,64,64,4,3,8,0.0,50.71,34.81600061058998,39.43423844873905,1.4456470334703126,7,-1,-1,16x1536x1024,0,
2026-03-03T06:14:42.671216+00:00,FULL,llm_style,tune,llm_style_tune_017,32,1024,2048,bf16,NVIDIA GeForce RTX 4060,c04,64,64,64,4,3,8,0.0,66.96,44.76799815893173,342.50752300023964,2.9980730325155722,3,-1,-1,32x1024x2048,0,
2026-03-03T06:14:42.698369+00:00,FULL,llm_style,tune,llm_style_tune_018,64,1536,2048,bf16,NVIDIA GeForce RTX 4060,c04,64,64,64,4,3,8,0.0,0.0,54.25599962472916,1400.3878018259957,7.421357762920583,3,-1,-1,64x1536x2048,0,
2026-03-03T06:14:42.785721+00:00,FULL,llm_style,tune,llm_style_tune_019,4,4096,1536,bf16,NVIDIA GeForce RTX 4060,c00,32,32,32,2,2,8,0.0,87.313,46.08000069856644,82.90079846978179,1.0922666501080551,7,-1,-1,4x4096x1536,0,
2026-03-03T06:14:42.939827+00:00,FULL,llm_style,tune,llm_style_tune_020,1,8192,1536,bf16,NVIDIA GeForce RTX 4060,c11,32,128,32,4,2,8,0.0,154.067,61.48799881339073,132.28703938424582,0.4092802577032225,5,-1,-1,1x8192x1536,0,
2026-03-03T06:14:43.046994+00:00,FULL,llm_style,tune,llm_style_tune_021,64,1536,4096,bf16,NVIDIA GeForce RTX 4060,c04,64,64,64,4,3,8,0.0,107.127,59.328000992536545,68.60800087451935,13.573799125665932,3,-1,-1,64x1536x4096,0,
2026-03-03T06:14:43.164324+00:00,FULL,llm_style,tune,llm_style_tune_022,64,1024,6144,bf16,NVIDIA GeForce RTX 4060,c04,64,64,64,4,3,8,0.0,117.277,71.52000069618225,211.8662409484386,11.259876400462442,3,-1,-1,64x1024x6144,0,
2026-03-03T06:14:43.238301+00:00,FULL,llm_style,tune,llm_style_tune_023,8,4096,1024,bf16,NVIDIA GeForce RTX 4060,c11,32,128,32,4,2,8,0.0,73.934,40.95999896526337,82.54272013902657,1.6384000413894664,7,-1,-1,8x4096x1024,0,
2026-03-03T06:14:43.478161+00:00,FULL,llm_style,tune,llm_style_tune_024,8,4096,4096,bf16,NVIDIA GeForce RTX 4060,c11,32,128,32,4,2,8,0.0,239.822,159.743994474411,171.59168228507042,1.6804103145361124,7,-1,-1,8x4096x4096,0,
2026-03-03T06:14:43.562874+00:00,FULL,llm_style,tune,llm_style_tune_025,32,6144,1024,bf16,NVIDIA GeForce RTX 4060,c11,32,128,32,4,2,8,0.0,84.672,41.98399931192398,46.60224087536335,9.590634303522425,1,-1,-1,32x6144x1024,0,
2026-03-03T06:14:43.639643+00:00,FULL,llm_style,tune,llm_style_tune_026,1,3072,1536,bf16,NVIDIA GeForce RTX 4060,c00,32,32,32,2,2,8,0.0,76.729,44.03200000524521,75.02176050096743,0.2143255813698178,7,-1,-1,1x3072x1536,0,
2026-03-03T06:14:43.740864+00:00,FULL,llm_style,tune,llm_style_tune_027,1,6144,1536,bf16,NVIDIA GeForce RTX 4060,c11,32,128,32,4,2,8,0.0,101.179,46.959999948740005,51.191358342766755,0.40192436159716016,5,-1,-1,1x6144x1536,0,
2026-03-03T06:14:43.777672+00:00,FULL,llm_style,tune,llm_style_tune_028,4,4096,1536,bf16,NVIDIA GeForce RTX 4060,c00,32,32,32,2,2,8,0.0,0.0,49.15200173854828,200.24319648742653,1.0239999637802455,7,-1,-1,4x4096x1536,0,
2026-03-03T06:14:43.897437+00:00,FULL,llm_style,tune,llm_style_tune_029,16,1024,6144,bf16,NVIDIA GeForce RTX 4060,c04,64,64,64,4,3,8,0.0,119.712,75.47200098633766,131.870723441243,2.6675666388710852,7,-1,-1,16x1024x6144,0,
2026-03-03T06:14:44.306743+00:00,FULL,llm_style,tune,llm_style_tune_030,64,4096,8192,bf16,NVIDIA GeForce RTX 4060,c03,64,64,32,4,2,8,0.0,409.262,301.05599761009216,314.00960564613337,14.266340249306568,2,-1,-1,64x4096x8192,0,
2026-03-03T06:14:44.411153+00:00,FULL,llm_style,tune,llm_style_tune_031,1,6144,1024,bf16,NVIDIA GeForce RTX 4060,c00,32,32,32,2,2,8,0.0,104.364,38.784001022577286,122.64447666704649,0.32443563501030037,5,-1,-1,1x6144x1024,0,
2026-03-03T06:14:44.501342+00:00,FULL,llm_style,tune,llm_style_tune_032,64,1024,4096,bf16,NVIDIA GeForce RTX 4060,c04,64,64,64,4,3,8,0.0,90.146,57.16799944639206,74.39359903335568,9.391108963038633,3,-1,-1,64x1024x4096,0,
2026-03-03T06:14:44.889937+00:00,FULL,llm_style,tune,llm_style_tune_033,2,4096,8192,bf16,NVIDIA GeForce RTX 4060,c00,32,32,32,2,2,8,0.0,388.55,293.7279939651489,352.2617495059966,0.4569456461678795,6,-1,-1,2x4096x8192,0,
2026-03-03T06:14:45.512099+00:00,FULL,llm_style,tune,llm_style_tune_034,1,8192,6144,bf16,NVIDIA GeForce RTX 4060,c10,64,128,64,8,3,8,0.0,622.119,424.9759912490845,448.9078417420387,0.2368681950811659,5,-1,-1,1x8192x6144,0,
2026-03-03T06:14:45.571829+00:00,FULL,llm_style,tune,llm_style_tune_035,64,1536,1024,bf16,NVIDIA GeForce RTX 4060,c00,32,32,32,2,2,8,0.0,59.683,24.25600029528141,70.07680021226403,8.300073777586679,3,-1,-1,64x1536x1024,0,
2026-03-03T06:14:45.655376+00:00,FULL,llm_style,tune,llm_style_tune_036,32,3072,2048,bf16,NVIDIA GeForce RTX 4060,c11,32,128,32,4,2,8,0.0,83.504,53.23199927806854,128.84992256760592,7.564119128734137,3,-1,-1,32x3072x2048,0,
2026-03-03T06:14:45.788000+00:00,FULL,llm_style,tune,llm_style_tune_037,4,1536,6144,bf16,NVIDIA GeForce RTX 4060,c04,64,64,64,4,3,8,0.0,132.584,71.68000191450119,146.88128225505326,1.0532571147256975,7,-1,-1,4x1536x6144,0,
2026-03-03T06:14:45.887852+00:00,FULL,llm_style,tune,llm_style_tune_038,1,4096,1536,bf16,NVIDIA GeForce RTX 4060,c00,32,32,32,2,2,8,0.0,99.812,46.78400047123432,129.16735522449014,0.2689575896301717,7,-1,-1,1x4096x1536,0,
2026-03-03T06:14:45.984326+00:00,FULL,llm_style,tune,llm_style_tune_039,4,1536,4096,bf16,NVIDIA GeForce RTX 4060,c04,64,64,64,4,3,8,0.0,96.427,57.34400078654289,98.5219226032495,0.877714273675364,7,-1,-1,4x1536x4096,0,
2026-03-03T06:14:46.543958+00:00,FULL,llm_style,tune,llm_style_tune_040,2,6144,8192,bf16,NVIDIA GeForce RTX 4060,c11,32,128,32,4,2,8,0.0,559.583,427.0080029964447,512.1392023563384,0.47148201107995685,4,-1,-1,2x6144x8192,0,
2026-03-03T06:14:46.602150+00:00,FULL,llm_style,tune,llm_style_tune_041,16,1024,1536,bf16,NVIDIA GeForce RTX 4060,c04,64,64,64,4,3,8,0.0,58.141,39.95199874043465,46.60224087536335,1.2598030032740342,7,-1,-1,16x1024x1536,0,
2026-03-03T06:14:46.627219+00:00,FULL,llm_style,tune,llm_style_tune_042,32,3072,2048,bf16,NVIDIA GeForce RTX 4060,c11,32,128,32,4,2,8,0.0,0.0,63.32799792289734,105.31808309257026,6.358217489999218,3,-1,-1,32x3072x2048,0,
2026-03-03T06:14:46.741946+00:00,FULL,llm_style,tune,llm_style_tune_043,2,2048,4096,bf16,NVIDIA GeForce RTX 4060,c00,32,32,32,2,2,8,0.0,114.667,60.416001826524734,168.2070395350455,0.5553898137176703,7,-1,-1,2x2048x4096,0,
2026-03-03T06:14:46.979714+00:00,FULL,llm_style,tune,llm_style_tune_044,64,2048,8192,bf16,NVIDIA GeForce RTX 4060,c06,64,128,32,4,3,8,0.0,237.724,166.9120043516159,179.21920046210286,12.865962854751436,2,-1,-1,64x2048x8192,0,
2026-03-03T06:14:47.119382+00:00,FULL,llm_style,tune,llm_style_tune_045,2,3072,8192,bf16,NVIDIA GeForce RTX 4060,c10,64,128,64,8,3,8,0.0,0.0,253.31200659275055,281.1596745252609,0.3973885697484379,6,-1,-1,2x3072x8192,0,
2026-03-03T06:14:47.697807+00:00,FULL,llm_style,tune,llm_style_tune_046,4,8192,6144,bf16,NVIDIA GeForce RTX 4060,c11,32,128,32,4,2,8,0.0,578.368,426.35199427604675,447.6518499851227,0.9444149186723337,5,-1,-1,4x8192x6144,0,
2026-03-03T06:14:47.827665+00:00,FULL,llm_style,tune,llm_style_tune_047,1,1024,6144,bf16,NVIDIA GeForce RTX 4060,c04,64,64,64,4,3,8,0.0,129.816,72.7040022611618,80.4508775472641,0.17307041715256086,7,-1,-1,1x1024x6144,0,
2026-03-03T06:14:47.988954+00:00,FULL,llm_style,tune,llm_style_tune_048,32,4096,3072,bf16,NVIDIA GeForce RTX 4060,c11,32,128,32,4,2,8,0.0,161.251,85.34400165081024,107.6678421348333,9.4360043169168,3,-1,-1,32x4096x3072,0,
2026-03-03T06:14:48.049693+00:00,FULL,llm_style,tune,llm_style_tune_049,16,2048,1024,bf16,NVIDIA GeForce RTX 4060,c11,32,128,32,4,2,8,0.0,60.694,38.84800150990486,54.937599897384615,1.7274727499917755,7,-1,-1,16x2048x1024,0,
2026-03-03T06:14:48.103535+00:00,FULL,llm_style,tune,llm_style_tune_050,4,1024,1536,bf16,NVIDIA GeForce RTX 4060,c04,64,64,64,4,3,8,0.0,53.8,37.88800165057182,42.56767950952052,0.3321080936399846,7,-1,-1,4x1024x1536,0,
2026-03-03T06:14:48.266207+00:00,FULL,llm_style,tune,llm_style_tune_051,64,4096,8192,bf16,NVIDIA GeForce RTX 4060,c03,64,64,32,4,2,8,0.0,0.0,325.6320059299469,349.1417661309242,13.18963497993491,2,-1,-1,64x4096x8192,0,
2026-03-03T06:14:48.353545+00:00,FULL,llm_style,tune,llm_style_tune_052,16,2048,1536,bf16,NVIDIA GeForce RTX 4060,c11,32,128,32,4,2,8,0.0,87.286,44.43200118839741,73.76096226274964,2.265558455788985,7,-1,-1,16x2048x1536,0,
2026-03-03T06:14:48.410182+00:00,FULL,llm_style,tune,llm_style_tune_053,64,1024,1024,bf16,NVIDIA GeForce RTX 4060,c04,64,64,64,4,3,8,0.0,56.596,35.840000957250595,100.90496420860279,3.7449141856913686,3,-1,-1,64x1024x1024,0,
2026-03-03T06:14:48.795184+00:00,FULL,llm_style,tune,llm_style_tune_054,4,4096,8192,bf16,NVIDIA GeForce RTX 4060,c00,32,32,32,2,2,8,0.0,384.963,292.87999868392944,310.8147171139717,0.9165373436432253,6,-1,-1,4x4096x8192,0,
2026-03-03T06:14:48.949539+00:00,FULL,llm_style,tune,llm_style_tune_055,1,4096,3072,bf16,NVIDIA GeForce RTX 4060,c00,32,32,32,2,2,8,0.0,154.312,68.60800087451935,150.07200598716733,0.3668059654737216,7,-1,-1,1x4096x3072,0,
2026-03-03T06:14:48.979335+00:00,FULL,llm_style,tune,llm_style_tune_056,64,1536,2048,bf16,NVIDIA GeForce RTX 4060,c04,64,64,64,4,3,8,0.0,0.0,54.78399991989136,646.0908809304227,7.349831786448325,3,-1,-1,64x1536x2048,0,
2026-03-03T06:14:49.087100+00:00,FULL,llm_style,tune,llm_style_tune_057,2,4096,2048,bf16,NVIDIA GeForce RTX 4060,c11,32,128,32,4,2,8,0.0,107.712,56.09599873423576,68.71040090918538,0.5981608805820495,7,-1,-1,2x4096x2048,0,
2026-03-03T06:14:49.237508+00:00,FULL,llm_style,tune,llm_style_tune_058,4,8192,1536,bf16,NVIDIA GeForce RTX 4060,c11,32,128,32,4,2,8,0.0,150.362,63.37599828839302,98.80383946001518,1.5883504594583393,5,-1,-1,4x8192x1536,0,
2026-03-03T06:14:49.340128+00:00,FULL,llm_style,tune,llm_style_tune_059,1,1536,4096,bf16,NVIDIA GeForce RTX 4060,c04,64,64,64,4,3,8,0.0,102.583,59.39200147986412,117.08544068038442,0.21186206368657284,7,-1,-1,1x1536x4096,0,
2026-03-03T06:14:49.369531+00:00,FULL,llm_style,tune,llm_style_tune_060,64,1536,4096,bf16,NVIDIA GeForce RTX 4060,c04,64,64,64,4,3,8,0.0,0.0,57.34400078654289,97.3356822878121,14.043428378805825,3,-1,-1,64x1536x4096,0,
2026-03-03T06:14:49.980996+00:00,FULL,llm_style,tune,llm_style_tune_061,8,8192,6144,bf16,NVIDIA GeForce RTX 4060,c10,64,128,64,8,3,8,0.0,611.417,431.1999976634979,526.9033628702163,1.867593627930511,5,-1,-1,8x8192x6144,0,
2026-03-03T06:14:50.105388+00:00,FULL,llm_style,tune,llm_style_tune_062,64,6144,1536,bf16,NVIDIA GeForce RTX 4060,c10,64,128,64,8,3,8,0.0,124.348,67.29599833488464,75.60448184609413,17.949946235864406,1,-1,-1,64x6144x1536,0,
2026-03-03T06:14:50.168364+00:00,FULL,llm_style,tune,llm_style_tune_063,2,1536,1024,bf16,NVIDIA GeForce RTX 4060,c04,64,64,64,4,3,8,0.0,62.933,38.91199827194214,122.97472115606044,0.1616842177066119,7,-1,-1,2x1536x1024,0,
2026-03-03T06:14:50.218596+00:00,FULL,llm_style,eval,llm_style_eval_000,32,1536,1024,bf16,NVIDIA GeForce RTX 4060,c00,32,32,32,2,2,8,0.0,50.194,34.671999514102936,66.62144020199776,2.903302301877771,3,-1,-1,32x1536x1024,0,
2026-03-03T06:14:50.444860+00:00,FULL,llm_style,eval,llm_style_eval_001,32,2048,8192,bf16,NVIDIA GeForce RTX 4060,c10,64,128,64,8,3,8,0.0,226.229,162.81600296497345,255.19872322678538,6.594817489967455,2,-1,-1,32x2048x8192,0,
2026-03-03T06:14:50.576697+00:00,FULL,llm_style,eval,llm_style_eval_002,16,2048,4096,bf16,NVIDIA GeForce RTX 4060,c00,32,32,32,2,2,8,0.0,131.798,46.063998714089394,74.75200295448303,5.827445803524974,7,-1,-1,16x2048x4096,0,
2026-03-03T06:14:50.599716+00:00,FULL,llm_style,eval,llm_style_eval_003,16,2048,1536,bf16,NVIDIA GeForce RTX 4060,c11,32,128,32,4,2,8,0.0,0.0,48.0320006608963,114.44639928638934,2.0957548012767195,7,-1,-1,16x2048x1536,0,
2026-03-03T06:14:50.824232+00:00,FULL,llm_style,eval,llm_style_eval_004,64,8192,2048,bf16,NVIDIA GeForce RTX 4060,c10,64,128,64,8,3,8,0.0,224.471,165.8879965543747,219.07807528972626,12.945382984935252,1,-1,-1,64x8192x2048,0,
2026-03-03T06:14:51.131943+00:00,FULL,llm_style,eval,llm_style_eval_005,64,3072,8192,bf16,NVIDIA GeForce RTX 4060,c10,64,128,64,8,3,8,0.0,307.668,234.27200317382812,260.44415861368174,13.749937800334914,2,-1,-1,64x3072x8192,0,
2026-03-03T06:14:51.210764+00:00,FULL,llm_style,eval,llm_style_eval_006,32,2048,2048,bf16,NVIDIA GeForce RTX 4060,c00,32,32,32,2,2,8,0.0,78.779,49.15200173854828,58.89024131000042,5.46133314016131,3,-1,-1,32x2048x2048,0,
2026-03-03T06:14:51.430126+00:00,FULL,llm_style,eval,llm_style_eval_007,8,8192,2048,bf16,NVIDIA GeForce RTX 4060,c10,64,128,64,8,3,8,0.0,219.32,160.76800227165222,171.0313618183136,1.6697069827764632,5,-1,-1,8x8192x2048,0,
2026-03-03T06:14:51.618507+00:00,FULL,llm_style,eval,llm_style_eval_008,64,1536,8192,bf16,NVIDIA GeForce RTX 4060,c04,64,64,64,4,3,8,0.0,188.341,104.44799810647964,156.56224370002747,15.420235573668524,2,-1,-1,64x1536x8192,0,
2026-03-03T06:14:51.937337+00:00,FULL,llm_style,eval,llm_style_eval_009,64,4096,6144,bf16,NVIDIA GeForce RTX 4060,c06,64,128,32,4,3,8,0.0,318.787,233.40800404548645,274.3193596601485,13.800835516215841,3,-1,-1,64x4096x6144,0,
2026-03-03T06:14:52.066054+00:00,FULL,llm_style,eval,llm_style_eval_010,64,2048,4096,bf16,NVIDIA GeForce RTX 4060,c03,64,64,32,4,2,8,0.0,128.67,75.77600330114365,107.12031960487366,14.169945328639345,3,-1,-1,64x2048x4096,0,
2026-03-03T06:14:52.303584+00:00,FULL,llm_style,eval,llm_style_eval_011,32,3072,6144,bf16,NVIDIA GeForce RTX 4060,c06,64,128,32,4,3,8,0.0,237.489,181.2319979071617,290.73856085538864,6.665266431697078,3,-1,-1,32x3072x6144,0,
2026-03-03T06:14:52.378064+00:00,FULL,llm_style,eval,llm_style_eval_012,16,1536,1536,bf16,NVIDIA GeForce RTX 4060,c04,64,64,64,4,3,8,0.0,74.441,43.02399978041649,78.83455991744984,1.7547757620239828,7,-1,-1,16x1536x1536,0,
2026-03-03T06:14:52.478436+00:00,FULL,llm_style,eval,llm_style_eval_013,64,2048,3072,bf16,NVIDIA GeForce RTX 4060,c03,64,64,32,4,2,8,0.0,100.328,64.12799656391144,367.25760042667326,12.557797080054,3,-1,-1,64x2048x3072,0,
2026-03-03T06:14:53.064668+00:00,FULL,llm_style,eval,llm_style_eval_014,16,8192,6144,bf16,NVIDIA GeForce RTX 4060,c02,32,64,32,2,2,8,0.0,586.189,430.9439957141876,546.9593513011932,3.73740614097846,5,-1,-1,16x8192x6144,0,
2026-03-03T06:14:53.108814+00:00,FULL,llm_style,eval,llm_style_eval_015,64,6144,1536,bf16,NVIDIA GeForce RTX 4060,c10,64,128,64,8,3,8,0.0,0.0,78.31999659538269,231.79328233003582,15.423386165867306,1,-1,-1,64x6144x1536,0,
2026-03-03T06:14:53.339578+00:00,FULL,llm_style,eval,llm_style_eval_016,16,4096,4096,bf16,NVIDIA GeForce RTX 4060,c03,64,64,32,4,2,8,0.0,230.709,163.80799561738968,228.76096621155722,3.2774402127108764,7,-1,-1,16x4096x4096,0,
2026-03-03T06:14:53.757298+00:00,FULL,llm_style,eval,llm_style_eval_017,64,8192,4096,bf16,NVIDIA GeForce RTX 4060,c10,64,128,64,8,3,8,0.0,417.679,303.1040132045746,361.80225253105164,14.169945328639345,1,-1,-1,64x8192x4096,0,
2026-03-03T06:14:54.071260+00:00,FULL,llm_style,eval,llm_style_eval_018,32,4096,6144,bf16,NVIDIA GeForce RTX 4060,c11,32,128,32,4,2,8,0.0,313.916,228.35199534893036,371.1564856767653,7.05320193738147,3,-1,-1,32x4096x6144,0,
2026-03-03T06:14:54.377673+00:00,FULL,llm_style,eval,llm_style_eval_019,16,3072,8192,bf16,NVIDIA GeForce RTX 4060,c10,64,128,64,8,3,8,0.0,306.371,229.23199832439423,273.364474773407,3.5130626347390765,6,-1,-1,16x3072x8192,0,
2026-03-03T06:14:54.448276+00:00,FULL,llm_style,eval,llm_style_eval_020,4,1536,1536,bf16,NVIDIA GeForce RTX 4060,c04,64,64,64,4,3,8,0.0,70.564,39.64800015091896,50.61311941593884,0.47604842433805655,7,-1,-1,4x1536x1536,0,
2026-03-03T06:14:54.556947+00:00,FULL,llm_style,eval,llm_style_eval_021,4,6144,1536,bf16,NVIDIA GeForce RTX 4060,c11,32,128,32,4,2,8,0.0,108.629,47.02400043606758,145.7705567032098,1.605509342035757,5,-1,-1,4x6144x1536,0,
2026-03-03T06:14:54.583165+00:00,FULL,llm_style,eval,llm_style_eval_022,32,6144,1024,bf16,NVIDIA GeForce RTX 4060,c11,32,128,32,4,2,8,0.0,0.0,40.81599973142147,138.90528291463852,9.865081993569904,1,-1,-1,32x6144x1024,0,
2026-03-03T06:14:54.593136+00:00,FULL,llm_style,eval,llm_style_eval_023,16,1024,1536,bf16,NVIDIA GeForce RTX 4060,c04,64,64,64,4,3,8,0.0,0.0,38.91199827194214,109.12767969071864,1.2934737416528952,7,-1,-1,16x1024x1536,0,
2026-03-03T06:14:54.691479+00:00,FULL,llm_style,eval,llm_style_eval_024,32,8192,1024,bf16,NVIDIA GeForce RTX 4060,c11,32,128,32,4,2,8,0.0,98.309,50.175998359918594,144.6911966800689,10.699755451779136,1,-1,-1,32x8192x1024,0,
2026-03-03T06:14:55.123227+00:00,FULL,llm_style,eval,llm_style_eval_025,32,6144,6144,bf16,NVIDIA GeForce RTX 4060,c11,32,128,32,4,2,8,0.0,431.707,330.51200211048126,370.85183143615717,7.309625939672906,1,-1,-1,32x6144x6144,0,
2026-03-03T06:14:55.266966+00:00,FULL,llm_style,eval,llm_style_eval_026,1,6144,2048,bf16,NVIDIA GeForce RTX 4060,c00,32,32,32,2,2,8,0.0,143.699,59.39200147986412,111.11520297825334,0.4237241273731457,5,-1,-1,1x6144x2048,0,
2026-03-03T06:14:55.327655+00:00,FULL,llm_style,eval,llm_style_eval_027,32,4096,3072,bf16,NVIDIA GeForce RTX 4060,c11,32,128,32,4,2,8,0.0,0.0,85.79199761152267,147.92704157531253,9.38673058583543,3,-1,-1,32x4096x3072,0,
2026-03-03T06:14:55.392065+00:00,FULL,llm_style,eval,llm_style_eval_028,64,1536,1536,bf16,NVIDIA GeForce RTX 4060,c04,64,64,64,4,3,8,0.0,64.359,47.10400104522705,62.62784067541357,6.411130292521085,3,-1,-1,64x1536x1536,0,
2026-03-03T06:14:55.459914+00:00,FULL,llm_style,eval,llm_style_eval_029,2,3072,1024,bf16,NVIDIA GeForce RTX 4060,c11,32,128,32,4,2,8,0.0,67.81,41.37600027024746,48.62592108547686,0.3041113669232085,7,-1,-1,2x3072x1024,0,
2026-03-03T06:14:55.641287+00:00,FULL,llm_style,eval,llm_style_eval_030,32,1536,8192,bf16,NVIDIA GeForce RTX 4060,c04,64,64,64,4,3,8,0.0,181.332,89.88799899816513,113.06432031095028,8.958997607861297,2,-1,-1,32x1536x8192,0,
2026-03-03T06:14:55.728854+00:00,FULL,llm_style,eval,llm_style_eval_031,8,3072,2048,bf16,NVIDIA GeForce RTX 4060,c00,32,32,32,2,2,8,0.0,87.525,50.783999264240265,82.48319812119006,1.9821852839164327,7,-1,-1,8x3072x2048,0,
2026-03-03T06:14:55.822834+00:00,FULL,llm_style,eval,llm_style_eval_032,8,2048,3072,bf16,NVIDIA GeForce RTX 4060,c00,32,32,32,2,2,8,0.0,93.937,58.41599963605404,156.9059237837791,1.7232144725273377,7,-1,-1,8x2048x3072,0,
2026-03-03T06:14:55.894264+00:00,FULL,llm_style,eval,llm_style_eval_033,64,1536,8192,bf16,NVIDIA GeForce RTX 4060,c04,64,64,64,4,3,8,0.0,0.0,108.0319993197918,218.8598389923572,14.908663600979297,2,-1,-1,64x1536x8192,0,
2026-03-03T06:14:56.039017+00:00,FULL,llm_style,eval,llm_style_eval_034,64,6144,2048,bf16,NVIDIA GeForce RTX 4060,c06,64,128,32,4,3,8,0.0,144.7,80.89599758386612,112.0255967229604,19.90967148072132,1,-1,-1,64x6144x2048,0,
2026-03-03T06:14:56.146202+00:00,FULL,llm_style,eval,llm_style_eval_035,4,4096,2048,bf16,NVIDIA GeForce RTX 4060,c11,32,128,32,4,2,8,0.0,107.143,53.247999399900436,56.84224061667919,1.2603077065112325,7,-1,-1,4x4096x2048,0,
2026-03-03T06:14:56.320975+00:00,FULL,llm_style,eval,llm_style_eval_036,64,8192,4096,bf16,NVIDIA GeForce RTX 4060,c10,64,128,64,8,3,8,0.0,0.0,305.1519989967346,341.1465534567833,14.074845683858555,1,-1,-1,64x8192x4096,0,
2026-03-03T06:14:56.353890+00:00,FULL,llm_style,eval,llm_style_eval_037,32,6144,1024,bf16,NVIDIA GeForce RTX 4060,c11,32,128,32,4,2,8,0.0,0.0,54.16000075638294,136.72255769371986,7.434512156142205,1,-1,-1,32x6144x1024,0,
2026-03-03T06:14:56.427237+00:00,FULL,llm_style,eval,llm_style_eval_038,64,6144,2048,bf16,NVIDIA GeForce RTX 4060,c06,64,128,32,4,3,8,0.0,0.0,86.95999905467033,267.2742366790768,18.521305813117984,1,-1,-1,64x6144x2048,0,
2026-03-03T06:14:56.507230+00:00,FULL,llm_style,eval,llm_style_eval_039,8,1024,3072,bf16,NVIDIA GeForce RTX 4060,c04,64,64,64,4,3,8,0.0,79.934,50.11200159788132,57.890880852937684,1.0043831097364901,7,-1,-1,8x1024x3072,0,
2026-03-03T06:14:56.720351+00:00,FULL,llm_style,eval,llm_style_eval_040,32,8192,2048,bf16,NVIDIA GeForce RTX 4060,c11,32,128,32,4,2,8,0.0,213.011,165.66399484872818,202.7020780742168,6.481443508473038,1,-1,-1,32x8192x2048,0,
2026-03-03T06:14:56.792140+00:00,FULL,llm_style,eval,llm_style_eval_041,32,3072,1024,bf16,NVIDIA GeForce RTX 4060,c11,32,128,32,4,2,8,0.0,71.745,41.680000722408295,62.085120491683455,4.830292430675545,3,-1,-1,32x3072x1024,0,
2026-03-03T06:14:56.813037+00:00,FULL,llm_style,eval,llm_style_eval_042,64,1024,4096,bf16,NVIDIA GeForce RTX 4060,c04,64,64,64,4,3,8,0.0,0.0,79.85599711537361,163.37663844227788,6.7229880208538955,3,-1,-1,64x1024x4096,0,
2026-03-03T06:14:56.825398+00:00,FULL,llm_style,eval,llm_style_eval_043,2,1536,1024,bf16,NVIDIA GeForce RTX 4060,c04,64,64,64,4,3,8,0.0,0.0,69.56800073385239,255.68671241402592,0.09043606160351426,7,-1,-1,2x1536x1024,0,
2026-03-03T06:14:57.066543+00:00,FULL,llm_style,eval,llm_style_eval_044,64,6144,3072,bf16,NVIDIA GeForce RTX 4060,c06,64,128,32,4,3,8,0.0,241.101,182.3519989848137,292.34048545360565,13.2486570887616,1,-1,-1,64x6144x3072,0,
2026-03-03T06:14:57.206207+00:00,FULL,llm_style,eval,llm_style_eval_045,64,1536,6144,bf16,NVIDIA GeForce RTX 4060,c04,64,64,64,4,3,8,0.0,139.622,72.7040022611618,77.17984274029732,16.61476004664584,3,-1,-1,64x1536x6144,0,
2026-03-03T06:14:57.445449+00:00,FULL,llm_style,eval,llm_style_eval_046,2,6144,3072,bf16,NVIDIA GeForce RTX 4060,c11,32,128,32,4,2,8,0.0,239.202,176.96000635623932,322.0172727107998,0.4266357893772651,5,-1,-1,2x6144x3072,0,
2026-03-03T06:14:57.853232+00:00,FULL,llm_style,eval,llm_style_eval_047,16,4096,8192,bf16,NVIDIA GeForce RTX 4060,c11,32,128,32,4,2,8,0.0,407.743,293.5680001974106,345.9993690252303,3.6575574424935944,6,-1,-1,16x4096x8192,0,
2026-03-03T06:14:57.889309+00:00,FULL,llm_style,eval,llm_style_eval_048,16,1024,6144,bf16,NVIDIA GeForce RTX 4060,c04,64,64,64,4,3,8,0.0,0.0,70.51200047135353,298.0447937548154,2.855210328088645,7,-1,-1,16x1024x6144,0,
2026-03-03T06:14:58.027658+00:00,FULL,llm_style,eval,llm_style_eval_049,16,8192,1536,bf16,NVIDIA GeForce RTX 4060,c00,32,32,32,2,2,8,0.0,138.3,64.51199948787689,135.91552130877966,6.241523859071623,5,-1,-1,16x8192x1536,0,
2026-03-03T06:14:58.089162+00:00,FULL,llm_style,eval,llm_style_eval_050,1,1024,1024,bf16,NVIDIA GeForce RTX 4060,c04,64,64,64,4,3,8,0.0,61.468,37.88800165057182,62.18687821179628,0.05535134893999744,7,-1,-1,1x1024x1024,0,
2026-03-03T06:14:58.173300+00:00,FULL,llm_style,eval,llm_style_eval_051,16,6144,1024,bf16,NVIDIA GeForce RTX 4060,c11,32,128,32,4,2,8,0.0,84.102,43.34400035440922,123.38272474706164,4.644854890038313,5,-1,-1,16x6144x1024,0,
2026-03-03T06:14:58.939686+00:00,FULL,llm_style,eval,llm_style_eval_052,16,8192,8192,bf16,NVIDIA GeForce RTX 4060,c00,32,32,32,2,2,8,0.0,766.346,560.479998588562,597.8768080472945,3.831508088438367,4,-1,-1,16x8192x8192,0,
2026-03-03T06:14:59.484618+00:00,FULL,llm_style,eval,llm_style_eval_053,1,6144,8192,bf16,NVIDIA GeForce RTX 4060,c06,64,128,32,4,3,8,0.0,544.888,424.9599874019623,470.7391911745071,0.23687711545601195,4,-1,-1,1x6144x8192,0,
2026-03-03T06:14:59.657168+00:00,FULL,llm_style,eval,llm_style_eval_054,64,4096,3072,bf16,NVIDIA GeForce RTX 4060,c04,64,64,64,4,3,8,0.0,172.509,87.0399996638298,141.0310401022434,18.504282424409332,3,-1,-1,64x4096x3072,0,
2026-03-03T06:14:59.763519+00:00,FULL,llm_style,eval,llm_style_eval_055,4,8192,1024,bf16,NVIDIA GeForce RTX 4060,c11,32,128,32,4,2,8,0.0,106.308,50.175998359918594,54.74527955055237,1.337469431472392,5,-1,-1,4x8192x1024,0,
2026-03-03T06:14:59.843367+00:00,FULL,llm_style,eval,llm_style_eval_056,64,1024,3072,bf16,NVIDIA GeForce RTX 4060,c04,64,64,64,4,3,8,0.0,79.805,49.1040013730526,55.84704004228114,8.200007590847147,3,-1,-1,64x1024x3072,0,
2026-03-03T06:14:59.847320+00:00,FULL,llm_style,eval,llm_style_eval_057,64,1024,3072,bf16,NVIDIA GeForce RTX 4060,c04,64,64,64,4,3,8,0.0,0.0,49.02400076389313,53.247999399900436,8.213388905961338,3,-1,-1,64x1024x3072,0,
2026-03-03T06:14:59.963661+00:00,FULL,llm_style,eval,llm_style_eval_058,32,2048,4096,bf16,NVIDIA GeForce RTX 4060,c00,32,32,32,2,2,8,0.0,116.316,67.58400052785873,143.36831569671628,7.943757513713575,3,-1,-1,32x2048x4096,0,
2026-03-03T06:15:00.053325+00:00,FULL,llm_style,eval,llm_style_eval_059,64,8192,2048,bf16,NVIDIA GeForce RTX 4060,c10,64,128,64,8,3,8,0.0,0.0,172.03199863433838,271.3577651977539,12.483047718143249,1,-1,-1,64x8192x2048,0,
2026-03-03T06:15:00.280536+00:00,FULL,llm_style,eval,llm_style_eval_060,1,3072,6144,bf16,NVIDIA GeForce RTX 4060,c06,64,128,32,4,3,8,0.0,227.152,176.96000635623932,186.89023986458778,0.21331789468863255,7,-1,-1,1x3072x6144,0,
2026-03-03T06:15:00.314820+00:00,FULL,llm_style,eval,llm_style_eval_061,64,1536,4096,bf16,NVIDIA GeForce RTX 4060,c04,64,64,64,4,3,8,0.0,0.0,39.424000307917595,147.52575695514673,20.42680503526348,3,-1,-1,64x1536x4096,0,
2026-03-03T06:15:00.450375+00:00,FULL,llm_style,eval,llm_style_eval_062,16,6144,2048,bf16,NVIDIA GeForce RTX 4060,c00,32,32,32,2,2,8,0.0,135.501,67.50399991869926,86.78399942815298,5.964878888435486,5,-1,-1,16x6144x2048,0,
2026-03-03T06:15:00.492226+00:00,FULL,llm_style,eval,llm_style_eval_063,64,1536,6144,bf16,NVIDIA GeForce RTX 4060,c04,64,64,64,4,3,8,0.0,0.0,70.65600156784058,138.69056209921825,17.09634744672289,3,-1,-1,64x1536x6144,0,
2026-03-03T06:15:00.551328+00:00,FULL,llm_style,eval,llm_style_eval_064,1,6144,2048,bf16,NVIDIA GeForce RTX 4060,c00,32,32,32,2,2,8,0.0,0.0,60.35200133919716,160.26623845100403,0.4169840840664121,5,-1,-1,1x6144x2048,0,
2026-03-03T06:15:00.687104+00:00,FULL,llm_style,eval,llm_style_eval_065,8,1536,6144,bf16,NVIDIA GeForce RTX 4060,c04,64,64,64,4,3,8,0.0,135.725,72.4480003118515,154.80960361659504,2.0841837366116964,7,-1,-1,8x1536x6144,0,
2026-03-03T06:15:00.728108+00:00,FULL,llm_style,eval,llm_style_eval_066,64,1536,4096,bf16,NVIDIA GeForce RTX 4060,c04,64,64,64,4,3,8,0.0,0.0,65.50399959087372,198.83264236152127,12.294003007904855,3,-1,-1,64x1536x4096,0,
2026-03-03T06:15:00.814103+00:00,FULL,llm_style,eval,llm_style_eval_067,64,8192,2048,bf16,NVIDIA GeForce RTX 4060,c10,64,128,64,8,3,8,0.0,0.0,166.75199568271637,189.75968033075327,12.878308527629716,1,-1,-1,64x8192x2048,0,
2026-03-03T06:15:00.837557+00:00,FULL,llm_style,eval,llm_style_eval_068,64,1024,4096,bf16,NVIDIA GeForce RTX 4060,c04,64,64,64,4,3,8,0.0,0.0,62.16000020503998,104.70144353806973,8.63691940522983,3,-1,-1,64x1024x4096,0,
2026-03-03T06:15:00.880275+00:00,FULL,llm_style,eval,llm_style_eval_069,64,2048,4096,bf16,NVIDIA GeForce RTX 4060,c03,64,64,32,4,2,8,0.0,0.0,80.71999996900558,126.76096186041826,13.302054316306856,3,-1,-1,64x2048x4096,0,
2026-03-03T06:15:00.997156+00:00,FULL,llm_style,eval,llm_style_eval_070,64,8192,1024,bf16,NVIDIA GeForce RTX 4060,c06,64,128,32,4,3,8,0.0,116.832,66.41599908471107,71.74144193530081,16.16691518304924,1,-1,-1,64x8192x1024,0,
2026-03-03T06:15:01.058267+00:00,FULL,llm_style,eval,llm_style_eval_071,64,6144,2048,bf16,NVIDIA GeForce RTX 4060,c06,64,128,32,4,3,8,0.0,0.0,86.7839977145195,174.62272316217422,18.558867745390053,1,-1,-1,64x6144x2048,0,
2026-03-03T06:15:01.068627+00:00,FULL,llm_style,eval,llm_style_eval_072,64,1536,1024,bf16,NVIDIA GeForce RTX 4060,c00,32,32,32,2,2,8,0.0,0.0,38.91199827194214,106.98687873780727,5.173894966611581,3,-1,-1,64x1536x1024,0,
2026-03-03T06:15:01.094044+00:00,FULL,llm_style,eval,llm_style_eval_073,1,4096,1536,bf16,NVIDIA GeForce RTX 4060,c00,32,32,32,2,2,8,0.0,0.0,52.112000063061714,131.21535591781137,0.24145901106795326,7,-1,-1,1x4096x1536,0,
2026-03-03T06:15:01.160502+00:00,FULL,llm_style,eval,llm_style_eval_074,8,1024,2048,bf16,NVIDIA GeForce RTX 4060,c04,64,64,64,4,3,8,0.0,66.39,47.10400104522705,152.76799835264666,0.7123478102801206,7,-1,-1,8x1024x2048,0,
2026-03-03T06:15:01.246559+00:00,FULL,llm_style,eval,llm_style_eval_075,2,6144,1024,bf16,NVIDIA GeForce RTX 4060,c11,32,128,32,4,2,8,0.0,86.017,41.88799858093262,59.57631964236494,0.6007884084358105,5,-1,-1,2x6144x1024,0,
2026-03-03T06:15:01.272937+00:00,FULL,llm_style,eval,llm_style_eval_076,64,1024,6144,bf16,NVIDIA GeForce RTX 4060,c04,64,64,64,4,3,8,0.0,0.0,74.73600283265114,192.13056057691568,10.775347054661754,3,-1,-1,64x1024x6144,0,
2026-03-03T06:15:01.692065+00:00,FULL,llm_style,eval,llm_style_eval_077,1,4096,8192,bf16,NVIDIA GeForce RTX 4060,c00,32,32,32,2,2,8,0.0,419.08,292.86399483680725,402.55488961935043,0.22914685718671254,6,-1,-1,1x4096x8192,0,
2026-03-03T06:15:01.795733+00:00,FULL,llm_style,eval,llm_style_eval_078,64,6144,3072,bf16,NVIDIA GeForce RTX 4060,c06,64,128,32,4,3,8,0.0,0.0,188.1920024752617,259.05504137277603,12.837522701410112,1,-1,-1,64x6144x3072,0,
2026-03-03T06:15:01.943488+00:00,FULL,llm_style,eval,llm_style_eval_079,2,3072,4096,bf16,NVIDIA GeForce RTX 4060,c00,32,32,32,2,2,8,0.0,147.705,77.72799953818321,153.04735511541355,0.6475356152099991,7,-1,-1,2x3072x4096,0,
2026-03-03T06:15:02.008011+00:00,FULL,llm_style,eval,llm_style_eval_080,4,1536,1024,bf16,NVIDIA GeForce RTX 4060,c04,64,64,64,4,3,8,0.0,64.485,39.84000161290169,134.63552072644225,0.31583613179185166,7,-1,-1,4x1536x1024,0,
2026-03-03T06:15:02.314451+00:00,FULL,llm_style,eval,llm_style_eval_081,4,4096,6144,bf16,NVIDIA GeForce RTX 4060,c02,32,64,32,2,2,8,0.0,306.402,227.32800245285034,385.43968766927713,0.8856216120658376,7,-1,-1,4x4096x6144,0,
2026-03-03T06:15:02.407813+00:00,FULL,llm_style,eval,llm_style_eval_082,64,6144,1024,bf16,NVIDIA GeForce RTX 4060,c06,64,128,32,4,3,8,0.0,93.311,54.25599962472916,142.07423910498613,14.842715525841166,1,-1,-1,64x6144x1024,0,
2026-03-03T06:15:02.494156+00:00,FULL,llm_style,eval,llm_style_eval_083,8,4096,4096,bf16,NVIDIA GeForce RTX 4060,c11,32,128,32,4,2,8,0.0,0.0,163.83999586105347,276.93696677684784,1.6384000413894664,7,-1,-1,8x4096x4096,0,
2026-03-03T06:15:02.641101+00:00,FULL,llm_style,eval,llm_style_eval_084,64,1024,8192,bf16,NVIDIA GeForce RTX 4060,c04,64,64,64,4,3,8,0.0,146.895,87.0399996638298,103.04512128233907,12.336188282939554,2,-1,-1,64x1024x8192,0,
2026-03-03T06:15:02.937027+00:00,FULL,llm_style,eval,llm_style_eval_085,1,3072,8192,bf16,NVIDIA GeForce RTX 4060,c10,64,128,64,8,3,8,0.0,295.886,227.32800245285034,253.8598401844501,0.2214054030164594,6,-1,-1,1x3072x8192,0,
2026-03-03T06:15:03.007876+00:00,FULL,llm_style,eval,llm_style_eval_086,8,1536,1024,bf16,NVIDIA GeForce RTX 4060,c00,32,32,32,2,2,8,0.0,70.808,20.44800017029047,105.49247846007347,1.230722994445403,7,-1,-1,8x1536x1024,0,
2026-03-03T06:15:03.087075+00:00,FULL,llm_style,eval,llm_style_eval_087,16,1024,3072,bf16,NVIDIA GeForce RTX 4060,c04,64,64,64,4,3,8,0.0,79.156,51.19999870657921,66.76480207592245,1.9660800496673596,7,-1,-1,16x1024x3072,0,
2026-03-03T06:15:03.172133+00:00,FULL,llm_style,eval,llm_style_eval_088,8,4096,1536,bf16,NVIDIA GeForce RTX 4060,c00,32,32,32,2,2,8,0.0,85.018,44.73600164055824,64.5324794948101,2.2501630076107952,7,-1,-1,8x4096x1536,0,
2026-03-03T06:15:03.403272+00:00,FULL,llm_style,eval,llm_style_eval_089,16,6144,3072,bf16,NVIDIA GeForce RTX 4060,c11,32,128,32,4,2,8,0.0,231.095,178.17600071430206,204.60543826222414,3.3897930898587,5,-1,-1,16x6144x3072,0,
2026-03-03T06:15:03.492374+00:00,FULL,llm_style,eval,llm_style_eval_090,32,1536,3072,bf16,NVIDIA GeForce RTX 4060,c04,64,64,64,4,3,8,0.0,89.058,55.135998874902725,62.43263855576515,5.477181771662114,3,-1,-1,32x1536x3072,0,
2026-03-03T06:15:03.578114+00:00,FULL,llm_style,eval,llm_style_eval_091,16,1024,4096,bf16,NVIDIA GeForce RTX 4060,c04,64,64,64,4,3,8,0.0,85.697,55.296000093221664,162.40671828389154,2.4272592551672245,7,-1,-1,16x1024x4096,0,
2026-03-03T06:15:03.897765+00:00,FULL,llm_style,eval,llm_style_eval_092,1,4096,6144,bf16,NVIDIA GeForce RTX 4060,c11,32,128,32,4,2,8,0.0,319.608,226.94400697946548,249.05728980898851,0.22178002702029556,7,-1,-1,1x4096x6144,0,
2026-03-03T06:15:03.999626+00:00,FULL,llm_style,eval,llm_style_eval_093,32,2048,3072,bf16,NVIDIA GeForce RTX 4060,c11,32,128,32,4,2,8,0.0,101.815,63.48799914121628,140.1939146220684,6.342193634176106,3,-1,-1,32x2048x3072,0,
2026-03-03T06:15:04.013223+00:00,FULL,llm_style,eval,llm_style_eval_094,32,1024,2048,bf16,NVIDIA GeForce RTX 4060,c04,64,64,64,4,3,8,0.0,0.0,46.400001272559166,118.20639893412582,2.892623368943224,3,-1,-1,32x1024x2048,0,
2026-03-03T06:15:04.154391+00:00,FULL,llm_style,eval,llm_style_eval_095,8,6144,2048,bf16,NVIDIA GeForce RTX 4060,c11,32,128,32,4,2,8,0.0,141.129,65.21599739789963,70.01152016222477,3.087073724743555,5,-1,-1,8x6144x2048,0,
2026-03-03T06:15:04.179763+00:00,FULL,llm_style,eval,llm_style_eval_096,64,2048,3072,bf16,NVIDIA GeForce RTX 4060,c03,64,64,32,4,2,8,0.0,0.0,67.35999882221222,107.77920193970195,11.955261016638365,3,-1,-1,64x2048x3072,0,
2026-03-03T06:15:04.206010+00:00,FULL,llm_style,eval,llm_style_eval_097,64,6144,1024,bf16,NVIDIA GeForce RTX 4060,c06,64,128,32,4,3,8,0.0,0.0,72.59200140833855,190.17055660486216,11.093596434544587,1,-1,-1,64x6144x1024,0,
2026-03-03T06:15:04.236656+00:00,FULL,llm_style,eval,llm_style_eval_098,32,6144,1024,bf16,NVIDIA GeForce RTX 4060,c11,32,128,32,4,2,8,0.0,0.0,43.328000232577324,124.31967906653877,9.293140275079079,1,-1,-1,32x6144x1024,0,
2026-03-03T06:15:04.309925+00:00,FULL,llm_style,eval,llm_style_eval_099,1,2048,2048,bf16,NVIDIA GeForce RTX 4060,c00,32,32,32,2,2,8,0.0,73.22,46.54400050640106,103.62144067883486,0.18022963021509805,7,-1,-1,1x2048x2048,0,
2026-03-03T06:15:04.348519+00:00,FULL,llm_style,eval,llm_style_eval_100,64,8192,1024,bf16,NVIDIA GeForce RTX 4060,c06,64,128,32,4,3,8,0.0,0.0,55.776000022888184,81.26816242933268,19.25096499496881,1,-1,-1,64x8192x1024,0,
2026-03-03T06:15:04.413771+00:00,FULL,llm_style,eval,llm_style_eval_101,64,8192,1536,bf16,NVIDIA GeForce RTX 4060,c06,64,128,32,4,3,8,0.0,0.0,95.23200243711472,145.2675227820872,16.91251569621828,1,-1,-1,64x8192x1536,0,
2026-03-03T06:15:04.442525+00:00,FULL,llm_style,eval,llm_style_eval_102,32,3072,2048,bf16,NVIDIA GeForce RTX 4060,c11,32,128,32,4,2,8,0.0,0.0,54.23999950289726,151.92704156041145,7.423546970690737,3,-1,-1,32x3072x2048,0,
2026-03-03T06:15:04.467416+00:00,FULL,llm_style,eval,llm_style_eval_103,64,2048,3072,bf16,NVIDIA GeForce RTX 4060,c03,64,64,32,4,2,8,0.0,0.0,60.256000608205795,107.58304059505454,13.364749732333406,3,-1,-1,64x2048x3072,0,
2026-03-03T06:15:04.525867+00:00,FULL,llm_style,eval,llm_style_eval_104,16,6144,2048,bf16,NVIDIA GeForce RTX 4060,c00,32,32,32,2,2,8,0.0,0.0,71.68000191450119,127.21151806414113,5.617371278537052,5,-1,-1,16x6144x2048,0,
2026-03-03T06:15:04.665415+00:00,FULL,llm_style,eval,llm_style_eval_105,1,1024,8192,bf16,NVIDIA GeForce RTX 4060,c04,64,64,64,4,3,8,0.0,139.497,86.01599931716919,92.2214414179325,0.19504762059598826,6,-1,-1,1x1024x8192,0,
2026-03-03T06:15:05.063032+00:00,FULL,llm_style,eval,llm_style_eval_106,32,4096,8192,bf16,NVIDIA GeForce RTX 4060,c11,32,128,32,4,2,8,0.0,397.576,295.80800235271454,359.3999972939489,7.259721275016052,2,-1,-1,32x4096x8192,0,
2026-03-03T06:15:05.122479+00:00,FULL,llm_style,eval,llm_style_eval_107,64,6144,1536,bf16,NVIDIA GeForce RTX 4060,c10,64,128,64,8,3,8,0.0,0.0,65.35999849438667,129.5667228102684,18.481633718271024,1,-1,-1,64x6144x1536,0,
2026-03-03T06:15:05.191874+00:00,FULL,llm_style,eval,llm_style_eval_108,8,3072,1536,bf16,NVIDIA GeForce RTX 4060,c00,32,32,32,2,2,8,0.0,69.333,42.8640004247427,116.69536121189591,1.7613258504080278,7,-1,-1,8x3072x1536,0,
2026-03-03T06:15:05.215357+00:00,FULL,llm_style,eval,llm_style_eval_109,16,2048,1024,bf16,NVIDIA GeForce RTX 4060,c11,32,128,32,4,2,8,0.0,0.0,49.02400076389313,916.9481807947154,1.3688981509935565,7,-1,-1,16x2048x1024,0,
2026-03-03T06:15:05.970003+00:00,FULL,llm_style,eval,llm_style_eval_110,1,8192,8192,bf16,NVIDIA GeForce RTX 4060,c11,32,128,32,4,2,8,0.0,754.602,556.3679933547974,599.5219457149506,0.24123912518887294,4,-1,-1,1x8192x8192,0,
2026-03-03T06:15:06.086220+00:00,FULL,llm_style,eval,llm_style_eval_111,8,6144,1536,bf16,NVIDIA GeForce RTX 4060,c11,32,128,32,4,2,8,0.0,116.175,47.98400029540062,94.66048091649998,3.146776906269593,5,-1,-1,8x6144x1536,0,
2026-03-03T06:15:06.181330+00:00,FULL,llm_style,eval,llm_style_eval_112,2,6144,3072,bf16,NVIDIA GeForce RTX 4060,c11,32,128,32,4,2,8,0.0,0.0,180.9919998049736,254.22848001122458,0.4171315421750777,5,-1,-1,2x6144x3072,0,
2026-03-03T06:15:06.513767+00:00,FULL,llm_style,eval,llm_style_eval_113,1,8192,8192,bf16,NVIDIA GeForce RTX 4060,c11,32,128,32,4,2,8,0.0,0.0,556.5280020236969,577.1692860126495,0.24116976596315998,4,-1,-1,1x8192x8192,0,
2026-03-03T06:15:06.573727+00:00,FULL,llm_style,eval,llm_style_eval_114,1,3072,1024,bf16,NVIDIA GeForce RTX 4060,c00,32,32,32,2,2,8,0.0,59.902,36.51199862360954,141.9571195542812,0.17231201350702813,7,-1,-1,1x3072x1024,0,
2026-03-03T06:15:06.640074+00:00,FULL,llm_style,eval,llm_style_eval_115,16,3072,1536,bf16,NVIDIA GeForce RTX 4060,c00,32,32,32,2,2,8,0.0,66.304,39.93599861860275,86.44832011312235,3.780923207706253,7,-1,-1,16x3072x1536,0,
2026-03-03T06:15:06.705086+00:00,FULL,llm_style,eval,llm_style_eval_116,8,3072,1024,bf16,NVIDIA GeForce RTX 4060,c11,32,128,32,4,2,8,0.0,64.97,39.93599861860275,58.07071972638366,1.2603077359020842,7,-1,-1,8x3072x1024,0,
2026-03-03T06:15:06.792260+00:00,FULL,llm_style,eval,llm_style_eval_117,4,1024,4096,bf16,NVIDIA GeForce RTX 4060,c04,64,64,64,4,3,8,0.0,87.132,56.32000043988228,61.39551993459463,0.5957818135285181,7,-1,-1,4x1024x4096,0,
2026-03-03T06:15:06.888444+00:00,FULL,llm_style,eval,llm_style_eval_118,64,6144,3072,bf16,NVIDIA GeForce RTX 4060,c06,64,128,32,4,3,8,0.0,0.0,184.32000279426575,282.579205930233,13.107199801296662,1,-1,-1,64x6144x3072,0,
2026-03-03T06:15:07.464550+00:00,FULL,llm_style,eval,llm_style_eval_119,64,8192,6144,bf16,NVIDIA GeForce RTX 4060,c00,32,32,32,2,2,8,0.0,576.056,438.78400325775146,485.36577135324467,14.682510976170573,1,-1,-1,64x8192x6144,0,
2026-03-03T06:15:07.565406+00:00,FULL,llm_style,eval,llm_style_eval_120,8,1024,4096,bf16,NVIDIA GeForce RTX 4060,c04,64,64,64,4,3,8,0.0,100.814,61.43999844789505,70.451839864254,1.0922666942596442,7,-1,-1,8x1024x4096,0,
2026-03-03T06:15:07.625966+00:00,FULL,llm_style,eval,llm_style_eval_121,4,1024,2048,bf16,NVIDIA GeForce RTX 4060,c00,32,32,32,2,2,8,0.0,60.517,40.78400135040283,127.68256217241284,0.41136758151451686,7,-1,-1,4x1024x2048,0,
2026-03-03T06:15:07.931419+00:00,FULL,llm_style,eval,llm_style_eval_122,4,6144,4096,bf16,NVIDIA GeForce RTX 4060,c03,64,64,32,4,2,8,0.0,305.413,226.8799990415573,252.78687864542007,0.8873703845667034,5,-1,-1,4x6144x4096,0,
2026-03-03T06:15:08.232171+00:00,FULL,llm_style,eval,llm_style_eval_123,4,3072,8192,bf16,NVIDIA GeForce RTX 4060,c10,64,128,64,8,3,8,0.0,300.714,227.32800245285034,351.26207441091503,0.8856216120658376,6,-1,-1,4x3072x8192,0,
2026-03-03T06:15:08.267904+00:00,FULL,llm_style,eval,llm_style_eval_124,64,6144,1024,bf16,NVIDIA GeForce RTX 4060,c06,64,128,32,4,3,8,0.0,0.0,78.831996768713,189.57312062382687,10.215475961654338,1,-1,-1,64x6144x1024,0,
2026-03-03T06:15:08.331300+00:00,FULL,llm_style,eval,llm_style_eval_125,64,1536,8192,bf16,NVIDIA GeForce RTX 4060,c04,64,64,64,4,3,8,0.0,0.0,105.47199845314026,202.48575925827026,15.270524495803242,2,-1,-1,64x1536x8192,0,
2026-03-03T06:15:08.415884+00:00,FULL,llm_style,eval,llm_style_eval_126,64,2048,8192,bf16,NVIDIA GeForce RTX 4060,c06,64,128,32,4,3,8,0.0,0.0,171.00800573825836,256.02047711610794,12.55779598580255,2,-1,-1,64x2048x8192,0,
2026-03-03T06:15:08.555390+00:00,FULL,llm_style,eval,llm_style_eval_127,2,8192,1536,bf16,NVIDIA GeForce RTX 4060,c11,32,128,32,4,2,8,0.0,139.454,62.463998794555664,94.95296128094188,0.8057705073532193,5,-1,-1,2x8192x1536,0,
2026-03-03T06:15:08.628638+00:00,FULL,llm_style,eval,llm_style_eval_128,8,2048,2048,bf16,NVIDIA GeForce RTX 4060,c00,32,32,32,2,2,8,0.0,73.205,45.744000002741814,167.59807668626286,1.467052815581882,7,-1,-1,8x2048x2048,0,
2026-03-03T06:15:08.885106+00:00,FULL,llm_style,eval,llm_style_eval_129,64,8192,6144,bf16,NVIDIA GeForce RTX 4060,c00,32,32,32,2,2,8,0.0,0.0,445.42399048805237,560.2787256240845,14.463637077430398,1,-1,-1,64x8192x6144,0,
2026-03-03T06:15:08.904708+00:00,FULL,llm_style,eval,llm_style_eval_130,16,3072,1536,bf16,NVIDIA GeForce RTX 4060,c00,32,32,32,2,2,8,0.0,0.0,42.320000007748604,96.40384152531618,3.567933458704005,7,-1,-1,16x3072x1536,0,
2026-03-03T06:15:09.669016+00:00,FULL,llm_style,eval,llm_style_eval_131,32,8192,8192,bf16,NVIDIA GeForce RTX 4060,c11,32,128,32,4,2,8,0.0,764.259,562.9599988460541,619.4640105962753,7.629258392787679,0,-1,-1,32x8192x8192,0,
2026-03-03T06:15:10.079374+00:00,FULL,llm_style,eval,llm_style_eval_132,32,8192,4096,bf16,NVIDIA GeForce RTX 4060,c11,32,128,32,4,2,8,0.0,410.314,297.4720001220703,327.7667289972305,7.219111873113303,1,-1,-1,32x8192x4096,0,
2026-03-03T06:15:10.833109+00:00,FULL,llm_style,eval,llm_style_eval_133,2,8192,8192,bf16,NVIDIA GeForce RTX 4060,c11,32,128,32,4,2,8,0.0,753.688,557.0560097694397,605.4707384109497,0.4818823444901042,4,-1,-1,2x8192x8192,0,
2026-03-03T06:15:10.952137+00:00,FULL,llm_style,eval,llm_style_eval_134,64,3072,3072,bf16,NVIDIA GeForce RTX 4060,c03,64,64,32,4,2,8,0.0,118.987,66.56000018119812,85.09439900517461,18.1484307198248,3,-1,-1,64x3072x3072,0,
2026-03-03T06:15:11.066110+00:00,FULL,llm_style,eval,llm_style_eval_135,8,3072,3072,bf16,NVIDIA GeForce RTX 4060,c00,32,32,32,2,2,8,0.0,113.931,60.92800013720989,260.1987218856809,2.478252095259311,7,-1,-1,8x3072x3072,0,
2026-03-03T06:15:11.193149+00:00,FULL,llm_style,eval,llm_style_eval_136,4,2048,4096,bf16,NVIDIA GeForce RTX 4060,c00,32,32,32,2,2,8,0.0,127.001,65.5359998345375,311.14047974348045,1.0240000025853515,7,-1,-1,4x2048x4096,0,
2026-03-03T06:15:11.930194+00:00,FULL,llm_style,eval,llm_style_eval_137,4,8192,8192,bf16,NVIDIA GeForce RTX 4060,c02,32,64,32,2,2,8,0.0,736.983,558.9599907398224,659.1267335414886,0.9604818249861032,4,-1,-1,4x8192x8192,0,
2026-03-03T06:15:12.013129+00:00,FULL,llm_style,eval,llm_style_eval_138,16,1024,1024,bf16,NVIDIA GeForce RTX 4060,c04,64,64,64,4,3,8,0.0,82.887,59.37600135803223,75.9276788681745,0.5651177450914829,7,-1,-1,16x1024x1024,0,
2026-03-03T06:15:12.075555+00:00,FULL,llm_style,eval,llm_style_eval_139,4,1024,1024,bf16,NVIDIA GeForce RTX 4060,c11,32,128,32,4,2,8,0.0,62.384,38.91199827194214,45.96191935241221,0.21557895694214924,7,-1,-1,4x1024x1024,0,
2026-03-03T06:15:12.205705+00:00,FULL,llm_style,eval,llm_style_eval_140,64,4096,6144,bf16,NVIDIA GeForce RTX 4060,c06,64,128,32,4,3,8,0.0,0.0,236.35200411081314,254.37823176383972,13.628932338097437,3,-1,-1,64x4096x6144,0,
2026-03-03T06:15:12.336653+00:00,FULL,llm_style,eval,llm_style_eval_141,4,6144,4096,bf16,NVIDIA GeForce RTX 4060,c03,64,64,32,4,2,8,0.0,0.0,228.43199968338013,236.5520016849041,0.8813414595111465,5,-1,-1,4x6144x4096,0,
2026-03-03T06:15:12.502155+00:00,FULL,llm_style,eval,llm_style_eval_142,4,2048,6144,bf16,NVIDIA GeForce RTX 4060,c00,32,32,32,2,2,8,0.0,165.45,89.08800035715103,155.6201559305191,1.1299310299529002,7,-1,-1,4x2048x6144,0,
2026-03-03T06:15:12.570319+00:00,FULL,llm_style,eval,llm_style_eval_143,64,1536,8192,bf16,NVIDIA GeForce RTX 4060,c04,64,64,64,4,3,8,0.0,0.0,104.43199798464775,184.46303978562355,15.422598122050404,2,-1,-1,64x1536x8192,0,
2026-03-03T06:15:12.679101+00:00,FULL,llm_style,eval,llm_style_eval_144,1,3072,3072,bf16,NVIDIA GeForce RTX 4060,c11,32,128,32,4,2,8,0.0,108.731,61.40800006687641,68.02464008331299,0.30736008304202805,7,-1,-1,1x3072x3072,0,
2026-03-03T06:15:12.690833+00:00,FULL,llm_style,eval,llm_style_eval_145,32,1024,2048,bf16,NVIDIA GeForce RTX 4060,c04,64,64,64,4,3,8,0.0,0.0,46.04800045490265,134.24191400408745,2.914735204006238,3,-1,-1,32x1024x2048,0,
2026-03-03T06:15:12.862787+00:00,FULL,llm_style,eval,llm_style_eval_146,64,8192,4096,bf16,NVIDIA GeForce RTX 4060,c10,64,128,64,8,3,8,0.0,0.0,303.616002202034,341.6576075553894,14.146050487622245,1,-1,-1,64x8192x4096,0,
2026-03-03T06:15:12.908221+00:00,FULL,llm_style,eval,llm_style_eval_147,64,2048,4096,bf16,NVIDIA GeForce RTX 4060,c03,64,64,32,4,2,8,0.0,0.0,54.32000011205673,186.89183846116052,19.7669702095909,3,-1,-1,64x2048x4096,0,
2026-03-03T06:15:12.936146+00:00,FULL,llm_style,eval,llm_style_eval_148,64,1024,6144,bf16,NVIDIA GeForce RTX 4060,c04,64,64,64,4,3,8,0.0,0.0,70.65600156784058,147.4172803759575,11.397564964481928,3,-1,-1,64x1024x6144,0,
2026-03-03T06:15:13.102067+00:00,FULL,llm_style,eval,llm_style_eval_149,64,4096,8192,bf16,NVIDIA GeForce RTX 4060,c03,64,64,32,4,2,8,0.0,0.0,302.0800054073334,435.23327827453613,14.217979406510347,2,-1,-1,64x4096x8192,0,
2026-03-03T06:15:13.193318+00:00,FULL,llm_style,eval,llm_style_eval_150,2,2048,3072,bf16,NVIDIA GeForce RTX 4060,c00,32,32,32,2,2,8,0.0,91.198,52.54399962723255,184.65183481574041,0.47894762824558623,7,-1,-1,2x2048x3072,0,
2026-03-03T06:15:13.317030+00:00,FULL,llm_style,eval,llm_style_eval_151,64,4096,2048,bf16,NVIDIA GeForce RTX 4060,c04,64,64,64,4,3,8,0.0,123.669,68.60800087451935,74.6988822519779,15.650387860212119,3,-1,-1,64x4096x2048,0,
2026-03-03T06:15:14.072446+00:00,FULL,llm_style,eval,llm_style_eval_152,8,8192,8192,bf16,NVIDIA GeForce RTX 4060,c11,32,128,32,4,2,8,0.0,755.376,557.0880174636841,580.6489706039429,1.927418631060389,4,-1,-1,8x8192x8192,0,
2026-03-03T06:15:14.171368+00:00,FULL,llm_style,eval,llm_style_eval_153,64,8192,2048,bf16,NVIDIA GeForce RTX 4060,c10,64,128,64,8,3,8,0.0,0.0,171.00800573825836,211.29439994692794,12.55779598580255,1,-1,-1,64x8192x2048,0,
2026-03-03T06:15:14.401292+00:00,FULL,llm_style,eval,llm_style_eval_154,16,2048,8192,bf16,NVIDIA GeForce RTX 4060,c06,64,128,32,4,3,8,0.0,229.867,163.66399824619293,169.92352113127708,3.28032382046788,6,-1,-1,16x2048x8192,0,
2026-03-03T06:15:14.479581+00:00,FULL,llm_style,eval,llm_style_eval_155,4,2048,1536,bf16,NVIDIA GeForce RTX 4060,c11,32,128,32,4,2,8,0.0,78.246,45.05600035190582,57.77216024696827,0.5585454501829857,7,-1,-1,4x2048x1536,0,
2026-03-03T06:15:14.604394+00:00,FULL,llm_style,eval,llm_style_eval_156,1,4096,6144,bf16,NVIDIA GeForce RTX 4060,c11,32,128,32,4,2,8,0.0,0.0,224.30399805307388,233.81887957453728,0.22439032936047235,7,-1,-1,1x4096x6144,0,
2026-03-03T06:15:14.770501+00:00,FULL,llm_style,eval,llm_style_eval_157,1,1536,8192,bf16,NVIDIA GeForce RTX 4060,c04,64,64,64,4,3,8,0.0,166.053,86.01599931716919,106.59456200897691,0.29257143089398235,6,-1,-1,1x1536x8192,0,
2026-03-03T06:15:14.843146+00:00,FULL,llm_style,eval,llm_style_eval_158,64,1536,8192,bf16,NVIDIA GeForce RTX 4060,c04,64,64,64,4,3,8,0.0,0.0,106.20799660682678,198.6399993300438,15.16470310575912,2,-1,-1,64x1536x8192,0,
2026-03-03T06:15:14.949603+00:00,FULL,llm_style,eval,llm_style_eval_159,16,6144,1536,bf16,NVIDIA GeForce RTX 4060,c11,32,128,32,4,2,8,0.0,106.411,47.10400104522705,52.84831985831261,6.411130292521085,5,-1,-1,16x6144x1536,0,
2026-03-03T06:15:15.135457+00:00,FULL,llm_style,eval,llm_style_eval_160,32,6144,6144,bf16,NVIDIA GeForce RTX 4060,c11,32,128,32,4,2,8,0.0,0.0,329.5360058546066,353.8636916875839,7.331275068818789,1,-1,-1,32x6144x6144,0,
2026-03-03T06:15:15.229697+00:00,FULL,llm_style,eval,llm_style_eval_161,2,1536,4096,bf16,NVIDIA GeForce RTX 4060,c00,32,32,32,2,2,8,0.0,94.188,53.75999957323074,143.46239641308782,0.46811428943037175,7,-1,-1,2x1536x4096,0,
2026-03-03T06:15:15.321908+00:00,FULL,llm_style,eval,llm_style_eval_162,64,1536,3072,bf16,NVIDIA GeForce RTX 4060,c04,64,64,64,4,3,8,0.0,92.168,51.19999870657921,61.48096028715371,11.796480298004159,3,-1,-1,64x1536x3072,0,
2026-03-03T06:15:15.360737+00:00,FULL,llm_style,eval,llm_style_eval_163,64,1024,8192,bf16,NVIDIA GeForce RTX 4060,c04,64,64,64,4,3,8,0.0,0.0,82.94399827718735,159.16064113378525,12.945382984935252,2,-1,-1,64x1024x8192,0,
2026-03-03T06:15:15.533862+00:00,FULL,llm_style,eval,llm_style_eval_164,64,4096,8192,bf16,NVIDIA GeForce RTX 4060,c03,64,64,32,4,2,8,0.0,0.0,303.056001663208,319.4678395986557,14.17219019728598,2,-1,-1,64x4096x8192,0,
2026-03-03T06:15:15.843620+00:00,FULL,llm_style,eval,llm_style_eval_165,4,8192,3072,bf16,NVIDIA GeForce RTX 4060,c11,32,128,32,4,2,8,0.0,309.708,226.31999850273132,240.13824298977852,0.8895660716327298,5,-1,-1,4x8192x3072,0,
2026-03-03T06:15:15.891016+00:00,FULL,llm_style,eval,llm_style_eval_166,64,1024,6144,bf16,NVIDIA GeForce RTX 4060,c04,64,64,64,4,3,8,0.0,0.0,72.7040022611618,209.5660868287086,11.076506697763895,3,-1,-1,64x1024x6144,0,
2026-03-03T06:15:15.907038+00:00,FULL,llm_style,eval,llm_style_eval_167,2,2048,1024,bf16,NVIDIA GeForce RTX 4060,c11,32,128,32,4,2,8,0.0,0.0,73.80800321698189,331.61793231964106,0.1136544498479256,7,-1,-1,2x2048x1024,0,
2026-03-03T06:15:15.984061+00:00,FULL,llm_style,eval,llm_style_eval_168,64,4096,1024,bf16,NVIDIA GeForce RTX 4060,c11,32,128,32,4,2,8,0.0,76.983,50.175998359918594,53.590080104768276,10.699755451779136,3,-1,-1,64x4096x1024,0,
2026-03-03T06:15:16.022697+00:00,FULL,llm_style,eval,llm_style_eval_169,4,1536,6144,bf16,NVIDIA GeForce RTX 4060,c04,64,64,64,4,3,8,0.0,0.0,72.64000177383423,198.61568644642827,1.0393374195537957,7,-1,-1,4x1536x6144,0,
2026-03-03T06:15:16.037479+00:00,FULL,llm_style,eval,llm_style_eval_170,16,1536,1536,bf16,NVIDIA GeForce RTX 4060,c04,64,64,64,4,3,8,0.0,0.0,43.98399963974953,121.49343982338891,1.7164758234440076,7,-1,-1,16x1536x1536,0,
2026-03-03T06:15:16.129397+00:00,FULL,llm_style,eval,llm_style_eval_171,1,2048,3072,bf16,NVIDIA GeForce RTX 4060,c00,32,32,32,2,2,8,0.0,91.874,51.19999870657921,60.46496029943228,0.24576000620841995,7,-1,-1,1x2048x3072,0,
2026-03-03T06:15:16.225119+00:00,FULL,llm_style,eval,llm_style_eval_172,64,3072,2048,bf16,NVIDIA GeForce RTX 4060,c10,64,128,64,8,3,8,0.0,95.678,55.296000093221664,118.65248166024685,14.563555531003347,3,-1,-1,64x3072x2048,0,
2026-03-03T06:15:16.484540+00:00,FULL,llm_style,eval,llm_style_eval_173,64,8192,6144,bf16,NVIDIA GeForce RTX 4060,c00,32,32,32,2,2,8,0.0,0.0,442.8800046443939,575.0271970033646,14.546718922595979,1,-1,-1,64x8192x6144,0,
2026-03-03T06:15:16.697312+00:00,FULL,llm_style,eval,llm_style_eval_174,2,4096,4096,bf16,NVIDIA GeForce RTX 4060,c11,32,128,32,4,2,8,0.0,212.722,160.0639969110489,174.64319571852684,0.41926270301305724,7,-1,-1,2x4096x4096,0,
2026-03-03T06:15:16.745057+00:00,FULL,llm_style,eval,llm_style_eval_175,64,4096,2048,bf16,NVIDIA GeForce RTX 4060,c04,64,64,64,4,3,8,0.0,0.0,98.30400347709656,169.7382450103758,10.92266628032262,3,-1,-1,64x4096x2048,0,
2026-03-03T06:15:16.813599+00:00,FULL,llm_style,eval,llm_style_eval_176,16,6144,2048,bf16,NVIDIA GeForce RTX 4060,c00,32,32,32,2,2,8,0.0,0.0,69.63200122117996,125.15327751636501,5.782588133881251,5,-1,-1,16x6144x2048,0,
2026-03-03T06:15:16.863456+00:00,FULL,llm_style,eval,llm_style_eval_177,1,6144,1536,bf16,NVIDIA GeForce RTX 4060,c11,32,128,32,4,2,8,0.0,0.0,75.60000196099281,148.1583979725837,0.2496609459049825,5,-1,-1,1x6144x1536,0,
2026-03-03T06:15:17.108499+00:00,FULL,llm_style,eval,llm_style_eval_178,32,6144,8192,bf16,NVIDIA GeForce RTX 4060,c11,32,128,32,4,2,8,0.0,0.0,431.61600828170776,569.4156903028487,7.463174234023234,0,-1,-1,32x6144x8192,0,
2026-03-03T06:15:17.238705+00:00,FULL,llm_style,eval,llm_style_eval_179,64,4096,6144,bf16,NVIDIA GeForce RTX 4060,c06,64,128,32,4,3,8,0.0,0.0,237.98400163650513,265.7996767759323,13.535470661259298,3,-1,-1,64x4096x6144,0,
2026-03-03T06:15:17.254893+00:00,FULL,llm_style,eval,llm_style_eval_180,64,2048,1536,bf16,NVIDIA GeForce RTX 4060,c11,32,128,32,4,2,8,0.0,0.0,44.84800063073635,123.93760010600087,8.978174686432814,3,-1,-1,64x2048x1536,0,
2026-03-03T06:15:17.279657+00:00,FULL,llm_style,eval,llm_style_eval_181,64,2048,3072,bf16,NVIDIA GeForce RTX 4060,c03,64,64,32,4,2,8,0.0,0.0,68.60800087451935,124.1030362993477,11.73779089515909,3,-1,-1,64x2048x3072,0,
2026-03-03T06:15:17.351447+00:00,FULL,llm_style,eval,llm_style_eval_182,32,3072,1536,bf16,NVIDIA GeForce RTX 4060,c02,32,64,32,2,2,8,0.0,71.736,45.00799998641014,59.914241656661034,6.709693567614286,3,-1,-1,32x3072x1536,0,
2026-03-03T06:15:17.439082+00:00,FULL,llm_style,eval,llm_style_eval_183,8,8192,2048,bf16,NVIDIA GeForce RTX 4060,c10,64,128,64,8,3,8,0.0,0.0,164.17599469423294,229.39647570252419,1.6350469293634766,5,-1,-1,8x8192x2048,0,
2026-03-03T06:15:17.475479+00:00,FULL,llm_style,eval,llm_style_eval_184,64,8192,1024,bf16,NVIDIA GeForce RTX 4060,c06,64,128,32,4,3,8,0.0,0.0,61.823999509215355,83.46015810966492,17.367718564373217,1,-1,-1,64x8192x1024,0,
2026-03-03T06:15:17.542987+00:00,FULL,llm_style,eval,llm_style_eval_185,1,8192,1536,bf16,NVIDIA GeForce RTX 4060,c11,32,128,32,4,2,8,0.0,0.0,68.94399970769882,254.542717039585,0.36501833526768523,5,-1,-1,1x8192x1536,0,
2026-03-03T06:15:17.571572+00:00,FULL,llm_style,eval,llm_style_eval_186,16,6144,1024,bf16,NVIDIA GeForce RTX 4060,c11,32,128,32,4,2,8,0.0,0.0,43.007999658584595,206.75967931747408,4.681142894303718,5,-1,-1,16x6144x1024,0,
2026-03-03T06:15:17.598800+00:00,FULL,llm_style,eval,llm_style_eval_187,1,1024,6144,bf16,NVIDIA GeForce RTX 4060,c04,64,64,64,4,3,8,0.0,0.0,72.08000123500824,127.66656145453447,0.1745686984518066,7,-1,-1,1x1024x6144,0,
2026-03-03T06:15:17.982872+00:00,FULL,llm_style,eval,llm_style_eval_188,8,8192,4096,bf16,NVIDIA GeForce RTX 4060,c11,32,128,32,4,2,8,0.0,384.023,293.93599927425385,325.73470622301096,1.8264891450028833,5,-1,-1,8x8192x4096,0,
2026-03-03T06:15:18.212302+00:00,FULL,llm_style,eval,llm_style_eval_189,8,2048,8192,bf16,NVIDIA GeForce RTX 4060,c04,64,64,64,4,3,8,0.0,229.381,162.81600296497345,175.12447968125343,1.6487043724918637,6,-1,-1,8x2048x8192,0,
2026-03-03T06:15:18.430547+00:00,FULL,llm_style,eval,llm_style_eval_190,4,8192,2048,bf16,NVIDIA GeForce RTX 4060,c11,32,128,32,4,2,8,0.0,218.205,160.76800227165222,345.3235283493992,0.8348534913882316,5,-1,-1,4x8192x2048,0,
2026-03-03T06:15:18.781000+00:00,FULL,llm_style,eval,llm_style_eval_191,4,8192,8192,bf16,NVIDIA GeForce RTX 4060,c02,32,64,32,2,2,8,0.0,0.0,561.0399842262268,576.5324592590332,0.956920945198656,4,-1,-1,4x8192x8192,0,
2026-03-03T06:15:18.792639+00:00,FULL,llm_style,eval,llm_style_eval_192,64,1536,1024,bf16,NVIDIA GeForce RTX 4060,c00,32,32,32,2,2,8,0.0,0.0,43.91999915242195,274.6534387767313,4.583938886276092,3,-1,-1,64x1536x1024,0,
2026-03-03T06:15:18.811359+00:00,FULL,llm_style,eval,llm_style_eval_193,32,2048,2048,bf16,NVIDIA GeForce RTX 4060,c00,32,32,32,2,2,8,0.0,0.0,51.96800082921982,58.95167943090199,5.165398932357389,3,-1,-1,32x2048x2048,0,
2026-03-03T06:15:18.823149+00:00,FULL,llm_style,eval,llm_style_eval_194,8,1024,2048,bf16,NVIDIA GeForce RTX 4060,c04,64,64,64,4,3,8,0.0,0.0,41.05599969625473,136.3292847573757,0.8172844955243156,7,-1,-1,8x1024x2048,0,
2026-03-03T06:15:18.858903+00:00,FULL,llm_style,eval,llm_style_eval_195,2,4096,2048,bf16,NVIDIA GeForce RTX 4060,c11,32,128,32,4,2,8,0.0,0.0,56.624000892043114,137.20575779676426,0.5925832062621899,7,-1,-1,2x4096x2048,0,
2026-03-03T06:15:18.904685+00:00,FULL,llm_style,eval,llm_style_eval_196,32,2048,4096,bf16,NVIDIA GeForce RTX 4060,c00,32,32,32,2,2,8,0.0,0.0,63.48799914121628,96.63296252489081,8.456258178901475,3,-1,-1,32x2048x4096,0,
2026-03-03T06:15:19.044014+00:00,FULL,llm_style,eval,llm_style_eval_197,32,8192,1536,bf16,NVIDIA GeForce RTX 4060,c02,32,64,32,2,2,8,0.0,139.277,71.68000191450119,79.93344090878963,11.234742557074105,1,-1,-1,32x8192x1536,0,
2026-03-03T06:15:19.216190+00:00,FULL,llm_style,eval,llm_style_eval_198,64,4096,8192,bf16,NVIDIA GeForce RTX 4060,c03,64,64,32,4,2,8,0.0,0.0,299.00801181793213,365.90592801570875,14.364054226798554,2,-1,-1,64x4096x8192,0,
2026-03-03T06:15:19.599004+00:00,FULL,llm_style,eval,llm_style_eval_199,2,8192,4096,bf16,NVIDIA GeForce RTX 4060,c11,32,128,32,4,2,8,0.0,382.762,292.83198714256287,354.9900844693184,0.45834380768880006,5,-1,-1,2x8192x4096,0,
2026-03-03T06:15:19.679448+00:00,FULL,llm_style,eval,llm_style_eval_200,1,4096,1024,bf16,NVIDIA GeForce RTX 4060,c11,32,128,32,4,2,8,0.0,80.403,41.98399931192398,48.22079975157975,0.19980488132338384,7,-1,-1,1x4096x1024,0,
2026-03-03T06:15:19.854311+00:00,FULL,llm_style,eval,llm_style_eval_201,4,1536,8192,bf16,NVIDIA GeForce RTX 4060,c04,64,64,64,4,3,8,0.0,174.82,87.95199915766716,178.1868830323218,1.1445253884399595,6,-1,-1,4x1536x8192,0,
2026-03-03T06:15:20.086707+00:00,FULL,llm_style,eval,llm_style_eval_202,1,6144,3072,bf16,NVIDIA GeForce RTX 4060,c11,32,128,32,4,2,8,0.0,232.354,176.12800002098083,224.37888130545616,0.2143255813698178,5,-1,-1,1x6144x3072,0,
2026-03-03T06:15:20.256294+00:00,FULL,llm_style,eval,llm_style_eval_203,16,2048,6144,bf16,NVIDIA GeForce RTX 4060,c00,32,32,32,2,2,8,0.0,169.543,101.83999687433243,181.0508768260478,3.9537823680106965,7,-1,-1,16x2048x6144,0,
2026-03-03T06:15:20.274737+00:00,FULL,llm_style,eval,llm_style_eval_204,16,1536,1024,bf16,NVIDIA GeForce RTX 4060,c04,64,64,64,4,3,8,0.0,0.0,40.81600159406662,1162.0278012752492,1.233135192921902,7,-1,-1,16x1536x1024,0,
2026-03-03T06:15:20.339469+00:00,FULL,llm_style,eval,llm_style_eval_205,64,6144,2048,bf16,NVIDIA GeForce RTX 4060,c06,64,128,32,4,3,8,0.0,0.0,82.91199803352356,139.53024238348002,19.425568967096726,1,-1,-1,64x6144x2048,0,
2026-03-03T06:15:20.402850+00:00,FULL,llm_style,eval,llm_style_eval_206,4,2048,6144,bf16,NVIDIA GeForce RTX 4060,c00,32,32,32,2,2,8,0.0,0.0,93.18400174379349,170.54368451237676,1.0802637160482826,7,-1,-1,4x2048x6144,0,
2026-03-03T06:15:20.520078+00:00,FULL,llm_style,eval,llm_style_eval_207,32,6144,1536,bf16,NVIDIA GeForce RTX 4060,c11,32,128,32,4,2,8,0.0,117.175,50.00000074505806,55.8796802908182,12.079595340000004,1,-1,-1,32x6144x1536,0,
2026-03-03T06:15:20.582006+00:00,FULL,llm_style,eval,llm_style_eval_208,4,2048,1024,bf16,NVIDIA GeForce RTX 4060,c00,32,32,32,2,2,8,0.0,61.887,39.47199881076813,143.81024077534667,0.425040953219301,7,-1,-1,4x2048x1024,0,
2026-03-03T06:15:20.642101+00:00,FULL,llm_style,eval,llm_style_eval_209,1,1024,1536,bf16,NVIDIA GeForce RTX 4060,c04,64,64,64,4,3,8,0.0,60.054,39.93599861860275,44.558400064706795,0.07876923349388026,7,-1,-1,1x1024x1536,0,
2026-03-03T06:15:20.942090+00:00,FULL,llm_style,eval,llm_style_eval_210,8,6144,4096,bf16,NVIDIA GeForce RTX 4060,c11,32,128,32,4,2,8,0.0,299.952,228.35199534893036,282.2096006572245,1.7633004843453675,5,-1,-1,8x6144x4096,0,
2026-03-03T06:15:21.164965+00:00,FULL,llm_style,eval,llm_style_eval_211,4,2048,8192,bf16,NVIDIA GeForce RTX 4060,c04,64,64,64,4,3,8,0.0,222.832,161.69600188732147,173.9619216322899,0.8300621316136819,6,-1,-1,4x2048x8192,0,
2026-03-03T06:15:21.222231+00:00,FULL,llm_style,eval,llm_style_eval_212,32,1024,1024,bf16,NVIDIA GeForce RTX 4060,c04,64,64,64,4,3,8,0.0,57.221,38.91199827194214,45.619200542569146,1.7246316555371939,3,-1,-1,32x1024x1024,0,
2026-03-03T06:15:21.367188+00:00,FULL,llm_style,eval,llm_style_eval_213,16,3072,4096,bf16,NVIDIA GeForce RTX 4060,c06,64,128,32,4,3,8,0.0,144.916,79.64800298213959,88.03615920245645,5.055408408548443,7,-1,-1,16x3072x4096,0,
2026-03-03T06:15:21.419366+00:00,FULL,llm_style,eval,llm_style_eval_214,64,1024,8192,bf16,NVIDIA GeForce RTX 4060,c04,64,64,64,4,3,8,0.0,0.0,87.93599903583527,129.6899184584617,12.2104921280582,2,-1,-1,64x1024x8192,0,
2026-03-03T06:15:21.447987+00:00,FULL,llm_style,eval,llm_style_eval_215,4,4096,1536,bf16,NVIDIA GeForce RTX 4060,c00,32,32,32,2,2,8,0.0,0.0,50.83199962973595,176.31487518548948,0.9901567588648774,7,-1,-1,4x4096x1536,0,
2026-03-03T06:15:21.532103+00:00,FULL,llm_style,eval,llm_style_eval_216,16,1536,3072,bf16,NVIDIA GeForce RTX 4060,c04,64,64,64,4,3,8,0.0,84.065,50.84799975156784,146.96672469377518,2.9695355714625578,7,-1,-1,16x1536x3072,0,
2026-03-03T06:15:21.592267+00:00,FULL,llm_style,eval,llm_style_eval_217,8,6144,2048,bf16,NVIDIA GeForce RTX 4060,c11,32,128,32,4,2,8,0.0,0.0,68.60800087451935,84.4118382036686,2.9344477237897726,5,-1,-1,8x6144x2048,0,
2026-03-03T06:15:21.732171+00:00,FULL,llm_style,eval,llm_style_eval_218,8,3072,4096,bf16,NVIDIA GeForce RTX 4060,c00,32,32,32,2,2,8,0.0,139.853,78.84799689054489,87.10143968462944,2.5533507500447636,7,-1,-1,8x3072x4096,0,
2026-03-03T06:15:22.044210+00:00,FULL,llm_style,eval,llm_style_eval_219,64,8192,3072,bf16,NVIDIA GeForce RTX 4060,c10,64,128,64,8,3,8,0.0,311.997,235.34400016069412,292.8579220175742,13.68730653766627,1,-1,-1,64x8192x3072,0,
2026-03-03T06:15:22.083611+00:00,FULL,llm_style,eval,llm_style_eval_220,2,4096,2048,bf16,NVIDIA GeForce RTX 4060,c11,32,128,32,4,2,8,0.0,0.0,58.73600021004677,168.42431783676142,0.571275399754928,7,-1,-1,2x4096x2048,0,
2026-03-03T06:15:22.232681+00:00,FULL,llm_style,eval,llm_style_eval_221,4,1024,8192,bf16,NVIDIA GeForce RTX 4060,c04,64,64,64,4,3,8,0.0,149.018,83.96799862384796,128.62655878067005,0.7992195252935353,6,-1,-1,4x1024x8192,0,
2026-03-03T06:15:22.299311+00:00,FULL,llm_style,eval,llm_style_eval_222,64,6144,2048,bf16,NVIDIA GeForce RTX 4060,c06,64,128,32,4,3,8,0.0,0.0,103.42399775981903,186.4601597189902,15.572911228400946,1,-1,-1,64x6144x2048,0,
2026-03-03T06:15:22.372600+00:00,FULL,llm_style,eval,llm_style_eval_223,4,2048,2048,bf16,NVIDIA GeForce RTX 4060,c02,32,64,32,2,2,8,0.0,73.239,52.112000063061714,69.56191994249818,0.6438906961812088,7,-1,-1,4x2048x2048,0,
2026-03-03T06:15:22.394739+00:00,FULL,llm_style,eval,llm_style_eval_224,16,3072,1536,bf16,NVIDIA GeForce RTX 4060,c00,32,32,32,2,2,8,0.0,0.0,72.7040022611618,173.20416137576098,2.07684500583073,7,-1,-1,16x3072x1536,0,
2026-03-03T06:15:22.414666+00:00,FULL,llm_style,eval,llm_style_eval_225,1,2048,2048,bf16,NVIDIA GeForce RTX 4060,c00,32,32,32,2,2,8,0.0,0.0,68.27199831604958,162.81023457646367,0.12287040378057869,7,-1,-1,1x2048x2048,0,
2026-03-03T06:15:22.426758+00:00,FULL,llm_style,eval,llm_style_eval_226,8,1536,1024,bf16,NVIDIA GeForce RTX 4060,c00,32,32,32,2,2,8,0.0,0.0,63.80799785256386,139.468802511692,0.39439921086614715,7,-1,-1,8x1536x1024,0,
2026-03-03T06:15:22.623418+00:00,FULL,llm_style,eval,llm_style_eval_227,64,6144,6144,bf16,NVIDIA GeForce RTX 4060,c10,64,128,64,8,3,8,0.0,0.0,337.20000088214874,486.08481884002674,14.329294766783601,1,-1,-1,64x6144x6144,0,
2026-03-03T06:15:22.684925+00:00,FULL,llm_style,eval,llm_style_eval_228,64,6144,2048,bf16,NVIDIA GeForce RTX 4060,c06,64,128,32,4,3,8,0.0,0.0,81.77599683403969,94.07200075685978,19.69542161948399,1,-1,-1,64x6144x2048,0,
2026-03-03T06:15:22.870397+00:00,FULL,llm_style,eval,llm_style_eval_229,16,1536,8192,bf16,NVIDIA GeForce RTX 4060,c04,64,64,64,4,3,8,0.0,185.422,89.07200023531914,170.81344187259668,4.520536003864642,6,-1,-1,16x1536x8192,0,
2026-03-03T06:15:22.891132+00:00,FULL,llm_style,eval,llm_style_eval_230,64,2048,1536,bf16,NVIDIA GeForce RTX 4060,c11,32,128,32,4,2,8,0.0,0.0,61.83999963104725,184.3814353644848,6.511209353207125,3,-1,-1,64x2048x1536,0,
2026-03-03T06:15:22.939354+00:00,FULL,llm_style,eval,llm_style_eval_231,4,1024,8192,bf16,NVIDIA GeForce RTX 4060,c04,64,64,64,4,3,8,0.0,0.0,92.49600023031235,170.00864163041115,0.7255326050088748,6,-1,-1,4x1024x8192,0,
2026-03-03T06:15:22.959219+00:00,FULL,llm_style,eval,llm_style_eval_232,16,3072,1536,bf16,NVIDIA GeForce RTX 4060,c00,32,32,32,2,2,8,0.0,0.0,40.94399884343147,107.24352270364757,3.6878406668923516,7,-1,-1,16x3072x1536,0,
2026-03-03T06:15:23.008341+00:00,FULL,llm_style,eval,llm_style_eval_233,64,3072,3072,bf16,NVIDIA GeForce RTX 4060,c03,64,64,32,4,2,8,0.0,0.0,62.463998794555664,113.56448262929912,19.338492176477267,3,-1,-1,64x3072x3072,0,
2026-03-03T06:15:23.180303+00:00,FULL,llm_style,eval,llm_style_eval_234,32,8192,4096,bf16,NVIDIA GeForce RTX 4060,c11,32,128,32,4,2,8,0.0,0.0,294.8320060968399,380.90431958436955,7.28375347178095,1,-1,-1,32x8192x4096,0,
2026-03-03T06:15:23.194288+00:00,FULL,llm_style,eval,llm_style_eval_235,4,2048,1024,bf16,NVIDIA GeForce RTX 4060,c00,32,32,32,2,2,8,0.0,0.0,61.823999509215355,155.18719658255577,0.2713706025683315,7,-1,-1,4x2048x1024,0,
2026-03-03T06:15:23.315976+00:00,FULL,llm_style,eval,llm_style_eval_236,4,8192,3072,bf16,NVIDIA GeForce RTX 4060,c11,32,128,32,4,2,8,0.0,0.0,228.35199534893036,318.33568334579456,0.8816502421726837,5,-1,-1,4x8192x3072,0,
2026-03-03T06:15:23.337482+00:00,FULL,llm_style,eval,llm_style_eval_237,64,1024,4096,bf16,NVIDIA GeForce RTX 4060,c04,64,64,64,4,3,8,0.0,0.0,86.01599931716919,167.30112433433527,6.241523859071624,3,-1,-1,64x1024x4096,0,
2026-03-03T06:15:23.511617+00:00,FULL,llm_style,eval,llm_style_eval_238,32,2048,6144,bf16,NVIDIA GeForce RTX 4060,c06,64,128,32,4,3,8,0.0,174.087,103.42399775981903,120.97536370158193,7.786455614200473,3,-1,-1,32x2048x6144,0,
2026-03-03T06:15:23.519272+00:00,FULL,llm_style,eval,llm_style_eval_239,32,2048,6144,bf16,NVIDIA GeForce RTX 4060,c06,64,128,32,4,3,8,0.0,0.0,105.47199845314026,158.34592118859288,7.635262247901621,3,-1,-1,32x2048x6144,0,
2026-03-03T06:15:23.664230+00:00,FULL,llm_style,eval,llm_style_eval_240,8,8192,1536,bf16,NVIDIA GeForce RTX 4060,c00,32,32,32,2,2,8,0.0,144.92,53.039997816085815,129.97216306626788,3.795750382533807,5,-1,-1,8x8192x1536,0,
2026-03-03T06:15:23.677644+00:00,FULL,llm_style,eval,llm_style_eval_241,16,1536,1536,bf16,NVIDIA GeForce RTX 4060,c04,64,64,64,4,3,8,0.0,0.0,63.48799914121628,200.92512100934968,1.18916130640802,7,-1,-1,16x1536x1536,0,
2026-03-03T06:15:23.703224+00:00,FULL,llm_style,eval,llm_style_eval_242,1,2048,3072,bf16,NVIDIA GeForce RTX 4060,c00,32,32,32,2,2,8,0.0,0.0,75.53600147366524,122.07391567528242,0.16658165317880755,7,-1,-1,1x2048x3072,0,
2026-03-03T06:15:23.742475+00:00,FULL,llm_style,eval,llm_style_eval_243,8,1536,6144,bf16,NVIDIA GeForce RTX 4060,c04,64,64,64,4,3,8,0.0,0.0,72.59200140833855,137.1222372353077,2.0800493314771096,7,-1,-1,8x1536x6144,0,
2026-03-03T06:15:23.783098+00:00,FULL,llm_style,eval,llm_style_eval_244,32,8192,1024,bf16,NVIDIA GeForce RTX 4060,c11,32,128,32,4,2,8,0.0,0.0,48.00000041723251,155.5967967212199,11.184810569444446,1,-1,-1,32x8192x1024,0,
2026-03-03T06:15:23.917906+00:00,FULL,llm_style,eval,llm_style_eval_245,4,6144,4096,bf16,NVIDIA GeForce RTX 4060,c03,64,64,32,4,2,8,0.0,0.0,229.37600314617157,290.7833608984947,0.877714273675364,5,-1,-1,4x6144x4096,0,
2026-03-03T06:15:23.984627+00:00,FULL,llm_style,eval,llm_style_eval_246,32,2048,6144,bf16,NVIDIA GeForce RTX 4060,c06,64,128,32,4,3,8,0.0,0.0,107.51999914646149,213.69856148958203,7.489828630885948,3,-1,-1,32x2048x6144,0,
2026-03-03T06:15:24.052650+00:00,FULL,llm_style,eval,llm_style_eval_247,64,6144,2048,bf16,NVIDIA GeForce RTX 4060,c06,64,128,32,4,3,8,0.0,0.0,84.84799787402153,220.19072353839863,18.982330477513035,1,-1,-1,64x6144x2048,0,
2026-03-03T06:15:24.064682+00:00,FULL,llm_style,eval,llm_style_eval_248,64,1024,1024,bf16,NVIDIA GeForce RTX 4060,c04,64,64,64,4,3,8,0.0,0.0,43.007999658584595,95.97343854606146,3.120761929535812,3,-1,-1,64x1024x1024,0,
2026-03-03T06:15:24.174565+00:00,FULL,llm_style,eval,llm_style_eval_249,2,8192,1024,bf16,NVIDIA GeForce RTX 4060,c11,32,128,32,4,2,8,0.0,109.838,50.175998359918594,135.85407748818395,0.668734715736196,5,-1,-1,2x8192x1024,0,
2026-03-03T06:15:24.238209+00:00,FULL,llm_style,eval,llm_style_eval_250,64,3072,3072,bf16,NVIDIA GeForce RTX 4060,c03,64,64,32,4,2,8,0.0,0.0,65.48799946904182,142.97983944416043,18.445510044493563,3,-1,-1,64x3072x3072,0,
2026-03-03T06:15:24.287658+00:00,FULL,llm_style,eval,llm_style_eval_251,64,1024,8192,bf16,NVIDIA GeForce RTX 4060,c04,64,64,64,4,3,8,0.0,0.0,91.48800000548363,131.1600036919117,11.736422524655056,2,-1,-1,64x1024x8192,0,
2026-03-03T06:15:24.353501+00:00,FULL,llm_style,eval,llm_style_eval_252,64,4096,3072,bf16,NVIDIA GeForce RTX 4060,c04,64,64,64,4,3,8,0.0,0.0,87.0399996638298,112.2611207515001,18.504282424409332,3,-1,-1,64x4096x3072,0,
2026-03-03T06:15:24.485551+00:00,FULL,llm_style,eval,llm_style_eval_253,8,6144,4096,bf16,NVIDIA GeForce RTX 4060,c11,32,128,32,4,2,8,0.0,0.0,227.29599475860596,363.8476765155791,1.7714926496070809,5,-1,-1,8x6144x4096,0,
2026-03-03T06:15:24.563260+00:00,FULL,llm_style,eval,llm_style_eval_254,4,1536,3072,bf16,NVIDIA GeForce RTX 4060,c04,64,64,64,4,3,8,0.0,77.659,49.15200173854828,56.84224061667919,0.7679999728351841,7,-1,-1,4x1536x3072,0,
2026-03-03T06:15:24.588862+00:00,FULL,llm_style,eval,llm_style_eval_255,1,3072,1536,bf16,NVIDIA GeForce RTX 4060,c00,32,32,32,2,2,8,0.0,0.0,45.05600035190582,85.54911881685256,0.20945454381861964,7,-1,-1,1x3072x1536,0,
2026-03-03T06:15:25.032098+00:00,BUCKET,llm_style,tune,llm_style_tune_000,64,6144,6144,bf16,NVIDIA GeForce RTX 4060,c06,64,128,32,4,3,8,0.0,440.676,330.7519853115082,363.0387273430824,14.608644611609172,1,-1,-1,llm8_g1,0,
2026-03-03T06:15:25.104269+00:00,BUCKET,llm_style,tune,llm_style_tune_001,64,8192,1536,bf16,NVIDIA GeForce RTX 4060,c06,64,128,32,4,3,8,0.0,0.0,96.27200290560722,192.9532767832279,16.729814352976263,1,-1,-1,llm8_g1,0,
2026-03-03T06:15:25.398479+00:00,BUCKET,llm_style,tune,llm_style_tune_002,32,3072,8192,bf16,NVIDIA GeForce RTX 4060,c10,64,128,64,8,3,8,0.0,294.156,228.46399992704391,246.1884805560112,7.049744101978087,2,-1,-1,llm8_g2,0,
2026-03-03T06:15:25.632528+00:00,BUCKET,llm_style,tune,llm_style_tune_003,4,6144,3072,bf16,NVIDIA GeForce RTX 4060,c11,32,128,32,4,2,8,0.0,234.008,177.12000012397766,256.59391731023777,0.8525008124114101,5,-1,-1,llm8_g5,0,
2026-03-03T06:15:25.682560+00:00,BUCKET,llm_style,tune,llm_style_tune_004,8,8192,1024,bf16,NVIDIA GeForce RTX 4060,c11,32,128,32,4,2,8,0.0,0.0,54.70399931073189,82.626561820507,2.453526793125508,5,-1,-1,llm8_g5,0,
2026-03-03T06:15:25.809842+00:00,BUCKET,llm_style,tune,llm_style_tune_005,32,8192,3072,bf16,NVIDIA GeForce RTX 4060,c06,64,128,32,4,3,8,0.0,0.0,236.54399812221527,296.8550354242325,6.808935118987225,1,-1,-1,llm8_g1,0,
2026-03-03T06:15:26.378044+00:00,BUCKET,llm_style,tune,llm_style_tune_006,32,6144,8192,bf16,NVIDIA GeForce RTX 4060,c11,32,128,32,4,2,8,0.0,568.148,425.9839951992035,481.8534392118453,7.561846239067394,0,-1,-1,llm8_g0,0,
2026-03-03T06:15:26.446267+00:00,BUCKET,llm_style,tune,llm_style_tune_007,8,1536,2048,bf16,NVIDIA GeForce RTX 4060,c04,64,64,64,4,3,8,0.0,68.182,42.89599880576134,67.60448053479195,1.1733413232294287,7,-1,-1,llm8_g7,0,
2026-03-03T06:15:26.471243+00:00,BUCKET,llm_style,tune,llm_style_tune_008,16,1536,4096,bf16,NVIDIA GeForce RTX 4060,c04,64,64,64,4,3,8,0.0,0.0,53.29599976539612,158.86336147785184,3.777517879132024,7,-1,-1,llm8_g7,0,
2026-03-03T06:15:26.543916+00:00,BUCKET,llm_style,tune,llm_style_tune_009,64,1536,2048,bf16,NVIDIA GeForce RTX 4060,c04,64,64,64,4,3,8,0.0,72.622,43.71200129389763,80.7747197896241,9.211501923528083,3,-1,-1,llm8_g3,0,
2026-03-03T06:15:26.565663+00:00,BUCKET,llm_style,tune,llm_style_tune_010,2,2048,1024,bf16,NVIDIA GeForce RTX 4060,c04,64,64,64,4,3,8,0.0,0.0,73.82399961352348,397.09473788738154,0.11362982287488159,7,-1,-1,llm8_g7,0,
2026-03-03T06:15:26.859295+00:00,BUCKET,llm_style,tune,llm_style_tune_011,2,3072,8192,bf16,NVIDIA GeForce RTX 4060,c06,64,128,32,4,3,8,0.0,293.588,227.2159978747368,262.4172857403754,0.4430290866028511,6,-1,-1,llm8_g6,0,
2026-03-03T06:15:26.884850+00:00,BUCKET,llm_style,tune,llm_style_tune_012,64,2048,1536,bf16,NVIDIA GeForce RTX 4060,c04,64,64,64,4,3,8,0.0,0.0,56.09599873423576,133.43168340623373,7.177930566984593,3,-1,-1,llm8_g3,0,
2026-03-03T06:15:27.048726+00:00,BUCKET,llm_style,tune,llm_style_tune_013,16,8192,4096,bf16,NVIDIA GeForce RTX 4060,c11,32,128,32,4,2,8,0.0,0.0,294.67199742794037,388.13088804483414,3.643854296886744,5,-1,-1,llm8_g5,0,
2026-03-03T06:15:27.212020+00:00,BUCKET,llm_style,tune,llm_style_tune_014,4,8192,4096,bf16,NVIDIA GeForce RTX 4060,c11,32,128,32,4,2,8,0.0,0.0,292.84799098968506,305.16160637140274,0.9166375193246761,5,-1,-1,llm8_g5,0,
2026-03-03T06:15:27.240339+00:00,BUCKET,llm_style,tune,llm_style_tune_015,4,3072,2048,bf16,NVIDIA GeForce RTX 4060,c04,64,64,64,4,3,8,0.0,0.0,51.56799964606762,109.88831900060168,0.9760248282936471,7,-1,-1,llm8_g7,0,
2026-03-03T06:15:27.252242+00:00,BUCKET,llm_style,tune,llm_style_tune_016,16,1536,1024,bf16,NVIDIA GeForce RTX 4060,c04,64,64,64,4,3,8,0.0,0.0,41.98399931192398,118.70431810617445,1.198829287940303,7,-1,-1,llm8_g7,0,
2026-03-03T06:15:27.265290+00:00,BUCKET,llm_style,tune,llm_style_tune_017,32,1024,2048,bf16,NVIDIA GeForce RTX 4060,c04,64,64,64,4,3,8,0.0,0.0,44.91199925541878,175.3497596085071,2.9884603274214343,3,-1,-1,llm8_g3,0,
2026-03-03T06:15:27.281033+00:00,BUCKET,llm_style,tune,llm_style_tune_018,64,1536,2048,bf16,NVIDIA GeForce RTX 4060,c04,64,64,64,4,3,8,0.0,0.0,50.175998359918594,146.48096159100533,8.024816588834353,3,-1,-1,llm8_g3,0,
2026-03-03T06:15:27.308694+00:00,BUCKET,llm_style,tune,llm_style_tune_019,4,4096,1536,bf16,NVIDIA GeForce RTX 4060,c04,64,64,64,4,3,8,0.0,0.0,64.495999366045,204.43136185407627,0.7803840314861132,7,-1,-1,llm8_g7,0,
2026-03-03T06:15:27.373627+00:00,BUCKET,llm_style,tune,llm_style_tune_020,1,8192,1536,bf16,NVIDIA GeForce RTX 4060,c11,32,128,32,4,2,8,0.0,0.0,67.43999943137169,179.26560238003722,0.37315872200754174,5,-1,-1,llm8_g5,0,
2026-03-03T06:15:27.408375+00:00,BUCKET,llm_style,tune,llm_style_tune_021,64,1536,4096,bf16,NVIDIA GeForce RTX 4060,c04,64,64,64,4,3,8,0.0,0.0,76.86400040984154,149.0636819601059,10.477029086517463,3,-1,-1,llm8_g3,0,
2026-03-03T06:15:27.436186+00:00,BUCKET,llm_style,tune,llm_style_tune_022,64,1024,6144,bf16,NVIDIA GeForce RTX 4060,c04,64,64,64,4,3,8,0.0,0.0,93.61600130796432,190.9212839603424,8.602229925959133,3,-1,-1,llm8_g3,0,
2026-03-03T06:15:27.457572+00:00,BUCKET,llm_style,tune,llm_style_tune_023,8,4096,1024,bf16,NVIDIA GeForce RTX 4060,c04,64,64,64,4,3,8,0.0,0.0,75.77600330114365,244.08320292830467,0.8856215830399591,7,-1,-1,llm8_g7,0,
2026-03-03T06:15:27.542484+00:00,BUCKET,llm_style,tune,llm_style_tune_024,8,4096,4096,bf16,NVIDIA GeForce RTX 4060,c04,64,64,64,4,3,8,0.0,0.0,164.86400365829468,264.6630324423312,1.6282235663545612,7,-1,-1,llm8_g7,0,
2026-03-03T06:15:27.569971+00:00,BUCKET,llm_style,tune,llm_style_tune_025,32,6144,1024,bf16,NVIDIA GeForce RTX 4060,c06,64,128,32,4,3,8,0.0,0.0,53.408000618219376,57.17247933149337,7.5391922434677445,1,-1,-1,llm8_g1,0,
2026-03-03T06:15:27.592172+00:00,BUCKET,llm_style,tune,llm_style_tune_026,1,3072,1536,bf16,NVIDIA GeForce RTX 4060,c04,64,64,64,4,3,8,0.0,0.0,48.128001391887665,116.7136034369467,0.19608510071209206,7,-1,-1,llm8_g7,0,
2026-03-03T06:15:27.629786+00:00,BUCKET,llm_style,tune,llm_style_tune_027,1,6144,1536,bf16,NVIDIA GeForce RTX 4060,c11,32,128,32,4,2,8,0.0,0.0,48.09600114822388,150.09535744786248,0.39243112835581356,5,-1,-1,llm8_g5,0,
2026-03-03T06:15:27.662789+00:00,BUCKET,llm_style,tune,llm_style_tune_028,4,4096,1536,bf16,NVIDIA GeForce RTX 4060,c04,64,64,64,4,3,8,0.0,0.0,57.18399956822395,183.91136169433588,0.8801701241612405,7,-1,-1,llm8_g7,0,
2026-03-03T06:15:27.690433+00:00,BUCKET,llm_style,tune,llm_style_tune_029,16,1024,6144,bf16,NVIDIA GeForce RTX 4060,c04,64,64,64,4,3,8,0.0,0.0,75.80799981951714,181.61344438791275,2.6557433579479235,7,-1,-1,llm8_g7,0,
2026-03-03T06:15:27.855495+00:00,BUCKET,llm_style,tune,llm_style_tune_030,64,4096,8192,bf16,NVIDIA GeForce RTX 4060,c10,64,128,64,8,3,8,0.0,0.0,306.17600679397583,392.25344598293304,14.02777226397776,2,-1,-1,llm8_g2,0,
2026-03-03T06:15:27.880696+00:00,BUCKET,llm_style,tune,llm_style_tune_031,1,6144,1024,bf16,NVIDIA GeForce RTX 4060,c11,32,128,32,4,2,8,0.0,0.0,40.95999896526337,93.9363205432891,0.307200007760525,5,-1,-1,llm8_g5,0,
2026-03-03T06:15:27.902763+00:00,BUCKET,llm_style,tune,llm_style_tune_032,64,1024,4096,bf16,NVIDIA GeForce RTX 4060,c04,64,64,64,4,3,8,0.0,0.0,80.89599758386612,161.24896079301828,6.636557160240439,3,-1,-1,llm8_g3,0,
2026-03-03T06:15:28.075026+00:00,BUCKET,llm_style,tune,llm_style_tune_033,2,4096,8192,bf16,NVIDIA GeForce RTX 4060,c06,64,128,32,4,3,8,0.0,0.0,295.7119941711426,316.7500779032707,0.453879892076078,6,-1,-1,llm8_g6,0,
2026-03-03T06:15:28.312771+00:00,BUCKET,llm_style,tune,llm_style_tune_034,1,8192,6144,bf16,NVIDIA GeForce RTX 4060,c11,32,128,32,4,2,8,0.0,0.0,427.0080029964447,451.08224749565125,0.23574100553997843,5,-1,-1,llm8_g5,0,
2026-03-03T06:15:28.323673+00:00,BUCKET,llm_style,tune,llm_style_tune_035,64,1536,1024,bf16,NVIDIA GeForce RTX 4060,c04,64,64,64,4,3,8,0.0,0.0,35.80800071358681,106.51647880673409,5.622391308867732,3,-1,-1,llm8_g3,0,
2026-03-03T06:15:28.351295+00:00,BUCKET,llm_style,tune,llm_style_tune_036,32,3072,2048,bf16,NVIDIA GeForce RTX 4060,c04,64,64,64,4,3,8,0.0,0.0,67.58400052785873,162.05824270844454,5.957818135285181,3,-1,-1,llm8_g3,0,
2026-03-03T06:15:28.391575+00:00,BUCKET,llm_style,tune,llm_style_tune_037,4,1536,6144,bf16,NVIDIA GeForce RTX 4060,c04,64,64,64,4,3,8,0.0,0.0,70.52800059318542,91.25152014195913,1.0704609710330386,7,-1,-1,llm8_g7,0,
2026-03-03T06:15:28.423347+00:00,BUCKET,llm_style,tune,llm_style_tune_038,1,4096,1536,bf16,NVIDIA GeForce RTX 4060,c04,64,64,64,4,3,8,0.0,0.0,63.439998775720596,180.45088216662396,0.19834350950233093,7,-1,-1,llm8_g7,0,
2026-03-03T06:15:28.447305+00:00,BUCKET,llm_style,tune,llm_style_tune_039,4,1536,4096,bf16,NVIDIA GeForce RTX 4060,c04,64,64,64,4,3,8,0.0,0.0,56.32000043988228,70.01120030879974,0.8936727202927771,7,-1,-1,llm8_g7,0,
2026-03-03T06:15:28.996973+00:00,BUCKET,llm_style,tune,llm_style_tune_040,2,6144,8192,bf16,NVIDIA GeForce RTX 4060,c11,32,128,32,4,2,8,0.0,549.619,423.93600940704346,574.1548764705658,0.474898540186747,4,-1,-1,llm8_g4,0,
2026-03-03T06:15:29.014297+00:00,BUCKET,llm_style,tune,llm_style_tune_041,16,1024,1536,bf16,NVIDIA GeForce RTX 4060,c04,64,64,64,4,3,8,0.0,0.0,40.36800004541874,2203.942723274231,1.2468204504402247,7,-1,-1,llm8_g7,0,
2026-03-03T06:15:29.045209+00:00,BUCKET,llm_style,tune,llm_style_tune_042,32,3072,2048,bf16,NVIDIA GeForce RTX 4060,c04,64,64,64,4,3,8,0.0,0.0,58.36800113320351,241.56799539923657,6.898526181855913,3,-1,-1,llm8_g3,0,
2026-03-03T06:15:29.084763+00:00,BUCKET,llm_style,tune,llm_style_tune_043,2,2048,4096,bf16,NVIDIA GeForce RTX 4060,c04,64,64,64,4,3,8,0.0,0.0,105.98399862647057,150.6288014352321,0.3165990379194793,7,-1,-1,llm8_g7,0,
2026-03-03T06:15:29.174160+00:00,BUCKET,llm_style,tune,llm_style_tune_044,64,2048,8192,bf16,NVIDIA GeForce RTX 4060,c10,64,128,64,8,3,8,0.0,0.0,166.9120043516159,190.14656096696848,12.865962854751436,2,-1,-1,llm8_g2,0,
2026-03-03T06:15:29.297283+00:00,BUCKET,llm_style,tune,llm_style_tune_045,2,3072,8192,bf16,NVIDIA GeForce RTX 4060,c06,64,128,32,4,3,8,0.0,0.0,228.35199534893036,307.2816038131714,0.44082512108634186,6,-1,-1,llm8_g6,0,
2026-03-03T06:15:29.537655+00:00,BUCKET,llm_style,tune,llm_style_tune_046,4,8192,6144,bf16,NVIDIA GeForce RTX 4060,c11,32,128,32,4,2,8,0.0,0.0,424.6559888124466,447.0572781562805,0.94818675494492,5,-1,-1,llm8_g5,0,
2026-03-03T06:15:29.570328+00:00,BUCKET,llm_style,tune,llm_style_tune_047,1,1024,6144,bf16,NVIDIA GeForce RTX 4060,c04,64,64,64,4,3,8,0.0,0.0,69.04000043869019,98.9184016734361,0.1822553870226876,7,-1,-1,llm8_g7,0,
2026-03-03T06:15:29.631072+00:00,BUCKET,llm_style,tune,llm_style_tune_048,32,4096,3072,bf16,NVIDIA GeForce RTX 4060,c04,64,64,64,4,3,8,0.0,0.0,89.08800035715103,185.56255355477333,9.039448239623201,3,-1,-1,llm8_g3,0,
2026-03-03T06:15:29.643356+00:00,BUCKET,llm_style,tune,llm_style_tune_049,16,2048,1024,bf16,NVIDIA GeForce RTX 4060,c04,64,64,64,4,3,8,0.0,0.0,40.95999896526337,124.46719743311404,1.6384000413894664,7,-1,-1,llm8_g7,0,
2026-03-03T06:15:29.654310+00:00,BUCKET,llm_style,tune,llm_style_tune_050,4,1024,1536,bf16,NVIDIA GeForce RTX 4060,c04,64,64,64,4,3,8,0.0,0.0,45.05600035190582,168.5606411099434,0.27927272509149287,7,-1,-1,llm8_g7,0,
2026-03-03T06:15:29.820016+00:00,BUCKET,llm_style,tune,llm_style_tune_051,64,4096,8192,bf16,NVIDIA GeForce RTX 4060,c10,64,128,64,8,3,8,0.0,0.0,306.92800879478455,412.2486442327499,13.993402924891297,2,-1,-1,llm8_g2,0,
2026-03-03T06:15:29.836882+00:00,BUCKET,llm_style,tune,llm_style_tune_052,16,2048,1536,bf16,NVIDIA GeForce RTX 4060,c04,64,64,64,4,3,8,0.0,0.0,57.19999969005585,210.13311624526972,1.759847841703751,7,-1,-1,llm8_g7,0,
2026-03-03T06:15:29.845148+00:00,BUCKET,llm_style,tune,llm_style_tune_053,64,1024,1024,bf16,NVIDIA GeForce RTX 4060,c04,64,64,64,4,3,8,0.0,0.0,38.91199827194214,118.35615865886209,3.4492633110743878,3,-1,-1,llm8_g3,0,
2026-03-03T06:15:30.020367+00:00,BUCKET,llm_style,tune,llm_style_tune_054,4,4096,8192,bf16,NVIDIA GeForce RTX 4060,c06,64,128,32,4,3,8,0.0,0.0,296.3999956846237,313.36448192596436,0.9056526987457226,6,-1,-1,llm8_g6,0,
2026-03-03T06:15:30.083353+00:00,BUCKET,llm_style,tune,llm_style_tune_055,1,4096,3072,bf16,NVIDIA GeForce RTX 4060,c04,64,64,64,4,3,8,0.0,0.0,87.55199983716011,211.9603309035299,0.28743859702584146,7,-1,-1,llm8_g7,0,
2026-03-03T06:15:30.101886+00:00,BUCKET,llm_style,tune,llm_style_tune_056,64,1536,2048,bf16,NVIDIA GeForce RTX 4060,c04,64,64,64,4,3,8,0.0,0.0,81.58400282263756,163.86048331856728,4.9354428572886055,3,-1,-1,llm8_g3,0,
2026-03-03T06:15:30.139250+00:00,BUCKET,llm_style,tune,llm_style_tune_057,2,4096,2048,bf16,NVIDIA GeForce RTX 4060,c04,64,64,64,4,3,8,0.0,0.0,66.54400005936623,149.03104171156883,0.5042442890428126,7,-1,-1,llm8_g7,0,
2026-03-03T06:15:30.205908+00:00,BUCKET,llm_style,tune,llm_style_tune_058,4,8192,1536,bf16,NVIDIA GeForce RTX 4060,c11,32,128,32,4,2,8,0.0,0.0,64.95999917387962,145.54111681878555,1.5496197241405854,5,-1,-1,llm8_g5,0,
2026-03-03T06:15:30.234120+00:00,BUCKET,llm_style,tune,llm_style_tune_059,1,1536,4096,bf16,NVIDIA GeForce RTX 4060,c04,64,64,64,4,3,8,0.0,0.0,57.34400078654289,69.60352085530758,0.219428568418841,7,-1,-1,llm8_g7,0,
2026-03-03T06:15:30.261113+00:00,BUCKET,llm_style,tune,llm_style_tune_060,64,1536,4096,bf16,NVIDIA GeForce RTX 4060,c04,64,64,64,4,3,8,0.0,0.0,36.86400130391121,77.33791969716547,21.84533256064524,3,-1,-1,llm8_g3,0,
2026-03-03T06:15:30.500403+00:00,BUCKET,llm_style,tune,llm_style_tune_061,8,8192,6144,bf16,NVIDIA GeForce RTX 4060,c11,32,128,32,4,2,8,0.0,0.0,428.0479997396469,571.658239364624,1.8813459436554176,5,-1,-1,llm8_g5,0,
2026-03-03T06:15:30.542124+00:00,BUCKET,llm_style,tune,llm_style_tune_062,64,6144,1536,bf16,NVIDIA GeForce RTX 4060,c06,64,128,32,4,3,8,0.0,0.0,65.5359998345375,76.84095986187458,18.432000046536324,1,-1,-1,llm8_g1,0,
2026-03-03T06:15:30.556210+00:00,BUCKET,llm_style,tune,llm_style_tune_063,2,1536,1024,bf16,NVIDIA GeForce RTX 4060,c04,64,64,64,4,3,8,0.0,0.0,67.00799986720085,120.24864286184311,0.09389111766458721,7,-1,-1,llm8_g7,0,
2026-03-03T06:15:30.567090+00:00,BUCKET,llm_style,eval,llm_style_eval_000,32,1536,1024,bf16,NVIDIA GeForce RTX 4060,c04,64,64,64,4,3,8,0.0,0.0,36.86400130391121,115.41631847620008,2.730666570080655,3,-1,-1,llm8_g3,0,
2026-03-03T06:15:30.658043+00:00,BUCKET,llm_style,eval,llm_style_eval_001,32,2048,8192,bf16,NVIDIA GeForce RTX 4060,c10,64,128,64,8,3,8,0.0,0.0,167.93599724769592,264.7968101501464,6.393756202348283,2,-1,-1,llm8_g2,0,
2026-03-03T06:15:30.705684+00:00,BUCKET,llm_style,eval,llm_style_eval_002,16,2048,4096,bf16,NVIDIA GeForce RTX 4060,c04,64,64,64,4,3,8,0.0,0.0,78.33600044250488,151.11167855560757,3.4267189348914946,7,-1,-1,llm8_g7,0,
2026-03-03T06:15:30.722623+00:00,BUCKET,llm_style,eval,llm_style_eval_003,16,2048,1536,bf16,NVIDIA GeForce RTX 4060,c04,64,64,64,4,3,8,0.0,0.0,63.35999816656113,251.9552069902419,1.5887515611249823,7,-1,-1,llm8_g7,0,
2026-03-03T06:15:30.810227+00:00,BUCKET,llm_style,eval,llm_style_eval_004,64,8192,2048,bf16,NVIDIA GeForce RTX 4060,c06,64,128,32,4,3,8,0.0,0.0,178.14400047063828,297.90559977293015,12.054762676972379,1,-1,-1,llm8_g1,0,
2026-03-03T06:15:30.936801+00:00,BUCKET,llm_style,eval,llm_style_eval_005,64,3072,8192,bf16,NVIDIA GeForce RTX 4060,c10,64,128,64,8,3,8,0.0,0.0,241.05600267648697,337.7254462242126,13.362975558518228,2,-1,-1,llm8_g2,0,
2026-03-03T06:15:30.962832+00:00,BUCKET,llm_style,eval,llm_style_eval_006,32,2048,2048,bf16,NVIDIA GeForce RTX 4060,c04,64,64,64,4,3,8,0.0,0.0,96.62400186061859,190.25919705629332,2.778144672451279,3,-1,-1,llm8_g3,0,
2026-03-03T06:15:31.050353+00:00,BUCKET,llm_style,eval,llm_style_eval_007,8,8192,2048,bf16,NVIDIA GeForce RTX 4060,c11,32,128,32,4,2,8,0.0,0.0,165.74399918317795,231.0697561502456,1.619578731796672,5,-1,-1,llm8_g5,0,
2026-03-03T06:15:31.127564+00:00,BUCKET,llm_style,eval,llm_style_eval_008,64,1536,8192,bf16,NVIDIA GeForce RTX 4060,c10,64,128,64,8,3,8,0.0,0.0,220.15999257564545,228.37248280644417,7.315646758330103,2,-1,-1,llm8_g2,0,
2026-03-03T06:15:31.252203+00:00,BUCKET,llm_style,eval,llm_style_eval_009,64,4096,6144,bf16,NVIDIA GeForce RTX 4060,c04,64,64,64,4,3,8,0.0,0.0,253.9519965648651,301.2572875618934,12.684387268352213,3,-1,-1,llm8_g3,0,
2026-03-03T06:15:31.301040+00:00,BUCKET,llm_style,eval,llm_style_eval_010,64,2048,4096,bf16,NVIDIA GeForce RTX 4060,c04,64,64,64,4,3,8,0.0,0.0,131.071999669075,227.5123223662376,8.192000020682812,3,-1,-1,llm8_g3,0,
2026-03-03T06:15:31.401705+00:00,BUCKET,llm_style,eval,llm_style_eval_011,32,3072,6144,bf16,NVIDIA GeForce RTX 4060,c04,64,64,64,4,3,8,0.0,0.0,274.4320034980774,419.64543640613533,4.401671585684658,3,-1,-1,llm8_g3,0,
2026-03-03T06:15:31.415075+00:00,BUCKET,llm_style,eval,llm_style_eval_012,16,1536,1536,bf16,NVIDIA GeForce RTX 4060,c04,64,64,64,4,3,8,0.0,0.0,51.05600133538246,111.15520037710665,1.4787188582212625,7,-1,-1,llm8_g7,0,
2026-03-03T06:15:31.444297+00:00,BUCKET,llm_style,eval,llm_style_eval_013,64,2048,3072,bf16,NVIDIA GeForce RTX 4060,c04,64,64,64,4,3,8,0.0,0.0,117.18400195240974,283.66272181272495,6.872152807403245,3,-1,-1,llm8_g3,0,
2026-03-03T06:15:31.702555+00:00,BUCKET,llm_style,eval,llm_style_eval_014,16,8192,6144,bf16,NVIDIA GeForce RTX 4060,c11,32,128,32,4,2,8,0.0,0.0,694.271981716156,797.716474533081,2.3198584681737566,5,-1,-1,llm8_g5,0,
2026-03-03T06:15:31.748365+00:00,BUCKET,llm_style,eval,llm_style_eval_015,64,6144,1536,bf16,NVIDIA GeForce RTX 4060,c06,64,128,32,4,3,8,0.0,0.0,113.66400122642517,254.96383637189865,10.62745934479005,1,-1,-1,llm8_g1,0,
2026-03-03T06:15:31.842268+00:00,BUCKET,llm_style,eval,llm_style_eval_016,16,4096,4096,bf16,NVIDIA GeForce RTX 4060,c04,64,64,64,4,3,8,0.0,0.0,260.46401262283325,424.56128478050226,2.061209556720681,7,-1,-1,llm8_g7,0,
2026-03-03T06:15:32.023258+00:00,BUCKET,llm_style,eval,llm_style_eval_017,64,8192,4096,bf16,NVIDIA GeForce RTX 4060,c06,64,128,32,4,3,8,0.0,0.0,500.4799962043762,613.2406485080719,8.581696228766164,1,-1,-1,llm8_g1,0,
2026-03-03T06:15:32.167787+00:00,BUCKET,llm_style,eval,llm_style_eval_018,32,4096,6144,bf16,NVIDIA GeForce RTX 4060,c04,64,64,64,4,3,8,0.0,0.0,375.8080005645752,463.0719923973083,4.285732963588805,3,-1,-1,llm8_g3,0,
2026-03-03T06:15:32.307821+00:00,BUCKET,llm_style,eval,llm_style_eval_019,16,3072,8192,bf16,NVIDIA GeForce RTX 4060,c06,64,128,32,4,3,8,0.0,0.0,367.6159977912903,486.84383273124695,2.1906183975627833,6,-1,-1,llm8_g6,0,
2026-03-03T06:15:32.324506+00:00,BUCKET,llm_style,eval,llm_style_eval_020,4,1536,1536,bf16,NVIDIA GeForce RTX 4060,c04,64,64,64,4,3,8,0.0,0.0,57.328000664711,166.6015993058681,0.3292347156913561,7,-1,-1,llm8_g7,0,
2026-03-03T06:15:32.374245+00:00,BUCKET,llm_style,eval,llm_style_eval_021,4,6144,1536,bf16,NVIDIA GeForce RTX 4060,c11,32,128,32,4,2,8,0.0,0.0,77.82399654388428,152.67839938402176,0.9701053062396715,5,-1,-1,llm8_g5,0,
2026-03-03T06:15:32.404236+00:00,BUCKET,llm_style,eval,llm_style_eval_022,32,6144,1024,bf16,NVIDIA GeForce RTX 4060,c06,64,128,32,4,3,8,0.0,0.0,91.13600105047226,106.5369588136673,4.418157252445229,1,-1,-1,llm8_g1,0,
2026-03-03T06:15:32.414889+00:00,BUCKET,llm_style,eval,llm_style_eval_023,16,1024,1536,bf16,NVIDIA GeForce RTX 4060,c04,64,64,64,4,3,8,0.0,0.0,55.27999997138977,97.10496187210073,0.9104856734089943,7,-1,-1,llm8_g7,0,
2026-03-03T06:15:32.452315+00:00,BUCKET,llm_style,eval,llm_style_eval_024,32,8192,1024,bf16,NVIDIA GeForce RTX 4060,c06,64,128,32,4,3,8,0.0,0.0,125.8080005645752,134.14399325847626,4.2673829135725985,1,-1,-1,llm8_g1,0,
2026-03-03T06:15:32.654913+00:00,BUCKET,llm_style,eval,llm_style_eval_025,32,6144,6144,bf16,NVIDIA GeForce RTX 4060,c06,64,128,32,4,3,8,0.0,0.0,536.4640057086945,563.2211083173752,4.503413236100446,1,-1,-1,llm8_g1,0,
2026-03-03T06:15:32.719990+00:00,BUCKET,llm_style,eval,llm_style_eval_026,1,6144,2048,bf16,NVIDIA GeForce RTX 4060,c11,32,128,32,4,2,8,0.0,0.0,124.35200437903404,218.372801542282,0.20237570054192872,5,-1,-1,llm8_g5,0,
2026-03-03T06:15:32.791760+00:00,BUCKET,llm_style,eval,llm_style_eval_027,32,4096,3072,bf16,NVIDIA GeForce RTX 4060,c04,64,64,64,4,3,8,0.0,0.0,197.63199985027313,310.2031961083412,4.074777205159608,3,-1,-1,llm8_g3,0,
2026-03-03T06:15:32.807605+00:00,BUCKET,llm_style,eval,llm_style_eval_028,64,1536,1536,bf16,NVIDIA GeForce RTX 4060,c04,64,64,64,4,3,8,0.0,0.0,66.49599969387054,104.72704090178004,4.541474515614159,3,-1,-1,llm8_g3,0,
2026-03-03T06:15:32.824678+00:00,BUCKET,llm_style,eval,llm_style_eval_029,2,3072,1024,bf16,NVIDIA GeForce RTX 4060,c04,64,64,64,4,3,8,0.0,0.0,92.16000139713287,164.52607989311215,0.1365333312635069,7,-1,-1,llm8_g7,0,
2026-03-03T06:15:32.906510+00:00,BUCKET,llm_style,eval,llm_style_eval_030,32,1536,8192,bf16,NVIDIA GeForce RTX 4060,c10,64,128,64,8,3,8,0.0,0.0,335.29599010944366,448.21503907442093,2.401777509290048,2,-1,-1,llm8_g2,0,
2026-03-03T06:15:32.934474+00:00,BUCKET,llm_style,eval,llm_style_eval_031,8,3072,2048,bf16,NVIDIA GeForce RTX 4060,c04,64,64,64,4,3,8,0.0,0.0,104.8319973051548,167.30975970625866,0.9602344569185288,7,-1,-1,llm8_g7,0,
2026-03-03T06:15:32.963711+00:00,BUCKET,llm_style,eval,llm_style_eval_032,8,2048,3072,bf16,NVIDIA GeForce RTX 4060,c04,64,64,64,4,3,8,0.0,0.0,147.45600521564484,184.1686414182185,0.6826666425201637,7,-1,-1,llm8_g7,0,
2026-03-03T06:15:33.045236+00:00,BUCKET,llm_style,eval,llm_style_eval_033,64,1536,8192,bf16,NVIDIA GeForce RTX 4060,c10,64,128,64,8,3,8,0.0,0.0,340.816006064415,439.0604683756828,4.725754387531877,2,-1,-1,llm8_g2,0,
2026-03-03T06:15:33.111881+00:00,BUCKET,llm_style,eval,llm_style_eval_034,64,6144,2048,bf16,NVIDIA GeForce RTX 4060,c06,64,128,32,4,3,8,0.0,0.0,177.50399559736252,298.51584017276764,9.073670316996129,1,-1,-1,llm8_g1,0,
2026-03-03T06:15:33.154278+00:00,BUCKET,llm_style,eval,llm_style_eval_035,4,4096,2048,bf16,NVIDIA GeForce RTX 4060,c04,64,64,64,4,3,8,0.0,0.0,146.43199741840363,261.7855954170227,0.4582937143734251,7,-1,-1,llm8_g7,0,
2026-03-03T06:15:33.334601+00:00,BUCKET,llm_style,eval,llm_style_eval_036,64,8192,4096,bf16,NVIDIA GeForce RTX 4060,c06,64,128,32,4,3,8,0.0,0.0,509.95200872421265,616.305256485939,8.422297044667124,1,-1,-1,llm8_g1,0,
2026-03-03T06:15:33.369904+00:00,BUCKET,llm_style,eval,llm_style_eval_037,32,6144,1024,bf16,NVIDIA GeForce RTX 4060,c06,64,128,32,4,3,8,0.0,0.0,110.59200018644333,124.30560380220412,3.6408888827508368,1,-1,-1,llm8_g1,0,
2026-03-03T06:15:33.442593+00:00,BUCKET,llm_style,eval,llm_style_eval_038,64,6144,2048,bf16,NVIDIA GeForce RTX 4060,c06,64,128,32,4,3,8,0.0,0.0,192.49600172042847,318.3465611934661,8.366993192612764,1,-1,-1,llm8_g1,0,
2026-03-03T06:15:33.461659+00:00,BUCKET,llm_style,eval,llm_style_eval_039,8,1024,3072,bf16,NVIDIA GeForce RTX 4060,c04,64,64,64,4,3,8,0.0,0.0,88.06400001049042,231.01439595222462,0.5715348836528475,7,-1,-1,llm8_g7,0,
2026-03-03T06:15:33.558668+00:00,BUCKET,llm_style,eval,llm_style_eval_040,32,8192,2048,bf16,NVIDIA GeForce RTX 4060,c06,64,128,32,4,3,8,0.0,0.0,276.4640003442764,337.0291185379027,3.8838395692129377,1,-1,-1,llm8_g1,0,
2026-03-03T06:15:33.578132+00:00,BUCKET,llm_style,eval,llm_style_eval_041,32,3072,1024,bf16,NVIDIA GeForce RTX 4060,c04,64,64,64,4,3,8,0.0,0.0,76.80000364780426,143.4627196192741,2.6214398754882873,3,-1,-1,llm8_g3,0,
2026-03-03T06:15:33.600870+00:00,BUCKET,llm_style,eval,llm_style_eval_042,64,1024,4096,bf16,NVIDIA GeForce RTX 4060,c04,64,64,64,4,3,8,0.0,0.0,133.84000211954117,188.02752256393416,4.011288878496026,3,-1,-1,llm8_g3,0,
2026-03-03T06:15:33.612165+00:00,BUCKET,llm_style,eval,llm_style_eval_043,2,1536,1024,bf16,NVIDIA GeForce RTX 4060,c04,64,64,64,4,3,8,0.0,0.0,77.2160030901432,245.53184181451792,0.08147865401237167,7,-1,-1,llm8_g7,0,
2026-03-03T06:15:33.714815+00:00,BUCKET,llm_style,eval,llm_style_eval_044,64,6144,3072,bf16,NVIDIA GeForce RTX 4060,c06,64,128,32,4,3,8,0.0,0.0,296.9599962234497,468.19327384233446,8.135503551738074,1,-1,-1,llm8_g1,0,
2026-03-03T06:15:33.762509+00:00,BUCKET,llm_style,eval,llm_style_eval_045,64,1536,6144,bf16,NVIDIA GeForce RTX 4060,c04,64,64,64,4,3,8,0.0,0.0,179.1360005736351,193.0547221004963,6.743253997699139,3,-1,-1,llm8_g3,0,
2026-03-03T06:15:33.865390+00:00,BUCKET,llm_style,eval,llm_style_eval_046,2,6144,3072,bf16,NVIDIA GeForce RTX 4060,c11,32,128,32,4,2,8,0.0,0.0,282.6240062713623,365.14015674591064,0.2671304288550452,5,-1,-1,llm8_g5,0,
2026-03-03T06:15:34.062491+00:00,BUCKET,llm_style,eval,llm_style_eval_047,16,4096,8192,bf16,NVIDIA GeForce RTX 4060,c06,64,128,32,4,3,8,0.0,0.0,780.7999849319458,890.3312027454376,1.3751816658828275,6,-1,-1,llm8_g6,0,
2026-03-03T06:15:34.105569+00:00,BUCKET,llm_style,eval,llm_style_eval_048,16,1024,6144,bf16,NVIDIA GeForce RTX 4060,c04,64,64,64,4,3,8,0.0,0.0,198.65599274635315,282.7769583463669,1.0134433359735426,7,-1,-1,llm8_g7,0,
2026-03-03T06:15:34.173308+00:00,BUCKET,llm_style,eval,llm_style_eval_049,16,8192,1536,bf16,NVIDIA GeForce RTX 4060,c11,32,128,32,4,2,8,0.0,0.0,156.0159996151924,194.27136167883867,2.5808454581140965,5,-1,-1,llm8_g5,0,
2026-03-03T06:15:34.182909+00:00,BUCKET,llm_style,eval,llm_style_eval_050,1,1024,1024,bf16,NVIDIA GeForce RTX 4060,c04,64,64,64,4,3,8,0.0,0.0,59.29600074887276,116.33663833141324,0.0353675116958013,7,-1,-1,llm8_g7,0,
2026-03-03T06:15:34.208233+00:00,BUCKET,llm_style,eval,llm_style_eval_051,16,6144,1024,bf16,NVIDIA GeForce RTX 4060,c11,32,128,32,4,2,8,0.0,0.0,77.31200009584427,124.30144079029552,2.6040794669703784,5,-1,-1,llm8_g5,0,
2026-03-03T06:15:34.597128+00:00,BUCKET,llm_style,eval,llm_style_eval_052,16,8192,8192,bf16,NVIDIA GeForce RTX 4060,c11,32,128,32,4,2,8,0.0,0.0,914.9439930915833,954.3888056278229,2.3471203310966415,4,-1,-1,llm8_g4,0,
2026-03-03T06:15:34.854671+00:00,BUCKET,llm_style,eval,llm_style_eval_053,1,6144,8192,bf16,NVIDIA GeForce RTX 4060,c11,32,128,32,4,2,8,0.0,0.0,695.0879991054535,809.8947209119797,0.14482093796691797,4,-1,-1,llm8_g4,0,
2026-03-03T06:15:34.933481+00:00,BUCKET,llm_style,eval,llm_style_eval_054,64,4096,3072,bf16,NVIDIA GeForce RTX 4060,c04,64,64,64,4,3,8,0.0,0.0,297.34399914741516,345.36448121070845,5.416664673301517,3,-1,-1,llm8_g3,0,
2026-03-03T06:15:34.971015+00:00,BUCKET,llm_style,eval,llm_style_eval_055,4,8192,1024,bf16,NVIDIA GeForce RTX 4060,c11,32,128,32,4,2,8,0.0,0.0,135.16800105571747,173.127682507038,0.49648484460709846,5,-1,-1,llm8_g5,0,
2026-03-03T06:15:34.997927+00:00,BUCKET,llm_style,eval,llm_style_eval_056,64,1024,3072,bf16,NVIDIA GeForce RTX 4060,c04,64,64,64,4,3,8,0.0,0.0,132.09599256515503,199.98367518186558,3.048186218074673,3,-1,-1,llm8_g3,0,
2026-03-03T06:15:35.007434+00:00,BUCKET,llm_style,eval,llm_style_eval_057,64,1024,3072,bf16,NVIDIA GeForce RTX 4060,c04,64,64,64,4,3,8,0.0,0.0,134.14399325847626,147.51743778586388,3.0016490058123213,3,-1,-1,llm8_g3,0,
2026-03-03T06:15:35.062283+00:00,BUCKET,llm_style,eval,llm_style_eval_058,32,2048,4096,bf16,NVIDIA GeForce RTX 4060,c04,64,64,64,4,3,8,0.0,0.0,273.4079957008362,360.48223465681065,1.9636254990415338,3,-1,-1,llm8_g3,0,
2026-03-03T06:15:35.158434+00:00,BUCKET,llm_style,eval,llm_style_eval_059,64,8192,2048,bf16,NVIDIA GeForce RTX 4060,c06,64,128,32,4,3,8,0.0,0.0,371.71199917793274,433.5104009509085,5.777278249691459,1,-1,-1,llm8_g1,0,
2026-03-03T06:15:35.262830+00:00,BUCKET,llm_style,eval,llm_style_eval_060,1,3072,6144,bf16,NVIDIA GeForce RTX 4060,c04,64,64,64,4,3,8,0.0,0.0,400.38400888442993,413.70847433805466,0.09428132783119243,7,-1,-1,llm8_g7,0,
2026-03-03T06:15:35.298600+00:00,BUCKET,llm_style,eval,llm_style_eval_061,64,1536,4096,bf16,NVIDIA GeForce RTX 4060,c04,64,64,64,4,3,8,0.0,0.0,167.7599996328354,235.02656117081642,4.800347936114198,3,-1,-1,llm8_g3,0,
2026-03-03T06:15:35.371726+00:00,BUCKET,llm_style,eval,llm_style_eval_062,16,6144,2048,bf16,NVIDIA GeForce RTX 4060,c11,32,128,32,4,2,8,0.0,0.0,157.44000673294067,184.68384101986885,2.5575023296524932,5,-1,-1,llm8_g5,0,
2026-03-03T06:15:35.424305+00:00,BUCKET,llm_style,eval,llm_style_eval_063,64,1536,6144,bf16,NVIDIA GeForce RTX 4060,c04,64,64,64,4,3,8,0.0,0.0,250.76799094676971,344.8694512248038,4.817040434225165,3,-1,-1,llm8_g3,0,
2026-03-03T06:15:35.493370+00:00,BUCKET,llm_style,eval,llm_style_eval_064,1,6144,2048,bf16,NVIDIA GeForce RTX 4060,c11,32,128,32,4,2,8,0.0,0.0,156.67200088500977,217.31136173009855,0.16062745007303883,5,-1,-1,llm8_g5,0,
2026-03-03T06:15:35.554104+00:00,BUCKET,llm_style,eval,llm_style_eval_065,8,1536,6144,bf16,NVIDIA GeForce RTX 4060,c04,64,64,64,4,3,8,0.0,0.0,250.88000297546387,308.1619158387183,0.6018612173516569,7,-1,-1,llm8_g7,0,
2026-03-03T06:15:35.590725+00:00,BUCKET,llm_style,eval,llm_style_eval_066,64,1536,4096,bf16,NVIDIA GeForce RTX 4060,c04,64,64,64,4,3,8,0.0,0.0,184.32000279426575,254.65856760740257,4.3690666004322205,3,-1,-1,llm8_g3,0,
2026-03-03T06:15:35.691446+00:00,BUCKET,llm_style,eval,llm_style_eval_067,64,8192,2048,bf16,NVIDIA GeForce RTX 4060,c06,64,128,32,4,3,8,0.0,0.0,411.0240042209625,511.9283255934714,5.2247158948058265,1,-1,-1,llm8_g1,0,
2026-03-03T06:15:35.718964+00:00,BUCKET,llm_style,eval,llm_style_eval_068,64,1024,4096,bf16,NVIDIA GeForce RTX 4060,c04,64,64,64,4,3,8,0.0,0.0,171.52000218629837,191.53855755925179,3.130077572042423,3,-1,-1,llm8_g3,0,
2026-03-03T06:15:35.772839+00:00,BUCKET,llm_style,eval,llm_style_eval_069,64,2048,4096,bf16,NVIDIA GeForce RTX 4060,c04,64,64,64,4,3,8,0.0,0.0,298.41600358486176,444.3059203028679,3.598137536530127,3,-1,-1,llm8_g3,0,
2026-03-03T06:15:35.830429+00:00,BUCKET,llm_style,eval,llm_style_eval_070,64,8192,1024,bf16,NVIDIA GeForce RTX 4060,c06,64,128,32,4,3,8,0.0,0.0,228.35199534893036,348.40575873851776,4.702134624920981,1,-1,-1,llm8_g1,0,
2026-03-03T06:15:35.912729+00:00,BUCKET,llm_style,eval,llm_style_eval_071,64,6144,2048,bf16,NVIDIA GeForce RTX 4060,c06,64,128,32,4,3,8,0.0,0.0,295.4239994287491,416.9523116946218,5.451868294770854,1,-1,-1,llm8_g1,0,
2026-03-03T06:15:35.928228+00:00,BUCKET,llm_style,eval,llm_style_eval_072,64,1536,1024,bf16,NVIDIA GeForce RTX 4060,c04,64,64,64,4,3,8,0.0,0.0,96.25600278377533,213.82144153118128,2.091574407595649,3,-1,-1,llm8_g3,0,
2026-03-03T06:15:35.963269+00:00,BUCKET,llm_style,eval,llm_style_eval_073,1,4096,1536,bf16,NVIDIA GeForce RTX 4060,c04,64,64,64,4,3,8,0.0,0.0,190.40000438690186,389.61438953876495,0.06608672116640778,7,-1,-1,llm8_g7,0,
2026-03-03T06:15:35.978904+00:00,BUCKET,llm_style,eval,llm_style_eval_074,8,1024,2048,bf16,NVIDIA GeForce RTX 4060,c04,64,64,64,4,3,8,0.0,0.0,107.00799897313118,171.9168011844157,0.31356938099950116,7,-1,-1,llm8_g7,0,
2026-03-03T06:15:36.006527+00:00,BUCKET,llm_style,eval,llm_style_eval_075,2,6144,1024,bf16,NVIDIA GeForce RTX 4060,c11,32,128,32,4,2,8,0.0,0.0,107.00799897313118,226.2902332842349,0.23517703574962587,5,-1,-1,llm8_g5,0,
2026-03-03T06:15:36.045336+00:00,BUCKET,llm_style,eval,llm_style_eval_076,64,1024,6144,bf16,NVIDIA GeForce RTX 4060,c04,64,64,64,4,3,8,0.0,0.0,264.1279995441437,278.02624106407166,3.048924647859642,3,-1,-1,llm8_g3,0,
2026-03-03T06:15:36.299975+00:00,BUCKET,llm_style,eval,llm_style_eval_077,1,4096,8192,bf16,NVIDIA GeForce RTX 4060,c06,64,128,32,4,3,8,0.0,0.0,1146.3680267333984,1165.8751952648163,0.058540418465113875,6,-1,-1,llm8_g6,0,
2026-03-03T06:15:36.411165+00:00,BUCKET,llm_style,eval,llm_style_eval_078,64,6144,3072,bf16,NVIDIA GeForce RTX 4060,c06,64,128,32,4,3,8,0.0,0.0,456.7039906978607,492.536638379097,5.289901453036102,1,-1,-1,llm8_g1,0,
2026-03-03T06:15:36.488347+00:00,BUCKET,llm_style,eval,llm_style_eval_079,2,3072,4096,bf16,NVIDIA GeForce RTX 4060,c04,64,64,64,4,3,8,0.0,0.0,335.7599973678589,473.032966852188,0.14990364663619116,7,-1,-1,llm8_g7,0,
2026-03-03T06:15:36.500186+00:00,BUCKET,llm_style,eval,llm_style_eval_080,4,1536,1024,bf16,NVIDIA GeForce RTX 4060,c04,64,64,64,4,3,8,0.0,0.0,72.54400104284286,105.75967736542216,0.17345213689783684,7,-1,-1,llm8_g7,0,
2026-03-03T06:15:36.652041+00:00,BUCKET,llm_style,eval,llm_style_eval_081,4,4096,6144,bf16,NVIDIA GeForce RTX 4060,c04,64,64,64,4,3,8,0.0,0.0,714.7520184516907,837.5100755691528,0.28167334516398773,7,-1,-1,llm8_g7,0,
2026-03-03T06:15:36.689128+00:00,BUCKET,llm_style,eval,llm_style_eval_082,64,6144,1024,bf16,NVIDIA GeForce RTX 4060,c06,64,128,32,4,3,8,0.0,0.0,174.0799993276596,262.0748782157898,4.626070606102333,1,-1,-1,llm8_g1,0,
2026-03-03T06:15:36.796791+00:00,BUCKET,llm_style,eval,llm_style_eval_083,8,4096,4096,bf16,NVIDIA GeForce RTX 4060,c04,64,64,64,4,3,8,0.0,0.0,491.42399430274963,629.9779194593428,0.5462400271701549,7,-1,-1,llm8_g7,0,
2026-03-03T06:15:36.868436+00:00,BUCKET,llm_style,eval,llm_style_eval_084,64,1024,8192,bf16,NVIDIA GeForce RTX 4060,c10,64,128,64,8,3,8,0.0,0.0,654.3359756469727,771.2489485740662,1.6409640673330563,2,-1,-1,llm8_g2,0,
2026-03-03T06:15:37.019343+00:00,BUCKET,llm_style,eval,llm_style_eval_085,1,3072,8192,bf16,NVIDIA GeForce RTX 4060,c06,64,128,32,4,3,8,0.0,0.0,648.1919884681702,743.4467327594756,0.07764929048096614,6,-1,-1,llm8_g6,0,
2026-03-03T06:15:37.036522+00:00,BUCKET,llm_style,eval,llm_style_eval_086,8,1536,1024,bf16,NVIDIA GeForce RTX 4060,c04,64,64,64,4,3,8,0.0,0.0,77.82400026917458,151.59296661615372,0.3233684199341777,7,-1,-1,llm8_g7,0,
2026-03-03T06:15:37.060943+00:00,BUCKET,llm_style,eval,llm_style_eval_087,16,1024,3072,bf16,NVIDIA GeForce RTX 4060,c04,64,64,64,4,3,8,0.0,0.0,164.86400365829468,192.1743974089622,0.6105838373829606,7,-1,-1,llm8_g7,0,
2026-03-03T06:15:37.100651+00:00,BUCKET,llm_style,eval,llm_style_eval_088,8,4096,1536,bf16,NVIDIA GeForce RTX 4060,c04,64,64,64,4,3,8,0.0,0.0,211.29599958658218,305.85854798555374,0.476408905975295,7,-1,-1,llm8_g7,0,
2026-03-03T06:15:37.199128+00:00,BUCKET,llm_style,eval,llm_style_eval_089,16,6144,3072,bf16,NVIDIA GeForce RTX 4060,c11,32,128,32,4,2,8,0.0,0.0,288.7679934501648,413.8947212696073,2.091574515526195,5,-1,-1,llm8_g5,0,
2026-03-03T06:15:37.226406+00:00,BUCKET,llm_style,eval,llm_style_eval_090,32,1536,3072,bf16,NVIDIA GeForce RTX 4060,c04,64,64,64,4,3,8,0.0,0.0,163.7759953737259,263.9052869379517,1.8439203334461758,3,-1,-1,llm8_g3,0,
2026-03-03T06:15:37.258772+00:00,BUCKET,llm_style,eval,llm_style_eval_091,16,1024,4096,bf16,NVIDIA GeForce RTX 4060,c04,64,64,64,4,3,8,0.0,0.0,190.33600389957428,225.32096177339554,0.7051620568372151,7,-1,-1,llm8_g7,0,
2026-03-03T06:15:37.413119+00:00,BUCKET,llm_style,eval,llm_style_eval_092,1,4096,6144,bf16,NVIDIA GeForce RTX 4060,c04,64,64,64,4,3,8,0.0,0.0,741.8879866600037,870.8210968971252,0.06784265132340828,7,-1,-1,llm8_g7,0,
2026-03-03T06:15:37.453997+00:00,BUCKET,llm_style,eval,llm_style_eval_093,32,2048,3072,bf16,NVIDIA GeForce RTX 4060,c04,64,64,64,4,3,8,0.0,0.0,260.09601354599,351.726399064064,1.548094407563087,3,-1,-1,llm8_g3,0,
2026-03-03T06:15:37.474050+00:00,BUCKET,llm_style,eval,llm_style_eval_094,32,1024,2048,bf16,NVIDIA GeForce RTX 4060,c04,64,64,64,4,3,8,0.0,0.0,131.071999669075,201.2262374162674,1.0240000025853515,3,-1,-1,llm8_g3,0,
2026-03-03T06:15:37.544685+00:00,BUCKET,llm_style,eval,llm_style_eval_095,8,6144,2048,bf16,NVIDIA GeForce RTX 4060,c11,32,128,32,4,2,8,0.0,0.0,192.51200556755066,226.67264208197588,1.0457872037978244,5,-1,-1,llm8_g5,0,
2026-03-03T06:15:37.587940+00:00,BUCKET,llm_style,eval,llm_style_eval_096,64,2048,3072,bf16,NVIDIA GeForce RTX 4060,c04,64,64,64,4,3,8,0.0,0.0,262.14399933815,403.50175857543945,3.072000007756054,3,-1,-1,llm8_g3,0,
2026-03-03T06:15:37.625712+00:00,BUCKET,llm_style,eval,llm_style_eval_097,64,6144,1024,bf16,NVIDIA GeForce RTX 4060,c06,64,128,32,4,3,8,0.0,0.0,178.17600071430206,257.7823963761328,4.519724119811601,1,-1,-1,llm8_g1,0,
2026-03-03T06:15:37.662105+00:00,BUCKET,llm_style,eval,llm_style_eval_098,32,6144,1024,bf16,NVIDIA GeForce RTX 4060,c06,64,128,32,4,3,8,0.0,0.0,190.33599644899368,301.59872174263,2.115486253320996,1,-1,-1,llm8_g1,0,
2026-03-03T06:15:37.690459+00:00,BUCKET,llm_style,eval,llm_style_eval_099,1,2048,2048,bf16,NVIDIA GeForce RTX 4060,c04,64,64,64,4,3,8,0.0,0.0,200.0960037112236,311.28800451755524,0.04192291622228672,7,-1,-1,llm8_g7,0,
2026-03-03T06:15:37.743607+00:00,BUCKET,llm_style,eval,llm_style_eval_100,64,8192,1024,bf16,NVIDIA GeForce RTX 4060,c06,64,128,32,4,3,8,0.0,0.0,269.3119943141937,385.5087959766388,3.986981072767652,1,-1,-1,llm8_g1,0,
2026-03-03T06:15:37.829143+00:00,BUCKET,llm_style,eval,llm_style_eval_101,64,8192,1536,bf16,NVIDIA GeForce RTX 4060,c06,64,128,32,4,3,8,0.0,0.0,397.3119854927063,451.22208237648005,4.0537733438941705,1,-1,-1,llm8_g1,0,
2026-03-03T06:15:37.864919+00:00,BUCKET,llm_style,eval,llm_style_eval_102,32,3072,2048,bf16,NVIDIA GeForce RTX 4060,c04,64,64,64,4,3,8,0.0,0.0,186.36800348758698,265.14239966869354,2.1605274320965653,3,-1,-1,llm8_g3,0,
2026-03-03T06:15:37.907177+00:00,BUCKET,llm_style,eval,llm_style_eval_103,64,2048,3072,bf16,NVIDIA GeForce RTX 4060,c04,64,64,64,4,3,8,0.0,0.0,271.87199890613556,412.35104441642756,2.9620791079629862,3,-1,-1,llm8_g3,0,
2026-03-03T06:15:37.980151+00:00,BUCKET,llm_style,eval,llm_style_eval_104,16,6144,2048,bf16,NVIDIA GeForce RTX 4060,c11,32,128,32,4,2,8,0.0,0.0,203.2639980316162,332.9843211174011,1.9809370468909613,5,-1,-1,llm8_g5,0,
2026-03-03T06:15:38.054262+00:00,BUCKET,llm_style,eval,llm_style_eval_105,1,1024,8192,bf16,NVIDIA GeForce RTX 4060,c06,64,128,32,4,3,8,0.0,0.0,691.1520063877106,770.2623850107193,0.02427427808201805,6,-1,-1,llm8_g6,0,
2026-03-03T06:15:38.309451+00:00,BUCKET,llm_style,eval,llm_style_eval_106,32,4096,8192,bf16,NVIDIA GeForce RTX 4060,c10,64,128,64,8,3,8,0.0,0.0,1360.8959913253784,1439.2806613445282,1.5779924856039607,2,-1,-1,llm8_g2,0,
2026-03-03T06:15:38.380538+00:00,BUCKET,llm_style,eval,llm_style_eval_107,64,6144,1536,bf16,NVIDIA GeForce RTX 4060,c06,64,128,32,4,3,8,0.0,0.0,289.4880026578903,449.7545623779296,4.172744780126645,1,-1,-1,llm8_g1,0,
2026-03-03T06:15:38.405633+00:00,BUCKET,llm_style,eval,llm_style_eval_108,8,3072,1536,bf16,NVIDIA GeForce RTX 4060,c04,64,64,64,4,3,8,0.0,0.0,135.67999750375748,230.3999960422516,0.5564377460864061,7,-1,-1,llm8_g7,0,
2026-03-03T06:15:38.419500+00:00,BUCKET,llm_style,eval,llm_style_eval_109,16,2048,1024,bf16,NVIDIA GeForce RTX 4060,c04,64,64,64,4,3,8,0.0,0.0,102.22400352358818,112.15872071683407,0.6564883167045461,7,-1,-1,llm8_g7,0,
2026-03-03T06:15:38.782564+00:00,BUCKET,llm_style,eval,llm_style_eval_110,1,8192,8192,bf16,NVIDIA GeForce RTX 4060,c11,32,128,32,4,2,8,0.0,0.0,917.5040125846863,1034.6031987667084,0.14628571227922732,4,-1,-1,llm8_g4,0,
2026-03-03T06:15:38.840812+00:00,BUCKET,llm_style,eval,llm_style_eval_111,8,6144,1536,bf16,NVIDIA GeForce RTX 4060,c11,32,128,32,4,2,8,0.0,0.0,134.14399325847626,269.6032011508941,1.1256183771796207,5,-1,-1,llm8_g5,0,
2026-03-03T06:15:38.942902+00:00,BUCKET,llm_style,eval,llm_style_eval_112,2,6144,3072,bf16,NVIDIA GeForce RTX 4060,c11,32,128,32,4,2,8,0.0,0.0,288.1599962711334,430.42559564113606,0.2619984486984913,5,-1,-1,llm8_g5,0,
2026-03-03T06:15:39.281188+00:00,BUCKET,llm_style,eval,llm_style_eval_113,1,8192,8192,bf16,NVIDIA GeForce RTX 4060,c11,32,128,32,4,2,8,0.0,0.0,918.287992477417,1054.7200441360474,0.14616082220339036,4,-1,-1,llm8_g4,0,
2026-03-03T06:15:39.304968+00:00,BUCKET,llm_style,eval,llm_style_eval_114,1,3072,1024,bf16,NVIDIA GeForce RTX 4060,c04,64,64,64,4,3,8,0.0,0.0,103.42399775981903,187.53536388278005,0.060831684485941194,7,-1,-1,llm8_g7,0,
2026-03-03T06:15:39.335735+00:00,BUCKET,llm_style,eval,llm_style_eval_115,16,3072,1536,bf16,NVIDIA GeForce RTX 4060,c04,64,64,64,4,3,8,0.0,0.0,138.2399946451187,718.5801428556424,1.0922667089768414,7,-1,-1,llm8_g7,0,
2026-03-03T06:15:39.355736+00:00,BUCKET,llm_style,eval,llm_style_eval_116,8,3072,1024,bf16,NVIDIA GeForce RTX 4060,c04,64,64,64,4,3,8,0.0,0.0,101.24799981713295,189.91520434617996,0.4971125167006311,7,-1,-1,llm8_g7,0,
2026-03-03T06:15:39.382105+00:00,BUCKET,llm_style,eval,llm_style_eval_117,4,1024,4096,bf16,NVIDIA GeForce RTX 4060,c04,64,64,64,4,3,8,0.0,0.0,176.59199982881546,293.35551500320423,0.1900110539125609,7,-1,-1,llm8_g7,0,
2026-03-03T06:15:39.491689+00:00,BUCKET,llm_style,eval,llm_style_eval_118,64,6144,3072,bf16,NVIDIA GeForce RTX 4060,c06,64,128,32,4,3,8,0.0,0.0,357.37600922584534,475.13824701309204,6.760160283935705,1,-1,-1,llm8_g1,0,
2026-03-03T06:15:39.768191+00:00,BUCKET,llm_style,eval,llm_style_eval_119,64,8192,6144,bf16,NVIDIA GeForce RTX 4060,c06,64,128,32,4,3,8,0.0,0.0,986.5919947624207,1124.3439972400665,6.530005289117914,1,-1,-1,llm8_g1,0,
2026-03-03T06:15:39.800228+00:00,BUCKET,llm_style,eval,llm_style_eval_120,8,1024,4096,bf16,NVIDIA GeForce RTX 4060,c04,64,64,64,4,3,8,0.0,0.0,163.83999586105347,225.734396725893,0.4096000103473666,7,-1,-1,llm8_g7,0,
2026-03-03T06:15:39.814812+00:00,BUCKET,llm_style,eval,llm_style_eval_121,4,1024,2048,bf16,NVIDIA GeForce RTX 4060,c04,64,64,64,4,3,8,0.0,0.0,93.18400174379349,103.46495777368544,0.18004395267471376,7,-1,-1,llm8_g7,0,
2026-03-03T06:15:39.947109+00:00,BUCKET,llm_style,eval,llm_style_eval_122,4,6144,4096,bf16,NVIDIA GeForce RTX 4060,c11,32,128,32,4,2,8,0.0,0.0,368.38398873806,486.9222369790077,0.5465128728576573,5,-1,-1,llm8_g5,0,
2026-03-03T06:15:40.087936+00:00,BUCKET,llm_style,eval,llm_style_eval_123,4,3072,8192,bf16,NVIDIA GeForce RTX 4060,c06,64,128,32,4,3,8,0.0,0.0,479.2320132255554,594.9849605560303,0.42010255250882744,6,-1,-1,llm8_g6,0,
2026-03-03T06:15:40.121411+00:00,BUCKET,llm_style,eval,llm_style_eval_124,64,6144,1024,bf16,NVIDIA GeForce RTX 4060,c06,64,128,32,4,3,8,0.0,0.0,144.896000623703,214.5792017877102,5.55782329763119,1,-1,-1,llm8_g1,0,
2026-03-03T06:15:40.222216+00:00,BUCKET,llm_style,eval,llm_style_eval_125,64,1536,8192,bf16,NVIDIA GeForce RTX 4060,c10,64,128,64,8,3,8,0.0,0.0,491.90399050712585,581.3555043935776,3.27424206162578,2,-1,-1,llm8_g2,0,
2026-03-03T06:15:40.336142+00:00,BUCKET,llm_style,eval,llm_style_eval_126,64,2048,8192,bf16,NVIDIA GeForce RTX 4060,c10,64,128,64,8,3,8,0.0,0.0,491.5199875831604,613.5603111982346,4.369066777038577,2,-1,-1,llm8_g2,0,
2026-03-03T06:15:40.404356+00:00,BUCKET,llm_style,eval,llm_style_eval_127,2,8192,1536,bf16,NVIDIA GeForce RTX 4060,c11,32,128,32,4,2,8,0.0,0.0,175.61600357294083,231.22783899307234,0.28660057725943594,5,-1,-1,llm8_g5,0,
2026-03-03T06:15:40.427662+00:00,BUCKET,llm_style,eval,llm_style_eval_128,8,2048,2048,bf16,NVIDIA GeForce RTX 4060,c04,64,64,64,4,3,8,0.0,0.0,144.3839967250824,170.20927786827082,0.464794336783599,7,-1,-1,llm8_g7,0,
2026-03-03T06:15:40.720472+00:00,BUCKET,llm_style,eval,llm_style_eval_129,64,8192,6144,bf16,NVIDIA GeForce RTX 4060,c06,64,128,32,4,3,8,0.0,0.0,994.3040013313293,1125.124807357788,6.479357354867165,1,-1,-1,llm8_g1,0,
2026-03-03T06:15:40.749452+00:00,BUCKET,llm_style,eval,llm_style_eval_130,16,3072,1536,bf16,NVIDIA GeForce RTX 4060,c04,64,64,64,4,3,8,0.0,0.0,121.85599654912949,323.6591966450211,1.2391260855112893,7,-1,-1,llm8_g7,0,
2026-03-03T06:15:41.098265+00:00,BUCKET,llm_style,eval,llm_style_eval_131,32,8192,8192,bf16,NVIDIA GeForce RTX 4060,c11,32,128,32,4,2,8,0.0,0.0,920.9119975566864,1088.8403451442719,4.66381946092045,0,-1,-1,llm8_g0,0,
2026-03-03T06:15:41.292037+00:00,BUCKET,llm_style,eval,llm_style_eval_132,32,8192,4096,bf16,NVIDIA GeForce RTX 4060,c06,64,128,32,4,3,8,0.0,0.0,782.1600139141083,881.3055741786957,2.745580967829714,1,-1,-1,llm8_g1,0,
2026-03-03T06:15:41.629766+00:00,BUCKET,llm_style,eval,llm_style_eval_133,2,8192,8192,bf16,NVIDIA GeForce RTX 4060,c11,32,128,32,4,2,8,0.0,0.0,922.0159947872162,987.0720058679581,0.2911396955341863,4,-1,-1,llm8_g4,0,
2026-03-03T06:15:41.689447+00:00,BUCKET,llm_style,eval,llm_style_eval_134,64,3072,3072,bf16,NVIDIA GeForce RTX 4060,c04,64,64,64,4,3,8,0.0,0.0,256.415992975235,341.55519276857376,4.710936856877981,3,-1,-1,llm8_g3,0,
2026-03-03T06:15:41.748567+00:00,BUCKET,llm_style,eval,llm_style_eval_135,8,3072,3072,bf16,NVIDIA GeForce RTX 4060,c04,64,64,64,4,3,8,0.0,0.0,249.29600208997726,372.9715082049368,0.605685380969335,7,-1,-1,llm8_g7,0,
2026-03-03T06:15:41.809503+00:00,BUCKET,llm_style,eval,llm_style_eval_136,4,2048,4096,bf16,NVIDIA GeForce RTX 4060,c04,64,64,64,4,3,8,0.0,0.0,324.0000009536743,412.9177653789518,0.20712612284712695,7,-1,-1,llm8_g7,0,
2026-03-03T06:15:42.168102+00:00,BUCKET,llm_style,eval,llm_style_eval_137,4,8192,8192,bf16,NVIDIA GeForce RTX 4060,c11,32,128,32,4,2,8,0.0,0.0,937.9839897155762,1070.3052628040314,0.5723668185027282,4,-1,-1,llm8_g4,0,
2026-03-03T06:15:42.185868+00:00,BUCKET,llm_style,eval,llm_style_eval_138,16,1024,1024,bf16,NVIDIA GeForce RTX 4060,c04,64,64,64,4,3,8,0.0,0.0,96.25600278377533,195.2243159711361,0.3485957345992748,7,-1,-1,llm8_g7,0,
2026-03-03T06:15:42.203544+00:00,BUCKET,llm_style,eval,llm_style_eval_139,4,1024,1024,bf16,NVIDIA GeForce RTX 4060,c04,64,64,64,4,3,8,0.0,0.0,83.96799862384796,553.6636775732037,0.09990244066169192,7,-1,-1,llm8_g7,0,
2026-03-03T06:15:42.369607+00:00,BUCKET,llm_style,eval,llm_style_eval_140,64,4096,6144,bf16,NVIDIA GeForce RTX 4060,c04,64,64,64,4,3,8,0.0,0.0,744.4480061531067,857.0758616924286,4.32699858872012,3,-1,-1,llm8_g3,0,
2026-03-03T06:15:42.502377+00:00,BUCKET,llm_style,eval,llm_style_eval_141,4,6144,4096,bf16,NVIDIA GeForce RTX 4060,c11,32,128,32,4,2,8,0.0,0.0,372.72000312805176,484.321290850639,0.5401550501995253,5,-1,-1,llm8_g5,0,
2026-03-03T06:15:42.594772+00:00,BUCKET,llm_style,eval,llm_style_eval_142,4,2048,6144,bf16,NVIDIA GeForce RTX 4060,c04,64,64,64,4,3,8,0.0,0.0,534.0160131454468,669.9465596675873,0.1885023922917138,7,-1,-1,llm8_g7,0,
2026-03-03T06:15:42.701136+00:00,BUCKET,llm_style,eval,llm_style_eval_143,64,1536,8192,bf16,NVIDIA GeForce RTX 4060,c10,64,128,64,8,3,8,0.0,0.0,723.9680290222168,837.1145528554916,2.224701466686693,2,-1,-1,llm8_g2,0,
2026-03-03T06:15:42.762136+00:00,BUCKET,llm_style,eval,llm_style_eval_144,1,3072,3072,bf16,NVIDIA GeForce RTX 4060,c04,64,64,64,4,3,8,0.0,0.0,289.66400027275085,423.3216017484664,0.06515952269604675,7,-1,-1,llm8_g7,0,
2026-03-03T06:15:42.778815+00:00,BUCKET,llm_style,eval,llm_style_eval_145,32,1024,2048,bf16,NVIDIA GeForce RTX 4060,c04,64,64,64,4,3,8,0.0,0.0,126.97599828243256,176.63871943950642,1.0570322723626844,3,-1,-1,llm8_g3,0,
2026-03-03T06:15:42.986424+00:00,BUCKET,llm_style,eval,llm_style_eval_146,64,8192,4096,bf16,NVIDIA GeForce RTX 4060,c06,64,128,32,4,3,8,0.0,0.0,993.2799935340881,1062.8847932815552,4.324024770415958,1,-1,-1,llm8_g1,0,
2026-03-03T06:15:43.050843+00:00,BUCKET,llm_style,eval,llm_style_eval_147,64,2048,4096,bf16,NVIDIA GeForce RTX 4060,c04,64,64,64,4,3,8,0.0,0.0,375.8080005645752,455.1782488822937,2.8571553090592032,3,-1,-1,llm8_g3,0,
2026-03-03T06:15:43.099088+00:00,BUCKET,llm_style,eval,llm_style_eval_148,64,1024,6144,bf16,NVIDIA GeForce RTX 4060,c04,64,64,64,4,3,8,0.0,0.0,321.53600454330444,414.583365023136,2.5045604741646943,3,-1,-1,llm8_g3,0,
2026-03-03T06:15:43.332728+00:00,BUCKET,llm_style,eval,llm_style_eval_149,64,4096,8192,bf16,NVIDIA GeForce RTX 4060,c10,64,128,64,8,3,8,0.0,0.0,1362.384021282196,1512.468433380127,3.1525379253625045,2,-1,-1,llm8_g2,0,
2026-03-03T06:15:43.381570+00:00,BUCKET,llm_style,eval,llm_style_eval_150,2,2048,3072,bf16,NVIDIA GeForce RTX 4060,c04,64,64,64,4,3,8,0.0,0.0,326.1440098285675,451.6147273778914,0.07716169312209054,7,-1,-1,llm8_g7,0,
2026-03-03T06:15:43.433379+00:00,BUCKET,llm_style,eval,llm_style_eval_151,64,4096,2048,bf16,NVIDIA GeForce RTX 4060,c04,64,64,64,4,3,8,0.0,0.0,235.4080006480217,360.73887884616846,4.561195120999485,3,-1,-1,llm8_g3,0,
2026-03-03T06:15:43.791479+00:00,BUCKET,llm_style,eval,llm_style_eval_152,8,8192,8192,bf16,NVIDIA GeForce RTX 4060,c11,32,128,32,4,2,8,0.0,0.0,918.8800156116486,1071.8515145778656,1.1685332206134316,4,-1,-1,llm8_g4,0,
2026-03-03T06:15:43.907219+00:00,BUCKET,llm_style,eval,llm_style_eval_153,64,8192,2048,bf16,NVIDIA GeForce RTX 4060,c06,64,128,32,4,3,8,0.0,0.0,410.0959897041321,526.3360142707825,5.236539010170092,1,-1,-1,llm8_g1,0,
2026-03-03T06:15:44.020255+00:00,BUCKET,llm_style,eval,llm_style_eval_154,16,2048,8192,bf16,NVIDIA GeForce RTX 4060,c06,64,128,32,4,3,8,0.0,0.0,554.9919903278351,710.6150490045545,0.9673489372033444,6,-1,-1,llm8_g6,0,
2026-03-03T06:15:44.044618+00:00,BUCKET,llm_style,eval,llm_style_eval_155,4,2048,1536,bf16,NVIDIA GeForce RTX 4060,c04,64,64,64,4,3,8,0.0,0.0,132.09599256515503,181.95264101028425,0.19051163862966705,7,-1,-1,llm8_g7,0,
2026-03-03T06:15:44.191025+00:00,BUCKET,llm_style,eval,llm_style_eval_156,1,4096,6144,bf16,NVIDIA GeForce RTX 4060,c04,64,64,64,4,3,8,0.0,0.0,619.376003742218,710.4793643951414,0.08126186306201788,7,-1,-1,llm8_g7,0,
2026-03-03T06:15:44.279004+00:00,BUCKET,llm_style,eval,llm_style_eval_157,1,1536,8192,bf16,NVIDIA GeForce RTX 4060,c06,64,128,32,4,3,8,0.0,0.0,540.6720042228699,612.5184088945387,0.046545454181915476,6,-1,-1,llm8_g6,0,
2026-03-03T06:15:44.372679+00:00,BUCKET,llm_style,eval,llm_style_eval_158,64,1536,8192,bf16,NVIDIA GeForce RTX 4060,c10,64,128,64,8,3,8,0.0,0.0,566.1280155181885,1020.6886458396912,2.8449620789845094,2,-1,-1,llm8_g2,0,
2026-03-03T06:15:44.426820+00:00,BUCKET,llm_style,eval,llm_style_eval_159,16,6144,1536,bf16,NVIDIA GeForce RTX 4060,c11,32,128,32,4,2,8,0.0,0.0,131.071999669075,172.88191512227053,2.3040000058170405,5,-1,-1,llm8_g5,0,
2026-03-03T06:15:44.644248+00:00,BUCKET,llm_style,eval,llm_style_eval_160,32,6144,6144,bf16,NVIDIA GeForce RTX 4060,c06,64,128,32,4,3,8,0.0,0.0,781.0239791870117,792.9881781339645,3.093271357064854,1,-1,-1,llm8_g1,0,
2026-03-03T06:15:44.678307+00:00,BUCKET,llm_style,eval,llm_style_eval_161,2,1536,4096,bf16,NVIDIA GeForce RTX 4060,c04,64,64,64,4,3,8,0.0,0.0,175.50399899482727,264.7923085093498,0.1433917411804487,7,-1,-1,llm8_g7,0,
2026-03-03T06:15:44.705893+00:00,BUCKET,llm_style,eval,llm_style_eval_162,64,1536,3072,bf16,NVIDIA GeForce RTX 4060,c04,64,64,64,4,3,8,0.0,0.0,175.47199875116348,270.069769322872,3.44202938530667,3,-1,-1,llm8_g3,0,
2026-03-03T06:15:44.777643+00:00,BUCKET,llm_style,eval,llm_style_eval_163,64,1024,8192,bf16,NVIDIA GeForce RTX 4060,c10,64,128,64,8,3,8,0.0,0.0,564.1440153121948,986.5987247228622,1.9033115567233236,2,-1,-1,llm8_g2,0,
2026-03-03T06:15:44.979632+00:00,BUCKET,llm_style,eval,llm_style_eval_164,64,4096,8192,bf16,NVIDIA GeForce RTX 4060,c10,64,128,64,8,3,8,0.0,0.0,769.0240144729614,916.6336011886596,5.5849586165959835,2,-1,-1,llm8_g2,0,
2026-03-03T06:15:45.116142+00:00,BUCKET,llm_style,eval,llm_style_eval_165,4,8192,3072,bf16,NVIDIA GeForce RTX 4060,c11,32,128,32,4,2,8,0.0,0.0,364.03200030326843,442.1632078289984,0.5530464130413768,5,-1,-1,llm8_g5,0,
2026-03-03T06:15:45.161002+00:00,BUCKET,llm_style,eval,llm_style_eval_166,64,1024,6144,bf16,NVIDIA GeForce RTX 4060,c04,64,64,64,4,3,8,0.0,0.0,198.65599274635315,287.0259124040603,4.0537733438941705,3,-1,-1,llm8_g3,0,
2026-03-03T06:15:45.175160+00:00,BUCKET,llm_style,eval,llm_style_eval_167,2,2048,1024,bf16,NVIDIA GeForce RTX 4060,c04,64,64,64,4,3,8,0.0,0.0,86.43199875950813,126.46400175988664,0.09705442568024836,7,-1,-1,llm8_g7,0,
2026-03-03T06:15:45.197592+00:00,BUCKET,llm_style,eval,llm_style_eval_168,64,4096,1024,bf16,NVIDIA GeForce RTX 4060,c04,64,64,64,4,3,8,0.0,0.0,104.44799810647964,151.6236790269612,5.140078524556174,3,-1,-1,llm8_g3,0,
2026-03-03T06:15:45.246085+00:00,BUCKET,llm_style,eval,llm_style_eval_169,4,1536,6144,bf16,NVIDIA GeForce RTX 4060,c04,64,64,64,4,3,8,0.0,0.0,198.65599274635315,256.2252847850322,0.3800412509900784,7,-1,-1,llm8_g7,0,
2026-03-03T06:15:45.263343+00:00,BUCKET,llm_style,eval,llm_style_eval_170,16,1536,1536,bf16,NVIDIA GeForce RTX 4060,c04,64,64,64,4,3,8,0.0,0.0,70.0480006635189,86.42527863383293,1.077796243788,7,-1,-1,llm8_g7,0,
2026-03-03T06:15:45.298106+00:00,BUCKET,llm_style,eval,llm_style_eval_171,1,2048,3072,bf16,NVIDIA GeForce RTX 4060,c04,64,64,64,4,3,8,0.0,0.0,172.54400253295898,191.02720126509666,0.07292581495318239,7,-1,-1,llm8_g7,0,
2026-03-03T06:15:45.327803+00:00,BUCKET,llm_style,eval,llm_style_eval_172,64,3072,2048,bf16,NVIDIA GeForce RTX 4060,c04,64,64,64,4,3,8,0.0,0.0,128.00000607967377,168.04863333702076,6.2914557011718895,3,-1,-1,llm8_g3,0,
2026-03-03T06:15:45.597070+00:00,BUCKET,llm_style,eval,llm_style_eval_173,64,8192,6144,bf16,NVIDIA GeForce RTX 4060,c06,64,128,32,4,3,8,0.0,0.0,882.671982049942,903.1884723901749,7.298805303684697,1,-1,-1,llm8_g1,0,
2026-03-03T06:15:45.692972+00:00,BUCKET,llm_style,eval,llm_style_eval_174,2,4096,4096,bf16,NVIDIA GeForce RTX 4060,c04,64,64,64,4,3,8,0.0,0.0,356.7360043525696,475.76064079999924,0.1881191222113788,7,-1,-1,llm8_g7,0,
2026-03-03T06:15:45.738210+00:00,BUCKET,llm_style,eval,llm_style_eval_175,64,4096,2048,bf16,NVIDIA GeForce RTX 4060,c04,64,64,64,4,3,8,0.0,0.0,184.83199924230576,268.3744041621684,5.809285342373951,3,-1,-1,llm8_g3,0,
2026-03-03T06:15:45.801564+00:00,BUCKET,llm_style,eval,llm_style_eval_176,16,6144,2048,bf16,NVIDIA GeForce RTX 4060,c11,32,128,32,4,2,8,0.0,0.0,134.51199978590012,145.30303612351418,2.993436902587832,5,-1,-1,llm8_g5,0,
2026-03-03T06:15:45.855273+00:00,BUCKET,llm_style,eval,llm_style_eval_177,1,6144,1536,bf16,NVIDIA GeForce RTX 4060,c11,32,128,32,4,2,8,0.0,0.0,106.89599812030792,147.52255707979197,0.17656758280845575,5,-1,-1,llm8_g5,0,
2026-03-03T06:15:46.124867+00:00,BUCKET,llm_style,eval,llm_style_eval_178,32,6144,8192,bf16,NVIDIA GeForce RTX 4060,c11,32,128,32,4,2,8,0.0,0.0,719.7279930114746,797.3750257492065,4.475615098034187,0,-1,-1,llm8_g0,0,
2026-03-03T06:15:46.264323+00:00,BUCKET,llm_style,eval,llm_style_eval_179,64,4096,6144,bf16,NVIDIA GeForce RTX 4060,c04,64,64,64,4,3,8,0.0,0.0,472.06398844718933,599.2652815580368,6.823705156150382,3,-1,-1,llm8_g3,0,
2026-03-03T06:15:46.285859+00:00,BUCKET,llm_style,eval,llm_style_eval_180,64,2048,1536,bf16,NVIDIA GeForce RTX 4060,c04,64,64,64,4,3,8,0.0,0.0,128.9760023355484,217.032318264246,3.1219232780408532,3,-1,-1,llm8_g3,0,
2026-03-03T06:15:46.322801+00:00,BUCKET,llm_style,eval,llm_style_eval_181,64,2048,3072,bf16,NVIDIA GeForce RTX 4060,c04,64,64,64,4,3,8,0.0,0.0,161.71199828386307,272.300165593624,4.979880135958719,3,-1,-1,llm8_g3,0,
2026-03-03T06:15:46.349247+00:00,BUCKET,llm_style,eval,llm_style_eval_182,32,3072,1536,bf16,NVIDIA GeForce RTX 4060,c04,64,64,64,4,3,8,0.0,0.0,113.66400122642517,202.68927365541458,2.6568648361975127,3,-1,-1,llm8_g3,0,
2026-03-03T06:15:46.442001+00:00,BUCKET,llm_style,eval,llm_style_eval_183,8,8192,2048,bf16,NVIDIA GeForce RTX 4060,c11,32,128,32,4,2,8,0.0,0.0,256.00001215934753,388.02847683429707,1.048575950195315,5,-1,-1,llm8_g5,0,
2026-03-03T06:15:46.488255+00:00,BUCKET,llm_style,eval,llm_style_eval_184,64,8192,1024,bf16,NVIDIA GeForce RTX 4060,c06,64,128,32,4,3,8,0.0,0.0,173.45600575208664,228.42176198959348,6.1902833478977595,1,-1,-1,llm8_g1,0,
2026-03-03T06:15:46.552774+00:00,BUCKET,llm_style,eval,llm_style_eval_185,1,8192,1536,bf16,NVIDIA GeForce RTX 4060,c11,32,128,32,4,2,8,0.0,0.0,157.69599378108978,218.5571190714834,0.15958442187779773,5,-1,-1,llm8_g5,0,
2026-03-03T06:15:46.578921+00:00,BUCKET,llm_style,eval,llm_style_eval_186,16,6144,1024,bf16,NVIDIA GeForce RTX 4060,c11,32,128,32,4,2,8,0.0,0.0,80.70399984717369,196.21887922286976,2.494629663724785,5,-1,-1,llm8_g5,0,
2026-03-03T06:15:46.615944+00:00,BUCKET,llm_style,eval,llm_style_eval_187,1,1024,6144,bf16,NVIDIA GeForce RTX 4060,c04,64,64,64,4,3,8,0.0,0.0,262.14399933815,289.09567356109613,0.048000000121188345,7,-1,-1,llm8_g7,0,
2026-03-03T06:15:46.795028+00:00,BUCKET,llm_style,eval,llm_style_eval_188,8,8192,4096,bf16,NVIDIA GeForce RTX 4060,c11,32,128,32,4,2,8,0.0,0.0,483.3280146121979,549.6041738986969,1.1107796274353405,5,-1,-1,llm8_g5,0,
2026-03-03T06:15:46.909570+00:00,BUCKET,llm_style,eval,llm_style_eval_189,8,2048,8192,bf16,NVIDIA GeForce RTX 4060,c06,64,128,32,4,3,8,0.0,0.0,617.4719929695129,745.0979262590408,0.4347330066082103,6,-1,-1,llm8_g6,0,
2026-03-03T06:15:47.001552+00:00,BUCKET,llm_style,eval,llm_style_eval_190,4,8192,2048,bf16,NVIDIA GeForce RTX 4060,c11,32,128,32,4,2,8,0.0,0.0,290.8160090446472,368.7116667628287,0.4615211124068289,5,-1,-1,llm8_g5,0,
2026-03-03T06:15:47.362003+00:00,BUCKET,llm_style,eval,llm_style_eval_191,4,8192,8192,bf16,NVIDIA GeForce RTX 4060,c11,32,128,32,4,2,8,0.0,0.0,1029.0719866752625,1126.5331101417542,0.5217039419511639,4,-1,-1,llm8_g4,0,
2026-03-03T06:15:47.390306+00:00,BUCKET,llm_style,eval,llm_style_eval_192,64,1536,1024,bf16,NVIDIA GeForce RTX 4060,c04,64,64,64,4,3,8,0.0,0.0,81.82399719953537,1146.2758499383915,2.4604834631709145,3,-1,-1,llm8_g3,0,
2026-03-03T06:15:47.419258+00:00,BUCKET,llm_style,eval,llm_style_eval_193,32,2048,2048,bf16,NVIDIA GeForce RTX 4060,c04,64,64,64,4,3,8,0.0,0.0,188.76799941062927,199.17823672294617,1.4220389940991491,3,-1,-1,llm8_g3,0,
2026-03-03T06:15:47.437282+00:00,BUCKET,llm_style,eval,llm_style_eval_194,8,1024,2048,bf16,NVIDIA GeForce RTX 4060,c04,64,64,64,4,3,8,0.0,0.0,134.14400070905685,270.09279727935785,0.2501374032579792,7,-1,-1,llm8_g7,0,
2026-03-03T06:15:47.488665+00:00,BUCKET,llm_style,eval,llm_style_eval_195,2,4096,2048,bf16,NVIDIA GeForce RTX 4060,c04,64,64,64,4,3,8,0.0,0.0,275.4560112953186,408.88321161270136,0.1218141213989555,7,-1,-1,llm8_g7,0,
2026-03-03T06:15:47.551376+00:00,BUCKET,llm_style,eval,llm_style_eval_196,32,2048,4096,bf16,NVIDIA GeForce RTX 4060,c04,64,64,64,4,3,8,0.0,0.0,354.68800365924835,430.43646842241276,1.5136427126409842,3,-1,-1,llm8_g3,0,
2026-03-03T06:15:47.637136+00:00,BUCKET,llm_style,eval,llm_style_eval_197,32,8192,1536,bf16,NVIDIA GeForce RTX 4060,c06,64,128,32,4,3,8,0.0,0.0,386.04798913002014,500.2377799153328,2.0860265839353316,1,-1,-1,llm8_g1,0,
2026-03-03T06:15:47.867632+00:00,BUCKET,llm_style,eval,llm_style_eval_198,64,4096,8192,bf16,NVIDIA GeForce RTX 4060,c10,64,128,64,8,3,8,0.0,0.0,1343.4879779815674,1429.6576333045957,3.1968781011741414,2,-1,-1,llm8_g2,0,
2026-03-03T06:15:48.060742+00:00,BUCKET,llm_style,eval,llm_style_eval_199,2,8192,4096,bf16,NVIDIA GeForce RTX 4060,c11,32,128,32,4,2,8,0.0,0.0,612.8640174865723,638.0953603982925,0.21900082917323613,5,-1,-1,llm8_g5,0,
2026-03-03T06:15:48.087726+00:00,BUCKET,llm_style,eval,llm_style_eval_200,1,4096,1024,bf16,NVIDIA GeForce RTX 4060,c04,64,64,64,4,3,8,0.0,0.0,141.31200313568115,315.4131287336349,0.05936231752334337,7,-1,-1,llm8_g7,0,
2026-03-03T06:15:48.191070+00:00,BUCKET,llm_style,eval,llm_style_eval_201,4,1536,8192,bf16,NVIDIA GeForce RTX 4060,c06,64,128,32,4,3,8,0.0,0.0,697.3440051078796,793.5590249300001,0.1443524218501417,6,-1,-1,llm8_g6,0,
2026-03-03T06:15:48.302836+00:00,BUCKET,llm_style,eval,llm_style_eval_202,1,6144,3072,bf16,NVIDIA GeForce RTX 4060,c11,32,128,32,4,2,8,0.0,0.0,310.2240115404129,397.91616410017014,0.1216821864063945,5,-1,-1,llm8_g5,0,
2026-03-03T06:15:48.404079+00:00,BUCKET,llm_style,eval,llm_style_eval_203,16,2048,6144,bf16,NVIDIA GeForce RTX 4060,c04,64,64,64,4,3,8,0.0,0.0,530.9439897537231,650.321894288063,0.7583722422147947,7,-1,-1,llm8_g7,0,
2026-03-03T06:15:48.420380+00:00,BUCKET,llm_style,eval,llm_style_eval_204,16,1536,1024,bf16,NVIDIA GeForce RTX 4060,c04,64,64,64,4,3,8,0.0,0.0,76.80000364780426,181.5347217023372,0.6553599688720718,7,-1,-1,llm8_g7,0,
2026-03-03T06:15:48.503299+00:00,BUCKET,llm_style,eval,llm_style_eval_205,64,6144,2048,bf16,NVIDIA GeForce RTX 4060,c06,64,128,32,4,3,8,0.0,0.0,350.20801424980164,524.7283148765562,4.599017356727758,1,-1,-1,llm8_g1,0,
2026-03-03T06:15:48.591491+00:00,BUCKET,llm_style,eval,llm_style_eval_206,4,2048,6144,bf16,NVIDIA GeForce RTX 4060,c04,64,64,64,4,3,8,0.0,0.0,525.3120064735413,574.609608054161,0.19162572863270388,7,-1,-1,llm8_g7,0,
2026-03-03T06:15:48.662390+00:00,BUCKET,llm_style,eval,llm_style_eval_207,32,6144,1536,bf16,NVIDIA GeForce RTX 4060,c06,64,128,32,4,3,8,0.0,0.0,267.2640085220337,272.40448266267776,2.259861996907103,1,-1,-1,llm8_g1,0,
2026-03-03T06:15:48.680682+00:00,BUCKET,llm_style,eval,llm_style_eval_208,4,2048,1024,bf16,NVIDIA GeForce RTX 4060,c04,64,64,64,4,3,8,0.0,0.0,121.824000030756,225.38112133741373,0.13771683737001233,7,-1,-1,llm8_g7,0,
2026-03-03T06:15:48.693959+00:00,BUCKET,llm_style,eval,llm_style_eval_209,1,1024,1536,bf16,NVIDIA GeForce RTX 4060,c04,64,64,64,4,3,8,0.0,0.0,105.47199845314026,147.48607754707336,0.029825243155865707,7,-1,-1,llm8_g7,0,
2026-03-03T06:15:48.829338+00:00,BUCKET,llm_style,eval,llm_style_eval_210,8,6144,4096,bf16,NVIDIA GeForce RTX 4060,c11,32,128,32,4,2,8,0.0,0.0,377.6320070028305,481.8022429943085,1.0662580939464221,5,-1,-1,llm8_g5,0,
2026-03-03T06:15:48.952699+00:00,BUCKET,llm_style,eval,llm_style_eval_211,4,2048,8192,bf16,NVIDIA GeForce RTX 4060,c06,64,128,32,4,3,8,0.0,0.0,675.8400201797485,744.7289532423017,0.19859393346416956,6,-1,-1,llm8_g6,0,
2026-03-03T06:15:48.963961+00:00,BUCKET,llm_style,eval,llm_style_eval_212,32,1024,1024,bf16,NVIDIA GeForce RTX 4060,c04,64,64,64,4,3,8,0.0,0.0,79.8719972372055,167.557120770216,0.8402051572680562,3,-1,-1,llm8_g3,0,
2026-03-03T06:15:49.050474+00:00,BUCKET,llm_style,eval,llm_style_eval_213,16,3072,4096,bf16,NVIDIA GeForce RTX 4060,c04,64,64,64,4,3,8,0.0,0.0,392.192006111145,507.63808280229534,1.0266736132451673,7,-1,-1,llm8_g7,0,
2026-03-03T06:15:49.141800+00:00,BUCKET,llm_style,eval,llm_style_eval_214,64,1024,8192,bf16,NVIDIA GeForce RTX 4060,c10,64,128,64,8,3,8,0.0,0.0,720.7359969615936,736.7782473564148,1.489785203634303,2,-1,-1,llm8_g2,0,
2026-03-03T06:15:49.185482+00:00,BUCKET,llm_style,eval,llm_style_eval_215,4,4096,1536,bf16,NVIDIA GeForce RTX 4060,c04,64,64,64,4,3,8,0.0,0.0,222.60800004005432,418.0787274241447,0.2260999065215254,7,-1,-1,llm8_g7,0,
2026-03-03T06:15:49.223132+00:00,BUCKET,llm_style,eval,llm_style_eval_216,16,1536,3072,bf16,NVIDIA GeForce RTX 4060,c04,64,64,64,4,3,8,0.0,0.0,167.88800060749054,190.39487645030022,0.8993790113268118,7,-1,-1,llm8_g7,0,
2026-03-03T06:15:49.293914+00:00,BUCKET,llm_style,eval,llm_style_eval_217,8,6144,2048,bf16,NVIDIA GeForce RTX 4060,c11,32,128,32,4,2,8,0.0,0.0,190.46400487422943,257.064965069294,1.0570322310136424,5,-1,-1,llm8_g5,0,
2026-03-03T06:15:49.373504+00:00,BUCKET,llm_style,eval,llm_style_eval_218,8,3072,4096,bf16,NVIDIA GeForce RTX 4060,c04,64,64,64,4,3,8,0.0,0.0,367.0080006122589,457.2160056233405,0.5485618614965835,7,-1,-1,llm8_g7,0,
2026-03-03T06:15:49.533233+00:00,BUCKET,llm_style,eval,llm_style_eval_219,64,8192,3072,bf16,NVIDIA GeForce RTX 4060,c06,64,128,32,4,3,8,0.0,0.0,736.0160052776337,795.8323282003403,4.376569869271956,1,-1,-1,llm8_g1,0,
2026-03-03T06:15:49.582354+00:00,BUCKET,llm_style,eval,llm_style_eval_220,2,4096,2048,bf16,NVIDIA GeForce RTX 4060,c04,64,64,64,4,3,8,0.0,0.0,301.4400005340576,310.1945599913597,0.11131380022741515,7,-1,-1,llm8_g7,0,
2026-03-03T06:15:49.664506+00:00,BUCKET,llm_style,eval,llm_style_eval_221,4,1024,8192,bf16,NVIDIA GeForce RTX 4060,c06,64,128,32,4,3,8,0.0,0.0,675.8400201797485,771.0905635356902,0.09929696673208478,6,-1,-1,llm8_g6,0,
2026-03-03T06:15:49.749225+00:00,BUCKET,llm_style,eval,llm_style_eval_222,64,6144,2048,bf16,NVIDIA GeForce RTX 4060,c06,64,128,32,4,3,8,0.0,0.0,348.6559987068176,438.66111934185017,4.619489531153465,1,-1,-1,llm8_g1,0,
2026-03-03T06:15:49.775778+00:00,BUCKET,llm_style,eval,llm_style_eval_223,4,2048,2048,bf16,NVIDIA GeForce RTX 4060,c04,64,64,64,4,3,8,0.0,0.0,196.60800695419312,210.2815991640091,0.17066666063004093,7,-1,-1,llm8_g7,0,
2026-03-03T06:15:49.802047+00:00,BUCKET,llm_style,eval,llm_style_eval_224,16,3072,1536,bf16,NVIDIA GeForce RTX 4060,c04,64,64,64,4,3,8,0.0,0.0,161.79199516773224,287.1481631696222,0.9332658506588118,7,-1,-1,llm8_g7,0,
2026-03-03T06:15:49.829251+00:00,BUCKET,llm_style,eval,llm_style_eval_225,1,2048,2048,bf16,NVIDIA GeForce RTX 4060,c04,64,64,64,4,3,8,0.0,0.0,196.00000232458115,261.25984162092203,0.04279901990056227,7,-1,-1,llm8_g7,0,
2026-03-03T06:15:49.843381+00:00,BUCKET,llm_style,eval,llm_style_eval_226,8,1536,1024,bf16,NVIDIA GeForce RTX 4060,c04,64,64,64,4,3,8,0.0,0.0,108.2719974219799,219.64192301034916,0.23243151137148205,7,-1,-1,llm8_g7,0,
2026-03-03T06:15:50.074858+00:00,BUCKET,llm_style,eval,llm_style_eval_227,64,6144,6144,bf16,NVIDIA GeForce RTX 4060,c06,64,128,32,4,3,8,0.0,0.0,1087.9039764404297,1184.901077747345,4.441419750858477,1,-1,-1,llm8_g1,0,
2026-03-03T06:15:50.155915+00:00,BUCKET,llm_style,eval,llm_style_eval_228,64,6144,2048,bf16,NVIDIA GeForce RTX 4060,c06,64,128,32,4,3,8,0.0,0.0,387.48799264431,465.5964806675911,4.156548761701741,1,-1,-1,llm8_g1,0,
2026-03-03T06:15:50.253610+00:00,BUCKET,llm_style,eval,llm_style_eval_229,16,1536,8192,bf16,NVIDIA GeForce RTX 4060,c06,64,128,32,4,3,8,0.0,0.0,637.7440094947815,677.754881978035,0.6313711740216587,6,-1,-1,llm8_g6,0,
2026-03-03T06:15:50.279509+00:00,BUCKET,llm_style,eval,llm_style_eval_230,64,2048,1536,bf16,NVIDIA GeForce RTX 4060,c04,64,64,64,4,3,8,0.0,0.0,150.52799880504608,165.2764755487442,2.6749387967449816,3,-1,-1,llm8_g3,0,
2026-03-03T06:15:50.360468+00:00,BUCKET,llm_style,eval,llm_style_eval_231,4,1024,8192,bf16,NVIDIA GeForce RTX 4060,c06,64,128,32,4,3,8,0.0,0.0,628.1439960002899,753.7468922138214,0.10683675148901531,6,-1,-1,llm8_g6,0,
2026-03-03T06:15:50.389523+00:00,BUCKET,llm_style,eval,llm_style_eval_232,16,3072,1536,bf16,NVIDIA GeForce RTX 4060,c04,64,64,64,4,3,8,0.0,0.0,151.31200104951859,666.1836624145501,0.997904613994135,7,-1,-1,llm8_g7,0,
2026-03-03T06:15:50.453322+00:00,BUCKET,llm_style,eval,llm_style_eval_233,64,3072,3072,bf16,NVIDIA GeForce RTX 4060,c04,64,64,64,4,3,8,0.0,0.0,224.2559939622879,361.543671786785,5.386520692968131,3,-1,-1,llm8_g3,0,
2026-03-03T06:15:50.659575+00:00,BUCKET,llm_style,eval,llm_style_eval_234,32,8192,4096,bf16,NVIDIA GeForce RTX 4060,c06,64,128,32,4,3,8,0.0,0.0,846.7360138893127,917.667852640152,2.536190279820464,1,-1,-1,llm8_g1,0,
2026-03-03T06:15:50.676992+00:00,BUCKET,llm_style,eval,llm_style_eval_235,4,2048,1024,bf16,NVIDIA GeForce RTX 4060,c04,64,64,64,4,3,8,0.0,0.0,127.88800150156021,179.78367745876312,0.13118678689959293,7,-1,-1,llm8_g7,0,
2026-03-03T06:15:50.810640+00:00,BUCKET,llm_style,eval,llm_style_eval_236,4,8192,3072,bf16,NVIDIA GeForce RTX 4060,c11,32,128,32,4,2,8,0.0,0.0,377.83999741077423,578.580496907234,0.5328355742632638,5,-1,-1,llm8_g5,0,
2026-03-03T06:15:50.838739+00:00,BUCKET,llm_style,eval,llm_style_eval_237,64,1024,4096,bf16,NVIDIA GeForce RTX 4060,c04,64,64,64,4,3,8,0.0,0.0,194.4960057735443,285.3990358114242,2.760318443891798,3,-1,-1,llm8_g3,0,
2026-03-03T06:15:50.927196+00:00,BUCKET,llm_style,eval,llm_style_eval_238,32,2048,6144,bf16,NVIDIA GeForce RTX 4060,c04,64,64,64,4,3,8,0.0,0.0,457.5999975204468,571.8326544761658,1.759847841703751,3,-1,-1,llm8_g3,0,
2026-03-03T06:15:50.956097+00:00,BUCKET,llm_style,eval,llm_style_eval_239,32,2048,6144,bf16,NVIDIA GeForce RTX 4060,c04,64,64,64,4,3,8,0.0,0.0,453.6319971084595,503.7206390500068,1.7752415463044557,3,-1,-1,llm8_g3,0,
2026-03-03T06:15:51.029562+00:00,BUCKET,llm_style,eval,llm_style_eval_240,8,8192,1536,bf16,NVIDIA GeForce RTX 4060,c11,32,128,32,4,2,8,0.0,0.0,199.68000054359436,261.68319523334503,1.0082461511013776,5,-1,-1,llm8_g5,0,
2026-03-03T06:15:51.044571+00:00,BUCKET,llm_style,eval,llm_style_eval_241,16,1536,1536,bf16,NVIDIA GeForce RTX 4060,c04,64,64,64,4,3,8,0.0,0.0,86.01599931716919,109.70624014735219,0.8777142926819471,7,-1,-1,llm8_g7,0,
2026-03-03T06:15:51.079430+00:00,BUCKET,llm_style,eval,llm_style_eval_242,1,2048,3072,bf16,NVIDIA GeForce RTX 4060,c04,64,64,64,4,3,8,0.0,0.0,229.37600314617157,300.6614449620247,0.05485714210471025,7,-1,-1,llm8_g7,0,
2026-03-03T06:15:51.130984+00:00,BUCKET,llm_style,eval,llm_style_eval_243,8,1536,6144,bf16,NVIDIA GeForce RTX 4060,c04,64,64,64,4,3,8,0.0,0.0,257.02399015426636,287.3241564631462,0.5874741260898351,7,-1,-1,llm8_g7,0,
2026-03-03T06:15:51.187470+00:00,BUCKET,llm_style,eval,llm_style_eval_244,32,8192,1024,bf16,NVIDIA GeForce RTX 4060,c06,64,128,32,4,3,8,0.0,0.0,219.64799612760544,327.1782425045967,2.4442331433249342,1,-1,-1,llm8_g1,0,
2026-03-03T06:15:51.325069+00:00,BUCKET,llm_style,eval,llm_style_eval_245,4,6144,4096,bf16,NVIDIA GeForce RTX 4060,c11,32,128,32,4,2,8,0.0,0.0,379.8559904098511,405.4784017801285,0.5300076794439276,5,-1,-1,llm8_g5,0,
2026-03-03T06:15:51.414201+00:00,BUCKET,llm_style,eval,llm_style_eval_246,32,2048,6144,bf16,NVIDIA GeForce RTX 4060,c04,64,64,64,4,3,8,0.0,0.0,430.07999658584595,616.3046473264692,1.872457157721487,3,-1,-1,llm8_g3,0,
2026-03-03T06:15:51.491944+00:00,BUCKET,llm_style,eval,llm_style_eval_247,64,6144,2048,bf16,NVIDIA GeForce RTX 4060,c06,64,128,32,4,3,8,0.0,0.0,277.45600044727325,287.7740877866745,5.804930271479478,1,-1,-1,llm8_g1,0,
2026-03-03T06:15:51.504123+00:00,BUCKET,llm_style,eval,llm_style_eval_248,64,1024,1024,bf16,NVIDIA GeForce RTX 4060,c04,64,64,64,4,3,8,0.0,0.0,63.48799914121628,117.35040232539164,2.1140645447253688,3,-1,-1,llm8_g3,0,
2026-03-03T06:15:51.555544+00:00,BUCKET,llm_style,eval,llm_style_eval_249,2,8192,1024,bf16,NVIDIA GeForce RTX 4060,c11,32,128,32,4,2,8,0.0,0.0,147.45600521564484,181.5347217023372,0.22755554750672122,5,-1,-1,llm8_g5,0,
2026-03-03T06:15:51.616891+00:00,BUCKET,llm_style,eval,llm_style_eval_250,64,3072,3072,bf16,NVIDIA GeForce RTX 4060,c04,64,64,64,4,3,8,0.0,0.0,230.79999536275864,367.29087978601433,5.233793658017177,3,-1,-1,llm8_g3,0,
2026-03-03T06:15:51.698805+00:00,BUCKET,llm_style,eval,llm_style_eval_251,64,1024,8192,bf16,NVIDIA GeForce RTX 4060,c10,64,128,64,8,3,8,0.0,0.0,552.3839890956879,721.8934458494185,1.9438322710218865,2,-1,-1,llm8_g2,0,
2026-03-03T06:15:51.776849+00:00,BUCKET,llm_style,eval,llm_style_eval_252,64,4096,3072,bf16,NVIDIA GeForce RTX 4060,c04,64,64,64,4,3,8,0.0,0.0,323.4879970550537,399.56735610961897,4.978894891503172,3,-1,-1,llm8_g3,0,
2026-03-03T06:15:51.911412+00:00,BUCKET,llm_style,eval,llm_style_eval_253,8,6144,4096,bf16,NVIDIA GeForce RTX 4060,c11,32,128,32,4,2,8,0.0,0.0,394.23999190330505,477.3478376865387,1.0213402807160123,5,-1,-1,llm8_g5,0,
2026-03-03T06:15:51.941853+00:00,BUCKET,llm_style,eval,llm_style_eval_254,4,1536,3072,bf16,NVIDIA GeForce RTX 4060,c04,64,64,64,4,3,8,0.0,0.0,142.33599603176117,233.4864003956318,0.2652086404873765,7,-1,-1,llm8_g7,0,
2026-03-03T06:15:51.968893+00:00,BUCKET,llm_style,eval,llm_style_eval_255,1,3072,1536,bf16,NVIDIA GeForce RTX 4060,c04,64,64,64,4,3,8,0.0,0.0,153.60000729560852,165.9558433294296,0.06143999708175673,7,-1,-1,llm8_g7,0,
2026-03-03T06:15:52.276725+00:00,TORCH,llm_style,tune,llm_style_tune_000,64,6144,6144,bf16,NVIDIA GeForce RTX 4060,torch_cublas,-1,-1,-1,-1,-1,-1,88.67740293499082,0.0,739.3280267715454,777.2364974021912,6.535445746726781,1,-1,-1,torch_mm,0,torch_mm_cublas
2026-03-03T06:15:52.365637+00:00,TORCH,llm_style,tune,llm_style_tune_001,64,8192,1536,bf16,NVIDIA GeForce RTX 4060,torch_cublas,-1,-1,-1,-1,-1,-1,0.0,0.0,296.9599962234497,325.6320059299469,5.423669034492049,1,-1,-1,torch_mm,0,torch_mm_cublas
2026-03-03T06:15:52.532859+00:00,TORCH,llm_style,tune,llm_style_tune_002,32,3072,8192,bf16,NVIDIA GeForce RTX 4060,torch_cublas,-1,-1,-1,-1,-1,-1,0.0,0.0,491.9839948415756,587.1276611089704,3.273709618376174,2,-1,-1,torch_mm,0,torch_mm_cublas
2026-03-03T06:15:52.645970+00:00,TORCH,llm_style,tune,llm_style_tune_003,4,6144,3072,bf16,NVIDIA GeForce RTX 4060,torch_cublas,-1,-1,-1,-1,-1,-1,0.0,0.0,424.9279946088791,453.56703221797943,0.3553424248712581,5,-1,-1,torch_mm,0,torch_mm_cublas
2026-03-03T06:15:52.695740+00:00,TORCH,llm_style,tune,llm_style_tune_004,8,8192,1024,bf16,NVIDIA GeForce RTX 4060,torch_cublas,-1,-1,-1,-1,-1,-1,0.0,0.0,178.17600071430206,199.12960305809975,0.7532873533019333,5,-1,-1,torch_mm,0,torch_mm_cublas
2026-03-03T06:15:52.846491+00:00,TORCH,llm_style,tune,llm_style_tune_005,32,8192,3072,bf16,NVIDIA GeForce RTX 4060,torch_cublas,-1,-1,-1,-1,-1,-1,0.0,0.0,696.3199973106384,709.5628881454468,2.3130353030511666,1,-1,-1,torch_mm,0,torch_mm_cublas
2026-03-03T06:15:53.160460+00:00,TORCH,llm_style,tune,llm_style_tune_006,32,6144,8192,bf16,NVIDIA GeForce RTX 4060,torch_cublas,-1,-1,-1,-1,-1,-1,0.0,0.0,1229.6319603919983,1256.3273859024048,2.6196663520140575,0,-1,-1,torch_mm,0,torch_mm_cublas
2026-03-03T06:15:53.185239+00:00,TORCH,llm_style,tune,llm_style_tune_007,8,1536,2048,bf16,NVIDIA GeForce RTX 4060,torch_cublas,-1,-1,-1,-1,-1,-1,0.0,0.0,79.8719972372055,160.203197300434,0.6301538679510421,7,-1,-1,torch_mm,0,torch_mm_cublas
2026-03-03T06:15:53.221588+00:00,TORCH,llm_style,tune,llm_style_tune_008,16,1536,4096,bf16,NVIDIA GeForce RTX 4060,torch_cublas,-1,-1,-1,-1,-1,-1,0.0,0.0,161.71199828386307,222.57952719926814,1.2449700339896796,7,-1,-1,torch_mm,0,torch_mm_cublas
2026-03-03T06:15:53.243154+00:00,TORCH,llm_style,tune,llm_style_tune_009,64,1536,2048,bf16,NVIDIA GeForce RTX 4060,torch_cublas,-1,-1,-1,-1,-1,-1,0.0,0.0,91.13600105047226,153.10783565044403,4.418157252445229,3,-1,-1,torch_mm,0,torch_mm_cublas
2026-03-03T06:15:53.258396+00:00,TORCH,llm_style,tune,llm_style_tune_010,2,2048,1024,bf16,NVIDIA GeForce RTX 4060,torch_cublas,-1,-1,-1,-1,-1,-1,0.0,0.0,85.91999858617783,97.2883228957653,0.09763277628067255,7,-1,-1,torch_mm,0,torch_mm_cublas
2026-03-03T06:15:53.404992+00:00,TORCH,llm_style,tune,llm_style_tune_011,2,3072,8192,bf16,NVIDIA GeForce RTX 4060,torch_cublas,-1,-1,-1,-1,-1,-1,0.0,0.0,582.6240181922913,668.3750534057615,0.17277574019747455,6,-1,-1,torch_mm,0,torch_mm_cublas
2026-03-03T06:15:53.426040+00:00,TORCH,llm_style,tune,llm_style_tune_012,64,2048,1536,bf16,NVIDIA GeForce RTX 4060,torch_cublas,-1,-1,-1,-1,-1,-1,0.0,0.0,122.8799968957901,137.6959978044033,3.276800082778933,3,-1,-1,torch_mm,0,torch_mm_cublas
2026-03-03T06:15:53.623745+00:00,TORCH,llm_style,tune,llm_style_tune_013,16,8192,4096,bf16,NVIDIA GeForce RTX 4060,torch_cublas,-1,-1,-1,-1,-1,-1,0.0,0.0,805.2639961242676,903.7555003166196,1.3334034914859165,5,-1,-1,torch_mm,0,torch_mm_cublas
2026-03-03T06:15:53.815422+00:00,TORCH,llm_style,tune,llm_style_tune_014,4,8192,4096,bf16,NVIDIA GeForce RTX 4060,torch_cublas,-1,-1,-1,-1,-1,-1,0.0,0.0,799.7440099716187,914.8211389780043,0.33565172436805907,5,-1,-1,torch_mm,0,torch_mm_cublas
2026-03-03T06:15:53.854935+00:00,TORCH,llm_style,tune,llm_style_tune_015,4,3072,2048,bf16,NVIDIA GeForce RTX 4060,torch_cublas,-1,-1,-1,-1,-1,-1,0.0,0.0,161.1199975013733,316.52863100171055,0.31238610216320917,7,-1,-1,torch_mm,0,torch_mm_cublas
2026-03-03T06:15:53.868177+00:00,TORCH,llm_style,tune,llm_style_tune_016,16,1536,1024,bf16,NVIDIA GeForce RTX 4060,torch_cublas,-1,-1,-1,-1,-1,-1,0.0,0.0,49.15200173854828,83.31135962158433,1.0239999637802455,7,-1,-1,torch_mm,0,torch_mm_cublas
2026-03-03T06:15:53.882277+00:00,TORCH,llm_style,tune,llm_style_tune_017,32,1024,2048,bf16,NVIDIA GeForce RTX 4060,torch_cublas,-1,-1,-1,-1,-1,-1,0.0,0.0,69.63200122117996,87.08095967769623,1.9275293779604168,3,-1,-1,torch_mm,0,torch_mm_cublas
2026-03-03T06:15:53.898928+00:00,TORCH,llm_style,tune,llm_style_tune_018,64,1536,2048,bf16,NVIDIA GeForce RTX 4060,torch_cublas,-1,-1,-1,-1,-1,-1,0.0,0.0,86.01599931716919,97.28000313043594,4.681142894303718,3,-1,-1,torch_mm,0,torch_mm_cublas
2026-03-03T06:15:53.932845+00:00,TORCH,llm_style,tune,llm_style_tune_019,4,4096,1536,bf16,NVIDIA GeForce RTX 4060,torch_cublas,-1,-1,-1,-1,-1,-1,0.0,0.0,195.5839991569519,208.8175992667675,0.25734031524536904,7,-1,-1,torch_mm,0,torch_mm_cublas
2026-03-03T06:15:54.003248+00:00,TORCH,llm_style,tune,llm_style_tune_020,1,8192,1536,bf16,NVIDIA GeForce RTX 4060,torch_cublas,-1,-1,-1,-1,-1,-1,0.0,0.0,217.96800196170807,228.7478418648243,0.11545650633812321,5,-1,-1,torch_mm,0,torch_mm_cublas
2026-03-03T06:15:54.046215+00:00,TORCH,llm_style,tune,llm_style_tune_021,64,1536,4096,bf16,NVIDIA GeForce RTX 4060,torch_cublas,-1,-1,-1,-1,-1,-1,0.0,0.0,167.93599724769592,211.25119686126703,4.795317151761212,3,-1,-1,torch_mm,0,torch_mm_cublas
2026-03-03T06:15:54.083534+00:00,TORCH,llm_style,tune,llm_style_tune_022,64,1024,6144,bf16,NVIDIA GeForce RTX 4060,torch_cublas,-1,-1,-1,-1,-1,-1,0.0,0.0,171.7119961977005,188.96735608577725,4.689866671125359,3,-1,-1,torch_mm,0,torch_mm_cublas
2026-03-03T06:15:54.109260+00:00,TORCH,llm_style,tune,llm_style_tune_023,8,4096,1024,bf16,NVIDIA GeForce RTX 4060,torch_cublas,-1,-1,-1,-1,-1,-1,0.0,0.0,134.92800295352936,140.20959839224815,0.4973679483206537,7,-1,-1,torch_mm,0,torch_mm_cublas
2026-03-03T06:15:54.209171+00:00,TORCH,llm_style,tune,llm_style_tune_024,8,4096,4096,bf16,NVIDIA GeForce RTX 4060,torch_cublas,-1,-1,-1,-1,-1,-1,0.0,0.0,414.5760089159012,508.9689528942106,0.6474939461691173,7,-1,-1,torch_mm,0,torch_mm_cublas
2026-03-03T06:15:54.243004+00:00,TORCH,llm_style,tune,llm_style_tune_025,32,6144,1024,bf16,NVIDIA GeForce RTX 4060,torch_cublas,-1,-1,-1,-1,-1,-1,0.0,0.0,184.32000279426575,216.6579185426234,2.1845333002161103,1,-1,-1,torch_mm,0,torch_mm_cublas
2026-03-03T06:15:54.264437+00:00,TORCH,llm_style,tune,llm_style_tune_026,1,3072,1536,bf16,NVIDIA GeForce RTX 4060,torch_cublas,-1,-1,-1,-1,-1,-1,0.0,0.0,73.72800260782242,142.18208387494082,0.1279999954725307,7,-1,-1,torch_mm,0,torch_mm_cublas
2026-03-03T06:15:54.322960+00:00,TORCH,llm_style,tune,llm_style_tune_027,1,6144,1536,bf16,NVIDIA GeForce RTX 4060,torch_cublas,-1,-1,-1,-1,-1,-1,0.0,0.0,152.5759994983673,179.7427174448967,0.12370469839328808,5,-1,-1,torch_mm,0,torch_mm_cublas
2026-03-03T06:15:54.357305+00:00,TORCH,llm_style,tune,llm_style_tune_028,4,4096,1536,bf16,NVIDIA GeForce RTX 4060,torch_cublas,-1,-1,-1,-1,-1,-1,0.0,0.0,195.5839991569519,221.18400037288666,0.25734031524536904,7,-1,-1,torch_mm,0,torch_mm_cublas
2026-03-03T06:15:54.389139+00:00,TORCH,llm_style,tune,llm_style_tune_029,16,1024,6144,bf16,NVIDIA GeForce RTX 4060,torch_cublas,-1,-1,-1,-1,-1,-1,0.0,0.0,161.5999937057495,190.76223969459534,1.2458329198117852,7,-1,-1,torch_mm,0,torch_mm_cublas
2026-03-03T06:15:54.610058+00:00,TORCH,llm_style,tune,llm_style_tune_030,64,4096,8192,bf16,NVIDIA GeForce RTX 4060,torch_cublas,-1,-1,-1,-1,-1,-1,0.0,0.0,1150.9759426116943,1206.282241344452,3.731587374671129,2,-1,-1,torch_mm,0,torch_mm_cublas
2026-03-03T06:15:54.647002+00:00,TORCH,llm_style,tune,llm_style_tune_031,1,6144,1024,bf16,NVIDIA GeForce RTX 4060,torch_cublas,-1,-1,-1,-1,-1,-1,0.0,0.0,110.59200018644333,190.91712042689323,0.11377777758596365,5,-1,-1,torch_mm,0,torch_mm_cublas
2026-03-03T06:15:54.676025+00:00,TORCH,llm_style,tune,llm_style_tune_032,64,1024,4096,bf16,NVIDIA GeForce RTX 4060,torch_cublas,-1,-1,-1,-1,-1,-1,0.0,0.0,131.93600624799728,144.89823654294014,4.069176620299202,3,-1,-1,torch_mm,0,torch_mm_cublas
2026-03-03T06:15:54.863354+00:00,TORCH,llm_style,tune,llm_style_tune_033,2,4096,8192,bf16,NVIDIA GeForce RTX 4060,torch_cublas,-1,-1,-1,-1,-1,-1,0.0,0.0,702.4639844894409,757.9238283634186,0.19106705961238857,6,-1,-1,torch_mm,0,torch_mm_cublas
2026-03-03T06:15:55.195560+00:00,TORCH,llm_style,tune,llm_style_tune_034,1,8192,6144,bf16,NVIDIA GeForce RTX 4060,torch_cublas,-1,-1,-1,-1,-1,-1,0.0,0.0,1875.3119707107544,1918.3088040351868,0.05367815999268005,5,-1,-1,torch_mm,0,torch_mm_cublas
2026-03-03T06:15:55.211136+00:00,TORCH,llm_style,tune,llm_style_tune_035,64,1536,1024,bf16,NVIDIA GeForce RTX 4060,torch_cublas,-1,-1,-1,-1,-1,-1,0.0,0.0,50.175998359918594,99.69664014875882,4.012408294417177,3,-1,-1,torch_mm,0,torch_mm_cublas
2026-03-03T06:15:55.249301+00:00,TORCH,llm_style,tune,llm_style_tune_036,32,3072,2048,bf16,NVIDIA GeForce RTX 4060,torch_cublas,-1,-1,-1,-1,-1,-1,0.0,0.0,143.16800236701965,155.66848054528236,2.812452345097159,3,-1,-1,torch_mm,0,torch_mm_cublas
2026-03-03T06:15:55.305015+00:00,TORCH,llm_style,tune,llm_style_tune_037,4,1536,6144,bf16,NVIDIA GeForce RTX 4060,torch_cublas,-1,-1,-1,-1,-1,-1,0.0,0.0,212.99199759960175,291.3996782898903,0.35446154245628414,7,-1,-1,torch_mm,0,torch_mm_cublas
2026-03-03T06:15:55.334969+00:00,TORCH,llm_style,tune,llm_style_tune_038,1,4096,1536,bf16,NVIDIA GeForce RTX 4060,torch_cublas,-1,-1,-1,-1,-1,-1,0.0,0.0,135.16800105571747,236.01152539253226,0.09309090836383095,7,-1,-1,torch_mm,0,torch_mm_cublas
2026-03-03T06:15:55.366260+00:00,TORCH,llm_style,tune,llm_style_tune_039,4,1536,4096,bf16,NVIDIA GeForce RTX 4060,torch_cublas,-1,-1,-1,-1,-1,-1,0.0,0.0,144.19200271368027,187.48223617672917,0.34905991353724897,7,-1,-1,torch_mm,0,torch_mm_cublas
2026-03-03T06:15:55.650185+00:00,TORCH,llm_style,tune,llm_style_tune_040,2,6144,8192,bf16,NVIDIA GeForce RTX 4060,torch_cublas,-1,-1,-1,-1,-1,-1,0.0,0.0,1046.4800000190735,1074.5241141319275,0.19238455775201682,4,-1,-1,torch_mm,0,torch_mm_cublas
2026-03-03T06:15:55.662215+00:00,TORCH,llm_style,tune,llm_style_tune_041,16,1024,1536,bf16,NVIDIA GeForce RTX 4060,torch_cublas,-1,-1,-1,-1,-1,-1,0.0,0.0,50.175998359918594,55.296000093221664,1.0031020736042942,7,-1,-1,torch_mm,0,torch_mm_cublas
2026-03-03T06:15:55.693997+00:00,TORCH,llm_style,tune,llm_style_tune_042,32,3072,2048,bf16,NVIDIA GeForce RTX 4060,torch_cublas,-1,-1,-1,-1,-1,-1,0.0,0.0,144.896000623703,199.0656001865863,2.778911648815595,3,-1,-1,torch_mm,0,torch_mm_cublas
2026-03-03T06:15:55.736369+00:00,TORCH,llm_style,tune,llm_style_tune_043,2,2048,4096,bf16,NVIDIA GeForce RTX 4060,torch_cublas,-1,-1,-1,-1,-1,-1,0.0,0.0,186.87999993562698,236.00832045078275,0.1795506849933552,7,-1,-1,torch_mm,0,torch_mm_cublas
2026-03-03T06:15:55.837885+00:00,TORCH,llm_style,tune,llm_style_tune_044,64,2048,8192,bf16,NVIDIA GeForce RTX 4060,torch_cublas,-1,-1,-1,-1,-1,-1,0.0,0.0,477.183997631073,487.42398619651794,4.500326202598881,2,-1,-1,torch_mm,0,torch_mm_cublas
2026-03-03T06:15:55.976570+00:00,TORCH,llm_style,tune,llm_style_tune_045,2,3072,8192,bf16,NVIDIA GeForce RTX 4060,torch_cublas,-1,-1,-1,-1,-1,-1,0.0,0.0,480.25599122047424,588.8921618461605,0.2096034153456044,6,-1,-1,torch_mm,0,torch_mm_cublas
2026-03-03T06:15:56.247365+00:00,TORCH,llm_style,tune,llm_style_tune_046,4,8192,6144,bf16,NVIDIA GeForce RTX 4060,torch_cublas,-1,-1,-1,-1,-1,-1,0.0,0.0,879.6160221099854,953.8175827264783,0.45776017475685893,5,-1,-1,torch_mm,0,torch_mm_cublas
2026-03-03T06:15:56.277308+00:00,TORCH,llm_style,tune,llm_style_tune_047,1,1024,6144,bf16,NVIDIA GeForce RTX 4060,torch_cublas,-1,-1,-1,-1,-1,-1,0.0,0.0,117.76000261306763,153.24160337448114,0.10685217154201808,7,-1,-1,torch_mm,0,torch_mm_cublas
2026-03-03T06:15:56.352217+00:00,TORCH,llm_style,tune,llm_style_tune_048,32,4096,3072,bf16,NVIDIA GeForce RTX 4060,torch_cublas,-1,-1,-1,-1,-1,-1,0.0,0.0,319.95199620723724,342.0774367451668,2.5169599738280493,3,-1,-1,torch_mm,0,torch_mm_cublas
2026-03-03T06:15:56.365926+00:00,TORCH,llm_style,tune,llm_style_tune_049,16,2048,1024,bf16,NVIDIA GeForce RTX 4060,torch_cublas,-1,-1,-1,-1,-1,-1,0.0,0.0,71.35999947786331,97.78592318296432,0.9404269127106417,7,-1,-1,torch_mm,0,torch_mm_cublas
2026-03-03T06:15:56.376462+00:00,TORCH,llm_style,tune,llm_style_tune_050,4,1024,1536,bf16,NVIDIA GeForce RTX 4060,torch_cublas,-1,-1,-1,-1,-1,-1,0.0,0.0,48.49600046873093,159.56991806626314,0.25946288102898635,7,-1,-1,torch_mm,0,torch_mm_cublas
2026-03-03T06:15:56.574553+00:00,TORCH,llm_style,tune,llm_style_tune_051,64,4096,8192,bf16,NVIDIA GeForce RTX 4060,torch_cublas,-1,-1,-1,-1,-1,-1,0.0,0.0,803.1840026378632,939.9708658456802,5.347426345512636,2,-1,-1,torch_mm,0,torch_mm_cublas
2026-03-03T06:15:56.592571+00:00,TORCH,llm_style,tune,llm_style_tune_052,16,2048,1536,bf16,NVIDIA GeForce RTX 4060,torch_cublas,-1,-1,-1,-1,-1,-1,0.0,0.0,89.08800035715103,103.04512128233907,1.1299310299529002,7,-1,-1,torch_mm,0,torch_mm_cublas
2026-03-03T06:15:56.601496+00:00,TORCH,llm_style,tune,llm_style_tune_053,64,1024,1024,bf16,NVIDIA GeForce RTX 4060,torch_cublas,-1,-1,-1,-1,-1,-1,0.0,0.0,35.58399900794029,62.5638415664434,3.771856220264911,3,-1,-1,torch_mm,0,torch_mm_cublas
2026-03-03T06:15:56.804059+00:00,TORCH,llm_style,tune,llm_style_tune_054,4,4096,8192,bf16,NVIDIA GeForce RTX 4060,torch_cublas,-1,-1,-1,-1,-1,-1,0.0,0.0,509.42400097846985,570.8902359008789,0.526939161650032,6,-1,-1,torch_mm,0,torch_mm_cublas
2026-03-03T06:15:56.875398+00:00,TORCH,llm_style,tune,llm_style_tune_055,1,4096,3072,bf16,NVIDIA GeForce RTX 4060,torch_cublas,-1,-1,-1,-1,-1,-1,0.0,0.0,222.20799326896667,257.1059101819992,0.11325345965182536,7,-1,-1,torch_mm,0,torch_mm_cublas
2026-03-03T06:15:56.893224+00:00,TORCH,llm_style,tune,llm_style_tune_056,64,1536,2048,bf16,NVIDIA GeForce RTX 4060,torch_cublas,-1,-1,-1,-1,-1,-1,0.0,0.0,64.51199948787689,88.72960023581979,6.241523859071623,3,-1,-1,torch_mm,0,torch_mm_cublas
2026-03-03T06:15:56.933252+00:00,TORCH,llm_style,tune,llm_style_tune_057,2,4096,2048,bf16,NVIDIA GeForce RTX 4060,torch_cublas,-1,-1,-1,-1,-1,-1,0.0,0.0,179.1040003299713,202.2502376139164,0.18734607791105262,7,-1,-1,torch_mm,0,torch_mm_cublas
2026-03-03T06:15:57.006518+00:00,TORCH,llm_style,tune,llm_style_tune_058,4,8192,1536,bf16,NVIDIA GeForce RTX 4060,torch_cublas,-1,-1,-1,-1,-1,-1,0.0,0.0,218.86400133371353,253.39903607964507,0.4599353725901837,5,-1,-1,torch_mm,0,torch_mm_cublas
2026-03-03T06:15:57.037565+00:00,TORCH,llm_style,tune,llm_style_tune_059,1,1536,4096,bf16,NVIDIA GeForce RTX 4060,torch_cublas,-1,-1,-1,-1,-1,-1,0.0,0.0,135.00800728797913,219.22655507922167,0.09320122748838143,7,-1,-1,torch_mm,0,torch_mm_cublas
2026-03-03T06:15:57.072032+00:00,TORCH,llm_style,tune,llm_style_tune_060,64,1536,4096,bf16,NVIDIA GeForce RTX 4060,torch_cublas,-1,-1,-1,-1,-1,-1,0.0,0.0,118.78400295972824,130.10943934321404,6.779586037970331,3,-1,-1,torch_mm,0,torch_mm_cublas
2026-03-03T06:15:57.332993+00:00,TORCH,llm_style,tune,llm_style_tune_061,8,8192,6144,bf16,NVIDIA GeForce RTX 4060,torch_cublas,-1,-1,-1,-1,-1,-1,0.0,0.0,824.3200182914734,875.6223905086517,0.9769341398127368,5,-1,-1,torch_mm,0,torch_mm_cublas
2026-03-03T06:15:57.387410+00:00,TORCH,llm_style,tune,llm_style_tune_062,64,6144,1536,bf16,NVIDIA GeForce RTX 4060,torch_cublas,-1,-1,-1,-1,-1,-1,0.0,0.0,164.63999450206757,175.6188789010048,7.336975172122168,1,-1,-1,torch_mm,0,torch_mm_cublas
2026-03-03T06:15:57.400933+00:00,TORCH,llm_style,tune,llm_style_tune_063,2,1536,1024,bf16,NVIDIA GeForce RTX 4060,torch_cublas,-1,-1,-1,-1,-1,-1,0.0,0.0,30.719999223947525,35.338240787386894,0.20480000517368332,7,-1,-1,torch_mm,0,torch_mm_cublas
2026-03-03T06:15:57.411769+00:00,TORCH,llm_style,eval,llm_style_eval_000,32,1536,1024,bf16,NVIDIA GeForce RTX 4060,torch_cublas,-1,-1,-1,-1,-1,-1,0.0,0.0,39.88800011575222,142.98112004995343,2.5236486088016967,3,-1,-1,torch_mm,0,torch_mm_cublas
2026-03-03T06:15:57.510191+00:00,TORCH,llm_style,eval,llm_style_eval_001,32,2048,8192,bf16,NVIDIA GeForce RTX 4060,torch_cublas,-1,-1,-1,-1,-1,-1,0.0,0.0,403.4560024738312,422.5126525759697,2.6613603897729705,2,-1,-1,torch_mm,0,torch_mm_cublas
2026-03-03T06:15:57.549522+00:00,TORCH,llm_style,eval,llm_style_eval_002,16,2048,4096,bf16,NVIDIA GeForce RTX 4060,torch_cublas,-1,-1,-1,-1,-1,-1,0.0,0.0,148.47999811172485,166.9120043516159,1.8078896781640164,7,-1,-1,torch_mm,0,torch_mm_cublas
2026-03-03T06:15:57.568391+00:00,TORCH,llm_style,eval,llm_style_eval_003,16,2048,1536,bf16,NVIDIA GeForce RTX 4060,torch_cublas,-1,-1,-1,-1,-1,-1,0.0,0.0,84.99199897050858,90.09632058441639,1.1843855565149046,7,-1,-1,torch_mm,0,torch_mm_cublas
2026-03-03T06:15:57.660251+00:00,TORCH,llm_style,eval,llm_style_eval_004,64,8192,2048,bf16,NVIDIA GeForce RTX 4060,torch_cublas,-1,-1,-1,-1,-1,-1,0.0,0.0,318.83201003074646,329.26720321178436,6.735470656766577,1,-1,-1,torch_mm,0,torch_mm_cublas
2026-03-03T06:15:57.796518+00:00,TORCH,llm_style,eval,llm_style_eval_005,64,3072,8192,bf16,NVIDIA GeForce RTX 4060,torch_cublas,-1,-1,-1,-1,-1,-1,0.0,0.0,427.0080029964447,473.208315372467,7.54371217727931,2,-1,-1,torch_mm,0,torch_mm_cublas
2026-03-03T06:15:57.819310+00:00,TORCH,llm_style,eval,llm_style_eval_006,32,2048,2048,bf16,NVIDIA GeForce RTX 4060,torch_cublas,-1,-1,-1,-1,-1,-1,0.0,0.0,93.07200089097023,142.99487538635717,2.8841698193902627,3,-1,-1,torch_mm,0,torch_mm_cublas
2026-03-03T06:15:57.909260+00:00,TORCH,llm_style,eval,llm_style_eval_007,8,8192,2048,bf16,NVIDIA GeForce RTX 4060,torch_cublas,-1,-1,-1,-1,-1,-1,0.0,0.0,297.9840040206909,317.3840054869652,0.9008384758175169,5,-1,-1,torch_mm,0,torch_mm_cublas
2026-03-03T06:15:57.983213+00:00,TORCH,llm_style,eval,llm_style_eval_008,64,1536,8192,bf16,NVIDIA GeForce RTX 4060,torch_cublas,-1,-1,-1,-1,-1,-1,0.0,0.0,222.1119999885559,317.8947192430495,7.251353983949473,2,-1,-1,torch_mm,0,torch_mm_cublas
2026-03-03T06:15:58.144021+00:00,TORCH,llm_style,eval,llm_style_eval_009,64,4096,6144,bf16,NVIDIA GeForce RTX 4060,torch_cublas,-1,-1,-1,-1,-1,-1,0.0,0.0,807.9360127449036,874.3014192581177,3.9869809256999473,3,-1,-1,torch_mm,0,torch_mm_cublas
2026-03-03T06:15:58.187774+00:00,TORCH,llm_style,eval,llm_style_eval_010,64,2048,4096,bf16,NVIDIA GeForce RTX 4060,torch_cublas,-1,-1,-1,-1,-1,-1,0.0,0.0,211.96800470352173,252.98944383859634,5.065584428658635,3,-1,-1,torch_mm,0,torch_mm_cublas
2026-03-03T06:15:58.294012+00:00,TORCH,llm_style,eval,llm_style_eval_011,32,3072,6144,bf16,NVIDIA GeForce RTX 4060,torch_cublas,-1,-1,-1,-1,-1,-1,0.0,0.0,365.35999178886414,460.4198500514028,3.3062173723116928,3,-1,-1,torch_mm,0,torch_mm_cublas
2026-03-03T06:15:58.307140+00:00,TORCH,llm_style,eval,llm_style_eval_012,16,1536,1536,bf16,NVIDIA GeForce RTX 4060,torch_cublas,-1,-1,-1,-1,-1,-1,0.0,0.0,52.73599922657013,105.23616261780259,1.4316116714815539,7,-1,-1,torch_mm,0,torch_mm_cublas
2026-03-03T06:15:58.340298+00:00,TORCH,llm_style,eval,llm_style_eval_013,64,2048,3072,bf16,NVIDIA GeForce RTX 4060,torch_cublas,-1,-1,-1,-1,-1,-1,0.0,0.0,187.27999925613403,191.48799777030945,4.300012661248576,3,-1,-1,torch_mm,0,torch_mm_cublas
2026-03-03T06:15:58.613455+00:00,TORCH,llm_style,eval,llm_style_eval_014,16,8192,6144,bf16,NVIDIA GeForce RTX 4060,torch_cublas,-1,-1,-1,-1,-1,-1,0.0,0.0,1043.3759689331055,1080.002555847168,1.5436551961676073,5,-1,-1,torch_mm,0,torch_mm_cublas
2026-03-03T06:15:58.678392+00:00,TORCH,llm_style,eval,llm_style_eval_015,64,6144,1536,bf16,NVIDIA GeForce RTX 4060,torch_cublas,-1,-1,-1,-1,-1,-1,0.0,0.0,209.9200040102005,218.17343935370445,5.7543803778762435,1,-1,-1,torch_mm,0,torch_mm_cublas
2026-03-03T06:15:58.782056+00:00,TORCH,llm_style,eval,llm_style_eval_016,16,4096,4096,bf16,NVIDIA GeForce RTX 4060,torch_cublas,-1,-1,-1,-1,-1,-1,0.0,0.0,366.8159991502762,472.0175954699515,1.463597316484705,7,-1,-1,torch_mm,0,torch_mm_cublas
2026-03-03T06:15:58.986681+00:00,TORCH,llm_style,eval,llm_style_eval_017,64,8192,4096,bf16,NVIDIA GeForce RTX 4060,torch_cublas,-1,-1,-1,-1,-1,-1,0.0,0.0,788.8639867305756,818.2172620296478,5.444496603020719,1,-1,-1,torch_mm,0,torch_mm_cublas
2026-03-03T06:15:59.146770+00:00,TORCH,llm_style,eval,llm_style_eval_018,32,4096,6144,bf16,NVIDIA GeForce RTX 4060,torch_cublas,-1,-1,-1,-1,-1,-1,0.0,0.0,798.7200021743774,913.2483160495757,2.016492302202755,3,-1,-1,torch_mm,0,torch_mm_cublas
2026-03-03T06:15:59.287469+00:00,TORCH,llm_style,eval,llm_style_eval_019,16,3072,8192,bf16,NVIDIA GeForce RTX 4060,torch_cublas,-1,-1,-1,-1,-1,-1,0.0,0.0,549.3760108947754,568.752943277359,1.465856448097156,6,-1,-1,torch_mm,0,torch_mm_cublas
2026-03-03T06:15:59.302040+00:00,TORCH,llm_style,eval,llm_style_eval_020,4,1536,1536,bf16,NVIDIA GeForce RTX 4060,torch_cublas,-1,-1,-1,-1,-1,-1,0.0,0.0,72.7040022611618,141.4323222637176,0.25960562572884127,7,-1,-1,torch_mm,0,torch_mm_cublas
2026-03-03T06:15:59.365474+00:00,TORCH,llm_style,eval,llm_style_eval_021,4,6144,1536,bf16,NVIDIA GeForce RTX 4060,torch_cublas,-1,-1,-1,-1,-1,-1,0.0,0.0,237.31200397014618,246.86592161655426,0.31813591700779525,5,-1,-1,torch_mm,0,torch_mm_cublas
2026-03-03T06:15:59.398366+00:00,TORCH,llm_style,eval,llm_style_eval_022,32,6144,1024,bf16,NVIDIA GeForce RTX 4060,torch_cublas,-1,-1,-1,-1,-1,-1,0.0,0.0,175.10400712490082,232.5443202257156,2.299508678363879,1,-1,-1,torch_mm,0,torch_mm_cublas
2026-03-03T06:15:59.408905+00:00,TORCH,llm_style,eval,llm_style_eval_023,16,1024,1536,bf16,NVIDIA GeForce RTX 4060,torch_cublas,-1,-1,-1,-1,-1,-1,0.0,0.0,56.32000043988228,69.6934412419796,0.8936727202927771,7,-1,-1,torch_mm,0,torch_mm_cublas
2026-03-03T06:15:59.450322+00:00,TORCH,llm_style,eval,llm_style_eval_024,32,8192,1024,bf16,NVIDIA GeForce RTX 4060,torch_cublas,-1,-1,-1,-1,-1,-1,0.0,0.0,237.31200397014618,261.59327894449234,2.2622998542776553,1,-1,-1,torch_mm,0,torch_mm_cublas
2026-03-03T06:15:59.673535+00:00,TORCH,llm_style,eval,llm_style_eval_025,32,6144,6144,bf16,NVIDIA GeForce RTX 4060,torch_cublas,-1,-1,-1,-1,-1,-1,0.0,0.0,1037.3120307922363,1052.174390554428,2.3290186870337046,1,-1,-1,torch_mm,0,torch_mm_cublas
2026-03-03T06:15:59.743638+00:00,TORCH,llm_style,eval,llm_style_eval_026,1,6144,2048,bf16,NVIDIA GeForce RTX 4060,torch_cublas,-1,-1,-1,-1,-1,-1,0.0,0.0,200.19199699163437,243.1132841110229,0.1257084417867695,5,-1,-1,torch_mm,0,torch_mm_cublas
2026-03-03T06:15:59.822535+00:00,TORCH,llm_style,eval,llm_style_eval_027,32,4096,3072,bf16,NVIDIA GeForce RTX 4060,torch_cublas,-1,-1,-1,-1,-1,-1,0.0,0.0,382.9759955406189,416.3046345114708,2.1027593827733475,3,-1,-1,torch_mm,0,torch_mm_cublas
2026-03-03T06:15:59.840446+00:00,TORCH,llm_style,eval,llm_style_eval_028,64,1536,1536,bf16,NVIDIA GeForce RTX 4060,torch_cublas,-1,-1,-1,-1,-1,-1,0.0,0.0,64.20799717307091,68.60800087451935,4.703306461747973,3,-1,-1,torch_mm,0,torch_mm_cublas
2026-03-03T06:15:59.857637+00:00,TORCH,llm_style,eval,llm_style_eval_029,2,3072,1024,bf16,NVIDIA GeForce RTX 4060,torch_cublas,-1,-1,-1,-1,-1,-1,0.0,0.0,80.89599758386612,135.1001599431038,0.15554430844313533,7,-1,-1,torch_mm,0,torch_mm_cublas
2026-03-03T06:15:59.934253+00:00,TORCH,llm_style,eval,llm_style_eval_030,32,1536,8192,bf16,NVIDIA GeForce RTX 4060,torch_cublas,-1,-1,-1,-1,-1,-1,0.0,0.0,290.800005197525,338.1884747743605,2.7692790701740115,2,-1,-1,torch_mm,0,torch_mm_cublas
2026-03-03T06:15:59.966453+00:00,TORCH,llm_style,eval,llm_style_eval_031,8,3072,2048,bf16,NVIDIA GeForce RTX 4060,torch_cublas,-1,-1,-1,-1,-1,-1,0.0,0.0,148.47999811172485,199.76192057132718,0.6779586293115061,7,-1,-1,torch_mm,0,torch_mm_cublas
2026-03-03T06:16:00.001601+00:00,TORCH,llm_style,eval,llm_style_eval_032,8,2048,3072,bf16,NVIDIA GeForce RTX 4060,torch_cublas,-1,-1,-1,-1,-1,-1,0.0,0.0,215.03999829292297,260.6694385409354,0.46811428943037175,7,-1,-1,torch_mm,0,torch_mm_cublas
2026-03-03T06:16:00.079226+00:00,TORCH,llm_style,eval,llm_style_eval_033,64,1536,8192,bf16,NVIDIA GeForce RTX 4060,torch_cublas,-1,-1,-1,-1,-1,-1,0.0,0.0,293.8559949398041,305.6089624762535,5.480959258054039,2,-1,-1,torch_mm,0,torch_mm_cublas
2026-03-03T06:16:00.154584+00:00,TORCH,llm_style,eval,llm_style_eval_034,64,6144,2048,bf16,NVIDIA GeForce RTX 4060,torch_cublas,-1,-1,-1,-1,-1,-1,0.0,0.0,290.17600417137146,300.03198981285095,5.550468380730779,1,-1,-1,torch_mm,0,torch_mm_cublas
2026-03-03T06:16:00.197911+00:00,TORCH,llm_style,eval,llm_style_eval_035,4,4096,2048,bf16,NVIDIA GeForce RTX 4060,torch_cublas,-1,-1,-1,-1,-1,-1,0.0,0.0,243.42399835586548,309.330236017704,0.27568713213679313,7,-1,-1,torch_mm,0,torch_mm_cublas
2026-03-03T06:16:00.396535+00:00,TORCH,llm_style,eval,llm_style_eval_036,64,8192,4096,bf16,NVIDIA GeForce RTX 4060,torch_cublas,-1,-1,-1,-1,-1,-1,0.0,0.0,832.5120210647583,891.5865528583527,5.159045379917594,1,-1,-1,torch_mm,0,torch_mm_cublas
2026-03-03T06:16:00.429870+00:00,TORCH,llm_style,eval,llm_style_eval_037,32,6144,1024,bf16,NVIDIA GeForce RTX 4060,torch_cublas,-1,-1,-1,-1,-1,-1,0.0,0.0,169.98399794101715,296.7449522018432,2.3687711130298092,1,-1,-1,torch_mm,0,torch_mm_cublas
2026-03-03T06:16:00.505761+00:00,TORCH,llm_style,eval,llm_style_eval_038,64,6144,2048,bf16,NVIDIA GeForce RTX 4060,torch_cublas,-1,-1,-1,-1,-1,-1,0.0,0.0,289.792001247406,382.402241528034,5.55782329763119,1,-1,-1,torch_mm,0,torch_mm_cublas
2026-03-03T06:16:00.524400+00:00,TORCH,llm_style,eval,llm_style_eval_039,8,1024,3072,bf16,NVIDIA GeForce RTX 4060,torch_cublas,-1,-1,-1,-1,-1,-1,0.0,0.0,95.23200243711472,116.23424209654331,0.5285161155068212,7,-1,-1,torch_mm,0,torch_mm_cublas
2026-03-03T06:16:00.625028+00:00,TORCH,llm_style,eval,llm_style_eval_040,32,8192,2048,bf16,NVIDIA GeForce RTX 4060,torch_cublas,-1,-1,-1,-1,-1,-1,0.0,0.0,430.07999658584595,500.5520009994505,2.4966095436286495,1,-1,-1,torch_mm,0,torch_mm_cublas
2026-03-03T06:16:00.647821+00:00,TORCH,llm_style,eval,llm_style_eval_041,32,3072,1024,bf16,NVIDIA GeForce RTX 4060,torch_cublas,-1,-1,-1,-1,-1,-1,0.0,0.0,84.33599770069122,131.24608322978006,2.387196422511166,3,-1,-1,torch_mm,0,torch_mm_cublas
2026-03-03T06:16:00.671695+00:00,TORCH,llm_style,eval,llm_style_eval_042,64,1024,4096,bf16,NVIDIA GeForce RTX 4060,torch_cublas,-1,-1,-1,-1,-1,-1,0.0,0.0,123.90399724245071,130.45600607991219,4.332958774118247,3,-1,-1,torch_mm,0,torch_mm_cublas
2026-03-03T06:16:00.685446+00:00,TORCH,llm_style,eval,llm_style_eval_043,2,1536,1024,bf16,NVIDIA GeForce RTX 4060,torch_cublas,-1,-1,-1,-1,-1,-1,0.0,0.0,44.03200000524521,138.33472117781633,0.1428837209132119,7,-1,-1,torch_mm,0,torch_mm_cublas
2026-03-03T06:16:00.820144+00:00,TORCH,llm_style,eval,llm_style_eval_044,64,6144,3072,bf16,NVIDIA GeForce RTX 4060,torch_cublas,-1,-1,-1,-1,-1,-1,0.0,0.0,428.0320107936859,523.4790569543836,5.644248661496694,1,-1,-1,torch_mm,0,torch_mm_cublas
2026-03-03T06:16:00.880106+00:00,TORCH,llm_style,eval,llm_style_eval_045,64,1536,6144,bf16,NVIDIA GeForce RTX 4060,torch_cublas,-1,-1,-1,-1,-1,-1,0.0,0.0,229.37600314617157,262.3331153392791,5.266285642052185,3,-1,-1,torch_mm,0,torch_mm_cublas
2026-03-03T06:16:00.993254+00:00,TORCH,llm_style,eval,llm_style_eval_046,2,6144,3072,bf16,NVIDIA GeForce RTX 4060,torch_cublas,-1,-1,-1,-1,-1,-1,0.0,0.0,474.11200404167175,484.8742365837097,0.15923973946326025,5,-1,-1,torch_mm,0,torch_mm_cublas
2026-03-03T06:16:01.189541+00:00,TORCH,llm_style,eval,llm_style_eval_047,16,4096,8192,bf16,NVIDIA GeForce RTX 4060,torch_cublas,-1,-1,-1,-1,-1,-1,0.0,0.0,740.3519749641418,767.4198532104492,1.4503126354893638,6,-1,-1,torch_mm,0,torch_mm_cublas
2026-03-03T06:16:01.222328+00:00,TORCH,llm_style,eval,llm_style_eval_048,16,1024,6144,bf16,NVIDIA GeForce RTX 4060,torch_cublas,-1,-1,-1,-1,-1,-1,0.0,0.0,156.49599581956863,195.3408016264438,1.2864648130174436,7,-1,-1,torch_mm,0,torch_mm_cublas
2026-03-03T06:16:01.300331+00:00,TORCH,llm_style,eval,llm_style_eval_049,16,8192,1536,bf16,NVIDIA GeForce RTX 4060,torch_cublas,-1,-1,-1,-1,-1,-1,0.0,0.0,295.82400619983673,461.25312924385025,1.3611240993335658,5,-1,-1,torch_mm,0,torch_mm_cublas
2026-03-03T06:16:01.311965+00:00,TORCH,llm_style,eval,llm_style_eval_050,1,1024,1024,bf16,NVIDIA GeForce RTX 4060,torch_cublas,-1,-1,-1,-1,-1,-1,0.0,0.0,35.840000957250595,137.2160017490387,0.058514284151427634,7,-1,-1,torch_mm,0,torch_mm_cublas
2026-03-03T06:16:01.344204+00:00,TORCH,llm_style,eval,llm_style_eval_051,16,6144,1024,bf16,NVIDIA GeForce RTX 4060,torch_cublas,-1,-1,-1,-1,-1,-1,0.0,0.0,164.84799981117249,199.75167661905277,1.221286228711373,5,-1,-1,torch_mm,0,torch_mm_cublas
2026-03-03T06:16:01.752500+00:00,TORCH,llm_style,eval,llm_style_eval_052,16,8192,8192,bf16,NVIDIA GeForce RTX 4060,torch_cublas,-1,-1,-1,-1,-1,-1,0.0,0.0,1852.239966392517,1906.1862111091614,1.1593981811020464,4,-1,-1,torch_mm,0,torch_mm_cublas
2026-03-03T06:16:02.039495+00:00,TORCH,llm_style,eval,llm_style_eval_053,1,6144,8192,bf16,NVIDIA GeForce RTX 4060,torch_cublas,-1,-1,-1,-1,-1,-1,0.0,0.0,1186.8159770965576,1237.0124816894531,0.08481794814244414,4,-1,-1,torch_mm,0,torch_mm_cublas
2026-03-03T06:16:02.133211+00:00,TORCH,llm_style,eval,llm_style_eval_054,64,4096,3072,bf16,NVIDIA GeForce RTX 4060,torch_cublas,-1,-1,-1,-1,-1,-1,0.0,0.0,456.7039906978607,527.7286320924759,3.526600968690735,3,-1,-1,torch_mm,0,torch_mm_cublas
2026-03-03T06:16:02.173059+00:00,TORCH,llm_style,eval,llm_style_eval_055,4,8192,1024,bf16,NVIDIA GeForce RTX 4060,torch_cublas,-1,-1,-1,-1,-1,-1,0.0,0.0,162.81600296497345,178.25184404850003,0.41217609312296594,5,-1,-1,torch_mm,0,torch_mm_cublas
2026-03-03T06:16:02.189879+00:00,TORCH,llm_style,eval,llm_style_eval_056,64,1024,3072,bf16,NVIDIA GeForce RTX 4060,torch_cublas,-1,-1,-1,-1,-1,-1,0.0,0.0,60.36800146102905,64.51199948787689,6.669977045039918,3,-1,-1,torch_mm,0,torch_mm_cublas
2026-03-03T06:16:02.195417+00:00,TORCH,llm_style,eval,llm_style_eval_057,64,1024,3072,bf16,NVIDIA GeForce RTX 4060,torch_cublas,-1,-1,-1,-1,-1,-1,0.0,0.0,60.14399975538254,125.82464210689052,6.694818862025632,3,-1,-1,torch_mm,0,torch_mm_cublas
2026-03-03T06:16:02.234906+00:00,TORCH,llm_style,eval,llm_style_eval_058,32,2048,4096,bf16,NVIDIA GeForce RTX 4060,torch_cublas,-1,-1,-1,-1,-1,-1,0.0,0.0,180.06400018930435,196.52863830327988,2.9815560658187006,3,-1,-1,torch_mm,0,torch_mm_cublas
2026-03-03T06:16:02.324801+00:00,TORCH,llm_style,eval,llm_style_eval_059,64,8192,2048,bf16,NVIDIA GeForce RTX 4060,torch_cublas,-1,-1,-1,-1,-1,-1,0.0,0.0,282.3359966278076,339.3331080675124,7.606127711837407,1,-1,-1,torch_mm,0,torch_mm_cublas
2026-03-03T06:16:02.423258+00:00,TORCH,llm_style,eval,llm_style_eval_060,1,3072,6144,bf16,NVIDIA GeForce RTX 4060,torch_cublas,-1,-1,-1,-1,-1,-1,0.0,0.0,279.55201268196106,381.96992188692093,0.13503296090715589,7,-1,-1,torch_mm,0,torch_mm_cublas
2026-03-03T06:16:02.452853+00:00,TORCH,llm_style,eval,llm_style_eval_061,64,1536,4096,bf16,NVIDIA GeForce RTX 4060,torch_cublas,-1,-1,-1,-1,-1,-1,0.0,0.0,104.44799810647964,111.5219198167324,7.710117786834262,3,-1,-1,torch_mm,0,torch_mm_cublas
2026-03-03T06:16:02.522569+00:00,TORCH,llm_style,eval,llm_style_eval_062,16,6144,2048,bf16,NVIDIA GeForce RTX 4060,torch_cublas,-1,-1,-1,-1,-1,-1,0.0,0.0,206.7520022392273,211.79231956601143,1.9475177006223165,5,-1,-1,torch_mm,0,torch_mm_cublas
2026-03-03T06:16:02.575635+00:00,TORCH,llm_style,eval,llm_style_eval_063,64,1536,6144,bf16,NVIDIA GeForce RTX 4060,torch_cublas,-1,-1,-1,-1,-1,-1,0.0,0.0,143.36000382900238,179.2921571433543,8.42605691780558,3,-1,-1,torch_mm,0,torch_mm_cublas
2026-03-03T06:16:02.638140+00:00,TORCH,llm_style,eval,llm_style_eval_064,1,6144,2048,bf16,NVIDIA GeForce RTX 4060,torch_cublas,-1,-1,-1,-1,-1,-1,0.0,0.0,120.7680031657219,212.11231976747507,0.2083815525662589,5,-1,-1,torch_mm,0,torch_mm_cublas
2026-03-03T06:16:02.688114+00:00,TORCH,llm_style,eval,llm_style_eval_065,8,1536,6144,bf16,NVIDIA GeForce RTX 4060,torch_cublas,-1,-1,-1,-1,-1,-1,0.0,0.0,138.08000087738037,186.81855604052535,1.0935323221361255,7,-1,-1,torch_mm,0,torch_mm_cublas
2026-03-03T06:16:02.720877+00:00,TORCH,llm_style,eval,llm_style_eval_066,64,1536,4096,bf16,NVIDIA GeForce RTX 4060,torch_cublas,-1,-1,-1,-1,-1,-1,0.0,0.0,105.47199845314026,115.27168177068232,7.635262247901621,3,-1,-1,torch_mm,0,torch_mm_cublas
2026-03-03T06:16:02.822120+00:00,TORCH,llm_style,eval,llm_style_eval_067,64,8192,2048,bf16,NVIDIA GeForce RTX 4060,torch_cublas,-1,-1,-1,-1,-1,-1,0.0,0.0,281.5999984741211,293.95775496959686,7.626007314049587,1,-1,-1,torch_mm,0,torch_mm_cublas
2026-03-03T06:16:02.843072+00:00,TORCH,llm_style,eval,llm_style_eval_068,64,1024,4096,bf16,NVIDIA GeForce RTX 4060,torch_cublas,-1,-1,-1,-1,-1,-1,0.0,0.0,80.89599758386612,89.61024053394794,6.636557160240439,3,-1,-1,torch_mm,0,torch_mm_cublas
2026-03-03T06:16:02.884389+00:00,TORCH,llm_style,eval,llm_style_eval_069,64,2048,4096,bf16,NVIDIA GeForce RTX 4060,torch_cublas,-1,-1,-1,-1,-1,-1,0.0,0.0,180.2240014076233,190.51936075091362,5.957818135285181,3,-1,-1,torch_mm,0,torch_mm_cublas
2026-03-03T06:16:02.922101+00:00,TORCH,llm_style,eval,llm_style_eval_070,64,8192,1024,bf16,NVIDIA GeForce RTX 4060,torch_cublas,-1,-1,-1,-1,-1,-1,0.0,0.0,148.47999811172485,153.60000729560852,7.231558712656065,1,-1,-1,torch_mm,0,torch_mm_cublas
2026-03-03T06:16:02.993959+00:00,TORCH,llm_style,eval,llm_style_eval_071,64,6144,2048,bf16,NVIDIA GeForce RTX 4060,torch_cublas,-1,-1,-1,-1,-1,-1,0.0,0.0,186.24000251293182,215.03999829292297,8.648049367848161,1,-1,-1,torch_mm,0,torch_mm_cublas
2026-03-03T06:16:03.005979+00:00,TORCH,llm_style,eval,llm_style_eval_072,64,1536,1024,bf16,NVIDIA GeForce RTX 4060,torch_cublas,-1,-1,-1,-1,-1,-1,0.0,0.0,31.74399957060814,51.840320862829664,6.342193634176106,3,-1,-1,torch_mm,0,torch_mm_cublas
2026-03-03T06:16:03.036093+00:00,TORCH,llm_style,eval,llm_style_eval_073,1,4096,1536,bf16,NVIDIA GeForce RTX 4060,torch_cublas,-1,-1,-1,-1,-1,-1,0.0,0.0,110.59200018644333,132.48352631926537,0.11377777758596365,7,-1,-1,torch_mm,0,torch_mm_cublas
2026-03-03T06:16:03.047653+00:00,TORCH,llm_style,eval,llm_style_eval_074,8,1024,2048,bf16,NVIDIA GeForce RTX 4060,torch_cublas,-1,-1,-1,-1,-1,-1,0.0,0.0,42.3360001295805,49.71520002931355,0.7925744495771403,7,-1,-1,torch_mm,0,torch_mm_cublas
2026-03-03T06:16:03.074053+00:00,TORCH,llm_style,eval,llm_style_eval_075,2,6144,1024,bf16,NVIDIA GeForce RTX 4060,torch_cublas,-1,-1,-1,-1,-1,-1,0.0,0.0,108.35199803113937,114.79040160775182,0.2322598979002452,5,-1,-1,torch_mm,0,torch_mm_cublas
2026-03-03T06:16:03.104862+00:00,TORCH,llm_style,eval,llm_style_eval_076,64,1024,6144,bf16,NVIDIA GeForce RTX 4060,torch_cublas,-1,-1,-1,-1,-1,-1,0.0,0.0,113.66400122642517,114.62528109550476,7.0849728965267005,3,-1,-1,torch_mm,0,torch_mm_cublas
2026-03-03T06:16:03.291879+00:00,TORCH,llm_style,eval,llm_style_eval_077,1,4096,8192,bf16,NVIDIA GeForce RTX 4060,torch_cublas,-1,-1,-1,-1,-1,-1,0.0,0.0,536.9759798049927,554.0454560518265,0.1249755417819083,6,-1,-1,torch_mm,0,torch_mm_cublas
2026-03-03T06:16:03.399042+00:00,TORCH,llm_style,eval,llm_style_eval_078,64,6144,3072,bf16,NVIDIA GeForce RTX 4060,torch_cublas,-1,-1,-1,-1,-1,-1,0.0,0.0,297.42400348186493,308.66944313049316,8.122811460129201,1,-1,-1,torch_mm,0,torch_mm_cublas
2026-03-03T06:16:03.469145+00:00,TORCH,llm_style,eval,llm_style_eval_079,2,3072,4096,bf16,NVIDIA GeForce RTX 4060,torch_cublas,-1,-1,-1,-1,-1,-1,0.0,0.0,179.19999361038208,200.83168447017667,0.2808685814433199,7,-1,-1,torch_mm,0,torch_mm_cublas
2026-03-03T06:16:03.482398+00:00,TORCH,llm_style,eval,llm_style_eval_080,4,1536,1024,bf16,NVIDIA GeForce RTX 4060,torch_cublas,-1,-1,-1,-1,-1,-1,0.0,0.0,27.583999559283257,82.92831815779209,0.4561670606525689,7,-1,-1,torch_mm,0,torch_mm_cublas
2026-03-03T06:16:03.615453+00:00,TORCH,llm_style,eval,llm_style_eval_081,4,4096,6144,bf16,NVIDIA GeForce RTX 4060,torch_cublas,-1,-1,-1,-1,-1,-1,0.0,0.0,367.1039938926697,485.9392040967941,0.5484184191656108,7,-1,-1,torch_mm,0,torch_mm_cublas
2026-03-03T06:16:03.645905+00:00,TORCH,llm_style,eval,llm_style_eval_082,64,6144,1024,bf16,NVIDIA GeForce RTX 4060,torch_cublas,-1,-1,-1,-1,-1,-1,0.0,0.0,105.3759977221489,114.708481580019,7.642218203460325,1,-1,-1,torch_mm,0,torch_mm_cublas
2026-03-03T06:16:03.734788+00:00,TORCH,llm_style,eval,llm_style_eval_083,8,4096,4096,bf16,NVIDIA GeForce RTX 4060,torch_cublas,-1,-1,-1,-1,-1,-1,0.0,0.0,249.85599517822266,318.98848265409447,1.0743606764709592,7,-1,-1,torch_mm,0,torch_mm_cublas
2026-03-03T06:16:03.770978+00:00,TORCH,llm_style,eval,llm_style_eval_084,64,1024,8192,bf16,NVIDIA GeForce RTX 4060,torch_cublas,-1,-1,-1,-1,-1,-1,0.0,0.0,131.00799918174744,135.69023743271828,8.196002005269904,2,-1,-1,torch_mm,0,torch_mm_cublas
2026-03-03T06:16:03.910826+00:00,TORCH,llm_style,eval,llm_style_eval_085,1,3072,8192,bf16,NVIDIA GeForce RTX 4060,torch_cublas,-1,-1,-1,-1,-1,-1,0.0,0.0,350.99199414253235,397.97983974218363,0.14339827927688034,6,-1,-1,torch_mm,0,torch_mm_cublas
2026-03-03T06:16:03.921776+00:00,TORCH,llm_style,eval,llm_style_eval_086,8,1536,1024,bf16,NVIDIA GeForce RTX 4060,torch_cublas,-1,-1,-1,-1,-1,-1,0.0,0.0,27.648000046610832,33.15967909991741,0.9102222206877092,7,-1,-1,torch_mm,0,torch_mm_cublas
2026-03-03T06:16:03.937863+00:00,TORCH,llm_style,eval,llm_style_eval_087,16,1024,3072,bf16,NVIDIA GeForce RTX 4060,torch_cublas,-1,-1,-1,-1,-1,-1,0.0,0.0,63.999999314546585,68.00831995904446,1.5728640168457033,7,-1,-1,torch_mm,0,torch_mm_cublas
2026-03-03T06:16:03.970203+00:00,TORCH,llm_style,eval,llm_style_eval_088,8,4096,1536,bf16,NVIDIA GeForce RTX 4060,torch_cublas,-1,-1,-1,-1,-1,-1,0.0,0.0,121.34400010108948,186.95168003439903,0.8295696195620652,7,-1,-1,torch_mm,0,torch_mm_cublas
2026-03-03T06:16:04.081411+00:00,TORCH,llm_style,eval,llm_style_eval_089,16,6144,3072,bf16,NVIDIA GeForce RTX 4060,torch_cublas,-1,-1,-1,-1,-1,-1,0.0,0.0,394.23999190330505,408.43488693237305,1.5320104210740186,5,-1,-1,torch_mm,0,torch_mm_cublas
2026-03-03T06:16:04.105145+00:00,TORCH,llm_style,eval,llm_style_eval_090,32,1536,3072,bf16,NVIDIA GeForce RTX 4060,torch_cublas,-1,-1,-1,-1,-1,-1,0.0,0.0,97.15200215578079,110.09024001657963,3.1084268084950715,3,-1,-1,torch_mm,0,torch_mm_cublas
2026-03-03T06:16:04.128260+00:00,TORCH,llm_style,eval,llm_style_eval_091,16,1024,4096,bf16,NVIDIA GeForce RTX 4060,torch_cublas,-1,-1,-1,-1,-1,-1,0.0,0.0,90.08000046014786,104.92192111909388,1.4899836513586502,7,-1,-1,torch_mm,0,torch_mm_cublas
2026-03-03T06:16:04.270256+00:00,TORCH,llm_style,eval,llm_style_eval_092,1,4096,6144,bf16,NVIDIA GeForce RTX 4060,torch_cublas,-1,-1,-1,-1,-1,-1,0.0,0.0,451.07200741767883,460.29824286699295,0.11158229101411393,7,-1,-1,torch_mm,0,torch_mm_cublas
2026-03-03T06:16:04.305511+00:00,TORCH,llm_style,eval,llm_style_eval_093,32,2048,3072,bf16,NVIDIA GeForce RTX 4060,torch_cublas,-1,-1,-1,-1,-1,-1,0.0,0.0,177.15199291706085,216.18496194481838,2.2729249463680294,3,-1,-1,torch_mm,0,torch_mm_cublas
2026-03-03T06:16:04.318982+00:00,TORCH,llm_style,eval,llm_style_eval_094,32,1024,2048,bf16,NVIDIA GeForce RTX 4060,torch_cublas,-1,-1,-1,-1,-1,-1,0.0,0.0,55.296000093221664,64.56128109246491,2.4272592551672245,3,-1,-1,torch_mm,0,torch_mm_cublas
2026-03-03T06:16:04.391211+00:00,TORCH,llm_style,eval,llm_style_eval_095,8,6144,2048,bf16,NVIDIA GeForce RTX 4060,torch_cublas,-1,-1,-1,-1,-1,-1,0.0,0.0,275.4560112953186,369.75456833839394,0.7308847283937331,5,-1,-1,torch_mm,0,torch_mm_cublas
2026-03-03T06:16:04.426153+00:00,TORCH,llm_style,eval,llm_style_eval_096,64,2048,3072,bf16,NVIDIA GeForce RTX 4060,torch_cublas,-1,-1,-1,-1,-1,-1,0.0,0.0,191.3599967956543,247.36767813563347,4.208331843044263,3,-1,-1,torch_mm,0,torch_mm_cublas
2026-03-03T06:16:04.462101+00:00,TORCH,llm_style,eval,llm_style_eval_097,64,6144,1024,bf16,NVIDIA GeForce RTX 4060,torch_cublas,-1,-1,-1,-1,-1,-1,0.0,0.0,136.19199395179749,204.52832028269756,5.913022818984665,1,-1,-1,torch_mm,0,torch_mm_cublas
2026-03-03T06:16:04.494063+00:00,TORCH,llm_style,eval,llm_style_eval_098,32,6144,1024,bf16,NVIDIA GeForce RTX 4060,torch_cublas,-1,-1,-1,-1,-1,-1,0.0,0.0,148.3840048313141,242.90591940283758,2.7135888700250694,1,-1,-1,torch_mm,0,torch_mm_cublas
2026-03-03T06:16:04.514848+00:00,TORCH,llm_style,eval,llm_style_eval_099,1,2048,2048,bf16,NVIDIA GeForce RTX 4060,torch_cublas,-1,-1,-1,-1,-1,-1,0.0,0.0,79.8719972372055,157.33344286680205,0.10502564465850703,7,-1,-1,torch_mm,0,torch_mm_cublas
2026-03-03T06:16:04.557549+00:00,TORCH,llm_style,eval,llm_style_eval_100,64,8192,1024,bf16,NVIDIA GeForce RTX 4060,torch_cublas,-1,-1,-1,-1,-1,-1,0.0,0.0,202.08000391721725,206.84799551963806,5.313449144824156,1,-1,-1,torch_mm,0,torch_mm_cublas
2026-03-03T06:16:04.635215+00:00,TORCH,llm_style,eval,llm_style_eval_101,64,8192,1536,bf16,NVIDIA GeForce RTX 4060,torch_cublas,-1,-1,-1,-1,-1,-1,0.0,0.0,291.3279980421066,316.6803148388862,5.528520248051176,1,-1,-1,torch_mm,0,torch_mm_cublas
2026-03-03T06:16:04.667162+00:00,TORCH,llm_style,eval,llm_style_eval_102,32,3072,2048,bf16,NVIDIA GeForce RTX 4060,torch_cublas,-1,-1,-1,-1,-1,-1,0.0,0.0,128.00000607967377,196.50239437818516,3.1457278505859447,3,-1,-1,torch_mm,0,torch_mm_cublas
2026-03-03T06:16:04.701250+00:00,TORCH,llm_style,eval,llm_style_eval_103,64,2048,3072,bf16,NVIDIA GeForce RTX 4060,torch_cublas,-1,-1,-1,-1,-1,-1,0.0,0.0,186.36800348758698,268.25727000832546,4.321054864193131,3,-1,-1,torch_mm,0,torch_mm_cublas
2026-03-03T06:16:04.778777+00:00,TORCH,llm_style,eval,llm_style_eval_104,16,6144,2048,bf16,NVIDIA GeForce RTX 4060,torch_cublas,-1,-1,-1,-1,-1,-1,0.0,0.0,279.31199967861176,329.7894471883774,1.441589278166745,5,-1,-1,torch_mm,0,torch_mm_cublas
2026-03-03T06:16:04.815691+00:00,TORCH,llm_style,eval,llm_style_eval_105,1,1024,8192,bf16,NVIDIA GeForce RTX 4060,torch_cublas,-1,-1,-1,-1,-1,-1,0.0,0.0,136.19199395179749,203.52832525968546,0.12318797539551384,6,-1,-1,torch_mm,0,torch_mm_cublas
2026-03-03T06:16:05.019342+00:00,TORCH,llm_style,eval,llm_style_eval_106,32,4096,8192,bf16,NVIDIA GeForce RTX 4060,torch_cublas,-1,-1,-1,-1,-1,-1,0.0,0.0,727.4720072746277,760.3302478790283,2.9519811436391175,2,-1,-1,torch_mm,0,torch_mm_cublas
2026-03-03T06:16:05.079268+00:00,TORCH,llm_style,eval,llm_style_eval_107,64,6144,1536,bf16,NVIDIA GeForce RTX 4060,torch_cublas,-1,-1,-1,-1,-1,-1,0.0,0.0,215.03999829292297,287.55776405334467,5.617371473164461,1,-1,-1,torch_mm,0,torch_mm_cublas
2026-03-03T06:16:05.103052+00:00,TORCH,llm_style,eval,llm_style_eval_108,8,3072,1536,bf16,NVIDIA GeForce RTX 4060,torch_cublas,-1,-1,-1,-1,-1,-1,0.0,0.0,108.5439994931221,170.73152184486383,0.6955471730593813,7,-1,-1,torch_mm,0,torch_mm_cublas
2026-03-03T06:16:05.116651+00:00,TORCH,llm_style,eval,llm_style_eval_109,16,2048,1024,bf16,NVIDIA GeForce RTX 4060,torch_cublas,-1,-1,-1,-1,-1,-1,0.0,0.0,76.7040029168129,92.702721580863,0.8749069337721653,7,-1,-1,torch_mm,0,torch_mm_cublas
2026-03-03T06:16:05.546166+00:00,TORCH,llm_style,eval,llm_style_eval_110,1,8192,8192,bf16,NVIDIA GeForce RTX 4060,torch_cublas,-1,-1,-1,-1,-1,-1,0.0,0.0,2095.487952232361,2197.2198510169983,0.0640508230348046,4,-1,-1,torch_mm,0,torch_mm_cublas
2026-03-03T06:16:05.605814+00:00,TORCH,llm_style,eval,llm_style_eval_111,8,6144,1536,bf16,NVIDIA GeForce RTX 4060,torch_cublas,-1,-1,-1,-1,-1,-1,0.0,0.0,148.43200147151947,271.79231747984875,1.0172667787476566,5,-1,-1,torch_mm,0,torch_mm_cublas
2026-03-03T06:16:05.705859+00:00,TORCH,llm_style,eval,llm_style_eval_112,2,6144,3072,bf16,NVIDIA GeForce RTX 4060,torch_cublas,-1,-1,-1,-1,-1,-1,0.0,0.0,299.00801181793213,325.11807441711426,0.2524931407054433,5,-1,-1,torch_mm,0,torch_mm_cublas
2026-03-03T06:16:06.062477+00:00,TORCH,llm_style,eval,llm_style_eval_113,1,8192,8192,bf16,NVIDIA GeForce RTX 4060,torch_cublas,-1,-1,-1,-1,-1,-1,0.0,0.0,1208.2239985466003,1287.690269947052,0.1110867919867951,4,-1,-1,torch_mm,0,torch_mm_cublas
2026-03-03T06:16:06.086671+00:00,TORCH,llm_style,eval,llm_style_eval_114,1,3072,1024,bf16,NVIDIA GeForce RTX 4060,torch_cublas,-1,-1,-1,-1,-1,-1,0.0,0.0,55.296000093221664,150.22367835044855,0.11377777758596365,7,-1,-1,torch_mm,0,torch_mm_cublas
2026-03-03T06:16:06.109861+00:00,TORCH,llm_style,eval,llm_style_eval_115,16,3072,1536,bf16,NVIDIA GeForce RTX 4060,torch_cublas,-1,-1,-1,-1,-1,-1,0.0,0.0,71.68000191450119,80.97792126238345,2.106514229451395,7,-1,-1,torch_mm,0,torch_mm_cublas
2026-03-03T06:16:06.125981+00:00,TORCH,llm_style,eval,llm_style_eval_116,8,3072,1024,bf16,NVIDIA GeForce RTX 4060,torch_cublas,-1,-1,-1,-1,-1,-1,0.0,0.0,51.19999870657921,136.65504105389107,0.9830400248336798,7,-1,-1,torch_mm,0,torch_mm_cublas
2026-03-03T06:16:06.147836+00:00,TORCH,llm_style,eval,llm_style_eval_117,4,1024,4096,bf16,NVIDIA GeForce RTX 4060,torch_cublas,-1,-1,-1,-1,-1,-1,0.0,0.0,87.0399996638298,231.14879786968203,0.3855058838418611,7,-1,-1,torch_mm,0,torch_mm_cublas
2026-03-03T06:16:06.257830+00:00,TORCH,llm_style,eval,llm_style_eval_118,64,6144,3072,bf16,NVIDIA GeForce RTX 4060,torch_cublas,-1,-1,-1,-1,-1,-1,0.0,0.0,277.50399708747864,313.37279349565506,8.705889390264964,1,-1,-1,torch_mm,0,torch_mm_cublas
2026-03-03T06:16:06.521054+00:00,TORCH,llm_style,eval,llm_style_eval_119,64,8192,6144,bf16,NVIDIA GeForce RTX 4060,torch_cublas,-1,-1,-1,-1,-1,-1,0.0,0.0,744.9600100517273,776.7388898134232,8.648049367848161,1,-1,-1,torch_mm,0,torch_mm_cublas
2026-03-03T06:16:06.540679+00:00,TORCH,llm_style,eval,llm_style_eval_120,8,1024,4096,bf16,NVIDIA GeForce RTX 4060,torch_cublas,-1,-1,-1,-1,-1,-1,0.0,0.0,61.40800006687641,66.35295860469341,1.0928358508160998,7,-1,-1,torch_mm,0,torch_mm_cublas
2026-03-03T06:16:06.552667+00:00,TORCH,llm_style,eval,llm_style_eval_121,4,1024,2048,bf16,NVIDIA GeForce RTX 4060,torch_cublas,-1,-1,-1,-1,-1,-1,0.0,0.0,39.93599861860275,183.12191858887667,0.4201025786340281,7,-1,-1,torch_mm,0,torch_mm_cublas
2026-03-03T06:16:06.691169+00:00,TORCH,llm_style,eval,llm_style_eval_122,4,6144,4096,bf16,NVIDIA GeForce RTX 4060,torch_cublas,-1,-1,-1,-1,-1,-1,0.0,0.0,343.423992395401,372.6671949028969,0.5862333338906699,5,-1,-1,torch_mm,0,torch_mm_cublas
2026-03-03T06:16:06.828105+00:00,TORCH,llm_style,eval,llm_style_eval_123,4,3072,8192,bf16,NVIDIA GeForce RTX 4060,torch_cublas,-1,-1,-1,-1,-1,-1,0.0,0.0,337.7919942140579,372.23424315452576,0.5960075888371109,6,-1,-1,torch_mm,0,torch_mm_cublas
2026-03-03T06:16:06.855381+00:00,TORCH,llm_style,eval,llm_style_eval_124,64,6144,1024,bf16,NVIDIA GeForce RTX 4060,torch_cublas,-1,-1,-1,-1,-1,-1,0.0,0.0,89.08800035715103,114.3343975394964,9.039448239623201,1,-1,-1,torch_mm,0,torch_mm_cublas
2026-03-03T06:16:06.924396+00:00,TORCH,llm_style,eval,llm_style_eval_125,64,1536,8192,bf16,NVIDIA GeForce RTX 4060,torch_cublas,-1,-1,-1,-1,-1,-1,0.0,0.0,163.82399946451187,227.52255856990803,9.83136012589472,2,-1,-1,torch_mm,0,torch_mm_cublas
2026-03-03T06:16:07.024499+00:00,TORCH,llm_style,eval,llm_style_eval_126,64,2048,8192,bf16,NVIDIA GeForce RTX 4060,torch_cublas,-1,-1,-1,-1,-1,-1,0.0,0.0,313.32799792289734,342.1388766169548,6.853787922675347,2,-1,-1,torch_mm,0,torch_mm_cublas
2026-03-03T06:16:07.091604+00:00,TORCH,llm_style,eval,llm_style_eval_127,2,8192,1536,bf16,NVIDIA GeForce RTX 4060,torch_cublas,-1,-1,-1,-1,-1,-1,0.0,0.0,161.74399852752686,176.71168386936188,0.31118093071894826,5,-1,-1,torch_mm,0,torch_mm_cublas
2026-03-03T06:16:07.117008+00:00,TORCH,llm_style,eval,llm_style_eval_128,8,2048,2048,bf16,NVIDIA GeForce RTX 4060,torch_cublas,-1,-1,-1,-1,-1,-1,0.0,0.0,80.89599758386612,88.56447972357272,0.8295696450300549,7,-1,-1,torch_mm,0,torch_mm_cublas
2026-03-03T06:16:07.385774+00:00,TORCH,llm_style,eval,llm_style_eval_129,64,8192,6144,bf16,NVIDIA GeForce RTX 4060,torch_cublas,-1,-1,-1,-1,-1,-1,0.0,0.0,746.399998664856,827.683218717575,8.631365160134132,1,-1,-1,torch_mm,0,torch_mm_cublas
2026-03-03T06:16:07.410592+00:00,TORCH,llm_style,eval,llm_style_eval_130,16,3072,1536,bf16,NVIDIA GeForce RTX 4060,torch_cublas,-1,-1,-1,-1,-1,-1,0.0,0.0,67.58400052785873,165.95360025763512,2.234181800731943,7,-1,-1,torch_mm,0,torch_mm_cublas
2026-03-03T06:16:07.772683+00:00,TORCH,llm_style,eval,llm_style_eval_131,32,8192,8192,bf16,NVIDIA GeForce RTX 4060,torch_cublas,-1,-1,-1,-1,-1,-1,0.0,0.0,1242.1120405197144,1299.5379209518433,3.457793786624059,0,-1,-1,torch_mm,0,torch_mm_cublas
2026-03-03T06:16:07.955779+00:00,TORCH,llm_style,eval,llm_style_eval_132,32,8192,4096,bf16,NVIDIA GeForce RTX 4060,torch_cublas,-1,-1,-1,-1,-1,-1,0.0,0.0,484.3519926071167,503.80802154541016,4.4337252262363185,1,-1,-1,torch_mm,0,torch_mm_cublas
2026-03-03T06:16:08.296265+00:00,TORCH,llm_style,eval,llm_style_eval_133,2,8192,8192,bf16,NVIDIA GeForce RTX 4060,torch_cublas,-1,-1,-1,-1,-1,-1,0.0,0.0,901.0080099105835,941.9228732585907,0.2979279352096322,4,-1,-1,torch_mm,0,torch_mm_cublas
2026-03-03T06:16:08.353729+00:00,TORCH,llm_style,eval,llm_style_eval_134,64,3072,3072,bf16,NVIDIA GeForce RTX 4060,torch_cublas,-1,-1,-1,-1,-1,-1,0.0,0.0,214.76799994707108,317.7897579967973,5.6244857348287365,3,-1,-1,torch_mm,0,torch_mm_cublas
2026-03-03T06:16:08.402064+00:00,TORCH,llm_style,eval,llm_style_eval_135,8,3072,3072,bf16,NVIDIA GeForce RTX 4060,torch_cublas,-1,-1,-1,-1,-1,-1,0.0,0.0,106.49599879980087,174.58175539970378,1.4178461698251366,7,-1,-1,torch_mm,0,torch_mm_cublas
2026-03-03T06:16:08.437683+00:00,TORCH,llm_style,eval,llm_style_eval_136,4,2048,4096,bf16,NVIDIA GeForce RTX 4060,torch_cublas,-1,-1,-1,-1,-1,-1,0.0,0.0,97.24800288677216,166.52287662029255,0.6900796109729495,7,-1,-1,torch_mm,0,torch_mm_cublas
2026-03-03T06:16:08.788218+00:00,TORCH,llm_style,eval,llm_style_eval_137,4,8192,8192,bf16,NVIDIA GeForce RTX 4060,torch_cublas,-1,-1,-1,-1,-1,-1,0.0,0.0,908.271998167038,963.604485988617,0.5910904586769673,4,-1,-1,torch_mm,0,torch_mm_cublas
2026-03-03T06:16:08.805941+00:00,TORCH,llm_style,eval,llm_style_eval_138,16,1024,1024,bf16,NVIDIA GeForce RTX 4060,torch_cublas,-1,-1,-1,-1,-1,-1,0.0,0.0,20.479999482631683,31.312000099569538,1.6384000413894664,7,-1,-1,torch_mm,0,torch_mm_cublas
2026-03-03T06:16:08.815271+00:00,TORCH,llm_style,eval,llm_style_eval_139,4,1024,1024,bf16,NVIDIA GeForce RTX 4060,torch_cublas,-1,-1,-1,-1,-1,-1,0.0,0.0,20.479999482631683,83.3535982668399,0.4096000103473666,7,-1,-1,torch_mm,0,torch_mm_cublas
2026-03-03T06:16:08.999873+00:00,TORCH,llm_style,eval,llm_style_eval_140,64,4096,6144,bf16,NVIDIA GeForce RTX 4060,torch_cublas,-1,-1,-1,-1,-1,-1,0.0,0.0,536.4479720592499,568.8627296686172,6.004730448760501,3,-1,-1,torch_mm,0,torch_mm_cublas
2026-03-03T06:16:09.132893+00:00,TORCH,llm_style,eval,llm_style_eval_141,4,6144,4096,bf16,NVIDIA GeForce RTX 4060,torch_cublas,-1,-1,-1,-1,-1,-1,0.0,0.0,338.9439880847931,377.4566373229027,0.5939818939925686,5,-1,-1,torch_mm,0,torch_mm_cublas
2026-03-03T06:16:09.195524+00:00,TORCH,llm_style,eval,llm_style_eval_142,4,2048,6144,bf16,NVIDIA GeForce RTX 4060,torch_cublas,-1,-1,-1,-1,-1,-1,0.0,0.0,143.36000382900238,185.6227189302444,0.7021714098171316,7,-1,-1,torch_mm,0,torch_mm_cublas
2026-03-03T06:16:09.263643+00:00,TORCH,llm_style,eval,llm_style_eval_143,64,1536,8192,bf16,NVIDIA GeForce RTX 4060,torch_cublas,-1,-1,-1,-1,-1,-1,0.0,0.0,161.79199516773224,297.67679587006535,9.95483574036066,2,-1,-1,torch_mm,0,torch_mm_cublas
2026-03-03T06:16:09.313216+00:00,TORCH,llm_style,eval,llm_style_eval_144,1,3072,3072,bf16,NVIDIA GeForce RTX 4060,torch_cublas,-1,-1,-1,-1,-1,-1,0.0,0.0,104.44799810647964,136.7936043441295,0.180705885628928,7,-1,-1,torch_mm,0,torch_mm_cublas
2026-03-03T06:16:09.325904+00:00,TORCH,llm_style,eval,llm_style_eval_145,32,1024,2048,bf16,NVIDIA GeForce RTX 4060,torch_cublas,-1,-1,-1,-1,-1,-1,0.0,0.0,39.93599861860275,98.12991961836809,3.360820629072225,3,-1,-1,torch_mm,0,torch_mm_cublas
2026-03-03T06:16:09.506500+00:00,TORCH,llm_style,eval,llm_style_eval_146,64,8192,4096,bf16,NVIDIA GeForce RTX 4060,torch_cublas,-1,-1,-1,-1,-1,-1,0.0,0.0,489.29600417613983,520.2943974733353,8.77785074748714,1,-1,-1,torch_mm,0,torch_mm_cublas
2026-03-03T06:16:09.548658+00:00,TORCH,llm_style,eval,llm_style_eval_147,64,2048,4096,bf16,NVIDIA GeForce RTX 4060,torch_cublas,-1,-1,-1,-1,-1,-1,0.0,0.0,138.2399946451187,143.7353628873825,7.7672299305019825,3,-1,-1,torch_mm,0,torch_mm_cublas
2026-03-03T06:16:09.578150+00:00,TORCH,llm_style,eval,llm_style_eval_148,64,1024,6144,bf16,NVIDIA GeForce RTX 4060,torch_cublas,-1,-1,-1,-1,-1,-1,0.0,0.0,84.89599823951721,117.7292824536561,9.485798915138353,3,-1,-1,torch_mm,0,torch_mm_cublas
2026-03-03T06:16:09.757991+00:00,TORCH,llm_style,eval,llm_style_eval_149,64,4096,8192,bf16,NVIDIA GeForce RTX 4060,torch_cublas,-1,-1,-1,-1,-1,-1,0.0,0.0,529.4079780578613,579.3075484037399,8.112774030637263,2,-1,-1,torch_mm,0,torch_mm_cublas
2026-03-03T06:16:09.786818+00:00,TORCH,llm_style,eval,llm_style_eval_150,2,2048,3072,bf16,NVIDIA GeForce RTX 4060,torch_cublas,-1,-1,-1,-1,-1,-1,0.0,0.0,110.59200018644333,178.08191999793053,0.2275555551719273,7,-1,-1,torch_mm,0,torch_mm_cublas
2026-03-03T06:16:09.830947+00:00,TORCH,llm_style,eval,llm_style_eval_151,64,4096,2048,bf16,NVIDIA GeForce RTX 4060,torch_cublas,-1,-1,-1,-1,-1,-1,0.0,0.0,189.43999707698822,331.7596724629401,5.667978465833868,3,-1,-1,torch_mm,0,torch_mm_cublas
2026-03-03T06:16:10.185141+00:00,TORCH,llm_style,eval,llm_style_eval_152,8,8192,8192,bf16,NVIDIA GeForce RTX 4060,torch_cublas,-1,-1,-1,-1,-1,-1,0.0,0.0,924.5760142803192,1059.5369982719421,1.1613342844890802,4,-1,-1,torch_mm,0,torch_mm_cublas
2026-03-03T06:16:10.276248+00:00,TORCH,llm_style,eval,llm_style_eval_153,64,8192,2048,bf16,NVIDIA GeForce RTX 4060,torch_cublas,-1,-1,-1,-1,-1,-1,0.0,0.0,281.5999984741211,336.60928934812534,7.626007314049587,1,-1,-1,torch_mm,0,torch_mm_cublas
2026-03-03T06:16:10.367469+00:00,TORCH,llm_style,eval,llm_style_eval_154,16,2048,8192,bf16,NVIDIA GeForce RTX 4060,torch_cublas,-1,-1,-1,-1,-1,-1,0.0,0.0,244.73600089550018,318.75328600406624,2.193673632140612,6,-1,-1,torch_mm,0,torch_mm_cublas
2026-03-03T06:16:10.385085+00:00,TORCH,llm_style,eval,llm_style_eval_155,4,2048,1536,bf16,NVIDIA GeForce RTX 4060,torch_cublas,-1,-1,-1,-1,-1,-1,0.0,0.0,81.91999793052673,141.33247569203377,0.307200007760525,7,-1,-1,torch_mm,0,torch_mm_cublas
2026-03-03T06:16:10.518871+00:00,TORCH,llm_style,eval,llm_style_eval_156,1,4096,6144,bf16,NVIDIA GeForce RTX 4060,torch_cublas,-1,-1,-1,-1,-1,-1,0.0,0.0,415.18400609493256,455.00414997339243,0.12122732875334216,7,-1,-1,torch_mm,0,torch_mm_cublas
2026-03-03T06:16:10.591294+00:00,TORCH,llm_style,eval,llm_style_eval_157,1,1536,8192,bf16,NVIDIA GeForce RTX 4060,torch_cublas,-1,-1,-1,-1,-1,-1,0.0,0.0,266.1760002374649,299.7555059194564,0.09454580419552736,6,-1,-1,torch_mm,0,torch_mm_cublas
2026-03-03T06:16:10.664389+00:00,TORCH,llm_style,eval,llm_style_eval_158,64,1536,8192,bf16,NVIDIA GeForce RTX 4060,torch_cublas,-1,-1,-1,-1,-1,-1,0.0,0.0,208.8319957256317,285.26847481727594,7.712480697239806,2,-1,-1,torch_mm,0,torch_mm_cublas
2026-03-03T06:16:10.718059+00:00,TORCH,llm_style,eval,llm_style_eval_159,16,6144,1536,bf16,NVIDIA GeForce RTX 4060,torch_cublas,-1,-1,-1,-1,-1,-1,0.0,0.0,167.7439957857132,179.30719718337056,1.80030221997204,5,-1,-1,torch_mm,0,torch_mm_cublas
2026-03-03T06:16:10.931511+00:00,TORCH,llm_style,eval,llm_style_eval_160,32,6144,6144,bf16,NVIDIA GeForce RTX 4060,torch_cublas,-1,-1,-1,-1,-1,-1,0.0,0.0,723.3439981937408,855.0988930463791,3.339931084010901,1,-1,-1,torch_mm,0,torch_mm_cublas
2026-03-03T06:16:10.960012+00:00,TORCH,llm_style,eval,llm_style_eval_161,2,1536,4096,bf16,NVIDIA GeForce RTX 4060,torch_cublas,-1,-1,-1,-1,-1,-1,0.0,0.0,107.51999914646149,164.98688369989392,0.23405714471518588,7,-1,-1,torch_mm,0,torch_mm_cublas
2026-03-03T06:16:10.982605+00:00,TORCH,llm_style,eval,llm_style_eval_162,64,1536,3072,bf16,NVIDIA GeForce RTX 4060,torch_cublas,-1,-1,-1,-1,-1,-1,0.0,0.0,88.06400001049042,159.94144484400744,6.85841860383417,3,-1,-1,torch_mm,0,torch_mm_cublas
2026-03-03T06:16:11.023690+00:00,TORCH,llm_style,eval,llm_style_eval_163,64,1024,8192,bf16,NVIDIA GeForce RTX 4060,torch_cublas,-1,-1,-1,-1,-1,-1,0.0,0.0,154.62400019168854,239.1900785267353,6.94421191192101,2,-1,-1,torch_mm,0,torch_mm_cublas
2026-03-03T06:16:11.235640+00:00,TORCH,llm_style,eval,llm_style_eval_164,64,4096,8192,bf16,NVIDIA GeForce RTX 4060,torch_cublas,-1,-1,-1,-1,-1,-1,0.0,0.0,851.967990398407,897.6486498117447,5.04123082604493,2,-1,-1,torch_mm,0,torch_mm_cublas
2026-03-03T06:16:11.374657+00:00,TORCH,llm_style,eval,llm_style_eval_165,4,8192,3072,bf16,NVIDIA GeForce RTX 4060,torch_cublas,-1,-1,-1,-1,-1,-1,0.0,0.0,467.9679870605469,635.248646736145,0.43021445390868557,5,-1,-1,torch_mm,0,torch_mm_cublas
2026-03-03T06:16:11.404946+00:00,TORCH,llm_style,eval,llm_style_eval_166,64,1024,6144,bf16,NVIDIA GeForce RTX 4060,torch_cublas,-1,-1,-1,-1,-1,-1,0.0,0.0,129.4879987835884,181.21952056884754,6.219158343360437,3,-1,-1,torch_mm,0,torch_mm_cublas
2026-03-03T06:16:11.417884+00:00,TORCH,llm_style,eval,llm_style_eval_167,2,2048,1024,bf16,NVIDIA GeForce RTX 4060,torch_cublas,-1,-1,-1,-1,-1,-1,0.0,0.0,67.37599894404411,68.04096020758152,0.12450439520706408,7,-1,-1,torch_mm,0,torch_mm_cublas
2026-03-03T06:16:11.439397+00:00,TORCH,llm_style,eval,llm_style_eval_168,64,4096,1024,bf16,NVIDIA GeForce RTX 4060,torch_cublas,-1,-1,-1,-1,-1,-1,0.0,0.0,120.83200365304947,125.95200538635254,4.443118509741362,3,-1,-1,torch_mm,0,torch_mm_cublas
2026-03-03T06:16:11.494622+00:00,TORCH,llm_style,eval,llm_style_eval_169,4,1536,6144,bf16,NVIDIA GeForce RTX 4060,torch_cublas,-1,-1,-1,-1,-1,-1,0.0,0.0,165.8879965543747,171.00800573825836,0.45511112056412995,7,-1,-1,torch_mm,0,torch_mm_cublas
2026-03-03T06:16:11.511673+00:00,TORCH,llm_style,eval,llm_style_eval_170,16,1536,1536,bf16,NVIDIA GeForce RTX 4060,torch_cublas,-1,-1,-1,-1,-1,-1,0.0,0.0,49.15200173854828,99.23391763120871,1.5359999456703681,7,-1,-1,torch_mm,0,torch_mm_cublas
2026-03-03T06:16:11.546447+00:00,TORCH,llm_style,eval,llm_style_eval_171,1,2048,3072,bf16,NVIDIA GeForce RTX 4060,torch_cublas,-1,-1,-1,-1,-1,-1,0.0,0.0,159.743994474411,277.8521719574927,0.07876923349388026,7,-1,-1,torch_mm,0,torch_mm_cublas
2026-03-03T06:16:11.584236+00:00,TORCH,llm_style,eval,llm_style_eval_172,64,3072,2048,bf16,NVIDIA GeForce RTX 4060,torch_cublas,-1,-1,-1,-1,-1,-1,0.0,0.0,257.4400007724762,285.3375959396362,3.1281322466733696,3,-1,-1,torch_mm,0,torch_mm_cublas
2026-03-03T06:16:11.857307+00:00,TORCH,llm_style,eval,llm_style_eval_173,64,8192,6144,bf16,NVIDIA GeForce RTX 4060,torch_cublas,-1,-1,-1,-1,-1,-1,0.0,0.0,947.2000002861023,976.8595445156097,6.801574051999634,1,-1,-1,torch_mm,0,torch_mm_cublas
2026-03-03T06:16:11.952647+00:00,TORCH,llm_style,eval,llm_style_eval_174,2,4096,4096,bf16,NVIDIA GeForce RTX 4060,torch_cublas,-1,-1,-1,-1,-1,-1,0.0,0.0,297.9840040206909,393.74880164861645,0.22520961895437921,7,-1,-1,torch_mm,0,torch_mm_cublas
2026-03-03T06:16:12.000821+00:00,TORCH,llm_style,eval,llm_style_eval_175,64,4096,2048,bf16,NVIDIA GeForce RTX 4060,torch_cublas,-1,-1,-1,-1,-1,-1,0.0,0.0,275.1999944448471,304.2918312549591,3.901678218293674,3,-1,-1,torch_mm,0,torch_mm_cublas
2026-03-03T06:16:12.078629+00:00,TORCH,llm_style,eval,llm_style_eval_176,16,6144,2048,bf16,NVIDIA GeForce RTX 4060,torch_cublas,-1,-1,-1,-1,-1,-1,0.0,0.0,231.85600340366364,295.53663939237595,1.7366519653967154,5,-1,-1,torch_mm,0,torch_mm_cublas
2026-03-03T06:16:12.128945+00:00,TORCH,llm_style,eval,llm_style_eval_177,1,6144,1536,bf16,NVIDIA GeForce RTX 4060,torch_cublas,-1,-1,-1,-1,-1,-1,0.0,0.0,96.19200229644775,162.25280247628672,0.19621556417790678,5,-1,-1,torch_mm,0,torch_mm_cublas
2026-03-03T06:16:12.389667+00:00,TORCH,llm_style,eval,llm_style_eval_178,32,6144,8192,bf16,NVIDIA GeForce RTX 4060,torch_cublas,-1,-1,-1,-1,-1,-1,0.0,0.0,780.7999849319458,795.7094484567642,4.1255449976484835,0,-1,-1,torch_mm,0,torch_mm_cublas
2026-03-03T06:16:12.554052+00:00,TORCH,llm_style,eval,llm_style_eval_179,64,4096,6144,bf16,NVIDIA GeForce RTX 4060,torch_cublas,-1,-1,-1,-1,-1,-1,0.0,0.0,773.1199860572815,780.2879810333252,4.166527227458501,3,-1,-1,torch_mm,0,torch_mm_cublas
2026-03-03T06:16:12.575384+00:00,TORCH,llm_style,eval,llm_style_eval_180,64,2048,1536,bf16,NVIDIA GeForce RTX 4060,torch_cublas,-1,-1,-1,-1,-1,-1,0.0,0.0,81.91999793052673,110.5023992061615,4.9152001241684,3,-1,-1,torch_mm,0,torch_mm_cublas
2026-03-03T06:16:12.606222+00:00,TORCH,llm_style,eval,llm_style_eval_181,64,2048,3072,bf16,NVIDIA GeForce RTX 4060,torch_cublas,-1,-1,-1,-1,-1,-1,0.0,0.0,151.5520066022873,206.12095862627012,5.313729498239754,3,-1,-1,torch_mm,0,torch_mm_cublas
2026-03-03T06:16:12.628538+00:00,TORCH,llm_style,eval,llm_style_eval_182,32,3072,1536,bf16,NVIDIA GeForce RTX 4060,torch_cublas,-1,-1,-1,-1,-1,-1,0.0,0.0,81.87199756503105,86.8963185697794,3.688561376069137,3,-1,-1,torch_mm,0,torch_mm_cublas
2026-03-03T06:16:12.720666+00:00,TORCH,llm_style,eval,llm_style_eval_183,8,8192,2048,bf16,NVIDIA GeForce RTX 4060,torch_cublas,-1,-1,-1,-1,-1,-1,0.0,0.0,288.7679934501648,369.0476736426351,0.929588673567198,5,-1,-1,torch_mm,0,torch_mm_cublas
2026-03-03T06:16:12.763770+00:00,TORCH,llm_style,eval,llm_style_eval_184,64,8192,1024,bf16,NVIDIA GeForce RTX 4060,torch_cublas,-1,-1,-1,-1,-1,-1,0.0,0.0,164.19199854135513,177.27968394756314,6.539550243244991,1,-1,-1,torch_mm,0,torch_mm_cublas
2026-03-03T06:16:12.834599+00:00,TORCH,llm_style,eval,llm_style_eval_185,1,8192,1536,bf16,NVIDIA GeForce RTX 4060,torch_cublas,-1,-1,-1,-1,-1,-1,0.0,0.0,182.27200210094452,225.44384181499476,0.1380674141389134,5,-1,-1,torch_mm,0,torch_mm_cublas
2026-03-03T06:16:12.865692+00:00,TORCH,llm_style,eval,llm_style_eval_186,16,6144,1024,bf16,NVIDIA GeForce RTX 4060,torch_cublas,-1,-1,-1,-1,-1,-1,0.0,0.0,120.83200365304947,194.81599494814856,1.6661694411530108,5,-1,-1,torch_mm,0,torch_mm_cublas
2026-03-03T06:16:12.891623+00:00,TORCH,llm_style,eval,llm_style_eval_187,1,1024,6144,bf16,NVIDIA GeForce RTX 4060,torch_cublas,-1,-1,-1,-1,-1,-1,0.0,0.0,86.01599931716919,91.13600105047226,0.14628571544699118,7,-1,-1,torch_mm,0,torch_mm_cublas
2026-03-03T06:16:13.090761+00:00,TORCH,llm_style,eval,llm_style_eval_188,8,8192,4096,bf16,NVIDIA GeForce RTX 4060,torch_cublas,-1,-1,-1,-1,-1,-1,0.0,0.0,537.0879769325256,656.0047930479046,0.9995958484608698,5,-1,-1,torch_mm,0,torch_mm_cublas
2026-03-03T06:16:13.180564+00:00,TORCH,llm_style,eval,llm_style_eval_189,8,2048,8192,bf16,NVIDIA GeForce RTX 4060,torch_cublas,-1,-1,-1,-1,-1,-1,0.0,0.0,268.2879865169525,278.95296066999435,1.000549668604107,6,-1,-1,torch_mm,0,torch_mm_cublas
2026-03-03T06:16:13.271925+00:00,TORCH,llm_style,eval,llm_style_eval_190,4,8192,2048,bf16,NVIDIA GeForce RTX 4060,torch_cublas,-1,-1,-1,-1,-1,-1,0.0,0.0,287.7439856529236,296.3929519057274,0.4664484218338911,5,-1,-1,torch_mm,0,torch_mm_cublas
2026-03-03T06:16:13.642845+00:00,TORCH,llm_style,eval,llm_style_eval_191,4,8192,8192,bf16,NVIDIA GeForce RTX 4060,torch_cublas,-1,-1,-1,-1,-1,-1,0.0,0.0,953.3439874649048,991.436807513237,0.563145012775112,4,-1,-1,torch_mm,0,torch_mm_cublas
2026-03-03T06:16:13.666312+00:00,TORCH,llm_style,eval,llm_style_eval_192,64,1536,1024,bf16,NVIDIA GeForce RTX 4060,torch_cublas,-1,-1,-1,-1,-1,-1,0.0,0.0,38.863999769091606,195.96288278698904,5.180284921679993,3,-1,-1,torch_mm,0,torch_mm_cublas
2026-03-03T06:16:13.692022+00:00,TORCH,llm_style,eval,llm_style_eval_193,32,2048,2048,bf16,NVIDIA GeForce RTX 4060,torch_cublas,-1,-1,-1,-1,-1,-1,0.0,0.0,99.93600100278854,179.22880083322525,2.6860736201812774,3,-1,-1,torch_mm,0,torch_mm_cublas
2026-03-03T06:16:13.705393+00:00,TORCH,llm_style,eval,llm_style_eval_194,8,1024,2048,bf16,NVIDIA GeForce RTX 4060,torch_cublas,-1,-1,-1,-1,-1,-1,0.0,0.0,51.16799846291542,103.15775737166389,0.6557698758593996,7,-1,-1,torch_mm,0,torch_mm_cublas
2026-03-03T06:16:13.744756+00:00,TORCH,llm_style,eval,llm_style_eval_195,2,4096,2048,bf16,NVIDIA GeForce RTX 4060,torch_cublas,-1,-1,-1,-1,-1,-1,0.0,0.0,176.12800002098083,192.92447745800018,0.1905116278842825,7,-1,-1,torch_mm,0,torch_mm_cublas
2026-03-03T06:16:13.785322+00:00,TORCH,llm_style,eval,llm_style_eval_196,32,2048,4096,bf16,NVIDIA GeForce RTX 4060,torch_cublas,-1,-1,-1,-1,-1,-1,0.0,0.0,198.65599274635315,289.7696042060851,2.7025155625961133,3,-1,-1,torch_mm,0,torch_mm_cublas
2026-03-03T06:16:13.858193+00:00,TORCH,llm_style,eval,llm_style_eval_197,32,8192,1536,bf16,NVIDIA GeForce RTX 4060,torch_cublas,-1,-1,-1,-1,-1,-1,0.0,0.0,220.15999257564545,251.46367952227592,3.6578233791650514,1,-1,-1,torch_mm,0,torch_mm_cublas
2026-03-03T06:16:14.055322+00:00,TORCH,llm_style,eval,llm_style_eval_198,64,4096,8192,bf16,NVIDIA GeForce RTX 4060,torch_cublas,-1,-1,-1,-1,-1,-1,0.0,0.0,716.7999744415283,756.7564606666565,5.991863070790824,2,-1,-1,torch_mm,0,torch_mm_cublas
2026-03-03T06:16:14.237540+00:00,TORCH,llm_style,eval,llm_style_eval_199,2,8192,4096,bf16,NVIDIA GeForce RTX 4060,torch_cublas,-1,-1,-1,-1,-1,-1,0.0,0.0,514.0479803085327,543.426553606987,0.2610996115954823,5,-1,-1,torch_mm,0,torch_mm_cublas
2026-03-03T06:16:14.257795+00:00,TORCH,llm_style,eval,llm_style_eval_200,1,4096,1024,bf16,NVIDIA GeForce RTX 4060,torch_cublas,-1,-1,-1,-1,-1,-1,0.0,0.0,82.94399827718735,107.51999914646149,0.10113580456980666,7,-1,-1,torch_mm,0,torch_mm_cublas
2026-03-03T06:16:14.323444+00:00,TORCH,llm_style,eval,llm_style_eval_201,4,1536,8192,bf16,NVIDIA GeForce RTX 4060,torch_cublas,-1,-1,-1,-1,-1,-1,0.0,0.0,187.391996383667,215.5827221274376,0.5371803382354795,6,-1,-1,torch_mm,0,torch_mm_cublas
2026-03-03T06:16:14.424743+00:00,TORCH,llm_style,eval,llm_style_eval_202,1,6144,3072,bf16,NVIDIA GeForce RTX 4060,torch_cublas,-1,-1,-1,-1,-1,-1,0.0,0.0,262.14399933815,274.89727944135666,0.14400000036356503,5,-1,-1,torch_mm,0,torch_mm_cublas
2026-03-03T06:16:14.494027+00:00,TORCH,llm_style,eval,llm_style_eval_203,16,2048,6144,bf16,NVIDIA GeForce RTX 4060,torch_cublas,-1,-1,-1,-1,-1,-1,0.0,0.0,197.63199985027313,256.9420848786829,2.037388602579804,7,-1,-1,torch_mm,0,torch_mm_cublas
2026-03-03T06:16:14.504676+00:00,TORCH,llm_style,eval,llm_style_eval_204,16,1536,1024,bf16,NVIDIA GeForce RTX 4060,torch_cublas,-1,-1,-1,-1,-1,-1,0.0,0.0,29.69600073993206,66.19936209171998,1.6948965094925827,7,-1,-1,torch_mm,0,torch_mm_cublas
2026-03-03T06:16:14.570152+00:00,TORCH,llm_style,eval,llm_style_eval_205,64,6144,2048,bf16,NVIDIA GeForce RTX 4060,torch_cublas,-1,-1,-1,-1,-1,-1,0.0,0.0,193.53599846363068,203.2089576125145,8.3220318120955,1,-1,-1,torch_mm,0,torch_mm_cublas
2026-03-03T06:16:14.644349+00:00,TORCH,llm_style,eval,llm_style_eval_206,4,2048,6144,bf16,NVIDIA GeForce RTX 4060,torch_cublas,-1,-1,-1,-1,-1,-1,0.0,0.0,192.51200556755066,228.45888197422025,0.5228936018989122,7,-1,-1,torch_mm,0,torch_mm_cublas
2026-03-03T06:16:14.701771+00:00,TORCH,llm_style,eval,llm_style_eval_207,32,6144,1536,bf16,NVIDIA GeForce RTX 4060,torch_cublas,-1,-1,-1,-1,-1,-1,0.0,0.0,165.8879965543747,174.0108858048916,3.6408889645130396,1,-1,-1,torch_mm,0,torch_mm_cublas
2026-03-03T06:16:14.716818+00:00,TORCH,llm_style,eval,llm_style_eval_208,4,2048,1024,bf16,NVIDIA GeForce RTX 4060,torch_cublas,-1,-1,-1,-1,-1,-1,0.0,0.0,54.27199974656105,59.39200147986412,0.30913207691528055,7,-1,-1,torch_mm,0,torch_mm_cublas
2026-03-03T06:16:14.725678+00:00,TORCH,llm_style,eval,llm_style_eval_209,1,1024,1536,bf16,NVIDIA GeForce RTX 4060,torch_cublas,-1,-1,-1,-1,-1,-1,0.0,0.0,34.7680002450943,48.59231907874345,0.09047767998804754,7,-1,-1,torch_mm,0,torch_mm_cublas
2026-03-03T06:16:14.855921+00:00,TORCH,llm_style,eval,llm_style_eval_210,8,6144,4096,bf16,NVIDIA GeForce RTX 4060,torch_cublas,-1,-1,-1,-1,-1,-1,0.0,0.0,365.9360110759735,400.3843241930008,1.1003376869526063,5,-1,-1,torch_mm,0,torch_mm_cublas
2026-03-03T06:16:14.944048+00:00,TORCH,llm_style,eval,llm_style_eval_211,4,2048,8192,bf16,NVIDIA GeForce RTX 4060,torch_cublas,-1,-1,-1,-1,-1,-1,0.0,0.0,250.20799040794373,263.6780834197998,0.5364246272917541,6,-1,-1,torch_mm,0,torch_mm_cublas
2026-03-03T06:16:14.951886+00:00,TORCH,llm_style,eval,llm_style_eval_212,32,1024,1024,bf16,NVIDIA GeForce RTX 4060,torch_cublas,-1,-1,-1,-1,-1,-1,0.0,0.0,31.74399957060814,36.816320940852165,2.1140645447253688,3,-1,-1,torch_mm,0,torch_mm_cublas
2026-03-03T06:16:15.055445+00:00,TORCH,llm_style,eval,llm_style_eval_213,16,3072,4096,bf16,NVIDIA GeForce RTX 4060,torch_cublas,-1,-1,-1,-1,-1,-1,0.0,0.0,187.19999492168427,239.92319926619524,2.1509251865548995,7,-1,-1,torch_mm,0,torch_mm_cublas
2026-03-03T06:16:15.098601+00:00,TORCH,llm_style,eval,llm_style_eval_214,64,1024,8192,bf16,NVIDIA GeForce RTX 4060,torch_cublas,-1,-1,-1,-1,-1,-1,0.0,0.0,136.19199395179749,184.9644826352595,7.8840304253128854,2,-1,-1,torch_mm,0,torch_mm_cublas
2026-03-03T06:16:15.127361+00:00,TORCH,llm_style,eval,llm_style_eval_215,4,4096,1536,bf16,NVIDIA GeForce RTX 4060,torch_cublas,-1,-1,-1,-1,-1,-1,0.0,0.0,127.88800150156021,175.29856324195848,0.3935603606987788,7,-1,-1,torch_mm,0,torch_mm_cublas
2026-03-03T06:16:15.147598+00:00,TORCH,llm_style,eval,llm_style_eval_216,16,1536,3072,bf16,NVIDIA GeForce RTX 4060,torch_cublas,-1,-1,-1,-1,-1,-1,0.0,0.0,71.68000191450119,189.97760385274876,2.106514229451395,7,-1,-1,torch_mm,0,torch_mm_cublas
2026-03-03T06:16:15.216962+00:00,TORCH,llm_style,eval,llm_style_eval_217,8,6144,2048,bf16,NVIDIA GeForce RTX 4060,torch_cublas,-1,-1,-1,-1,-1,-1,0.0,0.0,210.94399690628052,358.5843142867086,0.9544077809877026,5,-1,-1,torch_mm,0,torch_mm_cublas
2026-03-03T06:16:15.284000+00:00,TORCH,llm_style,eval,llm_style_eval_218,8,3072,4096,bf16,NVIDIA GeForce RTX 4060,torch_cublas,-1,-1,-1,-1,-1,-1,0.0,0.0,186.36800348758698,191.9286373257637,1.0802637160482826,7,-1,-1,torch_mm,0,torch_mm_cublas
2026-03-03T06:16:15.425739+00:00,TORCH,llm_style,eval,llm_style_eval_219,64,8192,3072,bf16,NVIDIA GeForce RTX 4060,torch_cublas,-1,-1,-1,-1,-1,-1,0.0,0.0,420.8639860153198,433.1363210082054,7.653839670384018,1,-1,-1,torch_mm,0,torch_mm_cublas
2026-03-03T06:16:15.468073+00:00,TORCH,llm_style,eval,llm_style_eval_220,2,4096,2048,bf16,NVIDIA GeForce RTX 4060,torch_cublas,-1,-1,-1,-1,-1,-1,0.0,0.0,161.71199828386307,170.04544541239738,0.2074950056649466,7,-1,-1,torch_mm,0,torch_mm_cublas
2026-03-03T06:16:15.506504+00:00,TORCH,llm_style,eval,llm_style_eval_221,4,1024,8192,bf16,NVIDIA GeForce RTX 4060,torch_cublas,-1,-1,-1,-1,-1,-1,0.0,0.0,132.4479952454567,142.69503876566887,0.5066808589713404,6,-1,-1,torch_mm,0,torch_mm_cublas
2026-03-03T06:16:15.579926+00:00,TORCH,llm_style,eval,llm_style_eval_222,64,6144,2048,bf16,NVIDIA GeForce RTX 4060,torch_cublas,-1,-1,-1,-1,-1,-1,0.0,0.0,193.53599846363068,270.5408018827438,8.3220318120955,1,-1,-1,torch_mm,0,torch_mm_cublas
2026-03-03T06:16:15.604579+00:00,TORCH,llm_style,eval,llm_style_eval_223,4,2048,2048,bf16,NVIDIA GeForce RTX 4060,torch_cublas,-1,-1,-1,-1,-1,-1,0.0,0.0,130.048006772995,210.83871766924852,0.2580157345938478,7,-1,-1,torch_mm,0,torch_mm_cublas
2026-03-03T06:16:15.632156+00:00,TORCH,llm_style,eval,llm_style_eval_224,16,3072,1536,bf16,NVIDIA GeForce RTX 4060,torch_cublas,-1,-1,-1,-1,-1,-1,0.0,0.0,98.12800213694572,183.2448057830331,1.538754898823621,7,-1,-1,torch_mm,0,torch_mm_cublas
2026-03-03T06:16:15.653127+00:00,TORCH,llm_style,eval,llm_style_eval_225,1,2048,2048,bf16,NVIDIA GeForce RTX 4060,torch_cublas,-1,-1,-1,-1,-1,-1,0.0,0.0,73.72800260782242,149.53471831977356,0.11377777375336061,7,-1,-1,torch_mm,0,torch_mm_cublas
2026-03-03T06:16:15.665050+00:00,TORCH,llm_style,eval,llm_style_eval_226,8,1536,1024,bf16,NVIDIA GeForce RTX 4060,torch_cublas,-1,-1,-1,-1,-1,-1,0.0,0.0,53.07199992239475,107.5404791533947,0.474182695899892,7,-1,-1,torch_mm,0,torch_mm_cublas
2026-03-03T06:16:15.884478+00:00,TORCH,llm_style,eval,llm_style_eval_227,64,6144,6144,bf16,NVIDIA GeForce RTX 4060,torch_cublas,-1,-1,-1,-1,-1,-1,0.0,0.0,734.9919974803925,760.6755197048187,6.574001110983389,1,-1,-1,torch_mm,0,torch_mm_cublas
2026-03-03T06:16:15.959926+00:00,TORCH,llm_style,eval,llm_style_eval_228,64,6144,2048,bf16,NVIDIA GeForce RTX 4060,torch_cublas,-1,-1,-1,-1,-1,-1,0.0,0.0,259.0720057487488,295.42399555444706,6.216853616990144,1,-1,-1,torch_mm,0,torch_mm_cublas
2026-03-03T06:16:16.034846+00:00,TORCH,llm_style,eval,llm_style_eval_229,16,1536,8192,bf16,NVIDIA GeForce RTX 4060,torch_cublas,-1,-1,-1,-1,-1,-1,0.0,0.0,251.90401077270508,265.18463999032974,1.5984389560328083,6,-1,-1,torch_mm,0,torch_mm_cublas
2026-03-03T06:16:16.055902+00:00,TORCH,llm_style,eval,llm_style_eval_230,64,2048,1536,bf16,NVIDIA GeForce RTX 4060,torch_cublas,-1,-1,-1,-1,-1,-1,0.0,0.0,107.51999914646149,119.20832239091396,3.744914315442974,3,-1,-1,torch_mm,0,torch_mm_cublas
2026-03-03T06:16:16.094698+00:00,TORCH,llm_style,eval,llm_style_eval_231,4,1024,8192,bf16,NVIDIA GeForce RTX 4060,torch_cublas,-1,-1,-1,-1,-1,-1,0.0,0.0,177.15199291706085,191.0403168201446,0.3788208243946715,6,-1,-1,torch_mm,0,torch_mm_cublas
2026-03-03T06:16:16.117947+00:00,TORCH,llm_style,eval,llm_style_eval_232,16,3072,1536,bf16,NVIDIA GeForce RTX 4060,torch_cublas,-1,-1,-1,-1,-1,-1,0.0,0.0,102.39999741315842,115.35359799861905,1.4745600372505199,7,-1,-1,torch_mm,0,torch_mm_cublas
2026-03-03T06:16:16.185669+00:00,TORCH,llm_style,eval,llm_style_eval_233,64,3072,3072,bf16,NVIDIA GeForce RTX 4060,torch_cublas,-1,-1,-1,-1,-1,-1,0.0,0.0,383.87200236320496,406.60991609096527,3.146776906269593,3,-1,-1,torch_mm,0,torch_mm_cublas
2026-03-03T06:16:16.375819+00:00,TORCH,llm_style,eval,llm_style_eval_234,32,8192,4096,bf16,NVIDIA GeForce RTX 4060,torch_cublas,-1,-1,-1,-1,-1,-1,0.0,0.0,761.8560194969177,799.4307225942612,2.81875261603638,1,-1,-1,torch_mm,0,torch_mm_cublas
2026-03-03T06:16:16.390320+00:00,TORCH,llm_style,eval,llm_style_eval_235,4,2048,1024,bf16,NVIDIA GeForce RTX 4060,torch_cublas,-1,-1,-1,-1,-1,-1,0.0,0.0,76.76800340414047,143.44415903091425,0.21854438380632837,7,-1,-1,torch_mm,0,torch_mm_cublas
2026-03-03T06:16:16.532368+00:00,TORCH,llm_style,eval,llm_style_eval_236,4,8192,3072,bf16,NVIDIA GeForce RTX 4060,torch_cublas,-1,-1,-1,-1,-1,-1,0.0,0.0,550.6400167942047,610.1693028211591,0.36562288584130176,5,-1,-1,torch_mm,0,torch_mm_cublas
2026-03-03T06:16:16.557888+00:00,TORCH,llm_style,eval,llm_style_eval_237,64,1024,4096,bf16,NVIDIA GeForce RTX 4060,torch_cublas,-1,-1,-1,-1,-1,-1,0.0,0.0,117.76000261306763,141.34496599435803,4.559025985792771,3,-1,-1,torch_mm,0,torch_mm_cublas
2026-03-03T06:16:16.632637+00:00,TORCH,llm_style,eval,llm_style_eval_238,32,2048,6144,bf16,NVIDIA GeForce RTX 4060,torch_cublas,-1,-1,-1,-1,-1,-1,0.0,0.0,287.7279967069626,340.75999528169626,2.798846053274985,3,-1,-1,torch_mm,0,torch_mm_cublas
2026-03-03T06:16:16.651762+00:00,TORCH,llm_style,eval,llm_style_eval_239,32,2048,6144,bf16,NVIDIA GeForce RTX 4060,torch_cublas,-1,-1,-1,-1,-1,-1,0.0,0.0,291.83998703956604,363.6060795187948,2.75941064885951,3,-1,-1,torch_mm,0,torch_mm_cublas
2026-03-03T06:16:16.725254+00:00,TORCH,llm_style,eval,llm_style_eval_240,8,8192,1536,bf16,NVIDIA GeForce RTX 4060,torch_cublas,-1,-1,-1,-1,-1,-1,0.0,0.0,280.5759906768799,290.86111038923264,0.7175474690985019,5,-1,-1,torch_mm,0,torch_mm_cublas
2026-03-03T06:16:16.742970+00:00,TORCH,llm_style,eval,llm_style_eval_241,16,1536,1536,bf16,NVIDIA GeForce RTX 4060,torch_cublas,-1,-1,-1,-1,-1,-1,0.0,0.0,56.32000043988228,108.76928322017187,1.3405090804391657,7,-1,-1,torch_mm,0,torch_mm_cublas
2026-03-03T06:16:16.779392+00:00,TORCH,llm_style,eval,llm_style_eval_242,1,2048,3072,bf16,NVIDIA GeForce RTX 4060,torch_cublas,-1,-1,-1,-1,-1,-1,0.0,0.0,199.66399669647217,252.0700860023498,0.0630204353723744,7,-1,-1,torch_mm,0,torch_mm_cublas
2026-03-03T06:16:16.842559+00:00,TORCH,llm_style,eval,llm_style_eval_243,8,1536,6144,bf16,NVIDIA GeForce RTX 4060,torch_cublas,-1,-1,-1,-1,-1,-1,0.0,0.0,208.8959962129593,212.99199759960175,0.722823542515712,7,-1,-1,torch_mm,0,torch_mm_cublas
2026-03-03T06:16:16.883653+00:00,TORCH,llm_style,eval,llm_style_eval_244,32,8192,1024,bf16,NVIDIA GeForce RTX 4060,torch_cublas,-1,-1,-1,-1,-1,-1,0.0,0.0,223.23200106620789,228.7926349043846,2.404990814201279,1,-1,-1,torch_mm,0,torch_mm_cublas
2026-03-03T06:16:17.031057+00:00,TORCH,llm_style,eval,llm_style_eval_245,4,6144,4096,bf16,NVIDIA GeForce RTX 4060,torch_cublas,-1,-1,-1,-1,-1,-1,0.0,0.0,567.6000118255615,661.9308948516845,0.35469800529509676,5,-1,-1,torch_mm,0,torch_mm_cublas
2026-03-03T06:16:17.116941+00:00,TORCH,llm_style,eval,llm_style_eval_246,32,2048,6144,bf16,NVIDIA GeForce RTX 4060,torch_cublas,-1,-1,-1,-1,-1,-1,0.0,0.0,309.2480003833771,341.5936064720153,2.6040794669703784,3,-1,-1,torch_mm,0,torch_mm_cublas
2026-03-03T06:16:17.191919+00:00,TORCH,llm_style,eval,llm_style_eval_247,64,6144,2048,bf16,NVIDIA GeForce RTX 4060,torch_cublas,-1,-1,-1,-1,-1,-1,0.0,0.0,299.00801181793213,350.4665586352347,5.386520335049458,1,-1,-1,torch_mm,0,torch_mm_cublas
2026-03-03T06:16:17.200995+00:00,TORCH,llm_style,eval,llm_style_eval_248,64,1024,1024,bf16,NVIDIA GeForce RTX 4060,torch_cublas,-1,-1,-1,-1,-1,-1,0.0,0.0,48.128001391887665,53.153920508921146,2.7887658767941983,3,-1,-1,torch_mm,0,torch_mm_cublas
2026-03-03T06:16:17.242074+00:00,TORCH,llm_style,eval,llm_style_eval_249,2,8192,1024,bf16,NVIDIA GeForce RTX 4060,torch_cublas,-1,-1,-1,-1,-1,-1,0.0,0.0,202.7519941329956,210.38432359695435,0.16549495428385233,5,-1,-1,torch_mm,0,torch_mm_cublas
2026-03-03T06:16:17.315979+00:00,TORCH,llm_style,eval,llm_style_eval_250,64,3072,3072,bf16,NVIDIA GeForce RTX 4060,torch_cublas,-1,-1,-1,-1,-1,-1,0.0,0.0,442.3680007457733,460.75776636600494,2.730666662063128,3,-1,-1,torch_mm,0,torch_mm_cublas
2026-03-03T06:16:17.362730+00:00,TORCH,llm_style,eval,llm_style_eval_251,64,1024,8192,bf16,NVIDIA GeForce RTX 4060,torch_cublas,-1,-1,-1,-1,-1,-1,0.0,0.0,209.24799889326096,236.64608135819432,5.1314317445287685,2,-1,-1,torch_mm,0,torch_mm_cublas
2026-03-03T06:16:17.454000+00:00,TORCH,llm_style,eval,llm_style_eval_252,64,4096,3072,bf16,NVIDIA GeForce RTX 4060,torch_cublas,-1,-1,-1,-1,-1,-1,0.0,0.0,583.6800038814545,616.5708649158478,2.7594105079657925,3,-1,-1,torch_mm,0,torch_mm_cublas
2026-03-03T06:16:17.607808+00:00,TORCH,llm_style,eval,llm_style_eval_253,8,6144,4096,bf16,NVIDIA GeForce RTX 4060,torch_cublas,-1,-1,-1,-1,-1,-1,0.0,0.0,606.2080264091492,620.0396913290024,0.6642161872799692,5,-1,-1,torch_mm,0,torch_mm_cublas
2026-03-03T06:16:17.635564+00:00,TORCH,llm_style,eval,llm_style_eval_254,4,1536,3072,bf16,NVIDIA GeForce RTX 4060,torch_cublas,-1,-1,-1,-1,-1,-1,0.0,0.0,108.5439994931221,271.17183402180655,0.34777358652969065,7,-1,-1,torch_mm,0,torch_mm_cublas
2026-03-03T06:16:17.661875+00:00,TORCH,llm_style,eval,llm_style_eval_255,1,3072,1536,bf16,NVIDIA GeForce RTX 4060,torch_cublas,-1,-1,-1,-1,-1,-1,0.0,0.0,79.8719972372055,81.41823776066303,0.11815385024082041,7,-1,-1,torch_mm,0,torch_mm_cublas
2026-03-03T06:16:18.242490+00:00,ONEKEY,llm_style,tune,llm_style_tune_000,64,6144,6144,bf16,NVIDIA GeForce RTX 4060,c11,32,128,32,4,2,8,0.0,0.0,337.8079980611801,447.2553640604019,14.303504463280678,1,-1,-1,onekey:8x4096x4096,0,onekey_rep_shape=8x4096x4096
2026-03-03T06:16:18.305740+00:00,ONEKEY,llm_style,tune,llm_style_tune_001,64,8192,1536,bf16,NVIDIA GeForce RTX 4060,c11,32,128,32,4,2,8,0.0,0.0,110.59200018644333,191.96800112724304,14.563555531003347,1,-1,-1,onekey:8x4096x4096,0,onekey_rep_shape=8x4096x4096
2026-03-03T06:16:18.434241+00:00,ONEKEY,llm_style,tune,llm_style_tune_002,32,3072,8192,bf16,NVIDIA GeForce RTX 4060,c11,32,128,32,4,2,8,0.0,0.0,235.52000522613525,300.03680706024164,6.838538978689157,2,-1,-1,onekey:8x4096x4096,0,onekey_rep_shape=8x4096x4096
2026-03-03T06:16:18.531887+00:00,ONEKEY,llm_style,tune,llm_style_tune_003,4,6144,3072,bf16,NVIDIA GeForce RTX 4060,c11,32,128,32,4,2,8,0.0,0.0,180.2240014076233,275.2131150662896,0.8378181752744785,5,-1,-1,onekey:8x4096x4096,0,onekey_rep_shape=8x4096x4096
2026-03-03T06:16:18.562066+00:00,ONEKEY,llm_style,tune,llm_style_tune_004,8,8192,1024,bf16,NVIDIA GeForce RTX 4060,c11,32,128,32,4,2,8,0.0,0.0,53.247999399900436,63.06816082447766,2.520615413022465,5,-1,-1,onekey:8x4096x4096,0,onekey_rep_shape=8x4096x4096
2026-03-03T06:16:18.692247+00:00,ONEKEY,llm_style,tune,llm_style_tune_005,32,8192,3072,bf16,NVIDIA GeForce RTX 4060,c11,32,128,32,4,2,8,0.0,0.0,261.4559978246689,278.5689499974251,6.160167482866732,1,-1,-1,onekey:8x4096x4096,0,onekey_rep_shape=8x4096x4096
2026-03-03T06:16:18.936007+00:00,ONEKEY,llm_style,tune,llm_style_tune_006,32,6144,8192,bf16,NVIDIA GeForce RTX 4060,c11,32,128,32,4,2,8,0.0,0.0,433.50400030612946,623.8086348772047,7.430670696753093,0,-1,-1,onekey:8x4096x4096,0,onekey_rep_shape=8x4096x4096
2026-03-03T06:16:18.955666+00:00,ONEKEY,llm_style,tune,llm_style_tune_007,8,1536,2048,bf16,NVIDIA GeForce RTX 4060,c11,32,128,32,4,2,8,0.0,0.0,78.8159966468811,166.89152404665927,0.6385968602985586,7,-1,-1,onekey:8x4096x4096,0,onekey_rep_shape=8x4096x4096
2026-03-03T06:16:18.984507+00:00,ONEKEY,llm_style,tune,llm_style_tune_008,16,1536,4096,bf16,NVIDIA GeForce RTX 4060,c11,32,128,32,4,2,8,0.0,0.0,103.42399775981903,194.58400189876554,1.9466139035501182,7,-1,-1,onekey:8x4096x4096,0,onekey_rep_shape=8x4096x4096
2026-03-03T06:16:19.000370+00:00,ONEKEY,llm_style,tune,llm_style_tune_009,64,1536,2048,bf16,NVIDIA GeForce RTX 4060,c11,32,128,32,4,2,8,0.0,0.0,68.60800087451935,179.45024043321604,5.868895447579545,3,-1,-1,onekey:8x4096x4096,0,onekey_rep_shape=8x4096x4096
2026-03-03T06:16:19.013100+00:00,ONEKEY,llm_style,tune,llm_style_tune_010,2,2048,1024,bf16,NVIDIA GeForce RTX 4060,c11,32,128,32,4,2,8,0.0,0.0,44.03200000524521,107.14783944189537,0.1905116278842825,7,-1,-1,onekey:8x4096x4096,0,onekey_rep_shape=8x4096x4096
2026-03-03T06:16:19.159451+00:00,ONEKEY,llm_style,tune,llm_style_tune_011,2,3072,8192,bf16,NVIDIA GeForce RTX 4060,c11,32,128,32,4,2,8,0.0,0.0,233.8239997625351,340.81791996955866,0.4305088275892583,6,-1,-1,onekey:8x4096x4096,0,onekey_rep_shape=8x4096x4096
2026-03-03T06:16:19.177226+00:00,ONEKEY,llm_style,tune,llm_style_tune_012,64,2048,1536,bf16,NVIDIA GeForce RTX 4060,c11,32,128,32,4,2,8,0.0,0.0,75.0880017876625,192.73663863539693,5.362417089465801,3,-1,-1,onekey:8x4096x4096,0,onekey_rep_shape=8x4096x4096
2026-03-03T06:16:19.347891+00:00,ONEKEY,llm_style,tune,llm_style_tune_013,16,8192,4096,bf16,NVIDIA GeForce RTX 4060,c11,32,128,32,4,2,8,0.0,0.0,296.9599962234497,370.51232129335386,3.6157793563280327,5,-1,-1,onekey:8x4096x4096,0,onekey_rep_shape=8x4096x4096
2026-03-03T06:16:19.508944+00:00,ONEKEY,llm_style,tune,llm_style_tune_014,4,8192,4096,bf16,NVIDIA GeForce RTX 4060,c11,32,128,32,4,2,8,0.0,0.0,297.2799986600876,478.2387366890906,0.9029718017017732,5,-1,-1,onekey:8x4096x4096,0,onekey_rep_shape=8x4096x4096
2026-03-03T06:16:19.535044+00:00,ONEKEY,llm_style,tune,llm_style_tune_015,4,3072,2048,bf16,NVIDIA GeForce RTX 4060,c11,32,128,32,4,2,8,0.0,0.0,52.73599922657013,66.05824001133442,0.9544077809877026,7,-1,-1,onekey:8x4096x4096,0,onekey_rep_shape=8x4096x4096
2026-03-03T06:16:19.544304+00:00,ONEKEY,llm_style,tune,llm_style_tune_016,16,1536,1024,bf16,NVIDIA GeForce RTX 4060,c11,32,128,32,4,2,8,0.0,0.0,40.95999896526337,135.2191986516115,1.2288000310421,7,-1,-1,onekey:8x4096x4096,0,onekey_rep_shape=8x4096x4096
2026-03-03T06:16:19.555261+00:00,ONEKEY,llm_style,tune,llm_style_tune_017,32,1024,2048,bf16,NVIDIA GeForce RTX 4060,c11,32,128,32,4,2,8,0.0,0.0,55.296000093221664,105.2399976551532,2.4272592551672245,3,-1,-1,onekey:8x4096x4096,0,onekey_rep_shape=8x4096x4096
2026-03-03T06:16:19.569445+00:00,ONEKEY,llm_style,tune,llm_style_tune_018,64,1536,2048,bf16,NVIDIA GeForce RTX 4060,c11,32,128,32,4,2,8,0.0,0.0,53.13599854707718,68.00895951688288,7.577785211719684,3,-1,-1,onekey:8x4096x4096,0,onekey_rep_shape=8x4096x4096
2026-03-03T06:16:19.592232+00:00,ONEKEY,llm_style,tune,llm_style_tune_019,4,4096,1536,bf16,NVIDIA GeForce RTX 4060,c11,32,128,32,4,2,8,0.0,0.0,50.175998359918594,152.36448615789408,1.0031020736042942,7,-1,-1,onekey:8x4096x4096,0,onekey_rep_shape=8x4096x4096
2026-03-03T06:16:19.654772+00:00,ONEKEY,llm_style,tune,llm_style_tune_020,1,8192,1536,bf16,NVIDIA GeForce RTX 4060,c11,32,128,32,4,2,8,0.0,0.0,46.06400057673454,125.8841582387685,0.5463230219893332,5,-1,-1,onekey:8x4096x4096,0,onekey_rep_shape=8x4096x4096
2026-03-03T06:16:19.682879+00:00,ONEKEY,llm_style,tune,llm_style_tune_021,64,1536,4096,bf16,NVIDIA GeForce RTX 4060,c11,32,128,32,4,2,8,0.0,0.0,93.18400174379349,370.0380855798718,8.642109728386261,3,-1,-1,onekey:8x4096x4096,0,onekey_rep_shape=8x4096x4096
2026-03-03T06:16:19.715459+00:00,ONEKEY,llm_style,tune,llm_style_tune_022,64,1024,6144,bf16,NVIDIA GeForce RTX 4060,c11,32,128,32,4,2,8,0.0,0.0,111.61600053310394,197.77535974979398,7.214972442603836,3,-1,-1,onekey:8x4096x4096,0,onekey_rep_shape=8x4096x4096
2026-03-03T06:16:19.733931+00:00,ONEKEY,llm_style,tune,llm_style_tune_023,8,4096,1024,bf16,NVIDIA GeForce RTX 4060,c11,32,128,32,4,2,8,0.0,0.0,47.10400104522705,91.16960026323792,1.4246956205602412,7,-1,-1,onekey:8x4096x4096,0,onekey_rep_shape=8x4096x4096
2026-03-03T06:16:19.733965+00:00,ONEKEY,llm_style,tune,llm_style_tune_024,8,4096,4096,bf16,NVIDIA GeForce RTX 4060,c11,32,128,32,4,2,8,0.0,387.185,161.79199516773224,209.01856064796448,1.6591392900601099,7,-1,-1,onekey:8x4096x4096,0,onekey_rep_shape=8x4096x4096
2026-03-03T06:16:19.757521+00:00,ONEKEY,llm_style,tune,llm_style_tune_025,32,6144,1024,bf16,NVIDIA GeForce RTX 4060,c11,32,128,32,4,2,8,0.0,0.0,43.007999658584595,81.79519932717076,9.362285788607435,1,-1,-1,onekey:8x4096x4096,0,onekey_rep_shape=8x4096x4096
2026-03-03T06:16:19.776232+00:00,ONEKEY,llm_style,tune,llm_style_tune_026,1,3072,1536,bf16,NVIDIA GeForce RTX 4060,c11,32,128,32,4,2,8,0.0,0.0,44.99199986457825,111.56831599771965,0.20975248996277224,7,-1,-1,onekey:8x4096x4096,0,onekey_rep_shape=8x4096x4096
2026-03-03T06:16:19.822300+00:00,ONEKEY,llm_style,tune,llm_style_tune_027,1,6144,1536,bf16,NVIDIA GeForce RTX 4060,c11,32,128,32,4,2,8,0.0,0.0,67.58400052785873,81.97376064956185,0.27927272509149287,5,-1,-1,onekey:8x4096x4096,0,onekey_rep_shape=8x4096x4096
2026-03-03T06:16:19.847418+00:00,ONEKEY,llm_style,tune,llm_style_tune_028,4,4096,1536,bf16,NVIDIA GeForce RTX 4060,c11,32,128,32,4,2,8,0.0,0.0,67.56800040602684,215.82848221063608,0.7449036185405685,7,-1,-1,onekey:8x4096x4096,0,onekey_rep_shape=8x4096x4096
2026-03-03T06:16:19.878082+00:00,ONEKEY,llm_style,tune,llm_style_tune_029,16,1024,6144,bf16,NVIDIA GeForce RTX 4060,c11,32,128,32,4,2,8,0.0,0.0,173.0080023407936,192.67583802342412,1.1636836983032959,7,-1,-1,onekey:8x4096x4096,0,onekey_rep_shape=8x4096x4096
2026-03-03T06:16:20.055635+00:00,ONEKEY,llm_style,tune,llm_style_tune_030,64,4096,8192,bf16,NVIDIA GeForce RTX 4060,c11,32,128,32,4,2,8,0.0,0.0,511.9680166244507,613.727343082428,8.389132048361008,2,-1,-1,onekey:8x4096x4096,0,onekey_rep_shape=8x4096x4096
2026-03-03T06:16:20.081331+00:00,ONEKEY,llm_style,tune,llm_style_tune_031,1,6144,1024,bf16,NVIDIA GeForce RTX 4060,c11,32,128,32,4,2,8,0.0,0.0,57.74400010704994,218.19008603692032,0.21790856152453764,5,-1,-1,onekey:8x4096x4096,0,onekey_rep_shape=8x4096x4096
2026-03-03T06:16:20.105187+00:00,ONEKEY,llm_style,tune,llm_style_tune_032,64,1024,4096,bf16,NVIDIA GeForce RTX 4060,c11,32,128,32,4,2,8,0.0,0.0,143.36000382900238,192.6742370426653,3.7449141856913686,3,-1,-1,onekey:8x4096x4096,0,onekey_rep_shape=8x4096x4096
2026-03-03T06:16:20.274439+00:00,ONEKEY,llm_style,tune,llm_style_tune_033,2,4096,8192,bf16,NVIDIA GeForce RTX 4060,c11,32,128,32,4,2,8,0.0,0.0,474.62400794029236,541.532149016857,0.2827874817847069,6,-1,-1,onekey:8x4096x4096,0,onekey_rep_shape=8x4096x4096
2026-03-03T06:16:20.532050+00:00,ONEKEY,llm_style,tune,llm_style_tune_034,1,8192,6144,bf16,NVIDIA GeForce RTX 4060,c11,32,128,32,4,2,8,0.0,0.0,688.9600157737732,733.8905733823776,0.14610905378441263,5,-1,-1,onekey:8x4096x4096,0,onekey_rep_shape=8x4096x4096
2026-03-03T06:16:20.544558+00:00,ONEKEY,llm_style,tune,llm_style_tune_035,64,1536,1024,bf16,NVIDIA GeForce RTX 4060,c11,32,128,32,4,2,8,0.0,0.0,57.82400071620941,192.06143766641605,3.4817132938981072,3,-1,-1,onekey:8x4096x4096,0,onekey_rep_shape=8x4096x4096
2026-03-03T06:16:20.569852+00:00,ONEKEY,llm_style,tune,llm_style_tune_036,32,3072,2048,bf16,NVIDIA GeForce RTX 4060,c11,32,128,32,4,2,8,0.0,0.0,85.90399846434593,137.11584120988837,4.687246125884575,3,-1,-1,onekey:8x4096x4096,0,onekey_rep_shape=8x4096x4096
2026-03-03T06:16:20.624213+00:00,ONEKEY,llm_style,tune,llm_style_tune_037,4,1536,6144,bf16,NVIDIA GeForce RTX 4060,c11,32,128,32,4,2,8,0.0,0.0,203.77600193023682,211.43488064408302,0.370492458802125,7,-1,-1,onekey:8x4096x4096,0,onekey_rep_shape=8x4096x4096
2026-03-03T06:16:20.650839+00:00,ONEKEY,llm_style,tune,llm_style_tune_038,1,4096,1536,bf16,NVIDIA GeForce RTX 4060,c11,32,128,32,4,2,8,0.0,0.0,82.94399827718735,199.8851162195205,0.15170370685471,7,-1,-1,onekey:8x4096x4096,0,onekey_rep_shape=8x4096x4096
2026-03-03T06:16:20.680217+00:00,ONEKEY,llm_style,tune,llm_style_tune_039,4,1536,4096,bf16,NVIDIA GeForce RTX 4060,c11,32,128,32,4,2,8,0.0,0.0,148.47999811172485,222.39232078194615,0.33897931465575304,7,-1,-1,onekey:8x4096x4096,0,onekey_rep_shape=8x4096x4096
2026-03-03T06:16:20.931742+00:00,ONEKEY,llm_style,tune,llm_style_tune_040,2,6144,8192,bf16,NVIDIA GeForce RTX 4060,c11,32,128,32,4,2,8,0.0,0.0,689.6640062332153,723.9884787797928,0.29191981918789567,4,-1,-1,onekey:8x4096x4096,0,onekey_rep_shape=8x4096x4096
2026-03-03T06:16:20.944580+00:00,ONEKEY,llm_style,tune,llm_style_tune_041,16,1024,1536,bf16,NVIDIA GeForce RTX 4060,c11,32,128,32,4,2,8,0.0,0.0,82.94399827718735,140.8921593427658,0.60681482741884,7,-1,-1,onekey:8x4096x4096,0,onekey_rep_shape=8x4096x4096
2026-03-03T06:16:20.973495+00:00,ONEKEY,llm_style,tune,llm_style_tune_042,32,3072,2048,bf16,NVIDIA GeForce RTX 4060,c11,32,128,32,4,2,8,0.0,0.0,124.84799697995186,233.86111691594115,3.225147329072954,3,-1,-1,onekey:8x4096x4096,0,onekey_rep_shape=8x4096x4096
2026-03-03T06:16:21.012625+00:00,ONEKEY,llm_style,tune,llm_style_tune_043,2,2048,4096,bf16,NVIDIA GeForce RTX 4060,c11,32,128,32,4,2,8,0.0,0.0,159.743994474411,238.13343748450274,0.21005128931701406,7,-1,-1,onekey:8x4096x4096,0,onekey_rep_shape=8x4096x4096
2026-03-03T06:16:21.112139+00:00,ONEKEY,llm_style,tune,llm_style_tune_044,64,2048,8192,bf16,NVIDIA GeForce RTX 4060,c11,32,128,32,4,2,8,0.0,0.0,366.43199622631073,489.68640893697733,5.860524381374438,2,-1,-1,onekey:8x4096x4096,0,onekey_rep_shape=8x4096x4096
2026-03-03T06:16:21.276235+00:00,ONEKEY,llm_style,tune,llm_style_tune_045,2,3072,8192,bf16,NVIDIA GeForce RTX 4060,c11,32,128,32,4,2,8,0.0,0.0,387.48799264431,533.0432057380676,0.2597842976063588,6,-1,-1,onekey:8x4096x4096,0,onekey_rep_shape=8x4096x4096
2026-03-03T06:16:21.539575+00:00,ONEKEY,llm_style,tune,llm_style_tune_046,4,8192,6144,bf16,NVIDIA GeForce RTX 4060,c11,32,128,32,4,2,8,0.0,0.0,691.5840208530426,803.5369563102722,0.5822187497960734,5,-1,-1,onekey:8x4096x4096,0,onekey_rep_shape=8x4096x4096
2026-03-03T06:16:21.574465+00:00,ONEKEY,llm_style,tune,llm_style_tune_047,1,1024,6144,bf16,NVIDIA GeForce RTX 4060,c11,32,128,32,4,2,8,0.0,0.0,231.34399950504303,299.7228875756263,0.05439048355228987,7,-1,-1,onekey:8x4096x4096,0,onekey_rep_shape=8x4096x4096
2026-03-03T06:16:21.647468+00:00,ONEKEY,llm_style,tune,llm_style_tune_048,32,4096,3072,bf16,NVIDIA GeForce RTX 4060,c11,32,128,32,4,2,8,0.0,0.0,163.83999586105347,260.7718387246131,4.9152001241684,3,-1,-1,onekey:8x4096x4096,0,onekey_rep_shape=8x4096x4096
2026-03-03T06:16:21.659918+00:00,ONEKEY,llm_style,tune,llm_style_tune_049,16,2048,1024,bf16,NVIDIA GeForce RTX 4060,c11,32,128,32,4,2,8,0.0,0.0,64.51199948787689,119.65439945459359,1.0402539765119372,7,-1,-1,onekey:8x4096x4096,0,onekey_rep_shape=8x4096x4096
2026-03-03T06:16:21.671415+00:00,ONEKEY,llm_style,tune,llm_style_tune_050,4,1024,1536,bf16,NVIDIA GeForce RTX 4060,c11,32,128,32,4,2,8,0.0,0.0,78.33599671721458,137.09311760961992,0.16062745771172227,7,-1,-1,onekey:8x4096x4096,0,onekey_rep_shape=8x4096x4096
2026-03-03T06:16:21.853106+00:00,ONEKEY,llm_style,tune,llm_style_tune_051,64,4096,8192,bf16,NVIDIA GeForce RTX 4060,c11,32,128,32,4,2,8,0.0,0.0,636.3040208816528,663.6748659610748,6.749866659728099,2,-1,-1,onekey:8x4096x4096,0,onekey_rep_shape=8x4096x4096
2026-03-03T06:16:21.872810+00:00,ONEKEY,llm_style,tune,llm_style_tune_052,16,2048,1536,bf16,NVIDIA GeForce RTX 4060,c11,32,128,32,4,2,8,0.0,0.0,109.26399752497673,157.01984524726862,0.9212851284979695,7,-1,-1,onekey:8x4096x4096,0,onekey_rep_shape=8x4096x4096
2026-03-03T06:16:21.882794+00:00,ONEKEY,llm_style,tune,llm_style_tune_053,64,1024,1024,bf16,NVIDIA GeForce RTX 4060,c11,32,128,32,4,2,8,0.0,0.0,67.34399870038033,172.71039411425585,1.993016907076562,3,-1,-1,onekey:8x4096x4096,0,onekey_rep_shape=8x4096x4096
2026-03-03T06:16:22.063723+00:00,ONEKEY,llm_style,tune,llm_style_tune_054,4,4096,8192,bf16,NVIDIA GeForce RTX 4060,c11,32,128,32,4,2,8,0.0,0.0,479.2320132255554,605.106555223465,0.5601367366784367,6,-1,-1,onekey:8x4096x4096,0,onekey_rep_shape=8x4096x4096
2026-03-03T06:16:22.131762+00:00,ONEKEY,llm_style,tune,llm_style_tune_055,1,4096,3072,bf16,NVIDIA GeForce RTX 4060,c11,32,128,32,4,2,8,0.0,0.0,169.98399794101715,222.8163208067417,0.14804819456436308,7,-1,-1,onekey:8x4096x4096,0,onekey_rep_shape=8x4096x4096
2026-03-03T06:16:22.151257+00:00,ONEKEY,llm_style,tune,llm_style_tune_056,64,1536,2048,bf16,NVIDIA GeForce RTX 4060,c11,32,128,32,4,2,8,0.0,0.0,116.09600111842155,250.0198425352573,3.4682778056177934,3,-1,-1,onekey:8x4096x4096,0,onekey_rep_shape=8x4096x4096
2026-03-03T06:16:22.190230+00:00,ONEKEY,llm_style,tune,llm_style_tune_057,2,4096,2048,bf16,NVIDIA GeForce RTX 4060,c11,32,128,32,4,2,8,0.0,0.0,125.29599666595459,227.7174411714077,0.2678013096416624,7,-1,-1,onekey:8x4096x4096,0,onekey_rep_shape=8x4096x4096
2026-03-03T06:16:22.253786+00:00,ONEKEY,llm_style,tune,llm_style_tune_058,4,8192,1536,bf16,NVIDIA GeForce RTX 4060,c11,32,128,32,4,2,8,0.0,0.0,150.52799880504608,163.8809558749199,0.6687346991862454,5,-1,-1,onekey:8x4096x4096,0,onekey_rep_shape=8x4096x4096
2026-03-03T06:16:22.286130+00:00,ONEKEY,llm_style,tune,llm_style_tune_059,1,1536,4096,bf16,NVIDIA GeForce RTX 4060,c11,32,128,32,4,2,8,0.0,0.0,182.27200210094452,306.12480282783497,0.0690337070694567,7,-1,-1,onekey:8x4096x4096,0,onekey_rep_shape=8x4096x4096
2026-03-03T06:16:22.319848+00:00,ONEKEY,llm_style,tune,llm_style_tune_060,64,1536,4096,bf16,NVIDIA GeForce RTX 4060,c11,32,128,32,4,2,8,0.0,0.0,194.48000192642212,206.34623900055885,4.140818387613306,3,-1,-1,onekey:8x4096x4096,0,onekey_rep_shape=8x4096x4096
2026-03-03T06:16:22.577232+00:00,ONEKEY,llm_style,tune,llm_style_tune_061,8,8192,6144,bf16,NVIDIA GeForce RTX 4060,c11,32,128,32,4,2,8,0.0,0.0,698.2080042362213,811.048966050148,1.1533903408640163,5,-1,-1,onekey:8x4096x4096,0,onekey_rep_shape=8x4096x4096
2026-03-03T06:16:22.635471+00:00,ONEKEY,llm_style,tune,llm_style_tune_062,64,6144,1536,bf16,NVIDIA GeForce RTX 4060,c11,32,128,32,4,2,8,0.0,0.0,195.5839991569519,284.16481018066395,6.176167565888857,1,-1,-1,onekey:8x4096x4096,0,onekey_rep_shape=8x4096x4096
2026-03-03T06:16:22.650290+00:00,ONEKEY,llm_style,tune,llm_style_tune_063,2,1536,1024,bf16,NVIDIA GeForce RTX 4060,c11,32,128,32,4,2,8,0.0,0.0,73.72800260782242,101.12000063061708,0.08533333031502047,7,-1,-1,onekey:8x4096x4096,0,onekey_rep_shape=8x4096x4096
2026-03-03T06:16:22.661553+00:00,ONEKEY,llm_style,eval,llm_style_eval_000,32,1536,1024,bf16,NVIDIA GeForce RTX 4060,c11,32,128,32,4,2,8,0.0,0.0,81.28000050783157,113.0086408555507,1.238475582813275,3,-1,-1,onekey:8x4096x4096,0,onekey_rep_shape=8x4096x4096
2026-03-03T06:16:22.765481+00:00,ONEKEY,llm_style,eval,llm_style_eval_001,32,2048,8192,bf16,NVIDIA GeForce RTX 4060,c11,32,128,32,4,2,8,0.0,0.0,448.5119879245758,592.7424103021622,2.3940091968747246,2,-1,-1,onekey:8x4096x4096,0,onekey_rep_shape=8x4096x4096
2026-03-03T06:16:22.812509+00:00,ONEKEY,llm_style,eval,llm_style_eval_002,16,2048,4096,bf16,NVIDIA GeForce RTX 4060,c11,32,128,32,4,2,8,0.0,0.0,214.9439975619316,381.8540814518926,1.248862303878274,7,-1,-1,onekey:8x4096x4096,0,onekey_rep_shape=8x4096x4096
2026-03-03T06:16:22.830725+00:00,ONEKEY,llm_style,eval,llm_style_eval_003,16,2048,1536,bf16,NVIDIA GeForce RTX 4060,c11,32,128,32,4,2,8,0.0,0.0,100.70399940013885,190.96192076802254,0.9995958114833441,7,-1,-1,onekey:8x4096x4096,0,onekey_rep_shape=8x4096x4096
2026-03-03T06:16:22.926835+00:00,ONEKEY,llm_style,eval,llm_style_eval_004,64,8192,2048,bf16,NVIDIA GeForce RTX 4060,c11,32,128,32,4,2,8,0.0,0.0,380.8640092611313,504.87327486276627,5.638452559920472,1,-1,-1,onekey:8x4096x4096,0,onekey_rep_shape=8x4096x4096
2026-03-03T06:16:23.072930+00:00,ONEKEY,llm_style,eval,llm_style_eval_005,64,3072,8192,bf16,NVIDIA GeForce RTX 4060,c11,32,128,32,4,2,8,0.0,0.0,514.0479803085327,648.7142324447632,6.266390678291574,2,-1,-1,onekey:8x4096x4096,0,onekey_rep_shape=8x4096x4096
2026-03-03T06:16:23.096769+00:00,ONEKEY,llm_style,eval,llm_style_eval_006,32,2048,2048,bf16,NVIDIA GeForce RTX 4060,c11,32,128,32,4,2,8,0.0,0.0,131.071999669075,171.05312198400497,2.048000005170703,3,-1,-1,onekey:8x4096x4096,0,onekey_rep_shape=8x4096x4096
2026-03-03T06:16:23.192198+00:00,ONEKEY,llm_style,eval,llm_style_eval_007,8,8192,2048,bf16,NVIDIA GeForce RTX 4060,c11,32,128,32,4,2,8,0.0,0.0,265.21599292755127,376.2585604190825,1.0121390231294543,5,-1,-1,onekey:8x4096x4096,0,onekey_rep_shape=8x4096x4096
2026-03-03T06:16:23.280515+00:00,ONEKEY,llm_style,eval,llm_style_eval_008,64,1536,8192,bf16,NVIDIA GeForce RTX 4060,c11,32,128,32,4,2,8,0.0,0.0,463.24799954891205,578.457909822464,3.4767829274348405,2,-1,-1,onekey:8x4096x4096,0,onekey_rep_shape=8x4096x4096
2026-03-03T06:16:23.435604+00:00,ONEKEY,llm_style,eval,llm_style_eval_009,64,4096,6144,bf16,NVIDIA GeForce RTX 4060,c11,32,128,32,4,2,8,0.0,0.0,636.4000141620636,646.5971255302429,5.061636392703933,3,-1,-1,onekey:8x4096x4096,0,onekey_rep_shape=8x4096x4096
2026-03-03T06:16:23.482554+00:00,ONEKEY,llm_style,eval,llm_style_eval_010,64,2048,4096,bf16,NVIDIA GeForce RTX 4060,c11,32,128,32,4,2,8,0.0,0.0,270.84800601005554,395.86816370487213,3.9643704224284972,3,-1,-1,onekey:8x4096x4096,0,onekey_rep_shape=8x4096x4096
2026-03-03T06:16:23.601022+00:00,ONEKEY,llm_style,eval,llm_style_eval_011,32,3072,6144,bf16,NVIDIA GeForce RTX 4060,c11,32,128,32,4,2,8,0.0,0.0,404.4800102710724,542.614095211029,2.9864505570756283,3,-1,-1,onekey:8x4096x4096,0,onekey_rep_shape=8x4096x4096
2026-03-03T06:16:23.620730+00:00,ONEKEY,llm_style,eval,llm_style_eval_012,16,1536,1536,bf16,NVIDIA GeForce RTX 4060,c11,32,128,32,4,2,8,0.0,0.0,102.27199643850327,163.3308823406696,0.738202779148807,7,-1,-1,onekey:8x4096x4096,0,onekey_rep_shape=8x4096x4096
2026-03-03T06:16:23.656004+00:00,ONEKEY,llm_style,eval,llm_style_eval_013,64,2048,3072,bf16,NVIDIA GeForce RTX 4060,c11,32,128,32,4,2,8,0.0,0.0,218.1120067834854,288.0310362577438,3.6921688992546313,3,-1,-1,onekey:8x4096x4096,0,onekey_rep_shape=8x4096x4096
2026-03-03T06:16:23.921161+00:00,ONEKEY,llm_style,eval,llm_style_eval_014,16,8192,6144,bf16,NVIDIA GeForce RTX 4060,c11,32,128,32,4,2,8,0.0,0.0,697.8240013122559,731.1769539117813,2.3080500713234966,5,-1,-1,onekey:8x4096x4096,0,onekey_rep_shape=8x4096x4096
2026-03-03T06:16:23.981252+00:00,ONEKEY,llm_style,eval,llm_style_eval_015,64,6144,1536,bf16,NVIDIA GeForce RTX 4060,c11,32,128,32,4,2,8,0.0,0.0,233.47200453281403,337.5308823585509,5.173894636391935,1,-1,-1,onekey:8x4096x4096,0,onekey_rep_shape=8x4096x4096
2026-03-03T06:16:24.075210+00:00,ONEKEY,llm_style,eval,llm_style_eval_016,16,4096,4096,bf16,NVIDIA GeForce RTX 4060,c11,32,128,32,4,2,8,0.0,0.0,304.1279911994934,381.55263870954514,1.7652795123610914,7,-1,-1,onekey:8x4096x4096,0,onekey_rep_shape=8x4096x4096
2026-03-03T06:16:24.275863+00:00,ONEKEY,llm_style,eval,llm_style_eval_017,64,8192,4096,bf16,NVIDIA GeForce RTX 4060,c11,32,128,32,4,2,8,0.0,0.0,898.5599875450134,1086.3922965526579,4.77983368448714,1,-1,-1,onekey:8x4096x4096,0,onekey_rep_shape=8x4096x4096
2026-03-03T06:16:24.417164+00:00,ONEKEY,llm_style,eval,llm_style_eval_018,32,4096,6144,bf16,NVIDIA GeForce RTX 4060,c11,32,128,32,4,2,8,0.0,0.0,478.7200093269348,591.3350343704224,3.3644149077129044,3,-1,-1,onekey:8x4096x4096,0,onekey_rep_shape=8x4096x4096
2026-03-03T06:16:24.572479+00:00,ONEKEY,llm_style,eval,llm_style_eval_019,16,3072,8192,bf16,NVIDIA GeForce RTX 4060,c11,32,128,32,4,2,8,0.0,0.0,570.3680217266083,597.4828922748566,1.4119065889461868,6,-1,-1,onekey:8x4096x4096,0,onekey_rep_shape=8x4096x4096
2026-03-03T06:16:24.589813+00:00,ONEKEY,llm_style,eval,llm_style_eval_020,4,1536,1536,bf16,NVIDIA GeForce RTX 4060,c11,32,128,32,4,2,8,0.0,0.0,121.77599966526031,129.6076828241348,0.15499251126562003,7,-1,-1,onekey:8x4096x4096,0,onekey_rep_shape=8x4096x4096
2026-03-03T06:16:24.649915+00:00,ONEKEY,llm_style,eval,llm_style_eval_021,4,6144,1536,bf16,NVIDIA GeForce RTX 4060,c11,32,128,32,4,2,8,0.0,0.0,140.28799533843994,158.74399721622464,0.5381606018238764,5,-1,-1,onekey:8x4096x4096,0,onekey_rep_shape=8x4096x4096
2026-03-03T06:16:24.682244+00:00,ONEKEY,llm_style,eval,llm_style_eval_022,32,6144,1024,bf16,NVIDIA GeForce RTX 4060,c11,32,128,32,4,2,8,0.0,0.0,104.44799810647964,188.88927936553944,3.855058893417131,1,-1,-1,onekey:8x4096x4096,0,onekey_rep_shape=8x4096x4096
2026-03-03T06:16:24.699711+00:00,ONEKEY,llm_style,eval,llm_style_eval_023,16,1024,1536,bf16,NVIDIA GeForce RTX 4060,c11,32,128,32,4,2,8,0.0,0.0,123.90399724245071,135.16800105571747,0.4062148850735857,7,-1,-1,onekey:8x4096x4096,0,onekey_rep_shape=8x4096x4096
2026-03-03T06:16:24.736307+00:00,ONEKEY,llm_style,eval,llm_style_eval_024,32,8192,1024,bf16,NVIDIA GeForce RTX 4060,c11,32,128,32,4,2,8,0.0,0.0,152.5759994983673,169.6051214635372,3.518711420964639,1,-1,-1,onekey:8x4096x4096,0,onekey_rep_shape=8x4096x4096
2026-03-03T06:16:24.930622+00:00,ONEKEY,llm_style,eval,llm_style_eval_025,32,6144,6144,bf16,NVIDIA GeForce RTX 4060,c11,32,128,32,4,2,8,0.0,0.0,529.9199819564819,655.4624134302139,4.559026242189146,1,-1,-1,onekey:8x4096x4096,0,onekey_rep_shape=8x4096x4096
2026-03-03T06:16:24.996035+00:00,ONEKEY,llm_style,eval,llm_style_eval_026,1,6144,2048,bf16,NVIDIA GeForce RTX 4060,c11,32,128,32,4,2,8,0.0,0.0,185.34399569034576,285.56320667266834,0.13577900868202142,5,-1,-1,onekey:8x4096x4096,0,onekey_rep_shape=8x4096x4096
2026-03-03T06:16:25.068972+00:00,ONEKEY,llm_style,eval,llm_style_eval_027,32,4096,3072,bf16,NVIDIA GeForce RTX 4060,c11,32,128,32,4,2,8,0.0,0.0,264.19198513031006,369.7356668114659,3.048186218074673,3,-1,-1,onekey:8x4096x4096,0,onekey_rep_shape=8x4096x4096
2026-03-03T06:16:25.089259+00:00,ONEKEY,llm_style,eval,llm_style_eval_028,64,1536,1536,bf16,NVIDIA GeForce RTX 4060,c11,32,128,32,4,2,8,0.0,0.0,133.5199996829033,149.00224208831787,2.26175770459254,3,-1,-1,onekey:8x4096x4096,0,onekey_rep_shape=8x4096x4096
2026-03-03T06:16:25.107934+00:00,ONEKEY,llm_style,eval,llm_style_eval_029,2,3072,1024,bf16,NVIDIA GeForce RTX 4060,c11,32,128,32,4,2,8,0.0,0.0,99.83999654650688,167.8905637562275,0.12603077359020842,7,-1,-1,onekey:8x4096x4096,0,onekey_rep_shape=8x4096x4096
2026-03-03T06:16:25.202721+00:00,ONEKEY,llm_style,eval,llm_style_eval_030,32,1536,8192,bf16,NVIDIA GeForce RTX 4060,c11,32,128,32,4,2,8,0.0,0.0,604.9120128154755,735.1916968822479,1.3312785180969013,2,-1,-1,onekey:8x4096x4096,0,onekey_rep_shape=8x4096x4096
2026-03-03T06:16:25.236191+00:00,ONEKEY,llm_style,eval,llm_style_eval_031,8,3072,2048,bf16,NVIDIA GeForce RTX 4060,c11,32,128,32,4,2,8,0.0,0.0,152.5759994983673,229.56896603107447,0.6597583914308698,7,-1,-1,onekey:8x4096x4096,0,onekey_rep_shape=8x4096x4096
2026-03-03T06:16:25.271470+00:00,ONEKEY,llm_style,eval,llm_style_eval_032,8,2048,3072,bf16,NVIDIA GeForce RTX 4060,c11,32,128,32,4,2,8,0.0,0.0,238.5919988155365,385.1263961195946,0.42190558149364504,7,-1,-1,onekey:8x4096x4096,0,onekey_rep_shape=8x4096x4096
2026-03-03T06:16:25.373148+00:00,ONEKEY,llm_style,eval,llm_style_eval_033,64,1536,8192,bf16,NVIDIA GeForce RTX 4060,c11,32,128,32,4,2,8,0.0,0.0,616.4479851722717,728.4608036279678,2.612730959855275,2,-1,-1,onekey:8x4096x4096,0,onekey_rep_shape=8x4096x4096
2026-03-03T06:16:25.453380+00:00,ONEKEY,llm_style,eval,llm_style_eval_034,64,6144,2048,bf16,NVIDIA GeForce RTX 4060,c11,32,128,32,4,2,8,0.0,0.0,339.4399881362915,509.3888118863104,4.744911596430144,1,-1,-1,onekey:8x4096x4096,0,onekey_rep_shape=8x4096x4096
2026-03-03T06:16:25.491525+00:00,ONEKEY,llm_style,eval,llm_style_eval_035,4,4096,2048,bf16,NVIDIA GeForce RTX 4060,c11,32,128,32,4,2,8,0.0,0.0,172.88000136613846,255.36767959594707,0.38818176463263515,7,-1,-1,onekey:8x4096x4096,0,onekey_rep_shape=8x4096x4096
2026-03-03T06:16:25.709788+00:00,ONEKEY,llm_style,eval,llm_style_eval_036,64,8192,4096,bf16,NVIDIA GeForce RTX 4060,c11,32,128,32,4,2,8,0.0,0.0,936.8480145931244,1085.479644536972,4.5844867354128045,1,-1,-1,onekey:8x4096x4096,0,onekey_rep_shape=8x4096x4096
2026-03-03T06:16:25.739778+00:00,ONEKEY,llm_style,eval,llm_style_eval_037,32,6144,1024,bf16,NVIDIA GeForce RTX 4060,c11,32,128,32,4,2,8,0.0,0.0,108.43199864029884,206.8889555335045,3.7134166025632367,1,-1,-1,onekey:8x4096x4096,0,onekey_rep_shape=8x4096x4096
2026-03-03T06:16:25.819298+00:00,ONEKEY,llm_style,eval,llm_style_eval_038,64,6144,2048,bf16,NVIDIA GeForce RTX 4060,c11,32,128,32,4,2,8,0.0,0.0,336.86400949954987,452.67968028783787,4.781195647444647,1,-1,-1,onekey:8x4096x4096,0,onekey_rep_shape=8x4096x4096
2026-03-03T06:16:25.844495+00:00,ONEKEY,llm_style,eval,llm_style_eval_039,8,1024,3072,bf16,NVIDIA GeForce RTX 4060,c11,32,128,32,4,2,8,0.0,0.0,217.95200556516647,264.9171192944048,0.2309299603345522,7,-1,-1,onekey:8x4096x4096,0,onekey_rep_shape=8x4096x4096
2026-03-03T06:16:25.934637+00:00,ONEKEY,llm_style,eval,llm_style_eval_040,32,8192,2048,bf16,NVIDIA GeForce RTX 4060,c11,32,128,32,4,2,8,0.0,0.0,281.5999984741211,452.4099224805829,3.8130036570247934,1,-1,-1,onekey:8x4096x4096,0,onekey_rep_shape=8x4096x4096
2026-03-03T06:16:25.952035+00:00,ONEKEY,llm_style,eval,llm_style_eval_041,32,3072,1024,bf16,NVIDIA GeForce RTX 4060,c11,32,128,32,4,2,8,0.0,0.0,95.20000219345093,102.92223758995533,2.114775077325049,3,-1,-1,onekey:8x4096x4096,0,onekey_rep_shape=8x4096x4096
2026-03-03T06:16:25.984184+00:00,ONEKEY,llm_style,eval,llm_style_eval_042,64,1024,4096,bf16,NVIDIA GeForce RTX 4060,c11,32,128,32,4,2,8,0.0,0.0,279.55201268196106,345.02687305212,1.9204687773462172,3,-1,-1,onekey:8x4096x4096,0,onekey_rep_shape=8x4096x4096
2026-03-03T06:16:25.996798+00:00,ONEKEY,llm_style,eval,llm_style_eval_043,2,1536,1024,bf16,NVIDIA GeForce RTX 4060,c11,32,128,32,4,2,8,0.0,0.0,91.95199981331825,148.75520125031454,0.06842108940287289,7,-1,-1,onekey:8x4096x4096,0,onekey_rep_shape=8x4096x4096
2026-03-03T06:16:26.116543+00:00,ONEKEY,llm_style,eval,llm_style_eval_044,64,6144,3072,bf16,NVIDIA GeForce RTX 4060,c11,32,128,32,4,2,8,0.0,0.0,500.7359981536865,621.5398335456848,4.824736214108783,1,-1,-1,onekey:8x4096x4096,0,onekey_rep_shape=8x4096x4096
2026-03-03T06:16:26.186023+00:00,ONEKEY,llm_style,eval,llm_style_eval_045,64,1536,6144,bf16,NVIDIA GeForce RTX 4060,c11,32,128,32,4,2,8,0.0,0.0,385.0240111351013,534.522557258606,3.137361611393473,3,-1,-1,onekey:8x4096x4096,0,onekey_rep_shape=8x4096x4096
2026-03-03T06:16:26.284368+00:00,ONEKEY,llm_style,eval,llm_style_eval_046,2,6144,3072,bf16,NVIDIA GeForce RTX 4060,c11,32,128,32,4,2,8,0.0,0.0,284.67199206352234,461.7113560438155,0.2652086404873765,5,-1,-1,onekey:8x4096x4096,0,onekey_rep_shape=8x4096x4096
2026-03-03T06:16:26.467836+00:00,ONEKEY,llm_style,eval,llm_style_eval_047,16,4096,8192,bf16,NVIDIA GeForce RTX 4060,c11,32,128,32,4,2,8,0.0,0.0,625.0079870223999,748.00577044487,1.7179649641205588,6,-1,-1,onekey:8x4096x4096,0,onekey_rep_shape=8x4096x4096
2026-03-03T06:16:26.514339+00:00,ONEKEY,llm_style,eval,llm_style_eval_048,16,1024,6144,bf16,NVIDIA GeForce RTX 4060,c11,32,128,32,4,2,8,0.0,0.0,401.2479931116104,422.8937566280365,0.5017510254412646,7,-1,-1,onekey:8x4096x4096,0,onekey_rep_shape=8x4096x4096
2026-03-03T06:16:26.582756+00:00,ONEKEY,llm_style,eval,llm_style_eval_049,16,8192,1536,bf16,NVIDIA GeForce RTX 4060,c11,32,128,32,4,2,8,0.0,0.0,221.69599682092667,320.50176769495,1.8162402108020028,5,-1,-1,onekey:8x4096x4096,0,onekey_rep_shape=8x4096x4096
2026-03-03T06:16:26.594329+00:00,ONEKEY,llm_style,eval,llm_style_eval_050,1,1024,1024,bf16,NVIDIA GeForce RTX 4060,c11,32,128,32,4,2,8,0.0,0.0,95.23200243711472,118.28224278986454,0.02202150481278422,7,-1,-1,onekey:8x4096x4096,0,onekey_rep_shape=8x4096x4096
2026-03-03T06:16:26.622011+00:00,ONEKEY,llm_style,eval,llm_style_eval_051,16,6144,1024,bf16,NVIDIA GeForce RTX 4060,c11,32,128,32,4,2,8,0.0,0.0,102.39999741315842,197.68575876951212,1.9660800496673596,5,-1,-1,onekey:8x4096x4096,0,onekey_rep_shape=8x4096x4096
2026-03-03T06:16:26.974468+00:00,ONEKEY,llm_style,eval,llm_style_eval_052,16,8192,8192,bf16,NVIDIA GeForce RTX 4060,c11,32,128,32,4,2,8,0.0,0.0,944.5119798183441,986.356492638588,2.2736436317229356,4,-1,-1,onekey:8x4096x4096,0,onekey_rep_shape=8x4096x4096
2026-03-03T06:16:27.238020+00:00,ONEKEY,llm_style,eval,llm_style_eval_053,1,6144,8192,bf16,NVIDIA GeForce RTX 4060,c11,32,128,32,4,2,8,0.0,0.0,761.2800002098083,838.5107308626175,0.1322290037466599,4,-1,-1,onekey:8x4096x4096,0,onekey_rep_shape=8x4096x4096
2026-03-03T06:16:27.365498+00:00,ONEKEY,llm_style,eval,llm_style_eval_054,64,4096,3072,bf16,NVIDIA GeForce RTX 4060,c11,32,128,32,4,2,8,0.0,0.0,511.9200050830841,635.5865705013275,3.1462195655717715,3,-1,-1,onekey:8x4096x4096,0,onekey_rep_shape=8x4096x4096
2026-03-03T06:16:27.408388+00:00,ONEKEY,llm_style,eval,llm_style_eval_055,4,8192,1024,bf16,NVIDIA GeForce RTX 4060,c11,32,128,32,4,2,8,0.0,0.0,187.391996383667,203.8601571321487,0.3581202254903197,5,-1,-1,onekey:8x4096x4096,0,onekey_rep_shape=8x4096x4096
2026-03-03T06:16:27.439829+00:00,ONEKEY,llm_style,eval,llm_style_eval_056,64,1024,3072,bf16,NVIDIA GeForce RTX 4060,c11,32,128,32,4,2,8,0.0,0.0,229.75999861955643,322.40639358758915,1.7524947180502266,3,-1,-1,onekey:8x4096x4096,0,onekey_rep_shape=8x4096x4096
2026-03-03T06:16:27.456639+00:00,ONEKEY,llm_style,eval,llm_style_eval_057,64,1024,3072,bf16,NVIDIA GeForce RTX 4060,c11,32,128,32,4,2,8,0.0,0.0,255.98400831222534,287.74848729372025,1.572962259067689,3,-1,-1,onekey:8x4096x4096,0,onekey_rep_shape=8x4096x4096
2026-03-03T06:16:27.507380+00:00,ONEKEY,llm_style,eval,llm_style_eval_058,32,2048,4096,bf16,NVIDIA GeForce RTX 4060,c11,32,128,32,4,2,8,0.0,0.0,329.72800731658936,411.1462414264679,1.6282235663545612,3,-1,-1,onekey:8x4096x4096,0,onekey_rep_shape=8x4096x4096
2026-03-03T06:16:27.617345+00:00,ONEKEY,llm_style,eval,llm_style_eval_059,64,8192,2048,bf16,NVIDIA GeForce RTX 4060,c11,32,128,32,4,2,8,0.0,0.0,578.5279870033264,656.0051071643829,3.7119788432770364,1,-1,-1,onekey:8x4096x4096,0,onekey_rep_shape=8x4096x4096
2026-03-03T06:16:27.733376+00:00,ONEKEY,llm_style,eval,llm_style_eval_060,1,3072,6144,bf16,NVIDIA GeForce RTX 4060,c11,32,128,32,4,2,8,0.0,0.0,503.80802154541016,602.2861009836196,0.0749268260640379,7,-1,-1,onekey:8x4096x4096,0,onekey_rep_shape=8x4096x4096
2026-03-03T06:16:27.776192+00:00,ONEKEY,llm_style,eval,llm_style_eval_061,64,1536,4096,bf16,NVIDIA GeForce RTX 4060,c11,32,128,32,4,2,8,0.0,0.0,305.9840053319931,337.5001662969589,2.631857724478903,3,-1,-1,onekey:8x4096x4096,0,onekey_rep_shape=8x4096x4096
2026-03-03T06:16:27.845188+00:00,ONEKEY,llm_style,eval,llm_style_eval_062,16,6144,2048,bf16,NVIDIA GeForce RTX 4060,c11,32,128,32,4,2,8,0.0,0.0,199.68000054359436,256.4384040236472,2.016492302202755,5,-1,-1,onekey:8x4096x4096,0,onekey_rep_shape=8x4096x4096
2026-03-03T06:16:27.921433+00:00,ONEKEY,llm_style,eval,llm_style_eval_063,64,1536,6144,bf16,NVIDIA GeForce RTX 4060,c11,32,128,32,4,2,8,0.0,0.0,465.87200462818146,558.2028901576994,2.5929000669703006,3,-1,-1,onekey:8x4096x4096,0,onekey_rep_shape=8x4096x4096
2026-03-03T06:16:27.995952+00:00,ONEKEY,llm_style,eval,llm_style_eval_064,1,6144,2048,bf16,NVIDIA GeForce RTX 4060,c11,32,128,32,4,2,8,0.0,0.0,201.7280012369156,338.7699189782142,0.12475126827060802,5,-1,-1,onekey:8x4096x4096,0,onekey_rep_shape=8x4096x4096
2026-03-03T06:16:28.067326+00:00,ONEKEY,llm_style,eval,llm_style_eval_065,8,1536,6144,bf16,NVIDIA GeForce RTX 4060,c11,32,128,32,4,2,8,0.0,0.0,461.7120027542114,575.967989563942,0.327032745736049,7,-1,-1,onekey:8x4096x4096,0,onekey_rep_shape=8x4096x4096
2026-03-03T06:16:28.112816+00:00,ONEKEY,llm_style,eval,llm_style_eval_066,64,1536,4096,bf16,NVIDIA GeForce RTX 4060,c11,32,128,32,4,2,8,0.0,0.0,299.00801181793213,418.98816704750055,2.693260167524729,3,-1,-1,onekey:8x4096x4096,0,onekey_rep_shape=8x4096x4096
2026-03-03T06:16:28.220334+00:00,ONEKEY,llm_style,eval,llm_style_eval_067,64,8192,2048,bf16,NVIDIA GeForce RTX 4060,c11,32,128,32,4,2,8,0.0,0.0,550.8800148963928,667.2076636552811,3.898278372657773,1,-1,-1,onekey:8x4096x4096,0,onekey_rep_shape=8x4096x4096
2026-03-03T06:16:28.257082+00:00,ONEKEY,llm_style,eval,llm_style_eval_068,64,1024,4096,bf16,NVIDIA GeForce RTX 4060,c11,32,128,32,4,2,8,0.0,0.0,314.87999856472015,428.57343912124634,1.705001633787965,3,-1,-1,onekey:8x4096x4096,0,onekey_rep_shape=8x4096x4096
2026-03-03T06:16:28.308774+00:00,ONEKEY,llm_style,eval,llm_style_eval_069,64,2048,4096,bf16,NVIDIA GeForce RTX 4060,c11,32,128,32,4,2,8,0.0,0.0,353.2800078392029,499.61985647678364,3.039350657195181,3,-1,-1,onekey:8x4096x4096,0,onekey_rep_shape=8x4096x4096
2026-03-03T06:16:28.354893+00:00,ONEKEY,llm_style,eval,llm_style_eval_070,64,8192,1024,bf16,NVIDIA GeForce RTX 4060,c11,32,128,32,4,2,8,0.0,0.0,281.96799755096436,382.5049477815627,3.808027270207947,1,-1,-1,onekey:8x4096x4096,0,onekey_rep_shape=8x4096x4096
2026-03-03T06:16:28.436618+00:00,ONEKEY,llm_style,eval,llm_style_eval_071,64,6144,2048,bf16,NVIDIA GeForce RTX 4060,c11,32,128,32,4,2,8,0.0,0.0,336.8480056524277,432.0153683423995,4.781422804865557,1,-1,-1,onekey:8x4096x4096,0,onekey_rep_shape=8x4096x4096
2026-03-03T06:16:28.450307+00:00,ONEKEY,llm_style,eval,llm_style_eval_072,64,1536,1024,bf16,NVIDIA GeForce RTX 4060,c11,32,128,32,4,2,8,0.0,0.0,103.15200313925743,170.91840475797653,1.9517467996060605,3,-1,-1,onekey:8x4096x4096,0,onekey_rep_shape=8x4096x4096
2026-03-03T06:16:28.479567+00:00,ONEKEY,llm_style,eval,llm_style_eval_073,1,4096,1536,bf16,NVIDIA GeForce RTX 4060,c11,32,128,32,4,2,8,0.0,0.0,137.7119943499565,276.38784021139134,0.09137121322943047,7,-1,-1,onekey:8x4096x4096,0,onekey_rep_shape=8x4096x4096
2026-03-03T06:16:28.498378+00:00,ONEKEY,llm_style,eval,llm_style_eval_074,8,1024,2048,bf16,NVIDIA GeForce RTX 4060,c11,32,128,32,4,2,8,0.0,0.0,148.47999811172485,222.35136076807973,0.22598620977050204,7,-1,-1,onekey:8x4096x4096,0,onekey_rep_shape=8x4096x4096
2026-03-03T06:16:28.524082+00:00,ONEKEY,llm_style,eval,llm_style_eval_075,2,6144,1024,bf16,NVIDIA GeForce RTX 4060,c11,32,128,32,4,2,8,0.0,0.0,99.13600236177444,126.23871788382525,0.2538515110601597,5,-1,-1,onekey:8x4096x4096,0,onekey_rep_shape=8x4096x4096
2026-03-03T06:16:28.575782+00:00,ONEKEY,llm_style,eval,llm_style_eval_076,64,1024,6144,bf16,NVIDIA GeForce RTX 4060,c11,32,128,32,4,2,8,0.0,0.0,373.1680065393448,514.7135841846466,2.1580262881273904,3,-1,-1,onekey:8x4096x4096,0,onekey_rep_shape=8x4096x4096
2026-03-03T06:16:28.756103+00:00,ONEKEY,llm_style,eval,llm_style_eval_077,1,4096,8192,bf16,NVIDIA GeForce RTX 4060,c11,32,128,32,4,2,8,0.0,0.0,581.6320180892944,639.5801717042923,0.11538027810170723,6,-1,-1,onekey:8x4096x4096,0,onekey_rep_shape=8x4096x4096
2026-03-03T06:16:28.874699+00:00,ONEKEY,llm_style,eval,llm_style_eval_078,64,6144,3072,bf16,NVIDIA GeForce RTX 4060,c11,32,128,32,4,2,8,0.0,0.0,488.44799399375916,608.8028919696808,4.946113268367456,1,-1,-1,onekey:8x4096x4096,0,onekey_rep_shape=8x4096x4096
