results/llm_with_torch_smoke.csv
timestamp,method,workload,split,shape_id,M,N,K,dtype,gpu,config_id,BLOCK_M,BLOCK_N,BLOCK_K,num_warps,num_stages,GROUP_M,compile_time_ms,tune_time_ms,runtime_cost_us,p99_us,runtime_perf_tflops,bucket_m,bucket_n,bucket_k,cache_key,invalid_config,notes
2026-03-03T03:56:06.121545+00:00,FULL,llm_style,tune,llm_style_tune_000,1,3072,1536,bf16,NVIDIA GeForce RTX 4060,c02,32,64,32,2,2,8,2.1928109927102923,1461.201,24.57600086927414,107.1833598613739,0.38399998641759203,7,-1,-1,1x3072x1536,0,
2026-03-03T03:56:06.218404+00:00,FULL,llm_style,tune,llm_style_tune_001,16,1024,8192,bf16,NVIDIA GeForce RTX 4060,c00,32,32,32,2,2,8,0.0,96.828,76.80000364780426,325.50911486148834,3.4952531673177156,6,-1,-1,16x1024x8192,0,
2026-03-03T03:56:06.603367+00:00,FULL,llm_style,tune,llm_style_tune_002,16,8192,8192,bf16,NVIDIA GeForce RTX 4060,c00,32,32,32,2,2,8,0.0,384.919,557.7600002288818,581.9187450408936,3.850192998993762,4,-1,-1,16x8192x8192,0,
2026-03-03T03:56:06.704742+00:00,FULL,llm_style,tune,llm_style_tune_003,64,6144,3072,bf16,NVIDIA GeForce RTX 4060,c01,64,32,32,2,2,8,0.0,101.331,158.720001578331,260.7718461751938,15.221264364766927,1,-1,-1,64x6144x3072,0,
2026-03-03T03:56:07.040415+00:00,FULL,llm_style,tune,llm_style_tune_004,64,8192,8192,bf16,NVIDIA GeForce RTX 4060,c00,32,32,32,2,2,8,0.0,335.627,573.4400153160095,595.240957736969,14.979656742765474,0,-1,-1,64x8192x8192,0,
2026-03-03T03:56:07.143368+00:00,FULL,llm_style,tune,llm_style_tune_005,64,2048,8192,bf16,NVIDIA GeForce RTX 4060,c03,64,64,32,4,2,8,0.0,102.908,164.86400365829468,190.42303800582886,13.02578853083649,2,-1,-1,64x2048x8192,0,
2026-03-03T03:56:07.157511+00:00,FULL,llm_style,tune,llm_style_tune_006,32,1024,1536,bf16,NVIDIA GeForce RTX 4060,c02,32,64,32,2,2,8,0.0,14.097,25.599999353289604,30.515199229121208,3.932160099334719,3,-1,-1,32x1024x1536,0,
2026-03-03T03:56:07.293511+00:00,FULL,llm_style,tune,llm_style_tune_007,16,6144,4096,bf16,NVIDIA GeForce RTX 4060,c11,32,128,32,4,2,8,0.0,135.963,252.9279887676239,260.61439752578735,3.183935364068666,5,-1,-1,16x6144x4096,0,
2026-03-03T03:56:07.308629+00:00,FULL,llm_style,eval,llm_style_eval_000,32,1536,1024,bf16,NVIDIA GeForce RTX 4060,c06,64,128,32,4,3,8,0.0,15.076,21.503999829292297,66.52543991804123,4.681142894303718,3,-1,-1,32x1536x1024,0,
2026-03-03T03:56:07.401848+00:00,FULL,llm_style,eval,llm_style_eval_001,32,2048,8192,bf16,NVIDIA GeForce RTX 4060,c10,64,128,64,8,3,8,0.0,93.183,165.8879965543747,173.83423924446106,6.472691492467626,2,-1,-1,32x2048x8192,0,
2026-03-03T03:56:07.453578+00:00,FULL,llm_style,eval,llm_style_eval_002,16,2048,4096,bf16,NVIDIA GeForce RTX 4060,c00,32,32,32,2,2,8,0.0,51.685,45.05600035190582,124.96895849704742,5.957818135285181,7,-1,-1,16x2048x4096,0,
2026-03-03T03:56:07.472753+00:00,FULL,llm_style,eval,llm_style_eval_003,16,2048,1536,bf16,NVIDIA GeForce RTX 4060,c00,32,32,32,2,2,8,0.0,19.132,21.503999829292297,22.33344078063965,4.681142894303718,7,-1,-1,16x2048x1536,0,
2026-03-03T03:56:07.563468+00:00,FULL,llm_style,eval,llm_style_eval_004,64,8192,2048,bf16,NVIDIA GeForce RTX 4060,c10,64,128,64,8,3,8,0.0,90.672,168.70400309562683,190.58687806129456,12.729298704208801,1,-1,-1,64x8192x2048,0,
2026-03-03T03:56:07.697198+00:00,FULL,llm_style,eval,llm_style_eval_005,64,3072,8192,bf16,NVIDIA GeForce RTX 4060,c00,32,32,32,2,2,8,0.0,133.688,210.94399690628052,210.94399690628052,15.270524495803242,2,-1,-1,64x3072x8192,0,
2026-03-03T03:56:07.720099+00:00,FULL,llm_style,eval,llm_style_eval_006,32,2048,2048,bf16,NVIDIA GeForce RTX 4060,c00,32,32,32,2,2,8,0.0,22.855,48.928000032901764,119.18591663241386,5.486336163740392,3,-1,-1,32x2048x2048,0,
2026-03-03T03:56:07.835052+00:00,FULL,llm_style,eval,llm_style_eval_007,8,8192,2048,bf16,NVIDIA GeForce RTX 4060,c11,32,128,32,4,2,8,0.0,114.912,162.81600296497345,168.72704446315765,1.6487043724918637,5,-1,-1,8x8192x2048,0,
2026-03-03T03:56:07.912424+00:00,FULL,llm_style,eval,llm_style_eval_008,64,1536,8192,bf16,NVIDIA GeForce RTX 4060,c04,64,64,64,4,3,8,0.0,77.337,126.71999633312225,206.80704355239868,12.710012488999858,2,-1,-1,64x1536x8192,0,
2026-03-03T03:56:08.047276+00:00,FULL,llm_style,eval,llm_style_eval_009,64,4096,6144,bf16,NVIDIA GeForce RTX 4060,c03,64,64,32,4,2,8,0.0,134.806,208.6080014705658,249.76383984088898,15.441524051293445,3,-1,-1,64x4096x6144,0,
2026-03-03T03:56:08.096586+00:00,FULL,llm_style,eval,llm_style_eval_010,64,2048,4096,bf16,NVIDIA GeForce RTX 4060,c02,32,64,32,2,2,8,0.0,49.267,82.94399827718735,86.01599931716919,12.945382984935252,3,-1,-1,64x2048x4096,0,
2026-03-03T03:56:08.232082+00:00,FULL,llm_style,eval,llm_style_eval_011,32,3072,6144,bf16,NVIDIA GeForce RTX 4060,c00,32,32,32,2,2,8,0.0,135.452,156.67200088500977,200.99071443080902,7.710117603505863,3,-1,-1,32x3072x6144,0,
2026-03-03T03:56:08.250812+00:00,FULL,llm_style,eval,llm_style_eval_012,16,1536,1536,bf16,NVIDIA GeForce RTX 4060,c04,64,64,64,4,3,8,0.0,18.687,20.35200037062168,20.478719472885132,3.7095848381066934,7,-1,-1,16x1536x1536,0,
2026-03-03T03:56:08.283353+00:00,FULL,llm_style,eval,llm_style_eval_013,64,2048,3072,bf16,NVIDIA GeForce RTX 4060,c03,64,64,32,4,2,8,0.0,32.503,45.05600035190582,84.37759935855865,17.873454405855544,3,-1,-1,64x2048x3072,0,
2026-03-03T03:56:08.545208+00:00,FULL,llm_style,eval,llm_style_eval_014,16,8192,6144,bf16,NVIDIA GeForce RTX 4060,c02,32,64,32,2,2,8,0.0,261.809,431.0719966888428,447.0297682285309,3.7362963689858417,5,-1,-1,16x8192x6144,0,
2026-03-03T03:56:08.588614+00:00,FULL,llm_style,eval,llm_style_eval_015,64,6144,1536,bf16,NVIDIA GeForce RTX 4060,c01,64,32,32,2,2,8,0.0,43.359,62.20800057053566,87.8591999411583,19.418073895982772,1,-1,-1,64x6144x1536,0,
2026-03-03T03:56:08.615546+00:00,BUCKET,llm_style,tune,llm_style_tune_000,1,3072,1536,bf16,NVIDIA GeForce RTX 4060,c00,32,32,32,2,2,8,0.0,26.454,21.503999829292297,37.23264157772064,0.43885714634097356,7,-1,-1,llm8_g7,0,
2026-03-03T03:56:08.665907+00:00,BUCKET,llm_style,tune,llm_style_tune_001,16,1024,8192,bf16,NVIDIA GeForce RTX 4060,c04,64,64,64,4,3,8,0.0,50.315,92.16000139713287,154.24512088298798,2.9127110669548135,6,-1,-1,llm8_g6,0,
2026-03-03T03:56:09.010222+00:00,BUCKET,llm_style,tune,llm_style_tune_002,16,8192,8192,bf16,NVIDIA GeForce RTX 4060,c06,64,128,32,4,3,8,0.0,344.269,562.175989151001,572.1612882614136,3.8199490718967435,4,-1,-1,llm8_g4,0,
2026-03-03T03:56:09.110942+00:00,BUCKET,llm_style,tune,llm_style_tune_003,64,6144,3072,bf16,NVIDIA GeForce RTX 4060,c01,64,32,32,2,2,8,0.0,100.671,158.55999290943146,158.6879938840866,15.236624697504613,1,-1,-1,llm8_g1,0,
2026-03-03T03:56:09.460511+00:00,BUCKET,llm_style,tune,llm_style_tune_004,64,8192,8192,bf16,NVIDIA GeForce RTX 4060,c06,64,128,32,4,3,8,0.0,349.515,570.0479745864868,579.4239950180054,15.068792408623406,0,-1,-1,llm8_g0,0,
2026-03-03T03:56:09.555870+00:00,BUCKET,llm_style,tune,llm_style_tune_005,64,2048,8192,bf16,NVIDIA GeForce RTX 4060,c00,32,32,32,2,2,8,0.0,95.307,154.62400019168854,166.35904371738434,13.88842382384202,2,-1,-1,llm8_g2,0,
2026-03-03T03:56:09.572610+00:00,BUCKET,llm_style,tune,llm_style_tune_006,32,1024,1536,bf16,NVIDIA GeForce RTX 4060,c10,64,128,64,8,3,8,0.0,16.694,26.623999699950218,82.93119847774506,3.780923119533697,3,-1,-1,llm8_g3,0,
2026-03-03T03:56:09.710862+00:00,BUCKET,llm_style,tune,llm_style_tune_007,16,6144,4096,bf16,NVIDIA GeForce RTX 4060,c00,32,32,32,2,2,8,0.0,138.211,202.7519941329956,211.72224462032318,3.9718789028124557,5,-1,-1,llm8_g5,0,
2026-03-03T03:56:09.717510+00:00,BUCKET,llm_style,eval,llm_style_eval_000,32,1536,1024,bf16,NVIDIA GeForce RTX 4060,c10,64,128,64,8,3,8,0.0,0.0,23.520000278949738,123.72991800308228,4.279901990056227,3,-1,-1,llm8_g3,0,
2026-03-03T03:56:09.799552+00:00,BUCKET,llm_style,eval,llm_style_eval_001,32,2048,8192,bf16,NVIDIA GeForce RTX 4060,c00,32,32,32,2,2,8,0.0,0.0,180.06399273872375,361.33631110191345,5.963112378375502,2,-1,-1,llm8_g2,0,
2026-03-03T03:56:09.838901+00:00,BUCKET,llm_style,eval,llm_style_eval_002,16,2048,4096,bf16,NVIDIA GeForce RTX 4060,c00,32,32,32,2,2,8,0.0,0.0,46.08000069856644,68.68992120027542,5.825422133909627,7,-1,-1,llm8_g7,0,
2026-03-03T03:56:09.852619+00:00,BUCKET,llm_style,eval,llm_style_eval_003,16,2048,1536,bf16,NVIDIA GeForce RTX 4060,c00,32,32,32,2,2,8,0.0,0.0,22.52800017595291,139.75551687180996,4.468363601463886,7,-1,-1,llm8_g7,0,
2026-03-03T03:56:09.927863+00:00,BUCKET,llm_style,eval,llm_style_eval_004,64,8192,2048,bf16,NVIDIA GeForce RTX 4060,c01,64,32,32,2,2,8,0.0,0.0,154.55999970436096,156.52864038944244,13.894174767777306,1,-1,-1,llm8_g1,0,
2026-03-03T03:56:10.037561+00:00,BUCKET,llm_style,eval,llm_style_eval_005,64,3072,8192,bf16,NVIDIA GeForce RTX 4060,c00,32,32,32,2,2,8,0.0,0.0,273.0880081653595,308.0140733718872,11.795558119305964,2,-1,-1,llm8_g2,0,
2026-03-03T03:56:10.054079+00:00,BUCKET,llm_style,eval,llm_style_eval_006,32,2048,2048,bf16,NVIDIA GeForce RTX 4060,c10,64,128,64,8,3,8,0.0,0.0,52.928000688552856,162.256640791893,5.071709728458656,3,-1,-1,llm8_g3,0,
2026-03-03T03:56:10.129628+00:00,BUCKET,llm_style,eval,llm_style_eval_007,8,8192,2048,bf16,NVIDIA GeForce RTX 4060,c00,32,32,32,2,2,8,0.0,0.0,140.28799533843994,153.10848712921143,1.913459917596005,5,-1,-1,llm8_g5,0,
2026-03-03T03:56:10.206326+00:00,BUCKET,llm_style,eval,llm_style_eval_008,64,1536,8192,bf16,NVIDIA GeForce RTX 4060,c00,32,32,32,2,2,8,0.0,0.0,134.14399325847626,137.13408172130585,12.006596023249285,2,-1,-1,llm8_g2,0,
2026-03-03T03:56:10.330818+00:00,BUCKET,llm_style,eval,llm_style_eval_009,64,4096,6144,bf16,NVIDIA GeForce RTX 4060,c10,64,128,64,8,3,8,0.0,0.0,214.01600539684296,247.23072052001953,15.051329763991184,3,-1,-1,llm8_g3,0,
2026-03-03T03:56:10.367341+00:00,BUCKET,llm_style,eval,llm_style_eval_010,64,2048,4096,bf16,NVIDIA GeForce RTX 4060,c10,64,128,64,8,3,8,0.0,0.0,67.58400052785873,73.48224252462387,15.88751502742715,3,-1,-1,llm8_g3,0,
2026-03-03T03:56:10.451546+00:00,BUCKET,llm_style,eval,llm_style_eval_011,32,3072,6144,bf16,NVIDIA GeForce RTX 4060,c10,64,128,64,8,3,8,0.0,0.0,153.60000729560852,154.3398380279541,7.864319626464861,3,-1,-1,llm8_g3,0,
2026-03-03T03:56:10.460535+00:00,BUCKET,llm_style,eval,llm_style_eval_012,16,1536,1536,bf16,NVIDIA GeForce RTX 4060,c00,32,32,32,2,2,8,0.0,0.0,96.25600278377533,136.0281616449356,0.7843404028483683,7,-1,-1,llm8_g7,0,
2026-03-03T03:56:10.482230+00:00,BUCKET,llm_style,eval,llm_style_eval_013,64,2048,3072,bf16,NVIDIA GeForce RTX 4060,c10,64,128,64,8,3,8,0.0,0.0,128.00000607967377,214.26175892353058,6.2914557011718895,3,-1,-1,llm8_g3,0,
2026-03-03T03:56:10.700908+00:00,BUCKET,llm_style,eval,llm_style_eval_014,16,8192,6144,bf16,NVIDIA GeForce RTX 4060,c00,32,32,32,2,2,8,0.0,0.0,452.60798931121826,470.67137002944946,3.558515921141915,5,-1,-1,llm8_g5,0,
2026-03-03T03:56:10.737035+00:00,BUCKET,llm_style,eval,llm_style_eval_015,64,6144,1536,bf16,NVIDIA GeForce RTX 4060,c01,64,32,32,2,2,8,0.0,0.0,63.48799914121628,83.9142370223999,19.02658090252832,1,-1,-1,llm8_g1,0,
2026-03-03T03:56:10.913027+00:00,TORCH,llm_style,tune,llm_style_tune_000,1,3072,1536,bf16,NVIDIA GeForce RTX 4060,torch_cublas,-1,-1,-1,-1,-1,-1,154.36936996411532,0.0,41.98399931192398,64.63487982749939,0.22478049148880683,7,-1,-1,torch_mm,0,torch_mm_cublas
2026-03-03T03:56:10.979411+00:00,TORCH,llm_style,tune,llm_style_tune_001,16,1024,8192,bf16,NVIDIA GeForce RTX 4060,torch_cublas,-1,-1,-1,-1,-1,-1,0.0,0.0,54.07999828457832,65.24928078055382,4.963673530229164,6,-1,-1,torch_mm,0,torch_mm_cublas
2026-03-03T03:56:11.305079+00:00,TORCH,llm_style,tune,llm_style_tune_002,16,8192,8192,bf16,NVIDIA GeForce RTX 4060,torch_cublas,-1,-1,-1,-1,-1,-1,0.0,0.0,560.7680082321167,579.584002494812,3.829540231387629,4,-1,-1,torch_mm,0,torch_mm_cublas
2026-03-03T03:56:11.389705+00:00,TORCH,llm_style,tune,llm_style_tune_003,64,6144,3072,bf16,NVIDIA GeForce RTX 4060,torch_cublas,-1,-1,-1,-1,-1,-1,0.0,0.0,164.86400365829468,170.58431684970856,14.654012097191053,1,-1,-1,torch_mm,0,torch_mm_cublas
2026-03-03T03:56:11.681295+00:00,TORCH,llm_style,tune,llm_style_tune_004,64,8192,8192,bf16,NVIDIA GeForce RTX 4060,torch_cublas,-1,-1,-1,-1,-1,-1,0.0,0.0,1188.86399269104,1228.2559490203857,7.2253299324478215,0,-1,-1,torch_mm,0,torch_mm_cublas
2026-03-03T03:56:11.756117+00:00,TORCH,llm_style,tune,llm_style_tune_005,64,2048,8192,bf16,NVIDIA GeForce RTX 4060,torch_cublas,-1,-1,-1,-1,-1,-1,0.0,0.0,237.56800591945648,243.32160532474518,9.039448050627108,2,-1,-1,torch_mm,0,torch_mm_cublas
2026-03-03T03:56:11.763461+00:00,TORCH,llm_style,tune,llm_style_tune_006,32,1024,1536,bf16,NVIDIA GeForce RTX 4060,torch_cublas,-1,-1,-1,-1,-1,-1,0.0,0.0,33.79200026392937,33.79200026392937,2.9789090676425904,3,-1,-1,torch_mm,0,torch_mm_cublas
2026-03-03T03:56:11.875200+00:00,TORCH,llm_style,tune,llm_style_tune_007,16,6144,4096,bf16,NVIDIA GeForce RTX 4060,torch_cublas,-1,-1,-1,-1,-1,-1,0.0,0.0,338.9439880847931,339.61984753608704,2.3759275759702745,5,-1,-1,torch_mm,0,torch_mm_cublas
2026-03-03T03:56:11.882646+00:00,TORCH,llm_style,eval,llm_style_eval_000,32,1536,1024,bf16,NVIDIA GeForce RTX 4060,torch_cublas,-1,-1,-1,-1,-1,-1,0.0,0.0,26.623999699950218,148.5209669917822,3.780923119533697,3,-1,-1,torch_mm,0,torch_mm_cublas
2026-03-03T03:56:11.957871+00:00,TORCH,llm_style,eval,llm_style_eval_001,32,2048,8192,bf16,NVIDIA GeForce RTX 4060,torch_cublas,-1,-1,-1,-1,-1,-1,0.0,0.0,253.9519965648651,259.6057641506195,4.2281290894507375,2,-1,-1,torch_mm,0,torch_mm_cublas
2026-03-03T03:56:11.998391+00:00,TORCH,llm_style,eval,llm_style_eval_002,16,2048,4096,bf16,NVIDIA GeForce RTX 4060,torch_cublas,-1,-1,-1,-1,-1,-1,0.0,0.0,99.32799637317657,100.34943699836731,2.7025155625961133,7,-1,-1,torch_mm,0,torch_mm_cublas
2026-03-03T03:56:12.010979+00:00,TORCH,llm_style,eval,llm_style_eval_003,16,2048,1536,bf16,NVIDIA GeForce RTX 4060,torch_cublas,-1,-1,-1,-1,-1,-1,0.0,0.0,59.39200147986412,73.9840017259121,1.6948965094925827,7,-1,-1,torch_mm,0,torch_mm_cublas
2026-03-03T03:56:12.089057+00:00,TORCH,llm_style,eval,llm_style_eval_004,64,8192,2048,bf16,NVIDIA GeForce RTX 4060,torch_cublas,-1,-1,-1,-1,-1,-1,0.0,0.0,250.88000297546387,255.86817145347595,8.559803980112454,1,-1,-1,torch_mm,0,torch_mm_cublas
2026-03-03T03:56:12.204466+00:00,TORCH,llm_style,eval,llm_style_eval_005,64,3072,8192,bf16,NVIDIA GeForce RTX 4060,torch_cublas,-1,-1,-1,-1,-1,-1,0.0,0.0,367.6159977912903,373.7190544605255,8.762473590251133,2,-1,-1,torch_mm,0,torch_mm_cublas
2026-03-03T03:56:12.228200+00:00,TORCH,llm_style,eval,llm_style_eval_006,32,2048,2048,bf16,NVIDIA GeForce RTX 4060,torch_cublas,-1,-1,-1,-1,-1,-1,0.0,0.0,68.60800087451935,222.94528305530548,3.9125969650530297,3,-1,-1,torch_mm,0,torch_mm_cublas
2026-03-03T03:56:12.301496+00:00,TORCH,llm_style,eval,llm_style_eval_007,8,8192,2048,bf16,NVIDIA GeForce RTX 4060,torch_cublas,-1,-1,-1,-1,-1,-1,0.0,0.0,249.85599517822266,252.7641487121582,1.0743606764709592,5,-1,-1,torch_mm,0,torch_mm_cublas
2026-03-03T03:56:12.355526+00:00,TORCH,llm_style,eval,llm_style_eval_008,64,1536,8192,bf16,NVIDIA GeForce RTX 4060,torch_cublas,-1,-1,-1,-1,-1,-1,0.0,0.0,164.86400365829468,170.8006453514099,9.76934139812737,2,-1,-1,torch_mm,0,torch_mm_cublas
2026-03-03T03:56:12.465108+00:00,TORCH,llm_style,eval,llm_style_eval_009,64,4096,6144,bf16,NVIDIA GeForce RTX 4060,torch_cublas,-1,-1,-1,-1,-1,-1,0.0,0.0,586.7519974708557,591.7490983009338,5.48992672523454,3,-1,-1,torch_mm,0,torch_mm_cublas
2026-03-03T03:56:12.502013+00:00,TORCH,llm_style,eval,llm_style_eval_010,64,2048,4096,bf16,NVIDIA GeForce RTX 4060,torch_cublas,-1,-1,-1,-1,-1,-1,0.0,0.0,155.64799308776855,156.67200088500977,6.8985266221487755,3,-1,-1,torch_mm,0,torch_mm_cublas
2026-03-03T03:56:12.588771+00:00,TORCH,llm_style,eval,llm_style_eval_011,32,3072,6144,bf16,NVIDIA GeForce RTX 4060,torch_cublas,-1,-1,-1,-1,-1,-1,0.0,0.0,275.4560112953186,331.6070485115051,4.385308370362398,3,-1,-1,torch_mm,0,torch_mm_cublas
2026-03-03T03:56:12.597702+00:00,TORCH,llm_style,eval,llm_style_eval_012,16,1536,1536,bf16,NVIDIA GeForce RTX 4060,torch_cublas,-1,-1,-1,-1,-1,-1,0.0,0.0,39.903998374938965,45.83424061536789,1.8919776231600622,7,-1,-1,torch_mm,0,torch_mm_cublas
2026-03-03T03:56:12.618243+00:00,TORCH,llm_style,eval,llm_style_eval_013,64,2048,3072,bf16,NVIDIA GeForce RTX 4060,torch_cublas,-1,-1,-1,-1,-1,-1,0.0,0.0,130.75199723243713,232.7334451675415,6.159036841084815,3,-1,-1,torch_mm,0,torch_mm_cublas
2026-03-03T03:56:12.851919+00:00,TORCH,llm_style,eval,llm_style_eval_014,16,8192,6144,bf16,NVIDIA GeForce RTX 4060,torch_cublas,-1,-1,-1,-1,-1,-1,0.0,0.0,735.2319955825806,751.2064003944397,2.1906183975627833,5,-1,-1,torch_mm,0,torch_mm_cublas
2026-03-03T03:56:12.885953+00:00,TORCH,llm_style,eval,llm_style_eval_015,64,6144,1536,bf16,NVIDIA GeForce RTX 4060,torch_cublas,-1,-1,-1,-1,-1,-1,0.0,0.0,145.24799585342407,151.12192511558533,8.316531632002713,1,-1,-1,torch_mm,0,torch_mm_cublas
