results/llm_full_vs_bucket_with_torch.csv
timestamp,method,workload,split,shape_id,M,N,K,dtype,gpu,config_id,BLOCK_M,BLOCK_N,BLOCK_K,num_warps,num_stages,GROUP_M,compile_time_ms,tune_time_ms,runtime_cost_us,p99_us,runtime_perf_tflops,bucket_m,bucket_n,bucket_k,cache_key,invalid_config,notes
2026-03-03T03:57:02.413722+00:00,FULL,llm_style,tune,llm_style_tune_000,64,6144,6144,bf16,NVIDIA GeForce RTX 4060,c06,64,128,32,4,3,8,1.1862220708280802,875.681,333.8240087032318,415.0476789474487,14.474208211595363,1,-1,-1,64x6144x6144,0,
2026-03-03T03:57:02.574632+00:00,FULL,llm_style,tune,llm_style_tune_001,64,8192,1536,bf16,NVIDIA GeForce RTX 4060,c06,64,128,32,4,3,8,0.0,160.875,98.30400347709656,103.42815764248371,16.383999420483928,1,-1,-1,64x8192x1536,0,
2026-03-03T03:57:02.872926+00:00,FULL,llm_style,tune,llm_style_tune_002,32,3072,8192,bf16,NVIDIA GeForce RTX 4060,c06,64,128,32,4,3,8,0.0,298.254,231.1680018901825,240.68095952272415,6.967282335057469,2,-1,-1,32x3072x8192,0,
2026-03-03T03:57:03.118515+00:00,FULL,llm_style,tune,llm_style_tune_003,4,6144,3072,bf16,NVIDIA GeForce RTX 4060,c11,32,128,32,4,2,8,0.0,245.551,178.94400656223297,225.81920087337488,0.8438111278540482,5,-1,-1,4x6144x3072,0,
2026-03-03T03:57:03.227034+00:00,FULL,llm_style,tune,llm_style_tune_004,8,8192,1024,bf16,NVIDIA GeForce RTX 4060,c00,32,32,32,2,2,8,0.0,108.484,42.49599948525429,150.581442117691,3.158361484039746,5,-1,-1,8x8192x1024,0,
2026-03-03T03:57:03.528645+00:00,FULL,llm_style,tune,llm_style_tune_005,32,8192,3072,bf16,NVIDIA GeForce RTX 4060,c11,32,128,32,4,2,8,0.0,301.568,229.2799949645996,307.27935835719086,7.024654445969766,1,-1,-1,32x8192x3072,0,
2026-03-03T03:57:04.085280+00:00,FULL,llm_style,tune,llm_style_tune_006,32,6144,8192,bf16,NVIDIA GeForce RTX 4060,c11,32,128,32,4,2,8,0.0,556.592,428.16001176834106,471.07615917921066,7.523415039849322,0,-1,-1,32x6144x8192,0,
2026-03-03T03:57:04.168191+00:00,FULL,llm_style,tune,llm_style_tune_007,8,1536,2048,bf16,NVIDIA GeForce RTX 4060,c04,64,64,64,4,3,8,0.0,82.871,56.32000043988228,74.34655867516992,0.8936727202927771,7,-1,-1,8x1536x2048,0,
2026-03-03T03:57:04.264701+00:00,FULL,llm_style,tune,llm_style_tune_008,16,1536,4096,bf16,NVIDIA GeForce RTX 4060,c04,64,64,64,4,3,8,0.0,96.466,60.30400097370148,93.63456174731246,3.33852793760398,7,-1,-1,16x1536x4096,0,
2026-03-03T03:57:04.329954+00:00,FULL,llm_style,tune,llm_style_tune_009,64,1536,2048,bf16,NVIDIA GeForce RTX 4060,c04,64,64,64,4,3,8,0.0,65.211,42.847998440265656,48.42943988740444,9.39724604782504,3,-1,-1,64x1536x2048,0,
2026-03-03T03:57:04.392398+00:00,FULL,llm_style,tune,llm_style_tune_010,2,2048,1024,bf16,NVIDIA GeForce RTX 4060,c11,32,128,32,4,2,8,0.0,62.366,40.28799943625927,56.9904004782438,0.20821604739326513,7,-1,-1,2x2048x1024,0,
2026-03-03T03:57:04.691684+00:00,FULL,llm_style,tune,llm_style_tune_011,2,3072,8192,bf16,NVIDIA GeForce RTX 4060,c04,64,64,64,4,3,8,0.0,299.243,228.35199534893036,251.92447572946548,0.44082512108634186,6,-1,-1,2x3072x8192,0,
2026-03-03T03:57:04.764667+00:00,FULL,llm_style,tune,llm_style_tune_012,64,2048,1536,bf16,NVIDIA GeForce RTX 4060,c00,32,32,32,2,2,8,0.0,72.941,47.07200080156326,84.77695874869818,8.553984898526512,3,-1,-1,64x2048x1536,0,
2026-03-03T03:57:05.152189+00:00,FULL,llm_style,tune,llm_style_tune_013,16,8192,4096,bf16,NVIDIA GeForce RTX 4060,c11,32,128,32,4,2,8,0.0,387.477,295.28000950813293,321.59744441509247,3.6363512240080236,5,-1,-1,16x8192x4096,0,
2026-03-03T03:57:05.539475+00:00,FULL,llm_style,tune,llm_style_tune_014,4,8192,4096,bf16,NVIDIA GeForce RTX 4060,c11,32,128,32,4,2,8,0.0,387.245,295.72799801826477,306.1219146847725,0.9077106591152754,5,-1,-1,4x8192x4096,0,
2026-03-03T03:57:05.627996+00:00,FULL,llm_style,tune,llm_style_tune_015,4,3072,2048,bf16,NVIDIA GeForce RTX 4060,c11,32,128,32,4,2,8,0.0,88.482,52.22399905323982,60.938240103423595,0.9637647233542828,7,-1,-1,4x3072x2048,0,
2026-03-03T03:57:05.677859+00:00,FULL,llm_style,tune,llm_style_tune_016,16,1536,1024,bf16,NVIDIA GeForce RTX 4060,c00,32,32,32,2,2,8,0.0,49.82,34.832000732421875,118.80448296666145,1.4449829737500821,7,-1,-1,16x1536x1024,0,
2026-03-03T03:57:05.736984+00:00,FULL,llm_style,tune,llm_style_tune_017,32,1024,2048,bf16,NVIDIA GeForce RTX 4060,c04,64,64,64,4,3,8,0.0,59.083,41.98399931192398,76.3551986590027,3.1968781011741414,3,-1,-1,32x1024x2048,0,
2026-03-03T03:57:05.755583+00:00,FULL,llm_style,tune,llm_style_tune_018,64,1536,2048,bf16,NVIDIA GeForce RTX 4060,c04,64,64,64,4,3,8,0.0,0.0,45.951999723911285,118.97248290479179,8.762473590251133,3,-1,-1,64x1536x2048,0,
2026-03-03T03:57:05.835786+00:00,FULL,llm_style,tune,llm_style_tune_019,4,4096,1536,bf16,NVIDIA GeForce RTX 4060,c00,32,32,32,2,2,8,0.0,80.163,42.448000982403755,92.08640139549958,1.1857248123619368,7,-1,-1,4x4096x1536,0,
2026-03-03T03:57:05.988380+00:00,FULL,llm_style,tune,llm_style_tune_020,1,8192,1536,bf16,NVIDIA GeForce RTX 4060,c11,32,128,32,4,2,8,0.0,152.552,64.51199948787689,94.91487793624395,0.3900952411919764,5,-1,-1,1x8192x1536,0,
2026-03-03T03:57:06.094359+00:00,FULL,llm_style,tune,llm_style_tune_021,64,1536,4096,bf16,NVIDIA GeForce RTX 4060,c04,64,64,64,4,3,8,0.0,105.946,58.36800113320351,135.00895604491234,13.797052363711826,3,-1,-1,64x1536x4096,0,
2026-03-03T03:57:06.209936+00:00,FULL,llm_style,tune,llm_style_tune_022,64,1024,6144,bf16,NVIDIA GeForce RTX 4060,c04,64,64,64,4,3,8,0.0,115.534,71.98400050401688,88.59103888273236,11.18729665427614,3,-1,-1,64x1024x6144,0,
2026-03-03T03:57:06.282811+00:00,FULL,llm_style,tune,llm_style_tune_023,8,4096,1024,bf16,NVIDIA GeForce RTX 4060,c11,32,128,32,4,2,8,0.0,72.834,41.90399870276451,124.90335777401916,1.6014906948623178,7,-1,-1,8x4096x1024,0,
2026-03-03T03:57:06.531970+00:00,FULL,llm_style,tune,llm_style_tune_024,8,4096,4096,bf16,NVIDIA GeForce RTX 4060,c11,32,128,32,4,2,8,0.0,249.118,159.743994474411,210.7539197802543,1.6804103145361124,7,-1,-1,8x4096x4096,0,
2026-03-03T03:57:06.611642+00:00,FULL,llm_style,tune,llm_style_tune_025,32,6144,1024,bf16,NVIDIA GeForce RTX 4060,c11,32,128,32,4,2,8,0.0,79.63,40.95999896526337,52.15999994426964,9.8304002483368,1,-1,-1,32x6144x1024,0,
2026-03-03T03:57:06.679589+00:00,FULL,llm_style,tune,llm_style_tune_026,1,3072,1536,bf16,NVIDIA GeForce RTX 4060,c00,32,32,32,2,2,8,0.0,67.905,40.95999896526337,349.1894388198849,0.23040000582039372,7,-1,-1,1x3072x1536,0,
2026-03-03T03:57:06.781103+00:00,FULL,llm_style,tune,llm_style_tune_027,1,6144,1536,bf16,NVIDIA GeForce RTX 4060,c02,32,64,32,2,2,8,0.0,101.47,46.08000069856644,116.0294417291878,0.4095999937905207,5,-1,-1,1x6144x1536,0,
2026-03-03T03:57:06.818537+00:00,FULL,llm_style,tune,llm_style_tune_028,4,4096,1536,bf16,NVIDIA GeForce RTX 4060,c00,32,32,32,2,2,8,0.0,0.0,50.175998359918594,152.65791952610016,1.0031020736042942,7,-1,-1,4x4096x1536,0,
2026-03-03T03:57:06.937979+00:00,FULL,llm_style,tune,llm_style_tune_029,16,1024,6144,bf16,NVIDIA GeForce RTX 4060,c00,32,32,32,2,2,8,0.0,119.39,73.72800260782242,188.33472296595573,2.730666570080655,7,-1,-1,16x1024x6144,0,
2026-03-03T03:57:07.354927+00:00,FULL,llm_style,tune,llm_style_tune_030,64,4096,8192,bf16,NVIDIA GeForce RTX 4060,c11,32,128,32,4,2,8,0.0,416.903,300.9440004825592,313.40959787368774,14.27164950659619,2,-1,-1,64x4096x8192,0,
2026-03-03T03:57:07.441646+00:00,FULL,llm_style,tune,llm_style_tune_031,1,6144,1024,bf16,NVIDIA GeForce RTX 4060,c11,32,128,32,4,2,8,0.0,86.674,41.95199906826019,140.9148802235719,0.2999359334349315,5,-1,-1,1x6144x1024,0,
2026-03-03T03:57:07.528506+00:00,FULL,llm_style,tune,llm_style_tune_032,64,1024,4096,bf16,NVIDIA GeForce RTX 4060,c04,64,64,64,4,3,8,0.0,86.812,56.32000043988228,75.30335944145912,9.53250901645629,3,-1,-1,64x1024x4096,0,
2026-03-03T03:57:07.928336+00:00,FULL,llm_style,tune,llm_style_tune_033,2,4096,8192,bf16,NVIDIA GeForce RTX 4060,c11,32,128,32,4,2,8,0.0,399.786,291.79199039936066,300.05248457193375,0.45997742369933836,6,-1,-1,2x4096x8192,0,
2026-03-03T03:57:08.536728+00:00,FULL,llm_style,tune,llm_style_tune_034,1,8192,6144,bf16,NVIDIA GeForce RTX 4060,c11,32,128,32,4,2,8,0.0,608.352,425.00799894332886,464.7955176234244,0.23685035634687568,5,-1,-1,1x8192x6144,0,
2026-03-03T03:57:08.608891+00:00,FULL,llm_style,tune,llm_style_tune_035,64,1536,1024,bf16,NVIDIA GeForce RTX 4060,c04,64,64,64,4,3,8,0.0,72.117,41.98399931192398,58.468799851834774,4.795317151761212,3,-1,-1,64x1536x1024,0,
2026-03-03T03:57:08.688928+00:00,FULL,llm_style,tune,llm_style_tune_036,32,3072,2048,bf16,NVIDIA GeForce RTX 4060,c02,32,64,32,2,2,8,0.0,79.997,52.22399905323982,142.7484828233719,7.710117786834262,3,-1,-1,32x3072x2048,0,
2026-03-03T03:57:08.819824+00:00,FULL,llm_style,tune,llm_style_tune_037,4,1536,6144,bf16,NVIDIA GeForce RTX 4060,c04,64,64,64,4,3,8,0.0,130.852,73.72800260782242,79.74559992551804,1.0239999637802455,7,-1,-1,4x1536x6144,0,
2026-03-03T03:57:08.914457+00:00,FULL,llm_style,tune,llm_style_tune_038,1,4096,1536,bf16,NVIDIA GeForce RTX 4060,c11,32,128,32,4,2,8,0.0,94.59,46.08000069856644,53.23711916804314,0.2730666625270138,7,-1,-1,1x4096x1536,0,
2026-03-03T03:57:09.009314+00:00,FULL,llm_style,tune,llm_style_tune_039,4,1536,4096,bf16,NVIDIA GeForce RTX 4060,c04,64,64,64,4,3,8,0.0,94.815,56.32000043988228,66.05824001133442,0.8936727202927771,7,-1,-1,4x1536x4096,0,
2026-03-03T03:57:09.559549+00:00,FULL,llm_style,tune,llm_style_tune_040,2,6144,8192,bf16,NVIDIA GeForce RTX 4060,c06,64,128,32,4,3,8,0.0,550.189,424.76800084114075,479.7235333919524,0.47396835825986394,4,-1,-1,2x6144x8192,0,
2026-03-03T03:57:09.626285+00:00,FULL,llm_style,tune,llm_style_tune_041,16,1024,1536,bf16,NVIDIA GeForce RTX 4060,c00,32,32,32,2,2,8,0.0,66.692,21.328000351786613,233.78784745931617,2.3598859325686288,7,-1,-1,16x1024x1536,0,
2026-03-03T03:57:09.654325+00:00,FULL,llm_style,tune,llm_style_tune_042,32,3072,2048,bf16,NVIDIA GeForce RTX 4060,c02,32,64,32,2,2,8,0.0,0.0,51.19999870657921,94.66336198151103,7.864320198669438,3,-1,-1,32x3072x2048,0,
2026-03-03T03:57:09.764901+00:00,FULL,llm_style,tune,llm_style_tune_043,2,2048,4096,bf16,NVIDIA GeForce RTX 4060,c00,32,32,32,2,2,8,0.0,110.525,68.60800087451935,321.4131234586233,0.4890746206316287,7,-1,-1,2x2048x4096,0,
2026-03-03T03:57:10.006492+00:00,FULL,llm_style,tune,llm_style_tune_044,64,2048,8192,bf16,NVIDIA GeForce RTX 4060,c06,64,128,32,4,3,8,0.0,241.548,166.9120043516159,191.6108778119087,12.865962854751436,2,-1,-1,64x2048x8192,0,
2026-03-03T03:57:10.148061+00:00,FULL,llm_style,tune,llm_style_tune_045,2,3072,8192,bf16,NVIDIA GeForce RTX 4060,c04,64,64,64,4,3,8,0.0,0.0,252.9279887676239,309.57791566848744,0.39799192050858323,6,-1,-1,2x3072x8192,0,
2026-03-03T03:57:10.708416+00:00,FULL,llm_style,tune,llm_style_tune_046,4,8192,6144,bf16,NVIDIA GeForce RTX 4060,c10,64,128,64,8,3,8,0.0,560.288,425.9679913520813,490.42432606220234,0.9452662927135044,5,-1,-1,4x8192x6144,0,
2026-03-03T03:57:10.834040+00:00,FULL,llm_style,tune,llm_style_tune_047,1,1024,6144,bf16,NVIDIA GeForce RTX 4060,c04,64,64,64,4,3,8,0.0,125.576,71.68000191450119,91.74367688596246,0.1755428524542829,7,-1,-1,1x1024x6144,0,
2026-03-03T03:57:10.990966+00:00,FULL,llm_style,tune,llm_style_tune_048,32,4096,3072,bf16,NVIDIA GeForce RTX 4060,c04,64,64,64,4,3,8,0.0,156.879,87.0399996638298,159.19999644160248,9.252141212204666,3,-1,-1,32x4096x3072,0,
2026-03-03T03:57:11.050457+00:00,FULL,llm_style,tune,llm_style_tune_049,16,2048,1024,bf16,NVIDIA GeForce RTX 4060,c11,32,128,32,4,2,8,0.0,59.449,39.77600112557411,43.55071984231472,1.6871697028601533,7,-1,-1,16x2048x1024,0,
2026-03-03T03:57:11.105785+00:00,FULL,llm_style,tune,llm_style_tune_050,4,1024,1536,bf16,NVIDIA GeForce RTX 4060,c00,32,32,32,2,2,8,0.0,55.291,38.54399919509888,640.8294373005608,0.3264557976018223,7,-1,-1,4x1024x1536,0,
2026-03-03T03:57:11.283265+00:00,FULL,llm_style,tune,llm_style_tune_051,64,4096,8192,bf16,NVIDIA GeForce RTX 4060,c11,32,128,32,4,2,8,0.0,0.0,306.9920092821121,326.7504015564918,13.990485635256762,2,-1,-1,64x4096x8192,0,
2026-03-03T03:57:11.364967+00:00,FULL,llm_style,tune,llm_style_tune_052,16,2048,1536,bf16,NVIDIA GeForce RTX 4060,c00,32,32,32,2,2,8,0.0,81.651,41.98399931192398,156.64127707481373,2.397658575880606,7,-1,-1,16x2048x1536,0,
2026-03-03T03:57:11.418593+00:00,FULL,llm_style,tune,llm_style_tune_053,64,1024,1024,bf16,NVIDIA GeForce RTX 4060,c04,64,64,64,4,3,8,0.0,53.586,34.832000732421875,40.519680641591535,3.853287930000219,3,-1,-1,64x1024x1024,0,
2026-03-03T03:57:11.815315+00:00,FULL,llm_style,tune,llm_style_tune_054,4,4096,8192,bf16,NVIDIA GeForce RTX 4060,c02,32,64,32,2,2,8,0.0,396.685,294.8160022497177,417.8739124536514,0.9105186080524468,6,-1,-1,4x4096x8192,0,
2026-03-03T03:57:11.967535+00:00,FULL,llm_style,tune,llm_style_tune_055,1,4096,3072,bf16,NVIDIA GeForce RTX 4060,c00,32,32,32,2,2,8,0.0,152.177,58.879999443888664,174.4051258265971,0.4274086996889746,7,-1,-1,1x4096x3072,0,
2026-03-03T03:57:11.991550+00:00,FULL,llm_style,tune,llm_style_tune_056,64,1536,2048,bf16,NVIDIA GeForce RTX 4060,c04,64,64,64,4,3,8,0.0,0.0,51.19999870657921,109.41663481295097,7.864320198669438,3,-1,-1,64x1536x2048,0,
2026-03-03T03:57:12.098519+00:00,FULL,llm_style,tune,llm_style_tune_057,2,4096,2048,bf16,NVIDIA GeForce RTX 4060,c11,32,128,32,4,2,8,0.0,106.923,53.247999399900436,63.28607868403195,0.6301538532556162,7,-1,-1,2x4096x2048,0,
2026-03-03T03:57:12.247227+00:00,FULL,llm_style,tune,llm_style_tune_058,4,8192,1536,bf16,NVIDIA GeForce RTX 4060,c11,32,128,32,4,2,8,0.0,148.667,66.56000018119812,75.61920210719109,1.5123692266520663,5,-1,-1,4x8192x1536,0,
2026-03-03T03:57:12.352053+00:00,FULL,llm_style,tune,llm_style_tune_059,1,1536,4096,bf16,NVIDIA GeForce RTX 4060,c04,64,64,64,4,3,8,0.0,104.777,60.416001826524734,81.81984052062033,0.20827118014412635,7,-1,-1,1x1536x4096,0,
2026-03-03T03:57:12.378160+00:00,FULL,llm_style,tune,llm_style_tune_060,64,1536,4096,bf16,NVIDIA GeForce RTX 4060,c04,64,64,64,4,3,8,0.0,0.0,61.503998935222626,118.74656207859495,13.093561100769506,3,-1,-1,64x1536x4096,0,
2026-03-03T03:57:12.964431+00:00,FULL,llm_style,tune,llm_style_tune_061,8,8192,6144,bf16,NVIDIA GeForce RTX 4060,c11,32,128,32,4,2,8,0.0,586.215,427.69598960876465,519.1599968075751,1.8828943632056379,5,-1,-1,8x8192x6144,0,
2026-03-03T03:57:13.082335+00:00,FULL,llm_style,tune,llm_style_tune_062,64,6144,1536,bf16,NVIDIA GeForce RTX 4060,c06,64,128,32,4,3,8,0.0,117.862,66.44799932837486,106.56096190214154,18.179020650877188,1,-1,-1,64x6144x1536,0,
2026-03-03T03:57:13.142089+00:00,FULL,llm_style,tune,llm_style_tune_063,2,1536,1024,bf16,NVIDIA GeForce RTX 4060,c04,64,64,64,4,3,8,0.0,59.712,36.86400130391121,44.55424018204212,0.17066666063004093,7,-1,-1,2x1536x1024,0,
2026-03-03T03:57:13.193535+00:00,FULL,llm_style,eval,llm_style_eval_000,32,1536,1024,bf16,NVIDIA GeForce RTX 4060,c04,64,64,64,4,3,8,0.0,51.409,35.840000957250595,60.11904165148731,2.808685639268526,3,-1,-1,32x1536x1024,0,
2026-03-03T03:57:13.423633+00:00,FULL,llm_style,eval,llm_style_eval_001,32,2048,8192,bf16,NVIDIA GeForce RTX 4060,c06,64,128,32,4,3,8,0.0,230.055,165.80799967050552,183.38207855820656,6.475814352345756,2,-1,-1,32x2048x8192,0,
2026-03-03T03:57:13.550428+00:00,FULL,llm_style,eval,llm_style_eval_002,16,2048,4096,bf16,NVIDIA GeForce RTX 4060,c00,32,32,32,2,2,8,0.0,126.741,67.50399991869926,74.75200295448303,3.9765859256236573,7,-1,-1,16x2048x4096,0,
2026-03-03T03:57:13.573160+00:00,FULL,llm_style,eval,llm_style_eval_003,16,2048,1536,bf16,NVIDIA GeForce RTX 4060,c00,32,32,32,2,2,8,0.0,0.0,43.007999658584595,487.0835085958227,2.340571447151859,7,-1,-1,16x2048x1536,0,
2026-03-03T03:57:13.791353+00:00,FULL,llm_style,eval,llm_style_eval_004,64,8192,2048,bf16,NVIDIA GeForce RTX 4060,c10,64,128,64,8,3,8,0.0,218.139,167.08800196647644,176.10143586993217,12.852410841748283,1,-1,-1,64x8192x2048,0,
2026-03-03T03:57:14.094275+00:00,FULL,llm_style,eval,llm_style_eval_005,64,3072,8192,bf16,NVIDIA GeForce RTX 4060,c06,64,128,32,4,3,8,0.0,302.879,233.47200453281403,273.0492761731148,13.797052363711826,2,-1,-1,64x3072x8192,0,
2026-03-03T03:57:14.170576+00:00,FULL,llm_style,eval,llm_style_eval_006,32,2048,2048,bf16,NVIDIA GeForce RTX 4060,c00,32,32,32,2,2,8,0.0,76.253,47.00800031423569,75.77600330114365,5.71042065617729,3,-1,-1,32x2048x2048,0,
2026-03-03T03:57:14.391885+00:00,FULL,llm_style,eval,llm_style_eval_007,8,8192,2048,bf16,NVIDIA GeForce RTX 4060,c11,32,128,32,4,2,8,0.0,221.267,160.76800227165222,183.60319495201105,1.6697069827764632,5,-1,-1,8x8192x2048,0,
2026-03-03T03:57:14.588760+00:00,FULL,llm_style,eval,llm_style_eval_008,64,1536,8192,bf16,NVIDIA GeForce RTX 4060,c04,64,64,64,4,3,8,0.0,196.83,113.0720004439354,142.33983531594274,14.244134088691494,2,-1,-1,64x1536x8192,0,
2026-03-03T03:57:14.899260+00:00,FULL,llm_style,eval,llm_style_eval_009,64,4096,6144,bf16,NVIDIA GeForce RTX 4060,c03,64,64,32,4,2,8,0.0,310.454,233.90400409698486,246.92736148834226,13.77157045445176,3,-1,-1,64x4096x6144,0,
2026-03-03T03:57:15.031579+00:00,FULL,llm_style,eval,llm_style_eval_010,64,2048,4096,bf16,NVIDIA GeForce RTX 4060,c06,64,128,32,4,3,8,0.0,132.277,77.53600180149078,90.14816083014011,13.848300132227802,3,-1,-1,64x2048x4096,0,
2026-03-03T03:57:15.267530+00:00,FULL,llm_style,eval,llm_style_eval_011,32,3072,6144,bf16,NVIDIA GeForce RTX 4060,c10,64,128,64,8,3,8,0.0,235.907,179.55199629068375,200.6460839509964,6.727630864345206,3,-1,-1,32x3072x6144,0,
2026-03-03T03:57:15.331951+00:00,FULL,llm_style,eval,llm_style_eval_012,16,1536,1536,bf16,NVIDIA GeForce RTX 4060,c04,64,64,64,4,3,8,0.0,64.381,40.73600098490715,53.77023957669735,1.85333538331296,7,-1,-1,16x1536x1536,0,
2026-03-03T03:57:15.428946+00:00,FULL,llm_style,eval,llm_style_eval_013,64,2048,3072,bf16,NVIDIA GeForce RTX 4060,c03,64,64,32,4,2,8,0.0,96.955,64.25599753856659,139.16639819741232,12.532781356583149,3,-1,-1,64x2048x3072,0,
2026-03-03T03:57:16.015127+00:00,FULL,llm_style,eval,llm_style_eval_014,16,8192,6144,bf16,NVIDIA GeForce RTX 4060,c02,32,64,32,2,2,8,0.0,586.139,429.75999414920807,557.5439989566803,3.7477028060476294,5,-1,-1,16x8192x6144,0,
2026-03-03T03:57:16.069865+00:00,FULL,llm_style,eval,llm_style_eval_015,64,6144,1536,bf16,NVIDIA GeForce RTX 4060,c06,64,128,32,4,3,8,0.0,0.0,69.63200122117996,295.7619115710256,17.34776440164375,1,-1,-1,64x6144x1536,0,
2026-03-03T03:57:16.310953+00:00,FULL,llm_style,eval,llm_style_eval_016,16,4096,4096,bf16,NVIDIA GeForce RTX 4060,c11,32,128,32,4,2,8,0.0,241.034,161.56799346208572,232.35104426741592,3.322879120399453,7,-1,-1,16x4096x4096,0,
2026-03-03T03:57:16.769734+00:00,FULL,llm_style,eval,llm_style_eval_017,64,8192,4096,bf16,NVIDIA GeForce RTX 4060,c10,64,128,64,8,3,8,0.0,458.741,302.592009305954,358.7481620907783,14.193921729298916,1,-1,-1,64x8192x4096,0,
2026-03-03T03:57:17.091526+00:00,FULL,llm_style,eval,llm_style_eval_018,32,4096,6144,bf16,NVIDIA GeForce RTX 4060,c11,32,128,32,4,2,8,0.0,321.754,229.19999808073044,248.3843137323856,7.0271062368538875,3,-1,-1,32x4096x6144,0,
2026-03-03T03:57:17.393577+00:00,FULL,llm_style,eval,llm_style_eval_019,16,3072,8192,bf16,NVIDIA GeForce RTX 4060,c08,128,128,64,8,4,8,0.0,302.012,213.50400149822235,361.61888629198074,3.771856088639655,6,-1,-1,16x3072x8192,0,
2026-03-03T03:57:17.469308+00:00,FULL,llm_style,eval,llm_style_eval_020,4,1536,1536,bf16,NVIDIA GeForce RTX 4060,c04,64,64,64,4,3,8,0.0,75.688,42.75200143456459,49.71072006970643,0.44148501512587085,7,-1,-1,4x1536x1536,0,
2026-03-03T03:57:17.581212+00:00,FULL,llm_style,eval,llm_style_eval_021,4,6144,1536,bf16,NVIDIA GeForce RTX 4060,c11,32,128,32,4,2,8,0.0,111.862,47.10400104522705,64.89919956773517,1.6027825731302712,5,-1,-1,4x6144x1536,0,
2026-03-03T03:57:17.612082+00:00,FULL,llm_style,eval,llm_style_eval_022,32,6144,1024,bf16,NVIDIA GeForce RTX 4060,c11,32,128,32,4,2,8,0.0,0.0,50.623999908566475,126.96319706737984,7.953800267210098,1,-1,-1,32x6144x1024,0,
2026-03-03T03:57:17.622826+00:00,FULL,llm_style,eval,llm_style_eval_023,16,1024,1536,bf16,NVIDIA GeForce RTX 4060,c00,32,32,32,2,2,8,0.0,0.0,49.15200173854828,93.31711966544377,1.0239999637802455,7,-1,-1,16x1024x1536,0,
2026-03-03T03:57:17.722426+00:00,FULL,llm_style,eval,llm_style_eval_024,32,8192,1024,bf16,NVIDIA GeForce RTX 4060,c11,32,128,32,4,2,8,0.0,99.549,49.15200173854828,52.746239230036736,10.92266628032262,1,-1,-1,32x8192x1024,0,
2026-03-03T03:57:18.170678+00:00,FULL,llm_style,eval,llm_style_eval_025,32,6144,6144,bf16,NVIDIA GeForce RTX 4060,c11,32,128,32,4,2,8,0.0,448.209,327.61600613594055,430.9747210144996,7.3742401431923374,1,-1,-1,32x6144x6144,0,
2026-03-03T03:57:18.317311+00:00,FULL,llm_style,eval,llm_style_eval_026,1,6144,2048,bf16,NVIDIA GeForce RTX 4060,c00,32,32,32,2,2,8,0.0,146.594,66.28799811005592,155.99616020917864,0.37964374724694444,5,-1,-1,1x6144x2048,0,
2026-03-03T03:57:18.387263+00:00,FULL,llm_style,eval,llm_style_eval_027,32,4096,3072,bf16,NVIDIA GeForce RTX 4060,c04,64,64,64,4,3,8,0.0,0.0,92.79999881982803,236.26751422882074,8.677870455187279,3,-1,-1,32x4096x3072,0,
2026-03-03T03:57:18.455588+00:00,FULL,llm_style,eval,llm_style_eval_028,64,1536,1536,bf16,NVIDIA GeForce RTX 4060,c01,64,32,32,2,2,8,0.0,68.271,30.672000721096992,142.34623953700054,9.845783806084864,3,-1,-1,64x1536x1536,0,
2026-03-03T03:57:18.511053+00:00,FULL,llm_style,eval,llm_style_eval_029,2,3072,1024,bf16,NVIDIA GeForce RTX 4060,c00,32,32,32,2,2,8,0.0,55.427,36.83200106024742,93.1158410012721,0.34162987722056376,7,-1,-1,2x3072x1024,0,
2026-03-03T03:57:18.690758+00:00,FULL,llm_style,eval,llm_style_eval_030,32,1536,8192,bf16,NVIDIA GeForce RTX 4060,c04,64,64,64,4,3,8,0.0,179.661,106.81600123643875,111.61600053310394,7.5391922434677445,2,-1,-1,32x1536x8192,0,
2026-03-03T03:57:18.775681+00:00,FULL,llm_style,eval,llm_style_eval_031,8,3072,2048,bf16,NVIDIA GeForce RTX 4060,c11,32,128,32,4,2,8,0.0,84.877,52.38400027155876,60.4569599404931,1.9216420181383873,7,-1,-1,8x3072x2048,0,
2026-03-03T03:57:18.861612+00:00,FULL,llm_style,eval,llm_style_eval_032,8,2048,3072,bf16,NVIDIA GeForce RTX 4060,c00,32,32,32,2,2,8,0.0,85.888,51.19999870657921,102.94271759688854,1.9660800496673596,7,-1,-1,8x2048x3072,0,
2026-03-03T03:57:18.941161+00:00,FULL,llm_style,eval,llm_style_eval_033,64,1536,8192,bf16,NVIDIA GeForce RTX 4060,c04,64,64,64,4,3,8,0.0,0.0,111.61600053310394,218.04607421159733,14.429944885207671,2,-1,-1,64x1536x8192,0,
2026-03-03T03:57:19.091564+00:00,FULL,llm_style,eval,llm_style_eval_034,64,6144,2048,bf16,NVIDIA GeForce RTX 4060,c03,64,64,32,4,2,8,0.0,150.35,98.30400347709656,108.41663852334023,16.383999420483928,1,-1,-1,64x6144x2048,0,
2026-03-03T03:57:19.197500+00:00,FULL,llm_style,eval,llm_style_eval_035,4,4096,2048,bf16,NVIDIA GeForce RTX 4060,c11,32,128,32,4,2,8,0.0,105.893,53.247999399900436,66.62144020199776,1.2603077065112325,7,-1,-1,4x4096x2048,0,
2026-03-03T03:57:19.369071+00:00,FULL,llm_style,eval,llm_style_eval_036,64,8192,4096,bf16,NVIDIA GeForce RTX 4060,c10,64,128,64,8,3,8,0.0,0.0,305.56799471378326,414.4435149431228,14.055684398567239,1,-1,-1,64x8192x4096,0,
2026-03-03T03:57:19.403051+00:00,FULL,llm_style,eval,llm_style_eval_037,32,6144,1024,bf16,NVIDIA GeForce RTX 4060,c11,32,128,32,4,2,8,0.0,0.0,67.32799857854843,229.7241631150245,5.980471609151478,1,-1,-1,32x6144x1024,0,
2026-03-03T03:57:19.468004+00:00,FULL,llm_style,eval,llm_style_eval_038,64,6144,2048,bf16,NVIDIA GeForce RTX 4060,c03,64,64,32,4,2,8,0.0,0.0,102.39999741315842,203.41759800910944,15.728640397338877,1,-1,-1,64x6144x2048,0,
2026-03-03T03:57:19.544973+00:00,FULL,llm_style,eval,llm_style_eval_039,8,1024,3072,bf16,NVIDIA GeForce RTX 4060,c04,64,64,64,4,3,8,0.0,76.916,50.09600147604942,58.8454408198595,1.0047038988543475,7,-1,-1,8x1024x3072,0,
2026-03-03T03:57:19.765170+00:00,FULL,llm_style,eval,llm_style_eval_040,32,8192,2048,bf16,NVIDIA GeForce RTX 4060,c11,32,128,32,4,2,8,0.0,220.153,162.81600296497345,300.96736013889273,6.594817489967455,1,-1,-1,32x8192x2048,0,
2026-03-03T03:57:19.835843+00:00,FULL,llm_style,eval,llm_style_eval_041,32,3072,1024,bf16,NVIDIA GeForce RTX 4060,c11,32,128,32,4,2,8,0.0,70.632,41.98399931192398,48.691199682652936,4.795317151761212,3,-1,-1,32x3072x1024,0,
2026-03-03T03:57:19.858041+00:00,FULL,llm_style,eval,llm_style_eval_042,64,1024,4096,bf16,NVIDIA GeForce RTX 4060,c04,64,64,64,4,3,8,0.0,0.0,62.463998794555664,71.7004819214344,8.594885411767674,3,-1,-1,64x1024x4096,0,
2026-03-03T03:57:19.867048+00:00,FULL,llm_style,eval,llm_style_eval_043,2,1536,1024,bf16,NVIDIA GeForce RTX 4060,c04,64,64,64,4,3,8,0.0,0.0,37.74400055408478,45.9209593385458,0.16668757703584547,7,-1,-1,2x1536x1024,0,
2026-03-03T03:57:20.101971+00:00,FULL,llm_style,eval,llm_style_eval_044,64,6144,3072,bf16,NVIDIA GeForce RTX 4060,c11,32,128,32,4,2,8,0.0,234.887,183.1519976258278,191.36160030961037,13.190787626218668,1,-1,-1,64x6144x3072,0,
2026-03-03T03:57:20.243888+00:00,FULL,llm_style,eval,llm_style_eval_045,64,1536,6144,bf16,NVIDIA GeForce RTX 4060,c04,64,64,64,4,3,8,0.0,141.874,72.59200140833855,154.382075369358,16.640394651816877,3,-1,-1,64x1536x6144,0,
2026-03-03T03:57:20.479168+00:00,FULL,llm_style,eval,llm_style_eval_046,2,6144,3072,bf16,NVIDIA GeForce RTX 4060,c00,32,32,32,2,2,8,0.0,235.237,177.15199291706085,200.70143982768056,0.4261734274440055,5,-1,-1,2x6144x3072,0,
2026-03-03T03:57:20.883016+00:00,FULL,llm_style,eval,llm_style_eval_047,16,4096,8192,bf16,NVIDIA GeForce RTX 4060,c03,64,64,32,4,2,8,0.0,403.808,295.72799801826477,321.9033521413803,3.6308426364611015,6,-1,-1,16x4096x8192,0,
2026-03-03T03:57:20.936155+00:00,FULL,llm_style,eval,llm_style_eval_048,16,1024,6144,bf16,NVIDIA GeForce RTX 4060,c00,32,32,32,2,2,8,0.0,0.0,77.82399654388428,84.88223813474178,2.5869474833057904,7,-1,-1,16x1024x6144,0,
2026-03-03T03:57:21.078414+00:00,FULL,llm_style,eval,llm_style_eval_049,16,8192,1536,bf16,NVIDIA GeForce RTX 4060,c00,32,32,32,2,2,8,0.0,142.202,74.75200295448303,115.98304055631152,5.386520335049458,5,-1,-1,16x8192x1536,0,
2026-03-03T03:57:21.128393+00:00,FULL,llm_style,eval,llm_style_eval_050,1,1024,1024,bf16,NVIDIA GeForce RTX 4060,c00,32,32,32,2,2,8,0.0,49.932,33.76000002026558,114.25984166562556,0.062119431242331574,7,-1,-1,1x1024x1024,0,
2026-03-03T03:57:21.212979+00:00,FULL,llm_style,eval,llm_style_eval_051,16,6144,1024,bf16,NVIDIA GeForce RTX 4060,c11,32,128,32,4,2,8,0.0,84.548,40.95999896526337,62.36287895590064,4.9152001241684,5,-1,-1,16x6144x1024,0,
2026-03-03T03:57:21.974782+00:00,FULL,llm_style,eval,llm_style_eval_052,16,8192,8192,bf16,NVIDIA GeForce RTX 4060,c11,32,128,32,4,2,8,0.0,761.759,561.5039765834808,589.6521687507629,3.8245208182968686,4,-1,-1,16x8192x8192,0,
2026-03-03T03:57:22.530166+00:00,FULL,llm_style,eval,llm_style_eval_053,1,6144,8192,bf16,NVIDIA GeForce RTX 4060,c01,64,32,32,2,2,8,0.0,555.343,423.8080084323883,492.0204859972,0.2375209859113816,4,-1,-1,1x6144x8192,0,
2026-03-03T03:57:22.707154+00:00,FULL,llm_style,eval,llm_style_eval_054,64,4096,3072,bf16,NVIDIA GeForce RTX 4060,c04,64,64,64,4,3,8,0.0,176.945,98.27200323343277,105.38079760968685,16.389334530753306,3,-1,-1,64x4096x3072,0,
2026-03-03T03:57:22.814523+00:00,FULL,llm_style,eval,llm_style_eval_055,4,8192,1024,bf16,NVIDIA GeForce RTX 4060,c11,32,128,32,4,2,8,0.0,107.322,48.976000398397446,335.5932800471774,1.3702397797717243,5,-1,-1,4x8192x1024,0,
2026-03-03T03:57:22.896833+00:00,FULL,llm_style,eval,llm_style_eval_056,64,1024,3072,bf16,NVIDIA GeForce RTX 4060,c04,64,64,64,4,3,8,0.0,82.263,52.22399905323982,58.812800571322434,7.710117786834262,3,-1,-1,64x1024x3072,0,
2026-03-03T03:57:22.900926+00:00,FULL,llm_style,eval,llm_style_eval_057,64,1024,3072,bf16,NVIDIA GeForce RTX 4060,c04,64,64,64,4,3,8,0.0,0.0,49.15200173854828,67.22912210971114,8.191999710241964,3,-1,-1,64x1024x3072,0,
2026-03-03T03:57:23.020514+00:00,FULL,llm_style,eval,llm_style_eval_058,32,2048,4096,bf16,NVIDIA GeForce RTX 4060,c00,32,32,32,2,2,8,0.0,119.559,62.463998794555664,115.61600126326076,8.594885411767674,3,-1,-1,32x2048x4096,0,
2026-03-03T03:57:23.110075+00:00,FULL,llm_style,eval,llm_style_eval_059,64,8192,2048,bf16,NVIDIA GeForce RTX 4060,c10,64,128,64,8,3,8,0.0,0.0,167.32800006866455,176.5561556816101,12.83397666331254,1,-1,-1,64x8192x2048,0,
2026-03-03T03:57:23.342484+00:00,FULL,llm_style,eval,llm_style_eval_060,1,3072,6144,bf16,NVIDIA GeForce RTX 4060,c10,64,128,64,8,3,8,0.0,232.355,178.17600071430206,195.86623981595034,0.21186206811616876,7,-1,-1,1x3072x6144,0,
2026-03-03T03:57:23.377449+00:00,FULL,llm_style,eval,llm_style_eval_061,64,1536,4096,bf16,NVIDIA GeForce RTX 4060,c04,64,64,64,4,3,8,0.0,0.0,58.111999183893204,134.9846362322568,13.857832793734023,3,-1,-1,64x1536x4096,0,
2026-03-03T03:57:23.518172+00:00,FULL,llm_style,eval,llm_style_eval_062,16,6144,2048,bf16,NVIDIA GeForce RTX 4060,c00,32,32,32,2,2,8,0.0,140.672,77.93599739670753,92.1020808070898,5.166459626485905,5,-1,-1,16x6144x2048,0,
2026-03-03T03:57:23.573978+00:00,FULL,llm_style,eval,llm_style_eval_063,64,1536,6144,bf16,NVIDIA GeForce RTX 4060,c04,64,64,64,4,3,8,0.0,0.0,55.67999929189682,116.14208191633216,21.694676137968194,3,-1,-1,64x1536x6144,0,
2026-03-03T03:57:23.638814+00:00,FULL,llm_style,eval,llm_style_eval_064,1,6144,2048,bf16,NVIDIA GeForce RTX 4060,c00,32,32,32,2,2,8,0.0,0.0,67.63200089335442,142.30463579297066,0.3720993563340341,5,-1,-1,1x6144x2048,0,
2026-03-03T03:57:23.777719+00:00,FULL,llm_style,eval,llm_style_eval_065,8,1536,6144,bf16,NVIDIA GeForce RTX 4060,c04,64,64,64,4,3,8,0.0,138.841,70.36799937486649,123.46176415681828,2.1457899235647626,7,-1,-1,8x1536x6144,0,
2026-03-03T03:57:23.817381+00:00,FULL,llm_style,eval,llm_style_eval_066,64,1536,4096,bf16,NVIDIA GeForce RTX 4060,c04,64,64,64,4,3,8,0.0,0.0,89.02399986982346,165.9084840118885,9.045946814090247,3,-1,-1,64x1536x4096,0,
2026-03-03T03:57:23.906736+00:00,FULL,llm_style,eval,llm_style_eval_067,64,8192,2048,bf16,NVIDIA GeForce RTX 4060,c10,64,128,64,8,3,8,0.0,0.0,171.00800573825836,256.2166471779346,12.55779598580255,1,-1,-1,64x8192x2048,0,
2026-03-03T03:57:23.931258+00:00,FULL,llm_style,eval,llm_style_eval_068,64,1024,4096,bf16,NVIDIA GeForce RTX 4060,c04,64,64,64,4,3,8,0.0,0.0,78.86399701237679,210.8518405258655,6.807553919892551,3,-1,-1,64x1024x4096,0,
2026-03-03T03:57:23.969012+00:00,FULL,llm_style,eval,llm_style_eval_069,64,2048,4096,bf16,NVIDIA GeForce RTX 4060,c06,64,128,32,4,3,8,0.0,0.0,79.8719972372055,93.46848011016846,13.4432825162889,3,-1,-1,64x2048x4096,0,
2026-03-03T03:57:24.082016+00:00,FULL,llm_style,eval,llm_style_eval_070,64,8192,1024,bf16,NVIDIA GeForce RTX 4060,c06,64,128,32,4,3,8,0.0,112.95,65.5359998345375,72.1084812283516,16.384000041365624,1,-1,-1,64x8192x1024,0,
2026-03-03T03:57:24.157802+00:00,FULL,llm_style,eval,llm_style_eval_071,64,6144,2048,bf16,NVIDIA GeForce RTX 4060,c03,64,64,32,4,2,8,0.0,0.0,103.42399775981903,238.3334338665008,15.572911228400946,1,-1,-1,64x6144x2048,0,
2026-03-03T03:57:24.168791+00:00,FULL,llm_style,eval,llm_style_eval_072,64,1536,1024,bf16,NVIDIA GeForce RTX 4060,c04,64,64,64,4,3,8,0.0,0.0,45.05600035190582,138.72191742062566,4.468363601463886,3,-1,-1,64x1536x1024,0,
2026-03-03T03:57:24.195488+00:00,FULL,llm_style,eval,llm_style_eval_073,1,4096,1536,bf16,NVIDIA GeForce RTX 4060,c11,32,128,32,4,2,8,0.0,0.0,47.839999198913574,128.35456117987633,0.26302074019026644,7,-1,-1,1x4096x1536,0,
2026-03-03T03:57:24.264973+00:00,FULL,llm_style,eval,llm_style_eval_074,8,1024,2048,bf16,NVIDIA GeForce RTX 4060,c04,64,64,64,4,3,8,0.0,69.436,46.480000019073486,109.75264206528655,0.7219111873113304,7,-1,-1,8x1024x2048,0,
2026-03-03T03:57:24.354124+00:00,FULL,llm_style,eval,llm_style_eval_075,2,6144,1024,bf16,NVIDIA GeForce RTX 4060,c00,32,32,32,2,2,8,0.0,89.109,41.471999138593674,121.8892830610275,0.60681482741884,5,-1,-1,2x6144x1024,0,
2026-03-03T03:57:24.382533+00:00,FULL,llm_style,eval,llm_style_eval_076,64,1024,6144,bf16,NVIDIA GeForce RTX 4060,c04,64,64,64,4,3,8,0.0,0.0,65.98399952054024,148.2284808158874,12.204570408759706,3,-1,-1,64x1024x6144,0,
2026-03-03T03:57:24.795298+00:00,FULL,llm_style,eval,llm_style_eval_077,1,4096,8192,bf16,NVIDIA GeForce RTX 4060,c11,32,128,32,4,2,8,0.0,412.713,292.86399483680725,419.0230470895764,0.22914685718671254,6,-1,-1,1x4096x8192,0,
2026-03-03T03:57:24.902287+00:00,FULL,llm_style,eval,llm_style_eval_078,64,6144,3072,bf16,NVIDIA GeForce RTX 4060,c11,32,128,32,4,2,8,0.0,0.0,190.68799912929535,296.0793635249138,12.669486884499188,1,-1,-1,64x6144x3072,0,
2026-03-03T03:57:25.047581+00:00,FULL,llm_style,eval,llm_style_eval_079,2,3072,4096,bf16,NVIDIA GeForce RTX 4060,c00,32,32,32,2,2,8,0.0,145.242,62.97599896788597,167.23967686295504,0.7992195252935352,7,-1,-1,2x3072x4096,0,
2026-03-03T03:57:25.109644+00:00,FULL,llm_style,eval,llm_style_eval_080,4,1536,1024,bf16,NVIDIA GeForce RTX 4060,c04,64,64,64,4,3,8,0.0,62.019,40.672000497579575,52.82783932983874,0.3093752912583884,7,-1,-1,4x1536x1024,0,
2026-03-03T03:57:25.421865+00:00,FULL,llm_style,eval,llm_style_eval_081,4,4096,6144,bf16,NVIDIA GeForce RTX 4060,c11,32,128,32,4,2,8,0.0,312.178,227.02399641275406,280.98816841840744,0.8868075409701034,7,-1,-1,4x4096x6144,0,
2026-03-03T03:57:25.512573+00:00,FULL,llm_style,eval,llm_style_eval_082,64,6144,1024,bf16,NVIDIA GeForce RTX 4060,c06,64,128,32,4,3,8,0.0,90.667,53.247999399900436,136.15040101110924,15.123692478134789,1,-1,-1,64x6144x1024,0,
2026-03-03T03:57:25.597464+00:00,FULL,llm_style,eval,llm_style_eval_083,8,4096,4096,bf16,NVIDIA GeForce RTX 4060,c11,32,128,32,4,2,8,0.0,0.0,165.8879965543747,248.27743366360662,1.6181728731169065,7,-1,-1,8x4096x4096,0,
2026-03-03T03:57:25.744702+00:00,FULL,llm_style,eval,llm_style_eval_084,64,1024,8192,bf16,NVIDIA GeForce RTX 4060,c04,64,64,64,4,3,8,0.0,147.186,86.01599931716919,160.91136217117307,12.483047718143249,2,-1,-1,64x1024x8192,0,
2026-03-03T03:57:26.037598+00:00,FULL,llm_style,eval,llm_style_eval_085,1,3072,8192,bf16,NVIDIA GeForce RTX 4060,c10,64,128,64,8,3,8,0.0,292.852,226.30399465560913,249.9401576817035,0.2224072450713697,6,-1,-1,1x3072x8192,0,
2026-03-03T03:57:26.096855+00:00,FULL,llm_style,eval,llm_style_eval_086,8,1536,1024,bf16,NVIDIA GeForce RTX 4060,c04,64,64,64,4,3,8,0.0,59.216,35.840000957250595,52.30944033712146,0.7021714098171316,7,-1,-1,8x1536x1024,0,
2026-03-03T03:57:26.177226+00:00,FULL,llm_style,eval,llm_style_eval_087,16,1024,3072,bf16,NVIDIA GeForce RTX 4060,c04,64,64,64,4,3,8,0.0,80.335,54.27199974656105,121.13599732518173,1.8547924614916835,7,-1,-1,16x1024x3072,0,
2026-03-03T03:57:26.267801+00:00,FULL,llm_style,eval,llm_style_eval_088,8,4096,1536,bf16,NVIDIA GeForce RTX 4060,c11,32,128,32,4,2,8,0.0,90.533,46.08000069856644,150.8390402793884,2.1845333002161103,7,-1,-1,8x4096x1536,0,
2026-03-03T03:57:26.508588+00:00,FULL,llm_style,eval,llm_style_eval_089,16,6144,3072,bf16,NVIDIA GeForce RTX 4060,c11,32,128,32,4,2,8,0.0,240.744,177.93600261211395,234.34719905257222,3.39436520509358,5,-1,-1,16x6144x3072,0,
2026-03-03T03:57:26.611694+00:00,FULL,llm_style,eval,llm_style_eval_090,32,1536,3072,bf16,NVIDIA GeForce RTX 4060,c04,64,64,64,4,3,8,0.0,103.061,55.296000093221664,127.00928099453446,5.461333324126256,3,-1,-1,32x1536x3072,0,
2026-03-03T03:57:26.698180+00:00,FULL,llm_style,eval,llm_style_eval_091,16,1024,4096,bf16,NVIDIA GeForce RTX 4060,c00,32,32,32,2,2,8,0.0,86.444,56.32000043988228,69.12416070699692,2.3831272541140724,7,-1,-1,16x1024x4096,0,
2026-03-03T03:57:27.017284+00:00,FULL,llm_style,eval,llm_style_eval_092,1,4096,6144,bf16,NVIDIA GeForce RTX 4060,c03,64,64,32,4,2,8,0.0,319.061,228.35199534893036,325.519362092018,0.22041256054317093,7,-1,-1,1x4096x6144,0,
2026-03-03T03:57:27.118417+00:00,FULL,llm_style,eval,llm_style_eval_093,32,2048,3072,bf16,NVIDIA GeForce RTX 4060,c00,32,32,32,2,2,8,0.0,101.089,57.392001152038574,83.46015810966492,7.015841509574155,3,-1,-1,32x2048x3072,0,
2026-03-03T03:57:27.130430+00:00,FULL,llm_style,eval,llm_style_eval_094,32,1024,2048,bf16,NVIDIA GeForce RTX 4060,c04,64,64,64,4,3,8,0.0,0.0,39.88800011575222,99.81983944773663,3.3648648117355955,3,-1,-1,32x1024x2048,0,
2026-03-03T03:57:27.274312+00:00,FULL,llm_style,eval,llm_style_eval_095,8,6144,2048,bf16,NVIDIA GeForce RTX 4060,c11,32,128,32,4,2,8,0.0,143.845,71.68000191450119,180.5587200820445,2.808685639268526,5,-1,-1,8x6144x2048,0,
2026-03-03T03:57:27.303056+00:00,FULL,llm_style,eval,llm_style_eval_096,64,2048,3072,bf16,NVIDIA GeForce RTX 4060,c03,64,64,32,4,2,8,0.0,0.0,96.25600278377533,244.89984810352303,8.366297630382595,3,-1,-1,64x2048x3072,0,
2026-03-03T03:57:27.328747+00:00,FULL,llm_style,eval,llm_style_eval_097,64,6144,1024,bf16,NVIDIA GeForce RTX 4060,c06,64,128,32,4,3,8,0.0,0.0,68.60800087451935,168.140797317028,11.73779089515909,1,-1,-1,64x6144x1024,0,
2026-03-03T03:57:27.353665+00:00,FULL,llm_style,eval,llm_style_eval_098,32,6144,1024,bf16,NVIDIA GeForce RTX 4060,c11,32,128,32,4,2,8,0.0,0.0,47.10400104522705,116.15648165345172,8.548173723361447,1,-1,-1,32x6144x1024,0,
2026-03-03T03:57:27.426139+00:00,FULL,llm_style,eval,llm_style_eval_099,1,2048,2048,bf16,NVIDIA GeForce RTX 4060,c00,32,32,32,2,2,8,0.0,72.418,47.10400104522705,51.72223888337612,0.17808695257003015,7,-1,-1,1x2048x2048,0,
2026-03-03T03:57:27.472556+00:00,FULL,llm_style,eval,llm_style_eval_100,64,8192,1024,bf16,NVIDIA GeForce RTX 4060,c06,64,128,32,4,3,8,0.0,0.0,66.56000018119812,135.55359974503517,16.13193841762204,1,-1,-1,64x8192x1024,0,
2026-03-03T03:57:27.539102+00:00,FULL,llm_style,eval,llm_style_eval_101,64,8192,1536,bf16,NVIDIA GeForce RTX 4060,c06,64,128,32,4,3,8,0.0,0.0,102.22399979829788,232.00768038630486,15.755720175085717,1,-1,-1,64x8192x1536,0,
2026-03-03T03:57:27.571280+00:00,FULL,llm_style,eval,llm_style_eval_102,32,3072,2048,bf16,NVIDIA GeForce RTX 4060,c02,32,64,32,2,2,8,0.0,0.0,53.247999399900436,149.9030414968727,7.561846239067394,3,-1,-1,32x3072x2048,0,
2026-03-03T03:57:27.597382+00:00,FULL,llm_style,eval,llm_style_eval_103,64,2048,3072,bf16,NVIDIA GeForce RTX 4060,c03,64,64,32,4,2,8,0.0,0.0,61.43999844789505,163.9628759026527,13.107200331115733,3,-1,-1,64x2048x3072,0,
2026-03-03T03:57:27.664111+00:00,FULL,llm_style,eval,llm_style_eval_104,16,6144,2048,bf16,NVIDIA GeForce RTX 4060,c00,32,32,32,2,2,8,0.0,0.0,84.81599763035774,152.07040265202522,4.7473730811353505,5,-1,-1,16x6144x2048,0,
2026-03-03T03:57:27.809735+00:00,FULL,llm_style,eval,llm_style_eval_105,1,1024,8192,bf16,NVIDIA GeForce RTX 4060,c04,64,64,64,4,3,8,0.0,145.566,85.67999675869942,192.69631817936894,0.19581251907898264,6,-1,-1,1x1024x8192,0,
2026-03-03T03:57:28.221098+00:00,FULL,llm_style,eval,llm_style_eval_106,32,4096,8192,bf16,NVIDIA GeForce RTX 4060,c02,32,64,32,2,2,8,0.0,411.317,295.9359884262085,362.92895555496216,7.25658159867729,2,-1,-1,32x4096x8192,0,
2026-03-03T03:57:28.273879+00:00,FULL,llm_style,eval,llm_style_eval_107,64,6144,1536,bf16,NVIDIA GeForce RTX 4060,c06,64,128,32,4,3,8,0.0,0.0,64.51199948787689,156.82368054985997,18.72457157721487,1,-1,-1,64x6144x1536,0,
2026-03-03T03:57:28.342770+00:00,FULL,llm_style,eval,llm_style_eval_108,8,3072,1536,bf16,NVIDIA GeForce RTX 4060,c02,32,64,32,2,2,8,0.0,68.836,44.95999962091446,140.7980789244175,1.6792142490339377,7,-1,-1,8x3072x1536,0,
2026-03-03T03:57:28.354253+00:00,FULL,llm_style,eval,llm_style_eval_109,16,2048,1024,bf16,NVIDIA GeForce RTX 4060,c11,32,128,32,4,2,8,0.0,0.0,44.03200000524521,99.1948799788951,1.52409302307426,7,-1,-1,16x2048x1024,0,
2026-03-03T03:57:29.135394+00:00,FULL,llm_style,eval,llm_style_eval_110,1,8192,8192,bf16,NVIDIA GeForce RTX 4060,c02,32,64,32,2,2,8,0.0,781.098,557.7919781208038,679.9696254730225,0.24062326685331387,4,-1,-1,1x8192x8192,0,
2026-03-03T03:57:29.252729+00:00,FULL,llm_style,eval,llm_style_eval_111,8,6144,1536,bf16,NVIDIA GeForce RTX 4060,c11,32,128,32,4,2,8,0.0,117.291,48.128001391887665,64.03936032205817,3.137361611393473,5,-1,-1,8x6144x1536,0,
2026-03-03T03:57:29.353182+00:00,FULL,llm_style,eval,llm_style_eval_112,2,6144,3072,bf16,NVIDIA GeForce RTX 4060,c00,32,32,32,2,2,8,0.0,0.0,182.20800161361694,238.38815987110132,0.4143477307878989,5,-1,-1,2x6144x3072,0,
2026-03-03T03:57:29.685192+00:00,FULL,llm_style,eval,llm_style_eval_113,1,8192,8192,bf16,NVIDIA GeForce RTX 4060,c02,32,64,32,2,2,8,0.0,0.0,560.1279735565186,619.5091211795807,0.23961975537088048,4,-1,-1,1x8192x8192,0,
2026-03-03T03:57:29.746357+00:00,FULL,llm_style,eval,llm_style_eval_114,1,3072,1024,bf16,NVIDIA GeForce RTX 4060,c06,64,128,32,4,3,8,0.0,61.116,39.93599861860275,51.230080313980565,0.15753846698776053,7,-1,-1,1x3072x1024,0,
2026-03-03T03:57:29.823116+00:00,FULL,llm_style,eval,llm_style_eval_115,16,3072,1536,bf16,NVIDIA GeForce RTX 4060,c11,32,128,32,4,2,8,0.0,76.715,46.08000069856644,58.31520028412341,3.2767999503241656,7,-1,-1,16x3072x1536,0,
2026-03-03T03:57:29.882144+00:00,FULL,llm_style,eval,llm_style_eval_116,8,3072,1024,bf16,NVIDIA GeForce RTX 4060,c00,32,32,32,2,2,8,0.0,58.983,29.21600081026554,195.82527980208394,1.7227425590129062,7,-1,-1,8x3072x1024,0,
2026-03-03T03:57:29.969126+00:00,FULL,llm_style,eval,llm_style_eval_117,4,1024,4096,bf16,NVIDIA GeForce RTX 4060,c04,64,64,64,4,3,8,0.0,86.938,56.04799836874008,64.5324794948101,0.5986731547350757,7,-1,-1,4x1024x4096,0,
2026-03-03T03:57:30.065769+00:00,FULL,llm_style,eval,llm_style_eval_118,64,6144,3072,bf16,NVIDIA GeForce RTX 4060,c11,32,128,32,4,2,8,0.0,0.0,186.44800037145615,301.66494905948633,12.957602651606983,1,-1,-1,64x6144x3072,0,
2026-03-03T03:57:30.636748+00:00,FULL,llm_style,eval,llm_style_eval_119,64,8192,6144,bf16,NVIDIA GeForce RTX 4060,c10,64,128,64,8,3,8,0.0,570.926,441.3439929485321,563.2006281614304,14.597345940882205,1,-1,-1,64x8192x6144,0,
2026-03-03T03:57:30.734396+00:00,FULL,llm_style,eval,llm_style_eval_120,8,1024,4096,bf16,NVIDIA GeForce RTX 4060,c04,64,64,64,4,3,8,0.0,97.606,60.416001826524734,65.46239912509918,1.1107796274353405,7,-1,-1,8x1024x4096,0,
2026-03-03T03:57:30.802930+00:00,FULL,llm_style,eval,llm_style_eval_121,4,1024,2048,bf16,NVIDIA GeForce RTX 4060,c04,64,64,64,4,3,8,0.0,68.488,44.03200000524521,48.66271931678055,0.381023255768565,7,-1,-1,4x1024x2048,0,
2026-03-03T03:57:31.121767+00:00,FULL,llm_style,eval,llm_style_eval_122,4,6144,4096,bf16,NVIDIA GeForce RTX 4060,c06,64,128,32,4,3,8,0.0,318.79,227.183997631073,273.11104685068125,0.8861829798722745,5,-1,-1,4x6144x4096,0,
2026-03-03T03:57:31.438451+00:00,FULL,llm_style,eval,llm_style_eval_123,4,3072,8192,bf16,NVIDIA GeForce RTX 4060,c06,64,128,32,4,3,8,0.0,316.637,227.83999890089035,273.5648036003113,0.8836314649368323,6,-1,-1,4x3072x8192,0,
2026-03-03T03:57:31.481064+00:00,FULL,llm_style,eval,llm_style_eval_124,64,6144,1024,bf16,NVIDIA GeForce RTX 4060,c06,64,128,32,4,3,8,0.0,0.0,60.416001826524734,141.81823879480362,13.329355529224086,1,-1,-1,64x6144x1024,0,
2026-03-03T03:57:31.556455+00:00,FULL,llm_style,eval,llm_style_eval_125,64,1536,8192,bf16,NVIDIA GeForce RTX 4060,c04,64,64,64,4,3,8,0.0,0.0,111.58400028944016,184.81696099042887,14.434083128604431,2,-1,-1,64x1536x8192,0,
2026-03-03T03:57:31.652557+00:00,FULL,llm_style,eval,llm_style_eval_126,64,2048,8192,bf16,NVIDIA GeForce RTX 4060,c06,64,128,32,4,3,8,0.0,0.0,171.00800573825836,306.37375086545933,12.55779598580255,2,-1,-1,64x2048x8192,0,
2026-03-03T03:57:31.806498+00:00,FULL,llm_style,eval,llm_style_eval_127,2,8192,1536,bf16,NVIDIA GeForce RTX 4060,c00,32,32,32,2,2,8,0.0,153.885,62.49599903821945,143.14495980739588,0.8053579233003326,5,-1,-1,2x8192x1536,0,
2026-03-03T03:57:31.890916+00:00,FULL,llm_style,eval,llm_style_eval_128,8,2048,2048,bf16,NVIDIA GeForce RTX 4060,c00,32,32,32,2,2,8,0.0,84.372,46.08000069856644,199.52703863382337,1.4563555334774068,7,-1,-1,8x2048x2048,0,
2026-03-03T03:57:32.157045+00:00,FULL,llm_style,eval,llm_style_eval_129,64,8192,6144,bf16,NVIDIA GeForce RTX 4060,c10,64,128,64,8,3,8,0.0,0.0,446.9760060310364,532.2649574279785,14.41341561308027,1,-1,-1,64x8192x6144,0,
2026-03-03T03:57:32.179416+00:00,FULL,llm_style,eval,llm_style_eval_130,16,3072,1536,bf16,NVIDIA GeForce RTX 4060,c11,32,128,32,4,2,8,0.0,0.0,44.03200000524521,159.19104158878315,3.429209301917085,7,-1,-1,16x3072x1536,0,
2026-03-03T03:57:32.962099+00:00,FULL,llm_style,eval,llm_style_eval_131,32,8192,8192,bf16,NVIDIA GeForce RTX 4060,c11,32,128,32,4,2,8,0.0,782.626,560.1279735565186,668.2300704717634,7.6678321718681755,0,-1,-1,32x8192x8192,0,
2026-03-03T03:57:33.360632+00:00,FULL,llm_style,eval,llm_style_eval_132,32,8192,4096,bf16,NVIDIA GeForce RTX 4060,c00,32,32,32,2,2,8,0.0,398.487,298.0159968137741,392.2384074330329,7.205934147695875,1,-1,-1,32x8192x4096,0,
2026-03-03T03:57:34.098679+00:00,FULL,llm_style,eval,llm_style_eval_133,2,8192,8192,bf16,NVIDIA GeForce RTX 4060,c10,64,128,64,8,3,8,0.0,738.005,556.7840039730072,680.1695984601974,0.48211775856443917,4,-1,-1,2x8192x8192,0,
2026-03-03T03:57:34.213993+00:00,FULL,llm_style,eval,llm_style_eval_134,64,3072,3072,bf16,NVIDIA GeForce RTX 4060,c03,64,64,32,4,2,8,0.0,115.267,66.56000018119812,71.17824174463749,18.1484307198248,3,-1,-1,64x3072x3072,0,
2026-03-03T03:57:34.333357+00:00,FULL,llm_style,eval,llm_style_eval_135,8,3072,3072,bf16,NVIDIA GeForce RTX 4060,c00,32,32,32,2,2,8,0.0,119.32,58.36800113320351,124.11167852580546,2.5869473181959677,7,-1,-1,8x3072x3072,0,
2026-03-03T03:57:34.454643+00:00,FULL,llm_style,eval,llm_style_eval_136,4,2048,4096,bf16,NVIDIA GeForce RTX 4060,c00,32,32,32,2,2,8,0.0,121.241,65.2799978852272,133.2838404178619,1.0280157195775073,7,-1,-1,4x2048x4096,0,
2026-03-03T03:57:35.202365+00:00,FULL,llm_style,eval,llm_style_eval_137,4,8192,8192,bf16,NVIDIA GeForce RTX 4060,c11,32,128,32,4,2,8,0.0,747.676,557.0560097694397,601.1824059486389,0.9637646889802084,4,-1,-1,4x8192x8192,0,
2026-03-03T03:57:35.263369+00:00,FULL,llm_style,eval,llm_style_eval_138,16,1024,1024,bf16,NVIDIA GeForce RTX 4060,c04,64,64,64,4,3,8,0.0,60.958,39.93599861860275,55.10784048587084,0.8402051572680562,7,-1,-1,16x1024x1024,0,
2026-03-03T03:57:35.314868+00:00,FULL,llm_style,eval,llm_style_eval_139,4,1024,1024,bf16,NVIDIA GeForce RTX 4060,c04,64,64,64,4,3,8,0.0,51.453,35.840000957250595,45.08608013391493,0.23405713660571054,7,-1,-1,4x1024x1024,0,
2026-03-03T03:57:35.449006+00:00,FULL,llm_style,eval,llm_style_eval_140,64,4096,6144,bf16,NVIDIA GeForce RTX 4060,c03,64,64,32,4,2,8,0.0,0.0,234.41600054502487,263.6783990263939,13.741491470337115,3,-1,-1,64x4096x6144,0,
2026-03-03T03:57:35.571238+00:00,FULL,llm_style,eval,llm_style_eval_141,4,6144,4096,bf16,NVIDIA GeForce RTX 4060,c06,64,128,32,4,3,8,0.0,0.0,230.28799891471863,289.82112407684326,0.874238314409759,5,-1,-1,4x6144x4096,0,
2026-03-03T03:57:35.738751+00:00,FULL,llm_style,eval,llm_style_eval_142,4,2048,6144,bf16,NVIDIA GeForce RTX 4060,c00,32,32,32,2,2,8,0.0,167.467,103.42399775981903,178.7596845626831,0.9733069517750591,7,-1,-1,4x2048x6144,0,
2026-03-03T03:57:35.818776+00:00,FULL,llm_style,eval,llm_style_eval_143,64,1536,8192,bf16,NVIDIA GeForce RTX 4060,c04,64,64,64,4,3,8,0.0,0.0,111.61600053310394,215.16287833452222,14.429944885207671,2,-1,-1,64x1536x8192,0,
2026-03-03T03:57:35.935127+00:00,FULL,llm_style,eval,llm_style_eval_144,1,3072,3072,bf16,NVIDIA GeForce RTX 4060,c00,32,32,32,2,2,8,0.0,116.291,58.14399942755699,207.11040243506426,0.32461420242541156,7,-1,-1,1x3072x3072,0,
2026-03-03T03:57:35.948234+00:00,FULL,llm_style,eval,llm_style_eval_145,32,1024,2048,bf16,NVIDIA GeForce RTX 4060,c04,64,64,64,4,3,8,0.0,0.0,56.01599998772144,257.2876742482182,2.396060554652602,3,-1,-1,32x1024x2048,0,
2026-03-03T03:57:36.112680+00:00,FULL,llm_style,eval,llm_style_eval_146,64,8192,4096,bf16,NVIDIA GeForce RTX 4060,c10,64,128,64,8,3,8,0.0,0.0,307.20001459121704,407.40000635385513,13.981012669270863,1,-1,-1,64x8192x4096,0,
2026-03-03T03:57:36.159295+00:00,FULL,llm_style,eval,llm_style_eval_147,64,2048,4096,bf16,NVIDIA GeForce RTX 4060,c06,64,128,32,4,3,8,0.0,0.0,82.94399827718735,170.01472160220135,12.945382984935252,3,-1,-1,64x2048x4096,0,
2026-03-03T03:57:36.190115+00:00,FULL,llm_style,eval,llm_style_eval_148,64,1024,6144,bf16,NVIDIA GeForce RTX 4060,c04,64,64,64,4,3,8,0.0,0.0,83.96799862384796,137.20863714814183,9.590634303522425,3,-1,-1,64x1024x6144,0,
2026-03-03T03:57:36.358774+00:00,FULL,llm_style,eval,llm_style_eval_149,64,4096,8192,bf16,NVIDIA GeForce RTX 4060,c11,32,128,32,4,2,8,0.0,0.0,306.9919943809509,438.2374349236487,13.990486314344443,2,-1,-1,64x4096x8192,0,
2026-03-03T03:57:36.450236+00:00,FULL,llm_style,eval,llm_style_eval_150,2,2048,3072,bf16,NVIDIA GeForce RTX 4060,c01,64,32,32,2,2,8,0.0,91.41,39.93599861860275,151.35744273662561,0.6301538679510421,7,-1,-1,2x2048x3072,0,
2026-03-03T03:57:36.567869+00:00,FULL,llm_style,eval,llm_style_eval_151,64,4096,2048,bf16,NVIDIA GeForce RTX 4060,c11,32,128,32,4,2,8,0.0,117.59,69.61600109934807,79.43648062646386,15.423779117500263,3,-1,-1,64x4096x2048,0,
2026-03-03T03:57:37.321144+00:00,FULL,llm_style,eval,llm_style_eval_152,8,8192,8192,bf16,NVIDIA GeForce RTX 4060,c11,32,128,32,4,2,8,0.0,753.232,559.0560138225555,620.2355164289474,1.9206337065552177,4,-1,-1,8x8192x8192,0,
2026-03-03T03:57:37.416411+00:00,FULL,llm_style,eval,llm_style_eval_153,64,8192,2048,bf16,NVIDIA GeForce RTX 4060,c10,64,128,64,8,3,8,0.0,0.0,170.86400091648102,249.299200773239,12.568379743429388,1,-1,-1,64x8192x2048,0,
2026-03-03T03:57:37.642382+00:00,FULL,llm_style,eval,llm_style_eval_154,16,2048,8192,bf16,NVIDIA GeForce RTX 4060,c06,64,128,32,4,3,8,0.0,225.916,163.503997027874,194.9446415901184,3.283533869257489,6,-1,-1,16x2048x8192,0,
2026-03-03T03:57:37.722111+00:00,FULL,llm_style,eval,llm_style_eval_155,4,2048,1536,bf16,NVIDIA GeForce RTX 4060,c00,32,32,32,2,2,8,0.0,79.685,46.01600021123886,797.7139222621915,0.5468929043044803,7,-1,-1,4x2048x1536,0,
2026-03-03T03:57:37.851595+00:00,FULL,llm_style,eval,llm_style_eval_156,1,4096,6144,bf16,NVIDIA GeForce RTX 4060,c03,64,64,32,4,2,8,0.0,0.0,230.89599609375,348.5510429739951,0.21798406577636797,7,-1,-1,1x4096x6144,0,
2026-03-03T03:57:38.028582+00:00,FULL,llm_style,eval,llm_style_eval_157,1,1536,8192,bf16,NVIDIA GeForce RTX 4060,c04,64,64,64,4,3,8,0.0,176.931,96.25600278377533,102.39999741315842,0.2614468009494561,6,-1,-1,1x1536x8192,0,
2026-03-03T03:57:38.105528+00:00,FULL,llm_style,eval,llm_style_eval_158,64,1536,8192,bf16,NVIDIA GeForce RTX 4060,c04,64,64,64,4,3,8,0.0,0.0,112.33599856495857,204.31487783789635,14.337458664852292,2,-1,-1,64x1536x8192,0,
2026-03-03T03:57:38.217711+00:00,FULL,llm_style,eval,llm_style_eval_159,16,6144,1536,bf16,NVIDIA GeForce RTX 4060,c11,32,128,32,4,2,8,0.0,112.132,48.128001391887665,55.920638404786565,6.274723222786946,5,-1,-1,16x6144x1536,0,
2026-03-03T03:57:38.407545+00:00,FULL,llm_style,eval,llm_style_eval_160,32,6144,6144,bf16,NVIDIA GeForce RTX 4060,c11,32,128,32,4,2,8,0.0,0.0,329.4239938259125,438.21920216083527,7.333767877505357,1,-1,-1,32x6144x6144,0,
2026-03-03T03:57:38.504228+00:00,FULL,llm_style,eval,llm_style_eval_161,2,1536,4096,bf16,NVIDIA GeForce RTX 4060,c04,64,64,64,4,3,8,0.0,96.631,58.36800113320351,64.11871969699858,0.43115788636599456,7,-1,-1,2x1536x4096,0,
2026-03-03T03:57:38.600686+00:00,FULL,llm_style,eval,llm_style_eval_162,64,1536,3072,bf16,NVIDIA GeForce RTX 4060,c00,32,32,32,2,2,8,0.0,96.419,45.312000438570976,469.8793473839755,13.329355803189694,3,-1,-1,64x1536x3072,0,
2026-03-03T03:57:38.641883+00:00,FULL,llm_style,eval,llm_style_eval_163,64,1024,8192,bf16,NVIDIA GeForce RTX 4060,c04,64,64,64,4,3,8,0.0,0.0,96.25600278377533,182.69408106803894,11.155063507176793,2,-1,-1,64x1024x8192,0,
2026-03-03T03:57:38.816147+00:00,FULL,llm_style,eval,llm_style_eval_164,64,4096,8192,bf16,NVIDIA GeForce RTX 4060,c11,32,128,32,4,2,8,0.0,0.0,303.8399964570999,373.65279585123045,14.135621860456476,2,-1,-1,64x4096x8192,0,
2026-03-03T03:57:39.118128+00:00,FULL,llm_style,eval,llm_style_eval_165,4,8192,3072,bf16,NVIDIA GeForce RTX 4060,c11,32,128,32,4,2,8,0.0,301.926,227.32800245285034,269.9161583185196,0.8856216120658376,5,-1,-1,4x8192x3072,0,
2026-03-03T03:57:39.160699+00:00,FULL,llm_style,eval,llm_style_eval_166,64,1024,6144,bf16,NVIDIA GeForce RTX 4060,c04,64,64,64,4,3,8,0.0,0.0,74.08000156283379,126.41632132232189,10.870766077359603,3,-1,-1,64x1024x6144,0,
2026-03-03T03:57:39.171995+00:00,FULL,llm_style,eval,llm_style_eval_167,2,2048,1024,bf16,NVIDIA GeForce RTX 4060,c11,32,128,32,4,2,8,0.0,0.0,45.05600035190582,94.0019204467534,0.1861818167276619,7,-1,-1,2x2048x1024,0,
2026-03-03T03:57:39.243196+00:00,FULL,llm_style,eval,llm_style_eval_168,64,4096,1024,bf16,NVIDIA GeForce RTX 4060,c04,64,64,64,4,3,8,0.0,71.155,47.15200141072273,65.0582409277558,11.385962333253394,3,-1,-1,64x4096x1024,0,
2026-03-03T03:57:39.280542+00:00,FULL,llm_style,eval,llm_style_eval_169,4,1536,6144,bf16,NVIDIA GeForce RTX 4060,c04,64,64,64,4,3,8,0.0,0.0,74.75200295448303,155.82143858075133,1.0099725628217733,7,-1,-1,4x1536x6144,0,
2026-03-03T03:57:39.294746+00:00,FULL,llm_style,eval,llm_style_eval_170,16,1536,1536,bf16,NVIDIA GeForce RTX 4060,c04,64,64,64,4,3,8,0.0,0.0,43.99999976158142,95.43679870665069,1.715851645661157,7,-1,-1,16x1536x1536,0,
2026-03-03T03:57:39.389717+00:00,FULL,llm_style,eval,llm_style_eval_171,1,2048,3072,bf16,NVIDIA GeForce RTX 4060,c00,32,32,32,2,2,8,0.0,94.927,56.304000318050385,139.12287771701813,0.2234816696668366,7,-1,-1,1x2048x3072,0,
2026-03-03T03:57:39.476338+00:00,FULL,llm_style,eval,llm_style_eval_172,64,3072,2048,bf16,NVIDIA GeForce RTX 4060,c03,64,64,32,4,2,8,0.0,86.58,53.58400009572506,78.79839926958081,15.02885873696181,3,-1,-1,64x3072x2048,0,
2026-03-03T03:57:39.722587+00:00,FULL,llm_style,eval,llm_style_eval_173,64,8192,6144,bf16,NVIDIA GeForce RTX 4060,c10,64,128,64,8,3,8,0.0,0.0,443.7279999256134,578.4972888231277,14.518919124058012,1,-1,-1,64x8192x6144,0,
2026-03-03T03:57:39.937391+00:00,FULL,llm_style,eval,llm_style_eval_174,2,4096,4096,bf16,NVIDIA GeForce RTX 4060,c00,32,32,32,2,2,8,0.0,214.752,160.65599769353867,274.68480974435795,0.41771776319247256,7,-1,-1,2x4096x4096,0,
2026-03-03T03:57:39.985296+00:00,FULL,llm_style,eval,llm_style_eval_175,64,4096,2048,bf16,NVIDIA GeForce RTX 4060,c11,32,128,32,4,2,8,0.0,0.0,49.04000088572502,152.43263915181143,21.895224400629118,3,-1,-1,64x4096x2048,0,
2026-03-03T03:57:40.049298+00:00,FULL,llm_style,eval,llm_style_eval_176,16,6144,2048,bf16,NVIDIA GeForce RTX 4060,c00,32,32,32,2,2,8,0.0,0.0,80.25600016117096,147.00095817446697,5.0171100377714755,5,-1,-1,16x6144x2048,0,
2026-03-03T03:57:40.095291+00:00,FULL,llm_style,eval,llm_style_eval_177,1,6144,1536,bf16,NVIDIA GeForce RTX 4060,c02,32,64,32,2,2,8,0.0,0.0,53.247999399900436,129.29312027990815,0.35446154245628414,5,-1,-1,1x6144x1536,0,
2026-03-03T03:57:40.333848+00:00,FULL,llm_style,eval,llm_style_eval_178,32,6144,8192,bf16,NVIDIA GeForce RTX 4060,c11,32,128,32,4,2,8,0.0,0.0,428.5919964313507,530.0777381658554,7.515832070643802,0,-1,-1,32x6144x8192,0,
2026-03-03T03:57:40.465240+00:00,FULL,llm_style,eval,llm_style_eval_179,64,4096,6144,bf16,NVIDIA GeForce RTX 4060,c03,64,64,32,4,2,8,0.0,0.0,233.42400044202805,355.56799650192244,13.799889753838773,3,-1,-1,64x4096x6144,0,
2026-03-03T03:57:40.481109+00:00,FULL,llm_style,eval,llm_style_eval_180,64,2048,1536,bf16,NVIDIA GeForce RTX 4060,c00,32,32,32,2,2,8,0.0,0.0,60.44800020754337,102.30847969651211,6.661149791846256,3,-1,-1,64x2048x1536,0,
2026-03-03T03:57:40.511153+00:00,FULL,llm_style,eval,llm_style_eval_181,64,2048,3072,bf16,NVIDIA GeForce RTX 4060,c03,64,64,32,4,2,8,0.0,0.0,73.44000041484833,237.42016285657857,10.965500591652782,3,-1,-1,64x2048x3072,0,
2026-03-03T03:57:40.589362+00:00,FULL,llm_style,eval,llm_style_eval_182,32,3072,1536,bf16,NVIDIA GeForce RTX 4060,c11,32,128,32,4,2,8,0.0,78.152,49.15200173854828,72.9641600325703,6.1439997826814725,3,-1,-1,32x3072x1536,0,
2026-03-03T03:57:40.675817+00:00,FULL,llm_style,eval,llm_style_eval_183,8,8192,2048,bf16,NVIDIA GeForce RTX 4060,c11,32,128,32,4,2,8,0.0,0.0,166.9120043516159,277.34208062291117,1.6082453568439294,5,-1,-1,8x8192x2048,0,
2026-03-03T03:57:40.718848+00:00,FULL,llm_style,eval,llm_style_eval_184,64,8192,1024,bf16,NVIDIA GeForce RTX 4060,c06,64,128,32,4,3,8,0.0,0.0,91.47199988365173,175.4630422592163,11.738475439104331,1,-1,-1,64x8192x1024,0,
2026-03-03T03:57:40.780314+00:00,FULL,llm_style,eval,llm_style_eval_185,1,8192,1536,bf16,NVIDIA GeForce RTX 4060,c11,32,128,32,4,2,8,0.0,0.0,69.68000158667564,180.75488075613973,0.3611627931537284,5,-1,-1,1x8192x1536,0,
2026-03-03T03:57:40.803958+00:00,FULL,llm_style,eval,llm_style_eval_186,16,6144,1024,bf16,NVIDIA GeForce RTX 4060,c11,32,128,32,4,2,8,0.0,0.0,40.01599922776222,50.84255963563919,5.031152436156686,5,-1,-1,16x6144x1024,0,
2026-03-03T03:57:40.828611+00:00,FULL,llm_style,eval,llm_style_eval_187,1,1024,6144,bf16,NVIDIA GeForce RTX 4060,c04,64,64,64,4,3,8,0.0,0.0,69.56800073385239,113.62591646611679,0.18087212320702853,7,-1,-1,1x1024x6144,0,
2026-03-03T03:57:41.217684+00:00,FULL,llm_style,eval,llm_style_eval_188,8,8192,4096,bf16,NVIDIA GeForce RTX 4060,c02,32,64,32,2,2,8,0.0,389.021,294.99199986457825,329.22624349594116,1.8199507520422957,5,-1,-1,8x8192x4096,0,
2026-03-03T03:57:41.449122+00:00,FULL,llm_style,eval,llm_style_eval_189,8,2048,8192,bf16,NVIDIA GeForce RTX 4060,c10,64,128,64,8,3,8,0.0,231.392,162.81600296497345,174.18239921331406,1.6487043724918637,6,-1,-1,8x2048x8192,0,
2026-03-03T03:57:41.664532+00:00,FULL,llm_style,eval,llm_style_eval_190,4,8192,2048,bf16,NVIDIA GeForce RTX 4060,c11,32,128,32,4,2,8,0.0,215.361,160.76800227165222,260.126722306013,0.8348534913882316,5,-1,-1,4x8192x2048,0,
2026-03-03T03:57:41.991408+00:00,FULL,llm_style,eval,llm_style_eval_191,4,8192,8192,bf16,NVIDIA GeForce RTX 4060,c11,32,128,32,4,2,8,0.0,0.0,558.976024389267,669.1833513975143,0.9604542745578063,4,-1,-1,4x8192x8192,0,
2026-03-03T03:57:42.002282+00:00,FULL,llm_style,eval,llm_style_eval_192,64,1536,1024,bf16,NVIDIA GeForce RTX 4060,c04,64,64,64,4,3,8,0.0,0.0,45.024000108242035,121.90368078649036,4.471539434878986,3,-1,-1,64x1536x1024,0,
2026-03-03T03:57:42.023635+00:00,FULL,llm_style,eval,llm_style_eval_193,32,2048,2048,bf16,NVIDIA GeForce RTX 4060,c00,32,32,32,2,2,8,0.0,0.0,57.711999863386154,262.2956717014312,4.651293606796353,3,-1,-1,32x2048x2048,0,
2026-03-03T03:57:42.036463+00:00,FULL,llm_style,eval,llm_style_eval_194,8,1024,2048,bf16,NVIDIA GeForce RTX 4060,c04,64,64,64,4,3,8,0.0,0.0,47.07200080156326,182.23103433847407,0.7128320748772093,7,-1,-1,8x1024x2048,0,
2026-03-03T03:57:42.072142+00:00,FULL,llm_style,eval,llm_style_eval_195,2,4096,2048,bf16,NVIDIA GeForce RTX 4060,c11,32,128,32,4,2,8,0.0,0.0,55.1999993622303,66.51584107428788,0.6078701519507457,7,-1,-1,2x4096x2048,0,
2026-03-03T03:57:42.121495+00:00,FULL,llm_style,eval,llm_style_eval_196,32,2048,4096,bf16,NVIDIA GeForce RTX 4060,c00,32,32,32,2,2,8,0.0,0.0,66.51199981570244,77.32224002480507,8.07179025570741,3,-1,-1,32x2048x4096,0,
2026-03-03T03:57:42.267890+00:00,FULL,llm_style,eval,llm_style_eval_197,32,8192,1536,bf16,NVIDIA GeForce RTX 4060,c11,32,128,32,4,2,8,0.0,146.341,82.94399827718735,89.59456041455269,9.70903723870144,1,-1,-1,32x8192x1536,0,
2026-03-03T03:57:42.434542+00:00,FULL,llm_style,eval,llm_style_eval_198,64,4096,8192,bf16,NVIDIA GeForce RTX 4060,c11,32,128,32,4,2,8,0.0,0.0,303.1040132045746,443.2732731103896,14.169945328639345,2,-1,-1,64x4096x8192,0,
2026-03-03T03:57:42.819753+00:00,FULL,llm_style,eval,llm_style_eval_199,2,8192,4096,bf16,NVIDIA GeForce RTX 4060,c11,32,128,32,4,2,8,0.0,385.154,292.27200150489807,324.0953615307808,0.4592219826357561,5,-1,-1,2x8192x4096,0,
2026-03-03T03:57:42.901264+00:00,FULL,llm_style,eval,llm_style_eval_200,1,4096,1024,bf16,NVIDIA GeForce RTX 4060,c11,32,128,32,4,2,8,0.0,81.473,41.98399931192398,49.67424001544714,0.19980488132338384,7,-1,-1,1x4096x1024,0,
2026-03-03T03:57:43.084020+00:00,FULL,llm_style,eval,llm_style_eval_201,4,1536,8192,bf16,NVIDIA GeForce RTX 4060,c04,64,64,64,4,3,8,0.0,182.713,96.28800302743912,240.0995177030561,1.0454396480869381,6,-1,-1,4x1536x8192,0,
2026-03-03T03:57:43.317749+00:00,FULL,llm_style,eval,llm_style_eval_202,1,6144,3072,bf16,NVIDIA GeForce RTX 4060,c11,32,128,32,4,2,8,0.0,233.689,177.07200348377228,198.14623966813087,0.21318297222214166,5,-1,-1,1x6144x3072,0,
2026-03-03T03:57:43.498514+00:00,FULL,llm_style,eval,llm_style_eval_203,16,2048,6144,bf16,NVIDIA GeForce RTX 4060,c10,64,128,64,8,3,8,0.0,180.714,106.49599879980087,111.5219198167324,3.780923119533697,7,-1,-1,16x2048x6144,0,
2026-03-03T03:57:43.515317+00:00,FULL,llm_style,eval,llm_style_eval_204,16,1536,1024,bf16,NVIDIA GeForce RTX 4060,c00,32,32,32,2,2,8,0.0,0.0,40.95999896526337,409.0681539475909,1.2288000310421,7,-1,-1,16x1536x1024,0,
2026-03-03T03:57:43.583453+00:00,FULL,llm_style,eval,llm_style_eval_205,64,6144,2048,bf16,NVIDIA GeForce RTX 4060,c03,64,64,32,4,2,8,0.0,0.0,102.28800028562546,231.80448621511448,15.745861992634335,1,-1,-1,64x6144x2048,0,
2026-03-03T03:57:43.652281+00:00,FULL,llm_style,eval,llm_style_eval_206,4,2048,6144,bf16,NVIDIA GeForce RTX 4060,c00,32,32,32,2,2,8,0.0,0.0,107.37599804997444,362.9023990035057,0.9374841475573502,7,-1,-1,4x2048x6144,0,
2026-03-03T03:57:43.775927+00:00,FULL,llm_style,eval,llm_style_eval_207,32,6144,1536,bf16,NVIDIA GeForce RTX 4060,c00,32,32,32,2,2,8,0.0,123.593,41.7919997125864,241.72543987631798,14.45204297841007,1,-1,-1,32x6144x1536,0,
2026-03-03T03:57:43.835937+00:00,FULL,llm_style,eval,llm_style_eval_208,4,2048,1024,bf16,NVIDIA GeForce RTX 4060,c11,32,128,32,4,2,8,0.0,59.97,39.5359992980957,57.409920021891566,0.424352901099128,7,-1,-1,4x2048x1024,0,
2026-03-03T03:57:43.891479+00:00,FULL,llm_style,eval,llm_style_eval_209,1,1024,1536,bf16,NVIDIA GeForce RTX 4060,c04,64,64,64,4,3,8,0.0,55.502,38.72000053524971,56.32703922688958,0.08124297408354136,7,-1,-1,1x1024x1536,0,
2026-03-03T03:57:44.185547+00:00,FULL,llm_style,eval,llm_style_eval_210,8,6144,4096,bf16,NVIDIA GeForce RTX 4060,c11,32,128,32,4,2,8,0.0,294.026,227.08799690008163,241.02112606167793,1.773115221836964,5,-1,-1,8x6144x4096,0,
2026-03-03T03:57:44.424045+00:00,FULL,llm_style,eval,llm_style_eval_211,4,2048,8192,bf16,NVIDIA GeForce RTX 4060,c06,64,128,32,4,3,8,0.0,238.455,161.79199516773224,186.2895992398262,0.8295696450300549,6,-1,-1,4x2048x8192,0,
2026-03-03T03:57:44.481807+00:00,FULL,llm_style,eval,llm_style_eval_212,32,1024,1024,bf16,NVIDIA GeForce RTX 4060,c04,64,64,64,4,3,8,0.0,57.719,38.91199827194214,42.5267194956541,1.7246316555371939,3,-1,-1,32x1024x1024,0,
2026-03-03T03:57:44.627119+00:00,FULL,llm_style,eval,llm_style_eval_213,16,3072,4096,bf16,NVIDIA GeForce RTX 4060,c04,64,64,64,4,3,8,0.0,145.267,82.94399827718735,95.23551806807515,4.85451861935072,7,-1,-1,16x3072x4096,0,
2026-03-03T03:57:44.676580+00:00,FULL,llm_style,eval,llm_style_eval_214,64,1024,8192,bf16,NVIDIA GeForce RTX 4060,c04,64,64,64,4,3,8,0.0,0.0,90.11200070381165,226.67264208197588,11.915636270570362,2,-1,-1,64x1024x8192,0,
2026-03-03T03:57:44.701981+00:00,FULL,llm_style,eval,llm_style_eval_215,4,4096,1536,bf16,NVIDIA GeForce RTX 4060,c00,32,32,32,2,2,8,0.0,0.0,60.87999977171421,184.45600569248194,0.826735351326083,7,-1,-1,4x4096x1536,0,
2026-03-03T03:57:44.790593+00:00,FULL,llm_style,eval,llm_style_eval_216,16,1536,3072,bf16,NVIDIA GeForce RTX 4060,c04,64,64,64,4,3,8,0.0,88.551,56.32000043988228,68.07904034852982,2.6810181608783314,7,-1,-1,16x1536x3072,0,
2026-03-03T03:57:44.857135+00:00,FULL,llm_style,eval,llm_style_eval_217,8,6144,2048,bf16,NVIDIA GeForce RTX 4060,c11,32,128,32,4,2,8,0.0,0.0,73.72800260782242,217.79456287622446,2.730666570080655,5,-1,-1,8x6144x2048,0,
2026-03-03T03:57:45.014938+00:00,FULL,llm_style,eval,llm_style_eval_218,8,3072,4096,bf16,NVIDIA GeForce RTX 4060,c04,64,64,64,4,3,8,0.0,157.751,79.8719972372055,166.35903656482685,2.5206154718041685,7,-1,-1,8x3072x4096,0,
2026-03-03T03:57:45.340633+00:00,FULL,llm_style,eval,llm_style_eval_219,64,8192,3072,bf16,NVIDIA GeForce RTX 4060,c10,64,128,64,8,3,8,0.0,325.65,237.21600323915482,338.96447509527184,13.579292408667921,1,-1,-1,64x8192x3072,0,
2026-03-03T03:57:45.376291+00:00,FULL,llm_style,eval,llm_style_eval_220,2,4096,2048,bf16,NVIDIA GeForce RTX 4060,c11,32,128,32,4,2,8,0.0,0.0,62.463998794555664,225.6895942986011,0.5371803382354796,7,-1,-1,2x4096x2048,0,
2026-03-03T03:57:45.547373+00:00,FULL,llm_style,eval,llm_style_eval_221,4,1024,8192,bf16,NVIDIA GeForce RTX 4060,c00,32,32,32,2,2,8,0.0,171.036,92.78399869799614,131.08383826911444,0.7232805757642924,6,-1,-1,4x1024x8192,0,
2026-03-03T03:57:45.621900+00:00,FULL,llm_style,eval,llm_style_eval_222,64,6144,2048,bf16,NVIDIA GeForce RTX 4060,c03,64,64,32,4,2,8,0.0,0.0,124.92799758911133,167.76031598448742,12.892328117651509,1,-1,-1,64x6144x2048,0,
2026-03-03T03:57:45.717152+00:00,FULL,llm_style,eval,llm_style_eval_223,4,2048,2048,bf16,NVIDIA GeForce RTX 4060,c11,32,128,32,4,2,8,0.0,95.196,50.175998359918594,95.26144102215763,0.668734715736196,7,-1,-1,4x2048x2048,0,
2026-03-03T03:57:45.740184+00:00,FULL,llm_style,eval,llm_style_eval_224,16,3072,1536,bf16,NVIDIA GeForce RTX 4060,c11,32,128,32,4,2,8,0.0,0.0,50.175998359918594,96.27328332513557,3.0093062208128822,7,-1,-1,16x3072x1536,0,
2026-03-03T03:57:45.762382+00:00,FULL,llm_style,eval,llm_style_eval_225,1,2048,2048,bf16,NVIDIA GeForce RTX 4060,c00,32,32,32,2,2,8,0.0,0.0,51.19999870657921,54.794239923357964,0.16384000413894662,7,-1,-1,1x2048x2048,0,
2026-03-03T03:57:45.775262+00:00,FULL,llm_style,eval,llm_style_eval_226,8,1536,1024,bf16,NVIDIA GeForce RTX 4060,c04,64,64,64,4,3,8,0.0,0.0,64.51199948787689,153.52255910634995,0.3900952411919764,7,-1,-1,8x1536x1024,0,
2026-03-03T03:57:45.964643+00:00,FULL,llm_style,eval,llm_style_eval_227,64,6144,6144,bf16,NVIDIA GeForce RTX 4060,c06,64,128,32,4,3,8,0.0,0.0,336.89600229263306,416.9727995991706,14.342224826410945,1,-1,-1,64x6144x6144,0,
2026-03-03T03:57:46.029007+00:00,FULL,llm_style,eval,llm_style_eval_228,64,6144,2048,bf16,NVIDIA GeForce RTX 4060,c03,64,64,32,4,2,8,0.0,0.0,98.30400347709656,181.32608130574224,16.383999420483928,1,-1,-1,64x6144x2048,0,
2026-03-03T03:57:46.211762+00:00,FULL,llm_style,eval,llm_style_eval_229,16,1536,8192,bf16,NVIDIA GeForce RTX 4060,c04,64,64,64,4,3,8,0.0,182.703,102.39999741315842,110.97151912748814,3.932160099334719,6,-1,-1,16x1536x8192,0,
2026-03-03T03:57:46.237931+00:00,FULL,llm_style,eval,llm_style_eval_230,64,2048,1536,bf16,NVIDIA GeForce RTX 4060,c00,32,32,32,2,2,8,0.0,0.0,85.40799841284752,212.13920176029205,4.714466929123477,3,-1,-1,64x2048x1536,0,
2026-03-03T03:57:46.285407+00:00,FULL,llm_style,eval,llm_style_eval_231,4,1024,8192,bf16,NVIDIA GeForce RTX 4060,c00,32,32,32,2,2,8,0.0,0.0,90.64000099897385,194.97632533311844,0.7403890474445134,6,-1,-1,4x1024x8192,0,
2026-03-03T03:57:46.306345+00:00,FULL,llm_style,eval,llm_style_eval_232,16,3072,1536,bf16,NVIDIA GeForce RTX 4060,c11,32,128,32,4,2,8,0.0,0.0,68.60800087451935,137.06815831363184,2.200835792842329,7,-1,-1,16x3072x1536,0,
2026-03-03T03:57:46.358306+00:00,FULL,llm_style,eval,llm_style_eval_233,64,3072,3072,bf16,NVIDIA GeForce RTX 4060,c03,64,64,32,4,2,8,0.0,0.0,66.56000018119812,145.6784006953239,18.1484307198248,3,-1,-1,64x3072x3072,0,
2026-03-03T03:57:46.520079+00:00,FULL,llm_style,eval,llm_style_eval_234,32,8192,4096,bf16,NVIDIA GeForce RTX 4060,c00,32,32,32,2,2,8,0.0,0.0,303.1040132045746,362.8444790840148,7.084972664319673,1,-1,-1,32x8192x4096,0,
2026-03-03T03:57:46.533982+00:00,FULL,llm_style,eval,llm_style_eval_235,4,2048,1024,bf16,NVIDIA GeForce RTX 4060,c11,32,128,32,4,2,8,0.0,0.0,21.79200015962124,81.88192099332808,0.7698795832007557,7,-1,-1,4x2048x1024,0,
2026-03-03T03:57:46.659847+00:00,FULL,llm_style,eval,llm_style_eval_236,4,8192,3072,bf16,NVIDIA GeForce RTX 4060,c11,32,128,32,4,2,8,0.0,0.0,257.7759921550751,309.2480003833771,0.7810137411046574,5,-1,-1,4x8192x3072,0,
2026-03-03T03:57:46.681377+00:00,FULL,llm_style,eval,llm_style_eval_237,64,1024,4096,bf16,NVIDIA GeForce RTX 4060,c04,64,64,64,4,3,8,0.0,0.0,79.16799932718277,155.57183921337128,6.781413153833009,3,-1,-1,64x1024x4096,0,
2026-03-03T03:57:46.865302+00:00,FULL,llm_style,eval,llm_style_eval_238,32,2048,6144,bf16,NVIDIA GeForce RTX 4060,c10,64,128,64,8,3,8,0.0,183.876,111.35999858379364,278.60384762287094,7.231558712656065,3,-1,-1,32x2048x6144,0,
2026-03-03T03:57:46.873768+00:00,FULL,llm_style,eval,llm_style_eval_239,32,2048,6144,bf16,NVIDIA GeForce RTX 4060,c10,64,128,64,8,3,8,0.0,0.0,109.56799983978271,143.99904415011403,7.349831786448325,3,-1,-1,32x2048x6144,0,
2026-03-03T03:57:47.043631+00:00,FULL,llm_style,eval,llm_style_eval_240,8,8192,1536,bf16,NVIDIA GeForce RTX 4060,c02,32,64,32,2,2,8,0.0,169.832,72.38399982452393,80.19839972257614,2.7813687070079527,5,-1,-1,8x8192x1536,0,
2026-03-03T03:57:47.066084+00:00,FULL,llm_style,eval,llm_style_eval_241,16,1536,1536,bf16,NVIDIA GeForce RTX 4060,c04,64,64,64,4,3,8,0.0,0.0,69.63200122117996,165.39039626717567,1.0842352751027344,7,-1,-1,16x1536x1536,0,
2026-03-03T03:57:47.092658+00:00,FULL,llm_style,eval,llm_style_eval_242,1,2048,3072,bf16,NVIDIA GeForce RTX 4060,c00,32,32,32,2,2,8,0.0,0.0,67.07200035452843,184.98559936881063,0.18760305244348438,7,-1,-1,1x2048x3072,0,
2026-03-03T03:57:47.137160+00:00,FULL,llm_style,eval,llm_style_eval_243,8,1536,6144,bf16,NVIDIA GeForce RTX 4060,c04,64,64,64,4,3,8,0.0,0.0,50.095999613404274,138.24064075946805,3.014111808632281,7,-1,-1,8x1536x6144,0,
2026-03-03T03:57:47.181923+00:00,FULL,llm_style,eval,llm_style_eval_244,32,8192,1024,bf16,NVIDIA GeForce RTX 4060,c11,32,128,32,4,2,8,0.0,0.0,27.98399981111288,121.64928309619418,19.184924086041487,1,-1,-1,32x8192x1024,0,
2026-03-03T03:57:47.316177+00:00,FULL,llm_style,eval,llm_style_eval_245,4,6144,4096,bf16,NVIDIA GeForce RTX 4060,c06,64,128,32,4,3,8,0.0,0.0,230.3679957985878,276.69119223952276,0.873934729093277,5,-1,-1,4x6144x4096,0,
2026-03-03T03:57:47.383801+00:00,FULL,llm_style,eval,llm_style_eval_246,32,2048,6144,bf16,NVIDIA GeForce RTX 4060,c10,64,128,64,8,3,8,0.0,0.0,116.73600226640701,231.78111851215363,6.898526181855913,3,-1,-1,32x2048x6144,0,
2026-03-03T03:57:47.449115+00:00,FULL,llm_style,eval,llm_style_eval_247,64,6144,2048,bf16,NVIDIA GeForce RTX 4060,c03,64,64,32,4,2,8,0.0,0.0,98.62400218844414,144.46975931525216,16.33083935209351,1,-1,-1,64x6144x2048,0,
2026-03-03T03:57:47.457594+00:00,FULL,llm_style,eval,llm_style_eval_248,64,1024,1024,bf16,NVIDIA GeForce RTX 4060,c04,64,64,64,4,3,8,0.0,0.0,33.79200026392937,147.46624507009972,3.9718787568567877,3,-1,-1,64x1024x1024,0,
2026-03-03T03:57:47.563413+00:00,FULL,llm_style,eval,llm_style_eval_249,2,8192,1024,bf16,NVIDIA GeForce RTX 4060,c00,32,32,32,2,2,8,0.0,105.781,49.15200173854828,113.83776366710657,0.6826666425201637,5,-1,-1,2x8192x1024,0,
2026-03-03T03:57:47.611607+00:00,FULL,llm_style,eval,llm_style_eval_250,64,3072,3072,bf16,NVIDIA GeForce RTX 4060,c03,64,64,32,4,2,8,0.0,0.0,64.51199948787689,145.55135712027547,18.72457157721487,3,-1,-1,64x3072x3072,0,
2026-03-03T03:57:47.657997+00:00,FULL,llm_style,eval,llm_style_eval_251,64,1024,8192,bf16,NVIDIA GeForce RTX 4060,c04,64,64,64,4,3,8,0.0,0.0,91.13600105047226,168.55040028691286,11.781752673187277,2,-1,-1,64x1024x8192,0,
2026-03-03T03:57:47.730390+00:00,FULL,llm_style,eval,llm_style_eval_252,64,4096,3072,bf16,NVIDIA GeForce RTX 4060,c04,64,64,64,4,3,8,0.0,0.0,103.2479964196682,198.46144378185267,15.599457537688227,3,-1,-1,64x4096x3072,0,
2026-03-03T03:57:47.862333+00:00,FULL,llm_style,eval,llm_style_eval_253,8,6144,4096,bf16,NVIDIA GeForce RTX 4060,c11,32,128,32,4,2,8,0.0,0.0,256.00001215934753,303.4876847267151,1.5728639252929724,5,-1,-1,8x6144x4096,0,
2026-03-03T03:57:47.965877+00:00,FULL,llm_style,eval,llm_style_eval_254,4,1536,3072,bf16,NVIDIA GeForce RTX 4060,c11,32,128,32,4,2,8,0.0,103.49,62.07999959588051,72.76544228196143,0.608065983339744,7,-1,-1,4x1536x3072,0,
2026-03-03T03:57:47.986216+00:00,FULL,llm_style,eval,llm_style_eval_255,1,3072,1536,bf16,NVIDIA GeForce RTX 4060,c00,32,32,32,2,2,8,0.0,0.0,38.14399987459183,132.1775969862938,0.24740939678657617,7,-1,-1,1x3072x1536,0,
2026-03-03T03:57:48.434117+00:00,BUCKET,llm_style,tune,llm_style_tune_000,64,6144,6144,bf16,NVIDIA GeForce RTX 4060,c10,64,128,64,8,3,8,0.0,445.028,334.84798669815063,385.2406388521194,14.429945527358568,1,-1,-1,llm8_g1,0,
2026-03-03T03:57:48.504202+00:00,BUCKET,llm_style,tune,llm_style_tune_001,64,8192,1536,bf16,NVIDIA GeForce RTX 4060,c10,64,128,64,8,3,8,0.0,0.0,126.97599828243256,245.60831978917122,12.684387268352213,1,-1,-1,llm8_g1,0,
2026-03-03T03:57:48.809304+00:00,BUCKET,llm_style,tune,llm_style_tune_002,32,3072,8192,bf16,NVIDIA GeForce RTX 4060,c06,64,128,32,4,3,8,0.0,305.039,231.4240038394928,349.0796822309491,6.959575105774515,2,-1,-1,llm8_g2,0,
2026-03-03T03:57:49.047943+00:00,BUCKET,llm_style,tune,llm_style_tune_003,4,6144,3072,bf16,NVIDIA GeForce RTX 4060,c10,64,128,64,8,3,8,0.0,238.594,179.08799648284912,252.68895477056495,0.8431326887643219,5,-1,-1,llm8_g5,0,
2026-03-03T03:57:49.096845+00:00,BUCKET,llm_style,tune,llm_style_tune_004,8,8192,1024,bf16,NVIDIA GeForce RTX 4060,c10,64,128,64,8,3,8,0.0,0.0,71.68000191450119,181.57568171620363,1.8724570928456843,5,-1,-1,llm8_g5,0,
2026-03-03T03:57:49.227070+00:00,BUCKET,llm_style,tune,llm_style_tune_005,32,8192,3072,bf16,NVIDIA GeForce RTX 4060,c10,64,128,64,8,3,8,0.0,0.0,231.4240038394928,320.7577568292618,6.959575105774515,1,-1,-1,llm8_g1,0,
2026-03-03T03:57:49.802331+00:00,BUCKET,llm_style,tune,llm_style_tune_006,32,6144,8192,bf16,NVIDIA GeForce RTX 4060,c11,32,128,32,4,2,8,0.0,575.208,428.79998683929443,573.1868672370908,7.5121864992203236,0,-1,-1,llm8_g0,0,
2026-03-03T03:57:49.881803+00:00,BUCKET,llm_style,tune,llm_style_tune_007,8,1536,2048,bf16,NVIDIA GeForce RTX 4060,c00,32,32,32,2,2,8,0.0,79.429,48.128001391887665,115.6185562908648,1.0457872037978244,7,-1,-1,llm8_g7,0,
2026-03-03T03:57:49.909024+00:00,BUCKET,llm_style,tune,llm_style_tune_008,16,1536,4096,bf16,NVIDIA GeForce RTX 4060,c00,32,32,32,2,2,8,0.0,0.0,60.416001826524734,151.18528291583058,3.3323388823060216,7,-1,-1,llm8_g7,0,
2026-03-03T03:57:49.973848+00:00,BUCKET,llm_style,tune,llm_style_tune_009,64,1536,2048,bf16,NVIDIA GeForce RTX 4060,c04,64,64,64,4,3,8,0.0,64.767,43.007999658584595,53.288959413766854,9.362285788607435,3,-1,-1,llm8_g3,0,
2026-03-03T03:57:49.984780+00:00,BUCKET,llm_style,tune,llm_style_tune_010,2,2048,1024,bf16,NVIDIA GeForce RTX 4060,c00,32,32,32,2,2,8,0.0,0.0,35.840000957250595,43.53023983538151,0.23405713660571054,7,-1,-1,llm8_g7,0,
2026-03-03T03:57:50.284451+00:00,BUCKET,llm_style,tune,llm_style_tune_011,2,3072,8192,bf16,NVIDIA GeForce RTX 4060,c04,64,64,64,4,3,8,0.0,299.628,228.35199534893036,246.66335672140121,0.44082512108634186,6,-1,-1,llm8_g6,0,
2026-03-03T03:57:50.311862+00:00,BUCKET,llm_style,tune,llm_style_tune_012,64,2048,1536,bf16,NVIDIA GeForce RTX 4060,c04,64,64,64,4,3,8,0.0,0.0,51.19999870657921,231.36127814650501,7.864320198669438,3,-1,-1,llm8_g3,0,
2026-03-03T03:57:50.490370+00:00,BUCKET,llm_style,tune,llm_style_tune_013,16,8192,4096,bf16,NVIDIA GeForce RTX 4060,c10,64,128,64,8,3,8,0.0,0.0,298.0000078678131,382.4332788586614,3.6031603880906293,5,-1,-1,llm8_g5,0,
2026-03-03T03:57:50.654126+00:00,BUCKET,llm_style,tune,llm_style_tune_014,4,8192,4096,bf16,NVIDIA GeForce RTX 4060,c10,64,128,64,8,3,8,0.0,0.0,320.19199430942535,383.2524716854094,0.838357800228418,5,-1,-1,llm8_g5,0,
2026-03-03T03:57:50.682753+00:00,BUCKET,llm_style,tune,llm_style_tune_015,4,3072,2048,bf16,NVIDIA GeForce RTX 4060,c00,32,32,32,2,2,8,0.0,0.0,68.60800087451935,163.44256214797474,0.7336119309474431,7,-1,-1,llm8_g7,0,
2026-03-03T03:57:50.697398+00:00,BUCKET,llm_style,tune,llm_style_tune_016,16,1536,1024,bf16,NVIDIA GeForce RTX 4060,c00,32,32,32,2,2,8,0.0,0.0,40.64000025391579,79.97184000909323,1.238475582813275,7,-1,-1,llm8_g7,0,
2026-03-03T03:57:50.710616+00:00,BUCKET,llm_style,tune,llm_style_tune_017,32,1024,2048,bf16,NVIDIA GeForce RTX 4060,c04,64,64,64,4,3,8,0.0,0.0,47.53600060939789,162.0624062418937,2.8234964296400045,3,-1,-1,llm8_g3,0,
2026-03-03T03:57:50.724886+00:00,BUCKET,llm_style,tune,llm_style_tune_018,64,1536,2048,bf16,NVIDIA GeForce RTX 4060,c04,64,64,64,4,3,8,0.0,0.0,38.7520007789135,135.14368057250977,10.390513416254358,3,-1,-1,llm8_g3,0,
2026-03-03T03:57:50.749463+00:00,BUCKET,llm_style,tune,llm_style_tune_019,4,4096,1536,bf16,NVIDIA GeForce RTX 4060,c00,32,32,32,2,2,8,0.0,0.0,50.6879985332489,136.08223676681519,0.9929697257031139,7,-1,-1,llm8_g7,0,
2026-03-03T03:57:50.820981+00:00,BUCKET,llm_style,tune,llm_style_tune_020,1,8192,1536,bf16,NVIDIA GeForce RTX 4060,c10,64,128,64,8,3,8,0.0,0.0,94.56000104546547,155.83232060074803,0.26613603766670857,5,-1,-1,llm8_g5,0,
2026-03-03T03:57:50.848667+00:00,BUCKET,llm_style,tune,llm_style_tune_021,64,1536,4096,bf16,NVIDIA GeForce RTX 4060,c04,64,64,64,4,3,8,0.0,0.0,69.02400031685829,155.88960081338868,11.667048625162247,3,-1,-1,llm8_g3,0,
2026-03-03T03:57:50.877019+00:00,BUCKET,llm_style,tune,llm_style_tune_022,64,1024,6144,bf16,NVIDIA GeForce RTX 4060,c04,64,64,64,4,3,8,0.0,0.0,77.19999924302101,145.07008075714106,10.431429739590326,3,-1,-1,llm8_g3,0,
2026-03-03T03:57:50.895073+00:00,BUCKET,llm_style,tune,llm_style_tune_023,8,4096,1024,bf16,NVIDIA GeForce RTX 4060,c00,32,32,32,2,2,8,0.0,0.0,61.455998569726944,167.4649643898009,1.0919823216908502,7,-1,-1,llm8_g7,0,
2026-03-03T03:57:50.984273+00:00,BUCKET,llm_style,tune,llm_style_tune_024,8,4096,4096,bf16,NVIDIA GeForce RTX 4060,c00,32,32,32,2,2,8,0.0,0.0,168.96000504493713,301.39840066432936,1.5887514677133565,7,-1,-1,llm8_g7,0,
2026-03-03T03:57:51.009343+00:00,BUCKET,llm_style,tune,llm_style_tune_025,32,6144,1024,bf16,NVIDIA GeForce RTX 4060,c10,64,128,64,8,3,8,0.0,0.0,53.247999399900436,115.92960089445107,7.561846239067394,1,-1,-1,llm8_g1,0,
2026-03-03T03:57:51.027651+00:00,BUCKET,llm_style,tune,llm_style_tune_026,1,3072,1536,bf16,NVIDIA GeForce RTX 4060,c00,32,32,32,2,2,8,0.0,0.0,39.824001491069794,54.353919774293885,0.2369722691507083,7,-1,-1,llm8_g7,0,
2026-03-03T03:57:51.064308+00:00,BUCKET,llm_style,tune,llm_style_tune_027,1,6144,1536,bf16,NVIDIA GeForce RTX 4060,c10,64,128,64,8,3,8,0.0,0.0,65.5359998345375,162.07872256636614,0.28800000072713006,5,-1,-1,llm8_g5,0,
2026-03-03T03:57:51.098330+00:00,BUCKET,llm_style,tune,llm_style_tune_028,4,4096,1536,bf16,NVIDIA GeForce RTX 4060,c00,32,32,32,2,2,8,0.0,0.0,24.57600086927414,114.93312492966635,2.047999927560491,7,-1,-1,llm8_g7,0,
2026-03-03T03:57:51.124494+00:00,BUCKET,llm_style,tune,llm_style_tune_029,16,1024,6144,bf16,NVIDIA GeForce RTX 4060,c00,32,32,32,2,2,8,0.0,0.0,75.77600330114365,96.4607990533113,2.656864749119877,7,-1,-1,llm8_g7,0,
2026-03-03T03:57:51.295084+00:00,BUCKET,llm_style,tune,llm_style_tune_030,64,4096,8192,bf16,NVIDIA GeForce RTX 4060,c06,64,128,32,4,3,8,0.0,0.0,317.328006029129,333.86495381593704,13.534788024999422,2,-1,-1,llm8_g2,0,
2026-03-03T03:57:51.321118+00:00,BUCKET,llm_style,tune,llm_style_tune_031,1,6144,1024,bf16,NVIDIA GeForce RTX 4060,c10,64,128,64,8,3,8,0.0,0.0,54.655998945236206,159.45727787911878,0.23022014495806267,5,-1,-1,llm8_g5,0,
2026-03-03T03:57:51.341075+00:00,BUCKET,llm_style,tune,llm_style_tune_032,64,1024,4096,bf16,NVIDIA GeForce RTX 4060,c04,64,64,64,4,3,8,0.0,0.0,71.24800235033035,177.85855680704114,7.535241610847923,3,-1,-1,llm8_g3,0,
2026-03-03T03:57:51.505255+00:00,BUCKET,llm_style,tune,llm_style_tune_033,2,4096,8192,bf16,NVIDIA GeForce RTX 4060,c04,64,64,64,4,3,8,0.0,0.0,297.9840040206909,395.5609560012816,0.45041923790875843,6,-1,-1,llm8_g6,0,
2026-03-03T03:57:51.745962+00:00,BUCKET,llm_style,tune,llm_style_tune_034,1,8192,6144,bf16,NVIDIA GeForce RTX 4060,c10,64,128,64,8,3,8,0.0,0.0,450.23998618125916,570.5280059576035,0.223576979143462,5,-1,-1,llm8_g5,0,
2026-03-03T03:57:51.758413+00:00,BUCKET,llm_style,tune,llm_style_tune_035,64,1536,1024,bf16,NVIDIA GeForce RTX 4060,c04,64,64,64,4,3,8,0.0,0.0,37.88800165057182,104.99071829020977,5.313729498239754,3,-1,-1,llm8_g3,0,
2026-03-03T03:57:51.788076+00:00,BUCKET,llm_style,tune,llm_style_tune_036,32,3072,2048,bf16,NVIDIA GeForce RTX 4060,c04,64,64,64,4,3,8,0.0,0.0,74.04800131917,217.337929755449,5.437731968813568,3,-1,-1,llm8_g3,0,
2026-03-03T03:57:51.829072+00:00,BUCKET,llm_style,tune,llm_style_tune_037,4,1536,6144,bf16,NVIDIA GeForce RTX 4060,c00,32,32,32,2,2,8,0.0,0.0,78.84799689054489,142.65440210700035,0.9575065312667864,7,-1,-1,llm8_g7,0,
2026-03-03T03:57:51.860158+00:00,BUCKET,llm_style,tune,llm_style_tune_038,1,4096,1536,bf16,NVIDIA GeForce RTX 4060,c00,32,32,32,2,2,8,0.0,0.0,49.15200173854828,59.219520166516304,0.2559999909450614,7,-1,-1,llm8_g7,0,
2026-03-03T03:57:51.887605+00:00,BUCKET,llm_style,tune,llm_style_tune_039,4,1536,4096,bf16,NVIDIA GeForce RTX 4060,c00,32,32,32,2,2,8,0.0,0.0,87.0399996638298,167.32799991965294,0.5782588257627916,7,-1,-1,llm8_g7,0,
2026-03-03T03:57:52.461307+00:00,BUCKET,llm_style,tune,llm_style_tune_040,2,6144,8192,bf16,NVIDIA GeForce RTX 4060,c11,32,128,32,4,2,8,0.0,573.65,425.9679913520813,447.83072113990784,0.4726331463567522,4,-1,-1,llm8_g4,0,
2026-03-03T03:57:52.480165+00:00,BUCKET,llm_style,tune,llm_style_tune_041,16,1024,1536,bf16,NVIDIA GeForce RTX 4060,c00,32,32,32,2,2,8,0.0,0.0,52.73599922657013,491.2640120089044,0.9544077809877026,7,-1,-1,llm8_g7,0,
2026-03-03T03:57:52.506843+00:00,BUCKET,llm_style,tune,llm_style_tune_042,32,3072,2048,bf16,NVIDIA GeForce RTX 4060,c04,64,64,64,4,3,8,0.0,0.0,61.43999844789505,141.8956796824932,6.553600165557866,3,-1,-1,llm8_g3,0,
2026-03-03T03:57:52.542757+00:00,BUCKET,llm_style,tune,llm_style_tune_043,2,2048,4096,bf16,NVIDIA GeForce RTX 4060,c00,32,32,32,2,2,8,0.0,0.0,69.63200122117996,113.93472425639624,0.4818823444901042,7,-1,-1,llm8_g7,0,
2026-03-03T03:57:52.642841+00:00,BUCKET,llm_style,tune,llm_style_tune_044,64,2048,8192,bf16,NVIDIA GeForce RTX 4060,c06,64,128,32,4,3,8,0.0,0.0,197.55200296640396,216.55392542481422,10.870472664178479,2,-1,-1,llm8_g2,0,
2026-03-03T03:57:52.768032+00:00,BUCKET,llm_style,tune,llm_style_tune_045,2,3072,8192,bf16,NVIDIA GeForce RTX 4060,c04,64,64,64,4,3,8,0.0,0.0,238.5919988155365,261.56096190214157,0.42190558149364504,6,-1,-1,llm8_g6,0,
2026-03-03T03:57:53.035169+00:00,BUCKET,llm_style,tune,llm_style_tune_046,4,8192,6144,bf16,NVIDIA GeForce RTX 4060,c10,64,128,64,8,3,8,0.0,0.0,428.46401035785675,472.6681524515152,0.9397596397039291,5,-1,-1,llm8_g5,0,
2026-03-03T03:57:53.070863+00:00,BUCKET,llm_style,tune,llm_style_tune_047,1,1024,6144,bf16,NVIDIA GeForce RTX 4060,c00,32,32,32,2,2,8,0.0,0.0,82.2720006108284,232.20224380493147,0.15294282266844345,7,-1,-1,llm8_g7,0,
2026-03-03T03:57:53.139697+00:00,BUCKET,llm_style,tune,llm_style_tune_048,32,4096,3072,bf16,NVIDIA GeForce RTX 4060,c04,64,64,64,4,3,8,0.0,0.0,90.11200070381165,151.8563175201416,8.936727202927772,3,-1,-1,llm8_g3,0,
2026-03-03T03:57:53.154334+00:00,BUCKET,llm_style,tune,llm_style_tune_049,16,2048,1024,bf16,NVIDIA GeForce RTX 4060,c00,32,32,32,2,2,8,0.0,0.0,38.28799910843372,45.003839507699,1.7527388623767985,7,-1,-1,llm8_g7,0,
2026-03-03T03:57:53.165085+00:00,BUCKET,llm_style,tune,llm_style_tune_050,4,1024,1536,bf16,NVIDIA GeForce RTX 4060,c00,32,32,32,2,2,8,0.0,0.0,47.10400104522705,151.63071915507317,0.26713042885504523,7,-1,-1,llm8_g7,0,
2026-03-03T03:57:53.329722+00:00,BUCKET,llm_style,tune,llm_style_tune_051,64,4096,8192,bf16,NVIDIA GeForce RTX 4060,c06,64,128,32,4,3,8,0.0,0.0,304.1279911994934,323.1459313631058,14.122236098888731,2,-1,-1,llm8_g2,0,
2026-03-03T03:57:53.345898+00:00,BUCKET,llm_style,tune,llm_style_tune_052,16,2048,1536,bf16,NVIDIA GeForce RTX 4060,c00,32,32,32,2,2,8,0.0,0.0,41.98399931192398,72.72448226809502,2.397658575880606,7,-1,-1,llm8_g7,0,
2026-03-03T03:57:53.355236+00:00,BUCKET,llm_style,tune,llm_style_tune_053,64,1024,1024,bf16,NVIDIA GeForce RTX 4060,c04,64,64,64,4,3,8,0.0,0.0,39.93599861860275,127.51872211694717,3.360820629072225,3,-1,-1,llm8_g3,0,
2026-03-03T03:57:53.520848+00:00,BUCKET,llm_style,tune,llm_style_tune_054,4,4096,8192,bf16,NVIDIA GeForce RTX 4060,c04,64,64,64,4,3,8,0.0,0.0,323.5839903354645,364.00959223508835,0.8295696450300549,6,-1,-1,llm8_g6,0,
2026-03-03T03:57:53.582491+00:00,BUCKET,llm_style,tune,llm_style_tune_055,1,4096,3072,bf16,NVIDIA GeForce RTX 4060,c00,32,32,32,2,2,8,0.0,0.0,53.13600040972233,121.53856009244916,0.47361155913035924,7,-1,-1,llm8_g7,0,
2026-03-03T03:57:53.598819+00:00,BUCKET,llm_style,tune,llm_style_tune_056,64,1536,2048,bf16,NVIDIA GeForce RTX 4060,c04,64,64,64,4,3,8,0.0,0.0,65.5359998345375,115.37023752927774,6.144000015512108,3,-1,-1,llm8_g3,0,
2026-03-03T03:57:53.630197+00:00,BUCKET,llm_style,tune,llm_style_tune_057,2,4096,2048,bf16,NVIDIA GeForce RTX 4060,c00,32,32,32,2,2,8,0.0,0.0,49.15200173854828,67.17664185911414,0.6826666425201637,7,-1,-1,llm8_g7,0,
2026-03-03T03:57:53.695539+00:00,BUCKET,llm_style,tune,llm_style_tune_058,4,8192,1536,bf16,NVIDIA GeForce RTX 4060,c10,64,128,64,8,3,8,0.0,0.0,91.13600105047226,195.4352062940597,1.1045393131113073,5,-1,-1,llm8_g5,0,
2026-03-03T03:57:53.722694+00:00,BUCKET,llm_style,tune,llm_style_tune_059,1,1536,4096,bf16,NVIDIA GeForce RTX 4060,c00,32,32,32,2,2,8,0.0,0.0,61.27999909222126,196.06528267264346,0.20533472889031498,7,-1,-1,llm8_g7,0,
2026-03-03T03:57:53.749374+00:00,BUCKET,llm_style,tune,llm_style_tune_060,64,1536,4096,bf16,NVIDIA GeForce RTX 4060,c04,64,64,64,4,3,8,0.0,0.0,67.52000004053116,77.15519860386848,11.926930798527662,3,-1,-1,llm8_g3,0,
2026-03-03T03:57:53.999093+00:00,BUCKET,llm_style,tune,llm_style_tune_061,8,8192,6144,bf16,NVIDIA GeForce RTX 4060,c10,64,128,64,8,3,8,0.0,0.0,452.5439888238907,527.3520106077194,1.779509589980187,5,-1,-1,llm8_g5,0,
2026-03-03T03:57:54.040580+00:00,BUCKET,llm_style,tune,llm_style_tune_062,64,6144,1536,bf16,NVIDIA GeForce RTX 4060,c10,64,128,64,8,3,8,0.0,0.0,91.13600105047226,174.59615901112556,13.254471757335688,1,-1,-1,llm8_g1,0,
2026-03-03T03:57:54.053979+00:00,BUCKET,llm_style,tune,llm_style_tune_063,2,1536,1024,bf16,NVIDIA GeForce RTX 4060,c00,32,32,32,2,2,8,0.0,0.0,59.39200147986412,101.75647944211948,0.10593103184328642,7,-1,-1,llm8_g7,0,
2026-03-03T03:57:54.063203+00:00,BUCKET,llm_style,eval,llm_style_eval_000,32,1536,1024,bf16,NVIDIA GeForce RTX 4060,c04,64,64,64,4,3,8,0.0,0.0,29.536000452935696,106.96031838655472,3.408155960736881,3,-1,-1,llm8_g3,0,
2026-03-03T03:57:54.158485+00:00,BUCKET,llm_style,eval,llm_style_eval_001,32,2048,8192,bf16,NVIDIA GeForce RTX 4060,c06,64,128,32,4,3,8,0.0,0.0,194.5600062608719,325.47710955142975,5.5188208750378775,2,-1,-1,llm8_g2,0,
2026-03-03T03:57:54.203863+00:00,BUCKET,llm_style,eval,llm_style_eval_002,16,2048,4096,bf16,NVIDIA GeForce RTX 4060,c00,32,32,32,2,2,8,0.0,0.0,83.96799862384796,197.89119899272913,3.1968781011741414,7,-1,-1,llm8_g7,0,
2026-03-03T03:57:54.220720+00:00,BUCKET,llm_style,eval,llm_style_eval_003,16,2048,1536,bf16,NVIDIA GeForce RTX 4060,c00,32,32,32,2,2,8,0.0,0.0,64.39999863505363,141.84864297509193,1.5630946915146027,7,-1,-1,llm8_g7,0,
2026-03-03T03:57:54.312632+00:00,BUCKET,llm_style,eval,llm_style_eval_004,64,8192,2048,bf16,NVIDIA GeForce RTX 4060,c10,64,128,64,8,3,8,0.0,0.0,152.5759994983673,290.249280333519,14.074845683858555,1,-1,-1,llm8_g1,0,
2026-03-03T03:57:54.440536+00:00,BUCKET,llm_style,eval,llm_style_eval_005,64,3072,8192,bf16,NVIDIA GeForce RTX 4060,c06,64,128,32,4,3,8,0.0,0.0,259.96801257133484,374.45632010698307,12.390853167429977,2,-1,-1,llm8_g2,0,
2026-03-03T03:57:54.464707+00:00,BUCKET,llm_style,eval,llm_style_eval_006,32,2048,2048,bf16,NVIDIA GeForce RTX 4060,c04,64,64,64,4,3,8,0.0,0.0,97.23200276494026,189.5628771185875,2.7607726712052463,3,-1,-1,llm8_g3,0,
2026-03-03T03:57:54.557286+00:00,BUCKET,llm_style,eval,llm_style_eval_007,8,8192,2048,bf16,NVIDIA GeForce RTX 4060,c10,64,128,64,8,3,8,0.0,0.0,206.84799551963806,223.2524736225605,1.2977426023667453,5,-1,-1,llm8_g5,0,
2026-03-03T03:57:54.629256+00:00,BUCKET,llm_style,eval,llm_style_eval_008,64,1536,8192,bf16,NVIDIA GeForce RTX 4060,c06,64,128,32,4,3,8,0.0,0.0,235.4400008916855,283.2998387515544,6.840862767159794,2,-1,-1,llm8_g2,0,
2026-03-03T03:57:54.755906+00:00,BUCKET,llm_style,eval,llm_style_eval_009,64,4096,6144,bf16,NVIDIA GeForce RTX 4060,c04,64,64,64,4,3,8,0.0,0.0,256.848007440567,398.27712327241886,12.541368352819989,3,-1,-1,llm8_g3,0,
2026-03-03T03:57:54.807290+00:00,BUCKET,llm_style,eval,llm_style_eval_010,64,2048,4096,bf16,NVIDIA GeForce RTX 4060,c04,64,64,64,4,3,8,0.0,0.0,132.09599256515503,217.27231889963144,8.128496581532461,3,-1,-1,llm8_g3,0,
2026-03-03T03:57:54.903282+00:00,BUCKET,llm_style,eval,llm_style_eval_011,32,3072,6144,bf16,NVIDIA GeForce RTX 4060,c04,64,64,64,4,3,8,0.0,0.0,189.43999707698822,270.0396844744682,6.376475774063102,3,-1,-1,llm8_g3,0,
2026-03-03T03:57:54.920937+00:00,BUCKET,llm_style,eval,llm_style_eval_012,16,1536,1536,bf16,NVIDIA GeForce RTX 4060,c00,32,32,32,2,2,8,0.0,0.0,65.0239996612072,814.1107195615746,1.1610708721912288,7,-1,-1,llm8_g7,0,
2026-03-03T03:57:54.951902+00:00,BUCKET,llm_style,eval,llm_style_eval_013,64,2048,3072,bf16,NVIDIA GeForce RTX 4060,c04,64,64,64,4,3,8,0.0,0.0,108.5439994931221,158.52543771266932,7.419169845966734,3,-1,-1,llm8_g3,0,
2026-03-03T03:57:55.220605+00:00,BUCKET,llm_style,eval,llm_style_eval_014,16,8192,6144,bf16,NVIDIA GeForce RTX 4060,c10,64,128,64,8,3,8,0.0,0.0,720.8960056304932,762.3987132310867,2.234181800731943,5,-1,-1,llm8_g5,0,
2026-03-03T03:57:55.265962+00:00,BUCKET,llm_style,eval,llm_style_eval_015,64,6144,1536,bf16,NVIDIA GeForce RTX 4060,c10,64,128,64,8,3,8,0.0,0.0,135.67999750375748,249.77407470345477,8.903003937382497,1,-1,-1,llm8_g1,0,
2026-03-03T03:57:55.358723+00:00,BUCKET,llm_style,eval,llm_style_eval_016,16,4096,4096,bf16,NVIDIA GeForce RTX 4060,c00,32,32,32,2,2,8,0.0,0.0,254.92800772190094,292.9891249537468,2.1059706887352623,7,-1,-1,llm8_g7,0,
2026-03-03T03:57:55.535573+00:00,BUCKET,llm_style,eval,llm_style_eval_017,64,8192,4096,bf16,NVIDIA GeForce RTX 4060,c10,64,128,64,8,3,8,0.0,0.0,495.0080066919327,634.0403187274933,8.676561263529146,1,-1,-1,llm8_g1,0,
2026-03-03T03:57:55.675020+00:00,BUCKET,llm_style,eval,llm_style_eval_018,32,4096,6144,bf16,NVIDIA GeForce RTX 4060,c04,64,64,64,4,3,8,0.0,0.0,399.3600010871887,430.18720775842667,4.03298460440551,3,-1,-1,llm8_g3,0,
2026-03-03T03:57:55.810789+00:00,BUCKET,llm_style,eval,llm_style_eval_019,16,3072,8192,bf16,NVIDIA GeForce RTX 4060,c04,64,64,64,4,3,8,0.0,0.0,375.8080005645752,428.0524757504463,2.1428664817944023,6,-1,-1,llm8_g6,0,
2026-03-03T03:57:55.827131+00:00,BUCKET,llm_style,eval,llm_style_eval_020,4,1536,1536,bf16,NVIDIA GeForce RTX 4060,c00,32,32,32,2,2,8,0.0,0.0,63.48799914121628,160.86784124374384,0.297290326602005,7,-1,-1,llm8_g7,0,
2026-03-03T03:57:55.878016+00:00,BUCKET,llm_style,eval,llm_style_eval_021,4,6144,1536,bf16,NVIDIA GeForce RTX 4060,c10,64,128,64,8,3,8,0.0,0.0,122.8799968957901,188.4160041809082,0.61440001552105,5,-1,-1,llm8_g5,0,
2026-03-03T03:57:55.908141+00:00,BUCKET,llm_style,eval,llm_style_eval_022,32,6144,1024,bf16,NVIDIA GeForce RTX 4060,c10,64,128,64,8,3,8,0.0,0.0,92.16000139713287,179.14879724383346,4.3690666004322205,1,-1,-1,llm8_g1,0,
2026-03-03T03:57:55.918810+00:00,BUCKET,llm_style,eval,llm_style_eval_023,16,1024,1536,bf16,NVIDIA GeForce RTX 4060,c00,32,32,32,2,2,8,0.0,0.0,57.24800005555153,88.89344014227385,0.8791861366538546,7,-1,-1,llm8_g7,0,
2026-03-03T03:57:55.961504+00:00,BUCKET,llm_style,eval,llm_style_eval_024,32,8192,1024,bf16,NVIDIA GeForce RTX 4060,c10,64,128,64,8,3,8,0.0,0.0,134.62399691343307,274.4463920593262,3.9879287817106093,1,-1,-1,llm8_g1,0,
2026-03-03T03:57:56.162324+00:00,BUCKET,llm_style,eval,llm_style_eval_025,32,6144,6144,bf16,NVIDIA GeForce RTX 4060,c10,64,128,64,8,3,8,0.0,0.0,539.0239953994751,631.1116844415665,4.482025150308091,1,-1,-1,llm8_g1,0,
2026-03-03T03:57:56.234007+00:00,BUCKET,llm_style,eval,llm_style_eval_026,1,6144,2048,bf16,NVIDIA GeForce RTX 4060,c10,64,128,64,8,3,8,0.0,0.0,167.28000342845917,305.30367136001587,0.15044131685926646,5,-1,-1,llm8_g5,0,
2026-03-03T03:57:56.310502+00:00,BUCKET,llm_style,eval,llm_style_eval_027,32,4096,3072,bf16,NVIDIA GeForce RTX 4060,c04,64,64,64,4,3,8,0.0,0.0,197.59999960660934,509.04064446687664,4.0754370931338,3,-1,-1,llm8_g3,0,
2026-03-03T03:57:56.325549+00:00,BUCKET,llm_style,eval,llm_style_eval_028,64,1536,1536,bf16,NVIDIA GeForce RTX 4060,c04,64,64,64,4,3,8,0.0,0.0,68.60800087451935,148.47999811172485,4.401671585684658,3,-1,-1,llm8_g3,0,
2026-03-03T03:57:56.343007+00:00,BUCKET,llm_style,eval,llm_style_eval_029,2,3072,1024,bf16,NVIDIA GeForce RTX 4060,c00,32,32,32,2,2,8,0.0,0.0,64.41600061953068,219.41695496439917,0.19533829916452328,7,-1,-1,llm8_g7,0,
2026-03-03T03:57:56.424997+00:00,BUCKET,llm_style,eval,llm_style_eval_030,32,1536,8192,bf16,NVIDIA GeForce RTX 4060,c06,64,128,32,4,3,8,0.0,0.0,338.72000873088837,354.86336410045624,2.3774986633275996,2,-1,-1,llm8_g2,0,
2026-03-03T03:57:56.451356+00:00,BUCKET,llm_style,eval,llm_style_eval_031,8,3072,2048,bf16,NVIDIA GeForce RTX 4060,c00,32,32,32,2,2,8,0.0,0.0,71.02400064468384,190.47039635479416,1.417313796551598,7,-1,-1,llm8_g7,0,
2026-03-03T03:57:56.478337+00:00,BUCKET,llm_style,eval,llm_style_eval_032,8,2048,3072,bf16,NVIDIA GeForce RTX 4060,c00,32,32,32,2,2,8,0.0,0.0,91.53600037097931,187.9833628237246,1.0997126331938183,7,-1,-1,llm8_g7,0,
2026-03-03T03:57:56.560035+00:00,BUCKET,llm_style,eval,llm_style_eval_033,64,1536,8192,bf16,NVIDIA GeForce RTX 4060,c06,64,128,32,4,3,8,0.0,0.0,332.8000009059906,449.0342319011688,4.839581525286612,2,-1,-1,llm8_g2,0,
2026-03-03T03:57:56.628588+00:00,BUCKET,llm_style,eval,llm_style_eval_034,64,6144,2048,bf16,NVIDIA GeForce RTX 4060,c10,64,128,64,8,3,8,0.0,0.0,186.36800348758698,272.58880287408823,8.642109728386261,1,-1,-1,llm8_g1,0,
2026-03-03T03:57:56.664900+00:00,BUCKET,llm_style,eval,llm_style_eval_035,4,4096,2048,bf16,NVIDIA GeForce RTX 4060,c00,32,32,32,2,2,8,0.0,0.0,96.25600278377533,192.66975402832028,0.6971914691985496,7,-1,-1,llm8_g7,0,
2026-03-03T03:57:56.846665+00:00,BUCKET,llm_style,eval,llm_style_eval_036,64,8192,4096,bf16,NVIDIA GeForce RTX 4060,c10,64,128,64,8,3,8,0.0,0.0,562.1439814567566,641.6998338699339,7.640333148937919,1,-1,-1,llm8_g1,0,
2026-03-03T03:57:56.884551+00:00,BUCKET,llm_style,eval,llm_style_eval_037,32,6144,1024,bf16,NVIDIA GeForce RTX 4060,c10,64,128,64,8,3,8,0.0,0.0,132.09599256515503,166.63552045822138,3.048186218074673,1,-1,-1,llm8_g1,0,
2026-03-03T03:57:56.953893+00:00,BUCKET,llm_style,eval,llm_style_eval_038,64,6144,2048,bf16,NVIDIA GeForce RTX 4060,c10,64,128,64,8,3,8,0.0,0.0,195.5839991569519,269.99424099922163,8.23489008785181,1,-1,-1,llm8_g1,0,
2026-03-03T03:57:56.973835+00:00,BUCKET,llm_style,eval,llm_style_eval_039,8,1024,3072,bf16,NVIDIA GeForce RTX 4060,c00,32,32,32,2,2,8,0.0,0.0,113.02400007843971,245.6643123924731,0.4453182329865282,7,-1,-1,llm8_g7,0,
2026-03-03T03:57:57.078560+00:00,BUCKET,llm_style,eval,llm_style_eval_040,32,8192,2048,bf16,NVIDIA GeForce RTX 4060,c10,64,128,64,8,3,8,0.0,0.0,318.4640109539032,404.08063143491745,3.3716268936756597,1,-1,-1,llm8_g1,0,
2026-03-03T03:57:57.099558+00:00,BUCKET,llm_style,eval,llm_style_eval_041,32,3072,1024,bf16,NVIDIA GeForce RTX 4060,c04,64,64,64,4,3,8,0.0,0.0,78.27199995517731,158.64831775426856,2.5721406392489046,3,-1,-1,llm8_g3,0,
2026-03-03T03:57:57.126128+00:00,BUCKET,llm_style,eval,llm_style_eval_042,64,1024,4096,bf16,NVIDIA GeForce RTX 4060,c04,64,64,64,4,3,8,0.0,0.0,123.90399724245071,274.65728342533106,4.332958774118247,3,-1,-1,llm8_g3,0,
2026-03-03T03:57:57.137897+00:00,BUCKET,llm_style,eval,llm_style_eval_043,2,1536,1024,bf16,NVIDIA GeForce RTX 4060,c00,32,32,32,2,2,8,0.0,0.0,66.3679987192154,125.65503768622871,0.09479653027684934,7,-1,-1,llm8_g7,0,
2026-03-03T03:57:57.238822+00:00,BUCKET,llm_style,eval,llm_style_eval_044,64,6144,3072,bf16,NVIDIA GeForce RTX 4060,c10,64,128,64,8,3,8,0.0,0.0,296.4159995317459,421.88799381256104,8.150434213458363,1,-1,-1,llm8_g1,0,
2026-03-03T03:57:57.288306+00:00,BUCKET,llm_style,eval,llm_style_eval_045,64,1536,6144,bf16,NVIDIA GeForce RTX 4060,c04,64,64,64,4,3,8,0.0,0.0,177.59999632835388,233.84703263640384,6.801574194667643,3,-1,-1,llm8_g3,0,
2026-03-03T03:57:57.390135+00:00,BUCKET,llm_style,eval,llm_style_eval_046,2,6144,3072,bf16,NVIDIA GeForce RTX 4060,c10,64,128,64,8,3,8,0.0,0.0,302.0800054073334,426.6700792312622,0.2499254192550647,5,-1,-1,llm8_g5,0,
2026-03-03T03:57:57.575463+00:00,BUCKET,llm_style,eval,llm_style_eval_047,16,4096,8192,bf16,NVIDIA GeForce RTX 4060,c04,64,64,64,4,3,8,0.0,0.0,630.7680010795593,738.3945518732071,1.7022769420171775,6,-1,-1,llm8_g6,0,
2026-03-03T03:57:57.618008+00:00,BUCKET,llm_style,eval,llm_style_eval_048,16,1024,6144,bf16,NVIDIA GeForce RTX 4060,c00,32,32,32,2,2,8,0.0,0.0,191.8879970908165,253.78751233220095,1.0491880422552768,7,-1,-1,llm8_g7,0,
2026-03-03T03:57:57.689525+00:00,BUCKET,llm_style,eval,llm_style_eval_049,16,8192,1536,bf16,NVIDIA GeForce RTX 4060,c10,64,128,64,8,3,8,0.0,0.0,247.80799448490143,325.21216213703156,1.6248595402943429,5,-1,-1,llm8_g5,0,
2026-03-03T03:57:57.698745+00:00,BUCKET,llm_style,eval,llm_style_eval_050,1,1024,1024,bf16,NVIDIA GeForce RTX 4060,c00,32,32,32,2,2,8,0.0,0.0,57.34400078654289,112.32255697250363,0.03657142806980683,7,-1,-1,llm8_g7,0,
2026-03-03T03:57:57.726909+00:00,BUCKET,llm_style,eval,llm_style_eval_051,16,6144,1024,bf16,NVIDIA GeForce RTX 4060,c10,64,128,64,8,3,8,0.0,0.0,123.90399724245071,157.70623728632916,1.6248595402943429,5,-1,-1,llm8_g5,0,
2026-03-03T03:57:58.090226+00:00,BUCKET,llm_style,eval,llm_style_eval_052,16,8192,8192,bf16,NVIDIA GeForce RTX 4060,c11,32,128,32,4,2,8,0.0,0.0,924.0959882736206,1067.92285323143,2.323875090088736,4,-1,-1,llm8_g4,0,
2026-03-03T03:57:58.363375+00:00,BUCKET,llm_style,eval,llm_style_eval_053,1,6144,8192,bf16,NVIDIA GeForce RTX 4060,c11,32,128,32,4,2,8,0.0,0.0,696.3039934635162,767.8566384315488,0.1445680291151086,4,-1,-1,llm8_g4,0,
2026-03-03T03:57:58.441559+00:00,BUCKET,llm_style,eval,llm_style_eval_054,64,4096,3072,bf16,NVIDIA GeForce RTX 4060,c04,64,64,64,4,3,8,0.0,0.0,302.0800054073334,351.13633334636677,5.33174227744138,3,-1,-1,llm8_g3,0,
2026-03-03T03:57:58.483483+00:00,BUCKET,llm_style,eval,llm_style_eval_055,4,8192,1024,bf16,NVIDIA GeForce RTX 4060,c10,64,128,64,8,3,8,0.0,0.0,206.25600218772888,214.44416105747223,0.3253668416345976,5,-1,-1,llm8_g5,0,
2026-03-03T03:57:58.508046+00:00,BUCKET,llm_style,eval,llm_style_eval_056,64,1024,3072,bf16,NVIDIA GeForce RTX 4060,c04,64,64,64,4,3,8,0.0,0.0,129.02399897575378,137.2364743053913,3.1207619295358113,3,-1,-1,llm8_g3,0,
2026-03-03T03:57:58.519140+00:00,BUCKET,llm_style,eval,llm_style_eval_057,64,1024,3072,bf16,NVIDIA GeForce RTX 4060,c04,64,64,64,4,3,8,0.0,0.0,121.19999900460243,258.13630968332285,3.322221017383917,3,-1,-1,llm8_g3,0,
2026-03-03T03:57:58.577895+00:00,BUCKET,llm_style,eval,llm_style_eval_058,32,2048,4096,bf16,NVIDIA GeForce RTX 4060,c04,64,64,64,4,3,8,0.0,0.0,260.09601354599,268.65151673555374,2.0641258767507824,3,-1,-1,llm8_g3,0,
2026-03-03T03:57:58.673647+00:00,BUCKET,llm_style,eval,llm_style_eval_059,64,8192,2048,bf16,NVIDIA GeForce RTX 4060,c10,64,128,64,8,3,8,0.0,0.0,363.42398822307587,376.4831966161728,5.90903109753404,1,-1,-1,llm8_g1,0,
2026-03-03T03:57:58.773485+00:00,BUCKET,llm_style,eval,llm_style_eval_060,1,3072,6144,bf16,NVIDIA GeForce RTX 4060,c00,32,32,32,2,2,8,0.0,0.0,302.0800054073334,399.870083928108,0.12496270962753235,7,-1,-1,llm8_g7,0,
2026-03-03T03:57:58.810960+00:00,BUCKET,llm_style,eval,llm_style_eval_061,64,1536,4096,bf16,NVIDIA GeForce RTX 4060,c04,64,64,64,4,3,8,0.0,0.0,162.81600296497345,286.75072371959675,4.946113117475591,3,-1,-1,llm8_g3,0,
2026-03-03T03:57:58.882706+00:00,BUCKET,llm_style,eval,llm_style_eval_062,16,6144,2048,bf16,NVIDIA GeForce RTX 4060,c10,64,128,64,8,3,8,0.0,0.0,252.9279887676239,343.3881643414497,1.591967682034333,5,-1,-1,llm8_g5,0,
2026-03-03T03:57:58.931982+00:00,BUCKET,llm_style,eval,llm_style_eval_063,64,1536,6144,bf16,NVIDIA GeForce RTX 4060,c04,64,64,64,4,3,8,0.0,0.0,223.66400063037872,357.3481720685959,5.400777722813974,3,-1,-1,llm8_g3,0,
2026-03-03T03:57:59.009217+00:00,BUCKET,llm_style,eval,llm_style_eval_064,1,6144,2048,bf16,NVIDIA GeForce RTX 4060,c10,64,128,64,8,3,8,0.0,0.0,253.9519965648651,268.28672111034393,0.09909677553400166,5,-1,-1,llm8_g5,0,
2026-03-03T03:57:59.076095+00:00,BUCKET,llm_style,eval,llm_style_eval_065,8,1536,6144,bf16,NVIDIA GeForce RTX 4060,c00,32,32,32,2,2,8,0.0,0.0,236.89600080251694,304.9433654546736,0.6373891643948585,7,-1,-1,llm8_g7,0,
2026-03-03T03:57:59.109971+00:00,BUCKET,llm_style,eval,llm_style_eval_066,64,1536,4096,bf16,NVIDIA GeForce RTX 4060,c04,64,64,64,4,3,8,0.0,0.0,159.5359966158867,277.59072810411453,5.047803537021983,3,-1,-1,llm8_g3,0,
2026-03-03T03:57:59.216389+00:00,BUCKET,llm_style,eval,llm_style_eval_067,64,8192,2048,bf16,NVIDIA GeForce RTX 4060,c10,64,128,64,8,3,8,0.0,0.0,367.6159977912903,462.0947265624999,5.841649060167422,1,-1,-1,llm8_g1,0,
2026-03-03T03:57:59.245810+00:00,BUCKET,llm_style,eval,llm_style_eval_068,64,1024,4096,bf16,NVIDIA GeForce RTX 4060,c04,64,64,64,4,3,8,0.0,0.0,156.67200088500977,219.07455936074237,3.4267189348914946,3,-1,-1,llm8_g3,0,
2026-03-03T03:57:59.296110+00:00,BUCKET,llm_style,eval,llm_style_eval_069,64,2048,4096,bf16,NVIDIA GeForce RTX 4060,c04,64,64,64,4,3,8,0.0,0.0,284.67199206352234,306.2579268217087,3.771856220264911,3,-1,-1,llm8_g3,0,
2026-03-03T03:57:59.351150+00:00,BUCKET,llm_style,eval,llm_style_eval_070,64,8192,1024,bf16,NVIDIA GeForce RTX 4060,c10,64,128,64,8,3,8,0.0,0.0,202.7519941329956,318.33856999874115,5.295838537083275,1,-1,-1,llm8_g1,0,
2026-03-03T03:57:59.424445+00:00,BUCKET,llm_style,eval,llm_style_eval_071,64,6144,2048,bf16,NVIDIA GeForce RTX 4060,c10,64,128,64,8,3,8,0.0,0.0,257.4719935655594,411.39903992414446,6.2554871063671404,1,-1,-1,llm8_g1,0,
2026-03-03T03:57:59.436046+00:00,BUCKET,llm_style,eval,llm_style_eval_072,64,1536,1024,bf16,NVIDIA GeForce RTX 4060,c04,64,64,64,4,3,8,0.0,0.0,67.07200035452843,149.5340782403946,3.00164883909575,3,-1,-1,llm8_g3,0,
2026-03-03T03:57:59.463216+00:00,BUCKET,llm_style,eval,llm_style_eval_073,1,4096,1536,bf16,NVIDIA GeForce RTX 4060,c00,32,32,32,2,2,8,0.0,0.0,115.13600125908852,206.3510426878929,0.10928738068369159,7,-1,-1,llm8_g7,0,
2026-03-03T03:57:59.478485+00:00,BUCKET,llm_style,eval,llm_style_eval_074,8,1024,2048,bf16,NVIDIA GeForce RTX 4060,c00,32,32,32,2,2,8,0.0,0.0,114.68800157308578,179.60800051689148,0.29257142455845464,7,-1,-1,llm8_g7,0,
2026-03-03T03:57:59.511885+00:00,BUCKET,llm_style,eval,llm_style_eval_075,2,6144,1024,bf16,NVIDIA GeForce RTX 4060,c10,64,128,64,8,3,8,0.0,0.0,126.848004758358,176.64000004529942,0.19839353443469773,5,-1,-1,llm8_g5,0,
2026-03-03T03:57:59.547887+00:00,BUCKET,llm_style,eval,llm_style_eval_076,64,1024,6144,bf16,NVIDIA GeForce RTX 4060,c04,64,64,64,4,3,8,0.0,0.0,218.11199933290482,279.69151735305786,3.692169025377,3,-1,-1,llm8_g3,0,
2026-03-03T03:57:59.745819+00:00,BUCKET,llm_style,eval,llm_style_eval_077,1,4096,8192,bf16,NVIDIA GeForce RTX 4060,c04,64,64,64,4,3,8,0.0,0.0,674.3040084838867,830.714561343193,0.09952315744183159,6,-1,-1,llm8_g6,0,
2026-03-03T03:57:59.857844+00:00,BUCKET,llm_style,eval,llm_style_eval_078,64,6144,3072,bf16,NVIDIA GeForce RTX 4060,c10,64,128,64,8,3,8,0.0,0.0,393.21601390838623,445.2454304695129,6.1439997826814725,1,-1,-1,llm8_g1,0,
2026-03-03T03:57:59.928259+00:00,BUCKET,llm_style,eval,llm_style_eval_079,2,3072,4096,bf16,NVIDIA GeForce RTX 4060,c00,32,32,32,2,2,8,0.0,0.0,184.32000279426575,322.78944849967957,0.2730666625270138,7,-1,-1,llm8_g7,0,
2026-03-03T03:57:59.943364+00:00,BUCKET,llm_style,eval,llm_style_eval_080,4,1536,1024,bf16,NVIDIA GeForce RTX 4060,c00,32,32,32,2,2,8,0.0,0.0,71.1360014975071,272.4556784331795,0.1768852864247783,7,-1,-1,llm8_g7,0,
2026-03-03T03:58:00.080860+00:00,BUCKET,llm_style,eval,llm_style_eval_081,4,4096,6144,bf16,NVIDIA GeForce RTX 4060,c00,32,32,32,2,2,8,0.0,0.0,373.76001477241516,394.85855907201767,0.5386520335049457,7,-1,-1,llm8_g7,0,
2026-03-03T03:58:00.111971+00:00,BUCKET,llm_style,eval,llm_style_eval_082,64,6144,1024,bf16,NVIDIA GeForce RTX 4060,c10,64,128,64,8,3,8,0.0,0.0,151.5520066022873,256.86721101403214,5.313729498239754,1,-1,-1,llm8_g1,0,
2026-03-03T03:58:00.203369+00:00,BUCKET,llm_style,eval,llm_style_eval_083,8,4096,4096,bf16,NVIDIA GeForce RTX 4060,c00,32,32,32,2,2,8,0.0,0.0,264.19198513031006,385.47296315431595,1.0160620726915577,7,-1,-1,llm8_g7,0,
2026-03-03T03:58:00.271225+00:00,BUCKET,llm_style,eval,llm_style_eval_084,64,1024,8192,bf16,NVIDIA GeForce RTX 4060,c06,64,128,32,4,3,8,0.0,0.0,478.59199345111847,566.5664154291151,2.2435432240670528,2,-1,-1,llm8_g2,0,
2026-03-03T03:58:00.435714+00:00,BUCKET,llm_style,eval,llm_style_eval_085,1,3072,8192,bf16,NVIDIA GeForce RTX 4060,c04,64,64,64,4,3,8,0.0,0.0,674.3040084838867,2576.261115074156,0.07464236808137369,6,-1,-1,llm8_g6,0,
2026-03-03T03:58:00.449906+00:00,BUCKET,llm_style,eval,llm_style_eval_086,8,1536,1024,bf16,NVIDIA GeForce RTX 4060,c00,32,32,32,2,2,8,0.0,0.0,74.75200295448303,132.59392336010933,0.33665752094059115,7,-1,-1,llm8_g7,0,
2026-03-03T03:58:00.471459+00:00,BUCKET,llm_style,eval,llm_style_eval_087,16,1024,3072,bf16,NVIDIA GeForce RTX 4060,c00,32,32,32,2,2,8,0.0,0.0,152.5759994983673,174.8479957878589,0.6597583914308698,7,-1,-1,llm8_g7,0,
2026-03-03T03:58:00.503912+00:00,BUCKET,llm_style,eval,llm_style_eval_088,8,4096,1536,bf16,NVIDIA GeForce RTX 4060,c00,32,32,32,2,2,8,0.0,0.0,129.02399897575378,180.81792145967472,0.7801904823839528,7,-1,-1,llm8_g7,0,
2026-03-03T03:58:00.616156+00:00,BUCKET,llm_style,eval,llm_style_eval_089,16,6144,3072,bf16,NVIDIA GeForce RTX 4060,c10,64,128,64,8,3,8,0.0,0.0,498.6880123615265,565.8521467447281,1.2111375469802586,5,-1,-1,llm8_g5,0,
2026-03-03T03:58:00.653493+00:00,BUCKET,llm_style,eval,llm_style_eval_090,32,1536,3072,bf16,NVIDIA GeForce RTX 4060,c04,64,64,64,4,3,8,0.0,0.0,168.96000504493713,292.4240016937256,1.787345401177526,3,-1,-1,llm8_g3,0,
2026-03-03T03:58:00.685390+00:00,BUCKET,llm_style,eval,llm_style_eval_091,16,1024,4096,bf16,NVIDIA GeForce RTX 4060,c00,32,32,32,2,2,8,0.0,0.0,201.664000749588,306.592002213001,0.6655512510964315,7,-1,-1,llm8_g7,0,
2026-03-03T03:58:00.828567+00:00,BUCKET,llm_style,eval,llm_style_eval_092,1,4096,6144,bf16,NVIDIA GeForce RTX 4060,c00,32,32,32,2,2,8,0.0,0.0,414.71999883651733,498.47295314073557,0.12136296330344258,7,-1,-1,llm8_g7,0,
2026-03-03T03:58:00.870577+00:00,BUCKET,llm_style,eval,llm_style_eval_093,32,2048,3072,bf16,NVIDIA GeForce RTX 4060,c04,64,64,64,4,3,8,0.0,0.0,304.1279911994934,372.6335990428923,1.3239596342708184,3,-1,-1,llm8_g3,0,
2026-03-03T03:58:00.889685+00:00,BUCKET,llm_style,eval,llm_style_eval_094,32,1024,2048,bf16,NVIDIA GeForce RTX 4060,c04,64,64,64,4,3,8,0.0,0.0,148.3839973807335,196.4953631162643,0.9045296687594637,3,-1,-1,llm8_g3,0,
2026-03-03T03:58:00.967641+00:00,BUCKET,llm_style,eval,llm_style_eval_095,8,6144,2048,bf16,NVIDIA GeForce RTX 4060,c10,64,128,64,8,3,8,0.0,0.0,365.56801199913025,447.94080942869164,0.5507226709991218,5,-1,-1,llm8_g5,0,
2026-03-03T03:58:01.009104+00:00,BUCKET,llm_style,eval,llm_style_eval_096,64,2048,3072,bf16,NVIDIA GeForce RTX 4060,c04,64,64,64,4,3,8,0.0,0.0,291.83998703956604,361.62559181451786,2.75941064885951,3,-1,-1,llm8_g3,0,
2026-03-03T03:58:01.043968+00:00,BUCKET,llm_style,eval,llm_style_eval_097,64,6144,1024,bf16,NVIDIA GeForce RTX 4060,c10,64,128,64,8,3,8,0.0,0.0,204.79999482631683,277.16608017683006,3.932160099334719,1,-1,-1,llm8_g1,0,
2026-03-03T03:58:01.079138+00:00,BUCKET,llm_style,eval,llm_style_eval_098,32,6144,1024,bf16,NVIDIA GeForce RTX 4060,c10,64,128,64,8,3,8,0.0,0.0,200.70399343967438,232.87807673215858,2.0062041472085883,1,-1,-1,llm8_g1,0,
2026-03-03T03:58:01.103035+00:00,BUCKET,llm_style,eval,llm_style_eval_099,1,2048,2048,bf16,NVIDIA GeForce RTX 4060,c00,32,32,32,2,2,8,0.0,0.0,125.95200538635254,277.16063275933254,0.06660162316803368,7,-1,-1,llm8_g7,0,
2026-03-03T03:58:01.152189+00:00,BUCKET,llm_style,eval,llm_style_eval_100,64,8192,1024,bf16,NVIDIA GeForce RTX 4060,c10,64,128,64,8,3,8,0.0,0.0,290.8160090446472,384.02048349380493,3.6921688992546313,1,-1,-1,llm8_g1,0,
2026-03-03T03:58:01.239928+00:00,BUCKET,llm_style,eval,llm_style_eval_101,64,8192,1536,bf16,NVIDIA GeForce RTX 4060,c10,64,128,64,8,3,8,0.0,0.0,408.57601165771484,486.4492800831795,3.94201492511825,1,-1,-1,llm8_g1,0,
2026-03-03T03:58:01.276936+00:00,BUCKET,llm_style,eval,llm_style_eval_102,32,3072,2048,bf16,NVIDIA GeForce RTX 4060,c04,64,64,64,4,3,8,0.0,0.0,206.84799551963806,302.68288880586624,1.9466139035501182,3,-1,-1,llm8_g3,0,
2026-03-03T03:58:01.315945+00:00,BUCKET,llm_style,eval,llm_style_eval_103,64,2048,3072,bf16,NVIDIA GeForce RTX 4060,c04,64,64,64,4,3,8,0.0,0.0,271.36000990867615,348.5158336162565,2.967667816164286,3,-1,-1,llm8_g3,0,
2026-03-03T03:58:01.398605+00:00,BUCKET,llm_style,eval,llm_style_eval_104,16,6144,2048,bf16,NVIDIA GeForce RTX 4060,c10,64,128,64,8,3,8,0.0,0.0,366.5919899940491,394.3628868460655,1.0983687450632413,5,-1,-1,llm8_g5,0,
2026-03-03T03:58:01.455321+00:00,BUCKET,llm_style,eval,llm_style_eval_105,1,1024,8192,bf16,NVIDIA GeForce RTX 4060,c04,64,64,64,4,3,8,0.0,0.0,416.76801443099976,433.17248493433,0.04025552686164125,6,-1,-1,llm8_g6,0,
2026-03-03T03:58:01.687934+00:00,BUCKET,llm_style,eval,llm_style_eval_106,32,4096,8192,bf16,NVIDIA GeForce RTX 4060,c06,64,128,32,4,3,8,0.0,0.0,1366.528034210205,1475.6044423580167,1.5714889078299472,2,-1,-1,llm8_g2,0,
2026-03-03T03:58:01.748960+00:00,BUCKET,llm_style,eval,llm_style_eval_107,64,6144,1536,bf16,NVIDIA GeForce RTX 4060,c10,64,128,64,8,3,8,0.0,0.0,283.6480140686035,325.12001305818546,4.258656828486877,1,-1,-1,llm8_g1,0,
2026-03-03T03:58:01.772028+00:00,BUCKET,llm_style,eval,llm_style_eval_108,8,3072,1536,bf16,NVIDIA GeForce RTX 4060,c00,32,32,32,2,2,8,0.0,0.0,99.67999905347824,185.4246427118778,0.7573984020555183,7,-1,-1,llm8_g7,0,
2026-03-03T03:58:01.784505+00:00,BUCKET,llm_style,eval,llm_style_eval_109,16,2048,1024,bf16,NVIDIA GeForce RTX 4060,c00,32,32,32,2,2,8,0.0,0.0,75.77600330114365,91.65824122726917,0.8856215830399591,7,-1,-1,llm8_g7,0,
2026-03-03T03:58:02.146179+00:00,BUCKET,llm_style,eval,llm_style_eval_110,1,8192,8192,bf16,NVIDIA GeForce RTX 4060,c11,32,128,32,4,2,8,0.0,0.0,1067.520022392273,1141.3340902328491,0.1257285345329852,4,-1,-1,llm8_g4,0,
2026-03-03T03:58:02.210461+00:00,BUCKET,llm_style,eval,llm_style_eval_111,8,6144,1536,bf16,NVIDIA GeForce RTX 4060,c10,64,128,64,8,3,8,0.0,0.0,277.8719961643219,407.43936002254475,0.5433974854763987,5,-1,-1,llm8_g5,0,
2026-03-03T03:58:02.323385+00:00,BUCKET,llm_style,eval,llm_style_eval_112,2,6144,3072,bf16,NVIDIA GeForce RTX 4060,c10,64,128,64,8,3,8,0.0,0.0,513.0239725112915,553.2265788316727,0.1471616845318828,5,-1,-1,llm8_g5,0,
2026-03-03T03:58:02.670793+00:00,BUCKET,llm_style,eval,llm_style_eval_113,1,8192,8192,bf16,NVIDIA GeForce RTX 4060,c11,32,128,32,4,2,8,0.0,0.0,1071.615993976593,1111.5788650512695,0.12524797012588418,4,-1,-1,llm8_g4,0,
2026-03-03T03:58:02.696687+00:00,BUCKET,llm_style,eval,llm_style_eval_114,1,3072,1024,bf16,NVIDIA GeForce RTX 4060,c00,32,32,32,2,2,8,0.0,0.0,92.16000139713287,335.4643186926842,0.06826666563175345,7,-1,-1,llm8_g7,0,
2026-03-03T03:58:02.723942+00:00,BUCKET,llm_style,eval,llm_style_eval_115,16,3072,1536,bf16,NVIDIA GeForce RTX 4060,c00,32,32,32,2,2,8,0.0,0.0,116.46400019526482,197.69343972206116,1.2964945712566993,7,-1,-1,llm8_g7,0,
2026-03-03T03:58:02.740125+00:00,BUCKET,llm_style,eval,llm_style_eval_116,8,3072,1024,bf16,NVIDIA GeForce RTX 4060,c00,32,32,32,2,2,8,0.0,0.0,90.11200070381165,195.58848589658737,0.5585454501829857,7,-1,-1,llm8_g7,0,
2026-03-03T03:58:02.767050+00:00,BUCKET,llm_style,eval,llm_style_eval_117,4,1024,4096,bf16,NVIDIA GeForce RTX 4060,c00,32,32,32,2,2,8,0.0,0.0,203.77600193023682,261.58144146203995,0.16466331502316667,7,-1,-1,llm8_g7,0,
2026-03-03T03:58:02.878541+00:00,BUCKET,llm_style,eval,llm_style_eval_118,64,6144,3072,bf16,NVIDIA GeForce RTX 4060,c10,64,128,64,8,3,8,0.0,0.0,515.0719881057739,589.4140583276746,4.690449412488478,1,-1,-1,llm8_g1,0,
2026-03-03T03:58:03.186737+00:00,BUCKET,llm_style,eval,llm_style_eval_119,64,8192,6144,bf16,NVIDIA GeForce RTX 4060,c10,64,128,64,8,3,8,0.0,0.0,1439.2319917678833,1545.2364444732666,4.476311658474464,1,-1,-1,llm8_g1,0,
2026-03-03T03:58:03.219753+00:00,BUCKET,llm_style,eval,llm_style_eval_120,8,1024,4096,bf16,NVIDIA GeForce RTX 4060,c00,32,32,32,2,2,8,0.0,0.0,207.87200331687927,223.2524736225605,0.3228374332723368,7,-1,-1,llm8_g7,0,
2026-03-03T03:58:03.237675+00:00,BUCKET,llm_style,eval,llm_style_eval_121,4,1024,2048,bf16,NVIDIA GeForce RTX 4060,c00,32,32,32,2,2,8,0.0,0.0,120.24000287055969,216.12543866038322,0.13953106785984482,7,-1,-1,llm8_g7,0,
2026-03-03T03:58:03.380388+00:00,BUCKET,llm_style,eval,llm_style_eval_122,4,6144,4096,bf16,NVIDIA GeForce RTX 4060,c10,64,128,64,8,3,8,0.0,0.0,534.38401222229,575.5904012918472,0.3767451633943219,5,-1,-1,llm8_g5,0,
2026-03-03T03:58:03.530111+00:00,BUCKET,llm_style,eval,llm_style_eval_123,4,3072,8192,bf16,NVIDIA GeForce RTX 4060,c04,64,64,64,4,3,8,0.0,0.0,551.9359707832336,643.5494375228882,0.36476439778749015,6,-1,-1,llm8_g6,0,
2026-03-03T03:58:03.569544+00:00,BUCKET,llm_style,eval,llm_style_eval_124,64,6144,1024,bf16,NVIDIA GeForce RTX 4060,c10,64,128,64,8,3,8,0.0,0.0,178.65599691867828,264.0656101703644,4.507580948243032,1,-1,-1,llm8_g1,0,
2026-03-03T03:58:03.659235+00:00,BUCKET,llm_style,eval,llm_style_eval_125,64,1536,8192,bf16,NVIDIA GeForce RTX 4060,c06,64,128,32,4,3,8,0.0,0.0,513.0239725112915,623.4953647851944,3.1394492700135,2,-1,-1,llm8_g2,0,
2026-03-03T03:58:03.765757+00:00,BUCKET,llm_style,eval,llm_style_eval_126,64,2048,8192,bf16,NVIDIA GeForce RTX 4060,c06,64,128,32,4,3,8,0.0,0.0,511.9040012359619,617.5129532814026,4.195090569354855,2,-1,-1,llm8_g2,0,
2026-03-03T03:58:03.837968+00:00,BUCKET,llm_style,eval,llm_style_eval_127,2,8192,1536,bf16,NVIDIA GeForce RTX 4060,c10,64,128,64,8,3,8,0.0,0.0,301.05599761009216,433.1212809681891,0.16718367479656135,5,-1,-1,llm8_g5,0,
2026-03-03T03:58:03.862177+00:00,BUCKET,llm_style,eval,llm_style_eval_128,8,2048,2048,bf16,NVIDIA GeForce RTX 4060,c00,32,32,32,2,2,8,0.0,0.0,101.35999694466591,200.66655650734901,0.6620843135644118,7,-1,-1,llm8_g7,0,
2026-03-03T03:58:04.145088+00:00,BUCKET,llm_style,eval,llm_style_eval_129,64,8192,6144,bf16,NVIDIA GeForce RTX 4060,c10,64,128,64,8,3,8,0.0,0.0,1092.095971107483,1189.3555116653442,5.899161900090867,1,-1,-1,llm8_g1,0,
2026-03-03T03:58:04.174787+00:00,BUCKET,llm_style,eval,llm_style_eval_130,16,3072,1536,bf16,NVIDIA GeForce RTX 4060,c00,32,32,32,2,2,8,0.0,0.0,104.44799810647964,217.91744291782373,1.445647085031424,7,-1,-1,llm8_g7,0,
2026-03-03T03:58:04.524111+00:00,BUCKET,llm_style,eval,llm_style_eval_131,32,8192,8192,bf16,NVIDIA GeForce RTX 4060,c11,32,128,32,4,2,8,0.0,0.0,930.8159947395325,979.4255882501602,4.614195845658893,0,-1,-1,llm8_g0,0,
2026-03-03T03:58:04.720075+00:00,BUCKET,llm_style,eval,llm_style_eval_132,32,8192,4096,bf16,NVIDIA GeForce RTX 4060,c10,64,128,64,8,3,8,0.0,0.0,758.7839961051941,852.9811108112335,2.830164656902283,1,-1,-1,llm8_g1,0,
2026-03-03T03:58:05.053989+00:00,BUCKET,llm_style,eval,llm_style_eval_133,2,8192,8192,bf16,NVIDIA GeForce RTX 4060,c11,32,128,32,4,2,8,0.0,0.0,917.5040125846863,1033.1942248344421,0.29257142455845464,4,-1,-1,llm8_g4,0,
2026-03-03T03:58:05.109503+00:00,BUCKET,llm_style,eval,llm_style_eval_134,64,3072,3072,bf16,NVIDIA GeForce RTX 4060,c04,64,64,64,4,3,8,0.0,0.0,260.09601354599,364.13439631462086,4.6442832226892605,3,-1,-1,llm8_g3,0,
2026-03-03T03:58:05.165903+00:00,BUCKET,llm_style,eval,llm_style_eval_135,8,3072,3072,bf16,NVIDIA GeForce RTX 4060,c00,32,32,32,2,2,8,0.0,0.0,164.86400365829468,252.02687591314313,0.9158757560744408,7,-1,-1,llm8_g7,0,
2026-03-03T03:58:05.216347+00:00,BUCKET,llm_style,eval,llm_style_eval_136,4,2048,4096,bf16,NVIDIA GeForce RTX 4060,c00,32,32,32,2,2,8,0.0,0.0,193.02400201559067,211.12831681966776,0.3476710839027137,7,-1,-1,llm8_g7,0,
2026-03-03T03:58:05.577724+00:00,BUCKET,llm_style,eval,llm_style_eval_137,4,8192,8192,bf16,NVIDIA GeForce RTX 4060,c11,32,128,32,4,2,8,0.0,0.0,1134.592056274414,1218.348467350006,0.4731840920540974,4,-1,-1,llm8_g4,0,
2026-03-03T03:58:05.588429+00:00,BUCKET,llm_style,eval,llm_style_eval_138,16,1024,1024,bf16,NVIDIA GeForce RTX 4060,c00,32,32,32,2,2,8,0.0,0.0,78.84799689054489,116.91007837653146,0.4255584583407939,7,-1,-1,llm8_g7,0,
2026-03-03T03:58:05.598443+00:00,BUCKET,llm_style,eval,llm_style_eval_139,4,1024,1024,bf16,NVIDIA GeForce RTX 4060,c00,32,32,32,2,2,8,0.0,0.0,87.23199740052223,109.3324796110391,0.09616434622589279,7,-1,-1,llm8_g7,0,
2026-03-03T03:58:05.754616+00:00,BUCKET,llm_style,eval,llm_style_eval_140,64,4096,6144,bf16,NVIDIA GeForce RTX 4060,c04,64,64,64,4,3,8,0.0,0.0,765.9519910812378,798.7404823303223,4.205518765546695,3,-1,-1,llm8_g3,0,
2026-03-03T03:58:05.908376+00:00,BUCKET,llm_style,eval,llm_style_eval_141,4,6144,4096,bf16,NVIDIA GeForce RTX 4060,c10,64,128,64,8,3,8,0.0,0.0,674.1439998149872,752.8960049152372,0.2986403380512951,5,-1,-1,llm8_g5,0,
2026-03-03T03:58:05.991651+00:00,BUCKET,llm_style,eval,llm_style_eval_142,4,2048,6144,bf16,NVIDIA GeForce RTX 4060,c00,32,32,32,2,2,8,0.0,0.0,313.34400177001953,424.4787183403969,0.32125490014607766,7,-1,-1,llm8_g7,0,
2026-03-03T03:58:06.096238+00:00,BUCKET,llm_style,eval,llm_style_eval_143,64,1536,8192,bf16,NVIDIA GeForce RTX 4060,c06,64,128,32,4,3,8,0.0,0.0,657.4079990386963,717.6035201549528,2.4499439288161082,2,-1,-1,llm8_g2,0,
2026-03-03T03:58:06.151744+00:00,BUCKET,llm_style,eval,llm_style_eval_144,1,3072,3072,bf16,NVIDIA GeForce RTX 4060,c00,32,32,32,2,2,8,0.0,0.0,166.9120043516159,257.09568113088596,0.11307975165308877,7,-1,-1,llm8_g7,0,
2026-03-03T03:58:06.168536+00:00,BUCKET,llm_style,eval,llm_style_eval_145,32,1024,2048,bf16,NVIDIA GeForce RTX 4060,c04,64,64,64,4,3,8,0.0,0.0,123.90399724245071,234.41856414079666,1.0832396935295618,3,-1,-1,llm8_g3,0,
2026-03-03T03:58:06.377374+00:00,BUCKET,llm_style,eval,llm_style_eval_146,64,8192,4096,bf16,NVIDIA GeForce RTX 4060,c10,64,128,64,8,3,8,0.0,0.0,962.4960124492645,1099.8723077774048,4.462322171154343,1,-1,-1,llm8_g1,0,
2026-03-03T03:58:06.446549+00:00,BUCKET,llm_style,eval,llm_style_eval_147,64,2048,4096,bf16,NVIDIA GeForce RTX 4060,c04,64,64,64,4,3,8,0.0,0.0,354.75198924541473,470.5059143900871,3.0267394026004846,3,-1,-1,llm8_g3,0,
2026-03-03T03:58:06.487126+00:00,BUCKET,llm_style,eval,llm_style_eval_148,64,1024,6144,bf16,NVIDIA GeForce RTX 4060,c04,64,64,64,4,3,8,0.0,0.0,298.351988196373,388.30015301704395,2.699182173607483,3,-1,-1,llm8_g3,0,
2026-03-03T03:58:06.709876+00:00,BUCKET,llm_style,eval,llm_style_eval_149,64,4096,8192,bf16,NVIDIA GeForce RTX 4060,c06,64,128,32,4,3,8,0.0,0.0,1223.680019378662,1277.6553225517273,3.5098777686840226,2,-1,-1,llm8_g2,0,
2026-03-03T03:58:06.747492+00:00,BUCKET,llm_style,eval,llm_style_eval_150,2,2048,3072,bf16,NVIDIA GeForce RTX 4060,c00,32,32,32,2,2,8,0.0,0.0,190.38400053977966,245.04192054271692,0.13218455294903703,7,-1,-1,llm8_g7,0,
2026-03-03T03:58:06.797686+00:00,BUCKET,llm_style,eval,llm_style_eval_151,64,4096,2048,bf16,NVIDIA GeForce RTX 4060,c04,64,64,64,4,3,8,0.0,0.0,296.28799855709076,349.87263053655613,3.623980145092189,3,-1,-1,llm8_g3,0,
2026-03-03T03:58:07.135237+00:00,BUCKET,llm_style,eval,llm_style_eval_152,8,8192,8192,bf16,NVIDIA GeForce RTX 4060,c11,32,128,32,4,2,8,0.0,0.0,920.5600023269653,1065.8713674545288,1.1664006922805967,4,-1,-1,llm8_g4,0,
2026-03-03T03:58:07.248487+00:00,BUCKET,llm_style,eval,llm_style_eval_153,64,8192,2048,bf16,NVIDIA GeForce RTX 4060,c10,64,128,64,8,3,8,0.0,0.0,400.38400888442993,543.5372960567473,5.363559983285614,1,-1,-1,llm8_g1,0,
2026-03-03T03:58:07.363823+00:00,BUCKET,llm_style,eval,llm_style_eval_154,16,2048,8192,bf16,NVIDIA GeForce RTX 4060,c04,64,64,64,4,3,8,0.0,0.0,537.5999808311462,653.352957367897,0.9986438451318039,6,-1,-1,llm8_g6,0,
2026-03-03T03:58:07.387836+00:00,BUCKET,llm_style,eval,llm_style_eval_155,4,2048,1536,bf16,NVIDIA GeForce RTX 4060,c00,32,32,32,2,2,8,0.0,0.0,110.57600006461143,241.70495972037315,0.22758848199695395,7,-1,-1,llm8_g7,0,
2026-03-03T03:58:07.524260+00:00,BUCKET,llm_style,eval,llm_style_eval_156,1,4096,6144,bf16,NVIDIA GeForce RTX 4060,c00,32,32,32,2,2,8,0.0,0.0,375.8080005645752,435.65056562423695,0.13392915511215014,7,-1,-1,llm8_g7,0,
2026-03-03T03:58:07.601698+00:00,BUCKET,llm_style,eval,llm_style_eval_157,1,1536,8192,bf16,NVIDIA GeForce RTX 4060,c04,64,64,64,4,3,8,0.0,0.0,313.31199407577515,445.4092705249785,0.0803219298202596,6,-1,-1,llm8_g6,0,
2026-03-03T03:58:07.698130+00:00,BUCKET,llm_style,eval,llm_style_eval_158,64,1536,8192,bf16,NVIDIA GeForce RTX 4060,c06,64,128,32,4,3,8,0.0,0.0,525.3120064735413,657.0419138669968,3.066011658123262,2,-1,-1,llm8_g2,0,
2026-03-03T03:58:07.753812+00:00,BUCKET,llm_style,eval,llm_style_eval_159,16,6144,1536,bf16,NVIDIA GeForce RTX 4060,c10,64,128,64,8,3,8,0.0,0.0,217.0879989862442,363.5964837670325,1.3910943461187626,5,-1,-1,llm8_g5,0,
2026-03-03T03:58:07.960239+00:00,BUCKET,llm_style,eval,llm_style_eval_160,32,6144,6144,bf16,NVIDIA GeForce RTX 4060,c10,64,128,64,8,3,8,0.0,0.0,760.8320116996765,775.7107257843018,3.1753646887213742,1,-1,-1,llm8_g1,0,
2026-03-03T03:58:07.994218+00:00,BUCKET,llm_style,eval,llm_style_eval_161,2,1536,4096,bf16,NVIDIA GeForce RTX 4060,c00,32,32,32,2,2,8,0.0,0.0,160.76800227165222,225.80223813652992,0.1565350296352934,7,-1,-1,llm8_g7,0,
2026-03-03T03:58:08.018999+00:00,BUCKET,llm_style,eval,llm_style_eval_162,64,1536,3072,bf16,NVIDIA GeForce RTX 4060,c04,64,64,64,4,3,8,0.0,0.0,136.57599687576294,143.75679925084114,4.422298133027089,3,-1,-1,llm8_g3,0,
2026-03-03T03:58:08.082379+00:00,BUCKET,llm_style,eval,llm_style_eval_163,64,1024,8192,bf16,NVIDIA GeForce RTX 4060,c06,64,128,32,4,3,8,0.0,0.0,523.6960053443909,581.1529582738875,2.0503150931882517,2,-1,-1,llm8_g2,0,
2026-03-03T03:58:08.297785+00:00,BUCKET,llm_style,eval,llm_style_eval_164,64,4096,8192,bf16,NVIDIA GeForce RTX 4060,c06,64,128,32,4,3,8,0.0,0.0,978.8160026073456,1101.4655816555023,4.387921003088603,2,-1,-1,llm8_g2,0,
2026-03-03T03:58:08.444357+00:00,BUCKET,llm_style,eval,llm_style_eval_165,4,8192,3072,bf16,NVIDIA GeForce RTX 4060,c10,64,128,64,8,3,8,0.0,0.0,594.8320031166077,765.839339494705,0.3384595834540749,5,-1,-1,llm8_g5,0,
2026-03-03T03:58:08.491514+00:00,BUCKET,llm_style,eval,llm_style_eval_166,64,1024,6144,bf16,NVIDIA GeForce RTX 4060,c04,64,64,64,4,3,8,0.0,0.0,222.20799326896667,304.1923254728316,3.6241107088584115,3,-1,-1,llm8_g3,0,
2026-03-03T03:58:08.508041+00:00,BUCKET,llm_style,eval,llm_style_eval_167,2,2048,1024,bf16,NVIDIA GeForce RTX 4060,c00,32,32,32,2,2,8,0.0,0.0,67.58400052785873,102.23456017673007,0.12412121115177462,7,-1,-1,llm8_g7,0,
2026-03-03T03:58:08.530454+00:00,BUCKET,llm_style,eval,llm_style_eval_168,64,4096,1024,bf16,NVIDIA GeForce RTX 4060,c04,64,64,64,4,3,8,0.0,0.0,123.84000048041344,147.17567339539522,4.335197915998972,3,-1,-1,llm8_g3,0,
2026-03-03T03:58:08.576845+00:00,BUCKET,llm_style,eval,llm_style_eval_169,4,1536,6144,bf16,NVIDIA GeForce RTX 4060,c00,32,32,32,2,2,8,0.0,0.0,230.3999960422516,276.53376311063766,0.32768000562879784,7,-1,-1,llm8_g7,0,
2026-03-03T03:58:08.596550+00:00,BUCKET,llm_style,eval,llm_style_eval_170,16,1536,1536,bf16,NVIDIA GeForce RTX 4060,c00,32,32,32,2,2,8,0.0,0.0,109.02399942278862,177.3568002879619,0.6924848877284833,7,-1,-1,llm8_g7,0,
2026-03-03T03:58:08.630197+00:00,BUCKET,llm_style,eval,llm_style_eval_171,1,2048,3072,bf16,NVIDIA GeForce RTX 4060,c00,32,32,32,2,2,8,0.0,0.0,140.28799533843994,207.30688214302052,0.08969343363731273,7,-1,-1,llm8_g7,0,
2026-03-03T03:58:08.661648+00:00,BUCKET,llm_style,eval,llm_style_eval_172,64,3072,2048,bf16,NVIDIA GeForce RTX 4060,c04,64,64,64,4,3,8,0.0,0.0,161.23200207948685,176.69119641184807,4.99470550271395,3,-1,-1,llm8_g3,0,
2026-03-03T03:58:08.948435+00:00,BUCKET,llm_style,eval,llm_style_eval_173,64,8192,6144,bf16,NVIDIA GeForce RTX 4060,c10,64,128,64,8,3,8,0.0,0.0,1241.6000366210938,1381.7037081718445,5.188829537676697,1,-1,-1,llm8_g1,0,
2026-03-03T03:58:09.043453+00:00,BUCKET,llm_style,eval,llm_style_eval_174,2,4096,4096,bf16,NVIDIA GeForce RTX 4060,c00,32,32,32,2,2,8,0.0,0.0,291.83998703956604,391.4239943027495,0.2299508874049592,7,-1,-1,llm8_g7,0,
2026-03-03T03:58:09.098024+00:00,BUCKET,llm_style,eval,llm_style_eval_175,64,4096,2048,bf16,NVIDIA GeForce RTX 4060,c04,64,64,64,4,3,8,0.0,0.0,266.2400007247925,386.06848388910294,4.03298460440551,3,-1,-1,llm8_g3,0,
2026-03-03T03:58:09.172999+00:00,BUCKET,llm_style,eval,llm_style_eval_176,16,6144,2048,bf16,NVIDIA GeForce RTX 4060,c10,64,128,64,8,3,8,0.0,0.0,300.03198981285095,323.4899169206619,1.3420341752596463,5,-1,-1,llm8_g5,0,
2026-03-03T03:58:09.235864+00:00,BUCKET,llm_style,eval,llm_style_eval_177,1,6144,1536,bf16,NVIDIA GeForce RTX 4060,c10,64,128,64,8,3,8,0.0,0.0,232.4480041861534,264.89856392145157,0.08119823642316443,5,-1,-1,llm8_g5,0,
2026-03-03T03:58:09.512015+00:00,BUCKET,llm_style,eval,llm_style_eval_178,32,6144,8192,bf16,NVIDIA GeForce RTX 4060,c11,32,128,32,4,2,8,0.0,0.0,703.3919990062714,835.9091258049009,4.57955944416604,0,-1,-1,llm8_g0,0,
2026-03-03T03:58:09.671415+00:00,BUCKET,llm_style,eval,llm_style_eval_179,64,4096,6144,bf16,NVIDIA GeForce RTX 4060,c04,64,64,64,4,3,8,0.0,0.0,641.0239934921265,745.4681587219238,5.025124651655594,3,-1,-1,llm8_g3,0,
2026-03-03T03:58:09.692667+00:00,BUCKET,llm_style,eval,llm_style_eval_180,64,2048,1536,bf16,NVIDIA GeForce RTX 4060,c04,64,64,64,4,3,8,0.0,0.0,135.5840042233467,214.83520537614805,2.96976908379776,3,-1,-1,llm8_g3,0,
2026-03-03T03:58:09.730871+00:00,BUCKET,llm_style,eval,llm_style_eval_181,64,2048,3072,bf16,NVIDIA GeForce RTX 4060,c04,64,64,64,4,3,8,0.0,0.0,214.01600539684296,281.0982346534729,3.762832440997796,3,-1,-1,llm8_g3,0,
2026-03-03T03:58:09.758778+00:00,BUCKET,llm_style,eval,llm_style_eval_182,32,3072,1536,bf16,NVIDIA GeForce RTX 4060,c04,64,64,64,4,3,8,0.0,0.0,173.98399859666824,277.04320818185806,1.7357336906601193,3,-1,-1,llm8_g3,0,
2026-03-03T03:58:09.857608+00:00,BUCKET,llm_style,eval,llm_style_eval_183,8,8192,2048,bf16,NVIDIA GeForce RTX 4060,c10,64,128,64,8,3,8,0.0,0.0,430.07999658584595,467.0566451549529,0.6241523859071624,5,-1,-1,llm8_g5,0,
2026-03-03T03:58:09.904501+00:00,BUCKET,llm_style,eval,llm_style_eval_184,64,8192,1024,bf16,NVIDIA GeForce RTX 4060,c10,64,128,64,8,3,8,0.0,0.0,237.56800591945648,276.490240395069,4.519724025313554,1,-1,-1,llm8_g1,0,
2026-03-03T03:58:09.985781+00:00,BUCKET,llm_style,eval,llm_style_eval_185,1,8192,1536,bf16,NVIDIA GeForce RTX 4060,c10,64,128,64,8,3,8,0.0,0.0,328.70399951934814,404.91423338651657,0.07656074777550338,5,-1,-1,llm8_g5,0,
2026-03-03T03:58:10.017882+00:00,BUCKET,llm_style,eval,llm_style_eval_186,16,6144,1024,bf16,NVIDIA GeForce RTX 4060,c10,64,128,64,8,3,8,0.0,0.0,167.85600036382675,267.7964811027049,1.1994006265109733,5,-1,-1,llm8_g5,0,
2026-03-03T03:58:10.054400+00:00,BUCKET,llm_style,eval,llm_style_eval_187,1,1024,6144,bf16,NVIDIA GeForce RTX 4060,c00,32,32,32,2,2,8,0.0,0.0,242.38400161266327,298.02494913339615,0.05191312923411448,7,-1,-1,llm8_g7,0,
2026-03-03T03:58:10.246234+00:00,BUCKET,llm_style,eval,llm_style_eval_188,8,8192,4096,bf16,NVIDIA GeForce RTX 4060,c10,64,128,64,8,3,8,0.0,0.0,814.4479990005493,874.1679960489273,0.6591837817255635,5,-1,-1,llm8_g5,0,
2026-03-03T03:58:10.358916+00:00,BUCKET,llm_style,eval,llm_style_eval_189,8,2048,8192,bf16,NVIDIA GeForce RTX 4060,c04,64,64,64,4,3,8,0.0,0.0,581.6320180892944,695.8326518535614,0.4615211124068289,6,-1,-1,llm8_g6,0,
2026-03-03T03:58:10.457127+00:00,BUCKET,llm_style,eval,llm_style_eval_190,4,8192,2048,bf16,NVIDIA GeForce RTX 4060,c10,64,128,64,8,3,8,0.0,0.0,407.9360067844391,548.0140757560729,0.329016624587697,5,-1,-1,llm8_g5,0,
2026-03-03T03:58:10.800052+00:00,BUCKET,llm_style,eval,llm_style_eval_191,4,8192,8192,bf16,NVIDIA GeForce RTX 4060,c11,32,128,32,4,2,8,0.0,0.0,911.871999502182,1050.77987074852,0.5887568784797578,4,-1,-1,llm8_g4,0,
2026-03-03T03:58:10.815465+00:00,BUCKET,llm_style,eval,llm_style_eval_192,64,1536,1024,bf16,NVIDIA GeForce RTX 4060,c04,64,64,64,4,3,8,0.0,0.0,74.68800246715546,188.78463670611376,2.6955680343510955,3,-1,-1,llm8_g3,0,
2026-03-03T03:58:10.840501+00:00,BUCKET,llm_style,eval,llm_style_eval_193,32,2048,2048,bf16,NVIDIA GeForce RTX 4060,c04,64,64,64,4,3,8,0.0,0.0,156.11199289560318,162.57631734013557,1.7195056639851556,3,-1,-1,llm8_g3,0,
2026-03-03T03:58:10.858181+00:00,BUCKET,llm_style,eval,llm_style_eval_194,8,1024,2048,bf16,NVIDIA GeForce RTX 4060,c00,32,32,32,2,2,8,0.0,0.0,77.82399654388428,180.83680078387255,0.43115791388429847,7,-1,-1,llm8_g7,0,
2026-03-03T03:58:10.898783+00:00,BUCKET,llm_style,eval,llm_style_eval_195,2,4096,2048,bf16,NVIDIA GeForce RTX 4060,c00,32,32,32,2,2,8,0.0,0.0,143.36000382900238,230.52287608385083,0.23405713660571054,7,-1,-1,llm8_g7,0,
2026-03-03T03:58:10.956415+00:00,BUCKET,llm_style,eval,llm_style_eval_196,32,2048,4096,bf16,NVIDIA GeForce RTX 4060,c04,64,64,64,4,3,8,0.0,0.0,290.8160090446472,375.7241639494895,1.8460844496273157,3,-1,-1,llm8_g3,0,
2026-03-03T03:58:11.035878+00:00,BUCKET,llm_style,eval,llm_style_eval_197,32,8192,1536,bf16,NVIDIA GeForce RTX 4060,c10,64,128,64,8,3,8,0.0,0.0,319.487988948822,447.48000144958485,2.5206154718041685,1,-1,-1,llm8_g1,0,
2026-03-03T03:58:11.247165+00:00,BUCKET,llm_style,eval,llm_style_eval_198,64,4096,8192,bf16,NVIDIA GeForce RTX 4060,c06,64,128,32,4,3,8,0.0,0.0,999.9359846115112,1017.8236854076385,4.295242257601774,2,-1,-1,llm8_g2,0,
2026-03-03T03:58:11.448680+00:00,BUCKET,llm_style,eval,llm_style_eval_199,2,8192,4096,bf16,NVIDIA GeForce RTX 4060,c10,64,128,64,8,3,8,0.0,0.0,773.1199860572815,789.1046273708344,0.17360530114410422,5,-1,-1,llm8_g5,0,
2026-03-03T03:58:11.468936+00:00,BUCKET,llm_style,eval,llm_style_eval_200,1,4096,1024,bf16,NVIDIA GeForce RTX 4060,c00,32,32,32,2,2,8,0.0,0.0,82.94399827718735,126.18752151727662,0.10113580456980666,7,-1,-1,llm8_g7,0,
2026-03-03T03:58:11.549789+00:00,BUCKET,llm_style,eval,llm_style_eval_201,4,1536,8192,bf16,NVIDIA GeForce RTX 4060,c04,64,64,64,4,3,8,0.0,0.0,325.5999982357025,353.52576792240137,0.309162458677686,6,-1,-1,llm8_g6,0,
2026-03-03T03:58:11.660278+00:00,BUCKET,llm_style,eval,llm_style_eval_202,1,6144,3072,bf16,NVIDIA GeForce RTX 4060,c10,64,128,64,8,3,8,0.0,0.0,407.51999616622925,524.2566311359406,0.09263038956400588,5,-1,-1,llm8_g5,0,
2026-03-03T03:58:11.735699+00:00,BUCKET,llm_style,eval,llm_style_eval_203,16,2048,6144,bf16,NVIDIA GeForce RTX 4060,c00,32,32,32,2,2,8,0.0,0.0,274.9280035495758,340.9280025959015,1.4645768303023827,7,-1,-1,llm8_g7,0,
2026-03-03T03:58:11.748737+00:00,BUCKET,llm_style,eval,llm_style_eval_204,16,1536,1024,bf16,NVIDIA GeForce RTX 4060,c00,32,32,32,2,2,8,0.0,0.0,70.41599974036217,186.12223565578446,0.7147757354235234,7,-1,-1,llm8_g7,0,
2026-03-03T03:58:11.826143+00:00,BUCKET,llm_style,eval,llm_style_eval_205,64,6144,2048,bf16,NVIDIA GeForce RTX 4060,c10,64,128,64,8,3,8,0.0,0.0,287.7439856529236,424.92159754037846,5.5973810620066935,1,-1,-1,llm8_g1,0,
2026-03-03T03:58:11.906608+00:00,BUCKET,llm_style,eval,llm_style_eval_206,4,2048,6144,bf16,NVIDIA GeForce RTX 4060,c00,32,32,32,2,2,8,0.0,0.0,267.2640085220337,342.2169560194015,0.37664366615118383,7,-1,-1,llm8_g7,0,
2026-03-03T03:58:11.969730+00:00,BUCKET,llm_style,eval,llm_style_eval_207,32,6144,1536,bf16,NVIDIA GeForce RTX 4060,c10,64,128,64,8,3,8,0.0,0.0,214.52799439430237,355.7868659496306,2.8153890950468936,1,-1,-1,llm8_g1,0,
2026-03-03T03:58:11.982520+00:00,BUCKET,llm_style,eval,llm_style_eval_208,4,2048,1024,bf16,NVIDIA GeForce RTX 4060,c00,32,32,32,2,2,8,0.0,0.0,67.58400052785873,104.52991813421248,0.24824242230354923,7,-1,-1,llm8_g7,0,
2026-03-03T03:58:11.993945+00:00,BUCKET,llm_style,eval,llm_style_eval_209,1,1024,1536,bf16,NVIDIA GeForce RTX 4060,c00,32,32,32,2,2,8,0.0,0.0,76.80000364780426,103.32384034991263,0.04095999805450449,7,-1,-1,llm8_g7,0,
2026-03-03T03:58:12.136721+00:00,BUCKET,llm_style,eval,llm_style_eval_210,8,6144,4096,bf16,NVIDIA GeForce RTX 4060,c10,64,128,64,8,3,8,0.0,0.0,533.5040092468262,646.6662168502808,0.7547331922930538,5,-1,-1,llm8_g5,0,
2026-03-03T03:58:12.252131+00:00,BUCKET,llm_style,eval,llm_style_eval_211,4,2048,8192,bf16,NVIDIA GeForce RTX 4060,c04,64,64,64,4,3,8,0.0,0.0,649.2159962654114,771.0259187221527,0.20673817153625607,6,-1,-1,llm8_g6,0,
2026-03-03T03:58:12.262952+00:00,BUCKET,llm_style,eval,llm_style_eval_212,32,1024,1024,bf16,NVIDIA GeForce RTX 4060,c04,64,64,64,4,3,8,0.0,0.0,80.89599758386612,119.08863820135585,0.8295696450300549,3,-1,-1,llm8_g3,0,
2026-03-03T03:58:12.338222+00:00,BUCKET,llm_style,eval,llm_style_eval_213,16,3072,4096,bf16,NVIDIA GeForce RTX 4060,c00,32,32,32,2,2,8,0.0,0.0,229.37600314617157,309.8483160138128,1.755428547350728,7,-1,-1,llm8_g7,0,
2026-03-03T03:58:12.421646+00:00,BUCKET,llm_style,eval,llm_style_eval_214,64,1024,8192,bf16,NVIDIA GeForce RTX 4060,c06,64,128,32,4,3,8,0.0,0.0,632.8319907188416,650.9465682506561,1.6967249439781382,2,-1,-1,llm8_g2,0,
2026-03-03T03:58:12.452484+00:00,BUCKET,llm_style,eval,llm_style_eval_215,4,4096,1536,bf16,NVIDIA GeForce RTX 4060,c00,32,32,32,2,2,8,0.0,0.0,132.06399977207184,230.33920228481293,0.38111558098245524,7,-1,-1,llm8_g7,0,
2026-03-03T03:58:12.478262+00:00,BUCKET,llm_style,eval,llm_style_eval_216,16,1536,3072,bf16,NVIDIA GeForce RTX 4060,c00,32,32,32,2,2,8,0.0,0.0,161.77599877119064,242.27648317813868,0.9333581319041095,7,-1,-1,llm8_g7,0,
2026-03-03T03:58:12.560307+00:00,BUCKET,llm_style,eval,llm_style_eval_217,8,6144,2048,bf16,NVIDIA GeForce RTX 4060,c10,64,128,64,8,3,8,0.0,0.0,338.4000062942505,458.5395327210424,0.5949367265228109,5,-1,-1,llm8_g5,0,
2026-03-03T03:58:12.629975+00:00,BUCKET,llm_style,eval,llm_style_eval_218,8,3072,4096,bf16,NVIDIA GeForce RTX 4060,c00,32,32,32,2,2,8,0.0,0.0,223.23200106620789,245.3158444166183,0.9018715553254795,7,-1,-1,llm8_g7,0,
2026-03-03T03:58:12.782905+00:00,BUCKET,llm_style,eval,llm_style_eval_219,64,8192,3072,bf16,NVIDIA GeForce RTX 4060,c10,64,128,64,8,3,8,0.0,0.0,699.9040246009827,713.6809593439102,4.6023816963139055,1,-1,-1,llm8_g1,0,
2026-03-03T03:58:12.824479+00:00,BUCKET,llm_style,eval,llm_style_eval_220,2,4096,2048,bf16,NVIDIA GeForce RTX 4060,c00,32,32,32,2,2,8,0.0,0.0,168.44800114631653,238.6124862730503,0.19919756703348535,7,-1,-1,llm8_g7,0,
2026-03-03T03:58:12.894316+00:00,BUCKET,llm_style,eval,llm_style_eval_221,4,1024,8192,bf16,NVIDIA GeForce RTX 4060,c04,64,64,64,4,3,8,0.0,0.0,392.67200231552124,606.4844650030133,0.1709031038736407,6,-1,-1,llm8_g6,0,
2026-03-03T03:58:12.979562+00:00,BUCKET,llm_style,eval,llm_style_eval_222,64,6144,2048,bf16,NVIDIA GeForce RTX 4060,c10,64,128,64,8,3,8,0.0,0.0,371.68000638484955,513.4745544195172,4.333331651776607,1,-1,-1,llm8_g1,0,
2026-03-03T03:58:13.003116+00:00,BUCKET,llm_style,eval,llm_style_eval_223,4,2048,2048,bf16,NVIDIA GeForce RTX 4060,c00,32,32,32,2,2,8,0.0,0.0,123.3919970691204,167.32799991965294,0.27193361641763397,7,-1,-1,llm8_g7,0,
2026-03-03T03:58:13.029462+00:00,BUCKET,llm_style,eval,llm_style_eval_224,16,3072,1536,bf16,NVIDIA GeForce RTX 4060,c00,32,32,32,2,2,8,0.0,0.0,85.93599870800972,196.18815556168556,1.7570627707841653,7,-1,-1,llm8_g7,0,
2026-03-03T03:58:13.051703+00:00,BUCKET,llm_style,eval,llm_style_eval_225,1,2048,2048,bf16,NVIDIA GeForce RTX 4060,c00,32,32,32,2,2,8,0.0,0.0,124.92799758911133,162.08832234144205,0.06714754227943495,7,-1,-1,llm8_g7,0,
2026-03-03T03:58:13.063536+00:00,BUCKET,llm_style,eval,llm_style_eval_226,8,1536,1024,bf16,NVIDIA GeForce RTX 4060,c00,32,32,32,2,2,8,0.0,0.0,79.8719972372055,145.03679573535902,0.31507693397552106,7,-1,-1,llm8_g7,0,
2026-03-03T03:58:13.293865+00:00,BUCKET,llm_style,eval,llm_style_eval_227,64,6144,6144,bf16,NVIDIA GeForce RTX 4060,c10,64,128,64,8,3,8,0.0,0.0,1057.7279925346375,1083.3184015750885,4.56812927529832,1,-1,-1,llm8_g1,0,
2026-03-03T03:58:13.380781+00:00,BUCKET,llm_style,eval,llm_style_eval_228,64,6144,2048,bf16,NVIDIA GeForce RTX 4060,c10,64,128,64,8,3,8,0.0,0.0,382.31998682022095,393.6128017306328,4.212734859601681,1,-1,-1,llm8_g1,0,
2026-03-03T03:58:13.461344+00:00,BUCKET,llm_style,eval,llm_style_eval_229,16,1536,8192,bf16,NVIDIA GeForce RTX 4060,c04,64,64,64,4,3,8,0.0,0.0,368.367999792099,381.4579105377197,1.0930731882987963,6,-1,-1,llm8_g6,0,
2026-03-03T03:58:13.482802+00:00,BUCKET,llm_style,eval,llm_style_eval_230,64,2048,1536,bf16,NVIDIA GeForce RTX 4060,c04,64,64,64,4,3,8,0.0,0.0,145.31199634075165,158.1692735850811,2.7709562468317626,3,-1,-1,llm8_g3,0,
2026-03-03T03:58:13.544882+00:00,BUCKET,llm_style,eval,llm_style_eval_231,4,1024,8192,bf16,NVIDIA GeForce RTX 4060,c04,64,64,64,4,3,8,0.0,0.0,369.6640133857727,414.71200495958317,0.18154015963129946,6,-1,-1,llm8_g6,0,
2026-03-03T03:58:13.569546+00:00,BUCKET,llm_style,eval,llm_style_eval_232,16,3072,1536,bf16,NVIDIA GeForce RTX 4060,c00,32,32,32,2,2,8,0.0,0.0,97.28000313043594,200.2963176369667,1.5521683711044034,7,-1,-1,llm8_g7,0,
2026-03-03T03:58:13.632200+00:00,BUCKET,llm_style,eval,llm_style_eval_233,64,3072,3072,bf16,NVIDIA GeForce RTX 4060,c04,64,64,64,4,3,8,0.0,0.0,263.96800577640533,282.13088512420654,4.576158949441792,3,-1,-1,llm8_g3,0,
2026-03-03T03:58:13.841165+00:00,BUCKET,llm_style,eval,llm_style_eval_234,32,8192,4096,bf16,NVIDIA GeForce RTX 4060,c10,64,128,64,8,3,8,0.0,0.0,889.8559808731079,913.8047844171524,2.4132934926086964,1,-1,-1,llm8_g1,0,
2026-03-03T03:58:13.855026+00:00,BUCKET,llm_style,eval,llm_style_eval_235,4,2048,1024,bf16,NVIDIA GeForce RTX 4060,c00,32,32,32,2,2,8,0.0,0.0,73.18400219082832,131.6044759005307,0.22924704167248425,7,-1,-1,llm8_g7,0,
2026-03-03T03:58:14.006746+00:00,BUCKET,llm_style,eval,llm_style_eval_236,4,8192,3072,bf16,NVIDIA GeForce RTX 4060,c10,64,128,64,8,3,8,0.0,0.0,676.8640279769897,692.1660566329956,0.2974402297633169,5,-1,-1,llm8_g5,0,
2026-03-03T03:58:14.037894+00:00,BUCKET,llm_style,eval,llm_style_eval_237,64,1024,4096,bf16,NVIDIA GeForce RTX 4060,c04,64,64,64,4,3,8,0.0,0.0,201.21599733829498,262.3494382202624,2.668132350815945,3,-1,-1,llm8_g3,0,
2026-03-03T03:58:14.131459+00:00,BUCKET,llm_style,eval,llm_style_eval_238,32,2048,6144,bf16,NVIDIA GeForce RTX 4060,c04,64,64,64,4,3,8,0.0,0.0,487.2159957885742,500.22208124399185,1.652873417459512,3,-1,-1,llm8_g3,0,
2026-03-03T03:58:14.162575+00:00,BUCKET,llm_style,eval,llm_style_eval_239,32,2048,6144,bf16,NVIDIA GeForce RTX 4060,c04,64,64,64,4,3,8,0.0,0.0,484.2880070209503,590.2915358543395,1.6628666337491245,3,-1,-1,llm8_g3,0,
2026-03-03T03:58:14.246492+00:00,BUCKET,llm_style,eval,llm_style_eval_240,8,8192,1536,bf16,NVIDIA GeForce RTX 4060,c10,64,128,64,8,3,8,0.0,0.0,361.4080101251602,394.96352583169926,0.55706178712054,5,-1,-1,llm8_g5,0,
2026-03-03T03:58:14.265129+00:00,BUCKET,llm_style,eval,llm_style_eval_241,16,1536,1536,bf16,NVIDIA GeForce RTX 4060,c00,32,32,32,2,2,8,0.0,0.0,89.60000053048134,174.14143919944763,0.8426057092970245,7,-1,-1,llm8_g7,0,
2026-03-03T03:58:14.295720+00:00,BUCKET,llm_style,eval,llm_style_eval_242,1,2048,3072,bf16,NVIDIA GeForce RTX 4060,c00,32,32,32,2,2,8,0.0,0.0,151.0080024600029,199.18079927563656,0.08332612705960933,7,-1,-1,llm8_g7,0,
2026-03-03T03:58:14.345232+00:00,BUCKET,llm_style,eval,llm_style_eval_243,8,1536,6144,bf16,NVIDIA GeForce RTX 4060,c00,32,32,32,2,2,8,0.0,0.0,264.19198513031006,295.9606394171715,0.5715349158890011,7,-1,-1,llm8_g7,0,
2026-03-03T03:58:14.404119+00:00,BUCKET,llm_style,eval,llm_style_eval_244,32,8192,1024,bf16,NVIDIA GeForce RTX 4060,c10,64,128,64,8,3,8,0.0,0.0,251.72799825668335,440.32000720500923,2.1327421491373424,1,-1,-1,llm8_g1,0,
2026-03-03T03:58:14.552401+00:00,BUCKET,llm_style,eval,llm_style_eval_245,4,6144,4096,bf16,NVIDIA GeForce RTX 4060,c10,64,128,64,8,3,8,0.0,0.0,612.3520135879517,651.0790574550629,0.3287759124369787,5,-1,-1,llm8_g5,0,
2026-03-03T03:58:14.640402+00:00,BUCKET,llm_style,eval,llm_style_eval_246,32,2048,6144,bf16,NVIDIA GeForce RTX 4060,c04,64,64,64,4,3,8,0.0,0.0,482.1760058403015,498.7072119116783,1.6701502319605686,3,-1,-1,llm8_g3,0,
2026-03-03T03:58:14.720761+00:00,BUCKET,llm_style,eval,llm_style_eval_247,64,6144,2048,bf16,NVIDIA GeForce RTX 4060,c10,64,128,64,8,3,8,0.0,0.0,327.67999172210693,415.83647817373264,4.9152001241684,1,-1,-1,llm8_g1,0,
2026-03-03T03:58:14.732732+00:00,BUCKET,llm_style,eval,llm_style_eval_248,64,1024,1024,bf16,NVIDIA GeForce RTX 4060,c04,64,64,64,4,3,8,0.0,0.0,92.67200157046318,242.14528352022154,1.4483093677214633,3,-1,-1,llm8_g3,0,
2026-03-03T03:58:14.791430+00:00,BUCKET,llm_style,eval,llm_style_eval_249,2,8192,1024,bf16,NVIDIA GeForce RTX 4060,c10,64,128,64,8,3,8,0.0,0.0,253.9519965648651,342.1772825717924,0.13212903404533555,5,-1,-1,llm8_g5,0,
2026-03-03T03:58:14.856578+00:00,BUCKET,llm_style,eval,llm_style_eval_250,64,3072,3072,bf16,NVIDIA GeForce RTX 4060,c04,64,64,64,4,3,8,0.0,0.0,264.19198513031006,386.48448675870856,4.572279327112009,3,-1,-1,llm8_g3,0,
2026-03-03T03:58:14.938875+00:00,BUCKET,llm_style,eval,llm_style_eval_251,64,1024,8192,bf16,NVIDIA GeForce RTX 4060,c06,64,128,32,4,3,8,0.0,0.0,621.5200126171112,685.8854150772094,1.7276061948169015,2,-1,-1,llm8_g2,0,
2026-03-03T03:58:15.023585+00:00,BUCKET,llm_style,eval,llm_style_eval_252,64,4096,3072,bf16,NVIDIA GeForce RTX 4060,c04,64,64,64,4,3,8,0.0,0.0,370.6879913806915,410.0300845503806,4.344928277824685,3,-1,-1,llm8_g3,0,
2026-03-03T03:58:15.175564+00:00,BUCKET,llm_style,eval,llm_style_eval_253,8,6144,4096,bf16,NVIDIA GeForce RTX 4060,c10,64,128,64,8,3,8,0.0,0.0,633.3439946174622,672.3094475269315,0.6357574831718446,5,-1,-1,llm8_g5,0,
2026-03-03T03:58:15.205221+00:00,BUCKET,llm_style,eval,llm_style_eval_254,4,1536,3072,bf16,NVIDIA GeForce RTX 4060,c00,32,32,32,2,2,8,0.0,0.0,167.93599724769592,222.19776421785343,0.22478049148880683,7,-1,-1,llm8_g7,0,
2026-03-03T03:58:15.230154+00:00,BUCKET,llm_style,eval,llm_style_eval_255,1,3072,1536,bf16,NVIDIA GeForce RTX 4060,c00,32,32,32,2,2,8,0.0,0.0,117.76000261306763,289.2800001800055,0.08013912865651357,7,-1,-1,llm8_g7,0,
2026-03-03T03:58:15.552646+00:00,TORCH,llm_style,tune,llm_style_tune_000,64,6144,6144,bf16,NVIDIA GeForce RTX 4060,torch_cublas,-1,-1,-1,-1,-1,-1,81.08568703755736,0.0,1005.5680274963379,1035.1542580127716,4.805083371664376,1,-1,-1,torch_mm,0,torch_mm_cublas
2026-03-03T03:58:15.645983+00:00,TORCH,llm_style,tune,llm_style_tune_001,64,8192,1536,bf16,NVIDIA GeForce RTX 4060,torch_cublas,-1,-1,-1,-1,-1,-1,0.0,0.0,405.5039882659912,427.1718430519104,3.9718789028124557,1,-1,-1,torch_mm,0,torch_mm_cublas
2026-03-03T03:58:15.807861+00:00,TORCH,llm_style,tune,llm_style_tune_002,32,3072,8192,bf16,NVIDIA GeForce RTX 4060,torch_cublas,-1,-1,-1,-1,-1,-1,0.0,0.0,672.7679967880249,738.0351805686948,2.394009143849734,2,-1,-1,torch_mm,0,torch_mm_cublas
2026-03-03T03:58:15.927232+00:00,TORCH,llm_style,tune,llm_style_tune_003,4,6144,3072,bf16,NVIDIA GeForce RTX 4060,torch_cublas,-1,-1,-1,-1,-1,-1,0.0,0.0,575.296014547348,597.1340799331665,0.2624647836623815,5,-1,-1,torch_mm,0,torch_mm_cublas
2026-03-03T03:58:15.980230+00:00,TORCH,llm_style,tune,llm_style_tune_004,8,8192,1024,bf16,NVIDIA GeForce RTX 4060,torch_cublas,-1,-1,-1,-1,-1,-1,0.0,0.0,241.5200024843216,256.1843171715736,0.555720961491431,5,-1,-1,torch_mm,0,torch_mm_cublas
2026-03-03T03:58:16.135597+00:00,TORCH,llm_style,tune,llm_style_tune_005,32,8192,3072,bf16,NVIDIA GeForce RTX 4060,torch_cublas,-1,-1,-1,-1,-1,-1,0.0,0.0,802.8159737586975,870.1564788818357,2.0062041472085883,1,-1,-1,torch_mm,0,torch_mm_cublas
2026-03-03T03:58:16.453813+00:00,TORCH,llm_style,tune,llm_style_tune_006,32,6144,8192,bf16,NVIDIA GeForce RTX 4060,torch_cublas,-1,-1,-1,-1,-1,-1,0.0,0.0,1424.3839979171753,1513.9122772216797,2.2614867035225616,0,-1,-1,torch_mm,0,torch_mm_cublas
2026-03-03T03:58:16.481365+00:00,TORCH,llm_style,tune,llm_style_tune_007,8,1536,2048,bf16,NVIDIA GeForce RTX 4060,torch_cublas,-1,-1,-1,-1,-1,-1,0.0,0.0,96.76800295710564,149.1251145303249,0.5201269682325729,7,-1,-1,torch_mm,0,torch_mm_cublas
2026-03-03T03:58:16.523537+00:00,TORCH,llm_style,tune,llm_style_tune_008,16,1536,4096,bf16,NVIDIA GeForce RTX 4060,torch_cublas,-1,-1,-1,-1,-1,-1,0.0,0.0,194.5600062608719,239.60800543427456,1.0347789140696022,7,-1,-1,torch_mm,0,torch_mm_cublas
2026-03-03T03:58:16.542464+00:00,TORCH,llm_style,tune,llm_style_tune_009,64,1536,2048,bf16,NVIDIA GeForce RTX 4060,torch_cublas,-1,-1,-1,-1,-1,-1,0.0,0.0,106.33599758148193,147.47456483542908,3.786612183625395,3,-1,-1,torch_mm,0,torch_mm_cublas
2026-03-03T03:58:16.557328+00:00,TORCH,llm_style,tune,llm_style_tune_010,2,2048,1024,bf16,NVIDIA GeForce RTX 4060,torch_cublas,-1,-1,-1,-1,-1,-1,0.0,0.0,109.56799983978271,122.36255660653114,0.07656074777550338,7,-1,-1,torch_mm,0,torch_mm_cublas
2026-03-03T03:58:16.710584+00:00,TORCH,llm_style,tune,llm_style_tune_011,2,3072,8192,bf16,NVIDIA GeForce RTX 4060,torch_cublas,-1,-1,-1,-1,-1,-1,0.0,0.0,750.3840029239655,761.3542556762695,0.13414904316690232,6,-1,-1,torch_mm,0,torch_mm_cublas
2026-03-03T03:58:16.735505+00:00,TORCH,llm_style,tune,llm_style_tune_012,64,2048,1536,bf16,NVIDIA GeForce RTX 4060,torch_cublas,-1,-1,-1,-1,-1,-1,0.0,0.0,160.76800227165222,162.6592017710209,2.5045604741646943,3,-1,-1,torch_mm,0,torch_mm_cublas
2026-03-03T03:58:16.956066+00:00,TORCH,llm_style,tune,llm_style_tune_013,16,8192,4096,bf16,NVIDIA GeForce RTX 4060,torch_cublas,-1,-1,-1,-1,-1,-1,0.0,0.0,1032.1919918060303,1044.9238204956055,1.0402539765119372,5,-1,-1,torch_mm,0,torch_mm_cublas
2026-03-03T03:58:17.162862+00:00,TORCH,llm_style,tune,llm_style_tune_014,4,8192,4096,bf16,NVIDIA GeForce RTX 4060,torch_cublas,-1,-1,-1,-1,-1,-1,0.0,0.0,1029.1199684143066,1061.5910756587982,0.2608398090007057,5,-1,-1,torch_mm,0,torch_mm_cublas
2026-03-03T03:58:17.210033+00:00,TORCH,llm_style,tune,llm_style_tune_015,4,3072,2048,bf16,NVIDIA GeForce RTX 4060,torch_cublas,-1,-1,-1,-1,-1,-1,0.0,0.0,201.7280012369156,259.7376096248626,0.24950253654121604,7,-1,-1,torch_mm,0,torch_mm_cublas
2026-03-03T03:58:17.221862+00:00,TORCH,llm_style,tune,llm_style_tune_016,16,1536,1024,bf16,NVIDIA GeForce RTX 4060,torch_cublas,-1,-1,-1,-1,-1,-1,0.0,0.0,60.416001826524734,67.48767919838427,0.8330847205765054,7,-1,-1,torch_mm,0,torch_mm_cublas
2026-03-03T03:58:17.236603+00:00,TORCH,llm_style,tune,llm_style_tune_017,32,1024,2048,bf16,NVIDIA GeForce RTX 4060,torch_cublas,-1,-1,-1,-1,-1,-1,0.0,0.0,89.08800035715103,90.11200070381165,1.5065747066038666,3,-1,-1,torch_mm,0,torch_mm_cublas
2026-03-03T03:58:17.258304+00:00,TORCH,llm_style,tune,llm_style_tune_018,64,1536,2048,bf16,NVIDIA GeForce RTX 4060,torch_cublas,-1,-1,-1,-1,-1,-1,0.0,0.0,105.47199845314026,134.46272283792496,3.8176311239508105,3,-1,-1,torch_mm,0,torch_mm_cublas
2026-03-03T03:58:17.298884+00:00,TORCH,llm_style,tune,llm_style_tune_019,4,4096,1536,bf16,NVIDIA GeForce RTX 4060,torch_cublas,-1,-1,-1,-1,-1,-1,0.0,0.0,242.62400716543198,317.28608936071385,0.2074471054535078,7,-1,-1,torch_mm,0,torch_mm_cublas
2026-03-03T03:58:17.376352+00:00,TORCH,llm_style,tune,llm_style_tune_020,1,8192,1536,bf16,NVIDIA GeForce RTX 4060,torch_cublas,-1,-1,-1,-1,-1,-1,0.0,0.0,263.6000066995621,302.3465612530708,0.0954697396069596,5,-1,-1,torch_mm,0,torch_mm_cublas
2026-03-03T03:58:17.414748+00:00,TORCH,llm_style,tune,llm_style_tune_021,64,1536,4096,bf16,NVIDIA GeForce RTX 4060,torch_cublas,-1,-1,-1,-1,-1,-1,0.0,0.0,203.77600193023682,214.53824177384377,3.9519195605559996,3,-1,-1,torch_mm,0,torch_mm_cublas
2026-03-03T03:58:17.453354+00:00,TORCH,llm_style,tune,llm_style_tune_022,64,1024,6144,bf16,NVIDIA GeForce RTX 4060,torch_cublas,-1,-1,-1,-1,-1,-1,0.0,0.0,214.01600539684296,231.32416263222694,3.762832440997796,3,-1,-1,torch_mm,0,torch_mm_cublas
2026-03-03T03:58:17.479962+00:00,TORCH,llm_style,tune,llm_style_tune_023,8,4096,1024,bf16,NVIDIA GeForce RTX 4060,torch_cublas,-1,-1,-1,-1,-1,-1,0.0,0.0,166.35199636220932,208.51391926407808,0.4034148400231963,7,-1,-1,torch_mm,0,torch_mm_cublas
2026-03-03T03:58:17.600972+00:00,TORCH,llm_style,tune,llm_style_tune_024,8,4096,4096,bf16,NVIDIA GeForce RTX 4060,torch_cublas,-1,-1,-1,-1,-1,-1,0.0,0.0,505.8559775352478,525.7763409614563,0.5306558940114443,7,-1,-1,torch_mm,0,torch_mm_cublas
2026-03-03T03:58:17.642214+00:00,TORCH,llm_style,tune,llm_style_tune_025,32,6144,1024,bf16,NVIDIA GeForce RTX 4060,torch_cublas,-1,-1,-1,-1,-1,-1,0.0,0.0,222.20799326896667,257.2483202815055,1.8120553544292057,1,-1,-1,torch_mm,0,torch_mm_cublas
2026-03-03T03:58:17.670517+00:00,TORCH,llm_style,tune,llm_style_tune_026,1,3072,1536,bf16,NVIDIA GeForce RTX 4060,torch_cublas,-1,-1,-1,-1,-1,-1,0.0,0.0,90.11200070381165,163.9116795361041,0.10472727190930982,7,-1,-1,torch_mm,0,torch_mm_cublas
2026-03-03T03:58:17.727370+00:00,TORCH,llm_style,tune,llm_style_tune_027,1,6144,1536,bf16,NVIDIA GeForce RTX 4060,torch_cublas,-1,-1,-1,-1,-1,-1,0.0,0.0,179.19999361038208,198.1782394647598,0.10532571804124496,5,-1,-1,torch_mm,0,torch_mm_cublas
2026-03-03T03:58:17.763037+00:00,TORCH,llm_style,tune,llm_style_tune_028,4,4096,1536,bf16,NVIDIA GeForce RTX 4060,torch_cublas,-1,-1,-1,-1,-1,-1,0.0,0.0,242.5440028309822,253.3091226220131,0.20751553290342048,7,-1,-1,torch_mm,0,torch_mm_cublas
2026-03-03T03:58:17.800114+00:00,TORCH,llm_style,tune,llm_style_tune_029,16,1024,6144,bf16,NVIDIA GeForce RTX 4060,torch_cublas,-1,-1,-1,-1,-1,-1,0.0,0.0,199.5519995689392,210.91263666749,1.0088928822306675,7,-1,-1,torch_mm,0,torch_mm_cublas
2026-03-03T03:58:18.046116+00:00,TORCH,llm_style,tune,llm_style_tune_030,64,4096,8192,bf16,NVIDIA GeForce RTX 4060,torch_cublas,-1,-1,-1,-1,-1,-1,0.0,0.0,1426.2080192565918,1463.2652723789215,3.0114592247481147,2,-1,-1,torch_mm,0,torch_mm_cublas
2026-03-03T03:58:18.080474+00:00,TORCH,llm_style,tune,llm_style_tune_031,1,6144,1024,bf16,NVIDIA GeForce RTX 4060,torch_cublas,-1,-1,-1,-1,-1,-1,0.0,0.0,125.95200538635254,177.43872031569475,0.09990243475205052,5,-1,-1,torch_mm,0,torch_mm_cublas
2026-03-03T03:58:18.107037+00:00,TORCH,llm_style,tune,llm_style_tune_032,64,1024,4096,bf16,NVIDIA GeForce RTX 4060,torch_cublas,-1,-1,-1,-1,-1,-1,0.0,0.0,159.743994474411,175.7695960998535,3.360820629072225,3,-1,-1,torch_mm,0,torch_mm_cublas
2026-03-03T03:58:18.303182+00:00,TORCH,llm_style,tune,llm_style_tune_033,2,4096,8192,bf16,NVIDIA GeForce RTX 4060,torch_cublas,-1,-1,-1,-1,-1,-1,0.0,0.0,855.0400137901306,882.2067022323608,0.15697245255816028,6,-1,-1,torch_mm,0,torch_mm_cublas
2026-03-03T03:58:18.634597+00:00,TORCH,llm_style,tune,llm_style_tune_034,1,8192,6144,bf16,NVIDIA GeForce RTX 4060,torch_cublas,-1,-1,-1,-1,-1,-1,0.0,0.0,1952.7679681777954,2046.0237574577332,0.05154903072991968,5,-1,-1,torch_mm,0,torch_mm_cublas
2026-03-03T03:58:18.655231+00:00,TORCH,llm_style,tune,llm_style_tune_035,64,1536,1024,bf16,NVIDIA GeForce RTX 4060,torch_cublas,-1,-1,-1,-1,-1,-1,0.0,0.0,54.27199974656105,55.28031997382641,3.709584922983367,3,-1,-1,torch_mm,0,torch_mm_cublas
2026-03-03T03:58:18.686869+00:00,TORCH,llm_style,tune,llm_style_tune_036,32,3072,2048,bf16,NVIDIA GeForce RTX 4060,torch_cublas,-1,-1,-1,-1,-1,-1,0.0,0.0,156.67200088500977,235.61056017875646,2.5700392011686213,3,-1,-1,torch_mm,0,torch_mm_cublas
2026-03-03T03:58:18.742931+00:00,TORCH,llm_style,tune,llm_style_tune_037,4,1536,6144,bf16,NVIDIA GeForce RTX 4060,torch_cublas,-1,-1,-1,-1,-1,-1,0.0,0.0,228.35199534893036,233.86367991566658,0.3306188408147564,7,-1,-1,torch_mm,0,torch_mm_cublas
2026-03-03T03:58:18.773076+00:00,TORCH,llm_style,tune,llm_style_tune_038,1,4096,1536,bf16,NVIDIA GeForce RTX 4060,torch_cublas,-1,-1,-1,-1,-1,-1,0.0,0.0,143.36000382900238,153.9446386694908,0.08777142622714144,7,-1,-1,torch_mm,0,torch_mm_cublas
2026-03-03T03:58:18.804445+00:00,TORCH,llm_style,tune,llm_style_tune_039,4,1536,4096,bf16,NVIDIA GeForce RTX 4060,torch_cublas,-1,-1,-1,-1,-1,-1,0.0,0.0,157.69599378108978,226.9977612793444,0.31916884375559545,7,-1,-1,torch_mm,0,torch_mm_cublas
2026-03-03T03:58:19.095756+00:00,TORCH,llm_style,tune,llm_style_tune_040,2,6144,8192,bf16,NVIDIA GeForce RTX 4060,torch_cublas,-1,-1,-1,-1,-1,-1,0.0,0.0,1146.880030632019,1173.3628702163696,0.1755428524542829,4,-1,-1,torch_mm,0,torch_mm_cublas
2026-03-03T03:58:19.116645+00:00,TORCH,llm_style,tune,llm_style_tune_041,16,1024,1536,bf16,NVIDIA GeForce RTX 4060,torch_cublas,-1,-1,-1,-1,-1,-1,0.0,0.0,58.36800113320351,149.5068811625241,0.8623157727319891,7,-1,-1,torch_mm,0,torch_mm_cublas
2026-03-03T03:58:19.153946+00:00,TORCH,llm_style,tune,llm_style_tune_042,32,3072,2048,bf16,NVIDIA GeForce RTX 4060,torch_cublas,-1,-1,-1,-1,-1,-1,0.0,0.0,156.62399679422379,160.76800227165222,2.5708268990799352,3,-1,-1,torch_mm,0,torch_mm_cublas
2026-03-03T03:58:19.199717+00:00,TORCH,llm_style,tune,llm_style_tune_043,2,2048,4096,bf16,NVIDIA GeForce RTX 4060,torch_cublas,-1,-1,-1,-1,-1,-1,0.0,0.0,206.84799551963806,308.820806443691,0.16221782529584317,7,-1,-1,torch_mm,0,torch_mm_cublas
2026-03-03T03:58:19.306827+00:00,TORCH,llm_style,tune,llm_style_tune_044,64,2048,8192,bf16,NVIDIA GeForce RTX 4060,torch_cublas,-1,-1,-1,-1,-1,-1,0.0,0.0,467.45599806308746,534.8454231023786,4.593980303810708,2,-1,-1,torch_mm,0,torch_mm_cublas
2026-03-03T03:58:19.451082+00:00,TORCH,llm_style,tune,llm_style_tune_045,2,3072,8192,bf16,NVIDIA GeForce RTX 4060,torch_cublas,-1,-1,-1,-1,-1,-1,0.0,0.0,463.8719856739044,496.7014366388321,0.2170066292185295,6,-1,-1,torch_mm,0,torch_mm_cublas
2026-03-03T03:58:19.726255+00:00,TORCH,llm_style,tune,llm_style_tune_046,4,8192,6144,bf16,NVIDIA GeForce RTX 4060,torch_cublas,-1,-1,-1,-1,-1,-1,0.0,0.0,857.9680025577545,904.4214367866516,0.46931025725856856,5,-1,-1,torch_mm,0,torch_mm_cublas
2026-03-03T03:58:19.759423+00:00,TORCH,llm_style,tune,llm_style_tune_047,1,1024,6144,bf16,NVIDIA GeForce RTX 4060,torch_cublas,-1,-1,-1,-1,-1,-1,0.0,0.0,114.68800157308578,166.59456044435495,0.1097142842094205,7,-1,-1,torch_mm,0,torch_mm_cublas
2026-03-03T03:58:19.838095+00:00,TORCH,llm_style,tune,llm_style_tune_048,32,4096,3072,bf16,NVIDIA GeForce RTX 4060,torch_cublas,-1,-1,-1,-1,-1,-1,0.0,0.0,314.36800956726074,431.9129604101179,2.5616676744829543,3,-1,-1,torch_mm,0,torch_mm_cublas
2026-03-03T03:58:19.852238+00:00,TORCH,llm_style,tune,llm_style_tune_049,16,2048,1024,bf16,NVIDIA GeForce RTX 4060,torch_cublas,-1,-1,-1,-1,-1,-1,0.0,0.0,69.55200061202049,113.23904342949376,0.9648732374263543,7,-1,-1,torch_mm,0,torch_mm_cublas
2026-03-03T03:58:19.863263+00:00,TORCH,llm_style,tune,llm_style_tune_050,4,1024,1536,bf16,NVIDIA GeForce RTX 4060,torch_cublas,-1,-1,-1,-1,-1,-1,0.0,0.0,48.0320006608963,95.45375928282735,0.26196935015958994,7,-1,-1,torch_mm,0,torch_mm_cublas
2026-03-03T03:58:20.068964+00:00,TORCH,llm_style,tune,llm_style_tune_051,64,4096,8192,bf16,NVIDIA GeForce RTX 4060,torch_cublas,-1,-1,-1,-1,-1,-1,0.0,0.0,920.5759763717651,948.1648027896881,4.665521810516509,2,-1,-1,torch_mm,0,torch_mm_cublas
2026-03-03T03:58:20.088971+00:00,TORCH,llm_style,tune,llm_style_tune_052,16,2048,1536,bf16,NVIDIA GeForce RTX 4060,torch_cublas,-1,-1,-1,-1,-1,-1,0.0,0.0,102.11200267076492,136.29760131239888,0.9858125721475083,7,-1,-1,torch_mm,0,torch_mm_cublas
2026-03-03T03:58:20.099186+00:00,TORCH,llm_style,tune,llm_style_tune_053,64,1024,1024,bf16,NVIDIA GeForce RTX 4060,torch_cublas,-1,-1,-1,-1,-1,-1,0.0,0.0,42.479999363422394,124.97856490313995,3.159551083128518,3,-1,-1,torch_mm,0,torch_mm_cublas
2026-03-03T03:58:20.280237+00:00,TORCH,llm_style,tune,llm_style_tune_054,4,4096,8192,bf16,NVIDIA GeForce RTX 4060,torch_cublas,-1,-1,-1,-1,-1,-1,0.0,0.0,561.5519881248474,589.885430932045,0.4780242287029708,6,-1,-1,torch_mm,0,torch_mm_cublas
2026-03-03T03:58:20.350217+00:00,TORCH,llm_style,tune,llm_style_tune_055,1,4096,3072,bf16,NVIDIA GeForce RTX 4060,torch_cublas,-1,-1,-1,-1,-1,-1,0.0,0.0,241.66400730609894,263.8992071151733,0.10413559007206317,7,-1,-1,torch_mm,0,torch_mm_cublas
2026-03-03T03:58:20.367610+00:00,TORCH,llm_style,tune,llm_style_tune_056,64,1536,2048,bf16,NVIDIA GeForce RTX 4060,torch_cublas,-1,-1,-1,-1,-1,-1,0.0,0.0,69.40799951553345,77.84063972532748,5.801250386274087,3,-1,-1,torch_mm,0,torch_mm_cublas
2026-03-03T03:58:20.408653+00:00,TORCH,llm_style,tune,llm_style_tune_057,2,4096,2048,bf16,NVIDIA GeForce RTX 4060,torch_cublas,-1,-1,-1,-1,-1,-1,0.0,0.0,205.79200237989426,245.00575661659235,0.1630502235847735,7,-1,-1,torch_mm,0,torch_mm_cublas
2026-03-03T03:58:20.481374+00:00,TORCH,llm_style,tune,llm_style_tune_058,4,8192,1536,bf16,NVIDIA GeForce RTX 4060,torch_cublas,-1,-1,-1,-1,-1,-1,0.0,0.0,244.73600089550018,262.4892857670784,0.41131380602636475,5,-1,-1,torch_mm,0,torch_mm_cublas
2026-03-03T03:58:20.512457+00:00,TORCH,llm_style,tune,llm_style_tune_059,1,1536,4096,bf16,NVIDIA GeForce RTX 4060,torch_cublas,-1,-1,-1,-1,-1,-1,0.0,0.0,153.55200320482254,160.8124853670597,0.08194560629219334,7,-1,-1,torch_mm,0,torch_mm_cublas
2026-03-03T03:58:20.543201+00:00,TORCH,llm_style,tune,llm_style_tune_060,64,1536,4096,bf16,NVIDIA GeForce RTX 4060,torch_cublas,-1,-1,-1,-1,-1,-1,0.0,0.0,137.2160017490387,209.9200040102005,5.868895447579545,3,-1,-1,torch_mm,0,torch_mm_cublas
2026-03-03T03:58:20.811830+00:00,TORCH,llm_style,tune,llm_style_tune_061,8,8192,6144,bf16,NVIDIA GeForce RTX 4060,torch_cublas,-1,-1,-1,-1,-1,-1,0.0,0.0,941.5040016174316,967.1212899684906,0.8553403560861615,5,-1,-1,torch_mm,0,torch_mm_cublas
2026-03-03T03:58:20.867946+00:00,TORCH,llm_style,tune,llm_style_tune_062,64,6144,1536,bf16,NVIDIA GeForce RTX 4060,torch_cublas,-1,-1,-1,-1,-1,-1,0.0,0.0,193.4720054268837,241.95072740316385,6.243588313124238,1,-1,-1,torch_mm,0,torch_mm_cublas
2026-03-03T03:58:20.879307+00:00,TORCH,llm_style,tune,llm_style_tune_063,2,1536,1024,bf16,NVIDIA GeForce RTX 4060,torch_cublas,-1,-1,-1,-1,-1,-1,0.0,0.0,50.623999908566475,139.15136225521556,0.12427812917515778,7,-1,-1,torch_mm,0,torch_mm_cublas
2026-03-03T03:58:20.889668+00:00,TORCH,llm_style,eval,llm_style_eval_000,32,1536,1024,bf16,NVIDIA GeForce RTX 4060,torch_cublas,-1,-1,-1,-1,-1,-1,0.0,0.0,39.93599861860275,79.88640055060385,2.5206154718041685,3,-1,-1,torch_mm,0,torch_mm_cublas
2026-03-03T03:58:20.997548+00:00,TORCH,llm_style,eval,llm_style_eval_001,32,2048,8192,bf16,NVIDIA GeForce RTX 4060,torch_cublas,-1,-1,-1,-1,-1,-1,0.0,0.0,464.89599347114563,497.24416077136993,2.3096387989556706,2,-1,-1,torch_mm,0,torch_mm_cublas
2026-03-03T03:58:21.039522+00:00,TORCH,llm_style,eval,llm_style_eval_002,16,2048,4096,bf16,NVIDIA GeForce RTX 4060,torch_cublas,-1,-1,-1,-1,-1,-1,0.0,0.0,194.5600062608719,214.07136127352712,1.3797052187594694,7,-1,-1,torch_mm,0,torch_mm_cublas
2026-03-03T03:58:21.059073+00:00,TORCH,llm_style,eval,llm_style_eval_003,16,2048,1536,bf16,NVIDIA GeForce RTX 4060,torch_cublas,-1,-1,-1,-1,-1,-1,0.0,0.0,111.61600053310394,153.6307233572005,0.9018715553254795,7,-1,-1,torch_mm,0,torch_mm_cublas
2026-03-03T03:58:21.157091+00:00,TORCH,llm_style,eval,llm_style_eval_004,64,8192,2048,bf16,NVIDIA GeForce RTX 4060,torch_cublas,-1,-1,-1,-1,-1,-1,0.0,0.0,419.840008020401,441.54880791902536,5.115004780334439,1,-1,-1,torch_mm,0,torch_mm_cublas
2026-03-03T03:58:21.308972+00:00,TORCH,llm_style,eval,llm_style_eval_005,64,3072,8192,bf16,NVIDIA GeForce RTX 4060,torch_cublas,-1,-1,-1,-1,-1,-1,0.0,0.0,571.3919997215271,599.5622158050537,5.637505379091573,2,-1,-1,torch_mm,0,torch_mm_cublas
2026-03-03T03:58:21.334893+00:00,TORCH,llm_style,eval,llm_style_eval_006,32,2048,2048,bf16,NVIDIA GeForce RTX 4060,torch_cublas,-1,-1,-1,-1,-1,-1,0.0,0.0,124.92799758911133,130.048006772995,2.1487213529419185,3,-1,-1,torch_mm,0,torch_mm_cublas
2026-03-03T03:58:21.434823+00:00,TORCH,llm_style,eval,llm_style_eval_007,8,8192,2048,bf16,NVIDIA GeForce RTX 4060,torch_cublas,-1,-1,-1,-1,-1,-1,0.0,0.0,384.0000033378601,410.84927737712854,0.6990506605902779,5,-1,-1,torch_mm,0,torch_mm_cublas
2026-03-03T03:58:21.542320+00:00,TORCH,llm_style,eval,llm_style_eval_008,64,1536,8192,bf16,NVIDIA GeForce RTX 4060,torch_cublas,-1,-1,-1,-1,-1,-1,0.0,0.0,293.88800263404846,350.8761581778525,5.480362320218791,2,-1,-1,torch_mm,0,torch_mm_cublas
2026-03-03T03:58:21.733802+00:00,TORCH,llm_style,eval,llm_style_eval_009,64,4096,6144,bf16,NVIDIA GeForce RTX 4060,torch_cublas,-1,-1,-1,-1,-1,-1,0.0,0.0,1162.2400283813477,1300.5926442146301,2.771566452143455,3,-1,-1,torch_mm,0,torch_mm_cublas
2026-03-03T03:58:21.786085+00:00,TORCH,llm_style,eval,llm_style_eval_010,64,2048,4096,bf16,NVIDIA GeForce RTX 4060,torch_cublas,-1,-1,-1,-1,-1,-1,0.0,0.0,299.00801181793213,348.8671940565108,3.5910135566996386,3,-1,-1,torch_mm,0,torch_mm_cublas
2026-03-03T03:58:21.896470+00:00,TORCH,llm_style,eval,llm_style_eval_011,32,3072,6144,bf16,NVIDIA GeForce RTX 4060,torch_cublas,-1,-1,-1,-1,-1,-1,0.0,0.0,370.6879913806915,431.90016329288466,3.258696208368514,3,-1,-1,torch_mm,0,torch_mm_cublas
2026-03-03T03:58:21.911772+00:00,TORCH,llm_style,eval,llm_style_eval_012,16,1536,1536,bf16,NVIDIA GeForce RTX 4060,torch_cublas,-1,-1,-1,-1,-1,-1,0.0,0.0,57.34400078654289,186.05055958032605,1.3165714105130462,7,-1,-1,torch_mm,0,torch_mm_cublas
2026-03-03T03:58:21.947175+00:00,TORCH,llm_style,eval,llm_style_eval_013,64,2048,3072,bf16,NVIDIA GeForce RTX 4060,torch_cublas,-1,-1,-1,-1,-1,-1,0.0,0.0,191.48799777030945,208.23103845119476,4.205518765546695,3,-1,-1,torch_mm,0,torch_mm_cublas
2026-03-03T03:58:22.235882+00:00,TORCH,llm_style,eval,llm_style_eval_014,16,8192,6144,bf16,NVIDIA GeForce RTX 4060,torch_cublas,-1,-1,-1,-1,-1,-1,0.0,0.0,993.2639896869659,1079.7241854667661,1.621535415280278,5,-1,-1,torch_mm,0,torch_mm_cublas
2026-03-03T03:58:22.295440+00:00,TORCH,llm_style,eval,llm_style_eval_015,64,6144,1536,bf16,NVIDIA GeForce RTX 4060,torch_cublas,-1,-1,-1,-1,-1,-1,0.0,0.0,199.00799542665482,240.855035483837,6.069904625742528,1,-1,-1,torch_mm,0,torch_mm_cublas
2026-03-03T03:58:22.393342+00:00,TORCH,llm_style,eval,llm_style_eval_016,16,4096,4096,bf16,NVIDIA GeForce RTX 4060,torch_cublas,-1,-1,-1,-1,-1,-1,0.0,0.0,351.1039912700653,468.5107257962227,1.529093731056577,7,-1,-1,torch_mm,0,torch_mm_cublas
2026-03-03T03:58:22.592191+00:00,TORCH,llm_style,eval,llm_style_eval_017,64,8192,4096,bf16,NVIDIA GeForce RTX 4060,torch_cublas,-1,-1,-1,-1,-1,-1,0.0,0.0,746.4960217475891,856.5958499908445,5.753503261739078,1,-1,-1,torch_mm,0,torch_mm_cublas
2026-03-03T03:58:22.752266+00:00,TORCH,llm_style,eval,llm_style_eval_018,32,4096,6144,bf16,NVIDIA GeForce RTX 4060,torch_cublas,-1,-1,-1,-1,-1,-1,0.0,0.0,734.2079877853394,797.9110604524611,2.1936736766624434,3,-1,-1,torch_mm,0,torch_mm_cublas
2026-03-03T03:58:22.891310+00:00,TORCH,llm_style,eval,llm_style_eval_019,16,3072,8192,bf16,NVIDIA GeForce RTX 4060,torch_cublas,-1,-1,-1,-1,-1,-1,0.0,0.0,493.5680031776428,514.1395229101181,1.6316016492466137,6,-1,-1,torch_mm,0,torch_mm_cublas
2026-03-03T03:58:22.904976+00:00,TORCH,llm_style,eval,llm_style_eval_020,4,1536,1536,bf16,NVIDIA GeForce RTX 4060,torch_cublas,-1,-1,-1,-1,-1,-1,0.0,0.0,50.09600147604942,59.996159784495816,0.3767639620703803,7,-1,-1,torch_mm,0,torch_mm_cublas
2026-03-03T03:58:22.962448+00:00,TORCH,llm_style,eval,llm_style_eval_021,4,6144,1536,bf16,NVIDIA GeForce RTX 4060,torch_cublas,-1,-1,-1,-1,-1,-1,0.0,0.0,211.96800470352173,275.80862820148457,0.35617390514006025,5,-1,-1,torch_mm,0,torch_mm_cublas
2026-03-03T03:58:22.996595+00:00,TORCH,llm_style,eval,llm_style_eval_022,32,6144,1024,bf16,NVIDIA GeForce RTX 4060,torch_cublas,-1,-1,-1,-1,-1,-1,0.0,0.0,151.5520066022873,163.8243193924427,2.656864749119877,1,-1,-1,torch_mm,0,torch_mm_cublas
2026-03-03T03:58:23.010538+00:00,TORCH,llm_style,eval,llm_style_eval_023,16,1024,1536,bf16,NVIDIA GeForce RTX 4060,torch_cublas,-1,-1,-1,-1,-1,-1,0.0,0.0,50.543999299407005,52.22399905323982,0.9957986842681542,7,-1,-1,torch_mm,0,torch_mm_cublas
2026-03-03T03:58:23.053075+00:00,TORCH,llm_style,eval,llm_style_eval_024,32,8192,1024,bf16,NVIDIA GeForce RTX 4060,torch_cublas,-1,-1,-1,-1,-1,-1,0.0,0.0,205.61599731445312,210.29536306858063,2.611036684946995,1,-1,-1,torch_mm,0,torch_mm_cublas
2026-03-03T03:58:23.272080+00:00,TORCH,llm_style,eval,llm_style_eval_025,32,6144,6144,bf16,NVIDIA GeForce RTX 4060,torch_cublas,-1,-1,-1,-1,-1,-1,0.0,0.0,872.4480271339417,939.5577448606489,2.7691266744409737,1,-1,-1,torch_mm,0,torch_mm_cublas
2026-03-03T03:58:23.349292+00:00,TORCH,llm_style,eval,llm_style_eval_026,1,6144,2048,bf16,NVIDIA GeForce RTX 4060,torch_cublas,-1,-1,-1,-1,-1,-1,0.0,0.0,182.24000185728073,209.66399997472757,0.13809165794295997,5,-1,-1,torch_mm,0,torch_mm_cublas
2026-03-03T03:58:23.427448+00:00,TORCH,llm_style,eval,llm_style_eval_027,32,4096,3072,bf16,NVIDIA GeForce RTX 4060,torch_cublas,-1,-1,-1,-1,-1,-1,0.0,0.0,329.21600341796875,355.80320090055466,2.4461337226598685,3,-1,-1,torch_mm,0,torch_mm_cublas
2026-03-03T03:58:23.443058+00:00,TORCH,llm_style,eval,llm_style_eval_028,64,1536,1536,bf16,NVIDIA GeForce RTX 4060,torch_cublas,-1,-1,-1,-1,-1,-1,0.0,0.0,61.43999844789505,76.29824347794056,4.9152001241684,3,-1,-1,torch_mm,0,torch_mm_cublas
2026-03-03T03:58:23.459921+00:00,TORCH,llm_style,eval,llm_style_eval_029,2,3072,1024,bf16,NVIDIA GeForce RTX 4060,torch_cublas,-1,-1,-1,-1,-1,-1,0.0,0.0,72.7040022611618,92.74848148226737,0.17307041715256086,7,-1,-1,torch_mm,0,torch_mm_cublas
2026-03-03T03:58:23.560470+00:00,TORCH,llm_style,eval,llm_style_eval_030,32,1536,8192,bf16,NVIDIA GeForce RTX 4060,torch_cublas,-1,-1,-1,-1,-1,-1,0.0,0.0,259.7920000553131,347.5558421015737,3.099812033582788,2,-1,-1,torch_mm,0,torch_mm_cublas
2026-03-03T03:58:23.590398+00:00,TORCH,llm_style,eval,llm_style_eval_031,8,3072,2048,bf16,NVIDIA GeForce RTX 4060,torch_cublas,-1,-1,-1,-1,-1,-1,0.0,0.0,132.9919993877411,137.2160017490387,0.7569124192690266,7,-1,-1,torch_mm,0,torch_mm_cublas
2026-03-03T03:58:23.623974+00:00,TORCH,llm_style,eval,llm_style_eval_032,8,2048,3072,bf16,NVIDIA GeForce RTX 4060,torch_cublas,-1,-1,-1,-1,-1,-1,0.0,0.0,192.36800074577332,200.21183669567108,0.5232850349837186,7,-1,-1,torch_mm,0,torch_mm_cublas
2026-03-03T03:58:23.706474+00:00,TORCH,llm_style,eval,llm_style_eval_033,64,1536,8192,bf16,NVIDIA GeForce RTX 4060,torch_cublas,-1,-1,-1,-1,-1,-1,0.0,0.0,311.2959861755371,317.4604833126068,5.173894966611581,2,-1,-1,torch_mm,0,torch_mm_cublas
2026-03-03T03:58:23.785815+00:00,TORCH,llm_style,eval,llm_style_eval_034,64,6144,2048,bf16,NVIDIA GeForce RTX 4060,torch_cublas,-1,-1,-1,-1,-1,-1,0.0,0.0,308.22399258613586,322.0991936326027,5.22546191971055,1,-1,-1,torch_mm,0,torch_mm_cublas
2026-03-03T03:58:23.829626+00:00,TORCH,llm_style,eval,llm_style_eval_035,4,4096,2048,bf16,NVIDIA GeForce RTX 4060,torch_cublas,-1,-1,-1,-1,-1,-1,0.0,0.0,258.04799795150757,263.16800713539124,0.2600634941279843,7,-1,-1,torch_mm,0,torch_mm_cublas
2026-03-03T03:58:24.044968+00:00,TORCH,llm_style,eval,llm_style_eval_036,64,8192,4096,bf16,NVIDIA GeForce RTX 4060,torch_cublas,-1,-1,-1,-1,-1,-1,0.0,0.0,885.6959939002991,920.1356822252274,4.84925677159998,1,-1,-1,torch_mm,0,torch_mm_cublas
2026-03-03T03:58:24.080151+00:00,TORCH,llm_style,eval,llm_style_eval_037,32,6144,1024,bf16,NVIDIA GeForce RTX 4060,torch_cublas,-1,-1,-1,-1,-1,-1,0.0,0.0,186.36800348758698,204.29823830723763,2.1605274320965653,1,-1,-1,torch_mm,0,torch_mm_cublas
2026-03-03T03:58:24.156873+00:00,TORCH,llm_style,eval,llm_style_eval_038,64,6144,2048,bf16,NVIDIA GeForce RTX 4060,torch_cublas,-1,-1,-1,-1,-1,-1,0.0,0.0,318.4640109539032,336.6399985551834,5.057440340513489,1,-1,-1,torch_mm,0,torch_mm_cublas
2026-03-03T03:58:24.175442+00:00,TORCH,llm_style,eval,llm_style_eval_039,8,1024,3072,bf16,NVIDIA GeForce RTX 4060,torch_cublas,-1,-1,-1,-1,-1,-1,0.0,0.0,103.42399775981903,106.49599879980087,0.48665347588752955,7,-1,-1,torch_mm,0,torch_mm_cublas
2026-03-03T03:58:24.276881+00:00,TORCH,llm_style,eval,llm_style_eval_040,32,8192,2048,bf16,NVIDIA GeForce RTX 4060,torch_cublas,-1,-1,-1,-1,-1,-1,0.0,0.0,489.47200179100037,500.08734941482544,2.193673632140612,1,-1,-1,torch_mm,0,torch_mm_cublas
2026-03-03T03:58:24.296736+00:00,TORCH,llm_style,eval,llm_style_eval_041,32,3072,1024,bf16,NVIDIA GeForce RTX 4060,torch_cublas,-1,-1,-1,-1,-1,-1,0.0,0.0,95.23200243711472,266.2707163393494,2.114064462027285,3,-1,-1,torch_mm,0,torch_mm_cublas
2026-03-03T03:58:24.322869+00:00,TORCH,llm_style,eval,llm_style_eval_042,64,1024,4096,bf16,NVIDIA GeForce RTX 4060,torch_cublas,-1,-1,-1,-1,-1,-1,0.0,0.0,139.26400244235992,204.44160580635068,3.8550587559208336,3,-1,-1,torch_mm,0,torch_mm_cublas
2026-03-03T03:58:24.334634+00:00,TORCH,llm_style,eval,llm_style_eval_043,2,1536,1024,bf16,NVIDIA GeForce RTX 4060,torch_cublas,-1,-1,-1,-1,-1,-1,0.0,0.0,63.48799914121628,86.06175921857356,0.09909677553400166,7,-1,-1,torch_mm,0,torch_mm_cublas
2026-03-03T03:58:24.452043+00:00,TORCH,llm_style,eval,llm_style_eval_044,64,6144,3072,bf16,NVIDIA GeForce RTX 4060,torch_cublas,-1,-1,-1,-1,-1,-1,0.0,0.0,483.3119958639145,532.2444772720337,4.99867399252438,1,-1,-1,torch_mm,0,torch_mm_cublas
2026-03-03T03:58:24.518513+00:00,TORCH,llm_style,eval,llm_style_eval_045,64,1536,6144,bf16,NVIDIA GeForce RTX 4060,torch_cublas,-1,-1,-1,-1,-1,-1,0.0,0.0,251.90401077270508,265.2569678425789,4.795316868098426,3,-1,-1,torch_mm,0,torch_mm_cublas
2026-03-03T03:58:24.640677+00:00,TORCH,llm_style,eval,llm_style_eval_046,2,6144,3072,bf16,NVIDIA GeForce RTX 4060,torch_cublas,-1,-1,-1,-1,-1,-1,0.0,0.0,536.9439721107483,692.3059159517288,0.14060586564221295,5,-1,-1,torch_mm,0,torch_mm_cublas
2026-03-03T03:58:24.843932+00:00,TORCH,llm_style,eval,llm_style_eval_047,16,4096,8192,bf16,NVIDIA GeForce RTX 4060,torch_cublas,-1,-1,-1,-1,-1,-1,0.0,0.0,871.3119924068451,906.6505527496338,1.2323276086605652,6,-1,-1,torch_mm,0,torch_mm_cublas
2026-03-03T03:58:24.882380+00:00,TORCH,llm_style,eval,llm_style_eval_048,16,1024,6144,bf16,NVIDIA GeForce RTX 4060,torch_cublas,-1,-1,-1,-1,-1,-1,0.0,0.0,184.32000279426575,264.56480368971813,1.0922666501080551,7,-1,-1,torch_mm,0,torch_mm_cublas
2026-03-03T03:58:24.963467+00:00,TORCH,llm_style,eval,llm_style_eval_049,16,8192,1536,bf16,NVIDIA GeForce RTX 4060,torch_cublas,-1,-1,-1,-1,-1,-1,0.0,0.0,360.4480028152466,454.7424036264417,1.1170909003659715,5,-1,-1,torch_mm,0,torch_mm_cublas
2026-03-03T03:58:24.973861+00:00,TORCH,llm_style,eval,llm_style_eval_050,1,1024,1024,bf16,NVIDIA GeForce RTX 4060,torch_cublas,-1,-1,-1,-1,-1,-1,0.0,0.0,42.399998754262924,626.7904229462126,0.04946113352866905,7,-1,-1,torch_mm,0,torch_mm_cublas
2026-03-03T03:58:25.008912+00:00,TORCH,llm_style,eval,llm_style_eval_051,16,6144,1024,bf16,NVIDIA GeForce RTX 4060,torch_cublas,-1,-1,-1,-1,-1,-1,0.0,0.0,203.77600193023682,271.0224017500877,0.9879798901389999,5,-1,-1,torch_mm,0,torch_mm_cublas
2026-03-03T03:58:25.442782+00:00,TORCH,llm_style,eval,llm_style_eval_052,16,8192,8192,bf16,NVIDIA GeForce RTX 4060,torch_cublas,-1,-1,-1,-1,-1,-1,0.0,0.0,2004.9920082092285,2066.0735964775085,1.0710684327954199,4,-1,-1,torch_mm,0,torch_mm_cublas
2026-03-03T03:58:25.760836+00:00,TORCH,llm_style,eval,llm_style_eval_053,1,6144,8192,bf16,NVIDIA GeForce RTX 4060,torch_cublas,-1,-1,-1,-1,-1,-1,0.0,0.0,1216.4959907531738,1269.5907545089722,0.08274856371509778,4,-1,-1,torch_mm,0,torch_mm_cublas
2026-03-03T03:58:25.856287+00:00,TORCH,llm_style,eval,llm_style_eval_054,64,4096,3072,bf16,NVIDIA GeForce RTX 4060,torch_cublas,-1,-1,-1,-1,-1,-1,0.0,0.0,467.9679870605469,491.96062713861465,3.4417156312694845,3,-1,-1,torch_mm,0,torch_mm_cublas
2026-03-03T03:58:25.898109+00:00,TORCH,llm_style,eval,llm_style_eval_055,4,8192,1024,bf16,NVIDIA GeForce RTX 4060,torch_cublas,-1,-1,-1,-1,-1,-1,0.0,0.0,122.3679967224598,279.01952505111683,0.5484184247308401,5,-1,-1,torch_mm,0,torch_mm_cublas
2026-03-03T03:58:25.917071+00:00,TORCH,llm_style,eval,llm_style_eval_056,64,1024,3072,bf16,NVIDIA GeForce RTX 4060,torch_cublas,-1,-1,-1,-1,-1,-1,0.0,0.0,56.32000043988228,61.232320591807365,7.149381762342217,3,-1,-1,torch_mm,0,torch_mm_cublas
2026-03-03T03:58:25.922583+00:00,TORCH,llm_style,eval,llm_style_eval_057,64,1024,3072,bf16,NVIDIA GeForce RTX 4060,torch_cublas,-1,-1,-1,-1,-1,-1,0.0,0.0,56.11199885606766,60.77504076063633,7.175883807540733,3,-1,-1,torch_mm,0,torch_mm_cublas
2026-03-03T03:58:25.964205+00:00,TORCH,llm_style,eval,llm_style_eval_058,32,2048,4096,bf16,NVIDIA GeForce RTX 4060,torch_cublas,-1,-1,-1,-1,-1,-1,0.0,0.0,166.9120043516159,256.5119972825049,3.216490713687859,3,-1,-1,torch_mm,0,torch_mm_cublas
2026-03-03T03:58:26.058009+00:00,TORCH,llm_style,eval,llm_style_eval_059,64,8192,2048,bf16,NVIDIA GeForce RTX 4060,torch_cublas,-1,-1,-1,-1,-1,-1,0.0,0.0,273.376002907753,381.71038717031473,7.855421197026716,1,-1,-1,torch_mm,0,torch_mm_cublas
2026-03-03T03:58:26.157563+00:00,TORCH,llm_style,eval,llm_style_eval_060,1,3072,6144,bf16,NVIDIA GeForce RTX 4060,torch_cublas,-1,-1,-1,-1,-1,-1,0.0,0.0,262.14399933815,293.4681588411331,0.14400000036356503,7,-1,-1,torch_mm,0,torch_mm_cublas
2026-03-03T03:58:26.186110+00:00,TORCH,llm_style,eval,llm_style_eval_061,64,1536,4096,bf16,NVIDIA GeForce RTX 4060,torch_cublas,-1,-1,-1,-1,-1,-1,0.0,0.0,98.30400347709656,130.55999554693688,8.191999710241964,3,-1,-1,torch_mm,0,torch_mm_cublas
2026-03-03T03:58:26.253882+00:00,TORCH,llm_style,eval,llm_style_eval_062,16,6144,2048,bf16,NVIDIA GeForce RTX 4060,torch_cublas,-1,-1,-1,-1,-1,-1,0.0,0.0,191.48799777030945,214.8864017426967,2.1027593827733475,5,-1,-1,torch_mm,0,torch_mm_cublas
2026-03-03T03:58:26.311237+00:00,TORCH,llm_style,eval,llm_style_eval_063,64,1536,6144,bf16,NVIDIA GeForce RTX 4060,torch_cublas,-1,-1,-1,-1,-1,-1,0.0,0.0,133.12000036239624,147.51743778586388,9.0742153599124,3,-1,-1,torch_mm,0,torch_mm_cublas
2026-03-03T03:58:26.382794+00:00,TORCH,llm_style,eval,llm_style_eval_064,1,6144,2048,bf16,NVIDIA GeForce RTX 4060,torch_cublas,-1,-1,-1,-1,-1,-1,0.0,0.0,115.50400033593178,133.18144023418427,0.21787837587276399,5,-1,-1,torch_mm,0,torch_mm_cublas
2026-03-03T03:58:26.435090+00:00,TORCH,llm_style,eval,llm_style_eval_065,8,1536,6144,bf16,NVIDIA GeForce RTX 4060,torch_cublas,-1,-1,-1,-1,-1,-1,0.0,0.0,128.00000607967377,135.7311974465847,1.1796479439697292,7,-1,-1,torch_mm,0,torch_mm_cublas
2026-03-03T03:58:26.464620+00:00,TORCH,llm_style,eval,llm_style_eval_066,64,1536,4096,bf16,NVIDIA GeForce RTX 4060,torch_cublas,-1,-1,-1,-1,-1,-1,0.0,0.0,97.680002450943,137.87135802209363,8.244331979869084,3,-1,-1,torch_mm,0,torch_mm_cublas
2026-03-03T03:58:26.558473+00:00,TORCH,llm_style,eval,llm_style_eval_067,64,8192,2048,bf16,NVIDIA GeForce RTX 4060,torch_cublas,-1,-1,-1,-1,-1,-1,0.0,0.0,274.4159996509552,290.8364740014076,7.825650292736221,1,-1,-1,torch_mm,0,torch_mm_cublas
2026-03-03T03:58:26.579808+00:00,TORCH,llm_style,eval,llm_style_eval_068,64,1024,4096,bf16,NVIDIA GeForce RTX 4060,torch_cublas,-1,-1,-1,-1,-1,-1,0.0,0.0,81.91999793052673,114.71231788396824,6.5536001655578655,3,-1,-1,torch_mm,0,torch_mm_cublas
2026-03-03T03:58:26.622257+00:00,TORCH,llm_style,eval,llm_style_eval_069,64,2048,4096,bf16,NVIDIA GeForce RTX 4060,torch_cublas,-1,-1,-1,-1,-1,-1,0.0,0.0,166.9120043516159,172.5542426109314,6.432981427375718,3,-1,-1,torch_mm,0,torch_mm_cublas
2026-03-03T03:58:26.658712+00:00,TORCH,llm_style,eval,llm_style_eval_070,64,8192,1024,bf16,NVIDIA GeForce RTX 4060,torch_cublas,-1,-1,-1,-1,-1,-1,0.0,0.0,138.2399946451187,186.04031562805162,7.7672299305019825,1,-1,-1,torch_mm,0,torch_mm_cublas
2026-03-03T03:58:26.726521+00:00,TORCH,llm_style,eval,llm_style_eval_071,64,6144,2048,bf16,NVIDIA GeForce RTX 4060,torch_cublas,-1,-1,-1,-1,-1,-1,0.0,0.0,174.0799993276596,179.16863337159157,9.252141212204666,1,-1,-1,torch_mm,0,torch_mm_cublas
2026-03-03T03:58:26.736951+00:00,TORCH,llm_style,eval,llm_style_eval_072,64,1536,1024,bf16,NVIDIA GeForce RTX 4060,torch_cublas,-1,-1,-1,-1,-1,-1,0.0,0.0,33.79200026392937,51.75104003399608,5.957818135285181,3,-1,-1,torch_mm,0,torch_mm_cublas
2026-03-03T03:58:26.764306+00:00,TORCH,llm_style,eval,llm_style_eval_073,1,4096,1536,bf16,NVIDIA GeForce RTX 4060,torch_cublas,-1,-1,-1,-1,-1,-1,0.0,0.0,110.59200018644333,117.86239884793757,0.11377777758596365,7,-1,-1,torch_mm,0,torch_mm_cublas
2026-03-03T03:58:26.775667+00:00,TORCH,llm_style,eval,llm_style_eval_074,8,1024,2048,bf16,NVIDIA GeForce RTX 4060,torch_cublas,-1,-1,-1,-1,-1,-1,0.0,0.0,39.93599861860275,50.80064039677379,0.8402051572680562,7,-1,-1,torch_mm,0,torch_mm_cublas
2026-03-03T03:58:26.802775+00:00,TORCH,llm_style,eval,llm_style_eval_075,2,6144,1024,bf16,NVIDIA GeForce RTX 4060,torch_cublas,-1,-1,-1,-1,-1,-1,0.0,0.0,101.24800354242325,102.39999741315842,0.24855624920500713,5,-1,-1,torch_mm,0,torch_mm_cublas
2026-03-03T03:58:26.832062+00:00,TORCH,llm_style,eval,llm_style_eval_076,64,1024,6144,bf16,NVIDIA GeForce RTX 4060,torch_cublas,-1,-1,-1,-1,-1,-1,0.0,0.0,102.12800279259682,150.7372780144214,7.885265020167183,3,-1,-1,torch_mm,0,torch_mm_cublas
2026-03-03T03:58:27.011896+00:00,TORCH,llm_style,eval,llm_style_eval_077,1,4096,8192,bf16,NVIDIA GeForce RTX 4060,torch_cublas,-1,-1,-1,-1,-1,-1,0.0,0.0,524.2879986763,550.3939348459244,0.12800000032316894,6,-1,-1,torch_mm,0,torch_mm_cublas
2026-03-03T03:58:27.117208+00:00,TORCH,llm_style,eval,llm_style_eval_078,64,6144,3072,bf16,NVIDIA GeForce RTX 4060,torch_cublas,-1,-1,-1,-1,-1,-1,0.0,0.0,279.55201268196106,341.6515159606933,8.642109498057977,1,-1,-1,torch_mm,0,torch_mm_cublas
2026-03-03T03:58:27.186344+00:00,TORCH,llm_style,eval,llm_style_eval_079,2,3072,4096,bf16,NVIDIA GeForce RTX 4060,torch_cublas,-1,-1,-1,-1,-1,-1,0.0,0.0,167.67999529838562,223.6668771505355,0.300164893912569,7,-1,-1,torch_mm,0,torch_mm_cublas
2026-03-03T03:58:27.196113+00:00,TORCH,llm_style,eval,llm_style_eval_080,4,1536,1024,bf16,NVIDIA GeForce RTX 4060,torch_cublas,-1,-1,-1,-1,-1,-1,0.0,0.0,25.599999353289604,35.840000957250595,0.4915200124168399,7,-1,-1,torch_mm,0,torch_mm_cublas
2026-03-03T03:58:27.324830+00:00,TORCH,llm_style,eval,llm_style_eval_081,4,4096,6144,bf16,NVIDIA GeForce RTX 4060,torch_cublas,-1,-1,-1,-1,-1,-1,0.0,0.0,359.42399501800537,492.1110334992408,0.5601367599008367,7,-1,-1,torch_mm,0,torch_mm_cublas
2026-03-03T03:58:27.353178+00:00,TORCH,llm_style,eval,llm_style_eval_082,64,6144,1024,bf16,NVIDIA GeForce RTX 4060,torch_cublas,-1,-1,-1,-1,-1,-1,0.0,0.0,98.30400347709656,101.30719989538193,8.191999710241964,1,-1,-1,torch_mm,0,torch_mm_cublas
2026-03-03T03:58:27.445143+00:00,TORCH,llm_style,eval,llm_style_eval_083,8,4096,4096,bf16,NVIDIA GeForce RTX 4060,torch_cublas,-1,-1,-1,-1,-1,-1,0.0,0.0,254.97600436210632,282.20416247844696,1.0527871305833905,7,-1,-1,torch_mm,0,torch_mm_cublas
2026-03-03T03:58:27.489443+00:00,TORCH,llm_style,eval,llm_style_eval_084,64,1024,8192,bf16,NVIDIA GeForce RTX 4060,torch_cublas,-1,-1,-1,-1,-1,-1,0.0,0.0,122.5920021533966,174.49983537197096,8.75866129224687,2,-1,-1,torch_mm,0,torch_mm_cublas
2026-03-03T03:58:27.628826+00:00,TORCH,llm_style,eval,llm_style_eval_085,1,3072,8192,bf16,NVIDIA GeForce RTX 4060,torch_cublas,-1,-1,-1,-1,-1,-1,0.0,0.0,345.5680012702942,392.17054963111866,0.1456490410425238,6,-1,-1,torch_mm,0,torch_mm_cublas
2026-03-03T03:58:27.638348+00:00,TORCH,llm_style,eval,llm_style_eval_086,8,1536,1024,bf16,NVIDIA GeForce RTX 4060,torch_cublas,-1,-1,-1,-1,-1,-1,0.0,0.0,26.448000222444534,30.719999223947525,0.9515208631404789,7,-1,-1,torch_mm,0,torch_mm_cublas
2026-03-03T03:58:27.654263+00:00,TORCH,llm_style,eval,llm_style_eval_087,16,1024,3072,bf16,NVIDIA GeForce RTX 4060,torch_cublas,-1,-1,-1,-1,-1,-1,0.0,0.0,61.32799945771694,77.75904290378092,1.641392135567753,7,-1,-1,torch_mm,0,torch_mm_cublas
2026-03-03T03:58:27.684479+00:00,TORCH,llm_style,eval,llm_style_eval_088,8,4096,1536,bf16,NVIDIA GeForce RTX 4060,torch_cublas,-1,-1,-1,-1,-1,-1,0.0,0.0,157.69599378108978,165.94944402575493,0.6383376875111909,7,-1,-1,torch_mm,0,torch_mm_cublas
2026-03-03T03:58:27.793653+00:00,TORCH,llm_style,eval,llm_style_eval_089,16,6144,3072,bf16,NVIDIA GeForce RTX 4060,torch_cublas,-1,-1,-1,-1,-1,-1,0.0,0.0,414.67200219631195,437.3708865046501,1.456524127023331,5,-1,-1,torch_mm,0,torch_mm_cublas
2026-03-03T03:58:27.825490+00:00,TORCH,llm_style,eval,llm_style_eval_090,32,1536,3072,bf16,NVIDIA GeForce RTX 4060,torch_cublas,-1,-1,-1,-1,-1,-1,0.0,0.0,97.28000313043594,110.11072002351284,3.104336742208807,3,-1,-1,torch_mm,0,torch_mm_cublas
2026-03-03T03:58:27.847113+00:00,TORCH,llm_style,eval,llm_style_eval_091,16,1024,4096,bf16,NVIDIA GeForce RTX 4060,torch_cublas,-1,-1,-1,-1,-1,-1,0.0,0.0,98.30400347709656,109.05023895204064,1.3653332850403275,7,-1,-1,torch_mm,0,torch_mm_cublas
2026-03-03T03:58:27.985720+00:00,TORCH,llm_style,eval,llm_style_eval_092,1,4096,6144,bf16,NVIDIA GeForce RTX 4060,torch_cublas,-1,-1,-1,-1,-1,-1,0.0,0.0,458.5760086774826,469.9875110387802,0.10975639162884848,7,-1,-1,torch_mm,0,torch_mm_cublas
2026-03-03T03:58:28.024858+00:00,TORCH,llm_style,eval,llm_style_eval_093,32,2048,3072,bf16,NVIDIA GeForce RTX 4060,torch_cublas,-1,-1,-1,-1,-1,-1,0.0,0.0,190.46400487422943,243.8041566312312,2.114064462027285,3,-1,-1,torch_mm,0,torch_mm_cublas
2026-03-03T03:58:28.038661+00:00,TORCH,llm_style,eval,llm_style_eval_094,32,1024,2048,bf16,NVIDIA GeForce RTX 4060,torch_cublas,-1,-1,-1,-1,-1,-1,0.0,0.0,62.463998794555664,134.1174440085888,2.1487213529419185,3,-1,-1,torch_mm,0,torch_mm_cublas
2026-03-03T03:58:28.114657+00:00,TORCH,llm_style,eval,llm_style_eval_095,8,6144,2048,bf16,NVIDIA GeForce RTX 4060,torch_cublas,-1,-1,-1,-1,-1,-1,0.0,0.0,281.5999984741211,375.9542393684386,0.7149381856921488,5,-1,-1,torch_mm,0,torch_mm_cublas
2026-03-03T03:58:28.154852+00:00,TORCH,llm_style,eval,llm_style_eval_096,64,2048,3072,bf16,NVIDIA GeForce RTX 4060,torch_cublas,-1,-1,-1,-1,-1,-1,0.0,0.0,191.48799777030945,205.4860861599445,4.205518765546695,3,-1,-1,torch_mm,0,torch_mm_cublas
2026-03-03T03:58:28.186040+00:00,TORCH,llm_style,eval,llm_style_eval_097,64,6144,1024,bf16,NVIDIA GeForce RTX 4060,torch_cublas,-1,-1,-1,-1,-1,-1,0.0,0.0,140.04799723625183,148.9539174735546,5.750216953417055,1,-1,-1,torch_mm,0,torch_mm_cublas
2026-03-03T03:58:28.217764+00:00,TORCH,llm_style,eval,llm_style_eval_098,32,6144,1024,bf16,NVIDIA GeForce RTX 4060,torch_cublas,-1,-1,-1,-1,-1,-1,0.0,0.0,152.5759994983673,181.45280167460436,2.639033565723479,1,-1,-1,torch_mm,0,torch_mm_cublas
2026-03-03T03:58:28.239363+00:00,TORCH,llm_style,eval,llm_style_eval_099,1,2048,2048,bf16,NVIDIA GeForce RTX 4060,torch_cublas,-1,-1,-1,-1,-1,-1,0.0,0.0,79.3599970638752,203.5103962570425,0.10570322971721112,7,-1,-1,torch_mm,0,torch_mm_cublas
2026-03-03T03:58:28.283845+00:00,TORCH,llm_style,eval,llm_style_eval_100,64,8192,1024,bf16,NVIDIA GeForce RTX 4060,torch_cublas,-1,-1,-1,-1,-1,-1,0.0,0.0,212.99199759960175,312.78304785490036,5.04123082604493,1,-1,-1,torch_mm,0,torch_mm_cublas
2026-03-03T03:58:28.367527+00:00,TORCH,llm_style,eval,llm_style_eval_101,64,8192,1536,bf16,NVIDIA GeForce RTX 4060,torch_cublas,-1,-1,-1,-1,-1,-1,0.0,0.0,309.2480003833771,386.0515195131302,5.208158933940757,1,-1,-1,torch_mm,0,torch_mm_cublas
2026-03-03T03:58:28.399189+00:00,TORCH,llm_style,eval,llm_style_eval_102,32,3072,2048,bf16,NVIDIA GeForce RTX 4060,torch_cublas,-1,-1,-1,-1,-1,-1,0.0,0.0,135.16800105571747,158.24096038937566,2.9789090676425904,3,-1,-1,torch_mm,0,torch_mm_cublas
2026-03-03T03:58:28.438914+00:00,TORCH,llm_style,eval,llm_style_eval_103,64,2048,3072,bf16,NVIDIA GeForce RTX 4060,torch_cublas,-1,-1,-1,-1,-1,-1,0.0,0.0,197.58400321006775,217.5132773816585,4.075767040430964,3,-1,-1,torch_mm,0,torch_mm_cublas
2026-03-03T03:58:28.516640+00:00,TORCH,llm_style,eval,llm_style_eval_104,16,6144,2048,bf16,NVIDIA GeForce RTX 4060,torch_cublas,-1,-1,-1,-1,-1,-1,0.0,0.0,302.0800054073334,399.37920063734055,1.332935569360345,5,-1,-1,torch_mm,0,torch_mm_cublas
2026-03-03T03:58:28.554822+00:00,TORCH,llm_style,eval,llm_style_eval_105,1,1024,8192,bf16,NVIDIA GeForce RTX 4060,torch_cublas,-1,-1,-1,-1,-1,-1,0.0,0.0,147.2640037536621,308.23424369096745,0.11392611617475999,6,-1,-1,torch_mm,0,torch_mm_cublas
2026-03-03T03:58:28.755155+00:00,TORCH,llm_style,eval,llm_style_eval_106,32,4096,8192,bf16,NVIDIA GeForce RTX 4060,torch_cublas,-1,-1,-1,-1,-1,-1,0.0,0.0,765.9519910812378,831.1807757616042,2.80367917703113,2,-1,-1,torch_mm,0,torch_mm_cublas
2026-03-03T03:58:28.814430+00:00,TORCH,llm_style,eval,llm_style_eval_107,64,6144,1536,bf16,NVIDIA GeForce RTX 4060,torch_cublas,-1,-1,-1,-1,-1,-1,0.0,0.0,223.23200106620789,248.4736059606075,5.411229331952877,1,-1,-1,torch_mm,0,torch_mm_cublas
2026-03-03T03:58:28.838223+00:00,TORCH,llm_style,eval,llm_style_eval_108,8,3072,1536,bf16,NVIDIA GeForce RTX 4060,torch_cublas,-1,-1,-1,-1,-1,-1,0.0,0.0,114.68800157308578,130.79551942646498,0.6582857052565231,7,-1,-1,torch_mm,0,torch_mm_cublas
2026-03-03T03:58:28.852934+00:00,TORCH,llm_style,eval,llm_style_eval_109,16,2048,1024,bf16,NVIDIA GeForce RTX 4060,torch_cublas,-1,-1,-1,-1,-1,-1,0.0,0.0,98.30400347709656,176.96288257837296,0.6826666425201637,7,-1,-1,torch_mm,0,torch_mm_cublas
2026-03-03T03:58:29.275144+00:00,TORCH,llm_style,eval,llm_style_eval_110,1,8192,8192,bf16,NVIDIA GeForce RTX 4060,torch_cublas,-1,-1,-1,-1,-1,-1,0.0,0.0,1909.7599983215332,1935.4828941822052,0.07027989282316233,4,-1,-1,torch_mm,0,torch_mm_cublas
2026-03-03T03:58:29.334252+00:00,TORCH,llm_style,eval,llm_style_eval_111,8,6144,1536,bf16,NVIDIA GeForce RTX 4060,torch_cublas,-1,-1,-1,-1,-1,-1,0.0,0.0,165.8879965543747,202.86464512348164,0.9102222411282599,5,-1,-1,torch_mm,0,torch_mm_cublas
2026-03-03T03:58:29.443762+00:00,TORCH,llm_style,eval,llm_style_eval_112,2,6144,3072,bf16,NVIDIA GeForce RTX 4060,torch_cublas,-1,-1,-1,-1,-1,-1,0.0,0.0,332.8000009059906,480.12960106134415,0.22685538399780994,5,-1,-1,torch_mm,0,torch_mm_cublas
2026-03-03T03:58:29.809961+00:00,TORCH,llm_style,eval,llm_style_eval_113,1,8192,8192,bf16,NVIDIA GeForce RTX 4060,torch_cublas,-1,-1,-1,-1,-1,-1,0.0,0.0,1357.8239679336548,1390.1926743984222,0.0988476644761643,4,-1,-1,torch_mm,0,torch_mm_cublas
2026-03-03T03:58:29.833470+00:00,TORCH,llm_style,eval,llm_style_eval_114,1,3072,1024,bf16,NVIDIA GeForce RTX 4060,torch_cublas,-1,-1,-1,-1,-1,-1,0.0,0.0,54.207999259233475,100.08576013147817,0.11606139473831162,7,-1,-1,torch_mm,0,torch_mm_cublas
2026-03-03T03:58:29.862856+00:00,TORCH,llm_style,eval,llm_style_eval_115,16,3072,1536,bf16,NVIDIA GeForce RTX 4060,torch_cublas,-1,-1,-1,-1,-1,-1,0.0,0.0,80.79999685287476,223.0374372005462,1.8687493797176777,7,-1,-1,torch_mm,0,torch_mm_cublas
2026-03-03T03:58:29.880422+00:00,TORCH,llm_style,eval,llm_style_eval_116,8,3072,1024,bf16,NVIDIA GeForce RTX 4060,torch_cublas,-1,-1,-1,-1,-1,-1,0.0,0.0,50.095999613404274,87.21184007823464,1.0047039362107604,7,-1,-1,torch_mm,0,torch_mm_cublas
2026-03-03T03:58:29.898778+00:00,TORCH,llm_style,eval,llm_style_eval_117,4,1024,4096,bf16,NVIDIA GeForce RTX 4060,torch_cublas,-1,-1,-1,-1,-1,-1,0.0,0.0,60.416001826524734,65.96031926572323,0.5553898137176703,7,-1,-1,torch_mm,0,torch_mm_cublas
2026-03-03T03:58:30.003094+00:00,TORCH,llm_style,eval,llm_style_eval_118,64,6144,3072,bf16,NVIDIA GeForce RTX 4060,torch_cublas,-1,-1,-1,-1,-1,-1,0.0,0.0,274.4320034980774,316.8665552139281,8.803343171369317,1,-1,-1,torch_mm,0,torch_mm_cublas
2026-03-03T03:58:30.263293+00:00,TORCH,llm_style,eval,llm_style_eval_119,64,8192,6144,bf16,NVIDIA GeForce RTX 4060,torch_cublas,-1,-1,-1,-1,-1,-1,0.0,0.0,745.4720139503479,804.6003341674804,8.642109728386261,1,-1,-1,torch_mm,0,torch_mm_cublas
2026-03-03T03:58:30.283607+00:00,TORCH,llm_style,eval,llm_style_eval_120,8,1024,4096,bf16,NVIDIA GeForce RTX 4060,torch_cublas,-1,-1,-1,-1,-1,-1,0.0,0.0,61.43999844789505,144.10751283168787,1.0922666942596442,7,-1,-1,torch_mm,0,torch_mm_cublas
2026-03-03T03:58:30.295155+00:00,TORCH,llm_style,eval,llm_style_eval_121,4,1024,2048,bf16,NVIDIA GeForce RTX 4060,torch_cublas,-1,-1,-1,-1,-1,-1,0.0,0.0,35.840000957250595,65.66848147660491,0.4681142732114211,7,-1,-1,torch_mm,0,torch_mm_cublas
2026-03-03T03:58:30.431069+00:00,TORCH,llm_style,eval,llm_style_eval_122,4,6144,4096,bf16,NVIDIA GeForce RTX 4060,torch_cublas,-1,-1,-1,-1,-1,-1,0.0,0.0,344.06399726867676,391.2703984975815,0.5851428617879647,5,-1,-1,torch_mm,0,torch_mm_cublas
2026-03-03T03:58:30.564653+00:00,TORCH,llm_style,eval,llm_style_eval_123,4,3072,8192,bf16,NVIDIA GeForce RTX 4060,torch_cublas,-1,-1,-1,-1,-1,-1,0.0,0.0,336.89600229263306,371.73887103796005,0.597592701100456,6,-1,-1,torch_mm,0,torch_mm_cublas
2026-03-03T03:58:30.600158+00:00,TORCH,llm_style,eval,llm_style_eval_124,64,6144,1024,bf16,NVIDIA GeForce RTX 4060,torch_cublas,-1,-1,-1,-1,-1,-1,0.0,0.0,89.08800035715103,151.8307215720413,9.039448239623201,1,-1,-1,torch_mm,0,torch_mm_cublas
2026-03-03T03:58:30.671972+00:00,TORCH,llm_style,eval,llm_style_eval_125,64,1536,8192,bf16,NVIDIA GeForce RTX 4060,torch_cublas,-1,-1,-1,-1,-1,-1,0.0,0.0,162.81600296497345,190.0441610813141,9.892226234951181,2,-1,-1,torch_mm,0,torch_mm_cublas
2026-03-03T03:58:30.768850+00:00,TORCH,llm_style,eval,llm_style_eval_126,64,2048,8192,bf16,NVIDIA GeForce RTX 4060,torch_cublas,-1,-1,-1,-1,-1,-1,0.0,0.0,294.9120104312897,341.58590883016575,7.281777520215079,2,-1,-1,torch_mm,0,torch_mm_cublas
2026-03-03T03:58:30.834033+00:00,TORCH,llm_style,eval,llm_style_eval_127,2,8192,1536,bf16,NVIDIA GeForce RTX 4060,torch_cublas,-1,-1,-1,-1,-1,-1,0.0,0.0,160.76800227165222,173.9433616399765,0.3130700592705868,5,-1,-1,torch_mm,0,torch_mm_cublas
2026-03-03T03:58:30.854033+00:00,TORCH,llm_style,eval,llm_style_eval_128,8,2048,2048,bf16,NVIDIA GeForce RTX 4060,torch_cublas,-1,-1,-1,-1,-1,-1,0.0,0.0,80.83199709653854,100.8742368966341,0.8302264747937769,7,-1,-1,torch_mm,0,torch_mm_cublas
2026-03-03T03:58:31.116114+00:00,TORCH,llm_style,eval,llm_style_eval_129,64,8192,6144,bf16,NVIDIA GeForce RTX 4060,torch_cublas,-1,-1,-1,-1,-1,-1,0.0,0.0,745.9840178489685,882.3807996511456,8.636178242231907,1,-1,-1,torch_mm,0,torch_mm_cublas
2026-03-03T03:58:31.140038+00:00,TORCH,llm_style,eval,llm_style_eval_130,16,3072,1536,bf16,NVIDIA GeForce RTX 4060,torch_cublas,-1,-1,-1,-1,-1,-1,0.0,0.0,63.37599828839302,67.58400052785873,2.382525689187509,7,-1,-1,torch_mm,0,torch_mm_cublas
2026-03-03T03:58:31.506717+00:00,TORCH,llm_style,eval,llm_style_eval_131,32,8192,8192,bf16,NVIDIA GeForce RTX 4060,torch_cublas,-1,-1,-1,-1,-1,-1,0.0,0.0,1239.4559979438782,1378.4291303157802,3.4652035272933293,0,-1,-1,torch_mm,0,torch_mm_cublas
2026-03-03T03:58:31.694543+00:00,TORCH,llm_style,eval,llm_style_eval_132,32,8192,4096,bf16,NVIDIA GeForce RTX 4060,torch_cublas,-1,-1,-1,-1,-1,-1,0.0,0.0,611.840009689331,626.7698937654495,3.5098777686840226,1,-1,-1,torch_mm,0,torch_mm_cublas
2026-03-03T03:58:32.102068+00:00,TORCH,llm_style,eval,llm_style_eval_133,2,8192,8192,bf16,NVIDIA GeForce RTX 4060,torch_cublas,-1,-1,-1,-1,-1,-1,0.0,0.0,1036.7519855499268,1114.3474757671356,0.25891964495019815,4,-1,-1,torch_mm,0,torch_mm_cublas
2026-03-03T03:58:32.174092+00:00,TORCH,llm_style,eval,llm_style_eval_134,64,3072,3072,bf16,NVIDIA GeForce RTX 4060,torch_cublas,-1,-1,-1,-1,-1,-1,0.0,0.0,346.1120128631592,355.85023760795593,3.490082710528703,3,-1,-1,torch_mm,0,torch_mm_cublas
2026-03-03T03:58:32.229643+00:00,TORCH,llm_style,eval,llm_style_eval_135,8,3072,3072,bf16,NVIDIA GeForce RTX 4060,torch_cublas,-1,-1,-1,-1,-1,-1,0.0,0.0,174.03200268745422,181.19488090276718,0.8676274574118031,7,-1,-1,torch_mm,0,torch_mm_cublas
2026-03-03T03:58:32.271672+00:00,TORCH,llm_style,eval,llm_style_eval_136,4,2048,4096,bf16,NVIDIA GeForce RTX 4060,torch_cublas,-1,-1,-1,-1,-1,-1,0.0,0.0,159.56800431013107,185.44992625713346,0.4205659166456042,7,-1,-1,torch_mm,0,torch_mm_cublas
2026-03-03T03:58:32.624909+00:00,TORCH,llm_style,eval,llm_style_eval_137,4,8192,8192,bf16,NVIDIA GeForce RTX 4060,torch_cublas,-1,-1,-1,-1,-1,-1,0.0,0.0,1158.0640077590942,1185.2588379383087,0.4635934701388995,4,-1,-1,torch_mm,0,torch_mm_cublas
2026-03-03T03:58:32.633327+00:00,TORCH,llm_style,eval,llm_style_eval_138,16,1024,1024,bf16,NVIDIA GeForce RTX 4060,torch_cublas,-1,-1,-1,-1,-1,-1,0.0,0.0,33.79200026392937,38.91199827194214,0.9929696892141969,7,-1,-1,torch_mm,0,torch_mm_cublas
2026-03-03T03:58:32.641540+00:00,TORCH,llm_style,eval,llm_style_eval_139,4,1024,1024,bf16,NVIDIA GeForce RTX 4060,torch_cublas,-1,-1,-1,-1,-1,-1,0.0,0.0,32.76799991726875,40.89055996388196,0.2560000006463379,7,-1,-1,torch_mm,0,torch_mm_cublas
2026-03-03T03:58:32.813539+00:00,TORCH,llm_style,eval,llm_style_eval_140,64,4096,6144,bf16,NVIDIA GeForce RTX 4060,torch_cublas,-1,-1,-1,-1,-1,-1,0.0,0.0,903.1040072441101,988.8051003217695,3.5668377575134587,3,-1,-1,torch_mm,0,torch_mm_cublas
2026-03-03T03:58:32.960222+00:00,TORCH,llm_style,eval,llm_style_eval_141,4,6144,4096,bf16,NVIDIA GeForce RTX 4060,torch_cublas,-1,-1,-1,-1,-1,-1,0.0,0.0,458.0959975719452,466.44224524497986,0.43948559486896877,5,-1,-1,torch_mm,0,torch_mm_cublas
2026-03-03T03:58:33.031582+00:00,TORCH,llm_style,eval,llm_style_eval_142,4,2048,6144,bf16,NVIDIA GeForce RTX 4060,torch_cublas,-1,-1,-1,-1,-1,-1,0.0,0.0,239.6160066127777,250.37823915481567,0.42010255250882744,7,-1,-1,torch_mm,0,torch_mm_cublas
2026-03-03T03:58:33.111367+00:00,TORCH,llm_style,eval,llm_style_eval_143,64,1536,8192,bf16,NVIDIA GeForce RTX 4060,torch_cublas,-1,-1,-1,-1,-1,-1,0.0,0.0,247.80799448490143,360.8470270037651,6.4994381611773715,2,-1,-1,torch_mm,0,torch_mm_cublas
2026-03-03T03:58:33.163609+00:00,TORCH,llm_style,eval,llm_style_eval_144,1,3072,3072,bf16,NVIDIA GeForce RTX 4060,torch_cublas,-1,-1,-1,-1,-1,-1,0.0,0.0,111.61600053310394,135.97696118056768,0.16910091662352741,7,-1,-1,torch_mm,0,torch_mm_cublas
2026-03-03T03:58:33.183397+00:00,TORCH,llm_style,eval,llm_style_eval_145,32,1024,2048,bf16,NVIDIA GeForce RTX 4060,torch_cublas,-1,-1,-1,-1,-1,-1,0.0,0.0,59.39200147986412,60.416001826524734,2.259862012656777,3,-1,-1,torch_mm,0,torch_mm_cublas
2026-03-03T03:58:33.376586+00:00,TORCH,llm_style,eval,llm_style_eval_146,64,8192,4096,bf16,NVIDIA GeForce RTX 4060,torch_cublas,-1,-1,-1,-1,-1,-1,0.0,0.0,691.2000179290771,705.492457151413,6.21378354252401,1,-1,-1,torch_mm,0,torch_mm_cublas
2026-03-03T03:58:33.421619+00:00,TORCH,llm_style,eval,llm_style_eval_147,64,2048,4096,bf16,NVIDIA GeForce RTX 4060,torch_cublas,-1,-1,-1,-1,-1,-1,0.0,0.0,232.44799673557281,237.95968130230904,4.619277597911341,3,-1,-1,torch_mm,0,torch_mm_cublas
2026-03-03T03:58:33.458088+00:00,TORCH,llm_style,eval,llm_style_eval_148,64,1024,6144,bf16,NVIDIA GeForce RTX 4060,torch_cublas,-1,-1,-1,-1,-1,-1,0.0,0.0,143.36000382900238,163.42015936970708,5.617371278537052,3,-1,-1,torch_mm,0,torch_mm_cublas
2026-03-03T03:58:33.661429+00:00,TORCH,llm_style,eval,llm_style_eval_149,64,4096,8192,bf16,NVIDIA GeForce RTX 4060,torch_cublas,-1,-1,-1,-1,-1,-1,0.0,0.0,893.9520120620728,921.1187297105789,4.804471871026756,2,-1,-1,torch_mm,0,torch_mm_cublas
2026-03-03T03:58:33.695278+00:00,TORCH,llm_style,eval,llm_style_eval_150,2,2048,3072,bf16,NVIDIA GeForce RTX 4060,torch_cublas,-1,-1,-1,-1,-1,-1,0.0,0.0,178.17600071430206,195.5839991569519,0.14124137874411252,7,-1,-1,torch_mm,0,torch_mm_cublas
2026-03-03T03:58:33.744953+00:00,TORCH,llm_style,eval,llm_style_eval_151,64,4096,2048,bf16,NVIDIA GeForce RTX 4060,torch_cublas,-1,-1,-1,-1,-1,-1,0.0,0.0,320.51199674606323,416.9830429553982,3.3500831011037295,3,-1,-1,torch_mm,0,torch_mm_cublas
2026-03-03T03:58:34.163289+00:00,TORCH,llm_style,eval,llm_style_eval_152,8,8192,8192,bf16,NVIDIA GeForce RTX 4060,torch_cublas,-1,-1,-1,-1,-1,-1,0.0,0.0,1207.2960138320923,1261.6176128387451,0.8893774283175372,4,-1,-1,torch_mm,0,torch_mm_cublas
2026-03-03T03:58:34.265696+00:00,TORCH,llm_style,eval,llm_style_eval_153,64,8192,2048,bf16,NVIDIA GeForce RTX 4060,torch_cublas,-1,-1,-1,-1,-1,-1,0.0,0.0,357.37600922584534,428.65279138088204,6.009031363498404,1,-1,-1,torch_mm,0,torch_mm_cublas
2026-03-03T03:58:34.365900+00:00,TORCH,llm_style,eval,llm_style_eval_154,16,2048,8192,bf16,NVIDIA GeForce RTX 4060,torch_cublas,-1,-1,-1,-1,-1,-1,0.0,0.0,262.14399933815,288.11935991048813,2.048000005170703,6,-1,-1,torch_mm,0,torch_mm_cublas
2026-03-03T03:58:34.384548+00:00,TORCH,llm_style,eval,llm_style_eval_155,4,2048,1536,bf16,NVIDIA GeForce RTX 4060,torch_cublas,-1,-1,-1,-1,-1,-1,0.0,0.0,78.62400263547897,120.76031967997542,0.3200781333491149,7,-1,-1,torch_mm,0,torch_mm_cublas
2026-03-03T03:58:34.525350+00:00,TORCH,llm_style,eval,llm_style_eval_156,1,4096,6144,bf16,NVIDIA GeForce RTX 4060,torch_cublas,-1,-1,-1,-1,-1,-1,0.0,0.0,418.3039963245392,452.6777559518814,0.12032313447216132,7,-1,-1,torch_mm,0,torch_mm_cublas
2026-03-03T03:58:34.596094+00:00,TORCH,llm_style,eval,llm_style_eval_157,1,1536,8192,bf16,NVIDIA GeForce RTX 4060,torch_cublas,-1,-1,-1,-1,-1,-1,0.0,0.0,257.00800120830536,329.0623956918715,0.09791844565805195,6,-1,-1,torch_mm,0,torch_mm_cublas
2026-03-03T03:58:34.667977+00:00,TORCH,llm_style,eval,llm_style_eval_158,64,1536,8192,bf16,NVIDIA GeForce RTX 4060,torch_cublas,-1,-1,-1,-1,-1,-1,0.0,0.0,200.70399343967438,264.5919947326181,8.024816588834353,2,-1,-1,torch_mm,0,torch_mm_cublas
2026-03-03T03:58:34.720272+00:00,TORCH,llm_style,eval,llm_style_eval_159,16,6144,1536,bf16,NVIDIA GeForce RTX 4060,torch_cublas,-1,-1,-1,-1,-1,-1,0.0,0.0,163.83999586105347,182.25600138306618,1.8432000465631497,5,-1,-1,torch_mm,0,torch_mm_cublas
2026-03-03T03:58:34.923505+00:00,TORCH,llm_style,eval,llm_style_eval_160,32,6144,6144,bf16,NVIDIA GeForce RTX 4060,torch_cublas,-1,-1,-1,-1,-1,-1,0.0,0.0,678.3999800682068,715.2995085716248,3.561201614064172,1,-1,-1,torch_mm,0,torch_mm_cublas
2026-03-03T03:58:34.952067+00:00,TORCH,llm_style,eval,llm_style_eval_161,2,1536,4096,bf16,NVIDIA GeForce RTX 4060,torch_cublas,-1,-1,-1,-1,-1,-1,0.0,0.0,101.3759970664978,116.73600226640701,0.24824243142577848,7,-1,-1,torch_mm,0,torch_mm_cublas
2026-03-03T03:58:34.975415+00:00,TORCH,llm_style,eval,llm_style_eval_162,64,1536,3072,bf16,NVIDIA GeForce RTX 4060,torch_cublas,-1,-1,-1,-1,-1,-1,0.0,0.0,78.84799689054489,107.36639894545071,7.660052250134291,3,-1,-1,torch_mm,0,torch_mm_cublas
2026-03-03T03:58:35.013816+00:00,TORCH,llm_style,eval,llm_style_eval_163,64,1024,8192,bf16,NVIDIA GeForce RTX 4060,torch_cublas,-1,-1,-1,-1,-1,-1,0.0,0.0,138.95999640226364,145.97120091319084,7.72698511657783,2,-1,-1,torch_mm,0,torch_mm_cublas
2026-03-03T03:58:35.203127+00:00,TORCH,llm_style,eval,llm_style_eval_164,64,4096,8192,bf16,NVIDIA GeForce RTX 4060,torch_cublas,-1,-1,-1,-1,-1,-1,0.0,0.0,735.2319955825806,744.5094466209412,5.841649060167422,2,-1,-1,torch_mm,0,torch_mm_cublas
2026-03-03T03:58:35.340517+00:00,TORCH,llm_style,eval,llm_style_eval_165,4,8192,3072,bf16,NVIDIA GeForce RTX 4060,torch_cublas,-1,-1,-1,-1,-1,-1,0.0,0.0,415.0719940662384,428.4009623527527,0.48504017345933426,5,-1,-1,torch_mm,0,torch_mm_cublas
2026-03-03T03:58:35.371236+00:00,TORCH,llm_style,eval,llm_style_eval_166,64,1024,6144,bf16,NVIDIA GeForce RTX 4060,torch_cublas,-1,-1,-1,-1,-1,-1,0.0,0.0,114.68800157308578,128.61664213240144,7.021714189402912,3,-1,-1,torch_mm,0,torch_mm_cublas
2026-03-03T03:58:35.384559+00:00,TORCH,llm_style,eval,llm_style_eval_167,2,2048,1024,bf16,NVIDIA GeForce RTX 4060,torch_cublas,-1,-1,-1,-1,-1,-1,0.0,0.0,60.28800085186958,74.77248296141624,0.13914224856470525,7,-1,-1,torch_mm,0,torch_mm_cublas
2026-03-03T03:58:35.406351+00:00,TORCH,llm_style,eval,llm_style_eval_168,64,4096,1024,bf16,NVIDIA GeForce RTX 4060,torch_cublas,-1,-1,-1,-1,-1,-1,0.0,0.0,106.49599879980087,111.61600053310394,5.04123082604493,3,-1,-1,torch_mm,0,torch_mm_cublas
2026-03-03T03:58:35.457472+00:00,TORCH,llm_style,eval,llm_style_eval_169,4,1536,6144,bf16,NVIDIA GeForce RTX 4060,torch_cublas,-1,-1,-1,-1,-1,-1,0.0,0.0,146.33600413799286,169.98399794101715,0.5159186383742371,7,-1,-1,torch_mm,0,torch_mm_cublas
2026-03-03T03:58:35.469979+00:00,TORCH,llm_style,eval,llm_style_eval_170,16,1536,1536,bf16,NVIDIA GeForce RTX 4060,torch_cublas,-1,-1,-1,-1,-1,-1,0.0,0.0,40.95999896526337,64.24383856356137,1.8432000465631497,7,-1,-1,torch_mm,0,torch_mm_cublas
2026-03-03T03:58:35.501134+00:00,TORCH,llm_style,eval,llm_style_eval_171,1,2048,3072,bf16,NVIDIA GeForce RTX 4060,torch_cublas,-1,-1,-1,-1,-1,-1,0.0,0.0,142.33599603176117,165.8879965543747,0.08840288016245884,7,-1,-1,torch_mm,0,torch_mm_cublas
2026-03-03T03:58:35.537395+00:00,TORCH,llm_style,eval,llm_style_eval_172,64,3072,2048,bf16,NVIDIA GeForce RTX 4060,torch_cublas,-1,-1,-1,-1,-1,-1,0.0,0.0,226.30399465560913,231.4240038394928,3.558515921141915,3,-1,-1,torch_mm,0,torch_mm_cublas
2026-03-03T03:58:35.812612+00:00,TORCH,llm_style,eval,llm_style_eval_173,64,8192,6144,bf16,NVIDIA GeForce RTX 4060,torch_cublas,-1,-1,-1,-1,-1,-1,0.0,0.0,833.9680135250092,866.7612892389297,7.725057603551365,1,-1,-1,torch_mm,0,torch_mm_cublas
2026-03-03T03:58:35.946695+00:00,TORCH,llm_style,eval,llm_style_eval_174,2,4096,4096,bf16,NVIDIA GeForce RTX 4060,torch_cublas,-1,-1,-1,-1,-1,-1,0.0,0.0,276.36800706386566,315.09503871202463,0.24282428604151662,7,-1,-1,torch_mm,0,torch_mm_cublas
2026-03-03T03:58:36.001727+00:00,TORCH,llm_style,eval,llm_style_eval_175,64,4096,2048,bf16,NVIDIA GeForce RTX 4060,torch_cublas,-1,-1,-1,-1,-1,-1,0.0,0.0,261.1199915409088,268.8041687011719,4.112062878310029,3,-1,-1,torch_mm,0,torch_mm_cublas
2026-03-03T03:58:36.076639+00:00,TORCH,llm_style,eval,llm_style_eval_176,16,6144,2048,bf16,NVIDIA GeForce RTX 4060,torch_cublas,-1,-1,-1,-1,-1,-1,0.0,0.0,236.92800104618073,357.34751760959625,1.6994748709398728,5,-1,-1,torch_mm,0,torch_mm_cublas
2026-03-03T03:58:36.129030+00:00,TORCH,llm_style,eval,llm_style_eval_177,1,6144,1536,bf16,NVIDIA GeForce RTX 4060,torch_cublas,-1,-1,-1,-1,-1,-1,0.0,0.0,112.64000087976456,176.57855957746494,0.16756363505489572,5,-1,-1,torch_mm,0,torch_mm_cublas
2026-03-03T03:58:36.424461+00:00,TORCH,llm_style,eval,llm_style_eval_178,32,6144,8192,bf16,NVIDIA GeForce RTX 4060,torch_cublas,-1,-1,-1,-1,-1,-1,0.0,0.0,992.2559857368469,1007.6979029178619,3.2463653717421774,0,-1,-1,torch_mm,0,torch_mm_cublas
2026-03-03T03:58:36.600509+00:00,TORCH,llm_style,eval,llm_style_eval_179,64,4096,6144,bf16,NVIDIA GeForce RTX 4060,torch_cublas,-1,-1,-1,-1,-1,-1,0.0,0.0,1030.992031097412,1065.9702384471893,3.1243941513022677,3,-1,-1,torch_mm,0,torch_mm_cublas
2026-03-03T03:58:36.623461+00:00,TORCH,llm_style,eval,llm_style_eval_180,64,2048,1536,bf16,NVIDIA GeForce RTX 4060,torch_cublas,-1,-1,-1,-1,-1,-1,0.0,0.0,113.45599964261055,119.7923231869936,3.548980972961927,3,-1,-1,torch_mm,0,torch_mm_cublas
2026-03-03T03:58:36.661968+00:00,TORCH,llm_style,eval,llm_style_eval_181,64,2048,3072,bf16,NVIDIA GeForce RTX 4060,torch_cublas,-1,-1,-1,-1,-1,-1,0.0,0.0,204.75199818611145,263.1168031692504,3.933081850893628,3,-1,-1,torch_mm,0,torch_mm_cublas
2026-03-03T03:58:36.687800+00:00,TORCH,llm_style,eval,llm_style_eval_182,32,3072,1536,bf16,NVIDIA GeForce RTX 4060,torch_cublas,-1,-1,-1,-1,-1,-1,0.0,0.0,112.5440001487732,526.9606333971009,2.683305086017879,3,-1,-1,torch_mm,0,torch_mm_cublas
2026-03-03T03:58:36.783795+00:00,TORCH,llm_style,eval,llm_style_eval_183,8,8192,2048,bf16,NVIDIA GeForce RTX 4060,torch_cublas,-1,-1,-1,-1,-1,-1,0.0,0.0,313.26399743556976,350.015685558319,0.8568985207283839,5,-1,-1,torch_mm,0,torch_mm_cublas
2026-03-03T03:58:36.824371+00:00,TORCH,llm_style,eval,llm_style_eval_184,64,8192,1024,bf16,NVIDIA GeForce RTX 4060,torch_cublas,-1,-1,-1,-1,-1,-1,0.0,0.0,183.29599499702454,240.855035483837,5.857966640337287,1,-1,-1,torch_mm,0,torch_mm_cublas
2026-03-03T03:58:36.896628+00:00,TORCH,llm_style,eval,llm_style_eval_185,1,8192,1536,bf16,NVIDIA GeForce RTX 4060,torch_cublas,-1,-1,-1,-1,-1,-1,0.0,0.0,202.71999388933182,338.56511920690536,0.12414080879332721,5,-1,-1,torch_mm,0,torch_mm_cublas
2026-03-03T03:58:36.927666+00:00,TORCH,llm_style,eval,llm_style_eval_186,16,6144,1024,bf16,NVIDIA GeForce RTX 4060,torch_cublas,-1,-1,-1,-1,-1,-1,0.0,0.0,134.14399325847626,155.27775958180422,1.5008245029061607,5,-1,-1,torch_mm,0,torch_mm_cublas
2026-03-03T03:58:36.956974+00:00,TORCH,llm_style,eval,llm_style_eval_187,1,1024,6144,bf16,NVIDIA GeForce RTX 4060,torch_cublas,-1,-1,-1,-1,-1,-1,0.0,0.0,95.23200243711472,105.05215831100938,0.1321290288767053,7,-1,-1,torch_mm,0,torch_mm_cublas
2026-03-03T03:58:37.148329+00:00,TORCH,llm_style,eval,llm_style_eval_188,8,8192,4096,bf16,NVIDIA GeForce RTX 4060,torch_cublas,-1,-1,-1,-1,-1,-1,0.0,0.0,598.831981420517,622.8172820806503,0.8965301264078511,5,-1,-1,torch_mm,0,torch_mm_cublas
2026-03-03T03:58:37.245685+00:00,TORCH,llm_style,eval,llm_style_eval_189,8,2048,8192,bf16,NVIDIA GeForce RTX 4060,torch_cublas,-1,-1,-1,-1,-1,-1,0.0,0.0,303.1040132045746,350.3615954518317,0.8856215830399591,6,-1,-1,torch_mm,0,torch_mm_cublas
2026-03-03T03:58:37.339315+00:00,TORCH,llm_style,eval,llm_style_eval_190,4,8192,2048,bf16,NVIDIA GeForce RTX 4060,torch_cublas,-1,-1,-1,-1,-1,-1,0.0,0.0,312.3199939727783,377.6230469346044,0.42974427058838366,5,-1,-1,torch_mm,0,torch_mm_cublas
2026-03-03T03:58:37.687836+00:00,TORCH,llm_style,eval,llm_style_eval_191,4,8192,8192,bf16,NVIDIA GeForce RTX 4060,torch_cublas,-1,-1,-1,-1,-1,-1,0.0,0.0,1030.1439762115479,1074.3567490577698,0.5211610458320531,4,-1,-1,torch_mm,0,torch_mm_cublas
2026-03-03T03:58:37.710727+00:00,TORCH,llm_style,eval,llm_style_eval_192,64,1536,1024,bf16,NVIDIA GeForce RTX 4060,torch_cublas,-1,-1,-1,-1,-1,-1,0.0,0.0,40.38400016725063,56.27935983240603,4.9853058430617185,3,-1,-1,torch_mm,0,torch_mm_cublas
2026-03-03T03:58:37.734893+00:00,TORCH,llm_style,eval,llm_style_eval_193,32,2048,2048,bf16,NVIDIA GeForce RTX 4060,torch_cublas,-1,-1,-1,-1,-1,-1,0.0,0.0,99.32799637317657,118.82496297359467,2.7025155625961133,3,-1,-1,torch_mm,0,torch_mm_cublas
2026-03-03T03:58:37.747211+00:00,TORCH,llm_style,eval,llm_style_eval_194,8,1024,2048,bf16,NVIDIA GeForce RTX 4060,torch_cublas,-1,-1,-1,-1,-1,-1,0.0,0.0,52.112000063061714,78.11072029173368,0.6438906961812088,7,-1,-1,torch_mm,0,torch_mm_cublas
2026-03-03T03:58:37.789471+00:00,TORCH,llm_style,eval,llm_style_eval_195,2,4096,2048,bf16,NVIDIA GeForce RTX 4060,torch_cublas,-1,-1,-1,-1,-1,-1,0.0,0.0,193.42400133609772,229.7241631150245,0.17347605141150552,7,-1,-1,torch_mm,0,torch_mm_cublas
2026-03-03T03:58:37.834211+00:00,TORCH,llm_style,eval,llm_style_eval_196,32,2048,4096,bf16,NVIDIA GeForce RTX 4060,torch_cublas,-1,-1,-1,-1,-1,-1,0.0,0.0,221.18400037288666,314.050572812557,2.4272592551672245,3,-1,-1,torch_mm,0,torch_mm_cublas
2026-03-03T03:58:37.912211+00:00,TORCH,llm_style,eval,llm_style_eval_197,32,8192,1536,bf16,NVIDIA GeForce RTX 4060,torch_cublas,-1,-1,-1,-1,-1,-1,0.0,0.0,271.36000990867615,287.7439856529236,2.967667816164286,1,-1,-1,torch_mm,0,torch_mm_cublas
2026-03-03T03:58:38.133660+00:00,TORCH,llm_style,eval,llm_style_eval_198,64,4096,8192,bf16,NVIDIA GeForce RTX 4060,torch_cublas,-1,-1,-1,-1,-1,-1,0.0,0.0,851.967990398407,896.1468881368637,5.04123082604493,2,-1,-1,torch_mm,0,torch_mm_cublas
2026-03-03T03:58:38.323666+00:00,TORCH,llm_style,eval,llm_style_eval_199,2,8192,4096,bf16,NVIDIA GeForce RTX 4060,torch_cublas,-1,-1,-1,-1,-1,-1,0.0,0.0,597.7280139923096,623.7820553779602,0.22454649080865544,5,-1,-1,torch_mm,0,torch_mm_cublas
2026-03-03T03:58:38.347759+00:00,TORCH,llm_style,eval,llm_style_eval_200,1,4096,1024,bf16,NVIDIA GeForce RTX 4060,torch_cublas,-1,-1,-1,-1,-1,-1,0.0,0.0,89.05600011348724,139.26400244235992,0.09419475374270232,7,-1,-1,torch_mm,0,torch_mm_cublas
2026-03-03T03:58:38.424938+00:00,TORCH,llm_style,eval,llm_style_eval_201,4,1536,8192,bf16,NVIDIA GeForce RTX 4060,torch_cublas,-1,-1,-1,-1,-1,-1,0.0,0.0,223.00800681114197,368.60928088426544,0.4513887076944658,6,-1,-1,torch_mm,0,torch_mm_cublas
2026-03-03T03:58:38.530242+00:00,TORCH,llm_style,eval,llm_style_eval_202,1,6144,3072,bf16,NVIDIA GeForce RTX 4060,torch_cublas,-1,-1,-1,-1,-1,-1,0.0,0.0,268.2879865169525,286.238708794117,0.14070229714745258,5,-1,-1,torch_mm,0,torch_mm_cublas
2026-03-03T03:58:38.606147+00:00,TORCH,llm_style,eval,llm_style_eval_203,16,2048,6144,bf16,NVIDIA GeForce RTX 4060,torch_cublas,-1,-1,-1,-1,-1,-1,0.0,0.0,273.4079957008362,336.90016537904717,1.4727191242811506,7,-1,-1,torch_mm,0,torch_mm_cublas
2026-03-03T03:58:38.618769+00:00,TORCH,llm_style,eval,llm_style_eval_204,16,1536,1024,bf16,NVIDIA GeForce RTX 4060,torch_cublas,-1,-1,-1,-1,-1,-1,0.0,0.0,41.311999782919884,137.1692808717488,1.218329983164098,7,-1,-1,torch_mm,0,torch_mm_cublas
2026-03-03T03:58:38.691927+00:00,TORCH,llm_style,eval,llm_style_eval_205,64,6144,2048,bf16,NVIDIA GeForce RTX 4060,torch_cublas,-1,-1,-1,-1,-1,-1,0.0,0.0,273.4079957008362,309.77376013994217,5.890876497124602,1,-1,-1,torch_mm,0,torch_mm_cublas
2026-03-03T03:58:38.767726+00:00,TORCH,llm_style,eval,llm_style_eval_206,4,2048,6144,bf16,NVIDIA GeForce RTX 4060,torch_cublas,-1,-1,-1,-1,-1,-1,0.0,0.0,280.5759906768799,335.0323215126991,0.35877373454925093,7,-1,-1,torch_mm,0,torch_mm_cublas
2026-03-03T03:58:38.834969+00:00,TORCH,llm_style,eval,llm_style_eval_207,32,6144,1536,bf16,NVIDIA GeForce RTX 4060,torch_cublas,-1,-1,-1,-1,-1,-1,0.0,0.0,241.66400730609894,321.3414329290387,2.499254161729516,1,-1,-1,torch_mm,0,torch_mm_cublas
2026-03-03T03:58:38.852305+00:00,TORCH,llm_style,eval,llm_style_eval_208,4,2048,1024,bf16,NVIDIA GeForce RTX 4060,torch_cublas,-1,-1,-1,-1,-1,-1,0.0,0.0,78.84799689054489,87.47743874788284,0.21277922917039696,7,-1,-1,torch_mm,0,torch_mm_cublas
2026-03-03T03:58:38.861916+00:00,TORCH,llm_style,eval,llm_style_eval_209,1,1024,1536,bf16,NVIDIA GeForce RTX 4060,torch_cublas,-1,-1,-1,-1,-1,-1,0.0,0.0,46.08000069856644,46.96031995117664,0.06826666563175345,7,-1,-1,torch_mm,0,torch_mm_cublas
2026-03-03T03:58:39.005218+00:00,TORCH,llm_style,eval,llm_style_eval_210,8,6144,4096,bf16,NVIDIA GeForce RTX 4060,torch_cublas,-1,-1,-1,-1,-1,-1,0.0,0.0,569.3439841270447,579.1027188301086,0.7072230412996707,5,-1,-1,torch_mm,0,torch_mm_cublas
2026-03-03T03:58:39.106870+00:00,TORCH,llm_style,eval,llm_style_eval_211,4,2048,8192,bf16,NVIDIA GeForce RTX 4060,torch_cublas,-1,-1,-1,-1,-1,-1,0.0,0.0,351.0719984769821,438.28447490930535,0.3823082689085496,6,-1,-1,torch_mm,0,torch_mm_cublas
2026-03-03T03:58:39.118479+00:00,TORCH,llm_style,eval,llm_style_eval_212,32,1024,1024,bf16,NVIDIA GeForce RTX 4060,torch_cublas,-1,-1,-1,-1,-1,-1,0.0,0.0,47.919999808073044,52.22399905323982,1.400435397929493,3,-1,-1,torch_mm,0,torch_mm_cublas
2026-03-03T03:58:39.194375+00:00,TORCH,llm_style,eval,llm_style_eval_213,16,3072,4096,bf16,NVIDIA GeForce RTX 4060,torch_cublas,-1,-1,-1,-1,-1,-1,0.0,0.0,289.792001247406,300.9775933623314,1.3894558244077975,7,-1,-1,torch_mm,0,torch_mm_cublas
2026-03-03T03:58:39.242473+00:00,TORCH,llm_style,eval,llm_style_eval_214,64,1024,8192,bf16,NVIDIA GeForce RTX 4060,torch_cublas,-1,-1,-1,-1,-1,-1,0.0,0.0,209.85600352287292,324.413434267044,5.116564720451132,2,-1,-1,torch_mm,0,torch_mm_cublas
2026-03-03T03:58:39.277329+00:00,TORCH,llm_style,eval,llm_style_eval_215,4,4096,1536,bf16,NVIDIA GeForce RTX 4060,torch_cublas,-1,-1,-1,-1,-1,-1,0.0,0.0,190.2879998087883,223.5884808003902,0.2645024807164717,7,-1,-1,torch_mm,0,torch_mm_cublas
2026-03-03T03:58:39.301771+00:00,TORCH,llm_style,eval,llm_style_eval_216,16,1536,3072,bf16,NVIDIA GeForce RTX 4060,torch_cublas,-1,-1,-1,-1,-1,-1,0.0,0.0,107.45599865913391,158.62816080451,1.4051792909112313,7,-1,-1,torch_mm,0,torch_mm_cublas
2026-03-03T03:58:39.379472+00:00,TORCH,llm_style,eval,llm_style_eval_217,8,6144,2048,bf16,NVIDIA GeForce RTX 4060,torch_cublas,-1,-1,-1,-1,-1,-1,0.0,0.0,334.84798669815063,437.02559053897846,0.601247730306607,5,-1,-1,torch_mm,0,torch_mm_cublas
2026-03-03T03:58:39.458069+00:00,TORCH,llm_style,eval,llm_style_eval_218,8,3072,4096,bf16,NVIDIA GeForce RTX 4060,torch_cublas,-1,-1,-1,-1,-1,-1,0.0,0.0,297.9840040206909,308.56927901506424,0.6756288568631377,7,-1,-1,torch_mm,0,torch_mm_cublas
2026-03-03T03:58:39.622828+00:00,TORCH,llm_style,eval,llm_style_eval_219,64,8192,3072,bf16,NVIDIA GeForce RTX 4060,torch_cublas,-1,-1,-1,-1,-1,-1,0.0,0.0,695.2959895133972,801.3209700584408,4.632883722304187,1,-1,-1,torch_mm,0,torch_mm_cublas
2026-03-03T03:58:39.667805+00:00,TORCH,llm_style,eval,llm_style_eval_220,2,4096,2048,bf16,NVIDIA GeForce RTX 4060,torch_cublas,-1,-1,-1,-1,-1,-1,0.0,0.0,266.06400310993195,299.05920803546894,0.1261141364776656,7,-1,-1,torch_mm,0,torch_mm_cublas
2026-03-03T03:58:39.709706+00:00,TORCH,llm_style,eval,llm_style_eval_221,4,1024,8192,bf16,NVIDIA GeForce RTX 4060,torch_cublas,-1,-1,-1,-1,-1,-1,0.0,0.0,217.0559987425804,263.3113670349121,0.3091776517984577,6,-1,-1,torch_mm,0,torch_mm_cublas
2026-03-03T03:58:39.791704+00:00,TORCH,llm_style,eval,llm_style_eval_222,64,6144,2048,bf16,NVIDIA GeForce RTX 4060,torch_cublas,-1,-1,-1,-1,-1,-1,0.0,0.0,318.4640109539032,329.74847227334976,5.057440340513489,1,-1,-1,torch_mm,0,torch_mm_cublas
2026-03-03T03:58:39.818684+00:00,TORCH,llm_style,eval,llm_style_eval_223,4,2048,2048,bf16,NVIDIA GeForce RTX 4060,torch_cublas,-1,-1,-1,-1,-1,-1,0.0,0.0,166.9120043516159,226.969598531723,0.20103066960549118,7,-1,-1,torch_mm,0,torch_mm_cublas
2026-03-03T03:58:39.843763+00:00,TORCH,llm_style,eval,llm_style_eval_224,16,3072,1536,bf16,NVIDIA GeForce RTX 4060,torch_cublas,-1,-1,-1,-1,-1,-1,0.0,0.0,125.95200538635254,238.051514327526,1.1988292170246064,7,-1,-1,torch_mm,0,torch_mm_cublas
2026-03-03T03:58:39.865126+00:00,TORCH,llm_style,eval,llm_style_eval_225,1,2048,2048,bf16,NVIDIA GeForce RTX 4060,torch_cublas,-1,-1,-1,-1,-1,-1,0.0,0.0,98.30400347709656,106.11711867153642,0.08533333031502047,7,-1,-1,torch_mm,0,torch_mm_cublas
2026-03-03T03:58:39.875243+00:00,TORCH,llm_style,eval,llm_style_eval_226,8,1536,1024,bf16,NVIDIA GeForce RTX 4060,torch_cublas,-1,-1,-1,-1,-1,-1,0.0,0.0,49.15200173854828,108.90240311622603,0.5119999818901227,7,-1,-1,torch_mm,0,torch_mm_cublas
2026-03-03T03:58:40.127176+00:00,TORCH,llm_style,eval,llm_style_eval_227,64,6144,6144,bf16,NVIDIA GeForce RTX 4060,torch_cublas,-1,-1,-1,-1,-1,-1,0.0,0.0,940.0320053100586,985.0393795967102,5.140078402337243,1,-1,-1,torch_mm,0,torch_mm_cublas
2026-03-03T03:58:40.208711+00:00,TORCH,llm_style,eval,llm_style_eval_228,64,6144,2048,bf16,NVIDIA GeForce RTX 4060,torch_cublas,-1,-1,-1,-1,-1,-1,0.0,0.0,340.9920036792755,352.25600004196167,4.723315264351133,1,-1,-1,torch_mm,0,torch_mm_cublas
2026-03-03T03:58:40.285157+00:00,TORCH,llm_style,eval,llm_style_eval_229,16,1536,8192,bf16,NVIDIA GeForce RTX 4060,torch_cublas,-1,-1,-1,-1,-1,-1,0.0,0.0,331.7759931087494,350.35135954618454,1.21362965483768,6,-1,-1,torch_mm,0,torch_mm_cublas
2026-03-03T03:58:40.307398+00:00,TORCH,llm_style,eval,llm_style_eval_230,64,2048,1536,bf16,NVIDIA GeForce RTX 4060,torch_cublas,-1,-1,-1,-1,-1,-1,0.0,0.0,135.16800105571747,154.38847631216044,2.9789090676425904,3,-1,-1,torch_mm,0,torch_mm_cublas
2026-03-03T03:58:40.348735+00:00,TORCH,llm_style,eval,llm_style_eval_231,4,1024,8192,bf16,NVIDIA GeForce RTX 4060,torch_cublas,-1,-1,-1,-1,-1,-1,0.0,0.0,231.4240038394928,239.15520280599594,0.2899822960739381,6,-1,-1,torch_mm,0,torch_mm_cublas
2026-03-03T03:58:40.374446+00:00,TORCH,llm_style,eval,llm_style_eval_232,16,3072,1536,bf16,NVIDIA GeForce RTX 4060,torch_cublas,-1,-1,-1,-1,-1,-1,0.0,0.0,135.0559964776039,307.77792692184437,1.1180173256878618,7,-1,-1,torch_mm,0,torch_mm_cublas
2026-03-03T03:58:40.448726+00:00,TORCH,llm_style,eval,llm_style_eval_233,64,3072,3072,bf16,NVIDIA GeForce RTX 4060,torch_cublas,-1,-1,-1,-1,-1,-1,0.0,0.0,504.1760206222534,525.2675211429596,2.3959083784054975,3,-1,-1,torch_mm,0,torch_mm_cublas
2026-03-03T03:58:40.654765+00:00,TORCH,llm_style,eval,llm_style_eval_234,32,8192,4096,bf16,NVIDIA GeForce RTX 4060,torch_cublas,-1,-1,-1,-1,-1,-1,0.0,0.0,1017.1999931335449,1028.010574579239,2.1111715124815813,1,-1,-1,torch_mm,0,torch_mm_cublas
2026-03-03T03:58:40.673652+00:00,TORCH,llm_style,eval,llm_style_eval_235,4,2048,1024,bf16,NVIDIA GeForce RTX 4060,torch_cublas,-1,-1,-1,-1,-1,-1,0.0,0.0,98.30400347709656,147.38687679171562,0.17066666063004093,7,-1,-1,torch_mm,0,torch_mm_cublas
2026-03-03T03:58:40.824912+00:00,TORCH,llm_style,eval,llm_style_eval_236,4,8192,3072,bf16,NVIDIA GeForce RTX 4060,torch_cublas,-1,-1,-1,-1,-1,-1,0.0,0.0,702.3679912090302,726.5628945827484,0.2866397593851677,5,-1,-1,torch_mm,0,torch_mm_cublas
2026-03-03T03:58:40.851399+00:00,TORCH,llm_style,eval,llm_style_eval_237,64,1024,4096,bf16,NVIDIA GeForce RTX 4060,torch_cublas,-1,-1,-1,-1,-1,-1,0.0,0.0,148.47999811172485,161.37215867638588,3.6157793563280327,3,-1,-1,torch_mm,0,torch_mm_cublas
2026-03-03T03:58:40.932900+00:00,TORCH,llm_style,eval,llm_style_eval_238,32,2048,6144,bf16,NVIDIA GeForce RTX 4060,torch_cublas,-1,-1,-1,-1,-1,-1,0.0,0.0,363.5199964046478,488.5014522075653,2.215301430360885,3,-1,-1,torch_mm,0,torch_mm_cublas
2026-03-03T03:58:40.956485+00:00,TORCH,llm_style,eval,llm_style_eval_239,32,2048,6144,bf16,NVIDIA GeForce RTX 4060,torch_cublas,-1,-1,-1,-1,-1,-1,0.0,0.0,363.5199964046478,375.57791471481323,2.215301430360885,3,-1,-1,torch_mm,0,torch_mm_cublas
2026-03-03T03:58:41.040523+00:00,TORCH,llm_style,eval,llm_style_eval_240,8,8192,1536,bf16,NVIDIA GeForce RTX 4060,torch_cublas,-1,-1,-1,-1,-1,-1,0.0,0.0,354.8159897327423,524.5132708549497,0.5674112718303508,5,-1,-1,torch_mm,0,torch_mm_cublas
2026-03-03T03:58:41.057698+00:00,TORCH,llm_style,eval,llm_style_eval_241,16,1536,1536,bf16,NVIDIA GeForce RTX 4060,torch_cublas,-1,-1,-1,-1,-1,-1,0.0,0.0,74.75200295448303,168.80064383149147,1.0099725628217733,7,-1,-1,torch_mm,0,torch_mm_cublas
2026-03-03T03:58:41.096049+00:00,TORCH,llm_style,eval,llm_style_eval_242,1,2048,3072,bf16,NVIDIA GeForce RTX 4060,torch_cublas,-1,-1,-1,-1,-1,-1,0.0,0.0,252.9279887676239,378.7263974547384,0.049748990063572904,7,-1,-1,torch_mm,0,torch_mm_cublas
2026-03-03T03:58:41.158222+00:00,TORCH,llm_style,eval,llm_style_eval_243,8,1536,6144,bf16,NVIDIA GeForce RTX 4060,torch_cublas,-1,-1,-1,-1,-1,-1,0.0,0.0,262.06400990486145,270.30079394578934,0.5761758131336558,7,-1,-1,torch_mm,0,torch_mm_cublas
2026-03-03T03:58:41.210230+00:00,TORCH,llm_style,eval,llm_style_eval_244,32,8192,1024,bf16,NVIDIA GeForce RTX 4060,torch_cublas,-1,-1,-1,-1,-1,-1,0.0,0.0,280.5759906768799,418.3142364025116,1.913459917596005,1,-1,-1,torch_mm,0,torch_mm_cublas
2026-03-03T03:58:41.362379+00:00,TORCH,llm_style,eval,llm_style_eval_245,4,6144,4096,bf16,NVIDIA GeForce RTX 4060,torch_cublas,-1,-1,-1,-1,-1,-1,0.0,0.0,698.3680129051208,790.2435255050657,0.28828151959954085,5,-1,-1,torch_mm,0,torch_mm_cublas
2026-03-03T03:58:41.444199+00:00,TORCH,llm_style,eval,llm_style_eval_246,32,2048,6144,bf16,NVIDIA GeForce RTX 4060,torch_cublas,-1,-1,-1,-1,-1,-1,0.0,0.0,377.20000743865967,494.6739310026169,2.134958515691331,3,-1,-1,torch_mm,0,torch_mm_cublas
2026-03-03T03:58:41.524489+00:00,TORCH,llm_style,eval,llm_style_eval_247,64,6144,2048,bf16,NVIDIA GeForce RTX 4060,torch_cublas,-1,-1,-1,-1,-1,-1,0.0,0.0,367.3439919948578,388.66783648729324,4.384480952726582,1,-1,-1,torch_mm,0,torch_mm_cublas
2026-03-03T03:58:41.535760+00:00,TORCH,llm_style,eval,llm_style_eval_248,64,1024,1024,bf16,NVIDIA GeForce RTX 4060,torch_cublas,-1,-1,-1,-1,-1,-1,0.0,0.0,59.39200147986412,185.19455537199966,2.259862012656777,3,-1,-1,torch_mm,0,torch_mm_cublas
2026-03-03T03:58:41.580267+00:00,TORCH,llm_style,eval,llm_style_eval_249,2,8192,1024,bf16,NVIDIA GeForce RTX 4060,torch_cublas,-1,-1,-1,-1,-1,-1,0.0,0.0,230.3999960422516,245.59455588459969,0.14563555805724349,5,-1,-1,torch_mm,0,torch_mm_cublas
2026-03-03T03:58:41.661220+00:00,TORCH,llm_style,eval,llm_style_eval_250,64,3072,3072,bf16,NVIDIA GeForce RTX 4060,torch_cublas,-1,-1,-1,-1,-1,-1,0.0,0.0,507.9039931297302,518.1849718093872,2.37832261281604,3,-1,-1,torch_mm,0,torch_mm_cublas
2026-03-03T03:58:41.716138+00:00,TORCH,llm_style,eval,llm_style_eval_251,64,1024,8192,bf16,NVIDIA GeForce RTX 4060,torch_cublas,-1,-1,-1,-1,-1,-1,0.0,0.0,238.54400217533112,347.6480057835578,4.501231698170277,2,-1,-1,torch_mm,0,torch_mm_cublas
2026-03-03T03:58:41.815735+00:00,TORCH,llm_style,eval,llm_style_eval_252,64,4096,3072,bf16,NVIDIA GeForce RTX 4060,torch_cublas,-1,-1,-1,-1,-1,-1,0.0,0.0,663.5519862174988,710.5843031406401,2.42725930967536,3,-1,-1,torch_mm,0,torch_mm_cublas
2026-03-03T03:58:41.967861+00:00,TORCH,llm_style,eval,llm_style_eval_253,8,6144,4096,bf16,NVIDIA GeForce RTX 4060,torch_cublas,-1,-1,-1,-1,-1,-1,0.0,0.0,649.2159962654114,662.4220830202103,0.6202145146087682,5,-1,-1,torch_mm,0,torch_mm_cublas
2026-03-03T03:58:41.993272+00:00,TORCH,llm_style,eval,llm_style_eval_254,4,1536,3072,bf16,NVIDIA GeForce RTX 4060,torch_cublas,-1,-1,-1,-1,-1,-1,0.0,0.0,120.60800194740295,163.76831933856002,0.3129869941503731,7,-1,-1,torch_mm,0,torch_mm_cublas
2026-03-03T03:58:42.015893+00:00,TORCH,llm_style,eval,llm_style_eval_255,1,3072,1536,bf16,NVIDIA GeForce RTX 4060,torch_cublas,-1,-1,-1,-1,-1,-1,0.0,0.0,84.99199897050858,177.22175970673538,0.1110361459232723,7,-1,-1,torch_mm,0,torch_mm_cublas
