results/llm_hp_m16_n4096_k4096.csv
timestamp,method,workload,split,shape_id,M,N,K,dtype,gpu,config_id,BLOCK_M,BLOCK_N,BLOCK_K,num_warps,num_stages,GROUP_M,compile_time_ms,tune_time_ms,runtime_cost_us,p99_us,runtime_perf_tflops,bucket_m,bucket_n,bucket_k,cache_key,invalid_config,notes
2026-03-03T03:26:16.743594+00:00,FULL,llm_style,tune,llm_style_tune_000,32,3072,2048,bf16,NVIDIA GeForce RTX 4060,c11,32,128,32,4,2,8,0.7333989487960935,497.013,56.28800019621849,105.09247779846179,7.153446251356623,3,-1,-1,32x3072x2048,0,
2026-03-03T03:26:16.861397+00:00,FULL,llm_style,tune,llm_style_tune_001,4,4096,1536,bf16,NVIDIA GeForce RTX 4060,c11,32,128,32,4,2,8,0.0,117.771,52.22399905323982,66.11968003213404,0.9637647233542828,7,-1,-1,4x4096x1536,0,
2026-03-03T03:26:16.968127+00:00,FULL,llm_style,tune,llm_style_tune_002,8,8192,1024,bf16,NVIDIA GeForce RTX 4060,c11,32,128,32,4,2,8,0.0,106.697,53.247999399900436,125.15328101813768,2.520615413022465,5,-1,-1,8x8192x1024,0,
2026-03-03T03:26:17.071444+00:00,FULL,llm_style,tune,llm_style_tune_003,64,1024,4096,bf16,NVIDIA GeForce RTX 4060,c04,64,64,64,4,3,8,0.0,103.276,65.5359998345375,171.28448188304884,8.192000020682812,3,-1,-1,64x1024x4096,0,
2026-03-03T03:26:17.223640+00:00,FULL,llm_style,tune,llm_style_tune_004,16,3072,4096,bf16,NVIDIA GeForce RTX 4060,c00,32,32,32,2,2,8,0.0,152.154,77.82399654388428,181.7804817855357,5.173894966611581,7,-1,-1,16x3072x4096,0,
2026-03-03T03:26:17.328199+00:00,FULL,llm_style,tune,llm_style_tune_005,16,1536,4096,bf16,NVIDIA GeForce RTX 4060,c04,64,64,64,4,3,8,0.0,104.511,64.51199948787689,72.11328111588954,3.1207619295358113,7,-1,-1,16x1536x4096,0,
2026-03-03T03:26:17.391592+00:00,FULL,llm_style,tune,llm_style_tune_006,2,2048,1024,bf16,NVIDIA GeForce RTX 4060,c11,32,128,32,4,2,8,0.0,63.351,39.93599861860275,45.401919186115265,0.21005128931701406,7,-1,-1,2x2048x1024,0,
2026-03-03T03:26:17.467050+00:00,FULL,llm_style,tune,llm_style_tune_007,32,6144,1024,bf16,NVIDIA GeForce RTX 4060,c11,32,128,32,4,2,8,0.0,75.419,41.728001087903976,106.52352131903169,9.649472141063576,1,-1,-1,32x6144x1024,0,
2026-03-03T03:26:17.540690+00:00,FULL,llm_style,tune,llm_style_tune_008,8,1536,2048,bf16,NVIDIA GeForce RTX 4060,c04,64,64,64,4,3,8,0.0,73.596,46.032000333070755,54.76991944015025,1.0934056229540008,7,-1,-1,8x1536x2048,0,
2026-03-03T03:26:17.653120+00:00,FULL,llm_style,tune,llm_style_tune_009,16,1024,6144,bf16,NVIDIA GeForce RTX 4060,c04,64,64,64,4,3,8,0.0,112.388,70.44799998402596,87.20383971929547,2.8578042250404647,6,-1,-1,16x1024x6144,0,
2026-03-03T03:26:17.727335+00:00,FULL,llm_style,tune,llm_style_tune_010,64,1536,2048,bf16,NVIDIA GeForce RTX 4060,c04,64,64,64,4,3,8,0.0,74.174,49.15200173854828,92.71296143531788,8.191999710241964,3,-1,-1,64x1536x2048,0,
2026-03-03T03:26:17.825032+00:00,FULL,llm_style,tune,llm_style_tune_011,64,1536,4096,bf16,NVIDIA GeForce RTX 4060,c04,64,64,64,4,3,8,0.0,97.658,57.34400078654289,71.31359763443466,14.043428378805825,3,-1,-1,64x1536x4096,0,
2026-03-03T03:26:17.898882+00:00,FULL,llm_style,tune,llm_style_tune_012,32,1024,2048,bf16,NVIDIA GeForce RTX 4060,c04,64,64,64,4,3,8,0.0,73.808,47.968000173568726,54.835199937224374,2.7980680352389697,3,-1,-1,32x1024x2048,0,
2026-03-03T03:26:17.952785+00:00,FULL,llm_style,tune,llm_style_tune_013,64,1536,1024,bf16,NVIDIA GeForce RTX 4060,c04,64,64,64,4,3,8,0.0,53.865,35.840000957250595,57.364480793476105,5.617371278537052,3,-1,-1,64x1536x1024,0,
2026-03-03T03:26:18.191851+00:00,FULL,llm_style,tune,llm_style_tune_014,4,6144,3072,bf16,NVIDIA GeForce RTX 4060,c11,32,128,32,4,2,8,0.0,239.027,176.12800002098083,219.84000265598291,0.8573023254792712,5,-1,-1,4x6144x3072,0,
2026-03-03T03:26:18.288432+00:00,FULL,llm_style,tune,llm_style_tune_015,1,6144,1024,bf16,NVIDIA GeForce RTX 4060,c11,32,128,32,4,2,8,0.0,96.545,39.93599861860275,54.728959426283836,0.31507693397552106,5,-1,-1,1x6144x1024,0,
2026-03-03T03:26:18.704596+00:00,FULL,llm_style,tune,llm_style_tune_016,4,8192,4096,bf16,NVIDIA GeForce RTX 4060,c11,32,128,32,4,2,8,0.0,416.12,293.2479977607727,404.46975141763676,0.9153871741657571,5,-1,-1,4x8192x4096,0,
2026-03-03T03:26:18.731773+00:00,FULL,llm_style,tune,llm_style_tune_017,64,1536,2048,bf16,NVIDIA GeForce RTX 4060,c04,64,64,64,4,3,8,0.0,0.0,68.60800087451935,143.04255992174146,5.868895447579545,3,-1,-1,64x1536x2048,0,
2026-03-03T03:26:18.898162+00:00,FULL,llm_style,tune,llm_style_tune_018,64,8192,1536,bf16,NVIDIA GeForce RTX 4060,c00,32,32,32,2,2,8,0.0,166.345,96.25600278377533,171.53087854385367,16.73259526076519,1,-1,-1,64x8192x1536,0,
2026-03-03T03:26:18.958483+00:00,FULL,llm_style,tune,llm_style_tune_019,2,1536,1024,bf16,NVIDIA GeForce RTX 4060,c04,64,64,64,4,3,8,0.0,60.28,38.76800090074539,44.656318910419934,0.16228476717454454,7,-1,-1,2x1536x1024,0,
2026-03-03T03:26:19.016933+00:00,FULL,llm_style,tune,llm_style_tune_020,16,1024,1536,bf16,NVIDIA GeForce RTX 4060,c04,64,64,64,4,3,8,0.0,58.413,40.62400013208389,58.75071957707403,1.2389633673777298,7,-1,-1,16x1024x1536,0,
2026-03-03T03:26:19.131485+00:00,FULL,llm_style,tune,llm_style_tune_021,1,6144,1536,bf16,NVIDIA GeForce RTX 4060,c11,32,128,32,4,2,8,0.0,114.509,46.959999948740005,64.17408119887111,0.40192436159716016,5,-1,-1,1x6144x1536,0,
2026-03-03T03:26:19.351114+00:00,FULL,llm_style,tune,llm_style_tune_022,8,4096,4096,bf16,NVIDIA GeForce RTX 4060,c03,64,64,32,4,2,8,0.0,219.586,162.1439978480339,268.2879865169525,1.6555374208275386,7,-1,-1,8x4096x4096,0,
2026-03-03T03:26:19.763761+00:00,FULL,llm_style,tune,llm_style_tune_023,2,4096,8192,bf16,NVIDIA GeForce RTX 4060,c04,64,64,64,4,3,8,0.0,412.606,296.4479923248291,348.7616014480591,0.45275303417448226,6,-1,-1,2x4096x8192,0,
2026-03-03T03:26:19.794835+00:00,FULL,llm_style,tune,llm_style_tune_024,64,1536,2048,bf16,NVIDIA GeForce RTX 4060,c04,64,64,64,4,3,8,0.0,0.0,47.47200012207031,150.8723172545432,8.481908977178353,3,-1,-1,64x1536x2048,0,
2026-03-03T03:26:19.819325+00:00,FULL,llm_style,tune,llm_style_tune_025,4,4096,1536,bf16,NVIDIA GeForce RTX 4060,c11,32,128,32,4,2,8,0.0,0.0,50.016000866889954,111.33951663970943,1.0063109230574052,7,-1,-1,4x4096x1536,0,
2026-03-03T03:26:19.896296+00:00,FULL,llm_style,tune,llm_style_tune_026,4,3072,2048,bf16,NVIDIA GeForce RTX 4060,c00,32,32,32,2,2,8,0.0,76.916,45.05600035190582,102.35231705009937,1.1170909003659715,7,-1,-1,4x3072x2048,0,
2026-03-03T03:26:19.965312+00:00,FULL,llm_style,tune,llm_style_tune_027,8,4096,1024,bf16,NVIDIA GeForce RTX 4060,c00,32,32,32,2,2,8,0.0,68.974,39.24799896776676,100.86400419473637,1.7098671464783353,7,-1,-1,8x4096x1024,0,
2026-03-03T03:26:20.023128+00:00,FULL,llm_style,tune,llm_style_tune_028,16,1536,1024,bf16,NVIDIA GeForce RTX 4060,c00,32,32,32,2,2,8,0.0,57.775,15.359999611973763,67.87071865051979,3.276800082778933,7,-1,-1,16x1536x1024,0,
2026-03-03T03:26:20.430241+00:00,FULL,llm_style,tune,llm_style_tune_029,64,4096,8192,bf16,NVIDIA GeForce RTX 4060,c06,64,128,32,4,3,8,0.0,407.073,301.40799283981323,357.5772845745086,14.249679497658875,2,-1,-1,64x4096x8192,0,
2026-03-03T03:26:20.573446+00:00,FULL,llm_style,tune,llm_style_tune_030,1,8192,1536,bf16,NVIDIA GeForce RTX 4060,c00,32,32,32,2,2,8,0.0,143.161,38.91199827194214,155.15904307365415,0.6467368708264476,5,-1,-1,1x8192x1536,0,
2026-03-03T03:26:21.126205+00:00,FULL,llm_style,tune,llm_style_tune_031,1,8192,6144,bf16,NVIDIA GeForce RTX 4060,c11,32,128,32,4,2,8,0.0,552.713,423.93600940704346,460.2329623699188,0.2374492700933735,4,-1,-1,1x8192x6144,0,
2026-03-03T03:26:21.428179+00:00,FULL,llm_style,tune,llm_style_tune_032,32,3072,8192,bf16,NVIDIA GeForce RTX 4060,c10,64,128,64,8,3,8,0.0,301.931,229.16799783706665,288.71678948402393,7.028087478187552,2,-1,-1,32x3072x8192,0,
2026-03-03T03:26:21.558761+00:00,FULL,llm_style,tune,llm_style_tune_033,4,1536,6144,bf16,NVIDIA GeForce RTX 4060,c04,64,64,64,4,3,8,0.0,130.54,72.7040022611618,80.70783980190754,1.038422502915365,6,-1,-1,4x1536x6144,0,
2026-03-03T03:26:21.658538+00:00,FULL,llm_style,tune,llm_style_tune_034,1,4096,1536,bf16,NVIDIA GeForce RTX 4060,c11,32,128,32,4,2,8,0.0,99.734,47.040000557899475,73.48479960113755,0.2674938743785142,7,-1,-1,1x4096x1536,0,
2026-03-03T03:26:21.752481+00:00,FULL,llm_style,tune,llm_style_tune_035,4,1536,4096,bf16,NVIDIA GeForce RTX 4060,c04,64,64,64,4,3,8,0.0,93.901,56.32000043988228,71.60256117582321,0.8936727202927771,7,-1,-1,4x1536x4096,0,
2026-03-03T03:26:22.065502+00:00,FULL,llm_style,tune,llm_style_tune_036,32,8192,3072,bf16,NVIDIA GeForce RTX 4060,c11,32,128,32,4,2,8,0.0,312.982,231.83999955654144,368.66047799587227,6.947087383888653,1,-1,-1,32x8192x3072,0,
2026-03-03T03:26:22.097803+00:00,FULL,llm_style,tune,llm_style_tune_037,32,3072,2048,bf16,NVIDIA GeForce RTX 4060,c11,32,128,32,4,2,8,0.0,0.0,58.17599967122078,65.48895947635174,6.921293768488338,3,-1,-1,32x3072x2048,0,
2026-03-03T03:26:22.208970+00:00,FULL,llm_style,tune,llm_style_tune_038,2,2048,4096,bf16,NVIDIA GeForce RTX 4060,c00,32,32,32,2,2,8,0.0,111.114,63.37599828839302,70.67648157477379,0.5294501531527799,7,-1,-1,2x2048x4096,0,
2026-03-03T03:26:22.287586+00:00,FULL,llm_style,tune,llm_style_tune_039,64,2048,1536,bf16,NVIDIA GeForce RTX 4060,c11,32,128,32,4,2,8,0.0,78.577,47.42399975657463,58.38848114013672,8.490493970706849,3,-1,-1,64x2048x1536,0,
2026-03-03T03:26:22.407001+00:00,FULL,llm_style,tune,llm_style_tune_040,64,1024,6144,bf16,NVIDIA GeForce RTX 4060,c04,64,64,64,4,3,8,0.0,119.373,71.68000191450119,103.40768009424207,11.234742557074105,2,-1,-1,64x1024x6144,0,
2026-03-03T03:26:22.991400+00:00,FULL,llm_style,tune,llm_style_tune_041,4,8192,6144,bf16,NVIDIA GeForce RTX 4060,c11,32,128,32,4,2,8,0.0,584.353,425.9839951992035,495.93280255794514,0.9452307798834243,4,-1,-1,4x8192x6144,0,
2026-03-03T03:26:23.125850+00:00,FULL,llm_style,tune,llm_style_tune_042,1,1024,6144,bf16,NVIDIA GeForce RTX 4060,c04,64,64,64,4,3,8,0.0,134.411,71.68000191450119,76.99008114635944,0.1755428524542829,6,-1,-1,1x1024x6144,0,
2026-03-03T03:26:23.362058+00:00,FULL,llm_style,tune,llm_style_tune_043,64,2048,8192,bf16,NVIDIA GeForce RTX 4060,c10,64,128,64,8,3,8,0.0,236.164,167.93599724769592,388.5465486347668,12.787512404696566,2,-1,-1,64x2048x8192,0,
2026-03-03T03:26:23.428479+00:00,FULL,llm_style,tune,llm_style_tune_044,16,2048,1024,bf16,NVIDIA GeForce RTX 4060,c01,64,32,32,2,2,8,0.0,66.378,40.271999314427376,284.8911947011943,1.6663901753682828,7,-1,-1,16x2048x1024,0,
2026-03-03T03:26:23.487247+00:00,FULL,llm_style,tune,llm_style_tune_045,4,1024,1536,bf16,NVIDIA GeForce RTX 4060,c00,32,32,32,2,2,8,0.0,58.724,38.91199827194214,848.8140680640907,0.3233684354132238,7,-1,-1,4x1024x1536,0,
2026-03-03T03:26:23.522152+00:00,FULL,llm_style,tune,llm_style_tune_046,64,1536,4096,bf16,NVIDIA GeForce RTX 4060,c04,64,64,64,4,3,8,0.0,0.0,66.47999957203865,171.56511813402173,12.1135134353808,3,-1,-1,64x1536x4096,0,
2026-03-03T03:26:23.589749+00:00,FULL,llm_style,tune,llm_style_tune_047,16,2048,1536,bf16,NVIDIA GeForce RTX 4060,c11,32,128,32,4,2,8,0.0,67.546,46.08000069856644,59.803200289607034,2.1845333002161103,7,-1,-1,16x2048x1536,0,
2026-03-03T03:26:24.019061+00:00,FULL,llm_style,tune,llm_style_tune_048,64,6144,6144,bf16,NVIDIA GeForce RTX 4060,c11,32,128,32,4,2,8,0.0,429.272,333.6479961872101,458.4652787446974,14.481843928979728,0,-1,-1,64x6144x6144,0,
2026-03-03T03:26:24.447343+00:00,FULL,llm_style,tune,llm_style_tune_049,4,4096,8192,bf16,NVIDIA GeForce RTX 4060,c06,64,128,32,4,3,8,0.0,428.24,294.9120104312897,431.16543650627113,0.9102221900268849,6,-1,-1,4x4096x8192,0,
2026-03-03T03:26:24.598558+00:00,FULL,llm_style,tune,llm_style_tune_050,1,4096,3072,bf16,NVIDIA GeForce RTX 4060,c00,32,32,32,2,2,8,0.0,151.164,67.04000011086464,130.9043215960262,0.37538520224318395,7,-1,-1,1x4096x3072,0,
2026-03-03T03:26:24.709492+00:00,FULL,llm_style,tune,llm_style_tune_051,2,4096,2048,bf16,NVIDIA GeForce RTX 4060,c11,32,128,32,4,2,8,0.0,110.893,53.247999399900436,57.34400078654289,0.6301538532556162,7,-1,-1,2x4096x2048,0,
2026-03-03T03:26:24.858563+00:00,FULL,llm_style,tune,llm_style_tune_052,4,8192,1536,bf16,NVIDIA GeForce RTX 4060,c11,32,128,32,4,2,8,0.0,149.028,58.75200033187866,76.34367898106572,1.7133594674457473,5,-1,-1,4x8192x1536,0,
2026-03-03T03:26:24.959654+00:00,FULL,llm_style,tune,llm_style_tune_053,1,1536,4096,bf16,NVIDIA GeForce RTX 4060,c04,64,64,64,4,3,8,0.0,101.05,58.479998260736465,106.4368014782666,0.21516608027069967,7,-1,-1,1x1536x4096,0,
2026-03-03T03:26:25.522593+00:00,FULL,llm_style,tune,llm_style_tune_054,8,8192,6144,bf16,NVIDIA GeForce RTX 4060,c11,32,128,32,4,2,8,0.0,562.897,427.0080029964447,452.6169627904892,1.8859280443198274,4,-1,-1,8x8192x6144,0,
2026-03-03T03:26:25.641461+00:00,FULL,llm_style,tune,llm_style_tune_055,64,6144,1536,bf16,NVIDIA GeForce RTX 4060,c06,64,128,32,4,3,8,0.0,118.825,64.51199948787689,71.5238407254219,18.72457157721487,1,-1,-1,64x6144x1536,0,
2026-03-03T03:26:25.716917+00:00,FULL,llm_style,tune,llm_style_tune_056,1,3072,1536,bf16,NVIDIA GeForce RTX 4060,c11,32,128,32,4,2,8,0.0,75.412,45.83999887108803,50.62080152332783,0.2058722563789628,7,-1,-1,1x3072x1536,0,
2026-03-03T03:26:25.767819+00:00,FULL,llm_style,tune,llm_style_tune_057,64,1024,1024,bf16,NVIDIA GeForce RTX 4060,c04,64,64,64,4,3,8,0.0,50.865,35.472000017762184,57.047040611505466,3.7837654469100155,3,-1,-1,64x1024x1024,0,
2026-03-03T03:26:26.172136+00:00,FULL,llm_style,tune,llm_style_tune_058,16,8192,4096,bf16,NVIDIA GeForce RTX 4060,c11,32,128,32,4,2,8,0.0,404.282,298.8319993019104,343.9939197897911,3.593128669313613,5,-1,-1,16x8192x4096,0,
2026-03-03T03:26:26.484659+00:00,FULL,llm_style,tune,llm_style_tune_059,16,4096,6144,bf16,NVIDIA GeForce RTX 4060,c00,32,32,32,2,2,8,0.0,312.48,226.81599855422974,276.9193625450134,3.5504830926089115,6,-1,-1,16x4096x6144,0,
2026-03-03T03:26:26.775590+00:00,FULL,llm_style,tune,llm_style_tune_060,2,3072,8192,bf16,NVIDIA GeForce RTX 4060,c06,64,128,32,4,3,8,0.0,290.883,228.06400060653687,272.025599181652,0.4413817863945457,6,-1,-1,2x3072x8192,0,
2026-03-03T03:26:26.948433+00:00,FULL,llm_style,tune,llm_style_tune_061,64,4096,8192,bf16,NVIDIA GeForce RTX 4060,c06,64,128,32,4,3,8,0.0,0.0,306.17600679397583,420.4598405957222,14.02777226397776,2,-1,-1,64x4096x8192,0,
2026-03-03T03:26:27.101585+00:00,FULL,llm_style,tune,llm_style_tune_062,32,4096,3072,bf16,NVIDIA GeForce RTX 4060,c11,32,128,32,4,2,8,0.0,153.103,80.73600009083748,106.96864135563371,9.974563603521798,3,-1,-1,32x4096x3072,0,
2026-03-03T03:26:27.225492+00:00,FULL,llm_style,tune,llm_style_tune_063,2,3072,8192,bf16,NVIDIA GeForce RTX 4060,c06,64,128,32,4,3,8,0.0,0.0,231.4240038394928,284.23166811466217,0.4349734441109072,6,-1,-1,2x3072x8192,0,
2026-03-03T03:26:27.276682+00:00,FULL,llm_style,eval,llm_style_eval_000,32,1536,1024,bf16,NVIDIA GeForce RTX 4060,c04,64,64,64,4,3,8,0.0,51.138,35.840000957250595,133.1836798787116,2.808685639268526,3,-1,-1,32x1536x1024,0,
2026-03-03T03:26:27.504510+00:00,FULL,llm_style,eval,llm_style_eval_001,32,2048,8192,bf16,NVIDIA GeForce RTX 4060,c10,64,128,64,8,3,8,0.0,227.787,164.86400365829468,180.24863749742508,6.512894265418245,2,-1,-1,32x2048x8192,0,
2026-03-03T03:26:27.632270+00:00,FULL,llm_style,eval,llm_style_eval_002,16,2048,4096,bf16,NVIDIA GeForce RTX 4060,c00,32,32,32,2,2,8,0.0,127.718,60.38400158286095,100.9254404157399,4.4454731214135235,7,-1,-1,16x2048x4096,0,
2026-03-03T03:26:27.655584+00:00,FULL,llm_style,eval,llm_style_eval_003,16,2048,1536,bf16,NVIDIA GeForce RTX 4060,c11,32,128,32,4,2,8,0.0,0.0,47.10400104522705,92.35455933958278,2.137043430840362,7,-1,-1,16x2048x1536,0,
2026-03-03T03:26:27.881290+00:00,FULL,llm_style,eval,llm_style_eval_004,64,8192,2048,bf16,NVIDIA GeForce RTX 4060,c10,64,128,64,8,3,8,0.0,225.664,165.8879965543747,438.67136925458806,12.945382984935252,1,-1,-1,64x8192x2048,0,
2026-03-03T03:26:28.179455+00:00,FULL,llm_style,eval,llm_style_eval_005,64,3072,8192,bf16,NVIDIA GeForce RTX 4060,c10,64,128,64,8,3,8,0.0,298.123,232.464000582695,345.8515280485152,13.85687875940217,2,-1,-1,64x3072x8192,0,
2026-03-03T03:26:28.263030+00:00,FULL,llm_style,eval,llm_style_eval_006,32,2048,2048,bf16,NVIDIA GeForce RTX 4060,c11,32,128,32,4,2,8,0.0,83.537,52.22399905323982,58.38848114013672,5.140078524556174,3,-1,-1,32x2048x2048,0,
2026-03-03T03:26:28.479339+00:00,FULL,llm_style,eval,llm_style_eval_007,8,8192,2048,bf16,NVIDIA GeForce RTX 4060,c11,32,128,32,4,2,8,0.0,216.268,162.60799765586853,188.47743675112724,1.6508133663148403,5,-1,-1,8x8192x2048,0,
2026-03-03T03:26:28.670078+00:00,FULL,llm_style,eval,llm_style_eval_008,64,1536,8192,bf16,NVIDIA GeForce RTX 4060,c04,64,64,64,4,3,8,0.0,190.696,118.78400295972824,135.59040322899816,13.559172075940662,2,-1,-1,64x1536x8192,0,
2026-03-03T03:26:28.984384+00:00,FULL,llm_style,eval,llm_style_eval_009,64,4096,6144,bf16,NVIDIA GeForce RTX 4060,c11,32,128,32,4,2,8,0.0,314.264,233.45600068569183,291.7049607634542,13.797998177553051,2,-1,-1,64x4096x6144,0,
2026-03-03T03:26:29.114195+00:00,FULL,llm_style,eval,llm_style_eval_010,64,2048,4096,bf16,NVIDIA GeForce RTX 4060,c03,64,64,32,4,2,8,0.0,129.758,76.80000364780426,82.96447828412056,13.981012669270863,3,-1,-1,64x2048x4096,0,
2026-03-03T03:26:29.344849+00:00,FULL,llm_style,eval,llm_style_eval_011,32,3072,6144,bf16,NVIDIA GeForce RTX 4060,c06,64,128,32,4,3,8,0.0,230.617,180.2240014076233,202.77248159050941,6.702545402195828,2,-1,-1,32x3072x6144,0,
2026-03-03T03:26:29.414783+00:00,FULL,llm_style,eval,llm_style_eval_012,16,1536,1536,bf16,NVIDIA GeForce RTX 4060,c04,64,64,64,4,3,8,0.0,69.893,44.43199932575226,50.739200375974164,1.6991689130730285,7,-1,-1,16x1536x1536,0,
2026-03-03T03:26:29.509894+00:00,FULL,llm_style,eval,llm_style_eval_013,64,2048,3072,bf16,NVIDIA GeForce RTX 4060,c03,64,64,32,4,2,8,0.0,95.071,64.51199948787689,89.09216023981571,12.483047718143245,3,-1,-1,64x2048x3072,0,
2026-03-03T03:26:30.089797+00:00,FULL,llm_style,eval,llm_style_eval_014,16,8192,6144,bf16,NVIDIA GeForce RTX 4060,c00,32,32,32,2,2,8,0.0,579.859,429.05598878860474,456.67743414640427,3.7538521267291913,4,-1,-1,16x8192x6144,0,
2026-03-03T03:26:30.141899+00:00,FULL,llm_style,eval,llm_style_eval_015,64,6144,1536,bf16,NVIDIA GeForce RTX 4060,c06,64,128,32,4,3,8,0.0,0.0,65.5359998345375,261.90527766942955,18.432000046536324,1,-1,-1,64x6144x1536,0,
2026-03-03T03:26:30.363725+00:00,FULL,llm_style,eval,llm_style_eval_016,16,4096,4096,bf16,NVIDIA GeForce RTX 4060,c00,32,32,32,2,2,8,0.0,221.773,160.76800227165222,245.77024489641178,3.3394139655529265,7,-1,-1,16x4096x4096,0,
2026-03-03T03:26:30.770638+00:00,FULL,llm_style,eval,llm_style_eval_017,64,8192,4096,bf16,NVIDIA GeForce RTX 4060,c10,64,128,64,8,3,8,0.0,406.872,302.0800054073334,338.4627190232277,14.217979406510347,1,-1,-1,64x8192x4096,0,
2026-03-03T03:26:31.083010+00:00,FULL,llm_style,eval,llm_style_eval_018,32,4096,6144,bf16,NVIDIA GeForce RTX 4060,c11,32,128,32,4,2,8,0.0,312.333,228.67199778556824,289.7305609285829,7.043331722278974,2,-1,-1,32x4096x6144,0,
2026-03-03T03:26:31.380323+00:00,FULL,llm_style,eval,llm_style_eval_019,16,3072,8192,bf16,NVIDIA GeForce RTX 4060,c06,64,128,32,4,3,8,0.0,297.273,227.32800245285034,248.9753697812557,3.5424864482633502,6,-1,-1,16x3072x8192,0,
2026-03-03T03:26:31.454982+00:00,FULL,llm_style,eval,llm_style_eval_020,4,1536,1536,bf16,NVIDIA GeForce RTX 4060,c04,64,64,64,4,3,8,0.0,74.61,43.007999658584595,50.64799953252076,0.43885714634097356,7,-1,-1,4x1536x1536,0,
2026-03-03T03:26:31.561441+00:00,FULL,llm_style,eval,llm_style_eval_021,4,6144,1536,bf16,NVIDIA GeForce RTX 4060,c11,32,128,32,4,2,8,0.0,106.414,47.10400104522705,63.150080852210486,1.6027825731302712,5,-1,-1,4x6144x1536,0,
2026-03-03T03:26:31.587614+00:00,FULL,llm_style,eval,llm_style_eval_022,32,6144,1024,bf16,NVIDIA GeForce RTX 4060,c11,32,128,32,4,2,8,0.0,0.0,44.89600099623203,242.37984701991059,8.968575709756271,1,-1,-1,32x6144x1024,0,
2026-03-03T03:26:31.596907+00:00,FULL,llm_style,eval,llm_style_eval_023,16,1024,1536,bf16,NVIDIA GeForce RTX 4060,c04,64,64,64,4,3,8,0.0,0.0,34.81600061058998,49.96960051357746,1.4456470334703126,7,-1,-1,16x1024x1536,0,
2026-03-03T03:26:31.692907+00:00,FULL,llm_style,eval,llm_style_eval_024,32,8192,1024,bf16,NVIDIA GeForce RTX 4060,c02,32,64,32,2,2,8,0.0,95.95,49.15200173854828,77.76832327246666,10.92266628032262,1,-1,-1,32x8192x1024,0,
2026-03-03T03:26:32.116407+00:00,FULL,llm_style,eval,llm_style_eval_025,32,6144,6144,bf16,NVIDIA GeForce RTX 4060,c06,64,128,32,4,3,8,0.0,423.457,326.6560137271881,383.5583940148352,7.395911914904138,0,-1,-1,32x6144x6144,0,
2026-03-03T03:26:32.252828+00:00,FULL,llm_style,eval,llm_style_eval_026,1,6144,2048,bf16,NVIDIA GeForce RTX 4060,c11,32,128,32,4,2,8,0.0,136.38,55.296000093221664,92.81535949558007,0.4551111103438546,5,-1,-1,1x6144x2048,0,
2026-03-03T03:26:32.333615+00:00,FULL,llm_style,eval,llm_style_eval_027,32,4096,3072,bf16,NVIDIA GeForce RTX 4060,c11,32,128,32,4,2,8,0.0,0.0,58.720000088214874,526.9510512053953,13.714345483484173,3,-1,-1,32x4096x3072,0,
2026-03-03T03:26:32.397817+00:00,FULL,llm_style,eval,llm_style_eval_028,64,1536,1536,bf16,NVIDIA GeForce RTX 4060,c04,64,64,64,4,3,8,0.0,64.15,40.8799983561039,68.52831982076167,7.387228477099709,3,-1,-1,64x1536x1536,0,
2026-03-03T03:26:32.457301+00:00,FULL,llm_style,eval,llm_style_eval_029,2,3072,1024,bf16,NVIDIA GeForce RTX 4060,c11,32,128,32,4,2,8,0.0,59.443,39.85599987208843,48.189439512789235,0.3157093546864432,7,-1,-1,2x3072x1024,0,
2026-03-03T03:26:32.646149+00:00,FULL,llm_style,eval,llm_style_eval_030,32,1536,8192,bf16,NVIDIA GeForce RTX 4060,c04,64,64,64,4,3,8,0.0,188.804,97.28000313043594,102.92223758995533,8.278231312556818,2,-1,-1,32x1536x8192,0,
2026-03-03T03:26:32.735816+00:00,FULL,llm_style,eval,llm_style_eval_031,8,3072,2048,bf16,NVIDIA GeForce RTX 4060,c11,32,128,32,4,2,8,0.0,89.623,52.83199995756149,60.33055882900952,1.9053470639169459,7,-1,-1,8x3072x2048,0,
2026-03-03T03:26:32.824963+00:00,FULL,llm_style,eval,llm_style_eval_032,8,2048,3072,bf16,NVIDIA GeForce RTX 4060,c00,32,32,32,2,2,8,0.0,89.107,51.920000463724136,136.78687609732125,1.938815391003939,7,-1,-1,8x2048x3072,0,
2026-03-03T03:26:32.893775+00:00,FULL,llm_style,eval,llm_style_eval_033,64,1536,8192,bf16,NVIDIA GeForce RTX 4060,c04,64,64,64,4,3,8,0.0,0.0,115.07200077176094,172.6463985443114,13.996564978430877,2,-1,-1,64x1536x8192,0,
2026-03-03T03:26:33.041778+00:00,FULL,llm_style,eval,llm_style_eval_034,64,6144,2048,bf16,NVIDIA GeForce RTX 4060,c10,64,128,64,8,3,8,0.0,147.951,94.2080020904541,100.78591957688332,17.096347446722895,1,-1,-1,64x6144x2048,0,
2026-03-03T03:26:33.151834+00:00,FULL,llm_style,eval,llm_style_eval_035,4,4096,2048,bf16,NVIDIA GeForce RTX 4060,c11,32,128,32,4,2,8,0.0,110.014,54.00000140070915,62.48447880148887,1.242756708504802,7,-1,-1,4x4096x2048,0,
2026-03-03T03:26:33.317980+00:00,FULL,llm_style,eval,llm_style_eval_036,64,8192,4096,bf16,NVIDIA GeForce RTX 4060,c10,64,128,64,8,3,8,0.0,0.0,328.67199182510376,416.7475265264509,13.067640087462888,1,-1,-1,64x8192x4096,0,
2026-03-03T03:26:33.350732+00:00,FULL,llm_style,eval,llm_style_eval_037,32,6144,1024,bf16,NVIDIA GeForce RTX 4060,c11,32,128,32,4,2,8,0.0,0.0,66.56000018119812,173.83423909544928,6.049476906608265,1,-1,-1,32x6144x1024,0,
2026-03-03T03:26:33.411985+00:00,FULL,llm_style,eval,llm_style_eval_038,64,6144,2048,bf16,NVIDIA GeForce RTX 4060,c10,64,128,64,8,3,8,0.0,0.0,102.12800279259682,133.82656060159204,15.770530040334366,1,-1,-1,64x6144x2048,0,
2026-03-03T03:26:33.485682+00:00,FULL,llm_style,eval,llm_style_eval_039,8,1024,3072,bf16,NVIDIA GeForce RTX 4060,c04,64,64,64,4,3,8,0.0,73.644,49.15200173854828,61.06112014502284,1.0239999637802455,7,-1,-1,8x1024x3072,0,
2026-03-03T03:26:33.723666+00:00,FULL,llm_style,eval,llm_style_eval_040,32,8192,2048,bf16,NVIDIA GeForce RTX 4060,c11,32,128,32,4,2,8,0.0,237.943,161.79199516773224,171.00800573825836,6.636557160240439,1,-1,-1,32x8192x2048,0,
2026-03-03T03:26:33.788667+00:00,FULL,llm_style,eval,llm_style_eval_041,32,3072,1024,bf16,NVIDIA GeForce RTX 4060,c11,32,128,32,4,2,8,0.0,64.962,41.71200096607208,49.254399873316274,4.826586769686643,3,-1,-1,32x3072x1024,0,
2026-03-03T03:26:33.810003+00:00,FULL,llm_style,eval,llm_style_eval_042,64,1024,4096,bf16,NVIDIA GeForce RTX 4060,c04,64,64,64,4,3,8,0.0,0.0,91.13600105047226,170.52063778042793,5.890876336593639,3,-1,-1,64x1024x4096,0,
2026-03-03T03:26:33.819999+00:00,FULL,llm_style,eval,llm_style_eval_043,2,1536,1024,bf16,NVIDIA GeForce RTX 4060,c04,64,64,64,4,3,8,0.0,0.0,45.16799934208393,149.6188794076442,0.13929011892581492,7,-1,-1,2x1536x1024,0,
2026-03-03T03:26:34.056455+00:00,FULL,llm_style,eval,llm_style_eval_044,64,6144,3072,bf16,NVIDIA GeForce RTX 4060,c11,32,128,32,4,2,8,0.0,236.415,183.19999426603317,233.76831680536264,13.18733176646137,1,-1,-1,64x6144x3072,0,
2026-03-03T03:26:34.196029+00:00,FULL,llm_style,eval,llm_style_eval_045,64,1536,6144,bf16,NVIDIA GeForce RTX 4060,c04,64,64,64,4,3,8,0.0,139.531,72.59200140833855,97.34143935143946,16.640394651816877,2,-1,-1,64x1536x6144,0,
2026-03-03T03:26:34.430743+00:00,FULL,llm_style,eval,llm_style_eval_046,2,6144,3072,bf16,NVIDIA GeForce RTX 4060,c02,32,64,32,2,2,8,0.0,234.675,177.0239993929863,194.06272158026692,0.4264815632845273,5,-1,-1,2x6144x3072,0,
2026-03-03T03:26:34.839837+00:00,FULL,llm_style,eval,llm_style_eval_047,16,4096,8192,bf16,NVIDIA GeForce RTX 4060,c11,32,128,32,4,2,8,0.0,409.055,292.9279953241348,342.96222895383823,3.6655486711397045,6,-1,-1,16x4096x8192,0,
2026-03-03T03:26:34.880155+00:00,FULL,llm_style,eval,llm_style_eval_048,16,1024,6144,bf16,NVIDIA GeForce RTX 4060,c04,64,64,64,4,3,8,0.0,0.0,78.84799689054489,180.53600504994387,2.5533507500447636,6,-1,-1,16x1024x6144,0,
2026-03-03T03:26:35.019340+00:00,FULL,llm_style,eval,llm_style_eval_049,16,8192,1536,bf16,NVIDIA GeForce RTX 4060,c11,32,128,32,4,2,8,0.0,139.135,62.36799992620945,115.32544083893293,6.456086205688785,5,-1,-1,16x8192x1536,0,
2026-03-03T03:26:35.081332+00:00,FULL,llm_style,eval,llm_style_eval_050,1,1024,1024,bf16,NVIDIA GeForce RTX 4060,c00,32,32,32,2,2,8,0.0,61.953,38.83200138807297,98.24736215174195,0.05400576650793303,7,-1,-1,1x1024x1024,0,
2026-03-03T03:26:35.157596+00:00,FULL,llm_style,eval,llm_style_eval_051,16,6144,1024,bf16,NVIDIA GeForce RTX 4060,c11,32,128,32,4,2,8,0.0,76.224,40.95999896526337,65.5359998345375,4.9152001241684,5,-1,-1,16x6144x1024,0,
2026-03-03T03:26:35.905489+00:00,FULL,llm_style,eval,llm_style_eval_052,16,8192,8192,bf16,NVIDIA GeForce RTX 4060,c11,32,128,32,4,2,8,0.0,747.848,559.9519908428192,685.7046258449554,3.8351210159422533,4,-1,-1,16x8192x8192,0,
2026-03-03T03:26:36.460732+00:00,FULL,llm_style,eval,llm_style_eval_053,1,6144,8192,bf16,NVIDIA GeForce RTX 4060,c11,32,128,32,4,2,8,0.0,555.203,424.9599874019623,514.447366595268,0.23687711545601195,4,-1,-1,1x6144x8192,0,
2026-03-03T03:26:36.632215+00:00,FULL,llm_style,eval,llm_style_eval_054,64,4096,3072,bf16,NVIDIA GeForce RTX 4060,c04,64,64,64,4,3,8,0.0,171.441,88.41599896550179,164.36223983764648,18.21630423050957,3,-1,-1,64x4096x3072,0,
2026-03-03T03:26:36.736119+00:00,FULL,llm_style,eval,llm_style_eval_055,4,8192,1024,bf16,NVIDIA GeForce RTX 4060,c11,32,128,32,4,2,8,0.0,103.858,48.43199998140335,81.44224084913728,1.3856306579486308,5,-1,-1,4x8192x1024,0,
2026-03-03T03:26:36.818058+00:00,FULL,llm_style,eval,llm_style_eval_056,64,1024,3072,bf16,NVIDIA GeForce RTX 4060,c04,64,64,64,4,3,8,0.0,81.897,53.567999973893166,62.95968044549226,7.5166738387887655,3,-1,-1,64x1024x3072,0,
2026-03-03T03:26:36.822133+00:00,FULL,llm_style,eval,llm_style_eval_057,64,1024,3072,bf16,NVIDIA GeForce RTX 4060,c04,64,64,64,4,3,8,0.0,0.0,49.50400069355965,59.95519977062939,8.13375037085405,3,-1,-1,64x1024x3072,0,
2026-03-03T03:26:36.942592+00:00,FULL,llm_style,eval,llm_style_eval_058,32,2048,4096,bf16,NVIDIA GeForce RTX 4060,c00,32,32,32,2,2,8,0.0,120.432,67.58400052785873,190.58688491582868,7.943757513713575,3,-1,-1,32x2048x4096,0,
2026-03-03T03:26:37.038638+00:00,FULL,llm_style,eval,llm_style_eval_059,64,8192,2048,bf16,NVIDIA GeForce RTX 4060,c10,64,128,64,8,3,8,0.0,0.0,166.9120043516159,193.01119357347486,12.865962854751436,1,-1,-1,64x8192x2048,0,
2026-03-03T03:26:37.263411+00:00,FULL,llm_style,eval,llm_style_eval_060,1,3072,6144,bf16,NVIDIA GeForce RTX 4060,c04,64,64,64,4,3,8,0.0,224.721,177.15199291706085,185.24383828043938,0.21308671372200275,6,-1,-1,1x3072x6144,0,
2026-03-03T03:26:37.299659+00:00,FULL,llm_style,eval,llm_style_eval_061,64,1536,4096,bf16,NVIDIA GeForce RTX 4060,c04,64,64,64,4,3,8,0.0,0.0,56.32000043988228,141.43936231732363,14.298763524684434,3,-1,-1,64x1536x4096,0,
2026-03-03T03:26:37.434987+00:00,FULL,llm_style,eval,llm_style_eval_062,16,6144,2048,bf16,NVIDIA GeForce RTX 4060,c11,32,128,32,4,2,8,0.0,135.274,62.463998794555664,85.92671848833561,6.4461640588257545,5,-1,-1,16x6144x2048,0,
2026-03-03T03:26:37.478938+00:00,FULL,llm_style,eval,llm_style_eval_063,64,1536,6144,bf16,NVIDIA GeForce RTX 4060,c04,64,64,64,4,3,8,0.0,0.0,70.65600156784058,180.68128049373627,17.09634744672289,2,-1,-1,64x1536x6144,0,
2026-03-03T03:26:37.536372+00:00,FULL,llm_style,eval,llm_style_eval_064,1,6144,2048,bf16,NVIDIA GeForce RTX 4060,c11,32,128,32,4,2,8,0.0,0.0,61.43999844789505,145.09056061506266,0.40960001034736665,5,-1,-1,1x6144x2048,0,
2026-03-03T03:26:37.674721+00:00,FULL,llm_style,eval,llm_style_eval_065,8,1536,6144,bf16,NVIDIA GeForce RTX 4060,c04,64,64,64,4,3,8,0.0,138.295,71.68000191450119,84.00895863771439,2.106514229451395,6,-1,-1,8x1536x6144,0,
2026-03-03T03:26:37.707816+00:00,FULL,llm_style,eval,llm_style_eval_066,64,1536,4096,bf16,NVIDIA GeForce RTX 4060,c04,64,64,64,4,3,8,0.0,0.0,65.34399837255478,78.08960221707821,12.324106085590223,3,-1,-1,64x1536x4096,0,
2026-03-03T03:26:37.793433+00:00,FULL,llm_style,eval,llm_style_eval_067,64,8192,2048,bf16,NVIDIA GeForce RTX 4060,c10,64,128,64,8,3,8,0.0,0.0,166.6879951953888,291.0393568873404,12.883253202984154,1,-1,-1,64x8192x2048,0,
2026-03-03T03:26:37.812616+00:00,FULL,llm_style,eval,llm_style_eval_068,64,1024,4096,bf16,NVIDIA GeForce RTX 4060,c04,64,64,64,4,3,8,0.0,0.0,50.175998359918594,102.55360096693025,10.699755451779136,3,-1,-1,64x1024x4096,0,
2026-03-03T03:26:37.849624+00:00,FULL,llm_style,eval,llm_style_eval_069,64,2048,4096,bf16,NVIDIA GeForce RTX 4060,c03,64,64,32,4,2,8,0.0,0.0,78.84799689054489,174.6015991270541,13.617870666905405,3,-1,-1,64x2048x4096,0,
2026-03-03T03:26:37.965677+00:00,FULL,llm_style,eval,llm_style_eval_070,64,8192,1024,bf16,NVIDIA GeForce RTX 4060,c06,64,128,32,4,3,8,0.0,116.002,65.32799825072289,73.63392189145088,16.436166004644395,1,-1,-1,64x8192x1024,0,
2026-03-03T03:26:38.027711+00:00,FULL,llm_style,eval,llm_style_eval_071,64,6144,2048,bf16,NVIDIA GeForce RTX 4060,c10,64,128,64,8,3,8,0.0,0.0,96.73600271344185,177.3366360366344,16.649568834997964,1,-1,-1,64x6144x2048,0,
2026-03-03T03:26:38.045253+00:00,FULL,llm_style,eval,llm_style_eval_072,64,1536,1024,bf16,NVIDIA GeForce RTX 4060,c04,64,64,64,4,3,8,0.0,0.0,73.72800260782242,108.69728237390513,2.730666570080655,3,-1,-1,64x1536x1024,0,
2026-03-03T03:26:38.071802+00:00,FULL,llm_style,eval,llm_style_eval_073,1,4096,1536,bf16,NVIDIA GeForce RTX 4060,c11,32,128,32,4,2,8,0.0,0.0,48.46400022506714,135.1599968969822,0.25963420150142114,7,-1,-1,1x4096x1536,0,
2026-03-03T03:26:38.135500+00:00,FULL,llm_style,eval,llm_style_eval_074,8,1024,2048,bf16,NVIDIA GeForce RTX 4060,c04,64,64,64,4,3,8,0.0,63.65,43.007999658584595,76.93280033767212,0.780190482383953,7,-1,-1,8x1024x2048,0,
2026-03-03T03:26:38.218259+00:00,FULL,llm_style,eval,llm_style_eval_075,2,6144,1024,bf16,NVIDIA GeForce RTX 4060,c11,32,128,32,4,2,8,0.0,82.719,40.95999896526337,95.19104212522487,0.61440001552105,5,-1,-1,2x6144x1024,0,
2026-03-03T03:26:38.244606+00:00,FULL,llm_style,eval,llm_style_eval_076,64,1024,6144,bf16,NVIDIA GeForce RTX 4060,c04,64,64,64,4,3,8,0.0,0.0,71.63200154900551,125.60191698372358,11.242270920617328,2,-1,-1,64x1024x6144,0,
2026-03-03T03:26:38.645265+00:00,FULL,llm_style,eval,llm_style_eval_077,1,4096,8192,bf16,NVIDIA GeForce RTX 4060,c06,64,128,32,4,3,8,0.0,400.6,293.88800263404846,358.316811621189,0.22834843000911628,6,-1,-1,1x4096x8192,0,
2026-03-03T03:26:38.744906+00:00,FULL,llm_style,eval,llm_style_eval_078,64,6144,3072,bf16,NVIDIA GeForce RTX 4060,c11,32,128,32,4,2,8,0.0,0.0,187.391996383667,261.42528221011145,12.892328117651509,1,-1,-1,64x6144x3072,0,
2026-03-03T03:26:38.883467+00:00,FULL,llm_style,eval,llm_style_eval_079,2,3072,4096,bf16,NVIDIA GeForce RTX 4060,c00,32,32,32,2,2,8,0.0,138.509,68.4639997780323,150.50400152802465,0.7351549451270835,7,-1,-1,2x3072x4096,0,
2026-03-03T03:26:38.933880+00:00,FULL,llm_style,eval,llm_style_eval_080,4,1536,1024,bf16,NVIDIA GeForce RTX 4060,c04,64,64,64,4,3,8,0.0,50.369,34.68799963593483,40.26112057268618,0.3627453912610402,7,-1,-1,4x1536x1024,0,
2026-03-03T03:26:39.238304+00:00,FULL,llm_style,eval,llm_style_eval_081,4,4096,6144,bf16,NVIDIA GeForce RTX 4060,c11,32,128,32,4,2,8,0.0,304.382,226.19199752807617,258.8038486242294,0.8900694728380488,6,-1,-1,4x4096x6144,0,
2026-03-03T03:26:39.332475+00:00,FULL,llm_style,eval,llm_style_eval_082,64,6144,1024,bf16,NVIDIA GeForce RTX 4060,c06,64,128,32,4,3,8,0.0,94.132,54.27199974656105,61.96223862469196,14.838339691933468,1,-1,-1,64x6144x1024,0,
2026-03-03T03:26:39.419682+00:00,FULL,llm_style,eval,llm_style_eval_083,8,4096,4096,bf16,NVIDIA GeForce RTX 4060,c03,64,64,32,4,2,8,0.0,0.0,166.78400337696075,365.12958914041485,1.6094796297297729,7,-1,-1,8x4096x4096,0,
2026-03-03T03:26:39.574146+00:00,FULL,llm_style,eval,llm_style_eval_084,64,1024,8192,bf16,NVIDIA GeForce RTX 4060,c04,64,64,64,4,3,8,0.0,154.415,85.87199822068214,97.94559955596921,12.503980881411362,2,-1,-1,64x1024x8192,0,
2026-03-03T03:26:39.871931+00:00,FULL,llm_style,eval,llm_style_eval_085,1,3072,8192,bf16,NVIDIA GeForce RTX 4060,c07,128,128,32,8,3,8,0.0,297.738,228.35199534893036,247.8355132043361,0.22041256054317093,6,-1,-1,1x3072x8192,0,
2026-03-03T03:26:39.937967+00:00,FULL,llm_style,eval,llm_style_eval_086,8,1536,1024,bf16,NVIDIA GeForce RTX 4060,c00,32,32,32,2,2,8,0.0,65.992,21.503999829292297,120.5881562083959,1.1702857235759294,7,-1,-1,8x1536x1024,0,
2026-03-03T03:26:40.017763+00:00,FULL,llm_style,eval,llm_style_eval_087,16,1024,3072,bf16,NVIDIA GeForce RTX 4060,c00,32,32,32,2,2,8,0.0,79.756,35.840000957250595,105.70368155837043,2.808685639268526,7,-1,-1,16x1024x3072,0,
2026-03-03T03:26:40.114123+00:00,FULL,llm_style,eval,llm_style_eval_088,8,4096,1536,bf16,NVIDIA GeForce RTX 4060,c11,32,128,32,4,2,8,0.0,96.321,47.919999808073044,120.62368161976336,2.1006530968942396,7,-1,-1,8x4096x1536,0,
2026-03-03T03:26:40.348080+00:00,FULL,llm_style,eval,llm_style_eval_089,16,6144,3072,bf16,NVIDIA GeForce RTX 4060,c06,64,128,32,4,3,8,0.0,233.915,179.19999361038208,223.5392010211944,3.370422977319839,5,-1,-1,16x6144x3072,0,
2026-03-03T03:26:40.446326+00:00,FULL,llm_style,eval,llm_style_eval_090,32,1536,3072,bf16,NVIDIA GeForce RTX 4060,c04,64,64,64,4,3,8,0.0,98.195,56.04800023138523,87.73856319487089,5.388058213554149,3,-1,-1,32x1536x3072,0,
2026-03-03T03:26:40.534567+00:00,FULL,llm_style,eval,llm_style_eval_091,16,1024,4096,bf16,NVIDIA GeForce RTX 4060,c04,64,64,64,4,3,8,0.0,88.202,57.34400078654289,74.37311902642247,2.340571396467637,7,-1,-1,16x1024x4096,0,
2026-03-03T03:26:40.844520+00:00,FULL,llm_style,eval,llm_style_eval_092,1,4096,6144,bf16,NVIDIA GeForce RTX 4060,c11,32,128,32,4,2,8,0.0,309.911,224.2559939622879,296.04320585727686,0.22443836220700544,6,-1,-1,1x4096x6144,0,
2026-03-03T03:26:40.943084+00:00,FULL,llm_style,eval,llm_style_eval_093,32,2048,3072,bf16,NVIDIA GeForce RTX 4060,c00,32,32,32,2,2,8,0.0,98.52,61.43999844789505,120.3891225904226,6.553600165557866,3,-1,-1,32x2048x3072,0,
2026-03-03T03:26:40.955831+00:00,FULL,llm_style,eval,llm_style_eval_094,32,1024,2048,bf16,NVIDIA GeForce RTX 4060,c04,64,64,64,4,3,8,0.0,0.0,47.79199883341789,253.70911538600916,2.8083723484306358,3,-1,-1,32x1024x2048,0,
2026-03-03T03:26:41.088971+00:00,FULL,llm_style,eval,llm_style_eval_095,8,6144,2048,bf16,NVIDIA GeForce RTX 4060,c02,32,64,32,2,2,8,0.0,133.101,59.39200147986412,111.35008335113508,3.3897930189851655,5,-1,-1,8x6144x2048,0,
2026-03-03T03:26:41.126541+00:00,FULL,llm_style,eval,llm_style_eval_096,64,2048,3072,bf16,NVIDIA GeForce RTX 4060,c03,64,64,32,4,2,8,0.0,0.0,69.63200122117996,178.60608071088782,11.565176267762501,3,-1,-1,64x2048x3072,0,
2026-03-03T03:26:41.151080+00:00,FULL,llm_style,eval,llm_style_eval_097,64,6144,1024,bf16,NVIDIA GeForce RTX 4060,c06,64,128,32,4,3,8,0.0,0.0,49.15200173854828,108.03423896431923,16.383999420483928,1,-1,-1,64x6144x1024,0,
2026-03-03T03:26:41.173404+00:00,FULL,llm_style,eval,llm_style_eval_098,32,6144,1024,bf16,NVIDIA GeForce RTX 4060,c11,32,128,32,4,2,8,0.0,0.0,40.65600037574768,117.72224143147466,9.903905457463363,1,-1,-1,32x6144x1024,0,
2026-03-03T03:26:41.244995+00:00,FULL,llm_style,eval,llm_style_eval_099,1,2048,2048,bf16,NVIDIA GeForce RTX 4060,c00,32,32,32,2,2,8,0.0,71.54,43.007999658584595,63.63136101514098,0.19504762059598826,7,-1,-1,1x2048x2048,0,
2026-03-03T03:26:41.281518+00:00,FULL,llm_style,eval,llm_style_eval_100,64,8192,1024,bf16,NVIDIA GeForce RTX 4060,c06,64,128,32,4,3,8,0.0,0.0,66.41599908471107,143.6876763403415,16.16691518304924,1,-1,-1,64x8192x1024,0,
2026-03-03T03:26:41.342174+00:00,FULL,llm_style,eval,llm_style_eval_101,64,8192,1536,bf16,NVIDIA GeForce RTX 4060,c00,32,32,32,2,2,8,0.0,0.0,116.73600226640701,171.87648549675924,13.797052363711826,1,-1,-1,64x8192x1536,0,
2026-03-03T03:26:41.366323+00:00,FULL,llm_style,eval,llm_style_eval_102,32,3072,2048,bf16,NVIDIA GeForce RTX 4060,c11,32,128,32,4,2,8,0.0,0.0,48.128001391887665,85.50880070775737,8.366297630382595,3,-1,-1,32x3072x2048,0,
2026-03-03T03:26:41.392539+00:00,FULL,llm_style,eval,llm_style_eval_103,64,2048,3072,bf16,NVIDIA GeForce RTX 4060,c03,64,64,32,4,2,8,0.0,0.0,63.4239986538887,102.24640101194375,12.69718694960625,3,-1,-1,64x2048x3072,0,
2026-03-03T03:26:41.454590+00:00,FULL,llm_style,eval,llm_style_eval_104,16,6144,2048,bf16,NVIDIA GeForce RTX 4060,c11,32,128,32,4,2,8,0.0,0.0,61.23200058937073,163.27135786414135,6.575861969629923,5,-1,-1,16x6144x2048,0,
2026-03-03T03:26:41.594772+00:00,FULL,llm_style,eval,llm_style_eval_105,1,1024,8192,bf16,NVIDIA GeForce RTX 4060,c04,64,64,64,4,3,8,0.0,140.132,84.9439986050129,153.13408195972437,0.19750913867398173,6,-1,-1,1x1024x8192,0,
2026-03-03T03:26:42.007687+00:00,FULL,llm_style,eval,llm_style_eval_106,32,4096,8192,bf16,NVIDIA GeForce RTX 4060,c11,32,128,32,4,2,8,0.0,412.873,295.8719879388809,374.13087517023075,7.258151280085397,2,-1,-1,32x4096x8192,0,
2026-03-03T03:26:42.065652+00:00,FULL,llm_style,eval,llm_style_eval_107,64,6144,1536,bf16,NVIDIA GeForce RTX 4060,c06,64,128,32,4,3,8,0.0,0.0,55.296000093221664,128.56319837272147,21.845333296505025,1,-1,-1,64x6144x1536,0,
2026-03-03T03:26:42.133307+00:00,FULL,llm_style,eval,llm_style_eval_108,8,3072,1536,bf16,NVIDIA GeForce RTX 4060,c00,32,32,32,2,2,8,0.0,67.604,42.49599948525429,251.10112562775583,1.7765783347723567,7,-1,-1,8x3072x1536,0,
2026-03-03T03:26:42.145304+00:00,FULL,llm_style,eval,llm_style_eval_109,16,2048,1024,bf16,NVIDIA GeForce RTX 4060,c01,64,32,32,2,2,8,0.0,0.0,41.98399931192398,118.36415901780127,1.5984390505870707,7,-1,-1,16x2048x1024,0,
2026-03-03T03:26:42.912040+00:00,FULL,llm_style,eval,llm_style_eval_110,1,8192,8192,bf16,NVIDIA GeForce RTX 4060,c02,32,64,32,2,2,8,0.0,766.697,560.8000159263611,769.6895807981489,0.23933260375945528,4,-1,-1,1x8192x8192,0,
2026-03-03T03:26:43.031798+00:00,FULL,llm_style,eval,llm_style_eval_111,8,6144,1536,bf16,NVIDIA GeForce RTX 4060,c11,32,128,32,4,2,8,0.0,119.71,48.128001391887665,56.80480003356932,3.137361611393473,5,-1,-1,8x6144x1536,0,
2026-03-03T03:26:43.135397+00:00,FULL,llm_style,eval,llm_style_eval_112,2,6144,3072,bf16,NVIDIA GeForce RTX 4060,c02,32,64,32,2,2,8,0.0,0.0,177.13599652051926,576.5677011013022,0.42621191334904335,5,-1,-1,2x6144x3072,0,
2026-03-03T03:26:43.473656+00:00,FULL,llm_style,eval,llm_style_eval_113,1,8192,8192,bf16,NVIDIA GeForce RTX 4060,c02,32,64,32,2,2,8,0.0,0.0,557.9839944839478,577.5203031301498,0.24054046231941015,4,-1,-1,1x8192x8192,0,
2026-03-03T03:26:43.528886+00:00,FULL,llm_style,eval,llm_style_eval_114,1,3072,1024,bf16,NVIDIA GeForce RTX 4060,c06,64,128,32,4,3,8,0.0,55.176,38.91199827194214,47.16543916612862,0.1616842177066119,7,-1,-1,1x3072x1024,0,
2026-03-03T03:26:43.606354+00:00,FULL,llm_style,eval,llm_style_eval_115,16,3072,1536,bf16,NVIDIA GeForce RTX 4060,c11,32,128,32,4,2,8,0.0,77.428,46.751998364925385,53.26847940683365,3.229700318292287,7,-1,-1,16x3072x1536,0,
2026-03-03T03:26:43.664061+00:00,FULL,llm_style,eval,llm_style_eval_116,8,3072,1024,bf16,NVIDIA GeForce RTX 4060,c00,32,32,32,2,2,8,0.0,57.664,16.70399960130453,124.90527972578998,3.013149497206002,7,-1,-1,8x3072x1024,0,
2026-03-03T03:26:43.761826+00:00,FULL,llm_style,eval,llm_style_eval_117,4,1024,4096,bf16,NVIDIA GeForce RTX 4060,c04,64,64,64,4,3,8,0.0,97.722,59.39200147986412,75.39711937308309,0.5649655031641942,7,-1,-1,4x1024x4096,0,
2026-03-03T03:26:43.857872+00:00,FULL,llm_style,eval,llm_style_eval_118,64,6144,3072,bf16,NVIDIA GeForce RTX 4060,c11,32,128,32,4,2,8,0.0,0.0,184.32000279426575,279.2431965470313,13.107199801296662,1,-1,-1,64x6144x3072,0,
2026-03-03T03:26:44.428119+00:00,FULL,llm_style,eval,llm_style_eval_119,64,8192,6144,bf16,NVIDIA GeForce RTX 4060,c06,64,128,32,4,3,8,0.0,570.198,440.2400106191635,528.0271944403646,14.633951455114657,0,-1,-1,64x8192x6144,0,
2026-03-03T03:26:44.517984+00:00,FULL,llm_style,eval,llm_style_eval_120,8,1024,4096,bf16,NVIDIA GeForce RTX 4060,c04,64,64,64,4,3,8,0.0,89.823,57.34400078654289,69.07712034881115,1.1702856982338186,7,-1,-1,8x1024x4096,0,
2026-03-03T03:26:44.575291+00:00,FULL,llm_style,eval,llm_style_eval_121,4,1024,2048,bf16,NVIDIA GeForce RTX 4060,c04,64,64,64,4,3,8,0.0,57.262,40.95999896526337,54.81504116207359,0.4096000103473666,7,-1,-1,4x1024x2048,0,
2026-03-03T03:26:44.863396+00:00,FULL,llm_style,eval,llm_style_eval_122,4,6144,4096,bf16,NVIDIA GeForce RTX 4060,c11,32,128,32,4,2,8,0.0,288.067,226.30399465560913,261.257275044918,0.8896289802854788,5,-1,-1,4x6144x4096,0,
2026-03-03T03:26:45.164049+00:00,FULL,llm_style,eval,llm_style_eval_123,4,3072,8192,bf16,NVIDIA GeForce RTX 4060,c06,64,128,32,4,3,8,0.0,300.615,227.32800245285034,310.36703571677185,0.8856216120658376,6,-1,-1,4x3072x8192,0,
2026-03-03T03:26:45.205351+00:00,FULL,llm_style,eval,llm_style_eval_124,64,6144,1024,bf16,NVIDIA GeForce RTX 4060,c06,64,128,32,4,3,8,0.0,0.0,60.30400097370148,90.81855714321134,13.35411175041592,1,-1,-1,64x6144x1024,0,
2026-03-03T03:26:45.267450+00:00,FULL,llm_style,eval,llm_style_eval_125,64,1536,8192,bf16,NVIDIA GeForce RTX 4060,c04,64,64,64,4,3,8,0.0,0.0,119.80800330638885,149.00224208831787,13.443281680282478,2,-1,-1,64x1536x8192,0,
2026-03-03T03:26:45.349188+00:00,FULL,llm_style,eval,llm_style_eval_126,64,2048,8192,bf16,NVIDIA GeForce RTX 4060,c10,64,128,64,8,3,8,0.0,0.0,161.79200261831284,280.07040143013,13.273113709249134,2,-1,-1,64x2048x8192,0,
2026-03-03T03:26:45.482343+00:00,FULL,llm_style,eval,llm_style_eval_127,2,8192,1536,bf16,NVIDIA GeForce RTX 4060,c11,32,128,32,4,2,8,0.0,133.103,59.29600074887276,287.73248143494044,0.8488202806992313,5,-1,-1,2x8192x1536,0,
2026-03-03T03:26:45.558916+00:00,FULL,llm_style,eval,llm_style_eval_128,8,2048,2048,bf16,NVIDIA GeForce RTX 4060,c00,32,32,32,2,2,8,0.0,76.533,43.007999658584595,274.92991700768385,1.560380964767906,7,-1,-1,8x2048x2048,0,
2026-03-03T03:26:45.810469+00:00,FULL,llm_style,eval,llm_style_eval_129,64,8192,6144,bf16,NVIDIA GeForce RTX 4060,c06,64,128,32,4,3,8,0.0,0.0,464.89599347114563,515.0479978322983,13.857832793734023,0,-1,-1,64x8192x6144,0,
2026-03-03T03:26:45.831672+00:00,FULL,llm_style,eval,llm_style_eval_130,16,3072,1536,bf16,NVIDIA GeForce RTX 4060,c11,32,128,32,4,2,8,0.0,0.0,69.32799890637398,108.67711924016461,2.1779792635283695,7,-1,-1,16x3072x1536,0,
2026-03-03T03:26:46.570198+00:00,FULL,llm_style,eval,llm_style_eval_131,32,8192,8192,bf16,NVIDIA GeForce RTX 4060,c11,32,128,32,4,2,8,0.0,738.479,561.6639852523804,612.3747289180756,7.646862552652512,0,-1,-1,32x8192x8192,0,
2026-03-03T03:26:46.975711+00:00,FULL,llm_style,eval,llm_style_eval_132,32,8192,4096,bf16,NVIDIA GeForce RTX 4060,c11,32,128,32,4,2,8,0.0,405.466,295.3120023012161,330.66016256809235,7.271914555675871,1,-1,-1,32x8192x4096,0,
2026-03-03T03:26:47.712364+00:00,FULL,llm_style,eval,llm_style_eval_133,2,8192,8192,bf16,NVIDIA GeForce RTX 4060,c11,32,128,32,4,2,8,0.0,736.611,559.4879984855652,701.1327987909315,0.4797876929024522,4,-1,-1,2x8192x8192,0,
2026-03-03T03:26:47.829434+00:00,FULL,llm_style,eval,llm_style_eval_134,64,3072,3072,bf16,NVIDIA GeForce RTX 4060,c03,64,64,32,4,2,8,0.0,117.024,63.48799914121628,72.22272209823132,19.02658090252832,3,-1,-1,64x3072x3072,0,
2026-03-03T03:26:47.939625+00:00,FULL,llm_style,eval,llm_style_eval_135,8,3072,3072,bf16,NVIDIA GeForce RTX 4060,c00,32,32,32,2,2,8,0.0,110.144,53.247999399900436,206.76000043749795,2.835692339650273,7,-1,-1,8x3072x3072,0,
2026-03-03T03:26:48.058667+00:00,FULL,llm_style,eval,llm_style_eval_136,4,2048,4096,bf16,NVIDIA GeForce RTX 4060,c00,32,32,32,2,2,8,0.0,118.999,62.97599896788597,633.5244590044006,1.0656260337247137,7,-1,-1,4x2048x4096,0,
2026-03-03T03:26:48.777542+00:00,FULL,llm_style,eval,llm_style_eval_137,4,8192,8192,bf16,NVIDIA GeForce RTX 4060,c11,32,128,32,4,2,8,0.0,718.83,557.0560097694397,638.2188814878464,0.9637646889802084,4,-1,-1,4x8192x8192,0,
2026-03-03T03:26:48.840659+00:00,FULL,llm_style,eval,llm_style_eval_138,16,1024,1024,bf16,NVIDIA GeForce RTX 4060,c04,64,64,64,4,3,8,0.0,63.076,40.95999896526337,44.97759975492954,0.8192000206947332,7,-1,-1,16x1024x1024,0,
2026-03-03T03:26:48.888301+00:00,FULL,llm_style,eval,llm_style_eval_139,4,1024,1024,bf16,NVIDIA GeForce RTX 4060,c00,32,32,32,2,2,8,0.0,47.601,34.65599939227104,84.6649623662232,0.2420535591846421,7,-1,-1,4x1024x1024,0,
2026-03-03T03:26:49.021900+00:00,FULL,llm_style,eval,llm_style_eval_140,64,4096,6144,bf16,NVIDIA GeForce RTX 4060,c11,32,128,32,4,2,8,0.0,0.0,234.49599742889404,303.5212734341619,13.736803644065475,2,-1,-1,64x4096x6144,0,
2026-03-03T03:26:49.146394+00:00,FULL,llm_style,eval,llm_style_eval_141,4,6144,4096,bf16,NVIDIA GeForce RTX 4060,c11,32,128,32,4,2,8,0.0,0.0,233.34399610757828,254.96383666992188,0.8627888240466348,5,-1,-1,4x6144x4096,0,
2026-03-03T03:26:49.312916+00:00,FULL,llm_style,eval,llm_style_eval_142,4,2048,6144,bf16,NVIDIA GeForce RTX 4060,c00,32,32,32,2,2,8,0.0,166.47,84.3999981880188,108.95199880003929,1.1926931061746147,6,-1,-1,4x2048x6144,0,
2026-03-03T03:26:49.379918+00:00,FULL,llm_style,eval,llm_style_eval_143,64,1536,8192,bf16,NVIDIA GeForce RTX 4060,c04,64,64,64,4,3,8,0.0,0.0,117.45600029826164,205.86496263742447,13.712477284345576,2,-1,-1,64x1536x8192,0,
2026-03-03T03:26:49.495733+00:00,FULL,llm_style,eval,llm_style_eval_144,1,3072,3072,bf16,NVIDIA GeForce RTX 4060,c00,32,32,32,2,2,8,0.0,115.763,56.32000043988228,157.4179184436797,0.33512727010979143,7,-1,-1,1x3072x3072,0,
2026-03-03T03:26:49.508533+00:00,FULL,llm_style,eval,llm_style_eval_145,32,1024,2048,bf16,NVIDIA GeForce RTX 4060,c04,64,64,64,4,3,8,0.0,0.0,62.36799992620945,160.30591785907745,2.152028735229595,3,-1,-1,32x1024x2048,0,
2026-03-03T03:26:49.683999+00:00,FULL,llm_style,eval,llm_style_eval_146,64,8192,4096,bf16,NVIDIA GeForce RTX 4060,c10,64,128,64,8,3,8,0.0,0.0,327.66400277614594,412.60960817337036,13.107839920194843,1,-1,-1,64x8192x4096,0,
2026-03-03T03:26:49.732249+00:00,FULL,llm_style,eval,llm_style_eval_147,64,2048,4096,bf16,NVIDIA GeForce RTX 4060,c03,64,64,32,4,2,8,0.0,0.0,55.08799850940704,119.74207937717429,19.49139291776309,3,-1,-1,64x2048x4096,0,
2026-03-03T03:26:49.763529+00:00,FULL,llm_style,eval,llm_style_eval_148,64,1024,6144,bf16,NVIDIA GeForce RTX 4060,c04,64,64,64,4,3,8,0.0,0.0,81.7280001938343,99.55968134105204,9.853494103490295,2,-1,-1,64x1024x6144,0,
2026-03-03T03:26:49.926520+00:00,FULL,llm_style,eval,llm_style_eval_149,64,4096,8192,bf16,NVIDIA GeForce RTX 4060,c06,64,128,32,4,3,8,0.0,0.0,304.1279911994934,371.21024221181847,14.122236098888731,2,-1,-1,64x4096x8192,0,
2026-03-03T03:26:50.016580+00:00,FULL,llm_style,eval,llm_style_eval_150,2,2048,3072,bf16,NVIDIA GeForce RTX 4060,c00,32,32,32,2,2,8,0.0,90.004,59.39200147986412,178.38624410331215,0.4237241273731457,7,-1,-1,2x2048x3072,0,
2026-03-03T03:26:50.136861+00:00,FULL,llm_style,eval,llm_style_eval_151,64,4096,2048,bf16,NVIDIA GeForce RTX 4060,c04,64,64,64,4,3,8,0.0,120.238,67.90399923920631,106.13216206431376,15.812644851999298,3,-1,-1,64x4096x2048,0,
2026-03-03T03:26:50.877447+00:00,FULL,llm_style,eval,llm_style_eval_152,8,8192,8192,bf16,NVIDIA GeForce RTX 4060,c11,32,128,32,4,2,8,0.0,740.547,558.4799945354462,633.3645004034041,1.9226146585486164,4,-1,-1,8x8192x8192,0,
2026-03-03T03:26:50.972949+00:00,FULL,llm_style,eval,llm_style_eval_153,64,8192,2048,bf16,NVIDIA GeForce RTX 4060,c10,64,128,64,8,3,8,0.0,0.0,172.03199863433838,297.1936029195785,12.483047718143249,1,-1,-1,64x8192x2048,0,
2026-03-03T03:26:51.203872+00:00,FULL,llm_style,eval,llm_style_eval_154,16,2048,8192,bf16,NVIDIA GeForce RTX 4060,c04,64,64,64,4,3,8,0.0,230.872,163.69599848985672,220.94847649335856,3.279682563732716,6,-1,-1,16x2048x8192,0,
2026-03-03T03:26:51.278226+00:00,FULL,llm_style,eval,llm_style_eval_155,4,2048,1536,bf16,NVIDIA GeForce RTX 4060,c00,32,32,32,2,2,8,0.0,74.311,28.16000021994114,130.84864348173136,0.8936727202927771,7,-1,-1,4x2048x1536,0,
2026-03-03T03:26:51.399955+00:00,FULL,llm_style,eval,llm_style_eval_156,1,4096,6144,bf16,NVIDIA GeForce RTX 4060,c11,32,128,32,4,2,8,0.0,0.0,232.44799673557281,348.6828738451004,0.2165286374020941,6,-1,-1,1x4096x6144,0,
2026-03-03T03:26:51.565758+00:00,FULL,llm_style,eval,llm_style_eval_157,1,1536,8192,bf16,NVIDIA GeForce RTX 4060,c04,64,64,64,4,3,8,0.0,165.747,86.01599931716919,123.36800329387175,0.29257143089398235,6,-1,-1,1x1536x8192,0,
2026-03-03T03:26:51.636898+00:00,FULL,llm_style,eval,llm_style_eval_158,64,1536,8192,bf16,NVIDIA GeForce RTX 4060,c04,64,64,64,4,3,8,0.0,0.0,105.47199845314026,228.85312259197224,15.270524495803242,2,-1,-1,64x1536x8192,0,
2026-03-03T03:26:51.751654+00:00,FULL,llm_style,eval,llm_style_eval_159,16,6144,1536,bf16,NVIDIA GeForce RTX 4060,c11,32,128,32,4,2,8,0.0,114.704,47.10400104522705,56.148160956799984,6.411130292521085,5,-1,-1,16x6144x1536,0,
2026-03-03T03:26:51.934198+00:00,FULL,llm_style,eval,llm_style_eval_160,32,6144,6144,bf16,NVIDIA GeForce RTX 4060,c06,64,128,32,4,3,8,0.0,0.0,330.6719958782196,399.942083954811,7.306089218664099,0,-1,-1,32x6144x6144,0,
2026-03-03T03:26:52.030732+00:00,FULL,llm_style,eval,llm_style_eval_161,2,1536,4096,bf16,NVIDIA GeForce RTX 4060,c04,64,64,64,4,3,8,0.0,96.474,58.1279993057251,335.8774270117276,0.43293807288360237,7,-1,-1,2x1536x4096,0,
2026-03-03T03:26:52.109135+00:00,FULL,llm_style,eval,llm_style_eval_162,64,1536,3072,bf16,NVIDIA GeForce RTX 4060,c04,64,64,64,4,3,8,0.0,78.36,49.15200173854828,67.22560223191974,12.287999565362945,3,-1,-1,64x1536x3072,0,
2026-03-03T03:26:52.149286+00:00,FULL,llm_style,eval,llm_style_eval_163,64,1024,8192,bf16,NVIDIA GeForce RTX 4060,c04,64,64,64,4,3,8,0.0,0.0,117.63200163841248,141.97759971022603,9.127973757520182,2,-1,-1,64x1024x8192,0,
2026-03-03T03:26:52.320837+00:00,FULL,llm_style,eval,llm_style_eval_164,64,4096,8192,bf16,NVIDIA GeForce RTX 4060,c06,64,128,32,4,3,8,0.0,0.0,329.6160101890564,436.8486425280571,13.030214441150948,2,-1,-1,64x4096x8192,0,
2026-03-03T03:26:52.620052+00:00,FULL,llm_style,eval,llm_style_eval_165,4,8192,3072,bf16,NVIDIA GeForce RTX 4060,c11,32,128,32,4,2,8,0.0,299.165,227.7119979262352,280.5743969976901,0.8841281699404242,5,-1,-1,4x8192x3072,0,
2026-03-03T03:26:52.659874+00:00,FULL,llm_style,eval,llm_style_eval_166,64,1024,6144,bf16,NVIDIA GeForce RTX 4060,c04,64,64,64,4,3,8,0.0,0.0,78.78400012850761,264.56063970923395,10.221699414683613,2,-1,-1,64x1024x6144,0,
2026-03-03T03:26:52.674449+00:00,FULL,llm_style,eval,llm_style_eval_167,2,2048,1024,bf16,NVIDIA GeForce RTX 4060,c11,32,128,32,4,2,8,0.0,0.0,38.91199827194214,81.93023961037387,0.21557895694214924,7,-1,-1,2x2048x1024,0,
2026-03-03T03:26:52.751120+00:00,FULL,llm_style,eval,llm_style_eval_168,64,4096,1024,bf16,NVIDIA GeForce RTX 4060,c11,32,128,32,4,2,8,0.0,76.634,49.15200173854828,70.96319969743485,10.92266628032262,3,-1,-1,64x4096x1024,0,
2026-03-03T03:26:52.792227+00:00,FULL,llm_style,eval,llm_style_eval_169,4,1536,6144,bf16,NVIDIA GeForce RTX 4060,c04,64,64,64,4,3,8,0.0,0.0,71.68000191450119,173.744637519121,1.0532571147256975,6,-1,-1,4x1536x6144,0,
2026-03-03T03:26:52.809907+00:00,FULL,llm_style,eval,llm_style_eval_170,16,1536,1536,bf16,NVIDIA GeForce RTX 4060,c04,64,64,64,4,3,8,0.0,0.0,67.76000186800957,245.73472142219532,1.1141893435460986,7,-1,-1,16x1536x1536,0,
2026-03-03T03:26:52.900792+00:00,FULL,llm_style,eval,llm_style_eval_171,1,2048,3072,bf16,NVIDIA GeForce RTX 4060,c00,32,32,32,2,2,8,0.0,90.841,58.88000130653381,175.23936584591848,0.21370434308403616,7,-1,-1,1x2048x3072,0,
2026-03-03T03:26:52.990146+00:00,FULL,llm_style,eval,llm_style_eval_172,64,3072,2048,bf16,NVIDIA GeForce RTX 4060,c03,64,64,32,4,2,8,0.0,89.311,53.247999399900436,144.6707241237163,15.123692478134789,3,-1,-1,64x3072x2048,0,
2026-03-03T03:26:53.246222+00:00,FULL,llm_style,eval,llm_style_eval_173,64,8192,6144,bf16,NVIDIA GeForce RTX 4060,c06,64,128,32,4,3,8,0.0,0.0,465.92000126838684,501.0761615633964,13.827375786533178,0,-1,-1,64x8192x6144,0,
2026-03-03T03:26:53.470030+00:00,FULL,llm_style,eval,llm_style_eval_174,2,4096,4096,bf16,NVIDIA GeForce RTX 4060,c11,32,128,32,4,2,8,0.0,223.758,161.79199516773224,196.309762597084,0.41478482251502746,7,-1,-1,2x4096x4096,0,
2026-03-03T03:26:53.521040+00:00,FULL,llm_style,eval,llm_style_eval_175,64,4096,2048,bf16,NVIDIA GeForce RTX 4060,c04,64,64,64,4,3,8,0.0,0.0,70.65600156784058,160.93248113989824,15.196753285975904,3,-1,-1,64x4096x2048,0,
2026-03-03T03:26:53.580141+00:00,FULL,llm_style,eval,llm_style_eval_176,16,6144,2048,bf16,NVIDIA GeForce RTX 4060,c11,32,128,32,4,2,8,0.0,0.0,41.600000113248825,97.89407998323429,9.679163050573225,5,-1,-1,16x6144x2048,0,
2026-03-03T03:26:53.625715+00:00,FULL,llm_style,eval,llm_style_eval_177,1,6144,1536,bf16,NVIDIA GeForce RTX 4060,c11,32,128,32,4,2,8,0.0,0.0,50.51199905574322,149.52736161649216,0.37366107762179296,5,-1,-1,1x6144x1536,0,
2026-03-03T03:26:54.179452+00:00,FULL,llm_style,eval,llm_style_eval_178,32,6144,8192,bf16,NVIDIA GeForce RTX 4060,c11,32,128,32,4,2,8,0.0,553.684,427.0080029964447,496.6086360812185,7.54371217727931,0,-1,-1,32x6144x8192,0,
2026-03-03T03:26:54.306293+00:00,FULL,llm_style,eval,llm_style_eval_179,64,4096,6144,bf16,NVIDIA GeForce RTX 4060,c11,32,128,32,4,2,8,0.0,0.0,233.47200453281403,255.6006333231926,13.797052363711826,2,-1,-1,64x4096x6144,0,
2026-03-03T03:26:54.321538+00:00,FULL,llm_style,eval,llm_style_eval_180,64,2048,1536,bf16,NVIDIA GeForce RTX 4060,c11,32,128,32,4,2,8,0.0,0.0,42.848000302910805,112.13824070990086,9.397245639317418,3,-1,-1,64x2048x1536,0,
2026-03-03T03:26:54.346153+00:00,FULL,llm_style,eval,llm_style_eval_181,64,2048,3072,bf16,NVIDIA GeForce RTX 4060,c03,64,64,32,4,2,8,0.0,0.0,68.60800087451935,81.43871776759624,11.73779089515909,3,-1,-1,64x2048x3072,0,
2026-03-03T03:26:54.422649+00:00,FULL,llm_style,eval,llm_style_eval_182,32,3072,1536,bf16,NVIDIA GeForce RTX 4060,c11,32,128,32,4,2,8,0.0,76.439,48.128001391887665,62.62784067541357,6.274723222786946,3,-1,-1,32x3072x1536,0,
2026-03-03T03:26:54.504121+00:00,FULL,llm_style,eval,llm_style_eval_183,8,8192,2048,bf16,NVIDIA GeForce RTX 4060,c11,32,128,32,4,2,8,0.0,0.0,163.80799561738968,280.96511065959925,1.6387201063554382,5,-1,-1,8x8192x2048,0,
2026-03-03T03:26:54.541987+00:00,FULL,llm_style,eval,llm_style_eval_184,64,8192,1024,bf16,NVIDIA GeForce RTX 4060,c06,64,128,32,4,3,8,0.0,0.0,65.5359998345375,77.32224002480507,16.384000041365624,1,-1,-1,64x8192x1024,0,
2026-03-03T03:26:54.606472+00:00,FULL,llm_style,eval,llm_style_eval_185,1,8192,1536,bf16,NVIDIA GeForce RTX 4060,c00,32,32,32,2,2,8,0.0,0.0,60.20800024271011,75.52127987146373,0.4179813961359236,5,-1,-1,1x8192x1536,0,
2026-03-03T03:26:54.635034+00:00,FULL,llm_style,eval,llm_style_eval_186,16,6144,1024,bf16,NVIDIA GeForce RTX 4060,c11,32,128,32,4,2,8,0.0,0.0,43.88799890875816,79.27199836820354,4.587281193169732,5,-1,-1,16x6144x1024,0,
2026-03-03T03:26:54.662389+00:00,FULL,llm_style,eval,llm_style_eval_187,1,1024,6144,bf16,NVIDIA GeForce RTX 4060,c04,64,64,64,4,3,8,0.0,0.0,70.65600156784058,88.66431869566435,0.17808695257003013,6,-1,-1,1x1024x6144,0,
2026-03-03T03:26:55.057272+00:00,FULL,llm_style,eval,llm_style_eval_188,8,8192,4096,bf16,NVIDIA GeForce RTX 4060,c10,64,128,64,8,3,8,0.0,394.832,294.3519949913025,331.7404899001121,1.8239078420917902,5,-1,-1,8x8192x4096,0,
2026-03-03T03:26:55.282720+00:00,FULL,llm_style,eval,llm_style_eval_189,8,2048,8192,bf16,NVIDIA GeForce RTX 4060,c06,64,128,32,4,3,8,0.0,225.4,162.49600052833557,169.90656465291977,1.6519511565036396,6,-1,-1,8x2048x8192,0,
2026-03-03T03:26:55.499756+00:00,FULL,llm_style,eval,llm_style_eval_190,4,8192,2048,bf16,NVIDIA GeForce RTX 4060,c11,32,128,32,4,2,8,0.0,216.989,159.743994474411,223.96416708827002,0.8402051572680562,5,-1,-1,4x8192x2048,0,
2026-03-03T03:26:55.828231+00:00,FULL,llm_style,eval,llm_style_eval_191,4,8192,8192,bf16,NVIDIA GeForce RTX 4060,c11,32,128,32,4,2,8,0.0,0.0,557.0560097694397,583.1987196207047,0.9637646889802084,4,-1,-1,4x8192x8192,0,
2026-03-03T03:26:55.842161+00:00,FULL,llm_style,eval,llm_style_eval_192,64,1536,1024,bf16,NVIDIA GeForce RTX 4060,c04,64,64,64,4,3,8,0.0,0.0,38.68800029158592,148.6233580112457,5.203851077404629,3,-1,-1,64x1536x1024,0,
2026-03-03T03:26:55.860425+00:00,FULL,llm_style,eval,llm_style_eval_193,32,2048,2048,bf16,NVIDIA GeForce RTX 4060,c11,32,128,32,4,2,8,0.0,0.0,57.34400078654289,194.70335885882375,4.681142792935274,3,-1,-1,32x2048x2048,0,
2026-03-03T03:26:55.875054+00:00,FULL,llm_style,eval,llm_style_eval_194,8,1024,2048,bf16,NVIDIA GeForce RTX 4060,c04,64,64,64,4,3,8,0.0,0.0,71.32799923419952,116.20767802000034,0.47042441061366136,7,-1,-1,8x1024x2048,0,
2026-03-03T03:26:55.907325+00:00,FULL,llm_style,eval,llm_style_eval_195,2,4096,2048,bf16,NVIDIA GeForce RTX 4060,c11,32,128,32,4,2,8,0.0,0.0,54.27199974656105,109.3632032722233,0.6182641538305611,7,-1,-1,2x4096x2048,0,
2026-03-03T03:26:55.951741+00:00,FULL,llm_style,eval,llm_style_eval_196,32,2048,4096,bf16,NVIDIA GeForce RTX 4060,c00,32,32,32,2,2,8,0.0,0.0,61.37600168585777,124.82304409146309,8.747244806657152,3,-1,-1,32x2048x4096,0,
2026-03-03T03:26:56.096355+00:00,FULL,llm_style,eval,llm_style_eval_197,32,8192,1536,bf16,NVIDIA GeForce RTX 4060,c11,32,128,32,4,2,8,0.0,144.561,70.65600156784058,91.52768023312092,11.397564964481928,1,-1,-1,32x8192x1536,0,
2026-03-03T03:26:56.271956+00:00,FULL,llm_style,eval,llm_style_eval_198,64,4096,8192,bf16,NVIDIA GeForce RTX 4060,c06,64,128,32,4,3,8,0.0,0.0,327.13599503040314,417.5478461384772,13.128996384518425,2,-1,-1,64x4096x8192,0,
2026-03-03T03:26:56.659877+00:00,FULL,llm_style,eval,llm_style_eval_199,2,8192,4096,bf16,NVIDIA GeForce RTX 4060,c10,64,128,64,8,3,8,0.0,387.871,293.88800263404846,370.14464557170857,0.45669686001823256,5,-1,-1,2x8192x4096,0,
2026-03-03T03:26:56.735381+00:00,FULL,llm_style,eval,llm_style_eval_200,1,4096,1024,bf16,NVIDIA GeForce RTX 4060,c11,32,128,32,4,2,8,0.0,75.447,39.93599861860275,82.64544077217572,0.21005128931701406,7,-1,-1,1x4096x1024,0,
2026-03-03T03:26:56.907321+00:00,FULL,llm_style,eval,llm_style_eval_201,4,1536,8192,bf16,NVIDIA GeForce RTX 4060,c04,64,64,64,4,3,8,0.0,171.891,86.01599931716919,96.20736181735991,1.1702857235759294,6,-1,-1,4x1536x8192,0,
2026-03-03T03:26:57.133582+00:00,FULL,llm_style,eval,llm_style_eval_202,1,6144,3072,bf16,NVIDIA GeForce RTX 4060,c11,32,128,32,4,2,8,0.0,226.211,176.94400250911713,193.04255381226537,0.2133371884026133,5,-1,-1,1x6144x3072,0,
2026-03-03T03:26:57.304025+00:00,FULL,llm_style,eval,llm_style_eval_203,16,2048,6144,bf16,NVIDIA GeForce RTX 4060,c00,32,32,32,2,2,8,0.0,170.4,90.11200070381165,182.3948821425438,4.468363601463886,6,-1,-1,16x2048x6144,0,
2026-03-03T03:26:57.323584+00:00,FULL,llm_style,eval,llm_style_eval_204,16,1536,1024,bf16,NVIDIA GeForce RTX 4060,c00,32,32,32,2,2,8,0.0,0.0,39.93599861860275,210.2137601375578,1.2603077359020842,7,-1,-1,16x1536x1024,0,
2026-03-03T03:26:57.385785+00:00,FULL,llm_style,eval,llm_style_eval_205,64,6144,2048,bf16,NVIDIA GeForce RTX 4060,c10,64,128,64,8,3,8,0.0,0.0,94.56000104546547,150.5104015022515,17.03270641066935,1,-1,-1,64x6144x2048,0,
2026-03-03T03:26:57.448632+00:00,FULL,llm_style,eval,llm_style_eval_206,4,2048,6144,bf16,NVIDIA GeForce RTX 4060,c00,32,32,32,2,2,8,0.0,0.0,86.01599931716919,146.8518410623072,1.1702857235759294,6,-1,-1,4x2048x6144,0,
2026-03-03T03:26:57.563061+00:00,FULL,llm_style,eval,llm_style_eval_207,32,6144,1536,bf16,NVIDIA GeForce RTX 4060,c11,32,128,32,4,2,8,0.0,114.372,49.136001616716385,54.31295976042746,12.292000898064979,1,-1,-1,32x6144x1536,0,
2026-03-03T03:26:57.629746+00:00,FULL,llm_style,eval,llm_style_eval_208,4,2048,1024,bf16,NVIDIA GeForce RTX 4060,c11,32,128,32,4,2,8,0.0,66.643,40.95999896526337,50.718720369040966,0.4096000103473666,7,-1,-1,4x2048x1024,0,
2026-03-03T03:26:57.690057+00:00,FULL,llm_style,eval,llm_style_eval_209,1,1024,1536,bf16,NVIDIA GeForce RTX 4060,c04,64,64,64,4,3,8,0.0,60.273,41.98399931192398,45.62720090150833,0.07492683049626894,7,-1,-1,1x1024x1536,0,
2026-03-03T03:26:57.986881+00:00,FULL,llm_style,eval,llm_style_eval_210,8,6144,4096,bf16,NVIDIA GeForce RTX 4060,c11,32,128,32,4,2,8,0.0,296.784,227.7119979262352,340.47838777303696,1.7682563398808484,5,-1,-1,8x6144x4096,0,
2026-03-03T03:26:58.218350+00:00,FULL,llm_style,eval,llm_style_eval_211,4,2048,8192,bf16,NVIDIA GeForce RTX 4060,c06,64,128,32,4,3,8,0.0,231.428,161.79199516773224,170.9923219680786,0.8295696450300549,6,-1,-1,4x2048x8192,0,
2026-03-03T03:26:58.280265+00:00,FULL,llm_style,eval,llm_style_eval_212,32,1024,1024,bf16,NVIDIA GeForce RTX 4060,c00,32,32,32,2,2,8,0.0,61.875,28.16000021994114,743.2758646458364,2.3831272541140724,3,-1,-1,32x1024x1024,0,
2026-03-03T03:26:58.347408+00:00,FULL,llm_style,eval,llm_style_eval_213,16,3072,4096,bf16,NVIDIA GeForce RTX 4060,c00,32,32,32,2,2,8,0.0,0.0,81.91999793052673,156.25216439366338,4.9152001241684,7,-1,-1,16x3072x4096,0,
2026-03-03T03:26:58.394146+00:00,FULL,llm_style,eval,llm_style_eval_214,64,1024,8192,bf16,NVIDIA GeForce RTX 4060,c04,64,64,64,4,3,8,0.0,0.0,85.90399846434593,147.28416085243208,12.499323002358869,2,-1,-1,64x1024x8192,0,
2026-03-03T03:26:58.417095+00:00,FULL,llm_style,eval,llm_style_eval_215,4,4096,1536,bf16,NVIDIA GeForce RTX 4060,c11,32,128,32,4,2,8,0.0,0.0,46.400001272559166,54.794239923357964,1.084733763353709,7,-1,-1,4x4096x1536,0,
2026-03-03T03:26:58.495399+00:00,FULL,llm_style,eval,llm_style_eval_216,16,1536,3072,bf16,NVIDIA GeForce RTX 4060,c04,64,64,64,4,3,8,0.0,78.253,49.0880012512207,52.62399990111588,3.07600513671852,7,-1,-1,16x1536x3072,0,
2026-03-03T03:26:58.562968+00:00,FULL,llm_style,eval,llm_style_eval_217,8,6144,2048,bf16,NVIDIA GeForce RTX 4060,c02,32,64,32,2,2,8,0.0,0.0,60.416001826524734,470.22270813584225,3.3323388823060216,5,-1,-1,8x6144x2048,0,
2026-03-03T03:26:58.702331+00:00,FULL,llm_style,eval,llm_style_eval_218,8,3072,4096,bf16,NVIDIA GeForce RTX 4060,c00,32,32,32,2,2,8,0.0,139.311,70.65600156784058,117.03424073755741,2.849391241120482,7,-1,-1,8x3072x4096,0,
2026-03-03T03:26:59.018508+00:00,FULL,llm_style,eval,llm_style_eval_219,64,8192,3072,bf16,NVIDIA GeForce RTX 4060,c10,64,128,64,8,3,8,0.0,316.132,234.51200127601624,261.9807901978493,13.735866200760777,1,-1,-1,64x8192x3072,0,
2026-03-03T03:26:59.057546+00:00,FULL,llm_style,eval,llm_style_eval_220,2,4096,2048,bf16,NVIDIA GeForce RTX 4060,c11,32,128,32,4,2,8,0.0,0.0,54.207999259233475,129.5798350125551,0.6189941052709952,7,-1,-1,2x4096x2048,0,
2026-03-03T03:26:59.209068+00:00,FULL,llm_style,eval,llm_style_eval_221,4,1024,8192,bf16,NVIDIA GeForce RTX 4060,c04,64,64,64,4,3,8,0.0,151.468,85.67999675869942,108.30847926437849,0.7832500763159306,6,-1,-1,4x1024x8192,0,
2026-03-03T03:26:59.283676+00:00,FULL,llm_style,eval,llm_style_eval_222,64,6144,2048,bf16,NVIDIA GeForce RTX 4060,c10,64,128,64,8,3,8,0.0,0.0,94.17600184679031,152.62911960482597,17.102156647297644,1,-1,-1,64x6144x2048,0,
2026-03-03T03:26:59.354250+00:00,FULL,llm_style,eval,llm_style_eval_223,4,2048,2048,bf16,NVIDIA GeForce RTX 4060,c00,32,32,32,2,2,8,0.0,70.524,45.05600035190582,107.38752096891392,0.7447272669106476,7,-1,-1,4x2048x2048,0,
2026-03-03T03:26:59.372297+00:00,FULL,llm_style,eval,llm_style_eval_224,16,3072,1536,bf16,NVIDIA GeForce RTX 4060,c11,32,128,32,4,2,8,0.0,0.0,45.04000023007393,56.32000043988228,3.3524632155569627,7,-1,-1,16x3072x1536,0,
2026-03-03T03:26:59.389020+00:00,FULL,llm_style,eval,llm_style_eval_225,1,2048,2048,bf16,NVIDIA GeForce RTX 4060,c00,32,32,32,2,2,8,0.0,0.0,25.56800004094839,49.0006385371089,0.3280901121153488,7,-1,-1,1x2048x2048,0,
2026-03-03T03:26:59.398971+00:00,FULL,llm_style,eval,llm_style_eval_226,8,1536,1024,bf16,NVIDIA GeForce RTX 4060,c00,32,32,32,2,2,8,0.0,0.0,43.87199878692627,170.1785540580748,0.5736192718782475,7,-1,-1,8x1536x1024,0,
2026-03-03T03:26:59.594276+00:00,FULL,llm_style,eval,llm_style_eval_227,64,6144,6144,bf16,NVIDIA GeForce RTX 4060,c11,32,128,32,4,2,8,0.0,0.0,333.21599662303925,358.9222311973572,14.500618988788117,0,-1,-1,64x6144x6144,0,
2026-03-03T03:26:59.656696+00:00,FULL,llm_style,eval,llm_style_eval_228,64,6144,2048,bf16,NVIDIA GeForce RTX 4060,c10,64,128,64,8,3,8,0.0,0.0,97.24800288677216,193.3926381170748,16.561910663350787,1,-1,-1,64x6144x2048,0,
2026-03-03T03:26:59.829728+00:00,FULL,llm_style,eval,llm_style_eval_229,16,1536,8192,bf16,NVIDIA GeForce RTX 4060,c04,64,64,64,4,3,8,0.0,172.97,88.06400001049042,152.50272199511505,4.57227906922278,6,-1,-1,16x1536x8192,0,
2026-03-03T03:26:59.849374+00:00,FULL,llm_style,eval,llm_style_eval_230,64,2048,1536,bf16,NVIDIA GeForce RTX 4060,c11,32,128,32,4,2,8,0.0,0.0,50.175998359918594,134.3078406155109,8.024816588834353,3,-1,-1,64x2048x1536,0,
2026-03-03T03:26:59.895137+00:00,FULL,llm_style,eval,llm_style_eval_231,4,1024,8192,bf16,NVIDIA GeForce RTX 4060,c04,64,64,64,4,3,8,0.0,0.0,85.31199768185616,141.178875491023,0.7866286785389913,6,-1,-1,4x1024x8192,0,
2026-03-03T03:26:59.914158+00:00,FULL,llm_style,eval,llm_style_eval_232,16,3072,1536,bf16,NVIDIA GeForce RTX 4060,c11,32,128,32,4,2,8,0.0,0.0,46.08000069856644,142.26688250899315,3.2767999503241656,7,-1,-1,16x3072x1536,0,
2026-03-03T03:26:59.961606+00:00,FULL,llm_style,eval,llm_style_eval_233,64,3072,3072,bf16,NVIDIA GeForce RTX 4060,c03,64,64,32,4,2,8,0.0,0.0,70.70400193333626,107.56095916032791,17.084740877028896,3,-1,-1,64x3072x3072,0,
2026-03-03T03:27:00.124296+00:00,FULL,llm_style,eval,llm_style_eval_234,32,8192,4096,bf16,NVIDIA GeForce RTX 4060,c11,32,128,32,4,2,8,0.0,0.0,295.9359884262085,371.5379154682159,7.25658159867729,1,-1,-1,32x8192x4096,0,
2026-03-03T03:27:00.137451+00:00,FULL,llm_style,eval,llm_style_eval_235,4,2048,1024,bf16,NVIDIA GeForce RTX 4060,c11,32,128,32,4,2,8,0.0,0.0,59.13599953055382,171.94336533546436,0.2837056299578011,7,-1,-1,4x2048x1024,0,
2026-03-03T03:27:00.269249+00:00,FULL,llm_style,eval,llm_style_eval_236,4,8192,3072,bf16,NVIDIA GeForce RTX 4060,c11,32,128,32,4,2,8,0.0,0.0,252.9279887676239,357.43072807788815,0.7959838410171665,5,-1,-1,4x8192x3072,0,
2026-03-03T03:27:00.291432+00:00,FULL,llm_style,eval,llm_style_eval_237,64,1024,4096,bf16,NVIDIA GeForce RTX 4060,c04,64,64,64,4,3,8,0.0,0.0,79.8719972372055,182.08128616213793,6.72164125814445,3,-1,-1,64x1024x4096,0,
2026-03-03T03:27:00.465424+00:00,FULL,llm_style,eval,llm_style_eval_238,32,2048,6144,bf16,NVIDIA GeForce RTX 4060,c06,64,128,32,4,3,8,0.0,173.943,105.45599833130836,113.66880111396313,7.636420694344857,2,-1,-1,32x2048x6144,0,
2026-03-03T03:27:00.473004+00:00,FULL,llm_style,eval,llm_style_eval_239,32,2048,6144,bf16,NVIDIA GeForce RTX 4060,c06,64,128,32,4,3,8,0.0,0.0,106.1599999666214,114.50495988130568,7.585779655738533,2,-1,-1,32x2048x6144,0,
2026-03-03T03:27:00.616999+00:00,FULL,llm_style,eval,llm_style_eval_240,8,8192,1536,bf16,NVIDIA GeForce RTX 4060,c11,32,128,32,4,2,8,0.0,143.964,60.38400158286095,67.8790385276079,3.3341048410601424,5,-1,-1,8x8192x1536,0,
2026-03-03T03:27:00.630652+00:00,FULL,llm_style,eval,llm_style_eval_241,16,1536,1536,bf16,NVIDIA GeForce RTX 4060,c04,64,64,64,4,3,8,0.0,0.0,37.84000128507614,153.67488294839848,1.9951762535953117,7,-1,-1,16x1536x1536,0,
2026-03-03T03:27:00.661117+00:00,FULL,llm_style,eval,llm_style_eval_242,1,2048,3072,bf16,NVIDIA GeForce RTX 4060,c00,32,32,32,2,2,8,0.0,0.0,53.71199920773506,310.6633673608299,0.23426631266013156,7,-1,-1,1x2048x3072,0,
2026-03-03T03:27:00.700087+00:00,FULL,llm_style,eval,llm_style_eval_243,8,1536,6144,bf16,NVIDIA GeForce RTX 4060,c04,64,64,64,4,3,8,0.0,0.0,70.3199990093708,104.27807778120034,2.147254637757866,6,-1,-1,8x1536x6144,0,
2026-03-03T03:27:00.744401+00:00,FULL,llm_style,eval,llm_style_eval_244,32,8192,1024,bf16,NVIDIA GeForce RTX 4060,c02,32,64,32,2,2,8,0.0,0.0,50.175998359918594,159.73375812172878,10.699755451779136,1,-1,-1,32x8192x1024,0,
2026-03-03T03:27:00.871223+00:00,FULL,llm_style,eval,llm_style_eval_245,4,6144,4096,bf16,NVIDIA GeForce RTX 4060,c11,32,128,32,4,2,8,0.0,0.0,228.67199778556824,300.496324300766,0.8804164652848717,5,-1,-1,4x6144x4096,0,
2026-03-03T03:27:00.934210+00:00,FULL,llm_style,eval,llm_style_eval_246,32,2048,6144,bf16,NVIDIA GeForce RTX 4060,c06,64,128,32,4,3,8,0.0,0.0,108.5439994931221,206.9180783629417,7.419169845966734,2,-1,-1,32x2048x6144,0,
2026-03-03T03:27:00.999605+00:00,FULL,llm_style,eval,llm_style_eval_247,64,6144,2048,bf16,NVIDIA GeForce RTX 4060,c10,64,128,64,8,3,8,0.0,0.0,96.22400254011154,230.8563278615473,16.73815985079821,1,-1,-1,64x6144x2048,0,
2026-03-03T03:27:01.008688+00:00,FULL,llm_style,eval,llm_style_eval_248,64,1024,1024,bf16,NVIDIA GeForce RTX 4060,c04,64,64,64,4,3,8,0.0,0.0,36.19199991226196,114.00287985801697,3.708491609343937,3,-1,-1,64x1024x1024,0,
2026-03-03T03:27:01.113813+00:00,FULL,llm_style,eval,llm_style_eval_249,2,8192,1024,bf16,NVIDIA GeForce RTX 4060,c00,32,32,32,2,2,8,0.0,105.084,48.128001391887665,95.80959856510151,0.6971914691985496,5,-1,-1,2x8192x1024,0,
2026-03-03T03:27:01.166122+00:00,FULL,llm_style,eval,llm_style_eval_250,64,3072,3072,bf16,NVIDIA GeForce RTX 4060,c03,64,64,32,4,2,8,0.0,0.0,64.495999366045,138.17887768149376,18.72921675566672,3,-1,-1,64x3072x3072,0,
2026-03-03T03:27:01.213550+00:00,FULL,llm_style,eval,llm_style_eval_251,64,1024,8192,bf16,NVIDIA GeForce RTX 4060,c04,64,64,64,4,3,8,0.0,0.0,91.13600105047226,228.56703132390965,11.781752673187277,2,-1,-1,64x1024x8192,0,
2026-03-03T03:27:01.276461+00:00,FULL,llm_style,eval,llm_style_eval_252,64,4096,3072,bf16,NVIDIA GeForce RTX 4060,c04,64,64,64,4,3,8,0.0,0.0,89.05600011348724,108.60512211918827,18.085392718598843,3,-1,-1,64x4096x3072,0,
2026-03-03T03:27:01.399508+00:00,FULL,llm_style,eval,llm_style_eval_253,8,6144,4096,bf16,NVIDIA GeForce RTX 4060,c11,32,128,32,4,2,8,0.0,0.0,230.3999960422516,254.903035312891,1.7476266966869218,5,-1,-1,8x6144x4096,0,
2026-03-03T03:27:01.479411+00:00,FULL,llm_style,eval,llm_style_eval_254,4,1536,3072,bf16,NVIDIA GeForce RTX 4060,c04,64,64,64,4,3,8,0.0,79.853,49.83999952673912,55.54848004132509,0.7573984020555183,7,-1,-1,4x1536x3072,0,
2026-03-03T03:27:01.499256+00:00,FULL,llm_style,eval,llm_style_eval_255,1,3072,1536,bf16,NVIDIA GeForce RTX 4060,c11,32,128,32,4,2,8,0.0,0.0,55.824000388383865,153.07039871811867,0.16905244938275216,7,-1,-1,1x3072x1536,0,
2026-03-03T03:27:01.582974+00:00,BUCKET,llm_style,tune,llm_style_tune_000,32,3072,2048,bf16,NVIDIA GeForce RTX 4060,c11,32,128,32,4,2,8,0.0,81.666,52.22399905323982,58.910721316933625,7.710117786834262,3,-1,-1,llm8_g3,0,
2026-03-03T03:27:01.673255+00:00,BUCKET,llm_style,tune,llm_style_tune_001,4,4096,1536,bf16,NVIDIA GeForce RTX 4060,c00,32,32,32,2,2,8,0.0,90.234,45.05600035190582,150.9833623468875,1.1170909003659715,7,-1,-1,llm8_g7,0,
2026-03-03T03:27:01.773487+00:00,BUCKET,llm_style,tune,llm_style_tune_002,8,8192,1024,bf16,NVIDIA GeForce RTX 4060,c11,32,128,32,4,2,8,0.0,100.187,49.1040013730526,92.80383735895153,2.7333358636157157,5,-1,-1,llm8_g5,0,
2026-03-03T03:27:01.813248+00:00,BUCKET,llm_style,tune,llm_style_tune_003,64,1024,4096,bf16,NVIDIA GeForce RTX 4060,c11,32,128,32,4,2,8,0.0,0.0,76.4320008456707,291.091199815273,7.024164042022585,3,-1,-1,llm8_g3,0,
2026-03-03T03:27:01.877516+00:00,BUCKET,llm_style,tune,llm_style_tune_004,16,3072,4096,bf16,NVIDIA GeForce RTX 4060,c00,32,32,32,2,2,8,0.0,0.0,73.72800260782242,191.18112057447416,5.46133314016131,7,-1,-1,llm8_g7,0,
2026-03-03T03:27:01.903110+00:00,BUCKET,llm_style,tune,llm_style_tune_005,16,1536,4096,bf16,NVIDIA GeForce RTX 4060,c00,32,32,32,2,2,8,0.0,0.0,56.32000043988228,72.59904131293297,3.5746908811711084,7,-1,-1,llm8_g7,0,
2026-03-03T03:27:01.914635+00:00,BUCKET,llm_style,tune,llm_style_tune_006,2,2048,1024,bf16,NVIDIA GeForce RTX 4060,c00,32,32,32,2,2,8,0.0,0.0,29.56799976527691,172.22272172570214,0.2837056299578011,7,-1,-1,llm8_g7,0,
2026-03-03T03:27:01.995221+00:00,BUCKET,llm_style,tune,llm_style_tune_007,32,6144,1024,bf16,NVIDIA GeForce RTX 4060,c11,32,128,32,4,2,8,0.0,80.535,41.98399931192398,52.32640091329811,9.590634303522425,1,-1,-1,llm8_g1,0,
2026-03-03T03:27:02.010066+00:00,BUCKET,llm_style,tune,llm_style_tune_008,8,1536,2048,bf16,NVIDIA GeForce RTX 4060,c00,32,32,32,2,2,8,0.0,0.0,41.471999138593674,84.4800004735588,1.21362965483768,7,-1,-1,llm8_g7,0,
2026-03-03T03:27:02.121630+00:00,BUCKET,llm_style,tune,llm_style_tune_009,16,1024,6144,bf16,NVIDIA GeForce RTX 4060,c04,64,64,64,4,3,8,0.0,111.52,70.5760009586811,128.04096199572066,2.8526211355878206,6,-1,-1,llm8_g6,0,
2026-03-03T03:27:02.136948+00:00,BUCKET,llm_style,tune,llm_style_tune_010,64,1536,2048,bf16,NVIDIA GeForce RTX 4060,c11,32,128,32,4,2,8,0.0,0.0,48.86399954557419,86.82143837213508,8.240282984295131,3,-1,-1,llm8_g3,0,
2026-03-03T03:27:02.161857+00:00,BUCKET,llm_style,tune,llm_style_tune_011,64,1536,4096,bf16,NVIDIA GeForce RTX 4060,c11,32,128,32,4,2,8,0.0,0.0,78.78400012850761,117.50400252640242,10.221699414683613,3,-1,-1,llm8_g3,0,
2026-03-03T03:27:02.173199+00:00,BUCKET,llm_style,tune,llm_style_tune_012,32,1024,2048,bf16,NVIDIA GeForce RTX 4060,c11,32,128,32,4,2,8,0.0,0.0,47.10400104522705,122.64447666704649,2.8493912411204825,3,-1,-1,llm8_g3,0,
2026-03-03T03:27:02.186041+00:00,BUCKET,llm_style,tune,llm_style_tune_013,64,1536,1024,bf16,NVIDIA GeForce RTX 4060,c11,32,128,32,4,2,8,0.0,0.0,51.19999870657921,72.14784137904643,3.932160099334719,3,-1,-1,llm8_g3,0,
2026-03-03T03:27:02.279702+00:00,BUCKET,llm_style,tune,llm_style_tune_014,4,6144,3072,bf16,NVIDIA GeForce RTX 4060,c11,32,128,32,4,2,8,0.0,0.0,177.0239993929863,233.37983831763253,0.8529631265690546,5,-1,-1,llm8_g5,0,
2026-03-03T03:27:02.306408+00:00,BUCKET,llm_style,tune,llm_style_tune_015,1,6144,1024,bf16,NVIDIA GeForce RTX 4060,c11,32,128,32,4,2,8,0.0,0.0,41.32799990475178,208.93535658717107,0.3044645767760286,5,-1,-1,llm8_g5,0,
2026-03-03T03:27:02.470892+00:00,BUCKET,llm_style,tune,llm_style_tune_016,4,8192,4096,bf16,NVIDIA GeForce RTX 4060,c11,32,128,32,4,2,8,0.0,0.0,293.88800263404846,390.62528163194634,0.9133937200364651,5,-1,-1,llm8_g5,0,
2026-03-03T03:27:02.487317+00:00,BUCKET,llm_style,tune,llm_style_tune_017,64,1536,2048,bf16,NVIDIA GeForce RTX 4060,c11,32,128,32,4,2,8,0.0,0.0,49.16799999773502,133.18144023418427,8.18933420148366,3,-1,-1,llm8_g3,0,
2026-03-03T03:27:02.551405+00:00,BUCKET,llm_style,tune,llm_style_tune_018,64,8192,1536,bf16,NVIDIA GeForce RTX 4060,c11,32,128,32,4,2,8,0.0,0.0,133.12000036239624,159.29983660578722,12.09895381321653,1,-1,-1,llm8_g1,0,
2026-03-03T03:27:02.563191+00:00,BUCKET,llm_style,tune,llm_style_tune_019,2,1536,1024,bf16,NVIDIA GeForce RTX 4060,c00,32,32,32,2,2,8,0.0,0.0,66.56000018119812,145.20928442478174,0.09452307666575414,7,-1,-1,llm8_g7,0,
2026-03-03T03:27:02.572483+00:00,BUCKET,llm_style,tune,llm_style_tune_020,16,1024,1536,bf16,NVIDIA GeForce RTX 4060,c00,32,32,32,2,2,8,0.0,0.0,43.79200004041195,95.46559847891325,1.149334306575474,7,-1,-1,llm8_g7,0,
2026-03-03T03:27:02.608276+00:00,BUCKET,llm_style,tune,llm_style_tune_021,1,6144,1536,bf16,NVIDIA GeForce RTX 4060,c11,32,128,32,4,2,8,0.0,0.0,50.175998359918594,63.06816082447766,0.3761632776016103,5,-1,-1,llm8_g5,0,
2026-03-03T03:27:02.690803+00:00,BUCKET,llm_style,tune,llm_style_tune_022,8,4096,4096,bf16,NVIDIA GeForce RTX 4060,c00,32,32,32,2,2,8,0.0,0.0,161.79199516773224,182.97856599092478,1.6591392900601099,7,-1,-1,llm8_g7,0,
2026-03-03T03:27:02.852223+00:00,BUCKET,llm_style,tune,llm_style_tune_023,2,4096,8192,bf16,NVIDIA GeForce RTX 4060,c04,64,64,64,4,3,8,0.0,0.0,302.5439977645874,447.02112942934036,0.4436304438088248,6,-1,-1,llm8_g6,0,
2026-03-03T03:27:02.873363+00:00,BUCKET,llm_style,tune,llm_style_tune_024,64,1536,2048,bf16,NVIDIA GeForce RTX 4060,c11,32,128,32,4,2,8,0.0,0.0,66.04800000786781,194.6643155813216,6.09637209229704,3,-1,-1,llm8_g3,0,
2026-03-03T03:27:02.905032+00:00,BUCKET,llm_style,tune,llm_style_tune_025,4,4096,1536,bf16,NVIDIA GeForce RTX 4060,c00,32,32,32,2,2,8,0.0,0.0,63.48799914121628,126.115837842226,0.7927742042720133,7,-1,-1,llm8_g7,0,
2026-03-03T03:27:02.929173+00:00,BUCKET,llm_style,tune,llm_style_tune_026,4,3072,2048,bf16,NVIDIA GeForce RTX 4060,c00,32,32,32,2,2,8,0.0,0.0,61.216000467538834,82.18624167144293,0.8221975891203395,7,-1,-1,llm8_g7,0,
2026-03-03T03:27:02.948573+00:00,BUCKET,llm_style,tune,llm_style_tune_027,8,4096,1024,bf16,NVIDIA GeForce RTX 4060,c00,32,32,32,2,2,8,0.0,0.0,55.02399988472462,155.18719658255577,1.2196289644626563,7,-1,-1,llm8_g7,0,
2026-03-03T03:27:02.959350+00:00,BUCKET,llm_style,tune,llm_style_tune_028,16,1536,1024,bf16,NVIDIA GeForce RTX 4060,c00,32,32,32,2,2,8,0.0,0.0,37.407999858260155,54.29247975349426,1.345478191582225,7,-1,-1,llm8_g7,0,
2026-03-03T03:27:03.397233+00:00,BUCKET,llm_style,tune,llm_style_tune_029,64,4096,8192,bf16,NVIDIA GeForce RTX 4060,c04,64,64,64,4,3,8,0.0,437.844,303.1040132045746,342.763505578041,14.169945328639345,2,-1,-1,llm8_g2,0,
2026-03-03T03:27:03.465732+00:00,BUCKET,llm_style,tune,llm_style_tune_030,1,8192,1536,bf16,NVIDIA GeForce RTX 4060,c11,32,128,32,4,2,8,0.0,0.0,89.08800035715103,196.1270385980606,0.28248275748822504,5,-1,-1,llm8_g5,0,
2026-03-03T03:27:04.045882+00:00,BUCKET,llm_style,tune,llm_style_tune_031,1,8192,6144,bf16,NVIDIA GeForce RTX 4060,c11,32,128,32,4,2,8,0.0,580.096,427.2480010986328,524.5046561956405,0.23560858269939866,4,-1,-1,llm8_g4,0,
2026-03-03T03:27:04.175932+00:00,BUCKET,llm_style,tune,llm_style_tune_032,32,3072,8192,bf16,NVIDIA GeForce RTX 4060,c04,64,64,64,4,3,8,0.0,0.0,231.27999901771545,335.82719415426254,6.963908434972931,2,-1,-1,llm8_g2,0,
2026-03-03T03:27:04.213601+00:00,BUCKET,llm_style,tune,llm_style_tune_033,4,1536,6144,bf16,NVIDIA GeForce RTX 4060,c04,64,64,64,4,3,8,0.0,0.0,70.65600156784058,154.18399944901464,1.0685217154201807,6,-1,-1,llm8_g6,0,
2026-03-03T03:27:04.246398+00:00,BUCKET,llm_style,tune,llm_style_tune_034,1,4096,1536,bf16,NVIDIA GeForce RTX 4060,c00,32,32,32,2,2,8,0.0,0.0,69.12000104784966,208.2153609395027,0.18204444168467587,7,-1,-1,llm8_g7,0,
2026-03-03T03:27:04.272377+00:00,BUCKET,llm_style,tune,llm_style_tune_035,4,1536,4096,bf16,NVIDIA GeForce RTX 4060,c00,32,32,32,2,2,8,0.0,0.0,57.34400078654289,72.23136126995084,0.877714273675364,7,-1,-1,llm8_g7,0,
2026-03-03T03:27:04.395437+00:00,BUCKET,llm_style,tune,llm_style_tune_036,32,8192,3072,bf16,NVIDIA GeForce RTX 4060,c11,32,128,32,4,2,8,0.0,0.0,230.3999960422516,256.3183957338333,6.990506786747687,1,-1,-1,llm8_g1,0,
2026-03-03T03:27:04.422721+00:00,BUCKET,llm_style,tune,llm_style_tune_037,32,3072,2048,bf16,NVIDIA GeForce RTX 4060,c11,32,128,32,4,2,8,0.0,0.0,55.1999993622303,66.55199982225895,7.294441823408948,3,-1,-1,llm8_g3,0,
2026-03-03T03:27:04.457422+00:00,BUCKET,llm_style,tune,llm_style_tune_038,2,2048,4096,bf16,NVIDIA GeForce RTX 4060,c00,32,32,32,2,2,8,0.0,0.0,63.34399804472923,188.4160041809082,0.5297176218069806,7,-1,-1,llm8_g7,0,
2026-03-03T03:27:04.478547+00:00,BUCKET,llm_style,tune,llm_style_tune_039,64,2048,1536,bf16,NVIDIA GeForce RTX 4060,c11,32,128,32,4,2,8,0.0,0.0,59.90399979054928,200.14111265540123,6.721641049142838,3,-1,-1,llm8_g3,0,
2026-03-03T03:27:04.510997+00:00,BUCKET,llm_style,tune,llm_style_tune_040,64,1024,6144,bf16,NVIDIA GeForce RTX 4060,c04,64,64,64,4,3,8,0.0,0.0,76.57600194215775,104.67328183352943,10.516432662654474,2,-1,-1,llm8_g2,0,
2026-03-03T03:27:04.753782+00:00,BUCKET,llm_style,tune,llm_style_tune_041,4,8192,6144,bf16,NVIDIA GeForce RTX 4060,c11,32,128,32,4,2,8,0.0,0.0,437.1680021286011,542.0032119750977,0.9210490750454149,4,-1,-1,llm8_g4,0,
2026-03-03T03:27:04.779569+00:00,BUCKET,llm_style,tune,llm_style_tune_042,1,1024,6144,bf16,NVIDIA GeForce RTX 4060,c04,64,64,64,4,3,8,0.0,0.0,82.87999778985977,123.80639992654312,0.15182085346941815,6,-1,-1,llm8_g6,0,
2026-03-03T03:27:04.868708+00:00,BUCKET,llm_style,tune,llm_style_tune_043,64,2048,8192,bf16,NVIDIA GeForce RTX 4060,c04,64,64,64,4,3,8,0.0,0.0,168.91200095415115,273.01088184118265,12.713623874380039,2,-1,-1,llm8_g2,0,
2026-03-03T03:27:04.883420+00:00,BUCKET,llm_style,tune,llm_style_tune_044,16,2048,1024,bf16,NVIDIA GeForce RTX 4060,c00,32,32,32,2,2,8,0.0,0.0,46.49600014090538,113.71807664632794,1.4433255290052407,7,-1,-1,llm8_g7,0,
2026-03-03T03:27:04.894304+00:00,BUCKET,llm_style,tune,llm_style_tune_045,4,1024,1536,bf16,NVIDIA GeForce RTX 4060,c00,32,32,32,2,2,8,0.0,0.0,46.08000069856644,69.6054408699274,0.2730666625270138,7,-1,-1,llm8_g7,0,
2026-03-03T03:27:04.924354+00:00,BUCKET,llm_style,tune,llm_style_tune_046,64,1536,4096,bf16,NVIDIA GeForce RTX 4060,c11,32,128,32,4,2,8,0.0,0.0,83.39199796319008,268.165767788887,9.656878209771026,3,-1,-1,llm8_g3,0,
2026-03-03T03:27:04.943271+00:00,BUCKET,llm_style,tune,llm_style_tune_047,16,2048,1536,bf16,NVIDIA GeForce RTX 4060,c00,32,32,32,2,2,8,0.0,0.0,48.976000398397446,146.85824051499367,2.0553596696575864,7,-1,-1,llm8_g7,0,
2026-03-03T03:27:05.393260+00:00,BUCKET,llm_style,tune,llm_style_tune_048,64,6144,6144,bf16,NVIDIA GeForce RTX 4060,c06,64,128,32,4,3,8,0.0,449.934,332.8000009059906,352.45951980352396,14.518744575859836,0,-1,-1,llm8_g0,0,
2026-03-03T03:27:05.564327+00:00,BUCKET,llm_style,tune,llm_style_tune_049,4,4096,8192,bf16,NVIDIA GeForce RTX 4060,c04,64,64,64,4,3,8,0.0,0.0,297.88801074028015,468.97152215242363,0.9011287675959575,6,-1,-1,llm8_g6,0,
2026-03-03T03:27:05.623384+00:00,BUCKET,llm_style,tune,llm_style_tune_050,1,4096,3072,bf16,NVIDIA GeForce RTX 4060,c00,32,32,32,2,2,8,0.0,0.0,64.51199948787689,182.49728202819819,0.3900952411919764,7,-1,-1,llm8_g7,0,
2026-03-03T03:27:05.656582+00:00,BUCKET,llm_style,tune,llm_style_tune_051,2,4096,2048,bf16,NVIDIA GeForce RTX 4060,c00,32,32,32,2,2,8,0.0,0.0,51.023999229073524,150.62432222068298,0.6576205806478739,7,-1,-1,llm8_g7,0,
2026-03-03T03:27:05.721177+00:00,BUCKET,llm_style,tune,llm_style_tune_052,4,8192,1536,bf16,NVIDIA GeForce RTX 4060,c11,32,128,32,4,2,8,0.0,0.0,68.60800087451935,176.12831562757492,1.4672238618948863,5,-1,-1,llm8_g5,0,
2026-03-03T03:27:05.749369+00:00,BUCKET,llm_style,tune,llm_style_tune_053,1,1536,4096,bf16,NVIDIA GeForce RTX 4060,c00,32,32,32,2,2,8,0.0,0.0,61.23199872672558,174.93536323308928,0.20549569280200566,7,-1,-1,llm8_g7,0,
2026-03-03T03:27:05.994424+00:00,BUCKET,llm_style,tune,llm_style_tune_054,8,8192,6144,bf16,NVIDIA GeForce RTX 4060,c11,32,128,32,4,2,8,0.0,0.0,450.5600035190582,554.6086299419403,1.7873454405855542,4,-1,-1,llm8_g4,0,
2026-03-03T03:27:06.033906+00:00,BUCKET,llm_style,tune,llm_style_tune_055,64,6144,1536,bf16,NVIDIA GeForce RTX 4060,c11,32,128,32,4,2,8,0.0,0.0,71.407999843359,95.26144102215763,16.916305661127424,1,-1,-1,llm8_g1,0,
2026-03-03T03:27:06.061915+00:00,BUCKET,llm_style,tune,llm_style_tune_056,1,3072,1536,bf16,NVIDIA GeForce RTX 4060,c00,32,32,32,2,2,8,0.0,0.0,40.57599976658821,118.33408303558826,0.2325804429782881,7,-1,-1,llm8_g7,0,
2026-03-03T03:27:06.069219+00:00,BUCKET,llm_style,tune,llm_style_tune_057,64,1024,1024,bf16,NVIDIA GeForce RTX 4060,c11,32,128,32,4,2,8,0.0,0.0,40.911998599767685,50.003518871963024,3.280644617561219,3,-1,-1,llm8_g3,0,
2026-03-03T03:27:06.230744+00:00,BUCKET,llm_style,tune,llm_style_tune_058,16,8192,4096,bf16,NVIDIA GeForce RTX 4060,c11,32,128,32,4,2,8,0.0,0.0,316.76799058914185,486.46433413028706,3.389679058174402,5,-1,-1,llm8_g5,0,
2026-03-03T03:27:06.355106+00:00,BUCKET,llm_style,tune,llm_style_tune_059,16,4096,6144,bf16,NVIDIA GeForce RTX 4060,c04,64,64,64,4,3,8,0.0,0.0,229.37600314617157,353.73951613903046,3.510857094701456,6,-1,-1,llm8_g6,0,
2026-03-03T03:27:06.484611+00:00,BUCKET,llm_style,tune,llm_style_tune_060,2,3072,8192,bf16,NVIDIA GeForce RTX 4060,c04,64,64,64,4,3,8,0.0,0.0,255.36000728607178,320.8316799998282,0.394201492511825,6,-1,-1,llm8_g6,0,
2026-03-03T03:27:06.662587+00:00,BUCKET,llm_style,tune,llm_style_tune_061,64,4096,8192,bf16,NVIDIA GeForce RTX 4060,c04,64,64,64,4,3,8,0.0,0.0,331.13598823547363,510.1158258318899,12.970403243956111,2,-1,-1,llm8_g2,0,
2026-03-03T03:27:06.734486+00:00,BUCKET,llm_style,tune,llm_style_tune_062,32,4096,3072,bf16,NVIDIA GeForce RTX 4060,c11,32,128,32,4,2,8,0.0,0.0,108.5439994931221,419.2748934030522,7.419169845966734,3,-1,-1,llm8_g3,0,
2026-03-03T03:27:06.855385+00:00,BUCKET,llm_style,tune,llm_style_tune_063,2,3072,8192,bf16,NVIDIA GeForce RTX 4060,c04,64,64,64,4,3,8,0.0,0.0,230.14400154352188,289.48416441678995,0.4373926555759649,6,-1,-1,llm8_g6,0,
2026-03-03T03:27:06.866861+00:00,BUCKET,llm_style,eval,llm_style_eval_000,32,1536,1024,bf16,NVIDIA GeForce RTX 4060,c11,32,128,32,4,2,8,0.0,0.0,18.432000651955605,133.3043237775562,5.46133314016131,3,-1,-1,llm8_g3,0,
2026-03-03T03:27:06.953508+00:00,BUCKET,llm_style,eval,llm_style_eval_001,32,2048,8192,bf16,NVIDIA GeForce RTX 4060,c04,64,64,64,4,3,8,0.0,0.0,165.8879965543747,264.0473666787145,6.472691492467626,2,-1,-1,llm8_g2,0,
2026-03-03T03:27:07.006026+00:00,BUCKET,llm_style,eval,llm_style_eval_002,16,2048,4096,bf16,NVIDIA GeForce RTX 4060,c00,32,32,32,2,2,8,0.0,0.0,66.19199737906456,181.1081537604331,4.055406493669305,7,-1,-1,llm8_g7,0,
2026-03-03T03:27:07.024488+00:00,BUCKET,llm_style,eval,llm_style_eval_003,16,2048,1536,bf16,NVIDIA GeForce RTX 4060,c00,32,32,32,2,2,8,0.0,0.0,52.12800018489361,987.1331445872752,1.9310791828375498,7,-1,-1,llm8_g7,0,
2026-03-03T03:27:07.115313+00:00,BUCKET,llm_style,eval,llm_style_eval_004,64,8192,2048,bf16,NVIDIA GeForce RTX 4060,c11,32,128,32,4,2,8,0.0,0.0,196.9440057873726,238.83999645709991,10.904031526191744,1,-1,-1,llm8_g1,0,
2026-03-03T03:27:07.244009+00:00,BUCKET,llm_style,eval,llm_style_eval_005,64,3072,8192,bf16,NVIDIA GeForce RTX 4060,c04,64,64,64,4,3,8,0.0,0.0,243.648000061512,259.60673302412033,13.220816387521184,2,-1,-1,llm8_g2,0,
2026-03-03T03:27:07.266424+00:00,BUCKET,llm_style,eval,llm_style_eval_006,32,2048,2048,bf16,NVIDIA GeForce RTX 4060,c11,32,128,32,4,2,8,0.0,0.0,77.7759999036789,143.13471980392916,3.451391898946229,3,-1,-1,llm8_g3,0,
2026-03-03T03:27:07.348489+00:00,BUCKET,llm_style,eval,llm_style_eval_007,8,8192,2048,bf16,NVIDIA GeForce RTX 4060,c11,32,128,32,4,2,8,0.0,0.0,163.83999586105347,177.14400365948677,1.6384000413894664,5,-1,-1,llm8_g5,0,
2026-03-03T03:27:07.413747+00:00,BUCKET,llm_style,eval,llm_style_eval_008,64,1536,8192,bf16,NVIDIA GeForce RTX 4060,c04,64,64,64,4,3,8,0.0,0.0,146.43199741840363,191.03743746876705,10.999049144962203,2,-1,-1,llm8_g2,0,
2026-03-03T03:27:07.544584+00:00,BUCKET,llm_style,eval,llm_style_eval_009,64,4096,6144,bf16,NVIDIA GeForce RTX 4060,c04,64,64,64,4,3,8,0.0,0.0,373.648002743721,405.0275155901909,8.621016165873593,2,-1,-1,llm8_g2,0,
2026-03-03T03:27:07.591175+00:00,BUCKET,llm_style,eval,llm_style_eval_010,64,2048,4096,bf16,NVIDIA GeForce RTX 4060,c11,32,128,32,4,2,8,0.0,0.0,131.50399923324585,219.71968352794647,8.165088744529562,3,-1,-1,llm8_g3,0,
2026-03-03T03:27:07.691524+00:00,BUCKET,llm_style,eval,llm_style_eval_011,32,3072,6144,bf16,NVIDIA GeForce RTX 4060,c04,64,64,64,4,3,8,0.0,0.0,283.6480140686035,324.04126942157745,4.258656828486877,2,-1,-1,llm8_g2,0,
2026-03-03T03:27:07.707591+00:00,BUCKET,llm_style,eval,llm_style_eval_012,16,1536,1536,bf16,NVIDIA GeForce RTX 4060,c00,32,32,32,2,2,8,0.0,0.0,55.296000093221664,1208.1970825791325,1.365333331031564,7,-1,-1,llm8_g7,0,
2026-03-03T03:27:07.740385+00:00,BUCKET,llm_style,eval,llm_style_eval_013,64,2048,3072,bf16,NVIDIA GeForce RTX 4060,c11,32,128,32,4,2,8,0.0,0.0,111.56800016760826,207.4111995100975,7.218076570254829,3,-1,-1,llm8_g3,0,
2026-03-03T03:27:08.023099+00:00,BUCKET,llm_style,eval,llm_style_eval_014,16,8192,6144,bf16,NVIDIA GeForce RTX 4060,c11,32,128,32,4,2,8,0.0,0.0,716.7999744415283,766.2470549345016,2.246948651546559,4,-1,-1,llm8_g4,0,
2026-03-03T03:27:08.068012+00:00,BUCKET,llm_style,eval,llm_style_eval_015,64,6144,1536,bf16,NVIDIA GeForce RTX 4060,c11,32,128,32,4,2,8,0.0,0.0,103.7760004401207,161.84127494692802,11.640066555629103,1,-1,-1,llm8_g1,0,
2026-03-03T03:27:08.158786+00:00,BUCKET,llm_style,eval,llm_style_eval_016,16,4096,4096,bf16,NVIDIA GeForce RTX 4060,c00,32,32,32,2,2,8,0.0,0.0,251.3280063867569,371.2518414855003,2.136136436676438,7,-1,-1,llm8_g7,0,
2026-03-03T03:27:08.343209+00:00,BUCKET,llm_style,eval,llm_style_eval_017,64,8192,4096,bf16,NVIDIA GeForce RTX 4060,c11,32,128,32,4,2,8,0.0,0.0,612.2559905052185,711.1987113952637,7.0149861538404865,1,-1,-1,llm8_g1,0,
2026-03-03T03:27:08.487530+00:00,BUCKET,llm_style,eval,llm_style_eval_018,32,4096,6144,bf16,NVIDIA GeForce RTX 4060,c04,64,64,64,4,3,8,0.0,0.0,402.43199467658997,461.73632264137257,4.002198526223918,2,-1,-1,llm8_g2,0,
2026-03-03T03:27:08.621708+00:00,BUCKET,llm_style,eval,llm_style_eval_019,16,3072,8192,bf16,NVIDIA GeForce RTX 4060,c04,64,64,64,4,3,8,0.0,0.0,367.5200045108795,484.93439584970474,2.191190569535817,6,-1,-1,llm8_g6,0,
2026-03-03T03:27:08.638422+00:00,BUCKET,llm_style,eval,llm_style_eval_020,4,1536,1536,bf16,NVIDIA GeForce RTX 4060,c00,32,32,32,2,2,8,0.0,0.0,57.8560009598732,157.97472462058062,0.3262300830831804,7,-1,-1,llm8_g7,0,
2026-03-03T03:27:08.687422+00:00,BUCKET,llm_style,eval,llm_style_eval_021,4,6144,1536,bf16,NVIDIA GeForce RTX 4060,c11,32,128,32,4,2,8,0.0,0.0,80.89599758386612,143.964160233736,0.9332658506588118,5,-1,-1,llm8_g5,0,
2026-03-03T03:27:08.720059+00:00,BUCKET,llm_style,eval,llm_style_eval_022,32,6144,1024,bf16,NVIDIA GeForce RTX 4060,c11,32,128,32,4,2,8,0.0,0.0,63.999999314546585,131.9766391068695,6.291456067382813,1,-1,-1,llm8_g1,0,
2026-03-03T03:27:08.731626+00:00,BUCKET,llm_style,eval,llm_style_eval_023,16,1024,1536,bf16,NVIDIA GeForce RTX 4060,c00,32,32,32,2,2,8,0.0,0.0,61.28000095486641,160.72703815996627,0.821338890596134,7,-1,-1,llm8_g7,0,
2026-03-03T03:27:08.767624+00:00,BUCKET,llm_style,eval,llm_style_eval_024,32,8192,1024,bf16,NVIDIA GeForce RTX 4060,c11,32,128,32,4,2,8,0.0,0.0,84.99199897050858,111.13472037017345,6.316722968079492,1,-1,-1,llm8_g1,0,
2026-03-03T03:27:08.977682+00:00,BUCKET,llm_style,eval,llm_style_eval_025,32,6144,6144,bf16,NVIDIA GeForce RTX 4060,c06,64,128,32,4,3,8,0.0,0.0,536.575973033905,680.6399947404861,4.502473508718483,0,-1,-1,llm8_g0,0,
2026-03-03T03:27:09.067081+00:00,BUCKET,llm_style,eval,llm_style_eval_026,1,6144,2048,bf16,NVIDIA GeForce RTX 4060,c11,32,128,32,4,2,8,0.0,0.0,104.86399754881859,174.578238427639,0.23998535806613946,5,-1,-1,llm8_g5,0,
2026-03-03T03:27:09.133977+00:00,BUCKET,llm_style,eval,llm_style_eval_027,32,4096,3072,bf16,NVIDIA GeForce RTX 4060,c11,32,128,32,4,2,8,0.0,0.0,161.79199516773224,270.3811180591583,4.97741787018033,3,-1,-1,llm8_g3,0,
2026-03-03T03:27:09.149399+00:00,BUCKET,llm_style,eval,llm_style_eval_028,64,1536,1536,bf16,NVIDIA GeForce RTX 4060,c11,32,128,32,4,2,8,0.0,0.0,77.82399654388428,168.0588772892952,3.880421224958686,3,-1,-1,llm8_g3,0,
2026-03-03T03:27:09.163007+00:00,BUCKET,llm_style,eval,llm_style_eval_029,2,3072,1024,bf16,NVIDIA GeForce RTX 4060,c00,32,32,32,2,2,8,0.0,0.0,54.27199974656105,129.21728208661065,0.23184905768646044,7,-1,-1,llm8_g7,0,
2026-03-03T03:27:09.237239+00:00,BUCKET,llm_style,eval,llm_style_eval_030,32,1536,8192,bf16,NVIDIA GeForce RTX 4060,c04,64,64,64,4,3,8,0.0,0.0,191.98400527238846,251.04192644357667,4.1946534392665935,2,-1,-1,llm8_g2,0,
2026-03-03T03:27:09.268457+00:00,BUCKET,llm_style,eval,llm_style_eval_031,8,3072,2048,bf16,NVIDIA GeForce RTX 4060,c00,32,32,32,2,2,8,0.0,0.0,79.8719972372055,286.4435151219362,1.2603077359020842,7,-1,-1,llm8_g7,0,
2026-03-03T03:27:09.299719+00:00,BUCKET,llm_style,eval,llm_style_eval_032,8,2048,3072,bf16,NVIDIA GeForce RTX 4060,c00,32,32,32,2,2,8,0.0,0.0,101.1200025677681,209.82783228158922,0.9954835190252095,7,-1,-1,llm8_g7,0,
2026-03-03T03:27:09.371445+00:00,BUCKET,llm_style,eval,llm_style_eval_033,64,1536,8192,bf16,NVIDIA GeForce RTX 4060,c04,64,64,64,4,3,8,0.0,0.0,193.28000396490097,273.95071938633896,8.333054133693429,2,-1,-1,llm8_g2,0,
2026-03-03T03:27:09.443830+00:00,BUCKET,llm_style,eval,llm_style_eval_034,64,6144,2048,bf16,NVIDIA GeForce RTX 4060,c11,32,128,32,4,2,8,0.0,0.0,219.13599967956543,302.5209605693817,7.349831786448325,1,-1,-1,llm8_g1,0,
2026-03-03T03:27:09.482231+00:00,BUCKET,llm_style,eval,llm_style_eval_035,4,4096,2048,bf16,NVIDIA GeForce RTX 4060,c00,32,32,32,2,2,8,0.0,0.0,104.44799810647964,161.90464615821827,0.6425098155695218,7,-1,-1,llm8_g7,0,
2026-03-03T03:27:09.687105+00:00,BUCKET,llm_style,eval,llm_style_eval_036,64,8192,4096,bf16,NVIDIA GeForce RTX 4060,c11,32,128,32,4,2,8,0.0,0.0,684.8959922790527,786.114553809166,6.270977410319064,1,-1,-1,llm8_g1,0,
2026-03-03T03:27:09.723523+00:00,BUCKET,llm_style,eval,llm_style_eval_037,32,6144,1024,bf16,NVIDIA GeForce RTX 4060,c11,32,128,32,4,2,8,0.0,0.0,99.27999973297119,204.00128185749048,4.055733129361378,1,-1,-1,llm8_g1,0,
2026-03-03T03:27:09.797378+00:00,BUCKET,llm_style,eval,llm_style_eval_038,64,6144,2048,bf16,NVIDIA GeForce RTX 4060,c11,32,128,32,4,2,8,0.0,0.0,225.27999430894852,324.24831360578537,7.149381998790399,1,-1,-1,llm8_g1,0,
2026-03-03T03:27:09.816388+00:00,BUCKET,llm_style,eval,llm_style_eval_039,8,1024,3072,bf16,NVIDIA GeForce RTX 4060,c00,32,32,32,2,2,8,0.0,0.0,108.5439994931221,267.95040816068644,0.4636981153729209,7,-1,-1,llm8_g7,0,
2026-03-03T03:27:09.909617+00:00,BUCKET,llm_style,eval,llm_style_eval_040,32,8192,2048,bf16,NVIDIA GeForce RTX 4060,c11,32,128,32,4,2,8,0.0,0.0,258.04799795150757,307.73247987031925,4.161015906047749,1,-1,-1,llm8_g1,0,
2026-03-03T03:27:09.929234+00:00,BUCKET,llm_style,eval,llm_style_eval_041,32,3072,1024,bf16,NVIDIA GeForce RTX 4060,c11,32,128,32,4,2,8,0.0,0.0,75.77600330114365,147.3155242204665,2.656864749119877,3,-1,-1,llm8_g3,0,
2026-03-03T03:27:09.957338+00:00,BUCKET,llm_style,eval,llm_style_eval_042,64,1024,4096,bf16,NVIDIA GeForce RTX 4060,c11,32,128,32,4,2,8,0.0,0.0,197.63199985027313,341.9795083999634,2.7165181367730717,3,-1,-1,llm8_g3,0,
2026-03-03T03:27:09.969676+00:00,BUCKET,llm_style,eval,llm_style_eval_043,2,1536,1024,bf16,NVIDIA GeForce RTX 4060,c00,32,32,32,2,2,8,0.0,0.0,67.07200035452843,157.19296425580976,0.09380152622174219,7,-1,-1,llm8_g7,0,
2026-03-03T03:27:10.082034+00:00,BUCKET,llm_style,eval,llm_style_eval_044,64,6144,3072,bf16,NVIDIA GeForce RTX 4060,c11,32,128,32,4,2,8,0.0,0.0,376.8320083618164,423.843830525875,6.411130292521085,1,-1,-1,llm8_g1,0,
2026-03-03T03:27:10.131217+00:00,BUCKET,llm_style,eval,llm_style_eval_045,64,1536,6144,bf16,NVIDIA GeForce RTX 4060,c04,64,64,64,4,3,8,0.0,0.0,195.5839991569519,205.38367867469788,6.176167565888857,2,-1,-1,llm8_g2,0,
2026-03-03T03:27:10.231987+00:00,BUCKET,llm_style,eval,llm_style_eval_046,2,6144,3072,bf16,NVIDIA GeForce RTX 4060,c11,32,128,32,4,2,8,0.0,0.0,283.6480140686035,313.3584049344063,0.2661660517804298,5,-1,-1,llm8_g5,0,
2026-03-03T03:27:10.418126+00:00,BUCKET,llm_style,eval,llm_style_eval_047,16,4096,8192,bf16,NVIDIA GeForce RTX 4060,c04,64,64,64,4,3,8,0.0,0.0,655.3599834442139,741.6115289926528,1.6384000413894664,6,-1,-1,llm8_g6,0,
2026-03-03T03:27:10.462689+00:00,BUCKET,llm_style,eval,llm_style_eval_048,16,1024,6144,bf16,NVIDIA GeForce RTX 4060,c04,64,64,64,4,3,8,0.0,0.0,212.38400042057037,292.8665646910666,0.9479367165197279,6,-1,-1,llm8_g6,0,
2026-03-03T03:27:10.529973+00:00,BUCKET,llm_style,eval,llm_style_eval_049,16,8192,1536,bf16,NVIDIA GeForce RTX 4060,c11,32,128,32,4,2,8,0.0,0.0,167.93599724769592,270.152320563793,2.397658575880606,5,-1,-1,llm8_g5,0,
2026-03-03T03:27:10.539906+00:00,BUCKET,llm_style,eval,llm_style_eval_050,1,1024,1024,bf16,NVIDIA GeForce RTX 4060,c00,32,32,32,2,2,8,0.0,0.0,57.328000664711,132.8230402618646,0.036581635076817345,7,-1,-1,llm8_g7,0,
2026-03-03T03:27:10.569824+00:00,BUCKET,llm_style,eval,llm_style_eval_051,16,6144,1024,bf16,NVIDIA GeForce RTX 4060,c11,32,128,32,4,2,8,0.0,0.0,110.59200018644333,197.19167590141296,1.8204444413754184,5,-1,-1,llm8_g5,0,
2026-03-03T03:27:10.954168+00:00,BUCKET,llm_style,eval,llm_style_eval_052,16,8192,8192,bf16,NVIDIA GeForce RTX 4060,c11,32,128,32,4,2,8,0.0,0.0,919.5520281791687,1013.2406771183014,2.3353585030444597,4,-1,-1,llm8_g4,0,
2026-03-03T03:27:11.251687+00:00,BUCKET,llm_style,eval,llm_style_eval_053,1,6144,8192,bf16,NVIDIA GeForce RTX 4060,c11,32,128,32,4,2,8,0.0,0.0,719.3599939346313,777.5334233045576,0.13993452075282817,4,-1,-1,llm8_g4,0,
2026-03-03T03:27:11.333797+00:00,BUCKET,llm_style,eval,llm_style_eval_054,64,4096,3072,bf16,NVIDIA GeForce RTX 4060,c11,32,128,32,4,2,8,0.0,0.0,352.2240072488785,492.62591540813446,4.572694373049804,3,-1,-1,llm8_g3,0,
2026-03-03T03:27:11.373316+00:00,BUCKET,llm_style,eval,llm_style_eval_055,4,8192,1024,bf16,NVIDIA GeForce RTX 4060,c11,32,128,32,4,2,8,0.0,0.0,144.3839967250824,161.9763226807117,0.464794336783599,5,-1,-1,llm8_g5,0,
2026-03-03T03:27:11.404352+00:00,BUCKET,llm_style,eval,llm_style_eval_056,64,1024,3072,bf16,NVIDIA GeForce RTX 4060,c11,32,128,32,4,2,8,0.0,0.0,192.9120048880577,234.3910439312458,2.0872375684118265,3,-1,-1,llm8_g3,0,
2026-03-03T03:27:11.417801+00:00,BUCKET,llm_style,eval,llm_style_eval_057,64,1024,3072,bf16,NVIDIA GeForce RTX 4060,c11,32,128,32,4,2,8,0.0,0.0,195.5839991569519,214.14335727691645,2.0587225219629524,3,-1,-1,llm8_g3,0,
2026-03-03T03:27:11.479874+00:00,BUCKET,llm_style,eval,llm_style_eval_058,32,2048,4096,bf16,NVIDIA GeForce RTX 4060,c11,32,128,32,4,2,8,0.0,0.0,246.7840015888214,262.16447949409485,2.1754688656621517,3,-1,-1,llm8_g3,0,
2026-03-03T03:27:11.587509+00:00,BUCKET,llm_style,eval,llm_style_eval_059,64,8192,2048,bf16,NVIDIA GeForce RTX 4060,c11,32,128,32,4,2,8,0.0,0.0,484.3519926071167,604.784625172615,4.4337252262363185,1,-1,-1,llm8_g1,0,
2026-03-03T03:27:11.703498+00:00,BUCKET,llm_style,eval,llm_style_eval_060,1,3072,6144,bf16,NVIDIA GeForce RTX 4060,c04,64,64,64,4,3,8,0.0,0.0,448.5119879245758,584.1209590435028,0.08416438582762704,6,-1,-1,llm8_g6,0,
2026-03-03T03:27:11.747270+00:00,BUCKET,llm_style,eval,llm_style_eval_061,64,1536,4096,bf16,NVIDIA GeForce RTX 4060,c11,32,128,32,4,2,8,0.0,0.0,243.599995970726,384.5222473144531,3.3058554241387412,3,-1,-1,llm8_g3,0,
2026-03-03T03:27:11.817677+00:00,BUCKET,llm_style,eval,llm_style_eval_062,16,6144,2048,bf16,NVIDIA GeForce RTX 4060,c11,32,128,32,4,2,8,0.0,0.0,163.83999586105347,192.2486445307731,2.4576000620842,5,-1,-1,llm8_g5,0,
2026-03-03T03:27:11.871565+00:00,BUCKET,llm_style,eval,llm_style_eval_063,64,1536,6144,bf16,NVIDIA GeForce RTX 4060,c04,64,64,64,4,3,8,0.0,0.0,264.19198513031006,291.5417575836181,4.572279327112009,2,-1,-1,llm8_g2,0,
2026-03-03T03:27:11.938458+00:00,BUCKET,llm_style,eval,llm_style_eval_064,1,6144,2048,bf16,NVIDIA GeForce RTX 4060,c11,32,128,32,4,2,8,0.0,0.0,165.8879965543747,260.0345659255979,0.15170370685471,5,-1,-1,llm8_g5,0,
2026-03-03T03:27:12.001635+00:00,BUCKET,llm_style,eval,llm_style_eval_065,8,1536,6144,bf16,NVIDIA GeForce RTX 4060,c04,64,64,64,4,3,8,0.0,0.0,270.7040011882782,359.0246382355688,0.557786155125875,6,-1,-1,llm8_g6,0,
2026-03-03T03:27:12.041925+00:00,BUCKET,llm_style,eval,llm_style_eval_066,64,1536,4096,bf16,NVIDIA GeForce RTX 4060,c11,32,128,32,4,2,8,0.0,0.0,272.8959918022156,351.23840272426594,2.950964441367298,3,-1,-1,llm8_g3,0,
2026-03-03T03:27:12.147824+00:00,BUCKET,llm_style,eval,llm_style_eval_067,64,8192,2048,bf16,NVIDIA GeForce RTX 4060,c11,32,128,32,4,2,8,0.0,0.0,479.74400222301483,542.1241825819016,4.476311612128745,1,-1,-1,llm8_g1,0,
2026-03-03T03:27:12.184453+00:00,BUCKET,llm_style,eval,llm_style_eval_068,64,1024,4096,bf16,NVIDIA GeForce RTX 4060,c11,32,128,32,4,2,8,0.0,0.0,279.4880121946335,333.53728115558613,1.9209085491156126,3,-1,-1,llm8_g3,0,
2026-03-03T03:27:12.235422+00:00,BUCKET,llm_style,eval,llm_style_eval_069,64,2048,4096,bf16,NVIDIA GeForce RTX 4060,c11,32,128,32,4,2,8,0.0,0.0,304.49599027633667,324.71039831638336,3.5262921624207797,3,-1,-1,llm8_g3,0,
2026-03-03T03:27:12.289530+00:00,BUCKET,llm_style,eval,llm_style_eval_070,64,8192,1024,bf16,NVIDIA GeForce RTX 4060,c11,32,128,32,4,2,8,0.0,0.0,250.88000297546387,291.91167801618565,4.279901990056227,1,-1,-1,llm8_g1,0,
2026-03-03T03:27:12.369523+00:00,BUCKET,llm_style,eval,llm_style_eval_071,64,6144,2048,bf16,NVIDIA GeForce RTX 4060,c11,32,128,32,4,2,8,0.0,0.0,326.6560137271881,393.29791873693466,4.9306079432694245,1,-1,-1,llm8_g1,0,
2026-03-03T03:27:12.385645+00:00,BUCKET,llm_style,eval,llm_style_eval_072,64,1536,1024,bf16,NVIDIA GeForce RTX 4060,c11,32,128,32,4,2,8,0.0,0.0,96.17600217461586,171.19231835007665,2.0933142098636432,3,-1,-1,llm8_g3,0,
2026-03-03T03:27:12.419166+00:00,BUCKET,llm_style,eval,llm_style_eval_073,1,4096,1536,bf16,NVIDIA GeForce RTX 4060,c00,32,32,32,2,2,8,0.0,0.0,141.82399958372116,255.58560326695437,0.08872202192106485,7,-1,-1,llm8_g7,0,
2026-03-03T03:27:12.437120+00:00,BUCKET,llm_style,eval,llm_style_eval_074,8,1024,2048,bf16,NVIDIA GeForce RTX 4060,c00,32,32,32,2,2,8,0.0,0.0,131.47199898958206,255.30368447303766,0.25522112889345266,7,-1,-1,llm8_g7,0,
2026-03-03T03:27:12.465476+00:00,BUCKET,llm_style,eval,llm_style_eval_075,2,6144,1024,bf16,NVIDIA GeForce RTX 4060,c11,32,128,32,4,2,8,0.0,0.0,99.32799637317657,192.00672432780263,0.25336083399338566,5,-1,-1,llm8_g5,0,
2026-03-03T03:27:12.505030+00:00,BUCKET,llm_style,eval,llm_style_eval_076,64,1024,6144,bf16,NVIDIA GeForce RTX 4060,c04,64,64,64,4,3,8,0.0,0.0,274.4320034980774,284.13761019706726,2.9344477237897726,2,-1,-1,llm8_g2,0,
2026-03-03T03:27:12.707606+00:00,BUCKET,llm_style,eval,llm_style_eval_077,1,4096,8192,bf16,NVIDIA GeForce RTX 4060,c04,64,64,64,4,3,8,0.0,0.0,864.6720051765442,1004.6464204788208,0.07761193099607529,6,-1,-1,llm8_g6,0,
2026-03-03T03:27:12.826854+00:00,BUCKET,llm_style,eval,llm_style_eval_078,64,6144,3072,bf16,NVIDIA GeForce RTX 4060,c11,32,128,32,4,2,8,0.0,0.0,478.2080054283142,559.8719996213913,5.052025638584084,1,-1,-1,llm8_g1,0,
2026-03-03T03:27:12.896507+00:00,BUCKET,llm_style,eval,llm_style_eval_079,2,3072,4096,bf16,NVIDIA GeForce RTX 4060,c00,32,32,32,2,2,8,0.0,0.0,203.74400168657303,245.80095380544662,0.24703376582063524,7,-1,-1,llm8_g7,0,
2026-03-03T03:27:12.908673+00:00,BUCKET,llm_style,eval,llm_style_eval_080,4,1536,1024,bf16,NVIDIA GeForce RTX 4060,c00,32,32,32,2,2,8,0.0,0.0,77.82399654388428,154.59360301494598,0.1616842177066119,7,-1,-1,llm8_g7,0,
2026-03-03T03:27:13.063370+00:00,BUCKET,llm_style,eval,llm_style_eval_081,4,4096,6144,bf16,NVIDIA GeForce RTX 4060,c04,64,64,64,4,3,8,0.0,0.0,655.2479863166809,727.5385737419126,0.30725251538995035,6,-1,-1,llm8_g6,0,
2026-03-03T03:27:13.103144+00:00,BUCKET,llm_style,eval,llm_style_eval_082,64,6144,1024,bf16,NVIDIA GeForce RTX 4060,c11,32,128,32,4,2,8,0.0,0.0,175.61599612236023,294.4342494010923,4.585609430697326,1,-1,-1,llm8_g1,0,
2026-03-03T03:27:13.203358+00:00,BUCKET,llm_style,eval,llm_style_eval_083,8,4096,4096,bf16,NVIDIA GeForce RTX 4060,c00,32,32,32,2,2,8,0.0,0.0,269.82399821281433,385.6691202521324,0.9948538965325124,7,-1,-1,llm8_g7,0,
2026-03-03T03:27:13.264640+00:00,BUCKET,llm_style,eval,llm_style_eval_084,64,1024,8192,bf16,NVIDIA GeForce RTX 4060,c04,64,64,64,4,3,8,0.0,0.0,347.9519933462143,419.50207650661446,3.085890710594724,2,-1,-1,llm8_g2,0,
2026-03-03T03:27:13.417525+00:00,BUCKET,llm_style,eval,llm_style_eval_085,1,3072,8192,bf16,NVIDIA GeForce RTX 4060,c04,64,64,64,4,3,8,0.0,0.0,599.0399718284607,724.3494379520415,0.08402051677181373,6,-1,-1,llm8_g6,0,
2026-03-03T03:27:13.433873+00:00,BUCKET,llm_style,eval,llm_style_eval_086,8,1536,1024,bf16,NVIDIA GeForce RTX 4060,c00,32,32,32,2,2,8,0.0,0.0,70.65600156784058,163.8809558749199,0.35617390514006025,7,-1,-1,llm8_g7,0,
2026-03-03T03:27:13.455476+00:00,BUCKET,llm_style,eval,llm_style_eval_087,16,1024,3072,bf16,NVIDIA GeForce RTX 4060,c00,32,32,32,2,2,8,0.0,0.0,145.4080045223236,199.33184012770639,0.6922816686102434,7,-1,-1,llm8_g7,0,
2026-03-03T03:27:13.486092+00:00,BUCKET,llm_style,eval,llm_style_eval_088,8,4096,1536,bf16,NVIDIA GeForce RTX 4060,c00,32,32,32,2,2,8,0.0,0.0,123.24799969792366,242.9276874661444,0.816753993953022,7,-1,-1,llm8_g7,0,
2026-03-03T03:27:13.585843+00:00,BUCKET,llm_style,eval,llm_style_eval_089,16,6144,3072,bf16,NVIDIA GeForce RTX 4060,c11,32,128,32,4,2,8,0.0,0.0,288.7679934501648,324.83743429183954,2.091574515526195,5,-1,-1,llm8_g5,0,
2026-03-03T03:27:13.621585+00:00,BUCKET,llm_style,eval,llm_style_eval_090,32,1536,3072,bf16,NVIDIA GeForce RTX 4060,c11,32,128,32,4,2,8,0.0,0.0,211.96800470352173,342.5075164437293,1.424695620560241,3,-1,-1,llm8_g3,0,
2026-03-03T03:27:13.647679+00:00,BUCKET,llm_style,eval,llm_style_eval_091,16,1024,4096,bf16,NVIDIA GeForce RTX 4060,c00,32,32,32,2,2,8,0.0,0.0,176.63999646902084,193.55680152773854,0.7598376963483416,7,-1,-1,llm8_g7,0,
2026-03-03T03:27:13.796741+00:00,BUCKET,llm_style,eval,llm_style_eval_092,1,4096,6144,bf16,NVIDIA GeForce RTX 4060,c04,64,64,64,4,3,8,0.0,0.0,656.1599969863892,766.3308972120283,0.0767063646536868,6,-1,-1,llm8_g6,0,
2026-03-03T03:27:13.840003+00:00,BUCKET,llm_style,eval,llm_style_eval_093,32,2048,3072,bf16,NVIDIA GeForce RTX 4060,c11,32,128,32,4,2,8,0.0,0.0,209.4080001115799,336.281594634056,1.9228166248923266,3,-1,-1,llm8_g3,0,
2026-03-03T03:27:13.860833+00:00,BUCKET,llm_style,eval,llm_style_eval_094,32,1024,2048,bf16,NVIDIA GeForce RTX 4060,c11,32,128,32,4,2,8,0.0,0.0,150.52799880504608,220.027194917202,0.8916462655816605,3,-1,-1,llm8_g3,0,
2026-03-03T03:27:13.926631+00:00,BUCKET,llm_style,eval,llm_style_eval_095,8,6144,2048,bf16,NVIDIA GeForce RTX 4060,c11,32,128,32,4,2,8,0.0,0.0,167.93599724769592,217.26208254694927,1.198829287940303,5,-1,-1,llm8_g5,0,
2026-03-03T03:27:13.967749+00:00,BUCKET,llm_style,eval,llm_style_eval_096,64,2048,3072,bf16,NVIDIA GeForce RTX 4060,c11,32,128,32,4,2,8,0.0,0.0,234.49599742889404,366.36672437190975,3.4342009110163687,3,-1,-1,llm8_g3,0,
2026-03-03T03:27:14.008616+00:00,BUCKET,llm_style,eval,llm_style_eval_097,64,6144,1024,bf16,NVIDIA GeForce RTX 4060,c11,32,128,32,4,2,8,0.0,0.0,179.1359931230545,329.3286284804344,4.495502852108611,1,-1,-1,llm8_g1,0,
2026-03-03T03:27:14.036719+00:00,BUCKET,llm_style,eval,llm_style_eval_098,32,6144,1024,bf16,NVIDIA GeForce RTX 4060,c11,32,128,32,4,2,8,0.0,0.0,99.32799637317657,171.7945654690264,4.0537733438941705,1,-1,-1,llm8_g1,0,
2026-03-03T03:27:14.057627+00:00,BUCKET,llm_style,eval,llm_style_eval_099,1,2048,2048,bf16,NVIDIA GeForce RTX 4060,c00,32,32,32,2,2,8,0.0,0.0,107.5039990246296,203.85792195796967,0.07803066003226668,7,-1,-1,llm8_g7,0,
2026-03-03T03:27:14.101420+00:00,BUCKET,llm_style,eval,llm_style_eval_100,64,8192,1024,bf16,NVIDIA GeForce RTX 4060,c11,32,128,32,4,2,8,0.0,0.0,241.55200272798538,321.08543694019306,4.445178727038557,1,-1,-1,llm8_g1,0,
2026-03-03T03:27:14.181058+00:00,BUCKET,llm_style,eval,llm_style_eval_101,64,8192,1536,bf16,NVIDIA GeForce RTX 4060,c11,32,128,32,4,2,8,0.0,0.0,390.079990029335,518.6662554740906,4.128929391838012,1,-1,-1,llm8_g1,0,
2026-03-03T03:27:14.214953+00:00,BUCKET,llm_style,eval,llm_style_eval_102,32,3072,2048,bf16,NVIDIA GeForce RTX 4060,c11,32,128,32,4,2,8,0.0,0.0,163.7120023369789,226.90208196640012,2.459521466063271,3,-1,-1,llm8_g3,0,
2026-03-03T03:27:14.251994+00:00,BUCKET,llm_style,eval,llm_style_eval_103,64,2048,3072,bf16,NVIDIA GeForce RTX 4060,c11,32,128,32,4,2,8,0.0,0.0,250.86399912834167,367.8207975625992,3.2101312695250717,3,-1,-1,llm8_g3,0,
2026-03-03T03:27:14.322262+00:00,BUCKET,llm_style,eval,llm_style_eval_104,16,6144,2048,bf16,NVIDIA GeForce RTX 4060,c11,32,128,32,4,2,8,0.0,0.0,180.2240014076233,189.37119990587234,2.234181800731943,5,-1,-1,llm8_g5,0,
2026-03-03T03:27:14.376407+00:00,BUCKET,llm_style,eval,llm_style_eval_105,1,1024,8192,bf16,NVIDIA GeForce RTX 4060,c04,64,64,64,4,3,8,0.0,0.0,389.1200125217438,548.9561629295348,0.04311578808623342,6,-1,-1,llm8_g6,0,
2026-03-03T03:27:14.585461+00:00,BUCKET,llm_style,eval,llm_style_eval_106,32,4096,8192,bf16,NVIDIA GeForce RTX 4060,c04,64,64,64,4,3,8,0.0,0.0,1038.8000011444092,1123.2179200649261,2.0672734363055385,2,-1,-1,llm8_g2,0,
2026-03-03T03:27:14.649966+00:00,BUCKET,llm_style,eval,llm_style_eval_107,64,6144,1536,bf16,NVIDIA GeForce RTX 4060,c11,32,128,32,4,2,8,0.0,0.0,298.92800748348236,359.5059150457382,4.040971477277007,1,-1,-1,llm8_g1,0,
2026-03-03T03:27:14.676975+00:00,BUCKET,llm_style,eval,llm_style_eval_108,8,3072,1536,bf16,NVIDIA GeForce RTX 4060,c00,32,32,32,2,2,8,0.0,0.0,128.4480020403862,238.19263488054276,0.587766806806869,7,-1,-1,llm8_g7,0,
2026-03-03T03:27:14.692153+00:00,BUCKET,llm_style,eval,llm_style_eval_109,16,2048,1024,bf16,NVIDIA GeForce RTX 4060,c00,32,32,32,2,2,8,0.0,0.0,103.42399775981903,165.94944402575493,0.6488713011833727,7,-1,-1,llm8_g7,0,
2026-03-03T03:27:15.050176+00:00,BUCKET,llm_style,eval,llm_style_eval_110,1,8192,8192,bf16,NVIDIA GeForce RTX 4060,c11,32,128,32,4,2,8,0.0,0.0,918.4960126876831,1057.6070356369019,0.14612771982238112,4,-1,-1,llm8_g4,0,
2026-03-03T03:27:15.106646+00:00,BUCKET,llm_style,eval,llm_style_eval_111,8,6144,1536,bf16,NVIDIA GeForce RTX 4060,c11,32,128,32,4,2,8,0.0,0.0,143.36000382900238,234.62304100394246,1.0532571147256975,5,-1,-1,llm8_g5,0,
2026-03-03T03:27:15.220352+00:00,BUCKET,llm_style,eval,llm_style_eval_112,2,6144,3072,bf16,NVIDIA GeForce RTX 4060,c11,32,128,32,4,2,8,0.0,0.0,286.6879999637604,386.3961640000343,0.2633436767829259,5,-1,-1,llm8_g5,0,
2026-03-03T03:27:15.579430+00:00,BUCKET,llm_style,eval,llm_style_eval_113,1,8192,8192,bf16,NVIDIA GeForce RTX 4060,c11,32,128,32,4,2,8,0.0,0.0,946.0799992084503,978.9849638938904,0.14186720796581148,4,-1,-1,llm8_g4,0,
2026-03-03T03:27:15.597108+00:00,BUCKET,llm_style,eval,llm_style_eval_114,1,3072,1024,bf16,NVIDIA GeForce RTX 4060,c00,32,32,32,2,2,8,0.0,0.0,78.33599671721458,197.72416338324535,0.08031372885586113,7,-1,-1,llm8_g7,0,
2026-03-03T03:27:15.620637+00:00,BUCKET,llm_style,eval,llm_style_eval_115,16,3072,1536,bf16,NVIDIA GeForce RTX 4060,c00,32,32,32,2,2,8,0.0,0.0,103.37599739432335,190.5663974583149,1.4606383281027626,7,-1,-1,llm8_g7,0,
2026-03-03T03:27:15.637838+00:00,BUCKET,llm_style,eval,llm_style_eval_116,8,3072,1024,bf16,NVIDIA GeForce RTX 4060,c00,32,32,32,2,2,8,0.0,0.0,88.06400001049042,216.61695852875698,0.5715348836528475,7,-1,-1,llm8_g7,0,
2026-03-03T03:27:15.664259+00:00,BUCKET,llm_style,eval,llm_style_eval_117,4,1024,4096,bf16,NVIDIA GeForce RTX 4060,c00,32,32,32,2,2,8,0.0,0.0,187.3439997434616,202.23455384373665,0.1791059870929817,7,-1,-1,llm8_g7,0,
2026-03-03T03:27:15.777832+00:00,BUCKET,llm_style,eval,llm_style_eval_118,64,6144,3072,bf16,NVIDIA GeForce RTX 4060,c11,32,128,32,4,2,8,0.0,0.0,518.6560153961182,649.4617557525635,4.658037374067409,1,-1,-1,llm8_g1,0,
2026-03-03T03:27:16.084671+00:00,BUCKET,llm_style,eval,llm_style_eval_119,64,8192,6144,bf16,NVIDIA GeForce RTX 4060,c06,64,128,32,4,3,8,0.0,0.0,1330.1759958267212,1462.4393594264984,4.843307174548684,0,-1,-1,llm8_g0,0,
2026-03-03T03:27:16.118633+00:00,BUCKET,llm_style,eval,llm_style_eval_120,8,1024,4096,bf16,NVIDIA GeForce RTX 4060,c00,32,32,32,2,2,8,0.0,0.0,189.95200097560883,257.5462341308594,0.3532937987245381,7,-1,-1,llm8_g7,0,
2026-03-03T03:27:16.134755+00:00,BUCKET,llm_style,eval,llm_style_eval_121,4,1024,2048,bf16,NVIDIA GeForce RTX 4060,c00,32,32,32,2,2,8,0.0,0.0,99.2479994893074,216.94464623928053,0.16904336698300415,7,-1,-1,llm8_g7,0,
2026-03-03T03:27:16.268119+00:00,BUCKET,llm_style,eval,llm_style_eval_122,4,6144,4096,bf16,NVIDIA GeForce RTX 4060,c11,32,128,32,4,2,8,0.0,0.0,366.5760010480881,480.0841724872588,0.5492083263071813,5,-1,-1,llm8_g5,0,
2026-03-03T03:27:16.406150+00:00,BUCKET,llm_style,eval,llm_style_eval_123,4,3072,8192,bf16,NVIDIA GeForce RTX 4060,c04,64,64,64,4,3,8,0.0,0.0,537.5039875507355,610.787506699562,0.3745583226598791,6,-1,-1,llm8_g6,0,
2026-03-03T03:27:16.438954+00:00,BUCKET,llm_style,eval,llm_style_eval_124,64,6144,1024,bf16,NVIDIA GeForce RTX 4060,c11,32,128,32,4,2,8,0.0,0.0,158.720001578331,231.53663992881764,5.073754788255642,1,-1,-1,llm8_g1,0,
2026-03-03T03:27:16.517850+00:00,BUCKET,llm_style,eval,llm_style_eval_125,64,1536,8192,bf16,NVIDIA GeForce RTX 4060,c04,64,64,64,4,3,8,0.0,0.0,318.33600997924805,341.176323890686,5.059473906533521,2,-1,-1,llm8_g2,0,
2026-03-03T03:27:16.624211+00:00,BUCKET,llm_style,eval,llm_style_eval_126,64,2048,8192,bf16,NVIDIA GeForce RTX 4060,c04,64,64,64,4,3,8,0.0,0.0,540.6239926815033,564.8691284656525,3.9722314900388502,2,-1,-1,llm8_g2,0,
2026-03-03T03:27:16.689679+00:00,BUCKET,llm_style,eval,llm_style_eval_127,2,8192,1536,bf16,NVIDIA GeForce RTX 4060,c11,32,128,32,4,2,8,0.0,0.0,196.3680014014244,214.20031800866124,0.25631288010672243,5,-1,-1,llm8_g5,0,
2026-03-03T03:27:16.710381+00:00,BUCKET,llm_style,eval,llm_style_eval_128,8,2048,2048,bf16,NVIDIA GeForce RTX 4060,c00,32,32,32,2,2,8,0.0,0.0,98.30400347709656,131.96287982165808,0.6826666425201637,7,-1,-1,llm8_g7,0,
2026-03-03T03:27:17.000782+00:00,BUCKET,llm_style,eval,llm_style_eval_129,64,8192,6144,bf16,NVIDIA GeForce RTX 4060,c06,64,128,32,4,3,8,0.0,0.0,1091.0719633102417,1131.6636645793915,5.9046984622847605,0,-1,-1,llm8_g0,0,
2026-03-03T03:27:17.031904+00:00,BUCKET,llm_style,eval,llm_style_eval_130,16,3072,1536,bf16,NVIDIA GeForce RTX 4060,c00,32,32,32,2,2,8,0.0,0.0,88.54399994015694,163.37919935584068,1.7053097228728198,7,-1,-1,llm8_g7,0,
2026-03-03T03:27:17.421617+00:00,BUCKET,llm_style,eval,llm_style_eval_131,32,8192,8192,bf16,NVIDIA GeForce RTX 4060,c06,64,128,32,4,3,8,0.0,0.0,1439.4240379333496,1599.3036913871763,2.983809623025673,0,-1,-1,llm8_g0,0,
2026-03-03T03:27:17.595229+00:00,BUCKET,llm_style,eval,llm_style_eval_132,32,8192,4096,bf16,NVIDIA GeForce RTX 4060,c11,32,128,32,4,2,8,0.0,0.0,481.27999901771545,548.966406583786,4.462025541021815,1,-1,-1,llm8_g1,0,
2026-03-03T03:27:17.936918+00:00,BUCKET,llm_style,eval,llm_style_eval_133,2,8192,8192,bf16,NVIDIA GeForce RTX 4060,c11,32,128,32,4,2,8,0.0,0.0,910.288006067276,963.6249661445618,0.2948906875745004,4,-1,-1,llm8_g4,0,
2026-03-03T03:27:17.983907+00:00,BUCKET,llm_style,eval,llm_style_eval_134,64,3072,3072,bf16,NVIDIA GeForce RTX 4060,c11,32,128,32,4,2,8,0.0,0.0,182.27200210094452,244.15232419967634,6.627235878667844,3,-1,-1,llm8_g3,0,
2026-03-03T03:27:18.038307+00:00,BUCKET,llm_style,eval,llm_style_eval_135,8,3072,3072,bf16,NVIDIA GeForce RTX 4060,c00,32,32,32,2,2,8,0.0,0.0,108.91199856996536,204.20608192682258,1.386394024373728,7,-1,-1,llm8_g7,0,
2026-03-03T03:27:18.083941+00:00,BUCKET,llm_style,eval,llm_style_eval_136,4,2048,4096,bf16,NVIDIA GeForce RTX 4060,c00,32,32,32,2,2,8,0.0,0.0,148.47999811172485,218.54495853185654,0.4519724195410041,7,-1,-1,llm8_g7,0,
2026-03-03T03:27:18.414041+00:00,BUCKET,llm_style,eval,llm_style_eval_137,4,8192,8192,bf16,NVIDIA GeForce RTX 4060,c11,32,128,32,4,2,8,0.0,0.0,912.3839735984802,1028.6531031131744,0.5884265041203638,4,-1,-1,llm8_g4,0,
2026-03-03T03:27:18.425918+00:00,BUCKET,llm_style,eval,llm_style_eval_138,16,1024,1024,bf16,NVIDIA GeForce RTX 4060,c00,32,32,32,2,2,8,0.0,0.0,84.33599770069122,160.80896228551865,0.3978660704185277,7,-1,-1,llm8_g7,0,
2026-03-03T03:27:18.435015+00:00,BUCKET,llm_style,eval,llm_style_eval_139,4,1024,1024,bf16,NVIDIA GeForce RTX 4060,c00,32,32,32,2,2,8,0.0,0.0,57.34400078654289,86.57919950783253,0.14628571227922732,7,-1,-1,llm8_g7,0,
2026-03-03T03:27:18.576909+00:00,BUCKET,llm_style,eval,llm_style_eval_140,64,4096,6144,bf16,NVIDIA GeForce RTX 4060,c04,64,64,64,4,3,8,0.0,0.0,506.879985332489,537.7478575706482,6.355006244499929,2,-1,-1,llm8_g2,0,
2026-03-03T03:27:18.706918+00:00,BUCKET,llm_style,eval,llm_style_eval_141,4,6144,4096,bf16,NVIDIA GeForce RTX 4060,c11,32,128,32,4,2,8,0.0,0.0,370.6879913806915,413.655361533165,0.5431160347280857,5,-1,-1,llm8_g5,0,
2026-03-03T03:27:18.782216+00:00,BUCKET,llm_style,eval,llm_style_eval_142,4,2048,6144,bf16,NVIDIA GeForce RTX 4060,c04,64,64,64,4,3,8,0.0,0.0,349.5680093765259,416.82944655418373,0.28796484031687747,6,-1,-1,llm8_g6,0,
2026-03-03T03:27:18.859942+00:00,BUCKET,llm_style,eval,llm_style_eval_143,64,1536,8192,bf16,NVIDIA GeForce RTX 4060,c04,64,64,64,4,3,8,0.0,0.0,271.36000990867615,286.10400676727295,5.935335632328572,2,-1,-1,llm8_g2,0,
2026-03-03T03:27:18.917862+00:00,BUCKET,llm_style,eval,llm_style_eval_144,1,3072,3072,bf16,NVIDIA GeForce RTX 4060,c00,32,32,32,2,2,8,0.0,0.0,123.90399724245071,178.13951954245564,0.15233058190259463,7,-1,-1,llm8_g7,0,
2026-03-03T03:27:18.935565+00:00,BUCKET,llm_style,eval,llm_style_eval_145,32,1024,2048,bf16,NVIDIA GeForce RTX 4060,c11,32,128,32,4,2,8,0.0,0.0,124.92799758911133,199.09855917096138,1.0743606764709592,3,-1,-1,llm8_g3,0,
2026-03-03T03:27:19.121567+00:00,BUCKET,llm_style,eval,llm_style_eval_146,64,8192,4096,bf16,NVIDIA GeForce RTX 4060,c11,32,128,32,4,2,8,0.0,0.0,755.1999986171722,771.6147238016129,5.687191874820454,1,-1,-1,llm8_g1,0,
2026-03-03T03:27:19.177324+00:00,BUCKET,llm_style,eval,llm_style_eval_147,64,2048,4096,bf16,NVIDIA GeForce RTX 4060,c11,32,128,32,4,2,8,0.0,0.0,235.3760004043579,295.42688220739365,4.561815232459528,3,-1,-1,llm8_g3,0,
2026-03-03T03:27:19.215891+00:00,BUCKET,llm_style,eval,llm_style_eval_148,64,1024,6144,bf16,NVIDIA GeForce RTX 4060,c04,64,64,64,4,3,8,0.0,0.0,209.9200040102005,223.7542374432087,3.836253585250829,2,-1,-1,llm8_g2,0,
2026-03-03T03:27:19.401638+00:00,BUCKET,llm_style,eval,llm_style_eval_149,64,4096,8192,bf16,NVIDIA GeForce RTX 4060,c04,64,64,64,4,3,8,0.0,0.0,722.6560115814209,797.9417467117307,5.943308056901275,2,-1,-1,llm8_g2,0,
2026-03-03T03:27:19.429959+00:00,BUCKET,llm_style,eval,llm_style_eval_150,2,2048,3072,bf16,NVIDIA GeForce RTX 4060,c00,32,32,32,2,2,8,0.0,0.0,125.84000080823898,166.00064024329174,0.1999827069164509,7,-1,-1,llm8_g7,0,
2026-03-03T03:27:19.473205+00:00,BUCKET,llm_style,eval,llm_style_eval_151,64,4096,2048,bf16,NVIDIA GeForce RTX 4060,c11,32,128,32,4,2,8,0.0,0.0,228.2239943742752,242.50559851527214,4.704771849006904,3,-1,-1,llm8_g3,0,
2026-03-03T03:27:19.831406+00:00,BUCKET,llm_style,eval,llm_style_eval_152,8,8192,8192,bf16,NVIDIA GeForce RTX 4060,c11,32,128,32,4,2,8,0.0,0.0,915.4239892959595,1042.4566757678986,1.1729448174345973,4,-1,-1,llm8_g4,0,
2026-03-03T03:27:19.939028+00:00,BUCKET,llm_style,eval,llm_style_eval_153,64,8192,2048,bf16,NVIDIA GeForce RTX 4060,c11,32,128,32,4,2,8,0.0,0.0,463.8719856739044,623.6774498224258,4.6294747566619625,1,-1,-1,llm8_g1,0,
2026-03-03T03:27:20.048720+00:00,BUCKET,llm_style,eval,llm_style_eval_154,16,2048,8192,bf16,NVIDIA GeForce RTX 4060,c04,64,64,64,4,3,8,0.0,0.0,562.175989151001,683.9993596076965,0.9549872679741859,6,-1,-1,llm8_g6,0,
2026-03-03T03:27:20.077263+00:00,BUCKET,llm_style,eval,llm_style_eval_155,4,2048,1536,bf16,NVIDIA GeForce RTX 4060,c00,32,32,32,2,2,8,0.0,0.0,88.87999877333641,946.7084677517387,0.28314383829120426,7,-1,-1,llm8_g7,0,
2026-03-03T03:27:20.226810+00:00,BUCKET,llm_style,eval,llm_style_eval_156,1,4096,6144,bf16,NVIDIA GeForce RTX 4060,c04,64,64,64,4,3,8,0.0,0.0,621.5680241584778,738.867192864418,0.08097528515586447,6,-1,-1,llm8_g6,0,
2026-03-03T03:27:20.302159+00:00,BUCKET,llm_style,eval,llm_style_eval_157,1,1536,8192,bf16,NVIDIA GeForce RTX 4060,c04,64,64,64,4,3,8,0.0,0.0,347.1039980649948,422.5596797466277,0.07250225909321772,6,-1,-1,llm8_g6,0,
2026-03-03T03:27:20.379136+00:00,BUCKET,llm_style,eval,llm_style_eval_158,64,1536,8192,bf16,NVIDIA GeForce RTX 4060,c04,64,64,64,4,3,8,0.0,0.0,345.6000089645386,392.5401511788367,4.660337656893007,2,-1,-1,llm8_g2,0,
2026-03-03T03:27:20.430109+00:00,BUCKET,llm_style,eval,llm_style_eval_159,16,6144,1536,bf16,NVIDIA GeForce RTX 4060,c11,32,128,32,4,2,8,0.0,0.0,136.7039978504181,212.56192475557316,2.2090786864217256,5,-1,-1,llm8_g5,0,
2026-03-03T03:27:20.643291+00:00,BUCKET,llm_style,eval,llm_style_eval_160,32,6144,6144,bf16,NVIDIA GeForce RTX 4060,c06,64,128,32,4,3,8,0.0,0.0,850.4319787025452,994.3244814872742,2.8408140386322582,0,-1,-1,llm8_g0,0,
2026-03-03T03:27:20.677779+00:00,BUCKET,llm_style,eval,llm_style_eval_161,2,1536,4096,bf16,NVIDIA GeForce RTX 4060,c00,32,32,32,2,2,8,0.0,0.0,186.75199896097183,302.0527973771094,0.13475531260717188,7,-1,-1,llm8_g7,0,
2026-03-03T03:27:20.709477+00:00,BUCKET,llm_style,eval,llm_style_eval_162,64,1536,3072,bf16,NVIDIA GeForce RTX 4060,c11,32,128,32,4,2,8,0.0,0.0,220.14399617910385,238.71487885713577,2.7435668766029697,3,-1,-1,llm8_g3,0,
2026-03-03T03:27:20.773413+00:00,BUCKET,llm_style,eval,llm_style_eval_163,64,1024,8192,bf16,NVIDIA GeForce RTX 4060,c04,64,64,64,4,3,8,0.0,0.0,367.6159977912903,462.6124688982963,2.920824530083711,2,-1,-1,llm8_g2,0,
2026-03-03T03:27:20.977345+00:00,BUCKET,llm_style,eval,llm_style_eval_164,64,4096,8192,bf16,NVIDIA GeForce RTX 4060,c04,64,64,64,4,3,8,0.0,0.0,920.5759763717651,1023.6381196975708,4.665521810516509,2,-1,-1,llm8_g2,0,
2026-03-03T03:27:21.112289+00:00,BUCKET,llm_style,eval,llm_style_eval_165,4,8192,3072,bf16,NVIDIA GeForce RTX 4060,c11,32,128,32,4,2,8,0.0,0.0,407.55200386047363,431.6671934723854,0.49398994506949995,5,-1,-1,llm8_g5,0,
2026-03-03T03:27:21.161962+00:00,BUCKET,llm_style,eval,llm_style_eval_166,64,1024,6144,bf16,NVIDIA GeForce RTX 4060,c04,64,64,64,4,3,8,0.0,0.0,300.03198981285095,372.81791925430275,2.6840683505192926,2,-1,-1,llm8_g2,0,
2026-03-03T03:27:21.175222+00:00,BUCKET,llm_style,eval,llm_style_eval_167,2,2048,1024,bf16,NVIDIA GeForce RTX 4060,c00,32,32,32,2,2,8,0.0,0.0,73.72800260782242,94.41279835999009,0.11377777375336061,7,-1,-1,llm8_g7,0,
2026-03-03T03:27:21.200932+00:00,BUCKET,llm_style,eval,llm_style_eval_168,64,4096,1024,bf16,NVIDIA GeForce RTX 4060,c11,32,128,32,4,2,8,0.0,0.0,153.48800271749496,259.6396812796592,3.4978037533535904,3,-1,-1,llm8_g3,0,
2026-03-03T03:27:21.251337+00:00,BUCKET,llm_style,eval,llm_style_eval_169,4,1536,6144,bf16,NVIDIA GeForce RTX 4060,c04,64,64,64,4,3,8,0.0,0.0,300.03198981285095,468.2515314221378,0.25163140786118365,6,-1,-1,llm8_g6,0,
2026-03-03T03:27:21.269029+00:00,BUCKET,llm_style,eval,llm_style_eval_170,16,1536,1536,bf16,NVIDIA GeForce RTX 4060,c00,32,32,32,2,2,8,0.0,0.0,96.25600278377533,103.3504007011652,0.7843404028483683,7,-1,-1,llm8_g7,0,
2026-03-03T03:27:21.301615+00:00,BUCKET,llm_style,eval,llm_style_eval_171,1,2048,3072,bf16,NVIDIA GeForce RTX 4060,c00,32,32,32,2,2,8,0.0,0.0,161.79199516773224,234.5779174566269,0.07777215422156766,7,-1,-1,llm8_g7,0,
2026-03-03T03:27:21.339777+00:00,BUCKET,llm_style,eval,llm_style_eval_172,64,3072,2048,bf16,NVIDIA GeForce RTX 4060,c11,32,128,32,4,2,8,0.0,0.0,196.06400281190872,355.01056462526316,4.107364719940761,3,-1,-1,llm8_g3,0,
2026-03-03T03:27:21.688526+00:00,BUCKET,llm_style,eval,llm_style_eval_173,64,8192,6144,bf16,NVIDIA GeForce RTX 4060,c06,64,128,32,4,3,8,0.0,0.0,1423.8719940185547,1536.061453819275,4.524599803257348,0,-1,-1,llm8_g0,0,
2026-03-03T03:27:21.787021+00:00,BUCKET,llm_style,eval,llm_style_eval_174,2,4096,4096,bf16,NVIDIA GeForce RTX 4060,c00,32,32,32,2,2,8,0.0,0.0,315.3599947690964,451.7507302761077,0.21280081530042033,7,-1,-1,llm8_g7,0,
2026-03-03T03:27:21.841256+00:00,BUCKET,llm_style,eval,llm_style_eval_175,64,4096,2048,bf16,NVIDIA GeForce RTX 4060,c11,32,128,32,4,2,8,0.0,0.0,318.9759999513626,378.65472108125675,3.366215088795784,3,-1,-1,llm8_g3,0,
2026-03-03T03:27:21.907607+00:00,BUCKET,llm_style,eval,llm_style_eval_176,16,6144,2048,bf16,NVIDIA GeForce RTX 4060,c11,32,128,32,4,2,8,0.0,0.0,195.5839991569519,255.300155431032,2.0587225219629524,5,-1,-1,llm8_g5,0,
2026-03-03T03:27:21.958598+00:00,BUCKET,llm_style,eval,llm_style_eval_177,1,6144,1536,bf16,NVIDIA GeForce RTX 4060,c11,32,128,32,4,2,8,0.0,0.0,155.0239995121956,290.0992012023925,0.12175126470347046,5,-1,-1,llm8_g5,0,
2026-03-03T03:27:22.267202+00:00,BUCKET,llm_style,eval,llm_style_eval_178,32,6144,8192,bf16,NVIDIA GeForce RTX 4060,c06,64,128,32,4,3,8,0.0,0.0,1383.9040398597717,1526.9785583019257,2.3276364395369495,0,-1,-1,llm8_g0,0,
2026-03-03T03:27:22.429833+00:00,BUCKET,llm_style,eval,llm_style_eval_179,64,4096,6144,bf16,NVIDIA GeForce RTX 4060,c04,64,64,64,4,3,8,0.0,0.0,849.9199748039246,985.3136014938354,3.790033847296191,2,-1,-1,llm8_g2,0,
2026-03-03T03:27:22.452552+00:00,BUCKET,llm_style,eval,llm_style_eval_180,64,2048,1536,bf16,NVIDIA GeForce RTX 4060,c11,32,128,32,4,2,8,0.0,0.0,169.40800100564957,181.17919713258743,2.3768250708924423,3,-1,-1,llm8_g3,0,
2026-03-03T03:27:22.493095+00:00,BUCKET,llm_style,eval,llm_style_eval_181,64,2048,3072,bf16,NVIDIA GeForce RTX 4060,c11,32,128,32,4,2,8,0.0,0.0,301.05599761009216,441.97727978229517,2.6749387967449816,3,-1,-1,llm8_g3,0,
2026-03-03T03:27:22.520926+00:00,BUCKET,llm_style,eval,llm_style_eval_182,32,3072,1536,bf16,NVIDIA GeForce RTX 4060,c11,32,128,32,4,2,8,0.0,0.0,155.93600273132324,235.38688123226157,1.9366270951572786,3,-1,-1,llm8_g3,0,
2026-03-03T03:27:22.613949+00:00,BUCKET,llm_style,eval,llm_style_eval_183,8,8192,2048,bf16,NVIDIA GeForce RTX 4060,c11,32,128,32,4,2,8,0.0,0.0,333.69600772857666,404.0191915631294,0.8044311282811073,5,-1,-1,llm8_g5,0,
2026-03-03T03:27:22.662503+00:00,BUCKET,llm_style,eval,llm_style_eval_184,64,8192,1024,bf16,NVIDIA GeForce RTX 4060,c11,32,128,32,4,2,8,0.0,0.0,314.36800956726074,351.13984316587437,3.415556899310606,1,-1,-1,llm8_g1,0,
2026-03-03T03:27:22.738075+00:00,BUCKET,llm_style,eval,llm_style_eval_185,1,8192,1536,bf16,NVIDIA GeForce RTX 4060,c11,32,128,32,4,2,8,0.0,0.0,281.5999984741211,378.83904129266716,0.0893672732115186,5,-1,-1,llm8_g5,0,
2026-03-03T03:27:22.767410+00:00,BUCKET,llm_style,eval,llm_style_eval_186,16,6144,1024,bf16,NVIDIA GeForce RTX 4060,c11,32,128,32,4,2,8,0.0,0.0,127.9040053486824,159.59039792418474,1.5740444675767453,5,-1,-1,llm8_g5,0,
2026-03-03T03:27:22.809183+00:00,BUCKET,llm_style,eval,llm_style_eval_187,1,1024,6144,bf16,NVIDIA GeForce RTX 4060,c04,64,64,64,4,3,8,0.0,0.0,353.2800078392029,518.4921488165852,0.035617390514006024,6,-1,-1,llm8_g6,0,
2026-03-03T03:27:22.989986+00:00,BUCKET,llm_style,eval,llm_style_eval_188,8,8192,4096,bf16,NVIDIA GeForce RTX 4060,c11,32,128,32,4,2,8,0.0,0.0,658.8639914989471,770.5702358484268,0.8148433044255354,5,-1,-1,llm8_g5,0,
2026-03-03T03:27:23.115958+00:00,BUCKET,llm_style,eval,llm_style_eval_189,8,2048,8192,bf16,NVIDIA GeForce RTX 4060,c04,64,64,64,4,3,8,0.0,0.0,833.5360288619995,927.9017531871793,0.32204421489313,6,-1,-1,llm8_g6,0,
2026-03-03T03:27:23.218322+00:00,BUCKET,llm_style,eval,llm_style_eval_190,4,8192,2048,bf16,NVIDIA GeForce RTX 4060,c11,32,128,32,4,2,8,0.0,0.0,363.5199964046478,443.0652874708175,0.3692169050601475,5,-1,-1,llm8_g5,0,
2026-03-03T03:27:23.588813+00:00,BUCKET,llm_style,eval,llm_style_eval_191,4,8192,8192,bf16,NVIDIA GeForce RTX 4060,c11,32,128,32,4,2,8,0.0,0.0,1442.6559805870056,1575.0998628139496,0.3721406345132617,4,-1,-1,llm8_g4,0,
2026-03-03T03:27:23.618890+00:00,BUCKET,llm_style,eval,llm_style_eval_192,64,1536,1024,bf16,NVIDIA GeForce RTX 4060,c11,32,128,32,4,2,8,0.0,0.0,134.5919966697693,559.9744132161131,1.4958288529887005,3,-1,-1,llm8_g3,0,
2026-03-03T03:27:23.654270+00:00,BUCKET,llm_style,eval,llm_style_eval_193,32,2048,2048,bf16,NVIDIA GeForce RTX 4060,c11,32,128,32,4,2,8,0.0,0.0,222.17600047588348,329.94943201541895,1.2082108572709582,3,-1,-1,llm8_g3,0,
2026-03-03T03:27:23.670303+00:00,BUCKET,llm_style,eval,llm_style_eval_194,8,1024,2048,bf16,NVIDIA GeForce RTX 4060,c00,32,32,32,2,2,8,0.0,0.0,116.73600226640701,129.53056648373604,0.2874385909106631,7,-1,-1,llm8_g7,0,
2026-03-03T03:27:23.709901+00:00,BUCKET,llm_style,eval,llm_style_eval_195,2,4096,2048,bf16,NVIDIA GeForce RTX 4060,c00,32,32,32,2,2,8,0.0,0.0,164.86400365829468,292.55489259958256,0.20352794579432015,7,-1,-1,llm8_g7,0,
2026-03-03T03:27:23.771612+00:00,BUCKET,llm_style,eval,llm_style_eval_196,32,2048,4096,bf16,NVIDIA GeForce RTX 4060,c11,32,128,32,4,2,8,0.0,0.0,302.0800054073334,381.634558737278,1.7772474258137934,3,-1,-1,llm8_g3,0,
2026-03-03T03:27:23.841627+00:00,BUCKET,llm_style,eval,llm_style_eval_197,32,8192,1536,bf16,NVIDIA GeForce RTX 4060,c11,32,128,32,4,2,8,0.0,0.0,229.88799959421158,250.3455913066864,3.50303786809878,1,-1,-1,llm8_g1,0,
2026-03-03T03:27:24.053137+00:00,BUCKET,llm_style,eval,llm_style_eval_198,64,4096,8192,bf16,NVIDIA GeForce RTX 4060,c04,64,64,64,4,3,8,0.0,0.0,974.8479723930359,1125.963796377182,4.405781637373472,2,-1,-1,llm8_g2,0,
2026-03-03T03:27:24.231386+00:00,BUCKET,llm_style,eval,llm_style_eval_199,2,8192,4096,bf16,NVIDIA GeForce RTX 4060,c11,32,128,32,4,2,8,0.0,0.0,527.2479951381683,636.502086520195,0.2545628039132277,5,-1,-1,llm8_g5,0,
2026-03-03T03:27:24.251897+00:00,BUCKET,llm_style,eval,llm_style_eval_200,1,4096,1024,bf16,NVIDIA GeForce RTX 4060,c00,32,32,32,2,2,8,0.0,0.0,98.30400347709656,136.80191837251175,0.08533333031502047,7,-1,-1,llm8_g7,0,
2026-03-03T03:27:24.328605+00:00,BUCKET,llm_style,eval,llm_style_eval_201,4,1536,8192,bf16,NVIDIA GeForce RTX 4060,c04,64,64,64,4,3,8,0.0,0.0,389.5360082387924,408.6988767981529,0.25841846163369736,6,-1,-1,llm8_g6,0,
2026-03-03T03:27:24.432853+00:00,BUCKET,llm_style,eval,llm_style_eval_202,1,6144,3072,bf16,NVIDIA GeForce RTX 4060,c11,32,128,32,4,2,8,0.0,0.0,286.72000765800476,390.20544558763504,0.1316571393407122,5,-1,-1,llm8_g5,0,
2026-03-03T03:27:24.522902+00:00,BUCKET,llm_style,eval,llm_style_eval_203,16,2048,6144,bf16,NVIDIA GeForce RTX 4060,c04,64,64,64,4,3,8,0.0,0.0,507.9039931297302,569.2582607269285,0.7927742042720133,6,-1,-1,llm8_g6,0,
2026-03-03T03:27:24.535217+00:00,BUCKET,llm_style,eval,llm_style_eval_204,16,1536,1024,bf16,NVIDIA GeForce RTX 4060,c00,32,32,32,2,2,8,0.0,0.0,70.56000083684921,98.402559235692,0.7133169983427045,7,-1,-1,llm8_g7,0,
2026-03-03T03:27:24.616963+00:00,BUCKET,llm_style,eval,llm_style_eval_205,64,6144,2048,bf16,NVIDIA GeForce RTX 4060,c11,32,128,32,4,2,8,0.0,0.0,364.54400420188904,477.706241607666,4.418157252445229,1,-1,-1,llm8_g1,0,
2026-03-03T03:27:24.707911+00:00,BUCKET,llm_style,eval,llm_style_eval_206,4,2048,6144,bf16,NVIDIA GeForce RTX 4060,c04,64,64,64,4,3,8,0.0,0.0,510.2880001068115,650.447039604187,0.19726761354162659,6,-1,-1,llm8_g6,0,
2026-03-03T03:27:24.765196+00:00,BUCKET,llm_style,eval,llm_style_eval_207,32,6144,1536,bf16,NVIDIA GeForce RTX 4060,c11,32,128,32,4,2,8,0.0,0.0,148.47999811172485,161.21056139469147,4.067751775869037,1,-1,-1,llm8_g1,0,
2026-03-03T03:27:24.782751+00:00,BUCKET,llm_style,eval,llm_style_eval_208,4,2048,1024,bf16,NVIDIA GeForce RTX 4060,c00,32,32,32,2,2,8,0.0,0.0,79.8719972372055,205.25535836815823,0.21005128931701406,7,-1,-1,llm8_g7,0,
2026-03-03T03:27:24.794932+00:00,BUCKET,llm_style,eval,llm_style_eval_209,1,1024,1536,bf16,NVIDIA GeForce RTX 4060,c00,32,32,32,2,2,8,0.0,0.0,89.08800035715103,109.18911971151826,0.03531034468602813,7,-1,-1,llm8_g7,0,
2026-03-03T03:27:24.930221+00:00,BUCKET,llm_style,eval,llm_style_eval_210,8,6144,4096,bf16,NVIDIA GeForce RTX 4060,c11,32,128,32,4,2,8,0.0,0.0,376.8320083618164,460.70783525705303,1.068521715420181,5,-1,-1,llm8_g5,0,
2026-03-03T03:27:25.051058+00:00,BUCKET,llm_style,eval,llm_style_eval_211,4,2048,8192,bf16,NVIDIA GeForce RTX 4060,c04,64,64,64,4,3,8,0.0,0.0,668.5760021209717,727.9820728302,0.20075163866817158,6,-1,-1,llm8_g6,0,
2026-03-03T03:27:25.066134+00:00,BUCKET,llm_style,eval,llm_style_eval_212,32,1024,1024,bf16,NVIDIA GeForce RTX 4060,c11,32,128,32,4,2,8,0.0,0.0,99.72799941897392,185.88671952486038,0.6729189835450774,3,-1,-1,llm8_g3,0,
2026-03-03T03:27:25.136725+00:00,BUCKET,llm_style,eval,llm_style_eval_213,16,3072,4096,bf16,NVIDIA GeForce RTX 4060,c00,32,32,32,2,2,8,0.0,0.0,230.23999482393265,277.6473569869995,1.7488411789963503,7,-1,-1,llm8_g7,0,
2026-03-03T03:27:25.198722+00:00,BUCKET,llm_style,eval,llm_style_eval_214,64,1024,8192,bf16,NVIDIA GeForce RTX 4060,c04,64,64,64,4,3,8,0.0,0.0,389.1200125217438,419.81343626976013,2.7594104375189388,2,-1,-1,llm8_g2,0,
2026-03-03T03:27:25.229451+00:00,BUCKET,llm_style,eval,llm_style_eval_215,4,4096,1536,bf16,NVIDIA GeForce RTX 4060,c00,32,32,32,2,2,8,0.0,0.0,132.09599256515503,353.04448336362793,0.3810232772593341,7,-1,-1,llm8_g7,0,
2026-03-03T03:27:25.255086+00:00,BUCKET,llm_style,eval,llm_style_eval_216,16,1536,3072,bf16,NVIDIA GeForce RTX 4060,c00,32,32,32,2,2,8,0.0,0.0,155.13599663972855,208.39423969388008,0.9733069517750591,7,-1,-1,llm8_g7,0,
2026-03-03T03:27:25.320091+00:00,BUCKET,llm_style,eval,llm_style_eval_217,8,6144,2048,bf16,NVIDIA GeForce RTX 4060,c11,32,128,32,4,2,8,0.0,0.0,187.391996383667,239.9151983857153,1.074360676470959,5,-1,-1,llm8_g5,0,
2026-03-03T03:27:25.387187+00:00,BUCKET,llm_style,eval,llm_style_eval_218,8,3072,4096,bf16,NVIDIA GeForce RTX 4060,c00,32,32,32,2,2,8,0.0,0.0,213.96800130605698,313.4982439875601,0.9409191597393347,7,-1,-1,llm8_g7,0,
2026-03-03T03:27:25.551844+00:00,BUCKET,llm_style,eval,llm_style_eval_219,64,8192,3072,bf16,NVIDIA GeForce RTX 4060,c11,32,128,32,4,2,8,0.0,0.0,883.6320042610168,1004.6054601669312,3.645437757422466,1,-1,-1,llm8_g1,0,
2026-03-03T03:27:25.596949+00:00,BUCKET,llm_style,eval,llm_style_eval_220,2,4096,2048,bf16,NVIDIA GeForce RTX 4060,c00,32,32,32,2,2,8,0.0,0.0,189.26399946212769,291.6659179329871,0.17728903592526243,7,-1,-1,llm8_g7,0,
2026-03-03T03:27:25.664514+00:00,BUCKET,llm_style,eval,llm_style_eval_221,4,1024,8192,bf16,NVIDIA GeForce RTX 4060,c04,64,64,64,4,3,8,0.0,0.0,443.29600036144257,487.657908797264,0.15138612562550216,6,-1,-1,llm8_g6,0,
2026-03-03T03:27:25.744913+00:00,BUCKET,llm_style,eval,llm_style_eval_222,64,6144,2048,bf16,NVIDIA GeForce RTX 4060,c11,32,128,32,4,2,8,0.0,0.0,410.6239974498749,511.63423359394073,3.9223541390724703,1,-1,-1,llm8_g1,0,
2026-03-03T03:27:25.768335+00:00,BUCKET,llm_style,eval,llm_style_eval_223,4,2048,2048,bf16,NVIDIA GeForce RTX 4060,c00,32,32,32,2,2,8,0.0,0.0,133.12000036239624,234.6896001696586,0.2520615377753444,7,-1,-1,llm8_g7,0,
2026-03-03T03:27:25.791691+00:00,BUCKET,llm_style,eval,llm_style_eval_224,16,3072,1536,bf16,NVIDIA GeForce RTX 4060,c00,32,32,32,2,2,8,0.0,0.0,116.72000214457512,199.61183980107296,1.2936509700622716,7,-1,-1,llm8_g7,0,
2026-03-03T03:27:25.816412+00:00,BUCKET,llm_style,eval,llm_style_eval_225,1,2048,2048,bf16,NVIDIA GeForce RTX 4060,c00,32,32,32,2,2,8,0.0,0.0,141.80800318717957,372.10111096501305,0.05915468669936386,7,-1,-1,llm8_g7,0,
2026-03-03T03:27:25.830202+00:00,BUCKET,llm_style,eval,llm_style_eval_226,8,1536,1024,bf16,NVIDIA GeForce RTX 4060,c00,32,32,32,2,2,8,0.0,0.0,109.05599966645241,162.51519858837122,0.2307605640860625,7,-1,-1,llm8_g7,0,
2026-03-03T03:27:26.056925+00:00,BUCKET,llm_style,eval,llm_style_eval_227,64,6144,6144,bf16,NVIDIA GeForce RTX 4060,c06,64,128,32,4,3,8,0.0,0.0,1087.9519581794739,1202.227163314819,4.441223871764857,0,-1,-1,llm8_g0,0,
2026-03-03T03:27:26.139299+00:00,BUCKET,llm_style,eval,llm_style_eval_228,64,6144,2048,bf16,NVIDIA GeForce RTX 4060,c11,32,128,32,4,2,8,0.0,0.0,424.9279946088791,518.5331162810324,3.7903191986267535,1,-1,-1,llm8_g1,0,
2026-03-03T03:27:26.221333+00:00,BUCKET,llm_style,eval,llm_style_eval_229,16,1536,8192,bf16,NVIDIA GeForce RTX 4060,c04,64,64,64,4,3,8,0.0,0.0,459.77601408958435,465.92000126838684,0.8757594386416724,6,-1,-1,llm8_g6,0,
2026-03-03T03:27:26.243135+00:00,BUCKET,llm_style,eval,llm_style_eval_230,64,2048,1536,bf16,NVIDIA GeForce RTX 4060,c11,32,128,32,4,2,8,0.0,0.0,153.50399911403656,164.1715183854103,2.6230794397797617,3,-1,-1,llm8_g3,0,
2026-03-03T03:27:26.305115+00:00,BUCKET,llm_style,eval,llm_style_eval_231,4,1024,8192,bf16,NVIDIA GeForce RTX 4060,c04,64,64,64,4,3,8,0.0,0.0,413.5359972715378,484.2086547613143,0.16228058607419052,6,-1,-1,llm8_g6,0,
2026-03-03T03:27:26.329667+00:00,BUCKET,llm_style,eval,llm_style_eval_232,16,3072,1536,bf16,NVIDIA GeForce RTX 4060,c00,32,32,32,2,2,8,0.0,0.0,114.911999553442,264.6425674855708,1.3140050176376659,7,-1,-1,llm8_g7,0,
2026-03-03T03:27:26.392562+00:00,BUCKET,llm_style,eval,llm_style_eval_233,64,3072,3072,bf16,NVIDIA GeForce RTX 4060,c11,32,128,32,4,2,8,0.0,0.0,275.4560112953186,285.11584639549255,4.385308370362398,3,-1,-1,llm8_g3,0,
2026-03-03T03:27:26.572701+00:00,BUCKET,llm_style,eval,llm_style_eval_234,32,8192,4096,bf16,NVIDIA GeForce RTX 4060,c11,32,128,32,4,2,8,0.0,0.0,575.4879713058472,596.4371085166931,3.731587374671129,1,-1,-1,llm8_g1,0,
2026-03-03T03:27:26.586822+00:00,BUCKET,llm_style,eval,llm_style_eval_235,4,2048,1024,bf16,NVIDIA GeForce RTX 4060,c00,32,32,32,2,2,8,0.0,0.0,77.82399654388428,87.58271984755993,0.21557895694214924,7,-1,-1,llm8_g7,0,
2026-03-03T03:27:26.727589+00:00,BUCKET,llm_style,eval,llm_style_eval_236,4,8192,3072,bf16,NVIDIA GeForce RTX 4060,c11,32,128,32,4,2,8,0.0,0.0,451.58401131629944,556.9331216812132,0.4458231180797639,5,-1,-1,llm8_g5,0,
2026-03-03T03:27:26.767758+00:00,BUCKET,llm_style,eval,llm_style_eval_237,64,1024,4096,bf16,NVIDIA GeForce RTX 4060,c11,32,128,32,4,2,8,0.0,0.0,318.4640109539032,432.6707211136818,1.6858134468378299,3,-1,-1,llm8_g3,0,
2026-03-03T03:27:26.868229+00:00,BUCKET,llm_style,eval,llm_style_eval_238,32,2048,6144,bf16,NVIDIA GeForce RTX 4060,c04,64,64,64,4,3,8,0.0,0.0,551.9359707832336,662.31296479702,1.4590575911499606,2,-1,-1,llm8_g2,0,
2026-03-03T03:27:26.903477+00:00,BUCKET,llm_style,eval,llm_style_eval_239,32,2048,6144,bf16,NVIDIA GeForce RTX 4060,c04,64,64,64,4,3,8,0.0,0.0,549.8720109462738,651.8192046880722,1.4645342042671887,2,-1,-1,llm8_g2,0,
2026-03-03T03:27:26.981306+00:00,BUCKET,llm_style,eval,llm_style_eval_240,8,8192,1536,bf16,NVIDIA GeForce RTX 4060,c11,32,128,32,4,2,8,0.0,0.0,254.86400723457336,290.23039311170567,0.7899373245540385,5,-1,-1,llm8_g5,0,
2026-03-03T03:27:26.997194+00:00,BUCKET,llm_style,eval,llm_style_eval_241,16,1536,1536,bf16,NVIDIA GeForce RTX 4060,c00,32,32,32,2,2,8,0.0,0.0,105.47199845314026,120.72192266583443,0.7158058357407769,7,-1,-1,llm8_g7,0,
2026-03-03T03:27:27.030025+00:00,BUCKET,llm_style,eval,llm_style_eval_242,1,2048,3072,bf16,NVIDIA GeForce RTX 4060,c00,32,32,32,2,2,8,0.0,0.0,155.64799308776855,208.51327940821642,0.08084210885330595,7,-1,-1,llm8_g7,0,
2026-03-03T03:27:27.083243+00:00,BUCKET,llm_style,eval,llm_style_eval_243,8,1536,6144,bf16,NVIDIA GeForce RTX 4060,c04,64,64,64,4,3,8,0.0,0.0,283.53600203990936,349.47071164846415,0.5325424034819627,6,-1,-1,llm8_g6,0,
2026-03-03T03:27:27.137538+00:00,BUCKET,llm_style,eval,llm_style_eval_244,32,8192,1024,bf16,NVIDIA GeForce RTX 4060,c11,32,128,32,4,2,8,0.0,0.0,162.1919944882393,328.72447967529297,3.310095012358511,1,-1,-1,llm8_g1,0,
2026-03-03T03:27:27.269723+00:00,BUCKET,llm_style,eval,llm_style_eval_245,4,6144,4096,bf16,NVIDIA GeForce RTX 4060,c11,32,128,32,4,2,8,0.0,0.0,370.6879913806915,410.63232421875,0.5431160347280857,5,-1,-1,llm8_g5,0,
2026-03-03T03:27:27.358025+00:00,BUCKET,llm_style,eval,llm_style_eval_246,32,2048,6144,bf16,NVIDIA GeForce RTX 4060,c04,64,64,64,4,3,8,0.0,0.0,483.3120107650757,552.9599785804749,1.6662246128028393,2,-1,-1,llm8_g2,0,
2026-03-03T03:27:27.441268+00:00,BUCKET,llm_style,eval,llm_style_eval_247,64,6144,2048,bf16,NVIDIA GeForce RTX 4060,c11,32,128,32,4,2,8,0.0,0.0,344.89600360393524,432.8585717082023,4.669850387276632,1,-1,-1,llm8_g1,0,
2026-03-03T03:27:27.455785+00:00,BUCKET,llm_style,eval,llm_style_eval_248,64,1024,1024,bf16,NVIDIA GeForce RTX 4060,c11,32,128,32,4,2,8,0.0,0.0,116.2240020930767,212.35232308506966,1.154819362462783,3,-1,-1,llm8_g3,0,
2026-03-03T03:27:27.504673+00:00,BUCKET,llm_style,eval,llm_style_eval_249,2,8192,1024,bf16,NVIDIA GeForce RTX 4060,c11,32,128,32,4,2,8,0.0,0.0,161.79199516773224,201.97984367609016,0.20739241125751373,5,-1,-1,llm8_g5,0,
2026-03-03T03:27:27.565888+00:00,BUCKET,llm_style,eval,llm_style_eval_250,64,3072,3072,bf16,NVIDIA GeForce RTX 4060,c11,32,128,32,4,2,8,0.0,0.0,242.68800020217896,407.6566460728643,4.977417717372392,3,-1,-1,llm8_g3,0,
2026-03-03T03:27:27.629712+00:00,BUCKET,llm_style,eval,llm_style_eval_251,64,1024,8192,bf16,NVIDIA GeForce RTX 4060,c04,64,64,64,4,3,8,0.0,0.0,366.4959967136383,485.95968425273895,2.9297504846661893,2,-1,-1,llm8_g2,0,
2026-03-03T03:27:27.715460+00:00,BUCKET,llm_style,eval,llm_style_eval_252,64,4096,3072,bf16,NVIDIA GeForce RTX 4060,c11,32,128,32,4,2,8,0.0,0.0,404.4800102710724,529.9507021903992,3.981934076100838,3,-1,-1,llm8_g3,0,
2026-03-03T03:27:27.858593+00:00,BUCKET,llm_style,eval,llm_style_eval_253,8,6144,4096,bf16,NVIDIA GeForce RTX 4060,c11,32,128,32,4,2,8,0.0,0.0,372.73600697517395,475.29825419187523,1.0802637160482826,5,-1,-1,llm8_g5,0,
2026-03-03T03:27:27.885425+00:00,BUCKET,llm_style,eval,llm_style_eval_254,4,1536,3072,bf16,NVIDIA GeForce RTX 4060,c00,32,32,32,2,2,8,0.0,0.0,130.0479993224144,162.2041580080986,0.2902677180478072,7,-1,-1,llm8_g7,0,
2026-03-03T03:27:27.911233+00:00,BUCKET,llm_style,eval,llm_style_eval_255,1,3072,1536,bf16,NVIDIA GeForce RTX 4060,c00,32,32,32,2,2,8,0.0,0.0,96.25600278377533,213.17088074982132,0.09804255035604603,7,-1,-1,llm8_g7,0,
