results/llm_hp2_m32_n4096_k4096.csv
timestamp,method,workload,split,shape_id,M,N,K,dtype,gpu,config_id,BLOCK_M,BLOCK_N,BLOCK_K,num_warps,num_stages,GROUP_M,compile_time_ms,tune_time_ms,runtime_cost_us,p99_us,runtime_perf_tflops,bucket_m,bucket_n,bucket_k,cache_key,invalid_config,notes
2026-03-03T03:37:55.272347+00:00,FULL,llm_style,tune,llm_style_tune_000,32,3072,2048,bf16,NVIDIA GeForce RTX 4060,c11,32,128,32,4,2,8,0.7434709696099162,537.175,55.18399924039841,68.20864073932168,7.2965567835328375,7,-1,-1,32x3072x2048,0,
2026-03-03T03:37:55.409537+00:00,FULL,llm_style,tune,llm_style_tune_001,4,4096,1536,bf16,NVIDIA GeForce RTX 4060,c00,32,32,32,2,2,8,0.0,137.153,51.632000133395195,367.41760030388787,0.9748149959320647,7,-1,-1,4x4096x1536,0,
2026-03-03T03:37:55.542697+00:00,FULL,llm_style,tune,llm_style_tune_002,8,8192,1024,bf16,NVIDIA GeForce RTX 4060,c00,32,32,32,2,2,8,0.0,133.126,55.296000093221664,171.3568011671302,2.4272592551672245,5,-1,-1,8x8192x1024,0,
2026-03-03T03:37:55.650870+00:00,FULL,llm_style,tune,llm_style_tune_003,64,1024,4096,bf16,NVIDIA GeForce RTX 4060,c04,64,64,64,4,3,8,0.0,108.131,61.43999844789505,78.8182397186756,8.738133554077153,3,-1,-1,64x1024x4096,0,
2026-03-03T03:37:55.807541+00:00,FULL,llm_style,tune,llm_style_tune_004,16,3072,4096,bf16,NVIDIA GeForce RTX 4060,c00,32,32,32,2,2,8,0.0,156.63,81.87199756503105,91.93151876330373,4.9180818347588495,7,-1,-1,16x3072x4096,0,
2026-03-03T03:37:55.944760+00:00,FULL,llm_style,tune,llm_style_tune_005,16,1536,4096,bf16,NVIDIA GeForce RTX 4060,c00,32,32,32,2,2,8,0.0,137.176,71.10400125384331,206.9094429910183,2.8314382939049847,7,-1,-1,16x1536x4096,0,
2026-03-03T03:37:55.999317+00:00,FULL,llm_style,tune,llm_style_tune_006,2,2048,1024,bf16,NVIDIA GeForce RTX 4060,c00,32,32,32,2,2,8,0.0,54.518,23.423999547958374,125.0144043564796,0.3581202254903197,7,-1,-1,2x2048x1024,0,
2026-03-03T03:37:56.078378+00:00,FULL,llm_style,tune,llm_style_tune_007,32,6144,1024,bf16,NVIDIA GeForce RTX 4060,c11,32,128,32,4,2,8,0.0,79.02,40.73600098490715,84.10112034529435,9.88445537766912,5,-1,-1,32x6144x1024,0,
2026-03-03T03:37:56.154296+00:00,FULL,llm_style,tune,llm_style_tune_008,8,1536,2048,bf16,NVIDIA GeForce RTX 4060,c04,64,64,64,4,3,8,0.0,75.873,45.69600149989128,81.35615918785324,1.1014453419982435,7,-1,-1,8x1536x2048,0,
2026-03-03T03:37:56.269625+00:00,FULL,llm_style,tune,llm_style_tune_009,16,1024,6144,bf16,NVIDIA GeForce RTX 4060,c04,64,64,64,4,3,8,0.0,115.282,70.54400071501732,78.8684768974781,2.8539151445821225,6,-1,-1,16x1024x6144,0,
2026-03-03T03:37:56.346859+00:00,FULL,llm_style,tune,llm_style_tune_010,64,1536,2048,bf16,NVIDIA GeForce RTX 4060,c04,64,64,64,4,3,8,0.0,77.192,47.968000173568726,63.02720081061124,8.39420410571691,3,-1,-1,64x1536x2048,0,
2026-03-03T03:37:56.442704+00:00,FULL,llm_style,tune,llm_style_tune_011,64,1536,4096,bf16,NVIDIA GeForce RTX 4060,c04,64,64,64,4,3,8,0.0,95.801,57.34400078654289,61.3788815587759,14.043428378805825,3,-1,-1,64x1536x4096,0,
2026-03-03T03:37:56.517443+00:00,FULL,llm_style,tune,llm_style_tune_012,32,1024,2048,bf16,NVIDIA GeForce RTX 4060,c00,32,32,32,2,2,8,0.0,74.698,42.368000373244286,52.244479060173035,3.167903295354942,7,-1,-1,32x1024x2048,0,
2026-03-03T03:37:56.572941+00:00,FULL,llm_style,tune,llm_style_tune_013,64,1536,1024,bf16,NVIDIA GeForce RTX 4060,c00,32,32,32,2,2,8,0.0,55.457,34.81600061058998,108.86400185525406,5.782588133881251,3,-1,-1,64x1536x1024,0,
2026-03-03T03:37:56.809825+00:00,FULL,llm_style,tune,llm_style_tune_014,4,6144,3072,bf16,NVIDIA GeForce RTX 4060,c02,32,64,32,2,2,8,0.0,236.841,178.17600071430206,184.70111444592476,0.847448272464675,5,-1,-1,4x6144x3072,0,
2026-03-03T03:37:56.933862+00:00,FULL,llm_style,tune,llm_style_tune_015,1,6144,1024,bf16,NVIDIA GeForce RTX 4060,c00,32,32,32,2,2,8,0.0,123.996,55.64800091087818,369.24575507640805,0.22611615501070528,5,-1,-1,1x6144x1024,0,
2026-03-03T03:37:57.352829+00:00,FULL,llm_style,tune,llm_style_tune_016,4,8192,4096,bf16,NVIDIA GeForce RTX 4060,c00,32,32,32,2,2,8,0.0,418.931,304.1279911994934,322.99647986888885,0.8826397561805457,5,-1,-1,4x8192x4096,0,
2026-03-03T03:37:57.376858+00:00,FULL,llm_style,tune,llm_style_tune_017,64,1536,2048,bf16,NVIDIA GeForce RTX 4060,c04,64,64,64,4,3,8,0.0,0.0,47.968000173568726,64.8905585706234,8.39420410571691,3,-1,-1,64x1536x2048,0,
2026-03-03T03:37:57.561250+00:00,FULL,llm_style,tune,llm_style_tune_018,64,8192,1536,bf16,NVIDIA GeForce RTX 4060,c06,64,128,32,4,3,8,0.0,184.345,107.4879989027977,137.43519768118853,14.984116854352184,1,-1,-1,64x8192x1536,0,
2026-03-03T03:37:57.625525+00:00,FULL,llm_style,tune,llm_style_tune_019,2,1536,1024,bf16,NVIDIA GeForce RTX 4060,c04,64,64,64,4,3,8,0.0,64.235,38.91199827194214,103.20160150527938,0.1616842177066119,7,-1,-1,2x1536x1024,0,
2026-03-03T03:37:57.681389+00:00,FULL,llm_style,tune,llm_style_tune_020,16,1024,1536,bf16,NVIDIA GeForce RTX 4060,c00,32,32,32,2,2,8,0.0,55.826,37.647999823093414,116.92384175956244,1.3369009837576122,7,-1,-1,16x1024x1536,0,
2026-03-03T03:37:57.792670+00:00,FULL,llm_style,tune,llm_style_tune_021,1,6144,1536,bf16,NVIDIA GeForce RTX 4060,c11,32,128,32,4,2,8,0.0,111.242,45.88799923658371,51.71007864177226,0.41131381437420816,5,-1,-1,1x6144x1536,0,
2026-03-03T03:37:58.035904+00:00,FULL,llm_style,tune,llm_style_tune_022,8,4096,4096,bf16,NVIDIA GeForce RTX 4060,c09,128,64,64,8,3,8,0.0,243.116,181.15199357271194,254.4080020487308,1.4818244652231976,7,-1,-1,8x4096x4096,0,
2026-03-03T03:37:58.440613+00:00,FULL,llm_style,tune,llm_style_tune_023,2,4096,8192,bf16,NVIDIA GeForce RTX 4060,c00,32,32,32,2,2,8,0.0,404.648,292.86399483680725,356.8828880786896,0.4582937143734251,6,-1,-1,2x4096x8192,0,
2026-03-03T03:37:58.462960+00:00,FULL,llm_style,tune,llm_style_tune_024,64,1536,2048,bf16,NVIDIA GeForce RTX 4060,c04,64,64,64,4,3,8,0.0,0.0,48.06400090456009,112.69408009946343,8.377437924893975,3,-1,-1,64x1536x2048,0,
2026-03-03T03:37:58.488097+00:00,FULL,llm_style,tune,llm_style_tune_025,4,4096,1536,bf16,NVIDIA GeForce RTX 4060,c00,32,32,32,2,2,8,0.0,0.0,43.007999658584595,152.66655489802355,1.1702857235759294,7,-1,-1,4x4096x1536,0,
2026-03-03T03:37:58.571446+00:00,FULL,llm_style,tune,llm_style_tune_026,4,3072,2048,bf16,NVIDIA GeForce RTX 4060,c11,32,128,32,4,2,8,0.0,83.3,52.15999856591225,76.17280252277851,0.9649472657940769,7,-1,-1,4x3072x2048,0,
2026-03-03T03:37:58.669722+00:00,FULL,llm_style,tune,llm_style_tune_027,8,4096,1024,bf16,NVIDIA GeForce RTX 4060,c00,32,32,32,2,2,8,0.0,98.235,43.007999658584595,136.11167982220638,1.560380964767906,7,-1,-1,8x4096x1024,0,
2026-03-03T03:37:58.738176+00:00,FULL,llm_style,tune,llm_style_tune_028,16,1536,1024,bf16,NVIDIA GeForce RTX 4060,c11,32,128,32,4,2,8,0.0,68.414,38.91199827194214,51.278080083429785,1.2934737416528952,7,-1,-1,16x1536x1024,0,
2026-03-03T03:37:59.151641+00:00,FULL,llm_style,tune,llm_style_tune_029,64,4096,8192,bf16,NVIDIA GeForce RTX 4060,c03,64,64,32,4,2,8,0.0,413.415,299.9200075864792,319.95743572711945,14.32037605814472,2,-1,-1,64x4096x8192,0,
2026-03-03T03:37:59.305277+00:00,FULL,llm_style,tune,llm_style_tune_030,1,8192,1536,bf16,NVIDIA GeForce RTX 4060,c11,32,128,32,4,2,8,0.0,153.589,60.416001826524734,76.32735885679719,0.4165423602882527,5,-1,-1,1x8192x1536,0,
2026-03-03T03:37:59.909015+00:00,FULL,llm_style,tune,llm_style_tune_031,1,8192,6144,bf16,NVIDIA GeForce RTX 4060,c11,32,128,32,4,2,8,0.0,603.697,426.4959990978241,520.6201380491257,0.23602401010310806,4,-1,-1,1x8192x6144,0,
2026-03-03T03:38:00.221021+00:00,FULL,llm_style,tune,llm_style_tune_032,32,3072,8192,bf16,NVIDIA GeForce RTX 4060,c04,64,64,64,4,3,8,0.0,311.962,231.4240038394928,240.0646424293518,6.959575105774515,6,-1,-1,32x3072x8192,0,
2026-03-03T03:38:00.349765+00:00,FULL,llm_style,tune,llm_style_tune_033,4,1536,6144,bf16,NVIDIA GeForce RTX 4060,c04,64,64,64,4,3,8,0.0,128.699,71.04000076651573,89.97599937021732,1.0627459344790051,6,-1,-1,4x1536x6144,0,
2026-03-03T03:38:00.448526+00:00,FULL,llm_style,tune,llm_style_tune_034,1,4096,1536,bf16,NVIDIA GeForce RTX 4060,c11,32,128,32,4,2,8,0.0,98.716,45.05600035190582,69.45663973689079,0.27927272509149287,7,-1,-1,1x4096x1536,0,
2026-03-03T03:38:00.541269+00:00,FULL,llm_style,tune,llm_style_tune_035,4,1536,4096,bf16,NVIDIA GeForce RTX 4060,c04,64,64,64,4,3,8,0.0,92.702,55.296000093221664,67.72736240178344,0.9102222206877092,7,-1,-1,4x1536x4096,0,
2026-03-03T03:38:00.852012+00:00,FULL,llm_style,tune,llm_style_tune_036,32,8192,3072,bf16,NVIDIA GeForce RTX 4060,c02,32,64,32,2,2,8,0.0,310.7,231.392003595829,337.9139074683188,6.960537576800827,5,-1,-1,32x8192x3072,0,
2026-03-03T03:38:00.884024+00:00,FULL,llm_style,tune,llm_style_tune_037,32,3072,2048,bf16,NVIDIA GeForce RTX 4060,c11,32,128,32,4,2,8,0.0,0.0,72.60800153017044,148.59679773449886,5.545575907810759,7,-1,-1,32x3072x2048,0,
2026-03-03T03:38:01.012390+00:00,FULL,llm_style,tune,llm_style_tune_038,2,2048,4096,bf16,NVIDIA GeForce RTX 4060,c11,32,128,32,4,2,8,0.0,128.317,73.72800260782242,88.45952242612837,0.45511109501344243,7,-1,-1,2x2048x4096,0,
2026-03-03T03:38:01.119534+00:00,FULL,llm_style,tune,llm_style_tune_039,64,2048,1536,bf16,NVIDIA GeForce RTX 4060,c00,32,32,32,2,2,8,0.0,107.102,70.14400139451027,108.93312327563754,5.740379447921161,3,-1,-1,64x2048x1536,0,
2026-03-03T03:38:01.241004+00:00,FULL,llm_style,tune,llm_style_tune_040,64,1024,6144,bf16,NVIDIA GeForce RTX 4060,c04,64,64,64,4,3,8,0.0,121.423,70.65600156784058,77.42848053574562,11.397564964481928,2,-1,-1,64x1024x6144,0,
2026-03-03T03:38:01.826228+00:00,FULL,llm_style,tune,llm_style_tune_041,4,8192,6144,bf16,NVIDIA GeForce RTX 4060,c11,32,128,32,4,2,8,0.0,585.176,427.93600261211395,535.0441431999205,0.9409191597393347,4,-1,-1,4x8192x6144,0,
2026-03-03T03:38:01.942876+00:00,FULL,llm_style,tune,llm_style_tune_042,1,1024,6144,bf16,NVIDIA GeForce RTX 4060,c04,64,64,64,4,3,8,0.0,116.603,71.55200093984604,76.80000364780426,0.1758568849888417,6,-1,-1,1x1024x6144,0,
2026-03-03T03:38:02.170120+00:00,FULL,llm_style,tune,llm_style_tune_043,64,2048,8192,bf16,NVIDIA GeForce RTX 4060,c04,64,64,64,4,3,8,0.0,227.195,167.87199676036835,185.50783574581143,12.7923875896077,2,-1,-1,64x2048x8192,0,
2026-03-03T03:38:02.236056+00:00,FULL,llm_style,tune,llm_style_tune_044,16,2048,1024,bf16,NVIDIA GeForce RTX 4060,c00,32,32,32,2,2,8,0.0,65.89,38.39999996125698,165.9712015092372,1.7476266684299044,7,-1,-1,16x2048x1024,0,
2026-03-03T03:38:02.291005+00:00,FULL,llm_style,tune,llm_style_tune_045,4,1024,1536,bf16,NVIDIA GeForce RTX 4060,c00,32,32,32,2,2,8,0.0,54.909,36.22400015592575,131.69535927474493,0.34736395610194937,7,-1,-1,4x1024x1536,0,
2026-03-03T03:38:02.316244+00:00,FULL,llm_style,tune,llm_style_tune_046,64,1536,4096,bf16,NVIDIA GeForce RTX 4060,c04,64,64,64,4,3,8,0.0,0.0,54.27199974656105,166.66047975420946,14.838339691933468,3,-1,-1,64x1536x4096,0,
2026-03-03T03:38:02.379143+00:00,FULL,llm_style,tune,llm_style_tune_047,16,2048,1536,bf16,NVIDIA GeForce RTX 4060,c00,32,32,32,2,2,8,0.0,62.847,30.7200001552701,112.46751956641674,3.276799983437856,7,-1,-1,16x2048x1536,0,
2026-03-03T03:38:02.810582+00:00,FULL,llm_style,tune,llm_style_tune_048,64,6144,6144,bf16,NVIDIA GeForce RTX 4060,c01,64,32,32,2,2,8,0.0,431.395,334.84798669815063,407.39295870065666,14.429945527358568,0,-1,-1,64x6144x6144,0,
2026-03-03T03:38:03.203039+00:00,FULL,llm_style,tune,llm_style_tune_049,4,4096,8192,bf16,NVIDIA GeForce RTX 4060,c00,32,32,32,2,2,8,0.0,392.415,292.86399483680725,381.0025617480277,0.9165874287468502,6,-1,-1,4x4096x8192,0,
2026-03-03T03:38:03.349062+00:00,FULL,llm_style,tune,llm_style_tune_050,1,4096,3072,bf16,NVIDIA GeForce RTX 4060,c11,32,128,32,4,2,8,0.0,145.982,67.58400052785873,84.21376235783094,0.3723636334553238,7,-1,-1,1x4096x3072,0,
2026-03-03T03:38:03.458938+00:00,FULL,llm_style,tune,llm_style_tune_051,2,4096,2048,bf16,NVIDIA GeForce RTX 4060,c11,32,128,32,4,2,8,0.0,109.832,52.09599994122982,58.83711870759724,0.6440884528150567,7,-1,-1,2x4096x2048,0,
2026-03-03T03:38:03.658127+00:00,FULL,llm_style,tune,llm_style_tune_052,4,8192,1536,bf16,NVIDIA GeForce RTX 4060,c11,32,128,32,4,2,8,0.0,199.147,59.39200147986412,77.22048260271548,1.6948965094925827,5,-1,-1,4x8192x1536,0,
2026-03-03T03:38:03.760707+00:00,FULL,llm_style,tune,llm_style_tune_053,1,1536,4096,bf16,NVIDIA GeForce RTX 4060,c04,64,64,64,4,3,8,0.0,102.536,58.36800113320351,66.43775895237923,0.21557894318299728,7,-1,-1,1x1536x4096,0,
2026-03-03T03:38:04.349941+00:00,FULL,llm_style,tune,llm_style_tune_054,8,8192,6144,bf16,NVIDIA GeForce RTX 4060,c10,64,128,64,8,3,8,0.0,589.192,428.0320107936859,527.1801656484602,1.881416220498898,4,-1,-1,8x8192x6144,0,
2026-03-03T03:38:04.475460+00:00,FULL,llm_style,tune,llm_style_tune_055,64,6144,1536,bf16,NVIDIA GeForce RTX 4060,c11,32,128,32,4,2,8,0.0,125.473,66.56000018119812,72.81856298446655,18.1484307198248,1,-1,-1,64x6144x1536,0,
2026-03-03T03:38:04.561013+00:00,FULL,llm_style,tune,llm_style_tune_056,1,3072,1536,bf16,NVIDIA GeForce RTX 4060,c00,32,32,32,2,2,8,0.0,85.507,19.967999309301376,71.1459209024906,0.47261540096328164,7,-1,-1,1x3072x1536,0,
2026-03-03T03:38:04.613974+00:00,FULL,llm_style,tune,llm_style_tune_057,64,1024,1024,bf16,NVIDIA GeForce RTX 4060,c04,64,64,64,4,3,8,0.0,52.917,37.88800165057182,47.193919532001004,3.5424863321598363,3,-1,-1,64x1024x1024,0,
2026-03-03T03:38:05.001050+00:00,FULL,llm_style,tune,llm_style_tune_058,16,8192,4096,bf16,NVIDIA GeForce RTX 4060,c02,32,64,32,2,2,8,0.0,387.034,296.7359870672226,309.64480340480804,3.6185089466642766,5,-1,-1,16x8192x4096,0,
2026-03-03T03:38:05.316270+00:00,FULL,llm_style,tune,llm_style_tune_059,16,4096,6144,bf16,NVIDIA GeForce RTX 4060,c02,32,64,32,2,2,8,0.0,315.175,229.16799783706665,242.309123724699,3.514043739093776,6,-1,-1,16x4096x6144,0,
2026-03-03T03:38:05.635954+00:00,FULL,llm_style,tune,llm_style_tune_060,2,3072,8192,bf16,NVIDIA GeForce RTX 4060,c10,64,128,64,8,3,8,0.0,319.638,229.12000119686127,370.9667325019835,0.4393474837384865,6,-1,-1,2x3072x8192,0,
2026-03-03T03:38:05.842244+00:00,FULL,llm_style,tune,llm_style_tune_061,64,4096,8192,bf16,NVIDIA GeForce RTX 4060,c03,64,64,32,4,2,8,0.0,0.0,300.4159927368164,367.1308723092079,14.296733196100732,2,-1,-1,64x4096x8192,0,
2026-03-03T03:38:05.997968+00:00,FULL,llm_style,tune,llm_style_tune_062,32,4096,3072,bf16,NVIDIA GeForce RTX 4060,c11,32,128,32,4,2,8,0.0,155.67,79.58400249481201,130.41663929820052,10.118947813067042,7,-1,-1,32x4096x3072,0,
2026-03-03T03:38:06.122929+00:00,FULL,llm_style,tune,llm_style_tune_063,2,3072,8192,bf16,NVIDIA GeForce RTX 4060,c10,64,128,64,8,3,8,0.0,0.0,229.37600314617157,296.0527917742729,0.438857136837682,6,-1,-1,2x3072x8192,0,
2026-03-03T03:38:06.177091+00:00,FULL,llm_style,eval,llm_style_eval_000,32,1536,1024,bf16,NVIDIA GeForce RTX 4060,c04,64,64,64,4,3,8,0.0,54.101,35.840000957250595,58.10335882008074,2.808685639268526,7,-1,-1,32x1536x1024,0,
2026-03-03T03:38:06.399465+00:00,FULL,llm_style,eval,llm_style_eval_001,32,2048,8192,bf16,NVIDIA GeForce RTX 4060,c06,64,128,32,4,3,8,0.0,222.327,164.86400365829468,172.06463888287544,6.512894265418245,6,-1,-1,32x2048x8192,0,
2026-03-03T03:38:06.525689+00:00,FULL,llm_style,eval,llm_style_eval_002,16,2048,4096,bf16,NVIDIA GeForce RTX 4060,c11,32,128,32,4,2,8,0.0,126.174,74.67200234532356,109.5987159013747,3.5948608255957812,7,-1,-1,16x2048x4096,0,
2026-03-03T03:38:06.547181+00:00,FULL,llm_style,eval,llm_style_eval_003,16,2048,1536,bf16,NVIDIA GeForce RTX 4060,c00,32,32,32,2,2,8,0.0,0.0,40.95999896526337,110.04799954593182,2.4576000620842,7,-1,-1,16x2048x1536,0,
2026-03-03T03:38:06.768717+00:00,FULL,llm_style,eval,llm_style_eval_004,64,8192,2048,bf16,NVIDIA GeForce RTX 4060,c10,64,128,64,8,3,8,0.0,221.484,166.6879951953888,212.54367709159848,12.883253202984154,1,-1,-1,64x8192x2048,0,
2026-03-03T03:38:07.074745+00:00,FULL,llm_style,eval,llm_style_eval_005,64,3072,8192,bf16,NVIDIA GeForce RTX 4060,c10,64,128,64,8,3,8,0.0,305.985,232.464000582695,292.00864404439915,13.85687875940217,2,-1,-1,64x3072x8192,0,
2026-03-03T03:38:07.167734+00:00,FULL,llm_style,eval,llm_style_eval_006,32,2048,2048,bf16,NVIDIA GeForce RTX 4060,c11,32,128,32,4,2,8,0.0,92.943,53.61600033938885,81.73536002635956,5.0066296310953025,7,-1,-1,32x2048x2048,0,
2026-03-03T03:38:07.383106+00:00,FULL,llm_style,eval,llm_style_eval_007,8,8192,2048,bf16,NVIDIA GeForce RTX 4060,c11,32,128,32,4,2,8,0.0,215.32,162.73599863052368,181.19519710540771,1.6495149091717358,5,-1,-1,8x8192x2048,0,
2026-03-03T03:38:07.572880+00:00,FULL,llm_style,eval,llm_style_eval_008,64,1536,8192,bf16,NVIDIA GeForce RTX 4060,c04,64,64,64,4,3,8,0.0,189.728,119.80800330638885,127.8736013174057,13.443281680282478,2,-1,-1,64x1536x8192,0,
2026-03-03T03:38:07.925369+00:00,FULL,llm_style,eval,llm_style_eval_009,64,4096,6144,bf16,NVIDIA GeForce RTX 4060,c06,64,128,32,4,3,8,0.0,352.443,234.23999547958374,261.7855954170227,13.751816658828277,2,-1,-1,64x4096x6144,0,
2026-03-03T03:38:08.055822+00:00,FULL,llm_style,eval,llm_style_eval_010,64,2048,4096,bf16,NVIDIA GeForce RTX 4060,c00,32,32,32,2,2,8,0.0,130.407,64.20799717307091,156.9996809959411,16.722867419548347,3,-1,-1,64x2048x4096,0,
2026-03-03T03:38:08.301214+00:00,FULL,llm_style,eval,llm_style_eval_011,32,3072,6144,bf16,NVIDIA GeForce RTX 4060,c08,128,128,64,8,4,8,0.0,245.344,179.08799648284912,196.18815556168556,6.745061510114575,6,-1,-1,32x3072x6144,0,
2026-03-03T03:38:08.391507+00:00,FULL,llm_style,eval,llm_style_eval_012,16,1536,1536,bf16,NVIDIA GeForce RTX 4060,c04,64,64,64,4,3,8,0.0,90.247,61.43999844789505,171.46879769861658,1.2288000310421,7,-1,-1,16x1536x1536,0,
2026-03-03T03:38:08.493870+00:00,FULL,llm_style,eval,llm_style_eval_013,64,2048,3072,bf16,NVIDIA GeForce RTX 4060,c06,64,128,32,4,3,8,0.0,102.31,64.51199948787689,70.696961581707,12.483047718143245,3,-1,-1,64x2048x3072,0,
2026-03-03T03:38:09.064007+00:00,FULL,llm_style,eval,llm_style_eval_014,16,8192,6144,bf16,NVIDIA GeForce RTX 4060,c02,32,64,32,2,2,8,0.0,570.089,429.05598878860474,464.80384439229954,3.7538521267291913,4,-1,-1,16x8192x6144,0,
2026-03-03T03:38:09.112656+00:00,FULL,llm_style,eval,llm_style_eval_015,64,6144,1536,bf16,NVIDIA GeForce RTX 4060,c11,32,128,32,4,2,8,0.0,0.0,94.19200196862221,130.77856466174114,12.824438665210687,1,-1,-1,64x6144x1536,0,
2026-03-03T03:38:09.330440+00:00,FULL,llm_style,eval,llm_style_eval_016,16,4096,4096,bf16,NVIDIA GeForce RTX 4060,c02,32,64,32,2,2,8,0.0,217.697,160.76800227165222,175.50080254673958,3.3394139655529265,7,-1,-1,16x4096x4096,0,
2026-03-03T03:38:09.742743+00:00,FULL,llm_style,eval,llm_style_eval_017,64,8192,4096,bf16,NVIDIA GeForce RTX 4060,c10,64,128,64,8,3,8,0.0,412.25,303.1040132045746,392.04863846302015,14.169945328639345,1,-1,-1,64x8192x4096,0,
2026-03-03T03:38:10.075813+00:00,FULL,llm_style,eval,llm_style_eval_018,32,4096,6144,bf16,NVIDIA GeForce RTX 4060,c02,32,64,32,2,2,8,0.0,333.025,230.3999960422516,364.4943916797638,6.990506786747687,6,-1,-1,32x4096x6144,0,
2026-03-03T03:38:10.377545+00:00,FULL,llm_style,eval,llm_style_eval_019,16,3072,8192,bf16,NVIDIA GeForce RTX 4060,c10,64,128,64,8,3,8,0.0,301.678,228.35199534893036,258.57375770807266,3.526600968690735,6,-1,-1,16x3072x8192,0,
2026-03-03T03:38:10.450176+00:00,FULL,llm_style,eval,llm_style_eval_020,4,1536,1536,bf16,NVIDIA GeForce RTX 4060,c00,32,32,32,2,2,8,0.0,72.588,43.775999918580055,113.6697579920291,0.43115789553876216,7,-1,-1,4x1536x1536,0,
2026-03-03T03:38:10.557884+00:00,FULL,llm_style,eval,llm_style_eval_021,4,6144,1536,bf16,NVIDIA GeForce RTX 4060,c02,32,64,32,2,2,8,0.0,107.664,46.94399982690811,74.48384065181011,1.6082454047029278,5,-1,-1,4x6144x1536,0,
2026-03-03T03:38:10.587672+00:00,FULL,llm_style,eval,llm_style_eval_022,32,6144,1024,bf16,NVIDIA GeForce RTX 4060,c11,32,128,32,4,2,8,0.0,0.0,50.176000222563744,213.06368127465237,8.024816290935245,5,-1,-1,32x6144x1024,0,
2026-03-03T03:38:10.599023+00:00,FULL,llm_style,eval,llm_style_eval_023,16,1024,1536,bf16,NVIDIA GeForce RTX 4060,c00,32,32,32,2,2,8,0.0,0.0,41.95199906826019,96.89120158553118,1.199743733739726,7,-1,-1,16x1024x1536,0,
2026-03-03T03:38:10.695980+00:00,FULL,llm_style,eval,llm_style_eval_024,32,8192,1024,bf16,NVIDIA GeForce RTX 4060,c11,32,128,32,4,2,8,0.0,96.916,49.15200173854828,63.12960084527728,10.92266628032262,5,-1,-1,32x8192x1024,0,
2026-03-03T03:38:11.129298+00:00,FULL,llm_style,eval,llm_style_eval_025,32,6144,6144,bf16,NVIDIA GeForce RTX 4060,c02,32,64,32,2,2,8,0.0,433.269,329.72800731658936,419.1155186295508,7.327006048595527,4,-1,-1,32x6144x6144,0,
2026-03-03T03:38:11.268898+00:00,FULL,llm_style,eval,llm_style_eval_026,1,6144,2048,bf16,NVIDIA GeForce RTX 4060,c11,32,128,32,4,2,8,0.0,139.556,55.296000093221664,64.5324794948101,0.4551111103438546,5,-1,-1,1x6144x2048,0,
2026-03-03T03:38:11.334838+00:00,FULL,llm_style,eval,llm_style_eval_027,32,4096,3072,bf16,NVIDIA GeForce RTX 4060,c11,32,128,32,4,2,8,0.0,0.0,81.91999793052673,162.4307176470756,9.8304002483368,7,-1,-1,32x4096x3072,0,
2026-03-03T03:38:11.394437+00:00,FULL,llm_style,eval,llm_style_eval_028,64,1536,1536,bf16,NVIDIA GeForce RTX 4060,c04,64,64,64,4,3,8,0.0,59.541,39.64800015091896,45.446721054613576,7.616774789408905,3,-1,-1,64x1536x1536,0,
2026-03-03T03:38:11.463766+00:00,FULL,llm_style,eval,llm_style_eval_029,2,3072,1024,bf16,NVIDIA GeForce RTX 4060,c11,32,128,32,4,2,8,0.0,69.286,39.93599861860275,47.82879859209059,0.31507693397552106,7,-1,-1,2x3072x1024,0,
2026-03-03T03:38:11.644615+00:00,FULL,llm_style,eval,llm_style_eval_030,32,1536,8192,bf16,NVIDIA GeForce RTX 4060,c04,64,64,64,4,3,8,0.0,180.807,96.25600278377533,101.31551645696163,8.366297630382595,6,-1,-1,32x1536x8192,0,
2026-03-03T03:38:11.752385+00:00,FULL,llm_style,eval,llm_style_eval_031,8,3072,2048,bf16,NVIDIA GeForce RTX 4060,c02,32,64,32,2,2,8,0.0,107.728,54.9280010163784,84.06784128397693,1.832640805005525,7,-1,-1,8x3072x2048,0,
2026-03-03T03:38:11.842194+00:00,FULL,llm_style,eval,llm_style_eval_032,8,2048,3072,bf16,NVIDIA GeForce RTX 4060,c00,32,32,32,2,2,8,0.0,89.767,51.19999870657921,273.05311620235386,1.9660800496673596,7,-1,-1,8x2048x3072,0,
2026-03-03T03:38:11.913286+00:00,FULL,llm_style,eval,llm_style_eval_033,64,1536,8192,bf16,NVIDIA GeForce RTX 4060,c04,64,64,64,4,3,8,0.0,0.0,117.76000261306763,164.71392288804046,13.677077957378314,2,-1,-1,64x1536x8192,0,
2026-03-03T03:38:12.063120+00:00,FULL,llm_style,eval,llm_style_eval_034,64,6144,2048,bf16,NVIDIA GeForce RTX 4060,c10,64,128,64,8,3,8,0.0,149.776,94.2080020904541,107.51999914646149,17.096347446722895,1,-1,-1,64x6144x2048,0,
2026-03-03T03:38:12.171750+00:00,FULL,llm_style,eval,llm_style_eval_035,4,4096,2048,bf16,NVIDIA GeForce RTX 4060,c11,32,128,32,4,2,8,0.0,108.587,53.247999399900436,61.864319778978825,1.2603077065112325,7,-1,-1,4x4096x2048,0,
2026-03-03T03:38:12.349620+00:00,FULL,llm_style,eval,llm_style_eval_036,64,8192,4096,bf16,NVIDIA GeForce RTX 4060,c10,64,128,64,8,3,8,0.0,0.0,327.67999172210693,382.44159907102585,13.107200331115731,1,-1,-1,64x8192x4096,0,
2026-03-03T03:38:12.383848+00:00,FULL,llm_style,eval,llm_style_eval_037,32,6144,1024,bf16,NVIDIA GeForce RTX 4060,c11,32,128,32,4,2,8,0.0,0.0,64.51199948787689,150.03104597330093,6.241523859071623,5,-1,-1,32x6144x1024,0,
2026-03-03T03:38:12.451226+00:00,FULL,llm_style,eval,llm_style_eval_038,64,6144,2048,bf16,NVIDIA GeForce RTX 4060,c10,64,128,64,8,3,8,0.0,0.0,97.21600264310837,104.27552044391632,16.56736228821044,1,-1,-1,64x6144x2048,0,
2026-03-03T03:38:12.526284+00:00,FULL,llm_style,eval,llm_style_eval_039,8,1024,3072,bf16,NVIDIA GeForce RTX 4060,c04,64,64,64,4,3,8,0.0,75.009,50.143999978899956,59.75744046270847,1.0037421829367223,7,-1,-1,8x1024x3072,0,
2026-03-03T03:38:12.738605+00:00,FULL,llm_style,eval,llm_style_eval_040,32,8192,2048,bf16,NVIDIA GeForce RTX 4060,c11,32,128,32,4,2,8,0.0,212.274,162.83199936151505,193.5769584774971,6.59416962396997,5,-1,-1,32x8192x2048,0,
2026-03-03T03:38:12.804054+00:00,FULL,llm_style,eval,llm_style_eval_041,32,3072,1024,bf16,NVIDIA GeForce RTX 4060,c11,32,128,32,4,2,8,0.0,65.407,40.95999896526337,50.624961405992494,4.9152001241684,7,-1,-1,32x3072x1024,0,
2026-03-03T03:38:12.823045+00:00,FULL,llm_style,eval,llm_style_eval_042,64,1024,4096,bf16,NVIDIA GeForce RTX 4060,c04,64,64,64,4,3,8,0.0,0.0,55.215999484062195,114.47552025318129,9.723104118670621,3,-1,-1,64x1024x4096,0,
2026-03-03T03:38:12.830850+00:00,FULL,llm_style,eval,llm_style_eval_043,2,1536,1024,bf16,NVIDIA GeForce RTX 4060,c04,64,64,64,4,3,8,0.0,0.0,34.81600061058998,47.12448105216026,0.18070587918378908,7,-1,-1,2x1536x1024,0,
2026-03-03T03:38:13.065246+00:00,FULL,llm_style,eval,llm_style_eval_044,64,6144,3072,bf16,NVIDIA GeForce RTX 4060,c03,64,64,32,4,2,8,0.0,234.365,183.29599499702454,204.84575852751732,13.180424940758897,1,-1,-1,64x6144x3072,0,
2026-03-03T03:38:13.210591+00:00,FULL,llm_style,eval,llm_style_eval_045,64,1536,6144,bf16,NVIDIA GeForce RTX 4060,c04,64,64,64,4,3,8,0.0,145.301,71.68000191450119,78.68031911551952,16.85211383561116,2,-1,-1,64x1536x6144,0,
2026-03-03T03:38:13.458882+00:00,FULL,llm_style,eval,llm_style_eval_046,2,6144,3072,bf16,NVIDIA GeForce RTX 4060,c10,64,128,64,8,3,8,0.0,248.248,176.12800002098083,191.6108778119087,0.4286511627396356,5,-1,-1,2x6144x3072,0,
2026-03-03T03:38:13.886164+00:00,FULL,llm_style,eval,llm_style_eval_047,16,4096,8192,bf16,NVIDIA GeForce RTX 4060,c04,64,64,64,4,3,8,0.0,427.241,297.9840040206909,499.5507350564002,3.6033539032700674,6,-1,-1,16x4096x8192,0,
2026-03-03T03:38:13.927228+00:00,FULL,llm_style,eval,llm_style_eval_048,16,1024,6144,bf16,NVIDIA GeForce RTX 4060,c04,64,64,64,4,3,8,0.0,0.0,68.60800087451935,85.91103836894035,2.9344477237897726,6,-1,-1,16x1024x6144,0,
2026-03-03T03:38:14.075060+00:00,FULL,llm_style,eval,llm_style_eval_049,16,8192,1536,bf16,NVIDIA GeForce RTX 4060,c11,32,128,32,4,2,8,0.0,147.78,62.463998794555664,80.95776066184041,6.4461640588257545,5,-1,-1,16x8192x1536,0,
2026-03-03T03:38:14.128869+00:00,FULL,llm_style,eval,llm_style_eval_050,1,1024,1024,bf16,NVIDIA GeForce RTX 4060,c04,64,64,64,4,3,8,0.0,53.762,35.74400022625923,42.50016096979378,0.05867144098939807,7,-1,-1,1x1024x1024,0,
2026-03-03T03:38:14.207066+00:00,FULL,llm_style,eval,llm_style_eval_051,16,6144,1024,bf16,NVIDIA GeForce RTX 4060,c11,32,128,32,4,2,8,0.0,78.158,41.87200032174587,52.22399905323982,4.8081436390189065,5,-1,-1,16x6144x1024,0,
2026-03-03T03:38:14.997262+00:00,FULL,llm_style,eval,llm_style_eval_052,16,8192,8192,bf16,NVIDIA GeForce RTX 4060,c11,32,128,32,4,2,8,0.0,790.153,562.9599988460541,1166.2835049629196,3.8146291963938395,4,-1,-1,16x8192x8192,0,
2026-03-03T03:38:15.539265+00:00,FULL,llm_style,eval,llm_style_eval_053,1,6144,8192,bf16,NVIDIA GeForce RTX 4060,c03,64,64,32,4,2,8,0.0,541.962,425.27998983860016,501.71838492155064,0.23669887698737757,4,-1,-1,1x6144x8192,0,
2026-03-03T03:38:15.706726+00:00,FULL,llm_style,eval,llm_style_eval_054,64,4096,3072,bf16,NVIDIA GeForce RTX 4060,c04,64,64,64,4,3,8,0.0,167.419,87.0399996638298,144.86528024077396,18.504282424409332,3,-1,-1,64x4096x3072,0,
2026-03-03T03:38:15.808043+00:00,FULL,llm_style,eval,llm_style_eval_055,4,8192,1024,bf16,NVIDIA GeForce RTX 4060,c11,32,128,32,4,2,8,0.0,101.276,49.15200173854828,52.08159979432821,1.3653332850403275,5,-1,-1,4x8192x1024,0,
2026-03-03T03:38:15.896770+00:00,FULL,llm_style,eval,llm_style_eval_056,64,1024,3072,bf16,NVIDIA GeForce RTX 4060,c04,64,64,64,4,3,8,0.0,88.685,49.15200173854828,65.72032172232863,8.191999710241964,3,-1,-1,64x1024x3072,0,
2026-03-03T03:38:15.901067+00:00,FULL,llm_style,eval,llm_style_eval_057,64,1024,3072,bf16,NVIDIA GeForce RTX 4060,c04,64,64,64,4,3,8,0.0,0.0,53.07199992239475,64.07168116420506,7.586923134398272,3,-1,-1,64x1024x3072,0,
2026-03-03T03:38:16.025977+00:00,FULL,llm_style,eval,llm_style_eval_058,32,2048,4096,bf16,NVIDIA GeForce RTX 4060,c00,32,32,32,2,2,8,0.0,124.881,60.72000041604042,153.4723225235939,8.841747502000588,7,-1,-1,32x2048x4096,0,
2026-03-03T03:38:16.124178+00:00,FULL,llm_style,eval,llm_style_eval_059,64,8192,2048,bf16,NVIDIA GeForce RTX 4060,c10,64,128,64,8,3,8,0.0,0.0,166.9280007481575,210.85888668894756,12.86472993371487,1,-1,-1,64x8192x2048,0,
2026-03-03T03:38:16.349565+00:00,FULL,llm_style,eval,llm_style_eval_060,1,3072,6144,bf16,NVIDIA GeForce RTX 4060,c10,64,128,64,8,3,8,0.0,225.335,176.12800002098083,192.9036809504032,0.2143255813698178,6,-1,-1,1x3072x6144,0,
2026-03-03T03:38:16.389170+00:00,FULL,llm_style,eval,llm_style_eval_061,64,1536,4096,bf16,NVIDIA GeForce RTX 4060,c04,64,64,64,4,3,8,0.0,0.0,61.375999823212624,217.25439727306338,13.120867608179154,3,-1,-1,64x1536x4096,0,
2026-03-03T03:38:16.522436+00:00,FULL,llm_style,eval,llm_style_eval_062,16,6144,2048,bf16,NVIDIA GeForce RTX 4060,c11,32,128,32,4,2,8,0.0,133.207,62.44799867272377,72.0707207918167,6.447815663560601,5,-1,-1,16x6144x2048,0,
2026-03-03T03:38:16.571073+00:00,FULL,llm_style,eval,llm_style_eval_063,64,1536,6144,bf16,NVIDIA GeForce RTX 4060,c04,64,64,64,4,3,8,0.0,0.0,72.7040022611618,166.72992378473276,16.61476004664584,2,-1,-1,64x1536x6144,0,
2026-03-03T03:38:16.630856+00:00,FULL,llm_style,eval,llm_style_eval_064,1,6144,2048,bf16,NVIDIA GeForce RTX 4060,c11,32,128,32,4,2,8,0.0,0.0,55.984001606702805,112.4342393130064,0.44951813514143235,5,-1,-1,1x6144x2048,0,
2026-03-03T03:38:16.764704+00:00,FULL,llm_style,eval,llm_style_eval_065,8,1536,6144,bf16,NVIDIA GeForce RTX 4060,c04,64,64,64,4,3,8,0.0,133.795,71.68000191450119,78.58592204749583,2.106514229451395,6,-1,-1,8x1536x6144,0,
2026-03-03T03:38:16.801230+00:00,FULL,llm_style,eval,llm_style_eval_066,64,1536,4096,bf16,NVIDIA GeForce RTX 4060,c04,64,64,64,4,3,8,0.0,0.0,58.88000130653381,135.4956848174333,13.677077957378314,3,-1,-1,64x1536x4096,0,
2026-03-03T03:38:16.886908+00:00,FULL,llm_style,eval,llm_style_eval_067,64,8192,2048,bf16,NVIDIA GeForce RTX 4060,c10,64,128,64,8,3,8,0.0,0.0,166.78399592638016,183.83455529808998,12.875837613028034,1,-1,-1,64x8192x2048,0,
2026-03-03T03:38:16.910109+00:00,FULL,llm_style,eval,llm_style_eval_068,64,1024,4096,bf16,NVIDIA GeForce RTX 4060,c04,64,64,64,4,3,8,0.0,0.0,63.48799914121628,145.4080045223236,8.456258178901475,3,-1,-1,64x1024x4096,0,
2026-03-03T03:38:16.950371+00:00,FULL,llm_style,eval,llm_style_eval_069,64,2048,4096,bf16,NVIDIA GeForce RTX 4060,c00,32,32,32,2,2,8,0.0,0.0,87.0399996638298,173.68063539266586,12.336188282939554,3,-1,-1,64x2048x4096,0,
2026-03-03T03:38:17.065711+00:00,FULL,llm_style,eval,llm_style_eval_070,64,8192,1024,bf16,NVIDIA GeForce RTX 4060,c06,64,128,32,4,3,8,0.0,115.291,65.18399715423584,74.31167900562285,16.472475927785677,1,-1,-1,64x8192x1024,0,
2026-03-03T03:38:17.134129+00:00,FULL,llm_style,eval,llm_style_eval_071,64,6144,2048,bf16,NVIDIA GeForce RTX 4060,c10,64,128,64,8,3,8,0.0,0.0,98.30400347709656,201.09471932053543,16.383999420483928,1,-1,-1,64x6144x2048,0,
2026-03-03T03:38:17.146014+00:00,FULL,llm_style,eval,llm_style_eval_072,64,1536,1024,bf16,NVIDIA GeForce RTX 4060,c00,32,32,32,2,2,8,0.0,0.0,36.83200106024742,92.49120078980914,5.46607803552902,3,-1,-1,64x1536x1024,0,
2026-03-03T03:38:17.171299+00:00,FULL,llm_style,eval,llm_style_eval_073,1,4096,1536,bf16,NVIDIA GeForce RTX 4060,c11,32,128,32,4,2,8,0.0,0.0,44.335998594760895,86.27135902643198,0.2838080205435341,7,-1,-1,1x4096x1536,0,
2026-03-03T03:38:17.231719+00:00,FULL,llm_style,eval,llm_style_eval_074,8,1024,2048,bf16,NVIDIA GeForce RTX 4060,c04,64,64,64,4,3,8,0.0,60.371,41.6640006005764,48.528640344738946,0.8053578992972602,7,-1,-1,8x1024x2048,0,
2026-03-03T03:38:17.308676+00:00,FULL,llm_style,eval,llm_style_eval_075,2,6144,1024,bf16,NVIDIA GeForce RTX 4060,c11,32,128,32,4,2,8,0.0,76.913,40.271999314427376,52.60351989418268,0.624896315763106,5,-1,-1,2x6144x1024,0,
2026-03-03T03:38:17.345114+00:00,FULL,llm_style,eval,llm_style_eval_076,64,1024,6144,bf16,NVIDIA GeForce RTX 4060,c04,64,64,64,4,3,8,0.0,0.0,78.87999713420868,221.05088397860519,10.2092596001218,2,-1,-1,64x1024x6144,0,
2026-03-03T03:38:17.743216+00:00,FULL,llm_style,eval,llm_style_eval_077,1,4096,8192,bf16,NVIDIA GeForce RTX 4060,c11,32,128,32,4,2,8,0.0,398.05,292.86399483680725,393.75872284173965,0.22914685718671254,6,-1,-1,1x4096x8192,0,
2026-03-03T03:38:17.845953+00:00,FULL,llm_style,eval,llm_style_eval_078,64,6144,3072,bf16,NVIDIA GeForce RTX 4060,c03,64,64,32,4,2,8,0.0,0.0,187.391996383667,298.28256160020806,12.892328117651509,1,-1,-1,64x6144x3072,0,
2026-03-03T03:38:17.983052+00:00,FULL,llm_style,eval,llm_style_eval_079,2,3072,4096,bf16,NVIDIA GeForce RTX 4060,c00,32,32,32,2,2,8,0.0,137.047,69.96800005435944,190.96704006195066,0.7193523891049681,7,-1,-1,2x3072x4096,0,
2026-03-03T03:38:18.043163+00:00,FULL,llm_style,eval,llm_style_eval_080,4,1536,1024,bf16,NVIDIA GeForce RTX 4060,c04,64,64,64,4,3,8,0.0,60.069,37.88800165057182,44.349760450422764,0.3321080936399846,7,-1,-1,4x1536x1024,0,
2026-03-03T03:38:18.368911+00:00,FULL,llm_style,eval,llm_style_eval_081,4,4096,6144,bf16,NVIDIA GeForce RTX 4060,c11,32,128,32,4,2,8,0.0,325.707,227.32800245285034,240.7363153994083,0.8856216120658376,6,-1,-1,4x4096x6144,0,
2026-03-03T03:38:18.452107+00:00,FULL,llm_style,eval,llm_style_eval_082,64,6144,1024,bf16,NVIDIA GeForce RTX 4060,c06,64,128,32,4,3,8,0.0,83.147,52.22399905323982,77.32224002480507,15.420235573668524,1,-1,-1,64x6144x1024,0,
2026-03-03T03:38:18.539012+00:00,FULL,llm_style,eval,llm_style_eval_083,8,4096,4096,bf16,NVIDIA GeForce RTX 4060,c09,128,64,64,8,3,8,0.0,0.0,186.8000030517578,343.1951987743375,1.4370206189216332,7,-1,-1,8x4096x4096,0,
2026-03-03T03:38:18.684974+00:00,FULL,llm_style,eval,llm_style_eval_084,64,1024,8192,bf16,NVIDIA GeForce RTX 4060,c04,64,64,64,4,3,8,0.0,145.912,86.01599931716919,147.7536000311373,12.483047718143249,2,-1,-1,64x1024x8192,0,
2026-03-03T03:38:18.975425+00:00,FULL,llm_style,eval,llm_style_eval_085,1,3072,8192,bf16,NVIDIA GeForce RTX 4060,c04,64,64,64,4,3,8,0.0,290.406,227.66400128602982,259.7376096248626,0.22107864096074162,6,-1,-1,1x3072x8192,0,
2026-03-03T03:38:19.043710+00:00,FULL,llm_style,eval,llm_style_eval_086,8,1536,1024,bf16,NVIDIA GeForce RTX 4060,c04,64,64,64,4,3,8,0.0,68.243,40.95999896526337,66.56064081937072,0.61440001552105,7,-1,-1,8x1536x1024,0,
2026-03-03T03:38:19.125580+00:00,FULL,llm_style,eval,llm_style_eval_087,16,1024,3072,bf16,NVIDIA GeForce RTX 4060,c00,32,32,32,2,2,8,0.0,81.829,45.72799988090992,187.9577629268168,2.2013492009744327,7,-1,-1,16x1024x3072,0,
2026-03-03T03:38:19.210895+00:00,FULL,llm_style,eval,llm_style_eval_088,8,4096,1536,bf16,NVIDIA GeForce RTX 4060,c00,32,32,32,2,2,8,0.0,85.275,44.03200000524521,83.23072202503675,2.28613953461139,7,-1,-1,8x4096x1536,0,
2026-03-03T03:38:19.448381+00:00,FULL,llm_style,eval,llm_style_eval_089,16,6144,3072,bf16,NVIDIA GeForce RTX 4060,c06,64,128,32,4,3,8,0.0,237.442,177.90400236845016,249.71680209040633,3.3949757619793206,5,-1,-1,16x6144x3072,0,
2026-03-03T03:38:19.539972+00:00,FULL,llm_style,eval,llm_style_eval_090,32,1536,3072,bf16,NVIDIA GeForce RTX 4060,c04,64,64,64,4,3,8,0.0,91.551,52.000001072883606,58.23167994618416,5.807497726331364,7,-1,-1,32x1536x3072,0,
2026-03-03T03:38:19.626364+00:00,FULL,llm_style,eval,llm_style_eval_091,16,1024,4096,bf16,NVIDIA GeForce RTX 4060,c00,32,32,32,2,2,8,0.0,86.35,51.68000049889088,109.42463949322683,2.59709223499099,7,-1,-1,16x1024x4096,0,
2026-03-03T03:38:19.928470+00:00,FULL,llm_style,eval,llm_style_eval_092,1,4096,6144,bf16,NVIDIA GeForce RTX 4060,c11,32,128,32,4,2,8,0.0,302.064,226.30399465560913,239.49376538395882,0.2224072450713697,6,-1,-1,1x4096x6144,0,
2026-03-03T03:38:20.030727+00:00,FULL,llm_style,eval,llm_style_eval_093,32,2048,3072,bf16,NVIDIA GeForce RTX 4060,c00,32,32,32,2,2,8,0.0,102.217,56.32000043988228,66.56000018119812,7.149381762342217,7,-1,-1,32x2048x3072,0,
2026-03-03T03:38:20.055408+00:00,FULL,llm_style,eval,llm_style_eval_094,32,1024,2048,bf16,NVIDIA GeForce RTX 4060,c00,32,32,32,2,2,8,0.0,0.0,55.296000093221664,229.53919738531096,2.4272592551672245,7,-1,-1,32x1024x2048,0,
2026-03-03T03:38:20.188002+00:00,FULL,llm_style,eval,llm_style_eval_095,8,6144,2048,bf16,NVIDIA GeForce RTX 4060,c02,32,64,32,2,2,8,0.0,132.548,59.07199904322624,66.92735888063908,3.4081560682020973,5,-1,-1,8x6144x2048,0,
2026-03-03T03:38:20.223548+00:00,FULL,llm_style,eval,llm_style_eval_096,64,2048,3072,bf16,NVIDIA GeForce RTX 4060,c06,64,128,32,4,3,8,0.0,0.0,71.68000191450119,151.60480156540865,11.234742557074105,3,-1,-1,64x2048x3072,0,
2026-03-03T03:38:20.251548+00:00,FULL,llm_style,eval,llm_style_eval_097,64,6144,1024,bf16,NVIDIA GeForce RTX 4060,c06,64,128,32,4,3,8,0.0,0.0,61.952000483870506,222.1465602517126,12.998875931531305,1,-1,-1,64x6144x1024,0,
2026-03-03T03:38:20.276564+00:00,FULL,llm_style,eval,llm_style_eval_098,32,6144,1024,bf16,NVIDIA GeForce RTX 4060,c11,32,128,32,4,2,8,0.0,0.0,41.42399877309799,150.8643250912425,9.72028765753767,5,-1,-1,32x6144x1024,0,
2026-03-03T03:38:20.345419+00:00,FULL,llm_style,eval,llm_style_eval_099,1,2048,2048,bf16,NVIDIA GeForce RTX 4060,c00,32,32,32,2,2,8,0.0,68.802,43.007999658584595,56.80480003356932,0.19504762059598826,7,-1,-1,1x2048x2048,0,
2026-03-03T03:38:20.384096+00:00,FULL,llm_style,eval,llm_style_eval_100,64,8192,1024,bf16,NVIDIA GeForce RTX 4060,c06,64,128,32,4,3,8,0.0,0.0,68.51200014352798,188.36480021476734,15.672317575761676,1,-1,-1,64x8192x1024,0,
2026-03-03T03:38:20.448458+00:00,FULL,llm_style,eval,llm_style_eval_101,64,8192,1536,bf16,NVIDIA GeForce RTX 4060,c06,64,128,32,4,3,8,0.0,0.0,112.64000087976456,154.6137562394141,14.298763524684434,1,-1,-1,64x8192x1536,0,
2026-03-03T03:38:20.477345+00:00,FULL,llm_style,eval,llm_style_eval_102,32,3072,2048,bf16,NVIDIA GeForce RTX 4060,c11,32,128,32,4,2,8,0.0,0.0,55.10399863123894,116.82815834879862,7.3071500072906215,7,-1,-1,32x3072x2048,0,
2026-03-03T03:38:20.507552+00:00,FULL,llm_style,eval,llm_style_eval_103,64,2048,3072,bf16,NVIDIA GeForce RTX 4060,c06,64,128,32,4,3,8,0.0,0.0,88.78399804234505,174.64671880006787,9.07039991165878,3,-1,-1,64x2048x3072,0,
2026-03-03T03:38:20.570333+00:00,FULL,llm_style,eval,llm_style_eval_104,16,6144,2048,bf16,NVIDIA GeForce RTX 4060,c11,32,128,32,4,2,8,0.0,0.0,63.27999755740166,118.28224278986454,6.3630404478879905,5,-1,-1,16x6144x2048,0,
2026-03-03T03:38:20.708489+00:00,FULL,llm_style,eval,llm_style_eval_105,1,1024,8192,bf16,NVIDIA GeForce RTX 4060,c00,32,32,32,2,2,8,0.0,138.103,82.30399712920189,122.64928035438055,0.20384448611484696,6,-1,-1,1x1024x8192,0,
2026-03-03T03:38:21.128620+00:00,FULL,llm_style,eval,llm_style_eval_106,32,4096,8192,bf16,NVIDIA GeForce RTX 4060,c11,32,128,32,4,2,8,0.0,420.089,294.2560017108917,368.3036801218985,7.2980113761958725,6,-1,-1,32x4096x8192,0,
2026-03-03T03:38:21.189389+00:00,FULL,llm_style,eval,llm_style_eval_107,64,6144,1536,bf16,NVIDIA GeForce RTX 4060,c11,32,128,32,4,2,8,0.0,0.0,68.60800087451935,151.61343917250633,17.606686342738634,1,-1,-1,64x6144x1536,0,
2026-03-03T03:38:21.257051+00:00,FULL,llm_style,eval,llm_style_eval_108,8,3072,1536,bf16,NVIDIA GeForce RTX 4060,c00,32,32,32,2,2,8,0.0,67.608,39.93599861860275,125.54496049880977,1.8904616038531266,7,-1,-1,8x3072x1536,0,
2026-03-03T03:38:21.268427+00:00,FULL,llm_style,eval,llm_style_eval_109,16,2048,1024,bf16,NVIDIA GeForce RTX 4060,c00,32,32,32,2,2,8,0.0,0.0,34.81600061058998,123.68864141404624,1.9275293779604168,7,-1,-1,16x2048x1024,0,
2026-03-03T03:38:22.032818+00:00,FULL,llm_style,eval,llm_style_eval_110,1,8192,8192,bf16,NVIDIA GeForce RTX 4060,c11,32,128,32,4,2,8,0.0,764.343,555.4879903793335,641.0390466451643,0.24162129573376548,4,-1,-1,1x8192x8192,0,
2026-03-03T03:38:22.144757+00:00,FULL,llm_style,eval,llm_style_eval_111,8,6144,1536,bf16,NVIDIA GeForce RTX 4060,c11,32,128,32,4,2,8,0.0,111.896,47.10400104522705,54.62656032294034,3.2055651462605423,5,-1,-1,8x6144x1536,0,
2026-03-03T03:38:22.241906+00:00,FULL,llm_style,eval,llm_style_eval_112,2,6144,3072,bf16,NVIDIA GeForce RTX 4060,c10,64,128,64,8,3,8,0.0,0.0,180.2240014076233,365.72928085923144,0.4189090876372393,5,-1,-1,2x6144x3072,0,
2026-03-03T03:38:22.614555+00:00,FULL,llm_style,eval,llm_style_eval_113,1,8192,8192,bf16,NVIDIA GeForce RTX 4060,c11,32,128,32,4,2,8,0.0,0.0,557.0079982280731,685.393260717392,0.24096194027189366,4,-1,-1,1x8192x8192,0,
2026-03-03T03:38:22.671317+00:00,FULL,llm_style,eval,llm_style_eval_114,1,3072,1024,bf16,NVIDIA GeForce RTX 4060,c00,32,32,32,2,2,8,0.0,56.704,35.840000957250595,110.04319965839386,0.1755428524542829,7,-1,-1,1x3072x1024,0,
2026-03-03T03:38:22.739869+00:00,FULL,llm_style,eval,llm_style_eval_115,16,3072,1536,bf16,NVIDIA GeForce RTX 4060,c02,32,64,32,2,2,8,0.0,68.505,45.05600035190582,70.67648157477379,3.351272701097914,7,-1,-1,16x3072x1536,0,
2026-03-03T03:38:22.800572+00:00,FULL,llm_style,eval,llm_style_eval_116,8,3072,1024,bf16,NVIDIA GeForce RTX 4060,c00,32,32,32,2,2,8,0.0,60.661,37.88800165057182,87.51391902565953,1.3284323745599385,7,-1,-1,8x3072x1024,0,
2026-03-03T03:38:22.888940+00:00,FULL,llm_style,eval,llm_style_eval_117,4,1024,4096,bf16,NVIDIA GeForce RTX 4060,c04,64,64,64,4,3,8,0.0,88.327,56.32000043988228,73.75712178647515,0.5957818135285181,7,-1,-1,4x1024x4096,0,
2026-03-03T03:38:22.988478+00:00,FULL,llm_style,eval,llm_style_eval_118,64,6144,3072,bf16,NVIDIA GeForce RTX 4060,c03,64,64,32,4,2,8,0.0,0.0,186.36800348758698,266.36416107416153,12.963164592579393,1,-1,-1,64x6144x3072,0,
2026-03-03T03:38:23.563146+00:00,FULL,llm_style,eval,llm_style_eval_119,64,8192,6144,bf16,NVIDIA GeForce RTX 4060,c04,64,64,64,4,3,8,0.0,574.617,440.3199851512909,503.52127879858006,14.631293516660206,0,-1,-1,64x8192x6144,0,
2026-03-03T03:38:23.660380+00:00,FULL,llm_style,eval,llm_style_eval_120,8,1024,4096,bf16,NVIDIA GeForce RTX 4060,c04,64,64,64,4,3,8,0.0,97.191,60.36800146102905,66.32671810686588,1.1116628408399862,7,-1,-1,8x1024x4096,0,
2026-03-03T03:38:23.719357+00:00,FULL,llm_style,eval,llm_style_eval_121,4,1024,2048,bf16,NVIDIA GeForce RTX 4060,c00,32,32,32,2,2,8,0.0,58.935,39.792001247406006,198.50464291870546,0.42162282554446,7,-1,-1,4x1024x2048,0,
2026-03-03T03:38:24.010898+00:00,FULL,llm_style,eval,llm_style_eval_122,4,6144,4096,bf16,NVIDIA GeForce RTX 4060,c11,32,128,32,4,2,8,0.0,291.498,227.32800245285034,356.1369574069976,0.8856216120658376,5,-1,-1,4x6144x4096,0,
2026-03-03T03:38:24.300539+00:00,FULL,llm_style,eval,llm_style_eval_123,4,3072,8192,bf16,NVIDIA GeForce RTX 4060,c06,64,128,32,4,3,8,0.0,289.601,225.2800017595291,234.53695744276047,0.8936727202927771,6,-1,-1,4x3072x8192,0,
2026-03-03T03:38:24.330936+00:00,FULL,llm_style,eval,llm_style_eval_124,64,6144,1024,bf16,NVIDIA GeForce RTX 4060,c06,64,128,32,4,3,8,0.0,0.0,55.0720002502203,156.23168043792225,14.622791333909804,1,-1,-1,64x6144x1024,0,
2026-03-03T03:38:24.398101+00:00,FULL,llm_style,eval,llm_style_eval_125,64,1536,8192,bf16,NVIDIA GeForce RTX 4060,c04,64,64,64,4,3,8,0.0,0.0,118.78400295972824,190.00320106744766,13.559172075940662,2,-1,-1,64x1536x8192,0,
2026-03-03T03:38:24.485265+00:00,FULL,llm_style,eval,llm_style_eval_126,64,2048,8192,bf16,NVIDIA GeForce RTX 4060,c04,64,64,64,4,3,8,0.0,0.0,167.93599724769592,216.16224244236946,12.787512404696566,2,-1,-1,64x2048x8192,0,
2026-03-03T03:38:24.622196+00:00,FULL,llm_style,eval,llm_style_eval_127,2,8192,1536,bf16,NVIDIA GeForce RTX 4060,c11,32,128,32,4,2,8,0.0,136.883,60.095999389886856,72.30463832616803,0.8375207752759324,5,-1,-1,2x8192x1536,0,
2026-03-03T03:38:24.692759+00:00,FULL,llm_style,eval,llm_style_eval_128,8,2048,2048,bf16,NVIDIA GeForce RTX 4060,c02,32,64,32,2,2,8,0.0,70.517,50.175998359918594,76.4124802872538,1.337469431472392,7,-1,-1,8x2048x2048,0,
2026-03-03T03:38:24.972579+00:00,FULL,llm_style,eval,llm_style_eval_129,64,8192,6144,bf16,NVIDIA GeForce RTX 4060,c04,64,64,64,4,3,8,0.0,0.0,465.92000126838684,562.4288022518156,13.827375786533178,0,-1,-1,64x8192x6144,0,
2026-03-03T03:38:24.997217+00:00,FULL,llm_style,eval,llm_style_eval_130,16,3072,1536,bf16,NVIDIA GeForce RTX 4060,c02,32,64,32,2,2,8,0.0,0.0,69.34399902820587,145.43200016021729,2.177476726408328,7,-1,-1,16x3072x1536,0,
2026-03-03T03:38:25.733744+00:00,FULL,llm_style,eval,llm_style_eval_131,32,8192,8192,bf16,NVIDIA GeForce RTX 4060,c11,32,128,32,4,2,8,0.0,736.478,560.9920024871826,587.718095779419,7.656022326446855,4,-1,-1,32x8192x8192,0,
2026-03-03T03:38:26.118000+00:00,FULL,llm_style,eval,llm_style_eval_132,32,8192,4096,bf16,NVIDIA GeForce RTX 4060,c11,32,128,32,4,2,8,0.0,384.2,294.9120104312897,454.59072321653366,7.281777520215079,5,-1,-1,32x8192x4096,0,
2026-03-03T03:38:26.857899+00:00,FULL,llm_style,eval,llm_style_eval_133,2,8192,8192,bf16,NVIDIA GeForce RTX 4060,c11,32,128,32,4,2,8,0.0,739.834,557.0560097694397,636.2316942214966,0.4818823444901042,4,-1,-1,2x8192x8192,0,
2026-03-03T03:38:26.971477+00:00,FULL,llm_style,eval,llm_style_eval_134,64,3072,3072,bf16,NVIDIA GeForce RTX 4060,c11,32,128,32,4,2,8,0.0,113.53,66.56000018119812,71.68000191450119,18.1484307198248,3,-1,-1,64x3072x3072,0,
2026-03-03T03:38:27.089274+00:00,FULL,llm_style,eval,llm_style_eval_135,8,3072,3072,bf16,NVIDIA GeForce RTX 4060,c00,32,32,32,2,2,8,0.0,117.756,57.66400136053562,197.73567989468552,2.618530459860503,7,-1,-1,8x3072x3072,0,
2026-03-03T03:38:27.213951+00:00,FULL,llm_style,eval,llm_style_eval_136,4,2048,4096,bf16,NVIDIA GeForce RTX 4060,c11,32,128,32,4,2,8,0.0,124.633,73.72800260782242,81.92479781806469,0.9102221900268849,7,-1,-1,4x2048x4096,0,
2026-03-03T03:38:27.951288+00:00,FULL,llm_style,eval,llm_style_eval_137,4,8192,8192,bf16,NVIDIA GeForce RTX 4060,c11,32,128,32,4,2,8,0.0,737.293,559.5680177211761,698.9823752641676,0.9594381647943186,4,-1,-1,4x8192x8192,0,
2026-03-03T03:38:28.022257+00:00,FULL,llm_style,eval,llm_style_eval_138,16,1024,1024,bf16,NVIDIA GeForce RTX 4060,c04,64,64,64,4,3,8,0.0,70.929,38.55999931693077,120.27904331684104,0.870187567282115,7,-1,-1,16x1024x1024,0,
2026-03-03T03:38:28.100656+00:00,FULL,llm_style,eval,llm_style_eval_139,4,1024,1024,bf16,NVIDIA GeForce RTX 4060,c04,64,64,64,4,3,8,0.0,78.361,57.28000029921532,105.70624157786354,0.14644916124616214,7,-1,-1,4x1024x1024,0,
2026-03-03T03:38:28.232381+00:00,FULL,llm_style,eval,llm_style_eval_140,64,4096,6144,bf16,NVIDIA GeForce RTX 4060,c06,64,128,32,4,3,8,0.0,0.0,236.25599592924118,287.93215513229353,13.634470775356572,2,-1,-1,64x4096x6144,0,
2026-03-03T03:38:28.358715+00:00,FULL,llm_style,eval,llm_style_eval_141,4,6144,4096,bf16,NVIDIA GeForce RTX 4060,c11,32,128,32,4,2,8,0.0,0.0,231.79200291633606,347.78111457824707,0.8685657376741664,5,-1,-1,4x6144x4096,0,
2026-03-03T03:38:28.523245+00:00,FULL,llm_style,eval,llm_style_eval_142,4,2048,6144,bf16,NVIDIA GeForce RTX 4060,c00,32,32,32,2,2,8,0.0,164.474,90.47999978065491,150.5187179148196,1.1125474828031812,6,-1,-1,4x2048x6144,0,
2026-03-03T03:38:28.600577+00:00,FULL,llm_style,eval,llm_style_eval_143,64,1536,8192,bf16,NVIDIA GeForce RTX 4060,c04,64,64,64,4,3,8,0.0,0.0,118.78400295972824,255.12288004159922,13.559172075940662,2,-1,-1,64x1536x8192,0,
2026-03-03T03:38:28.710581+00:00,FULL,llm_style,eval,llm_style_eval_144,1,3072,3072,bf16,NVIDIA GeForce RTX 4060,c00,32,32,32,2,2,8,0.0,109.951,59.087999165058136,100.35839974880207,0.3194281117435673,7,-1,-1,1x3072x3072,0,
2026-03-03T03:38:28.727504+00:00,FULL,llm_style,eval,llm_style_eval_145,32,1024,2048,bf16,NVIDIA GeForce RTX 4060,c00,32,32,32,2,2,8,0.0,0.0,50.175998359918594,119.87359941005704,2.674938862944784,7,-1,-1,32x1024x2048,0,
2026-03-03T03:38:28.906404+00:00,FULL,llm_style,eval,llm_style_eval_146,64,8192,4096,bf16,NVIDIA GeForce RTX 4060,c10,64,128,64,8,3,8,0.0,0.0,303.1040132045746,399.72864091396326,14.169945328639345,1,-1,-1,64x8192x4096,0,
2026-03-03T03:38:28.950782+00:00,FULL,llm_style,eval,llm_style_eval_147,64,2048,4096,bf16,NVIDIA GeForce RTX 4060,c00,32,32,32,2,2,8,0.0,0.0,84.99199897050858,102.41664059460162,12.633445936158983,3,-1,-1,64x2048x4096,0,
2026-03-03T03:38:28.979515+00:00,FULL,llm_style,eval,llm_style_eval_148,64,1024,6144,bf16,NVIDIA GeForce RTX 4060,c04,64,64,64,4,3,8,0.0,0.0,72.00000062584877,100.19071869552134,11.184810569444446,2,-1,-1,64x1024x6144,0,
2026-03-03T03:38:29.145339+00:00,FULL,llm_style,eval,llm_style_eval_149,64,4096,8192,bf16,NVIDIA GeForce RTX 4060,c03,64,64,32,4,2,8,0.0,0.0,302.0160049200058,345.7827171683311,14.220992351506657,2,-1,-1,64x4096x8192,0,
2026-03-03T03:38:29.235083+00:00,FULL,llm_style,eval,llm_style_eval_150,2,2048,3072,bf16,NVIDIA GeForce RTX 4060,c00,32,32,32,2,2,8,0.0,89.677,54.23999950289726,140.30047863721848,0.46397168566817104,7,-1,-1,2x2048x3072,0,
2026-03-03T03:38:29.351439+00:00,FULL,llm_style,eval,llm_style_eval_151,64,4096,2048,bf16,NVIDIA GeForce RTX 4060,c04,64,64,64,4,3,8,0.0,116.302,68.33599880337715,87.13759981095788,15.712682082681958,3,-1,-1,64x4096x2048,0,
2026-03-03T03:38:30.105082+00:00,FULL,llm_style,eval,llm_style_eval_152,8,8192,8192,bf16,NVIDIA GeForce RTX 4060,c11,32,128,32,4,2,8,0.0,753.594,558.0480098724365,657.2543954849242,1.9241029535172884,4,-1,-1,8x8192x8192,0,
2026-03-03T03:38:30.207864+00:00,FULL,llm_style,eval,llm_style_eval_153,64,8192,2048,bf16,NVIDIA GeForce RTX 4060,c10,64,128,64,8,3,8,0.0,0.0,171.90400511026382,283.54559883475287,12.492342145388331,1,-1,-1,64x8192x2048,0,
2026-03-03T03:38:30.433154+00:00,FULL,llm_style,eval,llm_style_eval_154,16,2048,8192,bf16,NVIDIA GeForce RTX 4060,c06,64,128,32,4,3,8,0.0,225.237,162.60799765586853,193.67807805538172,3.3016267326296806,6,-1,-1,16x2048x8192,0,
2026-03-03T03:38:30.514543+00:00,FULL,llm_style,eval,llm_style_eval_155,4,2048,1536,bf16,NVIDIA GeForce RTX 4060,c00,32,32,32,2,2,8,0.0,81.346,45.423999428749084,105.85760280489916,0.5540204366961228,7,-1,-1,4x2048x1536,0,
2026-03-03T03:38:30.654944+00:00,FULL,llm_style,eval,llm_style_eval_156,1,4096,6144,bf16,NVIDIA GeForce RTX 4060,c11,32,128,32,4,2,8,0.0,0.0,254.97600436210632,350.4873624444007,0.1973975869843857,6,-1,-1,1x4096x6144,0,
2026-03-03T03:38:30.826888+00:00,FULL,llm_style,eval,llm_style_eval_157,1,1536,8192,bf16,NVIDIA GeForce RTX 4060,c04,64,64,64,4,3,8,0.0,171.89,84.99199897050858,128.01760241389275,0.29609638912872616,6,-1,-1,1x1536x8192,0,
2026-03-03T03:38:30.899579+00:00,FULL,llm_style,eval,llm_style_eval_158,64,1536,8192,bf16,NVIDIA GeForce RTX 4060,c04,64,64,64,4,3,8,0.0,0.0,122.8799968957901,221.23808249831194,13.107200331115733,2,-1,-1,64x1536x8192,0,
2026-03-03T03:38:31.008222+00:00,FULL,llm_style,eval,llm_style_eval_159,16,6144,1536,bf16,NVIDIA GeForce RTX 4060,c11,32,128,32,4,2,8,0.0,108.592,47.10400104522705,52.75584083050488,6.411130292521085,5,-1,-1,16x6144x1536,0,
2026-03-03T03:38:31.201946+00:00,FULL,llm_style,eval,llm_style_eval_160,32,6144,6144,bf16,NVIDIA GeForce RTX 4060,c02,32,64,32,2,2,8,0.0,0.0,334.3359977006912,424.2636743187904,7.226021489205035,4,-1,-1,32x6144x6144,0,
2026-03-03T03:38:31.300533+00:00,FULL,llm_style,eval,llm_style_eval_161,2,1536,4096,bf16,NVIDIA GeForce RTX 4060,c04,64,64,64,4,3,8,0.0,98.531,56.32000043988228,86.15935936570165,0.44683636014638856,7,-1,-1,2x1536x4096,0,
2026-03-03T03:38:31.387301+00:00,FULL,llm_style,eval,llm_style_eval_162,64,1536,3072,bf16,NVIDIA GeForce RTX 4060,c04,64,64,64,4,3,8,0.0,86.723,52.97600105404854,58.931199423968785,11.401007323746317,3,-1,-1,64x1536x3072,0,
2026-03-03T03:38:31.428769+00:00,FULL,llm_style,eval,llm_style_eval_163,64,1024,8192,bf16,NVIDIA GeForce RTX 4060,c04,64,64,64,4,3,8,0.0,0.0,90.03200009465218,168.51968109607697,11.926224263274802,2,-1,-1,64x1024x8192,0,
2026-03-03T03:38:31.595892+00:00,FULL,llm_style,eval,llm_style_eval_164,64,4096,8192,bf16,NVIDIA GeForce RTX 4060,c03,64,64,32,4,2,8,0.0,0.0,302.0800054073334,421.0278406739235,14.217979406510347,2,-1,-1,64x4096x8192,0,
2026-03-03T03:38:31.909775+00:00,FULL,llm_style,eval,llm_style_eval_165,4,8192,3072,bf16,NVIDIA GeForce RTX 4060,c11,32,128,32,4,2,8,0.0,313.835,227.743998169899,336.004481613636,0.8840039413456184,5,-1,-1,4x8192x3072,0,
2026-03-03T03:38:31.956753+00:00,FULL,llm_style,eval,llm_style_eval_166,64,1024,6144,bf16,NVIDIA GeForce RTX 4060,c04,64,64,64,4,3,8,0.0,0.0,80.89599758386612,170.45503795146934,9.95483574036066,2,-1,-1,64x1024x6144,0,
2026-03-03T03:38:31.971112+00:00,FULL,llm_style,eval,llm_style_eval_167,2,2048,1024,bf16,NVIDIA GeForce RTX 4060,c00,32,32,32,2,2,8,0.0,0.0,53.84000018239021,154.4627147912978,0.15580624018540984,7,-1,-1,2x2048x1024,0,
2026-03-03T03:38:32.045659+00:00,FULL,llm_style,eval,llm_style_eval_168,64,4096,1024,bf16,NVIDIA GeForce RTX 4060,c02,32,64,32,2,2,8,0.0,74.503,51.96800082921982,84.72255758941165,10.330797864714778,3,-1,-1,64x4096x1024,0,
2026-03-03T03:38:32.092240+00:00,FULL,llm_style,eval,llm_style_eval_169,4,1536,6144,bf16,NVIDIA GeForce RTX 4060,c04,64,64,64,4,3,8,0.0,0.0,80.86399734020233,279.01952505111683,0.9336351711921331,6,-1,-1,4x1536x6144,0,
2026-03-03T03:38:32.110804+00:00,FULL,llm_style,eval,llm_style_eval_170,16,1536,1536,bf16,NVIDIA GeForce RTX 4060,c04,64,64,64,4,3,8,0.0,0.0,43.007999658584595,218.06144163012493,1.7554285853638942,7,-1,-1,16x1536x1536,0,
2026-03-03T03:38:32.203078+00:00,FULL,llm_style,eval,llm_style_eval_171,1,2048,3072,bf16,NVIDIA GeForce RTX 4060,c00,32,32,32,2,2,8,0.0,92.23,55.663999170064926,146.01216092705727,0.22605116749798418,7,-1,-1,1x2048x3072,0,
2026-03-03T03:38:32.285576+00:00,FULL,llm_style,eval,llm_style_eval_172,64,3072,2048,bf16,NVIDIA GeForce RTX 4060,c06,64,128,32,4,3,8,0.0,82.455,53.58400009572506,75.01440059393639,15.02885873696181,3,-1,-1,64x3072x2048,0,
2026-03-03T03:38:32.529936+00:00,FULL,llm_style,eval,llm_style_eval_173,64,8192,6144,bf16,NVIDIA GeForce RTX 4060,c04,64,64,64,4,3,8,0.0,0.0,448.5119879245758,568.1254124641418,14.364055181248348,0,-1,-1,64x8192x6144,0,
2026-03-03T03:38:32.759518+00:00,FULL,llm_style,eval,llm_style_eval_174,2,4096,4096,bf16,NVIDIA GeForce RTX 4060,c11,32,128,32,4,2,8,0.0,229.53,160.76800227165222,221.62175580859184,0.4174267456941158,7,-1,-1,2x4096x4096,0,
2026-03-03T03:38:32.805541+00:00,FULL,llm_style,eval,llm_style_eval_175,64,4096,2048,bf16,NVIDIA GeForce RTX 4060,c04,64,64,64,4,3,8,0.0,0.0,68.60800087451935,124.62880335748177,15.650387860212119,3,-1,-1,64x4096x2048,0,
2026-03-03T03:38:32.867437+00:00,FULL,llm_style,eval,llm_style_eval_176,16,6144,2048,bf16,NVIDIA GeForce RTX 4060,c11,32,128,32,4,2,8,0.0,0.0,67.58400052785873,194.34271603822697,5.957818135285181,5,-1,-1,16x6144x2048,0,
2026-03-03T03:38:32.919457+00:00,FULL,llm_style,eval,llm_style_eval_177,1,6144,1536,bf16,NVIDIA GeForce RTX 4060,c11,32,128,32,4,2,8,0.0,0.0,49.15200173854828,173.6057542264461,0.38399998641759203,5,-1,-1,1x6144x1536,0,
2026-03-03T03:38:33.488437+00:00,FULL,llm_style,eval,llm_style_eval_178,32,6144,8192,bf16,NVIDIA GeForce RTX 4060,c02,32,64,32,2,2,8,0.0,568.929,429.05598878860474,478.6908823251723,7.507704253458383,4,-1,-1,32x6144x8192,0,
2026-03-03T03:38:33.623957+00:00,FULL,llm_style,eval,llm_style_eval_179,64,4096,6144,bf16,NVIDIA GeForce RTX 4060,c06,64,128,32,4,3,8,0.0,0.0,233.8239997625351,300.542411506176,13.776282482856265,2,-1,-1,64x4096x6144,0,
2026-03-03T03:38:33.639377+00:00,FULL,llm_style,eval,llm_style_eval_180,64,2048,1536,bf16,NVIDIA GeForce RTX 4060,c00,32,32,32,2,2,8,0.0,0.0,49.47199858725071,68.51839989423752,8.139011875371589,3,-1,-1,64x2048x1536,0,
2026-03-03T03:38:33.666246+00:00,FULL,llm_style,eval,llm_style_eval_181,64,2048,3072,bf16,NVIDIA GeForce RTX 4060,c06,64,128,32,4,3,8,0.0,0.0,70.27199864387512,77.5660815834999,11.45984721569023,3,-1,-1,64x2048x3072,0,
2026-03-03T03:38:33.740616+00:00,FULL,llm_style,eval,llm_style_eval_182,32,3072,1536,bf16,NVIDIA GeForce RTX 4060,c11,32,128,32,4,2,8,0.0,74.315,45.871999114751816,69.06432211399073,6.583316485609282,7,-1,-1,32x3072x1536,0,
2026-03-03T03:38:33.825096+00:00,FULL,llm_style,eval,llm_style_eval_183,8,8192,2048,bf16,NVIDIA GeForce RTX 4060,c11,32,128,32,4,2,8,0.0,0.0,161.79199516773224,181.25631406903267,1.6591392900601099,5,-1,-1,8x8192x2048,0,
2026-03-03T03:38:33.865884+00:00,FULL,llm_style,eval,llm_style_eval_184,64,8192,1024,bf16,NVIDIA GeForce RTX 4060,c06,64,128,32,4,3,8,0.0,0.0,65.19999727606773,142.62272343039507,16.46843357145548,1,-1,-1,64x8192x1024,0,
2026-03-03T03:38:33.924625+00:00,FULL,llm_style,eval,llm_style_eval_185,1,8192,1536,bf16,NVIDIA GeForce RTX 4060,c11,32,128,32,4,2,8,0.0,0.0,61.20000034570694,182.07839831709845,0.41120627218697936,5,-1,-1,1x8192x1536,0,
2026-03-03T03:38:33.947930+00:00,FULL,llm_style,eval,llm_style_eval_186,16,6144,1024,bf16,NVIDIA GeForce RTX 4060,c11,32,128,32,4,2,8,0.0,0.0,47.05600067973137,124.0390411764383,4.278446725004368,5,-1,-1,16x6144x1024,0,
2026-03-03T03:38:33.973915+00:00,FULL,llm_style,eval,llm_style_eval_187,1,1024,6144,bf16,NVIDIA GeForce RTX 4060,c04,64,64,64,4,3,8,0.0,0.0,76.28800347447395,223.2406364381313,0.16493958980339887,6,-1,-1,1x1024x6144,0,
2026-03-03T03:38:34.358489+00:00,FULL,llm_style,eval,llm_style_eval_188,8,8192,4096,bf16,NVIDIA GeForce RTX 4060,c11,32,128,32,4,2,8,0.0,384.516,292.7519977092743,434.0224012732503,1.8338761689105703,5,-1,-1,8x8192x4096,0,
2026-03-03T03:38:34.589664+00:00,FULL,llm_style,eval,llm_style_eval_189,8,2048,8192,bf16,NVIDIA GeForce RTX 4060,c04,64,64,64,4,3,8,0.0,231.133,163.83999586105347,182.3212812840938,1.6384000413894664,6,-1,-1,8x2048x8192,0,
2026-03-03T03:38:34.807188+00:00,FULL,llm_style,eval,llm_style_eval_190,4,8192,2048,bf16,NVIDIA GeForce RTX 4060,c11,32,128,32,4,2,8,0.0,217.481,160.91199964284897,188.58016148209572,0.8341063954080614,5,-1,-1,4x8192x2048,0,
2026-03-03T03:38:35.155066+00:00,FULL,llm_style,eval,llm_style_eval_191,4,8192,8192,bf16,NVIDIA GeForce RTX 4060,c11,32,128,32,4,2,8,0.0,0.0,557.0079982280731,686.8070524930954,0.9638477610875746,4,-1,-1,4x8192x8192,0,
2026-03-03T03:38:35.166643+00:00,FULL,llm_style,eval,llm_style_eval_192,64,1536,1024,bf16,NVIDIA GeForce RTX 4060,c00,32,32,32,2,2,8,0.0,0.0,48.91199991106987,82.44255907833569,4.116098142910638,3,-1,-1,64x1536x1024,0,
2026-03-03T03:38:35.187104+00:00,FULL,llm_style,eval,llm_style_eval_193,32,2048,2048,bf16,NVIDIA GeForce RTX 4060,c11,32,128,32,4,2,8,0.0,0.0,65.2959980070591,141.1708825826644,4.1110552590218425,7,-1,-1,32x2048x2048,0,
2026-03-03T03:38:35.199887+00:00,FULL,llm_style,eval,llm_style_eval_194,8,1024,2048,bf16,NVIDIA GeForce RTX 4060,c04,64,64,64,4,3,8,0.0,0.0,51.19999870657921,147.49696522951126,0.6553600165557865,7,-1,-1,8x1024x2048,0,
2026-03-03T03:38:35.233820+00:00,FULL,llm_style,eval,llm_style_eval_195,2,4096,2048,bf16,NVIDIA GeForce RTX 4060,c11,32,128,32,4,2,8,0.0,0.0,58.20799991488457,100.48383980989442,0.5764573950155549,7,-1,-1,2x4096x2048,0,
2026-03-03T03:38:35.285360+00:00,FULL,llm_style,eval,llm_style_eval_196,32,2048,4096,bf16,NVIDIA GeForce RTX 4060,c00,32,32,32,2,2,8,0.0,0.0,73.72800260782242,146.72960348427276,7.281777520215079,7,-1,-1,32x2048x4096,0,
2026-03-03T03:38:35.431943+00:00,FULL,llm_style,eval,llm_style_eval_197,32,8192,1536,bf16,NVIDIA GeForce RTX 4060,c11,32,128,32,4,2,8,0.0,146.531,69.39199939370155,77.38368004560469,11.605176029458729,5,-1,-1,32x8192x1536,0,
2026-03-03T03:38:35.606962+00:00,FULL,llm_style,eval,llm_style_eval_198,64,4096,8192,bf16,NVIDIA GeForce RTX 4060,c03,64,64,32,4,2,8,0.0,0.0,325.6320059299469,421.7548698186873,13.18963497993491,2,-1,-1,64x4096x8192,0,
2026-03-03T03:38:36.002497+00:00,FULL,llm_style,eval,llm_style_eval_199,2,8192,4096,bf16,NVIDIA GeForce RTX 4060,c11,32,128,32,4,2,8,0.0,395.484,292.2719866037369,332.37280011177063,0.45922200604867663,5,-1,-1,2x8192x4096,0,
2026-03-03T03:38:36.078592+00:00,FULL,llm_style,eval,llm_style_eval_200,1,4096,1024,bf16,NVIDIA GeForce RTX 4060,c00,32,32,32,2,2,8,0.0,76.052,34.09599885344505,122.81504325568673,0.2460291025951984,7,-1,-1,1x4096x1024,0,
2026-03-03T03:38:36.246497+00:00,FULL,llm_style,eval,llm_style_eval_201,4,1536,8192,bf16,NVIDIA GeForce RTX 4060,c04,64,64,64,4,3,8,0.0,167.857,85.74399724602699,196.3766418397425,1.17399817168734,6,-1,-1,4x1536x8192,0,
2026-03-03T03:38:36.478469+00:00,FULL,llm_style,eval,llm_style_eval_202,1,6144,3072,bf16,NVIDIA GeForce RTX 4060,c11,32,128,32,4,2,8,0.0,231.922,177.10399627685547,198.1340792775154,0.21314446197470208,5,-1,-1,1x6144x3072,0,
2026-03-03T03:38:36.652480+00:00,FULL,llm_style,eval,llm_style_eval_203,16,2048,6144,bf16,NVIDIA GeForce RTX 4060,c00,32,32,32,2,2,8,0.0,173.962,90.47999978065491,113.738240301609,4.450189931212725,6,-1,-1,16x2048x6144,0,
2026-03-03T03:38:36.670657+00:00,FULL,llm_style,eval,llm_style_eval_204,16,1536,1024,bf16,NVIDIA GeForce RTX 4060,c11,32,128,32,4,2,8,0.0,0.0,45.05600035190582,133.92351493239403,1.1170909003659715,7,-1,-1,16x1536x1024,0,
2026-03-03T03:38:36.738834+00:00,FULL,llm_style,eval,llm_style_eval_205,64,6144,2048,bf16,NVIDIA GeForce RTX 4060,c10,64,128,64,8,3,8,0.0,0.0,94.2080020904541,118.96832302212712,17.096347446722895,1,-1,-1,64x6144x2048,0,
2026-03-03T03:38:36.801537+00:00,FULL,llm_style,eval,llm_style_eval_206,4,2048,6144,bf16,NVIDIA GeForce RTX 4060,c00,32,32,32,2,2,8,0.0,0.0,84.30399745702744,98.25280249118802,1.1940512791378777,6,-1,-1,4x2048x6144,0,
2026-03-03T03:38:36.914993+00:00,FULL,llm_style,eval,llm_style_eval_207,32,6144,1536,bf16,NVIDIA GeForce RTX 4060,c11,32,128,32,4,2,8,0.0,113.4,48.79999905824661,63.249278999865055,12.37663499294545,5,-1,-1,32x6144x1536,0,
2026-03-03T03:38:36.981249+00:00,FULL,llm_style,eval,llm_style_eval_208,4,2048,1024,bf16,NVIDIA GeForce RTX 4060,c11,32,128,32,4,2,8,0.0,66.211,40.720000863075256,72.51136023551219,0.4120141366503142,7,-1,-1,4x2048x1024,0,
2026-03-03T03:38:37.038472+00:00,FULL,llm_style,eval,llm_style_eval_209,1,1024,1536,bf16,NVIDIA GeForce RTX 4060,c04,64,64,64,4,3,8,0.0,57.185,38.91199827194214,47.53664024174212,0.08084210885330595,7,-1,-1,1x1024x1536,0,
2026-03-03T03:38:37.342736+00:00,FULL,llm_style,eval,llm_style_eval_210,8,6144,4096,bf16,NVIDIA GeForce RTX 4060,c06,64,128,32,4,3,8,0.0,304.224,226.28799825906754,277.0108759403229,1.7793837370863101,5,-1,-1,8x6144x4096,0,
2026-03-03T03:38:37.578253+00:00,FULL,llm_style,eval,llm_style_eval_211,4,2048,8192,bf16,NVIDIA GeForce RTX 4060,c10,64,128,64,8,3,8,0.0,235.479,160.76800227165222,169.9574413895607,0.8348534913882316,6,-1,-1,4x2048x8192,0,
2026-03-03T03:38:37.635436+00:00,FULL,llm_style,eval,llm_style_eval_212,32,1024,1024,bf16,NVIDIA GeForce RTX 4060,c00,32,32,32,2,2,8,0.0,57.143,16.047999262809753,940.6976288557034,4.18175891592422,7,-1,-1,32x1024x1024,0,
2026-03-03T03:38:37.695548+00:00,FULL,llm_style,eval,llm_style_eval_213,16,3072,4096,bf16,NVIDIA GeForce RTX 4060,c00,32,32,32,2,2,8,0.0,0.0,73.61600175499916,132.8742437809704,5.469642121288614,7,-1,-1,16x3072x4096,0,
2026-03-03T03:38:37.742465+00:00,FULL,llm_style,eval,llm_style_eval_214,64,1024,8192,bf16,NVIDIA GeForce RTX 4060,c04,64,64,64,4,3,8,0.0,0.0,90.01599997282028,147.74912364780883,11.928344120203176,2,-1,-1,64x1024x8192,0,
2026-03-03T03:38:37.765967+00:00,FULL,llm_style,eval,llm_style_eval_215,4,4096,1536,bf16,NVIDIA GeForce RTX 4060,c00,32,32,32,2,2,8,0.0,0.0,45.05600035190582,52.76671923696995,1.1170909003659715,7,-1,-1,4x4096x1536,0,
2026-03-03T03:38:37.845623+00:00,FULL,llm_style,eval,llm_style_eval_216,16,1536,3072,bf16,NVIDIA GeForce RTX 4060,c04,64,64,64,4,3,8,0.0,79.606,51.19999870657921,76.88191987574098,2.9491200745010397,7,-1,-1,16x1536x3072,0,
2026-03-03T03:38:37.909068+00:00,FULL,llm_style,eval,llm_style_eval_217,8,6144,2048,bf16,NVIDIA GeForce RTX 4060,c02,32,64,32,2,2,8,0.0,0.0,62.863998115062714,179.60960105061523,3.2025737788981092,5,-1,-1,8x6144x2048,0,
2026-03-03T03:38:38.049561+00:00,FULL,llm_style,eval,llm_style_eval_218,8,3072,4096,bf16,NVIDIA GeForce RTX 4060,c00,32,32,32,2,2,8,0.0,140.44,66.56000018119812,81.32031701505184,3.0247384533041326,7,-1,-1,8x3072x4096,0,
2026-03-03T03:38:38.364604+00:00,FULL,llm_style,eval,llm_style_eval_219,64,8192,3072,bf16,NVIDIA GeForce RTX 4060,c10,64,128,64,8,3,8,0.0,315.001,234.46399718523026,286.72000765800476,13.738678478023136,1,-1,-1,64x8192x3072,0,
2026-03-03T03:38:38.399345+00:00,FULL,llm_style,eval,llm_style_eval_220,2,4096,2048,bf16,NVIDIA GeForce RTX 4060,c11,32,128,32,4,2,8,0.0,0.0,58.09599906206131,147.5583977997303,0.5775687231775691,7,-1,-1,2x4096x2048,0,
2026-03-03T03:38:38.548591+00:00,FULL,llm_style,eval,llm_style_eval_221,4,1024,8192,bf16,NVIDIA GeForce RTX 4060,c04,64,64,64,4,3,8,0.0,149.192,85.77599748969078,93.24544176459311,0.7823734606882964,6,-1,-1,4x1024x8192,0,
2026-03-03T03:38:38.619753+00:00,FULL,llm_style,eval,llm_style_eval_222,64,6144,2048,bf16,NVIDIA GeForce RTX 4060,c10,64,128,64,8,3,8,0.0,0.0,95.23200243711472,108.6057589203119,16.91251569621828,1,-1,-1,64x6144x2048,0,
2026-03-03T03:38:38.691695+00:00,FULL,llm_style,eval,llm_style_eval_223,4,2048,2048,bf16,NVIDIA GeForce RTX 4060,c00,32,32,32,2,2,8,0.0,71.891,44.87999901175499,124.96895760297774,0.7476477882990017,7,-1,-1,4x2048x2048,0,
2026-03-03T03:38:38.710598+00:00,FULL,llm_style,eval,llm_style_eval_224,16,3072,1536,bf16,NVIDIA GeForce RTX 4060,c02,32,64,32,2,2,8,0.0,0.0,41.728001087903976,135.69023743271828,3.6185520528988406,7,-1,-1,16x3072x1536,0,
2026-03-03T03:38:38.726994+00:00,FULL,llm_style,eval,llm_style_eval_225,1,2048,2048,bf16,NVIDIA GeForce RTX 4060,c00,32,32,32,2,2,8,0.0,0.0,36.86400130391121,49.17247984558344,0.22755554750672122,7,-1,-1,1x2048x2048,0,
2026-03-03T03:38:38.736953+00:00,FULL,llm_style,eval,llm_style_eval_226,8,1536,1024,bf16,NVIDIA GeForce RTX 4060,c04,64,64,64,4,3,8,0.0,0.0,40.752001106739044,141.16671845316878,0.6175359078462137,7,-1,-1,8x1536x1024,0,
2026-03-03T03:38:38.946821+00:00,FULL,llm_style,eval,llm_style_eval_227,64,6144,6144,bf16,NVIDIA GeForce RTX 4060,c01,64,32,32,2,2,8,0.0,0.0,359.48799550533295,391.3727980852127,13.440888898690138,0,-1,-1,64x6144x6144,0,
2026-03-03T03:38:39.016575+00:00,FULL,llm_style,eval,llm_style_eval_228,64,6144,2048,bf16,NVIDIA GeForce RTX 4060,c10,64,128,64,8,3,8,0.0,0.0,101.3759970664978,156.6367997229099,15.887515611249823,1,-1,-1,64x6144x2048,0,
2026-03-03T03:38:39.211952+00:00,FULL,llm_style,eval,llm_style_eval_229,16,1536,8192,bf16,NVIDIA GeForce RTX 4060,c04,64,64,64,4,3,8,0.0,195.325,110.59200018644333,177.22176030278183,3.6408888827508368,6,-1,-1,16x1536x8192,0,
2026-03-03T03:38:39.239902+00:00,FULL,llm_style,eval,llm_style_eval_230,64,2048,1536,bf16,NVIDIA GeForce RTX 4060,c00,32,32,32,2,2,8,0.0,0.0,60.416001826524734,170.4579173028469,6.664677764612043,3,-1,-1,64x2048x1536,0,
2026-03-03T03:38:39.285974+00:00,FULL,llm_style,eval,llm_style_eval_231,4,1024,8192,bf16,NVIDIA GeForce RTX 4060,c04,64,64,64,4,3,8,0.0,0.0,84.97599884867668,129.0956750512122,0.7897390428973472,6,-1,-1,4x1024x8192,0,
2026-03-03T03:38:39.304678+00:00,FULL,llm_style,eval,llm_style_eval_232,16,3072,1536,bf16,NVIDIA GeForce RTX 4060,c02,32,64,32,2,2,8,0.0,0.0,47.61600121855736,104.39327850937836,3.1710966930409272,7,-1,-1,16x3072x1536,0,
2026-03-03T03:38:39.351784+00:00,FULL,llm_style,eval,llm_style_eval_233,64,3072,3072,bf16,NVIDIA GeForce RTX 4060,c11,32,128,32,4,2,8,0.0,0.0,67.47199967503548,121.52831614017472,17.903123633772232,3,-1,-1,64x3072x3072,0,
2026-03-03T03:38:39.515746+00:00,FULL,llm_style,eval,llm_style_eval_234,32,8192,4096,bf16,NVIDIA GeForce RTX 4060,c11,32,128,32,4,2,8,0.0,0.0,324.43200051784515,362.51295894384384,6.619210326269523,5,-1,-1,32x8192x4096,0,
2026-03-03T03:38:39.529924+00:00,FULL,llm_style,eval,llm_style_eval_235,4,2048,1024,bf16,NVIDIA GeForce RTX 4060,c11,32,128,32,4,2,8,0.0,0.0,62.991999089717865,126.13632164895532,0.26633884052647144,7,-1,-1,4x2048x1024,0,
2026-03-03T03:38:39.652099+00:00,FULL,llm_style,eval,llm_style_eval_236,4,8192,3072,bf16,NVIDIA GeForce RTX 4060,c11,32,128,32,4,2,8,0.0,0.0,227.10399329662323,241.76639989018437,0.8864951649575132,5,-1,-1,4x8192x3072,0,
2026-03-03T03:38:39.671551+00:00,FULL,llm_style,eval,llm_style_eval_237,64,1024,4096,bf16,NVIDIA GeForce RTX 4060,c04,64,64,64,4,3,8,0.0,0.0,60.20800024271011,75.27424313127995,8.916936450899703,3,-1,-1,64x1024x4096,0,
2026-03-03T03:38:39.839686+00:00,FULL,llm_style,eval,llm_style_eval_238,32,2048,6144,bf16,NVIDIA GeForce RTX 4060,c00,32,32,32,2,2,8,0.0,168.087,102.39999741315842,192.60095685720438,7.864320198669438,6,-1,-1,32x2048x6144,0,
2026-03-03T03:38:39.847028+00:00,FULL,llm_style,eval,llm_style_eval_239,32,2048,6144,bf16,NVIDIA GeForce RTX 4060,c00,32,32,32,2,2,8,0.0,0.0,102.39999741315842,121.39520004391669,7.864320198669438,6,-1,-1,32x2048x6144,0,
2026-03-03T03:38:39.990933+00:00,FULL,llm_style,eval,llm_style_eval_240,8,8192,1536,bf16,NVIDIA GeForce RTX 4060,c11,32,128,32,4,2,8,0.0,143.87,62.272001057863235,66.56000018119812,3.233019472313521,5,-1,-1,8x8192x1536,0,
2026-03-03T03:38:40.005179+00:00,FULL,llm_style,eval,llm_style_eval_241,16,1536,1536,bf16,NVIDIA GeForce RTX 4060,c04,64,64,64,4,3,8,0.0,0.0,54.78399991989136,165.71392014622683,1.3780934599590609,7,-1,-1,16x1536x1536,0,
2026-03-03T03:38:40.030160+00:00,FULL,llm_style,eval,llm_style_eval_242,1,2048,3072,bf16,NVIDIA GeForce RTX 4060,c00,32,32,32,2,2,8,0.0,0.0,59.39200147986412,133.7856042385101,0.21186206368657284,7,-1,-1,1x2048x3072,0,
2026-03-03T03:38:40.069263+00:00,FULL,llm_style,eval,llm_style_eval_243,8,1536,6144,bf16,NVIDIA GeForce RTX 4060,c04,64,64,64,4,3,8,0.0,0.0,50.00000074505806,121.49983525276178,3.019898835000001,6,-1,-1,8x1536x6144,0,
2026-03-03T03:38:40.110297+00:00,FULL,llm_style,eval,llm_style_eval_244,32,8192,1024,bf16,NVIDIA GeForce RTX 4060,c11,32,128,32,4,2,8,0.0,0.0,51.16799846291542,62.478400282561765,10.492318013750394,5,-1,-1,32x8192x1024,0,
2026-03-03T03:38:40.232172+00:00,FULL,llm_style,eval,llm_style_eval_245,4,6144,4096,bf16,NVIDIA GeForce RTX 4060,c11,32,128,32,4,2,8,0.0,0.0,228.2240018248558,331.85791313648224,0.8821446928903759,5,-1,-1,4x6144x4096,0,
2026-03-03T03:38:40.296154+00:00,FULL,llm_style,eval,llm_style_eval_246,32,2048,6144,bf16,NVIDIA GeForce RTX 4060,c00,32,32,32,2,2,8,0.0,0.0,102.39999741315842,189.46048453450203,7.864320198669438,6,-1,-1,32x2048x6144,0,
2026-03-03T03:38:40.360867+00:00,FULL,llm_style,eval,llm_style_eval_247,64,6144,2048,bf16,NVIDIA GeForce RTX 4060,c10,64,128,64,8,3,8,0.0,0.0,95.56800127029419,182.25024163722992,16.853054522347048,1,-1,-1,64x6144x2048,0,
2026-03-03T03:38:40.370228+00:00,FULL,llm_style,eval,llm_style_eval_248,64,1024,1024,bf16,NVIDIA GeForce RTX 4060,c04,64,64,64,4,3,8,0.0,0.0,41.98399931192398,172.1241621673106,3.1968781011741414,3,-1,-1,64x1024x1024,0,
2026-03-03T03:38:40.486505+00:00,FULL,llm_style,eval,llm_style_eval_249,2,8192,1024,bf16,NVIDIA GeForce RTX 4060,c11,32,128,32,4,2,8,0.0,116.236,49.15200173854828,123.10400269925574,0.6826666425201637,5,-1,-1,2x8192x1024,0,
2026-03-03T03:38:40.537255+00:00,FULL,llm_style,eval,llm_style_eval_250,64,3072,3072,bf16,NVIDIA GeForce RTX 4060,c11,32,128,32,4,2,8,0.0,0.0,73.72800260782242,128.48832130432126,16.383999420483928,3,-1,-1,64x3072x3072,0,
2026-03-03T03:38:40.585722+00:00,FULL,llm_style,eval,llm_style_eval_251,64,1024,8192,bf16,NVIDIA GeForce RTX 4060,c04,64,64,64,4,3,8,0.0,0.0,87.43999898433685,103.77472013235092,12.279755677860193,2,-1,-1,64x1024x8192,0,
2026-03-03T03:38:40.652086+00:00,FULL,llm_style,eval,llm_style_eval_252,64,4096,3072,bf16,NVIDIA GeForce RTX 4060,c04,64,64,64,4,3,8,0.0,0.0,88.08000013232231,153.8457597792148,18.2857939779789,3,-1,-1,64x4096x3072,0,
2026-03-03T03:38:40.793526+00:00,FULL,llm_style,eval,llm_style_eval_253,8,6144,4096,bf16,NVIDIA GeForce RTX 4060,c06,64,128,32,4,3,8,0.0,0.0,229.37600314617157,340.59423789381947,1.755428547350728,5,-1,-1,8x6144x4096,0,
2026-03-03T03:38:40.873134+00:00,FULL,llm_style,eval,llm_style_eval_254,4,1536,3072,bf16,NVIDIA GeForce RTX 4060,c04,64,64,64,4,3,8,0.0,79.555,49.15200173854828,116.16352126002312,0.7679999728351841,7,-1,-1,4x1536x3072,0,
2026-03-03T03:38:40.898006+00:00,FULL,llm_style,eval,llm_style_eval_255,1,3072,1536,bf16,NVIDIA GeForce RTX 4060,c00,32,32,32,2,2,8,0.0,0.0,41.98399931192398,118.106563836336,0.22478049148880683,7,-1,-1,1x3072x1536,0,
2026-03-03T03:38:40.983670+00:00,BUCKET,llm_style,tune,llm_style_tune_000,32,3072,2048,bf16,NVIDIA GeForce RTX 4060,c01,64,32,32,2,2,8,0.0,83.184,36.35199926793575,117.64992162585258,11.076507265314563,7,-1,-1,llm8_g7,0,
2026-03-03T03:38:41.008219+00:00,BUCKET,llm_style,tune,llm_style_tune_001,4,4096,1536,bf16,NVIDIA GeForce RTX 4060,c01,64,32,32,2,2,8,0.0,0.0,64.01599943637848,103.3932776004075,0.7862354480620348,7,-1,-1,llm8_g7,0,
2026-03-03T03:38:41.108865+00:00,BUCKET,llm_style,tune,llm_style_tune_002,8,8192,1024,bf16,NVIDIA GeForce RTX 4060,c11,32,128,32,4,2,8,0.0,100.581,49.12000149488449,146.9849570095536,2.732445519448485,5,-1,-1,llm8_g5,0,
2026-03-03T03:38:41.201934+00:00,BUCKET,llm_style,tune,llm_style_tune_003,64,1024,4096,bf16,NVIDIA GeForce RTX 4060,c00,32,32,32,2,2,8,0.0,93.022,41.98399931192398,134.33695979416365,12.787512404696566,3,-1,-1,llm8_g3,0,
2026-03-03T03:38:41.266263+00:00,BUCKET,llm_style,tune,llm_style_tune_004,16,3072,4096,bf16,NVIDIA GeForce RTX 4060,c01,64,32,32,2,2,8,0.0,0.0,88.51199969649315,186.82911559939384,4.549136675034958,7,-1,-1,llm8_g7,0,
2026-03-03T03:38:41.298791+00:00,BUCKET,llm_style,tune,llm_style_tune_005,16,1536,4096,bf16,NVIDIA GeForce RTX 4060,c01,64,32,32,2,2,8,0.0,0.0,73.63200187683105,86.05695933103561,2.7342267881942397,7,-1,-1,llm8_g7,0,
2026-03-03T03:38:41.313487+00:00,BUCKET,llm_style,tune,llm_style_tune_006,2,2048,1024,bf16,NVIDIA GeForce RTX 4060,c01,64,32,32,2,2,8,0.0,0.0,41.98399931192398,83.06688196957109,0.19980488132338384,7,-1,-1,llm8_g7,0,
2026-03-03T03:38:41.339263+00:00,BUCKET,llm_style,tune,llm_style_tune_007,32,6144,1024,bf16,NVIDIA GeForce RTX 4060,c11,32,128,32,4,2,8,0.0,0.0,67.07200035452843,200.46848446130747,6.0032976781915,5,-1,-1,llm8_g5,0,
2026-03-03T03:38:41.358498+00:00,BUCKET,llm_style,tune,llm_style_tune_008,8,1536,2048,bf16,NVIDIA GeForce RTX 4060,c01,64,32,32,2,2,8,0.0,0.0,53.247999399900436,518.7558516859999,0.9452307798834243,7,-1,-1,llm8_g7,0,
2026-03-03T03:38:41.472465+00:00,BUCKET,llm_style,tune,llm_style_tune_009,16,1024,6144,bf16,NVIDIA GeForce RTX 4060,c04,64,64,64,4,3,8,0.0,113.922,69.63200122117996,78.37856061756611,2.8912940669406253,6,-1,-1,llm8_g6,0,
2026-03-03T03:38:41.496955+00:00,BUCKET,llm_style,tune,llm_style_tune_010,64,1536,2048,bf16,NVIDIA GeForce RTX 4060,c00,32,32,32,2,2,8,0.0,0.0,44.99199986457825,146.67775750160212,8.94943957174495,3,-1,-1,llm8_g3,0,
2026-03-03T03:38:41.527208+00:00,BUCKET,llm_style,tune,llm_style_tune_011,64,1536,4096,bf16,NVIDIA GeForce RTX 4060,c00,32,32,32,2,2,8,0.0,0.0,82.7999971807003,237.08895713090894,9.725922650003511,3,-1,-1,llm8_g3,0,
2026-03-03T03:38:41.540357+00:00,BUCKET,llm_style,tune,llm_style_tune_012,32,1024,2048,bf16,NVIDIA GeForce RTX 4060,c01,64,32,32,2,2,8,0.0,0.0,55.92000111937523,176.75295948982233,2.400173914758669,7,-1,-1,llm8_g7,0,
2026-03-03T03:38:41.551815+00:00,BUCKET,llm_style,tune,llm_style_tune_013,64,1536,1024,bf16,NVIDIA GeForce RTX 4060,c00,32,32,32,2,2,8,0.0,0.0,49.15200173854828,133.16096037626266,4.095999855120982,3,-1,-1,llm8_g3,0,
2026-03-03T03:38:41.648117+00:00,BUCKET,llm_style,tune,llm_style_tune_014,4,6144,3072,bf16,NVIDIA GeForce RTX 4060,c11,32,128,32,4,2,8,0.0,0.0,178.17600071430206,196.1190420389175,0.847448272464675,5,-1,-1,llm8_g5,0,
2026-03-03T03:38:41.671719+00:00,BUCKET,llm_style,tune,llm_style_tune_015,1,6144,1024,bf16,NVIDIA GeForce RTX 4060,c11,32,128,32,4,2,8,0.0,0.0,39.792001247406006,140.02816222608084,0.31621711915834505,5,-1,-1,llm8_g5,0,
2026-03-03T03:38:41.832798+00:00,BUCKET,llm_style,tune,llm_style_tune_016,4,8192,4096,bf16,NVIDIA GeForce RTX 4060,c11,32,128,32,4,2,8,0.0,0.0,293.96800696849823,393.77056539058685,0.91314513701066,5,-1,-1,llm8_g5,0,
2026-03-03T03:38:41.852398+00:00,BUCKET,llm_style,tune,llm_style_tune_017,64,1536,2048,bf16,NVIDIA GeForce RTX 4060,c00,32,32,32,2,2,8,0.0,0.0,60.736000537872314,91.32031731307504,6.629563692606382,3,-1,-1,llm8_g3,0,
2026-03-03T03:38:42.019496+00:00,BUCKET,llm_style,tune,llm_style_tune_018,64,8192,1536,bf16,NVIDIA GeForce RTX 4060,c06,64,128,32,4,3,8,0.0,167.052,108.5439994931221,135.16800105571747,14.838339691933468,1,-1,-1,llm8_g1,0,
2026-03-03T03:38:42.037162+00:00,BUCKET,llm_style,tune,llm_style_tune_019,2,1536,1024,bf16,NVIDIA GeForce RTX 4060,c01,64,32,32,2,2,8,0.0,0.0,49.936000257730484,115.31008072197432,0.12599038704598758,7,-1,-1,llm8_g7,0,
2026-03-03T03:38:42.056189+00:00,BUCKET,llm_style,tune,llm_style_tune_020,16,1024,1536,bf16,NVIDIA GeForce RTX 4060,c01,64,32,32,2,2,8,0.0,0.0,64.51199948787689,185.50847947597492,0.7801904823839528,7,-1,-1,llm8_g7,0,
2026-03-03T03:38:42.095282+00:00,BUCKET,llm_style,tune,llm_style_tune_021,1,6144,1536,bf16,NVIDIA GeForce RTX 4060,c11,32,128,32,4,2,8,0.0,0.0,56.32000043988228,143.4419238567352,0.33512727010979143,5,-1,-1,llm8_g5,0,
2026-03-03T03:38:42.181605+00:00,BUCKET,llm_style,tune,llm_style_tune_022,8,4096,4096,bf16,NVIDIA GeForce RTX 4060,c01,64,32,32,2,2,8,0.0,0.0,166.60799831151962,237.63903826475143,1.6111798876431243,7,-1,-1,llm8_g7,0,
2026-03-03T03:38:42.346292+00:00,BUCKET,llm_style,tune,llm_style_tune_023,2,4096,8192,bf16,NVIDIA GeForce RTX 4060,c04,64,64,64,4,3,8,0.0,0.0,321.53600454330444,428.3494541049,0.4174267456941158,6,-1,-1,llm8_g6,0,
2026-03-03T03:38:42.367321+00:00,BUCKET,llm_style,tune,llm_style_tune_024,64,1536,2048,bf16,NVIDIA GeForce RTX 4060,c00,32,32,32,2,2,8,0.0,0.0,64.86399844288826,157.7984012663364,6.207652837722144,3,-1,-1,llm8_g3,0,
2026-03-03T03:38:42.396109+00:00,BUCKET,llm_style,tune,llm_style_tune_025,4,4096,1536,bf16,NVIDIA GeForce RTX 4060,c01,64,32,32,2,2,8,0.0,0.0,89.87199887633324,102.32383668422699,0.5600370374454224,7,-1,-1,llm8_g7,0,
2026-03-03T03:38:42.422599+00:00,BUCKET,llm_style,tune,llm_style_tune_026,4,3072,2048,bf16,NVIDIA GeForce RTX 4060,c01,64,32,32,2,2,8,0.0,0.0,79.64800298213959,188.46400395035744,0.6319260510685554,7,-1,-1,llm8_g7,0,
2026-03-03T03:38:42.441502+00:00,BUCKET,llm_style,tune,llm_style_tune_027,8,4096,1024,bf16,NVIDIA GeForce RTX 4060,c01,64,32,32,2,2,8,0.0,0.0,75.77600330114365,213.29920470714544,0.8856215830399591,7,-1,-1,llm8_g7,0,
2026-03-03T03:38:42.450310+00:00,BUCKET,llm_style,tune,llm_style_tune_028,16,1536,1024,bf16,NVIDIA GeForce RTX 4060,c01,64,32,32,2,2,8,0.0,0.0,34.81600061058998,71.08608156442634,1.4456470334703126,7,-1,-1,llm8_g7,0,
2026-03-03T03:38:42.869954+00:00,BUCKET,llm_style,tune,llm_style_tune_029,64,4096,8192,bf16,NVIDIA GeForce RTX 4060,c04,64,64,64,4,3,8,0.0,419.608,303.1040132045746,421.45792096853245,14.169945328639345,2,-1,-1,llm8_g2,0,
2026-03-03T03:38:42.935067+00:00,BUCKET,llm_style,tune,llm_style_tune_030,1,8192,1536,bf16,NVIDIA GeForce RTX 4060,c11,32,128,32,4,2,8,0.0,0.0,69.63200122117996,98.56479942798609,0.36141175836757816,5,-1,-1,llm8_g5,0,
2026-03-03T03:38:43.530372+00:00,BUCKET,llm_style,tune,llm_style_tune_031,1,8192,6144,bf16,NVIDIA GeForce RTX 4060,c11,32,128,32,4,2,8,0.0,595.252,425.79199373722076,455.0889566540718,0.2364142526881911,4,-1,-1,llm8_g4,0,
2026-03-03T03:38:43.661609+00:00,BUCKET,llm_style,tune,llm_style_tune_032,32,3072,8192,bf16,NVIDIA GeForce RTX 4060,c04,64,64,64,4,3,8,0.0,0.0,231.4240038394928,333.5065498948097,6.959575105774515,6,-1,-1,llm8_g6,0,
2026-03-03T03:38:43.701494+00:00,BUCKET,llm_style,tune,llm_style_tune_033,4,1536,6144,bf16,NVIDIA GeForce RTX 4060,c04,64,64,64,4,3,8,0.0,0.0,78.84799689054489,143.9232002198696,0.9575065312667864,6,-1,-1,llm8_g6,0,
2026-03-03T03:38:43.732854+00:00,BUCKET,llm_style,tune,llm_style_tune_034,1,4096,1536,bf16,NVIDIA GeForce RTX 4060,c01,64,32,32,2,2,8,0.0,0.0,59.90400165319443,110.78656375408158,0.21005127625441372,7,-1,-1,llm8_g7,0,
2026-03-03T03:38:43.757532+00:00,BUCKET,llm_style,tune,llm_style_tune_035,4,1536,4096,bf16,NVIDIA GeForce RTX 4060,c01,64,32,32,2,2,8,0.0,0.0,71.16800174117088,115.89248150587076,0.7072230042800682,7,-1,-1,llm8_g7,0,
2026-03-03T03:38:43.877732+00:00,BUCKET,llm_style,tune,llm_style_tune_036,32,8192,3072,bf16,NVIDIA GeForce RTX 4060,c11,32,128,32,4,2,8,0.0,0.0,231.4240038394928,355.36896854639053,6.959575105774515,5,-1,-1,llm8_g5,0,
2026-03-03T03:38:43.904411+00:00,BUCKET,llm_style,tune,llm_style_tune_037,32,3072,2048,bf16,NVIDIA GeForce RTX 4060,c01,64,32,32,2,2,8,0.0,0.0,51.19999870657921,117.12511844933024,7.864320198669438,7,-1,-1,llm8_g7,0,
2026-03-03T03:38:43.941268+00:00,BUCKET,llm_style,tune,llm_style_tune_038,2,2048,4096,bf16,NVIDIA GeForce RTX 4060,c01,64,32,32,2,2,8,0.0,0.0,106.47999867796898,210.63135534524912,0.3151242713805791,7,-1,-1,llm8_g7,0,
2026-03-03T03:38:43.962904+00:00,BUCKET,llm_style,tune,llm_style_tune_039,64,2048,1536,bf16,NVIDIA GeForce RTX 4060,c00,32,32,32,2,2,8,0.0,0.0,48.128001391887665,123.22815686464303,8.366297630382595,3,-1,-1,llm8_g3,0,
2026-03-03T03:38:43.994622+00:00,BUCKET,llm_style,tune,llm_style_tune_040,64,1024,6144,bf16,NVIDIA GeForce RTX 4060,c04,64,64,64,4,3,8,0.0,0.0,75.23200288414955,97.81407825648782,10.704305842290262,2,-1,-1,llm8_g2,0,
2026-03-03T03:38:44.235283+00:00,BUCKET,llm_style,tune,llm_style_tune_041,4,8192,6144,bf16,NVIDIA GeForce RTX 4060,c11,32,128,32,4,2,8,0.0,0.0,423.93600940704346,537.07424223423,0.949797080373494,4,-1,-1,llm8_g4,0,
2026-03-03T03:38:44.266001+00:00,BUCKET,llm_style,tune,llm_style_tune_042,1,1024,6144,bf16,NVIDIA GeForce RTX 4060,c04,64,64,64,4,3,8,0.0,0.0,70.99200040102005,130.39904199540595,0.17724408283921525,6,-1,-1,llm8_g6,0,
2026-03-03T03:38:44.354724+00:00,BUCKET,llm_style,tune,llm_style_tune_043,64,2048,8192,bf16,NVIDIA GeForce RTX 4060,c04,64,64,64,4,3,8,0.0,0.0,171.00800573825836,211.00544437766075,12.55779598580255,2,-1,-1,llm8_g2,0,
2026-03-03T03:38:44.368191+00:00,BUCKET,llm_style,tune,llm_style_tune_044,16,2048,1024,bf16,NVIDIA GeForce RTX 4060,c01,64,32,32,2,2,8,0.0,0.0,45.82400061190128,302.9683147370811,1.4644916005559467,7,-1,-1,llm8_g7,0,
2026-03-03T03:38:44.380111+00:00,BUCKET,llm_style,tune,llm_style_tune_045,4,1024,1536,bf16,NVIDIA GeForce RTX 4060,c01,64,32,32,2,2,8,0.0,0.0,70.3199990093708,117.58591495454304,0.17893788647982214,7,-1,-1,llm8_g7,0,
2026-03-03T03:38:44.410868+00:00,BUCKET,llm_style,tune,llm_style_tune_046,64,1536,4096,bf16,NVIDIA GeForce RTX 4060,c00,32,32,32,2,2,8,0.0,0.0,74.44800063967705,84.47391867637634,10.817031499578139,3,-1,-1,llm8_g3,0,
2026-03-03T03:38:44.425512+00:00,BUCKET,llm_style,tune,llm_style_tune_047,16,2048,1536,bf16,NVIDIA GeForce RTX 4060,c01,64,32,32,2,2,8,0.0,0.0,49.02400076389313,65.09567968547343,2.0533472264903345,7,-1,-1,llm8_g7,0,
2026-03-03T03:38:44.862608+00:00,BUCKET,llm_style,tune,llm_style_tune_048,64,6144,6144,bf16,NVIDIA GeForce RTX 4060,c06,64,128,32,4,3,8,0.0,437.043,332.8319936990738,408.8755157589911,14.517348991301152,0,-1,-1,llm8_g0,0,
2026-03-03T03:38:45.038400+00:00,BUCKET,llm_style,tune,llm_style_tune_049,4,4096,8192,bf16,NVIDIA GeForce RTX 4060,c04,64,64,64,4,3,8,0.0,0.0,298.99200797080994,431.57760739326477,0.8978014423255316,6,-1,-1,llm8_g6,0,
2026-03-03T03:38:45.101257+00:00,BUCKET,llm_style,tune,llm_style_tune_050,1,4096,3072,bf16,NVIDIA GeForce RTX 4060,c01,64,32,32,2,2,8,0.0,0.0,121.23200297355652,198.05248245596886,0.20758399913172468,7,-1,-1,llm8_g7,0,
2026-03-03T03:38:45.138068+00:00,BUCKET,llm_style,tune,llm_style_tune_051,2,4096,2048,bf16,NVIDIA GeForce RTX 4060,c01,64,32,32,2,2,8,0.0,0.0,98.1760025024414,189.5526403188702,0.34177834852427996,7,-1,-1,llm8_g7,0,
2026-03-03T03:38:45.201869+00:00,BUCKET,llm_style,tune,llm_style_tune_052,4,8192,1536,bf16,NVIDIA GeForce RTX 4060,c11,32,128,32,4,2,8,0.0,0.0,63.839998096227646,137.2364743053913,1.5768060620595203,5,-1,-1,llm8_g5,0,
2026-03-03T03:38:45.228427+00:00,BUCKET,llm_style,tune,llm_style_tune_053,1,1536,4096,bf16,NVIDIA GeForce RTX 4060,c01,64,32,32,2,2,8,0.0,0.0,72.51200079917908,159.38560545444486,0.17352868299480784,7,-1,-1,llm8_g7,0,
2026-03-03T03:38:45.480979+00:00,BUCKET,llm_style,tune,llm_style_tune_054,8,8192,6144,bf16,NVIDIA GeForce RTX 4060,c11,32,128,32,4,2,8,0.0,0.0,427.0080029964447,512.3894301056861,1.8859280443198274,4,-1,-1,llm8_g4,0,
2026-03-03T03:38:45.525842+00:00,BUCKET,llm_style,tune,llm_style_tune_055,64,6144,1536,bf16,NVIDIA GeForce RTX 4060,c06,64,128,32,4,3,8,0.0,0.0,90.11200070381165,108.0422393232584,13.405090804391657,1,-1,-1,llm8_g1,0,
2026-03-03T03:38:45.552447+00:00,BUCKET,llm_style,tune,llm_style_tune_056,1,3072,1536,bf16,NVIDIA GeForce RTX 4060,c01,64,32,32,2,2,8,0.0,0.0,69.63200122117996,75.76800294220448,0.1355294093878418,7,-1,-1,llm8_g7,0,
2026-03-03T03:38:45.562721+00:00,BUCKET,llm_style,tune,llm_style_tune_057,64,1024,1024,bf16,NVIDIA GeForce RTX 4060,c00,32,32,32,2,2,8,0.0,0.0,60.19200012087822,163.14752340316767,2.229826683453989,3,-1,-1,llm8_g3,0,
2026-03-03T03:38:45.725100+00:00,BUCKET,llm_style,tune,llm_style_tune_058,16,8192,4096,bf16,NVIDIA GeForce RTX 4060,c11,32,128,32,4,2,8,0.0,0.0,292.86399483680725,304.6502351760864,3.6663497149874007,5,-1,-1,llm8_g5,0,
2026-03-03T03:38:45.851348+00:00,BUCKET,llm_style,tune,llm_style_tune_059,16,4096,6144,bf16,NVIDIA GeForce RTX 4060,c04,64,64,64,4,3,8,0.0,0.0,253.9519965648651,350.0339153409003,3.171096817088053,6,-1,-1,llm8_g6,0,
2026-03-03T03:38:45.973161+00:00,BUCKET,llm_style,tune,llm_style_tune_060,2,3072,8192,bf16,NVIDIA GeForce RTX 4060,c04,64,64,64,4,3,8,0.0,0.0,227.32800245285034,320.4169735312462,0.4428108060329188,6,-1,-1,llm8_g6,0,
2026-03-03T03:38:46.137629+00:00,BUCKET,llm_style,tune,llm_style_tune_061,64,4096,8192,bf16,NVIDIA GeForce RTX 4060,c04,64,64,64,4,3,8,0.0,0.0,302.0800054073334,370.810886323452,14.217979406510347,2,-1,-1,llm8_g2,0,
2026-03-03T03:38:46.200915+00:00,BUCKET,llm_style,tune,llm_style_tune_062,32,4096,3072,bf16,NVIDIA GeForce RTX 4060,c01,64,32,32,2,2,8,0.0,0.0,96.17600217461586,184.64767530560488,8.373256839454573,7,-1,-1,llm8_g7,0,
2026-03-03T03:38:46.325098+00:00,BUCKET,llm_style,tune,llm_style_tune_063,2,3072,8192,bf16,NVIDIA GeForce RTX 4060,c04,64,64,64,4,3,8,0.0,0.0,227.00800001621246,555.6531089544286,0.44343501547439224,6,-1,-1,llm8_g6,0,
2026-03-03T03:38:46.336071+00:00,BUCKET,llm_style,eval,llm_style_eval_000,32,1536,1024,bf16,NVIDIA GeForce RTX 4060,c01,64,32,32,2,2,8,0.0,0.0,62.431998550891876,133.4883209317922,1.6123670287111442,7,-1,-1,llm8_g7,0,
2026-03-03T03:38:46.422833+00:00,BUCKET,llm_style,eval,llm_style_eval_001,32,2048,8192,bf16,NVIDIA GeForce RTX 4060,c04,64,64,64,4,3,8,0.0,0.0,164.86400365829468,180.67264452576637,6.512894265418245,6,-1,-1,llm8_g6,0,
2026-03-03T03:38:46.466142+00:00,BUCKET,llm_style,eval,llm_style_eval_002,16,2048,4096,bf16,NVIDIA GeForce RTX 4060,c01,64,32,32,2,2,8,0.0,0.0,74.68800246715546,149.0432021021843,3.5940907124681276,7,-1,-1,llm8_g7,0,
2026-03-03T03:38:46.480978+00:00,BUCKET,llm_style,eval,llm_style_eval_003,16,2048,1536,bf16,NVIDIA GeForce RTX 4060,c01,64,32,32,2,2,8,0.0,0.0,49.15200173854828,79.61600080132479,2.047999927560491,7,-1,-1,llm8_g7,0,
2026-03-03T03:38:46.566335+00:00,BUCKET,llm_style,eval,llm_style_eval_004,64,8192,2048,bf16,NVIDIA GeForce RTX 4060,c06,64,128,32,4,3,8,0.0,0.0,171.36000096797943,243.7283149361608,12.53200067617461,1,-1,-1,llm8_g1,0,
2026-03-03T03:38:46.698212+00:00,BUCKET,llm_style,eval,llm_style_eval_005,64,3072,8192,bf16,NVIDIA GeForce RTX 4060,c04,64,64,64,4,3,8,0.0,0.0,237.56800591945648,262.0755183696747,13.559172075940662,2,-1,-1,llm8_g2,0,
2026-03-03T03:38:46.718475+00:00,BUCKET,llm_style,eval,llm_style_eval_006,32,2048,2048,bf16,NVIDIA GeForce RTX 4060,c01,64,32,32,2,2,8,0.0,0.0,69.63200122117996,135.95487587153903,3.8550587559208336,7,-1,-1,llm8_g7,0,
2026-03-03T03:38:46.806157+00:00,BUCKET,llm_style,eval,llm_style_eval_007,8,8192,2048,bf16,NVIDIA GeForce RTX 4060,c11,32,128,32,4,2,8,0.0,0.0,165.8879965543747,176.5139226615429,1.6181728731169065,5,-1,-1,llm8_g5,0,
2026-03-03T03:38:46.894409+00:00,BUCKET,llm_style,eval,llm_style_eval_008,64,1536,8192,bf16,NVIDIA GeForce RTX 4060,c04,64,64,64,4,3,8,0.0,0.0,136.19199395179749,186.3884760439396,11.82604563796933,2,-1,-1,llm8_g2,0,
2026-03-03T03:38:47.032079+00:00,BUCKET,llm_style,eval,llm_style_eval_009,64,4096,6144,bf16,NVIDIA GeForce RTX 4060,c04,64,64,64,4,3,8,0.0,0.0,250.88000297546387,340.4800108075141,12.839705970168682,2,-1,-1,llm8_g2,0,
2026-03-03T03:38:47.077924+00:00,BUCKET,llm_style,eval,llm_style_eval_010,64,2048,4096,bf16,NVIDIA GeForce RTX 4060,c00,32,32,32,2,2,8,0.0,0.0,116.70400202274323,148.43967691063878,9.200557010810561,3,-1,-1,llm8_g3,0,
2026-03-03T03:38:47.178814+00:00,BUCKET,llm_style,eval,llm_style_eval_011,32,3072,6144,bf16,NVIDIA GeForce RTX 4060,c04,64,64,64,4,3,8,0.0,0.0,285.5519950389862,350.1705551147461,4.230261293867263,6,-1,-1,llm8_g6,0,
2026-03-03T03:38:47.199755+00:00,BUCKET,llm_style,eval,llm_style_eval_012,16,1536,1536,bf16,NVIDIA GeForce RTX 4060,c01,64,32,32,2,2,8,0.0,0.0,84.78399738669395,182.6815946400165,0.8904684177093143,7,-1,-1,llm8_g7,0,
2026-03-03T03:38:47.232747+00:00,BUCKET,llm_style,eval,llm_style_eval_013,64,2048,3072,bf16,NVIDIA GeForce RTX 4060,c00,32,32,32,2,2,8,0.0,0.0,111.61600053310394,189.60383713245386,7.214972442603836,3,-1,-1,llm8_g3,0,
2026-03-03T03:38:47.504374+00:00,BUCKET,llm_style,eval,llm_style_eval_014,16,8192,6144,bf16,NVIDIA GeForce RTX 4060,c11,32,128,32,4,2,8,0.0,0.0,716.7999744415283,753.0211281776428,2.246948651546559,4,-1,-1,llm8_g4,0,
2026-03-03T03:38:47.549202+00:00,BUCKET,llm_style,eval,llm_style_eval_015,64,6144,1536,bf16,NVIDIA GeForce RTX 4060,c06,64,128,32,4,3,8,0.0,0.0,115.55200070142746,194.30399492382998,10.453817715551484,1,-1,-1,llm8_g1,0,
2026-03-03T03:38:47.642860+00:00,BUCKET,llm_style,eval,llm_style_eval_016,16,4096,4096,bf16,NVIDIA GeForce RTX 4060,c01,64,32,32,2,2,8,0.0,0.0,253.9519965648651,400.33280491828907,2.1140645447253688,7,-1,-1,llm8_g7,0,
2026-03-03T03:38:47.818795+00:00,BUCKET,llm_style,eval,llm_style_eval_017,64,8192,4096,bf16,NVIDIA GeForce RTX 4060,c06,64,128,32,4,3,8,0.0,0.0,487.42400109767914,591.7001575231551,8.81156300536644,1,-1,-1,llm8_g1,0,
2026-03-03T03:38:47.960828+00:00,BUCKET,llm_style,eval,llm_style_eval_018,32,4096,6144,bf16,NVIDIA GeForce RTX 4060,c04,64,64,64,4,3,8,0.0,0.0,401.2320041656494,496.14432960748667,4.014168160262349,6,-1,-1,llm8_g6,0,
2026-03-03T03:38:48.099474+00:00,BUCKET,llm_style,eval,llm_style_eval_019,16,3072,8192,bf16,NVIDIA GeForce RTX 4060,c04,64,64,64,4,3,8,0.0,0.0,366.5439933538437,471.60319954156876,2.197025139142293,6,-1,-1,llm8_g6,0,
2026-03-03T03:38:48.116481+00:00,BUCKET,llm_style,eval,llm_style_eval_020,4,1536,1536,bf16,NVIDIA GeForce RTX 4060,c01,64,32,32,2,2,8,0.0,0.0,67.07200035452843,121.80736303329465,0.28140457866522656,7,-1,-1,llm8_g7,0,
2026-03-03T03:38:48.169987+00:00,BUCKET,llm_style,eval,llm_style_eval_021,4,6144,1536,bf16,NVIDIA GeForce RTX 4060,c11,32,128,32,4,2,8,0.0,0.0,107.51999914646149,212.61312112212178,0.7021714341455576,5,-1,-1,llm8_g5,0,
2026-03-03T03:38:48.200210+00:00,BUCKET,llm_style,eval,llm_style_eval_022,32,6144,1024,bf16,NVIDIA GeForce RTX 4060,c11,32,128,32,4,2,8,0.0,0.0,43.376000598073006,137.73024156689644,9.282856382519693,5,-1,-1,llm8_g5,0,
2026-03-03T03:38:48.212801+00:00,BUCKET,llm_style,eval,llm_style_eval_023,16,1024,1536,bf16,NVIDIA GeForce RTX 4060,c01,64,32,32,2,2,8,0.0,0.0,78.84799689054489,154.86976027488703,0.6383376875111909,7,-1,-1,llm8_g7,0,
2026-03-03T03:38:48.250045+00:00,BUCKET,llm_style,eval,llm_style_eval_024,32,8192,1024,bf16,NVIDIA GeForce RTX 4060,c11,32,128,32,4,2,8,0.0,0.0,90.62400087714195,188.08831632137284,5.924158134750976,5,-1,-1,llm8_g5,0,
2026-03-03T03:38:48.448560+00:00,BUCKET,llm_style,eval,llm_style_eval_025,32,6144,6144,bf16,NVIDIA GeForce RTX 4060,c11,32,128,32,4,2,8,0.0,0.0,513.0240023136139,649.9676942825315,4.709173631457379,4,-1,-1,llm8_g4,0,
2026-03-03T03:38:48.514122+00:00,BUCKET,llm_style,eval,llm_style_eval_026,1,6144,2048,bf16,NVIDIA GeForce RTX 4060,c11,32,128,32,4,2,8,0.0,0.0,103.42399775981903,137.35808134078974,0.24332673794376478,5,-1,-1,llm8_g5,0,
2026-03-03T03:38:48.591654+00:00,BUCKET,llm_style,eval,llm_style_eval_027,32,4096,3072,bf16,NVIDIA GeForce RTX 4060,c01,64,32,32,2,2,8,0.0,0.0,221.18400037288666,242.68800020217896,3.6408888827508368,7,-1,-1,llm8_g7,0,
2026-03-03T03:38:48.606604+00:00,BUCKET,llm_style,eval,llm_style_eval_028,64,1536,1536,bf16,NVIDIA GeForce RTX 4060,c00,32,32,32,2,2,8,0.0,0.0,74.75200295448303,211.97824090719212,4.039890251287093,3,-1,-1,llm8_g3,0,
2026-03-03T03:38:48.622298+00:00,BUCKET,llm_style,eval,llm_style_eval_029,2,3072,1024,bf16,NVIDIA GeForce RTX 4060,c01,64,32,32,2,2,8,0.0,0.0,67.4079991877079,127.22399719059459,0.1866679348390234,7,-1,-1,llm8_g7,0,
2026-03-03T03:38:48.691774+00:00,BUCKET,llm_style,eval,llm_style_eval_030,32,1536,8192,bf16,NVIDIA GeForce RTX 4060,c04,64,64,64,4,3,8,0.0,0.0,201.7280012369156,309.0172725915908,3.9920405846594567,6,-1,-1,llm8_g6,0,
2026-03-03T03:38:48.728043+00:00,BUCKET,llm_style,eval,llm_style_eval_031,8,3072,2048,bf16,NVIDIA GeForce RTX 4060,c01,64,32,32,2,2,8,0.0,0.0,111.61600053310394,244.8352032899855,0.9018715553254795,7,-1,-1,llm8_g7,0,
2026-03-03T03:38:48.760646+00:00,BUCKET,llm_style,eval,llm_style_eval_032,8,2048,3072,bf16,NVIDIA GeForce RTX 4060,c01,64,32,32,2,2,8,0.0,0.0,145.24800330400467,232.68352016806585,0.6930442671167831,7,-1,-1,llm8_g7,0,
2026-03-03T03:38:48.835807+00:00,BUCKET,llm_style,eval,llm_style_eval_033,64,1536,8192,bf16,NVIDIA GeForce RTX 4060,c04,64,64,64,4,3,8,0.0,0.0,208.8959962129593,277.30943322181696,7.710117786834262,2,-1,-1,llm8_g2,0,
2026-03-03T03:38:48.911025+00:00,BUCKET,llm_style,eval,llm_style_eval_034,64,6144,2048,bf16,NVIDIA GeForce RTX 4060,c06,64,128,32,4,3,8,0.0,0.0,193.53599846363068,320.4124906659125,8.3220318120955,1,-1,-1,llm8_g1,0,
2026-03-03T03:38:48.954136+00:00,BUCKET,llm_style,eval,llm_style_eval_035,4,4096,2048,bf16,NVIDIA GeForce RTX 4060,c01,64,32,32,2,2,8,0.0,0.0,177.15199291706085,249.54303801059717,0.3788208243946715,7,-1,-1,llm8_g7,0,
2026-03-03T03:38:49.142560+00:00,BUCKET,llm_style,eval,llm_style_eval_036,64,8192,4096,bf16,NVIDIA GeForce RTX 4060,c06,64,128,32,4,3,8,0.0,0.0,528.3839702606201,645.8879989385605,8.128496581532461,1,-1,-1,llm8_g1,0,
2026-03-03T03:38:49.178835+00:00,BUCKET,llm_style,eval,llm_style_eval_037,32,6144,1024,bf16,NVIDIA GeForce RTX 4060,c11,32,128,32,4,2,8,0.0,0.0,78.22399958968163,185.4534344375133,5.147437948865928,5,-1,-1,llm8_g5,0,
2026-03-03T03:38:49.246482+00:00,BUCKET,llm_style,eval,llm_style_eval_038,64,6144,2048,bf16,NVIDIA GeForce RTX 4060,c06,64,128,32,4,3,8,0.0,0.0,196.49600237607956,207.11487740278244,8.196669227485861,1,-1,-1,llm8_g1,0,
2026-03-03T03:38:49.266646+00:00,BUCKET,llm_style,eval,llm_style_eval_039,8,1024,3072,bf16,NVIDIA GeForce RTX 4060,c01,64,32,32,2,2,8,0.0,0.0,137.64800131320953,147.42464497685432,0.3656547681028324,7,-1,-1,llm8_g7,0,
2026-03-03T03:38:49.354369+00:00,BUCKET,llm_style,eval,llm_style_eval_040,32,8192,2048,bf16,NVIDIA GeForce RTX 4060,c11,32,128,32,4,2,8,0.0,0.0,260.46401262283325,279.51168417930603,4.122419113441362,5,-1,-1,llm8_g5,0,
2026-03-03T03:38:49.372110+00:00,BUCKET,llm_style,eval,llm_style_eval_041,32,3072,1024,bf16,NVIDIA GeForce RTX 4060,c01,64,32,32,2,2,8,0.0,0.0,74.75200295448303,172.11871474981305,2.693260167524729,7,-1,-1,llm8_g7,0,
2026-03-03T03:38:49.396186+00:00,BUCKET,llm_style,eval,llm_style_eval_042,64,1024,4096,bf16,NVIDIA GeForce RTX 4060,c00,32,32,32,2,2,8,0.0,0.0,141.82399958372116,207.0739218592643,3.7854729352987673,3,-1,-1,llm8_g3,0,
2026-03-03T03:38:49.408345+00:00,BUCKET,llm_style,eval,llm_style_eval_043,2,1536,1024,bf16,NVIDIA GeForce RTX 4060,c01,64,32,32,2,2,8,0.0,0.0,73.71200248599052,211.77344039082502,0.0853518529929469,7,-1,-1,llm8_g7,0,
2026-03-03T03:38:49.511960+00:00,BUCKET,llm_style,eval,llm_style_eval_044,64,6144,3072,bf16,NVIDIA GeForce RTX 4060,c06,64,128,32,4,3,8,0.0,0.0,291.7120009660721,358.89087826013565,8.281863948000503,1,-1,-1,llm8_g1,0,
2026-03-03T03:38:49.559879+00:00,BUCKET,llm_style,eval,llm_style_eval_045,64,1536,6144,bf16,NVIDIA GeForce RTX 4060,c04,64,64,64,4,3,8,0.0,0.0,192.51200556755066,234.85375717282287,6.274723222786946,2,-1,-1,llm8_g2,0,
2026-03-03T03:38:49.664925+00:00,BUCKET,llm_style,eval,llm_style_eval_046,2,6144,3072,bf16,NVIDIA GeForce RTX 4060,c11,32,128,32,4,2,8,0.0,0.0,287.7439856529236,343.97184818983067,0.26237723728156376,5,-1,-1,llm8_g5,0,
2026-03-03T03:38:49.850376+00:00,BUCKET,llm_style,eval,llm_style_eval_047,16,4096,8192,bf16,NVIDIA GeForce RTX 4060,c04,64,64,64,4,3,8,0.0,0.0,607.2319746017456,694.3766468763351,1.7682563977369865,6,-1,-1,llm8_g6,0,
2026-03-03T03:38:49.893824+00:00,BUCKET,llm_style,eval,llm_style_eval_048,16,1024,6144,bf16,NVIDIA GeForce RTX 4060,c04,64,64,64,4,3,8,0.0,0.0,192.51200556755066,220.62303915619847,1.0457872037978244,6,-1,-1,llm8_g6,0,
2026-03-03T03:38:49.958683+00:00,BUCKET,llm_style,eval,llm_style_eval_049,16,8192,1536,bf16,NVIDIA GeForce RTX 4060,c11,32,128,32,4,2,8,0.0,0.0,157.1199968457222,214.1145649552345,2.562711253077286,5,-1,-1,llm8_g5,0,
2026-03-03T03:38:49.969486+00:00,BUCKET,llm_style,eval,llm_style_eval_050,1,1024,1024,bf16,NVIDIA GeForce RTX 4060,c01,64,32,32,2,2,8,0.0,0.0,68.60800087451935,208.41151796281304,0.030567163789476794,7,-1,-1,llm8_g7,0,
2026-03-03T03:38:49.997262+00:00,BUCKET,llm_style,eval,llm_style_eval_051,16,6144,1024,bf16,NVIDIA GeForce RTX 4060,c11,32,128,32,4,2,8,0.0,0.0,83.96799862384796,182.3027181625365,2.397658575880606,5,-1,-1,llm8_g5,0,
2026-03-03T03:38:50.365201+00:00,BUCKET,llm_style,eval,llm_style_eval_052,16,8192,8192,bf16,NVIDIA GeForce RTX 4060,c11,32,128,32,4,2,8,0.0,0.0,913.4079813957214,958.6073571443558,2.3510673124604904,4,-1,-1,llm8_g4,0,
2026-03-03T03:38:50.620178+00:00,BUCKET,llm_style,eval,llm_style_eval_053,1,6144,8192,bf16,NVIDIA GeForce RTX 4060,c11,32,128,32,4,2,8,0.0,0.0,697.2640156745911,838.6015993356705,0.14436898181617758,4,-1,-1,llm8_g4,0,
2026-03-03T03:38:50.710461+00:00,BUCKET,llm_style,eval,llm_style_eval_054,64,4096,3072,bf16,NVIDIA GeForce RTX 4060,c00,32,32,32,2,2,8,0.0,0.0,367.0239895582199,496.7219167947769,4.3883037126228865,3,-1,-1,llm8_g3,0,
2026-03-03T03:38:50.748762+00:00,BUCKET,llm_style,eval,llm_style_eval_055,4,8192,1024,bf16,NVIDIA GeForce RTX 4060,c11,32,128,32,4,2,8,0.0,0.0,138.2399946451187,148.32256436347961,0.4854518706563739,5,-1,-1,llm8_g5,0,
2026-03-03T03:38:50.775138+00:00,BUCKET,llm_style,eval,llm_style_eval_056,64,1024,3072,bf16,NVIDIA GeForce RTX 4060,c00,32,32,32,2,2,8,0.0,0.0,139.055997133255,209.616319388151,2.8956189758155078,3,-1,-1,llm8_g3,0,
2026-03-03T03:38:50.785298+00:00,BUCKET,llm_style,eval,llm_style_eval_057,64,1024,3072,bf16,NVIDIA GeForce RTX 4060,c00,32,32,32,2,2,8,0.0,0.0,138.2399946451187,153.59647497534752,2.9127112239382438,3,-1,-1,llm8_g3,0,
2026-03-03T03:38:50.843804+00:00,BUCKET,llm_style,eval,llm_style_eval_058,32,2048,4096,bf16,NVIDIA GeForce RTX 4060,c01,64,32,32,2,2,8,0.0,0.0,261.51999831199646,271.4009550213814,2.052886645248088,7,-1,-1,llm8_g7,0,
2026-03-03T03:38:50.945819+00:00,BUCKET,llm_style,eval,llm_style_eval_059,64,8192,2048,bf16,NVIDIA GeForce RTX 4060,c06,64,128,32,4,3,8,0.0,0.0,395.61599493026733,474.57278519868834,5.428202285851771,1,-1,-1,llm8_g1,0,
2026-03-03T03:38:51.060443+00:00,BUCKET,llm_style,eval,llm_style_eval_060,1,3072,6144,bf16,NVIDIA GeForce RTX 4060,c04,64,64,64,4,3,8,0.0,0.0,411.6480052471161,442.38848090171814,0.0917014913684304,6,-1,-1,llm8_g6,0,
2026-03-03T03:38:51.099015+00:00,BUCKET,llm_style,eval,llm_style_eval_061,64,1536,4096,bf16,NVIDIA GeForce RTX 4060,c00,32,32,32,2,2,8,0.0,0.0,216.0000056028366,348.24543446302414,3.7282701255144057,3,-1,-1,llm8_g3,0,
2026-03-03T03:38:51.170046+00:00,BUCKET,llm_style,eval,llm_style_eval_062,16,6144,2048,bf16,NVIDIA GeForce RTX 4060,c11,32,128,32,4,2,8,0.0,0.0,166.4000004529953,273.402563035488,2.419790762643306,5,-1,-1,llm8_g5,0,
2026-03-03T03:38:51.225582+00:00,BUCKET,llm_style,eval,llm_style_eval_063,64,1536,6144,bf16,NVIDIA GeForce RTX 4060,c04,64,64,64,4,3,8,0.0,0.0,273.4079957008362,284.71296697854996,4.418157372843451,2,-1,-1,llm8_g2,0,
2026-03-03T03:38:51.291366+00:00,BUCKET,llm_style,eval,llm_style_eval_064,1,6144,2048,bf16,NVIDIA GeForce RTX 4060,c11,32,128,32,4,2,8,0.0,0.0,157.18399733304977,170.41695728898048,0.16010423724418538,5,-1,-1,llm8_g5,0,
2026-03-03T03:38:51.353371+00:00,BUCKET,llm_style,eval,llm_style_eval_065,8,1536,6144,bf16,NVIDIA GeForce RTX 4060,c04,64,64,64,4,3,8,0.0,0.0,262.14399933815,288.8089683651924,0.5760000014542601,6,-1,-1,llm8_g6,0,
2026-03-03T03:38:51.388961+00:00,BUCKET,llm_style,eval,llm_style_eval_066,64,1536,4096,bf16,NVIDIA GeForce RTX 4060,c00,32,32,32,2,2,8,0.0,0.0,208.8959962129593,246.1327898502349,3.855058893417131,3,-1,-1,llm8_g3,0,
2026-03-03T03:38:51.489597+00:00,BUCKET,llm_style,eval,llm_style_eval_067,64,8192,2048,bf16,NVIDIA GeForce RTX 4060,c06,64,128,32,4,3,8,0.0,0.0,419.6000099182129,491.60190761089325,5.117930403334787,1,-1,-1,llm8_g1,0,
2026-03-03T03:38:51.519581+00:00,BUCKET,llm_style,eval,llm_style_eval_068,64,1024,4096,bf16,NVIDIA GeForce RTX 4060,c00,32,32,32,2,2,8,0.0,0.0,192.51199811697006,263.09536591172207,2.7887659847247437,3,-1,-1,llm8_g3,0,
2026-03-03T03:38:51.571873+00:00,BUCKET,llm_style,eval,llm_style_eval_069,64,2048,4096,bf16,NVIDIA GeForce RTX 4060,c00,32,32,32,2,2,8,0.0,0.0,297.9840040206909,310.3129532933235,3.6033539032700674,3,-1,-1,llm8_g3,0,
2026-03-03T03:38:51.626324+00:00,BUCKET,llm_style,eval,llm_style_eval_070,64,8192,1024,bf16,NVIDIA GeForce RTX 4060,c06,64,128,32,4,3,8,0.0,0.0,235.31199991703033,330.5369564890861,4.563055961355967,1,-1,-1,llm8_g1,0,
2026-03-03T03:38:51.701440+00:00,BUCKET,llm_style,eval,llm_style_eval_071,64,6144,2048,bf16,NVIDIA GeForce RTX 4060,c06,64,128,32,4,3,8,0.0,0.0,302.047997713089,424.5075252652168,5.332307276308772,1,-1,-1,llm8_g1,0,
2026-03-03T03:38:51.713888+00:00,BUCKET,llm_style,eval,llm_style_eval_072,64,1536,1024,bf16,NVIDIA GeForce RTX 4060,c00,32,32,32,2,2,8,0.0,0.0,80.89599758386612,170.5676817893982,2.488708935090165,3,-1,-1,llm8_g3,0,
2026-03-03T03:38:51.750256+00:00,BUCKET,llm_style,eval,llm_style_eval_073,1,4096,1536,bf16,NVIDIA GeForce RTX 4060,c01,64,32,32,2,2,8,0.0,0.0,225.2800017595291,320.0921529531479,0.05585454501829857,7,-1,-1,llm8_g7,0,
2026-03-03T03:38:51.767648+00:00,BUCKET,llm_style,eval,llm_style_eval_074,8,1024,2048,bf16,NVIDIA GeForce RTX 4060,c01,64,32,32,2,2,8,0.0,0.0,147.88800477981567,174.8275232315063,0.2268908289753304,7,-1,-1,llm8_g7,0,
2026-03-03T03:38:51.794494+00:00,BUCKET,llm_style,eval,llm_style_eval_075,2,6144,1024,bf16,NVIDIA GeForce RTX 4060,c11,32,128,32,4,2,8,0.0,0.0,106.47999867796898,124.86048303544517,0.23634320353543434,5,-1,-1,llm8_g5,0,
2026-03-03T03:38:51.832760+00:00,BUCKET,llm_style,eval,llm_style_eval_076,64,1024,6144,bf16,NVIDIA GeForce RTX 4060,c04,64,64,64,4,3,8,0.0,0.0,274.3519991636276,337.8585624694822,2.9353034439515904,2,-1,-1,llm8_g2,0,
2026-03-03T03:38:52.046642+00:00,BUCKET,llm_style,eval,llm_style_eval_077,1,4096,8192,bf16,NVIDIA GeForce RTX 4060,c04,64,64,64,4,3,8,0.0,0.0,854.0160059928894,968.0998134613035,0.07858033517999281,6,-1,-1,llm8_g6,0,
2026-03-03T03:38:52.164140+00:00,BUCKET,llm_style,eval,llm_style_eval_078,64,6144,3072,bf16,NVIDIA GeForce RTX 4060,c06,64,128,32,4,3,8,0.0,0.0,457.72799849510193,531.4150407910345,5.278067131446958,1,-1,-1,llm8_g1,0,
2026-03-03T03:38:52.238935+00:00,BUCKET,llm_style,eval,llm_style_eval_079,2,3072,4096,bf16,NVIDIA GeForce RTX 4060,c01,64,32,32,2,2,8,0.0,0.0,312.3199939727783,432.6272001862526,0.16115410147064388,7,-1,-1,llm8_g7,0,
2026-03-03T03:38:52.251788+00:00,BUCKET,llm_style,eval,llm_style_eval_080,4,1536,1024,bf16,NVIDIA GeForce RTX 4060,c01,64,32,32,2,2,8,0.0,0.0,93.10400113463402,150.52799880504608,0.13514899302559885,7,-1,-1,llm8_g7,0,
2026-03-03T03:38:52.401656+00:00,BUCKET,llm_style,eval,llm_style_eval_081,4,4096,6144,bf16,NVIDIA GeForce RTX 4060,c04,64,64,64,4,3,8,0.0,0.0,715.7760262489319,790.3161507844923,0.2812703759513494,6,-1,-1,llm8_g6,0,
2026-03-03T03:38:52.437302+00:00,BUCKET,llm_style,eval,llm_style_eval_082,64,6144,1024,bf16,NVIDIA GeForce RTX 4060,c06,64,128,32,4,3,8,0.0,0.0,179.19999361038208,261.3535982370376,4.493897303093118,1,-1,-1,llm8_g1,0,
2026-03-03T03:38:52.548542+00:00,BUCKET,llm_style,eval,llm_style_eval_083,8,4096,4096,bf16,NVIDIA GeForce RTX 4060,c01,64,32,32,2,2,8,0.0,0.0,566.7840242385864,721.4182496070862,0.47361154252823945,7,-1,-1,llm8_g7,0,
2026-03-03T03:38:52.609186+00:00,BUCKET,llm_style,eval,llm_style_eval_084,64,1024,8192,bf16,NVIDIA GeForce RTX 4060,c04,64,64,64,4,3,8,0.0,0.0,389.1200125217438,500.16097217798233,2.7594104375189388,2,-1,-1,llm8_g2,0,
2026-03-03T03:38:52.759223+00:00,BUCKET,llm_style,eval,llm_style_eval_085,1,3072,8192,bf16,NVIDIA GeForce RTX 4060,c04,64,64,64,4,3,8,0.0,0.0,670.7199811935425,748.9827305078505,0.07504122347814225,6,-1,-1,llm8_g6,0,
2026-03-03T03:38:52.776712+00:00,BUCKET,llm_style,eval,llm_style_eval_086,8,1536,1024,bf16,NVIDIA GeForce RTX 4060,c01,64,32,32,2,2,8,0.0,0.0,100.22399947047234,219.65823605656624,0.251095786767263,7,-1,-1,llm8_g7,0,
2026-03-03T03:38:52.804724+00:00,BUCKET,llm_style,eval,llm_style_eval_087,16,1024,3072,bf16,NVIDIA GeForce RTX 4060,c01,64,32,32,2,2,8,0.0,0.0,225.27999430894852,325.58080196380604,0.4468363749243999,7,-1,-1,llm8_g7,0,
2026-03-03T03:38:52.847686+00:00,BUCKET,llm_style,eval,llm_style_eval_088,8,4096,1536,bf16,NVIDIA GeForce RTX 4060,c01,64,32,32,2,2,8,0.0,0.0,243.71199309825897,319.0067198872566,0.41304202850376315,7,-1,-1,llm8_g7,0,
2026-03-03T03:38:52.950472+00:00,BUCKET,llm_style,eval,llm_style_eval_089,16,6144,3072,bf16,NVIDIA GeForce RTX 4060,c11,32,128,32,4,2,8,0.0,0.0,291.7439937591553,335.9743946790695,2.070238938658686,5,-1,-1,llm8_g5,0,
2026-03-03T03:38:52.982862+00:00,BUCKET,llm_style,eval,llm_style_eval_090,32,1536,3072,bf16,NVIDIA GeForce RTX 4060,c01,64,32,32,2,2,8,0.0,0.0,231.83999955654144,336.76287829875935,1.3025788844791226,7,-1,-1,llm8_g7,0,
2026-03-03T03:38:53.015883+00:00,BUCKET,llm_style,eval,llm_style_eval_091,16,1024,4096,bf16,NVIDIA GeForce RTX 4060,c01,64,32,32,2,2,8,0.0,0.0,306.64001405239105,364.72064316272724,0.4377045455557154,7,-1,-1,llm8_g7,0,
2026-03-03T03:38:53.181521+00:00,BUCKET,llm_style,eval,llm_style_eval_092,1,4096,6144,bf16,NVIDIA GeForce RTX 4060,c04,64,64,64,4,3,8,0.0,0.0,758.7839961051941,775.6822341680527,0.06633198414614726,6,-1,-1,llm8_g6,0,
2026-03-03T03:38:53.221634+00:00,BUCKET,llm_style,eval,llm_style_eval_093,32,2048,3072,bf16,NVIDIA GeForce RTX 4060,c01,64,32,32,2,2,8,0.0,0.0,269.82399821281433,376.1439922451972,1.4922808447987688,7,-1,-1,llm8_g7,0,
2026-03-03T03:38:53.242307+00:00,BUCKET,llm_style,eval,llm_style_eval_094,32,1024,2048,bf16,NVIDIA GeForce RTX 4060,c01,64,32,32,2,2,8,0.0,0.0,170.9280014038086,218.3577592670917,0.7852296106997563,7,-1,-1,llm8_g7,0,
2026-03-03T03:38:53.311592+00:00,BUCKET,llm_style,eval,llm_style_eval_095,8,6144,2048,bf16,NVIDIA GeForce RTX 4060,c11,32,128,32,4,2,8,0.0,0.0,198.65599274635315,226.4003254473209,1.0134433359735426,5,-1,-1,llm8_g5,0,
2026-03-03T03:38:53.360260+00:00,BUCKET,llm_style,eval,llm_style_eval_096,64,2048,3072,bf16,NVIDIA GeForce RTX 4060,c00,32,32,32,2,2,8,0.0,0.0,270.83200216293335,309.50080662965763,2.9734535120244963,3,-1,-1,llm8_g3,0,
2026-03-03T03:38:53.394531+00:00,BUCKET,llm_style,eval,llm_style_eval_097,64,6144,1024,bf16,NVIDIA GeForce RTX 4060,c06,64,128,32,4,3,8,0.0,0.0,177.15199291706085,324.351994395256,4.545849892736059,1,-1,-1,llm8_g1,0,
2026-03-03T03:38:53.423488+00:00,BUCKET,llm_style,eval,llm_style_eval_098,32,6144,1024,bf16,NVIDIA GeForce RTX 4060,c11,32,128,32,4,2,8,0.0,0.0,118.78400295972824,211.98847725987434,3.3897930189851655,5,-1,-1,llm8_g5,0,
2026-03-03T03:38:53.451370+00:00,BUCKET,llm_style,eval,llm_style_eval_099,1,2048,2048,bf16,NVIDIA GeForce RTX 4060,c01,64,32,32,2,2,8,0.0,0.0,179.71199750900269,230.7769553363322,0.04667806332506973,7,-1,-1,llm8_g7,0,
2026-03-03T03:38:53.510847+00:00,BUCKET,llm_style,eval,llm_style_eval_100,64,8192,1024,bf16,NVIDIA GeForce RTX 4060,c06,64,128,32,4,3,8,0.0,0.0,279.34400737285614,308.07455986738194,3.843797596011489,1,-1,-1,llm8_g1,0,
2026-03-03T03:38:53.592779+00:00,BUCKET,llm_style,eval,llm_style_eval_101,64,8192,1536,bf16,NVIDIA GeForce RTX 4060,c06,64,128,32,4,3,8,0.0,0.0,398.3359932899475,434.4054341316223,4.043352253201081,1,-1,-1,llm8_g1,0,
2026-03-03T03:38:53.628788+00:00,BUCKET,llm_style,eval,llm_style_eval_102,32,3072,2048,bf16,NVIDIA GeForce RTX 4060,c01,64,32,32,2,2,8,0.0,0.0,194.5120021700859,276.52096420526505,2.070068579356407,7,-1,-1,llm8_g7,0,
2026-03-03T03:38:53.670586+00:00,BUCKET,llm_style,eval,llm_style_eval_103,64,2048,3072,bf16,NVIDIA GeForce RTX 4060,c00,32,32,32,2,2,8,0.0,0.0,251.3280063867569,289.83294636011124,3.204204655014658,3,-1,-1,llm8_g3,0,
2026-03-03T03:38:53.740551+00:00,BUCKET,llm_style,eval,llm_style_eval_104,16,6144,2048,bf16,NVIDIA GeForce RTX 4060,c11,32,128,32,4,2,8,0.0,0.0,201.52000337839127,401.60671710967995,1.9980804746412386,5,-1,-1,llm8_g5,0,
2026-03-03T03:38:53.798455+00:00,BUCKET,llm_style,eval,llm_style_eval_105,1,1024,8192,bf16,NVIDIA GeForce RTX 4060,c04,64,64,64,4,3,8,0.0,0.0,417.1680063009262,562.5139349699018,0.04021692878311879,6,-1,-1,llm8_g6,0,
2026-03-03T03:38:54.015546+00:00,BUCKET,llm_style,eval,llm_style_eval_106,32,4096,8192,bf16,NVIDIA GeForce RTX 4060,c04,64,64,64,4,3,8,0.0,0.0,1084.3679904937744,1122.8671669960022,1.9804011800663064,6,-1,-1,llm8_g6,0,
2026-03-03T03:38:54.096757+00:00,BUCKET,llm_style,eval,llm_style_eval_107,64,6144,1536,bf16,NVIDIA GeForce RTX 4060,c06,64,128,32,4,3,8,0.0,0.0,296.9599962234497,342.8864005208015,4.067751775869037,1,-1,-1,llm8_g1,0,
2026-03-03T03:38:54.130666+00:00,BUCKET,llm_style,eval,llm_style_eval_108,8,3072,1536,bf16,NVIDIA GeForce RTX 4060,c01,64,32,32,2,2,8,0.0,0.0,200.59199631214142,263.6969546973704,0.3763733019662375,7,-1,-1,llm8_g7,0,
2026-03-03T03:38:54.153379+00:00,BUCKET,llm_style,eval,llm_style_eval_109,16,2048,1024,bf16,NVIDIA GeForce RTX 4060,c01,64,32,32,2,2,8,0.0,0.0,140.6880021095276,416.8895903229707,0.47700488310122424,7,-1,-1,llm8_g7,0,
2026-03-03T03:38:54.536255+00:00,BUCKET,llm_style,eval,llm_style_eval_110,1,8192,8192,bf16,NVIDIA GeForce RTX 4060,c11,32,128,32,4,2,8,0.0,0.0,1162.223994731903,1287.7478551864624,0.1154835286557311,4,-1,-1,llm8_g4,0,
2026-03-03T03:38:54.592644+00:00,BUCKET,llm_style,eval,llm_style_eval_111,8,6144,1536,bf16,NVIDIA GeForce RTX 4060,c11,32,128,32,4,2,8,0.0,0.0,165.66400229930878,394.96703475713684,0.9114529523872914,5,-1,-1,llm8_g5,0,
2026-03-03T03:38:54.692798+00:00,BUCKET,llm_style,eval,llm_style_eval_112,2,6144,3072,bf16,NVIDIA GeForce RTX 4060,c11,32,128,32,4,2,8,0.0,0.0,297.9840040206909,398.6841604113576,0.2533608213236766,5,-1,-1,llm8_g5,0,
2026-03-03T03:38:55.049099+00:00,BUCKET,llm_style,eval,llm_style_eval_113,1,8192,8192,bf16,NVIDIA GeForce RTX 4060,c11,32,128,32,4,2,8,0.0,0.0,1165.7119989395142,1295.9846651554105,0.11513798272824009,4,-1,-1,llm8_g4,0,
2026-03-03T03:38:55.075177+00:00,BUCKET,llm_style,eval,llm_style_eval_114,1,3072,1024,bf16,NVIDIA GeForce RTX 4060,c01,64,32,32,2,2,8,0.0,0.0,98.1760025024414,295.53887456655497,0.0640834403483025,7,-1,-1,llm8_g7,0,
2026-03-03T03:38:55.102182+00:00,BUCKET,llm_style,eval,llm_style_eval_115,16,3072,1536,bf16,NVIDIA GeForce RTX 4060,c01,64,32,32,2,2,8,0.0,0.0,147.8080004453659,285.0201669335365,1.021561373843306,7,-1,-1,llm8_g7,0,
2026-03-03T03:38:55.120145+00:00,BUCKET,llm_style,eval,llm_style_eval_116,8,3072,1024,bf16,NVIDIA GeForce RTX 4060,c01,64,32,32,2,2,8,0.0,0.0,113.66400122642517,175.57728692889214,0.4428108060329188,7,-1,-1,llm8_g7,0,
2026-03-03T03:38:55.155222+00:00,BUCKET,llm_style,eval,llm_style_eval_117,4,1024,4096,bf16,NVIDIA GeForce RTX 4060,c01,64,32,32,2,2,8,0.0,0.0,287.7119928598404,391.4943978190421,0.11662507240824724,7,-1,-1,llm8_g7,0,
2026-03-03T03:38:55.275030+00:00,BUCKET,llm_style,eval,llm_style_eval_118,64,6144,3072,bf16,NVIDIA GeForce RTX 4060,c06,64,128,32,4,3,8,0.0,0.0,484.8639965057373,603.0982345342636,4.98267374234996,1,-1,-1,llm8_g1,0,
2026-03-03T03:38:55.586371+00:00,BUCKET,llm_style,eval,llm_style_eval_119,64,8192,6144,bf16,NVIDIA GeForce RTX 4060,c06,64,128,32,4,3,8,0.0,0.0,1378.2399892807007,1510.0415933132172,4.674404308470469,0,-1,-1,llm8_g0,0,
2026-03-03T03:38:55.628077+00:00,BUCKET,llm_style,eval,llm_style_eval_120,8,1024,4096,bf16,NVIDIA GeForce RTX 4060,c01,64,32,32,2,2,8,0.0,0.0,286.20800375938416,315.55584222078323,0.23447584665178897,7,-1,-1,llm8_g7,0,
2026-03-03T03:38:55.649965+00:00,BUCKET,llm_style,eval,llm_style_eval_121,4,1024,2048,bf16,NVIDIA GeForce RTX 4060,c01,64,32,32,2,2,8,0.0,0.0,159.67999398708344,243.8963130116462,0.10506773942737695,7,-1,-1,llm8_g7,0,
2026-03-03T03:38:55.786237+00:00,BUCKET,llm_style,eval,llm_style_eval_122,4,6144,4096,bf16,NVIDIA GeForce RTX 4060,c11,32,128,32,4,2,8,0.0,0.0,364.54400420188904,444.8115170001982,0.5522696565556536,5,-1,-1,llm8_g5,0,
2026-03-03T03:38:55.925920+00:00,BUCKET,llm_style,eval,llm_style_eval_123,4,3072,8192,bf16,NVIDIA GeForce RTX 4060,c04,64,64,64,4,3,8,0.0,0.0,491.007998585701,519.3113791942596,0.41002711275559856,6,-1,-1,llm8_g6,0,
2026-03-03T03:38:55.966030+00:00,BUCKET,llm_style,eval,llm_style_eval_124,64,6144,1024,bf16,NVIDIA GeForce RTX 4060,c06,64,128,32,4,3,8,0.0,0.0,137.07199692726135,253.1328037381172,5.8750611799093,1,-1,-1,llm8_g1,0,
2026-03-03T03:38:56.042848+00:00,BUCKET,llm_style,eval,llm_style_eval_125,64,1536,8192,bf16,NVIDIA GeForce RTX 4060,c04,64,64,64,4,3,8,0.0,0.0,289.23200070858,422.73791790008534,5.568584154084654,2,-1,-1,llm8_g2,0,
2026-03-03T03:38:56.160155+00:00,BUCKET,llm_style,eval,llm_style_eval_126,64,2048,8192,bf16,NVIDIA GeForce RTX 4060,c04,64,64,64,4,3,8,0.0,0.0,511.48802042007446,565.3913724422455,4.198502334886195,2,-1,-1,llm8_g2,0,
2026-03-03T03:38:56.234884+00:00,BUCKET,llm_style,eval,llm_style_eval_127,2,8192,1536,bf16,NVIDIA GeForce RTX 4060,c11,32,128,32,4,2,8,0.0,0.0,205.19999414682388,217.09280267357826,0.24528094266896958,5,-1,-1,llm8_g5,0,
2026-03-03T03:38:56.258135+00:00,BUCKET,llm_style,eval,llm_style_eval_128,8,2048,2048,bf16,NVIDIA GeForce RTX 4060,c01,64,32,32,2,2,8,0.0,0.0,134.5600038766861,180.78112497925747,0.4987281663688128,7,-1,-1,llm8_g7,0,
2026-03-03T03:38:56.542559+00:00,BUCKET,llm_style,eval,llm_style_eval_129,64,8192,6144,bf16,NVIDIA GeForce RTX 4060,c06,64,128,32,4,3,8,0.0,0.0,990.7200038433075,1099.3152260780334,6.502796873998458,0,-1,-1,llm8_g0,0,
2026-03-03T03:38:56.566134+00:00,BUCKET,llm_style,eval,llm_style_eval_130,16,3072,1536,bf16,NVIDIA GeForce RTX 4060,c01,64,32,32,2,2,8,0.0,0.0,108.91199856996536,140.05248636007303,1.386394024373728,7,-1,-1,llm8_g7,0,
2026-03-03T03:38:56.926598+00:00,BUCKET,llm_style,eval,llm_style_eval_131,32,8192,8192,bf16,NVIDIA GeForce RTX 4060,c11,32,128,32,4,2,8,0.0,0.0,919.3920195102692,1016.4838558435439,4.671529885899806,4,-1,-1,llm8_g4,0,
2026-03-03T03:38:57.111379+00:00,BUCKET,llm_style,eval,llm_style_eval_132,32,8192,4096,bf16,NVIDIA GeForce RTX 4060,c11,32,128,32,4,2,8,0.0,0.0,502.78401374816895,527.5443118810654,4.271185219257224,5,-1,-1,llm8_g5,0,
2026-03-03T03:38:57.468030+00:00,BUCKET,llm_style,eval,llm_style_eval_133,2,8192,8192,bf16,NVIDIA GeForce RTX 4060,c11,32,128,32,4,2,8,0.0,0.0,905.7279825210571,1019.9449777603149,0.2963753590264715,4,-1,-1,llm8_g4,0,
2026-03-03T03:38:57.523481+00:00,BUCKET,llm_style,eval,llm_style_eval_134,64,3072,3072,bf16,NVIDIA GeForce RTX 4060,c00,32,32,32,2,2,8,0.0,0.0,304.55999076366425,409.11872059106827,3.966245037541275,3,-1,-1,llm8_g3,0,
2026-03-03T03:38:57.581892+00:00,BUCKET,llm_style,eval,llm_style_eval_135,8,3072,3072,bf16,NVIDIA GeForce RTX 4060,c01,64,32,32,2,2,8,0.0,0.0,221.55199944972992,374.84768301248545,0.6815327524690686,7,-1,-1,llm8_g7,0,
2026-03-03T03:38:57.637289+00:00,BUCKET,llm_style,eval,llm_style_eval_136,4,2048,4096,bf16,NVIDIA GeForce RTX 4060,c01,64,32,32,2,2,8,0.0,0.0,281.48800134658813,393.70561003685,0.23840754731627362,7,-1,-1,llm8_g7,0,
2026-03-03T03:38:57.979780+00:00,BUCKET,llm_style,eval,llm_style_eval_137,4,8192,8192,bf16,NVIDIA GeForce RTX 4060,c11,32,128,32,4,2,8,0.0,0.0,915.3600037097931,1037.9366147518158,0.5865134043700365,4,-1,-1,llm8_g4,0,
2026-03-03T03:38:57.998088+00:00,BUCKET,llm_style,eval,llm_style_eval_138,16,1024,1024,bf16,NVIDIA GeForce RTX 4060,c01,64,32,32,2,2,8,0.0,0.0,97.28000313043594,210.1619234681129,0.34492630468986735,7,-1,-1,llm8_g7,0,
2026-03-03T03:38:58.016323+00:00,BUCKET,llm_style,eval,llm_style_eval_139,4,1024,1024,bf16,NVIDIA GeForce RTX 4060,c01,64,32,32,2,2,8,0.0,0.0,93.18400174379349,149.09152388572687,0.09002197633735688,7,-1,-1,llm8_g7,0,
2026-03-03T03:38:58.175154+00:00,BUCKET,llm_style,eval,llm_style_eval_140,64,4096,6144,bf16,NVIDIA GeForce RTX 4060,c04,64,64,64,4,3,8,0.0,0.0,699.3920207023621,776.0652661323545,4.605750961764041,2,-1,-1,llm8_g2,0,
2026-03-03T03:38:58.315002+00:00,BUCKET,llm_style,eval,llm_style_eval_141,4,6144,4096,bf16,NVIDIA GeForce RTX 4060,c11,32,128,32,4,2,8,0.0,0.0,393.16800236701965,456.8291208148002,0.5120625045475166,5,-1,-1,llm8_g5,0,
2026-03-03T03:38:58.404541+00:00,BUCKET,llm_style,eval,llm_style_eval_142,4,2048,6144,bf16,NVIDIA GeForce RTX 4060,c04,64,64,64,4,3,8,0.0,0.0,494.59201097488403,612.8825545310974,0.20352794579432015,6,-1,-1,llm8_g6,0,
2026-03-03T03:38:58.491789+00:00,BUCKET,llm_style,eval,llm_style_eval_143,64,1536,8192,bf16,NVIDIA GeForce RTX 4060,c04,64,64,64,4,3,8,0.0,0.0,378.81599366664886,417.29024320840836,4.251702047768632,2,-1,-1,llm8_g2,0,
2026-03-03T03:38:58.554575+00:00,BUCKET,llm_style,eval,llm_style_eval_144,1,3072,3072,bf16,NVIDIA GeForce RTX 4060,c01,64,32,32,2,2,8,0.0,0.0,262.9919946193695,353.09377074241627,0.0717678423151892,7,-1,-1,llm8_g7,0,
2026-03-03T03:38:58.575547+00:00,BUCKET,llm_style,eval,llm_style_eval_145,32,1024,2048,bf16,NVIDIA GeForce RTX 4060,c01,64,32,32,2,2,8,0.0,0.0,170.49600183963776,194.78143826127047,0.787219210725189,7,-1,-1,llm8_g7,0,
2026-03-03T03:38:58.784347+00:00,BUCKET,llm_style,eval,llm_style_eval_146,64,8192,4096,bf16,NVIDIA GeForce RTX 4060,c06,64,128,32,4,3,8,0.0,0.0,946.1759924888611,1078.1561660766602,4.539290079324817,1,-1,-1,llm8_g1,0,
2026-03-03T03:38:58.849176+00:00,BUCKET,llm_style,eval,llm_style_eval_147,64,2048,4096,bf16,NVIDIA GeForce RTX 4060,c00,32,32,32,2,2,8,0.0,0.0,343.02400052547455,473.61024022102356,3.1302236063807403,3,-1,-1,llm8_g3,0,
2026-03-03T03:38:58.890938+00:00,BUCKET,llm_style,eval,llm_style_eval_148,64,1024,6144,bf16,NVIDIA GeForce RTX 4060,c04,64,64,64,4,3,8,0.0,0.0,298.2559949159622,322.0412841439247,2.7000509016655516,2,-1,-1,llm8_g2,0,
2026-03-03T03:38:59.091289+00:00,BUCKET,llm_style,eval,llm_style_eval_149,64,4096,8192,bf16,NVIDIA GeForce RTX 4060,c04,64,64,64,4,3,8,0.0,0.0,839.568018913269,967.2396832704544,5.115687114379816,2,-1,-1,llm8_g2,0,
2026-03-03T03:38:59.132709+00:00,BUCKET,llm_style,eval,llm_style_eval_150,2,2048,3072,bf16,NVIDIA GeForce RTX 4060,c01,64,32,32,2,2,8,0.0,0.0,228.35199534893036,242.70848006010056,0.11020628027158547,7,-1,-1,llm8_g7,0,
2026-03-03T03:38:59.185058+00:00,BUCKET,llm_style,eval,llm_style_eval_151,64,4096,2048,bf16,NVIDIA GeForce RTX 4060,c00,32,32,32,2,2,8,0.0,0.0,281.5999984741211,316.53889030218124,3.8130036570247934,3,-1,-1,llm8_g3,0,
2026-03-03T03:38:59.546795+00:00,BUCKET,llm_style,eval,llm_style_eval_152,8,8192,8192,bf16,NVIDIA GeForce RTX 4060,c11,32,128,32,4,2,8,0.0,0.0,899.071991443634,1056.8089592456818,1.1942779156938255,4,-1,-1,llm8_g4,0,
2026-03-03T03:38:59.650116+00:00,BUCKET,llm_style,eval,llm_style_eval_153,64,8192,2048,bf16,NVIDIA GeForce RTX 4060,c06,64,128,32,4,3,8,0.0,0.0,419.840008020401,435.2288129925728,5.115004780334439,1,-1,-1,llm8_g1,0,
2026-03-03T03:38:59.767654+00:00,BUCKET,llm_style,eval,llm_style_eval_154,16,2048,8192,bf16,NVIDIA GeForce RTX 4060,c04,64,64,64,4,3,8,0.0,0.0,563.5519921779633,717.163519859314,0.9526555126265303,6,-1,-1,llm8_g6,0,
2026-03-03T03:38:59.792668+00:00,BUCKET,llm_style,eval,llm_style_eval_155,4,2048,1536,bf16,NVIDIA GeForce RTX 4060,c01,64,32,32,2,2,8,0.0,0.0,105.47199845314026,251.2185631692409,0.23860194524692566,7,-1,-1,llm8_g7,0,
2026-03-03T03:38:59.950549+00:00,BUCKET,llm_style,eval,llm_style_eval_156,1,4096,6144,bf16,NVIDIA GeForce RTX 4060,c04,64,64,64,4,3,8,0.0,0.0,623.6159801483154,737.9046255350113,0.08070936217514753,6,-1,-1,llm8_g6,0,
2026-03-03T03:39:00.033353+00:00,BUCKET,llm_style,eval,llm_style_eval_157,1,1536,8192,bf16,NVIDIA GeForce RTX 4060,c04,64,64,64,4,3,8,0.0,0.0,332.8000009059906,430.74560046195984,0.07561846133260332,6,-1,-1,llm8_g6,0,
2026-03-03T03:39:00.111016+00:00,BUCKET,llm_style,eval,llm_style_eval_158,64,1536,8192,bf16,NVIDIA GeForce RTX 4060,c04,64,64,64,4,3,8,0.0,0.0,330.1120102405548,441.81920021772385,4.878988603978195,2,-1,-1,llm8_g2,0,
2026-03-03T03:39:00.161694+00:00,BUCKET,llm_style,eval,llm_style_eval_159,16,6144,1536,bf16,NVIDIA GeForce RTX 4060,c11,32,128,32,4,2,8,0.0,0.0,128.00000607967377,215.48735350370404,2.3592958879394583,5,-1,-1,llm8_g5,0,
2026-03-03T03:39:00.356820+00:00,BUCKET,llm_style,eval,llm_style_eval_160,32,6144,6144,bf16,NVIDIA GeForce RTX 4060,c11,32,128,32,4,2,8,0.0,0.0,560.1279735565186,582.187180519104,4.313155596675848,4,-1,-1,llm8_g4,0,
2026-03-03T03:39:00.397665+00:00,BUCKET,llm_style,eval,llm_style_eval_161,2,1536,4096,bf16,NVIDIA GeForce RTX 4060,c01,64,32,32,2,2,8,0.0,0.0,269.0400034189224,333.92639368772507,0.09353933868642676,7,-1,-1,llm8_g7,0,
2026-03-03T03:39:00.428493+00:00,BUCKET,llm_style,eval,llm_style_eval_162,64,1536,3072,bf16,NVIDIA GeForce RTX 4060,c00,32,32,32,2,2,8,0.0,0.0,165.26400297880173,234.2435240745544,3.65463600731898,3,-1,-1,llm8_g3,0,
2026-03-03T03:39:00.480353+00:00,BUCKET,llm_style,eval,llm_style_eval_163,64,1024,8192,bf16,NVIDIA GeForce RTX 4060,c04,64,64,64,4,3,8,0.0,0.0,328.70399951934814,440.32033056020737,3.2665919050881445,2,-1,-1,llm8_g2,0,
2026-03-03T03:39:00.683767+00:00,BUCKET,llm_style,eval,llm_style_eval_164,64,4096,8192,bf16,NVIDIA GeForce RTX 4060,c04,64,64,64,4,3,8,0.0,0.0,794.6239709854126,821.1667358875275,5.4050311251922265,2,-1,-1,llm8_g2,0,
2026-03-03T03:39:00.825525+00:00,BUCKET,llm_style,eval,llm_style_eval_165,4,8192,3072,bf16,NVIDIA GeForce RTX 4060,c11,32,128,32,4,2,8,0.0,0.0,367.6159977912903,394.76223587989807,0.5476545993906958,5,-1,-1,llm8_g5,0,
2026-03-03T03:39:00.870612+00:00,BUCKET,llm_style,eval,llm_style_eval_166,64,1024,6144,bf16,NVIDIA GeForce RTX 4060,c04,64,64,64,4,3,8,0.0,0.0,247.80799448490143,274.72703576087946,3.2497190805886857,2,-1,-1,llm8_g2,0,
2026-03-03T03:39:00.884612+00:00,BUCKET,llm_style,eval,llm_style_eval_167,2,2048,1024,bf16,NVIDIA GeForce RTX 4060,c01,64,32,32,2,2,8,0.0,0.0,91.13600105047226,142.57151581346974,0.0920449427592756,7,-1,-1,llm8_g7,0,
2026-03-03T03:39:00.906935+00:00,BUCKET,llm_style,eval,llm_style_eval_168,64,4096,1024,bf16,NVIDIA GeForce RTX 4060,c00,32,32,32,2,2,8,0.0,0.0,146.88000082969666,176.39423996210093,3.655166863884261,3,-1,-1,llm8_g3,0,
2026-03-03T03:39:00.954763+00:00,BUCKET,llm_style,eval,llm_style_eval_169,4,1536,6144,bf16,NVIDIA GeForce RTX 4060,c04,64,64,64,4,3,8,0.0,0.0,248.6719936132431,260.978881418705,0.30360263294233447,6,-1,-1,llm8_g6,0,
2026-03-03T03:39:00.978369+00:00,BUCKET,llm_style,eval,llm_style_eval_170,16,1536,1536,bf16,NVIDIA GeForce RTX 4060,c01,64,32,32,2,2,8,0.0,0.0,109.05599966645241,197.71391987800598,0.6922816922581875,7,-1,-1,llm8_g7,0,
2026-03-03T03:39:01.016618+00:00,BUCKET,llm_style,eval,llm_style_eval_171,1,2048,3072,bf16,NVIDIA GeForce RTX 4060,c01,64,32,32,2,2,8,0.0,0.0,211.96800470352173,253.10208722949017,0.05936231752334337,7,-1,-1,llm8_g7,0,
2026-03-03T03:39:01.053928+00:00,BUCKET,llm_style,eval,llm_style_eval_172,64,3072,2048,bf16,NVIDIA GeForce RTX 4060,c00,32,32,32,2,2,8,0.0,0.0,208.3360031247139,222.09632351994514,3.865421031034796,3,-1,-1,llm8_g3,0,
2026-03-03T03:39:01.384554+00:00,BUCKET,llm_style,eval,llm_style_eval_173,64,8192,6144,bf16,NVIDIA GeForce RTX 4060,c06,64,128,32,4,3,8,0.0,0.0,1092.6079750061035,1262.6432144641876,5.896397510702786,0,-1,-1,llm8_g0,0,
2026-03-03T03:39:01.492013+00:00,BUCKET,llm_style,eval,llm_style_eval_174,2,4096,4096,bf16,NVIDIA GeForce RTX 4060,c01,64,32,32,2,2,8,0.0,0.0,491.5199875831604,615.4281628131866,0.13653333678245552,7,-1,-1,llm8_g7,0,
2026-03-03T03:39:01.539050+00:00,BUCKET,llm_style,eval,llm_style_eval_175,64,4096,2048,bf16,NVIDIA GeForce RTX 4060,c00,32,32,32,2,2,8,0.0,0.0,222.20799326896667,328.2780787348747,4.832147611811216,3,-1,-1,llm8_g3,0,
2026-03-03T03:39:01.607513+00:00,BUCKET,llm_style,eval,llm_style_eval_176,16,6144,2048,bf16,NVIDIA GeForce RTX 4060,c11,32,128,32,4,2,8,0.0,0.0,136.1439973115921,199.58591982722282,2.9575537074796596,5,-1,-1,llm8_g5,0,
2026-03-03T03:39:01.656928+00:00,BUCKET,llm_style,eval,llm_style_eval_177,1,6144,1536,bf16,NVIDIA GeForce RTX 4060,c11,32,128,32,4,2,8,0.0,0.0,102.39999741315842,155.3408039361237,0.18432000465631498,5,-1,-1,llm8_g5,0,
2026-03-03T03:39:01.913002+00:00,BUCKET,llm_style,eval,llm_style_eval_178,32,6144,8192,bf16,NVIDIA GeForce RTX 4060,c11,32,128,32,4,2,8,0.0,0.0,702.2719979286194,830.6278455257416,4.586863040960111,4,-1,-1,llm8_g4,0,
2026-03-03T03:39:02.055224+00:00,BUCKET,llm_style,eval,llm_style_eval_179,64,4096,6144,bf16,NVIDIA GeForce RTX 4060,c04,64,64,64,4,3,8,0.0,0.0,493.5680031776428,583.7705665826797,6.526406596986455,2,-1,-1,llm8_g2,0,
2026-03-03T03:39:02.075046+00:00,BUCKET,llm_style,eval,llm_style_eval_180,64,2048,1536,bf16,NVIDIA GeForce RTX 4060,c00,32,32,32,2,2,8,0.0,0.0,86.5279994904995,169.4828802347183,4.653443814382997,3,-1,-1,llm8_g3,0,
2026-03-03T03:39:02.108802+00:00,BUCKET,llm_style,eval,llm_style_eval_181,64,2048,3072,bf16,NVIDIA GeForce RTX 4060,c00,32,32,32,2,2,8,0.0,0.0,174.52800273895264,281.8764819204806,4.614195747169145,3,-1,-1,llm8_g3,0,
2026-03-03T03:39:02.131458+00:00,BUCKET,llm_style,eval,llm_style_eval_182,32,3072,1536,bf16,NVIDIA GeForce RTX 4060,c01,64,32,32,2,2,8,0.0,0.0,102.38399729132652,203.29120054841036,2.949580950045434,7,-1,-1,llm8_g7,0,
2026-03-03T03:39:02.221643+00:00,BUCKET,llm_style,eval,llm_style_eval_183,8,8192,2048,bf16,NVIDIA GeForce RTX 4060,c11,32,128,32,4,2,8,0.0,0.0,256.00001215934753,374.7532835602759,1.048575950195315,5,-1,-1,llm8_g5,0,
2026-03-03T03:39:02.263309+00:00,BUCKET,llm_style,eval,llm_style_eval_184,64,8192,1024,bf16,NVIDIA GeForce RTX 4060,c06,64,128,32,4,3,8,0.0,0.0,179.19999361038208,283.3203189074992,5.991863070790824,1,-1,-1,llm8_g1,0,
2026-03-03T03:39:02.335482+00:00,BUCKET,llm_style,eval,llm_style_eval_185,1,8192,1536,bf16,NVIDIA GeForce RTX 4060,c11,32,128,32,4,2,8,0.0,0.0,166.9120043516159,397.9059204459189,0.15077300220411838,5,-1,-1,llm8_g5,0,
2026-03-03T03:39:02.362597+00:00,BUCKET,llm_style,eval,llm_style_eval_186,16,6144,1024,bf16,NVIDIA GeForce RTX 4060,c11,32,128,32,4,2,8,0.0,0.0,79.8719972372055,171.03328198194504,2.5206154718041685,5,-1,-1,llm8_g5,0,
2026-03-03T03:39:02.396967+00:00,BUCKET,llm_style,eval,llm_style_eval_187,1,1024,6144,bf16,NVIDIA GeForce RTX 4060,c04,64,64,64,4,3,8,0.0,0.0,197.10400700569153,217.108486443758,0.0638389456975203,6,-1,-1,llm8_g6,0,
2026-03-03T03:39:02.583276+00:00,BUCKET,llm_style,eval,llm_style_eval_188,8,8192,4096,bf16,NVIDIA GeForce RTX 4060,c11,32,128,32,4,2,8,0.0,0.0,502.78401374816895,610.170903801918,1.067796304814306,5,-1,-1,llm8_g5,0,
2026-03-03T03:39:02.691901+00:00,BUCKET,llm_style,eval,llm_style_eval_189,8,2048,8192,bf16,NVIDIA GeForce RTX 4060,c04,64,64,64,4,3,8,0.0,0.0,452.09600031375885,500.39807438850397,0.5937576439820376,6,-1,-1,llm8_g6,0,
2026-03-03T03:39:02.784402+00:00,BUCKET,llm_style,eval,llm_style_eval_190,4,8192,2048,bf16,NVIDIA GeForce RTX 4060,c11,32,128,32,4,2,8,0.0,0.0,253.4399926662445,425.9123262763022,0.5295838537083274,5,-1,-1,llm8_g5,0,
2026-03-03T03:39:03.130463+00:00,BUCKET,llm_style,eval,llm_style_eval_191,4,8192,8192,bf16,NVIDIA GeForce RTX 4060,c11,32,128,32,4,2,8,0.0,0.0,910.7040166854858,969.8713529109955,0.5895119623540761,4,-1,-1,llm8_g4,0,
2026-03-03T03:39:03.142626+00:00,BUCKET,llm_style,eval,llm_style_eval_192,64,1536,1024,bf16,NVIDIA GeForce RTX 4060,c00,32,32,32,2,2,8,0.0,0.0,61.95199862122536,123.94976079463957,3.2497190805886857,3,-1,-1,llm8_g3,0,
2026-03-03T03:39:03.166514+00:00,BUCKET,llm_style,eval,llm_style_eval_193,32,2048,2048,bf16,NVIDIA GeForce RTX 4060,c01,64,32,32,2,2,8,0.0,0.0,131.071999669075,273.49952310323715,2.048000005170703,7,-1,-1,llm8_g7,0,
2026-03-03T03:39:03.182659+00:00,BUCKET,llm_style,eval,llm_style_eval_194,8,1024,2048,bf16,NVIDIA GeForce RTX 4060,c01,64,32,32,2,2,8,0.0,0.0,120.68800255656242,176.2918400764465,0.27802624361335476,7,-1,-1,llm8_g7,0,
2026-03-03T03:39:03.228559+00:00,BUCKET,llm_style,eval,llm_style_eval_195,2,4096,2048,bf16,NVIDIA GeForce RTX 4060,c01,64,32,32,2,2,8,0.0,0.0,218.49600225687027,291.6803252696989,0.1535700042719886,7,-1,-1,llm8_g7,0,
2026-03-03T03:39:03.283683+00:00,BUCKET,llm_style,eval,llm_style_eval_196,32,2048,4096,bf16,NVIDIA GeForce RTX 4060,c01,64,32,32,2,2,8,0.0,0.0,226.30399465560913,271.4444851875304,2.3723439474279435,7,-1,-1,llm8_g7,0,
2026-03-03T03:39:03.354040+00:00,BUCKET,llm_style,eval,llm_style_eval_197,32,8192,1536,bf16,NVIDIA GeForce RTX 4060,c11,32,128,32,4,2,8,0.0,0.0,152.5759994983673,245.5654372274875,5.278067131446958,5,-1,-1,llm8_g5,0,
2026-03-03T03:39:03.547761+00:00,BUCKET,llm_style,eval,llm_style_eval_198,64,4096,8192,bf16,NVIDIA GeForce RTX 4060,c04,64,64,64,4,3,8,0.0,0.0,620.5440163612366,637.4707156419754,6.921293546886408,2,-1,-1,llm8_g2,0,
2026-03-03T03:39:03.725012+00:00,BUCKET,llm_style,eval,llm_style_eval_199,2,8192,4096,bf16,NVIDIA GeForce RTX 4060,c11,32,128,32,4,2,8,0.0,0.0,474.11200404167175,577.4774557352065,0.2830928701569071,5,-1,-1,llm8_g5,0,
2026-03-03T03:39:03.749469+00:00,BUCKET,llm_style,eval,llm_style_eval_200,1,4096,1024,bf16,NVIDIA GeForce RTX 4060,c01,64,32,32,2,2,8,0.0,0.0,104.44799810647964,379.39200043678215,0.08031372694619023,7,-1,-1,llm8_g7,0,
2026-03-03T03:39:03.821329+00:00,BUCKET,llm_style,eval,llm_style_eval_201,4,1536,8192,bf16,NVIDIA GeForce RTX 4060,c04,64,64,64,4,3,8,0.0,0.0,246.7840015888214,332.76927709579456,0.4079004123116534,6,-1,-1,llm8_g6,0,
2026-03-03T03:39:03.926313+00:00,BUCKET,llm_style,eval,llm_style_eval_202,1,6144,3072,bf16,NVIDIA GeForce RTX 4060,c11,32,128,32,4,2,8,0.0,0.0,281.5999984741211,369.1404742002487,0.13405090981727788,5,-1,-1,llm8_g5,0,
2026-03-03T03:39:04.002966+00:00,BUCKET,llm_style,eval,llm_style_eval_203,16,2048,6144,bf16,NVIDIA GeForce RTX 4060,c04,64,64,64,4,3,8,0.0,0.0,318.86400282382965,397.998084127903,1.26277403668693,6,-1,-1,llm8_g6,0,
2026-03-03T03:39:04.014555+00:00,BUCKET,llm_style,eval,llm_style_eval_204,16,1536,1024,bf16,NVIDIA GeForce RTX 4060,c01,64,32,32,2,2,8,0.0,0.0,78.84799689054489,149.38336104154587,0.6383376875111909,7,-1,-1,llm8_g7,0,
2026-03-03T03:39:04.088296+00:00,BUCKET,llm_style,eval,llm_style_eval_205,64,6144,2048,bf16,NVIDIA GeForce RTX 4060,c06,64,128,32,4,3,8,0.0,0.0,213.84000033140182,320.41823983192444,7.531859023119754,1,-1,-1,llm8_g1,0,
2026-03-03T03:39:04.166727+00:00,BUCKET,llm_style,eval,llm_style_eval_206,4,2048,6144,bf16,NVIDIA GeForce RTX 4060,c04,64,64,64,4,3,8,0.0,0.0,316.4159953594208,423.94016563892365,0.3181359269959009,6,-1,-1,llm8_g6,0,
2026-03-03T03:39:04.224600+00:00,BUCKET,llm_style,eval,llm_style_eval_207,32,6144,1536,bf16,NVIDIA GeForce RTX 4060,c11,32,128,32,4,2,8,0.0,0.0,106.49599879980087,182.28639796376228,5.671384679300546,5,-1,-1,llm8_g5,0,
2026-03-03T03:39:04.241275+00:00,BUCKET,llm_style,eval,llm_style_eval_208,4,2048,1024,bf16,NVIDIA GeForce RTX 4060,c01,64,32,32,2,2,8,0.0,0.0,80.89599758386612,131.30975924432272,0.20739241125751373,7,-1,-1,llm8_g7,0,
2026-03-03T03:39:04.253110+00:00,BUCKET,llm_style,eval,llm_style_eval_209,1,1024,1536,bf16,NVIDIA GeForce RTX 4060,c01,64,32,32,2,2,8,0.0,0.0,84.89599823951721,163.37919935584068,0.03705390201225919,7,-1,-1,llm8_g7,0,
2026-03-03T03:39:04.390141+00:00,BUCKET,llm_style,eval,llm_style_eval_210,8,6144,4096,bf16,NVIDIA GeForce RTX 4060,c11,32,128,32,4,2,8,0.0,0.0,361.4400029182434,446.90912932157494,1.1140249578049026,5,-1,-1,llm8_g5,0,
2026-03-03T03:39:04.493523+00:00,BUCKET,llm_style,eval,llm_style_eval_211,4,2048,8192,bf16,NVIDIA GeForce RTX 4060,c04,64,64,64,4,3,8,0.0,0.0,416.48000478744507,470.70208668708796,0.3222669190769421,6,-1,-1,llm8_g6,0,
2026-03-03T03:39:04.513628+00:00,BUCKET,llm_style,eval,llm_style_eval_212,32,1024,1024,bf16,NVIDIA GeForce RTX 4060,c01,64,32,32,2,2,8,0.0,0.0,80.89599758386612,235.31520500779135,0.8295696450300549,7,-1,-1,llm8_g7,0,
2026-03-03T03:39:04.591665+00:00,BUCKET,llm_style,eval,llm_style_eval_213,16,3072,4096,bf16,NVIDIA GeForce RTX 4060,c01,64,32,32,2,2,8,0.0,0.0,217.0559987425804,339.2268824577331,1.8550659107907463,7,-1,-1,llm8_g7,0,
2026-03-03T03:39:04.657710+00:00,BUCKET,llm_style,eval,llm_style_eval_214,64,1024,8192,bf16,NVIDIA GeForce RTX 4060,c04,64,64,64,4,3,8,0.0,0.0,249.27999824285507,413.88032585382456,4.307372559245338,2,-1,-1,llm8_g2,0,
2026-03-03T03:39:04.694288+00:00,BUCKET,llm_style,eval,llm_style_eval_215,4,4096,1536,bf16,NVIDIA GeForce RTX 4060,c01,64,32,32,2,2,8,0.0,0.0,159.743994474411,292.6361684501169,0.31507693397552106,7,-1,-1,llm8_g7,0,
2026-03-03T03:39:04.724039+00:00,BUCKET,llm_style,eval,llm_style_eval_216,16,1536,3072,bf16,NVIDIA GeForce RTX 4060,c01,64,32,32,2,2,8,0.0,0.0,152.5759994983673,162.33471900224686,0.9896375871463047,7,-1,-1,llm8_g7,0,
2026-03-03T03:39:04.788334+00:00,BUCKET,llm_style,eval,llm_style_eval_217,8,6144,2048,bf16,NVIDIA GeForce RTX 4060,c11,32,128,32,4,2,8,0.0,0.0,103.42399775981903,134.16927680373192,1.9466139035501182,5,-1,-1,llm8_g5,0,
2026-03-03T03:39:04.856567+00:00,BUCKET,llm_style,eval,llm_style_eval_218,8,3072,4096,bf16,NVIDIA GeForce RTX 4060,c01,64,32,32,2,2,8,0.0,0.0,212.99199759960175,260.4115259647369,0.9452307798834243,7,-1,-1,llm8_g7,0,
2026-03-03T03:39:04.996367+00:00,BUCKET,llm_style,eval,llm_style_eval_219,64,8192,3072,bf16,NVIDIA GeForce RTX 4060,c06,64,128,32,4,3,8,0.0,0.0,437.1839910745621,559.7081595659256,7.368123119244358,1,-1,-1,llm8_g1,0,
2026-03-03T03:39:05.049070+00:00,BUCKET,llm_style,eval,llm_style_eval_220,2,4096,2048,bf16,NVIDIA GeForce RTX 4060,c01,64,32,32,2,2,8,0.0,0.0,196.60800695419312,204.33919832110405,0.17066666063004093,7,-1,-1,llm8_g7,0,
2026-03-03T03:39:05.108961+00:00,BUCKET,llm_style,eval,llm_style_eval_221,4,1024,8192,bf16,NVIDIA GeForce RTX 4060,c04,64,64,64,4,3,8,0.0,0.0,354.3039858341217,366.0950371623039,0.18941041219733576,6,-1,-1,llm8_g6,0,
2026-03-03T03:39:05.190022+00:00,BUCKET,llm_style,eval,llm_style_eval_222,64,6144,2048,bf16,NVIDIA GeForce RTX 4060,c06,64,128,32,4,3,8,0.0,0.0,309.2480003833771,322.976316511631,5.208158933940757,1,-1,-1,llm8_g1,0,
2026-03-03T03:39:05.217541+00:00,BUCKET,llm_style,eval,llm_style_eval_223,4,2048,2048,bf16,NVIDIA GeForce RTX 4060,c01,64,32,32,2,2,8,0.0,0.0,167.93599724769592,204.39040184020985,0.19980488132338384,7,-1,-1,llm8_g7,0,
2026-03-03T03:39:05.243520+00:00,BUCKET,llm_style,eval,llm_style_eval_224,16,3072,1536,bf16,NVIDIA GeForce RTX 4060,c01,64,32,32,2,2,8,0.0,0.0,140.22399485111237,224.88063782453537,1.0768124539621344,7,-1,-1,llm8_g7,0,
2026-03-03T03:39:05.275136+00:00,BUCKET,llm_style,eval,llm_style_eval_225,1,2048,2048,bf16,NVIDIA GeForce RTX 4060,c01,64,32,32,2,2,8,0.0,0.0,168.8160002231598,233.50528359413144,0.04969083492625701,7,-1,-1,llm8_g7,0,
2026-03-03T03:39:05.287058+00:00,BUCKET,llm_style,eval,llm_style_eval_226,8,1536,1024,bf16,NVIDIA GeForce RTX 4060,c01,64,32,32,2,2,8,0.0,0.0,88.43199908733368,104.44799810647964,0.2845782551533946,7,-1,-1,llm8_g7,0,
2026-03-03T03:39:05.515119+00:00,BUCKET,llm_style,eval,llm_style_eval_227,64,6144,6144,bf16,NVIDIA GeForce RTX 4060,c06,64,128,32,4,3,8,0.0,0.0,874.9760091304779,942.4077010154723,5.52225221900852,0,-1,-1,llm8_g0,0,
2026-03-03T03:39:05.599828+00:00,BUCKET,llm_style,eval,llm_style_eval_228,64,6144,2048,bf16,NVIDIA GeForce RTX 4060,c06,64,128,32,4,3,8,0.0,0.0,328.67200672626495,424.6425583958626,4.900364810628371,1,-1,-1,llm8_g1,0,
2026-03-03T03:39:05.683384+00:00,BUCKET,llm_style,eval,llm_style_eval_229,16,1536,8192,bf16,NVIDIA GeForce RTX 4060,c04,64,64,64,4,3,8,0.0,0.0,377.20000743865967,429.0457597374915,1.0674792578456656,6,-1,-1,llm8_g6,0,
2026-03-03T03:39:05.707497+00:00,BUCKET,llm_style,eval,llm_style_eval_230,64,2048,1536,bf16,NVIDIA GeForce RTX 4060,c00,32,32,32,2,2,8,0.0,0.0,122.8799968957901,200.8268807828426,3.276800082778933,3,-1,-1,llm8_g3,0,
2026-03-03T03:39:05.770723+00:00,BUCKET,llm_style,eval,llm_style_eval_231,4,1024,8192,bf16,NVIDIA GeForce RTX 4060,c04,64,64,64,4,3,8,0.0,0.0,377.29600071907043,501.76000595092773,0.17786794419262442,6,-1,-1,llm8_g6,0,
2026-03-03T03:39:05.799570+00:00,BUCKET,llm_style,eval,llm_style_eval_232,16,3072,1536,bf16,NVIDIA GeForce RTX 4060,c01,64,32,32,2,2,8,0.0,0.0,142.71999895572662,305.5513700842855,1.057980276799472,7,-1,-1,llm8_g7,0,
2026-03-03T03:39:05.868042+00:00,BUCKET,llm_style,eval,llm_style_eval_233,64,3072,3072,bf16,NVIDIA GeForce RTX 4060,c00,32,32,32,2,2,8,0.0,0.0,339.9679958820343,488.80893796682346,3.5531566695447134,3,-1,-1,llm8_g3,0,
2026-03-03T03:39:06.045192+00:00,BUCKET,llm_style,eval,llm_style_eval_234,32,8192,4096,bf16,NVIDIA GeForce RTX 4060,c11,32,128,32,4,2,8,0.0,0.0,533.3920121192932,565.2684926986694,4.026088878735805,5,-1,-1,llm8_g5,0,
2026-03-03T03:39:06.062068+00:00,BUCKET,llm_style,eval,llm_style_eval_235,4,2048,1024,bf16,NVIDIA GeForce RTX 4060,c01,64,32,32,2,2,8,0.0,0.0,109.05599966645241,255.44928401708583,0.153840376057375,7,-1,-1,llm8_g7,0,
2026-03-03T03:39:06.206798+00:00,BUCKET,llm_style,eval,llm_style_eval_236,4,8192,3072,bf16,NVIDIA GeForce RTX 4060,c11,32,128,32,4,2,8,0.0,0.0,426.86399817466736,461.9878399372101,0.47164106802377764,5,-1,-1,llm8_g5,0,
2026-03-03T03:39:06.240281+00:00,BUCKET,llm_style,eval,llm_style_eval_237,64,1024,4096,bf16,NVIDIA GeForce RTX 4060,c00,32,32,32,2,2,8,0.0,0.0,225.77600181102753,312.18686997890467,2.3778918383423058,3,-1,-1,llm8_g3,0,
2026-03-03T03:39:06.335340+00:00,BUCKET,llm_style,eval,llm_style_eval_238,32,2048,6144,bf16,NVIDIA GeForce RTX 4060,c04,64,64,64,4,3,8,0.0,0.0,549.807995557785,659.9987083673477,1.4647047232971024,6,-1,-1,llm8_g6,0,
2026-03-03T03:39:06.371385+00:00,BUCKET,llm_style,eval,llm_style_eval_239,32,2048,6144,bf16,NVIDIA GeForce RTX 4060,c04,64,64,64,4,3,8,0.0,0.0,552.3519814014435,786.7801576852798,1.4579586841650378,6,-1,-1,llm8_g6,0,
2026-03-03T03:39:06.449908+00:00,BUCKET,llm_style,eval,llm_style_eval_240,8,8192,1536,bf16,NVIDIA GeForce RTX 4060,c11,32,128,32,4,2,8,0.0,0.0,258.4480047225952,306.43872201442707,0.7789829610644261,5,-1,-1,llm8_g5,0,
2026-03-03T03:39:06.468217+00:00,BUCKET,llm_style,eval,llm_style_eval_241,16,1536,1536,bf16,NVIDIA GeForce RTX 4060,c01,64,32,32,2,2,8,0.0,0.0,134.5919966697693,203.20927321910858,0.5609358198707627,7,-1,-1,llm8_g7,0,
2026-03-03T03:39:06.504833+00:00,BUCKET,llm_style,eval,llm_style_eval_242,1,2048,3072,bf16,NVIDIA GeForce RTX 4060,c01,64,32,32,2,2,8,0.0,0.0,250.86399912834167,324.04831707477547,0.050158301086329245,7,-1,-1,llm8_g7,0,
2026-03-03T03:39:06.558413+00:00,BUCKET,llm_style,eval,llm_style_eval_243,8,1536,6144,bf16,NVIDIA GeForce RTX 4060,c04,64,64,64,4,3,8,0.0,0.0,292.2239899635315,304.63456600904465,0.5167096103877153,6,-1,-1,llm8_g6,0,
2026-03-03T03:39:06.610696+00:00,BUCKET,llm_style,eval,llm_style_eval_244,32,8192,1024,bf16,NVIDIA GeForce RTX 4060,c11,32,128,32,4,2,8,0.0,0.0,165.71199893951416,318.89407604932774,3.2397829694635507,5,-1,-1,llm8_g5,0,
2026-03-03T03:39:06.742697+00:00,BUCKET,llm_style,eval,llm_style_eval_245,4,6144,4096,bf16,NVIDIA GeForce RTX 4060,c11,32,128,32,4,2,8,0.0,0.0,368.1280016899109,393.40031892061234,0.5468929043044803,5,-1,-1,llm8_g5,0,
2026-03-03T03:39:06.835479+00:00,BUCKET,llm_style,eval,llm_style_eval_246,32,2048,6144,bf16,NVIDIA GeForce RTX 4060,c04,64,64,64,4,3,8,0.0,0.0,499.6800124645233,612.2422564029694,1.611644148078018,6,-1,-1,llm8_g6,0,
2026-03-03T03:39:06.917939+00:00,BUCKET,llm_style,eval,llm_style_eval_247,64,6144,2048,bf16,NVIDIA GeForce RTX 4060,c06,64,128,32,4,3,8,0.0,0.0,329.6160101890564,427.39712297916407,4.886330415431605,1,-1,-1,llm8_g1,0,
2026-03-03T03:39:06.931334+00:00,BUCKET,llm_style,eval,llm_style_eval_248,64,1024,1024,bf16,NVIDIA GeForce RTX 4060,c00,32,32,32,2,2,8,0.0,0.0,62.46400065720081,122.6336002349853,2.1487212888681255,3,-1,-1,llm8_g3,0,
2026-03-03T03:39:06.984907+00:00,BUCKET,llm_style,eval,llm_style_eval_249,2,8192,1024,bf16,NVIDIA GeForce RTX 4060,c11,32,128,32,4,2,8,0.0,0.0,168.41600090265274,251.9449558854103,0.19923541599467748,5,-1,-1,llm8_g5,0,
2026-03-03T03:39:07.055965+00:00,BUCKET,llm_style,eval,llm_style_eval_250,64,3072,3072,bf16,NVIDIA GeForce RTX 4060,c00,32,32,32,2,2,8,0.0,0.0,347.00798988342285,474.23486918210983,3.4810712929284806,3,-1,-1,llm8_g3,0,
2026-03-03T03:39:07.121557+00:00,BUCKET,llm_style,eval,llm_style_eval_251,64,1024,8192,bf16,NVIDIA GeForce RTX 4060,c04,64,64,64,4,3,8,0.0,0.0,381.9519877433777,403.476482629776,2.8111958006654376,2,-1,-1,llm8_g2,0,
2026-03-03T03:39:07.208388+00:00,BUCKET,llm_style,eval,llm_style_eval_252,64,4096,3072,bf16,NVIDIA GeForce RTX 4060,c00,32,32,32,2,2,8,0.0,0.0,453.6319971084595,556.093442440033,3.5504830926089115,3,-1,-1,llm8_g3,0,
2026-03-03T03:39:07.361038+00:00,BUCKET,llm_style,eval,llm_style_eval_253,8,6144,4096,bf16,NVIDIA GeForce RTX 4060,c11,32,128,32,4,2,8,0.0,0.0,390.5919939279556,504.7030502557753,1.0308792557439594,5,-1,-1,llm8_g5,0,
2026-03-03T03:39:07.397544+00:00,BUCKET,llm_style,eval,llm_style_eval_254,4,1536,3072,bf16,NVIDIA GeForce RTX 4060,c01,64,32,32,2,2,8,0.0,0.0,242.01600253582,312.1356812119482,0.15597619828636303,7,-1,-1,llm8_g7,0,
2026-03-03T03:39:07.425997+00:00,BUCKET,llm_style,eval,llm_style_eval_255,1,3072,1536,bf16,NVIDIA GeForce RTX 4060,c01,64,32,32,2,2,8,0.0,0.0,121.61600217223167,254.9862329661845,0.07759820937572945,7,-1,-1,llm8_g7,0,
