results/llm_full_vs_bucket_v3.csv
timestamp,method,workload,split,shape_id,M,N,K,dtype,gpu,config_id,BLOCK_M,BLOCK_N,BLOCK_K,num_warps,num_stages,GROUP_M,compile_time_ms,tune_time_ms,runtime_cost_us,p99_us,runtime_perf_tflops,bucket_m,bucket_n,bucket_k,cache_key,invalid_config,notes
2026-03-03T03:12:19.148563+00:00,FULL,llm_style,tune,llm_style_tune_000,32,3072,2048,bf16,NVIDIA GeForce RTX 4060,c02,32,64,32,2,2,8,0.7250589551404119,505.307,54.27199974656105,75.77375799417491,7.419169845966734,3,-1,-1,32x3072x2048,0,
2026-03-03T03:12:19.259117+00:00,FULL,llm_style,tune,llm_style_tune_001,4,4096,1536,bf16,NVIDIA GeForce RTX 4060,c11,32,128,32,4,2,8,0.0,110.524,50.175998359918594,76.02239958941931,1.0031020736042942,6,-1,-1,4x4096x1536,0,
2026-03-03T03:12:19.365528+00:00,FULL,llm_style,tune,llm_style_tune_002,8,8192,1024,bf16,NVIDIA GeForce RTX 4060,c11,32,128,32,4,2,8,0.0,106.38,53.247999399900436,94.42304383963332,2.520615413022465,4,-1,-1,8x8192x1024,0,
2026-03-03T03:12:19.441368+00:00,FULL,llm_style,tune,llm_style_tune_003,64,4096,1024,bf16,NVIDIA GeForce RTX 4060,c04,64,64,64,4,3,8,0.0,75.8,50.175998359918594,57.24384155124425,10.699755451779136,2,-1,-1,64x4096x1024,0,
2026-03-03T03:12:19.597939+00:00,FULL,llm_style,tune,llm_style_tune_004,16,3072,4096,bf16,NVIDIA GeForce RTX 4060,c04,64,64,64,4,3,8,0.0,156.529,89.51999992132187,214.07392054796216,4.497913140682389,7,-1,-1,16x3072x4096,0,
2026-03-03T03:12:19.704244+00:00,FULL,llm_style,tune,llm_style_tune_005,16,1536,4096,bf16,NVIDIA GeForce RTX 4060,c04,64,64,64,4,3,8,0.0,106.267,62.24000081419945,81.64768137037748,3.234681705757133,7,-1,-1,16x1536x4096,0,
2026-03-03T03:12:19.762202+00:00,FULL,llm_style,tune,llm_style_tune_006,2,2048,1024,bf16,NVIDIA GeForce RTX 4060,c00,32,32,32,2,2,8,0.0,57.92,36.86400130391121,103.41888047754762,0.22755554750672122,7,-1,-1,2x2048x1024,0,
2026-03-03T03:12:19.844695+00:00,FULL,llm_style,tune,llm_style_tune_007,32,6144,1024,bf16,NVIDIA GeForce RTX 4060,c11,32,128,32,4,2,8,0.0,82.455,40.95999896526337,45.076480358839035,9.8304002483368,0,-1,-1,32x6144x1024,0,
2026-03-03T03:12:19.912426+00:00,FULL,llm_style,tune,llm_style_tune_008,8,1536,2048,bf16,NVIDIA GeForce RTX 4060,c04,64,64,64,4,3,8,0.0,67.694,41.98399931192398,131.76831960678086,1.198829287940303,7,-1,-1,8x1536x2048,0,
2026-03-03T03:12:20.039949+00:00,FULL,llm_style,tune,llm_style_tune_009,16,1024,6144,bf16,NVIDIA GeForce RTX 4060,c04,64,64,64,4,3,8,0.0,127.487,73.72800260782242,102.59871959686271,2.730666570080655,7,-1,-1,16x1024x6144,0,
2026-03-03T03:12:20.104595+00:00,FULL,llm_style,tune,llm_style_tune_010,64,1536,2048,bf16,NVIDIA GeForce RTX 4060,c04,64,64,64,4,3,8,0.0,64.604,41.98399931192398,60.05759980529544,9.590634303522425,3,-1,-1,64x1536x2048,0,
2026-03-03T03:12:20.208564+00:00,FULL,llm_style,tune,llm_style_tune_011,64,1536,4096,bf16,NVIDIA GeForce RTX 4060,c04,64,64,64,4,3,8,0.0,103.932,61.37600168585777,124.9689571559427,13.120867209985729,3,-1,-1,64x1536x4096,0,
2026-03-03T03:12:20.279432+00:00,FULL,llm_style,tune,llm_style_tune_012,32,1024,2048,bf16,NVIDIA GeForce RTX 4060,c04,64,64,64,4,3,8,0.0,70.83,48.08000102639198,65.13664152473208,2.7915500236018183,3,-1,-1,32x1024x2048,0,
2026-03-03T03:12:20.330535+00:00,FULL,llm_style,tune,llm_style_tune_013,64,1536,1024,bf16,NVIDIA GeForce RTX 4060,c04,64,64,64,4,3,8,0.0,51.064,36.86400130391121,43.42431873083113,5.46133314016131,3,-1,-1,64x1536x1024,0,
2026-03-03T03:12:20.562060+00:00,FULL,llm_style,tune,llm_style_tune_014,4,6144,3072,bf16,NVIDIA GeForce RTX 4060,c11,32,128,32,4,2,8,0.0,231.483,176.86400562524796,191.86336383223534,0.8537347294957168,5,-1,-1,4x6144x3072,0,
2026-03-03T03:12:20.656466+00:00,FULL,llm_style,tune,llm_style_tune_015,1,6144,1024,bf16,NVIDIA GeForce RTX 4060,c11,32,128,32,4,2,8,0.0,94.368,39.93599861860275,67.64544054865836,0.31507693397552106,4,-1,-1,1x6144x1024,0,
2026-03-03T03:12:21.055104+00:00,FULL,llm_style,tune,llm_style_tune_016,4,8192,4096,bf16,NVIDIA GeForce RTX 4060,c11,32,128,32,4,2,8,0.0,398.606,295.4239994287491,466.66142582893343,0.9086447157951424,5,-1,-1,4x8192x4096,0,
2026-03-03T03:12:21.075561+00:00,FULL,llm_style,tune,llm_style_tune_017,64,1536,2048,bf16,NVIDIA GeForce RTX 4060,c04,64,64,64,4,3,8,0.0,0.0,58.36800113320351,216.96672692894907,6.898526181855913,3,-1,-1,64x1536x2048,0,
2026-03-03T03:12:21.241445+00:00,FULL,llm_style,tune,llm_style_tune_018,64,8192,1536,bf16,NVIDIA GeForce RTX 4060,c06,64,128,32,4,3,8,0.0,165.838,97.74399921298027,115.69184131920338,16.477868196190123,0,-1,-1,64x8192x1536,0,
2026-03-03T03:12:21.333291+00:00,FULL,llm_style,tune,llm_style_tune_019,2,1536,1024,bf16,NVIDIA GeForce RTX 4060,c01,64,32,32,2,2,8,0.0,91.805,41.39200039207935,318.74912470579136,0.15199690617523073,7,-1,-1,2x1536x1024,0,
2026-03-03T03:12:21.390602+00:00,FULL,llm_style,tune,llm_style_tune_020,16,1024,1536,bf16,NVIDIA GeForce RTX 4060,c04,64,64,64,4,3,8,0.0,57.267,37.88800165057182,70.94271969050163,1.3284323745599385,7,-1,-1,16x1024x1536,0,
2026-03-03T03:12:21.498484+00:00,FULL,llm_style,tune,llm_style_tune_021,1,6144,1536,bf16,NVIDIA GeForce RTX 4060,c11,32,128,32,4,2,8,0.0,107.843,46.08000069856644,50.5507193133235,0.4095999937905207,4,-1,-1,1x6144x1536,0,
2026-03-03T03:12:21.741078+00:00,FULL,llm_style,tune,llm_style_tune_022,8,4096,4096,bf16,NVIDIA GeForce RTX 4060,c09,128,64,64,8,3,8,0.0,242.553,181.2319979071617,268.44159752130497,1.4811703181549063,7,-1,-1,8x4096x4096,0,
2026-03-03T03:12:22.146235+00:00,FULL,llm_style,tune,llm_style_tune_023,2,4096,8192,bf16,NVIDIA GeForce RTX 4060,c06,64,128,32,4,3,8,0.0,405.117,295.9359884262085,426.3808050751684,0.4535363499173306,7,-1,-1,2x4096x8192,0,
2026-03-03T03:12:22.174192+00:00,FULL,llm_style,tune,llm_style_tune_024,64,1536,2048,bf16,NVIDIA GeForce RTX 4060,c04,64,64,64,4,3,8,0.0,0.0,59.39200147986412,628.4169645607453,6.779586037970331,3,-1,-1,64x1536x2048,0,
2026-03-03T03:12:22.204324+00:00,FULL,llm_style,tune,llm_style_tune_025,4,4096,1536,bf16,NVIDIA GeForce RTX 4060,c11,32,128,32,4,2,8,0.0,0.0,58.36800113320351,156.3059160113334,0.8623157727319891,6,-1,-1,4x4096x1536,0,
2026-03-03T03:12:22.284854+00:00,FULL,llm_style,tune,llm_style_tune_026,4,3072,2048,bf16,NVIDIA GeForce RTX 4060,c00,32,32,32,2,2,8,0.0,80.481,49.47200044989586,188.28735962510098,1.0173764461167236,7,-1,-1,4x3072x2048,0,
2026-03-03T03:12:22.364893+00:00,FULL,llm_style,tune,llm_style_tune_027,8,4096,1024,bf16,NVIDIA GeForce RTX 4060,c11,32,128,32,4,2,8,0.0,79.997,42.94399917125702,98.84671986103058,1.5627064385032134,6,-1,-1,8x4096x1024,0,
2026-03-03T03:12:22.419009+00:00,FULL,llm_style,tune,llm_style_tune_028,16,1536,1024,bf16,NVIDIA GeForce RTX 4060,c04,64,64,64,4,3,8,0.0,54.071,35.840000957250595,45.480319783091545,1.404342819634263,7,-1,-1,16x1536x1024,0,
2026-03-03T03:12:22.853058+00:00,FULL,llm_style,tune,llm_style_tune_029,64,4096,8192,bf16,NVIDIA GeForce RTX 4060,c04,64,64,64,4,3,8,0.0,434.003,301.05599761009216,332.73631662130356,14.266340249306568,3,-1,-1,64x4096x8192,0,
2026-03-03T03:12:23.014211+00:00,FULL,llm_style,tune,llm_style_tune_030,1,8192,1536,bf16,NVIDIA GeForce RTX 4060,c00,32,32,32,2,2,8,0.0,161.111,66.56000018119812,100.71648061275475,0.3780923066630166,4,-1,-1,1x8192x1536,0,
2026-03-03T03:12:23.605465+00:00,FULL,llm_style,tune,llm_style_tune_031,1,8192,6144,bf16,NVIDIA GeForce RTX 4060,c11,32,128,32,4,2,8,0.0,591.213,425.83999037742615,531.0463857650756,0.23638760631846986,5,-1,-1,1x8192x6144,0,
2026-03-03T03:12:23.923546+00:00,FULL,llm_style,tune,llm_style_tune_032,32,3072,8192,bf16,NVIDIA GeForce RTX 4060,c10,64,128,64,8,3,8,0.0,318.039,229.34400290250778,254.03391659259796,7.022693925354822,3,-1,-1,32x3072x8192,0,
2026-03-03T03:12:24.075222+00:00,FULL,llm_style,tune,llm_style_tune_033,4,1536,6144,bf16,NVIDIA GeForce RTX 4060,c04,64,64,64,4,3,8,0.0,151.637,95.04000097513199,169.16895374655718,0.794375749425282,7,-1,-1,4x1536x6144,0,
2026-03-03T03:12:24.174669+00:00,FULL,llm_style,tune,llm_style_tune_034,1,4096,1536,bf16,NVIDIA GeForce RTX 4060,c11,32,128,32,4,2,8,0.0,99.405,46.08000069856644,101.62015739828328,0.2730666625270138,6,-1,-1,1x4096x1536,0,
2026-03-03T03:12:24.265917+00:00,FULL,llm_style,tune,llm_style_tune_035,4,1536,4096,bf16,NVIDIA GeForce RTX 4060,c04,64,64,64,4,3,8,0.0,91.211,56.32000043988228,62.30719942599535,0.8936727202927771,7,-1,-1,4x1536x4096,0,
2026-03-03T03:12:24.572709+00:00,FULL,llm_style,tune,llm_style_tune_036,32,8192,3072,bf16,NVIDIA GeForce RTX 4060,c02,32,64,32,2,2,8,0.0,306.752,231.79200291633606,392.5024014711378,6.948525901393332,0,-1,-1,32x8192x3072,0,
2026-03-03T03:12:24.604893+00:00,FULL,llm_style,tune,llm_style_tune_037,32,3072,2048,bf16,NVIDIA GeForce RTX 4060,c02,32,64,32,2,2,8,0.0,0.0,63.34399804472923,95.53919874131674,6.356611461683767,3,-1,-1,32x3072x2048,0,
2026-03-03T03:12:24.721574+00:00,FULL,llm_style,tune,llm_style_tune_038,2,2048,4096,bf16,NVIDIA GeForce RTX 4060,c00,32,32,32,2,2,8,0.0,116.628,42.448000982403755,175.2780757844447,0.7904832082412911,7,-1,-1,2x2048x4096,0,
2026-03-03T03:12:24.792006+00:00,FULL,llm_style,tune,llm_style_tune_039,64,2048,1536,bf16,NVIDIA GeForce RTX 4060,c03,64,64,32,4,2,8,0.0,70.39,47.05600067973137,58.42943925410508,8.556893450008737,3,-1,-1,64x2048x1536,0,
2026-03-03T03:12:24.920888+00:00,FULL,llm_style,tune,llm_style_tune_040,64,1024,6144,bf16,NVIDIA GeForce RTX 4060,c04,64,64,64,4,3,8,0.0,128.844,78.831996768713,132.11648002266884,10.215475961654338,3,-1,-1,64x1024x6144,0,
2026-03-03T03:12:25.518127+00:00,FULL,llm_style,tune,llm_style_tune_041,4,8192,6144,bf16,NVIDIA GeForce RTX 4060,c11,32,128,32,4,2,8,0.0,597.2,424.3199974298477,478.2428929209708,0.9489375623089037,5,-1,-1,4x8192x6144,0,
2026-03-03T03:12:25.641498+00:00,FULL,llm_style,tune,llm_style_tune_042,1,1024,6144,bf16,NVIDIA GeForce RTX 4060,c04,64,64,64,4,3,8,0.0,123.33,72.7040022611618,76.29824347794056,0.17307041715256086,7,-1,-1,1x1024x6144,0,
2026-03-03T03:12:25.876246+00:00,FULL,llm_style,tune,llm_style_tune_043,64,2048,8192,bf16,NVIDIA GeForce RTX 4060,c06,64,128,32,4,3,8,0.0,234.708,168.65599900484085,242.35008373856542,12.732921809311756,3,-1,-1,64x2048x8192,0,
2026-03-03T03:12:25.938751+00:00,FULL,llm_style,tune,llm_style_tune_044,16,2048,1024,bf16,NVIDIA GeForce RTX 4060,c11,32,128,32,4,2,8,0.0,62.468,40.95999896526337,47.687679342925534,1.6384000413894664,7,-1,-1,16x2048x1024,0,
2026-03-03T03:12:25.997710+00:00,FULL,llm_style,tune,llm_style_tune_045,4,1024,1536,bf16,NVIDIA GeForce RTX 4060,c04,64,64,64,4,3,8,0.0,58.924,38.784001022577286,78.26687924563873,0.32443563501030037,7,-1,-1,4x1024x1536,0,
2026-03-03T03:12:26.031149+00:00,FULL,llm_style,tune,llm_style_tune_046,64,1536,4096,bf16,NVIDIA GeForce RTX 4060,c04,64,64,64,4,3,8,0.0,0.0,89.9679996073246,147.44511753320694,8.95103116124455,3,-1,-1,64x1536x4096,0,
2026-03-03T03:12:26.096035+00:00,FULL,llm_style,tune,llm_style_tune_047,16,2048,1536,bf16,NVIDIA GeForce RTX 4060,c00,32,32,32,2,2,8,0.0,64.838,40.89599847793579,52.02752083539961,2.4614461009995843,7,-1,-1,16x2048x1536,0,
2026-03-03T03:12:26.542827+00:00,FULL,llm_style,tune,llm_style_tune_048,64,6144,6144,bf16,NVIDIA GeForce RTX 4060,c11,32,128,32,4,2,8,0.0,446.75,331.7759931087494,368.7590301036835,14.563555858052158,1,-1,-1,64x6144x6144,0,
2026-03-03T03:12:26.951498+00:00,FULL,llm_style,tune,llm_style_tune_049,4,4096,8192,bf16,NVIDIA GeForce RTX 4060,c06,64,128,32,4,3,8,0.0,408.631,295.26400566101074,336.57857328653336,0.9091370802175858,7,-1,-1,4x4096x8192,0,
2026-03-03T03:12:27.131655+00:00,FULL,llm_style,tune,llm_style_tune_050,1,4096,3072,bf16,NVIDIA GeForce RTX 4060,c00,32,32,32,2,2,8,0.0,180.118,78.73599976301193,184.05632540583605,0.3196228418480339,7,-1,-1,1x4096x3072,0,
2026-03-03T03:12:27.237320+00:00,FULL,llm_style,tune,llm_style_tune_051,2,4096,2048,bf16,NVIDIA GeForce RTX 4060,c00,32,32,32,2,2,8,0.0,105.627,50.175998359918594,141.3625629246235,0.668734715736196,7,-1,-1,2x4096x2048,0,
2026-03-03T03:12:27.386785+00:00,FULL,llm_style,tune,llm_style_tune_052,4,8192,1536,bf16,NVIDIA GeForce RTX 4060,c11,32,128,32,4,2,8,0.0,149.424,65.64800068736076,184.37056258320808,1.5333794623753219,4,-1,-1,4x8192x1536,0,
2026-03-03T03:12:27.514746+00:00,FULL,llm_style,tune,llm_style_tune_053,1,1536,4096,bf16,NVIDIA GeForce RTX 4060,c00,32,32,32,2,2,8,0.0,127.919,62.92799860239029,676.5206387639029,0.19995728895662104,7,-1,-1,1x1536x4096,0,
2026-03-03T03:12:28.116205+00:00,FULL,llm_style,tune,llm_style_tune_054,8,8192,6144,bf16,NVIDIA GeForce RTX 4060,c10,64,128,64,8,3,8,0.0,601.413,428.3680021762848,473.0268719792366,1.8799405275574133,5,-1,-1,8x8192x6144,0,
2026-03-03T03:12:28.259345+00:00,FULL,llm_style,tune,llm_style_tune_055,64,6144,1536,bf16,NVIDIA GeForce RTX 4060,c06,64,128,32,4,3,8,0.0,143.098,87.95199915766716,155.98592035472376,13.734304661279515,0,-1,-1,64x6144x1536,0,
2026-03-03T03:12:28.365603+00:00,FULL,llm_style,tune,llm_style_tune_056,1,3072,1536,bf16,NVIDIA GeForce RTX 4060,c00,32,32,32,2,2,8,0.0,106.218,41.471999138593674,141.46847859024996,0.22755556028206497,7,-1,-1,1x3072x1536,0,
2026-03-03T03:12:28.425840+00:00,FULL,llm_style,tune,llm_style_tune_057,64,1024,1024,bf16,NVIDIA GeForce RTX 4060,c00,32,32,32,2,2,8,0.0,60.198,38.91199827194214,1161.9392075762107,3.4492633110743878,3,-1,-1,64x1024x1024,0,
2026-03-03T03:12:28.815918+00:00,FULL,llm_style,tune,llm_style_tune_058,16,8192,4096,bf16,NVIDIA GeForce RTX 4060,c11,32,128,32,4,2,8,0.0,390.043,293.88800263404846,352.12287604808796,3.6535748801458605,5,-1,-1,16x8192x4096,0,
2026-03-03T03:12:29.133872+00:00,FULL,llm_style,tune,llm_style_tune_059,16,4096,6144,bf16,NVIDIA GeForce RTX 4060,c06,64,128,32,4,3,8,0.0,317.902,229.24800217151642,246.24159336090088,3.5128173871608888,7,-1,-1,16x4096x6144,0,
2026-03-03T03:12:29.450558+00:00,FULL,llm_style,tune,llm_style_tune_060,2,3072,8192,bf16,NVIDIA GeForce RTX 4060,c10,64,128,64,8,3,8,0.0,316.648,227.32800245285034,350.5587288737295,0.4428108060329188,7,-1,-1,2x3072x8192,0,
2026-03-03T03:12:29.618095+00:00,FULL,llm_style,tune,llm_style_tune_061,64,4096,8192,bf16,NVIDIA GeForce RTX 4060,c04,64,64,64,4,3,8,0.0,0.0,301.7439991235733,439.3577626347542,14.233811802305572,3,-1,-1,64x4096x8192,0,
2026-03-03T03:12:29.776697+00:00,FULL,llm_style,tune,llm_style_tune_062,32,4096,3072,bf16,NVIDIA GeForce RTX 4060,c04,64,64,64,4,3,8,0.0,158.551,87.02399954199791,101.44607990980145,9.253842299116096,3,-1,-1,32x4096x3072,0,
2026-03-03T03:12:29.901371+00:00,FULL,llm_style,tune,llm_style_tune_063,2,3072,8192,bf16,NVIDIA GeForce RTX 4060,c10,64,128,64,8,3,8,0.0,0.0,232.40000009536743,325.2169579267502,0.4331467123867982,7,-1,-1,2x3072x8192,0,
2026-03-03T03:12:29.957394+00:00,FULL,llm_style,eval,llm_style_eval_000,32,1536,1024,bf16,NVIDIA GeForce RTX 4060,c04,64,64,64,4,3,8,0.0,55.972,35.840000957250595,53.244480155408354,2.808685639268526,3,-1,-1,32x1536x1024,0,
2026-03-03T03:12:30.198467+00:00,FULL,llm_style,eval,llm_style_eval_001,32,2048,8192,bf16,NVIDIA GeForce RTX 4060,c10,64,128,64,8,3,8,0.0,241.009,165.69600254297256,209.064639955759,6.480191480307616,3,-1,-1,32x2048x8192,0,
2026-03-03T03:12:30.330912+00:00,FULL,llm_style,eval,llm_style_eval_002,16,2048,4096,bf16,NVIDIA GeForce RTX 4060,c00,32,32,32,2,2,8,0.0,132.405,61.343999579548836,153.20768222212786,4.375904046685152,7,-1,-1,16x2048x4096,0,
2026-03-03T03:12:30.352077+00:00,FULL,llm_style,eval,llm_style_eval_003,16,2048,1536,bf16,NVIDIA GeForce RTX 4060,c00,32,32,32,2,2,8,0.0,0.0,63.999999314546585,154.82335701584816,1.5728640168457033,7,-1,-1,16x2048x1536,0,
2026-03-03T03:12:30.574759+00:00,FULL,llm_style,eval,llm_style_eval_004,64,8192,2048,bf16,NVIDIA GeForce RTX 4060,c10,64,128,64,8,3,8,0.0,222.636,166.6719987988472,196.48256599903107,12.884489677187775,0,-1,-1,64x8192x2048,0,
2026-03-03T03:12:30.885593+00:00,FULL,llm_style,eval,llm_style_eval_005,64,3072,8192,bf16,NVIDIA GeForce RTX 4060,c06,64,128,32,4,3,8,0.0,310.793,233.47200453281403,252.6636880636215,13.797052363711826,3,-1,-1,64x3072x8192,0,
2026-03-03T03:12:30.986247+00:00,FULL,llm_style,eval,llm_style_eval_006,32,2048,2048,bf16,NVIDIA GeForce RTX 4060,c11,32,128,32,4,2,8,0.0,100.615,51.632000133395195,55.691839158535,5.199013311637677,3,-1,-1,32x2048x2048,0,
2026-03-03T03:12:31.224479+00:00,FULL,llm_style,eval,llm_style_eval_007,8,8192,2048,bf16,NVIDIA GeForce RTX 4060,c10,64,128,64,8,3,8,0.0,238.195,161.69599443674088,168.4835247695446,1.6601243397220826,4,-1,-1,8x8192x2048,0,
2026-03-03T03:12:31.419157+00:00,FULL,llm_style,eval,llm_style_eval_008,64,1536,8192,bf16,NVIDIA GeForce RTX 4060,c04,64,64,64,4,3,8,0.0,194.64,112.64000087976456,135.0111998617649,14.298763524684434,3,-1,-1,64x1536x8192,0,
2026-03-03T03:12:31.745120+00:00,FULL,llm_style,eval,llm_style_eval_009,64,4096,6144,bf16,NVIDIA GeForce RTX 4060,c02,32,64,32,2,2,8,0.0,325.926,233.47200453281403,254.94751274585724,13.797052363711826,3,-1,-1,64x4096x6144,0,
2026-03-03T03:12:31.876475+00:00,FULL,llm_style,eval,llm_style_eval_010,64,2048,4096,bf16,NVIDIA GeForce RTX 4060,c03,64,64,32,4,2,8,0.0,131.315,76.80000364780426,83.43775808811188,13.981012669270863,3,-1,-1,64x2048x4096,0,
2026-03-03T03:12:32.122370+00:00,FULL,llm_style,eval,llm_style_eval_011,32,3072,6144,bf16,NVIDIA GeForce RTX 4060,c04,64,64,64,4,3,8,0.0,245.854,180.2240014076233,298.3792038261887,6.702545402195828,3,-1,-1,32x3072x6144,0,
2026-03-03T03:12:32.192111+00:00,FULL,llm_style,eval,llm_style_eval_012,16,1536,1536,bf16,NVIDIA GeForce RTX 4060,c04,64,64,64,4,3,8,0.0,69.701,43.36000047624111,65.19456028938292,1.7411778406545093,7,-1,-1,16x1536x1536,0,
2026-03-03T03:12:32.289577+00:00,FULL,llm_style,eval,llm_style_eval_013,64,2048,3072,bf16,NVIDIA GeForce RTX 4060,c03,64,64,32,4,2,8,0.0,97.426,63.48799914121628,92.2214414179325,12.684387268352213,3,-1,-1,64x2048x3072,0,
2026-03-03T03:12:32.867506+00:00,FULL,llm_style,eval,llm_style_eval_014,16,8192,6144,bf16,NVIDIA GeForce RTX 4060,c11,32,128,32,4,2,8,0.0,577.885,428.46399545669556,531.4768040180206,3.7590386895479138,5,-1,-1,16x8192x6144,0,
2026-03-03T03:12:32.912855+00:00,FULL,llm_style,eval,llm_style_eval_015,64,6144,1536,bf16,NVIDIA GeForce RTX 4060,c06,64,128,32,4,3,8,0.0,0.0,66.47999957203865,84.04991865158078,18.1702701530712,0,-1,-1,64x6144x1536,0,
2026-03-03T03:12:33.138307+00:00,FULL,llm_style,eval,llm_style_eval_016,16,4096,4096,bf16,NVIDIA GeForce RTX 4060,c11,32,128,32,4,2,8,0.0,225.401,160.76800227165222,186.36800348758698,3.3394139655529265,7,-1,-1,16x4096x4096,0,
2026-03-03T03:12:33.568110+00:00,FULL,llm_style,eval,llm_style_eval_017,64,8192,4096,bf16,NVIDIA GeForce RTX 4060,c10,64,128,64,8,3,8,0.0,429.76,302.0800054073334,345.6348702311516,14.217979406510347,1,-1,-1,64x8192x4096,0,
2026-03-03T03:12:33.890111+00:00,FULL,llm_style,eval,llm_style_eval_018,32,4096,6144,bf16,NVIDIA GeForce RTX 4060,c11,32,128,32,4,2,8,0.0,321.96,228.35199534893036,258.3551979064941,7.05320193738147,3,-1,-1,32x4096x6144,0,
2026-03-03T03:12:34.204267+00:00,FULL,llm_style,eval,llm_style_eval_019,16,3072,8192,bf16,NVIDIA GeForce RTX 4060,c06,64,128,32,4,3,8,0.0,314.118,228.35199534893036,282.03168481588364,3.526600968690735,7,-1,-1,16x3072x8192,0,
2026-03-03T03:12:34.287743+00:00,FULL,llm_style,eval,llm_style_eval_020,4,1536,1536,bf16,NVIDIA GeForce RTX 4060,c00,32,32,32,2,2,8,0.0,83.437,45.00799998641014,179.55232039093954,0.41935584797589287,7,-1,-1,4x1536x1536,0,
2026-03-03T03:12:34.393488+00:00,FULL,llm_style,eval,llm_style_eval_021,4,6144,1536,bf16,NVIDIA GeForce RTX 4060,c00,32,32,32,2,2,8,0.0,105.707,35.280000418424606,124.10912036895746,2.1399509950281135,4,-1,-1,4x6144x1536,0,
2026-03-03T03:12:34.422668+00:00,FULL,llm_style,eval,llm_style_eval_022,32,6144,1024,bf16,NVIDIA GeForce RTX 4060,c11,32,128,32,4,2,8,0.0,0.0,41.728001087903976,45.44767953455448,9.649472141063576,0,-1,-1,32x6144x1024,0,
2026-03-03T03:12:34.434842+00:00,FULL,llm_style,eval,llm_style_eval_023,16,1024,1536,bf16,NVIDIA GeForce RTX 4060,c04,64,64,64,4,3,8,0.0,0.0,36.896001547575,83.98847863078117,1.364149118844236,7,-1,-1,16x1024x1536,0,
2026-03-03T03:12:34.533991+00:00,FULL,llm_style,eval,llm_style_eval_024,32,8192,1024,bf16,NVIDIA GeForce RTX 4060,c11,32,128,32,4,2,8,0.0,99.117,49.15200173854828,54.30079951882361,10.92266628032262,0,-1,-1,32x8192x1024,0,
2026-03-03T03:12:34.965728+00:00,FULL,llm_style,eval,llm_style_eval_025,32,6144,6144,bf16,NVIDIA GeForce RTX 4060,c00,32,32,32,2,2,8,0.0,431.697,328.67200672626495,457.76352554559696,7.350547215942557,1,-1,-1,32x6144x6144,0,
2026-03-03T03:12:35.117292+00:00,FULL,llm_style,eval,llm_style_eval_026,1,6144,2048,bf16,NVIDIA GeForce RTX 4060,c00,32,32,32,2,2,8,0.0,151.527,48.64000156521797,102.44095742702484,0.5173894570348011,4,-1,-1,1x6144x2048,0,
2026-03-03T03:12:35.187488+00:00,FULL,llm_style,eval,llm_style_eval_027,32,4096,3072,bf16,NVIDIA GeForce RTX 4060,c04,64,64,64,4,3,8,0.0,0.0,114.72000181674957,253.96448284387577,7.019755537368045,3,-1,-1,32x4096x3072,0,
2026-03-03T03:12:35.269955+00:00,FULL,llm_style,eval,llm_style_eval_028,64,1536,1536,bf16,NVIDIA GeForce RTX 4060,c11,32,128,32,4,2,8,0.0,82.417,45.05600035190582,95.30367851257313,6.702545402195828,3,-1,-1,64x1536x1536,0,
2026-03-03T03:12:35.328559+00:00,FULL,llm_style,eval,llm_style_eval_029,2,3072,1024,bf16,NVIDIA GeForce RTX 4060,c11,32,128,32,4,2,8,0.0,58.566,39.824001491069794,46.64320088922976,0.3159630255342777,6,-1,-1,2x3072x1024,0,
2026-03-03T03:12:35.518000+00:00,FULL,llm_style,eval,llm_style_eval_030,32,1536,8192,bf16,NVIDIA GeForce RTX 4060,c04,64,64,64,4,3,8,0.0,189.403,107.51999914646149,185.466875731945,7.489828630885948,3,-1,-1,32x1536x8192,0,
2026-03-03T03:12:35.608720+00:00,FULL,llm_style,eval,llm_style_eval_031,8,3072,2048,bf16,NVIDIA GeForce RTX 4060,c00,32,32,32,2,2,8,0.0,90.679,48.48000034689903,69.74879849702116,2.0763881039542693,7,-1,-1,8x3072x2048,0,
2026-03-03T03:12:35.697453+00:00,FULL,llm_style,eval,llm_style_eval_032,8,2048,3072,bf16,NVIDIA GeForce RTX 4060,c00,32,32,32,2,2,8,0.0,88.692,57.34399892389774,138.39584544301027,1.7554286043704779,7,-1,-1,8x2048x3072,0,
2026-03-03T03:12:35.763806+00:00,FULL,llm_style,eval,llm_style_eval_033,64,1536,8192,bf16,NVIDIA GeForce RTX 4060,c04,64,64,64,4,3,8,0.0,0.0,114.68800157308578,205.80000475049013,14.043428378805825,3,-1,-1,64x1536x8192,0,
2026-03-03T03:12:35.931091+00:00,FULL,llm_style,eval,llm_style_eval_034,64,6144,2048,bf16,NVIDIA GeForce RTX 4060,c06,64,128,32,4,3,8,0.0,167.233,97.28000313043594,116.33663833141324,16.556462625113635,0,-1,-1,64x6144x2048,0,
2026-03-03T03:12:36.064502+00:00,FULL,llm_style,eval,llm_style_eval_035,4,4096,2048,bf16,NVIDIA GeForce RTX 4060,c00,32,32,32,2,2,8,0.0,133.372,51.96800082921982,169.6236807107923,1.2913497330893473,7,-1,-1,4x4096x2048,0,
2026-03-03T03:12:36.245910+00:00,FULL,llm_style,eval,llm_style_eval_036,64,8192,4096,bf16,NVIDIA GeForce RTX 4060,c10,64,128,64,8,3,8,0.0,0.0,326.6560137271881,360.3750264644623,13.148287848718466,1,-1,-1,64x8192x4096,0,
2026-03-03T03:12:36.279114+00:00,FULL,llm_style,eval,llm_style_eval_037,32,6144,1024,bf16,NVIDIA GeForce RTX 4060,c11,32,128,32,4,2,8,0.0,0.0,63.48799914121628,145.89279666543007,6.342193634176106,0,-1,-1,32x6144x1024,0,
2026-03-03T03:12:36.341095+00:00,FULL,llm_style,eval,llm_style_eval_038,64,6144,2048,bf16,NVIDIA GeForce RTX 4060,c06,64,128,32,4,3,8,0.0,0.0,104.39999774098396,197.27551966905583,15.427325391289036,0,-1,-1,64x6144x2048,0,
2026-03-03T03:12:36.416498+00:00,FULL,llm_style,eval,llm_style_eval_039,8,1024,3072,bf16,NVIDIA GeForce RTX 4060,c04,64,64,64,4,3,8,0.0,75.353,50.09600147604942,59.22432005405425,1.0047038988543475,7,-1,-1,8x1024x3072,0,
2026-03-03T03:12:36.632674+00:00,FULL,llm_style,eval,llm_style_eval_040,32,8192,2048,bf16,NVIDIA GeForce RTX 4060,c11,32,128,32,4,2,8,0.0,216.138,163.7440025806427,221.82303637266145,6.557442147972352,0,-1,-1,32x8192x2048,0,
2026-03-03T03:12:36.704859+00:00,FULL,llm_style,eval,llm_style_eval_041,32,3072,1024,bf16,NVIDIA GeForce RTX 4060,c11,32,128,32,4,2,8,0.0,72.145,41.919998824596405,56.0633588954806,4.802638302601104,2,-1,-1,32x3072x1024,0,
2026-03-03T03:12:36.797416+00:00,FULL,llm_style,eval,llm_style_eval_042,64,1024,4096,bf16,NVIDIA GeForce RTX 4060,c04,64,64,64,4,3,8,0.0,92.514,57.34400078654289,64.93664015084504,9.362285585870548,3,-1,-1,64x1024x4096,0,
2026-03-03T03:12:36.807660+00:00,FULL,llm_style,eval,llm_style_eval_043,2,1536,1024,bf16,NVIDIA GeForce RTX 4060,c01,64,32,32,2,2,8,0.0,0.0,37.88800165057182,52.23264079540968,0.1660540468199923,7,-1,-1,2x1536x1024,0,
2026-03-03T03:12:37.041580+00:00,FULL,llm_style,eval,llm_style_eval_044,64,6144,3072,bf16,NVIDIA GeForce RTX 4060,c11,32,128,32,4,2,8,0.0,233.886,181.93600326776505,209.24287855625153,13.278950073693556,1,-1,-1,64x6144x3072,0,
2026-03-03T03:12:37.174268+00:00,FULL,llm_style,eval,llm_style_eval_045,64,1536,6144,bf16,NVIDIA GeForce RTX 4060,c04,64,64,64,4,3,8,0.0,132.648,71.42399996519089,96.19616217911243,16.91251613727472,3,-1,-1,64x1536x6144,0,
2026-03-03T03:12:37.414529+00:00,FULL,llm_style,eval,llm_style_eval_046,2,6144,3072,bf16,NVIDIA GeForce RTX 4060,c11,32,128,32,4,2,8,0.0,240.222,178.15999686717987,312.64736756682356,0.4237621987402938,5,-1,-1,2x6144x3072,0,
2026-03-03T03:12:37.823203+00:00,FULL,llm_style,eval,llm_style_eval_047,16,4096,8192,bf16,NVIDIA GeForce RTX 4060,c02,32,64,32,2,2,8,0.0,408.632,294.8160022497177,318.06463211774826,3.642074432209787,7,-1,-1,16x4096x8192,0,
2026-03-03T03:12:37.862234+00:00,FULL,llm_style,eval,llm_style_eval_048,16,1024,6144,bf16,NVIDIA GeForce RTX 4060,c04,64,64,64,4,3,8,0.0,0.0,70.56000083684921,121.4156800508499,2.853267993370818,7,-1,-1,16x1024x6144,0,
2026-03-03T03:12:38.005408+00:00,FULL,llm_style,eval,llm_style_eval_049,16,8192,1536,bf16,NVIDIA GeForce RTX 4060,c11,32,128,32,4,2,8,0.0,143.13,75.77600330114365,110.56799910962579,5.313729498239754,4,-1,-1,16x8192x1536,0,
2026-03-03T03:12:38.064543+00:00,FULL,llm_style,eval,llm_style_eval_050,1,1024,1024,bf16,NVIDIA GeForce RTX 4060,c04,64,64,64,4,3,8,0.0,59.098,38.704000413417816,46.60224087536335,0.05418437312937203,7,-1,-1,1x1024x1024,0,
2026-03-03T03:12:38.141191+00:00,FULL,llm_style,eval,llm_style_eval_051,16,6144,1024,bf16,NVIDIA GeForce RTX 4060,c11,32,128,32,4,2,8,0.0,76.613,39.93599861860275,49.537918828427784,5.041230943608337,4,-1,-1,16x6144x1024,0,
2026-03-03T03:12:38.921080+00:00,FULL,llm_style,eval,llm_style_eval_052,16,8192,8192,bf16,NVIDIA GeForce RTX 4060,c06,64,128,32,4,3,8,0.0,779.846,567.3760175704956,615.4444867372513,3.7849390554002023,5,-1,-1,16x8192x8192,0,
2026-03-03T03:12:39.486650+00:00,FULL,llm_style,eval,llm_style_eval_053,1,6144,8192,bf16,NVIDIA GeForce RTX 4060,c00,32,32,32,2,2,8,0.0,565.526,423.71200025081635,486.0723355412482,0.23757480538765097,5,-1,-1,1x6144x8192,0,
2026-03-03T03:12:39.670042+00:00,FULL,llm_style,eval,llm_style_eval_054,64,4096,3072,bf16,NVIDIA GeForce RTX 4060,c04,64,64,64,4,3,8,0.0,183.354,97.36000001430511,166.4191961288451,16.54285883076574,3,-1,-1,64x4096x3072,0,
2026-03-03T03:12:39.776564+00:00,FULL,llm_style,eval,llm_style_eval_055,4,8192,1024,bf16,NVIDIA GeForce RTX 4060,c11,32,128,32,4,2,8,0.0,106.482,49.15200173854828,104.77440211921909,1.3653332850403275,4,-1,-1,4x8192x1024,0,
2026-03-03T03:12:39.873551+00:00,FULL,llm_style,eval,llm_style_eval_056,64,1024,3072,bf16,NVIDIA GeForce RTX 4060,c11,32,128,32,4,2,8,0.0,96.95,62.463998794555664,74.0473610907793,6.4461640588257545,3,-1,-1,64x1024x3072,0,
2026-03-03T03:12:39.878617+00:00,FULL,llm_style,eval,llm_style_eval_057,64,1024,3072,bf16,NVIDIA GeForce RTX 4060,c11,32,128,32,4,2,8,0.0,0.0,63.4239986538887,71.81887887418269,6.348593474803125,3,-1,-1,64x1024x3072,0,
2026-03-03T03:12:39.998171+00:00,FULL,llm_style,eval,llm_style_eval_058,32,2048,4096,bf16,NVIDIA GeForce RTX 4060,c00,32,32,32,2,2,8,0.0,119.522,67.58400052785873,155.8528004586696,7.943757513713575,3,-1,-1,32x2048x4096,0,
2026-03-03T03:12:40.090131+00:00,FULL,llm_style,eval,llm_style_eval_059,64,8192,2048,bf16,NVIDIA GeForce RTX 4060,c10,64,128,64,8,3,8,0.0,0.0,169.8400005698204,313.5343983769417,12.644157093706438,0,-1,-1,64x8192x2048,0,
2026-03-03T03:12:40.322288+00:00,FULL,llm_style,eval,llm_style_eval_060,1,3072,6144,bf16,NVIDIA GeForce RTX 4060,c06,64,128,32,4,3,8,0.0,232.111,176.2399971485138,201.33695706725118,0.21418938158623507,7,-1,-1,1x3072x6144,0,
2026-03-03T03:12:40.361580+00:00,FULL,llm_style,eval,llm_style_eval_061,64,1536,4096,bf16,NVIDIA GeForce RTX 4060,c04,64,64,64,4,3,8,0.0,0.0,57.34400078654289,289.04735505580874,14.043428378805825,3,-1,-1,64x1536x4096,0,
2026-03-03T03:12:40.505100+00:00,FULL,llm_style,eval,llm_style_eval_062,16,6144,2048,bf16,NVIDIA GeForce RTX 4060,c00,32,32,32,2,2,8,0.0,143.474,76.63999870419502,188.00863906741125,5.253825558558629,4,-1,-1,16x6144x2048,0,
2026-03-03T03:12:40.556131+00:00,FULL,llm_style,eval,llm_style_eval_063,64,1536,6144,bf16,NVIDIA GeForce RTX 4060,c04,64,64,64,4,3,8,0.0,0.0,73.64800199866295,205.63200294971452,16.40179664374235,3,-1,-1,64x1536x6144,0,
2026-03-03T03:12:40.618285+00:00,FULL,llm_style,eval,llm_style_eval_064,1,6144,2048,bf16,NVIDIA GeForce RTX 4060,c00,32,32,32,2,2,8,0.0,0.0,44.8479987680912,103.43424126505842,0.5611359412073739,4,-1,-1,1x6144x2048,0,
2026-03-03T03:12:40.756820+00:00,FULL,llm_style,eval,llm_style_eval_065,8,1536,6144,bf16,NVIDIA GeForce RTX 4060,c04,64,64,64,4,3,8,0.0,138.488,70.3199990093708,79.85184028744698,2.147254637757866,7,-1,-1,8x1536x6144,0,
2026-03-03T03:12:40.794539+00:00,FULL,llm_style,eval,llm_style_eval_066,64,1536,4096,bf16,NVIDIA GeForce RTX 4060,c04,64,64,64,4,3,8,0.0,0.0,65.5359998345375,106.97568163275707,12.288000031024216,3,-1,-1,64x1536x4096,0,
2026-03-03T03:12:40.888575+00:00,FULL,llm_style,eval,llm_style_eval_067,64,8192,2048,bf16,NVIDIA GeForce RTX 4060,c10,64,128,64,8,3,8,0.0,0.0,196.25599682331085,233.7177570164203,10.942257473708578,0,-1,-1,64x8192x2048,0,
2026-03-03T03:12:40.909361+00:00,FULL,llm_style,eval,llm_style_eval_068,64,1024,4096,bf16,NVIDIA GeForce RTX 4060,c04,64,64,64,4,3,8,0.0,0.0,53.247999399900436,168.202237188816,10.08246165208986,3,-1,-1,64x1024x4096,0,
2026-03-03T03:12:40.949848+00:00,FULL,llm_style,eval,llm_style_eval_069,64,2048,4096,bf16,NVIDIA GeForce RTX 4060,c03,64,64,32,4,2,8,0.0,0.0,78.84799689054489,189.5753557980059,13.617870666905405,3,-1,-1,64x2048x4096,0,
2026-03-03T03:12:41.062537+00:00,FULL,llm_style,eval,llm_style_eval_070,64,8192,1024,bf16,NVIDIA GeForce RTX 4060,c06,64,128,32,4,3,8,0.0,112.637,65.58400020003319,69.13024105131626,16.372008732694788,0,-1,-1,64x8192x1024,0,
2026-03-03T03:12:41.130741+00:00,FULL,llm_style,eval,llm_style_eval_071,64,6144,2048,bf16,NVIDIA GeForce RTX 4060,c06,64,128,32,4,3,8,0.0,0.0,102.30399668216705,218.23487922549248,15.7433999475482,0,-1,-1,64x6144x2048,0,
2026-03-03T03:12:41.143874+00:00,FULL,llm_style,eval,llm_style_eval_072,64,1536,1024,bf16,NVIDIA GeForce RTX 4060,c04,64,64,64,4,3,8,0.0,0.0,44.03200000524521,143.60575631260866,4.57227906922278,3,-1,-1,64x1536x1024,0,
2026-03-03T03:12:41.171442+00:00,FULL,llm_style,eval,llm_style_eval_073,1,4096,1536,bf16,NVIDIA GeForce RTX 4060,c11,32,128,32,4,2,8,0.0,0.0,34.78400036692619,124.27263721823685,0.36174424641405706,6,-1,-1,1x4096x1536,0,
2026-03-03T03:12:41.232998+00:00,FULL,llm_style,eval,llm_style_eval_074,8,1024,2048,bf16,NVIDIA GeForce RTX 4060,c00,32,32,32,2,2,8,0.0,61.507,40.95999896526337,150.63871845602986,0.8192000206947332,7,-1,-1,8x1024x2048,0,
2026-03-03T03:12:41.310739+00:00,FULL,llm_style,eval,llm_style_eval_075,2,6144,1024,bf16,NVIDIA GeForce RTX 4060,c00,32,32,32,2,2,8,0.0,77.7,38.99199888110161,524.1343998908982,0.6454099487625194,4,-1,-1,2x6144x1024,0,
2026-03-03T03:12:41.347049+00:00,FULL,llm_style,eval,llm_style_eval_076,64,1024,6144,bf16,NVIDIA GeForce RTX 4060,c04,64,64,64,4,3,8,0.0,0.0,82.24000036716461,207.56479881703817,9.79214937262487,3,-1,-1,64x1024x6144,0,
2026-03-03T03:12:41.773862+00:00,FULL,llm_style,eval,llm_style_eval_077,1,4096,8192,bf16,NVIDIA GeForce RTX 4060,c00,32,32,32,2,2,8,0.0,426.758,292.7199900150299,389.8588752746581,0.22925958694025048,7,-1,-1,1x4096x8192,0,
2026-03-03T03:12:41.874265+00:00,FULL,llm_style,eval,llm_style_eval_078,64,6144,3072,bf16,NVIDIA GeForce RTX 4060,c11,32,128,32,4,2,8,0.0,0.0,182.25599825382233,228.3984027802943,13.25563562871288,1,-1,-1,64x6144x3072,0,
2026-03-03T03:12:42.014898+00:00,FULL,llm_style,eval,llm_style_eval_079,2,3072,4096,bf16,NVIDIA GeForce RTX 4060,c04,64,64,64,4,3,8,0.0,140.585,80.89599758386612,93.2044817507267,0.6221772337725413,7,-1,-1,2x3072x4096,0,
2026-03-03T03:12:42.070932+00:00,FULL,llm_style,eval,llm_style_eval_080,4,1536,1024,bf16,NVIDIA GeForce RTX 4060,c04,64,64,64,4,3,8,0.0,55.997,37.88800165057182,51.13952085375783,0.3321080936399846,7,-1,-1,4x1536x1024,0,
2026-03-03T03:12:42.368853+00:00,FULL,llm_style,eval,llm_style_eval_081,4,4096,6144,bf16,NVIDIA GeForce RTX 4060,c02,32,64,32,2,2,8,0.0,297.885,226.30399465560913,311.90016478300095,0.8896289802854788,7,-1,-1,4x4096x6144,0,
2026-03-03T03:12:42.488396+00:00,FULL,llm_style,eval,llm_style_eval_082,64,6144,1024,bf16,NVIDIA GeForce RTX 4060,c06,64,128,32,4,3,8,0.0,119.505,76.75200328230858,82.85439729690552,10.492317249856383,0,-1,-1,64x6144x1024,0,
2026-03-03T03:12:42.571279+00:00,FULL,llm_style,eval,llm_style_eval_083,8,4096,4096,bf16,NVIDIA GeForce RTX 4060,c09,128,64,64,8,3,8,0.0,0.0,181.11999332904816,273.36767971515644,1.4820862736689828,7,-1,-1,8x4096x4096,0,
2026-03-03T03:12:42.739636+00:00,FULL,llm_style,eval,llm_style_eval_084,64,1024,8192,bf16,NVIDIA GeForce RTX 4060,c00,32,32,32,2,2,8,0.0,168.309,101.3759970664978,117.69631728529927,10.59167707416655,3,-1,-1,64x1024x8192,0,
2026-03-03T03:12:43.046554+00:00,FULL,llm_style,eval,llm_style_eval_085,1,3072,8192,bf16,NVIDIA GeForce RTX 4060,c06,64,128,32,4,3,8,0.0,306.879,228.35199534893036,287.8016000986099,0.22041256054317093,7,-1,-1,1x3072x8192,0,
2026-03-03T03:12:43.110430+00:00,FULL,llm_style,eval,llm_style_eval_086,8,1536,1024,bf16,NVIDIA GeForce RTX 4060,c00,32,32,32,2,2,8,0.0,63.835,15.072000212967396,298.6524827033274,1.6697069827764632,7,-1,-1,8x1536x1024,0,
2026-03-03T03:12:43.186992+00:00,FULL,llm_style,eval,llm_style_eval_087,16,1024,3072,bf16,NVIDIA GeForce RTX 4060,c04,64,64,64,4,3,8,0.0,76.527,49.15200173854828,54.81471993029117,2.047999927560491,7,-1,-1,16x1024x3072,0,
2026-03-03T03:12:43.271734+00:00,FULL,llm_style,eval,llm_style_eval_088,8,4096,1536,bf16,NVIDIA GeForce RTX 4060,c00,32,32,32,2,2,8,0.0,84.707,45.05600035190582,134.3212750554083,2.234181800731943,6,-1,-1,8x4096x1536,0,
2026-03-03T03:12:43.505880+00:00,FULL,llm_style,eval,llm_style_eval_089,16,6144,3072,bf16,NVIDIA GeForce RTX 4060,c00,32,32,32,2,2,8,0.0,234.107,177.0239993929863,189.96224105358124,3.4118525062762184,5,-1,-1,16x6144x3072,0,
2026-03-03T03:12:43.625057+00:00,FULL,llm_style,eval,llm_style_eval_090,32,1536,3072,bf16,NVIDIA GeForce RTX 4060,c01,64,32,32,2,2,8,0.0,119.139,39.424000307917595,2306.662490516893,7.660051888223805,3,-1,-1,32x1536x3072,0,
2026-03-03T03:12:43.718169+00:00,FULL,llm_style,eval,llm_style_eval_091,16,1024,4096,bf16,NVIDIA GeForce RTX 4060,c04,64,64,64,4,3,8,0.0,93.073,59.39200147986412,92.61056140065185,2.259862012656777,7,-1,-1,16x1024x4096,0,
2026-03-03T03:12:44.038052+00:00,FULL,llm_style,eval,llm_style_eval_092,1,4096,6144,bf16,NVIDIA GeForce RTX 4060,c11,32,128,32,4,2,8,0.0,319.844,227.08800435066223,263.53663966059673,0.22163939545780426,7,-1,-1,1x4096x6144,0,
2026-03-03T03:12:44.135141+00:00,FULL,llm_style,eval,llm_style_eval_093,32,2048,3072,bf16,NVIDIA GeForce RTX 4060,c00,32,32,32,2,2,8,0.0,97.051,54.207999259233475,157.90048554539678,7.427929263251944,3,-1,-1,32x2048x3072,0,
2026-03-03T03:12:44.147776+00:00,FULL,llm_style,eval,llm_style_eval_094,32,1024,2048,bf16,NVIDIA GeForce RTX 4060,c04,64,64,64,4,3,8,0.0,0.0,43.12000051140785,137.35936164855954,3.112655992768165,3,-1,-1,32x1024x2048,0,
2026-03-03T03:12:44.281126+00:00,FULL,llm_style,eval,llm_style_eval_095,8,6144,2048,bf16,NVIDIA GeForce RTX 4060,c00,32,32,32,2,2,8,0.0,133.311,56.752000004053116,72.72448226809502,3.547480123795138,4,-1,-1,8x6144x2048,0,
2026-03-03T03:12:44.312846+00:00,FULL,llm_style,eval,llm_style_eval_096,64,2048,3072,bf16,NVIDIA GeForce RTX 4060,c03,64,64,32,4,2,8,0.0,0.0,65.5359998345375,216.0931211709974,12.288000031024216,3,-1,-1,64x2048x3072,0,
2026-03-03T03:12:44.337626+00:00,FULL,llm_style,eval,llm_style_eval_097,64,6144,1024,bf16,NVIDIA GeForce RTX 4060,c06,64,128,32,4,3,8,0.0,0.0,54.08000014722347,76.7302384227514,14.891020077804962,0,-1,-1,64x6144x1024,0,
2026-03-03T03:12:44.360273+00:00,FULL,llm_style,eval,llm_style_eval_098,32,6144,1024,bf16,NVIDIA GeForce RTX 4060,c11,32,128,32,4,2,8,0.0,0.0,41.98399931192398,73.4310387074947,9.590634303522425,0,-1,-1,32x6144x1024,0,
2026-03-03T03:12:44.427695+00:00,FULL,llm_style,eval,llm_style_eval_099,1,2048,2048,bf16,NVIDIA GeForce RTX 4060,c00,32,32,32,2,2,8,0.0,67.374,43.95199939608574,62.041921243071506,0.19085839359442358,7,-1,-1,1x2048x2048,0,
2026-03-03T03:12:44.464635+00:00,FULL,llm_style,eval,llm_style_eval_100,64,8192,1024,bf16,NVIDIA GeForce RTX 4060,c06,64,128,32,4,3,8,0.0,0.0,62.33599968254566,118.70208263397198,17.22506784952792,0,-1,-1,64x8192x1024,0,
2026-03-03T03:12:44.526154+00:00,FULL,llm_style,eval,llm_style_eval_101,64,8192,1536,bf16,NVIDIA GeForce RTX 4060,c06,64,128,32,4,3,8,0.0,0.0,96.25600278377533,166.38592004776,16.73259526076519,0,-1,-1,64x8192x1536,0,
2026-03-03T03:12:44.550863+00:00,FULL,llm_style,eval,llm_style_eval_102,32,3072,2048,bf16,NVIDIA GeForce RTX 4060,c02,32,64,32,2,2,8,0.0,0.0,49.15200173854828,102.46176004409786,8.191999710241964,3,-1,-1,32x3072x2048,0,
2026-03-03T03:12:44.579968+00:00,FULL,llm_style,eval,llm_style_eval_103,64,2048,3072,bf16,NVIDIA GeForce RTX 4060,c03,64,64,32,4,2,8,0.0,0.0,84.87999811768532,149.86048564314834,9.487587015299534,3,-1,-1,64x2048x3072,0,
2026-03-03T03:12:44.642977+00:00,FULL,llm_style,eval,llm_style_eval_104,16,6144,2048,bf16,NVIDIA GeForce RTX 4060,c00,32,32,32,2,2,8,0.0,0.0,79.21599969267845,161.39455556869495,5.082978003965216,4,-1,-1,16x6144x2048,0,
2026-03-03T03:12:44.783026+00:00,FULL,llm_style,eval,llm_style_eval_105,1,1024,8192,bf16,NVIDIA GeForce RTX 4060,c04,64,64,64,4,3,8,0.0,139.998,84.73599702119827,224.94208529591555,0.1979939646641895,7,-1,-1,1x1024x8192,0,
2026-03-03T03:12:45.194610+00:00,FULL,llm_style,eval,llm_style_eval_106,32,4096,8192,bf16,NVIDIA GeForce RTX 4060,c11,32,128,32,4,2,8,0.0,411.542,294.76800560951233,421.20191723108275,7.285334931650735,3,-1,-1,32x4096x8192,0,
2026-03-03T03:12:45.254303+00:00,FULL,llm_style,eval,llm_style_eval_107,64,6144,1536,bf16,NVIDIA GeForce RTX 4060,c06,64,128,32,4,3,8,0.0,0.0,65.5359998345375,377.84958928823403,18.432000046536324,0,-1,-1,64x6144x1536,0,
2026-03-03T03:12:45.324906+00:00,FULL,llm_style,eval,llm_style_eval_108,8,3072,1536,bf16,NVIDIA GeForce RTX 4060,c00,32,32,32,2,2,8,0.0,70.554,38.68800029158592,90.86976263672098,1.9514441540267358,7,-1,-1,8x3072x1536,0,
2026-03-03T03:12:45.343733+00:00,FULL,llm_style,eval,llm_style_eval_109,16,2048,1024,bf16,NVIDIA GeForce RTX 4060,c11,32,128,32,4,2,8,0.0,0.0,42.01599955558777,147.01568126678467,1.5972216467494484,7,-1,-1,16x2048x1024,0,
2026-03-03T03:12:46.098047+00:00,FULL,llm_style,eval,llm_style_eval_110,1,8192,8192,bf16,NVIDIA GeForce RTX 4060,c06,64,128,32,4,3,8,0.0,754.272,564.1120076179504,648.6425483226776,0.23792744381874614,5,-1,-1,1x8192x8192,0,
2026-03-03T03:12:46.215489+00:00,FULL,llm_style,eval,llm_style_eval_111,8,6144,1536,bf16,NVIDIA GeForce RTX 4060,c11,32,128,32,4,2,8,0.0,117.403,47.47200012207031,53.790719583630555,3.180715866441882,4,-1,-1,8x6144x1536,0,
2026-03-03T03:12:46.312419+00:00,FULL,llm_style,eval,llm_style_eval_112,2,6144,3072,bf16,NVIDIA GeForce RTX 4060,c11,32,128,32,4,2,8,0.0,0.0,179.19999361038208,256.58718928694725,0.42130287216497986,5,-1,-1,2x6144x3072,0,
2026-03-03T03:12:46.622327+00:00,FULL,llm_style,eval,llm_style_eval_113,1,8192,8192,bf16,NVIDIA GeForce RTX 4060,c06,64,128,32,4,3,8,0.0,0.0,566.32000207901,634.1039979457853,0.2369998013619068,5,-1,-1,1x8192x8192,0,
2026-03-03T03:12:46.679704+00:00,FULL,llm_style,eval,llm_style_eval_114,1,3072,1024,bf16,NVIDIA GeForce RTX 4060,c11,32,128,32,4,2,8,0.0,57.326,37.88800165057182,42.94687904417515,0.1660540468199923,6,-1,-1,1x3072x1024,0,
2026-03-03T03:12:46.743865+00:00,FULL,llm_style,eval,llm_style_eval_115,16,3072,1536,bf16,NVIDIA GeForce RTX 4060,c00,32,32,32,2,2,8,0.0,64.122,41.39200039207935,89.89823728799816,3.6479257482055383,7,-1,-1,16x3072x1536,0,
2026-03-03T03:12:46.808377+00:00,FULL,llm_style,eval,llm_style_eval_116,8,3072,1024,bf16,NVIDIA GeForce RTX 4060,c11,32,128,32,4,2,8,0.0,64.469,41.360000148415565,52.11903993040323,1.2169160497918452,6,-1,-1,8x3072x1024,0,
2026-03-03T03:12:46.893823+00:00,FULL,llm_style,eval,llm_style_eval_117,4,1024,4096,bf16,NVIDIA GeForce RTX 4060,c04,64,64,64,4,3,8,0.0,85.411,56.32000043988228,59.934719763696194,0.5957818135285181,7,-1,-1,4x1024x4096,0,
2026-03-03T03:12:46.987426+00:00,FULL,llm_style,eval,llm_style_eval_118,64,6144,3072,bf16,NVIDIA GeForce RTX 4060,c11,32,128,32,4,2,8,0.0,0.0,183.631993830204,251.2131217122078,13.156308187961452,1,-1,-1,64x6144x3072,0,
2026-03-03T03:12:47.564114+00:00,FULL,llm_style,eval,llm_style_eval_119,64,8192,6144,bf16,NVIDIA GeForce RTX 4060,c06,64,128,32,4,3,8,0.0,576.63,442.3680007457733,589.7260701656339,14.563555531003347,1,-1,-1,64x8192x6144,0,
2026-03-03T03:12:47.681717+00:00,FULL,llm_style,eval,llm_style_eval_120,8,1024,4096,bf16,NVIDIA GeForce RTX 4060,c11,32,128,32,4,2,8,0.0,117.564,73.63200187683105,113.55519771575922,0.9114089293980799,7,-1,-1,8x1024x4096,0,
2026-03-03T03:12:47.740058+00:00,FULL,llm_style,eval,llm_style_eval_121,4,1024,2048,bf16,NVIDIA GeForce RTX 4060,c04,64,64,64,4,3,8,0.0,58.303,40.95999896526337,64.89343844354151,0.4096000103473666,7,-1,-1,4x1024x2048,0,
2026-03-03T03:12:48.055403+00:00,FULL,llm_style,eval,llm_style_eval_122,4,6144,4096,bf16,NVIDIA GeForce RTX 4060,c11,32,128,32,4,2,8,0.0,315.31,226.06400400400162,255.34624189138407,0.8905734147592833,5,-1,-1,4x6144x4096,0,
2026-03-03T03:12:48.341529+00:00,FULL,llm_style,eval,llm_style_eval_123,4,3072,8192,bf16,NVIDIA GeForce RTX 4060,c04,64,64,64,4,3,8,0.0,286.087,227.32800245285034,345.25184512138367,0.8856216120658376,7,-1,-1,4x3072x8192,0,
2026-03-03T03:12:48.371218+00:00,FULL,llm_style,eval,llm_style_eval_124,64,6144,1024,bf16,NVIDIA GeForce RTX 4060,c06,64,128,32,4,3,8,0.0,0.0,50.87999999523163,70.27712143957612,15.827562265634272,0,-1,-1,64x6144x1024,0,
2026-03-03T03:12:48.435729+00:00,FULL,llm_style,eval,llm_style_eval_125,64,1536,8192,bf16,NVIDIA GeForce RTX 4060,c04,64,64,64,4,3,8,0.0,0.0,118.76800283789635,276.60287827253325,13.560998732952404,3,-1,-1,64x1536x8192,0,
2026-03-03T03:12:48.522302+00:00,FULL,llm_style,eval,llm_style_eval_126,64,2048,8192,bf16,NVIDIA GeForce RTX 4060,c06,64,128,32,4,3,8,0.0,0.0,172.03199863433838,245.70208430290222,12.483047718143249,3,-1,-1,64x2048x8192,0,
2026-03-03T03:12:48.666756+00:00,FULL,llm_style,eval,llm_style_eval_127,2,8192,1536,bf16,NVIDIA GeForce RTX 4060,c11,32,128,32,4,2,8,0.0,144.406,64.46399912238121,87.72607989609239,0.7807714179265896,4,-1,-1,2x8192x1536,0,
2026-03-03T03:12:48.743735+00:00,FULL,llm_style,eval,llm_style_eval_128,8,2048,2048,bf16,NVIDIA GeForce RTX 4060,c00,32,32,32,2,2,8,0.0,76.939,47.10400104522705,110.35647995769972,1.4246956205602412,7,-1,-1,8x2048x2048,0,
2026-03-03T03:12:48.984257+00:00,FULL,llm_style,eval,llm_style_eval_129,64,8192,6144,bf16,NVIDIA GeForce RTX 4060,c06,64,128,32,4,3,8,0.0,0.0,442.1120136976242,510.1878160238266,14.571987967751125,1,-1,-1,64x8192x6144,0,
2026-03-03T03:12:49.004896+00:00,FULL,llm_style,eval,llm_style_eval_130,16,3072,1536,bf16,NVIDIA GeForce RTX 4060,c00,32,32,32,2,2,8,0.0,0.0,65.5359998345375,129.07776251435268,2.3040000058170405,7,-1,-1,16x3072x1536,0,
2026-03-03T03:12:49.735110+00:00,FULL,llm_style,eval,llm_style_eval_131,32,8192,8192,bf16,NVIDIA GeForce RTX 4060,c11,32,128,32,4,2,8,0.0,730.155,563.7120008468628,601.5305763483047,7.619080824157875,1,-1,-1,32x8192x8192,0,
2026-03-03T03:12:50.148251+00:00,FULL,llm_style,eval,llm_style_eval_132,32,8192,4096,bf16,NVIDIA GeForce RTX 4060,c11,32,128,32,4,2,8,0.0,413.097,295.9839999675751,337.66400635242456,7.255404509146629,1,-1,-1,32x8192x4096,0,
2026-03-03T03:12:50.903443+00:00,FULL,llm_style,eval,llm_style_eval_133,2,8192,8192,bf16,NVIDIA GeForce RTX 4060,c11,32,128,32,4,2,8,0.0,755.152,557.7600002288818,593.358074426651,0.4812741248742203,5,-1,-1,2x8192x8192,0,
2026-03-03T03:12:51.020639+00:00,FULL,llm_style,eval,llm_style_eval_134,64,3072,3072,bf16,NVIDIA GeForce RTX 4060,c06,64,128,32,4,3,8,0.0,117.151,65.5359998345375,102.430720925331,18.432000046536324,3,-1,-1,64x3072x3072,0,
2026-03-03T03:12:51.132813+00:00,FULL,llm_style,eval,llm_style_eval_135,8,3072,3072,bf16,NVIDIA GeForce RTX 4060,c00,32,32,32,2,2,8,0.0,112.136,57.103998959064484,150.22079840302453,2.6442096307167926,7,-1,-1,8x3072x3072,0,
2026-03-03T03:12:51.254698+00:00,FULL,llm_style,eval,llm_style_eval_136,4,2048,4096,bf16,NVIDIA GeForce RTX 4060,c02,32,64,32,2,2,8,0.0,121.842,73.72800260782242,81.41823776066303,0.9102221900268849,7,-1,-1,4x2048x4096,0,
2026-03-03T03:12:51.979690+00:00,FULL,llm_style,eval,llm_style_eval_137,4,8192,8192,bf16,NVIDIA GeForce RTX 4060,c02,32,64,32,2,2,8,0.0,724.953,559.0880215167999,630.4700917005539,0.9602618753009138,5,-1,-1,4x8192x8192,0,
2026-03-03T03:12:52.044392+00:00,FULL,llm_style,eval,llm_style_eval_138,16,1024,1024,bf16,NVIDIA GeForce RTX 4060,c04,64,64,64,4,3,8,0.0,64.662,39.93599861860275,121.96479931473718,0.8402051572680562,7,-1,-1,16x1024x1024,0,
2026-03-03T03:12:52.101809+00:00,FULL,llm_style,eval,llm_style_eval_139,4,1024,1024,bf16,NVIDIA GeForce RTX 4060,c04,64,64,64,4,3,8,0.0,57.383,34.81600061058998,77.05888096243136,0.2409411722450521,7,-1,-1,4x1024x1024,0,
2026-03-03T03:12:52.243813+00:00,FULL,llm_style,eval,llm_style_eval_140,64,4096,6144,bf16,NVIDIA GeForce RTX 4060,c02,32,64,32,2,2,8,0.0,0.0,236.60799860954285,336.72191858291615,13.614186717819951,3,-1,-1,64x4096x6144,0,
2026-03-03T03:12:52.365343+00:00,FULL,llm_style,eval,llm_style_eval_141,4,6144,4096,bf16,NVIDIA GeForce RTX 4060,c11,32,128,32,4,2,8,0.0,0.0,229.88799959421158,364.6668693423271,0.875759467024695,5,-1,-1,4x6144x4096,0,
2026-03-03T03:12:52.529952+00:00,FULL,llm_style,eval,llm_style_eval_142,4,2048,6144,bf16,NVIDIA GeForce RTX 4060,c00,32,32,32,2,2,8,0.0,164.56,101.35999694466591,215.30240431427947,0.9931264703466177,7,-1,-1,4x2048x6144,0,
2026-03-03T03:12:52.598360+00:00,FULL,llm_style,eval,llm_style_eval_143,64,1536,8192,bf16,NVIDIA GeForce RTX 4060,c04,64,64,64,4,3,8,0.0,0.0,89.93599936366081,158.38591977953894,17.90843207832055,3,-1,-1,64x1536x8192,0,
2026-03-03T03:12:52.709680+00:00,FULL,llm_style,eval,llm_style_eval_144,1,3072,3072,bf16,NVIDIA GeForce RTX 4060,c00,32,32,32,2,2,8,0.0,111.271,53.679998964071274,215.04159718751896,0.351608948663223,7,-1,-1,1x3072x3072,0,
2026-03-03T03:12:52.724625+00:00,FULL,llm_style,eval,llm_style_eval_145,32,1024,2048,bf16,NVIDIA GeForce RTX 4060,c04,64,64,64,4,3,8,0.0,0.0,46.89599946141243,59.86143890768288,2.8620293743912795,3,-1,-1,32x1024x2048,0,
2026-03-03T03:12:52.898258+00:00,FULL,llm_style,eval,llm_style_eval_146,64,8192,4096,bf16,NVIDIA GeForce RTX 4060,c10,64,128,64,8,3,8,0.0,0.0,305.64799904823303,333.3222448825836,14.05200527853686,1,-1,-1,64x8192x4096,0,
2026-03-03T03:12:52.948525+00:00,FULL,llm_style,eval,llm_style_eval_147,64,2048,4096,bf16,NVIDIA GeForce RTX 4060,c03,64,64,32,4,2,8,0.0,0.0,80.89599758386612,193.586558252573,13.273114320480879,3,-1,-1,64x2048x4096,0,
2026-03-03T03:12:52.977307+00:00,FULL,llm_style,eval,llm_style_eval_148,64,1024,6144,bf16,NVIDIA GeForce RTX 4060,c04,64,64,64,4,3,8,0.0,0.0,78.84799689054489,152.07519873976707,10.213403000179055,3,-1,-1,64x1024x6144,0,
2026-03-03T03:12:53.149656+00:00,FULL,llm_style,eval,llm_style_eval_149,64,4096,8192,bf16,NVIDIA GeForce RTX 4060,c04,64,64,64,4,3,8,0.0,0.0,306.5759986639023,319.48544323444366,14.009470130466902,3,-1,-1,64x4096x8192,0,
2026-03-03T03:12:53.245653+00:00,FULL,llm_style,eval,llm_style_eval_150,2,2048,3072,bf16,NVIDIA GeForce RTX 4060,c00,32,32,32,2,2,8,0.0,95.941,46.592000871896744,171.9193620979785,0.5401318580241413,7,-1,-1,2x2048x3072,0,
2026-03-03T03:12:53.357952+00:00,FULL,llm_style,eval,llm_style_eval_151,64,4096,2048,bf16,NVIDIA GeForce RTX 4060,c04,64,64,64,4,3,8,0.0,112.254,66.94399937987328,74.4832007586956,16.039403590261454,3,-1,-1,64x4096x2048,0,
2026-03-03T03:12:54.138776+00:00,FULL,llm_style,eval,llm_style_eval_152,8,8192,8192,bf16,NVIDIA GeForce RTX 4060,c10,64,128,64,8,3,8,0.0,780.774,561.0239803791046,623.9459264278412,1.9138964849139477,5,-1,-1,8x8192x8192,0,
2026-03-03T03:12:54.243282+00:00,FULL,llm_style,eval,llm_style_eval_153,64,8192,2048,bf16,NVIDIA GeForce RTX 4060,c10,64,128,64,8,3,8,0.0,0.0,174.0799993276596,270.12095808982843,12.336188282939554,0,-1,-1,64x8192x2048,0,
2026-03-03T03:12:54.484144+00:00,FULL,llm_style,eval,llm_style_eval_154,16,2048,8192,bf16,NVIDIA GeForce RTX 4060,c10,64,128,64,8,3,8,0.0,240.806,162.78399527072906,186.74880370497698,3.298057103876337,7,-1,-1,16x2048x8192,0,
2026-03-03T03:12:54.562750+00:00,FULL,llm_style,eval,llm_style_eval_155,4,2048,1536,bf16,NVIDIA GeForce RTX 4060,c11,32,128,32,4,2,8,0.0,78.567,45.05600035190582,53.68863895535469,0.5585454501829857,7,-1,-1,4x2048x1536,0,
2026-03-03T03:12:54.695330+00:00,FULL,llm_style,eval,llm_style_eval_156,1,4096,6144,bf16,NVIDIA GeForce RTX 4060,c11,32,128,32,4,2,8,0.0,0.0,230.9119999408722,306.80544674396515,0.21796895792721047,7,-1,-1,1x4096x6144,0,
2026-03-03T03:12:54.881094+00:00,FULL,llm_style,eval,llm_style_eval_157,1,1536,8192,bf16,NVIDIA GeForce RTX 4060,c04,64,64,64,4,3,8,0.0,185.713,119.72800269722939,164.53215956687913,0.2101916296360497,7,-1,-1,1x1536x8192,0,
2026-03-03T03:12:54.956357+00:00,FULL,llm_style,eval,llm_style_eval_158,64,1536,8192,bf16,NVIDIA GeForce RTX 4060,c04,64,64,64,4,3,8,0.0,0.0,115.7120019197464,201.30816474556923,13.91915021154903,3,-1,-1,64x1536x8192,0,
2026-03-03T03:12:55.065462+00:00,FULL,llm_style,eval,llm_style_eval_159,16,6144,1536,bf16,NVIDIA GeForce RTX 4060,c11,32,128,32,4,2,8,0.0,109.057,47.10400104522705,53.79487946629523,6.411130292521085,4,-1,-1,16x6144x1536,0,
2026-03-03T03:12:55.254553+00:00,FULL,llm_style,eval,llm_style_eval_160,32,6144,6144,bf16,NVIDIA GeForce RTX 4060,c00,32,32,32,2,2,8,0.0,0.0,332.8319936990738,403.4150496125219,7.258674495650576,1,-1,-1,32x6144x6144,0,
2026-03-03T03:12:55.350148+00:00,FULL,llm_style,eval,llm_style_eval_161,2,1536,4096,bf16,NVIDIA GeForce RTX 4060,c04,64,64,64,4,3,8,0.0,95.546,57.0559985935688,63.47711890935898,0.44107236084439727,7,-1,-1,2x1536x4096,0,
2026-03-03T03:12:55.433253+00:00,FULL,llm_style,eval,llm_style_eval_162,64,1536,3072,bf16,NVIDIA GeForce RTX 4060,c04,64,64,64,4,3,8,0.0,83.061,49.23199862241745,54.63136021047829,12.26803284246482,3,-1,-1,64x1536x3072,0,
2026-03-03T03:12:55.473329+00:00,FULL,llm_style,eval,llm_style_eval_163,64,1024,8192,bf16,NVIDIA GeForce RTX 4060,c00,32,32,32,2,2,8,0.0,0.0,95.23200243711472,108.0422393232584,11.27501046414552,3,-1,-1,64x1024x8192,0,
2026-03-03T03:12:55.640665+00:00,FULL,llm_style,eval,llm_style_eval_164,64,4096,8192,bf16,NVIDIA GeForce RTX 4060,c04,64,64,64,4,3,8,0.0,0.0,330.49599826335907,364.06272053718567,12.995519820417044,3,-1,-1,64x4096x8192,0,
2026-03-03T03:12:55.936748+00:00,FULL,llm_style,eval,llm_style_eval_165,4,8192,3072,bf16,NVIDIA GeForce RTX 4060,c02,32,64,32,2,2,8,0.0,296.032,226.30399465560913,244.20159682631493,0.8896289802854788,4,-1,-1,4x8192x3072,0,
2026-03-03T03:12:55.977156+00:00,FULL,llm_style,eval,llm_style_eval_166,64,1024,6144,bf16,NVIDIA GeForce RTX 4060,c04,64,64,64,4,3,8,0.0,0.0,75.77600330114365,177.23199874162668,10.627458996479508,3,-1,-1,64x1024x6144,0,
2026-03-03T03:12:55.989336+00:00,FULL,llm_style,eval,llm_style_eval_167,2,2048,1024,bf16,NVIDIA GeForce RTX 4060,c00,32,32,32,2,2,8,0.0,0.0,39.263999089598656,163.9529646933078,0.21364629672228697,7,-1,-1,2x2048x1024,0,
2026-03-03T03:12:56.012731+00:00,FULL,llm_style,eval,llm_style_eval_168,64,4096,1024,bf16,NVIDIA GeForce RTX 4060,c04,64,64,64,4,3,8,0.0,0.0,94.14400160312653,189.61120173335075,5.702656599017675,2,-1,-1,64x4096x1024,0,
2026-03-03T03:12:56.053468+00:00,FULL,llm_style,eval,llm_style_eval_169,4,1536,6144,bf16,NVIDIA GeForce RTX 4060,c04,64,64,64,4,3,8,0.0,0.0,74.48000088334084,134.17472057044495,1.0136609976448958,7,-1,-1,4x1536x6144,0,
2026-03-03T03:12:56.070272+00:00,FULL,llm_style,eval,llm_style_eval_170,16,1536,1536,bf16,NVIDIA GeForce RTX 4060,c04,64,64,64,4,3,8,0.0,0.0,63.53599950671196,96.17760218679905,1.1882629152945716,7,-1,-1,16x1536x1536,0,
2026-03-03T03:12:56.160600+00:00,FULL,llm_style,eval,llm_style_eval_171,1,2048,3072,bf16,NVIDIA GeForce RTX 4060,c00,32,32,32,2,2,8,0.0,90.29,51.183998584747314,108.40959802269936,0.24583683080496316,7,-1,-1,1x2048x3072,0,
2026-03-03T03:12:56.246902+00:00,FULL,llm_style,eval,llm_style_eval_172,64,3072,2048,bf16,NVIDIA GeForce RTX 4060,c06,64,128,32,4,3,8,0.0,86.26,54.11199852824211,61.02623865008353,14.882214479284015,3,-1,-1,64x3072x2048,0,
2026-03-03T03:12:56.526081+00:00,FULL,llm_style,eval,llm_style_eval_173,64,8192,6144,bf16,NVIDIA GeForce RTX 4060,c06,64,128,32,4,3,8,0.0,0.0,442.0800060033798,506.4192110300064,14.573043015998207,1,-1,-1,64x8192x6144,0,
2026-03-03T03:12:56.745516+00:00,FULL,llm_style,eval,llm_style_eval_174,2,4096,4096,bf16,NVIDIA GeForce RTX 4060,c11,32,128,32,4,2,8,0.0,219.381,159.743994474411,271.3702385127543,0.4201025786340281,7,-1,-1,2x4096x4096,0,
2026-03-03T03:12:56.790513+00:00,FULL,llm_style,eval,llm_style_eval_175,64,4096,2048,bf16,NVIDIA GeForce RTX 4060,c04,64,64,64,4,3,8,0.0,0.0,74.41600039601326,132.34527938067907,14.428910695091917,3,-1,-1,64x4096x2048,0,
2026-03-03T03:12:56.852402+00:00,FULL,llm_style,eval,llm_style_eval_176,16,6144,2048,bf16,NVIDIA GeForce RTX 4060,c00,32,32,32,2,2,8,0.0,0.0,80.38399741053581,218.28608304262147,5.0091211804704905,4,-1,-1,16x6144x2048,0,
2026-03-03T03:12:56.896503+00:00,FULL,llm_style,eval,llm_style_eval_177,1,6144,1536,bf16,NVIDIA GeForce RTX 4060,c11,32,128,32,4,2,8,0.0,0.0,46.959999948740005,61.88927900046107,0.40192436159716016,4,-1,-1,1x6144x1536,0,
2026-03-03T03:12:57.442338+00:00,FULL,llm_style,eval,llm_style_eval_178,32,6144,8192,bf16,NVIDIA GeForce RTX 4060,c06,64,128,32,4,3,8,0.0,545.786,426.9759953022003,461.54431730508804,7.544277681746761,1,-1,-1,32x6144x8192,0,
2026-03-03T03:12:57.574103+00:00,FULL,llm_style,eval,llm_style_eval_179,64,4096,6144,bf16,NVIDIA GeForce RTX 4060,c02,32,64,32,2,2,8,0.0,0.0,235.50400137901306,324.543040692806,13.678007393241089,3,-1,-1,64x4096x6144,0,
2026-03-03T03:12:57.591564+00:00,FULL,llm_style,eval,llm_style_eval_180,64,2048,1536,bf16,NVIDIA GeForce RTX 4060,c03,64,64,32,4,2,8,0.0,0.0,41.840000078082085,195.14847844839073,9.623642047049856,3,-1,-1,64x2048x1536,0,
2026-03-03T03:12:57.618129+00:00,FULL,llm_style,eval,llm_style_eval_181,64,2048,3072,bf16,NVIDIA GeForce RTX 4060,c03,64,64,32,4,2,8,0.0,0.0,63.999999314546585,108.78976322710508,12.582912134765627,3,-1,-1,64x2048x3072,0,
2026-03-03T03:12:57.685257+00:00,FULL,llm_style,eval,llm_style_eval_182,32,3072,1536,bf16,NVIDIA GeForce RTX 4060,c03,64,64,32,4,2,8,0.0,67.077,45.05600035190582,60.89375901967284,6.702545402195828,3,-1,-1,32x3072x1536,0,
2026-03-03T03:12:57.768745+00:00,FULL,llm_style,eval,llm_style_eval_183,8,8192,2048,bf16,NVIDIA GeForce RTX 4060,c10,64,128,64,8,3,8,0.0,0.0,163.83999586105347,280.5577501654624,1.6384000413894664,4,-1,-1,8x8192x2048,0,
2026-03-03T03:12:57.802860+00:00,FULL,llm_style,eval,llm_style_eval_184,64,8192,1024,bf16,NVIDIA GeForce RTX 4060,c06,64,128,32,4,3,8,0.0,0.0,68.43199953436852,109.55807909369457,15.69063933987105,0,-1,-1,64x8192x1024,0,
2026-03-03T03:12:57.865269+00:00,FULL,llm_style,eval,llm_style_eval_185,1,8192,1536,bf16,NVIDIA GeForce RTX 4060,c00,32,32,32,2,2,8,0.0,0.0,72.1920020878315,228.73312056064603,0.3485957345992748,4,-1,-1,1x8192x1536,0,
2026-03-03T03:12:57.892887+00:00,FULL,llm_style,eval,llm_style_eval_186,16,6144,1024,bf16,NVIDIA GeForce RTX 4060,c11,32,128,32,4,2,8,0.0,0.0,67.96799972653389,222.36512005329118,2.9620791079629862,4,-1,-1,16x6144x1024,0,
2026-03-03T03:12:57.921635+00:00,FULL,llm_style,eval,llm_style_eval_187,1,1024,6144,bf16,NVIDIA GeForce RTX 4060,c04,64,64,64,4,3,8,0.0,0.0,74.14400205016136,149.07327309250826,0.16970910191072716,7,-1,-1,1x1024x6144,0,
2026-03-03T03:12:58.331325+00:00,FULL,llm_style,eval,llm_style_eval_188,8,8192,4096,bf16,NVIDIA GeForce RTX 4060,c11,32,128,32,4,2,8,0.0,409.639,295.26400566101074,408.25663447380066,1.8182741604351715,5,-1,-1,8x8192x4096,0,
2026-03-03T03:12:58.561190+00:00,FULL,llm_style,eval,llm_style_eval_189,8,2048,8192,bf16,NVIDIA GeForce RTX 4060,c10,64,128,64,8,3,8,0.0,229.821,161.72799468040466,187.45344385504723,1.6597958598971254,7,-1,-1,8x2048x8192,0,
2026-03-03T03:12:58.770655+00:00,FULL,llm_style,eval,llm_style_eval_190,4,8192,2048,bf16,NVIDIA GeForce RTX 4060,c11,32,128,32,4,2,8,0.0,209.427,160.15999764204025,209.40223947167397,0.8380227895605894,4,-1,-1,4x8192x2048,0,
2026-03-03T03:12:59.097886+00:00,FULL,llm_style,eval,llm_style_eval_191,4,8192,8192,bf16,NVIDIA GeForce RTX 4060,c02,32,64,32,2,2,8,0.0,0.0,561.5519881248474,698.7635201215744,0.9560484574059416,5,-1,-1,4x8192x8192,0,
2026-03-03T03:12:59.109899+00:00,FULL,llm_style,eval,llm_style_eval_192,64,1536,1024,bf16,NVIDIA GeForce RTX 4060,c04,64,64,64,4,3,8,0.0,0.0,64.46399912238121,226.3491290807723,3.123085671706358,3,-1,-1,64x1536x1024,0,
2026-03-03T03:12:59.129384+00:00,FULL,llm_style,eval,llm_style_eval_193,32,2048,2048,bf16,NVIDIA GeForce RTX 4060,c11,32,128,32,4,2,8,0.0,0.0,55.296000093221664,142.64671906828872,4.854518510334449,3,-1,-1,32x2048x2048,0,
2026-03-03T03:12:59.140917+00:00,FULL,llm_style,eval,llm_style_eval_194,8,1024,2048,bf16,NVIDIA GeForce RTX 4060,c00,32,32,32,2,2,8,0.0,0.0,47.10400104522705,101.23552031815044,0.7123478102801206,7,-1,-1,8x1024x2048,0,
2026-03-03T03:12:59.173132+00:00,FULL,llm_style,eval,llm_style_eval_195,2,4096,2048,bf16,NVIDIA GeForce RTX 4060,c00,32,32,32,2,2,8,0.0,0.0,55.296000093221664,114.47519704699499,0.6068148137918061,7,-1,-1,2x4096x2048,0,
2026-03-03T03:12:59.216404+00:00,FULL,llm_style,eval,llm_style_eval_196,32,2048,4096,bf16,NVIDIA GeForce RTX 4060,c00,32,32,32,2,2,8,0.0,0.0,64.44799900054932,75.69696150720117,8.330296057685578,3,-1,-1,32x2048x4096,0,
2026-03-03T03:12:59.369850+00:00,FULL,llm_style,eval,llm_style_eval_197,32,8192,1536,bf16,NVIDIA GeForce RTX 4060,c11,32,128,32,4,2,8,0.0,153.394,81.91999793052673,86.75263747572899,9.8304002483368,0,-1,-1,32x8192x1536,0,
2026-03-03T03:12:59.534080+00:00,FULL,llm_style,eval,llm_style_eval_198,64,4096,8192,bf16,NVIDIA GeForce RTX 4060,c04,64,64,64,4,3,8,0.0,0.0,326.01600885391235,475.3305450081822,13.174099367385892,3,-1,-1,64x4096x8192,0,
2026-03-03T03:12:59.920407+00:00,FULL,llm_style,eval,llm_style_eval_199,2,8192,4096,bf16,NVIDIA GeForce RTX 4060,c11,32,128,32,4,2,8,0.0,386.281,292.86399483680725,338.0121660232543,0.4582937143734251,5,-1,-1,2x8192x4096,0,
2026-03-03T03:12:59.999970+00:00,FULL,llm_style,eval,llm_style_eval_200,1,4096,1024,bf16,NVIDIA GeForce RTX 4060,c11,32,128,32,4,2,8,0.0,79.519,40.95999896526337,53.15263867378235,0.2048000051736833,6,-1,-1,1x4096x1024,0,
2026-03-03T03:13:00.184013+00:00,FULL,llm_style,eval,llm_style_eval_201,4,1536,8192,bf16,NVIDIA GeForce RTX 4060,c04,64,64,64,4,3,8,0.0,183.999,97.120001912117,152.6086398959158,1.0364836698735784,7,-1,-1,4x1536x8192,0,
2026-03-03T03:13:00.422752+00:00,FULL,llm_style,eval,llm_style_eval_202,1,6144,3072,bf16,NVIDIA GeForce RTX 4060,c11,32,128,32,4,2,8,0.0,238.699,176.92799866199493,187.2822391986847,0.2133564856069817,5,-1,-1,1x6144x3072,0,
2026-03-03T03:13:00.606098+00:00,FULL,llm_style,eval,llm_style_eval_203,16,2048,6144,bf16,NVIDIA GeForce RTX 4060,c00,32,32,32,2,2,8,0.0,183.302,106.44799843430519,217.46303394436836,3.7826280430110577,7,-1,-1,16x2048x6144,0,
2026-03-03T03:13:00.615699+00:00,FULL,llm_style,eval,llm_style_eval_204,16,1536,1024,bf16,NVIDIA GeForce RTX 4060,c04,64,64,64,4,3,8,0.0,0.0,33.663999289274216,240.21344915032333,1.4951179022878696,7,-1,-1,16x1536x1024,0,
2026-03-03T03:13:00.681657+00:00,FULL,llm_style,eval,llm_style_eval_205,64,6144,2048,bf16,NVIDIA GeForce RTX 4060,c06,64,128,32,4,3,8,0.0,0.0,98.28800335526466,107.13407926261424,16.38666654137226,0,-1,-1,64x6144x2048,0,
2026-03-03T03:13:00.743662+00:00,FULL,llm_style,eval,llm_style_eval_206,4,2048,6144,bf16,NVIDIA GeForce RTX 4060,c00,32,32,32,2,2,8,0.0,0.0,101.88799723982811,188.07551920413965,0.9879799262621155,7,-1,-1,4x2048x6144,0,
2026-03-03T03:13:00.862950+00:00,FULL,llm_style,eval,llm_style_eval_207,32,6144,1536,bf16,NVIDIA GeForce RTX 4060,c11,32,128,32,4,2,8,0.0,119.24,48.128001391887665,52.61568013578653,12.549446445573892,0,-1,-1,32x6144x1536,0,
2026-03-03T03:13:00.928824+00:00,FULL,llm_style,eval,llm_style_eval_208,4,2048,1024,bf16,NVIDIA GeForce RTX 4060,c11,32,128,32,4,2,8,0.0,65.83,42.51199960708618,56.36096045374869,0.39464659755038817,7,-1,-1,4x2048x1024,0,
2026-03-03T03:13:00.990983+00:00,FULL,llm_style,eval,llm_style_eval_209,1,1024,1536,bf16,NVIDIA GeForce RTX 4060,c00,32,32,32,2,2,8,0.0,62.112,38.91199827194214,90.76128080487248,0.08084210885330595,7,-1,-1,1x1024x1536,0,
2026-03-03T03:13:01.292395+00:00,FULL,llm_style,eval,llm_style_eval_210,8,6144,4096,bf16,NVIDIA GeForce RTX 4060,c11,32,128,32,4,2,8,0.0,301.367,226.17600113153458,233.88000383973122,1.7802648467811297,5,-1,-1,8x6144x4096,0,
2026-03-03T03:13:01.539711+00:00,FULL,llm_style,eval,llm_style_eval_211,4,2048,8192,bf16,NVIDIA GeForce RTX 4060,c10,64,128,64,8,3,8,0.0,247.278,160.76800227165222,200.09439542889584,0.8348534913882316,7,-1,-1,4x2048x8192,0,
2026-03-03T03:13:01.602825+00:00,FULL,llm_style,eval,llm_style_eval_212,32,1024,1024,bf16,NVIDIA GeForce RTX 4060,c00,32,32,32,2,2,8,0.0,63.078,38.91199827194214,231.77152723073942,1.7246316555371939,3,-1,-1,32x1024x1024,0,
2026-03-03T03:13:01.671577+00:00,FULL,llm_style,eval,llm_style_eval_213,16,3072,4096,bf16,NVIDIA GeForce RTX 4060,c04,64,64,64,4,3,8,0.0,0.0,86.01599931716919,103.35103996098039,4.681142894303718,7,-1,-1,16x3072x4096,0,
2026-03-03T03:13:01.726570+00:00,FULL,llm_style,eval,llm_style_eval_214,64,1024,8192,bf16,NVIDIA GeForce RTX 4060,c00,32,32,32,2,2,8,0.0,0.0,99.31199997663498,186.43392220139498,10.811803450263996,3,-1,-1,64x1024x8192,0,
2026-03-03T03:13:01.750976+00:00,FULL,llm_style,eval,llm_style_eval_215,4,4096,1536,bf16,NVIDIA GeForce RTX 4060,c11,32,128,32,4,2,8,0.0,0.0,45.05600035190582,110.1395197957754,1.1170909003659715,6,-1,-1,4x4096x1536,0,
2026-03-03T03:13:01.832550+00:00,FULL,llm_style,eval,llm_style_eval_216,16,1536,3072,bf16,NVIDIA GeForce RTX 4060,c04,64,64,64,4,3,8,0.0,81.529,50.175998359918594,59.914241656661034,3.0093062208128822,7,-1,-1,16x1536x3072,0,
2026-03-03T03:13:01.899010+00:00,FULL,llm_style,eval,llm_style_eval_217,8,6144,2048,bf16,NVIDIA GeForce RTX 4060,c00,32,32,32,2,2,8,0.0,0.0,69.12000104784966,114.66688111424445,2.912711066954814,4,-1,-1,8x6144x2048,0,
2026-03-03T03:13:02.045048+00:00,FULL,llm_style,eval,llm_style_eval_218,8,3072,4096,bf16,NVIDIA GeForce RTX 4060,c04,64,64,64,4,3,8,0.0,145.982,81.85599744319916,88.11296038329601,2.4595215779968096,7,-1,-1,8x3072x4096,0,
2026-03-03T03:13:02.373235+00:00,FULL,llm_style,eval,llm_style_eval_219,64,8192,3072,bf16,NVIDIA GeForce RTX 4060,c10,64,128,64,8,3,8,0.0,328.138,233.47200453281403,257.5401723384857,13.797052363711826,0,-1,-1,64x8192x3072,0,
2026-03-03T03:13:02.411079+00:00,FULL,llm_style,eval,llm_style_eval_220,2,4096,2048,bf16,NVIDIA GeForce RTX 4060,c00,32,32,32,2,2,8,0.0,0.0,54.83200028538704,279.0707138180733,0.6119498071446866,7,-1,-1,2x4096x2048,0,
2026-03-03T03:13:02.560714+00:00,FULL,llm_style,eval,llm_style_eval_221,4,1024,8192,bf16,NVIDIA GeForce RTX 4060,c00,32,32,32,2,2,8,0.0,149.586,83.3279974758625,180.86911782622334,0.8053579353018694,7,-1,-1,4x1024x8192,0,
2026-03-03T03:13:02.637112+00:00,FULL,llm_style,eval,llm_style_eval_222,64,6144,2048,bf16,NVIDIA GeForce RTX 4060,c06,64,128,32,4,3,8,0.0,0.0,99.02400150895119,181.2419238686561,16.264872267905776,0,-1,-1,64x6144x2048,0,
2026-03-03T03:13:02.715567+00:00,FULL,llm_style,eval,llm_style_eval_223,4,2048,2048,bf16,NVIDIA GeForce RTX 4060,c11,32,128,32,4,2,8,0.0,78.404,51.183998584747314,56.89536087214946,0.6555648821465685,7,-1,-1,4x2048x2048,0,
2026-03-03T03:13:02.734518+00:00,FULL,llm_style,eval,llm_style_eval_224,16,3072,1536,bf16,NVIDIA GeForce RTX 4060,c00,32,32,32,2,2,8,0.0,0.0,40.95999896526337,116.92032232880588,3.6864000931262995,7,-1,-1,16x3072x1536,0,
2026-03-03T03:13:02.751460+00:00,FULL,llm_style,eval,llm_style_eval_225,1,2048,2048,bf16,NVIDIA GeForce RTX 4060,c00,32,32,32,2,2,8,0.0,0.0,36.86400130391121,94.28992211818692,0.22755554750672122,7,-1,-1,1x2048x2048,0,
2026-03-03T03:13:02.762178+00:00,FULL,llm_style,eval,llm_style_eval_226,8,1536,1024,bf16,NVIDIA GeForce RTX 4060,c00,32,32,32,2,2,8,0.0,0.0,41.56799986958504,139.54687826335424,0.6054133968185855,7,-1,-1,8x1536x1024,0,
2026-03-03T03:13:02.954611+00:00,FULL,llm_style,eval,llm_style_eval_227,64,6144,6144,bf16,NVIDIA GeForce RTX 4060,c11,32,128,32,4,2,8,0.0,0.0,337.2479975223541,470.60927867889404,14.327255442575982,1,-1,-1,64x6144x6144,0,
2026-03-03T03:13:03.020408+00:00,FULL,llm_style,eval,llm_style_eval_228,64,6144,2048,bf16,NVIDIA GeForce RTX 4060,c06,64,128,32,4,3,8,0.0,0.0,101.3759970664978,257.43359714746447,15.887515611249823,0,-1,-1,64x6144x2048,0,
2026-03-03T03:13:03.205413+00:00,FULL,llm_style,eval,llm_style_eval_229,16,1536,8192,bf16,NVIDIA GeForce RTX 4060,c04,64,64,64,4,3,8,0.0,184.949,102.20800340175629,115.10528080165386,3.93954651885002,7,-1,-1,16x1536x8192,0,
2026-03-03T03:13:03.227547+00:00,FULL,llm_style,eval,llm_style_eval_230,64,2048,1536,bf16,NVIDIA GeForce RTX 4060,c03,64,64,32,4,2,8,0.0,0.0,52.22399905323982,101.89823724329472,7.710117786834262,3,-1,-1,64x2048x1536,0,
2026-03-03T03:13:03.274813+00:00,FULL,llm_style,eval,llm_style_eval_231,4,1024,8192,bf16,NVIDIA GeForce RTX 4060,c00,32,32,32,2,2,8,0.0,0.0,88.04799988865852,101.75327993929386,0.7621849909692758,7,-1,-1,4x1024x8192,0,
2026-03-03T03:13:03.293103+00:00,FULL,llm_style,eval,llm_style_eval_232,16,3072,1536,bf16,NVIDIA GeForce RTX 4060,c00,32,32,32,2,2,8,0.0,0.0,41.32799990475178,140.8921593427658,3.653574921312343,7,-1,-1,16x3072x1536,0,
2026-03-03T03:13:03.342284+00:00,FULL,llm_style,eval,llm_style_eval_233,64,3072,3072,bf16,NVIDIA GeForce RTX 4060,c06,64,128,32,4,3,8,0.0,0.0,68.44799965620041,79.29120011627674,17.647843005892376,3,-1,-1,64x3072x3072,0,
2026-03-03T03:13:03.506899+00:00,FULL,llm_style,eval,llm_style_eval_234,32,8192,4096,bf16,NVIDIA GeForce RTX 4060,c11,32,128,32,4,2,8,0.0,0.0,298.70399832725525,415.5337589979171,7.1893368017365855,1,-1,-1,32x8192x4096,0,
2026-03-03T03:13:03.520647+00:00,FULL,llm_style,eval,llm_style_eval_235,4,2048,1024,bf16,NVIDIA GeForce RTX 4060,c11,32,128,32,4,2,8,0.0,0.0,63.48799914121628,190.6790408492087,0.2642580680906711,7,-1,-1,4x2048x1024,0,
2026-03-03T03:13:03.643374+00:00,FULL,llm_style,eval,llm_style_eval_236,4,8192,3072,bf16,NVIDIA GeForce RTX 4060,c02,32,64,32,2,2,8,0.0,0.0,228.7519946694374,313.0271962285039,0.8801085747511447,4,-1,-1,4x8192x3072,0,
2026-03-03T03:13:03.664257+00:00,FULL,llm_style,eval,llm_style_eval_237,64,1024,4096,bf16,NVIDIA GeForce RTX 4060,c04,64,64,64,4,3,8,0.0,0.0,60.40000170469284,122.27327942848206,8.888591007411963,3,-1,-1,64x1024x4096,0,
2026-03-03T03:13:03.843790+00:00,FULL,llm_style,eval,llm_style_eval_238,32,2048,6144,bf16,NVIDIA GeForce RTX 4060,c04,64,64,64,4,3,8,0.0,179.486,107.51999914646149,114.18624140322208,7.489828630885948,3,-1,-1,32x2048x6144,0,
2026-03-03T03:13:03.851359+00:00,FULL,llm_style,eval,llm_style_eval_239,32,2048,6144,bf16,NVIDIA GeForce RTX 4060,c04,64,64,64,4,3,8,0.0,0.0,105.47199845314026,133.42752352356905,7.635262247901621,3,-1,-1,32x2048x6144,0,
2026-03-03T03:13:03.997595+00:00,FULL,llm_style,eval,llm_style_eval_240,8,8192,1536,bf16,NVIDIA GeForce RTX 4060,c11,32,128,32,4,2,8,0.0,146.21,66.56000018119812,70.67648157477379,3.0247384533041326,4,-1,-1,8x8192x1536,0,
2026-03-03T03:13:04.011509+00:00,FULL,llm_style,eval,llm_style_eval_241,16,1536,1536,bf16,NVIDIA GeForce RTX 4060,c04,64,64,64,4,3,8,0.0,0.0,39.712000638246536,117.98527888953681,1.9011248687201256,7,-1,-1,16x1536x1536,0,
2026-03-03T03:13:04.037976+00:00,FULL,llm_style,eval,llm_style_eval_242,1,2048,3072,bf16,NVIDIA GeForce RTX 4060,c00,32,32,32,2,2,8,0.0,0.0,36.12799942493439,173.979520946741,0.3482869851718298,7,-1,-1,1x2048x3072,0,
2026-03-03T03:13:04.079171+00:00,FULL,llm_style,eval,llm_style_eval_243,8,1536,6144,bf16,NVIDIA GeForce RTX 4060,c04,64,64,64,4,3,8,0.0,0.0,72.54400104284286,172.75776207447046,2.081425642774042,7,-1,-1,8x1536x6144,0,
2026-03-03T03:13:04.124358+00:00,FULL,llm_style,eval,llm_style_eval_244,32,8192,1024,bf16,NVIDIA GeForce RTX 4060,c11,32,128,32,4,2,8,0.0,0.0,46.04800045490265,108.84352229535571,11.658940816024952,0,-1,-1,32x8192x1024,0,
2026-03-03T03:13:04.251532+00:00,FULL,llm_style,eval,llm_style_eval_245,4,6144,4096,bf16,NVIDIA GeForce RTX 4060,c11,32,128,32,4,2,8,0.0,0.0,226.6559973359108,238.22528302669525,0.888247363256963,5,-1,-1,4x6144x4096,0,
2026-03-03T03:13:04.316608+00:00,FULL,llm_style,eval,llm_style_eval_246,32,2048,6144,bf16,NVIDIA GeForce RTX 4060,c04,64,64,64,4,3,8,0.0,0.0,84.87999811768532,200.48895701766008,9.487587015299534,3,-1,-1,32x2048x6144,0,
2026-03-03T03:13:04.382041+00:00,FULL,llm_style,eval,llm_style_eval_247,64,6144,2048,bf16,NVIDIA GeForce RTX 4060,c06,64,128,32,4,3,8,0.0,0.0,101.3759970664978,169.00096505880356,15.887515611249823,0,-1,-1,64x6144x2048,0,
2026-03-03T03:13:04.390869+00:00,FULL,llm_style,eval,llm_style_eval_248,64,1024,1024,bf16,NVIDIA GeForce RTX 4060,c00,32,32,32,2,2,8,0.0,0.0,39.93599861860275,98.92895929515359,3.360820629072225,3,-1,-1,64x1024x1024,0,
2026-03-03T03:13:04.495406+00:00,FULL,llm_style,eval,llm_style_eval_249,2,8192,1024,bf16,NVIDIA GeForce RTX 4060,c11,32,128,32,4,2,8,0.0,104.502,49.15200173854828,67.23136272281407,0.6826666425201637,4,-1,-1,2x8192x1024,0,
2026-03-03T03:13:04.551760+00:00,FULL,llm_style,eval,llm_style_eval_250,64,3072,3072,bf16,NVIDIA GeForce RTX 4060,c06,64,128,32,4,3,8,0.0,0.0,70.65600156784058,108.39520178735245,17.09634744672289,3,-1,-1,64x3072x3072,0,
2026-03-03T03:13:04.599601+00:00,FULL,llm_style,eval,llm_style_eval_251,64,1024,8192,bf16,NVIDIA GeForce RTX 4060,c00,32,32,32,2,2,8,0.0,0.0,93.61600130796432,216.77471861243242,11.469639901278844,3,-1,-1,64x1024x8192,0,
2026-03-03T03:13:04.665133+00:00,FULL,llm_style,eval,llm_style_eval_252,64,4096,3072,bf16,NVIDIA GeForce RTX 4060,c04,64,64,64,4,3,8,0.0,0.0,97.28000313043594,255.88128224015202,16.556462625113635,3,-1,-1,64x4096x3072,0,
2026-03-03T03:13:04.795303+00:00,FULL,llm_style,eval,llm_style_eval_253,8,6144,4096,bf16,NVIDIA GeForce RTX 4060,c11,32,128,32,4,2,8,0.0,0.0,229.10399734973907,271.8550379574298,1.7575126957969622,5,-1,-1,8x6144x4096,0,
2026-03-03T03:13:04.874271+00:00,FULL,llm_style,eval,llm_style_eval_254,4,1536,3072,bf16,NVIDIA GeForce RTX 4060,c04,64,64,64,4,3,8,0.0,78.921,49.136001616716385,53.247999399900436,0.7682500561290612,7,-1,-1,4x1536x3072,0,
2026-03-03T03:13:04.903976+00:00,FULL,llm_style,eval,llm_style_eval_255,1,3072,1536,bf16,NVIDIA GeForce RTX 4060,c00,32,32,32,2,2,8,0.0,0.0,47.00800031423569,164.56704720854754,0.20075697619373284,7,-1,-1,1x3072x1536,0,
2026-03-03T03:13:04.995029+00:00,BUCKET,llm_style,tune,llm_style_tune_000,32,3072,2048,bf16,NVIDIA GeForce RTX 4060,c11,32,128,32,4,2,8,0.0,88.372,52.22399905323982,55.15616085380316,7.710117786834262,3,-1,-1,llm8_g3,0,
2026-03-03T03:13:05.079784+00:00,BUCKET,llm_style,tune,llm_style_tune_001,4,4096,1536,bf16,NVIDIA GeForce RTX 4060,c00,32,32,32,2,2,8,0.0,84.715,44.92799937725067,342.0614422857755,1.1202735198016733,6,-1,-1,llm8_g6,0,
2026-03-03T03:13:05.173157+00:00,BUCKET,llm_style,tune,llm_style_tune_002,8,8192,1024,bf16,NVIDIA GeForce RTX 4060,c11,32,128,32,4,2,8,0.0,93.329,48.767998814582825,58.288320526480675,2.7521680459003295,4,-1,-1,llm8_g4,0,
2026-03-03T03:13:05.256985+00:00,BUCKET,llm_style,tune,llm_style_tune_003,64,4096,1024,bf16,NVIDIA GeForce RTX 4060,c11,32,128,32,4,2,8,0.0,83.789,49.15200173854828,132.43232294917098,10.92266628032262,2,-1,-1,llm8_g2,0,
2026-03-03T03:13:05.412146+00:00,BUCKET,llm_style,tune,llm_style_tune_004,16,3072,4096,bf16,NVIDIA GeForce RTX 4060,c04,64,64,64,4,3,8,0.0,155.122,83.96799862384796,88.10496002435684,4.795317151761212,7,-1,-1,llm8_g7,0,
2026-03-03T03:13:05.444553+00:00,BUCKET,llm_style,tune,llm_style_tune_005,16,1536,4096,bf16,NVIDIA GeForce RTX 4060,c04,64,64,64,4,3,8,0.0,0.0,62.463998794555664,111.58464029431343,3.2230820294128772,7,-1,-1,llm8_g7,0,
2026-03-03T03:13:05.456985+00:00,BUCKET,llm_style,tune,llm_style_tune_006,2,2048,1024,bf16,NVIDIA GeForce RTX 4060,c04,64,64,64,4,3,8,0.0,0.0,53.02400141954422,181.61664173007006,0.15820397886659732,7,-1,-1,llm8_g7,0,
2026-03-03T03:13:05.535117+00:00,BUCKET,llm_style,tune,llm_style_tune_007,32,6144,1024,bf16,NVIDIA GeForce RTX 4060,c11,32,128,32,4,2,8,0.0,78.081,40.95999896526337,48.34527924656868,9.8304002483368,0,-1,-1,llm8_g0,0,
2026-03-03T03:13:05.555196+00:00,BUCKET,llm_style,tune,llm_style_tune_008,8,1536,2048,bf16,NVIDIA GeForce RTX 4060,c04,64,64,64,4,3,8,0.0,0.0,46.91200144588947,195.5308784544468,1.0728949191829924,7,-1,-1,llm8_g7,0,
2026-03-03T03:13:05.589668+00:00,BUCKET,llm_style,tune,llm_style_tune_009,16,1024,6144,bf16,NVIDIA GeForce RTX 4060,c04,64,64,64,4,3,8,0.0,0.0,73.72800260782242,112.79360078275191,2.730666570080655,7,-1,-1,llm8_g7,0,
2026-03-03T03:13:05.608098+00:00,BUCKET,llm_style,tune,llm_style_tune_010,64,1536,2048,bf16,NVIDIA GeForce RTX 4060,c11,32,128,32,4,2,8,0.0,0.0,67.58400052785873,161.57695874571795,5.957818135285181,3,-1,-1,llm8_g3,0,
2026-03-03T03:13:05.636817+00:00,BUCKET,llm_style,tune,llm_style_tune_011,64,1536,4096,bf16,NVIDIA GeForce RTX 4060,c11,32,128,32,4,2,8,0.0,0.0,77.63200253248215,168.30464467406267,10.373381359872178,3,-1,-1,llm8_g3,0,
2026-03-03T03:13:05.650153+00:00,BUCKET,llm_style,tune,llm_style_tune_012,32,1024,2048,bf16,NVIDIA GeForce RTX 4060,c11,32,128,32,4,2,8,0.0,0.0,64.19199705123901,129.0540786087513,2.09087945796211,3,-1,-1,llm8_g3,0,
2026-03-03T03:13:05.660925+00:00,BUCKET,llm_style,tune,llm_style_tune_013,64,1536,1024,bf16,NVIDIA GeForce RTX 4060,c11,32,128,32,4,2,8,0.0,0.0,52.22399905323982,60.42047921568154,3.855058893417131,3,-1,-1,llm8_g3,0,
2026-03-03T03:13:05.891165+00:00,BUCKET,llm_style,tune,llm_style_tune_014,4,6144,3072,bf16,NVIDIA GeForce RTX 4060,c11,32,128,32,4,2,8,0.0,230.209,176.84800177812576,183.18623781204224,0.8538119881582767,5,-1,-1,llm8_g5,0,
2026-03-03T03:13:05.919602+00:00,BUCKET,llm_style,tune,llm_style_tune_015,1,6144,1024,bf16,NVIDIA GeForce RTX 4060,c11,32,128,32,4,2,8,0.0,0.0,42.7200011909008,69.69567824155088,0.29454381201375324,4,-1,-1,llm8_g4,0,
2026-03-03T03:13:06.084113+00:00,BUCKET,llm_style,tune,llm_style_tune_016,4,8192,4096,bf16,NVIDIA GeForce RTX 4060,c11,32,128,32,4,2,8,0.0,0.0,294.20800507068634,342.9478403925895,0.9124002453145548,5,-1,-1,llm8_g5,0,
2026-03-03T03:13:06.099945+00:00,BUCKET,llm_style,tune,llm_style_tune_017,64,1536,2048,bf16,NVIDIA GeForce RTX 4060,c11,32,128,32,4,2,8,0.0,0.0,34.89600121974945,137.20800422132,11.538662595303833,3,-1,-1,llm8_g3,0,
2026-03-03T03:13:06.183917+00:00,BUCKET,llm_style,tune,llm_style_tune_018,64,8192,1536,bf16,NVIDIA GeForce RTX 4060,c11,32,128,32,4,2,8,0.0,0.0,118.19200217723846,131.11295968294144,13.627087335272957,0,-1,-1,llm8_g0,0,
2026-03-03T03:13:06.197373+00:00,BUCKET,llm_style,tune,llm_style_tune_019,2,1536,1024,bf16,NVIDIA GeForce RTX 4060,c04,64,64,64,4,3,8,0.0,0.0,44.36800070106983,1418.0864365398834,0.14180165661258423,7,-1,-1,llm8_g7,0,
2026-03-03T03:13:06.208155+00:00,BUCKET,llm_style,tune,llm_style_tune_020,16,1024,1536,bf16,NVIDIA GeForce RTX 4060,c04,64,64,64,4,3,8,0.0,0.0,47.968000173568726,116.35456107556814,1.0492755132146137,7,-1,-1,llm8_g7,0,
2026-03-03T03:13:06.245131+00:00,BUCKET,llm_style,tune,llm_style_tune_021,1,6144,1536,bf16,NVIDIA GeForce RTX 4060,c11,32,128,32,4,2,8,0.0,0.0,52.191998809576035,65.09920094162223,0.3616333620190263,4,-1,-1,llm8_g4,0,
2026-03-03T03:13:06.336129+00:00,BUCKET,llm_style,tune,llm_style_tune_022,8,4096,4096,bf16,NVIDIA GeForce RTX 4060,c04,64,64,64,4,3,8,0.0,0.0,193.42400133609772,269.4553542137146,1.3878084112920441,7,-1,-1,llm8_g7,0,
2026-03-03T03:13:06.513882+00:00,BUCKET,llm_style,tune,llm_style_tune_023,2,4096,8192,bf16,NVIDIA GeForce RTX 4060,c04,64,64,64,4,3,8,0.0,0.0,302.0319938659668,329.65311884880066,0.44438248505409,7,-1,-1,llm8_g7,0,
2026-03-03T03:13:06.538881+00:00,BUCKET,llm_style,tune,llm_style_tune_024,64,1536,2048,bf16,NVIDIA GeForce RTX 4060,c11,32,128,32,4,2,8,0.0,0.0,83.96799862384796,175.10400712490082,4.795317151761212,3,-1,-1,llm8_g3,0,
2026-03-03T03:13:06.566039+00:00,BUCKET,llm_style,tune,llm_style_tune_025,4,4096,1536,bf16,NVIDIA GeForce RTX 4060,c00,32,32,32,2,2,8,0.0,0.0,53.26399952173233,170.15231713652605,0.944946839365003,6,-1,-1,llm8_g6,0,
2026-03-03T03:13:06.592588+00:00,BUCKET,llm_style,tune,llm_style_tune_026,4,3072,2048,bf16,NVIDIA GeForce RTX 4060,c04,64,64,64,4,3,8,0.0,0.0,63.48799914121628,130.29375925660128,0.7927742042720133,7,-1,-1,llm8_g7,0,
2026-03-03T03:13:06.608813+00:00,BUCKET,llm_style,tune,llm_style_tune_027,8,4096,1024,bf16,NVIDIA GeForce RTX 4060,c00,32,32,32,2,2,8,0.0,0.0,46.04800045490265,52.26495906710624,1.457367602003119,6,-1,-1,llm8_g6,0,
2026-03-03T03:13:06.618594+00:00,BUCKET,llm_style,tune,llm_style_tune_028,16,1536,1024,bf16,NVIDIA GeForce RTX 4060,c04,64,64,64,4,3,8,0.0,0.0,34.81600061058998,133.1139236688614,1.4456470334703126,7,-1,-1,llm8_g7,0,
2026-03-03T03:13:06.791274+00:00,BUCKET,llm_style,tune,llm_style_tune_029,64,4096,8192,bf16,NVIDIA GeForce RTX 4060,c11,32,128,32,4,2,8,0.0,0.0,330.7519853115082,444.51232492923737,12.985461876985932,3,-1,-1,llm8_g3,0,
2026-03-03T03:13:06.854581+00:00,BUCKET,llm_style,tune,llm_style_tune_030,1,8192,1536,bf16,NVIDIA GeForce RTX 4060,c11,32,128,32,4,2,8,0.0,0.0,76.80000364780426,178.84160459041593,0.3276799844360359,4,-1,-1,llm8_g4,0,
2026-03-03T03:13:07.104519+00:00,BUCKET,llm_style,tune,llm_style_tune_031,1,8192,6144,bf16,NVIDIA GeForce RTX 4060,c11,32,128,32,4,2,8,0.0,0.0,450.9440064430237,480.27648597955704,0.223227927551397,5,-1,-1,llm8_g5,0,
2026-03-03T03:13:07.233640+00:00,BUCKET,llm_style,tune,llm_style_tune_032,32,3072,8192,bf16,NVIDIA GeForce RTX 4060,c11,32,128,32,4,2,8,0.0,0.0,252.9279887676239,365.1260870695113,6.367870728137332,3,-1,-1,llm8_g3,0,
2026-03-03T03:13:07.275526+00:00,BUCKET,llm_style,tune,llm_style_tune_033,4,1536,6144,bf16,NVIDIA GeForce RTX 4060,c04,64,64,64,4,3,8,0.0,0.0,101.34399682283401,162.08767816424353,0.7449624483626989,7,-1,-1,llm8_g7,0,
2026-03-03T03:13:07.307932+00:00,BUCKET,llm_style,tune,llm_style_tune_034,1,4096,1536,bf16,NVIDIA GeForce RTX 4060,c00,32,32,32,2,2,8,0.0,0.0,56.32000043988228,163.01919810473902,0.22341818007319428,6,-1,-1,llm8_g6,0,
2026-03-03T03:13:07.336613+00:00,BUCKET,llm_style,tune,llm_style_tune_035,4,1536,4096,bf16,NVIDIA GeForce RTX 4060,c04,64,64,64,4,3,8,0.0,0.0,76.78400352597237,173.5878425836563,0.6554965316828681,7,-1,-1,llm8_g7,0,
2026-03-03T03:13:07.461835+00:00,BUCKET,llm_style,tune,llm_style_tune_036,32,8192,3072,bf16,NVIDIA GeForce RTX 4060,c11,32,128,32,4,2,8,0.0,0.0,260.8799934387207,396.3273516297339,6.173768692532279,0,-1,-1,llm8_g0,0,
2026-03-03T03:13:07.491760+00:00,BUCKET,llm_style,tune,llm_style_tune_037,32,3072,2048,bf16,NVIDIA GeForce RTX 4060,c11,32,128,32,4,2,8,0.0,0.0,81.91999793052673,133.15711975097656,4.9152001241684,3,-1,-1,llm8_g3,0,
2026-03-03T03:13:07.528916+00:00,BUCKET,llm_style,tune,llm_style_tune_038,2,2048,4096,bf16,NVIDIA GeForce RTX 4060,c04,64,64,64,4,3,8,0.0,0.0,126.40000134706497,169.87136140465728,0.26546227565193886,7,-1,-1,llm8_g7,0,
2026-03-03T03:13:07.548398+00:00,BUCKET,llm_style,tune,llm_style_tune_039,64,2048,1536,bf16,NVIDIA GeForce RTX 4060,c11,32,128,32,4,2,8,0.0,0.0,68.60800087451935,175.4128023982047,5.868895447579545,3,-1,-1,llm8_g3,0,
2026-03-03T03:13:07.580894+00:00,BUCKET,llm_style,tune,llm_style_tune_040,64,1024,6144,bf16,NVIDIA GeForce RTX 4060,c11,32,128,32,4,2,8,0.0,0.0,149.21600371599197,194.70432192087168,5.396916871817366,3,-1,-1,llm8_g3,0,
2026-03-03T03:13:07.824773+00:00,BUCKET,llm_style,tune,llm_style_tune_041,4,8192,6144,bf16,NVIDIA GeForce RTX 4060,c11,32,128,32,4,2,8,0.0,0.0,454.0960043668747,486.8595165014267,0.886713778865773,5,-1,-1,llm8_g5,0,
2026-03-03T03:13:07.855615+00:00,BUCKET,llm_style,tune,llm_style_tune_042,1,1024,6144,bf16,NVIDIA GeForce RTX 4060,c04,64,64,64,4,3,8,0.0,0.0,136.19199395179749,209.82784003019324,0.09239098154663539,7,-1,-1,llm8_g7,0,
2026-03-03T03:13:07.945233+00:00,BUCKET,llm_style,tune,llm_style_tune_043,64,2048,8192,bf16,NVIDIA GeForce RTX 4060,c11,32,128,32,4,2,8,0.0,0.0,265.0559991598129,338.9606276154518,8.101999784223695,3,-1,-1,llm8_g3,0,
2026-03-03T03:13:07.958179+00:00,BUCKET,llm_style,tune,llm_style_tune_044,16,2048,1024,bf16,NVIDIA GeForce RTX 4060,c04,64,64,64,4,3,8,0.0,0.0,52.22399905323982,127.88991764187813,1.2850196311390436,7,-1,-1,llm8_g7,0,
2026-03-03T03:13:07.968505+00:00,BUCKET,llm_style,tune,llm_style_tune_045,4,1024,1536,bf16,NVIDIA GeForce RTX 4060,c04,64,64,64,4,3,8,0.0,0.0,55.296000093221664,164.44768294692037,0.2275555551719273,7,-1,-1,llm8_g7,0,
2026-03-03T03:13:07.999156+00:00,BUCKET,llm_style,tune,llm_style_tune_046,64,1536,4096,bf16,NVIDIA GeForce RTX 4060,c11,32,128,32,4,2,8,0.0,0.0,122.8799968957901,199.576635658741,6.553600165557866,3,-1,-1,llm8_g3,0,
2026-03-03T03:13:08.016708+00:00,BUCKET,llm_style,tune,llm_style_tune_047,16,2048,1536,bf16,NVIDIA GeForce RTX 4060,c04,64,64,64,4,3,8,0.0,0.0,79.8720009624958,204.5337620377539,1.260307677120382,7,-1,-1,llm8_g7,0,
2026-03-03T03:13:08.537209+00:00,BUCKET,llm_style,tune,llm_style_tune_048,64,6144,6144,bf16,NVIDIA GeForce RTX 4060,c11,32,128,32,4,2,8,0.0,520.449,330.4640054702759,353.8399872183799,14.621375181614471,1,-1,-1,llm8_g1,0,
2026-03-03T03:13:08.701755+00:00,BUCKET,llm_style,tune,llm_style_tune_049,4,4096,8192,bf16,NVIDIA GeForce RTX 4060,c04,64,64,64,4,3,8,0.0,0.0,297.87200689315796,339.37408298254,0.9011771827766402,7,-1,-1,llm8_g7,0,
2026-03-03T03:13:08.765103+00:00,BUCKET,llm_style,tune,llm_style_tune_050,1,4096,3072,bf16,NVIDIA GeForce RTX 4060,c04,64,64,64,4,3,8,0.0,0.0,64.51199948787689,134.60767991840828,0.3900952411919764,7,-1,-1,llm8_g7,0,
2026-03-03T03:13:08.800428+00:00,BUCKET,llm_style,tune,llm_style_tune_051,2,4096,2048,bf16,NVIDIA GeForce RTX 4060,c04,64,64,64,4,3,8,0.0,0.0,64.87999856472015,69.63200122117996,0.5171768301833151,7,-1,-1,llm8_g7,0,
2026-03-03T03:13:08.864776+00:00,BUCKET,llm_style,tune,llm_style_tune_052,4,8192,1536,bf16,NVIDIA GeForce RTX 4060,c11,32,128,32,4,2,8,0.0,0.0,47.10400104522705,177.7791967988014,2.137043430840362,4,-1,-1,llm8_g4,0,
2026-03-03T03:13:08.889405+00:00,BUCKET,llm_style,tune,llm_style_tune_053,1,1536,4096,bf16,NVIDIA GeForce RTX 4060,c04,64,64,64,4,3,8,0.0,0.0,55.215999484062195,136.6857612133026,0.22788525278134264,7,-1,-1,llm8_g7,0,
2026-03-03T03:13:09.135369+00:00,BUCKET,llm_style,tune,llm_style_tune_054,8,8192,6144,bf16,NVIDIA GeForce RTX 4060,c11,32,128,32,4,2,8,0.0,0.0,424.9599874019623,448.89246702194214,1.8950169236480956,5,-1,-1,llm8_g5,0,
2026-03-03T03:13:09.176909+00:00,BUCKET,llm_style,tune,llm_style_tune_055,64,6144,1536,bf16,NVIDIA GeForce RTX 4060,c11,32,128,32,4,2,8,0.0,0.0,68.84799897670746,144.38879907131192,17.545310974232887,0,-1,-1,llm8_g0,0,
2026-03-03T03:13:09.203517+00:00,BUCKET,llm_style,tune,llm_style_tune_056,1,3072,1536,bf16,NVIDIA GeForce RTX 4060,c04,64,64,64,4,3,8,0.0,0.0,66.56000018119812,223.45375791192052,0.14178461499863124,7,-1,-1,llm8_g7,0,
2026-03-03T03:13:09.214080+00:00,BUCKET,llm_style,tune,llm_style_tune_057,64,1024,1024,bf16,NVIDIA GeForce RTX 4060,c11,32,128,32,4,2,8,0.0,0.0,67.58400052785873,106.06592215597618,1.9859393784283939,3,-1,-1,llm8_g3,0,
2026-03-03T03:13:09.377798+00:00,BUCKET,llm_style,tune,llm_style_tune_058,16,8192,4096,bf16,NVIDIA GeForce RTX 4060,c11,32,128,32,4,2,8,0.0,0.0,294.22400891780853,417.43358850479126,3.6494024670160403,5,-1,-1,llm8_g5,0,
2026-03-03T03:13:09.510418+00:00,BUCKET,llm_style,tune,llm_style_tune_059,16,4096,6144,bf16,NVIDIA GeForce RTX 4060,c04,64,64,64,4,3,8,0.0,0.0,260.09601354599,349.04000967741,3.096188815126174,7,-1,-1,llm8_g7,0,
2026-03-03T03:13:09.641050+00:00,BUCKET,llm_style,tune,llm_style_tune_060,2,3072,8192,bf16,NVIDIA GeForce RTX 4060,c04,64,64,64,4,3,8,0.0,0.0,251.66399776935577,312.1635201573371,0.39999084848145655,7,-1,-1,llm8_g7,0,
2026-03-03T03:13:09.807804+00:00,BUCKET,llm_style,tune,llm_style_tune_061,64,4096,8192,bf16,NVIDIA GeForce RTX 4060,c11,32,128,32,4,2,8,0.0,0.0,326.6560137271881,347.74015486240387,13.148287848718466,3,-1,-1,llm8_g3,0,
2026-03-03T03:13:09.872669+00:00,BUCKET,llm_style,tune,llm_style_tune_062,32,4096,3072,bf16,NVIDIA GeForce RTX 4060,c11,32,128,32,4,2,8,0.0,0.0,102.9919981956482,168.6796805262565,7.819115874130377,3,-1,-1,llm8_g3,0,
2026-03-03T03:13:09.995874+00:00,BUCKET,llm_style,tune,llm_style_tune_063,2,3072,8192,bf16,NVIDIA GeForce RTX 4060,c04,64,64,64,4,3,8,0.0,0.0,228.35199534893036,399.24351662397373,0.44082512108634186,7,-1,-1,llm8_g7,0,
2026-03-03T03:13:10.008327+00:00,BUCKET,llm_style,eval,llm_style_eval_000,32,1536,1024,bf16,NVIDIA GeForce RTX 4060,c11,32,128,32,4,2,8,0.0,0.0,63.071999698877335,254.7254313528534,1.5960060958998228,3,-1,-1,llm8_g3,0,
2026-03-03T03:13:10.098827+00:00,BUCKET,llm_style,eval,llm_style_eval_001,32,2048,8192,bf16,NVIDIA GeForce RTX 4060,c11,32,128,32,4,2,8,0.0,0.0,173.92000555992126,272.12799876928324,6.173768339893825,3,-1,-1,llm8_g3,0,
2026-03-03T03:13:10.144235+00:00,BUCKET,llm_style,eval,llm_style_eval_002,16,2048,4096,bf16,NVIDIA GeForce RTX 4060,c04,64,64,64,4,3,8,0.0,0.0,78.84799689054489,159.90784183144564,3.4044676667263514,7,-1,-1,llm8_g7,0,
2026-03-03T03:13:10.161177+00:00,BUCKET,llm_style,eval,llm_style_eval_003,16,2048,1536,bf16,NVIDIA GeForce RTX 4060,c04,64,64,64,4,3,8,0.0,0.0,53.247999399900436,160.8214382827282,1.8904615597668486,7,-1,-1,llm8_g7,0,
2026-03-03T03:13:10.269299+00:00,BUCKET,llm_style,eval,llm_style_eval_004,64,8192,2048,bf16,NVIDIA GeForce RTX 4060,c11,32,128,32,4,2,8,0.0,0.0,189.26399946212769,268.6659198999405,11.346498299216796,0,-1,-1,llm8_g0,0,
2026-03-03T03:13:10.397664+00:00,BUCKET,llm_style,eval,llm_style_eval_005,64,3072,8192,bf16,NVIDIA GeForce RTX 4060,c11,32,128,32,4,2,8,0.0,0.0,237.56800591945648,303.38048934936506,13.559172075940662,3,-1,-1,llm8_g3,0,
2026-03-03T03:13:10.419770+00:00,BUCKET,llm_style,eval,llm_style_eval_006,32,2048,2048,bf16,NVIDIA GeForce RTX 4060,c11,32,128,32,4,2,8,0.0,0.0,71.55200093984604,109.34559881687156,3.7516135464286235,3,-1,-1,llm8_g3,0,
2026-03-03T03:13:10.510678+00:00,BUCKET,llm_style,eval,llm_style_eval_007,8,8192,2048,bf16,NVIDIA GeForce RTX 4060,c11,32,128,32,4,2,8,0.0,0.0,191.44000113010406,386.47839635610563,1.4021910489729326,4,-1,-1,llm8_g4,0,
2026-03-03T03:13:10.588459+00:00,BUCKET,llm_style,eval,llm_style_eval_008,64,1536,8192,bf16,NVIDIA GeForce RTX 4060,c11,32,128,32,4,2,8,0.0,0.0,251.90401077270508,347.99424201250065,6.393755824131233,3,-1,-1,llm8_g3,0,
2026-03-03T03:13:10.721856+00:00,BUCKET,llm_style,eval,llm_style_eval_009,64,4096,6144,bf16,NVIDIA GeForce RTX 4060,c11,32,128,32,4,2,8,0.0,0.0,375.2799928188324,494.40769821405394,8.58352572383217,3,-1,-1,llm8_g3,0,
2026-03-03T03:13:10.772349+00:00,BUCKET,llm_style,eval,llm_style_eval_010,64,2048,4096,bf16,NVIDIA GeForce RTX 4060,c11,32,128,32,4,2,8,0.0,0.0,129.95200604200363,155.45344412326807,8.262602915517446,3,-1,-1,llm8_g3,0,
2026-03-03T03:13:10.874809+00:00,BUCKET,llm_style,eval,llm_style_eval_011,32,3072,6144,bf16,NVIDIA GeForce RTX 4060,c11,32,128,32,4,2,8,0.0,0.0,285.69599986076355,603.2486391067504,4.22812903431868,3,-1,-1,llm8_g3,0,
2026-03-03T03:13:10.888168+00:00,BUCKET,llm_style,eval,llm_style_eval_012,16,1536,1536,bf16,NVIDIA GeForce RTX 4060,c04,64,64,64,4,3,8,0.0,0.0,52.99200117588043,82.89279993623485,1.424695620560241,7,-1,-1,llm8_g7,0,
2026-03-03T03:13:10.920430+00:00,BUCKET,llm_style,eval,llm_style_eval_013,64,2048,3072,bf16,NVIDIA GeForce RTX 4060,c11,32,128,32,4,2,8,0.0,0.0,136.19199395179749,245.29919728636742,5.913022818984665,3,-1,-1,llm8_g3,0,
2026-03-03T03:13:11.201916+00:00,BUCKET,llm_style,eval,llm_style_eval_014,16,8192,6144,bf16,NVIDIA GeForce RTX 4060,c11,32,128,32,4,2,8,0.0,0.0,716.159999370575,798.0831825733183,2.2489565703411944,5,-1,-1,llm8_g5,0,
2026-03-03T03:13:11.245260+00:00,BUCKET,llm_style,eval,llm_style_eval_015,64,6144,1536,bf16,NVIDIA GeForce RTX 4060,c11,32,128,32,4,2,8,0.0,0.0,132.91200250387192,219.8630361258983,9.088415863456802,0,-1,-1,llm8_g0,0,
2026-03-03T03:13:11.338202+00:00,BUCKET,llm_style,eval,llm_style_eval_016,16,4096,4096,bf16,NVIDIA GeForce RTX 4060,c04,64,64,64,4,3,8,0.0,0.0,261.0720098018646,345.73311418294907,2.0564093117735887,7,-1,-1,llm8_g7,0,
2026-03-03T03:13:11.531199+00:00,BUCKET,llm_style,eval,llm_style_eval_017,64,8192,4096,bf16,NVIDIA GeForce RTX 4060,c11,32,128,32,4,2,8,0.0,0.0,591.264009475708,685.3632014989852,7.264043180657114,1,-1,-1,llm8_g1,0,
2026-03-03T03:13:11.666197+00:00,BUCKET,llm_style,eval,llm_style_eval_018,32,4096,6144,bf16,NVIDIA GeForce RTX 4060,c11,32,128,32,4,2,8,0.0,0.0,369.50400471687317,446.20799839496607,4.3588505549056435,3,-1,-1,llm8_g3,0,
2026-03-03T03:13:11.800909+00:00,BUCKET,llm_style,eval,llm_style_eval_019,16,3072,8192,bf16,NVIDIA GeForce RTX 4060,c04,64,64,64,4,3,8,0.0,0.0,368.6400055885315,461.52702808380104,2.1845333002161103,7,-1,-1,llm8_g7,0,
2026-03-03T03:13:11.818477+00:00,BUCKET,llm_style,eval,llm_style_eval_020,4,1536,1536,bf16,NVIDIA GeForce RTX 4060,c04,64,64,64,4,3,8,0.0,0.0,68.44799965620041,192.3993617296218,0.2757475469670684,7,-1,-1,llm8_g7,0,
2026-03-03T03:13:11.864480+00:00,BUCKET,llm_style,eval,llm_style_eval_021,4,6144,1536,bf16,NVIDIA GeForce RTX 4060,c11,32,128,32,4,2,8,0.0,0.0,78.19199934601784,209.76927906274776,0.9655396029190413,4,-1,-1,llm8_g4,0,
2026-03-03T03:13:11.891790+00:00,BUCKET,llm_style,eval,llm_style_eval_022,32,6144,1024,bf16,NVIDIA GeForce RTX 4060,c11,32,128,32,4,2,8,0.0,0.0,66.56000018119812,132.8025564551353,6.049476906608265,0,-1,-1,llm8_g0,0,
2026-03-03T03:13:11.903941+00:00,BUCKET,llm_style,eval,llm_style_eval_023,16,1024,1536,bf16,NVIDIA GeForce RTX 4060,c04,64,64,64,4,3,8,0.0,0.0,61.79199926555157,142.29535922408104,0.814533412063581,7,-1,-1,llm8_g7,0,
2026-03-03T03:13:11.940743+00:00,BUCKET,llm_style,eval,llm_style_eval_024,32,8192,1024,bf16,NVIDIA GeForce RTX 4060,c11,32,128,32,4,2,8,0.0,0.0,90.46399965882301,162.2239995002745,5.934636032286448,0,-1,-1,llm8_g0,0,
2026-03-03T03:13:12.140598+00:00,BUCKET,llm_style,eval,llm_style_eval_025,32,6144,6144,bf16,NVIDIA GeForce RTX 4060,c11,32,128,32,4,2,8,0.0,0.0,532.9920053482056,644.6591907739639,4.532749234055906,1,-1,-1,llm8_g1,0,
2026-03-03T03:13:12.206293+00:00,BUCKET,llm_style,eval,llm_style_eval_026,1,6144,2048,bf16,NVIDIA GeForce RTX 4060,c11,32,128,32,4,2,8,0.0,0.0,141.31200313568115,243.07648211717603,0.17808695257003013,4,-1,-1,llm8_g4,0,
2026-03-03T03:13:12.278794+00:00,BUCKET,llm_style,eval,llm_style_eval_027,32,4096,3072,bf16,NVIDIA GeForce RTX 4060,c11,32,128,32,4,2,8,0.0,0.0,170.3519970178604,286.7228865623473,4.727308056832279,3,-1,-1,llm8_g3,0,
2026-03-03T03:13:12.293720+00:00,BUCKET,llm_style,eval,llm_style_eval_028,64,1536,1536,bf16,NVIDIA GeForce RTX 4060,c11,32,128,32,4,2,8,0.0,0.0,83.45599845051765,180.3894399851558,3.6185522144229627,3,-1,-1,llm8_g3,0,
2026-03-03T03:13:12.309542+00:00,BUCKET,llm_style,eval,llm_style_eval_029,2,3072,1024,bf16,NVIDIA GeForce RTX 4060,c00,32,32,32,2,2,8,0.0,0.0,57.312000542879105,164.7820795327423,0.21955108669755555,6,-1,-1,llm8_g6,0,
2026-03-03T03:13:12.388657+00:00,BUCKET,llm_style,eval,llm_style_eval_030,32,1536,8192,bf16,NVIDIA GeForce RTX 4060,c11,32,128,32,4,2,8,0.0,0.0,330.7519853115082,404.66430753469444,2.4347741019348623,3,-1,-1,llm8_g3,0,
2026-03-03T03:13:12.419022+00:00,BUCKET,llm_style,eval,llm_style_eval_031,8,3072,2048,bf16,NVIDIA GeForce RTX 4060,c04,64,64,64,4,3,8,0.0,0.0,107.88799822330475,187.44991913437838,0.9330351629256186,7,-1,-1,llm8_g7,0,
2026-03-03T03:13:12.451620+00:00,BUCKET,llm_style,eval,llm_style_eval_032,8,2048,3072,bf16,NVIDIA GeForce RTX 4060,c04,64,64,64,4,3,8,0.0,0.0,156.47999942302704,263.95647615194315,0.6432981618811711,7,-1,-1,llm8_g7,0,
2026-03-03T03:13:12.536389+00:00,BUCKET,llm_style,eval,llm_style_eval_033,64,1536,8192,bf16,NVIDIA GeForce RTX 4060,c11,32,128,32,4,2,8,0.0,0.0,360.4480028152466,476.3443246483803,4.468363601463886,3,-1,-1,llm8_g3,0,
2026-03-03T03:13:12.612199+00:00,BUCKET,llm_style,eval,llm_style_eval_034,64,6144,2048,bf16,NVIDIA GeForce RTX 4060,c11,32,128,32,4,2,8,0.0,0.0,213.95200490951538,294.377598464489,7.527916070153962,0,-1,-1,llm8_g0,0,
2026-03-03T03:13:12.652965+00:00,BUCKET,llm_style,eval,llm_style_eval_035,4,4096,2048,bf16,NVIDIA GeForce RTX 4060,c04,64,64,64,4,3,8,0.0,0.0,159.743994474411,263.59807953238476,0.4201025786340281,7,-1,-1,llm8_g7,0,
2026-03-03T03:13:12.850589+00:00,BUCKET,llm_style,eval,llm_style_eval_036,64,8192,4096,bf16,NVIDIA GeForce RTX 4060,c11,32,128,32,4,2,8,0.0,0.0,653.7440121173859,761.285428404808,6.569799824382634,1,-1,-1,llm8_g1,0,
2026-03-03T03:13:12.884417+00:00,BUCKET,llm_style,eval,llm_style_eval_037,32,6144,1024,bf16,NVIDIA GeForce RTX 4060,c11,32,128,32,4,2,8,0.0,0.0,85.40799841284752,157.10623711347571,4.714466929123477,0,-1,-1,llm8_g0,0,
2026-03-03T03:13:12.954094+00:00,BUCKET,llm_style,eval,llm_style_eval_038,64,6144,2048,bf16,NVIDIA GeForce RTX 4060,c11,32,128,32,4,2,8,0.0,0.0,229.312002658844,288.01024049520487,7.02367393474893,0,-1,-1,llm8_g0,0,
2026-03-03T03:13:12.972331+00:00,BUCKET,llm_style,eval,llm_style_eval_039,8,1024,3072,bf16,NVIDIA GeForce RTX 4060,c04,64,64,64,4,3,8,0.0,0.0,104.41599786281586,204.9740783870219,0.48203004357748785,7,-1,-1,llm8_g7,0,
2026-03-03T03:13:13.059408+00:00,BUCKET,llm_style,eval,llm_style_eval_040,32,8192,2048,bf16,NVIDIA GeForce RTX 4060,c11,32,128,32,4,2,8,0.0,0.0,256.00001215934753,268.81023049354553,4.19430380078126,0,-1,-1,llm8_g0,0,
2026-03-03T03:13:13.078020+00:00,BUCKET,llm_style,eval,llm_style_eval_041,32,3072,1024,bf16,NVIDIA GeForce RTX 4060,c11,32,128,32,4,2,8,0.0,0.0,94.57600116729736,192.57696121931073,2.12872810771381,2,-1,-1,llm8_g2,0,
2026-03-03T03:13:13.108029+00:00,BUCKET,llm_style,eval,llm_style_eval_042,64,1024,4096,bf16,NVIDIA GeForce RTX 4060,c11,32,128,32,4,2,8,0.0,0.0,193.53599846363068,281.2620747089386,2.774010604031833,3,-1,-1,llm8_g3,0,
2026-03-03T03:13:13.118935+00:00,BUCKET,llm_style,eval,llm_style_eval_043,2,1536,1024,bf16,NVIDIA GeForce RTX 4060,c04,64,64,64,4,3,8,0.0,0.0,55.27999997138977,109.97760362923137,0.11381070917612429,7,-1,-1,llm8_g7,0,
2026-03-03T03:13:13.219854+00:00,BUCKET,llm_style,eval,llm_style_eval_044,64,6144,3072,bf16,NVIDIA GeForce RTX 4060,c11,32,128,32,4,2,8,0.0,0.0,336.87999844551086,398.3769604563711,7.171453084623446,1,-1,-1,llm8_g1,0,
2026-03-03T03:13:13.272554+00:00,BUCKET,llm_style,eval,llm_style_eval_045,64,1536,6144,bf16,NVIDIA GeForce RTX 4060,c11,32,128,32,4,2,8,0.0,0.0,281.5999984741211,337.1152058243751,4.289629114152892,3,-1,-1,llm8_g3,0,
2026-03-03T03:13:13.381691+00:00,BUCKET,llm_style,eval,llm_style_eval_046,2,6144,3072,bf16,NVIDIA GeForce RTX 4060,c11,32,128,32,4,2,8,0.0,0.0,282.99200534820557,369.9302306771276,0.2667830559633819,5,-1,-1,llm8_g5,0,
2026-03-03T03:13:13.569366+00:00,BUCKET,llm_style,eval,llm_style_eval_047,16,4096,8192,bf16,NVIDIA GeForce RTX 4060,c04,64,64,64,4,3,8,0.0,0.0,639.4879817962646,695.3679966926574,1.6790648996779505,7,-1,-1,llm8_g7,0,
2026-03-03T03:13:13.614684+00:00,BUCKET,llm_style,eval,llm_style_eval_048,16,1024,6144,bf16,NVIDIA GeForce RTX 4060,c04,64,64,64,4,3,8,0.0,0.0,221.64800018072128,241.8278397619724,0.908316753753013,7,-1,-1,llm8_g7,0,
2026-03-03T03:13:13.684946+00:00,BUCKET,llm_style,eval,llm_style_eval_049,16,8192,1536,bf16,NVIDIA GeForce RTX 4060,c11,32,128,32,4,2,8,0.0,0.0,165.24799913167953,195.9324823319911,2.436659966328196,4,-1,-1,llm8_g4,0,
2026-03-03T03:13:13.698216+00:00,BUCKET,llm_style,eval,llm_style_eval_050,1,1024,1024,bf16,NVIDIA GeForce RTX 4060,c04,64,64,64,4,3,8,0.0,0.0,62.44799867272377,227.45120525360085,0.03358237324771146,7,-1,-1,llm8_g7,0,
2026-03-03T03:13:13.724656+00:00,BUCKET,llm_style,eval,llm_style_eval_051,16,6144,1024,bf16,NVIDIA GeForce RTX 4060,c11,32,128,32,4,2,8,0.0,0.0,84.87999811768532,106.3423985987901,2.3718967538248834,4,-1,-1,llm8_g4,0,
2026-03-03T03:13:14.088172+00:00,BUCKET,llm_style,eval,llm_style_eval_052,16,8192,8192,bf16,NVIDIA GeForce RTX 4060,c11,32,128,32,4,2,8,0.0,0.0,917.9680049419403,1046.585956811905,2.339388340812406,5,-1,-1,llm8_g5,0,
2026-03-03T03:13:14.343474+00:00,BUCKET,llm_style,eval,llm_style_eval_053,1,6144,8192,bf16,NVIDIA GeForce RTX 4060,c11,32,128,32,4,2,8,0.0,0.0,694.271981716156,723.397114276886,0.1449911542608598,5,-1,-1,llm8_g5,0,
2026-03-03T03:13:14.428579+00:00,BUCKET,llm_style,eval,llm_style_eval_054,64,4096,3072,bf16,NVIDIA GeForce RTX 4060,c11,32,128,32,4,2,8,0.0,0.0,341.5040075778961,532.2089520096777,4.716233778406315,3,-1,-1,llm8_g3,0,
2026-03-03T03:13:14.468643+00:00,BUCKET,llm_style,eval,llm_style_eval_055,4,8192,1024,bf16,NVIDIA GeForce RTX 4060,c11,32,128,32,4,2,8,0.0,0.0,146.81600034236908,192.0512017607689,0.45709502944845787,4,-1,-1,llm8_g4,0,
2026-03-03T03:13:14.498694+00:00,BUCKET,llm_style,eval,llm_style_eval_056,64,1024,3072,bf16,NVIDIA GeForce RTX 4060,c11,32,128,32,4,2,8,0.0,0.0,193.37600469589233,229.53984320163724,2.08222930571568,3,-1,-1,llm8_g3,0,
2026-03-03T03:13:14.511529+00:00,BUCKET,llm_style,eval,llm_style_eval_057,64,1024,3072,bf16,NVIDIA GeForce RTX 4060,c11,32,128,32,4,2,8,0.0,0.0,192.51200556755066,198.5840030014515,2.091574407595649,3,-1,-1,llm8_g3,0,
2026-03-03T03:13:14.568709+00:00,BUCKET,llm_style,eval,llm_style_eval_058,32,2048,4096,bf16,NVIDIA GeForce RTX 4060,c11,32,128,32,4,2,8,0.0,0.0,246.5120032429695,355.97344815731043,2.1778692515465226,3,-1,-1,llm8_g3,0,
2026-03-03T03:13:14.669013+00:00,BUCKET,llm_style,eval,llm_style_eval_059,64,8192,2048,bf16,NVIDIA GeForce RTX 4060,c11,32,128,32,4,2,8,0.0,0.0,448.43199849128723,544.3811428546904,4.7888724605403565,0,-1,-1,llm8_g0,0,
2026-03-03T03:13:14.776370+00:00,BUCKET,llm_style,eval,llm_style_eval_060,1,3072,6144,bf16,NVIDIA GeForce RTX 4060,c04,64,64,64,4,3,8,0.0,0.0,422.91200160980225,579.6147191524504,0.08925907956338561,7,-1,-1,llm8_g7,0,
2026-03-03T03:13:14.831042+00:00,BUCKET,llm_style,eval,llm_style_eval_061,64,1536,4096,bf16,NVIDIA GeForce RTX 4060,c11,32,128,32,4,2,8,0.0,0.0,259.45599377155304,359.8815977573395,3.103826418861072,3,-1,-1,llm8_g3,0,
2026-03-03T03:13:14.901289+00:00,BUCKET,llm_style,eval,llm_style_eval_062,16,6144,2048,bf16,NVIDIA GeForce RTX 4060,c11,32,128,32,4,2,8,0.0,0.0,171.92000150680542,270.6070381402969,2.3420962102775524,4,-1,-1,llm8_g4,0,
2026-03-03T03:13:14.959907+00:00,BUCKET,llm_style,eval,llm_style_eval_063,64,1536,6144,bf16,NVIDIA GeForce RTX 4060,c11,32,128,32,4,2,8,0.0,0.0,367.6159977912903,438.7267154455184,3.285927596344175,3,-1,-1,llm8_g3,0,
2026-03-03T03:13:15.025674+00:00,BUCKET,llm_style,eval,llm_style_eval_064,1,6144,2048,bf16,NVIDIA GeForce RTX 4060,c11,32,128,32,4,2,8,0.0,0.0,165.67999869585037,228.25408488512028,0.15189415860751276,4,-1,-1,llm8_g4,0,
2026-03-03T03:13:15.085885+00:00,BUCKET,llm_style,eval,llm_style_eval_065,8,1536,6144,bf16,NVIDIA GeForce RTX 4060,c04,64,64,64,4,3,8,0.0,0.0,261.1199915409088,280.1152017712593,0.5782588422623479,7,-1,-1,llm8_g7,0,
2026-03-03T03:13:15.128552+00:00,BUCKET,llm_style,eval,llm_style_eval_066,64,1536,4096,bf16,NVIDIA GeForce RTX 4060,c11,32,128,32,4,2,8,0.0,0.0,242.68800020217896,272.9472067952156,3.318278478248261,3,-1,-1,llm8_g3,0,
2026-03-03T03:13:15.233014+00:00,BUCKET,llm_style,eval,llm_style_eval_067,64,8192,2048,bf16,NVIDIA GeForce RTX 4060,c11,32,128,32,4,2,8,0.0,0.0,461.8239998817444,554.5779061317443,4.65000443578049,0,-1,-1,llm8_g0,0,
2026-03-03T03:13:15.268268+00:00,BUCKET,llm_style,eval,llm_style_eval_068,64,1024,4096,bf16,NVIDIA GeForce RTX 4060,c11,32,128,32,4,2,8,0.0,0.0,272.271990776062,418.3859273791312,1.9718183661483013,3,-1,-1,llm8_g3,0,
2026-03-03T03:13:15.320493+00:00,BUCKET,llm_style,eval,llm_style_eval_069,64,2048,4096,bf16,NVIDIA GeForce RTX 4060,c11,32,128,32,4,2,8,0.0,0.0,297.9840040206909,334.80094999074936,3.6033539032700674,3,-1,-1,llm8_g3,0,
2026-03-03T03:13:15.375199+00:00,BUCKET,llm_style,eval,llm_style_eval_070,64,8192,1024,bf16,NVIDIA GeForce RTX 4060,c11,32,128,32,4,2,8,0.0,0.0,244.59199607372284,314.2656016349791,4.389930338016301,0,-1,-1,llm8_g0,0,
2026-03-03T03:13:15.452217+00:00,BUCKET,llm_style,eval,llm_style_eval_071,64,6144,2048,bf16,NVIDIA GeForce RTX 4060,c11,32,128,32,4,2,8,0.0,0.0,333.6640000343323,423.18688452243794,4.827049774126895,0,-1,-1,llm8_g0,0,
2026-03-03T03:13:15.467406+00:00,BUCKET,llm_style,eval,llm_style_eval_072,64,1536,1024,bf16,NVIDIA GeForce RTX 4060,c11,32,128,32,4,2,8,0.0,0.0,100.35199671983719,137.20575779676426,2.0062041472085883,3,-1,-1,llm8_g3,0,
2026-03-03T03:13:15.497896+00:00,BUCKET,llm_style,eval,llm_style_eval_073,1,4096,1536,bf16,NVIDIA GeForce RTX 4060,c00,32,32,32,2,2,8,0.0,0.0,121.83999642729759,173.56799885630596,0.10327406737497956,6,-1,-1,llm8_g6,0,
2026-03-03T03:13:15.512734+00:00,BUCKET,llm_style,eval,llm_style_eval_074,8,1024,2048,bf16,NVIDIA GeForce RTX 4060,c04,64,64,64,4,3,8,0.0,0.0,109.56799983978271,159.35488164424885,0.30624299110201353,7,-1,-1,llm8_g7,0,
2026-03-03T03:13:15.540254+00:00,BUCKET,llm_style,eval,llm_style_eval_075,2,6144,1024,bf16,NVIDIA GeForce RTX 4060,c11,32,128,32,4,2,8,0.0,0.0,108.5439994931221,277.7356839179992,0.23184905768646044,4,-1,-1,llm8_g4,0,
2026-03-03T03:13:15.588145+00:00,BUCKET,llm_style,eval,llm_style_eval_076,64,1024,6144,bf16,NVIDIA GeForce RTX 4060,c11,32,128,32,4,2,8,0.0,0.0,399.24800395965576,514.652174115181,2.0170579690146093,3,-1,-1,llm8_g3,0,
2026-03-03T03:13:15.783767+00:00,BUCKET,llm_style,eval,llm_style_eval_077,1,4096,8192,bf16,NVIDIA GeForce RTX 4060,c04,64,64,64,4,3,8,0.0,0.0,882.6879858970642,1000.4031729698181,0.07602784344209482,7,-1,-1,llm8_g7,0,
2026-03-03T03:13:15.900587+00:00,BUCKET,llm_style,eval,llm_style_eval_078,64,6144,3072,bf16,NVIDIA GeForce RTX 4060,c11,32,128,32,4,2,8,0.0,0.0,502.57599353790283,625.1827120780945,4.807072233978081,1,-1,-1,llm8_g1,0,
2026-03-03T03:13:15.976423+00:00,BUCKET,llm_style,eval,llm_style_eval_079,2,3072,4096,bf16,NVIDIA GeForce RTX 4060,c04,64,64,64,4,3,8,0.0,0.0,310.62400341033936,465.59455305337883,0.16203399430632887,7,-1,-1,llm8_g7,0,
2026-03-03T03:13:15.988343+00:00,BUCKET,llm_style,eval,llm_style_eval_080,4,1536,1024,bf16,NVIDIA GeForce RTX 4060,c04,64,64,64,4,3,8,0.0,0.0,73.63200187683105,152.3404756188392,0.17088917426213998,7,-1,-1,llm8_g7,0,
2026-03-03T03:13:16.140098+00:00,BUCKET,llm_style,eval,llm_style_eval_081,4,4096,6144,bf16,NVIDIA GeForce RTX 4060,c04,64,64,64,4,3,8,0.0,0.0,716.7039811611176,844.8534536361694,0.28090620017742174,7,-1,-1,llm8_g7,0,
2026-03-03T03:13:16.173851+00:00,BUCKET,llm_style,eval,llm_style_eval_082,64,6144,1024,bf16,NVIDIA GeForce RTX 4060,c11,32,128,32,4,2,8,0.0,0.0,195.0720027089119,275.0259159505366,4.128251911176024,0,-1,-1,llm8_g0,0,
2026-03-03T03:13:16.276050+00:00,BUCKET,llm_style,eval,llm_style_eval_083,8,4096,4096,bf16,NVIDIA GeForce RTX 4060,c04,64,64,64,4,3,8,0.0,0.0,487.88799345493317,555.5843365192413,0.5501989382831487,7,-1,-1,llm8_g7,0,
2026-03-03T03:13:16.347969+00:00,BUCKET,llm_style,eval,llm_style_eval_084,64,1024,8192,bf16,NVIDIA GeForce RTX 4060,c11,32,128,32,4,2,8,0.0,0.0,524.8000025749207,670.2592068910599,2.0460019411808443,3,-1,-1,llm8_g3,0,
2026-03-03T03:13:16.512542+00:00,BUCKET,llm_style,eval,llm_style_eval_085,1,3072,8192,bf16,NVIDIA GeForce RTX 4060,c04,64,64,64,4,3,8,0.0,0.0,670.7199811935425,790.7532799243927,0.07504122347814225,7,-1,-1,llm8_g7,0,
2026-03-03T03:13:16.528574+00:00,BUCKET,llm_style,eval,llm_style_eval_086,8,1536,1024,bf16,NVIDIA GeForce RTX 4060,c04,64,64,64,4,3,8,0.0,0.0,82.94399827718735,201.12127631902695,0.30340741370942,7,-1,-1,llm8_g7,0,
2026-03-03T03:13:16.552874+00:00,BUCKET,llm_style,eval,llm_style_eval_087,16,1024,3072,bf16,NVIDIA GeForce RTX 4060,c04,64,64,64,4,3,8,0.0,0.0,166.8960005044937,347.28192061185825,0.6031498399944558,7,-1,-1,llm8_g7,0,
2026-03-03T03:13:16.587990+00:00,BUCKET,llm_style,eval,llm_style_eval_088,8,4096,1536,bf16,NVIDIA GeForce RTX 4060,c00,32,32,32,2,2,8,0.0,0.0,111.61600053310394,316.0166463255882,0.9018715553254795,6,-1,-1,llm8_g6,0,
2026-03-03T03:13:16.691375+00:00,BUCKET,llm_style,eval,llm_style_eval_089,16,6144,3072,bf16,NVIDIA GeForce RTX 4060,c11,32,128,32,4,2,8,0.0,0.0,295.26400566101074,355.43040841817856,2.0455584304895678,5,-1,-1,llm8_g5,0,
2026-03-03T03:13:16.726838+00:00,BUCKET,llm_style,eval,llm_style_eval_090,32,1536,3072,bf16,NVIDIA GeForce RTX 4060,c11,32,128,32,4,2,8,0.0,0.0,234.49599742889404,322.2835284471512,1.2878253416311383,3,-1,-1,llm8_g3,0,
2026-03-03T03:13:16.758086+00:00,BUCKET,llm_style,eval,llm_style_eval_091,16,1024,4096,bf16,NVIDIA GeForce RTX 4060,c04,64,64,64,4,3,8,0.0,0.0,214.01600539684296,301.30175769329065,0.6271387401662993,7,-1,-1,llm8_g7,0,
2026-03-03T03:13:16.918185+00:00,BUCKET,llm_style,eval,llm_style_eval_092,1,4096,6144,bf16,NVIDIA GeForce RTX 4060,c04,64,64,64,4,3,8,0.0,0.0,787.4559760093689,903.0883079767227,0.063916776979798,7,-1,-1,llm8_g7,0,
2026-03-03T03:13:16.957857+00:00,BUCKET,llm_style,eval,llm_style_eval_093,32,2048,3072,bf16,NVIDIA GeForce RTX 4060,c11,32,128,32,4,2,8,0.0,0.0,227.32800245285034,356.9545644521712,1.7712432241316751,3,-1,-1,llm8_g3,0,
2026-03-03T03:13:16.977996+00:00,BUCKET,llm_style,eval,llm_style_eval_094,32,1024,2048,bf16,NVIDIA GeForce RTX 4060,c11,32,128,32,4,2,8,0.0,0.0,178.17600071430206,255.03744423389435,0.7532873533019333,3,-1,-1,llm8_g3,0,
2026-03-03T03:13:17.043916+00:00,BUCKET,llm_style,eval,llm_style_eval_095,8,6144,2048,bf16,NVIDIA GeForce RTX 4060,c11,32,128,32,4,2,8,0.0,0.0,200.70399343967438,320.3379276394843,1.0031020736042942,4,-1,-1,llm8_g4,0,
2026-03-03T03:13:17.087538+00:00,BUCKET,llm_style,eval,llm_style_eval_096,64,2048,3072,bf16,NVIDIA GeForce RTX 4060,c11,32,128,32,4,2,8,0.0,0.0,274.4320034980774,364.6300804615021,2.9344477237897726,3,-1,-1,llm8_g3,0,
2026-03-03T03:13:17.121842+00:00,BUCKET,llm_style,eval,llm_style_eval_097,64,6144,1024,bf16,NVIDIA GeForce RTX 4060,c11,32,128,32,4,2,8,0.0,0.0,205.6799978017807,256.7577646672724,3.9153363312269933,0,-1,-1,llm8_g0,0,
2026-03-03T03:13:17.150438+00:00,BUCKET,llm_style,eval,llm_style_eval_098,32,6144,1024,bf16,NVIDIA GeForce RTX 4060,c11,32,128,32,4,2,8,0.0,0.0,117.76000261306763,218.8569621741771,3.4192694893445785,0,-1,-1,llm8_g0,0,
2026-03-03T03:13:17.177955+00:00,BUCKET,llm_style,eval,llm_style_eval_099,1,2048,2048,bf16,NVIDIA GeForce RTX 4060,c04,64,64,64,4,3,8,0.0,0.0,206.84799551963806,274.5961591601371,0.04055445632396079,7,-1,-1,llm8_g7,0,
2026-03-03T03:13:17.226531+00:00,BUCKET,llm_style,eval,llm_style_eval_100,64,8192,1024,bf16,NVIDIA GeForce RTX 4060,c11,32,128,32,4,2,8,0.0,0.0,292.81599819660187,352.46144920587517,3.6669506810180184,0,-1,-1,llm8_g0,0,
2026-03-03T03:13:17.315502+00:00,BUCKET,llm_style,eval,llm_style_eval_101,64,8192,1536,bf16,NVIDIA GeForce RTX 4060,c11,32,128,32,4,2,8,0.0,0.0,426.39999091625214,573.3030658960341,3.7772344519499184,0,-1,-1,llm8_g0,0,
2026-03-03T03:13:17.353762+00:00,BUCKET,llm_style,eval,llm_style_eval_102,32,3072,2048,bf16,NVIDIA GeForce RTX 4060,c11,32,128,32,4,2,8,0.0,0.0,181.61600083112717,288.5324844717979,2.217057870217068,3,-1,-1,llm8_g3,0,
2026-03-03T03:13:17.395294+00:00,BUCKET,llm_style,eval,llm_style_eval_103,64,2048,3072,bf16,NVIDIA GeForce RTX 4060,c11,32,128,32,4,2,8,0.0,0.0,265.21599292755127,341.42206877470005,3.0364170693883628,3,-1,-1,llm8_g3,0,
2026-03-03T03:13:17.464341+00:00,BUCKET,llm_style,eval,llm_style_eval_104,16,6144,2048,bf16,NVIDIA GeForce RTX 4060,c11,32,128,32,4,2,8,0.0,0.0,205.82400262355804,423.8646253943439,1.9562984825265148,4,-1,-1,llm8_g4,0,
2026-03-03T03:13:17.520257+00:00,BUCKET,llm_style,eval,llm_style_eval_105,1,1024,8192,bf16,NVIDIA GeForce RTX 4060,c04,64,64,64,4,3,8,0.0,0.0,428.0320107936859,608.1945639848707,0.03919617126039371,7,-1,-1,llm8_g7,0,
2026-03-03T03:13:17.710931+00:00,BUCKET,llm_style,eval,llm_style_eval_106,32,4096,8192,bf16,NVIDIA GeForce RTX 4060,c11,32,128,32,4,2,8,0.0,0.0,752.6400089263916,871.9871932268143,2.8532679933708183,3,-1,-1,llm8_g3,0,
2026-03-03T03:13:17.779516+00:00,BUCKET,llm_style,eval,llm_style_eval_107,64,6144,1536,bf16,NVIDIA GeForce RTX 4060,c11,32,128,32,4,2,8,0.0,0.0,319.3280100822449,404.2854464054107,3.7828173973491475,0,-1,-1,llm8_g0,0,
2026-03-03T03:13:17.807973+00:00,BUCKET,llm_style,eval,llm_style_eval_108,8,3072,1536,bf16,NVIDIA GeForce RTX 4060,c04,64,64,64,4,3,8,0.0,0.0,154.03200685977936,219.5660796761512,0.4901414552673325,7,-1,-1,llm8_g7,0,
2026-03-03T03:13:17.827625+00:00,BUCKET,llm_style,eval,llm_style_eval_109,16,2048,1024,bf16,NVIDIA GeForce RTX 4060,c04,64,64,64,4,3,8,0.0,0.0,142.33599603176117,232.15104028582567,0.47148202753311386,7,-1,-1,llm8_g7,0,
2026-03-03T03:13:18.224096+00:00,BUCKET,llm_style,eval,llm_style_eval_110,1,8192,8192,bf16,NVIDIA GeForce RTX 4060,c11,32,128,32,4,2,8,0.0,0.0,1333.2480192184448,1480.639044046402,0.10066973741215753,5,-1,-1,llm8_g5,0,
2026-03-03T03:13:18.281582+00:00,BUCKET,llm_style,eval,llm_style_eval_111,8,6144,1536,bf16,NVIDIA GeForce RTX 4060,c11,32,128,32,4,2,8,0.0,0.0,175.56800693273544,233.55424016714093,0.8600367836826329,4,-1,-1,llm8_g4,0,
2026-03-03T03:13:18.382633+00:00,BUCKET,llm_style,eval,llm_style_eval_112,2,6144,3072,bf16,NVIDIA GeForce RTX 4060,c11,32,128,32,4,2,8,0.0,0.0,319.487988948822,386.40639990568144,0.23630770048164082,5,-1,-1,llm8_g5,0,
2026-03-03T03:13:18.793623+00:00,BUCKET,llm_style,eval,llm_style_eval_113,1,8192,8192,bf16,NVIDIA GeForce RTX 4060,c11,32,128,32,4,2,8,0.0,0.0,1282.047986984253,1413.1200313568115,0.10469009690949155,5,-1,-1,llm8_g5,0,
2026-03-03T03:13:18.817762+00:00,BUCKET,llm_style,eval,llm_style_eval_114,1,3072,1024,bf16,NVIDIA GeForce RTX 4060,c00,32,32,32,2,2,8,0.0,0.0,93.18400174379349,1509.5193624496446,0.06751648225301767,6,-1,-1,llm8_g6,0,
2026-03-03T03:13:18.843819+00:00,BUCKET,llm_style,eval,llm_style_eval_115,16,3072,1536,bf16,NVIDIA GeForce RTX 4060,c04,64,64,64,4,3,8,0.0,0.0,155.64799308776855,225.86367830634117,0.9701053062396715,7,-1,-1,llm8_g7,0,
2026-03-03T03:13:18.859177+00:00,BUCKET,llm_style,eval,llm_style_eval_116,8,3072,1024,bf16,NVIDIA GeForce RTX 4060,c00,32,32,32,2,2,8,0.0,0.0,81.64800330996513,137.70592108368874,0.6164467710119377,6,-1,-1,llm8_g6,0,
2026-03-03T03:13:18.885273+00:00,BUCKET,llm_style,eval,llm_style_eval_117,4,1024,4096,bf16,NVIDIA GeForce RTX 4060,c04,64,64,64,4,3,8,0.0,0.0,217.0879989862442,225.20255357027054,0.15456603845764028,7,-1,-1,llm8_g7,0,
2026-03-03T03:13:19.001777+00:00,BUCKET,llm_style,eval,llm_style_eval_118,64,6144,3072,bf16,NVIDIA GeForce RTX 4060,c11,32,128,32,4,2,8,0.0,0.0,546.8159914016724,684.062709212303,4.418157372843451,1,-1,-1,llm8_g1,0,
2026-03-03T03:13:19.323988+00:00,BUCKET,llm_style,eval,llm_style_eval_119,64,8192,6144,bf16,NVIDIA GeForce RTX 4060,c11,32,128,32,4,2,8,0.0,0.0,1511.904001235962,1739.4227087497711,4.261150799742166,1,-1,-1,llm8_g1,0,
2026-03-03T03:13:19.359371+00:00,BUCKET,llm_style,eval,llm_style_eval_120,8,1024,4096,bf16,NVIDIA GeForce RTX 4060,c04,64,64,64,4,3,8,0.0,0.0,218.1120067834854,284.6297663450241,0.3076807416045526,7,-1,-1,llm8_g7,0,
2026-03-03T03:13:19.380779+00:00,BUCKET,llm_style,eval,llm_style_eval_121,4,1024,2048,bf16,NVIDIA GeForce RTX 4060,c04,64,64,64,4,3,8,0.0,0.0,126.44800543785095,293.1609657406805,0.1326807484381079,7,-1,-1,llm8_g7,0,
2026-03-03T03:13:19.516581+00:00,BUCKET,llm_style,eval,llm_style_eval_122,4,6144,4096,bf16,NVIDIA GeForce RTX 4060,c11,32,128,32,4,2,8,0.0,0.0,366.06401205062866,390.72000831365585,0.5499764668813044,5,-1,-1,llm8_g5,0,
2026-03-03T03:13:19.656030+00:00,BUCKET,llm_style,eval,llm_style_eval_123,4,3072,8192,bf16,NVIDIA GeForce RTX 4060,c04,64,64,64,4,3,8,0.0,0.0,501.24800205230713,530.4121518135071,0.4016506622982824,7,-1,-1,llm8_g7,0,
2026-03-03T03:13:19.687904+00:00,BUCKET,llm_style,eval,llm_style_eval_124,64,6144,1024,bf16,NVIDIA GeForce RTX 4060,c11,32,128,32,4,2,8,0.0,0.0,150.52799880504608,196.28031909465778,5.349877593489963,0,-1,-1,llm8_g0,0,
2026-03-03T03:13:19.774587+00:00,BUCKET,llm_style,eval,llm_style_eval_125,64,1536,8192,bf16,NVIDIA GeForce RTX 4060,c11,32,128,32,4,2,8,0.0,0.0,461.8239998817444,477.2537499666214,3.4875033268353675,3,-1,-1,llm8_g3,0,
2026-03-03T03:13:19.879872+00:00,BUCKET,llm_style,eval,llm_style_eval_126,64,2048,8192,bf16,NVIDIA GeForce RTX 4060,c11,32,128,32,4,2,8,0.0,0.0,510.97601652145386,583.7721604108809,4.202709282950927,3,-1,-1,llm8_g3,0,
2026-03-03T03:13:19.945654+00:00,BUCKET,llm_style,eval,llm_style_eval_127,2,8192,1536,bf16,NVIDIA GeForce RTX 4060,c11,32,128,32,4,2,8,0.0,0.0,181.2479943037033,270.11584475636477,0.27769492398168627,4,-1,-1,llm8_g4,0,
2026-03-03T03:13:19.969782+00:00,BUCKET,llm_style,eval,llm_style_eval_128,8,2048,2048,bf16,NVIDIA GeForce RTX 4060,c04,64,64,64,4,3,8,0.0,0.0,145.32800018787384,198.2675164937973,0.4617751838134738,7,-1,-1,llm8_g7,0,
2026-03-03T03:13:20.262986+00:00,BUCKET,llm_style,eval,llm_style_eval_129,64,8192,6144,bf16,NVIDIA GeForce RTX 4060,c11,32,128,32,4,2,8,0.0,0.0,1225.6960272789001,1306.9990718364716,5.256157155296105,1,-1,-1,llm8_g1,0,
2026-03-03T03:13:20.293497+00:00,BUCKET,llm_style,eval,llm_style_eval_130,16,3072,1536,bf16,NVIDIA GeForce RTX 4060,c04,64,64,64,4,3,8,0.0,0.0,120.83200365304947,330.77280268073036,1.249627080864758,7,-1,-1,llm8_g7,0,
2026-03-03T03:13:20.676742+00:00,BUCKET,llm_style,eval,llm_style_eval_131,32,8192,8192,bf16,NVIDIA GeForce RTX 4060,c11,32,128,32,4,2,8,0.0,0.0,923.0239987373352,960.0102186203003,4.653148024185033,1,-1,-1,llm8_g1,0,
2026-03-03T03:13:20.848617+00:00,BUCKET,llm_style,eval,llm_style_eval_132,32,8192,4096,bf16,NVIDIA GeForce RTX 4060,c11,32,128,32,4,2,8,0.0,0.0,480.6399941444397,522.7132856845856,4.467967031796043,1,-1,-1,llm8_g1,0,
2026-03-03T03:13:21.190344+00:00,BUCKET,llm_style,eval,llm_style_eval_133,2,8192,8192,bf16,NVIDIA GeForce RTX 4060,c11,32,128,32,4,2,8,0.0,0.0,910.3360176086426,1057.832967042923,0.29487513490365,5,-1,-1,llm8_g5,0,
2026-03-03T03:13:21.239228+00:00,BUCKET,llm_style,eval,llm_style_eval_134,64,3072,3072,bf16,NVIDIA GeForce RTX 4060,c11,32,128,32,4,2,8,0.0,0.0,224.2559939622879,298.106869161129,5.386520692968131,3,-1,-1,llm8_g3,0,
2026-03-03T03:13:21.295332+00:00,BUCKET,llm_style,eval,llm_style_eval_135,8,3072,3072,bf16,NVIDIA GeForce RTX 4060,c04,64,64,64,4,3,8,0.0,0.0,236.54399812221527,246.1884805560112,0.6383376674050524,7,-1,-1,llm8_g7,0,
2026-03-03T03:13:21.351578+00:00,BUCKET,llm_style,eval,llm_style_eval_136,4,2048,4096,bf16,NVIDIA GeForce RTX 4060,c04,64,64,64,4,3,8,0.0,0.0,305.5199980735779,400.6835129857062,0.21965457064397562,7,-1,-1,llm8_g7,0,
2026-03-03T03:13:21.698956+00:00,BUCKET,llm_style,eval,llm_style_eval_137,4,8192,8192,bf16,NVIDIA GeForce RTX 4060,c11,32,128,32,4,2,8,0.0,0.0,944.0799951553345,989.772162437439,0.5686709969017676,5,-1,-1,llm8_g5,0,
2026-03-03T03:13:21.714158+00:00,BUCKET,llm_style,eval,llm_style_eval_138,16,1024,1024,bf16,NVIDIA GeForce RTX 4060,c04,64,64,64,4,3,8,0.0,0.0,76.80000364780426,163.3996795117855,0.43690664591471445,7,-1,-1,llm8_g7,0,
2026-03-03T03:13:21.725654+00:00,BUCKET,llm_style,eval,llm_style_eval_139,4,1024,1024,bf16,NVIDIA GeForce RTX 4060,c04,64,64,64,4,3,8,0.0,0.0,81.91999793052673,189.06112059950829,0.10240000258684165,7,-1,-1,llm8_g7,0,
2026-03-03T03:13:21.886105+00:00,BUCKET,llm_style,eval,llm_style_eval_140,64,4096,6144,bf16,NVIDIA GeForce RTX 4060,c11,32,128,32,4,2,8,0.0,0.0,784.7840189933777,913.8300901651382,4.104601258486103,3,-1,-1,llm8_g3,0,
2026-03-03T03:13:22.018109+00:00,BUCKET,llm_style,eval,llm_style_eval_141,4,6144,4096,bf16,NVIDIA GeForce RTX 4060,c11,32,128,32,4,2,8,0.0,0.0,374.59200620651245,453.91871690750116,0.5374556548572174,5,-1,-1,llm8_g5,0,
2026-03-03T03:13:22.107164+00:00,BUCKET,llm_style,eval,llm_style_eval_142,4,2048,6144,bf16,NVIDIA GeForce RTX 4060,c04,64,64,64,4,3,8,0.0,0.0,494.59201097488403,627.6044607162476,0.20352794579432015,7,-1,-1,llm8_g7,0,
2026-03-03T03:13:22.209736+00:00,BUCKET,llm_style,eval,llm_style_eval_143,64,1536,8192,bf16,NVIDIA GeForce RTX 4060,c11,32,128,32,4,2,8,0.0,0.0,556.5440058708191,702.5459343194962,2.8939539713124565,3,-1,-1,llm8_g3,0,
2026-03-03T03:13:22.274204+00:00,BUCKET,llm_style,eval,llm_style_eval_144,1,3072,3072,bf16,NVIDIA GeForce RTX 4060,c04,64,64,64,4,3,8,0.0,0.0,275.4560112953186,378.46368074417114,0.06852044328691247,7,-1,-1,llm8_g7,0,
2026-03-03T03:13:22.298528+00:00,BUCKET,llm_style,eval,llm_style_eval_145,32,1024,2048,bf16,NVIDIA GeForce RTX 4060,c11,32,128,32,4,2,8,0.0,0.0,151.5040025115013,217.79903471469873,0.8859021925167353,3,-1,-1,llm8_g3,0,
2026-03-03T03:13:22.510783+00:00,BUCKET,llm_style,eval,llm_style_eval_146,64,8192,4096,bf16,NVIDIA GeForce RTX 4060,c11,32,128,32,4,2,8,0.0,0.0,1013.1679773330688,1169.5104229450226,4.23914631343315,1,-1,-1,llm8_g1,0,
2026-03-03T03:13:22.574211+00:00,BUCKET,llm_style,eval,llm_style_eval_147,64,2048,4096,bf16,NVIDIA GeForce RTX 4060,c11,32,128,32,4,2,8,0.0,0.0,342.863991856575,455.8816117048263,3.1316844273608115,3,-1,-1,llm8_g3,0,
2026-03-03T03:13:22.624189+00:00,BUCKET,llm_style,eval,llm_style_eval_148,64,1024,6144,bf16,NVIDIA GeForce RTX 4060,c11,32,128,32,4,2,8,0.0,0.0,447.488009929657,565.1868730783463,1.7996155207076732,3,-1,-1,llm8_g3,0,
2026-03-03T03:13:22.843939+00:00,BUCKET,llm_style,eval,llm_style_eval_149,64,4096,8192,bf16,NVIDIA GeForce RTX 4060,c11,32,128,32,4,2,8,0.0,0.0,856.0320138931274,955.2383995056152,5.017297514922394,3,-1,-1,llm8_g3,0,
2026-03-03T03:13:22.880107+00:00,BUCKET,llm_style,eval,llm_style_eval_150,2,2048,3072,bf16,NVIDIA GeForce RTX 4060,c04,64,64,64,4,3,8,0.0,0.0,221.1040034890175,360.8576029539107,0.1138189431348312,7,-1,-1,llm8_g7,0,
2026-03-03T03:13:22.929670+00:00,BUCKET,llm_style,eval,llm_style_eval_151,64,4096,2048,bf16,NVIDIA GeForce RTX 4060,c11,32,128,32,4,2,8,0.0,0.0,242.12800711393356,257.064965069294,4.434603979930128,3,-1,-1,llm8_g3,0,
2026-03-03T03:13:23.280837+00:00,BUCKET,llm_style,eval,llm_style_eval_152,8,8192,8192,bf16,NVIDIA GeForce RTX 4060,c11,32,128,32,4,2,8,0.0,0.0,914.4319891929626,994.9184316396712,1.1742172591180204,5,-1,-1,llm8_g5,0,
2026-03-03T03:13:23.386857+00:00,BUCKET,llm_style,eval,llm_style_eval_153,64,8192,2048,bf16,NVIDIA GeForce RTX 4060,c11,32,128,32,4,2,8,0.0,0.0,463.8719856739044,611.9526493549347,4.6294747566619625,0,-1,-1,llm8_g0,0,
2026-03-03T03:13:23.498223+00:00,BUCKET,llm_style,eval,llm_style_eval_154,16,2048,8192,bf16,NVIDIA GeForce RTX 4060,c04,64,64,64,4,3,8,0.0,0.0,510.3839933872223,684.5721638202665,1.0518960605268872,7,-1,-1,llm8_g7,0,
2026-03-03T03:13:23.521013+00:00,BUCKET,llm_style,eval,llm_style_eval_155,4,2048,1536,bf16,NVIDIA GeForce RTX 4060,c04,64,64,64,4,3,8,0.0,0.0,118.67200210690498,164.47487592697132,0.21206201591955542,7,-1,-1,llm8_g7,0,
2026-03-03T03:13:23.664333+00:00,BUCKET,llm_style,eval,llm_style_eval_156,1,4096,6144,bf16,NVIDIA GeForce RTX 4060,c04,64,64,64,4,3,8,0.0,0.0,555.8879971504211,629.4630551338194,0.09054278606123681,7,-1,-1,llm8_g7,0,
2026-03-03T03:13:23.736605+00:00,BUCKET,llm_style,eval,llm_style_eval_157,1,1536,8192,bf16,NVIDIA GeForce RTX 4060,c04,64,64,64,4,3,8,0.0,0.0,299.00801181793213,358.9939221739768,0.08416438023514779,7,-1,-1,llm8_g7,0,
2026-03-03T03:13:23.823270+00:00,BUCKET,llm_style,eval,llm_style_eval_158,64,1536,8192,bf16,NVIDIA GeForce RTX 4060,c11,32,128,32,4,2,8,0.0,0.0,471.52000665664673,573.8025379180906,3.4157887539495695,3,-1,-1,llm8_g3,0,
2026-03-03T03:13:23.871011+00:00,BUCKET,llm_style,eval,llm_style_eval_159,16,6144,1536,bf16,NVIDIA GeForce RTX 4060,c11,32,128,32,4,2,8,0.0,0.0,119.80800330638885,207.50752270221707,2.520615315052965,4,-1,-1,llm8_g4,0,
2026-03-03T03:13:24.063006+00:00,BUCKET,llm_style,eval,llm_style_eval_160,32,6144,6144,bf16,NVIDIA GeForce RTX 4060,c11,32,128,32,4,2,8,0.0,0.0,537.4879837036133,600.7603293657302,4.494833702798106,1,-1,-1,llm8_g1,0,
2026-03-03T03:13:24.095182+00:00,BUCKET,llm_style,eval,llm_style_eval_161,2,1536,4096,bf16,NVIDIA GeForce RTX 4060,c04,64,64,64,4,3,8,0.0,0.0,163.28000277280807,191.15648001432413,0.15412679797057796,7,-1,-1,llm8_g7,0,
2026-03-03T03:13:24.126007+00:00,BUCKET,llm_style,eval,llm_style_eval_162,64,1536,3072,bf16,NVIDIA GeForce RTX 4060,c11,32,128,32,4,2,8,0.0,0.0,191.48799777030945,270.7766416668892,3.154139074160021,3,-1,-1,llm8_g3,0,
2026-03-03T03:13:24.186465+00:00,BUCKET,llm_style,eval,llm_style_eval_163,64,1024,8192,bf16,NVIDIA GeForce RTX 4060,c11,32,128,32,4,2,8,0.0,0.0,438.78400325775146,558.1004977226257,2.4470851626950956,3,-1,-1,llm8_g3,0,
2026-03-03T03:13:24.384823+00:00,BUCKET,llm_style,eval,llm_style_eval_164,64,4096,8192,bf16,NVIDIA GeForce RTX 4060,c11,32,128,32,4,2,8,0.0,0.0,777.2160172462463,845.5014425516126,5.526092103991238,3,-1,-1,llm8_g3,0,
2026-03-03T03:13:24.517222+00:00,BUCKET,llm_style,eval,llm_style_eval_165,4,8192,3072,bf16,NVIDIA GeForce RTX 4060,c11,32,128,32,4,2,8,0.0,0.0,367.0559972524643,519.8131138086319,0.5484901309527599,4,-1,-1,llm8_g4,0,
2026-03-03T03:13:24.570901+00:00,BUCKET,llm_style,eval,llm_style_eval_166,64,1024,6144,bf16,NVIDIA GeForce RTX 4060,c11,32,128,32,4,2,8,0.0,0.0,299.9520003795624,443.4739285707474,2.6847841220627204,3,-1,-1,llm8_g3,0,
2026-03-03T03:13:24.585796+00:00,BUCKET,llm_style,eval,llm_style_eval_167,2,2048,1024,bf16,NVIDIA GeForce RTX 4060,c04,64,64,64,4,3,8,0.0,0.0,89.08800035715103,220.952963232994,0.09416091916274166,7,-1,-1,llm8_g7,0,
2026-03-03T03:13:24.608416+00:00,BUCKET,llm_style,eval,llm_style_eval_168,64,4096,1024,bf16,NVIDIA GeForce RTX 4060,c11,32,128,32,4,2,8,0.0,0.0,122.8799968957901,133.68319675326347,4.369066777038577,2,-1,-1,llm8_g2,0,
2026-03-03T03:13:24.655499+00:00,BUCKET,llm_style,eval,llm_style_eval_169,4,1536,6144,bf16,NVIDIA GeForce RTX 4060,c04,64,64,64,4,3,8,0.0,0.0,224.2559939622879,276.5311928093432,0.3366575433105082,7,-1,-1,llm8_g7,0,
2026-03-03T03:13:24.674233+00:00,BUCKET,llm_style,eval,llm_style_eval_170,16,1536,1536,bf16,NVIDIA GeForce RTX 4060,c04,64,64,64,4,3,8,0.0,0.0,74.24000278115273,217.54495441913582,1.0169378929383135,7,-1,-1,llm8_g7,0,
2026-03-03T03:13:24.714718+00:00,BUCKET,llm_style,eval,llm_style_eval_171,1,2048,3072,bf16,NVIDIA GeForce RTX 4060,c04,64,64,64,4,3,8,0.0,0.0,202.7519941329956,334.27711695432663,0.06206060785644462,7,-1,-1,llm8_g7,0,
2026-03-03T03:13:24.748323+00:00,BUCKET,llm_style,eval,llm_style_eval_172,64,3072,2048,bf16,NVIDIA GeForce RTX 4060,c11,32,128,32,4,2,8,0.0,0.0,138.62399756908417,223.7542374432087,5.8092854204314115,3,-1,-1,llm8_g3,0,
2026-03-03T03:13:25.061038+00:00,BUCKET,llm_style,eval,llm_style_eval_173,64,8192,6144,bf16,NVIDIA GeForce RTX 4060,c11,32,128,32,4,2,8,0.0,0.0,1201.151967048645,1342.3381900787354,5.363560249441018,1,-1,-1,llm8_g1,0,
2026-03-03T03:13:25.156606+00:00,BUCKET,llm_style,eval,llm_style_eval_174,2,4096,4096,bf16,NVIDIA GeForce RTX 4060,c04,64,64,64,4,3,8,0.0,0.0,368.6400055885315,488.1408008933066,0.18204444168467585,7,-1,-1,llm8_g7,0,
2026-03-03T03:13:25.200214+00:00,BUCKET,llm_style,eval,llm_style_eval_175,64,4096,2048,bf16,NVIDIA GeForce RTX 4060,c11,32,128,32,4,2,8,0.0,0.0,219.88800168037415,296.6681662201879,4.883130574631238,3,-1,-1,llm8_g3,0,
2026-03-03T03:13:25.272570+00:00,BUCKET,llm_style,eval,llm_style_eval_176,16,6144,2048,bf16,NVIDIA GeForce RTX 4060,c11,32,128,32,4,2,8,0.0,0.0,155.5519998073578,329.1955196857451,2.5885439242096715,4,-1,-1,llm8_g4,0,
2026-03-03T03:13:25.324954+00:00,BUCKET,llm_style,eval,llm_style_eval_177,1,6144,1536,bf16,NVIDIA GeForce RTX 4060,c11,32,128,32,4,2,8,0.0,0.0,108.5279993712902,164.34208288788795,0.1739124291366325,4,-1,-1,llm8_g4,0,
2026-03-03T03:13:25.581610+00:00,BUCKET,llm_style,eval,llm_style_eval_178,32,6144,8192,bf16,NVIDIA GeForce RTX 4060,c11,32,128,32,4,2,8,0.0,0.0,699.7600197792053,731.1647862195969,4.603328828383752,1,-1,-1,llm8_g1,0,
2026-03-03T03:13:25.725008+00:00,BUCKET,llm_style,eval,llm_style_eval_179,64,4096,6144,bf16,NVIDIA GeForce RTX 4060,c11,32,128,32,4,2,8,0.0,0.0,565.6160116195679,644.6834945678709,5.6950747606603995,3,-1,-1,llm8_g3,0,
2026-03-03T03:13:25.744783+00:00,BUCKET,llm_style,eval,llm_style_eval_180,64,2048,1536,bf16,NVIDIA GeForce RTX 4060,c11,32,128,32,4,2,8,0.0,0.0,112.64000087976456,224.26623746752728,3.5746908811711084,3,-1,-1,llm8_g3,0,
2026-03-03T03:13:25.783239+00:00,BUCKET,llm_style,eval,llm_style_eval_181,64,2048,3072,bf16,NVIDIA GeForce RTX 4060,c11,32,128,32,4,2,8,0.0,0.0,186.3360032439232,290.33471018075943,4.321796936611404,3,-1,-1,llm8_g3,0,
2026-03-03T03:13:25.809017+00:00,BUCKET,llm_style,eval,llm_style_eval_182,32,3072,1536,bf16,NVIDIA GeForce RTX 4060,c11,32,128,32,4,2,8,0.0,0.0,109.56799983978271,202.29600131511688,2.7561869199181217,3,-1,-1,llm8_g3,0,
2026-03-03T03:13:25.903755+00:00,BUCKET,llm_style,eval,llm_style_eval_183,8,8192,2048,bf16,NVIDIA GeForce RTX 4060,c11,32,128,32,4,2,8,0.0,0.0,253.26399505138397,294.53536152839655,1.059903741728223,4,-1,-1,llm8_g4,0,
2026-03-03T03:13:25.950797+00:00,BUCKET,llm_style,eval,llm_style_eval_184,64,8192,1024,bf16,NVIDIA GeForce RTX 4060,c11,32,128,32,4,2,8,0.0,0.0,171.93599790334702,303.55455845594395,6.245008823594921,0,-1,-1,llm8_g0,0,
2026-03-03T03:13:26.022488+00:00,BUCKET,llm_style,eval,llm_style_eval_185,1,8192,1536,bf16,NVIDIA GeForce RTX 4060,c11,32,128,32,4,2,8,0.0,0.0,173.0560064315796,230.58432355523104,0.14542011293869594,4,-1,-1,llm8_g4,0,
2026-03-03T03:13:26.052198+00:00,BUCKET,llm_style,eval,llm_style_eval_186,16,6144,1024,bf16,NVIDIA GeForce RTX 4060,c11,32,128,32,4,2,8,0.0,0.0,84.47999879717827,143.0508796870708,2.3831273066581122,4,-1,-1,llm8_g4,0,
2026-03-03T03:13:26.087173+00:00,BUCKET,llm_style,eval,llm_style_eval_187,1,1024,6144,bf16,NVIDIA GeForce RTX 4060,c04,64,64,64,4,3,8,0.0,0.0,215.03999829292297,301.260797381401,0.05851428617879647,7,-1,-1,llm8_g7,0,
2026-03-03T03:13:26.258990+00:00,BUCKET,llm_style,eval,llm_style_eval_188,8,8192,4096,bf16,NVIDIA GeForce RTX 4060,c11,32,128,32,4,2,8,0.0,0.0,471.0400104522705,599.0809613466263,1.1397564964481928,5,-1,-1,llm8_g5,0,
2026-03-03T03:13:26.360307+00:00,BUCKET,llm_style,eval,llm_style_eval_189,8,2048,8192,bf16,NVIDIA GeForce RTX 4060,c04,64,64,64,4,3,8,0.0,0.0,467.74400770664215,560.7705664634705,0.5738939496331427,7,-1,-1,llm8_g7,0,
2026-03-03T03:13:26.452758+00:00,BUCKET,llm_style,eval,llm_style_eval_190,4,8192,2048,bf16,NVIDIA GeForce RTX 4060,c11,32,128,32,4,2,8,0.0,0.0,258.5600018501282,425.9926453232763,0.5190970259885672,4,-1,-1,llm8_g4,0,
2026-03-03T03:13:26.805916+00:00,BUCKET,llm_style,eval,llm_style_eval_191,4,8192,8192,bf16,NVIDIA GeForce RTX 4060,c11,32,128,32,4,2,8,0.0,0.0,911.3600254058838,1114.7676944732661,0.5890876240275065,5,-1,-1,llm8_g5,0,
2026-03-03T03:13:26.823936+00:00,BUCKET,llm_style,eval,llm_style_eval_192,64,1536,1024,bf16,NVIDIA GeForce RTX 4060,c11,32,128,32,4,2,8,0.0,0.0,74.75200295448303,126.92288123071194,2.693260167524729,3,-1,-1,llm8_g3,0,
2026-03-03T03:13:26.852675+00:00,BUCKET,llm_style,eval,llm_style_eval_193,32,2048,2048,bf16,NVIDIA GeForce RTX 4060,c11,32,128,32,4,2,8,0.0,0.0,127.79200077056885,218.27583923935885,2.1005654061394274,3,-1,-1,llm8_g3,0,
2026-03-03T03:13:26.866329+00:00,BUCKET,llm_style,eval,llm_style_eval_194,8,1024,2048,bf16,NVIDIA GeForce RTX 4060,c04,64,64,64,4,3,8,0.0,0.0,88.94399926066399,106.5369588136673,0.3772534659889039,7,-1,-1,llm8_g7,0,
2026-03-03T03:13:26.907149+00:00,BUCKET,llm_style,eval,llm_style_eval_195,2,4096,2048,bf16,NVIDIA GeForce RTX 4060,c04,64,64,64,4,3,8,0.0,0.0,197.02400267124176,383.75423550605757,0.17030631570301413,7,-1,-1,llm8_g7,0,
2026-03-03T03:13:26.961344+00:00,BUCKET,llm_style,eval,llm_style_eval_196,32,2048,4096,bf16,NVIDIA GeForce RTX 4060,c11,32,128,32,4,2,8,0.0,0.0,218.1120067834854,252.9382398724555,2.461445932836421,3,-1,-1,llm8_g3,0,
2026-03-03T03:13:27.031608+00:00,BUCKET,llm_style,eval,llm_style_eval_197,32,8192,1536,bf16,NVIDIA GeForce RTX 4060,c11,32,128,32,4,2,8,0.0,0.0,194.43200528621674,205.2431944012642,4.14184057205261,0,-1,-1,llm8_g0,0,
2026-03-03T03:13:27.234221+00:00,BUCKET,llm_style,eval,llm_style_eval_198,64,4096,8192,bf16,NVIDIA GeForce RTX 4060,c11,32,128,32,4,2,8,0.0,0.0,889.2479836940765,937.0828920602798,4.829887022243253,3,-1,-1,llm8_g3,0,
2026-03-03T03:13:27.406399+00:00,BUCKET,llm_style,eval,llm_style_eval_199,2,8192,4096,bf16,NVIDIA GeForce RTX 4060,c11,32,128,32,4,2,8,0.0,0.0,477.183997631073,576.5017646551131,0.28127038766243007,5,-1,-1,llm8_g5,0,
2026-03-03T03:13:27.426555+00:00,BUCKET,llm_style,eval,llm_style_eval_200,1,4096,1024,bf16,NVIDIA GeForce RTX 4060,c00,32,32,32,2,2,8,0.0,0.0,87.0399996638298,154.5859196782111,0.09637647096046527,6,-1,-1,llm8_g6,0,
2026-03-03T03:13:27.508714+00:00,BUCKET,llm_style,eval,llm_style_eval_201,4,1536,8192,bf16,NVIDIA GeForce RTX 4060,c04,64,64,64,4,3,8,0.0,0.0,353.2800078392029,439.15680676698673,0.2849391241120482,7,-1,-1,llm8_g7,0,
2026-03-03T03:13:27.608269+00:00,BUCKET,llm_style,eval,llm_style_eval_202,1,6144,3072,bf16,NVIDIA GeForce RTX 4060,c11,32,128,32,4,2,8,0.0,0.0,284.67199206352234,313.9033502340317,0.13260432024368826,5,-1,-1,llm8_g5,0,
2026-03-03T03:13:27.694132+00:00,BUCKET,llm_style,eval,llm_style_eval_203,16,2048,6144,bf16,NVIDIA GeForce RTX 4060,c04,64,64,64,4,3,8,0.0,0.0,468.9279943704605,586.3526332378387,0.858667404876446,7,-1,-1,llm8_g7,0,
2026-03-03T03:13:27.706271+00:00,BUCKET,llm_style,eval,llm_style_eval_204,16,1536,1024,bf16,NVIDIA GeForce RTX 4060,c04,64,64,64,4,3,8,0.0,0.0,70.65600156784058,146.44704461097706,0.7123478102801205,7,-1,-1,llm8_g7,0,
2026-03-03T03:13:27.783940+00:00,BUCKET,llm_style,eval,llm_style_eval_205,64,6144,2048,bf16,NVIDIA GeForce RTX 4060,c11,32,128,32,4,2,8,0.0,0.0,334.84798669815063,361.30206793546665,4.809981842452856,0,-1,-1,llm8_g0,0,
2026-03-03T03:13:27.872685+00:00,BUCKET,llm_style,eval,llm_style_eval_206,4,2048,6144,bf16,NVIDIA GeForce RTX 4060,c04,64,64,64,4,3,8,0.0,0.0,484.3519926071167,501.84191077947617,0.2078308699798274,7,-1,-1,llm8_g7,0,
2026-03-03T03:13:27.926518+00:00,BUCKET,llm_style,eval,llm_style_eval_207,32,6144,1536,bf16,NVIDIA GeForce RTX 4060,c11,32,128,32,4,2,8,0.0,0.0,136.19199395179749,183.93088236451138,4.434767114238498,0,-1,-1,llm8_g0,0,
2026-03-03T03:13:27.943472+00:00,BUCKET,llm_style,eval,llm_style_eval_208,4,2048,1024,bf16,NVIDIA GeForce RTX 4060,c04,64,64,64,4,3,8,0.0,0.0,131.58399611711502,141.35296314954758,0.12750194928772043,7,-1,-1,llm8_g7,0,
2026-03-03T03:13:27.956054+00:00,BUCKET,llm_style,eval,llm_style_eval_209,1,1024,1536,bf16,NVIDIA GeForce RTX 4060,c04,64,64,64,4,3,8,0.0,0.0,95.23200243711472,117.35263831913468,0.033032257219176325,7,-1,-1,llm8_g7,0,
2026-03-03T03:13:28.088936+00:00,BUCKET,llm_style,eval,llm_style_eval_210,8,6144,4096,bf16,NVIDIA GeForce RTX 4060,c11,32,128,32,4,2,8,0.0,0.0,369.6640133857727,465.58207750320435,1.0892409577877968,5,-1,-1,llm8_g5,0,
2026-03-03T03:13:28.201283+00:00,BUCKET,llm_style,eval,llm_style_eval_211,4,2048,8192,bf16,NVIDIA GeForce RTX 4060,c04,64,64,64,4,3,8,0.0,0.0,647.167980670929,656.7756742238998,0.20739241125751373,7,-1,-1,llm8_g7,0,
2026-03-03T03:13:28.216099+00:00,BUCKET,llm_style,eval,llm_style_eval_212,32,1024,1024,bf16,NVIDIA GeForce RTX 4060,c11,32,128,32,4,2,8,0.0,0.0,76.80000364780426,289.92511749267567,0.8738132918294289,3,-1,-1,llm8_g3,0,
2026-03-03T03:13:28.297704+00:00,BUCKET,llm_style,eval,llm_style_eval_213,16,3072,4096,bf16,NVIDIA GeForce RTX 4060,c04,64,64,64,4,3,8,0.0,0.0,343.03998947143555,438.743039369583,1.1737791405031754,7,-1,-1,llm8_g7,0,
2026-03-03T03:13:28.375221+00:00,BUCKET,llm_style,eval,llm_style_eval_214,64,1024,8192,bf16,NVIDIA GeForce RTX 4060,c11,32,128,32,4,2,8,0.0,0.0,548.2560098171234,563.0774319171906,1.9584679506899665,3,-1,-1,llm8_g3,0,
2026-03-03T03:13:28.405339+00:00,BUCKET,llm_style,eval,llm_style_eval_215,4,4096,1536,bf16,NVIDIA GeForce RTX 4060,c00,32,32,32,2,2,8,0.0,0.0,126.97599828243256,185.82527920603732,0.39638710213600664,6,-1,-1,llm8_g6,0,
2026-03-03T03:13:28.431686+00:00,BUCKET,llm_style,eval,llm_style_eval_216,16,1536,3072,bf16,NVIDIA GeForce RTX 4060,c04,64,64,64,4,3,8,0.0,0.0,161.77599877119064,211.97824090719212,0.9333581319041095,7,-1,-1,llm8_g7,0,
2026-03-03T03:13:28.500724+00:00,BUCKET,llm_style,eval,llm_style_eval_217,8,6144,2048,bf16,NVIDIA GeForce RTX 4060,c11,32,128,32,4,2,8,0.0,0.0,191.23200327157974,277.4527931213378,1.0527871305833907,4,-1,-1,llm8_g4,0,
2026-03-03T03:13:28.578155+00:00,BUCKET,llm_style,eval,llm_style_eval_218,8,3072,4096,bf16,NVIDIA GeForce RTX 4060,c04,64,64,64,4,3,8,0.0,0.0,354.3039858341217,362.93662816286087,0.5682312365920074,7,-1,-1,llm8_g7,0,
2026-03-03T03:13:28.739327+00:00,BUCKET,llm_style,eval,llm_style_eval_219,64,8192,3072,bf16,NVIDIA GeForce RTX 4060,c11,32,128,32,4,2,8,0.0,0.0,776.6560018062592,879.6364718675613,4.147557560243449,0,-1,-1,llm8_g0,0,
2026-03-03T03:13:28.788434+00:00,BUCKET,llm_style,eval,llm_style_eval_220,2,4096,2048,bf16,NVIDIA GeForce RTX 4060,c04,64,64,64,4,3,8,0.0,0.0,282.0480018854141,331.1001601815223,0.11896709700369354,7,-1,-1,llm8_g7,0,
2026-03-03T03:13:28.853884+00:00,BUCKET,llm_style,eval,llm_style_eval_221,4,1024,8192,bf16,NVIDIA GeForce RTX 4060,c04,64,64,64,4,3,8,0.0,0.0,401.37599408626556,542.7711862325667,0.16719700477546912,7,-1,-1,llm8_g7,0,
2026-03-03T03:13:28.935689+00:00,BUCKET,llm_style,eval,llm_style_eval_222,64,6144,2048,bf16,NVIDIA GeForce RTX 4060,c11,32,128,32,4,2,8,0.0,0.0,375.15199184417725,537.7993631362914,4.293227201280548,0,-1,-1,llm8_g0,0,
2026-03-03T03:13:28.962714+00:00,BUCKET,llm_style,eval,llm_style_eval_223,4,2048,2048,bf16,NVIDIA GeForce RTX 4060,c04,64,64,64,4,3,8,0.0,0.0,197.10400700569153,231.52639642357826,0.17023718852672076,7,-1,-1,llm8_g7,0,
2026-03-03T03:13:28.988602+00:00,BUCKET,llm_style,eval,llm_style_eval_224,16,3072,1536,bf16,NVIDIA GeForce RTX 4060,c04,64,64,64,4,3,8,0.0,0.0,158.11199694871902,257.16735005378723,0.9549872679741859,7,-1,-1,llm8_g7,0,
2026-03-03T03:13:29.016019+00:00,BUCKET,llm_style,eval,llm_style_eval_225,1,2048,2048,bf16,NVIDIA GeForce RTX 4060,c04,64,64,64,4,3,8,0.0,0.0,199.10400360822678,297.93695628643025,0.04213178965756061,7,-1,-1,llm8_g7,0,
2026-03-03T03:13:29.027679+00:00,BUCKET,llm_style,eval,llm_style_eval_226,8,1536,1024,bf16,NVIDIA GeForce RTX 4060,c04,64,64,64,4,3,8,0.0,0.0,78.84799689054489,144.77055944502342,0.31916884375559545,7,-1,-1,llm8_g7,0,
2026-03-03T03:13:29.276627+00:00,BUCKET,llm_style,eval,llm_style_eval_227,64,6144,6144,bf16,NVIDIA GeForce RTX 4060,c11,32,128,32,4,2,8,0.0,0.0,1131.5200328826904,1174.210557937622,4.270218880429612,1,-1,-1,llm8_g1,0,
2026-03-03T03:13:29.360543+00:00,BUCKET,llm_style,eval,llm_style_eval_228,64,6144,2048,bf16,NVIDIA GeForce RTX 4060,c11,32,128,32,4,2,8,0.0,0.0,399.29600059986115,421.40672475099564,4.033631024554169,0,-1,-1,llm8_g0,0,
2026-03-03T03:13:29.445423+00:00,BUCKET,llm_style,eval,llm_style_eval_229,16,1536,8192,bf16,NVIDIA GeForce RTX 4060,c04,64,64,64,4,3,8,0.0,0.0,392.192006111145,479.8463985323905,1.0266736132451673,7,-1,-1,llm8_g7,0,
2026-03-03T03:13:29.466797+00:00,BUCKET,llm_style,eval,llm_style_eval_230,64,2048,1536,bf16,NVIDIA GeForce RTX 4060,c11,32,128,32,4,2,8,0.0,0.0,148.47999811172485,211.4252880215643,2.7118345172460243,3,-1,-1,llm8_g3,0,
2026-03-03T03:13:29.528316+00:00,BUCKET,llm_style,eval,llm_style_eval_231,4,1024,8192,bf16,NVIDIA GeForce RTX 4060,c04,64,64,64,4,3,8,0.0,0.0,388.09600472450256,434.82112169265747,0.1729182036997225,7,-1,-1,llm8_g7,0,
2026-03-03T03:13:29.556938+00:00,BUCKET,llm_style,eval,llm_style_eval_232,16,3072,1536,bf16,NVIDIA GeForce RTX 4060,c04,64,64,64,4,3,8,0.0,0.0,153.60000729560852,182.45632201433176,0.9830399533081077,7,-1,-1,llm8_g7,0,
2026-03-03T03:13:29.618826+00:00,BUCKET,llm_style,eval,llm_style_eval_233,64,3072,3072,bf16,NVIDIA GeForce RTX 4060,c11,32,128,32,4,2,8,0.0,0.0,260.09601354599,356.83327734470345,4.6442832226892605,3,-1,-1,llm8_g3,0,
2026-03-03T03:13:29.796695+00:00,BUCKET,llm_style,eval,llm_style_eval_234,32,8192,4096,bf16,NVIDIA GeForce RTX 4060,c11,32,128,32,4,2,8,0.0,0.0,531.4559936523438,571.5968000888824,4.040755346913621,1,-1,-1,llm8_g1,0,
2026-03-03T03:13:29.812688+00:00,BUCKET,llm_style,eval,llm_style_eval_235,4,2048,1024,bf16,NVIDIA GeForce RTX 4060,c04,64,64,64,4,3,8,0.0,0.0,111.61600053310394,194.30399492382998,0.15031192588757994,7,-1,-1,llm8_g7,0,
2026-03-03T03:13:29.946282+00:00,BUCKET,llm_style,eval,llm_style_eval_236,4,8192,3072,bf16,NVIDIA GeForce RTX 4060,c11,32,128,32,4,2,8,0.0,0.0,411.00800037384033,451.1542350053787,0.4898361876578545,4,-1,-1,llm8_g4,0,
2026-03-03T03:13:29.981991+00:00,BUCKET,llm_style,eval,llm_style_eval_237,64,1024,4096,bf16,NVIDIA GeForce RTX 4060,c11,32,128,32,4,2,8,0.0,0.0,297.92000353336334,364.70784425735474,1.8020639958131481,3,-1,-1,llm8_g3,0,
2026-03-03T03:13:30.065140+00:00,BUCKET,llm_style,eval,llm_style_eval_238,32,2048,6144,bf16,NVIDIA GeForce RTX 4060,c11,32,128,32,4,2,8,0.0,0.0,457.72799849510193,512.2508656978606,1.7593557104823194,3,-1,-1,llm8_g3,0,
2026-03-03T03:13:30.093892+00:00,BUCKET,llm_style,eval,llm_style_eval_239,32,2048,6144,bf16,NVIDIA GeForce RTX 4060,c11,32,128,32,4,2,8,0.0,0.0,456.7039906978607,499.70176130533207,1.7633004843453675,3,-1,-1,llm8_g3,0,
2026-03-03T03:13:30.166027+00:00,BUCKET,llm_style,eval,llm_style_eval_240,8,8192,1536,bf16,NVIDIA GeForce RTX 4060,c11,32,128,32,4,2,8,0.0,0.0,242.0320063829422,397.4499332904814,0.8318180517061936,4,-1,-1,llm8_g4,0,
2026-03-03T03:13:30.182131+00:00,BUCKET,llm_style,eval,llm_style_eval_241,16,1536,1536,bf16,NVIDIA GeForce RTX 4060,c04,64,64,64,4,3,8,0.0,0.0,99.27999973297119,167.61855334043497,0.7604499617552583,7,-1,-1,llm8_g7,0,
2026-03-03T03:13:30.218935+00:00,BUCKET,llm_style,eval,llm_style_eval_242,1,2048,3072,bf16,NVIDIA GeForce RTX 4060,c04,64,64,64,4,3,8,0.0,0.0,267.2640085220337,289.1222470998764,0.04708045826889798,7,-1,-1,llm8_g7,0,
2026-03-03T03:13:30.269381+00:00,BUCKET,llm_style,eval,llm_style_eval_243,8,1536,6144,bf16,NVIDIA GeForce RTX 4060,c04,64,64,64,4,3,8,0.0,0.0,293.2319939136505,414.5459151268005,0.5149333876727797,7,-1,-1,llm8_g7,0,
2026-03-03T03:13:30.320983+00:00,BUCKET,llm_style,eval,llm_style_eval_244,32,8192,1024,bf16,NVIDIA GeForce RTX 4060,c11,32,128,32,4,2,8,0.0,0.0,168.96000504493713,250.705926567316,3.177502935426713,0,-1,-1,llm8_g0,0,
2026-03-03T03:13:30.451765+00:00,BUCKET,llm_style,eval,llm_style_eval_245,4,6144,4096,bf16,NVIDIA GeForce RTX 4060,c11,32,128,32,4,2,8,0.0,0.0,366.5919899940491,442.0812878012656,0.5491843725316207,5,-1,-1,llm8_g5,0,
2026-03-03T03:13:30.536909+00:00,BUCKET,llm_style,eval,llm_style_eval_246,32,2048,6144,bf16,NVIDIA GeForce RTX 4060,c11,32,128,32,4,2,8,0.0,0.0,447.488009929657,528.9472037553787,1.7996155207076732,3,-1,-1,llm8_g3,0,
2026-03-03T03:13:30.618439+00:00,BUCKET,llm_style,eval,llm_style_eval_247,64,6144,2048,bf16,NVIDIA GeForce RTX 4060,c11,32,128,32,4,2,8,0.0,0.0,356.7200005054474,514.6182453632355,4.515061487210905,0,-1,-1,llm8_g0,0,
2026-03-03T03:13:30.630367+00:00,BUCKET,llm_style,eval,llm_style_eval_248,64,1024,1024,bf16,NVIDIA GeForce RTX 4060,c11,32,128,32,4,2,8,0.0,0.0,98.24000298976898,175.78879565000528,1.3662227597242425,3,-1,-1,llm8_g3,0,
2026-03-03T03:13:30.678915+00:00,BUCKET,llm_style,eval,llm_style_eval_249,2,8192,1024,bf16,NVIDIA GeForce RTX 4060,c11,32,128,32,4,2,8,0.0,0.0,165.3760001063347,276.18657082319254,0.20289783268687672,4,-1,-1,llm8_g4,0,
2026-03-03T03:13:30.737954+00:00,BUCKET,llm_style,eval,llm_style_eval_250,64,3072,3072,bf16,NVIDIA GeForce RTX 4060,c11,32,128,32,4,2,8,0.0,0.0,249.85599517822266,284.5881554484367,4.834623044119317,3,-1,-1,llm8_g3,0,
2026-03-03T03:13:30.813714+00:00,BUCKET,llm_style,eval,llm_style_eval_251,64,1024,8192,bf16,NVIDIA GeForce RTX 4060,c11,32,128,32,4,2,8,0.0,0.0,551.9359707832336,671.7644691467285,1.945410121533281,3,-1,-1,llm8_g3,0,
2026-03-03T03:13:30.905339+00:00,BUCKET,llm_style,eval,llm_style_eval_252,64,4096,3072,bf16,NVIDIA GeForce RTX 4060,c11,32,128,32,4,2,8,0.0,0.0,419.840008020401,544.8499256372452,3.836253585250829,3,-1,-1,llm8_g3,0,
2026-03-03T03:13:31.044272+00:00,BUCKET,llm_style,eval,llm_style_eval_253,8,6144,4096,bf16,NVIDIA GeForce RTX 4060,c11,32,128,32,4,2,8,0.0,0.0,366.5919899940491,460.30847936868656,1.0983687450632413,5,-1,-1,llm8_g5,0,
2026-03-03T03:13:31.070684+00:00,BUCKET,llm_style,eval,llm_style_eval_254,4,1536,3072,bf16,NVIDIA GeForce RTX 4060,c04,64,64,64,4,3,8,0.0,0.0,160.5919972062111,215.0809583067894,0.23505988253902865,7,-1,-1,llm8_g7,0,
2026-03-03T03:13:31.096489+00:00,BUCKET,llm_style,eval,llm_style_eval_255,1,3072,1536,bf16,NVIDIA GeForce RTX 4060,c04,64,64,64,4,3,8,0.0,0.0,150.52799880504608,235.60192525386807,0.0626938780487105,7,-1,-1,llm8_g7,0,
