results/llm_full_vs_bucket.csv
timestamp,method,workload,split,shape_id,M,N,K,dtype,gpu,config_id,BLOCK_M,BLOCK_N,BLOCK_K,num_warps,num_stages,GROUP_M,compile_time_ms,tune_time_ms,runtime_cost_us,p99_us,runtime_perf_tflops,bucket_m,bucket_n,bucket_k,cache_key,invalid_config,notes
2026-03-03T02:12:31.790149+00:00,FULL,llm_style,tune,llm_style_tune_000,4,2048,2048,bf16,NVIDIA GeForce RTX 4060,c02,32,64,32,2,2,8,1.8837269162759185,1405.002,54.27199974656105,155.57759657502166,0.6182641538305611,2,-1,-1,4x2048x2048,0,
2026-03-03T02:12:31.969285+00:00,FULL,llm_style,tune,llm_style_tune_001,32,6144,1536,bf16,NVIDIA GeForce RTX 4060,c02,32,64,32,2,2,8,0.0,179.1,58.01599845290184,88.68864022195336,10.41057280933153,6,-1,-1,32x6144x1536,0,
2026-03-03T02:12:32.378371+00:00,FULL,llm_style,tune,llm_style_tune_002,4,8192,4096,bf16,NVIDIA GeForce RTX 4060,c11,32,128,32,4,2,8,0.0,409.045,294.40000653266907,402.8006345033645,0.9118051971585545,2,-1,-1,4x8192x4096,0,
2026-03-03T02:12:32.464726+00:00,FULL,llm_style,tune,llm_style_tune_003,2,1536,1536,bf16,NVIDIA GeForce RTX 4060,c00,32,32,32,2,2,8,0.0,86.313,42.49599948525429,111.92800417542452,0.2220722918465446,6,-1,-1,2x1536x1536,0,
2026-03-03T02:12:32.543752+00:00,FULL,llm_style,tune,llm_style_tune_004,16,1536,1536,bf16,NVIDIA GeForce RTX 4060,c11,32,128,32,4,2,8,0.0,78.982,44.015999883413315,62.96448033303022,1.7152279216642297,7,-1,-1,16x1536x1536,0,
2026-03-03T02:12:32.816808+00:00,FULL,llm_style,tune,llm_style_tune_005,16,3072,6144,bf16,NVIDIA GeForce RTX 4060,c04,64,64,64,4,3,8,0.0,273.013,180.16000092029572,256.7305643856525,3.3524632155569627,2,-1,-1,16x3072x6144,0,
2026-03-03T02:12:32.879746+00:00,FULL,llm_style,tune,llm_style_tune_006,16,1536,1024,bf16,NVIDIA GeForce RTX 4060,c04,64,64,64,4,3,8,0.0,62.888,38.91199827194214,48.7177600339055,1.2934737416528952,6,-1,-1,16x1536x1024,0,
2026-03-03T02:12:32.945280+00:00,FULL,llm_style,tune,llm_style_tune_007,64,2048,1536,bf16,NVIDIA GeForce RTX 4060,c11,32,128,32,4,2,8,0.0,65.492,46.08000069856644,110.61248019337654,8.738133200864441,4,-1,-1,64x2048x1536,0,
2026-03-03T02:12:33.356779+00:00,FULL,llm_style,tune,llm_style_tune_008,2,8192,4096,bf16,NVIDIA GeForce RTX 4060,c11,32,128,32,4,2,8,0.0,411.455,295.6319898366928,353.8576000928879,0.4540027216748158,2,-1,-1,2x8192x4096,0,
2026-03-03T02:12:33.927704+00:00,FULL,llm_style,tune,llm_style_tune_009,4,8192,6144,bf16,NVIDIA GeForce RTX 4060,c11,32,128,32,4,2,8,0.0,570.884,426.9600063562393,500.58880507946,0.9430700253082752,2,-1,-1,4x8192x6144,0,
2026-03-03T02:12:34.157538+00:00,FULL,llm_style,tune,llm_style_tune_010,2,3072,6144,bf16,NVIDIA GeForce RTX 4060,c10,64,128,64,8,3,8,0.0,229.791,176.84800177812576,186.2867222726345,0.4269059940791384,2,-1,-1,2x3072x6144,0,
2026-03-03T02:12:34.393643+00:00,FULL,llm_style,tune,llm_style_tune_011,32,6144,3072,bf16,NVIDIA GeForce RTX 4060,c11,32,128,32,4,2,8,0.0,236.06,179.19999361038208,210.6908781826496,6.740845954639678,2,-1,-1,32x6144x3072,0,
2026-03-03T02:12:34.510388+00:00,FULL,llm_style,tune,llm_style_tune_012,8,6144,1024,bf16,NVIDIA GeForce RTX 4060,c00,32,32,32,2,2,8,0.0,116.702,50.175998359918594,710.7606470584853,2.0062041472085883,6,-1,-1,8x6144x1024,0,
2026-03-03T02:12:34.638899+00:00,FULL,llm_style,tune,llm_style_tune_013,16,4096,2048,bf16,NVIDIA GeForce RTX 4060,c02,32,64,32,2,2,8,0.0,128.467,56.01599998772144,148.80416080355636,4.792121109305204,2,-1,-1,16x4096x2048,0,
2026-03-03T02:12:34.878580+00:00,FULL,llm_style,tune,llm_style_tune_014,8,8192,2048,bf16,NVIDIA GeForce RTX 4060,c11,32,128,32,4,2,8,0.0,239.636,162.6719981431961,255.52767574787129,1.6501638823155227,2,-1,-1,8x8192x2048,0,
2026-03-03T02:12:35.041983+00:00,FULL,llm_style,tune,llm_style_tune_015,16,1536,6144,bf16,NVIDIA GeForce RTX 4060,c00,32,32,32,2,2,8,0.0,163.359,54.27199974656105,187.86335572600365,5.56437738447505,2,-1,-1,16x1536x6144,0,
2026-03-03T02:12:35.108565+00:00,FULL,llm_style,tune,llm_style_tune_016,64,1536,1024,bf16,NVIDIA GeForce RTX 4060,c04,64,64,64,4,3,8,0.0,66.539,41.96799919009209,81.69279884546988,4.797145346102886,6,-1,-1,64x1536x1024,0,
2026-03-03T02:12:35.174549+00:00,FULL,llm_style,tune,llm_style_tune_017,64,1536,1536,bf16,NVIDIA GeForce RTX 4060,c04,64,64,64,4,3,8,0.0,65.948,42.927999049425125,51.177600063383565,7.034800006688038,4,-1,-1,64x1536x1536,0,
2026-03-03T02:12:35.275827+00:00,FULL,llm_style,tune,llm_style_tune_018,2,8192,1024,bf16,NVIDIA GeForce RTX 4060,c00,32,32,32,2,2,8,0.0,101.238,47.58399911224842,123.83040018379688,0.7051620844403319,6,-1,-1,2x8192x1024,0,
2026-03-03T02:12:35.435193+00:00,FULL,llm_style,tune,llm_style_tune_019,64,1024,8192,bf16,NVIDIA GeForce RTX 4060,c00,32,32,32,2,2,8,0.0,159.322,76.57600194215775,202.38400533795357,14.021910216872628,7,-1,-1,64x1024x8192,0,
2026-03-03T02:12:35.543323+00:00,FULL,llm_style,tune,llm_style_tune_020,1,2048,2048,bf16,NVIDIA GeForce RTX 4060,c00,32,32,32,2,2,8,0.0,108.084,46.76799848675728,118.46240296959874,0.17936641018270855,2,-1,-1,1x2048x2048,0,
2026-03-03T02:12:36.124692+00:00,FULL,llm_style,tune,llm_style_tune_021,64,6144,8192,bf16,NVIDIA GeForce RTX 4060,c06,64,128,32,4,3,8,0.0,581.333,432.97599256038666,523.3459407091141,14.879464577014579,7,-1,-1,64x6144x8192,0,
2026-03-03T02:12:36.431565+00:00,FULL,llm_style,tune,llm_style_tune_022,2,4096,6144,bf16,NVIDIA GeForce RTX 4060,c00,32,32,32,2,2,8,0.0,306.832,226.27199441194534,233.904639929533,0.44487739749504673,2,-1,-1,2x4096x6144,0,
2026-03-03T02:12:36.557321+00:00,FULL,llm_style,tune,llm_style_tune_023,64,8192,1024,bf16,NVIDIA GeForce RTX 4060,c06,64,128,32,4,3,8,0.0,125.712,65.32799825072289,87.640640437603,16.436166004644395,6,-1,-1,64x8192x1024,0,
2026-03-03T02:12:36.622377+00:00,FULL,llm_style,tune,llm_style_tune_024,8,1024,2048,bf16,NVIDIA GeForce RTX 4060,c00,32,32,32,2,2,8,0.0,65.01,43.95199939608574,1170.15898186713,0.7634335743776943,2,-1,-1,8x1024x2048,0,
2026-03-03T02:12:36.645596+00:00,FULL,llm_style,tune,llm_style_tune_025,4,2048,2048,bf16,NVIDIA GeForce RTX 4060,c02,32,64,32,2,2,8,0.0,0.0,75.6320022046566,254.73888218402834,0.4436538901773789,2,-1,-1,4x2048x2048,0,
2026-03-03T02:12:36.704313+00:00,FULL,llm_style,tune,llm_style_tune_026,4,3072,1024,bf16,NVIDIA GeForce RTX 4060,c11,32,128,32,4,2,8,0.0,58.666,37.90399990975857,44.036799892783165,0.6639358394869809,6,-1,-1,4x3072x1024,0,
2026-03-03T02:12:36.770726+00:00,FULL,llm_style,tune,llm_style_tune_027,16,3072,1536,bf16,NVIDIA GeForce RTX 4060,c00,32,32,32,2,2,8,0.0,66.368,37.82400116324425,59.516480416059444,3.9920404863653203,7,-1,-1,16x3072x1536,0,
2026-03-03T02:12:36.868453+00:00,FULL,llm_style,tune,llm_style_tune_028,64,6144,1024,bf16,NVIDIA GeForce RTX 4060,c06,64,128,32,4,3,8,0.0,97.68,53.247999399900436,61.85215946286916,15.123692478134789,6,-1,-1,64x6144x1024,0,
2026-03-03T02:12:36.985591+00:00,FULL,llm_style,tune,llm_style_tune_029,64,2048,4096,bf16,NVIDIA GeForce RTX 4060,c03,64,64,32,4,2,8,0.0,117.092,76.80000364780426,97.84319952130318,13.981012669270863,3,-1,-1,64x2048x4096,0,
2026-03-03T02:12:37.220826+00:00,FULL,llm_style,tune,llm_style_tune_030,1,8192,2048,bf16,NVIDIA GeForce RTX 4060,c10,64,128,64,8,3,8,0.0,235.189,162.52800077199936,170.98368525505066,0.20645323784589878,2,-1,-1,1x8192x2048,0,
2026-03-03T02:12:37.275520+00:00,FULL,llm_style,tune,llm_style_tune_031,64,1024,8192,bf16,NVIDIA GeForce RTX 4060,c00,32,32,32,2,2,8,0.0,0.0,75.77600330114365,157.88159430027005,14.169945328639345,7,-1,-1,64x1024x8192,0,
2026-03-03T02:12:37.578684+00:00,FULL,llm_style,tune,llm_style_tune_032,4,6144,4096,bf16,NVIDIA GeForce RTX 4060,c00,32,32,32,2,2,8,0.0,303.103,226.30399465560913,251.98592349886894,0.8896289802854788,2,-1,-1,4x6144x4096,0,
2026-03-03T02:12:37.683343+00:00,FULL,llm_style,tune,llm_style_tune_033,1,4096,1024,bf16,NVIDIA GeForce RTX 4060,c11,32,128,32,4,2,8,0.0,104.613,62.463998794555664,74.35871936380862,0.1342950845588699,1,-1,-1,1x4096x1024,0,
2026-03-03T02:12:38.084309+00:00,FULL,llm_style,tune,llm_style_tune_034,4,4096,8192,bf16,NVIDIA GeForce RTX 4060,c00,32,32,32,2,2,8,0.0,400.923,291.7119860649109,327.0246389508247,0.9202071523391862,2,-1,-1,4x4096x8192,0,
2026-03-03T02:12:38.164983+00:00,FULL,llm_style,tune,llm_style_tune_035,32,1024,3072,bf16,NVIDIA GeForce RTX 4060,c04,64,64,64,4,3,8,0.0,80.629,50.175998359918594,78.11072029173368,4.012408294417177,2,-1,-1,32x1024x3072,0,
2026-03-03T02:12:38.226277+00:00,FULL,llm_style,tune,llm_style_tune_036,16,2048,1536,bf16,NVIDIA GeForce RTX 4060,c00,32,32,32,2,2,8,0.0,61.251,38.91199827194214,83.1836817413567,2.5869474833057904,7,-1,-1,16x2048x1536,0,
2026-03-03T02:12:38.447134+00:00,FULL,llm_style,tune,llm_style_tune_037,1,2048,8192,bf16,NVIDIA GeForce RTX 4060,c04,64,64,64,4,3,8,0.0,220.807,160.76800227165222,174.59008291363716,0.2087133728470579,0,-1,-1,1x2048x8192,0,
2026-03-03T02:12:38.570538+00:00,FULL,llm_style,tune,llm_style_tune_038,64,3072,2048,bf16,NVIDIA GeForce RTX 4060,c00,32,32,32,2,2,8,0.0,123.359,66.47999957203865,124.31359723210326,12.1135134353808,3,-1,-1,64x3072x2048,0,
2026-03-03T02:12:38.690323+00:00,FULL,llm_style,tune,llm_style_tune_039,64,1536,3072,bf16,NVIDIA GeForce RTX 4060,c00,32,32,32,2,2,8,0.0,119.678,70.12800127267838,798.3388996124243,8.61253372460379,3,-1,-1,64x1536x3072,0,
2026-03-03T02:12:39.003800+00:00,FULL,llm_style,tune,llm_style_tune_040,8,8192,3072,bf16,NVIDIA GeForce RTX 4060,c11,32,128,32,4,2,8,0.0,313.436,227.32800245285034,251.77247822284698,1.7712432241316751,2,-1,-1,8x8192x3072,0,
2026-03-03T02:12:39.093868+00:00,FULL,llm_style,tune,llm_style_tune_041,2,1024,4096,bf16,NVIDIA GeForce RTX 4060,c00,32,32,32,2,2,8,0.0,90.016,57.34400078654289,84.29567858576769,0.29257142455845464,2,-1,-1,2x1024x4096,0,
2026-03-03T02:12:39.224031+00:00,FULL,llm_style,tune,llm_style_tune_042,64,1536,6144,bf16,NVIDIA GeForce RTX 4060,c04,64,64,64,4,3,8,0.0,130.117,71.68000191450119,74.75200295448303,16.85211383561116,5,-1,-1,64x1536x6144,0,
2026-03-03T02:12:39.255319+00:00,FULL,llm_style,tune,llm_style_tune_043,16,3072,1536,bf16,NVIDIA GeForce RTX 4060,c00,32,32,32,2,2,8,0.0,0.0,23.535999469459057,280.4944038391108,6.415488927756609,7,-1,-1,16x3072x1536,0,
2026-03-03T02:12:39.323670+00:00,FULL,llm_style,tune,llm_style_tune_044,8,4096,1024,bf16,NVIDIA GeForce RTX 4060,c02,32,64,32,2,2,8,0.0,68.302,39.99999910593033,91.15904271602615,1.677721637500001,6,-1,-1,8x4096x1024,0,
2026-03-03T02:12:39.471544+00:00,FULL,llm_style,tune,llm_style_tune_045,32,3072,4096,bf16,NVIDIA GeForce RTX 4060,c04,64,64,64,4,3,8,0.0,147.827,79.96799796819687,91.67872123420238,10.070357998961896,2,-1,-1,32x3072x4096,0,
2026-03-03T02:12:39.704357+00:00,FULL,llm_style,tune,llm_style_tune_046,64,4096,4096,bf16,NVIDIA GeForce RTX 4060,c00,32,32,32,2,2,8,0.0,232.766,165.53599387407303,260.10624215006817,12.972910590271015,3,-1,-1,64x4096x4096,0,
2026-03-03T02:12:39.876162+00:00,FULL,llm_style,tune,llm_style_tune_047,4,4096,8192,bf16,NVIDIA GeForce RTX 4060,c00,32,32,32,2,2,8,0.0,0.0,292.86399483680725,310.82335978746414,0.9165874287468502,2,-1,-1,4x4096x8192,0,
2026-03-03T02:12:40.095843+00:00,FULL,llm_style,tune,llm_style_tune_048,2,4096,4096,bf16,NVIDIA GeForce RTX 4060,c03,64,64,32,4,2,8,0.0,219.623,159.743994474411,229.1910485923288,0.4201025786340281,2,-1,-1,2x4096x4096,0,
2026-03-03T02:12:40.183601+00:00,FULL,llm_style,tune,llm_style_tune_049,2,3072,2048,bf16,NVIDIA GeForce RTX 4060,c00,32,32,32,2,2,8,0.0,87.712,49.15200173854828,870.6748521327945,0.5119999818901227,2,-1,-1,2x3072x2048,0,
2026-03-03T02:12:40.277746+00:00,FULL,llm_style,tune,llm_style_tune_050,4,8192,1024,bf16,NVIDIA GeForce RTX 4060,c00,32,32,32,2,2,8,0.0,94.102,48.3039990067482,133.12960013747215,1.3893024465867663,6,-1,-1,4x8192x1024,0,
2026-03-03T02:12:40.675318+00:00,FULL,llm_style,tune,llm_style_tune_051,1,8192,4096,bf16,NVIDIA GeForce RTX 4060,c02,32,64,32,2,2,8,0.0,397.531,293.7600016593933,304.81055945158005,0.2284479289927663,2,-1,-1,1x8192x4096,0,
2026-03-03T02:12:41.089915+00:00,FULL,llm_style,tune,llm_style_tune_052,8,4096,8192,bf16,NVIDIA GeForce RTX 4060,c03,64,64,32,4,2,8,0.0,414.552,293.88800263404846,304.18944627046585,1.8267874400729303,2,-1,-1,8x4096x8192,0,
2026-03-03T02:12:41.196405+00:00,FULL,llm_style,tune,llm_style_tune_053,64,4096,1024,bf16,NVIDIA GeForce RTX 4060,c11,32,128,32,4,2,8,0.0,106.446,48.1599997729063,117.96447720378615,11.14765187980817,6,-1,-1,64x4096x1024,0,
2026-03-03T02:12:41.260995+00:00,FULL,llm_style,tune,llm_style_tune_054,1,2048,1536,bf16,NVIDIA GeForce RTX 4060,c00,32,32,32,2,2,8,0.0,64.546,37.96800039708614,122.97855921089644,0.1657041702012529,1,-1,-1,1x2048x1536,0,
2026-03-03T02:12:41.424345+00:00,FULL,llm_style,tune,llm_style_tune_055,64,6144,2048,bf16,NVIDIA GeForce RTX 4060,c03,64,64,32,4,2,8,0.0,163.306,95.23200243711472,110.71488022804257,16.91251569621828,3,-1,-1,64x6144x2048,0,
2026-03-03T02:12:41.528156+00:00,FULL,llm_style,tune,llm_style_tune_056,16,1536,4096,bf16,NVIDIA GeForce RTX 4060,c04,64,64,64,4,3,8,0.0,103.762,56.832000613212585,90.84287762641904,3.5424864482633502,2,-1,-1,16x1536x4096,0,
2026-03-03T02:12:41.775105+00:00,FULL,llm_style,tune,llm_style_tune_057,16,4096,4096,bf16,NVIDIA GeForce RTX 4060,c11,32,128,32,4,2,8,0.0,246.901,161.79199516773224,169.50080141425133,3.3182785801202197,2,-1,-1,16x4096x4096,0,
2026-03-03T02:12:42.087858+00:00,FULL,llm_style,tune,llm_style_tune_058,1,3072,8192,bf16,NVIDIA GeForce RTX 4060,c06,64,128,32,4,3,8,0.0,312.707,227.32800245285034,272.22592711448664,0.2214054030164594,0,-1,-1,1x3072x8192,0,
2026-03-03T02:12:42.137625+00:00,FULL,llm_style,tune,llm_style_tune_059,64,1024,8192,bf16,NVIDIA GeForce RTX 4060,c00,32,32,32,2,2,8,0.0,0.0,99.21600297093391,194.92736116051674,10.822264471937666,7,-1,-1,64x1024x8192,0,
2026-03-03T02:12:42.258548+00:00,FULL,llm_style,tune,llm_style_tune_060,16,3072,3072,bf16,NVIDIA GeForce RTX 4060,c00,32,32,32,2,2,8,0.0,120.869,59.39200147986412,156.69536396861074,5.084689528477748,2,-1,-1,16x3072x3072,0,
2026-03-03T02:12:42.323944+00:00,FULL,llm_style,tune,llm_style_tune_061,1,1024,1536,bf16,NVIDIA GeForce RTX 4060,c00,32,32,32,2,2,8,0.0,65.356,40.33599980175495,270.6534413248295,0.07798810034363235,1,-1,-1,1x1024x1536,0,
2026-03-03T02:12:42.412664+00:00,FULL,llm_style,tune,llm_style_tune_062,32,6144,1024,bf16,NVIDIA GeForce RTX 4060,c02,32,64,32,2,2,8,0.0,88.68,46.08000069856644,163.58399942517275,8.738133200864441,6,-1,-1,32x6144x1024,0,
2026-03-03T02:12:42.497886+00:00,FULL,llm_style,tune,llm_style_tune_063,4,1536,3072,bf16,NVIDIA GeForce RTX 4060,c04,64,64,64,4,3,8,0.0,85.177,51.024001091718674,55.28511986136436,0.739823126221411,2,-1,-1,4x1536x3072,0,
2026-03-03T02:12:42.598290+00:00,FULL,llm_style,eval,llm_style_eval_000,32,8192,1024,bf16,NVIDIA GeForce RTX 4060,c11,32,128,32,4,2,8,0.0,100.358,48.128001391887665,55.20191937685013,11.155063507176793,6,-1,-1,32x8192x1024,0,
2026-03-03T02:12:42.633764+00:00,FULL,llm_style,eval,llm_style_eval_001,2,3072,2048,bf16,NVIDIA GeForce RTX 4060,c00,32,32,32,2,2,8,0.0,0.0,49.15200173854828,102.42047742009163,0.5119999818901227,2,-1,-1,2x3072x2048,0,
2026-03-03T02:12:42.699122+00:00,FULL,llm_style,eval,llm_style_eval_002,32,1536,1536,bf16,NVIDIA GeForce RTX 4060,c04,64,64,64,4,3,8,0.0,65.302,39.93599861860275,47.10400104522705,3.780923207706253,6,-1,-1,32x1536x1536,0,
2026-03-03T02:12:43.273883+00:00,FULL,llm_style,eval,llm_style_eval_003,16,8192,6144,bf16,NVIDIA GeForce RTX 4060,c04,64,64,64,4,3,8,0.0,574.715,435.2000057697296,484.6892800927161,3.7008564215235737,2,-1,-1,16x8192x6144,0,
2026-03-03T02:12:43.354138+00:00,FULL,llm_style,eval,llm_style_eval_004,2,3072,1536,bf16,NVIDIA GeForce RTX 4060,c00,32,32,32,2,2,8,0.0,80.21,41.48799926042557,720.581771731376,0.4549356039447247,6,-1,-1,2x3072x1536,0,
2026-03-03T02:12:43.680674+00:00,FULL,llm_style,eval,llm_style_eval_005,8,3072,8192,bf16,NVIDIA GeForce RTX 4060,c10,64,128,64,8,3,8,0.0,326.492,227.32800245285034,312.70560413599003,1.7712432241316751,2,-1,-1,8x3072x8192,0,
2026-03-03T02:12:43.869815+00:00,FULL,llm_style,eval,llm_style_eval_006,64,2048,6144,bf16,NVIDIA GeForce RTX 4060,c04,64,64,64,4,3,8,0.0,189.097,108.5439994931221,115.4425597190857,14.838339691933468,5,-1,-1,64x2048x6144,0,
2026-03-03T02:12:43.980622+00:00,FULL,llm_style,eval,llm_style_eval_007,8,3072,2048,bf16,NVIDIA GeForce RTX 4060,c00,32,32,32,2,2,8,0.0,110.762,48.128001391887665,231.88479974865913,2.091574407595649,2,-1,-1,8x3072x2048,0,
2026-03-03T02:12:44.068303+00:00,FULL,llm_style,eval,llm_style_eval_008,16,3072,2048,bf16,NVIDIA GeForce RTX 4060,c11,32,128,32,4,2,8,0.0,87.63,50.83199962973595,55.31648010015487,3.9606270354595097,2,-1,-1,16x3072x2048,0,
2026-03-03T02:12:44.509150+00:00,FULL,llm_style,eval,llm_style_eval_009,64,6144,6144,bf16,NVIDIA GeForce RTX 4060,c11,32,128,32,4,2,8,0.0,440.8,335.32799780368805,420.6393498182297,14.40928953039202,5,-1,-1,64x6144x6144,0,
2026-03-03T02:12:44.552807+00:00,FULL,llm_style,eval,llm_style_eval_010,64,1536,6144,bf16,NVIDIA GeForce RTX 4060,c04,64,64,64,4,3,8,0.0,0.0,73.13600182533264,106.4387182891368,16.516620020942824,5,-1,-1,64x1536x6144,0,
2026-03-03T02:12:44.961910+00:00,FULL,llm_style,eval,llm_style_eval_011,32,4096,8192,bf16,NVIDIA GeForce RTX 4060,c11,32,128,32,4,2,8,0.0,409.046,295.4239994287491,387.518731355667,7.269157726361139,2,-1,-1,32x4096x8192,0,
2026-03-03T02:12:45.023662+00:00,FULL,llm_style,eval,llm_style_eval_012,32,1536,1024,bf16,NVIDIA GeForce RTX 4060,c04,64,64,64,4,3,8,0.0,61.703,37.59999945759773,59.61728148162361,2.677215357769353,6,-1,-1,32x1536x1024,0,
2026-03-03T02:12:45.190877+00:00,FULL,llm_style,eval,llm_style_eval_013,32,2048,6144,bf16,NVIDIA GeForce RTX 4060,c00,32,32,32,2,2,8,0.0,167.165,100.35199671983719,171.20480164885515,8.024816588834353,2,-1,-1,32x2048x6144,0,
2026-03-03T02:12:45.232274+00:00,FULL,llm_style,eval,llm_style_eval_014,2,8192,1024,bf16,NVIDIA GeForce RTX 4060,c00,32,32,32,2,2,8,0.0,0.0,50.12799985706806,161.7820744216441,0.6693750418064769,6,-1,-1,2x8192x1024,0,
2026-03-03T02:12:45.307047+00:00,FULL,llm_style,eval,llm_style_eval_015,32,2048,2048,bf16,NVIDIA GeForce RTX 4060,c11,32,128,32,4,2,8,0.0,74.72,51.19999870657921,67.57536109536883,5.242880132446292,2,-1,-1,32x2048x2048,0,
2026-03-03T02:12:45.529362+00:00,FULL,llm_style,eval,llm_style_eval_016,32,4096,4096,bf16,NVIDIA GeForce RTX 4060,c11,32,128,32,4,2,8,0.0,222.267,161.74399852752686,208.51744070649136,6.638526522004229,2,-1,-1,32x4096x4096,0,
2026-03-03T02:12:46.120710+00:00,FULL,llm_style,eval,llm_style_eval_017,8,8192,6144,bf16,NVIDIA GeForce RTX 4060,c11,32,128,32,4,2,8,0.0,591.288,426.0160028934479,524.8307228088379,1.890319524455558,2,-1,-1,8x8192x6144,0,
2026-03-03T02:12:46.205246+00:00,FULL,llm_style,eval,llm_style_eval_018,8,2048,2048,bf16,NVIDIA GeForce RTX 4060,c00,32,32,32,2,2,8,0.0,84.49,50.016000866889954,114.73695769906043,1.3417478974098735,2,-1,-1,8x2048x2048,0,
2026-03-03T02:12:46.265739+00:00,FULL,llm_style,eval,llm_style_eval_019,32,3072,1024,bf16,NVIDIA GeForce RTX 4060,c11,32,128,32,4,2,8,0.0,60.448,40.95999896526337,48.617601320147514,4.9152001241684,6,-1,-1,32x3072x1024,0,
2026-03-03T02:12:46.289154+00:00,FULL,llm_style,eval,llm_style_eval_020,64,1536,3072,bf16,NVIDIA GeForce RTX 4060,c00,32,32,32,2,2,8,0.0,0.0,65.96799939870834,123.40224042534808,9.155647912703351,3,-1,-1,64x1536x3072,0,
2026-03-03T02:12:46.318226+00:00,FULL,llm_style,eval,llm_style_eval_021,64,6144,1024,bf16,NVIDIA GeForce RTX 4060,c06,64,128,32,4,3,8,0.0,0.0,60.416001826524734,116.00895792245848,13.329355529224086,6,-1,-1,64x6144x1024,0,
2026-03-03T02:12:46.359854+00:00,FULL,llm_style,eval,llm_style_eval_022,32,6144,1536,bf16,NVIDIA GeForce RTX 4060,c02,32,64,32,2,2,8,0.0,0.0,55.296000093221664,105.60512199997889,10.922666648252513,6,-1,-1,32x6144x1536,0,
2026-03-03T02:12:46.456149+00:00,FULL,llm_style,eval,llm_style_eval_023,8,1024,4096,bf16,NVIDIA GeForce RTX 4060,c04,64,64,64,4,3,8,0.0,96.233,59.39200147986412,75.39711937308309,1.1299310063283885,2,-1,-1,8x1024x4096,0,
2026-03-03T02:12:47.214513+00:00,FULL,llm_style,eval,llm_style_eval_024,64,8192,8192,bf16,NVIDIA GeForce RTX 4060,c04,64,64,64,4,3,8,0.0,758.32,576.335996389389,727.7987170219419,14.904386756707792,7,-1,-1,64x8192x8192,0,
2026-03-03T02:12:47.431346+00:00,FULL,llm_style,eval,llm_style_eval_025,2,8192,2048,bf16,NVIDIA GeForce RTX 4060,c11,32,128,32,4,2,8,0.0,216.789,159.743994474411,205.1891148090362,0.4201025786340281,2,-1,-1,2x8192x2048,0,
2026-03-03T02:12:47.505936+00:00,FULL,llm_style,eval,llm_style_eval_026,32,4096,1024,bf16,NVIDIA GeForce RTX 4060,c11,32,128,32,4,2,8,0.0,74.548,41.74400120973587,46.622720882296555,6.430515720122041,6,-1,-1,32x4096x1024,0,
2026-03-03T02:12:47.590896+00:00,FULL,llm_style,eval,llm_style_eval_027,8,4096,1536,bf16,NVIDIA GeForce RTX 4060,c00,32,32,32,2,2,8,0.0,84.916,43.5199998319149,105.5840019136667,2.3130353030511666,6,-1,-1,8x4096x1536,0,
2026-03-03T02:12:47.611188+00:00,FULL,llm_style,eval,llm_style_eval_028,2,1536,1536,bf16,NVIDIA GeForce RTX 4060,c00,32,32,32,2,2,8,0.0,0.0,54.03200164437294,138.70559349656102,0.1746591596238378,6,-1,-1,2x1536x1536,0,
2026-03-03T02:12:47.921211+00:00,FULL,llm_style,eval,llm_style_eval_029,16,3072,8192,bf16,NVIDIA GeForce RTX 4060,c10,64,128,64,8,3,8,0.0,309.976,226.17599368095398,243.46816495060915,3.560529810851513,2,-1,-1,16x3072x8192,0,
2026-03-03T02:12:47.940767+00:00,FULL,llm_style,eval,llm_style_eval_030,2,1536,1536,bf16,NVIDIA GeForce RTX 4060,c00,32,32,32,2,2,8,0.0,0.0,52.22399905323982,157.1657532453537,0.180705885628928,6,-1,-1,2x1536x1536,0,
2026-03-03T02:12:48.048803+00:00,FULL,llm_style,eval,llm_style_eval_031,64,4096,2048,bf16,NVIDIA GeForce RTX 4060,c04,64,64,64,4,3,8,0.0,107.988,66.8959990143776,106.85503900051111,16.05091245844503,3,-1,-1,64x4096x2048,0,
2026-03-03T02:12:48.451519+00:00,FULL,llm_style,eval,llm_style_eval_032,64,8192,4096,bf16,NVIDIA GeForce RTX 4060,c10,64,128,64,8,3,8,0.0,402.666,302.5600016117096,383.4720021486281,14.195423298258529,3,-1,-1,64x8192x4096,0,
2026-03-03T02:12:48.606388+00:00,FULL,llm_style,eval,llm_style_eval_033,32,4096,3072,bf16,NVIDIA GeForce RTX 4060,c00,32,32,32,2,2,8,0.0,154.821,76.80000364780426,247.6463922113174,10.485759501953149,2,-1,-1,32x4096x3072,0,
2026-03-03T02:12:48.914264+00:00,FULL,llm_style,eval,llm_style_eval_034,64,6144,4096,bf16,NVIDIA GeForce RTX 4060,c06,64,128,32,4,3,8,0.0,307.831,233.5360050201416,257.05663800239563,13.793271284751924,3,-1,-1,64x6144x4096,0,
2026-03-03T02:12:49.161035+00:00,FULL,llm_style,eval,llm_style_eval_035,64,6144,8192,bf16,NVIDIA GeForce RTX 4060,c06,64,128,32,4,3,8,0.0,0.0,433.1519901752472,466.5011093020439,14.873418777075168,7,-1,-1,64x6144x8192,0,
2026-03-03T02:12:49.379331+00:00,FULL,llm_style,eval,llm_style_eval_036,4,8192,2048,bf16,NVIDIA GeForce RTX 4060,c10,64,128,64,8,3,8,0.0,218.243,160.76800227165222,172.95168548822403,0.8348534913882316,2,-1,-1,4x8192x2048,0,
2026-03-03T02:12:49.434322+00:00,FULL,llm_style,eval,llm_style_eval_037,64,2048,4096,bf16,NVIDIA GeForce RTX 4060,c03,64,64,32,4,2,8,0.0,0.0,76.28799974918365,139.3699181079864,14.074845683858555,3,-1,-1,64x2048x4096,0,
2026-03-03T02:12:49.481234+00:00,FULL,llm_style,eval,llm_style_eval_038,64,4096,2048,bf16,NVIDIA GeForce RTX 4060,c04,64,64,64,4,3,8,0.0,0.0,66.56000018119812,110.77023983001695,16.13193841762204,3,-1,-1,64x4096x2048,0,
2026-03-03T02:12:49.548711+00:00,FULL,llm_style,eval,llm_style_eval_039,64,6144,2048,bf16,NVIDIA GeForce RTX 4060,c03,64,64,32,4,2,8,0.0,0.0,96.25600278377533,191.08864143490788,16.73259526076519,3,-1,-1,64x6144x2048,0,
2026-03-03T02:12:49.810367+00:00,FULL,llm_style,eval,llm_style_eval_040,8,6144,3072,bf16,NVIDIA GeForce RTX 4060,c11,32,128,32,4,2,8,0.0,261.604,177.15199291706085,195.0336016714573,1.704693709776022,2,-1,-1,8x6144x3072,0,
2026-03-03T02:12:49.982882+00:00,FULL,llm_style,eval,llm_style_eval_041,2,8192,1536,bf16,NVIDIA GeForce RTX 4060,c00,32,32,32,2,2,8,0.0,172.473,65.93599915504456,168.54944109916676,0.7633409464479053,6,-1,-1,2x8192x1536,0,
2026-03-03T02:12:50.003749+00:00,FULL,llm_style,eval,llm_style_eval_042,32,1536,1536,bf16,NVIDIA GeForce RTX 4060,c04,64,64,64,4,3,8,0.0,0.0,41.4079986512661,63.79519909620279,3.6465163475217404,6,-1,-1,32x1536x1536,0,
2026-03-03T02:12:50.028843+00:00,FULL,llm_style,eval,llm_style_eval_043,64,1536,3072,bf16,NVIDIA GeForce RTX 4060,c00,32,32,32,2,2,8,0.0,0.0,66.56000018119812,143.6985640227794,9.0742153599124,3,-1,-1,64x1536x3072,0,
2026-03-03T02:12:50.084473+00:00,FULL,llm_style,eval,llm_style_eval_044,2,1536,1024,bf16,NVIDIA GeForce RTX 4060,c04,64,64,64,4,3,8,0.0,55.58,37.71200031042099,58.376320376992204,0.166829018567373,6,-1,-1,2x1536x1024,0,
2026-03-03T02:12:50.242129+00:00,FULL,llm_style,eval,llm_style_eval_045,64,4096,3072,bf16,NVIDIA GeForce RTX 4060,c04,64,64,64,4,3,8,0.0,157.609,88.92799913883209,123.80831964313973,18.11142442871736,3,-1,-1,64x4096x3072,0,
2026-03-03T02:12:50.292437+00:00,FULL,llm_style,eval,llm_style_eval_046,64,2048,4096,bf16,NVIDIA GeForce RTX 4060,c03,64,64,32,4,2,8,0.0,0.0,54.27199974656105,136.25343732535816,19.784452922577955,3,-1,-1,64x2048x4096,0,
2026-03-03T02:12:50.520051+00:00,FULL,llm_style,eval,llm_style_eval_047,2,6144,3072,bf16,NVIDIA GeForce RTX 4060,c11,32,128,32,4,2,8,0.0,227.561,176.00000649690628,251.2383991479872,0.42896289325606984,2,-1,-1,2x6144x3072,0,
2026-03-03T02:12:50.931314+00:00,FULL,llm_style,eval,llm_style_eval_048,16,4096,8192,bf16,NVIDIA GeForce RTX 4060,c03,64,64,32,4,2,8,0.0,411.218,294.8160022497177,383.3126339316367,3.642074432209787,2,-1,-1,16x4096x8192,0,
2026-03-03T02:12:51.032435+00:00,FULL,llm_style,eval,llm_style_eval_049,16,2048,3072,bf16,NVIDIA GeForce RTX 4060,c00,32,32,32,2,2,8,0.0,101.074,31.74399957060814,107.53920122981057,6.342193634176106,2,-1,-1,16x2048x3072,0,
2026-03-03T02:12:51.091702+00:00,FULL,llm_style,eval,llm_style_eval_050,16,1024,1536,bf16,NVIDIA GeForce RTX 4060,c00,32,32,32,2,2,8,0.0,59.212,39.871999993920326,140.66080264747137,1.2623306582984188,7,-1,-1,16x1024x1536,0,
2026-03-03T02:12:51.201129+00:00,FULL,llm_style,eval,llm_style_eval_051,4,2048,4096,bf16,NVIDIA GeForce RTX 4060,c00,32,32,32,2,2,8,0.0,109.376,54.60800044238567,150.26815444231028,1.2289200017642725,2,-1,-1,4x2048x4096,0,
2026-03-03T02:12:51.319022+00:00,FULL,llm_style,eval,llm_style_eval_052,4,1024,6144,bf16,NVIDIA GeForce RTX 4060,c00,32,32,32,2,2,8,0.0,117.847,68.56000050902367,170.6374411284923,0.7341255488085285,2,-1,-1,4x1024x6144,0,
2026-03-03T02:12:51.389210+00:00,FULL,llm_style,eval,llm_style_eval_053,64,6144,2048,bf16,NVIDIA GeForce RTX 4060,c03,64,64,32,4,2,8,0.0,0.0,94.72000226378441,176.8140764534473,17.00393472874533,3,-1,-1,64x6144x2048,0,
2026-03-03T02:12:51.414797+00:00,FULL,llm_style,eval,llm_style_eval_054,2,3072,2048,bf16,NVIDIA GeForce RTX 4060,c00,32,32,32,2,2,8,0.0,0.0,43.60000044107437,133.16927954554555,0.5771977923259827,2,-1,-1,2x3072x2048,0,
2026-03-03T02:12:51.464990+00:00,FULL,llm_style,eval,llm_style_eval_055,4,1024,1024,bf16,NVIDIA GeForce RTX 4060,c00,32,32,32,2,2,8,0.0,50.142,31.79199993610382,108.14879700541488,0.26385908457661006,6,-1,-1,4x1024x1024,0,
2026-03-03T02:12:51.514195+00:00,FULL,llm_style,eval,llm_style_eval_056,2,1024,1024,bf16,NVIDIA GeForce RTX 4060,c04,64,64,64,4,3,8,0.0,49.165,33.79200026392937,53.48928011953828,0.12412121115177462,6,-1,-1,2x1024x1024,0,
2026-03-03T02:12:51.624423+00:00,FULL,llm_style,eval,llm_style_eval_057,2,1024,6144,bf16,NVIDIA GeForce RTX 4060,c04,64,64,64,4,3,8,0.0,110.191,71.61600142717361,85.61791963875292,0.35139945680423323,2,-1,-1,2x1024x6144,0,
2026-03-03T02:12:51.701904+00:00,FULL,llm_style,eval,llm_style_eval_058,2,2048,1536,bf16,NVIDIA GeForce RTX 4060,c00,32,32,32,2,2,8,0.0,77.437,44.75199989974499,96.9407987594604,0.2811698254421855,6,-1,-1,2x2048x1536,0,
2026-03-03T02:12:51.975233+00:00,FULL,llm_style,eval,llm_style_eval_059,8,8192,6144,bf16,NVIDIA GeForce RTX 4060,c11,32,128,32,4,2,8,0.0,0.0,427.0080029964447,557.8627097606659,1.8859280443198274,2,-1,-1,8x8192x6144,0,
2026-03-03T02:12:52.363150+00:00,FULL,llm_style,eval,llm_style_eval_060,1,4096,8192,bf16,NVIDIA GeForce RTX 4060,c11,32,128,32,4,2,8,0.0,387.863,292.86399483680725,345.082247853279,0.22914685718671254,0,-1,-1,1x4096x8192,0,
2026-03-03T02:12:52.448341+00:00,FULL,llm_style,eval,llm_style_eval_061,32,1536,3072,bf16,NVIDIA GeForce RTX 4060,c04,64,64,64,4,3,8,0.0,85.148,49.8879998922348,55.38783859461545,6.053357293384005,2,-1,-1,32x1536x3072,0,
2026-03-03T02:12:52.473153+00:00,FULL,llm_style,eval,llm_style_eval_062,8,6144,1024,bf16,NVIDIA GeForce RTX 4060,c00,32,32,32,2,2,8,0.0,0.0,66.46399945020676,147.05216214060783,1.5145536957253758,6,-1,-1,8x6144x1024,0,
2026-03-03T02:12:52.645600+00:00,FULL,llm_style,eval,llm_style_eval_063,64,8192,4096,bf16,NVIDIA GeForce RTX 4060,c10,64,128,64,8,3,8,0.0,0.0,306.5759986639023,424.7244784235954,14.009470130466902,3,-1,-1,64x8192x4096,0,
2026-03-03T02:12:52.722580+00:00,FULL,llm_style,eval,llm_style_eval_064,16,6144,1024,bf16,NVIDIA GeForce RTX 4060,c11,32,128,32,4,2,8,0.0,76.923,40.64000025391579,48.23424000293016,4.9539023312531,6,-1,-1,16x6144x1024,0,
2026-03-03T02:12:53.110029+00:00,FULL,llm_style,eval,llm_style_eval_065,8,8192,4096,bf16,NVIDIA GeForce RTX 4060,c11,32,128,32,4,2,8,0.0,387.398,292.86399483680725,405.9136030077933,1.8331748574937003,2,-1,-1,8x8192x4096,0,
2026-03-03T02:12:53.138816+00:00,FULL,llm_style,eval,llm_style_eval_066,32,1536,3072,bf16,NVIDIA GeForce RTX 4060,c04,64,64,64,4,3,8,0.0,0.0,76.80000364780426,494.33792173862344,3.9321598132324307,2,-1,-1,32x1536x3072,0,
2026-03-03T02:12:53.259586+00:00,FULL,llm_style,eval,llm_style_eval_067,8,8192,3072,bf16,NVIDIA GeForce RTX 4060,c11,32,128,32,4,2,8,0.0,0.0,228.35199534893036,243.22304308414456,1.7633004843453675,2,-1,-1,8x8192x3072,0,
2026-03-03T02:12:53.284707+00:00,FULL,llm_style,eval,llm_style_eval_068,64,1536,3072,bf16,NVIDIA GeForce RTX 4060,c00,32,32,32,2,2,8,0.0,0.0,80.38399741053581,266.54496803879704,7.513681770705736,3,-1,-1,64x1536x3072,0,
2026-03-03T02:12:53.870733+00:00,FULL,llm_style,eval,llm_style_eval_069,64,8192,6144,bf16,NVIDIA GeForce RTX 4060,c00,32,32,32,2,2,8,0.0,585.968,441.3439929485321,468.11136215925217,14.597345940882205,5,-1,-1,64x8192x6144,0,
2026-03-03T02:12:53.982313+00:00,FULL,llm_style,eval,llm_style_eval_070,8,8192,1024,bf16,NVIDIA GeForce RTX 4060,c11,32,128,32,4,2,8,0.0,111.534,59.79199893772602,216.04992181062687,2.2447439521095314,6,-1,-1,8x8192x1024,0,
2026-03-03T02:12:54.086448+00:00,FULL,llm_style,eval,llm_style_eval_071,2,6144,3072,bf16,NVIDIA GeForce RTX 4060,c11,32,128,32,4,2,8,0.0,0.0,183.61599743366241,247.32288509607312,0.41117044840973643,2,-1,-1,2x6144x3072,0,
2026-03-03T02:12:54.143793+00:00,FULL,llm_style,eval,llm_style_eval_072,64,1024,1024,bf16,NVIDIA GeForce RTX 4060,c04,64,64,64,4,3,8,0.0,57.289,38.91199827194214,85.27071855962271,3.4492633110743878,6,-1,-1,64x1024x1024,0,
2026-03-03T02:12:54.230101+00:00,FULL,llm_style,eval,llm_style_eval_073,1,8192,2048,bf16,NVIDIA GeForce RTX 4060,c10,64,128,64,8,3,8,0.0,0.0,161.79199516773224,219.65024247765527,0.20739241125751373,2,-1,-1,1x8192x2048,0,
2026-03-03T02:12:54.285579+00:00,FULL,llm_style,eval,llm_style_eval_074,64,1024,1536,bf16,NVIDIA GeForce RTX 4060,c04,64,64,64,4,3,8,0.0,55.421,38.8799998909235,44.94623951613903,5.178153100946883,4,-1,-1,64x1024x1536,0,
2026-03-03T02:12:54.352521+00:00,FULL,llm_style,eval,llm_style_eval_075,2,1536,2048,bf16,NVIDIA GeForce RTX 4060,c04,64,64,64,4,3,8,0.0,66.891,42.927999049425125,55.83872027695178,0.29311666694533495,2,-1,-1,2x1536x2048,0,
2026-03-03T02:12:54.453012+00:00,FULL,llm_style,eval,llm_style_eval_076,64,2048,3072,bf16,NVIDIA GeForce RTX 4060,c11,32,128,32,4,2,8,0.0,100.441,65.5359998345375,75.73983892798424,12.288000031024216,3,-1,-1,64x2048x3072,0,
2026-03-03T02:12:54.584119+00:00,FULL,llm_style,eval,llm_style_eval_077,1,3072,8192,bf16,NVIDIA GeForce RTX 4060,c06,64,128,32,4,3,8,0.0,0.0,231.4240038394928,243.2511965930462,0.2174867220554536,0,-1,-1,1x3072x8192,0,
2026-03-03T02:12:54.648850+00:00,FULL,llm_style,eval,llm_style_eval_078,1,1024,2048,bf16,NVIDIA GeForce RTX 4060,c04,64,64,64,4,3,8,0.0,64.667,44.415999203920364,58.164161406457424,0.09443227834959504,2,-1,-1,1x1024x2048,0,
2026-03-03T02:12:54.719171+00:00,FULL,llm_style,eval,llm_style_eval_079,64,1536,2048,bf16,NVIDIA GeForce RTX 4060,c04,64,64,64,4,3,8,0.0,70.262,49.15200173854828,85.8895990252494,8.191999710241964,3,-1,-1,64x1536x2048,0,
2026-03-03T02:12:54.769323+00:00,FULL,llm_style,eval,llm_style_eval_080,4,1536,1024,bf16,NVIDIA GeForce RTX 4060,c00,32,32,32,2,2,8,0.0,50.095,34.81600061058998,63.520321547985034,0.36141175836757816,6,-1,-1,4x1536x1024,0,
2026-03-03T02:12:55.073657+00:00,FULL,llm_style,eval,llm_style_eval_081,4,4096,6144,bf16,NVIDIA GeForce RTX 4060,c00,32,32,32,2,2,8,0.0,304.278,226.33599489927292,273.2339265942573,0.8895032011571871,2,-1,-1,4x4096x6144,0,
2026-03-03T02:12:55.146672+00:00,FULL,llm_style,eval,llm_style_eval_082,64,1024,2048,bf16,NVIDIA GeForce RTX 4060,c04,64,64,64,4,3,8,0.0,72.961,47.47200012207031,87.63392154127348,5.654605984785569,3,-1,-1,64x1024x2048,0,
2026-03-03T02:12:55.360964+00:00,FULL,llm_style,eval,llm_style_eval_083,8,4096,4096,bf16,NVIDIA GeForce RTX 4060,c11,32,128,32,4,2,8,0.0,214.237,159.743994474411,170.52672177553177,1.6804103145361124,2,-1,-1,8x4096x4096,0,
2026-03-03T02:12:55.473073+00:00,FULL,llm_style,eval,llm_style_eval_084,64,3072,3072,bf16,NVIDIA GeForce RTX 4060,c03,64,64,32,4,2,8,0.0,112.061,64.4799992442131,73.97920072078705,18.733864239435626,3,-1,-1,64x3072x3072,0,
2026-03-03T02:12:55.597152+00:00,FULL,llm_style,eval,llm_style_eval_085,1,3072,8192,bf16,NVIDIA GeForce RTX 4060,c06,64,128,32,4,3,8,0.0,0.0,227.32800245285034,260.33568203449244,0.2214054030164594,0,-1,-1,1x3072x8192,0,
2026-03-03T02:12:55.649440+00:00,FULL,llm_style,eval,llm_style_eval_086,8,1536,1024,bf16,NVIDIA GeForce RTX 4060,c04,64,64,64,4,3,8,0.0,52.233,34.71999987959862,40.810561105608926,0.7248221223291931,6,-1,-1,8x1536x1024,0,
2026-03-03T02:12:55.722610+00:00,FULL,llm_style,eval,llm_style_eval_087,16,1024,3072,bf16,NVIDIA GeForce RTX 4060,c04,64,64,64,4,3,8,0.0,73.129,48.128001391887665,53.82335983216762,2.091574407595649,2,-1,-1,16x1024x3072,0,
2026-03-03T02:12:55.824176+00:00,FULL,llm_style,eval,llm_style_eval_088,8,8192,2048,bf16,NVIDIA GeForce RTX 4060,c11,32,128,32,4,2,8,0.0,0.0,162.73599863052368,212.32095971703518,1.6495149091717358,2,-1,-1,8x8192x2048,0,
2026-03-03T02:12:55.948710+00:00,FULL,llm_style,eval,llm_style_eval_089,64,6144,4096,bf16,NVIDIA GeForce RTX 4060,c06,64,128,32,4,3,8,0.0,0.0,234.3199998140335,382.90912836790073,13.74712134925104,3,-1,-1,64x6144x4096,0,
2026-03-03T02:12:56.083153+00:00,FULL,llm_style,eval,llm_style_eval_090,2,1536,6144,bf16,NVIDIA GeForce RTX 4060,c00,32,32,32,2,2,8,0.0,134.391,70.68800181150436,116.32639817893492,0.5340189994429358,2,-1,-1,2x1536x6144,0,
2026-03-03T02:12:56.097080+00:00,FULL,llm_style,eval,llm_style_eval_091,2,1024,1024,bf16,NVIDIA GeForce RTX 4060,c04,64,64,64,4,3,8,0.0,0.0,35.840000957250595,594.9542710185032,0.11702856830285527,6,-1,-1,2x1024x1024,0,
2026-03-03T02:12:56.310164+00:00,FULL,llm_style,eval,llm_style_eval_092,4,4096,4096,bf16,NVIDIA GeForce RTX 4060,c02,32,64,32,2,2,8,0.0,213.047,160.15999764204025,188.16415637731546,0.8380227895605894,2,-1,-1,4x4096x4096,0,
2026-03-03T02:12:56.384681+00:00,FULL,llm_style,eval,llm_style_eval_093,32,2048,1536,bf16,NVIDIA GeForce RTX 4060,c00,32,32,32,2,2,8,0.0,74.472,38.255998864769936,131.11040242016313,5.2626149616865,6,-1,-1,32x2048x1536,0,
2026-03-03T02:12:56.455805+00:00,FULL,llm_style,eval,llm_style_eval_094,2,2048,2048,bf16,NVIDIA GeForce RTX 4060,c00,32,32,32,2,2,8,0.0,71.079,44.03200000524521,127.07680199295255,0.381023255768565,2,-1,-1,2x2048x2048,0,
2026-03-03T02:12:56.872974+00:00,FULL,llm_style,eval,llm_style_eval_095,1,6144,6144,bf16,NVIDIA GeForce RTX 4060,c02,32,64,32,2,2,8,0.0,417.124,326.03199779987335,347.532793879509,0.2315646087177684,2,-1,-1,1x6144x6144,0,
2026-03-03T02:12:56.999653+00:00,FULL,llm_style,eval,llm_style_eval_096,64,1024,6144,bf16,NVIDIA GeForce RTX 4060,c04,64,64,64,4,3,8,0.0,126.631,72.67200201749802,94.36799786984916,11.081384104515212,5,-1,-1,64x1024x6144,0,
2026-03-03T02:12:57.014598+00:00,FULL,llm_style,eval,llm_style_eval_097,64,1536,2048,bf16,NVIDIA GeForce RTX 4060,c04,64,64,64,4,3,8,0.0,0.0,27.53600012511015,61.60351742058991,14.622791333909804,3,-1,-1,64x1536x2048,0,
2026-03-03T02:12:57.074971+00:00,FULL,llm_style,eval,llm_style_eval_098,32,1024,2048,bf16,NVIDIA GeForce RTX 4060,c04,64,64,64,4,3,8,0.0,60.328,41.85600019991398,67.66240131109949,3.206654418935038,2,-1,-1,32x1024x2048,0,
2026-03-03T02:12:57.174188+00:00,FULL,llm_style,eval,llm_style_eval_099,1,6144,1536,bf16,NVIDIA GeForce RTX 4060,c11,32,128,32,4,2,8,0.0,99.173,46.08000069856644,55.23487947881222,0.4095999937905207,1,-1,-1,1x6144x1536,0,
2026-03-03T02:12:57.216021+00:00,FULL,llm_style,eval,llm_style_eval_100,64,6144,1024,bf16,NVIDIA GeForce RTX 4060,c06,64,128,32,4,3,8,0.0,0.0,50.83199962973595,127.6972769945859,15.842508141838039,6,-1,-1,64x6144x1024,0,
2026-03-03T02:12:57.379785+00:00,FULL,llm_style,eval,llm_style_eval_101,64,8192,1536,bf16,NVIDIA GeForce RTX 4060,c06,64,128,32,4,3,8,0.0,163.712,109.56799983978271,209.07775521278376,14.69966357289665,4,-1,-1,64x8192x1536,0,
2026-03-03T02:12:57.418515+00:00,FULL,llm_style,eval,llm_style_eval_102,32,6144,1536,bf16,NVIDIA GeForce RTX 4060,c02,32,64,32,2,2,8,0.0,0.0,63.9679990708828,92.98208072781554,9.441905089617254,6,-1,-1,32x6144x1536,0,
2026-03-03T02:12:57.732194+00:00,FULL,llm_style,eval,llm_style_eval_103,64,4096,6144,bf16,NVIDIA GeForce RTX 4060,c11,32,128,32,4,2,8,0.0,313.623,232.5119972229004,242.72896021604538,13.854018332275276,5,-1,-1,64x4096x6144,0,
2026-03-03T02:12:57.829326+00:00,FULL,llm_style,eval,llm_style_eval_104,2,6144,3072,bf16,NVIDIA GeForce RTX 4060,c11,32,128,32,4,2,8,0.0,0.0,210.40000021457672,237.61728569865227,0.3588282886074325,2,-1,-1,2x6144x3072,0,
2026-03-03T02:12:57.987898+00:00,FULL,llm_style,eval,llm_style_eval_105,1,4096,3072,bf16,NVIDIA GeForce RTX 4060,c00,32,32,32,2,2,8,0.0,158.499,60.416001826524734,145.58207683265195,0.4165423602882527,2,-1,-1,1x4096x3072,0,
2026-03-03T02:12:58.080862+00:00,FULL,llm_style,eval,llm_style_eval_106,64,4096,1536,bf16,NVIDIA GeForce RTX 4060,c04,64,64,64,4,3,8,0.0,92.914,57.440001517534256,93.38879801332946,14.019957289767314,4,-1,-1,64x4096x1536,0,
2026-03-03T02:12:58.195250+00:00,FULL,llm_style,eval,llm_style_eval_107,64,6144,1536,bf16,NVIDIA GeForce RTX 4060,c06,64,128,32,4,3,8,0.0,114.343,64.51199948787689,69.97472003102303,18.72457157721487,4,-1,-1,64x6144x1536,0,
2026-03-03T02:12:58.300428+00:00,FULL,llm_style,eval,llm_style_eval_108,16,3072,6144,bf16,NVIDIA GeForce RTX 4060,c04,64,64,64,4,3,8,0.0,0.0,179.31199818849564,238.77984389662743,3.3683176926347493,2,-1,-1,16x3072x6144,0,
2026-03-03T02:12:58.314905+00:00,FULL,llm_style,eval,llm_style_eval_109,64,1024,2048,bf16,NVIDIA GeForce RTX 4060,c04,64,64,64,4,3,8,0.0,0.0,47.10400104522705,105.20927932113392,5.698782482240965,3,-1,-1,64x1024x2048,0,
2026-03-03T02:12:58.396794+00:00,FULL,llm_style,eval,llm_style_eval_110,16,1536,3072,bf16,NVIDIA GeForce RTX 4060,c00,32,32,32,2,2,8,0.0,81.842,48.87999966740608,130.35520307719702,3.089094620037113,2,-1,-1,16x1536x3072,0,
2026-03-03T02:12:58.594697+00:00,FULL,llm_style,eval,llm_style_eval_111,64,6144,6144,bf16,NVIDIA GeForce RTX 4060,c11,32,128,32,4,2,8,0.0,0.0,333.68000388145447,411.2691134214399,14.480454782410614,5,-1,-1,64x6144x6144,0,
2026-03-03T02:12:59.014360+00:00,FULL,llm_style,eval,llm_style_eval_112,16,6144,6144,bf16,NVIDIA GeForce RTX 4060,c06,64,128,32,4,3,8,0.0,419.607,325.6320059299469,374.1823932528495,3.7095848381066934,2,-1,-1,16x6144x6144,0,
2026-03-03T02:12:59.333089+00:00,FULL,llm_style,eval,llm_style_eval_113,1,8192,3072,bf16,NVIDIA GeForce RTX 4060,c11,32,128,32,4,2,8,0.0,318.671,228.03199291229248,240.27648404240608,0.22072187045858502,2,-1,-1,1x8192x3072,0,
2026-03-03T02:12:59.407304+00:00,FULL,llm_style,eval,llm_style_eval_114,64,3072,1024,bf16,NVIDIA GeForce RTX 4060,c03,64,64,32,4,2,8,0.0,74.166,43.007999658584595,92.60736040771006,9.362285788607435,6,-1,-1,64x3072x1024,0,
2026-03-03T02:12:59.517068+00:00,FULL,llm_style,eval,llm_style_eval_115,8,3072,3072,bf16,NVIDIA GeForce RTX 4060,c00,32,32,32,2,2,8,0.0,109.717,54.27199974656105,170.26304438710204,2.782188692237525,2,-1,-1,8x3072x3072,0,
2026-03-03T02:12:59.545850+00:00,FULL,llm_style,eval,llm_style_eval_116,16,3072,2048,bf16,NVIDIA GeForce RTX 4060,c11,32,128,32,4,2,8,0.0,0.0,61.32800132036209,166.40704274177537,3.2827841714312584,2,-1,-1,16x3072x2048,0,
2026-03-03T02:12:59.553888+00:00,FULL,llm_style,eval,llm_style_eval_117,64,1024,1024,bf16,NVIDIA GeForce RTX 4060,c04,64,64,64,4,3,8,0.0,0.0,41.7919997125864,48.870079442858696,3.211565106313349,6,-1,-1,64x1024x1024,0,
2026-03-03T02:12:59.591636+00:00,FULL,llm_style,eval,llm_style_eval_118,1,6144,1536,bf16,NVIDIA GeForce RTX 4060,c11,32,128,32,4,2,8,0.0,0.0,49.15200173854828,146.67743429541582,0.38399998641759203,1,-1,-1,1x6144x1536,0,
2026-03-03T02:12:59.603135+00:00,FULL,llm_style,eval,llm_style_eval_119,1,1024,1536,bf16,NVIDIA GeForce RTX 4060,c00,32,32,32,2,2,8,0.0,0.0,41.888000443577766,53.297281004488454,0.07509854771504855,1,-1,-1,1x1024x1536,0,
2026-03-03T02:12:59.813997+00:00,FULL,llm_style,eval,llm_style_eval_120,16,8192,2048,bf16,NVIDIA GeForce RTX 4060,c11,32,128,32,4,2,8,0.0,210.821,161.80799901485443,175.4867222905159,3.3179503811224667,2,-1,-1,16x8192x2048,0,
2026-03-03T02:12:59.848993+00:00,FULL,llm_style,eval,llm_style_eval_121,64,4096,1024,bf16,NVIDIA GeForce RTX 4060,c11,32,128,32,4,2,8,0.0,0.0,53.15199866890907,180.80448314547533,10.10067213735914,6,-1,-1,64x4096x1024,0,
2026-03-03T02:12:59.954840+00:00,FULL,llm_style,eval,llm_style_eval_122,4,6144,1024,bf16,NVIDIA GeForce RTX 4060,c11,32,128,32,4,2,8,0.0,105.796,41.98399931192398,55.40639996528623,1.198829287940303,6,-1,-1,4x6144x1024,0,
2026-03-03T02:13:00.138666+00:00,FULL,llm_style,eval,llm_style_eval_123,4,8192,4096,bf16,NVIDIA GeForce RTX 4060,c11,32,128,32,4,2,8,0.0,0.0,292.86399483680725,333.7439975142478,0.9165874287468502,2,-1,-1,4x8192x4096,0,
2026-03-03T02:13:00.436518+00:00,FULL,llm_style,eval,llm_style_eval_124,4,3072,8192,bf16,NVIDIA GeForce RTX 4060,c10,64,128,64,8,3,8,0.0,297.796,227.03999280929565,242.7228835225105,0.886745059797047,2,-1,-1,4x3072x8192,0,
2026-03-03T02:13:00.656734+00:00,FULL,llm_style,eval,llm_style_eval_125,64,8192,2048,bf16,NVIDIA GeForce RTX 4060,c00,32,32,32,2,2,8,0.0,220.168,166.9120043516159,252.3648063838482,12.865962854751436,3,-1,-1,64x8192x2048,0,
2026-03-03T02:13:00.720346+00:00,FULL,llm_style,eval,llm_style_eval_126,8,1536,1536,bf16,NVIDIA GeForce RTX 4060,c04,64,64,64,4,3,8,0.0,63.569,38.95999863743782,55.68799816071984,0.968910095487686,6,-1,-1,8x1536x1536,0,
2026-03-03T02:13:00.783224+00:00,FULL,llm_style,eval,llm_style_eval_127,64,2048,1024,bf16,NVIDIA GeForce RTX 4060,c11,32,128,32,4,2,8,0.0,62.831,42.97599941492081,70.2527999132871,6.246171343412716,6,-1,-1,64x2048x1024,0,
2026-03-03T02:13:00.845137+00:00,FULL,llm_style,eval,llm_style_eval_128,64,6144,2048,bf16,NVIDIA GeForce RTX 4060,c03,64,64,32,4,2,8,0.0,0.0,96.25600278377533,159.88736197352407,16.73259526076519,3,-1,-1,64x6144x2048,0,
2026-03-03T02:13:00.871125+00:00,FULL,llm_style,eval,llm_style_eval_129,32,6144,1024,bf16,NVIDIA GeForce RTX 4060,c02,32,64,32,2,2,8,0.0,0.0,50.175998359918594,121.29664264619348,8.024816588834353,6,-1,-1,32x6144x1024,0,
2026-03-03T02:13:00.957203+00:00,FULL,llm_style,eval,llm_style_eval_130,64,8192,2048,bf16,NVIDIA GeForce RTX 4060,c00,32,32,32,2,2,8,0.0,0.0,168.8160002231598,251.3318356871602,12.720853741121795,3,-1,-1,64x8192x2048,0,
2026-03-03T02:13:01.084081+00:00,FULL,llm_style,eval,llm_style_eval_131,64,4096,6144,bf16,NVIDIA GeForce RTX 4060,c11,32,128,32,4,2,8,0.0,0.0,237.56800591945648,443.3510404825209,13.559172075940662,5,-1,-1,64x4096x6144,0,
2026-03-03T02:13:01.225948+00:00,FULL,llm_style,eval,llm_style_eval_132,16,8192,1536,bf16,NVIDIA GeForce RTX 4060,c11,32,128,32,4,2,8,0.0,141.813,60.416001826524734,72.10880063474175,6.664677764612043,7,-1,-1,16x8192x1536,0,
2026-03-03T02:13:01.795437+00:00,FULL,llm_style,eval,llm_style_eval_133,32,8192,6144,bf16,NVIDIA GeForce RTX 4060,c11,32,128,32,4,2,8,0.0,569.445,430.07999658584595,583.9148682355878,7.489828630885948,2,-1,-1,32x8192x6144,0,
2026-03-03T02:13:02.071568+00:00,FULL,llm_style,eval,llm_style_eval_134,64,8192,6144,bf16,NVIDIA GeForce RTX 4060,c00,32,32,32,2,2,8,0.0,0.0,442.3680007457733,559.4521552324295,14.563555531003347,5,-1,-1,64x8192x6144,0,
2026-03-03T02:13:02.150966+00:00,FULL,llm_style,eval,llm_style_eval_135,4,3072,2048,bf16,NVIDIA GeForce RTX 4060,c00,32,32,32,2,2,8,0.0,79.342,41.4079986512661,103.92448112368582,1.2155054491739132,2,-1,-1,4x3072x2048,0,
2026-03-03T02:13:02.196662+00:00,FULL,llm_style,eval,llm_style_eval_136,64,3072,3072,bf16,NVIDIA GeForce RTX 4060,c03,64,64,32,4,2,8,0.0,0.0,65.43999910354614,82.37216047942636,18.459039861669886,3,-1,-1,64x3072x3072,0,
2026-03-03T02:13:02.424759+00:00,FULL,llm_style,eval,llm_style_eval_137,1,3072,6144,bf16,NVIDIA GeForce RTX 4060,c10,64,128,64,8,3,8,0.0,228.039,177.13599652051926,182.7779221534729,0.21310595667452167,2,-1,-1,1x3072x6144,0,
2026-03-03T02:13:02.521092+00:00,FULL,llm_style,eval,llm_style_eval_138,1,2048,3072,bf16,NVIDIA GeForce RTX 4060,c00,32,32,32,2,2,8,0.0,96.287,50.97600072622299,59.76736053824425,0.24683992115386014,2,-1,-1,1x2048x3072,0,
2026-03-03T02:13:02.817505+00:00,FULL,llm_style,eval,llm_style_eval_139,4,8192,3072,bf16,NVIDIA GeForce RTX 4060,c11,32,128,32,4,2,8,0.0,296.367,228.35199534893036,238.1302386522293,0.8816502421726837,2,-1,-1,4x8192x3072,0,
2026-03-03T02:13:02.841087+00:00,FULL,llm_style,eval,llm_style_eval_140,64,1024,2048,bf16,NVIDIA GeForce RTX 4060,c04,64,64,64,4,3,8,0.0,0.0,71.60000130534172,218.32895979285217,3.7490984791361086,3,-1,-1,64x1024x2048,0,
2026-03-03T02:13:03.136880+00:00,FULL,llm_style,eval,llm_style_eval_141,1,6144,4096,bf16,NVIDIA GeForce RTX 4060,c11,32,128,32,4,2,8,0.0,295.751,225.2800017595291,237.5564856827259,0.22341818007319428,2,-1,-1,1x6144x4096,0,
2026-03-03T02:13:03.219615+00:00,FULL,llm_style,eval,llm_style_eval_142,4,4096,4096,bf16,NVIDIA GeForce RTX 4060,c02,32,64,32,2,2,8,0.0,0.0,166.9120043516159,215.02976194024075,0.8041226784219647,2,-1,-1,4x4096x4096,0,
2026-03-03T02:13:03.262385+00:00,FULL,llm_style,eval,llm_style_eval_143,64,1536,6144,bf16,NVIDIA GeForce RTX 4060,c04,64,64,64,4,3,8,0.0,0.0,68.59200075268745,80.39423741400242,17.61079336868114,5,-1,-1,64x1536x6144,0,
2026-03-03T02:13:03.346931+00:00,FULL,llm_style,eval,llm_style_eval_144,1,6144,1024,bf16,NVIDIA GeForce RTX 4060,c11,32,128,32,4,2,8,0.0,84.491,40.78399948775768,65.50816010683772,0.3085257002265575,1,-1,-1,1x6144x1024,0,
2026-03-03T02:13:03.582820+00:00,FULL,llm_style,eval,llm_style_eval_145,8,3072,6144,bf16,NVIDIA GeForce RTX 4060,c06,64,128,32,4,3,8,0.0,235.844,179.07200008630753,188.87711629271507,1.6864160106239368,2,-1,-1,8x3072x6144,0,
2026-03-03T02:13:03.907402+00:00,FULL,llm_style,eval,llm_style_eval_146,64,8192,8192,bf16,NVIDIA GeForce RTX 4060,c04,64,64,64,4,3,8,0.0,0.0,578.5599946975708,695.3392142057419,14.847093941381473,7,-1,-1,64x8192x8192,0,
2026-03-03T02:13:04.045687+00:00,FULL,llm_style,eval,llm_style_eval_147,1,1024,8192,bf16,NVIDIA GeForce RTX 4060,c04,64,64,64,4,3,8,0.0,138.233,84.97599884867668,134.19519677758205,0.1974347607243368,0,-1,-1,1x1024x8192,0,
2026-03-03T02:13:04.098512+00:00,FULL,llm_style,eval,llm_style_eval_148,32,4096,1024,bf16,NVIDIA GeForce RTX 4060,c11,32,128,32,4,2,8,0.0,0.0,49.00800064206123,134.65408384799957,5.477380274305959,6,-1,-1,32x4096x1024,0,
2026-03-03T02:13:04.252248+00:00,FULL,llm_style,eval,llm_style_eval_149,64,3072,4096,bf16,NVIDIA GeForce RTX 4060,c04,64,64,64,4,3,8,0.0,153.682,87.88799867033958,158.36159765720365,18.325741402319007,3,-1,-1,64x3072x4096,0,
2026-03-03T02:13:04.339194+00:00,FULL,llm_style,eval,llm_style_eval_150,2,4096,4096,bf16,NVIDIA GeForce RTX 4060,c03,64,64,32,4,2,8,0.0,0.0,165.8879965543747,324.24959421157837,0.4045432182792266,2,-1,-1,2x4096x4096,0,
2026-03-03T02:13:04.371535+00:00,FULL,llm_style,eval,llm_style_eval_151,64,2048,3072,bf16,NVIDIA GeForce RTX 4060,c11,32,128,32,4,2,8,0.0,0.0,67.951999604702,146.79104015231133,11.851106261548132,3,-1,-1,64x2048x3072,0,
2026-03-03T02:13:04.407996+00:00,FULL,llm_style,eval,llm_style_eval_152,64,1024,8192,bf16,NVIDIA GeForce RTX 4060,c00,32,32,32,2,2,8,0.0,0.0,96.3359996676445,105.83167739212513,11.145800403840392,7,-1,-1,64x1024x8192,0,
2026-03-03T02:13:04.434121+00:00,FULL,llm_style,eval,llm_style_eval_153,64,4096,1024,bf16,NVIDIA GeForce RTX 4060,c11,32,128,32,4,2,8,0.0,0.0,38.91199827194214,69.65728111565113,13.797053244297551,6,-1,-1,64x4096x1024,0,
2026-03-03T02:13:04.474624+00:00,FULL,llm_style,eval,llm_style_eval_154,64,4096,2048,bf16,NVIDIA GeForce RTX 4060,c04,64,64,64,4,3,8,0.0,0.0,68.60800087451935,107.08991870284069,15.650387860212119,3,-1,-1,64x4096x2048,0,
2026-03-03T02:13:04.646634+00:00,FULL,llm_style,eval,llm_style_eval_155,8,4096,8192,bf16,NVIDIA GeForce RTX 4060,c03,64,64,32,4,2,8,0.0,0.0,295.80798745155334,409.69854921102524,1.8149304101801083,2,-1,-1,8x4096x8192,0,
2026-03-03T02:13:04.707878+00:00,FULL,llm_style,eval,llm_style_eval_156,64,6144,2048,bf16,NVIDIA GeForce RTX 4060,c03,64,64,32,4,2,8,0.0,0.0,93.6960019171238,150.09472101926798,17.189770140081567,3,-1,-1,64x6144x2048,0,
2026-03-03T02:13:05.007999+00:00,FULL,llm_style,eval,llm_style_eval_157,16,4096,6144,bf16,NVIDIA GeForce RTX 4060,c11,32,128,32,4,2,8,0.0,300.044,226.30399465560913,247.27360472083092,3.558515921141915,2,-1,-1,16x4096x6144,0,
2026-03-03T02:13:05.042344+00:00,FULL,llm_style,eval,llm_style_eval_158,64,2048,3072,bf16,NVIDIA GeForce RTX 4060,c11,32,128,32,4,2,8,0.0,0.0,45.05600035190582,109.45535965263835,17.873454405855544,3,-1,-1,64x2048x3072,0,
2026-03-03T02:13:05.058582+00:00,FULL,llm_style,eval,llm_style_eval_159,64,1536,2048,bf16,NVIDIA GeForce RTX 4060,c04,64,64,64,4,3,8,0.0,0.0,39.93599861860275,112.56128050386897,10.082461887216674,3,-1,-1,64x1536x2048,0,
2026-03-03T02:13:05.077513+00:00,FULL,llm_style,eval,llm_style_eval_160,16,1536,3072,bf16,NVIDIA GeForce RTX 4060,c00,32,32,32,2,2,8,0.0,0.0,48.5600009560585,67.16416038572787,3.1094510096207353,2,-1,-1,16x1536x3072,0,
2026-03-03T02:13:05.090211+00:00,FULL,llm_style,eval,llm_style_eval_161,64,1536,1024,bf16,NVIDIA GeForce RTX 4060,c04,64,64,64,4,3,8,0.0,0.0,61.503998935222626,250.17344623804075,3.2733902751923765,6,-1,-1,64x1536x1024,0,
2026-03-03T02:13:05.116091+00:00,FULL,llm_style,eval,llm_style_eval_162,64,6144,1024,bf16,NVIDIA GeForce RTX 4060,c06,64,128,32,4,3,8,0.0,0.0,50.175998359918594,72.81088203191754,16.049633177668706,6,-1,-1,64x6144x1024,0,
2026-03-03T02:13:05.150535+00:00,FULL,llm_style,eval,llm_style_eval_163,32,6144,1536,bf16,NVIDIA GeForce RTX 4060,c02,32,64,32,2,2,8,0.0,0.0,53.247999399900436,107.54463903605938,11.342769358601092,6,-1,-1,32x6144x1536,0,
2026-03-03T02:13:05.317705+00:00,FULL,llm_style,eval,llm_style_eval_164,16,1536,8192,bf16,NVIDIA GeForce RTX 4060,c04,64,64,64,4,3,8,0.0,167.115,89.08800035715103,96.08832135796547,4.519724119811601,2,-1,-1,16x1536x8192,0,
2026-03-03T02:13:05.492904+00:00,FULL,llm_style,eval,llm_style_eval_165,8,1536,8192,bf16,NVIDIA GeForce RTX 4060,c00,32,32,32,2,2,8,0.0,175.148,82.73599669337273,140.42912304401386,2.433361536045006,2,-1,-1,8x1536x8192,0,
2026-03-03T02:13:05.523433+00:00,FULL,llm_style,eval,llm_style_eval_166,2,1024,6144,bf16,NVIDIA GeForce RTX 4060,c04,64,64,64,4,3,8,0.0,0.0,75.71200281381607,122.43839994072911,0.3323888295741622,2,-1,-1,2x1024x6144,0,
2026-03-03T02:13:05.591617+00:00,FULL,llm_style,eval,llm_style_eval_167,64,4096,3072,bf16,NVIDIA GeForce RTX 4060,c04,64,64,64,4,3,8,0.0,0.0,90.7839983701706,168.22272464632982,17.741152239547183,3,-1,-1,64x4096x3072,0,
2026-03-03T02:13:05.898073+00:00,FULL,llm_style,eval,llm_style_eval_168,64,8192,3072,bf16,NVIDIA GeForce RTX 4060,c10,64,128,64,8,3,8,0.0,306.4,235.26399582624435,290.4166302084923,13.69196106989127,3,-1,-1,64x8192x3072,0,
2026-03-03T02:13:05.927852+00:00,FULL,llm_style,eval,llm_style_eval_169,2,1024,6144,bf16,NVIDIA GeForce RTX 4060,c04,64,64,64,4,3,8,0.0,0.0,75.77600330114365,129.98111844062794,0.3321080936399846,2,-1,-1,2x1024x6144,0,
2026-03-03T02:13:06.152887+00:00,FULL,llm_style,eval,llm_style_eval_170,16,2048,8192,bf16,NVIDIA GeForce RTX 4060,c06,64,128,32,4,3,8,0.0,224.962,161.71199828386307,277.1641547977922,3.3199200906391457,2,-1,-1,16x2048x8192,0,
2026-03-03T02:13:06.248000+00:00,FULL,llm_style,eval,llm_style_eval_171,2,4096,1536,bf16,NVIDIA GeForce RTX 4060,c11,32,128,32,4,2,8,0.0,95.067,47.10400104522705,96.74752280116071,0.5342608577100905,6,-1,-1,2x4096x1536,0,
2026-03-03T02:13:06.297862+00:00,FULL,llm_style,eval,llm_style_eval_172,1,1536,1024,bf16,NVIDIA GeForce RTX 4060,c00,32,32,32,2,2,8,0.0,49.818,34.28800031542778,92.0825606584549,0.09174428287043003,1,-1,-1,1x1536x1024,0,
2026-03-03T02:13:06.401718+00:00,FULL,llm_style,eval,llm_style_eval_173,32,1536,4096,bf16,NVIDIA GeForce RTX 4060,c04,64,64,64,4,3,8,0.0,103.807,57.360000908374786,63.851197957992554,7.019755537368045,2,-1,-1,32x1536x4096,0,
2026-03-03T02:13:06.432184+00:00,FULL,llm_style,eval,llm_style_eval_174,64,2048,3072,bf16,NVIDIA GeForce RTX 4060,c11,32,128,32,4,2,8,0.0,0.0,63.34399804472923,215.16512468457205,12.713222923367534,3,-1,-1,64x2048x3072,0,
2026-03-03T02:13:06.491424+00:00,FULL,llm_style,eval,llm_style_eval_175,2,3072,1024,bf16,NVIDIA GeForce RTX 4060,c00,32,32,32,2,2,8,0.0,59.186,35.26400029659271,82.11391918361177,0.3568203236776796,6,-1,-1,2x3072x1024,0,
2026-03-03T02:13:06.706351+00:00,FULL,llm_style,eval,llm_style_eval_176,64,6144,6144,bf16,NVIDIA GeForce RTX 4060,c11,32,128,32,4,2,8,0.0,0.0,358.39998722076416,437.9033663868903,13.481691909279355,5,-1,-1,64x6144x6144,0,
2026-03-03T02:13:07.002729+00:00,FULL,llm_style,eval,llm_style_eval_177,2,6144,4096,bf16,NVIDIA GeForce RTX 4060,c11,32,128,32,4,2,8,0.0,296.323,227.63200104236603,388.9049685001373,0.44221943988123585,2,-1,-1,2x6144x4096,0,
2026-03-03T02:13:07.055753+00:00,FULL,llm_style,eval,llm_style_eval_178,64,4096,2048,bf16,NVIDIA GeForce RTX 4060,c04,64,64,64,4,3,8,0.0,0.0,93.53600069880486,193.4233619272708,11.479449794497356,3,-1,-1,64x4096x2048,0,
2026-03-03T02:13:07.200893+00:00,FULL,llm_style,eval,llm_style_eval_179,16,6144,2048,bf16,NVIDIA GeForce RTX 4060,c11,32,128,32,4,2,8,0.0,145.062,62.192000448703766,90.39904005825512,6.47435652648141,2,-1,-1,16x6144x2048,0,
2026-03-03T02:13:07.277986+00:00,FULL,llm_style,eval,llm_style_eval_180,1,3072,2048,bf16,NVIDIA GeForce RTX 4060,c00,32,32,32,2,2,8,0.0,77.05,44.03200000524521,260.59776186943014,0.2857674418264238,2,-1,-1,1x3072x2048,0,
2026-03-03T02:13:07.585967+00:00,FULL,llm_style,eval,llm_style_eval_181,32,3072,8192,bf16,NVIDIA GeForce RTX 4060,c10,64,128,64,8,3,8,0.0,307.934,231.36000335216522,351.62111222743977,6.961500314072876,2,-1,-1,32x3072x8192,0,
2026-03-03T02:13:07.638336+00:00,FULL,llm_style,eval,llm_style_eval_182,64,1024,8192,bf16,NVIDIA GeForce RTX 4060,c00,32,32,32,2,2,8,0.0,0.0,97.79200330376625,180.16128093004227,10.97985303220235,7,-1,-1,64x1024x8192,0,
2026-03-03T02:13:07.737426+00:00,FULL,llm_style,eval,llm_style_eval_183,32,4096,1536,bf16,NVIDIA GeForce RTX 4060,c11,32,128,32,4,2,8,0.0,99.028,48.128001391887665,52.244479060173035,8.366297630382595,6,-1,-1,32x4096x1536,0,
2026-03-03T02:13:07.826924+00:00,FULL,llm_style,eval,llm_style_eval_184,2,2048,3072,bf16,NVIDIA GeForce RTX 4060,c00,32,32,32,2,2,8,0.0,89.451,30.719999223947525,488.34657296538217,0.8192000206947333,2,-1,-1,2x2048x3072,0,
2026-03-03T02:13:07.844461+00:00,FULL,llm_style,eval,llm_style_eval_185,64,1536,1536,bf16,NVIDIA GeForce RTX 4060,c04,64,64,64,4,3,8,0.0,0.0,45.93599960207939,145.68256422877306,6.574144257575484,4,-1,-1,64x1536x1536,0,
2026-03-03T02:13:07.883130+00:00,FULL,llm_style,eval,llm_style_eval_186,64,8192,1024,bf16,NVIDIA GeForce RTX 4060,c06,64,128,32,4,3,8,0.0,0.0,66.56000018119812,109.79807965457434,16.13193841762204,6,-1,-1,64x8192x1024,0,
2026-03-03T02:13:07.923333+00:00,FULL,llm_style,eval,llm_style_eval_187,4,8192,1024,bf16,NVIDIA GeForce RTX 4060,c00,32,32,32,2,2,8,0.0,0.0,49.15200173854828,139.92799721658224,1.3653332850403275,6,-1,-1,4x8192x1024,0,
2026-03-03T02:13:07.949531+00:00,FULL,llm_style,eval,llm_style_eval_188,32,6144,1024,bf16,NVIDIA GeForce RTX 4060,c02,32,64,32,2,2,8,0.0,0.0,40.95999896526337,111.13472037017345,9.8304002483368,6,-1,-1,32x6144x1024,0,
2026-03-03T02:13:07.957275+00:00,FULL,llm_style,eval,llm_style_eval_189,4,1024,1024,bf16,NVIDIA GeForce RTX 4060,c00,32,32,32,2,2,8,0.0,0.0,29.69600073993206,122.62400045990938,0.2824827515820971,6,-1,-1,4x1024x1024,0,
2026-03-03T02:13:08.033705+00:00,FULL,llm_style,eval,llm_style_eval_190,16,2048,2048,bf16,NVIDIA GeForce RTX 4060,c00,32,32,32,2,2,8,0.0,76.385,51.711998879909515,111.82752303779108,2.5954852047334906,2,-1,-1,16x2048x2048,0,
2026-03-03T02:13:08.096721+00:00,FULL,llm_style,eval,llm_style_eval_191,4,2048,1536,bf16,NVIDIA GeForce RTX 4060,c00,32,32,32,2,2,8,0.0,62.972,39.93599861860275,126.4764769375324,0.6301538679510421,6,-1,-1,4x2048x1536,0,
2026-03-03T02:13:08.132561+00:00,FULL,llm_style,eval,llm_style_eval_192,64,8192,1024,bf16,NVIDIA GeForce RTX 4060,c06,64,128,32,4,3,8,0.0,0.0,68.01600009202957,124.47296179831018,15.786606424182038,6,-1,-1,64x8192x1024,0,
2026-03-03T02:13:08.940162+00:00,FULL,llm_style,eval,llm_style_eval_193,4,8192,8192,bf16,NVIDIA GeForce RTX 4060,c11,32,128,32,4,2,8,0.0,807.516,558.8800013065338,626.5929508209229,0.9606192934886172,2,-1,-1,4x8192x8192,0,
2026-03-03T02:13:08.956468+00:00,FULL,llm_style,eval,llm_style_eval_194,64,1024,1024,bf16,NVIDIA GeForce RTX 4060,c04,64,64,64,4,3,8,0.0,0.0,31.488001346588135,60.477439947426305,4.262503882754156,6,-1,-1,64x1024x1024,0,
2026-03-03T02:13:08.992347+00:00,FULL,llm_style,eval,llm_style_eval_195,32,4096,1536,bf16,NVIDIA GeForce RTX 4060,c11,32,128,32,4,2,8,0.0,0.0,67.391999065876,168.39391589164728,5.974792105608926,6,-1,-1,32x4096x1536,0,
2026-03-03T02:13:09.011611+00:00,FULL,llm_style,eval,llm_style_eval_196,8,4096,1024,bf16,NVIDIA GeForce RTX 4060,c02,32,64,32,2,2,8,0.0,0.0,63.152000308036804,158.19519728422165,1.0626561893948374,6,-1,-1,8x4096x1024,0,
2026-03-03T02:13:09.149423+00:00,FULL,llm_style,eval,llm_style_eval_197,2,6144,2048,bf16,NVIDIA GeForce RTX 4060,c02,32,64,32,2,2,8,0.0,137.764,56.32000043988228,167.48480051755905,0.8936727202927771,2,-1,-1,2x6144x2048,0,
2026-03-03T02:13:09.282408+00:00,FULL,llm_style,eval,llm_style_eval_198,32,1536,6144,bf16,NVIDIA GeForce RTX 4060,c00,32,32,32,2,2,8,0.0,132.941,58.36800113320351,151.30399942398066,10.34778927278387,2,-1,-1,32x1536x6144,0,
2026-03-03T02:13:09.365738+00:00,FULL,llm_style,eval,llm_style_eval_199,32,3072,1536,bf16,NVIDIA GeForce RTX 4060,c11,32,128,32,4,2,8,0.0,83.286,45.05600035190582,104.2841595783828,6.702545402195828,6,-1,-1,32x3072x1536,0,
2026-03-03T02:13:09.392567+00:00,FULL,llm_style,eval,llm_style_eval_200,64,2048,3072,bf16,NVIDIA GeForce RTX 4060,c11,32,128,32,4,2,8,0.0,0.0,69.64800134301186,160.27936130762097,11.56251941866815,3,-1,-1,64x2048x3072,0,
2026-03-03T02:13:09.525717+00:00,FULL,llm_style,eval,llm_style_eval_201,4,6144,2048,bf16,NVIDIA GeForce RTX 4060,c11,32,128,32,4,2,8,0.0,133.094,57.04000033438206,63.50847914814949,1.7647842813795198,2,-1,-1,4x6144x2048,0,
2026-03-03T02:13:09.552786+00:00,FULL,llm_style,eval,llm_style_eval_202,4,6144,1024,bf16,NVIDIA GeForce RTX 4060,c11,32,128,32,4,2,8,0.0,0.0,42.64000058174133,60.88031951338052,1.1803857249840721,6,-1,-1,4x6144x1024,0,
2026-03-03T02:13:10.107701+00:00,FULL,llm_style,eval,llm_style_eval_203,1,6144,8192,bf16,NVIDIA GeForce RTX 4060,c06,64,128,32,4,3,8,0.0,554.863,422.92800545692444,514.1190272569656,0.2380152051913541,0,-1,-1,1x6144x8192,0,
2026-03-03T02:13:10.135602+00:00,FULL,llm_style,eval,llm_style_eval_204,1,2048,3072,bf16,NVIDIA GeForce RTX 4060,c00,32,32,32,2,2,8,0.0,0.0,50.175998359918594,115.3270376473665,0.25077551840107354,2,-1,-1,1x2048x3072,0,
2026-03-03T02:13:10.263156+00:00,FULL,llm_style,eval,llm_style_eval_205,2,6144,1536,bf16,NVIDIA GeForce RTX 4060,c11,32,128,32,4,2,8,0.0,127.498,46.08000069856644,58.36800113320351,0.8191999875810414,6,-1,-1,2x6144x1536,0,
2026-03-03T02:13:10.316012+00:00,FULL,llm_style,eval,llm_style_eval_206,16,1024,1024,bf16,NVIDIA GeForce RTX 4060,c04,64,64,64,4,3,8,0.0,52.815,34.81600061058998,47.66719933599232,0.9637646889802084,6,-1,-1,16x1024x1024,0,
2026-03-03T02:13:10.381403+00:00,FULL,llm_style,eval,llm_style_eval_207,64,6144,2048,bf16,NVIDIA GeForce RTX 4060,c03,64,64,32,4,2,8,0.0,0.0,94.2080020904541,194.06079739332188,17.096347446722895,3,-1,-1,64x6144x2048,0,
2026-03-03T02:13:10.513394+00:00,FULL,llm_style,eval,llm_style_eval_208,4,4096,6144,bf16,NVIDIA GeForce RTX 4060,c00,32,32,32,2,2,8,0.0,0.0,227.32800245285034,304.6502351760864,0.8856216120658376,2,-1,-1,4x4096x6144,0,
2026-03-03T02:13:10.941203+00:00,FULL,llm_style,eval,llm_style_eval_209,32,6144,6144,bf16,NVIDIA GeForce RTX 4060,c06,64,128,32,4,3,8,0.0,427.747,327.9999941587448,368.3667129278182,7.365607155562168,2,-1,-1,32x6144x6144,0,
2026-03-03T02:13:10.958748+00:00,FULL,llm_style,eval,llm_style_eval_210,64,2048,1024,bf16,NVIDIA GeForce RTX 4060,c11,32,128,32,4,2,8,0.0,0.0,47.00800031423569,100.63424117863175,5.71042065617729,6,-1,-1,64x2048x1024,0,
2026-03-03T02:13:11.039193+00:00,FULL,llm_style,eval,llm_style_eval_211,4,1024,3072,bf16,NVIDIA GeForce RTX 4060,c00,32,32,32,2,2,8,0.0,80.401,29.69600073993206,131.20383992791173,0.8474482547462914,2,-1,-1,4x1024x3072,0,
2026-03-03T02:13:11.221433+00:00,FULL,llm_style,eval,llm_style_eval_212,64,6144,6144,bf16,NVIDIA GeForce RTX 4060,c11,32,128,32,4,2,8,0.0,0.0,332.8000009059906,369.7260698676109,14.518744575859836,5,-1,-1,64x6144x6144,0,
2026-03-03T02:13:11.281101+00:00,FULL,llm_style,eval,llm_style_eval_213,4,1024,2048,bf16,NVIDIA GeForce RTX 4060,c04,64,64,64,4,3,8,0.0,59.617,40.81600159406662,56.28863893449304,0.41104506430730064,2,-1,-1,4x1024x2048,0,
2026-03-03T02:13:11.475286+00:00,FULL,llm_style,eval,llm_style_eval_214,32,6144,6144,bf16,NVIDIA GeForce RTX 4060,c06,64,128,32,4,3,8,0.0,0.0,353.983998298645,378.39872509241104,6.824938741896932,2,-1,-1,32x6144x6144,0,
2026-03-03T02:13:11.502282+00:00,FULL,llm_style,eval,llm_style_eval_215,16,2048,3072,bf16,NVIDIA GeForce RTX 4060,c00,32,32,32,2,2,8,0.0,0.0,60.416001826524734,176.0563234984874,3.3323388823060216,2,-1,-1,16x2048x3072,0,
2026-03-03T02:13:11.517443+00:00,FULL,llm_style,eval,llm_style_eval_216,2,1536,2048,bf16,NVIDIA GeForce RTX 4060,c04,64,64,64,4,3,8,0.0,0.0,43.87199878692627,56.32000043988228,0.28680963593912373,2,-1,-1,2x1536x2048,0,
2026-03-03T02:13:11.641869+00:00,FULL,llm_style,eval,llm_style_eval_217,64,8192,3072,bf16,NVIDIA GeForce RTX 4060,c10,64,128,64,8,3,8,0.0,0.0,235.52000522613525,327.20575898885716,13.677077957378314,3,-1,-1,64x8192x3072,0,
2026-03-03T02:13:11.703496+00:00,FULL,llm_style,eval,llm_style_eval_218,64,4096,3072,bf16,NVIDIA GeForce RTX 4060,c04,64,64,64,4,3,8,0.0,0.0,84.87999811768532,93.04960027337073,18.975174030599067,3,-1,-1,64x4096x3072,0,
2026-03-03T02:13:11.723935+00:00,FULL,llm_style,eval,llm_style_eval_219,64,1536,3072,bf16,NVIDIA GeForce RTX 4060,c00,32,32,32,2,2,8,0.0,0.0,62.463998794555664,78.3667203783989,9.669246088238634,3,-1,-1,64x1536x3072,0,
2026-03-03T02:13:11.910022+00:00,FULL,llm_style,eval,llm_style_eval_220,1,6144,6144,bf16,NVIDIA GeForce RTX 4060,c02,32,64,32,2,2,8,0.0,0.0,326.57600939273834,335.3075101971626,0.23117886748749872,2,-1,-1,1x6144x6144,0,
2026-03-03T02:13:12.080301+00:00,FULL,llm_style,eval,llm_style_eval_221,8,4096,8192,bf16,NVIDIA GeForce RTX 4060,c03,64,64,32,4,2,8,0.0,0.0,319.3439990282059,336.46047472953796,1.6811679995044504,2,-1,-1,8x4096x8192,0,
2026-03-03T02:13:12.836267+00:00,FULL,llm_style,eval,llm_style_eval_222,8,8192,8192,bf16,NVIDIA GeForce RTX 4060,c11,32,128,32,4,2,8,0.0,755.911,557.0560097694397,606.2889659404755,1.9275293779604168,2,-1,-1,8x8192x8192,0,
2026-03-03T02:13:12.928916+00:00,FULL,llm_style,eval,llm_style_eval_223,1,4096,1536,bf16,NVIDIA GeForce RTX 4060,c11,32,128,32,4,2,8,0.0,92.603,46.08000069856644,56.84224061667919,0.2730666625270138,1,-1,-1,1x4096x1536,0,
2026-03-03T02:13:13.039551+00:00,FULL,llm_style,eval,llm_style_eval_224,4,3072,3072,bf16,NVIDIA GeForce RTX 4060,c00,32,32,32,2,2,8,0.0,110.593,59.79200080037117,125.48287622630592,1.262668433726863,2,-1,-1,4x3072x3072,0,
2026-03-03T02:13:13.126943+00:00,FULL,llm_style,eval,llm_style_eval_225,64,8192,2048,bf16,NVIDIA GeForce RTX 4060,c00,32,32,32,2,2,8,0.0,0.0,171.00800573825836,236.2947173416614,12.55779598580255,3,-1,-1,64x8192x2048,0,
2026-03-03T02:13:13.217172+00:00,FULL,llm_style,eval,llm_style_eval_226,4,4096,1536,bf16,NVIDIA GeForce RTX 4060,c00,32,32,32,2,2,8,0.0,90.176,44.95999962091446,124.07807700335965,1.1194761660226253,6,-1,-1,4x4096x1536,0,
2026-03-03T02:13:13.281655+00:00,FULL,llm_style,eval,llm_style_eval_227,16,8192,1536,bf16,NVIDIA GeForce RTX 4060,c11,32,128,32,4,2,8,0.0,0.0,74.0320011973381,224.21216219663614,5.438907195372126,7,-1,-1,16x8192x1536,0,
2026-03-03T02:13:13.411164+00:00,FULL,llm_style,eval,llm_style_eval_228,16,2048,4096,bf16,NVIDIA GeForce RTX 4060,c11,32,128,32,4,2,8,0.0,129.455,74.64000210165977,163.68640281259985,3.596402042357804,2,-1,-1,16x2048x4096,0,
2026-03-03T02:13:13.428395+00:00,FULL,llm_style,eval,llm_style_eval_229,8,1536,1024,bf16,NVIDIA GeForce RTX 4060,c04,64,64,64,4,3,8,0.0,0.0,39.68000039458275,1173.933444023131,0.6342193485319553,6,-1,-1,8x1536x1024,0,
2026-03-03T02:13:13.552613+00:00,FULL,llm_style,eval,llm_style_eval_230,64,4096,6144,bf16,NVIDIA GeForce RTX 4060,c11,32,128,32,4,2,8,0.0,0.0,234.49599742889404,277.71295279264444,13.736803644065475,5,-1,-1,64x4096x6144,0,
2026-03-03T02:13:13.598305+00:00,FULL,llm_style,eval,llm_style_eval_231,64,4096,2048,bf16,NVIDIA GeForce RTX 4060,c04,64,64,64,4,3,8,0.0,0.0,65.5359998345375,147.26144134998316,16.384000041365624,3,-1,-1,64x4096x2048,0,
2026-03-03T02:13:13.735647+00:00,FULL,llm_style,eval,llm_style_eval_232,16,3072,4096,bf16,NVIDIA GeForce RTX 4060,c00,32,32,32,2,2,8,0.0,137.287,77.82399654388428,151.63871407508844,5.173894966611581,2,-1,-1,16x3072x4096,0,
2026-03-03T02:13:13.809464+00:00,FULL,llm_style,eval,llm_style_eval_233,64,8192,1536,bf16,NVIDIA GeForce RTX 4060,c06,64,128,32,4,3,8,0.0,0.0,110.68800091743469,198.81408110260963,14.550924424061119,4,-1,-1,64x8192x1536,0,
2026-03-03T02:13:13.900760+00:00,FULL,llm_style,eval,llm_style_eval_234,64,1024,4096,bf16,NVIDIA GeForce RTX 4060,c04,64,64,64,4,3,8,0.0,91.244,56.32000043988228,103.16800132393831,9.53250901645629,3,-1,-1,64x1024x4096,0,
2026-03-03T02:13:13.915538+00:00,FULL,llm_style,eval,llm_style_eval_235,64,3072,1024,bf16,NVIDIA GeForce RTX 4060,c03,64,64,32,4,2,8,0.0,0.0,47.82399907708168,129.22880269587037,8.41947958703772,6,-1,-1,64x3072x1024,0,
2026-03-03T02:13:14.146688+00:00,FULL,llm_style,eval,llm_style_eval_236,32,3072,6144,bf16,NVIDIA GeForce RTX 4060,c06,64,128,32,4,3,8,0.0,231.105,179.1359931230545,227.36896246671677,6.743254278162916,2,-1,-1,32x3072x6144,0,
2026-03-03T02:13:14.703778+00:00,FULL,llm_style,eval,llm_style_eval_237,2,8192,6144,bf16,NVIDIA GeForce RTX 4060,c10,64,128,64,8,3,8,0.0,557.042,424.9599874019623,482.3654466867447,0.4737542309120239,2,-1,-1,2x8192x6144,0,
2026-03-03T02:13:14.746714+00:00,FULL,llm_style,eval,llm_style_eval_238,4,2048,4096,bf16,NVIDIA GeForce RTX 4060,c00,32,32,32,2,2,8,0.0,0.0,65.5359998345375,218.422722518444,1.0240000025853515,2,-1,-1,4x2048x4096,0,
2026-03-03T02:13:14.790040+00:00,FULL,llm_style,eval,llm_style_eval_239,4,8192,1024,bf16,NVIDIA GeForce RTX 4060,c00,32,32,32,2,2,8,0.0,0.0,52.079999819397926,129.71007905900476,1.2885726619185653,6,-1,-1,4x8192x1024,0,
2026-03-03T02:13:14.812157+00:00,FULL,llm_style,eval,llm_style_eval_240,2,1024,4096,bf16,NVIDIA GeForce RTX 4060,c00,32,32,32,2,2,8,0.0,0.0,56.71999976038933,118.56895908713335,0.2957901281889011,2,-1,-1,2x1024x4096,0,
2026-03-03T02:13:14.838138+00:00,FULL,llm_style,eval,llm_style_eval_241,8,3072,2048,bf16,NVIDIA GeForce RTX 4060,c00,32,32,32,2,2,8,0.0,0.0,59.39200147986412,90.64127959311006,1.6948965094925827,2,-1,-1,8x3072x2048,0,
2026-03-03T02:13:15.161313+00:00,FULL,llm_style,eval,llm_style_eval_242,32,4096,6144,bf16,NVIDIA GeForce RTX 4060,c11,32,128,32,4,2,8,0.0,323.121,228.35199534893036,254.42592322826385,7.05320193738147,2,-1,-1,32x4096x6144,0,
2026-03-03T02:13:15.245560+00:00,FULL,llm_style,eval,llm_style_eval_243,64,2048,2048,bf16,NVIDIA GeForce RTX 4060,c03,64,64,32,4,2,8,0.0,84.201,52.22399905323982,100.23936033248893,10.280157049112349,3,-1,-1,64x2048x2048,0,
2026-03-03T02:13:15.306535+00:00,FULL,llm_style,eval,llm_style_eval_244,8,2048,1536,bf16,NVIDIA GeForce RTX 4060,c00,32,32,32,2,2,8,0.0,60.933,38.8799998909235,92.89760272949917,1.2945382752367207,6,-1,-1,8x2048x1536,0,
2026-03-03T02:13:15.417404+00:00,FULL,llm_style,eval,llm_style_eval_245,1,1024,6144,bf16,NVIDIA GeForce RTX 4060,c04,64,64,64,4,3,8,0.0,110.822,71.53600081801414,75.77600330114365,0.17589621807361897,2,-1,-1,1x1024x6144,0,
2026-03-03T02:13:15.429169+00:00,FULL,llm_style,eval,llm_style_eval_246,2,1536,1024,bf16,NVIDIA GeForce RTX 4060,c04,64,64,64,4,3,8,0.0,0.0,35.711999982595444,109.93664361536496,0.17617204309661166,6,-1,-1,2x1536x1024,0,
2026-03-03T02:13:15.492917+00:00,FULL,llm_style,eval,llm_style_eval_247,64,2048,6144,bf16,NVIDIA GeForce RTX 4060,c04,64,64,64,4,3,8,0.0,0.0,110.4159988462925,154.807039797306,14.58676960611565,5,-1,-1,64x2048x6144,0,
2026-03-03T02:13:15.505750+00:00,FULL,llm_style,eval,llm_style_eval_248,64,1536,1024,bf16,NVIDIA GeForce RTX 4060,c04,64,64,64,4,3,8,0.0,0.0,46.04800045490265,134.47168067097658,4.372102806009357,6,-1,-1,64x1536x1024,0,
2026-03-03T02:13:15.523307+00:00,FULL,llm_style,eval,llm_style_eval_249,8,2048,1536,bf16,NVIDIA GeForce RTX 4060,c00,32,32,32,2,2,8,0.0,0.0,61.39199994504452,161.81695446372032,0.8198405011248165,6,-1,-1,8x2048x1536,0,
2026-03-03T02:13:15.565524+00:00,FULL,llm_style,eval,llm_style_eval_250,32,6144,1536,bf16,NVIDIA GeForce RTX 4060,c02,32,64,32,2,2,8,0.0,0.0,55.26399984955788,76.38015970587728,10.928991344169454,6,-1,-1,32x6144x1536,0,
2026-03-03T02:13:15.609960+00:00,FULL,llm_style,eval,llm_style_eval_251,64,8192,1024,bf16,NVIDIA GeForce RTX 4060,c06,64,128,32,4,3,8,0.0,0.0,57.08799883723259,160.23359760642052,18.808538499683923,6,-1,-1,64x8192x1024,0,
2026-03-03T02:13:15.637152+00:00,FULL,llm_style,eval,llm_style_eval_252,1,3072,2048,bf16,NVIDIA GeForce RTX 4060,c00,32,32,32,2,2,8,0.0,0.0,43.088000267744064,116.36799857020375,0.29202821949988805,2,-1,-1,1x3072x2048,0,
2026-03-03T02:13:15.693505+00:00,FULL,llm_style,eval,llm_style_eval_253,8,3072,1024,bf16,NVIDIA GeForce RTX 4060,c00,32,32,32,2,2,8,0.0,56.3,36.687999963760376,104.80256050825119,1.3718831239019986,6,-1,-1,8x3072x1024,0,
2026-03-03T02:13:15.749339+00:00,FULL,llm_style,eval,llm_style_eval_254,2,1024,1536,bf16,NVIDIA GeForce RTX 4060,c00,32,32,32,2,2,8,0.0,55.788,39.93599861860275,59.900800436735125,0.15753846698776053,6,-1,-1,2x1024x1536,0,
2026-03-03T02:13:15.839045+00:00,FULL,llm_style,eval,llm_style_eval_255,64,4096,4096,bf16,NVIDIA GeForce RTX 4060,c00,32,32,32,2,2,8,0.0,0.0,165.8879965543747,186.36800348758698,12.945382984935252,3,-1,-1,64x4096x4096,0,
2026-03-03T02:13:15.910469+00:00,BUCKET,llm_style,tune,llm_style_tune_000,4,2048,2048,bf16,NVIDIA GeForce RTX 4060,c00,32,32,32,2,2,8,0.0,69.246,42.78400167822838,114.74944159388541,0.7842752123178544,2,-1,-1,llm8_g2,0,
2026-03-03T02:13:16.014267+00:00,BUCKET,llm_style,tune,llm_style_tune_001,32,6144,1536,bf16,NVIDIA GeForce RTX 4060,c00,32,32,32,2,2,8,0.0,103.754,41.98399931192398,97.12703928351395,14.385951455283637,6,-1,-1,llm8_g6,0,
2026-03-03T02:13:16.181091+00:00,BUCKET,llm_style,tune,llm_style_tune_002,4,8192,4096,bf16,NVIDIA GeForce RTX 4060,c00,32,32,32,2,2,8,0.0,0.0,295.6480085849762,304.58912551403046,0.907956245958766,2,-1,-1,llm8_g2,0,
2026-03-03T02:13:16.197593+00:00,BUCKET,llm_style,tune,llm_style_tune_003,2,1536,1536,bf16,NVIDIA GeForce RTX 4060,c00,32,32,32,2,2,8,0.0,0.0,45.05600035190582,57.866240963339806,0.20945454381861964,6,-1,-1,llm8_g6,0,
2026-03-03T02:13:16.259576+00:00,BUCKET,llm_style,tune,llm_style_tune_004,16,1536,1536,bf16,NVIDIA GeForce RTX 4060,c04,64,64,64,4,3,8,0.0,61.938,44.416001066565514,78.37695840746153,1.6997809390100926,7,-1,-1,llm8_g7,0,
2026-03-03T02:13:16.361908+00:00,BUCKET,llm_style,tune,llm_style_tune_005,16,3072,6144,bf16,NVIDIA GeForce RTX 4060,c00,32,32,32,2,2,8,0.0,0.0,180.56000024080276,255.85888743400574,3.345036415565496,2,-1,-1,llm8_g2,0,
2026-03-03T02:13:16.371746+00:00,BUCKET,llm_style,tune,llm_style_tune_006,16,1536,1024,bf16,NVIDIA GeForce RTX 4060,c00,32,32,32,2,2,8,0.0,0.0,34.81600061058998,107.52831891179085,1.4456470334703126,6,-1,-1,llm8_g6,0,
2026-03-03T02:13:16.436274+00:00,BUCKET,llm_style,tune,llm_style_tune_007,64,2048,1536,bf16,NVIDIA GeForce RTX 4060,c03,64,64,32,4,2,8,0.0,64.485,46.08000069856644,62.25759893655772,8.738133200864441,4,-1,-1,llm8_g4,0,
2026-03-03T02:13:16.619230+00:00,BUCKET,llm_style,tune,llm_style_tune_008,2,8192,4096,bf16,NVIDIA GeForce RTX 4060,c00,32,32,32,2,2,8,0.0,0.0,296.62398993968964,376.7910403013227,0.4524843996174736,2,-1,-1,llm8_g2,0,
2026-03-03T02:13:16.856225+00:00,BUCKET,llm_style,tune,llm_style_tune_009,4,8192,6144,bf16,NVIDIA GeForce RTX 4060,c00,32,32,32,2,2,8,0.0,0.0,430.04800379276276,456.1043280363083,0.9362982282183453,2,-1,-1,llm8_g2,0,
2026-03-03T02:13:16.948828+00:00,BUCKET,llm_style,tune,llm_style_tune_010,2,3072,6144,bf16,NVIDIA GeForce RTX 4060,c00,32,32,32,2,2,8,0.0,0.0,183.07199329137802,285.77120661735523,0.4123922542310333,2,-1,-1,llm8_g2,0,
2026-03-03T02:13:17.042554+00:00,BUCKET,llm_style,tune,llm_style_tune_011,32,6144,3072,bf16,NVIDIA GeForce RTX 4060,c00,32,32,32,2,2,8,0.0,0.0,180.2240014076233,198.82784426212308,6.702545402195828,2,-1,-1,llm8_g2,0,
2026-03-03T02:13:17.071817+00:00,BUCKET,llm_style,tune,llm_style_tune_012,8,6144,1024,bf16,NVIDIA GeForce RTX 4060,c00,32,32,32,2,2,8,0.0,0.0,41.920000687241554,137.24255666136736,2.4013190446019506,6,-1,-1,llm8_g6,0,
2026-03-03T02:13:17.105362+00:00,BUCKET,llm_style,tune,llm_style_tune_013,16,4096,2048,bf16,NVIDIA GeForce RTX 4060,c00,32,32,32,2,2,8,0.0,0.0,55.1999993622303,148.29408034682274,4.862961215605965,2,-1,-1,llm8_g2,0,
2026-03-03T02:13:17.192435+00:00,BUCKET,llm_style,tune,llm_style_tune_014,8,8192,2048,bf16,NVIDIA GeForce RTX 4060,c00,32,32,32,2,2,8,0.0,0.0,167.83999651670456,284.38527867197956,1.5993533220389666,2,-1,-1,llm8_g2,0,
2026-03-03T02:13:17.243840+00:00,BUCKET,llm_style,tune,llm_style_tune_015,16,1536,6144,bf16,NVIDIA GeForce RTX 4060,c00,32,32,32,2,2,8,0.0,0.0,104.95999827980995,179.84544053673739,2.8771902910567277,2,-1,-1,llm8_g2,0,
2026-03-03T02:13:17.254314+00:00,BUCKET,llm_style,tune,llm_style_tune_016,64,1536,1024,bf16,NVIDIA GeForce RTX 4060,c00,32,32,32,2,2,8,0.0,0.0,48.128001391887665,62.35807951539754,4.183148815191298,6,-1,-1,llm8_g6,0,
2026-03-03T02:13:17.267843+00:00,BUCKET,llm_style,tune,llm_style_tune_017,64,1536,1536,bf16,NVIDIA GeForce RTX 4060,c03,64,64,32,4,2,8,0.0,0.0,58.36800113320351,121.23264260590075,5.173894636391935,4,-1,-1,llm8_g4,0,
2026-03-03T02:13:17.308813+00:00,BUCKET,llm_style,tune,llm_style_tune_018,2,8192,1024,bf16,NVIDIA GeForce RTX 4060,c00,32,32,32,2,2,8,0.0,0.0,55.296000093221664,155.79583972692484,0.6068148137918061,6,-1,-1,llm8_g6,0,
2026-03-03T02:13:17.355930+00:00,BUCKET,llm_style,tune,llm_style_tune_019,64,1024,8192,bf16,NVIDIA GeForce RTX 4060,c04,64,64,64,4,3,8,0.0,0.0,115.60000106692314,217.90655523538584,9.288423997318041,7,-1,-1,llm8_g7,0,
2026-03-03T02:13:17.374724+00:00,BUCKET,llm_style,tune,llm_style_tune_020,1,2048,2048,bf16,NVIDIA GeForce RTX 4060,c00,32,32,32,2,2,8,0.0,0.0,54.27199974656105,202.41407722234703,0.15456603845764028,2,-1,-1,llm8_g2,0,
2026-03-03T02:13:17.620413+00:00,BUCKET,llm_style,tune,llm_style_tune_021,64,6144,8192,bf16,NVIDIA GeForce RTX 4060,c04,64,64,64,4,3,8,0.0,0.0,471.48799896240234,539.6889567375183,13.664082560272625,7,-1,-1,llm8_g7,0,
2026-03-03T02:13:17.744526+00:00,BUCKET,llm_style,tune,llm_style_tune_022,2,4096,6144,bf16,NVIDIA GeForce RTX 4060,c00,32,32,32,2,2,8,0.0,0.0,229.37600314617157,315.9756714105606,0.438857136837682,2,-1,-1,llm8_g2,0,
2026-03-03T02:13:17.792073+00:00,BUCKET,llm_style,tune,llm_style_tune_023,64,8192,1024,bf16,NVIDIA GeForce RTX 4060,c00,32,32,32,2,2,8,0.0,0.0,118.75200271606445,190.6892774999141,9.041883921463727,6,-1,-1,llm8_g6,0,
2026-03-03T02:13:17.807894+00:00,BUCKET,llm_style,tune,llm_style_tune_024,8,1024,2048,bf16,NVIDIA GeForce RTX 4060,c00,32,32,32,2,2,8,0.0,0.0,46.57600075006485,100.40320403873909,0.7204232106586198,2,-1,-1,llm8_g2,0,
2026-03-03T02:13:17.824398+00:00,BUCKET,llm_style,tune,llm_style_tune_025,4,2048,2048,bf16,NVIDIA GeForce RTX 4060,c00,32,32,32,2,2,8,0.0,0.0,58.36800113320351,70.17472140491009,0.5748771818213262,2,-1,-1,llm8_g2,0,
2026-03-03T02:13:17.838515+00:00,BUCKET,llm_style,tune,llm_style_tune_026,4,3072,1024,bf16,NVIDIA GeForce RTX 4060,c00,32,32,32,2,2,8,0.0,0.0,40.86400009691715,190.93440458178492,0.6158433814681434,6,-1,-1,llm8_g6,0,
2026-03-03T02:13:17.860512+00:00,BUCKET,llm_style,tune,llm_style_tune_027,16,3072,1536,bf16,NVIDIA GeForce RTX 4060,c04,64,64,64,4,3,8,0.0,0.0,75.77600330114365,178.524160683155,1.992648561839908,7,-1,-1,llm8_g7,0,
2026-03-03T02:13:17.890770+00:00,BUCKET,llm_style,tune,llm_style_tune_028,64,6144,1024,bf16,NVIDIA GeForce RTX 4060,c00,32,32,32,2,2,8,0.0,0.0,99.07200187444687,113.7664012610912,8.128495970239484,6,-1,-1,llm8_g6,0,
2026-03-03T02:13:18.044635+00:00,BUCKET,llm_style,tune,llm_style_tune_029,64,2048,4096,bf16,NVIDIA GeForce RTX 4060,c03,64,64,32,4,2,8,0.0,153.812,118.73600259423256,129.5462429523468,9.043102349246137,3,-1,-1,llm8_g3,0,
2026-03-03T02:13:18.130258+00:00,BUCKET,llm_style,tune,llm_style_tune_030,1,8192,2048,bf16,NVIDIA GeForce RTX 4060,c00,32,32,32,2,2,8,0.0,0.0,165.77599942684174,196.97663947939867,0.20240826245060786,2,-1,-1,llm8_g2,0,
2026-03-03T02:13:18.180469+00:00,BUCKET,llm_style,tune,llm_style_tune_031,64,1024,8192,bf16,NVIDIA GeForce RTX 4060,c04,64,64,64,4,3,8,0.0,0.0,137.08800077438354,216.24832585453964,7.832500422609131,7,-1,-1,llm8_g7,0,
2026-03-03T02:13:18.305193+00:00,BUCKET,llm_style,tune,llm_style_tune_032,4,6144,4096,bf16,NVIDIA GeForce RTX 4060,c00,32,32,32,2,2,8,0.0,0.0,231.1679944396019,247.3475135862827,0.8709103199517584,2,-1,-1,llm8_g2,0,
2026-03-03T02:13:18.390549+00:00,BUCKET,llm_style,tune,llm_style_tune_033,1,4096,1024,bf16,NVIDIA GeForce RTX 4060,c00,32,32,32,2,2,8,0.0,85.299,44.544000178575516,87.06047967076302,0.18832183832548333,1,-1,-1,llm8_g1,0,
2026-03-03T02:13:18.548868+00:00,BUCKET,llm_style,tune,llm_style_tune_034,4,4096,8192,bf16,NVIDIA GeForce RTX 4060,c00,32,32,32,2,2,8,0.0,0.0,298.8640069961548,344.68864142894745,0.8981859632346217,2,-1,-1,llm8_g2,0,
2026-03-03T02:13:18.568067+00:00,BUCKET,llm_style,tune,llm_style_tune_035,32,1024,3072,bf16,NVIDIA GeForce RTX 4060,c00,32,32,32,2,2,8,0.0,0.0,82.94399827718735,190.47424107789982,2.42725930967536,2,-1,-1,llm8_g2,0,
2026-03-03T02:13:18.585963+00:00,BUCKET,llm_style,tune,llm_style_tune_036,16,2048,1536,bf16,NVIDIA GeForce RTX 4060,c04,64,64,64,4,3,8,0.0,0.0,75.53600147366524,212.56160154938686,1.3326532254304604,7,-1,-1,llm8_g7,0,
2026-03-03T02:13:18.880469+00:00,BUCKET,llm_style,tune,llm_style_tune_037,1,2048,8192,bf16,NVIDIA GeForce RTX 4060,c10,64,128,64,8,3,8,0.0,294.455,184.32000279426575,256.2252847850322,0.18204444168467585,0,-1,-1,llm8_g0,0,
2026-03-03T02:13:18.916248+00:00,BUCKET,llm_style,tune,llm_style_tune_038,64,3072,2048,bf16,NVIDIA GeForce RTX 4060,c03,64,64,32,4,2,8,0.0,0.0,66.56000018119812,140.75776472687716,12.09895381321653,3,-1,-1,llm8_g3,0,
2026-03-03T02:13:18.939189+00:00,BUCKET,llm_style,tune,llm_style_tune_039,64,1536,3072,bf16,NVIDIA GeForce RTX 4060,c03,64,64,32,4,2,8,0.0,0.0,79.8719972372055,135.83360493183133,7.561846415412506,3,-1,-1,llm8_g3,0,
2026-03-03T02:13:19.061737+00:00,BUCKET,llm_style,tune,llm_style_tune_040,8,8192,3072,bf16,NVIDIA GeForce RTX 4060,c00,32,32,32,2,2,8,0.0,0.0,232.28799551725388,339.9571231007576,1.7334222679195308,2,-1,-1,llm8_g2,0,
2026-03-03T02:13:19.083846+00:00,BUCKET,llm_style,tune,llm_style_tune_041,2,1024,4096,bf16,NVIDIA GeForce RTX 4060,c00,32,32,32,2,2,8,0.0,0.0,70.65600156784058,165.35359978675842,0.2374492700933735,2,-1,-1,llm8_g2,0,
2026-03-03T02:13:19.233575+00:00,BUCKET,llm_style,tune,llm_style_tune_042,64,1536,6144,bf16,NVIDIA GeForce RTX 4060,c04,64,64,64,4,3,8,0.0,149.677,86.97599917650223,94.05120089650154,13.88842397255664,5,-1,-1,llm8_g5,0,
2026-03-03T02:13:19.263901+00:00,BUCKET,llm_style,tune,llm_style_tune_043,16,3072,1536,bf16,NVIDIA GeForce RTX 4060,c04,64,64,64,4,3,8,0.0,0.0,55.63200078904629,70.61120107769966,2.714174249683471,7,-1,-1,llm8_g7,0,
2026-03-03T02:13:19.289539+00:00,BUCKET,llm_style,tune,llm_style_tune_044,8,4096,1024,bf16,NVIDIA GeForce RTX 4060,c00,32,32,32,2,2,8,0.0,0.0,59.1839998960495,180.62303438782675,1.133902137703935,6,-1,-1,llm8_g6,0,
2026-03-03T02:13:19.358414+00:00,BUCKET,llm_style,tune,llm_style_tune_045,32,3072,4096,bf16,NVIDIA GeForce RTX 4060,c00,32,32,32,2,2,8,0.0,0.0,92.16000139713287,180.26496142148972,8.738133200864441,2,-1,-1,llm8_g2,0,
2026-03-03T02:13:19.444203+00:00,BUCKET,llm_style,tune,llm_style_tune_046,64,4096,4096,bf16,NVIDIA GeForce RTX 4060,c03,64,64,32,4,2,8,0.0,0.0,167.7279993891716,223.31392109394073,12.80337007429089,3,-1,-1,llm8_g3,0,
2026-03-03T02:13:19.604566+00:00,BUCKET,llm_style,tune,llm_style_tune_047,4,4096,8192,bf16,NVIDIA GeForce RTX 4060,c00,32,32,32,2,2,8,0.0,0.0,293.88800263404846,411.6889503598213,0.9133937200364651,2,-1,-1,llm8_g2,0,
2026-03-03T02:13:19.686143+00:00,BUCKET,llm_style,tune,llm_style_tune_048,2,4096,4096,bf16,NVIDIA GeForce RTX 4060,c00,32,32,32,2,2,8,0.0,0.0,160.08000075817108,233.84064465761176,0.4192207876196834,2,-1,-1,llm8_g2,0,
2026-03-03T02:13:19.711353+00:00,BUCKET,llm_style,tune,llm_style_tune_049,2,3072,2048,bf16,NVIDIA GeForce RTX 4060,c00,32,32,32,2,2,8,0.0,0.0,61.43999844789505,182.09791809320444,0.40960001034736665,2,-1,-1,llm8_g2,0,
2026-03-03T02:13:19.744774+00:00,BUCKET,llm_style,tune,llm_style_tune_050,4,8192,1024,bf16,NVIDIA GeForce RTX 4060,c00,32,32,32,2,2,8,0.0,0.0,59.39200147986412,76.26976311206818,1.1299310063283885,6,-1,-1,llm8_g6,0,
2026-03-03T02:13:19.906425+00:00,BUCKET,llm_style,tune,llm_style_tune_051,1,8192,4096,bf16,NVIDIA GeForce RTX 4060,c00,32,32,32,2,2,8,0.0,0.0,294.9120104312897,359.14462953805906,0.22755554750672122,2,-1,-1,llm8_g2,0,
2026-03-03T02:13:20.070136+00:00,BUCKET,llm_style,tune,llm_style_tune_052,8,4096,8192,bf16,NVIDIA GeForce RTX 4060,c00,32,32,32,2,2,8,0.0,0.0,300.84800720214844,371.7734313011167,1.7845254053461652,2,-1,-1,llm8_g2,0,
2026-03-03T02:13:20.095645+00:00,BUCKET,llm_style,tune,llm_style_tune_053,64,4096,1024,bf16,NVIDIA GeForce RTX 4060,c00,32,32,32,2,2,8,0.0,0.0,53.2160010188818,128.52224245667458,10.088524160421422,6,-1,-1,llm8_g6,0,
2026-03-03T02:13:20.111341+00:00,BUCKET,llm_style,tune,llm_style_tune_054,1,2048,1536,bf16,NVIDIA GeForce RTX 4060,c00,32,32,32,2,2,8,0.0,0.0,47.10400104522705,74.33215901255605,0.13356521442752262,1,-1,-1,llm8_g1,0,
2026-03-03T02:13:20.182199+00:00,BUCKET,llm_style,tune,llm_style_tune_055,64,6144,2048,bf16,NVIDIA GeForce RTX 4060,c03,64,64,32,4,2,8,0.0,0.0,96.0799977183342,158.2899211347102,16.763247025896415,3,-1,-1,llm8_g3,0,
2026-03-03T02:13:20.208462+00:00,BUCKET,llm_style,tune,llm_style_tune_056,16,1536,4096,bf16,NVIDIA GeForce RTX 4060,c00,32,32,32,2,2,8,0.0,0.0,64.94399905204773,131.76223598420614,3.1000030016422593,2,-1,-1,llm8_g2,0,
2026-03-03T02:13:20.290253+00:00,BUCKET,llm_style,tune,llm_style_tune_057,16,4096,4096,bf16,NVIDIA GeForce RTX 4060,c00,32,32,32,2,2,8,0.0,0.0,163.83999586105347,258.9075215160846,3.2768000827789328,2,-1,-1,llm8_g2,0,
2026-03-03T02:13:20.409403+00:00,BUCKET,llm_style,tune,llm_style_tune_058,1,3072,8192,bf16,NVIDIA GeForce RTX 4060,c10,64,128,64,8,3,8,0.0,0.0,227.32800245285034,349.8086354136467,0.2214054030164594,0,-1,-1,llm8_g0,0,
2026-03-03T02:13:20.448433+00:00,BUCKET,llm_style,tune,llm_style_tune_059,64,1024,8192,bf16,NVIDIA GeForce RTX 4060,c04,64,64,64,4,3,8,0.0,0.0,110.59200018644333,211.6633597016334,9.709037020668898,7,-1,-1,llm8_g7,0,
2026-03-03T02:13:20.494813+00:00,BUCKET,llm_style,tune,llm_style_tune_060,16,3072,3072,bf16,NVIDIA GeForce RTX 4060,c00,32,32,32,2,2,8,0.0,0.0,66.3519985973835,74.15232203900814,4.551330696644737,2,-1,-1,llm8_g2,0,
2026-03-03T02:13:20.505479+00:00,BUCKET,llm_style,tune,llm_style_tune_061,1,1024,1536,bf16,NVIDIA GeForce RTX 4060,c00,32,32,32,2,2,8,0.0,0.0,45.52000015974045,156.34176537394524,0.0691065023936928,1,-1,-1,llm8_g1,0,
2026-03-03T02:13:20.535705+00:00,BUCKET,llm_style,tune,llm_style_tune_062,32,6144,1024,bf16,NVIDIA GeForce RTX 4060,c00,32,32,32,2,2,8,0.0,0.0,50.12799985706806,180.55295772850488,8.032500501677722,6,-1,-1,llm8_g6,0,
2026-03-03T02:13:20.556699+00:00,BUCKET,llm_style,tune,llm_style_tune_063,4,1536,3072,bf16,NVIDIA GeForce RTX 4060,c00,32,32,32,2,2,8,0.0,0.0,70.12800127267838,152.61695951223373,0.5382833577877368,2,-1,-1,llm8_g2,0,
2026-03-03T02:13:20.590253+00:00,BUCKET,llm_style,eval,llm_style_eval_000,32,8192,1024,bf16,NVIDIA GeForce RTX 4060,c00,32,32,32,2,2,8,0.0,0.0,65.5359998345375,120.16799822449673,8.192000020682812,6,-1,-1,llm8_g6,0,
2026-03-03T02:13:20.621894+00:00,BUCKET,llm_style,eval,llm_style_eval_001,2,3072,2048,bf16,NVIDIA GeForce RTX 4060,c00,32,32,32,2,2,8,0.0,0.0,51.19999870657921,130.15007615089417,0.4915200124168399,2,-1,-1,llm8_g2,0,
2026-03-03T02:13:20.634148+00:00,BUCKET,llm_style,eval,llm_style_eval_002,32,1536,1536,bf16,NVIDIA GeForce RTX 4060,c00,32,32,32,2,2,8,0.0,0.0,47.10400104522705,109.26944240927679,3.2055651462605423,6,-1,-1,llm8_g6,0,
2026-03-03T02:13:20.928279+00:00,BUCKET,llm_style,eval,llm_style_eval_003,16,8192,6144,bf16,NVIDIA GeForce RTX 4060,c00,32,32,32,2,2,8,0.0,0.0,698.3680129051208,814.623054265976,2.306252156796327,2,-1,-1,llm8_g2,0,
2026-03-03T02:13:20.949148+00:00,BUCKET,llm_style,eval,llm_style_eval_004,2,3072,1536,bf16,NVIDIA GeForce RTX 4060,c00,32,32,32,2,2,8,0.0,0.0,45.05599848926067,156.59648016095161,0.41890910495522143,6,-1,-1,llm8_g6,0,
2026-03-03T02:13:21.080880+00:00,BUCKET,llm_style,eval,llm_style_eval_005,8,3072,8192,bf16,NVIDIA GeForce RTX 4060,c00,32,32,32,2,2,8,0.0,0.0,368.6400055885315,429.6601527929306,1.0922666501080551,2,-1,-1,llm8_g2,0,
2026-03-03T02:13:21.151661+00:00,BUCKET,llm_style,eval,llm_style_eval_006,64,2048,6144,bf16,NVIDIA GeForce RTX 4060,c04,64,64,64,4,3,8,0.0,0.0,233.92000049352646,271.2399938702582,6.885314349358392,5,-1,-1,llm8_g5,0,
2026-03-03T02:13:21.178042+00:00,BUCKET,llm_style,eval,llm_style_eval_007,8,3072,2048,bf16,NVIDIA GeForce RTX 4060,c00,32,32,32,2,2,8,0.0,0.0,89.08800035715103,190.3267173469066,1.1299310299529002,2,-1,-1,llm8_g2,0,
2026-03-03T02:13:21.206430+00:00,BUCKET,llm_style,eval,llm_style_eval_008,16,3072,2048,bf16,NVIDIA GeForce RTX 4060,c00,32,32,32,2,2,8,0.0,0.0,74.64000210165977,121.8553581833838,2.697301531768353,2,-1,-1,llm8_g2,0,
2026-03-03T02:13:21.404626+00:00,BUCKET,llm_style,eval,llm_style_eval_009,64,6144,6144,bf16,NVIDIA GeForce RTX 4060,c04,64,64,64,4,3,8,0.0,0.0,625.6159842014313,741.8739205598831,7.723329214754014,5,-1,-1,llm8_g5,0,
2026-03-03T02:13:21.450613+00:00,BUCKET,llm_style,eval,llm_style_eval_010,64,1536,6144,bf16,NVIDIA GeForce RTX 4060,c04,64,64,64,4,3,8,0.0,0.0,155.44000267982483,193.02400559186924,7.77122704049455,5,-1,-1,llm8_g5,0,
2026-03-03T02:13:21.622809+00:00,BUCKET,llm_style,eval,llm_style_eval_011,32,4096,8192,bf16,NVIDIA GeForce RTX 4060,c00,32,32,32,2,2,8,0.0,0.0,482.2400063276291,625.1971304416656,4.453142874548282,2,-1,-1,llm8_g2,0,
2026-03-03T02:13:21.635866+00:00,BUCKET,llm_style,eval,llm_style_eval_012,32,1536,1024,bf16,NVIDIA GeForce RTX 4060,c00,32,32,32,2,2,8,0.0,0.0,52.22399905323982,126.49472191929817,1.9275294467085655,6,-1,-1,llm8_g6,0,
2026-03-03T02:13:21.706223+00:00,BUCKET,llm_style,eval,llm_style_eval_013,32,2048,6144,bf16,NVIDIA GeForce RTX 4060,c00,32,32,32,2,2,8,0.0,0.0,200.70399343967438,302.1926414966582,4.012408294417177,2,-1,-1,llm8_g2,0,
2026-03-03T02:13:21.750236+00:00,BUCKET,llm_style,eval,llm_style_eval_014,2,8192,1024,bf16,NVIDIA GeForce RTX 4060,c00,32,32,32,2,2,8,0.0,0.0,94.2080020904541,202.19904839992495,0.3561739051400603,6,-1,-1,llm8_g6,0,
2026-03-03T02:13:21.771701+00:00,BUCKET,llm_style,eval,llm_style_eval_015,32,2048,2048,bf16,NVIDIA GeForce RTX 4060,c00,32,32,32,2,2,8,0.0,0.0,88.06400001049042,201.59487724304194,3.04818604614852,2,-1,-1,llm8_g2,0,
2026-03-03T02:13:21.869248+00:00,BUCKET,llm_style,eval,llm_style_eval_016,32,4096,4096,bf16,NVIDIA GeForce RTX 4060,c00,32,32,32,2,2,8,0.0,0.0,260.51200926303864,311.8716883659363,4.12165960040577,2,-1,-1,llm8_g2,0,
2026-03-03T02:13:22.125526+00:00,BUCKET,llm_style,eval,llm_style_eval_017,8,8192,6144,bf16,NVIDIA GeForce RTX 4060,c00,32,32,32,2,2,8,0.0,0.0,697.3440051078796,812.6540970802307,1.1548193748011335,2,-1,-1,llm8_g2,0,
2026-03-03T02:13:22.152291+00:00,BUCKET,llm_style,eval,llm_style_eval_018,8,2048,2048,bf16,NVIDIA GeForce RTX 4060,c00,32,32,32,2,2,8,0.0,0.0,105.47199845314026,163.86048331856728,0.6362718539918018,2,-1,-1,llm8_g2,0,
2026-03-03T02:13:22.171492+00:00,BUCKET,llm_style,eval,llm_style_eval_019,32,3072,1024,bf16,NVIDIA GeForce RTX 4060,c00,32,32,32,2,2,8,0.0,0.0,62.384000048041344,177.934719622135,3.2272151808951053,6,-1,-1,llm8_g6,0,
2026-03-03T02:13:22.197568+00:00,BUCKET,llm_style,eval,llm_style_eval_020,64,1536,3072,bf16,NVIDIA GeForce RTX 4060,c03,64,64,32,4,2,8,0.0,0.0,132.4639990925789,188.49792420864105,4.55957679171289,3,-1,-1,llm8_g3,0,
2026-03-03T02:13:22.228538+00:00,BUCKET,llm_style,eval,llm_style_eval_021,64,6144,1024,bf16,NVIDIA GeForce RTX 4060,c00,32,32,32,2,2,8,0.0,0.0,161.79199516773224,172.4563218653202,4.97741787018033,6,-1,-1,llm8_g6,0,
2026-03-03T02:13:22.268512+00:00,BUCKET,llm_style,eval,llm_style_eval_022,32,6144,1536,bf16,NVIDIA GeForce RTX 4060,c00,32,32,32,2,2,8,0.0,0.0,123.77599999308586,175.5135996639728,4.879619441844448,6,-1,-1,llm8_g6,0,
2026-03-03T02:13:22.300120+00:00,BUCKET,llm_style,eval,llm_style_eval_023,8,1024,4096,bf16,NVIDIA GeForce RTX 4060,c00,32,32,32,2,2,8,0.0,0.0,126.3360008597374,217.53055453300448,0.5311935120892942,2,-1,-1,llm8_g2,0,
2026-03-03T02:13:22.661633+00:00,BUCKET,llm_style,eval,llm_style_eval_024,64,8192,8192,bf16,NVIDIA GeForce RTX 4060,c04,64,64,64,4,3,8,0.0,0.0,1197.5679993629456,1241.518052816391,7.172815737034952,7,-1,-1,llm8_g7,0,
2026-03-03T02:13:22.757964+00:00,BUCKET,llm_style,eval,llm_style_eval_025,2,8192,2048,bf16,NVIDIA GeForce RTX 4060,c00,32,32,32,2,2,8,0.0,0.0,255.3279995918274,334.8227235674856,0.2628339395102833,2,-1,-1,llm8_g2,0,
2026-03-03T02:13:22.779244+00:00,BUCKET,llm_style,eval,llm_style_eval_026,32,4096,1024,bf16,NVIDIA GeForce RTX 4060,c00,32,32,32,2,2,8,0.0,0.0,79.28000018000603,156.12127289175987,3.385916440344534,6,-1,-1,llm8_g6,0,
2026-03-03T02:13:22.804843+00:00,BUCKET,llm_style,eval,llm_style_eval_027,8,4096,1536,bf16,NVIDIA GeForce RTX 4060,c00,32,32,32,2,2,8,0.0,0.0,86.01599931716919,117.27743819355963,1.1702857235759294,6,-1,-1,llm8_g6,0,
2026-03-03T02:13:22.817625+00:00,BUCKET,llm_style,eval,llm_style_eval_028,2,1536,1536,bf16,NVIDIA GeForce RTX 4060,c00,32,32,32,2,2,8,0.0,0.0,60.416001826524734,77.4246400594711,0.15620338510809476,6,-1,-1,llm8_g6,0,
2026-03-03T02:13:22.951442+00:00,BUCKET,llm_style,eval,llm_style_eval_029,16,3072,8192,bf16,NVIDIA GeForce RTX 4060,c00,32,32,32,2,2,8,0.0,0.0,374.783992767334,505.5180683732033,2.148721352941918,2,-1,-1,llm8_g2,0,
2026-03-03T02:13:22.965290+00:00,BUCKET,llm_style,eval,llm_style_eval_030,2,1536,1536,bf16,NVIDIA GeForce RTX 4060,c00,32,32,32,2,2,8,0.0,0.0,64.495999366045,129.71007905900476,0.14632200590364625,6,-1,-1,llm8_g6,0,
2026-03-03T02:13:23.006921+00:00,BUCKET,llm_style,eval,llm_style_eval_031,64,4096,2048,bf16,NVIDIA GeForce RTX 4060,c03,64,64,32,4,2,8,0.0,0.0,158.720001578331,187.51487642526624,6.7650063843408565,3,-1,-1,llm8_g3,0,
2026-03-03T02:13:23.187120+00:00,BUCKET,llm_style,eval,llm_style_eval_032,64,8192,4096,bf16,NVIDIA GeForce RTX 4060,c03,64,64,32,4,2,8,0.0,0.0,594.3680107593536,647.270410656929,7.226107761945043,3,-1,-1,llm8_g3,0,
2026-03-03T02:13:23.253331+00:00,BUCKET,llm_style,eval,llm_style_eval_033,32,4096,3072,bf16,NVIDIA GeForce RTX 4060,c00,32,32,32,2,2,8,0.0,0.0,162.1919944882393,182.45632201433176,4.965142518537767,2,-1,-1,llm8_g2,0,
2026-03-03T02:13:23.387281+00:00,BUCKET,llm_style,eval,llm_style_eval_034,64,6144,4096,bf16,NVIDIA GeForce RTX 4060,c03,64,64,32,4,2,8,0.0,0.0,396.65600657463074,432.24000453948975,8.120954728045767,3,-1,-1,llm8_g3,0,
2026-03-03T02:13:23.659824+00:00,BUCKET,llm_style,eval,llm_style_eval_035,64,6144,8192,bf16,NVIDIA GeForce RTX 4060,c04,64,64,64,4,3,8,0.0,0.0,738.1599843502045,760.0742435455322,8.727716322459868,7,-1,-1,llm8_g7,0,
2026-03-03T02:13:23.755212+00:00,BUCKET,llm_style,eval,llm_style_eval_036,4,8192,2048,bf16,NVIDIA GeForce RTX 4060,c00,32,32,32,2,2,8,0.0,0.0,257.3919892311096,351.026555597782,0.5214526232962413,2,-1,-1,llm8_g2,0,
2026-03-03T02:13:23.811238+00:00,BUCKET,llm_style,eval,llm_style_eval_037,64,2048,4096,bf16,NVIDIA GeForce RTX 4060,c03,64,64,32,4,2,8,0.0,0.0,195.5839991569519,241.52735859155644,5.48992672523454,3,-1,-1,llm8_g3,0,
2026-03-03T02:13:23.862705+00:00,BUCKET,llm_style,eval,llm_style_eval_038,64,4096,2048,bf16,NVIDIA GeForce RTX 4060,c03,64,64,32,4,2,8,0.0,0.0,182.27200210094452,237.29152202606195,5.890876336593639,3,-1,-1,llm8_g3,0,
2026-03-03T02:13:23.937664+00:00,BUCKET,llm_style,eval,llm_style_eval_039,64,6144,2048,bf16,NVIDIA GeForce RTX 4060,c03,64,64,32,4,2,8,0.0,0.0,218.1120067834854,392.24575757980324,7.384337798509263,3,-1,-1,llm8_g3,0,
2026-03-03T02:13:24.035577+00:00,BUCKET,llm_style,eval,llm_style_eval_040,8,6144,3072,bf16,NVIDIA GeForce RTX 4060,c00,32,32,32,2,2,8,0.0,0.0,280.0320088863373,296.64256721735,1.0784120329707567,2,-1,-1,llm8_g2,0,
2026-03-03T02:13:24.099817+00:00,BUCKET,llm_style,eval,llm_style_eval_041,2,8192,1536,bf16,NVIDIA GeForce RTX 4060,c00,32,32,32,2,2,8,0.0,0.0,135.16800105571747,176.0444790124892,0.3723636334553238,6,-1,-1,llm8_g6,0,
2026-03-03T02:13:24.113816+00:00,BUCKET,llm_style,eval,llm_style_eval_042,32,1536,1536,bf16,NVIDIA GeForce RTX 4060,c00,32,32,32,2,2,8,0.0,0.0,72.7040022611618,114.31263707578178,2.07684500583073,6,-1,-1,llm8_g6,0,
2026-03-03T02:13:24.137215+00:00,BUCKET,llm_style,eval,llm_style_eval_043,64,1536,3072,bf16,NVIDIA GeForce RTX 4060,c03,64,64,32,4,2,8,0.0,0.0,131.071999669075,144.94720071554184,4.608000011634081,3,-1,-1,llm8_g3,0,
2026-03-03T02:13:24.147956+00:00,BUCKET,llm_style,eval,llm_style_eval_044,2,1536,1024,bf16,NVIDIA GeForce RTX 4060,c00,32,32,32,2,2,8,0.0,0.0,63.48799914121628,158.19776110351066,0.09909677553400166,6,-1,-1,llm8_g6,0,
2026-03-03T02:13:24.220507+00:00,BUCKET,llm_style,eval,llm_style_eval_045,64,4096,3072,bf16,NVIDIA GeForce RTX 4060,c03,64,64,32,4,2,8,0.0,0.0,252.8959959745407,282.030093371868,6.36867630028489,3,-1,-1,llm8_g3,0,
2026-03-03T02:13:24.270921+00:00,BUCKET,llm_style,eval,llm_style_eval_046,64,2048,4096,bf16,NVIDIA GeForce RTX 4060,c03,64,64,32,4,2,8,0.0,0.0,194.5600062608719,272.967671751976,5.5188208750378775,3,-1,-1,llm8_g3,0,
2026-03-03T02:13:24.375133+00:00,BUCKET,llm_style,eval,llm_style_eval_047,2,6144,3072,bf16,NVIDIA GeForce RTX 4060,c00,32,32,32,2,2,8,0.0,0.0,280.2880108356476,398.84800046682324,0.2693567654746012,2,-1,-1,llm8_g2,0,
2026-03-03T02:13:24.550366+00:00,BUCKET,llm_style,eval,llm_style_eval_048,16,4096,8192,bf16,NVIDIA GeForce RTX 4060,c00,32,32,32,2,2,8,0.0,0.0,477.183997631073,513.4979289770126,2.2501631012994405,2,-1,-1,llm8_g2,0,
2026-03-03T02:13:24.581394+00:00,BUCKET,llm_style,eval,llm_style_eval_049,16,2048,3072,bf16,NVIDIA GeForce RTX 4060,c00,32,32,32,2,2,8,0.0,0.0,128.00000607967377,264.40191641449917,1.5728639252929724,2,-1,-1,llm8_g2,0,
2026-03-03T02:13:24.593926+00:00,BUCKET,llm_style,eval,llm_style_eval_050,16,1024,1536,bf16,NVIDIA GeForce RTX 4060,c04,64,64,64,4,3,8,0.0,0.0,79.3599970638752,163.57183873653406,0.6342193783032667,7,-1,-1,llm8_g7,0,
2026-03-03T02:13:24.634115+00:00,BUCKET,llm_style,eval,llm_style_eval_051,4,2048,4096,bf16,NVIDIA GeForce RTX 4060,c00,32,32,32,2,2,8,0.0,0.0,162.7039983868599,231.76895871758438,0.41245983298109146,2,-1,-1,llm8_g2,0,
2026-03-03T02:13:24.686187+00:00,BUCKET,llm_style,eval,llm_style_eval_052,4,1024,6144,bf16,NVIDIA GeForce RTX 4060,c00,32,32,32,2,2,8,0.0,0.0,201.21600478887558,343.3235113322731,0.25013739862696366,2,-1,-1,llm8_g2,0,
2026-03-03T02:13:24.765513+00:00,BUCKET,llm_style,eval,llm_style_eval_053,64,6144,2048,bf16,NVIDIA GeForce RTX 4060,c03,64,64,32,4,2,8,0.0,0.0,269.1680043935776,327.6998350024222,5.983670829037174,3,-1,-1,llm8_g3,0,
2026-03-03T02:13:24.792258+00:00,BUCKET,llm_style,eval,llm_style_eval_054,2,3072,2048,bf16,NVIDIA GeForce RTX 4060,c00,32,32,32,2,2,8,0.0,0.0,97.28000313043594,145.59552326798433,0.25869472851740055,2,-1,-1,llm8_g2,0,
2026-03-03T02:13:24.802099+00:00,BUCKET,llm_style,eval,llm_style_eval_055,4,1024,1024,bf16,NVIDIA GeForce RTX 4060,c00,32,32,32,2,2,8,0.0,0.0,57.34400078654289,260.4134421050547,0.14628571227922732,6,-1,-1,llm8_g6,0,
2026-03-03T02:13:24.815202+00:00,BUCKET,llm_style,eval,llm_style_eval_056,2,1024,1024,bf16,NVIDIA GeForce RTX 4060,c00,32,32,32,2,2,8,0.0,0.0,63.48799914121628,120.79104334115962,0.06606451702266777,6,-1,-1,llm8_g6,0,
2026-03-03T02:13:24.849622+00:00,BUCKET,llm_style,eval,llm_style_eval_057,2,1024,6144,bf16,NVIDIA GeForce RTX 4060,c00,32,32,32,2,2,8,0.0,0.0,217.95199811458588,425.8918383717534,0.11546498411438899,2,-1,-1,llm8_g2,0,
2026-03-03T02:13:24.866205+00:00,BUCKET,llm_style,eval,llm_style_eval_058,2,2048,1536,bf16,NVIDIA GeForce RTX 4060,c00,32,32,32,2,2,8,0.0,0.0,78.31999659538269,154.98047992587084,0.16066027256111776,6,-1,-1,llm8_g6,0,
2026-03-03T02:13:25.148071+00:00,BUCKET,llm_style,eval,llm_style_eval_059,8,8192,6144,bf16,NVIDIA GeForce RTX 4060,c00,32,32,32,2,2,8,0.0,0.0,703.8879990577698,747.0591956377029,1.1440831056616814,2,-1,-1,llm8_g2,0,
2026-03-03T02:13:25.363605+00:00,BUCKET,llm_style,eval,llm_style_eval_060,1,4096,8192,bf16,NVIDIA GeForce RTX 4060,c10,64,128,64,8,3,8,0.0,0.0,1017.7119970321655,1202.0736181735988,0.06594091864466738,0,-1,-1,llm8_g0,0,
2026-03-03T02:13:25.393439+00:00,BUCKET,llm_style,eval,llm_style_eval_061,32,1536,3072,bf16,NVIDIA GeForce RTX 4060,c00,32,32,32,2,2,8,0.0,0.0,128.00000607967377,245.54496496915812,2.3592958879394583,2,-1,-1,llm8_g2,0,
2026-03-03T02:13:25.423486+00:00,BUCKET,llm_style,eval,llm_style_eval_062,8,6144,1024,bf16,NVIDIA GeForce RTX 4060,c00,32,32,32,2,2,8,0.0,0.0,85.42399853467941,235.4073613882064,1.178395974512173,6,-1,-1,llm8_g6,0,
2026-03-03T02:13:25.616473+00:00,BUCKET,llm_style,eval,llm_style_eval_063,64,8192,4096,bf16,NVIDIA GeForce RTX 4060,c03,64,64,32,4,2,8,0.0,0.0,863.9360070228577,1029.9385249614716,4.9713951740483076,3,-1,-1,llm8_g3,0,
2026-03-03T02:13:25.645875+00:00,BUCKET,llm_style,eval,llm_style_eval_064,16,6144,1024,bf16,NVIDIA GeForce RTX 4060,c00,32,32,32,2,2,8,0.0,0.0,121.24800309538841,168.98272454738606,1.6604528475542153,6,-1,-1,llm8_g6,0,
2026-03-03T02:13:25.816585+00:00,BUCKET,llm_style,eval,llm_style_eval_065,8,8192,4096,bf16,NVIDIA GeForce RTX 4060,c00,32,32,32,2,2,8,0.0,0.0,490.4960095882416,511.386553645134,1.094546951463864,2,-1,-1,llm8_g2,0,
2026-03-03T02:13:25.844193+00:00,BUCKET,llm_style,eval,llm_style_eval_066,32,1536,3072,bf16,NVIDIA GeForce RTX 4060,c00,32,32,32,2,2,8,0.0,0.0,158.720001578331,172.0729586482048,1.902658045595866,2,-1,-1,llm8_g2,0,
2026-03-03T02:13:25.976709+00:00,BUCKET,llm_style,eval,llm_style_eval_067,8,8192,3072,bf16,NVIDIA GeForce RTX 4060,c00,32,32,32,2,2,8,0.0,0.0,379.90400195121765,427.12832212448114,1.0598813961736142,2,-1,-1,llm8_g2,0,
2026-03-03T02:13:26.010409+00:00,BUCKET,llm_style,eval,llm_style_eval_068,64,1536,3072,bf16,NVIDIA GeForce RTX 4060,c03,64,64,32,4,2,8,0.0,0.0,207.85599946975708,303.22687834501266,2.905760610907354,3,-1,-1,llm8_g3,0,
2026-03-03T02:13:26.311412+00:00,BUCKET,llm_style,eval,llm_style_eval_069,64,8192,6144,bf16,NVIDIA GeForce RTX 4060,c04,64,64,64,4,3,8,0.0,0.0,1372.54399061203,1546.444832086563,4.693802885783829,5,-1,-1,llm8_g5,0,
2026-03-03T02:13:26.358361+00:00,BUCKET,llm_style,eval,llm_style_eval_070,8,8192,1024,bf16,NVIDIA GeForce RTX 4060,c00,32,32,32,2,2,8,0.0,0.0,158.720001578331,330.6572902202605,0.8456257980426071,6,-1,-1,llm8_g6,0,
2026-03-03T02:13:26.458733+00:00,BUCKET,llm_style,eval,llm_style_eval_071,2,6144,3072,bf16,NVIDIA GeForce RTX 4060,c00,32,32,32,2,2,8,0.0,0.0,285.16799211502075,395.62367498874664,0.2647473562514988,2,-1,-1,llm8_g2,0,
2026-03-03T02:13:26.470765+00:00,BUCKET,llm_style,eval,llm_style_eval_072,64,1024,1024,bf16,NVIDIA GeForce RTX 4060,c00,32,32,32,2,2,8,0.0,0.0,77.82399654388428,143.56480389833445,1.7246316555371939,6,-1,-1,llm8_g6,0,
2026-03-03T02:13:26.560821+00:00,BUCKET,llm_style,eval,llm_style_eval_073,1,8192,2048,bf16,NVIDIA GeForce RTX 4060,c00,32,32,32,2,2,8,0.0,0.0,257.00800120830536,273.3606496453285,0.13055792754406928,2,-1,-1,llm8_g2,0,
2026-03-03T02:13:26.576481+00:00,BUCKET,llm_style,eval,llm_style_eval_074,64,1024,1536,bf16,NVIDIA GeForce RTX 4060,c03,64,64,32,4,2,8,0.0,0.0,100.3040000796318,183.21632504463196,2.007164139417829,4,-1,-1,llm8_g4,0,
2026-03-03T02:13:26.595344+00:00,BUCKET,llm_style,eval,llm_style_eval_075,2,1536,2048,bf16,NVIDIA GeForce RTX 4060,c00,32,32,32,2,2,8,0.0,0.0,92.06400066614151,161.43008142709726,0.1366757028692501,2,-1,-1,llm8_g2,0,
2026-03-03T02:13:26.634727+00:00,BUCKET,llm_style,eval,llm_style_eval_076,64,2048,3072,bf16,NVIDIA GeForce RTX 4060,c03,64,64,32,4,2,8,0.0,0.0,193.93600523471832,307.7219185233116,4.152433515506044,3,-1,-1,llm8_g3,0,
2026-03-03T02:13:26.820831+00:00,BUCKET,llm_style,eval,llm_style_eval_077,1,3072,8192,bf16,NVIDIA GeForce RTX 4060,c10,64,128,64,8,3,8,0.0,0.0,505.8559775352478,547.3116934299469,0.09949798012714581,0,-1,-1,llm8_g0,0,
2026-03-03T02:13:26.839352+00:00,BUCKET,llm_style,eval,llm_style_eval_078,1,1024,2048,bf16,NVIDIA GeForce RTX 4060,c00,32,32,32,2,2,8,0.0,0.0,95.98400071263313,280.8524741232394,0.04369794933384099,2,-1,-1,llm8_g2,0,
2026-03-03T02:13:26.862261+00:00,BUCKET,llm_style,eval,llm_style_eval_079,64,1536,2048,bf16,NVIDIA GeForce RTX 4060,c03,64,64,32,4,2,8,0.0,0.0,129.96800243854523,255.7439932227134,3.0980947344358296,3,-1,-1,llm8_g3,0,
2026-03-03T02:13:26.874212+00:00,BUCKET,llm_style,eval,llm_style_eval_080,4,1536,1024,bf16,NVIDIA GeForce RTX 4060,c00,32,32,32,2,2,8,0.0,0.0,64.36799839138985,156.5593570470809,0.19548397207397314,6,-1,-1,llm8_g6,0,
2026-03-03T02:13:27.005163+00:00,BUCKET,llm_style,eval,llm_style_eval_081,4,4096,6144,bf16,NVIDIA GeForce RTX 4060,c00,32,32,32,2,2,8,0.0,0.0,380.2720010280609,557.0966446399689,0.529427860730519,2,-1,-1,llm8_g2,0,
2026-03-03T02:13:27.022623+00:00,BUCKET,llm_style,eval,llm_style_eval_082,64,1024,2048,bf16,NVIDIA GeForce RTX 4060,c03,64,64,32,4,2,8,0.0,0.0,123.90399724245071,174.8937612771988,2.1664793870591237,3,-1,-1,llm8_g3,0,
2026-03-03T02:13:27.114631+00:00,BUCKET,llm_style,eval,llm_style_eval_083,8,4096,4096,bf16,NVIDIA GeForce RTX 4060,c00,32,32,32,2,2,8,0.0,0.0,269.3119943141937,327.60832279920567,0.996745268191913,2,-1,-1,llm8_g2,0,
2026-03-03T02:13:27.165457+00:00,BUCKET,llm_style,eval,llm_style_eval_084,64,3072,3072,bf16,NVIDIA GeForce RTX 4060,c03,64,64,32,4,2,8,0.0,0.0,212.99199759960175,289.3823933601378,5.671384679300546,3,-1,-1,llm8_g3,0,
2026-03-03T02:13:27.307598+00:00,BUCKET,llm_style,eval,llm_style_eval_085,1,3072,8192,bf16,NVIDIA GeForce RTX 4060,c10,64,128,64,8,3,8,0.0,0.0,536.048024892807,581.5398246049881,0.09389391558725502,0,-1,-1,llm8_g0,0,
2026-03-03T02:13:27.321232+00:00,BUCKET,llm_style,eval,llm_style_eval_086,8,1536,1024,bf16,NVIDIA GeForce RTX 4060,c00,32,32,32,2,2,8,0.0,0.0,63.48799914121628,149.4118419289588,0.39638710213600664,6,-1,-1,llm8_g6,0,
2026-03-03T02:13:27.341880+00:00,BUCKET,llm_style,eval,llm_style_eval_087,16,1024,3072,bf16,NVIDIA GeForce RTX 4060,c00,32,32,32,2,2,8,0.0,0.0,136.19199395179749,231.50592386722565,0.7391278523730831,2,-1,-1,llm8_g2,0,
2026-03-03T02:13:27.433270+00:00,BUCKET,llm_style,eval,llm_style_eval_088,8,8192,2048,bf16,NVIDIA GeForce RTX 4060,c00,32,32,32,2,2,8,0.0,0.0,258.04799795150757,351.6415923833846,1.0402539765119372,2,-1,-1,llm8_g2,0,
2026-03-03T02:13:27.573907+00:00,BUCKET,llm_style,eval,llm_style_eval_089,64,6144,4096,bf16,NVIDIA GeForce RTX 4060,c03,64,64,32,4,2,8,0.0,0.0,543.1840121746063,609.2316734790802,5.930265618651048,3,-1,-1,llm8_g3,0,
2026-03-03T02:13:27.632993+00:00,BUCKET,llm_style,eval,llm_style_eval_090,2,1536,6144,bf16,NVIDIA GeForce RTX 4060,c00,32,32,32,2,2,8,0.0,0.0,227.11999714374542,239.5628859102726,0.16620613100883685,2,-1,-1,llm8_g2,0,
2026-03-03T02:13:27.645332+00:00,BUCKET,llm_style,eval,llm_style_eval_091,2,1024,1024,bf16,NVIDIA GeForce RTX 4060,c00,32,32,32,2,2,8,0.0,0.0,63.29599767923355,317.2038422524925,0.06626491648422325,6,-1,-1,llm8_g6,0,
2026-03-03T02:13:27.734107+00:00,BUCKET,llm_style,eval,llm_style_eval_092,4,4096,4096,bf16,NVIDIA GeForce RTX 4060,c00,32,32,32,2,2,8,0.0,0.0,261.1199915409088,282.3475223779678,0.5140078597887536,2,-1,-1,llm8_g2,0,
2026-03-03T02:13:27.754983+00:00,BUCKET,llm_style,eval,llm_style_eval_093,32,2048,1536,bf16,NVIDIA GeForce RTX 4060,c00,32,32,32,2,2,8,0.0,0.0,95.23200243711472,240.26527881622292,2.114064462027285,6,-1,-1,llm8_g6,0,
2026-03-03T02:13:27.777169+00:00,BUCKET,llm_style,eval,llm_style_eval_094,2,2048,2048,bf16,NVIDIA GeForce RTX 4060,c00,32,32,32,2,2,8,0.0,0.0,101.3759970664978,132.89728298783294,0.16549495428385233,2,-1,-1,llm8_g2,0,
2026-03-03T02:13:27.967371+00:00,BUCKET,llm_style,eval,llm_style_eval_095,1,6144,6144,bf16,NVIDIA GeForce RTX 4060,c00,32,32,32,2,2,8,0.0,0.0,527.3600220680237,558.2316899299622,0.14316115905779003,2,-1,-1,llm8_g2,0,
2026-03-03T02:13:28.008466+00:00,BUCKET,llm_style,eval,llm_style_eval_096,64,1024,6144,bf16,NVIDIA GeForce RTX 4060,c04,64,64,64,4,3,8,0.0,0.0,243.19999665021896,324.64896529912926,3.3112926771879336,5,-1,-1,llm8_g5,0,
2026-03-03T02:13:28.031957+00:00,BUCKET,llm_style,eval,llm_style_eval_097,64,1536,2048,bf16,NVIDIA GeForce RTX 4060,c03,64,64,32,4,2,8,0.0,0.0,133.12000036239624,162.2835226356982,3.0247384533041326,3,-1,-1,llm8_g3,0,
2026-03-03T02:13:28.046643+00:00,BUCKET,llm_style,eval,llm_style_eval_098,32,1024,2048,bf16,NVIDIA GeForce RTX 4060,c00,32,32,32,2,2,8,0.0,0.0,104.35199737548828,133.7123159319162,1.2862018109442246,2,-1,-1,llm8_g2,0,
2026-03-03T02:13:28.086558+00:00,BUCKET,llm_style,eval,llm_style_eval_099,1,6144,1536,bf16,NVIDIA GeForce RTX 4060,c00,32,32,32,2,2,8,0.0,0.0,134.14399325847626,181.69856175780285,0.14070229714745258,1,-1,-1,llm8_g1,0,
2026-03-03T02:13:28.128797+00:00,BUCKET,llm_style,eval,llm_style_eval_100,64,6144,1024,bf16,NVIDIA GeForce RTX 4060,c00,32,32,32,2,2,8,0.0,0.0,202.7519941329956,327.89503484964337,3.9718789028124557,6,-1,-1,llm8_g6,0,
2026-03-03T02:13:28.208638+00:00,BUCKET,llm_style,eval,llm_style_eval_101,64,8192,1536,bf16,NVIDIA GeForce RTX 4060,c03,64,64,32,4,2,8,0.0,0.0,415.120005607605,484.5977526903152,3.879872601279647,4,-1,-1,llm8_g4,0,
2026-03-03T02:13:28.254965+00:00,BUCKET,llm_style,eval,llm_style_eval_102,32,6144,1536,bf16,NVIDIA GeForce RTX 4060,c00,32,32,32,2,2,8,0.0,0.0,222.20799326896667,284.0851253271102,2.7180830316438085,6,-1,-1,llm8_g6,0,
2026-03-03T02:13:28.415019+00:00,BUCKET,llm_style,eval,llm_style_eval_103,64,4096,6144,bf16,NVIDIA GeForce RTX 4060,c04,64,64,64,4,3,8,0.0,0.0,817.1360194683075,857.4095880985259,3.942092130629587,5,-1,-1,llm8_g5,0,
2026-03-03T02:13:28.518719+00:00,BUCKET,llm_style,eval,llm_style_eval_104,2,6144,3072,bf16,NVIDIA GeForce RTX 4060,c00,32,32,32,2,2,8,0.0,0.0,324.6079981327057,341.55519276857376,0.2325804429782881,2,-1,-1,llm8_g2,0,
2026-03-03T02:13:28.594422+00:00,BUCKET,llm_style,eval,llm_style_eval_105,1,4096,3072,bf16,NVIDIA GeForce RTX 4060,c00,32,32,32,2,2,8,0.0,0.0,262.06399500370026,294.75103467702854,0.09602930764924295,2,-1,-1,llm8_g2,0,
2026-03-03T02:13:28.634688+00:00,BUCKET,llm_style,eval,llm_style_eval_106,64,4096,1536,bf16,NVIDIA GeForce RTX 4060,c03,64,64,32,4,2,8,0.0,0.0,252.9280036687851,321.1878365278243,3.1839351764882737,4,-1,-1,llm8_g4,0,
2026-03-03T02:13:28.686454+00:00,BUCKET,llm_style,eval,llm_style_eval_107,64,6144,1536,bf16,NVIDIA GeForce RTX 4060,c03,64,64,32,4,2,8,0.0,0.0,309.7600042819977,317.2972744703293,3.8996627560099855,4,-1,-1,llm8_g4,0,
2026-03-03T02:13:28.799899+00:00,BUCKET,llm_style,eval,llm_style_eval_108,16,3072,6144,bf16,NVIDIA GeForce RTX 4060,c00,32,32,32,2,2,8,0.0,0.0,415.120005607605,487.8627237677573,1.4549522254798677,2,-1,-1,llm8_g2,0,
2026-03-03T02:13:28.830439+00:00,BUCKET,llm_style,eval,llm_style_eval_109,64,1024,2048,bf16,NVIDIA GeForce RTX 4060,c03,64,64,32,4,2,8,0.0,0.0,168.95999759435654,290.1075279712676,1.5887515377720747,3,-1,-1,llm8_g3,0,
2026-03-03T02:13:28.861570+00:00,BUCKET,llm_style,eval,llm_style_eval_110,16,1536,3072,bf16,NVIDIA GeForce RTX 4060,c00,32,32,32,2,2,8,0.0,0.0,159.18400138616562,216.6604815423488,0.9485560275225164,2,-1,-1,llm8_g2,0,
2026-03-03T02:13:29.124963+00:00,BUCKET,llm_style,eval,llm_style_eval_111,64,6144,6144,bf16,NVIDIA GeForce RTX 4060,c04,64,64,64,4,3,8,0.0,0.0,1172.9599833488464,1222.5705671310425,4.119354689496665,5,-1,-1,llm8_g5,0,
2026-03-03T02:13:29.328115+00:00,BUCKET,llm_style,eval,llm_style_eval_112,16,6144,6144,bf16,NVIDIA GeForce RTX 4060,c00,32,32,32,2,2,8,0.0,0.0,684.0320229530334,695.3369498252869,1.7659400605034834,2,-1,-1,llm8_g2,0,
2026-03-03T02:13:29.466208+00:00,BUCKET,llm_style,eval,llm_style_eval_113,1,8192,3072,bf16,NVIDIA GeForce RTX 4060,c00,32,32,32,2,2,8,0.0,0.0,513.0239725112915,531.3990545272827,0.09810778968792187,2,-1,-1,llm8_g2,0,
2026-03-03T02:13:29.489396+00:00,BUCKET,llm_style,eval,llm_style_eval_114,64,3072,1024,bf16,NVIDIA GeForce RTX 4060,c00,32,32,32,2,2,8,0.0,0.0,173.0560064315796,206.7135985195636,2.326721807019135,6,-1,-1,llm8_g6,0,
2026-03-03T02:13:29.542128+00:00,BUCKET,llm_style,eval,llm_style_eval_115,8,3072,3072,bf16,NVIDIA GeForce RTX 4060,c00,32,32,32,2,2,8,0.0,0.0,205.82400262355804,250.91071903705586,0.7336119309474431,2,-1,-1,llm8_g2,0,
2026-03-03T02:13:29.572775+00:00,BUCKET,llm_style,eval,llm_style_eval_116,16,3072,2048,bf16,NVIDIA GeForce RTX 4060,c00,32,32,32,2,2,8,0.0,0.0,168.44800114631653,216.51455864310256,1.195185402200912,2,-1,-1,llm8_g2,0,
2026-03-03T02:13:29.584293+00:00,BUCKET,llm_style,eval,llm_style_eval_117,64,1024,1024,bf16,NVIDIA GeForce RTX 4060,c00,32,32,32,2,2,8,0.0,0.0,99.72799941897392,124.31616023182868,1.3458379670901548,6,-1,-1,llm8_g6,0,
2026-03-03T02:13:29.629673+00:00,BUCKET,llm_style,eval,llm_style_eval_118,1,6144,1536,bf16,NVIDIA GeForce RTX 4060,c00,32,32,32,2,2,8,0.0,0.0,205.1839977502823,217.98976555466652,0.09198752440222416,1,-1,-1,llm8_g1,0,
2026-03-03T02:13:29.646490+00:00,BUCKET,llm_style,eval,llm_style_eval_119,1,1024,1536,bf16,NVIDIA GeForce RTX 4060,c00,32,32,32,2,2,8,0.0,0.0,112.64000087976456,235.18207386136052,0.027927272509149285,1,-1,-1,llm8_g1,0,
2026-03-03T02:13:29.742957+00:00,BUCKET,llm_style,eval,llm_style_eval_120,16,8192,2048,bf16,NVIDIA GeForce RTX 4060,c00,32,32,32,2,2,8,0.0,0.0,362.4959886074066,377.41569221019745,1.4810395945689936,2,-1,-1,llm8_g2,0,
2026-03-03T02:13:29.777914+00:00,BUCKET,llm_style,eval,llm_style_eval_121,64,4096,1024,bf16,NVIDIA GeForce RTX 4060,c00,32,32,32,2,2,8,0.0,0.0,201.1839970946312,267.39712476730335,2.6685567428480472,6,-1,-1,llm8_g6,0,
2026-03-03T02:13:29.809906+00:00,BUCKET,llm_style,eval,llm_style_eval_122,4,6144,1024,bf16,NVIDIA GeForce RTX 4060,c00,32,32,32,2,2,8,0.0,0.0,130.048006772995,260.0150337815285,0.38702360189077173,6,-1,-1,llm8_g6,0,
2026-03-03T02:13:29.993235+00:00,BUCKET,llm_style,eval,llm_style_eval_123,4,8192,4096,bf16,NVIDIA GeForce RTX 4060,c00,32,32,32,2,2,8,0.0,0.0,700.4160284996033,772.7103781700133,0.38325144639397984,2,-1,-1,llm8_g2,0,
2026-03-03T02:13:30.142988+00:00,BUCKET,llm_style,eval,llm_style_eval_124,4,3072,8192,bf16,NVIDIA GeForce RTX 4060,c00,32,32,32,2,2,8,0.0,0.0,593.9199924468994,620.5440163612366,0.33897931465575304,2,-1,-1,llm8_g2,0,
2026-03-03T02:13:30.265446+00:00,BUCKET,llm_style,eval,llm_style_eval_125,64,8192,2048,bf16,NVIDIA GeForce RTX 4060,c03,64,64,32,4,2,8,0.0,0.0,682.4159920215607,829.1199928522109,3.1468835330754548,3,-1,-1,llm8_g3,0,
2026-03-03T02:13:30.283979+00:00,BUCKET,llm_style,eval,llm_style_eval_126,8,1536,1536,bf16,NVIDIA GeForce RTX 4060,c00,32,32,32,2,2,8,0.0,0.0,123.90399724245071,259.6147146821022,0.30466116380518926,6,-1,-1,llm8_g6,0,
2026-03-03T02:13:30.301336+00:00,BUCKET,llm_style,eval,llm_style_eval_127,64,2048,1024,bf16,NVIDIA GeForce RTX 4060,c00,32,32,32,2,2,8,0.0,0.0,143.3439999818802,234.84416499733916,1.8726661460119178,6,-1,-1,llm8_g6,0,
2026-03-03T02:13:30.388743+00:00,BUCKET,llm_style,eval,llm_style_eval_128,64,6144,2048,bf16,NVIDIA GeForce RTX 4060,c03,64,64,32,4,2,8,0.0,0.0,487.8079891204834,580.2291190624235,3.301735051334298,3,-1,-1,llm8_g3,0,
2026-03-03T02:13:30.423425+00:00,BUCKET,llm_style,eval,llm_style_eval_129,32,6144,1024,bf16,NVIDIA GeForce RTX 4060,c00,32,32,32,2,2,8,0.0,0.0,190.94400107860565,243.31519171595556,2.108750113779381,6,-1,-1,llm8_g6,0,
2026-03-03T02:13:30.541373+00:00,BUCKET,llm_style,eval,llm_style_eval_130,64,8192,2048,bf16,NVIDIA GeForce RTX 4060,c03,64,64,32,4,2,8,0.0,0.0,688.1119906902313,860.7628840208051,3.120834511030541,3,-1,-1,llm8_g3,0,
2026-03-03T02:13:30.725709+00:00,BUCKET,llm_style,eval,llm_style_eval_131,64,4096,6144,bf16,NVIDIA GeForce RTX 4060,c04,64,64,64,4,3,8,0.0,0.0,1011.7119550704956,1110.1827669143677,3.183935364068666,5,-1,-1,llm8_g5,0,
2026-03-03T02:13:30.821033+00:00,BUCKET,llm_style,eval,llm_style_eval_132,16,8192,1536,bf16,NVIDIA GeForce RTX 4060,c04,64,64,64,4,3,8,0.0,0.0,557.5680136680603,590.4486352205276,0.72215976191151,7,-1,-1,llm8_g7,0,
2026-03-03T02:13:31.181134+00:00,BUCKET,llm_style,eval,llm_style_eval_133,32,8192,6144,bf16,NVIDIA GeForce RTX 4060,c00,32,32,32,2,2,8,0.0,0.0,1386.4959478378296,1501.9110298156738,2.3232851686464273,2,-1,-1,llm8_g2,0,
2026-03-03T02:13:31.524197+00:00,BUCKET,llm_style,eval,llm_style_eval_134,64,8192,6144,bf16,NVIDIA GeForce RTX 4060,c04,64,64,64,4,3,8,0.0,0.0,1969.1519737243652,2161.9710898399353,3.2716880311756937,5,-1,-1,llm8_g5,0,
2026-03-03T02:13:31.563305+00:00,BUCKET,llm_style,eval,llm_style_eval_135,4,3072,2048,bf16,NVIDIA GeForce RTX 4060,c00,32,32,32,2,2,8,0.0,0.0,166.73599928617477,262.2102355957031,0.30186431373835504,2,-1,-1,llm8_g2,0,
2026-03-03T02:13:31.617570+00:00,BUCKET,llm_style,eval,llm_style_eval_136,64,3072,3072,bf16,NVIDIA GeForce RTX 4060,c03,64,64,32,4,2,8,0.0,0.0,230.30400276184082,271.0220861434936,5.245065381035346,3,-1,-1,llm8_g3,0,
2026-03-03T02:13:31.723499+00:00,BUCKET,llm_style,eval,llm_style_eval_137,1,3072,6144,bf16,NVIDIA GeForce RTX 4060,c00,32,32,32,2,2,8,0.0,0.0,327.4240046739578,433.3158302307129,0.11529006872171582,2,-1,-1,llm8_g2,0,
2026-03-03T02:13:31.761309+00:00,BUCKET,llm_style,eval,llm_style_eval_138,1,2048,3072,bf16,NVIDIA GeForce RTX 4060,c00,32,32,32,2,2,8,0.0,0.0,137.58400082588196,142.21375480294228,0.09145621529006254,2,-1,-1,llm8_g2,0,
2026-03-03T02:13:31.909205+00:00,BUCKET,llm_style,eval,llm_style_eval_139,4,8192,3072,bf16,NVIDIA GeForce RTX 4060,c00,32,32,32,2,2,8,0.0,0.0,369.1520094871521,495.2496033906936,0.5453758528355158,2,-1,-1,llm8_g2,0,
2026-03-03T02:13:31.929351+00:00,BUCKET,llm_style,eval,llm_style_eval_140,64,1024,2048,bf16,NVIDIA GeForce RTX 4060,c03,64,64,32,4,2,8,0.0,0.0,133.00800323486328,154.31007936596865,2.0181902552585593,3,-1,-1,llm8_g3,0,
2026-03-03T02:13:32.058688+00:00,BUCKET,llm_style,eval,llm_style_eval_141,1,6144,4096,bf16,NVIDIA GeForce RTX 4060,c00,32,32,32,2,2,8,0.0,0.0,364.25599455833435,461.1116790771483,0.13817658117343504,2,-1,-1,llm8_g2,0,
2026-03-03T02:13:32.155856+00:00,BUCKET,llm_style,eval,llm_style_eval_142,4,4096,4096,bf16,NVIDIA GeForce RTX 4060,c00,32,32,32,2,2,8,0.0,0.0,268.2879865169525,345.1084852218628,0.5002748343020536,2,-1,-1,llm8_g2,0,
2026-03-03T02:13:32.214109+00:00,BUCKET,llm_style,eval,llm_style_eval_143,64,1536,6144,bf16,NVIDIA GeForce RTX 4060,c04,64,64,64,4,3,8,0.0,0.0,257.02399015426636,298.0291199684143,4.6997930087186806,5,-1,-1,llm8_g5,0,
2026-03-03T02:13:32.247073+00:00,BUCKET,llm_style,eval,llm_style_eval_144,1,6144,1024,bf16,NVIDIA GeForce RTX 4060,c00,32,32,32,2,2,8,0.0,0.0,103.39199751615524,142.74559982120982,0.1217010242793103,1,-1,-1,llm8_g1,0,
2026-03-03T02:13:32.351647+00:00,BUCKET,llm_style,eval,llm_style_eval_145,8,3072,6144,bf16,NVIDIA GeForce RTX 4060,c00,32,32,32,2,2,8,0.0,0.0,345.6000089645386,367.6774376630783,0.8738133106674388,2,-1,-1,llm8_g2,0,
2026-03-03T02:13:32.749920+00:00,BUCKET,llm_style,eval,llm_style_eval_146,64,8192,8192,bf16,NVIDIA GeForce RTX 4060,c04,64,64,64,4,3,8,0.0,0.0,1521.1520195007324,1609.8144149780273,5.646992859280009,7,-1,-1,llm8_g7,0,
2026-03-03T02:13:32.811876+00:00,BUCKET,llm_style,eval,llm_style_eval_147,1,1024,8192,bf16,NVIDIA GeForce RTX 4060,c10,64,128,64,8,3,8,0.0,0.0,437.23200261592865,455.17567336559296,0.03837142729631657,0,-1,-1,llm8_g0,0,
2026-03-03T02:13:32.835621+00:00,BUCKET,llm_style,eval,llm_style_eval_148,32,4096,1024,bf16,NVIDIA GeForce RTX 4060,c00,32,32,32,2,2,8,0.0,0.0,78.84799689054489,115.01920096576205,3.4044676667263514,6,-1,-1,llm8_g6,0,
2026-03-03T02:13:32.907528+00:00,BUCKET,llm_style,eval,llm_style_eval_149,64,3072,4096,bf16,NVIDIA GeForce RTX 4060,c03,64,64,32,4,2,8,0.0,0.0,239.34400081634521,336.803838610649,6.729279741738187,3,-1,-1,llm8_g3,0,
2026-03-03T02:13:33.001382+00:00,BUCKET,llm_style,eval,llm_style_eval_150,2,4096,4096,bf16,NVIDIA GeForce RTX 4060,c00,32,32,32,2,2,8,0.0,0.0,260.09601354599,318.50495606660843,0.2580157345938478,2,-1,-1,llm8_g2,0,
2026-03-03T02:13:33.035915+00:00,BUCKET,llm_style,eval,llm_style_eval_151,64,2048,3072,bf16,NVIDIA GeForce RTX 4060,c03,64,64,32,4,2,8,0.0,0.0,153.4240022301674,184.303038418293,5.248894281820883,3,-1,-1,llm8_g3,0,
2026-03-03T02:13:33.082486+00:00,BUCKET,llm_style,eval,llm_style_eval_152,64,1024,8192,bf16,NVIDIA GeForce RTX 4060,c04,64,64,64,4,3,8,0.0,0.0,258.04799795150757,352.4812799692154,4.161015906047749,7,-1,-1,llm8_g7,0,
2026-03-03T02:13:33.109963+00:00,BUCKET,llm_style,eval,llm_style_eval_153,64,4096,1024,bf16,NVIDIA GeForce RTX 4060,c00,32,32,32,2,2,8,0.0,0.0,118.78400295972824,186.2860757112501,4.519724025313554,6,-1,-1,llm8_g6,0,
2026-03-03T02:13:33.163168+00:00,BUCKET,llm_style,eval,llm_style_eval_154,64,4096,2048,bf16,NVIDIA GeForce RTX 4060,c03,64,64,32,4,2,8,0.0,0.0,206.54399693012238,312.6582407951353,5.198610659031967,3,-1,-1,llm8_g3,0,
2026-03-03T02:13:33.346952+00:00,BUCKET,llm_style,eval,llm_style_eval_155,8,4096,8192,bf16,NVIDIA GeForce RTX 4060,c00,32,32,32,2,2,8,0.0,0.0,477.6960015296936,604.1743987798691,1.1238756662831897,2,-1,-1,llm8_g2,0,
2026-03-03T02:13:33.416360+00:00,BUCKET,llm_style,eval,llm_style_eval_156,64,6144,2048,bf16,NVIDIA GeForce RTX 4060,c03,64,64,32,4,2,8,0.0,0.0,241.66400730609894,278.7907201051711,6.664677764612043,3,-1,-1,llm8_g3,0,
2026-03-03T02:13:33.547210+00:00,BUCKET,llm_style,eval,llm_style_eval_157,16,4096,6144,bf16,NVIDIA GeForce RTX 4060,c00,32,32,32,2,2,8,0.0,0.0,370.62399089336395,467.13856518268574,2.172839286682073,2,-1,-1,llm8_g2,0,
2026-03-03T02:13:33.581889+00:00,BUCKET,llm_style,eval,llm_style_eval_158,64,2048,3072,bf16,NVIDIA GeForce RTX 4060,c03,64,64,32,4,2,8,0.0,0.0,179.19999361038208,264.3148800730705,4.493897303093118,3,-1,-1,llm8_g3,0,
2026-03-03T02:13:33.602471+00:00,BUCKET,llm_style,eval,llm_style_eval_159,64,1536,2048,bf16,NVIDIA GeForce RTX 4060,c03,64,64,32,4,2,8,0.0,0.0,114.656001329422,186.58239573240274,3.511836967374465,3,-1,-1,llm8_g3,0,
2026-03-03T02:13:33.626254+00:00,BUCKET,llm_style,eval,llm_style_eval_160,16,1536,3072,bf16,NVIDIA GeForce RTX 4060,c00,32,32,32,2,2,8,0.0,0.0,120.83200365304947,159.39391732215876,1.249627080864758,2,-1,-1,llm8_g2,0,
2026-03-03T02:13:33.638851+00:00,BUCKET,llm_style,eval,llm_style_eval_161,64,1536,1024,bf16,NVIDIA GeForce RTX 4060,c00,32,32,32,2,2,8,0.0,0.0,61.423998326063156,81.23647972941399,3.277653644936591,6,-1,-1,llm8_g6,0,
2026-03-03T02:13:33.670399+00:00,BUCKET,llm_style,eval,llm_style_eval_162,64,6144,1024,bf16,NVIDIA GeForce RTX 4060,c00,32,32,32,2,2,8,0.0,0.0,171.9679981470108,202.99776151776308,4.682885052319825,6,-1,-1,llm8_g6,0,
2026-03-03T02:13:33.713089+00:00,BUCKET,llm_style,eval,llm_style_eval_163,32,6144,1536,bf16,NVIDIA GeForce RTX 4060,c00,32,32,32,2,2,8,0.0,0.0,142.84799993038177,199.66975659131992,4.22812903431868,6,-1,-1,llm8_g6,0,
2026-03-03T02:13:33.787501+00:00,BUCKET,llm_style,eval,llm_style_eval_164,16,1536,8192,bf16,NVIDIA GeForce RTX 4060,c00,32,32,32,2,2,8,0.0,0.0,262.14399933815,294.4307115674019,1.536000003878027,2,-1,-1,llm8_g2,0,
2026-03-03T02:13:33.860942+00:00,BUCKET,llm_style,eval,llm_style_eval_165,8,1536,8192,bf16,NVIDIA GeForce RTX 4060,c00,32,32,32,2,2,8,0.0,0.0,258.36800038814545,412.11903750896425,0.7792241751979645,2,-1,-1,llm8_g2,0,
2026-03-03T02:13:33.894522+00:00,BUCKET,llm_style,eval,llm_style_eval_166,2,1024,6144,bf16,NVIDIA GeForce RTX 4060,c00,32,32,32,2,2,8,0.0,0.0,192.4320012331009,296.4582324028015,0.13077774922433816,2,-1,-1,llm8_g2,0,
2026-03-03T02:13:33.969968+00:00,BUCKET,llm_style,eval,llm_style_eval_167,64,4096,3072,bf16,NVIDIA GeForce RTX 4060,c03,64,64,32,4,2,8,0.0,0.0,266.2400007247925,293.39039504528046,6.049476906608265,3,-1,-1,llm8_g3,0,
2026-03-03T02:13:34.109246+00:00,BUCKET,llm_style,eval,llm_style_eval_168,64,8192,3072,bf16,NVIDIA GeForce RTX 4060,c03,64,64,32,4,2,8,0.0,0.0,485.8880043029785,564.080636501312,6.629563692606382,3,-1,-1,llm8_g3,0,
2026-03-03T02:13:34.142110+00:00,BUCKET,llm_style,eval,llm_style_eval_169,2,1024,6144,bf16,NVIDIA GeForce RTX 4060,c00,32,32,32,2,2,8,0.0,0.0,183.29600244760513,255.55968821048737,0.13729608755212003,2,-1,-1,llm8_g2,0,
2026-03-03T02:13:34.242304+00:00,BUCKET,llm_style,eval,llm_style_eval_170,16,2048,8192,bf16,NVIDIA GeForce RTX 4060,c00,32,32,32,2,2,8,0.0,0.0,347.6479947566986,459.1043245792389,1.5442945741013956,2,-1,-1,llm8_g2,0,
2026-03-03T02:13:34.268345+00:00,BUCKET,llm_style,eval,llm_style_eval_171,2,4096,1536,bf16,NVIDIA GeForce RTX 4060,c00,32,32,32,2,2,8,0.0,0.0,93.55200082063675,123.66848081350321,0.269003589225733,6,-1,-1,llm8_g6,0,
2026-03-03T02:13:34.278964+00:00,BUCKET,llm_style,eval,llm_style_eval_172,1,1536,1024,bf16,NVIDIA GeForce RTX 4060,c00,32,32,32,2,2,8,0.0,0.0,61.344001442193985,82.50367812812327,0.05128012399002533,1,-1,-1,llm8_g1,0,
2026-03-03T02:13:34.310396+00:00,BUCKET,llm_style,eval,llm_style_eval_173,32,1536,4096,bf16,NVIDIA GeForce RTX 4060,c00,32,32,32,2,2,8,0.0,0.0,148.47999811172485,164.75903525948524,2.7118345172460243,2,-1,-1,llm8_g2,0,
2026-03-03T02:13:34.347262+00:00,BUCKET,llm_style,eval,llm_style_eval_174,64,2048,3072,bf16,NVIDIA GeForce RTX 4060,c03,64,64,32,4,2,8,0.0,0.0,159.2320054769516,258.8979293406009,5.057440340513489,3,-1,-1,llm8_g3,0,
2026-03-03T02:13:34.362734+00:00,BUCKET,llm_style,eval,llm_style_eval_175,2,3072,1024,bf16,NVIDIA GeForce RTX 4060,c00,32,32,32,2,2,8,0.0,0.0,56.32000043988228,71.97216004133223,0.22341818007319428,6,-1,-1,llm8_g6,0,
2026-03-03T02:13:34.567976+00:00,BUCKET,llm_style,eval,llm_style_eval_176,64,6144,6144,bf16,NVIDIA GeForce RTX 4060,c04,64,64,64,4,3,8,0.0,0.0,608.240008354187,730.6547099351883,7.943966430413354,5,-1,-1,llm8_g5,0,
2026-03-03T02:13:34.703000+00:00,BUCKET,llm_style,eval,llm_style_eval_177,2,6144,4096,bf16,NVIDIA GeForce RTX 4060,c00,32,32,32,2,2,8,0.0,0.0,371.19999527931213,481.9459185004234,0.27118345172460245,2,-1,-1,llm8_g2,0,
2026-03-03T02:13:34.753907+00:00,BUCKET,llm_style,eval,llm_style_eval_178,64,4096,2048,bf16,NVIDIA GeForce RTX 4060,c03,64,64,32,4,2,8,0.0,0.0,256.51199370622635,443.1395226716995,4.185932238434498,3,-1,-1,llm8_g3,0,
2026-03-03T02:13:34.824848+00:00,BUCKET,llm_style,eval,llm_style_eval_179,16,6144,2048,bf16,NVIDIA GeForce RTX 4060,c00,32,32,32,2,2,8,0.0,0.0,202.09600031375885,322.5727966427803,1.9923857145855004,2,-1,-1,llm8_g2,0,
2026-03-03T02:13:34.856042+00:00,BUCKET,llm_style,eval,llm_style_eval_180,1,3072,2048,bf16,NVIDIA GeForce RTX 4060,c00,32,32,32,2,2,8,0.0,0.0,112.64000087976456,244.22400042414654,0.11170909003659714,2,-1,-1,llm8_g2,0,
2026-03-03T02:13:35.002560+00:00,BUCKET,llm_style,eval,llm_style_eval_181,32,3072,8192,bf16,NVIDIA GeForce RTX 4060,c00,32,32,32,2,2,8,0.0,0.0,519.6800231933594,629.2630290985107,3.0992392705477023,2,-1,-1,llm8_g2,0,
2026-03-03T02:13:35.062954+00:00,BUCKET,llm_style,eval,llm_style_eval_182,64,1024,8192,bf16,NVIDIA GeForce RTX 4060,c04,64,64,64,4,3,8,0.0,0.0,380.2720010280609,504.99582439661026,2.8236152572294344,7,-1,-1,llm8_g7,0,
2026-03-03T02:13:35.101066+00:00,BUCKET,llm_style,eval,llm_style_eval_183,32,4096,1536,bf16,NVIDIA GeForce RTX 4060,c00,32,32,32,2,2,8,0.0,0.0,148.47999811172485,257.81280457973475,2.7118345172460243,6,-1,-1,llm8_g6,0,
2026-03-03T02:13:35.131086+00:00,BUCKET,llm_style,eval,llm_style_eval_184,2,2048,3072,bf16,NVIDIA GeForce RTX 4060,c00,32,32,32,2,2,8,0.0,0.0,155.5039957165718,184.19103503227225,0.1618339379900456,2,-1,-1,llm8_g2,0,
2026-03-03T02:13:35.149400+00:00,BUCKET,llm_style,eval,llm_style_eval_185,64,1536,1536,bf16,NVIDIA GeForce RTX 4060,c03,64,64,32,4,2,8,0.0,0.0,123.90399724245071,134.6505607664585,2.437289310441514,4,-1,-1,llm8_g4,0,
2026-03-03T02:13:35.201089+00:00,BUCKET,llm_style,eval,llm_style_eval_186,64,8192,1024,bf16,NVIDIA GeForce RTX 4060,c00,32,32,32,2,2,8,0.0,0.0,312.3199939727783,430.876792371273,3.4379541647070693,6,-1,-1,llm8_g6,0,
2026-03-03T02:13:35.248446+00:00,BUCKET,llm_style,eval,llm_style_eval_187,4,8192,1024,bf16,NVIDIA GeForce RTX 4060,c00,32,32,32,2,2,8,0.0,0.0,152.52800285816193,253.8991916179655,0.43997733362053876,6,-1,-1,llm8_g6,0,
2026-03-03T02:13:35.281790+00:00,BUCKET,llm_style,eval,llm_style_eval_188,32,6144,1024,bf16,NVIDIA GeForce RTX 4060,c00,32,32,32,2,2,8,0.0,0.0,117.76000261306763,186.94495916366563,3.4192694893445785,6,-1,-1,llm8_g6,0,
2026-03-03T02:13:35.292205+00:00,BUCKET,llm_style,eval,llm_style_eval_189,4,1024,1024,bf16,NVIDIA GeForce RTX 4060,c00,32,32,32,2,2,8,0.0,0.0,65.0239996612072,138.4086456894874,0.1290078746879143,6,-1,-1,llm8_g6,0,
2026-03-03T02:13:35.313323+00:00,BUCKET,llm_style,eval,llm_style_eval_190,16,2048,2048,bf16,NVIDIA GeForce RTX 4060,c00,32,32,32,2,2,8,0.0,0.0,103.42399775981903,152.18687906861294,1.2977426023667453,2,-1,-1,llm8_g2,0,
2026-03-03T02:13:35.329661+00:00,BUCKET,llm_style,eval,llm_style_eval_191,4,2048,1536,bf16,NVIDIA GeForce RTX 4060,c00,32,32,32,2,2,8,0.0,0.0,93.18400174379349,136.2636812776326,0.27006592901207066,6,-1,-1,llm8_g6,0,
2026-03-03T02:13:35.382261+00:00,BUCKET,llm_style,eval,llm_style_eval_192,64,8192,1024,bf16,NVIDIA GeForce RTX 4060,c00,32,32,32,2,2,8,0.0,0.0,313.34400177001953,379.68895792961115,3.4267189348914946,6,-1,-1,llm8_g6,0,
2026-03-03T02:13:35.757688+00:00,BUCKET,llm_style,eval,llm_style_eval_193,4,8192,8192,bf16,NVIDIA GeForce RTX 4060,c00,32,32,32,2,2,8,0.0,0.0,1077.247977256775,1114.2144203186035,0.4983726340959565,2,-1,-1,llm8_g2,0,
2026-03-03T02:13:35.779336+00:00,BUCKET,llm_style,eval,llm_style_eval_194,64,1024,1024,bf16,NVIDIA GeForce RTX 4060,c00,32,32,32,2,2,8,0.0,0.0,91.13600105047226,234.01119560003258,1.4727190841484097,6,-1,-1,llm8_g6,0,
2026-03-03T02:13:35.820165+00:00,BUCKET,llm_style,eval,llm_style_eval_195,32,4096,1536,bf16,NVIDIA GeForce RTX 4060,c00,32,32,32,2,2,8,0.0,0.0,159.4720035791397,203.36640164256085,2.524914561571799,6,-1,-1,llm8_g6,0,
2026-03-03T02:13:35.841774+00:00,BUCKET,llm_style,eval,llm_style_eval_196,8,4096,1024,bf16,NVIDIA GeForce RTX 4060,c00,32,32,32,2,2,8,0.0,0.0,104.44799810647964,114.68800157308578,0.6425098155695218,6,-1,-1,llm8_g6,0,
2026-03-03T02:13:35.915150+00:00,BUCKET,llm_style,eval,llm_style_eval_197,2,6144,2048,bf16,NVIDIA GeForce RTX 4060,c00,32,32,32,2,2,8,0.0,0.0,219.13599967956543,268.0627286434172,0.22968224332651016,2,-1,-1,llm8_g2,0,
2026-03-03T02:13:35.970069+00:00,BUCKET,llm_style,eval,llm_style_eval_198,32,1536,6144,bf16,NVIDIA GeForce RTX 4060,c00,32,32,32,2,2,8,0.0,0.0,332.8000009059906,348.68224263191223,1.8148430719824795,2,-1,-1,llm8_g2,0,
2026-03-03T02:13:36.004470+00:00,BUCKET,llm_style,eval,llm_style_eval_199,32,3072,1536,bf16,NVIDIA GeForce RTX 4060,c00,32,32,32,2,2,8,0.0,0.0,132.09599256515503,240.3596825897693,2.2861396635560043,6,-1,-1,llm8_g6,0,
2026-03-03T02:13:36.048003+00:00,BUCKET,llm_style,eval,llm_style_eval_200,64,2048,3072,bf16,NVIDIA GeForce RTX 4060,c03,64,64,32,4,2,8,0.0,0.0,287.7439856529236,341.7190328240394,2.7986905310033467,3,-1,-1,llm8_g3,0,
2026-03-03T02:13:36.125095+00:00,BUCKET,llm_style,eval,llm_style_eval_201,4,6144,2048,bf16,NVIDIA GeForce RTX 4060,c00,32,32,32,2,2,8,0.0,0.0,227.32800245285034,263.5820864140986,0.4428108060329188,2,-1,-1,llm8_g2,0,
2026-03-03T02:13:36.157220+00:00,BUCKET,llm_style,eval,llm_style_eval_202,4,6144,1024,bf16,NVIDIA GeForce RTX 4060,c00,32,32,32,2,2,8,0.0,0.0,134.14399325847626,294.9836716055869,0.37520612572654016,6,-1,-1,llm8_g6,0,
2026-03-03T02:13:36.471515+00:00,BUCKET,llm_style,eval,llm_style_eval_203,1,6144,8192,bf16,NVIDIA GeForce RTX 4060,c10,64,128,64,8,3,8,0.0,0.0,1525.2480506896973,1690.972158908844,0.06599798370794925,0,-1,-1,llm8_g0,0,
2026-03-03T02:13:36.513793+00:00,BUCKET,llm_style,eval,llm_style_eval_204,1,2048,3072,bf16,NVIDIA GeForce RTX 4060,c00,32,32,32,2,2,8,0.0,0.0,193.88800114393234,247.53568172454828,0.06489783754415572,2,-1,-1,llm8_g2,0,
2026-03-03T02:13:36.562698+00:00,BUCKET,llm_style,eval,llm_style_eval_205,2,6144,1536,bf16,NVIDIA GeForce RTX 4060,c00,32,32,32,2,2,8,0.0,0.0,202.67199724912643,219.6099190413952,0.18625531159886324,6,-1,-1,llm8_g6,0,
2026-03-03T02:13:36.579085+00:00,BUCKET,llm_style,eval,llm_style_eval_206,16,1024,1024,bf16,NVIDIA GeForce RTX 4060,c00,32,32,32,2,2,8,0.0,0.0,86.97599917650223,135.46496465802176,0.38578955479324,6,-1,-1,llm8_g6,0,
2026-03-03T02:13:36.656190+00:00,BUCKET,llm_style,eval,llm_style_eval_207,64,6144,2048,bf16,NVIDIA GeForce RTX 4060,c03,64,64,32,4,2,8,0.0,0.0,300.927996635437,411.8937653303146,5.3521531861696365,3,-1,-1,llm8_g3,0,
2026-03-03T02:13:36.792276+00:00,BUCKET,llm_style,eval,llm_style_eval_208,4,4096,6144,bf16,NVIDIA GeForce RTX 4060,c00,32,32,32,2,2,8,0.0,0.0,377.85598635673523,414.11808520555496,0.5328130273683869,2,-1,-1,llm8_g2,0,
2026-03-03T02:13:36.994300+00:00,BUCKET,llm_style,eval,llm_style_eval_209,32,6144,6144,bf16,NVIDIA GeForce RTX 4060,c00,32,32,32,2,2,8,0.0,0.0,596.8800187110901,712.5750648975371,4.047579125226816,2,-1,-1,llm8_g2,0,
2026-03-03T02:13:37.012468+00:00,BUCKET,llm_style,eval,llm_style_eval_210,64,2048,1024,bf16,NVIDIA GeForce RTX 4060,c00,32,32,32,2,2,8,0.0,0.0,105.87199777364731,217.47392162680626,2.5354717172137513,6,-1,-1,llm8_g6,0,
2026-03-03T02:13:37.032866+00:00,BUCKET,llm_style,eval,llm_style_eval_211,4,1024,3072,bf16,NVIDIA GeForce RTX 4060,c00,32,32,32,2,2,8,0.0,0.0,135.16800105571747,201.8051159381866,0.1861818167276619,2,-1,-1,llm8_g2,0,
2026-03-03T02:13:37.260754+00:00,BUCKET,llm_style,eval,llm_style_eval_212,64,6144,6144,bf16,NVIDIA GeForce RTX 4060,c04,64,64,64,4,3,8,0.0,0.0,801.2000024318695,901.9904112815857,6.030751614246129,5,-1,-1,llm8_g5,0,
2026-03-03T02:13:37.276570+00:00,BUCKET,llm_style,eval,llm_style_eval_213,4,1024,2048,bf16,NVIDIA GeForce RTX 4060,c00,32,32,32,2,2,8,0.0,0.0,101.3759970664978,167.7088025212288,0.16549495428385233,2,-1,-1,llm8_g2,0,
2026-03-03T02:13:37.474280+00:00,BUCKET,llm_style,eval,llm_style_eval_214,32,6144,6144,bf16,NVIDIA GeForce RTX 4060,c00,32,32,32,2,2,8,0.0,0.0,599.0399718284607,621.4739215373993,4.032984805047058,2,-1,-1,llm8_g2,0,
2026-03-03T02:13:37.505113+00:00,BUCKET,llm_style,eval,llm_style_eval_215,16,2048,3072,bf16,NVIDIA GeForce RTX 4060,c00,32,32,32,2,2,8,0.0,0.0,147.45600521564484,161.27455487847328,1.3653332850403275,2,-1,-1,llm8_g2,0,
2026-03-03T02:13:37.522251+00:00,BUCKET,llm_style,eval,llm_style_eval_216,2,1536,2048,bf16,NVIDIA GeForce RTX 4060,c00,32,32,32,2,2,8,0.0,0.0,112.64000087976456,132.7820802479982,0.11170909003659714,2,-1,-1,llm8_g2,0,
2026-03-03T02:13:37.669916+00:00,BUCKET,llm_style,eval,llm_style_eval_217,64,8192,3072,bf16,NVIDIA GeForce RTX 4060,c03,64,64,32,4,2,8,0.0,0.0,640.9599781036377,736.3174438476562,5.025626532143877,3,-1,-1,llm8_g3,0,
2026-03-03T02:13:37.747831+00:00,BUCKET,llm_style,eval,llm_style_eval_218,64,4096,3072,bf16,NVIDIA GeForce RTX 4060,c03,64,64,32,4,2,8,0.0,0.0,380.92800974845886,419.95264410972584,4.22812892405457,3,-1,-1,llm8_g3,0,
2026-03-03T02:13:37.776273+00:00,BUCKET,llm_style,eval,llm_style_eval_219,64,1536,3072,bf16,NVIDIA GeForce RTX 4060,c03,64,64,32,4,2,8,0.0,0.0,189.43999707698822,246.97727710008604,3.188237887031551,3,-1,-1,llm8_g3,0,
2026-03-03T02:13:37.968267+00:00,BUCKET,llm_style,eval,llm_style_eval_220,1,6144,6144,bf16,NVIDIA GeForce RTX 4060,c00,32,32,32,2,2,8,0.0,0.0,533.3119928836823,632.5942403078077,0.14156342442587136,2,-1,-1,llm8_g2,0,
2026-03-03T02:13:38.141560+00:00,BUCKET,llm_style,eval,llm_style_eval_221,8,4096,8192,bf16,NVIDIA GeForce RTX 4060,c00,32,32,32,2,2,8,0.0,0.0,494.59201097488403,529.8364651203156,1.0854823775697076,2,-1,-1,llm8_g2,0,
2026-03-03T02:13:38.510011+00:00,BUCKET,llm_style,eval,llm_style_eval_222,8,8192,8192,bf16,NVIDIA GeForce RTX 4060,c00,32,32,32,2,2,8,0.0,0.0,1094.655990600586,1121.8226790428162,0.9808943021550439,2,-1,-1,llm8_g2,0,
2026-03-03T02:13:38.543336+00:00,BUCKET,llm_style,eval,llm_style_eval_223,1,4096,1536,bf16,NVIDIA GeForce RTX 4060,c00,32,32,32,2,2,8,0.0,0.0,143.36000382900238,227.8102345764637,0.08777142622714144,1,-1,-1,llm8_g1,0,
2026-03-03T02:13:38.585545+00:00,BUCKET,llm_style,eval,llm_style_eval_224,4,3072,3072,bf16,NVIDIA GeForce RTX 4060,c00,32,32,32,2,2,8,0.0,0.0,162.81600296497345,181.795521825552,0.46369810476333667,2,-1,-1,llm8_g2,0,
2026-03-03T02:13:38.692755+00:00,BUCKET,llm_style,eval,llm_style_eval_225,64,8192,2048,bf16,NVIDIA GeForce RTX 4060,c03,64,64,32,4,2,8,0.0,0.0,472.06398844718933,495.09247958660126,4.549136770766921,3,-1,-1,llm8_g3,0,
2026-03-03T02:13:38.728235+00:00,BUCKET,llm_style,eval,llm_style_eval_226,4,4096,1536,bf16,NVIDIA GeForce RTX 4060,c00,32,32,32,2,2,8,0.0,0.0,131.45600259304047,210.10431662201876,0.38287827871821095,6,-1,-1,llm8_g6,0,
2026-03-03T02:13:38.805340+00:00,BUCKET,llm_style,eval,llm_style_eval_227,16,8192,1536,bf16,NVIDIA GeForce RTX 4060,c04,64,64,64,4,3,8,0.0,0.0,368.6400055885315,389.18143779039383,1.0922666501080551,7,-1,-1,llm8_g7,0,
2026-03-03T02:13:38.849569+00:00,BUCKET,llm_style,eval,llm_style_eval_228,16,2048,4096,bf16,NVIDIA GeForce RTX 4060,c00,32,32,32,2,2,8,0.0,0.0,201.08799636363983,241.69471576809872,1.3349153646872667,2,-1,-1,llm8_g2,0,
2026-03-03T02:13:38.863791+00:00,BUCKET,llm_style,eval,llm_style_eval_229,8,1536,1024,bf16,NVIDIA GeForce RTX 4060,c00,32,32,32,2,2,8,0.0,0.0,73.21600243449211,189.83584359288216,0.3437202682912986,6,-1,-1,llm8_g6,0,
2026-03-03T02:13:39.016849+00:00,BUCKET,llm_style,eval,llm_style_eval_230,64,4096,6144,bf16,NVIDIA GeForce RTX 4060,c04,64,64,64,4,3,8,0.0,0.0,717.7119851112366,758.5622501373291,4.488186819815681,5,-1,-1,llm8_g5,0,
2026-03-03T02:13:39.095991+00:00,BUCKET,llm_style,eval,llm_style_eval_231,64,4096,2048,bf16,NVIDIA GeForce RTX 4060,c03,64,64,32,4,2,8,0.0,0.0,294.2720055580139,387.8854325413703,3.6488072386087658,3,-1,-1,llm8_g3,0,
2026-03-03T02:13:39.172316+00:00,BUCKET,llm_style,eval,llm_style_eval_232,16,3072,4096,bf16,NVIDIA GeForce RTX 4060,c00,32,32,32,2,2,8,0.0,0.0,220.99199891090393,278.57920110225666,1.822026073271256,2,-1,-1,llm8_g2,0,
2026-03-03T02:13:39.251789+00:00,BUCKET,llm_style,eval,llm_style_eval_233,64,8192,1536,bf16,NVIDIA GeForce RTX 4060,c03,64,64,32,4,2,8,0.0,0.0,362.4959886074066,383.0374354124069,4.44311878370698,4,-1,-1,llm8_g4,0,
2026-03-03T02:13:39.284919+00:00,BUCKET,llm_style,eval,llm_style_eval_234,64,1024,4096,bf16,NVIDIA GeForce RTX 4060,c03,64,64,32,4,2,8,0.0,0.0,264.6879851818085,587.4176070094097,2.0283161384572668,3,-1,-1,llm8_g3,0,
2026-03-03T02:13:39.306863+00:00,BUCKET,llm_style,eval,llm_style_eval_235,64,3072,1024,bf16,NVIDIA GeForce RTX 4060,c00,32,32,32,2,2,8,0.0,0.0,133.5199996829033,149.52447846531868,3.0156769394567196,6,-1,-1,llm8_g6,0,
2026-03-03T02:13:39.423291+00:00,BUCKET,llm_style,eval,llm_style_eval_236,32,3072,6144,bf16,NVIDIA GeForce RTX 4060,c00,32,32,32,2,2,8,0.0,0.0,403.4560024738312,453.62176805734623,2.994030438494592,2,-1,-1,llm8_g2,0,
2026-03-03T02:13:39.696556+00:00,BUCKET,llm_style,eval,llm_style_eval_237,2,8192,6144,bf16,NVIDIA GeForce RTX 4060,c00,32,32,32,2,2,8,0.0,0.0,735.727995634079,754.2191791534424,0.2736426956629385,2,-1,-1,llm8_g2,0,
2026-03-03T02:13:39.745904+00:00,BUCKET,llm_style,eval,llm_style_eval_238,4,2048,4096,bf16,NVIDIA GeForce RTX 4060,c00,32,32,32,2,2,8,0.0,0.0,202.60800421237946,317.23521023988707,0.3312251372342358,2,-1,-1,llm8_g2,0,
2026-03-03T02:13:39.795171+00:00,BUCKET,llm_style,eval,llm_style_eval_239,4,8192,1024,bf16,NVIDIA GeForce RTX 4060,c00,32,32,32,2,2,8,0.0,0.0,151.5520066022873,244.5929637551306,0.44281079151997954,6,-1,-1,llm8_g6,0,
2026-03-03T02:13:39.824750+00:00,BUCKET,llm_style,eval,llm_style_eval_240,2,1024,4096,bf16,NVIDIA GeForce RTX 4060,c00,32,32,32,2,2,8,0.0,0.0,187.391996383667,211.0668769478798,0.08953005637257992,2,-1,-1,llm8_g2,0,
2026-03-03T02:13:39.854498+00:00,BUCKET,llm_style,eval,llm_style_eval_241,8,3072,2048,bf16,NVIDIA GeForce RTX 4060,c00,32,32,32,2,2,8,0.0,0.0,124.92799758911133,218.75712320208547,0.8057705073532193,2,-1,-1,llm8_g2,0,
2026-03-03T02:13:39.992709+00:00,BUCKET,llm_style,eval,llm_style_eval_242,32,4096,6144,bf16,NVIDIA GeForce RTX 4060,c00,32,32,32,2,2,8,0.0,0.0,470.96000611782074,540.5587235093114,3.419850337773842,2,-1,-1,llm8_g2,0,
2026-03-03T02:13:40.025677+00:00,BUCKET,llm_style,eval,llm_style_eval_243,64,2048,2048,bf16,NVIDIA GeForce RTX 4060,c03,64,64,32,4,2,8,0.0,0.0,158.720001578331,187.4124838411808,3.3825031921704283,3,-1,-1,llm8_g3,0,
2026-03-03T02:13:40.046813+00:00,BUCKET,llm_style,eval,llm_style_eval_244,8,2048,1536,bf16,NVIDIA GeForce RTX 4060,c00,32,32,32,2,2,8,0.0,0.0,96.25600278377533,182.9990385472774,0.5228936018989122,6,-1,-1,llm8_g6,0,
2026-03-03T02:13:40.083602+00:00,BUCKET,llm_style,eval,llm_style_eval_245,1,1024,6144,bf16,NVIDIA GeForce RTX 4060,c00,32,32,32,2,2,8,0.0,0.0,265.1679962873459,383.9897596836089,0.047452604296804694,2,-1,-1,llm8_g2,0,
2026-03-03T02:13:40.095571+00:00,BUCKET,llm_style,eval,llm_style_eval_246,2,1536,1024,bf16,NVIDIA GeForce RTX 4060,c00,32,32,32,2,2,8,0.0,0.0,71.68000191450119,141.85471966862679,0.08777142622714144,6,-1,-1,llm8_g6,0,
2026-03-03T02:13:40.187342+00:00,BUCKET,llm_style,eval,llm_style_eval_247,64,2048,6144,bf16,NVIDIA GeForce RTX 4060,c04,64,64,64,4,3,8,0.0,0.0,499.7119903564453,589.3427288532255,3.2230820294128772,5,-1,-1,llm8_g5,0,
2026-03-03T02:13:40.202467+00:00,BUCKET,llm_style,eval,llm_style_eval_248,64,1536,1024,bf16,NVIDIA GeForce RTX 4060,c00,32,32,32,2,2,8,0.0,0.0,88.06400001049042,200.2431969344616,2.28613953461139,6,-1,-1,llm8_g6,0,
2026-03-03T02:13:40.223960+00:00,BUCKET,llm_style,eval,llm_style_eval_249,8,2048,1536,bf16,NVIDIA GeForce RTX 4060,c00,32,32,32,2,2,8,0.0,0.0,96.76800295710564,180.7462377846241,0.5201269682325729,6,-1,-1,llm8_g6,0,
2026-03-03T02:13:40.268552+00:00,BUCKET,llm_style,eval,llm_style_eval_250,32,6144,1536,bf16,NVIDIA GeForce RTX 4060,c00,32,32,32,2,2,8,0.0,0.0,196.60800695419312,278.29246610403055,3.0719998913407363,6,-1,-1,llm8_g6,0,
2026-03-03T02:13:40.327020+00:00,BUCKET,llm_style,eval,llm_style_eval_251,64,8192,1024,bf16,NVIDIA GeForce RTX 4060,c00,32,32,32,2,2,8,0.0,0.0,318.4159994125366,406.4092904329299,3.3721352758058827,6,-1,-1,llm8_g6,0,
2026-03-03T02:13:40.359687+00:00,BUCKET,llm_style,eval,llm_style_eval_252,1,3072,2048,bf16,NVIDIA GeForce RTX 4060,c00,32,32,32,2,2,8,0.0,0.0,125.85600093007088,218.33759501576418,0.09997864151898023,2,-1,-1,llm8_g2,0,
2026-03-03T02:13:40.377060+00:00,BUCKET,llm_style,eval,llm_style_eval_253,8,3072,1024,bf16,NVIDIA GeForce RTX 4060,c00,32,32,32,2,2,8,0.0,0.0,81.91999793052673,225.26431798934937,0.61440001552105,6,-1,-1,llm8_g6,0,
2026-03-03T02:13:40.390334+00:00,BUCKET,llm_style,eval,llm_style_eval_254,2,1024,1536,bf16,NVIDIA GeForce RTX 4060,c00,32,32,32,2,2,8,0.0,0.0,97.28000313043594,175.56831911206245,0.06467368212935014,6,-1,-1,llm8_g6,0,
2026-03-03T02:13:40.502667+00:00,BUCKET,llm_style,eval,llm_style_eval_255,64,4096,4096,bf16,NVIDIA GeForce RTX 4060,c03,64,64,32,4,2,8,0.0,0.0,617.2640025615692,642.160964012146,3.4790359377644067,3,-1,-1,llm8_g3,0,
