results/llm_with_onekey_smoke.csv
timestamp,method,workload,split,shape_id,M,N,K,dtype,gpu,config_id,BLOCK_M,BLOCK_N,BLOCK_K,num_warps,num_stages,GROUP_M,compile_time_ms,tune_time_ms,runtime_cost_us,p99_us,runtime_perf_tflops,bucket_m,bucket_n,bucket_k,cache_key,invalid_config,notes
2026-03-03T06:13:56.979265+00:00,FULL,llm_style,tune,llm_style_tune_000,1,3072,1536,bf16,NVIDIA GeForce RTX 4060,c03,64,64,32,4,2,8,0.6343279965221882,429.594,51.072001457214355,142.90943935513496,0.18478194961491798,7,-1,-1,1x3072x1536,0,
2026-03-03T06:13:57.052506+00:00,FULL,llm_style,tune,llm_style_tune_001,16,1024,8192,bf16,NVIDIA GeForce RTX 4060,c04,64,64,64,4,3,8,0.0,73.214,69.63200122117996,69.63200122117996,3.8550587559208336,6,-1,-1,16x1024x8192,0,
2026-03-03T06:13:57.423906+00:00,FULL,llm_style,tune,llm_style_tune_002,16,8192,8192,bf16,NVIDIA GeForce RTX 4060,c00,32,32,32,2,2,8,0.0,371.367,534.5280170440674,566.9388914108276,4.017532438945961,4,-1,-1,16x8192x8192,0,
2026-03-03T06:13:57.523695+00:00,FULL,llm_style,tune,llm_style_tune_003,64,6144,3072,bf16,NVIDIA GeForce RTX 4060,c01,64,32,32,2,2,8,0.0,99.743,158.720001578331,185.07776200771332,15.221264364766927,1,-1,-1,64x6144x3072,0,
2026-03-03T06:13:57.882533+00:00,FULL,llm_style,tune,llm_style_tune_004,64,8192,8192,bf16,NVIDIA GeForce RTX 4060,c00,32,32,32,2,2,8,0.0,358.791,555.0079941749573,731.9756555557251,15.477136693804383,0,-1,-1,64x8192x8192,0,
2026-03-03T06:13:57.982258+00:00,FULL,llm_style,tune,llm_style_tune_005,64,2048,8192,bf16,NVIDIA GeForce RTX 4060,c00,32,32,32,2,2,8,0.0,99.681,154.62400019168854,179.2000013589859,13.88842382384202,2,-1,-1,64x2048x8192,0,
2026-03-03T06:13:57.996650+00:00,FULL,llm_style,tune,llm_style_tune_006,32,1024,1536,bf16,NVIDIA GeForce RTX 4060,c00,32,32,32,2,2,8,0.0,14.353,22.5600004196167,27.654399648308754,4.462025448921082,3,-1,-1,32x1024x1536,0,
2026-03-03T06:13:58.134279+00:00,FULL,llm_style,tune,llm_style_tune_007,16,6144,4096,bf16,NVIDIA GeForce RTX 4060,c02,32,64,32,2,2,8,0.0,137.594,203.74399423599243,290.283522605896,3.9525403976680185,5,-1,-1,16x6144x4096,0,
2026-03-03T06:13:58.147983+00:00,FULL,llm_style,eval,llm_style_eval_000,32,1536,1024,bf16,NVIDIA GeForce RTX 4060,c04,64,64,64,4,3,8,0.0,13.665,16.383999958634377,17.12128020823002,6.144000015512108,3,-1,-1,32x1536x1024,0,
2026-03-03T06:13:58.247335+00:00,FULL,llm_style,eval,llm_style_eval_001,32,2048,8192,bf16,NVIDIA GeForce RTX 4060,c00,32,32,32,2,2,8,0.0,99.317,145.4080045223236,221.31711840629578,7.384337798509263,2,-1,-1,32x2048x8192,0,
2026-03-03T06:13:58.302498+00:00,FULL,llm_style,eval,llm_style_eval_002,16,2048,4096,bf16,NVIDIA GeForce RTX 4060,c00,32,32,32,2,2,8,0.0,55.116,45.024000108242035,79.46239769458771,5.962052579838648,7,-1,-1,16x2048x4096,0,
2026-03-03T06:13:58.320805+00:00,FULL,llm_style,eval,llm_style_eval_003,16,2048,1536,bf16,NVIDIA GeForce RTX 4060,c06,64,128,32,4,3,8,0.0,18.262,28.79999950528145,29.6819207072258,3.4952533933738437,7,-1,-1,16x2048x1536,0,
2026-03-03T06:13:58.413227+00:00,FULL,llm_style,eval,llm_style_eval_004,64,8192,2048,bf16,NVIDIA GeForce RTX 4060,c00,32,32,32,2,2,8,0.0,92.383,145.4080045223236,148.398078083992,14.768675597018525,1,-1,-1,64x8192x2048,0,
2026-03-03T06:13:58.545654+00:00,FULL,llm_style,eval,llm_style_eval_005,64,3072,8192,bf16,NVIDIA GeForce RTX 4060,c00,32,32,32,2,2,8,0.0,132.381,211.96800470352173,213.9340853691101,15.196753285975904,2,-1,-1,64x3072x8192,0,
2026-03-03T06:13:58.566972+00:00,FULL,llm_style,eval,llm_style_eval_006,32,2048,2048,bf16,NVIDIA GeForce RTX 4060,c00,32,32,32,2,2,8,0.0,21.275,49.15200173854828,103.22943732142448,5.46133314016131,3,-1,-1,32x2048x2048,0,
2026-03-03T06:13:58.667032+00:00,FULL,llm_style,eval,llm_style_eval_007,8,8192,2048,bf16,NVIDIA GeForce RTX 4060,c00,32,32,32,2,2,8,0.0,100.021,137.2160017490387,137.2160017490387,1.9562984825265148,5,-1,-1,8x8192x2048,0,
2026-03-03T06:13:58.738418+00:00,FULL,llm_style,eval,llm_style_eval_008,64,1536,8192,bf16,NVIDIA GeForce RTX 4060,c04,64,64,64,4,3,8,0.0,71.35,124.89599734544754,220.40575444698334,12.895631327121203,2,-1,-1,64x1536x8192,0,
2026-03-03T06:13:58.876685+00:00,FULL,llm_style,eval,llm_style_eval_009,64,4096,6144,bf16,NVIDIA GeForce RTX 4060,c00,32,32,32,2,2,8,0.0,138.205,208.8959962129593,333.45537066459656,15.420235573668524,3,-1,-1,64x4096x6144,0,
2026-03-03T06:13:58.926238+00:00,FULL,llm_style,eval,llm_style_eval_010,64,2048,4096,bf16,NVIDIA GeForce RTX 4060,c02,32,64,32,2,2,8,0.0,49.504,64.51199948787689,83.67487877607346,16.644063624190995,3,-1,-1,64x2048x4096,0,
2026-03-03T06:13:59.026854+00:00,FULL,llm_style,eval,llm_style_eval_011,32,3072,6144,bf16,NVIDIA GeForce RTX 4060,c00,32,32,32,2,2,8,0.0,100.567,157.69599378108978,157.69599378108978,7.660052250134291,3,-1,-1,32x3072x6144,0,
2026-03-03T06:13:59.042072+00:00,FULL,llm_style,eval,llm_style_eval_012,16,1536,1536,bf16,NVIDIA GeForce RTX 4060,c02,32,64,32,2,2,8,0.0,15.172,25.599999353289604,47.74911969900131,2.9491200745010397,7,-1,-1,16x1536x1536,0,
2026-03-03T06:13:59.081217+00:00,FULL,llm_style,eval,llm_style_eval_013,64,2048,3072,bf16,NVIDIA GeForce RTX 4060,c11,32,128,32,4,2,8,0.0,39.107,48.128001391887665,103.02463740110397,16.73259526076519,3,-1,-1,64x2048x3072,0,
2026-03-03T06:13:59.387763+00:00,FULL,llm_style,eval,llm_style_eval_014,16,8192,6144,bf16,NVIDIA GeForce RTX 4060,c11,32,128,32,4,2,8,0.0,306.498,431.90398812294006,435.1040053367615,3.7290990134167146,5,-1,-1,16x8192x6144,0,
2026-03-03T06:13:59.435317+00:00,FULL,llm_style,eval,llm_style_eval_015,64,6144,1536,bf16,NVIDIA GeForce RTX 4060,c06,64,128,32,4,3,8,0.0,47.506,74.75200295448303,75.52000164985657,16.159561005148372,1,-1,-1,64x6144x1536,0,
2026-03-03T06:13:59.463943+00:00,BUCKET,llm_style,tune,llm_style_tune_000,1,3072,1536,bf16,NVIDIA GeForce RTX 4060,c00,32,32,32,2,2,8,0.0,28.121,27.35999971628189,56.66815847158432,0.3449263193662954,7,-1,-1,llm8_g7,0,
2026-03-03T06:13:59.516302+00:00,BUCKET,llm_style,tune,llm_style_tune_001,16,1024,8192,bf16,NVIDIA GeForce RTX 4060,c00,32,32,32,2,2,8,0.0,52.292,79.6160027384758,171.88863813877106,3.3716268936756597,6,-1,-1,llm8_g6,0,
2026-03-03T06:13:59.860037+00:00,BUCKET,llm_style,tune,llm_style_tune_002,16,8192,8192,bf16,NVIDIA GeForce RTX 4060,c11,32,128,32,4,2,8,0.0,343.687,561.1519813537598,570.9823989868164,3.82691983519201,4,-1,-1,llm8_g4,0,
2026-03-03T06:13:59.960236+00:00,BUCKET,llm_style,tune,llm_style_tune_003,64,6144,3072,bf16,NVIDIA GeForce RTX 4060,c01,64,32,32,2,2,8,0.0,100.149,158.4639996290207,158.713601231575,15.24585463989232,1,-1,-1,llm8_g1,0,
2026-03-03T06:14:00.311017+00:00,BUCKET,llm_style,tune,llm_style_tune_004,64,8192,8192,bf16,NVIDIA GeForce RTX 4060,c06,64,128,32,4,3,8,0.0,350.733,575.4879713058472,600.3916668891907,14.926349498684516,0,-1,-1,llm8_g0,0,
2026-03-03T06:14:00.404501+00:00,BUCKET,llm_style,tune,llm_style_tune_005,64,2048,8192,bf16,NVIDIA GeForce RTX 4060,c00,32,32,32,2,2,8,0.0,93.435,164.86400365829468,183.0092751979828,13.02578853083649,2,-1,-1,llm8_g2,0,
2026-03-03T06:14:00.422631+00:00,BUCKET,llm_style,tune,llm_style_tune_006,32,1024,1536,bf16,NVIDIA GeForce RTX 4060,c04,64,64,64,4,3,8,0.0,18.081,20.479999482631683,100.87423652410507,4.9152001241684,3,-1,-1,llm8_g3,0,
2026-03-03T06:14:00.552725+00:00,BUCKET,llm_style,tune,llm_style_tune_007,16,6144,4096,bf16,NVIDIA GeForce RTX 4060,c06,64,128,32,4,3,8,0.0,130.047,228.03199291229248,241.17248713970184,3.5315499273373603,5,-1,-1,llm8_g5,0,
2026-03-03T06:14:00.559576+00:00,BUCKET,llm_style,eval,llm_style_eval_000,32,1536,1024,bf16,NVIDIA GeForce RTX 4060,c04,64,64,64,4,3,8,0.0,0.0,83.83999764919281,127.67616122961044,1.200659575650276,3,-1,-1,llm8_g3,0,
2026-03-03T06:14:00.632693+00:00,BUCKET,llm_style,eval,llm_style_eval_001,32,2048,8192,bf16,NVIDIA GeForce RTX 4060,c00,32,32,32,2,2,8,0.0,0.0,148.25600385665894,169.23647820949554,7.242484594675474,2,-1,-1,llm8_g2,0,
2026-03-03T06:14:00.671832+00:00,BUCKET,llm_style,eval,llm_style_eval_002,16,2048,4096,bf16,NVIDIA GeForce RTX 4060,c00,32,32,32,2,2,8,0.0,0.0,44.03200000524521,51.89631909132004,6.09637209229704,7,-1,-1,llm8_g7,0,
2026-03-03T06:14:00.684341+00:00,BUCKET,llm_style,eval,llm_style_eval_003,16,2048,1536,bf16,NVIDIA GeForce RTX 4060,c00,32,32,32,2,2,8,0.0,0.0,21.503999829292297,48.76928165555,4.681142894303718,7,-1,-1,llm8_g7,0,
2026-03-03T06:14:00.762156+00:00,BUCKET,llm_style,eval,llm_style_eval_004,64,8192,2048,bf16,NVIDIA GeForce RTX 4060,c01,64,32,32,2,2,8,0.0,0.0,157.69599378108978,177.79200077056885,13.617870666905405,1,-1,-1,llm8_g1,0,
2026-03-03T06:14:00.873504+00:00,BUCKET,llm_style,eval,llm_style_eval_005,64,3072,8192,bf16,NVIDIA GeForce RTX 4060,c00,32,32,32,2,2,8,0.0,0.0,209.9200040102005,301.34271919727325,15.345014341003315,2,-1,-1,llm8_g2,0,
2026-03-03T06:14:00.887560+00:00,BUCKET,llm_style,eval,llm_style_eval_006,32,2048,2048,bf16,NVIDIA GeForce RTX 4060,c04,64,64,64,4,3,8,0.0,0.0,51.19999870657921,76.79232358932495,5.242880132446292,3,-1,-1,llm8_g3,0,
2026-03-03T06:14:00.961680+00:00,BUCKET,llm_style,eval,llm_style_eval_007,8,8192,2048,bf16,NVIDIA GeForce RTX 4060,c06,64,128,32,4,3,8,0.0,0.0,139.26400244235992,139.87840712070465,1.9275293779604168,5,-1,-1,llm8_g5,0,
2026-03-03T06:14:01.018539+00:00,BUCKET,llm_style,eval,llm_style_eval_008,64,1536,8192,bf16,NVIDIA GeForce RTX 4060,c00,32,32,32,2,2,8,0.0,0.0,132.09599256515503,276.50817036628723,12.192744872298691,2,-1,-1,llm8_g2,0,
2026-03-03T06:14:01.148672+00:00,BUCKET,llm_style,eval,llm_style_eval_009,64,4096,6144,bf16,NVIDIA GeForce RTX 4060,c04,64,64,64,4,3,8,0.0,0.0,209.79200303554535,210.89919686317444,15.354376837015199,3,-1,-1,llm8_g3,0,
2026-03-03T06:14:01.190091+00:00,BUCKET,llm_style,eval,llm_style_eval_010,64,2048,4096,bf16,NVIDIA GeForce RTX 4060,c04,64,64,64,4,3,8,0.0,0.0,65.5359998345375,88.18688035011292,16.384000041365624,3,-1,-1,llm8_g3,0,
2026-03-03T06:14:01.273825+00:00,BUCKET,llm_style,eval,llm_style_eval_011,32,3072,6144,bf16,NVIDIA GeForce RTX 4060,c04,64,64,64,4,3,8,0.0,0.0,155.39200603961945,155.64799308776855,7.773627374962989,3,-1,-1,llm8_g3,0,
2026-03-03T06:14:01.282929+00:00,BUCKET,llm_style,eval,llm_style_eval_012,16,1536,1536,bf16,NVIDIA GeForce RTX 4060,c00,32,32,32,2,2,8,0.0,0.0,39.8080013692379,135.9052823483944,1.8965401276925586,7,-1,-1,llm8_g7,0,
2026-03-03T06:14:01.305788+00:00,BUCKET,llm_style,eval,llm_style_eval_013,64,2048,3072,bf16,NVIDIA GeForce RTX 4060,c04,64,64,64,4,3,8,0.0,0.0,69.63200122117996,75.66336274147034,11.565176267762501,3,-1,-1,llm8_g3,0,
2026-03-03T06:14:01.532879+00:00,BUCKET,llm_style,eval,llm_style_eval_014,16,8192,6144,bf16,NVIDIA GeForce RTX 4060,c06,64,128,32,4,3,8,0.0,0.0,429.9199879169464,496.2816047668457,3.746308106779963,5,-1,-1,llm8_g5,0,
2026-03-03T06:14:01.573489+00:00,BUCKET,llm_style,eval,llm_style_eval_015,64,6144,1536,bf16,NVIDIA GeForce RTX 4060,c01,64,32,32,2,2,8,0.0,0.0,63.48799914121628,64.4748792052269,19.02658090252832,1,-1,-1,llm8_g1,0,
2026-03-03T06:14:01.690263+00:00,TORCH,llm_style,tune,llm_style_tune_000,1,3072,1536,bf16,NVIDIA GeForce RTX 4060,torch_cublas,-1,-1,-1,-1,-1,-1,91.17607004009187,0.0,52.06400156021118,54.067198783159256,0.18126121153184985,7,-1,-1,torch_mm,0,torch_mm_cublas
2026-03-03T06:14:01.744991+00:00,TORCH,llm_style,tune,llm_style_tune_001,16,1024,8192,bf16,NVIDIA GeForce RTX 4060,torch_cublas,-1,-1,-1,-1,-1,-1,0.0,0.0,43.007999658584595,44.701441526412964,6.241523859071624,6,-1,-1,torch_mm,0,torch_mm_cublas
2026-03-03T06:14:02.056994+00:00,TORCH,llm_style,tune,llm_style_tune_002,16,8192,8192,bf16,NVIDIA GeForce RTX 4060,torch_cublas,-1,-1,-1,-1,-1,-1,0.0,0.0,558.0800175666809,583.4547162055969,3.8479851999779098,4,-1,-1,torch_mm,0,torch_mm_cublas
2026-03-03T06:14:02.146611+00:00,TORCH,llm_style,tune,llm_style_tune_003,64,6144,3072,bf16,NVIDIA GeForce RTX 4060,torch_cublas,-1,-1,-1,-1,-1,-1,0.0,0.0,161.79199516773224,165.57823538780212,14.93225361054099,1,-1,-1,torch_mm,0,torch_mm_cublas
2026-03-03T06:14:02.449524+00:00,TORCH,llm_style,tune,llm_style_tune_004,64,8192,8192,bf16,NVIDIA GeForce RTX 4060,torch_cublas,-1,-1,-1,-1,-1,-1,0.0,0.0,610.2079749107361,648.8473629951477,14.077060519008414,0,-1,-1,torch_mm,0,torch_mm_cublas
2026-03-03T06:14:02.524954+00:00,TORCH,llm_style,tune,llm_style_tune_005,64,2048,8192,bf16,NVIDIA GeForce RTX 4060,torch_cublas,-1,-1,-1,-1,-1,-1,0.0,0.0,142.33599603176117,242.3603194952011,15.087424881059643,2,-1,-1,torch_mm,0,torch_mm_cublas
2026-03-03T06:14:02.534467+00:00,TORCH,llm_style,tune,llm_style_tune_006,32,1024,1536,bf16,NVIDIA GeForce RTX 4060,torch_cublas,-1,-1,-1,-1,-1,-1,0.0,0.0,101.3759970664978,103.42399775981903,0.9929697257031139,3,-1,-1,torch_mm,0,torch_mm_cublas
2026-03-03T06:14:02.642784+00:00,TORCH,llm_style,tune,llm_style_tune_007,16,6144,4096,bf16,NVIDIA GeForce RTX 4060,torch_cublas,-1,-1,-1,-1,-1,-1,0.0,0.0,206.84799551963806,244.27775382995605,3.8932278071002364,5,-1,-1,torch_mm,0,torch_mm_cublas
2026-03-03T06:14:02.649544+00:00,TORCH,llm_style,eval,llm_style_eval_000,32,1536,1024,bf16,NVIDIA GeForce RTX 4060,torch_cublas,-1,-1,-1,-1,-1,-1,0.0,0.0,12.128000147640705,15.20640030503273,8.300073777586679,3,-1,-1,torch_mm,0,torch_mm_cublas
2026-03-03T06:14:02.726558+00:00,TORCH,llm_style,eval,llm_style_eval_001,32,2048,8192,bf16,NVIDIA GeForce RTX 4060,torch_cublas,-1,-1,-1,-1,-1,-1,0.0,0.0,139.93600010871887,239.71711814403534,7.673092150452993,2,-1,-1,torch_mm,0,torch_mm_cublas
2026-03-03T06:14:02.763021+00:00,TORCH,llm_style,eval,llm_style_eval_002,16,2048,4096,bf16,NVIDIA GeForce RTX 4060,torch_cublas,-1,-1,-1,-1,-1,-1,0.0,0.0,49.15200173854828,50.141441822052,5.46133314016131,7,-1,-1,torch_mm,0,torch_mm_cublas
2026-03-03T06:14:02.773316+00:00,TORCH,llm_style,eval,llm_style_eval_003,16,2048,1536,bf16,NVIDIA GeForce RTX 4060,torch_cublas,-1,-1,-1,-1,-1,-1,0.0,0.0,29.69600073993206,34.519039914011955,3.3897930189851655,7,-1,-1,torch_mm,0,torch_mm_cublas
2026-03-03T06:14:02.843485+00:00,TORCH,llm_style,eval,llm_style_eval_004,64,8192,2048,bf16,NVIDIA GeForce RTX 4060,torch_cublas,-1,-1,-1,-1,-1,-1,0.0,0.0,150.52799880504608,152.34304547309875,14.266340249306568,1,-1,-1,torch_mm,0,torch_mm_cublas
2026-03-03T06:14:02.955136+00:00,TORCH,llm_style,eval,llm_style_eval_005,64,3072,8192,bf16,NVIDIA GeForce RTX 4060,torch_cublas,-1,-1,-1,-1,-1,-1,0.0,0.0,220.15999257564545,231.00416362285614,14.631293516660206,2,-1,-1,torch_mm,0,torch_mm_cublas
2026-03-03T06:14:02.976135+00:00,TORCH,llm_style,eval,llm_style_eval_006,32,2048,2048,bf16,NVIDIA GeForce RTX 4060,torch_cublas,-1,-1,-1,-1,-1,-1,0.0,0.0,32.76799991726875,39.687678664922714,8.192000020682812,3,-1,-1,torch_mm,0,torch_mm_cublas
2026-03-03T06:14:03.049970+00:00,TORCH,llm_style,eval,llm_style_eval_007,8,8192,2048,bf16,NVIDIA GeForce RTX 4060,torch_cublas,-1,-1,-1,-1,-1,-1,0.0,0.0,263.16800713539124,265.98400592803955,1.020015536546199,5,-1,-1,torch_mm,0,torch_mm_cublas
2026-03-03T06:14:03.107406+00:00,TORCH,llm_style,eval,llm_style_eval_008,64,1536,8192,bf16,NVIDIA GeForce RTX 4060,torch_cublas,-1,-1,-1,-1,-1,-1,0.0,0.0,175.10400712490082,176.08704030513763,9.198034713455517,2,-1,-1,torch_mm,0,torch_mm_cublas
2026-03-03T06:14:03.232601+00:00,TORCH,llm_style,eval,llm_style_eval_009,64,4096,6144,bf16,NVIDIA GeForce RTX 4060,torch_cublas,-1,-1,-1,-1,-1,-1,0.0,0.0,626.6880035400391,756.4492774009705,5.140078402337243,3,-1,-1,torch_mm,0,torch_mm_cublas
2026-03-03T06:14:03.271301+00:00,TORCH,llm_style,eval,llm_style_eval_010,64,2048,4096,bf16,NVIDIA GeForce RTX 4060,torch_cublas,-1,-1,-1,-1,-1,-1,0.0,0.0,166.6879951953888,170.56767642498016,6.441626601492077,3,-1,-1,torch_mm,0,torch_mm_cublas
2026-03-03T06:14:03.358712+00:00,TORCH,llm_style,eval,llm_style_eval_011,32,3072,6144,bf16,NVIDIA GeForce RTX 4060,torch_cublas,-1,-1,-1,-1,-1,-1,0.0,0.0,259.0720057487488,260.09601354599,4.662640212742607,3,-1,-1,torch_mm,0,torch_mm_cublas
2026-03-03T06:14:03.367878+00:00,TORCH,llm_style,eval,llm_style_eval_012,16,1536,1536,bf16,NVIDIA GeForce RTX 4060,torch_cublas,-1,-1,-1,-1,-1,-1,0.0,0.0,39.8080013692379,52.654078900814056,1.8965401276925586,7,-1,-1,torch_mm,0,torch_mm_cublas
2026-03-03T06:14:03.389337+00:00,TORCH,llm_style,eval,llm_style_eval_013,64,2048,3072,bf16,NVIDIA GeForce RTX 4060,torch_cublas,-1,-1,-1,-1,-1,-1,0.0,0.0,142.33599603176117,147.1884834766388,5.657784330397366,3,-1,-1,torch_mm,0,torch_mm_cublas
2026-03-03T06:14:03.628418+00:00,TORCH,llm_style,eval,llm_style_eval_014,16,8192,6144,bf16,NVIDIA GeForce RTX 4060,torch_cublas,-1,-1,-1,-1,-1,-1,0.0,0.0,740.1919960975647,749.2403054237366,2.1759391407789623,5,-1,-1,torch_mm,0,torch_mm_cublas
2026-03-03T06:14:03.661752+00:00,TORCH,llm_style,eval,llm_style_eval_015,64,6144,1536,bf16,NVIDIA GeForce RTX 4060,torch_cublas,-1,-1,-1,-1,-1,-1,0.0,0.0,153.60000729560852,153.60000729560852,7.864319626464861,1,-1,-1,torch_mm,0,torch_mm_cublas
2026-03-03T06:14:03.835534+00:00,ONEKEY,llm_style,tune,llm_style_tune_000,1,3072,1536,bf16,NVIDIA GeForce RTX 4060,c02,32,64,32,2,2,8,0.0,0.0,80.89599758386612,90.11200070381165,0.11665823133235148,7,-1,-1,onekey:16x6144x4096,0,onekey_rep_shape=16x6144x4096
2026-03-03T06:14:03.874167+00:00,ONEKEY,llm_style,tune,llm_style_tune_001,16,1024,8192,bf16,NVIDIA GeForce RTX 4060,c02,32,64,32,2,2,8,0.0,0.0,306.17600679397583,434.04415130615234,0.87673576649861,6,-1,-1,onekey:16x6144x4096,0,onekey_rep_shape=16x6144x4096
2026-03-03T06:14:04.173186+00:00,ONEKEY,llm_style,tune,llm_style_tune_002,16,8192,8192,bf16,NVIDIA GeForce RTX 4060,c02,32,64,32,2,2,8,0.0,0.0,889.7920250892639,921.5551924705505,2.4134669534541673,4,-1,-1,onekey:16x6144x4096,0,onekey_rep_shape=16x6144x4096
2026-03-03T06:14:04.255792+00:00,ONEKEY,llm_style,tune,llm_style_tune_003,64,6144,3072,bf16,NVIDIA GeForce RTX 4060,c02,32,64,32,2,2,8,0.0,0.0,381.9519877433777,395.129599571228,6.325190551497235,1,-1,-1,onekey:16x6144x4096,0,onekey_rep_shape=16x6144x4096
2026-03-03T06:14:04.560798+00:00,ONEKEY,llm_style,tune,llm_style_tune_004,64,8192,8192,bf16,NVIDIA GeForce RTX 4060,c02,32,64,32,2,2,8,0.0,0.0,1594.3679809570312,1637.0893239974976,5.3876737958848295,0,-1,-1,onekey:16x6144x4096,0,onekey_rep_shape=16x6144x4096
2026-03-03T06:14:04.643405+00:00,ONEKEY,llm_style,tune,llm_style_tune_005,64,2048,8192,bf16,NVIDIA GeForce RTX 4060,c02,32,64,32,2,2,8,0.0,0.0,585.7279896736145,607.471342086792,3.6663497149874007,2,-1,-1,onekey:16x6144x4096,0,onekey_rep_shape=16x6144x4096
2026-03-03T06:14:04.650947+00:00,ONEKEY,llm_style,tune,llm_style_tune_006,32,1024,1536,bf16,NVIDIA GeForce RTX 4060,c02,32,64,32,2,2,8,0.0,0.0,113.66400122642517,126.93503856658936,0.8856216120658376,3,-1,-1,onekey:16x6144x4096,0,onekey_rep_shape=16x6144x4096
2026-03-03T06:14:04.650972+00:00,ONEKEY,llm_style,tune,llm_style_tune_007,16,6144,4096,bf16,NVIDIA GeForce RTX 4060,c02,32,64,32,2,2,8,0.0,152.849,369.6640133857727,378.71615409851074,2.1784819155755937,5,-1,-1,onekey:16x6144x4096,0,onekey_rep_shape=16x6144x4096
2026-03-03T06:14:04.658165+00:00,ONEKEY,llm_style,eval,llm_style_eval_000,32,1536,1024,bf16,NVIDIA GeForce RTX 4060,c02,32,64,32,2,2,8,0.0,0.0,94.11200135946274,171.9500869512558,1.069611681251092,3,-1,-1,onekey:16x6144x4096,0,onekey_rep_shape=16x6144x4096
2026-03-03T06:14:04.735174+00:00,ONEKEY,llm_style,eval,llm_style_eval_001,32,2048,8192,bf16,NVIDIA GeForce RTX 4060,c02,32,64,32,2,2,8,0.0,0.0,498.6880123615265,504.4838523864746,2.153133416853793,2,-1,-1,onekey:16x6144x4096,0,onekey_rep_shape=16x6144x4096
2026-03-03T06:14:04.774805+00:00,ONEKEY,llm_style,eval,llm_style_eval_002,16,2048,4096,bf16,NVIDIA GeForce RTX 4060,c02,32,64,32,2,2,8,0.0,0.0,228.35199534893036,275.50718784332275,1.1755336562302452,7,-1,-1,onekey:16x6144x4096,0,onekey_rep_shape=16x6144x4096
2026-03-03T06:14:04.789761+00:00,ONEKEY,llm_style,eval,llm_style_eval_003,16,2048,1536,bf16,NVIDIA GeForce RTX 4060,c02,32,64,32,2,2,8,0.0,0.0,93.18400174379349,94.16704207658768,1.0802637160482826,7,-1,-1,onekey:16x6144x4096,0,onekey_rep_shape=16x6144x4096
2026-03-03T06:14:04.869073+00:00,ONEKEY,llm_style,eval,llm_style_eval_004,64,8192,2048,bf16,NVIDIA GeForce RTX 4060,c02,32,64,32,2,2,8,0.0,0.0,456.7039906978607,490.2092683315277,4.702134624920981,1,-1,-1,onekey:16x6144x4096,0,onekey_rep_shape=16x6144x4096
2026-03-03T06:14:04.979923+00:00,ONEKEY,llm_style,eval,llm_style_eval_005,64,3072,8192,bf16,NVIDIA GeForce RTX 4060,c02,32,64,32,2,2,8,0.0,0.0,611.0399961471558,675.2972912788391,5.2717096954554155,2,-1,-1,onekey:16x6144x4096,0,onekey_rep_shape=16x6144x4096
2026-03-03T06:14:04.997605+00:00,ONEKEY,llm_style,eval,llm_style_eval_006,32,2048,2048,bf16,NVIDIA GeForce RTX 4060,c02,32,64,32,2,2,8,0.0,0.0,131.071999669075,161.58719539642334,2.048000005170703,3,-1,-1,onekey:16x6144x4096,0,onekey_rep_shape=16x6144x4096
2026-03-03T06:14:05.071044+00:00,ONEKEY,llm_style,eval,llm_style_eval_007,8,8192,2048,bf16,NVIDIA GeForce RTX 4060,c02,32,64,32,2,2,8,0.0,0.0,246.59200012683868,277.42207765579224,1.0885813646100677,5,-1,-1,onekey:16x6144x4096,0,onekey_rep_shape=16x6144x4096
2026-03-03T06:14:05.129174+00:00,ONEKEY,llm_style,eval,llm_style_eval_008,64,1536,8192,bf16,NVIDIA GeForce RTX 4060,c02,32,64,32,2,2,8,0.0,0.0,520.19202709198,523.9961576461792,3.096188815126174,2,-1,-1,onekey:16x6144x4096,0,onekey_rep_shape=16x6144x4096
2026-03-03T06:14:05.253321+00:00,ONEKEY,llm_style,eval,llm_style_eval_009,64,4096,6144,bf16,NVIDIA GeForce RTX 4060,c02,32,64,32,2,2,8,0.0,0.0,864.2560243606567,944.1267204284668,3.7271657717201783,3,-1,-1,onekey:16x6144x4096,0,onekey_rep_shape=16x6144x4096
2026-03-03T06:14:05.330853+00:00,ONEKEY,llm_style,eval,llm_style_eval_010,64,2048,4096,bf16,NVIDIA GeForce RTX 4060,c02,32,64,32,2,2,8,0.0,0.0,327.61600613594055,469.23649191856384,3.277440063641039,3,-1,-1,onekey:16x6144x4096,0,onekey_rep_shape=16x6144x4096
2026-03-03T06:14:05.427871+00:00,ONEKEY,llm_style,eval,llm_style_eval_011,32,3072,6144,bf16,NVIDIA GeForce RTX 4060,c02,32,64,32,2,2,8,0.0,0.0,481.27999901771545,482.30400681495667,2.5098893668247704,3,-1,-1,onekey:16x6144x4096,0,onekey_rep_shape=16x6144x4096
2026-03-03T06:14:05.436866+00:00,ONEKEY,llm_style,eval,llm_style_eval_012,16,1536,1536,bf16,NVIDIA GeForce RTX 4060,c02,32,64,32,2,2,8,0.0,0.0,125.88800489902496,127.95904576778412,0.5997193462598497,7,-1,-1,onekey:16x6144x4096,0,onekey_rep_shape=16x6144x4096
2026-03-03T06:14:05.458091+00:00,ONEKEY,llm_style,eval,llm_style_eval_013,64,2048,3072,bf16,NVIDIA GeForce RTX 4060,c02,32,64,32,2,2,8,0.0,0.0,266.2400007247925,292.7923083305359,3.0247384533041326,3,-1,-1,onekey:16x6144x4096,0,onekey_rep_shape=16x6144x4096
2026-03-03T06:14:05.690828+00:00,ONEKEY,llm_style,eval,llm_style_eval_014,16,8192,6144,bf16,NVIDIA GeForce RTX 4060,c02,32,64,32,2,2,8,0.0,0.0,999.3600249290466,1006.3053131103516,1.611644148078018,5,-1,-1,onekey:16x6144x4096,0,onekey_rep_shape=16x6144x4096
2026-03-03T06:14:05.727480+00:00,ONEKEY,llm_style,eval,llm_style_eval_015,64,6144,1536,bf16,NVIDIA GeForce RTX 4060,c02,32,64,32,2,2,8,0.0,0.0,309.2480003833771,310.2720081806183,3.906119200455568,1,-1,-1,onekey:16x6144x4096,0,onekey_rep_shape=16x6144x4096
