results/llm_hp_m16_n3072_k4096.csv
timestamp,method,workload,split,shape_id,M,N,K,dtype,gpu,config_id,BLOCK_M,BLOCK_N,BLOCK_K,num_warps,num_stages,GROUP_M,compile_time_ms,tune_time_ms,runtime_cost_us,p99_us,runtime_perf_tflops,bucket_m,bucket_n,bucket_k,cache_key,invalid_config,notes
2026-03-03T03:27:29.510532+00:00,FULL,llm_style,tune,llm_style_tune_000,32,3072,2048,bf16,NVIDIA GeForce RTX 4060,c11,32,128,32,4,2,8,0.7395680295303464,489.276,55.296000093221664,63.48799914121628,7.2817777655016735,3,-1,-1,32x3072x2048,0,
2026-03-03T03:27:29.628958+00:00,FULL,llm_style,tune,llm_style_tune_001,4,4096,1536,bf16,NVIDIA GeForce RTX 4060,c11,32,128,32,4,2,8,0.0,118.392,49.26399886608124,68.60864151269195,1.0216719949353086,5,-1,-1,4x4096x1536,0,
2026-03-03T03:27:29.736460+00:00,FULL,llm_style,tune,llm_style_tune_002,8,8192,1024,bf16,NVIDIA GeForce RTX 4060,c11,32,128,32,4,2,8,0.0,107.466,53.23199927806854,60.85279900580643,2.521373042911379,5,-1,-1,8x8192x1024,0,
2026-03-03T03:27:29.838458+00:00,FULL,llm_style,tune,llm_style_tune_003,64,1024,4096,bf16,NVIDIA GeForce RTX 4060,c04,64,64,64,4,3,8,0.0,101.954,64.51199948787689,73.06720107793808,8.322031812095497,3,-1,-1,64x1024x4096,0,
2026-03-03T03:27:29.984190+00:00,FULL,llm_style,tune,llm_style_tune_004,16,3072,4096,bf16,NVIDIA GeForce RTX 4060,c00,32,32,32,2,2,8,0.0,145.686,74.24000278115273,227.07359701395018,5.423668762337673,7,-1,-1,16x3072x4096,0,
2026-03-03T03:27:30.076959+00:00,FULL,llm_style,tune,llm_style_tune_005,16,1536,4096,bf16,NVIDIA GeForce RTX 4060,c00,32,32,32,2,2,8,0.0,92.723,56.32000043988228,112.96703666448576,3.5746908811711084,7,-1,-1,16x1536x4096,0,
2026-03-03T03:27:30.134712+00:00,FULL,llm_style,tune,llm_style_tune_006,2,2048,1024,bf16,NVIDIA GeForce RTX 4060,c02,32,64,32,2,2,8,0.0,57.706,41.45600087940693,290.872000306844,0.20234966764888798,7,-1,-1,2x2048x1024,0,
2026-03-03T03:27:30.214358+00:00,FULL,llm_style,tune,llm_style_tune_007,32,6144,1024,bf16,NVIDIA GeForce RTX 4060,c11,32,128,32,4,2,8,0.0,79.602,41.74400120973587,112.56224043667298,9.64577358018306,1,-1,-1,32x6144x1024,0,
2026-03-03T03:27:30.287497+00:00,FULL,llm_style,tune,llm_style_tune_008,8,1536,2048,bf16,NVIDIA GeForce RTX 4060,c04,64,64,64,4,3,8,0.0,73.094,46.08000069856644,89.90335933864108,1.0922666501080551,7,-1,-1,8x1536x2048,0,
2026-03-03T03:27:30.402876+00:00,FULL,llm_style,tune,llm_style_tune_009,16,1024,6144,bf16,NVIDIA GeForce RTX 4060,c04,64,64,64,4,3,8,0.0,115.335,71.47200033068657,87.20383971929547,2.816859624307454,6,-1,-1,16x1024x6144,0,
2026-03-03T03:27:30.478605+00:00,FULL,llm_style,tune,llm_style_tune_010,64,1536,2048,bf16,NVIDIA GeForce RTX 4060,c01,64,32,32,2,2,8,0.0,75.684,37.776000797748566,141.17888264358015,10.658968008704562,3,-1,-1,64x1536x2048,0,
2026-03-03T03:27:30.579869+00:00,FULL,llm_style,tune,llm_style_tune_011,64,1536,4096,bf16,NVIDIA GeForce RTX 4060,c04,64,64,64,4,3,8,0.0,101.219,61.39199994504452,72.40223996341228,13.117448017997065,3,-1,-1,64x1536x4096,0,
2026-03-03T03:27:30.649237+00:00,FULL,llm_style,tune,llm_style_tune_012,32,1024,2048,bf16,NVIDIA GeForce RTX 4060,c04,64,64,64,4,3,8,0.0,69.32,47.85599932074547,69.83263943344352,2.804616556023247,3,-1,-1,32x1024x2048,0,
2026-03-03T03:27:30.705219+00:00,FULL,llm_style,tune,llm_style_tune_013,64,1536,1024,bf16,NVIDIA GeForce RTX 4060,c00,32,32,32,2,2,8,0.0,55.945,32.68800023943186,55.90016029775141,6.159036665606046,3,-1,-1,64x1536x1024,0,
2026-03-03T03:27:30.936416+00:00,FULL,llm_style,tune,llm_style_tune_014,4,6144,3072,bf16,NVIDIA GeForce RTX 4060,c11,32,128,32,4,2,8,0.0,231.16,176.7840012907982,218.75712320208547,0.8541210906954365,5,-1,-1,4x6144x3072,0,
2026-03-03T03:27:31.030517+00:00,FULL,llm_style,tune,llm_style_tune_015,1,6144,1024,bf16,NVIDIA GeForce RTX 4060,c11,32,128,32,4,2,8,0.0,94.059,41.919998824596405,45.54560028016567,0.300164893912569,5,-1,-1,1x6144x1024,0,
2026-03-03T03:27:31.420103+00:00,FULL,llm_style,tune,llm_style_tune_016,4,8192,4096,bf16,NVIDIA GeForce RTX 4060,c11,32,128,32,4,2,8,0.0,389.548,293.8399910926819,300.58688163757324,0.9135429626232568,5,-1,-1,4x8192x4096,0,
2026-03-03T03:27:31.441355+00:00,FULL,llm_style,tune,llm_style_tune_017,64,1536,2048,bf16,NVIDIA GeForce RTX 4060,c01,64,32,32,2,2,8,0.0,0.0,53.247999399900436,120.36096334457386,7.561846239067394,3,-1,-1,64x1536x2048,0,
2026-03-03T03:27:31.607041+00:00,FULL,llm_style,tune,llm_style_tune_018,64,8192,1536,bf16,NVIDIA GeForce RTX 4060,c06,64,128,32,4,3,8,0.0,165.643,108.5439994931221,133.38496364653105,14.838339691933468,1,-1,-1,64x8192x1536,0,
2026-03-03T03:27:31.663255+00:00,FULL,llm_style,tune,llm_style_tune_019,2,1536,1024,bf16,NVIDIA GeForce RTX 4060,c04,64,64,64,4,3,8,0.0,56.168,36.14400140941143,45.53120017051697,0.1740663942748128,7,-1,-1,2x1536x1024,0,
2026-03-03T03:27:31.717840+00:00,FULL,llm_style,tune,llm_style_tune_020,16,1024,1536,bf16,NVIDIA GeForce RTX 4060,c04,64,64,64,4,3,8,0.0,54.548,38.91199827194214,48.05792003870008,1.2934737416528952,7,-1,-1,16x1024x1536,0,
2026-03-03T03:27:31.826478+00:00,FULL,llm_style,tune,llm_style_tune_021,1,6144,1536,bf16,NVIDIA GeForce RTX 4060,c11,32,128,32,4,2,8,0.0,108.598,47.00800031423569,51.074559576809406,0.4015139523874657,5,-1,-1,1x6144x1536,0,
2026-03-03T03:27:32.047488+00:00,FULL,llm_style,tune,llm_style_tune_022,8,4096,4096,bf16,NVIDIA GeForce RTX 4060,c11,32,128,32,4,2,8,0.0,220.961,160.76800227165222,228.9759950339793,1.6697069827764632,5,-1,-1,8x4096x4096,0,
2026-03-03T03:27:32.443560+00:00,FULL,llm_style,tune,llm_style_tune_023,2,4096,8192,bf16,NVIDIA GeForce RTX 4060,c11,32,128,32,4,2,8,0.0,396.029,292.81599819660187,340.85760205984116,0.4583688351272523,4,-1,-1,2x4096x8192,0,
2026-03-03T03:27:32.470484+00:00,FULL,llm_style,tune,llm_style_tune_024,64,1536,2048,bf16,NVIDIA GeForce RTX 4060,c01,64,32,32,2,2,8,0.0,0.0,57.360000908374786,501.76255285739865,7.019755537368045,3,-1,-1,64x1536x2048,0,
2026-03-03T03:27:32.494945+00:00,FULL,llm_style,tune,llm_style_tune_025,4,4096,1536,bf16,NVIDIA GeForce RTX 4060,c11,32,128,32,4,2,8,0.0,0.0,46.08000069856644,65.99744062870738,1.0922666501080551,5,-1,-1,4x4096x1536,0,
2026-03-03T03:27:32.572327+00:00,FULL,llm_style,tune,llm_style_tune_026,4,3072,2048,bf16,NVIDIA GeForce RTX 4060,c00,32,32,32,2,2,8,0.0,77.326,40.991999208927155,91.66240110993385,1.2278407731096674,7,-1,-1,4x3072x2048,0,
2026-03-03T03:27:32.645054+00:00,FULL,llm_style,tune,llm_style_tune_027,8,4096,1024,bf16,NVIDIA GeForce RTX 4060,c11,32,128,32,4,2,8,0.0,72.671,42.79999993741512,52.83327974379063,1.5679641144423093,5,-1,-1,8x4096x1024,0,
2026-03-03T03:27:32.698635+00:00,FULL,llm_style,tune,llm_style_tune_028,16,1536,1024,bf16,NVIDIA GeForce RTX 4060,c04,64,64,64,4,3,8,0.0,53.517,35.840000957250595,55.44351994991299,1.404342819634263,7,-1,-1,16x1536x1024,0,
2026-03-03T03:27:33.108290+00:00,FULL,llm_style,tune,llm_style_tune_029,64,4096,8192,bf16,NVIDIA GeForce RTX 4060,c11,32,128,32,4,2,8,0.0,409.598,300.03198981285095,344.85632151365274,14.315031202769559,0,-1,-1,64x4096x8192,0,
2026-03-03T03:27:33.251677+00:00,FULL,llm_style,tune,llm_style_tune_030,1,8192,1536,bf16,NVIDIA GeForce RTX 4060,c11,32,128,32,4,2,8,0.0,143.341,61.43999844789505,69.15072105824947,0.40960001034736665,5,-1,-1,1x8192x1536,0,
2026-03-03T03:27:33.806385+00:00,FULL,llm_style,tune,llm_style_tune_031,1,8192,6144,bf16,NVIDIA GeForce RTX 4060,c11,32,128,32,4,2,8,0.0,554.664,423.9040017127991,481.12641006708134,0.23746719916128747,4,-1,-1,1x8192x6144,0,
2026-03-03T03:27:34.111338+00:00,FULL,llm_style,tune,llm_style_tune_032,32,3072,8192,bf16,NVIDIA GeForce RTX 4060,c04,64,64,64,4,3,8,0.0,304.908,230.3999960422516,290.80384105443954,6.990506786747687,2,-1,-1,32x3072x8192,0,
2026-03-03T03:27:34.237661+00:00,FULL,llm_style,tune,llm_style_tune_033,4,1536,6144,bf16,NVIDIA GeForce RTX 4060,c04,64,64,64,4,3,8,0.0,126.277,71.68000191450119,145.09055651724313,1.0532571147256975,6,-1,-1,4x1536x6144,0,
2026-03-03T03:27:34.329586+00:00,FULL,llm_style,tune,llm_style_tune_034,1,4096,1536,bf16,NVIDIA GeForce RTX 4060,c11,32,128,32,4,2,8,0.0,91.881,46.08000069856644,55.06207939237354,0.2730666625270138,5,-1,-1,1x4096x1536,0,
2026-03-03T03:27:34.423254+00:00,FULL,llm_style,tune,llm_style_tune_035,4,1536,4096,bf16,NVIDIA GeForce RTX 4060,c04,64,64,64,4,3,8,0.0,93.628,58.36800113320351,64.38655853271484,0.8623157727319891,7,-1,-1,4x1536x4096,0,
2026-03-03T03:27:34.737187+00:00,FULL,llm_style,tune,llm_style_tune_036,32,8192,3072,bf16,NVIDIA GeForce RTX 4060,c11,32,128,32,4,2,8,0.0,313.889,230.14400154352188,238.11072245240211,6.9982824892154385,1,-1,-1,32x8192x3072,0,
2026-03-03T03:27:34.767551+00:00,FULL,llm_style,tune,llm_style_tune_037,32,3072,2048,bf16,NVIDIA GeForce RTX 4060,c11,32,128,32,4,2,8,0.0,0.0,51.19999870657921,61.8806393817067,7.864320198669438,3,-1,-1,32x3072x2048,0,
2026-03-03T03:27:34.882857+00:00,FULL,llm_style,tune,llm_style_tune_038,2,2048,4096,bf16,NVIDIA GeForce RTX 4060,c00,32,32,32,2,2,8,0.0,115.248,60.416001826524734,116.90720051527006,0.5553898137176703,7,-1,-1,2x2048x4096,0,
2026-03-03T03:27:34.970886+00:00,FULL,llm_style,tune,llm_style_tune_039,64,2048,1536,bf16,NVIDIA GeForce RTX 4060,c10,64,128,64,8,3,8,0.0,87.98,49.15200173854828,52.19263881444931,8.191999710241964,3,-1,-1,64x2048x1536,0,
2026-03-03T03:27:35.088709+00:00,FULL,llm_style,tune,llm_style_tune_040,64,1024,6144,bf16,NVIDIA GeForce RTX 4060,c04,64,64,64,4,3,8,0.0,117.768,71.68000191450119,76.141442283988,11.234742557074105,2,-1,-1,64x1024x6144,0,
2026-03-03T03:27:35.668967+00:00,FULL,llm_style,tune,llm_style_tune_041,4,8192,6144,bf16,NVIDIA GeForce RTX 4060,c11,32,128,32,4,2,8,0.0,580.205,423.96800220012665,556.6131168603895,0.9497254083102589,4,-1,-1,4x8192x6144,0,
2026-03-03T03:27:35.791089+00:00,FULL,llm_style,tune,llm_style_tune_042,1,1024,6144,bf16,NVIDIA GeForce RTX 4060,c04,64,64,64,4,3,8,0.0,122.059,71.68000191450119,106.52671866118897,0.1755428524542829,6,-1,-1,1x1024x6144,0,
2026-03-03T03:27:36.032184+00:00,FULL,llm_style,tune,llm_style_tune_043,64,2048,8192,bf16,NVIDIA GeForce RTX 4060,c06,64,128,32,4,3,8,0.0,241.043,167.92000085115433,181.8927951157093,12.788730568811438,2,-1,-1,64x2048x8192,0,
2026-03-03T03:27:36.096536+00:00,FULL,llm_style,tune,llm_style_tune_044,16,2048,1024,bf16,NVIDIA GeForce RTX 4060,c11,32,128,32,4,2,8,0.0,64.306,40.95999896526337,43.21152113378048,1.6384000413894664,7,-1,-1,16x2048x1024,0,
2026-03-03T03:27:36.151835+00:00,FULL,llm_style,tune,llm_style_tune_045,4,1024,1536,bf16,NVIDIA GeForce RTX 4060,c00,32,32,32,2,2,8,0.0,55.25,37.82400116324425,99.91968058049679,0.33267004053044336,7,-1,-1,4x1024x1536,0,
2026-03-03T03:27:36.180799+00:00,FULL,llm_style,tune,llm_style_tune_046,64,1536,4096,bf16,NVIDIA GeForce RTX 4060,c04,64,64,64,4,3,8,0.0,0.0,66.56000018119812,160.8739179372787,12.09895381321653,3,-1,-1,64x1536x4096,0,
2026-03-03T03:27:36.248413+00:00,FULL,llm_style,tune,llm_style_tune_047,16,2048,1536,bf16,NVIDIA GeForce RTX 4060,c00,32,32,32,2,2,8,0.0,67.54,42.83200018107891,278.88768598437287,2.3501890076211787,7,-1,-1,16x2048x1536,0,
2026-03-03T03:27:36.690659+00:00,FULL,llm_style,tune,llm_style_tune_048,64,6144,6144,bf16,NVIDIA GeForce RTX 4060,c06,64,128,32,4,3,8,0.0,442.203,332.64000713825226,413.88672173023207,14.525727826814846,0,-1,-1,64x6144x6144,0,
2026-03-03T03:27:37.086802+00:00,FULL,llm_style,tune,llm_style_tune_049,4,4096,8192,bf16,NVIDIA GeForce RTX 4060,c11,32,128,32,4,2,8,0.0,396.097,292.1919971704483,308.08129370212555,0.918695442036388,4,-1,-1,4x4096x8192,0,
2026-03-03T03:27:37.244112+00:00,FULL,llm_style,tune,llm_style_tune_050,1,4096,3072,bf16,NVIDIA GeForce RTX 4060,c00,32,32,32,2,2,8,0.0,157.261,66.52799993753433,200.62527924776074,0.3782741706293463,5,-1,-1,1x4096x3072,0,
2026-03-03T03:27:37.351882+00:00,FULL,llm_style,tune,llm_style_tune_051,2,4096,2048,bf16,NVIDIA GeForce RTX 4060,c00,32,32,32,2,2,8,0.0,107.725,52.719999104738235,131.66528329253194,0.6364649576973206,5,-1,-1,2x4096x2048,0,
2026-03-03T03:27:37.497622+00:00,FULL,llm_style,tune,llm_style_tune_052,4,8192,1536,bf16,NVIDIA GeForce RTX 4060,c11,32,128,32,4,2,8,0.0,145.697,59.39200147986412,66.98591947555542,1.6948965094925827,5,-1,-1,4x8192x1536,0,
2026-03-03T03:27:37.596688+00:00,FULL,llm_style,tune,llm_style_tune_053,1,1536,4096,bf16,NVIDIA GeForce RTX 4060,c04,64,64,64,4,3,8,0.0,99.021,57.34400078654289,65.52735947072506,0.219428568418841,7,-1,-1,1x1536x4096,0,
2026-03-03T03:27:38.166187+00:00,FULL,llm_style,tune,llm_style_tune_054,8,8192,6144,bf16,NVIDIA GeForce RTX 4060,c11,32,128,32,4,2,8,0.0,569.452,424.9599874019623,453.9500868320465,1.8950169236480956,4,-1,-1,8x8192x6144,0,
2026-03-03T03:27:38.283443+00:00,FULL,llm_style,tune,llm_style_tune_055,64,6144,1536,bf16,NVIDIA GeForce RTX 4060,c06,64,128,32,4,3,8,0.0,117.204,66.49599969387054,71.04160040616988,18.165898062456638,1,-1,-1,64x6144x1536,0,
2026-03-03T03:27:38.357835+00:00,FULL,llm_style,tune,llm_style_tune_056,1,3072,1536,bf16,NVIDIA GeForce RTX 4060,c00,32,32,32,2,2,8,0.0,74.346,45.48799991607666,175.3606414794922,0.20746535388258847,7,-1,-1,1x3072x1536,0,
2026-03-03T03:27:38.406494+00:00,FULL,llm_style,tune,llm_style_tune_057,64,1024,1024,bf16,NVIDIA GeForce RTX 4060,c04,64,64,64,4,3,8,0.0,48.619,34.81600061058998,68.0550405383109,3.8550587559208336,3,-1,-1,64x1024x1024,0,
2026-03-03T03:27:38.791962+00:00,FULL,llm_style,tune,llm_style_tune_058,16,8192,4096,bf16,NVIDIA GeForce RTX 4060,c02,32,64,32,2,2,8,0.0,385.432,296.9599962234497,315.9238389134407,3.6157793563280327,5,-1,-1,16x8192x4096,0,
2026-03-03T03:27:39.120046+00:00,FULL,llm_style,tune,llm_style_tune_059,16,4096,6144,bf16,NVIDIA GeForce RTX 4060,c02,32,64,32,2,2,8,0.0,328.029,229.08799350261688,273.3081507682799,3.515270947583733,4,-1,-1,16x4096x6144,0,
2026-03-03T03:27:39.412516+00:00,FULL,llm_style,tune,llm_style_tune_060,2,3072,8192,bf16,NVIDIA GeForce RTX 4060,c04,64,64,64,4,3,8,0.0,292.425,228.255994617939,235.44767707586288,0.4410105249086357,6,-1,-1,2x3072x8192,0,
2026-03-03T03:27:39.579444+00:00,FULL,llm_style,tune,llm_style_tune_061,64,4096,8192,bf16,NVIDIA GeForce RTX 4060,c11,32,128,32,4,2,8,0.0,0.0,302.0800054073334,375.85856169462187,14.217979406510347,0,-1,-1,64x4096x8192,0,
2026-03-03T03:27:39.729819+00:00,FULL,llm_style,tune,llm_style_tune_062,32,4096,3072,bf16,NVIDIA GeForce RTX 4060,c00,32,32,32,2,2,8,0.0,150.315,55.296000093221664,149.50336173176754,14.563555531003347,1,-1,-1,32x4096x3072,0,
2026-03-03T03:27:39.858821+00:00,FULL,llm_style,tune,llm_style_tune_063,2,3072,8192,bf16,NVIDIA GeForce RTX 4060,c04,64,64,64,4,3,8,0.0,0.0,229.37600314617157,415.7107216119765,0.438857136837682,6,-1,-1,2x3072x8192,0,
2026-03-03T03:27:39.916245+00:00,FULL,llm_style,eval,llm_style_eval_000,32,1536,1024,bf16,NVIDIA GeForce RTX 4060,c04,64,64,64,4,3,8,0.0,57.368,40.95999896526337,47.626241222023964,2.4576000620842,3,-1,-1,32x1536x1024,0,
2026-03-03T03:27:40.147560+00:00,FULL,llm_style,eval,llm_style_eval_001,32,2048,8192,bf16,NVIDIA GeForce RTX 4060,c10,64,128,64,8,3,8,0.0,231.271,165.632002055645,175.48096179962158,6.4826954373181485,2,-1,-1,32x2048x8192,0,
2026-03-03T03:27:40.275724+00:00,FULL,llm_style,eval,llm_style_eval_002,16,2048,4096,bf16,NVIDIA GeForce RTX 4060,c00,32,32,32,2,2,8,0.0,128.117,63.48799914121628,156.90688058733934,4.2281290894507375,7,-1,-1,16x2048x4096,0,
2026-03-03T03:27:40.291915+00:00,FULL,llm_style,eval,llm_style_eval_003,16,2048,1536,bf16,NVIDIA GeForce RTX 4060,c00,32,32,32,2,2,8,0.0,0.0,31.232000328600407,122.62336164712903,3.2230819333021885,7,-1,-1,16x2048x1536,0,
2026-03-03T03:27:40.510590+00:00,FULL,llm_style,eval,llm_style_eval_004,64,8192,2048,bf16,NVIDIA GeForce RTX 4060,c10,64,128,64,8,3,8,0.0,218.633,167.93599724769592,194.28352236747736,12.787512404696566,1,-1,-1,64x8192x2048,0,
2026-03-03T03:27:40.811397+00:00,FULL,llm_style,eval,llm_style_eval_005,64,3072,8192,bf16,NVIDIA GeForce RTX 4060,c10,64,128,64,8,3,8,0.0,300.758,232.56000131368637,262.5612673163414,13.851158642087727,2,-1,-1,64x3072x8192,0,
2026-03-03T03:27:40.902097+00:00,FULL,llm_style,eval,llm_style_eval_006,32,2048,2048,bf16,NVIDIA GeForce RTX 4060,c11,32,128,32,4,2,8,0.0,90.655,53.247999399900436,60.49791995435952,5.04123082604493,3,-1,-1,32x2048x2048,0,
2026-03-03T03:27:41.116646+00:00,FULL,llm_style,eval,llm_style_eval_007,8,8192,2048,bf16,NVIDIA GeForce RTX 4060,c11,32,128,32,4,2,8,0.0,214.505,160.89599579572678,192.3584017157554,1.6683787229907516,5,-1,-1,8x8192x2048,0,
2026-03-03T03:27:41.316907+00:00,FULL,llm_style,eval,llm_style_eval_008,64,1536,8192,bf16,NVIDIA GeForce RTX 4060,c04,64,64,64,4,3,8,0.0,200.206,117.76000261306763,130.69311954081056,13.677077957378314,2,-1,-1,64x1536x8192,0,
2026-03-03T03:27:41.635765+00:00,FULL,llm_style,eval,llm_style_eval_009,64,4096,6144,bf16,NVIDIA GeForce RTX 4060,c03,64,64,32,4,2,8,0.0,318.814,233.39200019836426,304.20768439769734,13.801781848830379,0,-1,-1,64x4096x6144,0,
2026-03-03T03:27:41.772578+00:00,FULL,llm_style,eval,llm_style_eval_010,64,2048,4096,bf16,NVIDIA GeForce RTX 4060,c03,64,64,32,4,2,8,0.0,136.767,78.84799689054489,86.98687896132469,13.617870666905405,3,-1,-1,64x2048x4096,0,
2026-03-03T03:27:42.005689+00:00,FULL,llm_style,eval,llm_style_eval_011,32,3072,6144,bf16,NVIDIA GeForce RTX 4060,c06,64,128,32,4,3,8,0.0,233.063,180.2240014076233,270.3894305229187,6.702545402195828,2,-1,-1,32x3072x6144,0,
2026-03-03T03:27:42.077679+00:00,FULL,llm_style,eval,llm_style_eval_012,16,1536,1536,bf16,NVIDIA GeForce RTX 4060,c04,64,64,64,4,3,8,0.0,71.944,42.78400167822838,49.19711973518132,1.7646192277151724,7,-1,-1,16x1536x1536,0,
2026-03-03T03:27:42.169057+00:00,FULL,llm_style,eval,llm_style_eval_013,64,2048,3072,bf16,NVIDIA GeForce RTX 4060,c03,64,64,32,4,2,8,0.0,91.333,63.839998096227646,85.080961510539,12.614448496476163,3,-1,-1,64x2048x3072,0,
2026-03-03T03:27:42.742287+00:00,FULL,llm_style,eval,llm_style_eval_014,16,8192,6144,bf16,NVIDIA GeForce RTX 4060,c11,32,128,32,4,2,8,0.0,573.185,425.9040057659149,473.8368007540703,3.7816332182731895,4,-1,-1,16x8192x6144,0,
2026-03-03T03:27:42.785898+00:00,FULL,llm_style,eval,llm_style_eval_015,64,6144,1536,bf16,NVIDIA GeForce RTX 4060,c06,64,128,32,4,3,8,0.0,0.0,71.68000191450119,113.11103709042064,16.85211383561116,1,-1,-1,64x6144x1536,0,
2026-03-03T03:27:43.002174+00:00,FULL,llm_style,eval,llm_style_eval_016,16,4096,4096,bf16,NVIDIA GeForce RTX 4060,c11,32,128,32,4,2,8,0.0,216.179,161.79199516773224,257.8464037179947,3.3182785801202197,5,-1,-1,16x4096x4096,0,
2026-03-03T03:27:43.410044+00:00,FULL,llm_style,eval,llm_style_eval_017,64,8192,4096,bf16,NVIDIA GeForce RTX 4060,c10,64,128,64,8,3,8,0.0,407.826,303.616002202034,347.4022457003593,14.146050487622245,1,-1,-1,64x8192x4096,0,
2026-03-03T03:27:43.724234+00:00,FULL,llm_style,eval,llm_style_eval_018,32,4096,6144,bf16,NVIDIA GeForce RTX 4060,c11,32,128,32,4,2,8,0.0,314.141,229.3279990553856,316.8051153421401,7.023184009951689,0,-1,-1,32x4096x6144,0,
2026-03-03T03:27:44.028873+00:00,FULL,llm_style,eval,llm_style_eval_019,16,3072,8192,bf16,NVIDIA GeForce RTX 4060,c06,64,128,32,4,3,8,0.0,304.594,228.83199900388718,276.99007987976074,3.5192034833656294,6,-1,-1,16x3072x8192,0,
2026-03-03T03:27:44.103852+00:00,FULL,llm_style,eval,llm_style_eval_020,4,1536,1536,bf16,NVIDIA GeForce RTX 4060,c00,32,32,32,2,2,8,0.0,74.932,39.93599861860275,184.84223917126656,0.47261540096328164,7,-1,-1,4x1536x1536,0,
2026-03-03T03:27:44.211349+00:00,FULL,llm_style,eval,llm_style_eval_021,4,6144,1536,bf16,NVIDIA GeForce RTX 4060,c02,32,64,32,2,2,8,0.0,107.448,47.53599874675274,64.64064110070464,1.588216803905006,5,-1,-1,4x6144x1536,0,
2026-03-03T03:27:44.244558+00:00,FULL,llm_style,eval,llm_style_eval_022,32,6144,1024,bf16,NVIDIA GeForce RTX 4060,c11,32,128,32,4,2,8,0.0,0.0,47.07200080156326,264.5673593878746,8.553984898526512,1,-1,-1,32x6144x1024,0,
2026-03-03T03:27:44.255027+00:00,FULL,llm_style,eval,llm_style_eval_023,16,1024,1536,bf16,NVIDIA GeForce RTX 4060,c04,64,64,64,4,3,8,0.0,0.0,43.007999658584595,120.95487989485261,1.1702857235759294,7,-1,-1,16x1024x1536,0,
2026-03-03T03:27:44.353098+00:00,FULL,llm_style,eval,llm_style_eval_024,32,8192,1024,bf16,NVIDIA GeForce RTX 4060,c02,32,64,32,2,2,8,0.0,98.026,50.08000135421753,123.06432031095002,10.720265524808877,1,-1,-1,32x8192x1024,0,
2026-03-03T03:27:44.814593+00:00,FULL,llm_style,eval,llm_style_eval_025,32,6144,6144,bf16,NVIDIA GeForce RTX 4060,c08,128,128,64,8,4,8,0.0,461.443,341.98400378227234,445.94527393579483,7.064421368486346,0,-1,-1,32x6144x6144,0,
2026-03-03T03:27:44.981070+00:00,FULL,llm_style,eval,llm_style_eval_026,1,6144,2048,bf16,NVIDIA GeForce RTX 4060,c00,32,32,32,2,2,8,0.0,166.436,63.439998775720596,108.5439994931221,0.39668701900466186,5,-1,-1,1x6144x2048,0,
2026-03-03T03:27:45.052422+00:00,FULL,llm_style,eval,llm_style_eval_027,32,4096,3072,bf16,NVIDIA GeForce RTX 4060,c00,32,32,32,2,2,8,0.0,0.0,84.47999879717827,173.22752445936194,9.532509226632449,1,-1,-1,32x4096x3072,0,
2026-03-03T03:27:45.111480+00:00,FULL,llm_style,eval,llm_style_eval_028,64,1536,1536,bf16,NVIDIA GeForce RTX 4060,c04,64,64,64,4,3,8,0.0,59.007,39.744000881910324,58.47744178026909,7.598376642987952,3,-1,-1,64x1536x1536,0,
2026-03-03T03:27:45.202574+00:00,FULL,llm_style,eval,llm_style_eval_029,2,3072,1024,bf16,NVIDIA GeForce RTX 4060,c02,32,64,32,2,2,8,0.0,91.052,45.00799998641014,70.32159890979523,0.2795705653172619,7,-1,-1,2x3072x1024,0,
2026-03-03T03:27:45.385960+00:00,FULL,llm_style,eval,llm_style_eval_030,32,1536,8192,bf16,NVIDIA GeForce RTX 4060,c04,64,64,64,4,3,8,0.0,183.334,97.26400300860405,104.48895812034607,8.279593098062826,2,-1,-1,32x1536x8192,0,
2026-03-03T03:27:45.497867+00:00,FULL,llm_style,eval,llm_style_eval_031,8,3072,2048,bf16,NVIDIA GeForce RTX 4060,c11,32,128,32,4,2,8,0.0,111.861,74.75200295448303,81.36927738785744,1.3466300837623646,7,-1,-1,8x3072x2048,0,
2026-03-03T03:27:45.594621+00:00,FULL,llm_style,eval,llm_style_eval_032,8,2048,3072,bf16,NVIDIA GeForce RTX 4060,c00,32,32,32,2,2,8,0.0,96.71,52.22399905323982,89.6303994953632,1.9275294467085655,7,-1,-1,8x2048x3072,0,
2026-03-03T03:27:45.664318+00:00,FULL,llm_style,eval,llm_style_eval_033,64,1536,8192,bf16,NVIDIA GeForce RTX 4060,c04,64,64,64,4,3,8,0.0,0.0,147.45600521564484,209.97056379914284,10.92266628032262,2,-1,-1,64x1536x8192,0,
2026-03-03T03:27:45.816899+00:00,FULL,llm_style,eval,llm_style_eval_034,64,6144,2048,bf16,NVIDIA GeForce RTX 4060,c10,64,128,64,8,3,8,0.0,152.519,94.2080020904541,105.49247846007347,17.096347446722895,1,-1,-1,64x6144x2048,0,
2026-03-03T03:27:45.926823+00:00,FULL,llm_style,eval,llm_style_eval_035,4,4096,2048,bf16,NVIDIA GeForce RTX 4060,c00,32,32,32,2,2,8,0.0,109.879,57.28000029921532,150.02624228596687,1.1715932899692971,5,-1,-1,4x4096x2048,0,
2026-03-03T03:27:46.097417+00:00,FULL,llm_style,eval,llm_style_eval_036,64,8192,4096,bf16,NVIDIA GeForce RTX 4060,c10,64,128,64,8,3,8,0.0,0.0,304.9599975347519,402.94815987348534,14.083707144280668,1,-1,-1,64x8192x4096,0,
2026-03-03T03:27:46.127564+00:00,FULL,llm_style,eval,llm_style_eval_037,32,6144,1024,bf16,NVIDIA GeForce RTX 4060,c11,32,128,32,4,2,8,0.0,0.0,40.95999896526337,79.52992096543299,9.8304002483368,1,-1,-1,32x6144x1024,0,
2026-03-03T03:27:46.188215+00:00,FULL,llm_style,eval,llm_style_eval_038,64,6144,2048,bf16,NVIDIA GeForce RTX 4060,c10,64,128,64,8,3,8,0.0,0.0,95.66399827599525,116.39807835221288,16.836142802157447,1,-1,-1,64x6144x2048,0,
2026-03-03T03:27:46.264310+00:00,FULL,llm_style,eval,llm_style_eval_039,8,1024,3072,bf16,NVIDIA GeForce RTX 4060,c00,32,32,32,2,2,8,0.0,76.042,49.056001007556915,62.49664179980752,1.02600389282132,7,-1,-1,8x1024x3072,0,
2026-03-03T03:27:46.494315+00:00,FULL,llm_style,eval,llm_style_eval_040,32,8192,2048,bf16,NVIDIA GeForce RTX 4060,c04,64,64,64,4,3,8,0.0,229.963,165.71199893951416,176.16896003484726,6.479565938927101,1,-1,-1,32x8192x2048,0,
2026-03-03T03:27:46.584109+00:00,FULL,llm_style,eval,llm_style_eval_041,32,3072,1024,bf16,NVIDIA GeForce RTX 4060,c00,32,32,32,2,2,8,0.0,89.746,63.48799914121628,285.8291161060332,3.171096817088053,3,-1,-1,32x3072x1024,0,
2026-03-03T03:27:46.607432+00:00,FULL,llm_style,eval,llm_style_eval_042,64,1024,4096,bf16,NVIDIA GeForce RTX 4060,c04,64,64,64,4,3,8,0.0,0.0,80.89599758386612,161.35167881846428,6.636557160240439,3,-1,-1,64x1024x4096,0,
2026-03-03T03:27:46.616966+00:00,FULL,llm_style,eval,llm_style_eval_043,2,1536,1024,bf16,NVIDIA GeForce RTX 4060,c04,64,64,64,4,3,8,0.0,0.0,45.05600035190582,71.65568143129347,0.13963636254574643,7,-1,-1,2x1536x1024,0,
2026-03-03T03:27:46.855007+00:00,FULL,llm_style,eval,llm_style_eval_044,64,6144,3072,bf16,NVIDIA GeForce RTX 4060,c01,64,32,32,2,2,8,0.0,237.997,183.29599499702454,206.88960164785382,13.180424940758897,1,-1,-1,64x6144x3072,0,
2026-03-03T03:27:47.002679+00:00,FULL,llm_style,eval,llm_style_eval_045,64,1536,6144,bf16,NVIDIA GeForce RTX 4060,c04,64,64,64,4,3,8,0.0,147.626,82.94399827718735,93.18400174379349,14.563555858052158,2,-1,-1,64x1536x6144,0,
2026-03-03T03:27:47.250881+00:00,FULL,llm_style,eval,llm_style_eval_046,2,6144,3072,bf16,NVIDIA GeForce RTX 4060,c10,64,128,64,8,3,8,0.0,248.159,179.19999361038208,186.36800348758698,0.42130287216497986,5,-1,-1,2x6144x3072,0,
2026-03-03T03:27:47.676849+00:00,FULL,llm_style,eval,llm_style_eval_047,16,4096,8192,bf16,NVIDIA GeForce RTX 4060,c06,64,128,32,4,3,8,0.0,425.922,297.3119914531708,416.78847938776016,3.611498543169671,4,-1,-1,16x4096x8192,0,
2026-03-03T03:27:47.723606+00:00,FULL,llm_style,eval,llm_style_eval_048,16,1024,6144,bf16,NVIDIA GeForce RTX 4060,c04,64,64,64,4,3,8,0.0,0.0,74.75200295448303,91.25504061579701,2.693260167524729,6,-1,-1,16x1024x6144,0,
2026-03-03T03:27:47.886290+00:00,FULL,llm_style,eval,llm_style_eval_049,16,8192,1536,bf16,NVIDIA GeForce RTX 4060,c11,32,128,32,4,2,8,0.0,162.632,61.11999973654747,104.57568168640134,6.5879120702814475,5,-1,-1,16x8192x1536,0,
2026-03-03T03:27:47.964963+00:00,FULL,llm_style,eval,llm_style_eval_050,1,1024,1024,bf16,NVIDIA GeForce RTX 4060,c03,64,64,32,4,2,8,0.0,78.632,43.007999658584595,208.92127931117992,0.048761905148997066,7,-1,-1,1x1024x1024,0,
2026-03-03T03:27:48.045768+00:00,FULL,llm_style,eval,llm_style_eval_051,16,6144,1024,bf16,NVIDIA GeForce RTX 4060,c11,32,128,32,4,2,8,0.0,80.766,41.98399931192398,47.626241222023964,4.795317151761212,5,-1,-1,16x6144x1024,0,
2026-03-03T03:27:48.840167+00:00,FULL,llm_style,eval,llm_style_eval_052,16,8192,8192,bf16,NVIDIA GeForce RTX 4060,c06,64,128,32,4,3,8,0.0,794.358,567.296028137207,697.2518336772916,3.785472736432779,4,-1,-1,16x8192x8192,0,
2026-03-03T03:27:49.384172+00:00,FULL,llm_style,eval,llm_style_eval_053,1,6144,8192,bf16,NVIDIA GeForce RTX 4060,c06,64,128,32,4,3,8,0.0,543.954,425.9839951992035,537.7964758872984,0.23630769497085607,4,-1,-1,1x6144x8192,0,
2026-03-03T03:27:49.566486+00:00,FULL,llm_style,eval,llm_style_eval_054,64,4096,3072,bf16,NVIDIA GeForce RTX 4060,c04,64,64,64,4,3,8,0.0,182.271,111.50399968028069,121.83168351650238,14.444439128804046,1,-1,-1,64x4096x3072,0,
2026-03-03T03:27:49.665446+00:00,FULL,llm_style,eval,llm_style_eval_055,4,8192,1024,bf16,NVIDIA GeForce RTX 4060,c00,32,32,32,2,2,8,0.0,98.917,30.207999981939793,497.7455991506562,2.2215593233620834,5,-1,-1,4x8192x1024,0,
2026-03-03T03:27:49.744505+00:00,FULL,llm_style,eval,llm_style_eval_056,64,1024,3072,bf16,NVIDIA GeForce RTX 4060,c04,64,64,64,4,3,8,0.0,79.017,50.9600006043911,53.77023957669735,7.901357520103804,3,-1,-1,64x1024x3072,0,
2026-03-03T03:27:49.748371+00:00,FULL,llm_style,eval,llm_style_eval_057,64,1024,3072,bf16,NVIDIA GeForce RTX 4060,c04,64,64,64,4,3,8,0.0,0.0,49.136001616716385,55.77119991183281,8.194667265376653,3,-1,-1,64x1024x3072,0,
2026-03-03T03:27:49.861365+00:00,FULL,llm_style,eval,llm_style_eval_058,32,2048,4096,bf16,NVIDIA GeForce RTX 4060,c00,32,32,32,2,2,8,0.0,112.967,59.47200022637844,79.03936184942722,9.027288639299444,3,-1,-1,32x2048x4096,0,
2026-03-03T03:27:49.941504+00:00,FULL,llm_style,eval,llm_style_eval_059,64,8192,2048,bf16,NVIDIA GeForce RTX 4060,c10,64,128,64,8,3,8,0.0,0.0,166.9120043516159,219.48415964841837,12.865962854751436,1,-1,-1,64x8192x2048,0,
2026-03-03T03:27:50.191867+00:00,FULL,llm_style,eval,llm_style_eval_060,1,3072,6144,bf16,NVIDIA GeForce RTX 4060,c06,64,128,32,4,3,8,0.0,250.309,178.96000295877457,199.6643167734146,0.2109339258822869,6,-1,-1,1x3072x6144,0,
2026-03-03T03:27:50.233693+00:00,FULL,llm_style,eval,llm_style_eval_061,64,1536,4096,bf16,NVIDIA GeForce RTX 4060,c04,64,64,64,4,3,8,0.0,0.0,37.887999787926674,208.54656577110285,21.25491903789066,3,-1,-1,64x1536x4096,0,
2026-03-03T03:27:50.370373+00:00,FULL,llm_style,eval,llm_style_eval_062,16,6144,2048,bf16,NVIDIA GeForce RTX 4060,c11,32,128,32,4,2,8,0.0,136.628,61.343999579548836,108.67711924016461,6.563856070027728,5,-1,-1,16x6144x2048,0,
2026-03-03T03:27:50.416771+00:00,FULL,llm_style,eval,llm_style_eval_063,64,1536,6144,bf16,NVIDIA GeForce RTX 4060,c04,64,64,64,4,3,8,0.0,0.0,49.15199987590313,304.86752346157994,24.576000062048436,2,-1,-1,64x1536x6144,0,
2026-03-03T03:27:50.475009+00:00,FULL,llm_style,eval,llm_style_eval_064,1,6144,2048,bf16,NVIDIA GeForce RTX 4060,c00,32,32,32,2,2,8,0.0,0.0,61.43999844789505,211.4275160431862,0.40960001034736665,5,-1,-1,1x6144x2048,0,
2026-03-03T03:27:50.617327+00:00,FULL,llm_style,eval,llm_style_eval_065,8,1536,6144,bf16,NVIDIA GeForce RTX 4060,c04,64,64,64,4,3,8,0.0,142.263,71.68000191450119,148.26495759189103,2.106514229451395,6,-1,-1,8x1536x6144,0,
2026-03-03T03:27:50.658272+00:00,FULL,llm_style,eval,llm_style_eval_066,64,1536,4096,bf16,NVIDIA GeForce RTX 4060,c04,64,64,64,4,3,8,0.0,0.0,63.00799921154976,201.12672597169853,12.781017935455763,3,-1,-1,64x1536x4096,0,
2026-03-03T03:27:50.747588+00:00,FULL,llm_style,eval,llm_style_eval_067,64,8192,2048,bf16,NVIDIA GeForce RTX 4060,c10,64,128,64,8,3,8,0.0,0.0,191.55199825763702,346.7571219801903,11.210969697698685,1,-1,-1,64x8192x2048,0,
2026-03-03T03:27:50.767449+00:00,FULL,llm_style,eval,llm_style_eval_068,64,1024,4096,bf16,NVIDIA GeForce RTX 4060,c04,64,64,64,4,3,8,0.0,0.0,61.39199994504452,120.0496027618646,8.744965345331376,3,-1,-1,64x1024x4096,0,
2026-03-03T03:27:50.801726+00:00,FULL,llm_style,eval,llm_style_eval_069,64,2048,4096,bf16,NVIDIA GeForce RTX 4060,c03,64,64,32,4,2,8,0.0,0.0,83.96799862384796,141.83104202151284,12.787512404696566,3,-1,-1,64x2048x4096,0,
2026-03-03T03:27:50.914735+00:00,FULL,llm_style,eval,llm_style_eval_070,64,8192,1024,bf16,NVIDIA GeForce RTX 4060,c06,64,128,32,4,3,8,0.0,112.939,66.56000018119812,72.25952222943305,16.13193841762204,1,-1,-1,64x8192x1024,0,
2026-03-03T03:27:50.977392+00:00,FULL,llm_style,eval,llm_style_eval_071,64,6144,2048,bf16,NVIDIA GeForce RTX 4060,c10,64,128,64,8,3,8,0.0,0.0,96.0640013217926,184.9446393549442,16.766038410213756,1,-1,-1,64x6144x2048,0,
2026-03-03T03:27:50.989575+00:00,FULL,llm_style,eval,llm_style_eval_072,64,1536,1024,bf16,NVIDIA GeForce RTX 4060,c00,32,32,32,2,2,8,0.0,0.0,46.06400057673454,136.4787176996469,4.370584175914666,3,-1,-1,64x1536x1024,0,
2026-03-03T03:27:51.014386+00:00,FULL,llm_style,eval,llm_style_eval_073,1,4096,1536,bf16,NVIDIA GeForce RTX 4060,c11,32,128,32,4,2,8,0.0,0.0,46.84799909591675,119.1792020201683,0.26859016911773975,5,-1,-1,1x4096x1536,0,
2026-03-03T03:27:51.078161+00:00,FULL,llm_style,eval,llm_style_eval_074,8,1024,2048,bf16,NVIDIA GeForce RTX 4060,c00,32,32,32,2,2,8,0.0,63.726,38.863999769091606,133.80863882601255,0.8633808202799989,7,-1,-1,8x1024x2048,0,
2026-03-03T03:27:51.174200+00:00,FULL,llm_style,eval,llm_style_eval_075,2,6144,1024,bf16,NVIDIA GeForce RTX 4060,c11,32,128,32,4,2,8,0.0,95.998,40.76799936592579,81.20543919503686,0.6172935731801888,5,-1,-1,2x6144x1024,0,
2026-03-03T03:27:51.209142+00:00,FULL,llm_style,eval,llm_style_eval_076,64,1024,6144,bf16,NVIDIA GeForce RTX 4060,c04,64,64,64,4,3,8,0.0,0.0,76.73600316047668,153.91679972410196,10.494504988953837,2,-1,-1,64x1024x6144,0,
2026-03-03T03:27:51.630171+00:00,FULL,llm_style,eval,llm_style_eval_077,1,4096,8192,bf16,NVIDIA GeForce RTX 4060,c03,64,64,32,4,2,8,0.0,420.977,295.29599845409393,365.13600051403046,0.22725964574976318,4,-1,-1,1x4096x8192,0,
2026-03-03T03:27:51.727114+00:00,FULL,llm_style,eval,llm_style_eval_078,64,6144,3072,bf16,NVIDIA GeForce RTX 4060,c01,64,32,32,2,2,8,0.0,0.0,183.4079995751381,251.29728570580463,13.172375848362345,1,-1,-1,64x6144x3072,0,
2026-03-03T03:27:51.865325+00:00,FULL,llm_style,eval,llm_style_eval_079,2,3072,4096,bf16,NVIDIA GeForce RTX 4060,c00,32,32,32,2,2,8,0.0,138.152,65.47199934720993,73.07904101908207,0.7687507408026767,7,-1,-1,2x3072x4096,0,
2026-03-03T03:27:51.937120+00:00,FULL,llm_style,eval,llm_style_eval_080,4,1536,1024,bf16,NVIDIA GeForce RTX 4060,c00,32,32,32,2,2,8,0.0,71.751,38.91199827194214,202.8745585680008,0.3233684354132238,7,-1,-1,4x1536x1024,0,
2026-03-03T03:27:52.269674+00:00,FULL,llm_style,eval,llm_style_eval_081,4,4096,6144,bf16,NVIDIA GeForce RTX 4060,c10,64,128,64,8,3,8,0.0,332.513,232.28799551725388,268.32896143198013,0.8667111339597654,4,-1,-1,4x4096x6144,0,
2026-03-03T03:27:52.367837+00:00,FULL,llm_style,eval,llm_style_eval_082,64,6144,1024,bf16,NVIDIA GeForce RTX 4060,c10,64,128,64,8,3,8,0.0,98.118,54.70400117337704,60.505920313298695,14.721160257504543,1,-1,-1,64x6144x1024,0,
2026-03-03T03:27:52.454578+00:00,FULL,llm_style,eval,llm_style_eval_083,8,4096,4096,bf16,NVIDIA GeForce RTX 4060,c11,32,128,32,4,2,8,0.0,0.0,165.8879965543747,307.714886367321,1.6181728731169065,5,-1,-1,8x4096x4096,0,
2026-03-03T03:27:52.613360+00:00,FULL,llm_style,eval,llm_style_eval_084,64,1024,8192,bf16,NVIDIA GeForce RTX 4060,c04,64,64,64,4,3,8,0.0,158.723,96.25600278377533,101.70239955186844,11.155063507176793,2,-1,-1,64x1024x8192,0,
2026-03-03T03:27:52.920232+00:00,FULL,llm_style,eval,llm_style_eval_085,1,3072,8192,bf16,NVIDIA GeForce RTX 4060,c05,128,64,32,4,3,8,0.0,306.83,229.37600314617157,265.35935282707214,0.219428568418841,6,-1,-1,1x3072x8192,0,
2026-03-03T03:27:52.983680+00:00,FULL,llm_style,eval,llm_style_eval_086,8,1536,1024,bf16,NVIDIA GeForce RTX 4060,c04,64,64,64,4,3,8,0.0,63.404,37.90399990975857,53.35520114749667,0.6639358394869809,7,-1,-1,8x1536x1024,0,
2026-03-03T03:27:53.060688+00:00,FULL,llm_style,eval,llm_style_eval_087,16,1024,3072,bf16,NVIDIA GeForce RTX 4060,c04,64,64,64,4,3,8,0.0,76.965,50.175998359918594,59.746558330953114,2.0062041472085883,7,-1,-1,16x1024x3072,0,
2026-03-03T03:27:53.155809+00:00,FULL,llm_style,eval,llm_style_eval_088,8,4096,1536,bf16,NVIDIA GeForce RTX 4060,c11,32,128,32,4,2,8,0.0,95.076,46.08000069856644,51.061441078782074,2.1845333002161103,5,-1,-1,8x4096x1536,0,
2026-03-03T03:27:53.389240+00:00,FULL,llm_style,eval,llm_style_eval_089,16,6144,3072,bf16,NVIDIA GeForce RTX 4060,c10,64,128,64,8,3,8,0.0,233.385,179.03999984264374,250.64863502979273,3.3734348555117912,5,-1,-1,16x6144x3072,0,
2026-03-03T03:27:53.480291+00:00,FULL,llm_style,eval,llm_style_eval_090,32,1536,3072,bf16,NVIDIA GeForce RTX 4060,c04,64,64,64,4,3,8,0.0,91.004,51.19999870657921,107.98848189413536,5.8982401490020795,3,-1,-1,32x1536x3072,0,
2026-03-03T03:27:53.585274+00:00,FULL,llm_style,eval,llm_style_eval_091,16,1024,4096,bf16,NVIDIA GeForce RTX 4060,c04,64,64,64,4,3,8,0.0,104.921,57.34400078654289,63.48799914121628,2.340571396467637,7,-1,-1,16x1024x4096,0,
2026-03-03T03:27:53.902127+00:00,FULL,llm_style,eval,llm_style_eval_092,1,4096,6144,bf16,NVIDIA GeForce RTX 4060,c03,64,64,32,4,2,8,0.0,316.8,228.2399982213974,336.39423847198486,0.220520716755252,4,-1,-1,1x4096x6144,0,
2026-03-03T03:27:54.002310+00:00,FULL,llm_style,eval,llm_style_eval_093,32,2048,3072,bf16,NVIDIA GeForce RTX 4060,c00,32,32,32,2,2,8,0.0,100.132,57.66399949789047,147.7791972458362,6.9827481185159606,3,-1,-1,32x2048x3072,0,
2026-03-03T03:27:54.014243+00:00,FULL,llm_style,eval,llm_style_eval_094,32,1024,2048,bf16,NVIDIA GeForce RTX 4060,c04,64,64,64,4,3,8,0.0,0.0,41.680000722408295,104.21248368918886,3.2201949537836962,3,-1,-1,32x1024x2048,0,
2026-03-03T03:27:54.182698+00:00,FULL,llm_style,eval,llm_style_eval_095,8,6144,2048,bf16,NVIDIA GeForce RTX 4060,c00,32,32,32,2,2,8,0.0,168.415,67.53600016236305,116.7443204671143,2.981026289919324,5,-1,-1,8x6144x2048,0,
2026-03-03T03:27:54.217252+00:00,FULL,llm_style,eval,llm_style_eval_096,64,2048,3072,bf16,NVIDIA GeForce RTX 4060,c03,64,64,32,4,2,8,0.0,0.0,66.91199913620949,183.97600233554834,12.035305750776885,3,-1,-1,64x2048x3072,0,
2026-03-03T03:27:54.243296+00:00,FULL,llm_style,eval,llm_style_eval_097,64,6144,1024,bf16,NVIDIA GeForce RTX 4060,c10,64,128,64,8,3,8,0.0,0.0,60.48000045120716,76.35296359658241,13.31525069431322,1,-1,-1,64x6144x1024,0,
2026-03-03T03:27:54.267466+00:00,FULL,llm_style,eval,llm_style_eval_098,32,6144,1024,bf16,NVIDIA GeForce RTX 4060,c11,32,128,32,4,2,8,0.0,0.0,41.34400002658367,56.430720165371866,9.739095968970082,1,-1,-1,32x6144x1024,0,
2026-03-03T03:27:54.337344+00:00,FULL,llm_style,eval,llm_style_eval_099,1,2048,2048,bf16,NVIDIA GeForce RTX 4060,c00,32,32,32,2,2,8,0.0,69.821,43.007999658584595,167.7107168734072,0.19504762059598826,7,-1,-1,1x2048x2048,0,
2026-03-03T03:27:54.369832+00:00,FULL,llm_style,eval,llm_style_eval_100,64,8192,1024,bf16,NVIDIA GeForce RTX 4060,c06,64,128,32,4,3,8,0.0,0.0,70.64000144600868,129.73248243331903,15.200195385339548,1,-1,-1,64x8192x1024,0,
2026-03-03T03:27:54.433936+00:00,FULL,llm_style,eval,llm_style_eval_101,64,8192,1536,bf16,NVIDIA GeForce RTX 4060,c06,64,128,32,4,3,8,0.0,0.0,115.36000296473503,211.71199336647982,13.961621832589206,1,-1,-1,64x8192x1536,0,
2026-03-03T03:27:54.462557+00:00,FULL,llm_style,eval,llm_style_eval_102,32,3072,2048,bf16,NVIDIA GeForce RTX 4060,c11,32,128,32,4,2,8,0.0,0.0,57.37600103020668,189.30688068270678,7.017797977729672,3,-1,-1,32x3072x2048,0,
2026-03-03T03:27:54.489131+00:00,FULL,llm_style,eval,llm_style_eval_103,64,2048,3072,bf16,NVIDIA GeForce RTX 4060,c03,64,64,32,4,2,8,0.0,0.0,73.21600243449211,173.96736279129976,10.999048585321555,3,-1,-1,64x2048x3072,0,
2026-03-03T03:27:54.550722+00:00,FULL,llm_style,eval,llm_style_eval_104,16,6144,2048,bf16,NVIDIA GeForce RTX 4060,c11,32,128,32,4,2,8,0.0,0.0,66.56000018119812,106.08447842299935,6.049476906608265,5,-1,-1,16x6144x2048,0,
2026-03-03T03:27:54.696297+00:00,FULL,llm_style,eval,llm_style_eval_105,1,1024,8192,bf16,NVIDIA GeForce RTX 4060,c04,64,64,64,4,3,8,0.0,145.522,95.85599973797798,131.61376006901253,0.17502520495180746,6,-1,-1,1x1024x8192,0,
2026-03-03T03:27:55.098781+00:00,FULL,llm_style,eval,llm_style_eval_106,32,4096,8192,bf16,NVIDIA GeForce RTX 4060,c11,32,128,32,4,2,8,0.0,402.443,295.9359884262085,411.8323102593422,7.25658159867729,0,-1,-1,32x4096x8192,0,
2026-03-03T03:27:55.145386+00:00,FULL,llm_style,eval,llm_style_eval_107,64,6144,1536,bf16,NVIDIA GeForce RTX 4060,c06,64,128,32,4,3,8,0.0,0.0,64.51199948787689,109.3814399838447,18.72457157721487,1,-1,-1,64x6144x1536,0,
2026-03-03T03:27:55.228026+00:00,FULL,llm_style,eval,llm_style_eval_108,8,3072,1536,bf16,NVIDIA GeForce RTX 4060,c00,32,32,32,2,2,8,0.0,82.588,40.55999964475632,48.14848139882087,1.861377531095725,7,-1,-1,8x3072x1536,0,
2026-03-03T03:27:55.248239+00:00,FULL,llm_style,eval,llm_style_eval_109,16,2048,1024,bf16,NVIDIA GeForce RTX 4060,c11,32,128,32,4,2,8,0.0,0.0,43.007999658584595,113.5376001149416,1.560380964767906,7,-1,-1,16x2048x1024,0,
2026-03-03T03:27:56.003629+00:00,FULL,llm_style,eval,llm_style_eval_110,1,8192,8192,bf16,NVIDIA GeForce RTX 4060,c11,32,128,32,4,2,8,0.0,755.347,556.0320019721985,661.6739201545714,0.24138489785469375,4,-1,-1,1x8192x8192,0,
2026-03-03T03:27:56.124135+00:00,FULL,llm_style,eval,llm_style_eval_111,8,6144,1536,bf16,NVIDIA GeForce RTX 4060,c11,32,128,32,4,2,8,0.0,120.459,47.10400104522705,113.60223770141585,3.2055651462605423,5,-1,-1,8x6144x1536,0,
2026-03-03T03:27:56.221394+00:00,FULL,llm_style,eval,llm_style_eval_112,2,6144,3072,bf16,NVIDIA GeForce RTX 4060,c10,64,128,64,8,3,8,0.0,0.0,183.29599499702454,341.2787234783172,0.41188827939871553,5,-1,-1,2x6144x3072,0,
2026-03-03T03:27:56.550165+00:00,FULL,llm_style,eval,llm_style_eval_113,1,8192,8192,bf16,NVIDIA GeForce RTX 4060,c11,32,128,32,4,2,8,0.0,0.0,579.584002494812,619.6806335449219,0.2315759707346329,4,-1,-1,1x8192x8192,0,
2026-03-03T03:27:56.614223+00:00,FULL,llm_style,eval,llm_style_eval_114,1,3072,1024,bf16,NVIDIA GeForce RTX 4060,c11,32,128,32,4,2,8,0.0,64.009,38.91199827194214,106.83391861617548,0.1616842177066119,7,-1,-1,1x3072x1024,0,
2026-03-03T03:27:56.687945+00:00,FULL,llm_style,eval,llm_style_eval_115,16,3072,1536,bf16,NVIDIA GeForce RTX 4060,c00,32,32,32,2,2,8,0.0,73.676,40.95999896526337,58.458239026367636,3.6864000931262995,7,-1,-1,16x3072x1536,0,
2026-03-03T03:27:56.782495+00:00,FULL,llm_style,eval,llm_style_eval_116,8,3072,1024,bf16,NVIDIA GeForce RTX 4060,c00,32,32,32,2,2,8,0.0,94.505,16.383999958634377,362.04640075564276,3.072000007756054,7,-1,-1,8x3072x1024,0,
2026-03-03T03:27:56.870152+00:00,FULL,llm_style,eval,llm_style_eval_117,4,1024,4096,bf16,NVIDIA GeForce RTX 4060,c04,64,64,64,4,3,8,0.0,87.616,58.36800113320351,63.54944098740815,0.5748771818213262,7,-1,-1,4x1024x4096,0,
2026-03-03T03:27:56.966292+00:00,FULL,llm_style,eval,llm_style_eval_118,64,6144,3072,bf16,NVIDIA GeForce RTX 4060,c01,64,32,32,2,2,8,0.0,0.0,188.4160041809082,272.2303989529609,12.82226058504217,1,-1,-1,64x6144x3072,0,
2026-03-03T03:27:57.540207+00:00,FULL,llm_style,eval,llm_style_eval_119,64,8192,6144,bf16,NVIDIA GeForce RTX 4060,c00,32,32,32,2,2,8,0.0,573.859,442.3680007457733,474.74624037742615,14.563555531003347,0,-1,-1,64x8192x6144,0,
2026-03-03T03:27:57.637002+00:00,FULL,llm_style,eval,llm_style_eval_120,8,1024,4096,bf16,NVIDIA GeForce RTX 4060,c00,32,32,32,2,2,8,0.0,96.75,62.463998794555664,166.15423649549479,1.0743606764709592,7,-1,-1,8x1024x4096,0,
2026-03-03T03:27:57.697855+00:00,FULL,llm_style,eval,llm_style_eval_121,4,1024,2048,bf16,NVIDIA GeForce RTX 4060,c04,64,64,64,4,3,8,0.0,60.807,41.88799858093262,52.848641090095015,0.40052560562387374,7,-1,-1,4x1024x2048,0,
2026-03-03T03:27:58.001329+00:00,FULL,llm_style,eval,llm_style_eval_122,4,6144,4096,bf16,NVIDIA GeForce RTX 4060,c10,64,128,64,8,3,8,0.0,303.431,227.32800245285034,288.4547206759452,0.8856216120658376,5,-1,-1,4x6144x4096,0,
2026-03-03T03:27:58.307196+00:00,FULL,llm_style,eval,llm_style_eval_123,4,3072,8192,bf16,NVIDIA GeForce RTX 4060,c06,64,128,32,4,3,8,0.0,305.816,227.32800245285034,256.2047973275184,0.8856216120658376,6,-1,-1,4x3072x8192,0,
2026-03-03T03:27:58.342399+00:00,FULL,llm_style,eval,llm_style_eval_124,64,6144,1024,bf16,NVIDIA GeForce RTX 4060,c10,64,128,64,8,3,8,0.0,0.0,55.18399924039841,73.6588816344738,14.593113567065675,1,-1,-1,64x6144x1024,0,
2026-03-03T03:27:58.411892+00:00,FULL,llm_style,eval,llm_style_eval_125,64,1536,8192,bf16,NVIDIA GeForce RTX 4060,c04,64,64,64,4,3,8,0.0,0.0,144.1439986228943,284.88864243030525,11.17363713638639,2,-1,-1,64x1536x8192,0,
2026-03-03T03:27:58.499675+00:00,FULL,llm_style,eval,llm_style_eval_126,64,2048,8192,bf16,NVIDIA GeForce RTX 4060,c06,64,128,32,4,3,8,0.0,0.0,171.88800126314163,242.30335161089886,12.493505260512272,2,-1,-1,64x2048x8192,0,
2026-03-03T03:27:58.656368+00:00,FULL,llm_style,eval,llm_style_eval_127,2,8192,1536,bf16,NVIDIA GeForce RTX 4060,c00,32,32,32,2,2,8,0.0,156.638,62.44799867272377,73.5555212944746,0.8059769579450752,5,-1,-1,2x8192x1536,0,
2026-03-03T03:27:58.764649+00:00,FULL,llm_style,eval,llm_style_eval_128,8,2048,2048,bf16,NVIDIA GeForce RTX 4060,c00,32,32,32,2,2,8,0.0,108.227,68.28799843788147,207.56927937269208,0.9827329184504644,7,-1,-1,8x2048x2048,0,
2026-03-03T03:27:59.009988+00:00,FULL,llm_style,eval,llm_style_eval_129,64,8192,6144,bf16,NVIDIA GeForce RTX 4060,c00,32,32,32,2,2,8,0.0,0.0,441.72799587249756,475.16863614320755,14.584656178005929,0,-1,-1,64x8192x6144,0,
2026-03-03T03:27:59.033554+00:00,FULL,llm_style,eval,llm_style_eval_130,16,3072,1536,bf16,NVIDIA GeForce RTX 4060,c00,32,32,32,2,2,8,0.0,0.0,44.03200000524521,145.50016440451134,3.429209301917085,7,-1,-1,16x3072x1536,0,
2026-03-03T03:27:59.793497+00:00,FULL,llm_style,eval,llm_style_eval_131,32,8192,8192,bf16,NVIDIA GeForce RTX 4060,c00,32,32,32,2,2,8,0.0,759.881,564.2240047454834,581.5097695589066,7.612166905123831,0,-1,-1,32x8192x8192,0,
2026-03-03T03:28:00.220564+00:00,FULL,llm_style,eval,llm_style_eval_132,32,8192,4096,bf16,NVIDIA GeForce RTX 4060,c00,32,32,32,2,2,8,0.0,427.023,297.9840040206909,387.5152000784873,7.206707806540135,1,-1,-1,32x8192x4096,0,
2026-03-03T03:28:01.003077+00:00,FULL,llm_style,eval,llm_style_eval_133,2,8192,8192,bf16,NVIDIA GeForce RTX 4060,c11,32,128,32,4,2,8,0.0,782.467,556.4799904823303,611.0537868738174,0.48238114683572536,4,-1,-1,2x8192x8192,0,
2026-03-03T03:28:01.124668+00:00,FULL,llm_style,eval,llm_style_eval_134,64,3072,3072,bf16,NVIDIA GeForce RTX 4060,c03,64,64,32,4,2,8,0.0,121.544,65.39199873805046,100.23936033248893,18.472589541709628,3,-1,-1,64x3072x3072,0,
2026-03-03T03:28:01.243045+00:00,FULL,llm_style,eval,llm_style_eval_135,8,3072,3072,bf16,NVIDIA GeForce RTX 4060,c00,32,32,32,2,2,8,0.0,118.334,55.08799850940704,129.57504257559773,2.740977129060434,7,-1,-1,8x3072x3072,0,
2026-03-03T03:28:01.366128+00:00,FULL,llm_style,eval,llm_style_eval_136,4,2048,4096,bf16,NVIDIA GeForce RTX 4060,c00,32,32,32,2,2,8,0.0,123.037,38.91199827194214,91.04672022163868,1.7246316555371939,7,-1,-1,4x2048x4096,0,
2026-03-03T03:28:02.122729+00:00,FULL,llm_style,eval,llm_style_eval_137,4,8192,8192,bf16,NVIDIA GeForce RTX 4060,c06,64,128,32,4,3,8,0.0,756.556,567.1679973602295,630.9987401962279,0.9465818143808514,4,-1,-1,4x8192x8192,0,
2026-03-03T03:28:02.212698+00:00,FULL,llm_style,eval,llm_style_eval_138,16,1024,1024,bf16,NVIDIA GeForce RTX 4060,c01,64,32,32,2,2,8,0.0,89.927,49.536000937223434,95.44159859418865,0.6773746641866237,7,-1,-1,16x1024x1024,0,
2026-03-03T03:28:02.293321+00:00,FULL,llm_style,eval,llm_style_eval_139,4,1024,1024,bf16,NVIDIA GeForce RTX 4060,c04,64,64,64,4,3,8,0.0,80.577,58.36800113320351,64.37087841331959,0.14371929545533155,7,-1,-1,4x1024x1024,0,
2026-03-03T03:28:02.429008+00:00,FULL,llm_style,eval,llm_style_eval_140,64,4096,6144,bf16,NVIDIA GeForce RTX 4060,c03,64,64,32,4,2,8,0.0,0.0,241.60000681877136,262.75649040937424,13.332886511117943,0,-1,-1,64x4096x6144,0,
2026-03-03T03:28:02.554353+00:00,FULL,llm_style,eval,llm_style_eval_141,4,6144,4096,bf16,NVIDIA GeForce RTX 4060,c10,64,128,64,8,3,8,0.0,0.0,256.99199736118317,290.16351968050003,0.7833963472296394,5,-1,-1,4x6144x4096,0,
2026-03-03T03:28:02.733817+00:00,FULL,llm_style,eval,llm_style_eval_142,4,2048,6144,bf16,NVIDIA GeForce RTX 4060,c11,32,128,32,4,2,8,0.0,179.406,103.16800326108932,200.19200056791294,0.9757220535251553,6,-1,-1,4x2048x6144,0,
2026-03-03T03:28:02.799976+00:00,FULL,llm_style,eval,llm_style_eval_143,64,1536,8192,bf16,NVIDIA GeForce RTX 4060,c04,64,64,64,4,3,8,0.0,0.0,122.32000008225441,178.87103572487823,13.167206792976938,2,-1,-1,64x1536x8192,0,
2026-03-03T03:28:02.917061+00:00,FULL,llm_style,eval,llm_style_eval_144,1,3072,3072,bf16,NVIDIA GeForce RTX 4060,c11,32,128,32,4,2,8,0.0,117.032,62.463998794555664,211.63680292665921,0.3021639402574573,7,-1,-1,1x3072x3072,0,
2026-03-03T03:28:02.938111+00:00,FULL,llm_style,eval,llm_style_eval_145,32,1024,2048,bf16,NVIDIA GeForce RTX 4060,c04,64,64,64,4,3,8,0.0,0.0,70.11200115084648,169.19520005583755,1.9143331497731693,3,-1,-1,32x1024x2048,0,
2026-03-03T03:28:03.105598+00:00,FULL,llm_style,eval,llm_style_eval_146,64,8192,4096,bf16,NVIDIA GeForce RTX 4060,c10,64,128,64,8,3,8,0.0,0.0,329.680010676384,442.76799619197845,13.027684897207697,1,-1,-1,64x8192x4096,0,
2026-03-03T03:28:03.150281+00:00,FULL,llm_style,eval,llm_style_eval_147,64,2048,4096,bf16,NVIDIA GeForce RTX 4060,c03,64,64,32,4,2,8,0.0,0.0,98.7360030412674,159.11936141550524,10.87487634628295,3,-1,-1,64x2048x4096,0,
2026-03-03T03:28:03.178873+00:00,FULL,llm_style,eval,llm_style_eval_148,64,1024,6144,bf16,NVIDIA GeForce RTX 4060,c04,64,64,64,4,3,8,0.0,0.0,94.2080020904541,176.62336051464072,8.548173723361447,2,-1,-1,64x1024x6144,0,
2026-03-03T03:28:03.342926+00:00,FULL,llm_style,eval,llm_style_eval_149,64,4096,8192,bf16,NVIDIA GeForce RTX 4060,c11,32,128,32,4,2,8,0.0,0.0,303.616002202034,319.4095993041992,14.146050487622245,0,-1,-1,64x4096x8192,0,
2026-03-03T03:28:03.437300+00:00,FULL,llm_style,eval,llm_style_eval_150,2,2048,3072,bf16,NVIDIA GeForce RTX 4060,c00,32,32,32,2,2,8,0.0,94.321,53.247999399900436,79.11392122507091,0.47261538994171215,7,-1,-1,2x2048x3072,0,
2026-03-03T03:28:03.548677+00:00,FULL,llm_style,eval,llm_style_eval_151,64,4096,2048,bf16,NVIDIA GeForce RTX 4060,c04,64,64,64,4,3,8,0.0,111.331,67.58400052785873,77.7551993727684,15.88751502742715,1,-1,-1,64x4096x2048,0,
2026-03-03T03:28:04.287526+00:00,FULL,llm_style,eval,llm_style_eval_152,8,8192,8192,bf16,NVIDIA GeForce RTX 4060,c00,32,32,32,2,2,8,0.0,738.804,562.1119737625122,581.4752095937729,1.9101920509055856,4,-1,-1,8x8192x8192,0,
2026-03-03T03:28:04.383588+00:00,FULL,llm_style,eval,llm_style_eval_153,64,8192,2048,bf16,NVIDIA GeForce RTX 4060,c10,64,128,64,8,3,8,0.0,0.0,193.53599846363068,324.01088029146194,11.096042416127332,1,-1,-1,64x8192x2048,0,
2026-03-03T03:28:04.626709+00:00,FULL,llm_style,eval,llm_style_eval_154,16,2048,8192,bf16,NVIDIA GeForce RTX 4060,c00,32,32,32,2,2,8,0.0,243.042,168.96000504493713,235.0073608756063,3.177502935426713,6,-1,-1,16x2048x8192,0,
2026-03-03T03:28:04.730089+00:00,FULL,llm_style,eval,llm_style_eval_155,4,2048,1536,bf16,NVIDIA GeForce RTX 4060,c11,32,128,32,4,2,8,0.0,103.339,45.792000368237495,61.46495956927535,0.5495681297525421,7,-1,-1,4x2048x1536,0,
2026-03-03T03:28:04.856218+00:00,FULL,llm_style,eval,llm_style_eval_156,1,4096,6144,bf16,NVIDIA GeForce RTX 4060,c03,64,64,32,4,2,8,0.0,0.0,252.9279887676239,366.07552528381336,0.19899596025429162,4,-1,-1,1x4096x6144,0,
2026-03-03T03:28:05.020872+00:00,FULL,llm_style,eval,llm_style_eval_157,1,1536,8192,bf16,NVIDIA GeForce RTX 4060,c04,64,64,64,4,3,8,0.0,164.597,85.91999858617783,92.58848071098328,0.29289832884201766,6,-1,-1,1x1536x8192,0,
2026-03-03T03:28:05.094480+00:00,FULL,llm_style,eval,llm_style_eval_158,64,1536,8192,bf16,NVIDIA GeForce RTX 4060,c04,64,64,64,4,3,8,0.0,0.0,110.08000001311302,215.0108732283115,14.631293021512894,2,-1,-1,64x1536x8192,0,
2026-03-03T03:28:05.209599+00:00,FULL,llm_style,eval,llm_style_eval_159,16,6144,1536,bf16,NVIDIA GeForce RTX 4060,c00,32,32,32,2,2,8,0.0,115.063,34.71999987959862,143.9244799315929,8.697865467950317,5,-1,-1,16x6144x1536,0,
2026-03-03T03:28:05.405785+00:00,FULL,llm_style,eval,llm_style_eval_160,32,6144,6144,bf16,NVIDIA GeForce RTX 4060,c08,128,128,64,8,4,8,0.0,0.0,365.56801199913025,455.7209500670431,6.608672051989461,0,-1,-1,32x6144x6144,0,
2026-03-03T03:28:05.513044+00:00,FULL,llm_style,eval,llm_style_eval_161,2,1536,4096,bf16,NVIDIA GeForce RTX 4060,c03,64,64,32,4,2,8,0.0,107.206,70.65600156784058,115.69344073534009,0.35617390514006025,7,-1,-1,2x1536x4096,0,
2026-03-03T03:28:05.597025+00:00,FULL,llm_style,eval,llm_style_eval_162,64,1536,3072,bf16,NVIDIA GeForce RTX 4060,c04,64,64,64,4,3,8,0.0,83.935,50.175998359918594,120.68863950669748,12.037224883251529,3,-1,-1,64x1536x3072,0,
2026-03-03T03:28:05.631756+00:00,FULL,llm_style,eval,llm_style_eval_163,64,1024,8192,bf16,NVIDIA GeForce RTX 4060,c04,64,64,64,4,3,8,0.0,0.0,84.89599823951721,135.26368401944623,12.647731886851139,2,-1,-1,64x1024x8192,0,
2026-03-03T03:28:05.795697+00:00,FULL,llm_style,eval,llm_style_eval_164,64,4096,8192,bf16,NVIDIA GeForce RTX 4060,c11,32,128,32,4,2,8,0.0,0.0,301.7280101776123,348.8988849520682,14.23456606985797,0,-1,-1,64x4096x8192,0,
2026-03-03T03:28:06.118352+00:00,FULL,llm_style,eval,llm_style_eval_165,4,8192,3072,bf16,NVIDIA GeForce RTX 4060,c11,32,128,32,4,2,8,0.0,322.601,247.80799448490143,289.9676838517188,0.8124297701471714,5,-1,-1,4x8192x3072,0,
2026-03-03T03:28:06.161122+00:00,FULL,llm_style,eval,llm_style_eval_166,64,1024,6144,bf16,NVIDIA GeForce RTX 4060,c04,64,64,64,4,3,8,0.0,0.0,50.175998359918594,113.66400122642517,16.049633177668706,2,-1,-1,64x1024x6144,0,
2026-03-03T03:28:06.176352+00:00,FULL,llm_style,eval,llm_style_eval_167,2,2048,1024,bf16,NVIDIA GeForce RTX 4060,c02,32,64,32,2,2,8,0.0,0.0,41.999999433755875,575.2649573981744,0.19972876459750571,7,-1,-1,2x2048x1024,0,
2026-03-03T03:28:06.248308+00:00,FULL,llm_style,eval,llm_style_eval_168,64,4096,1024,bf16,NVIDIA GeForce RTX 4060,c11,32,128,32,4,2,8,0.0,71.916,49.02400076389313,51.72223888337612,10.951185207948452,1,-1,-1,64x4096x1024,0,
2026-03-03T03:28:06.289966+00:00,FULL,llm_style,eval,llm_style_eval_169,4,1536,6144,bf16,NVIDIA GeForce RTX 4060,c04,64,64,64,4,3,8,0.0,0.0,74.75200295448303,160.32800152897832,1.0099725628217733,6,-1,-1,4x1536x6144,0,
2026-03-03T03:28:06.310932+00:00,FULL,llm_style,eval,llm_style_eval_170,16,1536,1536,bf16,NVIDIA GeForce RTX 4060,c04,64,64,64,4,3,8,0.0,0.0,58.75200033187866,128.3427198976278,1.2850196005843106,7,-1,-1,16x1536x1536,0,
2026-03-03T03:28:06.424458+00:00,FULL,llm_style,eval,llm_style_eval_171,1,2048,3072,bf16,NVIDIA GeForce RTX 4060,c11,32,128,32,4,2,8,0.0,113.482,60.416001826524734,107.74335823953135,0.20827118014412635,7,-1,-1,1x2048x3072,0,
2026-03-03T03:28:06.544308+00:00,FULL,llm_style,eval,llm_style_eval_172,64,3072,2048,bf16,NVIDIA GeForce RTX 4060,c11,32,128,32,4,2,8,0.0,119.8,54.27199974656105,135.09887263178825,14.838339691933468,3,-1,-1,64x3072x2048,0,
2026-03-03T03:28:06.808365+00:00,FULL,llm_style,eval,llm_style_eval_173,64,8192,6144,bf16,NVIDIA GeForce RTX 4060,c00,32,32,32,2,2,8,0.0,0.0,443.3920085430145,463.390716612339,14.529921198106127,0,-1,-1,64x8192x6144,0,
2026-03-03T03:28:07.029532+00:00,FULL,llm_style,eval,llm_style_eval_174,2,4096,4096,bf16,NVIDIA GeForce RTX 4060,c00,32,32,32,2,2,8,0.0,221.11,161.3280028104782,182.8012773394584,0.4159777771428612,5,-1,-1,2x4096x4096,0,
2026-03-03T03:28:07.075503+00:00,FULL,llm_style,eval,llm_style_eval_175,64,4096,2048,bf16,NVIDIA GeForce RTX 4060,c04,64,64,64,4,3,8,0.0,0.0,95.16800194978714,123.10848064720625,11.282592909395442,1,-1,-1,64x4096x2048,0,
2026-03-03T03:28:07.139880+00:00,FULL,llm_style,eval,llm_style_eval_176,16,6144,2048,bf16,NVIDIA GeForce RTX 4060,c11,32,128,32,4,2,8,0.0,0.0,87.91999891400337,186.0060821473598,4.579767845468749,5,-1,-1,16x6144x2048,0,
2026-03-03T03:28:07.185963+00:00,FULL,llm_style,eval,llm_style_eval_177,1,6144,1536,bf16,NVIDIA GeForce RTX 4060,c11,32,128,32,4,2,8,0.0,0.0,47.55200073122978,96.40576403588042,0.3969205860901718,5,-1,-1,1x6144x1536,0,
2026-03-03T03:28:07.769203+00:00,FULL,llm_style,eval,llm_style_eval_178,32,6144,8192,bf16,NVIDIA GeForce RTX 4060,c02,32,64,32,2,2,8,0.0,583.184,431.10400438308716,528.5501050949097,7.472037928781469,0,-1,-1,32x6144x8192,0,
2026-03-03T03:28:07.910604+00:00,FULL,llm_style,eval,llm_style_eval_179,64,4096,6144,bf16,NVIDIA GeForce RTX 4060,c03,64,64,32,4,2,8,0.0,0.0,258.04799795150757,266.8236845731735,12.483047718143245,0,-1,-1,64x4096x6144,0,
2026-03-03T03:28:07.926900+00:00,FULL,llm_style,eval,llm_style_eval_180,64,2048,1536,bf16,NVIDIA GeForce RTX 4060,c10,64,128,64,8,3,8,0.0,0.0,53.16799879074097,135.30943684279916,7.57322436725079,3,-1,-1,64x2048x1536,0,
2026-03-03T03:28:07.955199+00:00,FULL,llm_style,eval,llm_style_eval_181,64,2048,3072,bf16,NVIDIA GeForce RTX 4060,c03,64,64,32,4,2,8,0.0,0.0,79.05600219964981,138.0211167037486,10.186530378379887,3,-1,-1,64x2048x3072,0,
2026-03-03T03:28:08.028570+00:00,FULL,llm_style,eval,llm_style_eval_182,32,3072,1536,bf16,NVIDIA GeForce RTX 4060,c02,32,64,32,2,2,8,0.0,73.314,45.98399996757507,202.47552514076227,6.567281841791571,3,-1,-1,32x3072x1536,0,
2026-03-03T03:28:08.116472+00:00,FULL,llm_style,eval,llm_style_eval_183,8,8192,2048,bf16,NVIDIA GeForce RTX 4060,c11,32,128,32,4,2,8,0.0,0.0,190.7999962568283,241.00255534052843,1.4068944510809616,5,-1,-1,8x8192x2048,0,
2026-03-03T03:28:08.155453+00:00,FULL,llm_style,eval,llm_style_eval_184,64,8192,1024,bf16,NVIDIA GeForce RTX 4060,c06,64,128,32,4,3,8,0.0,0.0,87.95199915766716,178.08544307947156,12.208270810026235,1,-1,-1,64x8192x1024,0,
2026-03-03T03:28:08.220244+00:00,FULL,llm_style,eval,llm_style_eval_185,1,8192,1536,bf16,NVIDIA GeForce RTX 4060,c11,32,128,32,4,2,8,0.0,0.0,85.79199761152267,149.26815882325167,0.2933353308073572,5,-1,-1,1x8192x1536,0,
2026-03-03T03:28:08.246846+00:00,FULL,llm_style,eval,llm_style_eval_186,16,6144,1024,bf16,NVIDIA GeForce RTX 4060,c11,32,128,32,4,2,8,0.0,0.0,64.51199948787689,141.3865585625171,3.1207619295358113,5,-1,-1,16x6144x1024,0,
2026-03-03T03:28:08.273262+00:00,FULL,llm_style,eval,llm_style_eval_187,1,1024,6144,bf16,NVIDIA GeForce RTX 4060,c04,64,64,64,4,3,8,0.0,0.0,92.6080010831356,98.92031691968441,0.13587283877020656,6,-1,-1,1x1024x6144,0,
2026-03-03T03:28:08.691637+00:00,FULL,llm_style,eval,llm_style_eval_188,8,8192,4096,bf16,NVIDIA GeForce RTX 4060,c11,32,128,32,4,2,8,0.0,418.324,296.51200771331787,326.19519501924515,1.8106211486688686,5,-1,-1,8x8192x4096,0,
2026-03-03T03:28:08.927788+00:00,FULL,llm_style,eval,llm_style_eval_189,8,2048,8192,bf16,NVIDIA GeForce RTX 4060,c06,64,128,32,4,3,8,0.0,236.104,162.81600296497345,172.00544208288193,1.6487043724918637,6,-1,-1,8x2048x8192,0,
2026-03-03T03:28:09.172018+00:00,FULL,llm_style,eval,llm_style_eval_190,4,8192,2048,bf16,NVIDIA GeForce RTX 4060,c07,128,128,32,8,3,8,0.0,244.188,179.26399409770966,271.5852898359298,0.7487154834162809,5,-1,-1,4x8192x2048,0,
2026-03-03T03:28:09.524330+00:00,FULL,llm_style,eval,llm_style_eval_191,4,8192,8192,bf16,NVIDIA GeForce RTX 4060,c06,64,128,32,4,3,8,0.0,0.0,589.8240208625793,631.1676758527756,0.9102221900268849,4,-1,-1,4x8192x8192,0,
2026-03-03T03:28:09.535944+00:00,FULL,llm_style,eval,llm_style_eval_192,64,1536,1024,bf16,NVIDIA GeForce RTX 4060,c00,32,32,32,2,2,8,0.0,0.0,61.43999844789505,166.92832067608833,3.276800082778933,3,-1,-1,64x1536x1024,0,
2026-03-03T03:28:09.554152+00:00,FULL,llm_style,eval,llm_style_eval_193,32,2048,2048,bf16,NVIDIA GeForce RTX 4060,c11,32,128,32,4,2,8,0.0,0.0,53.247999399900436,130.37567928433413,5.04123082604493,3,-1,-1,32x2048x2048,0,
2026-03-03T03:28:09.566797+00:00,FULL,llm_style,eval,llm_style_eval_194,8,1024,2048,bf16,NVIDIA GeForce RTX 4060,c00,32,32,32,2,2,8,0.0,0.0,47.98400029540062,172.38720044493672,0.6992837569487984,7,-1,-1,8x1024x2048,0,
2026-03-03T03:28:09.605062+00:00,FULL,llm_style,eval,llm_style_eval_195,2,4096,2048,bf16,NVIDIA GeForce RTX 4060,c00,32,32,32,2,2,8,0.0,0.0,52.22399905323982,128.61503526568413,0.6425098155695218,5,-1,-1,2x4096x2048,0,
2026-03-03T03:28:09.649721+00:00,FULL,llm_style,eval,llm_style_eval_196,32,2048,4096,bf16,NVIDIA GeForce RTX 4060,c00,32,32,32,2,2,8,0.0,0.0,65.50399959087372,104.03232149779794,8.196002005269904,3,-1,-1,32x2048x4096,0,
2026-03-03T03:28:09.793914+00:00,FULL,llm_style,eval,llm_style_eval_197,32,8192,1536,bf16,NVIDIA GeForce RTX 4060,c11,32,128,32,4,2,8,0.0,144.143,71.55200093984604,73.68096224963665,11.254840639285868,1,-1,-1,32x8192x1536,0,
2026-03-03T03:28:09.959032+00:00,FULL,llm_style,eval,llm_style_eval_198,64,4096,8192,bf16,NVIDIA GeForce RTX 4060,c11,32,128,32,4,2,8,0.0,0.0,326.6560137271881,361.512955725193,13.148287848718466,0,-1,-1,64x4096x8192,0,
2026-03-03T03:28:10.355252+00:00,FULL,llm_style,eval,llm_style_eval_199,2,8192,4096,bf16,NVIDIA GeForce RTX 4060,c11,32,128,32,4,2,8,0.0,396.165,293.69600117206573,455.0691208243369,0.45699542201586446,5,-1,-1,2x8192x4096,0,
2026-03-03T03:28:10.431671+00:00,FULL,llm_style,eval,llm_style_eval_200,1,4096,1024,bf16,NVIDIA GeForce RTX 4060,c00,32,32,32,2,2,8,0.0,76.376,18.432000651955605,195.14240056276316,0.45511109501344243,5,-1,-1,1x4096x1024,0,
2026-03-03T03:28:10.610465+00:00,FULL,llm_style,eval,llm_style_eval_201,4,1536,8192,bf16,NVIDIA GeForce RTX 4060,c04,64,64,64,4,3,8,0.0,178.75,86.01599931716919,126.9494417309761,1.1702857235759294,6,-1,-1,4x1536x8192,0,
2026-03-03T03:28:10.861557+00:00,FULL,llm_style,eval,llm_style_eval_202,1,6144,3072,bf16,NVIDIA GeForce RTX 4060,c07,128,128,32,8,3,8,0.0,251.045,179.19999361038208,194.39072102308273,0.21065143608248993,5,-1,-1,1x6144x3072,0,
2026-03-03T03:28:11.054100+00:00,FULL,llm_style,eval,llm_style_eval_203,16,2048,6144,bf16,NVIDIA GeForce RTX 4060,c00,32,32,32,2,2,8,0.0,192.499,116.52800068259239,237.93248608708365,3.4554199989818466,6,-1,-1,16x2048x6144,0,
2026-03-03T03:28:11.067404+00:00,FULL,llm_style,eval,llm_style_eval_204,16,1536,1024,bf16,NVIDIA GeForce RTX 4060,c04,64,64,64,4,3,8,0.0,0.0,34.671999514102936,125.02304472029206,1.4516511509388854,7,-1,-1,16x1536x1024,0,
2026-03-03T03:28:11.133205+00:00,FULL,llm_style,eval,llm_style_eval_205,64,6144,2048,bf16,NVIDIA GeForce RTX 4060,c10,64,128,64,8,3,8,0.0,0.0,118.78400295972824,268.93312498927094,13.559172075940662,1,-1,-1,64x6144x2048,0,
2026-03-03T03:28:11.194911+00:00,FULL,llm_style,eval,llm_style_eval_206,4,2048,6144,bf16,NVIDIA GeForce RTX 4060,c11,32,128,32,4,2,8,0.0,0.0,80.75200021266937,208.48639592528332,1.2465734066635132,6,-1,-1,4x2048x6144,0,
2026-03-03T03:28:11.310347+00:00,FULL,llm_style,eval,llm_style_eval_207,32,6144,1536,bf16,NVIDIA GeForce RTX 4060,c11,32,128,32,4,2,8,0.0,115.381,50.175998359918594,57.80096046626568,12.037224883251529,1,-1,-1,32x6144x1536,0,
2026-03-03T03:28:11.365687+00:00,FULL,llm_style,eval,llm_style_eval_208,4,2048,1024,bf16,NVIDIA GeForce RTX 4060,c00,32,32,32,2,2,8,0.0,55.301,36.86400130391121,168.9449587464332,0.45511109501344243,7,-1,-1,4x2048x1024,0,
2026-03-03T03:28:11.420786+00:00,FULL,llm_style,eval,llm_style_eval_209,1,1024,1536,bf16,NVIDIA GeForce RTX 4060,c00,32,32,32,2,2,8,0.0,55.061,37.88800165057182,129.2864022403955,0.08302702340999615,7,-1,-1,1x1024x1536,0,
2026-03-03T03:28:11.723569+00:00,FULL,llm_style,eval,llm_style_eval_210,8,6144,4096,bf16,NVIDIA GeForce RTX 4060,c02,32,64,32,2,2,8,0.0,302.746,228.28800231218338,252.1990305185318,1.7637947676697114,5,-1,-1,8x6144x4096,0,
2026-03-03T03:28:11.974221+00:00,FULL,llm_style,eval,llm_style_eval_211,4,2048,8192,bf16,NVIDIA GeForce RTX 4060,c00,32,32,32,2,2,8,0.0,250.607,168.96000504493713,377.3529587686056,0.7943757338566783,6,-1,-1,4x2048x8192,0,
2026-03-03T03:28:12.036931+00:00,FULL,llm_style,eval,llm_style_eval_212,32,1024,1024,bf16,NVIDIA GeForce RTX 4060,c04,64,64,64,4,3,8,0.0,62.666,40.95999896526337,63.63904077559706,1.6384000413894664,3,-1,-1,32x1024x1024,0,
2026-03-03T03:28:12.106530+00:00,FULL,llm_style,eval,llm_style_eval_213,16,3072,4096,bf16,NVIDIA GeForce RTX 4060,c00,32,32,32,2,2,8,0.0,0.0,78.84799689054489,156.38400301337234,5.106701500089527,7,-1,-1,16x3072x4096,0,
2026-03-03T03:28:12.158602+00:00,FULL,llm_style,eval,llm_style_eval_214,64,1024,8192,bf16,NVIDIA GeForce RTX 4060,c04,64,64,64,4,3,8,0.0,0.0,94.71999853849411,227.08160579204554,11.335956931667736,2,-1,-1,64x1024x8192,0,
2026-03-03T03:28:12.183501+00:00,FULL,llm_style,eval,llm_style_eval_215,4,4096,1536,bf16,NVIDIA GeForce RTX 4060,c11,32,128,32,4,2,8,0.0,0.0,47.13600128889084,70.81983782351014,1.067796304814306,5,-1,-1,4x4096x1536,0,
2026-03-03T03:28:12.264156+00:00,FULL,llm_style,eval,llm_style_eval_216,16,1536,3072,bf16,NVIDIA GeForce RTX 4060,c00,32,32,32,2,2,8,0.0,80.604,53.247999399900436,88.00287939608097,2.835692339650273,7,-1,-1,16x1536x3072,0,
2026-03-03T03:28:12.325733+00:00,FULL,llm_style,eval,llm_style_eval_217,8,6144,2048,bf16,NVIDIA GeForce RTX 4060,c00,32,32,32,2,2,8,0.0,0.0,69.43999975919724,149.7756765782833,2.8992884893167723,5,-1,-1,8x6144x2048,0,
2026-03-03T03:28:12.481339+00:00,FULL,llm_style,eval,llm_style_eval_218,8,3072,4096,bf16,NVIDIA GeForce RTX 4060,c11,32,128,32,4,2,8,0.0,155.555,78.51200178265572,90.17344072461127,2.564277912023326,7,-1,-1,8x3072x4096,0,
2026-03-03T03:28:12.804502+00:00,FULL,llm_style,eval,llm_style_eval_219,64,8192,3072,bf16,NVIDIA GeForce RTX 4060,c00,32,32,32,2,2,8,0.0,323.118,236.4640012383461,588.0729597806921,13.62247722753002,1,-1,-1,64x8192x3072,0,
2026-03-03T03:28:12.842388+00:00,FULL,llm_style,eval,llm_style_eval_220,2,4096,2048,bf16,NVIDIA GeForce RTX 4060,c00,32,32,32,2,2,8,0.0,0.0,72.75200262665749,150.23840010166168,0.46121660969515527,5,-1,-1,2x4096x2048,0,
2026-03-03T03:28:13.013962+00:00,FULL,llm_style,eval,llm_style_eval_221,4,1024,8192,bf16,NVIDIA GeForce RTX 4060,c04,64,64,64,4,3,8,0.0,171.512,108.5439994931221,190.77536106109613,0.6182641538305611,6,-1,-1,4x1024x8192,0,
2026-03-03T03:28:13.085539+00:00,FULL,llm_style,eval,llm_style_eval_222,64,6144,2048,bf16,NVIDIA GeForce RTX 4060,c10,64,128,64,8,3,8,0.0,0.0,118.78400295972824,206.67391866445513,13.559172075940662,1,-1,-1,64x6144x2048,0,
2026-03-03T03:28:13.163521+00:00,FULL,llm_style,eval,llm_style_eval_223,4,2048,2048,bf16,NVIDIA GeForce RTX 4060,c11,32,128,32,4,2,8,0.0,77.929,51.93600058555603,178.3567959070205,0.6460726975833379,7,-1,-1,4x2048x2048,0,
2026-03-03T03:28:13.185589+00:00,FULL,llm_style,eval,llm_style_eval_224,16,3072,1536,bf16,NVIDIA GeForce RTX 4060,c00,32,32,32,2,2,8,0.0,0.0,48.895999789237976,117.75615923106652,3.0880837829444285,7,-1,-1,16x3072x1536,0,
2026-03-03T03:28:13.201542+00:00,FULL,llm_style,eval,llm_style_eval_225,1,2048,2048,bf16,NVIDIA GeForce RTX 4060,c00,32,32,32,2,2,8,0.0,0.0,49.1040013730526,59.751040413975716,0.17083349147598223,7,-1,-1,1x2048x2048,0,
2026-03-03T03:28:13.211665+00:00,FULL,llm_style,eval,llm_style_eval_226,8,1536,1024,bf16,NVIDIA GeForce RTX 4060,c04,64,64,64,4,3,8,0.0,0.0,41.98399931192398,102.38976091146459,0.5994146439701515,7,-1,-1,8x1536x1024,0,
2026-03-03T03:28:13.397939+00:00,FULL,llm_style,eval,llm_style_eval_227,64,6144,6144,bf16,NVIDIA GeForce RTX 4060,c06,64,128,32,4,3,8,0.0,0.0,333.77599716186523,482.9932665824889,14.476290233826465,0,-1,-1,64x6144x6144,0,
2026-03-03T03:28:13.458250+00:00,FULL,llm_style,eval,llm_style_eval_228,64,6144,2048,bf16,NVIDIA GeForce RTX 4060,c10,64,128,64,8,3,8,0.0,0.0,94.86399963498116,153.3606418967246,16.97812386360827,1,-1,-1,64x6144x2048,0,
2026-03-03T03:28:13.634848+00:00,FULL,llm_style,eval,llm_style_eval_229,16,1536,8192,bf16,NVIDIA GeForce RTX 4060,c04,64,64,64,4,3,8,0.0,176.542,88.06400001049042,98.79967950284481,4.57227906922278,6,-1,-1,16x1536x8192,0,
2026-03-03T03:28:13.654128+00:00,FULL,llm_style,eval,llm_style_eval_230,64,2048,1536,bf16,NVIDIA GeForce RTX 4060,c10,64,128,64,8,3,8,0.0,0.0,50.09600147604942,63.528959155082696,8.03763119083478,3,-1,-1,64x2048x1536,0,
2026-03-03T03:28:13.699098+00:00,FULL,llm_style,eval,llm_style_eval_231,4,1024,8192,bf16,NVIDIA GeForce RTX 4060,c04,64,64,64,4,3,8,0.0,0.0,97.6640023291111,185.82495868206013,0.6871402195238172,6,-1,-1,4x1024x8192,0,
2026-03-03T03:28:13.721005+00:00,FULL,llm_style,eval,llm_style_eval_232,16,3072,1536,bf16,NVIDIA GeForce RTX 4060,c00,32,32,32,2,2,8,0.0,0.0,22.175999358296394,194.14016202092148,6.80893526196421,7,-1,-1,16x3072x1536,0,
2026-03-03T03:28:13.772052+00:00,FULL,llm_style,eval,llm_style_eval_233,64,3072,3072,bf16,NVIDIA GeForce RTX 4060,c03,64,64,32,4,2,8,0.0,0.0,66.56000018119812,193.16064029932005,18.1484307198248,3,-1,-1,64x3072x3072,0,
2026-03-03T03:28:13.931580+00:00,FULL,llm_style,eval,llm_style_eval_234,32,8192,4096,bf16,NVIDIA GeForce RTX 4060,c00,32,32,32,2,2,8,0.0,0.0,297.4720001220703,405.4972717165947,7.219111873113303,1,-1,-1,32x8192x4096,0,
2026-03-03T03:28:13.945620+00:00,FULL,llm_style,eval,llm_style_eval_235,4,2048,1024,bf16,NVIDIA GeForce RTX 4060,c00,32,32,32,2,2,8,0.0,0.0,59.79200080037117,192.50176161527622,0.2805929852726362,7,-1,-1,4x2048x1024,0,
2026-03-03T03:28:14.075822+00:00,FULL,llm_style,eval,llm_style_eval_236,4,8192,3072,bf16,NVIDIA GeForce RTX 4060,c11,32,128,32,4,2,8,0.0,0.0,233.5360050201416,352.8396838903427,0.8620794552969953,5,-1,-1,4x8192x3072,0,
2026-03-03T03:28:14.097543+00:00,FULL,llm_style,eval,llm_style_eval_237,64,1024,4096,bf16,NVIDIA GeForce RTX 4060,c04,64,64,64,4,3,8,0.0,0.0,72.7040022611618,229.78559568524352,7.384337798509263,3,-1,-1,64x1024x4096,0,
2026-03-03T03:28:14.271499+00:00,FULL,llm_style,eval,llm_style_eval_238,32,2048,6144,bf16,NVIDIA GeForce RTX 4060,c04,64,64,64,4,3,8,0.0,173.904,105.47199845314026,115.14496125280857,7.635262247901621,2,-1,-1,32x2048x6144,0,
2026-03-03T03:28:14.281183+00:00,FULL,llm_style,eval,llm_style_eval_239,32,2048,6144,bf16,NVIDIA GeForce RTX 4060,c04,64,64,64,4,3,8,0.0,0.0,128.00000607967377,170.12416437268251,6.2914557011718895,2,-1,-1,32x2048x6144,0,
2026-03-03T03:28:14.425216+00:00,FULL,llm_style,eval,llm_style_eval_240,8,8192,1536,bf16,NVIDIA GeForce RTX 4060,c00,32,32,32,2,2,8,0.0,144.0,62.463998794555664,85.3935980796814,3.2230820294128772,5,-1,-1,8x8192x1536,0,
2026-03-03T03:28:14.438050+00:00,FULL,llm_style,eval,llm_style_eval_241,16,1536,1536,bf16,NVIDIA GeForce RTX 4060,c04,64,64,64,4,3,8,0.0,0.0,39.93599861860275,117.833599075675,1.8904616038531266,7,-1,-1,16x1536x1536,0,
2026-03-03T03:28:14.463579+00:00,FULL,llm_style,eval,llm_style_eval_242,1,2048,3072,bf16,NVIDIA GeForce RTX 4060,c11,32,128,32,4,2,8,0.0,0.0,62.272001057863235,237.65055716037745,0.20206371701959505,7,-1,-1,1x2048x3072,0,
2026-03-03T03:28:14.504468+00:00,FULL,llm_style,eval,llm_style_eval_243,8,1536,6144,bf16,NVIDIA GeForce RTX 4060,c04,64,64,64,4,3,8,0.0,0.0,72.65600189566612,81.45919777452944,2.0782170785674174,6,-1,-1,8x1536x6144,0,
2026-03-03T03:28:14.546328+00:00,FULL,llm_style,eval,llm_style_eval_244,32,8192,1024,bf16,NVIDIA GeForce RTX 4060,c02,32,64,32,2,2,8,0.0,0.0,52.22399905323982,155.12287586927403,10.280157049112349,1,-1,-1,32x8192x1024,0,
2026-03-03T03:28:14.673670+00:00,FULL,llm_style,eval,llm_style_eval_245,4,6144,4096,bf16,NVIDIA GeForce RTX 4060,c10,64,128,64,8,3,8,0.0,0.0,254.97600436210632,346.4483210444449,0.7895903479375428,5,-1,-1,4x6144x4096,0,
2026-03-03T03:28:14.748972+00:00,FULL,llm_style,eval,llm_style_eval_246,32,2048,6144,bf16,NVIDIA GeForce RTX 4060,c04,64,64,64,4,3,8,0.0,0.0,132.09599256515503,289.7497707605361,6.096372436149346,2,-1,-1,32x2048x6144,0,
2026-03-03T03:28:14.812333+00:00,FULL,llm_style,eval,llm_style_eval_247,64,6144,2048,bf16,NVIDIA GeForce RTX 4060,c10,64,128,64,8,3,8,0.0,0.0,92.06400066614151,106.02303840219973,17.494489967264013,1,-1,-1,64x6144x2048,0,
2026-03-03T03:28:14.821464+00:00,FULL,llm_style,eval,llm_style_eval_248,64,1024,1024,bf16,NVIDIA GeForce RTX 4060,c04,64,64,64,4,3,8,0.0,0.0,40.95999896526337,90.5123206228017,3.2768000827789328,3,-1,-1,64x1024x1024,0,
2026-03-03T03:28:14.928774+00:00,FULL,llm_style,eval,llm_style_eval_249,2,8192,1024,bf16,NVIDIA GeForce RTX 4060,c00,32,32,32,2,2,8,0.0,107.266,49.55200105905533,144.94720071554184,0.6771559429055214,5,-1,-1,2x8192x1024,0,
2026-03-03T03:28:14.986020+00:00,FULL,llm_style,eval,llm_style_eval_250,64,3072,3072,bf16,NVIDIA GeForce RTX 4060,c03,64,64,32,4,2,8,0.0,0.0,72.08000123500824,180.46976149082178,16.758595051373433,3,-1,-1,64x3072x3072,0,
2026-03-03T03:28:15.031519+00:00,FULL,llm_style,eval,llm_style_eval_251,64,1024,8192,bf16,NVIDIA GeForce RTX 4060,c04,64,64,64,4,3,8,0.0,0.0,93.6960019171238,137.65568152070034,11.45984676005438,2,-1,-1,64x1024x8192,0,
2026-03-03T03:28:15.095396+00:00,FULL,llm_style,eval,llm_style_eval_252,64,4096,3072,bf16,NVIDIA GeForce RTX 4060,c04,64,64,64,4,3,8,0.0,0.0,92.49600023031235,174.3257594108581,17.412782520212996,1,-1,-1,64x4096x3072,0,
2026-03-03T03:28:15.218865+00:00,FULL,llm_style,eval,llm_style_eval_253,8,6144,4096,bf16,NVIDIA GeForce RTX 4060,c02,32,64,32,2,2,8,0.0,0.0,229.48800027370453,265.5436803400516,1.7545718448013217,5,-1,-1,8x6144x4096,0,
2026-03-03T03:28:15.302916+00:00,FULL,llm_style,eval,llm_style_eval_254,4,1536,3072,bf16,NVIDIA GeForce RTX 4060,c00,32,32,32,2,2,8,0.0,83.997,29.69600073993206,155.6153585016727,1.271172382119437,7,-1,-1,4x1536x3072,0,
2026-03-03T03:28:15.324605+00:00,FULL,llm_style,eval,llm_style_eval_255,1,3072,1536,bf16,NVIDIA GeForce RTX 4060,c00,32,32,32,2,2,8,0.0,0.0,41.9359989464283,130.05375988781444,0.225037777496505,7,-1,-1,1x3072x1536,0,
2026-03-03T03:28:15.408691+00:00,BUCKET,llm_style,tune,llm_style_tune_000,32,3072,2048,bf16,NVIDIA GeForce RTX 4060,c02,32,64,32,2,2,8,0.0,81.838,51.88800022006035,113.73567730188358,7.760044370419402,3,-1,-1,llm8_g3,0,
2026-03-03T03:28:15.499439+00:00,BUCKET,llm_style,tune,llm_style_tune_001,4,4096,1536,bf16,NVIDIA GeForce RTX 4060,c11,32,128,32,4,2,8,0.0,90.699,47.50399850308895,54.81951981782912,1.059524452383249,5,-1,-1,llm8_g5,0,
2026-03-03T03:28:15.531027+00:00,BUCKET,llm_style,tune,llm_style_tune_002,8,8192,1024,bf16,NVIDIA GeForce RTX 4060,c11,32,128,32,4,2,8,0.0,0.0,47.568000853061676,57.425918914377675,2.821596989425743,5,-1,-1,llm8_g5,0,
2026-03-03T03:28:15.556980+00:00,BUCKET,llm_style,tune,llm_style_tune_003,64,1024,4096,bf16,NVIDIA GeForce RTX 4060,c02,32,64,32,2,2,8,0.0,0.0,69.50400024652481,241.89888447523086,7.7243167313502,3,-1,-1,llm8_g3,0,
2026-03-03T03:28:15.698671+00:00,BUCKET,llm_style,tune,llm_style_tune_004,16,3072,4096,bf16,NVIDIA GeForce RTX 4060,c00,32,32,32,2,2,8,0.0,141.64,51.15199834108353,244.31616440415382,7.8716999737741,7,-1,-1,llm8_g7,0,
2026-03-03T03:28:15.740666+00:00,BUCKET,llm_style,tune,llm_style_tune_005,16,1536,4096,bf16,NVIDIA GeForce RTX 4060,c00,32,32,32,2,2,8,0.0,0.0,60.48000045120716,157.88736015558237,3.328812673578305,7,-1,-1,llm8_g7,0,
2026-03-03T03:28:15.755335+00:00,BUCKET,llm_style,tune,llm_style_tune_006,2,2048,1024,bf16,NVIDIA GeForce RTX 4060,c00,32,32,32,2,2,8,0.0,0.0,36.73600032925606,113.63999910652632,0.22834843000911628,7,-1,-1,llm8_g7,0,
2026-03-03T03:28:15.832693+00:00,BUCKET,llm_style,tune,llm_style_tune_007,32,6144,1024,bf16,NVIDIA GeForce RTX 4060,c11,32,128,32,4,2,8,0.0,77.314,41.95199906826019,50.10847937315702,9.597949869917809,1,-1,-1,llm8_g1,0,
2026-03-03T03:28:15.846766+00:00,BUCKET,llm_style,tune,llm_style_tune_008,8,1536,2048,bf16,NVIDIA GeForce RTX 4060,c00,32,32,32,2,2,8,0.0,0.0,43.007999658584595,88.87296013534063,1.1702857235759294,7,-1,-1,llm8_g7,0,
2026-03-03T03:28:15.959620+00:00,BUCKET,llm_style,tune,llm_style_tune_009,16,1024,6144,bf16,NVIDIA GeForce RTX 4060,c04,64,64,64,4,3,8,0.0,112.803,70.65600156784058,78.84799689054489,2.849391241120482,6,-1,-1,llm8_g6,0,
2026-03-03T03:28:15.976531+00:00,BUCKET,llm_style,tune,llm_style_tune_010,64,1536,2048,bf16,NVIDIA GeForce RTX 4060,c02,32,64,32,2,2,8,0.0,0.0,71.68000191450119,171.550722271204,5.617371278537052,3,-1,-1,llm8_g3,0,
2026-03-03T03:28:16.004398+00:00,BUCKET,llm_style,tune,llm_style_tune_011,64,1536,4096,bf16,NVIDIA GeForce RTX 4060,c02,32,64,32,2,2,8,0.0,0.0,75.77600330114365,136.99072137474997,10.627458996479508,3,-1,-1,llm8_g3,0,
2026-03-03T03:28:16.018980+00:00,BUCKET,llm_style,tune,llm_style_tune_012,32,1024,2048,bf16,NVIDIA GeForce RTX 4060,c02,32,64,32,2,2,8,0.0,0.0,60.416001826524734,146.11200176179398,2.221559254870681,3,-1,-1,llm8_g3,0,
2026-03-03T03:28:16.029927+00:00,BUCKET,llm_style,tune,llm_style_tune_013,64,1536,1024,bf16,NVIDIA GeForce RTX 4060,c02,32,64,32,2,2,8,0.0,0.0,43.007999658584595,132.65920385718346,4.681142894303718,3,-1,-1,llm8_g3,0,
2026-03-03T03:28:16.123267+00:00,BUCKET,llm_style,tune,llm_style_tune_014,4,6144,3072,bf16,NVIDIA GeForce RTX 4060,c11,32,128,32,4,2,8,0.0,0.0,179.58399653434753,219.04384329915038,0.8408040076729245,5,-1,-1,llm8_g5,0,
2026-03-03T03:28:16.148706+00:00,BUCKET,llm_style,tune,llm_style_tune_015,1,6144,1024,bf16,NVIDIA GeForce RTX 4060,c11,32,128,32,4,2,8,0.0,0.0,61.4400003105402,179.0543995797633,0.204799998964866,5,-1,-1,llm8_g5,0,
2026-03-03T03:28:16.320520+00:00,BUCKET,llm_style,tune,llm_style_tune_016,4,8192,4096,bf16,NVIDIA GeForce RTX 4060,c11,32,128,32,4,2,8,0.0,0.0,294.3200021982193,403.03615868091583,0.9120530510842191,5,-1,-1,llm8_g5,0,
2026-03-03T03:28:16.339532+00:00,BUCKET,llm_style,tune,llm_style_tune_017,64,1536,2048,bf16,NVIDIA GeForce RTX 4060,c02,32,64,32,2,2,8,0.0,0.0,57.80800059437752,149.98175829648972,6.965353927829197,3,-1,-1,llm8_g3,0,
2026-03-03T03:28:16.405638+00:00,BUCKET,llm_style,tune,llm_style_tune_018,64,8192,1536,bf16,NVIDIA GeForce RTX 4060,c11,32,128,32,4,2,8,0.0,0.0,120.83200365304947,233.6358445882797,13.329355529224086,1,-1,-1,llm8_g1,0,
2026-03-03T03:28:16.417142+00:00,BUCKET,llm_style,tune,llm_style_tune_019,2,1536,1024,bf16,NVIDIA GeForce RTX 4060,c00,32,32,32,2,2,8,0.0,0.0,65.5359998345375,136.617602109909,0.09600000024237669,7,-1,-1,llm8_g7,0,
2026-03-03T03:28:16.427413+00:00,BUCKET,llm_style,tune,llm_style_tune_020,16,1024,1536,bf16,NVIDIA GeForce RTX 4060,c00,32,32,32,2,2,8,0.0,0.0,44.89600099623203,113.1036792695522,1.1210719637195339,7,-1,-1,llm8_g7,0,
2026-03-03T03:28:16.463251+00:00,BUCKET,llm_style,tune,llm_style_tune_021,1,6144,1536,bf16,NVIDIA GeForce RTX 4060,c11,32,128,32,4,2,8,0.0,0.0,50.175998359918594,61.982720457017415,0.3761632776016103,5,-1,-1,llm8_g5,0,
2026-03-03T03:28:16.551195+00:00,BUCKET,llm_style,tune,llm_style_tune_022,8,4096,4096,bf16,NVIDIA GeForce RTX 4060,c11,32,128,32,4,2,8,0.0,0.0,164.86400365829468,215.65440028905863,1.6282235663545612,5,-1,-1,llm8_g5,0,
2026-03-03T03:28:16.982919+00:00,BUCKET,llm_style,tune,llm_style_tune_023,2,4096,8192,bf16,NVIDIA GeForce RTX 4060,c11,32,128,32,4,2,8,0.0,431.665,293.88800263404846,473.6918446421623,0.45669686001823256,4,-1,-1,llm8_g4,0,
2026-03-03T03:28:17.015825+00:00,BUCKET,llm_style,tune,llm_style_tune_024,64,1536,2048,bf16,NVIDIA GeForce RTX 4060,c02,32,64,32,2,2,8,0.0,0.0,55.79200014472008,262.25663542747486,7.217041564302216,3,-1,-1,llm8_g3,0,
2026-03-03T03:28:17.042712+00:00,BUCKET,llm_style,tune,llm_style_tune_025,4,4096,1536,bf16,NVIDIA GeForce RTX 4060,c11,32,128,32,4,2,8,0.0,0.0,46.20799981057644,118.29920172691342,1.0892410016951157,5,-1,-1,llm8_g5,0,
2026-03-03T03:28:17.066112+00:00,BUCKET,llm_style,tune,llm_style_tune_026,4,3072,2048,bf16,NVIDIA GeForce RTX 4060,c00,32,32,32,2,2,8,0.0,0.0,56.2559999525547,141.50943815708135,0.8946894205497868,7,-1,-1,llm8_g7,0,
2026-03-03T03:28:17.084175+00:00,BUCKET,llm_style,tune,llm_style_tune_027,8,4096,1024,bf16,NVIDIA GeForce RTX 4060,c11,32,128,32,4,2,8,0.0,0.0,45.823998749256134,90.44799916446209,1.4644916600843219,5,-1,-1,llm8_g5,0,
2026-03-03T03:28:17.094840+00:00,BUCKET,llm_style,tune,llm_style_tune_028,16,1536,1024,bf16,NVIDIA GeForce RTX 4060,c00,32,32,32,2,2,8,0.0,0.0,39.792001247406006,104.9027194455264,1.2648684766333802,7,-1,-1,llm8_g7,0,
2026-03-03T03:28:17.495900+00:00,BUCKET,llm_style,tune,llm_style_tune_029,64,4096,8192,bf16,NVIDIA GeForce RTX 4060,c06,64,128,32,4,3,8,0.0,401.026,300.6719946861267,342.9363191127776,14.284560490854965,0,-1,-1,llm8_g0,0,
2026-03-03T03:28:17.560920+00:00,BUCKET,llm_style,tune,llm_style_tune_030,1,8192,1536,bf16,NVIDIA GeForce RTX 4060,c11,32,128,32,4,2,8,0.0,0.0,63.34399804472923,77.79263995587826,0.3972882163552354,5,-1,-1,llm8_g5,0,
2026-03-03T03:28:17.803026+00:00,BUCKET,llm_style,tune,llm_style_tune_031,1,8192,6144,bf16,NVIDIA GeForce RTX 4060,c11,32,128,32,4,2,8,0.0,0.0,426.9440025091171,458.63584667444223,0.23577634398986647,4,-1,-1,llm8_g4,0,
2026-03-03T03:28:18.104183+00:00,BUCKET,llm_style,tune,llm_style_tune_032,32,3072,8192,bf16,NVIDIA GeForce RTX 4060,c10,64,128,64,8,3,8,0.0,301.094,229.37600314617157,263.7407884001732,7.021714189402912,2,-1,-1,llm8_g2,0,
2026-03-03T03:28:18.144284+00:00,BUCKET,llm_style,tune,llm_style_tune_033,4,1536,6144,bf16,NVIDIA GeForce RTX 4060,c04,64,64,64,4,3,8,0.0,0.0,75.77600330114365,150.08768245577812,0.996324280919954,6,-1,-1,llm8_g6,0,
2026-03-03T03:28:18.175613+00:00,BUCKET,llm_style,tune,llm_style_tune_034,1,4096,1536,bf16,NVIDIA GeForce RTX 4060,c11,32,128,32,4,2,8,0.0,0.0,40.351999923586845,108.85983861982814,0.31182870796559814,5,-1,-1,llm8_g5,0,
2026-03-03T03:28:18.199574+00:00,BUCKET,llm_style,tune,llm_style_tune_035,4,1536,4096,bf16,NVIDIA GeForce RTX 4060,c00,32,32,32,2,2,8,0.0,0.0,59.39200147986412,69.4643197953701,0.8474482547462914,7,-1,-1,llm8_g7,0,
2026-03-03T03:28:18.319051+00:00,BUCKET,llm_style,tune,llm_style_tune_036,32,8192,3072,bf16,NVIDIA GeForce RTX 4060,c11,32,128,32,4,2,8,0.0,0.0,229.40800338983536,251.96447834372518,7.020734726778775,1,-1,-1,llm8_g1,0,
2026-03-03T03:28:18.344144+00:00,BUCKET,llm_style,tune,llm_style_tune_037,32,3072,2048,bf16,NVIDIA GeForce RTX 4060,c02,32,64,32,2,2,8,0.0,0.0,48.06400090456009,119.1590379178524,8.377437924893975,3,-1,-1,llm8_g3,0,
2026-03-03T03:28:18.375937+00:00,BUCKET,llm_style,tune,llm_style_tune_038,2,2048,4096,bf16,NVIDIA GeForce RTX 4060,c00,32,32,32,2,2,8,0.0,0.0,61.135999858379364,113.10272157192223,0.5488489936817643,7,-1,-1,llm8_g7,0,
2026-03-03T03:28:18.394608+00:00,BUCKET,llm_style,tune,llm_style_tune_039,64,2048,1536,bf16,NVIDIA GeForce RTX 4060,c02,32,64,32,2,2,8,0.0,0.0,54.83200028538704,143.04255992174146,7.343397685736241,3,-1,-1,llm8_g3,0,
2026-03-03T03:28:18.426471+00:00,BUCKET,llm_style,tune,llm_style_tune_040,64,1024,6144,bf16,NVIDIA GeForce RTX 4060,c10,64,128,64,8,3,8,0.0,0.0,106.49599879980087,150.92895738780487,7.561846239067394,2,-1,-1,llm8_g2,0,
2026-03-03T03:28:18.685521+00:00,BUCKET,llm_style,tune,llm_style_tune_041,4,8192,6144,bf16,NVIDIA GeForce RTX 4060,c11,32,128,32,4,2,8,0.0,0.0,424.9119907617569,450.4236897826195,0.947615489217302,4,-1,-1,llm8_g4,0,
2026-03-03T03:28:18.710667+00:00,BUCKET,llm_style,tune,llm_style_tune_042,1,1024,6144,bf16,NVIDIA GeForce RTX 4060,c04,64,64,64,4,3,8,0.0,0.0,70.28799876570702,152.07775875926018,0.17901935210793207,6,-1,-1,llm8_g6,0,
2026-03-03T03:28:18.798420+00:00,BUCKET,llm_style,tune,llm_style_tune_043,64,2048,8192,bf16,NVIDIA GeForce RTX 4060,c10,64,128,64,8,3,8,0.0,0.0,166.655994951725,259.20448407530756,12.88572696482991,2,-1,-1,llm8_g2,0,
2026-03-03T03:28:18.813034+00:00,BUCKET,llm_style,tune,llm_style_tune_044,16,2048,1024,bf16,NVIDIA GeForce RTX 4060,c00,32,32,32,2,2,8,0.0,0.0,40.95999896526337,906.9875064492205,1.6384000413894664,7,-1,-1,llm8_g7,0,
2026-03-03T03:28:18.824168+00:00,BUCKET,llm_style,tune,llm_style_tune_045,4,1024,1536,bf16,NVIDIA GeForce RTX 4060,c00,32,32,32,2,2,8,0.0,0.0,46.879999339580536,139.82719883322716,0.26840682971973323,7,-1,-1,llm8_g7,0,
2026-03-03T03:28:18.854760+00:00,BUCKET,llm_style,tune,llm_style_tune_046,64,1536,4096,bf16,NVIDIA GeForce RTX 4060,c02,32,64,32,2,2,8,0.0,0.0,104.39999774098396,196.81279942393297,7.713662695644518,3,-1,-1,llm8_g3,0,
2026-03-03T03:28:18.871311+00:00,BUCKET,llm_style,tune,llm_style_tune_047,16,2048,1536,bf16,NVIDIA GeForce RTX 4060,c00,32,32,32,2,2,8,0.0,0.0,64.51199948787689,160.2505606412887,1.5603809647679057,7,-1,-1,llm8_g7,0,
2026-03-03T03:28:19.053402+00:00,BUCKET,llm_style,tune,llm_style_tune_048,64,6144,6144,bf16,NVIDIA GeForce RTX 4060,c06,64,128,32,4,3,8,0.0,0.0,334.6879929304123,349.76769030094147,14.436843597806114,0,-1,-1,llm8_g0,0,
2026-03-03T03:28:19.214372+00:00,BUCKET,llm_style,tune,llm_style_tune_049,4,4096,8192,bf16,NVIDIA GeForce RTX 4060,c11,32,128,32,4,2,8,0.0,0.0,293.61599683761597,314.31936860084534,0.914239887782606,4,-1,-1,llm8_g4,0,
2026-03-03T03:28:19.274006+00:00,BUCKET,llm_style,tune,llm_style_tune_050,1,4096,3072,bf16,NVIDIA GeForce RTX 4060,c11,32,128,32,4,2,8,0.0,0.0,81.55200257897377,123.68895702064032,0.3085862174338366,5,-1,-1,llm8_g5,0,
2026-03-03T03:28:19.307716+00:00,BUCKET,llm_style,tune,llm_style_tune_051,2,4096,2048,bf16,NVIDIA GeForce RTX 4060,c11,32,128,32,4,2,8,0.0,0.0,58.28800052404404,198.49632158875463,0.5756662039926839,5,-1,-1,llm8_g5,0,
2026-03-03T03:28:19.367797+00:00,BUCKET,llm_style,tune,llm_style_tune_052,4,8192,1536,bf16,NVIDIA GeForce RTX 4060,c11,32,128,32,4,2,8,0.0,0.0,62.463998794555664,92.06336192786688,1.6115410147064386,5,-1,-1,llm8_g5,0,
2026-03-03T03:28:19.393035+00:00,BUCKET,llm_style,tune,llm_style_tune_053,1,1536,4096,bf16,NVIDIA GeForce RTX 4060,c00,32,32,32,2,2,8,0.0,0.0,66.31999835371971,135.7311974465847,0.189730282152431,7,-1,-1,llm8_g7,0,
2026-03-03T03:28:19.633168+00:00,BUCKET,llm_style,tune,llm_style_tune_054,8,8192,6144,bf16,NVIDIA GeForce RTX 4060,c11,32,128,32,4,2,8,0.0,0.0,426.7999976873398,463.9427238702774,1.8868471704864958,4,-1,-1,llm8_g4,0,
2026-03-03T03:28:19.672247+00:00,BUCKET,llm_style,tune,llm_style_tune_055,64,6144,1536,bf16,NVIDIA GeForce RTX 4060,c11,32,128,32,4,2,8,0.0,0.0,67.96799972653389,74.20544229447842,17.77247464777792,1,-1,-1,llm8_g1,0,
2026-03-03T03:28:19.696928+00:00,BUCKET,llm_style,tune,llm_style_tune_056,1,3072,1536,bf16,NVIDIA GeForce RTX 4060,c00,32,32,32,2,2,8,0.0,0.0,39.93599861860275,54.772481285035596,0.23630770048164082,7,-1,-1,llm8_g7,0,
2026-03-03T03:28:19.706974+00:00,BUCKET,llm_style,tune,llm_style_tune_057,64,1024,1024,bf16,NVIDIA GeForce RTX 4060,c02,32,64,32,2,2,8,0.0,0.0,50.175998359918594,178.07392030954352,2.674938862944784,3,-1,-1,llm8_g3,0,
2026-03-03T03:28:19.867597+00:00,BUCKET,llm_style,tune,llm_style_tune_058,16,8192,4096,bf16,NVIDIA GeForce RTX 4060,c11,32,128,32,4,2,8,0.0,0.0,295.3120023012161,320.55297166109085,3.6359572778379357,5,-1,-1,llm8_g5,0,
2026-03-03T03:28:19.992023+00:00,BUCKET,llm_style,tune,llm_style_tune_059,16,4096,6144,bf16,NVIDIA GeForce RTX 4060,c11,32,128,32,4,2,8,0.0,0.0,231.4240038394928,243.5248026251793,3.4797875528872577,4,-1,-1,llm8_g4,0,
2026-03-03T03:28:20.114300+00:00,BUCKET,llm_style,tune,llm_style_tune_060,2,3072,8192,bf16,NVIDIA GeForce RTX 4060,c04,64,64,64,4,3,8,0.0,0.0,233.47200453281403,269.8492816090584,0.43115788636599456,6,-1,-1,llm8_g6,0,
2026-03-03T03:28:20.290319+00:00,BUCKET,llm_style,tune,llm_style_tune_061,64,4096,8192,bf16,NVIDIA GeForce RTX 4060,c06,64,128,32,4,3,8,0.0,0.0,402.43199467658997,423.4751906991005,10.67252940326378,0,-1,-1,llm8_g0,0,
2026-03-03T03:28:20.351915+00:00,BUCKET,llm_style,tune,llm_style_tune_062,32,4096,3072,bf16,NVIDIA GeForce RTX 4060,c11,32,128,32,4,2,8,0.0,0.0,113.66400122642517,130.0684793293476,7.0849728965267005,1,-1,-1,llm8_g1,0,
2026-03-03T03:28:20.472483+00:00,BUCKET,llm_style,tune,llm_style_tune_063,2,3072,8192,bf16,NVIDIA GeForce RTX 4060,c04,64,64,64,4,3,8,0.0,0.0,236.52800172567368,257.04448491334915,0.42558722546833916,6,-1,-1,llm8_g6,0,
2026-03-03T03:28:20.483888+00:00,BUCKET,llm_style,eval,llm_style_eval_000,32,1536,1024,bf16,NVIDIA GeForce RTX 4060,c02,32,64,32,2,2,8,0.0,0.0,45.05600035190582,136.30464129149902,2.234181800731943,3,-1,-1,llm8_g3,0,
2026-03-03T03:28:20.584745+00:00,BUCKET,llm_style,eval,llm_style_eval_001,32,2048,8192,bf16,NVIDIA GeForce RTX 4060,c10,64,128,64,8,3,8,0.0,0.0,258.0319941043854,268.2879865169525,4.1612739835883445,2,-1,-1,llm8_g2,0,
2026-03-03T03:28:20.629915+00:00,BUCKET,llm_style,eval,llm_style_eval_002,16,2048,4096,bf16,NVIDIA GeForce RTX 4060,c00,32,32,32,2,2,8,0.0,0.0,95.23200243711472,191.37087658047676,2.81875261603638,7,-1,-1,llm8_g7,0,
2026-03-03T03:28:20.645335+00:00,BUCKET,llm_style,eval,llm_style_eval_003,16,2048,1536,bf16,NVIDIA GeForce RTX 4060,c00,32,32,32,2,2,8,0.0,0.0,50.175998359918594,98.08895960450167,2.0062041472085883,7,-1,-1,llm8_g7,0,
2026-03-03T03:28:20.737849+00:00,BUCKET,llm_style,eval,llm_style_eval_004,64,8192,2048,bf16,NVIDIA GeForce RTX 4060,c11,32,128,32,4,2,8,0.0,0.0,307.1199953556061,394.6211302280425,6.992327691049507,1,-1,-1,llm8_g1,0,
2026-03-03T03:28:20.872543+00:00,BUCKET,llm_style,eval,llm_style_eval_005,64,3072,8192,bf16,NVIDIA GeForce RTX 4060,c10,64,128,64,8,3,8,0.0,0.0,369.6639984846115,404.3388855457306,8.713928013560926,2,-1,-1,llm8_g2,0,
2026-03-03T03:28:20.892760+00:00,BUCKET,llm_style,eval,llm_style_eval_006,32,2048,2048,bf16,NVIDIA GeForce RTX 4060,c02,32,64,32,2,2,8,0.0,0.0,73.72800260782242,131.28704324364648,3.6408887601075395,3,-1,-1,llm8_g3,0,
2026-03-03T03:28:20.982685+00:00,BUCKET,llm_style,eval,llm_style_eval_007,8,8192,2048,bf16,NVIDIA GeForce RTX 4060,c11,32,128,32,4,2,8,0.0,0.0,254.97600436210632,377.53855735063553,1.0527871305833905,5,-1,-1,llm8_g5,0,
2026-03-03T03:28:21.056038+00:00,BUCKET,llm_style,eval,llm_style_eval_008,64,1536,8192,bf16,NVIDIA GeForce RTX 4060,c10,64,128,64,8,3,8,0.0,0.0,259.0720057487488,331.0182324051855,6.216853616990144,2,-1,-1,llm8_g2,0,
2026-03-03T03:28:21.183811+00:00,BUCKET,llm_style,eval,llm_style_eval_009,64,4096,6144,bf16,NVIDIA GeForce RTX 4060,c06,64,128,32,4,3,8,0.0,0.0,388.09600472450256,425.050565302372,8.300073777586679,0,-1,-1,llm8_g0,0,
2026-03-03T03:28:21.230205+00:00,BUCKET,llm_style,eval,llm_style_eval_010,64,2048,4096,bf16,NVIDIA GeForce RTX 4060,c02,32,64,32,2,2,8,0.0,0.0,140.23999869823456,145.4115206003189,7.656459169758371,3,-1,-1,llm8_g3,0,
2026-03-03T03:28:21.328709+00:00,BUCKET,llm_style,eval,llm_style_eval_011,32,3072,6144,bf16,NVIDIA GeForce RTX 4060,c10,64,128,64,8,3,8,0.0,0.0,286.72000765800476,326.48191481828684,4.21302845890279,2,-1,-1,llm8_g2,0,
2026-03-03T03:28:21.343108+00:00,BUCKET,llm_style,eval,llm_style_eval_012,16,1536,1536,bf16,NVIDIA GeForce RTX 4060,c00,32,32,32,2,2,8,0.0,0.0,54.27199974656105,191.10911354422547,1.3910943461187626,7,-1,-1,llm8_g7,0,
2026-03-03T03:28:21.373991+00:00,BUCKET,llm_style,eval,llm_style_eval_013,64,2048,3072,bf16,NVIDIA GeForce RTX 4060,c02,32,64,32,2,2,8,0.0,0.0,141.31200313568115,290.73792040348053,5.698782482240964,3,-1,-1,llm8_g3,0,
2026-03-03T03:28:21.636094+00:00,BUCKET,llm_style,eval,llm_style_eval_014,16,8192,6144,bf16,NVIDIA GeForce RTX 4060,c11,32,128,32,4,2,8,0.0,0.0,689.6640062332153,726.0448068380356,2.3353585535031653,4,-1,-1,llm8_g4,0,
2026-03-03T03:28:21.681974+00:00,BUCKET,llm_style,eval,llm_style_eval_015,64,6144,1536,bf16,NVIDIA GeForce RTX 4060,c11,32,128,32,4,2,8,0.0,0.0,135.16800105571747,238.98976117372501,8.936727202927772,1,-1,-1,llm8_g1,0,
2026-03-03T03:28:21.771641+00:00,BUCKET,llm_style,eval,llm_style_eval_016,16,4096,4096,bf16,NVIDIA GeForce RTX 4060,c11,32,128,32,4,2,8,0.0,0.0,257.02399015426636,347.88351476192474,2.0887968927638583,5,-1,-1,llm8_g5,0,
2026-03-03T03:28:21.948230+00:00,BUCKET,llm_style,eval,llm_style_eval_017,64,8192,4096,bf16,NVIDIA GeForce RTX 4060,c11,32,128,32,4,2,8,0.0,0.0,602.1119952201843,623.0876743793488,7.133170124653284,1,-1,-1,llm8_g1,0,
2026-03-03T03:28:22.086110+00:00,BUCKET,llm_style,eval,llm_style_eval_018,32,4096,6144,bf16,NVIDIA GeForce RTX 4060,c06,64,128,32,4,3,8,0.0,0.0,448.44798743724823,516.9340863823888,3.5915262887100696,0,-1,-1,llm8_g0,0,
2026-03-03T03:28:22.218098+00:00,BUCKET,llm_style,eval,llm_style_eval_019,16,3072,8192,bf16,NVIDIA GeForce RTX 4060,c04,64,64,64,4,3,8,0.0,0.0,393.96800100803375,578.3552092313763,2.0440908041756884,6,-1,-1,llm8_g6,0,
2026-03-03T03:28:22.234995+00:00,BUCKET,llm_style,eval,llm_style_eval_020,4,1536,1536,bf16,NVIDIA GeForce RTX 4060,c00,32,32,32,2,2,8,0.0,0.0,60.416001826524734,148.6233580112457,0.3124067702161895,7,-1,-1,llm8_g7,0,
2026-03-03T03:28:22.282464+00:00,BUCKET,llm_style,eval,llm_style_eval_021,4,6144,1536,bf16,NVIDIA GeForce RTX 4060,c11,32,128,32,4,2,8,0.0,0.0,88.06400001049042,171.73504218459124,0.8573023254792712,5,-1,-1,llm8_g5,0,
2026-03-03T03:28:22.310395+00:00,BUCKET,llm_style,eval,llm_style_eval_022,32,6144,1024,bf16,NVIDIA GeForce RTX 4060,c11,32,128,32,4,2,8,0.0,0.0,69.63200122117996,106.48991845548153,5.782588133881251,1,-1,-1,llm8_g1,0,
2026-03-03T03:28:22.321757+00:00,BUCKET,llm_style,eval,llm_style_eval_023,16,1024,1536,bf16,NVIDIA GeForce RTX 4060,c00,32,32,32,2,2,8,0.0,0.0,69.60000097751617,156.09055951237679,0.7231558519124061,7,-1,-1,llm8_g7,0,
2026-03-03T03:28:22.356743+00:00,BUCKET,llm_style,eval,llm_style_eval_024,32,8192,1024,bf16,NVIDIA GeForce RTX 4060,c11,32,128,32,4,2,8,0.0,0.0,94.60800141096115,153.47711950540526,5.6746882292537135,1,-1,-1,llm8_g1,0,
2026-03-03T03:28:22.547413+00:00,BUCKET,llm_style,eval,llm_style_eval_025,32,6144,6144,bf16,NVIDIA GeForce RTX 4060,c06,64,128,32,4,3,8,0.0,0.0,562.175989151001,621.1276704072952,4.297442705883837,0,-1,-1,llm8_g0,0,
2026-03-03T03:28:22.618136+00:00,BUCKET,llm_style,eval,llm_style_eval_026,1,6144,2048,bf16,NVIDIA GeForce RTX 4060,c11,32,128,32,4,2,8,0.0,0.0,112.64000087976456,203.46624061465246,0.22341818007319428,5,-1,-1,llm8_g5,0,
2026-03-03T03:28:22.688536+00:00,BUCKET,llm_style,eval,llm_style_eval_027,32,4096,3072,bf16,NVIDIA GeForce RTX 4060,c11,32,128,32,4,2,8,0.0,0.0,173.0560064315796,247.54175409674627,4.65344361403827,1,-1,-1,llm8_g1,0,
2026-03-03T03:28:22.704652+00:00,BUCKET,llm_style,eval,llm_style_eval_028,64,1536,1536,bf16,NVIDIA GeForce RTX 4060,c02,32,64,32,2,2,8,0.0,0.0,90.47999978065491,167.09631696343416,3.3376424484095435,3,-1,-1,llm8_g3,0,
2026-03-03T03:28:22.719880+00:00,BUCKET,llm_style,eval,llm_style_eval_029,2,3072,1024,bf16,NVIDIA GeForce RTX 4060,c00,32,32,32,2,2,8,0.0,0.0,54.27199974656105,82.50367812812327,0.23184905768646044,7,-1,-1,llm8_g7,0,
2026-03-03T03:28:22.810199+00:00,BUCKET,llm_style,eval,llm_style_eval_030,32,1536,8192,bf16,NVIDIA GeForce RTX 4060,c10,64,128,64,8,3,8,0.0,0.0,390.1439905166626,542.5049757957458,2.0641260344252474,2,-1,-1,llm8_g2,0,
2026-03-03T03:28:22.837703+00:00,BUCKET,llm_style,eval,llm_style_eval_031,8,3072,2048,bf16,NVIDIA GeForce RTX 4060,c00,32,32,32,2,2,8,0.0,0.0,81.26400038599968,148.9612816274164,1.2387194270753925,7,-1,-1,llm8_g7,0,
2026-03-03T03:28:22.865127+00:00,BUCKET,llm_style,eval,llm_style_eval_032,8,2048,3072,bf16,NVIDIA GeForce RTX 4060,c00,32,32,32,2,2,8,0.0,0.0,106.49599879980087,203.2127963006496,0.9452307798834243,7,-1,-1,llm8_g7,0,
2026-03-03T03:28:22.947211+00:00,BUCKET,llm_style,eval,llm_style_eval_033,64,1536,8192,bf16,NVIDIA GeForce RTX 4060,c10,64,128,64,8,3,8,0.0,0.0,399.77599680423737,520.19202709198,4.028787993463966,2,-1,-1,llm8_g2,0,
2026-03-03T03:28:23.017824+00:00,BUCKET,llm_style,eval,llm_style_eval_034,64,6144,2048,bf16,NVIDIA GeForce RTX 4060,c11,32,128,32,4,2,8,0.0,0.0,229.24800217151642,313.1795102357864,7.0256347743217775,1,-1,-1,llm8_g1,0,
2026-03-03T03:28:23.055029+00:00,BUCKET,llm_style,eval,llm_style_eval_035,4,4096,2048,bf16,NVIDIA GeForce RTX 4060,c11,32,128,32,4,2,8,0.0,0.0,123.90399724245071,230.36767899990082,0.5416198467647809,5,-1,-1,llm8_g5,0,
2026-03-03T03:28:23.244174+00:00,BUCKET,llm_style,eval,llm_style_eval_036,64,8192,4096,bf16,NVIDIA GeForce RTX 4060,c11,32,128,32,4,2,8,0.0,0.0,700.2720236778259,801.8700605630875,6.133284139273262,1,-1,-1,llm8_g1,0,
2026-03-03T03:28:23.278674+00:00,BUCKET,llm_style,eval,llm_style_eval_037,32,6144,1024,bf16,NVIDIA GeForce RTX 4060,c11,32,128,32,4,2,8,0.0,0.0,79.66400310397148,239.818245768547,5.054393054721181,1,-1,-1,llm8_g1,0,
2026-03-03T03:28:23.358285+00:00,BUCKET,llm_style,eval,llm_style_eval_038,64,6144,2048,bf16,NVIDIA GeForce RTX 4060,c11,32,128,32,4,2,8,0.0,0.0,244.73600089550018,345.7100880146026,6.581020896421836,1,-1,-1,llm8_g1,0,
2026-03-03T03:28:23.378546+00:00,BUCKET,llm_style,eval,llm_style_eval_039,8,1024,3072,bf16,NVIDIA GeForce RTX 4060,c00,32,32,32,2,2,8,0.0,0.0,107.51999914646149,188.99968072772026,0.46811428943037175,7,-1,-1,llm8_g7,0,
2026-03-03T03:28:23.466211+00:00,BUCKET,llm_style,eval,llm_style_eval_040,32,8192,2048,bf16,NVIDIA GeForce RTX 4060,c11,32,128,32,4,2,8,0.0,0.0,261.1199915409088,288.99327337741846,4.112062878310029,1,-1,-1,llm8_g1,0,
2026-03-03T03:28:23.483547+00:00,BUCKET,llm_style,eval,llm_style_eval_041,32,3072,1024,bf16,NVIDIA GeForce RTX 4060,c02,32,64,32,2,2,8,0.0,0.0,72.7040022611618,154.29632358252988,2.7691266744409737,3,-1,-1,llm8_g3,0,
2026-03-03T03:28:23.512298+00:00,BUCKET,llm_style,eval,llm_style_eval_042,64,1024,4096,bf16,NVIDIA GeForce RTX 4060,c02,32,64,32,2,2,8,0.0,0.0,204.54399287700653,300.0246328115463,2.6247209925290913,3,-1,-1,llm8_g3,0,
2026-03-03T03:28:23.523857+00:00,BUCKET,llm_style,eval,llm_style_eval_043,2,1536,1024,bf16,NVIDIA GeForce RTX 4060,c00,32,32,32,2,2,8,0.0,0.0,67.53600016236305,156.30623996257776,0.09315707155997888,7,-1,-1,llm8_g7,0,
2026-03-03T03:28:23.637633+00:00,BUCKET,llm_style,eval,llm_style_eval_044,64,6144,3072,bf16,NVIDIA GeForce RTX 4060,c11,32,128,32,4,2,8,0.0,0.0,370.6879913806915,435.4854303598403,6.517392416737028,1,-1,-1,llm8_g1,0,
2026-03-03T03:28:23.694227+00:00,BUCKET,llm_style,eval,llm_style_eval_045,64,1536,6144,bf16,NVIDIA GeForce RTX 4060,c10,64,128,64,8,3,8,0.0,0.0,354.3039858341217,426.7315191030502,3.409387419552044,2,-1,-1,llm8_g2,0,
2026-03-03T03:28:23.791517+00:00,BUCKET,llm_style,eval,llm_style_eval_046,2,6144,3072,bf16,NVIDIA GeForce RTX 4060,c11,32,128,32,4,2,8,0.0,0.0,281.5999984741211,304.20640140771866,0.26810181963455576,5,-1,-1,llm8_g5,0,
2026-03-03T03:28:23.962145+00:00,BUCKET,llm_style,eval,llm_style_eval_047,16,4096,8192,bf16,NVIDIA GeForce RTX 4060,c11,32,128,32,4,2,8,0.0,0.0,502.78401374816895,520.6819242238998,2.135592609628612,4,-1,-1,llm8_g4,0,
2026-03-03T03:28:24.006010+00:00,BUCKET,llm_style,eval,llm_style_eval_048,16,1024,6144,bf16,NVIDIA GeForce RTX 4060,c04,64,64,64,4,3,8,0.0,0.0,221.0879996418953,287.05599933862675,0.9106174569677974,6,-1,-1,llm8_g6,0,
2026-03-03T03:28:24.071106+00:00,BUCKET,llm_style,eval,llm_style_eval_049,16,8192,1536,bf16,NVIDIA GeForce RTX 4060,c11,32,128,32,4,2,8,0.0,0.0,154.62400019168854,206.3097584247589,2.6040794669703784,5,-1,-1,llm8_g5,0,
2026-03-03T03:28:24.082469+00:00,BUCKET,llm_style,eval,llm_style_eval_050,1,1024,1024,bf16,NVIDIA GeForce RTX 4060,c00,32,32,32,2,2,8,0.0,0.0,83.8559977710247,231.16799980401987,0.025008968419008452,7,-1,-1,llm8_g7,0,
2026-03-03T03:28:24.108284+00:00,BUCKET,llm_style,eval,llm_style_eval_051,16,6144,1024,bf16,NVIDIA GeForce RTX 4060,c11,32,128,32,4,2,8,0.0,0.0,81.40799775719643,142.2028796374797,2.473056671906696,5,-1,-1,llm8_g5,0,
2026-03-03T03:28:24.458860+00:00,BUCKET,llm_style,eval,llm_style_eval_052,16,8192,8192,bf16,NVIDIA GeForce RTX 4060,c11,32,128,32,4,2,8,0.0,0.0,919.0400242805481,963.6886405944824,2.336659548294552,4,-1,-1,llm8_g4,0,
2026-03-03T03:28:24.712428+00:00,BUCKET,llm_style,eval,llm_style_eval_053,1,6144,8192,bf16,NVIDIA GeForce RTX 4060,c11,32,128,32,4,2,8,0.0,0.0,698.2240080833435,774.3408149480817,0.14417048803051805,4,-1,-1,llm8_g4,0,
2026-03-03T03:28:24.793582+00:00,BUCKET,llm_style,eval,llm_style_eval_054,64,4096,3072,bf16,NVIDIA GeForce RTX 4060,c11,32,128,32,4,2,8,0.0,0.0,370.6879913806915,472.3302432894706,4.344928277824685,1,-1,-1,llm8_g1,0,
2026-03-03T03:28:24.834846+00:00,BUCKET,llm_style,eval,llm_style_eval_055,4,8192,1024,bf16,NVIDIA GeForce RTX 4060,c11,32,128,32,4,2,8,0.0,0.0,156.15999698638916,283.28384563326824,0.42974427058838366,5,-1,-1,llm8_g5,0,
2026-03-03T03:28:24.863792+00:00,BUCKET,llm_style,eval,llm_style_eval_056,64,1024,3072,bf16,NVIDIA GeForce RTX 4060,c02,32,64,32,2,2,8,0.0,0.0,206.30399882793427,301.54751777648914,1.9517468700925609,3,-1,-1,llm8_g3,0,
2026-03-03T03:28:24.877788+00:00,BUCKET,llm_style,eval,llm_style_eval_057,64,1024,3072,bf16,NVIDIA GeForce RTX 4060,c02,32,64,32,2,2,8,0.0,0.0,200.55999606847763,270.87871104478836,2.007644554712303,3,-1,-1,llm8_g3,0,
2026-03-03T03:28:24.934954+00:00,BUCKET,llm_style,eval,llm_style_eval_058,32,2048,4096,bf16,NVIDIA GeForce RTX 4060,c02,32,64,32,2,2,8,0.0,0.0,228.86399924755096,342.86592036485666,2.345807613976426,3,-1,-1,llm8_g3,0,
2026-03-03T03:28:25.036367+00:00,BUCKET,llm_style,eval,llm_style_eval_059,64,8192,2048,bf16,NVIDIA GeForce RTX 4060,c11,32,128,32,4,2,8,0.0,0.0,445.44000923633575,498.2067134976387,4.82103898049404,1,-1,-1,llm8_g1,0,
2026-03-03T03:28:25.152438+00:00,BUCKET,llm_style,eval,llm_style_eval_060,1,3072,6144,bf16,NVIDIA GeForce RTX 4060,c04,64,64,64,4,3,8,0.0,0.0,457.72799849510193,514.8876753449439,0.08246979892885872,6,-1,-1,llm8_g6,0,
2026-03-03T03:28:25.194346+00:00,BUCKET,llm_style,eval,llm_style_eval_061,64,1536,4096,bf16,NVIDIA GeForce RTX 4060,c02,32,64,32,2,2,8,0.0,0.0,253.4400075674057,314.45824205875397,3.177502935426713,3,-1,-1,llm8_g3,0,
2026-03-03T03:28:25.264745+00:00,BUCKET,llm_style,eval,llm_style_eval_062,16,6144,2048,bf16,NVIDIA GeForce RTX 4060,c11,32,128,32,4,2,8,0.0,0.0,163.84000331163406,227.4508824944496,2.4575999503254904,5,-1,-1,llm8_g5,0,
2026-03-03T03:28:25.328648+00:00,BUCKET,llm_style,eval,llm_style_eval_063,64,1536,6144,bf16,NVIDIA GeForce RTX 4060,c10,64,128,64,8,3,8,0.0,0.0,433.1519901752472,504.9692752957342,2.7887660207015936,2,-1,-1,llm8_g2,0,
2026-03-03T03:28:25.397321+00:00,BUCKET,llm_style,eval,llm_style_eval_064,1,6144,2048,bf16,NVIDIA GeForce RTX 4060,c11,32,128,32,4,2,8,0.0,0.0,163.83999586105347,262.86496669054026,0.1536000038802625,5,-1,-1,llm8_g5,0,
2026-03-03T03:28:25.459754+00:00,BUCKET,llm_style,eval,llm_style_eval_065,8,1536,6144,bf16,NVIDIA GeForce RTX 4060,c04,64,64,64,4,3,8,0.0,0.0,253.90399992465973,266.2809458374977,0.5946930495179452,6,-1,-1,llm8_g6,0,
2026-03-03T03:28:25.496835+00:00,BUCKET,llm_style,eval,llm_style_eval_066,64,1536,4096,bf16,NVIDIA GeForce RTX 4060,c02,32,64,32,2,2,8,0.0,0.0,238.0319982767105,304.81439083814615,3.383185344114269,3,-1,-1,llm8_g3,0,
2026-03-03T03:28:25.602710+00:00,BUCKET,llm_style,eval,llm_style_eval_067,64,8192,2048,bf16,NVIDIA GeForce RTX 4060,c11,32,128,32,4,2,8,0.0,0.0,485.8879894018173,515.6351923942566,4.419709263947425,1,-1,-1,llm8_g1,0,
2026-03-03T03:28:25.635542+00:00,BUCKET,llm_style,eval,llm_style_eval_068,64,1024,4096,bf16,NVIDIA GeForce RTX 4060,c02,32,64,32,2,2,8,0.0,0.0,252.9279887676239,285.05023926496494,2.1226235760457772,3,-1,-1,llm8_g3,0,
2026-03-03T03:28:25.684369+00:00,BUCKET,llm_style,eval,llm_style_eval_069,64,2048,4096,bf16,NVIDIA GeForce RTX 4060,c02,32,64,32,2,2,8,0.0,0.0,285.69599986076355,339.4662320613861,3.7583369193943823,3,-1,-1,llm8_g3,0,
2026-03-03T03:28:25.737393+00:00,BUCKET,llm_style,eval,llm_style_eval_070,64,8192,1024,bf16,NVIDIA GeForce RTX 4060,c11,32,128,32,4,2,8,0.0,0.0,236.54399812221527,322.32447355985636,4.539290079324817,1,-1,-1,llm8_g1,0,
2026-03-03T03:28:25.812028+00:00,BUCKET,llm_style,eval,llm_style_eval_071,64,6144,2048,bf16,NVIDIA GeForce RTX 4060,c11,32,128,32,4,2,8,0.0,0.0,309.2480003833771,371.14495813846577,5.208158933940757,1,-1,-1,llm8_g1,0,
2026-03-03T03:28:25.825310+00:00,BUCKET,llm_style,eval,llm_style_eval_072,64,1536,1024,bf16,NVIDIA GeForce RTX 4060,c02,32,64,32,2,2,8,0.0,0.0,91.13600105047226,137.13856384158123,2.2090786262226145,3,-1,-1,llm8_g3,0,
2026-03-03T03:28:25.856819+00:00,BUCKET,llm_style,eval,llm_style_eval_073,1,4096,1536,bf16,NVIDIA GeForce RTX 4060,c11,32,128,32,4,2,8,0.0,0.0,154.62400019168854,264.3417555093764,0.08137748334282432,5,-1,-1,llm8_g5,0,
2026-03-03T03:28:25.873603+00:00,BUCKET,llm_style,eval,llm_style_eval_074,8,1024,2048,bf16,NVIDIA GeForce RTX 4060,c00,32,32,32,2,2,8,0.0,0.0,129.7760009765625,200.2451157569885,0.2585565262259847,7,-1,-1,llm8_g7,0,
2026-03-03T03:28:25.900852+00:00,BUCKET,llm_style,eval,llm_style_eval_075,2,6144,1024,bf16,NVIDIA GeForce RTX 4060,c11,32,128,32,4,2,8,0.0,0.0,94.2080020904541,104.99071829020977,0.26713042885504523,5,-1,-1,llm8_g5,0,
2026-03-03T03:28:25.951311+00:00,BUCKET,llm_style,eval,llm_style_eval_076,64,1024,6144,bf16,NVIDIA GeForce RTX 4060,c10,64,128,64,8,3,8,0.0,0.0,436.2240135669708,503.26559841632843,1.8460844496273157,2,-1,-1,llm8_g2,0,
2026-03-03T03:28:26.128302+00:00,BUCKET,llm_style,eval,llm_style_eval_077,1,4096,8192,bf16,NVIDIA GeForce RTX 4060,c11,32,128,32,4,2,8,0.0,0.0,541.0400032997131,567.2268772125244,0.12403678765103168,4,-1,-1,llm8_g4,0,
2026-03-03T03:28:26.239346+00:00,BUCKET,llm_style,eval,llm_style_eval_078,64,6144,3072,bf16,NVIDIA GeForce RTX 4060,c11,32,128,32,4,2,8,0.0,0.0,452.4320065975189,578.9798307418821,5.339850118405059,1,-1,-1,llm8_g1,0,
2026-03-03T03:28:26.303660+00:00,BUCKET,llm_style,eval,llm_style_eval_079,2,3072,4096,bf16,NVIDIA GeForce RTX 4060,c00,32,32,32,2,2,8,0.0,0.0,183.24799835681915,229.2633593082427,0.27466410793745527,7,-1,-1,llm8_g7,0,
2026-03-03T03:28:26.315164+00:00,BUCKET,llm_style,eval,llm_style_eval_080,4,1536,1024,bf16,NVIDIA GeForce RTX 4060,c00,32,32,32,2,2,8,0.0,0.0,69.63200122117996,130.48576220870018,0.18070587918378908,7,-1,-1,llm8_g7,0,
2026-03-03T03:28:26.446340+00:00,BUCKET,llm_style,eval,llm_style_eval_081,4,4096,6144,bf16,NVIDIA GeForce RTX 4060,c11,32,128,32,4,2,8,0.0,0.0,431.10400438308716,515.7376140356062,0.4670023705488418,4,-1,-1,llm8_g4,0,
2026-03-03T03:28:26.480345+00:00,BUCKET,llm_style,eval,llm_style_eval_082,64,6144,1024,bf16,NVIDIA GeForce RTX 4060,c11,32,128,32,4,2,8,0.0,0.0,169.3279966711998,261.1711950600146,4.755896153214047,1,-1,-1,llm8_g1,0,
2026-03-03T03:28:26.571546+00:00,BUCKET,llm_style,eval,llm_style_eval_083,8,4096,4096,bf16,NVIDIA GeForce RTX 4060,c11,32,128,32,4,2,8,0.0,0.0,302.0800054073334,422.05183386802673,0.8886237129068967,5,-1,-1,llm8_g5,0,
2026-03-03T03:28:26.635519+00:00,BUCKET,llm_style,eval,llm_style_eval_084,64,1024,8192,bf16,NVIDIA GeForce RTX 4060,c10,64,128,64,8,3,8,0.0,0.0,565.2480125427246,651.9090980291364,1.899594160746988,2,-1,-1,llm8_g2,0,
2026-03-03T03:28:26.803307+00:00,BUCKET,llm_style,eval,llm_style_eval_085,1,3072,8192,bf16,NVIDIA GeForce RTX 4060,c04,64,64,64,4,3,8,0.0,0.0,676.7520010471344,738.1913453340529,0.07437236671945135,6,-1,-1,llm8_g6,0,
2026-03-03T03:28:26.819048+00:00,BUCKET,llm_style,eval,llm_style_eval_086,8,1536,1024,bf16,NVIDIA GeForce RTX 4060,c00,32,32,32,2,2,8,0.0,0.0,93.6960019171238,106.0556786507368,0.2685901584387745,7,-1,-1,llm8_g7,0,
2026-03-03T03:28:26.843902+00:00,BUCKET,llm_style,eval,llm_style_eval_087,16,1024,3072,bf16,NVIDIA GeForce RTX 4060,c00,32,32,32,2,2,8,0.0,0.0,173.44000190496445,293.9683327078819,0.5803926135515031,7,-1,-1,llm8_g7,0,
2026-03-03T03:28:26.876429+00:00,BUCKET,llm_style,eval,llm_style_eval_088,8,4096,1536,bf16,NVIDIA GeForce RTX 4060,c11,32,128,32,4,2,8,0.0,0.0,144.384004175663,189.11232411861408,0.6971914691985496,5,-1,-1,llm8_g5,0,
2026-03-03T03:28:26.978277+00:00,BUCKET,llm_style,eval,llm_style_eval_089,16,6144,3072,bf16,NVIDIA GeForce RTX 4060,c11,32,128,32,4,2,8,0.0,0.0,291.6800081729889,425.57247817516327,2.0706930851489593,5,-1,-1,llm8_g5,0,
2026-03-03T03:28:27.008392+00:00,BUCKET,llm_style,eval,llm_style_eval_090,32,1536,3072,bf16,NVIDIA GeForce RTX 4060,c02,32,64,32,2,2,8,0.0,0.0,202.67199724912643,252.77887895703307,1.490042492790906,3,-1,-1,llm8_g3,0,
2026-03-03T03:28:27.036009+00:00,BUCKET,llm_style,eval,llm_style_eval_091,16,1024,4096,bf16,NVIDIA GeForce RTX 4060,c00,32,32,32,2,2,8,0.0,0.0,198.512002825737,296.98047637939453,0.6761189554760701,7,-1,-1,llm8_g7,0,
2026-03-03T03:28:27.180358+00:00,BUCKET,llm_style,eval,llm_style_eval_092,1,4096,6144,bf16,NVIDIA GeForce RTX 4060,c11,32,128,32,4,2,8,0.0,0.0,501.76000595092773,641.9584006071091,0.10031020289194283,4,-1,-1,llm8_g4,0,
2026-03-03T03:28:27.217958+00:00,BUCKET,llm_style,eval,llm_style_eval_093,32,2048,3072,bf16,NVIDIA GeForce RTX 4060,c02,32,64,32,2,2,8,0.0,0.0,232.35199600458145,418.5318502783774,1.7329448032461083,3,-1,-1,llm8_g3,0,
2026-03-03T03:28:27.239017+00:00,BUCKET,llm_style,eval,llm_style_eval_094,32,1024,2048,bf16,NVIDIA GeForce RTX 4060,c02,32,64,32,2,2,8,0.0,0.0,156.5600037574768,229.9391995370388,0.8572925701248278,3,-1,-1,llm8_g3,0,
2026-03-03T03:28:27.306030+00:00,BUCKET,llm_style,eval,llm_style_eval_095,8,6144,2048,bf16,NVIDIA GeForce RTX 4060,c11,32,128,32,4,2,8,0.0,0.0,196.56000286340714,212.97983691096306,1.0242500461291977,5,-1,-1,llm8_g5,0,
2026-03-03T03:28:27.345893+00:00,BUCKET,llm_style,eval,llm_style_eval_096,64,2048,3072,bf16,NVIDIA GeForce RTX 4060,c02,32,64,32,2,2,8,0.0,0.0,261.6319954395294,457.7827250957488,3.0780117953353647,3,-1,-1,llm8_g3,0,
2026-03-03T03:28:27.382617+00:00,BUCKET,llm_style,eval,llm_style_eval_097,64,6144,1024,bf16,NVIDIA GeForce RTX 4060,c11,32,128,32,4,2,8,0.0,0.0,207.2639986872673,271.33344560861565,3.8854136420242273,1,-1,-1,llm8_g1,0,
2026-03-03T03:28:27.411641+00:00,BUCKET,llm_style,eval,llm_style_eval_098,32,6144,1024,bf16,NVIDIA GeForce RTX 4060,c11,32,128,32,4,2,8,0.0,0.0,119.80800330638885,224.86048087477678,3.3608204200706195,1,-1,-1,llm8_g1,0,
2026-03-03T03:28:27.434206+00:00,BUCKET,llm_style,eval,llm_style_eval_099,1,2048,2048,bf16,NVIDIA GeForce RTX 4060,c00,32,32,32,2,2,8,0.0,0.0,118.78400295972824,138.76223862171173,0.07062068789552428,7,-1,-1,llm8_g7,0,
2026-03-03T03:28:27.483401+00:00,BUCKET,llm_style,eval,llm_style_eval_100,64,8192,1024,bf16,NVIDIA GeForce RTX 4060,c11,32,128,32,4,2,8,0.0,0.0,291.83998703956604,309.8768001794815,3.679214198479347,1,-1,-1,llm8_g1,0,
2026-03-03T03:28:27.562401+00:00,BUCKET,llm_style,eval,llm_style_eval_101,64,8192,1536,bf16,NVIDIA GeForce RTX 4060,c11,32,128,32,4,2,8,0.0,0.0,422.91200160980225,464.0460768342017,3.8083873947044524,1,-1,-1,llm8_g1,0,
2026-03-03T03:28:27.598847+00:00,BUCKET,llm_style,eval,llm_style_eval_102,32,3072,2048,bf16,NVIDIA GeForce RTX 4060,c02,32,64,32,2,2,8,0.0,0.0,172.38400131464005,294.777591228485,2.335792074260222,3,-1,-1,llm8_g3,0,
2026-03-03T03:28:27.637922+00:00,BUCKET,llm_style,eval,llm_style_eval_103,64,2048,3072,bf16,NVIDIA GeForce RTX 4060,c02,32,64,32,2,2,8,0.0,0.0,281.5999984741211,374.783992767334,2.8597527427685954,3,-1,-1,llm8_g3,0,
2026-03-03T03:28:27.704315+00:00,BUCKET,llm_style,eval,llm_style_eval_104,16,6144,2048,bf16,NVIDIA GeForce RTX 4060,c11,32,128,32,4,2,8,0.0,0.0,202.54399627447128,211.48672074079514,1.9879788658576525,5,-1,-1,llm8_g5,0,
2026-03-03T03:28:27.759044+00:00,BUCKET,llm_style,eval,llm_style_eval_105,1,1024,8192,bf16,NVIDIA GeForce RTX 4060,c04,64,64,64,4,3,8,0.0,0.0,428.0320107936859,545.3491282463074,0.03919617126039371,6,-1,-1,llm8_g6,0,
2026-03-03T03:28:27.987513+00:00,BUCKET,llm_style,eval,llm_style_eval_106,32,4096,8192,bf16,NVIDIA GeForce RTX 4060,c06,64,128,32,4,3,8,0.0,0.0,1415.168046951294,1520.343050956726,1.517476071217364,0,-1,-1,llm8_g0,0,
2026-03-03T03:28:28.052874+00:00,BUCKET,llm_style,eval,llm_style_eval_107,64,6144,1536,bf16,NVIDIA GeForce RTX 4060,c11,32,128,32,4,2,8,0.0,0.0,284.67199206352234,385.8617523312568,4.243338247798024,1,-1,-1,llm8_g1,0,
2026-03-03T03:28:28.076703+00:00,BUCKET,llm_style,eval,llm_style_eval_108,8,3072,1536,bf16,NVIDIA GeForce RTX 4060,c00,32,32,32,2,2,8,0.0,0.0,104.87999767065048,227.8857661783694,0.7198462402438358,7,-1,-1,llm8_g7,0,
2026-03-03T03:28:28.089852+00:00,BUCKET,llm_style,eval,llm_style_eval_109,16,2048,1024,bf16,NVIDIA GeForce RTX 4060,c00,32,32,32,2,2,8,0.0,0.0,76.80000364780426,137.18528158962715,0.8738132918294289,7,-1,-1,llm8_g7,0,
2026-03-03T03:28:28.447220+00:00,BUCKET,llm_style,eval,llm_style_eval_110,1,8192,8192,bf16,NVIDIA GeForce RTX 4060,c11,32,128,32,4,2,8,0.0,0.0,1066.4799809455872,1116.282855272293,0.12585114619872825,4,-1,-1,llm8_g4,0,
2026-03-03T03:28:28.505577+00:00,BUCKET,llm_style,eval,llm_style_eval_111,8,6144,1536,bf16,NVIDIA GeForce RTX 4060,c11,32,128,32,4,2,8,0.0,0.0,156.67200088500977,291.4406375586984,0.9637647004382329,5,-1,-1,llm8_g5,0,
2026-03-03T03:28:28.606777+00:00,BUCKET,llm_style,eval,llm_style_eval_112,2,6144,3072,bf16,NVIDIA GeForce RTX 4060,c11,32,128,32,4,2,8,0.0,0.0,296.9599962234497,390.09280174970615,0.2542344859918148,5,-1,-1,llm8_g5,0,
2026-03-03T03:28:28.974886+00:00,BUCKET,llm_style,eval,llm_style_eval_113,1,8192,8192,bf16,NVIDIA GeForce RTX 4060,c11,32,128,32,4,2,8,0.0,0.0,1070.032000541687,1200.1689195632935,0.12543337762987872,4,-1,-1,llm8_g4,0,
2026-03-03T03:28:29.002270+00:00,BUCKET,llm_style,eval,llm_style_eval_114,1,3072,1024,bf16,NVIDIA GeForce RTX 4060,c00,32,32,32,2,2,8,0.0,0.0,83.96799862384796,229.11424532532683,0.07492683049626894,7,-1,-1,llm8_g7,0,
2026-03-03T03:28:29.029824+00:00,BUCKET,llm_style,eval,llm_style_eval_115,16,3072,1536,bf16,NVIDIA GeForce RTX 4060,c00,32,32,32,2,2,8,0.0,0.0,105.87199777364731,118.84543918073176,1.4262028409327352,7,-1,-1,llm8_g7,0,
2026-03-03T03:28:29.046876+00:00,BUCKET,llm_style,eval,llm_style_eval_116,8,3072,1024,bf16,NVIDIA GeForce RTX 4060,c00,32,32,32,2,2,8,0.0,0.0,100.23999959230423,179.70112085342396,0.5021114146519223,7,-1,-1,llm8_g7,0,
2026-03-03T03:28:29.073949+00:00,BUCKET,llm_style,eval,llm_style_eval_117,4,1024,4096,bf16,NVIDIA GeForce RTX 4060,c00,32,32,32,2,2,8,0.0,0.0,209.4080001115799,265.4351964592933,0.1602347187410272,7,-1,-1,llm8_g7,0,
2026-03-03T03:28:29.191739+00:00,BUCKET,llm_style,eval,llm_style_eval_118,64,6144,3072,bf16,NVIDIA GeForce RTX 4060,c11,32,128,32,4,2,8,0.0,0.0,546.2239980697632,607.6108807325361,4.422945737531365,1,-1,-1,llm8_g1,0,
2026-03-03T03:28:29.493977+00:00,BUCKET,llm_style,eval,llm_style_eval_119,64,8192,6144,bf16,NVIDIA GeForce RTX 4060,c06,64,128,32,4,3,8,0.0,0.0,1403.9039611816406,1539.3177378177643,4.58895417502598,0,-1,-1,llm8_g0,0,
2026-03-03T03:28:29.528692+00:00,BUCKET,llm_style,eval,llm_style_eval_120,8,1024,4096,bf16,NVIDIA GeForce RTX 4060,c00,32,32,32,2,2,8,0.0,0.0,201.48800313472748,362.5676795840262,0.33306630149650557,7,-1,-1,llm8_g7,0,
2026-03-03T03:28:29.544442+00:00,BUCKET,llm_style,eval,llm_style_eval_121,4,1024,2048,bf16,NVIDIA GeForce RTX 4060,c00,32,32,32,2,2,8,0.0,0.0,115.7120019197464,202.78687745332718,0.14499114803696905,7,-1,-1,llm8_g7,0,
2026-03-03T03:28:29.672440+00:00,BUCKET,llm_style,eval,llm_style_eval_122,4,6144,4096,bf16,NVIDIA GeForce RTX 4060,c11,32,128,32,4,2,8,0.0,0.0,369.53601241111755,475.4432117938995,0.5448091261428112,5,-1,-1,llm8_g5,0,
2026-03-03T03:28:29.818610+00:00,BUCKET,llm_style,eval,llm_style_eval_123,4,3072,8192,bf16,NVIDIA GeForce RTX 4060,c04,64,64,64,4,3,8,0.0,0.0,581.0399949550629,699.7606307268143,0.3464935180848788,6,-1,-1,llm8_g6,0,
2026-03-03T03:28:29.853427+00:00,BUCKET,llm_style,eval,llm_style_eval_124,64,6144,1024,bf16,NVIDIA GeForce RTX 4060,c11,32,128,32,4,2,8,0.0,0.0,152.0640030503273,281.0825654864311,5.295838277606533,1,-1,-1,llm8_g1,0,
2026-03-03T03:28:29.946520+00:00,BUCKET,llm_style,eval,llm_style_eval_125,64,1536,8192,bf16,NVIDIA GeForce RTX 4060,c10,64,128,64,8,3,8,0.0,0.0,587.5999927520752,705.7251244783401,2.741001967097645,2,-1,-1,llm8_g2,0,
2026-03-03T03:28:30.056514+00:00,BUCKET,llm_style,eval,llm_style_eval_126,64,2048,8192,bf16,NVIDIA GeForce RTX 4060,c10,64,128,64,8,3,8,0.0,0.0,586.463987827301,726.1881667375565,3.661748534561989,2,-1,-1,llm8_g2,0,
2026-03-03T03:28:30.125663+00:00,BUCKET,llm_style,eval,llm_style_eval_127,2,8192,1536,bf16,NVIDIA GeForce RTX 4060,c11,32,128,32,4,2,8,0.0,0.0,213.96800130605698,333.44512462615967,0.23522978993483368,5,-1,-1,llm8_g5,0,
2026-03-03T03:28:30.147736+00:00,BUCKET,llm_style,eval,llm_style_eval_128,8,2048,2048,bf16,NVIDIA GeForce RTX 4060,c00,32,32,32,2,2,8,0.0,0.0,104.27199676632881,260.157438367605,0.6435943118111515,7,-1,-1,llm8_g7,0,
2026-03-03T03:28:30.439627+00:00,BUCKET,llm_style,eval,llm_style_eval_129,64,8192,6144,bf16,NVIDIA GeForce RTX 4060,c06,64,128,32,4,3,8,0.0,0.0,1199.1040110588074,1316.3827300071716,5.372720701944216,0,-1,-1,llm8_g0,0,
2026-03-03T03:28:30.469378+00:00,BUCKET,llm_style,eval,llm_style_eval_130,16,3072,1536,bf16,NVIDIA GeForce RTX 4060,c00,32,32,32,2,2,8,0.0,0.0,114.08000066876411,203.46496120095236,1.32358821103464,7,-1,-1,llm8_g7,0,
2026-03-03T03:28:30.851450+00:00,BUCKET,llm_style,eval,llm_style_eval_131,32,8192,8192,bf16,NVIDIA GeForce RTX 4060,c06,64,128,32,4,3,8,0.0,0.0,1562.0319843292236,1713.7971150875092,2.749602658004707,0,-1,-1,llm8_g0,0,
2026-03-03T03:28:31.049000+00:00,BUCKET,llm_style,eval,llm_style_eval_132,32,8192,4096,bf16,NVIDIA GeForce RTX 4060,c11,32,128,32,4,2,8,0.0,0.0,489.47200179100037,583.925763964653,4.387347264281224,1,-1,-1,llm8_g1,0,
2026-03-03T03:28:31.411829+00:00,BUCKET,llm_style,eval,llm_style_eval_133,2,8192,8192,bf16,NVIDIA GeForce RTX 4060,c11,32,128,32,4,2,8,0.0,0.0,922.6239919662476,1025.7715213298798,0.29094783827149834,4,-1,-1,llm8_g4,0,
2026-03-03T03:28:31.479549+00:00,BUCKET,llm_style,eval,llm_style_eval_134,64,3072,3072,bf16,NVIDIA GeForce RTX 4060,c02,32,64,32,2,2,8,0.0,0.0,276.38399600982666,358.8915219902991,4.370584293734041,3,-1,-1,llm8_g3,0,
2026-03-03T03:28:31.531888+00:00,BUCKET,llm_style,eval,llm_style_eval_135,8,3072,3072,bf16,NVIDIA GeForce RTX 4060,c00,32,32,32,2,2,8,0.0,0.0,166.9120043516159,289.8047924041746,0.9046380132247102,7,-1,-1,llm8_g7,0,
2026-03-03T03:28:31.586963+00:00,BUCKET,llm_style,eval,llm_style_eval_136,4,2048,4096,bf16,NVIDIA GeForce RTX 4060,c00,32,32,32,2,2,8,0.0,0.0,209.647998213768,319.0169709920882,0.3201025746574137,7,-1,-1,llm8_g7,0,
2026-03-03T03:28:31.945599+00:00,BUCKET,llm_style,eval,llm_style_eval_137,4,8192,8192,bf16,NVIDIA GeForce RTX 4060,c11,32,128,32,4,2,8,0.0,0.0,1220.080018043518,1246.1814105510712,0.440029263704285,4,-1,-1,llm8_g4,0,
2026-03-03T03:28:31.963655+00:00,BUCKET,llm_style,eval,llm_style_eval_138,16,1024,1024,bf16,NVIDIA GeForce RTX 4060,c00,32,32,32,2,2,8,0.0,0.0,82.94399827718735,170.13087362051004,0.4045432182792266,7,-1,-1,llm8_g7,0,
2026-03-03T03:28:31.974315+00:00,BUCKET,llm_style,eval,llm_style_eval_139,4,1024,1024,bf16,NVIDIA GeForce RTX 4060,c00,32,32,32,2,2,8,0.0,0.0,90.11200070381165,121.040319353342,0.09309090836383095,7,-1,-1,llm8_g7,0,
2026-03-03T03:28:32.146461+00:00,BUCKET,llm_style,eval,llm_style_eval_140,64,4096,6144,bf16,NVIDIA GeForce RTX 4060,c06,64,128,32,4,3,8,0.0,0.0,934.4000220298767,1052.672028541565,3.4473730694079583,0,-1,-1,llm8_g0,0,
2026-03-03T03:28:32.285507+00:00,BUCKET,llm_style,eval,llm_style_eval_141,4,6144,4096,bf16,NVIDIA GeForce RTX 4060,c11,32,128,32,4,2,8,0.0,0.0,396.2880074977875,428.677119910717,0.5080309981399678,5,-1,-1,llm8_g5,0,
2026-03-03T03:28:32.379680+00:00,BUCKET,llm_style,eval,llm_style_eval_142,4,2048,6144,bf16,NVIDIA GeForce RTX 4060,c04,64,64,64,4,3,8,0.0,0.0,535.4560017585754,635.525130033493,0.1879954574594286,6,-1,-1,llm8_g6,0,
2026-03-03T03:28:32.483932+00:00,BUCKET,llm_style,eval,llm_style_eval_143,64,1536,8192,bf16,NVIDIA GeForce RTX 4060,c10,64,128,64,8,3,8,0.0,0.0,649.2159962654114,793.7843126058578,2.480858058435073,2,-1,-1,llm8_g2,0,
2026-03-03T03:28:32.543369+00:00,BUCKET,llm_style,eval,llm_style_eval_144,1,3072,3072,bf16,NVIDIA GeForce RTX 4060,c00,32,32,32,2,2,8,0.0,0.0,166.9120043516159,178.82111713290212,0.11307975165308877,7,-1,-1,llm8_g7,0,
2026-03-03T03:28:32.563914+00:00,BUCKET,llm_style,eval,llm_style_eval_145,32,1024,2048,bf16,NVIDIA GeForce RTX 4060,c02,32,64,32,2,2,8,0.0,0.0,152.5759994983673,204.41088199615467,0.8796778552411597,3,-1,-1,llm8_g3,0,
2026-03-03T03:28:32.770421+00:00,BUCKET,llm_style,eval,llm_style_eval_146,64,8192,4096,bf16,NVIDIA GeForce RTX 4060,c11,32,128,32,4,2,8,0.0,0.0,990.5600249767303,1166.4588797092438,4.335898065441208,1,-1,-1,llm8_g1,0,
2026-03-03T03:28:32.833789+00:00,BUCKET,llm_style,eval,llm_style_eval_147,64,2048,4096,bf16,NVIDIA GeForce RTX 4060,c02,32,64,32,2,2,8,0.0,0.0,343.03998947143555,458.32191824913014,3.130077708008468,3,-1,-1,llm8_g3,0,
2026-03-03T03:28:32.890958+00:00,BUCKET,llm_style,eval,llm_style_eval_148,64,1024,6144,bf16,NVIDIA GeForce RTX 4060,c10,64,128,64,8,3,8,0.0,0.0,510.46401262283325,636.467188000679,1.5775967513600553,2,-1,-1,llm8_g2,0,
2026-03-03T03:28:33.118715+00:00,BUCKET,llm_style,eval,llm_style_eval_149,64,4096,8192,bf16,NVIDIA GeForce RTX 4060,c06,64,128,32,4,3,8,0.0,0.0,1220.6079959869385,1382.0457458496094,3.518711420964639,0,-1,-1,llm8_g0,0,
2026-03-03T03:28:33.158143+00:00,BUCKET,llm_style,eval,llm_style_eval_150,2,2048,3072,bf16,NVIDIA GeForce RTX 4060,c00,32,32,32,2,2,8,0.0,0.0,161.75999492406845,250.92095538973808,0.1555750790658287,7,-1,-1,llm8_g7,0,
2026-03-03T03:28:33.211127+00:00,BUCKET,llm_style,eval,llm_style_eval_151,64,4096,2048,bf16,NVIDIA GeForce RTX 4060,c11,32,128,32,4,2,8,0.0,0.0,297.92000353336334,317.26912170648575,3.6041279916262963,1,-1,-1,llm8_g1,0,
2026-03-03T03:28:33.562169+00:00,BUCKET,llm_style,eval,llm_style_eval_152,8,8192,8192,bf16,NVIDIA GeForce RTX 4060,c11,32,128,32,4,2,8,0.0,0.0,915.9680008888245,978.4191983938217,1.1722481822051394,4,-1,-1,llm8_g4,0,
2026-03-03T03:28:33.665633+00:00,BUCKET,llm_style,eval,llm_style_eval_153,64,8192,2048,bf16,NVIDIA GeForce RTX 4060,c11,32,128,32,4,2,8,0.0,0.0,426.4959990978241,468.5107257962227,5.035178882199639,1,-1,-1,llm8_g1,0,
2026-03-03T03:28:33.778405+00:00,BUCKET,llm_style,eval,llm_style_eval_154,16,2048,8192,bf16,NVIDIA GeForce RTX 4060,c04,64,64,64,4,3,8,0.0,0.0,522.2399830818176,534.892812371254,1.0280157195775073,6,-1,-1,llm8_g6,0,
2026-03-03T03:28:33.798560+00:00,BUCKET,llm_style,eval,llm_style_eval_155,4,2048,1536,bf16,NVIDIA GeForce RTX 4060,c00,32,32,32,2,2,8,0.0,0.0,81.77600055932999,88.50079908967017,0.30774094878535585,7,-1,-1,llm8_g7,0,
2026-03-03T03:28:33.929488+00:00,BUCKET,llm_style,eval,llm_style_eval_156,1,4096,6144,bf16,NVIDIA GeForce RTX 4060,c11,32,128,32,4,2,8,0.0,0.0,393.12000572681427,483.0358469486236,0.1280312557661497,4,-1,-1,llm8_g4,0,
2026-03-03T03:28:34.005167+00:00,BUCKET,llm_style,eval,llm_style_eval_157,1,1536,8192,bf16,NVIDIA GeForce RTX 4060,c04,64,64,64,4,3,8,0.0,0.0,306.12801015377045,432.77312129735947,0.08220686498879674,6,-1,-1,llm8_g6,0,
2026-03-03T03:28:34.095085+00:00,BUCKET,llm_style,eval,llm_style_eval_158,64,1536,8192,bf16,NVIDIA GeForce RTX 4060,c10,64,128,64,8,3,8,0.0,0.0,529.9199819564819,628.0396914482116,3.0393508281260972,2,-1,-1,llm8_g2,0,
2026-03-03T03:28:34.147581+00:00,BUCKET,llm_style,eval,llm_style_eval_159,16,6144,1536,bf16,NVIDIA GeForce RTX 4060,c11,32,128,32,4,2,8,0.0,0.0,120.83200365304947,186.23968318104735,2.499254161729516,5,-1,-1,llm8_g5,0,
2026-03-03T03:28:34.359721+00:00,BUCKET,llm_style,eval,llm_style_eval_160,32,6144,6144,bf16,NVIDIA GeForce RTX 4060,c06,64,128,32,4,3,8,0.0,0.0,722.9440212249756,885.8595132827758,3.3417789387156183,0,-1,-1,llm8_g0,0,
2026-03-03T03:28:34.391471+00:00,BUCKET,llm_style,eval,llm_style_eval_161,2,1536,4096,bf16,NVIDIA GeForce RTX 4060,c00,32,32,32,2,2,8,0.0,0.0,155.96800297498703,265.99423289299,0.16135247948283282,7,-1,-1,llm8_g7,0,
2026-03-03T03:28:34.418693+00:00,BUCKET,llm_style,eval,llm_style_eval_162,64,1536,3072,bf16,NVIDIA GeForce RTX 4060,c02,32,64,32,2,2,8,0.0,0.0,176.94400250911713,220.05919888615597,3.4133950144418126,3,-1,-1,llm8_g3,0,
2026-03-03T03:28:34.481619+00:00,BUCKET,llm_style,eval,llm_style_eval_163,64,1024,8192,bf16,NVIDIA GeForce RTX 4060,c10,64,128,64,8,3,8,0.0,0.0,499.10400807857513,647.7107048034668,2.1513388123923023,2,-1,-1,llm8_g2,0,
2026-03-03T03:28:34.688169+00:00,BUCKET,llm_style,eval,llm_style_eval_164,64,4096,8192,bf16,NVIDIA GeForce RTX 4060,c06,64,128,32,4,3,8,0.0,0.0,949.1679966449738,1131.6121888160706,4.524981153158799,0,-1,-1,llm8_g0,0,
2026-03-03T03:28:34.819861+00:00,BUCKET,llm_style,eval,llm_style_eval_165,4,8192,3072,bf16,NVIDIA GeForce RTX 4060,c11,32,128,32,4,2,8,0.0,0.0,369.6640133857727,492.56447553634644,0.5446204788938984,5,-1,-1,llm8_g5,0,
2026-03-03T03:28:34.874805+00:00,BUCKET,llm_style,eval,llm_style_eval_166,64,1024,6144,bf16,NVIDIA GeForce RTX 4060,c10,64,128,64,8,3,8,0.0,0.0,397.8240042924881,595.4662358760831,2.0242779704362004,2,-1,-1,llm8_g2,0,
2026-03-03T03:28:34.889381+00:00,BUCKET,llm_style,eval,llm_style_eval_167,2,2048,1024,bf16,NVIDIA GeForce RTX 4060,c00,32,32,32,2,2,8,0.0,0.0,74.11200180649757,155.16672402620316,0.11318825285413557,7,-1,-1,llm8_g7,0,
2026-03-03T03:28:34.913256+00:00,BUCKET,llm_style,eval,llm_style_eval_168,64,4096,1024,bf16,NVIDIA GeForce RTX 4060,c11,32,128,32,4,2,8,0.0,0.0,141.13599807024002,248.1644742190837,3.80392613748912,1,-1,-1,llm8_g1,0,
2026-03-03T03:28:34.965311+00:00,BUCKET,llm_style,eval,llm_style_eval_169,4,1536,6144,bf16,NVIDIA GeForce RTX 4060,c04,64,64,64,4,3,8,0.0,0.0,239.98400568962097,332.0831930637359,0.3145937654597003,6,-1,-1,llm8_g6,0,
2026-03-03T03:28:34.985000+00:00,BUCKET,llm_style,eval,llm_style_eval_170,16,1536,1536,bf16,NVIDIA GeForce RTX 4060,c00,32,32,32,2,2,8,0.0,0.0,87.55199983716011,186.57280355691904,0.8623157910775243,7,-1,-1,llm8_g7,0,
2026-03-03T03:28:35.020553+00:00,BUCKET,llm_style,eval,llm_style_eval_171,1,2048,3072,bf16,NVIDIA GeForce RTX 4060,c00,32,32,32,2,2,8,0.0,0.0,132.09599256515503,174.88223925232882,0.09525581931483353,7,-1,-1,llm8_g7,0,
2026-03-03T03:28:35.055015+00:00,BUCKET,llm_style,eval,llm_style_eval_172,64,3072,2048,bf16,NVIDIA GeForce RTX 4060,c02,32,64,32,2,2,8,0.0,0.0,151.5520066022873,234.99775350093822,5.313729498239754,3,-1,-1,llm8_g3,0,
2026-03-03T03:28:35.347574+00:00,BUCKET,llm_style,eval,llm_style_eval_173,64,8192,6144,bf16,NVIDIA GeForce RTX 4060,c06,64,128,32,4,3,8,0.0,0.0,1219.43998336792,1333.2262444496155,5.283122606991175,0,-1,-1,llm8_g0,0,
2026-03-03T03:28:35.440814+00:00,BUCKET,llm_style,eval,llm_style_eval_174,2,4096,4096,bf16,NVIDIA GeForce RTX 4060,c11,32,128,32,4,2,8,0.0,0.0,310.2240115404129,392.73471504449844,0.21632388694470134,5,-1,-1,llm8_g5,0,
2026-03-03T03:28:35.486957+00:00,BUCKET,llm_style,eval,llm_style_eval_175,64,4096,2048,bf16,NVIDIA GeForce RTX 4060,c11,32,128,32,4,2,8,0.0,0.0,233.47200453281403,276.6092759370804,4.5990174545706095,1,-1,-1,llm8_g1,0,
2026-03-03T03:28:35.550264+00:00,BUCKET,llm_style,eval,llm_style_eval_176,16,6144,2048,bf16,NVIDIA GeForce RTX 4060,c11,32,128,32,4,2,8,0.0,0.0,124.92799758911133,210.87232038378704,3.2230820294128772,5,-1,-1,llm8_g5,0,
2026-03-03T03:28:35.605115+00:00,BUCKET,llm_style,eval,llm_style_eval_177,1,6144,1536,bf16,NVIDIA GeForce RTX 4060,c11,32,128,32,4,2,8,0.0,0.0,119.29600313305855,163.4611193835735,0.1582145881195047,5,-1,-1,llm8_g5,0,
2026-03-03T03:28:35.882844+00:00,BUCKET,llm_style,eval,llm_style_eval_178,32,6144,8192,bf16,NVIDIA GeForce RTX 4060,c06,64,128,32,4,3,8,0.0,0.0,951.2959718704224,1079.9862623214722,3.386144341246899,0,-1,-1,llm8_g0,0,
2026-03-03T03:28:36.039279+00:00,BUCKET,llm_style,eval,llm_style_eval_179,64,4096,6144,bf16,NVIDIA GeForce RTX 4060,c06,64,128,32,4,3,8,0.0,0.0,721.8399941921234,840.7244735956192,4.462520084669408,0,-1,-1,llm8_g0,0,
2026-03-03T03:28:36.064123+00:00,BUCKET,llm_style,eval,llm_style_eval_180,64,2048,1536,bf16,NVIDIA GeForce RTX 4060,c02,32,64,32,2,2,8,0.0,0.0,137.61600106954575,207.4835197627544,2.9259183588434223,3,-1,-1,llm8_g3,0,
2026-03-03T03:28:36.099269+00:00,BUCKET,llm_style,eval,llm_style_eval_181,64,2048,3072,bf16,NVIDIA GeForce RTX 4060,c02,32,64,32,2,2,8,0.0,0.0,192.51200556755066,302.01088428497314,4.183148815191298,3,-1,-1,llm8_g3,0,
2026-03-03T03:28:36.123925+00:00,BUCKET,llm_style,eval,llm_style_eval_182,32,3072,1536,bf16,NVIDIA GeForce RTX 4060,c02,32,64,32,2,2,8,0.0,0.0,116.73600226640701,243.19999262690533,2.5869473181959677,3,-1,-1,llm8_g3,0,
2026-03-03T03:28:36.212630+00:00,BUCKET,llm_style,eval,llm_style_eval_183,8,8192,2048,bf16,NVIDIA GeForce RTX 4060,c11,32,128,32,4,2,8,0.0,0.0,256.848007440567,362.1375998854637,1.0451140294016659,5,-1,-1,llm8_g5,0,
2026-03-03T03:28:36.258887+00:00,BUCKET,llm_style,eval,llm_style_eval_184,64,8192,1024,bf16,NVIDIA GeForce RTX 4060,c11,32,128,32,4,2,8,0.0,0.0,203.77600193023682,275.998720228672,5.269226080741333,1,-1,-1,llm8_g1,0,
2026-03-03T03:28:36.328344+00:00,BUCKET,llm_style,eval,llm_style_eval_185,1,8192,1536,bf16,NVIDIA GeForce RTX 4060,c11,32,128,32,4,2,8,0.0,0.0,178.17600071430206,270.18239796161646,0.14124137874411252,5,-1,-1,llm8_g5,0,
2026-03-03T03:28:36.354955+00:00,BUCKET,llm_style,eval,llm_style_eval_186,16,6144,1024,bf16,NVIDIA GeForce RTX 4060,c11,32,128,32,4,2,8,0.0,0.0,86.01599931716919,132.051522731781,2.340571447151859,5,-1,-1,llm8_g5,0,
2026-03-03T03:28:36.389730+00:00,BUCKET,llm_style,eval,llm_style_eval_187,1,1024,6144,bf16,NVIDIA GeForce RTX 4060,c04,64,64,64,4,3,8,0.0,0.0,220.5119952559471,463.7696149945255,0.05706225634299432,6,-1,-1,llm8_g6,0,
2026-03-03T03:28:36.566160+00:00,BUCKET,llm_style,eval,llm_style_eval_188,8,8192,4096,bf16,NVIDIA GeForce RTX 4060,c11,32,128,32,4,2,8,0.0,0.0,499.7119903564453,611.0032045841217,1.0743606764709592,5,-1,-1,llm8_g5,0,
2026-03-03T03:28:36.669856+00:00,BUCKET,llm_style,eval,llm_style_eval_189,8,2048,8192,bf16,NVIDIA GeForce RTX 4060,c04,64,64,64,4,3,8,0.0,0.0,488.44799399375916,605.7881528139114,0.5495681409297174,6,-1,-1,llm8_g6,0,
2026-03-03T03:28:36.758257+00:00,BUCKET,llm_style,eval,llm_style_eval_190,4,8192,2048,bf16,NVIDIA GeForce RTX 4060,c11,32,128,32,4,2,8,0.0,0.0,257.53599405288696,329.30463850498194,0.5211610458320531,5,-1,-1,llm8_g5,0,
2026-03-03T03:28:37.103050+00:00,BUCKET,llm_style,eval,llm_style_eval_191,4,8192,8192,bf16,NVIDIA GeForce RTX 4060,c11,32,128,32,4,2,8,0.0,0.0,932.8640103340149,1032.7008175849915,0.5755082263359819,4,-1,-1,llm8_g4,0,
2026-03-03T03:28:37.119166+00:00,BUCKET,llm_style,eval,llm_style_eval_192,64,1536,1024,bf16,NVIDIA GeForce RTX 4060,c02,32,64,32,2,2,8,0.0,0.0,107.51999914646149,119.6825623512268,1.872457157721487,3,-1,-1,llm8_g3,0,
2026-03-03T03:28:37.142729+00:00,BUCKET,llm_style,eval,llm_style_eval_193,32,2048,2048,bf16,NVIDIA GeForce RTX 4060,c02,32,64,32,2,2,8,0.0,0.0,133.12000036239624,215.64416185021378,2.016492302202755,3,-1,-1,llm8_g3,0,
2026-03-03T03:28:37.158262+00:00,BUCKET,llm_style,eval,llm_style_eval_194,8,1024,2048,bf16,NVIDIA GeForce RTX 4060,c00,32,32,32,2,2,8,0.0,0.0,92.04800054430962,134.51712377369395,0.36453189424628224,7,-1,-1,llm8_g7,0,
2026-03-03T03:28:37.195418+00:00,BUCKET,llm_style,eval,llm_style_eval_195,2,4096,2048,bf16,NVIDIA GeForce RTX 4060,c11,32,128,32,4,2,8,0.0,0.0,138.2399946451187,154.66496020555496,0.24272593532818695,5,-1,-1,llm8_g5,0,
2026-03-03T03:28:37.246272+00:00,BUCKET,llm_style,eval,llm_style_eval_196,32,2048,4096,bf16,NVIDIA GeForce RTX 4060,c02,32,64,32,2,2,8,0.0,0.0,203.61600071191788,247.3168005049228,2.6366833162565713,3,-1,-1,llm8_g3,0,
2026-03-03T03:28:37.310795+00:00,BUCKET,llm_style,eval,llm_style_eval_197,32,8192,1536,bf16,NVIDIA GeForce RTX 4060,c11,32,128,32,4,2,8,0.0,0.0,161.79199516773224,200.77984064817417,4.97741787018033,1,-1,-1,llm8_g1,0,
2026-03-03T03:28:37.508485+00:00,BUCKET,llm_style,eval,llm_style_eval_198,64,4096,8192,bf16,NVIDIA GeForce RTX 4060,c06,64,128,32,4,3,8,0.0,0.0,829.8400044441223,992.5632160902022,5.1756570820866035,0,-1,-1,llm8_g0,0,
2026-03-03T03:28:37.681385+00:00,BUCKET,llm_style,eval,llm_style_eval_199,2,8192,4096,bf16,NVIDIA GeForce RTX 4060,c11,32,128,32,4,2,8,0.0,0.0,467.96800196170807,622.7846491336823,0.2868096268064553,5,-1,-1,llm8_g5,0,
2026-03-03T03:28:37.701446+00:00,BUCKET,llm_style,eval,llm_style_eval_200,1,4096,1024,bf16,NVIDIA GeForce RTX 4060,c11,32,128,32,4,2,8,0.0,0.0,80.89599758386612,102.42080047726628,0.10369620562875687,5,-1,-1,llm8_g5,0,
2026-03-03T03:28:37.771710+00:00,BUCKET,llm_style,eval,llm_style_eval_201,4,1536,8192,bf16,NVIDIA GeForce RTX 4060,c04,64,64,64,4,3,8,0.0,0.0,269.23200488090515,306.5241518616675,0.37389052629359,6,-1,-1,llm8_g6,0,
2026-03-03T03:28:37.871003+00:00,BUCKET,llm_style,eval,llm_style_eval_202,1,6144,3072,bf16,NVIDIA GeForce RTX 4060,c11,32,128,32,4,2,8,0.0,0.0,280.43200075626373,444.27263349294645,0.1346092311084324,5,-1,-1,llm8_g5,0,
2026-03-03T03:28:37.953244+00:00,BUCKET,llm_style,eval,llm_style_eval_203,16,2048,6144,bf16,NVIDIA GeForce RTX 4060,c04,64,64,64,4,3,8,0.0,0.0,352.25600004196167,457.2099107503891,1.143069767305695,6,-1,-1,llm8_g6,0,
2026-03-03T03:28:37.966966+00:00,BUCKET,llm_style,eval,llm_style_eval_204,16,1536,1024,bf16,NVIDIA GeForce RTX 4060,c00,32,32,32,2,2,8,0.0,0.0,83.96799862384796,266.7846409976481,0.5994146439701515,7,-1,-1,llm8_g7,0,
2026-03-03T03:28:38.042756+00:00,BUCKET,llm_style,eval,llm_style_eval_205,64,6144,2048,bf16,NVIDIA GeForce RTX 4060,c11,32,128,32,4,2,8,0.0,0.0,260.09601354599,352.92160391807556,6.192377630252348,1,-1,-1,llm8_g1,0,
2026-03-03T03:28:38.120629+00:00,BUCKET,llm_style,eval,llm_style_eval_206,4,2048,6144,bf16,NVIDIA GeForce RTX 4060,c04,64,64,64,4,3,8,0.0,0.0,355.088010430336,440.30975610017765,0.2834882987966977,6,-1,-1,llm8_g6,0,
2026-03-03T03:28:38.171017+00:00,BUCKET,llm_style,eval,llm_style_eval_207,32,6144,1536,bf16,NVIDIA GeForce RTX 4060,c11,32,128,32,4,2,8,0.0,0.0,109.50399935245514,151.1833587288855,5.515595590769246,1,-1,-1,llm8_g1,0,
2026-03-03T03:28:38.183257+00:00,BUCKET,llm_style,eval,llm_style_eval_208,4,2048,1024,bf16,NVIDIA GeForce RTX 4060,c00,32,32,32,2,2,8,0.0,0.0,58.25600028038025,65.47487922012806,0.28799120981964005,7,-1,-1,llm8_g7,0,
2026-03-03T03:28:38.194411+00:00,BUCKET,llm_style,eval,llm_style_eval_209,1,1024,1536,bf16,NVIDIA GeForce RTX 4060,c00,32,32,32,2,2,8,0.0,0.0,73.21600243449211,169.4105575978755,0.042965033536412324,7,-1,-1,llm8_g7,0,
2026-03-03T03:28:38.325094+00:00,BUCKET,llm_style,eval,llm_style_eval_210,8,6144,4096,bf16,NVIDIA GeForce RTX 4060,c11,32,128,32,4,2,8,0.0,0.0,366.43199622631073,482.29313403367996,1.0988483215077072,5,-1,-1,llm8_g5,0,
2026-03-03T03:28:38.429512+00:00,BUCKET,llm_style,eval,llm_style_eval_211,4,2048,8192,bf16,NVIDIA GeForce RTX 4060,c04,64,64,64,4,3,8,0.0,0.0,457.72799849510193,595.2614498138428,0.29322595174705324,6,-1,-1,llm8_g6,0,
2026-03-03T03:28:38.439928+00:00,BUCKET,llm_style,eval,llm_style_eval_212,32,1024,1024,bf16,NVIDIA GeForce RTX 4060,c02,32,64,32,2,2,8,0.0,0.0,69.63200122117996,116.7667221277951,0.9637646889802084,3,-1,-1,llm8_g3,0,
2026-03-03T03:28:38.505296+00:00,BUCKET,llm_style,eval,llm_style_eval_213,16,3072,4096,bf16,NVIDIA GeForce RTX 4060,c00,32,32,32,2,2,8,0.0,0.0,165.21599888801575,291.37919813394547,2.4371319164611918,7,-1,-1,llm8_g7,0,
2026-03-03T03:28:38.574605+00:00,BUCKET,llm_style,eval,llm_style_eval_214,64,1024,8192,bf16,NVIDIA GeForce RTX 4060,c10,64,128,64,8,3,8,0.0,0.0,459.77599918842316,572.4160075187683,2.3353585787325195,2,-1,-1,llm8_g2,0,
2026-03-03T03:28:38.606281+00:00,BUCKET,llm_style,eval,llm_style_eval_215,4,4096,1536,bf16,NVIDIA GeForce RTX 4060,c11,32,128,32,4,2,8,0.0,0.0,110.59200018644333,121.35424003005028,0.4551111103438546,5,-1,-1,llm8_g5,0,
2026-03-03T03:28:38.631931+00:00,BUCKET,llm_style,eval,llm_style_eval_216,16,1536,3072,bf16,NVIDIA GeForce RTX 4060,c00,32,32,32,2,2,8,0.0,0.0,122.8799968957901,215.16287833452222,1.2288000310421,7,-1,-1,llm8_g7,0,
2026-03-03T03:28:38.696565+00:00,BUCKET,llm_style,eval,llm_style_eval_217,8,6144,2048,bf16,NVIDIA GeForce RTX 4060,c11,32,128,32,4,2,8,0.0,0.0,132.09599256515503,146.77536368370056,1.5240931090373364,5,-1,-1,llm8_g5,0,
2026-03-03T03:28:38.763164+00:00,BUCKET,llm_style,eval,llm_style_eval_218,8,3072,4096,bf16,NVIDIA GeForce RTX 4060,c00,32,32,32,2,2,8,0.0,0.0,157.69599378108978,173.5782428085804,1.2766753750223818,7,-1,-1,llm8_g7,0,
2026-03-03T03:28:38.914076+00:00,BUCKET,llm_style,eval,llm_style_eval_219,64,8192,3072,bf16,NVIDIA GeForce RTX 4060,c11,32,128,32,4,2,8,0.0,0.0,543.7439978122711,632.4464231729506,5.9241582159259725,1,-1,-1,llm8_g1,0,
2026-03-03T03:28:38.957801+00:00,BUCKET,llm_style,eval,llm_style_eval_220,2,4096,2048,bf16,NVIDIA GeForce RTX 4060,c11,32,128,32,4,2,8,0.0,0.0,137.10399717092514,241.6316749155519,0.24473708055475785,5,-1,-1,llm8_g5,0,
2026-03-03T03:28:39.022306+00:00,BUCKET,llm_style,eval,llm_style_eval_221,4,1024,8192,bf16,NVIDIA GeForce RTX 4060,c04,64,64,64,4,3,8,0.0,0.0,272.8959918022156,419.4816040992737,0.24591370344727487,6,-1,-1,llm8_g6,0,
2026-03-03T03:28:39.102713+00:00,BUCKET,llm_style,eval,llm_style_eval_222,64,6144,2048,bf16,NVIDIA GeForce RTX 4060,c11,32,128,32,4,2,8,0.0,0.0,309.2480003833771,367.79007375240315,5.208158933940757,1,-1,-1,llm8_g1,0,
2026-03-03T03:28:39.134009+00:00,BUCKET,llm_style,eval,llm_style_eval_223,4,2048,2048,bf16,NVIDIA GeForce RTX 4060,c00,32,32,32,2,2,8,0.0,0.0,108.5439994931221,245.780481249094,0.30913207691528055,7,-1,-1,llm8_g7,0,
2026-03-03T03:28:39.157530+00:00,BUCKET,llm_style,eval,llm_style_eval_224,16,3072,1536,bf16,NVIDIA GeForce RTX 4060,c00,32,32,32,2,2,8,0.0,0.0,99.83999654650688,170.73152184486383,1.512369283082501,7,-1,-1,llm8_g7,0,
2026-03-03T03:28:39.181597+00:00,BUCKET,llm_style,eval,llm_style_eval_225,1,2048,2048,bf16,NVIDIA GeForce RTX 4060,c00,32,32,32,2,2,8,0.0,0.0,106.44799843430519,181.8521578609941,0.0788047508960637,7,-1,-1,llm8_g7,0,
2026-03-03T03:28:39.192825+00:00,BUCKET,llm_style,eval,llm_style_eval_226,8,1536,1024,bf16,NVIDIA GeForce RTX 4060,c00,32,32,32,2,2,8,0.0,0.0,64.51199948787689,80.89599758386612,0.3900952411919764,7,-1,-1,llm8_g7,0,
2026-03-03T03:28:39.426459+00:00,BUCKET,llm_style,eval,llm_style_eval_227,64,6144,6144,bf16,NVIDIA GeForce RTX 4060,c06,64,128,32,4,3,8,0.0,0.0,828.8959860801697,912.2815960645673,5.829245513480713,0,-1,-1,llm8_g0,0,
2026-03-03T03:28:39.506739+00:00,BUCKET,llm_style,eval,llm_style_eval_228,64,6144,2048,bf16,NVIDIA GeForce RTX 4060,c11,32,128,32,4,2,8,0.0,0.0,324.6079981327057,450.7977667450904,4.961716116870146,1,-1,-1,llm8_g1,0,
2026-03-03T03:28:39.585868+00:00,BUCKET,llm_style,eval,llm_style_eval_229,16,1536,8192,bf16,NVIDIA GeForce RTX 4060,c04,64,64,64,4,3,8,0.0,0.0,350.0960022211075,485.9168070554732,1.1501221991838095,6,-1,-1,llm8_g6,0,
2026-03-03T03:28:39.608292+00:00,BUCKET,llm_style,eval,llm_style_eval_230,64,2048,1536,bf16,NVIDIA GeForce RTX 4060,c02,32,64,32,2,2,8,0.0,0.0,138.2399946451187,264.32798802852625,2.9127112239382438,3,-1,-1,llm8_g3,0,
2026-03-03T03:28:39.668806+00:00,BUCKET,llm_style,eval,llm_style_eval_231,4,1024,8192,bf16,NVIDIA GeForce RTX 4060,c04,64,64,64,4,3,8,0.0,0.0,349.13600981235504,399.7824001312255,0.1922141002759011,6,-1,-1,llm8_g6,0,
2026-03-03T03:28:39.694587+00:00,BUCKET,llm_style,eval,llm_style_eval_232,16,3072,1536,bf16,NVIDIA GeForce RTX 4060,c00,32,32,32,2,2,8,0.0,0.0,98.30400347709656,175.95392361283297,1.5359999456703681,7,-1,-1,llm8_g7,0,
2026-03-03T03:28:39.754701+00:00,BUCKET,llm_style,eval,llm_style_eval_233,64,3072,3072,bf16,NVIDIA GeForce RTX 4060,c02,32,64,32,2,2,8,0.0,0.0,237.56799846887589,408.6681529879569,5.084689687943204,3,-1,-1,llm8_g3,0,
2026-03-03T03:28:39.930439+00:00,BUCKET,llm_style,eval,llm_style_eval_234,32,8192,4096,bf16,NVIDIA GeForce RTX 4060,c11,32,128,32,4,2,8,0.0,0.0,498.6879974603653,601.2252855300903,4.30626696238198,1,-1,-1,llm8_g1,0,
2026-03-03T03:28:39.944599+00:00,BUCKET,llm_style,eval,llm_style_eval_235,4,2048,1024,bf16,NVIDIA GeForce RTX 4060,c00,32,32,32,2,2,8,0.0,0.0,71.68000191450119,114.41152147948736,0.23405713660571054,7,-1,-1,llm8_g7,0,
2026-03-03T03:28:40.077338+00:00,BUCKET,llm_style,eval,llm_style_eval_236,4,8192,3072,bf16,NVIDIA GeForce RTX 4060,c11,32,128,32,4,2,8,0.0,0.0,407.55200386047363,426.88159823417664,0.49398994506949995,5,-1,-1,llm8_g5,0,
2026-03-03T03:28:40.113119+00:00,BUCKET,llm_style,eval,llm_style_eval_237,64,1024,4096,bf16,NVIDIA GeForce RTX 4060,c02,32,64,32,2,2,8,0.0,0.0,292.86399483680725,350.74400067329395,1.8331748574937003,3,-1,-1,llm8_g3,0,
2026-03-03T03:28:40.204940+00:00,BUCKET,llm_style,eval,llm_style_eval_238,32,2048,6144,bf16,NVIDIA GeForce RTX 4060,c10,64,128,64,8,3,8,0.0,0.0,516.0320103168488,630.906885266304,1.560574444801465,2,-1,-1,llm8_g2,0,
2026-03-03T03:28:40.238849+00:00,BUCKET,llm_style,eval,llm_style_eval_239,32,2048,6144,bf16,NVIDIA GeForce RTX 4060,c10,64,128,64,8,3,8,0.0,0.0,522.1439898014069,562.8342354297638,1.5423070718601812,2,-1,-1,llm8_g2,0,
2026-03-03T03:28:40.312895+00:00,BUCKET,llm_style,eval,llm_style_eval_240,8,8192,1536,bf16,NVIDIA GeForce RTX 4060,c11,32,128,32,4,2,8,0.0,0.0,189.43999707698822,240.62720224261273,1.0627459623438502,5,-1,-1,llm8_g5,0,
2026-03-03T03:28:40.327629+00:00,BUCKET,llm_style,eval,llm_style_eval_241,16,1536,1536,bf16,NVIDIA GeForce RTX 4060,c00,32,32,32,2,2,8,0.0,0.0,83.8719978928566,168.202237188816,0.90015110998602,7,-1,-1,llm8_g7,0,
2026-03-03T03:28:40.356791+00:00,BUCKET,llm_style,eval,llm_style_eval_242,1,2048,3072,bf16,NVIDIA GeForce RTX 4060,c00,32,32,32,2,2,8,0.0,0.0,133.12000036239624,191.0192047059536,0.09452307666575414,7,-1,-1,llm8_g7,0,
2026-03-03T03:28:40.407362+00:00,BUCKET,llm_style,eval,llm_style_eval_243,8,1536,6144,bf16,NVIDIA GeForce RTX 4060,c04,64,64,64,4,3,8,0.0,0.0,236.4640012383461,323.9043280482291,0.6385536200404696,6,-1,-1,llm8_g6,0,
2026-03-03T03:28:40.457174+00:00,BUCKET,llm_style,eval,llm_style_eval_244,32,8192,1024,bf16,NVIDIA GeForce RTX 4060,c11,32,128,32,4,2,8,0.0,0.0,125.84000080823898,302.17023745179154,4.2662977475509525,1,-1,-1,llm8_g1,0,
2026-03-03T03:28:40.588130+00:00,BUCKET,llm_style,eval,llm_style_eval_245,4,6144,4096,bf16,NVIDIA GeForce RTX 4060,c11,32,128,32,4,2,8,0.0,0.0,364.54400420188904,455.49855679273594,0.5522696565556536,5,-1,-1,llm8_g5,0,
2026-03-03T03:28:40.676716+00:00,BUCKET,llm_style,eval,llm_style_eval_246,32,2048,6144,bf16,NVIDIA GeForce RTX 4060,c10,64,128,64,8,3,8,0.0,0.0,402.70400047302246,433.21344524621964,1.9997476236989808,2,-1,-1,llm8_g2,0,
2026-03-03T03:28:40.756430+00:00,BUCKET,llm_style,eval,llm_style_eval_247,64,6144,2048,bf16,NVIDIA GeForce RTX 4060,c11,32,128,32,4,2,8,0.0,0.0,292.62399673461914,417.8124871850014,5.504035055131399,1,-1,-1,llm8_g1,0,
2026-03-03T03:28:40.771606+00:00,BUCKET,llm_style,eval,llm_style_eval_248,64,1024,1024,bf16,NVIDIA GeForce RTX 4060,c02,32,64,32,2,2,8,0.0,0.0,86.81599795818329,189.58976015448553,1.5460022479341737,3,-1,-1,llm8_g3,0,
2026-03-03T03:28:40.818955+00:00,BUCKET,llm_style,eval,llm_style_eval_249,2,8192,1024,bf16,NVIDIA GeForce RTX 4060,c11,32,128,32,4,2,8,0.0,0.0,138.2399946451187,189.00928050279617,0.24272593532818695,5,-1,-1,llm8_g5,0,
2026-03-03T03:28:40.878858+00:00,BUCKET,llm_style,eval,llm_style_eval_250,64,3072,3072,bf16,NVIDIA GeForce RTX 4060,c02,32,64,32,2,2,8,0.0,0.0,214.01600539684296,337.61631816625584,5.644248661496694,3,-1,-1,llm8_g3,0,
2026-03-03T03:28:40.953172+00:00,BUCKET,llm_style,eval,llm_style_eval_251,64,1024,8192,bf16,NVIDIA GeForce RTX 4060,c10,64,128,64,8,3,8,0.0,0.0,527.7920067310333,661.7497605085373,2.0344033450798107,2,-1,-1,llm8_g2,0,
2026-03-03T03:28:41.037993+00:00,BUCKET,llm_style,eval,llm_style_eval_252,64,4096,3072,bf16,NVIDIA GeForce RTX 4060,c11,32,128,32,4,2,8,0.0,0.0,339.4559919834137,403.476482629776,4.744687894855887,1,-1,-1,llm8_g1,0,
2026-03-03T03:28:41.173615+00:00,BUCKET,llm_style,eval,llm_style_eval_253,8,6144,4096,bf16,NVIDIA GeForce RTX 4060,c11,32,128,32,4,2,8,0.0,0.0,369.1039979457855,492.32895135879505,1.0908935862004459,5,-1,-1,llm8_g5,0,
2026-03-03T03:28:41.203128+00:00,BUCKET,llm_style,eval,llm_style_eval_254,4,1536,3072,bf16,NVIDIA GeForce RTX 4060,c00,32,32,32,2,2,8,0.0,0.0,110.44799908995628,188.91776025295238,0.34177836005209017,7,-1,-1,llm8_g7,0,
2026-03-03T03:28:41.227971+00:00,BUCKET,llm_style,eval,llm_style_eval_255,1,3072,1536,bf16,NVIDIA GeForce RTX 4060,c00,32,32,32,2,2,8,0.0,0.0,82.94399827718735,183.35744246840477,0.11377778014103249,7,-1,-1,llm8_g7,0,
