results/llm_bestsplit_with_torch.csv
timestamp,method,workload,split,shape_id,M,N,K,dtype,gpu,config_id,BLOCK_M,BLOCK_N,BLOCK_K,num_warps,num_stages,GROUP_M,compile_time_ms,tune_time_ms,runtime_cost_us,p99_us,runtime_perf_tflops,bucket_m,bucket_n,bucket_k,cache_key,invalid_config,notes
2026-03-03T06:03:34.738280+00:00,FULL,llm_style,tune,llm_style_tune_000,64,6144,6144,bf16,NVIDIA GeForce RTX 4060,c06,64,128,32,4,3,8,2.4838059907779098,897.268,334.7039967775345,412.78464913368214,14.436153301185543,1,-1,-1,64x6144x6144,0,
2026-03-03T06:03:34.906917+00:00,FULL,llm_style,tune,llm_style_tune_001,64,8192,1536,bf16,NVIDIA GeForce RTX 4060,c06,64,128,32,4,3,8,0.0,168.599,94.03200075030327,128.5427226126194,17.12834697920437,1,-1,-1,64x8192x1536,0,
2026-03-03T06:03:35.226478+00:00,FULL,llm_style,tune,llm_style_tune_002,32,3072,8192,bf16,NVIDIA GeForce RTX 4060,c06,64,128,32,4,3,8,0.0,319.521,230.3999960422516,264.11520689725876,6.990506786747687,2,-1,-1,32x3072x8192,0,
2026-03-03T06:03:35.496641+00:00,FULL,llm_style,tune,llm_style_tune_003,4,6144,3072,bf16,NVIDIA GeForce RTX 4060,c06,64,128,32,4,3,8,0.0,270.112,179.19999361038208,254.80447873473156,0.8426057443299597,5,-1,-1,4x6144x3072,0,
2026-03-03T06:03:35.603914+00:00,FULL,llm_style,tune,llm_style_tune_004,8,8192,1024,bf16,NVIDIA GeForce RTX 4060,c11,32,128,32,4,2,8,0.0,107.224,48.16000163555145,61.424000076949596,2.78691286216488,5,-1,-1,8x8192x1024,0,
2026-03-03T06:03:35.913770+00:00,FULL,llm_style,tune,llm_style_tune_005,32,8192,3072,bf16,NVIDIA GeForce RTX 4060,c11,32,128,32,4,2,8,0.0,309.81,229.21600192785263,268.8041687011719,7.026615604729691,1,-1,-1,32x8192x3072,0,
2026-03-03T06:03:36.468140+00:00,FULL,llm_style,tune,llm_style_tune_006,32,6144,8192,bf16,NVIDIA GeForce RTX 4060,c06,64,128,32,4,3,8,0.0,554.328,427.0080029964447,512.6854416728019,7.54371217727931,0,-1,-1,32x6144x8192,0,
2026-03-03T06:03:36.549867+00:00,FULL,llm_style,tune,llm_style_tune_007,8,1536,2048,bf16,NVIDIA GeForce RTX 4060,c04,64,64,64,4,3,8,0.0,81.687,46.00000008940697,60.48095937818286,1.094166258742911,7,-1,-1,8x1536x2048,0,
2026-03-03T06:03:36.649251+00:00,FULL,llm_style,tune,llm_style_tune_008,16,1536,4096,bf16,NVIDIA GeForce RTX 4060,c04,64,64,64,4,3,8,0.0,99.342,56.32000043988228,64.3151995167136,3.5746908811711084,7,-1,-1,16x1536x4096,0,
2026-03-03T06:03:36.731999+00:00,FULL,llm_style,tune,llm_style_tune_009,64,1536,2048,bf16,NVIDIA GeForce RTX 4060,c04,64,64,64,4,3,8,0.0,82.704,46.92799970507622,55.81824027001858,8.580233262242476,3,-1,-1,64x1536x2048,0,
2026-03-03T06:03:36.788814+00:00,FULL,llm_style,tune,llm_style_tune_010,2,2048,1024,bf16,NVIDIA GeForce RTX 4060,c00,32,32,32,2,2,8,0.0,56.774,36.86400130391121,159.88608136773104,0.22755554750672122,7,-1,-1,2x2048x1024,0,
2026-03-03T06:03:37.077871+00:00,FULL,llm_style,tune,llm_style_tune_011,2,3072,8192,bf16,NVIDIA GeForce RTX 4060,c10,64,128,64,8,3,8,0.0,289.009,226.30399465560913,254.1363240778446,0.4448144901427394,6,-1,-1,2x3072x8192,0,
2026-03-03T06:03:37.162961+00:00,FULL,llm_style,tune,llm_style_tune_012,64,2048,1536,bf16,NVIDIA GeForce RTX 4060,c11,32,128,32,4,2,8,0.0,85.047,47.82399907708168,55.31648010015487,8.41947958703772,3,-1,-1,64x2048x1536,0,
2026-03-03T06:03:37.571167+00:00,FULL,llm_style,tune,llm_style_tune_013,16,8192,4096,bf16,NVIDIA GeForce RTX 4060,c02,32,64,32,2,2,8,0.0,408.164,296.7039942741394,395.6675150990483,3.6188991207442833,5,-1,-1,16x8192x4096,0,
2026-03-03T06:03:37.959039+00:00,FULL,llm_style,tune,llm_style_tune_014,4,8192,4096,bf16,NVIDIA GeForce RTX 4060,c10,64,128,64,8,3,8,0.0,387.824,291.83998703956604,326.56383484601963,0.9198035496198368,5,-1,-1,4x8192x4096,0,
2026-03-03T06:03:38.046729+00:00,FULL,llm_style,tune,llm_style_tune_015,4,3072,2048,bf16,NVIDIA GeForce RTX 4060,c00,32,32,32,2,2,8,0.0,87.648,49.00800064206123,394.4211295247077,1.0270088014323673,7,-1,-1,4x3072x2048,0,
2026-03-03T06:03:38.100646+00:00,FULL,llm_style,tune,llm_style_tune_016,16,1536,1024,bf16,NVIDIA GeForce RTX 4060,c04,64,64,64,4,3,8,0.0,53.875,35.58399900794029,136.63903787732096,1.4144460825993415,7,-1,-1,16x1536x1024,0,
2026-03-03T06:03:38.170728+00:00,FULL,llm_style,tune,llm_style_tune_017,32,1024,2048,bf16,NVIDIA GeForce RTX 4060,c04,64,64,64,4,3,8,0.0,70.04,45.903999358415604,60.55935997515914,2.9238787442470153,3,-1,-1,32x1024x2048,0,
2026-03-03T06:03:38.185418+00:00,FULL,llm_style,tune,llm_style_tune_018,64,1536,2048,bf16,NVIDIA GeForce RTX 4060,c04,64,64,64,4,3,8,0.0,0.0,47.10400104522705,131.5132807940244,8.548173723361447,3,-1,-1,64x1536x2048,0,
2026-03-03T06:03:38.270694+00:00,FULL,llm_style,tune,llm_style_tune_019,4,4096,1536,bf16,NVIDIA GeForce RTX 4060,c11,32,128,32,4,2,8,0.0,85.234,46.08000069856644,52.59903963655232,1.0922666501080551,7,-1,-1,4x4096x1536,0,
2026-03-03T06:03:38.437963+00:00,FULL,llm_style,tune,llm_style_tune_020,1,8192,1536,bf16,NVIDIA GeForce RTX 4060,c11,32,128,32,4,2,8,0.0,167.226,61.39199994504452,109.40736249089231,0.4099202505624083,5,-1,-1,1x8192x1536,0,
2026-03-03T06:03:38.538912+00:00,FULL,llm_style,tune,llm_style_tune_021,64,1536,4096,bf16,NVIDIA GeForce RTX 4060,c04,64,64,64,4,3,8,0.0,100.916,60.27200073003769,66.4230389893055,13.361201855684548,3,-1,-1,64x1536x4096,0,
2026-03-03T06:03:38.653465+00:00,FULL,llm_style,tune,llm_style_tune_022,64,1024,6144,bf16,NVIDIA GeForce RTX 4060,c04,64,64,64,4,3,8,0.0,114.509,70.5760009586811,86.71456284821029,11.410484542351282,3,-1,-1,64x1024x6144,0,
2026-03-03T06:03:38.733303+00:00,FULL,llm_style,tune,llm_style_tune_023,8,4096,1024,bf16,NVIDIA GeForce RTX 4060,c11,32,128,32,4,2,8,0.0,79.798,41.85600019991398,49.515200555324554,1.603327209467519,7,-1,-1,8x4096x1024,0,
2026-03-03T06:03:38.946020+00:00,FULL,llm_style,tune,llm_style_tune_024,8,4096,4096,bf16,NVIDIA GeForce RTX 4060,c00,32,32,32,2,2,8,0.0,212.675,160.60800105333328,234.78688105940813,1.6713703815469338,7,-1,-1,8x4096x4096,0,
2026-03-03T06:03:39.034751+00:00,FULL,llm_style,tune,llm_style_tune_025,32,6144,1024,bf16,NVIDIA GeForce RTX 4060,c11,32,128,32,4,2,8,0.0,88.691,40.95999896526337,49.107201248407364,9.8304002483368,1,-1,-1,32x6144x1024,0,
2026-03-03T06:03:39.100146+00:00,FULL,llm_style,tune,llm_style_tune_026,1,3072,1536,bf16,NVIDIA GeForce RTX 4060,c11,32,128,32,4,2,8,0.0,65.35,44.03200000524521,61.44063908606765,0.2143255813698178,7,-1,-1,1x3072x1536,0,
2026-03-03T06:03:39.205710+00:00,FULL,llm_style,tune,llm_style_tune_027,1,6144,1536,bf16,NVIDIA GeForce RTX 4060,c11,32,128,32,4,2,8,0.0,105.521,45.83999887108803,54.81471993029117,0.4117445127579256,5,-1,-1,1x6144x1536,0,
2026-03-03T06:03:39.238272+00:00,FULL,llm_style,tune,llm_style_tune_028,4,4096,1536,bf16,NVIDIA GeForce RTX 4060,c11,32,128,32,4,2,8,0.0,0.0,57.82399885356426,209.71040010452253,0.8704283515130424,7,-1,-1,4x4096x1536,0,
2026-03-03T06:03:39.356266+00:00,FULL,llm_style,tune,llm_style_tune_029,16,1024,6144,bf16,NVIDIA GeForce RTX 4060,c04,64,64,64,4,3,8,0.0,117.944,72.7040022611618,82.4015974998474,2.7691266744409737,7,-1,-1,16x1024x6144,0,
2026-03-03T06:03:39.781677+00:00,FULL,llm_style,tune,llm_style_tune_030,64,4096,8192,bf16,NVIDIA GeForce RTX 4060,c11,32,128,32,4,2,8,0.0,425.365,297.9840040206909,326.7788788676262,14.41341561308027,2,-1,-1,64x4096x8192,0,
2026-03-03T06:03:39.863417+00:00,FULL,llm_style,tune,llm_style_tune_031,1,6144,1024,bf16,NVIDIA GeForce RTX 4060,c02,32,64,32,2,2,8,0.0,81.701,41.98399931192398,59.867201298475266,0.29970732198507577,5,-1,-1,1x6144x1024,0,
2026-03-03T06:03:39.955022+00:00,FULL,llm_style,tune,llm_style_tune_032,64,1024,4096,bf16,NVIDIA GeForce RTX 4060,c04,64,64,64,4,3,8,0.0,91.559,58.35200101137161,68.60800087451935,9.200557010810561,3,-1,-1,64x1024x4096,0,
2026-03-03T06:03:40.355950+00:00,FULL,llm_style,tune,llm_style_tune_033,2,4096,8192,bf16,NVIDIA GeForce RTX 4060,c11,32,128,32,4,2,8,0.0,400.885,291.83998703956604,331.43808394670486,0.4599017748099184,6,-1,-1,2x4096x8192,0,
2026-03-03T06:03:40.916657+00:00,FULL,llm_style,tune,llm_style_tune_034,1,8192,6144,bf16,NVIDIA GeForce RTX 4060,c11,32,128,32,4,2,8,0.0,560.662,424.8639941215515,449.1571268439293,0.2369306351980505,5,-1,-1,1x8192x6144,0,
2026-03-03T06:03:40.977104+00:00,FULL,llm_style,tune,llm_style_tune_035,64,1536,1024,bf16,NVIDIA GeForce RTX 4060,c04,64,64,64,4,3,8,0.0,60.407,37.79200091958046,44.83584050089121,5.327227643447967,3,-1,-1,64x1536x1024,0,
2026-03-03T06:03:41.056484+00:00,FULL,llm_style,tune,llm_style_tune_036,32,3072,2048,bf16,NVIDIA GeForce RTX 4060,c02,32,64,32,2,2,8,0.0,79.341,51.952000707387924,75.8822400122881,7.750484649626593,3,-1,-1,32x3072x2048,0,
2026-03-03T06:03:41.185651+00:00,FULL,llm_style,tune,llm_style_tune_037,4,1536,6144,bf16,NVIDIA GeForce RTX 4060,c04,64,64,64,4,3,8,0.0,129.124,71.68000191450119,127.0102374255656,1.0532571147256975,7,-1,-1,4x1536x6144,0,
2026-03-03T06:03:41.287790+00:00,FULL,llm_style,tune,llm_style_tune_038,1,4096,1536,bf16,NVIDIA GeForce RTX 4060,c11,32,128,32,4,2,8,0.0,102.095,47.759998589754105,50.63551988452673,0.2634613143120862,7,-1,-1,1x4096x1536,0,
2026-03-03T06:03:41.381441+00:00,FULL,llm_style,tune,llm_style_tune_039,4,1536,4096,bf16,NVIDIA GeForce RTX 4060,c04,64,64,64,4,3,8,0.0,93.605,56.07999861240387,62.317119054496274,0.8974973117932203,7,-1,-1,4x1536x4096,0,
2026-03-03T06:03:41.967598+00:00,FULL,llm_style,tune,llm_style_tune_040,2,6144,8192,bf16,NVIDIA GeForce RTX 4060,c06,64,128,32,4,3,8,0.0,586.11,422.2240000963211,464.79615926742554,0.47682413115803873,4,-1,-1,2x6144x8192,0,
2026-03-03T06:03:42.031122+00:00,FULL,llm_style,tune,llm_style_tune_041,16,1024,1536,bf16,NVIDIA GeForce RTX 4060,c00,32,32,32,2,2,8,0.0,63.477,35.840000957250595,113.18272106349468,1.404342819634263,7,-1,-1,16x1024x1536,0,
2026-03-03T06:03:42.060003+00:00,FULL,llm_style,tune,llm_style_tune_042,32,3072,2048,bf16,NVIDIA GeForce RTX 4060,c02,32,64,32,2,2,8,0.0,0.0,59.87200140953064,126.91903755068779,6.725233406610394,3,-1,-1,32x3072x2048,0,
2026-03-03T06:03:42.175564+00:00,FULL,llm_style,tune,llm_style_tune_043,2,2048,4096,bf16,NVIDIA GeForce RTX 4060,c00,32,32,32,2,2,8,0.0,115.507,63.90399858355522,233.88159707188598,0.5250756250585351,7,-1,-1,2x2048x4096,0,
2026-03-03T06:03:42.407194+00:00,FULL,llm_style,tune,llm_style_tune_044,64,2048,8192,bf16,NVIDIA GeForce RTX 4060,c04,64,64,64,4,3,8,0.0,231.586,168.8160002231598,205.4723143577575,12.720853741121795,2,-1,-1,64x2048x8192,0,
2026-03-03T06:03:42.534997+00:00,FULL,llm_style,tune,llm_style_tune_045,2,3072,8192,bf16,NVIDIA GeForce RTX 4060,c10,64,128,64,8,3,8,0.0,0.0,230.71999847888947,335.3091210126877,0.43630069635775653,6,-1,-1,2x3072x8192,0,
2026-03-03T06:03:43.092399+00:00,FULL,llm_style,tune,llm_style_tune_046,4,8192,6144,bf16,NVIDIA GeForce RTX 4060,c10,64,128,64,8,3,8,0.0,557.352,425.9839951992035,453.6524772644043,0.9452307798834243,5,-1,-1,4x8192x6144,0,
2026-03-03T06:03:43.218314+00:00,FULL,llm_style,tune,llm_style_tune_047,1,1024,6144,bf16,NVIDIA GeForce RTX 4060,c04,64,64,64,4,3,8,0.0,125.868,71.68000191450119,94.73727732896802,0.1755428524542829,7,-1,-1,1x1024x6144,0,
2026-03-03T06:03:43.387352+00:00,FULL,llm_style,tune,llm_style_tune_048,32,4096,3072,bf16,NVIDIA GeForce RTX 4060,c02,32,64,32,2,2,8,0.0,168.992,84.111999720335,97.73471869528294,9.574214983326668,3,-1,-1,32x4096x3072,0,
2026-03-03T06:03:43.451347+00:00,FULL,llm_style,tune,llm_style_tune_049,16,2048,1024,bf16,NVIDIA GeForce RTX 4060,c00,32,32,32,2,2,8,0.0,63.952,39.93599861860275,129.0649589896202,1.6804103145361124,7,-1,-1,16x2048x1024,0,
2026-03-03T06:03:43.511021+00:00,FULL,llm_style,tune,llm_style_tune_050,4,1024,1536,bf16,NVIDIA GeForce RTX 4060,c04,64,64,64,4,3,8,0.0,59.637,40.95999896526337,67.3977600783109,0.307200007760525,7,-1,-1,4x1024x1536,0,
2026-03-03T06:03:43.680558+00:00,FULL,llm_style,tune,llm_style_tune_051,64,4096,8192,bf16,NVIDIA GeForce RTX 4060,c11,32,128,32,4,2,8,0.0,0.0,306.207999587059,430.5865621566772,14.026306634026664,2,-1,-1,64x4096x8192,0,
2026-03-03T06:03:43.746472+00:00,FULL,llm_style,tune,llm_style_tune_052,16,2048,1536,bf16,NVIDIA GeForce RTX 4060,c00,32,32,32,2,2,8,0.0,65.856,43.84000040590763,186.79808348417274,2.2961518035578115,7,-1,-1,16x2048x1536,0,
2026-03-03T06:03:43.797496+00:00,FULL,llm_style,tune,llm_style_tune_053,64,1024,1024,bf16,NVIDIA GeForce RTX 4060,c04,64,64,64,4,3,8,0.0,50.985,35.58399900794029,54.76031869649884,3.771856220264911,3,-1,-1,64x1024x1024,0,
2026-03-03T06:03:44.200461+00:00,FULL,llm_style,tune,llm_style_tune_054,4,4096,8192,bf16,NVIDIA GeForce RTX 4060,c11,32,128,32,4,2,8,0.0,402.929,292.86399483680725,307.64255851507187,0.9165874287468502,6,-1,-1,4x4096x8192,0,
2026-03-03T06:03:44.351633+00:00,FULL,llm_style,tune,llm_style_tune_055,1,4096,3072,bf16,NVIDIA GeForce RTX 4060,c00,32,32,32,2,2,8,0.0,151.126,70.65600156784058,165.95424011349678,0.35617390514006025,7,-1,-1,1x4096x3072,0,
2026-03-03T06:03:44.367981+00:00,FULL,llm_style,tune,llm_style_tune_056,64,1536,2048,bf16,NVIDIA GeForce RTX 4060,c04,64,64,64,4,3,8,0.0,0.0,38.863999769091606,56.764799878001206,10.360569843359986,3,-1,-1,64x1536x2048,0,
2026-03-03T06:03:44.477079+00:00,FULL,llm_style,tune,llm_style_tune_057,2,4096,2048,bf16,NVIDIA GeForce RTX 4060,c11,32,128,32,4,2,8,0.0,109.046,52.22399905323982,65.09567968547343,0.6425098155695218,7,-1,-1,2x4096x2048,0,
2026-03-03T06:03:44.651813+00:00,FULL,llm_style,tune,llm_style_tune_058,4,8192,1536,bf16,NVIDIA GeForce RTX 4060,c00,32,32,32,2,2,8,0.0,174.687,70.30399888753891,279.69535797834396,1.4318288801896608,5,-1,-1,4x8192x1536,0,
2026-03-03T06:03:44.751238+00:00,FULL,llm_style,tune,llm_style_tune_059,1,1536,4096,bf16,NVIDIA GeForce RTX 4060,c04,64,64,64,4,3,8,0.0,99.379,58.36800113320351,62.90463835000992,0.21557894318299728,7,-1,-1,1x1536x4096,0,
2026-03-03T06:03:44.784065+00:00,FULL,llm_style,tune,llm_style_tune_060,64,1536,4096,bf16,NVIDIA GeForce RTX 4060,c04,64,64,64,4,3,8,0.0,0.0,62.463998794555664,175.36159753799438,12.892328117651509,3,-1,-1,64x1536x4096,0,
2026-03-03T06:03:45.366511+00:00,FULL,llm_style,tune,llm_style_tune_061,8,8192,6144,bf16,NVIDIA GeForce RTX 4060,c04,64,64,64,4,3,8,0.0,582.326,432.12801218032837,559.8598164319992,1.8635828858600891,5,-1,-1,8x8192x6144,0,
2026-03-03T06:03:45.492818+00:00,FULL,llm_style,tune,llm_style_tune_062,64,6144,1536,bf16,NVIDIA GeForce RTX 4060,c06,64,128,32,4,3,8,0.0,126.252,65.34399837255478,85.06111875176427,18.486159128385335,1,-1,-1,64x6144x1536,0,
2026-03-03T06:03:45.552155+00:00,FULL,llm_style,tune,llm_style_tune_063,2,1536,1024,bf16,NVIDIA GeForce RTX 4060,c04,64,64,64,4,3,8,0.0,59.296,36.86400130391121,46.4227195084095,0.17066666063004093,7,-1,-1,2x1536x1024,0,
2026-03-03T06:03:45.603123+00:00,FULL,llm_style,eval,llm_style_eval_000,32,1536,1024,bf16,NVIDIA GeForce RTX 4060,c04,64,64,64,4,3,8,0.0,50.928,35.87200120091438,59.975679777562604,2.8061801023087076,3,-1,-1,32x1536x1024,0,
2026-03-03T06:03:45.854238+00:00,FULL,llm_style,eval,llm_style_eval_001,32,2048,8192,bf16,NVIDIA GeForce RTX 4060,c10,64,128,64,8,3,8,0.0,251.078,165.42399674654007,213.1856003403663,6.490846824630707,2,-1,-1,32x2048x8192,0,
2026-03-03T06:03:46.000410+00:00,FULL,llm_style,eval,llm_style_eval_002,16,2048,4096,bf16,NVIDIA GeForce RTX 4060,c03,64,64,32,4,2,8,0.0,146.13,77.69600301980972,84.33023758232594,3.454945499983551,7,-1,-1,16x2048x4096,0,
2026-03-03T06:03:46.022634+00:00,FULL,llm_style,eval,llm_style_eval_003,16,2048,1536,bf16,NVIDIA GeForce RTX 4060,c00,32,32,32,2,2,8,0.0,0.0,57.679999619722366,184.0003190934657,1.7452027854310261,7,-1,-1,16x2048x1536,0,
2026-03-03T06:03:46.261039+00:00,FULL,llm_style,eval,llm_style_eval_004,64,8192,2048,bf16,NVIDIA GeForce RTX 4060,c06,64,128,32,4,3,8,0.0,238.349,170.75200378894806,225.97248449921602,12.576623409083508,1,-1,-1,64x8192x2048,0,
2026-03-03T06:03:46.568847+00:00,FULL,llm_style,eval,llm_style_eval_005,64,3072,8192,bf16,NVIDIA GeForce RTX 4060,c06,64,128,32,4,3,8,0.0,307.764,233.47200453281403,240.13824298977852,13.797052363711826,2,-1,-1,64x3072x8192,0,
2026-03-03T06:03:46.656012+00:00,FULL,llm_style,eval,llm_style_eval_006,32,2048,2048,bf16,NVIDIA GeForce RTX 4060,c11,32,128,32,4,2,8,0.0,87.118,52.1440003067255,55.67135915160179,5.147964375977831,3,-1,-1,32x2048x2048,0,
2026-03-03T06:03:46.885912+00:00,FULL,llm_style,eval,llm_style_eval_007,8,8192,2048,bf16,NVIDIA GeForce RTX 4060,c11,32,128,32,4,2,8,0.0,229.859,160.51200032234192,179.2204810678959,1.672370012590492,5,-1,-1,8x8192x2048,0,
2026-03-03T06:03:47.092699+00:00,FULL,llm_style,eval,llm_style_eval_008,64,1536,8192,bf16,NVIDIA GeForce RTX 4060,c04,64,64,64,4,3,8,0.0,206.744,106.84799775481224,113.76480184495449,15.073869139746803,2,-1,-1,64x1536x8192,0,
2026-03-03T06:03:47.414098+00:00,FULL,llm_style,eval,llm_style_eval_009,64,4096,6144,bf16,NVIDIA GeForce RTX 4060,c02,32,64,32,2,2,8,0.0,321.355,233.21600258350372,257.0527973771095,13.812197432063565,3,-1,-1,64x4096x6144,0,
2026-03-03T06:03:47.551321+00:00,FULL,llm_style,eval,llm_style_eval_010,64,2048,4096,bf16,NVIDIA GeForce RTX 4060,c03,64,64,32,4,2,8,0.0,137.174,77.82399654388428,94.96287845075125,13.797053244297551,3,-1,-1,64x2048x4096,0,
2026-03-03T06:03:47.824086+00:00,FULL,llm_style,eval,llm_style_eval_011,32,3072,6144,bf16,NVIDIA GeForce RTX 4060,c04,64,64,64,4,3,8,0.0,272.718,179.19999361038208,188.43647673726082,6.740845954639678,3,-1,-1,32x3072x6144,0,
2026-03-03T06:03:47.894315+00:00,FULL,llm_style,eval,llm_style_eval_012,16,1536,1536,bf16,NVIDIA GeForce RTX 4060,c00,32,32,32,2,2,8,0.0,70.186,26.688000187277794,132.94656015932554,2.828892066479741,7,-1,-1,16x1536x1536,0,
2026-03-03T06:03:47.998869+00:00,FULL,llm_style,eval,llm_style_eval_013,64,2048,3072,bf16,NVIDIA GeForce RTX 4060,c03,64,64,32,4,2,8,0.0,104.509,63.48799914121628,84.18111786246294,12.684387268352213,3,-1,-1,64x2048x3072,0,
2026-03-03T06:03:48.627787+00:00,FULL,llm_style,eval,llm_style_eval_014,16,8192,6144,bf16,NVIDIA GeForce RTX 4060,c02,32,64,32,2,2,8,0.0,628.869,429.0879964828491,490.2297767996787,3.7535721092220697,5,-1,-1,16x8192x6144,0,
2026-03-03T06:03:48.676575+00:00,FULL,llm_style,eval,llm_style_eval_015,64,6144,1536,bf16,NVIDIA GeForce RTX 4060,c06,64,128,32,4,3,8,0.0,0.0,65.91999903321266,147.97824159264565,18.32462939496389,1,-1,-1,64x6144x1536,0,
2026-03-03T06:03:48.922140+00:00,FULL,llm_style,eval,llm_style_eval_016,16,4096,4096,bf16,NVIDIA GeForce RTX 4060,c06,64,128,32,4,3,8,0.0,245.51,163.82399946451187,179.78367745876312,3.2771200419649067,7,-1,-1,16x4096x4096,0,
2026-03-03T06:03:49.369431+00:00,FULL,llm_style,eval,llm_style_eval_017,64,8192,4096,bf16,NVIDIA GeForce RTX 4060,c00,32,32,32,2,2,8,0.0,447.248,305.4880052804947,319.1091200709343,14.05936475985832,1,-1,-1,64x8192x4096,0,
2026-03-03T06:03:49.712514+00:00,FULL,llm_style,eval,llm_style_eval_018,32,4096,6144,bf16,NVIDIA GeForce RTX 4060,c02,32,64,32,2,2,8,0.0,343.037,230.3999960422516,279.48864102363575,6.990506786747687,3,-1,-1,32x4096x6144,0,
2026-03-03T06:03:50.019189+00:00,FULL,llm_style,eval,llm_style_eval_019,16,3072,8192,bf16,NVIDIA GeForce RTX 4060,c06,64,128,32,4,3,8,0.0,306.631,228.7359982728958,333.18047553300823,3.520680496644962,6,-1,-1,16x3072x8192,0,
2026-03-03T06:03:50.092837+00:00,FULL,llm_style,eval,llm_style_eval_020,4,1536,1536,bf16,NVIDIA GeForce RTX 4060,c00,32,32,32,2,2,8,0.0,73.608,40.79999960958958,91.21184073388574,0.46260706325016226,7,-1,-1,4x1536x1536,0,
2026-03-03T06:03:50.205856+00:00,FULL,llm_style,eval,llm_style_eval_021,4,6144,1536,bf16,NVIDIA GeForce RTX 4060,c11,32,128,32,4,2,8,0.0,112.981,46.94399982690811,50.718720369040966,1.6082454047029278,5,-1,-1,4x6144x1536,0,
2026-03-03T06:03:50.233071+00:00,FULL,llm_style,eval,llm_style_eval_022,32,6144,1024,bf16,NVIDIA GeForce RTX 4060,c11,32,128,32,4,2,8,0.0,0.0,68.39999929070473,171.0332806408405,5.886742517184776,1,-1,-1,32x6144x1024,0,
2026-03-03T06:03:50.242588+00:00,FULL,llm_style,eval,llm_style_eval_023,16,1024,1536,bf16,NVIDIA GeForce RTX 4060,c00,32,32,32,2,2,8,0.0,0.0,33.79200026392937,117.50400252640242,1.4894545338212952,7,-1,-1,16x1024x1536,0,
2026-03-03T06:03:50.340195+00:00,FULL,llm_style,eval,llm_style_eval_024,32,8192,1024,bf16,NVIDIA GeForce RTX 4060,c11,32,128,32,4,2,8,0.0,97.569,48.128001391887665,59.330559112131596,11.155063507176793,1,-1,-1,32x8192x1024,0,
2026-03-03T06:03:50.765157+00:00,FULL,llm_style,eval,llm_style_eval_025,32,6144,6144,bf16,NVIDIA GeForce RTX 4060,c06,64,128,32,4,3,8,0.0,424.916,329.69599962234497,503.9718386530874,7.327717372268238,1,-1,-1,32x6144x6144,0,
2026-03-03T06:03:50.906960+00:00,FULL,llm_style,eval,llm_style_eval_026,1,6144,2048,bf16,NVIDIA GeForce RTX 4060,c00,32,32,32,2,2,8,0.0,141.76,62.463998794555664,105.31903706490984,0.40288525367660966,5,-1,-1,1x6144x2048,0,
2026-03-03T06:03:50.968283+00:00,FULL,llm_style,eval,llm_style_eval_027,32,4096,3072,bf16,NVIDIA GeForce RTX 4060,c02,32,64,32,2,2,8,0.0,0.0,88.86399865150452,140.57055547833428,9.062234203056152,3,-1,-1,32x4096x3072,0,
2026-03-03T06:03:51.034300+00:00,FULL,llm_style,eval,llm_style_eval_028,64,1536,1536,bf16,NVIDIA GeForce RTX 4060,c04,64,64,64,4,3,8,0.0,65.962,45.05600035190582,63.047680817544446,6.702545402195828,3,-1,-1,64x1536x1536,0,
2026-03-03T06:03:51.095528+00:00,FULL,llm_style,eval,llm_style_eval_029,2,3072,1024,bf16,NVIDIA GeForce RTX 4060,c00,32,32,32,2,2,8,0.0,61.185,38.91199827194214,57.81663961708543,0.3233684354132238,7,-1,-1,2x3072x1024,0,
2026-03-03T06:03:51.287993+00:00,FULL,llm_style,eval,llm_style_eval_030,32,1536,8192,bf16,NVIDIA GeForce RTX 4060,c04,64,64,64,4,3,8,0.0,192.427,88.8959988951683,100.41727721691132,9.058972034834406,2,-1,-1,32x1536x8192,0,
2026-03-03T06:03:51.375899+00:00,FULL,llm_style,eval,llm_style_eval_031,8,3072,2048,bf16,NVIDIA GeForce RTX 4060,c11,32,128,32,4,2,8,0.0,87.866,50.175998359918594,68.72000250965354,2.0062041472085883,7,-1,-1,8x3072x2048,0,
2026-03-03T06:03:51.467584+00:00,FULL,llm_style,eval,llm_style_eval_032,8,2048,3072,bf16,NVIDIA GeForce RTX 4060,c11,32,128,32,4,2,8,0.0,91.642,62.463998794555664,70.66080145537853,1.6115410147064386,7,-1,-1,8x2048x3072,0,
2026-03-03T06:03:51.536211+00:00,FULL,llm_style,eval,llm_style_eval_033,64,1536,8192,bf16,NVIDIA GeForce RTX 4060,c04,64,64,64,4,3,8,0.0,0.0,111.61600053310394,223.56160730123509,14.429944885207671,2,-1,-1,64x1536x8192,0,
2026-03-03T06:03:51.690712+00:00,FULL,llm_style,eval,llm_style_eval_034,64,6144,2048,bf16,NVIDIA GeForce RTX 4060,c10,64,128,64,8,3,8,0.0,154.445,81.79199695587158,85.49791902303696,19.691568807996674,1,-1,-1,64x6144x2048,0,
2026-03-03T06:03:51.824439+00:00,FULL,llm_style,eval,llm_style_eval_035,4,4096,2048,bf16,NVIDIA GeForce RTX 4060,c11,32,128,32,4,2,8,0.0,133.686,51.6160000115633,55.65504092723131,1.3001562303348944,7,-1,-1,4x4096x2048,0,
2026-03-03T06:03:51.995953+00:00,FULL,llm_style,eval,llm_style_eval_036,64,8192,4096,bf16,NVIDIA GeForce RTX 4060,c00,32,32,32,2,2,8,0.0,0.0,304.1279911994934,359.01919811964024,14.122236098888731,1,-1,-1,64x8192x4096,0,
2026-03-03T06:03:52.027890+00:00,FULL,llm_style,eval,llm_style_eval_037,32,6144,1024,bf16,NVIDIA GeForce RTX 4060,c11,32,128,32,4,2,8,0.0,0.0,42.79999993741512,224.05791223049135,9.407784686653855,1,-1,-1,32x6144x1024,0,
2026-03-03T06:03:52.087575+00:00,FULL,llm_style,eval,llm_style_eval_038,64,6144,2048,bf16,NVIDIA GeForce RTX 4060,c10,64,128,64,8,3,8,0.0,0.0,75.84000006318092,104.77568186819548,21.236982260788867,1,-1,-1,64x6144x2048,0,
2026-03-03T06:03:52.171211+00:00,FULL,llm_style,eval,llm_style_eval_039,8,1024,3072,bf16,NVIDIA GeForce RTX 4060,c04,64,64,64,4,3,8,0.0,83.588,50.783999264240265,62.322879545390606,0.9910926419582163,7,-1,-1,8x1024x3072,0,
2026-03-03T06:03:52.394235+00:00,FULL,llm_style,eval,llm_style_eval_040,32,8192,2048,bf16,NVIDIA GeForce RTX 4060,c00,32,32,32,2,2,8,0.0,222.981,162.81600296497345,177.2134403884411,6.594817489967455,1,-1,-1,32x8192x2048,0,
2026-03-03T06:03:52.485893+00:00,FULL,llm_style,eval,llm_style_eval_041,32,3072,1024,bf16,NVIDIA GeForce RTX 4060,c00,32,32,32,2,2,8,0.0,91.612,44.943999499082565,151.0809588432311,4.479498803930649,3,-1,-1,32x3072x1024,0,
2026-03-03T06:03:52.507092+00:00,FULL,llm_style,eval,llm_style_eval_042,64,1024,4096,bf16,NVIDIA GeForce RTX 4060,c04,64,64,64,4,3,8,0.0,0.0,65.0239996612072,159.36447679996485,8.256503980026515,3,-1,-1,64x1024x4096,0,
2026-03-03T06:03:52.519545+00:00,FULL,llm_style,eval,llm_style_eval_043,2,1536,1024,bf16,NVIDIA GeForce RTX 4060,c04,64,64,64,4,3,8,0.0,0.0,62.511999160051346,145.0534412264824,0.10064397370962007,7,-1,-1,2x1536x1024,0,
2026-03-03T06:03:52.750289+00:00,FULL,llm_style,eval,llm_style_eval_044,64,6144,3072,bf16,NVIDIA GeForce RTX 4060,c02,32,64,32,2,2,8,0.0,230.707,181.2479943037033,205.2160046994686,13.329356351120941,1,-1,-1,64x6144x3072,0,
2026-03-03T06:03:52.895686+00:00,FULL,llm_style,eval,llm_style_eval_045,64,1536,6144,bf16,NVIDIA GeForce RTX 4060,c04,64,64,64,4,3,8,0.0,145.349,71.68000191450119,155.26335939764962,16.85211383561116,3,-1,-1,64x1536x6144,0,
2026-03-03T06:03:53.153193+00:00,FULL,llm_style,eval,llm_style_eval_046,2,6144,3072,bf16,NVIDIA GeForce RTX 4060,c11,32,128,32,4,2,8,0.0,257.466,176.12800002098083,250.69567501544935,0.4286511627396356,5,-1,-1,2x6144x3072,0,
2026-03-03T06:03:53.576841+00:00,FULL,llm_style,eval,llm_style_eval_047,16,4096,8192,bf16,NVIDIA GeForce RTX 4060,c03,64,64,32,4,2,8,0.0,423.604,295.8879917860031,316.4364755153656,3.6288793523481986,6,-1,-1,16x4096x8192,0,
2026-03-03T06:03:53.615404+00:00,FULL,llm_style,eval,llm_style_eval_048,16,1024,6144,bf16,NVIDIA GeForce RTX 4060,c04,64,64,64,4,3,8,0.0,0.0,94.12800148129463,147.12287753820414,2.1388597317665154,7,-1,-1,16x1024x6144,0,
2026-03-03T06:03:53.757929+00:00,FULL,llm_style,eval,llm_style_eval_049,16,8192,1536,bf16,NVIDIA GeForce RTX 4060,c11,32,128,32,4,2,8,0.0,142.473,68.36799904704094,71.55456095933914,5.889497858829428,5,-1,-1,16x8192x1536,0,
2026-03-03T06:03:53.811727+00:00,FULL,llm_style,eval,llm_style_eval_050,1,1024,1024,bf16,NVIDIA GeForce RTX 4060,c04,64,64,64,4,3,8,0.0,53.758,37.88800165057182,64.96800057590002,0.05535134893999744,7,-1,-1,1x1024x1024,0,
2026-03-03T06:03:53.888300+00:00,FULL,llm_style,eval,llm_style_eval_051,16,6144,1024,bf16,NVIDIA GeForce RTX 4060,c11,32,128,32,4,2,8,0.0,76.53,39.93599861860275,43.53023983538151,5.041230943608337,5,-1,-1,16x6144x1024,0,
2026-03-03T06:03:54.667873+00:00,FULL,llm_style,eval,llm_style_eval_052,16,8192,8192,bf16,NVIDIA GeForce RTX 4060,c11,32,128,32,4,2,8,0.0,779.53,560.1279735565186,959.4595587253557,3.8339160859340877,4,-1,-1,16x8192x8192,0,
2026-03-03T06:03:55.215123+00:00,FULL,llm_style,eval,llm_style_eval_053,1,6144,8192,bf16,NVIDIA GeForce RTX 4060,c10,64,128,64,8,3,8,0.0,547.207,427.0080029964447,595.5385476350784,0.23574100553997843,4,-1,-1,1x6144x8192,0,
2026-03-03T06:03:55.394348+00:00,FULL,llm_style,eval,llm_style_eval_054,64,4096,3072,bf16,NVIDIA GeForce RTX 4060,c11,32,128,32,4,2,8,0.0,179.18,96.99200093746185,145.21344065666193,16.605624385855126,3,-1,-1,64x4096x3072,0,
2026-03-03T06:03:55.500262+00:00,FULL,llm_style,eval,llm_style_eval_055,4,8192,1024,bf16,NVIDIA GeForce RTX 4060,c11,32,128,32,4,2,8,0.0,105.871,48.128001391887665,75.01856047660105,1.3943829383970991,5,-1,-1,4x8192x1024,0,
2026-03-03T06:03:55.576009+00:00,FULL,llm_style,eval,llm_style_eval_056,64,1024,3072,bf16,NVIDIA GeForce RTX 4060,c04,64,64,64,4,3,8,0.0,75.702,50.23999884724617,59.823680296540246,8.01459381446763,3,-1,-1,64x1024x3072,0,
2026-03-03T06:03:55.579881+00:00,FULL,llm_style,eval,llm_style_eval_057,64,1024,3072,bf16,NVIDIA GeForce RTX 4060,c04,64,64,64,4,3,8,0.0,0.0,48.847999423742294,53.20095904171467,8.24298208217495,3,-1,-1,64x1024x3072,0,
2026-03-03T06:03:55.700351+00:00,FULL,llm_style,eval,llm_style_eval_058,32,2048,4096,bf16,NVIDIA GeForce RTX 4060,c02,32,64,32,2,2,8,0.0,120.445,74.41600039601326,114.20704081654546,7.214455347545958,3,-1,-1,32x2048x4096,0,
2026-03-03T06:03:55.796009+00:00,FULL,llm_style,eval,llm_style_eval_059,64,8192,2048,bf16,NVIDIA GeForce RTX 4060,c06,64,128,32,4,3,8,0.0,0.0,199.79199767112732,264.0793637931346,10.748596905942748,1,-1,-1,64x8192x2048,0,
2026-03-03T06:03:56.035285+00:00,FULL,llm_style,eval,llm_style_eval_060,1,3072,6144,bf16,NVIDIA GeForce RTX 4060,c04,64,64,64,4,3,8,0.0,239.223,176.88000202178955,197.27359592914578,0.213414380192905,7,-1,-1,1x3072x6144,0,
2026-03-03T06:03:56.077309+00:00,FULL,llm_style,eval,llm_style_eval_061,64,1536,4096,bf16,NVIDIA GeForce RTX 4060,c04,64,64,64,4,3,8,0.0,0.0,89.12000060081482,196.33088350296015,9.036202452546181,3,-1,-1,64x1536x4096,0,
2026-03-03T06:03:56.227483+00:00,FULL,llm_style,eval,llm_style_eval_062,16,6144,2048,bf16,NVIDIA GeForce RTX 4060,c00,32,32,32,2,2,8,0.0,150.123,69.63200122117996,108.33504222333423,5.782588133881251,5,-1,-1,16x6144x2048,0,
2026-03-03T06:03:56.274134+00:00,FULL,llm_style,eval,llm_style_eval_063,64,1536,6144,bf16,NVIDIA GeForce RTX 4060,c04,64,64,64,4,3,8,0.0,0.0,83.79199728369713,109.56799983978271,14.416168502466585,3,-1,-1,64x1536x6144,0,
2026-03-03T06:03:56.332913+00:00,FULL,llm_style,eval,llm_style_eval_064,1,6144,2048,bf16,NVIDIA GeForce RTX 4060,c00,32,32,32,2,2,8,0.0,0.0,69.63200122117996,151.5193584561348,0.36141175836757816,5,-1,-1,1x6144x2048,0,
2026-03-03T06:03:56.469512+00:00,FULL,llm_style,eval,llm_style_eval_065,8,1536,6144,bf16,NVIDIA GeForce RTX 4060,c00,32,32,32,2,2,8,0.0,136.544,68.52800026535988,259.5814444124695,2.2034050813580532,7,-1,-1,8x1536x6144,0,
2026-03-03T06:03:56.503171+00:00,FULL,llm_style,eval,llm_style_eval_066,64,1536,4096,bf16,NVIDIA GeForce RTX 4060,c04,64,64,64,4,3,8,0.0,0.0,81.91999793052673,152.22367957234383,9.8304002483368,3,-1,-1,64x1536x4096,0,
2026-03-03T06:03:56.587270+00:00,FULL,llm_style,eval,llm_style_eval_067,64,8192,2048,bf16,NVIDIA GeForce RTX 4060,c06,64,128,32,4,3,8,0.0,0.0,169.64799910783768,278.15392345190037,12.658467292826368,1,-1,-1,64x8192x2048,0,
2026-03-03T06:03:56.609226+00:00,FULL,llm_style,eval,llm_style_eval_068,64,1024,4096,bf16,NVIDIA GeForce RTX 4060,c04,64,64,64,4,3,8,0.0,0.0,66.56000018119812,174.80703577399248,8.06596920881102,3,-1,-1,64x1024x4096,0,
2026-03-03T06:03:56.650487+00:00,FULL,llm_style,eval,llm_style_eval_069,64,2048,4096,bf16,NVIDIA GeForce RTX 4060,c03,64,64,32,4,2,8,0.0,0.0,88.76799792051315,165.36992371082306,12.096046426117177,3,-1,-1,64x2048x4096,0,
2026-03-03T06:03:56.764764+00:00,FULL,llm_style,eval,llm_style_eval_070,64,8192,1024,bf16,NVIDIA GeForce RTX 4060,c06,64,128,32,4,3,8,0.0,114.224,64.51199948787689,213.18463727831835,16.644063624190995,1,-1,-1,64x8192x1024,0,
2026-03-03T06:03:56.834592+00:00,FULL,llm_style,eval,llm_style_eval_071,64,6144,2048,bf16,NVIDIA GeForce RTX 4060,c10,64,128,64,8,3,8,0.0,0.0,86.01599931716919,194.30399492382998,18.72457157721487,1,-1,-1,64x6144x2048,0,
2026-03-03T06:03:56.847258+00:00,FULL,llm_style,eval,llm_style_eval_072,64,1536,1024,bf16,NVIDIA GeForce RTX 4060,c04,64,64,64,4,3,8,0.0,0.0,65.31199812889099,170.44095292687413,3.082536100069835,3,-1,-1,64x1536x1024,0,
2026-03-03T06:03:56.876221+00:00,FULL,llm_style,eval,llm_style_eval_073,1,4096,1536,bf16,NVIDIA GeForce RTX 4060,c11,32,128,32,4,2,8,0.0,0.0,69.63200122117996,199.5468841493129,0.18070587918378908,7,-1,-1,1x4096x1536,0,
2026-03-03T06:03:56.945126+00:00,FULL,llm_style,eval,llm_style_eval_074,8,1024,2048,bf16,NVIDIA GeForce RTX 4060,c04,64,64,64,4,3,8,0.0,68.862,45.05600035190582,71.19455825537439,0.7447272669106476,7,-1,-1,8x1024x2048,0,
2026-03-03T06:03:57.042580+00:00,FULL,llm_style,eval,llm_style_eval_075,2,6144,1024,bf16,NVIDIA GeForce RTX 4060,c11,32,128,32,4,2,8,0.0,97.417,41.74400120973587,275.0889533758155,0.6028608487614413,5,-1,-1,2x6144x1024,0,
2026-03-03T06:03:57.068917+00:00,FULL,llm_style,eval,llm_style_eval_076,64,1024,6144,bf16,NVIDIA GeForce RTX 4060,c04,64,64,64,4,3,8,0.0,0.0,77.7439996600151,118.20384219288826,10.358437583887017,3,-1,-1,64x1024x6144,0,
2026-03-03T06:03:57.470936+00:00,FULL,llm_style,eval,llm_style_eval_077,1,4096,8192,bf16,NVIDIA GeForce RTX 4060,c02,32,64,32,2,2,8,0.0,401.968,292.7519977092743,341.2265661358832,0.22923452111382128,6,-1,-1,1x4096x8192,0,
2026-03-03T06:03:57.579378+00:00,FULL,llm_style,eval,llm_style_eval_078,64,6144,3072,bf16,NVIDIA GeForce RTX 4060,c02,32,64,32,2,2,8,0.0,0.0,185.16799807548523,240.37151545286164,13.047174074945342,1,-1,-1,64x6144x3072,0,
2026-03-03T06:03:57.726704+00:00,FULL,llm_style,eval,llm_style_eval_079,2,3072,4096,bf16,NVIDIA GeForce RTX 4060,c00,32,32,32,2,2,8,0.0,147.266,79.8719972372055,216.05376198887797,0.6301538679510421,7,-1,-1,2x3072x4096,0,
2026-03-03T06:03:57.811059+00:00,FULL,llm_style,eval,llm_style_eval_080,4,1536,1024,bf16,NVIDIA GeForce RTX 4060,c11,32,128,32,4,2,8,0.0,84.31,40.95999896526337,53.38047914206979,0.307200007760525,7,-1,-1,4x1536x1024,0,
2026-03-03T06:03:58.114754+00:00,FULL,llm_style,eval,llm_style_eval_081,4,4096,6144,bf16,NVIDIA GeForce RTX 4060,c00,32,32,32,2,2,8,0.0,303.651,223.02399575710297,334.9184000492096,0.9027126938361657,7,-1,-1,4x4096x6144,0,
2026-03-03T06:03:58.213884+00:00,FULL,llm_style,eval,llm_style_eval_082,64,6144,1024,bf16,NVIDIA GeForce RTX 4060,c10,64,128,64,8,3,8,0.0,99.091,54.27199974656105,60.7587206363678,14.838339691933468,1,-1,-1,64x6144x1024,0,
2026-03-03T06:03:58.301981+00:00,FULL,llm_style,eval,llm_style_eval_083,8,4096,4096,bf16,NVIDIA GeForce RTX 4060,c00,32,32,32,2,2,8,0.0,0.0,159.2159941792488,311.1596792936323,1.6859829779273907,7,-1,-1,8x4096x4096,0,
2026-03-03T06:03:58.470921+00:00,FULL,llm_style,eval,llm_style_eval_084,64,1024,8192,bf16,NVIDIA GeForce RTX 4060,c04,64,64,64,4,3,8,0.0,168.892,83.71199667453766,121.92575998604295,12.82661824654095,2,-1,-1,64x1024x8192,0,
2026-03-03T06:03:58.788379+00:00,FULL,llm_style,eval,llm_style_eval_085,1,3072,8192,bf16,NVIDIA GeForce RTX 4060,c11,32,128,32,4,2,8,0.0,317.418,230.3999960422516,329.97376739978785,0.21845333708586523,6,-1,-1,1x3072x8192,0,
2026-03-03T06:03:58.848677+00:00,FULL,llm_style,eval,llm_style_eval_086,8,1536,1024,bf16,NVIDIA GeForce RTX 4060,c04,64,64,64,4,3,8,0.0,60.254,35.840000957250595,45.174399204552174,0.7021714098171316,7,-1,-1,8x1536x1024,0,
2026-03-03T06:03:58.926215+00:00,FULL,llm_style,eval,llm_style_eval_087,16,1024,3072,bf16,NVIDIA GeForce RTX 4060,c00,32,32,32,2,2,8,0.0,77.493,51.05599947273731,130.21183557808396,1.9716252162246242,7,-1,-1,16x1024x3072,0,
2026-03-03T06:03:59.015619+00:00,FULL,llm_style,eval,llm_style_eval_088,8,4096,1536,bf16,NVIDIA GeForce RTX 4060,c00,32,32,32,2,2,8,0.0,89.367,46.76800034940243,148.59455838799477,2.152396836468254,7,-1,-1,8x4096x1536,0,
2026-03-03T06:03:59.265120+00:00,FULL,llm_style,eval,llm_style_eval_089,16,6144,3072,bf16,NVIDIA GeForce RTX 4060,c11,32,128,32,4,2,8,0.0,249.459,176.4800027012825,321.87392055988295,3.4223694852403286,5,-1,-1,16x6144x3072,0,
2026-03-03T06:03:59.388292+00:00,FULL,llm_style,eval,llm_style_eval_090,32,1536,3072,bf16,NVIDIA GeForce RTX 4060,c04,64,64,64,4,3,8,0.0,123.129,74.09600168466568,182.66719795763456,4.0756570008351405,3,-1,-1,32x1536x3072,0,
2026-03-03T06:03:59.478401+00:00,FULL,llm_style,eval,llm_style_eval_091,16,1024,4096,bf16,NVIDIA GeForce RTX 4060,c04,64,64,64,4,3,8,0.0,90.068,60.416001826524734,78.28799873590467,2.221559254870681,7,-1,-1,16x1024x4096,0,
2026-03-03T06:03:59.788688+00:00,FULL,llm_style,eval,llm_style_eval_092,1,4096,6144,bf16,NVIDIA GeForce RTX 4060,c11,32,128,32,4,2,8,0.0,310.242,227.29600220918655,296.6630473732948,0.22143657394237162,7,-1,-1,1x4096x6144,0,
2026-03-03T06:03:59.895967+00:00,FULL,llm_style,eval,llm_style_eval_093,32,2048,3072,bf16,NVIDIA GeForce RTX 4060,c11,32,128,32,4,2,8,0.0,107.235,62.224000692367554,70.22176176309586,6.4710269272253615,3,-1,-1,32x2048x3072,0,
2026-03-03T06:03:59.910017+00:00,FULL,llm_style,eval,llm_style_eval_094,32,1024,2048,bf16,NVIDIA GeForce RTX 4060,c04,64,64,64,4,3,8,0.0,0.0,47.10400104522705,126.7439974844455,2.8493912411204825,3,-1,-1,32x1024x2048,0,
2026-03-03T06:04:00.050683+00:00,FULL,llm_style,eval,llm_style_eval_095,8,6144,2048,bf16,NVIDIA GeForce RTX 4060,c11,32,128,32,4,2,8,0.0,140.623,67.58400052785873,74.77664284408092,2.9789090676425904,5,-1,-1,8x6144x2048,0,
2026-03-03T06:04:00.080858+00:00,FULL,llm_style,eval,llm_style_eval_096,64,2048,3072,bf16,NVIDIA GeForce RTX 4060,c03,64,64,32,4,2,8,0.0,0.0,64.51199948787689,163.8076788187027,12.483047718143245,3,-1,-1,64x2048x3072,0,
2026-03-03T06:04:00.105083+00:00,FULL,llm_style,eval,llm_style_eval_097,64,6144,1024,bf16,NVIDIA GeForce RTX 4060,c10,64,128,64,8,3,8,0.0,0.0,51.19999870657921,102.74816118180745,15.728640397338877,1,-1,-1,64x6144x1024,0,
2026-03-03T06:04:00.126977+00:00,FULL,llm_style,eval,llm_style_eval_098,32,6144,1024,bf16,NVIDIA GeForce RTX 4060,c11,32,128,32,4,2,8,0.0,0.0,42.320000007748604,53.95008027553557,9.51448922321068,1,-1,-1,32x6144x1024,0,
2026-03-03T06:04:00.199201+00:00,FULL,llm_style,eval,llm_style_eval_099,1,2048,2048,bf16,NVIDIA GeForce RTX 4060,c00,32,32,32,2,2,8,0.0,72.176,45.504000037908554,152.73215860128397,0.18434880434712558,7,-1,-1,1x2048x2048,0,
2026-03-03T06:04:00.245728+00:00,FULL,llm_style,eval,llm_style_eval_100,64,8192,1024,bf16,NVIDIA GeForce RTX 4060,c06,64,128,32,4,3,8,0.0,0.0,66.3359984755516,87.10496276617047,16.18641233531341,1,-1,-1,64x8192x1024,0,
2026-03-03T06:04:00.309640+00:00,FULL,llm_style,eval,llm_style_eval_101,64,8192,1536,bf16,NVIDIA GeForce RTX 4060,c06,64,128,32,4,3,8,0.0,0.0,96.25600278377533,174.43968340754492,16.73259526076519,1,-1,-1,64x8192x1536,0,
2026-03-03T06:04:00.337758+00:00,FULL,llm_style,eval,llm_style_eval_102,32,3072,2048,bf16,NVIDIA GeForce RTX 4060,c02,32,64,32,2,2,8,0.0,0.0,54.27199974656105,64.38655853271484,7.419169845966734,3,-1,-1,32x3072x2048,0,
2026-03-03T06:04:00.363292+00:00,FULL,llm_style,eval,llm_style_eval_103,64,2048,3072,bf16,NVIDIA GeForce RTX 4060,c03,64,64,32,4,2,8,0.0,0.0,78.5440020263195,145.70687741041178,10.252932715729814,3,-1,-1,64x2048x3072,0,
2026-03-03T06:04:00.425766+00:00,FULL,llm_style,eval,llm_style_eval_104,16,6144,2048,bf16,NVIDIA GeForce RTX 4060,c00,32,32,32,2,2,8,0.0,0.0,67.91999936103821,83.00543829798697,5.928344932096377,5,-1,-1,16x6144x2048,0,
2026-03-03T06:04:00.567179+00:00,FULL,llm_style,eval,llm_style_eval_105,1,1024,8192,bf16,NVIDIA GeForce RTX 4060,c04,64,64,64,4,3,8,0.0,141.361,83.96799862384796,194.07135769724843,0.19980488132338384,6,-1,-1,1x1024x8192,0,
2026-03-03T06:04:00.998401+00:00,FULL,llm_style,eval,llm_style_eval_106,32,4096,8192,bf16,NVIDIA GeForce RTX 4060,c10,64,128,64,8,3,8,0.0,431.177,302.0640015602112,455.7337489724157,7.10936634921039,2,-1,-1,32x4096x8192,0,
2026-03-03T06:04:01.058814+00:00,FULL,llm_style,eval,llm_style_eval_107,64,6144,1536,bf16,NVIDIA GeForce RTX 4060,c06,64,128,32,4,3,8,0.0,0.0,67.56800040602684,143.75520288944244,17.877686844973645,1,-1,-1,64x6144x1536,0,
2026-03-03T06:04:01.130927+00:00,FULL,llm_style,eval,llm_style_eval_108,8,3072,1536,bf16,NVIDIA GeForce RTX 4060,c11,32,128,32,4,2,8,0.0,72.059,45.05600035190582,52.19967857003211,1.675636350548957,7,-1,-1,8x3072x1536,0,
2026-03-03T06:04:01.142228+00:00,FULL,llm_style,eval,llm_style_eval_109,16,2048,1024,bf16,NVIDIA GeForce RTX 4060,c00,32,32,32,2,2,8,0.0,0.0,33.28000009059906,96.74688272178173,2.016492302202755,7,-1,-1,16x2048x1024,0,
2026-03-03T06:04:01.892807+00:00,FULL,llm_style,eval,llm_style_eval_110,1,8192,8192,bf16,NVIDIA GeForce RTX 4060,c10,64,128,64,8,3,8,0.0,750.534,559.1040253639221,678.5740822553632,0.24005859716827715,4,-1,-1,1x8192x8192,0,
2026-03-03T06:04:02.038624+00:00,FULL,llm_style,eval,llm_style_eval_111,8,6144,1536,bf16,NVIDIA GeForce RTX 4060,c11,32,128,32,4,2,8,0.0,145.771,69.63200122117996,99.54432234168044,2.168470550205469,5,-1,-1,8x6144x1536,0,
2026-03-03T06:04:02.138632+00:00,FULL,llm_style,eval,llm_style_eval_112,2,6144,3072,bf16,NVIDIA GeForce RTX 4060,c11,32,128,32,4,2,8,0.0,0.0,179.19999361038208,296.81183218955977,0.42130287216497986,5,-1,-1,2x6144x3072,0,
2026-03-03T06:04:02.484853+00:00,FULL,llm_style,eval,llm_style_eval_113,1,8192,8192,bf16,NVIDIA GeForce RTX 4060,c10,64,128,64,8,3,8,0.0,0.0,581.6320180892944,646.2464028596878,0.23076055620341446,4,-1,-1,1x8192x8192,0,
2026-03-03T06:04:02.562265+00:00,FULL,llm_style,eval,llm_style_eval_114,1,3072,1024,bf16,NVIDIA GeForce RTX 4060,c11,32,128,32,4,2,8,0.0,77.36,39.45600055158138,46.120960712432854,0.15945498560542373,7,-1,-1,1x3072x1024,0,
2026-03-03T06:04:02.627454+00:00,FULL,llm_style,eval,llm_style_eval_115,16,3072,1536,bf16,NVIDIA GeForce RTX 4060,c00,32,32,32,2,2,8,0.0,65.147,40.95999896526337,126.75519660115242,3.6864000931262995,7,-1,-1,16x3072x1536,0,
2026-03-03T06:04:02.710571+00:00,FULL,llm_style,eval,llm_style_eval_116,8,3072,1024,bf16,NVIDIA GeForce RTX 4060,c00,32,32,32,2,2,8,0.0,83.074,42.047999799251556,342.1468776464458,1.197004571924867,7,-1,-1,8x3072x1024,0,
2026-03-03T06:04:02.813121+00:00,FULL,llm_style,eval,llm_style_eval_117,4,1024,4096,bf16,NVIDIA GeForce RTX 4060,c11,32,128,32,4,2,8,0.0,102.507,73.55200126767159,80.73696002364159,0.4562001226572774,7,-1,-1,4x1024x4096,0,
2026-03-03T06:04:02.916995+00:00,FULL,llm_style,eval,llm_style_eval_118,64,6144,3072,bf16,NVIDIA GeForce RTX 4060,c02,32,64,32,2,2,8,0.0,0.0,183.29599499702454,304.09920275211323,13.180424940758897,1,-1,-1,64x6144x3072,0,
2026-03-03T06:04:03.506506+00:00,FULL,llm_style,eval,llm_style_eval_119,64,8192,6144,bf16,NVIDIA GeForce RTX 4060,c06,64,128,32,4,3,8,0.0,589.457,441.24799966812134,520.0540769100188,14.600521586150197,1,-1,-1,64x8192x6144,0,
2026-03-03T06:04:03.612014+00:00,FULL,llm_style,eval,llm_style_eval_120,8,1024,4096,bf16,NVIDIA GeForce RTX 4060,c00,32,32,32,2,2,8,0.0,105.455,65.0079995393753,317.03039482235874,1.032317014452232,7,-1,-1,8x1024x4096,0,
2026-03-03T06:04:03.685779+00:00,FULL,llm_style,eval,llm_style_eval_121,4,1024,2048,bf16,NVIDIA GeForce RTX 4060,c00,32,32,32,2,2,8,0.0,73.718,44.064000248909,151.78752273321138,0.38074654832127725,7,-1,-1,4x1024x2048,0,
2026-03-03T06:04:03.986444+00:00,FULL,llm_style,eval,llm_style_eval_122,4,6144,4096,bf16,NVIDIA GeForce RTX 4060,c00,32,32,32,2,2,8,0.0,300.598,226.71999782323837,376.75231277942646,0.8879966210874954,5,-1,-1,4x6144x4096,0,
2026-03-03T06:04:04.306726+00:00,FULL,llm_style,eval,llm_style_eval_123,4,3072,8192,bf16,NVIDIA GeForce RTX 4060,c08,128,128,64,8,4,8,0.0,320.232,229.24800217151642,242.72896021604538,0.8782043467902222,6,-1,-1,4x3072x8192,0,
2026-03-03T06:04:04.340081+00:00,FULL,llm_style,eval,llm_style_eval_124,64,6144,1024,bf16,NVIDIA GeForce RTX 4060,c10,64,128,64,8,3,8,0.0,0.0,69.12000104784966,168.90880107879627,11.650844267819256,1,-1,-1,64x6144x1024,0,
2026-03-03T06:04:04.409064+00:00,FULL,llm_style,eval,llm_style_eval_125,64,1536,8192,bf16,NVIDIA GeForce RTX 4060,c04,64,64,64,4,3,8,0.0,0.0,112.60800063610077,223.5392010211944,14.302826858677543,2,-1,-1,64x1536x8192,0,
2026-03-03T06:04:04.498084+00:00,FULL,llm_style,eval,llm_style_eval_126,64,2048,8192,bf16,NVIDIA GeForce RTX 4060,c04,64,64,64,4,3,8,0.0,0.0,175.10399967432022,263.6623987555504,12.2640468064359,2,-1,-1,64x2048x8192,0,
2026-03-03T06:04:04.648210+00:00,FULL,llm_style,eval,llm_style_eval_127,2,8192,1536,bf16,NVIDIA GeForce RTX 4060,c02,32,64,32,2,2,8,0.0,150.073,61.43999844789505,78.32639917731282,0.8192000206947333,5,-1,-1,2x8192x1536,0,
2026-03-03T06:04:04.756583+00:00,FULL,llm_style,eval,llm_style_eval_128,8,2048,2048,bf16,NVIDIA GeForce RTX 4060,c00,32,32,32,2,2,8,0.0,108.329,54.207999259233475,150.31679630279538,1.2379882105419904,7,-1,-1,8x2048x2048,0,
2026-03-03T06:04:05.005146+00:00,FULL,llm_style,eval,llm_style_eval_129,64,8192,6144,bf16,NVIDIA GeForce RTX 4060,c06,64,128,32,4,3,8,0.0,0.0,440.3199851512909,475.61344027519226,14.631293516660206,1,-1,-1,64x8192x6144,0,
2026-03-03T06:04:05.024288+00:00,FULL,llm_style,eval,llm_style_eval_130,16,3072,1536,bf16,NVIDIA GeForce RTX 4060,c00,32,32,32,2,2,8,0.0,0.0,47.10400104522705,94.42304383963332,3.2055651462605423,7,-1,-1,16x3072x1536,0,
2026-03-03T06:04:05.782937+00:00,FULL,llm_style,eval,llm_style_eval_131,32,8192,8192,bf16,NVIDIA GeForce RTX 4060,c00,32,32,32,2,2,8,0.0,758.6,564.736008644104,617.1635162830353,7.6052655227562855,0,-1,-1,32x8192x8192,0,
2026-03-03T06:04:06.198930+00:00,FULL,llm_style,eval,llm_style_eval_132,32,8192,4096,bf16,NVIDIA GeForce RTX 4060,c00,32,32,32,2,2,8,0.0,415.949,298.3680069446564,316.35487109422684,7.19743269390921,1,-1,-1,32x8192x4096,0,
2026-03-03T06:04:06.963788+00:00,FULL,llm_style,eval,llm_style_eval_133,2,8192,8192,bf16,NVIDIA GeForce RTX 4060,c11,32,128,32,4,2,8,0.0,764.817,558.0160021781921,645.5999833345413,0.4810533299263344,4,-1,-1,2x8192x8192,0,
2026-03-03T06:04:07.112141+00:00,FULL,llm_style,eval,llm_style_eval_134,64,3072,3072,bf16,NVIDIA GeForce RTX 4060,c03,64,64,32,4,2,8,0.0,148.313,90.11200070381165,92.1129610389471,13.405090804391657,3,-1,-1,64x3072x3072,0,
2026-03-03T06:04:07.255548+00:00,FULL,llm_style,eval,llm_style_eval_135,8,3072,3072,bf16,NVIDIA GeForce RTX 4060,c00,32,32,32,2,2,8,0.0,143.363,82.94399827718735,145.6537570059299,1.8204444822565198,7,-1,-1,8x3072x3072,0,
2026-03-03T06:04:07.385165+00:00,FULL,llm_style,eval,llm_style_eval_136,4,2048,4096,bf16,NVIDIA GeForce RTX 4060,c00,32,32,32,2,2,8,0.0,129.576,66.56000018119812,244.58239704370493,1.0082461511013776,7,-1,-1,4x2048x4096,0,
2026-03-03T06:04:08.138746+00:00,FULL,llm_style,eval,llm_style_eval_137,4,8192,8192,bf16,NVIDIA GeForce RTX 4060,c10,64,128,64,8,3,8,0.0,753.537,560.1279735565186,622.5881767272949,0.9584790214835219,4,-1,-1,4x8192x8192,0,
2026-03-03T06:04:08.203578+00:00,FULL,llm_style,eval,llm_style_eval_138,16,1024,1024,bf16,NVIDIA GeForce RTX 4060,c04,64,64,64,4,3,8,0.0,64.786,39.93599861860275,54.32000037282701,0.8402051572680562,7,-1,-1,16x1024x1024,0,
2026-03-03T06:04:08.254928+00:00,FULL,llm_style,eval,llm_style_eval_139,4,1024,1024,bf16,NVIDIA GeForce RTX 4060,c04,64,64,64,4,3,8,0.0,51.314,36.81600093841553,59.975679777562604,0.22785223234951998,7,-1,-1,4x1024x1024,0,
2026-03-03T06:04:08.387176+00:00,FULL,llm_style,eval,llm_style_eval_140,64,4096,6144,bf16,NVIDIA GeForce RTX 4060,c02,32,64,32,2,2,8,0.0,0.0,235.24799942970276,356.0236698389053,13.692892096039152,3,-1,-1,64x4096x6144,0,
2026-03-03T06:04:08.511993+00:00,FULL,llm_style,eval,llm_style_eval_141,4,6144,4096,bf16,NVIDIA GeForce RTX 4060,c00,32,32,32,2,2,8,0.0,0.0,230.31999915838242,357.86687046289444,0.8741168493212579,5,-1,-1,4x6144x4096,0,
2026-03-03T06:04:08.676832+00:00,FULL,llm_style,eval,llm_style_eval_142,4,2048,6144,bf16,NVIDIA GeForce RTX 4060,c00,32,32,32,2,2,8,0.0,164.787,94.2080020904541,118.53152215480797,1.068521715420181,7,-1,-1,4x2048x6144,0,
2026-03-03T06:04:08.750950+00:00,FULL,llm_style,eval,llm_style_eval_143,64,1536,8192,bf16,NVIDIA GeForce RTX 4060,c04,64,64,64,4,3,8,0.0,0.0,110.59200018644333,176.38239547610277,14.563555531003347,2,-1,-1,64x1536x8192,0,
2026-03-03T06:04:08.861317+00:00,FULL,llm_style,eval,llm_style_eval_144,1,3072,3072,bf16,NVIDIA GeForce RTX 4060,c00,32,32,32,2,2,8,0.0,110.313,50.73599889874458,75.58016080409281,0.37201136096025555,7,-1,-1,1x3072x3072,0,
2026-03-03T06:04:08.880980+00:00,FULL,llm_style,eval,llm_style_eval_145,32,1024,2048,bf16,NVIDIA GeForce RTX 4060,c04,64,64,64,4,3,8,0.0,0.0,44.015999883413315,145.23392051458353,3.049294082958631,3,-1,-1,32x1024x2048,0,
2026-03-03T06:04:09.051652+00:00,FULL,llm_style,eval,llm_style_eval_146,64,8192,4096,bf16,NVIDIA GeForce RTX 4060,c00,32,32,32,2,2,8,0.0,0.0,308.1759959459305,347.5456055998801,13.936735347660084,1,-1,-1,64x8192x4096,0,
2026-03-03T06:04:09.096413+00:00,FULL,llm_style,eval,llm_style_eval_147,64,2048,4096,bf16,NVIDIA GeForce RTX 4060,c03,64,64,32,4,2,8,0.0,0.0,75.66400244832039,216.18687853217122,14.19092024286425,3,-1,-1,64x2048x4096,0,
2026-03-03T06:04:09.122661+00:00,FULL,llm_style,eval,llm_style_eval_148,64,1024,6144,bf16,NVIDIA GeForce RTX 4060,c04,64,64,64,4,3,8,0.0,0.0,67.58400052785873,125.86848437786092,11.915636270570362,3,-1,-1,64x1024x6144,0,
2026-03-03T06:04:09.295908+00:00,FULL,llm_style,eval,llm_style_eval_149,64,4096,8192,bf16,NVIDIA GeForce RTX 4060,c11,32,128,32,4,2,8,0.0,0.0,302.99200117588043,329.7123235464096,14.175183765022437,2,-1,-1,64x4096x8192,0,
2026-03-03T06:04:09.387389+00:00,FULL,llm_style,eval,llm_style_eval_150,2,2048,3072,bf16,NVIDIA GeForce RTX 4060,c00,32,32,32,2,2,8,0.0,91.428,58.3840012550354,206.82303577661497,0.43103972764849763,7,-1,-1,2x2048x3072,0,
2026-03-03T06:04:09.495038+00:00,FULL,llm_style,eval,llm_style_eval_151,64,4096,2048,bf16,NVIDIA GeForce RTX 4060,c04,64,64,64,4,3,8,0.0,107.608,66.20799750089645,90.23488074541089,16.21770578373801,3,-1,-1,64x4096x2048,0,
2026-03-03T06:04:10.256176+00:00,FULL,llm_style,eval,llm_style_eval_152,8,8192,8192,bf16,NVIDIA GeForce RTX 4060,c02,32,64,32,2,2,8,0.0,761.095,561.1519813537598,621.9920164346693,1.913459917596005,4,-1,-1,8x8192x8192,0,
2026-03-03T06:04:10.350486+00:00,FULL,llm_style,eval,llm_style_eval_153,64,8192,2048,bf16,NVIDIA GeForce RTX 4060,c06,64,128,32,4,3,8,0.0,0.0,197.63199985027313,353.6960032582281,10.866072547092287,1,-1,-1,64x8192x2048,0,
2026-03-03T06:04:10.575534+00:00,FULL,llm_style,eval,llm_style_eval_154,16,2048,8192,bf16,NVIDIA GeForce RTX 4060,c04,64,64,64,4,3,8,0.0,224.995,162.81600296497345,178.69823709130287,3.2974087449837275,6,-1,-1,16x2048x8192,0,
2026-03-03T06:04:10.671867+00:00,FULL,llm_style,eval,llm_style_eval_155,4,2048,1536,bf16,NVIDIA GeForce RTX 4060,c11,32,128,32,4,2,8,0.0,96.291,43.96799951791763,112.13951706886273,0.5723668185027282,7,-1,-1,4x2048x1536,0,
2026-03-03T06:04:10.802232+00:00,FULL,llm_style,eval,llm_style_eval_156,1,4096,6144,bf16,NVIDIA GeForce RTX 4060,c11,32,128,32,4,2,8,0.0,0.0,232.44799673557281,305.71520268917084,0.2165286374020941,7,-1,-1,1x4096x6144,0,
2026-03-03T06:04:10.971162+00:00,FULL,llm_style,eval,llm_style_eval_157,1,1536,8192,bf16,NVIDIA GeForce RTX 4060,c04,64,64,64,4,3,8,0.0,168.876,87.0399996638298,92.13344104588032,0.2891294128813958,6,-1,-1,1x1536x8192,0,
2026-03-03T06:04:11.038918+00:00,FULL,llm_style,eval,llm_style_eval_158,64,1536,8192,bf16,NVIDIA GeForce RTX 4060,c04,64,64,64,4,3,8,0.0,0.0,110.59200018644333,187.95775905251497,14.563555531003347,2,-1,-1,64x1536x8192,0,
2026-03-03T06:04:11.149649+00:00,FULL,llm_style,eval,llm_style_eval_159,16,6144,1536,bf16,NVIDIA GeForce RTX 4060,c11,32,128,32,4,2,8,0.0,110.677,47.10400104522705,61.624320335686164,6.411130292521085,5,-1,-1,16x6144x1536,0,
2026-03-03T06:04:11.332967+00:00,FULL,llm_style,eval,llm_style_eval_160,32,6144,6144,bf16,NVIDIA GeForce RTX 4060,c06,64,128,32,4,3,8,0.0,0.0,354.3039858341217,447.0054408907889,6.818774839104088,1,-1,-1,32x6144x6144,0,
2026-03-03T06:04:11.428187+00:00,FULL,llm_style,eval,llm_style_eval_161,2,1536,4096,bf16,NVIDIA GeForce RTX 4060,c04,64,64,64,4,3,8,0.0,95.168,55.296000093221664,109.48607571423034,0.4551111103438546,7,-1,-1,2x1536x4096,0,
2026-03-03T06:04:11.526456+00:00,FULL,llm_style,eval,llm_style_eval_162,64,1536,3072,bf16,NVIDIA GeForce RTX 4060,c04,64,64,64,4,3,8,0.0,98.226,55.00799976289272,87.864960245788,10.97985345046908,3,-1,-1,64x1536x3072,0,
2026-03-03T06:04:11.567671+00:00,FULL,llm_style,eval,llm_style_eval_163,64,1024,8192,bf16,NVIDIA GeForce RTX 4060,c04,64,64,64,4,3,8,0.0,0.0,87.42399886250496,124.37504105269899,12.282003088061831,2,-1,-1,64x1024x8192,0,
2026-03-03T06:04:11.730198+00:00,FULL,llm_style,eval,llm_style_eval_164,64,4096,8192,bf16,NVIDIA GeForce RTX 4060,c11,32,128,32,4,2,8,0.0,0.0,301.05599761009216,327.17440247535706,14.266340249306568,2,-1,-1,64x4096x8192,0,
2026-03-03T06:04:12.052329+00:00,FULL,llm_style,eval,llm_style_eval_165,4,8192,3072,bf16,NVIDIA GeForce RTX 4060,c11,32,128,32,4,2,8,0.0,322.071,226.30399465560913,306.2438443303107,0.8896289802854788,5,-1,-1,4x8192x3072,0,
2026-03-03T06:04:12.098020+00:00,FULL,llm_style,eval,llm_style_eval_166,64,1024,6144,bf16,NVIDIA GeForce RTX 4060,c04,64,64,64,4,3,8,0.0,0.0,96.3359996676445,134.24640074372292,8.359350302880294,3,-1,-1,64x1024x6144,0,
2026-03-03T06:04:12.112409+00:00,FULL,llm_style,eval,llm_style_eval_167,2,2048,1024,bf16,NVIDIA GeForce RTX 4060,c00,32,32,32,2,2,8,0.0,0.0,59.39200147986412,108.48127901554108,0.14124137579104856,7,-1,-1,2x2048x1024,0,
2026-03-03T06:04:12.190960+00:00,FULL,llm_style,eval,llm_style_eval_168,64,4096,1024,bf16,NVIDIA GeForce RTX 4060,c11,32,128,32,4,2,8,0.0,78.501,50.92800036072731,73.44768006354565,10.541763041888514,3,-1,-1,64x4096x1024,0,
2026-03-03T06:04:12.234431+00:00,FULL,llm_style,eval,llm_style_eval_169,4,1536,6144,bf16,NVIDIA GeForce RTX 4060,c04,64,64,64,4,3,8,0.0,0.0,76.89599692821503,148.29376131296152,0.9818127733031331,7,-1,-1,4x1536x6144,0,
2026-03-03T06:04:12.252202+00:00,FULL,llm_style,eval,llm_style_eval_170,16,1536,1536,bf16,NVIDIA GeForce RTX 4060,c00,32,32,32,2,2,8,0.0,0.0,40.94399884343147,130.18175959587094,1.8439203334461758,7,-1,-1,16x1536x1536,0,
2026-03-03T06:04:12.344016+00:00,FULL,llm_style,eval,llm_style_eval_171,1,2048,3072,bf16,NVIDIA GeForce RTX 4060,c11,32,128,32,4,2,8,0.0,91.773,60.46400032937527,74.65120188891888,0.2081058469743166,7,-1,-1,1x2048x3072,0,
2026-03-03T06:04:12.428358+00:00,FULL,llm_style,eval,llm_style_eval_172,64,3072,2048,bf16,NVIDIA GeForce RTX 4060,c03,64,64,32,4,2,8,0.0,84.298,52.960000932216644,121.93759717047215,15.205935684002524,3,-1,-1,64x3072x2048,0,
2026-03-03T06:04:12.689643+00:00,FULL,llm_style,eval,llm_style_eval_173,64,8192,6144,bf16,NVIDIA GeForce RTX 4060,c06,64,128,32,4,3,8,0.0,0.0,452.08001136779785,566.3417428731918,14.250687449126406,1,-1,-1,64x8192x6144,0,
2026-03-03T06:04:12.911858+00:00,FULL,llm_style,eval,llm_style_eval_174,2,4096,4096,bf16,NVIDIA GeForce RTX 4060,c02,32,64,32,2,2,8,0.0,222.164,161.79199516773224,274.5055964589119,0.41478482251502746,7,-1,-1,2x4096x4096,0,
2026-03-03T06:04:12.959243+00:00,FULL,llm_style,eval,llm_style_eval_175,64,4096,2048,bf16,NVIDIA GeForce RTX 4060,c04,64,64,64,4,3,8,0.0,0.0,72.7040022611618,145.8857561647892,14.768675597018525,3,-1,-1,64x4096x2048,0,
2026-03-03T06:04:13.020137+00:00,FULL,llm_style,eval,llm_style_eval_176,16,6144,2048,bf16,NVIDIA GeForce RTX 4060,c00,32,32,32,2,2,8,0.0,0.0,70.56000083684921,146.19872048497183,5.706535986741636,5,-1,-1,16x6144x2048,0,
2026-03-03T06:04:13.064437+00:00,FULL,llm_style,eval,llm_style_eval_177,1,6144,1536,bf16,NVIDIA GeForce RTX 4060,c11,32,128,32,4,2,8,0.0,0.0,47.10400104522705,115.28191782534111,0.4006956432825678,5,-1,-1,1x6144x1536,0,
2026-03-03T06:04:13.308081+00:00,FULL,llm_style,eval,llm_style_eval_178,32,6144,8192,bf16,NVIDIA GeForce RTX 4060,c06,64,128,32,4,3,8,0.0,0.0,430.3999990224838,560.7500863075256,7.484259942648665,0,-1,-1,32x6144x8192,0,
2026-03-03T06:04:13.432853+00:00,FULL,llm_style,eval,llm_style_eval_179,64,4096,6144,bf16,NVIDIA GeForce RTX 4060,c02,32,64,32,2,2,8,0.0,0.0,234.92799699306488,292.38272577524185,13.711543593057115,3,-1,-1,64x4096x6144,0,
2026-03-03T06:04:13.449074+00:00,FULL,llm_style,eval,llm_style_eval_180,64,2048,1536,bf16,NVIDIA GeForce RTX 4060,c11,32,128,32,4,2,8,0.0,0.0,43.007999658584595,131.41888111829755,9.362285788607435,3,-1,-1,64x2048x1536,0,
2026-03-03T06:04:13.477834+00:00,FULL,llm_style,eval,llm_style_eval_181,64,2048,3072,bf16,NVIDIA GeForce RTX 4060,c03,64,64,32,4,2,8,0.0,0.0,81.84000104665756,227.7990420162675,9.840009258319647,3,-1,-1,64x2048x3072,0,
2026-03-03T06:04:13.555420+00:00,FULL,llm_style,eval,llm_style_eval_182,32,3072,1536,bf16,NVIDIA GeForce RTX 4060,c03,64,64,32,4,2,8,0.0,77.532,48.8319993019104,67.12768010795115,6.1842622116065105,3,-1,-1,32x3072x1536,0,
2026-03-03T06:04:13.644100+00:00,FULL,llm_style,eval,llm_style_eval_183,8,8192,2048,bf16,NVIDIA GeForce RTX 4060,c11,32,128,32,4,2,8,0.0,0.0,166.75199568271637,279.0176010131836,1.6097885659537146,5,-1,-1,8x8192x2048,0,
2026-03-03T06:04:13.682863+00:00,FULL,llm_style,eval,llm_style_eval_184,64,8192,1024,bf16,NVIDIA GeForce RTX 4060,c06,64,128,32,4,3,8,0.0,0.0,69.39199939370155,141.3647980988025,15.473568039278307,1,-1,-1,64x8192x1024,0,
2026-03-03T06:04:13.741578+00:00,FULL,llm_style,eval,llm_style_eval_185,1,8192,1536,bf16,NVIDIA GeForce RTX 4060,c11,32,128,32,4,2,8,0.0,0.0,64.51199948787689,76.39103993773459,0.3900952411919764,5,-1,-1,1x8192x1536,0,
2026-03-03T06:04:13.765720+00:00,FULL,llm_style,eval,llm_style_eval_186,16,6144,1024,bf16,NVIDIA GeForce RTX 4060,c11,32,128,32,4,2,8,0.0,0.0,40.86400009691715,129.98208582401276,4.9267470517451475,5,-1,-1,16x6144x1024,0,
2026-03-03T06:04:13.795656+00:00,FULL,llm_style,eval,llm_style_eval_187,1,1024,6144,bf16,NVIDIA GeForce RTX 4060,c04,64,64,64,4,3,8,0.0,0.0,97.52000123262405,274.38239097595215,0.12902903856599368,7,-1,-1,1x1024x6144,0,
2026-03-03T06:04:14.235817+00:00,FULL,llm_style,eval,llm_style_eval_188,8,8192,4096,bf16,NVIDIA GeForce RTX 4060,c02,32,64,32,2,2,8,0.0,440.111,297.39199578762054,435.8825647830962,1.8052634892816717,5,-1,-1,8x8192x4096,0,
2026-03-03T06:04:14.470430+00:00,FULL,llm_style,eval,llm_style_eval_189,8,2048,8192,bf16,NVIDIA GeForce RTX 4060,c10,64,128,64,8,3,8,0.0,234.567,161.871999502182,170.04544541239738,1.6583192697040945,6,-1,-1,8x2048x8192,0,
2026-03-03T06:04:14.679497+00:00,FULL,llm_style,eval,llm_style_eval_190,4,8192,2048,bf16,NVIDIA GeForce RTX 4060,c11,32,128,32,4,2,8,0.0,209.015,159.743994474411,196.4681608974933,0.8402051572680562,5,-1,-1,4x8192x2048,0,
2026-03-03T06:04:15.002915+00:00,FULL,llm_style,eval,llm_style_eval_191,4,8192,8192,bf16,NVIDIA GeForce RTX 4060,c10,64,128,64,8,3,8,0.0,0.0,561.1999928951263,706.4883315563202,0.9566481090464433,4,-1,-1,4x8192x8192,0,
2026-03-03T06:04:15.014299+00:00,FULL,llm_style,eval,llm_style_eval_192,64,1536,1024,bf16,NVIDIA GeForce RTX 4060,c04,64,64,64,4,3,8,0.0,0.0,38.863999769091606,190.30015707015974,5.180284921679993,3,-1,-1,64x1536x1024,0,
2026-03-03T06:04:15.033315+00:00,FULL,llm_style,eval,llm_style_eval_193,32,2048,2048,bf16,NVIDIA GeForce RTX 4060,c11,32,128,32,4,2,8,0.0,0.0,65.0239996612072,87.14239969849584,4.128251990013258,3,-1,-1,32x2048x2048,0,
2026-03-03T06:04:15.047693+00:00,FULL,llm_style,eval,llm_style_eval_194,8,1024,2048,bf16,NVIDIA GeForce RTX 4060,c04,64,64,64,4,3,8,0.0,0.0,65.5359998345375,163.06176304817194,0.5120000012926758,7,-1,-1,8x1024x2048,0,
2026-03-03T06:04:15.084048+00:00,FULL,llm_style,eval,llm_style_eval_195,2,4096,2048,bf16,NVIDIA GeForce RTX 4060,c11,32,128,32,4,2,8,0.0,0.0,50.175998359918594,125.32928161323063,0.668734715736196,7,-1,-1,2x4096x2048,0,
2026-03-03T06:04:15.129757+00:00,FULL,llm_style,eval,llm_style_eval_196,32,2048,4096,bf16,NVIDIA GeForce RTX 4060,c02,32,64,32,2,2,8,0.0,0.0,73.40800017118454,109.23007972538468,7.313520471175326,3,-1,-1,32x2048x4096,0,
2026-03-03T06:04:15.277607+00:00,FULL,llm_style,eval,llm_style_eval_197,32,8192,1536,bf16,NVIDIA GeForce RTX 4060,c11,32,128,32,4,2,8,0.0,147.795,71.58400118350983,128.87904174625865,11.249809380388635,1,-1,-1,32x8192x1536,0,
2026-03-03T06:04:15.451193+00:00,FULL,llm_style,eval,llm_style_eval_198,64,4096,8192,bf16,NVIDIA GeForce RTX 4060,c11,32,128,32,4,2,8,0.0,0.0,327.1680027246475,455.31359732151026,13.127711940750967,2,-1,-1,64x4096x8192,0,
2026-03-03T06:04:15.835829+00:00,FULL,llm_style,eval,llm_style_eval_199,2,8192,4096,bf16,NVIDIA GeForce RTX 4060,c02,32,64,32,2,2,8,0.0,384.577,293.8399910926819,338.3091300725936,0.4567714813116284,5,-1,-1,2x8192x4096,0,
2026-03-03T06:04:15.915322+00:00,FULL,llm_style,eval,llm_style_eval_200,1,4096,1024,bf16,NVIDIA GeForce RTX 4060,c00,32,32,32,2,2,8,0.0,79.449,34.81600061058998,100.70688292384128,0.2409411722450521,7,-1,-1,1x4096x1024,0,
2026-03-03T06:04:16.098221+00:00,FULL,llm_style,eval,llm_style_eval_201,4,1536,8192,bf16,NVIDIA GeForce RTX 4060,c04,64,64,64,4,3,8,0.0,182.855,88.95999938249588,109.26016315817827,1.1315568423869267,6,-1,-1,4x1536x8192,0,
2026-03-03T06:04:16.334298+00:00,FULL,llm_style,eval,llm_style_eval_202,1,6144,3072,bf16,NVIDIA GeForce RTX 4060,c11,32,128,32,4,2,8,0.0,236.035,176.97599530220032,216.89408123493183,0.2132986224235727,5,-1,-1,1x6144x3072,0,
2026-03-03T06:04:16.508904+00:00,FULL,llm_style,eval,llm_style_eval_203,16,2048,6144,bf16,NVIDIA GeForce RTX 4060,c00,32,32,32,2,2,8,0.0,174.563,98.30400347709656,192.0755222439766,4.095999855120982,7,-1,-1,16x2048x6144,0,
2026-03-03T06:04:16.525630+00:00,FULL,llm_style,eval,llm_style_eval_204,16,1536,1024,bf16,NVIDIA GeForce RTX 4060,c04,64,64,64,4,3,8,0.0,0.0,35.840000957250595,943.6003386974303,1.404342819634263,7,-1,-1,16x1536x1024,0,
2026-03-03T06:04:16.587608+00:00,FULL,llm_style,eval,llm_style_eval_205,64,6144,2048,bf16,NVIDIA GeForce RTX 4060,c10,64,128,64,8,3,8,0.0,0.0,80.75199648737907,148.06816577911377,19.945175426736682,1,-1,-1,64x6144x2048,0,
2026-03-03T06:04:16.652857+00:00,FULL,llm_style,eval,llm_style_eval_206,4,2048,6144,bf16,NVIDIA GeForce RTX 4060,c00,32,32,32,2,2,8,0.0,0.0,95.58400139212608,139.41568180918688,1.0531395896164306,7,-1,-1,4x2048x6144,0,
2026-03-03T06:04:16.770015+00:00,FULL,llm_style,eval,llm_style_eval_207,32,6144,1536,bf16,NVIDIA GeForce RTX 4060,c11,32,128,32,4,2,8,0.0,117.091,48.128001391887665,54.19455900788307,12.549446445573892,1,-1,-1,32x6144x1536,0,
2026-03-03T06:04:16.838861+00:00,FULL,llm_style,eval,llm_style_eval_208,4,2048,1024,bf16,NVIDIA GeForce RTX 4060,c11,32,128,32,4,2,8,0.0,68.804,40.95999896526337,43.88895891606808,0.4096000103473666,7,-1,-1,4x2048x1024,0,
2026-03-03T06:04:16.895343+00:00,FULL,llm_style,eval,llm_style_eval_209,1,1024,1536,bf16,NVIDIA GeForce RTX 4060,c00,32,32,32,2,2,8,0.0,56.442,38.91199827194214,47.56832063198089,0.08084210885330595,7,-1,-1,1x1024x1536,0,
2026-03-03T06:04:17.190206+00:00,FULL,llm_style,eval,llm_style_eval_210,8,6144,4096,bf16,NVIDIA GeForce RTX 4060,c06,64,128,32,4,3,8,0.0,294.825,226.30399465560913,240.81984028220177,1.7792579605709575,5,-1,-1,8x6144x4096,0,
2026-03-03T06:04:17.414724+00:00,FULL,llm_style,eval,llm_style_eval_211,4,2048,8192,bf16,NVIDIA GeForce RTX 4060,c04,64,64,64,4,3,8,0.0,224.476,161.66400164365768,176.3328000903129,0.8302264365312744,6,-1,-1,4x2048x8192,0,
2026-03-03T06:04:17.469052+00:00,FULL,llm_style,eval,llm_style_eval_212,32,1024,1024,bf16,NVIDIA GeForce RTX 4060,c04,64,64,64,4,3,8,0.0,54.282,35.599999129772186,39.84416149556637,1.8850804955182439,3,-1,-1,32x1024x1024,0,
2026-03-03T06:04:17.616999+00:00,FULL,llm_style,eval,llm_style_eval_213,16,3072,4096,bf16,NVIDIA GeForce RTX 4060,c10,64,128,64,8,3,8,0.0,147.911,81.23200014233589,107.60191917419432,4.95682961510815,7,-1,-1,16x3072x4096,0,
2026-03-03T06:04:17.666125+00:00,FULL,llm_style,eval,llm_style_eval_214,64,1024,8192,bf16,NVIDIA GeForce RTX 4060,c04,64,64,64,4,3,8,0.0,0.0,87.47199922800064,174.18239921331406,12.275263323995055,2,-1,-1,64x1024x8192,0,
2026-03-03T06:04:17.694288+00:00,FULL,llm_style,eval,llm_style_eval_215,4,4096,1536,bf16,NVIDIA GeForce RTX 4060,c11,32,128,32,4,2,8,0.0,0.0,47.919999808073044,86.99359938502302,1.0503265484471198,7,-1,-1,4x4096x1536,0,
2026-03-03T06:04:17.777876+00:00,FULL,llm_style,eval,llm_style_eval_216,16,1536,3072,bf16,NVIDIA GeForce RTX 4060,c04,64,64,64,4,3,8,0.0,83.54,49.95200037956238,57.17632118612527,3.0228007457691093,7,-1,-1,16x1536x3072,0,
2026-03-03T06:04:17.841608+00:00,FULL,llm_style,eval,llm_style_eval_217,8,6144,2048,bf16,NVIDIA GeForce RTX 4060,c11,32,128,32,4,2,8,0.0,0.0,70.65600156784058,783.061768412589,2.849391241120482,5,-1,-1,8x6144x2048,0,
2026-03-03T06:04:17.982300+00:00,FULL,llm_style,eval,llm_style_eval_218,8,3072,4096,bf16,NVIDIA GeForce RTX 4060,c04,64,64,64,4,3,8,0.0,140.64,79.77600023150444,94.29823763668534,2.5236486088016967,7,-1,-1,8x3072x4096,0,
2026-03-03T06:04:18.300861+00:00,FULL,llm_style,eval,llm_style_eval_219,64,8192,3072,bf16,NVIDIA GeForce RTX 4060,c00,32,32,32,2,2,8,0.0,318.515,234.49599742889404,325.05279392004013,13.736803644065475,1,-1,-1,64x8192x3072,0,
2026-03-03T06:04:18.342285+00:00,FULL,llm_style,eval,llm_style_eval_220,2,4096,2048,bf16,NVIDIA GeForce RTX 4060,c11,32,128,32,4,2,8,0.0,0.0,63.88799846172333,321.6179163753982,0.5252071250925662,7,-1,-1,2x4096x2048,0,
2026-03-03T06:04:18.493221+00:00,FULL,llm_style,eval,llm_style_eval_221,4,1024,8192,bf16,NVIDIA GeForce RTX 4060,c00,32,32,32,2,2,8,0.0,150.883,64.51199948787689,100.03328174352646,1.0402539765119372,6,-1,-1,4x1024x8192,0,
2026-03-03T06:04:18.567828+00:00,FULL,llm_style,eval,llm_style_eval_222,64,6144,2048,bf16,NVIDIA GeForce RTX 4060,c10,64,128,64,8,3,8,0.0,0.0,84.99199897050858,163.168958723545,18.950168904238474,1,-1,-1,64x6144x2048,0,
2026-03-03T06:04:18.638705+00:00,FULL,llm_style,eval,llm_style_eval_223,4,2048,2048,bf16,NVIDIA GeForce RTX 4060,c00,32,32,32,2,2,8,0.0,70.826,43.007999658584595,149.430081397295,0.780190482383953,7,-1,-1,4x2048x2048,0,
2026-03-03T06:04:18.656600+00:00,FULL,llm_style,eval,llm_style_eval_224,16,3072,1536,bf16,NVIDIA GeForce RTX 4060,c00,32,32,32,2,2,8,0.0,0.0,39.93599861860275,91.08320020139217,3.780923207706253,7,-1,-1,16x3072x1536,0,
2026-03-03T06:04:18.674961+00:00,FULL,llm_style,eval,llm_style_eval_225,1,2048,2048,bf16,NVIDIA GeForce RTX 4060,c00,32,32,32,2,2,8,0.0,0.0,22.591999731957912,51.72223888337612,0.3713087862750701,7,-1,-1,1x2048x2048,0,
2026-03-03T06:04:18.687265+00:00,FULL,llm_style,eval,llm_style_eval_226,8,1536,1024,bf16,NVIDIA GeForce RTX 4060,c04,64,64,64,4,3,8,0.0,0.0,32.62399882078171,96.60415910184376,0.7713899248907893,7,-1,-1,8x1536x1024,0,
2026-03-03T06:04:18.881078+00:00,FULL,llm_style,eval,llm_style_eval_227,64,6144,6144,bf16,NVIDIA GeForce RTX 4060,c06,64,128,32,4,3,8,0.0,0.0,333.8080048561096,468.85279446840275,14.474902152459764,1,-1,-1,64x6144x6144,0,
2026-03-03T06:04:18.941674+00:00,FULL,llm_style,eval,llm_style_eval_228,64,6144,2048,bf16,NVIDIA GeForce RTX 4060,c10,64,128,64,8,3,8,0.0,0.0,81.60000294446945,190.5292847752567,19.737900464244547,1,-1,-1,64x6144x2048,0,
2026-03-03T06:04:19.121630+00:00,FULL,llm_style,eval,llm_style_eval_229,16,1536,8192,bf16,NVIDIA GeForce RTX 4060,c04,64,64,64,4,3,8,0.0,179.905,88.06400001049042,158.84288161993024,4.57227906922278,6,-1,-1,16x1536x8192,0,
2026-03-03T06:04:19.147410+00:00,FULL,llm_style,eval,llm_style_eval_230,64,2048,1536,bf16,NVIDIA GeForce RTX 4060,c11,32,128,32,4,2,8,0.0,0.0,67.58400052785873,217.86656215786917,5.957818135285181,3,-1,-1,64x2048x1536,0,
2026-03-03T06:04:19.199642+00:00,FULL,llm_style,eval,llm_style_eval_231,4,1024,8192,bf16,NVIDIA GeForce RTX 4060,c00,32,32,32,2,2,8,0.0,0.0,93.08800101280212,209.37376186251635,0.7209185208603922,6,-1,-1,4x1024x8192,0,
2026-03-03T06:04:19.221416+00:00,FULL,llm_style,eval,llm_style_eval_232,16,3072,1536,bf16,NVIDIA GeForce RTX 4060,c00,32,32,32,2,2,8,0.0,0.0,55.80800026655197,196.79743990302086,2.7056146659764386,7,-1,-1,16x3072x1536,0,
2026-03-03T06:04:19.271074+00:00,FULL,llm_style,eval,llm_style_eval_233,64,3072,3072,bf16,NVIDIA GeForce RTX 4060,c03,64,64,32,4,2,8,0.0,0.0,69.34399902820587,154.347516298294,17.419813811266625,3,-1,-1,64x3072x3072,0,
2026-03-03T06:04:19.439808+00:00,FULL,llm_style,eval,llm_style_eval_234,32,8192,4096,bf16,NVIDIA GeForce RTX 4060,c00,32,32,32,2,2,8,0.0,0.0,300.03198981285095,314.6854293346405,7.157515601384779,1,-1,-1,32x8192x4096,0,
2026-03-03T06:04:19.452840+00:00,FULL,llm_style,eval,llm_style_eval_235,4,2048,1024,bf16,NVIDIA GeForce RTX 4060,c11,32,128,32,4,2,8,0.0,0.0,40.95999896526337,214.15935799479482,0.4096000103473666,7,-1,-1,4x2048x1024,0,
2026-03-03T06:04:19.578666+00:00,FULL,llm_style,eval,llm_style_eval_236,4,8192,3072,bf16,NVIDIA GeForce RTX 4060,c11,32,128,32,4,2,8,0.0,0.0,230.3999960422516,236.9363209605217,0.8738133483434609,5,-1,-1,4x8192x3072,0,
2026-03-03T06:04:19.605298+00:00,FULL,llm_style,eval,llm_style_eval_237,64,1024,4096,bf16,NVIDIA GeForce RTX 4060,c04,64,64,64,4,3,8,0.0,0.0,86.01599931716919,157.9209581017494,6.241523859071624,3,-1,-1,64x1024x4096,0,
2026-03-03T06:04:19.771387+00:00,FULL,llm_style,eval,llm_style_eval_238,32,2048,6144,bf16,NVIDIA GeForce RTX 4060,c06,64,128,32,4,3,8,0.0,166.037,103.31199690699577,112.01183959841728,7.794896934621818,3,-1,-1,32x2048x6144,0,
2026-03-03T06:04:19.779155+00:00,FULL,llm_style,eval,llm_style_eval_239,32,2048,6144,bf16,NVIDIA GeForce RTX 4060,c06,64,128,32,4,3,8,0.0,0.0,103.42399775981903,175.79487964510912,7.786455614200473,3,-1,-1,32x2048x6144,0,
2026-03-03T06:04:19.924119+00:00,FULL,llm_style,eval,llm_style_eval_240,8,8192,1536,bf16,NVIDIA GeForce RTX 4060,c11,32,128,32,4,2,8,0.0,144.934,62.463998794555664,65.8857586979866,3.2230820294128772,5,-1,-1,8x8192x1536,0,
2026-03-03T06:04:19.935530+00:00,FULL,llm_style,eval,llm_style_eval_241,16,1536,1536,bf16,NVIDIA GeForce RTX 4060,c00,32,32,32,2,2,8,0.0,0.0,37.88800165057182,56.36096045374869,1.992648561839908,7,-1,-1,16x1536x1536,0,
2026-03-03T06:04:19.959250+00:00,FULL,llm_style,eval,llm_style_eval_242,1,2048,3072,bf16,NVIDIA GeForce RTX 4060,c11,32,128,32,4,2,8,0.0,0.0,61.08799949288368,86.97887904942036,0.2059800960001288,7,-1,-1,1x2048x3072,0,
2026-03-03T06:04:20.001074+00:00,FULL,llm_style,eval,llm_style_eval_243,8,1536,6144,bf16,NVIDIA GeForce RTX 4060,c00,32,32,32,2,2,8,0.0,0.0,74.41600039601326,85.44095829129218,2.0290655664973007,7,-1,-1,8x1536x6144,0,
2026-03-03T06:04:20.043095+00:00,FULL,llm_style,eval,llm_style_eval_244,32,8192,1024,bf16,NVIDIA GeForce RTX 4060,c11,32,128,32,4,2,8,0.0,0.0,55.296000093221664,159.2934414744376,9.709037020668898,1,-1,-1,32x8192x1024,0,
2026-03-03T06:04:20.168251+00:00,FULL,llm_style,eval,llm_style_eval_245,4,6144,4096,bf16,NVIDIA GeForce RTX 4060,c00,32,32,32,2,2,8,0.0,0.0,230.75199872255325,317.66528308391565,0.8724803820315631,5,-1,-1,4x6144x4096,0,
2026-03-03T06:04:20.232212+00:00,FULL,llm_style,eval,llm_style_eval_246,32,2048,6144,bf16,NVIDIA GeForce RTX 4060,c06,64,128,32,4,3,8,0.0,0.0,108.44799876213074,257.20831677317574,7.425737470419852,3,-1,-1,32x2048x6144,0,
2026-03-03T06:04:20.292989+00:00,FULL,llm_style,eval,llm_style_eval_247,64,6144,2048,bf16,NVIDIA GeForce RTX 4060,c10,64,128,64,8,3,8,0.0,0.0,81.00799843668938,172.64031752943987,19.882144566980642,1,-1,-1,64x6144x2048,0,
2026-03-03T06:04:20.300923+00:00,FULL,llm_style,eval,llm_style_eval_248,64,1024,1024,bf16,NVIDIA GeForce RTX 4060,c04,64,64,64,4,3,8,0.0,0.0,32.76799991726875,70.20512249320733,4.096000010341406,3,-1,-1,64x1024x1024,0,
2026-03-03T06:04:20.408706+00:00,FULL,llm_style,eval,llm_style_eval_249,2,8192,1024,bf16,NVIDIA GeForce RTX 4060,c11,32,128,32,4,2,8,0.0,107.749,49.15200173854828,53.64480044692755,0.6826666425201637,5,-1,-1,2x8192x1024,0,
2026-03-03T06:04:20.458170+00:00,FULL,llm_style,eval,llm_style_eval_250,64,3072,3072,bf16,NVIDIA GeForce RTX 4060,c03,64,64,32,4,2,8,0.0,0.0,65.88799878954887,182.7404811978339,18.333529234334645,3,-1,-1,64x3072x3072,0,
2026-03-03T06:04:20.504390+00:00,FULL,llm_style,eval,llm_style_eval_251,64,1024,8192,bf16,NVIDIA GeForce RTX 4060,c04,64,64,64,4,3,8,0.0,0.0,82.94399827718735,126.95232063531863,12.945382984935252,2,-1,-1,64x1024x8192,0,
2026-03-03T06:04:20.572863+00:00,FULL,llm_style,eval,llm_style_eval_252,64,4096,3072,bf16,NVIDIA GeForce RTX 4060,c11,32,128,32,4,2,8,0.0,0.0,98.30400347709656,186.55231609940526,16.383999420483928,3,-1,-1,64x4096x3072,0,
2026-03-03T06:04:20.697695+00:00,FULL,llm_style,eval,llm_style_eval_253,8,6144,4096,bf16,NVIDIA GeForce RTX 4060,c06,64,128,32,4,3,8,0.0,0.0,229.37600314617157,336.2201693654059,1.755428547350728,5,-1,-1,8x6144x4096,0,
2026-03-03T06:04:20.778883+00:00,FULL,llm_style,eval,llm_style_eval_254,4,1536,3072,bf16,NVIDIA GeForce RTX 4060,c04,64,64,64,4,3,8,0.0,81.137,50.175998359918594,58.2947202771902,0.7523265552032206,7,-1,-1,4x1536x3072,0,
2026-03-03T06:04:20.798979+00:00,FULL,llm_style,eval,llm_style_eval_255,1,3072,1536,bf16,NVIDIA GeForce RTX 4060,c11,32,128,32,4,2,8,0.0,0.0,67.6800012588501,126.6137613356113,0.13943829527878382,7,-1,-1,1x3072x1536,0,
2026-03-03T06:04:21.241908+00:00,BUCKET,llm_style,tune,llm_style_tune_000,64,6144,6144,bf16,NVIDIA GeForce RTX 4060,c06,64,128,32,4,3,8,0.0,440.682,331.4400017261505,389.34464097023,14.578319402714294,1,-1,-1,llm8_g1,0,
2026-03-03T06:04:21.310218+00:00,BUCKET,llm_style,tune,llm_style_tune_001,64,8192,1536,bf16,NVIDIA GeForce RTX 4060,c06,64,128,32,4,3,8,0.0,0.0,99.32799637317657,193.6281619966029,16.215093375576682,1,-1,-1,llm8_g1,0,
2026-03-03T06:04:21.600667+00:00,BUCKET,llm_style,tune,llm_style_tune_002,32,3072,8192,bf16,NVIDIA GeForce RTX 4060,c10,64,128,64,8,3,8,0.0,290.393,231.11999779939651,269.1574275493621,6.968729453683845,2,-1,-1,llm8_g2,0,
2026-03-03T06:04:21.831465+00:00,BUCKET,llm_style,tune,llm_style_tune_003,4,6144,3072,bf16,NVIDIA GeForce RTX 4060,c11,32,128,32,4,2,8,0.0,230.757,178.17600071430206,259.8691248893735,0.847448272464675,5,-1,-1,llm8_g5,0,
2026-03-03T06:04:21.880730+00:00,BUCKET,llm_style,tune,llm_style_tune_004,8,8192,1024,bf16,NVIDIA GeForce RTX 4060,c11,32,128,32,4,2,8,0.0,0.0,60.92800013720989,197.43743598461145,2.20289075134161,5,-1,-1,llm8_g5,0,
2026-03-03T06:04:22.010638+00:00,BUCKET,llm_style,tune,llm_style_tune_005,32,8192,3072,bf16,NVIDIA GeForce RTX 4060,c06,64,128,32,4,3,8,0.0,0.0,262.14399933815,367.8422474861144,6.144000015512108,1,-1,-1,llm8_g1,0,
2026-03-03T06:04:22.577797+00:00,BUCKET,llm_style,tune,llm_style_tune_006,32,6144,8192,bf16,NVIDIA GeForce RTX 4060,c06,64,128,32,4,3,8,0.0,567.105,429.05598878860474,470.09792268276215,7.507704253458383,0,-1,-1,llm8_g0,0,
2026-03-03T06:04:22.653751+00:00,BUCKET,llm_style,tune,llm_style_tune_007,8,1536,2048,bf16,NVIDIA GeForce RTX 4060,c04,64,64,64,4,3,8,0.0,75.891,44.015999883413315,63.047680817544446,1.1434852811094867,7,-1,-1,llm8_g7,0,
2026-03-03T06:04:22.678621+00:00,BUCKET,llm_style,tune,llm_style_tune_008,16,1536,4096,bf16,NVIDIA GeForce RTX 4060,c04,64,64,64,4,3,8,0.0,0.0,61.43999844789505,168.1871986389159,3.276800082778933,7,-1,-1,llm8_g7,0,
2026-03-03T06:04:22.758158+00:00,BUCKET,llm_style,tune,llm_style_tune_009,64,1536,2048,bf16,NVIDIA GeForce RTX 4060,c04,64,64,64,4,3,8,0.0,79.475,50.20799860358238,57.425918914377675,8.019701943890478,3,-1,-1,llm8_g3,0,
2026-03-03T06:04:22.768776+00:00,BUCKET,llm_style,tune,llm_style_tune_010,2,2048,1024,bf16,NVIDIA GeForce RTX 4060,c04,64,64,64,4,3,8,0.0,0.0,39.93599861860275,60.338561087846756,0.21005128931701406,7,-1,-1,llm8_g7,0,
2026-03-03T06:04:23.058614+00:00,BUCKET,llm_style,tune,llm_style_tune_011,2,3072,8192,bf16,NVIDIA GeForce RTX 4060,c04,64,64,64,4,3,8,0.0,289.8,227.11999714374542,276.34688049554813,0.44321634935689824,6,-1,-1,llm8_g6,0,
2026-03-03T06:04:23.081052+00:00,BUCKET,llm_style,tune,llm_style_tune_012,64,2048,1536,bf16,NVIDIA GeForce RTX 4060,c04,64,64,64,4,3,8,0.0,0.0,53.247999399900436,272.1689590811729,7.561846239067394,3,-1,-1,llm8_g3,0,
2026-03-03T06:04:23.248452+00:00,BUCKET,llm_style,tune,llm_style_tune_013,16,8192,4096,bf16,NVIDIA GeForce RTX 4060,c11,32,128,32,4,2,8,0.0,0.0,316.97599589824677,423.40031683444977,3.38745469024312,5,-1,-1,llm8_g5,0,
2026-03-03T06:04:23.417252+00:00,BUCKET,llm_style,tune,llm_style_tune_014,4,8192,4096,bf16,NVIDIA GeForce RTX 4060,c11,32,128,32,4,2,8,0.0,0.0,315.91999530792236,396.64159804582573,0.8496944162662452,5,-1,-1,llm8_g5,0,
2026-03-03T06:04:23.443986+00:00,BUCKET,llm_style,tune,llm_style_tune_015,4,3072,2048,bf16,NVIDIA GeForce RTX 4060,c04,64,64,64,4,3,8,0.0,0.0,59.728000313043594,218.76160204410547,0.8426809492399566,7,-1,-1,llm8_g7,0,
2026-03-03T06:04:23.454276+00:00,BUCKET,llm_style,tune,llm_style_tune_016,16,1536,1024,bf16,NVIDIA GeForce RTX 4060,c04,64,64,64,4,3,8,0.0,0.0,38.91199827194214,108.52383889257908,1.2934737416528952,7,-1,-1,llm8_g7,0,
2026-03-03T06:04:23.466341+00:00,BUCKET,llm_style,tune,llm_style_tune_017,32,1024,2048,bf16,NVIDIA GeForce RTX 4060,c04,64,64,64,4,3,8,0.0,0.0,50.543999299407005,62.78431896120309,2.655463158048411,3,-1,-1,llm8_g3,0,
2026-03-03T06:04:23.482177+00:00,BUCKET,llm_style,tune,llm_style_tune_018,64,1536,2048,bf16,NVIDIA GeForce RTX 4060,c04,64,64,64,4,3,8,0.0,0.0,47.93599992990494,74.08704154193401,8.399807755940943,3,-1,-1,llm8_g3,0,
2026-03-03T06:04:23.506436+00:00,BUCKET,llm_style,tune,llm_style_tune_019,4,4096,1536,bf16,NVIDIA GeForce RTX 4060,c04,64,64,64,4,3,8,0.0,0.0,60.416001826524734,164.9663962423801,0.8330847205765054,7,-1,-1,llm8_g7,0,
2026-03-03T06:04:23.564322+00:00,BUCKET,llm_style,tune,llm_style_tune_020,1,8192,1536,bf16,NVIDIA GeForce RTX 4060,c11,32,128,32,4,2,8,0.0,0.0,63.871998339891434,131.71327941119665,0.3940040182566609,5,-1,-1,llm8_g5,0,
2026-03-03T06:04:23.594915+00:00,BUCKET,llm_style,tune,llm_style_tune_021,64,1536,4096,bf16,NVIDIA GeForce RTX 4060,c04,64,64,64,4,3,8,0.0,0.0,89.56800028681755,176.20992004871368,8.991005330265518,3,-1,-1,llm8_g3,0,
2026-03-03T06:04:23.620896+00:00,BUCKET,llm_style,tune,llm_style_tune_022,64,1024,6144,bf16,NVIDIA GeForce RTX 4060,c04,64,64,64,4,3,8,0.0,0.0,77.66399905085564,158.2143971323967,10.369107666895601,3,-1,-1,llm8_g3,0,
2026-03-03T06:04:23.639805+00:00,BUCKET,llm_style,tune,llm_style_tune_023,8,4096,1024,bf16,NVIDIA GeForce RTX 4060,c04,64,64,64,4,3,8,0.0,0.0,69.56800073385239,164.57663938403124,0.9646513237708189,7,-1,-1,llm8_g7,0,
2026-03-03T06:04:23.726918+00:00,BUCKET,llm_style,tune,llm_style_tune_024,8,4096,4096,bf16,NVIDIA GeForce RTX 4060,c04,64,64,64,4,3,8,0.0,0.0,175.05600303411484,258.67262691259384,1.5334261684684267,7,-1,-1,llm8_g7,0,
2026-03-03T06:04:23.752561+00:00,BUCKET,llm_style,tune,llm_style_tune_025,32,6144,1024,bf16,NVIDIA GeForce RTX 4060,c06,64,128,32,4,3,8,0.0,0.0,75.77600330114365,237.10111409425724,5.313729498239754,1,-1,-1,llm8_g1,0,
2026-03-03T06:04:23.773832+00:00,BUCKET,llm_style,tune,llm_style_tune_026,1,3072,1536,bf16,NVIDIA GeForce RTX 4060,c04,64,64,64,4,3,8,0.0,0.0,70.62400132417679,142.53951549530024,0.13362573378817263,7,-1,-1,llm8_g7,0,
2026-03-03T06:04:23.811756+00:00,BUCKET,llm_style,tune,llm_style_tune_027,1,6144,1536,bf16,NVIDIA GeForce RTX 4060,c11,32,128,32,4,2,8,0.0,0.0,69.63200122117996,162.0214462280273,0.2710588187756836,5,-1,-1,llm8_g5,0,
2026-03-03T06:04:23.846709+00:00,BUCKET,llm_style,tune,llm_style_tune_028,4,4096,1536,bf16,NVIDIA GeForce RTX 4060,c04,64,64,64,4,3,8,0.0,0.0,57.08799883723259,92.10912063717831,0.8816502421726837,7,-1,-1,llm8_g7,0,
2026-03-03T06:04:23.875290+00:00,BUCKET,llm_style,tune,llm_style_tune_029,16,1024,6144,bf16,NVIDIA GeForce RTX 4060,c04,64,64,64,4,3,8,0.0,0.0,80.89599758386612,206.2847986817358,2.488708935090165,7,-1,-1,llm8_g7,0,
2026-03-03T06:04:24.044514+00:00,BUCKET,llm_style,tune,llm_style_tune_030,64,4096,8192,bf16,NVIDIA GeForce RTX 4060,c10,64,128,64,8,3,8,0.0,0.0,328.73599231243134,354.36607211828226,13.065095993255447,2,-1,-1,llm8_g2,0,
2026-03-03T06:04:24.071968+00:00,BUCKET,llm_style,tune,llm_style_tune_031,1,6144,1024,bf16,NVIDIA GeForce RTX 4060,c11,32,128,32,4,2,8,0.0,0.0,67.34399870038033,161.33119866251945,0.18684533503842768,5,-1,-1,llm8_g5,0,
2026-03-03T06:04:24.095078+00:00,BUCKET,llm_style,tune,llm_style_tune_032,64,1024,4096,bf16,NVIDIA GeForce RTX 4060,c04,64,64,64,4,3,8,0.0,0.0,86.01599931716919,198.14623966813087,6.241523859071624,3,-1,-1,llm8_g3,0,
2026-03-03T06:04:24.265868+00:00,BUCKET,llm_style,tune,llm_style_tune_033,2,4096,8192,bf16,NVIDIA GeForce RTX 4060,c04,64,64,64,4,3,8,0.0,0.0,323.5519975423813,345.1632088422775,0.4148258364018264,6,-1,-1,llm8_g6,0,
2026-03-03T06:04:24.504897+00:00,BUCKET,llm_style,tune,llm_style_tune_034,1,8192,6144,bf16,NVIDIA GeForce RTX 4060,c11,32,128,32,4,2,8,0.0,0.0,424.9599874019623,479.784958064556,0.23687711545601195,5,-1,-1,llm8_g5,0,
2026-03-03T06:04:24.515037+00:00,BUCKET,llm_style,tune,llm_style_tune_035,64,1536,1024,bf16,NVIDIA GeForce RTX 4060,c04,64,64,64,4,3,8,0.0,0.0,36.59199923276901,93.92128366976962,5.501929280204707,3,-1,-1,llm8_g3,0,
2026-03-03T06:04:24.538679+00:00,BUCKET,llm_style,tune,llm_style_tune_036,32,3072,2048,bf16,NVIDIA GeForce RTX 4060,c04,64,64,64,4,3,8,0.0,0.0,53.247999399900436,63.86783961206673,7.561846239067394,3,-1,-1,llm8_g3,0,
2026-03-03T06:04:24.574619+00:00,BUCKET,llm_style,tune,llm_style_tune_037,4,1536,6144,bf16,NVIDIA GeForce RTX 4060,c04,64,64,64,4,3,8,0.0,0.0,69.63200122117996,79.7292798012495,1.0842352751027344,7,-1,-1,llm8_g7,0,
2026-03-03T06:04:24.605168+00:00,BUCKET,llm_style,tune,llm_style_tune_038,1,4096,1536,bf16,NVIDIA GeForce RTX 4060,c04,64,64,64,4,3,8,0.0,0.0,57.34400078654289,140.37696152925486,0.219428568418841,7,-1,-1,llm8_g7,0,
2026-03-03T06:04:24.630307+00:00,BUCKET,llm_style,tune,llm_style_tune_039,4,1536,4096,bf16,NVIDIA GeForce RTX 4060,c04,64,64,64,4,3,8,0.0,0.0,57.29600042104721,135.76608076691625,0.8784495886297691,7,-1,-1,llm8_g7,0,
2026-03-03T06:04:25.189598+00:00,BUCKET,llm_style,tune,llm_style_tune_040,2,6144,8192,bf16,NVIDIA GeForce RTX 4060,c06,64,128,32,4,3,8,0.0,559.236,424.9759912490845,484.8908904194832,0.4737363901623318,4,-1,-1,llm8_g4,0,
2026-03-03T06:04:25.208448+00:00,BUCKET,llm_style,tune,llm_style_tune_041,16,1024,1536,bf16,NVIDIA GeForce RTX 4060,c04,64,64,64,4,3,8,0.0,0.0,53.199999034404755,1067.568975985048,0.9460836261942454,7,-1,-1,llm8_g7,0,
2026-03-03T06:04:25.237082+00:00,BUCKET,llm_style,tune,llm_style_tune_042,32,3072,2048,bf16,NVIDIA GeForce RTX 4060,c04,64,64,64,4,3,8,0.0,0.0,57.34400078654289,131.1123192310333,7.021714189402912,3,-1,-1,llm8_g3,0,
2026-03-03T06:04:25.274802+00:00,BUCKET,llm_style,tune,llm_style_tune_043,2,2048,4096,bf16,NVIDIA GeForce RTX 4060,c04,64,64,64,4,3,8,0.0,0.0,80.65600320696831,153.29824075102783,0.416019027299149,7,-1,-1,llm8_g7,0,
2026-03-03T06:04:25.366087+00:00,BUCKET,llm_style,tune,llm_style_tune_044,64,2048,8192,bf16,NVIDIA GeForce RTX 4060,c10,64,128,64,8,3,8,0.0,0.0,171.00800573825836,207.99488335847852,12.55779598580255,2,-1,-1,llm8_g2,0,
2026-03-03T06:04:25.488791+00:00,BUCKET,llm_style,tune,llm_style_tune_045,2,3072,8192,bf16,NVIDIA GeForce RTX 4060,c04,64,64,64,4,3,8,0.0,0.0,230.3999960422516,431.8924733996391,0.43690667417173046,6,-1,-1,llm8_g6,0,
2026-03-03T06:04:25.736734+00:00,BUCKET,llm_style,tune,llm_style_tune_046,4,8192,6144,bf16,NVIDIA GeForce RTX 4060,c11,32,128,32,4,2,8,0.0,0.0,425.9839951992035,457.16704457998276,0.9452307798834243,5,-1,-1,llm8_g5,0,
2026-03-03T06:04:25.770863+00:00,BUCKET,llm_style,tune,llm_style_tune_047,1,1024,6144,bf16,NVIDIA GeForce RTX 4060,c04,64,64,64,4,3,8,0.0,0.0,93.96800026297569,228.74496310949297,0.13390635072350038,7,-1,-1,llm8_g7,0,
2026-03-03T06:04:25.834438+00:00,BUCKET,llm_style,tune,llm_style_tune_048,32,4096,3072,bf16,NVIDIA GeForce RTX 4060,c04,64,64,64,4,3,8,0.0,0.0,87.0399996638298,157.2147174179554,9.252141212204666,3,-1,-1,llm8_g3,0,
2026-03-03T06:04:25.847152+00:00,BUCKET,llm_style,tune,llm_style_tune_049,16,2048,1024,bf16,NVIDIA GeForce RTX 4060,c04,64,64,64,4,3,8,0.0,0.0,40.991999208927155,134.2259205877781,1.63712103081289,7,-1,-1,llm8_g7,0,
2026-03-03T06:04:25.858399+00:00,BUCKET,llm_style,tune,llm_style_tune_050,4,1024,1536,bf16,NVIDIA GeForce RTX 4060,c04,64,64,64,4,3,8,0.0,0.0,35.66399961709976,126.31519675254822,0.35281830796024605,7,-1,-1,llm8_g7,0,
2026-03-03T06:04:26.019640+00:00,BUCKET,llm_style,tune,llm_style_tune_051,64,4096,8192,bf16,NVIDIA GeForce RTX 4060,c10,64,128,64,8,3,8,0.0,0.0,306.17600679397583,406.5875193476676,14.02777226397776,2,-1,-1,llm8_g2,0,
2026-03-03T06:04:26.035269+00:00,BUCKET,llm_style,tune,llm_style_tune_052,16,2048,1536,bf16,NVIDIA GeForce RTX 4060,c04,64,64,64,4,3,8,0.0,0.0,49.0880012512207,132.11648002266884,2.05067009114568,7,-1,-1,llm8_g7,0,
2026-03-03T06:04:26.042760+00:00,BUCKET,llm_style,tune,llm_style_tune_053,64,1024,1024,bf16,NVIDIA GeForce RTX 4060,c04,64,64,64,4,3,8,0.0,0.0,35.840000957250595,53.22560030966995,3.7449141856913686,3,-1,-1,llm8_g3,0,
2026-03-03T06:04:26.215145+00:00,BUCKET,llm_style,tune,llm_style_tune_054,4,4096,8192,bf16,NVIDIA GeForce RTX 4060,c04,64,64,64,4,3,8,0.0,0.0,296.9599962234497,317.2931179404259,0.9039448390820082,6,-1,-1,llm8_g6,0,
2026-03-03T06:04:26.275071+00:00,BUCKET,llm_style,tune,llm_style_tune_055,1,4096,3072,bf16,NVIDIA GeForce RTX 4060,c04,64,64,64,4,3,8,0.0,0.0,64.2399974167347,123.30015800893301,0.3917469646946815,7,-1,-1,llm8_g7,0,
2026-03-03T06:04:26.295778+00:00,BUCKET,llm_style,tune,llm_style_tune_056,64,1536,2048,bf16,NVIDIA GeForce RTX 4060,c04,64,64,64,4,3,8,0.0,0.0,76.80000364780426,144.4729635119438,5.2428797509765745,3,-1,-1,llm8_g3,0,
2026-03-03T06:04:26.330935+00:00,BUCKET,llm_style,tune,llm_style_tune_057,2,4096,2048,bf16,NVIDIA GeForce RTX 4060,c04,64,64,64,4,3,8,0.0,0.0,67.50399991869926,73.87872345745564,0.49707324070295716,7,-1,-1,llm8_g7,0,
2026-03-03T06:04:26.391447+00:00,BUCKET,llm_style,tune,llm_style_tune_058,4,8192,1536,bf16,NVIDIA GeForce RTX 4060,c11,32,128,32,4,2,8,0.0,0.0,61.77599914371967,113.3107198774813,1.6294887560751612,5,-1,-1,llm8_g5,0,
2026-03-03T06:04:26.416670+00:00,BUCKET,llm_style,tune,llm_style_tune_059,1,1536,4096,bf16,NVIDIA GeForce RTX 4060,c04,64,64,64,4,3,8,0.0,0.0,57.10400082170963,122.36800402402866,0.22035079537222663,7,-1,-1,llm8_g7,0,
2026-03-03T06:04:26.443304+00:00,BUCKET,llm_style,tune,llm_style_tune_060,64,1536,4096,bf16,NVIDIA GeForce RTX 4060,c04,64,64,64,4,3,8,0.0,0.0,69.16800141334534,202.3116849362848,11.642758957100984,3,-1,-1,llm8_g3,0,
2026-03-03T06:04:26.686489+00:00,BUCKET,llm_style,tune,llm_style_tune_061,8,8192,6144,bf16,NVIDIA GeForce RTX 4060,c11,32,128,32,4,2,8,0.0,0.0,438.27199935913086,510.3974288702011,1.8374579466120813,5,-1,-1,llm8_g5,0,
2026-03-03T06:04:26.727355+00:00,BUCKET,llm_style,tune,llm_style_tune_062,64,6144,1536,bf16,NVIDIA GeForce RTX 4060,c06,64,128,32,4,3,8,0.0,0.0,88.16000074148178,173.91072250902624,13.701900429222894,1,-1,-1,llm8_g1,0,
2026-03-03T06:04:26.741401+00:00,BUCKET,llm_style,tune,llm_style_tune_063,2,1536,1024,bf16,NVIDIA GeForce RTX 4060,c04,64,64,64,4,3,8,0.0,0.0,70.16000151634216,215.64288035035128,0.08967297411666318,7,-1,-1,llm8_g7,0,
2026-03-03T06:04:26.751301+00:00,BUCKET,llm_style,eval,llm_style_eval_000,32,1536,1024,bf16,NVIDIA GeForce RTX 4060,c04,64,64,64,4,3,8,0.0,0.0,34.81600061058998,154.97856006026262,2.8912940669406253,3,-1,-1,llm8_g3,0,
2026-03-03T06:04:26.842631+00:00,BUCKET,llm_style,eval,llm_style_eval_001,32,2048,8192,bf16,NVIDIA GeForce RTX 4060,c10,64,128,64,8,3,8,0.0,0.0,164.86400365829468,254.7200079262256,6.512894265418245,2,-1,-1,llm8_g2,0,
2026-03-03T06:04:26.892350+00:00,BUCKET,llm_style,eval,llm_style_eval_002,16,2048,4096,bf16,NVIDIA GeForce RTX 4060,c04,64,64,64,4,3,8,0.0,0.0,81.87199756503105,255.81696704030009,3.278721223172566,7,-1,-1,llm8_g7,0,
2026-03-03T06:04:26.910237+00:00,BUCKET,llm_style,eval,llm_style_eval_003,16,2048,1536,bf16,NVIDIA GeForce RTX 4060,c04,64,64,64,4,3,8,0.0,0.0,72.7040022611618,236.9455972313881,1.3845633372204869,7,-1,-1,llm8_g7,0,
2026-03-03T06:04:27.001755+00:00,BUCKET,llm_style,eval,llm_style_eval_004,64,8192,2048,bf16,NVIDIA GeForce RTX 4060,c06,64,128,32,4,3,8,0.0,0.0,175.10400712490082,296.69919610023493,12.264046284607355,1,-1,-1,llm8_g1,0,
2026-03-03T06:04:27.127647+00:00,BUCKET,llm_style,eval,llm_style_eval_005,64,3072,8192,bf16,NVIDIA GeForce RTX 4060,c10,64,128,64,8,3,8,0.0,0.0,238.5919988155365,296.4201661944388,13.500978607796641,2,-1,-1,llm8_g2,0,
2026-03-03T06:04:27.150554+00:00,BUCKET,llm_style,eval,llm_style_eval_006,32,2048,2048,bf16,NVIDIA GeForce RTX 4060,c04,64,64,64,4,3,8,0.0,0.0,75.66400244832039,146.95424139499664,3.5477300607160625,3,-1,-1,llm8_g3,0,
2026-03-03T06:04:27.237902+00:00,BUCKET,llm_style,eval,llm_style_eval_007,8,8192,2048,bf16,NVIDIA GeForce RTX 4060,c11,32,128,32,4,2,8,0.0,0.0,166.81600362062454,285.7148790359496,1.6091708839307763,5,-1,-1,llm8_g5,0,
2026-03-03T06:04:27.311312+00:00,BUCKET,llm_style,eval,llm_style_eval_008,64,1536,8192,bf16,NVIDIA GeForce RTX 4060,c10,64,128,64,8,3,8,0.0,0.0,217.0879989862442,225.2800017595291,7.419169845966734,2,-1,-1,llm8_g2,0,
2026-03-03T06:04:27.439909+00:00,BUCKET,llm_style,eval,llm_style_eval_009,64,4096,6144,bf16,NVIDIA GeForce RTX 4060,c04,64,64,64,4,3,8,0.0,0.0,253.88799607753754,442.73664057254786,12.687584768742813,3,-1,-1,llm8_g3,0,
2026-03-03T06:04:27.489197+00:00,BUCKET,llm_style,eval,llm_style_eval_010,64,2048,4096,bf16,NVIDIA GeForce RTX 4060,c04,64,64,64,4,3,8,0.0,0.0,128.00000607967377,227.91647508740422,8.38860760156252,3,-1,-1,llm8_g3,0,
2026-03-03T06:04:27.588117+00:00,BUCKET,llm_style,eval,llm_style_eval_011,32,3072,6144,bf16,NVIDIA GeForce RTX 4060,c04,64,64,64,4,3,8,0.0,0.0,190.86400419473648,241.4182470738886,6.328901864426631,3,-1,-1,llm8_g3,0,
2026-03-03T06:04:27.602521+00:00,BUCKET,llm_style,eval,llm_style_eval_012,16,1536,1536,bf16,NVIDIA GeForce RTX 4060,c04,64,64,64,4,3,8,0.0,0.0,51.19999870657921,115.33311799168584,1.4745600372505199,7,-1,-1,llm8_g7,0,
2026-03-03T06:04:27.632255+00:00,BUCKET,llm_style,eval,llm_style_eval_013,64,2048,3072,bf16,NVIDIA GeForce RTX 4060,c04,64,64,64,4,3,8,0.0,0.0,112.5119999051094,192.01024174690247,7.157515364398295,3,-1,-1,llm8_g3,0,
2026-03-03T06:04:27.891324+00:00,BUCKET,llm_style,eval,llm_style_eval_014,16,8192,6144,bf16,NVIDIA GeForce RTX 4060,c11,32,128,32,4,2,8,0.0,0.0,693.1679844856262,722.4422574043274,2.3235532685416436,5,-1,-1,llm8_g5,0,
2026-03-03T06:04:27.934727+00:00,BUCKET,llm_style,eval,llm_style_eval_015,64,6144,1536,bf16,NVIDIA GeForce RTX 4060,c06,64,128,32,4,3,8,0.0,0.0,112.60800063610077,205.88543519377708,10.727120144008158,1,-1,-1,llm8_g1,0,
2026-03-03T06:04:28.027132+00:00,BUCKET,llm_style,eval,llm_style_eval_016,16,4096,4096,bf16,NVIDIA GeForce RTX 4060,c04,64,64,64,4,3,8,0.0,0.0,257.02399015426636,325.68255841732025,2.0887968927638583,7,-1,-1,llm8_g7,0,
2026-03-03T06:04:28.209100+00:00,BUCKET,llm_style,eval,llm_style_eval_017,64,8192,4096,bf16,NVIDIA GeForce RTX 4060,c06,64,128,32,4,3,8,0.0,0.0,491.5199875831604,629.8111933469771,8.738133554077153,1,-1,-1,llm8_g1,0,
2026-03-03T06:04:28.344932+00:00,BUCKET,llm_style,eval,llm_style_eval_018,32,4096,6144,bf16,NVIDIA GeForce RTX 4060,c04,64,64,64,4,3,8,0.0,0.0,373.76001477241516,446.77024036645867,4.309216268039566,3,-1,-1,llm8_g3,0,
2026-03-03T06:04:28.482014+00:00,BUCKET,llm_style,eval,llm_style_eval_019,16,3072,8192,bf16,NVIDIA GeForce RTX 4060,c04,64,64,64,4,3,8,0.0,0.0,393.12000572681427,456.07296407222736,2.0485000922583954,6,-1,-1,llm8_g6,0,
2026-03-03T06:04:28.500452+00:00,BUCKET,llm_style,eval,llm_style_eval_020,4,1536,1536,bf16,NVIDIA GeForce RTX 4060,c04,64,64,64,4,3,8,0.0,0.0,78.72000336647034,189.2659278213975,0.23976584340492124,7,-1,-1,llm8_g7,0,
2026-03-03T06:04:28.547276+00:00,BUCKET,llm_style,eval,llm_style_eval_021,4,6144,1536,bf16,NVIDIA GeForce RTX 4060,c11,32,128,32,4,2,8,0.0,0.0,74.75200295448303,155.91424062848085,1.0099725628217733,5,-1,-1,llm8_g5,0,
2026-03-03T06:04:28.579738+00:00,BUCKET,llm_style,eval,llm_style_eval_022,32,6144,1024,bf16,NVIDIA GeForce RTX 4060,c06,64,128,32,4,3,8,0.0,0.0,84.99199897050858,100.30720002949238,4.7375422260596185,1,-1,-1,llm8_g1,0,
2026-03-03T06:04:28.594237+00:00,BUCKET,llm_style,eval,llm_style_eval_023,16,1024,1536,bf16,NVIDIA GeForce RTX 4060,c04,64,64,64,4,3,8,0.0,0.0,63.48799914121628,140.55424287915224,0.7927742042720133,7,-1,-1,llm8_g7,0,
2026-03-03T06:04:28.636830+00:00,BUCKET,llm_style,eval,llm_style_eval_024,32,8192,1024,bf16,NVIDIA GeForce RTX 4060,c06,64,128,32,4,3,8,0.0,0.0,125.93600153923035,148.52095812559128,4.263045558364493,1,-1,-1,llm8_g1,0,
2026-03-03T06:04:28.834269+00:00,BUCKET,llm_style,eval,llm_style_eval_025,32,6144,6144,bf16,NVIDIA GeForce RTX 4060,c06,64,128,32,4,3,8,0.0,0.0,534.38401222229,591.3436746597289,4.5209419607318635,1,-1,-1,llm8_g1,0,
2026-03-03T06:04:28.896337+00:00,BUCKET,llm_style,eval,llm_style_eval_026,1,6144,2048,bf16,NVIDIA GeForce RTX 4060,c11,32,128,32,4,2,8,0.0,0.0,105.47199845314026,200.22303998470304,0.23860194524692566,5,-1,-1,llm8_g5,0,
2026-03-03T06:04:28.965415+00:00,BUCKET,llm_style,eval,llm_style_eval_027,32,4096,3072,bf16,NVIDIA GeForce RTX 4060,c04,64,64,64,4,3,8,0.0,0.0,191.3600042462349,215.13440161943433,4.208331679193328,3,-1,-1,llm8_g3,0,
2026-03-03T06:04:28.979479+00:00,BUCKET,llm_style,eval,llm_style_eval_028,64,1536,1536,bf16,NVIDIA GeForce RTX 4060,c04,64,64,64,4,3,8,0.0,0.0,58.36800113320351,137.58047804236406,5.173894636391935,3,-1,-1,llm8_g3,0,
2026-03-03T06:04:28.993821+00:00,BUCKET,llm_style,eval,llm_style_eval_029,2,3072,1024,bf16,NVIDIA GeForce RTX 4060,c04,64,64,64,4,3,8,0.0,0.0,63.48799914121628,85.0044786185026,0.19819355106800332,7,-1,-1,llm8_g7,0,
2026-03-03T06:04:29.071834+00:00,BUCKET,llm_style,eval,llm_style_eval_030,32,1536,8192,bf16,NVIDIA GeForce RTX 4060,c10,64,128,64,8,3,8,0.0,0.0,325.6320059299469,438.9171230792999,2.4730565587377953,2,-1,-1,llm8_g2,0,
2026-03-03T06:04:29.099395+00:00,BUCKET,llm_style,eval,llm_style_eval_031,8,3072,2048,bf16,NVIDIA GeForce RTX 4060,c04,64,64,64,4,3,8,0.0,0.0,107.90399834513664,165.57056024670595,0.9328968114603422,7,-1,-1,llm8_g7,0,
2026-03-03T06:04:29.128359+00:00,BUCKET,llm_style,eval,llm_style_eval_032,8,2048,3072,bf16,NVIDIA GeForce RTX 4060,c04,64,64,64,4,3,8,0.0,0.0,136.54399663209915,195.12320265173912,0.7372224226834722,7,-1,-1,llm8_g7,0,
2026-03-03T06:04:29.209572+00:00,BUCKET,llm_style,eval,llm_style_eval_033,64,1536,8192,bf16,NVIDIA GeForce RTX 4060,c10,64,128,64,8,3,8,0.0,0.0,330.7519853115082,549.1836977005001,4.869548203869725,2,-1,-1,llm8_g2,0,
2026-03-03T06:04:29.276455+00:00,BUCKET,llm_style,eval,llm_style_eval_034,64,6144,2048,bf16,NVIDIA GeForce RTX 4060,c06,64,128,32,4,3,8,0.0,0.0,175.04000663757324,240.30976623296723,9.201397822926463,1,-1,-1,llm8_g1,0,
2026-03-03T06:04:29.315784+00:00,BUCKET,llm_style,eval,llm_style_eval_035,4,4096,2048,bf16,NVIDIA GeForce RTX 4060,c04,64,64,64,4,3,8,0.0,0.0,143.79199594259262,259.6182304620743,0.46670792459680766,7,-1,-1,llm8_g7,0,
2026-03-03T06:04:29.500677+00:00,BUCKET,llm_style,eval,llm_style_eval_036,64,8192,4096,bf16,NVIDIA GeForce RTX 4060,c06,64,128,32,4,3,8,0.0,0.0,507.9039931297302,542.8223901987076,8.456258178901475,1,-1,-1,llm8_g1,0,
2026-03-03T06:04:29.536131+00:00,BUCKET,llm_style,eval,llm_style_eval_037,32,6144,1024,bf16,NVIDIA GeForce RTX 4060,c06,64,128,32,4,3,8,0.0,0.0,111.61600053310394,193.5974459350109,3.607486221301918,1,-1,-1,llm8_g1,0,
2026-03-03T06:04:29.608397+00:00,BUCKET,llm_style,eval,llm_style_eval_038,64,6144,2048,bf16,NVIDIA GeForce RTX 4060,c06,64,128,32,4,3,8,0.0,0.0,187.391996383667,306.58560693263996,8.594885411767672,1,-1,-1,llm8_g1,0,
2026-03-03T06:04:29.630704+00:00,BUCKET,llm_style,eval,llm_style_eval_039,8,1024,3072,bf16,NVIDIA GeForce RTX 4060,c04,64,64,64,4,3,8,0.0,0.0,104.95999827980995,242.69824355840655,0.4795317151761212,7,-1,-1,llm8_g7,0,
2026-03-03T06:04:29.723699+00:00,BUCKET,llm_style,eval,llm_style_eval_040,32,8192,2048,bf16,NVIDIA GeForce RTX 4060,c06,64,128,32,4,3,8,0.0,0.0,276.4799892902374,470.8345586061477,3.8836149652509913,1,-1,-1,llm8_g1,0,
2026-03-03T06:04:29.741696+00:00,BUCKET,llm_style,eval,llm_style_eval_041,32,3072,1024,bf16,NVIDIA GeForce RTX 4060,c04,64,64,64,4,3,8,0.0,0.0,94.72000226378441,193.20640116930002,2.1254918410931665,3,-1,-1,llm8_g3,0,
2026-03-03T06:04:29.765563+00:00,BUCKET,llm_style,eval,llm_style_eval_042,64,1024,4096,bf16,NVIDIA GeForce RTX 4060,c04,64,64,64,4,3,8,0.0,0.0,131.00799918174744,238.20415705442414,4.098001002634952,3,-1,-1,llm8_g3,0,
2026-03-03T06:04:29.777227+00:00,BUCKET,llm_style,eval,llm_style_eval_043,2,1536,1024,bf16,NVIDIA GeForce RTX 4060,c04,64,64,64,4,3,8,0.0,0.0,63.48799914121628,194.25311863422388,0.09909677553400166,7,-1,-1,llm8_g7,0,
2026-03-03T06:04:29.876383+00:00,BUCKET,llm_style,eval,llm_style_eval_044,64,6144,3072,bf16,NVIDIA GeForce RTX 4060,c06,64,128,32,4,3,8,0.0,0.0,292.86399483680725,424.7039973735805,8.249286858721652,1,-1,-1,llm8_g1,0,
2026-03-03T06:04:29.921815+00:00,BUCKET,llm_style,eval,llm_style_eval_045,64,1536,6144,bf16,NVIDIA GeForce RTX 4060,c04,64,64,64,4,3,8,0.0,0.0,178.17600071430206,194.45984154939651,6.7795861797174,3,-1,-1,llm8_g3,0,
2026-03-03T06:04:30.022036+00:00,BUCKET,llm_style,eval,llm_style_eval_046,2,6144,3072,bf16,NVIDIA GeForce RTX 4060,c11,32,128,32,4,2,8,0.0,0.0,279.5040011405945,316.8544027209281,0.27011231213832854,5,-1,-1,llm8_g5,0,
2026-03-03T06:04:30.202974+00:00,BUCKET,llm_style,eval,llm_style_eval_047,16,4096,8192,bf16,NVIDIA GeForce RTX 4060,c04,64,64,64,4,3,8,0.0,0.0,573.2960104942322,661.0739129781722,1.8729274307601391,6,-1,-1,llm8_g6,0,
2026-03-03T06:04:30.247404+00:00,BUCKET,llm_style,eval,llm_style_eval_048,16,1024,6144,bf16,NVIDIA GeForce RTX 4060,c04,64,64,64,4,3,8,0.0,0.0,187.391996383667,255.18079683184618,1.074360676470959,7,-1,-1,llm8_g7,0,
2026-03-03T06:04:30.313227+00:00,BUCKET,llm_style,eval,llm_style_eval_049,16,8192,1536,bf16,NVIDIA GeForce RTX 4060,c11,32,128,32,4,2,8,0.0,0.0,153.60000729560852,206.55103906989092,2.6214398754882873,5,-1,-1,llm8_g5,0,
2026-03-03T06:04:30.324953+00:00,BUCKET,llm_style,eval,llm_style_eval_050,1,1024,1024,bf16,NVIDIA GeForce RTX 4060,c04,64,64,64,4,3,8,0.0,0.0,59.808000922203064,206.8889585882421,0.03506473996226574,7,-1,-1,llm8_g7,0,
2026-03-03T06:04:30.355553+00:00,BUCKET,llm_style,eval,llm_style_eval_051,16,6144,1024,bf16,NVIDIA GeForce RTX 4060,c11,32,128,32,4,2,8,0.0,0.0,106.49599879980087,327.00415879487986,1.8904615597668486,5,-1,-1,llm8_g5,0,
2026-03-03T06:04:30.745141+00:00,BUCKET,llm_style,eval,llm_style_eval_052,16,8192,8192,bf16,NVIDIA GeForce RTX 4060,c06,64,128,32,4,3,8,0.0,0.0,1249.2799758911133,1279.1439890861511,1.7189770823535346,4,-1,-1,llm8_g4,0,
2026-03-03T06:04:31.003811+00:00,BUCKET,llm_style,eval,llm_style_eval_053,1,6144,8192,bf16,NVIDIA GeForce RTX 4060,c06,64,128,32,4,3,8,0.0,0.0,792.495995759964,924.1907238960266,0.1270205736540901,4,-1,-1,llm8_g4,0,
2026-03-03T06:04:31.079637+00:00,BUCKET,llm_style,eval,llm_style_eval_054,64,4096,3072,bf16,NVIDIA GeForce RTX 4060,c04,64,64,64,4,3,8,0.0,0.0,258.0160051584244,312.20735013484943,6.24229777920586,3,-1,-1,llm8_g3,0,
2026-03-03T06:04:31.119996+00:00,BUCKET,llm_style,eval,llm_style_eval_055,4,8192,1024,bf16,NVIDIA GeForce RTX 4060,c11,32,128,32,4,2,8,0.0,0.0,120.83200365304947,141.8956796824932,0.5553898137176703,5,-1,-1,llm8_g5,0,
2026-03-03T06:04:31.146511+00:00,BUCKET,llm_style,eval,llm_style_eval_056,64,1024,3072,bf16,NVIDIA GeForce RTX 4060,c04,64,64,64,4,3,8,0.0,0.0,114.04800042510033,249.43455725908245,3.530558909399185,3,-1,-1,llm8_g3,0,
2026-03-03T06:04:31.156135+00:00,BUCKET,llm_style,eval,llm_style_eval_057,64,1024,3072,bf16,NVIDIA GeForce RTX 4060,c04,64,64,64,4,3,8,0.0,0.0,118.78400295972824,290.08895665407124,3.3897930189851655,3,-1,-1,llm8_g3,0,
2026-03-03T06:04:31.211753+00:00,BUCKET,llm_style,eval,llm_style_eval_058,32,2048,4096,bf16,NVIDIA GeForce RTX 4060,c04,64,64,64,4,3,8,0.0,0.0,232.96000063419342,287.0067128539085,2.3045626310888627,3,-1,-1,llm8_g3,0,
2026-03-03T06:04:31.307720+00:00,BUCKET,llm_style,eval,llm_style_eval_059,64,8192,2048,bf16,NVIDIA GeForce RTX 4060,c06,64,128,32,4,3,8,0.0,0.0,320.51199674606323,425.11328458786005,6.700166202207459,1,-1,-1,llm8_g1,0,
2026-03-03T06:04:31.414803+00:00,BUCKET,llm_style,eval,llm_style_eval_060,1,3072,6144,bf16,NVIDIA GeForce RTX 4060,c04,64,64,64,4,3,8,0.0,0.0,342.0160114765167,460.2697664499283,0.11037125378146771,7,-1,-1,llm8_g7,0,
2026-03-03T06:04:31.448911+00:00,BUCKET,llm_style,eval,llm_style_eval_061,64,1536,4096,bf16,NVIDIA GeForce RTX 4060,c04,64,64,64,4,3,8,0.0,0.0,140.1600018143654,173.20288211107248,5.745621843431382,3,-1,-1,llm8_g3,0,
2026-03-03T06:04:31.512507+00:00,BUCKET,llm_style,eval,llm_style_eval_062,16,6144,2048,bf16,NVIDIA GeForce RTX 4060,c11,32,128,32,4,2,8,0.0,0.0,136.62399351596832,288.87264341115946,2.947163039506225,5,-1,-1,llm8_g5,0,
2026-03-03T06:04:31.566855+00:00,BUCKET,llm_style,eval,llm_style_eval_063,64,1536,6144,bf16,NVIDIA GeForce RTX 4060,c04,64,64,64,4,3,8,0.0,0.0,202.17599719762802,208.80191549658775,5.974792105608925,3,-1,-1,llm8_g3,0,
2026-03-03T06:04:31.634485+00:00,BUCKET,llm_style,eval,llm_style_eval_064,1,6144,2048,bf16,NVIDIA GeForce RTX 4060,c11,32,128,32,4,2,8,0.0,0.0,135.53600013256073,240.22719874978054,0.18567630722012318,5,-1,-1,llm8_g5,0,
2026-03-03T06:04:31.698979+00:00,BUCKET,llm_style,eval,llm_style_eval_065,8,1536,6144,bf16,NVIDIA GeForce RTX 4060,c04,64,64,64,4,3,8,0.0,0.0,202.7519941329956,211.3519962131977,0.7447272942773354,7,-1,-1,llm8_g7,0,
2026-03-03T06:04:31.732130+00:00,BUCKET,llm_style,eval,llm_style_eval_066,64,1536,4096,bf16,NVIDIA GeForce RTX 4060,c04,64,64,64,4,3,8,0.0,0.0,142.33599603176117,205.2915222942828,5.657784330397366,3,-1,-1,llm8_g3,0,
2026-03-03T06:04:31.827624+00:00,BUCKET,llm_style,eval,llm_style_eval_067,64,8192,2048,bf16,NVIDIA GeForce RTX 4060,c06,64,128,32,4,3,8,0.0,0.0,320.51199674606323,417.31071561574913,6.700166202207459,1,-1,-1,llm8_g1,0,
2026-03-03T06:04:31.852865+00:00,BUCKET,llm_style,eval,llm_style_eval_068,64,1024,4096,bf16,NVIDIA GeForce RTX 4060,c04,64,64,64,4,3,8,0.0,0.0,151.39200538396835,292.5260856747627,3.5462302691503407,3,-1,-1,llm8_g3,0,
2026-03-03T06:04:31.898814+00:00,BUCKET,llm_style,eval,llm_style_eval_069,64,2048,4096,bf16,NVIDIA GeForce RTX 4060,c04,64,64,64,4,3,8,0.0,0.0,235.52000522613525,318.5868829488752,4.559025985792771,3,-1,-1,llm8_g3,0,
2026-03-03T06:04:31.947255+00:00,BUCKET,llm_style,eval,llm_style_eval_070,64,8192,1024,bf16,NVIDIA GeForce RTX 4060,c06,64,128,32,4,3,8,0.0,0.0,174.49600249528885,316.70271515846247,6.15338923898265,1,-1,-1,llm8_g1,0,
2026-03-03T06:04:32.021397+00:00,BUCKET,llm_style,eval,llm_style_eval_071,64,6144,2048,bf16,NVIDIA GeForce RTX 4060,c06,64,128,32,4,3,8,0.0,0.0,226.30399465560913,283.4979256987571,7.11703184228383,1,-1,-1,llm8_g1,0,
2026-03-03T06:04:32.034412+00:00,BUCKET,llm_style,eval,llm_style_eval_072,64,1536,1024,bf16,NVIDIA GeForce RTX 4060,c04,64,64,64,4,3,8,0.0,0.0,56.32000043988228,144.92672055959702,3.5746908811711084,3,-1,-1,llm8_g3,0,
2026-03-03T06:04:32.065790+00:00,BUCKET,llm_style,eval,llm_style_eval_073,1,4096,1536,bf16,NVIDIA GeForce RTX 4060,c04,64,64,64,4,3,8,0.0,0.0,140.28799533843994,178.18624421954144,0.08969343363731273,7,-1,-1,llm8_g7,0,
2026-03-03T06:04:32.080655+00:00,BUCKET,llm_style,eval,llm_style_eval_074,8,1024,2048,bf16,NVIDIA GeForce RTX 4060,c04,64,64,64,4,3,8,0.0,0.0,92.16000139713287,326.3692852854723,0.3640888833693517,7,-1,-1,llm8_g7,0,
2026-03-03T06:04:32.105151+00:00,BUCKET,llm_style,eval,llm_style_eval_075,2,6144,1024,bf16,NVIDIA GeForce RTX 4060,c11,32,128,32,4,2,8,0.0,0.0,83.96799862384796,126.04415766894806,0.29970732198507577,5,-1,-1,llm8_g5,0,
2026-03-03T06:04:32.142045+00:00,BUCKET,llm_style,eval,llm_style_eval_076,64,1024,6144,bf16,NVIDIA GeForce RTX 4060,c04,64,64,64,4,3,8,0.0,0.0,202.2399976849556,282.73888200521446,3.9819342227964527,3,-1,-1,llm8_g3,0,
2026-03-03T06:04:32.326314+00:00,BUCKET,llm_style,eval,llm_style_eval_077,1,4096,8192,bf16,NVIDIA GeForce RTX 4060,c04,64,64,64,4,3,8,0.0,0.0,628.5600066184998,696.8812841176984,0.10676604189475783,6,-1,-1,llm8_g6,0,
2026-03-03T06:04:32.434928+00:00,BUCKET,llm_style,eval,llm_style_eval_078,64,6144,3072,bf16,NVIDIA GeForce RTX 4060,c06,64,128,32,4,3,8,0.0,0.0,325.6320059299469,421.46816462278366,7.419169676213387,1,-1,-1,llm8_g1,0,
2026-03-03T06:04:32.509159+00:00,BUCKET,llm_style,eval,llm_style_eval_079,2,3072,4096,bf16,NVIDIA GeForce RTX 4060,c04,64,64,64,4,3,8,0.0,0.0,245.7439973950386,345.1215934753418,0.20481333637252927,7,-1,-1,llm8_g7,0,
2026-03-03T06:04:32.524101+00:00,BUCKET,llm_style,eval,llm_style_eval_080,4,1536,1024,bf16,NVIDIA GeForce RTX 4060,c04,64,64,64,4,3,8,0.0,0.0,59.248000383377075,67.95935958623886,0.2123769902541779,7,-1,-1,llm8_g7,0,
2026-03-03T06:04:32.676331+00:00,BUCKET,llm_style,eval,llm_style_eval_081,4,4096,6144,bf16,NVIDIA GeForce RTX 4060,c04,64,64,64,4,3,8,0.0,0.0,674.208015203476,800.0969678163528,0.2986119824446757,7,-1,-1,llm8_g7,0,
2026-03-03T06:04:32.710037+00:00,BUCKET,llm_style,eval,llm_style_eval_082,64,6144,1024,bf16,NVIDIA GeForce RTX 4060,c06,64,128,32,4,3,8,0.0,0.0,168.75199973583221,210.91328039765347,4.772129333345044,1,-1,-1,llm8_g1,0,
2026-03-03T06:04:32.815024+00:00,BUCKET,llm_style,eval,llm_style_eval_083,8,4096,4096,bf16,NVIDIA GeForce RTX 4060,c04,64,64,64,4,3,8,0.0,0.0,484.3519926071167,632.8220772743224,0.5542156532795398,7,-1,-1,llm8_g7,0,
2026-03-03T06:04:32.885970+00:00,BUCKET,llm_style,eval,llm_style_eval_084,64,1024,8192,bf16,NVIDIA GeForce RTX 4060,c10,64,128,64,8,3,8,0.0,0.0,638.975977897644,798.03072810173,1.6804103145361124,2,-1,-1,llm8_g2,0,
2026-03-03T06:04:33.034940+00:00,BUCKET,llm_style,eval,llm_style_eval_085,1,3072,8192,bf16,NVIDIA GeForce RTX 4060,c04,64,64,64,4,3,8,0.0,0.0,629.2160153388977,741.9187068939209,0.0799910472286552,6,-1,-1,llm8_g6,0,
2026-03-03T06:04:33.048288+00:00,BUCKET,llm_style,eval,llm_style_eval_086,8,1536,1024,bf16,NVIDIA GeForce RTX 4060,c04,64,64,64,4,3,8,0.0,0.0,75.15200227499008,111.50336034595959,0.33486564879423,7,-1,-1,llm8_g7,0,
2026-03-03T06:04:33.070208+00:00,BUCKET,llm_style,eval,llm_style_eval_087,16,1024,3072,bf16,NVIDIA GeForce RTX 4060,c04,64,64,64,4,3,8,0.0,0.0,166.9120043516159,227.553282380104,0.6030920088164735,7,-1,-1,llm8_g7,0,
2026-03-03T06:04:33.109857+00:00,BUCKET,llm_style,eval,llm_style_eval_088,8,4096,1536,bf16,NVIDIA GeForce RTX 4060,c04,64,64,64,4,3,8,0.0,0.0,179.18399721384048,257.21855357289303,0.5617873111730348,7,-1,-1,llm8_g7,0,
2026-03-03T06:04:33.213285+00:00,BUCKET,llm_style,eval,llm_style_eval_089,16,6144,3072,bf16,NVIDIA GeForce RTX 4060,c11,32,128,32,4,2,8,0.0,0.0,294.8320060968399,411.1903920769691,2.048555663938392,5,-1,-1,llm8_g5,0,
2026-03-03T06:04:33.240566+00:00,BUCKET,llm_style,eval,llm_style_eval_090,32,1536,3072,bf16,NVIDIA GeForce RTX 4060,c04,64,64,64,4,3,8,0.0,0.0,162.1439978480339,166.93247690796852,1.862479598430981,3,-1,-1,llm8_g3,0,
2026-03-03T06:04:33.268821+00:00,BUCKET,llm_style,eval,llm_style_eval_091,16,1024,4096,bf16,NVIDIA GeForce RTX 4060,c04,64,64,64,4,3,8,0.0,0.0,191.48799777030945,295.88479965925205,0.7009197942577825,7,-1,-1,llm8_g7,0,
2026-03-03T06:04:33.421216+00:00,BUCKET,llm_style,eval,llm_style_eval_092,1,4096,6144,bf16,NVIDIA GeForce RTX 4060,c04,64,64,64,4,3,8,0.0,0.0,688.1119906902313,812.2572940587997,0.0731445588522783,7,-1,-1,llm8_g7,0,
2026-03-03T06:04:33.464257+00:00,BUCKET,llm_style,eval,llm_style_eval_093,32,2048,3072,bf16,NVIDIA GeForce RTX 4060,c04,64,64,64,4,3,8,0.0,0.0,261.9999945163727,364.67647671699524,1.5368442459064162,3,-1,-1,llm8_g3,0,
2026-03-03T06:04:33.480931+00:00,BUCKET,llm_style,eval,llm_style_eval_094,32,1024,2048,bf16,NVIDIA GeForce RTX 4060,c04,64,64,64,4,3,8,0.0,0.0,124.30400028824806,181.72128438949574,1.079753891176173,3,-1,-1,llm8_g3,0,
2026-03-03T06:04:33.547517+00:00,BUCKET,llm_style,eval,llm_style_eval_095,8,6144,2048,bf16,NVIDIA GeForce RTX 4060,c11,32,128,32,4,2,8,0.0,0.0,181.2479943037033,245.48160031437857,1.110779695926745,5,-1,-1,llm8_g5,0,
2026-03-03T06:04:33.587371+00:00,BUCKET,llm_style,eval,llm_style_eval_096,64,2048,3072,bf16,NVIDIA GeForce RTX 4060,c04,64,64,64,4,3,8,0.0,0.0,263.16800713539124,277.92128026485443,3.060046609638597,3,-1,-1,llm8_g3,0,
2026-03-03T06:04:33.621251+00:00,BUCKET,llm_style,eval,llm_style_eval_097,64,6144,1024,bf16,NVIDIA GeForce RTX 4060,c06,64,128,32,4,3,8,0.0,0.0,183.69599431753159,267.7862372994423,4.383908157561513,1,-1,-1,llm8_g1,0,
2026-03-03T06:04:33.655277+00:00,BUCKET,llm_style,eval,llm_style_eval_098,32,6144,1024,bf16,NVIDIA GeForce RTX 4060,c06,64,128,32,4,3,8,0.0,0.0,183.29599499702454,313.91968101263024,2.1967374901264827,1,-1,-1,llm8_g1,0,
2026-03-03T06:04:33.683032+00:00,BUCKET,llm_style,eval,llm_style_eval_099,1,2048,2048,bf16,NVIDIA GeForce RTX 4060,c04,64,64,64,4,3,8,0.0,0.0,199.16799664497375,292.4236708879471,0.04211825263751126,7,-1,-1,llm8_g7,0,
2026-03-03T06:04:33.732084+00:00,BUCKET,llm_style,eval,llm_style_eval_100,64,8192,1024,bf16,NVIDIA GeForce RTX 4060,c06,64,128,32,4,3,8,0.0,0.0,264.0799880027771,418.53951632976526,4.065971950849636,1,-1,-1,llm8_g1,0,
2026-03-03T06:04:33.816299+00:00,BUCKET,llm_style,eval,llm_style_eval_101,64,8192,1536,bf16,NVIDIA GeForce RTX 4060,c06,64,128,32,4,3,8,0.0,0.0,368.0320084095001,441.86976730823517,4.376284397002532,1,-1,-1,llm8_g1,0,
2026-03-03T06:04:33.856975+00:00,BUCKET,llm_style,eval,llm_style_eval_102,32,3072,2048,bf16,NVIDIA GeForce RTX 4060,c04,64,64,64,4,3,8,0.0,0.0,174.0799993276596,412.0131230354307,2.3130353030511666,3,-1,-1,llm8_g3,0,
2026-03-03T06:04:33.901372+00:00,BUCKET,llm_style,eval,llm_style_eval_103,64,2048,3072,bf16,NVIDIA GeForce RTX 4060,c04,64,64,64,4,3,8,0.0,0.0,281.47199749946594,408.1766328215599,2.861053231419683,3,-1,-1,llm8_g3,0,
2026-03-03T06:04:33.969861+00:00,BUCKET,llm_style,eval,llm_style_eval_104,16,6144,2048,bf16,NVIDIA GeForce RTX 4060,c11,32,128,32,4,2,8,0.0,0.0,190.3200000524521,216.66816249489784,2.1156640599465586,5,-1,-1,llm8_g5,0,
2026-03-03T06:04:34.025697+00:00,BUCKET,llm_style,eval,llm_style_eval_105,1,1024,8192,bf16,NVIDIA GeForce RTX 4060,c04,64,64,64,4,3,8,0.0,0.0,400.38400888442993,539.5580977201461,0.04190281236941886,6,-1,-1,llm8_g6,0,
2026-03-03T06:04:34.255930+00:00,BUCKET,llm_style,eval,llm_style_eval_106,32,4096,8192,bf16,NVIDIA GeForce RTX 4060,c10,64,128,64,8,3,8,0.0,0.0,1311.743974685669,1413.335007429123,1.63712103081289,2,-1,-1,llm8_g2,0,
2026-03-03T06:04:34.330554+00:00,BUCKET,llm_style,eval,llm_style_eval_107,64,6144,1536,bf16,NVIDIA GeForce RTX 4060,c06,64,128,32,4,3,8,0.0,0.0,303.1040132045746,331.3356691598892,3.985297123679816,1,-1,-1,llm8_g1,0,
2026-03-03T06:04:34.358995+00:00,BUCKET,llm_style,eval,llm_style_eval_108,8,3072,1536,bf16,NVIDIA GeForce RTX 4060,c04,64,64,64,4,3,8,0.0,0.0,186.11200153827667,246.6000044345854,0.4056561176925113,7,-1,-1,llm8_g7,0,
2026-03-03T06:04:34.377414+00:00,BUCKET,llm_style,eval,llm_style_eval_109,16,2048,1024,bf16,NVIDIA GeForce RTX 4060,c04,64,64,64,4,3,8,0.0,0.0,144.3839967250824,249.4975985586643,0.464794336783599,7,-1,-1,llm8_g7,0,
2026-03-03T06:04:34.804932+00:00,BUCKET,llm_style,eval,llm_style_eval_110,1,8192,8192,bf16,NVIDIA GeForce RTX 4060,c06,64,128,32,4,3,8,0.0,0.0,1853.4240126609802,1949.9110400676725,0.07241609425751543,4,-1,-1,llm8_g4,0,
2026-03-03T06:04:34.865286+00:00,BUCKET,llm_style,eval,llm_style_eval_111,8,6144,1536,bf16,NVIDIA GeForce RTX 4060,c11,32,128,32,4,2,8,0.0,0.0,110.57600006461143,193.1571219861507,1.365530891981724,5,-1,-1,llm8_g5,0,
2026-03-03T06:04:34.968331+00:00,BUCKET,llm_style,eval,llm_style_eval_112,2,6144,3072,bf16,NVIDIA GeForce RTX 4060,c11,32,128,32,4,2,8,0.0,0.0,281.43998980522156,381.057921051979,0.2682542450781431,5,-1,-1,llm8_g5,0,
2026-03-03T06:04:35.327301+00:00,BUCKET,llm_style,eval,llm_style_eval_113,1,8192,8192,bf16,NVIDIA GeForce RTX 4060,c06,64,128,32,4,3,8,0.0,0.0,1256.3520073890686,1408.204791545868,0.10683130779480284,4,-1,-1,llm8_g4,0,
2026-03-03T06:04:35.353435+00:00,BUCKET,llm_style,eval,llm_style_eval_114,1,3072,1024,bf16,NVIDIA GeForce RTX 4060,c04,64,64,64,4,3,8,0.0,0.0,109.05599966645241,287.0262348651883,0.05769014102151562,7,-1,-1,llm8_g7,0,
2026-03-03T06:04:35.380718+00:00,BUCKET,llm_style,eval,llm_style_eval_115,16,3072,1536,bf16,NVIDIA GeForce RTX 4060,c04,64,64,64,4,3,8,0.0,0.0,111.51999980211258,257.064965069294,1.3539718818860653,7,-1,-1,llm8_g7,0,
2026-03-03T06:04:35.398509+00:00,BUCKET,llm_style,eval,llm_style_eval_116,8,3072,1024,bf16,NVIDIA GeForce RTX 4060,c04,64,64,64,4,3,8,0.0,0.0,90.86399897933006,187.56160318851465,0.5539228799675606,7,-1,-1,llm8_g7,0,
2026-03-03T06:04:35.423460+00:00,BUCKET,llm_style,eval,llm_style_eval_117,4,1024,4096,bf16,NVIDIA GeForce RTX 4060,c04,64,64,64,4,3,8,0.0,0.0,131.071999669075,232.98239916563028,0.2560000006463379,7,-1,-1,llm8_g7,0,
2026-03-03T06:04:35.534350+00:00,BUCKET,llm_style,eval,llm_style_eval_118,64,6144,3072,bf16,NVIDIA GeForce RTX 4060,c06,64,128,32,4,3,8,0.0,0.0,294.9120104312897,378.1734374165534,8.191999710241964,1,-1,-1,llm8_g1,0,
2026-03-03T06:04:35.800113+00:00,BUCKET,llm_style,eval,llm_style_eval_119,64,8192,6144,bf16,NVIDIA GeForce RTX 4060,c06,64,128,32,4,3,8,0.0,0.0,792.5440073013306,872.9315167665482,8.128824247800459,1,-1,-1,llm8_g1,0,
2026-03-03T06:04:35.830884+00:00,BUCKET,llm_style,eval,llm_style_eval_120,8,1024,4096,bf16,NVIDIA GeForce RTX 4060,c04,64,64,64,4,3,8,0.0,0.0,133.90400260686874,243.74272406101215,0.501171456368083,7,-1,-1,llm8_g7,0,
2026-03-03T06:04:35.851732+00:00,BUCKET,llm_style,eval,llm_style_eval_121,4,1024,2048,bf16,NVIDIA GeForce RTX 4060,c04,64,64,64,4,3,8,0.0,0.0,84.44799855351448,151.4476825296878,0.19866919627903698,7,-1,-1,llm8_g7,0,
2026-03-03T06:04:35.985208+00:00,BUCKET,llm_style,eval,llm_style_eval_122,4,6144,4096,bf16,NVIDIA GeForce RTX 4060,c11,32,128,32,4,2,8,0.0,0.0,365.85600674152374,482.3244869709015,0.5502891528093364,5,-1,-1,llm8_g5,0,
2026-03-03T06:04:36.118881+00:00,BUCKET,llm_style,eval,llm_style_eval_123,4,3072,8192,bf16,NVIDIA GeForce RTX 4060,c04,64,64,64,4,3,8,0.0,0.0,383.34399461746216,490.4495868086814,0.52518519874272,6,-1,-1,llm8_g6,0,
2026-03-03T06:04:36.148816+00:00,BUCKET,llm_style,eval,llm_style_eval_124,64,6144,1024,bf16,NVIDIA GeForce RTX 4060,c06,64,128,32,4,3,8,0.0,0.0,125.92000514268875,274.40127924084635,6.395380679086307,1,-1,-1,llm8_g1,0,
2026-03-03T06:04:36.229296+00:00,BUCKET,llm_style,eval,llm_style_eval_125,64,1536,8192,bf16,NVIDIA GeForce RTX 4060,c10,64,128,64,8,3,8,0.0,0.0,379.69599664211273,399.56480085849756,4.241848084371833,2,-1,-1,llm8_g2,0,
2026-03-03T06:04:36.328069+00:00,BUCKET,llm_style,eval,llm_style_eval_126,64,2048,8192,bf16,NVIDIA GeForce RTX 4060,c10,64,128,64,8,3,8,0.0,0.0,388.09600472450256,443.4617608785629,5.53338251839112,2,-1,-1,llm8_g2,0,
2026-03-03T06:04:36.392090+00:00,BUCKET,llm_style,eval,llm_style_eval_127,2,8192,1536,bf16,NVIDIA GeForce RTX 4060,c11,32,128,32,4,2,8,0.0,0.0,141.24800264835358,175.22687956690788,0.3563352901017937,5,-1,-1,llm8_g5,0,
2026-03-03T06:04:36.414188+00:00,BUCKET,llm_style,eval,llm_style_eval_128,8,2048,2048,bf16,NVIDIA GeForce RTX 4060,c04,64,64,64,4,3,8,0.0,0.0,118.78400295972824,135.13664081692696,0.5649655031641942,7,-1,-1,llm8_g7,0,
2026-03-03T06:04:36.686504+00:00,BUCKET,llm_style,eval,llm_style_eval_129,64,8192,6144,bf16,NVIDIA GeForce RTX 4060,c06,64,128,32,4,3,8,0.0,0.0,769.5040106773376,865.747216939926,8.372212301179802,1,-1,-1,llm8_g1,0,
2026-03-03T06:04:36.708415+00:00,BUCKET,llm_style,eval,llm_style_eval_130,16,3072,1536,bf16,NVIDIA GeForce RTX 4060,c04,64,64,64,4,3,8,0.0,0.0,95.20000219345093,109.60895985364914,1.5860813079937865,7,-1,-1,llm8_g7,0,
2026-03-03T06:04:37.052614+00:00,BUCKET,llm_style,eval,llm_style_eval_131,32,8192,8192,bf16,NVIDIA GeForce RTX 4060,c06,64,128,32,4,3,8,0.0,0.0,1028.0159711837769,1085.3273355960846,4.177918842111253,0,-1,-1,llm8_g0,0,
2026-03-03T06:04:37.255824+00:00,BUCKET,llm_style,eval,llm_style_eval_132,32,8192,4096,bf16,NVIDIA GeForce RTX 4060,c06,64,128,32,4,3,8,0.0,0.0,712.7040028572083,741.3964629173279,3.013149413207733,1,-1,-1,llm8_g1,0,
2026-03-03T06:04:37.624661+00:00,BUCKET,llm_style,eval,llm_style_eval_133,2,8192,8192,bf16,NVIDIA GeForce RTX 4060,c06,64,128,32,4,3,8,0.0,0.0,1406.816005706787,1461.799076795578,0.1908106354427902,4,-1,-1,llm8_g4,0,
2026-03-03T06:04:37.681198+00:00,BUCKET,llm_style,eval,llm_style_eval_134,64,3072,3072,bf16,NVIDIA GeForce RTX 4060,c04,64,64,64,4,3,8,0.0,0.0,221.69599682092667,305.16479790210724,5.448720632406009,3,-1,-1,llm8_g3,0,
2026-03-03T06:04:37.739485+00:00,BUCKET,llm_style,eval,llm_style_eval_135,8,3072,3072,bf16,NVIDIA GeForce RTX 4060,c04,64,64,64,4,3,8,0.0,0.0,220.15999257564545,323.76702994108194,0.6858418835934471,7,-1,-1,llm8_g7,0,
2026-03-03T06:04:37.793725+00:00,BUCKET,llm_style,eval,llm_style_eval_136,4,2048,4096,bf16,NVIDIA GeForce RTX 4060,c04,64,64,64,4,3,8,0.0,0.0,276.4799892902374,315.9347262978554,0.24272593532818695,7,-1,-1,llm8_g7,0,
2026-03-03T06:04:38.187588+00:00,BUCKET,llm_style,eval,llm_style_eval_137,4,8192,8192,bf16,NVIDIA GeForce RTX 4060,c06,64,128,32,4,3,8,0.0,0.0,1563.0559921264648,1633.6690986156464,0.3434751632087166,4,-1,-1,llm8_g4,0,
2026-03-03T06:04:38.204441+00:00,BUCKET,llm_style,eval,llm_style_eval_138,16,1024,1024,bf16,NVIDIA GeForce RTX 4060,c04,64,64,64,4,3,8,0.0,0.0,94.2080020904541,131.77855990827078,0.3561739051400603,7,-1,-1,llm8_g7,0,
2026-03-03T06:04:38.218145+00:00,BUCKET,llm_style,eval,llm_style_eval_139,4,1024,1024,bf16,NVIDIA GeForce RTX 4060,c04,64,64,64,4,3,8,0.0,0.0,62.84799799323082,307.40479886531784,0.13347454601343883,7,-1,-1,llm8_g7,0,
2026-03-03T06:04:38.361046+00:00,BUCKET,llm_style,eval,llm_style_eval_140,64,4096,6144,bf16,NVIDIA GeForce RTX 4060,c04,64,64,64,4,3,8,0.0,0.0,491.4559870958328,518.1849718093872,6.554453616559296,3,-1,-1,llm8_g3,0,
2026-03-03T06:04:38.498671+00:00,BUCKET,llm_style,eval,llm_style_eval_141,4,6144,4096,bf16,NVIDIA GeForce RTX 4060,c11,32,128,32,4,2,8,0.0,0.0,366.5919899940491,395.31742811203003,0.5491843725316207,5,-1,-1,llm8_g5,0,
2026-03-03T06:04:38.574395+00:00,BUCKET,llm_style,eval,llm_style_eval_142,4,2048,6144,bf16,NVIDIA GeForce RTX 4060,c04,64,64,64,4,3,8,0.0,0.0,337.92001008987427,384.6246322989464,0.29789090019625436,7,-1,-1,llm8_g7,0,
2026-03-03T06:04:38.660040+00:00,BUCKET,llm_style,eval,llm_style_eval_143,64,1536,8192,bf16,NVIDIA GeForce RTX 4060,c10,64,128,64,8,3,8,0.0,0.0,448.4799951314926,527.3670306801794,3.5912699640655643,2,-1,-1,llm8_g2,0,
2026-03-03T06:04:38.720243+00:00,BUCKET,llm_style,eval,llm_style_eval_144,1,3072,3072,bf16,NVIDIA GeForce RTX 4060,c04,64,64,64,4,3,8,0.0,0.0,188.4160041809082,319.66207966208424,0.10017391082064195,7,-1,-1,llm8_g7,0,
2026-03-03T06:04:38.740008+00:00,BUCKET,llm_style,eval,llm_style_eval_145,32,1024,2048,bf16,NVIDIA GeForce RTX 4060,c04,64,64,64,4,3,8,0.0,0.0,116.06400087475777,183.25120195746422,1.156411350534362,3,-1,-1,llm8_g3,0,
2026-03-03T06:04:38.929626+00:00,BUCKET,llm_style,eval,llm_style_eval_146,64,8192,4096,bf16,NVIDIA GeForce RTX 4060,c06,64,128,32,4,3,8,0.0,0.0,605.6160032749176,734.8940855264659,7.091898616903477,1,-1,-1,llm8_g1,0,
2026-03-03T06:04:38.982856+00:00,BUCKET,llm_style,eval,llm_style_eval_147,64,2048,4096,bf16,NVIDIA GeForce RTX 4060,c04,64,64,64,4,3,8,0.0,0.0,220.67200392484665,264.1408036649226,4.865781816009972,3,-1,-1,llm8_g3,0,
2026-03-03T06:04:39.020285+00:00,BUCKET,llm_style,eval,llm_style_eval_148,64,1024,6144,bf16,NVIDIA GeForce RTX 4060,c04,64,64,64,4,3,8,0.0,0.0,200.19199699163437,290.2041643857956,4.022670137176624,3,-1,-1,llm8_g3,0,
2026-03-03T06:04:39.222893+00:00,BUCKET,llm_style,eval,llm_style_eval_149,64,4096,8192,bf16,NVIDIA GeForce RTX 4060,c10,64,128,64,8,3,8,0.0,0.0,837.6320004463196,875.7247912883759,5.127510999712871,2,-1,-1,llm8_g2,0,
2026-03-03T06:04:39.255901+00:00,BUCKET,llm_style,eval,llm_style_eval_150,2,2048,3072,bf16,NVIDIA GeForce RTX 4060,c04,64,64,64,4,3,8,0.0,0.0,184.23999845981598,237.9923215508461,0.13659261946579337,7,-1,-1,llm8_g7,0,
2026-03-03T06:04:39.300588+00:00,BUCKET,llm_style,eval,llm_style_eval_151,64,4096,2048,bf16,NVIDIA GeForce RTX 4060,c04,64,64,64,4,3,8,0.0,0.0,184.32000279426575,244.24448058009136,5.825422133909627,3,-1,-1,llm8_g3,0,
2026-03-03T06:04:39.662630+00:00,BUCKET,llm_style,eval,llm_style_eval_152,8,8192,8192,bf16,NVIDIA GeForce RTX 4060,c06,64,128,32,4,3,8,0.0,0.0,1194.3680047988892,1223.680019378662,0.8990041760041954,4,-1,-1,llm8_g4,0,
2026-03-03T06:04:39.772916+00:00,BUCKET,llm_style,eval,llm_style_eval_153,64,8192,2048,bf16,NVIDIA GeForce RTX 4060,c06,64,128,32,4,3,8,0.0,0.0,347.1039980649948,363.54047656059265,6.186859442621246,1,-1,-1,llm8_g1,0,
2026-03-03T06:04:39.882871+00:00,BUCKET,llm_style,eval,llm_style_eval_154,16,2048,8192,bf16,NVIDIA GeForce RTX 4060,c04,64,64,64,4,3,8,0.0,0.0,443.3920085430145,485.76513558626164,1.210826766508844,6,-1,-1,llm8_g6,0,
2026-03-03T06:04:39.905514+00:00,BUCKET,llm_style,eval,llm_style_eval_155,4,2048,1536,bf16,NVIDIA GeForce RTX 4060,c04,64,64,64,4,3,8,0.0,0.0,108.5439994931221,135.8105602115392,0.23184905768646044,7,-1,-1,llm8_g7,0,
2026-03-03T06:04:40.046117+00:00,BUCKET,llm_style,eval,llm_style_eval_156,1,4096,6144,bf16,NVIDIA GeForce RTX 4060,c04,64,64,64,4,3,8,0.0,0.0,515.0719881057739,562.1078360080718,0.09771769609350997,7,-1,-1,llm8_g7,0,
2026-03-03T06:04:40.117764+00:00,BUCKET,llm_style,eval,llm_style_eval_157,1,1536,8192,bf16,NVIDIA GeForce RTX 4060,c04,64,64,64,4,3,8,0.0,0.0,275.4560112953186,290.249280333519,0.09136059104921664,6,-1,-1,llm8_g6,0,
2026-03-03T06:04:40.202114+00:00,BUCKET,llm_style,eval,llm_style_eval_158,64,1536,8192,bf16,NVIDIA GeForce RTX 4060,c10,64,128,64,8,3,8,0.0,0.0,468.81599724292755,499.8601612448692,3.4354901399949984,2,-1,-1,llm8_g2,0,
2026-03-03T06:04:40.257836+00:00,BUCKET,llm_style,eval,llm_style_eval_159,16,6144,1536,bf16,NVIDIA GeForce RTX 4060,c11,32,128,32,4,2,8,0.0,0.0,114.68800157308578,203.0489577352999,2.6331428210260923,5,-1,-1,llm8_g5,0,
2026-03-03T06:04:40.484492+00:00,BUCKET,llm_style,eval,llm_style_eval_160,32,6144,6144,bf16,NVIDIA GeForce RTX 4060,c06,64,128,32,4,3,8,0.0,0.0,730.1120162010193,792.4108839035034,3.30897047355927,1,-1,-1,llm8_g1,0,
2026-03-03T06:04:40.519507+00:00,BUCKET,llm_style,eval,llm_style_eval_161,2,1536,4096,bf16,NVIDIA GeForce RTX 4060,c04,64,64,64,4,3,8,0.0,0.0,156.5760001540184,246.0262413322925,0.16072593485109626,7,-1,-1,llm8_g7,0,
2026-03-03T06:04:40.545214+00:00,BUCKET,llm_style,eval,llm_style_eval_162,64,1536,3072,bf16,NVIDIA GeForce RTX 4060,c04,64,64,64,4,3,8,0.0,0.0,137.2160017490387,240.70143938064575,4.401671585684658,3,-1,-1,llm8_g3,0,
2026-03-03T06:04:40.610464+00:00,BUCKET,llm_style,eval,llm_style_eval_163,64,1024,8192,bf16,NVIDIA GeForce RTX 4060,c10,64,128,64,8,3,8,0.0,0.0,515.4879987239838,633.1856042146683,2.082961827739721,2,-1,-1,llm8_g2,0,
2026-03-03T06:04:40.817168+00:00,BUCKET,llm_style,eval,llm_style_eval_164,64,4096,8192,bf16,NVIDIA GeForce RTX 4060,c10,64,128,64,8,3,8,0.0,0.0,842.7519798278809,1021.4399951696396,5.0963597817677995,2,-1,-1,llm8_g2,0,
2026-03-03T06:04:40.952094+00:00,BUCKET,llm_style,eval,llm_style_eval_165,4,8192,3072,bf16,NVIDIA GeForce RTX 4060,c11,32,128,32,4,2,8,0.0,0.0,368.6400055885315,442.00895994901646,0.5461333250540276,5,-1,-1,llm8_g5,0,
2026-03-03T06:04:40.997946+00:00,BUCKET,llm_style,eval,llm_style_eval_166,64,1024,6144,bf16,NVIDIA GeForce RTX 4060,c04,64,64,64,4,3,8,0.0,0.0,212.99199759960175,241.16224348545074,3.780923119533697,3,-1,-1,llm8_g3,0,
2026-03-03T06:04:41.013756+00:00,BUCKET,llm_style,eval,llm_style_eval_167,2,2048,1024,bf16,NVIDIA GeForce RTX 4060,c04,64,64,64,4,3,8,0.0,0.0,83.96799862384796,653.8015826046446,0.09990244066169192,7,-1,-1,llm8_g7,0,
2026-03-03T06:04:41.035606+00:00,BUCKET,llm_style,eval,llm_style_eval_168,64,4096,1024,bf16,NVIDIA GeForce RTX 4060,c04,64,64,64,4,3,8,0.0,0.0,121.85599654912949,218.29631939530367,4.405781637373472,3,-1,-1,llm8_g3,0,
2026-03-03T06:04:41.085823+00:00,BUCKET,llm_style,eval,llm_style_eval_169,4,1536,6144,bf16,NVIDIA GeForce RTX 4060,c04,64,64,64,4,3,8,0.0,0.0,213.84000033140182,306.4303949475287,0.35305589170873847,7,-1,-1,llm8_g7,0,
2026-03-03T06:04:41.104524+00:00,BUCKET,llm_style,eval,llm_style_eval_170,16,1536,1536,bf16,NVIDIA GeForce RTX 4060,c04,64,64,64,4,3,8,0.0,0.0,74.65600222349167,234.09280002117134,1.011271294356069,7,-1,-1,llm8_g7,0,
2026-03-03T06:04:41.143636+00:00,BUCKET,llm_style,eval,llm_style_eval_171,1,2048,3072,bf16,NVIDIA GeForce RTX 4060,c04,64,64,64,4,3,8,0.0,0.0,201.21599733829498,328.265910744667,0.06253435197224871,7,-1,-1,llm8_g7,0,
2026-03-03T06:04:41.177067+00:00,BUCKET,llm_style,eval,llm_style_eval_172,64,3072,2048,bf16,NVIDIA GeForce RTX 4060,c04,64,64,64,4,3,8,0.0,0.0,149.34400469064713,345.9635272622105,5.392291238393672,3,-1,-1,llm8_g3,0,
2026-03-03T06:04:41.450716+00:00,BUCKET,llm_style,eval,llm_style_eval_173,64,8192,6144,bf16,NVIDIA GeForce RTX 4060,c06,64,128,32,4,3,8,0.0,0.0,948.1920003890991,1080.9651255607605,6.794458233518403,1,-1,-1,llm8_g1,0,
2026-03-03T06:04:41.547427+00:00,BUCKET,llm_style,eval,llm_style_eval_174,2,4096,4096,bf16,NVIDIA GeForce RTX 4060,c04,64,64,64,4,3,8,0.0,0.0,381.9519877433777,394.76223587989807,0.17569973754158985,7,-1,-1,llm8_g7,0,
2026-03-03T06:04:41.593353+00:00,BUCKET,llm_style,eval,llm_style_eval_175,64,4096,2048,bf16,NVIDIA GeForce RTX 4060,c04,64,64,64,4,3,8,0.0,0.0,219.13599967956543,228.454402834177,4.8998878576322165,3,-1,-1,llm8_g3,0,
2026-03-03T06:04:41.659688+00:00,BUCKET,llm_style,eval,llm_style_eval_176,16,6144,2048,bf16,NVIDIA GeForce RTX 4060,c11,32,128,32,4,2,8,0.0,0.0,144.23999935388565,297.9225637018679,2.791550095699255,5,-1,-1,llm8_g5,0,
2026-03-03T06:04:41.712956+00:00,BUCKET,llm_style,eval,llm_style_eval_177,1,6144,1536,bf16,NVIDIA GeForce RTX 4060,c11,32,128,32,4,2,8,0.0,0.0,104.84800115227699,244.15232419967634,0.18001647902269147,5,-1,-1,llm8_g5,0,
2026-03-03T06:04:41.985231+00:00,BUCKET,llm_style,eval,llm_style_eval_178,32,6144,8192,bf16,NVIDIA GeForce RTX 4060,c06,64,128,32,4,3,8,0.0,0.0,847.8720188140869,904.5449566841125,3.799188321493976,0,-1,-1,llm8_g0,0,
2026-03-03T06:04:42.132560+00:00,BUCKET,llm_style,eval,llm_style_eval_179,64,4096,6144,bf16,NVIDIA GeForce RTX 4060,c04,64,64,64,4,3,8,0.0,0.0,514.5599842071533,630.7107275724411,6.260155416016937,3,-1,-1,llm8_g3,0,
2026-03-03T06:04:42.153184+00:00,BUCKET,llm_style,eval,llm_style_eval_180,64,2048,1536,bf16,NVIDIA GeForce RTX 4060,c04,64,64,64,4,3,8,0.0,0.0,111.9839996099472,120.30720256268975,3.5956313884348305,3,-1,-1,llm8_g3,0,
2026-03-03T06:04:42.186326+00:00,BUCKET,llm_style,eval,llm_style_eval_181,64,2048,3072,bf16,NVIDIA GeForce RTX 4060,c04,64,64,64,4,3,8,0.0,0.0,192.51200556755066,196.62847951054573,4.183148815191298,3,-1,-1,llm8_g3,0,
2026-03-03T06:04:42.208776+00:00,BUCKET,llm_style,eval,llm_style_eval_182,32,3072,1536,bf16,NVIDIA GeForce RTX 4060,c04,64,64,64,4,3,8,0.0,0.0,111.61600053310394,194.8672060668466,2.7056146659764386,3,-1,-1,llm8_g3,0,
2026-03-03T06:04:42.300464+00:00,BUCKET,llm_style,eval,llm_style_eval_183,8,8192,2048,bf16,NVIDIA GeForce RTX 4060,c11,32,128,32,4,2,8,0.0,0.0,254.87999618053436,302.59199053049076,1.053183694376173,5,-1,-1,llm8_g5,0,
2026-03-03T06:04:42.351643+00:00,BUCKET,llm_style,eval,llm_style_eval_184,64,8192,1024,bf16,NVIDIA GeForce RTX 4060,c06,64,128,32,4,3,8,0.0,0.0,189.43999707698822,214.8864017426967,5.667978465833868,1,-1,-1,llm8_g1,0,
2026-03-03T06:04:42.423180+00:00,BUCKET,llm_style,eval,llm_style_eval_185,1,8192,1536,bf16,NVIDIA GeForce RTX 4060,c11,32,128,32,4,2,8,0.0,0.0,201.7280012369156,274.43488240241993,0.12475126827060802,5,-1,-1,llm8_g5,0,
2026-03-03T06:04:42.452568+00:00,BUCKET,llm_style,eval,llm_style_eval_186,16,6144,1024,bf16,NVIDIA GeForce RTX 4060,c11,32,128,32,4,2,8,0.0,0.0,105.31199723482132,195.51520198583603,1.911715638163128,5,-1,-1,llm8_g5,0,
2026-03-03T06:04:42.490491+00:00,BUCKET,llm_style,eval,llm_style_eval_187,1,1024,6144,bf16,NVIDIA GeForce RTX 4060,c04,64,64,64,4,3,8,0.0,0.0,248.7040013074875,263.69023591279984,0.05059392665115589,7,-1,-1,llm8_g7,0,
2026-03-03T06:04:42.672434+00:00,BUCKET,llm_style,eval,llm_style_eval_188,8,8192,4096,bf16,NVIDIA GeForce RTX 4060,c11,32,128,32,4,2,8,0.0,0.0,480.25599122047424,502.8454238176346,1.1178848818432234,5,-1,-1,llm8_g5,0,
2026-03-03T06:04:42.780903+00:00,BUCKET,llm_style,eval,llm_style_eval_189,8,2048,8192,bf16,NVIDIA GeForce RTX 4060,c04,64,64,64,4,3,8,0.0,0.0,577.5359869003296,682.5881415605545,0.464794336783599,6,-1,-1,llm8_g6,0,
2026-03-03T06:04:42.869726+00:00,BUCKET,llm_style,eval,llm_style_eval_190,4,8192,2048,bf16,NVIDIA GeForce RTX 4060,c11,32,128,32,4,2,8,0.0,0.0,261.1199915409088,300.65696418285364,0.5140078597887536,5,-1,-1,llm8_g5,0,
2026-03-03T06:04:43.271521+00:00,BUCKET,llm_style,eval,llm_style_eval_191,4,8192,8192,bf16,NVIDIA GeForce RTX 4060,c06,64,128,32,4,3,8,0.0,0.0,1757.1359872817993,1867.018268108368,0.3055374859350028,4,-1,-1,llm8_g4,0,
2026-03-03T06:04:43.289174+00:00,BUCKET,llm_style,eval,llm_style_eval_192,64,1536,1024,bf16,NVIDIA GeForce RTX 4060,c04,64,64,64,4,3,8,0.0,0.0,55.80800026655197,122.49088406562791,3.607486221301918,3,-1,-1,llm8_g3,0,
2026-03-03T06:04:43.319361+00:00,BUCKET,llm_style,eval,llm_style_eval_193,32,2048,2048,bf16,NVIDIA GeForce RTX 4060,c04,64,64,64,4,3,8,0.0,0.0,211.96800470352173,280.90367078781117,1.2663961071646588,3,-1,-1,llm8_g3,0,
2026-03-03T06:04:43.337359+00:00,BUCKET,llm_style,eval,llm_style_eval_194,8,1024,2048,bf16,NVIDIA GeForce RTX 4060,c04,64,64,64,4,3,8,0.0,0.0,129.4720023870468,223.37536096572873,0.2591636136103893,7,-1,-1,llm8_g7,0,
2026-03-03T06:04:43.384998+00:00,BUCKET,llm_style,eval,llm_style_eval_195,2,4096,2048,bf16,NVIDIA GeForce RTX 4060,c04,64,64,64,4,3,8,0.0,0.0,262.14399933815,364.292796254158,0.12800000032316894,7,-1,-1,llm8_g7,0,
2026-03-03T06:04:43.442702+00:00,BUCKET,llm_style,eval,llm_style_eval_196,32,2048,4096,bf16,NVIDIA GeForce RTX 4060,c04,64,64,64,4,3,8,0.0,0.0,266.11199975013733,379.9654418230057,2.0174622433565137,3,-1,-1,llm8_g3,0,
2026-03-03T06:04:43.519332+00:00,BUCKET,llm_style,eval,llm_style_eval_197,32,8192,1536,bf16,NVIDIA GeForce RTX 4060,c06,64,128,32,4,3,8,0.0,0.0,279.36001121997833,371.95775926113123,2.8826830457343884,1,-1,-1,llm8_g1,0,
2026-03-03T06:04:43.727732+00:00,BUCKET,llm_style,eval,llm_style_eval_198,64,4096,8192,bf16,NVIDIA GeForce RTX 4060,c10,64,128,64,8,3,8,0.0,0.0,931.6799938678741,1090.007051229477,4.609916842981057,2,-1,-1,llm8_g2,0,
2026-03-03T06:04:43.903018+00:00,BUCKET,llm_style,eval,llm_style_eval_199,2,8192,4096,bf16,NVIDIA GeForce RTX 4060,c11,32,128,32,4,2,8,0.0,0.0,475.0239998102188,620.1235085725784,0.28254936182934454,5,-1,-1,llm8_g5,0,
2026-03-03T06:04:43.926288+00:00,BUCKET,llm_style,eval,llm_style_eval_200,1,4096,1024,bf16,NVIDIA GeForce RTX 4060,c04,64,64,64,4,3,8,0.0,0.0,119.80800330638885,232.49920785427082,0.07001709208480458,7,-1,-1,llm8_g7,0,
2026-03-03T06:04:44.004898+00:00,BUCKET,llm_style,eval,llm_style_eval_201,4,1536,8192,bf16,NVIDIA GeForce RTX 4060,c04,64,64,64,4,3,8,0.0,0.0,296.9599962234497,410.4294335842132,0.33897931465575304,6,-1,-1,llm8_g6,0,
2026-03-03T06:04:44.106564+00:00,BUCKET,llm_style,eval,llm_style_eval_202,1,6144,3072,bf16,NVIDIA GeForce RTX 4060,c11,32,128,32,4,2,8,0.0,0.0,284.67199206352234,354.10369455814345,0.13260432024368826,5,-1,-1,llm8_g5,0,
2026-03-03T06:04:44.191315+00:00,BUCKET,llm_style,eval,llm_style_eval_203,16,2048,6144,bf16,NVIDIA GeForce RTX 4060,c04,64,64,64,4,3,8,0.0,0.0,382.4639916419983,420.4851171374321,1.0527871716009796,7,-1,-1,llm8_g7,0,
2026-03-03T06:04:44.202432+00:00,BUCKET,llm_style,eval,llm_style_eval_204,16,1536,1024,bf16,NVIDIA GeForce RTX 4060,c04,64,64,64,4,3,8,0.0,0.0,61.43999844789505,119.34943832457063,0.8192000206947333,7,-1,-1,llm8_g7,0,
2026-03-03T06:04:44.277226+00:00,BUCKET,llm_style,eval,llm_style_eval_205,64,6144,2048,bf16,NVIDIA GeForce RTX 4060,c06,64,128,32,4,3,8,0.0,0.0,257.02399015426636,329.308163523674,6.266390678291574,1,-1,-1,llm8_g1,0,
2026-03-03T06:04:44.358275+00:00,BUCKET,llm_style,eval,llm_style_eval_206,4,2048,6144,bf16,NVIDIA GeForce RTX 4060,c04,64,64,64,4,3,8,0.0,0.0,385.0240111351013,520.0467351078986,0.2614468009494561,7,-1,-1,llm8_g7,0,
2026-03-03T06:04:44.419898+00:00,BUCKET,llm_style,eval,llm_style_eval_207,32,6144,1536,bf16,NVIDIA GeForce RTX 4060,c06,64,128,32,4,3,8,0.0,0.0,201.7119973897934,315.2851104736327,2.9942679851256147,1,-1,-1,llm8_g1,0,
2026-03-03T06:04:44.435285+00:00,BUCKET,llm_style,eval,llm_style_eval_208,4,2048,1024,bf16,NVIDIA GeForce RTX 4060,c04,64,64,64,4,3,8,0.0,0.0,102.32000052928925,220.40575996041292,0.16396809922999853,7,-1,-1,llm8_g7,0,
2026-03-03T06:04:44.446913+00:00,BUCKET,llm_style,eval,llm_style_eval_209,1,1024,1536,bf16,NVIDIA GeForce RTX 4060,c04,64,64,64,4,3,8,0.0,0.0,85.50399914383888,158.86144123971448,0.036790419530063234,7,-1,-1,llm8_g7,0,
2026-03-03T06:04:44.598305+00:00,BUCKET,llm_style,eval,llm_style_eval_210,8,6144,4096,bf16,NVIDIA GeForce RTX 4060,c11,32,128,32,4,2,8,0.0,0.0,370.65599858760834,442.0915168523788,1.0863258264652873,5,-1,-1,llm8_g5,0,
2026-03-03T06:04:44.714646+00:00,BUCKET,llm_style,eval,llm_style_eval_211,4,2048,8192,bf16,NVIDIA GeForce RTX 4060,c04,64,64,64,4,3,8,0.0,0.0,499.08798933029175,571.0233521461486,0.26892598273122525,6,-1,-1,llm8_g6,0,
2026-03-03T06:04:44.725060+00:00,BUCKET,llm_style,eval,llm_style_eval_212,32,1024,1024,bf16,NVIDIA GeForce RTX 4060,c04,64,64,64,4,3,8,0.0,0.0,63.48799914121628,143.4380759298801,1.0570322723626844,3,-1,-1,llm8_g3,0,
2026-03-03T06:04:44.802458+00:00,BUCKET,llm_style,eval,llm_style_eval_213,16,3072,4096,bf16,NVIDIA GeForce RTX 4060,c04,64,64,64,4,3,8,0.0,0.0,272.3200023174286,419.1641673445699,1.4786030426463095,7,-1,-1,llm8_g7,0,
2026-03-03T06:04:44.876441+00:00,BUCKET,llm_style,eval,llm_style_eval_214,64,1024,8192,bf16,NVIDIA GeForce RTX 4060,c10,64,128,64,8,3,8,0.0,0.0,503.80802154541016,615.9465515613556,2.131251941377078,2,-1,-1,llm8_g2,0,
2026-03-03T06:04:44.908491+00:00,BUCKET,llm_style,eval,llm_style_eval_215,4,4096,1536,bf16,NVIDIA GeForce RTX 4060,c04,64,64,64,4,3,8,0.0,0.0,141.31200313568115,174.14143919944763,0.35617390514006025,7,-1,-1,llm8_g7,0,
2026-03-03T06:04:44.934878+00:00,BUCKET,llm_style,eval,llm_style_eval_216,16,1536,3072,bf16,NVIDIA GeForce RTX 4060,c04,64,64,64,4,3,8,0.0,0.0,128.51200252771378,166.88128054141987,1.174948184061156,7,-1,-1,llm8_g7,0,
2026-03-03T06:04:44.998623+00:00,BUCKET,llm_style,eval,llm_style_eval_217,8,6144,2048,bf16,NVIDIA GeForce RTX 4060,c11,32,128,32,4,2,8,0.0,0.0,144.25600320100784,187.48415991663921,1.3956201997324813,5,-1,-1,llm8_g5,0,
2026-03-03T06:04:45.074114+00:00,BUCKET,llm_style,eval,llm_style_eval_218,8,3072,4096,bf16,NVIDIA GeForce RTX 4060,c04,64,64,64,4,3,8,0.0,0.0,269.3119943141937,344.1868922114372,0.7475589511439348,7,-1,-1,llm8_g7,0,
2026-03-03T06:04:45.218488+00:00,BUCKET,llm_style,eval,llm_style_eval_219,64,8192,3072,bf16,NVIDIA GeForce RTX 4060,c06,64,128,32,4,3,8,0.0,0.0,549.888014793396,754.9583828449247,5.857966322852625,1,-1,-1,llm8_g1,0,
2026-03-03T06:04:45.265619+00:00,BUCKET,llm_style,eval,llm_style_eval_220,2,4096,2048,bf16,NVIDIA GeForce RTX 4060,c04,64,64,64,4,3,8,0.0,0.0,258.4639936685562,330.89536041021347,0.1298224620139115,7,-1,-1,llm8_g7,0,
2026-03-03T06:04:45.329664+00:00,BUCKET,llm_style,eval,llm_style_eval_221,4,1024,8192,bf16,NVIDIA GeForce RTX 4060,c04,64,64,64,4,3,8,0.0,0.0,365.56801199913025,403.7695938348769,0.18357422366637394,6,-1,-1,llm8_g6,0,
2026-03-03T06:04:45.405490+00:00,BUCKET,llm_style,eval,llm_style_eval_222,64,6144,2048,bf16,NVIDIA GeForce RTX 4060,c06,64,128,32,4,3,8,0.0,0.0,317.26399064064026,435.5891257524489,5.076569618719557,1,-1,-1,llm8_g1,0,
2026-03-03T06:04:45.434191+00:00,BUCKET,llm_style,eval,llm_style_eval_223,4,2048,2048,bf16,NVIDIA GeForce RTX 4060,c04,64,64,64,4,3,8,0.0,0.0,171.4239940047264,193.05344149470326,0.1957394132298356,7,-1,-1,llm8_g7,0,
2026-03-03T06:04:45.459642+00:00,BUCKET,llm_style,eval,llm_style_eval_224,16,3072,1536,bf16,NVIDIA GeForce RTX 4060,c04,64,64,64,4,3,8,0.0,0.0,142.33599603176117,174.42815929651255,1.060834561949506,7,-1,-1,llm8_g7,0,
2026-03-03T06:04:45.487134+00:00,BUCKET,llm_style,eval,llm_style_eval_225,1,2048,2048,bf16,NVIDIA GeForce RTX 4060,c04,64,64,64,4,3,8,0.0,0.0,183.29599499702454,304.4313657283782,0.04576536437763506,7,-1,-1,llm8_g7,0,
2026-03-03T06:04:45.499638+00:00,BUCKET,llm_style,eval,llm_style_eval_226,8,1536,1024,bf16,NVIDIA GeForce RTX 4060,c04,64,64,64,4,3,8,0.0,0.0,79.3599970638752,118.30272279679775,0.31710968915163334,7,-1,-1,llm8_g7,0,
2026-03-03T06:04:45.736267+00:00,BUCKET,llm_style,eval,llm_style_eval_227,64,6144,6144,bf16,NVIDIA GeForce RTX 4060,c06,64,128,32,4,3,8,0.0,0.0,903.5679996013641,1057.0342409610748,5.347509219153079,1,-1,-1,llm8_g1,0,
2026-03-03T06:04:45.818478+00:00,BUCKET,llm_style,eval,llm_style_eval_228,64,6144,2048,bf16,NVIDIA GeForce RTX 4060,c06,64,128,32,4,3,8,0.0,0.0,343.03998947143555,443.46366971731175,4.695116562012702,1,-1,-1,llm8_g1,0,
2026-03-03T06:04:45.899150+00:00,BUCKET,llm_style,eval,llm_style_eval_229,16,1536,8192,bf16,NVIDIA GeForce RTX 4060,c04,64,64,64,4,3,8,0.0,0.0,390.1439905166626,500.1113536953922,1.0320630172126237,6,-1,-1,llm8_g6,0,
2026-03-03T06:04:45.921283+00:00,BUCKET,llm_style,eval,llm_style_eval_230,64,2048,1536,bf16,NVIDIA GeForce RTX 4060,c04,64,64,64,4,3,8,0.0,0.0,160.49599647521973,220.72320386767387,2.508805159274916,3,-1,-1,llm8_g3,0,
2026-03-03T06:04:45.992195+00:00,BUCKET,llm_style,eval,llm_style_eval_231,4,1024,8192,bf16,NVIDIA GeForce RTX 4060,c04,64,64,64,4,3,8,0.0,0.0,388.89598846435547,524.1958343982695,0.17256249997587958,6,-1,-1,llm8_g6,0,
2026-03-03T06:04:46.019589+00:00,BUCKET,llm_style,eval,llm_style_eval_232,16,3072,1536,bf16,NVIDIA GeForce RTX 4060,c04,64,64,64,4,3,8,0.0,0.0,158.720001578331,283.7743949890136,0.951329022797933,7,-1,-1,llm8_g7,0,
2026-03-03T06:04:46.083600+00:00,BUCKET,llm_style,eval,llm_style_eval_233,64,3072,3072,bf16,NVIDIA GeForce RTX 4060,c04,64,64,64,4,3,8,0.0,0.0,277.50399708747864,310.60000389814365,4.352944695132482,3,-1,-1,llm8_g3,0,
2026-03-03T06:04:46.287966+00:00,BUCKET,llm_style,eval,llm_style_eval_234,32,8192,4096,bf16,NVIDIA GeForce RTX 4060,c06,64,128,32,4,3,8,0.0,0.0,994.6720004081726,1022.5152373313904,2.158986728407717,1,-1,-1,llm8_g1,0,
2026-03-03T06:04:46.308221+00:00,BUCKET,llm_style,eval,llm_style_eval_235,4,2048,1024,bf16,NVIDIA GeForce RTX 4060,c04,64,64,64,4,3,8,0.0,0.0,121.85599654912949,205.3667218983173,0.137680676167921,7,-1,-1,llm8_g7,0,
2026-03-03T06:04:46.447733+00:00,BUCKET,llm_style,eval,llm_style_eval_236,4,8192,3072,bf16,NVIDIA GeForce RTX 4060,c11,32,128,32,4,2,8,0.0,0.0,452.60798931121826,485.2428916096686,0.4448144901427394,5,-1,-1,llm8_g5,0,
2026-03-03T06:04:46.478288+00:00,BUCKET,llm_style,eval,llm_style_eval_237,64,1024,4096,bf16,NVIDIA GeForce RTX 4060,c04,64,64,64,4,3,8,0.0,0.0,219.61599588394165,268.0012735724448,2.4445892925017856,3,-1,-1,llm8_g3,0,
2026-03-03T06:04:46.571969+00:00,BUCKET,llm_style,eval,llm_style_eval_238,32,2048,6144,bf16,NVIDIA GeForce RTX 4060,c04,64,64,64,4,3,8,0.0,0.0,552.9599785804749,646.4486420154572,1.4563556119691219,3,-1,-1,llm8_g3,0,
2026-03-03T06:04:46.606557+00:00,BUCKET,llm_style,eval,llm_style_eval_239,32,2048,6144,bf16,NVIDIA GeForce RTX 4060,c04,64,64,64,4,3,8,0.0,0.0,549.8560070991516,569.3884742259979,1.4645768303023827,3,-1,-1,llm8_g3,0,
2026-03-03T06:04:46.680917+00:00,BUCKET,llm_style,eval,llm_style_eval_240,8,8192,1536,bf16,NVIDIA GeForce RTX 4060,c11,32,128,32,4,2,8,0.0,0.0,206.7519947886467,324.36479330062855,0.9737588854018417,5,-1,-1,llm8_g5,0,
2026-03-03T06:04:46.700238+00:00,BUCKET,llm_style,eval,llm_style_eval_241,16,1536,1536,bf16,NVIDIA GeForce RTX 4060,c04,64,64,64,4,3,8,0.0,0.0,89.08800035715103,178.26816424727429,0.847448272464675,7,-1,-1,llm8_g7,0,
2026-03-03T06:04:46.739017+00:00,BUCKET,llm_style,eval,llm_style_eval_242,1,2048,3072,bf16,NVIDIA GeForce RTX 4060,c04,64,64,64,4,3,8,0.0,0.0,232.41599649190903,243.72031986713407,0.05413961254787401,7,-1,-1,llm8_g7,0,
2026-03-03T06:04:46.792184+00:00,BUCKET,llm_style,eval,llm_style_eval_243,8,1536,6144,bf16,NVIDIA GeForce RTX 4060,c04,64,64,64,4,3,8,0.0,0.0,254.94399666786194,266.208633184433,0.5922671095358815,7,-1,-1,llm8_g7,0,
2026-03-03T06:04:46.851609+00:00,BUCKET,llm_style,eval,llm_style_eval_244,32,8192,1024,bf16,NVIDIA GeForce RTX 4060,c06,64,128,32,4,3,8,0.0,0.0,227.32800245285034,454.5149022340772,2.3616576321755667,1,-1,-1,llm8_g1,0,
2026-03-03T06:04:46.987903+00:00,BUCKET,llm_style,eval,llm_style_eval_245,4,6144,4096,bf16,NVIDIA GeForce RTX 4060,c11,32,128,32,4,2,8,0.0,0.0,367.6159977912903,505.6409555673597,0.5476545993906958,5,-1,-1,llm8_g5,0,
2026-03-03T06:04:47.075876+00:00,BUCKET,llm_style,eval,llm_style_eval_246,32,2048,6144,bf16,NVIDIA GeForce RTX 4060,c04,64,64,64,4,3,8,0.0,0.0,434.1759979724884,461.30208671092987,1.8547924614916835,3,-1,-1,llm8_g3,0,
2026-03-03T06:04:47.154659+00:00,BUCKET,llm_style,eval,llm_style_eval_247,64,6144,2048,bf16,NVIDIA GeForce RTX 4060,c06,64,128,32,4,3,8,0.0,0.0,286.52800619602203,369.8790344595908,5.621135460308664,1,-1,-1,llm8_g1,0,
2026-03-03T06:04:47.164994+00:00,BUCKET,llm_style,eval,llm_style_eval_248,64,1024,1024,bf16,NVIDIA GeForce RTX 4060,c04,64,64,64,4,3,8,0.0,0.0,67.58400052785873,139.3868824839592,1.9859393784283939,3,-1,-1,llm8_g3,0,
2026-03-03T06:04:47.212260+00:00,BUCKET,llm_style,eval,llm_style_eval_249,2,8192,1024,bf16,NVIDIA GeForce RTX 4060,c11,32,128,32,4,2,8,0.0,0.0,143.8720002770424,167.11679682135576,0.23322419883915574,5,-1,-1,llm8_g5,0,
2026-03-03T06:04:47.272818+00:00,BUCKET,llm_style,eval,llm_style_eval_250,64,3072,3072,bf16,NVIDIA GeForce RTX 4060,c04,64,64,64,4,3,8,0.0,0.0,233.8400036096573,304.168966114521,5.165752366376174,3,-1,-1,llm8_g3,0,
2026-03-03T06:04:47.353564+00:00,BUCKET,llm_style,eval,llm_style_eval_251,64,1024,8192,bf16,NVIDIA GeForce RTX 4060,c10,64,128,64,8,3,8,0.0,0.0,567.8080022335052,619.7964847087858,1.8910297490989476,2,-1,-1,llm8_g2,0,
2026-03-03T06:04:47.434941+00:00,BUCKET,llm_style,eval,llm_style_eval_252,64,4096,3072,bf16,NVIDIA GeForce RTX 4060,c04,64,64,64,4,3,8,0.0,0.0,328.70399951934814,462.62272000312794,4.8998878576322165,3,-1,-1,llm8_g3,0,
2026-03-03T06:04:47.572010+00:00,BUCKET,llm_style,eval,llm_style_eval_253,8,6144,4096,bf16,NVIDIA GeForce RTX 4060,c11,32,128,32,4,2,8,0.0,0.0,368.6400055885315,473.9788800477981,1.0922666501080551,5,-1,-1,llm8_g5,0,
2026-03-03T06:04:47.597742+00:00,BUCKET,llm_style,eval,llm_style_eval_254,4,1536,3072,bf16,NVIDIA GeForce RTX 4060,c04,64,64,64,4,3,8,0.0,0.0,142.33599603176117,247.09632083773604,0.2652086404873765,7,-1,-1,llm8_g7,0,
2026-03-03T06:04:47.621627+00:00,BUCKET,llm_style,eval,llm_style_eval_255,1,3072,1536,bf16,NVIDIA GeForce RTX 4060,c04,64,64,64,4,3,8,0.0,0.0,129.42399829626083,146.98432102799416,0.07291680155327614,7,-1,-1,llm8_g7,0,
2026-03-03T06:04:47.981149+00:00,TORCH,llm_style,tune,llm_style_tune_000,64,6144,6144,bf16,NVIDIA GeForce RTX 4060,torch_cublas,-1,-1,-1,-1,-1,-1,144.70262301620096,0.0,759.6319913864136,804.225926399231,6.360761872576421,1,-1,-1,torch_mm,0,torch_mm_cublas
2026-03-03T06:04:48.065307+00:00,TORCH,llm_style,tune,llm_style_tune_001,64,8192,1536,bf16,NVIDIA GeForce RTX 4060,torch_cublas,-1,-1,-1,-1,-1,-1,0.0,0.0,305.1519989967346,362.4447998404502,5.278067131446958,1,-1,-1,torch_mm,0,torch_mm_cublas
2026-03-03T06:04:48.217949+00:00,TORCH,llm_style,tune,llm_style_tune_002,32,3072,8192,bf16,NVIDIA GeForce RTX 4060,torch_cublas,-1,-1,-1,-1,-1,-1,0.0,0.0,502.78401374816895,554.7110599279404,3.2033889144429173,2,-1,-1,torch_mm,0,torch_mm_cublas
2026-03-03T06:04:48.327575+00:00,TORCH,llm_style,tune,llm_style_tune_003,4,6144,3072,bf16,NVIDIA GeForce RTX 4060,torch_cublas,-1,-1,-1,-1,-1,-1,0.0,0.0,437.23200261592865,459.43807512521744,0.3453428456668491,5,-1,-1,torch_mm,0,torch_mm_cublas
2026-03-03T06:04:48.376214+00:00,TORCH,llm_style,tune,llm_style_tune_004,8,8192,1024,bf16,NVIDIA GeForce RTX 4060,torch_cublas,-1,-1,-1,-1,-1,-1,0.0,0.0,182.27200210094452,266.5267205238342,0.7363595420742048,5,-1,-1,torch_mm,0,torch_mm_cublas
2026-03-03T06:04:48.525520+00:00,TORCH,llm_style,tune,llm_style_tune_005,32,8192,3072,bf16,NVIDIA GeForce RTX 4060,torch_cublas,-1,-1,-1,-1,-1,-1,0.0,0.0,720.8960056304932,821.8857622146606,2.234181800731943,1,-1,-1,torch_mm,0,torch_mm_cublas
2026-03-03T06:04:48.857996+00:00,TORCH,llm_style,tune,llm_style_tune_006,32,6144,8192,bf16,NVIDIA GeForce RTX 4060,torch_cublas,-1,-1,-1,-1,-1,-1,0.0,0.0,1319.9360370635986,1367.5827622413635,2.4404405831407656,0,-1,-1,torch_mm,0,torch_mm_cublas
2026-03-03T06:04:48.882496+00:00,TORCH,llm_style,tune,llm_style_tune_007,8,1536,2048,bf16,NVIDIA GeForce RTX 4060,torch_cublas,-1,-1,-1,-1,-1,-1,0.0,0.0,88.97599950432777,182.61887416243547,0.5656766800079822,7,-1,-1,torch_mm,0,torch_mm_cublas
2026-03-03T06:04:48.920941+00:00,TORCH,llm_style,tune,llm_style_tune_008,16,1536,4096,bf16,NVIDIA GeForce RTX 4060,torch_cublas,-1,-1,-1,-1,-1,-1,0.0,0.0,189.95200097560883,214.8864017426967,1.0598813961736142,7,-1,-1,torch_mm,0,torch_mm_cublas
2026-03-03T06:04:48.939619+00:00,TORCH,llm_style,tune,llm_style_tune_009,64,1536,2048,bf16,NVIDIA GeForce RTX 4060,torch_cublas,-1,-1,-1,-1,-1,-1,0.0,0.0,102.39999741315842,161.90464615821827,3.932160099334719,3,-1,-1,torch_mm,0,torch_mm_cublas
2026-03-03T06:04:48.955577+00:00,TORCH,llm_style,tune,llm_style_tune_010,2,2048,1024,bf16,NVIDIA GeForce RTX 4060,torch_cublas,-1,-1,-1,-1,-1,-1,0.0,0.0,97.63200208544731,104.89695742726326,0.08592067990840042,7,-1,-1,torch_mm,0,torch_mm_cublas
2026-03-03T06:04:49.105973+00:00,TORCH,llm_style,tune,llm_style_tune_011,2,3072,8192,bf16,NVIDIA GeForce RTX 4060,torch_cublas,-1,-1,-1,-1,-1,-1,0.0,0.0,601.936012506485,626.2067198753357,0.16723255281044597,6,-1,-1,torch_mm,0,torch_mm_cublas
2026-03-03T06:04:49.131352+00:00,TORCH,llm_style,tune,llm_style_tune_012,64,2048,1536,bf16,NVIDIA GeForce RTX 4060,torch_cublas,-1,-1,-1,-1,-1,-1,0.0,0.0,130.97600638866425,227.24287524819357,3.074251499203208,3,-1,-1,torch_mm,0,torch_mm_cublas
2026-03-03T06:04:49.350474+00:00,TORCH,llm_style,tune,llm_style_tune_013,16,8192,4096,bf16,NVIDIA GeForce RTX 4060,torch_cublas,-1,-1,-1,-1,-1,-1,0.0,0.0,830.4640054702759,877.1241581439972,1.2929420383391097,5,-1,-1,torch_mm,0,torch_mm_cublas
2026-03-03T06:04:49.552552+00:00,TORCH,llm_style,tune,llm_style_tune_014,4,8192,4096,bf16,NVIDIA GeForce RTX 4060,torch_cublas,-1,-1,-1,-1,-1,-1,0.0,0.0,848.719984292984,884.269139766693,0.31628270921842017,5,-1,-1,torch_mm,0,torch_mm_cublas
2026-03-03T06:04:49.592948+00:00,TORCH,llm_style,tune,llm_style_tune_015,4,3072,2048,bf16,NVIDIA GeForce RTX 4060,torch_cublas,-1,-1,-1,-1,-1,-1,0.0,0.0,162.81600296497345,294.20416206121416,0.3091320698422244,7,-1,-1,torch_mm,0,torch_mm_cublas
2026-03-03T06:04:49.607028+00:00,TORCH,llm_style,tune,llm_style_tune_016,16,1536,1024,bf16,NVIDIA GeForce RTX 4060,torch_cublas,-1,-1,-1,-1,-1,-1,0.0,0.0,46.08000069856644,51.62432003766298,1.0922666501080551,7,-1,-1,torch_mm,0,torch_mm_cublas
2026-03-03T06:04:49.622019+00:00,TORCH,llm_style,tune,llm_style_tune_017,32,1024,2048,bf16,NVIDIA GeForce RTX 4060,torch_cublas,-1,-1,-1,-1,-1,-1,0.0,0.0,72.43200019001961,176.09728410840026,1.8530170041955274,3,-1,-1,torch_mm,0,torch_mm_cublas
2026-03-03T06:04:49.640342+00:00,TORCH,llm_style,tune,llm_style_tune_018,64,1536,2048,bf16,NVIDIA GeForce RTX 4060,torch_cublas,-1,-1,-1,-1,-1,-1,0.0,0.0,89.08800035715103,175.49983873963356,4.519724119811601,3,-1,-1,torch_mm,0,torch_mm_cublas
2026-03-03T06:04:49.679061+00:00,TORCH,llm_style,tune,llm_style_tune_019,4,4096,1536,bf16,NVIDIA GeForce RTX 4060,torch_cublas,-1,-1,-1,-1,-1,-1,0.0,0.0,202.7519941329956,255.080647021532,0.24824243142577848,7,-1,-1,torch_mm,0,torch_mm_cublas
2026-03-03T06:04:49.759921+00:00,TORCH,llm_style,tune,llm_style_tune_020,1,8192,1536,bf16,NVIDIA GeForce RTX 4060,torch_cublas,-1,-1,-1,-1,-1,-1,0.0,0.0,223.23200106620789,249.2726418375969,0.11273394441568493,5,-1,-1,torch_mm,0,torch_mm_cublas
2026-03-03T06:04:49.805156+00:00,TORCH,llm_style,tune,llm_style_tune_021,64,1536,4096,bf16,NVIDIA GeForce RTX 4060,torch_cublas,-1,-1,-1,-1,-1,-1,0.0,0.0,176.01600289344788,223.77471759915352,4.575188362205316,3,-1,-1,torch_mm,0,torch_mm_cublas
2026-03-03T06:04:49.846932+00:00,TORCH,llm_style,tune,llm_style_tune_022,64,1024,6144,bf16,NVIDIA GeForce RTX 4060,torch_cublas,-1,-1,-1,-1,-1,-1,0.0,0.0,176.92800611257553,222.35136076807973,4.551604834610529,3,-1,-1,torch_mm,0,torch_mm_cublas
2026-03-03T06:04:49.873811+00:00,TORCH,llm_style,tune,llm_style_tune_023,8,4096,1024,bf16,NVIDIA GeForce RTX 4060,torch_cublas,-1,-1,-1,-1,-1,-1,0.0,0.0,139.26400244235992,153.12351942062378,0.4818823444901042,7,-1,-1,torch_mm,0,torch_mm_cublas
2026-03-03T06:04:49.974517+00:00,TORCH,llm_style,tune,llm_style_tune_024,8,4096,4096,bf16,NVIDIA GeForce RTX 4060,torch_cublas,-1,-1,-1,-1,-1,-1,0.0,0.0,427.8080016374588,497.61281579732884,0.6274671230377843,7,-1,-1,torch_mm,0,torch_mm_cublas
2026-03-03T06:04:50.007973+00:00,TORCH,llm_style,tune,llm_style_tune_025,32,6144,1024,bf16,NVIDIA GeForce RTX 4060,torch_cublas,-1,-1,-1,-1,-1,-1,0.0,0.0,186.36800348758698,194.58879858255386,2.1605274320965653,1,-1,-1,torch_mm,0,torch_mm_cublas
2026-03-03T06:04:50.028793+00:00,TORCH,llm_style,tune,llm_style_tune_026,1,3072,1536,bf16,NVIDIA GeForce RTX 4060,torch_cublas,-1,-1,-1,-1,-1,-1,0.0,0.0,75.77600330114365,92.7232015877962,0.12454053511499424,7,-1,-1,torch_mm,0,torch_mm_cublas
2026-03-03T06:04:50.086597+00:00,TORCH,llm_style,tune,llm_style_tune_027,1,6144,1536,bf16,NVIDIA GeForce RTX 4060,torch_cublas,-1,-1,-1,-1,-1,-1,0.0,0.0,155.58400005102158,217.46687501668913,0.12131303986149229,5,-1,-1,torch_mm,0,torch_mm_cublas
2026-03-03T06:04:50.123619+00:00,TORCH,llm_style,tune,llm_style_tune_028,4,4096,1536,bf16,NVIDIA GeForce RTX 4060,torch_cublas,-1,-1,-1,-1,-1,-1,0.0,0.0,202.7519941329956,254.1363240778446,0.24824243142577848,7,-1,-1,torch_mm,0,torch_mm_cublas
2026-03-03T06:04:50.163308+00:00,TORCH,llm_style,tune,llm_style_tune_029,16,1024,6144,bf16,NVIDIA GeForce RTX 4060,torch_cublas,-1,-1,-1,-1,-1,-1,0.0,0.0,170.83200067281723,210.30912399291987,1.1785063173590467,7,-1,-1,torch_mm,0,torch_mm_cublas
2026-03-03T06:04:50.389287+00:00,TORCH,llm_style,tune,llm_style_tune_030,64,4096,8192,bf16,NVIDIA GeForce RTX 4060,torch_cublas,-1,-1,-1,-1,-1,-1,0.0,0.0,1189.8720264434814,1262.9196381568909,3.6096043948840655,2,-1,-1,torch_mm,0,torch_mm_cublas
2026-03-03T06:04:50.425458+00:00,TORCH,llm_style,tune,llm_style_tune_031,1,6144,1024,bf16,NVIDIA GeForce RTX 4060,torch_cublas,-1,-1,-1,-1,-1,-1,0.0,0.0,108.5439994931221,165.47039523720736,0.11592452884323022,5,-1,-1,torch_mm,0,torch_mm_cublas
2026-03-03T06:04:50.452678+00:00,TORCH,llm_style,tune,llm_style_tune_032,64,1024,4096,bf16,NVIDIA GeForce RTX 4060,torch_cublas,-1,-1,-1,-1,-1,-1,0.0,0.0,135.16800105571747,196.50560662150366,3.9718787568567877,3,-1,-1,torch_mm,0,torch_mm_cublas
2026-03-03T06:04:50.640042+00:00,TORCH,llm_style,tune,llm_style_tune_033,2,4096,8192,bf16,NVIDIA GeForce RTX 4060,torch_cublas,-1,-1,-1,-1,-1,-1,0.0,0.0,719.871997833252,764.6310490369797,0.18644665774468647,6,-1,-1,torch_mm,0,torch_mm_cublas
2026-03-03T06:04:50.978224+00:00,TORCH,llm_style,tune,llm_style_tune_034,1,8192,6144,bf16,NVIDIA GeForce RTX 4060,torch_cublas,-1,-1,-1,-1,-1,-1,0.0,0.0,1811.4559650421143,1856.071685552597,0.05557037981746341,5,-1,-1,torch_mm,0,torch_mm_cublas
2026-03-03T06:04:50.997902+00:00,TORCH,llm_style,tune,llm_style_tune_035,64,1536,1024,bf16,NVIDIA GeForce RTX 4060,torch_cublas,-1,-1,-1,-1,-1,-1,0.0,0.0,56.671999394893646,79.45216074585912,3.552487897897251,3,-1,-1,torch_mm,0,torch_mm_cublas
2026-03-03T06:04:51.029056+00:00,TORCH,llm_style,tune,llm_style_tune_036,32,3072,2048,bf16,NVIDIA GeForce RTX 4060,torch_cublas,-1,-1,-1,-1,-1,-1,0.0,0.0,118.78400295972824,166.05183660984036,3.3897930189851655,3,-1,-1,torch_mm,0,torch_mm_cublas
2026-03-03T06:04:51.083899+00:00,TORCH,llm_style,tune,llm_style_tune_037,4,1536,6144,bf16,NVIDIA GeForce RTX 4060,torch_cublas,-1,-1,-1,-1,-1,-1,0.0,0.0,174.0799993276596,187.1455942094326,0.43369411932209373,7,-1,-1,torch_mm,0,torch_mm_cublas
2026-03-03T06:04:51.113614+00:00,TORCH,llm_style,tune,llm_style_tune_038,1,4096,1536,bf16,NVIDIA GeForce RTX 4060,torch_cublas,-1,-1,-1,-1,-1,-1,0.0,0.0,126.92800164222717,201.48224100470526,0.09913424805558303,7,-1,-1,torch_mm,0,torch_mm_cublas
2026-03-03T06:04:51.144075+00:00,TORCH,llm_style,tune,llm_style_tune_039,4,1536,4096,bf16,NVIDIA GeForce RTX 4060,torch_cublas,-1,-1,-1,-1,-1,-1,0.0,0.0,119.80800330638885,213.52480068802822,0.42010255250882744,7,-1,-1,torch_mm,0,torch_mm_cublas
2026-03-03T06:04:51.412671+00:00,TORCH,llm_style,tune,llm_style_tune_040,2,6144,8192,bf16,NVIDIA GeForce RTX 4060,torch_cublas,-1,-1,-1,-1,-1,-1,0.0,0.0,873.4719753265381,970.1612901687622,0.23049004168077197,4,-1,-1,torch_mm,0,torch_mm_cublas
2026-03-03T06:04:51.424433+00:00,TORCH,llm_style,tune,llm_style_tune_041,16,1024,1536,bf16,NVIDIA GeForce RTX 4060,torch_cublas,-1,-1,-1,-1,-1,-1,0.0,0.0,43.007999658584595,109.18911971151826,1.1702857235759294,7,-1,-1,torch_mm,0,torch_mm_cublas
2026-03-03T06:04:51.455961+00:00,TORCH,llm_style,tune,llm_style_tune_042,32,3072,2048,bf16,NVIDIA GeForce RTX 4060,torch_cublas,-1,-1,-1,-1,-1,-1,0.0,0.0,118.78400295972824,177.83808425068852,3.3897930189851655,3,-1,-1,torch_mm,0,torch_mm_cublas
2026-03-03T06:04:51.497035+00:00,TORCH,llm_style,tune,llm_style_tune_043,2,2048,4096,bf16,NVIDIA GeForce RTX 4060,torch_cublas,-1,-1,-1,-1,-1,-1,0.0,0.0,154.62400019168854,229.10911902785296,0.21700662224753156,7,-1,-1,torch_mm,0,torch_mm_cublas
2026-03-03T06:04:51.608250+00:00,TORCH,llm_style,tune,llm_style_tune_044,64,2048,8192,bf16,NVIDIA GeForce RTX 4060,torch_cublas,-1,-1,-1,-1,-1,-1,0.0,0.0,443.3920085430145,473.1456106901169,4.843307066035376,2,-1,-1,torch_mm,0,torch_mm_cublas
2026-03-03T06:04:51.747128+00:00,TORCH,llm_style,tune,llm_style_tune_045,2,3072,8192,bf16,NVIDIA GeForce RTX 4060,torch_cublas,-1,-1,-1,-1,-1,-1,0.0,0.0,443.90399754047394,475.2383968234062,0.22676816734641325,6,-1,-1,torch_mm,0,torch_mm_cublas
2026-03-03T06:04:52.014930+00:00,TORCH,llm_style,tune,llm_style_tune_046,4,8192,6144,bf16,NVIDIA GeForce RTX 4060,torch_cublas,-1,-1,-1,-1,-1,-1,0.0,0.0,829.2799890041351,904.9068915843964,0.4855455206190827,5,-1,-1,torch_mm,0,torch_mm_cublas
2026-03-03T06:04:52.047752+00:00,TORCH,llm_style,tune,llm_style_tune_047,1,1024,6144,bf16,NVIDIA GeForce RTX 4060,torch_cublas,-1,-1,-1,-1,-1,-1,0.0,0.0,112.64000087976456,238.45887482166285,0.11170909003659714,7,-1,-1,torch_mm,0,torch_mm_cublas
2026-03-03T06:04:52.121741+00:00,TORCH,llm_style,tune,llm_style_tune_048,32,4096,3072,bf16,NVIDIA GeForce RTX 4060,torch_cublas,-1,-1,-1,-1,-1,-1,0.0,0.0,299.8559921979904,312.84223794937134,2.68564373883937,3,-1,-1,torch_mm,0,torch_mm_cublas
2026-03-03T06:04:52.139801+00:00,TORCH,llm_style,tune,llm_style_tune_049,16,2048,1024,bf16,NVIDIA GeForce RTX 4060,torch_cublas,-1,-1,-1,-1,-1,-1,0.0,0.0,70.56000083684921,76.82047985494137,0.9510893311236059,7,-1,-1,torch_mm,0,torch_mm_cublas
2026-03-03T06:04:52.153144+00:00,TORCH,llm_style,tune,llm_style_tune_050,4,1024,1536,bf16,NVIDIA GeForce RTX 4060,torch_cublas,-1,-1,-1,-1,-1,-1,0.0,0.0,45.423999428749084,71.64928175508966,0.2770102183480614,7,-1,-1,torch_mm,0,torch_mm_cublas
2026-03-03T06:04:52.352639+00:00,TORCH,llm_style,tune,llm_style_tune_051,64,4096,8192,bf16,NVIDIA GeForce RTX 4060,torch_cublas,-1,-1,-1,-1,-1,-1,0.0,0.0,872.4480271339417,890.0198209285736,4.922891865672842,2,-1,-1,torch_mm,0,torch_mm_cublas
2026-03-03T06:04:52.374770+00:00,TORCH,llm_style,tune,llm_style_tune_052,16,2048,1536,bf16,NVIDIA GeForce RTX 4060,torch_cublas,-1,-1,-1,-1,-1,-1,0.0,0.0,92.96000003814697,111.23712040483949,1.0828667809669956,7,-1,-1,torch_mm,0,torch_mm_cublas
2026-03-03T06:04:52.384698+00:00,TORCH,llm_style,tune,llm_style_tune_053,64,1024,1024,bf16,NVIDIA GeForce RTX 4060,torch_cublas,-1,-1,-1,-1,-1,-1,0.0,0.0,38.784001022577286,61.58816020935771,3.460646773443204,3,-1,-1,torch_mm,0,torch_mm_cublas
2026-03-03T06:04:52.571748+00:00,TORCH,llm_style,tune,llm_style_tune_054,4,4096,8192,bf16,NVIDIA GeForce RTX 4060,torch_cublas,-1,-1,-1,-1,-1,-1,0.0,0.0,538.6239886283875,601.0777437686919,0.4983726340959565,6,-1,-1,torch_mm,0,torch_mm_cublas
2026-03-03T06:04:52.648612+00:00,TORCH,llm_style,tune,llm_style_tune_055,1,4096,3072,bf16,NVIDIA GeForce RTX 4060,torch_cublas,-1,-1,-1,-1,-1,-1,0.0,0.0,236.54399812221527,374.76288318634,0.1063896112341754,7,-1,-1,torch_mm,0,torch_mm_cublas
2026-03-03T06:04:52.668511+00:00,TORCH,llm_style,tune,llm_style_tune_056,64,1536,2048,bf16,NVIDIA GeForce RTX 4060,torch_cublas,-1,-1,-1,-1,-1,-1,0.0,0.0,70.01600041985512,110.32447971403593,5.750873822918565,3,-1,-1,torch_mm,0,torch_mm_cublas
2026-03-03T06:04:52.713090+00:00,TORCH,llm_style,tune,llm_style_tune_057,2,4096,2048,bf16,NVIDIA GeForce RTX 4060,torch_cublas,-1,-1,-1,-1,-1,-1,0.0,0.0,199.68000054359436,265.7123258709907,0.16804102518356293,7,-1,-1,torch_mm,0,torch_mm_cublas
2026-03-03T06:04:52.782709+00:00,TORCH,llm_style,tune,llm_style_tune_058,4,8192,1536,bf16,NVIDIA GeForce RTX 4060,torch_cublas,-1,-1,-1,-1,-1,-1,0.0,0.0,234.49599742889404,398.2028836011882,0.4292751138770461,5,-1,-1,torch_mm,0,torch_mm_cublas
2026-03-03T06:04:52.816022+00:00,TORCH,llm_style,tune,llm_style_tune_059,1,1536,4096,bf16,NVIDIA GeForce RTX 4060,torch_cublas,-1,-1,-1,-1,-1,-1,0.0,0.0,169.98399794101715,248.04384872317297,0.07402409728218154,7,-1,-1,torch_mm,0,torch_mm_cublas
2026-03-03T06:04:52.850235+00:00,TORCH,llm_style,tune,llm_style_tune_060,64,1536,4096,bf16,NVIDIA GeForce RTX 4060,torch_cublas,-1,-1,-1,-1,-1,-1,0.0,0.0,154.62400019168854,199.87455666065202,5.208158933940757,3,-1,-1,torch_mm,0,torch_mm_cublas
2026-03-03T06:04:53.201664+00:00,TORCH,llm_style,tune,llm_style_tune_061,8,8192,6144,bf16,NVIDIA GeForce RTX 4060,torch_cublas,-1,-1,-1,-1,-1,-1,0.0,0.0,1139.7119760513306,1196.0294556617737,0.7065876159256315,5,-1,-1,torch_mm,0,torch_mm_cublas
2026-03-03T06:04:53.261033+00:00,TORCH,llm_style,tune,llm_style_tune_062,64,6144,1536,bf16,NVIDIA GeForce RTX 4060,torch_cublas,-1,-1,-1,-1,-1,-1,0.0,0.0,229.37600314617157,274.7392034530639,5.266285642052185,1,-1,-1,torch_mm,0,torch_mm_cublas
2026-03-03T06:04:53.271868+00:00,TORCH,llm_style,tune,llm_style_tune_063,2,1536,1024,bf16,NVIDIA GeForce RTX 4060,torch_cublas,-1,-1,-1,-1,-1,-1,0.0,0.0,46.08000069856644,102.45056085288523,0.1365333312635069,7,-1,-1,torch_mm,0,torch_mm_cublas
2026-03-03T06:04:53.282431+00:00,TORCH,llm_style,eval,llm_style_eval_000,32,1536,1024,bf16,NVIDIA GeForce RTX 4060,torch_cublas,-1,-1,-1,-1,-1,-1,0.0,0.0,52.12800018489361,101.80159777402872,1.9310791828375498,3,-1,-1,torch_mm,0,torch_mm_cublas
2026-03-03T06:04:53.402205+00:00,TORCH,llm_style,eval,llm_style_eval_001,32,2048,8192,bf16,NVIDIA GeForce RTX 4060,torch_cublas,-1,-1,-1,-1,-1,-1,0.0,0.0,565.0080144405365,596.0498982667923,1.9004010501748456,2,-1,-1,torch_mm,0,torch_mm_cublas
2026-03-03T06:04:53.450695+00:00,TORCH,llm_style,eval,llm_style_eval_002,16,2048,4096,bf16,NVIDIA GeForce RTX 4060,torch_cublas,-1,-1,-1,-1,-1,-1,0.0,0.0,213.3440002799034,239.01632204651833,1.2582282869347983,7,-1,-1,torch_mm,0,torch_mm_cublas
2026-03-03T06:04:53.472385+00:00,TORCH,llm_style,eval,llm_style_eval_003,16,2048,1536,bf16,NVIDIA GeForce RTX 4060,torch_cublas,-1,-1,-1,-1,-1,-1,0.0,0.0,121.85599654912949,202.89280071854586,0.8260840570075263,7,-1,-1,torch_mm,0,torch_mm_cublas
2026-03-03T06:04:53.575352+00:00,TORCH,llm_style,eval,llm_style_eval_004,64,8192,2048,bf16,NVIDIA GeForce RTX 4060,torch_cublas,-1,-1,-1,-1,-1,-1,0.0,0.0,462.3359888792038,472.99423933029175,4.644855039742712,1,-1,-1,torch_mm,0,torch_mm_cublas
2026-03-03T06:04:53.730628+00:00,TORCH,llm_style,eval,llm_style_eval_005,64,3072,8192,bf16,NVIDIA GeForce RTX 4060,torch_cublas,-1,-1,-1,-1,-1,-1,0.0,0.0,631.8079829216003,682.5471812486649,5.098424773147754,2,-1,-1,torch_mm,0,torch_mm_cublas
2026-03-03T06:04:53.759549+00:00,TORCH,llm_style,eval,llm_style_eval_006,32,2048,2048,bf16,NVIDIA GeForce RTX 4060,torch_cublas,-1,-1,-1,-1,-1,-1,0.0,0.0,138.75199854373932,144.42495673894882,1.9346420867255478,3,-1,-1,torch_mm,0,torch_mm_cublas
2026-03-03T06:04:53.861054+00:00,TORCH,llm_style,eval,llm_style_eval_007,8,8192,2048,bf16,NVIDIA GeForce RTX 4060,torch_cublas,-1,-1,-1,-1,-1,-1,0.0,0.0,433.0720007419586,449.4259148836136,0.6198402472108661,5,-1,-1,torch_mm,0,torch_mm_cublas
2026-03-03T06:04:53.942166+00:00,TORCH,llm_style,eval,llm_style_eval_008,64,1536,8192,bf16,NVIDIA GeForce RTX 4060,torch_cublas,-1,-1,-1,-1,-1,-1,0.0,0.0,333.69599282741547,345.0758373737335,4.826586985217394,2,-1,-1,torch_mm,0,torch_mm_cublas
2026-03-03T06:04:54.127292+00:00,TORCH,llm_style,eval,llm_style_eval_009,64,4096,6144,bf16,NVIDIA GeForce RTX 4060,torch_cublas,-1,-1,-1,-1,-1,-1,0.0,0.0,1246.2079524993896,1300.5414485931396,2.5848217912103055,3,-1,-1,torch_mm,0,torch_mm_cublas
2026-03-03T06:04:54.179656+00:00,TORCH,llm_style,eval,llm_style_eval_010,64,2048,4096,bf16,NVIDIA GeForce RTX 4060,torch_cublas,-1,-1,-1,-1,-1,-1,0.0,0.0,319.487988948822,331.1488029360771,3.360820629072225,3,-1,-1,torch_mm,0,torch_mm_cublas
2026-03-03T06:04:54.292595+00:00,TORCH,llm_style,eval,llm_style_eval_011,32,3072,6144,bf16,NVIDIA GeForce RTX 4060,torch_cublas,-1,-1,-1,-1,-1,-1,0.0,0.0,374.783992767334,409.73952412605286,3.2230820294128772,3,-1,-1,torch_mm,0,torch_mm_cublas
2026-03-03T06:04:54.307603+00:00,TORCH,llm_style,eval,llm_style_eval_012,16,1536,1536,bf16,NVIDIA GeForce RTX 4060,torch_cublas,-1,-1,-1,-1,-1,-1,0.0,0.0,62.46400065720081,138.36287468671796,1.2086557249883207,7,-1,-1,torch_mm,0,torch_mm_cublas
2026-03-03T06:04:54.342296+00:00,TORCH,llm_style,eval,llm_style_eval_013,64,2048,3072,bf16,NVIDIA GeForce RTX 4060,torch_cublas,-1,-1,-1,-1,-1,-1,0.0,0.0,195.5839991569519,210.08384406566614,4.117445043925905,3,-1,-1,torch_mm,0,torch_mm_cublas
2026-03-03T06:04:54.622732+00:00,TORCH,llm_style,eval,llm_style_eval_014,16,8192,6144,bf16,NVIDIA GeForce RTX 4060,torch_cublas,-1,-1,-1,-1,-1,-1,0.0,0.0,989.1840219497681,1071.849913597107,1.6282235663545612,5,-1,-1,torch_mm,0,torch_mm_cublas
2026-03-03T06:04:54.678558+00:00,TORCH,llm_style,eval,llm_style_eval_015,64,6144,1536,bf16,NVIDIA GeForce RTX 4060,torch_cublas,-1,-1,-1,-1,-1,-1,0.0,0.0,199.40800219774246,222.96480000019068,6.057728570000566,1,-1,-1,torch_mm,0,torch_mm_cublas
2026-03-03T06:04:54.772646+00:00,TORCH,llm_style,eval,llm_style_eval_016,16,4096,4096,bf16,NVIDIA GeForce RTX 4060,torch_cublas,-1,-1,-1,-1,-1,-1,0.0,0.0,350.0799983739853,358.9222311973572,1.5335663690973533,7,-1,-1,torch_mm,0,torch_mm_cublas
2026-03-03T06:04:54.963660+00:00,TORCH,llm_style,eval,llm_style_eval_017,64,8192,4096,bf16,NVIDIA GeForce RTX 4060,torch_cublas,-1,-1,-1,-1,-1,-1,0.0,0.0,753.6640167236328,786.7187184095383,5.698782482240965,1,-1,-1,torch_mm,0,torch_mm_cublas
2026-03-03T06:04:55.134255+00:00,TORCH,llm_style,eval,llm_style_eval_018,32,4096,6144,bf16,NVIDIA GeForce RTX 4060,torch_cublas,-1,-1,-1,-1,-1,-1,0.0,0.0,734.2079877853394,783.708164691925,2.1936736766624434,3,-1,-1,torch_mm,0,torch_mm_cublas
2026-03-03T06:04:55.278787+00:00,TORCH,llm_style,eval,llm_style_eval_019,16,3072,8192,bf16,NVIDIA GeForce RTX 4060,torch_cublas,-1,-1,-1,-1,-1,-1,0.0,0.0,489.47200179100037,523.9500749111176,1.645255224105459,6,-1,-1,torch_mm,0,torch_mm_cublas
2026-03-03T06:04:55.291412+00:00,TORCH,llm_style,eval,llm_style_eval_020,4,1536,1536,bf16,NVIDIA GeForce RTX 4060,torch_cublas,-1,-1,-1,-1,-1,-1,0.0,0.0,49.15200173854828,59.49439961463211,0.38399998641759203,7,-1,-1,torch_mm,0,torch_mm_cublas
2026-03-03T06:04:55.345366+00:00,TORCH,llm_style,eval,llm_style_eval_021,4,6144,1536,bf16,NVIDIA GeForce RTX 4060,torch_cublas,-1,-1,-1,-1,-1,-1,0.0,0.0,211.96800470352173,258.35967704653734,0.35617390514006025,5,-1,-1,torch_mm,0,torch_mm_cublas
2026-03-03T06:04:55.379033+00:00,TORCH,llm_style,eval,llm_style_eval_022,32,6144,1024,bf16,NVIDIA GeForce RTX 4060,torch_cublas,-1,-1,-1,-1,-1,-1,0.0,0.0,152.3040011525154,210.00831961631764,2.64374659203331,1,-1,-1,torch_mm,0,torch_mm_cublas
2026-03-03T06:04:55.393340+00:00,TORCH,llm_style,eval,llm_style_eval_023,16,1024,1536,bf16,NVIDIA GeForce RTX 4060,torch_cublas,-1,-1,-1,-1,-1,-1,0.0,0.0,50.11200159788132,70.73792159557341,1.0043831097364901,7,-1,-1,torch_mm,0,torch_mm_cublas
2026-03-03T06:04:55.438222+00:00,TORCH,llm_style,eval,llm_style_eval_024,32,8192,1024,bf16,NVIDIA GeForce RTX 4060,torch_cublas,-1,-1,-1,-1,-1,-1,0.0,0.0,205.6799978017807,220.7436764240265,2.6102242208179955,1,-1,-1,torch_mm,0,torch_mm_cublas
2026-03-03T06:04:55.657094+00:00,TORCH,llm_style,eval,llm_style_eval_025,32,6144,6144,bf16,NVIDIA GeForce RTX 4060,torch_cublas,-1,-1,-1,-1,-1,-1,0.0,0.0,873.4719753265381,972.5235247611997,2.7658805001692635,1,-1,-1,torch_mm,0,torch_mm_cublas
2026-03-03T06:04:55.733303+00:00,TORCH,llm_style,eval,llm_style_eval_026,1,6144,2048,bf16,NVIDIA GeForce RTX 4060,torch_cublas,-1,-1,-1,-1,-1,-1,0.0,0.0,182.27200210094452,208.4147198498249,0.1380674141389134,5,-1,-1,torch_mm,0,torch_mm_cublas
2026-03-03T06:04:55.814051+00:00,TORCH,llm_style,eval,llm_style_eval_027,32,4096,3072,bf16,NVIDIA GeForce RTX 4060,torch_cublas,-1,-1,-1,-1,-1,-1,0.0,0.0,331.7759931087494,421.8777647614478,2.42725930967536,3,-1,-1,torch_mm,0,torch_mm_cublas
2026-03-03T06:04:55.831774+00:00,TORCH,llm_style,eval,llm_style_eval_028,64,1536,1536,bf16,NVIDIA GeForce RTX 4060,torch_cublas,-1,-1,-1,-1,-1,-1,0.0,0.0,58.04799869656563,68.09439986944196,5.202416875361924,3,-1,-1,torch_mm,0,torch_mm_cublas
2026-03-03T06:04:55.847483+00:00,TORCH,llm_style,eval,llm_style_eval_029,2,3072,1024,bf16,NVIDIA GeForce RTX 4060,torch_cublas,-1,-1,-1,-1,-1,-1,0.0,0.0,72.7040022611618,125.50144508481014,0.17307041715256086,7,-1,-1,torch_mm,0,torch_mm_cublas
2026-03-03T06:04:55.920697+00:00,TORCH,llm_style,eval,llm_style_eval_030,32,1536,8192,bf16,NVIDIA GeForce RTX 4060,torch_cublas,-1,-1,-1,-1,-1,-1,0.0,0.0,260.09601354599,274.43679988384247,3.096188815126174,2,-1,-1,torch_mm,0,torch_mm_cublas
2026-03-03T06:04:55.950644+00:00,TORCH,llm_style,eval,llm_style_eval_031,8,3072,2048,bf16,NVIDIA GeForce RTX 4060,torch_cublas,-1,-1,-1,-1,-1,-1,0.0,0.0,132.86399841308594,217.55231857299805,0.757641627546304,7,-1,-1,torch_mm,0,torch_mm_cublas
2026-03-03T06:04:55.989507+00:00,TORCH,llm_style,eval,llm_style_eval_032,8,2048,3072,bf16,NVIDIA GeForce RTX 4060,torch_cublas,-1,-1,-1,-1,-1,-1,0.0,0.0,191.48799777030945,197.49088242650032,0.5256898456933369,7,-1,-1,torch_mm,0,torch_mm_cublas
2026-03-03T06:04:56.071622+00:00,TORCH,llm_style,eval,llm_style_eval_033,64,1536,8192,bf16,NVIDIA GeForce RTX 4060,torch_cublas,-1,-1,-1,-1,-1,-1,0.0,0.0,285.69599986076355,423.5366305708885,5.637505379091573,2,-1,-1,torch_mm,0,torch_mm_cublas
2026-03-03T06:04:56.146155+00:00,TORCH,llm_style,eval,llm_style_eval_034,64,6144,2048,bf16,NVIDIA GeForce RTX 4060,torch_cublas,-1,-1,-1,-1,-1,-1,0.0,0.0,282.4160009622574,353.95583301782597,5.7029797550856385,1,-1,-1,torch_mm,0,torch_mm_cublas
2026-03-03T06:04:56.190385+00:00,TORCH,llm_style,eval,llm_style_eval_035,4,4096,2048,bf16,NVIDIA GeForce RTX 4060,torch_cublas,-1,-1,-1,-1,-1,-1,0.0,0.0,235.52000522613525,290.1401615142821,0.2849391241120482,7,-1,-1,torch_mm,0,torch_mm_cublas
2026-03-03T06:04:56.396590+00:00,TORCH,llm_style,eval,llm_style_eval_036,64,8192,4096,bf16,NVIDIA GeForce RTX 4060,torch_cublas,-1,-1,-1,-1,-1,-1,0.0,0.0,832.5120210647583,1019.838040471077,5.159045379917594,1,-1,-1,torch_mm,0,torch_mm_cublas
2026-03-03T06:04:56.432408+00:00,TORCH,llm_style,eval,llm_style_eval_037,32,6144,1024,bf16,NVIDIA GeForce RTX 4060,torch_cublas,-1,-1,-1,-1,-1,-1,0.0,0.0,175.10400712490082,253.91135931014995,2.299508678363879,1,-1,-1,torch_mm,0,torch_mm_cublas
2026-03-03T06:04:56.510821+00:00,TORCH,llm_style,eval,llm_style_eval_038,64,6144,2048,bf16,NVIDIA GeForce RTX 4060,torch_cublas,-1,-1,-1,-1,-1,-1,0.0,0.0,299.00801181793213,306.7391958832741,5.386520335049458,1,-1,-1,torch_mm,0,torch_mm_cublas
2026-03-03T06:04:56.532450+00:00,TORCH,llm_style,eval,llm_style_eval_039,8,1024,3072,bf16,NVIDIA GeForce RTX 4060,torch_cublas,-1,-1,-1,-1,-1,-1,0.0,0.0,94.2080020904541,141.40959963202477,0.5342608577100905,7,-1,-1,torch_mm,0,torch_mm_cublas
2026-03-03T06:04:56.635542+00:00,TORCH,llm_style,eval,llm_style_eval_040,32,8192,2048,bf16,NVIDIA GeForce RTX 4060,torch_cublas,-1,-1,-1,-1,-1,-1,0.0,0.0,457.72799849510193,488.94209176301956,2.345807613976426,1,-1,-1,torch_mm,0,torch_mm_cublas
2026-03-03T06:04:56.653293+00:00,TORCH,llm_style,eval,llm_style_eval_041,32,3072,1024,bf16,NVIDIA GeForce RTX 4060,torch_cublas,-1,-1,-1,-1,-1,-1,0.0,0.0,89.08800035715103,90.11200070381165,2.2598620599058004,3,-1,-1,torch_mm,0,torch_mm_cublas
2026-03-03T06:04:56.679969+00:00,TORCH,llm_style,eval,llm_style_eval_042,64,1024,4096,bf16,NVIDIA GeForce RTX 4060,torch_cublas,-1,-1,-1,-1,-1,-1,0.0,0.0,132.04800337553024,225.9558418393134,4.065725329244072,3,-1,-1,torch_mm,0,torch_mm_cublas
2026-03-03T06:04:56.691103+00:00,TORCH,llm_style,eval,llm_style_eval_043,2,1536,1024,bf16,NVIDIA GeForce RTX 4060,torch_cublas,-1,-1,-1,-1,-1,-1,0.0,0.0,42.7360013127327,84.0294386446476,0.14721676822219523,7,-1,-1,torch_mm,0,torch_mm_cublas
2026-03-03T06:04:56.804903+00:00,TORCH,llm_style,eval,llm_style_eval_044,64,6144,3072,bf16,NVIDIA GeForce RTX 4060,torch_cublas,-1,-1,-1,-1,-1,-1,0.0,0.0,454.6560049057007,516.7820799350739,5.313729672395025,1,-1,-1,torch_mm,0,torch_mm_cublas
2026-03-03T06:04:56.866822+00:00,TORCH,llm_style,eval,llm_style_eval_045,64,1536,6144,bf16,NVIDIA GeForce RTX 4060,torch_cublas,-1,-1,-1,-1,-1,-1,0.0,0.0,236.54399812221527,301.98720484971983,5.106701339240419,3,-1,-1,torch_mm,0,torch_mm_cublas
2026-03-03T06:04:56.981547+00:00,TORCH,llm_style,eval,llm_style_eval_046,2,6144,3072,bf16,NVIDIA GeForce RTX 4060,torch_cublas,-1,-1,-1,-1,-1,-1,0.0,0.0,509.95200872421265,569.7683149576187,0.14804819023828927,5,-1,-1,torch_mm,0,torch_mm_cublas
2026-03-03T06:04:57.190838+00:00,TORCH,llm_style,eval,llm_style_eval_047,16,4096,8192,bf16,NVIDIA GeForce RTX 4060,torch_cublas,-1,-1,-1,-1,-1,-1,0.0,0.0,818.1759715080261,861.2019199132919,1.3123604962645457,6,-1,-1,torch_mm,0,torch_mm_cublas
2026-03-03T06:04:57.228718+00:00,TORCH,llm_style,eval,llm_style_eval_048,16,1024,6144,bf16,NVIDIA GeForce RTX 4060,torch_cublas,-1,-1,-1,-1,-1,-1,0.0,0.0,176.12800002098083,210.85215613245953,1.143069767305695,7,-1,-1,torch_mm,0,torch_mm_cublas
2026-03-03T06:04:57.306418+00:00,TORCH,llm_style,eval,llm_style_eval_049,16,8192,1536,bf16,NVIDIA GeForce RTX 4060,torch_cublas,-1,-1,-1,-1,-1,-1,0.0,0.0,332.8000009059906,392.5836890935898,1.209895381321653,5,-1,-1,torch_mm,0,torch_mm_cublas
2026-03-03T06:04:57.315393+00:00,TORCH,llm_style,eval,llm_style_eval_050,1,1024,1024,bf16,NVIDIA GeForce RTX 4060,torch_cublas,-1,-1,-1,-1,-1,-1,0.0,0.0,35.840000957250595,40.95999896526337,0.058514284151427634,7,-1,-1,torch_mm,0,torch_mm_cublas
2026-03-03T06:04:57.349044+00:00,TORCH,llm_style,eval,llm_style_eval_051,16,6144,1024,bf16,NVIDIA GeForce RTX 4060,torch_cublas,-1,-1,-1,-1,-1,-1,0.0,0.0,187.3759999871254,228.2393588125705,1.0744523952578406,5,-1,-1,torch_mm,0,torch_mm_cublas
2026-03-03T06:04:57.771863+00:00,TORCH,llm_style,eval,llm_style_eval_052,16,8192,8192,bf16,NVIDIA GeForce RTX 4060,torch_cublas,-1,-1,-1,-1,-1,-1,0.0,0.0,1852.4160385131836,2023.4648704528809,1.1592879803198253,4,-1,-1,torch_mm,0,torch_mm_cublas
2026-03-03T06:04:58.072864+00:00,TORCH,llm_style,eval,llm_style_eval_053,1,6144,8192,bf16,NVIDIA GeForce RTX 4060,torch_cublas,-1,-1,-1,-1,-1,-1,0.0,0.0,1186.8159770965576,1226.74462556839,0.08481794814244414,4,-1,-1,torch_mm,0,torch_mm_cublas
2026-03-03T06:04:58.162402+00:00,TORCH,llm_style,eval,llm_style_eval_054,64,4096,3072,bf16,NVIDIA GeForce RTX 4060,torch_cublas,-1,-1,-1,-1,-1,-1,0.0,0.0,457.68000185489655,501.0262489318847,3.5190804262202193,3,-1,-1,torch_mm,0,torch_mm_cublas
2026-03-03T06:04:58.199089+00:00,TORCH,llm_style,eval,llm_style_eval_055,4,8192,1024,bf16,NVIDIA GeForce RTX 4060,torch_cublas,-1,-1,-1,-1,-1,-1,0.0,0.0,163.16799819469452,173.09696644544601,0.4112869235542419,5,-1,-1,torch_mm,0,torch_mm_cublas
2026-03-03T06:04:58.214884+00:00,TORCH,llm_style,eval,llm_style_eval_056,64,1024,3072,bf16,NVIDIA GeForce RTX 4060,torch_cublas,-1,-1,-1,-1,-1,-1,0.0,0.0,56.32000043988228,61.26624085009098,7.149381762342217,3,-1,-1,torch_mm,0,torch_mm_cublas
2026-03-03T06:04:58.220137+00:00,TORCH,llm_style,eval,llm_style_eval_057,64,1024,3072,bf16,NVIDIA GeForce RTX 4060,torch_cublas,-1,-1,-1,-1,-1,-1,0.0,0.0,56.2720000743866,83.41919809579849,7.15548022938101,3,-1,-1,torch_mm,0,torch_mm_cublas
2026-03-03T06:04:58.264582+00:00,TORCH,llm_style,eval,llm_style_eval_058,32,2048,4096,bf16,NVIDIA GeForce RTX 4060,torch_cublas,-1,-1,-1,-1,-1,-1,0.0,0.0,166.9120043516159,237.0662420988083,3.216490713687859,3,-1,-1,torch_mm,0,torch_mm_cublas
2026-03-03T06:04:58.357862+00:00,TORCH,llm_style,eval,llm_style_eval_059,64,8192,2048,bf16,NVIDIA GeForce RTX 4060,torch_cublas,-1,-1,-1,-1,-1,-1,0.0,0.0,273.391991853714,304.7897544503212,7.85496178377116,1,-1,-1,torch_mm,0,torch_mm_cublas
2026-03-03T06:04:58.455814+00:00,TORCH,llm_style,eval,llm_style_eval_060,1,3072,6144,bf16,NVIDIA GeForce RTX 4060,torch_cublas,-1,-1,-1,-1,-1,-1,0.0,0.0,258.04799795150757,299.1103968024254,0.14628571544699118,7,-1,-1,torch_mm,0,torch_mm_cublas
2026-03-03T06:04:58.488559+00:00,TORCH,llm_style,eval,llm_style_eval_061,64,1536,4096,bf16,NVIDIA GeForce RTX 4060,torch_cublas,-1,-1,-1,-1,-1,-1,0.0,0.0,98.30400347709656,128.8908825814723,8.191999710241964,3,-1,-1,torch_mm,0,torch_mm_cublas
2026-03-03T06:04:58.557801+00:00,TORCH,llm_style,eval,llm_style_eval_062,16,6144,2048,bf16,NVIDIA GeForce RTX 4060,torch_cublas,-1,-1,-1,-1,-1,-1,0.0,0.0,192.51200556755066,289.12096425890894,2.091574407595649,5,-1,-1,torch_mm,0,torch_mm_cublas
2026-03-03T06:04:58.615856+00:00,TORCH,llm_style,eval,llm_style_eval_063,64,1536,6144,bf16,NVIDIA GeForce RTX 4060,torch_cublas,-1,-1,-1,-1,-1,-1,0.0,0.0,137.2160017490387,264.5087997615337,8.803343171369317,3,-1,-1,torch_mm,0,torch_mm_cublas
2026-03-03T06:04:58.680912+00:00,TORCH,llm_style,eval,llm_style_eval_064,1,6144,2048,bf16,NVIDIA GeForce RTX 4060,torch_cublas,-1,-1,-1,-1,-1,-1,0.0,0.0,113.64800110459328,139.70783457159996,0.22143657394237162,5,-1,-1,torch_mm,0,torch_mm_cublas
2026-03-03T06:04:58.734330+00:00,TORCH,llm_style,eval,llm_style_eval_065,8,1536,6144,bf16,NVIDIA GeForce RTX 4060,torch_cublas,-1,-1,-1,-1,-1,-1,0.0,0.0,128.00000607967377,142.91967988014218,1.1796479439697292,7,-1,-1,torch_mm,0,torch_mm_cublas
2026-03-03T06:04:58.763514+00:00,TORCH,llm_style,eval,llm_style_eval_066,64,1536,4096,bf16,NVIDIA GeForce RTX 4060,torch_cublas,-1,-1,-1,-1,-1,-1,0.0,0.0,105.42399808764458,279.1116887331009,7.638738642130665,3,-1,-1,torch_mm,0,torch_mm_cublas
2026-03-03T06:04:58.861157+00:00,TORCH,llm_style,eval,llm_style_eval_067,64,8192,2048,bf16,NVIDIA GeForce RTX 4060,torch_cublas,-1,-1,-1,-1,-1,-1,0.0,0.0,273.4079957008362,314.44864898920054,7.854501996166135,1,-1,-1,torch_mm,0,torch_mm_cublas
2026-03-03T06:04:58.883364+00:00,TORCH,llm_style,eval,llm_style_eval_068,64,1024,4096,bf16,NVIDIA GeForce RTX 4060,torch_cublas,-1,-1,-1,-1,-1,-1,0.0,0.0,77.56800204515457,82.94399827718735,6.921293546886408,3,-1,-1,torch_mm,0,torch_mm_cublas
2026-03-03T06:04:58.927191+00:00,TORCH,llm_style,eval,llm_style_eval_069,64,2048,4096,bf16,NVIDIA GeForce RTX 4060,torch_cublas,-1,-1,-1,-1,-1,-1,0.0,0.0,167.79199987649918,199.71071660518635,6.399243258262085,3,-1,-1,torch_mm,0,torch_mm_cublas
2026-03-03T06:04:58.970657+00:00,TORCH,llm_style,eval,llm_style_eval_070,64,8192,1024,bf16,NVIDIA GeForce RTX 4060,torch_cublas,-1,-1,-1,-1,-1,-1,0.0,0.0,140.28799533843994,405.35040587186745,7.65383967038402,1,-1,-1,torch_mm,0,torch_mm_cublas
2026-03-03T06:04:59.040188+00:00,TORCH,llm_style,eval,llm_style_eval_071,64,6144,2048,bf16,NVIDIA GeForce RTX 4060,torch_cublas,-1,-1,-1,-1,-1,-1,0.0,0.0,198.12799990177155,286.1465597152709,8.12915255187815,1,-1,-1,torch_mm,0,torch_mm_cublas
2026-03-03T06:04:59.052060+00:00,TORCH,llm_style,eval,llm_style_eval_072,64,1536,1024,bf16,NVIDIA GeForce RTX 4060,torch_cublas,-1,-1,-1,-1,-1,-1,0.0,0.0,33.695999532938,34.24895994365215,5.974792105608926,3,-1,-1,torch_mm,0,torch_mm_cublas
2026-03-03T06:04:59.078665+00:00,TORCH,llm_style,eval,llm_style_eval_073,1,4096,1536,bf16,NVIDIA GeForce RTX 4060,torch_cublas,-1,-1,-1,-1,-1,-1,0.0,0.0,106.49599879980087,135.8672003448009,0.11815384748542804,7,-1,-1,torch_mm,0,torch_mm_cublas
2026-03-03T06:04:59.089678+00:00,TORCH,llm_style,eval,llm_style_eval_074,8,1024,2048,bf16,NVIDIA GeForce RTX 4060,torch_cublas,-1,-1,-1,-1,-1,-1,0.0,0.0,39.93599861860275,47.14496105909346,0.8402051572680562,7,-1,-1,torch_mm,0,torch_mm_cublas
2026-03-03T06:04:59.115049+00:00,TORCH,llm_style,eval,llm_style_eval_075,2,6144,1024,bf16,NVIDIA GeForce RTX 4060,torch_cublas,-1,-1,-1,-1,-1,-1,0.0,0.0,101.3759970664978,110.13120003044604,0.24824243142577848,5,-1,-1,torch_mm,0,torch_mm_cublas
2026-03-03T06:04:59.144718+00:00,TORCH,llm_style,eval,llm_style_eval_076,64,1024,6144,bf16,NVIDIA GeForce RTX 4060,torch_cublas,-1,-1,-1,-1,-1,-1,0.0,0.0,107.51999914646149,196.782075613737,7.489828630885948,3,-1,-1,torch_mm,0,torch_mm_cublas
2026-03-03T06:04:59.344155+00:00,TORCH,llm_style,eval,llm_style_eval_077,1,4096,8192,bf16,NVIDIA GeForce RTX 4060,torch_cublas,-1,-1,-1,-1,-1,-1,0.0,0.0,526.7200171947479,552.2566503286362,0.1274089873352722,6,-1,-1,torch_mm,0,torch_mm_cublas
2026-03-03T06:04:59.452680+00:00,TORCH,llm_style,eval,llm_style_eval_078,64,6144,3072,bf16,NVIDIA GeForce RTX 4060,torch_cublas,-1,-1,-1,-1,-1,-1,0.0,0.0,276.41598880290985,301.59872174263,8.740156871759682,1,-1,-1,torch_mm,0,torch_mm_cublas
2026-03-03T06:04:59.518217+00:00,TORCH,llm_style,eval,llm_style_eval_079,2,3072,4096,bf16,NVIDIA GeForce RTX 4060,torch_cublas,-1,-1,-1,-1,-1,-1,0.0,0.0,167.93599724769592,227.32255458831776,0.29970732198507577,7,-1,-1,torch_mm,0,torch_mm_cublas
2026-03-03T06:04:59.530144+00:00,TORCH,llm_style,eval,llm_style_eval_080,4,1536,1024,bf16,NVIDIA GeForce RTX 4060,torch_cublas,-1,-1,-1,-1,-1,-1,0.0,0.0,41.85600019991398,448.2435138523568,0.3006238517751599,7,-1,-1,torch_mm,0,torch_mm_cublas
2026-03-03T06:04:59.661982+00:00,TORCH,llm_style,eval,llm_style_eval_081,4,4096,6144,bf16,NVIDIA GeForce RTX 4060,torch_cublas,-1,-1,-1,-1,-1,-1,0.0,0.0,361.4239990711212,480.63135027885437,0.5570371434033711,7,-1,-1,torch_mm,0,torch_mm_cublas
2026-03-03T06:04:59.699842+00:00,TORCH,llm_style,eval,llm_style_eval_082,64,6144,1024,bf16,NVIDIA GeForce RTX 4060,torch_cublas,-1,-1,-1,-1,-1,-1,0.0,0.0,98.27200323343277,219.21535879373545,8.194667265376653,1,-1,-1,torch_mm,0,torch_mm_cublas
2026-03-03T06:04:59.790341+00:00,TORCH,llm_style,eval,llm_style_eval_083,8,4096,4096,bf16,NVIDIA GeForce RTX 4060,torch_cublas,-1,-1,-1,-1,-1,-1,0.0,0.0,248.31999838352203,364.6819162368773,1.0810061926039896,7,-1,-1,torch_mm,0,torch_mm_cublas
2026-03-03T06:04:59.829745+00:00,TORCH,llm_style,eval,llm_style_eval_084,64,1024,8192,bf16,NVIDIA GeForce RTX 4060,torch_cublas,-1,-1,-1,-1,-1,-1,0.0,0.0,122.67200276255608,154.24512371420857,8.752949326818563,2,-1,-1,torch_mm,0,torch_mm_cublas
2026-03-03T06:04:59.961514+00:00,TORCH,llm_style,eval,llm_style_eval_085,1,3072,8192,bf16,NVIDIA GeForce RTX 4060,torch_cublas,-1,-1,-1,-1,-1,-1,0.0,0.0,347.135990858078,399.0015971660614,0.1449911542608598,6,-1,-1,torch_mm,0,torch_mm_cublas
2026-03-03T06:04:59.972017+00:00,TORCH,llm_style,eval,llm_style_eval_086,8,1536,1024,bf16,NVIDIA GeForce RTX 4060,torch_cublas,-1,-1,-1,-1,-1,-1,0.0,0.0,26.623999699950218,31.634240560233593,0.9452307798834243,7,-1,-1,torch_mm,0,torch_mm_cublas
2026-03-03T06:04:59.988872+00:00,TORCH,llm_style,eval,llm_style_eval_087,16,1024,3072,bf16,NVIDIA GeForce RTX 4060,torch_cublas,-1,-1,-1,-1,-1,-1,0.0,0.0,59.39200147986412,115.7120019197464,1.6948965094925827,7,-1,-1,torch_mm,0,torch_mm_cublas
2026-03-03T06:05:00.023677+00:00,TORCH,llm_style,eval,llm_style_eval_088,8,4096,1536,bf16,NVIDIA GeForce RTX 4060,torch_cublas,-1,-1,-1,-1,-1,-1,0.0,0.0,157.69599378108978,248.93920585513112,0.6383376875111909,7,-1,-1,torch_mm,0,torch_mm_cublas
2026-03-03T06:05:00.129118+00:00,TORCH,llm_style,eval,llm_style_eval_089,16,6144,3072,bf16,NVIDIA GeForce RTX 4060,torch_cublas,-1,-1,-1,-1,-1,-1,0.0,0.0,413.6959910392761,421.84095710515976,1.4599604276625886,5,-1,-1,torch_mm,0,torch_mm_cublas
2026-03-03T06:05:00.153815+00:00,TORCH,llm_style,eval,llm_style_eval_090,32,1536,3072,bf16,NVIDIA GeForce RTX 4060,torch_cublas,-1,-1,-1,-1,-1,-1,0.0,0.0,97.28000313043594,106.02303840219973,3.104336742208807,3,-1,-1,torch_mm,0,torch_mm_cublas
2026-03-03T06:05:00.176959+00:00,TORCH,llm_style,eval,llm_style_eval_091,16,1024,4096,bf16,NVIDIA GeForce RTX 4060,torch_cublas,-1,-1,-1,-1,-1,-1,0.0,0.0,98.30400347709656,194.5110374689101,1.3653332850403275,7,-1,-1,torch_mm,0,torch_mm_cublas
2026-03-03T06:05:00.312173+00:00,TORCH,llm_style,eval,llm_style_eval_092,1,4096,6144,bf16,NVIDIA GeForce RTX 4060,torch_cublas,-1,-1,-1,-1,-1,-1,0.0,0.0,459.7280025482178,480.8361652493477,0.10948136228599878,7,-1,-1,torch_mm,0,torch_mm_cublas
2026-03-03T06:05:00.347975+00:00,TORCH,llm_style,eval,llm_style_eval_093,32,2048,3072,bf16,NVIDIA GeForce RTX 4060,torch_cublas,-1,-1,-1,-1,-1,-1,0.0,0.0,186.36800348758698,206.63295909762377,2.1605274320965653,3,-1,-1,torch_mm,0,torch_mm_cublas
2026-03-03T06:05:00.364749+00:00,TORCH,llm_style,eval,llm_style_eval_094,32,1024,2048,bf16,NVIDIA GeForce RTX 4060,torch_cublas,-1,-1,-1,-1,-1,-1,0.0,0.0,75.77600330114365,132.20863990485657,1.7712431660799182,3,-1,-1,torch_mm,0,torch_mm_cublas
2026-03-03T06:05:00.440649+00:00,TORCH,llm_style,eval,llm_style_eval_095,8,6144,2048,bf16,NVIDIA GeForce RTX 4060,torch_cublas,-1,-1,-1,-1,-1,-1,0.0,0.0,287.2319966554642,358.4921583533286,0.7009197942577825,5,-1,-1,torch_mm,0,torch_mm_cublas
2026-03-03T06:05:00.481724+00:00,TORCH,llm_style,eval,llm_style_eval_096,64,2048,3072,bf16,NVIDIA GeForce RTX 4060,torch_cublas,-1,-1,-1,-1,-1,-1,0.0,0.0,191.48799777030945,234.7007974982261,4.205518765546695,3,-1,-1,torch_mm,0,torch_mm_cublas
2026-03-03T06:05:00.513467+00:00,TORCH,llm_style,eval,llm_style_eval_097,64,6144,1024,bf16,NVIDIA GeForce RTX 4060,torch_cublas,-1,-1,-1,-1,-1,-1,0.0,0.0,140.28799533843994,191.5699177980423,5.740379752788015,1,-1,-1,torch_mm,0,torch_mm_cublas
2026-03-03T06:05:00.545336+00:00,TORCH,llm_style,eval,llm_style_eval_098,32,6144,1024,bf16,NVIDIA GeForce RTX 4060,torch_cublas,-1,-1,-1,-1,-1,-1,0.0,0.0,154.06399965286255,249.0777543187139,2.613544922287227,1,-1,-1,torch_mm,0,torch_mm_cublas
2026-03-03T06:05:00.566779+00:00,TORCH,llm_style,eval,llm_style_eval_099,1,2048,2048,bf16,NVIDIA GeForce RTX 4060,torch_cublas,-1,-1,-1,-1,-1,-1,0.0,0.0,81.91999793052673,148.19167703390116,0.10240000258684165,7,-1,-1,torch_mm,0,torch_mm_cublas
2026-03-03T06:05:00.611968+00:00,TORCH,llm_style,eval,llm_style_eval_100,64,8192,1024,bf16,NVIDIA GeForce RTX 4060,torch_cublas,-1,-1,-1,-1,-1,-1,0.0,0.0,212.99199759960175,253.11231628060338,5.04123082604493,1,-1,-1,torch_mm,0,torch_mm_cublas
2026-03-03T06:05:00.685673+00:00,TORCH,llm_style,eval,llm_style_eval_101,64,8192,1536,bf16,NVIDIA GeForce RTX 4060,torch_cublas,-1,-1,-1,-1,-1,-1,0.0,0.0,305.07200956344604,310.7942369580269,5.279451032904544,1,-1,-1,torch_mm,0,torch_mm_cublas
2026-03-03T06:05:00.720162+00:00,TORCH,llm_style,eval,llm_style_eval_102,32,3072,2048,bf16,NVIDIA GeForce RTX 4060,torch_cublas,-1,-1,-1,-1,-1,-1,0.0,0.0,135.52000373601913,147.47647777199745,2.971171582789596,3,-1,-1,torch_mm,0,torch_mm_cublas
2026-03-03T06:05:00.753068+00:00,TORCH,llm_style,eval,llm_style_eval_103,64,2048,3072,bf16,NVIDIA GeForce RTX 4060,torch_cublas,-1,-1,-1,-1,-1,-1,0.0,0.0,196.60800695419312,201.7280012369156,4.095999855120982,3,-1,-1,torch_mm,0,torch_mm_cublas
2026-03-03T06:05:00.826209+00:00,TORCH,llm_style,eval,llm_style_eval_104,16,6144,2048,bf16,NVIDIA GeForce RTX 4060,torch_cublas,-1,-1,-1,-1,-1,-1,0.0,0.0,305.6640028953552,352.88062900304794,1.3173065201853333,5,-1,-1,torch_mm,0,torch_mm_cublas
2026-03-03T06:05:00.862532+00:00,TORCH,llm_style,eval,llm_style_eval_105,1,1024,8192,bf16,NVIDIA GeForce RTX 4060,torch_cublas,-1,-1,-1,-1,-1,-1,0.0,0.0,144.3839967250824,158.25919777154922,0.11619858419589975,6,-1,-1,torch_mm,0,torch_mm_cublas
2026-03-03T06:05:01.051685+00:00,TORCH,llm_style,eval,llm_style_eval_106,32,4096,8192,bf16,NVIDIA GeForce RTX 4060,torch_cublas,-1,-1,-1,-1,-1,-1,0.0,0.0,744.3679869174957,755.1522994041443,2.884975826127276,2,-1,-1,torch_mm,0,torch_mm_cublas
2026-03-03T06:05:01.118806+00:00,TORCH,llm_style,eval,llm_style_eval_107,64,6144,1536,bf16,NVIDIA GeForce RTX 4060,torch_cublas,-1,-1,-1,-1,-1,-1,0.0,0.0,216.06400609016418,225.88415816426277,5.590748657580266,1,-1,-1,torch_mm,0,torch_mm_cublas
2026-03-03T06:05:01.142247+00:00,TORCH,llm_style,eval,llm_style_eval_108,8,3072,1536,bf16,NVIDIA GeForce RTX 4060,torch_cublas,-1,-1,-1,-1,-1,-1,0.0,0.0,115.7120019197464,175.64671605825424,0.6524601661663608,7,-1,-1,torch_mm,0,torch_mm_cublas
2026-03-03T06:05:01.155642+00:00,TORCH,llm_style,eval,llm_style_eval_109,16,2048,1024,bf16,NVIDIA GeForce RTX 4060,torch_cublas,-1,-1,-1,-1,-1,-1,0.0,0.0,78.831996768713,111.10880009829988,0.8512896634711947,7,-1,-1,torch_mm,0,torch_mm_cublas
2026-03-03T06:05:01.610934+00:00,TORCH,llm_style,eval,llm_style_eval_110,1,8192,8192,bf16,NVIDIA GeForce RTX 4060,torch_cublas,-1,-1,-1,-1,-1,-1,0.0,0.0,2096.127986907959,2182.064242362976,0.06403126566617112,4,-1,-1,torch_mm,0,torch_mm_cublas
2026-03-03T06:05:01.666957+00:00,TORCH,llm_style,eval,llm_style_eval_111,8,6144,1536,bf16,NVIDIA GeForce RTX 4060,torch_cublas,-1,-1,-1,-1,-1,-1,0.0,0.0,195.0240060687065,319.6313640475273,0.7742377312606573,5,-1,-1,torch_mm,0,torch_mm_cublas
2026-03-03T06:05:01.770708+00:00,TORCH,llm_style,eval,llm_style_eval_112,2,6144,3072,bf16,NVIDIA GeForce RTX 4060,torch_cublas,-1,-1,-1,-1,-1,-1,0.0,0.0,345.08800506591797,374.66559916734695,0.21877744485954714,5,-1,-1,torch_mm,0,torch_mm_cublas
2026-03-03T06:05:02.143897+00:00,TORCH,llm_style,eval,llm_style_eval_113,1,8192,8192,bf16,NVIDIA GeForce RTX 4060,torch_cublas,-1,-1,-1,-1,-1,-1,0.0,0.0,1414.1440391540527,1537.5462651252747,0.09491093147787805,4,-1,-1,torch_mm,0,torch_mm_cublas
2026-03-03T06:05:02.167425+00:00,TORCH,llm_style,eval,llm_style_eval_114,1,3072,1024,bf16,NVIDIA GeForce RTX 4060,torch_cublas,-1,-1,-1,-1,-1,-1,0.0,0.0,52.22399905323982,169.64416101574892,0.12047059041928534,7,-1,-1,torch_mm,0,torch_mm_cublas
2026-03-03T06:05:02.192609+00:00,TORCH,llm_style,eval,llm_style_eval_115,16,3072,1536,bf16,NVIDIA GeForce RTX 4060,torch_cublas,-1,-1,-1,-1,-1,-1,0.0,0.0,100.35199671983719,200.20223692059517,1.5046531104064411,7,-1,-1,torch_mm,0,torch_mm_cublas
2026-03-03T06:05:02.209092+00:00,TORCH,llm_style,eval,llm_style_eval_116,8,3072,1024,bf16,NVIDIA GeForce RTX 4060,torch_cublas,-1,-1,-1,-1,-1,-1,0.0,0.0,45.05600035190582,64.89663835614914,1.1170909003659715,7,-1,-1,torch_mm,0,torch_mm_cublas
2026-03-03T06:05:02.229353+00:00,TORCH,llm_style,eval,llm_style_eval_117,4,1024,4096,bf16,NVIDIA GeForce RTX 4060,torch_cublas,-1,-1,-1,-1,-1,-1,0.0,0.0,61.35999970138073,162.42688253521908,0.5468453742388946,7,-1,-1,torch_mm,0,torch_mm_cublas
2026-03-03T06:05:02.331560+00:00,TORCH,llm_style,eval,llm_style_eval_118,64,6144,3072,bf16,NVIDIA GeForce RTX 4060,torch_cublas,-1,-1,-1,-1,-1,-1,0.0,0.0,273.4079957008362,327.36479789018625,8.836314745686902,1,-1,-1,torch_mm,0,torch_mm_cublas
2026-03-03T06:05:02.590917+00:00,TORCH,llm_style,eval,llm_style_eval_119,64,8192,6144,bf16,NVIDIA GeForce RTX 4060,torch_cublas,-1,-1,-1,-1,-1,-1,0.0,0.0,743.4239983558655,777.7180820703506,8.665917374537187,1,-1,-1,torch_mm,0,torch_mm_cublas
2026-03-03T06:05:02.610709+00:00,TORCH,llm_style,eval,llm_style_eval_120,8,1024,4096,bf16,NVIDIA GeForce RTX 4060,torch_cublas,-1,-1,-1,-1,-1,-1,0.0,0.0,61.43999844789505,72.16351725161073,1.0922666942596442,7,-1,-1,torch_mm,0,torch_mm_cublas
2026-03-03T06:05:02.621792+00:00,TORCH,llm_style,eval,llm_style_eval_121,4,1024,2048,bf16,NVIDIA GeForce RTX 4060,torch_cublas,-1,-1,-1,-1,-1,-1,0.0,0.0,40.752001106739044,47.04128056764603,0.41169060523080914,7,-1,-1,torch_mm,0,torch_mm_cublas
2026-03-03T06:05:02.752440+00:00,TORCH,llm_style,eval,llm_style_eval_122,4,6144,4096,bf16,NVIDIA GeForce RTX 4060,torch_cublas,-1,-1,-1,-1,-1,-1,0.0,0.0,340.9920036792755,469.93407487869246,0.5904144080438917,5,-1,-1,torch_mm,0,torch_mm_cublas
2026-03-03T06:05:02.882132+00:00,TORCH,llm_style,eval,llm_style_eval_123,4,3072,8192,bf16,NVIDIA GeForce RTX 4060,torch_cublas,-1,-1,-1,-1,-1,-1,0.0,0.0,336.89600229263306,481.3619181513782,0.597592701100456,6,-1,-1,torch_mm,0,torch_mm_cublas
2026-03-03T06:05:02.909356+00:00,TORCH,llm_style,eval,llm_style_eval_124,64,6144,1024,bf16,NVIDIA GeForce RTX 4060,torch_cublas,-1,-1,-1,-1,-1,-1,0.0,0.0,89.80799838900566,90.11200070381165,8.96697824743621,1,-1,-1,torch_mm,0,torch_mm_cublas
2026-03-03T06:05:02.979162+00:00,TORCH,llm_style,eval,llm_style_eval_125,64,1536,8192,bf16,NVIDIA GeForce RTX 4060,torch_cublas,-1,-1,-1,-1,-1,-1,0.0,0.0,168.96000504493713,233.5881561040877,9.53250880628014,2,-1,-1,torch_mm,0,torch_mm_cublas
2026-03-03T06:05:03.074132+00:00,TORCH,llm_style,eval,llm_style_eval_126,64,2048,8192,bf16,NVIDIA GeForce RTX 4060,torch_cublas,-1,-1,-1,-1,-1,-1,0.0,0.0,294.9120104312897,307.2409597039223,7.281777520215079,2,-1,-1,torch_mm,0,torch_mm_cublas
2026-03-03T06:05:03.168085+00:00,TORCH,llm_style,eval,llm_style_eval_127,2,8192,1536,bf16,NVIDIA GeForce RTX 4060,torch_cublas,-1,-1,-1,-1,-1,-1,0.0,0.0,161.23200207948685,351.5187194943426,0.3121690939196219,5,-1,-1,torch_mm,0,torch_mm_cublas
2026-03-03T06:05:03.188925+00:00,TORCH,llm_style,eval,llm_style_eval_128,8,2048,2048,bf16,NVIDIA GeForce RTX 4060,torch_cublas,-1,-1,-1,-1,-1,-1,0.0,0.0,84.87999811768532,105.019841119647,0.7906322512749611,7,-1,-1,torch_mm,0,torch_mm_cublas
2026-03-03T06:05:03.483881+00:00,TORCH,llm_style,eval,llm_style_eval_129,64,8192,6144,bf16,NVIDIA GeForce RTX 4060,torch_cublas,-1,-1,-1,-1,-1,-1,0.0,0.0,747.0080256462097,817.6908618211746,8.624339662785909,1,-1,-1,torch_mm,0,torch_mm_cublas
2026-03-03T06:05:03.505296+00:00,TORCH,llm_style,eval,llm_style_eval_130,16,3072,1536,bf16,NVIDIA GeForce RTX 4060,torch_cublas,-1,-1,-1,-1,-1,-1,0.0,0.0,67.58400052785873,77.8649602085352,2.234181800731943,7,-1,-1,torch_mm,0,torch_mm_cublas
2026-03-03T06:05:03.872993+00:00,TORCH,llm_style,eval,llm_style_eval_131,32,8192,8192,bf16,NVIDIA GeForce RTX 4060,torch_cublas,-1,-1,-1,-1,-1,-1,0.0,0.0,1239.0400171279907,1374.791657924652,3.4663668942310983,0,-1,-1,torch_mm,0,torch_mm_cublas
2026-03-03T06:05:04.055109+00:00,TORCH,llm_style,eval,llm_style_eval_132,32,8192,4096,bf16,NVIDIA GeForce RTX 4060,torch_cublas,-1,-1,-1,-1,-1,-1,0.0,0.0,505.69602847099304,556.9228559732437,4.246589902026846,1,-1,-1,torch_mm,0,torch_mm_cublas
2026-03-03T06:05:04.392072+00:00,TORCH,llm_style,eval,llm_style_eval_133,2,8192,8192,bf16,NVIDIA GeForce RTX 4060,torch_cublas,-1,-1,-1,-1,-1,-1,0.0,0.0,908.2880020141602,957.3715227842331,0.2955400218925441,4,-1,-1,torch_mm,0,torch_mm_cublas
2026-03-03T06:05:04.460374+00:00,TORCH,llm_style,eval,llm_style_eval_134,64,3072,3072,bf16,NVIDIA GeForce RTX 4060,torch_cublas,-1,-1,-1,-1,-1,-1,0.0,0.0,260.6080025434494,279.06463742256165,4.635159090322275,3,-1,-1,torch_mm,0,torch_mm_cublas
2026-03-03T06:05:04.515674+00:00,TORCH,llm_style,eval,llm_style_eval_135,8,3072,3072,bf16,NVIDIA GeForce RTX 4060,torch_cublas,-1,-1,-1,-1,-1,-1,0.0,0.0,130.8000013232231,224.39936146140096,1.1543955846519653,7,-1,-1,torch_mm,0,torch_mm_cublas
2026-03-03T06:05:04.553360+00:00,TORCH,llm_style,eval,llm_style_eval_136,4,2048,4096,bf16,NVIDIA GeForce RTX 4060,torch_cublas,-1,-1,-1,-1,-1,-1,0.0,0.0,117.76000261306763,175.41119977831835,0.5698782482240964,7,-1,-1,torch_mm,0,torch_mm_cublas
2026-03-03T06:05:04.893696+00:00,TORCH,llm_style,eval,llm_style_eval_137,4,8192,8192,bf16,NVIDIA GeForce RTX 4060,torch_cublas,-1,-1,-1,-1,-1,-1,0.0,0.0,948.608011007309,1041.9814431667326,0.5659565445055718,4,-1,-1,torch_mm,0,torch_mm_cublas
2026-03-03T06:05:04.901283+00:00,TORCH,llm_style,eval,llm_style_eval_138,16,1024,1024,bf16,NVIDIA GeForce RTX 4060,torch_cublas,-1,-1,-1,-1,-1,-1,0.0,0.0,26.623999699950218,31.74399957060814,1.2603077065112325,7,-1,-1,torch_mm,0,torch_mm_cublas
2026-03-03T06:05:04.908615+00:00,TORCH,llm_style,eval,llm_style_eval_139,4,1024,1024,bf16,NVIDIA GeForce RTX 4060,torch_cublas,-1,-1,-1,-1,-1,-1,0.0,0.0,30.719999223947525,69.49088014662266,0.27306667356491104,7,-1,-1,torch_mm,0,torch_mm_cublas
2026-03-03T06:05:05.062984+00:00,TORCH,llm_style,eval,llm_style_eval_140,64,4096,6144,bf16,NVIDIA GeForce RTX 4060,torch_cublas,-1,-1,-1,-1,-1,-1,0.0,0.0,762.8800272941589,865.1878386735916,4.2224535402051195,3,-1,-1,torch_mm,0,torch_mm_cublas
2026-03-03T06:05:05.226681+00:00,TORCH,llm_style,eval,llm_style_eval_141,4,6144,4096,bf16,NVIDIA GeForce RTX 4060,torch_cublas,-1,-1,-1,-1,-1,-1,0.0,0.0,405.5039882659912,474.9619129300117,0.49648486285155696,5,-1,-1,torch_mm,0,torch_mm_cublas
2026-03-03T06:05:05.296494+00:00,TORCH,llm_style,eval,llm_style_eval_142,4,2048,6144,bf16,NVIDIA GeForce RTX 4060,torch_cublas,-1,-1,-1,-1,-1,-1,0.0,0.0,214.01600539684296,226.34495466947556,0.4703540551247245,7,-1,-1,torch_mm,0,torch_mm_cublas
2026-03-03T06:05:05.371762+00:00,TORCH,llm_style,eval,llm_style_eval_143,64,1536,8192,bf16,NVIDIA GeForce RTX 4060,torch_cublas,-1,-1,-1,-1,-1,-1,0.0,0.0,214.01600539684296,240.68095952272415,7.525664881995592,2,-1,-1,torch_mm,0,torch_mm_cublas
2026-03-03T06:05:05.423373+00:00,TORCH,llm_style,eval,llm_style_eval_144,1,3072,3072,bf16,NVIDIA GeForce RTX 4060,torch_cublas,-1,-1,-1,-1,-1,-1,0.0,0.0,117.76000261306763,130.4070419073105,0.16027825731302714,7,-1,-1,torch_mm,0,torch_mm_cublas
2026-03-03T06:05:05.436138+00:00,TORCH,llm_style,eval,llm_style_eval_145,32,1024,2048,bf16,NVIDIA GeForce RTX 4060,torch_cublas,-1,-1,-1,-1,-1,-1,0.0,0.0,54.27199974656105,65.61791986227034,2.4730566153222444,3,-1,-1,torch_mm,0,torch_mm_cublas
2026-03-03T06:05:05.616249+00:00,TORCH,llm_style,eval,llm_style_eval_146,64,8192,4096,bf16,NVIDIA GeForce RTX 4060,torch_cublas,-1,-1,-1,-1,-1,-1,0.0,0.0,639.8560106754303,666.5791940689087,6.712396577264695,1,-1,-1,torch_mm,0,torch_mm_cublas
2026-03-03T06:05:05.658935+00:00,TORCH,llm_style,eval,llm_style_eval_147,64,2048,4096,bf16,NVIDIA GeForce RTX 4060,torch_cublas,-1,-1,-1,-1,-1,-1,0.0,0.0,217.0879989862442,243.70591640472412,4.946113230644489,3,-1,-1,torch_mm,0,torch_mm_cublas
2026-03-03T06:05:05.694774+00:00,TORCH,llm_style,eval,llm_style_eval_148,64,1024,6144,bf16,NVIDIA GeForce RTX 4060,torch_cublas,-1,-1,-1,-1,-1,-1,0.0,0.0,130.048006772995,136.2124814093113,6.192377630252348,3,-1,-1,torch_mm,0,torch_mm_cublas
2026-03-03T06:05:05.892270+00:00,TORCH,llm_style,eval,llm_style_eval_149,64,4096,8192,bf16,NVIDIA GeForce RTX 4060,torch_cublas,-1,-1,-1,-1,-1,-1,0.0,0.0,872.4480271339417,943.0528247356414,4.922891865672842,2,-1,-1,torch_mm,0,torch_mm_cublas
2026-03-03T06:05:05.926286+00:00,TORCH,llm_style,eval,llm_style_eval_150,2,2048,3072,bf16,NVIDIA GeForce RTX 4060,torch_cublas,-1,-1,-1,-1,-1,-1,0.0,0.0,174.0799993276596,218.94143581390375,0.1445647064406979,7,-1,-1,torch_mm,0,torch_mm_cublas
2026-03-03T06:05:05.975514+00:00,TORCH,llm_style,eval,llm_style_eval_151,64,4096,2048,bf16,NVIDIA GeForce RTX 4060,torch_cublas,-1,-1,-1,-1,-1,-1,0.0,0.0,311.2799972295761,467.2921532392497,3.4494404830262537,3,-1,-1,torch_mm,0,torch_mm_cublas
2026-03-03T06:05:06.338354+00:00,TORCH,llm_style,eval,llm_style_eval_152,8,8192,8192,bf16,NVIDIA GeForce RTX 4060,torch_cublas,-1,-1,-1,-1,-1,-1,0.0,0.0,1030.1439762115479,1106.5651404857635,1.0423220916641063,4,-1,-1,torch_mm,0,torch_mm_cublas
2026-03-03T06:05:06.431540+00:00,TORCH,llm_style,eval,llm_style_eval_153,64,8192,2048,bf16,NVIDIA GeForce RTX 4060,torch_cublas,-1,-1,-1,-1,-1,-1,0.0,0.0,306.14399909973145,313.38494688272476,7.0146194415537835,1,-1,-1,torch_mm,0,torch_mm_cublas
2026-03-03T06:05:06.523825+00:00,TORCH,llm_style,eval,llm_style_eval_154,16,2048,8192,bf16,NVIDIA GeForce RTX 4060,torch_cublas,-1,-1,-1,-1,-1,-1,0.0,0.0,272.38398790359497,295.01184940338135,1.9710076063282214,6,-1,-1,torch_mm,0,torch_mm_cublas
2026-03-03T06:05:06.541313+00:00,TORCH,llm_style,eval,llm_style_eval_155,4,2048,1536,bf16,NVIDIA GeForce RTX 4060,torch_cublas,-1,-1,-1,-1,-1,-1,0.0,0.0,81.7439965903759,86.39135837554932,0.3078614338629351,7,-1,-1,torch_mm,0,torch_mm_cublas
2026-03-03T06:05:06.677258+00:00,TORCH,llm_style,eval,llm_style_eval_156,1,4096,6144,bf16,NVIDIA GeForce RTX 4060,torch_cublas,-1,-1,-1,-1,-1,-1,0.0,0.0,421.79200053215027,446.46400213241577,0.11932812366403228,7,-1,-1,torch_mm,0,torch_mm_cublas
2026-03-03T06:05:06.749306+00:00,TORCH,llm_style,eval,llm_style_eval_157,1,1536,8192,bf16,NVIDIA GeForce RTX 4060,torch_cublas,-1,-1,-1,-1,-1,-1,0.0,0.0,271.36000990867615,320.219843685627,0.09273961925513394,6,-1,-1,torch_mm,0,torch_mm_cublas
2026-03-03T06:05:06.817697+00:00,TORCH,llm_style,eval,llm_style_eval_158,64,1536,8192,bf16,NVIDIA GeForce RTX 4060,torch_cublas,-1,-1,-1,-1,-1,-1,0.0,0.0,208.8959962129593,224.41184476017946,7.710117786834262,2,-1,-1,torch_mm,0,torch_mm_cublas
2026-03-03T06:05:06.875871+00:00,TORCH,llm_style,eval,llm_style_eval_159,16,6144,1536,bf16,NVIDIA GeForce RTX 4060,torch_cublas,-1,-1,-1,-1,-1,-1,0.0,0.0,171.00800573825836,241.24415546655632,1.7659400605034834,5,-1,-1,torch_mm,0,torch_mm_cublas
2026-03-03T06:05:07.086883+00:00,TORCH,llm_style,eval,llm_style_eval_160,32,6144,6144,bf16,NVIDIA GeForce RTX 4060,torch_cublas,-1,-1,-1,-1,-1,-1,0.0,0.0,702.3679912090302,770.1791989803314,3.4396771126220127,1,-1,-1,torch_mm,0,torch_mm_cublas
2026-03-03T06:05:07.120011+00:00,TORCH,llm_style,eval,llm_style_eval_161,2,1536,4096,bf16,NVIDIA GeForce RTX 4060,torch_cublas,-1,-1,-1,-1,-1,-1,0.0,0.0,105.26399686932564,113.745921254158,0.23907342252299962,7,-1,-1,torch_mm,0,torch_mm_cublas
2026-03-03T06:05:07.142997+00:00,TORCH,llm_style,eval,llm_style_eval_162,64,1536,3072,bf16,NVIDIA GeForce RTX 4060,torch_cublas,-1,-1,-1,-1,-1,-1,0.0,0.0,86.01599931716919,123.35936032235611,7.021714341455577,3,-1,-1,torch_mm,0,torch_mm_cublas
2026-03-03T06:05:07.185237+00:00,TORCH,llm_style,eval,llm_style_eval_163,64,1024,8192,bf16,NVIDIA GeForce RTX 4060,torch_cublas,-1,-1,-1,-1,-1,-1,0.0,0.0,144.3839967250824,156.8153607845306,7.436709388537584,2,-1,-1,torch_mm,0,torch_mm_cublas
2026-03-03T06:05:07.400679+00:00,TORCH,llm_style,eval,llm_style_eval_164,64,4096,8192,bf16,NVIDIA GeForce RTX 4060,torch_cublas,-1,-1,-1,-1,-1,-1,0.0,0.0,761.8560194969177,830.5609637498853,5.63750523207276,2,-1,-1,torch_mm,0,torch_mm_cublas
2026-03-03T06:05:07.540639+00:00,TORCH,llm_style,eval,llm_style_eval_165,4,8192,3072,bf16,NVIDIA GeForce RTX 4060,torch_cublas,-1,-1,-1,-1,-1,-1,0.0,0.0,425.9839951992035,466.70847028493876,0.47261538994171215,5,-1,-1,torch_mm,0,torch_mm_cublas
2026-03-03T06:05:07.575104+00:00,TORCH,llm_style,eval,llm_style_eval_166,64,1024,6144,bf16,NVIDIA GeForce RTX 4060,torch_cublas,-1,-1,-1,-1,-1,-1,0.0,0.0,119.1520020365715,279.94432389736164,6.758647393543804,3,-1,-1,torch_mm,0,torch_mm_cublas
2026-03-03T06:05:07.589543+00:00,TORCH,llm_style,eval,llm_style_eval_167,2,2048,1024,bf16,NVIDIA GeForce RTX 4060,torch_cublas,-1,-1,-1,-1,-1,-1,0.0,0.0,58.320000767707825,320.34687854349534,0.14383758384044515,7,-1,-1,torch_mm,0,torch_mm_cublas
2026-03-03T06:05:07.612343+00:00,TORCH,llm_style,eval,llm_style_eval_168,64,4096,1024,bf16,NVIDIA GeForce RTX 4060,torch_cublas,-1,-1,-1,-1,-1,-1,0.0,0.0,114.68800157308578,137.2364743053913,4.681142792935274,3,-1,-1,torch_mm,0,torch_mm_cublas
2026-03-03T06:05:07.663244+00:00,TORCH,llm_style,eval,llm_style_eval_169,4,1536,6144,bf16,NVIDIA GeForce RTX 4060,torch_cublas,-1,-1,-1,-1,-1,-1,0.0,0.0,153.60000729560852,157.11264044046402,0.49151997665405384,7,-1,-1,torch_mm,0,torch_mm_cublas
2026-03-03T06:05:07.674877+00:00,TORCH,llm_style,eval,llm_style_eval_170,16,1536,1536,bf16,NVIDIA GeForce RTX 4060,torch_cublas,-1,-1,-1,-1,-1,-1,0.0,0.0,41.98399931192398,82.626561820507,1.7982439319104546,7,-1,-1,torch_mm,0,torch_mm_cublas
2026-03-03T06:05:07.706244+00:00,TORCH,llm_style,eval,llm_style_eval_171,1,2048,3072,bf16,NVIDIA GeForce RTX 4060,torch_cublas,-1,-1,-1,-1,-1,-1,0.0,0.0,151.5360027551651,195.1001542806625,0.08303579196509532,7,-1,-1,torch_mm,0,torch_mm_cublas
2026-03-03T06:05:07.748141+00:00,TORCH,llm_style,eval,llm_style_eval_172,64,3072,2048,bf16,NVIDIA GeForce RTX 4060,torch_cublas,-1,-1,-1,-1,-1,-1,0.0,0.0,235.34400016069412,286.2742528319358,3.4218266344165675,3,-1,-1,torch_mm,0,torch_mm_cublas
2026-03-03T06:05:08.028461+00:00,TORCH,llm_style,eval,llm_style_eval_173,64,8192,6144,bf16,NVIDIA GeForce RTX 4060,torch_cublas,-1,-1,-1,-1,-1,-1,0.0,0.0,1070.080041885376,1103.3545231819153,6.0205318217588975,1,-1,-1,torch_mm,0,torch_mm_cublas
2026-03-03T06:05:08.126542+00:00,TORCH,llm_style,eval,llm_style_eval_174,2,4096,4096,bf16,NVIDIA GeForce RTX 4060,torch_cublas,-1,-1,-1,-1,-1,-1,0.0,0.0,335.6480002403259,375.42655587196344,0.19993822085026478,7,-1,-1,torch_mm,0,torch_mm_cublas
2026-03-03T06:05:08.177179+00:00,TORCH,llm_style,eval,llm_style_eval_175,64,4096,2048,bf16,NVIDIA GeForce RTX 4060,torch_cublas,-1,-1,-1,-1,-1,-1,0.0,0.0,338.7040048837662,388.2371196150779,3.17014800096172,3,-1,-1,torch_mm,0,torch_mm_cublas
2026-03-03T06:05:08.249379+00:00,TORCH,llm_style,eval,llm_style_eval_176,16,6144,2048,bf16,NVIDIA GeForce RTX 4060,torch_cublas,-1,-1,-1,-1,-1,-1,0.0,0.0,272.38398790359497,386.2099194526669,1.4782557047461662,5,-1,-1,torch_mm,0,torch_mm_cublas
2026-03-03T06:05:08.297271+00:00,TORCH,llm_style,eval,llm_style_eval_177,1,6144,1536,bf16,NVIDIA GeForce RTX 4060,torch_cublas,-1,-1,-1,-1,-1,-1,0.0,0.0,117.76000261306763,203.79648163914658,0.16027825731302714,5,-1,-1,torch_mm,0,torch_mm_cublas
2026-03-03T06:05:08.568766+00:00,TORCH,llm_style,eval,llm_style_eval_178,32,6144,8192,bf16,NVIDIA GeForce RTX 4060,torch_cublas,-1,-1,-1,-1,-1,-1,0.0,0.0,921.999990940094,944.5891410112381,3.4937369887775795,0,-1,-1,torch_mm,0,torch_mm_cublas
2026-03-03T06:05:08.733798+00:00,TORCH,llm_style,eval,llm_style_eval_179,64,4096,6144,bf16,NVIDIA GeForce RTX 4060,torch_cublas,-1,-1,-1,-1,-1,-1,0.0,0.0,926.5120029449463,958.986240029335,3.4767228721929535,3,-1,-1,torch_mm,0,torch_mm_cublas
2026-03-03T06:05:08.767148+00:00,TORCH,llm_style,eval,llm_style_eval_180,64,2048,1536,bf16,NVIDIA GeForce RTX 4060,torch_cublas,-1,-1,-1,-1,-1,-1,0.0,0.0,105.20000010728836,267.76575684547385,3.827501745145947,3,-1,-1,torch_mm,0,torch_mm_cublas
2026-03-03T06:05:08.803692+00:00,TORCH,llm_style,eval,llm_style_eval_181,64,2048,3072,bf16,NVIDIA GeForce RTX 4060,torch_cublas,-1,-1,-1,-1,-1,-1,0.0,0.0,182.27200210094452,277.71904066205013,4.418157252445229,3,-1,-1,torch_mm,0,torch_mm_cublas
2026-03-03T06:05:08.829514+00:00,TORCH,llm_style,eval,llm_style_eval_182,32,3072,1536,bf16,NVIDIA GeForce RTX 4060,torch_cublas,-1,-1,-1,-1,-1,-1,0.0,0.0,97.28000313043594,112.15872071683407,3.104336742208807,3,-1,-1,torch_mm,0,torch_mm_cublas
2026-03-03T06:05:08.925768+00:00,TORCH,llm_style,eval,llm_style_eval_183,8,8192,2048,bf16,NVIDIA GeForce RTX 4060,torch_cublas,-1,-1,-1,-1,-1,-1,0.0,0.0,336.2879902124405,447.97950714826555,0.798230872980101,5,-1,-1,torch_mm,0,torch_mm_cublas
2026-03-03T06:05:08.969271+00:00,TORCH,llm_style,eval,llm_style_eval_184,64,8192,1024,bf16,NVIDIA GeForce RTX 4060,torch_cublas,-1,-1,-1,-1,-1,-1,0.0,0.0,200.70399343967438,282.93343365192385,5.349877725889568,1,-1,-1,torch_mm,0,torch_mm_cublas
2026-03-03T06:05:09.039741+00:00,TORCH,llm_style,eval,llm_style_eval_185,1,8192,1536,bf16,NVIDIA GeForce RTX 4060,torch_cublas,-1,-1,-1,-1,-1,-1,0.0,0.0,189.43999707698822,202.27071776986122,0.13284324529298128,5,-1,-1,torch_mm,0,torch_mm_cublas
2026-03-03T06:05:09.069904+00:00,TORCH,llm_style,eval,llm_style_eval_186,16,6144,1024,bf16,NVIDIA GeForce RTX 4060,torch_cublas,-1,-1,-1,-1,-1,-1,0.0,0.0,140.28799533843994,219.6377557516096,1.4350949381970037,5,-1,-1,torch_mm,0,torch_mm_cublas
2026-03-03T06:05:09.097739+00:00,TORCH,llm_style,eval,llm_style_eval_187,1,1024,6144,bf16,NVIDIA GeForce RTX 4060,torch_cublas,-1,-1,-1,-1,-1,-1,0.0,0.0,102.83199697732925,186.2246431410311,0.12236378140914717,7,-1,-1,torch_mm,0,torch_mm_cublas
2026-03-03T06:05:09.281477+00:00,TORCH,llm_style,eval,llm_style_eval_188,8,8192,4096,bf16,NVIDIA GeForce RTX 4060,torch_cublas,-1,-1,-1,-1,-1,-1,0.0,0.0,650.2400040626526,658.9055800437927,0.8256503885421833,5,-1,-1,torch_mm,0,torch_mm_cublas
2026-03-03T06:05:09.381491+00:00,TORCH,llm_style,eval,llm_style_eval_189,8,2048,8192,bf16,NVIDIA GeForce RTX 4060,torch_cublas,-1,-1,-1,-1,-1,-1,0.0,0.0,321.53600454330444,332.2982370853424,0.8348534913882316,6,-1,-1,torch_mm,0,torch_mm_cublas
2026-03-03T06:05:09.476064+00:00,TORCH,llm_style,eval,llm_style_eval_190,4,8192,2048,bf16,NVIDIA GeForce RTX 4060,torch_cublas,-1,-1,-1,-1,-1,-1,0.0,0.0,330.7519853115082,399.8003172874449,0.40579568365581037,5,-1,-1,torch_mm,0,torch_mm_cublas
2026-03-03T06:05:09.861145+00:00,TORCH,llm_style,eval,llm_style_eval_191,4,8192,8192,bf16,NVIDIA GeForce RTX 4060,torch_cublas,-1,-1,-1,-1,-1,-1,0.0,0.0,1101.8240451812744,1134.1721522808075,0.487256485595822,4,-1,-1,torch_mm,0,torch_mm_cublas
2026-03-03T06:05:09.879477+00:00,TORCH,llm_style,eval,llm_style_eval_192,64,1536,1024,bf16,NVIDIA GeForce RTX 4060,torch_cublas,-1,-1,-1,-1,-1,-1,0.0,0.0,40.64000025391579,193.4956762194631,4.9539023312531,3,-1,-1,torch_mm,0,torch_mm_cublas
2026-03-03T06:05:09.905085+00:00,TORCH,llm_style,eval,llm_style_eval_193,32,2048,2048,bf16,NVIDIA GeForce RTX 4060,torch_cublas,-1,-1,-1,-1,-1,-1,0.0,0.0,110.33599823713303,111.61600053310394,2.432890990147034,3,-1,-1,torch_mm,0,torch_mm_cublas
2026-03-03T06:05:09.919571+00:00,TORCH,llm_style,eval,llm_style_eval_194,8,1024,2048,bf16,NVIDIA GeForce RTX 4060,torch_cublas,-1,-1,-1,-1,-1,-1,0.0,0.0,55.64800091087818,145.60256063938127,0.6029764133618808,7,-1,-1,torch_mm,0,torch_mm_cublas
2026-03-03T06:05:09.964557+00:00,TORCH,llm_style,eval,llm_style_eval_195,2,4096,2048,bf16,NVIDIA GeForce RTX 4060,torch_cublas,-1,-1,-1,-1,-1,-1,0.0,0.0,205.82400262355804,267.26688012480724,0.1630248735438762,7,-1,-1,torch_mm,0,torch_mm_cublas
2026-03-03T06:05:10.006466+00:00,TORCH,llm_style,eval,llm_style_eval_196,32,2048,4096,bf16,NVIDIA GeForce RTX 4060,torch_cublas,-1,-1,-1,-1,-1,-1,0.0,0.0,200.6239965558052,253.91327932476997,2.6760054690200783,3,-1,-1,torch_mm,0,torch_mm_cublas
2026-03-03T06:05:10.080327+00:00,TORCH,llm_style,eval,llm_style_eval_197,32,8192,1536,bf16,NVIDIA GeForce RTX 4060,torch_cublas,-1,-1,-1,-1,-1,-1,0.0,0.0,235.52000522613525,289.97248083353037,3.4192694893445785,1,-1,-1,torch_mm,0,torch_mm_cublas
2026-03-03T06:05:10.274586+00:00,TORCH,llm_style,eval,llm_style_eval_198,64,4096,8192,bf16,NVIDIA GeForce RTX 4060,torch_cublas,-1,-1,-1,-1,-1,-1,0.0,0.0,766.6719853878021,790.0467157363892,5.602092391347125,2,-1,-1,torch_mm,0,torch_mm_cublas
2026-03-03T06:05:10.454672+00:00,TORCH,llm_style,eval,llm_style_eval_199,2,8192,4096,bf16,NVIDIA GeForce RTX 4060,torch_cublas,-1,-1,-1,-1,-1,-1,0.0,0.0,534.0160131454468,685.2095967531203,0.25133652305561843,5,-1,-1,torch_mm,0,torch_mm_cublas
2026-03-03T06:05:10.476815+00:00,TORCH,llm_style,eval,llm_style_eval_200,1,4096,1024,bf16,NVIDIA GeForce RTX 4060,torch_cublas,-1,-1,-1,-1,-1,-1,0.0,0.0,84.99199897050858,567.7078539878112,0.09869879637624206,7,-1,-1,torch_mm,0,torch_mm_cublas
2026-03-03T06:05:10.547901+00:00,TORCH,llm_style,eval,llm_style_eval_201,4,1536,8192,bf16,NVIDIA GeForce RTX 4060,torch_cublas,-1,-1,-1,-1,-1,-1,0.0,0.0,200.56000351905823,292.75135099887837,0.5019111200326364,6,-1,-1,torch_mm,0,torch_mm_cublas
2026-03-03T06:05:10.644800+00:00,TORCH,llm_style,eval,llm_style_eval_202,1,6144,3072,bf16,NVIDIA GeForce RTX 4060,torch_cublas,-1,-1,-1,-1,-1,-1,0.0,0.0,259.42400097846985,359.14751112461084,0.1455098057913803,5,-1,-1,torch_mm,0,torch_mm_cublas
2026-03-03T06:05:10.719105+00:00,TORCH,llm_style,eval,llm_style_eval_203,16,2048,6144,bf16,NVIDIA GeForce RTX 4060,torch_cublas,-1,-1,-1,-1,-1,-1,0.0,0.0,208.8959962129593,369.26464885473206,1.9275294467085655,7,-1,-1,torch_mm,0,torch_mm_cublas
2026-03-03T06:05:10.731080+00:00,TORCH,llm_style,eval,llm_style_eval_204,16,1536,1024,bf16,NVIDIA GeForce RTX 4060,torch_cublas,-1,-1,-1,-1,-1,-1,0.0,0.0,48.73599857091904,189.6140806376933,1.0327406737497957,7,-1,-1,torch_mm,0,torch_mm_cublas
2026-03-03T06:05:10.803684+00:00,TORCH,llm_style,eval,llm_style_eval_205,64,6144,2048,bf16,NVIDIA GeForce RTX 4060,torch_cublas,-1,-1,-1,-1,-1,-1,0.0,0.0,206.7839950323105,306.948798894882,7.788865553875859,1,-1,-1,torch_mm,0,torch_mm_cublas
2026-03-03T06:05:10.874385+00:00,TORCH,llm_style,eval,llm_style_eval_206,4,2048,6144,bf16,NVIDIA GeForce RTX 4060,torch_cublas,-1,-1,-1,-1,-1,-1,0.0,0.0,204.79999482631683,216.0844786465168,0.4915200124168399,7,-1,-1,torch_mm,0,torch_mm_cublas
2026-03-03T06:05:10.929946+00:00,TORCH,llm_style,eval,llm_style_eval_207,32,6144,1536,bf16,NVIDIA GeForce RTX 4060,torch_cublas,-1,-1,-1,-1,-1,-1,0.0,0.0,176.12800002098083,249.43615868687627,3.429209301917085,1,-1,-1,torch_mm,0,torch_mm_cublas
2026-03-03T06:05:10.944927+00:00,TORCH,llm_style,eval,llm_style_eval_208,4,2048,1024,bf16,NVIDIA GeForce RTX 4060,torch_cublas,-1,-1,-1,-1,-1,-1,0.0,0.0,62.463998794555664,274.1145589947696,0.2685901691177398,7,-1,-1,torch_mm,0,torch_mm_cublas
2026-03-03T06:05:10.953500+00:00,TORCH,llm_style,eval,llm_style_eval_209,1,1024,1536,bf16,NVIDIA GeForce RTX 4060,torch_cublas,-1,-1,-1,-1,-1,-1,0.0,0.0,30.719999223947525,35.840000957250595,0.10240000258684166,7,-1,-1,torch_mm,0,torch_mm_cublas
2026-03-03T06:05:11.085905+00:00,TORCH,llm_style,eval,llm_style_eval_210,8,6144,4096,bf16,NVIDIA GeForce RTX 4060,torch_cublas,-1,-1,-1,-1,-1,-1,0.0,0.0,392.192006111145,426.18881016969675,1.0266736132451673,5,-1,-1,torch_mm,0,torch_mm_cublas
2026-03-03T06:05:11.175798+00:00,TORCH,llm_style,eval,llm_style_eval_211,4,2048,8192,bf16,NVIDIA GeForce RTX 4060,torch_cublas,-1,-1,-1,-1,-1,-1,0.0,0.0,262.59200274944305,336.6399985551834,0.5111264874584406,6,-1,-1,torch_mm,0,torch_mm_cublas
2026-03-03T06:05:11.185078+00:00,TORCH,llm_style,eval,llm_style_eval_212,32,1024,1024,bf16,NVIDIA GeForce RTX 4060,torch_cublas,-1,-1,-1,-1,-1,-1,0.0,0.0,51.19999870657921,114.46015864610669,1.310720033111573,3,-1,-1,torch_mm,0,torch_mm_cublas
2026-03-03T06:05:11.255228+00:00,TORCH,llm_style,eval,llm_style_eval_213,16,3072,4096,bf16,NVIDIA GeForce RTX 4060,torch_cublas,-1,-1,-1,-1,-1,-1,0.0,0.0,198.65599274635315,209.4182401895523,2.0268866719470853,7,-1,-1,torch_mm,0,torch_mm_cublas
2026-03-03T06:05:11.294869+00:00,TORCH,llm_style,eval,llm_style_eval_214,64,1024,8192,bf16,NVIDIA GeForce RTX 4060,torch_cublas,-1,-1,-1,-1,-1,-1,0.0,0.0,148.47999811172485,230.64831867814047,7.231558712656065,2,-1,-1,torch_mm,0,torch_mm_cublas
2026-03-03T06:05:11.326887+00:00,TORCH,llm_style,eval,llm_style_eval_215,4,4096,1536,bf16,NVIDIA GeForce RTX 4060,torch_cublas,-1,-1,-1,-1,-1,-1,0.0,0.0,134.5279961824417,198.0767951905725,0.3741351200365918,7,-1,-1,torch_mm,0,torch_mm_cublas
2026-03-03T06:05:11.348606+00:00,TORCH,llm_style,eval,llm_style_eval_216,16,1536,3072,bf16,NVIDIA GeForce RTX 4060,torch_cublas,-1,-1,-1,-1,-1,-1,0.0,0.0,76.62400230765343,125.96032090485095,1.970595889702282,7,-1,-1,torch_mm,0,torch_mm_cublas
2026-03-03T06:05:11.420356+00:00,TORCH,llm_style,eval,llm_style_eval_217,8,6144,2048,bf16,NVIDIA GeForce RTX 4060,torch_cublas,-1,-1,-1,-1,-1,-1,0.0,0.0,228.30399870872498,247.77600169181824,0.8818355926251501,5,-1,-1,torch_mm,0,torch_mm_cublas
2026-03-03T06:05:11.494609+00:00,TORCH,llm_style,eval,llm_style_eval_218,8,3072,4096,bf16,NVIDIA GeForce RTX 4060,torch_cublas,-1,-1,-1,-1,-1,-1,0.0,0.0,201.58400386571884,251.2281553447246,0.9987230541075556,7,-1,-1,torch_mm,0,torch_mm_cublas
2026-03-03T06:05:11.641167+00:00,TORCH,llm_style,eval,llm_style_eval_219,64,8192,3072,bf16,NVIDIA GeForce RTX 4060,torch_cublas,-1,-1,-1,-1,-1,-1,0.0,0.0,446.46400213241577,529.8895993828771,7.214972442603836,1,-1,-1,torch_mm,0,torch_mm_cublas
2026-03-03T06:05:11.682081+00:00,TORCH,llm_style,eval,llm_style_eval_220,2,4096,2048,bf16,NVIDIA GeForce RTX 4060,torch_cublas,-1,-1,-1,-1,-1,-1,0.0,0.0,173.98399859666824,280.2121613919734,0.19285929896223547,7,-1,-1,torch_mm,0,torch_mm_cublas
2026-03-03T06:05:11.721656+00:00,TORCH,llm_style,eval,llm_style_eval_221,4,1024,8192,bf16,NVIDIA GeForce RTX 4060,torch_cublas,-1,-1,-1,-1,-1,-1,0.0,0.0,144.3839967250824,156.794880926609,0.464794336783599,6,-1,-1,torch_mm,0,torch_mm_cublas
2026-03-03T06:05:11.793091+00:00,TORCH,llm_style,eval,llm_style_eval_222,64,6144,2048,bf16,NVIDIA GeForce RTX 4060,torch_cublas,-1,-1,-1,-1,-1,-1,0.0,0.0,206.7199945449829,220.68223655223846,7.791276985785357,1,-1,-1,torch_mm,0,torch_mm_cublas
2026-03-03T06:05:11.815842+00:00,TORCH,llm_style,eval,llm_style_eval_223,4,2048,2048,bf16,NVIDIA GeForce RTX 4060,torch_cublas,-1,-1,-1,-1,-1,-1,0.0,0.0,126.97599828243256,144.66464012861246,0.2642580680906711,7,-1,-1,torch_mm,0,torch_mm_cublas
2026-03-03T06:05:11.839701+00:00,TORCH,llm_style,eval,llm_style_eval_224,16,3072,1536,bf16,NVIDIA GeForce RTX 4060,torch_cublas,-1,-1,-1,-1,-1,-1,0.0,0.0,95.23200243711472,100.80896019935608,1.5855483465204636,7,-1,-1,torch_mm,0,torch_mm_cublas
2026-03-03T06:05:11.859389+00:00,TORCH,llm_style,eval,llm_style_eval_225,1,2048,2048,bf16,NVIDIA GeForce RTX 4060,torch_cublas,-1,-1,-1,-1,-1,-1,0.0,0.0,75.77600330114365,76.80000364780426,0.11070269787999489,7,-1,-1,torch_mm,0,torch_mm_cublas
2026-03-03T06:05:11.868904+00:00,TORCH,llm_style,eval,llm_style_eval_226,8,1536,1024,bf16,NVIDIA GeForce RTX 4060,torch_cublas,-1,-1,-1,-1,-1,-1,0.0,0.0,38.91199827194214,142.62432198971476,0.6467368708264476,7,-1,-1,torch_mm,0,torch_mm_cublas
2026-03-03T06:05:12.089104+00:00,TORCH,llm_style,eval,llm_style_eval_227,64,6144,6144,bf16,NVIDIA GeForce RTX 4060,torch_cublas,-1,-1,-1,-1,-1,-1,0.0,0.0,734.0640127658844,751.2166368961334,6.582311792937631,1,-1,-1,torch_mm,0,torch_mm_cublas
2026-03-03T06:05:12.159780+00:00,TORCH,llm_style,eval,llm_style_eval_228,64,6144,2048,bf16,NVIDIA GeForce RTX 4060,torch_cublas,-1,-1,-1,-1,-1,-1,0.0,0.0,253.9519965648651,272.025599181652,6.342193634176106,1,-1,-1,torch_mm,0,torch_mm_cublas
2026-03-03T06:05:12.237060+00:00,TORCH,llm_style,eval,llm_style_eval_229,16,1536,8192,bf16,NVIDIA GeForce RTX 4060,torch_cublas,-1,-1,-1,-1,-1,-1,0.0,0.0,247.55199998617172,300.3801646828651,1.6265398139481495,6,-1,-1,torch_mm,0,torch_mm_cublas
2026-03-03T06:05:12.256252+00:00,TORCH,llm_style,eval,llm_style_eval_230,64,2048,1536,bf16,NVIDIA GeForce RTX 4060,torch_cublas,-1,-1,-1,-1,-1,-1,0.0,0.0,100.35199671983719,130.51904313266266,4.012408294417177,3,-1,-1,torch_mm,0,torch_mm_cublas
2026-03-03T06:05:12.295954+00:00,TORCH,llm_style,eval,llm_style_eval_231,4,1024,8192,bf16,NVIDIA GeForce RTX 4060,torch_cublas,-1,-1,-1,-1,-1,-1,0.0,0.0,172.7679967880249,201.69727742671955,0.38843342081657756,6,-1,-1,torch_mm,0,torch_mm_cublas
2026-03-03T06:05:12.318302+00:00,TORCH,llm_style,eval,llm_style_eval_232,16,3072,1536,bf16,NVIDIA GeForce RTX 4060,torch_cublas,-1,-1,-1,-1,-1,-1,0.0,0.0,100.35199671983719,110.53247898817061,1.5046531104064411,7,-1,-1,torch_mm,0,torch_mm_cublas
2026-03-03T06:05:12.387433+00:00,TORCH,llm_style,eval,llm_style_eval_233,64,3072,3072,bf16,NVIDIA GeForce RTX 4060,torch_cublas,-1,-1,-1,-1,-1,-1,0.0,0.0,373.63201379776,384.0000033378601,3.233019407844013,3,-1,-1,torch_mm,0,torch_mm_cublas
2026-03-03T06:05:12.586013+00:00,TORCH,llm_style,eval,llm_style_eval_234,32,8192,4096,bf16,NVIDIA GeForce RTX 4060,torch_cublas,-1,-1,-1,-1,-1,-1,0.0,0.0,741.2960231304169,771.1539202928543,2.8969312946417785,1,-1,-1,torch_mm,0,torch_mm_cublas
2026-03-03T06:05:12.605173+00:00,TORCH,llm_style,eval,llm_style_eval_235,4,2048,1024,bf16,NVIDIA GeForce RTX 4060,torch_cublas,-1,-1,-1,-1,-1,-1,0.0,0.0,78.84799689054489,138.73152211308468,0.21277922917039696,7,-1,-1,torch_mm,0,torch_mm_cublas
2026-03-03T06:05:12.747541+00:00,TORCH,llm_style,eval,llm_style_eval_236,4,8192,3072,bf16,NVIDIA GeForce RTX 4060,torch_cublas,-1,-1,-1,-1,-1,-1,0.0,0.0,536.575973033905,621.4758306741714,0.37520612572654016,5,-1,-1,torch_mm,0,torch_mm_cublas
2026-03-03T06:05:12.784969+00:00,TORCH,llm_style,eval,llm_style_eval_237,64,1024,4096,bf16,NVIDIA GeForce RTX 4060,torch_cublas,-1,-1,-1,-1,-1,-1,0.0,0.0,110.35199835896492,121.35424003005028,4.865076482381482,3,-1,-1,torch_mm,0,torch_mm_cublas
2026-03-03T06:05:12.862839+00:00,TORCH,llm_style,eval,llm_style_eval_238,32,2048,6144,bf16,NVIDIA GeForce RTX 4060,torch_cublas,-1,-1,-1,-1,-1,-1,0.0,0.0,279.55201268196106,304.6502351760864,2.880703166019326,3,-1,-1,torch_mm,0,torch_mm_cublas
2026-03-03T06:05:12.881644+00:00,TORCH,llm_style,eval,llm_style_eval_239,32,2048,6144,bf16,NVIDIA GeForce RTX 4060,torch_cublas,-1,-1,-1,-1,-1,-1,0.0,0.0,279.55201268196106,305.1519989967346,2.880703166019326,3,-1,-1,torch_mm,0,torch_mm_cublas
2026-03-03T06:05:12.957344+00:00,TORCH,llm_style,eval,llm_style_eval_240,8,8192,1536,bf16,NVIDIA GeForce RTX 4060,torch_cublas,-1,-1,-1,-1,-1,-1,0.0,0.0,276.44799649715424,327.564158141613,0.7282620765966464,5,-1,-1,torch_mm,0,torch_mm_cublas
2026-03-03T06:05:12.972427+00:00,TORCH,llm_style,eval,llm_style_eval_241,16,1536,1536,bf16,NVIDIA GeForce RTX 4060,torch_cublas,-1,-1,-1,-1,-1,-1,0.0,0.0,55.296000093221664,71.2419187650084,1.365333331031564,7,-1,-1,torch_mm,0,torch_mm_cublas
2026-03-03T06:05:13.006576+00:00,TORCH,llm_style,eval,llm_style_eval_242,1,2048,3072,bf16,NVIDIA GeForce RTX 4060,torch_cublas,-1,-1,-1,-1,-1,-1,0.0,0.0,199.5680034160614,224.2764814198017,0.06305074853992008,7,-1,-1,torch_mm,0,torch_mm_cublas
2026-03-03T06:05:13.067643+00:00,TORCH,llm_style,eval,llm_style_eval_243,8,1536,6144,bf16,NVIDIA GeForce RTX 4060,torch_cublas,-1,-1,-1,-1,-1,-1,0.0,0.0,219.13599967956543,304.6217656135557,0.6890467299795304,7,-1,-1,torch_mm,0,torch_mm_cublas
2026-03-03T06:05:13.115179+00:00,TORCH,llm_style,eval,llm_style_eval_244,32,8192,1024,bf16,NVIDIA GeForce RTX 4060,torch_cublas,-1,-1,-1,-1,-1,-1,0.0,0.0,223.23200106620789,244.92032080888742,2.404990814201279,1,-1,-1,torch_mm,0,torch_mm_cublas
2026-03-03T06:05:13.257044+00:00,TORCH,llm_style,eval,llm_style_eval_245,4,6144,4096,bf16,NVIDIA GeForce RTX 4060,torch_cublas,-1,-1,-1,-1,-1,-1,0.0,0.0,548.6880242824554,618.2707130908964,0.3669236124905114,5,-1,-1,torch_mm,0,torch_mm_cublas
2026-03-03T06:05:13.340025+00:00,TORCH,llm_style,eval,llm_style_eval_246,32,2048,6144,bf16,NVIDIA GeForce RTX 4060,torch_cublas,-1,-1,-1,-1,-1,-1,0.0,0.0,295.9359884262085,323.5839903354645,2.721218099503984,3,-1,-1,torch_mm,0,torch_mm_cublas
2026-03-03T06:05:13.421882+00:00,TORCH,llm_style,eval,llm_style_eval_247,64,6144,2048,bf16,NVIDIA GeForce RTX 4060,torch_cublas,-1,-1,-1,-1,-1,-1,0.0,0.0,299.00801181793213,312.88319766521454,5.386520335049458,1,-1,-1,torch_mm,0,torch_mm_cublas
2026-03-03T06:05:13.431808+00:00,TORCH,llm_style,eval,llm_style_eval_248,64,1024,1024,bf16,NVIDIA GeForce RTX 4060,torch_cublas,-1,-1,-1,-1,-1,-1,0.0,0.0,63.48799914121628,131.09055742621416,2.1140645447253688,3,-1,-1,torch_mm,0,torch_mm_cublas
2026-03-03T06:05:13.472231+00:00,TORCH,llm_style,eval,llm_style_eval_249,2,8192,1024,bf16,NVIDIA GeForce RTX 4060,torch_cublas,-1,-1,-1,-1,-1,-1,0.0,0.0,205.23200184106827,245.64735725522033,0.16349512599884186,5,-1,-1,torch_mm,0,torch_mm_cublas
2026-03-03T06:05:13.543212+00:00,TORCH,llm_style,eval,llm_style_eval_250,64,3072,3072,bf16,NVIDIA GeForce RTX 4060,torch_cublas,-1,-1,-1,-1,-1,-1,0.0,0.0,442.3680007457733,485.140491425991,2.730666662063128,3,-1,-1,torch_mm,0,torch_mm_cublas
2026-03-03T06:05:13.586076+00:00,TORCH,llm_style,eval,llm_style_eval_251,64,1024,8192,bf16,NVIDIA GeForce RTX 4060,torch_cublas,-1,-1,-1,-1,-1,-1,0.0,0.0,213.8879969716072,253.61408010125157,5.020112578559212,2,-1,-1,torch_mm,0,torch_mm_cublas
2026-03-03T06:05:13.681622+00:00,TORCH,llm_style,eval,llm_style_eval_252,64,4096,3072,bf16,NVIDIA GeForce RTX 4060,torch_cublas,-1,-1,-1,-1,-1,-1,0.0,0.0,582.5760066509247,597.0124959945679,2.764639665232673,3,-1,-1,torch_mm,0,torch_mm_cublas
2026-03-03T06:05:13.831957+00:00,TORCH,llm_style,eval,llm_style_eval_253,8,6144,4096,bf16,NVIDIA GeForce RTX 4060,torch_cublas,-1,-1,-1,-1,-1,-1,0.0,0.0,587.7760052680969,697.8870218992231,0.6850452900273489,5,-1,-1,torch_mm,0,torch_mm_cublas
2026-03-03T06:05:13.858502+00:00,TORCH,llm_style,eval,llm_style_eval_254,4,1536,3072,bf16,NVIDIA GeForce RTX 4060,torch_cublas,-1,-1,-1,-1,-1,-1,0.0,0.0,105.47199845314026,111.11424036324024,0.35790291787038847,7,-1,-1,torch_mm,0,torch_mm_cublas
2026-03-03T06:05:13.880085+00:00,TORCH,llm_style,eval,llm_style_eval_255,1,3072,1536,bf16,NVIDIA GeForce RTX 4060,torch_cublas,-1,-1,-1,-1,-1,-1,0.0,0.0,73.56800138950348,106.00447468459596,0.12827837948233942,7,-1,-1,torch_mm,0,torch_mm_cublas
