results/llm_hp_m16_n4096_k6144.csv
timestamp,method,workload,split,shape_id,M,N,K,dtype,gpu,config_id,BLOCK_M,BLOCK_N,BLOCK_K,num_warps,num_stages,GROUP_M,compile_time_ms,tune_time_ms,runtime_cost_us,p99_us,runtime_perf_tflops,bucket_m,bucket_n,bucket_k,cache_key,invalid_config,notes
2026-03-03T03:25:03.070506+00:00,FULL,llm_style,tune,llm_style_tune_000,64,6144,6144,bf16,NVIDIA GeForce RTX 4060,c06,64,128,32,4,3,8,2.301734988577664,1900.218,333.8240087032318,390.5740854144095,14.474208211595363,1,-1,-1,64x6144x6144,0,
2026-03-03T03:25:03.253810+00:00,FULL,llm_style,tune,llm_style_tune_001,64,8192,1536,bf16,NVIDIA GeForce RTX 4060,c06,64,128,32,4,3,8,0.0,183.266,89.90399911999702,99.68960277736187,17.914806368627456,1,-1,-1,64x8192x1536,0,
2026-03-03T03:25:03.561474+00:00,FULL,llm_style,tune,llm_style_tune_002,32,3072,8192,bf16,NVIDIA GeForce RTX 4060,c04,64,64,64,4,3,8,0.0,307.62,228.36799919605255,238.57632234692574,7.052707654618889,2,-1,-1,32x3072x8192,0,
2026-03-03T03:25:03.835642+00:00,FULL,llm_style,tune,llm_style_tune_003,4,6144,3072,bf16,NVIDIA GeForce RTX 4060,c11,32,128,32,4,2,8,0.0,274.13,175.9520024061203,223.23200106620789,0.8581598500452633,5,-1,-1,4x6144x3072,0,
2026-03-03T03:25:03.948696+00:00,FULL,llm_style,tune,llm_style_tune_004,8,8192,1024,bf16,NVIDIA GeForce RTX 4060,c11,32,128,32,4,2,8,0.0,113.02,50.08000135421753,64.37087904661891,2.680066381202219,5,-1,-1,8x8192x1024,0,
2026-03-03T03:25:04.271770+00:00,FULL,llm_style,tune,llm_style_tune_005,32,8192,3072,bf16,NVIDIA GeForce RTX 4060,c11,32,128,32,4,2,8,0.0,323.029,228.35199534893036,296.2739196419714,7.05320193738147,1,-1,-1,32x8192x3072,0,
2026-03-03T03:25:04.589930+00:00,FULL,llm_style,tune,llm_style_tune_006,16,4096,6144,bf16,NVIDIA GeForce RTX 4060,c03,64,64,32,4,2,8,0.0,318.12,227.7120053768158,318.39326828718174,3.536512564049428,7,-1,-1,16x4096x6144,0,
2026-03-03T03:25:04.665032+00:00,FULL,llm_style,tune,llm_style_tune_007,8,1536,2048,bf16,NVIDIA GeForce RTX 4060,c00,32,32,32,2,2,8,0.0,75.062,40.95999896526337,101.67296249419434,1.2288000310421,7,-1,-1,8x1536x2048,0,
2026-03-03T03:25:04.764510+00:00,FULL,llm_style,tune,llm_style_tune_008,16,1536,4096,bf16,NVIDIA GeForce RTX 4060,c00,32,32,32,2,2,8,0.0,99.434,55.296000093221664,195.65567523241032,3.6408888827508368,7,-1,-1,16x1536x4096,0,
2026-03-03T03:25:04.829809+00:00,FULL,llm_style,tune,llm_style_tune_009,64,1536,2048,bf16,NVIDIA GeForce RTX 4060,c04,64,64,64,4,3,8,0.0,65.255,41.98399931192398,58.07104095816608,9.590634303522425,3,-1,-1,64x1536x2048,0,
2026-03-03T03:25:04.898972+00:00,FULL,llm_style,tune,llm_style_tune_010,2,2048,1024,bf16,NVIDIA GeForce RTX 4060,c11,32,128,32,4,2,8,0.0,69.123,41.69600084424019,138.28544139862058,0.2011849537162216,7,-1,-1,2x2048x1024,0,
2026-03-03T03:25:05.198459+00:00,FULL,llm_style,tune,llm_style_tune_011,2,3072,8192,bf16,NVIDIA GeForce RTX 4060,c10,64,128,64,8,3,8,0.0,299.449,228.35199534893036,244.83840078115463,0.44082512108634186,6,-1,-1,2x3072x8192,0,
2026-03-03T03:25:05.275222+00:00,FULL,llm_style,tune,llm_style_tune_012,64,2048,1536,bf16,NVIDIA GeForce RTX 4060,c00,32,32,32,2,2,8,0.0,76.721,46.68799974024296,105.92736460268486,8.624340006859,3,-1,-1,64x2048x1536,0,
2026-03-03T03:25:05.665578+00:00,FULL,llm_style,tune,llm_style_tune_013,16,8192,4096,bf16,NVIDIA GeForce RTX 4060,c11,32,128,32,4,2,8,0.0,390.313,291.7279899120331,394.2748707532879,3.680626683520403,5,-1,-1,16x8192x4096,0,
2026-03-03T03:25:06.095599+00:00,FULL,llm_style,tune,llm_style_tune_014,4,8192,4096,bf16,NVIDIA GeForce RTX 4060,c11,32,128,32,4,2,8,0.0,429.98,294.639989733696,337.4796861410141,0.9110625351386266,5,-1,-1,4x8192x4096,0,
2026-03-03T03:25:06.204645+00:00,FULL,llm_style,tune,llm_style_tune_015,4,3072,2048,bf16,NVIDIA GeForce RTX 4060,c00,32,32,32,2,2,8,0.0,109.004,23.552000522613525,632.0873731374724,2.137043430840362,7,-1,-1,4x3072x2048,0,
2026-03-03T03:25:06.263537+00:00,FULL,llm_style,tune,llm_style_tune_016,16,1536,1024,bf16,NVIDIA GeForce RTX 4060,c04,64,64,64,4,3,8,0.0,58.848,34.7680002450943,51.8208002671599,1.4476428798087606,7,-1,-1,16x1536x1024,0,
2026-03-03T03:25:06.337164+00:00,FULL,llm_style,tune,llm_style_tune_017,32,1024,2048,bf16,NVIDIA GeForce RTX 4060,c04,64,64,64,4,3,8,0.0,73.591,41.98399931192398,56.934718377888174,3.1968781011741414,3,-1,-1,32x1024x2048,0,
2026-03-03T03:25:06.355042+00:00,FULL,llm_style,tune,llm_style_tune_018,64,1536,2048,bf16,NVIDIA GeForce RTX 4060,c04,64,64,64,4,3,8,0.0,0.0,55.296000093221664,94.76575821638096,7.2817777655016735,3,-1,-1,64x1536x2048,0,
2026-03-03T03:25:06.438830+00:00,FULL,llm_style,tune,llm_style_tune_019,4,4096,1536,bf16,NVIDIA GeForce RTX 4060,c00,32,32,32,2,2,8,0.0,83.743,44.815998524427414,54.29247975349426,1.1230732251244213,7,-1,-1,4x4096x1536,0,
2026-03-03T03:25:06.606736+00:00,FULL,llm_style,tune,llm_style_tune_020,1,8192,1536,bf16,NVIDIA GeForce RTX 4060,c11,32,128,32,4,2,8,0.0,167.865,63.53599950671196,69.55456048250198,0.3960876384315238,5,-1,-1,1x8192x1536,0,
2026-03-03T03:25:06.717737+00:00,FULL,llm_style,tune,llm_style_tune_021,64,1536,4096,bf16,NVIDIA GeForce RTX 4060,c04,64,64,64,4,3,8,0.0,110.968,58.36800113320351,66.50207959115505,13.797052363711826,3,-1,-1,64x1536x4096,0,
2026-03-03T03:25:06.841995+00:00,FULL,llm_style,tune,llm_style_tune_022,64,1024,6144,bf16,NVIDIA GeForce RTX 4060,c04,64,64,64,4,3,8,0.0,124.216,71.68000191450119,99.6761601418256,11.234742557074105,3,-1,-1,64x1024x6144,0,
2026-03-03T03:25:06.918644+00:00,FULL,llm_style,tune,llm_style_tune_023,8,4096,1024,bf16,NVIDIA GeForce RTX 4060,c11,32,128,32,4,2,8,0.0,76.607,39.93599861860275,116.00095711648444,1.6804103145361124,7,-1,-1,8x4096x1024,0,
2026-03-03T03:25:07.128046+00:00,FULL,llm_style,tune,llm_style_tune_024,8,4096,4096,bf16,NVIDIA GeForce RTX 4060,c11,32,128,32,4,2,8,0.0,209.365,160.76800227165222,205.29312103986737,1.6697069827764632,7,-1,-1,8x4096x4096,0,
2026-03-03T03:25:07.215237+00:00,FULL,llm_style,tune,llm_style_tune_025,32,6144,1024,bf16,NVIDIA GeForce RTX 4060,c00,32,32,32,2,2,8,0.0,87.15,34.32000055909157,142.9606398940086,11.732318689992994,1,-1,-1,32x6144x1024,0,
2026-03-03T03:25:07.280569+00:00,FULL,llm_style,tune,llm_style_tune_026,1,3072,1536,bf16,NVIDIA GeForce RTX 4060,c11,32,128,32,4,2,8,0.0,65.293,44.03200000524521,113.88927750289436,0.2143255813698178,7,-1,-1,1x3072x1536,0,
2026-03-03T03:25:07.376065+00:00,FULL,llm_style,tune,llm_style_tune_027,1,6144,1536,bf16,NVIDIA GeForce RTX 4060,c02,32,64,32,2,2,8,0.0,95.454,46.08000069856644,116.72032214701176,0.4095999937905207,5,-1,-1,1x6144x1536,0,
2026-03-03T03:25:07.411564+00:00,FULL,llm_style,tune,llm_style_tune_028,4,4096,1536,bf16,NVIDIA GeForce RTX 4060,c00,32,32,32,2,2,8,0.0,0.0,54.27199974656105,113.15840058028697,0.9273962307458418,7,-1,-1,4x4096x1536,0,
2026-03-03T03:25:07.528457+00:00,FULL,llm_style,tune,llm_style_tune_029,16,1024,6144,bf16,NVIDIA GeForce RTX 4060,c04,64,64,64,4,3,8,0.0,116.833,73.72800260782242,186.58528685569757,2.730666570080655,7,-1,-1,16x1024x6144,0,
2026-03-03T03:25:07.917343+00:00,FULL,llm_style,tune,llm_style_tune_030,64,4096,8192,bf16,NVIDIA GeForce RTX 4060,c00,32,32,32,2,2,8,0.0,388.844,284.63999927043915,345.5920085310935,15.089120668242103,2,-1,-1,64x4096x8192,0,
2026-03-03T03:25:08.001652+00:00,FULL,llm_style,tune,llm_style_tune_031,1,6144,1024,bf16,NVIDIA GeForce RTX 4060,c11,32,128,32,4,2,8,0.0,84.256,41.00799933075905,48.189439512789235,0.30684042638875775,5,-1,-1,1x6144x1024,0,
2026-03-03T03:25:08.579118+00:00,FULL,llm_style,tune,llm_style_tune_032,32,6144,8192,bf16,NVIDIA GeForce RTX 4060,c11,32,128,32,4,2,8,0.0,577.425,428.0320107936859,443.4534338116646,7.525664881995592,0,-1,-1,32x6144x8192,0,
2026-03-03T03:25:08.975124+00:00,FULL,llm_style,tune,llm_style_tune_033,2,4096,8192,bf16,NVIDIA GeForce RTX 4060,c00,32,32,32,2,2,8,0.0,395.964,287.6160144805908,373.42271447181673,0.4666559622640812,6,-1,-1,2x4096x8192,0,
2026-03-03T03:25:09.522040+00:00,FULL,llm_style,tune,llm_style_tune_034,1,8192,6144,bf16,NVIDIA GeForce RTX 4060,c11,32,128,32,4,2,8,0.0,546.874,424.9119907617569,536.8012902140615,0.2369038723043255,5,-1,-1,1x8192x6144,0,
2026-03-03T03:25:09.590432+00:00,FULL,llm_style,tune,llm_style_tune_035,64,1536,1024,bf16,NVIDIA GeForce RTX 4060,c04,64,64,64,4,3,8,0.0,68.348,37.71200031042099,204.14080306887604,5.338528594155936,3,-1,-1,64x1536x1024,0,
2026-03-03T03:25:09.668088+00:00,FULL,llm_style,tune,llm_style_tune_036,32,3072,2048,bf16,NVIDIA GeForce RTX 4060,c02,32,64,32,2,2,8,0.0,77.62,51.19999870657921,137.93056279420853,7.864320198669438,3,-1,-1,32x3072x2048,0,
2026-03-03T03:25:09.791590+00:00,FULL,llm_style,tune,llm_style_tune_037,4,1536,6144,bf16,NVIDIA GeForce RTX 4060,c04,64,64,64,4,3,8,0.0,123.462,71.68000191450119,132.75296106934547,1.0532571147256975,7,-1,-1,4x1536x6144,0,
2026-03-03T03:25:09.890306+00:00,FULL,llm_style,tune,llm_style_tune_038,1,4096,1536,bf16,NVIDIA GeForce RTX 4060,c00,32,32,32,2,2,8,0.0,98.674,46.08000069856644,89.17343981564042,0.2730666625270138,7,-1,-1,1x4096x1536,0,
2026-03-03T03:25:09.983873+00:00,FULL,llm_style,tune,llm_style_tune_039,4,1536,4096,bf16,NVIDIA GeForce RTX 4060,c04,64,64,64,4,3,8,0.0,93.526,58.36800113320351,67.45759941637516,0.8623157727319891,7,-1,-1,4x1536x4096,0,
2026-03-03T03:25:10.131669+00:00,FULL,llm_style,tune,llm_style_tune_040,16,3072,4096,bf16,NVIDIA GeForce RTX 4060,c00,32,32,32,2,2,8,0.0,147.75,67.58400052785873,225.10591000318502,5.957818135285181,7,-1,-1,16x3072x4096,0,
2026-03-03T03:25:10.194317+00:00,FULL,llm_style,tune,llm_style_tune_041,16,1024,1536,bf16,NVIDIA GeForce RTX 4060,c04,64,64,64,4,3,8,0.0,62.609,40.25599919259548,98.30399937927703,1.2502893732484421,7,-1,-1,16x1024x1536,0,
2026-03-03T03:25:10.225138+00:00,FULL,llm_style,tune,llm_style_tune_042,32,3072,2048,bf16,NVIDIA GeForce RTX 4060,c02,32,64,32,2,2,8,0.0,0.0,77.85599678754807,232.51008063554752,5.17176840081763,3,-1,-1,32x3072x2048,0,
2026-03-03T03:25:10.340506+00:00,FULL,llm_style,tune,llm_style_tune_043,2,2048,4096,bf16,NVIDIA GeForce RTX 4060,c00,32,32,32,2,2,8,0.0,115.32,56.68799951672554,201.05440035462362,0.5919142020543504,7,-1,-1,2x2048x4096,0,
2026-03-03T03:25:10.583480+00:00,FULL,llm_style,tune,llm_style_tune_044,64,2048,8192,bf16,NVIDIA GeForce RTX 4060,c10,64,128,64,8,3,8,0.0,242.932,165.8399999141693,203.39712545275688,12.94912957737236,2,-1,-1,64x2048x8192,0,
2026-03-03T03:25:10.704700+00:00,FULL,llm_style,tune,llm_style_tune_045,2,3072,8192,bf16,NVIDIA GeForce RTX 4060,c10,64,128,64,8,3,8,0.0,0.0,229.19999808073044,287.6655960083008,0.43919413980336797,6,-1,-1,2x3072x8192,0,
2026-03-03T03:25:11.262879+00:00,FULL,llm_style,tune,llm_style_tune_046,4,8192,6144,bf16,NVIDIA GeForce RTX 4060,c11,32,128,32,4,2,8,0.0,558.123,425.9839951992035,556.8355000019073,0.9452307798834243,5,-1,-1,4x8192x6144,0,
2026-03-03T03:25:11.388162+00:00,FULL,llm_style,tune,llm_style_tune_047,1,1024,6144,bf16,NVIDIA GeForce RTX 4060,c04,64,64,64,4,3,8,0.0,125.244,72.4480003118515,154.85152341425402,0.17368197805097468,7,-1,-1,1x1024x6144,0,
2026-03-03T03:25:11.545889+00:00,FULL,llm_style,tune,llm_style_tune_048,32,4096,3072,bf16,NVIDIA GeForce RTX 4060,c00,32,32,32,2,2,8,0.0,157.687,82.89599791169167,175.75327843427652,9.714659190880186,3,-1,-1,32x4096x3072,0,
2026-03-03T03:25:11.603907+00:00,FULL,llm_style,tune,llm_style_tune_049,16,2048,1024,bf16,NVIDIA GeForce RTX 4060,c00,32,32,32,2,2,8,0.0,57.977,34.86400097608566,394.0585657954215,1.92487557713276,7,-1,-1,16x2048x1024,0,
2026-03-03T03:25:11.660132+00:00,FULL,llm_style,tune,llm_style_tune_050,4,1024,1536,bf16,NVIDIA GeForce RTX 4060,c00,32,32,32,2,2,8,0.0,56.188,36.86400130391121,73.03232103586187,0.34133332126008187,7,-1,-1,4x1024x1536,0,
2026-03-03T03:25:12.203220+00:00,FULL,llm_style,tune,llm_style_tune_051,2,6144,8192,bf16,NVIDIA GeForce RTX 4060,c10,64,128,64,8,3,8,0.0,543.052,425.4719913005829,538.3331155776978,0.4731841251984293,4,-1,-1,2x6144x8192,0,
2026-03-03T03:25:12.278846+00:00,FULL,llm_style,tune,llm_style_tune_052,16,2048,1536,bf16,NVIDIA GeForce RTX 4060,c01,64,32,32,2,2,8,0.0,75.585,44.87999901175499,136.66303761303416,2.2429433648970054,7,-1,-1,16x2048x1536,0,
2026-03-03T03:25:12.341511+00:00,FULL,llm_style,tune,llm_style_tune_053,64,1024,1024,bf16,NVIDIA GeForce RTX 4060,c04,64,64,64,4,3,8,0.0,62.62,37.88800165057182,78.5075172036886,3.5424863321598363,3,-1,-1,64x1024x1024,0,
2026-03-03T03:25:12.746698+00:00,FULL,llm_style,tune,llm_style_tune_054,4,4096,8192,bf16,NVIDIA GeForce RTX 4060,c11,32,128,32,4,2,8,0.0,405.145,293.3119982481003,311.8047961592674,0.9151874372794724,6,-1,-1,4x4096x8192,0,
2026-03-03T03:25:12.897953+00:00,FULL,llm_style,tune,llm_style_tune_055,1,4096,3072,bf16,NVIDIA GeForce RTX 4060,c00,32,32,32,2,2,8,0.0,151.215,71.16800174117088,187.25760236382484,0.3536115021400341,7,-1,-1,1x4096x3072,0,
2026-03-03T03:25:12.924322+00:00,FULL,llm_style,tune,llm_style_tune_056,64,1536,2048,bf16,NVIDIA GeForce RTX 4060,c04,64,64,64,4,3,8,0.0,0.0,54.208001121878624,266.0339224338528,7.427929008020315,3,-1,-1,64x1536x2048,0,
2026-03-03T03:25:13.028460+00:00,FULL,llm_style,tune,llm_style_tune_057,2,4096,2048,bf16,NVIDIA GeForce RTX 4060,c00,32,32,32,2,2,8,0.0,104.089,40.720000863075256,123.20768065750593,0.8240282733006284,7,-1,-1,2x4096x2048,0,
2026-03-03T03:25:13.168932+00:00,FULL,llm_style,tune,llm_style_tune_058,4,8192,1536,bf16,NVIDIA GeForce RTX 4060,c11,32,128,32,4,2,8,0.0,140.43,66.28799811005592,91.97952024638644,1.5185749889877778,5,-1,-1,4x8192x1536,0,
2026-03-03T03:25:13.258898+00:00,FULL,llm_style,tune,llm_style_tune_059,1,1536,4096,bf16,NVIDIA GeForce RTX 4060,c00,32,32,32,2,2,8,0.0,89.922,54.76799979805946,84.20288212597364,0.22974934352898965,7,-1,-1,1x1536x4096,0,
2026-03-03T03:25:13.284281+00:00,FULL,llm_style,tune,llm_style_tune_060,64,1536,4096,bf16,NVIDIA GeForce RTX 4060,c04,64,64,64,4,3,8,0.0,0.0,65.98399952054024,111.63648054003716,12.204570408759706,3,-1,-1,64x1536x4096,0,
2026-03-03T03:25:13.857157+00:00,FULL,llm_style,tune,llm_style_tune_061,8,8192,6144,bf16,NVIDIA GeForce RTX 4060,c11,32,128,32,4,2,8,0.0,572.823,425.9839951992035,498.2505548000335,1.8904615597668486,5,-1,-1,8x8192x6144,0,
2026-03-03T03:25:13.975290+00:00,FULL,llm_style,tune,llm_style_tune_062,64,6144,1536,bf16,NVIDIA GeForce RTX 4060,c06,64,128,32,4,3,8,0.0,118.094,64.35199826955795,72.22272209823132,18.77112730734628,1,-1,-1,64x6144x1536,0,
2026-03-03T03:25:14.038418+00:00,FULL,llm_style,tune,llm_style_tune_063,2,1536,1024,bf16,NVIDIA GeForce RTX 4060,c00,32,32,32,2,2,8,0.0,63.09,15.15199989080429,155.97568050026888,0.4152228118624967,7,-1,-1,2x1536x1024,0,
2026-03-03T03:25:14.093327+00:00,FULL,llm_style,eval,llm_style_eval_000,32,1536,1024,bf16,NVIDIA GeForce RTX 4060,c04,64,64,64,4,3,8,0.0,54.871,37.856001406908035,59.56671986728904,2.6591106365932977,3,-1,-1,32x1536x1024,0,
2026-03-03T03:25:14.323840+00:00,FULL,llm_style,eval,llm_style_eval_001,32,2048,8192,bf16,NVIDIA GeForce RTX 4060,c04,64,64,64,4,3,8,0.0,230.474,165.24799913167953,218.28160360455502,6.497759910208522,2,-1,-1,32x2048x8192,0,
2026-03-03T03:25:14.478279+00:00,FULL,llm_style,eval,llm_style_eval_002,16,2048,4096,bf16,NVIDIA GeForce RTX 4060,c00,32,32,32,2,2,8,0.0,154.395,66.8959990143776,197.8470434248446,4.0127281146112574,7,-1,-1,16x2048x4096,0,
2026-03-03T03:25:14.494822+00:00,FULL,llm_style,eval,llm_style_eval_003,16,2048,1536,bf16,NVIDIA GeForce RTX 4060,c01,64,32,32,2,2,8,0.0,0.0,51.711998879909515,182.8636823594568,1.9466139035501182,7,-1,-1,16x2048x1536,0,
2026-03-03T03:25:14.715741+00:00,FULL,llm_style,eval,llm_style_eval_004,64,8192,2048,bf16,NVIDIA GeForce RTX 4060,c00,32,32,32,2,2,8,0.0,220.867,164.97600078582764,294.87327069044113,13.016945724050311,1,-1,-1,64x8192x2048,0,
2026-03-03T03:25:15.014353+00:00,FULL,llm_style,eval,llm_style_eval_005,64,3072,8192,bf16,NVIDIA GeForce RTX 4060,c10,64,128,64,8,3,8,0.0,298.57,231.53600096702576,338.68799120187737,13.91241732839098,2,-1,-1,64x3072x8192,0,
2026-03-03T03:25:15.091361+00:00,FULL,llm_style,eval,llm_style_eval_006,32,2048,2048,bf16,NVIDIA GeForce RTX 4060,c00,32,32,32,2,2,8,0.0,76.968,41.77600145339966,555.8476673811656,6.425589971779245,3,-1,-1,32x2048x2048,0,
2026-03-03T03:25:15.300849+00:00,FULL,llm_style,eval,llm_style_eval_007,8,8192,2048,bf16,NVIDIA GeForce RTX 4060,c11,32,128,32,4,2,8,0.0,209.446,160.5760008096695,186.7804753780365,1.6717034590877384,5,-1,-1,8x8192x2048,0,
2026-03-03T03:25:15.495022+00:00,FULL,llm_style,eval,llm_style_eval_008,64,1536,8192,bf16,NVIDIA GeForce RTX 4060,c04,64,64,64,4,3,8,0.0,194.127,109.56799983978271,146.98496110737312,14.69966357289665,2,-1,-1,64x1536x8192,0,
2026-03-03T03:25:15.806591+00:00,FULL,llm_style,eval,llm_style_eval_009,64,4096,6144,bf16,NVIDIA GeForce RTX 4060,c11,32,128,32,4,2,8,0.0,311.526,232.41599649190903,345.8937540650367,13.859740812255746,3,-1,-1,64x4096x6144,0,
2026-03-03T03:25:15.937852+00:00,FULL,llm_style,eval,llm_style_eval_010,64,2048,4096,bf16,NVIDIA GeForce RTX 4060,c03,64,64,32,4,2,8,0.0,131.221,77.82399654388428,82.34847724437714,13.797053244297551,3,-1,-1,64x2048x4096,0,
2026-03-03T03:25:16.172744+00:00,FULL,llm_style,eval,llm_style_eval_011,32,3072,6144,bf16,NVIDIA GeForce RTX 4060,c10,64,128,64,8,3,8,0.0,234.851,178.99200320243835,187.38591969013214,6.748678881669414,3,-1,-1,32x3072x6144,0,
2026-03-03T03:25:16.237619+00:00,FULL,llm_style,eval,llm_style_eval_012,16,1536,1536,bf16,NVIDIA GeForce RTX 4060,c04,64,64,64,4,3,8,0.0,64.836,38.91199827194214,56.59839931875464,1.940210612479343,7,-1,-1,16x1536x1536,0,
2026-03-03T03:25:16.333858+00:00,FULL,llm_style,eval,llm_style_eval_013,64,2048,3072,bf16,NVIDIA GeForce RTX 4060,c11,32,128,32,4,2,8,0.0,96.199,64.51199948787689,73.76896262168884,12.483047718143245,3,-1,-1,64x2048x3072,0,
2026-03-03T03:25:16.921085+00:00,FULL,llm_style,eval,llm_style_eval_014,16,8192,6144,bf16,NVIDIA GeForce RTX 4060,c11,32,128,32,4,2,8,0.0,587.184,427.0080029964447,448.09343934059143,3.771856088639655,5,-1,-1,16x8192x6144,0,
2026-03-03T03:25:16.966262+00:00,FULL,llm_style,eval,llm_style_eval_015,64,6144,1536,bf16,NVIDIA GeForce RTX 4060,c06,64,128,32,4,3,8,0.0,0.0,66.97599962353706,81.8303969502449,18.03570769812732,1,-1,-1,64x6144x1536,0,
2026-03-03T03:25:17.184750+00:00,FULL,llm_style,eval,llm_style_eval_016,16,4096,4096,bf16,NVIDIA GeForce RTX 4060,c11,32,128,32,4,2,8,0.0,218.433,161.77599877119064,195.12575402855867,3.3186066912146113,7,-1,-1,16x4096x4096,0,
2026-03-03T03:25:17.584151+00:00,FULL,llm_style,eval,llm_style_eval_017,64,8192,4096,bf16,NVIDIA GeForce RTX 4060,c10,64,128,64,8,3,8,0.0,399.359,301.40799283981323,386.07487976551045,14.249679497658875,1,-1,-1,64x8192x4096,0,
2026-03-03T03:25:17.890713+00:00,FULL,llm_style,eval,llm_style_eval_018,32,4096,6144,bf16,NVIDIA GeForce RTX 4060,c11,32,128,32,4,2,8,0.0,306.524,228.35199534893036,287.66239628195746,7.05320193738147,3,-1,-1,32x4096x6144,0,
2026-03-03T03:25:18.185217+00:00,FULL,llm_style,eval,llm_style_eval_019,16,3072,8192,bf16,NVIDIA GeForce RTX 4060,c06,64,128,32,4,3,8,0.0,294.462,227.02400386333466,372.4390351772306,3.5472300474657446,6,-1,-1,16x3072x8192,0,
2026-03-03T03:25:18.257467+00:00,FULL,llm_style,eval,llm_style_eval_020,4,1536,1536,bf16,NVIDIA GeForce RTX 4060,c04,64,64,64,4,3,8,0.0,72.21,44.03200000524521,117.13759809732429,0.4286511627396356,7,-1,-1,4x1536x1536,0,
2026-03-03T03:25:18.364031+00:00,FULL,llm_style,eval,llm_style_eval_021,4,6144,1536,bf16,NVIDIA GeForce RTX 4060,c11,32,128,32,4,2,8,0.0,106.521,47.10400104522705,52.33631990849972,1.6027825731302712,5,-1,-1,4x6144x1536,0,
2026-03-03T03:25:18.390478+00:00,FULL,llm_style,eval,llm_style_eval_022,32,6144,1024,bf16,NVIDIA GeForce RTX 4060,c00,32,32,32,2,2,8,0.0,0.0,54.17599901556969,95.98112337291228,7.4323167328078465,1,-1,-1,32x6144x1024,0,
2026-03-03T03:25:18.401013+00:00,FULL,llm_style,eval,llm_style_eval_023,16,1024,1536,bf16,NVIDIA GeForce RTX 4060,c04,64,64,64,4,3,8,0.0,0.0,42.38400049507618,112.84479714930055,1.1875152749171733,7,-1,-1,16x1024x1536,0,
2026-03-03T03:25:18.496742+00:00,FULL,llm_style,eval,llm_style_eval_024,32,8192,1024,bf16,NVIDIA GeForce RTX 4060,c02,32,64,32,2,2,8,0.0,95.689,49.15200173854828,62.62784067541357,10.92266628032262,1,-1,-1,32x8192x1024,0,
2026-03-03T03:25:18.959529+00:00,FULL,llm_style,eval,llm_style_eval_025,32,6144,6144,bf16,NVIDIA GeForce RTX 4060,c11,32,128,32,4,2,8,0.0,462.743,326.6560137271881,355.80095648765564,7.395911914904138,1,-1,-1,32x6144x6144,0,
2026-03-03T03:25:19.100918+00:00,FULL,llm_style,eval,llm_style_eval_026,1,6144,2048,bf16,NVIDIA GeForce RTX 4060,c11,32,128,32,4,2,8,0.0,141.348,68.60800087451935,75.61920210719109,0.3668059654737216,5,-1,-1,1x6144x2048,0,
2026-03-03T03:25:19.161306+00:00,FULL,llm_style,eval,llm_style_eval_027,32,4096,3072,bf16,NVIDIA GeForce RTX 4060,c00,32,32,32,2,2,8,0.0,0.0,83.82399752736092,194.1840009391304,9.607110037160192,3,-1,-1,32x4096x3072,0,
2026-03-03T03:25:19.220935+00:00,FULL,llm_style,eval,llm_style_eval_028,64,1536,1536,bf16,NVIDIA GeForce RTX 4060,c04,64,64,64,4,3,8,0.0,59.577,37.88800165057182,43.95359940826893,7.970594247359632,3,-1,-1,64x1536x1536,0,
2026-03-03T03:25:19.275492+00:00,FULL,llm_style,eval,llm_style_eval_029,2,3072,1024,bf16,NVIDIA GeForce RTX 4060,c02,32,64,32,2,2,8,0.0,54.516,38.91199827194214,47.95552007853985,0.3233684354132238,7,-1,-1,2x3072x1024,0,
2026-03-03T03:25:19.452969+00:00,FULL,llm_style,eval,llm_style_eval_030,32,1536,8192,bf16,NVIDIA GeForce RTX 4060,c04,64,64,64,4,3,8,0.0,177.438,96.25600278377533,103.94623793661594,8.366297630382595,2,-1,-1,32x1536x8192,0,
2026-03-03T03:25:19.537475+00:00,FULL,llm_style,eval,llm_style_eval_031,8,3072,2048,bf16,NVIDIA GeForce RTX 4060,c11,32,128,32,4,2,8,0.0,84.462,51.2159988284111,58.333440423011766,1.9654658369009286,7,-1,-1,8x3072x2048,0,
2026-03-03T03:25:19.625361+00:00,FULL,llm_style,eval,llm_style_eval_032,8,2048,3072,bf16,NVIDIA GeForce RTX 4060,c00,32,32,32,2,2,8,0.0,87.843,54.23999950289726,169.103357642889,1.8558867426726842,7,-1,-1,8x2048x3072,0,
2026-03-03T03:25:19.692699+00:00,FULL,llm_style,eval,llm_style_eval_033,64,1536,8192,bf16,NVIDIA GeForce RTX 4060,c04,64,64,64,4,3,8,0.0,0.0,109.56799983978271,117.25824244320393,14.69966357289665,2,-1,-1,64x1536x8192,0,
2026-03-03T03:25:19.837766+00:00,FULL,llm_style,eval,llm_style_eval_034,64,6144,2048,bf16,NVIDIA GeForce RTX 4060,c10,64,128,64,8,3,8,0.0,145.016,81.91999793052673,90.56096002459526,19.6608004966736,1,-1,-1,64x6144x2048,0,
2026-03-03T03:25:19.947002+00:00,FULL,llm_style,eval,llm_style_eval_035,4,4096,2048,bf16,NVIDIA GeForce RTX 4060,c11,32,128,32,4,2,8,0.0,109.198,53.247999399900436,99.30975951254356,1.2603077065112325,7,-1,-1,4x4096x2048,0,
2026-03-03T03:25:20.107802+00:00,FULL,llm_style,eval,llm_style_eval_036,64,8192,4096,bf16,NVIDIA GeForce RTX 4060,c10,64,128,64,8,3,8,0.0,0.0,305.04000186920166,372.12000608444214,14.080013341468712,1,-1,-1,64x8192x4096,0,
2026-03-03T03:25:20.138045+00:00,FULL,llm_style,eval,llm_style_eval_037,32,6144,1024,bf16,NVIDIA GeForce RTX 4060,c00,32,32,32,2,2,8,0.0,0.0,48.128001391887665,94.78976327925906,8.366297630382595,1,-1,-1,32x6144x1024,0,
2026-03-03T03:25:20.201090+00:00,FULL,llm_style,eval,llm_style_eval_038,64,6144,2048,bf16,NVIDIA GeForce RTX 4060,c10,64,128,64,8,3,8,0.0,0.0,87.0399996638298,150.36543637514112,18.504282424409332,1,-1,-1,64x6144x2048,0,
2026-03-03T03:25:20.276778+00:00,FULL,llm_style,eval,llm_style_eval_039,8,1024,3072,bf16,NVIDIA GeForce RTX 4060,c00,32,32,32,2,2,8,0.0,75.635,29.69600073993206,89.67168055474757,1.6948965094925827,7,-1,-1,8x1024x3072,0,
2026-03-03T03:25:20.490603+00:00,FULL,llm_style,eval,llm_style_eval_040,32,8192,2048,bf16,NVIDIA GeForce RTX 4060,c11,32,128,32,4,2,8,0.0,213.784,162.81600296497345,185.9276795387268,6.594817489967455,1,-1,-1,32x8192x2048,0,
2026-03-03T03:25:20.551765+00:00,FULL,llm_style,eval,llm_style_eval_041,32,3072,1024,bf16,NVIDIA GeForce RTX 4060,c00,32,32,32,2,2,8,0.0,61.123,34.671999514102936,136.86591625213597,5.806604603755542,3,-1,-1,32x3072x1024,0,
2026-03-03T03:25:20.639141+00:00,FULL,llm_style,eval,llm_style_eval_042,64,1024,4096,bf16,NVIDIA GeForce RTX 4060,c04,64,64,64,4,3,8,0.0,87.337,56.32000043988228,64.43232025951146,9.53250901645629,3,-1,-1,64x1024x4096,0,
2026-03-03T03:25:20.650846+00:00,FULL,llm_style,eval,llm_style_eval_043,2,1536,1024,bf16,NVIDIA GeForce RTX 4060,c00,32,32,32,2,2,8,0.0,0.0,15.056000091135502,461.7462524771677,0.4178703481613427,7,-1,-1,2x1536x1024,0,
2026-03-03T03:25:20.889310+00:00,FULL,llm_style,eval,llm_style_eval_044,64,6144,3072,bf16,NVIDIA GeForce RTX 4060,c06,64,128,32,4,3,8,0.0,238.426,182.608000934124,208.35775911808014,13.230083521211894,1,-1,-1,64x6144x3072,0,
2026-03-03T03:25:21.024357+00:00,FULL,llm_style,eval,llm_style_eval_045,64,1536,6144,bf16,NVIDIA GeForce RTX 4060,c04,64,64,64,4,3,8,0.0,134.998,73.61600175499916,83.96799862384796,16.408926363865845,3,-1,-1,64x1536x6144,0,
2026-03-03T03:25:21.256157+00:00,FULL,llm_style,eval,llm_style_eval_046,2,6144,3072,bf16,NVIDIA GeForce RTX 4060,c11,32,128,32,4,2,8,0.0,231.757,176.12800002098083,215.38208156824103,0.4286511627396356,5,-1,-1,2x6144x3072,0,
2026-03-03T03:25:21.657204+00:00,FULL,llm_style,eval,llm_style_eval_047,16,4096,8192,bf16,NVIDIA GeForce RTX 4060,c11,32,128,32,4,2,8,0.0,401.004,292.86399483680725,416.8377512693405,3.6663497149874007,6,-1,-1,16x4096x8192,0,
2026-03-03T03:25:21.694512+00:00,FULL,llm_style,eval,llm_style_eval_048,16,1024,6144,bf16,NVIDIA GeForce RTX 4060,c04,64,64,64,4,3,8,0.0,0.0,72.65600189566612,150.9171211719513,2.7709561047565567,7,-1,-1,16x1024x6144,0,
2026-03-03T03:25:21.833755+00:00,FULL,llm_style,eval,llm_style_eval_049,16,8192,1536,bf16,NVIDIA GeForce RTX 4060,c11,32,128,32,4,2,8,0.0,139.187,69.42399963736534,144.67071637511228,5.799913374384213,5,-1,-1,16x8192x1536,0,
2026-03-03T03:25:21.896699+00:00,FULL,llm_style,eval,llm_style_eval_050,1,1024,1024,bf16,NVIDIA GeForce RTX 4060,c11,32,128,32,4,2,8,0.0,62.906,39.63200002908707,101.31871845573167,0.052915623699556914,7,-1,-1,1x1024x1024,0,
2026-03-03T03:25:21.981040+00:00,FULL,llm_style,eval,llm_style_eval_051,16,6144,1024,bf16,NVIDIA GeForce RTX 4060,c11,32,128,32,4,2,8,0.0,84.305,41.98399931192398,44.413120932877064,4.795317151761212,5,-1,-1,16x6144x1024,0,
2026-03-03T03:25:22.726309+00:00,FULL,llm_style,eval,llm_style_eval_052,16,8192,8192,bf16,NVIDIA GeForce RTX 4060,c02,32,64,32,2,2,8,0.0,745.225,562.0799958705902,650.1033556461333,3.8206014513535953,4,-1,-1,16x8192x8192,0,
2026-03-03T03:25:23.293133+00:00,FULL,llm_style,eval,llm_style_eval_053,1,6144,8192,bf16,NVIDIA GeForce RTX 4060,c11,32,128,32,4,2,8,0.0,566.776,423.39199781417847,500.49217134714104,0.23775436597689284,4,-1,-1,1x6144x8192,0,
2026-03-03T03:25:23.448916+00:00,FULL,llm_style,eval,llm_style_eval_054,64,4096,3072,bf16,NVIDIA GeForce RTX 4060,c04,64,64,64,4,3,8,0.0,155.738,86.01599931716919,93.24544176459311,18.72457157721487,3,-1,-1,64x4096x3072,0,
2026-03-03T03:25:23.554389+00:00,FULL,llm_style,eval,llm_style_eval_055,4,8192,1024,bf16,NVIDIA GeForce RTX 4060,c11,32,128,32,4,2,8,0.0,105.428,48.96000027656555,53.153920508921146,1.3706875739565978,5,-1,-1,4x8192x1024,0,
2026-03-03T03:25:23.634242+00:00,FULL,llm_style,eval,llm_style_eval_056,64,1024,3072,bf16,NVIDIA GeForce RTX 4060,c04,64,64,64,4,3,8,0.0,79.812,50.175998359918594,59.13599953055382,8.024816588834353,3,-1,-1,64x1024x3072,0,
2026-03-03T03:25:23.638338+00:00,FULL,llm_style,eval,llm_style_eval_057,64,1024,3072,bf16,NVIDIA GeForce RTX 4060,c04,64,64,64,4,3,8,0.0,0.0,49.15200173854828,53.23231928050518,8.191999710241964,3,-1,-1,64x1024x3072,0,
2026-03-03T03:25:23.755829+00:00,FULL,llm_style,eval,llm_style_eval_058,32,2048,4096,bf16,NVIDIA GeForce RTX 4060,c00,32,32,32,2,2,8,0.0,117.46,72.7040022611618,81.168959364295,7.384337798509263,3,-1,-1,32x2048x4096,0,
2026-03-03T03:25:23.848378+00:00,FULL,llm_style,eval,llm_style_eval_059,64,8192,2048,bf16,NVIDIA GeForce RTX 4060,c00,32,32,32,2,2,8,0.0,0.0,169.98399794101715,207.4521595239639,12.633445936158983,1,-1,-1,64x8192x2048,0,
2026-03-03T03:25:24.072976+00:00,FULL,llm_style,eval,llm_style_eval_060,1,3072,6144,bf16,NVIDIA GeForce RTX 4060,c10,64,128,64,8,3,8,0.0,224.549,177.91999876499176,232.08575978875155,0.2121669079475488,7,-1,-1,1x3072x6144,0,
2026-03-03T03:25:24.107604+00:00,FULL,llm_style,eval,llm_style_eval_061,64,1536,4096,bf16,NVIDIA GeForce RTX 4060,c04,64,64,64,4,3,8,0.0,0.0,58.35200101137161,115.06688140332682,13.800835516215841,3,-1,-1,64x1536x4096,0,
2026-03-03T03:25:24.245282+00:00,FULL,llm_style,eval,llm_style_eval_062,16,6144,2048,bf16,NVIDIA GeForce RTX 4060,c11,32,128,32,4,2,8,0.0,137.625,73.72800260782242,84.46367844939232,5.46133314016131,5,-1,-1,16x6144x2048,0,
2026-03-03T03:25:24.291570+00:00,FULL,llm_style,eval,llm_style_eval_063,64,1536,6144,bf16,NVIDIA GeForce RTX 4060,c04,64,64,64,4,3,8,0.0,0.0,73.04000109434128,156.2425573170185,16.538328777401755,3,-1,-1,64x1536x6144,0,
2026-03-03T03:25:24.350972+00:00,FULL,llm_style,eval,llm_style_eval_064,1,6144,2048,bf16,NVIDIA GeForce RTX 4060,c11,32,128,32,4,2,8,0.0,0.0,72.68800213932991,150.11647418141362,0.3462170270103395,5,-1,-1,1x6144x2048,0,
2026-03-03T03:25:24.483065+00:00,FULL,llm_style,eval,llm_style_eval_065,8,1536,6144,bf16,NVIDIA GeForce RTX 4060,c04,64,64,64,4,3,8,0.0,132.042,70.65600156784058,79.89247724413872,2.1370434308403614,7,-1,-1,8x1536x6144,0,
2026-03-03T03:25:24.518710+00:00,FULL,llm_style,eval,llm_style_eval_066,64,1536,4096,bf16,NVIDIA GeForce RTX 4060,c04,64,64,64,4,3,8,0.0,0.0,57.103998959064484,146.5116813033818,14.102451363822894,3,-1,-1,64x1536x4096,0,
2026-03-03T03:25:24.603089+00:00,FULL,llm_style,eval,llm_style_eval_067,64,8192,2048,bf16,NVIDIA GeForce RTX 4060,c00,32,32,32,2,2,8,0.0,0.0,166.9440045952797,203.26047837734214,12.863496674864834,1,-1,-1,64x8192x2048,0,
2026-03-03T03:25:24.625636+00:00,FULL,llm_style,eval,llm_style_eval_068,64,1024,4096,bf16,NVIDIA GeForce RTX 4060,c04,64,64,64,4,3,8,0.0,0.0,57.19999969005585,108.69760304689393,9.385855155753339,3,-1,-1,64x1024x4096,0,
2026-03-03T03:25:24.661323+00:00,FULL,llm_style,eval,llm_style_eval_069,64,2048,4096,bf16,NVIDIA GeForce RTX 4060,c03,64,64,32,4,2,8,0.0,0.0,76.84800028800964,153.40544342994684,13.972280605557055,3,-1,-1,64x2048x4096,0,
2026-03-03T03:25:24.773122+00:00,FULL,llm_style,eval,llm_style_eval_070,64,8192,1024,bf16,NVIDIA GeForce RTX 4060,c10,64,128,64,8,3,8,0.0,111.747,65.5359998345375,80.09728096425528,16.384000041365624,1,-1,-1,64x8192x1024,0,
2026-03-03T03:25:24.839526+00:00,FULL,llm_style,eval,llm_style_eval_071,64,6144,2048,bf16,NVIDIA GeForce RTX 4060,c10,64,128,64,8,3,8,0.0,0.0,82.2880007326603,130.67200280725942,19.57287480142587,1,-1,-1,64x6144x2048,0,
2026-03-03T03:25:24.848754+00:00,FULL,llm_style,eval,llm_style_eval_072,64,1536,1024,bf16,NVIDIA GeForce RTX 4060,c04,64,64,64,4,3,8,0.0,0.0,35.840000957250595,83.9219181984662,5.617371278537052,3,-1,-1,64x1536x1024,0,
2026-03-03T03:25:24.871344+00:00,FULL,llm_style,eval,llm_style_eval_073,1,4096,1536,bf16,NVIDIA GeForce RTX 4060,c00,32,32,32,2,2,8,0.0,0.0,49.8879998922348,116.80095791816709,0.2522232205576669,7,-1,-1,1x4096x1536,0,
2026-03-03T03:25:24.932053+00:00,FULL,llm_style,eval,llm_style_eval_074,8,1024,2048,bf16,NVIDIA GeForce RTX 4060,c04,64,64,64,4,3,8,0.0,60.661,40.95999896526337,45.45599929988383,0.8192000206947332,7,-1,-1,8x1024x2048,0,
2026-03-03T03:25:25.010005+00:00,FULL,llm_style,eval,llm_style_eval_075,2,6144,1024,bf16,NVIDIA GeForce RTX 4060,c11,32,128,32,4,2,8,0.0,77.906,40.95999896526337,56.938560232520075,0.61440001552105,5,-1,-1,2x6144x1024,0,
2026-03-03T03:25:25.047296+00:00,FULL,llm_style,eval,llm_style_eval_076,64,1024,6144,bf16,NVIDIA GeForce RTX 4060,c04,64,64,64,4,3,8,0.0,0.0,72.7040022611618,82.96447828412056,11.076506697763895,3,-1,-1,64x1024x6144,0,
2026-03-03T03:25:25.449617+00:00,FULL,llm_style,eval,llm_style_eval_077,1,4096,8192,bf16,NVIDIA GeForce RTX 4060,c11,32,128,32,4,2,8,0.0,402.272,291.83998703956604,364.5791921019553,0.2299508874049592,6,-1,-1,1x4096x8192,0,
2026-03-03T03:25:25.547318+00:00,FULL,llm_style,eval,llm_style_eval_078,64,6144,3072,bf16,NVIDIA GeForce RTX 4060,c06,64,128,32,4,3,8,0.0,0.0,184.32000279426575,230.90239405632002,13.107199801296662,1,-1,-1,64x6144x3072,0,
2026-03-03T03:25:25.685316+00:00,FULL,llm_style,eval,llm_style_eval_079,2,3072,4096,bf16,NVIDIA GeForce RTX 4060,c04,64,64,64,4,3,8,0.0,137.948,79.8719972372055,96.31839796900745,0.6301538679510421,7,-1,-1,2x3072x4096,0,
2026-03-03T03:25:25.739315+00:00,FULL,llm_style,eval,llm_style_eval_080,4,1536,1024,bf16,NVIDIA GeForce RTX 4060,c00,32,32,32,2,2,8,0.0,53.96,35.840000957250595,107.41984173655509,0.3510857049085658,7,-1,-1,4x1536x1024,0,
2026-03-03T03:25:26.042887+00:00,FULL,llm_style,eval,llm_style_eval_081,4,4096,6144,bf16,NVIDIA GeForce RTX 4060,c11,32,128,32,4,2,8,0.0,303.532,226.28799825906754,280.40064096450794,0.8896918685431551,7,-1,-1,4x4096x6144,0,
2026-03-03T03:25:26.138278+00:00,FULL,llm_style,eval,llm_style_eval_082,64,6144,1024,bf16,NVIDIA GeForce RTX 4060,c10,64,128,64,8,3,8,0.0,95.347,54.27199974656105,62.00320046395062,14.838339691933468,1,-1,-1,64x6144x1024,0,
2026-03-03T03:25:26.221392+00:00,FULL,llm_style,eval,llm_style_eval_083,8,4096,4096,bf16,NVIDIA GeForce RTX 4060,c11,32,128,32,4,2,8,0.0,0.0,161.79199516773224,245.258237272501,1.6591392900601099,7,-1,-1,8x4096x4096,0,
2026-03-03T03:25:26.364275+00:00,FULL,llm_style,eval,llm_style_eval_084,64,1024,8192,bf16,NVIDIA GeForce RTX 4060,c04,64,64,64,4,3,8,0.0,142.831,84.86399799585342,90.97695969045162,12.652501052949031,2,-1,-1,64x1024x8192,0,
2026-03-03T03:25:26.653548+00:00,FULL,llm_style,eval,llm_style_eval_085,1,3072,8192,bf16,NVIDIA GeForce RTX 4060,c10,64,128,64,8,3,8,0.0,289.23,226.28799825906754,241.74591973423958,0.22242296713578877,6,-1,-1,1x3072x8192,0,
2026-03-03T03:25:26.717371+00:00,FULL,llm_style,eval,llm_style_eval_086,8,1536,1024,bf16,NVIDIA GeForce RTX 4060,c00,32,32,32,2,2,8,0.0,63.782,28.672000393271446,180.96128135919557,0.877714273675364,7,-1,-1,8x1536x1024,0,
2026-03-03T03:25:26.795133+00:00,FULL,llm_style,eval,llm_style_eval_087,16,1024,3072,bf16,NVIDIA GeForce RTX 4060,c04,64,64,64,4,3,8,0.0,77.722,49.15200173854828,60.979200117290006,2.047999927560491,7,-1,-1,16x1024x3072,0,
2026-03-03T03:25:26.882142+00:00,FULL,llm_style,eval,llm_style_eval_088,8,4096,1536,bf16,NVIDIA GeForce RTX 4060,c00,32,32,32,2,2,8,0.0,86.968,44.624000787734985,136.9788805395363,2.2558106450120796,7,-1,-1,8x4096x1536,0,
2026-03-03T03:25:27.114359+00:00,FULL,llm_style,eval,llm_style_eval_089,16,6144,3072,bf16,NVIDIA GeForce RTX 4060,c11,32,128,32,4,2,8,0.0,232.17,178.0640035867691,238.13343748450274,3.391925172038972,5,-1,-1,16x6144x3072,0,
2026-03-03T03:25:27.202136+00:00,FULL,llm_style,eval,llm_style_eval_090,32,1536,3072,bf16,NVIDIA GeForce RTX 4060,c04,64,64,64,4,3,8,0.0,87.735,49.15200173854828,110.48191692680099,6.1439997826814725,3,-1,-1,32x1536x3072,0,
2026-03-03T03:25:27.287438+00:00,FULL,llm_style,eval,llm_style_eval_091,16,1024,4096,bf16,NVIDIA GeForce RTX 4060,c04,64,64,64,4,3,8,0.0,85.263,55.296000093221664,70.27712143957612,2.4272592551672245,7,-1,-1,16x1024x4096,0,
2026-03-03T03:25:27.594668+00:00,FULL,llm_style,eval,llm_style_eval_092,1,4096,6144,bf16,NVIDIA GeForce RTX 4060,c11,32,128,32,4,2,8,0.0,307.19,226.24000161886215,248.33920434117312,0.22247015399510028,7,-1,-1,1x4096x6144,0,
2026-03-03T03:25:27.689590+00:00,FULL,llm_style,eval,llm_style_eval_093,32,2048,3072,bf16,NVIDIA GeForce RTX 4060,c00,32,32,32,2,2,8,0.0,94.882,53.247999399900436,148.6953604221343,7.561846239067394,3,-1,-1,32x2048x3072,0,
2026-03-03T03:25:27.701150+00:00,FULL,llm_style,eval,llm_style_eval_094,32,1024,2048,bf16,NVIDIA GeForce RTX 4060,c04,64,64,64,4,3,8,0.0,0.0,41.98399931192398,174.80384558439238,3.1968781011741414,3,-1,-1,32x1024x2048,0,
2026-03-03T03:25:27.837390+00:00,FULL,llm_style,eval,llm_style_eval_095,8,6144,2048,bf16,NVIDIA GeForce RTX 4060,c00,32,32,32,2,2,8,0.0,136.204,66.97599962353706,80.32095655798912,3.0059512830212203,5,-1,-1,8x6144x2048,0,
2026-03-03T03:25:27.874065+00:00,FULL,llm_style,eval,llm_style_eval_096,64,2048,3072,bf16,NVIDIA GeForce RTX 4060,c11,32,128,32,4,2,8,0.0,0.0,63.920000568032265,201.14911973476407,12.59866021344735,3,-1,-1,64x2048x3072,0,
2026-03-03T03:25:27.901274+00:00,FULL,llm_style,eval,llm_style_eval_097,64,6144,1024,bf16,NVIDIA GeForce RTX 4060,c10,64,128,64,8,3,8,0.0,0.0,56.68800137937069,78.43904063105582,14.205940382527912,1,-1,-1,64x6144x1024,0,
2026-03-03T03:25:27.926032+00:00,FULL,llm_style,eval,llm_style_eval_098,32,6144,1024,bf16,NVIDIA GeForce RTX 4060,c00,32,32,32,2,2,8,0.0,0.0,50.175998359918594,132.8025564551353,8.024816588834353,1,-1,-1,32x6144x1024,0,
2026-03-03T03:25:27.998711+00:00,FULL,llm_style,eval,llm_style_eval_099,1,2048,2048,bf16,NVIDIA GeForce RTX 4060,c00,32,32,32,2,2,8,0.0,72.628,43.007999658584595,136.35584130883214,0.19504762059598826,7,-1,-1,1x2048x2048,0,
2026-03-03T03:25:28.032923+00:00,FULL,llm_style,eval,llm_style_eval_100,64,8192,1024,bf16,NVIDIA GeForce RTX 4060,c10,64,128,64,8,3,8,0.0,0.0,75.72800293564796,113.60927782952778,14.178926980451907,1,-1,-1,64x8192x1024,0,
2026-03-03T03:25:28.097021+00:00,FULL,llm_style,eval,llm_style_eval_101,64,8192,1536,bf16,NVIDIA GeForce RTX 4060,c06,64,128,32,4,3,8,0.0,0.0,97.28000313043594,218.57279881834953,16.556462625113635,1,-1,-1,64x8192x1536,0,
2026-03-03T03:25:28.124453+00:00,FULL,llm_style,eval,llm_style_eval_102,32,3072,2048,bf16,NVIDIA GeForce RTX 4060,c02,32,64,32,2,2,8,0.0,0.0,56.03200010955334,133.82656060159204,7.1861290550531045,3,-1,-1,32x3072x2048,0,
2026-03-03T03:25:28.151374+00:00,FULL,llm_style,eval,llm_style_eval_103,64,2048,3072,bf16,NVIDIA GeForce RTX 4060,c11,32,128,32,4,2,8,0.0,0.0,65.95199927687645,143.22335675358767,12.2104921280582,3,-1,-1,64x2048x3072,0,
2026-03-03T03:25:28.210912+00:00,FULL,llm_style,eval,llm_style_eval_104,16,6144,2048,bf16,NVIDIA GeForce RTX 4060,c11,32,128,32,4,2,8,0.0,0.0,80.89599758386612,165.59103600680803,4.97741787018033,5,-1,-1,16x6144x2048,0,
2026-03-03T03:25:28.346893+00:00,FULL,llm_style,eval,llm_style_eval_105,1,1024,8192,bf16,NVIDIA GeForce RTX 4060,c04,64,64,64,4,3,8,0.0,135.927,83.96799862384796,93.40063959360123,0.19980488132338384,6,-1,-1,1x1024x8192,0,
2026-03-03T03:25:28.749968+00:00,FULL,llm_style,eval,llm_style_eval_106,32,4096,8192,bf16,NVIDIA GeForce RTX 4060,c11,32,128,32,4,2,8,0.0,403.033,294.6559935808182,397.77183920145035,7.288104415941531,2,-1,-1,32x4096x8192,0,
2026-03-03T03:25:28.803404+00:00,FULL,llm_style,eval,llm_style_eval_107,64,6144,1536,bf16,NVIDIA GeForce RTX 4060,c06,64,128,32,4,3,8,0.0,0.0,64.51199948787689,94.37183834612367,18.72457157721487,1,-1,-1,64x6144x1536,0,
2026-03-03T03:25:28.879592+00:00,FULL,llm_style,eval,llm_style_eval_108,8,3072,1536,bf16,NVIDIA GeForce RTX 4060,c11,32,128,32,4,2,8,0.0,76.133,46.08000069856644,81.32479906082148,1.6383999751620828,7,-1,-1,8x3072x1536,0,
2026-03-03T03:25:28.895094+00:00,FULL,llm_style,eval,llm_style_eval_109,16,2048,1024,bf16,NVIDIA GeForce RTX 4060,c00,32,32,32,2,2,8,0.0,0.0,32.496001571416855,65.07519967854022,2.0651421945716626,7,-1,-1,16x2048x1024,0,
2026-03-03T03:25:29.660284+00:00,FULL,llm_style,eval,llm_style_eval_110,1,8192,8192,bf16,NVIDIA GeForce RTX 4060,c11,32,128,32,4,2,8,0.0,765.147,557.4080049991608,603.8528025150298,0.24078902132057126,4,-1,-1,1x8192x8192,0,
2026-03-03T03:25:29.773101+00:00,FULL,llm_style,eval,llm_style_eval_111,8,6144,1536,bf16,NVIDIA GeForce RTX 4060,c11,32,128,32,4,2,8,0.0,112.776,48.128001391887665,112.67967816442228,3.137361611393473,5,-1,-1,8x6144x1536,0,
2026-03-03T03:25:29.867673+00:00,FULL,llm_style,eval,llm_style_eval_112,2,6144,3072,bf16,NVIDIA GeForce RTX 4060,c11,32,128,32,4,2,8,0.0,0.0,180.2240014076233,291.50815814733494,0.4189090876372393,5,-1,-1,2x6144x3072,0,
2026-03-03T03:25:30.179292+00:00,FULL,llm_style,eval,llm_style_eval_113,1,8192,8192,bf16,NVIDIA GeForce RTX 4060,c11,32,128,32,4,2,8,0.0,0.0,558.784008026123,631.0915076732635,0.24019607947284946,4,-1,-1,1x8192x8192,0,
2026-03-03T03:25:30.237908+00:00,FULL,llm_style,eval,llm_style_eval_114,1,3072,1024,bf16,NVIDIA GeForce RTX 4060,c00,32,32,32,2,2,8,0.0,58.566,34.81600061058998,211.29855245351774,0.18070587918378908,7,-1,-1,1x3072x1024,0,
2026-03-03T03:25:30.317144+00:00,FULL,llm_style,eval,llm_style_eval_115,16,3072,1536,bf16,NVIDIA GeForce RTX 4060,c11,32,128,32,4,2,8,0.0,79.196,47.10400104522705,76.108480580151,3.2055651462605423,7,-1,-1,16x3072x1536,0,
2026-03-03T03:25:30.377298+00:00,FULL,llm_style,eval,llm_style_eval_116,8,3072,1024,bf16,NVIDIA GeForce RTX 4060,c02,32,64,32,2,2,8,0.0,60.115,40.672000497579575,99.28704351186732,1.2375011650335537,7,-1,-1,8x3072x1024,0,
2026-03-03T03:25:30.462344+00:00,FULL,llm_style,eval,llm_style_eval_117,4,1024,4096,bf16,NVIDIA GeForce RTX 4060,c04,64,64,64,4,3,8,0.0,85.005,55.44000118970871,58.841280937194824,0.6052386594506186,7,-1,-1,4x1024x4096,0,
2026-03-03T03:25:30.563417+00:00,FULL,llm_style,eval,llm_style_eval_118,64,6144,3072,bf16,NVIDIA GeForce RTX 4060,c06,64,128,32,4,3,8,0.0,0.0,185.84000319242477,218.03488120436663,12.99999495532982,1,-1,-1,64x6144x3072,0,
2026-03-03T03:25:31.139685+00:00,FULL,llm_style,eval,llm_style_eval_119,64,8192,6144,bf16,NVIDIA GeForce RTX 4060,c06,64,128,32,4,3,8,0.0,576.22,444.2720115184784,478.8121694326401,14.501140690768098,1,-1,-1,64x8192x6144,0,
2026-03-03T03:25:31.235930+00:00,FULL,llm_style,eval,llm_style_eval_120,8,1024,4096,bf16,NVIDIA GeForce RTX 4060,c04,64,64,64,4,3,8,0.0,96.199,60.416001826524734,69.03263971209523,1.1107796274353405,7,-1,-1,8x1024x4096,0,
2026-03-03T03:25:31.297456+00:00,FULL,llm_style,eval,llm_style_eval_121,4,1024,2048,bf16,NVIDIA GeForce RTX 4060,c04,64,64,64,4,3,8,0.0,61.487,42.03199967741966,74.17312145233151,0.3991534099914123,7,-1,-1,4x1024x2048,0,
2026-03-03T03:25:31.594969+00:00,FULL,llm_style,eval,llm_style_eval_122,4,6144,4096,bf16,NVIDIA GeForce RTX 4060,c11,32,128,32,4,2,8,0.0,297.473,225.2800017595291,254.63711559772486,0.8936727202927771,5,-1,-1,4x6144x4096,0,
2026-03-03T03:25:31.884802+00:00,FULL,llm_style,eval,llm_style_eval_123,4,3072,8192,bf16,NVIDIA GeForce RTX 4060,c04,64,64,64,4,3,8,0.0,289.791,229.34399545192719,308.10111969709374,0.8778367691871841,6,-1,-1,4x3072x8192,0,
2026-03-03T03:25:31.914218+00:00,FULL,llm_style,eval,llm_style_eval_124,64,6144,1024,bf16,NVIDIA GeForce RTX 4060,c10,64,128,64,8,3,8,0.0,0.0,63.48799914121628,185.8476853370666,12.684387268352213,1,-1,-1,64x6144x1024,0,
2026-03-03T03:25:31.978972+00:00,FULL,llm_style,eval,llm_style_eval_125,64,1536,8192,bf16,NVIDIA GeForce RTX 4060,c04,64,64,64,4,3,8,0.0,0.0,109.66400057077408,159.32512402534468,14.686795371472481,2,-1,-1,64x1536x8192,0,
2026-03-03T03:25:32.062757+00:00,FULL,llm_style,eval,llm_style_eval_126,64,2048,8192,bf16,NVIDIA GeForce RTX 4060,c10,64,128,64,8,3,8,0.0,0.0,167.93599724769592,202.61887773871416,12.787512404696566,2,-1,-1,64x2048x8192,0,
2026-03-03T03:25:32.207154+00:00,FULL,llm_style,eval,llm_style_eval_127,2,8192,1536,bf16,NVIDIA GeForce RTX 4060,c11,32,128,32,4,2,8,0.0,144.344,65.5519999563694,72.6822417974472,0.7678125462762406,5,-1,-1,2x8192x1536,0,
2026-03-03T03:25:32.286200+00:00,FULL,llm_style,eval,llm_style_eval_128,8,2048,2048,bf16,NVIDIA GeForce RTX 4060,c11,32,128,32,4,2,8,0.0,79.005,52.25599929690361,155.97952112555498,1.2842327178302855,7,-1,-1,8x2048x2048,0,
2026-03-03T03:25:32.539922+00:00,FULL,llm_style,eval,llm_style_eval_129,64,8192,6144,bf16,NVIDIA GeForce RTX 4060,c06,64,128,32,4,3,8,0.0,0.0,442.3680007457733,540.3721410036087,14.563555531003347,1,-1,-1,64x8192x6144,0,
2026-03-03T03:25:32.561816+00:00,FULL,llm_style,eval,llm_style_eval_130,16,3072,1536,bf16,NVIDIA GeForce RTX 4060,c11,32,128,32,4,2,8,0.0,0.0,45.903999358415604,69.11200184375045,3.2893635872778915,7,-1,-1,16x3072x1536,0,
2026-03-03T03:25:33.296439+00:00,FULL,llm_style,eval,llm_style_eval_131,32,8192,8192,bf16,NVIDIA GeForce RTX 4060,c11,32,128,32,4,2,8,0.0,734.578,561.1519813537598,624.4886487722396,7.65383967038402,0,-1,-1,32x8192x8192,0,
2026-03-03T03:25:33.699926+00:00,FULL,llm_style,eval,llm_style_eval_132,32,8192,4096,bf16,NVIDIA GeForce RTX 4060,c11,32,128,32,4,2,8,0.0,403.444,294.8480099439621,421.3964810967444,7.283358122064802,1,-1,-1,32x8192x4096,0,
2026-03-03T03:25:34.443929+00:00,FULL,llm_style,eval,llm_style_eval_133,2,8192,8192,bf16,NVIDIA GeForce RTX 4060,c11,32,128,32,4,2,8,0.0,743.963,557.9520165920258,679.2396640777588,0.4811084968195032,4,-1,-1,2x8192x8192,0,
2026-03-03T03:25:34.551860+00:00,FULL,llm_style,eval,llm_style_eval_134,64,3072,3072,bf16,NVIDIA GeForce RTX 4060,c03,64,64,32,4,2,8,0.0,107.889,64.43199887871742,71.7209619283676,18.747820539818797,3,-1,-1,64x3072x3072,0,
2026-03-03T03:25:34.668608+00:00,FULL,llm_style,eval,llm_style_eval_135,8,3072,3072,bf16,NVIDIA GeForce RTX 4060,c00,32,32,32,2,2,8,0.0,116.698,55.296000093221664,148.60735729336733,2.730666662063128,7,-1,-1,8x3072x3072,0,
2026-03-03T03:25:34.785034+00:00,FULL,llm_style,eval,llm_style_eval_136,4,2048,4096,bf16,NVIDIA GeForce RTX 4060,c00,32,32,32,2,2,8,0.0,116.383,62.463998794555664,141.22367806732632,1.0743606764709592,7,-1,-1,4x2048x4096,0,
2026-03-03T03:25:35.530666+00:00,FULL,llm_style,eval,llm_style_eval_137,4,8192,8192,bf16,NVIDIA GeForce RTX 4060,c02,32,64,32,2,2,8,0.0,745.588,558.4799945354462,643.6147332191467,0.9613073292743082,4,-1,-1,4x8192x8192,0,
2026-03-03T03:25:35.589589+00:00,FULL,llm_style,eval,llm_style_eval_138,16,1024,1024,bf16,NVIDIA GeForce RTX 4060,c04,64,64,64,4,3,8,0.0,58.881,36.86400130391121,47.58144073188305,0.9102221900268849,7,-1,-1,16x1024x1024,0,
2026-03-03T03:25:35.639977+00:00,FULL,llm_style,eval,llm_style_eval_139,4,1024,1024,bf16,NVIDIA GeForce RTX 4060,c00,32,32,32,2,2,8,0.0,50.354,15.15199989080429,71.48768067359916,0.5536304158166623,7,-1,-1,4x1024x1024,0,
2026-03-03T03:25:35.771017+00:00,FULL,llm_style,eval,llm_style_eval_140,64,4096,6144,bf16,NVIDIA GeForce RTX 4060,c11,32,128,32,4,2,8,0.0,0.0,235.4240044951439,327.9948794841766,13.682655168948349,3,-1,-1,64x4096x6144,0,
2026-03-03T03:25:35.897272+00:00,FULL,llm_style,eval,llm_style_eval_141,4,6144,4096,bf16,NVIDIA GeForce RTX 4060,c11,32,128,32,4,2,8,0.0,0.0,232.2239950299263,375.1043304800986,0.866949997884824,5,-1,-1,4x6144x4096,0,
2026-03-03T03:25:36.066975+00:00,FULL,llm_style,eval,llm_style_eval_142,4,2048,6144,bf16,NVIDIA GeForce RTX 4060,c00,32,32,32,2,2,8,0.0,169.651,103.26400026679039,212.44671702384937,0.9748149959320647,7,-1,-1,4x2048x6144,0,
2026-03-03T03:25:36.135605+00:00,FULL,llm_style,eval,llm_style_eval_143,64,1536,8192,bf16,NVIDIA GeForce RTX 4060,c04,64,64,64,4,3,8,0.0,0.0,115.7120019197464,201.84063732624043,13.91915021154903,2,-1,-1,64x1536x8192,0,
2026-03-03T03:25:36.249474+00:00,FULL,llm_style,eval,llm_style_eval_144,1,3072,3072,bf16,NVIDIA GeForce RTX 4060,c00,32,32,32,2,2,8,0.0,113.815,56.32000043988228,149.74975839257235,0.33512727010979143,7,-1,-1,1x3072x3072,0,
2026-03-03T03:25:36.261272+00:00,FULL,llm_style,eval,llm_style_eval_145,32,1024,2048,bf16,NVIDIA GeForce RTX 4060,c04,64,64,64,4,3,8,0.0,0.0,41.98399931192398,135.88640213012692,3.1968781011741414,3,-1,-1,32x1024x2048,0,
2026-03-03T03:25:36.423266+00:00,FULL,llm_style,eval,llm_style_eval_146,64,8192,4096,bf16,NVIDIA GeForce RTX 4060,c10,64,128,64,8,3,8,0.0,0.0,303.1200021505356,405.5142393708228,14.169197893667972,1,-1,-1,64x8192x4096,0,
2026-03-03T03:25:36.466876+00:00,FULL,llm_style,eval,llm_style_eval_147,64,2048,4096,bf16,NVIDIA GeForce RTX 4060,c03,64,64,32,4,2,8,0.0,0.0,74.75200295448303,92.97375969588755,14.364054226798554,3,-1,-1,64x2048x4096,0,
2026-03-03T03:25:36.494631+00:00,FULL,llm_style,eval,llm_style_eval_148,64,1024,6144,bf16,NVIDIA GeForce RTX 4060,c04,64,64,64,4,3,8,0.0,0.0,76.28800347447395,156.7539209127426,10.556133747417528,3,-1,-1,64x1024x6144,0,
2026-03-03T03:25:36.656119+00:00,FULL,llm_style,eval,llm_style_eval_149,64,4096,8192,bf16,NVIDIA GeForce RTX 4060,c00,32,32,32,2,2,8,0.0,0.0,303.1040132045746,329.1459184885025,14.169945328639345,2,-1,-1,64x4096x8192,0,
2026-03-03T03:25:36.743471+00:00,FULL,llm_style,eval,llm_style_eval_150,2,2048,3072,bf16,NVIDIA GeForce RTX 4060,c00,32,32,32,2,2,8,0.0,87.297,49.2320004850626,129.41952139139173,0.5111680157631523,7,-1,-1,2x2048x3072,0,
2026-03-03T03:25:36.849129+00:00,FULL,llm_style,eval,llm_style_eval_151,64,4096,2048,bf16,NVIDIA GeForce RTX 4060,c04,64,64,64,4,3,8,0.0,105.609,66.56000018119812,110.82175940275185,16.13193841762204,3,-1,-1,64x4096x2048,0,
2026-03-03T03:25:37.596600+00:00,FULL,llm_style,eval,llm_style_eval_152,8,8192,8192,bf16,NVIDIA GeForce RTX 4060,c11,32,128,32,4,2,8,0.0,747.426,558.5600137710571,618.037120103836,1.922339225020332,4,-1,-1,8x8192x8192,0,
2026-03-03T03:25:37.686827+00:00,FULL,llm_style,eval,llm_style_eval_153,64,8192,2048,bf16,NVIDIA GeForce RTX 4060,c00,32,32,32,2,2,8,0.0,0.0,167.67999529838562,228.6393661797045,12.807035473602948,1,-1,-1,64x8192x2048,0,
2026-03-03T03:25:37.914639+00:00,FULL,llm_style,eval,llm_style_eval_154,16,2048,8192,bf16,NVIDIA GeForce RTX 4060,c10,64,128,64,8,3,8,0.0,227.763,162.81600296497345,195.30751526355738,3.2974087449837275,6,-1,-1,16x2048x8192,0,
2026-03-03T03:25:37.993657+00:00,FULL,llm_style,eval,llm_style_eval_155,4,2048,1536,bf16,NVIDIA GeForce RTX 4060,c00,32,32,32,2,2,8,0.0,78.978,42.91199892759323,131.65568351745605,0.5864519162219193,7,-1,-1,4x2048x1536,0,
2026-03-03T03:25:38.114786+00:00,FULL,llm_style,eval,llm_style_eval_156,1,4096,6144,bf16,NVIDIA GeForce RTX 4060,c11,32,128,32,4,2,8,0.0,0.0,228.35199534893036,237.44160115718842,0.22041256054317093,7,-1,-1,1x4096x6144,0,
2026-03-03T03:25:38.287634+00:00,FULL,llm_style,eval,llm_style_eval_157,1,1536,8192,bf16,NVIDIA GeForce RTX 4060,c04,64,64,64,4,3,8,0.0,172.795,93.9360000193119,301.8227250874039,0.2679039345386887,6,-1,-1,1x1536x8192,0,
2026-03-03T03:25:38.358493+00:00,FULL,llm_style,eval,llm_style_eval_158,64,1536,8192,bf16,NVIDIA GeForce RTX 4060,c04,64,64,64,4,3,8,0.0,0.0,108.36799815297127,158.83263766765583,14.86243875914801,2,-1,-1,64x1536x8192,0,
2026-03-03T03:25:38.471866+00:00,FULL,llm_style,eval,llm_style_eval_159,16,6144,1536,bf16,NVIDIA GeForce RTX 4060,c11,32,128,32,4,2,8,0.0,113.317,48.128001391887665,53.16255830228327,6.274723222786946,5,-1,-1,16x6144x1536,0,
2026-03-03T03:25:38.651003+00:00,FULL,llm_style,eval,llm_style_eval_160,32,6144,6144,bf16,NVIDIA GeForce RTX 4060,c11,32,128,32,4,2,8,0.0,0.0,331.63200318813324,364.2211240530014,7.284939573909158,1,-1,-1,32x6144x6144,0,
2026-03-03T03:25:38.744513+00:00,FULL,llm_style,eval,llm_style_eval_161,2,1536,4096,bf16,NVIDIA GeForce RTX 4060,c00,32,32,32,2,2,8,0.0,93.454,56.352000683546066,133.23680005967614,0.4465826180923518,7,-1,-1,2x1536x4096,0,
2026-03-03T03:25:38.842175+00:00,FULL,llm_style,eval,llm_style_eval_162,64,1536,3072,bf16,NVIDIA GeForce RTX 4060,c04,64,64,64,4,3,8,0.0,97.617,55.376000702381134,93.46144042909137,10.906886888529478,3,-1,-1,64x1536x3072,0,
2026-03-03T03:25:38.880487+00:00,FULL,llm_style,eval,llm_style_eval_163,64,1024,8192,bf16,NVIDIA GeForce RTX 4060,c04,64,64,64,4,3,8,0.0,0.0,87.90399879217148,114.54944021999836,12.21493719004311,2,-1,-1,64x1024x8192,0,
2026-03-03T03:25:39.045910+00:00,FULL,llm_style,eval,llm_style_eval_164,64,4096,8192,bf16,NVIDIA GeForce RTX 4060,c00,32,32,32,2,2,8,0.0,0.0,303.48800122737885,354.89792078733433,14.15201681328459,2,-1,-1,64x4096x8192,0,
2026-03-03T03:25:39.346358+00:00,FULL,llm_style,eval,llm_style_eval_165,4,8192,3072,bf16,NVIDIA GeForce RTX 4060,c11,32,128,32,4,2,8,0.0,300.397,226.25599801540375,281.4054346084594,0.8898177010374483,5,-1,-1,4x8192x3072,0,
2026-03-03T03:25:39.385029+00:00,FULL,llm_style,eval,llm_style_eval_166,64,1024,6144,bf16,NVIDIA GeForce RTX 4060,c04,64,64,64,4,3,8,0.0,0.0,73.64800199866295,196.16223409771902,10.934531095828234,3,-1,-1,64x1024x6144,0,
2026-03-03T03:25:39.396075+00:00,FULL,llm_style,eval,llm_style_eval_167,2,2048,1024,bf16,NVIDIA GeForce RTX 4060,c11,32,128,32,4,2,8,0.0,0.0,43.007999658584595,93.78816194832322,0.19504762059598826,7,-1,-1,2x2048x1024,0,
2026-03-03T03:25:39.464283+00:00,FULL,llm_style,eval,llm_style_eval_168,64,4096,1024,bf16,NVIDIA GeForce RTX 4060,c01,64,32,32,2,2,8,0.0,68.164,47.10400104522705,62.87647996097803,11.39756496448193,3,-1,-1,64x4096x1024,0,
2026-03-03T03:25:39.508424+00:00,FULL,llm_style,eval,llm_style_eval_169,4,1536,6144,bf16,NVIDIA GeForce RTX 4060,c04,64,64,64,4,3,8,0.0,0.0,73.85599985718727,128.42527873814097,1.0222253052695351,7,-1,-1,4x1536x6144,0,
2026-03-03T03:25:39.527994+00:00,FULL,llm_style,eval,llm_style_eval_170,16,1536,1536,bf16,NVIDIA GeForce RTX 4060,c04,64,64,64,4,3,8,0.0,0.0,47.10400104522705,114.43615756928915,1.6027825731302712,7,-1,-1,16x1536x1536,0,
2026-03-03T03:25:39.620689+00:00,FULL,llm_style,eval,llm_style_eval_171,1,2048,3072,bf16,NVIDIA GeForce RTX 4060,c00,32,32,32,2,2,8,0.0,92.655,56.752000004053116,163.33856254816055,0.22171750773719612,7,-1,-1,1x2048x3072,0,
2026-03-03T03:25:39.717111+00:00,FULL,llm_style,eval,llm_style_eval_172,64,3072,2048,bf16,NVIDIA GeForce RTX 4060,c10,64,128,64,8,3,8,0.0,96.382,56.20799958705902,61.856319345533834,14.327255442575984,3,-1,-1,64x3072x2048,0,
2026-03-03T03:25:39.990168+00:00,FULL,llm_style,eval,llm_style_eval_173,64,8192,6144,bf16,NVIDIA GeForce RTX 4060,c06,64,128,32,4,3,8,0.0,0.0,445.43999433517456,478.6204922199249,14.46311742531213,1,-1,-1,64x8192x6144,0,
2026-03-03T03:25:40.207752+00:00,FULL,llm_style,eval,llm_style_eval_174,2,4096,4096,bf16,NVIDIA GeForce RTX 4060,c11,32,128,32,4,2,8,0.0,217.533,159.71200168132782,167.45472088456154,0.42018673170161513,7,-1,-1,2x4096x4096,0,
2026-03-03T03:25:40.259601+00:00,FULL,llm_style,eval,llm_style_eval_175,64,4096,2048,bf16,NVIDIA GeForce RTX 4060,c04,64,64,64,4,3,8,0.0,0.0,46.08000069856644,199.39583569765085,23.301688535638508,3,-1,-1,64x4096x2048,0,
2026-03-03T03:25:40.320382+00:00,FULL,llm_style,eval,llm_style_eval_176,16,6144,2048,bf16,NVIDIA GeForce RTX 4060,c11,32,128,32,4,2,8,0.0,0.0,77.7759999036789,257.57694974541636,5.177087848419343,5,-1,-1,16x6144x2048,0,
2026-03-03T03:25:40.369355+00:00,FULL,llm_style,eval,llm_style_eval_177,1,6144,1536,bf16,NVIDIA GeForce RTX 4060,c02,32,64,32,2,2,8,0.0,0.0,51.0879997164011,87.68160246312613,0.3694481699180843,5,-1,-1,1x6144x1536,0,
2026-03-03T03:25:40.618742+00:00,FULL,llm_style,eval,llm_style_eval_178,32,6144,8192,bf16,NVIDIA GeForce RTX 4060,c11,32,128,32,4,2,8,0.0,0.0,429.02399599552155,476.21855884790415,7.508264111254108,0,-1,-1,32x6144x8192,0,
2026-03-03T03:25:40.747467+00:00,FULL,llm_style,eval,llm_style_eval_179,64,4096,6144,bf16,NVIDIA GeForce RTX 4060,c11,32,128,32,4,2,8,0.0,0.0,234.49599742889404,252.94047206640244,13.736803644065475,3,-1,-1,64x4096x6144,0,
2026-03-03T03:25:40.763360+00:00,FULL,llm_style,eval,llm_style_eval_180,64,2048,1536,bf16,NVIDIA GeForce RTX 4060,c00,32,32,32,2,2,8,0.0,0.0,56.32000043988228,192.4799980223177,7.149381762342217,3,-1,-1,64x2048x1536,0,
2026-03-03T03:25:40.792382+00:00,FULL,llm_style,eval,llm_style_eval_181,64,2048,3072,bf16,NVIDIA GeForce RTX 4060,c11,32,128,32,4,2,8,0.0,0.0,62.463998794555664,171.99328556656826,12.892328117651509,3,-1,-1,64x2048x3072,0,
2026-03-03T03:25:40.865546+00:00,FULL,llm_style,eval,llm_style_eval_182,32,3072,1536,bf16,NVIDIA GeForce RTX 4060,c11,32,128,32,4,2,8,0.0,73.114,48.128001391887665,55.744959414005265,6.274723222786946,3,-1,-1,32x3072x1536,0,
2026-03-03T03:25:40.950267+00:00,FULL,llm_style,eval,llm_style_eval_183,8,8192,2048,bf16,NVIDIA GeForce RTX 4060,c11,32,128,32,4,2,8,0.0,0.0,165.95199704170227,211.2547199428081,1.617548814025688,5,-1,-1,8x8192x2048,0,
2026-03-03T03:25:40.989868+00:00,FULL,llm_style,eval,llm_style_eval_184,64,8192,1024,bf16,NVIDIA GeForce RTX 4060,c10,64,128,64,8,3,8,0.0,0.0,60.416001826524734,83.94016146659848,17.77247403896545,1,-1,-1,64x8192x1024,0,
2026-03-03T03:25:41.051854+00:00,FULL,llm_style,eval,llm_style_eval_185,1,8192,1536,bf16,NVIDIA GeForce RTX 4060,c11,32,128,32,4,2,8,0.0,0.0,71.61600142717361,123.65280069410795,0.35139945680423323,5,-1,-1,1x8192x1536,0,
2026-03-03T03:25:41.078705+00:00,FULL,llm_style,eval,llm_style_eval_186,16,6144,1024,bf16,NVIDIA GeForce RTX 4060,c11,32,128,32,4,2,8,0.0,0.0,45.05600035190582,59.432959593832486,4.468363601463886,5,-1,-1,16x6144x1024,0,
2026-03-03T03:25:41.106086+00:00,FULL,llm_style,eval,llm_style_eval_187,1,1024,6144,bf16,NVIDIA GeForce RTX 4060,c04,64,64,64,4,3,8,0.0,0.0,74.75200295448303,210.52639558911318,0.16832876047029557,7,-1,-1,1x1024x6144,0,
2026-03-03T03:25:41.490582+00:00,FULL,llm_style,eval,llm_style_eval_188,8,8192,4096,bf16,NVIDIA GeForce RTX 4060,c11,32,128,32,4,2,8,0.0,384.444,292.6719933748245,345.7775896787643,1.8343774742820382,5,-1,-1,8x8192x4096,0,
2026-03-03T03:25:41.721927+00:00,FULL,llm_style,eval,llm_style_eval_189,8,2048,8192,bf16,NVIDIA GeForce RTX 4060,c10,64,128,64,8,3,8,0.0,231.304,161.79199516773224,216.55167713761315,1.6591392900601099,6,-1,-1,8x2048x8192,0,
2026-03-03T03:25:41.939035+00:00,FULL,llm_style,eval,llm_style_eval_190,4,8192,2048,bf16,NVIDIA GeForce RTX 4060,c11,32,128,32,4,2,8,0.0,217.069,160.76800227165222,484.8230382800091,0.8348534913882316,5,-1,-1,4x8192x2048,0,
2026-03-03T03:25:42.266003+00:00,FULL,llm_style,eval,llm_style_eval_191,4,8192,8192,bf16,NVIDIA GeForce RTX 4060,c02,32,64,32,2,2,8,0.0,0.0,560.6399774551392,589.9062502384186,0.9576036914758883,4,-1,-1,4x8192x8192,0,
2026-03-03T03:25:42.279327+00:00,FULL,llm_style,eval,llm_style_eval_192,64,1536,1024,bf16,NVIDIA GeForce RTX 4060,c04,64,64,64,4,3,8,0.0,0.0,63.232000917196274,173.81695672869682,3.1839351764882737,3,-1,-1,64x1536x1024,0,
2026-03-03T03:25:42.300151+00:00,FULL,llm_style,eval,llm_style_eval_193,32,2048,2048,bf16,NVIDIA GeForce RTX 4060,c00,32,32,32,2,2,8,0.0,0.0,49.71200041472912,166.90847992897034,5.399811992286385,3,-1,-1,32x2048x2048,0,
2026-03-03T03:25:42.313957+00:00,FULL,llm_style,eval,llm_style_eval_194,8,1024,2048,bf16,NVIDIA GeForce RTX 4060,c04,64,64,64,4,3,8,0.0,0.0,43.96799951791763,79.35615837573998,0.7631557580036376,7,-1,-1,8x1024x2048,0,
2026-03-03T03:25:42.350031+00:00,FULL,llm_style,eval,llm_style_eval_195,2,4096,2048,bf16,NVIDIA GeForce RTX 4060,c00,32,32,32,2,2,8,0.0,0.0,57.64799937605858,179.7257545590399,0.5820571808765193,7,-1,-1,2x4096x2048,0,
2026-03-03T03:25:42.394252+00:00,FULL,llm_style,eval,llm_style_eval_196,32,2048,4096,bf16,NVIDIA GeForce RTX 4060,c00,32,32,32,2,2,8,0.0,0.0,63.839998096227646,73.78783896565437,8.409632330984108,3,-1,-1,32x2048x4096,0,
2026-03-03T03:25:42.548763+00:00,FULL,llm_style,eval,llm_style_eval_197,32,8192,1536,bf16,NVIDIA GeForce RTX 4060,c02,32,64,32,2,2,8,0.0,154.453,72.7040022611618,80.29632046818733,11.076506697763895,1,-1,-1,32x8192x1536,0,
2026-03-03T03:25:42.728608+00:00,FULL,llm_style,eval,llm_style_eval_198,64,4096,8192,bf16,NVIDIA GeForce RTX 4060,c00,32,32,32,2,2,8,0.0,0.0,303.1040132045746,317.59135991334915,14.169945328639345,2,-1,-1,64x4096x8192,0,
2026-03-03T03:25:43.143509+00:00,FULL,llm_style,eval,llm_style_eval_199,2,8192,4096,bf16,NVIDIA GeForce RTX 4060,c10,64,128,64,8,3,8,0.0,414.846,292.6719933748245,314.1494351625442,0.45859436857050956,5,-1,-1,2x8192x4096,0,
2026-03-03T03:25:43.220973+00:00,FULL,llm_style,eval,llm_style_eval_200,1,4096,1024,bf16,NVIDIA GeForce RTX 4060,c11,32,128,32,4,2,8,0.0,77.419,40.95999896526337,50.175998359918594,0.2048000051736833,7,-1,-1,1x4096x1024,0,
2026-03-03T03:25:43.442150+00:00,FULL,llm_style,eval,llm_style_eval_201,4,1536,8192,bf16,NVIDIA GeForce RTX 4060,c04,64,64,64,4,3,8,0.0,221.133,95.0240008533001,115.68416111171243,1.0593460083353674,6,-1,-1,4x1536x8192,0,
2026-03-03T03:25:43.690122+00:00,FULL,llm_style,eval,llm_style_eval_202,1,6144,3072,bf16,NVIDIA GeForce RTX 4060,c11,32,128,32,4,2,8,0.0,247.927,176.11200362443924,210.03423884510988,0.21434504873670956,5,-1,-1,1x6144x3072,0,
2026-03-03T03:25:43.884902+00:00,FULL,llm_style,eval,llm_style_eval_203,16,2048,6144,bf16,NVIDIA GeForce RTX 4060,c10,64,128,64,8,3,8,0.0,194.737,106.1439998447895,113.68448123335838,3.793461567199136,7,-1,-1,16x2048x6144,0,
2026-03-03T03:25:43.901856+00:00,FULL,llm_style,eval,llm_style_eval_204,16,1536,1024,bf16,NVIDIA GeForce RTX 4060,c04,64,64,64,4,3,8,0.0,0.0,43.007999658584595,112.77120009064669,1.1702857235759294,7,-1,-1,16x1536x1024,0,
2026-03-03T03:25:43.975947+00:00,FULL,llm_style,eval,llm_style_eval_205,64,6144,2048,bf16,NVIDIA GeForce RTX 4060,c10,64,128,64,8,3,8,0.0,0.0,85.37599816918373,201.93280130624765,18.864935936776515,1,-1,-1,64x6144x2048,0,
2026-03-03T03:25:44.047492+00:00,FULL,llm_style,eval,llm_style_eval_206,4,2048,6144,bf16,NVIDIA GeForce RTX 4060,c00,32,32,32,2,2,8,0.0,0.0,106.39999806880951,274.57536339759827,0.9460836261942454,7,-1,-1,4x2048x6144,0,
2026-03-03T03:25:44.170481+00:00,FULL,llm_style,eval,llm_style_eval_207,32,6144,1536,bf16,NVIDIA GeForce RTX 4060,c11,32,128,32,4,2,8,0.0,122.928,49.15200173854828,56.78527988493441,12.287999565362945,1,-1,-1,32x6144x1536,0,
2026-03-03T03:25:44.243729+00:00,FULL,llm_style,eval,llm_style_eval_208,4,2048,1024,bf16,NVIDIA GeForce RTX 4060,c11,32,128,32,4,2,8,0.0,73.203,41.600000113248825,128.45408171415318,0.403298460440551,7,-1,-1,4x2048x1024,0,
2026-03-03T03:25:44.305798+00:00,FULL,llm_style,eval,llm_style_eval_209,1,1024,1536,bf16,NVIDIA GeForce RTX 4060,c04,64,64,64,4,3,8,0.0,62.024,39.93599861860275,51.084159351885305,0.07876923349388026,7,-1,-1,1x1024x1536,0,
2026-03-03T03:25:44.621318+00:00,FULL,llm_style,eval,llm_style_eval_210,8,6144,4096,bf16,NVIDIA GeForce RTX 4060,c06,64,128,32,4,3,8,0.0,315.462,226.30399465560913,280.51167875528324,1.7792579605709575,5,-1,-1,8x6144x4096,0,
2026-03-03T03:25:44.875525+00:00,FULL,llm_style,eval,llm_style_eval_211,4,2048,8192,bf16,NVIDIA GeForce RTX 4060,c06,64,128,32,4,3,8,0.0,254.155,163.7439951300621,230.6153552234171,0.8196803057931416,6,-1,-1,4x2048x8192,0,
2026-03-03T03:25:44.965695+00:00,FULL,llm_style,eval,llm_style_eval_212,32,1024,1024,bf16,NVIDIA GeForce RTX 4060,c00,32,32,32,2,2,8,0.0,90.111,29.711998999118805,873.689251840113,2.2586452026331285,3,-1,-1,32x1024x1024,0,
2026-03-03T03:25:45.036828+00:00,FULL,llm_style,eval,llm_style_eval_213,16,3072,4096,bf16,NVIDIA GeForce RTX 4060,c00,32,32,32,2,2,8,0.0,0.0,89.08800035715103,170.53888216614723,4.519724119811601,7,-1,-1,16x3072x4096,0,
2026-03-03T03:25:45.087121+00:00,FULL,llm_style,eval,llm_style_eval_214,64,1024,8192,bf16,NVIDIA GeForce RTX 4060,c04,64,64,64,4,3,8,0.0,0.0,82.94399827718735,130.10943934321404,12.945382984935252,2,-1,-1,64x1024x8192,0,
2026-03-03T03:25:45.115694+00:00,FULL,llm_style,eval,llm_style_eval_215,4,4096,1536,bf16,NVIDIA GeForce RTX 4060,c00,32,32,32,2,2,8,0.0,0.0,46.17599956691265,163.97728666663167,1.0899958522189757,7,-1,-1,4x4096x1536,0,
2026-03-03T03:25:45.203367+00:00,FULL,llm_style,eval,llm_style_eval_216,16,1536,3072,bf16,NVIDIA GeForce RTX 4060,c04,64,64,64,4,3,8,0.0,87.619,52.22399905323982,58.33952076733112,2.891294170062848,7,-1,-1,16x1536x3072,0,
2026-03-03T03:25:45.271314+00:00,FULL,llm_style,eval,llm_style_eval_217,8,6144,2048,bf16,NVIDIA GeForce RTX 4060,c00,32,32,32,2,2,8,0.0,0.0,74.06400144100189,168.46656039357185,2.7182786250128994,5,-1,-1,8x6144x2048,0,
2026-03-03T03:25:45.457613+00:00,FULL,llm_style,eval,llm_style_eval_218,8,3072,4096,bf16,NVIDIA GeForce RTX 4060,c10,64,128,64,8,3,8,0.0,186.242,83.80800113081932,157.40992501378057,2.402235935513378,7,-1,-1,8x3072x4096,0,
2026-03-03T03:25:45.797451+00:00,FULL,llm_style,eval,llm_style_eval_219,64,8192,3072,bf16,NVIDIA GeForce RTX 4060,c06,64,128,32,4,3,8,0.0,339.793,237.39200085401535,245.7599937915802,13.569224996679221,1,-1,-1,64x8192x3072,0,
2026-03-03T03:25:45.838859+00:00,FULL,llm_style,eval,llm_style_eval_220,2,4096,2048,bf16,NVIDIA GeForce RTX 4060,c00,32,32,32,2,2,8,0.0,0.0,57.34400078654289,175.96416160464275,0.5851428491169093,7,-1,-1,2x4096x2048,0,
2026-03-03T03:25:45.994820+00:00,FULL,llm_style,eval,llm_style_eval_221,4,1024,8192,bf16,NVIDIA GeForce RTX 4060,c00,32,32,32,2,2,8,0.0,155.897,68.60800087451935,225.5769577622412,0.9781492412632574,6,-1,-1,4x1024x8192,0,
2026-03-03T03:25:46.062945+00:00,FULL,llm_style,eval,llm_style_eval_222,64,6144,2048,bf16,NVIDIA GeForce RTX 4060,c10,64,128,64,8,3,8,0.0,0.0,82.75200054049492,111.02336063981049,19.463127483085344,1,-1,-1,64x6144x2048,0,
2026-03-03T03:25:46.134285+00:00,FULL,llm_style,eval,llm_style_eval_223,4,2048,2048,bf16,NVIDIA GeForce RTX 4060,c00,32,32,32,2,2,8,0.0,71.289,42.7360013127327,124.31520022451878,0.7851560971850411,7,-1,-1,4x2048x2048,0,
2026-03-03T03:25:46.153435+00:00,FULL,llm_style,eval,llm_style_eval_224,16,3072,1536,bf16,NVIDIA GeForce RTX 4060,c11,32,128,32,4,2,8,0.0,0.0,45.96799984574318,142.5155198574066,3.2847838606574205,7,-1,-1,16x3072x1536,0,
2026-03-03T03:25:46.169449+00:00,FULL,llm_style,eval,llm_style_eval_225,1,2048,2048,bf16,NVIDIA GeForce RTX 4060,c00,32,32,32,2,2,8,0.0,0.0,42.688000947237015,108.26752305030817,0.1965097407669298,7,-1,-1,1x2048x2048,0,
2026-03-03T03:25:46.177967+00:00,FULL,llm_style,eval,llm_style_eval_226,8,1536,1024,bf16,NVIDIA GeForce RTX 4060,c00,32,32,32,2,2,8,0.0,0.0,29.69600073993206,46.039679497480364,0.8474482547462914,7,-1,-1,8x1536x1024,0,
2026-03-03T03:25:46.364495+00:00,FULL,llm_style,eval,llm_style_eval_227,64,6144,6144,bf16,NVIDIA GeForce RTX 4060,c06,64,128,32,4,3,8,0.0,0.0,353.2000035047531,407.7206403017044,13.680175991093886,1,-1,-1,64x6144x6144,0,
2026-03-03T03:25:46.435398+00:00,FULL,llm_style,eval,llm_style_eval_228,64,6144,2048,bf16,NVIDIA GeForce RTX 4060,c10,64,128,64,8,3,8,0.0,0.0,82.89599791169167,298.4620901942252,19.42931838176037,1,-1,-1,64x6144x2048,0,
2026-03-03T03:25:46.622096+00:00,FULL,llm_style,eval,llm_style_eval_229,16,1536,8192,bf16,NVIDIA GeForce RTX 4060,c04,64,64,64,4,3,8,0.0,186.645,97.20000252127647,101.57824225723743,4.142522361682674,6,-1,-1,16x1536x8192,0,
2026-03-03T03:25:46.644258+00:00,FULL,llm_style,eval,llm_style_eval_230,64,2048,1536,bf16,NVIDIA GeForce RTX 4060,c00,32,32,32,2,2,8,0.0,0.0,55.296000093221664,112.91648447513565,7.2817777655016735,3,-1,-1,64x2048x1536,0,
2026-03-03T03:25:46.689302+00:00,FULL,llm_style,eval,llm_style_eval_231,4,1024,8192,bf16,NVIDIA GeForce RTX 4060,c00,32,32,32,2,2,8,0.0,0.0,91.07200056314468,254.45855438709236,0.736877015822993,6,-1,-1,4x1024x8192,0,
2026-03-03T03:25:46.708627+00:00,FULL,llm_style,eval,llm_style_eval_232,16,3072,1536,bf16,NVIDIA GeForce RTX 4060,c11,32,128,32,4,2,8,0.0,0.0,43.99999976158142,129.00832250714302,3.431703291322314,7,-1,-1,16x3072x1536,0,
2026-03-03T03:25:46.757575+00:00,FULL,llm_style,eval,llm_style_eval_233,64,3072,3072,bf16,NVIDIA GeForce RTX 4060,c03,64,64,32,4,2,8,0.0,0.0,65.5680000782013,119.49055939912793,18.423004370413878,3,-1,-1,64x3072x3072,0,
2026-03-03T03:25:46.920483+00:00,FULL,llm_style,eval,llm_style_eval_234,32,8192,4096,bf16,NVIDIA GeForce RTX 4060,c11,32,128,32,4,2,8,0.0,0.0,320.8480030298233,447.78304219245905,6.69314949047817,1,-1,-1,32x8192x4096,0,
2026-03-03T03:25:46.934484+00:00,FULL,llm_style,eval,llm_style_eval_235,4,2048,1024,bf16,NVIDIA GeForce RTX 4060,c11,32,128,32,4,2,8,0.0,0.0,63.48799914121628,200.40576398372644,0.2642580680906711,7,-1,-1,4x2048x1024,0,
2026-03-03T03:25:47.059208+00:00,FULL,llm_style,eval,llm_style_eval_236,4,8192,3072,bf16,NVIDIA GeForce RTX 4060,c11,32,128,32,4,2,8,0.0,0.0,231.27999901771545,389.0278410911557,0.8704885543716164,5,-1,-1,4x8192x3072,0,
2026-03-03T03:25:47.083474+00:00,FULL,llm_style,eval,llm_style_eval_237,64,1024,4096,bf16,NVIDIA GeForce RTX 4060,c04,64,64,64,4,3,8,0.0,0.0,70.97600027918816,216.01920530199982,7.56411899639579,3,-1,-1,64x1024x4096,0,
2026-03-03T03:25:47.253216+00:00,FULL,llm_style,eval,llm_style_eval_238,32,2048,6144,bf16,NVIDIA GeForce RTX 4060,c04,64,64,64,4,3,8,0.0,169.684,105.20000010728836,144.9657597392796,7.655003490291894,3,-1,-1,32x2048x6144,0,
2026-03-03T03:25:47.261236+00:00,FULL,llm_style,eval,llm_style_eval_239,32,2048,6144,bf16,NVIDIA GeForce RTX 4060,c04,64,64,64,4,3,8,0.0,0.0,106.49599879980087,138.6684814095497,7.561846239067394,3,-1,-1,32x2048x6144,0,
2026-03-03T03:25:47.434690+00:00,FULL,llm_style,eval,llm_style_eval_240,8,8192,1536,bf16,NVIDIA GeForce RTX 4060,c11,32,128,32,4,2,8,0.0,173.421,93.18400174379349,104.02815796434878,2.1605274320965653,5,-1,-1,8x8192x1536,0,
2026-03-03T03:25:47.455110+00:00,FULL,llm_style,eval,llm_style_eval_241,16,1536,1536,bf16,NVIDIA GeForce RTX 4060,c04,64,64,64,4,3,8,0.0,0.0,46.08000069856644,604.6912217885236,1.6383999751620828,7,-1,-1,16x1536x1536,0,
2026-03-03T03:25:47.481811+00:00,FULL,llm_style,eval,llm_style_eval_242,1,2048,3072,bf16,NVIDIA GeForce RTX 4060,c00,32,32,32,2,2,8,0.0,0.0,71.16800174117088,148.70911866426465,0.17680575107001706,7,-1,-1,1x2048x3072,0,
2026-03-03T03:25:47.523336+00:00,FULL,llm_style,eval,llm_style_eval_243,8,1536,6144,bf16,NVIDIA GeForce RTX 4060,c04,64,64,64,4,3,8,0.0,0.0,80.89599758386612,239.52672123908997,1.8665317013176237,7,-1,-1,8x1536x6144,0,
2026-03-03T03:25:47.566598+00:00,FULL,llm_style,eval,llm_style_eval_244,32,8192,1024,bf16,NVIDIA GeForce RTX 4060,c02,32,64,32,2,2,8,0.0,0.0,56.12799897789955,91.72544181346885,9.565117620020505,1,-1,-1,32x8192x1024,0,
2026-03-03T03:25:47.698658+00:00,FULL,llm_style,eval,llm_style_eval_245,4,6144,4096,bf16,NVIDIA GeForce RTX 4060,c11,32,128,32,4,2,8,0.0,0.0,251.68000161647797,262.11647897958755,0.7999308276658036,5,-1,-1,4x6144x4096,0,
2026-03-03T03:25:47.763191+00:00,FULL,llm_style,eval,llm_style_eval_246,32,2048,6144,bf16,NVIDIA GeForce RTX 4060,c04,64,64,64,4,3,8,0.0,0.0,107.51999914646149,168.69183540344238,7.489828630885948,3,-1,-1,32x2048x6144,0,
2026-03-03T03:25:47.826904+00:00,FULL,llm_style,eval,llm_style_eval_247,64,6144,2048,bf16,NVIDIA GeForce RTX 4060,c10,64,128,64,8,3,8,0.0,0.0,66.51200167834759,94.75072227418423,24.215370088979316,1,-1,-1,64x6144x2048,0,
2026-03-03T03:25:47.836312+00:00,FULL,llm_style,eval,llm_style_eval_248,64,1024,1024,bf16,NVIDIA GeForce RTX 4060,c04,64,64,64,4,3,8,0.0,0.0,39.93599861860275,57.405440807342515,3.360820629072225,3,-1,-1,64x1024x1024,0,
2026-03-03T03:25:47.942002+00:00,FULL,llm_style,eval,llm_style_eval_249,2,8192,1024,bf16,NVIDIA GeForce RTX 4060,c00,32,32,32,2,2,8,0.0,105.65,45.45599967241287,115.61983793973914,0.7381738877555496,5,-1,-1,2x8192x1024,0,
2026-03-03T03:25:47.999047+00:00,FULL,llm_style,eval,llm_style_eval_250,64,3072,3072,bf16,NVIDIA GeForce RTX 4060,c03,64,64,32,4,2,8,0.0,0.0,64.51199948787689,73.76896262168884,18.72457157721487,3,-1,-1,64x3072x3072,0,
2026-03-03T03:25:48.048338+00:00,FULL,llm_style,eval,llm_style_eval_251,64,1024,8192,bf16,NVIDIA GeForce RTX 4060,c04,64,64,64,4,3,8,0.0,0.0,87.87199854850769,172.5046373903751,12.219385489534142,2,-1,-1,64x1024x8192,0,
2026-03-03T03:25:48.114071+00:00,FULL,llm_style,eval,llm_style_eval_252,64,4096,3072,bf16,NVIDIA GeForce RTX 4060,c04,64,64,64,4,3,8,0.0,0.0,88.92799913883209,238.56128230690948,18.11142442871736,3,-1,-1,64x4096x3072,0,
2026-03-03T03:25:48.236182+00:00,FULL,llm_style,eval,llm_style_eval_253,8,6144,4096,bf16,NVIDIA GeForce RTX 4060,c06,64,128,32,4,3,8,0.0,0.0,227.7119979262352,286.2806335091589,1.7682563398808484,5,-1,-1,8x6144x4096,0,
2026-03-03T03:25:48.318387+00:00,FULL,llm_style,eval,llm_style_eval_254,4,1536,3072,bf16,NVIDIA GeForce RTX 4060,c04,64,64,64,4,3,8,0.0,82.153,50.175998359918594,56.308158449828625,0.7523265552032206,7,-1,-1,4x1536x3072,0,
2026-03-03T03:25:48.346132+00:00,FULL,llm_style,eval,llm_style_eval_255,1,3072,1536,bf16,NVIDIA GeForce RTX 4060,c11,32,128,32,4,2,8,0.0,0.0,72.7040022611618,177.8988807648418,0.12980281286442064,7,-1,-1,1x3072x1536,0,
2026-03-03T03:25:48.794130+00:00,BUCKET,llm_style,tune,llm_style_tune_000,64,6144,6144,bf16,NVIDIA GeForce RTX 4060,c06,64,128,32,4,3,8,0.0,445.635,335.28000116348267,391.8543979525566,14.41135227640373,1,-1,-1,llm8_g1,0,
2026-03-03T03:25:48.862107+00:00,BUCKET,llm_style,tune,llm_style_tune_001,64,8192,1536,bf16,NVIDIA GeForce RTX 4060,c06,64,128,32,4,3,8,0.0,0.0,116.73600226640701,188.54783982038484,13.797052363711826,1,-1,-1,llm8_g1,0,
2026-03-03T03:25:49.165889+00:00,BUCKET,llm_style,tune,llm_style_tune_002,32,3072,8192,bf16,NVIDIA GeForce RTX 4060,c10,64,128,64,8,3,8,0.0,303.73,228.35199534893036,331.7964732646942,7.05320193738147,2,-1,-1,llm8_g2,0,
2026-03-03T03:25:49.401459+00:00,BUCKET,llm_style,tune,llm_style_tune_003,4,6144,3072,bf16,NVIDIA GeForce RTX 4060,c02,32,64,32,2,2,8,0.0,235.527,177.15199291706085,216.92479535937304,0.852346854888011,5,-1,-1,llm8_g5,0,
2026-03-03T03:25:49.446828+00:00,BUCKET,llm_style,tune,llm_style_tune_004,8,8192,1024,bf16,NVIDIA GeForce RTX 4060,c02,32,64,32,2,2,8,0.0,0.0,56.32000043988228,100.44416405260552,2.3831272541140724,5,-1,-1,llm8_g5,0,
2026-03-03T03:25:49.579148+00:00,BUCKET,llm_style,tune,llm_style_tune_005,32,8192,3072,bf16,NVIDIA GeForce RTX 4060,c06,64,128,32,4,3,8,0.0,0.0,258.41599702835083,401.9651252031323,6.232635574117726,1,-1,-1,llm8_g1,0,
2026-03-03T03:25:49.905624+00:00,BUCKET,llm_style,tune,llm_style_tune_006,16,4096,6144,bf16,NVIDIA GeForce RTX 4060,c11,32,128,32,4,2,8,0.0,326.427,225.2800017595291,238.63295882940292,3.5746908811711084,7,-1,-1,llm8_g7,0,
2026-03-03T03:25:49.930049+00:00,BUCKET,llm_style,tune,llm_style_tune_007,8,1536,2048,bf16,NVIDIA GeForce RTX 4060,c11,32,128,32,4,2,8,0.0,0.0,78.84799689054489,152.5625582039356,0.6383376875111909,7,-1,-1,llm8_g7,0,
2026-03-03T03:25:49.965463+00:00,BUCKET,llm_style,tune,llm_style_tune_008,16,1536,4096,bf16,NVIDIA GeForce RTX 4060,c11,32,128,32,4,2,8,0.0,0.0,101.74399986863136,209.32768121361727,1.978756410795197,7,-1,-1,llm8_g7,0,
2026-03-03T03:25:50.057243+00:00,BUCKET,llm_style,tune,llm_style_tune_009,64,1536,2048,bf16,NVIDIA GeForce RTX 4060,c11,32,128,32,4,2,8,0.0,91.724,51.19999870657921,59.89856153726578,7.864320198669438,3,-1,-1,llm8_g3,0,
2026-03-03T03:25:50.069511+00:00,BUCKET,llm_style,tune,llm_style_tune_010,2,2048,1024,bf16,NVIDIA GeForce RTX 4060,c11,32,128,32,4,2,8,0.0,0.0,35.72800010442734,380.5744022130966,0.2347908636218488,7,-1,-1,llm8_g7,0,
2026-03-03T03:25:50.370202+00:00,BUCKET,llm_style,tune,llm_style_tune_011,2,3072,8192,bf16,NVIDIA GeForce RTX 4060,c10,64,128,64,8,3,8,0.0,300.651,225.2800017595291,272.64799833297724,0.44683636014638856,6,-1,-1,llm8_g6,0,
2026-03-03T03:25:50.402370+00:00,BUCKET,llm_style,tune,llm_style_tune_012,64,2048,1536,bf16,NVIDIA GeForce RTX 4060,c11,32,128,32,4,2,8,0.0,0.0,60.416001826524734,295.6435260176658,6.664677764612043,3,-1,-1,llm8_g3,0,
2026-03-03T03:25:50.573773+00:00,BUCKET,llm_style,tune,llm_style_tune_013,16,8192,4096,bf16,NVIDIA GeForce RTX 4060,c02,32,64,32,2,2,8,0.0,0.0,319.487988948822,349.43454772233963,3.360820629072225,5,-1,-1,llm8_g5,0,
2026-03-03T03:25:50.736030+00:00,BUCKET,llm_style,tune,llm_style_tune_014,4,8192,4096,bf16,NVIDIA GeForce RTX 4060,c02,32,64,32,2,2,8,0.0,0.0,294.9120104312897,315.9142315387726,0.9102221900268849,5,-1,-1,llm8_g5,0,
2026-03-03T03:25:50.763365+00:00,BUCKET,llm_style,tune,llm_style_tune_015,4,3072,2048,bf16,NVIDIA GeForce RTX 4060,c11,32,128,32,4,2,8,0.0,0.0,63.48799914121628,149.58783678710446,0.7927742042720133,7,-1,-1,llm8_g7,0,
2026-03-03T03:25:50.774575+00:00,BUCKET,llm_style,tune,llm_style_tune_016,16,1536,1024,bf16,NVIDIA GeForce RTX 4060,c11,32,128,32,4,2,8,0.0,0.0,50.00000074505806,161.95328086614603,1.0066329450000002,7,-1,-1,llm8_g7,0,
2026-03-03T03:25:50.787128+00:00,BUCKET,llm_style,tune,llm_style_tune_017,32,1024,2048,bf16,NVIDIA GeForce RTX 4060,c11,32,128,32,4,2,8,0.0,0.0,59.4559982419014,73.21408219635487,2.257429560831266,3,-1,-1,llm8_g3,0,
2026-03-03T03:25:50.803462+00:00,BUCKET,llm_style,tune,llm_style_tune_018,64,1536,2048,bf16,NVIDIA GeForce RTX 4060,c11,32,128,32,4,2,8,0.0,0.0,60.48000045120716,70.65600156784058,6.65762534715661,3,-1,-1,llm8_g3,0,
2026-03-03T03:25:50.826114+00:00,BUCKET,llm_style,tune,llm_style_tune_019,4,4096,1536,bf16,NVIDIA GeForce RTX 4060,c11,32,128,32,4,2,8,0.0,0.0,56.12799897789955,134.78688351809973,0.8967297768769225,7,-1,-1,llm8_g7,0,
2026-03-03T03:25:50.886999+00:00,BUCKET,llm_style,tune,llm_style_tune_020,1,8192,1536,bf16,NVIDIA GeForce RTX 4060,c02,32,64,32,2,2,8,0.0,0.0,68.97599995136261,224.6764835715294,0.3648489912106429,5,-1,-1,llm8_g5,0,
2026-03-03T03:25:50.912131+00:00,BUCKET,llm_style,tune,llm_style_tune_021,64,1536,4096,bf16,NVIDIA GeForce RTX 4060,c11,32,128,32,4,2,8,0.0,0.0,72.64000177383423,90.65472088754177,11.08626580857382,3,-1,-1,llm8_g3,0,
2026-03-03T03:25:50.941245+00:00,BUCKET,llm_style,tune,llm_style_tune_022,64,1024,6144,bf16,NVIDIA GeForce RTX 4060,c11,32,128,32,4,2,8,0.0,0.0,100.03200173377991,112.99903981387615,8.050487384459242,3,-1,-1,llm8_g3,0,
2026-03-03T03:25:50.959258+00:00,BUCKET,llm_style,tune,llm_style_tune_023,8,4096,1024,bf16,NVIDIA GeForce RTX 4060,c11,32,128,32,4,2,8,0.0,0.0,58.927999809384346,156.3238368183373,1.138828132926257,7,-1,-1,llm8_g7,0,
2026-03-03T03:25:51.039937+00:00,BUCKET,llm_style,tune,llm_style_tune_024,8,4096,4096,bf16,NVIDIA GeForce RTX 4060,c11,32,128,32,4,2,8,0.0,0.0,162.63999789953232,283.6918373405932,1.650488560420548,7,-1,-1,llm8_g7,0,
2026-03-03T03:25:51.064545+00:00,BUCKET,llm_style,tune,llm_style_tune_025,32,6144,1024,bf16,NVIDIA GeForce RTX 4060,c06,64,128,32,4,3,8,0.0,0.0,54.76799979805946,204.7603149712084,7.351978992927669,1,-1,-1,llm8_g1,0,
2026-03-03T03:25:51.084775+00:00,BUCKET,llm_style,tune,llm_style_tune_026,1,3072,1536,bf16,NVIDIA GeForce RTX 4060,c11,32,128,32,4,2,8,0.0,0.0,67.58400052785873,151.11775934696198,0.13963636254574643,7,-1,-1,llm8_g7,0,
2026-03-03T03:25:51.121971+00:00,BUCKET,llm_style,tune,llm_style_tune_027,1,6144,1536,bf16,NVIDIA GeForce RTX 4060,c02,32,64,32,2,2,8,0.0,0.0,48.91199991106987,121.39520004391669,0.3858842008978723,5,-1,-1,llm8_g5,0,
2026-03-03T03:25:51.155707+00:00,BUCKET,llm_style,tune,llm_style_tune_028,4,4096,1536,bf16,NVIDIA GeForce RTX 4060,c11,32,128,32,4,2,8,0.0,0.0,54.27199974656105,119.42335844039913,0.9273962307458418,7,-1,-1,llm8_g7,0,
2026-03-03T03:25:51.186363+00:00,BUCKET,llm_style,tune,llm_style_tune_029,16,1024,6144,bf16,NVIDIA GeForce RTX 4060,c11,32,128,32,4,2,8,0.0,0.0,99.27999973297119,246.34208038449282,2.027866564680689,7,-1,-1,llm8_g7,0,
2026-03-03T03:25:51.346544+00:00,BUCKET,llm_style,tune,llm_style_tune_030,64,4096,8192,bf16,NVIDIA GeForce RTX 4060,c10,64,128,64,8,3,8,0.0,0.0,304.48000133037567,388.5260698199271,14.105909344567266,2,-1,-1,llm8_g2,0,
2026-03-03T03:25:51.371051+00:00,BUCKET,llm_style,tune,llm_style_tune_031,1,6144,1024,bf16,NVIDIA GeForce RTX 4060,c02,32,64,32,2,2,8,0.0,0.0,35.19999980926514,50.665598288178444,0.3574690928460744,5,-1,-1,llm8_g5,0,
2026-03-03T03:25:51.953454+00:00,BUCKET,llm_style,tune,llm_style_tune_032,32,6144,8192,bf16,NVIDIA GeForce RTX 4060,c00,32,32,32,2,2,8,0.0,582.35,429.4719994068146,469.9727955460547,7.500431870876674,0,-1,-1,llm8_g0,0,
2026-03-03T03:25:52.120801+00:00,BUCKET,llm_style,tune,llm_style_tune_033,2,4096,8192,bf16,NVIDIA GeForce RTX 4060,c10,64,128,64,8,3,8,0.0,0.0,300.03198981285095,435.456640124321,0.4473447250865487,6,-1,-1,llm8_g6,0,
2026-03-03T03:25:52.359982+00:00,BUCKET,llm_style,tune,llm_style_tune_034,1,8192,6144,bf16,NVIDIA GeForce RTX 4060,c02,32,64,32,2,2,8,0.0,0.0,425.9839951992035,524.9216133356092,0.23630769497085607,5,-1,-1,llm8_g5,0,
2026-03-03T03:25:52.374103+00:00,BUCKET,llm_style,tune,llm_style_tune_035,64,1536,1024,bf16,NVIDIA GeForce RTX 4060,c11,32,128,32,4,2,8,0.0,0.0,45.423999428749084,158.94528150558466,4.432163493568982,3,-1,-1,llm8_g3,0,
2026-03-03T03:25:52.403864+00:00,BUCKET,llm_style,tune,llm_style_tune_036,32,3072,2048,bf16,NVIDIA GeForce RTX 4060,c11,32,128,32,4,2,8,0.0,0.0,79.8719972372055,109.47584345936767,5.041230943608337,3,-1,-1,llm8_g3,0,
2026-03-03T03:25:52.444810+00:00,BUCKET,llm_style,tune,llm_style_tune_037,4,1536,6144,bf16,NVIDIA GeForce RTX 4060,c11,32,128,32,4,2,8,0.0,0.0,118.78400295972824,144.40063625574112,0.6355861910597185,7,-1,-1,llm8_g7,0,
2026-03-03T03:25:52.475600+00:00,BUCKET,llm_style,tune,llm_style_tune_038,1,4096,1536,bf16,NVIDIA GeForce RTX 4060,c11,32,128,32,4,2,8,0.0,0.0,46.08000069856644,216.21471524238564,0.2730666625270138,7,-1,-1,llm8_g7,0,
2026-03-03T03:25:52.502418+00:00,BUCKET,llm_style,tune,llm_style_tune_039,4,1536,4096,bf16,NVIDIA GeForce RTX 4060,c11,32,128,32,4,2,8,0.0,0.0,78.78400012850761,187.35135957598686,0.6388562134177258,7,-1,-1,llm8_g7,0,
2026-03-03T03:25:52.564075+00:00,BUCKET,llm_style,tune,llm_style_tune_040,16,3072,4096,bf16,NVIDIA GeForce RTX 4060,c11,32,128,32,4,2,8,0.0,0.0,97.28000313043594,129.27808247506613,4.139115656278409,7,-1,-1,llm8_g7,0,
2026-03-03T03:25:52.574200+00:00,BUCKET,llm_style,tune,llm_style_tune_041,16,1024,1536,bf16,NVIDIA GeForce RTX 4060,c11,32,128,32,4,2,8,0.0,0.0,51.19999870657921,173.3523187041282,0.9830400248336798,7,-1,-1,llm8_g7,0,
2026-03-03T03:25:52.600819+00:00,BUCKET,llm_style,tune,llm_style_tune_042,32,3072,2048,bf16,NVIDIA GeForce RTX 4060,c11,32,128,32,4,2,8,0.0,0.0,73.05600121617317,144.4985570013523,5.511568896421619,3,-1,-1,llm8_g3,0,
2026-03-03T03:25:52.636404+00:00,BUCKET,llm_style,tune,llm_style_tune_043,2,2048,4096,bf16,NVIDIA GeForce RTX 4060,c11,32,128,32,4,2,8,0.0,0.0,74.04800131917,117.22783789038647,0.45314433073446403,7,-1,-1,llm8_g7,0,
2026-03-03T03:25:52.728974+00:00,BUCKET,llm_style,tune,llm_style_tune_044,64,2048,8192,bf16,NVIDIA GeForce RTX 4060,c10,64,128,64,8,3,8,0.0,0.0,193.31199675798416,314.33119371533365,11.108900037324274,2,-1,-1,llm8_g2,0,
2026-03-03T03:25:52.854350+00:00,BUCKET,llm_style,tune,llm_style_tune_045,2,3072,8192,bf16,NVIDIA GeForce RTX 4060,c10,64,128,64,8,3,8,0.0,0.0,256.0480087995529,280.3260800242424,0.3931422723103628,6,-1,-1,llm8_g6,0,
2026-03-03T03:25:53.098218+00:00,BUCKET,llm_style,tune,llm_style_tune_046,4,8192,6144,bf16,NVIDIA GeForce RTX 4060,c02,32,64,32,2,2,8,0.0,0.0,451.4399915933609,535.6351804733276,0.8919306917821624,5,-1,-1,llm8_g5,0,
2026-03-03T03:25:53.134119+00:00,BUCKET,llm_style,tune,llm_style_tune_047,1,1024,6144,bf16,NVIDIA GeForce RTX 4060,c11,32,128,32,4,2,8,0.0,0.0,116.52800068259239,204.43392485380167,0.1079818749681827,7,-1,-1,llm8_g7,0,
2026-03-03T03:25:53.198081+00:00,BUCKET,llm_style,tune,llm_style_tune_048,32,4096,3072,bf16,NVIDIA GeForce RTX 4060,c11,32,128,32,4,2,8,0.0,0.0,87.35999837517738,209.90976005792606,9.218250720902269,3,-1,-1,llm8_g3,0,
2026-03-03T03:25:53.212805+00:00,BUCKET,llm_style,tune,llm_style_tune_049,16,2048,1024,bf16,NVIDIA GeForce RTX 4060,c11,32,128,32,4,2,8,0.0,0.0,66.51199981570244,225.5257537961004,1.0089737819634264,7,-1,-1,llm8_g7,0,
2026-03-03T03:25:53.223830+00:00,BUCKET,llm_style,tune,llm_style_tune_050,4,1024,1536,bf16,NVIDIA GeForce RTX 4060,c11,32,128,32,4,2,8,0.0,0.0,49.60000142455101,160.3228822350502,0.2536877346493726,7,-1,-1,llm8_g7,0,
2026-03-03T03:25:53.776455+00:00,BUCKET,llm_style,tune,llm_style_tune_051,2,6144,8192,bf16,NVIDIA GeForce RTX 4060,c03,64,64,32,4,2,8,0.0,552.588,427.39200592041016,1173.53056669235,0.47105839419348305,4,-1,-1,llm8_g4,0,
2026-03-03T03:25:53.796498+00:00,BUCKET,llm_style,tune,llm_style_tune_052,16,2048,1536,bf16,NVIDIA GeForce RTX 4060,c11,32,128,32,4,2,8,0.0,0.0,48.976000398397446,134.344000890851,2.0553596696575864,7,-1,-1,llm8_g7,0,
2026-03-03T03:25:53.807325+00:00,BUCKET,llm_style,tune,llm_style_tune_053,64,1024,1024,bf16,NVIDIA GeForce RTX 4060,c11,32,128,32,4,2,8,0.0,0.0,47.10400104522705,179.60575312376014,2.8493912411204825,3,-1,-1,llm8_g3,0,
2026-03-03T03:25:53.974890+00:00,BUCKET,llm_style,tune,llm_style_tune_054,4,4096,8192,bf16,NVIDIA GeForce RTX 4060,c10,64,128,64,8,3,8,0.0,0.0,322.56001234054565,343.0012795329094,0.8322031427646303,6,-1,-1,llm8_g6,0,
2026-03-03T03:25:54.039442+00:00,BUCKET,llm_style,tune,llm_style_tune_055,1,4096,3072,bf16,NVIDIA GeForce RTX 4060,c11,32,128,32,4,2,8,0.0,0.0,106.39999806880951,229.1072089970108,0.23652090654856134,7,-1,-1,llm8_g7,0,
2026-03-03T03:25:54.059255+00:00,BUCKET,llm_style,tune,llm_style_tune_056,64,1536,2048,bf16,NVIDIA GeForce RTX 4060,c11,32,128,32,4,2,8,0.0,0.0,52.079999819397926,190.79328328371025,7.731435971511393,3,-1,-1,llm8_g3,0,
2026-03-03T03:25:54.096562+00:00,BUCKET,llm_style,tune,llm_style_tune_057,2,4096,2048,bf16,NVIDIA GeForce RTX 4060,c11,32,128,32,4,2,8,0.0,0.0,54.27199974656105,73.59456118196243,0.6182641538305611,7,-1,-1,llm8_g7,0,
2026-03-03T03:25:54.155046+00:00,BUCKET,llm_style,tune,llm_style_tune_058,4,8192,1536,bf16,NVIDIA GeForce RTX 4060,c02,32,64,32,2,2,8,0.0,0.0,66.56000018119812,127.5644808262586,1.5123692266520663,5,-1,-1,llm8_g5,0,
2026-03-03T03:25:54.181075+00:00,BUCKET,llm_style,tune,llm_style_tune_059,1,1536,4096,bf16,NVIDIA GeForce RTX 4060,c11,32,128,32,4,2,8,0.0,0.0,70.46400010585785,167.9257608950137,0.1785722068162002,7,-1,-1,llm8_g7,0,
2026-03-03T03:25:54.207334+00:00,BUCKET,llm_style,tune,llm_style_tune_060,64,1536,4096,bf16,NVIDIA GeForce RTX 4060,c11,32,128,32,4,2,8,0.0,0.0,83.96799862384796,217.74335891008366,9.590634303522425,3,-1,-1,llm8_g3,0,
2026-03-03T03:25:54.455740+00:00,BUCKET,llm_style,tune,llm_style_tune_061,8,8192,6144,bf16,NVIDIA GeForce RTX 4060,c02,32,64,32,2,2,8,0.0,0.0,450.27199387550354,515.8502280712127,1.7884886889559928,5,-1,-1,llm8_g5,0,
2026-03-03T03:25:54.499763+00:00,BUCKET,llm_style,tune,llm_style_tune_062,64,6144,1536,bf16,NVIDIA GeForce RTX 4060,c06,64,128,32,4,3,8,0.0,0.0,75.6480023264885,167.44224078953246,15.968161945461281,1,-1,-1,llm8_g1,0,
2026-03-03T03:25:54.515129+00:00,BUCKET,llm_style,tune,llm_style_tune_063,2,1536,1024,bf16,NVIDIA GeForce RTX 4060,c11,32,128,32,4,2,8,0.0,0.0,49.15200173854828,325.03807708620957,0.1279999954725307,7,-1,-1,llm8_g7,0,
2026-03-03T03:25:54.526841+00:00,BUCKET,llm_style,eval,llm_style_eval_000,32,1536,1024,bf16,NVIDIA GeForce RTX 4060,c11,32,128,32,4,2,8,0.0,0.0,40.95999896526337,57.866240963339806,2.4576000620842,3,-1,-1,llm8_g3,0,
2026-03-03T03:25:54.614133+00:00,BUCKET,llm_style,eval,llm_style_eval_001,32,2048,8192,bf16,NVIDIA GeForce RTX 4060,c10,64,128,64,8,3,8,0.0,0.0,164.86400365829468,179.0102431178093,6.512894265418245,2,-1,-1,llm8_g2,0,
2026-03-03T03:25:54.660571+00:00,BUCKET,llm_style,eval,llm_style_eval_002,16,2048,4096,bf16,NVIDIA GeForce RTX 4060,c11,32,128,32,4,2,8,0.0,0.0,78.84799689054489,91.23392179608345,3.4044676667263514,7,-1,-1,llm8_g7,0,
2026-03-03T03:25:54.676752+00:00,BUCKET,llm_style,eval,llm_style_eval_003,16,2048,1536,bf16,NVIDIA GeForce RTX 4060,c11,32,128,32,4,2,8,0.0,0.0,45.48799991607666,125.05088128149507,2.2129637747476103,7,-1,-1,llm8_g7,0,
2026-03-03T03:25:54.763467+00:00,BUCKET,llm_style,eval,llm_style_eval_004,64,8192,2048,bf16,NVIDIA GeForce RTX 4060,c06,64,128,32,4,3,8,0.0,0.0,173.5680028796196,256.54495626688,12.372577965821362,1,-1,-1,llm8_g1,0,
2026-03-03T03:25:54.889690+00:00,BUCKET,llm_style,eval,llm_style_eval_005,64,3072,8192,bf16,NVIDIA GeForce RTX 4060,c10,64,128,64,8,3,8,0.0,0.0,232.54400491714478,246.28223776817322,13.852111445090662,2,-1,-1,llm8_g2,0,
2026-03-03T03:25:54.908512+00:00,BUCKET,llm_style,eval,llm_style_eval_006,32,2048,2048,bf16,NVIDIA GeForce RTX 4060,c11,32,128,32,4,2,8,0.0,0.0,56.07999861240387,139.7788818180561,4.786652329563842,3,-1,-1,llm8_g3,0,
2026-03-03T03:25:54.991383+00:00,BUCKET,llm_style,eval,llm_style_eval_007,8,8192,2048,bf16,NVIDIA GeForce RTX 4060,c02,32,64,32,2,2,8,0.0,0.0,161.77599877119064,262.3033642768859,1.6593033456073056,5,-1,-1,llm8_g5,0,
2026-03-03T03:25:55.055737+00:00,BUCKET,llm_style,eval,llm_style_eval_008,64,1536,8192,bf16,NVIDIA GeForce RTX 4060,c10,64,128,64,8,3,8,0.0,0.0,131.96799904108047,198.5206426680088,12.204570408759706,2,-1,-1,llm8_g2,0,
2026-03-03T03:25:55.178791+00:00,BUCKET,llm_style,eval,llm_style_eval_009,64,4096,6144,bf16,NVIDIA GeForce RTX 4060,c11,32,128,32,4,2,8,0.0,0.0,235.4400008916855,281.95296078920353,13.681725534319588,3,-1,-1,llm8_g3,0,
2026-03-03T03:25:55.226613+00:00,BUCKET,llm_style,eval,llm_style_eval_010,64,2048,4096,bf16,NVIDIA GeForce RTX 4060,c11,32,128,32,4,2,8,0.0,0.0,89.55200016498566,181.48639708757395,11.990148986307368,3,-1,-1,llm8_g3,0,
2026-03-03T03:25:55.318920+00:00,BUCKET,llm_style,eval,llm_style_eval_011,32,3072,6144,bf16,NVIDIA GeForce RTX 4060,c11,32,128,32,4,2,8,0.0,0.0,182.27200210094452,205.8284744620323,6.627235878667844,3,-1,-1,llm8_g3,0,
2026-03-03T03:25:55.331625+00:00,BUCKET,llm_style,eval,llm_style_eval_012,16,1536,1536,bf16,NVIDIA GeForce RTX 4060,c11,32,128,32,4,2,8,0.0,0.0,44.91199925541878,146.27840086817736,1.6810089341745567,7,-1,-1,llm8_g7,0,
2026-03-03T03:25:55.359266+00:00,BUCKET,llm_style,eval,llm_style_eval_013,64,2048,3072,bf16,NVIDIA GeForce RTX 4060,c11,32,128,32,4,2,8,0.0,0.0,70.36799937486649,209.72415953874582,11.444212925678732,3,-1,-1,llm8_g3,0,
2026-03-03T03:25:55.639622+00:00,BUCKET,llm_style,eval,llm_style_eval_014,16,8192,6144,bf16,NVIDIA GeForce RTX 4060,c02,32,64,32,2,2,8,0.0,0.0,436.0160082578659,457.22623467445374,3.6939302812190817,5,-1,-1,llm8_g5,0,
2026-03-03T03:25:55.682927+00:00,BUCKET,llm_style,eval,llm_style_eval_015,64,6144,1536,bf16,NVIDIA GeForce RTX 4060,c06,64,128,32,4,3,8,0.0,0.0,102.39999741315842,113.18272106349468,11.796480298004159,1,-1,-1,llm8_g1,0,
2026-03-03T03:25:55.769488+00:00,BUCKET,llm_style,eval,llm_style_eval_016,16,4096,4096,bf16,NVIDIA GeForce RTX 4060,c11,32,128,32,4,2,8,0.0,0.0,165.3600037097931,243.29215660691258,3.2466793659620907,7,-1,-1,llm8_g7,0,
2026-03-03T03:25:55.946299+00:00,BUCKET,llm_style,eval,llm_style_eval_017,64,8192,4096,bf16,NVIDIA GeForce RTX 4060,c06,64,128,32,4,3,8,0.0,0.0,494.59201097488403,624.5708966255188,8.68385902055766,1,-1,-1,llm8_g1,0,
2026-03-03T03:25:56.089087+00:00,BUCKET,llm_style,eval,llm_style_eval_018,32,4096,6144,bf16,NVIDIA GeForce RTX 4060,c11,32,128,32,4,2,8,0.0,0.0,388.032004237175,439.95519459247583,4.150721379712671,3,-1,-1,llm8_g3,0,
2026-03-03T03:25:56.224584+00:00,BUCKET,llm_style,eval,llm_style_eval_019,16,3072,8192,bf16,NVIDIA GeForce RTX 4060,c10,64,128,64,8,3,8,0.0,0.0,389.1040086746216,605.5631953477857,2.069642949048662,6,-1,-1,llm8_g6,0,
2026-03-03T03:25:56.242943+00:00,BUCKET,llm_style,eval,llm_style_eval_020,4,1536,1536,bf16,NVIDIA GeForce RTX 4060,c11,32,128,32,4,2,8,0.0,0.0,90.83199873566628,155.6172765791415,0.20779426042277274,7,-1,-1,llm8_g7,0,
2026-03-03T03:25:56.290183+00:00,BUCKET,llm_style,eval,llm_style_eval_021,4,6144,1536,bf16,NVIDIA GeForce RTX 4060,c02,32,64,32,2,2,8,0.0,0.0,79.8719972372055,139.28447499871254,0.9452308019265633,5,-1,-1,llm8_g5,0,
2026-03-03T03:25:56.318930+00:00,BUCKET,llm_style,eval,llm_style_eval_022,32,6144,1024,bf16,NVIDIA GeForce RTX 4060,c06,64,128,32,4,3,8,0.0,0.0,88.06400001049042,153.13567847013468,4.57227906922278,1,-1,-1,llm8_g1,0,
2026-03-03T03:25:56.329990+00:00,BUCKET,llm_style,eval,llm_style_eval_023,16,1024,1536,bf16,NVIDIA GeForce RTX 4060,c11,32,128,32,4,2,8,0.0,0.0,71.68000191450119,92.25631728768346,0.7021714098171316,7,-1,-1,llm8_g7,0,
2026-03-03T03:25:56.365999+00:00,BUCKET,llm_style,eval,llm_style_eval_024,32,8192,1024,bf16,NVIDIA GeForce RTX 4060,c06,64,128,32,4,3,8,0.0,0.0,115.42399972677231,129.5462429523468,4.651293606796353,1,-1,-1,llm8_g1,0,
2026-03-03T03:25:56.558503+00:00,BUCKET,llm_style,eval,llm_style_eval_025,32,6144,6144,bf16,NVIDIA GeForce RTX 4060,c06,64,128,32,4,3,8,0.0,0.0,506.3360035419464,586.0659354925153,4.771375306318422,1,-1,-1,llm8_g1,0,
2026-03-03T03:25:56.629506+00:00,BUCKET,llm_style,eval,llm_style_eval_026,1,6144,2048,bf16,NVIDIA GeForce RTX 4060,c02,32,64,32,2,2,8,0.0,0.0,130.99200278520584,157.235197275877,0.19211725498437995,5,-1,-1,llm8_g5,0,
2026-03-03T03:25:56.696814+00:00,BUCKET,llm_style,eval,llm_style_eval_027,32,4096,3072,bf16,NVIDIA GeForce RTX 4060,c11,32,128,32,4,2,8,0.0,0.0,138.12800496816635,244.0192006528377,5.830145510214202,3,-1,-1,llm8_g3,0,
2026-03-03T03:25:56.711080+00:00,BUCKET,llm_style,eval,llm_style_eval_028,64,1536,1536,bf16,NVIDIA GeForce RTX 4060,c11,32,128,32,4,2,8,0.0,0.0,76.65600255131721,122.52160422503945,3.9395465188500207,3,-1,-1,llm8_g3,0,
2026-03-03T03:25:56.725423+00:00,BUCKET,llm_style,eval,llm_style_eval_029,2,3072,1024,bf16,NVIDIA GeForce RTX 4060,c11,32,128,32,4,2,8,0.0,0.0,58.78400057554245,115.45343697071067,0.2140533457540013,7,-1,-1,llm8_g7,0,
2026-03-03T03:25:56.799064+00:00,BUCKET,llm_style,eval,llm_style_eval_030,32,1536,8192,bf16,NVIDIA GeForce RTX 4060,c10,64,128,64,8,3,8,0.0,0.0,300.3999888896942,341.8864032626151,2.680780285566873,2,-1,-1,llm8_g2,0,
2026-03-03T03:25:56.830507+00:00,BUCKET,llm_style,eval,llm_style_eval_031,8,3072,2048,bf16,NVIDIA GeForce RTX 4060,c11,32,128,32,4,2,8,0.0,0.0,93.18400174379349,171.02847829461098,1.0802637160482826,7,-1,-1,llm8_g7,0,
2026-03-03T03:25:56.859658+00:00,BUCKET,llm_style,eval,llm_style_eval_032,8,2048,3072,bf16,NVIDIA GeForce RTX 4060,c11,32,128,32,4,2,8,0.0,0.0,121.8079999089241,223.87455657124514,0.8264095632082129,7,-1,-1,llm8_g7,0,
2026-03-03T03:25:56.936834+00:00,BUCKET,llm_style,eval,llm_style_eval_033,64,1536,8192,bf16,NVIDIA GeForce RTX 4060,c10,64,128,64,8,3,8,0.0,0.0,279.55201268196106,401.6134330630302,5.761406332038652,2,-1,-1,llm8_g2,0,
2026-03-03T03:25:57.001866+00:00,BUCKET,llm_style,eval,llm_style_eval_034,64,6144,2048,bf16,NVIDIA GeForce RTX 4060,c06,64,128,32,4,3,8,0.0,0.0,164.75199908018112,177.67840042710304,9.775982962222818,1,-1,-1,llm8_g1,0,
2026-03-03T03:25:57.040513+00:00,BUCKET,llm_style,eval,llm_style_eval_035,4,4096,2048,bf16,NVIDIA GeForce RTX 4060,c11,32,128,32,4,2,8,0.0,0.0,98.30400347709656,186.4703960716724,0.6826666425201637,7,-1,-1,llm8_g7,0,
2026-03-03T03:25:57.220213+00:00,BUCKET,llm_style,eval,llm_style_eval_036,64,8192,4096,bf16,NVIDIA GeForce RTX 4060,c06,64,128,32,4,3,8,0.0,0.0,498.6880123615265,617.8201448917387,8.612533667415171,1,-1,-1,llm8_g1,0,
2026-03-03T03:25:57.259005+00:00,BUCKET,llm_style,eval,llm_style_eval_037,32,6144,1024,bf16,NVIDIA GeForce RTX 4060,c06,64,128,32,4,3,8,0.0,0.0,124.92799758911133,243.10176387429232,3.2230820294128772,1,-1,-1,llm8_g1,0,
2026-03-03T03:25:57.327375+00:00,BUCKET,llm_style,eval,llm_style_eval_038,64,6144,2048,bf16,NVIDIA GeForce RTX 4060,c06,64,128,32,4,3,8,0.0,0.0,174.0799993276596,288.9420846104621,9.252141212204666,1,-1,-1,llm8_g1,0,
2026-03-03T03:25:57.348114+00:00,BUCKET,llm_style,eval,llm_style_eval_039,8,1024,3072,bf16,NVIDIA GeForce RTX 4060,c11,32,128,32,4,2,8,0.0,0.0,117.76000261306763,228.52607846260037,0.4274086861680723,7,-1,-1,llm8_g7,0,
2026-03-03T03:25:57.437163+00:00,BUCKET,llm_style,eval,llm_style_eval_040,32,8192,2048,bf16,NVIDIA GeForce RTX 4060,c06,64,128,32,4,3,8,0.0,0.0,270.28799057006836,339.34335917234404,3.97258428587728,1,-1,-1,llm8_g1,0,
2026-03-03T03:25:57.452564+00:00,BUCKET,llm_style,eval,llm_style_eval_041,32,3072,1024,bf16,NVIDIA GeForce RTX 4060,c11,32,128,32,4,2,8,0.0,0.0,64.51199948787689,74.27072279155254,3.1207619295358113,3,-1,-1,llm8_g3,0,
2026-03-03T03:25:57.476928+00:00,BUCKET,llm_style,eval,llm_style_eval_042,64,1024,4096,bf16,NVIDIA GeForce RTX 4060,c11,32,128,32,4,2,8,0.0,0.0,155.13599663972855,174.20287936925888,3.460646939644654,3,-1,-1,llm8_g3,0,
2026-03-03T03:25:57.488093+00:00,BUCKET,llm_style,eval,llm_style_eval_043,2,1536,1024,bf16,NVIDIA GeForce RTX 4060,c11,32,128,32,4,2,8,0.0,0.0,60.416001826524734,113.5308772325515,0.10413559007206317,7,-1,-1,llm8_g7,0,
2026-03-03T03:25:57.600636+00:00,BUCKET,llm_style,eval,llm_style_eval_044,64,6144,3072,bf16,NVIDIA GeForce RTX 4060,c06,64,128,32,4,3,8,0.0,0.0,297.34399914741516,384.2867153882978,8.124997009952274,1,-1,-1,llm8_g1,0,
2026-03-03T03:25:57.651390+00:00,BUCKET,llm_style,eval,llm_style_eval_045,64,1536,6144,bf16,NVIDIA GeForce RTX 4060,c11,32,128,32,4,2,8,0.0,0.0,245.7599937915802,352.8192037343979,4.9152001241684,3,-1,-1,llm8_g3,0,
2026-03-03T03:25:57.754943+00:00,BUCKET,llm_style,eval,llm_style_eval_046,2,6144,3072,bf16,NVIDIA GeForce RTX 4060,c02,32,64,32,2,2,8,0.0,0.0,305.1519989967346,371.8963193893432,0.24740939678657617,5,-1,-1,llm8_g5,0,
2026-03-03T03:25:57.943844+00:00,BUCKET,llm_style,eval,llm_style_eval_047,16,4096,8192,bf16,NVIDIA GeForce RTX 4060,c10,64,128,64,8,3,8,0.0,0.0,686.0799789428711,739.9158370494843,1.565038854004234,6,-1,-1,llm8_g6,0,
2026-03-03T03:25:57.994026+00:00,BUCKET,llm_style,eval,llm_style_eval_048,16,1024,6144,bf16,NVIDIA GeForce RTX 4060,c11,32,128,32,4,2,8,0.0,0.0,276.4799892902374,365.0092801451683,0.7281778059845609,7,-1,-1,llm8_g7,0,
2026-03-03T03:25:58.057862+00:00,BUCKET,llm_style,eval,llm_style_eval_049,16,8192,1536,bf16,NVIDIA GeForce RTX 4060,c02,32,64,32,2,2,8,0.0,0.0,141.31200313568115,193.24128136038766,2.849391241120482,5,-1,-1,llm8_g5,0,
2026-03-03T03:25:58.068001+00:00,BUCKET,llm_style,eval,llm_style_eval_050,1,1024,1024,bf16,NVIDIA GeForce RTX 4060,c11,32,128,32,4,2,8,0.0,0.0,65.5359998345375,147.86976128816596,0.032000000080792235,7,-1,-1,llm8_g7,0,
2026-03-03T03:25:58.094926+00:00,BUCKET,llm_style,eval,llm_style_eval_051,16,6144,1024,bf16,NVIDIA GeForce RTX 4060,c02,32,64,32,2,2,8,0.0,0.0,72.48000055551529,120.87295986711979,2.7776847469226493,5,-1,-1,llm8_g5,0,
2026-03-03T03:25:58.483339+00:00,BUCKET,llm_style,eval,llm_style_eval_052,16,8192,8192,bf16,NVIDIA GeForce RTX 4060,c03,64,64,32,4,2,8,0.0,0.0,1225.0720262527466,1261.017245054245,1.752944808125877,4,-1,-1,llm8_g4,0,
2026-03-03T03:25:58.759136+00:00,BUCKET,llm_style,eval,llm_style_eval_053,1,6144,8192,bf16,NVIDIA GeForce RTX 4060,c03,64,64,32,4,2,8,0.0,0.0,843.7759876251221,881.6783964633942,0.11930097262346283,4,-1,-1,llm8_g4,0,
2026-03-03T03:25:58.834039+00:00,BUCKET,llm_style,eval,llm_style_eval_054,64,4096,3072,bf16,NVIDIA GeForce RTX 4060,c11,32,128,32,4,2,8,0.0,0.0,275.32799541950226,333.1891208887099,5.849796471099849,3,-1,-1,llm8_g3,0,
2026-03-03T03:25:58.873590+00:00,BUCKET,llm_style,eval,llm_style_eval_055,4,8192,1024,bf16,NVIDIA GeForce RTX 4060,c02,32,64,32,2,2,8,0.0,0.0,115.7120019197464,143.50335642695424,0.5799645921478762,5,-1,-1,llm8_g5,0,
2026-03-03T03:25:58.904581+00:00,BUCKET,llm_style,eval,llm_style_eval_056,64,1024,3072,bf16,NVIDIA GeForce RTX 4060,c11,32,128,32,4,2,8,0.0,0.0,159.743994474411,181.43232181668276,2.5206154718041685,3,-1,-1,llm8_g3,0,
2026-03-03T03:25:58.915565+00:00,BUCKET,llm_style,eval,llm_style_eval_057,64,1024,3072,bf16,NVIDIA GeForce RTX 4060,c11,32,128,32,4,2,8,0.0,0.0,155.64799308776855,183.06048601865763,2.5869474833057904,3,-1,-1,llm8_g3,0,
2026-03-03T03:25:58.966776+00:00,BUCKET,llm_style,eval,llm_style_eval_058,32,2048,4096,bf16,NVIDIA GeForce RTX 4060,c11,32,128,32,4,2,8,0.0,0.0,205.79199492931366,268.73856157064426,2.6088036718066063,3,-1,-1,llm8_g3,0,
2026-03-03T03:25:59.056957+00:00,BUCKET,llm_style,eval,llm_style_eval_059,64,8192,2048,bf16,NVIDIA GeForce RTX 4060,c06,64,128,32,4,3,8,0.0,0.0,304.0960133075714,344.5145571231841,7.061860577001296,1,-1,-1,llm8_g1,0,
2026-03-03T03:25:59.157344+00:00,BUCKET,llm_style,eval,llm_style_eval_060,1,3072,6144,bf16,NVIDIA GeForce RTX 4060,c11,32,128,32,4,2,8,0.0,0.0,327.67999172210693,472.24832326173777,0.11520000291019686,7,-1,-1,llm8_g7,0,
2026-03-03T03:25:59.198424+00:00,BUCKET,llm_style,eval,llm_style_eval_061,64,1536,4096,bf16,NVIDIA GeForce RTX 4060,c11,32,128,32,4,2,8,0.0,0.0,197.63199985027313,317.0483297109603,4.074777205159608,3,-1,-1,llm8_g3,0,
2026-03-03T03:25:59.261264+00:00,BUCKET,llm_style,eval,llm_style_eval_062,16,6144,2048,bf16,NVIDIA GeForce RTX 4060,c02,32,64,32,2,2,8,0.0,0.0,134.14399325847626,202.3116849362848,3.0016490058123213,5,-1,-1,llm8_g5,0,
2026-03-03T03:25:59.315046+00:00,BUCKET,llm_style,eval,llm_style_eval_063,64,1536,6144,bf16,NVIDIA GeForce RTX 4060,c11,32,128,32,4,2,8,0.0,0.0,281.5999984741211,393.88158798217773,4.289629114152892,3,-1,-1,llm8_g3,0,
2026-03-03T03:25:59.387142+00:00,BUCKET,llm_style,eval,llm_style_eval_064,1,6144,2048,bf16,NVIDIA GeForce RTX 4060,c02,32,64,32,2,2,8,0.0,0.0,155.64799308776855,293.8367986679076,0.1616842177066119,5,-1,-1,llm8_g5,0,
2026-03-03T03:25:59.449454+00:00,BUCKET,llm_style,eval,llm_style_eval_065,8,1536,6144,bf16,NVIDIA GeForce RTX 4060,c11,32,128,32,4,2,8,0.0,0.0,301.0080009698868,392.71425008773804,0.5016309982242158,7,-1,-1,llm8_g7,0,
2026-03-03T03:25:59.486696+00:00,BUCKET,llm_style,eval,llm_style_eval_066,64,1536,4096,bf16,NVIDIA GeForce RTX 4060,c11,32,128,32,4,2,8,0.0,0.0,219.4880023598671,332.9433608055115,3.6690222670104746,3,-1,-1,llm8_g3,0,
2026-03-03T03:25:59.582622+00:00,BUCKET,llm_style,eval,llm_style_eval_067,64,8192,2048,bf16,NVIDIA GeForce RTX 4060,c06,64,128,32,4,3,8,0.0,0.0,307.6480031013489,325.23262709379196,6.980326952723797,1,-1,-1,llm8_g1,0,
2026-03-03T03:25:59.610235+00:00,BUCKET,llm_style,eval,llm_style_eval_068,64,1024,4096,bf16,NVIDIA GeForce RTX 4060,c11,32,128,32,4,2,8,0.0,0.0,190.97600132226944,197.5219263136387,2.8111956909917573,3,-1,-1,llm8_g3,0,
2026-03-03T03:25:59.654053+00:00,BUCKET,llm_style,eval,llm_style_eval_069,64,2048,4096,bf16,NVIDIA GeForce RTX 4060,c11,32,128,32,4,2,8,0.0,0.0,223.63200038671494,313.589761853218,4.801378255988568,3,-1,-1,llm8_g3,0,
2026-03-03T03:25:59.703613+00:00,BUCKET,llm_style,eval,llm_style_eval_070,64,8192,1024,bf16,NVIDIA GeForce RTX 4060,c06,64,128,32,4,3,8,0.0,0.0,172.4800020456314,267.5507137179374,6.22531198553633,1,-1,-1,llm8_g1,0,
2026-03-03T03:25:59.782627+00:00,BUCKET,llm_style,eval,llm_style_eval_071,64,6144,2048,bf16,NVIDIA GeForce RTX 4060,c06,64,128,32,4,3,8,0.0,0.0,216.5280058979988,354.05630916357035,7.438357589450675,1,-1,-1,llm8_g1,0,
2026-03-03T03:25:59.794971+00:00,BUCKET,llm_style,eval,llm_style_eval_072,64,1536,1024,bf16,NVIDIA GeForce RTX 4060,c11,32,128,32,4,2,8,0.0,0.0,74.70400258898735,124.09856081008897,2.6949906969198856,3,-1,-1,llm8_g3,0,
2026-03-03T03:25:59.821263+00:00,BUCKET,llm_style,eval,llm_style_eval_073,1,4096,1536,bf16,NVIDIA GeForce RTX 4060,c11,32,128,32,4,2,8,0.0,0.0,96.25600278377533,154.79200378060335,0.13072340047472805,7,-1,-1,llm8_g7,0,
2026-03-03T03:25:59.835757+00:00,BUCKET,llm_style,eval,llm_style_eval_074,8,1024,2048,bf16,NVIDIA GeForce RTX 4060,c11,32,128,32,4,2,8,0.0,0.0,108.5439994931221,158.41152451932413,0.30913207691528055,7,-1,-1,llm8_g7,0,
2026-03-03T03:25:59.861556+00:00,BUCKET,llm_style,eval,llm_style_eval_075,2,6144,1024,bf16,NVIDIA GeForce RTX 4060,c02,32,64,32,2,2,8,0.0,0.0,89.55200016498566,162.51168191432947,0.28101911686657893,5,-1,-1,llm8_g5,0,
2026-03-03T03:25:59.899533+00:00,BUCKET,llm_style,eval,llm_style_eval_076,64,1024,6144,bf16,NVIDIA GeForce RTX 4060,c11,32,128,32,4,2,8,0.0,0.0,274.27199482917786,317.16351926326746,2.936159663335519,3,-1,-1,llm8_g3,0,
2026-03-03T03:26:00.096221+00:00,BUCKET,llm_style,eval,llm_style_eval_077,1,4096,8192,bf16,NVIDIA GeForce RTX 4060,c10,64,128,64,8,3,8,0.0,0.0,788.4480059146881,817.1951884031296,0.08511514202150362,6,-1,-1,llm8_g6,0,
2026-03-03T03:26:00.200325+00:00,BUCKET,llm_style,eval,llm_style_eval_078,64,6144,3072,bf16,NVIDIA GeForce RTX 4060,c06,64,128,32,4,3,8,0.0,0.0,303.1040132045746,358.70495706796635,7.970594247359632,1,-1,-1,llm8_g1,0,
2026-03-03T03:26:00.267763+00:00,BUCKET,llm_style,eval,llm_style_eval_079,2,3072,4096,bf16,NVIDIA GeForce RTX 4060,c11,32,128,32,4,2,8,0.0,0.0,192.00000166893005,310.87615698575974,0.26214399772135416,7,-1,-1,llm8_g7,0,
2026-03-03T03:26:00.279925+00:00,BUCKET,llm_style,eval,llm_style_eval_080,4,1536,1024,bf16,NVIDIA GeForce RTX 4060,c11,32,128,32,4,2,8,0.0,0.0,76.688002794981,177.68448039889324,0.16407927630661304,7,-1,-1,llm8_g7,0,
2026-03-03T03:26:00.416913+00:00,BUCKET,llm_style,eval,llm_style_eval_081,4,4096,6144,bf16,NVIDIA GeForce RTX 4060,c11,32,128,32,4,2,8,0.0,0.0,445.43999433517456,481.4521661400795,0.4519724195410041,7,-1,-1,llm8_g7,0,
2026-03-03T03:26:00.450099+00:00,BUCKET,llm_style,eval,llm_style_eval_082,64,6144,1024,bf16,NVIDIA GeForce RTX 4060,c06,64,128,32,4,3,8,0.0,0.0,157.6159968972206,186.366715580225,5.109293370298765,1,-1,-1,llm8_g1,0,
2026-03-03T03:26:00.540902+00:00,BUCKET,llm_style,eval,llm_style_eval_083,8,4096,4096,bf16,NVIDIA GeForce RTX 4060,c11,32,128,32,4,2,8,0.0,0.0,307.20001459121704,319.0067198872566,0.8738132918294289,7,-1,-1,llm8_g7,0,
2026-03-03T03:26:00.609295+00:00,BUCKET,llm_style,eval,llm_style_eval_084,64,1024,8192,bf16,NVIDIA GeForce RTX 4060,c10,64,128,64,8,3,8,0.0,0.0,602.1119952201843,732.9075258970261,1.783292531163321,2,-1,-1,llm8_g2,0,
2026-03-03T03:26:00.758424+00:00,BUCKET,llm_style,eval,llm_style_eval_085,1,3072,8192,bf16,NVIDIA GeForce RTX 4060,c10,64,128,64,8,3,8,0.0,0.0,594.2719876766205,698.7407791614532,0.08469463317087818,6,-1,-1,llm8_g6,0,
2026-03-03T03:26:00.774475+00:00,BUCKET,llm_style,eval,llm_style_eval_086,8,1536,1024,bf16,NVIDIA GeForce RTX 4060,c11,32,128,32,4,2,8,0.0,0.0,90.11200070381165,210.7084803283214,0.27927272509149287,7,-1,-1,llm8_g7,0,
2026-03-03T03:26:00.801142+00:00,BUCKET,llm_style,eval,llm_style_eval_087,16,1024,3072,bf16,NVIDIA GeForce RTX 4060,c11,32,128,32,4,2,8,0.0,0.0,184.27199870347977,259.1334456205368,0.5462755964457832,7,-1,-1,llm8_g7,0,
2026-03-03T03:26:00.834422+00:00,BUCKET,llm_style,eval,llm_style_eval_088,8,4096,1536,bf16,NVIDIA GeForce RTX 4060,c11,32,128,32,4,2,8,0.0,0.0,129.84000146389008,203.252484947443,0.7752872371000054,7,-1,-1,llm8_g7,0,
2026-03-03T03:26:00.937319+00:00,BUCKET,llm_style,eval,llm_style_eval_089,16,6144,3072,bf16,NVIDIA GeForce RTX 4060,c02,32,64,32,2,2,8,0.0,0.0,290.8160090446472,367.71839797496796,2.07684500583073,5,-1,-1,llm8_g5,0,
2026-03-03T03:26:00.966535+00:00,BUCKET,llm_style,eval,llm_style_eval_090,32,1536,3072,bf16,NVIDIA GeForce RTX 4060,c11,32,128,32,4,2,8,0.0,0.0,210.94399690628052,255.52896440029133,1.4316116714815539,3,-1,-1,llm8_g3,0,
2026-03-03T03:26:00.999919+00:00,BUCKET,llm_style,eval,llm_style_eval_091,16,1024,4096,bf16,NVIDIA GeForce RTX 4060,c11,32,128,32,4,2,8,0.0,0.0,266.2400007247925,321.8432044982909,0.5041230755506888,7,-1,-1,llm8_g7,0,
2026-03-03T03:26:01.139021+00:00,BUCKET,llm_style,eval,llm_style_eval_092,1,4096,6144,bf16,NVIDIA GeForce RTX 4060,c11,32,128,32,4,2,8,0.0,0.0,455.56800067424774,591.8038237094878,0.11048108718239291,7,-1,-1,llm8_g7,0,
2026-03-03T03:26:01.175201+00:00,BUCKET,llm_style,eval,llm_style_eval_093,32,2048,3072,bf16,NVIDIA GeForce RTX 4060,c11,32,128,32,4,2,8,0.0,0.0,221.18399292230606,285.5731269717215,1.8204445026970715,3,-1,-1,llm8_g3,0,
2026-03-03T03:26:01.193937+00:00,BUCKET,llm_style,eval,llm_style_eval_094,32,1024,2048,bf16,NVIDIA GeForce RTX 4060,c11,32,128,32,4,2,8,0.0,0.0,163.64799439907074,269.5577543973922,0.8201611543903048,3,-1,-1,llm8_g3,0,
2026-03-03T03:26:01.267538+00:00,BUCKET,llm_style,eval,llm_style_eval_095,8,6144,2048,bf16,NVIDIA GeForce RTX 4060,c02,32,64,32,2,2,8,0.0,0.0,205.82400262355804,339.74079936742777,0.9781492412632574,5,-1,-1,llm8_g5,0,
2026-03-03T03:26:01.313319+00:00,BUCKET,llm_style,eval,llm_style_eval_096,64,2048,3072,bf16,NVIDIA GeForce RTX 4060,c11,32,128,32,4,2,8,0.0,0.0,267.68000423908234,339.05311435461033,3.008466658872019,3,-1,-1,llm8_g3,0,
2026-03-03T03:26:01.347847+00:00,BUCKET,llm_style,eval,llm_style_eval_097,64,6144,1024,bf16,NVIDIA GeForce RTX 4060,c06,64,128,32,4,3,8,0.0,0.0,155.64799308776855,245.9798410534857,5.173894966611581,1,-1,-1,llm8_g1,0,
2026-03-03T03:26:01.381382+00:00,BUCKET,llm_style,eval,llm_style_eval_098,32,6144,1024,bf16,NVIDIA GeForce RTX 4060,c06,64,128,32,4,3,8,0.0,0.0,159.66399759054184,267.11039707064623,2.521878382580672,1,-1,-1,llm8_g1,0,
2026-03-03T03:26:01.406820+00:00,BUCKET,llm_style,eval,llm_style_eval_099,1,2048,2048,bf16,NVIDIA GeForce RTX 4060,c11,32,128,32,4,2,8,0.0,0.0,151.0080024600029,221.27455577254293,0.05555075137307288,7,-1,-1,llm8_g7,0,
2026-03-03T03:26:01.454393+00:00,BUCKET,llm_style,eval,llm_style_eval_100,64,8192,1024,bf16,NVIDIA GeForce RTX 4060,c06,64,128,32,4,3,8,0.0,0.0,259.0720057487488,323.7478303909302,4.144569077993429,1,-1,-1,llm8_g1,0,
2026-03-03T03:26:01.533864+00:00,BUCKET,llm_style,eval,llm_style_eval_101,64,8192,1536,bf16,NVIDIA GeForce RTX 4060,c06,64,128,32,4,3,8,0.0,0.0,365.56801199913025,478.33919763565063,4.405781367992974,1,-1,-1,llm8_g1,0,
2026-03-03T03:26:01.566224+00:00,BUCKET,llm_style,eval,llm_style_eval_102,32,3072,2048,bf16,NVIDIA GeForce RTX 4060,c11,32,128,32,4,2,8,0.0,0.0,148.8640010356903,181.7049577832222,2.7048391901240345,3,-1,-1,llm8_g3,0,
2026-03-03T03:26:01.604037+00:00,BUCKET,llm_style,eval,llm_style_eval_103,64,2048,3072,bf16,NVIDIA GeForce RTX 4060,c11,32,128,32,4,2,8,0.0,0.0,258.04799795150757,370.15360951423645,3.1207619295358113,3,-1,-1,llm8_g3,0,
2026-03-03T03:26:01.675909+00:00,BUCKET,llm_style,eval,llm_style_eval_104,16,6144,2048,bf16,NVIDIA GeForce RTX 4060,c02,32,64,32,2,2,8,0.0,0.0,185.34399569034576,200.4720026254654,2.1724641389123427,5,-1,-1,llm8_g5,0,
2026-03-03T03:26:01.747820+00:00,BUCKET,llm_style,eval,llm_style_eval_105,1,1024,8192,bf16,NVIDIA GeForce RTX 4060,c10,64,128,64,8,3,8,0.0,0.0,668.6720252037048,754.903030991554,0.025090351274810657,6,-1,-1,llm8_g6,0,
2026-03-03T03:26:01.977279+00:00,BUCKET,llm_style,eval,llm_style_eval_106,32,4096,8192,bf16,NVIDIA GeForce RTX 4060,c10,64,128,64,8,3,8,0.0,0.0,1252.7360320091248,1402.0403254032135,1.7142347574659353,2,-1,-1,llm8_g2,0,
2026-03-03T03:26:02.042029+00:00,BUCKET,llm_style,eval,llm_style_eval_107,64,6144,1536,bf16,NVIDIA GeForce RTX 4060,c06,64,128,32,4,3,8,0.0,0.0,263.08800280094147,335.0118413567543,4.5914657420314615,1,-1,-1,llm8_g1,0,
2026-03-03T03:26:02.069078+00:00,BUCKET,llm_style,eval,llm_style_eval_108,8,3072,1536,bf16,NVIDIA GeForce RTX 4060,c11,32,128,32,4,2,8,0.0,0.0,132.9280063509941,176.17920354008663,0.5679576040631364,7,-1,-1,llm8_g7,0,
2026-03-03T03:26:02.083692+00:00,BUCKET,llm_style,eval,llm_style_eval_109,16,2048,1024,bf16,NVIDIA GeForce RTX 4060,c11,32,128,32,4,2,8,0.0,0.0,103.15200313925743,148.49791705608365,0.6505822665353536,7,-1,-1,llm8_g7,0,
2026-03-03T03:26:02.518252+00:00,BUCKET,llm_style,eval,llm_style_eval_110,1,8192,8192,bf16,NVIDIA GeForce RTX 4060,c03,64,64,32,4,2,8,0.0,0.0,2160.640001296997,2298.023130893707,0.062119431242331574,4,-1,-1,llm8_g4,0,
2026-03-03T03:26:02.570956+00:00,BUCKET,llm_style,eval,llm_style_eval_111,8,6144,1536,bf16,NVIDIA GeForce RTX 4060,c02,32,64,32,2,2,8,0.0,0.0,106.89599812030792,231.24991983175272,1.412540662467646,5,-1,-1,llm8_g5,0,
2026-03-03T03:26:02.671345+00:00,BUCKET,llm_style,eval,llm_style_eval_112,2,6144,3072,bf16,NVIDIA GeForce RTX 4060,c02,32,64,32,2,2,8,0.0,0.0,307.20001459121704,352.4905624985694,0.24575998832702692,5,-1,-1,llm8_g5,0,
2026-03-03T03:26:03.034578+00:00,BUCKET,llm_style,eval,llm_style_eval_113,1,8192,8192,bf16,NVIDIA GeForce RTX 4060,c03,64,64,32,4,2,8,0.0,0.0,1238.8799786567688,1311.211493015289,0.10833795873069393,4,-1,-1,llm8_g4,0,
2026-03-03T03:26:03.059554+00:00,BUCKET,llm_style,eval,llm_style_eval_114,1,3072,1024,bf16,NVIDIA GeForce RTX 4060,c11,32,128,32,4,2,8,0.0,0.0,79.3599970638752,137.7971246838569,0.07927742228790834,7,-1,-1,llm8_g7,0,
2026-03-03T03:26:03.086357+00:00,BUCKET,llm_style,eval,llm_style_eval_115,16,3072,1536,bf16,NVIDIA GeForce RTX 4060,c11,32,128,32,4,2,8,0.0,0.0,122.25599959492683,375.994882434606,1.2350718533265808,7,-1,-1,llm8_g7,0,
2026-03-03T03:26:03.104082+00:00,BUCKET,llm_style,eval,llm_style_eval_116,8,3072,1024,bf16,NVIDIA GeForce RTX 4060,c11,32,128,32,4,2,8,0.0,0.0,76.80000364780426,190.50496488809586,0.6553599688720718,7,-1,-1,llm8_g7,0,
2026-03-03T03:26:03.130692+00:00,BUCKET,llm_style,eval,llm_style_eval_117,4,1024,4096,bf16,NVIDIA GeForce RTX 4060,c11,32,128,32,4,2,8,0.0,0.0,209.27999913692474,291.8886485695839,0.16033272237375384,7,-1,-1,llm8_g7,0,
2026-03-03T03:26:03.238008+00:00,BUCKET,llm_style,eval,llm_style_eval_118,64,6144,3072,bf16,NVIDIA GeForce RTX 4060,c06,64,128,32,4,3,8,0.0,0.0,318.1919902563095,396.0320037603378,7.592645880413056,1,-1,-1,llm8_g1,0,
2026-03-03T03:26:03.508832+00:00,BUCKET,llm_style,eval,llm_style_eval_119,64,8192,6144,bf16,NVIDIA GeForce RTX 4060,c06,64,128,32,4,3,8,0.0,0.0,779.263973236084,897.9763299226761,8.267353766203446,1,-1,-1,llm8_g1,0,
2026-03-03T03:26:03.536256+00:00,BUCKET,llm_style,eval,llm_style_eval_120,8,1024,4096,bf16,NVIDIA GeForce RTX 4060,c11,32,128,32,4,2,8,0.0,0.0,178.15999686717987,286.33600205183023,0.37667750999137234,7,-1,-1,llm8_g7,0,
2026-03-03T03:26:03.551964+00:00,BUCKET,llm_style,eval,llm_style_eval_121,4,1024,2048,bf16,NVIDIA GeForce RTX 4060,c11,32,128,32,4,2,8,0.0,0.0,103.93599793314934,264.86783966422047,0.16141872242176333,7,-1,-1,llm8_g7,0,
2026-03-03T03:26:03.713135+00:00,BUCKET,llm_style,eval,llm_style_eval_122,4,6144,4096,bf16,NVIDIA GeForce RTX 4060,c02,32,64,32,2,2,8,0.0,0.0,375.71199238300323,534.0819060802459,0.5358535156758222,5,-1,-1,llm8_g5,0,
2026-03-03T03:26:03.850472+00:00,BUCKET,llm_style,eval,llm_style_eval_123,4,3072,8192,bf16,NVIDIA GeForce RTX 4060,c10,64,128,64,8,3,8,0.0,0.0,373.7120032310486,510.2182337641716,0.5387212352275697,6,-1,-1,llm8_g6,0,
2026-03-03T03:26:03.879719+00:00,BUCKET,llm_style,eval,llm_style_eval_124,64,6144,1024,bf16,NVIDIA GeForce RTX 4060,c06,64,128,32,4,3,8,0.0,0.0,113.66400122642517,188.02560016512868,7.0849728965267005,1,-1,-1,llm8_g1,0,
2026-03-03T03:26:03.959955+00:00,BUCKET,llm_style,eval,llm_style_eval_125,64,1536,8192,bf16,NVIDIA GeForce RTX 4060,c10,64,128,64,8,3,8,0.0,0.0,373.2000142335892,441.69216781854624,4.315682407750133,2,-1,-1,llm8_g2,0,
2026-03-03T03:26:04.059376+00:00,BUCKET,llm_style,eval,llm_style_eval_126,64,2048,8192,bf16,NVIDIA GeForce RTX 4060,c10,64,128,64,8,3,8,0.0,0.0,371.71199917793274,446.9043183326719,5.777278249691459,2,-1,-1,llm8_g2,0,
2026-03-03T03:26:04.122102+00:00,BUCKET,llm_style,eval,llm_style_eval_127,2,8192,1536,bf16,NVIDIA GeForce RTX 4060,c02,32,64,32,2,2,8,0.0,0.0,137.68000155687332,258.9491255581377,0.36556978087488495,5,-1,-1,llm8_g5,0,
2026-03-03T03:26:04.144262+00:00,BUCKET,llm_style,eval,llm_style_eval_128,8,2048,2048,bf16,NVIDIA GeForce RTX 4060,c11,32,128,32,4,2,8,0.0,0.0,125.95200538635254,225.88224858045567,0.5328129853442695,7,-1,-1,llm8_g7,0,
2026-03-03T03:26:04.411268+00:00,BUCKET,llm_style,eval,llm_style_eval_129,64,8192,6144,bf16,NVIDIA GeForce RTX 4060,c06,64,128,32,4,3,8,0.0,0.0,755.7119727134705,814.1926360130308,8.52500843789419,1,-1,-1,llm8_g1,0,
2026-03-03T03:26:04.434147+00:00,BUCKET,llm_style,eval,llm_style_eval_130,16,3072,1536,bf16,NVIDIA GeForce RTX 4060,c11,32,128,32,4,2,8,0.0,0.0,79.8719972372055,158.19007664918897,1.8904616038531266,7,-1,-1,llm8_g7,0,
2026-03-03T03:26:04.768118+00:00,BUCKET,llm_style,eval,llm_style_eval_131,32,8192,8192,bf16,NVIDIA GeForce RTX 4060,c00,32,32,32,2,2,8,0.0,0.0,917.9520010948181,948.2854181528091,4.678858252803525,0,-1,-1,llm8_g0,0,
2026-03-03T03:26:04.942269+00:00,BUCKET,llm_style,eval,llm_style_eval_132,32,8192,4096,bf16,NVIDIA GeForce RTX 4060,c06,64,128,32,4,3,8,0.0,0.0,531.9039821624756,570.396813750267,4.037352078601338,1,-1,-1,llm8_g1,0,
2026-03-03T03:26:05.326452+00:00,BUCKET,llm_style,eval,llm_style_eval_133,2,8192,8192,bf16,NVIDIA GeForce RTX 4060,c03,64,64,32,4,2,8,0.0,0.0,1522.0320224761963,1798.7071871757507,0.17636649691724746,4,-1,-1,llm8_g4,0,
2026-03-03T03:26:05.379840+00:00,BUCKET,llm_style,eval,llm_style_eval_134,64,3072,3072,bf16,NVIDIA GeForce RTX 4060,c11,32,128,32,4,2,8,0.0,0.0,165.8879965543747,181.16959735751152,7.281777929026079,3,-1,-1,llm8_g3,0,
2026-03-03T03:26:05.431223+00:00,BUCKET,llm_style,eval,llm_style_eval_135,8,3072,3072,bf16,NVIDIA GeForce RTX 4060,c11,32,128,32,4,2,8,0.0,0.0,149.50399845838547,206.80448576807964,1.009972613154086,7,-1,-1,llm8_g7,0,
2026-03-03T03:26:05.487028+00:00,BUCKET,llm_style,eval,llm_style_eval_136,4,2048,4096,bf16,NVIDIA GeForce RTX 4060,c11,32,128,32,4,2,8,0.0,0.0,222.70400077104568,302.04064071178436,0.30133658922900225,7,-1,-1,llm8_g7,0,
2026-03-03T03:26:05.842952+00:00,BUCKET,llm_style,eval,llm_style_eval_137,4,8192,8192,bf16,NVIDIA GeForce RTX 4060,c03,64,64,32,4,2,8,0.0,0.0,1156.0959815979004,1180.5827724933624,0.46438264689577313,4,-1,-1,llm8_g4,0,
2026-03-03T03:26:05.854941+00:00,BUCKET,llm_style,eval,llm_style_eval_138,16,1024,1024,bf16,NVIDIA GeForce RTX 4060,c11,32,128,32,4,2,8,0.0,0.0,72.7040022611618,163.8809558749199,0.4615211124068289,7,-1,-1,llm8_g7,0,
2026-03-03T03:26:05.864309+00:00,BUCKET,llm_style,eval,llm_style_eval_139,4,1024,1024,bf16,NVIDIA GeForce RTX 4060,c11,32,128,32,4,2,8,0.0,0.0,75.6320022046566,87.58271984755993,0.11091347254434472,7,-1,-1,llm8_g7,0,
2026-03-03T03:26:06.003872+00:00,BUCKET,llm_style,eval,llm_style_eval_140,64,4096,6144,bf16,NVIDIA GeForce RTX 4060,c11,32,128,32,4,2,8,0.0,0.0,469.37599778175354,494.2540872097015,6.862782688555323,3,-1,-1,llm8_g3,0,
2026-03-03T03:26:06.139588+00:00,BUCKET,llm_style,eval,llm_style_eval_141,4,6144,4096,bf16,NVIDIA GeForce RTX 4060,c02,32,64,32,2,2,8,0.0,0.0,364.54400420188904,376.72703236341476,0.5522696565556536,5,-1,-1,llm8_g5,0,
2026-03-03T03:26:06.212023+00:00,BUCKET,llm_style,eval,llm_style_eval_142,4,2048,6144,bf16,NVIDIA GeForce RTX 4060,c11,32,128,32,4,2,8,0.0,0.0,283.6480140686035,293.73024493455887,0.3548880690405731,7,-1,-1,llm8_g7,0,
2026-03-03T03:26:06.299439+00:00,BUCKET,llm_style,eval,llm_style_eval_143,64,1536,8192,bf16,NVIDIA GeForce RTX 4060,c10,64,128,64,8,3,8,0.0,0.0,397.3119854927063,495.2703991532325,4.0537733438941705,2,-1,-1,llm8_g2,0,
2026-03-03T03:26:06.361391+00:00,BUCKET,llm_style,eval,llm_style_eval_144,1,3072,3072,bf16,NVIDIA GeForce RTX 4060,c11,32,128,32,4,2,8,0.0,0.0,170.44799774885178,216.99424177408218,0.11073387924339609,7,-1,-1,llm8_g7,0,
2026-03-03T03:26:06.379866+00:00,BUCKET,llm_style,eval,llm_style_eval_145,32,1024,2048,bf16,NVIDIA GeForce RTX 4060,c11,32,128,32,4,2,8,0.0,0.0,107.51999914646149,140.70048213005066,1.2483047718143248,3,-1,-1,llm8_g3,0,
2026-03-03T03:26:06.561510+00:00,BUCKET,llm_style,eval,llm_style_eval_146,64,8192,4096,bf16,NVIDIA GeForce RTX 4060,c06,64,128,32,4,3,8,0.0,0.0,565.200001001358,599.6646457910538,7.599022095524873,1,-1,-1,llm8_g1,0,
2026-03-03T03:26:06.616101+00:00,BUCKET,llm_style,eval,llm_style_eval_147,64,2048,4096,bf16,NVIDIA GeForce RTX 4060,c11,32,128,32,4,2,8,0.0,0.0,201.4400064945221,220.3238399326801,5.330330566829082,3,-1,-1,llm8_g3,0,
2026-03-03T03:26:06.655038+00:00,BUCKET,llm_style,eval,llm_style_eval_148,64,1024,6144,bf16,NVIDIA GeForce RTX 4060,c11,32,128,32,4,2,8,0.0,0.0,258.39999318122864,270.7929655909538,3.1165107943141432,3,-1,-1,llm8_g3,0,
2026-03-03T03:26:06.841828+00:00,BUCKET,llm_style,eval,llm_style_eval_149,64,4096,8192,bf16,NVIDIA GeForce RTX 4060,c10,64,128,64,8,3,8,0.0,0.0,729.0880084037781,740.2124762535095,5.890876336593639,2,-1,-1,llm8_g2,0,
2026-03-03T03:26:06.877327+00:00,BUCKET,llm_style,eval,llm_style_eval_150,2,2048,3072,bf16,NVIDIA GeForce RTX 4060,c11,32,128,32,4,2,8,0.0,0.0,148.40000122785568,209.4182401895523,0.16958102285565346,7,-1,-1,llm8_g7,0,
2026-03-03T03:26:06.923496+00:00,BUCKET,llm_style,eval,llm_style_eval_151,64,4096,2048,bf16,NVIDIA GeForce RTX 4060,c11,32,128,32,4,2,8,0.0,0.0,180.2240014076233,221.27616390585888,5.957818135285181,3,-1,-1,llm8_g3,0,
2026-03-03T03:26:07.280676+00:00,BUCKET,llm_style,eval,llm_style_eval_152,8,8192,8192,bf16,NVIDIA GeForce RTX 4060,c03,64,64,32,4,2,8,0.0,0.0,1095.6799983978271,1251.3062167167664,0.9799775715264434,4,-1,-1,llm8_g4,0,
2026-03-03T03:26:07.376778+00:00,BUCKET,llm_style,eval,llm_style_eval_153,64,8192,2048,bf16,NVIDIA GeForce RTX 4060,c06,64,128,32,4,3,8,0.0,0.0,294.9120104312897,392.07936227321613,7.281777520215079,1,-1,-1,llm8_g1,0,
2026-03-03T03:26:07.477231+00:00,BUCKET,llm_style,eval,llm_style_eval_154,16,2048,8192,bf16,NVIDIA GeForce RTX 4060,c10,64,128,64,8,3,8,0.0,0.0,395.04000544548035,524.9945628643036,1.359029223874628,6,-1,-1,llm8_g6,0,
2026-03-03T03:26:07.500149+00:00,BUCKET,llm_style,eval,llm_style_eval_155,4,2048,1536,bf16,NVIDIA GeForce RTX 4060,c11,32,128,32,4,2,8,0.0,0.0,113.66400122642517,209.57407608628267,0.2214054030164594,7,-1,-1,llm8_g7,0,
2026-03-03T03:26:07.636048+00:00,BUCKET,llm_style,eval,llm_style_eval_156,1,4096,6144,bf16,NVIDIA GeForce RTX 4060,c11,32,128,32,4,2,8,0.0,0.0,396.67201042175293,536.8012827634811,0.12688479821524581,7,-1,-1,llm8_g7,0,
2026-03-03T03:26:07.719468+00:00,BUCKET,llm_style,eval,llm_style_eval_157,1,1536,8192,bf16,NVIDIA GeForce RTX 4060,c10,64,128,64,8,3,8,0.0,0.0,401.3279974460602,448.7577626109123,0.06270637523459192,6,-1,-1,llm8_g6,0,
2026-03-03T03:26:07.820567+00:00,BUCKET,llm_style,eval,llm_style_eval_158,64,1536,8192,bf16,NVIDIA GeForce RTX 4060,c10,64,128,64,8,3,8,0.0,0.0,435.2000057697296,555.0387400388717,3.7008564215235737,2,-1,-1,llm8_g2,0,
2026-03-03T03:26:07.870178+00:00,BUCKET,llm_style,eval,llm_style_eval_159,16,6144,1536,bf16,NVIDIA GeForce RTX 4060,c02,32,64,32,2,2,8,0.0,0.0,122.3679967224598,170.40608137845985,2.4678829112887803,5,-1,-1,llm8_g5,0,
2026-03-03T03:26:08.076243+00:00,BUCKET,llm_style,eval,llm_style_eval_160,32,6144,6144,bf16,NVIDIA GeForce RTX 4060,c06,64,128,32,4,3,8,0.0,0.0,643.0720090866089,717.1612572669982,3.756840711247042,1,-1,-1,llm8_g1,0,
2026-03-03T03:26:08.113546+00:00,BUCKET,llm_style,eval,llm_style_eval_161,2,1536,4096,bf16,NVIDIA GeForce RTX 4060,c11,32,128,32,4,2,8,0.0,0.0,230.3999960422516,293.11999082565296,0.10922666854293261,7,-1,-1,llm8_g7,0,
2026-03-03T03:26:08.142631+00:00,BUCKET,llm_style,eval,llm_style_eval_162,64,1536,3072,bf16,NVIDIA GeForce RTX 4060,c11,32,128,32,4,2,8,0.0,0.0,141.31200313568115,241.8627120554446,4.274086861680723,3,-1,-1,llm8_g3,0,
2026-03-03T03:26:08.204388+00:00,BUCKET,llm_style,eval,llm_style_eval_163,64,1024,8192,bf16,NVIDIA GeForce RTX 4060,c10,64,128,64,8,3,8,0.0,0.0,458.75200629234314,568.5759943723675,2.340571396467637,2,-1,-1,llm8_g2,0,
2026-03-03T03:26:08.416700+00:00,BUCKET,llm_style,eval,llm_style_eval_164,64,4096,8192,bf16,NVIDIA GeForce RTX 4060,c10,64,128,64,8,3,8,0.0,0.0,907.7759981155396,982.3539435863493,4.731307398428646,2,-1,-1,llm8_g2,0,
2026-03-03T03:26:08.553376+00:00,BUCKET,llm_style,eval,llm_style_eval_165,4,8192,3072,bf16,NVIDIA GeForce RTX 4060,c02,32,64,32,2,2,8,0.0,0.0,391.58399403095245,447.6927950978279,0.5141338641744542,5,-1,-1,llm8_g5,0,
2026-03-03T03:26:08.606410+00:00,BUCKET,llm_style,eval,llm_style_eval_166,64,1024,6144,bf16,NVIDIA GeForce RTX 4060,c11,32,128,32,4,2,8,0.0,0.0,343.4079885482788,393.9327988028525,2.345042616522545,3,-1,-1,llm8_g3,0,
2026-03-03T03:26:08.622844+00:00,BUCKET,llm_style,eval,llm_style_eval_167,2,2048,1024,bf16,NVIDIA GeForce RTX 4060,c11,32,128,32,4,2,8,0.0,0.0,101.3759970664978,139.5404767245053,0.08274747714192617,7,-1,-1,llm8_g7,0,
2026-03-03T03:26:08.648090+00:00,BUCKET,llm_style,eval,llm_style_eval_168,64,4096,1024,bf16,NVIDIA GeForce RTX 4060,c11,32,128,32,4,2,8,0.0,0.0,120.83200365304947,265.6073598563669,4.443118509741362,3,-1,-1,llm8_g3,0,
2026-03-03T03:26:08.700574+00:00,BUCKET,llm_style,eval,llm_style_eval_169,4,1536,6144,bf16,NVIDIA GeForce RTX 4060,c11,32,128,32,4,2,8,0.0,0.0,316.9279992580414,394.789762198925,0.2382164787483175,7,-1,-1,llm8_g7,0,
2026-03-03T03:26:08.719473+00:00,BUCKET,llm_style,eval,llm_style_eval_170,16,1536,1536,bf16,NVIDIA GeForce RTX 4060,c11,32,128,32,4,2,8,0.0,0.0,104.44799810647964,140.26143871247757,0.722823542515712,7,-1,-1,llm8_g7,0,
2026-03-03T03:26:08.753925+00:00,BUCKET,llm_style,eval,llm_style_eval_171,1,2048,3072,bf16,NVIDIA GeForce RTX 4060,c11,32,128,32,4,2,8,0.0,0.0,166.3839966058731,261.1199915409088,0.0756257347862976,7,-1,-1,llm8_g7,0,
2026-03-03T03:26:08.783844+00:00,BUCKET,llm_style,eval,llm_style_eval_172,64,3072,2048,bf16,NVIDIA GeForce RTX 4060,c11,32,128,32,4,2,8,0.0,0.0,137.58400082588196,255.79775974154467,5.853197778564002,3,-1,-1,llm8_g3,0,
2026-03-03T03:26:09.064681+00:00,BUCKET,llm_style,eval,llm_style_eval_173,64,8192,6144,bf16,NVIDIA GeForce RTX 4060,c06,64,128,32,4,3,8,0.0,0.0,1063.9039874076843,1115.0198578834534,6.055481528645944,1,-1,-1,llm8_g1,0,
2026-03-03T03:26:09.154065+00:00,BUCKET,llm_style,eval,llm_style_eval_174,2,4096,4096,bf16,NVIDIA GeForce RTX 4060,c11,32,128,32,4,2,8,0.0,0.0,281.5999984741211,307.79808700084686,0.2383127285640496,7,-1,-1,llm8_g7,0,
2026-03-03T03:26:09.198331+00:00,BUCKET,llm_style,eval,llm_style_eval_175,64,4096,2048,bf16,NVIDIA GeForce RTX 4060,c11,32,128,32,4,2,8,0.0,0.0,224.2559939622879,234.95296090841293,4.788018393749449,3,-1,-1,llm8_g3,0,
2026-03-03T03:26:09.266696+00:00,BUCKET,llm_style,eval,llm_style_eval_176,16,6144,2048,bf16,NVIDIA GeForce RTX 4060,c02,32,64,32,2,2,8,0.0,0.0,152.5759994983673,284.9177516996858,2.639033565723479,5,-1,-1,llm8_g5,0,
2026-03-03T03:26:09.317382+00:00,BUCKET,llm_style,eval,llm_style_eval_177,1,6144,1536,bf16,NVIDIA GeForce RTX 4060,c02,32,64,32,2,2,8,0.0,0.0,114.6400012075901,116.73600226640701,0.16464033322733743,5,-1,-1,llm8_g5,0,
2026-03-03T03:26:09.574644+00:00,BUCKET,llm_style,eval,llm_style_eval_178,32,6144,8192,bf16,NVIDIA GeForce RTX 4060,c00,32,32,32,2,2,8,0.0,0.0,734.2079877853394,836.4588856697083,4.387347353324887,0,-1,-1,llm8_g0,0,
2026-03-03T03:26:09.729904+00:00,BUCKET,llm_style,eval,llm_style_eval_179,64,4096,6144,bf16,NVIDIA GeForce RTX 4060,c11,32,128,32,4,2,8,0.0,0.0,606.2080264091492,649.0627229213715,5.313729498239754,3,-1,-1,llm8_g3,0,
2026-03-03T03:26:09.750869+00:00,BUCKET,llm_style,eval,llm_style_eval_180,64,2048,1536,bf16,NVIDIA GeForce RTX 4060,c11,32,128,32,4,2,8,0.0,0.0,108.87999832630157,154.4627147912978,3.6981373088681724,3,-1,-1,llm8_g3,0,
2026-03-03T03:26:09.784885+00:00,BUCKET,llm_style,eval,llm_style_eval_181,64,2048,3072,bf16,NVIDIA GeForce RTX 4060,c11,32,128,32,4,2,8,0.0,0.0,182.78399854898453,261.726718097925,4.40578154757997,3,-1,-1,llm8_g3,0,
2026-03-03T03:26:09.808310+00:00,BUCKET,llm_style,eval,llm_style_eval_182,32,3072,1536,bf16,NVIDIA GeForce RTX 4060,c11,32,128,32,4,2,8,0.0,0.0,115.7120019197464,243.00544396042807,2.6098406646654433,3,-1,-1,llm8_g3,0,
2026-03-03T03:26:09.906911+00:00,BUCKET,llm_style,eval,llm_style_eval_183,8,8192,2048,bf16,NVIDIA GeForce RTX 4060,c02,32,64,32,2,2,8,0.0,0.0,263.16800713539124,383.10367166996,1.020015536546199,5,-1,-1,llm8_g5,0,
2026-03-03T03:26:09.954855+00:00,BUCKET,llm_style,eval,llm_style_eval_184,64,8192,1024,bf16,NVIDIA GeForce RTX 4060,c06,64,128,32,4,3,8,0.0,0.0,203.2639980316162,347.07680523395527,5.28249879170923,1,-1,-1,llm8_g1,0,
2026-03-03T03:26:10.026596+00:00,BUCKET,llm_style,eval,llm_style_eval_185,1,8192,1536,bf16,NVIDIA GeForce RTX 4060,c02,32,64,32,2,2,8,0.0,0.0,187.75999546051025,300.0012806057929,0.13403187371344435,5,-1,-1,llm8_g5,0,
2026-03-03T03:26:10.057127+00:00,BUCKET,llm_style,eval,llm_style_eval_186,16,6144,1024,bf16,NVIDIA GeForce RTX 4060,c02,32,64,32,2,2,8,0.0,0.0,94.2080020904541,208.76287981867785,2.137043430840362,5,-1,-1,llm8_g5,0,
2026-03-03T03:26:10.101288+00:00,BUCKET,llm_style,eval,llm_style_eval_187,1,1024,6144,bf16,NVIDIA GeForce RTX 4060,c11,32,128,32,4,2,8,0.0,0.0,309.2480003833771,410.3119960427283,0.04068874167141216,7,-1,-1,llm8_g7,0,
2026-03-03T03:26:10.276891+00:00,BUCKET,llm_style,eval,llm_style_eval_188,8,8192,4096,bf16,NVIDIA GeForce RTX 4060,c02,32,64,32,2,2,8,0.0,0.0,483.3280146121979,508.0473530292511,1.1107796274353405,5,-1,-1,llm8_g5,0,
2026-03-03T03:26:10.389698+00:00,BUCKET,llm_style,eval,llm_style_eval_189,8,2048,8192,bf16,NVIDIA GeForce RTX 4060,c10,64,128,64,8,3,8,0.0,0.0,514.0479803085327,592.0153588056562,0.5221992231909646,6,-1,-1,llm8_g6,0,
2026-03-03T03:26:10.485420+00:00,BUCKET,llm_style,eval,llm_style_eval_190,4,8192,2048,bf16,NVIDIA GeForce RTX 4060,c02,32,64,32,2,2,8,0.0,0.0,260.0480020046234,358.5228744149206,0.5161267418528895,5,-1,-1,llm8_g5,0,
2026-03-03T03:26:10.874353+00:00,BUCKET,llm_style,eval,llm_style_eval_191,4,8192,8192,bf16,NVIDIA GeForce RTX 4060,c03,64,64,32,4,2,8,0.0,0.0,1386.415958404541,1486.2432408332825,0.3872365351433346,4,-1,-1,llm8_g4,0,
2026-03-03T03:26:10.890991+00:00,BUCKET,llm_style,eval,llm_style_eval_192,64,1536,1024,bf16,NVIDIA GeForce RTX 4060,c11,32,128,32,4,2,8,0.0,0.0,81.7440003156662,182.43584215641016,2.462891358663002,3,-1,-1,llm8_g3,0,
2026-03-03T03:26:10.915069+00:00,BUCKET,llm_style,eval,llm_style_eval_193,32,2048,2048,bf16,NVIDIA GeForce RTX 4060,c11,32,128,32,4,2,8,0.0,0.0,134.0639963746071,167.9257608950137,2.00229340657522,3,-1,-1,llm8_g3,0,
2026-03-03T03:26:10.932183+00:00,BUCKET,llm_style,eval,llm_style_eval_194,8,1024,2048,bf16,NVIDIA GeForce RTX 4060,c11,32,128,32,4,2,8,0.0,0.0,142.7519991993904,243.74080032110214,0.23505402507976428,7,-1,-1,llm8_g7,0,
2026-03-03T03:26:10.970833+00:00,BUCKET,llm_style,eval,llm_style_eval_195,2,4096,2048,bf16,NVIDIA GeForce RTX 4060,c11,32,128,32,4,2,8,0.0,0.0,113.63200098276138,137.89023734629149,0.2952903381952272,7,-1,-1,llm8_g7,0,
2026-03-03T03:26:11.022630+00:00,BUCKET,llm_style,eval,llm_style_eval_196,32,2048,4096,bf16,NVIDIA GeForce RTX 4060,c11,32,128,32,4,2,8,0.0,0.0,168.38400065898895,185.34879937767982,3.1883724694679887,3,-1,-1,llm8_g3,0,
2026-03-03T03:26:11.097896+00:00,BUCKET,llm_style,eval,llm_style_eval_197,32,8192,1536,bf16,NVIDIA GeForce RTX 4060,c06,64,128,32,4,3,8,0.0,0.0,207.7760025858879,390.56161165237404,3.875839163221519,1,-1,-1,llm8_g1,0,
2026-03-03T03:26:11.285285+00:00,BUCKET,llm_style,eval,llm_style_eval_198,64,4096,8192,bf16,NVIDIA GeForce RTX 4060,c10,64,128,64,8,3,8,0.0,0.0,671.7439889907837,818.4310287237167,6.393756202348283,2,-1,-1,llm8_g2,0,
2026-03-03T03:26:11.457784+00:00,BUCKET,llm_style,eval,llm_style_eval_199,2,8192,4096,bf16,NVIDIA GeForce RTX 4060,c02,32,64,32,2,2,8,0.0,0.0,477.6480048894882,558.0435365438459,0.28099714983851654,5,-1,-1,llm8_g5,0,
2026-03-03T03:26:11.477223+00:00,BUCKET,llm_style,eval,llm_style_eval_200,1,4096,1024,bf16,NVIDIA GeForce RTX 4060,c11,32,128,32,4,2,8,0.0,0.0,65.5359998345375,142.56128355860704,0.12800000032316894,7,-1,-1,llm8_g7,0,
2026-03-03T03:26:11.559938+00:00,BUCKET,llm_style,eval,llm_style_eval_201,4,1536,8192,bf16,NVIDIA GeForce RTX 4060,c10,64,128,64,8,3,8,0.0,0.0,367.6159977912903,492.5359985232353,0.2738272996953479,6,-1,-1,llm8_g6,0,
2026-03-03T03:26:11.660045+00:00,BUCKET,llm_style,eval,llm_style_eval_202,1,6144,3072,bf16,NVIDIA GeForce RTX 4060,c02,32,64,32,2,2,8,0.0,0.0,283.6480140686035,407.56480276584625,0.1330830258902149,5,-1,-1,llm8_g5,0,
2026-03-03T03:26:11.733480+00:00,BUCKET,llm_style,eval,llm_style_eval_203,16,2048,6144,bf16,NVIDIA GeForce RTX 4060,c11,32,128,32,4,2,8,0.0,0.0,268.22398602962494,339.04640287160873,1.5011826121901253,7,-1,-1,llm8_g7,0,
2026-03-03T03:26:11.745899+00:00,BUCKET,llm_style,eval,llm_style_eval_204,16,1536,1024,bf16,NVIDIA GeForce RTX 4060,c11,32,128,32,4,2,8,0.0,0.0,67.58400052785873,244.26495984196612,0.7447272669106476,7,-1,-1,llm8_g7,0,
2026-03-03T03:26:11.816345+00:00,BUCKET,llm_style,eval,llm_style_eval_205,64,6144,2048,bf16,NVIDIA GeForce RTX 4060,c06,64,128,32,4,3,8,0.0,0.0,191.3280040025711,287.0153555274009,8.418071073267226,1,-1,-1,llm8_g1,0,
2026-03-03T03:26:11.894917+00:00,BUCKET,llm_style,eval,llm_style_eval_206,4,2048,6144,bf16,NVIDIA GeForce RTX 4060,c11,32,128,32,4,2,8,0.0,0.0,292.33598709106445,379.0233540534973,0.3443411021737901,7,-1,-1,llm8_g7,0,
2026-03-03T03:26:11.949045+00:00,BUCKET,llm_style,eval,llm_style_eval_207,32,6144,1536,bf16,NVIDIA GeForce RTX 4060,c06,64,128,32,4,3,8,0.0,0.0,171.87200486660004,270.3446404635905,3.514125389232436,1,-1,-1,llm8_g1,0,
2026-03-03T03:26:11.963280+00:00,BUCKET,llm_style,eval,llm_style_eval_208,4,2048,1024,bf16,NVIDIA GeForce RTX 4060,c11,32,128,32,4,2,8,0.0,0.0,68.59200075268745,256.30720481276506,0.24459435234279361,7,-1,-1,llm8_g7,0,
2026-03-03T03:26:11.974755+00:00,BUCKET,llm_style,eval,llm_style_eval_209,1,1024,1536,bf16,NVIDIA GeForce RTX 4060,c11,32,128,32,4,2,8,0.0,0.0,74.24000278115273,143.58367912471277,0.04237241220576307,7,-1,-1,llm8_g7,0,
2026-03-03T03:26:12.109368+00:00,BUCKET,llm_style,eval,llm_style_eval_210,8,6144,4096,bf16,NVIDIA GeForce RTX 4060,c02,32,64,32,2,2,8,0.0,0.0,362.7679944038391,533.7190303206443,1.1099468261021948,5,-1,-1,llm8_g5,0,
2026-03-03T03:26:12.207184+00:00,BUCKET,llm_style,eval,llm_style_eval_211,4,2048,8192,bf16,NVIDIA GeForce RTX 4060,c10,64,128,64,8,3,8,0.0,0.0,369.6480095386505,469.0329697728157,0.363096038762698,6,-1,-1,llm8_g6,0,
2026-03-03T03:26:12.219193+00:00,BUCKET,llm_style,eval,llm_style_eval_212,32,1024,1024,bf16,NVIDIA GeForce RTX 4060,c11,32,128,32,4,2,8,0.0,0.0,46.911999583244324,106.75680100917808,1.4305266157098415,3,-1,-1,llm8_g3,0,
2026-03-03T03:26:12.290419+00:00,BUCKET,llm_style,eval,llm_style_eval_213,16,3072,4096,bf16,NVIDIA GeForce RTX 4060,c11,32,128,32,4,2,8,0.0,0.0,190.46399742364883,196.99968233704567,2.1140645447253688,7,-1,-1,llm8_g7,0,
2026-03-03T03:26:12.360498+00:00,BUCKET,llm_style,eval,llm_style_eval_214,64,1024,8192,bf16,NVIDIA GeForce RTX 4060,c10,64,128,64,8,3,8,0.0,0.0,362.8639876842499,468.2022359967232,2.9590751919265363,2,-1,-1,llm8_g2,0,
2026-03-03T03:26:12.388157+00:00,BUCKET,llm_style,eval,llm_style_eval_215,4,4096,1536,bf16,NVIDIA GeForce RTX 4060,c11,32,128,32,4,2,8,0.0,0.0,93.18400174379349,239.6262352168559,0.5401318580241413,7,-1,-1,llm8_g7,0,
2026-03-03T03:26:12.412232+00:00,BUCKET,llm_style,eval,llm_style_eval_216,16,1536,3072,bf16,NVIDIA GeForce RTX 4060,c11,32,128,32,4,2,8,0.0,0.0,139.055997133255,228.9632055163383,1.0858571159308155,7,-1,-1,llm8_g7,0,
2026-03-03T03:26:12.481156+00:00,BUCKET,llm_style,eval,llm_style_eval_217,8,6144,2048,bf16,NVIDIA GeForce RTX 4060,c02,32,64,32,2,2,8,0.0,0.0,123.90399724245071,417.2390536963932,1.6248595402943429,5,-1,-1,llm8_g5,0,
2026-03-03T03:26:12.551726+00:00,BUCKET,llm_style,eval,llm_style_eval_218,8,3072,4096,bf16,NVIDIA GeForce RTX 4060,c11,32,128,32,4,2,8,0.0,0.0,192.51200556755066,301.5334412455559,1.0457872037978244,7,-1,-1,llm8_g7,0,
2026-03-03T03:26:12.687736+00:00,BUCKET,llm_style,eval,llm_style_eval_219,64,8192,3072,bf16,NVIDIA GeForce RTX 4060,c06,64,128,32,4,3,8,0.0,0.0,396.2880074977875,530.1760119199753,8.128495970239484,1,-1,-1,llm8_g1,0,
2026-03-03T03:26:12.725762+00:00,BUCKET,llm_style,eval,llm_style_eval_220,2,4096,2048,bf16,NVIDIA GeForce RTX 4060,c11,32,128,32,4,2,8,0.0,0.0,107.51999914646149,211.83488070964808,0.3120761929535812,7,-1,-1,llm8_g7,0,
2026-03-03T03:26:12.798175+00:00,BUCKET,llm_style,eval,llm_style_eval_221,4,1024,8192,bf16,NVIDIA GeForce RTX 4060,c10,64,128,64,8,3,8,0.0,0.0,523.6479938030243,545.9375786781311,0.1281564424846125,6,-1,-1,llm8_g6,0,
2026-03-03T03:26:12.869826+00:00,BUCKET,llm_style,eval,llm_style_eval_222,64,6144,2048,bf16,NVIDIA GeForce RTX 4060,c06,64,128,32,4,3,8,0.0,0.0,265.21599292755127,283.7913593649864,6.0728341387767255,1,-1,-1,llm8_g1,0,
2026-03-03T03:26:12.894263+00:00,BUCKET,llm_style,eval,llm_style_eval_223,4,2048,2048,bf16,NVIDIA GeForce RTX 4060,c11,32,128,32,4,2,8,0.0,0.0,129.02399897575378,157.69247636198995,0.2600634941279843,7,-1,-1,llm8_g7,0,
2026-03-03T03:26:12.920341+00:00,BUCKET,llm_style,eval,llm_style_eval_224,16,3072,1536,bf16,NVIDIA GeForce RTX 4060,c11,32,128,32,4,2,8,0.0,0.0,113.66400122642517,215.87967813014967,1.3284324180987563,7,-1,-1,llm8_g7,0,
2026-03-03T03:26:12.946778+00:00,BUCKET,llm_style,eval,llm_style_eval_225,1,2048,2048,bf16,NVIDIA GeForce RTX 4060,c11,32,128,32,4,2,8,0.0,0.0,130.41600584983826,218.79007875919336,0.06432192080517089,7,-1,-1,llm8_g7,0,
2026-03-03T03:26:12.959510+00:00,BUCKET,llm_style,eval,llm_style_eval_226,8,1536,1024,bf16,NVIDIA GeForce RTX 4060,c11,32,128,32,4,2,8,0.0,0.0,84.99199897050858,145.04960060119626,0.29609638912872616,7,-1,-1,llm8_g7,0,
2026-03-03T03:26:13.174811+00:00,BUCKET,llm_style,eval,llm_style_eval_227,64,6144,6144,bf16,NVIDIA GeForce RTX 4060,c06,64,128,32,4,3,8,0.0,0.0,781.2480032444,869.4966232776642,6.184768713563601,1,-1,-1,llm8_g1,0,
2026-03-03T03:26:13.250739+00:00,BUCKET,llm_style,eval,llm_style_eval_228,64,6144,2048,bf16,NVIDIA GeForce RTX 4060,c06,64,128,32,4,3,8,0.0,0.0,287.55199909210205,373.3635148406027,5.601118201526137,1,-1,-1,llm8_g1,0,
2026-03-03T03:26:13.342338+00:00,BUCKET,llm_style,eval,llm_style_eval_229,16,1536,8192,bf16,NVIDIA GeForce RTX 4060,c10,64,128,64,8,3,8,0.0,0.0,565.2480125427246,583.7702363729477,0.7123478102801205,6,-1,-1,llm8_g6,0,
2026-03-03T03:26:13.365012+00:00,BUCKET,llm_style,eval,llm_style_eval_230,64,2048,1536,bf16,NVIDIA GeForce RTX 4060,c11,32,128,32,4,2,8,0.0,0.0,125.44000148773193,186.90720260143277,3.2099264925421704,3,-1,-1,llm8_g3,0,
2026-03-03T03:26:13.435474+00:00,BUCKET,llm_style,eval,llm_style_eval_231,4,1024,8192,bf16,NVIDIA GeForce RTX 4060,c10,64,128,64,8,3,8,0.0,0.0,549.888014793396,616.3052785396574,0.12204096505942968,6,-1,-1,llm8_g6,0,
2026-03-03T03:26:13.467360+00:00,BUCKET,llm_style,eval,llm_style_eval_232,16,3072,1536,bf16,NVIDIA GeForce RTX 4060,c11,32,128,32,4,2,8,0.0,0.0,118.78400295972824,231.52639642357826,1.271172382119437,7,-1,-1,llm8_g7,0,
2026-03-03T03:26:13.531680+00:00,BUCKET,llm_style,eval,llm_style_eval_233,64,3072,3072,bf16,NVIDIA GeForce RTX 4060,c11,32,128,32,4,2,8,0.0,0.0,215.98400175571442,338.49568247795105,5.592819570804346,3,-1,-1,llm8_g3,0,
2026-03-03T03:26:13.728523+00:00,BUCKET,llm_style,eval,llm_style_eval_234,32,8192,4096,bf16,NVIDIA GeForce RTX 4060,c06,64,128,32,4,3,8,0.0,0.0,761.2000107765198,820.1011294126508,2.8211818412998926,1,-1,-1,llm8_g1,0,
2026-03-03T03:26:13.743976+00:00,BUCKET,llm_style,eval,llm_style_eval_235,4,2048,1024,bf16,NVIDIA GeForce RTX 4060,c11,32,128,32,4,2,8,0.0,0.0,86.01599931716919,244.96928185224522,0.19504762059598826,7,-1,-1,llm8_g7,0,
2026-03-03T03:26:13.876203+00:00,BUCKET,llm_style,eval,llm_style_eval_236,4,8192,3072,bf16,NVIDIA GeForce RTX 4060,c02,32,64,32,2,2,8,0.0,0.0,373.24801087379456,449.26527857780445,0.5393909307880387,5,-1,-1,llm8_g5,0,
2026-03-03T03:26:13.911327+00:00,BUCKET,llm_style,eval,llm_style_eval_237,64,1024,4096,bf16,NVIDIA GeForce RTX 4060,c11,32,128,32,4,2,8,0.0,0.0,249.11999702453613,274.37087923288345,2.155069518353932,3,-1,-1,llm8_g3,0,
2026-03-03T03:26:14.002052+00:00,BUCKET,llm_style,eval,llm_style_eval_238,32,2048,6144,bf16,NVIDIA GeForce RTX 4060,c11,32,128,32,4,2,8,0.0,0.0,377.85598635673523,482.12159782648087,2.1312521094735475,3,-1,-1,llm8_g3,0,
2026-03-03T03:26:14.026388+00:00,BUCKET,llm_style,eval,llm_style_eval_239,32,2048,6144,bf16,NVIDIA GeForce RTX 4060,c11,32,128,32,4,2,8,0.0,0.0,380.41600584983826,435.2000057697296,2.116909792480916,3,-1,-1,llm8_g3,0,
2026-03-03T03:26:14.102441+00:00,BUCKET,llm_style,eval,llm_style_eval_240,8,8192,1536,bf16,NVIDIA GeForce RTX 4060,c02,32,64,32,2,2,8,0.0,0.0,210.94399690628052,313.006078004837,0.9544077809877026,5,-1,-1,llm8_g5,0,
2026-03-03T03:26:14.123139+00:00,BUCKET,llm_style,eval,llm_style_eval_241,16,1536,1536,bf16,NVIDIA GeForce RTX 4060,c11,32,128,32,4,2,8,0.0,0.0,112.64000087976456,123.92447724938393,0.6702545402195829,7,-1,-1,llm8_g7,0,
2026-03-03T03:26:14.158161+00:00,BUCKET,llm_style,eval,llm_style_eval_242,1,2048,3072,bf16,NVIDIA GeForce RTX 4060,c11,32,128,32,4,2,8,0.0,0.0,189.43999707698822,307.31264293193783,0.06642162264649064,7,-1,-1,llm8_g7,0,
2026-03-03T03:26:14.217371+00:00,BUCKET,llm_style,eval,llm_style_eval_243,8,1536,6144,bf16,NVIDIA GeForce RTX 4060,c11,32,128,32,4,2,8,0.0,0.0,353.1839996576309,417.3721632361412,0.4275248713032621,7,-1,-1,llm8_g7,0,
2026-03-03T03:26:14.269208+00:00,BUCKET,llm_style,eval,llm_style_eval_244,32,8192,1024,bf16,NVIDIA GeForce RTX 4060,c06,64,128,32,4,3,8,0.0,0.0,218.1120067834854,327.6288029551505,2.461445932836421,1,-1,-1,llm8_g1,0,
2026-03-03T03:26:14.402850+00:00,BUCKET,llm_style,eval,llm_style_eval_245,4,6144,4096,bf16,NVIDIA GeForce RTX 4060,c02,32,64,32,2,2,8,0.0,0.0,368.1119978427887,680.769936144351,0.5469166807379678,5,-1,-1,llm8_g5,0,
2026-03-03T03:26:14.485047+00:00,BUCKET,llm_style,eval,llm_style_eval_246,32,2048,6144,bf16,NVIDIA GeForce RTX 4060,c11,32,128,32,4,2,8,0.0,0.0,379.8239976167679,463.390716612339,2.120209289178543,3,-1,-1,llm8_g3,0,
2026-03-03T03:26:14.558059+00:00,BUCKET,llm_style,eval,llm_style_eval_247,64,6144,2048,bf16,NVIDIA GeForce RTX 4060,c06,64,128,32,4,3,8,0.0,0.0,278.49599719047546,331.98336333036406,5.783252729835223,1,-1,-1,llm8_g1,0,
2026-03-03T03:26:14.570106+00:00,BUCKET,llm_style,eval,llm_style_eval_248,64,1024,1024,bf16,NVIDIA GeForce RTX 4060,c11,32,128,32,4,2,8,0.0,0.0,86.01599931716919,139.19232226908198,1.560380964767906,3,-1,-1,llm8_g3,0,
2026-03-03T03:26:14.623052+00:00,BUCKET,llm_style,eval,llm_style_eval_249,2,8192,1024,bf16,NVIDIA GeForce RTX 4060,c02,32,64,32,2,2,8,0.0,0.0,173.45600575208664,244.86911684274662,0.19344635462180498,5,-1,-1,llm8_g5,0,
2026-03-03T03:26:14.680996+00:00,BUCKET,llm_style,eval,llm_style_eval_250,64,3072,3072,bf16,NVIDIA GeForce RTX 4060,c11,32,128,32,4,2,8,0.0,0.0,218.1120067834854,271.3929581642151,5.538253348881947,3,-1,-1,llm8_g3,0,
2026-03-03T03:26:14.753423+00:00,BUCKET,llm_style,eval,llm_style_eval_251,64,1024,8192,bf16,NVIDIA GeForce RTX 4060,c10,64,128,64,8,3,8,0.0,0.0,550.9120225906372,588.0156737565994,1.949025942383288,2,-1,-1,llm8_g2,0,
2026-03-03T03:26:14.832088+00:00,BUCKET,llm_style,eval,llm_style_eval_252,64,4096,3072,bf16,NVIDIA GeForce RTX 4060,c11,32,128,32,4,2,8,0.0,0.0,353.10399532318115,487.50592082738876,4.561298533384972,3,-1,-1,llm8_g3,0,
2026-03-03T03:26:14.964544+00:00,BUCKET,llm_style,eval,llm_style_eval_253,8,6144,4096,bf16,NVIDIA GeForce RTX 4060,c02,32,64,32,2,2,8,0.0,0.0,369.6160018444061,478.51999342441536,1.0893824455400642,5,-1,-1,llm8_g5,0,
2026-03-03T03:26:14.992763+00:00,BUCKET,llm_style,eval,llm_style_eval_254,4,1536,3072,bf16,NVIDIA GeForce RTX 4060,c11,32,128,32,4,2,8,0.0,0.0,191.8720006942749,269.3529614806173,0.19673915872774006,7,-1,-1,llm8_g7,0,
2026-03-03T03:26:15.015488+00:00,BUCKET,llm_style,eval,llm_style_eval_255,1,3072,1536,bf16,NVIDIA GeForce RTX 4060,c11,32,128,32,4,2,8,0.0,0.0,109.45599898695946,212.58463978767378,0.08621897463221127,7,-1,-1,llm8_g7,0,
