results/llm_hp2_m8_n3072_k4096.csv
timestamp,method,workload,split,shape_id,M,N,K,dtype,gpu,config_id,BLOCK_M,BLOCK_N,BLOCK_K,num_warps,num_stages,GROUP_M,compile_time_ms,tune_time_ms,runtime_cost_us,p99_us,runtime_perf_tflops,bucket_m,bucket_n,bucket_k,cache_key,invalid_config,notes
2026-03-03T03:40:22.231917+00:00,FULL,llm_style,tune,llm_style_tune_000,32,3072,2048,bf16,NVIDIA GeForce RTX 4060,c02,32,64,32,2,2,8,0.7814079290255904,494.655,55.36000058054924,173.9392015337941,7.273359461297989,3,-1,-1,32x3072x2048,0,
2026-03-03T03:40:22.352280+00:00,FULL,llm_style,tune,llm_style_tune_001,4,4096,1536,bf16,NVIDIA GeForce RTX 4060,c11,32,128,32,4,2,8,0.0,120.331,50.143999978899956,84.4832010567188,1.0037421829367223,5,-1,-1,4x4096x1536,0,
2026-03-03T03:40:22.458351+00:00,FULL,llm_style,tune,llm_style_tune_002,8,8192,1024,bf16,NVIDIA GeForce RTX 4060,c11,32,128,32,4,2,8,0.0,106.035,52.22399905323982,229.31871145963652,2.570039262278087,5,-1,-1,8x8192x1024,0,
2026-03-03T03:40:22.562753+00:00,FULL,llm_style,tune,llm_style_tune_003,64,1024,4096,bf16,NVIDIA GeForce RTX 4060,c04,64,64,64,4,3,8,0.0,104.362,61.28000095486641,122.92096406221367,8.760948166358762,3,-1,-1,64x1024x4096,0,
2026-03-03T03:40:22.713166+00:00,FULL,llm_style,tune,llm_style_tune_004,16,3072,4096,bf16,NVIDIA GeForce RTX 4060,c00,32,32,32,2,2,8,0.0,150.366,76.86400040984154,158.35391670465464,5.238514543258732,3,-1,-1,16x3072x4096,0,
2026-03-03T03:40:22.811378+00:00,FULL,llm_style,tune,llm_style_tune_005,16,1536,4096,bf16,NVIDIA GeForce RTX 4060,c04,64,64,64,4,3,8,0.0,98.161,60.20800024271011,110.96095904707909,3.343851169087389,3,-1,-1,16x1536x4096,0,
2026-03-03T03:40:22.867224+00:00,FULL,llm_style,tune,llm_style_tune_006,2,2048,1024,bf16,NVIDIA GeForce RTX 4060,c11,32,128,32,4,2,8,0.0,55.8,38.704000413417816,100.23136280477027,0.2167374925174881,7,-1,-1,2x2048x1024,0,
2026-03-03T03:40:22.946974+00:00,FULL,llm_style,tune,llm_style_tune_007,32,6144,1024,bf16,NVIDIA GeForce RTX 4060,c11,32,128,32,4,2,8,0.0,79.704,42.7200011909008,48.0915206670761,9.425401984440104,1,-1,-1,32x6144x1024,0,
2026-03-03T03:40:23.012912+00:00,FULL,llm_style,tune,llm_style_tune_008,8,1536,2048,bf16,NVIDIA GeForce RTX 4060,c04,64,64,64,4,3,8,0.0,65.888,41.98399931192398,46.16320118308067,1.198829287940303,7,-1,-1,8x1536x2048,0,
2026-03-03T03:40:23.128903+00:00,FULL,llm_style,tune,llm_style_tune_009,16,1024,6144,bf16,NVIDIA GeForce RTX 4060,c04,64,64,64,4,3,8,0.0,115.947,70.51200047135353,132.0019156485794,2.855210328088645,2,-1,-1,16x1024x6144,0,
2026-03-03T03:40:23.199975+00:00,FULL,llm_style,tune,llm_style_tune_010,64,1536,2048,bf16,NVIDIA GeForce RTX 4060,c04,64,64,64,4,3,8,0.0,71.028,43.88799890875816,50.19648019224405,9.174562386339463,3,-1,-1,64x1536x2048,0,
2026-03-03T03:40:23.295491+00:00,FULL,llm_style,tune,llm_style_tune_011,64,1536,4096,bf16,NVIDIA GeForce RTX 4060,c04,64,64,64,4,3,8,0.0,95.471,57.00800009071827,62.46879868209361,14.126199247798477,3,-1,-1,64x1536x4096,0,
2026-03-03T03:40:23.376176+00:00,FULL,llm_style,tune,llm_style_tune_012,32,1024,2048,bf16,NVIDIA GeForce RTX 4060,c04,64,64,64,4,3,8,0.0,80.642,44.8479987680912,57.40928128361702,2.9927250197726605,3,-1,-1,32x1024x2048,0,
2026-03-03T03:40:23.429247+00:00,FULL,llm_style,tune,llm_style_tune_013,64,1536,1024,bf16,NVIDIA GeForce RTX 4060,c04,64,64,64,4,3,8,0.0,53.035,35.53599864244461,141.7727991938589,5.6654266009435625,3,-1,-1,64x1536x1024,0,
2026-03-03T03:40:23.668688+00:00,FULL,llm_style,tune,llm_style_tune_014,4,6144,3072,bf16,NVIDIA GeForce RTX 4060,c00,32,32,32,2,2,8,0.0,239.4,173.552006483078,193.1161619722843,0.8700270717683842,5,-1,-1,4x6144x3072,0,
2026-03-03T03:40:23.758987+00:00,FULL,llm_style,tune,llm_style_tune_015,1,6144,1024,bf16,NVIDIA GeForce RTX 4060,c00,32,32,32,2,2,8,0.0,90.258,21.503999829292297,159.93664175271982,0.5851428617879647,5,-1,-1,1x6144x1024,0,
2026-03-03T03:40:24.160450+00:00,FULL,llm_style,tune,llm_style_tune_016,4,8192,4096,bf16,NVIDIA GeForce RTX 4060,c02,32,64,32,2,2,8,0.0,401.427,294.9120104312897,331.5081670880317,0.9102221900268849,5,-1,-1,4x8192x4096,0,
2026-03-03T03:40:24.181612+00:00,FULL,llm_style,tune,llm_style_tune_017,64,1536,2048,bf16,NVIDIA GeForce RTX 4060,c04,64,64,64,4,3,8,0.0,0.0,47.10400104522705,130.69311954081056,8.548173723361447,3,-1,-1,64x1536x2048,0,
2026-03-03T03:40:24.356655+00:00,FULL,llm_style,tune,llm_style_tune_018,64,8192,1536,bf16,NVIDIA GeForce RTX 4060,c06,64,128,32,4,3,8,0.0,174.994,107.51999914646149,116.23424209654331,14.979657261771896,1,-1,-1,64x8192x1536,0,
2026-03-03T03:40:24.422173+00:00,FULL,llm_style,tune,llm_style_tune_019,2,1536,1024,bf16,NVIDIA GeForce RTX 4060,c04,64,64,64,4,3,8,0.0,65.476,40.271999314427376,112.22016073763368,0.1562240789407765,7,-1,-1,2x1536x1024,0,
2026-03-03T03:40:24.482634+00:00,FULL,llm_style,tune,llm_style_tune_020,16,1024,1536,bf16,NVIDIA GeForce RTX 4060,c04,64,64,64,4,3,8,0.0,60.424,39.91999849677086,47.48223952949046,1.2608128731285235,3,-1,-1,16x1024x1536,0,
2026-03-03T03:40:24.588114+00:00,FULL,llm_style,tune,llm_style_tune_021,1,6144,1536,bf16,NVIDIA GeForce RTX 4060,c11,32,128,32,4,2,8,0.0,105.442,45.104000717401505,54.31295976042746,0.41846327819691853,5,-1,-1,1x6144x1536,0,
2026-03-03T03:40:24.809999+00:00,FULL,llm_style,tune,llm_style_tune_022,8,4096,4096,bf16,NVIDIA GeForce RTX 4060,c11,32,128,32,4,2,8,0.0,221.84,161.79199516773224,212.0540766417979,1.6591392900601099,5,-1,-1,8x4096x4096,0,
2026-03-03T03:40:25.199920+00:00,FULL,llm_style,tune,llm_style_tune_023,2,4096,8192,bf16,NVIDIA GeForce RTX 4060,c11,32,128,32,4,2,8,0.0,389.877,292.86399483680725,365.47934889793385,0.4582937143734251,4,-1,-1,2x4096x8192,0,
2026-03-03T03:40:25.228291+00:00,FULL,llm_style,tune,llm_style_tune_024,64,1536,2048,bf16,NVIDIA GeForce RTX 4060,c04,64,64,64,4,3,8,0.0,0.0,26.655999943614006,151.86367839574805,15.105536646598916,3,-1,-1,64x1536x2048,0,
2026-03-03T03:40:25.256181+00:00,FULL,llm_style,tune,llm_style_tune_025,4,4096,1536,bf16,NVIDIA GeForce RTX 4060,c11,32,128,32,4,2,8,0.0,0.0,48.128001391887665,283.3046419918534,1.0457872037978244,5,-1,-1,4x4096x1536,0,
2026-03-03T03:40:25.337696+00:00,FULL,llm_style,tune,llm_style_tune_026,4,3072,2048,bf16,NVIDIA GeForce RTX 4060,c11,32,128,32,4,2,8,0.0,81.461,51.88800022006035,67.05792080610988,0.9700055463024253,7,-1,-1,4x3072x2048,0,
2026-03-03T03:40:25.408884+00:00,FULL,llm_style,tune,llm_style_tune_027,8,4096,1024,bf16,NVIDIA GeForce RTX 4060,c11,32,128,32,4,2,8,0.0,71.147,40.271999314427376,142.40768335759628,1.6663901753682828,5,-1,-1,8x4096x1024,0,
2026-03-03T03:40:25.461953+00:00,FULL,llm_style,tune,llm_style_tune_028,16,1536,1024,bf16,NVIDIA GeForce RTX 4060,c00,32,32,32,2,2,8,0.0,53.029,32.67199918627739,110.81600025296207,1.540513260698778,3,-1,-1,16x1536x1024,0,
2026-03-03T03:40:25.881958+00:00,FULL,llm_style,tune,llm_style_tune_029,64,4096,8192,bf16,NVIDIA GeForce RTX 4060,c02,32,64,32,2,2,8,0.0,419.966,300.3999888896942,322.58047729730606,14.297494856356657,0,-1,-1,64x4096x8192,0,
2026-03-03T03:40:26.047388+00:00,FULL,llm_style,tune,llm_style_tune_030,1,8192,1536,bf16,NVIDIA GeForce RTX 4060,c11,32,128,32,4,2,8,0.0,165.383,59.119999408721924,63.47231902182102,0.42567361724782604,5,-1,-1,1x8192x1536,0,
2026-03-03T03:40:26.611993+00:00,FULL,llm_style,tune,llm_style_tune_031,1,8192,6144,bf16,NVIDIA GeForce RTX 4060,c04,64,64,64,4,3,8,0.0,564.563,427.8239905834198,487.5776124000548,0.2352913773318938,4,-1,-1,1x8192x6144,0,
2026-03-03T03:40:26.913483+00:00,FULL,llm_style,tune,llm_style_tune_032,32,3072,8192,bf16,NVIDIA GeForce RTX 4060,c10,64,128,64,8,3,8,0.0,301.445,230.3999960422516,289.9763214588165,6.990506786747687,2,-1,-1,32x3072x8192,0,
2026-03-03T03:40:27.040098+00:00,FULL,llm_style,tune,llm_style_tune_033,4,1536,6144,bf16,NVIDIA GeForce RTX 4060,c04,64,64,64,4,3,8,0.0,126.572,70.65600156784058,94.6473616361618,1.0685217154201807,6,-1,-1,4x1536x6144,0,
2026-03-03T03:40:27.135812+00:00,FULL,llm_style,tune,llm_style_tune_034,1,4096,1536,bf16,NVIDIA GeForce RTX 4060,c11,32,128,32,4,2,8,0.0,95.67,46.08000069856644,61.163522005081134,0.2730666625270138,5,-1,-1,1x4096x1536,0,
2026-03-03T03:40:27.228344+00:00,FULL,llm_style,tune,llm_style_tune_035,4,1536,4096,bf16,NVIDIA GeForce RTX 4060,c04,64,64,64,4,3,8,0.0,92.486,56.32000043988228,76.90239988267419,0.8936727202927771,7,-1,-1,4x1536x4096,0,
2026-03-03T03:40:27.536283+00:00,FULL,llm_style,tune,llm_style_tune_036,32,8192,3072,bf16,NVIDIA GeForce RTX 4060,c10,64,128,64,8,3,8,0.0,307.895,229.37600314617157,253.25439125299454,7.021714189402912,1,-1,-1,32x8192x3072,0,
2026-03-03T03:40:27.570607+00:00,FULL,llm_style,tune,llm_style_tune_037,32,3072,2048,bf16,NVIDIA GeForce RTX 4060,c02,32,64,32,2,2,8,0.0,0.0,59.13599953055382,72.33120247721669,6.808935118987225,3,-1,-1,32x3072x2048,0,
2026-03-03T03:40:27.683457+00:00,FULL,llm_style,tune,llm_style_tune_038,2,2048,4096,bf16,NVIDIA GeForce RTX 4060,c11,32,128,32,4,2,8,0.0,112.794,74.75200295448303,91.29983730614182,0.4488766945874548,7,-1,-1,2x2048x4096,0,
2026-03-03T03:40:27.765939+00:00,FULL,llm_style,tune,llm_style_tune_039,64,2048,1536,bf16,NVIDIA GeForce RTX 4060,c11,32,128,32,4,2,8,0.0,82.441,48.81599918007851,56.679039373993874,8.248385585935527,3,-1,-1,64x2048x1536,0,
2026-03-03T03:40:27.884349+00:00,FULL,llm_style,tune,llm_style_tune_040,64,1024,6144,bf16,NVIDIA GeForce RTX 4060,c04,64,64,64,4,3,8,0.0,118.368,70.73600217700005,87.22431972622869,11.384674610036797,2,-1,-1,64x1024x6144,0,
2026-03-03T03:40:28.468814+00:00,FULL,llm_style,tune,llm_style_tune_041,4,8192,6144,bf16,NVIDIA GeForce RTX 4060,c11,32,128,32,4,2,8,0.0,584.422,424.9599874019623,441.3331201672554,0.9475084618240478,4,-1,-1,4x8192x6144,0,
2026-03-03T03:40:28.587303+00:00,FULL,llm_style,tune,llm_style_tune_042,1,1024,6144,bf16,NVIDIA GeForce RTX 4060,c04,64,64,64,4,3,8,0.0,118.447,71.68000191450119,78.70687946677208,0.1755428524542829,6,-1,-1,1x1024x6144,0,
2026-03-03T03:40:28.820678+00:00,FULL,llm_style,tune,llm_style_tune_043,64,2048,8192,bf16,NVIDIA GeForce RTX 4060,c10,64,128,64,8,3,8,0.0,233.32,166.9120043516159,177.6172834634781,12.865962854751436,2,-1,-1,64x2048x8192,0,
2026-03-03T03:40:28.886202+00:00,FULL,llm_style,tune,llm_style_tune_044,16,2048,1024,bf16,NVIDIA GeForce RTX 4060,c11,32,128,32,4,2,8,0.0,65.465,39.59999978542328,48.691199682652936,1.6946682920110192,3,-1,-1,16x2048x1024,0,
2026-03-03T03:40:28.941998+00:00,FULL,llm_style,tune,llm_style_tune_045,4,1024,1536,bf16,NVIDIA GeForce RTX 4060,c00,32,32,32,2,2,8,0.0,55.755,29.184000566601753,504.77470509707774,0.43115788636599456,7,-1,-1,4x1024x1536,0,
2026-03-03T03:40:28.981103+00:00,FULL,llm_style,tune,llm_style_tune_046,64,1536,4096,bf16,NVIDIA GeForce RTX 4060,c04,64,64,64,4,3,8,0.0,0.0,64.55999985337257,158.32063764333722,12.473766571081107,3,-1,-1,64x1536x4096,0,
2026-03-03T03:40:29.045808+00:00,FULL,llm_style,tune,llm_style_tune_047,16,2048,1536,bf16,NVIDIA GeForce RTX 4060,c00,32,32,32,2,2,8,0.0,64.648,40.95999896526337,54.81471993029117,2.4576000620842,3,-1,-1,16x2048x1536,0,
2026-03-03T03:40:29.481244+00:00,FULL,llm_style,tune,llm_style_tune_048,64,6144,6144,bf16,NVIDIA GeForce RTX 4060,c06,64,128,32,4,3,8,0.0,435.385,334.22400057315826,464.81441050767876,14.456885800283393,0,-1,-1,64x6144x6144,0,
2026-03-03T03:40:29.889696+00:00,FULL,llm_style,tune,llm_style_tune_049,4,4096,8192,bf16,NVIDIA GeForce RTX 4060,c11,32,128,32,4,2,8,0.0,408.407,291.83998703956604,328.3865705132484,0.9198035496198368,4,-1,-1,4x4096x8192,0,
2026-03-03T03:40:30.040362+00:00,FULL,llm_style,tune,llm_style_tune_050,1,4096,3072,bf16,NVIDIA GeForce RTX 4060,c11,32,128,32,4,2,8,0.0,150.621,67.58400052785873,73.22624243795872,0.3723636334553238,5,-1,-1,1x4096x3072,0,
2026-03-03T03:40:30.149694+00:00,FULL,llm_style,tune,llm_style_tune_051,2,4096,2048,bf16,NVIDIA GeForce RTX 4060,c00,32,32,32,2,2,8,0.0,109.289,48.64000156521797,117.63936154544353,0.6898526093797347,5,-1,-1,2x4096x2048,0,
2026-03-03T03:40:30.294588+00:00,FULL,llm_style,tune,llm_style_tune_052,4,8192,1536,bf16,NVIDIA GeForce RTX 4060,c11,32,128,32,4,2,8,0.0,144.85,60.15999987721443,68.53920005261898,1.6732595778831805,5,-1,-1,4x8192x1536,0,
2026-03-03T03:40:30.382936+00:00,FULL,llm_style,tune,llm_style_tune_053,1,1536,4096,bf16,NVIDIA GeForce RTX 4060,c00,32,32,32,2,2,8,0.0,88.305,55.296000093221664,74.76160272955893,0.2275555551719273,7,-1,-1,1x1536x4096,0,
2026-03-03T03:40:30.939761+00:00,FULL,llm_style,tune,llm_style_tune_054,8,8192,6144,bf16,NVIDIA GeForce RTX 4060,c11,32,128,32,4,2,8,0.0,556.776,425.9839951992035,490.39711594581604,1.8904615597668486,4,-1,-1,8x8192x6144,0,
2026-03-03T03:40:31.048245+00:00,FULL,llm_style,tune,llm_style_tune_055,64,6144,1536,bf16,NVIDIA GeForce RTX 4060,c06,64,128,32,4,3,8,0.0,108.436,64.51199948787689,70.592001080513,18.72457157721487,1,-1,-1,64x6144x1536,0,
2026-03-03T03:40:31.118876+00:00,FULL,llm_style,tune,llm_style_tune_056,1,3072,1536,bf16,NVIDIA GeForce RTX 4060,c11,32,128,32,4,2,8,0.0,70.588,44.03200000524521,86.86591945588582,0.2143255813698178,7,-1,-1,1x3072x1536,0,
2026-03-03T03:40:31.178688+00:00,FULL,llm_style,tune,llm_style_tune_057,64,1024,1024,bf16,NVIDIA GeForce RTX 4060,c04,64,64,64,4,3,8,0.0,59.77,37.50399872660637,71.31328247487544,3.5787578006923897,3,-1,-1,64x1024x1024,0,
2026-03-03T03:40:31.576823+00:00,FULL,llm_style,tune,llm_style_tune_058,16,8192,4096,bf16,NVIDIA GeForce RTX 4060,c11,32,128,32,4,2,8,0.0,398.092,294.8960065841675,343.21568667888636,3.641086349175566,1,-1,-1,16x8192x4096,0,
2026-03-03T03:40:31.888998+00:00,FULL,llm_style,tune,llm_style_tune_059,16,4096,6144,bf16,NVIDIA GeForce RTX 4060,c00,32,32,32,2,2,8,0.0,312.131,228.14399749040604,240.0240059196949,3.529816154965308,0,-1,-1,16x4096x6144,0,
2026-03-03T03:40:32.180576+00:00,FULL,llm_style,tune,llm_style_tune_060,2,3072,8192,bf16,NVIDIA GeForce RTX 4060,c04,64,64,64,4,3,8,0.0,291.536,227.32800245285034,270.2847981452941,0.4428108060329188,6,-1,-1,2x3072x8192,0,
2026-03-03T03:40:32.347184+00:00,FULL,llm_style,tune,llm_style_tune_061,64,4096,8192,bf16,NVIDIA GeForce RTX 4060,c02,32,64,32,2,2,8,0.0,0.0,301.39200389385223,418.34176272153854,14.250435447891482,0,-1,-1,64x4096x8192,0,
2026-03-03T03:40:32.500360+00:00,FULL,llm_style,tune,llm_style_tune_062,32,4096,3072,bf16,NVIDIA GeForce RTX 4060,c02,32,64,32,2,2,8,0.0,153.121,79.8719972372055,165.42399734258643,10.082461887216674,1,-1,-1,32x4096x3072,0,
2026-03-03T03:40:32.636695+00:00,FULL,llm_style,tune,llm_style_tune_063,2,3072,8192,bf16,NVIDIA GeForce RTX 4060,c04,64,64,64,4,3,8,0.0,0.0,257.02399015426636,323.23199689388264,0.3916494173932234,6,-1,-1,2x3072x8192,0,
2026-03-03T03:40:32.707456+00:00,FULL,llm_style,eval,llm_style_eval_000,32,1536,1024,bf16,NVIDIA GeForce RTX 4060,c11,32,128,32,4,2,8,0.0,70.705,38.72000053524971,55.904639512300456,2.5997751706733236,3,-1,-1,32x1536x1024,0,
2026-03-03T03:40:32.936071+00:00,FULL,llm_style,eval,llm_style_eval_001,32,2048,8192,bf16,NVIDIA GeForce RTX 4060,c10,64,128,64,8,3,8,0.0,228.572,163.93599659204483,173.95360186696053,6.549762384841015,2,-1,-1,32x2048x8192,0,
2026-03-03T03:40:33.064473+00:00,FULL,llm_style,eval,llm_style_eval_002,16,2048,4096,bf16,NVIDIA GeForce RTX 4060,c00,32,32,32,2,2,8,0.0,128.353,38.91199827194214,112.77311697602259,6.8985266221487755,3,-1,-1,16x2048x4096,0,
2026-03-03T03:40:33.087205+00:00,FULL,llm_style,eval,llm_style_eval_003,16,2048,1536,bf16,NVIDIA GeForce RTX 4060,c00,32,32,32,2,2,8,0.0,0.0,69.29599866271019,206.725122630596,1.452656689312846,3,-1,-1,16x2048x1536,0,
2026-03-03T03:40:33.308780+00:00,FULL,llm_style,eval,llm_style_eval_004,64,8192,2048,bf16,NVIDIA GeForce RTX 4060,c10,64,128,64,8,3,8,0.0,221.529,166.9120043516159,192.1536016464233,12.865962854751436,1,-1,-1,64x8192x2048,0,
2026-03-03T03:40:33.611932+00:00,FULL,llm_style,eval,llm_style_eval_005,64,3072,8192,bf16,NVIDIA GeForce RTX 4060,c06,64,128,32,4,3,8,0.0,303.11,233.2959994673729,268.71007725596417,13.807461248174972,2,-1,-1,64x3072x8192,0,
2026-03-03T03:40:33.699647+00:00,FULL,llm_style,eval,llm_style_eval_006,32,2048,2048,bf16,NVIDIA GeForce RTX 4060,c00,32,32,32,2,2,8,0.0,87.669,49.20000024139881,156.5350429713725,5.456005176482253,3,-1,-1,32x2048x2048,0,
2026-03-03T03:40:33.924042+00:00,FULL,llm_style,eval,llm_style_eval_007,8,8192,2048,bf16,NVIDIA GeForce RTX 4060,c11,32,128,32,4,2,8,0.0,224.345,161.79199516773224,207.7840049564838,1.6591392900601099,5,-1,-1,8x8192x2048,0,
2026-03-03T03:40:34.117839+00:00,FULL,llm_style,eval,llm_style_eval_008,64,1536,8192,bf16,NVIDIA GeForce RTX 4060,c04,64,64,64,4,3,8,0.0,193.752,119.52000111341476,127.85888135433197,13.475675376472424,2,-1,-1,64x1536x8192,0,
2026-03-03T03:40:34.435060+00:00,FULL,llm_style,eval,llm_style_eval_009,64,4096,6144,bf16,NVIDIA GeForce RTX 4060,c00,32,32,32,2,2,8,0.0,317.178,234.24000293016434,265.76031833887095,13.751816221417856,0,-1,-1,64x4096x6144,0,
2026-03-03T03:40:34.559300+00:00,FULL,llm_style,eval,llm_style_eval_010,64,2048,4096,bf16,NVIDIA GeForce RTX 4060,c11,32,128,32,4,2,8,0.0,124.197,78.65599915385246,87.44159877300262,13.651111619594875,3,-1,-1,64x2048x4096,0,
2026-03-03T03:40:34.797844+00:00,FULL,llm_style,eval,llm_style_eval_011,32,3072,6144,bf16,NVIDIA GeForce RTX 4060,c10,64,128,64,8,3,8,0.0,238.503,179.85600233078003,246.21951982378948,6.71625932048904,2,-1,-1,32x3072x6144,0,
2026-03-03T03:40:34.867926+00:00,FULL,llm_style,eval,llm_style_eval_012,16,1536,1536,bf16,NVIDIA GeForce RTX 4060,c04,64,64,64,4,3,8,0.0,70.04,41.98399931192398,53.72800093144178,1.7982439319104546,3,-1,-1,16x1536x1536,0,
2026-03-03T03:40:34.965392+00:00,FULL,llm_style,eval,llm_style_eval_013,64,2048,3072,bf16,NVIDIA GeForce RTX 4060,c11,32,128,32,4,2,8,0.0,97.42,65.5359998345375,71.26400224864483,12.288000031024216,3,-1,-1,64x2048x3072,0,
2026-03-03T03:40:35.546252+00:00,FULL,llm_style,eval,llm_style_eval_014,16,8192,6144,bf16,NVIDIA GeForce RTX 4060,c11,32,128,32,4,2,8,0.0,580.813,429.03999984264374,543.9385539293288,3.7539920207689588,0,-1,-1,16x8192x6144,0,
2026-03-03T03:40:35.588763+00:00,FULL,llm_style,eval,llm_style_eval_015,64,6144,1536,bf16,NVIDIA GeForce RTX 4060,c06,64,128,32,4,3,8,0.0,0.0,68.44799965620041,144.8943994194267,17.647843005892376,1,-1,-1,64x6144x1536,0,
2026-03-03T03:40:35.807642+00:00,FULL,llm_style,eval,llm_style_eval_016,16,4096,4096,bf16,NVIDIA GeForce RTX 4060,c00,32,32,32,2,2,8,0.0,218.824,160.08000075817108,227.6748774945736,3.353766300957467,1,-1,-1,16x4096x4096,0,
2026-03-03T03:40:36.219078+00:00,FULL,llm_style,eval,llm_style_eval_017,64,8192,4096,bf16,NVIDIA GeForce RTX 4060,c10,64,128,64,8,3,8,0.0,411.393,303.1040132045746,349.7971141338348,14.169945328639345,1,-1,-1,64x8192x4096,0,
2026-03-03T03:40:36.534196+00:00,FULL,llm_style,eval,llm_style_eval_018,32,4096,6144,bf16,NVIDIA GeForce RTX 4060,c11,32,128,32,4,2,8,0.0,315.072,229.37600314617157,284.3020814657211,7.021714189402912,0,-1,-1,32x4096x6144,0,
2026-03-03T03:40:36.835335+00:00,FULL,llm_style,eval,llm_style_eval_019,16,3072,8192,bf16,NVIDIA GeForce RTX 4060,c06,64,128,32,4,3,8,0.0,301.092,227.23199427127838,247.9718494415283,3.543983190318675,2,-1,-1,16x3072x8192,0,
2026-03-03T03:40:36.904906+00:00,FULL,llm_style,eval,llm_style_eval_020,4,1536,1536,bf16,NVIDIA GeForce RTX 4060,c04,64,64,64,4,3,8,0.0,69.527,43.136000633239746,46.43967963755131,0.4375548897190943,7,-1,-1,4x1536x1536,0,
2026-03-03T03:40:37.018507+00:00,FULL,llm_style,eval,llm_style_eval_021,4,6144,1536,bf16,NVIDIA GeForce RTX 4060,c11,32,128,32,4,2,8,0.0,113.556,48.128001391887665,134.2054407298565,1.5686808056967365,5,-1,-1,4x6144x1536,0,
2026-03-03T03:40:37.047559+00:00,FULL,llm_style,eval,llm_style_eval_022,32,6144,1024,bf16,NVIDIA GeForce RTX 4060,c11,32,128,32,4,2,8,0.0,0.0,45.05600035190582,57.88672097027302,8.936727202927772,1,-1,-1,32x6144x1024,0,
2026-03-03T03:40:37.059399+00:00,FULL,llm_style,eval,llm_style_eval_023,16,1024,1536,bf16,NVIDIA GeForce RTX 4060,c04,64,64,64,4,3,8,0.0,0.0,40.591999888420105,143.16480115056035,1.2399400901249602,3,-1,-1,16x1024x1536,0,
2026-03-03T03:40:37.158833+00:00,FULL,llm_style,eval,llm_style_eval_024,32,8192,1024,bf16,NVIDIA GeForce RTX 4060,c11,32,128,32,4,2,8,0.0,99.388,49.136001616716385,52.05151956528425,10.926223020502203,1,-1,-1,32x8192x1024,0,
2026-03-03T03:40:37.582548+00:00,FULL,llm_style,eval,llm_style_eval_025,32,6144,6144,bf16,NVIDIA GeForce RTX 4060,c06,64,128,32,4,3,8,0.0,423.671,329.72800731658936,350.8371150493622,7.327006048595527,0,-1,-1,32x6144x6144,0,
2026-03-03T03:40:37.719321+00:00,FULL,llm_style,eval,llm_style_eval_026,1,6144,2048,bf16,NVIDIA GeForce RTX 4060,c11,32,128,32,4,2,8,0.0,136.729,56.20799958705902,102.07231700420365,0.4477267325804995,5,-1,-1,1x6144x2048,0,
2026-03-03T03:40:37.790815+00:00,FULL,llm_style,eval,llm_style_eval_027,32,4096,3072,bf16,NVIDIA GeForce RTX 4060,c02,32,64,32,2,2,8,0.0,0.0,83.31199735403061,154.00000244379044,9.666151257638038,1,-1,-1,32x4096x3072,0,
2026-03-03T03:40:37.858980+00:00,FULL,llm_style,eval,llm_style_eval_028,64,1536,1536,bf16,NVIDIA GeForce RTX 4060,c04,64,64,64,4,3,8,0.0,68.111,43.96799951791763,79.2063980177044,6.868401822032737,3,-1,-1,64x1536x1536,0,
2026-03-03T03:40:37.914643+00:00,FULL,llm_style,eval,llm_style_eval_029,2,3072,1024,bf16,NVIDIA GeForce RTX 4060,c00,32,32,32,2,2,8,0.0,55.621,34.7680002450943,110.2745600789785,0.36191071995219015,7,-1,-1,2x3072x1024,0,
2026-03-03T03:40:38.099557+00:00,FULL,llm_style,eval,llm_style_eval_030,32,1536,8192,bf16,NVIDIA GeForce RTX 4060,c04,64,64,64,4,3,8,0.0,184.872,97.28000313043594,105.93311801552773,8.278231312556818,2,-1,-1,32x1536x8192,0,
2026-03-03T03:40:38.191545+00:00,FULL,llm_style,eval,llm_style_eval_031,8,3072,2048,bf16,NVIDIA GeForce RTX 4060,c11,32,128,32,4,2,8,0.0,91.94,52.000001072883606,71.65984131395815,1.935832575443788,7,-1,-1,8x3072x2048,0,
2026-03-03T03:40:38.281312+00:00,FULL,llm_style,eval,llm_style_eval_032,8,2048,3072,bf16,NVIDIA GeForce RTX 4060,c03,64,64,32,4,2,8,0.0,89.723,63.48799914121628,74.24767807126042,1.5855484085440266,7,-1,-1,8x2048x3072,0,
2026-03-03T03:40:38.345132+00:00,FULL,llm_style,eval,llm_style_eval_033,64,1536,8192,bf16,NVIDIA GeForce RTX 4060,c04,64,64,64,4,3,8,0.0,0.0,118.3839999139309,217.26463794708246,13.604986629704765,2,-1,-1,64x1536x8192,0,
2026-03-03T03:40:38.494332+00:00,FULL,llm_style,eval,llm_style_eval_034,64,6144,2048,bf16,NVIDIA GeForce RTX 4060,c06,64,128,32,4,3,8,0.0,149.143,95.20000219345093,104.00895841419697,16.91820061860039,1,-1,-1,64x6144x2048,0,
2026-03-03T03:40:38.603607+00:00,FULL,llm_style,eval,llm_style_eval_035,4,4096,2048,bf16,NVIDIA GeForce RTX 4060,c11,32,128,32,4,2,8,0.0,109.231,52.30399966239929,62.404800020158284,1.283054153280055,5,-1,-1,4x4096x2048,0,
2026-03-03T03:40:38.770349+00:00,FULL,llm_style,eval,llm_style_eval_036,64,8192,4096,bf16,NVIDIA GeForce RTX 4060,c10,64,128,64,8,3,8,0.0,0.0,304.1279911994934,340.09089082479477,14.122236098888731,1,-1,-1,64x8192x4096,0,
2026-03-03T03:40:38.801336+00:00,FULL,llm_style,eval,llm_style_eval_037,32,6144,1024,bf16,NVIDIA GeForce RTX 4060,c11,32,128,32,4,2,8,0.0,0.0,40.95999896526337,108.56447950005531,9.8304002483368,1,-1,-1,32x6144x1024,0,
2026-03-03T03:40:38.865743+00:00,FULL,llm_style,eval,llm_style_eval_038,64,6144,2048,bf16,NVIDIA GeForce RTX 4060,c06,64,128,32,4,3,8,0.0,0.0,75.21600276231766,229.76319894194586,21.413165773904943,1,-1,-1,64x6144x2048,0,
2026-03-03T03:40:38.943480+00:00,FULL,llm_style,eval,llm_style_eval_039,8,1024,3072,bf16,NVIDIA GeForce RTX 4060,c00,32,32,32,2,2,8,0.0,77.679,48.22400026023388,108.21631908416734,1.043705369284848,7,-1,-1,8x1024x3072,0,
2026-03-03T03:40:39.159309+00:00,FULL,llm_style,eval,llm_style_eval_040,32,8192,2048,bf16,NVIDIA GeForce RTX 4060,c10,64,128,64,8,3,8,0.0,215.787,162.81600296497345,189.10208061337465,6.594817489967455,1,-1,-1,32x8192x2048,0,
2026-03-03T03:40:39.228330+00:00,FULL,llm_style,eval,llm_style_eval_041,32,3072,1024,bf16,NVIDIA GeForce RTX 4060,c11,32,128,32,4,2,8,0.0,68.978,40.95999896526337,50.19648019224405,4.9152001241684,3,-1,-1,32x3072x1024,0,
2026-03-03T03:40:39.253122+00:00,FULL,llm_style,eval,llm_style_eval_042,64,1024,4096,bf16,NVIDIA GeForce RTX 4060,c04,64,64,64,4,3,8,0.0,0.0,59.39200147986412,294.66079324483826,9.039448050627108,3,-1,-1,64x1024x4096,0,
2026-03-03T03:40:39.266203+00:00,FULL,llm_style,eval,llm_style_eval_043,2,1536,1024,bf16,NVIDIA GeForce RTX 4060,c04,64,64,64,4,3,8,0.0,0.0,66.56000018119812,138.85664194822309,0.09452307666575414,7,-1,-1,2x1536x1024,0,
2026-03-03T03:40:39.501833+00:00,FULL,llm_style,eval,llm_style_eval_044,64,6144,3072,bf16,NVIDIA GeForce RTX 4060,c10,64,128,64,8,3,8,0.0,235.589,182.22399801015854,200.32480135560036,13.257963442692759,1,-1,-1,64x6144x3072,0,
2026-03-03T03:40:39.634135+00:00,FULL,llm_style,eval,llm_style_eval_045,64,1536,6144,bf16,NVIDIA GeForce RTX 4060,c04,64,64,64,4,3,8,0.0,132.255,72.7040022611618,81.75967976450919,16.61476004664584,2,-1,-1,64x1536x6144,0,
2026-03-03T03:40:39.863374+00:00,FULL,llm_style,eval,llm_style_eval_046,2,6144,3072,bf16,NVIDIA GeForce RTX 4060,c11,32,128,32,4,2,8,0.0,229.194,177.15199291706085,213.390717357397,0.4261734274440055,5,-1,-1,2x6144x3072,0,
2026-03-03T03:40:40.277147+00:00,FULL,llm_style,eval,llm_style_eval_047,16,4096,8192,bf16,NVIDIA GeForce RTX 4060,c11,32,128,32,4,2,8,0.0,413.729,292.89600253105164,317.30656355619425,3.6659490560516144,0,-1,-1,16x4096x8192,0,
2026-03-03T03:40:40.321167+00:00,FULL,llm_style,eval,llm_style_eval_048,16,1024,6144,bf16,NVIDIA GeForce RTX 4060,c04,64,64,64,4,3,8,0.0,0.0,73.72800260782242,200.14016017317763,2.730666570080655,2,-1,-1,16x1024x6144,0,
2026-03-03T03:40:40.458256+00:00,FULL,llm_style,eval,llm_style_eval_049,16,8192,1536,bf16,NVIDIA GeForce RTX 4060,c11,32,128,32,4,2,8,0.0,137.034,60.75199879705906,69.05408032238483,6.627817882092334,1,-1,-1,16x8192x1536,0,
2026-03-03T03:40:40.524609+00:00,FULL,llm_style,eval,llm_style_eval_050,1,1024,1024,bf16,NVIDIA GeForce RTX 4060,c00,32,32,32,2,2,8,0.0,66.314,32.70399942994118,100.46655744314194,0.06412524573615344,7,-1,-1,1x1024x1024,0,
2026-03-03T03:40:40.602188+00:00,FULL,llm_style,eval,llm_style_eval_051,16,6144,1024,bf16,NVIDIA GeForce RTX 4060,c11,32,128,32,4,2,8,0.0,77.542,40.95999896526337,69.31679993867867,4.9152001241684,1,-1,-1,16x6144x1024,0,
2026-03-03T03:40:41.377964+00:00,FULL,llm_style,eval,llm_style_eval_052,16,8192,8192,bf16,NVIDIA GeForce RTX 4060,c11,32,128,32,4,2,8,0.0,775.731,560.0800216197968,689.7452783584595,3.834244331353408,0,-1,-1,16x8192x8192,0,
2026-03-03T03:40:41.923427+00:00,FULL,llm_style,eval,llm_style_eval_053,1,6144,8192,bf16,NVIDIA GeForce RTX 4060,c11,32,128,32,4,2,8,0.0,545.412,423.93600940704346,452.6163163781166,0.2374492700933735,4,-1,-1,1x6144x8192,0,
2026-03-03T03:40:42.085344+00:00,FULL,llm_style,eval,llm_style_eval_054,64,4096,3072,bf16,NVIDIA GeForce RTX 4060,c04,64,64,64,4,3,8,0.0,161.871,88.06400001049042,95.17408184707165,18.28911627689112,1,-1,-1,64x4096x3072,0,
2026-03-03T03:40:42.183310+00:00,FULL,llm_style,eval,llm_style_eval_055,4,8192,1024,bf16,NVIDIA GeForce RTX 4060,c11,32,128,32,4,2,8,0.0,97.917,48.78399893641472,59.20479990541935,1.3756326964394614,5,-1,-1,4x8192x1024,0,
2026-03-03T03:40:42.267160+00:00,FULL,llm_style,eval,llm_style_eval_056,64,1024,3072,bf16,NVIDIA GeForce RTX 4060,c04,64,64,64,4,3,8,0.0,83.801,51.53599940240383,58.408961147069924,7.813046970448753,3,-1,-1,64x1024x3072,0,
2026-03-03T03:40:42.271158+00:00,FULL,llm_style,eval,llm_style_eval_057,64,1024,3072,bf16,NVIDIA GeForce RTX 4060,c04,64,64,64,4,3,8,0.0,0.0,49.15200173854828,62.48447880148887,8.191999710241964,3,-1,-1,64x1024x3072,0,
2026-03-03T03:40:42.386631+00:00,FULL,llm_style,eval,llm_style_eval_058,32,2048,4096,bf16,NVIDIA GeForce RTX 4060,c00,32,32,32,2,2,8,0.0,115.444,61.93599849939346,139.93663996458054,8.668156242048113,3,-1,-1,32x2048x4096,0,
2026-03-03T03:40:42.472305+00:00,FULL,llm_style,eval,llm_style_eval_059,64,8192,2048,bf16,NVIDIA GeForce RTX 4060,c10,64,128,64,8,3,8,0.0,0.0,173.0560064315796,236.73663780093187,12.409182970768722,1,-1,-1,64x8192x2048,0,
2026-03-03T03:40:42.701016+00:00,FULL,llm_style,eval,llm_style_eval_060,1,3072,6144,bf16,NVIDIA GeForce RTX 4060,c06,64,128,32,4,3,8,0.0,228.658,177.15199291706085,182.79423847794533,0.21308671372200275,6,-1,-1,1x3072x6144,0,
2026-03-03T03:40:42.733343+00:00,FULL,llm_style,eval,llm_style_eval_061,64,1536,4096,bf16,NVIDIA GeForce RTX 4060,c04,64,64,64,4,3,8,0.0,0.0,42.41599887609482,171.73504218459124,18.985910725630973,3,-1,-1,64x1536x4096,0,
2026-03-03T03:40:42.868879+00:00,FULL,llm_style,eval,llm_style_eval_062,16,6144,2048,bf16,NVIDIA GeForce RTX 4060,c11,32,128,32,4,2,8,0.0,135.484,61.43999844789505,69.68512147665024,6.553600165557866,1,-1,-1,16x6144x2048,0,
2026-03-03T03:40:42.915167+00:00,FULL,llm_style,eval,llm_style_eval_063,64,1536,6144,bf16,NVIDIA GeForce RTX 4060,c04,64,64,64,4,3,8,0.0,0.0,74.22399893403053,88.07711966335772,16.274514568712757,2,-1,-1,64x1536x6144,0,
2026-03-03T03:40:42.977061+00:00,FULL,llm_style,eval,llm_style_eval_064,1,6144,2048,bf16,NVIDIA GeForce RTX 4060,c11,32,128,32,4,2,8,0.0,0.0,56.32000043988228,158.31071689724908,0.44683636014638856,5,-1,-1,1x6144x2048,0,
2026-03-03T03:40:43.112686+00:00,FULL,llm_style,eval,llm_style_eval_065,8,1536,6144,bf16,NVIDIA GeForce RTX 4060,c04,64,64,64,4,3,8,0.0,135.566,71.68000191450119,88.66816021502017,2.106514229451395,6,-1,-1,8x1536x6144,0,
2026-03-03T03:40:43.139130+00:00,FULL,llm_style,eval,llm_style_eval_066,64,1536,4096,bf16,NVIDIA GeForce RTX 4060,c04,64,64,64,4,3,8,0.0,0.0,60.336001217365265,67.58400052785873,13.347029165867646,3,-1,-1,64x1536x4096,0,
2026-03-03T03:40:43.222179+00:00,FULL,llm_style,eval,llm_style_eval_067,64,8192,2048,bf16,NVIDIA GeForce RTX 4060,c10,64,128,64,8,3,8,0.0,0.0,167.90399700403214,209.8646365106105,12.789949532579795,1,-1,-1,64x8192x2048,0,
2026-03-03T03:40:43.246932+00:00,FULL,llm_style,eval,llm_style_eval_068,64,1024,4096,bf16,NVIDIA GeForce RTX 4060,c04,64,64,64,4,3,8,0.0,0.0,39.21600058674812,202.60255709290487,13.690098530379448,3,-1,-1,64x1024x4096,0,
2026-03-03T03:40:43.288750+00:00,FULL,llm_style,eval,llm_style_eval_069,64,2048,4096,bf16,NVIDIA GeForce RTX 4060,c11,32,128,32,4,2,8,0.0,0.0,83.96799862384796,190.7200008630751,12.787512404696566,3,-1,-1,64x2048x4096,0,
2026-03-03T03:40:43.400339+00:00,FULL,llm_style,eval,llm_style_eval_070,64,8192,1024,bf16,NVIDIA GeForce RTX 4060,c06,64,128,32,4,3,8,0.0,111.531,64.30399790406227,75.83743952214716,16.697901514645462,1,-1,-1,64x8192x1024,0,
2026-03-03T03:40:43.470477+00:00,FULL,llm_style,eval,llm_style_eval_071,64,6144,2048,bf16,NVIDIA GeForce RTX 4060,c06,64,128,32,4,3,8,0.0,0.0,93.18400174379349,189.3651159107685,17.284219456772522,1,-1,-1,64x6144x2048,0,
2026-03-03T03:40:43.480292+00:00,FULL,llm_style,eval,llm_style_eval_072,64,1536,1024,bf16,NVIDIA GeForce RTX 4060,c04,64,64,64,4,3,8,0.0,0.0,35.840000957250595,140.1919984817502,5.617371278537052,3,-1,-1,64x1536x1024,0,
2026-03-03T03:40:43.504186+00:00,FULL,llm_style,eval,llm_style_eval_073,1,4096,1536,bf16,NVIDIA GeForce RTX 4060,c11,32,128,32,4,2,8,0.0,0.0,51.4880008995533,138.54720219969744,0.24438532823497458,5,-1,-1,1x4096x1536,0,
2026-03-03T03:40:43.564665+00:00,FULL,llm_style,eval,llm_style_eval_074,8,1024,2048,bf16,NVIDIA GeForce RTX 4060,c04,64,64,64,4,3,8,0.0,60.431,41.840000078082085,54.53823979943991,0.801970170587488,7,-1,-1,8x1024x2048,0,
2026-03-03T03:40:43.639204+00:00,FULL,llm_style,eval,llm_style_eval_075,2,6144,1024,bf16,NVIDIA GeForce RTX 4060,c00,32,32,32,2,2,8,0.0,74.499,38.84800150990486,84.58240050822485,0.6478022812469157,5,-1,-1,2x6144x1024,0,
2026-03-03T03:40:43.674852+00:00,FULL,llm_style,eval,llm_style_eval_076,64,1024,6144,bf16,NVIDIA GeForce RTX 4060,c04,64,64,64,4,3,8,0.0,0.0,73.04000109434128,156.69472351670262,11.025552518267835,2,-1,-1,64x1024x6144,0,
2026-03-03T03:40:44.073768+00:00,FULL,llm_style,eval,llm_style_eval_077,1,4096,8192,bf16,NVIDIA GeForce RTX 4060,c00,32,32,32,2,2,8,0.0,398.863,292.7359938621521,312.3535966873169,0.2292470533418628,4,-1,-1,1x4096x8192,0,
2026-03-03T03:40:44.176001+00:00,FULL,llm_style,eval,llm_style_eval_078,64,6144,3072,bf16,NVIDIA GeForce RTX 4060,c10,64,128,64,8,3,8,0.0,0.0,182.68799781799316,249.1734416782854,13.224290226262763,1,-1,-1,64x6144x3072,0,
2026-03-03T03:40:44.311290+00:00,FULL,llm_style,eval,llm_style_eval_079,2,3072,4096,bf16,NVIDIA GeForce RTX 4060,c00,32,32,32,2,2,8,0.0,135.233,65.5359998345375,126.41152128577232,0.7680000019390135,7,-1,-1,2x3072x4096,0,
2026-03-03T03:40:44.371288+00:00,FULL,llm_style,eval,llm_style_eval_080,4,1536,1024,bf16,NVIDIA GeForce RTX 4060,c04,64,64,64,4,3,8,0.0,59.953,36.83200106024742,46.182398833334425,0.34162987722056376,7,-1,-1,4x1536x1024,0,
2026-03-03T03:40:44.702244+00:00,FULL,llm_style,eval,llm_style_eval_081,4,4096,6144,bf16,NVIDIA GeForce RTX 4060,c06,64,128,32,4,3,8,0.0,330.907,230.3519994020462,377.9852917790412,0.873995417980347,4,-1,-1,4x4096x6144,0,
2026-03-03T03:40:44.793381+00:00,FULL,llm_style,eval,llm_style_eval_082,64,6144,1024,bf16,NVIDIA GeForce RTX 4060,c06,64,128,32,4,3,8,0.0,91.063,53.247999399900436,149.1763215512034,15.123692478134789,1,-1,-1,64x6144x1024,0,
2026-03-03T03:40:44.882193+00:00,FULL,llm_style,eval,llm_style_eval_083,8,4096,4096,bf16,NVIDIA GeForce RTX 4060,c11,32,128,32,4,2,8,0.0,0.0,163.83999586105347,326.6220849752426,1.6384000413894664,5,-1,-1,8x4096x4096,0,
2026-03-03T03:40:45.050222+00:00,FULL,llm_style,eval,llm_style_eval_084,64,1024,8192,bf16,NVIDIA GeForce RTX 4060,c00,32,32,32,2,2,8,0.0,167.974,98.9760011434555,156.4774370193481,10.848506825848844,2,-1,-1,64x1024x8192,0,
2026-03-03T03:40:45.363144+00:00,FULL,llm_style,eval,llm_style_eval_085,1,3072,8192,bf16,NVIDIA GeForce RTX 4060,c07,128,128,32,8,3,8,0.0,312.882,228.86399924755096,305.91136544942844,0.21991946381028993,6,-1,-1,1x3072x8192,0,
2026-03-03T03:40:45.453790+00:00,FULL,llm_style,eval,llm_style_eval_086,8,1536,1024,bf16,NVIDIA GeForce RTX 4060,c04,64,64,64,4,3,8,0.0,90.604,60.416001826524734,114.52416121959669,0.4165423602882527,7,-1,-1,8x1536x1024,0,
2026-03-03T03:40:45.542963+00:00,FULL,llm_style,eval,llm_style_eval_087,16,1024,3072,bf16,NVIDIA GeForce RTX 4060,c04,64,64,64,4,3,8,0.0,89.133,50.175998359918594,118.6886379867792,2.0062041472085883,3,-1,-1,16x1024x3072,0,
2026-03-03T03:40:45.634313+00:00,FULL,llm_style,eval,llm_style_eval_088,8,4096,1536,bf16,NVIDIA GeForce RTX 4060,c11,32,128,32,4,2,8,0.0,91.31,46.08000069856644,51.110719703137875,2.1845333002161103,5,-1,-1,8x4096x1536,0,
2026-03-03T03:40:45.884600+00:00,FULL,llm_style,eval,llm_style_eval_089,16,6144,3072,bf16,NVIDIA GeForce RTX 4060,c11,32,128,32,4,2,8,0.0,250.246,178.17600071430206,281.8867182731628,3.3897930898587,1,-1,-1,16x6144x3072,0,
2026-03-03T03:40:45.979719+00:00,FULL,llm_style,eval,llm_style_eval_090,32,1536,3072,bf16,NVIDIA GeForce RTX 4060,c00,32,32,32,2,2,8,0.0,95.076,37.82400116324425,143.11840325593943,7.9840809727306405,3,-1,-1,32x1536x3072,0,
2026-03-03T03:40:46.071080+00:00,FULL,llm_style,eval,llm_style_eval_091,16,1024,4096,bf16,NVIDIA GeForce RTX 4060,c04,64,64,64,4,3,8,0.0,91.316,55.296000093221664,62.48447880148887,2.4272592551672245,3,-1,-1,16x1024x4096,0,
2026-03-03T03:40:46.402138+00:00,FULL,llm_style,eval,llm_style_eval_092,1,4096,6144,bf16,NVIDIA GeForce RTX 4060,c11,32,128,32,4,2,8,0.0,331.017,226.97599977254868,256.95200741291046,0.22174876661161114,4,-1,-1,1x4096x6144,0,
2026-03-03T03:40:46.507982+00:00,FULL,llm_style,eval,llm_style_eval_093,32,2048,3072,bf16,NVIDIA GeForce RTX 4060,c00,32,32,32,2,2,8,0.0,105.804,56.32000043988228,67.08224035799503,7.149381762342217,3,-1,-1,32x2048x3072,0,
2026-03-03T03:40:46.519638+00:00,FULL,llm_style,eval,llm_style_eval_094,32,1024,2048,bf16,NVIDIA GeForce RTX 4060,c04,64,64,64,4,3,8,0.0,0.0,43.42399910092354,123.70815657079211,3.0908652076944585,3,-1,-1,32x1024x2048,0,
2026-03-03T03:40:46.649754+00:00,FULL,llm_style,eval,llm_style_eval_095,8,6144,2048,bf16,NVIDIA GeForce RTX 4060,c02,32,64,32,2,2,8,0.0,130.075,58.36800113320351,61.982720457017415,3.4492630909279565,5,-1,-1,8x6144x2048,0,
2026-03-03T03:40:46.684204+00:00,FULL,llm_style,eval,llm_style_eval_096,64,2048,3072,bf16,NVIDIA GeForce RTX 4060,c11,32,128,32,4,2,8,0.0,0.0,66.56000018119812,115.96800550818428,12.09895381321653,3,-1,-1,64x2048x3072,0,
2026-03-03T03:40:46.708176+00:00,FULL,llm_style,eval,llm_style_eval_097,64,6144,1024,bf16,NVIDIA GeForce RTX 4060,c06,64,128,32,4,3,8,0.0,0.0,49.15200173854828,62.30495743453502,16.383999420483928,1,-1,-1,64x6144x1024,0,
2026-03-03T03:40:46.732735+00:00,FULL,llm_style,eval,llm_style_eval_098,32,6144,1024,bf16,NVIDIA GeForce RTX 4060,c11,32,128,32,4,2,8,0.0,0.0,50.175998359918594,208.45439881086327,8.024816588834353,1,-1,-1,32x6144x1024,0,
2026-03-03T03:40:46.808481+00:00,FULL,llm_style,eval,llm_style_eval_099,1,2048,2048,bf16,NVIDIA GeForce RTX 4060,c11,32,128,32,4,2,8,0.0,75.693,49.66400004923344,54.494721218943596,0.1689072163274025,7,-1,-1,1x2048x2048,0,
2026-03-03T03:40:46.845872+00:00,FULL,llm_style,eval,llm_style_eval_100,64,8192,1024,bf16,NVIDIA GeForce RTX 4060,c06,64,128,32,4,3,8,0.0,0.0,69.95199993252754,226.54975429177262,15.349694433835795,1,-1,-1,64x8192x1024,0,
2026-03-03T03:40:46.910921+00:00,FULL,llm_style,eval,llm_style_eval_101,64,8192,1536,bf16,NVIDIA GeForce RTX 4060,c06,64,128,32,4,3,8,0.0,0.0,107.999999076128,242.88255631923664,14.913081016460906,1,-1,-1,64x8192x1536,0,
2026-03-03T03:40:46.935510+00:00,FULL,llm_style,eval,llm_style_eval_102,32,3072,2048,bf16,NVIDIA GeForce RTX 4060,c02,32,64,32,2,2,8,0.0,0.0,51.19999870657921,65.54015971720219,7.864320198669438,3,-1,-1,32x3072x2048,0,
2026-03-03T03:40:46.961195+00:00,FULL,llm_style,eval,llm_style_eval_103,64,2048,3072,bf16,NVIDIA GeForce RTX 4060,c11,32,128,32,4,2,8,0.0,0.0,69.63200122117996,126.24895773828014,11.565176267762501,3,-1,-1,64x2048x3072,0,
2026-03-03T03:40:47.022206+00:00,FULL,llm_style,eval,llm_style_eval_104,16,6144,2048,bf16,NVIDIA GeForce RTX 4060,c11,32,128,32,4,2,8,0.0,0.0,89.08800035715103,201.60960003733635,4.519724119811601,1,-1,-1,16x6144x2048,0,
2026-03-03T03:40:47.160036+00:00,FULL,llm_style,eval,llm_style_eval_105,1,1024,8192,bf16,NVIDIA GeForce RTX 4060,c04,64,64,64,4,3,8,0.0,137.78,86.01599931716919,182.97280147671682,0.19504762059598826,6,-1,-1,1x1024x8192,0,
2026-03-03T03:40:47.562656+00:00,FULL,llm_style,eval,llm_style_eval_106,32,4096,8192,bf16,NVIDIA GeForce RTX 4060,c00,32,32,32,2,2,8,0.0,402.581,295.184001326561,310.87615698575974,7.275067884266013,0,-1,-1,32x4096x8192,0,
2026-03-03T03:40:47.614492+00:00,FULL,llm_style,eval,llm_style_eval_107,64,6144,1536,bf16,NVIDIA GeForce RTX 4060,c06,64,128,32,4,3,8,0.0,0.0,64.51199948787689,189.71935987472528,18.72457157721487,1,-1,-1,64x6144x1536,0,
2026-03-03T03:40:47.684297+00:00,FULL,llm_style,eval,llm_style_eval_108,8,3072,1536,bf16,NVIDIA GeForce RTX 4060,c00,32,32,32,2,2,8,0.0,69.756,37.23200038075447,44.413120932877064,2.0277576071100727,7,-1,-1,8x3072x1536,0,
2026-03-03T03:40:47.700910+00:00,FULL,llm_style,eval,llm_style_eval_109,16,2048,1024,bf16,NVIDIA GeForce RTX 4060,c11,32,128,32,4,2,8,0.0,0.0,43.007999658584595,320.60448966920285,1.560380964767906,3,-1,-1,16x2048x1024,0,
2026-03-03T03:40:48.435908+00:00,FULL,llm_style,eval,llm_style_eval_110,1,8192,8192,bf16,NVIDIA GeForce RTX 4060,c10,64,128,64,8,3,8,0.0,734.957,560.1279735565186,658.358721733093,0.23961975537088048,4,-1,-1,1x8192x8192,0,
2026-03-03T03:40:48.551198+00:00,FULL,llm_style,eval,llm_style_eval_111,8,6144,1536,bf16,NVIDIA GeForce RTX 4060,c11,32,128,32,4,2,8,0.0,115.249,46.15999944508076,65.60800086706872,3.271121009861525,5,-1,-1,8x6144x1536,0,
2026-03-03T03:40:48.643198+00:00,FULL,llm_style,eval,llm_style_eval_112,2,6144,3072,bf16,NVIDIA GeForce RTX 4060,c11,32,128,32,4,2,8,0.0,0.0,181.2479943037033,348.3731174468992,0.4165423859725294,5,-1,-1,2x6144x3072,0,
2026-03-03T03:40:48.952805+00:00,FULL,llm_style,eval,llm_style_eval_113,1,8192,8192,bf16,NVIDIA GeForce RTX 4060,c10,64,128,64,8,3,8,0.0,0.0,559.9679946899414,646.8608057498932,0.23968821302781312,4,-1,-1,1x8192x8192,0,
2026-03-03T03:40:49.010896+00:00,FULL,llm_style,eval,llm_style_eval_114,1,3072,1024,bf16,NVIDIA GeForce RTX 4060,c00,32,32,32,2,2,8,0.0,58.035,34.81600061058998,193.02112072706208,0.18070587918378908,7,-1,-1,1x3072x1024,0,
2026-03-03T03:40:49.078092+00:00,FULL,llm_style,eval,llm_style_eval_115,16,3072,1536,bf16,NVIDIA GeForce RTX 4060,c00,32,32,32,2,2,8,0.0,67.154,43.99999976158142,235.3043222427366,3.431703291322314,3,-1,-1,16x3072x1536,0,
2026-03-03T03:40:49.144122+00:00,FULL,llm_style,eval,llm_style_eval_116,8,3072,1024,bf16,NVIDIA GeForce RTX 4060,c11,32,128,32,4,2,8,0.0,65.982,41.69600084424019,43.53023983538151,1.20710972229733,7,-1,-1,8x3072x1024,0,
2026-03-03T03:40:49.230316+00:00,FULL,llm_style,eval,llm_style_eval_117,4,1024,4096,bf16,NVIDIA GeForce RTX 4060,c04,64,64,64,4,3,8,0.0,86.153,55.296000093221664,71.24416105449197,0.6068148137918061,7,-1,-1,4x1024x4096,0,
2026-03-03T03:40:49.326766+00:00,FULL,llm_style,eval,llm_style_eval_118,64,6144,3072,bf16,NVIDIA GeForce RTX 4060,c10,64,128,64,8,3,8,0.0,0.0,207.87200331687927,315.01311868429184,11.622147597804126,1,-1,-1,64x6144x3072,0,
2026-03-03T03:40:49.906592+00:00,FULL,llm_style,eval,llm_style_eval_119,64,8192,6144,bf16,NVIDIA GeForce RTX 4060,c00,32,32,32,2,2,8,0.0,579.775,441.8559968471527,670.4502522945397,14.580431158499312,0,-1,-1,64x8192x6144,0,
2026-03-03T03:40:50.024565+00:00,FULL,llm_style,eval,llm_style_eval_120,8,1024,4096,bf16,NVIDIA GeForce RTX 4060,c00,32,32,32,2,2,8,0.0,117.928,68.87999922037125,392.79007852077484,0.9742866544654746,7,-1,-1,8x1024x4096,0,
2026-03-03T03:40:50.097221+00:00,FULL,llm_style,eval,llm_style_eval_121,4,1024,2048,bf16,NVIDIA GeForce RTX 4060,c04,64,64,64,4,3,8,0.0,72.616,46.512000262737274,50.69823853671551,0.3607072563043679,7,-1,-1,4x1024x2048,0,
2026-03-03T03:40:50.410706+00:00,FULL,llm_style,eval,llm_style_eval_122,4,6144,4096,bf16,NVIDIA GeForce RTX 4060,c11,32,128,32,4,2,8,0.0,313.445,228.17599773406982,296.18176311254496,0.8823302801315599,5,-1,-1,4x6144x4096,0,
2026-03-03T03:40:50.716551+00:00,FULL,llm_style,eval,llm_style_eval_123,4,3072,8192,bf16,NVIDIA GeForce RTX 4060,c07,128,128,32,8,3,8,0.0,305.798,227.743998169899,236.9193571805954,0.8840039413456184,6,-1,-1,4x3072x8192,0,
2026-03-03T03:40:50.749739+00:00,FULL,llm_style,eval,llm_style_eval_124,64,6144,1024,bf16,NVIDIA GeForce RTX 4060,c06,64,128,32,4,3,8,0.0,0.0,63.48799914121628,191.91424056887627,12.684387268352213,1,-1,-1,64x6144x1024,0,
2026-03-03T03:40:50.816636+00:00,FULL,llm_style,eval,llm_style_eval_125,64,1536,8192,bf16,NVIDIA GeForce RTX 4060,c04,64,64,64,4,3,8,0.0,0.0,118.78400295972824,217.08031803369522,13.559172075940662,2,-1,-1,64x1536x8192,0,
2026-03-03T03:40:50.900521+00:00,FULL,llm_style,eval,llm_style_eval_126,64,2048,8192,bf16,NVIDIA GeForce RTX 4060,c10,64,128,64,8,3,8,0.0,0.0,168.2559996843338,189.9350443482399,12.763192112191591,2,-1,-1,64x2048x8192,0,
2026-03-03T03:40:51.044702+00:00,FULL,llm_style,eval,llm_style_eval_127,2,8192,1536,bf16,NVIDIA GeForce RTX 4060,c11,32,128,32,4,2,8,0.0,144.127,60.496000573039055,68.66944089531897,0.8319830653802105,5,-1,-1,2x8192x1536,0,
2026-03-03T03:40:51.133153+00:00,FULL,llm_style,eval,llm_style_eval_128,8,2048,2048,bf16,NVIDIA GeForce RTX 4060,c00,32,32,32,2,2,8,0.0,88.41,45.85599899291992,101.88736066222191,1.463469676243701,7,-1,-1,8x2048x2048,0,
2026-03-03T03:40:51.375017+00:00,FULL,llm_style,eval,llm_style_eval_129,64,8192,6144,bf16,NVIDIA GeForce RTX 4060,c00,32,32,32,2,2,8,0.0,0.0,442.208006978035,525.3660663962362,14.568824721258393,0,-1,-1,64x8192x6144,0,
2026-03-03T03:40:51.394830+00:00,FULL,llm_style,eval,llm_style_eval_130,16,3072,1536,bf16,NVIDIA GeForce RTX 4060,c00,32,32,32,2,2,8,0.0,0.0,41.98399931192398,123.02463941276068,3.5964878638209092,3,-1,-1,16x3072x1536,0,
2026-03-03T03:40:52.141245+00:00,FULL,llm_style,eval,llm_style_eval_131,32,8192,8192,bf16,NVIDIA GeForce RTX 4060,c11,32,128,32,4,2,8,0.0,746.364,563.0559921264648,616.5552026033401,7.6279577094622795,0,-1,-1,32x8192x8192,0,
2026-03-03T03:40:52.546882+00:00,FULL,llm_style,eval,llm_style_eval_132,32,8192,4096,bf16,NVIDIA GeForce RTX 4060,c11,32,128,32,4,2,8,0.0,405.596,297.32799530029297,378.42944115400303,7.222608304445403,1,-1,-1,32x8192x4096,0,
2026-03-03T03:40:53.282558+00:00,FULL,llm_style,eval,llm_style_eval_133,2,8192,8192,bf16,NVIDIA GeForce RTX 4060,c02,32,64,32,2,2,8,0.0,735.634,557.5680136680603,606.4127963781357,0.48143984127434003,4,-1,-1,2x8192x8192,0,
2026-03-03T03:40:53.425623+00:00,FULL,llm_style,eval,llm_style_eval_134,64,3072,3072,bf16,NVIDIA GeForce RTX 4060,c03,64,64,32,4,2,8,0.0,143.015,88.06400001049042,107.03136183321473,13.71683720766834,3,-1,-1,64x3072x3072,0,
2026-03-03T03:40:53.563169+00:00,FULL,llm_style,eval,llm_style_eval_135,8,3072,3072,bf16,NVIDIA GeForce RTX 4060,c00,32,32,32,2,2,8,0.0,137.499,56.73599988222122,189.60287958383554,2.661360411616113,7,-1,-1,8x3072x3072,0,
2026-03-03T03:40:53.691863+00:00,FULL,llm_style,eval,llm_style_eval_136,4,2048,4096,bf16,NVIDIA GeForce RTX 4060,c00,32,32,32,2,2,8,0.0,128.649,72.7200023829937,146.53440490365028,0.9228391336754698,7,-1,-1,4x2048x4096,0,
2026-03-03T03:40:54.428791+00:00,FULL,llm_style,eval,llm_style_eval_137,4,8192,8192,bf16,NVIDIA GeForce RTX 4060,c11,32,128,32,4,2,8,0.0,736.835,558.351993560791,715.9180831909177,0.9615277068793123,4,-1,-1,4x8192x8192,0,
2026-03-03T03:40:54.492642+00:00,FULL,llm_style,eval,llm_style_eval_138,16,1024,1024,bf16,NVIDIA GeForce RTX 4060,c04,64,64,64,4,3,8,0.0,63.811,39.93599861860275,70.71776099503037,0.8402051572680562,3,-1,-1,16x1024x1024,0,
2026-03-03T03:40:54.543118+00:00,FULL,llm_style,eval,llm_style_eval_139,4,1024,1024,bf16,NVIDIA GeForce RTX 4060,c04,64,64,64,4,3,8,0.0,50.441,35.88800132274628,58.4908792749047,0.23374408411769626,7,-1,-1,4x1024x1024,0,
2026-03-03T03:40:54.671539+00:00,FULL,llm_style,eval,llm_style_eval_140,64,4096,6144,bf16,NVIDIA GeForce RTX 4060,c00,32,32,32,2,2,8,0.0,0.0,257.9360008239746,333.2630470395086,12.488467921150283,0,-1,-1,64x4096x6144,0,
2026-03-03T03:40:54.794777+00:00,FULL,llm_style,eval,llm_style_eval_141,4,6144,4096,bf16,NVIDIA GeForce RTX 4060,c11,32,128,32,4,2,8,0.0,0.0,224.22399371862411,286.0851198434829,0.8978815721775174,5,-1,-1,4x6144x4096,0,
2026-03-03T03:40:54.956503+00:00,FULL,llm_style,eval,llm_style_eval_142,4,2048,6144,bf16,NVIDIA GeForce RTX 4060,c00,32,32,32,2,2,8,0.0,161.673,93.18400174379349,179.1676838696003,1.0802637160482826,6,-1,-1,4x2048x6144,0,
2026-03-03T03:40:55.024978+00:00,FULL,llm_style,eval,llm_style_eval_143,64,1536,8192,bf16,NVIDIA GeForce RTX 4060,c04,64,64,64,4,3,8,0.0,0.0,119.80800330638885,234.9772885441778,13.443281680282478,2,-1,-1,64x1536x8192,0,
2026-03-03T03:40:55.136231+00:00,FULL,llm_style,eval,llm_style_eval_144,1,3072,3072,bf16,NVIDIA GeForce RTX 4060,c00,32,32,32,2,2,8,0.0,111.197,56.32000043988228,113.60256090760211,0.33512727010979143,7,-1,-1,1x3072x3072,0,
2026-03-03T03:40:55.154584+00:00,FULL,llm_style,eval,llm_style_eval_145,32,1024,2048,bf16,NVIDIA GeForce RTX 4060,c04,64,64,64,4,3,8,0.0,0.0,47.85599932074547,118.74719865620126,2.804616556023247,3,-1,-1,32x1024x2048,0,
2026-03-03T03:40:55.324430+00:00,FULL,llm_style,eval,llm_style_eval_146,64,8192,4096,bf16,NVIDIA GeForce RTX 4060,c10,64,128,64,8,3,8,0.0,0.0,328.0320018529892,357.8656053543091,13.093135034809295,1,-1,-1,64x8192x4096,0,
2026-03-03T03:40:55.370916+00:00,FULL,llm_style,eval,llm_style_eval_147,64,2048,4096,bf16,NVIDIA GeForce RTX 4060,c11,32,128,32,4,2,8,0.0,0.0,73.61600175499916,241.9011299312112,14.585712323436306,3,-1,-1,64x2048x4096,0,
2026-03-03T03:40:55.399044+00:00,FULL,llm_style,eval,llm_style_eval_148,64,1024,6144,bf16,NVIDIA GeForce RTX 4060,c04,64,64,64,4,3,8,0.0,0.0,73.21600243449211,196.90944239497168,10.999048585321555,2,-1,-1,64x1024x6144,0,
2026-03-03T03:40:55.569559+00:00,FULL,llm_style,eval,llm_style_eval_149,64,4096,8192,bf16,NVIDIA GeForce RTX 4060,c02,32,64,32,2,2,8,0.0,0.0,303.0240088701248,406.58943593502045,14.173686474594856,0,-1,-1,64x4096x8192,0,
2026-03-03T03:40:55.668386+00:00,FULL,llm_style,eval,llm_style_eval_150,2,2048,3072,bf16,NVIDIA GeForce RTX 4060,c00,32,32,32,2,2,8,0.0,98.772,47.61600121855736,152.5446392595768,0.5285161155068212,7,-1,-1,2x2048x3072,0,
2026-03-03T03:40:55.792577+00:00,FULL,llm_style,eval,llm_style_eval_151,64,4096,2048,bf16,NVIDIA GeForce RTX 4060,c11,32,128,32,4,2,8,0.0,124.149,68.97599995136261,89.34207834303379,15.566890291654095,1,-1,-1,64x4096x2048,0,
2026-03-03T03:40:56.549462+00:00,FULL,llm_style,eval,llm_style_eval_152,8,8192,8192,bf16,NVIDIA GeForce RTX 4060,c04,64,64,64,4,3,8,0.0,756.842,565.1359856128693,594.9644804000854,1.8999707173762195,4,-1,-1,8x8192x8192,0,
2026-03-03T03:40:56.643610+00:00,FULL,llm_style,eval,llm_style_eval_153,64,8192,2048,bf16,NVIDIA GeForce RTX 4060,c10,64,128,64,8,3,8,0.0,0.0,165.6000018119812,230.6313602626323,12.967896283227148,1,-1,-1,64x8192x2048,0,
2026-03-03T03:40:56.883231+00:00,FULL,llm_style,eval,llm_style_eval_154,16,2048,8192,bf16,NVIDIA GeForce RTX 4060,c10,64,128,64,8,3,8,0.0,239.569,164.33599591255188,214.03647795319557,3.266910021865722,2,-1,-1,16x2048x8192,0,
2026-03-03T03:40:56.960355+00:00,FULL,llm_style,eval,llm_style_eval_155,4,2048,1536,bf16,NVIDIA GeForce RTX 4060,c11,32,128,32,4,2,8,0.0,77.085,46.511998400092125,61.66528034955259,0.5410609061241746,7,-1,-1,4x2048x1536,0,
2026-03-03T03:40:57.086410+00:00,FULL,llm_style,eval,llm_style_eval_156,1,4096,6144,bf16,NVIDIA GeForce RTX 4060,c11,32,128,32,4,2,8,0.0,0.0,231.26400262117386,299.1923168301582,0.21763719138964596,4,-1,-1,1x4096x6144,0,
2026-03-03T03:40:57.260372+00:00,FULL,llm_style,eval,llm_style_eval_157,1,1536,8192,bf16,NVIDIA GeForce RTX 4060,c04,64,64,64,4,3,8,0.0,173.899,84.99199897050858,100.5219207704067,0.29609638912872616,6,-1,-1,1x1536x8192,0,
2026-03-03T03:40:57.335888+00:00,FULL,llm_style,eval,llm_style_eval_158,64,1536,8192,bf16,NVIDIA GeForce RTX 4060,c04,64,64,64,4,3,8,0.0,0.0,147.2800001502037,224.4809582829475,10.935719271845562,2,-1,-1,64x1536x8192,0,
2026-03-03T03:40:57.446785+00:00,FULL,llm_style,eval,llm_style_eval_159,16,6144,1536,bf16,NVIDIA GeForce RTX 4060,c11,32,128,32,4,2,8,0.0,110.84,48.128001391887665,206.66368231177293,6.274723222786946,1,-1,-1,16x6144x1536,0,
2026-03-03T03:40:57.630825+00:00,FULL,llm_style,eval,llm_style_eval_160,32,6144,6144,bf16,NVIDIA GeForce RTX 4060,c06,64,128,32,4,3,8,0.0,0.0,342.0160114765167,381.96223884820927,7.063760242013934,0,-1,-1,32x6144x6144,0,
2026-03-03T03:40:57.725536+00:00,FULL,llm_style,eval,llm_style_eval_161,2,1536,4096,bf16,NVIDIA GeForce RTX 4060,c04,64,64,64,4,3,8,0.0,94.656,58.36800113320351,122.53855936229223,0.43115788636599456,7,-1,-1,2x1536x4096,0,
2026-03-03T03:40:57.810662+00:00,FULL,llm_style,eval,llm_style_eval_162,64,1536,3072,bf16,NVIDIA GeForce RTX 4060,c04,64,64,64,4,3,8,0.0,85.083,56.0000017285347,158.96576166152948,10.785352809948991,3,-1,-1,64x1536x3072,0,
2026-03-03T03:40:57.856375+00:00,FULL,llm_style,eval,llm_style_eval_163,64,1024,8192,bf16,NVIDIA GeForce RTX 4060,c00,32,32,32,2,2,8,0.0,0.0,101.88799723982811,203.1734365224837,10.538452546795899,2,-1,-1,64x1024x8192,0,
2026-03-03T03:40:58.031168+00:00,FULL,llm_style,eval,llm_style_eval_164,64,4096,8192,bf16,NVIDIA GeForce RTX 4060,c02,32,64,32,2,2,8,0.0,0.0,324.6079981327057,433.817600905895,13.231242978320388,0,-1,-1,64x4096x8192,0,
2026-03-03T03:40:58.334072+00:00,FULL,llm_style,eval,llm_style_eval_165,4,8192,3072,bf16,NVIDIA GeForce RTX 4060,c11,32,128,32,4,2,8,0.0,302.849,228.35199534893036,341.5756797790525,0.8816502421726837,5,-1,-1,4x8192x3072,0,
2026-03-03T03:40:58.375997+00:00,FULL,llm_style,eval,llm_style_eval_166,64,1024,6144,bf16,NVIDIA GeForce RTX 4060,c04,64,64,64,4,3,8,0.0,0.0,50.175998359918594,471.83712795376647,16.049633177668706,2,-1,-1,64x1024x6144,0,
2026-03-03T03:40:58.387147+00:00,FULL,llm_style,eval,llm_style_eval_167,2,2048,1024,bf16,NVIDIA GeForce RTX 4060,c11,32,128,32,4,2,8,0.0,0.0,40.31999967992306,88.15039932727811,0.2080507953023875,7,-1,-1,2x2048x1024,0,
2026-03-03T03:40:58.454961+00:00,FULL,llm_style,eval,llm_style_eval_168,64,4096,1024,bf16,NVIDIA GeForce RTX 4060,c11,32,128,32,4,2,8,0.0,67.772,48.128001391887665,70.76319832354778,11.155063507176793,1,-1,-1,64x4096x1024,0,
2026-03-03T03:40:58.495925+00:00,FULL,llm_style,eval,llm_style_eval_169,4,1536,6144,bf16,NVIDIA GeForce RTX 4060,c04,64,64,64,4,3,8,0.0,0.0,70.65600156784058,199.95647668838484,1.0685217154201807,6,-1,-1,4x1536x6144,0,
2026-03-03T03:40:58.514837+00:00,FULL,llm_style,eval,llm_style_eval_170,16,1536,1536,bf16,NVIDIA GeForce RTX 4060,c04,64,64,64,4,3,8,0.0,0.0,20.480000413954258,137.72287696599957,3.6863999254882347,3,-1,-1,16x1536x1536,0,
2026-03-03T03:40:58.633786+00:00,FULL,llm_style,eval,llm_style_eval_171,1,2048,3072,bf16,NVIDIA GeForce RTX 4060,c00,32,32,32,2,2,8,0.0,118.911,73.44000041484833,162.4118369817732,0.17133594674457472,7,-1,-1,1x2048x3072,0,
2026-03-03T03:40:58.727905+00:00,FULL,llm_style,eval,llm_style_eval_172,64,3072,2048,bf16,NVIDIA GeForce RTX 4060,c06,64,128,32,4,3,8,0.0,94.075,55.296000093221664,69.67776175588365,14.563555531003347,3,-1,-1,64x3072x2048,0,
2026-03-03T03:40:58.995422+00:00,FULL,llm_style,eval,llm_style_eval_173,64,8192,6144,bf16,NVIDIA GeForce RTX 4060,c00,32,32,32,2,2,8,0.0,0.0,441.3279891014099,489.0278366208076,14.597875283454162,0,-1,-1,64x8192x6144,0,
2026-03-03T03:40:59.232204+00:00,FULL,llm_style,eval,llm_style_eval_174,2,4096,4096,bf16,NVIDIA GeForce RTX 4060,c10,64,128,64,8,3,8,0.0,236.719,164.86400365829468,230.92703610658646,0.4070558915886403,5,-1,-1,2x4096x4096,0,
2026-03-03T03:40:59.274892+00:00,FULL,llm_style,eval,llm_style_eval_175,64,4096,2048,bf16,NVIDIA GeForce RTX 4060,c11,32,128,32,4,2,8,0.0,0.0,93.18400174379349,128.3628812432289,11.522812971181681,1,-1,-1,64x4096x2048,0,
2026-03-03T03:40:59.336126+00:00,FULL,llm_style,eval,llm_style_eval_176,16,6144,2048,bf16,NVIDIA GeForce RTX 4060,c11,32,128,32,4,2,8,0.0,0.0,67.85599887371063,218.79264160990698,5.933936434262696,1,-1,-1,16x6144x2048,0,
2026-03-03T03:40:59.382441+00:00,FULL,llm_style,eval,llm_style_eval_177,1,6144,1536,bf16,NVIDIA GeForce RTX 4060,c11,32,128,32,4,2,8,0.0,0.0,51.19999870657921,181.779204159975,0.36864000931262997,5,-1,-1,1x6144x1536,0,
2026-03-03T03:40:59.945185+00:00,FULL,llm_style,eval,llm_style_eval_178,32,6144,8192,bf16,NVIDIA GeForce RTX 4060,c02,32,64,32,2,2,8,0.0,562.685,428.384006023407,543.129590153694,7.519481182086876,0,-1,-1,32x6144x8192,0,
2026-03-03T03:41:00.078900+00:00,FULL,llm_style,eval,llm_style_eval_179,64,4096,6144,bf16,NVIDIA GeForce RTX 4060,c00,32,32,32,2,2,8,0.0,0.0,258.04799795150757,283.18719536066055,12.483047718143245,0,-1,-1,64x4096x6144,0,
2026-03-03T03:41:00.095177+00:00,FULL,llm_style,eval,llm_style_eval_180,64,2048,1536,bf16,NVIDIA GeForce RTX 4060,c11,32,128,32,4,2,8,0.0,0.0,55.904000997543335,249.43679392337785,7.202582584700768,3,-1,-1,64x2048x1536,0,
2026-03-03T03:41:00.124782+00:00,FULL,llm_style,eval,llm_style_eval_181,64,2048,3072,bf16,NVIDIA GeForce RTX 4060,c11,32,128,32,4,2,8,0.0,0.0,68.60800087451935,151.71583905816075,11.73779089515909,3,-1,-1,64x2048x3072,0,
2026-03-03T03:41:00.199178+00:00,FULL,llm_style,eval,llm_style_eval_182,32,3072,1536,bf16,NVIDIA GeForce RTX 4060,c11,32,128,32,4,2,8,0.0,74.33,46.00000008940697,56.376640573143945,6.564997552457466,3,-1,-1,32x3072x1536,0,
2026-03-03T03:41:00.312088+00:00,FULL,llm_style,eval,llm_style_eval_183,8,8192,2048,bf16,NVIDIA GeForce RTX 4060,c11,32,128,32,4,2,8,0.0,0.0,188.1280019879341,821.3247904181463,1.426876664629737,5,-1,-1,8x8192x2048,0,
2026-03-03T03:41:00.353223+00:00,FULL,llm_style,eval,llm_style_eval_184,64,8192,1024,bf16,NVIDIA GeForce RTX 4060,c06,64,128,32,4,3,8,0.0,0.0,89.83999863266945,175.76928064227104,11.951712381366223,1,-1,-1,64x8192x1024,0,
2026-03-03T03:41:00.420240+00:00,FULL,llm_style,eval,llm_style_eval_185,1,8192,1536,bf16,NVIDIA GeForce RTX 4060,c11,32,128,32,4,2,8,0.0,0.0,61.423998326063156,725.3190174698811,0.4097067056170739,5,-1,-1,1x8192x1536,0,
2026-03-03T03:41:00.445871+00:00,FULL,llm_style,eval,llm_style_eval_186,16,6144,1024,bf16,NVIDIA GeForce RTX 4060,c11,32,128,32,4,2,8,0.0,0.0,41.98399931192398,168.17152068018896,4.795317151761212,1,-1,-1,16x6144x1024,0,
2026-03-03T03:41:00.472708+00:00,FULL,llm_style,eval,llm_style_eval_187,1,1024,6144,bf16,NVIDIA GeForce RTX 4060,c04,64,64,64,4,3,8,0.0,0.0,94.14400160312653,134.79520127177238,0.13365601403947674,6,-1,-1,1x1024x6144,0,
2026-03-03T03:41:00.881580+00:00,FULL,llm_style,eval,llm_style_eval_188,8,8192,4096,bf16,NVIDIA GeForce RTX 4060,c11,32,128,32,4,2,8,0.0,408.814,295.9359884262085,337.56160616874695,1.8141453996693224,5,-1,-1,8x8192x4096,0,
2026-03-03T03:41:01.119993+00:00,FULL,llm_style,eval,llm_style_eval_189,8,2048,8192,bf16,NVIDIA GeForce RTX 4060,c10,64,128,64,8,3,8,0.0,238.37,161.77599877119064,185.7225616276264,1.6593033456073056,6,-1,-1,8x2048x8192,0,
2026-03-03T03:41:01.351824+00:00,FULL,llm_style,eval,llm_style_eval_190,4,8192,2048,bf16,NVIDIA GeForce RTX 4060,c10,64,128,64,8,3,8,0.0,231.787,164.86400365829468,257.0137611031531,0.8141117831772806,5,-1,-1,4x8192x2048,0,
2026-03-03T03:41:01.690023+00:00,FULL,llm_style,eval,llm_style_eval_191,4,8192,8192,bf16,NVIDIA GeForce RTX 4060,c11,32,128,32,4,2,8,0.0,0.0,579.0239870548248,629.7225415706633,0.9271997775614889,4,-1,-1,4x8192x8192,0,
2026-03-03T03:41:01.700914+00:00,FULL,llm_style,eval,llm_style_eval_192,64,1536,1024,bf16,NVIDIA GeForce RTX 4060,c04,64,64,64,4,3,8,0.0,0.0,48.527998849749565,113.29760074615476,4.14866874324118,3,-1,-1,64x1536x1024,0,
2026-03-03T03:41:01.720377+00:00,FULL,llm_style,eval,llm_style_eval_193,32,2048,2048,bf16,NVIDIA GeForce RTX 4060,c00,32,32,32,2,2,8,0.0,0.0,62.16000020503998,136.23520404100415,4.318459702614915,3,-1,-1,32x2048x2048,0,
2026-03-03T03:41:01.732324+00:00,FULL,llm_style,eval,llm_style_eval_194,8,1024,2048,bf16,NVIDIA GeForce RTX 4060,c04,64,64,64,4,3,8,0.0,0.0,47.10400104522705,145.43392062187195,0.7123478102801206,7,-1,-1,8x1024x2048,0,
2026-03-03T03:41:01.765576+00:00,FULL,llm_style,eval,llm_style_eval_195,2,4096,2048,bf16,NVIDIA GeForce RTX 4060,c00,32,32,32,2,2,8,0.0,0.0,50.175998359918594,151.17311522364614,0.668734715736196,5,-1,-1,2x4096x2048,0,
2026-03-03T03:41:01.809764+00:00,FULL,llm_style,eval,llm_style_eval_196,32,2048,4096,bf16,NVIDIA GeForce RTX 4060,c00,32,32,32,2,2,8,0.0,0.0,63.311997801065445,142.90336355566978,8.479765773414991,3,-1,-1,32x2048x4096,0,
2026-03-03T03:41:01.954922+00:00,FULL,llm_style,eval,llm_style_eval_197,32,8192,1536,bf16,NVIDIA GeForce RTX 4060,c02,32,64,32,2,2,8,0.0,145.104,70.65600156784058,111.27423994243141,11.397564964481928,1,-1,-1,32x8192x1536,0,
2026-03-03T03:41:02.123068+00:00,FULL,llm_style,eval,llm_style_eval_198,64,4096,8192,bf16,NVIDIA GeForce RTX 4060,c02,32,64,32,2,2,8,0.0,0.0,326.6880065202713,353.3622434735298,13.14700022736676,0,-1,-1,64x4096x8192,0,
2026-03-03T03:41:02.522811+00:00,FULL,llm_style,eval,llm_style_eval_199,2,8192,4096,bf16,NVIDIA GeForce RTX 4060,c11,32,128,32,4,2,8,0.0,399.689,293.5839891433716,329.7855919599533,0.45716978092580807,5,-1,-1,2x8192x4096,0,
2026-03-03T03:41:02.626120+00:00,FULL,llm_style,eval,llm_style_eval_200,1,4096,1024,bf16,NVIDIA GeForce RTX 4060,c00,32,32,32,2,2,8,0.0,103.269,61.952000483870506,211.16927683353418,0.13540495762011776,5,-1,-1,1x4096x1024,0,
2026-03-03T03:41:02.800458+00:00,FULL,llm_style,eval,llm_style_eval_201,4,1536,8192,bf16,NVIDIA GeForce RTX 4060,c04,64,64,64,4,3,8,0.0,174.294,85.9999991953373,201.64671942591664,1.170503452812331,6,-1,-1,4x1536x8192,0,
2026-03-03T03:41:03.037847+00:00,FULL,llm_style,eval,llm_style_eval_202,1,6144,3072,bf16,NVIDIA GeForce RTX 4060,c06,64,128,32,4,3,8,0.0,237.35,177.8080016374588,299.9523204565048,0.21230054695158035,5,-1,-1,1x6144x3072,0,
2026-03-03T03:41:03.215218+00:00,FULL,llm_style,eval,llm_style_eval_203,16,2048,6144,bf16,NVIDIA GeForce RTX 4060,c11,32,128,32,4,2,8,0.0,177.329,105.47199845314026,266.519999951124,3.8176311239508105,2,-1,-1,16x2048x6144,0,
2026-03-03T03:41:03.229567+00:00,FULL,llm_style,eval,llm_style_eval_204,16,1536,1024,bf16,NVIDIA GeForce RTX 4060,c00,32,32,32,2,2,8,0.0,0.0,37.88800165057182,131.69664353132245,1.3284323745599385,3,-1,-1,16x1536x1024,0,
2026-03-03T03:41:03.289956+00:00,FULL,llm_style,eval,llm_style_eval_205,64,6144,2048,bf16,NVIDIA GeForce RTX 4060,c06,64,128,32,4,3,8,0.0,0.0,94.2080020904541,165.22656247019768,17.096347446722895,1,-1,-1,64x6144x2048,0,
2026-03-03T03:41:03.354481+00:00,FULL,llm_style,eval,llm_style_eval_206,4,2048,6144,bf16,NVIDIA GeForce RTX 4060,c00,32,32,32,2,2,8,0.0,0.0,86.5279994904995,180.13248071074486,1.1633609535957492,6,-1,-1,4x2048x6144,0,
2026-03-03T03:41:03.476462+00:00,FULL,llm_style,eval,llm_style_eval_207,32,6144,1536,bf16,NVIDIA GeForce RTX 4060,c11,32,128,32,4,2,8,0.0,121.926,48.128001391887665,94.9043202027677,12.549446445573892,1,-1,-1,32x6144x1536,0,
2026-03-03T03:41:03.532104+00:00,FULL,llm_style,eval,llm_style_eval_208,4,2048,1024,bf16,NVIDIA GeForce RTX 4060,c00,32,32,32,2,2,8,0.0,55.599,36.559998989105225,55.904960110783556,0.4588954175025979,7,-1,-1,4x2048x1024,0,
2026-03-03T03:41:03.598175+00:00,FULL,llm_style,eval,llm_style_eval_209,1,1024,1536,bf16,NVIDIA GeForce RTX 4060,c04,64,64,64,4,3,8,0.0,66.033,40.40000028908253,74.00864049792288,0.0778645538982851,7,-1,-1,1x1024x1536,0,
2026-03-03T03:41:03.901196+00:00,FULL,llm_style,eval,llm_style_eval_210,8,6144,4096,bf16,NVIDIA GeForce RTX 4060,c11,32,128,32,4,2,8,0.0,302.983,227.32800245285034,291.60928070545185,1.7712432241316751,5,-1,-1,8x6144x4096,0,
2026-03-03T03:41:04.146803+00:00,FULL,llm_style,eval,llm_style_eval_211,4,2048,8192,bf16,NVIDIA GeForce RTX 4060,c06,64,128,32,4,3,8,0.0,245.568,162.81600296497345,283.59712570905674,0.8243521862459319,6,-1,-1,4x2048x8192,0,
2026-03-03T03:41:04.210939+00:00,FULL,llm_style,eval,llm_style_eval_212,32,1024,1024,bf16,NVIDIA GeForce RTX 4060,c04,64,64,64,4,3,8,0.0,64.094,40.64000025391579,59.535359628498526,1.6513007770843666,3,-1,-1,32x1024x1024,0,
2026-03-03T03:41:04.275851+00:00,FULL,llm_style,eval,llm_style_eval_213,16,3072,4096,bf16,NVIDIA GeForce RTX 4060,c00,32,32,32,2,2,8,0.0,0.0,73.15200194716454,183.1430372595786,5.504335811490492,3,-1,-1,16x3072x4096,0,
2026-03-03T03:41:04.325852+00:00,FULL,llm_style,eval,llm_style_eval_214,64,1024,8192,bf16,NVIDIA GeForce RTX 4060,c00,32,32,32,2,2,8,0.0,0.0,87.00799942016602,186.63423791527748,12.34072534888254,2,-1,-1,64x1024x8192,0,
2026-03-03T03:41:04.354162+00:00,FULL,llm_style,eval,llm_style_eval_215,4,4096,1536,bf16,NVIDIA GeForce RTX 4060,c11,32,128,32,4,2,8,0.0,0.0,48.128001391887665,57.34400078654289,1.0457872037978244,5,-1,-1,4x4096x1536,0,
2026-03-03T03:41:04.433552+00:00,FULL,llm_style,eval,llm_style_eval_216,16,1536,3072,bf16,NVIDIA GeForce RTX 4060,c00,32,32,32,2,2,8,0.0,79.332,49.056001007556915,142.81759560108185,3.0780116784639606,3,-1,-1,16x1536x3072,0,
2026-03-03T03:41:04.495652+00:00,FULL,llm_style,eval,llm_style_eval_217,8,6144,2048,bf16,NVIDIA GeForce RTX 4060,c02,32,64,32,2,2,8,0.0,0.0,59.39200147986412,219.19007837772335,3.3897930189851655,5,-1,-1,8x6144x2048,0,
2026-03-03T03:41:04.633729+00:00,FULL,llm_style,eval,llm_style_eval_218,8,3072,4096,bf16,NVIDIA GeForce RTX 4060,c00,32,32,32,2,2,8,0.0,138.021,67.58400052785873,135.36031700670705,2.9789090676425904,7,-1,-1,8x3072x4096,0,
2026-03-03T03:41:04.965559+00:00,FULL,llm_style,eval,llm_style_eval_219,64,8192,3072,bf16,NVIDIA GeForce RTX 4060,c10,64,128,64,8,3,8,0.0,331.787,234.49599742889404,292.54463225603104,13.736803644065475,1,-1,-1,64x8192x3072,0,
2026-03-03T03:41:05.003739+00:00,FULL,llm_style,eval,llm_style_eval_220,2,4096,2048,bf16,NVIDIA GeForce RTX 4060,c00,32,32,32,2,2,8,0.0,0.0,75.72799921035767,189.78271588683128,0.4430914899361372,5,-1,-1,2x4096x2048,0,
2026-03-03T03:41:05.171650+00:00,FULL,llm_style,eval,llm_style_eval_221,4,1024,8192,bf16,NVIDIA GeForce RTX 4060,c00,32,32,32,2,2,8,0.0,167.86,95.05600109696388,209.75616380572302,0.7059929223357944,6,-1,-1,4x1024x8192,0,
2026-03-03T03:41:05.245160+00:00,FULL,llm_style,eval,llm_style_eval_222,64,6144,2048,bf16,NVIDIA GeForce RTX 4060,c06,64,128,32,4,3,8,0.0,0.0,119.80800330638885,136.25344142317772,13.443281680282478,1,-1,-1,64x6144x2048,0,
2026-03-03T03:41:05.337048+00:00,FULL,llm_style,eval,llm_style_eval_223,4,2048,2048,bf16,NVIDIA GeForce RTX 4060,c11,32,128,32,4,2,8,0.0,91.834,51.19999870657921,107.8806359693406,0.6553600165557865,7,-1,-1,4x2048x2048,0,
2026-03-03T03:41:05.361758+00:00,FULL,llm_style,eval,llm_style_eval_224,16,3072,1536,bf16,NVIDIA GeForce RTX 4060,c00,32,32,32,2,2,8,0.0,0.0,50.00000074505806,92.52864137291901,3.019898835000001,3,-1,-1,16x3072x1536,0,
2026-03-03T03:41:05.385560+00:00,FULL,llm_style,eval,llm_style_eval_225,1,2048,2048,bf16,NVIDIA GeForce RTX 4060,c11,32,128,32,4,2,8,0.0,0.0,29.69600073993206,153.35423946380598,0.2824827515820971,7,-1,-1,1x2048x2048,0,
2026-03-03T03:41:05.396659+00:00,FULL,llm_style,eval,llm_style_eval_226,8,1536,1024,bf16,NVIDIA GeForce RTX 4060,c04,64,64,64,4,3,8,0.0,0.0,38.7520007789135,80.09856142103669,0.6494070885158973,7,-1,-1,8x1536x1024,0,
2026-03-03T03:41:05.582688+00:00,FULL,llm_style,eval,llm_style_eval_227,64,6144,6144,bf16,NVIDIA GeForce RTX 4060,c06,64,128,32,4,3,8,0.0,0.0,332.8000009059906,431.44863963127125,14.518744575859836,0,-1,-1,64x6144x6144,0,
2026-03-03T03:41:05.655223+00:00,FULL,llm_style,eval,llm_style_eval_228,64,6144,2048,bf16,NVIDIA GeForce RTX 4060,c06,64,128,32,4,3,8,0.0,0.0,120.78400328755379,226.84672564268092,13.334652703682707,1,-1,-1,64x6144x2048,0,
2026-03-03T03:41:05.833524+00:00,FULL,llm_style,eval,llm_style_eval_229,16,1536,8192,bf16,NVIDIA GeForce RTX 4060,c04,64,64,64,4,3,8,0.0,178.245,88.0960002541542,97.84319952130318,4.570618221467015,2,-1,-1,16x1536x8192,0,
2026-03-03T03:41:05.852704+00:00,FULL,llm_style,eval,llm_style_eval_230,64,2048,1536,bf16,NVIDIA GeForce RTX 4060,c11,32,128,32,4,2,8,0.0,0.0,70.6080012023449,282.357750982046,5.702656599017675,3,-1,-1,64x2048x1536,0,
2026-03-03T03:41:05.899905+00:00,FULL,llm_style,eval,llm_style_eval_231,4,1024,8192,bf16,NVIDIA GeForce RTX 4060,c00,32,32,32,2,2,8,0.0,0.0,68.08000057935715,157.3763146996498,0.9857353617642064,6,-1,-1,4x1024x8192,0,
2026-03-03T03:41:05.924489+00:00,FULL,llm_style,eval,llm_style_eval_232,16,3072,1536,bf16,NVIDIA GeForce RTX 4060,c00,32,32,32,2,2,8,0.0,0.0,67.56800040602684,136.92768141627286,2.2347108556217057,3,-1,-1,16x3072x1536,0,
2026-03-03T03:41:05.975875+00:00,FULL,llm_style,eval,llm_style_eval_233,64,3072,3072,bf16,NVIDIA GeForce RTX 4060,c03,64,64,32,4,2,8,0.0,0.0,90.11200070381165,107.48128175735471,13.405090804391657,3,-1,-1,64x3072x3072,0,
2026-03-03T03:41:06.147613+00:00,FULL,llm_style,eval,llm_style_eval_234,32,8192,4096,bf16,NVIDIA GeForce RTX 4060,c11,32,128,32,4,2,8,0.0,0.0,322.56001234054565,379.33375418186176,6.657625142117042,1,-1,-1,32x8192x4096,0,
2026-03-03T03:41:06.161191+00:00,FULL,llm_style,eval,llm_style_eval_235,4,2048,1024,bf16,NVIDIA GeForce RTX 4060,c00,32,32,32,2,2,8,0.0,0.0,59.39200147986412,142.97504335641858,0.2824827515820971,7,-1,-1,4x2048x1024,0,
2026-03-03T03:41:06.291117+00:00,FULL,llm_style,eval,llm_style_eval_236,4,8192,3072,bf16,NVIDIA GeForce RTX 4060,c11,32,128,32,4,2,8,0.0,0.0,253.91998887062073,302.3667106032371,0.7928741368312736,5,-1,-1,4x8192x3072,0,
2026-03-03T03:41:06.313491+00:00,FULL,llm_style,eval,llm_style_eval_237,64,1024,4096,bf16,NVIDIA GeForce RTX 4060,c04,64,64,64,4,3,8,0.0,0.0,67.24799796938896,230.06911873817438,7.983448254390884,3,-1,-1,64x1024x4096,0,
2026-03-03T03:41:06.491974+00:00,FULL,llm_style,eval,llm_style_eval_238,32,2048,6144,bf16,NVIDIA GeForce RTX 4060,c04,64,64,64,4,3,8,0.0,178.425,105.47199845314026,109.55231972038746,7.635262247901621,2,-1,-1,32x2048x6144,0,
2026-03-03T03:41:06.501348+00:00,FULL,llm_style,eval,llm_style_eval_239,32,2048,6144,bf16,NVIDIA GeForce RTX 4060,c04,64,64,64,4,3,8,0.0,0.0,126.97599828243256,158.14656123518935,6.342193634176106,2,-1,-1,32x2048x6144,0,
2026-03-03T03:41:06.653123+00:00,FULL,llm_style,eval,llm_style_eval_240,8,8192,1536,bf16,NVIDIA GeForce RTX 4060,c00,32,32,32,2,2,8,0.0,151.744,58.78400057554245,128.7184012681245,3.424853532064021,5,-1,-1,8x8192x1536,0,
2026-03-03T03:41:06.666840+00:00,FULL,llm_style,eval,llm_style_eval_241,16,1536,1536,bf16,NVIDIA GeForce RTX 4060,c04,64,64,64,4,3,8,0.0,0.0,69.56800073385239,169.32000234723085,1.0852327392421712,3,-1,-1,16x1536x1536,0,
2026-03-03T03:41:06.692777+00:00,FULL,llm_style,eval,llm_style_eval_242,1,2048,3072,bf16,NVIDIA GeForce RTX 4060,c00,32,32,32,2,2,8,0.0,0.0,60.815999284386635,208.57792109251022,0.20690134418674966,7,-1,-1,1x2048x3072,0,
2026-03-03T03:41:06.730481+00:00,FULL,llm_style,eval,llm_style_eval_243,8,1536,6144,bf16,NVIDIA GeForce RTX 4060,c04,64,64,64,4,3,8,0.0,0.0,71.68000191450119,91.15648105740547,2.106514229451395,6,-1,-1,8x1536x6144,0,
2026-03-03T03:41:06.771724+00:00,FULL,llm_style,eval,llm_style_eval_244,32,8192,1024,bf16,NVIDIA GeForce RTX 4060,c11,32,128,32,4,2,8,0.0,0.0,54.32000011205673,161.9683185219764,9.88348510479545,1,-1,-1,32x8192x1024,0,
2026-03-03T03:41:06.898208+00:00,FULL,llm_style,eval,llm_style_eval_245,4,6144,4096,bf16,NVIDIA GeForce RTX 4060,c11,32,128,32,4,2,8,0.0,0.0,232.91199654340744,267.86431610584253,0.8643891039870892,5,-1,-1,4x6144x4096,0,
2026-03-03T03:41:06.969480+00:00,FULL,llm_style,eval,llm_style_eval_246,32,2048,6144,bf16,NVIDIA GeForce RTX 4060,c04,64,64,64,4,3,8,0.0,0.0,108.92799869179726,201.3273556530475,7.393015364934296,2,-1,-1,32x2048x6144,0,
2026-03-03T03:41:07.029771+00:00,FULL,llm_style,eval,llm_style_eval_247,64,6144,2048,bf16,NVIDIA GeForce RTX 4060,c06,64,128,32,4,3,8,0.0,0.0,94.94400024414062,113.82783748209474,16.963817954356706,1,-1,-1,64x6144x2048,0,
2026-03-03T03:41:07.038268+00:00,FULL,llm_style,eval,llm_style_eval_248,64,1024,1024,bf16,NVIDIA GeForce RTX 4060,c04,64,64,64,4,3,8,0.0,0.0,39.93599861860275,60.04064105451103,3.360820629072225,3,-1,-1,64x1024x1024,0,
2026-03-03T03:41:07.141832+00:00,FULL,llm_style,eval,llm_style_eval_249,2,8192,1024,bf16,NVIDIA GeForce RTX 4060,c00,32,32,32,2,2,8,0.0,103.528,46.00000008940697,141.36703968048084,0.729444172495274,5,-1,-1,2x8192x1024,0,
2026-03-03T03:41:07.194119+00:00,FULL,llm_style,eval,llm_style_eval_250,64,3072,3072,bf16,NVIDIA GeForce RTX 4060,c03,64,64,32,4,2,8,0.0,0.0,64.92799893021584,149.19583857059476,18.604601587957553,3,-1,-1,64x3072x3072,0,
2026-03-03T03:41:07.238306+00:00,FULL,llm_style,eval,llm_style_eval_251,64,1024,8192,bf16,NVIDIA GeForce RTX 4060,c00,32,32,32,2,2,8,0.0,0.0,95.21600231528282,119.64479967951769,11.276905119840944,2,-1,-1,64x1024x8192,0,
2026-03-03T03:41:07.298638+00:00,FULL,llm_style,eval,llm_style_eval_252,64,4096,3072,bf16,NVIDIA GeForce RTX 4060,c04,64,64,64,4,3,8,0.0,0.0,91.13600105047226,194.46943372488022,17.672629009780916,1,-1,-1,64x4096x3072,0,
2026-03-03T03:41:07.427345+00:00,FULL,llm_style,eval,llm_style_eval_253,8,6144,4096,bf16,NVIDIA GeForce RTX 4060,c11,32,128,32,4,2,8,0.0,0.0,251.90401077270508,410.8953633904452,1.5984389560328083,5,-1,-1,8x6144x4096,0,
2026-03-03T03:41:07.528017+00:00,FULL,llm_style,eval,llm_style_eval_254,4,1536,3072,bf16,NVIDIA GeForce RTX 4060,c11,32,128,32,4,2,8,0.0,100.618,62.463998794555664,70.17472140491009,0.6043278805149146,7,-1,-1,4x1536x3072,0,
2026-03-03T03:41:07.555341+00:00,FULL,llm_style,eval,llm_style_eval_255,1,3072,1536,bf16,NVIDIA GeForce RTX 4060,c11,32,128,32,4,2,8,0.0,0.0,50.912000238895416,202.22112014889714,0.18536266412079094,7,-1,-1,1x3072x1536,0,
2026-03-03T03:41:07.649251+00:00,BUCKET,llm_style,tune,llm_style_tune_000,32,3072,2048,bf16,NVIDIA GeForce RTX 4060,c11,32,128,32,4,2,8,0.0,91.38,53.10400016605854,114.09407950937745,7.582351286925388,3,-1,-1,llm8_g3,0,
2026-03-03T03:41:07.743937+00:00,BUCKET,llm_style,tune,llm_style_tune_001,4,4096,1536,bf16,NVIDIA GeForce RTX 4060,c11,32,128,32,4,2,8,0.0,94.641,47.10400104522705,70.27776189148425,1.068521715420181,5,-1,-1,llm8_g5,0,
2026-03-03T03:41:07.777137+00:00,BUCKET,llm_style,tune,llm_style_tune_002,8,8192,1024,bf16,NVIDIA GeForce RTX 4060,c11,32,128,32,4,2,8,0.0,0.0,57.151999324560165,142.57791548967356,2.348434518236041,5,-1,-1,llm8_g5,0,
2026-03-03T03:41:07.802988+00:00,BUCKET,llm_style,tune,llm_style_tune_003,64,1024,4096,bf16,NVIDIA GeForce RTX 4060,c11,32,128,32,4,2,8,0.0,0.0,72.7040022611618,189.2352041602133,7.384337798509263,3,-1,-1,llm8_g3,0,
2026-03-03T03:41:07.862835+00:00,BUCKET,llm_style,tune,llm_style_tune_004,16,3072,4096,bf16,NVIDIA GeForce RTX 4060,c11,32,128,32,4,2,8,0.0,0.0,81.91999793052673,89.53055948019026,4.9152001241684,3,-1,-1,llm8_g3,0,
2026-03-03T03:41:07.890499+00:00,BUCKET,llm_style,tune,llm_style_tune_005,16,1536,4096,bf16,NVIDIA GeForce RTX 4060,c11,32,128,32,4,2,8,0.0,0.0,70.65600156784058,121.38495989143837,2.849391241120482,3,-1,-1,llm8_g3,0,
2026-03-03T03:41:07.944818+00:00,BUCKET,llm_style,tune,llm_style_tune_006,2,2048,1024,bf16,NVIDIA GeForce RTX 4060,c00,32,32,32,2,2,8,0.0,54.269,29.632000252604485,65.94431936740865,0.2830928701569071,7,-1,-1,llm8_g7,0,
2026-03-03T03:41:08.053684+00:00,BUCKET,llm_style,tune,llm_style_tune_007,32,6144,1024,bf16,NVIDIA GeForce RTX 4060,c00,32,32,32,2,2,8,0.0,108.822,52.22399905323982,79.31712001562117,7.710117786834262,1,-1,-1,llm8_g1,0,
2026-03-03T03:41:08.073283+00:00,BUCKET,llm_style,tune,llm_style_tune_008,8,1536,2048,bf16,NVIDIA GeForce RTX 4060,c00,32,32,32,2,2,8,0.0,0.0,67.47199967503548,100.95616057515142,0.7459634847405097,7,-1,-1,llm8_g7,0,
2026-03-03T03:41:08.194879+00:00,BUCKET,llm_style,tune,llm_style_tune_009,16,1024,6144,bf16,NVIDIA GeForce RTX 4060,c04,64,64,64,4,3,8,0.0,121.547,70.3199990093708,79.95392091572282,2.8630061836771543,2,-1,-1,llm8_g2,0,
2026-03-03T03:41:08.231880+00:00,BUCKET,llm_style,tune,llm_style_tune_010,64,1536,2048,bf16,NVIDIA GeForce RTX 4060,c11,32,128,32,4,2,8,0.0,0.0,84.97599884867668,140.82944139838204,4.738434257384083,3,-1,-1,llm8_g3,0,
2026-03-03T03:41:08.263855+00:00,BUCKET,llm_style,tune,llm_style_tune_011,64,1536,4096,bf16,NVIDIA GeForce RTX 4060,c11,32,128,32,4,2,8,0.0,0.0,101.24800354242325,189.26399648189528,7.953799974560228,3,-1,-1,llm8_g3,0,
2026-03-03T03:41:08.277528+00:00,BUCKET,llm_style,tune,llm_style_tune_012,32,1024,2048,bf16,NVIDIA GeForce RTX 4060,c11,32,128,32,4,2,8,0.0,0.0,69.63200122117996,184.06015843152994,1.9275293779604168,3,-1,-1,llm8_g3,0,
2026-03-03T03:41:08.290380+00:00,BUCKET,llm_style,tune,llm_style_tune_013,64,1536,1024,bf16,NVIDIA GeForce RTX 4060,c11,32,128,32,4,2,8,0.0,0.0,57.12000094354153,132.39455491304386,3.5246251518622165,3,-1,-1,llm8_g3,0,
2026-03-03T03:41:08.383241+00:00,BUCKET,llm_style,tune,llm_style_tune_014,4,6144,3072,bf16,NVIDIA GeForce RTX 4060,c11,32,128,32,4,2,8,0.0,0.0,182.6239973306656,361.6031968593595,0.8268077920044818,5,-1,-1,llm8_g5,0,
2026-03-03T03:41:08.407325+00:00,BUCKET,llm_style,tune,llm_style_tune_015,1,6144,1024,bf16,NVIDIA GeForce RTX 4060,c11,32,128,32,4,2,8,0.0,0.0,35.90399958193302,150.5904014408588,0.35045989712889125,5,-1,-1,llm8_g5,0,
2026-03-03T03:41:08.586485+00:00,BUCKET,llm_style,tune,llm_style_tune_016,4,8192,4096,bf16,NVIDIA GeForce RTX 4060,c11,32,128,32,4,2,8,0.0,0.0,292.86399483680725,316.4979153871536,0.9165874287468502,5,-1,-1,llm8_g5,0,
2026-03-03T03:41:08.602436+00:00,BUCKET,llm_style,tune,llm_style_tune_017,64,1536,2048,bf16,NVIDIA GeForce RTX 4060,c11,32,128,32,4,2,8,0.0,0.0,51.19999870657921,104.01727784425005,7.864320198669438,3,-1,-1,llm8_g3,0,
2026-03-03T03:41:08.665176+00:00,BUCKET,llm_style,tune,llm_style_tune_018,64,8192,1536,bf16,NVIDIA GeForce RTX 4060,c00,32,32,32,2,2,8,0.0,0.0,132.143996655941,246.82496160268784,12.188315600847913,1,-1,-1,llm8_g1,0,
2026-03-03T03:41:08.675369+00:00,BUCKET,llm_style,tune,llm_style_tune_019,2,1536,1024,bf16,NVIDIA GeForce RTX 4060,c00,32,32,32,2,2,8,0.0,0.0,38.91199827194214,99.84639927744863,0.1616842177066119,7,-1,-1,llm8_g7,0,
2026-03-03T03:41:08.684987+00:00,BUCKET,llm_style,tune,llm_style_tune_020,16,1024,1536,bf16,NVIDIA GeForce RTX 4060,c11,32,128,32,4,2,8,0.0,0.0,55.296000093221664,63.87167796492575,0.9102222206877092,3,-1,-1,llm8_g3,0,
2026-03-03T03:41:08.720394+00:00,BUCKET,llm_style,tune,llm_style_tune_021,1,6144,1536,bf16,NVIDIA GeForce RTX 4060,c11,32,128,32,4,2,8,0.0,0.0,51.08800157904625,107.44479790329922,0.3694481564481732,5,-1,-1,llm8_g5,0,
2026-03-03T03:41:08.809155+00:00,BUCKET,llm_style,tune,llm_style_tune_022,8,4096,4096,bf16,NVIDIA GeForce RTX 4060,c11,32,128,32,4,2,8,0.0,0.0,167.7279993891716,258.2943965494632,1.6004212592863611,5,-1,-1,llm8_g5,0,
2026-03-03T03:41:09.243386+00:00,BUCKET,llm_style,tune,llm_style_tune_023,2,4096,8192,bf16,NVIDIA GeForce RTX 4060,c02,32,64,32,2,2,8,0.0,434.176,295.9359884262085,313.8179284334183,0.4535363499173306,4,-1,-1,llm8_g4,0,
2026-03-03T03:41:09.269618+00:00,BUCKET,llm_style,tune,llm_style_tune_024,64,1536,2048,bf16,NVIDIA GeForce RTX 4060,c11,32,128,32,4,2,8,0.0,0.0,56.32000043988228,207.91520155966236,7.149381762342217,3,-1,-1,llm8_g3,0,
2026-03-03T03:41:09.295799+00:00,BUCKET,llm_style,tune,llm_style_tune_025,4,4096,1536,bf16,NVIDIA GeForce RTX 4060,c11,32,128,32,4,2,8,0.0,0.0,58.17599967122078,154.347516298294,0.8651617210610423,5,-1,-1,llm8_g5,0,
2026-03-03T03:41:09.322276+00:00,BUCKET,llm_style,tune,llm_style_tune_026,4,3072,2048,bf16,NVIDIA GeForce RTX 4060,c00,32,32,32,2,2,8,0.0,0.0,71.56800106167793,147.02848047018045,0.703270277964362,7,-1,-1,llm8_g7,0,
2026-03-03T03:41:09.341039+00:00,BUCKET,llm_style,tune,llm_style_tune_027,8,4096,1024,bf16,NVIDIA GeForce RTX 4060,c11,32,128,32,4,2,8,0.0,0.0,44.03200000524521,134.73599687218663,1.52409302307426,5,-1,-1,llm8_g5,0,
2026-03-03T03:41:09.350311+00:00,BUCKET,llm_style,tune,llm_style_tune_028,16,1536,1024,bf16,NVIDIA GeForce RTX 4060,c11,32,128,32,4,2,8,0.0,0.0,39.93599861860275,121.83295927941796,1.2603077359020842,3,-1,-1,llm8_g3,0,
2026-03-03T03:41:09.771851+00:00,BUCKET,llm_style,tune,llm_style_tune_029,64,4096,8192,bf16,NVIDIA GeForce RTX 4060,c03,64,64,32,4,2,8,0.0,421.504,297.9840040206909,361.0889557003975,14.41341561308027,0,-1,-1,llm8_g0,0,
2026-03-03T03:41:09.837827+00:00,BUCKET,llm_style,tune,llm_style_tune_030,1,8192,1536,bf16,NVIDIA GeForce RTX 4060,c11,32,128,32,4,2,8,0.0,0.0,64.95999917387962,252.04736337065694,0.38740493103514634,5,-1,-1,llm8_g5,0,
2026-03-03T03:41:10.075690+00:00,BUCKET,llm_style,tune,llm_style_tune_031,1,8192,6144,bf16,NVIDIA GeForce RTX 4060,c02,32,64,32,2,2,8,0.0,0.0,427.0080029964447,539.0646278858185,0.23574100553997843,4,-1,-1,llm8_g4,0,
2026-03-03T03:41:10.201539+00:00,BUCKET,llm_style,tune,llm_style_tune_032,32,3072,8192,bf16,NVIDIA GeForce RTX 4060,c04,64,64,64,4,3,8,0.0,0.0,229.37600314617157,306.39295995235443,7.021714189402912,2,-1,-1,llm8_g2,0,
2026-03-03T03:41:10.331839+00:00,BUCKET,llm_style,tune,llm_style_tune_033,4,1536,6144,bf16,NVIDIA GeForce RTX 4060,c04,64,64,64,4,3,8,0.0,130.244,71.44000008702278,80.41471742093563,1.0567955194293772,6,-1,-1,llm8_g6,0,
2026-03-03T03:41:10.374991+00:00,BUCKET,llm_style,tune,llm_style_tune_034,1,4096,1536,bf16,NVIDIA GeForce RTX 4060,c11,32,128,32,4,2,8,0.0,0.0,68.60800087451935,222.17087432742102,0.1834029827368608,5,-1,-1,llm8_g5,0,
2026-03-03T03:41:10.401355+00:00,BUCKET,llm_style,tune,llm_style_tune_035,4,1536,4096,bf16,NVIDIA GeForce RTX 4060,c00,32,32,32,2,2,8,0.0,0.0,56.304000318050385,144.76991936564445,0.8939266786673464,7,-1,-1,llm8_g7,0,
2026-03-03T03:41:10.542283+00:00,BUCKET,llm_style,tune,llm_style_tune_036,32,8192,3072,bf16,NVIDIA GeForce RTX 4060,c00,32,32,32,2,2,8,0.0,0.0,232.2399988770485,355.8400085568427,6.9351220452454605,1,-1,-1,llm8_g1,0,
2026-03-03T03:41:10.574267+00:00,BUCKET,llm_style,tune,llm_style_tune_037,32,3072,2048,bf16,NVIDIA GeForce RTX 4060,c11,32,128,32,4,2,8,0.0,0.0,61.43999844789505,135.59680342674253,6.553600165557866,3,-1,-1,llm8_g3,0,
2026-03-03T03:41:10.608073+00:00,BUCKET,llm_style,tune,llm_style_tune_038,2,2048,4096,bf16,NVIDIA GeForce RTX 4060,c00,32,32,32,2,2,8,0.0,0.0,58.44799987971783,87.70624235272402,0.5740903378909943,7,-1,-1,llm8_g7,0,
2026-03-03T03:41:10.626043+00:00,BUCKET,llm_style,tune,llm_style_tune_039,64,2048,1536,bf16,NVIDIA GeForce RTX 4060,c11,32,128,32,4,2,8,0.0,0.0,44.35200057923794,57.870718352496596,9.078579968013665,3,-1,-1,llm8_g3,0,
2026-03-03T03:41:10.652797+00:00,BUCKET,llm_style,tune,llm_style_tune_040,64,1024,6144,bf16,NVIDIA GeForce RTX 4060,c04,64,64,64,4,3,8,0.0,0.0,70.72000205516815,119.8227186501025,11.387250347812296,2,-1,-1,llm8_g2,0,
2026-03-03T03:41:10.894312+00:00,BUCKET,llm_style,tune,llm_style_tune_041,4,8192,6144,bf16,NVIDIA GeForce RTX 4060,c02,32,64,32,2,2,8,0.0,0.0,451.29600167274475,490.3363290429114,0.8922152700390689,4,-1,-1,llm8_g4,0,
2026-03-03T03:41:10.921556+00:00,BUCKET,llm_style,tune,llm_style_tune_042,1,1024,6144,bf16,NVIDIA GeForce RTX 4060,c04,64,64,64,4,3,8,0.0,0.0,82.49599859118462,179.61536392569542,0.152527543334018,6,-1,-1,llm8_g6,0,
2026-03-03T03:41:11.008823+00:00,BUCKET,llm_style,tune,llm_style_tune_043,64,2048,8192,bf16,NVIDIA GeForce RTX 4060,c04,64,64,64,4,3,8,0.0,0.0,169.3120002746582,279.295993745327,12.683587959012643,2,-1,-1,llm8_g2,0,
2026-03-03T03:41:11.019964+00:00,BUCKET,llm_style,tune,llm_style_tune_044,16,2048,1024,bf16,NVIDIA GeForce RTX 4060,c11,32,128,32,4,2,8,0.0,0.0,45.05600035190582,55.31648010015487,1.4894545338212952,3,-1,-1,llm8_g3,0,
2026-03-03T03:41:11.031313+00:00,BUCKET,llm_style,tune,llm_style_tune_045,4,1024,1536,bf16,NVIDIA GeForce RTX 4060,c00,32,32,32,2,2,8,0.0,0.0,41.98399931192398,163.37919935584068,0.29970732198507577,7,-1,-1,llm8_g7,0,
2026-03-03T03:41:11.059228+00:00,BUCKET,llm_style,tune,llm_style_tune_046,64,1536,4096,bf16,NVIDIA GeForce RTX 4060,c11,32,128,32,4,2,8,0.0,0.0,78.84799689054489,112.45375998318187,10.213403000179055,3,-1,-1,llm8_g3,0,
2026-03-03T03:41:11.073491+00:00,BUCKET,llm_style,tune,llm_style_tune_047,16,2048,1536,bf16,NVIDIA GeForce RTX 4060,c11,32,128,32,4,2,8,0.0,0.0,49.15200173854828,115.89631818234918,2.047999927560491,3,-1,-1,llm8_g3,0,
2026-03-03T03:41:11.263456+00:00,BUCKET,llm_style,tune,llm_style_tune_048,64,6144,6144,bf16,NVIDIA GeForce RTX 4060,c03,64,64,32,4,2,8,0.0,0.0,334.1760039329529,376.1392110586165,14.458962196966818,0,-1,-1,llm8_g0,0,
2026-03-03T03:41:11.434064+00:00,BUCKET,llm_style,tune,llm_style_tune_049,4,4096,8192,bf16,NVIDIA GeForce RTX 4060,c02,32,64,32,2,2,8,0.0,0.0,318.4159994125366,384.9484857916831,0.8430338189514707,4,-1,-1,llm8_g4,0,
2026-03-03T03:41:11.494496+00:00,BUCKET,llm_style,tune,llm_style_tune_050,1,4096,3072,bf16,NVIDIA GeForce RTX 4060,c11,32,128,32,4,2,8,0.0,0.0,92.04800054430962,189.67423558235163,0.27339892068471167,5,-1,-1,llm8_g5,0,
2026-03-03T03:41:11.526142+00:00,BUCKET,llm_style,tune,llm_style_tune_051,2,4096,2048,bf16,NVIDIA GeForce RTX 4060,c11,32,128,32,4,2,8,0.0,0.0,49.31199923157692,55.81824027001858,0.6804516653730281,5,-1,-1,llm8_g5,0,
2026-03-03T03:41:11.587827+00:00,BUCKET,llm_style,tune,llm_style_tune_052,4,8192,1536,bf16,NVIDIA GeForce RTX 4060,c11,32,128,32,4,2,8,0.0,0.0,62.12799996137619,77.82399654388428,1.6202565037113776,5,-1,-1,llm8_g5,0,
2026-03-03T03:41:11.615298+00:00,BUCKET,llm_style,tune,llm_style_tune_053,1,1536,4096,bf16,NVIDIA GeForce RTX 4060,c00,32,32,32,2,2,8,0.0,0.0,56.304000318050385,118.36415901780127,0.2234816696668366,7,-1,-1,llm8_g7,0,
2026-03-03T03:41:11.857361+00:00,BUCKET,llm_style,tune,llm_style_tune_054,8,8192,6144,bf16,NVIDIA GeForce RTX 4060,c02,32,64,32,2,2,8,0.0,0.0,433.6639940738678,570.071057677269,1.856982315812986,4,-1,-1,llm8_g4,0,
2026-03-03T03:41:11.899286+00:00,BUCKET,llm_style,tune,llm_style_tune_055,64,6144,1536,bf16,NVIDIA GeForce RTX 4060,c00,32,32,32,2,2,8,0.0,0.0,143.36000382900238,211.04640439152718,8.42605691780558,1,-1,-1,llm8_g1,0,
2026-03-03T03:41:11.924556+00:00,BUCKET,llm_style,tune,llm_style_tune_056,1,3072,1536,bf16,NVIDIA GeForce RTX 4060,c00,32,32,32,2,2,8,0.0,0.0,46.911999583244324,59.914241656661034,0.20116780533419648,7,-1,-1,llm8_g7,0,
2026-03-03T03:41:11.933236+00:00,BUCKET,llm_style,tune,llm_style_tune_057,64,1024,1024,bf16,NVIDIA GeForce RTX 4060,c11,32,128,32,4,2,8,0.0,0.0,53.18399891257286,70.696961581707,2.523648667724956,3,-1,-1,llm8_g3,0,
2026-03-03T03:41:12.100290+00:00,BUCKET,llm_style,tune,llm_style_tune_058,16,8192,4096,bf16,NVIDIA GeForce RTX 4060,c00,32,32,32,2,2,8,0.0,0.0,323.5839903354645,370.45824915170664,3.3182785801202197,1,-1,-1,llm8_g1,0,
2026-03-03T03:41:12.228857+00:00,BUCKET,llm_style,tune,llm_style_tune_059,16,4096,6144,bf16,NVIDIA GeForce RTX 4060,c03,64,64,32,4,2,8,0.0,0.0,278.52800488471985,313.006078004837,2.8912940669406253,0,-1,-1,llm8_g0,0,
2026-03-03T03:41:12.358075+00:00,BUCKET,llm_style,tune,llm_style_tune_060,2,3072,8192,bf16,NVIDIA GeForce RTX 4060,c04,64,64,64,4,3,8,0.0,0.0,262.14399933815,278.5689499974251,0.38400000096950676,6,-1,-1,llm8_g6,0,
2026-03-03T03:41:12.532253+00:00,BUCKET,llm_style,tune,llm_style_tune_061,64,4096,8192,bf16,NVIDIA GeForce RTX 4060,c03,64,64,32,4,2,8,0.0,0.0,480.25599122047424,550.0620609521865,8.943079054745787,0,-1,-1,llm8_g0,0,
2026-03-03T03:41:12.594899+00:00,BUCKET,llm_style,tune,llm_style_tune_062,32,4096,3072,bf16,NVIDIA GeForce RTX 4060,c00,32,32,32,2,2,8,0.0,0.0,116.11200124025345,165.84703817963586,6.93559976055962,1,-1,-1,llm8_g1,0,
2026-03-03T03:41:12.725199+00:00,BUCKET,llm_style,tune,llm_style_tune_063,2,3072,8192,bf16,NVIDIA GeForce RTX 4060,c04,64,64,64,4,3,8,0.0,0.0,364.54400420188904,491.99102759361256,0.2761348282778268,6,-1,-1,llm8_g6,0,
2026-03-03T03:41:12.739071+00:00,BUCKET,llm_style,eval,llm_style_eval_000,32,1536,1024,bf16,NVIDIA GeForce RTX 4060,c11,32,128,32,4,2,8,0.0,0.0,79.8719972372055,177.4892801046371,1.2603077359020842,3,-1,-1,llm8_g3,0,
2026-03-03T03:41:12.834429+00:00,BUCKET,llm_style,eval,llm_style_eval_001,32,2048,8192,bf16,NVIDIA GeForce RTX 4060,c04,64,64,64,4,3,8,0.0,0.0,270.7519978284836,345.1084852218628,3.9657761811981005,2,-1,-1,llm8_g2,0,
2026-03-03T03:41:12.882223+00:00,BUCKET,llm_style,eval,llm_style_eval_002,16,2048,4096,bf16,NVIDIA GeForce RTX 4060,c11,32,128,32,4,2,8,0.0,0.0,131.95200264453888,211.56159996986383,2.034341659240515,3,-1,-1,llm8_g3,0,
2026-03-03T03:41:12.898464+00:00,BUCKET,llm_style,eval,llm_style_eval_003,16,2048,1536,bf16,NVIDIA GeForce RTX 4060,c11,32,128,32,4,2,8,0.0,0.0,64.2399974167347,157.8169602900742,1.566987858778726,3,-1,-1,llm8_g3,0,
2026-03-03T03:41:12.989047+00:00,BUCKET,llm_style,eval,llm_style_eval_004,64,8192,2048,bf16,NVIDIA GeForce RTX 4060,c00,32,32,32,2,2,8,0.0,0.0,270.33600211143494,285.358076095581,7.943757513713575,1,-1,-1,llm8_g1,0,
2026-03-03T03:41:13.126964+00:00,BUCKET,llm_style,eval,llm_style_eval_005,64,3072,8192,bf16,NVIDIA GeForce RTX 4060,c04,64,64,64,4,3,8,0.0,0.0,373.6160099506378,590.1440197229385,8.621754384737391,2,-1,-1,llm8_g2,0,
2026-03-03T03:41:13.149862+00:00,BUCKET,llm_style,eval,llm_style_eval_006,32,2048,2048,bf16,NVIDIA GeForce RTX 4060,c11,32,128,32,4,2,8,0.0,0.0,77.18400284647942,92.76416160166262,3.477863885006375,3,-1,-1,llm8_g3,0,
2026-03-03T03:41:13.241844+00:00,BUCKET,llm_style,eval,llm_style_eval_007,8,8192,2048,bf16,NVIDIA GeForce RTX 4060,c11,32,128,32,4,2,8,0.0,0.0,253.9519965648651,288.0022290349006,1.0570322723626844,5,-1,-1,llm8_g5,0,
2026-03-03T03:41:13.311919+00:00,BUCKET,llm_style,eval,llm_style_eval_008,64,1536,8192,bf16,NVIDIA GeForce RTX 4060,c04,64,64,64,4,3,8,0.0,0.0,188.1600022315979,260.67966759204865,8.559803980112454,2,-1,-1,llm8_g2,0,
2026-03-03T03:41:13.447368+00:00,BUCKET,llm_style,eval,llm_style_eval_009,64,4096,6144,bf16,NVIDIA GeForce RTX 4060,c03,64,64,32,4,2,8,0.0,0.0,376.2719929218292,492.4707180261612,8.560896193698934,0,-1,-1,llm8_g0,0,
2026-03-03T03:41:13.495575+00:00,BUCKET,llm_style,eval,llm_style_eval_010,64,2048,4096,bf16,NVIDIA GeForce RTX 4060,c11,32,128,32,4,2,8,0.0,0.0,153.60000729560852,226.9862380623817,6.990506334635431,3,-1,-1,llm8_g3,0,
2026-03-03T03:41:13.594333+00:00,BUCKET,llm_style,eval,llm_style_eval_011,32,3072,6144,bf16,NVIDIA GeForce RTX 4060,c04,64,64,64,4,3,8,0.0,0.0,284.67199206352234,362.53440231084824,4.243338247798024,2,-1,-1,llm8_g2,0,
2026-03-03T03:41:13.609465+00:00,BUCKET,llm_style,eval,llm_style_eval_012,16,1536,1536,bf16,NVIDIA GeForce RTX 4060,c11,32,128,32,4,2,8,0.0,0.0,70.65600156784058,210.78912004828447,1.0685217154201807,3,-1,-1,llm8_g3,0,
2026-03-03T03:41:13.639876+00:00,BUCKET,llm_style,eval,llm_style_eval_013,64,2048,3072,bf16,NVIDIA GeForce RTX 4060,c11,32,128,32,4,2,8,0.0,0.0,129.93600219488144,238.13120231032372,6.197715447579958,3,-1,-1,llm8_g3,0,
2026-03-03T03:41:13.917481+00:00,BUCKET,llm_style,eval,llm_style_eval_014,16,8192,6144,bf16,NVIDIA GeForce RTX 4060,c03,64,64,32,4,2,8,0.0,0.0,863.2320165634155,944.4707190990446,1.8657935585058085,0,-1,-1,llm8_g0,0,
2026-03-03T03:41:13.968287+00:00,BUCKET,llm_style,eval,llm_style_eval_015,64,6144,1536,bf16,NVIDIA GeForce RTX 4060,c00,32,32,32,2,2,8,0.0,0.0,208.8320031762123,232.4371239542961,5.784360316558973,1,-1,-1,llm8_g1,0,
2026-03-03T03:41:14.058038+00:00,BUCKET,llm_style,eval,llm_style_eval_016,16,4096,4096,bf16,NVIDIA GeForce RTX 4060,c00,32,32,32,2,2,8,0.0,0.0,253.9519965648651,267.25184082984924,2.1140645447253688,1,-1,-1,llm8_g1,0,
2026-03-03T03:41:14.246429+00:00,BUCKET,llm_style,eval,llm_style_eval_017,64,8192,4096,bf16,NVIDIA GeForce RTX 4060,c00,32,32,32,2,2,8,0.0,0.0,616.4160072803497,755.0771147012711,6.967644002221089,1,-1,-1,llm8_g1,0,
2026-03-03T03:41:14.381032+00:00,BUCKET,llm_style,eval,llm_style_eval_018,32,4096,6144,bf16,NVIDIA GeForce RTX 4060,c03,64,64,32,4,2,8,0.0,0.0,393.5680091381073,423.94016563892365,4.092336517714321,0,-1,-1,llm8_g0,0,
2026-03-03T03:41:14.519701+00:00,BUCKET,llm_style,eval,llm_style_eval_019,16,3072,8192,bf16,NVIDIA GeForce RTX 4060,c04,64,64,64,4,3,8,0.0,0.0,374.783992767334,409.12351697683334,2.148721352941918,2,-1,-1,llm8_g2,0,
2026-03-03T03:41:14.535770+00:00,BUCKET,llm_style,eval,llm_style_eval_020,4,1536,1536,bf16,NVIDIA GeForce RTX 4060,c00,32,32,32,2,2,8,0.0,0.0,64.51199948787689,135.18847361207008,0.29257143089398235,7,-1,-1,llm8_g7,0,
2026-03-03T03:41:14.588480+00:00,BUCKET,llm_style,eval,llm_style_eval_021,4,6144,1536,bf16,NVIDIA GeForce RTX 4060,c11,32,128,32,4,2,8,0.0,0.0,93.18400174379349,186.4396795630454,0.810197787036212,5,-1,-1,llm8_g5,0,
2026-03-03T03:41:14.619755+00:00,BUCKET,llm_style,eval,llm_style_eval_022,32,6144,1024,bf16,NVIDIA GeForce RTX 4060,c00,32,32,32,2,2,8,0.0,0.0,114.17600139975548,256.32767707109446,3.526600853626166,1,-1,-1,llm8_g1,0,
2026-03-03T03:41:14.633083+00:00,BUCKET,llm_style,eval,llm_style_eval_023,16,1024,1536,bf16,NVIDIA GeForce RTX 4060,c11,32,128,32,4,2,8,0.0,0.0,80.84799721837044,191.6825538873671,0.622546627395781,3,-1,-1,llm8_g3,0,
2026-03-03T03:41:14.670812+00:00,BUCKET,llm_style,eval,llm_style_eval_024,32,8192,1024,bf16,NVIDIA GeForce RTX 4060,c00,32,32,32,2,2,8,0.0,0.0,114.68800157308578,205.4655987024307,4.681142792935274,1,-1,-1,llm8_g1,0,
2026-03-03T03:41:14.876568+00:00,BUCKET,llm_style,eval,llm_style_eval_025,32,6144,6144,bf16,NVIDIA GeForce RTX 4060,c03,64,64,32,4,2,8,0.0,0.0,601.3120114803314,715.8169561624527,4.017746291234735,0,-1,-1,llm8_g0,0,
2026-03-03T03:41:14.943358+00:00,BUCKET,llm_style,eval,llm_style_eval_026,1,6144,2048,bf16,NVIDIA GeForce RTX 4060,c11,32,128,32,4,2,8,0.0,0.0,122.5920021533966,158.48480090498919,0.20528112403703605,5,-1,-1,llm8_g5,0,
2026-03-03T03:41:15.015045+00:00,BUCKET,llm_style,eval,llm_style_eval_027,32,4096,3072,bf16,NVIDIA GeForce RTX 4060,c00,32,32,32,2,2,8,0.0,0.0,161.77599877119064,258.7647980451582,4.977910036821917,1,-1,-1,llm8_g1,0,
2026-03-03T03:41:15.034850+00:00,BUCKET,llm_style,eval,llm_style_eval_028,64,1536,1536,bf16,NVIDIA GeForce RTX 4060,c11,32,128,32,4,2,8,0.0,0.0,97.15200215578079,178.36032062768933,3.1084268084950715,3,-1,-1,llm8_g3,0,
2026-03-03T03:41:15.051661+00:00,BUCKET,llm_style,eval,llm_style_eval_029,2,3072,1024,bf16,NVIDIA GeForce RTX 4060,c00,32,32,32,2,2,8,0.0,0.0,60.816001147031784,148.1852768361568,0.20690133784986828,7,-1,-1,llm8_g7,0,
2026-03-03T03:41:15.128440+00:00,BUCKET,llm_style,eval,llm_style_eval_030,32,1536,8192,bf16,NVIDIA GeForce RTX 4060,c04,64,64,64,4,3,8,0.0,0.0,245.7599937915802,294.9939304590225,3.276800082778933,2,-1,-1,llm8_g2,0,
2026-03-03T03:41:15.156997+00:00,BUCKET,llm_style,eval,llm_style_eval_031,8,3072,2048,bf16,NVIDIA GeForce RTX 4060,c00,32,32,32,2,2,8,0.0,0.0,86.5279994904995,208.8287991285323,1.1633609535957492,7,-1,-1,llm8_g7,0,
2026-03-03T03:41:15.184594+00:00,BUCKET,llm_style,eval,llm_style_eval_032,8,2048,3072,bf16,NVIDIA GeForce RTX 4060,c00,32,32,32,2,2,8,0.0,0.0,107.00799897313118,187.12511956691736,0.9407081429985035,7,-1,-1,llm8_g7,0,
2026-03-03T03:41:15.255761+00:00,BUCKET,llm_style,eval,llm_style_eval_033,64,1536,8192,bf16,NVIDIA GeForce RTX 4060,c04,64,64,64,4,3,8,0.0,0.0,246.7840015888214,339.7043141722677,6.526406596986455,2,-1,-1,llm8_g2,0,
2026-03-03T03:41:15.333969+00:00,BUCKET,llm_style,eval,llm_style_eval_034,64,6144,2048,bf16,NVIDIA GeForce RTX 4060,c00,32,32,32,2,2,8,0.0,0.0,367.1039938926697,497.3056158423423,4.387347353324887,1,-1,-1,llm8_g1,0,
2026-03-03T03:41:15.375485+00:00,BUCKET,llm_style,eval,llm_style_eval_035,4,4096,2048,bf16,NVIDIA GeForce RTX 4060,c11,32,128,32,4,2,8,0.0,0.0,130.52800297737122,302.11072146892536,0.5141338446098361,5,-1,-1,llm8_g5,0,
2026-03-03T03:41:15.582042+00:00,BUCKET,llm_style,eval,llm_style_eval_036,64,8192,4096,bf16,NVIDIA GeForce RTX 4060,c00,32,32,32,2,2,8,0.0,0.0,844.2080020904541,984.8115366697311,5.087569989107743,1,-1,-1,llm8_g1,0,
2026-03-03T03:41:15.619113+00:00,BUCKET,llm_style,eval,llm_style_eval_037,32,6144,1024,bf16,NVIDIA GeForce RTX 4060,c00,32,32,32,2,2,8,0.0,0.0,81.91999793052673,203.41759800910944,4.9152001241684,1,-1,-1,llm8_g1,0,
2026-03-03T03:41:15.697405+00:00,BUCKET,llm_style,eval,llm_style_eval_038,64,6144,2048,bf16,NVIDIA GeForce RTX 4060,c00,32,32,32,2,2,8,0.0,0.0,370.12800574302673,412.6924780011177,4.351501942596097,1,-1,-1,llm8_g1,0,
2026-03-03T03:41:15.723218+00:00,BUCKET,llm_style,eval,llm_style_eval_039,8,1024,3072,bf16,NVIDIA GeForce RTX 4060,c00,32,32,32,2,2,8,0.0,0.0,116.59200116991997,188.4502400457859,0.4316904032434196,7,-1,-1,llm8_g7,0,
2026-03-03T03:41:15.816132+00:00,BUCKET,llm_style,eval,llm_style_eval_040,32,8192,2048,bf16,NVIDIA GeForce RTX 4060,c00,32,32,32,2,2,8,0.0,0.0,261.1199915409088,269.61152374744415,4.112062878310029,1,-1,-1,llm8_g1,0,
2026-03-03T03:41:15.836335+00:00,BUCKET,llm_style,eval,llm_style_eval_041,32,3072,1024,bf16,NVIDIA GeForce RTX 4060,c11,32,128,32,4,2,8,0.0,0.0,75.77600330114365,124.06591631472095,2.656864749119877,3,-1,-1,llm8_g3,0,
2026-03-03T03:41:15.867220+00:00,BUCKET,llm_style,eval,llm_style_eval_042,64,1024,4096,bf16,NVIDIA GeForce RTX 4060,c11,32,128,32,4,2,8,0.0,0.0,217.0879989862442,297.13344365358347,2.4730566153222444,3,-1,-1,llm8_g3,0,
2026-03-03T03:41:15.879781+00:00,BUCKET,llm_style,eval,llm_style_eval_043,2,1536,1024,bf16,NVIDIA GeForce RTX 4060,c00,32,32,32,2,2,8,0.0,0.0,76.79999992251396,235.85792124271376,0.08192000008265177,7,-1,-1,llm8_g7,0,
2026-03-03T03:41:16.001996+00:00,BUCKET,llm_style,eval,llm_style_eval_044,64,6144,3072,bf16,NVIDIA GeForce RTX 4060,c00,32,32,32,2,2,8,0.0,0.0,546.7360019683838,681.1033594608307,4.418803765075097,1,-1,-1,llm8_g1,0,
2026-03-03T03:41:16.049931+00:00,BUCKET,llm_style,eval,llm_style_eval_045,64,1536,6144,bf16,NVIDIA GeForce RTX 4060,c04,64,64,64,4,3,8,0.0,0.0,216.5760025382042,371.3343977928156,5.5775318495266575,2,-1,-1,llm8_g2,0,
2026-03-03T03:41:16.151167+00:00,BUCKET,llm_style,eval,llm_style_eval_046,2,6144,3072,bf16,NVIDIA GeForce RTX 4060,c11,32,128,32,4,2,8,0.0,0.0,284.67199206352234,396.56896620988834,0.2652086404873765,5,-1,-1,llm8_g5,0,
2026-03-03T03:41:16.350757+00:00,BUCKET,llm_style,eval,llm_style_eval_047,16,4096,8192,bf16,NVIDIA GeForce RTX 4060,c03,64,64,32,4,2,8,0.0,0.0,821.2479948997498,932.1878337860107,1.3074513796908231,0,-1,-1,llm8_g0,0,
2026-03-03T03:41:16.399025+00:00,BUCKET,llm_style,eval,llm_style_eval_048,16,1024,6144,bf16,NVIDIA GeForce RTX 4060,c04,64,64,64,4,3,8,0.0,0.0,231.9200038909912,329.5948833227157,0.8680863600477905,2,-1,-1,llm8_g2,0,
2026-03-03T03:41:16.466537+00:00,BUCKET,llm_style,eval,llm_style_eval_049,16,8192,1536,bf16,NVIDIA GeForce RTX 4060,c00,32,32,32,2,2,8,0.0,0.0,151.5520066022873,271.4105623960495,2.656864749119877,1,-1,-1,llm8_g1,0,
2026-03-03T03:41:16.477167+00:00,BUCKET,llm_style,eval,llm_style_eval_050,1,1024,1024,bf16,NVIDIA GeForce RTX 4060,c00,32,32,32,2,2,8,0.0,0.0,82.43199810385704,124.23167720437043,0.025440994374026624,7,-1,-1,llm8_g7,0,
2026-03-03T03:41:16.505314+00:00,BUCKET,llm_style,eval,llm_style_eval_051,16,6144,1024,bf16,NVIDIA GeForce RTX 4060,c00,32,32,32,2,2,8,0.0,0.0,110.08000001311302,127.54879444837569,1.8289116276891118,1,-1,-1,llm8_g1,0,
2026-03-03T03:41:16.924730+00:00,BUCKET,llm_style,eval,llm_style_eval_052,16,8192,8192,bf16,NVIDIA GeForce RTX 4060,c03,64,64,32,4,2,8,0.0,0.0,1590.7840132713318,1883.7094736099243,1.3499529980715963,0,-1,-1,llm8_g0,0,
2026-03-03T03:41:17.180910+00:00,BUCKET,llm_style,eval,llm_style_eval_053,1,6144,8192,bf16,NVIDIA GeForce RTX 4060,c02,32,64,32,2,2,8,0.0,0.0,706.0160040855408,831.2307143211365,0.14257934015303658,4,-1,-1,llm8_g4,0,
2026-03-03T03:41:17.263413+00:00,BUCKET,llm_style,eval,llm_style_eval_054,64,4096,3072,bf16,NVIDIA GeForce RTX 4060,c00,32,32,32,2,2,8,0.0,0.0,404.4800102710724,508.28513145446766,3.981934076100838,1,-1,-1,llm8_g1,0,
2026-03-03T03:41:17.302738+00:00,BUCKET,llm_style,eval,llm_style_eval_055,4,8192,1024,bf16,NVIDIA GeForce RTX 4060,c11,32,128,32,4,2,8,0.0,0.0,147.96800166368484,210.12479647994036,0.4535363270805748,5,-1,-1,llm8_g5,0,
2026-03-03T03:41:17.332070+00:00,BUCKET,llm_style,eval,llm_style_eval_056,64,1024,3072,bf16,NVIDIA GeForce RTX 4060,c11,32,128,32,4,2,8,0.0,0.0,210.94400435686111,316.506558060646,1.9088154945556925,3,-1,-1,llm8_g3,0,
2026-03-03T03:41:17.346045+00:00,BUCKET,llm_style,eval,llm_style_eval_057,64,1024,3072,bf16,NVIDIA GeForce RTX 4060,c11,32,128,32,4,2,8,0.0,0.0,209.72799509763718,226.76607742905614,1.9198828645291157,3,-1,-1,llm8_g3,0,
2026-03-03T03:41:17.402485+00:00,BUCKET,llm_style,eval,llm_style_eval_058,32,2048,4096,bf16,NVIDIA GeForce RTX 4060,c11,32,128,32,4,2,8,0.0,0.0,265.21599292755127,375.8694404363632,2.0242780462589085,3,-1,-1,llm8_g3,0,
2026-03-03T03:41:17.513700+00:00,BUCKET,llm_style,eval,llm_style_eval_059,64,8192,2048,bf16,NVIDIA GeForce RTX 4060,c00,32,32,32,2,2,8,0.0,0.0,593.7919914722443,785.4073607921598,3.6165587930472793,1,-1,-1,llm8_g1,0,
2026-03-03T03:41:17.629117+00:00,BUCKET,llm_style,eval,llm_style_eval_060,1,3072,6144,bf16,NVIDIA GeForce RTX 4060,c04,64,64,64,4,3,8,0.0,0.0,467.8879976272583,580.4512017965317,0.08067900051172594,6,-1,-1,llm8_g6,0,
2026-03-03T03:41:17.672345+00:00,BUCKET,llm_style,eval,llm_style_eval_061,64,1536,4096,bf16,NVIDIA GeForce RTX 4060,c11,32,128,32,4,2,8,0.0,0.0,276.4640003442764,326.38368606567377,2.912879676909703,3,-1,-1,llm8_g3,0,
2026-03-03T03:41:17.740225+00:00,BUCKET,llm_style,eval,llm_style_eval_062,16,6144,2048,bf16,NVIDIA GeForce RTX 4060,c00,32,32,32,2,2,8,0.0,0.0,189.44000452756882,385.7919999957084,2.1254918410931665,1,-1,-1,llm8_g1,0,
2026-03-03T03:41:17.796573+00:00,BUCKET,llm_style,eval,llm_style_eval_063,64,1536,6144,bf16,NVIDIA GeForce RTX 4060,c04,64,64,64,4,3,8,0.0,0.0,254.97600436210632,318.45375210046757,4.737542087625257,2,-1,-1,llm8_g2,0,
2026-03-03T03:41:17.861262+00:00,BUCKET,llm_style,eval,llm_style_eval_064,1,6144,2048,bf16,NVIDIA GeForce RTX 4060,c11,32,128,32,4,2,8,0.0,0.0,169.3280041217804,274.65728342533106,0.14862174824845148,5,-1,-1,llm8_g5,0,
2026-03-03T03:41:17.922729+00:00,BUCKET,llm_style,eval,llm_style_eval_065,8,1536,6144,bf16,NVIDIA GeForce RTX 4060,c04,64,64,64,4,3,8,0.0,0.0,280.5759906768799,365.81408768892277,0.5381606018238764,6,-1,-1,llm8_g6,0,
2026-03-03T03:41:17.967888+00:00,BUCKET,llm_style,eval,llm_style_eval_066,64,1536,4096,bf16,NVIDIA GeForce RTX 4060,c11,32,128,32,4,2,8,0.0,0.0,287.6800000667572,357.8982454538343,2.799313013810921,3,-1,-1,llm8_g3,0,
2026-03-03T03:41:18.080966+00:00,BUCKET,llm_style,eval,llm_style_eval_067,64,8192,2048,bf16,NVIDIA GeForce RTX 4060,c00,32,32,32,2,2,8,0.0,0.0,617.9839968681335,680.9727984666824,3.474982619102083,1,-1,-1,llm8_g1,0,
2026-03-03T03:41:18.117561+00:00,BUCKET,llm_style,eval,llm_style_eval_068,64,1024,4096,bf16,NVIDIA GeForce RTX 4060,c11,32,128,32,4,2,8,0.0,0.0,287.6800000667572,326.0214415192603,1.8662086758739471,3,-1,-1,llm8_g3,0,
2026-03-03T03:41:18.168015+00:00,BUCKET,llm_style,eval,llm_style_eval_069,64,2048,4096,bf16,NVIDIA GeForce RTX 4060,c11,32,128,32,4,2,8,0.0,0.0,324.30399954319,359.8214417695998,3.31091144578068,3,-1,-1,llm8_g3,0,
2026-03-03T03:41:18.227536+00:00,BUCKET,llm_style,eval,llm_style_eval_070,64,8192,1024,bf16,NVIDIA GeForce RTX 4060,c00,32,32,32,2,2,8,0.0,0.0,317.888006567955,336.9574421644211,3.3777361895232936,1,-1,-1,llm8_g1,0,
2026-03-03T03:41:18.323839+00:00,BUCKET,llm_style,eval,llm_style_eval_071,64,6144,2048,bf16,NVIDIA GeForce RTX 4060,c00,32,32,32,2,2,8,0.0,0.0,545.2639758586884,598.3437037467955,2.9538220152240706,1,-1,-1,llm8_g1,0,
2026-03-03T03:41:18.338201+00:00,BUCKET,llm_style,eval,llm_style_eval_072,64,1536,1024,bf16,NVIDIA GeForce RTX 4060,c11,32,128,32,4,2,8,0.0,0.0,101.3759970664978,243.32287982106175,1.9859394514062279,3,-1,-1,llm8_g3,0,
2026-03-03T03:41:18.370891+00:00,BUCKET,llm_style,eval,llm_style_eval_073,1,4096,1536,bf16,NVIDIA GeForce RTX 4060,c11,32,128,32,4,2,8,0.0,0.0,121.85599654912949,198.32831978797898,0.10326050712594079,5,-1,-1,llm8_g5,0,
2026-03-03T03:41:18.386312+00:00,BUCKET,llm_style,eval,llm_style_eval_074,8,1024,2048,bf16,NVIDIA GeForce RTX 4060,c00,32,32,32,2,2,8,0.0,0.0,108.5439994931221,139.97951865196222,0.30913207691528055,7,-1,-1,llm8_g7,0,
2026-03-03T03:41:18.414074+00:00,BUCKET,llm_style,eval,llm_style_eval_075,2,6144,1024,bf16,NVIDIA GeForce RTX 4060,c11,32,128,32,4,2,8,0.0,0.0,110.46399921178818,190.4953628778457,0.22781923685155175,5,-1,-1,llm8_g5,0,
2026-03-03T03:41:18.454983+00:00,BUCKET,llm_style,eval,llm_style_eval_076,64,1024,6144,bf16,NVIDIA GeForce RTX 4060,c04,64,64,64,4,3,8,0.0,0.0,270.27200162410736,406.41535222530354,2.979614474162274,2,-1,-1,llm8_g2,0,
2026-03-03T03:41:18.637539+00:00,BUCKET,llm_style,eval,llm_style_eval_077,1,4096,8192,bf16,NVIDIA GeForce RTX 4060,c02,32,64,32,2,2,8,0.0,0.0,620.959997177124,769.2287844419479,0.10807276524265011,4,-1,-1,llm8_g4,0,
2026-03-03T03:41:18.779787+00:00,BUCKET,llm_style,eval,llm_style_eval_078,64,6144,3072,bf16,NVIDIA GeForce RTX 4060,c00,32,32,32,2,2,8,0.0,0.0,769.0240144729614,916.295677423477,3.1415392218352403,1,-1,-1,llm8_g1,0,
2026-03-03T03:41:18.852388+00:00,BUCKET,llm_style,eval,llm_style_eval_079,2,3072,4096,bf16,NVIDIA GeForce RTX 4060,c00,32,32,32,2,2,8,0.0,0.0,220.16000002622604,311.28575712442387,0.22861395346113897,7,-1,-1,llm8_g7,0,
2026-03-03T03:41:18.865035+00:00,BUCKET,llm_style,eval,llm_style_eval_080,4,1536,1024,bf16,NVIDIA GeForce RTX 4060,c00,32,32,32,2,2,8,0.0,0.0,80.38399741053581,253.24640244245492,0.15653503688970283,7,-1,-1,llm8_g7,0,
2026-03-03T03:41:19.005691+00:00,BUCKET,llm_style,eval,llm_style_eval_081,4,4096,6144,bf16,NVIDIA GeForce RTX 4060,c02,32,64,32,2,2,8,0.0,0.0,501.71199440956116,615.4444867372513,0.4012792084768291,4,-1,-1,llm8_g4,0,
2026-03-03T03:41:19.049482+00:00,BUCKET,llm_style,eval,llm_style_eval_082,64,6144,1024,bf16,NVIDIA GeForce RTX 4060,c00,32,32,32,2,2,8,0.0,0.0,266.7520046234131,374.79840010404575,3.018932769172215,1,-1,-1,llm8_g1,0,
2026-03-03T03:41:19.146318+00:00,BUCKET,llm_style,eval,llm_style_eval_083,8,4096,4096,bf16,NVIDIA GeForce RTX 4060,c11,32,128,32,4,2,8,0.0,0.0,365.5040115118027,384.06144320964813,0.7344254715281882,5,-1,-1,llm8_g5,0,
2026-03-03T03:41:19.204640+00:00,BUCKET,llm_style,eval,llm_style_eval_084,64,1024,8192,bf16,NVIDIA GeForce RTX 4060,c04,64,64,64,4,3,8,0.0,0.0,419.280007481575,536.4716559648513,2.5609182523380514,2,-1,-1,llm8_g2,0,
2026-03-03T03:41:19.362933+00:00,BUCKET,llm_style,eval,llm_style_eval_085,1,3072,8192,bf16,NVIDIA GeForce RTX 4060,c04,64,64,64,4,3,8,0.0,0.0,745.3440129756927,859.095686674118,0.0675280771345532,6,-1,-1,llm8_g6,0,
2026-03-03T03:41:19.378407+00:00,BUCKET,llm_style,eval,llm_style_eval_086,8,1536,1024,bf16,NVIDIA GeForce RTX 4060,c00,32,32,32,2,2,8,0.0,0.0,75.1200020313263,159.72383752465248,0.3350082976502774,7,-1,-1,llm8_g7,0,
2026-03-03T03:41:19.407810+00:00,BUCKET,llm_style,eval,llm_style_eval_087,16,1024,3072,bf16,NVIDIA GeForce RTX 4060,c11,32,128,32,4,2,8,0.0,0.0,261.12000644207,342.763505578041,0.38550587284215754,3,-1,-1,llm8_g3,0,
2026-03-03T03:41:19.445192+00:00,BUCKET,llm_style,eval,llm_style_eval_088,8,4096,1536,bf16,NVIDIA GeForce RTX 4060,c11,32,128,32,4,2,8,0.0,0.0,159.743994474411,210.83136036992067,0.6301538679510421,5,-1,-1,llm8_g5,0,
2026-03-03T03:41:19.547448+00:00,BUCKET,llm_style,eval,llm_style_eval_089,16,6144,3072,bf16,NVIDIA GeForce RTX 4060,c00,32,32,32,2,2,8,0.0,0.0,330.6239992380142,448.5039907693863,1.8267874606561716,1,-1,-1,llm8_g1,0,
2026-03-03T03:41:19.583878+00:00,BUCKET,llm_style,eval,llm_style_eval_090,32,1536,3072,bf16,NVIDIA GeForce RTX 4060,c11,32,128,32,4,2,8,0.0,0.0,238.5919988155365,330.18113017082214,1.265716744480935,3,-1,-1,llm8_g3,0,
2026-03-03T03:41:19.619406+00:00,BUCKET,llm_style,eval,llm_style_eval_091,16,1024,4096,bf16,NVIDIA GeForce RTX 4060,c11,32,128,32,4,2,8,0.0,0.0,325.6160020828247,444.61888492107374,0.41219635135087723,3,-1,-1,llm8_g3,0,
2026-03-03T03:41:19.764254+00:00,BUCKET,llm_style,eval,llm_style_eval_092,1,4096,6144,bf16,NVIDIA GeForce RTX 4060,c02,32,64,32,2,2,8,0.0,0.0,557.5680136680603,657.4729692935944,0.09026997023893875,4,-1,-1,llm8_g4,0,
2026-03-03T03:41:19.803726+00:00,BUCKET,llm_style,eval,llm_style_eval_093,32,2048,3072,bf16,NVIDIA GeForce RTX 4060,c11,32,128,32,4,2,8,0.0,0.0,263.61601054668427,342.4096032977103,1.5274230998526297,3,-1,-1,llm8_g3,0,
2026-03-03T03:41:19.825733+00:00,BUCKET,llm_style,eval,llm_style_eval_094,32,1024,2048,bf16,NVIDIA GeForce RTX 4060,c11,32,128,32,4,2,8,0.0,0.0,164.7999957203865,308.7760028243064,0.8144279823145449,3,-1,-1,llm8_g3,0,
2026-03-03T03:41:19.893744+00:00,BUCKET,llm_style,eval,llm_style_eval_095,8,6144,2048,bf16,NVIDIA GeForce RTX 4060,c11,32,128,32,4,2,8,0.0,0.0,208.8319957256317,233.93728017807007,0.9640600871549757,5,-1,-1,llm8_g5,0,
2026-03-03T03:41:19.934839+00:00,BUCKET,llm_style,eval,llm_style_eval_096,64,2048,3072,bf16,NVIDIA GeForce RTX 4060,c11,32,128,32,4,2,8,0.0,0.0,272.38398790359497,371.99871897697443,2.9565114094923324,3,-1,-1,llm8_g3,0,
2026-03-03T03:41:19.980905+00:00,BUCKET,llm_style,eval,llm_style_eval_097,64,6144,1024,bf16,NVIDIA GeForce RTX 4060,c00,32,32,32,2,2,8,0.0,0.0,320.49599289894104,517.6406347751615,2.5126877896845645,1,-1,-1,llm8_g1,0,
2026-03-03T03:41:20.012911+00:00,BUCKET,llm_style,eval,llm_style_eval_098,32,6144,1024,bf16,NVIDIA GeForce RTX 4060,c00,32,32,32,2,2,8,0.0,0.0,140.28799533843994,162.81600296497345,2.8701898763940075,1,-1,-1,llm8_g1,0,
2026-03-03T03:41:20.035052+00:00,BUCKET,llm_style,eval,llm_style_eval_099,1,2048,2048,bf16,NVIDIA GeForce RTX 4060,c00,32,32,32,2,2,8,0.0,0.0,129.95200604200363,167.50592440366734,0.06455158527748005,7,-1,-1,llm8_g7,0,
2026-03-03T03:41:20.086115+00:00,BUCKET,llm_style,eval,llm_style_eval_100,64,8192,1024,bf16,NVIDIA GeForce RTX 4060,c00,32,32,32,2,2,8,0.0,0.0,372.5920021533966,396.3494473695755,2.881816619235802,1,-1,-1,llm8_g1,0,
2026-03-03T03:41:20.178153+00:00,BUCKET,llm_style,eval,llm_style_eval_101,64,8192,1536,bf16,NVIDIA GeForce RTX 4060,c00,32,32,32,2,2,8,0.0,0.0,545.2799797058105,630.4563170671462,2.9537353211995017,1,-1,-1,llm8_g1,0,
2026-03-03T03:41:20.213846+00:00,BUCKET,llm_style,eval,llm_style_eval_102,32,3072,2048,bf16,NVIDIA GeForce RTX 4060,c11,32,128,32,4,2,8,0.0,0.0,184.31999534368515,339.56864684820175,2.1845333885192884,3,-1,-1,llm8_g3,0,
2026-03-03T03:41:20.254053+00:00,BUCKET,llm_style,eval,llm_style_eval_103,64,2048,3072,bf16,NVIDIA GeForce RTX 4060,c11,32,128,32,4,2,8,0.0,0.0,297.9840040206909,358.20545315742487,2.7025154274525507,3,-1,-1,llm8_g3,0,
2026-03-03T03:41:20.325060+00:00,BUCKET,llm_style,eval,llm_style_eval_104,16,6144,2048,bf16,NVIDIA GeForce RTX 4060,c00,32,32,32,2,2,8,0.0,0.0,241.08800292015076,353.8563194870949,1.6701502319605686,1,-1,-1,llm8_g1,0,
2026-03-03T03:41:20.390792+00:00,BUCKET,llm_style,eval,llm_style_eval_105,1,1024,8192,bf16,NVIDIA GeForce RTX 4060,c04,64,64,64,4,3,8,0.0,0.0,443.7599927186966,560.2713638544083,0.0378069593367675,6,-1,-1,llm8_g6,0,
2026-03-03T03:41:20.620639+00:00,BUCKET,llm_style,eval,llm_style_eval_106,32,4096,8192,bf16,NVIDIA GeForce RTX 4060,c03,64,64,32,4,2,8,0.0,0.0,1296.3839769363403,1349.071056842804,1.6565181969272775,0,-1,-1,llm8_g0,0,
2026-03-03T03:41:20.709569+00:00,BUCKET,llm_style,eval,llm_style_eval_107,64,6144,1536,bf16,NVIDIA GeForce RTX 4060,c00,32,32,32,2,2,8,0.0,0.0,445.8879977464676,599.2959982156752,2.70910981705062,1,-1,-1,llm8_g1,0,
2026-03-03T03:41:20.733521+00:00,BUCKET,llm_style,eval,llm_style_eval_108,8,3072,1536,bf16,NVIDIA GeForce RTX 4060,c00,32,32,32,2,2,8,0.0,0.0,104.44799810647964,170.67424118518815,0.722823542515712,7,-1,-1,llm8_g7,0,
2026-03-03T03:41:20.748720+00:00,BUCKET,llm_style,eval,llm_style_eval_109,16,2048,1024,bf16,NVIDIA GeForce RTX 4060,c11,32,128,32,4,2,8,0.0,0.0,104.3039970099926,186.44992351531982,0.6433968584499287,3,-1,-1,llm8_g3,0,
2026-03-03T03:41:21.144979+00:00,BUCKET,llm_style,eval,llm_style_eval_110,1,8192,8192,bf16,NVIDIA GeForce RTX 4060,c02,32,64,32,2,2,8,0.0,0.0,1198.3519792556763,1221.6320037841797,0.112001924579259,4,-1,-1,llm8_g4,0,
2026-03-03T03:41:21.207632+00:00,BUCKET,llm_style,eval,llm_style_eval_111,8,6144,1536,bf16,NVIDIA GeForce RTX 4060,c11,32,128,32,4,2,8,0.0,0.0,162.81600296497345,216.88607841730112,0.9273962095266733,5,-1,-1,llm8_g5,0,
2026-03-03T03:41:21.317453+00:00,BUCKET,llm_style,eval,llm_style_eval_112,2,6144,3072,bf16,NVIDIA GeForce RTX 4060,c11,32,128,32,4,2,8,0.0,0.0,304.1279911994934,443.3920085430145,0.24824243142577845,5,-1,-1,llm8_g5,0,
2026-03-03T03:41:21.697674+00:00,BUCKET,llm_style,eval,llm_style_eval_113,1,8192,8192,bf16,NVIDIA GeForce RTX 4060,c02,32,64,32,2,2,8,0.0,0.0,1202.5759816169739,1312.8111934661865,0.11160852208234855,4,-1,-1,llm8_g4,0,
2026-03-03T03:41:21.722447+00:00,BUCKET,llm_style,eval,llm_style_eval_114,1,3072,1024,bf16,NVIDIA GeForce RTX 4060,c00,32,32,32,2,2,8,0.0,0.0,84.99199897050858,128.99327881634227,0.07402409728218154,7,-1,-1,llm8_g7,0,
2026-03-03T03:41:21.751954+00:00,BUCKET,llm_style,eval,llm_style_eval_115,16,3072,1536,bf16,NVIDIA GeForce RTX 4060,c11,32,128,32,4,2,8,0.0,0.0,126.3200007379055,147.88032084703445,1.195336788457524,3,-1,-1,llm8_g3,0,
2026-03-03T03:41:21.769175+00:00,BUCKET,llm_style,eval,llm_style_eval_116,8,3072,1024,bf16,NVIDIA GeForce RTX 4060,c00,32,32,32,2,2,8,0.0,0.0,76.80000364780426,155.18751919269556,0.6553599688720718,7,-1,-1,llm8_g7,0,
2026-03-03T03:41:21.798230+00:00,BUCKET,llm_style,eval,llm_style_eval_117,4,1024,4096,bf16,NVIDIA GeForce RTX 4060,c00,32,32,32,2,2,8,0.0,0.0,206.84799551963806,279.59391355514526,0.16221782529584317,7,-1,-1,llm8_g7,0,
2026-03-03T03:41:21.947696+00:00,BUCKET,llm_style,eval,llm_style_eval_118,64,6144,3072,bf16,NVIDIA GeForce RTX 4060,c00,32,32,32,2,2,8,0.0,0.0,801.2800216674805,894.2592120170593,3.0150746788524967,1,-1,-1,llm8_g1,0,
2026-03-03T03:41:22.278616+00:00,BUCKET,llm_style,eval,llm_style_eval_119,64,8192,6144,bf16,NVIDIA GeForce RTX 4060,c03,64,64,32,4,2,8,0.0,0.0,1436.1119866371155,1499.475553035736,4.486036607135369,0,-1,-1,llm8_g0,0,
2026-03-03T03:41:22.311969+00:00,BUCKET,llm_style,eval,llm_style_eval_120,8,1024,4096,bf16,NVIDIA GeForce RTX 4060,c00,32,32,32,2,2,8,0.0,0.0,198.5279992222786,259.0639942884445,0.33803223859050063,7,-1,-1,llm8_g7,0,
2026-03-03T03:41:22.333096+00:00,BUCKET,llm_style,eval,llm_style_eval_121,4,1024,2048,bf16,NVIDIA GeForce RTX 4060,c00,32,32,32,2,2,8,0.0,0.0,112.5280000269413,231.80224373936645,0.14909370108758016,7,-1,-1,llm8_g7,0,
2026-03-03T03:41:22.476633+00:00,BUCKET,llm_style,eval,llm_style_eval_122,4,6144,4096,bf16,NVIDIA GeForce RTX 4060,c11,32,128,32,4,2,8,0.0,0.0,366.94400012493134,489.01120513677574,0.5486575388382301,5,-1,-1,llm8_g5,0,
2026-03-03T03:41:22.627783+00:00,BUCKET,llm_style,eval,llm_style_eval_123,4,3072,8192,bf16,NVIDIA GeForce RTX 4060,c04,64,64,64,4,3,8,0.0,0.0,500.68798661231995,536.6255760192871,0.4020999052966815,6,-1,-1,llm8_g6,0,
2026-03-03T03:41:22.669630+00:00,BUCKET,llm_style,eval,llm_style_eval_124,64,6144,1024,bf16,NVIDIA GeForce RTX 4060,c00,32,32,32,2,2,8,0.0,0.0,197.12000340223312,233.91456365585327,4.085360968448912,1,-1,-1,llm8_g1,0,
2026-03-03T03:41:22.784622+00:00,BUCKET,llm_style,eval,llm_style_eval_125,64,1536,8192,bf16,NVIDIA GeForce RTX 4060,c04,64,64,64,4,3,8,0.0,0.0,293.64800453186035,376.9635236263273,5.484841412655509,2,-1,-1,llm8_g2,0,
2026-03-03T03:41:22.899451+00:00,BUCKET,llm_style,eval,llm_style_eval_126,64,2048,8192,bf16,NVIDIA GeForce RTX 4060,c04,64,64,64,4,3,8,0.0,0.0,500.7359981536865,621.2301003932953,4.28865441254114,2,-1,-1,llm8_g2,0,
2026-03-03T03:41:22.979152+00:00,BUCKET,llm_style,eval,llm_style_eval_127,2,8192,1536,bf16,NVIDIA GeForce RTX 4060,c11,32,128,32,4,2,8,0.0,0.0,185.85599958896637,359.4732815027233,0.2708099179542871,5,-1,-1,llm8_g5,0,
2026-03-03T03:41:23.004002+00:00,BUCKET,llm_style,eval,llm_style_eval_128,8,2048,2048,bf16,NVIDIA GeForce RTX 4060,c00,32,32,32,2,2,8,0.0,0.0,94.2080020904541,150.6406385451554,0.7123478102801206,7,-1,-1,llm8_g7,0,
2026-03-03T03:41:23.327030+00:00,BUCKET,llm_style,eval,llm_style_eval_129,64,8192,6144,bf16,NVIDIA GeForce RTX 4060,c03,64,64,32,4,2,8,0.0,0.0,1061.2319707870483,1198.993901014328,6.07072828688156,0,-1,-1,llm8_g0,0,
2026-03-03T03:41:23.362212+00:00,BUCKET,llm_style,eval,llm_style_eval_130,16,3072,1536,bf16,NVIDIA GeForce RTX 4060,c11,32,128,32,4,2,8,0.0,0.0,112.64000087976456,770.14657318592,1.3405090804391657,3,-1,-1,llm8_g3,0,
2026-03-03T03:41:23.768215+00:00,BUCKET,llm_style,eval,llm_style_eval_131,32,8192,8192,bf16,NVIDIA GeForce RTX 4060,c03,64,64,32,4,2,8,0.0,0.0,1400.320053100586,1518.1311964988708,3.067132607642154,0,-1,-1,llm8_g0,0,
2026-03-03T03:41:23.944797+00:00,BUCKET,llm_style,eval,llm_style_eval_132,32,8192,4096,bf16,NVIDIA GeForce RTX 4060,c00,32,32,32,2,2,8,0.0,0.0,482.8159958124161,622.581757903099,4.447830367315214,1,-1,-1,llm8_g1,0,
2026-03-03T03:41:24.282561+00:00,BUCKET,llm_style,eval,llm_style_eval_133,2,8192,8192,bf16,NVIDIA GeForce RTX 4060,c02,32,64,32,2,2,8,0.0,0.0,913.919985294342,1051.9190275669098,0.29371877223315807,4,-1,-1,llm8_g4,0,
2026-03-03T03:41:24.329426+00:00,BUCKET,llm_style,eval,llm_style_eval_134,64,3072,3072,bf16,NVIDIA GeForce RTX 4060,c11,32,128,32,4,2,8,0.0,0.0,167.93599724769592,201.80992126464844,7.1929757276418185,3,-1,-1,llm8_g3,0,
2026-03-03T03:41:24.379955+00:00,BUCKET,llm_style,eval,llm_style_eval_135,8,3072,3072,bf16,NVIDIA GeForce RTX 4060,c00,32,32,32,2,2,8,0.0,0.0,126.8479973077774,138.70112165808678,1.190361276525586,7,-1,-1,llm8_g7,0,
2026-03-03T03:41:24.426340+00:00,BUCKET,llm_style,eval,llm_style_eval_136,4,2048,4096,bf16,NVIDIA GeForce RTX 4060,c00,32,32,32,2,2,8,0.0,0.0,146.92800492048264,299.7555059194564,0.4567465816766469,7,-1,-1,llm8_g7,0,
2026-03-03T03:41:24.766088+00:00,BUCKET,llm_style,eval,llm_style_eval_137,4,8192,8192,bf16,NVIDIA GeForce RTX 4060,c02,32,64,32,2,2,8,0.0,0.0,905.2159786224365,1039.0425431728363,0.5930859868569859,4,-1,-1,llm8_g4,0,
2026-03-03T03:41:24.777090+00:00,BUCKET,llm_style,eval,llm_style_eval_138,16,1024,1024,bf16,NVIDIA GeForce RTX 4060,c11,32,128,32,4,2,8,0.0,0.0,76.80000364780426,170.17184093594545,0.43690664591471445,3,-1,-1,llm8_g3,0,
2026-03-03T03:41:24.785930+00:00,BUCKET,llm_style,eval,llm_style_eval_139,4,1024,1024,bf16,NVIDIA GeForce RTX 4060,c00,32,32,32,2,2,8,0.0,0.0,56.32000043988228,119.07711848616583,0.14894545338212953,7,-1,-1,llm8_g7,0,
2026-03-03T03:41:24.937856+00:00,BUCKET,llm_style,eval,llm_style_eval_140,64,4096,6144,bf16,NVIDIA GeForce RTX 4060,c03,64,64,32,4,2,8,0.0,0.0,575.4879713058472,693.7049525976181,5.5973810620066935,0,-1,-1,llm8_g0,0,
2026-03-03T03:41:25.071390+00:00,BUCKET,llm_style,eval,llm_style_eval_141,4,6144,4096,bf16,NVIDIA GeForce RTX 4060,c11,32,128,32,4,2,8,0.0,0.0,363.9200031757355,481.80287420749664,0.5532166142095251,5,-1,-1,llm8_g5,0,
2026-03-03T03:41:25.152666+00:00,BUCKET,llm_style,eval,llm_style_eval_142,4,2048,6144,bf16,NVIDIA GeForce RTX 4060,c04,64,64,64,4,3,8,0.0,0.0,366.08000099658966,482.25536584854126,0.27497622302764846,6,-1,-1,llm8_g6,0,
2026-03-03T03:41:25.228531+00:00,BUCKET,llm_style,eval,llm_style_eval_143,64,1536,8192,bf16,NVIDIA GeForce RTX 4060,c04,64,64,64,4,3,8,0.0,0.0,280.5759906768799,320.55297166109085,5.740379752788015,2,-1,-1,llm8_g2,0,
2026-03-03T03:41:25.279784+00:00,BUCKET,llm_style,eval,llm_style_eval_144,1,3072,3072,bf16,NVIDIA GeForce RTX 4060,c00,32,32,32,2,2,8,0.0,0.0,147.88800477981567,275.8963274955747,0.12762609129862335,7,-1,-1,llm8_g7,0,
2026-03-03T03:41:25.296881+00:00,BUCKET,llm_style,eval,llm_style_eval_145,32,1024,2048,bf16,NVIDIA GeForce RTX 4060,c11,32,128,32,4,2,8,0.0,0.0,125.7920041680336,132.09599256515503,1.0669813943079505,3,-1,-1,llm8_g3,0,
2026-03-03T03:41:25.500076+00:00,BUCKET,llm_style,eval,llm_style_eval_146,64,8192,4096,bf16,NVIDIA GeForce RTX 4060,c00,32,32,32,2,2,8,0.0,0.0,866.7999804019928,1061.9149005413055,4.954969304461842,1,-1,-1,llm8_g1,0,
2026-03-03T03:41:25.555037+00:00,BUCKET,llm_style,eval,llm_style_eval_147,64,2048,4096,bf16,NVIDIA GeForce RTX 4060,c11,32,128,32,4,2,8,0.0,0.0,244.06399577856064,271.16416543722147,4.399427373852415,3,-1,-1,llm8_g3,0,
2026-03-03T03:41:25.592981+00:00,BUCKET,llm_style,eval,llm_style_eval_148,64,1024,6144,bf16,NVIDIA GeForce RTX 4060,c04,64,64,64,4,3,8,0.0,0.0,225.2800017595291,327.0703950524329,3.5746908811711084,2,-1,-1,llm8_g2,0,
2026-03-03T03:41:25.800544+00:00,BUCKET,llm_style,eval,llm_style_eval_149,64,4096,8192,bf16,NVIDIA GeForce RTX 4060,c03,64,64,32,4,2,8,0.0,0.0,924.127995967865,1053.6960363388062,4.647589202729175,0,-1,-1,llm8_g0,0,
2026-03-03T03:41:25.831203+00:00,BUCKET,llm_style,eval,llm_style_eval_150,2,2048,3072,bf16,NVIDIA GeForce RTX 4060,c00,32,32,32,2,2,8,0.0,0.0,135.16800105571747,210.54464057087898,0.1861818167276619,7,-1,-1,llm8_g7,0,
2026-03-03T03:41:25.881183+00:00,BUCKET,llm_style,eval,llm_style_eval_151,64,4096,2048,bf16,NVIDIA GeForce RTX 4060,c00,32,32,32,2,2,8,0.0,0.0,272.38398790359497,370.0326386094093,3.9420152126564427,1,-1,-1,llm8_g1,0,
2026-03-03T03:41:26.229150+00:00,BUCKET,llm_style,eval,llm_style_eval_152,8,8192,8192,bf16,NVIDIA GeForce RTX 4060,c02,32,64,32,2,2,8,0.0,0.0,923.9680171012878,1041.9276559352875,1.1620984754089096,4,-1,-1,llm8_g4,0,
2026-03-03T03:41:26.341038+00:00,BUCKET,llm_style,eval,llm_style_eval_153,64,8192,2048,bf16,NVIDIA GeForce RTX 4060,c00,32,32,32,2,2,8,0.0,0.0,527.8080105781555,555.0899440050125,4.06868331848103,1,-1,-1,llm8_g1,0,
2026-03-03T03:41:26.459950+00:00,BUCKET,llm_style,eval,llm_style_eval_154,16,2048,8192,bf16,NVIDIA GeForce RTX 4060,c04,64,64,64,4,3,8,0.0,0.0,550.2560138702393,602.1433722972869,0.9756747740454579,2,-1,-1,llm8_g2,0,
2026-03-03T03:41:26.482408+00:00,BUCKET,llm_style,eval,llm_style_eval_155,4,2048,1536,bf16,NVIDIA GeForce RTX 4060,c00,32,32,32,2,2,8,0.0,0.0,100.3040000796318,251.71967506408654,0.2508955174272286,7,-1,-1,llm8_g7,0,
2026-03-03T03:41:26.619808+00:00,BUCKET,llm_style,eval,llm_style_eval_156,1,4096,6144,bf16,NVIDIA GeForce RTX 4060,c02,32,64,32,2,2,8,0.0,0.0,410.6239974498749,444.42048817873,0.1225735668460147,4,-1,-1,llm8_g4,0,
2026-03-03T03:41:26.694396+00:00,BUCKET,llm_style,eval,llm_style_eval_157,1,1536,8192,bf16,NVIDIA GeForce RTX 4060,c04,64,64,64,4,3,8,0.0,0.0,322.56001234054565,411.3785675168036,0.07801904463418408,6,-1,-1,llm8_g6,0,
2026-03-03T03:41:26.778247+00:00,BUCKET,llm_style,eval,llm_style_eval_158,64,1536,8192,bf16,NVIDIA GeForce RTX 4060,c04,64,64,64,4,3,8,0.0,0.0,322.56001234054565,440.29599517583847,4.993218856587781,2,-1,-1,llm8_g2,0,
2026-03-03T03:41:26.837095+00:00,BUCKET,llm_style,eval,llm_style_eval_159,16,6144,1536,bf16,NVIDIA GeForce RTX 4060,c00,32,32,32,2,2,8,0.0,0.0,144.8799967765808,252.139834910631,2.0844139613400055,1,-1,-1,llm8_g1,0,
2026-03-03T03:41:27.060371+00:00,BUCKET,llm_style,eval,llm_style_eval_160,32,6144,6144,bf16,NVIDIA GeForce RTX 4060,c03,64,64,32,4,2,8,0.0,0.0,811.0079765319824,961.5504086017609,2.9789091771093417,0,-1,-1,llm8_g0,0,
2026-03-03T03:41:27.092634+00:00,BUCKET,llm_style,eval,llm_style_eval_161,2,1536,4096,bf16,NVIDIA GeForce RTX 4060,c00,32,32,32,2,2,8,0.0,0.0,164.73599523305893,175.56928277015686,0.15276457318509443,7,-1,-1,llm8_g7,0,
2026-03-03T03:41:27.124213+00:00,BUCKET,llm_style,eval,llm_style_eval_162,64,1536,3072,bf16,NVIDIA GeForce RTX 4060,c11,32,128,32,4,2,8,0.0,0.0,207.8399956226349,337.70496606826777,2.905984356815601,3,-1,-1,llm8_g3,0,
2026-03-03T03:41:27.177761+00:00,BUCKET,llm_style,eval,llm_style_eval_163,64,1024,8192,bf16,NVIDIA GeForce RTX 4060,c04,64,64,64,4,3,8,0.0,0.0,319.42400336265564,366.27935737371445,3.361493853612921,2,-1,-1,llm8_g2,0,
2026-03-03T03:41:27.376957+00:00,BUCKET,llm_style,eval,llm_style_eval_164,64,4096,8192,bf16,NVIDIA GeForce RTX 4060,c03,64,64,32,4,2,8,0.0,0.0,873.4720051288605,1017.9833984375,4.917120721420692,0,-1,-1,llm8_g0,0,
2026-03-03T03:41:27.509445+00:00,BUCKET,llm_style,eval,llm_style_eval_165,4,8192,3072,bf16,NVIDIA GeForce RTX 4060,c11,32,128,32,4,2,8,0.0,0.0,372.6720064878464,558.8889437913892,0.5402246170764256,5,-1,-1,llm8_g5,0,
2026-03-03T03:41:27.556666+00:00,BUCKET,llm_style,eval,llm_style_eval_166,64,1024,6144,bf16,NVIDIA GeForce RTX 4060,c04,64,64,64,4,3,8,0.0,0.0,228.12799364328384,260.5897659063339,3.530063781910215,2,-1,-1,llm8_g2,0,
2026-03-03T03:41:27.571213+00:00,BUCKET,llm_style,eval,llm_style_eval_167,2,2048,1024,bf16,NVIDIA GeForce RTX 4060,c00,32,32,32,2,2,8,0.0,0.0,71.02400064468384,279.9820773303506,0.11810948304596651,7,-1,-1,llm8_g7,0,
2026-03-03T03:41:27.596493+00:00,BUCKET,llm_style,eval,llm_style_eval_168,64,4096,1024,bf16,NVIDIA GeForce RTX 4060,c00,32,32,32,2,2,8,0.0,0.0,159.743994474411,254.95166897773743,3.360820629072225,1,-1,-1,llm8_g1,0,
2026-03-03T03:41:27.644986+00:00,BUCKET,llm_style,eval,llm_style_eval_169,4,1536,6144,bf16,NVIDIA GeForce RTX 4060,c04,64,64,64,4,3,8,0.0,0.0,250.2399981021881,275.28191238641733,0.3017002580425605,6,-1,-1,llm8_g6,0,
2026-03-03T03:41:27.665809+00:00,BUCKET,llm_style,eval,llm_style_eval_170,16,1536,1536,bf16,NVIDIA GeForce RTX 4060,c11,32,128,32,4,2,8,0.0,0.0,109.56799983978271,189.5628771185875,0.6890467299795304,3,-1,-1,llm8_g3,0,
2026-03-03T03:41:27.699387+00:00,BUCKET,llm_style,eval,llm_style_eval_171,1,2048,3072,bf16,NVIDIA GeForce RTX 4060,c00,32,32,32,2,2,8,0.0,0.0,142.06399768590927,198.25664371252057,0.08857213794461624,7,-1,-1,llm8_g7,0,
2026-03-03T03:41:27.735854+00:00,BUCKET,llm_style,eval,llm_style_eval_172,64,3072,2048,bf16,NVIDIA GeForce RTX 4060,c11,32,128,32,4,2,8,0.0,0.0,172.03199863433838,300.837443768978,4.681142894303718,3,-1,-1,llm8_g3,0,
2026-03-03T03:41:28.032541+00:00,BUCKET,llm_style,eval,llm_style_eval_173,64,8192,6144,bf16,NVIDIA GeForce RTX 4060,c03,64,64,32,4,2,8,0.0,0.0,1318.880021572113,1529.2825710773463,4.884789244377635,0,-1,-1,llm8_g0,0,
2026-03-03T03:41:28.130083+00:00,BUCKET,llm_style,eval,llm_style_eval_174,2,4096,4096,bf16,NVIDIA GeForce RTX 4060,c11,32,128,32,4,2,8,0.0,0.0,305.5039942264557,434.36032503843285,0.21966607726331513,5,-1,-1,llm8_g5,0,
2026-03-03T03:41:28.178972+00:00,BUCKET,llm_style,eval,llm_style_eval_175,64,4096,2048,bf16,NVIDIA GeForce RTX 4060,c00,32,32,32,2,2,8,0.0,0.0,279.9360007047653,318.45375210046757,3.835668943246862,1,-1,-1,llm8_g1,0,
2026-03-03T03:41:28.248163+00:00,BUCKET,llm_style,eval,llm_style_eval_176,16,6144,2048,bf16,NVIDIA GeForce RTX 4060,c00,32,32,32,2,2,8,0.0,0.0,184.12800133228302,295.4342392086983,2.1868112459080016,1,-1,-1,llm8_g1,0,
2026-03-03T03:41:28.299292+00:00,BUCKET,llm_style,eval,llm_style_eval_177,1,6144,1536,bf16,NVIDIA GeForce RTX 4060,c11,32,128,32,4,2,8,0.0,0.0,131.071999669075,241.59232348203653,0.14400000036356503,5,-1,-1,llm8_g5,0,
2026-03-03T03:41:28.587379+00:00,BUCKET,llm_style,eval,llm_style_eval_178,32,6144,8192,bf16,NVIDIA GeForce RTX 4060,c03,64,64,32,4,2,8,0.0,0.0,1097.216010093689,1229.9264061450958,2.935817051853761,0,-1,-1,llm8_g0,0,
2026-03-03T03:41:28.746366+00:00,BUCKET,llm_style,eval,llm_style_eval_179,64,4096,6144,bf16,NVIDIA GeForce RTX 4060,c03,64,64,32,4,2,8,0.0,0.0,728.0479967594147,796.4591968059538,4.424468560229363,0,-1,-1,llm8_g0,0,
2026-03-03T03:41:28.770168+00:00,BUCKET,llm_style,eval,llm_style_eval_180,64,2048,1536,bf16,NVIDIA GeForce RTX 4060,c11,32,128,32,4,2,8,0.0,0.0,128.51200252771378,193.19808200001714,3.133195157496416,3,-1,-1,llm8_g3,0,
2026-03-03T03:41:28.809420+00:00,BUCKET,llm_style,eval,llm_style_eval_181,64,2048,3072,bf16,NVIDIA GeForce RTX 4060,c11,32,128,32,4,2,8,0.0,0.0,224.2559939622879,279.33695405721653,3.591013795312087,3,-1,-1,llm8_g3,0,
2026-03-03T03:41:28.834329+00:00,BUCKET,llm_style,eval,llm_style_eval_182,32,3072,1536,bf16,NVIDIA GeForce RTX 4060,c11,32,128,32,4,2,8,0.0,0.0,129.0080025792122,237.96543776988975,2.3408616672021973,3,-1,-1,llm8_g3,0,
2026-03-03T03:41:28.930411+00:00,BUCKET,llm_style,eval,llm_style_eval_183,8,8192,2048,bf16,NVIDIA GeForce RTX 4060,c11,32,128,32,4,2,8,0.0,0.0,259.0720057487488,298.8835158944129,1.0361422694983573,5,-1,-1,llm8_g5,0,
2026-03-03T03:41:28.983449+00:00,BUCKET,llm_style,eval,llm_style_eval_184,64,8192,1024,bf16,NVIDIA GeForce RTX 4060,c00,32,32,32,2,2,8,0.0,0.0,288.1920039653778,436.1932897567748,3.725786313380835,1,-1,-1,llm8_g1,0,
2026-03-03T03:41:29.051676+00:00,BUCKET,llm_style,eval,llm_style_eval_185,1,8192,1536,bf16,NVIDIA GeForce RTX 4060,c11,32,128,32,4,2,8,0.0,0.0,207.87200331687927,220.20095989108086,0.12106403747712632,5,-1,-1,llm8_g5,0,
2026-03-03T03:41:29.089549+00:00,BUCKET,llm_style,eval,llm_style_eval_186,16,6144,1024,bf16,NVIDIA GeForce RTX 4060,c00,32,32,32,2,2,8,0.0,0.0,125.95200538635254,188.09856027364725,1.5984389560328083,1,-1,-1,llm8_g1,0,
2026-03-03T03:41:29.126456+00:00,BUCKET,llm_style,eval,llm_style_eval_187,1,1024,6144,bf16,NVIDIA GeForce RTX 4060,c04,64,64,64,4,3,8,0.0,0.0,264.0160024166107,340.1004830002785,0.04765965655424355,6,-1,-1,llm8_g6,0,
2026-03-03T03:41:29.309298+00:00,BUCKET,llm_style,eval,llm_style_eval_188,8,8192,4096,bf16,NVIDIA GeForce RTX 4060,c11,32,128,32,4,2,8,0.0,0.0,481.79200291633606,608.734735250473,1.1143209284302473,5,-1,-1,llm8_g5,0,
2026-03-03T03:41:29.419188+00:00,BUCKET,llm_style,eval,llm_style_eval_189,8,2048,8192,bf16,NVIDIA GeForce RTX 4060,c04,64,64,64,4,3,8,0.0,0.0,579.584002494812,724.5004791021346,0.4631519414692658,6,-1,-1,llm8_g6,0,
2026-03-03T03:41:29.507198+00:00,BUCKET,llm_style,eval,llm_style_eval_190,4,8192,2048,bf16,NVIDIA GeForce RTX 4060,c11,32,128,32,4,2,8,0.0,0.0,261.1199915409088,315.0521618127821,0.5140078597887536,5,-1,-1,llm8_g5,0,
2026-03-03T03:41:29.855321+00:00,BUCKET,llm_style,eval,llm_style_eval_191,4,8192,8192,bf16,NVIDIA GeForce RTX 4060,c02,32,64,32,2,2,8,0.0,0.0,927.7439713478088,1043.5379374027252,0.5786843445827453,4,-1,-1,llm8_g4,0,
2026-03-03T03:41:29.868855+00:00,BUCKET,llm_style,eval,llm_style_eval_192,64,1536,1024,bf16,NVIDIA GeForce RTX 4060,c11,32,128,32,4,2,8,0.0,0.0,89.05600011348724,112.86400035023684,2.2606740898248554,3,-1,-1,llm8_g3,0,
2026-03-03T03:41:29.895179+00:00,BUCKET,llm_style,eval,llm_style_eval_193,32,2048,2048,bf16,NVIDIA GeForce RTX 4060,c11,32,128,32,4,2,8,0.0,0.0,158.2079976797104,230.41663512587525,1.6967249439781382,3,-1,-1,llm8_g3,0,
2026-03-03T03:41:29.909363+00:00,BUCKET,llm_style,eval,llm_style_eval_194,8,1024,2048,bf16,NVIDIA GeForce RTX 4060,c00,32,32,32,2,2,8,0.0,0.0,104.87999767065048,127.24223822355265,0.31993166233059367,7,-1,-1,llm8_g7,0,
2026-03-03T03:41:29.948893+00:00,BUCKET,llm_style,eval,llm_style_eval_195,2,4096,2048,bf16,NVIDIA GeForce RTX 4060,c11,32,128,32,4,2,8,0.0,0.0,153.3600017428398,298.75680387020105,0.21879519834816782,5,-1,-1,llm8_g5,0,
2026-03-03T03:41:30.005120+00:00,BUCKET,llm_style,eval,llm_style_eval_196,32,2048,4096,bf16,NVIDIA GeForce RTX 4060,c11,32,128,32,4,2,8,0.0,0.0,286.72000765800476,395.6735998392104,1.8724570928456843,3,-1,-1,llm8_g3,0,
2026-03-03T03:41:30.075312+00:00,BUCKET,llm_style,eval,llm_style_eval_197,32,8192,1536,bf16,NVIDIA GeForce RTX 4060,c00,32,32,32,2,2,8,0.0,0.0,244.719997048378,255.92256397008896,3.2907256362903654,1,-1,-1,llm8_g1,0,
2026-03-03T03:41:30.288187+00:00,BUCKET,llm_style,eval,llm_style_eval_198,64,4096,8192,bf16,NVIDIA GeForce RTX 4060,c03,64,64,32,4,2,8,0.0,0.0,1086.4640474319458,1206.8556904792786,3.9531609961249354,0,-1,-1,llm8_g0,0,
2026-03-03T03:41:30.468566+00:00,BUCKET,llm_style,eval,llm_style_eval_199,2,8192,4096,bf16,NVIDIA GeForce RTX 4060,c11,32,128,32,4,2,8,0.0,0.0,531.3920080661774,562.298868894577,0.2525776187121073,5,-1,-1,llm8_g5,0,
2026-03-03T03:41:30.492172+00:00,BUCKET,llm_style,eval,llm_style_eval_200,1,4096,1024,bf16,NVIDIA GeForce RTX 4060,c11,32,128,32,4,2,8,0.0,0.0,116.14400148391724,230.46144351363182,0.07222592551335157,5,-1,-1,llm8_g5,0,
2026-03-03T03:41:30.570953+00:00,BUCKET,llm_style,eval,llm_style_eval_201,4,1536,8192,bf16,NVIDIA GeForce RTX 4060,c04,64,64,64,4,3,8,0.0,0.0,399.3600010871887,441.31328374147404,0.2520615377753444,6,-1,-1,llm8_g6,0,
2026-03-03T03:41:30.674351+00:00,BUCKET,llm_style,eval,llm_style_eval_202,1,6144,3072,bf16,NVIDIA GeForce RTX 4060,c11,32,128,32,4,2,8,0.0,0.0,285.69599986076355,331.3459202647208,0.13212903232245876,5,-1,-1,llm8_g5,0,
2026-03-03T03:41:30.770763+00:00,BUCKET,llm_style,eval,llm_style_eval_203,16,2048,6144,bf16,NVIDIA GeForce RTX 4060,c04,64,64,64,4,3,8,0.0,0.0,548.2079982757568,574.4928002357483,0.7344898018023067,2,-1,-1,llm8_g2,0,
2026-03-03T03:41:30.784612+00:00,BUCKET,llm_style,eval,llm_style_eval_204,16,1536,1024,bf16,NVIDIA GeForce RTX 4060,c11,32,128,32,4,2,8,0.0,0.0,103.42399775981903,173.15839901566505,0.48665347588752955,3,-1,-1,llm8_g3,0,
2026-03-03T03:41:30.876498+00:00,BUCKET,llm_style,eval,llm_style_eval_205,64,6144,2048,bf16,NVIDIA GeForce RTX 4060,c00,32,32,32,2,2,8,0.0,0.0,568.2239830493927,651.8681460618973,2.8344680690114377,1,-1,-1,llm8_g1,0,
2026-03-03T03:41:30.974075+00:00,BUCKET,llm_style,eval,llm_style_eval_206,4,2048,6144,bf16,NVIDIA GeForce RTX 4060,c04,64,64,64,4,3,8,0.0,0.0,543.7440276145935,650.7852834463118,0.18512993410081238,6,-1,-1,llm8_g6,0,
2026-03-03T03:41:31.032253+00:00,BUCKET,llm_style,eval,llm_style_eval_207,32,6144,1536,bf16,NVIDIA GeForce RTX 4060,c00,32,32,32,2,2,8,0.0,0.0,212.44800090789795,285.3971262276171,2.84295344469653,1,-1,-1,llm8_g1,0,
2026-03-03T03:41:31.050290+00:00,BUCKET,llm_style,eval,llm_style_eval_208,4,2048,1024,bf16,NVIDIA GeForce RTX 4060,c00,32,32,32,2,2,8,0.0,0.0,78.84799689054489,170.5187252163887,0.21277922917039696,7,-1,-1,llm8_g7,0,
2026-03-03T03:41:31.064566+00:00,BUCKET,llm_style,eval,llm_style_eval_209,1,1024,1536,bf16,NVIDIA GeForce RTX 4060,c00,32,32,32,2,2,8,0.0,0.0,94.2080020904541,194.5804788172245,0.033391303606880654,7,-1,-1,llm8_g7,0,
2026-03-03T03:41:31.201474+00:00,BUCKET,llm_style,eval,llm_style_eval_210,8,6144,4096,bf16,NVIDIA GeForce RTX 4060,c11,32,128,32,4,2,8,0.0,0.0,383.91999900341034,453.1097605824468,1.0487945015764162,5,-1,-1,llm8_g5,0,
2026-03-03T03:41:31.328402+00:00,BUCKET,llm_style,eval,llm_style_eval_211,4,2048,8192,bf16,NVIDIA GeForce RTX 4060,c04,64,64,64,4,3,8,0.0,0.0,773.4879851341248,888.9753633737564,0.17352270569106037,6,-1,-1,llm8_g6,0,
2026-03-03T03:41:31.344959+00:00,BUCKET,llm_style,eval,llm_style_eval_212,32,1024,1024,bf16,NVIDIA GeForce RTX 4060,c11,32,128,32,4,2,8,0.0,0.0,109.56799983978271,117.10144124925137,0.6124859822040271,3,-1,-1,llm8_g3,0,
2026-03-03T03:41:31.425005+00:00,BUCKET,llm_style,eval,llm_style_eval_213,16,3072,4096,bf16,NVIDIA GeForce RTX 4060,c11,32,128,32,4,2,8,0.0,0.0,347.53599762916565,397.1993714570998,1.1585941794428056,3,-1,-1,llm8_g3,0,
2026-03-03T03:41:31.491656+00:00,BUCKET,llm_style,eval,llm_style_eval_214,64,1024,8192,bf16,NVIDIA GeForce RTX 4060,c04,64,64,64,4,3,8,0.0,0.0,429.05598878860474,539.6684765815735,2.502568084486128,2,-1,-1,llm8_g2,0,
2026-03-03T03:41:31.528078+00:00,BUCKET,llm_style,eval,llm_style_eval_215,4,4096,1536,bf16,NVIDIA GeForce RTX 4060,c11,32,128,32,4,2,8,0.0,0.0,188.4159967303276,300.039035975933,0.2671304394182502,5,-1,-1,llm8_g5,0,
2026-03-03T03:41:31.566247+00:00,BUCKET,llm_style,eval,llm_style_eval_216,16,1536,3072,bf16,NVIDIA GeForce RTX 4060,c11,32,128,32,4,2,8,0.0,0.0,253.9519965648651,320.0307199358938,0.59458065320401,3,-1,-1,llm8_g3,0,
2026-03-03T03:41:31.632714+00:00,BUCKET,llm_style,eval,llm_style_eval_217,8,6144,2048,bf16,NVIDIA GeForce RTX 4060,c11,32,128,32,4,2,8,0.0,0.0,200.54400712251663,210.96448436379433,1.0039023099653397,5,-1,-1,llm8_g5,0,
2026-03-03T03:41:31.702888+00:00,BUCKET,llm_style,eval,llm_style_eval_218,8,3072,4096,bf16,NVIDIA GeForce RTX 4060,c00,32,32,32,2,2,8,0.0,0.0,237.56800591945648,377.3583933711052,0.8474482547462914,7,-1,-1,llm8_g7,0,
2026-03-03T03:41:31.876575+00:00,BUCKET,llm_style,eval,llm_style_eval_219,64,8192,3072,bf16,NVIDIA GeForce RTX 4060,c00,32,32,32,2,2,8,0.0,0.0,1059.711992740631,1172.9369354248047,3.0397178611419267,1,-1,-1,llm8_g1,0,
2026-03-03T03:41:31.920032+00:00,BUCKET,llm_style,eval,llm_style_eval_220,2,4096,2048,bf16,NVIDIA GeForce RTX 4060,c11,32,128,32,4,2,8,0.0,0.0,205.82400262355804,231.96672037243843,0.1630248735438762,5,-1,-1,llm8_g5,0,
2026-03-03T03:41:31.988622+00:00,BUCKET,llm_style,eval,llm_style_eval_221,4,1024,8192,bf16,NVIDIA GeForce RTX 4060,c04,64,64,64,4,3,8,0.0,0.0,427.95200645923615,481.04449003934855,0.1568139954646815,6,-1,-1,llm8_g6,0,
2026-03-03T03:41:32.082073+00:00,BUCKET,llm_style,eval,llm_style_eval_222,64,6144,2048,bf16,NVIDIA GeForce RTX 4060,c00,32,32,32,2,2,8,0.0,0.0,590.2720093727112,705.36641061306,2.7285941234306823,1,-1,-1,llm8_g1,0,
2026-03-03T03:41:32.108091+00:00,BUCKET,llm_style,eval,llm_style_eval_223,4,2048,2048,bf16,NVIDIA GeForce RTX 4060,c00,32,32,32,2,2,8,0.0,0.0,125.92000514268875,171.03743389248837,0.2664741949619294,7,-1,-1,llm8_g7,0,
2026-03-03T03:41:32.136804+00:00,BUCKET,llm_style,eval,llm_style_eval_224,16,3072,1536,bf16,NVIDIA GeForce RTX 4060,c11,32,128,32,4,2,8,0.0,0.0,145.4080045223236,159.11679700016975,1.038422502915365,3,-1,-1,llm8_g3,0,
2026-03-03T03:41:32.162486+00:00,BUCKET,llm_style,eval,llm_style_eval_225,1,2048,2048,bf16,NVIDIA GeForce RTX 4060,c00,32,32,32,2,2,8,0.0,0.0,148.30400049686432,312.9855978488922,0.056563598904247794,7,-1,-1,llm8_g7,0,
2026-03-03T03:41:32.174603+00:00,BUCKET,llm_style,eval,llm_style_eval_226,8,1536,1024,bf16,NVIDIA GeForce RTX 4060,c00,32,32,32,2,2,8,0.0,0.0,76.80000364780426,88.45567919313908,0.3276799844360359,7,-1,-1,llm8_g7,0,
2026-03-03T03:41:32.404290+00:00,BUCKET,llm_style,eval,llm_style_eval_227,64,6144,6144,bf16,NVIDIA GeForce RTX 4060,c03,64,64,32,4,2,8,0.0,0.0,1046.4320182800293,1177.5107491016388,4.6174410985071574,0,-1,-1,llm8_g0,0,
2026-03-03T03:41:32.501463+00:00,BUCKET,llm_style,eval,llm_style_eval_228,64,6144,2048,bf16,NVIDIA GeForce RTX 4060,c00,32,32,32,2,2,8,0.0,0.0,581.6320180892944,724.5510613918303,2.7691266744409737,1,-1,-1,llm8_g1,0,
2026-03-03T03:41:32.587436+00:00,BUCKET,llm_style,eval,llm_style_eval_229,16,1536,8192,bf16,NVIDIA GeForce RTX 4060,c04,64,64,64,4,3,8,0.0,0.0,430.5119961500168,509.5616155862807,0.9352891152879534,2,-1,-1,llm8_g2,0,
2026-03-03T03:41:32.613297+00:00,BUCKET,llm_style,eval,llm_style_eval_230,64,2048,1536,bf16,NVIDIA GeForce RTX 4060,c11,32,128,32,4,2,8,0.0,0.0,164.8159995675087,253.4175918996334,2.443046700906444,3,-1,-1,llm8_g3,0,
2026-03-03T03:41:32.676573+00:00,BUCKET,llm_style,eval,llm_style_eval_231,4,1024,8192,bf16,NVIDIA GeForce RTX 4060,c04,64,64,64,4,3,8,0.0,0.0,427.0080029964447,455.78239768743515,0.15716067035998563,6,-1,-1,llm8_g6,0,
2026-03-03T03:41:32.703355+00:00,BUCKET,llm_style,eval,llm_style_eval_232,16,3072,1536,bf16,NVIDIA GeForce RTX 4060,c11,32,128,32,4,2,8,0.0,0.0,144.3839967250824,255.0095997750759,1.0457872577630976,3,-1,-1,llm8_g3,0,
2026-03-03T03:41:32.766000+00:00,BUCKET,llm_style,eval,llm_style_eval_233,64,3072,3072,bf16,NVIDIA GeForce RTX 4060,c11,32,128,32,4,2,8,0.0,0.0,275.4560112953186,312.0435100793838,4.385308370362398,3,-1,-1,llm8_g3,0,
2026-03-03T03:41:32.957895+00:00,BUCKET,llm_style,eval,llm_style_eval_234,32,8192,4096,bf16,NVIDIA GeForce RTX 4060,c00,32,32,32,2,2,8,0.0,0.0,651.1520147323608,734.0339040756226,3.297975894127683,1,-1,-1,llm8_g1,0,
2026-03-03T03:41:32.973351+00:00,BUCKET,llm_style,eval,llm_style_eval_235,4,2048,1024,bf16,NVIDIA GeForce RTX 4060,c00,32,32,32,2,2,8,0.0,0.0,78.25599983334541,107.20256268978115,0.21438887798672165,7,-1,-1,llm8_g7,0,
2026-03-03T03:41:33.112887+00:00,BUCKET,llm_style,eval,llm_style_eval_236,4,8192,3072,bf16,NVIDIA GeForce RTX 4060,c11,32,128,32,4,2,8,0.0,0.0,450.30398666858673,579.6009576320648,0.44709040550460794,5,-1,-1,llm8_g5,0,
2026-03-03T03:41:33.148310+00:00,BUCKET,llm_style,eval,llm_style_eval_237,64,1024,4096,bf16,NVIDIA GeForce RTX 4060,c11,32,128,32,4,2,8,0.0,0.0,314.36800956726074,406.9206318259238,1.707778449655303,3,-1,-1,llm8_g3,0,
2026-03-03T03:41:33.238286+00:00,BUCKET,llm_style,eval,llm_style_eval_238,32,2048,6144,bf16,NVIDIA GeForce RTX 4060,c04,64,64,64,4,3,8,0.0,0.0,537.5999808311462,670.1235038042068,1.4979657676977058,2,-1,-1,llm8_g2,0,
2026-03-03T03:41:33.272676+00:00,BUCKET,llm_style,eval,llm_style_eval_239,32,2048,6144,bf16,NVIDIA GeForce RTX 4060,c04,64,64,64,4,3,8,0.0,0.0,547.2959876060486,593.0972599983215,1.4714275021867527,2,-1,-1,llm8_g2,0,
2026-03-03T03:41:33.345239+00:00,BUCKET,llm_style,eval,llm_style_eval_240,8,8192,1536,bf16,NVIDIA GeForce RTX 4060,c11,32,128,32,4,2,8,0.0,0.0,196.60800695419312,299.9670401215553,1.0239999637802455,5,-1,-1,llm8_g5,0,
2026-03-03T03:41:33.364365+00:00,BUCKET,llm_style,eval,llm_style_eval_241,16,1536,1536,bf16,NVIDIA GeForce RTX 4060,c11,32,128,32,4,2,8,0.0,0.0,112.64000087976456,213.73952150344843,0.6702545402195829,3,-1,-1,llm8_g3,0,
2026-03-03T03:41:33.398385+00:00,BUCKET,llm_style,eval,llm_style_eval_242,1,2048,3072,bf16,NVIDIA GeForce RTX 4060,c00,32,32,32,2,2,8,0.0,0.0,136.60799711942673,174.9507188796996,0.09210962948969707,7,-1,-1,llm8_g7,0,
2026-03-03T03:41:33.450000+00:00,BUCKET,llm_style,eval,llm_style_eval_243,8,1536,6144,bf16,NVIDIA GeForce RTX 4060,c04,64,64,64,4,3,8,0.0,0.0,243.71199309825897,341.06368005275715,0.6195630427556447,6,-1,-1,llm8_g6,0,
2026-03-03T03:41:33.497769+00:00,BUCKET,llm_style,eval,llm_style_eval_244,32,8192,1024,bf16,NVIDIA GeForce RTX 4060,c00,32,32,32,2,2,8,0.0,0.0,128.00000607967377,255.39230853319168,4.19430380078126,1,-1,-1,llm8_g1,0,
2026-03-03T03:41:33.629208+00:00,BUCKET,llm_style,eval,llm_style_eval_245,4,6144,4096,bf16,NVIDIA GeForce RTX 4060,c11,32,128,32,4,2,8,0.0,0.0,367.0080006122589,469.95295763015747,0.5485618614965835,5,-1,-1,llm8_g5,0,
2026-03-03T03:41:33.711828+00:00,BUCKET,llm_style,eval,llm_style_eval_246,32,2048,6144,bf16,NVIDIA GeForce RTX 4060,c04,64,64,64,4,3,8,0.0,0.0,411.51998937129974,536.7603224515915,1.9569070489876033,2,-1,-1,llm8_g2,0,
2026-03-03T03:41:33.808152+00:00,BUCKET,llm_style,eval,llm_style_eval_247,64,6144,2048,bf16,NVIDIA GeForce RTX 4060,c00,32,32,32,2,2,8,0.0,0.0,446.9760060310364,561.0092526674271,3.6033539032700674,1,-1,-1,llm8_g1,0,
2026-03-03T03:41:33.821974+00:00,BUCKET,llm_style,eval,llm_style_eval_248,64,1024,1024,bf16,NVIDIA GeForce RTX 4060,c11,32,128,32,4,2,8,0.0,0.0,90.03200009465218,115.66079795360557,1.4907780329093503,3,-1,-1,llm8_g3,0,
2026-03-03T03:41:33.868233+00:00,BUCKET,llm_style,eval,llm_style_eval_249,2,8192,1024,bf16,NVIDIA GeForce RTX 4060,c11,32,128,32,4,2,8,0.0,0.0,141.31200313568115,259.6863983571528,0.2374492700933735,5,-1,-1,llm8_g5,0,
2026-03-03T03:41:33.926249+00:00,BUCKET,llm_style,eval,llm_style_eval_250,64,3072,3072,bf16,NVIDIA GeForce RTX 4060,c11,32,128,32,4,2,8,0.0,0.0,210.35200357437134,282.19327449798584,5.742562616347593,3,-1,-1,llm8_g3,0,
2026-03-03T03:41:33.985581+00:00,BUCKET,llm_style,eval,llm_style_eval_251,64,1024,8192,bf16,NVIDIA GeForce RTX 4060,c04,64,64,64,4,3,8,0.0,0.0,314.30400907993317,434.23615723848343,3.4162523957081574,2,-1,-1,llm8_g2,0,
2026-03-03T03:41:34.062209+00:00,BUCKET,llm_style,eval,llm_style_eval_252,64,4096,3072,bf16,NVIDIA GeForce RTX 4060,c00,32,32,32,2,2,8,0.0,0.0,370.03201246261597,383.58015954494476,4.352630804240806,1,-1,-1,llm8_g1,0,
2026-03-03T03:41:34.198981+00:00,BUCKET,llm_style,eval,llm_style_eval_253,8,6144,4096,bf16,NVIDIA GeForce RTX 4060,c11,32,128,32,4,2,8,0.0,0.0,364.54400420188904,389.7817611694336,1.1045393131113073,5,-1,-1,llm8_g5,0,
2026-03-03T03:41:34.223998+00:00,BUCKET,llm_style,eval,llm_style_eval_254,4,1536,3072,bf16,NVIDIA GeForce RTX 4060,c00,32,32,32,2,2,8,0.0,0.0,133.03999602794647,219.97247487306583,0.28373975591573586,7,-1,-1,llm8_g7,0,
2026-03-03T03:41:34.245241+00:00,BUCKET,llm_style,eval,llm_style_eval_255,1,3072,1536,bf16,NVIDIA GeForce RTX 4060,c00,32,32,32,2,2,8,0.0,0.0,89.08800035715103,133.0783961713313,0.10593103405808438,7,-1,-1,llm8_g7,0,
