results/llm_hp2_m32_n3072_k6144.csv
timestamp,method,workload,split,shape_id,M,N,K,dtype,gpu,config_id,BLOCK_M,BLOCK_N,BLOCK_K,num_warps,num_stages,GROUP_M,compile_time_ms,tune_time_ms,runtime_cost_us,p99_us,runtime_perf_tflops,bucket_m,bucket_n,bucket_k,cache_key,invalid_config,notes
2026-03-03T03:39:08.983246+00:00,FULL,llm_style,tune,llm_style_tune_000,32,3072,2048,bf16,NVIDIA GeForce RTX 4060,c11,32,128,32,4,2,8,0.8309689583256841,484.335,55.7279996573925,111.7593605816364,7.225329932447822,7,-1,-1,32x3072x2048,0,
2026-03-03T03:39:09.099442+00:00,FULL,llm_style,tune,llm_style_tune_001,4,4096,1536,bf16,NVIDIA GeForce RTX 4060,c11,32,128,32,4,2,8,0.0,116.163,50.175998359918594,109.83903992921094,1.0031020736042942,5,-1,-1,4x4096x1536,0,
2026-03-03T03:39:09.204370+00:00,FULL,llm_style,tune,llm_style_tune_002,8,8192,1024,bf16,NVIDIA GeForce RTX 4060,c11,32,128,32,4,2,8,0.0,104.893,53.247999399900436,60.905601754784584,2.520615413022465,5,-1,-1,8x8192x1024,0,
2026-03-03T03:39:09.302789+00:00,FULL,llm_style,tune,llm_style_tune_003,64,1024,4096,bf16,NVIDIA GeForce RTX 4060,c04,64,64,64,4,3,8,0.0,98.375,61.43999844789505,70.696961581707,8.738133554077153,3,-1,-1,64x1024x4096,0,
2026-03-03T03:39:09.451031+00:00,FULL,llm_style,tune,llm_style_tune_004,16,3072,4096,bf16,NVIDIA GeForce RTX 4060,c00,32,32,32,2,2,8,0.0,148.202,68.09599883854389,174.16159614920616,5.913022657244424,7,-1,-1,16x3072x4096,0,
2026-03-03T03:39:09.547090+00:00,FULL,llm_style,tune,llm_style_tune_005,16,1536,4096,bf16,NVIDIA GeForce RTX 4060,c04,64,64,64,4,3,8,0.0,96.018,58.36800113320351,64.76799748837946,3.4492630909279565,7,-1,-1,16x1536x4096,0,
2026-03-03T03:39:09.600383+00:00,FULL,llm_style,tune,llm_style_tune_006,2,2048,1024,bf16,NVIDIA GeForce RTX 4060,c00,32,32,32,2,2,8,0.0,53.25,34.81600061058998,88.08287896215913,0.2409411722450521,7,-1,-1,2x2048x1024,0,
2026-03-03T03:39:09.682933+00:00,FULL,llm_style,tune,llm_style_tune_007,32,6144,1024,bf16,NVIDIA GeForce RTX 4060,c11,32,128,32,4,2,8,0.0,82.506,42.78400167822838,53.790719583630555,9.411302547814252,5,-1,-1,32x6144x1024,0,
2026-03-03T03:39:09.747312+00:00,FULL,llm_style,tune,llm_style_tune_008,8,1536,2048,bf16,NVIDIA GeForce RTX 4060,c04,64,64,64,4,3,8,0.0,64.335,44.015999883413315,64.81887821108099,1.1434852811094867,7,-1,-1,8x1536x2048,0,
2026-03-03T03:39:09.871351+00:00,FULL,llm_style,tune,llm_style_tune_009,16,1024,6144,bf16,NVIDIA GeForce RTX 4060,c04,64,64,64,4,3,8,0.0,123.993,71.68000191450119,75.77600330114365,2.808685639268526,7,-1,-1,16x1024x6144,0,
2026-03-03T03:39:09.947507+00:00,FULL,llm_style,tune,llm_style_tune_010,64,1536,2048,bf16,NVIDIA GeForce RTX 4060,c04,64,64,64,4,3,8,0.0,76.111,43.71200129389763,62.12608050554987,9.211501923528083,3,-1,-1,64x1536x2048,0,
2026-03-03T03:39:10.045044+00:00,FULL,llm_style,tune,llm_style_tune_011,64,1536,4096,bf16,NVIDIA GeForce RTX 4060,c04,64,64,64,4,3,8,0.0,97.493,57.24800005555153,60.416001826524734,14.066978186461673,3,-1,-1,64x1536x4096,0,
2026-03-03T03:39:10.118239+00:00,FULL,llm_style,tune,llm_style_tune_012,32,1024,2048,bf16,NVIDIA GeForce RTX 4060,c04,64,64,64,4,3,8,0.0,73.151,49.15200173854828,75.8153580129146,2.730666570080655,7,-1,-1,32x1024x2048,0,
2026-03-03T03:39:10.178445+00:00,FULL,llm_style,tune,llm_style_tune_013,64,1536,1024,bf16,NVIDIA GeForce RTX 4060,c04,64,64,64,4,3,8,0.0,60.162,42.65600070357323,47.61536099016666,4.7197718651372575,3,-1,-1,64x1536x1024,0,
2026-03-03T03:39:10.408349+00:00,FULL,llm_style,tune,llm_style_tune_014,4,6144,3072,bf16,NVIDIA GeForce RTX 4060,c06,64,128,32,4,3,8,0.0,229.859,176.88000202178955,197.17120334506035,0.85365752077162,5,-1,-1,4x6144x3072,0,
2026-03-03T03:39:10.497780+00:00,FULL,llm_style,tune,llm_style_tune_015,1,6144,1024,bf16,NVIDIA GeForce RTX 4060,c11,32,128,32,4,2,8,0.0,89.39,39.744000881910324,54.57088045775886,0.3165990267911647,5,-1,-1,1x6144x1024,0,
2026-03-03T03:39:10.918537+00:00,FULL,llm_style,tune,llm_style_tune_016,4,8192,4096,bf16,NVIDIA GeForce RTX 4060,c04,64,64,64,4,3,8,0.0,420.72,299.44001138210297,365.04992753267277,0.8964582079762903,5,-1,-1,4x8192x4096,0,
2026-03-03T03:39:10.938357+00:00,FULL,llm_style,tune,llm_style_tune_017,64,1536,2048,bf16,NVIDIA GeForce RTX 4060,c04,64,64,64,4,3,8,0.0,0.0,49.15200173854828,241.67455866932838,8.191999710241964,3,-1,-1,64x1536x2048,0,
2026-03-03T03:39:11.107204+00:00,FULL,llm_style,tune,llm_style_tune_018,64,8192,1536,bf16,NVIDIA GeForce RTX 4060,c06,64,128,32,4,3,8,0.0,168.792,110.23999750614166,119.07392121851444,14.610057805110799,1,-1,-1,64x8192x1536,0,
2026-03-03T03:39:11.168800+00:00,FULL,llm_style,tune,llm_style_tune_019,2,1536,1024,bf16,NVIDIA GeForce RTX 4060,c00,32,32,32,2,2,8,0.0,61.547,37.90399990975857,153.36767524480814,0.16598395987174522,7,-1,-1,2x1536x1024,0,
2026-03-03T03:39:11.230194+00:00,FULL,llm_style,tune,llm_style_tune_020,16,1024,1536,bf16,NVIDIA GeForce RTX 4060,c04,64,64,64,4,3,8,0.0,61.351,41.311999782919884,47.42240149527788,1.218329983164098,7,-1,-1,16x1024x1536,0,
2026-03-03T03:39:11.336203+00:00,FULL,llm_style,tune,llm_style_tune_021,1,6144,1536,bf16,NVIDIA GeForce RTX 4060,c02,32,64,32,2,2,8,0.0,105.962,46.08000069856644,55.77119991183281,0.4095999937905207,5,-1,-1,1x6144x1536,0,
2026-03-03T03:39:11.560937+00:00,FULL,llm_style,tune,llm_style_tune_022,8,4096,4096,bf16,NVIDIA GeForce RTX 4060,c00,32,32,32,2,2,8,0.0,224.687,143.26400309801102,327.5484807789322,1.873711820102888,5,-1,-1,8x4096x4096,0,
2026-03-03T03:39:11.976684+00:00,FULL,llm_style,tune,llm_style_tune_023,2,4096,8192,bf16,NVIDIA GeForce RTX 4060,c11,32,128,32,4,2,8,0.0,415.705,292.86399483680725,342.25376009941095,0.4582937143734251,4,-1,-1,2x4096x8192,0,
2026-03-03T03:39:11.998945+00:00,FULL,llm_style,tune,llm_style_tune_024,64,1536,2048,bf16,NVIDIA GeForce RTX 4060,c04,64,64,64,4,3,8,0.0,0.0,60.35200133919716,206.60031825304026,6.671745345062593,3,-1,-1,64x1536x2048,0,
2026-03-03T03:39:12.026883+00:00,FULL,llm_style,tune,llm_style_tune_025,4,4096,1536,bf16,NVIDIA GeForce RTX 4060,c11,32,128,32,4,2,8,0.0,0.0,49.12000149488449,109.91711869835854,1.024667069793182,5,-1,-1,4x4096x1536,0,
2026-03-03T03:39:12.107119+00:00,FULL,llm_style,tune,llm_style_tune_026,4,3072,2048,bf16,NVIDIA GeForce RTX 4060,c11,32,128,32,4,2,8,0.0,80.179,51.19999870657921,71.80159952491518,0.9830400248336798,7,-1,-1,4x3072x2048,0,
2026-03-03T03:39:12.178052+00:00,FULL,llm_style,tune,llm_style_tune_027,8,4096,1024,bf16,NVIDIA GeForce RTX 4060,c00,32,32,32,2,2,8,0.0,70.893,25.088000111281872,303.90016257762863,2.6749387636450814,5,-1,-1,8x4096x1024,0,
2026-03-03T03:39:12.241417+00:00,FULL,llm_style,tune,llm_style_tune_028,16,1536,1024,bf16,NVIDIA GeForce RTX 4060,c04,64,64,64,4,3,8,0.0,63.32,40.031999349594116,92.15232171118251,1.2572853921299414,7,-1,-1,16x1536x1024,0,
2026-03-03T03:39:12.646632+00:00,FULL,llm_style,tune,llm_style_tune_029,64,4096,8192,bf16,NVIDIA GeForce RTX 4060,c03,64,64,32,4,2,8,0.0,405.166,300.9280115365982,426.022410094738,14.272407789720349,0,-1,-1,64x4096x8192,0,
2026-03-03T03:39:12.795346+00:00,FULL,llm_style,tune,llm_style_tune_030,1,8192,1536,bf16,NVIDIA GeForce RTX 4060,c11,32,128,32,4,2,8,0.0,148.674,60.416001826524734,67.60448053479195,0.4165423602882527,5,-1,-1,1x8192x1536,0,
2026-03-03T03:39:13.365752+00:00,FULL,llm_style,tune,llm_style_tune_031,1,8192,6144,bf16,NVIDIA GeForce RTX 4060,c10,64,128,64,8,3,8,0.0,570.362,423.93600940704346,454.95519340038294,0.2374492700933735,5,-1,-1,1x8192x6144,0,
2026-03-03T03:39:13.678112+00:00,FULL,llm_style,tune,llm_style_tune_032,32,3072,8192,bf16,NVIDIA GeForce RTX 4060,c10,64,128,64,8,3,8,0.0,312.316,228.38399559259415,284.2652860283851,7.0522136711939885,6,-1,-1,32x3072x8192,0,
2026-03-03T03:39:13.806170+00:00,FULL,llm_style,tune,llm_style_tune_033,4,1536,6144,bf16,NVIDIA GeForce RTX 4060,c04,64,64,64,4,3,8,0.0,128.018,69.74400207400322,134.23135742545128,1.0824941178438823,7,-1,-1,4x1536x6144,0,
2026-03-03T03:39:13.902446+00:00,FULL,llm_style,tune,llm_style_tune_034,1,4096,1536,bf16,NVIDIA GeForce RTX 4060,c11,32,128,32,4,2,8,0.0,96.229,45.88799923658371,50.651200003921986,0.2742092095828054,5,-1,-1,1x4096x1536,0,
2026-03-03T03:39:13.997281+00:00,FULL,llm_style,tune,llm_style_tune_035,4,1536,4096,bf16,NVIDIA GeForce RTX 4060,c04,64,64,64,4,3,8,0.0,94.791,57.34400078654289,63.00671897828578,0.877714273675364,7,-1,-1,4x1536x4096,0,
2026-03-03T03:39:14.303044+00:00,FULL,llm_style,tune,llm_style_tune_036,32,8192,3072,bf16,NVIDIA GeForce RTX 4060,c11,32,128,32,4,2,8,0.0,305.722,230.3999960422516,256.2348769605159,6.990506786747687,5,-1,-1,32x8192x3072,0,
2026-03-03T03:39:14.340364+00:00,FULL,llm_style,tune,llm_style_tune_037,32,3072,2048,bf16,NVIDIA GeForce RTX 4060,c11,32,128,32,4,2,8,0.0,0.0,37.328001111745834,172.040641605854,10.786893806464738,7,-1,-1,32x3072x2048,0,
2026-03-03T03:39:14.450866+00:00,FULL,llm_style,tune,llm_style_tune_038,2,2048,4096,bf16,NVIDIA GeForce RTX 4060,c00,32,32,32,2,2,8,0.0,110.45,49.056001007556915,133.23072001338002,0.6840025952142134,7,-1,-1,2x2048x4096,0,
2026-03-03T03:39:14.539934+00:00,FULL,llm_style,tune,llm_style_tune_039,64,2048,1536,bf16,NVIDIA GeForce RTX 4060,c11,32,128,32,4,2,8,0.0,89.024,47.10400104522705,187.97631904482836,8.548173723361447,3,-1,-1,64x2048x1536,0,
2026-03-03T03:39:14.663256+00:00,FULL,llm_style,tune,llm_style_tune_040,64,1024,6144,bf16,NVIDIA GeForce RTX 4060,c04,64,64,64,4,3,8,0.0,123.271,70.65600156784058,79.7513598203659,11.397564964481928,3,-1,-1,64x1024x6144,0,
2026-03-03T03:39:15.214476+00:00,FULL,llm_style,tune,llm_style_tune_041,4,8192,6144,bf16,NVIDIA GeForce RTX 4060,c11,32,128,32,4,2,8,0.0,551.174,425.9839951992035,534.0972852706909,0.9452307798834243,5,-1,-1,4x8192x6144,0,
2026-03-03T03:39:15.331904+00:00,FULL,llm_style,tune,llm_style_tune_042,1,1024,6144,bf16,NVIDIA GeForce RTX 4060,c04,64,64,64,4,3,8,0.0,117.383,71.68000191450119,76.16511881351471,0.1755428524542829,7,-1,-1,1x1024x6144,0,
2026-03-03T03:39:15.569487+00:00,FULL,llm_style,tune,llm_style_tune_043,64,2048,8192,bf16,NVIDIA GeForce RTX 4060,c10,64,128,64,8,3,8,0.0,237.539,166.57599806785583,230.91200366616238,12.891915239344435,2,-1,-1,64x2048x8192,0,
2026-03-03T03:39:15.637064+00:00,FULL,llm_style,tune,llm_style_tune_044,16,2048,1024,bf16,NVIDIA GeForce RTX 4060,c01,64,32,32,2,2,8,0.0,67.538,40.95999896526337,48.65024156868458,1.6384000413894664,7,-1,-1,16x2048x1024,0,
2026-03-03T03:39:15.692684+00:00,FULL,llm_style,tune,llm_style_tune_045,4,1024,1536,bf16,NVIDIA GeForce RTX 4060,c04,64,64,64,4,3,8,0.0,55.581,38.91199827194214,57.81183972954747,0.3233684354132238,7,-1,-1,4x1024x1536,0,
2026-03-03T03:39:15.717256+00:00,FULL,llm_style,tune,llm_style_tune_046,64,1536,4096,bf16,NVIDIA GeForce RTX 4060,c04,64,64,64,4,3,8,0.0,0.0,54.27199974656105,137.45984315872192,14.838339691933468,3,-1,-1,64x1536x4096,0,
2026-03-03T03:39:15.779209+00:00,FULL,llm_style,tune,llm_style_tune_047,16,2048,1536,bf16,NVIDIA GeForce RTX 4060,c00,32,32,32,2,2,8,0.0,61.901,33.59999880194664,46.60224087536335,2.9959315353954117,7,-1,-1,16x2048x1536,0,
2026-03-03T03:39:16.229417+00:00,FULL,llm_style,tune,llm_style_tune_048,64,6144,6144,bf16,NVIDIA GeForce RTX 4060,c11,32,128,32,4,2,8,0.0,450.165,332.2239965200424,397.8198441863059,14.543916931384288,1,-1,-1,64x6144x6144,0,
2026-03-03T03:39:16.622074+00:00,FULL,llm_style,tune,llm_style_tune_049,4,4096,8192,bf16,NVIDIA GeForce RTX 4060,c11,32,128,32,4,2,8,0.0,392.614,293.8079982995987,357.68320918083185,0.9136424384412909,4,-1,-1,4x4096x8192,0,
2026-03-03T03:39:16.775855+00:00,FULL,llm_style,tune,llm_style_tune_050,1,4096,3072,bf16,NVIDIA GeForce RTX 4060,c00,32,32,32,2,2,8,0.0,153.728,68.60800087451935,128.66559870541093,0.3668059654737216,5,-1,-1,1x4096x3072,0,
2026-03-03T03:39:16.886281+00:00,FULL,llm_style,tune,llm_style_tune_051,2,4096,2048,bf16,NVIDIA GeForce RTX 4060,c11,32,128,32,4,2,8,0.0,110.384,52.032001316547394,59.009600020945065,0.6448806724896993,5,-1,-1,2x4096x2048,0,
2026-03-03T03:39:17.029230+00:00,FULL,llm_style,tune,llm_style_tune_052,4,8192,1536,bf16,NVIDIA GeForce RTX 4060,c11,32,128,32,4,2,8,0.0,142.906,61.43999844789505,70.3849595040083,1.6384000413894666,5,-1,-1,4x8192x1536,0,
2026-03-03T03:39:17.130033+00:00,FULL,llm_style,tune,llm_style_tune_053,1,1536,4096,bf16,NVIDIA GeForce RTX 4060,c04,64,64,64,4,3,8,0.0,100.76,58.20799991488457,66.50207959115505,0.2161715231308331,7,-1,-1,1x1536x4096,0,
2026-03-03T03:39:17.697094+00:00,FULL,llm_style,tune,llm_style_tune_054,8,8192,6144,bf16,NVIDIA GeForce RTX 4060,c11,32,128,32,4,2,8,0.0,567.017,427.5200068950653,480.2480125427245,1.8836694306979234,5,-1,-1,8x8192x6144,0,
2026-03-03T03:39:17.807982+00:00,FULL,llm_style,tune,llm_style_tune_055,64,6144,1536,bf16,NVIDIA GeForce RTX 4060,c06,64,128,32,4,3,8,0.0,110.842,64.51199948787689,67.47423969209194,18.72457157721487,1,-1,-1,64x6144x1536,0,
2026-03-03T03:39:17.893252+00:00,FULL,llm_style,tune,llm_style_tune_056,1,3072,1536,bf16,NVIDIA GeForce RTX 4060,c11,32,128,32,4,2,8,0.0,85.223,45.024000108242035,72.4569606035947,0.20960341100995245,7,-1,-1,1x3072x1536,0,
2026-03-03T03:39:17.950409+00:00,FULL,llm_style,tune,llm_style_tune_057,64,1024,1024,bf16,NVIDIA GeForce RTX 4060,c04,64,64,64,4,3,8,0.0,57.113,39.0079990029335,68.66464100778103,3.4407744931983437,3,-1,-1,64x1024x1024,0,
2026-03-03T03:39:18.358627+00:00,FULL,llm_style,tune,llm_style_tune_058,16,8192,4096,bf16,NVIDIA GeForce RTX 4060,c11,32,128,32,4,2,8,0.0,408.162,294.2879945039749,327.91008263826365,3.6486089954495142,5,-1,-1,16x8192x4096,0,
2026-03-03T03:39:18.673442+00:00,FULL,llm_style,tune,llm_style_tune_059,16,4096,6144,bf16,NVIDIA GeForce RTX 4060,c11,32,128,32,4,2,8,0.0,314.77,227.07199305295944,296.1715194582938,3.546480379075989,5,-1,-1,16x4096x6144,0,
2026-03-03T03:39:18.964687+00:00,FULL,llm_style,tune,llm_style_tune_060,2,3072,8192,bf16,NVIDIA GeForce RTX 4060,c07,128,128,32,8,3,8,0.0,291.199,226.6719937324524,305.3875300288199,0.44409233951864313,6,-1,-1,2x3072x8192,0,
2026-03-03T03:39:19.131772+00:00,FULL,llm_style,tune,llm_style_tune_061,64,4096,8192,bf16,NVIDIA GeForce RTX 4060,c03,64,64,32,4,2,8,0.0,0.0,297.9840040206909,315.99615156650543,14.41341561308027,0,-1,-1,64x4096x8192,0,
2026-03-03T03:39:19.278621+00:00,FULL,llm_style,tune,llm_style_tune_062,32,4096,3072,bf16,NVIDIA GeForce RTX 4060,c00,32,32,32,2,2,8,0.0,146.798,76.80000364780426,83.3567974716425,10.485759501953149,5,-1,-1,32x4096x3072,0,
2026-03-03T03:39:19.402243+00:00,FULL,llm_style,tune,llm_style_tune_063,2,3072,8192,bf16,NVIDIA GeForce RTX 4060,c07,128,128,32,8,3,8,0.0,0.0,230.3999960422516,322.7635169029235,0.43690667417173046,6,-1,-1,2x3072x8192,0,
2026-03-03T03:39:19.454498+00:00,FULL,llm_style,eval,llm_style_eval_000,32,1536,1024,bf16,NVIDIA GeForce RTX 4060,c04,64,64,64,4,3,8,0.0,52.206,34.81600061058998,52.367360927164526,2.8912940669406253,7,-1,-1,32x1536x1024,0,
2026-03-03T03:39:19.682526+00:00,FULL,llm_style,eval,llm_style_eval_001,32,2048,8192,bf16,NVIDIA GeForce RTX 4060,c10,64,128,64,8,3,8,0.0,227.989,163.55200111865997,173.82720485329628,6.565140240754258,6,-1,-1,32x2048x8192,0,
2026-03-03T03:39:19.810541+00:00,FULL,llm_style,eval,llm_style_eval_002,16,2048,4096,bf16,NVIDIA GeForce RTX 4060,c00,32,32,32,2,2,8,0.0,127.972,57.34400078654289,143.52032408118237,4.681142792935274,7,-1,-1,16x2048x4096,0,
2026-03-03T03:39:19.823978+00:00,FULL,llm_style,eval,llm_style_eval_003,16,2048,1536,bf16,NVIDIA GeForce RTX 4060,c00,32,32,32,2,2,8,0.0,0.0,39.93599861860275,52.787199243903146,2.5206154718041685,7,-1,-1,16x2048x1536,0,
2026-03-03T03:39:20.047582+00:00,FULL,llm_style,eval,llm_style_eval_004,64,8192,2048,bf16,NVIDIA GeForce RTX 4060,c00,32,32,32,2,2,8,0.0,223.562,166.84799641370773,188.69055837392807,12.870898627246383,1,-1,-1,64x8192x2048,0,
2026-03-03T03:39:20.346090+00:00,FULL,llm_style,eval,llm_style_eval_005,64,3072,8192,bf16,NVIDIA GeForce RTX 4060,c10,64,128,64,8,3,8,0.0,298.462,232.44799673557281,326.8095949292182,13.857832793734023,2,-1,-1,64x3072x8192,0,
2026-03-03T03:39:20.428279+00:00,FULL,llm_style,eval,llm_style_eval_006,32,2048,2048,bf16,NVIDIA GeForce RTX 4060,c11,32,128,32,4,2,8,0.0,82.145,51.952000707387924,131.98336135596008,5.1669897664177284,7,-1,-1,32x2048x2048,0,
2026-03-03T03:39:20.641316+00:00,FULL,llm_style,eval,llm_style_eval_007,8,8192,2048,bf16,NVIDIA GeForce RTX 4060,c11,32,128,32,4,2,8,0.0,212.994,160.8159989118576,181.2262338399887,1.6692086472511236,5,-1,-1,8x8192x2048,0,
2026-03-03T03:39:20.837894+00:00,FULL,llm_style,eval,llm_style_eval_008,64,1536,8192,bf16,NVIDIA GeForce RTX 4060,c04,64,64,64,4,3,8,0.0,196.536,118.76800283789635,208.9900839328766,13.560998732952404,2,-1,-1,64x1536x8192,0,
2026-03-03T03:39:21.159574+00:00,FULL,llm_style,eval,llm_style_eval_009,64,4096,6144,bf16,NVIDIA GeForce RTX 4060,c02,32,64,32,2,2,8,0.0,321.639,233.47200453281403,263.23999494314194,13.797052363711826,1,-1,-1,64x4096x6144,0,
2026-03-03T03:39:21.278759+00:00,FULL,llm_style,eval,llm_style_eval_010,64,2048,4096,bf16,NVIDIA GeForce RTX 4060,c03,64,64,32,4,2,8,0.0,119.143,75.16799867153168,92.2627208381891,14.284560490854965,3,-1,-1,64x2048x4096,0,
2026-03-03T03:39:21.507459+00:00,FULL,llm_style,eval,llm_style_eval_011,32,3072,6144,bf16,NVIDIA GeForce RTX 4060,c10,64,128,64,8,3,8,0.0,228.655,178.51199954748154,242.5625592470169,6.766825507876858,7,-1,-1,32x3072x6144,0,
2026-03-03T03:39:21.575528+00:00,FULL,llm_style,eval,llm_style_eval_012,16,1536,1536,bf16,NVIDIA GeForce RTX 4060,c04,64,64,64,4,3,8,0.0,68.026,42.64000058174133,54.33343976736067,1.7705785874761082,7,-1,-1,16x1536x1536,0,
2026-03-03T03:39:21.671458+00:00,FULL,llm_style,eval,llm_style_eval_013,64,2048,3072,bf16,NVIDIA GeForce RTX 4060,c03,64,64,32,4,2,8,0.0,95.886,63.29599767923355,91.15648105740547,12.722863964970864,3,-1,-1,64x2048x3072,0,
2026-03-03T03:39:22.262666+00:00,FULL,llm_style,eval,llm_style_eval_014,16,8192,6144,bf16,NVIDIA GeForce RTX 4060,c11,32,128,32,4,2,8,0.0,591.166,425.7600009441376,458.9772862195968,3.782912280224564,5,-1,-1,16x8192x6144,0,
2026-03-03T03:39:22.313141+00:00,FULL,llm_style,eval,llm_style_eval_015,64,6144,1536,bf16,NVIDIA GeForce RTX 4060,c06,64,128,32,4,3,8,0.0,0.0,74.5920017361641,170.0611196458339,16.194223561295722,1,-1,-1,64x6144x1536,0,
2026-03-03T03:39:22.530138+00:00,FULL,llm_style,eval,llm_style_eval_016,16,4096,4096,bf16,NVIDIA GeForce RTX 4060,c11,32,128,32,4,2,8,0.0,216.942,161.79199516773224,222.87359714508054,3.3182785801202197,5,-1,-1,16x4096x4096,0,
2026-03-03T03:39:22.940583+00:00,FULL,llm_style,eval,llm_style_eval_017,64,8192,4096,bf16,NVIDIA GeForce RTX 4060,c06,64,128,32,4,3,8,0.0,410.403,304.1279911994934,374.7327888011931,14.122236098888731,1,-1,-1,64x8192x4096,0,
2026-03-03T03:39:23.257223+00:00,FULL,llm_style,eval,llm_style_eval_018,32,4096,6144,bf16,NVIDIA GeForce RTX 4060,c02,32,64,32,2,2,8,0.0,316.594,229.37600314617157,299.4451230764388,7.021714189402912,5,-1,-1,32x4096x6144,0,
2026-03-03T03:39:23.558282+00:00,FULL,llm_style,eval,llm_style_eval_019,16,3072,8192,bf16,NVIDIA GeForce RTX 4060,c10,64,128,64,8,3,8,0.0,301.015,226.30399465560913,403.91552031040135,3.558515921141915,6,-1,-1,16x3072x8192,0,
2026-03-03T03:39:23.624829+00:00,FULL,llm_style,eval,llm_style_eval_020,4,1536,1536,bf16,NVIDIA GeForce RTX 4060,c00,32,32,32,2,2,8,0.0,66.502,41.98399931192398,129.18784268200395,0.44956098297761365,7,-1,-1,4x1536x1536,0,
2026-03-03T03:39:23.737049+00:00,FULL,llm_style,eval,llm_style_eval_021,4,6144,1536,bf16,NVIDIA GeForce RTX 4060,c02,32,64,32,2,2,8,0.0,112.173,47.10400104522705,67.18464039266107,1.6027825731302712,5,-1,-1,4x6144x1536,0,
2026-03-03T03:39:23.769321+00:00,FULL,llm_style,eval,llm_style_eval_022,32,6144,1024,bf16,NVIDIA GeForce RTX 4060,c11,32,128,32,4,2,8,0.0,0.0,47.07200080156326,124.66719746589656,8.553984898526512,5,-1,-1,32x6144x1024,0,
2026-03-03T03:39:23.789468+00:00,FULL,llm_style,eval,llm_style_eval_023,16,1024,1536,bf16,NVIDIA GeForce RTX 4060,c04,64,64,64,4,3,8,0.0,0.0,76.20800286531448,196.1600020527839,0.6604509514434223,7,-1,-1,16x1024x1536,0,
2026-03-03T03:39:23.889003+00:00,FULL,llm_style,eval,llm_style_eval_024,32,8192,1024,bf16,NVIDIA GeForce RTX 4060,c11,32,128,32,4,2,8,0.0,99.49,49.12000149488449,108.32095891237253,10.92978207779394,5,-1,-1,32x8192x1024,0,
2026-03-03T03:39:24.330961+00:00,FULL,llm_style,eval,llm_style_eval_025,32,6144,6144,bf16,NVIDIA GeForce RTX 4060,c11,32,128,32,4,2,8,0.0,441.916,327.66400277614594,464.19167876243546,7.3731599551096,5,-1,-1,32x6144x6144,0,
2026-03-03T03:39:24.469819+00:00,FULL,llm_style,eval,llm_style_eval_026,1,6144,2048,bf16,NVIDIA GeForce RTX 4060,c11,32,128,32,4,2,8,0.0,138.813,56.40000104904175,63.776639215648174,0.4462025448921082,5,-1,-1,1x6144x2048,0,
2026-03-03T03:39:24.535454+00:00,FULL,llm_style,eval,llm_style_eval_027,32,4096,3072,bf16,NVIDIA GeForce RTX 4060,c00,32,32,32,2,2,8,0.0,0.0,75.76000317931175,177.5302346050739,10.629703460993387,5,-1,-1,32x4096x3072,0,
2026-03-03T03:39:24.603910+00:00,FULL,llm_style,eval,llm_style_eval_028,64,1536,1536,bf16,NVIDIA GeForce RTX 4060,c11,32,128,32,4,2,8,0.0,68.402,46.92799970507622,115.89216362684942,6.435174946681856,3,-1,-1,64x1536x1536,0,
2026-03-03T03:39:24.664325+00:00,FULL,llm_style,eval,llm_style_eval_029,2,3072,1024,bf16,NVIDIA GeForce RTX 4060,c00,32,32,32,2,2,8,0.0,60.372,39.664000272750854,119.34335887432096,0.3172375936232648,7,-1,-1,2x3072x1024,0,
2026-03-03T03:39:24.844843+00:00,FULL,llm_style,eval,llm_style_eval_030,32,1536,8192,bf16,NVIDIA GeForce RTX 4060,c04,64,64,64,4,3,8,0.0,180.479,96.0640013217926,102.7107197791338,8.383019205106878,6,-1,-1,32x1536x8192,0,
2026-03-03T03:39:24.933796+00:00,FULL,llm_style,eval,llm_style_eval_031,8,3072,2048,bf16,NVIDIA GeForce RTX 4060,c00,32,32,32,2,2,8,0.0,88.909,50.87999999523163,124.33408103883258,1.978445283204284,7,-1,-1,8x3072x2048,0,
2026-03-03T03:39:25.025532+00:00,FULL,llm_style,eval,llm_style_eval_032,8,2048,3072,bf16,NVIDIA GeForce RTX 4060,c00,32,32,32,2,2,8,0.0,91.694,54.27199974656105,128.56863498687733,1.8547924614916835,7,-1,-1,8x2048x3072,0,
2026-03-03T03:39:25.102035+00:00,FULL,llm_style,eval,llm_style_eval_033,64,1536,8192,bf16,NVIDIA GeForce RTX 4060,c04,64,64,64,4,3,8,0.0,0.0,116.73600226640701,189.397764056921,13.797052363711826,2,-1,-1,64x1536x8192,0,
2026-03-03T03:39:25.250037+00:00,FULL,llm_style,eval,llm_style_eval_034,64,6144,2048,bf16,NVIDIA GeForce RTX 4060,c10,64,128,64,8,3,8,0.0,147.941,94.2080020904541,101.33119657635689,17.096347446722895,1,-1,-1,64x6144x2048,0,
2026-03-03T03:39:25.355268+00:00,FULL,llm_style,eval,llm_style_eval_035,4,4096,2048,bf16,NVIDIA GeForce RTX 4060,c00,32,32,32,2,2,8,0.0,105.187,52.20799893140793,131.9219157099721,1.2854134495399676,5,-1,-1,4x4096x2048,0,
2026-03-03T03:39:25.516874+00:00,FULL,llm_style,eval,llm_style_eval_036,64,8192,4096,bf16,NVIDIA GeForce RTX 4060,c06,64,128,32,4,3,8,0.0,0.0,304.1279911994934,324.18463855981827,14.122236098888731,1,-1,-1,64x8192x4096,0,
2026-03-03T03:39:25.546649+00:00,FULL,llm_style,eval,llm_style_eval_037,32,6144,1024,bf16,NVIDIA GeForce RTX 4060,c11,32,128,32,4,2,8,0.0,0.0,40.95999896526337,96.85215983539804,9.8304002483368,5,-1,-1,32x6144x1024,0,
2026-03-03T03:39:25.607203+00:00,FULL,llm_style,eval,llm_style_eval_038,64,6144,2048,bf16,NVIDIA GeForce RTX 4060,c10,64,128,64,8,3,8,0.0,0.0,83.43999832868576,208.91840040683738,19.302645832463888,1,-1,-1,64x6144x2048,0,
2026-03-03T03:39:25.685027+00:00,FULL,llm_style,eval,llm_style_eval_039,8,1024,3072,bf16,NVIDIA GeForce RTX 4060,c04,64,64,64,4,3,8,0.0,77.77,50.175998359918594,70.18912106752393,1.0031020736042942,7,-1,-1,8x1024x3072,0,
2026-03-03T03:39:25.906062+00:00,FULL,llm_style,eval,llm_style_eval_040,32,8192,2048,bf16,NVIDIA GeForce RTX 4060,c11,32,128,32,4,2,8,0.0,220.995,163.63199800252914,241.48991599678988,6.56193065602856,5,-1,-1,32x8192x2048,0,
2026-03-03T03:39:25.971610+00:00,FULL,llm_style,eval,llm_style_eval_041,32,3072,1024,bf16,NVIDIA GeForce RTX 4060,c00,32,32,32,2,2,8,0.0,65.508,37.88800165057182,65.7900777086615,5.313729498239754,7,-1,-1,32x3072x1024,0,
2026-03-03T03:39:25.990295+00:00,FULL,llm_style,eval,llm_style_eval_042,64,1024,4096,bf16,NVIDIA GeForce RTX 4060,c04,64,64,64,4,3,8,0.0,0.0,53.199999034404755,139.24224197864532,10.091558679405283,3,-1,-1,64x1024x4096,0,
2026-03-03T03:39:26.000533+00:00,FULL,llm_style,eval,llm_style_eval_043,2,1536,1024,bf16,NVIDIA GeForce RTX 4060,c00,32,32,32,2,2,8,0.0,0.0,55.296000093221664,197.84896001219744,0.11377777758596365,7,-1,-1,2x1536x1024,0,
2026-03-03T03:39:26.237318+00:00,FULL,llm_style,eval,llm_style_eval_044,64,6144,3072,bf16,NVIDIA GeForce RTX 4060,c06,64,128,32,4,3,8,0.0,236.742,182.27200210094452,287.2140756249428,13.254471757335688,1,-1,-1,64x6144x3072,0,
2026-03-03T03:39:26.373626+00:00,FULL,llm_style,eval,llm_style_eval_045,64,1536,6144,bf16,NVIDIA GeForce RTX 4060,c04,64,64,64,4,3,8,0.0,136.264,71.47200033068657,137.14112058281898,16.901157745844724,3,-1,-1,64x1536x6144,0,
2026-03-03T03:39:26.608471+00:00,FULL,llm_style,eval,llm_style_eval_046,2,6144,3072,bf16,NVIDIA GeForce RTX 4060,c11,32,128,32,4,2,8,0.0,234.804,176.12800002098083,236.19039788842198,0.4286511627396356,5,-1,-1,2x6144x3072,0,
2026-03-03T03:39:27.011072+00:00,FULL,llm_style,eval,llm_style_eval_047,16,4096,8192,bf16,NVIDIA GeForce RTX 4060,c11,32,128,32,4,2,8,0.0,402.555,293.88800263404846,305.2499121427536,3.6535748801458605,4,-1,-1,16x4096x8192,0,
2026-03-03T03:39:27.054475+00:00,FULL,llm_style,eval,llm_style_eval_048,16,1024,6144,bf16,NVIDIA GeForce RTX 4060,c04,64,64,64,4,3,8,0.0,0.0,62.831999734044075,126.29216082394105,3.204204750002821,7,-1,-1,16x1024x6144,0,
2026-03-03T03:39:27.193101+00:00,FULL,llm_style,eval,llm_style_eval_049,16,8192,1536,bf16,NVIDIA GeForce RTX 4060,c11,32,128,32,4,2,8,0.0,138.57,61.43999844789505,67.58400052785873,6.553600165557866,5,-1,-1,16x8192x1536,0,
2026-03-03T03:39:27.240648+00:00,FULL,llm_style,eval,llm_style_eval_050,1,1024,1024,bf16,NVIDIA GeForce RTX 4060,c00,32,32,32,2,2,8,0.0,47.504,34.25599820911884,57.344961054623084,0.061219993859111796,7,-1,-1,1x1024x1024,0,
2026-03-03T03:39:27.316456+00:00,FULL,llm_style,eval,llm_style_eval_051,16,6144,1024,bf16,NVIDIA GeForce RTX 4060,c11,32,128,32,4,2,8,0.0,75.766,40.95999896526337,59.17696133255953,4.9152001241684,5,-1,-1,16x6144x1024,0,
2026-03-03T03:39:28.065702+00:00,FULL,llm_style,eval,llm_style_eval_052,16,8192,8192,bf16,NVIDIA GeForce RTX 4060,c11,32,128,32,4,2,8,0.0,749.201,559.1040253639221,633.231346607208,3.8409375546924345,4,-1,-1,16x8192x8192,0,
2026-03-03T03:39:28.622937+00:00,FULL,llm_style,eval,llm_style_eval_053,1,6144,8192,bf16,NVIDIA GeForce RTX 4060,c02,32,64,32,2,2,8,0.0,557.186,424.8320013284683,492.6684740185736,0.2369484777164184,4,-1,-1,1x6144x8192,0,
2026-03-03T03:39:28.790091+00:00,FULL,llm_style,eval,llm_style_eval_054,64,4096,3072,bf16,NVIDIA GeForce RTX 4060,c04,64,64,64,4,3,8,0.0,167.108,87.42399886250496,103.93664017319675,18.423004632092745,1,-1,-1,64x4096x3072,0,
2026-03-03T03:39:28.891677+00:00,FULL,llm_style,eval,llm_style_eval_055,4,8192,1024,bf16,NVIDIA GeForce RTX 4060,c11,32,128,32,4,2,8,0.0,101.538,49.15200173854828,57.27040007710456,1.3653332850403275,5,-1,-1,4x8192x1024,0,
2026-03-03T03:39:28.976968+00:00,FULL,llm_style,eval,llm_style_eval_056,64,1024,3072,bf16,NVIDIA GeForce RTX 4060,c04,64,64,64,4,3,8,0.0,85.246,50.175998359918594,73.47008019685745,8.024816588834353,3,-1,-1,64x1024x3072,0,
2026-03-03T03:39:28.980998+00:00,FULL,llm_style,eval,llm_style_eval_057,64,1024,3072,bf16,NVIDIA GeForce RTX 4060,c04,64,64,64,4,3,8,0.0,0.0,49.15200173854828,67.64896180480716,8.191999710241964,3,-1,-1,64x1024x3072,0,
2026-03-03T03:39:29.104357+00:00,FULL,llm_style,eval,llm_style_eval_058,32,2048,4096,bf16,NVIDIA GeForce RTX 4060,c11,32,128,32,4,2,8,0.0,123.331,74.67200234532356,79.3702370673418,7.1897216511915625,7,-1,-1,32x2048x4096,0,
2026-03-03T03:39:29.196121+00:00,FULL,llm_style,eval,llm_style_eval_059,64,8192,2048,bf16,NVIDIA GeForce RTX 4060,c00,32,32,32,2,2,8,0.0,0.0,166.9120043516159,256.9113536179065,12.865962854751436,1,-1,-1,64x8192x2048,0,
2026-03-03T03:39:29.423974+00:00,FULL,llm_style,eval,llm_style_eval_060,1,3072,6144,bf16,NVIDIA GeForce RTX 4060,c10,64,128,64,8,3,8,0.0,227.801,178.14400047063828,199.1763235628605,0.21190012518115509,7,-1,-1,1x3072x6144,0,
2026-03-03T03:39:29.462767+00:00,FULL,llm_style,eval,llm_style_eval_061,64,1536,4096,bf16,NVIDIA GeForce RTX 4060,c04,64,64,64,4,3,8,0.0,0.0,38.75199891626835,135.63904106616965,20.781027831365027,3,-1,-1,64x1536x4096,0,
2026-03-03T03:39:29.597552+00:00,FULL,llm_style,eval,llm_style_eval_062,16,6144,2048,bf16,NVIDIA GeForce RTX 4060,c02,32,64,32,2,2,8,0.0,134.727,62.32000142335892,67.52703979611397,6.461058645757294,5,-1,-1,16x6144x2048,0,
2026-03-03T03:39:29.641613+00:00,FULL,llm_style,eval,llm_style_eval_063,64,1536,6144,bf16,NVIDIA GeForce RTX 4060,c04,64,64,64,4,3,8,0.0,0.0,50.175998359918594,187.45344385504723,24.074449766503058,3,-1,-1,64x1536x6144,0,
2026-03-03T03:39:29.702902+00:00,FULL,llm_style,eval,llm_style_eval_064,1,6144,2048,bf16,NVIDIA GeForce RTX 4060,c11,32,128,32,4,2,8,0.0,0.0,57.34400078654289,197.43808209896076,0.438857136837682,5,-1,-1,1x6144x2048,0,
2026-03-03T03:39:29.841203+00:00,FULL,llm_style,eval,llm_style_eval_065,8,1536,6144,bf16,NVIDIA GeForce RTX 4060,c00,32,32,32,2,2,8,0.0,138.245,74.75200295448303,128.73728238046155,2.0199451256435466,7,-1,-1,8x1536x6144,0,
2026-03-03T03:39:29.879423+00:00,FULL,llm_style,eval,llm_style_eval_066,64,1536,4096,bf16,NVIDIA GeForce RTX 4060,c04,64,64,64,4,3,8,0.0,0.0,60.40000170469284,207.88191407918916,13.332886511117943,3,-1,-1,64x1536x4096,0,
2026-03-03T03:39:29.976970+00:00,FULL,llm_style,eval,llm_style_eval_067,64,8192,2048,bf16,NVIDIA GeForce RTX 4060,c00,32,32,32,2,2,8,0.0,0.0,166.6719987988472,181.23584151268005,12.884489677187775,1,-1,-1,64x8192x2048,0,
2026-03-03T03:39:29.997036+00:00,FULL,llm_style,eval,llm_style_eval_068,64,1024,4096,bf16,NVIDIA GeForce RTX 4060,c04,64,64,64,4,3,8,0.0,0.0,51.103999838232994,179.38688367605192,10.505457766504314,3,-1,-1,64x1024x4096,0,
2026-03-03T03:39:30.034570+00:00,FULL,llm_style,eval,llm_style_eval_069,64,2048,4096,bf16,NVIDIA GeForce RTX 4060,c03,64,64,32,4,2,8,0.0,0.0,73.72800260782242,89.58176016807556,14.563555040430158,3,-1,-1,64x2048x4096,0,
2026-03-03T03:39:30.143817+00:00,FULL,llm_style,eval,llm_style_eval_070,64,8192,1024,bf16,NVIDIA GeForce RTX 4060,c06,64,128,32,4,3,8,0.0,109.199,64.51199948787689,154.3222415447235,16.644063624190995,1,-1,-1,64x8192x1024,0,
2026-03-03T03:39:30.212088+00:00,FULL,llm_style,eval,llm_style_eval_071,64,6144,2048,bf16,NVIDIA GeForce RTX 4060,c10,64,128,64,8,3,8,0.0,0.0,95.0240008533001,148.24447423219675,16.94953613336588,1,-1,-1,64x6144x2048,0,
2026-03-03T03:39:30.224885+00:00,FULL,llm_style,eval,llm_style_eval_072,64,1536,1024,bf16,NVIDIA GeForce RTX 4060,c04,64,64,64,4,3,8,0.0,0.0,44.03200000524521,114.9222376197576,4.57227906922278,3,-1,-1,64x1536x1024,0,
2026-03-03T03:39:30.251965+00:00,FULL,llm_style,eval,llm_style_eval_073,1,4096,1536,bf16,NVIDIA GeForce RTX 4060,c11,32,128,32,4,2,8,0.0,0.0,50.20799860358238,91.57088093459598,0.25061568574657744,5,-1,-1,1x4096x1536,0,
2026-03-03T03:39:30.316476+00:00,FULL,llm_style,eval,llm_style_eval_074,8,1024,2048,bf16,NVIDIA GeForce RTX 4060,c04,64,64,64,4,3,8,0.0,64.457,41.98399931192398,141.54751926660524,0.7992195252935353,7,-1,-1,8x1024x2048,0,
2026-03-03T03:39:30.401665+00:00,FULL,llm_style,eval,llm_style_eval_075,2,6144,1024,bf16,NVIDIA GeForce RTX 4060,c11,32,128,32,4,2,8,0.0,85.148,40.31999967992306,52.535359524190426,0.6241523859071625,5,-1,-1,2x6144x1024,0,
2026-03-03T03:39:30.436011+00:00,FULL,llm_style,eval,llm_style_eval_076,64,1024,6144,bf16,NVIDIA GeForce RTX 4060,c04,64,64,64,4,3,8,0.0,0.0,74.0320011973381,163.42015936970708,10.877814390744252,3,-1,-1,64x1024x6144,0,
2026-03-03T03:39:30.844478+00:00,FULL,llm_style,eval,llm_style_eval_077,1,4096,8192,bf16,NVIDIA GeForce RTX 4060,c11,32,128,32,4,2,8,0.0,408.411,291.7439937591553,391.9487935304639,0.23002654873985404,4,-1,-1,1x4096x8192,0,
2026-03-03T03:39:30.947294+00:00,FULL,llm_style,eval,llm_style_eval_078,64,6144,3072,bf16,NVIDIA GeForce RTX 4060,c06,64,128,32,4,3,8,0.0,0.0,183.29599499702454,260.13120144605625,13.180424940758897,1,-1,-1,64x6144x3072,0,
2026-03-03T03:39:31.088237+00:00,FULL,llm_style,eval,llm_style_eval_079,2,3072,4096,bf16,NVIDIA GeForce RTX 4060,c00,32,32,32,2,2,8,0.0,140.888,67.07200035452843,117.81632259488104,0.7504122097739375,7,-1,-1,2x3072x4096,0,
2026-03-03T03:39:31.139958+00:00,FULL,llm_style,eval,llm_style_eval_080,4,1536,1024,bf16,NVIDIA GeForce RTX 4060,c04,64,64,64,4,3,8,0.0,51.682,34.63999927043915,127.60896191000936,0.3632480446019502,7,-1,-1,4x1536x1024,0,
2026-03-03T03:39:31.451895+00:00,FULL,llm_style,eval,llm_style_eval_081,4,4096,6144,bf16,NVIDIA GeForce RTX 4060,c03,64,64,32,4,2,8,0.0,311.897,227.32800245285034,243.76863688230515,0.8856216120658376,5,-1,-1,4x4096x6144,0,
2026-03-03T03:39:31.548146+00:00,FULL,llm_style,eval,llm_style_eval_082,64,6144,1024,bf16,NVIDIA GeForce RTX 4060,c10,64,128,64,8,3,8,0.0,96.208,53.92000079154968,58.39264102280139,14.935206902411752,1,-1,-1,64x6144x1024,0,
2026-03-03T03:39:31.639153+00:00,FULL,llm_style,eval,llm_style_eval_083,8,4096,4096,bf16,NVIDIA GeForce RTX 4060,c00,32,32,32,2,2,8,0.0,0.0,166.23999923467636,399.0700832009315,1.6147464944405898,5,-1,-1,8x4096x4096,0,
2026-03-03T03:39:31.784438+00:00,FULL,llm_style,eval,llm_style_eval_084,64,1024,8192,bf16,NVIDIA GeForce RTX 4060,c04,64,64,64,4,3,8,0.0,145.231,87.0399996638298,163.52191679179649,12.336188282939554,2,-1,-1,64x1024x8192,0,
2026-03-03T03:39:32.086220+00:00,FULL,llm_style,eval,llm_style_eval_085,1,3072,8192,bf16,NVIDIA GeForce RTX 4060,c10,64,128,64,8,3,8,0.0,301.738,226.73600167036057,253.7369525432586,0.22198348576850405,6,-1,-1,1x3072x8192,0,
2026-03-03T03:39:32.152294+00:00,FULL,llm_style,eval,llm_style_eval_086,8,1536,1024,bf16,NVIDIA GeForce RTX 4060,c04,64,64,64,4,3,8,0.0,66.024,39.792001247406006,178.31807434558849,0.6324342383166901,7,-1,-1,8x1536x1024,0,
2026-03-03T03:39:32.230618+00:00,FULL,llm_style,eval,llm_style_eval_087,16,1024,3072,bf16,NVIDIA GeForce RTX 4060,c00,32,32,32,2,2,8,0.0,78.283,48.08000102639198,211.91071674227703,2.0936625177013637,7,-1,-1,16x1024x3072,0,
2026-03-03T03:39:32.317828+00:00,FULL,llm_style,eval,llm_style_eval_088,8,4096,1536,bf16,NVIDIA GeForce RTX 4060,c00,32,32,32,2,2,8,0.0,87.17,43.007999658584595,93.66720218211398,2.340571447151859,5,-1,-1,8x4096x1536,0,
2026-03-03T03:39:32.551450+00:00,FULL,llm_style,eval,llm_style_eval_089,16,6144,3072,bf16,NVIDIA GeForce RTX 4060,c11,32,128,32,4,2,8,0.0,233.571,178.99200320243835,278.0262406170366,3.374339440834707,5,-1,-1,16x6144x3072,0,
2026-03-03T03:39:32.639995+00:00,FULL,llm_style,eval,llm_style_eval_090,32,1536,3072,bf16,NVIDIA GeForce RTX 4060,c00,32,32,32,2,2,8,0.0,88.503,50.5599994212389,118.14912259578698,5.972901334194678,7,-1,-1,32x1536x3072,0,
2026-03-03T03:39:32.731431+00:00,FULL,llm_style,eval,llm_style_eval_091,16,1024,4096,bf16,NVIDIA GeForce RTX 4060,c04,64,64,64,4,3,8,0.0,91.391,61.37600168585777,64.46495912969112,2.186811201664288,7,-1,-1,16x1024x4096,0,
2026-03-03T03:39:33.038699+00:00,FULL,llm_style,eval,llm_style_eval_092,1,4096,6144,bf16,NVIDIA GeForce RTX 4060,c11,32,128,32,4,2,8,0.0,307.225,226.30399465560913,345.21758854389157,0.2224072450713697,5,-1,-1,1x4096x6144,0,
2026-03-03T03:39:33.142134+00:00,FULL,llm_style,eval,llm_style_eval_093,32,2048,3072,bf16,NVIDIA GeForce RTX 4060,c00,32,32,32,2,2,8,0.0,103.393,57.34400078654289,73.72416213154793,7.021714189402912,7,-1,-1,32x2048x3072,0,
2026-03-03T03:39:33.163124+00:00,FULL,llm_style,eval,llm_style_eval_094,32,1024,2048,bf16,NVIDIA GeForce RTX 4060,c04,64,64,64,4,3,8,0.0,0.0,41.02399945259094,108.60416240990139,3.2716880311756937,7,-1,-1,32x1024x2048,0,
2026-03-03T03:39:33.303432+00:00,FULL,llm_style,eval,llm_style_eval_095,8,6144,2048,bf16,NVIDIA GeForce RTX 4060,c11,32,128,32,4,2,8,0.0,140.267,59.328000992536545,159.39455695450272,3.393449781416483,5,-1,-1,8x6144x2048,0,
2026-03-03T03:39:33.329867+00:00,FULL,llm_style,eval,llm_style_eval_096,64,2048,3072,bf16,NVIDIA GeForce RTX 4060,c03,64,64,32,4,2,8,0.0,0.0,62.463998794555664,78.43904063105582,12.892328117651509,3,-1,-1,64x2048x3072,0,
2026-03-03T03:39:33.358119+00:00,FULL,llm_style,eval,llm_style_eval_097,64,6144,1024,bf16,NVIDIA GeForce RTX 4060,c10,64,128,64,8,3,8,0.0,0.0,88.06400001049042,193.65472227334973,9.14455813844556,1,-1,-1,64x6144x1024,0,
2026-03-03T03:39:33.382011+00:00,FULL,llm_style,eval,llm_style_eval_098,32,6144,1024,bf16,NVIDIA GeForce RTX 4060,c11,32,128,32,4,2,8,0.0,0.0,41.98399931192398,155.55424347519875,9.590634303522425,5,-1,-1,32x6144x1024,0,
2026-03-03T03:39:33.451557+00:00,FULL,llm_style,eval,llm_style_eval_099,1,2048,2048,bf16,NVIDIA GeForce RTX 4060,c00,32,32,32,2,2,8,0.0,69.494,43.87199878692627,51.72223888337612,0.1912064239594158,7,-1,-1,1x2048x2048,0,
2026-03-03T03:39:33.491493+00:00,FULL,llm_style,eval,llm_style_eval_100,64,8192,1024,bf16,NVIDIA GeForce RTX 4060,c06,64,128,32,4,3,8,0.0,0.0,65.5359998345375,106.56768232583988,16.384000041365624,1,-1,-1,64x8192x1024,0,
2026-03-03T03:39:33.556131+00:00,FULL,llm_style,eval,llm_style_eval_101,64,8192,1536,bf16,NVIDIA GeForce RTX 4060,c06,64,128,32,4,3,8,0.0,0.0,109.91999879479408,207.0118351280687,14.65259055366984,1,-1,-1,64x8192x1536,0,
2026-03-03T03:39:33.580583+00:00,FULL,llm_style,eval,llm_style_eval_102,32,3072,2048,bf16,NVIDIA GeForce RTX 4060,c11,32,128,32,4,2,8,0.0,0.0,49.1040013730526,69.27360109984872,8.200007590847147,7,-1,-1,32x3072x2048,0,
2026-03-03T03:39:33.613260+00:00,FULL,llm_style,eval,llm_style_eval_103,64,2048,3072,bf16,NVIDIA GeForce RTX 4060,c03,64,64,32,4,2,8,0.0,0.0,93.07200089097023,226.06271997094134,8.652509458170789,3,-1,-1,64x2048x3072,0,
2026-03-03T03:39:33.673518+00:00,FULL,llm_style,eval,llm_style_eval_104,16,6144,2048,bf16,NVIDIA GeForce RTX 4060,c02,32,64,32,2,2,8,0.0,0.0,68.43199953436852,136.3868843019008,5.883989752451644,5,-1,-1,16x6144x2048,0,
2026-03-03T03:39:33.810568+00:00,FULL,llm_style,eval,llm_style_eval_105,1,1024,8192,bf16,NVIDIA GeForce RTX 4060,c04,64,64,64,4,3,8,0.0,136.995,83.96799862384796,169.8012839257716,0.19980488132338384,6,-1,-1,1x1024x8192,0,
2026-03-03T03:39:34.236563+00:00,FULL,llm_style,eval,llm_style_eval_106,32,4096,8192,bf16,NVIDIA GeForce RTX 4060,c11,32,128,32,4,2,8,0.0,425.951,296.4159995317459,335.4316705465317,7.244830411962989,4,-1,-1,32x4096x8192,0,
2026-03-03T03:39:34.297006+00:00,FULL,llm_style,eval,llm_style_eval_107,64,6144,1536,bf16,NVIDIA GeForce RTX 4060,c06,64,128,32,4,3,8,0.0,0.0,66.56000018119812,163.48159953951833,18.1484307198248,1,-1,-1,64x6144x1536,0,
2026-03-03T03:39:34.368026+00:00,FULL,llm_style,eval,llm_style_eval_108,8,3072,1536,bf16,NVIDIA GeForce RTX 4060,c00,32,32,32,2,2,8,0.0,70.966,40.95999896526337,174.89120274782164,1.8432000465631497,7,-1,-1,8x3072x1536,0,
2026-03-03T03:39:34.379276+00:00,FULL,llm_style,eval,llm_style_eval_109,16,2048,1024,bf16,NVIDIA GeForce RTX 4060,c01,64,32,32,2,2,8,0.0,0.0,36.86400130391121,90.33727943897239,1.8204443800537697,7,-1,-1,16x2048x1024,0,
2026-03-03T03:39:35.127846+00:00,FULL,llm_style,eval,llm_style_eval_110,1,8192,8192,bf16,NVIDIA GeForce RTX 4060,c10,64,128,64,8,3,8,0.0,748.529,552.9439747333527,603.3855885267258,0.24273296054039487,4,-1,-1,1x8192x8192,0,
2026-03-03T03:39:35.243636+00:00,FULL,llm_style,eval,llm_style_eval_111,8,6144,1536,bf16,NVIDIA GeForce RTX 4060,c11,32,128,32,4,2,8,0.0,115.746,47.07200080156326,137.56416171789164,3.207744336947442,5,-1,-1,8x6144x1536,0,
2026-03-03T03:39:35.338873+00:00,FULL,llm_style,eval,llm_style_eval_112,2,6144,3072,bf16,NVIDIA GeForce RTX 4060,c11,32,128,32,4,2,8,0.0,0.0,181.2479943037033,219.3603222072124,0.4165423859725294,5,-1,-1,2x6144x3072,0,
2026-03-03T03:39:35.652273+00:00,FULL,llm_style,eval,llm_style_eval_113,1,8192,8192,bf16,NVIDIA GeForce RTX 4060,c10,64,128,64,8,3,8,0.0,0.0,556.9599866867065,618.6083322763443,0.24098271187926165,4,-1,-1,1x8192x8192,0,
2026-03-03T03:39:35.710441+00:00,FULL,llm_style,eval,llm_style_eval_114,1,3072,1024,bf16,NVIDIA GeForce RTX 4060,c00,32,32,32,2,2,8,0.0,58.107,34.81600061058998,118.14592160284519,0.18070587918378908,7,-1,-1,1x3072x1024,0,
2026-03-03T03:39:35.786865+00:00,FULL,llm_style,eval,llm_style_eval_115,16,3072,1536,bf16,NVIDIA GeForce RTX 4060,c11,32,128,32,4,2,8,0.0,76.378,45.05600035190582,66.86719831079239,3.351272701097914,7,-1,-1,16x3072x1536,0,
2026-03-03T03:39:35.848013+00:00,FULL,llm_style,eval,llm_style_eval_116,8,3072,1024,bf16,NVIDIA GeForce RTX 4060,c00,32,32,32,2,2,8,0.0,61.105,37.58399933576584,113.85855734348283,1.3391775460176532,7,-1,-1,8x3072x1024,0,
2026-03-03T03:39:35.948676+00:00,FULL,llm_style,eval,llm_style_eval_117,4,1024,4096,bf16,NVIDIA GeForce RTX 4060,c04,64,64,64,4,3,8,0.0,100.62,59.007998555898666,153.19456279277767,0.5686420963458652,7,-1,-1,4x1024x4096,0,
2026-03-03T03:39:36.046521+00:00,FULL,llm_style,eval,llm_style_eval_118,64,6144,3072,bf16,NVIDIA GeForce RTX 4060,c06,64,128,32,4,3,8,0.0,0.0,181.2479943037033,233.66528764367087,13.329356351120941,1,-1,-1,64x6144x3072,0,
2026-03-03T03:39:36.640814+00:00,FULL,llm_style,eval,llm_style_eval_119,64,8192,6144,bf16,NVIDIA GeForce RTX 4060,c06,64,128,32,4,3,8,0.0,594.23,441.3439929485321,536.9676560163498,14.597345940882205,1,-1,-1,64x8192x6144,0,
2026-03-03T03:39:36.735709+00:00,FULL,llm_style,eval,llm_style_eval_120,8,1024,4096,bf16,NVIDIA GeForce RTX 4060,c04,64,64,64,4,3,8,0.0,94.844,58.14399942755699,66.88639886677265,1.1541838308459078,7,-1,-1,8x1024x4096,0,
2026-03-03T03:39:36.800584+00:00,FULL,llm_style,eval,llm_style_eval_121,4,1024,2048,bf16,NVIDIA GeForce RTX 4060,c04,64,64,64,4,3,8,0.0,64.83,42.17600077390671,68.15520107746124,0.39779058450652505,7,-1,-1,4x1024x2048,0,
2026-03-03T03:39:37.089029+00:00,FULL,llm_style,eval,llm_style_eval_122,4,6144,4096,bf16,NVIDIA GeForce RTX 4060,c11,32,128,32,4,2,8,0.0,288.401,228.15999388694763,285.00768363475794,0.8823921695043371,5,-1,-1,4x6144x4096,0,
2026-03-03T03:39:37.384437+00:00,FULL,llm_style,eval,llm_style_eval_123,4,3072,8192,bf16,NVIDIA GeForce RTX 4060,c10,64,128,64,8,3,8,0.0,295.352,227.76000201702118,238.35360080003738,0.883941825680851,6,-1,-1,4x3072x8192,0,
2026-03-03T03:39:37.415737+00:00,FULL,llm_style,eval,llm_style_eval_124,64,6144,1024,bf16,NVIDIA GeForce RTX 4060,c10,64,128,64,8,3,8,0.0,0.0,62.463998794555664,144.92672055959702,12.892328117651509,1,-1,-1,64x6144x1024,0,
2026-03-03T03:39:37.480132+00:00,FULL,llm_style,eval,llm_style_eval_125,64,1536,8192,bf16,NVIDIA GeForce RTX 4060,c04,64,64,64,4,3,8,0.0,0.0,117.76000261306763,139.88512158393854,13.677077957378314,2,-1,-1,64x1536x8192,0,
2026-03-03T03:39:37.565782+00:00,FULL,llm_style,eval,llm_style_eval_126,64,2048,8192,bf16,NVIDIA GeForce RTX 4060,c10,64,128,64,8,3,8,0.0,0.0,172.03199863433838,203.8144010305404,12.483047718143249,2,-1,-1,64x2048x8192,0,
2026-03-03T03:39:37.702984+00:00,FULL,llm_style,eval,llm_style_eval_127,2,8192,1536,bf16,NVIDIA GeForce RTX 4060,c11,32,128,32,4,2,8,0.0,137.15,60.06399914622307,79.25599999725819,0.8379669804781046,5,-1,-1,2x8192x1536,0,
2026-03-03T03:39:37.774820+00:00,FULL,llm_style,eval,llm_style_eval_128,8,2048,2048,bf16,NVIDIA GeForce RTX 4060,c00,32,32,32,2,2,8,0.0,71.79,46.46399989724159,107.57792174816127,1.4443195624228649,7,-1,-1,8x2048x2048,0,
2026-03-03T03:39:38.025856+00:00,FULL,llm_style,eval,llm_style_eval_129,64,8192,6144,bf16,NVIDIA GeForce RTX 4060,c06,64,128,32,4,3,8,0.0,0.0,442.7200108766556,474.62848633527756,14.551975934503002,1,-1,-1,64x8192x6144,0,
2026-03-03T03:39:38.046125+00:00,FULL,llm_style,eval,llm_style_eval_130,16,3072,1536,bf16,NVIDIA GeForce RTX 4060,c11,32,128,32,4,2,8,0.0,0.0,46.99200019240379,138.89376133680338,3.2132052983862596,7,-1,-1,16x3072x1536,0,
2026-03-03T03:39:38.804360+00:00,FULL,llm_style,eval,llm_style_eval_131,32,8192,8192,bf16,NVIDIA GeForce RTX 4060,c00,32,32,32,2,2,8,0.0,758.182,564.2240047454834,631.1103844642637,7.612166905123831,4,-1,-1,32x8192x8192,0,
2026-03-03T03:39:39.195256+00:00,FULL,llm_style,eval,llm_style_eval_132,32,8192,4096,bf16,NVIDIA GeForce RTX 4060,c11,32,128,32,4,2,8,0.0,390.841,296.640008687973,322.64671981334686,7.239359442774543,5,-1,-1,32x8192x4096,0,
2026-03-03T03:39:39.926556+00:00,FULL,llm_style,eval,llm_style_eval_133,2,8192,8192,bf16,NVIDIA GeForce RTX 4060,c11,32,128,32,4,2,8,0.0,731.256,554.9120008945465,613.3289736509323,0.48374418928995644,4,-1,-1,2x8192x8192,0,
2026-03-03T03:39:40.053405+00:00,FULL,llm_style,eval,llm_style_eval_134,64,3072,3072,bf16,NVIDIA GeForce RTX 4060,c03,64,64,32,4,2,8,0.0,126.806,64.33599814772606,84.68543909490106,18.775795616418755,3,-1,-1,64x3072x3072,0,
2026-03-03T03:39:40.169989+00:00,FULL,llm_style,eval,llm_style_eval_135,8,3072,3072,bf16,NVIDIA GeForce RTX 4060,c00,32,32,32,2,2,8,0.0,116.544,56.32000043988228,162.45408162474627,2.6810181608783314,7,-1,-1,8x3072x3072,0,
2026-03-03T03:39:40.293725+00:00,FULL,llm_style,eval,llm_style_eval_136,4,2048,4096,bf16,NVIDIA GeForce RTX 4060,c00,32,32,32,2,2,8,0.0,123.692,59.567999094724655,152.16031923890114,1.1265925500247862,7,-1,-1,4x2048x4096,0,
2026-03-03T03:39:41.054466+00:00,FULL,llm_style,eval,llm_style_eval_137,4,8192,8192,bf16,NVIDIA GeForce RTX 4060,c11,32,128,32,4,2,8,0.0,760.699,557.4719905853271,590.008310675621,0.9630455360390454,4,-1,-1,4x8192x8192,0,
2026-03-03T03:39:41.115979+00:00,FULL,llm_style,eval,llm_style_eval_138,16,1024,1024,bf16,NVIDIA GeForce RTX 4060,c04,64,64,64,4,3,8,0.0,61.462,40.70400074124336,60.981440916657405,0.8243521862459319,7,-1,-1,16x1024x1024,0,
2026-03-03T03:39:41.170144+00:00,FULL,llm_style,eval,llm_style_eval_139,4,1024,1024,bf16,NVIDIA GeForce RTX 4060,c04,64,64,64,4,3,8,0.0,54.131,36.81600093841553,46.1903991922736,0.22785223234951998,7,-1,-1,4x1024x1024,0,
2026-03-03T03:39:41.298326+00:00,FULL,llm_style,eval,llm_style_eval_140,64,4096,6144,bf16,NVIDIA GeForce RTX 4060,c02,32,64,32,2,2,8,0.0,0.0,235.36000400781631,336.39871031045914,13.686375837642418,1,-1,-1,64x4096x6144,0,
2026-03-03T03:39:41.420643+00:00,FULL,llm_style,eval,llm_style_eval_141,4,6144,4096,bf16,NVIDIA GeForce RTX 4060,c11,32,128,32,4,2,8,0.0,0.0,229.96800392866135,323.9936050772666,0.8754547961483102,5,-1,-1,4x6144x4096,0,
2026-03-03T03:39:41.589857+00:00,FULL,llm_style,eval,llm_style_eval_142,4,2048,6144,bf16,NVIDIA GeForce RTX 4060,c00,32,32,32,2,2,8,0.0,169.153,86.87999844551086,184.34079855680466,1.1586475345431055,7,-1,-1,4x2048x6144,0,
2026-03-03T03:39:41.670413+00:00,FULL,llm_style,eval,llm_style_eval_143,64,1536,8192,bf16,NVIDIA GeForce RTX 4060,c04,64,64,64,4,3,8,0.0,0.0,120.83200365304947,256.7542485892771,13.329355529224086,2,-1,-1,64x1536x8192,0,
2026-03-03T03:39:41.779110+00:00,FULL,llm_style,eval,llm_style_eval_144,1,3072,3072,bf16,NVIDIA GeForce RTX 4060,c00,32,32,32,2,2,8,0.0,108.626,57.34400078654289,153.64863961935043,0.32914285262826154,7,-1,-1,1x3072x3072,0,
2026-03-03T03:39:41.795329+00:00,FULL,llm_style,eval,llm_style_eval_145,32,1024,2048,bf16,NVIDIA GeForce RTX 4060,c04,64,64,64,4,3,8,0.0,0.0,46.08000069856644,76.83231905102727,2.9127110669548135,7,-1,-1,32x1024x2048,0,
2026-03-03T03:39:41.967790+00:00,FULL,llm_style,eval,llm_style_eval_146,64,8192,4096,bf16,NVIDIA GeForce RTX 4060,c06,64,128,32,4,3,8,0.0,0.0,308.20800364017487,448.8156872987747,13.935288004442178,1,-1,-1,64x8192x4096,0,
2026-03-03T03:39:42.012170+00:00,FULL,llm_style,eval,llm_style_eval_147,64,2048,4096,bf16,NVIDIA GeForce RTX 4060,c03,64,64,32,4,2,8,0.0,0.0,82.39999786019325,154.8623956739902,13.030847717032719,3,-1,-1,64x2048x4096,0,
2026-03-03T03:39:42.040695+00:00,FULL,llm_style,eval,llm_style_eval_148,64,1024,6144,bf16,NVIDIA GeForce RTX 4060,c04,64,64,64,4,3,8,0.0,0.0,74.75200295448303,103.2201598584652,10.773040670098917,3,-1,-1,64x1024x6144,0,
2026-03-03T03:39:42.220302+00:00,FULL,llm_style,eval,llm_style_eval_149,64,4096,8192,bf16,NVIDIA GeForce RTX 4060,c03,64,64,32,4,2,8,0.0,0.0,300.4480004310608,409.1577634215354,14.295210119015255,0,-1,-1,64x4096x8192,0,
2026-03-03T03:39:42.311192+00:00,FULL,llm_style,eval,llm_style_eval_150,2,2048,3072,bf16,NVIDIA GeForce RTX 4060,c00,32,32,32,2,2,8,0.0,90.84,54.22399938106537,124.50816109776495,0.46410859190124076,7,-1,-1,2x2048x3072,0,
2026-03-03T03:39:42.428395+00:00,FULL,llm_style,eval,llm_style_eval_151,64,4096,2048,bf16,NVIDIA GeForce RTX 4060,c04,64,64,64,4,3,8,0.0,117.164,66.56000018119812,72.24320210516451,16.13193841762204,1,-1,-1,64x4096x2048,0,
2026-03-03T03:39:43.162126+00:00,FULL,llm_style,eval,llm_style_eval_152,8,8192,8192,bf16,NVIDIA GeForce RTX 4060,c11,32,128,32,4,2,8,0.0,733.688,558.0800175666809,626.3273674249648,1.9239925999889549,4,-1,-1,8x8192x8192,0,
2026-03-03T03:39:43.259336+00:00,FULL,llm_style,eval,llm_style_eval_153,64,8192,2048,bf16,NVIDIA GeForce RTX 4060,c00,32,32,32,2,2,8,0.0,0.0,169.98399794101715,218.28608304262147,12.633445936158983,1,-1,-1,64x8192x2048,0,
2026-03-03T03:39:43.484650+00:00,FULL,llm_style,eval,llm_style_eval_154,16,2048,8192,bf16,NVIDIA GeForce RTX 4060,c10,64,128,64,8,3,8,0.0,225.261,162.81600296497345,183.2995180785656,3.2974087449837275,6,-1,-1,16x2048x8192,0,
2026-03-03T03:39:43.558792+00:00,FULL,llm_style,eval,llm_style_eval_155,4,2048,1536,bf16,NVIDIA GeForce RTX 4060,c00,32,32,32,2,2,8,0.0,74.098,39.95199874043465,119.49536211788639,0.6299015016370171,7,-1,-1,4x2048x1536,0,
2026-03-03T03:39:43.688200+00:00,FULL,llm_style,eval,llm_style_eval_156,1,4096,6144,bf16,NVIDIA GeForce RTX 4060,c11,32,128,32,4,2,8,0.0,0.0,227.32800245285034,252.54975840449328,0.2214054030164594,5,-1,-1,1x4096x6144,0,
2026-03-03T03:39:43.851810+00:00,FULL,llm_style,eval,llm_style_eval_157,1,1536,8192,bf16,NVIDIA GeForce RTX 4060,c04,64,64,64,4,3,8,0.0,163.554,84.99199897050858,91.15648105740547,0.29609638912872616,6,-1,-1,1x1536x8192,0,
2026-03-03T03:39:43.921301+00:00,FULL,llm_style,eval,llm_style_eval_158,64,1536,8192,bf16,NVIDIA GeForce RTX 4060,c04,64,64,64,4,3,8,0.0,0.0,120.84800004959106,194.43711847066862,13.327591150363023,2,-1,-1,64x1536x8192,0,
2026-03-03T03:39:44.031565+00:00,FULL,llm_style,eval,llm_style_eval_159,16,6144,1536,bf16,NVIDIA GeForce RTX 4060,c11,32,128,32,4,2,8,0.0,110.212,47.10400104522705,57.296960428357124,6.411130292521085,5,-1,-1,16x6144x1536,0,
2026-03-03T03:39:44.241292+00:00,FULL,llm_style,eval,llm_style_eval_160,32,6144,6144,bf16,NVIDIA GeForce RTX 4060,c11,32,128,32,4,2,8,0.0,0.0,329.680010676384,355.90080469846725,7.32807275467933,5,-1,-1,32x6144x6144,0,
2026-03-03T03:39:44.334308+00:00,FULL,llm_style,eval,llm_style_eval_161,2,1536,4096,bf16,NVIDIA GeForce RTX 4060,c04,64,64,64,4,3,8,0.0,92.967,56.28800019621849,64.0307193249464,0.44709039070978895,7,-1,-1,2x1536x4096,0,
2026-03-03T03:39:44.426470+00:00,FULL,llm_style,eval,llm_style_eval_162,64,1536,3072,bf16,NVIDIA GeForce RTX 4060,c04,64,64,64,4,3,8,0.0,92.117,53.999999538064,183.8431982696056,11.18481076234568,3,-1,-1,64x1536x3072,0,
2026-03-03T03:39:44.465884+00:00,FULL,llm_style,eval,llm_style_eval_163,64,1024,8192,bf16,NVIDIA GeForce RTX 4060,c04,64,64,64,4,3,8,0.0,0.0,86.01599931716919,150.5484862625599,12.483047718143249,2,-1,-1,64x1024x8192,0,
2026-03-03T03:39:44.632282+00:00,FULL,llm_style,eval,llm_style_eval_164,64,4096,8192,bf16,NVIDIA GeForce RTX 4060,c03,64,64,32,4,2,8,0.0,0.0,301.08800530433655,335.54689317941666,14.264823640711601,0,-1,-1,64x4096x8192,0,
2026-03-03T03:39:44.950025+00:00,FULL,llm_style,eval,llm_style_eval_165,4,8192,3072,bf16,NVIDIA GeForce RTX 4060,c06,64,128,32,4,3,8,0.0,317.69,230.14400154352188,282.3475223779678,0.8747853111519298,5,-1,-1,4x8192x3072,0,
2026-03-03T03:39:44.995432+00:00,FULL,llm_style,eval,llm_style_eval_166,64,1024,6144,bf16,NVIDIA GeForce RTX 4060,c04,64,64,64,4,3,8,0.0,0.0,100.89599713683128,177.37728044390673,7.981549227447293,3,-1,-1,64x1024x6144,0,
2026-03-03T03:39:45.009567+00:00,FULL,llm_style,eval,llm_style_eval_167,2,2048,1024,bf16,NVIDIA GeForce RTX 4060,c00,32,32,32,2,2,8,0.0,0.0,63.48799914121628,237.20159783959383,0.13212903404533555,7,-1,-1,2x2048x1024,0,
2026-03-03T03:39:45.086357+00:00,FULL,llm_style,eval,llm_style_eval_168,64,4096,1024,bf16,NVIDIA GeForce RTX 4060,c11,32,128,32,4,2,8,0.0,76.744,51.19999870657921,58.40480126440525,10.485760264892583,1,-1,-1,64x4096x1024,0,
2026-03-03T03:39:45.129634+00:00,FULL,llm_style,eval,llm_style_eval_169,4,1536,6144,bf16,NVIDIA GeForce RTX 4060,c04,64,64,64,4,3,8,0.0,0.0,75.77600330114365,262.5785583257672,0.996324280919954,7,-1,-1,4x1536x6144,0,
2026-03-03T03:39:45.147681+00:00,FULL,llm_style,eval,llm_style_eval_170,16,1536,1536,bf16,NVIDIA GeForce RTX 4060,c04,64,64,64,4,3,8,0.0,0.0,54.016001522541046,138.70143726468086,1.3976871643950666,7,-1,-1,16x1536x1536,0,
2026-03-03T03:39:45.248330+00:00,FULL,llm_style,eval,llm_style_eval_171,1,2048,3072,bf16,NVIDIA GeForce RTX 4060,c00,32,32,32,2,2,8,0.0,100.6,61.43999844789505,164.24928009510035,0.20480000517368332,7,-1,-1,1x2048x3072,0,
2026-03-03T03:39:45.335550+00:00,FULL,llm_style,eval,llm_style_eval_172,64,3072,2048,bf16,NVIDIA GeForce RTX 4060,c10,64,128,64,8,3,8,0.0,87.178,53.247999399900436,68.7513609230518,15.123692478134789,3,-1,-1,64x3072x2048,0,
2026-03-03T03:39:45.594243+00:00,FULL,llm_style,eval,llm_style_eval_173,64,8192,6144,bf16,NVIDIA GeForce RTX 4060,c06,64,128,32,4,3,8,0.0,0.0,440.0320053100586,549.5126312971115,14.640868996473275,1,-1,-1,64x8192x6144,0,
2026-03-03T03:39:45.835788+00:00,FULL,llm_style,eval,llm_style_eval_174,2,4096,4096,bf16,NVIDIA GeForce RTX 4060,c10,64,128,64,8,3,8,0.0,241.499,165.632002055645,217.83552289009089,0.4051684648323843,5,-1,-1,2x4096x4096,0,
2026-03-03T03:39:45.883293+00:00,FULL,llm_style,eval,llm_style_eval_175,64,4096,2048,bf16,NVIDIA GeForce RTX 4060,c04,64,64,64,4,3,8,0.0,0.0,72.1760019659996,164.02432337403295,14.87671517890135,1,-1,-1,64x4096x2048,0,
2026-03-03T03:39:45.945234+00:00,FULL,llm_style,eval,llm_style_eval_176,16,6144,2048,bf16,NVIDIA GeForce RTX 4060,c02,32,64,32,2,2,8,0.0,0.0,68.41599941253662,147.85600036382675,5.885365812930264,5,-1,-1,16x6144x2048,0,
2026-03-03T03:39:45.994588+00:00,FULL,llm_style,eval,llm_style_eval_177,1,6144,1536,bf16,NVIDIA GeForce RTX 4060,c02,32,64,32,2,2,8,0.0,0.0,49.15200173854828,142.46847584843633,0.38399998641759203,5,-1,-1,1x6144x1536,0,
2026-03-03T03:39:46.555733+00:00,FULL,llm_style,eval,llm_style_eval_178,32,6144,8192,bf16,NVIDIA GeForce RTX 4060,c00,32,32,32,2,2,8,0.0,561.093,429.05598878860474,533.0841356515884,7.507704253458383,4,-1,-1,32x6144x8192,0,
2026-03-03T03:39:46.695867+00:00,FULL,llm_style,eval,llm_style_eval_179,64,4096,6144,bf16,NVIDIA GeForce RTX 4060,c02,32,64,32,2,2,8,0.0,0.0,257.83999264240265,326.8710348010062,12.493118072910848,1,-1,-1,64x4096x6144,0,
2026-03-03T03:39:46.711960+00:00,FULL,llm_style,eval,llm_style_eval_180,64,2048,1536,bf16,NVIDIA GeForce RTX 4060,c11,32,128,32,4,2,8,0.0,0.0,52.239999175071716,176.23040340840794,7.707756323858082,3,-1,-1,64x2048x1536,0,
2026-03-03T03:39:46.736723+00:00,FULL,llm_style,eval,llm_style_eval_181,64,2048,3072,bf16,NVIDIA GeForce RTX 4060,c03,64,64,32,4,2,8,0.0,0.0,60.38400158286095,91.0233608633279,13.33641936424057,3,-1,-1,64x2048x3072,0,
2026-03-03T03:39:46.805846+00:00,FULL,llm_style,eval,llm_style_eval_182,32,3072,1536,bf16,NVIDIA GeForce RTX 4060,c00,32,32,32,2,2,8,0.0,69.076,42.368000373244286,143.3900761604309,7.12778241454862,7,-1,-1,32x3072x1536,0,
2026-03-03T03:39:46.890463+00:00,FULL,llm_style,eval,llm_style_eval_183,8,8192,2048,bf16,NVIDIA GeForce RTX 4060,c11,32,128,32,4,2,8,0.0,0.0,159.743994474411,200.89792639017097,1.6804103145361124,5,-1,-1,8x8192x2048,0,
2026-03-03T03:39:46.923350+00:00,FULL,llm_style,eval,llm_style_eval_184,64,8192,1024,bf16,NVIDIA GeForce RTX 4060,c06,64,128,32,4,3,8,0.0,0.0,66.25599786639214,95.58688156306735,16.20595657113554,1,-1,-1,64x8192x1024,0,
2026-03-03T03:39:46.982347+00:00,FULL,llm_style,eval,llm_style_eval_185,1,8192,1536,bf16,NVIDIA GeForce RTX 4060,c11,32,128,32,4,2,8,0.0,0.0,60.336001217365265,111.83456353843196,0.41709466143336393,5,-1,-1,1x8192x1536,0,
2026-03-03T03:39:47.009323+00:00,FULL,llm_style,eval,llm_style_eval_186,16,6144,1024,bf16,NVIDIA GeForce RTX 4060,c11,32,128,32,4,2,8,0.0,0.0,27.552000246942043,178.14848117530317,7.307149760291722,5,-1,-1,16x6144x1024,0,
2026-03-03T03:39:47.037014+00:00,FULL,llm_style,eval,llm_style_eval_187,1,1024,6144,bf16,NVIDIA GeForce RTX 4060,c04,64,64,64,4,3,8,0.0,0.0,71.27999886870384,83.39295759797096,0.1765279489296491,7,-1,-1,1x1024x6144,0,
2026-03-03T03:39:47.442915+00:00,FULL,llm_style,eval,llm_style_eval_188,8,8192,4096,bf16,NVIDIA GeForce RTX 4060,c10,64,128,64,8,3,8,0.0,405.851,294.8480099439621,309.4118404388428,1.8208395305162004,5,-1,-1,8x8192x4096,0,
2026-03-03T03:39:47.689353+00:00,FULL,llm_style,eval,llm_style_eval_189,8,2048,8192,bf16,NVIDIA GeForce RTX 4060,c06,64,128,32,4,3,8,0.0,246.394,161.6000011563301,168.89120057225227,1.6611104831634156,6,-1,-1,8x2048x8192,0,
2026-03-03T03:39:47.919348+00:00,FULL,llm_style,eval,llm_style_eval_190,4,8192,2048,bf16,NVIDIA GeForce RTX 4060,c11,32,128,32,4,2,8,0.0,229.952,160.76800227165222,173.54176223278046,0.8348534913882316,5,-1,-1,4x8192x2048,0,
2026-03-03T03:39:48.251301+00:00,FULL,llm_style,eval,llm_style_eval_191,4,8192,8192,bf16,NVIDIA GeForce RTX 4060,c11,32,128,32,4,2,8,0.0,0.0,581.4879834651947,1549.9776542186703,0.9232708624530582,4,-1,-1,4x8192x8192,0,
2026-03-03T03:39:48.263825+00:00,FULL,llm_style,eval,llm_style_eval_192,64,1536,1024,bf16,NVIDIA GeForce RTX 4060,c04,64,64,64,4,3,8,0.0,0.0,60.095999389886856,163.37663844227788,3.3500831011037295,3,-1,-1,64x1536x1024,0,
2026-03-03T03:39:48.282303+00:00,FULL,llm_style,eval,llm_style_eval_193,32,2048,2048,bf16,NVIDIA GeForce RTX 4060,c11,32,128,32,4,2,8,0.0,0.0,69.12000104784966,118.38463902473447,3.883614755939752,7,-1,-1,32x2048x2048,0,
2026-03-03T03:39:48.295139+00:00,FULL,llm_style,eval,llm_style_eval_194,8,1024,2048,bf16,NVIDIA GeForce RTX 4060,c04,64,64,64,4,3,8,0.0,0.0,55.296000093221664,160.51968678832054,0.6068148137918061,7,-1,-1,8x1024x2048,0,
2026-03-03T03:39:48.329678+00:00,FULL,llm_style,eval,llm_style_eval_195,2,4096,2048,bf16,NVIDIA GeForce RTX 4060,c11,32,128,32,4,2,8,0.0,0.0,49.59999956190586,149.7724810242652,0.6765006511365115,5,-1,-1,2x4096x2048,0,
2026-03-03T03:39:48.376010+00:00,FULL,llm_style,eval,llm_style_eval_196,32,2048,4096,bf16,NVIDIA GeForce RTX 4060,c11,32,128,32,4,2,8,0.0,0.0,74.62400197982788,162.72480115294445,7.194346292833843,7,-1,-1,32x2048x4096,0,
2026-03-03T03:39:48.522929+00:00,FULL,llm_style,eval,llm_style_eval_197,32,8192,1536,bf16,NVIDIA GeForce RTX 4060,c11,32,128,32,4,2,8,0.0,146.867,69.63200122117996,77.39584028720856,11.565176267762501,5,-1,-1,32x8192x1536,0,
2026-03-03T03:39:48.697364+00:00,FULL,llm_style,eval,llm_style_eval_198,64,4096,8192,bf16,NVIDIA GeForce RTX 4060,c03,64,64,32,4,2,8,0.0,0.0,322.160005569458,403.87200504541397,13.331783032496878,0,-1,-1,64x4096x8192,0,
2026-03-03T03:39:49.096253+00:00,FULL,llm_style,eval,llm_style_eval_199,2,8192,4096,bf16,NVIDIA GeForce RTX 4060,c11,32,128,32,4,2,8,0.0,398.838,291.83998703956604,397.328639626503,0.4599017748099184,5,-1,-1,2x8192x4096,0,
2026-03-03T03:39:49.177633+00:00,FULL,llm_style,eval,llm_style_eval_200,1,4096,1024,bf16,NVIDIA GeForce RTX 4060,c11,32,128,32,4,2,8,0.0,81.336,41.840000078082085,49.694720022380345,0.200492542646872,5,-1,-1,1x4096x1024,0,
2026-03-03T03:39:49.354394+00:00,FULL,llm_style,eval,llm_style_eval_201,4,1536,8192,bf16,NVIDIA GeForce RTX 4060,c04,64,64,64,4,3,8,0.0,176.717,86.03199943900108,172.9072008281943,1.1700680753255408,6,-1,-1,4x1536x8192,0,
2026-03-03T03:39:49.597338+00:00,FULL,llm_style,eval,llm_style_eval_202,1,6144,3072,bf16,NVIDIA GeForce RTX 4060,c06,64,128,32,4,3,8,0.0,242.899,176.12800002098083,255.06655976176256,0.2143255813698178,5,-1,-1,1x6144x3072,0,
2026-03-03T03:39:49.789130+00:00,FULL,llm_style,eval,llm_style_eval_203,16,2048,6144,bf16,NVIDIA GeForce RTX 4060,c00,32,32,32,2,2,8,0.0,191.738,100.3040000796318,150.46368137001988,4.014328278835658,7,-1,-1,16x2048x6144,0,
2026-03-03T03:39:49.806484+00:00,FULL,llm_style,eval,llm_style_eval_204,16,1536,1024,bf16,NVIDIA GeForce RTX 4060,c04,64,64,64,4,3,8,0.0,0.0,60.44800020754337,364.77952152490565,0.832643723980782,7,-1,-1,16x1536x1024,0,
2026-03-03T03:39:49.873991+00:00,FULL,llm_style,eval,llm_style_eval_205,64,6144,2048,bf16,NVIDIA GeForce RTX 4060,c10,64,128,64,8,3,8,0.0,0.0,101.1040024459362,181.85215830802917,15.93025693380685,1,-1,-1,64x6144x2048,0,
2026-03-03T03:39:49.943310+00:00,FULL,llm_style,eval,llm_style_eval_206,4,2048,6144,bf16,NVIDIA GeForce RTX 4060,c00,32,32,32,2,2,8,0.0,0.0,85.50399914383888,255.201276540756,1.1772934249620235,7,-1,-1,4x2048x6144,0,
2026-03-03T03:39:50.055954+00:00,FULL,llm_style,eval,llm_style_eval_207,32,6144,1536,bf16,NVIDIA GeForce RTX 4060,c11,32,128,32,4,2,8,0.0,112.589,47.82399907708168,54.14656061679125,12.629219380556583,5,-1,-1,32x6144x1536,0,
2026-03-03T03:39:50.108720+00:00,FULL,llm_style,eval,llm_style_eval_208,4,2048,1024,bf16,NVIDIA GeForce RTX 4060,c00,32,32,32,2,2,8,0.0,52.722,32.71999955177307,75.71648154407731,0.512751107268608,7,-1,-1,4x2048x1024,0,
2026-03-03T03:39:50.161997+00:00,FULL,llm_style,eval,llm_style_eval_209,1,1024,1536,bf16,NVIDIA GeForce RTX 4060,c00,32,32,32,2,2,8,0.0,53.241,35.840000957250595,89.46688018739205,0.08777142622714144,7,-1,-1,1x1024x1536,0,
2026-03-03T03:39:50.477780+00:00,FULL,llm_style,eval,llm_style_eval_210,8,6144,4096,bf16,NVIDIA GeForce RTX 4060,c06,64,128,32,4,3,8,0.0,315.745,228.28799486160278,242.6310394704342,1.7637948252342586,5,-1,-1,8x6144x4096,0,
2026-03-03T03:39:50.726291+00:00,FULL,llm_style,eval,llm_style_eval_211,4,2048,8192,bf16,NVIDIA GeForce RTX 4060,c04,64,64,64,4,3,8,0.0,248.47,162.81600296497345,244.66431707143772,0.8243521862459319,6,-1,-1,4x2048x8192,0,
2026-03-03T03:39:50.785687+00:00,FULL,llm_style,eval,llm_style_eval_212,32,1024,1024,bf16,NVIDIA GeForce RTX 4060,c04,64,64,64,4,3,8,0.0,59.35,35.679999738931656,41.61152012646198,1.8808538254212834,7,-1,-1,32x1024x1024,0,
2026-03-03T03:39:50.854147+00:00,FULL,llm_style,eval,llm_style_eval_213,16,3072,4096,bf16,NVIDIA GeForce RTX 4060,c00,32,32,32,2,2,8,0.0,0.0,97.98400104045868,106.4489584416151,4.109376834221538,7,-1,-1,16x3072x4096,0,
2026-03-03T03:39:50.904881+00:00,FULL,llm_style,eval,llm_style_eval_214,64,1024,8192,bf16,NVIDIA GeForce RTX 4060,c04,64,64,64,4,3,8,0.0,0.0,85.87199822068214,116.14016138017178,12.503980881411362,2,-1,-1,64x1024x8192,0,
2026-03-03T03:39:50.928893+00:00,FULL,llm_style,eval,llm_style_eval_215,4,4096,1536,bf16,NVIDIA GeForce RTX 4060,c11,32,128,32,4,2,8,0.0,0.0,43.935999274253845,59.86944019794461,1.1455673896438257,5,-1,-1,4x4096x1536,0,
2026-03-03T03:39:51.019965+00:00,FULL,llm_style,eval,llm_style_eval_216,16,1536,3072,bf16,NVIDIA GeForce RTX 4060,c04,64,64,64,4,3,8,0.0,91.017,55.31200021505356,73.27679842710492,2.729876761153643,7,-1,-1,16x1536x3072,0,
2026-03-03T03:39:51.078533+00:00,FULL,llm_style,eval,llm_style_eval_217,8,6144,2048,bf16,NVIDIA GeForce RTX 4060,c11,32,128,32,4,2,8,0.0,0.0,63.439998775720596,96.86015918850897,3.173496152037295,5,-1,-1,8x6144x2048,0,
2026-03-03T03:39:51.227820+00:00,FULL,llm_style,eval,llm_style_eval_218,8,3072,4096,bf16,NVIDIA GeForce RTX 4060,c00,32,32,32,2,2,8,0.0,149.232,66.94399937987328,162.62975886464113,3.007388173174023,7,-1,-1,8x3072x4096,0,
2026-03-03T03:39:51.552630+00:00,FULL,llm_style,eval,llm_style_eval_219,64,8192,3072,bf16,NVIDIA GeForce RTX 4060,c10,64,128,64,8,3,8,0.0,324.765,234.49599742889404,291.87902987003315,13.736803644065475,1,-1,-1,64x8192x3072,0,
2026-03-03T03:39:51.593772+00:00,FULL,llm_style,eval,llm_style_eval_220,2,4096,2048,bf16,NVIDIA GeForce RTX 4060,c11,32,128,32,4,2,8,0.0,0.0,55.616000667214394,242.8985646367072,0.6033233529461661,5,-1,-1,2x4096x2048,0,
2026-03-03T03:39:51.764131+00:00,FULL,llm_style,eval,llm_style_eval_221,4,1024,8192,bf16,NVIDIA GeForce RTX 4060,c00,32,32,32,2,2,8,0.0,170.307,92.25600212812424,241.70495972037315,0.727420031780695,6,-1,-1,4x1024x8192,0,
2026-03-03T03:39:51.827362+00:00,FULL,llm_style,eval,llm_style_eval_222,64,6144,2048,bf16,NVIDIA GeForce RTX 4060,c10,64,128,64,8,3,8,0.0,0.0,84.35199782252312,162.83647552132607,19.09394889957123,1,-1,-1,64x6144x2048,0,
2026-03-03T03:39:51.897501+00:00,FULL,llm_style,eval,llm_style_eval_223,4,2048,2048,bf16,NVIDIA GeForce RTX 4060,c00,32,32,32,2,2,8,0.0,70.086,44.015999883413315,126.87360405921933,0.7623235207396577,7,-1,-1,4x2048x2048,0,
2026-03-03T03:39:51.916137+00:00,FULL,llm_style,eval,llm_style_eval_224,16,3072,1536,bf16,NVIDIA GeForce RTX 4060,c11,32,128,32,4,2,8,0.0,0.0,46.08000069856644,122.2768026590347,3.2767999503241656,7,-1,-1,16x3072x1536,0,
2026-03-03T03:39:51.935831+00:00,FULL,llm_style,eval,llm_style_eval_225,1,2048,2048,bf16,NVIDIA GeForce RTX 4060,c00,32,32,32,2,2,8,0.0,0.0,72.59200140833855,154.45631861686707,0.11555829619317276,7,-1,-1,1x2048x2048,0,
2026-03-03T03:39:51.944565+00:00,FULL,llm_style,eval,llm_style_eval_226,8,1536,1024,bf16,NVIDIA GeForce RTX 4060,c04,64,64,64,4,3,8,0.0,0.0,35.56800074875355,45.09696036577224,0.7075411456991132,7,-1,-1,8x1536x1024,0,
2026-03-03T03:39:52.129823+00:00,FULL,llm_style,eval,llm_style_eval_227,64,6144,6144,bf16,NVIDIA GeForce RTX 4060,c11,32,128,32,4,2,8,0.0,0.0,358.39998722076416,428.91263574361784,13.481691909279355,1,-1,-1,64x6144x6144,0,
2026-03-03T03:39:52.195756+00:00,FULL,llm_style,eval,llm_style_eval_228,64,6144,2048,bf16,NVIDIA GeForce RTX 4060,c10,64,128,64,8,3,8,0.0,0.0,96.57600149512291,185.83808407187453,16.67715282332678,1,-1,-1,64x6144x2048,0,
2026-03-03T03:39:52.370542+00:00,FULL,llm_style,eval,llm_style_eval_229,16,1536,8192,bf16,NVIDIA GeForce RTX 4060,c04,64,64,64,4,3,8,0.0,174.733,88.06400001049042,102.58432112634179,4.57227906922278,6,-1,-1,16x1536x8192,0,
2026-03-03T03:39:52.399498+00:00,FULL,llm_style,eval,llm_style_eval_230,64,2048,1536,bf16,NVIDIA GeForce RTX 4060,c11,32,128,32,4,2,8,0.0,0.0,69.63200122117996,730.1203286647797,5.782588133881251,3,-1,-1,64x2048x1536,0,
2026-03-03T03:39:52.446485+00:00,FULL,llm_style,eval,llm_style_eval_231,4,1024,8192,bf16,NVIDIA GeForce RTX 4060,c00,32,32,32,2,2,8,0.0,0.0,93.1680016219616,222.38080620765678,0.7202994894352341,6,-1,-1,4x1024x8192,0,
2026-03-03T03:39:52.468903+00:00,FULL,llm_style,eval,llm_style_eval_232,16,3072,1536,bf16,NVIDIA GeForce RTX 4060,c11,32,128,32,4,2,8,0.0,0.0,54.68800105154514,62.38655805587768,2.7610251078236074,7,-1,-1,16x3072x1536,0,
2026-03-03T03:39:52.520958+00:00,FULL,llm_style,eval,llm_style_eval_233,64,3072,3072,bf16,NVIDIA GeForce RTX 4060,c03,64,64,32,4,2,8,0.0,0.0,88.76799792051315,189.62431699037546,13.608052229381823,3,-1,-1,64x3072x3072,0,
2026-03-03T03:39:52.697896+00:00,FULL,llm_style,eval,llm_style_eval_234,32,8192,4096,bf16,NVIDIA GeForce RTX 4060,c11,32,128,32,4,2,8,0.0,0.0,297.9840040206909,405.002239048481,7.206707806540135,5,-1,-1,32x8192x4096,0,
2026-03-03T03:39:52.712943+00:00,FULL,llm_style,eval,llm_style_eval_235,4,2048,1024,bf16,NVIDIA GeForce RTX 4060,c00,32,32,32,2,2,8,0.0,0.0,38.91199827194214,644.0038576722126,0.43115791388429847,7,-1,-1,4x2048x1024,0,
2026-03-03T03:39:52.837975+00:00,FULL,llm_style,eval,llm_style_eval_236,4,8192,3072,bf16,NVIDIA GeForce RTX 4060,c06,64,128,32,4,3,8,0.0,0.0,259.74398851394653,356.75233006477345,0.7750962520897383,5,-1,-1,4x8192x3072,0,
2026-03-03T03:39:52.859944+00:00,FULL,llm_style,eval,llm_style_eval_237,64,1024,4096,bf16,NVIDIA GeForce RTX 4060,c04,64,64,64,4,3,8,0.0,0.0,71.42399996519089,193.44384208321563,7.516673838788765,3,-1,-1,64x1024x4096,0,
2026-03-03T03:39:53.042213+00:00,FULL,llm_style,eval,llm_style_eval_238,32,2048,6144,bf16,NVIDIA GeForce RTX 4060,c04,64,64,64,4,3,8,0.0,182.212,105.47199845314026,121.49760007858274,7.635262247901621,7,-1,-1,32x2048x6144,0,
2026-03-03T03:39:53.051831+00:00,FULL,llm_style,eval,llm_style_eval_239,32,2048,6144,bf16,NVIDIA GeForce RTX 4060,c04,64,64,64,4,3,8,0.0,0.0,128.00000607967377,134.13312047719955,6.2914557011718895,7,-1,-1,32x2048x6144,0,
2026-03-03T03:39:53.199509+00:00,FULL,llm_style,eval,llm_style_eval_240,8,8192,1536,bf16,NVIDIA GeForce RTX 4060,c11,32,128,32,4,2,8,0.0,147.642,59.39200147986412,67.01951988041401,3.3897930189851655,5,-1,-1,8x8192x1536,0,
2026-03-03T03:39:53.214088+00:00,FULL,llm_style,eval,llm_style_eval_241,16,1536,1536,bf16,NVIDIA GeForce RTX 4060,c04,64,64,64,4,3,8,0.0,0.0,63.48799914121628,177.87583827972412,1.18916130640802,7,-1,-1,16x1536x1536,0,
2026-03-03T03:39:53.237740+00:00,FULL,llm_style,eval,llm_style_eval_242,1,2048,3072,bf16,NVIDIA GeForce RTX 4060,c00,32,32,32,2,2,8,0.0,0.0,51.19999870657921,104.96032118797291,0.24576000620841995,7,-1,-1,1x2048x3072,0,
2026-03-03T03:39:53.274843+00:00,FULL,llm_style,eval,llm_style_eval_243,8,1536,6144,bf16,NVIDIA GeForce RTX 4060,c00,32,32,32,2,2,8,0.0,0.0,71.68000191450119,175.5955196917056,2.106514229451395,7,-1,-1,8x1536x6144,0,
2026-03-03T03:39:53.318573+00:00,FULL,llm_style,eval,llm_style_eval_244,32,8192,1024,bf16,NVIDIA GeForce RTX 4060,c11,32,128,32,4,2,8,0.0,0.0,55.456001311540604,139.4892823696136,9.681024583506622,5,-1,-1,32x8192x1024,0,
2026-03-03T03:39:53.438702+00:00,FULL,llm_style,eval,llm_style_eval_245,4,6144,4096,bf16,NVIDIA GeForce RTX 4060,c11,32,128,32,4,2,8,0.0,0.0,227.02399641275406,247.84895449876785,0.8868075409701034,5,-1,-1,4x6144x4096,0,
2026-03-03T03:39:53.503712+00:00,FULL,llm_style,eval,llm_style_eval_246,32,2048,6144,bf16,NVIDIA GeForce RTX 4060,c04,64,64,64,4,3,8,0.0,0.0,109.15200039744377,209.6844801306724,7.377843420805135,7,-1,-1,32x2048x6144,0,
2026-03-03T03:39:53.572151+00:00,FULL,llm_style,eval,llm_style_eval_247,64,6144,2048,bf16,NVIDIA GeForce RTX 4060,c10,64,128,64,8,3,8,0.0,0.0,99.7919999063015,177.97664076089853,16.139697946852106,1,-1,-1,64x6144x2048,0,
2026-03-03T03:39:53.580916+00:00,FULL,llm_style,eval,llm_style_eval_248,64,1024,1024,bf16,NVIDIA GeForce RTX 4060,c04,64,64,64,4,3,8,0.0,0.0,41.98399931192398,106.01471863687038,3.1968781011741414,3,-1,-1,64x1024x1024,0,
2026-03-03T03:39:53.692503+00:00,FULL,llm_style,eval,llm_style_eval_249,2,8192,1024,bf16,NVIDIA GeForce RTX 4060,c11,32,128,32,4,2,8,0.0,111.548,49.07200112938881,83.97824030369509,0.6837795734379484,5,-1,-1,2x8192x1024,0,
2026-03-03T03:39:53.746283+00:00,FULL,llm_style,eval,llm_style_eval_250,64,3072,3072,bf16,NVIDIA GeForce RTX 4060,c03,64,64,32,4,2,8,0.0,0.0,53.61600033938885,223.53408172726608,22.529833339928864,3,-1,-1,64x3072x3072,0,
2026-03-03T03:39:53.792074+00:00,FULL,llm_style,eval,llm_style_eval_251,64,1024,8192,bf16,NVIDIA GeForce RTX 4060,c04,64,64,64,4,3,8,0.0,0.0,85.4399986565113,176.39423996210093,12.567203193865817,2,-1,-1,64x1024x8192,0,
2026-03-03T03:39:53.858820+00:00,FULL,llm_style,eval,llm_style_eval_252,64,4096,3072,bf16,NVIDIA GeForce RTX 4060,c04,64,64,64,4,3,8,0.0,0.0,88.06400001049042,173.04383873939514,18.28911627689112,1,-1,-1,64x4096x3072,0,
2026-03-03T03:39:53.983414+00:00,FULL,llm_style,eval,llm_style_eval_253,8,6144,4096,bf16,NVIDIA GeForce RTX 4060,c06,64,128,32,4,3,8,0.0,0.0,232.89600014686584,400.67425072193134,1.7288969486212047,5,-1,-1,8x6144x4096,0,
2026-03-03T03:39:54.063750+00:00,FULL,llm_style,eval,llm_style_eval_254,4,1536,3072,bf16,NVIDIA GeForce RTX 4060,c00,32,32,32,2,2,8,0.0,80.285,47.9040015488863,53.737599328160286,0.7880079905532987,7,-1,-1,4x1536x3072,0,
2026-03-03T03:39:54.089292+00:00,FULL,llm_style,eval,llm_style_eval_255,1,3072,1536,bf16,NVIDIA GeForce RTX 4060,c11,32,128,32,4,2,8,0.0,0.0,47.47200012207031,343.004174232482,0.19879474165261762,7,-1,-1,1x3072x1536,0,
2026-03-03T03:39:54.177954+00:00,BUCKET,llm_style,tune,llm_style_tune_000,32,3072,2048,bf16,NVIDIA GeForce RTX 4060,c11,32,128,32,4,2,8,0.0,86.135,51.19999870657921,60.37855934351682,7.864320198669438,7,-1,-1,llm8_g7,0,
2026-03-03T03:39:54.258905+00:00,BUCKET,llm_style,tune,llm_style_tune_001,4,4096,1536,bf16,NVIDIA GeForce RTX 4060,c00,32,32,32,2,2,8,0.0,80.904,43.03999990224838,109.60895985364914,1.1694156160388538,5,-1,-1,llm8_g5,0,
2026-03-03T03:39:54.290338+00:00,BUCKET,llm_style,tune,llm_style_tune_002,8,8192,1024,bf16,NVIDIA GeForce RTX 4060,c00,32,32,32,2,2,8,0.0,0.0,51.19999870657921,106.2777629122136,2.621440066223146,5,-1,-1,llm8_g5,0,
2026-03-03T03:39:54.386640+00:00,BUCKET,llm_style,tune,llm_style_tune_003,64,1024,4096,bf16,NVIDIA GeForce RTX 4060,c04,64,64,64,4,3,8,0.0,96.244,56.97600170969963,62.91711982339619,9.422755123032838,3,-1,-1,llm8_g3,0,
2026-03-03T03:39:54.450474+00:00,BUCKET,llm_style,tune,llm_style_tune_004,16,3072,4096,bf16,NVIDIA GeForce RTX 4060,c11,32,128,32,4,2,8,0.0,0.0,81.91999793052673,131.23583972454068,4.9152001241684,7,-1,-1,llm8_g7,0,
2026-03-03T03:39:54.476873+00:00,BUCKET,llm_style,tune,llm_style_tune_005,16,1536,4096,bf16,NVIDIA GeForce RTX 4060,c11,32,128,32,4,2,8,0.0,0.0,81.90399780869484,181.50463670492155,2.458080159533157,7,-1,-1,llm8_g7,0,
2026-03-03T03:39:54.490040+00:00,BUCKET,llm_style,tune,llm_style_tune_006,2,2048,1024,bf16,NVIDIA GeForce RTX 4060,c11,32,128,32,4,2,8,0.0,0.0,48.128001391887665,88.46271976828567,0.1742978672996374,7,-1,-1,llm8_g7,0,
2026-03-03T03:39:54.515455+00:00,BUCKET,llm_style,tune,llm_style_tune_007,32,6144,1024,bf16,NVIDIA GeForce RTX 4060,c00,32,32,32,2,2,8,0.0,0.0,50.27199909090996,95.22559914737926,8.0094921881236,5,-1,-1,llm8_g5,0,
2026-03-03T03:39:54.532292+00:00,BUCKET,llm_style,tune,llm_style_tune_008,8,1536,2048,bf16,NVIDIA GeForce RTX 4060,c11,32,128,32,4,2,8,0.0,0.0,71.16800174117088,171.05728551745412,0.7072230042800682,7,-1,-1,llm8_g7,0,
2026-03-03T03:39:54.561979+00:00,BUCKET,llm_style,tune,llm_style_tune_009,16,1024,6144,bf16,NVIDIA GeForce RTX 4060,c11,32,128,32,4,2,8,0.0,0.0,108.5279993712902,145.40864333510396,1.8550659107907463,7,-1,-1,llm8_g7,0,
2026-03-03T03:39:54.577096+00:00,BUCKET,llm_style,tune,llm_style_tune_010,64,1536,2048,bf16,NVIDIA GeForce RTX 4060,c04,64,64,64,4,3,8,0.0,0.0,37.79200091958046,61.350719444453716,10.654455286895933,3,-1,-1,llm8_g3,0,
2026-03-03T03:39:54.603555+00:00,BUCKET,llm_style,tune,llm_style_tune_011,64,1536,4096,bf16,NVIDIA GeForce RTX 4060,c04,64,64,64,4,3,8,0.0,0.0,60.20800024271011,71.60672105848788,13.375404676349556,3,-1,-1,llm8_g3,0,
2026-03-03T03:39:54.614895+00:00,BUCKET,llm_style,tune,llm_style_tune_012,32,1024,2048,bf16,NVIDIA GeForce RTX 4060,c11,32,128,32,4,2,8,0.0,0.0,45.98399996757507,58.26304018497467,2.918791929685143,7,-1,-1,llm8_g7,0,
2026-03-03T03:39:54.624598+00:00,BUCKET,llm_style,tune,llm_style_tune_013,64,1536,1024,bf16,NVIDIA GeForce RTX 4060,c04,64,64,64,4,3,8,0.0,0.0,31.648000702261925,116.78560145199296,6.361431608082937,3,-1,-1,llm8_g3,0,
2026-03-03T03:39:54.723338+00:00,BUCKET,llm_style,tune,llm_style_tune_014,4,6144,3072,bf16,NVIDIA GeForce RTX 4060,c00,32,32,32,2,2,8,0.0,0.0,182.20800161361694,299.5718321204185,0.8286954615757978,5,-1,-1,llm8_g5,0,
2026-03-03T03:39:54.749318+00:00,BUCKET,llm_style,tune,llm_style_tune_015,1,6144,1024,bf16,NVIDIA GeForce RTX 4060,c00,32,32,32,2,2,8,0.0,0.0,55.10399863123894,170.42240008711812,0.22834843772783192,5,-1,-1,llm8_g5,0,
2026-03-03T03:39:54.915662+00:00,BUCKET,llm_style,tune,llm_style_tune_016,4,8192,4096,bf16,NVIDIA GeForce RTX 4060,c00,32,32,32,2,2,8,0.0,0.0,308.6239993572235,343.92126858234406,0.869781535328021,5,-1,-1,llm8_g5,0,
2026-03-03T03:39:54.934534+00:00,BUCKET,llm_style,tune,llm_style_tune_017,64,1536,2048,bf16,NVIDIA GeForce RTX 4060,c04,64,64,64,4,3,8,0.0,0.0,78.84799689054489,87.43679888546467,5.106701500089527,3,-1,-1,llm8_g3,0,
2026-03-03T03:39:55.122349+00:00,BUCKET,llm_style,tune,llm_style_tune_018,64,8192,1536,bf16,NVIDIA GeForce RTX 4060,c04,64,64,64,4,3,8,0.0,187.767,113.66400122642517,127.51872211694717,14.169945793053401,1,-1,-1,llm8_g1,0,
2026-03-03T03:39:55.137155+00:00,BUCKET,llm_style,tune,llm_style_tune_019,2,1536,1024,bf16,NVIDIA GeForce RTX 4060,c11,32,128,32,4,2,8,0.0,0.0,45.05600035190582,114.4729577004909,0.13963636254574643,7,-1,-1,llm8_g7,0,
2026-03-03T03:39:55.147545+00:00,BUCKET,llm_style,tune,llm_style_tune_020,16,1024,1536,bf16,NVIDIA GeForce RTX 4060,c11,32,128,32,4,2,8,0.0,0.0,54.60800044238567,110.24223871529085,0.9216900013232044,7,-1,-1,llm8_g7,0,
2026-03-03T03:39:55.183886+00:00,BUCKET,llm_style,tune,llm_style_tune_021,1,6144,1536,bf16,NVIDIA GeForce RTX 4060,c00,32,32,32,2,2,8,0.0,0.0,57.34400078654289,111.92320048809046,0.32914285262826154,5,-1,-1,llm8_g5,0,
2026-03-03T03:39:55.264417+00:00,BUCKET,llm_style,tune,llm_style_tune_022,8,4096,4096,bf16,NVIDIA GeForce RTX 4060,c00,32,32,32,2,2,8,0.0,0.0,160.76800227165222,175.53567856550217,1.6697069827764632,5,-1,-1,llm8_g5,0,
2026-03-03T03:39:55.703382+00:00,BUCKET,llm_style,tune,llm_style_tune_023,2,4096,8192,bf16,NVIDIA GeForce RTX 4060,c02,32,64,32,2,2,8,0.0,438.914,294.92799937725067,310.35392820835114,0.4550864220535343,4,-1,-1,llm8_g4,0,
2026-03-03T03:39:55.727788+00:00,BUCKET,llm_style,tune,llm_style_tune_024,64,1536,2048,bf16,NVIDIA GeForce RTX 4060,c04,64,64,64,4,3,8,0.0,0.0,53.120000287890434,455.21727740764607,7.580067428798403,3,-1,-1,llm8_g3,0,
2026-03-03T03:39:55.756064+00:00,BUCKET,llm_style,tune,llm_style_tune_025,4,4096,1536,bf16,NVIDIA GeForce RTX 4060,c00,32,32,32,2,2,8,0.0,0.0,48.00000041723251,133.2633602619171,1.0485759908854166,5,-1,-1,llm8_g5,0,
2026-03-03T03:39:55.781969+00:00,BUCKET,llm_style,tune,llm_style_tune_026,4,3072,2048,bf16,NVIDIA GeForce RTX 4060,c11,32,128,32,4,2,8,0.0,0.0,55.296000093221664,116.2528020888567,0.9102222206877092,7,-1,-1,llm8_g7,0,
2026-03-03T03:39:55.800471+00:00,BUCKET,llm_style,tune,llm_style_tune_027,8,4096,1024,bf16,NVIDIA GeForce RTX 4060,c00,32,32,32,2,2,8,0.0,0.0,52.22399905323982,123.50464075803754,1.2850196311390436,5,-1,-1,llm8_g5,0,
2026-03-03T03:39:55.812105+00:00,BUCKET,llm_style,tune,llm_style_tune_028,16,1536,1024,bf16,NVIDIA GeForce RTX 4060,c11,32,128,32,4,2,8,0.0,0.0,67.58400052785873,115.19392162561417,0.7447272669106476,7,-1,-1,llm8_g7,0,
2026-03-03T03:39:56.224116+00:00,BUCKET,llm_style,tune,llm_style_tune_029,64,4096,8192,bf16,NVIDIA GeForce RTX 4060,c03,64,64,32,4,2,8,0.0,411.957,300.8799999952316,346.7702364921569,14.274685243512586,0,-1,-1,llm8_g0,0,
2026-03-03T03:39:56.290162+00:00,BUCKET,llm_style,tune,llm_style_tune_030,1,8192,1536,bf16,NVIDIA GeForce RTX 4060,c00,32,32,32,2,2,8,0.0,0.0,75.18400251865387,171.02496087551114,0.3347231213682208,5,-1,-1,llm8_g5,0,
2026-03-03T03:39:56.548277+00:00,BUCKET,llm_style,tune,llm_style_tune_031,1,8192,6144,bf16,NVIDIA GeForce RTX 4060,c00,32,32,32,2,2,8,0.0,0.0,450.5600035190582,545.484805703163,0.22341818007319428,5,-1,-1,llm8_g5,0,
2026-03-03T03:39:56.857907+00:00,BUCKET,llm_style,tune,llm_style_tune_032,32,3072,8192,bf16,NVIDIA GeForce RTX 4060,c06,64,128,32,4,3,8,0.0,309.574,229.37600314617157,344.1459172964096,7.021714189402912,6,-1,-1,llm8_g6,0,
2026-03-03T03:39:56.906904+00:00,BUCKET,llm_style,tune,llm_style_tune_033,4,1536,6144,bf16,NVIDIA GeForce RTX 4060,c11,32,128,32,4,2,8,0.0,0.0,130.048006772995,293.8150295615195,0.5805354028361576,7,-1,-1,llm8_g7,0,
2026-03-03T03:39:56.941457+00:00,BUCKET,llm_style,tune,llm_style_tune_034,1,4096,1536,bf16,NVIDIA GeForce RTX 4060,c00,32,32,32,2,2,8,0.0,0.0,55.296000093221664,202.8505532443521,0.2275555551719273,5,-1,-1,llm8_g5,0,
2026-03-03T03:39:56.968580+00:00,BUCKET,llm_style,tune,llm_style_tune_035,4,1536,4096,bf16,NVIDIA GeForce RTX 4060,c11,32,128,32,4,2,8,0.0,0.0,71.08800113201141,137.8755216300487,0.7080188948699432,7,-1,-1,llm8_g7,0,
2026-03-03T03:39:57.091724+00:00,BUCKET,llm_style,tune,llm_style_tune_036,32,8192,3072,bf16,NVIDIA GeForce RTX 4060,c00,32,32,32,2,2,8,0.0,0.0,230.83200305700302,302.4012878537176,6.977423904268013,5,-1,-1,llm8_g5,0,
2026-03-03T03:39:57.116487+00:00,BUCKET,llm_style,tune,llm_style_tune_037,32,3072,2048,bf16,NVIDIA GeForce RTX 4060,c11,32,128,32,4,2,8,0.0,0.0,54.207999259233475,147.30240136384958,7.427929263251944,7,-1,-1,llm8_g7,0,
2026-03-03T03:39:57.150845+00:00,BUCKET,llm_style,tune,llm_style_tune_038,2,2048,4096,bf16,NVIDIA GeForce RTX 4060,c11,32,128,32,4,2,8,0.0,0.0,74.28799942135811,118.8160028308629,0.45168038258347504,7,-1,-1,llm8_g7,0,
2026-03-03T03:39:57.171722+00:00,BUCKET,llm_style,tune,llm_style_tune_039,64,2048,1536,bf16,NVIDIA GeForce RTX 4060,c04,64,64,64,4,3,8,0.0,0.0,51.51999928057194,158.95552136003957,7.815473401061158,3,-1,-1,llm8_g3,0,
2026-03-03T03:39:57.202676+00:00,BUCKET,llm_style,tune,llm_style_tune_040,64,1024,6144,bf16,NVIDIA GeForce RTX 4060,c04,64,64,64,4,3,8,0.0,0.0,76.80000364780426,173.1059174239635,10.485759501953149,3,-1,-1,llm8_g3,0,
2026-03-03T03:39:57.448103+00:00,BUCKET,llm_style,tune,llm_style_tune_041,4,8192,6144,bf16,NVIDIA GeForce RTX 4060,c00,32,32,32,2,2,8,0.0,0.0,428.3680021762848,451.1231926083565,0.9399702637787066,5,-1,-1,llm8_g5,0,
2026-03-03T03:39:57.474620+00:00,BUCKET,llm_style,tune,llm_style_tune_042,1,1024,6144,bf16,NVIDIA GeForce RTX 4060,c11,32,128,32,4,2,8,0.0,0.0,93.18400174379349,161.947523355484,0.13503296450603533,7,-1,-1,llm8_g7,0,
2026-03-03T03:39:57.707834+00:00,BUCKET,llm_style,tune,llm_style_tune_043,64,2048,8192,bf16,NVIDIA GeForce RTX 4060,c06,64,128,32,4,3,8,0.0,233.16,167.83999651670456,181.32991433143616,12.794826576311733,2,-1,-1,llm8_g2,0,
2026-03-03T03:39:57.725822+00:00,BUCKET,llm_style,tune,llm_style_tune_044,16,2048,1024,bf16,NVIDIA GeForce RTX 4060,c11,32,128,32,4,2,8,0.0,0.0,42.30399988591671,139.26879853010178,1.5863479619179226,7,-1,-1,llm8_g7,0,
2026-03-03T03:39:57.742814+00:00,BUCKET,llm_style,tune,llm_style_tune_045,4,1024,1536,bf16,NVIDIA GeForce RTX 4060,c11,32,128,32,4,2,8,0.0,0.0,53.247999399900436,1133.2505992054903,0.23630769497085607,7,-1,-1,llm8_g7,0,
2026-03-03T03:39:57.771924+00:00,BUCKET,llm_style,tune,llm_style_tune_046,64,1536,4096,bf16,NVIDIA GeForce RTX 4060,c04,64,64,64,4,3,8,0.0,0.0,67.58400052785873,127.8432048857212,11.915636270570362,3,-1,-1,llm8_g3,0,
2026-03-03T03:39:57.787841+00:00,BUCKET,llm_style,tune,llm_style_tune_047,16,2048,1536,bf16,NVIDIA GeForce RTX 4060,c11,32,128,32,4,2,8,0.0,0.0,51.19999870657921,117.5369626283645,1.9660800496673596,7,-1,-1,llm8_g7,0,
2026-03-03T03:39:57.977105+00:00,BUCKET,llm_style,tune,llm_style_tune_048,64,6144,6144,bf16,NVIDIA GeForce RTX 4060,c04,64,64,64,4,3,8,0.0,0.0,345.8719998598099,374.6742355823517,13.970018417097824,1,-1,-1,llm8_g1,0,
2026-03-03T03:39:58.142683+00:00,BUCKET,llm_style,tune,llm_style_tune_049,4,4096,8192,bf16,NVIDIA GeForce RTX 4060,c02,32,64,32,2,2,8,0.0,0.0,320.3520029783249,418.75808298587776,0.8379390592359194,4,-1,-1,llm8_g4,0,
2026-03-03T03:39:58.201906+00:00,BUCKET,llm_style,tune,llm_style_tune_050,1,4096,3072,bf16,NVIDIA GeForce RTX 4060,c00,32,32,32,2,2,8,0.0,0.0,60.86399964988232,108.62591952085492,0.41347634307251213,5,-1,-1,llm8_g5,0,
2026-03-03T03:39:58.234578+00:00,BUCKET,llm_style,tune,llm_style_tune_051,2,4096,2048,bf16,NVIDIA GeForce RTX 4060,c00,32,32,32,2,2,8,0.0,0.0,50.175998359918594,126.60736165940749,0.668734715736196,5,-1,-1,llm8_g5,0,
2026-03-03T03:39:58.292635+00:00,BUCKET,llm_style,tune,llm_style_tune_052,4,8192,1536,bf16,NVIDIA GeForce RTX 4060,c00,32,32,32,2,2,8,0.0,0.0,58.36800113320351,147.05728136003006,1.7246315454639782,5,-1,-1,llm8_g5,0,
2026-03-03T03:39:58.318803+00:00,BUCKET,llm_style,tune,llm_style_tune_053,1,1536,4096,bf16,NVIDIA GeForce RTX 4060,c11,32,128,32,4,2,8,0.0,0.0,68.9920000731945,106.02495849132526,0.18238218904584044,7,-1,-1,llm8_g7,0,
2026-03-03T03:39:58.566454+00:00,BUCKET,llm_style,tune,llm_style_tune_054,8,8192,6144,bf16,NVIDIA GeForce RTX 4060,c00,32,32,32,2,2,8,0.0,0.0,428.95999550819397,548.2867354154587,1.877346084559573,5,-1,-1,llm8_g5,0,
2026-03-03T03:39:58.611152+00:00,BUCKET,llm_style,tune,llm_style_tune_055,64,6144,1536,bf16,NVIDIA GeForce RTX 4060,c04,64,64,64,4,3,8,0.0,0.0,68.60800087451935,86.57439962029457,17.606686342738634,1,-1,-1,llm8_g1,0,
2026-03-03T03:39:58.635183+00:00,BUCKET,llm_style,tune,llm_style_tune_056,1,3072,1536,bf16,NVIDIA GeForce RTX 4060,c11,32,128,32,4,2,8,0.0,0.0,44.03200000524521,137.98848494887346,0.2143255813698178,7,-1,-1,llm8_g7,0,
2026-03-03T03:39:58.644786+00:00,BUCKET,llm_style,tune,llm_style_tune_057,64,1024,1024,bf16,NVIDIA GeForce RTX 4060,c04,64,64,64,4,3,8,0.0,0.0,64.67200070619583,212.18752011656744,2.0753606898563355,3,-1,-1,llm8_g3,0,
2026-03-03T03:39:58.812298+00:00,BUCKET,llm_style,tune,llm_style_tune_058,16,8192,4096,bf16,NVIDIA GeForce RTX 4060,c00,32,32,32,2,2,8,0.0,0.0,296.9599962234497,387.8963175415991,3.6157793563280327,5,-1,-1,llm8_g5,0,
2026-03-03T03:39:58.937868+00:00,BUCKET,llm_style,tune,llm_style_tune_059,16,4096,6144,bf16,NVIDIA GeForce RTX 4060,c00,32,32,32,2,2,8,0.0,0.0,231.4240038394928,237.0662420988083,3.4797875528872577,5,-1,-1,llm8_g5,0,
2026-03-03T03:39:59.059758+00:00,BUCKET,llm_style,tune,llm_style_tune_060,2,3072,8192,bf16,NVIDIA GeForce RTX 4060,c06,64,128,32,4,3,8,0.0,0.0,231.4240038394928,254.97472375631332,0.4349734441109072,6,-1,-1,llm8_g6,0,
2026-03-03T03:39:59.220721+00:00,BUCKET,llm_style,tune,llm_style_tune_061,64,4096,8192,bf16,NVIDIA GeForce RTX 4060,c03,64,64,32,4,2,8,0.0,0.0,299.00801181793213,368.097288906574,14.364054226798554,0,-1,-1,llm8_g0,0,
2026-03-03T03:39:59.282331+00:00,BUCKET,llm_style,tune,llm_style_tune_062,32,4096,3072,bf16,NVIDIA GeForce RTX 4060,c00,32,32,32,2,2,8,0.0,0.0,77.2320032119751,125.94240024685847,10.427107086549508,5,-1,-1,llm8_g5,0,
2026-03-03T03:39:59.403380+00:00,BUCKET,llm_style,tune,llm_style_tune_063,2,3072,8192,bf16,NVIDIA GeForce RTX 4060,c06,64,128,32,4,3,8,0.0,0.0,231.4240038394928,273.9609557390212,0.4349734441109072,6,-1,-1,llm8_g6,0,
2026-03-03T03:39:59.413699+00:00,BUCKET,llm_style,eval,llm_style_eval_000,32,1536,1024,bf16,NVIDIA GeForce RTX 4060,c11,32,128,32,4,2,8,0.0,0.0,39.48799893260002,103.94464440643775,2.549212386573877,7,-1,-1,llm8_g7,0,
2026-03-03T03:39:59.510087+00:00,BUCKET,llm_style,eval,llm_style_eval_001,32,2048,8192,bf16,NVIDIA GeForce RTX 4060,c06,64,128,32,4,3,8,0.0,0.0,219.13599967956543,263.3215956389903,4.8998878576322165,6,-1,-1,llm8_g6,0,
2026-03-03T03:39:59.553817+00:00,BUCKET,llm_style,eval,llm_style_eval_002,16,2048,4096,bf16,NVIDIA GeForce RTX 4060,c11,32,128,32,4,2,8,0.0,0.0,112.01599985361099,164.01824295520768,2.3964028027318154,7,-1,-1,llm8_g7,0,
2026-03-03T03:39:59.568544+00:00,BUCKET,llm_style,eval,llm_style_eval_003,16,2048,1536,bf16,NVIDIA GeForce RTX 4060,c11,32,128,32,4,2,8,0.0,0.0,57.34400078654289,71.64256133139132,1.755428547350728,7,-1,-1,llm8_g7,0,
2026-03-03T03:39:59.653655+00:00,BUCKET,llm_style,eval,llm_style_eval_004,64,8192,2048,bf16,NVIDIA GeForce RTX 4060,c04,64,64,64,4,3,8,0.0,0.0,183.71199816465378,213.15808013081545,11.689403356634854,1,-1,-1,llm8_g1,0,
2026-03-03T03:39:59.783915+00:00,BUCKET,llm_style,eval,llm_style_eval_005,64,3072,8192,bf16,NVIDIA GeForce RTX 4060,c06,64,128,32,4,3,8,0.0,0.0,239.4080013036728,327.87679523229593,13.454961632272658,2,-1,-1,llm8_g2,0,
2026-03-03T03:39:59.805228+00:00,BUCKET,llm_style,eval,llm_style_eval_006,32,2048,2048,bf16,NVIDIA GeForce RTX 4060,c11,32,128,32,4,2,8,0.0,0.0,73.72800260782242,158.27967762947083,3.6408887601075395,7,-1,-1,llm8_g7,0,
2026-03-03T03:39:59.891941+00:00,BUCKET,llm_style,eval,llm_style_eval_007,8,8192,2048,bf16,NVIDIA GeForce RTX 4060,c00,32,32,32,2,2,8,0.0,0.0,250.88000297546387,268.410881459713,1.0699754975140567,5,-1,-1,llm8_g5,0,
2026-03-03T03:39:59.966474+00:00,BUCKET,llm_style,eval,llm_style_eval_008,64,1536,8192,bf16,NVIDIA GeForce RTX 4060,c06,64,128,32,4,3,8,0.0,0.0,236.54399812221527,289.5872010290621,6.808935118987225,2,-1,-1,llm8_g2,0,
2026-03-03T03:40:00.099406+00:00,BUCKET,llm_style,eval,llm_style_eval_009,64,4096,6144,bf16,NVIDIA GeForce RTX 4060,c04,64,64,64,4,3,8,0.0,0.0,371.71199917793274,467.3535862565038,8.665917374537187,1,-1,-1,llm8_g1,0,
2026-03-03T03:40:00.146438+00:00,BUCKET,llm_style,eval,llm_style_eval_010,64,2048,4096,bf16,NVIDIA GeForce RTX 4060,c04,64,64,64,4,3,8,0.0,0.0,141.31200313568115,237.8652809560298,7.598376642987952,3,-1,-1,llm8_g3,0,
2026-03-03T03:40:00.245300+00:00,BUCKET,llm_style,eval,llm_style_eval_011,32,3072,6144,bf16,NVIDIA GeForce RTX 4060,c11,32,128,32,4,2,8,0.0,0.0,284.5439910888672,343.68063628673536,4.245247096512177,7,-1,-1,llm8_g7,0,
2026-03-03T03:40:00.260085+00:00,BUCKET,llm_style,eval,llm_style_eval_012,16,1536,1536,bf16,NVIDIA GeForce RTX 4060,c11,32,128,32,4,2,8,0.0,0.0,68.06400045752525,246.1696007847783,1.109212968566453,7,-1,-1,llm8_g7,0,
2026-03-03T03:40:00.290408+00:00,BUCKET,llm_style,eval,llm_style_eval_013,64,2048,3072,bf16,NVIDIA GeForce RTX 4060,c04,64,64,64,4,3,8,0.0,0.0,103.93600165843964,170.91807693243015,7.748098398536085,3,-1,-1,llm8_g3,0,
2026-03-03T03:40:00.561094+00:00,BUCKET,llm_style,eval,llm_style_eval_014,16,8192,6144,bf16,NVIDIA GeForce RTX 4060,c00,32,32,32,2,2,8,0.0,0.0,696.7200040817261,827.5388729572296,2.31170732369423,5,-1,-1,llm8_g5,0,
2026-03-03T03:40:00.607064+00:00,BUCKET,llm_style,eval,llm_style_eval_015,64,6144,1536,bf16,NVIDIA GeForce RTX 4060,c04,64,64,64,4,3,8,0.0,0.0,123.90399724245071,183.3062385022639,9.749157241766056,1,-1,-1,llm8_g1,0,
2026-03-03T03:40:00.703452+00:00,BUCKET,llm_style,eval,llm_style_eval_016,16,4096,4096,bf16,NVIDIA GeForce RTX 4060,c00,32,32,32,2,2,8,0.0,0.0,252.75200605392456,366.44896000623703,2.1241014873902078,5,-1,-1,llm8_g5,0,
2026-03-03T03:40:00.881335+00:00,BUCKET,llm_style,eval,llm_style_eval_017,64,8192,4096,bf16,NVIDIA GeForce RTX 4060,c04,64,64,64,4,3,8,0.0,0.0,501.24800205230713,615.4323190450668,8.568547462363359,1,-1,-1,llm8_g1,0,
2026-03-03T03:40:01.014608+00:00,BUCKET,llm_style,eval,llm_style_eval_018,32,4096,6144,bf16,NVIDIA GeForce RTX 4060,c00,32,32,32,2,2,8,0.0,0.0,369.56800520420074,413.7404817342758,4.35809570449713,5,-1,-1,llm8_g5,0,
2026-03-03T03:40:01.148075+00:00,BUCKET,llm_style,eval,llm_style_eval_019,16,3072,8192,bf16,NVIDIA GeForce RTX 4060,c06,64,128,32,4,3,8,0.0,0.0,376.800000667572,474.86623942852003,2.1372249643663705,6,-1,-1,llm8_g6,0,
2026-03-03T03:40:01.165348+00:00,BUCKET,llm_style,eval,llm_style_eval_020,4,1536,1536,bf16,NVIDIA GeForce RTX 4060,c11,32,128,32,4,2,8,0.0,0.0,83.96799862384796,163.9398424327373,0.22478049148880683,7,-1,-1,llm8_g7,0,
2026-03-03T03:40:01.215303+00:00,BUCKET,llm_style,eval,llm_style_eval_021,4,6144,1536,bf16,NVIDIA GeForce RTX 4060,c00,32,32,32,2,2,8,0.0,0.0,111.58400028944016,162.46816210448728,0.6765976466533327,5,-1,-1,llm8_g5,0,
2026-03-03T03:40:01.244441+00:00,BUCKET,llm_style,eval,llm_style_eval_022,32,6144,1024,bf16,NVIDIA GeForce RTX 4060,c00,32,32,32,2,2,8,0.0,0.0,101.3759970664978,145.29824003577232,3.9718789028124557,5,-1,-1,llm8_g5,0,
2026-03-03T03:40:01.256535+00:00,BUCKET,llm_style,eval,llm_style_eval_023,16,1024,1536,bf16,NVIDIA GeForce RTX 4060,c11,32,128,32,4,2,8,0.0,0.0,63.231997191905975,96.88063919544217,0.7959838410171665,7,-1,-1,llm8_g7,0,
2026-03-03T03:40:01.290415+00:00,BUCKET,llm_style,eval,llm_style_eval_024,32,8192,1024,bf16,NVIDIA GeForce RTX 4060,c00,32,32,32,2,2,8,0.0,0.0,95.13600170612335,146.21503680944426,5.643193978851486,5,-1,-1,llm8_g5,0,
2026-03-03T03:40:01.498711+00:00,BUCKET,llm_style,eval,llm_style_eval_025,32,6144,6144,bf16,NVIDIA GeForce RTX 4060,c00,32,32,32,2,2,8,0.0,0.0,533.9680016040802,547.3587155342102,4.5244641940011325,5,-1,-1,llm8_g5,0,
2026-03-03T03:40:01.564826+00:00,BUCKET,llm_style,eval,llm_style_eval_026,1,6144,2048,bf16,NVIDIA GeForce RTX 4060,c00,32,32,32,2,2,8,0.0,0.0,117.76000261306763,175.5388832092284,0.21370434308403616,5,-1,-1,llm8_g5,0,
2026-03-03T03:40:01.628344+00:00,BUCKET,llm_style,eval,llm_style_eval_027,32,4096,3072,bf16,NVIDIA GeForce RTX 4060,c00,32,32,32,2,2,8,0.0,0.0,146.27200365066528,236.08319386839844,5.505540006980941,5,-1,-1,llm8_g5,0,
2026-03-03T03:40:01.644834+00:00,BUCKET,llm_style,eval,llm_style_eval_028,64,1536,1536,bf16,NVIDIA GeForce RTX 4060,c04,64,64,64,4,3,8,0.0,0.0,67.58400052785873,228.9151993393898,4.468363601463886,3,-1,-1,llm8_g3,0,
2026-03-03T03:40:01.661317+00:00,BUCKET,llm_style,eval,llm_style_eval_029,2,3072,1024,bf16,NVIDIA GeForce RTX 4060,c11,32,128,32,4,2,8,0.0,0.0,65.95199927687645,104.75520186126226,0.1907889395009094,7,-1,-1,llm8_g7,0,
2026-03-03T03:40:01.740113+00:00,BUCKET,llm_style,eval,llm_style_eval_030,32,1536,8192,bf16,NVIDIA GeForce RTX 4060,c06,64,128,32,4,3,8,0.0,0.0,349.5839983224869,467.0505502820015,2.30361335720268,6,-1,-1,llm8_g6,0,
2026-03-03T03:40:01.770355+00:00,BUCKET,llm_style,eval,llm_style_eval_031,8,3072,2048,bf16,NVIDIA GeForce RTX 4060,c11,32,128,32,4,2,8,0.0,0.0,128.00000607967377,265.0214363634586,0.7864319626464862,7,-1,-1,llm8_g7,0,
2026-03-03T03:40:01.802491+00:00,BUCKET,llm_style,eval,llm_style_eval_032,8,2048,3072,bf16,NVIDIA GeForce RTX 4060,c11,32,128,32,4,2,8,0.0,0.0,135.99999994039536,209.6844801306724,0.7401712944420415,7,-1,-1,llm8_g7,0,
2026-03-03T03:40:01.890231+00:00,BUCKET,llm_style,eval,llm_style_eval_033,64,1536,8192,bf16,NVIDIA GeForce RTX 4060,c06,64,128,32,4,3,8,0.0,0.0,360.4479879140854,440.5129480361938,4.4683637861890295,2,-1,-1,llm8_g2,0,
2026-03-03T03:40:01.961626+00:00,BUCKET,llm_style,eval,llm_style_eval_034,64,6144,2048,bf16,NVIDIA GeForce RTX 4060,c04,64,64,64,4,3,8,0.0,0.0,199.0399956703186,254.6319963037967,8.091904999172883,1,-1,-1,llm8_g1,0,
2026-03-03T03:40:01.996831+00:00,BUCKET,llm_style,eval,llm_style_eval_035,4,4096,2048,bf16,NVIDIA GeForce RTX 4060,c00,32,32,32,2,2,8,0.0,0.0,104.95999827980995,208.484486490488,0.6393756202348283,5,-1,-1,llm8_g5,0,
2026-03-03T03:40:02.175555+00:00,BUCKET,llm_style,eval,llm_style_eval_036,64,8192,4096,bf16,NVIDIA GeForce RTX 4060,c04,64,64,64,4,3,8,0.0,0.0,573.4400153160095,628.9552074670792,7.489828371382737,1,-1,-1,llm8_g1,0,
2026-03-03T03:40:02.211534+00:00,BUCKET,llm_style,eval,llm_style_eval_037,32,6144,1024,bf16,NVIDIA GeForce RTX 4060,c00,32,32,32,2,2,8,0.0,0.0,113.66400122642517,172.56992638111115,3.5424864482633502,5,-1,-1,llm8_g5,0,
2026-03-03T03:40:02.279993+00:00,BUCKET,llm_style,eval,llm_style_eval_038,64,6144,2048,bf16,NVIDIA GeForce RTX 4060,c04,64,64,64,4,3,8,0.0,0.0,207.3119953274727,257.27936491370195,7.769028190847593,1,-1,-1,llm8_g1,0,
2026-03-03T03:40:02.302251+00:00,BUCKET,llm_style,eval,llm_style_eval_039,8,1024,3072,bf16,NVIDIA GeForce RTX 4060,c11,32,128,32,4,2,8,0.0,0.0,149.50400590896606,185.9276795387268,0.33665752094059115,7,-1,-1,llm8_g7,0,
2026-03-03T03:40:02.392121+00:00,BUCKET,llm_style,eval,llm_style_eval_040,32,8192,2048,bf16,NVIDIA GeForce RTX 4060,c00,32,32,32,2,2,8,0.0,0.0,257.02399015426636,355.614728629589,4.1775937855277165,5,-1,-1,llm8_g5,0,
2026-03-03T03:40:02.408539+00:00,BUCKET,llm_style,eval,llm_style_eval_041,32,3072,1024,bf16,NVIDIA GeForce RTX 4060,c11,32,128,32,4,2,8,0.0,0.0,74.75200295448303,105.73983736336223,2.693260167524729,7,-1,-1,llm8_g7,0,
2026-03-03T03:40:02.432892+00:00,BUCKET,llm_style,eval,llm_style_eval_042,64,1024,4096,bf16,NVIDIA GeForce RTX 4060,c04,64,64,64,4,3,8,0.0,0.0,137.2160017490387,238.29568117856974,3.9125969650530297,3,-1,-1,llm8_g3,0,
2026-03-03T03:40:02.446267+00:00,BUCKET,llm_style,eval,llm_style_eval_043,2,1536,1024,bf16,NVIDIA GeForce RTX 4060,c11,32,128,32,4,2,8,0.0,0.0,101.3759970664978,208.25503930449477,0.06206060785644462,7,-1,-1,llm8_g7,0,
2026-03-03T03:40:02.558314+00:00,BUCKET,llm_style,eval,llm_style_eval_044,64,6144,3072,bf16,NVIDIA GeForce RTX 4060,c04,64,64,64,4,3,8,0.0,0.0,316.4159953594208,391.24991834163666,7.635262247901621,1,-1,-1,llm8_g1,0,
2026-03-03T03:40:02.608350+00:00,BUCKET,llm_style,eval,llm_style_eval_045,64,1536,6144,bf16,NVIDIA GeForce RTX 4060,c04,64,64,64,4,3,8,0.0,0.0,201.7280012369156,330.7663959264753,5.988060876989184,3,-1,-1,llm8_g3,0,
2026-03-03T03:40:02.710797+00:00,BUCKET,llm_style,eval,llm_style_eval_046,2,6144,3072,bf16,NVIDIA GeForce RTX 4060,c00,32,32,32,2,2,8,0.0,0.0,280.2880108356476,385.6076803803444,0.2693567654746012,5,-1,-1,llm8_g5,0,
2026-03-03T03:40:02.888681+00:00,BUCKET,llm_style,eval,llm_style_eval_047,16,4096,8192,bf16,NVIDIA GeForce RTX 4060,c02,32,64,32,2,2,8,0.0,0.0,509.95200872421265,559.9532812833786,2.105574261166781,4,-1,-1,llm8_g4,0,
2026-03-03T03:40:02.937825+00:00,BUCKET,llm_style,eval,llm_style_eval_048,16,1024,6144,bf16,NVIDIA GeForce RTX 4060,c11,32,128,32,4,2,8,0.0,0.0,322.56001234054565,432.65024095773697,0.6241523570734726,7,-1,-1,llm8_g7,0,
2026-03-03T03:40:03.008544+00:00,BUCKET,llm_style,eval,llm_style_eval_049,16,8192,1536,bf16,NVIDIA GeForce RTX 4060,c00,32,32,32,2,2,8,0.0,0.0,165.3280034661293,261.0585585236547,2.435480835419944,5,-1,-1,llm8_g5,0,
2026-03-03T03:40:03.023706+00:00,BUCKET,llm_style,eval,llm_style_eval_050,1,1024,1024,bf16,NVIDIA GeForce RTX 4060,c11,32,128,32,4,2,8,0.0,0.0,77.16800272464752,457.2400072216976,0.02717644523576827,7,-1,-1,llm8_g7,0,
2026-03-03T03:40:03.054140+00:00,BUCKET,llm_style,eval,llm_style_eval_051,16,6144,1024,bf16,NVIDIA GeForce RTX 4060,c00,32,32,32,2,2,8,0.0,0.0,126.97599828243256,172.24639847874636,1.5855484085440266,5,-1,-1,llm8_g5,0,
2026-03-03T03:40:03.411272+00:00,BUCKET,llm_style,eval,llm_style_eval_052,16,8192,8192,bf16,NVIDIA GeForce RTX 4060,c02,32,64,32,2,2,8,0.0,0.0,930.8159947395325,1018.6546915769575,2.3070979228294464,4,-1,-1,llm8_g4,0,
2026-03-03T03:40:03.672757+00:00,BUCKET,llm_style,eval,llm_style_eval_053,1,6144,8192,bf16,NVIDIA GeForce RTX 4060,c02,32,64,32,2,2,8,0.0,0.0,719.871997833252,751.8412816524506,0.13983499330851484,4,-1,-1,llm8_g4,0,
2026-03-03T03:40:03.749190+00:00,BUCKET,llm_style,eval,llm_style_eval_054,64,4096,3072,bf16,NVIDIA GeForce RTX 4060,c04,64,64,64,4,3,8,0.0,0.0,313.34400177001953,340.9184104204178,5.140078402337243,1,-1,-1,llm8_g1,0,
2026-03-03T03:40:03.785705+00:00,BUCKET,llm_style,eval,llm_style_eval_055,4,8192,1024,bf16,NVIDIA GeForce RTX 4060,c00,32,32,32,2,2,8,0.0,0.0,134.09599661827087,164.6415956318378,0.5004538964055566,5,-1,-1,llm8_g5,0,
2026-03-03T03:40:03.811553+00:00,BUCKET,llm_style,eval,llm_style_eval_056,64,1024,3072,bf16,NVIDIA GeForce RTX 4060,c04,64,64,64,4,3,8,0.0,0.0,138.2399946451187,152.0742429792881,2.9127112239382438,3,-1,-1,llm8_g3,0,
2026-03-03T03:40:03.821942+00:00,BUCKET,llm_style,eval,llm_style_eval_057,64,1024,3072,bf16,NVIDIA GeForce RTX 4060,c04,64,64,64,4,3,8,0.0,0.0,137.2160017490387,186.52991876006112,2.9344477237897726,3,-1,-1,llm8_g3,0,
2026-03-03T03:40:03.877800+00:00,BUCKET,llm_style,eval,llm_style_eval_058,32,2048,4096,bf16,NVIDIA GeForce RTX 4060,c11,32,128,32,4,2,8,0.0,0.0,243.18400025367737,285.1840069890021,2.207673660438035,7,-1,-1,llm8_g7,0,
2026-03-03T03:40:03.980864+00:00,BUCKET,llm_style,eval,llm_style_eval_059,64,8192,2048,bf16,NVIDIA GeForce RTX 4060,c04,64,64,64,4,3,8,0.0,0.0,434.1759979724884,455.342073738575,4.946113230644489,1,-1,-1,llm8_g1,0,
2026-03-03T03:40:04.091823+00:00,BUCKET,llm_style,eval,llm_style_eval_060,1,3072,6144,bf16,NVIDIA GeForce RTX 4060,c11,32,128,32,4,2,8,0.0,0.0,434.54399704933167,454.1529604792595,0.08686976751795876,7,-1,-1,llm8_g7,0,
2026-03-03T03:40:04.134479+00:00,BUCKET,llm_style,eval,llm_style_eval_061,64,1536,4096,bf16,NVIDIA GeForce RTX 4060,c04,64,64,64,4,3,8,0.0,0.0,180.2239939570427,226.24896526336659,4.4683637861890295,3,-1,-1,llm8_g3,0,
2026-03-03T03:40:04.205622+00:00,BUCKET,llm_style,eval,llm_style_eval_062,16,6144,2048,bf16,NVIDIA GeForce RTX 4060,c00,32,32,32,2,2,8,0.0,0.0,185.34399569034576,285.74527174234385,2.1724641389123427,5,-1,-1,llm8_g5,0,
2026-03-03T03:40:04.262912+00:00,BUCKET,llm_style,eval,llm_style_eval_063,64,1536,6144,bf16,NVIDIA GeForce RTX 4060,c04,64,64,64,4,3,8,0.0,0.0,287.7439856529236,376.8281677365303,4.19803579650502,3,-1,-1,llm8_g3,0,
2026-03-03T03:40:04.334476+00:00,BUCKET,llm_style,eval,llm_style_eval_064,1,6144,2048,bf16,NVIDIA GeForce RTX 4060,c00,32,32,32,2,2,8,0.0,0.0,206.84799551963806,224.66240406036377,0.12166336897188239,5,-1,-1,llm8_g5,0,
2026-03-03T03:40:04.409245+00:00,BUCKET,llm_style,eval,llm_style_eval_065,8,1536,6144,bf16,NVIDIA GeForce RTX 4060,c11,32,128,32,4,2,8,0.0,0.0,370.6879913806915,476.18464082479477,0.40733702604606425,7,-1,-1,llm8_g7,0,
2026-03-03T03:40:04.444136+00:00,BUCKET,llm_style,eval,llm_style_eval_066,64,1536,4096,bf16,NVIDIA GeForce RTX 4060,c04,64,64,64,4,3,8,0.0,0.0,188.4160041809082,270.9737688302993,4.274086861680724,3,-1,-1,llm8_g3,0,
2026-03-03T03:40:04.551292+00:00,BUCKET,llm_style,eval,llm_style_eval_067,64,8192,2048,bf16,NVIDIA GeForce RTX 4060,c04,64,64,64,4,3,8,0.0,0.0,454.6560049057007,565.1744192838669,4.723315264351133,1,-1,-1,llm8_g1,0,
2026-03-03T03:40:04.592473+00:00,BUCKET,llm_style,eval,llm_style_eval_068,64,1024,4096,bf16,NVIDIA GeForce RTX 4060,c04,64,64,64,4,3,8,0.0,0.0,202.7519941329956,351.5289631485938,2.6479192685416373,3,-1,-1,llm8_g3,0,
2026-03-03T03:40:04.650521+00:00,BUCKET,llm_style,eval,llm_style_eval_069,64,2048,4096,bf16,NVIDIA GeForce RTX 4060,c04,64,64,64,4,3,8,0.0,0.0,312.3200088739395,405.1455995440483,3.437954000678164,3,-1,-1,llm8_g3,0,
2026-03-03T03:40:04.708805+00:00,BUCKET,llm_style,eval,llm_style_eval_070,64,8192,1024,bf16,NVIDIA GeForce RTX 4060,c04,64,64,64,4,3,8,0.0,0.0,247.80799448490143,368.3225467801094,4.332958774118247,1,-1,-1,llm8_g1,0,
2026-03-03T03:40:04.786128+00:00,BUCKET,llm_style,eval,llm_style_eval_071,64,6144,2048,bf16,NVIDIA GeForce RTX 4060,c04,64,64,64,4,3,8,0.0,0.0,317.440003156662,430.2233564853668,5.073754788255642,1,-1,-1,llm8_g1,0,
2026-03-03T03:40:04.799720+00:00,BUCKET,llm_style,eval,llm_style_eval_072,64,1536,1024,bf16,NVIDIA GeForce RTX 4060,c04,64,64,64,4,3,8,0.0,0.0,78.33599671721458,309.2070475220678,2.5700393233875563,3,-1,-1,llm8_g3,0,
2026-03-03T03:40:04.829073+00:00,BUCKET,llm_style,eval,llm_style_eval_073,1,4096,1536,bf16,NVIDIA GeForce RTX 4060,c00,32,32,32,2,2,8,0.0,0.0,126.97599828243256,293.9193496108054,0.09909677553400166,5,-1,-1,llm8_g5,0,
2026-03-03T03:40:04.850047+00:00,BUCKET,llm_style,eval,llm_style_eval_074,8,1024,2048,bf16,NVIDIA GeForce RTX 4060,c11,32,128,32,4,2,8,0.0,0.0,176.01600289344788,272.51999080181116,0.1906328484252215,7,-1,-1,llm8_g7,0,
2026-03-03T03:40:04.883664+00:00,BUCKET,llm_style,eval,llm_style_eval_075,2,6144,1024,bf16,NVIDIA GeForce RTX 4060,c00,32,32,32,2,2,8,0.0,0.0,114.68800157308578,194.00512173771858,0.219428568418841,5,-1,-1,llm8_g5,0,
2026-03-03T03:40:04.926708+00:00,BUCKET,llm_style,eval,llm_style_eval_076,64,1024,6144,bf16,NVIDIA GeForce RTX 4060,c04,64,64,64,4,3,8,0.0,0.0,287.7439856529236,384.5408099889754,2.7986905310033467,3,-1,-1,llm8_g3,0,
2026-03-03T03:40:05.120186+00:00,BUCKET,llm_style,eval,llm_style_eval_077,1,4096,8192,bf16,NVIDIA GeForce RTX 4060,c02,32,64,32,2,2,8,0.0,0.0,660.4800224304199,745.0054228305816,0.10160619809976125,4,-1,-1,llm8_g4,0,
2026-03-03T03:40:05.235992+00:00,BUCKET,llm_style,eval,llm_style_eval_078,64,6144,3072,bf16,NVIDIA GeForce RTX 4060,c04,64,64,64,4,3,8,0.0,0.0,504.30402159690857,640.8499097824097,4.7906005118695045,1,-1,-1,llm8_g1,0,
2026-03-03T03:40:05.310897+00:00,BUCKET,llm_style,eval,llm_style_eval_079,2,3072,4096,bf16,NVIDIA GeForce RTX 4060,c11,32,128,32,4,2,8,0.0,0.0,307.71200358867645,366.75583004951477,0.1635673857795912,7,-1,-1,llm8_g7,0,
2026-03-03T03:40:05.328434+00:00,BUCKET,llm_style,eval,llm_style_eval_080,4,1536,1024,bf16,NVIDIA GeForce RTX 4060,c11,32,128,32,4,2,8,0.0,0.0,124.92799758911133,375.3779277205466,0.10072131341915241,7,-1,-1,llm8_g7,0,
2026-03-03T03:40:05.464156+00:00,BUCKET,llm_style,eval,llm_style_eval_081,4,4096,6144,bf16,NVIDIA GeForce RTX 4060,c00,32,32,32,2,2,8,0.0,0.0,450.52799582481384,477.8496015071869,0.446868105568927,5,-1,-1,llm8_g5,0,
2026-03-03T03:40:05.499259+00:00,BUCKET,llm_style,eval,llm_style_eval_082,64,6144,1024,bf16,NVIDIA GeForce RTX 4060,c04,64,64,64,4,3,8,0.0,0.0,204.71999794244766,279.3414404988288,3.933696639770353,1,-1,-1,llm8_g1,0,
2026-03-03T03:40:05.596150+00:00,BUCKET,llm_style,eval,llm_style_eval_083,8,4096,4096,bf16,NVIDIA GeForce RTX 4060,c00,32,32,32,2,2,8,0.0,0.0,330.7519853115082,434.28863406181324,0.8115913673116207,5,-1,-1,llm8_g5,0,
2026-03-03T03:40:05.675614+00:00,BUCKET,llm_style,eval,llm_style_eval_084,64,1024,8192,bf16,NVIDIA GeForce RTX 4060,c06,64,128,32,4,3,8,0.0,0.0,668.1599915027618,736.1462461948395,1.6070130472569035,2,-1,-1,llm8_g2,0,
2026-03-03T03:40:05.835389+00:00,BUCKET,llm_style,eval,llm_style_eval_085,1,3072,8192,bf16,NVIDIA GeForce RTX 4060,c06,64,128,32,4,3,8,0.0,0.0,713.7280106544495,739.1948729753493,0.07051936767039398,6,-1,-1,llm8_g6,0,
2026-03-03T03:40:05.853898+00:00,BUCKET,llm_style,eval,llm_style_eval_086,8,1536,1024,bf16,NVIDIA GeForce RTX 4060,c11,32,128,32,4,2,8,0.0,0.0,128.00000607967377,209.03936371207234,0.19660799066162155,7,-1,-1,llm8_g7,0,
2026-03-03T03:40:05.882785+00:00,BUCKET,llm_style,eval,llm_style_eval_087,16,1024,3072,bf16,NVIDIA GeForce RTX 4060,c11,32,128,32,4,2,8,0.0,0.0,254.92800772190094,306.9030359387398,0.3948695041378617,7,-1,-1,llm8_g7,0,
2026-03-03T03:40:05.920200+00:00,BUCKET,llm_style,eval,llm_style_eval_088,8,4096,1536,bf16,NVIDIA GeForce RTX 4060,c00,32,32,32,2,2,8,0.0,0.0,143.36000382900238,288.0307206511497,0.7021714098171316,5,-1,-1,llm8_g5,0,
2026-03-03T03:40:06.028915+00:00,BUCKET,llm_style,eval,llm_style_eval_089,16,6144,3072,bf16,NVIDIA GeForce RTX 4060,c00,32,32,32,2,2,8,0.0,0.0,321.53600454330444,391.7926272749901,1.878420355623521,5,-1,-1,llm8_g5,0,
2026-03-03T03:40:06.063403+00:00,BUCKET,llm_style,eval,llm_style_eval_090,32,1536,3072,bf16,NVIDIA GeForce RTX 4060,c11,32,128,32,4,2,8,0.0,0.0,247.80799448490143,276.1055922508239,1.218644655220757,7,-1,-1,llm8_g7,0,
2026-03-03T03:40:06.103426+00:00,BUCKET,llm_style,eval,llm_style_eval_091,16,1024,4096,bf16,NVIDIA GeForce RTX 4060,c11,32,128,32,4,2,8,0.0,0.0,329.72800731658936,382.71935492753965,0.4070558915886403,7,-1,-1,llm8_g7,0,
2026-03-03T03:40:06.240095+00:00,BUCKET,llm_style,eval,llm_style_eval_092,1,4096,6144,bf16,NVIDIA GeForce RTX 4060,c00,32,32,32,2,2,8,0.0,0.0,474.11200404167175,595.9641528129578,0.10615982630884016,5,-1,-1,llm8_g5,0,
2026-03-03T03:40:06.280017+00:00,BUCKET,llm_style,eval,llm_style_eval_093,32,2048,3072,bf16,NVIDIA GeForce RTX 4060,c11,32,128,32,4,2,8,0.0,0.0,292.86399483680725,348.42623889446253,1.3748811431202754,7,-1,-1,llm8_g7,0,
2026-03-03T03:40:06.302395+00:00,BUCKET,llm_style,eval,llm_style_eval_094,32,1024,2048,bf16,NVIDIA GeForce RTX 4060,c11,32,128,32,4,2,8,0.0,0.0,192.51200556755066,302.7660742402077,0.6971914691985496,7,-1,-1,llm8_g7,0,
2026-03-03T03:40:06.374070+00:00,BUCKET,llm_style,eval,llm_style_eval_095,8,6144,2048,bf16,NVIDIA GeForce RTX 4060,c00,32,32,32,2,2,8,0.0,0.0,239.00800198316574,376.8710511922835,0.8423424752706824,5,-1,-1,llm8_g5,0,
2026-03-03T03:40:06.417754+00:00,BUCKET,llm_style,eval,llm_style_eval_096,64,2048,3072,bf16,NVIDIA GeForce RTX 4060,c04,64,64,64,4,3,8,0.0,0.0,305.6640028953552,426.6086393594742,2.6346130403706667,3,-1,-1,llm8_g3,0,
2026-03-03T03:40:06.452767+00:00,BUCKET,llm_style,eval,llm_style_eval_097,64,6144,1024,bf16,NVIDIA GeForce RTX 4060,c04,64,64,64,4,3,8,0.0,0.0,212.95999735593796,251.4739154279231,3.7814912565669494,1,-1,-1,llm8_g1,0,
2026-03-03T03:40:06.484497+00:00,BUCKET,llm_style,eval,llm_style_eval_098,32,6144,1024,bf16,NVIDIA GeForce RTX 4060,c00,32,32,32,2,2,8,0.0,0.0,150.01600235700607,197.15935513377178,2.6840682172143966,5,-1,-1,llm8_g5,0,
2026-03-03T03:40:06.510277+00:00,BUCKET,llm_style,eval,llm_style_eval_099,1,2048,2048,bf16,NVIDIA GeForce RTX 4060,c11,32,128,32,4,2,8,0.0,0.0,179.60000038146973,261.7174422740935,0.04670717139299904,7,-1,-1,llm8_g7,0,
2026-03-03T03:40:06.560359+00:00,BUCKET,llm_style,eval,llm_style_eval_100,64,8192,1024,bf16,NVIDIA GeForce RTX 4060,c04,64,64,64,4,3,8,0.0,0.0,300.54399371147156,352.48895525932295,3.572661062828673,1,-1,-1,llm8_g1,0,
2026-03-03T03:40:06.641345+00:00,BUCKET,llm_style,eval,llm_style_eval_101,64,8192,1536,bf16,NVIDIA GeForce RTX 4060,c04,64,64,64,4,3,8,0.0,0.0,436.2240135669708,458.27072262763977,3.6921688992546313,1,-1,-1,llm8_g1,0,
2026-03-03T03:40:06.679664+00:00,BUCKET,llm_style,eval,llm_style_eval_102,32,3072,2048,bf16,NVIDIA GeForce RTX 4060,c11,32,128,32,4,2,8,0.0,0.0,194.5600062608719,296.91104263067234,2.0695578281392044,7,-1,-1,llm8_g7,0,
2026-03-03T03:40:06.729271+00:00,BUCKET,llm_style,eval,llm_style_eval_103,64,2048,3072,bf16,NVIDIA GeForce RTX 4060,c04,64,64,64,4,3,8,0.0,0.0,316.4159953594208,441.47712379693974,2.545087415967207,3,-1,-1,llm8_g3,0,
2026-03-03T03:40:06.801574+00:00,BUCKET,llm_style,eval,llm_style_eval_104,16,6144,2048,bf16,NVIDIA GeForce RTX 4060,c00,32,32,32,2,2,8,0.0,0.0,236.54399812221527,317.22495138645144,1.7022337797468063,5,-1,-1,llm8_g5,0,
2026-03-03T03:40:06.874782+00:00,BUCKET,llm_style,eval,llm_style_eval_105,1,1024,8192,bf16,NVIDIA GeForce RTX 4060,c06,64,128,32,4,3,8,0.0,0.0,738.6720180511475,761.3788920640945,0.022712672999667224,6,-1,-1,llm8_g6,0,
2026-03-03T03:40:07.071051+00:00,BUCKET,llm_style,eval,llm_style_eval_106,32,4096,8192,bf16,NVIDIA GeForce RTX 4060,c02,32,64,32,2,2,8,0.0,0.0,757.7599883079529,875.4687869548798,2.833989232916934,4,-1,-1,llm8_g4,0,
2026-03-03T03:40:07.136056+00:00,BUCKET,llm_style,eval,llm_style_eval_107,64,6144,1536,bf16,NVIDIA GeForce RTX 4060,c04,64,64,64,4,3,8,0.0,0.0,326.6559988260269,403.10624122619623,3.6979561261427953,1,-1,-1,llm8_g1,0,
2026-03-03T03:40:07.162659+00:00,BUCKET,llm_style,eval,llm_style_eval_108,8,3072,1536,bf16,NVIDIA GeForce RTX 4060,c11,32,128,32,4,2,8,0.0,0.0,135.16800105571747,216.52255356311787,0.5585454501829857,7,-1,-1,llm8_g7,0,
2026-03-03T03:40:07.178605+00:00,BUCKET,llm_style,eval,llm_style_eval_109,16,2048,1024,bf16,NVIDIA GeForce RTX 4060,c11,32,128,32,4,2,8,0.0,0.0,135.16800105571747,164.5487949252128,0.49648484460709846,7,-1,-1,llm8_g7,0,
2026-03-03T03:40:07.574559+00:00,BUCKET,llm_style,eval,llm_style_eval_110,1,8192,8192,bf16,NVIDIA GeForce RTX 4060,c02,32,64,32,2,2,8,0.0,0.0,1551.2319803237915,1704.6835041046143,0.08652331160165,4,-1,-1,llm8_g4,0,
2026-03-03T03:40:07.639889+00:00,BUCKET,llm_style,eval,llm_style_eval_111,8,6144,1536,bf16,NVIDIA GeForce RTX 4060,c00,32,32,32,2,2,8,0.0,0.0,240.63999950885773,494.43840652704193,0.6274723417061926,5,-1,-1,llm8_g5,0,
2026-03-03T03:40:07.748891+00:00,BUCKET,llm_style,eval,llm_style_eval_112,2,6144,3072,bf16,NVIDIA GeForce RTX 4060,c00,32,32,32,2,2,8,0.0,0.0,290.1439964771271,299.92576390504837,0.2602069073173178,5,-1,-1,llm8_g5,0,
2026-03-03T03:40:08.111454+00:00,BUCKET,llm_style,eval,llm_style_eval_113,1,8192,8192,bf16,NVIDIA GeForce RTX 4060,c02,32,64,32,2,2,8,0.0,0.0,1016.7199969291687,1108.3878087997437,0.1320105126341392,4,-1,-1,llm8_g4,0,
2026-03-03T03:40:08.140039+00:00,BUCKET,llm_style,eval,llm_style_eval_114,1,3072,1024,bf16,NVIDIA GeForce RTX 4060,c11,32,128,32,4,2,8,0.0,0.0,102.39999741315842,187.65823632478708,0.06144000155210499,7,-1,-1,llm8_g7,0,
2026-03-03T03:40:08.169152+00:00,BUCKET,llm_style,eval,llm_style_eval_115,16,3072,1536,bf16,NVIDIA GeForce RTX 4060,c11,32,128,32,4,2,8,0.0,0.0,138.2399946451187,203.77600193023682,1.0922667089768414,7,-1,-1,llm8_g7,0,
2026-03-03T03:40:08.193649+00:00,BUCKET,llm_style,eval,llm_style_eval_116,8,3072,1024,bf16,NVIDIA GeForce RTX 4060,c11,32,128,32,4,2,8,0.0,0.0,128.00000607967377,193.19808200001714,0.3932159813232431,7,-1,-1,llm8_g7,0,
2026-03-03T03:40:08.228754+00:00,BUCKET,llm_style,eval,llm_style_eval_117,4,1024,4096,bf16,NVIDIA GeForce RTX 4060,c11,32,128,32,4,2,8,0.0,0.0,322.3999887704849,389.160957634449,0.10407702595761331,7,-1,-1,llm8_g7,0,
2026-03-03T03:40:08.344280+00:00,BUCKET,llm_style,eval,llm_style_eval_118,64,6144,3072,bf16,NVIDIA GeForce RTX 4060,c04,64,64,64,4,3,8,0.0,0.0,505.75998425483704,613.3641546964645,4.776809512835424,1,-1,-1,llm8_g1,0,
2026-03-03T03:40:08.645473+00:00,BUCKET,llm_style,eval,llm_style_eval_119,64,8192,6144,bf16,NVIDIA GeForce RTX 4060,c04,64,64,64,4,3,8,0.0,0.0,1372.1599578857422,1427.4662566184998,4.695116562012702,1,-1,-1,llm8_g1,0,
2026-03-03T03:40:08.689166+00:00,BUCKET,llm_style,eval,llm_style_eval_120,8,1024,4096,bf16,NVIDIA GeForce RTX 4060,c11,32,128,32,4,2,8,0.0,0.0,265.1039958000183,534.2499354481695,0.2531416540798717,7,-1,-1,llm8_g7,0,
2026-03-03T03:40:08.709293+00:00,BUCKET,llm_style,eval,llm_style_eval_121,4,1024,2048,bf16,NVIDIA GeForce RTX 4060,c11,32,128,32,4,2,8,0.0,0.0,147.45600521564484,192.6348780095577,0.11377777375336061,7,-1,-1,llm8_g7,0,
2026-03-03T03:40:08.875913+00:00,BUCKET,llm_style,eval,llm_style_eval_122,4,6144,4096,bf16,NVIDIA GeForce RTX 4060,c00,32,32,32,2,2,8,0.0,0.0,360.9600067138672,499.6041727066039,0.5577531811151353,5,-1,-1,llm8_g5,0,
2026-03-03T03:40:09.029515+00:00,BUCKET,llm_style,eval,llm_style_eval_123,4,3072,8192,bf16,NVIDIA GeForce RTX 4060,c06,64,128,32,4,3,8,0.0,0.0,593.9199924468994,663.558377623558,0.33897931465575304,6,-1,-1,llm8_g6,0,
2026-03-03T03:40:09.064704+00:00,BUCKET,llm_style,eval,llm_style_eval_124,64,6144,1024,bf16,NVIDIA GeForce RTX 4060,c04,64,64,64,4,3,8,0.0,0.0,191.48799777030945,303.5939249396324,4.205518765546695,1,-1,-1,llm8_g1,0,
2026-03-03T03:40:09.157703+00:00,BUCKET,llm_style,eval,llm_style_eval_125,64,1536,8192,bf16,NVIDIA GeForce RTX 4060,c06,64,128,32,4,3,8,0.0,0.0,570.3679919242859,688.8140785694122,2.8238133254395565,2,-1,-1,llm8_g2,0,
2026-03-03T03:40:09.266663+00:00,BUCKET,llm_style,eval,llm_style_eval_126,64,2048,8192,bf16,NVIDIA GeForce RTX 4060,c06,64,128,32,4,3,8,0.0,0.0,572.4160075187683,695.3779393434525,3.7516135464286235,2,-1,-1,llm8_g2,0,
2026-03-03T03:40:09.343414+00:00,BUCKET,llm_style,eval,llm_style_eval_127,2,8192,1536,bf16,NVIDIA GeForce RTX 4060,c00,32,32,32,2,2,8,0.0,0.0,196.0960030555725,309.78048026561726,0.2566684033112918,5,-1,-1,llm8_g5,0,
2026-03-03T03:40:09.367438+00:00,BUCKET,llm_style,eval,llm_style_eval_128,8,2048,2048,bf16,NVIDIA GeForce RTX 4060,c11,32,128,32,4,2,8,0.0,0.0,146.43199741840363,193.77408489584917,0.4582937143734251,7,-1,-1,llm8_g7,0,
2026-03-03T03:40:09.682130+00:00,BUCKET,llm_style,eval,llm_style_eval_129,64,8192,6144,bf16,NVIDIA GeForce RTX 4060,c04,64,64,64,4,3,8,0.0,0.0,1208.3200216293335,1330.2649176120758,5.33174227744138,1,-1,-1,llm8_g1,0,
2026-03-03T03:40:09.714078+00:00,BUCKET,llm_style,eval,llm_style_eval_130,16,3072,1536,bf16,NVIDIA GeForce RTX 4060,c11,32,128,32,4,2,8,0.0,0.0,113.15200105309486,255.87040394544596,1.3344434264944898,7,-1,-1,llm8_g7,0,
2026-03-03T03:40:10.061765+00:00,BUCKET,llm_style,eval,llm_style_eval_131,32,8192,8192,bf16,NVIDIA GeForce RTX 4060,c02,32,64,32,2,2,8,0.0,0.0,951.2799978256226,1011.2716901302338,4.514934935893924,4,-1,-1,llm8_g4,0,
2026-03-03T03:40:10.254549+00:00,BUCKET,llm_style,eval,llm_style_eval_132,32,8192,4096,bf16,NVIDIA GeForce RTX 4060,c00,32,32,32,2,2,8,0.0,0.0,555.9360086917877,662.4163120985028,3.862825243238688,5,-1,-1,llm8_g5,0,
2026-03-03T03:40:10.615069+00:00,BUCKET,llm_style,eval,llm_style_eval_133,2,8192,8192,bf16,NVIDIA GeForce RTX 4060,c02,32,64,32,2,2,8,0.0,0.0,1221.5200066566467,1352.222764492035,0.2197552676478214,4,-1,-1,llm8_g4,0,
2026-03-03T03:40:10.681135+00:00,BUCKET,llm_style,eval,llm_style_eval_134,64,3072,3072,bf16,NVIDIA GeForce RTX 4060,c04,64,64,64,4,3,8,0.0,0.0,302.0640015602112,381.726714670658,3.9990185714308444,3,-1,-1,llm8_g3,0,
2026-03-03T03:40:10.741692+00:00,BUCKET,llm_style,eval,llm_style_eval_135,8,3072,3072,bf16,NVIDIA GeForce RTX 4060,c11,32,128,32,4,2,8,0.0,0.0,263.16800713539124,333.8204836845398,0.573758739307237,7,-1,-1,llm8_g7,0,
2026-03-03T03:40:10.797232+00:00,BUCKET,llm_style,eval,llm_style_eval_136,4,2048,4096,bf16,NVIDIA GeForce RTX 4060,c11,32,128,32,4,2,8,0.0,0.0,278.52800488471985,370.7699182629583,0.2409411722450521,7,-1,-1,llm8_g7,0,
2026-03-03T03:40:11.176434+00:00,BUCKET,llm_style,eval,llm_style_eval_137,4,8192,8192,bf16,NVIDIA GeForce RTX 4060,c02,32,64,32,2,2,8,0.0,0.0,1011.7119550704956,1047.0707058906555,0.5306558940114443,4,-1,-1,llm8_g4,0,
2026-03-03T03:40:11.194680+00:00,BUCKET,llm_style,eval,llm_style_eval_138,16,1024,1024,bf16,NVIDIA GeForce RTX 4060,c11,32,128,32,4,2,8,0.0,0.0,109.51999947428703,250.6854391098022,0.3063772111127326,7,-1,-1,llm8_g7,0,
2026-03-03T03:40:11.212967+00:00,BUCKET,llm_style,eval,llm_style_eval_139,4,1024,1024,bf16,NVIDIA GeForce RTX 4060,c11,32,128,32,4,2,8,0.0,0.0,132.9599991440773,256.83968469500525,0.063091215809275,7,-1,-1,llm8_g7,0,
2026-03-03T03:40:11.372925+00:00,BUCKET,llm_style,eval,llm_style_eval_140,64,4096,6144,bf16,NVIDIA GeForce RTX 4060,c04,64,64,64,4,3,8,0.0,0.0,717.8079783916473,733.2086455821991,4.487586609468484,1,-1,-1,llm8_g1,0,
2026-03-03T03:40:11.510826+00:00,BUCKET,llm_style,eval,llm_style_eval_141,4,6144,4096,bf16,NVIDIA GeForce RTX 4060,c00,32,32,32,2,2,8,0.0,0.0,395.26399970054626,416.3276904821396,0.509347150644951,5,-1,-1,llm8_g5,0,
2026-03-03T03:40:11.594597+00:00,BUCKET,llm_style,eval,llm_style_eval_142,4,2048,6144,bf16,NVIDIA GeForce RTX 4060,c11,32,128,32,4,2,8,0.0,0.0,422.87999391555786,488.5606452822684,0.23804222816958515,7,-1,-1,llm8_g7,0,
2026-03-03T03:40:11.690200+00:00,BUCKET,llm_style,eval,llm_style_eval_143,64,1536,8192,bf16,NVIDIA GeForce RTX 4060,c06,64,128,32,4,3,8,0.0,0.0,632.2399973869324,738.2118254899978,2.547470490093497,2,-1,-1,llm8_g2,0,
2026-03-03T03:40:11.746472+00:00,BUCKET,llm_style,eval,llm_style_eval_144,1,3072,3072,bf16,NVIDIA GeForce RTX 4060,c11,32,128,32,4,2,8,0.0,0.0,219.13599967956543,312.7910339832305,0.0861308412474413,7,-1,-1,llm8_g7,0,
2026-03-03T03:40:11.765563+00:00,BUCKET,llm_style,eval,llm_style_eval_145,32,1024,2048,bf16,NVIDIA GeForce RTX 4060,c11,32,128,32,4,2,8,0.0,0.0,172.97600209712982,234.96512070298195,0.7759326517711619,7,-1,-1,llm8_g7,0,
2026-03-03T03:40:11.971673+00:00,BUCKET,llm_style,eval,llm_style_eval_146,64,8192,4096,bf16,NVIDIA GeForce RTX 4060,c04,64,64,64,4,3,8,0.0,0.0,917.8720116615295,1051.1667370796204,4.679265999434128,1,-1,-1,llm8_g1,0,
2026-03-03T03:40:12.041226+00:00,BUCKET,llm_style,eval,llm_style_eval_147,64,2048,4096,bf16,NVIDIA GeForce RTX 4060,c04,64,64,64,4,3,8,0.0,0.0,342.8319990634918,454.056952893734,3.131976673510996,3,-1,-1,llm8_g3,0,
2026-03-03T03:40:12.082372+00:00,BUCKET,llm_style,eval,llm_style_eval_148,64,1024,6144,bf16,NVIDIA GeForce RTX 4060,c04,64,64,64,4,3,8,0.0,0.0,284.4479978084564,434.8620820045471,2.8311198328148643,3,-1,-1,llm8_g3,0,
2026-03-03T03:40:12.291091+00:00,BUCKET,llm_style,eval,llm_style_eval_149,64,4096,8192,bf16,NVIDIA GeForce RTX 4060,c03,64,64,32,4,2,8,0.0,0.0,1051.6480207443237,1075.1999616622925,4.08403497299425,0,-1,-1,llm8_g0,0,
2026-03-03T03:40:12.325219+00:00,BUCKET,llm_style,eval,llm_style_eval_150,2,2048,3072,bf16,NVIDIA GeForce RTX 4060,c11,32,128,32,4,2,8,0.0,0.0,218.1120067834854,311.92767649888987,0.11538027810170723,7,-1,-1,llm8_g7,0,
2026-03-03T03:40:12.373339+00:00,BUCKET,llm_style,eval,llm_style_eval_151,64,4096,2048,bf16,NVIDIA GeForce RTX 4060,c04,64,64,64,4,3,8,0.0,0.0,258.04799795150757,389.6524846553799,4.161015906047749,1,-1,-1,llm8_g1,0,
2026-03-03T03:40:12.736621+00:00,BUCKET,llm_style,eval,llm_style_eval_152,8,8192,8192,bf16,NVIDIA GeForce RTX 4060,c02,32,64,32,2,2,8,0.0,0.0,948.2240080833435,989.9315160512924,1.1323714806276284,4,-1,-1,llm8_g4,0,
2026-03-03T03:40:12.841989+00:00,BUCKET,llm_style,eval,llm_style_eval_153,64,8192,2048,bf16,NVIDIA GeForce RTX 4060,c04,64,64,64,4,3,8,0.0,0.0,468.31999719142914,492.0723184943199,4.585504913048163,1,-1,-1,llm8_g1,0,
2026-03-03T03:40:12.959864+00:00,BUCKET,llm_style,eval,llm_style_eval_154,16,2048,8192,bf16,NVIDIA GeForce RTX 4060,c06,64,128,32,4,3,8,0.0,0.0,548.8640069961548,661.6780763864516,0.9781492412632574,6,-1,-1,llm8_g6,0,
2026-03-03T03:40:12.983376+00:00,BUCKET,llm_style,eval,llm_style_eval_155,4,2048,1536,bf16,NVIDIA GeForce RTX 4060,c11,32,128,32,4,2,8,0.0,0.0,112.64000087976456,201.13471537828443,0.22341818007319428,7,-1,-1,llm8_g7,0,
2026-03-03T03:40:13.118513+00:00,BUCKET,llm_style,eval,llm_style_eval_156,1,4096,6144,bf16,NVIDIA GeForce RTX 4060,c00,32,32,32,2,2,8,0.0,0.0,374.783992767334,394.7452715039253,0.13429508455886988,5,-1,-1,llm8_g5,0,
2026-03-03T03:40:13.207104+00:00,BUCKET,llm_style,eval,llm_style_eval_157,1,1536,8192,bf16,NVIDIA GeForce RTX 4060,c06,64,128,32,4,3,8,0.0,0.0,544.7039902210236,704.9142569303508,0.046200917290487455,6,-1,-1,llm8_g6,0,
2026-03-03T03:40:13.299173+00:00,BUCKET,llm_style,eval,llm_style_eval_158,64,1536,8192,bf16,NVIDIA GeForce RTX 4060,c06,64,128,32,4,3,8,0.0,0.0,549.888014793396,628.3571350574493,2.9289831614263124,2,-1,-1,llm8_g2,0,
2026-03-03T03:40:13.358005+00:00,BUCKET,llm_style,eval,llm_style_eval_159,16,6144,1536,bf16,NVIDIA GeForce RTX 4060,c00,32,32,32,2,2,8,0.0,0.0,172.03199863433838,266.1478443443774,1.7554285853638942,5,-1,-1,llm8_g5,0,
2026-03-03T03:40:13.571556+00:00,BUCKET,llm_style,eval,llm_style_eval_160,32,6144,6144,bf16,NVIDIA GeForce RTX 4060,c00,32,32,32,2,2,8,0.0,0.0,596.992015838623,717.9264122247696,4.046819789719036,5,-1,-1,llm8_g5,0,
2026-03-03T03:40:13.609768+00:00,BUCKET,llm_style,eval,llm_style_eval_161,2,1536,4096,bf16,NVIDIA GeForce RTX 4060,c11,32,128,32,4,2,8,0.0,0.0,254.94399666786194,347.9084736108777,0.09871118492264691,7,-1,-1,llm8_g7,0,
2026-03-03T03:40:13.637569+00:00,BUCKET,llm_style,eval,llm_style_eval_162,64,1536,3072,bf16,NVIDIA GeForce RTX 4060,c04,64,64,64,4,3,8,0.0,0.0,141.31200313568115,172.85343840718264,4.274086861680723,3,-1,-1,llm8_g3,0,
2026-03-03T03:40:13.701663+00:00,BUCKET,llm_style,eval,llm_style_eval_163,64,1024,8192,bf16,NVIDIA GeForce RTX 4060,c06,64,128,32,4,3,8,0.0,0.0,545.6480085849762,555.5916786193848,1.9678287231076395,2,-1,-1,llm8_g2,0,
2026-03-03T03:40:13.911934+00:00,BUCKET,llm_style,eval,llm_style_eval_164,64,4096,8192,bf16,NVIDIA GeForce RTX 4060,c03,64,64,32,4,2,8,0.0,0.0,906.1760008335114,947.2204804420471,4.739661271154211,0,-1,-1,llm8_g0,0,
2026-03-03T03:40:14.052378+00:00,BUCKET,llm_style,eval,llm_style_eval_165,4,8192,3072,bf16,NVIDIA GeForce RTX 4060,c00,32,32,32,2,2,8,0.0,0.0,375.2000033855438,456.30591303110117,0.5365847286337124,5,-1,-1,llm8_g5,0,
2026-03-03T03:40:14.099821+00:00,BUCKET,llm_style,eval,llm_style_eval_166,64,1024,6144,bf16,NVIDIA GeForce RTX 4060,c04,64,64,64,4,3,8,0.0,0.0,263.16800713539124,277.00223326683044,3.060046609638597,3,-1,-1,llm8_g3,0,
2026-03-03T03:40:14.114471+00:00,BUCKET,llm_style,eval,llm_style_eval_167,2,2048,1024,bf16,NVIDIA GeForce RTX 4060,c11,32,128,32,4,2,8,0.0,0.0,97.21600264310837,164.92543622851372,0.08628834525109604,7,-1,-1,llm8_g7,0,
2026-03-03T03:40:14.139654+00:00,BUCKET,llm_style,eval,llm_style_eval_168,64,4096,1024,bf16,NVIDIA GeForce RTX 4060,c04,64,64,64,4,3,8,0.0,0.0,140.28799533843994,211.90048441290844,3.82691983519201,1,-1,-1,llm8_g1,0,
2026-03-03T03:40:14.193320+00:00,BUCKET,llm_style,eval,llm_style_eval_169,4,1536,6144,bf16,NVIDIA GeForce RTX 4060,c11,32,128,32,4,2,8,0.0,0.0,362.43200302124023,476.22144490480423,0.20830796224023154,7,-1,-1,llm8_g7,0,
2026-03-03T03:40:14.214472+00:00,BUCKET,llm_style,eval,llm_style_eval_170,16,1536,1536,bf16,NVIDIA GeForce RTX 4060,c11,32,128,32,4,2,8,0.0,0.0,130.048006772995,236.61855354905126,0.5805354028361576,7,-1,-1,llm8_g7,0,
2026-03-03T03:40:14.251308+00:00,BUCKET,llm_style,eval,llm_style_eval_171,1,2048,3072,bf16,NVIDIA GeForce RTX 4060,c11,32,128,32,4,2,8,0.0,0.0,190.46400487422943,272.60160177946085,0.06606451443835265,7,-1,-1,llm8_g7,0,
2026-03-03T03:40:14.283537+00:00,BUCKET,llm_style,eval,llm_style_eval_172,64,3072,2048,bf16,NVIDIA GeForce RTX 4060,c04,64,64,64,4,3,8,0.0,0.0,164.86400365829468,210.96448436379433,4.884670699063685,3,-1,-1,llm8_g3,0,
2026-03-03T03:40:14.567679+00:00,BUCKET,llm_style,eval,llm_style_eval_173,64,8192,6144,bf16,NVIDIA GeForce RTX 4060,c04,64,64,64,4,3,8,0.0,0.0,1173.5039949417114,1279.2422032356262,5.48992672523454,1,-1,-1,llm8_g1,0,
2026-03-03T03:40:14.656916+00:00,BUCKET,llm_style,eval,llm_style_eval_174,2,4096,4096,bf16,NVIDIA GeForce RTX 4060,c00,32,32,32,2,2,8,0.0,0.0,261.1199915409088,330.3936034440992,0.2570039298943768,5,-1,-1,llm8_g5,0,
2026-03-03T03:40:14.702608+00:00,BUCKET,llm_style,eval,llm_style_eval_175,64,4096,2048,bf16,NVIDIA GeForce RTX 4060,c04,64,64,64,4,3,8,0.0,0.0,198.4959989786148,244.35040384531004,5.409387743456133,1,-1,-1,llm8_g1,0,
2026-03-03T03:40:14.766236+00:00,BUCKET,llm_style,eval,llm_style_eval_176,16,6144,2048,bf16,NVIDIA GeForce RTX 4060,c00,32,32,32,2,2,8,0.0,0.0,156.67200088500977,218.48736584186554,2.5700392011686213,5,-1,-1,llm8_g5,0,
2026-03-03T03:40:14.817500+00:00,BUCKET,llm_style,eval,llm_style_eval_177,1,6144,1536,bf16,NVIDIA GeForce RTX 4060,c00,32,32,32,2,2,8,0.0,0.0,127.88800150156021,189.10271942615503,0.14758513526204206,5,-1,-1,llm8_g5,0,
2026-03-03T03:40:15.094692+00:00,BUCKET,llm_style,eval,llm_style_eval_178,32,6144,8192,bf16,NVIDIA GeForce RTX 4060,c02,32,64,32,2,2,8,0.0,0.0,703.4879922866821,745.0726497173309,4.5789345480218255,4,-1,-1,llm8_g4,0,
2026-03-03T03:40:15.244519+00:00,BUCKET,llm_style,eval,llm_style_eval_179,64,4096,6144,bf16,NVIDIA GeForce RTX 4060,c04,64,64,64,4,3,8,0.0,0.0,529.8239886760712,647.4758523702621,6.079802992781105,1,-1,-1,llm8_g1,0,
2026-03-03T03:40:15.264646+00:00,BUCKET,llm_style,eval,llm_style_eval_180,64,2048,1536,bf16,NVIDIA GeForce RTX 4060,c04,64,64,64,4,3,8,0.0,0.0,121.85599654912949,214.1062372922897,3.304336228030105,3,-1,-1,llm8_g3,0,
2026-03-03T03:40:15.300273+00:00,BUCKET,llm_style,eval,llm_style_eval_181,64,2048,3072,bf16,NVIDIA GeForce RTX 4060,c04,64,64,64,4,3,8,0.0,0.0,200.70399343967438,313.38336050510395,4.012408294417177,3,-1,-1,llm8_g3,0,
2026-03-03T03:40:15.322776+00:00,BUCKET,llm_style,eval,llm_style_eval_182,32,3072,1536,bf16,NVIDIA GeForce RTX 4060,c11,32,128,32,4,2,8,0.0,0.0,99.32799637317657,151.15264266729352,3.0403300079206272,7,-1,-1,llm8_g7,0,
2026-03-03T03:40:15.411894+00:00,BUCKET,llm_style,eval,llm_style_eval_183,8,8192,2048,bf16,NVIDIA GeForce RTX 4060,c00,32,32,32,2,2,8,0.0,0.0,260.09601354599,377.9593491554258,1.0320629383753912,5,-1,-1,llm8_g5,0,
2026-03-03T03:40:15.454155+00:00,BUCKET,llm_style,eval,llm_style_eval_184,64,8192,1024,bf16,NVIDIA GeForce RTX 4060,c04,64,64,64,4,3,8,0.0,0.0,174.5920032262802,201.63392052054405,6.150005751456871,1,-1,-1,llm8_g1,0,
2026-03-03T03:40:15.523618+00:00,BUCKET,llm_style,eval,llm_style_eval_185,1,8192,1536,bf16,NVIDIA GeForce RTX 4060,c00,32,32,32,2,2,8,0.0,0.0,161.79199516773224,265.5436803400516,0.15554430844313533,5,-1,-1,llm8_g5,0,
2026-03-03T03:40:15.551704+00:00,BUCKET,llm_style,eval,llm_style_eval_186,16,6144,1024,bf16,NVIDIA GeForce RTX 4060,c00,32,32,32,2,2,8,0.0,0.0,107.51999914646149,132.88448013365263,1.872457157721487,5,-1,-1,llm8_g5,0,
2026-03-03T03:40:15.593663+00:00,BUCKET,llm_style,eval,llm_style_eval_187,1,1024,6144,bf16,NVIDIA GeForce RTX 4060,c11,32,128,32,4,2,8,0.0,0.0,295.4239994287491,385.31071633100504,0.0425927210528973,7,-1,-1,llm8_g7,0,
2026-03-03T03:40:15.776849+00:00,BUCKET,llm_style,eval,llm_style_eval_188,8,8192,4096,bf16,NVIDIA GeForce RTX 4060,c00,32,32,32,2,2,8,0.0,0.0,505.69599866867065,599.3843060731887,1.0616475380730765,5,-1,-1,llm8_g5,0,
2026-03-03T03:40:15.879982+00:00,BUCKET,llm_style,eval,llm_style_eval_189,8,2048,8192,bf16,NVIDIA GeForce RTX 4060,c06,64,128,32,4,3,8,0.0,0.0,473.88799488544464,567.4928015470505,0.566453379062473,6,-1,-1,llm8_g6,0,
2026-03-03T03:40:15.971314+00:00,BUCKET,llm_style,eval,llm_style_eval_190,4,8192,2048,bf16,NVIDIA GeForce RTX 4060,c00,32,32,32,2,2,8,0.0,0.0,281.5999984741211,348.115513920784,0.4766254571280992,5,-1,-1,llm8_g5,0,
2026-03-03T03:40:16.310476+00:00,BUCKET,llm_style,eval,llm_style_eval_191,4,8192,8192,bf16,NVIDIA GeForce RTX 4060,c02,32,64,32,2,2,8,0.0,0.0,917.5040125846863,950.815018415451,0.5851428491169093,4,-1,-1,llm8_g4,0,
2026-03-03T03:40:16.334282+00:00,BUCKET,llm_style,eval,llm_style_eval_192,64,1536,1024,bf16,NVIDIA GeForce RTX 4060,c04,64,64,64,4,3,8,0.0,0.0,75.13600215315819,180.07999733090392,2.6794956642704157,3,-1,-1,llm8_g3,0,
2026-03-03T03:40:16.362978+00:00,BUCKET,llm_style,eval,llm_style_eval_193,32,2048,2048,bf16,NVIDIA GeForce RTX 4060,c11,32,128,32,4,2,8,0.0,0.0,124.81600046157837,152.9792021214962,2.150649395969321,7,-1,-1,llm8_g7,0,
2026-03-03T03:40:16.379819+00:00,BUCKET,llm_style,eval,llm_style_eval_194,8,1024,2048,bf16,NVIDIA GeForce RTX 4060,c11,32,128,32,4,2,8,0.0,0.0,125.44000148773193,203.34592148661602,0.2674938743785142,7,-1,-1,llm8_g7,0,
2026-03-03T03:40:16.422054+00:00,BUCKET,llm_style,eval,llm_style_eval_195,2,4096,2048,bf16,NVIDIA GeForce RTX 4060,c00,32,32,32,2,2,8,0.0,0.0,125.44000148773193,264.50943619012816,0.2674938743785142,5,-1,-1,llm8_g5,0,
2026-03-03T03:40:16.481634+00:00,BUCKET,llm_style,eval,llm_style_eval_196,32,2048,4096,bf16,NVIDIA GeForce RTX 4060,c11,32,128,32,4,2,8,0.0,0.0,235.52000522613525,329.5948833227157,2.2795129928963855,7,-1,-1,llm8_g7,0,
2026-03-03T03:40:16.551215+00:00,BUCKET,llm_style,eval,llm_style_eval_197,32,8192,1536,bf16,NVIDIA GeForce RTX 4060,c00,32,32,32,2,2,8,0.0,0.0,201.7280012369156,293.1071937084197,3.9920405846594567,5,-1,-1,llm8_g5,0,
2026-03-03T03:40:16.753384+00:00,BUCKET,llm_style,eval,llm_style_eval_198,64,4096,8192,bf16,NVIDIA GeForce RTX 4060,c03,64,64,32,4,2,8,0.0,0.0,871.4240193367004,1005.3929638862609,4.928676741397591,0,-1,-1,llm8_g0,0,
2026-03-03T03:40:16.924655+00:00,BUCKET,llm_style,eval,llm_style_eval_199,2,8192,4096,bf16,NVIDIA GeForce RTX 4060,c00,32,32,32,2,2,8,0.0,0.0,479.66401278972626,512.9743754863739,0.27981613050224385,5,-1,-1,llm8_g5,0,
2026-03-03T03:40:16.948060+00:00,BUCKET,llm_style,eval,llm_style_eval_200,1,4096,1024,bf16,NVIDIA GeForce RTX 4060,c00,32,32,32,2,2,8,0.0,0.0,117.76000261306763,254.4435240328311,0.07123478102801205,5,-1,-1,llm8_g5,0,
2026-03-03T03:40:17.041133+00:00,BUCKET,llm_style,eval,llm_style_eval_201,4,1536,8192,bf16,NVIDIA GeForce RTX 4060,c06,64,128,32,4,3,8,0.0,0.0,532.480001449585,620.1651322841644,0.1890461533315083,6,-1,-1,llm8_g6,0,
2026-03-03T03:40:17.148996+00:00,BUCKET,llm_style,eval,llm_style_eval_202,1,6144,3072,bf16,NVIDIA GeForce RTX 4060,c00,32,32,32,2,2,8,0.0,0.0,283.6480140686035,308.4575995802879,0.1330830258902149,5,-1,-1,llm8_g5,0,
2026-03-03T03:40:17.227092+00:00,BUCKET,llm_style,eval,llm_style_eval_203,16,2048,6144,bf16,NVIDIA GeForce RTX 4060,c11,32,128,32,4,2,8,0.0,0.0,373.76001477241516,423.94623070955265,1.0773040670098915,7,-1,-1,llm8_g7,0,
2026-03-03T03:40:17.239577+00:00,BUCKET,llm_style,eval,llm_style_eval_204,16,1536,1024,bf16,NVIDIA GeForce RTX 4060,c11,32,128,32,4,2,8,0.0,0.0,86.01599931716919,150.52799880504608,0.5851428617879647,7,-1,-1,llm8_g7,0,
2026-03-03T03:40:17.316510+00:00,BUCKET,llm_style,eval,llm_style_eval_205,64,6144,2048,bf16,NVIDIA GeForce RTX 4060,c04,64,64,64,4,3,8,0.0,0.0,303.1040132045746,313.83775413036346,5.313729498239754,1,-1,-1,llm8_g1,0,
2026-03-03T03:40:17.394488+00:00,BUCKET,llm_style,eval,llm_style_eval_206,4,2048,6144,bf16,NVIDIA GeForce RTX 4060,c11,32,128,32,4,2,8,0.0,0.0,383.93600285053253,470.302722454071,0.262187696003046,7,-1,-1,llm8_g7,0,
2026-03-03T03:40:17.452857+00:00,BUCKET,llm_style,eval,llm_style_eval_207,32,6144,1536,bf16,NVIDIA GeForce RTX 4060,c00,32,32,32,2,2,8,0.0,0.0,152.5759994983673,257.24927008152,3.9585503485852187,5,-1,-1,llm8_g5,0,
2026-03-03T03:40:17.472877+00:00,BUCKET,llm_style,eval,llm_style_eval_208,4,2048,1024,bf16,NVIDIA GeForce RTX 4060,c11,32,128,32,4,2,8,0.0,0.0,98.2080027461052,240.29183909296978,0.17083349147598223,7,-1,-1,llm8_g7,0,
2026-03-03T03:40:17.490324+00:00,BUCKET,llm_style,eval,llm_style_eval_209,1,1024,1536,bf16,NVIDIA GeForce RTX 4060,c11,32,128,32,4,2,8,0.0,0.0,114.68800157308578,201.28767728805542,0.027428571052355126,7,-1,-1,llm8_g7,0,
2026-03-03T03:40:17.623592+00:00,BUCKET,llm_style,eval,llm_style_eval_210,8,6144,4096,bf16,NVIDIA GeForce RTX 4060,c00,32,32,32,2,2,8,0.0,0.0,371.71199917793274,482.3449519276619,1.0832396718171484,5,-1,-1,llm8_g5,0,
2026-03-03T03:40:17.736011+00:00,BUCKET,llm_style,eval,llm_style_eval_211,4,2048,8192,bf16,NVIDIA GeForce RTX 4060,c06,64,128,32,4,3,8,0.0,0.0,612.3520135879517,728.6681640148163,0.2191839416246525,6,-1,-1,llm8_g6,0,
2026-03-03T03:40:17.749478+00:00,BUCKET,llm_style,eval,llm_style_eval_212,32,1024,1024,bf16,NVIDIA GeForce RTX 4060,c11,32,128,32,4,2,8,0.0,0.0,97.6480022072792,236.47232159972182,0.68725281094381,7,-1,-1,llm8_g7,0,
2026-03-03T03:40:17.827668+00:00,BUCKET,llm_style,eval,llm_style_eval_213,16,3072,4096,bf16,NVIDIA GeForce RTX 4060,c11,32,128,32,4,2,8,0.0,0.0,291.1680042743683,408.6374369263649,1.3828895280010882,7,-1,-1,llm8_g7,0,
2026-03-03T03:40:17.906747+00:00,BUCKET,llm_style,eval,llm_style_eval_214,64,1024,8192,bf16,NVIDIA GeForce RTX 4060,c06,64,128,32,4,3,8,0.0,0.0,611.7759943008423,731.6991978883743,1.755122518704101,2,-1,-1,llm8_g2,0,
2026-03-03T03:40:17.939912+00:00,BUCKET,llm_style,eval,llm_style_eval_215,4,4096,1536,bf16,NVIDIA GeForce RTX 4060,c00,32,32,32,2,2,8,0.0,0.0,123.75999987125397,223.30591693520543,0.4066875246635375,5,-1,-1,llm8_g5,0,
2026-03-03T03:40:17.970968+00:00,BUCKET,llm_style,eval,llm_style_eval_216,16,1536,3072,bf16,NVIDIA GeForce RTX 4060,c11,32,128,32,4,2,8,0.0,0.0,197.58400321006775,298.44768702983845,0.7642063200808058,7,-1,-1,llm8_g7,0,
2026-03-03T03:40:18.037751+00:00,BUCKET,llm_style,eval,llm_style_eval_217,8,6144,2048,bf16,NVIDIA GeForce RTX 4060,c00,32,32,32,2,2,8,0.0,0.0,195.5839991569519,223.2524736225605,1.0293612609814762,5,-1,-1,llm8_g5,0,
2026-03-03T03:40:18.111128+00:00,BUCKET,llm_style,eval,llm_style_eval_218,8,3072,4096,bf16,NVIDIA GeForce RTX 4060,c11,32,128,32,4,2,8,0.0,0.0,301.05599761009216,397.30175644159306,0.6687346991862454,7,-1,-1,llm8_g7,0,
2026-03-03T03:40:18.265043+00:00,BUCKET,llm_style,eval,llm_style_eval_219,64,8192,3072,bf16,NVIDIA GeForce RTX 4060,c04,64,64,64,4,3,8,0.0,0.0,701.8719911575317,825.4054361581802,4.589477159057927,1,-1,-1,llm8_g1,0,
2026-03-03T03:40:18.305507+00:00,BUCKET,llm_style,eval,llm_style_eval_220,2,4096,2048,bf16,NVIDIA GeForce RTX 4060,c00,32,32,32,2,2,8,0.0,0.0,162.1439978480339,273.00864666700363,0.20694217760344233,5,-1,-1,llm8_g5,0,
2026-03-03T03:40:18.383002+00:00,BUCKET,llm_style,eval,llm_style_eval_221,4,1024,8192,bf16,NVIDIA GeForce RTX 4060,c06,64,128,32,4,3,8,0.0,0.0,631.8079829216003,681.2310355901718,0.10621718277391154,6,-1,-1,llm8_g6,0,
2026-03-03T03:40:18.464836+00:00,BUCKET,llm_style,eval,llm_style_eval_222,64,6144,2048,bf16,NVIDIA GeForce RTX 4060,c04,64,64,64,4,3,8,0.0,0.0,337.92001008987427,439.49056327342976,4.76625440314007,1,-1,-1,llm8_g1,0,
2026-03-03T03:40:18.497269+00:00,BUCKET,llm_style,eval,llm_style_eval_223,4,2048,2048,bf16,NVIDIA GeForce RTX 4060,c11,32,128,32,4,2,8,0.0,0.0,171.00800573825836,247.5315254926681,0.19621556227816483,7,-1,-1,llm8_g7,0,
2026-03-03T03:40:18.522804+00:00,BUCKET,llm_style,eval,llm_style_eval_224,16,3072,1536,bf16,NVIDIA GeForce RTX 4060,c11,32,128,32,4,2,8,0.0,0.0,135.0880041718483,180.09440049529067,1.1177524231382983,7,-1,-1,llm8_g7,0,
2026-03-03T03:40:18.546541+00:00,BUCKET,llm_style,eval,llm_style_eval_225,1,2048,2048,bf16,NVIDIA GeForce RTX 4060,c11,32,128,32,4,2,8,0.0,0.0,154.62400019168854,201.2774409353732,0.05425165556188289,7,-1,-1,llm8_g7,0,
2026-03-03T03:40:18.559497+00:00,BUCKET,llm_style,eval,llm_style_eval_226,8,1536,1024,bf16,NVIDIA GeForce RTX 4060,c11,32,128,32,4,2,8,0.0,0.0,95.16800194978714,161.89504146575922,0.2644357713139557,7,-1,-1,llm8_g7,0,
2026-03-03T03:40:18.786047+00:00,BUCKET,llm_style,eval,llm_style_eval_227,64,6144,6144,bf16,NVIDIA GeForce RTX 4060,c04,64,64,64,4,3,8,0.0,0.0,966.6560292243958,1076.254745721817,4.998508323459032,1,-1,-1,llm8_g1,0,
2026-03-03T03:40:18.868295+00:00,BUCKET,llm_style,eval,llm_style_eval_228,64,6144,2048,bf16,NVIDIA GeForce RTX 4060,c04,64,64,64,4,3,8,0.0,0.0,359.42399501800537,464.9292725324631,4.481094079206693,1,-1,-1,llm8_g1,0,
2026-03-03T03:40:18.969974+00:00,BUCKET,llm_style,eval,llm_style_eval_229,16,1536,8192,bf16,NVIDIA GeForce RTX 4060,c06,64,128,32,4,3,8,0.0,0.0,679.9359917640686,794.5302432775497,0.5921927782574523,6,-1,-1,llm8_g6,0,
2026-03-03T03:40:18.996009+00:00,BUCKET,llm_style,eval,llm_style_eval_230,64,2048,1536,bf16,NVIDIA GeForce RTX 4060,c04,64,64,64,4,3,8,0.0,0.0,161.27999871969223,213.78880068659774,2.49660954362865,3,-1,-1,llm8_g3,0,
2026-03-03T03:40:19.078006+00:00,BUCKET,llm_style,eval,llm_style_eval_231,4,1024,8192,bf16,NVIDIA GeForce RTX 4060,c06,64,128,32,4,3,8,0.0,0.0,679.7599792480469,796.6802990436554,0.09872435278439913,6,-1,-1,llm8_g6,0,
2026-03-03T03:40:19.105873+00:00,BUCKET,llm_style,eval,llm_style_eval_232,16,3072,1536,bf16,NVIDIA GeForce RTX 4060,c11,32,128,32,4,2,8,0.0,0.0,158.60799700021744,311.8387249112129,0.9520008250264518,7,-1,-1,llm8_g7,0,
2026-03-03T03:40:19.172409+00:00,BUCKET,llm_style,eval,llm_style_eval_233,64,3072,3072,bf16,NVIDIA GeForce RTX 4060,c04,64,64,64,4,3,8,0.0,0.0,278.52800488471985,311.9820848107338,4.336941100410938,3,-1,-1,llm8_g3,0,
2026-03-03T03:40:19.365178+00:00,BUCKET,llm_style,eval,llm_style_eval_234,32,8192,4096,bf16,NVIDIA GeForce RTX 4060,c00,32,32,32,2,2,8,0.0,0.0,612.7040088176727,771.637428998947,3.5049283456525315,5,-1,-1,llm8_g5,0,
2026-03-03T03:40:19.381836+00:00,BUCKET,llm_style,eval,llm_style_eval_235,4,2048,1024,bf16,NVIDIA GeForce RTX 4060,c11,32,128,32,4,2,8,0.0,0.0,100.91199725866318,231.4467157423495,0.16625591065248385,7,-1,-1,llm8_g7,0,
2026-03-03T03:40:19.514353+00:00,BUCKET,llm_style,eval,llm_style_eval_236,4,8192,3072,bf16,NVIDIA GeForce RTX 4060,c00,32,32,32,2,2,8,0.0,0.0,402.43199467658997,422.4921578168869,0.5002748157779897,5,-1,-1,llm8_g5,0,
2026-03-03T03:40:19.544150+00:00,BUCKET,llm_style,eval,llm_style_eval_237,64,1024,4096,bf16,NVIDIA GeForce RTX 4060,c04,64,64,64,4,3,8,0.0,0.0,216.46400541067123,282.1324783563613,2.4801856132222038,3,-1,-1,llm8_g3,0,
2026-03-03T03:40:19.628635+00:00,BUCKET,llm_style,eval,llm_style_eval_238,32,2048,6144,bf16,NVIDIA GeForce RTX 4060,c11,32,128,32,4,2,8,0.0,0.0,446.9759911298752,566.3827323913574,1.8016770116988383,7,-1,-1,llm8_g7,0,
2026-03-03T03:40:19.657658+00:00,BUCKET,llm_style,eval,llm_style_eval_239,32,2048,6144,bf16,NVIDIA GeForce RTX 4060,c11,32,128,32,4,2,8,0.0,0.0,448.43199849128723,557.5497621297836,1.7958271727026336,7,-1,-1,llm8_g7,0,
2026-03-03T03:40:19.730215+00:00,BUCKET,llm_style,eval,llm_style_eval_240,8,8192,1536,bf16,NVIDIA GeForce RTX 4060,c00,32,32,32,2,2,8,0.0,0.0,195.5839991569519,217.2240018844604,1.0293612609814762,5,-1,-1,llm8_g5,0,
2026-03-03T03:40:19.747412+00:00,BUCKET,llm_style,eval,llm_style_eval_241,16,1536,1536,bf16,NVIDIA GeForce RTX 4060,c11,32,128,32,4,2,8,0.0,0.0,117.60000139474869,172.9536060988901,0.6419852985084341,7,-1,-1,llm8_g7,0,
2026-03-03T03:40:19.780988+00:00,BUCKET,llm_style,eval,llm_style_eval_242,1,2048,3072,bf16,NVIDIA GeForce RTX 4060,c11,32,128,32,4,2,8,0.0,0.0,174.54399913549423,252.62271448969824,0.0720902011087313,7,-1,-1,llm8_g7,0,
2026-03-03T03:40:19.840105+00:00,BUCKET,llm_style,eval,llm_style_eval_243,8,1536,6144,bf16,NVIDIA GeForce RTX 4060,c11,32,128,32,4,2,8,0.0,0.0,367.6000088453293,443.12865138053877,0.41075881492574273,7,-1,-1,llm8_g7,0,
2026-03-03T03:40:19.891488+00:00,BUCKET,llm_style,eval,llm_style_eval_244,32,8192,1024,bf16,NVIDIA GeForce RTX 4060,c00,32,32,32,2,2,8,0.0,0.0,159.743994474411,281.5999984741211,3.360820629072225,5,-1,-1,llm8_g5,0,
2026-03-03T03:40:20.024226+00:00,BUCKET,llm_style,eval,llm_style_eval_245,4,6144,4096,bf16,NVIDIA GeForce RTX 4060,c00,32,32,32,2,2,8,0.0,0.0,389.1200125217438,413.54688465595245,0.5173894570348011,5,-1,-1,llm8_g5,0,
2026-03-03T03:40:20.106755+00:00,BUCKET,llm_style,eval,llm_style_eval_246,32,2048,6144,bf16,NVIDIA GeForce RTX 4060,c11,32,128,32,4,2,8,0.0,0.0,416.76801443099976,474.890228807926,1.93226528935878,7,-1,-1,llm8_g7,0,
2026-03-03T03:40:20.182082+00:00,BUCKET,llm_style,eval,llm_style_eval_247,64,6144,2048,bf16,NVIDIA GeForce RTX 4060,c04,64,64,64,4,3,8,0.0,0.0,302.99200117588043,390.9155249595641,5.315693911883414,1,-1,-1,llm8_g1,0,
2026-03-03T03:40:20.192546+00:00,BUCKET,llm_style,eval,llm_style_eval_248,64,1024,1024,bf16,NVIDIA GeForce RTX 4060,c04,64,64,64,4,3,8,0.0,0.0,70.592001080513,143.31136286258695,1.9013163806890714,3,-1,-1,llm8_g3,0,
2026-03-03T03:40:20.238492+00:00,BUCKET,llm_style,eval,llm_style_eval_249,2,8192,1024,bf16,NVIDIA GeForce RTX 4060,c00,32,32,32,2,2,8,0.0,0.0,130.0320029258728,189.89056453108776,0.25804749019461265,5,-1,-1,llm8_g5,0,
2026-03-03T03:40:20.299755+00:00,BUCKET,llm_style,eval,llm_style_eval_250,64,3072,3072,bf16,NVIDIA GeForce RTX 4060,c04,64,64,64,4,3,8,0.0,0.0,243.6479926109314,318.1056070327759,4.957806296926594,3,-1,-1,llm8_g3,0,
2026-03-03T03:40:20.375721+00:00,BUCKET,llm_style,eval,llm_style_eval_251,64,1024,8192,bf16,NVIDIA GeForce RTX 4060,c06,64,128,32,4,3,8,0.0,0.0,565.200001001358,691.220498085022,1.8997555238812183,2,-1,-1,llm8_g2,0,
2026-03-03T03:40:20.457071+00:00,BUCKET,llm_style,eval,llm_style_eval_252,64,4096,3072,bf16,NVIDIA GeForce RTX 4060,c04,64,64,64,4,3,8,0.0,0.0,343.03998947143555,396.19839161634445,4.695116562012702,1,-1,-1,llm8_g1,0,
2026-03-03T03:40:20.591526+00:00,BUCKET,llm_style,eval,llm_style_eval_253,8,6144,4096,bf16,NVIDIA GeForce RTX 4060,c00,32,32,32,2,2,8,0.0,0.0,368.3519959449768,485.05857139825815,1.093120679221586,5,-1,-1,llm8_g5,0,
2026-03-03T03:40:20.621674+00:00,BUCKET,llm_style,eval,llm_style_eval_254,4,1536,3072,bf16,NVIDIA GeForce RTX 4060,c11,32,128,32,4,2,8,0.0,0.0,203.77600193023682,266.80318981409073,0.1852462294010625,7,-1,-1,llm8_g7,0,
2026-03-03T03:40:20.645176+00:00,BUCKET,llm_style,eval,llm_style_eval_255,1,3072,1536,bf16,NVIDIA GeForce RTX 4060,c11,32,128,32,4,2,8,0.0,0.0,117.64800176024437,223.02720084786398,0.08021542107644206,7,-1,-1,llm8_g7,0,
