results/llm_hp_m32_n3072_k4096.csv
timestamp,method,workload,split,shape_id,M,N,K,dtype,gpu,config_id,BLOCK_M,BLOCK_N,BLOCK_K,num_warps,num_stages,GROUP_M,compile_time_ms,tune_time_ms,runtime_cost_us,p99_us,runtime_perf_tflops,bucket_m,bucket_n,bucket_k,cache_key,invalid_config,notes
2026-03-03T03:28:42.788832+00:00,FULL,llm_style,tune,llm_style_tune_000,32,3072,2048,bf16,NVIDIA GeForce RTX 4060,c02,32,64,32,2,2,8,0.6965560605749488,488.484,54.27199974656105,67.55552016198635,7.419169845966734,7,-1,-1,32x3072x2048,0,
2026-03-03T03:28:42.914938+00:00,FULL,llm_style,tune,llm_style_tune_001,4,4096,1536,bf16,NVIDIA GeForce RTX 4060,c11,32,128,32,4,2,8,0.0,126.074,49.15200173854828,176.88639216124966,1.0239999637802455,5,-1,-1,4x4096x1536,0,
2026-03-03T03:28:43.023260+00:00,FULL,llm_style,tune,llm_style_tune_002,8,8192,1024,bf16,NVIDIA GeForce RTX 4060,c11,32,128,32,4,2,8,0.0,108.288,53.247999399900436,82.87487730383872,2.520615413022465,5,-1,-1,8x8192x1024,0,
2026-03-03T03:28:43.121934+00:00,FULL,llm_style,tune,llm_style_tune_003,64,1024,4096,bf16,NVIDIA GeForce RTX 4060,c04,64,64,64,4,3,8,0.0,98.634,63.48799914121628,330.65982349216847,8.456258178901475,3,-1,-1,64x1024x4096,0,
2026-03-03T03:28:43.267448+00:00,FULL,llm_style,tune,llm_style_tune_004,16,3072,4096,bf16,NVIDIA GeForce RTX 4060,c00,32,32,32,2,2,8,0.0,145.473,76.80000364780426,176.96991994976992,5.2428797509765745,7,-1,-1,16x3072x4096,0,
2026-03-03T03:28:43.361575+00:00,FULL,llm_style,tune,llm_style_tune_005,16,1536,4096,bf16,NVIDIA GeForce RTX 4060,c04,64,64,64,4,3,8,0.0,94.082,55.31200021505356,66.62144020199776,3.6398356815381905,7,-1,-1,16x1536x4096,0,
2026-03-03T03:28:43.425395+00:00,FULL,llm_style,tune,llm_style_tune_006,2,2048,1024,bf16,NVIDIA GeForce RTX 4060,c11,32,128,32,4,2,8,0.0,63.781,39.69600051641464,48.132801279425614,0.21132123868577735,7,-1,-1,2x2048x1024,0,
2026-03-03T03:28:43.501991+00:00,FULL,llm_style,tune,llm_style_tune_007,32,6144,1024,bf16,NVIDIA GeForce RTX 4060,c11,32,128,32,4,2,8,0.0,76.558,40.86400009691715,45.405761040747166,9.853494103490295,5,-1,-1,32x6144x1024,0,
2026-03-03T03:28:43.564908+00:00,FULL,llm_style,tune,llm_style_tune_008,8,1536,2048,bf16,NVIDIA GeForce RTX 4060,c00,32,32,32,2,2,8,0.0,62.871,39.903998374938965,105.26720188558086,1.2613184154400414,7,-1,-1,8x1536x2048,0,
2026-03-03T03:28:43.692402+00:00,FULL,llm_style,tune,llm_style_tune_009,16,1024,6144,bf16,NVIDIA GeForce RTX 4060,c04,64,64,64,4,3,8,0.0,127.449,73.40800017118454,84.35872115194798,2.742570176690747,6,-1,-1,16x1024x6144,0,
2026-03-03T03:28:43.772190+00:00,FULL,llm_style,tune,llm_style_tune_010,64,1536,2048,bf16,NVIDIA GeForce RTX 4060,c04,64,64,64,4,3,8,0.0,79.742,49.5039988309145,69.65760052204129,8.133750676895806,3,-1,-1,64x1536x2048,0,
2026-03-03T03:28:43.870388+00:00,FULL,llm_style,tune,llm_style_tune_011,64,1536,4096,bf16,NVIDIA GeForce RTX 4060,c04,64,64,64,4,3,8,0.0,98.155,60.22400036454201,77.94688023626802,13.371851141162967,3,-1,-1,64x1536x4096,0,
2026-03-03T03:28:43.937866+00:00,FULL,llm_style,tune,llm_style_tune_012,32,1024,2048,bf16,NVIDIA GeForce RTX 4060,c00,32,32,32,2,2,8,0.0,67.434,43.79200004041195,97.32095934450626,3.0648914842012642,7,-1,-1,32x1024x2048,0,
2026-03-03T03:28:43.990102+00:00,FULL,llm_style,tune,llm_style_tune_013,64,1536,1024,bf16,NVIDIA GeForce RTX 4060,c00,32,32,32,2,2,8,0.0,52.198,23.39200023561716,109.3324796110391,8.606642868165494,3,-1,-1,64x1536x1024,0,
2026-03-03T03:28:44.221037+00:00,FULL,llm_style,tune,llm_style_tune_014,4,6144,3072,bf16,NVIDIA GeForce RTX 4060,c11,32,128,32,4,2,8,0.0,230.897,176.12800002098083,189.50144454836845,0.8573023254792712,5,-1,-1,4x6144x3072,0,
2026-03-03T03:28:44.313255+00:00,FULL,llm_style,tune,llm_style_tune_015,1,6144,1024,bf16,NVIDIA GeForce RTX 4060,c11,32,128,32,4,2,8,0.0,92.179,40.40000028908253,60.01663979142902,0.3114582155931404,5,-1,-1,1x6144x1024,0,
2026-03-03T03:28:44.713436+00:00,FULL,llm_style,tune,llm_style_tune_016,4,8192,4096,bf16,NVIDIA GeForce RTX 4060,c02,32,64,32,2,2,8,0.0,400.145,291.83998703956604,414.76767927408207,0.9198035496198368,5,-1,-1,4x8192x4096,0,
2026-03-03T03:28:44.734429+00:00,FULL,llm_style,tune,llm_style_tune_017,64,1536,2048,bf16,NVIDIA GeForce RTX 4060,c04,64,64,64,4,3,8,0.0,0.0,57.34400078654289,200.24512290954584,7.021714189402912,3,-1,-1,64x1536x2048,0,
2026-03-03T03:28:44.915278+00:00,FULL,llm_style,tune,llm_style_tune_018,64,8192,1536,bf16,NVIDIA GeForce RTX 4060,c10,64,128,64,8,3,8,0.0,180.797,110.57600006461143,118.28224278986454,14.565662847805052,1,-1,-1,64x8192x1536,0,
2026-03-03T03:28:45.006719+00:00,FULL,llm_style,tune,llm_style_tune_019,2,1536,1024,bf16,NVIDIA GeForce RTX 4060,c04,64,64,64,4,3,8,0.0,91.396,61.77599914371967,70.98656013607979,0.10184304725469757,7,-1,-1,2x1536x1024,0,
2026-03-03T03:28:45.077686+00:00,FULL,llm_style,tune,llm_style_tune_020,16,1024,1536,bf16,NVIDIA GeForce RTX 4060,c11,32,128,32,4,2,8,0.0,70.928,44.03200000524521,48.509120494127274,1.143069767305695,7,-1,-1,16x1024x1536,0,
2026-03-03T03:28:45.185456+00:00,FULL,llm_style,tune,llm_style_tune_021,1,6144,1536,bf16,NVIDIA GeForce RTX 4060,c11,32,128,32,4,2,8,0.0,107.73,46.08000069856644,80.95327962189901,0.4095999937905207,5,-1,-1,1x6144x1536,0,
2026-03-03T03:28:45.406119+00:00,FULL,llm_style,tune,llm_style_tune_022,8,4096,4096,bf16,NVIDIA GeForce RTX 4060,c03,64,64,32,4,2,8,0.0,220.621,161.0880047082901,228.71040642261488,1.6663900982950435,5,-1,-1,8x4096x4096,0,
2026-03-03T03:28:45.814745+00:00,FULL,llm_style,tune,llm_style_tune_023,2,4096,8192,bf16,NVIDIA GeForce RTX 4060,c11,32,128,32,4,2,8,0.0,408.582,293.3119982481003,392.55679070949543,0.4575937186397362,4,-1,-1,2x4096x8192,0,
2026-03-03T03:28:45.833469+00:00,FULL,llm_style,tune,llm_style_tune_024,64,1536,2048,bf16,NVIDIA GeForce RTX 4060,c04,64,64,64,4,3,8,0.0,0.0,40.880000218749046,130.06880253553388,9.849637520680067,3,-1,-1,64x1536x2048,0,
2026-03-03T03:28:45.857957+00:00,FULL,llm_style,tune,llm_style_tune_025,4,4096,1536,bf16,NVIDIA GeForce RTX 4060,c11,32,128,32,4,2,8,0.0,0.0,31.295999884605408,105.95584496855724,1.6082454047029275,5,-1,-1,4x4096x1536,0,
2026-03-03T03:28:45.937591+00:00,FULL,llm_style,tune,llm_style_tune_026,4,3072,2048,bf16,NVIDIA GeForce RTX 4060,c00,32,32,32,2,2,8,0.0,79.581,51.59999988973141,62.463998794555664,0.9754195369681811,7,-1,-1,4x3072x2048,0,
2026-03-03T03:28:46.012880+00:00,FULL,llm_style,tune,llm_style_tune_027,8,4096,1024,bf16,NVIDIA GeForce RTX 4060,c11,32,128,32,4,2,8,0.0,75.239,38.91199827194214,46.49631977081298,1.7246316555371939,5,-1,-1,8x4096x1024,0,
2026-03-03T03:28:46.064844+00:00,FULL,llm_style,tune,llm_style_tune_028,16,1536,1024,bf16,NVIDIA GeForce RTX 4060,c04,64,64,64,4,3,8,0.0,51.922,35.599999129772186,91.27936109900472,1.413810371638683,7,-1,-1,16x1536x1024,0,
2026-03-03T03:28:46.470987+00:00,FULL,llm_style,tune,llm_style_tune_029,64,4096,8192,bf16,NVIDIA GeForce RTX 4060,c02,32,64,32,2,2,8,0.0,406.105,300.03198981285095,342.8799992799758,14.315031202769559,0,-1,-1,64x4096x8192,0,
2026-03-03T03:28:46.609001+00:00,FULL,llm_style,tune,llm_style_tune_030,1,8192,1536,bf16,NVIDIA GeForce RTX 4060,c11,32,128,32,4,2,8,0.0,137.969,60.22400036454201,64.48767900466918,0.4178703481613427,5,-1,-1,1x8192x1536,0,
2026-03-03T03:28:47.185982+00:00,FULL,llm_style,tune,llm_style_tune_031,1,8192,6144,bf16,NVIDIA GeForce RTX 4060,c11,32,128,32,4,2,8,0.0,576.937,425.02400279045105,449.74081069231033,0.2368414379872797,4,-1,-1,1x8192x6144,0,
2026-03-03T03:28:47.498789+00:00,FULL,llm_style,tune,llm_style_tune_032,32,3072,8192,bf16,NVIDIA GeForce RTX 4060,c04,64,64,64,4,3,8,0.0,312.761,231.1839982867241,350.441591143608,6.966800245415128,6,-1,-1,32x3072x8192,0,
2026-03-03T03:28:47.647271+00:00,FULL,llm_style,tune,llm_style_tune_033,4,1536,6144,bf16,NVIDIA GeForce RTX 4060,c04,64,64,64,4,3,8,0.0,148.441,93.83999928832054,119.50815908610815,0.804534021446828,6,-1,-1,4x1536x6144,0,
2026-03-03T03:28:47.746471+00:00,FULL,llm_style,tune,llm_style_tune_034,1,4096,1536,bf16,NVIDIA GeForce RTX 4060,c00,32,32,32,2,2,8,0.0,99.156,24.49600026011467,175.2719949930903,0.5136721042776923,5,-1,-1,1x4096x1536,0,
2026-03-03T03:28:47.840671+00:00,FULL,llm_style,tune,llm_style_tune_035,4,1536,4096,bf16,NVIDIA GeForce RTX 4060,c04,64,64,64,4,3,8,0.0,94.156,55.296000093221664,60.81279914826155,0.9102222206877092,7,-1,-1,4x1536x4096,0,
2026-03-03T03:28:48.148781+00:00,FULL,llm_style,tune,llm_style_tune_036,32,8192,3072,bf16,NVIDIA GeForce RTX 4060,c11,32,128,32,4,2,8,0.0,308.071,230.30399531126022,262.7974352240562,6.993420734291762,5,-1,-1,32x8192x3072,0,
2026-03-03T03:28:48.190395+00:00,FULL,llm_style,tune,llm_style_tune_037,32,3072,2048,bf16,NVIDIA GeForce RTX 4060,c02,32,64,32,2,2,8,0.0,0.0,54.27199974656105,147.92032480239868,7.419169845966734,7,-1,-1,32x3072x2048,0,
2026-03-03T03:28:48.306671+00:00,FULL,llm_style,tune,llm_style_tune_038,2,2048,4096,bf16,NVIDIA GeForce RTX 4060,c00,32,32,32,2,2,8,0.0,116.211,58.799998834729195,101.72416083514685,0.5706536167511225,7,-1,-1,2x2048x4096,0,
2026-03-03T03:28:48.416437+00:00,FULL,llm_style,tune,llm_style_tune_039,64,2048,1536,bf16,NVIDIA GeForce RTX 4060,c11,32,128,32,4,2,8,0.0,109.726,67.60000064969063,133.2224002480507,5.9564079900913836,3,-1,-1,64x2048x1536,0,
2026-03-03T03:28:48.544011+00:00,FULL,llm_style,tune,llm_style_tune_040,64,1024,6144,bf16,NVIDIA GeForce RTX 4060,c04,64,64,64,4,3,8,0.0,127.531,71.68000191450119,99.4585589319467,11.234742557074105,2,-1,-1,64x1024x6144,0,
2026-03-03T03:28:49.119875+00:00,FULL,llm_style,tune,llm_style_tune_041,4,8192,6144,bf16,NVIDIA GeForce RTX 4060,c11,32,128,32,4,2,8,0.0,575.818,427.42399871349335,486.9065594673156,0.9420462707099948,4,-1,-1,4x8192x6144,0,
2026-03-03T03:28:49.239103+00:00,FULL,llm_style,tune,llm_style_tune_042,1,1024,6144,bf16,NVIDIA GeForce RTX 4060,c04,64,64,64,4,3,8,0.0,119.183,71.6480016708374,94.19584184885025,0.17562125539534162,6,-1,-1,1x1024x6144,0,
2026-03-03T03:28:49.483919+00:00,FULL,llm_style,tune,llm_style_tune_043,64,2048,8192,bf16,NVIDIA GeForce RTX 4060,c06,64,128,32,4,3,8,0.0,244.772,167.7599996328354,181.37503787875173,12.800927829637862,2,-1,-1,64x2048x8192,0,
2026-03-03T03:28:49.555023+00:00,FULL,llm_style,tune,llm_style_tune_044,16,2048,1024,bf16,NVIDIA GeForce RTX 4060,c00,32,32,32,2,2,8,0.0,71.054,38.32000121474266,340.77312603592827,1.7512751010608407,7,-1,-1,16x2048x1024,0,
2026-03-03T03:28:49.612899+00:00,FULL,llm_style,tune,llm_style_tune_045,4,1024,1536,bf16,NVIDIA GeForce RTX 4060,c04,64,64,64,4,3,8,0.0,57.837,37.88800165057182,43.10688026249409,0.3321080936399846,7,-1,-1,4x1024x1536,0,
2026-03-03T03:28:49.650606+00:00,FULL,llm_style,tune,llm_style_tune_046,64,1536,4096,bf16,NVIDIA GeForce RTX 4060,c04,64,64,64,4,3,8,0.0,0.0,60.2400004863739,110.827523767948,13.368299493658832,3,-1,-1,64x1536x4096,0,
2026-03-03T03:28:49.719668+00:00,FULL,llm_style,tune,llm_style_tune_047,16,2048,1536,bf16,NVIDIA GeForce RTX 4060,c00,32,32,32,2,2,8,0.0,69.012,39.93599861860275,53.969601169228554,2.5206154718041685,7,-1,-1,16x2048x1536,0,
2026-03-03T03:28:50.154501+00:00,FULL,llm_style,tune,llm_style_tune_048,64,6144,6144,bf16,NVIDIA GeForce RTX 4060,c06,64,128,32,4,3,8,0.0,434.789,332.8000009059906,417.4582427740096,14.518744575859836,0,-1,-1,64x6144x6144,0,
2026-03-03T03:28:50.552983+00:00,FULL,llm_style,tune,llm_style_tune_049,4,4096,8192,bf16,NVIDIA GeForce RTX 4060,c02,32,64,32,2,2,8,0.0,398.436,292.86399483680725,315.84415435791016,0.9165874287468502,4,-1,-1,4x4096x8192,0,
2026-03-03T03:28:50.701060+00:00,FULL,llm_style,tune,llm_style_tune_050,1,4096,3072,bf16,NVIDIA GeForce RTX 4060,c11,32,128,32,4,2,8,0.0,148.033,68.60800087451935,80.78976027667522,0.3668059654737216,5,-1,-1,1x4096x3072,0,
2026-03-03T03:28:50.805461+00:00,FULL,llm_style,tune,llm_style_tune_051,2,4096,2048,bf16,NVIDIA GeForce RTX 4060,c11,32,128,32,4,2,8,0.0,104.355,52.22399905323982,74.49599906802172,0.6425098155695218,5,-1,-1,2x4096x2048,0,
2026-03-03T03:28:50.949340+00:00,FULL,llm_style,tune,llm_style_tune_052,4,8192,1536,bf16,NVIDIA GeForce RTX 4060,c00,32,32,32,2,2,8,0.0,143.835,58.36800113320351,197.65472248196596,1.7246315454639782,5,-1,-1,4x8192x1536,0,
2026-03-03T03:28:51.048214+00:00,FULL,llm_style,tune,llm_style_tune_053,1,1536,4096,bf16,NVIDIA GeForce RTX 4060,c04,64,64,64,4,3,8,0.0,98.828,60.416001826524734,68.62880028784272,0.20827118014412635,7,-1,-1,1x1536x4096,0,
2026-03-03T03:28:51.636312+00:00,FULL,llm_style,tune,llm_style_tune_054,8,8192,6144,bf16,NVIDIA GeForce RTX 4060,c02,32,64,32,2,2,8,0.0,588.047,426.9600063562393,545.8582496643066,1.8861400506165504,4,-1,-1,8x8192x6144,0,
2026-03-03T03:28:51.760050+00:00,FULL,llm_style,tune,llm_style_tune_055,64,6144,1536,bf16,NVIDIA GeForce RTX 4060,c06,64,128,32,4,3,8,0.0,123.687,75.58400183916092,91.63008026778695,15.9816829303439,1,-1,-1,64x6144x1536,0,
2026-03-03T03:28:51.836344+00:00,FULL,llm_style,tune,llm_style_tune_056,1,3072,1536,bf16,NVIDIA GeForce RTX 4060,c11,32,128,32,4,2,8,0.0,76.25,44.03200000524521,74.60480153560637,0.2143255813698178,7,-1,-1,1x3072x1536,0,
2026-03-03T03:28:51.884606+00:00,FULL,llm_style,tune,llm_style_tune_057,64,1024,1024,bf16,NVIDIA GeForce RTX 4060,c04,64,64,64,4,3,8,0.0,48.208,33.824000507593155,41.000958979129784,3.9681210378964322,3,-1,-1,64x1024x1024,0,
2026-03-03T03:28:52.283302+00:00,FULL,llm_style,tune,llm_style_tune_058,16,8192,4096,bf16,NVIDIA GeForce RTX 4060,c00,32,32,32,2,2,8,0.0,398.649,295.9359884262085,332.6684683561325,3.628290799338645,5,-1,-1,16x8192x4096,0,
2026-03-03T03:28:52.598548+00:00,FULL,llm_style,tune,llm_style_tune_059,16,4096,6144,bf16,NVIDIA GeForce RTX 4060,c02,32,64,32,2,2,8,0.0,315.197,228.35199534893036,239.9961617588997,3.526600968690735,4,-1,-1,16x4096x6144,0,
2026-03-03T03:28:52.892122+00:00,FULL,llm_style,tune,llm_style_tune_060,2,3072,8192,bf16,NVIDIA GeForce RTX 4060,c06,64,128,32,4,3,8,0.0,293.526,226.3839989900589,263.2790499925613,0.4446572922515623,6,-1,-1,2x3072x8192,0,
2026-03-03T03:28:53.064078+00:00,FULL,llm_style,tune,llm_style_tune_061,64,4096,8192,bf16,NVIDIA GeForce RTX 4060,c02,32,64,32,2,2,8,0.0,0.0,300.01600086688995,339.65951055288303,14.315794102947116,0,-1,-1,64x4096x8192,0,
2026-03-03T03:28:53.224500+00:00,FULL,llm_style,tune,llm_style_tune_062,32,4096,3072,bf16,NVIDIA GeForce RTX 4060,c11,32,128,32,4,2,8,0.0,160.369,79.85599711537361,83.84159751236439,10.084482031280842,5,-1,-1,32x4096x3072,0,
2026-03-03T03:28:53.354641+00:00,FULL,llm_style,tune,llm_style_tune_063,2,3072,8192,bf16,NVIDIA GeForce RTX 4060,c06,64,128,32,4,3,8,0.0,0.0,229.24800217151642,351.8361562490463,0.4391021733951111,6,-1,-1,2x3072x8192,0,
2026-03-03T03:28:53.407131+00:00,FULL,llm_style,eval,llm_style_eval_000,32,1536,1024,bf16,NVIDIA GeForce RTX 4060,c04,64,64,64,4,3,8,0.0,52.436,34.92799960076809,73.9472003653645,2.882022937202116,7,-1,-1,32x1536x1024,0,
2026-03-03T03:28:53.634934+00:00,FULL,llm_style,eval,llm_style_eval_001,32,2048,8192,bf16,NVIDIA GeForce RTX 4060,c10,64,128,64,8,3,8,0.0,227.763,163.83999586105347,192.96096488833427,6.5536001655578655,6,-1,-1,32x2048x8192,0,
2026-03-03T03:28:53.770511+00:00,FULL,llm_style,eval,llm_style_eval_002,16,2048,4096,bf16,NVIDIA GeForce RTX 4060,c00,32,32,32,2,2,8,0.0,135.536,64.89599868655205,247.10207387804957,4.136394561035179,7,-1,-1,16x2048x4096,0,
2026-03-03T03:28:53.791390+00:00,FULL,llm_style,eval,llm_style_eval_003,16,2048,1536,bf16,NVIDIA GeForce RTX 4060,c00,32,32,32,2,2,8,0.0,0.0,52.22399905323982,120.0489597022533,1.9275294467085655,7,-1,-1,16x2048x1536,0,
2026-03-03T03:28:54.017456+00:00,FULL,llm_style,eval,llm_style_eval_004,64,8192,2048,bf16,NVIDIA GeForce RTX 4060,c00,32,32,32,2,2,8,0.0,226.011,166.8960005044937,209.1439987719058,12.867196586548392,1,-1,-1,64x8192x2048,0,
2026-03-03T03:28:54.316835+00:00,FULL,llm_style,eval,llm_style_eval_005,64,3072,8192,bf16,NVIDIA GeForce RTX 4060,c00,32,32,32,2,2,8,0.0,299.338,232.44799673557281,249.14176434278485,13.857832793734023,2,-1,-1,64x3072x8192,0,
2026-03-03T03:28:54.394475+00:00,FULL,llm_style,eval,llm_style_eval_006,32,2048,2048,bf16,NVIDIA GeForce RTX 4060,c11,32,128,32,4,2,8,0.0,77.597,51.920000463724136,58.487361744046204,5.170174376010504,7,-1,-1,32x2048x2048,0,
2026-03-03T03:28:54.605275+00:00,FULL,llm_style,eval,llm_style_eval_007,8,8192,2048,bf16,NVIDIA GeForce RTX 4060,c11,32,128,32,4,2,8,0.0,210.753,160.800002515316,187.97952085733414,1.6693747002549446,5,-1,-1,8x8192x2048,0,
2026-03-03T03:28:54.803778+00:00,FULL,llm_style,eval,llm_style_eval_008,64,1536,8192,bf16,NVIDIA GeForce RTX 4060,c04,64,64,64,4,3,8,0.0,198.461,123.90399724245071,206.41215831041333,12.998876322354743,2,-1,-1,64x1536x8192,0,
2026-03-03T03:28:55.115809+00:00,FULL,llm_style,eval,llm_style_eval_009,64,4096,6144,bf16,NVIDIA GeForce RTX 4060,c02,32,64,32,2,2,8,0.0,311.989,231.31199926137924,272.4876832962036,13.925890063143944,0,-1,-1,64x4096x6144,0,
2026-03-03T03:28:55.243147+00:00,FULL,llm_style,eval,llm_style_eval_010,64,2048,4096,bf16,NVIDIA GeForce RTX 4060,c03,64,64,32,4,2,8,0.0,127.278,76.80000364780426,94.39231835305688,13.981012669270863,3,-1,-1,64x2048x4096,0,
2026-03-03T03:28:55.488077+00:00,FULL,llm_style,eval,llm_style_eval_011,32,3072,6144,bf16,NVIDIA GeForce RTX 4060,c10,64,128,64,8,3,8,0.0,244.887,180.00000715255737,230.76896667480457,6.710886133333344,6,-1,-1,32x3072x6144,0,
2026-03-03T03:28:55.556444+00:00,FULL,llm_style,eval,llm_style_eval_012,16,1536,1536,bf16,NVIDIA GeForce RTX 4060,c04,64,64,64,4,3,8,0.0,68.323,40.94399884343147,127.54943817853916,1.8439203334461758,7,-1,-1,16x1536x1536,0,
2026-03-03T03:28:55.653913+00:00,FULL,llm_style,eval,llm_style_eval_013,64,2048,3072,bf16,NVIDIA GeForce RTX 4060,c03,64,64,32,4,2,8,0.0,97.424,63.471999019384384,109.46048319339744,12.687584768742813,3,-1,-1,64x2048x3072,0,
2026-03-03T03:28:56.235559+00:00,FULL,llm_style,eval,llm_style_eval_014,16,8192,6144,bf16,NVIDIA GeForce RTX 4060,c00,32,32,32,2,2,8,0.0,581.601,429.05598878860474,498.5439875721931,3.7538521267291913,4,-1,-1,16x8192x6144,0,
2026-03-03T03:28:56.287031+00:00,FULL,llm_style,eval,llm_style_eval_015,64,6144,1536,bf16,NVIDIA GeForce RTX 4060,c06,64,128,32,4,3,8,0.0,0.0,44.43199932575226,103.33791792392724,27.186702609168456,1,-1,-1,64x6144x1536,0,
2026-03-03T03:28:56.511548+00:00,FULL,llm_style,eval,llm_style_eval_016,16,4096,4096,bf16,NVIDIA GeForce RTX 4060,c03,64,64,32,4,2,8,0.0,224.458,161.47200018167496,185.68671450018883,3.3248545345072658,5,-1,-1,16x4096x4096,0,
2026-03-03T03:28:56.924025+00:00,FULL,llm_style,eval,llm_style_eval_017,64,8192,4096,bf16,NVIDIA GeForce RTX 4060,c06,64,128,32,4,3,8,0.0,412.427,302.8640002012253,316.8444672226906,14.18117469605628,1,-1,-1,64x8192x4096,0,
2026-03-03T03:28:57.243626+00:00,FULL,llm_style,eval,llm_style_eval_018,32,4096,6144,bf16,NVIDIA GeForce RTX 4060,c11,32,128,32,4,2,8,0.0,319.558,229.0399968624115,247.82848194241524,7.032015185398053,4,-1,-1,32x4096x6144,0,
2026-03-03T03:28:57.557919+00:00,FULL,llm_style,eval,llm_style_eval_019,16,3072,8192,bf16,NVIDIA GeForce RTX 4060,c04,64,64,64,4,3,8,0.0,314.249,229.37600314617157,248.75072106719014,3.510857094701456,6,-1,-1,16x3072x8192,0,
2026-03-03T03:28:57.655167+00:00,FULL,llm_style,eval,llm_style_eval_020,4,1536,1536,bf16,NVIDIA GeForce RTX 4060,c00,32,32,32,2,2,8,0.0,97.204,40.73600098490715,225.65151825547213,0.46333384582824,7,-1,-1,4x1536x1536,0,
2026-03-03T03:28:57.794102+00:00,FULL,llm_style,eval,llm_style_eval_021,4,6144,1536,bf16,NVIDIA GeForce RTX 4060,c00,32,32,32,2,2,8,0.0,138.889,57.34400078654289,210.16096591949452,1.3165714105130462,5,-1,-1,4x6144x1536,0,
2026-03-03T03:28:57.826638+00:00,FULL,llm_style,eval,llm_style_eval_022,32,6144,1024,bf16,NVIDIA GeForce RTX 4060,c11,32,128,32,4,2,8,0.0,0.0,43.96799951791763,918.652464449403,9.157869096043651,5,-1,-1,32x6144x1024,0,
2026-03-03T03:28:57.839758+00:00,FULL,llm_style,eval,llm_style_eval_023,16,1024,1536,bf16,NVIDIA GeForce RTX 4060,c11,32,128,32,4,2,8,0.0,0.0,68.52800026535988,137.31839433312413,0.7344683604526845,7,-1,-1,16x1024x1536,0,
2026-03-03T03:28:57.937305+00:00,FULL,llm_style,eval,llm_style_eval_024,32,8192,1024,bf16,NVIDIA GeForce RTX 4060,c11,32,128,32,4,2,8,0.0,97.503,47.10400104522705,54.31295976042746,11.39756496448193,5,-1,-1,32x8192x1024,0,
2026-03-03T03:28:58.373548+00:00,FULL,llm_style,eval,llm_style_eval_025,32,6144,6144,bf16,NVIDIA GeForce RTX 4060,c10,64,128,64,8,3,8,0.0,436.192,332.19200372695923,589.971829652786,7.272658814466023,4,-1,-1,32x6144x6144,0,
2026-03-03T03:28:58.513474+00:00,FULL,llm_style,eval,llm_style_eval_026,1,6144,2048,bf16,NVIDIA GeForce RTX 4060,c00,32,32,32,2,2,8,0.0,139.885,36.75200045108795,104.37663733959188,0.6847470529799426,5,-1,-1,1x6144x2048,0,
2026-03-03T03:28:58.578198+00:00,FULL,llm_style,eval,llm_style_eval_027,32,4096,3072,bf16,NVIDIA GeForce RTX 4060,c11,32,128,32,4,2,8,0.0,0.0,83.03999900817871,173.94688293337816,9.697812832592694,5,-1,-1,32x4096x3072,0,
2026-03-03T03:28:58.638414+00:00,FULL,llm_style,eval,llm_style_eval_028,64,1536,1536,bf16,NVIDIA GeForce RTX 4060,c04,64,64,64,4,3,8,0.0,60.166,38.91199827194214,47.10400104522705,7.760842449917372,3,-1,-1,64x1536x1536,0,
2026-03-03T03:28:58.694129+00:00,FULL,llm_style,eval,llm_style_eval_029,2,3072,1024,bf16,NVIDIA GeForce RTX 4060,c00,32,32,32,2,2,8,0.0,55.669,37.696000188589096,59.95167870074507,0.33379965877146184,7,-1,-1,2x3072x1024,0,
2026-03-03T03:28:58.895667+00:00,FULL,llm_style,eval,llm_style_eval_030,32,1536,8192,bf16,NVIDIA GeForce RTX 4060,c04,64,64,64,4,3,8,0.0,201.494,119.6800023317337,182.79423847794533,6.728829815425809,6,-1,-1,32x1536x8192,0,
2026-03-03T03:28:59.006283+00:00,FULL,llm_style,eval,llm_style_eval_031,8,3072,2048,bf16,NVIDIA GeForce RTX 4060,c00,32,32,32,2,2,8,0.0,110.572,49.15200173854828,178.70720028877247,2.047999927560491,7,-1,-1,8x3072x2048,0,
2026-03-03T03:28:59.096822+00:00,FULL,llm_style,eval,llm_style_eval_032,8,2048,3072,bf16,NVIDIA GeForce RTX 4060,c00,32,32,32,2,2,8,0.0,90.496,56.32000043988228,160.55935829877848,1.7873454405855542,7,-1,-1,8x2048x3072,0,
2026-03-03T03:28:59.169746+00:00,FULL,llm_style,eval,llm_style_eval_033,64,1536,8192,bf16,NVIDIA GeForce RTX 4060,c04,64,64,64,4,3,8,0.0,0.0,135.13600081205368,372.7769520878792,11.918457896649096,2,-1,-1,64x1536x8192,0,
2026-03-03T03:28:59.326467+00:00,FULL,llm_style,eval,llm_style_eval_034,64,6144,2048,bf16,NVIDIA GeForce RTX 4060,c10,64,128,64,8,3,8,0.0,156.663,94.2080020904541,111.58399909734723,17.096347446722895,1,-1,-1,64x6144x2048,0,
2026-03-03T03:28:59.457613+00:00,FULL,llm_style,eval,llm_style_eval_035,4,4096,2048,bf16,NVIDIA GeForce RTX 4060,c01,64,32,32,2,2,8,0.0,131.105,50.063999369740486,177.5513564050196,1.3404615061688763,5,-1,-1,4x4096x2048,0,
2026-03-03T03:28:59.626537+00:00,FULL,llm_style,eval,llm_style_eval_036,64,8192,4096,bf16,NVIDIA GeForce RTX 4060,c06,64,128,32,4,3,8,0.0,0.0,329.0880024433136,344.00735944509506,13.051120867707175,1,-1,-1,64x8192x4096,0,
2026-03-03T03:28:59.659662+00:00,FULL,llm_style,eval,llm_style_eval_037,32,6144,1024,bf16,NVIDIA GeForce RTX 4060,c11,32,128,32,4,2,8,0.0,0.0,64.27199766039848,171.8886382877825,6.2648306985500275,5,-1,-1,32x6144x1024,0,
2026-03-03T03:28:59.719752+00:00,FULL,llm_style,eval,llm_style_eval_038,64,6144,2048,bf16,NVIDIA GeForce RTX 4060,c10,64,128,64,8,3,8,0.0,0.0,94.2080020904541,128.82080115377894,17.096347446722895,1,-1,-1,64x6144x2048,0,
2026-03-03T03:28:59.792471+00:00,FULL,llm_style,eval,llm_style_eval_039,8,1024,3072,bf16,NVIDIA GeForce RTX 4060,c00,32,32,32,2,2,8,0.0,72.667,48.128001391887665,145.21344065666193,1.0457872037978244,7,-1,-1,8x1024x3072,0,
2026-03-03T03:29:00.010981+00:00,FULL,llm_style,eval,llm_style_eval_040,32,8192,2048,bf16,NVIDIA GeForce RTX 4060,c11,32,128,32,4,2,8,0.0,218.465,163.64800184965134,172.4649579823017,6.561288936399486,5,-1,-1,32x8192x2048,0,
2026-03-03T03:29:00.073788+00:00,FULL,llm_style,eval,llm_style_eval_041,32,3072,1024,bf16,NVIDIA GeForce RTX 4060,c11,32,128,32,4,2,8,0.0,62.759,39.84000161290169,48.7199994549155,5.053378108669627,7,-1,-1,32x3072x1024,0,
2026-03-03T03:29:00.092276+00:00,FULL,llm_style,eval,llm_style_eval_042,64,1024,4096,bf16,NVIDIA GeForce RTX 4060,c04,64,64,64,4,3,8,0.0,0.0,52.94400081038475,69.3324787914753,10.140354030341715,3,-1,-1,64x1024x4096,0,
2026-03-03T03:29:00.103413+00:00,FULL,llm_style,eval,llm_style_eval_043,2,1536,1024,bf16,NVIDIA GeForce RTX 4060,c04,64,64,64,4,3,8,0.0,0.0,67.05600023269653,159.35488164424885,0.09382390804950343,7,-1,-1,2x1536x1024,0,
2026-03-03T03:29:00.339426+00:00,FULL,llm_style,eval,llm_style_eval_044,64,6144,3072,bf16,NVIDIA GeForce RTX 4060,c06,64,128,32,4,3,8,0.0,235.972,181.2319979071617,190.5663974583149,13.330532863394156,1,-1,-1,64x6144x3072,0,
2026-03-03T03:29:00.494686+00:00,FULL,llm_style,eval,llm_style_eval_045,64,1536,6144,bf16,NVIDIA GeForce RTX 4060,c04,64,64,64,4,3,8,0.0,155.221,94.2080020904541,140.6566391140222,12.82226058504217,2,-1,-1,64x1536x6144,0,
2026-03-03T03:29:00.737712+00:00,FULL,llm_style,eval,llm_style_eval_046,2,6144,3072,bf16,NVIDIA GeForce RTX 4060,c11,32,128,32,4,2,8,0.0,242.983,176.12800002098083,225.01823320984823,0.4286511627396356,5,-1,-1,2x6144x3072,0,
2026-03-03T03:29:01.151431+00:00,FULL,llm_style,eval,llm_style_eval_047,16,4096,8192,bf16,NVIDIA GeForce RTX 4060,c02,32,64,32,2,2,8,0.0,413.677,293.88800263404846,317.85630732774734,3.6535748801458605,4,-1,-1,16x4096x8192,0,
2026-03-03T03:29:01.190773+00:00,FULL,llm_style,eval,llm_style_eval_048,16,1024,6144,bf16,NVIDIA GeForce RTX 4060,c04,64,64,64,4,3,8,0.0,0.0,67.58400052785873,198.297603726387,2.9789090676425904,6,-1,-1,16x1024x6144,0,
2026-03-03T03:29:01.331577+00:00,FULL,llm_style,eval,llm_style_eval_049,16,8192,1536,bf16,NVIDIA GeForce RTX 4060,c11,32,128,32,4,2,8,0.0,140.755,62.20800057053566,68.7116813659668,6.472691298660925,5,-1,-1,16x8192x1536,0,
2026-03-03T03:29:01.379602+00:00,FULL,llm_style,eval,llm_style_eval_050,1,1024,1024,bf16,NVIDIA GeForce RTX 4060,c00,32,32,32,2,2,8,0.0,47.985,32.55999833345413,88.43424141406999,0.06440884850553748,7,-1,-1,1x1024x1024,0,
2026-03-03T03:29:01.456270+00:00,FULL,llm_style,eval,llm_style_eval_051,16,6144,1024,bf16,NVIDIA GeForce RTX 4060,c11,32,128,32,4,2,8,0.0,76.629,40.95999896526337,54.18272074311972,4.9152001241684,5,-1,-1,16x6144x1024,0,
2026-03-03T03:29:02.226394+00:00,FULL,llm_style,eval,llm_style_eval_052,16,8192,8192,bf16,NVIDIA GeForce RTX 4060,c11,32,128,32,4,2,8,0.0,770.08,557.3759973049164,637.2089552879331,3.8528455806919224,4,-1,-1,16x8192x8192,0,
2026-03-03T03:29:02.769664+00:00,FULL,llm_style,eval,llm_style_eval_053,1,6144,8192,bf16,NVIDIA GeForce RTX 4060,c02,32,64,32,2,2,8,0.0,543.226,423.93600940704346,494.2588716745375,0.2374492700933735,4,-1,-1,1x6144x8192,0,
2026-03-03T03:29:02.941999+00:00,FULL,llm_style,eval,llm_style_eval_054,64,4096,3072,bf16,NVIDIA GeForce RTX 4060,c04,64,64,64,4,3,8,0.0,172.296,88.06400001049042,103.09663847088812,18.28911627689112,1,-1,-1,64x4096x3072,0,
2026-03-03T03:29:03.049794+00:00,FULL,llm_style,eval,llm_style_eval_055,4,8192,1024,bf16,NVIDIA GeForce RTX 4060,c11,32,128,32,4,2,8,0.0,107.722,49.15200173854828,64.11264117807148,1.3653332850403275,5,-1,-1,4x8192x1024,0,
2026-03-03T03:29:03.129595+00:00,FULL,llm_style,eval,llm_style_eval_056,64,1024,3072,bf16,NVIDIA GeForce RTX 4060,c04,64,64,64,4,3,8,0.0,79.76,50.175998359918594,67.66815755516286,8.024816588834353,3,-1,-1,64x1024x3072,0,
2026-03-03T03:29:03.135637+00:00,FULL,llm_style,eval,llm_style_eval_057,64,1024,3072,bf16,NVIDIA GeForce RTX 4060,c04,64,64,64,4,3,8,0.0,0.0,72.09600135684013,120.66175647079939,5.5849586165959835,3,-1,-1,64x1024x3072,0,
2026-03-03T03:29:03.271378+00:00,FULL,llm_style,eval,llm_style_eval_058,32,2048,4096,bf16,NVIDIA GeForce RTX 4060,c00,32,32,32,2,2,8,0.0,135.703,65.96799939870834,74.31167900562285,8.138353700180756,7,-1,-1,32x2048x4096,0,
2026-03-03T03:29:03.358844+00:00,FULL,llm_style,eval,llm_style_eval_059,64,8192,2048,bf16,NVIDIA GeForce RTX 4060,c00,32,32,32,2,2,8,0.0,0.0,169.79199647903442,275.30271515250195,12.647731886851139,1,-1,-1,64x8192x2048,0,
2026-03-03T03:29:03.597205+00:00,FULL,llm_style,eval,llm_style_eval_060,1,3072,6144,bf16,NVIDIA GeForce RTX 4060,c06,64,128,32,4,3,8,0.0,238.315,177.15199291706085,200.20223692059517,0.21308671372200275,6,-1,-1,1x3072x6144,0,
2026-03-03T03:29:03.632341+00:00,FULL,llm_style,eval,llm_style_eval_061,64,1536,4096,bf16,NVIDIA GeForce RTX 4060,c04,64,64,64,4,3,8,0.0,0.0,62.03199923038483,84.96063873171806,12.982112103289117,3,-1,-1,64x1536x4096,0,
2026-03-03T03:29:03.768775+00:00,FULL,llm_style,eval,llm_style_eval_062,16,6144,2048,bf16,NVIDIA GeForce RTX 4060,c11,32,128,32,4,2,8,0.0,136.379,60.416001826524734,88.37791860103607,6.664677764612043,5,-1,-1,16x6144x2048,0,
2026-03-03T03:29:03.820256+00:00,FULL,llm_style,eval,llm_style_eval_063,64,1536,6144,bf16,NVIDIA GeForce RTX 4060,c04,64,64,64,4,3,8,0.0,0.0,72.7040022611618,121.76864370703689,16.61476004664584,2,-1,-1,64x1536x6144,0,
2026-03-03T03:29:03.881062+00:00,FULL,llm_style,eval,llm_style_eval_064,1,6144,2048,bf16,NVIDIA GeForce RTX 4060,c00,32,32,32,2,2,8,0.0,0.0,59.1839998960495,139.79936167597768,0.42521330163897564,5,-1,-1,1x6144x2048,0,
2026-03-03T03:29:04.016679+00:00,FULL,llm_style,eval,llm_style_eval_065,8,1536,6144,bf16,NVIDIA GeForce RTX 4060,c04,64,64,64,4,3,8,0.0,135.563,70.35199925303459,78.20511929690838,2.146277939549627,6,-1,-1,8x1536x6144,0,
2026-03-03T03:29:04.053836+00:00,FULL,llm_style,eval,llm_style_eval_066,64,1536,4096,bf16,NVIDIA GeForce RTX 4060,c04,64,64,64,4,3,8,0.0,0.0,83.74400064349174,246.26208797097183,9.616287278037813,3,-1,-1,64x1536x4096,0,
2026-03-03T03:29:04.140573+00:00,FULL,llm_style,eval,llm_style_eval_067,64,8192,2048,bf16,NVIDIA GeForce RTX 4060,c00,32,32,32,2,2,8,0.0,0.0,170.33600062131882,280.58624178171146,12.607338672780992,1,-1,-1,64x8192x2048,0,
2026-03-03T03:29:04.159541+00:00,FULL,llm_style,eval,llm_style_eval_068,64,1024,4096,bf16,NVIDIA GeForce RTX 4060,c04,64,64,64,4,3,8,0.0,0.0,35.840000957250595,74.81343917548655,14.979656742765474,3,-1,-1,64x1024x4096,0,
2026-03-03T03:29:04.192977+00:00,FULL,llm_style,eval,llm_style_eval_069,64,2048,4096,bf16,NVIDIA GeForce RTX 4060,c03,64,64,32,4,2,8,0.0,0.0,72.7040022611618,136.43775768578047,14.768675597018525,3,-1,-1,64x2048x4096,0,
2026-03-03T03:29:04.305961+00:00,FULL,llm_style,eval,llm_style_eval_070,64,8192,1024,bf16,NVIDIA GeForce RTX 4060,c06,64,128,32,4,3,8,0.0,112.93,64.51199948787689,173.49983856081963,16.644063624190995,1,-1,-1,64x8192x1024,0,
2026-03-03T03:29:04.379777+00:00,FULL,llm_style,eval,llm_style_eval_071,64,6144,2048,bf16,NVIDIA GeForce RTX 4060,c10,64,128,64,8,3,8,0.0,0.0,103.31199690699577,370.559040009975,15.589793869243636,1,-1,-1,64x6144x2048,0,
2026-03-03T03:29:04.393461+00:00,FULL,llm_style,eval,llm_style_eval_072,64,1536,1024,bf16,NVIDIA GeForce RTX 4060,c00,32,32,32,2,2,8,0.0,0.0,18.432000651955605,134.44255560636512,10.92266628032262,3,-1,-1,64x1536x1024,0,
2026-03-03T03:29:04.418417+00:00,FULL,llm_style,eval,llm_style_eval_073,1,4096,1536,bf16,NVIDIA GeForce RTX 4060,c00,32,32,32,2,2,8,0.0,0.0,45.80799862742424,86.26176305115217,0.2746880976473591,5,-1,-1,1x4096x1536,0,
2026-03-03T03:29:04.478785+00:00,FULL,llm_style,eval,llm_style_eval_074,8,1024,2048,bf16,NVIDIA GeForce RTX 4060,c00,32,32,32,2,2,8,0.0,60.318,40.81599973142147,51.53215926140547,0.8220901661308254,7,-1,-1,8x1024x2048,0,
2026-03-03T03:29:04.565356+00:00,FULL,llm_style,eval,llm_style_eval_075,2,6144,1024,bf16,NVIDIA GeForce RTX 4060,c11,32,128,32,4,2,8,0.0,86.529,40.95999896526337,161.4608026295897,0.61440001552105,5,-1,-1,2x6144x1024,0,
2026-03-03T03:29:04.594511+00:00,FULL,llm_style,eval,llm_style_eval_076,64,1024,6144,bf16,NVIDIA GeForce RTX 4060,c04,64,64,64,4,3,8,0.0,0.0,69.42399963736534,115.80416180193413,11.599826748768425,2,-1,-1,64x1024x6144,0,
2026-03-03T03:29:05.005294+00:00,FULL,llm_style,eval,llm_style_eval_077,1,4096,8192,bf16,NVIDIA GeForce RTX 4060,c11,32,128,32,4,2,8,0.0,410.733,314.36800956726074,361.23711824417103,0.21347230620691288,4,-1,-1,1x4096x8192,0,
2026-03-03T03:29:05.113525+00:00,FULL,llm_style,eval,llm_style_eval_078,64,6144,3072,bf16,NVIDIA GeForce RTX 4060,c06,64,128,32,4,3,8,0.0,0.0,209.71199870109558,293.1507298350333,11.520175855285379,1,-1,-1,64x6144x3072,0,
2026-03-03T03:29:05.253804+00:00,FULL,llm_style,eval,llm_style_eval_079,2,3072,4096,bf16,NVIDIA GeForce RTX 4060,c00,32,32,32,2,2,8,0.0,140.227,66.56000018119812,194.42560434341428,0.7561846133260332,7,-1,-1,2x3072x4096,0,
2026-03-03T03:29:05.301975+00:00,FULL,llm_style,eval,llm_style_eval_080,4,1536,1024,bf16,NVIDIA GeForce RTX 4060,c00,32,32,32,2,2,8,0.0,48.129,31.66399896144867,40.49920063465832,0.3973885931249511,7,-1,-1,4x1536x1024,0,
2026-03-03T03:29:05.621407+00:00,FULL,llm_style,eval,llm_style_eval_081,4,4096,6144,bf16,NVIDIA GeForce RTX 4060,c03,64,64,32,4,2,8,0.0,319.394,226.30399465560913,242.67583951354024,0.8896289802854788,4,-1,-1,4x4096x6144,0,
2026-03-03T03:29:05.710290+00:00,FULL,llm_style,eval,llm_style_eval_082,64,6144,1024,bf16,NVIDIA GeForce RTX 4060,c06,64,128,32,4,3,8,0.0,88.84,51.90400034189224,138.16831812262527,15.515304460069316,1,-1,-1,64x6144x1024,0,
2026-03-03T03:29:05.798115+00:00,FULL,llm_style,eval,llm_style_eval_083,8,4096,4096,bf16,NVIDIA GeForce RTX 4060,c03,64,64,32,4,2,8,0.0,0.0,162.81600296497345,228.5884885489939,1.6487043724918637,5,-1,-1,8x4096x4096,0,
2026-03-03T03:29:05.953763+00:00,FULL,llm_style,eval,llm_style_eval_084,64,1024,8192,bf16,NVIDIA GeForce RTX 4060,c04,64,64,64,4,3,8,0.0,155.596,84.99199897050858,109.74975883960718,12.633445936158983,2,-1,-1,64x1024x8192,0,
2026-03-03T03:29:06.262974+00:00,FULL,llm_style,eval,llm_style_eval_085,1,3072,8192,bf16,NVIDIA GeForce RTX 4060,c09,128,64,64,8,3,8,0.0,309.169,228.35199534893036,250.81503808498383,0.22041256054317093,6,-1,-1,1x3072x8192,0,
2026-03-03T03:29:06.331814+00:00,FULL,llm_style,eval,llm_style_eval_086,8,1536,1024,bf16,NVIDIA GeForce RTX 4060,c04,64,64,64,4,3,8,0.0,68.797,38.896000012755394,85.1881576329469,0.6470028792612922,7,-1,-1,8x1536x1024,0,
2026-03-03T03:29:06.409829+00:00,FULL,llm_style,eval,llm_style_eval_087,16,1024,3072,bf16,NVIDIA GeForce RTX 4060,c04,64,64,64,4,3,8,0.0,77.975,49.15200173854828,56.246719583868966,2.047999927560491,7,-1,-1,16x1024x3072,0,
2026-03-03T03:29:06.495828+00:00,FULL,llm_style,eval,llm_style_eval_088,8,4096,1536,bf16,NVIDIA GeForce RTX 4060,c02,32,64,32,2,2,8,0.0,85.957,46.08000069856644,99.2400035262107,2.1845333002161103,5,-1,-1,8x4096x1536,0,
2026-03-03T03:29:06.731198+00:00,FULL,llm_style,eval,llm_style_eval_089,16,6144,3072,bf16,NVIDIA GeForce RTX 4060,c02,32,64,32,2,2,8,0.0,235.329,178.28799784183502,184.34047535061836,3.3876636863453355,5,-1,-1,16x6144x3072,0,
2026-03-03T03:29:06.850367+00:00,FULL,llm_style,eval,llm_style_eval_090,32,1536,3072,bf16,NVIDIA GeForce RTX 4060,c04,64,64,64,4,3,8,0.0,119.127,74.75200295448303,158.58079358935348,4.039890251287093,7,-1,-1,32x1536x3072,0,
2026-03-03T03:29:06.941270+00:00,FULL,llm_style,eval,llm_style_eval_091,16,1024,4096,bf16,NVIDIA GeForce RTX 4060,c04,64,64,64,4,3,8,0.0,90.858,58.36800113320351,66.08960025012493,2.2995087272853048,7,-1,-1,16x1024x4096,0,
2026-03-03T03:29:07.251557+00:00,FULL,llm_style,eval,llm_style_eval_092,1,4096,6144,bf16,NVIDIA GeForce RTX 4060,c02,32,64,32,2,2,8,0.0,310.243,227.07200050354004,309.8521566390989,0.22165501641940805,4,-1,-1,1x4096x6144,0,
2026-03-03T03:29:07.347384+00:00,FULL,llm_style,eval,llm_style_eval_093,32,2048,3072,bf16,NVIDIA GeForce RTX 4060,c00,32,32,32,2,2,8,0.0,95.784,59.39200147986412,102.92640075087536,6.779586037970331,7,-1,-1,32x2048x3072,0,
2026-03-03T03:29:07.363948+00:00,FULL,llm_style,eval,llm_style_eval_094,32,1024,2048,bf16,NVIDIA GeForce RTX 4060,c00,32,32,32,2,2,8,0.0,0.0,81.76000043749809,169.42720025777814,1.641606253446678,7,-1,-1,32x1024x2048,0,
2026-03-03T03:29:07.501205+00:00,FULL,llm_style,eval,llm_style_eval_095,8,6144,2048,bf16,NVIDIA GeForce RTX 4060,c11,32,128,32,4,2,8,0.0,137.204,57.34400078654289,69.13504093885422,3.510857094701456,5,-1,-1,8x6144x2048,0,
2026-03-03T03:29:07.536838+00:00,FULL,llm_style,eval,llm_style_eval_096,64,2048,3072,bf16,NVIDIA GeForce RTX 4060,c03,64,64,32,4,2,8,0.0,0.0,75.71200281381607,162.98591971397397,10.63644254637319,3,-1,-1,64x2048x3072,0,
2026-03-03T03:29:07.567218+00:00,FULL,llm_style,eval,llm_style_eval_097,64,6144,1024,bf16,NVIDIA GeForce RTX 4060,c06,64,128,32,4,3,8,0.0,0.0,81.91999793052673,200.3401608765125,9.8304002483368,1,-1,-1,64x6144x1024,0,
2026-03-03T03:29:07.592837+00:00,FULL,llm_style,eval,llm_style_eval_098,32,6144,1024,bf16,NVIDIA GeForce RTX 4060,c11,32,128,32,4,2,8,0.0,0.0,43.84000040590763,132.95072264969338,9.184607214231246,5,-1,-1,32x6144x1024,0,
2026-03-03T03:29:07.669139+00:00,FULL,llm_style,eval,llm_style_eval_099,1,2048,2048,bf16,NVIDIA GeForce RTX 4060,c00,32,32,32,2,2,8,0.0,76.25,45.05600035190582,68.06144114583728,0.1861818167276619,7,-1,-1,1x2048x2048,0,
2026-03-03T03:29:07.713940+00:00,FULL,llm_style,eval,llm_style_eval_100,64,8192,1024,bf16,NVIDIA GeForce RTX 4060,c06,64,128,32,4,3,8,0.0,0.0,68.03200021386147,77.83679999411106,15.782893647469532,1,-1,-1,64x8192x1024,0,
2026-03-03T03:29:07.777315+00:00,FULL,llm_style,eval,llm_style_eval_101,64,8192,1536,bf16,NVIDIA GeForce RTX 4060,c10,64,128,64,8,3,8,0.0,0.0,110.59200018644333,157.3273571580647,14.563555531003347,1,-1,-1,64x8192x1536,0,
2026-03-03T03:29:07.804664+00:00,FULL,llm_style,eval,llm_style_eval_102,32,3072,2048,bf16,NVIDIA GeForce RTX 4060,c02,32,64,32,2,2,8,0.0,0.0,74.65600222349167,272.9411143064495,5.393446903232369,7,-1,-1,32x3072x2048,0,
2026-03-03T03:29:07.833610+00:00,FULL,llm_style,eval,llm_style_eval_103,64,2048,3072,bf16,NVIDIA GeForce RTX 4060,c03,64,64,32,4,2,8,0.0,0.0,78.84800061583519,217.70047903060902,10.21340251763174,3,-1,-1,64x2048x3072,0,
2026-03-03T03:29:07.900261+00:00,FULL,llm_style,eval,llm_style_eval_104,16,6144,2048,bf16,NVIDIA GeForce RTX 4060,c11,32,128,32,4,2,8,0.0,0.0,69.56800073385239,154.56416323781013,5.787907942624913,5,-1,-1,16x6144x2048,0,
2026-03-03T03:29:08.053504+00:00,FULL,llm_style,eval,llm_style_eval_105,1,1024,8192,bf16,NVIDIA GeForce RTX 4060,c04,64,64,64,4,3,8,0.0,153.191,84.97599884867668,91.6112008690834,0.1974347607243368,6,-1,-1,1x1024x8192,0,
2026-03-03T03:29:08.483114+00:00,FULL,llm_style,eval,llm_style_eval_106,32,4096,8192,bf16,NVIDIA GeForce RTX 4060,c06,64,128,32,4,3,8,0.0,429.565,299.00801181793213,391.4239943027495,7.182027113399277,4,-1,-1,32x4096x8192,0,
2026-03-03T03:29:08.535119+00:00,FULL,llm_style,eval,llm_style_eval_107,64,6144,1536,bf16,NVIDIA GeForce RTX 4060,c06,64,128,32,4,3,8,0.0,0.0,64.51199948787689,77.82751642167568,18.72457157721487,1,-1,-1,64x6144x1536,0,
2026-03-03T03:29:08.602856+00:00,FULL,llm_style,eval,llm_style_eval_108,8,3072,1536,bf16,NVIDIA GeForce RTX 4060,c00,32,32,32,2,2,8,0.0,67.683,39.95199874043465,124.62144136428829,1.8897045049110515,7,-1,-1,8x3072x1536,0,
2026-03-03T03:29:08.614653+00:00,FULL,llm_style,eval,llm_style_eval_109,16,2048,1024,bf16,NVIDIA GeForce RTX 4060,c00,32,32,32,2,2,8,0.0,0.0,35.679999738931656,159.10912156105033,1.8808538254212834,7,-1,-1,16x2048x1024,0,
2026-03-03T03:29:09.383413+00:00,FULL,llm_style,eval,llm_style_eval_110,1,8192,8192,bf16,NVIDIA GeForce RTX 4060,c11,32,128,32,4,2,8,0.0,768.715,556.3519895076752,610.8262419700623,0.24124606459801,4,-1,-1,1x8192x8192,0,
2026-03-03T03:29:09.526587+00:00,FULL,llm_style,eval,llm_style_eval_111,8,6144,1536,bf16,NVIDIA GeForce RTX 4060,c00,32,32,32,2,2,8,0.0,143.126,54.1439987719059,149.02272194623947,2.7887660207015936,5,-1,-1,8x6144x1536,0,
2026-03-03T03:29:09.630227+00:00,FULL,llm_style,eval,llm_style_eval_112,2,6144,3072,bf16,NVIDIA GeForce RTX 4060,c11,32,128,32,4,2,8,0.0,0.0,206.2240019440651,308.5603153705596,0.3660944957341942,5,-1,-1,2x6144x3072,0,
2026-03-03T03:29:09.963218+00:00,FULL,llm_style,eval,llm_style_eval_113,1,8192,8192,bf16,NVIDIA GeForce RTX 4060,c11,32,128,32,4,2,8,0.0,0.0,529.4079780578613,640.0124764442442,0.2535241884574145,4,-1,-1,1x8192x8192,0,
2026-03-03T03:29:10.030186+00:00,FULL,llm_style,eval,llm_style_eval_114,1,3072,1024,bf16,NVIDIA GeForce RTX 4060,c00,32,32,32,2,2,8,0.0,66.845,45.88799923658371,98.137281909585,0.1371046047914027,7,-1,-1,1x3072x1024,0,
2026-03-03T03:29:10.133687+00:00,FULL,llm_style,eval,llm_style_eval_115,16,3072,1536,bf16,NVIDIA GeForce RTX 4060,c11,32,128,32,4,2,8,0.0,103.456,68.60800087451935,167.36063882708544,2.200835792842329,7,-1,-1,16x3072x1536,0,
2026-03-03T03:29:10.196172+00:00,FULL,llm_style,eval,llm_style_eval_116,8,3072,1024,bf16,NVIDIA GeForce RTX 4060,c11,32,128,32,4,2,8,0.0,62.441,41.152000427246094,49.47232007980345,1.2230668613299343,7,-1,-1,8x3072x1024,0,
2026-03-03T03:29:10.297584+00:00,FULL,llm_style,eval,llm_style_eval_117,4,1024,4096,bf16,NVIDIA GeForce RTX 4060,c04,64,64,64,4,3,8,0.0,101.367,59.007998555898666,72.28863760828968,0.5686420963458652,7,-1,-1,4x1024x4096,0,
2026-03-03T03:29:10.396868+00:00,FULL,llm_style,eval,llm_style_eval_118,64,6144,3072,bf16,NVIDIA GeForce RTX 4060,c06,64,128,32,4,3,8,0.0,0.0,207.8239992260933,263.00031065940857,11.624832131979634,1,-1,-1,64x6144x3072,0,
2026-03-03T03:29:11.000671+00:00,FULL,llm_style,eval,llm_style_eval_119,64,8192,6144,bf16,NVIDIA GeForce RTX 4060,c06,64,128,32,4,3,8,0.0,603.749,441.3439929485321,522.8236967325211,14.597345940882205,0,-1,-1,64x8192x6144,0,
2026-03-03T03:29:11.124572+00:00,FULL,llm_style,eval,llm_style_eval_120,8,1024,4096,bf16,NVIDIA GeForce RTX 4060,c04,64,64,64,4,3,8,0.0,123.858,79.8719972372055,117.70496472716319,0.8402051572680562,7,-1,-1,8x1024x4096,0,
2026-03-03T03:29:11.190438+00:00,FULL,llm_style,eval,llm_style_eval_121,4,1024,2048,bf16,NVIDIA GeForce RTX 4060,c04,64,64,64,4,3,8,0.0,65.819,41.85599833726883,47.12448105216026,0.40083182020440467,7,-1,-1,4x1024x2048,0,
2026-03-03T03:29:11.495500+00:00,FULL,llm_style,eval,llm_style_eval_122,4,6144,4096,bf16,NVIDIA GeForce RTX 4060,c02,32,64,32,2,2,8,0.0,305.016,227.02399641275406,249.88128632307053,0.8868075409701034,5,-1,-1,4x6144x4096,0,
2026-03-03T03:29:11.799609+00:00,FULL,llm_style,eval,llm_style_eval_123,4,3072,8192,bf16,NVIDIA GeForce RTX 4060,c04,64,64,64,4,3,8,0.0,304.064,227.32800245285034,250.2966347336769,0.8856216120658376,6,-1,-1,4x3072x8192,0,
2026-03-03T03:29:11.837728+00:00,FULL,llm_style,eval,llm_style_eval_124,64,6144,1024,bf16,NVIDIA GeForce RTX 4060,c06,64,128,32,4,3,8,0.0,0.0,80.89599758386612,195.92383995652193,9.95483574036066,1,-1,-1,64x6144x1024,0,
2026-03-03T03:29:11.906260+00:00,FULL,llm_style,eval,llm_style_eval_125,64,1536,8192,bf16,NVIDIA GeForce RTX 4060,c04,64,64,64,4,3,8,0.0,0.0,147.42400497198105,225.93824028968805,10.925037183097203,2,-1,-1,64x1536x8192,0,
2026-03-03T03:29:11.993866+00:00,FULL,llm_style,eval,llm_style_eval_126,64,2048,8192,bf16,NVIDIA GeForce RTX 4060,c06,64,128,32,4,3,8,0.0,0.0,171.39200121164322,302.22336530685425,12.529660852423225,2,-1,-1,64x2048x8192,0,
2026-03-03T03:29:12.137613+00:00,FULL,llm_style,eval,llm_style_eval_127,2,8192,1536,bf16,NVIDIA GeForce RTX 4060,c11,32,128,32,4,2,8,0.0,143.696,59.13599953055382,65.51423937082289,0.8511168898734032,5,-1,-1,2x8192x1536,0,
2026-03-03T03:29:12.246678+00:00,FULL,llm_style,eval,llm_style_eval_128,8,2048,2048,bf16,NVIDIA GeForce RTX 4060,c00,32,32,32,2,2,8,0.0,109.024,47.10400104522705,990.5433422327039,1.4246956205602412,7,-1,-1,8x2048x2048,0,
2026-03-03T03:29:12.504818+00:00,FULL,llm_style,eval,llm_style_eval_129,64,8192,6144,bf16,NVIDIA GeForce RTX 4060,c06,64,128,32,4,3,8,0.0,0.0,465.32800793647766,573.0537664890287,13.844967064349724,0,-1,-1,64x8192x6144,0,
2026-03-03T03:29:12.527236+00:00,FULL,llm_style,eval,llm_style_eval_130,16,3072,1536,bf16,NVIDIA GeForce RTX 4060,c11,32,128,32,4,2,8,0.0,0.0,68.60800087451935,126.47424176335335,2.200835792842329,7,-1,-1,16x3072x1536,0,
2026-03-03T03:29:13.281851+00:00,FULL,llm_style,eval,llm_style_eval_131,32,8192,8192,bf16,NVIDIA GeForce RTX 4060,c11,32,128,32,4,2,8,0.0,754.56,562.6879930496216,647.0003139972687,7.632946409114582,4,-1,-1,32x8192x8192,0,
2026-03-03T03:29:13.697906+00:00,FULL,llm_style,eval,llm_style_eval_132,32,8192,4096,bf16,NVIDIA GeForce RTX 4060,c06,64,128,32,4,3,8,0.0,416.011,299.904003739357,345.7420724630355,7.160570119851926,5,-1,-1,32x8192x4096,0,
2026-03-03T03:29:14.452760+00:00,FULL,llm_style,eval,llm_style_eval_133,2,8192,8192,bf16,NVIDIA GeForce RTX 4060,c11,32,128,32,4,2,8,0.0,754.811,555.4080009460449,625.7728058099746,0.48331218769402845,4,-1,-1,2x8192x8192,0,
2026-03-03T03:29:14.565646+00:00,FULL,llm_style,eval,llm_style_eval_134,64,3072,3072,bf16,NVIDIA GeForce RTX 4060,c03,64,64,32,4,2,8,0.0,112.841,64.51199948787689,69.05664034187794,18.72457157721487,3,-1,-1,64x3072x3072,0,
2026-03-03T03:29:14.683534+00:00,FULL,llm_style,eval,llm_style_eval_135,8,3072,3072,bf16,NVIDIA GeForce RTX 4060,c00,32,32,32,2,2,8,0.0,117.845,55.18399924039841,123.56959640979761,2.7362087938248143,7,-1,-1,8x3072x3072,0,
2026-03-03T03:29:14.803064+00:00,FULL,llm_style,eval,llm_style_eval_136,4,2048,4096,bf16,NVIDIA GeForce RTX 4060,c00,32,32,32,2,2,8,0.0,119.478,64.51199948787689,119.9820832163094,1.0402539765119372,7,-1,-1,4x2048x4096,0,
2026-03-03T03:29:15.554277+00:00,FULL,llm_style,eval,llm_style_eval_137,4,8192,8192,bf16,NVIDIA GeForce RTX 4060,c10,64,128,64,8,3,8,0.0,751.168,559.2800080776215,670.8838212490082,0.9599322418932033,4,-1,-1,4x8192x8192,0,
2026-03-03T03:29:15.610197+00:00,FULL,llm_style,eval,llm_style_eval_138,16,1024,1024,bf16,NVIDIA GeForce RTX 4060,c04,64,64,64,4,3,8,0.0,55.874,37.74400055408478,45.499839931726456,0.8890004108578425,7,-1,-1,16x1024x1024,0,
2026-03-03T03:29:15.664187+00:00,FULL,llm_style,eval,llm_style_eval_139,4,1024,1024,bf16,NVIDIA GeForce RTX 4060,c00,32,32,32,2,2,8,0.0,53.95,34.591998904943466,113.60735990107057,0.2425013952807799,7,-1,-1,4x1024x1024,0,
2026-03-03T03:29:15.794901+00:00,FULL,llm_style,eval,llm_style_eval_140,64,4096,6144,bf16,NVIDIA GeForce RTX 4060,c02,32,64,32,2,2,8,0.0,0.0,236.89600080251694,350.1814466714858,13.597635507090315,0,-1,-1,64x4096x6144,0,
2026-03-03T03:29:15.921351+00:00,FULL,llm_style,eval,llm_style_eval_141,4,6144,4096,bf16,NVIDIA GeForce RTX 4060,c02,32,64,32,2,2,8,0.0,0.0,227.32800245285034,257.56672888994217,0.8856216120658376,5,-1,-1,4x6144x4096,0,
2026-03-03T03:29:16.084402+00:00,FULL,llm_style,eval,llm_style_eval_142,4,2048,6144,bf16,NVIDIA GeForce RTX 4060,c00,32,32,32,2,2,8,0.0,162.997,88.03199976682663,165.41696369647968,1.1434852811094867,6,-1,-1,4x2048x6144,0,
2026-03-03T03:29:16.163996+00:00,FULL,llm_style,eval,llm_style_eval_143,64,1536,8192,bf16,NVIDIA GeForce RTX 4060,c04,64,64,64,4,3,8,0.0,0.0,97.6640023291111,210.72032287716854,16.491365268571613,2,-1,-1,64x1536x8192,0,
2026-03-03T03:29:16.281035+00:00,FULL,llm_style,eval,llm_style_eval_144,1,3072,3072,bf16,NVIDIA GeForce RTX 4060,c00,32,32,32,2,2,8,0.0,116.971,58.22400003671646,890.1625548303099,0.3241681778664759,7,-1,-1,1x3072x3072,0,
2026-03-03T03:29:16.295105+00:00,FULL,llm_style,eval,llm_style_eval_145,32,1024,2048,bf16,NVIDIA GeForce RTX 4060,c00,32,32,32,2,2,8,0.0,0.0,44.624000787734985,124.99808043241497,3.0077475266827727,7,-1,-1,32x1024x2048,0,
2026-03-03T03:29:16.462193+00:00,FULL,llm_style,eval,llm_style_eval_146,64,8192,4096,bf16,NVIDIA GeForce RTX 4060,c06,64,128,32,4,3,8,0.0,0.0,305.87199330329895,382.40479469299316,14.041714802378662,1,-1,-1,64x8192x4096,0,
2026-03-03T03:29:16.508210+00:00,FULL,llm_style,eval,llm_style_eval_147,64,2048,4096,bf16,NVIDIA GeForce RTX 4060,c03,64,64,32,4,2,8,0.0,0.0,73.7760029733181,161.6588787734508,14.554079656339344,3,-1,-1,64x2048x4096,0,
2026-03-03T03:29:16.534856+00:00,FULL,llm_style,eval,llm_style_eval_148,64,1024,6144,bf16,NVIDIA GeForce RTX 4060,c04,64,64,64,4,3,8,0.0,0.0,68.35199892520905,84.56863939762115,11.781752994249205,2,-1,-1,64x1024x6144,0,
2026-03-03T03:29:16.702631+00:00,FULL,llm_style,eval,llm_style_eval_149,64,4096,8192,bf16,NVIDIA GeForce RTX 4060,c02,32,64,32,2,2,8,0.0,0.0,299.55199360847473,380.8358308672904,14.3379693263323,0,-1,-1,64x4096x8192,0,
2026-03-03T03:29:16.792256+00:00,FULL,llm_style,eval,llm_style_eval_150,2,2048,3072,bf16,NVIDIA GeForce RTX 4060,c00,32,32,32,2,2,8,0.0,89.573,48.11200127005577,61.456639356911154,0.523067495337444,7,-1,-1,2x2048x3072,0,
2026-03-03T03:29:16.904704+00:00,FULL,llm_style,eval,llm_style_eval_151,64,4096,2048,bf16,NVIDIA GeForce RTX 4060,c04,64,64,64,4,3,8,0.0,112.406,66.56000018119812,127.97951817512492,16.13193841762204,1,-1,-1,64x4096x2048,0,
2026-03-03T03:29:17.652848+00:00,FULL,llm_style,eval,llm_style_eval_152,8,8192,8192,bf16,NVIDIA GeForce RTX 4060,c02,32,64,32,2,2,8,0.0,748.099,558.4640204906464,594.4627165794373,1.9226696521230664,4,-1,-1,8x8192x8192,0,
2026-03-03T03:29:17.748692+00:00,FULL,llm_style,eval,llm_style_eval_153,64,8192,2048,bf16,NVIDIA GeForce RTX 4060,c00,32,32,32,2,2,8,0.0,0.0,167.6959991455078,238.3667184412478,12.805813251016525,1,-1,-1,64x8192x2048,0,
2026-03-03T03:29:17.977191+00:00,FULL,llm_style,eval,llm_style_eval_154,16,2048,8192,bf16,NVIDIA GeForce RTX 4060,c10,64,128,64,8,3,8,0.0,228.441,162.89599984884262,221.22015669941902,3.2957894147074387,6,-1,-1,16x2048x8192,0,
2026-03-03T03:29:18.052856+00:00,FULL,llm_style,eval,llm_style_eval_155,4,2048,1536,bf16,NVIDIA GeForce RTX 4060,c00,32,32,32,2,2,8,0.0,75.622,38.415998220443726,615.4947119951235,0.6550870774095251,7,-1,-1,4x2048x1536,0,
2026-03-03T03:29:18.177748+00:00,FULL,llm_style,eval,llm_style_eval_156,1,4096,6144,bf16,NVIDIA GeForce RTX 4060,c02,32,64,32,2,2,8,0.0,0.0,225.2800017595291,237.56192192435265,0.22341818007319428,4,-1,-1,1x4096x6144,0,
2026-03-03T03:29:18.344946+00:00,FULL,llm_style,eval,llm_style_eval_157,1,1536,8192,bf16,NVIDIA GeForce RTX 4060,c04,64,64,64,4,3,8,0.0,167.146,85.42399853467941,94.22848209738731,0.29459899362804326,6,-1,-1,1x1536x8192,0,
2026-03-03T03:29:18.420983+00:00,FULL,llm_style,eval,llm_style_eval_158,64,1536,8192,bf16,NVIDIA GeForce RTX 4060,c04,64,64,64,4,3,8,0.0,0.0,117.71200224757195,132.4387189745903,13.682655168948349,2,-1,-1,64x1536x8192,0,
2026-03-03T03:29:18.530251+00:00,FULL,llm_style,eval,llm_style_eval_159,16,6144,1536,bf16,NVIDIA GeForce RTX 4060,c11,32,128,32,4,2,8,0.0,109.214,46.08000069856644,136.83936119079567,6.553599900648331,5,-1,-1,16x6144x1536,0,
2026-03-03T03:29:18.724703+00:00,FULL,llm_style,eval,llm_style_eval_160,32,6144,6144,bf16,NVIDIA GeForce RTX 4060,c10,64,128,64,8,3,8,0.0,0.0,334.78398621082306,367.1142339706421,7.21635204641666,4,-1,-1,32x6144x6144,0,
2026-03-03T03:29:18.820112+00:00,FULL,llm_style,eval,llm_style_eval_161,2,1536,4096,bf16,NVIDIA GeForce RTX 4060,c04,64,64,64,4,3,8,0.0,95.354,56.01599998772144,76.40063971281049,0.4492613539973629,7,-1,-1,2x1536x4096,0,
2026-03-03T03:29:18.915506+00:00,FULL,llm_style,eval,llm_style_eval_162,64,1536,3072,bf16,NVIDIA GeForce RTX 4060,c04,64,64,64,4,3,8,0.0,95.344,51.19999870657921,66.72384206205604,11.796480298004159,3,-1,-1,64x1536x3072,0,
2026-03-03T03:29:18.953537+00:00,FULL,llm_style,eval,llm_style_eval_163,64,1024,8192,bf16,NVIDIA GeForce RTX 4060,c04,64,64,64,4,3,8,0.0,0.0,82.95999839901924,166.88415989279747,12.942886267132495,2,-1,-1,64x1024x8192,0,
2026-03-03T03:29:19.124404+00:00,FULL,llm_style,eval,llm_style_eval_164,64,4096,8192,bf16,NVIDIA GeForce RTX 4060,c02,32,64,32,2,2,8,0.0,0.0,305.1519989967346,323.1152045726776,14.074845683858555,0,-1,-1,64x4096x8192,0,
2026-03-03T03:29:19.430540+00:00,FULL,llm_style,eval,llm_style_eval_165,4,8192,3072,bf16,NVIDIA GeForce RTX 4060,c00,32,32,32,2,2,8,0.0,306.081,226.30399465560913,317.40767836570717,0.8896289802854788,5,-1,-1,4x8192x3072,0,
2026-03-03T03:29:19.470031+00:00,FULL,llm_style,eval,llm_style_eval_166,64,1024,6144,bf16,NVIDIA GeForce RTX 4060,c04,64,64,64,4,3,8,0.0,0.0,71.68000191450119,101.27295665442935,11.234742557074105,2,-1,-1,64x1024x6144,0,
2026-03-03T03:29:19.481874+00:00,FULL,llm_style,eval,llm_style_eval_167,2,2048,1024,bf16,NVIDIA GeForce RTX 4060,c11,32,128,32,4,2,8,0.0,0.0,45.05600035190582,57.405440807342515,0.1861818167276619,7,-1,-1,2x2048x1024,0,
2026-03-03T03:29:19.552879+00:00,FULL,llm_style,eval,llm_style_eval_168,64,4096,1024,bf16,NVIDIA GeForce RTX 4060,c04,64,64,64,4,3,8,0.0,70.958,47.10400104522705,128.61375726759428,11.39756496448193,1,-1,-1,64x4096x1024,0,
2026-03-03T03:29:19.599069+00:00,FULL,llm_style,eval,llm_style_eval_169,4,1536,6144,bf16,NVIDIA GeForce RTX 4060,c04,64,64,64,4,3,8,0.0,0.0,82.76800066232681,177.25087434053412,0.9121577348232827,6,-1,-1,4x1536x6144,0,
2026-03-03T03:29:19.619490+00:00,FULL,llm_style,eval,llm_style_eval_170,16,1536,1536,bf16,NVIDIA GeForce RTX 4060,c04,64,64,64,4,3,8,0.0,0.0,40.92799872159958,98.35743933916089,1.844641183497607,7,-1,-1,16x1536x1536,0,
2026-03-03T03:29:19.716387+00:00,FULL,llm_style,eval,llm_style_eval_171,1,2048,3072,bf16,NVIDIA GeForce RTX 4060,c00,32,32,32,2,2,8,0.0,96.852,50.11199973523617,144.95135724544525,0.251095786767263,7,-1,-1,1x2048x3072,0,
2026-03-03T03:29:19.814627+00:00,FULL,llm_style,eval,llm_style_eval_172,64,3072,2048,bf16,NVIDIA GeForce RTX 4060,c10,64,128,64,8,3,8,0.0,98.197,54.27199974656105,97.90400296449648,14.838339691933468,3,-1,-1,64x3072x2048,0,
2026-03-03T03:29:20.065937+00:00,FULL,llm_style,eval,llm_style_eval_173,64,8192,6144,bf16,NVIDIA GeForce RTX 4060,c06,64,128,32,4,3,8,0.0,0.0,443.29600036144257,530.1487761735915,14.533068060048208,0,-1,-1,64x8192x6144,0,
2026-03-03T03:29:20.283678+00:00,FULL,llm_style,eval,llm_style_eval_174,2,4096,4096,bf16,NVIDIA GeForce RTX 4060,c11,32,128,32,4,2,8,0.0,217.686,159.743994474411,168.45824122428894,0.4201025786340281,5,-1,-1,2x4096x4096,0,
2026-03-03T03:29:20.327194+00:00,FULL,llm_style,eval,llm_style_eval_175,64,4096,2048,bf16,NVIDIA GeForce RTX 4060,c04,64,64,64,4,3,8,0.0,0.0,67.58400052785873,108.91999661922449,15.88751502742715,1,-1,-1,64x4096x2048,0,
2026-03-03T03:29:20.387793+00:00,FULL,llm_style,eval,llm_style_eval_176,16,6144,2048,bf16,NVIDIA GeForce RTX 4060,c11,32,128,32,4,2,8,0.0,0.0,63.48799914121628,67.04960010945797,6.342193634176106,5,-1,-1,16x6144x2048,0,
2026-03-03T03:29:20.437608+00:00,FULL,llm_style,eval,llm_style_eval_177,1,6144,1536,bf16,NVIDIA GeForce RTX 4060,c11,32,128,32,4,2,8,0.0,0.0,50.83199962973595,171.56095817685116,0.37130878457432903,5,-1,-1,1x6144x1536,0,
2026-03-03T03:29:20.997016+00:00,FULL,llm_style,eval,llm_style_eval_178,32,6144,8192,bf16,NVIDIA GeForce RTX 4060,c06,64,128,32,4,3,8,0.0,559.357,428.0640035867691,510.69952130317677,7.525102426294188,4,-1,-1,32x6144x8192,0,
2026-03-03T03:29:21.131923+00:00,FULL,llm_style,eval,llm_style_eval_179,64,4096,6144,bf16,NVIDIA GeForce RTX 4060,c02,32,64,32,2,2,8,0.0,0.0,236.54399812221527,309.2358326911926,13.61787023797445,0,-1,-1,64x4096x6144,0,
2026-03-03T03:29:21.148995+00:00,FULL,llm_style,eval,llm_style_eval_180,64,2048,1536,bf16,NVIDIA GeForce RTX 4060,c11,32,128,32,4,2,8,0.0,0.0,53.58400009572506,157.2147174179554,7.514429368480905,3,-1,-1,64x2048x1536,0,
2026-03-03T03:29:21.178652+00:00,FULL,llm_style,eval,llm_style_eval_181,64,2048,3072,bf16,NVIDIA GeForce RTX 4060,c03,64,64,32,4,2,8,0.0,0.0,87.0399996638298,278.02207380533207,9.252141212204666,3,-1,-1,64x2048x3072,0,
2026-03-03T03:29:21.253335+00:00,FULL,llm_style,eval,llm_style_eval_182,32,3072,1536,bf16,NVIDIA GeForce RTX 4060,c03,64,64,32,4,2,8,0.0,74.632,47.79199883341789,75.2505626529455,6.318837783968931,7,-1,-1,32x3072x1536,0,
2026-03-03T03:29:21.344855+00:00,FULL,llm_style,eval,llm_style_eval_183,8,8192,2048,bf16,NVIDIA GeForce RTX 4060,c11,32,128,32,4,2,8,0.0,0.0,165.27999937534332,260.6041502952572,1.6241254659639448,5,-1,-1,8x8192x2048,0,
2026-03-03T03:29:21.382850+00:00,FULL,llm_style,eval,llm_style_eval_184,64,8192,1024,bf16,NVIDIA GeForce RTX 4060,c06,64,128,32,4,3,8,0.0,0.0,65.50399959087372,113.54336261749265,16.392004010539807,1,-1,-1,64x8192x1024,0,
2026-03-03T03:29:21.445178+00:00,FULL,llm_style,eval,llm_style_eval_185,1,8192,1536,bf16,NVIDIA GeForce RTX 4060,c11,32,128,32,4,2,8,0.0,0.0,66.91199913620949,192.03904226422293,0.37610330471177766,5,-1,-1,1x8192x1536,0,
2026-03-03T03:29:21.473422+00:00,FULL,llm_style,eval,llm_style_eval_186,16,6144,1024,bf16,NVIDIA GeForce RTX 4060,c11,32,128,32,4,2,8,0.0,0.0,68.43199953436852,144.4147240370511,2.941994876225822,5,-1,-1,16x6144x1024,0,
2026-03-03T03:29:21.500062+00:00,FULL,llm_style,eval,llm_style_eval_187,1,1024,6144,bf16,NVIDIA GeForce RTX 4060,c04,64,64,64,4,3,8,0.0,0.0,69.63200122117996,198.32415625452984,0.18070587918378908,6,-1,-1,1x1024x6144,0,
2026-03-03T03:29:21.890922+00:00,FULL,llm_style,eval,llm_style_eval_188,8,8192,4096,bf16,NVIDIA GeForce RTX 4060,c11,32,128,32,4,2,8,0.0,390.806,291.83998703956604,316.82336181402206,1.8396070992396736,5,-1,-1,8x8192x4096,0,
2026-03-03T03:29:22.122275+00:00,FULL,llm_style,eval,llm_style_eval_189,8,2048,8192,bf16,NVIDIA GeForce RTX 4060,c10,64,128,64,8,3,8,0.0,231.298,162.81600296497345,237.09695056080807,1.6487043724918637,6,-1,-1,8x2048x8192,0,
2026-03-03T03:29:22.338247+00:00,FULL,llm_style,eval,llm_style_eval_190,4,8192,2048,bf16,NVIDIA GeForce RTX 4060,c02,32,64,32,2,2,8,0.0,215.931,161.79199516773224,204.58528161048883,0.8295696450300549,5,-1,-1,4x8192x2048,0,
2026-03-03T03:29:22.681346+00:00,FULL,llm_style,eval,llm_style_eval_191,4,8192,8192,bf16,NVIDIA GeForce RTX 4060,c10,64,128,64,8,3,8,0.0,0.0,562.175989151001,759.0502423048017,0.9549872679741859,4,-1,-1,4x8192x8192,0,
2026-03-03T03:29:22.694891+00:00,FULL,llm_style,eval,llm_style_eval_192,64,1536,1024,bf16,NVIDIA GeForce RTX 4060,c00,32,32,32,2,2,8,0.0,0.0,56.703999638557434,144.49856489896774,3.5504830926089115,3,-1,-1,64x1536x1024,0,
2026-03-03T03:29:22.717095+00:00,FULL,llm_style,eval,llm_style_eval_193,32,2048,2048,bf16,NVIDIA GeForce RTX 4060,c11,32,128,32,4,2,8,0.0,0.0,60.47999858856201,132.5324749946594,4.43841703479746,7,-1,-1,32x2048x2048,0,
2026-03-03T03:29:22.730385+00:00,FULL,llm_style,eval,llm_style_eval_194,8,1024,2048,bf16,NVIDIA GeForce RTX 4060,c00,32,32,32,2,2,8,0.0,0.0,68.4639997780323,165.47808066010464,0.49010329675138903,7,-1,-1,8x1024x2048,0,
2026-03-03T03:29:22.766019+00:00,FULL,llm_style,eval,llm_style_eval_195,2,4096,2048,bf16,NVIDIA GeForce RTX 4060,c11,32,128,32,4,2,8,0.0,0.0,53.247999399900436,62.38560002297163,0.6301538532556162,5,-1,-1,2x4096x2048,0,
2026-03-03T03:29:22.807458+00:00,FULL,llm_style,eval,llm_style_eval_196,32,2048,4096,bf16,NVIDIA GeForce RTX 4060,c00,32,32,32,2,2,8,0.0,0.0,63.48799914121628,86.70207954943177,8.456258178901475,7,-1,-1,32x2048x4096,0,
2026-03-03T03:29:22.949782+00:00,FULL,llm_style,eval,llm_style_eval_197,32,8192,1536,bf16,NVIDIA GeForce RTX 4060,c11,32,128,32,4,2,8,0.0,142.273,69.63200122117996,110.56800186634058,11.565176267762501,5,-1,-1,32x8192x1536,0,
2026-03-03T03:29:23.122265+00:00,FULL,llm_style,eval,llm_style_eval_198,64,4096,8192,bf16,NVIDIA GeForce RTX 4060,c02,32,64,32,2,2,8,0.0,0.0,305.10400235652924,416.26559495925903,14.077059831490235,0,-1,-1,64x4096x8192,0,
2026-03-03T03:29:23.511440+00:00,FULL,llm_style,eval,llm_style_eval_199,2,8192,4096,bf16,NVIDIA GeForce RTX 4060,c02,32,64,32,2,2,8,0.0,389.121,292.86399483680725,327.08607882261265,0.4582937143734251,5,-1,-1,2x8192x4096,0,
2026-03-03T03:29:23.583824+00:00,FULL,llm_style,eval,llm_style_eval_200,1,4096,1024,bf16,NVIDIA GeForce RTX 4060,c11,32,128,32,4,2,8,0.0,72.342,39.583999663591385,56.895680278539636,0.21191916105728154,5,-1,-1,1x4096x1024,0,
2026-03-03T03:29:23.756995+00:00,FULL,llm_style,eval,llm_style_eval_201,4,1536,8192,bf16,NVIDIA GeForce RTX 4060,c04,64,64,64,4,3,8,0.0,173.129,86.01599931716919,111.25503934919828,1.1702857235759294,6,-1,-1,4x1536x8192,0,
2026-03-03T03:29:23.988707+00:00,FULL,llm_style,eval,llm_style_eval_202,1,6144,3072,bf16,NVIDIA GeForce RTX 4060,c02,32,64,32,2,2,8,0.0,231.67,177.15199291706085,197.55231499671936,0.21308671372200275,5,-1,-1,1x6144x3072,0,
2026-03-03T03:29:24.159788+00:00,FULL,llm_style,eval,llm_style_eval_203,16,2048,6144,bf16,NVIDIA GeForce RTX 4060,c00,32,32,32,2,2,8,0.0,171.038,91.5680006146431,194.75680217146868,4.397313267705112,6,-1,-1,16x2048x6144,0,
2026-03-03T03:29:24.179130+00:00,FULL,llm_style,eval,llm_style_eval_204,16,1536,1024,bf16,NVIDIA GeForce RTX 4060,c04,64,64,64,4,3,8,0.0,0.0,41.45599901676178,203.10879662632914,1.2140980604435454,7,-1,-1,16x1536x1024,0,
2026-03-03T03:29:24.247770+00:00,FULL,llm_style,eval,llm_style_eval_205,64,6144,2048,bf16,NVIDIA GeForce RTX 4060,c10,64,128,64,8,3,8,0.0,0.0,95.76000273227692,142.62976229190818,16.819263680504534,1,-1,-1,64x6144x2048,0,
2026-03-03T03:29:24.309762+00:00,FULL,llm_style,eval,llm_style_eval_206,4,2048,6144,bf16,NVIDIA GeForce RTX 4060,c00,32,32,32,2,2,8,0.0,0.0,86.01599931716919,219.4124758243559,1.1702857235759294,6,-1,-1,4x2048x6144,0,
2026-03-03T03:29:24.427228+00:00,FULL,llm_style,eval,llm_style_eval_207,32,6144,1536,bf16,NVIDIA GeForce RTX 4060,c11,32,128,32,4,2,8,0.0,117.411,48.128001391887665,63.128322213888126,12.549446445573892,5,-1,-1,32x6144x1536,0,
2026-03-03T03:29:24.480678+00:00,FULL,llm_style,eval,llm_style_eval_208,4,2048,1024,bf16,NVIDIA GeForce RTX 4060,c02,32,64,32,2,2,8,0.0,53.406,37.88800165057182,50.66688012331724,0.44281079151997954,7,-1,-1,4x2048x1024,0,
2026-03-03T03:29:24.533882+00:00,FULL,llm_style,eval,llm_style_eval_209,1,1024,1536,bf16,NVIDIA GeForce RTX 4060,c04,64,64,64,4,3,8,0.0,53.168,36.86400130391121,41.993600912392125,0.08533333031502047,7,-1,-1,1x1024x1536,0,
2026-03-03T03:29:24.837030+00:00,FULL,llm_style,eval,llm_style_eval_210,8,6144,4096,bf16,NVIDIA GeForce RTX 4060,c00,32,32,32,2,2,8,0.0,303.111,226.31999850273132,264.2022435367106,1.7791321432654597,5,-1,-1,8x6144x4096,0,
2026-03-03T03:29:25.065032+00:00,FULL,llm_style,eval,llm_style_eval_211,4,2048,8192,bf16,NVIDIA GeForce RTX 4060,c10,64,128,64,8,3,8,0.0,227.959,161.47199273109436,239.3702387809752,0.8312136719803666,6,-1,-1,4x2048x8192,0,
2026-03-03T03:29:25.124913+00:00,FULL,llm_style,eval,llm_style_eval_212,32,1024,1024,bf16,NVIDIA GeForce RTX 4060,c04,64,64,64,4,3,8,0.0,59.84,37.728000432252884,58.50303951650856,1.7787548566350744,7,-1,-1,32x1024x1024,0,
2026-03-03T03:29:25.187091+00:00,FULL,llm_style,eval,llm_style_eval_213,16,3072,4096,bf16,NVIDIA GeForce RTX 4060,c00,32,32,32,2,2,8,0.0,0.0,72.64000177383423,86.57919950783253,5.54313290428691,7,-1,-1,16x3072x4096,0,
2026-03-03T03:29:25.232053+00:00,FULL,llm_style,eval,llm_style_eval_214,64,1024,8192,bf16,NVIDIA GeForce RTX 4060,c04,64,64,64,4,3,8,0.0,0.0,81.91999793052673,100.8284832537174,13.107200331115731,2,-1,-1,64x1024x8192,0,
2026-03-03T03:29:25.257996+00:00,FULL,llm_style,eval,llm_style_eval_215,4,4096,1536,bf16,NVIDIA GeForce RTX 4060,c11,32,128,32,4,2,8,0.0,0.0,50.03200098872185,148.1625542044639,1.0059891070786016,5,-1,-1,4x4096x1536,0,
2026-03-03T03:29:25.336131+00:00,FULL,llm_style,eval,llm_style_eval_216,16,1536,3072,bf16,NVIDIA GeForce RTX 4060,c00,32,32,32,2,2,8,0.0,78.084,48.048000782728195,69.67296123504639,3.1425853633909804,7,-1,-1,16x1536x3072,0,
2026-03-03T03:29:25.406396+00:00,FULL,llm_style,eval,llm_style_eval_217,8,6144,2048,bf16,NVIDIA GeForce RTX 4060,c11,32,128,32,4,2,8,0.0,0.0,63.48799914121628,155.71200042963028,3.171096817088053,5,-1,-1,8x6144x2048,0,
2026-03-03T03:29:25.546572+00:00,FULL,llm_style,eval,llm_style_eval_218,8,3072,4096,bf16,NVIDIA GeForce RTX 4060,c00,32,32,32,2,2,8,0.0,140.123,67.58400052785873,145.57407930493326,2.9789090676425904,7,-1,-1,8x3072x4096,0,
2026-03-03T03:29:25.859206+00:00,FULL,llm_style,eval,llm_style_eval_219,64,8192,3072,bf16,NVIDIA GeForce RTX 4060,c00,32,32,32,2,2,8,0.0,312.591,234.5760017633438,333.5859239101409,13.732118578991686,1,-1,-1,64x8192x3072,0,
2026-03-03T03:29:25.904874+00:00,FULL,llm_style,eval,llm_style_eval_220,2,4096,2048,bf16,NVIDIA GeForce RTX 4060,c11,32,128,32,4,2,8,0.0,0.0,59.39200147986412,157.42176048457605,0.5649655031641942,5,-1,-1,2x4096x2048,0,
2026-03-03T03:29:26.054420+00:00,FULL,llm_style,eval,llm_style_eval_221,4,1024,8192,bf16,NVIDIA GeForce RTX 4060,c04,64,64,64,4,3,8,0.0,149.493,84.99199897050858,95.25119818747041,0.7895903710099365,6,-1,-1,4x1024x8192,0,
2026-03-03T03:29:26.124822+00:00,FULL,llm_style,eval,llm_style_eval_222,64,6144,2048,bf16,NVIDIA GeForce RTX 4060,c10,64,128,64,8,3,8,0.0,0.0,95.0240008533001,163.48607867956156,16.94953613336588,1,-1,-1,64x6144x2048,0,
2026-03-03T03:29:26.196508+00:00,FULL,llm_style,eval,llm_style_eval_223,4,2048,2048,bf16,NVIDIA GeForce RTX 4060,c11,32,128,32,4,2,8,0.0,71.635,50.89600011706352,58.943359665572636,0.6592744404830049,7,-1,-1,4x2048x2048,0,
2026-03-03T03:29:26.221555+00:00,FULL,llm_style,eval,llm_style_eval_224,16,3072,1536,bf16,NVIDIA GeForce RTX 4060,c11,32,128,32,4,2,8,0.0,0.0,49.99999888241291,185.44607996940613,3.0198989475000015,7,-1,-1,16x3072x1536,0,
2026-03-03T03:29:26.243079+00:00,FULL,llm_style,eval,llm_style_eval_225,1,2048,2048,bf16,NVIDIA GeForce RTX 4060,c00,32,32,32,2,2,8,0.0,0.0,69.13600116968155,201.00768357515327,0.12133487413325672,7,-1,-1,1x2048x2048,0,
2026-03-03T03:29:26.253005+00:00,FULL,llm_style,eval,llm_style_eval_226,8,1536,1024,bf16,NVIDIA GeForce RTX 4060,c04,64,64,64,4,3,8,0.0,0.0,35.87200120091438,109.75935861468308,0.7015450255771769,7,-1,-1,8x1536x1024,0,
2026-03-03T03:29:26.441645+00:00,FULL,llm_style,eval,llm_style_eval_227,64,6144,6144,bf16,NVIDIA GeForce RTX 4060,c06,64,128,32,4,3,8,0.0,0.0,332.0799916982651,452.63361811637856,14.550223827969472,0,-1,-1,64x6144x6144,0,
2026-03-03T03:29:26.502811+00:00,FULL,llm_style,eval,llm_style_eval_228,64,6144,2048,bf16,NVIDIA GeForce RTX 4060,c10,64,128,64,8,3,8,0.0,0.0,102.39999741315842,198.92159610986693,15.728640397338877,1,-1,-1,64x6144x2048,0,
2026-03-03T03:29:26.671280+00:00,FULL,llm_style,eval,llm_style_eval_229,16,1536,8192,bf16,NVIDIA GeForce RTX 4060,c04,64,64,64,4,3,8,0.0,168.402,87.0399996638298,93.5232002288103,4.626070606102333,6,-1,-1,16x1536x8192,0,
2026-03-03T03:29:26.693548+00:00,FULL,llm_style,eval,llm_style_eval_230,64,2048,1536,bf16,NVIDIA GeForce RTX 4060,c11,32,128,32,4,2,8,0.0,0.0,46.08000069856644,173.59711438417423,8.738133200864441,3,-1,-1,64x2048x1536,0,
2026-03-03T03:29:26.738231+00:00,FULL,llm_style,eval,llm_style_eval_231,4,1024,8192,bf16,NVIDIA GeForce RTX 4060,c04,64,64,64,4,3,8,0.0,0.0,82.94399827718735,138.52192230522627,0.8090864365584532,6,-1,-1,4x1024x8192,0,
2026-03-03T03:29:26.755683+00:00,FULL,llm_style,eval,llm_style_eval_232,16,3072,1536,bf16,NVIDIA GeForce RTX 4060,c11,32,128,32,4,2,8,0.0,0.0,41.98399931192398,94.9027176946401,3.5964878638209092,7,-1,-1,16x3072x1536,0,
2026-03-03T03:29:26.805339+00:00,FULL,llm_style,eval,llm_style_eval_233,64,3072,3072,bf16,NVIDIA GeForce RTX 4060,c03,64,64,32,4,2,8,0.0,0.0,91.18400141596794,176.11583933234215,13.247494442467676,3,-1,-1,64x3072x3072,0,
2026-03-03T03:29:26.970098+00:00,FULL,llm_style,eval,llm_style_eval_234,32,8192,4096,bf16,NVIDIA GeForce RTX 4060,c06,64,128,32,4,3,8,0.0,0.0,300.83200335502625,398.08608114719385,7.138481358533028,5,-1,-1,32x8192x4096,0,
2026-03-03T03:29:26.981284+00:00,FULL,llm_style,eval,llm_style_eval_235,4,2048,1024,bf16,NVIDIA GeForce RTX 4060,c02,32,64,32,2,2,8,0.0,0.0,40.86400009691715,128.8089625537395,0.41056225431209564,7,-1,-1,4x2048x1024,0,
2026-03-03T03:29:27.101486+00:00,FULL,llm_style,eval,llm_style_eval_236,4,8192,3072,bf16,NVIDIA GeForce RTX 4060,c00,32,32,32,2,2,8,0.0,0.0,229.37600314617157,269.03904080390924,0.877714273675364,5,-1,-1,4x8192x3072,0,
2026-03-03T03:29:27.120957+00:00,FULL,llm_style,eval,llm_style_eval_237,64,1024,4096,bf16,NVIDIA GeForce RTX 4060,c04,64,64,64,4,3,8,0.0,0.0,64.51199948787689,178.63744333386418,8.322031812095497,3,-1,-1,64x1024x4096,0,
2026-03-03T03:29:27.288455+00:00,FULL,llm_style,eval,llm_style_eval_238,32,2048,6144,bf16,NVIDIA GeForce RTX 4060,c00,32,32,32,2,2,8,0.0,167.441,105.47199845314026,121.87648020684719,7.635262247901621,6,-1,-1,32x2048x6144,0,
2026-03-03T03:29:27.296087+00:00,FULL,llm_style,eval,llm_style_eval_239,32,2048,6144,bf16,NVIDIA GeForce RTX 4060,c00,32,32,32,2,2,8,0.0,0.0,111.61600053310394,200.4400004446506,7.214972442603836,6,-1,-1,32x2048x6144,0,
2026-03-03T03:29:27.436801+00:00,FULL,llm_style,eval,llm_style_eval_240,8,8192,1536,bf16,NVIDIA GeForce RTX 4060,c11,32,128,32,4,2,8,0.0,140.666,59.39200147986412,67.94719934463501,3.3897930189851655,5,-1,-1,8x8192x1536,0,
2026-03-03T03:29:27.455274+00:00,FULL,llm_style,eval,llm_style_eval_241,16,1536,1536,bf16,NVIDIA GeForce RTX 4060,c04,64,64,64,4,3,8,0.0,0.0,39.37599994242191,231.9455939531323,1.9173474225517368,7,-1,-1,16x1536x1536,0,
2026-03-03T03:29:27.482076+00:00,FULL,llm_style,eval,llm_style_eval_242,1,2048,3072,bf16,NVIDIA GeForce RTX 4060,c00,32,32,32,2,2,8,0.0,0.0,52.12800018489361,146.5548774600029,0.24138489785469372,7,-1,-1,1x2048x3072,0,
2026-03-03T03:29:27.518497+00:00,FULL,llm_style,eval,llm_style_eval_243,8,1536,6144,bf16,NVIDIA GeForce RTX 4060,c04,64,64,64,4,3,8,0.0,0.0,68.04800033569336,84.5516788214445,2.2189475554772224,6,-1,-1,8x1536x6144,0,
2026-03-03T03:29:27.557925+00:00,FULL,llm_style,eval,llm_style_eval_244,32,8192,1024,bf16,NVIDIA GeForce RTX 4060,c11,32,128,32,4,2,8,0.0,0.0,49.15200173854828,78.05280152708286,10.92266628032262,5,-1,-1,32x8192x1024,0,
2026-03-03T03:29:27.677318+00:00,FULL,llm_style,eval,llm_style_eval_245,4,6144,4096,bf16,NVIDIA GeForce RTX 4060,c02,32,64,32,2,2,8,0.0,0.0,227.32800245285034,291.5548753738401,0.8856216120658376,5,-1,-1,4x6144x4096,0,
2026-03-03T03:29:27.739694+00:00,FULL,llm_style,eval,llm_style_eval_246,32,2048,6144,bf16,NVIDIA GeForce RTX 4060,c00,32,32,32,2,2,8,0.0,0.0,105.31199723482132,138.64960208535186,7.646862552652512,6,-1,-1,32x2048x6144,0,
2026-03-03T03:29:27.802912+00:00,FULL,llm_style,eval,llm_style_eval_247,64,6144,2048,bf16,NVIDIA GeForce RTX 4060,c10,64,128,64,8,3,8,0.0,0.0,95.23200243711472,190.41439995169637,16.91251569621828,1,-1,-1,64x6144x2048,0,
2026-03-03T03:29:27.810835+00:00,FULL,llm_style,eval,llm_style_eval_248,64,1024,1024,bf16,NVIDIA GeForce RTX 4060,c04,64,64,64,4,3,8,0.0,0.0,32.76799991726875,60.459200739860506,4.096000010341406,3,-1,-1,64x1024x1024,0,
2026-03-03T03:29:27.911717+00:00,FULL,llm_style,eval,llm_style_eval_249,2,8192,1024,bf16,NVIDIA GeForce RTX 4060,c00,32,32,32,2,2,8,0.0,100.847,45.69600149989128,114.41152147948736,0.7342968946654957,5,-1,-1,2x8192x1024,0,
2026-03-03T03:29:27.968473+00:00,FULL,llm_style,eval,llm_style_eval_250,64,3072,3072,bf16,NVIDIA GeForce RTX 4060,c03,64,64,32,4,2,8,0.0,0.0,69.2799985408783,242.21023917198158,17.435906140893607,3,-1,-1,64x3072x3072,0,
2026-03-03T03:29:28.012557+00:00,FULL,llm_style,eval,llm_style_eval_251,64,1024,8192,bf16,NVIDIA GeForce RTX 4060,c04,64,64,64,4,3,8,0.0,0.0,94.2080020904541,199.45728316903106,11.39756496448193,2,-1,-1,64x1024x8192,0,
2026-03-03T03:29:28.079976+00:00,FULL,llm_style,eval,llm_style_eval_252,64,4096,3072,bf16,NVIDIA GeForce RTX 4060,c04,64,64,64,4,3,8,0.0,0.0,90.11200070381165,162.67039567232126,17.873454405855544,1,-1,-1,64x4096x3072,0,
2026-03-03T03:29:28.201777+00:00,FULL,llm_style,eval,llm_style_eval_253,8,6144,4096,bf16,NVIDIA GeForce RTX 4060,c00,32,32,32,2,2,8,0.0,0.0,230.84799945354462,292.93792098760593,1.7442351025486322,5,-1,-1,8x6144x4096,0,
2026-03-03T03:29:28.283464+00:00,FULL,llm_style,eval,llm_style_eval_254,4,1536,3072,bf16,NVIDIA GeForce RTX 4060,c04,64,64,64,4,3,8,0.0,81.633,50.175998359918594,56.84224061667919,0.7523265552032206,7,-1,-1,4x1536x3072,0,
2026-03-03T03:29:28.308416+00:00,FULL,llm_style,eval,llm_style_eval_255,1,3072,1536,bf16,NVIDIA GeForce RTX 4060,c11,32,128,32,4,2,8,0.0,0.0,50.5599994212389,707.7689559757687,0.1866531666935837,7,-1,-1,1x3072x1536,0,
2026-03-03T03:29:28.397495+00:00,BUCKET,llm_style,tune,llm_style_tune_000,32,3072,2048,bf16,NVIDIA GeForce RTX 4060,c11,32,128,32,4,2,8,0.0,86.93,53.247999399900436,67.58048128336665,7.561846239067394,7,-1,-1,llm8_g7,0,
2026-03-03T03:29:28.492873+00:00,BUCKET,llm_style,tune,llm_style_tune_001,4,4096,1536,bf16,NVIDIA GeForce RTX 4060,c11,32,128,32,4,2,8,0.0,95.333,46.08000069856644,71.11392021179196,1.0922666501080551,5,-1,-1,llm8_g5,0,
2026-03-03T03:29:28.524416+00:00,BUCKET,llm_style,tune,llm_style_tune_002,8,8192,1024,bf16,NVIDIA GeForce RTX 4060,c11,32,128,32,4,2,8,0.0,0.0,50.175998359918594,118.82496297359467,2.674938862944784,5,-1,-1,llm8_g5,0,
2026-03-03T03:29:28.617713+00:00,BUCKET,llm_style,tune,llm_style_tune_003,64,1024,4096,bf16,NVIDIA GeForce RTX 4060,c04,64,64,64,4,3,8,0.0,93.244,57.13599920272827,71.17632128298281,9.396368655339176,3,-1,-1,llm8_g3,0,
2026-03-03T03:29:28.677832+00:00,BUCKET,llm_style,tune,llm_style_tune_004,16,3072,4096,bf16,NVIDIA GeForce RTX 4060,c11,32,128,32,4,2,8,0.0,0.0,80.89599758386612,117.49760523438447,4.97741787018033,7,-1,-1,llm8_g7,0,
2026-03-03T03:29:28.704923+00:00,BUCKET,llm_style,tune,llm_style_tune_005,16,1536,4096,bf16,NVIDIA GeForce RTX 4060,c11,32,128,32,4,2,8,0.0,0.0,80.92799782752991,163.20191830396652,2.487724859189747,7,-1,-1,llm8_g7,0,
2026-03-03T03:29:28.718515+00:00,BUCKET,llm_style,tune,llm_style_tune_006,2,2048,1024,bf16,NVIDIA GeForce RTX 4060,c11,32,128,32,4,2,8,0.0,0.0,45.56800052523613,217.31904327869404,0.1840898855185512,7,-1,-1,llm8_g7,0,
2026-03-03T03:29:28.743848+00:00,BUCKET,llm_style,tune,llm_style_tune_007,32,6144,1024,bf16,NVIDIA GeForce RTX 4060,c11,32,128,32,4,2,8,0.0,0.0,69.45599988102913,157.4313597381114,5.797241198596274,5,-1,-1,llm8_g5,0,
2026-03-03T03:29:28.759742+00:00,BUCKET,llm_style,tune,llm_style_tune_008,8,1536,2048,bf16,NVIDIA GeForce RTX 4060,c11,32,128,32,4,2,8,0.0,0.0,53.18399891257286,86.74304321408268,0.9463682503968586,7,-1,-1,llm8_g7,0,
2026-03-03T03:29:28.866971+00:00,BUCKET,llm_style,tune,llm_style_tune_009,16,1024,6144,bf16,NVIDIA GeForce RTX 4060,c04,64,64,64,4,3,8,0.0,107.186,70.01600041985512,76.82047985494137,2.8754369114592824,6,-1,-1,llm8_g6,0,
2026-03-03T03:29:28.884861+00:00,BUCKET,llm_style,tune,llm_style_tune_010,64,1536,2048,bf16,NVIDIA GeForce RTX 4060,c04,64,64,64,4,3,8,0.0,0.0,36.86400130391121,89.86495904624454,10.92266628032262,3,-1,-1,llm8_g3,0,
2026-03-03T03:29:28.912344+00:00,BUCKET,llm_style,tune,llm_style_tune_011,64,1536,4096,bf16,NVIDIA GeForce RTX 4060,c04,64,64,64,4,3,8,0.0,0.0,59.39200147986412,120.0880025327204,13.559172075940662,3,-1,-1,llm8_g3,0,
2026-03-03T03:29:28.925812+00:00,BUCKET,llm_style,tune,llm_style_tune_012,32,1024,2048,bf16,NVIDIA GeForce RTX 4060,c11,32,128,32,4,2,8,0.0,0.0,62.33600154519081,140.1983943581581,2.153133416853793,7,-1,-1,llm8_g7,0,
2026-03-03T03:29:28.935904+00:00,BUCKET,llm_style,tune,llm_style_tune_013,64,1536,1024,bf16,NVIDIA GeForce RTX 4060,c04,64,64,64,4,3,8,0.0,0.0,35.840000957250595,53.247999399900436,5.617371278537052,3,-1,-1,llm8_g3,0,
2026-03-03T03:29:29.024217+00:00,BUCKET,llm_style,tune,llm_style_tune_014,4,6144,3072,bf16,NVIDIA GeForce RTX 4060,c11,32,128,32,4,2,8,0.0,0.0,178.17600071430206,204.25375998020166,0.847448272464675,5,-1,-1,llm8_g5,0,
2026-03-03T03:29:29.047098+00:00,BUCKET,llm_style,tune,llm_style_tune_015,1,6144,1024,bf16,NVIDIA GeForce RTX 4060,c11,32,128,32,4,2,8,0.0,0.0,39.93599861860275,70.32512016594404,0.31507693397552106,5,-1,-1,llm8_g5,0,
2026-03-03T03:29:29.205705+00:00,BUCKET,llm_style,tune,llm_style_tune_016,4,8192,4096,bf16,NVIDIA GeForce RTX 4060,c11,32,128,32,4,2,8,0.0,0.0,295.80800235271454,362.7110394835471,0.9074651593770064,5,-1,-1,llm8_g5,0,
2026-03-03T03:29:29.222513+00:00,BUCKET,llm_style,tune,llm_style_tune_017,64,1536,2048,bf16,NVIDIA GeForce RTX 4060,c04,64,64,64,4,3,8,0.0,0.0,39.32799957692623,112.79968105256555,10.238333714696155,3,-1,-1,llm8_g3,0,
2026-03-03T03:29:29.389604+00:00,BUCKET,llm_style,tune,llm_style_tune_018,64,8192,1536,bf16,NVIDIA GeForce RTX 4060,c06,64,128,32,4,3,8,0.0,167.04,108.5439994931221,148.4044812619685,14.838339691933468,1,-1,-1,llm8_g1,0,
2026-03-03T03:29:29.406386+00:00,BUCKET,llm_style,tune,llm_style_tune_019,2,1536,1024,bf16,NVIDIA GeForce RTX 4060,c11,32,128,32,4,2,8,0.0,0.0,43.07200014591217,659.8624306917176,0.14606835017382175,7,-1,-1,llm8_g7,0,
2026-03-03T03:29:29.416381+00:00,BUCKET,llm_style,tune,llm_style_tune_020,16,1024,1536,bf16,NVIDIA GeForce RTX 4060,c11,32,128,32,4,2,8,0.0,0.0,47.10400104522705,120.85247986018658,1.068521715420181,7,-1,-1,llm8_g7,0,
2026-03-03T03:29:29.451266+00:00,BUCKET,llm_style,tune,llm_style_tune_021,1,6144,1536,bf16,NVIDIA GeForce RTX 4060,c11,32,128,32,4,2,8,0.0,0.0,51.19999870657921,62.78303850442169,0.36864000931262997,5,-1,-1,llm8_g5,0,
2026-03-03T03:29:29.533233+00:00,BUCKET,llm_style,tune,llm_style_tune_022,8,4096,4096,bf16,NVIDIA GeForce RTX 4060,c11,32,128,32,4,2,8,0.0,0.0,160.8479991555214,262.4246390163897,1.6688765630242874,5,-1,-1,llm8_g5,0,
2026-03-03T03:29:29.924672+00:00,BUCKET,llm_style,tune,llm_style_tune_023,2,4096,8192,bf16,NVIDIA GeForce RTX 4060,c02,32,64,32,2,2,8,0.0,391.386,292.86399483680725,326.7497611045837,0.4582937143734251,4,-1,-1,llm8_g4,0,
2026-03-03T03:29:29.954475+00:00,BUCKET,llm_style,tune,llm_style_tune_024,64,1536,2048,bf16,NVIDIA GeForce RTX 4060,c04,64,64,64,4,3,8,0.0,0.0,48.94400015473366,144.62111383676526,8.226813965491887,3,-1,-1,llm8_g3,0,
2026-03-03T03:29:29.980977+00:00,BUCKET,llm_style,tune,llm_style_tune_025,4,4096,1536,bf16,NVIDIA GeForce RTX 4060,c11,32,128,32,4,2,8,0.0,0.0,44.463999569416046,76.18080157786599,1.131964026794835,5,-1,-1,llm8_g5,0,
2026-03-03T03:29:30.006553+00:00,BUCKET,llm_style,tune,llm_style_tune_026,4,3072,2048,bf16,NVIDIA GeForce RTX 4060,c11,32,128,32,4,2,8,0.0,0.0,52.22399905323982,152.88319945335382,0.9637647233542828,7,-1,-1,llm8_g7,0,
2026-03-03T03:29:30.023531+00:00,BUCKET,llm_style,tune,llm_style_tune_027,8,4096,1024,bf16,NVIDIA GeForce RTX 4060,c11,32,128,32,4,2,8,0.0,0.0,37.647999823093414,74.0761607512831,1.7825346450101496,5,-1,-1,llm8_g5,0,
2026-03-03T03:29:30.033372+00:00,BUCKET,llm_style,tune,llm_style_tune_028,16,1536,1024,bf16,NVIDIA GeForce RTX 4060,c11,32,128,32,4,2,8,0.0,0.0,44.03200000524521,100.4236802458762,1.143069767305695,7,-1,-1,llm8_g7,0,
2026-03-03T03:29:30.437635+00:00,BUCKET,llm_style,tune,llm_style_tune_029,64,4096,8192,bf16,NVIDIA GeForce RTX 4060,c03,64,64,32,4,2,8,0.0,404.221,298.39999973773956,331.23551934957504,14.393322050183643,0,-1,-1,llm8_g0,0,
2026-03-03T03:29:30.501244+00:00,BUCKET,llm_style,tune,llm_style_tune_030,1,8192,1536,bf16,NVIDIA GeForce RTX 4060,c11,32,128,32,4,2,8,0.0,0.0,65.5359998345375,229.9391995370388,0.38400000096950676,5,-1,-1,llm8_g5,0,
2026-03-03T03:29:30.746699+00:00,BUCKET,llm_style,tune,llm_style_tune_031,1,8192,6144,bf16,NVIDIA GeForce RTX 4060,c02,32,64,32,2,2,8,0.0,0.0,429.05598878860474,594.662712216377,0.23461575792057446,4,-1,-1,llm8_g4,0,
2026-03-03T03:29:30.873104+00:00,BUCKET,llm_style,tune,llm_style_tune_032,32,3072,8192,bf16,NVIDIA GeForce RTX 4060,c04,64,64,64,4,3,8,0.0,0.0,233.47200453281403,335.88513225317,6.898526181855913,6,-1,-1,llm8_g6,0,
2026-03-03T03:29:30.912038+00:00,BUCKET,llm_style,tune,llm_style_tune_033,4,1536,6144,bf16,NVIDIA GeForce RTX 4060,c04,64,64,64,4,3,8,0.0,0.0,72.7040022611618,166.97343692183495,1.038422502915365,6,-1,-1,llm8_g6,0,
2026-03-03T03:29:30.945348+00:00,BUCKET,llm_style,tune,llm_style_tune_034,1,4096,1536,bf16,NVIDIA GeForce RTX 4060,c11,32,128,32,4,2,8,0.0,0.0,47.10400104522705,133.28255981206888,0.26713042885504523,5,-1,-1,llm8_g5,0,
2026-03-03T03:29:30.975242+00:00,BUCKET,llm_style,tune,llm_style_tune_035,4,1536,4096,bf16,NVIDIA GeForce RTX 4060,c11,32,128,32,4,2,8,0.0,0.0,75.1200020313263,83.84736120700836,0.6700165953005548,7,-1,-1,llm8_g7,0,
2026-03-03T03:29:31.102324+00:00,BUCKET,llm_style,tune,llm_style_tune_036,32,8192,3072,bf16,NVIDIA GeForce RTX 4060,c11,32,128,32,4,2,8,0.0,0.0,228.35199534893036,350.36351203918457,7.05320193738147,5,-1,-1,llm8_g5,0,
2026-03-03T03:29:31.128245+00:00,BUCKET,llm_style,tune,llm_style_tune_037,32,3072,2048,bf16,NVIDIA GeForce RTX 4060,c11,32,128,32,4,2,8,0.0,0.0,51.16799846291542,95.56928217411033,7.869238510312796,7,-1,-1,llm8_g7,0,
2026-03-03T03:29:31.163766+00:00,BUCKET,llm_style,tune,llm_style_tune_038,2,2048,4096,bf16,NVIDIA GeForce RTX 4060,c11,32,128,32,4,2,8,0.0,0.0,77.82399654388428,197.63199985027313,0.43115791388429847,7,-1,-1,llm8_g7,0,
2026-03-03T03:29:31.183800+00:00,BUCKET,llm_style,tune,llm_style_tune_039,64,2048,1536,bf16,NVIDIA GeForce RTX 4060,c04,64,64,64,4,3,8,0.0,0.0,61.43999844789505,143.22143867611885,6.553600165557866,3,-1,-1,llm8_g3,0,
2026-03-03T03:29:31.300249+00:00,BUCKET,llm_style,tune,llm_style_tune_040,64,1024,6144,bf16,NVIDIA GeForce RTX 4060,c04,64,64,64,4,3,8,0.0,116.401,70.65600156784058,85.17632268369195,11.397564964481928,2,-1,-1,llm8_g2,0,
2026-03-03T03:29:31.536550+00:00,BUCKET,llm_style,tune,llm_style_tune_041,4,8192,6144,bf16,NVIDIA GeForce RTX 4060,c02,32,64,32,2,2,8,0.0,0.0,427.0399957895279,452.73088425397873,0.9428933775993497,4,-1,-1,llm8_g4,0,
2026-03-03T03:29:31.563264+00:00,BUCKET,llm_style,tune,llm_style_tune_042,1,1024,6144,bf16,NVIDIA GeForce RTX 4060,c04,64,64,64,4,3,8,0.0,0.0,71.69600203633308,212.59264126420018,0.1755036772290791,6,-1,-1,llm8_g6,0,
2026-03-03T03:29:31.649655+00:00,BUCKET,llm_style,tune,llm_style_tune_043,64,2048,8192,bf16,NVIDIA GeForce RTX 4060,c04,64,64,64,4,3,8,0.0,0.0,168.96000504493713,278.79232063889486,12.710011741706852,2,-1,-1,llm8_g2,0,
2026-03-03T03:29:31.660527+00:00,BUCKET,llm_style,tune,llm_style_tune_044,16,2048,1024,bf16,NVIDIA GeForce RTX 4060,c11,32,128,32,4,2,8,0.0,0.0,36.86400130391121,63.528959155082696,1.8204443800537697,7,-1,-1,llm8_g7,0,
2026-03-03T03:29:31.671427+00:00,BUCKET,llm_style,tune,llm_style_tune_045,4,1024,1536,bf16,NVIDIA GeForce RTX 4060,c11,32,128,32,4,2,8,0.0,0.0,48.048000782728195,146.63872122764573,0.261882113615915,7,-1,-1,llm8_g7,0,
2026-03-03T03:29:31.697252+00:00,BUCKET,llm_style,tune,llm_style_tune_046,64,1536,4096,bf16,NVIDIA GeForce RTX 4060,c04,64,64,64,4,3,8,0.0,0.0,62.463998794555664,149.39488150179378,12.892328117651509,3,-1,-1,llm8_g3,0,
2026-03-03T03:29:31.711698+00:00,BUCKET,llm_style,tune,llm_style_tune_047,16,2048,1536,bf16,NVIDIA GeForce RTX 4060,c11,32,128,32,4,2,8,0.0,0.0,45.53600028157234,93.8339181244372,2.210631047468979,7,-1,-1,llm8_g7,0,
2026-03-03T03:29:31.889980+00:00,BUCKET,llm_style,tune,llm_style_tune_048,64,6144,6144,bf16,NVIDIA GeForce RTX 4060,c03,64,64,32,4,2,8,0.0,0.0,334.1760039329529,407.638083398342,14.458962196966818,0,-1,-1,llm8_g0,0,
2026-03-03T03:29:32.064955+00:00,BUCKET,llm_style,tune,llm_style_tune_049,4,4096,8192,bf16,NVIDIA GeForce RTX 4060,c02,32,64,32,2,2,8,0.0,0.0,293.64800453186035,386.31423622369743,0.9141402354425848,4,-1,-1,llm8_g4,0,
2026-03-03T03:29:32.123470+00:00,BUCKET,llm_style,tune,llm_style_tune_050,1,4096,3072,bf16,NVIDIA GeForce RTX 4060,c11,32,128,32,4,2,8,0.0,0.0,65.5359998345375,83.14880199730392,0.38400000096950676,5,-1,-1,llm8_g5,0,
2026-03-03T03:29:32.157491+00:00,BUCKET,llm_style,tune,llm_style_tune_051,2,4096,2048,bf16,NVIDIA GeForce RTX 4060,c11,32,128,32,4,2,8,0.0,0.0,49.55200105905533,105.54367817938316,0.6771559429055214,5,-1,-1,llm8_g5,0,
2026-03-03T03:29:32.215153+00:00,BUCKET,llm_style,tune,llm_style_tune_052,4,8192,1536,bf16,NVIDIA GeForce RTX 4060,c11,32,128,32,4,2,8,0.0,0.0,62.36799992620945,163.24447482824326,1.6140215514221963,5,-1,-1,llm8_g5,0,
2026-03-03T03:29:32.241913+00:00,BUCKET,llm_style,tune,llm_style_tune_053,1,1536,4096,bf16,NVIDIA GeForce RTX 4060,c11,32,128,32,4,2,8,0.0,0.0,97.10400179028511,178.69887590408322,0.12958180680519465,7,-1,-1,llm8_g7,0,
2026-03-03T03:29:32.480892+00:00,BUCKET,llm_style,tune,llm_style_tune_054,8,8192,6144,bf16,NVIDIA GeForce RTX 4060,c02,32,64,32,2,2,8,0.0,0.0,431.5679967403412,452.5487992167473,1.8660011263173522,4,-1,-1,llm8_g4,0,
2026-03-03T03:29:32.519541+00:00,BUCKET,llm_style,tune,llm_style_tune_055,64,6144,1536,bf16,NVIDIA GeForce RTX 4060,c06,64,128,32,4,3,8,0.0,0.0,90.11200070381165,98.84671986103058,13.405090804391657,1,-1,-1,llm8_g1,0,
2026-03-03T03:29:32.545824+00:00,BUCKET,llm_style,tune,llm_style_tune_056,1,3072,1536,bf16,NVIDIA GeForce RTX 4060,c11,32,128,32,4,2,8,0.0,0.0,54.64000068604946,150.5689588189125,0.17271566401003863,7,-1,-1,llm8_g7,0,
2026-03-03T03:29:32.553709+00:00,BUCKET,llm_style,tune,llm_style_tune_057,64,1024,1024,bf16,NVIDIA GeForce RTX 4060,c04,64,64,64,4,3,8,0.0,0.0,38.91199827194214,114.74271707236753,3.4492633110743878,3,-1,-1,llm8_g3,0,
2026-03-03T03:29:32.722662+00:00,BUCKET,llm_style,tune,llm_style_tune_058,16,8192,4096,bf16,NVIDIA GeForce RTX 4060,c11,32,128,32,4,2,8,0.0,0.0,301.0080009698868,415.8668717741966,3.5671537651499787,5,-1,-1,llm8_g5,0,
2026-03-03T03:29:32.846935+00:00,BUCKET,llm_style,tune,llm_style_tune_059,16,4096,6144,bf16,NVIDIA GeForce RTX 4060,c02,32,64,32,2,2,8,0.0,0.0,234.49599742889404,374.3641635775566,3.4342009110163687,4,-1,-1,llm8_g4,0,
2026-03-03T03:29:32.970025+00:00,BUCKET,llm_style,tune,llm_style_tune_060,2,3072,8192,bf16,NVIDIA GeForce RTX 4060,c04,64,64,64,4,3,8,0.0,0.0,236.4960014820099,370.97472637891764,0.4256448116212967,6,-1,-1,llm8_g6,0,
2026-03-03T03:29:33.148722+00:00,BUCKET,llm_style,tune,llm_style_tune_061,64,4096,8192,bf16,NVIDIA GeForce RTX 4060,c03,64,64,32,4,2,8,0.0,0.0,481.79200291633606,601.4143896102905,8.914567427441979,0,-1,-1,llm8_g0,0,
2026-03-03T03:29:33.213945+00:00,BUCKET,llm_style,tune,llm_style_tune_062,32,4096,3072,bf16,NVIDIA GeForce RTX 4060,c11,32,128,32,4,2,8,0.0,0.0,129.02399897575378,180.3471970558166,6.241523859071623,5,-1,-1,llm8_g5,0,
2026-03-03T03:29:33.342959+00:00,BUCKET,llm_style,tune,llm_style_tune_063,2,3072,8192,bf16,NVIDIA GeForce RTX 4060,c04,64,64,64,4,3,8,0.0,0.0,365.4720038175583,448.80223870277393,0.27543367193250345,6,-1,-1,llm8_g6,0,
2026-03-03T03:29:33.353588+00:00,BUCKET,llm_style,eval,llm_style_eval_000,32,1536,1024,bf16,NVIDIA GeForce RTX 4060,c11,32,128,32,4,2,8,0.0,0.0,52.22399905323982,64.91999879479408,1.9275294467085655,7,-1,-1,llm8_g7,0,
2026-03-03T03:29:33.446834+00:00,BUCKET,llm_style,eval,llm_style_eval_001,32,2048,8192,bf16,NVIDIA GeForce RTX 4060,c04,64,64,64,4,3,8,0.0,0.0,274.944007396698,387.1539169549942,3.90531088190175,6,-1,-1,llm8_g6,0,
2026-03-03T03:29:33.497166+00:00,BUCKET,llm_style,eval,llm_style_eval_002,16,2048,4096,bf16,NVIDIA GeForce RTX 4060,c11,32,128,32,4,2,8,0.0,0.0,133.12000036239624,176.599040031433,2.016492302202755,7,-1,-1,llm8_g7,0,
2026-03-03T03:29:33.513774+00:00,BUCKET,llm_style,eval,llm_style_eval_003,16,2048,1536,bf16,NVIDIA GeForce RTX 4060,c11,32,128,32,4,2,8,0.0,0.0,70.65600156784058,198.18495988845814,1.424695620560241,7,-1,-1,llm8_g7,0,
2026-03-03T03:29:33.606930+00:00,BUCKET,llm_style,eval,llm_style_eval_004,64,8192,2048,bf16,NVIDIA GeForce RTX 4060,c06,64,128,32,4,3,8,0.0,0.0,268.70399713516235,295.1987156271934,7.992004848814296,1,-1,-1,llm8_g1,0,
2026-03-03T03:29:33.737156+00:00,BUCKET,llm_style,eval,llm_style_eval_005,64,3072,8192,bf16,NVIDIA GeForce RTX 4060,c04,64,64,64,4,3,8,0.0,0.0,372.73600697517395,486.44095331430435,8.642109728386261,2,-1,-1,llm8_g2,0,
2026-03-03T03:29:33.758325+00:00,BUCKET,llm_style,eval,llm_style_eval_006,32,2048,2048,bf16,NVIDIA GeForce RTX 4060,c11,32,128,32,4,2,8,0.0,0.0,90.11200070381165,192.10048094391817,2.9789090676425904,7,-1,-1,llm8_g7,0,
2026-03-03T03:29:33.853482+00:00,BUCKET,llm_style,eval,llm_style_eval_007,8,8192,2048,bf16,NVIDIA GeForce RTX 4060,c11,32,128,32,4,2,8,0.0,0.0,252.9279887676239,283.4124752879142,1.0613117880228886,5,-1,-1,llm8_g5,0,
2026-03-03T03:29:33.926404+00:00,BUCKET,llm_style,eval,llm_style_eval_008,64,1536,8192,bf16,NVIDIA GeForce RTX 4060,c04,64,64,64,4,3,8,0.0,0.0,192.46400147676468,316.46144211292267,8.368384340146031,2,-1,-1,llm8_g2,0,
2026-03-03T03:29:34.067424+00:00,BUCKET,llm_style,eval,llm_style_eval_009,64,4096,6144,bf16,NVIDIA GeForce RTX 4060,c03,64,64,32,4,2,8,0.0,0.0,381.9519877433777,492.0671981573105,8.433587401996313,0,-1,-1,llm8_g0,0,
2026-03-03T03:29:34.119864+00:00,BUCKET,llm_style,eval,llm_style_eval_010,64,2048,4096,bf16,NVIDIA GeForce RTX 4060,c04,64,64,64,4,3,8,0.0,0.0,165.8879965543747,263.3113670349121,6.472691492467626,3,-1,-1,llm8_g3,0,
2026-03-03T03:29:34.221087+00:00,BUCKET,llm_style,eval,llm_style_eval_011,32,3072,6144,bf16,NVIDIA GeForce RTX 4060,c04,64,64,64,4,3,8,0.0,0.0,288.672000169754,404.5004752278328,4.184540070701895,6,-1,-1,llm8_g6,0,
2026-03-03T03:29:34.235853+00:00,BUCKET,llm_style,eval,llm_style_eval_012,16,1536,1536,bf16,NVIDIA GeForce RTX 4060,c11,32,128,32,4,2,8,0.0,0.0,75.6480023264885,98.49247962236402,0.9980101215913301,7,-1,-1,llm8_g7,0,
2026-03-03T03:29:34.266383+00:00,BUCKET,llm_style,eval,llm_style_eval_013,64,2048,3072,bf16,NVIDIA GeForce RTX 4060,c04,64,64,64,4,3,8,0.0,0.0,118.78400295972824,196.66943952441216,6.779586037970331,3,-1,-1,llm8_g3,0,
2026-03-03T03:29:34.536667+00:00,BUCKET,llm_style,eval,llm_style_eval_014,16,8192,6144,bf16,NVIDIA GeForce RTX 4060,c02,32,64,32,2,2,8,0.0,0.0,701.4079988002777,783.9436805248258,2.2962565849760344,4,-1,-1,llm8_g4,0,
2026-03-03T03:29:34.581846+00:00,BUCKET,llm_style,eval,llm_style_eval_015,64,6144,1536,bf16,NVIDIA GeForce RTX 4060,c06,64,128,32,4,3,8,0.0,0.0,139.66400176286697,226.01184189319605,8.649040101621699,1,-1,-1,llm8_g1,0,
2026-03-03T03:29:34.673035+00:00,BUCKET,llm_style,eval,llm_style_eval_016,16,4096,4096,bf16,NVIDIA GeForce RTX 4060,c11,32,128,32,4,2,8,0.0,0.0,254.36799228191376,376.8524733185768,2.11060718443298,5,-1,-1,llm8_g5,0,
2026-03-03T03:29:34.848606+00:00,BUCKET,llm_style,eval,llm_style_eval_017,64,8192,4096,bf16,NVIDIA GeForce RTX 4060,c06,64,128,32,4,3,8,0.0,0.0,517.1039998531342,665.8499360084531,8.305809464285403,1,-1,-1,llm8_g1,0,
2026-03-03T03:29:34.986332+00:00,BUCKET,llm_style,eval,llm_style_eval_018,32,4096,6144,bf16,NVIDIA GeForce RTX 4060,c02,32,64,32,2,2,8,0.0,0.0,372.5920021533966,490.11712551116943,4.322724928853703,4,-1,-1,llm8_g4,0,
2026-03-03T03:29:35.123547+00:00,BUCKET,llm_style,eval,llm_style_eval_019,16,3072,8192,bf16,NVIDIA GeForce RTX 4060,c04,64,64,64,4,3,8,0.0,0.0,383.4879994392395,499.1715317964554,2.0999519389852357,6,-1,-1,llm8_g6,0,
2026-03-03T03:29:35.141687+00:00,BUCKET,llm_style,eval,llm_style_eval_020,4,1536,1536,bf16,NVIDIA GeForce RTX 4060,c11,32,128,32,4,2,8,0.0,0.0,81.91999793052673,159.30367812514305,0.23040000582039372,7,-1,-1,llm8_g7,0,
2026-03-03T03:29:35.189396+00:00,BUCKET,llm_style,eval,llm_style_eval_021,4,6144,1536,bf16,NVIDIA GeForce RTX 4060,c11,32,128,32,4,2,8,0.0,0.0,88.06400001049042,101.83295674622059,0.8573023254792712,5,-1,-1,llm8_g5,0,
2026-03-03T03:29:35.216868+00:00,BUCKET,llm_style,eval,llm_style_eval_022,32,6144,1024,bf16,NVIDIA GeForce RTX 4060,c11,32,128,32,4,2,8,0.0,0.0,71.04000076651573,147.8150400519371,5.667978317221361,5,-1,-1,llm8_g5,0,
2026-03-03T03:29:35.230454+00:00,BUCKET,llm_style,eval,llm_style_eval_023,16,1024,1536,bf16,NVIDIA GeForce RTX 4060,c11,32,128,32,4,2,8,0.0,0.0,95.74400261044502,202.18815922737107,0.5256898252393425,7,-1,-1,llm8_g7,0,
2026-03-03T03:29:35.267707+00:00,BUCKET,llm_style,eval,llm_style_eval_024,32,8192,1024,bf16,NVIDIA GeForce RTX 4060,c11,32,128,32,4,2,8,0.0,0.0,102.91199758648872,224.61440503597242,5.216796142245767,5,-1,-1,llm8_g5,0,
2026-03-03T03:29:35.465840+00:00,BUCKET,llm_style,eval,llm_style_eval_025,32,6144,6144,bf16,NVIDIA GeForce RTX 4060,c02,32,64,32,2,2,8,0.0,0.0,532.9119861125946,598.1260693073272,4.533429847625083,4,-1,-1,llm8_g4,0,
2026-03-03T03:29:35.529348+00:00,BUCKET,llm_style,eval,llm_style_eval_026,1,6144,2048,bf16,NVIDIA GeForce RTX 4060,c11,32,128,32,4,2,8,0.0,0.0,120.83200365304947,237.89983794093115,0.20827118014412635,5,-1,-1,llm8_g5,0,
2026-03-03T03:29:35.596238+00:00,BUCKET,llm_style,eval,llm_style_eval_027,32,4096,3072,bf16,NVIDIA GeForce RTX 4060,c11,32,128,32,4,2,8,0.0,0.0,180.2240014076233,291.19584798812866,4.468363601463886,5,-1,-1,llm8_g5,0,
2026-03-03T03:29:35.614858+00:00,BUCKET,llm_style,eval,llm_style_eval_028,64,1536,1536,bf16,NVIDIA GeForce RTX 4060,c04,64,64,64,4,3,8,0.0,0.0,80.25600016117096,192.17407420277593,3.762832528328607,3,-1,-1,llm8_g3,0,
2026-03-03T03:29:35.632268+00:00,BUCKET,llm_style,eval,llm_style_eval_029,2,3072,1024,bf16,NVIDIA GeForce RTX 4060,c11,32,128,32,4,2,8,0.0,0.0,71.68000191450119,177.500160485506,0.1755428524542829,7,-1,-1,llm8_g7,0,
2026-03-03T03:29:35.706876+00:00,BUCKET,llm_style,eval,llm_style_eval_030,32,1536,8192,bf16,NVIDIA GeForce RTX 4060,c04,64,64,64,4,3,8,0.0,0.0,252.8800070285797,347.28767752647394,3.1845394875720117,6,-1,-1,llm8_g6,0,
2026-03-03T03:29:35.736528+00:00,BUCKET,llm_style,eval,llm_style_eval_031,8,3072,2048,bf16,NVIDIA GeForce RTX 4060,c11,32,128,32,4,2,8,0.0,0.0,114.68800157308578,259.10687804222096,0.877714273675364,7,-1,-1,llm8_g7,0,
2026-03-03T03:29:35.767019+00:00,BUCKET,llm_style,eval,llm_style_eval_032,8,2048,3072,bf16,NVIDIA GeForce RTX 4060,c11,32,128,32,4,2,8,0.0,0.0,156.15999698638916,242.49343633651728,0.6446164058825755,7,-1,-1,llm8_g7,0,
2026-03-03T03:29:35.843437+00:00,BUCKET,llm_style,eval,llm_style_eval_033,64,1536,8192,bf16,NVIDIA GeForce RTX 4060,c04,64,64,64,4,3,8,0.0,0.0,265.21599292755127,302.5244888663291,6.0728341387767255,2,-1,-1,llm8_g2,0,
2026-03-03T03:29:35.923248+00:00,BUCKET,llm_style,eval,llm_style_eval_034,64,6144,2048,bf16,NVIDIA GeForce RTX 4060,c06,64,128,32,4,3,8,0.0,0.0,231.4240038394928,337.2169661521911,6.959575105774515,1,-1,-1,llm8_g1,0,
2026-03-03T03:29:35.960852+00:00,BUCKET,llm_style,eval,llm_style_eval_035,4,4096,2048,bf16,NVIDIA GeForce RTX 4060,c11,32,128,32,4,2,8,0.0,0.0,128.00000607967377,146.95424139499664,0.5242879750976575,5,-1,-1,llm8_g5,0,
2026-03-03T03:29:36.151482+00:00,BUCKET,llm_style,eval,llm_style_eval_036,64,8192,4096,bf16,NVIDIA GeForce RTX 4060,c06,64,128,32,4,3,8,0.0,0.0,643.0720090866089,777.2099179029462,6.678827931105853,1,-1,-1,llm8_g1,0,
2026-03-03T03:29:36.186477+00:00,BUCKET,llm_style,eval,llm_style_eval_037,32,6144,1024,bf16,NVIDIA GeForce RTX 4060,c11,32,128,32,4,2,8,0.0,0.0,79.83999699354172,118.84543918073176,5.043251492514094,5,-1,-1,llm8_g5,0,
2026-03-03T03:29:36.258913+00:00,BUCKET,llm_style,eval,llm_style_eval_038,64,6144,2048,bf16,NVIDIA GeForce RTX 4060,c06,64,128,32,4,3,8,0.0,0.0,243.6319962143898,380.217283964157,6.610842422284726,1,-1,-1,llm8_g1,0,
2026-03-03T03:29:36.281604+00:00,BUCKET,llm_style,eval,llm_style_eval_039,8,1024,3072,bf16,NVIDIA GeForce RTX 4060,c11,32,128,32,4,2,8,0.0,0.0,166.3680002093315,263.18656250834454,0.3025320250088389,7,-1,-1,llm8_g7,0,
2026-03-03T03:29:36.373306+00:00,BUCKET,llm_style,eval,llm_style_eval_040,32,8192,2048,bf16,NVIDIA GeForce RTX 4060,c11,32,128,32,4,2,8,0.0,0.0,261.4879906177521,423.89504134654976,4.106275861707222,5,-1,-1,llm8_g5,0,
2026-03-03T03:29:36.392759+00:00,BUCKET,llm_style,eval,llm_style_eval_041,32,3072,1024,bf16,NVIDIA GeForce RTX 4060,c11,32,128,32,4,2,8,0.0,0.0,86.01599931716919,127.04767800867546,2.340571447151859,7,-1,-1,llm8_g7,0,
2026-03-03T03:29:36.419776+00:00,BUCKET,llm_style,eval,llm_style_eval_042,64,1024,4096,bf16,NVIDIA GeForce RTX 4060,c04,64,64,64,4,3,8,0.0,0.0,157.69599378108978,168.45824122428894,3.4044676667263514,3,-1,-1,llm8_g3,0,
2026-03-03T03:29:36.433420+00:00,BUCKET,llm_style,eval,llm_style_eval_043,2,1536,1024,bf16,NVIDIA GeForce RTX 4060,c11,32,128,32,4,2,8,0.0,0.0,84.99199897050858,156.35455697774884,0.07402409728218154,7,-1,-1,llm8_g7,0,
2026-03-03T03:29:36.541992+00:00,BUCKET,llm_style,eval,llm_style_eval_044,64,6144,3072,bf16,NVIDIA GeForce RTX 4060,c06,64,128,32,4,3,8,0.0,0.0,368.6400055885315,514.154896736145,6.553599900648331,1,-1,-1,llm8_g1,0,
2026-03-03T03:29:36.593840+00:00,BUCKET,llm_style,eval,llm_style_eval_045,64,1536,6144,bf16,NVIDIA GeForce RTX 4060,c04,64,64,64,4,3,8,0.0,0.0,230.9119999408722,334.88896161317825,5.231254990253052,2,-1,-1,llm8_g2,0,
2026-03-03T03:29:36.693557+00:00,BUCKET,llm_style,eval,llm_style_eval_046,2,6144,3072,bf16,NVIDIA GeForce RTX 4060,c11,32,128,32,4,2,8,0.0,0.0,282.6240062713623,328.89696240425104,0.2671304288550452,5,-1,-1,llm8_g5,0,
2026-03-03T03:29:36.878719+00:00,BUCKET,llm_style,eval,llm_style_eval_047,16,4096,8192,bf16,NVIDIA GeForce RTX 4060,c02,32,64,32,2,2,8,0.0,0.0,538.5439991950989,614.5945554971693,1.9937866276567953,4,-1,-1,llm8_g4,0,
2026-03-03T03:29:36.928832+00:00,BUCKET,llm_style,eval,llm_style_eval_048,16,1024,6144,bf16,NVIDIA GeForce RTX 4060,c04,64,64,64,4,3,8,0.0,0.0,247.80799448490143,294.6972820162772,0.8124297701471714,6,-1,-1,llm8_g6,0,
2026-03-03T03:29:37.005992+00:00,BUCKET,llm_style,eval,llm_style_eval_049,16,8192,1536,bf16,NVIDIA GeForce RTX 4060,c11,32,128,32,4,2,8,0.0,0.0,205.79200237989426,364.4307234883306,1.956602683017282,5,-1,-1,llm8_g5,0,
2026-03-03T03:29:37.020802+00:00,BUCKET,llm_style,eval,llm_style_eval_050,1,1024,1024,bf16,NVIDIA GeForce RTX 4060,c11,32,128,32,4,2,8,0.0,0.0,87.80799806118011,187.47264340519902,0.02388338245154857,7,-1,-1,llm8_g7,0,
2026-03-03T03:29:37.052633+00:00,BUCKET,llm_style,eval,llm_style_eval_051,16,6144,1024,bf16,NVIDIA GeForce RTX 4060,c11,32,128,32,4,2,8,0.0,0.0,93.18400174379349,157.84192383289323,2.1605274320965653,5,-1,-1,llm8_g5,0,
2026-03-03T03:29:37.402909+00:00,BUCKET,llm_style,eval,llm_style_eval_052,16,8192,8192,bf16,NVIDIA GeForce RTX 4060,c02,32,64,32,2,2,8,0.0,0.0,941.0560131072998,982.1183973550797,2.2819934393800456,4,-1,-1,llm8_g4,0,
2026-03-03T03:29:37.662043+00:00,BUCKET,llm_style,eval,llm_style_eval_053,1,6144,8192,bf16,NVIDIA GeForce RTX 4060,c02,32,64,32,2,2,8,0.0,0.0,713.1200134754181,823.859184384346,0.14115898319753153,4,-1,-1,llm8_g4,0,
2026-03-03T03:29:37.748196+00:00,BUCKET,llm_style,eval,llm_style_eval_054,64,4096,3072,bf16,NVIDIA GeForce RTX 4060,c06,64,128,32,4,3,8,0.0,0.0,483.3280146121979,607.2524839639664,3.3323388823060216,1,-1,-1,llm8_g1,0,
2026-03-03T03:29:37.789078+00:00,BUCKET,llm_style,eval,llm_style_eval_055,4,8192,1024,bf16,NVIDIA GeForce RTX 4060,c11,32,128,32,4,2,8,0.0,0.0,168.94400119781494,242.74944007396698,0.397225492022193,5,-1,-1,llm8_g5,0,
2026-03-03T03:29:37.817807+00:00,BUCKET,llm_style,eval,llm_style_eval_056,64,1024,3072,bf16,NVIDIA GeForce RTX 4060,c04,64,64,64,4,3,8,0.0,0.0,151.5040025115013,272.4447968602179,2.657706577550206,3,-1,-1,llm8_g3,0,
2026-03-03T03:29:37.828740+00:00,BUCKET,llm_style,eval,llm_style_eval_057,64,1024,3072,bf16,NVIDIA GeForce RTX 4060,c04,64,64,64,4,3,8,0.0,0.0,151.5520066022873,178.38080078363416,2.656864749119877,3,-1,-1,llm8_g3,0,
2026-03-03T03:29:37.883744+00:00,BUCKET,llm_style,eval,llm_style_eval_058,32,2048,4096,bf16,NVIDIA GeForce RTX 4060,c11,32,128,32,4,2,8,0.0,0.0,268.2879865169525,331.3664057850836,2.001099337208214,7,-1,-1,llm8_g7,0,
2026-03-03T03:29:37.983582+00:00,BUCKET,llm_style,eval,llm_style_eval_059,64,8192,2048,bf16,NVIDIA GeForce RTX 4060,c06,64,128,32,4,3,8,0.0,0.0,432.0000112056732,523.0390593409537,4.971026834019208,1,-1,-1,llm8_g1,0,
2026-03-03T03:29:38.104432+00:00,BUCKET,llm_style,eval,llm_style_eval_060,1,3072,6144,bf16,NVIDIA GeForce RTX 4060,c04,64,64,64,4,3,8,0.0,0.0,459.77601408958435,603.6275231838225,0.08210244737265679,6,-1,-1,llm8_g6,0,
2026-03-03T03:29:38.141393+00:00,BUCKET,llm_style,eval,llm_style_eval_061,64,1536,4096,bf16,NVIDIA GeForce RTX 4060,c04,64,64,64,4,3,8,0.0,0.0,187.3920038342476,271.50688558816904,4.297442535020392,3,-1,-1,llm8_g3,0,
2026-03-03T03:29:38.210808+00:00,BUCKET,llm_style,eval,llm_style_eval_062,16,6144,2048,bf16,NVIDIA GeForce RTX 4060,c11,32,128,32,4,2,8,0.0,0.0,166.9120043516159,278.6099249124527,2.412368035265894,5,-1,-1,llm8_g5,0,
2026-03-03T03:29:38.272853+00:00,BUCKET,llm_style,eval,llm_style_eval_063,64,1536,6144,bf16,NVIDIA GeForce RTX 4060,c04,64,64,64,4,3,8,0.0,0.0,269.3119943141937,365.0393667817116,4.4853537068636085,2,-1,-1,llm8_g2,0,
2026-03-03T03:29:38.343348+00:00,BUCKET,llm_style,eval,llm_style_eval_064,1,6144,2048,bf16,NVIDIA GeForce RTX 4060,c11,32,128,32,4,2,8,0.0,0.0,169.98399794101715,399.26783740520466,0.14804819456436308,5,-1,-1,llm8_g5,0,
2026-03-03T03:29:38.404158+00:00,BUCKET,llm_style,eval,llm_style_eval_065,8,1536,6144,bf16,NVIDIA GeForce RTX 4060,c04,64,64,64,4,3,8,0.0,0.0,266.2400007247925,355.70911675691593,0.567138459994525,6,-1,-1,llm8_g6,0,
2026-03-03T03:29:38.438131+00:00,BUCKET,llm_style,eval,llm_style_eval_066,64,1536,4096,bf16,NVIDIA GeForce RTX 4060,c04,64,64,64,4,3,8,0.0,0.0,189.39200043678284,234.0128044784068,4.25206115434006,3,-1,-1,llm8_g3,0,
2026-03-03T03:29:38.542026+00:00,BUCKET,llm_style,eval,llm_style_eval_067,64,8192,2048,bf16,NVIDIA GeForce RTX 4060,c06,64,128,32,4,3,8,0.0,0.0,433.58398973941803,528.1484764814377,4.952866569844121,1,-1,-1,llm8_g1,0,
2026-03-03T03:29:38.570044+00:00,BUCKET,llm_style,eval,llm_style_eval_068,64,1024,4096,bf16,NVIDIA GeForce RTX 4060,c04,64,64,64,4,3,8,0.0,0.0,185.34399569034576,225.73055431246746,2.8966188518831237,3,-1,-1,llm8_g3,0,
2026-03-03T03:29:38.620380+00:00,BUCKET,llm_style,eval,llm_style_eval_069,64,2048,4096,bf16,NVIDIA GeForce RTX 4060,c04,64,64,64,4,3,8,0.0,0.0,319.3439990282059,435.76319485902786,3.362335999008901,3,-1,-1,llm8_g3,0,
2026-03-03T03:29:38.679744+00:00,BUCKET,llm_style,eval,llm_style_eval_070,64,8192,1024,bf16,NVIDIA GeForce RTX 4060,c06,64,128,32,4,3,8,0.0,0.0,235.52000522613525,347.2816011309623,4.559025985792771,1,-1,-1,llm8_g1,0,
2026-03-03T03:29:38.757759+00:00,BUCKET,llm_style,eval,llm_style_eval_071,64,6144,2048,bf16,NVIDIA GeForce RTX 4060,c06,64,128,32,4,3,8,0.0,0.0,300.4480004310608,363.5283234715462,5.36070379463072,1,-1,-1,llm8_g1,0,
2026-03-03T03:29:38.770345+00:00,BUCKET,llm_style,eval,llm_style_eval_072,64,1536,1024,bf16,NVIDIA GeForce RTX 4060,c04,64,64,64,4,3,8,0.0,0.0,70.64000144600868,133.655359596014,2.850036634751165,3,-1,-1,llm8_g3,0,
2026-03-03T03:29:38.800647+00:00,BUCKET,llm_style,eval,llm_style_eval_073,1,4096,1536,bf16,NVIDIA GeForce RTX 4060,c11,32,128,32,4,2,8,0.0,0.0,132.09599256515503,237.71135851740834,0.09525581931483353,5,-1,-1,llm8_g5,0,
2026-03-03T03:29:38.818319+00:00,BUCKET,llm_style,eval,llm_style_eval_074,8,1024,2048,bf16,NVIDIA GeForce RTX 4060,c11,32,128,32,4,2,8,0.0,0.0,145.31199634075165,207.46464282274243,0.23091302056931354,7,-1,-1,llm8_g7,0,
2026-03-03T03:29:38.845400+00:00,BUCKET,llm_style,eval,llm_style_eval_075,2,6144,1024,bf16,NVIDIA GeForce RTX 4060,c11,32,128,32,4,2,8,0.0,0.0,121.34400010108948,145.57184457778925,0.2073924048905163,5,-1,-1,llm8_g5,0,
2026-03-03T03:29:38.883589+00:00,BUCKET,llm_style,eval,llm_style_eval_076,64,1024,6144,bf16,NVIDIA GeForce RTX 4060,c04,64,64,64,4,3,8,0.0,0.0,260.0959986448288,278.54464441537857,3.0961889925099433,2,-1,-1,llm8_g2,0,
2026-03-03T03:29:39.064383+00:00,BUCKET,llm_style,eval,llm_style_eval_077,1,4096,8192,bf16,NVIDIA GeForce RTX 4060,c02,32,64,32,2,2,8,0.0,0.0,569.3439841270447,711.0492932796477,0.11787050688327846,4,-1,-1,llm8_g4,0,
2026-03-03T03:29:39.180389+00:00,BUCKET,llm_style,eval,llm_style_eval_078,64,6144,3072,bf16,NVIDIA GeForce RTX 4060,c06,64,128,32,4,3,8,0.0,0.0,432.5600117444992,519.8336002230642,5.585165152591622,1,-1,-1,llm8_g1,0,
2026-03-03T03:29:39.255848+00:00,BUCKET,llm_style,eval,llm_style_eval_079,2,3072,4096,bf16,NVIDIA GeForce RTX 4060,c11,32,128,32,4,2,8,0.0,0.0,271.7280089855194,383.25120478868484,0.18522804545585955,7,-1,-1,llm8_g7,0,
2026-03-03T03:29:39.272415+00:00,BUCKET,llm_style,eval,llm_style_eval_080,4,1536,1024,bf16,NVIDIA GeForce RTX 4060,c11,32,128,32,4,2,8,0.0,0.0,92.0800007879734,124.8972774296998,0.1366519536524967,7,-1,-1,llm8_g7,0,
2026-03-03T03:29:39.408912+00:00,BUCKET,llm_style,eval,llm_style_eval_081,4,4096,6144,bf16,NVIDIA GeForce RTX 4060,c02,32,64,32,2,2,8,0.0,0.0,440.3199851512909,658.2476931810373,0.4572279223956314,4,-1,-1,llm8_g4,0,
2026-03-03T03:29:39.441191+00:00,BUCKET,llm_style,eval,llm_style_eval_082,64,6144,1024,bf16,NVIDIA GeForce RTX 4060,c06,64,128,32,4,3,8,0.0,0.0,166.27199947834015,228.40320646762837,4.843307174548684,1,-1,-1,llm8_g1,0,
2026-03-03T03:29:39.539378+00:00,BUCKET,llm_style,eval,llm_style_eval_083,8,4096,4096,bf16,NVIDIA GeForce RTX 4060,c11,32,128,32,4,2,8,0.0,0.0,315.39198756217957,440.05663901567453,0.8511169166815878,5,-1,-1,llm8_g5,0,
2026-03-03T03:29:39.604354+00:00,BUCKET,llm_style,eval,llm_style_eval_084,64,1024,8192,bf16,NVIDIA GeForce RTX 4060,c04,64,64,64,4,3,8,0.0,0.0,370.1760023832321,531.4316582679749,2.9006251542162027,2,-1,-1,llm8_g2,0,
2026-03-03T03:29:39.759081+00:00,BUCKET,llm_style,eval,llm_style_eval_085,1,3072,8192,bf16,NVIDIA GeForce RTX 4060,c04,64,64,64,4,3,8,0.0,0.0,718.1279957294464,805.5727887153625,0.07008729404689908,6,-1,-1,llm8_g6,0,
2026-03-03T03:29:39.779918+00:00,BUCKET,llm_style,eval,llm_style_eval_086,8,1536,1024,bf16,NVIDIA GeForce RTX 4060,c11,32,128,32,4,2,8,0.0,0.0,103.79199683666229,186.13247960805887,0.2424640123226795,7,-1,-1,llm8_g7,0,
2026-03-03T03:29:39.809822+00:00,BUCKET,llm_style,eval,llm_style_eval_087,16,1024,3072,bf16,NVIDIA GeForce RTX 4060,c11,32,128,32,4,2,8,0.0,0.0,240.63999950885773,255.49824833869934,0.4183148944707951,7,-1,-1,llm8_g7,0,
2026-03-03T03:29:39.843262+00:00,BUCKET,llm_style,eval,llm_style_eval_088,8,4096,1536,bf16,NVIDIA GeForce RTX 4060,c11,32,128,32,4,2,8,0.0,0.0,151.48800611495972,242.56512731313688,0.6644968046091361,5,-1,-1,llm8_g5,0,
2026-03-03T03:29:39.945175+00:00,BUCKET,llm_style,eval,llm_style_eval_089,16,6144,3072,bf16,NVIDIA GeForce RTX 4060,c11,32,128,32,4,2,8,0.0,0.0,295.9359884262085,357.89823800325394,2.0409135746279876,5,-1,-1,llm8_g5,0,
2026-03-03T03:29:39.977216+00:00,BUCKET,llm_style,eval,llm_style_eval_090,32,1536,3072,bf16,NVIDIA GeForce RTX 4060,c11,32,128,32,4,2,8,0.0,0.0,241.55200272798538,255.05792438983917,1.250206516979594,7,-1,-1,llm8_g7,0,
2026-03-03T03:29:40.013247+00:00,BUCKET,llm_style,eval,llm_style_eval_091,16,1024,4096,bf16,NVIDIA GeForce RTX 4060,c11,32,128,32,4,2,8,0.0,0.0,302.0800054073334,423.2287937402724,0.44431185645344834,7,-1,-1,llm8_g7,0,
2026-03-03T03:29:40.159054+00:00,BUCKET,llm_style,eval,llm_style_eval_092,1,4096,6144,bf16,NVIDIA GeForce RTX 4060,c02,32,64,32,2,2,8,0.0,0.0,534.0160131454468,686.4691287279128,0.0942511961458569,4,-1,-1,llm8_g4,0,
2026-03-03T03:29:40.201722+00:00,BUCKET,llm_style,eval,llm_style_eval_093,32,2048,3072,bf16,NVIDIA GeForce RTX 4060,c11,32,128,32,4,2,8,0.0,0.0,240.62400311231613,389.6934375166892,1.6733708141828787,7,-1,-1,llm8_g7,0,
2026-03-03T03:29:40.222881+00:00,BUCKET,llm_style,eval,llm_style_eval_094,32,1024,2048,bf16,NVIDIA GeForce RTX 4060,c11,32,128,32,4,2,8,0.0,0.0,179.71199750900269,240.39071425795538,0.7468490132011156,7,-1,-1,llm8_g7,0,
2026-03-03T03:29:40.294557+00:00,BUCKET,llm_style,eval,llm_style_eval_095,8,6144,2048,bf16,NVIDIA GeForce RTX 4060,c11,32,128,32,4,2,8,0.0,0.0,209.27999913692474,436.9756817817687,0.9619963342425231,5,-1,-1,llm8_g5,0,
2026-03-03T03:29:40.337973+00:00,BUCKET,llm_style,eval,llm_style_eval_096,64,2048,3072,bf16,NVIDIA GeForce RTX 4060,c04,64,64,64,4,3,8,0.0,0.0,287.2319966554642,416.26625061035156,2.80367917703113,3,-1,-1,llm8_g3,0,
2026-03-03T03:29:40.373458+00:00,BUCKET,llm_style,eval,llm_style_eval_097,64,6144,1024,bf16,NVIDIA GeForce RTX 4060,c06,64,128,32,4,3,8,0.0,0.0,204.68799769878387,223.73855367302895,3.934311620875192,1,-1,-1,llm8_g1,0,
2026-03-03T03:29:40.403452+00:00,BUCKET,llm_style,eval,llm_style_eval_098,32,6144,1024,bf16,NVIDIA GeForce RTX 4060,c11,32,128,32,4,2,8,0.0,0.0,126.8640011548996,194.06047761440274,3.1738963010347176,5,-1,-1,llm8_g5,0,
2026-03-03T03:29:40.434903+00:00,BUCKET,llm_style,eval,llm_style_eval_099,1,2048,2048,bf16,NVIDIA GeForce RTX 4060,c11,32,128,32,4,2,8,0.0,0.0,178.5920038819313,276.7142364382743,0.04697079274358655,7,-1,-1,llm8_g7,0,
2026-03-03T03:29:40.484237+00:00,BUCKET,llm_style,eval,llm_style_eval_100,64,8192,1024,bf16,NVIDIA GeForce RTX 4060,c06,64,128,32,4,3,8,0.0,0.0,301.90399289131165,453.02432656288136,3.556567151420741,1,-1,-1,llm8_g1,0,
2026-03-03T03:29:40.571917+00:00,BUCKET,llm_style,eval,llm_style_eval_101,64,8192,1536,bf16,NVIDIA GeForce RTX 4060,c06,64,128,32,4,3,8,0.0,0.0,432.97600746154785,663.1321638822553,3.7198660162319435,1,-1,-1,llm8_g1,0,
2026-03-03T03:29:40.609356+00:00,BUCKET,llm_style,eval,llm_style_eval_102,32,3072,2048,bf16,NVIDIA GeForce RTX 4060,c11,32,128,32,4,2,8,0.0,0.0,183.29600244760513,200.7244808971882,2.1967374008339204,7,-1,-1,llm8_g7,0,
2026-03-03T03:29:40.650460+00:00,BUCKET,llm_style,eval,llm_style_eval_103,64,2048,3072,bf16,NVIDIA GeForce RTX 4060,c04,64,64,64,4,3,8,0.0,0.0,309.2319965362549,395.9379303455352,2.604214237272774,3,-1,-1,llm8_g3,0,
2026-03-03T03:29:40.722946+00:00,BUCKET,llm_style,eval,llm_style_eval_104,16,6144,2048,bf16,NVIDIA GeForce RTX 4060,c11,32,128,32,4,2,8,0.0,0.0,210.83199977874756,317.54240334033966,1.9098295534954584,5,-1,-1,llm8_g5,0,
2026-03-03T03:29:40.781375+00:00,BUCKET,llm_style,eval,llm_style_eval_105,1,1024,8192,bf16,NVIDIA GeForce RTX 4060,c04,64,64,64,4,3,8,0.0,0.0,445.3440010547638,567.8182417154312,0.03767248679731718,6,-1,-1,llm8_g6,0,
2026-03-03T03:29:40.977623+00:00,BUCKET,llm_style,eval,llm_style_eval_106,32,4096,8192,bf16,NVIDIA GeForce RTX 4060,c02,32,64,32,2,2,8,0.0,0.0,763.7920081615448,882.6348727941513,2.8116079051010434,4,-1,-1,llm8_g4,0,
2026-03-03T03:29:41.046396+00:00,BUCKET,llm_style,eval,llm_style_eval_107,64,6144,1536,bf16,NVIDIA GeForce RTX 4060,c06,64,128,32,4,3,8,0.0,0.0,310.65601110458374,440.22880256175995,3.8884151885711784,1,-1,-1,llm8_g1,0,
2026-03-03T03:29:41.076267+00:00,BUCKET,llm_style,eval,llm_style_eval_108,8,3072,1536,bf16,NVIDIA GeForce RTX 4060,c11,32,128,32,4,2,8,0.0,0.0,155.64799308776855,222.45376065373415,0.48505265311983575,7,-1,-1,llm8_g7,0,
2026-03-03T03:29:41.092400+00:00,BUCKET,llm_style,eval,llm_style_eval_109,16,2048,1024,bf16,NVIDIA GeForce RTX 4060,c11,32,128,32,4,2,8,0.0,0.0,114.04800042510033,209.47968006134033,0.5884264848998643,7,-1,-1,llm8_g7,0,
2026-03-03T03:29:41.486012+00:00,BUCKET,llm_style,eval,llm_style_eval_110,1,8192,8192,bf16,NVIDIA GeForce RTX 4060,c02,32,64,32,2,2,8,0.0,0.0,1543.1679487228394,1651.5094542503357,0.08697545079981839,4,-1,-1,llm8_g4,0,
2026-03-03T03:29:41.544646+00:00,BUCKET,llm_style,eval,llm_style_eval_111,8,6144,1536,bf16,NVIDIA GeForce RTX 4060,c11,32,128,32,4,2,8,0.0,0.0,196.60800695419312,308.28543990850426,0.7679999728351841,5,-1,-1,llm8_g5,0,
2026-03-03T03:29:41.645165+00:00,BUCKET,llm_style,eval,llm_style_eval_112,2,6144,3072,bf16,NVIDIA GeForce RTX 4060,c11,32,128,32,4,2,8,0.0,0.0,287.7439856529236,425.2876821160316,0.26237723728156376,5,-1,-1,llm8_g5,0,
2026-03-03T03:29:42.009135+00:00,BUCKET,llm_style,eval,llm_style_eval_113,1,8192,8192,bf16,NVIDIA GeForce RTX 4060,c02,32,64,32,2,2,8,0.0,0.0,1076.640009880066,1204.305911064148,0.12466351498023133,4,-1,-1,llm8_g4,0,
2026-03-03T03:29:42.035507+00:00,BUCKET,llm_style,eval,llm_style_eval_114,1,3072,1024,bf16,NVIDIA GeForce RTX 4060,c11,32,128,32,4,2,8,0.0,0.0,108.5439994931221,206.36671915650368,0.05796226442161511,7,-1,-1,llm8_g7,0,
2026-03-03T03:29:42.061665+00:00,BUCKET,llm_style,eval,llm_style_eval_115,16,3072,1536,bf16,NVIDIA GeForce RTX 4060,c11,32,128,32,4,2,8,0.0,0.0,132.9760029911995,189.19232040643686,1.1355052084848198,7,-1,-1,llm8_g7,0,
2026-03-03T03:29:42.080974+00:00,BUCKET,llm_style,eval,llm_style_eval_116,8,3072,1024,bf16,NVIDIA GeForce RTX 4060,c11,32,128,32,4,2,8,0.0,0.0,107.2319969534874,318.2374426722525,0.46937154422137356,7,-1,-1,llm8_g7,0,
2026-03-03T03:29:42.116449+00:00,BUCKET,llm_style,eval,llm_style_eval_117,4,1024,4096,bf16,NVIDIA GeForce RTX 4060,c11,32,128,32,4,2,8,0.0,0.0,310.2720081806183,405.43231934308994,0.10814521167010012,7,-1,-1,llm8_g7,0,
2026-03-03T03:29:42.233481+00:00,BUCKET,llm_style,eval,llm_style_eval_118,64,6144,3072,bf16,NVIDIA GeForce RTX 4060,c06,64,128,32,4,3,8,0.0,0.0,500.7359981536865,620.4111957550047,4.824736214108783,1,-1,-1,llm8_g1,0,
2026-03-03T03:29:42.551980+00:00,BUCKET,llm_style,eval,llm_style_eval_119,64,8192,6144,bf16,NVIDIA GeForce RTX 4060,c03,64,64,32,4,2,8,0.0,0.0,1426.4320135116577,1519.3254840373993,4.516479497778285,0,-1,-1,llm8_g0,0,
2026-03-03T03:29:42.591731+00:00,BUCKET,llm_style,eval,llm_style_eval_120,8,1024,4096,bf16,NVIDIA GeForce RTX 4060,c11,32,128,32,4,2,8,0.0,0.0,304.1279911994934,419.3772870302199,0.22065993904513642,7,-1,-1,llm8_g7,0,
2026-03-03T03:29:42.608802+00:00,BUCKET,llm_style,eval,llm_style_eval_121,4,1024,2048,bf16,NVIDIA GeForce RTX 4060,c11,32,128,32,4,2,8,0.0,0.0,124.92799758911133,229.62176322937006,0.1342950845588699,7,-1,-1,llm8_g7,0,
2026-03-03T03:29:42.744558+00:00,BUCKET,llm_style,eval,llm_style_eval_122,4,6144,4096,bf16,NVIDIA GeForce RTX 4060,c11,32,128,32,4,2,8,0.0,0.0,365.26399850845337,457.676786780357,0.5511810439082752,5,-1,-1,llm8_g5,0,
2026-03-03T03:29:42.890659+00:00,BUCKET,llm_style,eval,llm_style_eval_123,4,3072,8192,bf16,NVIDIA GeForce RTX 4060,c04,64,64,64,4,3,8,0.0,0.0,502.25600600242615,604.2214208841324,0.40084456849487127,6,-1,-1,llm8_g6,0,
2026-03-03T03:29:42.925261+00:00,BUCKET,llm_style,eval,llm_style_eval_124,64,6144,1024,bf16,NVIDIA GeForce RTX 4060,c06,64,128,32,4,3,8,0.0,0.0,136.7039978504181,162.23584219813347,5.890876497124602,1,-1,-1,llm8_g1,0,
2026-03-03T03:29:43.004938+00:00,BUCKET,llm_style,eval,llm_style_eval_125,64,1536,8192,bf16,NVIDIA GeForce RTX 4060,c04,64,64,64,4,3,8,0.0,0.0,295.9359884262085,463.41120362281777,5.442436199007968,2,-1,-1,llm8_g2,0,
2026-03-03T03:29:43.114704+00:00,BUCKET,llm_style,eval,llm_style_eval_126,64,2048,8192,bf16,NVIDIA GeForce RTX 4060,c04,64,64,64,4,3,8,0.0,0.0,497.6640045642853,612.034569978714,4.315127532440616,2,-1,-1,llm8_g2,0,
2026-03-03T03:29:43.180750+00:00,BUCKET,llm_style,eval,llm_style_eval_127,2,8192,1536,bf16,NVIDIA GeForce RTX 4060,c11,32,128,32,4,2,8,0.0,0.0,181.67999386787415,200.20223692059517,0.2770346196543987,5,-1,-1,llm8_g5,0,
2026-03-03T03:29:43.203531+00:00,BUCKET,llm_style,eval,llm_style_eval_128,8,2048,2048,bf16,NVIDIA GeForce RTX 4060,c11,32,128,32,4,2,8,0.0,0.0,134.14399325847626,255.5372841656207,0.5002748343020536,7,-1,-1,llm8_g7,0,
2026-03-03T03:29:43.500817+00:00,BUCKET,llm_style,eval,llm_style_eval_129,64,8192,6144,bf16,NVIDIA GeForce RTX 4060,c03,64,64,32,4,2,8,0.0,0.0,1058.7039589881897,1192.913258075714,6.0852241925656845,0,-1,-1,llm8_g0,0,
2026-03-03T03:29:43.527747+00:00,BUCKET,llm_style,eval,llm_style_eval_130,16,3072,1536,bf16,NVIDIA GeForce RTX 4060,c11,32,128,32,4,2,8,0.0,0.0,131.05600327253342,224.1920004785061,1.15214061339871,7,-1,-1,llm8_g7,0,
2026-03-03T03:29:43.874148+00:00,BUCKET,llm_style,eval,llm_style_eval_131,32,8192,8192,bf16,NVIDIA GeForce RTX 4060,c02,32,64,32,2,2,8,0.0,0.0,925.6000220775604,1069.2198145389557,4.640197918707595,4,-1,-1,llm8_g4,0,
2026-03-03T03:29:44.048512+00:00,BUCKET,llm_style,eval,llm_style_eval_132,32,8192,4096,bf16,NVIDIA GeForce RTX 4060,c11,32,128,32,4,2,8,0.0,0.0,483.3280146121979,598.4566479921341,4.443118509741362,5,-1,-1,llm8_g5,0,
2026-03-03T03:29:44.408218+00:00,BUCKET,llm_style,eval,llm_style_eval_133,2,8192,8192,bf16,NVIDIA GeForce RTX 4060,c02,32,64,32,2,2,8,0.0,0.0,917.5040125846863,949.7846478223801,0.29257142455845464,4,-1,-1,llm8_g4,0,
2026-03-03T03:29:44.461905+00:00,BUCKET,llm_style,eval,llm_style_eval_134,64,3072,3072,bf16,NVIDIA GeForce RTX 4060,c04,64,64,64,4,3,8,0.0,0.0,252.28799879550934,418.0092906951904,4.788018287699468,3,-1,-1,llm8_g3,0,
2026-03-03T03:29:44.521797+00:00,BUCKET,llm_style,eval,llm_style_eval_135,8,3072,3072,bf16,NVIDIA GeForce RTX 4060,c11,32,128,32,4,2,8,0.0,0.0,228.2239943742752,374.3683198094368,0.661608541266596,7,-1,-1,llm8_g7,0,
2026-03-03T03:29:44.584886+00:00,BUCKET,llm_style,eval,llm_style_eval_136,4,2048,4096,bf16,NVIDIA GeForce RTX 4060,c11,32,128,32,4,2,8,0.0,0.0,276.99199318885803,336.3779145479202,0.2422772702828417,7,-1,-1,llm8_g7,0,
2026-03-03T03:29:44.933287+00:00,BUCKET,llm_style,eval,llm_style_eval_137,4,8192,8192,bf16,NVIDIA GeForce RTX 4060,c02,32,64,32,2,2,8,0.0,0.0,1013.1999850273132,1098.9056181907654,0.5298765494805326,4,-1,-1,llm8_g4,0,
2026-03-03T03:29:44.952847+00:00,BUCKET,llm_style,eval,llm_style_eval_138,16,1024,1024,bf16,NVIDIA GeForce RTX 4060,c11,32,128,32,4,2,8,0.0,0.0,128.51200252771378,300.7471962273118,0.2610995964580347,7,-1,-1,llm8_g7,0,
2026-03-03T03:29:44.967486+00:00,BUCKET,llm_style,eval,llm_style_eval_139,4,1024,1024,bf16,NVIDIA GeForce RTX 4060,c11,32,128,32,4,2,8,0.0,0.0,124.92799758911133,195.74783921241755,0.06714754227943495,7,-1,-1,llm8_g7,0,
2026-03-03T03:29:45.129822+00:00,BUCKET,llm_style,eval,llm_style_eval_140,64,4096,6144,bf16,NVIDIA GeForce RTX 4060,c03,64,64,32,4,2,8,0.0,0.0,825.7279992103577,944.8742347955704,3.901073325696177,0,-1,-1,llm8_g0,0,
2026-03-03T03:29:45.264399+00:00,BUCKET,llm_style,eval,llm_style_eval_141,4,6144,4096,bf16,NVIDIA GeForce RTX 4060,c11,32,128,32,4,2,8,0.0,0.0,364.3359988927841,438.6604824662206,0.5525849562267545,5,-1,-1,llm8_g5,0,
2026-03-03T03:29:45.352138+00:00,BUCKET,llm_style,eval,llm_style_eval_142,4,2048,6144,bf16,NVIDIA GeForce RTX 4060,c04,64,64,64,4,3,8,0.0,0.0,493.5680031776428,520.1472115516663,0.2039502061558267,6,-1,-1,llm8_g6,0,
2026-03-03T03:29:45.432929+00:00,BUCKET,llm_style,eval,llm_style_eval_143,64,1536,8192,bf16,NVIDIA GeForce RTX 4060,c04,64,64,64,4,3,8,0.0,0.0,377.85598635673523,459.5241513848304,4.262504218947095,2,-1,-1,llm8_g2,0,
2026-03-03T03:29:45.489454+00:00,BUCKET,llm_style,eval,llm_style_eval_144,1,3072,3072,bf16,NVIDIA GeForce RTX 4060,c11,32,128,32,4,2,8,0.0,0.0,217.51999855041504,272.2201626002787,0.08677072510933036,7,-1,-1,llm8_g7,0,
2026-03-03T03:29:45.508459+00:00,BUCKET,llm_style,eval,llm_style_eval_145,32,1024,2048,bf16,NVIDIA GeForce RTX 4060,c11,32,128,32,4,2,8,0.0,0.0,165.82400351762772,231.4240038394928,0.8093986705955519,7,-1,-1,llm8_g7,0,
2026-03-03T03:29:45.714515+00:00,BUCKET,llm_style,eval,llm_style_eval_146,64,8192,4096,bf16,NVIDIA GeForce RTX 4060,c06,64,128,32,4,3,8,0.0,0.0,871.4240193367004,910.784637928009,4.928676741397591,1,-1,-1,llm8_g1,0,
2026-03-03T03:29:45.783187+00:00,BUCKET,llm_style,eval,llm_style_eval_147,64,2048,4096,bf16,NVIDIA GeForce RTX 4060,c04,64,64,64,4,3,8,0.0,0.0,344.57600116729736,381.9401654601097,3.1161248037081974,3,-1,-1,llm8_g3,0,
2026-03-03T03:29:45.825658+00:00,BUCKET,llm_style,eval,llm_style_eval_148,64,1024,6144,bf16,NVIDIA GeForce RTX 4060,c04,64,64,64,4,3,8,0.0,0.0,281.5999984741211,318.9862397313118,2.8597527427685954,2,-1,-1,llm8_g2,0,
2026-03-03T03:29:46.039473+00:00,BUCKET,llm_style,eval,llm_style_eval_149,64,4096,8192,bf16,NVIDIA GeForce RTX 4060,c03,64,64,32,4,2,8,0.0,0.0,1048.5759973526,1106.0121130943298,4.096000010341406,0,-1,-1,llm8_g0,0,
2026-03-03T03:29:46.082458+00:00,BUCKET,llm_style,eval,llm_style_eval_150,2,2048,3072,bf16,NVIDIA GeForce RTX 4060,c11,32,128,32,4,2,8,0.0,0.0,225.2800017595291,357.2940814495085,0.11170909003659714,7,-1,-1,llm8_g7,0,
2026-03-03T03:29:46.138088+00:00,BUCKET,llm_style,eval,llm_style_eval_151,64,4096,2048,bf16,NVIDIA GeForce RTX 4060,c06,64,128,32,4,3,8,0.0,0.0,339.9679958820343,457.6179245114324,3.158361484039746,1,-1,-1,llm8_g1,0,
2026-03-03T03:29:46.497502+00:00,BUCKET,llm_style,eval,llm_style_eval_152,8,8192,8192,bf16,NVIDIA GeForce RTX 4060,c02,32,64,32,2,2,8,0.0,0.0,939.520001411438,1084.5475542545319,1.1428621236236811,4,-1,-1,llm8_g4,0,
2026-03-03T03:29:46.610153+00:00,BUCKET,llm_style,eval,llm_style_eval_153,64,8192,2048,bf16,NVIDIA GeForce RTX 4060,c06,64,128,32,4,3,8,0.0,0.0,458.75200629234314,598.6851280927658,4.681142792935274,1,-1,-1,llm8_g1,0,
2026-03-03T03:29:46.719422+00:00,BUCKET,llm_style,eval,llm_style_eval_154,16,2048,8192,bf16,NVIDIA GeForce RTX 4060,c04,64,64,64,4,3,8,0.0,0.0,535.5520248413086,660.6233823299408,1.0024626686064386,6,-1,-1,llm8_g6,0,
2026-03-03T03:29:46.743150+00:00,BUCKET,llm_style,eval,llm_style_eval_155,4,2048,1536,bf16,NVIDIA GeForce RTX 4060,c11,32,128,32,4,2,8,0.0,0.0,108.5439994931221,165.9084840118885,0.23184905768646044,7,-1,-1,llm8_g7,0,
2026-03-03T03:29:46.877641+00:00,BUCKET,llm_style,eval,llm_style_eval_156,1,4096,6144,bf16,NVIDIA GeForce RTX 4060,c02,32,64,32,2,2,8,0.0,0.0,402.43199467658997,524.3699181079865,0.12506870394449743,4,-1,-1,llm8_g4,0,
2026-03-03T03:29:46.956671+00:00,BUCKET,llm_style,eval,llm_style_eval_157,1,1536,8192,bf16,NVIDIA GeForce RTX 4060,c04,64,64,64,4,3,8,0.0,0.0,315.2639865875244,440.07230848073954,0.07982460753731982,6,-1,-1,llm8_g6,0,
2026-03-03T03:29:47.032863+00:00,BUCKET,llm_style,eval,llm_style_eval_158,64,1536,8192,bf16,NVIDIA GeForce RTX 4060,c04,64,64,64,4,3,8,0.0,0.0,314.36800956726074,325.6524860858917,5.123335348965909,2,-1,-1,llm8_g2,0,
2026-03-03T03:29:47.083053+00:00,BUCKET,llm_style,eval,llm_style_eval_159,16,6144,1536,bf16,NVIDIA GeForce RTX 4060,c11,32,128,32,4,2,8,0.0,0.0,121.85599654912949,177.01728284358958,2.4782521710225787,5,-1,-1,llm8_g5,0,
2026-03-03T03:29:47.290724+00:00,BUCKET,llm_style,eval,llm_style_eval_160,32,6144,6144,bf16,NVIDIA GeForce RTX 4060,c02,32,64,32,2,2,8,0.0,0.0,541.6960120201111,566.3129502534866,4.45991672523206,4,-1,-1,llm8_g4,0,
2026-03-03T03:29:47.330000+00:00,BUCKET,llm_style,eval,llm_style_eval_161,2,1536,4096,bf16,NVIDIA GeForce RTX 4060,c11,32,128,32,4,2,8,0.0,0.0,242.65599995851517,263.8528105616569,0.10370987737497686,7,-1,-1,llm8_g7,0,
2026-03-03T03:29:47.356046+00:00,BUCKET,llm_style,eval,llm_style_eval_162,64,1536,3072,bf16,NVIDIA GeForce RTX 4060,c04,64,64,64,4,3,8,0.0,0.0,145.26399970054626,203.29504117369652,4.157807696642465,3,-1,-1,llm8_g3,0,
2026-03-03T03:29:47.409094+00:00,BUCKET,llm_style,eval,llm_style_eval_163,64,1024,8192,bf16,NVIDIA GeForce RTX 4060,c04,64,64,64,4,3,8,0.0,0.0,312.3199939727783,475.46785145997984,3.4379541647070693,2,-1,-1,llm8_g2,0,
2026-03-03T03:29:47.610119+00:00,BUCKET,llm_style,eval,llm_style_eval_164,64,4096,8192,bf16,NVIDIA GeForce RTX 4060,c03,64,64,32,4,2,8,0.0,0.0,868.3519959449768,1018.8108587265015,4.946113230644489,0,-1,-1,llm8_g0,0,
2026-03-03T03:29:47.746568+00:00,BUCKET,llm_style,eval,llm_style_eval_165,4,8192,3072,bf16,NVIDIA GeForce RTX 4060,c11,32,128,32,4,2,8,0.0,0.0,366.4959967136383,381.5321585536003,0.5493282158749105,5,-1,-1,llm8_g5,0,
2026-03-03T03:29:47.792335+00:00,BUCKET,llm_style,eval,llm_style_eval_166,64,1024,6144,bf16,NVIDIA GeForce RTX 4060,c04,64,64,64,4,3,8,0.0,0.0,246.2719976902008,338.6560082435608,3.2699875566569268,2,-1,-1,llm8_g2,0,
2026-03-03T03:29:47.808829+00:00,BUCKET,llm_style,eval,llm_style_eval_167,2,2048,1024,bf16,NVIDIA GeForce RTX 4060,c11,32,128,32,4,2,8,0.0,0.0,107.51999914646149,240.36351867020085,0.0780190482383953,7,-1,-1,llm8_g7,0,
2026-03-03T03:29:47.832250+00:00,BUCKET,llm_style,eval,llm_style_eval_168,64,4096,1024,bf16,NVIDIA GeForce RTX 4060,c06,64,128,32,4,3,8,0.0,0.0,147.45600521564484,175.00992640852928,3.6408887601075395,1,-1,-1,llm8_g1,0,
2026-03-03T03:29:47.885176+00:00,BUCKET,llm_style,eval,llm_style_eval_169,4,1536,6144,bf16,NVIDIA GeForce RTX 4060,c04,64,64,64,4,3,8,0.0,0.0,245.7599937915802,435.56672900915123,0.307200007760525,6,-1,-1,llm8_g6,0,
2026-03-03T03:29:47.907393+00:00,BUCKET,llm_style,eval,llm_style_eval_170,16,1536,1536,bf16,NVIDIA GeForce RTX 4060,c11,32,128,32,4,2,8,0.0,0.0,110.04799976944923,169.4515176117419,0.6860412925102441,7,-1,-1,llm8_g7,0,
2026-03-03T03:29:47.946053+00:00,BUCKET,llm_style,eval,llm_style_eval_171,1,2048,3072,bf16,NVIDIA GeForce RTX 4060,c11,32,128,32,4,2,8,0.0,0.0,182.27200210094452,206.3468778133392,0.0690337070694567,7,-1,-1,llm8_g7,0,
2026-03-03T03:29:47.979411+00:00,BUCKET,llm_style,eval,llm_style_eval_172,64,3072,2048,bf16,NVIDIA GeForce RTX 4060,c04,64,64,64,4,3,8,0.0,0.0,161.67999804019928,231.36607944965363,4.980865770419992,3,-1,-1,llm8_g3,0,
2026-03-03T03:29:48.274884+00:00,BUCKET,llm_style,eval,llm_style_eval_173,64,8192,6144,bf16,NVIDIA GeForce RTX 4060,c03,64,64,32,4,2,8,0.0,0.0,1139.7119760513306,1251.993587017059,5.652700927405052,0,-1,-1,llm8_g0,0,
2026-03-03T03:29:48.365967+00:00,BUCKET,llm_style,eval,llm_style_eval_174,2,4096,4096,bf16,NVIDIA GeForce RTX 4060,c11,32,128,32,4,2,8,0.0,0.0,287.7439856529236,369.039361476898,0.23322421091694556,5,-1,-1,llm8_g5,0,
2026-03-03T03:29:48.418814+00:00,BUCKET,llm_style,eval,llm_style_eval_175,64,4096,2048,bf16,NVIDIA GeForce RTX 4060,c06,64,128,32,4,3,8,0.0,0.0,270.84800601005554,284.19072300195694,3.9643704224284972,1,-1,-1,llm8_g1,0,
2026-03-03T03:29:48.488943+00:00,BUCKET,llm_style,eval,llm_style_eval_176,16,6144,2048,bf16,NVIDIA GeForce RTX 4060,c11,32,128,32,4,2,8,0.0,0.0,173.39200526475906,265.441272854805,2.3222130881131053,5,-1,-1,llm8_g5,0,
2026-03-03T03:29:48.539065+00:00,BUCKET,llm_style,eval,llm_style_eval_177,1,6144,1536,bf16,NVIDIA GeForce RTX 4060,c11,32,128,32,4,2,8,0.0,0.0,118.78400295972824,132.74112388491628,0.15889654776492962,5,-1,-1,llm8_g5,0,
2026-03-03T03:29:48.804856+00:00,BUCKET,llm_style,eval,llm_style_eval_178,32,6144,8192,bf16,NVIDIA GeForce RTX 4060,c02,32,64,32,2,2,8,0.0,0.0,714.1120135784149,751.5676844120026,4.510812604675898,4,-1,-1,llm8_g4,0,
2026-03-03T03:29:48.959263+00:00,BUCKET,llm_style,eval,llm_style_eval_179,64,4096,6144,bf16,NVIDIA GeForce RTX 4060,c03,64,64,32,4,2,8,0.0,0.0,668.0000126361847,693.7907272577286,4.822193729140523,0,-1,-1,llm8_g0,0,
2026-03-03T03:29:48.982107+00:00,BUCKET,llm_style,eval,llm_style_eval_180,64,2048,1536,bf16,NVIDIA GeForce RTX 4060,c04,64,64,64,4,3,8,0.0,0.0,149.50400590896606,269.0112048387527,2.693260167524729,3,-1,-1,llm8_g3,0,
2026-03-03T03:29:49.017999+00:00,BUCKET,llm_style,eval,llm_style_eval_181,64,2048,3072,bf16,NVIDIA GeForce RTX 4060,c04,64,64,64,4,3,8,0.0,0.0,221.5680032968521,280.5699288845062,3.6345788020712884,3,-1,-1,llm8_g3,0,
2026-03-03T03:29:49.044026+00:00,BUCKET,llm_style,eval,llm_style_eval_182,32,3072,1536,bf16,NVIDIA GeForce RTX 4060,c11,32,128,32,4,2,8,0.0,0.0,114.68800157308578,216.4019221067427,2.6331428210260923,7,-1,-1,llm8_g7,0,
2026-03-03T03:29:49.133675+00:00,BUCKET,llm_style,eval,llm_style_eval_183,8,8192,2048,bf16,NVIDIA GeForce RTX 4060,c11,32,128,32,4,2,8,0.0,0.0,255.93601167201996,396.7283159494396,1.0488381617198832,5,-1,-1,llm8_g5,0,
2026-03-03T03:29:49.180888+00:00,BUCKET,llm_style,eval,llm_style_eval_184,64,8192,1024,bf16,NVIDIA GeForce RTX 4060,c06,64,128,32,4,3,8,0.0,0.0,207.87200331687927,284.602554887533,5.165398932357389,1,-1,-1,llm8_g1,0,
2026-03-03T03:29:49.247719+00:00,BUCKET,llm_style,eval,llm_style_eval_185,1,8192,1536,bf16,NVIDIA GeForce RTX 4060,c11,32,128,32,4,2,8,0.0,0.0,190.46400487422943,249.2927983403204,0.1321290288767053,5,-1,-1,llm8_g5,0,
2026-03-03T03:29:49.274873+00:00,BUCKET,llm_style,eval,llm_style_eval_186,16,6144,1024,bf16,NVIDIA GeForce RTX 4060,c11,32,128,32,4,2,8,0.0,0.0,87.02399954199791,156.40576049685464,2.313460574779024,5,-1,-1,llm8_g5,0,
2026-03-03T03:29:49.311175+00:00,BUCKET,llm_style,eval,llm_style_eval_187,1,1024,6144,bf16,NVIDIA GeForce RTX 4060,c04,64,64,64,4,3,8,0.0,0.0,234.49599742889404,353.7100729346274,0.05365938923463076,6,-1,-1,llm8_g6,0,
2026-03-03T03:29:49.488193+00:00,BUCKET,llm_style,eval,llm_style_eval_188,8,8192,4096,bf16,NVIDIA GeForce RTX 4060,c11,32,128,32,4,2,8,0.0,0.0,501.76000595092773,661.400963068008,1.0699754975140567,5,-1,-1,llm8_g5,0,
2026-03-03T03:29:49.604383+00:00,BUCKET,llm_style,eval,llm_style_eval_189,8,2048,8192,bf16,NVIDIA GeForce RTX 4060,c04,64,64,64,4,3,8,0.0,0.0,546.7999875545502,621.8643367290497,0.4909207427025046,6,-1,-1,llm8_g6,0,
2026-03-03T03:29:49.697101+00:00,BUCKET,llm_style,eval,llm_style_eval_190,4,8192,2048,bf16,NVIDIA GeForce RTX 4060,c11,32,128,32,4,2,8,0.0,0.0,279.55201268196106,371.3660785555839,0.4801171943365543,5,-1,-1,llm8_g5,0,
2026-03-03T03:29:50.040979+00:00,BUCKET,llm_style,eval,llm_style_eval_191,4,8192,8192,bf16,NVIDIA GeForce RTX 4060,c02,32,64,32,2,2,8,0.0,0.0,934.8960220813751,980.5971121788025,0.5742573498224487,4,-1,-1,llm8_g4,0,
2026-03-03T03:29:50.054339+00:00,BUCKET,llm_style,eval,llm_style_eval_192,64,1536,1024,bf16,NVIDIA GeForce RTX 4060,c04,64,64,64,4,3,8,0.0,0.0,75.1040019094944,203.45248520374284,2.6806373413045645,3,-1,-1,llm8_g3,0,
2026-03-03T03:29:50.080043+00:00,BUCKET,llm_style,eval,llm_style_eval_193,32,2048,2048,bf16,NVIDIA GeForce RTX 4060,c11,32,128,32,4,2,8,0.0,0.0,131.42400234937668,212.37152054905883,2.0425146944345296,7,-1,-1,llm8_g7,0,
2026-03-03T03:29:50.097859+00:00,BUCKET,llm_style,eval,llm_style_eval_194,8,1024,2048,bf16,NVIDIA GeForce RTX 4060,c11,32,128,32,4,2,8,0.0,0.0,139.02399688959122,175.09376317262638,0.24135712359534553,7,-1,-1,llm8_g7,0,
2026-03-03T03:29:50.141222+00:00,BUCKET,llm_style,eval,llm_style_eval_195,2,4096,2048,bf16,NVIDIA GeForce RTX 4060,c11,32,128,32,4,2,8,0.0,0.0,151.5200063586235,239.86047878861422,0.2214521554373622,5,-1,-1,llm8_g5,0,
2026-03-03T03:29:50.203786+00:00,BUCKET,llm_style,eval,llm_style_eval_196,32,2048,4096,bf16,NVIDIA GeForce RTX 4060,c11,32,128,32,4,2,8,0.0,0.0,240.63999950885773,291.10271424055094,2.2310127705109073,7,-1,-1,llm8_g7,0,
2026-03-03T03:29:50.280318+00:00,BUCKET,llm_style,eval,llm_style_eval_197,32,8192,1536,bf16,NVIDIA GeForce RTX 4060,c11,32,128,32,4,2,8,0.0,0.0,227.76000201702118,330.15614807605743,3.535767302723404,5,-1,-1,llm8_g5,0,
2026-03-03T03:29:50.518428+00:00,BUCKET,llm_style,eval,llm_style_eval_198,64,4096,8192,bf16,NVIDIA GeForce RTX 4060,c03,64,64,32,4,2,8,0.0,0.0,1130.3839683532715,1269.8214530944824,3.799564940979172,0,-1,-1,llm8_g0,0,
2026-03-03T03:29:50.703044+00:00,BUCKET,llm_style,eval,llm_style_eval_199,2,8192,4096,bf16,NVIDIA GeForce RTX 4060,c11,32,128,32,4,2,8,0.0,0.0,558.5920214653015,724.736003279686,0.24027863421306903,5,-1,-1,llm8_g5,0,
2026-03-03T03:29:50.725418+00:00,BUCKET,llm_style,eval,llm_style_eval_200,1,4096,1024,bf16,NVIDIA GeForce RTX 4060,c11,32,128,32,4,2,8,0.0,0.0,108.5439994931221,197.15071588754654,0.07728301922882014,5,-1,-1,llm8_g5,0,
2026-03-03T03:29:50.815369+00:00,BUCKET,llm_style,eval,llm_style_eval_201,4,1536,8192,bf16,NVIDIA GeForce RTX 4060,c04,64,64,64,4,3,8,0.0,0.0,409.59998965263367,538.1632143259048,0.24576000620841995,6,-1,-1,llm8_g6,0,
2026-03-03T03:29:50.924195+00:00,BUCKET,llm_style,eval,llm_style_eval_202,1,6144,3072,bf16,NVIDIA GeForce RTX 4060,c11,32,128,32,4,2,8,0.0,0.0,319.44000720977783,398.70464831590647,0.11817159763338665,5,-1,-1,llm8_g5,0,
2026-03-03T03:29:51.016697+00:00,BUCKET,llm_style,eval,llm_style_eval_203,16,2048,6144,bf16,NVIDIA GeForce RTX 4060,c04,64,64,64,4,3,8,0.0,0.0,545.7919836044312,664.9587088823318,0.7377411103418245,6,-1,-1,llm8_g6,0,
2026-03-03T03:29:51.031248+00:00,BUCKET,llm_style,eval,llm_style_eval_204,16,1536,1024,bf16,NVIDIA GeForce RTX 4060,c11,32,128,32,4,2,8,0.0,0.0,101.28000006079674,174.30527925491327,0.49695544993865254,7,-1,-1,llm8_g7,0,
2026-03-03T03:29:51.111852+00:00,BUCKET,llm_style,eval,llm_style_eval_205,64,6144,2048,bf16,NVIDIA GeForce RTX 4060,c06,64,128,32,4,3,8,0.0,0.0,359.42399501800537,383.1625655293464,4.481094079206693,1,-1,-1,llm8_g1,0,
2026-03-03T03:29:51.202183+00:00,BUCKET,llm_style,eval,llm_style_eval_206,4,2048,6144,bf16,NVIDIA GeForce RTX 4060,c04,64,64,64,4,3,8,0.0,0.0,548.7360060214996,667.9190534353256,0.1834457642570952,6,-1,-1,llm8_g6,0,
2026-03-03T03:29:51.256383+00:00,BUCKET,llm_style,eval,llm_style_eval_207,32,6144,1536,bf16,NVIDIA GeForce RTX 4060,c11,32,128,32,4,2,8,0.0,0.0,152.97599881887436,207.38048300147045,3.9481995911994026,5,-1,-1,llm8_g5,0,
2026-03-03T03:29:51.272160+00:00,BUCKET,llm_style,eval,llm_style_eval_208,4,2048,1024,bf16,NVIDIA GeForce RTX 4060,c11,32,128,32,4,2,8,0.0,0.0,109.93599891662598,242.9584072530268,0.15260893761217945,7,-1,-1,llm8_g7,0,
2026-03-03T03:29:51.288443+00:00,BUCKET,llm_style,eval,llm_style_eval_209,1,1024,1536,bf16,NVIDIA GeForce RTX 4060,c11,32,128,32,4,2,8,0.0,0.0,138.63999396562576,247.44960546493527,0.02268990289180154,7,-1,-1,llm8_g7,0,
2026-03-03T03:29:51.426497+00:00,BUCKET,llm_style,eval,llm_style_eval_210,8,6144,4096,bf16,NVIDIA GeForce RTX 4060,c11,32,128,32,4,2,8,0.0,0.0,390.52799344062805,554.8214441537857,1.0310481982419408,5,-1,-1,llm8_g5,0,
2026-03-03T03:29:51.553208+00:00,BUCKET,llm_style,eval,llm_style_eval_211,4,2048,8192,bf16,NVIDIA GeForce RTX 4060,c04,64,64,64,4,3,8,0.0,0.0,791.3760244846344,926.2307196855543,0.16960044763474638,6,-1,-1,llm8_g6,0,
2026-03-03T03:29:51.571895+00:00,BUCKET,llm_style,eval,llm_style_eval_212,32,1024,1024,bf16,NVIDIA GeForce RTX 4060,c11,32,128,32,4,2,8,0.0,0.0,134.65599715709686,207.53407955169675,0.4983726340959565,7,-1,-1,llm8_g7,0,
2026-03-03T03:29:51.656886+00:00,BUCKET,llm_style,eval,llm_style_eval_213,16,3072,4096,bf16,NVIDIA GeForce RTX 4060,c11,32,128,32,4,2,8,0.0,0.0,350.72000324726105,412.9484891891478,1.1480759017789057,7,-1,-1,llm8_g7,0,
2026-03-03T03:29:51.726985+00:00,BUCKET,llm_style,eval,llm_style_eval_214,64,1024,8192,bf16,NVIDIA GeForce RTX 4060,c04,64,64,64,4,3,8,0.0,0.0,445.43999433517456,487.4124765396117,2.410519570885355,2,-1,-1,llm8_g2,0,
2026-03-03T03:29:51.759745+00:00,BUCKET,llm_style,eval,llm_style_eval_215,4,4096,1536,bf16,NVIDIA GeForce RTX 4060,c11,32,128,32,4,2,8,0.0,0.0,160.71999818086624,274.2156788706779,0.31316356750675967,5,-1,-1,llm8_g5,0,
2026-03-03T03:29:51.792197+00:00,BUCKET,llm_style,eval,llm_style_eval_216,16,1536,3072,bf16,NVIDIA GeForce RTX 4060,c11,32,128,32,4,2,8,0.0,0.0,263.16800713539124,309.8419201374053,0.573758739307237,7,-1,-1,llm8_g7,0,
2026-03-03T03:29:51.860583+00:00,BUCKET,llm_style,eval,llm_style_eval_217,8,6144,2048,bf16,NVIDIA GeForce RTX 4060,c11,32,128,32,4,2,8,0.0,0.0,214.01600539684296,338.5548901557921,0.940708110249449,5,-1,-1,llm8_g5,0,
2026-03-03T03:29:51.939664+00:00,BUCKET,llm_style,eval,llm_style_eval_218,8,3072,4096,bf16,NVIDIA GeForce RTX 4060,c11,32,128,32,4,2,8,0.0,0.0,354.0319949388504,438.8863992691039,0.5686677895730124,7,-1,-1,llm8_g7,0,
2026-03-03T03:29:52.112367+00:00,BUCKET,llm_style,eval,llm_style_eval_219,64,8192,3072,bf16,NVIDIA GeForce RTX 4060,c06,64,128,32,4,3,8,0.0,0.0,848.8960266113281,899.7417515516281,3.794605429900141,1,-1,-1,llm8_g1,0,
2026-03-03T03:29:52.156668+00:00,BUCKET,llm_style,eval,llm_style_eval_220,2,4096,2048,bf16,NVIDIA GeForce RTX 4060,c11,32,128,32,4,2,8,0.0,0.0,221.69599682092667,283.1462502479553,0.1513533509001669,5,-1,-1,llm8_g5,0,
2026-03-03T03:29:52.227744+00:00,BUCKET,llm_style,eval,llm_style_eval_221,4,1024,8192,bf16,NVIDIA GeForce RTX 4060,c04,64,64,64,4,3,8,0.0,0.0,478.5120040178299,601.5346920490264,0.14024489132251622,6,-1,-1,llm8_g6,0,
2026-03-03T03:29:52.309332+00:00,BUCKET,llm_style,eval,llm_style_eval_222,64,6144,2048,bf16,NVIDIA GeForce RTX 4060,c06,64,128,32,4,3,8,0.0,0.0,348.1599986553192,475.68897187709797,4.626070606102333,1,-1,-1,llm8_g1,0,
2026-03-03T03:29:52.335530+00:00,BUCKET,llm_style,eval,llm_style_eval_223,4,2048,2048,bf16,NVIDIA GeForce RTX 4060,c11,32,128,32,4,2,8,0.0,0.0,169.98399794101715,260.212805867195,0.1973975927524841,7,-1,-1,llm8_g7,0,
2026-03-03T03:29:52.366749+00:00,BUCKET,llm_style,eval,llm_style_eval_224,16,3072,1536,bf16,NVIDIA GeForce RTX 4060,c11,32,128,32,4,2,8,0.0,0.0,145.4080045223236,267.69343674182875,1.038422502915365,7,-1,-1,llm8_g7,0,
2026-03-03T03:29:52.392493+00:00,BUCKET,llm_style,eval,llm_style_eval_225,1,2048,2048,bf16,NVIDIA GeForce RTX 4060,c11,32,128,32,4,2,8,0.0,0.0,143.3280035853386,178.09760376811028,0.05852734839082133,7,-1,-1,llm8_g7,0,
2026-03-03T03:29:52.405725+00:00,BUCKET,llm_style,eval,llm_style_eval_226,8,1536,1024,bf16,NVIDIA GeForce RTX 4060,c11,32,128,32,4,2,8,0.0,0.0,98.30400347709656,206.99968278408048,0.2559999909450614,7,-1,-1,llm8_g7,0,
2026-03-03T03:29:52.637562+00:00,BUCKET,llm_style,eval,llm_style_eval_227,64,6144,6144,bf16,NVIDIA GeForce RTX 4060,c03,64,64,32,4,2,8,0.0,0.0,994.6559965610504,1122.3581051826477,4.857798298814589,0,-1,-1,llm8_g0,0,
2026-03-03T03:29:52.717170+00:00,BUCKET,llm_style,eval,llm_style_eval_228,64,6144,2048,bf16,NVIDIA GeForce RTX 4060,c06,64,128,32,4,3,8,0.0,0.0,348.143994808197,433.6639973521229,4.6262832621523025,1,-1,-1,llm8_g1,0,
2026-03-03T03:29:52.799074+00:00,BUCKET,llm_style,eval,llm_style_eval_229,16,1536,8192,bf16,NVIDIA GeForce RTX 4060,c04,64,64,64,4,3,8,0.0,0.0,401.40798687934875,469.6166390180588,1.0031020736042942,6,-1,-1,llm8_g6,0,
2026-03-03T03:29:52.824089+00:00,BUCKET,llm_style,eval,llm_style_eval_230,64,2048,1536,bf16,NVIDIA GeForce RTX 4060,c04,64,64,64,4,3,8,0.0,0.0,155.58400005102158,251.23711705207822,2.5880115170451687,3,-1,-1,llm8_g3,0,
2026-03-03T03:29:52.888939+00:00,BUCKET,llm_style,eval,llm_style_eval_231,4,1024,8192,bf16,NVIDIA GeForce RTX 4060,c04,64,64,64,4,3,8,0.0,0.0,388.032004237175,494.83807146549213,0.17294672415469464,6,-1,-1,llm8_g6,0,
2026-03-03T03:29:52.921504+00:00,BUCKET,llm_style,eval,llm_style_eval_232,16,3072,1536,bf16,NVIDIA GeForce RTX 4060,c11,32,128,32,4,2,8,0.0,0.0,143.2959958910942,161.43360614776608,1.0537275871599163,7,-1,-1,llm8_g7,0,
2026-03-03T03:29:52.986051+00:00,BUCKET,llm_style,eval,llm_style_eval_233,64,3072,3072,bf16,NVIDIA GeForce RTX 4060,c04,64,64,64,4,3,8,0.0,0.0,285.0399911403656,345.59232413768757,4.237859912804833,3,-1,-1,llm8_g3,0,
2026-03-03T03:29:53.167000+00:00,BUCKET,llm_style,eval,llm_style_eval_234,32,8192,4096,bf16,NVIDIA GeForce RTX 4060,c11,32,128,32,4,2,8,0.0,0.0,550.3199994564056,661.4098972082138,3.90224533021013,5,-1,-1,llm8_g5,0,
2026-03-03T03:29:53.184797+00:00,BUCKET,llm_style,eval,llm_style_eval_235,4,2048,1024,bf16,NVIDIA GeForce RTX 4060,c11,32,128,32,4,2,8,0.0,0.0,102.39999741315842,142.4281595647334,0.16384000413894662,7,-1,-1,llm8_g7,0,
2026-03-03T03:29:53.327035+00:00,BUCKET,llm_style,eval,llm_style_eval_236,4,8192,3072,bf16,NVIDIA GeForce RTX 4060,c11,32,128,32,4,2,8,0.0,0.0,448.92799854278564,466.35454922914505,0.4484607613102847,5,-1,-1,llm8_g5,0,
2026-03-03T03:29:53.358735+00:00,BUCKET,llm_style,eval,llm_style_eval_237,64,1024,4096,bf16,NVIDIA GeForce RTX 4060,c04,64,64,64,4,3,8,0.0,0.0,238.44800144433975,294.63359445333464,2.2515219618031495,3,-1,-1,llm8_g3,0,
2026-03-03T03:29:53.447451+00:00,BUCKET,llm_style,eval,llm_style_eval_238,32,2048,6144,bf16,NVIDIA GeForce RTX 4060,c04,64,64,64,4,3,8,0.0,0.0,529.3760001659393,571.135995388031,1.521237018201745,6,-1,-1,llm8_g6,0,
2026-03-03T03:29:53.480625+00:00,BUCKET,llm_style,eval,llm_style_eval_239,32,2048,6144,bf16,NVIDIA GeForce RTX 4060,c04,64,64,64,4,3,8,0.0,0.0,521.727979183197,548.9136099815369,1.5435368623717776,6,-1,-1,llm8_g6,0,
2026-03-03T03:29:53.552782+00:00,BUCKET,llm_style,eval,llm_style_eval_240,8,8192,1536,bf16,NVIDIA GeForce RTX 4060,c11,32,128,32,4,2,8,0.0,0.0,238.5919988155365,309.04383867979027,0.8438111629872901,5,-1,-1,llm8_g5,0,
2026-03-03T03:29:53.570725+00:00,BUCKET,llm_style,eval,llm_style_eval_241,16,1536,1536,bf16,NVIDIA GeForce RTX 4060,c11,32,128,32,4,2,8,0.0,0.0,136.07999682426453,146.77663579583168,0.5548021293496825,7,-1,-1,llm8_g7,0,
2026-03-03T03:29:53.607226+00:00,BUCKET,llm_style,eval,llm_style_eval_242,1,2048,3072,bf16,NVIDIA GeForce RTX 4060,c11,32,128,32,4,2,8,0.0,0.0,220.15999257564545,305.61087086796726,0.05715349029945393,7,-1,-1,llm8_g7,0,
2026-03-03T03:29:53.659101+00:00,BUCKET,llm_style,eval,llm_style_eval_243,8,1536,6144,bf16,NVIDIA GeForce RTX 4060,c04,64,64,64,4,3,8,0.0,0.0,299.3760108947754,368.9670488238333,0.504365542010885,6,-1,-1,llm8_g6,0,
2026-03-03T03:29:53.710973+00:00,BUCKET,llm_style,eval,llm_style_eval_244,32,8192,1024,bf16,NVIDIA GeForce RTX 4060,c11,32,128,32,4,2,8,0.0,0.0,170.3680008649826,298.4748800098894,3.151242658681383,5,-1,-1,llm8_g5,0,
2026-03-03T03:29:53.841951+00:00,BUCKET,llm_style,eval,llm_style_eval_245,4,6144,4096,bf16,NVIDIA GeForce RTX 4060,c11,32,128,32,4,2,8,0.0,0.0,369.6640133857727,416.40961050987244,0.5446204788938984,5,-1,-1,llm8_g5,0,
2026-03-03T03:29:53.932858+00:00,BUCKET,llm_style,eval,llm_style_eval_246,32,2048,6144,bf16,NVIDIA GeForce RTX 4060,c04,64,64,64,4,3,8,0.0,0.0,510.97601652145386,636.0063982009883,1.5760159811065975,6,-1,-1,llm8_g6,0,
2026-03-03T03:29:54.009548+00:00,BUCKET,llm_style,eval,llm_style_eval_247,64,6144,2048,bf16,NVIDIA GeForce RTX 4060,c06,64,128,32,4,3,8,0.0,0.0,335.87199449539185,347.71967470645905,4.795317151761212,1,-1,-1,llm8_g1,0,
2026-03-03T03:29:54.026412+00:00,BUCKET,llm_style,eval,llm_style_eval_248,64,1024,1024,bf16,NVIDIA GeForce RTX 4060,c04,64,64,64,4,3,8,0.0,0.0,107.39199817180634,142.940160036087,1.2497926315262122,3,-1,-1,llm8_g3,0,
2026-03-03T03:29:54.078177+00:00,BUCKET,llm_style,eval,llm_style_eval_249,2,8192,1024,bf16,NVIDIA GeForce RTX 4060,c11,32,128,32,4,2,8,0.0,0.0,151.5520066022873,289.1449600458144,0.22140539575998977,5,-1,-1,llm8_g5,0,
2026-03-03T03:29:54.143942+00:00,BUCKET,llm_style,eval,llm_style_eval_250,64,3072,3072,bf16,NVIDIA GeForce RTX 4060,c04,64,64,64,4,3,8,0.0,0.0,279.55201268196106,381.49120569229103,4.321054749028988,3,-1,-1,llm8_g3,0,
2026-03-03T03:29:54.211281+00:00,BUCKET,llm_style,eval,llm_style_eval_251,64,1024,8192,bf16,NVIDIA GeForce RTX 4060,c04,64,64,64,4,3,8,0.0,0.0,393.21601390838623,490.0147107243538,2.730666570080655,2,-1,-1,llm8_g2,0,
2026-03-03T03:29:54.299048+00:00,BUCKET,llm_style,eval,llm_style_eval_252,64,4096,3072,bf16,NVIDIA GeForce RTX 4060,c06,64,128,32,4,3,8,0.0,0.0,490.4160052537918,557.5910526514053,3.2841765332811743,1,-1,-1,llm8_g1,0,
2026-03-03T03:29:54.437013+00:00,BUCKET,llm_style,eval,llm_style_eval_253,8,6144,4096,bf16,NVIDIA GeForce RTX 4060,c11,32,128,32,4,2,8,0.0,0.0,371.71199917793274,488.0486449599266,1.0832396718171484,5,-1,-1,llm8_g5,0,
2026-03-03T03:29:54.468481+00:00,BUCKET,llm_style,eval,llm_style_eval_254,4,1536,3072,bf16,NVIDIA GeForce RTX 4060,c11,32,128,32,4,2,8,0.0,0.0,230.3999960422516,299.57984358072275,0.16384000281439892,7,-1,-1,llm8_g7,0,
2026-03-03T03:29:54.492591+00:00,BUCKET,llm_style,eval,llm_style_eval_255,1,3072,1536,bf16,NVIDIA GeForce RTX 4060,c11,32,128,32,4,2,8,0.0,0.0,132.01600313186646,224.92159783840174,0.07148515161887993,7,-1,-1,llm8_g7,0,
