results/llm_clean_ab_run2.csv
timestamp,method,workload,split,shape_id,M,N,K,dtype,gpu,config_id,BLOCK_M,BLOCK_N,BLOCK_K,num_warps,num_stages,GROUP_M,compile_time_ms,tune_time_ms,runtime_cost_us,p99_us,runtime_perf_tflops,bucket_m,bucket_n,bucket_k,cache_key,invalid_config,notes
2026-03-02T12:38:22.665519+00:00,B,llm_style,tune,llm_style_tune_000,4,2048,2048,bf16,NVIDIA GeForce RTX 4060,c02,32,64,32,2,2,8,126.65193399880081,2555.71,55.02399988472462,118.54847528040403,0.6098144822313282,1,0,-1,llm8_m1_k0,0,
2026-03-02T12:38:24.794815+00:00,B,llm_style,tune,llm_style_tune_001,32,6144,1536,bf16,NVIDIA GeForce RTX 4060,c11,32,128,32,4,2,8,0.0,2129.256,52.160000428557396,80.24064101278773,11.579366776027161,2,0,-1,llm8_m2_k0,0,
2026-03-02T12:38:25.209876+00:00,B,llm_style,tune,llm_style_tune_002,4,8192,4096,bf16,NVIDIA GeForce RTX 4060,c11,32,128,32,4,2,8,0.0,415.021,294.7999984025955,391.54143452644337,0.9105680374984582,1,1,-1,llm8_m1_k1,0,
2026-03-02T12:38:25.280684+00:00,B,llm_style,tune,llm_style_tune_003,2,1536,1536,bf16,NVIDIA GeForce RTX 4060,c04,64,64,64,4,3,8,0.0,70.765,43.31200011074543,49.43743996322155,0.2178884368274347,0,0,-1,llm8_m0_k0,0,
2026-03-02T12:38:25.293028+00:00,B,llm_style,tune,llm_style_tune_004,16,1536,1536,bf16,NVIDIA GeForce RTX 4060,c11,32,128,32,4,2,8,0.0,0.0,44.704001396894455,129.14687901735303,1.6888302979796512,2,0,-1,llm8_m2_k0,0,
2026-03-02T12:38:25.521795+00:00,B,llm_style,tune,llm_style_tune_005,16,3072,6144,bf16,NVIDIA GeForce RTX 4060,c06,64,128,32,4,3,8,0.0,228.728,178.1120002269745,189.0159970521927,3.3910111347372833,2,1,-1,llm8_m2_k1,0,
2026-03-02T12:38:25.538401+00:00,B,llm_style,tune,llm_style_tune_006,16,1536,1024,bf16,NVIDIA GeForce RTX 4060,c11,32,128,32,4,2,8,0.0,0.0,42.83200018107891,382.76319235563165,1.1750945038105893,2,0,-1,llm8_m2_k0,0,
2026-03-02T12:38:25.610840+00:00,B,llm_style,tune,llm_style_tune_007,64,2048,1536,bf16,NVIDIA GeForce RTX 4060,c00,32,32,32,2,2,8,0.0,72.402,47.10400104522705,135.40543437004087,8.548173723361447,3,0,-1,llm8_m3_k0,0,
2026-03-02T12:38:25.996663+00:00,B,llm_style,tune,llm_style_tune_008,2,8192,4096,bf16,NVIDIA GeForce RTX 4060,c11,32,128,32,4,2,8,0.0,385.78,291.8719947338104,370.11038690805424,0.4598513403877875,0,1,-1,llm8_m0_k1,0,
2026-03-02T12:38:26.233103+00:00,B,llm_style,tune,llm_style_tune_009,4,8192,6144,bf16,NVIDIA GeForce RTX 4060,c11,32,128,32,4,2,8,0.0,0.0,429.05598878860474,548.9868867397308,0.9384630316822978,1,1,-1,llm8_m1_k1,0,
2026-03-02T12:38:26.329267+00:00,B,llm_style,tune,llm_style_tune_010,2,3072,6144,bf16,NVIDIA GeForce RTX 4060,c11,32,128,32,4,2,8,0.0,0.0,185.34399569034576,236.00992456078527,0.40733702604606425,0,1,-1,llm8_m0_k1,0,
2026-03-02T12:38:26.430516+00:00,B,llm_style,tune,llm_style_tune_011,32,6144,3072,bf16,NVIDIA GeForce RTX 4060,c06,64,128,32,4,3,8,0.0,0.0,185.32799929380417,314.4844862818717,6.517954958791724,2,1,-1,llm8_m2_k1,0,
2026-03-02T12:38:26.467726+00:00,B,llm_style,tune,llm_style_tune_012,8,6144,1024,bf16,NVIDIA GeForce RTX 4060,c02,32,64,32,2,2,8,0.0,0.0,17.40800030529499,838.4268856048573,5.782588133881251,1,0,-1,llm8_m1_k0,0,
2026-03-02T12:38:26.512673+00:00,B,llm_style,tune,llm_style_tune_013,16,4096,2048,bf16,NVIDIA GeForce RTX 4060,c11,32,128,32,4,2,8,0.0,0.0,79.71200346946716,184.79104280471793,3.3675662926076293,2,0,-1,llm8_m2_k0,0,
2026-03-02T12:38:26.596959+00:00,B,llm_style,tune,llm_style_tune_014,8,8192,2048,bf16,NVIDIA GeForce RTX 4060,c02,32,64,32,2,2,8,0.0,0.0,167.68000274896622,363.8748827576635,1.600879363067967,1,0,-1,llm8_m1_k0,0,
2026-03-02T12:38:26.655354+00:00,B,llm_style,tune,llm_style_tune_015,16,1536,6144,bf16,NVIDIA GeForce RTX 4060,c06,64,128,32,4,3,8,0.0,0.0,105.91999813914299,154.7980837523936,2.8511130410263754,2,1,-1,llm8_m2_k1,0,
2026-03-02T12:38:26.664716+00:00,B,llm_style,tune,llm_style_tune_016,64,1536,1024,bf16,NVIDIA GeForce RTX 4060,c00,32,32,32,2,2,8,0.0,0.0,38.91199827194214,51.43424041569233,5.173894966611581,3,0,-1,llm8_m3_k0,0,
2026-03-02T12:38:26.677074+00:00,B,llm_style,tune,llm_style_tune_017,64,1536,1536,bf16,NVIDIA GeForce RTX 4060,c00,32,32,32,2,2,8,0.0,0.0,48.06400090456009,150.99903881549827,6.2830784436704805,3,0,-1,llm8_m3_k0,0,
2026-03-02T12:38:26.719418+00:00,B,llm_style,tune,llm_style_tune_018,2,8192,1024,bf16,NVIDIA GeForce RTX 4060,c04,64,64,64,4,3,8,0.0,0.0,89.08800035715103,179.82624337077124,0.37664367665096665,0,0,-1,llm8_m0_k0,0,
2026-03-02T12:38:26.871664+00:00,B,llm_style,tune,llm_style_tune_019,64,1024,8192,bf16,NVIDIA GeForce RTX 4060,c04,64,64,64,4,3,8,0.0,152.193,87.0399996638298,109.64991986751555,12.336188282939554,3,1,-1,llm8_m3_k1,0,
2026-03-02T12:38:27.145934+00:00,B,llm_style,tune,llm_style_tune_020,1,2048,2048,bf16,NVIDIA GeForce RTX 4060,c04,64,64,64,4,3,8,0.0,0.0,53.247999399900436,144.92672406136967,0.15753846331390406,0,0,-1,llm8_m0_k0,0,
2026-03-02T12:38:27.386537+00:00,B,llm_style,tune,llm_style_tune_021,64,6144,8192,bf16,NVIDIA GeForce RTX 4060,c04,64,64,64,4,3,8,0.0,0.0,446.46400213241577,478.1692808866501,14.429944885207671,3,1,-1,llm8_m3_k1,0,
2026-03-02T12:38:27.507813+00:00,B,llm_style,tune,llm_style_tune_022,2,4096,6144,bf16,NVIDIA GeForce RTX 4060,c11,32,128,32,4,2,8,0.0,0.0,231.4400002360344,332.9939132928848,0.43494338013022127,0,1,-1,llm8_m0_k1,0,
2026-03-02T12:38:27.551410+00:00,B,llm_style,tune,llm_style_tune_023,64,8192,1024,bf16,NVIDIA GeForce RTX 4060,c00,32,32,32,2,2,8,0.0,0.0,88.06400001049042,184.0230463445186,12.19274418459408,3,0,-1,llm8_m3_k0,0,
2026-03-02T12:38:27.562984+00:00,B,llm_style,tune,llm_style_tune_024,8,1024,2048,bf16,NVIDIA GeForce RTX 4060,c02,32,64,32,2,2,8,0.0,0.0,49.56800118088722,83.42624105513093,0.6769373628270925,1,0,-1,llm8_m1_k0,0,
2026-03-02T12:38:27.579903+00:00,B,llm_style,tune,llm_style_tune_025,4,2048,2048,bf16,NVIDIA GeForce RTX 4060,c02,32,64,32,2,2,8,0.0,0.0,48.11200127005577,83.68895865976808,0.697423327116592,1,0,-1,llm8_m1_k0,0,
2026-03-02T12:38:27.592744+00:00,B,llm_style,tune,llm_style_tune_026,4,3072,1024,bf16,NVIDIA GeForce RTX 4060,c02,32,64,32,2,2,8,0.0,0.0,36.70400008559227,118.02623890340323,0.6856425441726868,1,0,-1,llm8_m1_k0,0,
2026-03-02T12:38:27.611256+00:00,B,llm_style,tune,llm_style_tune_027,16,3072,1536,bf16,NVIDIA GeForce RTX 4060,c11,32,128,32,4,2,8,0.0,0.0,42.447999119758606,105.54015710949884,3.557174593176883,2,0,-1,llm8_m2_k0,0,
2026-03-02T12:38:27.636135+00:00,B,llm_style,tune,llm_style_tune_028,64,6144,1024,bf16,NVIDIA GeForce RTX 4060,c00,32,32,32,2,2,8,0.0,0.0,70.65600156784058,124.87680122256269,11.397564964481928,3,0,-1,llm8_m3_k0,0,
2026-03-02T12:38:27.669133+00:00,B,llm_style,tune,llm_style_tune_029,64,2048,4096,bf16,NVIDIA GeForce RTX 4060,c04,64,64,64,4,3,8,0.0,0.0,76.80000364780426,132.80544295907004,13.981012669270863,3,1,-1,llm8_m3_k1,0,
2026-03-02T12:38:27.749002+00:00,B,llm_style,tune,llm_style_tune_030,1,8192,2048,bf16,NVIDIA GeForce RTX 4060,c04,64,64,64,4,3,8,0.0,0.0,162.62400150299072,229.6038314700125,0.20633136369715338,0,0,-1,llm8_m0_k0,0,
2026-03-02T12:38:27.823045+00:00,B,llm_style,tune,llm_style_tune_031,64,1024,8192,bf16,NVIDIA GeForce RTX 4060,c04,64,64,64,4,3,8,0.0,0.0,85.37599816918373,146.41600370407102,12.57662395785101,3,1,-1,llm8_m3_k1,0,
2026-03-02T12:38:27.960979+00:00,B,llm_style,tune,llm_style_tune_032,4,6144,4096,bf16,NVIDIA GeForce RTX 4060,c11,32,128,32,4,2,8,0.0,0.0,229.35999929904938,296.0281595587729,0.8777755171576442,1,1,-1,llm8_m1_k1,0,
2026-03-02T12:38:27.980756+00:00,B,llm_style,tune,llm_style_tune_033,1,4096,1024,bf16,NVIDIA GeForce RTX 4060,c04,64,64,64,4,3,8,0.0,0.0,67.951999604702,173.9619216322899,0.12344902355779304,0,0,-1,llm8_m0_k0,0,
2026-03-02T12:38:28.142256+00:00,B,llm_style,tune,llm_style_tune_034,4,4096,8192,bf16,NVIDIA GeForce RTX 4060,c11,32,128,32,4,2,8,0.0,0.0,294.6400046348572,398.9523249864578,0.9110624890624338,1,1,-1,llm8_m1_k1,0,
2026-03-02T12:38:28.159315+00:00,B,llm_style,tune,llm_style_tune_035,32,1024,3072,bf16,NVIDIA GeForce RTX 4060,c06,64,128,32,4,3,8,0.0,0.0,69.63200122117996,140.0115263462066,2.8912940669406253,2,1,-1,llm8_m2_k1,0,
2026-03-02T12:38:28.174288+00:00,B,llm_style,tune,llm_style_tune_036,16,2048,1536,bf16,NVIDIA GeForce RTX 4060,c11,32,128,32,4,2,8,0.0,0.0,54.14400063455105,128.44607979059214,1.8591772831755522,2,0,-1,llm8_m2_k0,0,
2026-03-02T12:38:28.380976+00:00,B,llm_style,tune,llm_style_tune_037,1,2048,8192,bf16,NVIDIA GeForce RTX 4060,c11,32,128,32,4,2,8,0.0,0.0,169.98399794101715,228.52607890963543,0.1973975927524841,0,1,-1,llm8_m0_k1,0,
2026-03-02T12:38:28.425696+00:00,B,llm_style,tune,llm_style_tune_038,64,3072,2048,bf16,NVIDIA GeForce RTX 4060,c00,32,32,32,2,2,8,0.0,0.0,73.72800260782242,178.48320066928858,10.92266628032262,3,0,-1,llm8_m3_k0,0,
2026-03-02T12:38:28.445382+00:00,B,llm_style,tune,llm_style_tune_039,64,1536,3072,bf16,NVIDIA GeForce RTX 4060,c04,64,64,64,4,3,8,0.0,0.0,34.17599946260452,85.686402618885,17.672629491373804,3,1,-1,llm8_m3_k1,0,
2026-03-02T12:38:28.565861+00:00,B,llm_style,tune,llm_style_tune_040,8,8192,3072,bf16,NVIDIA GeForce RTX 4060,c11,32,128,32,4,2,8,0.0,0.0,231.4240038394928,320.2275159955024,1.7398937764436289,1,1,-1,llm8_m1_k1,0,
2026-03-02T12:38:28.586626+00:00,B,llm_style,tune,llm_style_tune_041,2,1024,4096,bf16,NVIDIA GeForce RTX 4060,c11,32,128,32,4,2,8,0.0,0.0,98.09600189328194,183.29568505287168,0.17102854016672192,0,1,-1,llm8_m0_k1,0,
2026-03-02T12:38:28.629181+00:00,B,llm_style,tune,llm_style_tune_042,64,1536,6144,bf16,NVIDIA GeForce RTX 4060,c04,64,64,64,4,3,8,0.0,0.0,71.68000191450119,182.23424091935158,16.85211383561116,3,1,-1,llm8_m3_k1,0,
2026-03-02T12:38:28.655381+00:00,B,llm_style,tune,llm_style_tune_043,16,3072,1536,bf16,NVIDIA GeForce RTX 4060,c11,32,128,32,4,2,8,0.0,0.0,35.679999738931656,95.92832434922443,4.231921107197888,2,0,-1,llm8_m2_k0,0,
2026-03-02T12:38:28.676718+00:00,B,llm_style,tune,llm_style_tune_044,8,4096,1024,bf16,NVIDIA GeForce RTX 4060,c02,32,64,32,2,2,8,0.0,0.0,44.03200000524521,88.23807794600711,1.52409302307426,1,0,-1,llm8_m1_k0,0,
2026-03-02T12:38:28.743765+00:00,B,llm_style,tune,llm_style_tune_045,32,3072,4096,bf16,NVIDIA GeForce RTX 4060,c06,64,128,32,4,3,8,0.0,0.0,136.19199395179749,329.4924905896184,5.913022818984665,2,1,-1,llm8_m2_k1,0,
2026-03-02T12:38:28.836172+00:00,B,llm_style,tune,llm_style_tune_046,64,4096,4096,bf16,NVIDIA GeForce RTX 4060,c04,64,64,64,4,3,8,0.0,0.0,261.1199915409088,282.28128612041473,8.224125756620058,3,1,-1,llm8_m3_k1,0,
2026-03-02T12:38:29.009496+00:00,B,llm_style,tune,llm_style_tune_047,4,4096,8192,bf16,NVIDIA GeForce RTX 4060,c11,32,128,32,4,2,8,0.0,0.0,470.0160026550293,506.22016310691833,0.5711198224819157,1,1,-1,llm8_m1_k1,0,
2026-03-02T12:38:29.099979+00:00,B,llm_style,tune,llm_style_tune_048,2,4096,4096,bf16,NVIDIA GeForce RTX 4060,c11,32,128,32,4,2,8,0.0,0.0,249.85599517822266,366.24383717775333,0.2685901691177398,0,1,-1,llm8_m0_k1,0,
2026-03-02T12:38:29.126731+00:00,B,llm_style,tune,llm_style_tune_049,2,3072,2048,bf16,NVIDIA GeForce RTX 4060,c04,64,64,64,4,3,8,0.0,0.0,91.05600044131279,137.3187248408794,0.2763774367206016,0,0,-1,llm8_m0_k0,0,
2026-03-02T12:38:29.161159+00:00,B,llm_style,tune,llm_style_tune_050,4,8192,1024,bf16,NVIDIA GeForce RTX 4060,c02,32,64,32,2,2,8,0.0,0.0,82.94399827718735,190.51520109176624,0.8090864365584532,1,0,-1,llm8_m1_k0,0,
2026-03-02T12:38:29.332943+00:00,B,llm_style,tune,llm_style_tune_051,1,8192,4096,bf16,NVIDIA GeForce RTX 4060,c11,32,128,32,4,2,8,0.0,0.0,470.0160026550293,581.7548686265945,0.14277995562047893,0,1,-1,llm8_m0_k1,0,
2026-03-02T12:38:29.506550+00:00,B,llm_style,tune,llm_style_tune_052,8,4096,8192,bf16,NVIDIA GeForce RTX 4060,c11,32,128,32,4,2,8,0.0,0.0,497.6319968700409,574.8614394664763,1.078851270369993,1,1,-1,llm8_m1_k1,0,
2026-03-02T12:38:29.536125+00:00,B,llm_style,tune,llm_style_tune_053,64,4096,1024,bf16,NVIDIA GeForce RTX 4060,c00,32,32,32,2,2,8,0.0,0.0,108.5439994931221,201.85088127851483,4.946113230644489,3,0,-1,llm8_m3_k0,0,
2026-03-02T12:38:29.555202+00:00,B,llm_style,tune,llm_style_tune_054,1,2048,1536,bf16,NVIDIA GeForce RTX 4060,c04,64,64,64,4,3,8,0.0,0.0,99.32799637317657,182.13887810707087,0.06334020849834641,0,0,-1,llm8_m0_k0,0,
2026-03-02T12:38:29.623778+00:00,B,llm_style,tune,llm_style_tune_055,64,6144,2048,bf16,NVIDIA GeForce RTX 4060,c00,32,32,32,2,2,8,0.0,0.0,224.7679978609085,360.8905619382858,7.165667494162952,3,0,-1,llm8_m3_k0,0,
2026-03-02T12:38:29.654635+00:00,B,llm_style,tune,llm_style_tune_056,16,1536,4096,bf16,NVIDIA GeForce RTX 4060,c06,64,128,32,4,3,8,0.0,0.0,151.92000567913055,199.29088011384,1.3252144844255789,2,1,-1,llm8_m2_k1,0,
2026-03-02T12:38:29.743476+00:00,B,llm_style,tune,llm_style_tune_057,16,4096,4096,bf16,NVIDIA GeForce RTX 4060,c06,64,128,32,4,3,8,0.0,0.0,282.1120023727417,333.0355319380759,1.9030417262809578,2,1,-1,llm8_m2_k1,0,
2026-03-02T12:38:29.877607+00:00,B,llm_style,tune,llm_style_tune_058,1,3072,8192,bf16,NVIDIA GeForce RTX 4060,c11,32,128,32,4,2,8,0.0,0.0,374.59200620651245,504.99998062849045,0.13436391371430434,0,1,-1,llm8_m0_k1,0,
2026-03-02T12:38:29.924155+00:00,B,llm_style,tune,llm_style_tune_059,64,1024,8192,bf16,NVIDIA GeForce RTX 4060,c04,64,64,64,4,3,8,0.0,0.0,182.27200210094452,243.00191894173605,5.890876336593639,3,1,-1,llm8_m3_k1,0,
2026-03-02T12:38:29.975362+00:00,B,llm_style,tune,llm_style_tune_060,16,3072,3072,bf16,NVIDIA GeForce RTX 4060,c06,64,128,32,4,3,8,0.0,0.0,130.048006772995,165.33504366874686,2.3221416113446303,2,1,-1,llm8_m2_k1,0,
2026-03-02T12:38:29.985795+00:00,B,llm_style,tune,llm_style_tune_061,1,1024,1536,bf16,NVIDIA GeForce RTX 4060,c04,64,64,64,4,3,8,0.0,0.0,59.39200147986412,104.51423801481722,0.05296551592164321,0,0,-1,llm8_m0_k0,0,
2026-03-02T12:38:30.016781+00:00,B,llm_style,tune,llm_style_tune_062,32,6144,1024,bf16,NVIDIA GeForce RTX 4060,c11,32,128,32,4,2,8,0.0,0.0,96.25600278377533,161.52416154742235,4.183148815191298,2,0,-1,llm8_m2_k0,0,
2026-03-02T12:38:30.041368+00:00,B,llm_style,tune,llm_style_tune_063,4,1536,3072,bf16,NVIDIA GeForce RTX 4060,c11,32,128,32,4,2,8,0.0,0.0,119.80800330638885,242.8723277151584,0.3150769143816206,1,1,-1,llm8_m1_k1,0,
2026-03-02T12:38:30.075687+00:00,B,llm_style,eval,llm_style_eval_000,32,8192,1024,bf16,NVIDIA GeForce RTX 4060,c11,32,128,32,4,2,8,0.0,0.0,89.9679996073246,193.1571219861507,5.967354107496367,2,0,-1,llm8_m2_k0,0,
2026-03-02T12:38:30.109603+00:00,B,llm_style,eval,llm_style_eval_001,2,3072,2048,bf16,NVIDIA GeForce RTX 4060,c04,64,64,64,4,3,8,0.0,0.0,108.5439994931221,117.25824244320393,0.23184905768646044,0,0,-1,llm8_m0_k0,0,
2026-03-02T12:38:30.124947+00:00,B,llm_style,eval,llm_style_eval_002,32,1536,1536,bf16,NVIDIA GeForce RTX 4060,c11,32,128,32,4,2,8,0.0,0.0,73.05600121617317,112.22016073763368,2.066838336158107,2,0,-1,llm8_m2_k0,0,
2026-03-02T12:38:30.390185+00:00,B,llm_style,eval,llm_style_eval_003,16,8192,6144,bf16,NVIDIA GeForce RTX 4060,c06,64,128,32,4,3,8,0.0,0.0,724.9919772148132,757.7030354738235,2.22155939185349,2,1,-1,llm8_m2_k1,0,
2026-03-02T12:38:30.412496+00:00,B,llm_style,eval,llm_style_eval_004,2,3072,1536,bf16,NVIDIA GeForce RTX 4060,c04,64,64,64,4,3,8,0.0,0.0,86.01599931716919,155.15904307365415,0.21942857317048678,0,0,-1,llm8_m0_k0,0,
2026-03-02T12:38:30.545147+00:00,B,llm_style,eval,llm_style_eval_005,8,3072,8192,bf16,NVIDIA GeForce RTX 4060,c11,32,128,32,4,2,8,0.0,0.0,394.6239948272705,477.7779173851012,1.0203464292034343,1,1,-1,llm8_m1_k1,0,
2026-03-02T12:38:30.620784+00:00,B,llm_style,eval,llm_style_eval_006,64,2048,6144,bf16,NVIDIA GeForce RTX 4060,c04,64,64,64,4,3,8,0.0,0.0,271.7280089855194,341.237763762474,5.927297454587506,3,1,-1,llm8_m3_k1,0,
2026-03-02T12:38:30.649404+00:00,B,llm_style,eval,llm_style_eval_007,8,3072,2048,bf16,NVIDIA GeForce RTX 4060,c02,32,64,32,2,2,8,0.0,0.0,77.82399654388428,162.85696297883987,1.2934737416528952,1,0,-1,llm8_m1_k0,0,
2026-03-02T12:38:30.677540+00:00,B,llm_style,eval,llm_style_eval_008,16,3072,2048,bf16,NVIDIA GeForce RTX 4060,c11,32,128,32,4,2,8,0.0,0.0,97.24800288677216,126.19648121297354,2.0702388329188484,2,0,-1,llm8_m2_k0,0,
2026-03-02T12:38:30.877672+00:00,B,llm_style,eval,llm_style_eval_009,64,6144,6144,bf16,NVIDIA GeForce RTX 4060,c04,64,64,64,4,3,8,0.0,0.0,579.0719985961914,769.6691381931305,8.344106121023858,3,1,-1,llm8_m3_k1,0,
2026-03-02T12:38:30.926450+00:00,B,llm_style,eval,llm_style_eval_010,64,1536,6144,bf16,NVIDIA GeForce RTX 4060,c04,64,64,64,4,3,8,0.0,0.0,177.15199291706085,268.5644851624964,6.818774839104088,3,1,-1,llm8_m3_k1,0,
2026-03-02T12:38:31.109701+00:00,B,llm_style,eval,llm_style_eval_011,32,4096,8192,bf16,NVIDIA GeForce RTX 4060,c06,64,128,32,4,3,8,0.0,0.0,699.7599899768829,826.7750430107116,3.0688860162910196,2,1,-1,llm8_m2_k1,0,
2026-03-02T12:38:31.128009+00:00,B,llm_style,eval,llm_style_eval_012,32,1536,1024,bf16,NVIDIA GeForce RTX 4060,c11,32,128,32,4,2,8,0.0,0.0,69.34399902820587,156.41600444912905,1.4516511509388854,2,0,-1,llm8_m2_k0,0,
2026-03-02T12:38:31.205148+00:00,B,llm_style,eval,llm_style_eval_013,32,2048,6144,bf16,NVIDIA GeForce RTX 4060,c06,64,128,32,4,3,8,0.0,0.0,297.39199578762054,366.2336081266401,2.7078952339225073,2,1,-1,llm8_m2_k1,0,
2026-03-02T12:38:31.251389+00:00,B,llm_style,eval,llm_style_eval_014,2,8192,1024,bf16,NVIDIA GeForce RTX 4060,c04,64,64,64,4,3,8,0.0,0.0,159.743994474411,229.7756749391554,0.21005128931701406,0,0,-1,llm8_m0_k0,0,
2026-03-02T12:38:31.272076+00:00,B,llm_style,eval,llm_style_eval_015,32,2048,2048,bf16,NVIDIA GeForce RTX 4060,c11,32,128,32,4,2,8,0.0,0.0,105.40799796581268,120.83679974079132,2.546632714597829,2,0,-1,llm8_m2_k0,0,
2026-03-02T12:38:31.378064+00:00,B,llm_style,eval,llm_style_eval_016,32,4096,4096,bf16,NVIDIA GeForce RTX 4060,c06,64,128,32,4,3,8,0.0,0.0,376.8320083618164,430.59136778116226,2.8493912411204825,2,1,-1,llm8_m2_k1,0,
2026-03-02T12:38:31.640084+00:00,B,llm_style,eval,llm_style_eval_017,8,8192,6144,bf16,NVIDIA GeForce RTX 4060,c11,32,128,32,4,2,8,0.0,0.0,720.3199863433838,801.331213712692,1.1179842060027227,1,1,-1,llm8_m1_k1,0,
2026-03-02T12:38:31.664746+00:00,B,llm_style,eval,llm_style_eval_018,8,2048,2048,bf16,NVIDIA GeForce RTX 4060,c02,32,64,32,2,2,8,0.0,0.0,135.16800105571747,226.91232219338414,0.49648484460709846,1,0,-1,llm8_m1_k0,0,
2026-03-02T12:38:31.682724+00:00,B,llm_style,eval,llm_style_eval_019,32,3072,1024,bf16,NVIDIA GeForce RTX 4060,c11,32,128,32,4,2,8,0.0,0.0,95.23200243711472,110.62559984624384,2.114064462027285,2,0,-1,llm8_m2_k0,0,
2026-03-02T12:38:31.706416+00:00,B,llm_style,eval,llm_style_eval_020,64,1536,3072,bf16,NVIDIA GeForce RTX 4060,c04,64,64,64,4,3,8,0.0,0.0,100.78400000929832,180.81792145967472,5.992814096922894,3,1,-1,llm8_m3_k1,0,
2026-03-02T12:38:31.738066+00:00,B,llm_style,eval,llm_style_eval_021,64,6144,1024,bf16,NVIDIA GeForce RTX 4060,c00,32,32,32,2,2,8,0.0,0.0,170.9280014038086,218.96192327141756,4.711377664198537,3,0,-1,llm8_m3_k0,0,
2026-03-02T12:38:31.783478+00:00,B,llm_style,eval,llm_style_eval_022,32,6144,1536,bf16,NVIDIA GeForce RTX 4060,c11,32,128,32,4,2,8,0.0,0.0,103.42399775981903,177.5206403434276,5.839841710650354,2,0,-1,llm8_m2_k0,0,
2026-03-02T12:38:31.814550+00:00,B,llm_style,eval,llm_style_eval_023,8,1024,4096,bf16,NVIDIA GeForce RTX 4060,c11,32,128,32,4,2,8,0.0,0.0,195.96800208091736,214.4608011841774,0.34244806951846146,1,1,-1,llm8_m1_k1,0,
2026-03-02T12:38:32.235670+00:00,B,llm_style,eval,llm_style_eval_024,64,8192,8192,bf16,NVIDIA GeForce RTX 4060,c04,64,64,64,4,3,8,0.0,0.0,1362.4320030212402,1431.0095882415771,6.304853800374273,3,1,-1,llm8_m3_k1,0,
2026-03-02T12:38:32.328682+00:00,B,llm_style,eval,llm_style_eval_025,2,8192,2048,bf16,NVIDIA GeForce RTX 4060,c04,64,64,64,4,3,8,0.0,0.0,314.736008644104,382.65855878591515,0.2132227077832874,0,0,-1,llm8_m0_k0,0,
2026-03-02T12:38:32.348991+00:00,B,llm_style,eval,llm_style_eval_026,32,4096,1024,bf16,NVIDIA GeForce RTX 4060,c11,32,128,32,4,2,8,0.0,0.0,82.43199810385704,245.66783696413012,3.256447279875408,2,0,-1,llm8_m2_k0,0,
2026-03-02T12:38:32.375983+00:00,B,llm_style,eval,llm_style_eval_027,8,4096,1536,bf16,NVIDIA GeForce RTX 4060,c02,32,64,32,2,2,8,0.0,0.0,97.120001912117,107.54527904093266,1.0364836698735784,1,0,-1,llm8_m1_k0,0,
2026-03-02T12:38:32.389358+00:00,B,llm_style,eval,llm_style_eval_028,2,1536,1536,bf16,NVIDIA GeForce RTX 4060,c04,64,64,64,4,3,8,0.0,0.0,67.58400052785873,88.14592003822325,0.13963636254574643,0,0,-1,llm8_m0_k0,0,
2026-03-02T12:38:32.521816+00:00,B,llm_style,eval,llm_style_eval_029,16,3072,8192,bf16,NVIDIA GeForce RTX 4060,c06,64,128,32,4,3,8,0.0,0.0,418.15999150276184,454.58048075437534,1.9258331365129686,2,1,-1,llm8_m2_k1,0,
2026-03-02T12:38:32.538461+00:00,B,llm_style,eval,llm_style_eval_030,2,1536,1536,bf16,NVIDIA GeForce RTX 4060,c04,64,64,64,4,3,8,0.0,0.0,71.08800113201141,113.79712112247933,0.13275354278811435,0,0,-1,llm8_m0_k0,0,
2026-03-02T12:38:32.581382+00:00,B,llm_style,eval,llm_style_eval_031,64,4096,2048,bf16,NVIDIA GeForce RTX 4060,c00,32,32,32,2,2,8,0.0,0.0,207.87200331687927,334.02879387140274,5.165398932357389,3,0,-1,llm8_m3_k0,0,
2026-03-02T12:38:32.759923+00:00,B,llm_style,eval,llm_style_eval_032,64,8192,4096,bf16,NVIDIA GeForce RTX 4060,c04,64,64,64,4,3,8,0.0,0.0,596.4800119400024,676.2086302042007,7.200521744276008,3,1,-1,llm8_m3_k1,0,
2026-03-02T12:38:32.841806+00:00,B,llm_style,eval,llm_style_eval_033,32,4096,3072,bf16,NVIDIA GeForce RTX 4060,c06,64,128,32,4,3,8,0.0,0.0,309.6480071544647,360.6118428707123,2.600715487887126,2,1,-1,llm8_m2_k1,0,
2026-03-02T12:38:32.986146+00:00,B,llm_style,eval,llm_style_eval_034,64,6144,4096,bf16,NVIDIA GeForce RTX 4060,c04,64,64,64,4,3,8,0.0,0.0,417.7919924259186,517.3657631874083,7.710117786834262,3,1,-1,llm8_m3_k1,0,
2026-03-02T12:38:33.252815+00:00,B,llm_style,eval,llm_style_eval_035,64,6144,8192,bf16,NVIDIA GeForce RTX 4060,c04,64,64,64,4,3,8,0.0,0.0,791.4400100708008,839.772171974182,8.140163325106183,3,1,-1,llm8_m3_k1,0,
2026-03-02T12:38:33.345839+00:00,B,llm_style,eval,llm_style_eval_036,4,8192,2048,bf16,NVIDIA GeForce RTX 4060,c02,32,64,32,2,2,8,0.0,0.0,251.80800259113312,362.07615941762924,0.5330161337959248,1,0,-1,llm8_m1_k0,0,
2026-03-02T12:38:33.400751+00:00,B,llm_style,eval,llm_style_eval_037,64,2048,4096,bf16,NVIDIA GeForce RTX 4060,c04,64,64,64,4,3,8,0.0,0.0,229.37600314617157,234.49599742889404,4.681142792935274,3,1,-1,llm8_m3_k1,0,
2026-03-02T12:38:33.451325+00:00,B,llm_style,eval,llm_style_eval_038,64,4096,2048,bf16,NVIDIA GeForce RTX 4060,c00,32,32,32,2,2,8,0.0,0.0,208.8959962129593,280.09471386671044,5.140078524556174,3,0,-1,llm8_m3_k0,0,
2026-03-02T12:38:33.525505+00:00,B,llm_style,eval,llm_style_eval_039,64,6144,2048,bf16,NVIDIA GeForce RTX 4060,c00,32,32,32,2,2,8,0.0,0.0,330.52800595760345,358.39998722076416,4.87284800975864,3,0,-1,llm8_m3_k0,0,
2026-03-02T12:38:33.622632+00:00,B,llm_style,eval,llm_style_eval_040,8,6144,3072,bf16,NVIDIA GeForce RTX 4060,c11,32,128,32,4,2,8,0.0,0.0,282.6240062713623,311.25855684280396,1.0685217154201807,1,1,-1,llm8_m1_k1,0,
2026-03-02T12:38:33.692145+00:00,B,llm_style,eval,llm_style_eval_041,2,8192,1536,bf16,NVIDIA GeForce RTX 4060,c04,64,64,64,4,3,8,0.0,0.0,243.6159998178482,373.442555963993,0.20660239080205323,0,0,-1,llm8_m0_k0,0,
2026-03-02T12:38:33.708273+00:00,B,llm_style,eval,llm_style_eval_042,32,1536,1536,bf16,NVIDIA GeForce RTX 4060,c11,32,128,32,4,2,8,0.0,0.0,96.25600278377533,173.11648160219187,1.5686808056967365,2,0,-1,llm8_m2_k0,0,
2026-03-02T12:38:33.733969+00:00,B,llm_style,eval,llm_style_eval_043,64,1536,3072,bf16,NVIDIA GeForce RTX 4060,c04,64,64,64,4,3,8,0.0,0.0,113.98399993777275,207.74975419044492,5.2988119063178205,3,1,-1,llm8_m3_k1,0,
2026-03-02T12:38:33.745175+00:00,B,llm_style,eval,llm_style_eval_044,2,1536,1024,bf16,NVIDIA GeForce RTX 4060,c04,64,64,64,4,3,8,0.0,0.0,75.6320022046566,133.72288376092908,0.08318510440825855,0,0,-1,llm8_m0_k0,0,
2026-03-02T12:38:33.824300+00:00,B,llm_style,eval,llm_style_eval_045,64,4096,3072,bf16,NVIDIA GeForce RTX 4060,c04,64,64,64,4,3,8,0.0,0.0,250.88000297546387,323.51039707660675,6.419852985084341,3,1,-1,llm8_m3_k1,0,
2026-03-02T12:38:33.881463+00:00,B,llm_style,eval,llm_style_eval_046,64,2048,4096,bf16,NVIDIA GeForce RTX 4060,c04,64,64,64,4,3,8,0.0,0.0,227.6799976825714,241.00704580545425,4.7160129784303555,3,1,-1,llm8_m3_k1,0,
2026-03-02T12:38:34.016718+00:00,B,llm_style,eval,llm_style_eval_047,2,6144,3072,bf16,NVIDIA GeForce RTX 4060,c11,32,128,32,4,2,8,0.0,0.0,282.99200534820557,403.3052924275396,0.2667830559633819,0,1,-1,llm8_m0_k1,0,
2026-03-02T12:38:34.233907+00:00,B,llm_style,eval,llm_style_eval_048,16,4096,8192,bf16,NVIDIA GeForce RTX 4060,c06,64,128,32,4,3,8,0.0,0.0,1054.4959902763367,1111.0399961471558,1.0182512156529109,2,1,-1,llm8_m2_k1,0,
2026-03-02T12:38:34.272593+00:00,B,llm_style,eval,llm_style_eval_049,16,2048,3072,bf16,NVIDIA GeForce RTX 4060,c06,64,128,32,4,3,8,0.0,0.0,249.34399873018265,345.2499133348464,0.8074250554466212,2,1,-1,llm8_m2_k1,0,
2026-03-02T12:38:34.291867+00:00,B,llm_style,eval,llm_style_eval_050,16,1024,1536,bf16,NVIDIA GeForce RTX 4060,c11,32,128,32,4,2,8,0.0,0.0,122.8799968957901,197.15071588754654,0.40960001034736665,2,0,-1,llm8_m2_k0,0,
2026-03-02T12:38:34.335820+00:00,B,llm_style,eval,llm_style_eval_051,4,2048,4096,bf16,NVIDIA GeForce RTX 4060,c11,32,128,32,4,2,8,0.0,0.0,246.2719976902008,361.62559181451786,0.2724989630547439,1,1,-1,llm8_m1_k1,0,
2026-03-02T12:38:34.383688+00:00,B,llm_style,eval,llm_style_eval_052,4,1024,6144,bf16,NVIDIA GeForce RTX 4060,c11,32,128,32,4,2,8,0.0,0.0,345.0720012187958,354.7776034474373,0.14585839425461472,1,1,-1,llm8_m1_k1,0,
2026-03-02T12:38:34.465718+00:00,B,llm_style,eval,llm_style_eval_053,64,6144,2048,bf16,NVIDIA GeForce RTX 4060,c00,32,32,32,2,2,8,0.0,0.0,421.88799381256104,483.0815938115119,3.8176311239508105,3,0,-1,llm8_m3_k0,0,
2026-03-02T12:38:34.496022+00:00,B,llm_style,eval,llm_style_eval_054,2,3072,2048,bf16,NVIDIA GeForce RTX 4060,c04,64,64,64,4,3,8,0.0,0.0,155.13599663972855,208.66047963500017,0.16221782529584317,0,0,-1,llm8_m0_k0,0,
2026-03-02T12:38:34.506551+00:00,B,llm_style,eval,llm_style_eval_055,4,1024,1024,bf16,NVIDIA GeForce RTX 4060,c02,32,64,32,2,2,8,0.0,0.0,74.17600229382515,92.13696047663686,0.11309059184358763,1,0,-1,llm8_m1_k0,0,
2026-03-02T12:38:34.515541+00:00,B,llm_style,eval,llm_style_eval_056,2,1024,1024,bf16,NVIDIA GeForce RTX 4060,c04,64,64,64,4,3,8,0.0,0.0,64.51199948787689,135.7107175886631,0.06501587353199607,0,0,-1,llm8_m0_k0,0,
2026-03-02T12:38:34.558411+00:00,B,llm_style,eval,llm_style_eval_057,2,1024,6144,bf16,NVIDIA GeForce RTX 4060,c11,32,128,32,4,2,8,0.0,0.0,346.1120128631592,410.5830445885656,0.07271005646934797,0,1,-1,llm8_m0_k1,0,
2026-03-02T12:38:34.579189+00:00,B,llm_style,eval,llm_style_eval_058,2,2048,1536,bf16,NVIDIA GeForce RTX 4060,c04,64,64,64,4,3,8,0.0,0.0,130.560003221035,212.5516812503338,0.09637646821053938,0,0,-1,llm8_m0_k0,0,
2026-03-02T12:38:34.834284+00:00,B,llm_style,eval,llm_style_eval_059,8,8192,6144,bf16,NVIDIA GeForce RTX 4060,c11,32,128,32,4,2,8,0.0,0.0,720.2399969100952,834.3040031194687,1.118108368675509,1,1,-1,llm8_m1_k1,0,
2026-03-02T12:38:35.011711+00:00,B,llm_style,eval,llm_style_eval_060,1,4096,8192,bf16,NVIDIA GeForce RTX 4060,c11,32,128,32,4,2,8,0.0,0.0,519.1680192947388,578.7327754497526,0.1292623226121742,0,1,-1,llm8_m0_k1,0,
2026-03-02T12:38:35.042701+00:00,B,llm_style,eval,llm_style_eval_061,32,1536,3072,bf16,NVIDIA GeForce RTX 4060,c06,64,128,32,4,3,8,0.0,0.0,220.12799978256226,306.92353069782257,1.3718831239019986,2,1,-1,llm8_m2_k1,0,
2026-03-02T12:38:35.068070+00:00,B,llm_style,eval,llm_style_eval_062,8,6144,1024,bf16,NVIDIA GeForce RTX 4060,c02,32,64,32,2,2,8,0.0,0.0,92.0800007879734,189.7369606792925,1.0932156292199735,1,0,-1,llm8_m1_k0,0,
2026-03-02T12:38:35.255726+00:00,B,llm_style,eval,llm_style_eval_063,64,8192,4096,bf16,NVIDIA GeForce RTX 4060,c04,64,64,64,4,3,8,0.0,0.0,759.7439885139465,848.3065557479857,5.653177071398647,3,1,-1,llm8_m3_k1,0,
2026-03-02T12:38:35.283290+00:00,B,llm_style,eval,llm_style_eval_064,16,6144,1024,bf16,NVIDIA GeForce RTX 4060,c11,32,128,32,4,2,8,0.0,0.0,92.16000139713287,142.62272343039507,2.1845333002161103,2,0,-1,llm8_m2_k0,0,
2026-03-02T12:38:35.458216+00:00,B,llm_style,eval,llm_style_eval_065,8,8192,4096,bf16,NVIDIA GeForce RTX 4060,c11,32,128,32,4,2,8,0.0,0.0,500.2079904079437,642.4479812383652,1.07329535372307,1,1,-1,llm8_m1_k1,0,
2026-03-02T12:38:35.491217+00:00,B,llm_style,eval,llm_style_eval_066,32,1536,3072,bf16,NVIDIA GeForce RTX 4060,c06,64,128,32,4,3,8,0.0,0.0,237.5039979815483,322.85087555646896,1.271514966343689,2,1,-1,llm8_m2_k1,0,
2026-03-02T12:38:35.621493+00:00,B,llm_style,eval,llm_style_eval_067,8,8192,3072,bf16,NVIDIA GeForce RTX 4060,c11,32,128,32,4,2,8,0.0,0.0,373.1200098991394,428.59871566295624,1.0791519439250763,1,1,-1,llm8_m1_k1,0,
2026-03-02T12:38:35.646474+00:00,B,llm_style,eval,llm_style_eval_068,64,1536,3072,bf16,NVIDIA GeForce RTX 4060,c04,64,64,64,4,3,8,0.0,0.0,135.5840042233467,150.16959488391873,4.454653625696641,3,1,-1,llm8_m3_k1,0,
2026-03-02T12:38:35.924624+00:00,B,llm_style,eval,llm_style_eval_069,64,8192,6144,bf16,NVIDIA GeForce RTX 4060,c04,64,64,64,4,3,8,0.0,0.0,1116.5120005607605,1131.581473350525,5.770158261410825,3,1,-1,llm8_m3_k1,0,
2026-03-02T12:38:35.973945+00:00,B,llm_style,eval,llm_style_eval_070,8,8192,1024,bf16,NVIDIA GeForce RTX 4060,c02,32,64,32,2,2,8,0.0,0.0,175.61600357294083,335.3702375292776,0.7642682060251624,1,0,-1,llm8_m1_k0,0,
2026-03-02T12:38:36.084769+00:00,B,llm_style,eval,llm_style_eval_071,2,6144,3072,bf16,NVIDIA GeForce RTX 4060,c11,32,128,32,4,2,8,0.0,0.0,286.72000765800476,368.6198332905767,0.2633142786814244,0,1,-1,llm8_m0_k1,0,
2026-03-02T12:38:36.097258+00:00,B,llm_style,eval,llm_style_eval_072,64,1024,1024,bf16,NVIDIA GeForce RTX 4060,c00,32,32,32,2,2,8,0.0,0.0,78.8159966468811,174.72255483269686,1.7029249607961563,3,0,-1,llm8_m3_k0,0,
2026-03-02T12:38:36.204236+00:00,B,llm_style,eval,llm_style_eval_073,1,8192,2048,bf16,NVIDIA GeForce RTX 4060,c04,64,64,64,4,3,8,0.0,0.0,467.3760086297989,564.0704011917114,0.07179322725265928,0,0,-1,llm8_m0_k0,0,
2026-03-02T12:38:36.223320+00:00,B,llm_style,eval,llm_style_eval_074,64,1024,1536,bf16,NVIDIA GeForce RTX 4060,c00,32,32,32,2,2,8,0.0,0.0,118.78400295972824,202.65248045325268,1.6948965094925827,3,0,-1,llm8_m3_k0,0,
2026-03-02T12:38:36.247947+00:00,B,llm_style,eval,llm_style_eval_075,2,1536,2048,bf16,NVIDIA GeForce RTX 4060,c04,64,64,64,4,3,8,0.0,0.0,139.26400244235992,226.1401602625847,0.09035293959189454,0,0,-1,llm8_m0_k0,0,
2026-03-02T12:38:36.291744+00:00,B,llm_style,eval,llm_style_eval_076,64,2048,3072,bf16,NVIDIA GeForce RTX 4060,c04,64,64,64,4,3,8,0.0,0.0,261.12000644207,367.1225532889364,3.0840469827372603,3,1,-1,llm8_m3_k1,0,
2026-03-02T12:38:36.442025+00:00,B,llm_style,eval,llm_style_eval_077,1,3072,8192,bf16,NVIDIA GeForce RTX 4060,c11,32,128,32,4,2,8,0.0,0.0,594.7999954223633,709.6463978290558,0.08461944920537508,0,1,-1,llm8_m0_k1,0,
2026-03-02T12:38:36.458122+00:00,B,llm_style,eval,llm_style_eval_078,1,1024,2048,bf16,NVIDIA GeForce RTX 4060,c04,64,64,64,4,3,8,0.0,0.0,117.76000261306763,187.91424036026,0.035617390514006024,0,0,-1,llm8_m0_k0,0,
2026-03-02T12:38:36.477934+00:00,B,llm_style,eval,llm_style_eval_079,64,1536,2048,bf16,NVIDIA GeForce RTX 4060,c00,32,32,32,2,2,8,0.0,0.0,141.77600294351578,216.60672262310982,2.840065847817835,3,0,-1,llm8_m3_k0,0,
2026-03-02T12:38:36.489450+00:00,B,llm_style,eval,llm_style_eval_080,4,1536,1024,bf16,NVIDIA GeForce RTX 4060,c02,32,64,32,2,2,8,0.0,0.0,84.3999981880188,92.63520121574402,0.14908663827182683,1,0,-1,llm8_m1_k0,0,
2026-03-02T12:38:36.627584+00:00,B,llm_style,eval,llm_style_eval_081,4,4096,6144,bf16,NVIDIA GeForce RTX 4060,c11,32,128,32,4,2,8,0.0,0.0,500.09599328041077,575.3625595569611,0.4025758948384803,1,1,-1,llm8_m1_k1,0,
2026-03-02T12:38:36.647068+00:00,B,llm_style,eval,llm_style_eval_082,64,1024,2048,bf16,NVIDIA GeForce RTX 4060,c00,32,32,32,2,2,8,0.0,0.0,125.44000148773193,179.19999361038208,2.1399509950281135,3,0,-1,llm8_m3_k0,0,
2026-03-02T12:38:36.740696+00:00,B,llm_style,eval,llm_style_eval_083,8,4096,4096,bf16,NVIDIA GeForce RTX 4060,c11,32,128,32,4,2,8,0.0,0.0,356.3520014286041,453.1980836391448,0.7532873533019333,1,1,-1,llm8_m1_k1,0,
2026-03-02T12:38:36.792629+00:00,B,llm_style,eval,llm_style_eval_084,64,3072,3072,bf16,NVIDIA GeForce RTX 4060,c04,64,64,64,4,3,8,0.0,0.0,284.67199206352234,364.30848002433777,4.243338247798024,3,1,-1,llm8_m3_k1,0,
2026-03-02T12:38:36.942379+00:00,B,llm_style,eval,llm_style_eval_085,1,3072,8192,bf16,NVIDIA GeForce RTX 4060,c11,32,128,32,4,2,8,0.0,0.0,646.1439728736877,769.7715085744858,0.07789540739063607,0,1,-1,llm8_m0_k1,0,
2026-03-02T12:38:36.960969+00:00,B,llm_style,eval,llm_style_eval_086,8,1536,1024,bf16,NVIDIA GeForce RTX 4060,c02,32,64,32,2,2,8,0.0,0.0,104.38399761915207,207.92159870266912,0.24108890801268418,1,0,-1,llm8_m1_k0,0,
2026-03-02T12:38:36.990789+00:00,B,llm_style,eval,llm_style_eval_087,16,1024,3072,bf16,NVIDIA GeForce RTX 4060,c06,64,128,32,4,3,8,0.0,0.0,289.7759974002838,370.0735983252524,0.3473831404363976,2,1,-1,llm8_m2_k1,0,
2026-03-02T12:38:37.089425+00:00,B,llm_style,eval,llm_style_eval_088,8,8192,2048,bf16,NVIDIA GeForce RTX 4060,c02,32,64,32,2,2,8,0.0,0.0,317.328006029129,485.96864014863957,0.8459242515624639,1,0,-1,llm8_m1_k0,0,
2026-03-02T12:38:37.241426+00:00,B,llm_style,eval,llm_style_eval_089,64,6144,4096,bf16,NVIDIA GeForce RTX 4060,c04,64,64,64,4,3,8,0.0,0.0,677.7919828891754,725.5513554811478,4.752528140372969,3,1,-1,llm8_m3_k1,0,
2026-03-02T12:38:37.311999+00:00,B,llm_style,eval,llm_style_eval_090,2,1536,6144,bf16,NVIDIA GeForce RTX 4060,c11,32,128,32,4,2,8,0.0,0.0,444.3039894104004,489.5296010375023,0.08496150586019556,0,1,-1,llm8_m0_k1,0,
2026-03-02T12:38:37.325889+00:00,B,llm_style,eval,llm_style_eval_091,2,1024,1024,bf16,NVIDIA GeForce RTX 4060,c04,64,64,64,4,3,8,0.0,0.0,105.95199838280678,272.7327939867972,0.039586832377109984,0,0,-1,llm8_m0_k0,0,
2026-03-02T12:38:37.420501+00:00,B,llm_style,eval,llm_style_eval_092,4,4096,4096,bf16,NVIDIA GeForce RTX 4060,c11,32,128,32,4,2,8,0.0,0.0,352.25600004196167,482.81408309936523,0.381023255768565,1,1,-1,llm8_m1_k1,0,
2026-03-02T12:38:37.442466+00:00,B,llm_style,eval,llm_style_eval_093,32,2048,1536,bf16,NVIDIA GeForce RTX 4060,c11,32,128,32,4,2,8,0.0,0.0,135.16800105571747,145.86560055613518,1.4894545338212952,2,0,-1,llm8_m2_k0,0,
2026-03-02T12:38:37.473246+00:00,B,llm_style,eval,llm_style_eval_094,2,2048,2048,bf16,NVIDIA GeForce RTX 4060,c04,64,64,64,4,3,8,0.0,0.0,200.70399343967438,378.3481520414351,0.0835918394670245,0,0,-1,llm8_m0_k0,0,
2026-03-02T12:38:37.666630+00:00,B,llm_style,eval,llm_style_eval_095,1,6144,6144,bf16,NVIDIA GeForce RTX 4060,c11,32,128,32,4,2,8,0.0,0.0,536.575973033905,657.9084974527359,0.14070229714745258,0,1,-1,llm8_m0_k1,0,
2026-03-02T12:38:37.716033+00:00,B,llm_style,eval,llm_style_eval_096,64,1024,6144,bf16,NVIDIA GeForce RTX 4060,c04,64,64,64,4,3,8,0.0,0.0,309.2480003833771,429.7382321953773,2.6040794669703784,3,1,-1,llm8_m3_k1,0,
2026-03-02T12:38:37.737952+00:00,B,llm_style,eval,llm_style_eval_097,64,1536,2048,bf16,NVIDIA GeForce RTX 4060,c00,32,32,32,2,2,8,0.0,0.0,131.58399611711502,189.6345604956149,3.06004678290529,3,0,-1,llm8_m3_k0,0,
2026-03-02T12:38:37.758443+00:00,B,llm_style,eval,llm_style_eval_098,32,1024,2048,bf16,NVIDIA GeForce RTX 4060,c11,32,128,32,4,2,8,0.0,0.0,169.47200149297714,227.38144114613522,0.7919758238387355,2,0,-1,llm8_m2_k0,0,
2026-03-02T12:38:37.807674+00:00,B,llm_style,eval,llm_style_eval_099,1,6144,1536,bf16,NVIDIA GeForce RTX 4060,c04,64,64,64,4,3,8,0.0,0.0,276.4799892902374,364.302403628826,0.06826666931105259,0,0,-1,llm8_m0_k0,0,
2026-03-02T12:38:37.859611+00:00,B,llm_style,eval,llm_style_eval_100,64,6144,1024,bf16,NVIDIA GeForce RTX 4060,c00,32,32,32,2,2,8,0.0,0.0,278.8959890604019,325.83679109811777,2.8874792022397666,3,0,-1,llm8_m3_k0,0,
2026-03-02T12:38:37.947018+00:00,B,llm_style,eval,llm_style_eval_101,64,8192,1536,bf16,NVIDIA GeForce RTX 4060,c00,32,32,32,2,2,8,0.0,0.0,504.30402159690857,619.4937711954116,3.1937336745796703,3,0,-1,llm8_m3_k0,0,
2026-03-02T12:38:37.990415+00:00,B,llm_style,eval,llm_style_eval_102,32,6144,1536,bf16,NVIDIA GeForce RTX 4060,c11,32,128,32,4,2,8,0.0,0.0,149.9360054731369,194.29375857114778,4.02825041319519,2,0,-1,llm8_m2_k0,0,
2026-03-02T12:38:38.175441+00:00,B,llm_style,eval,llm_style_eval_103,64,4096,6144,bf16,NVIDIA GeForce RTX 4060,c04,64,64,64,4,3,8,0.0,0.0,769.0240144729614,885.213760137558,4.188718962446988,3,1,-1,llm8_m3_k1,0,
2026-03-02T12:38:38.275797+00:00,B,llm_style,eval,llm_style_eval_104,2,6144,3072,bf16,NVIDIA GeForce RTX 4060,c11,32,128,32,4,2,8,0.0,0.0,292.6560044288635,358.80960196256626,0.2579734256515188,0,1,-1,llm8_m0_k1,0,
2026-03-02T12:38:38.346607+00:00,B,llm_style,eval,llm_style_eval_105,1,4096,3072,bf16,NVIDIA GeForce RTX 4060,c11,32,128,32,4,2,8,0.0,0.0,266.2400007247925,298.8422399759292,0.09452307666575414,0,1,-1,llm8_m0_k1,0,
2026-03-02T12:38:38.385208+00:00,B,llm_style,eval,llm_style_eval_106,64,4096,1536,bf16,NVIDIA GeForce RTX 4060,c00,32,32,32,2,2,8,0.0,0.0,259.5840096473694,279.73631769418716,3.1022957426921804,3,0,-1,llm8_m3_k0,0,
2026-03-02T12:38:38.442673+00:00,B,llm_style,eval,llm_style_eval_107,64,6144,1536,bf16,NVIDIA GeForce RTX 4060,c00,32,32,32,2,2,8,0.0,0.0,413.6960059404373,431.0761672258377,2.9199207501508204,3,0,-1,llm8_m3_k0,0,
2026-03-02T12:38:38.556948+00:00,B,llm_style,eval,llm_style_eval_108,16,3072,6144,bf16,NVIDIA GeForce RTX 4060,c06,64,128,32,4,3,8,0.0,0.0,521.2159752845764,635.9859043359756,1.1587898388383735,2,1,-1,llm8_m2_k1,0,
2026-03-02T12:38:38.579402+00:00,B,llm_style,eval,llm_style_eval_109,64,1024,2048,bf16,NVIDIA GeForce RTX 4060,c00,32,32,32,2,2,8,0.0,0.0,125.95200538635254,257.43359759449953,2.131251941377078,3,0,-1,llm8_m3_k0,0,
2026-03-02T12:38:38.614232+00:00,B,llm_style,eval,llm_style_eval_110,16,1536,3072,bf16,NVIDIA GeForce RTX 4060,c06,64,128,32,4,3,8,0.0,0.0,277.50399708747864,334.6534526348113,0.5441180868915603,2,1,-1,llm8_m2_k1,0,
2026-03-02T12:38:38.841639+00:00,B,llm_style,eval,llm_style_eval_111,64,6144,6144,bf16,NVIDIA GeForce RTX 4060,c04,64,64,64,4,3,8,0.0,0.0,998.3999729156494,1122.0070588588715,4.839581669748524,3,1,-1,llm8_m3_k1,0,
2026-03-02T12:38:39.069867+00:00,B,llm_style,eval,llm_style_eval_112,16,6144,6144,bf16,NVIDIA GeForce RTX 4060,c06,64,128,32,4,3,8,0.0,0.0,1113.6000156402588,1226.3116586208344,1.084733777868609,2,1,-1,llm8_m2_k1,0,
2026-03-02T12:38:39.210070+00:00,B,llm_style,eval,llm_style_eval_113,1,8192,3072,bf16,NVIDIA GeForce RTX 4060,c11,32,128,32,4,2,8,0.0,0.0,507.35998153686523,521.2159752845764,0.09920303104619783,0,1,-1,llm8_m0_k1,0,
2026-03-02T12:38:39.235606+00:00,B,llm_style,eval,llm_style_eval_114,64,3072,1024,bf16,NVIDIA GeForce RTX 4060,c00,32,32,32,2,2,8,0.0,0.0,159.05600041151047,218.99263933300955,2.531518351764497,3,0,-1,llm8_m3_k0,0,
2026-03-02T12:38:39.299220+00:00,B,llm_style,eval,llm_style_eval_115,8,3072,3072,bf16,NVIDIA GeForce RTX 4060,c11,32,128,32,4,2,8,0.0,0.0,281.48800134658813,380.4876857995987,0.5364169814616156,1,1,-1,llm8_m1_k1,0,
2026-03-02T12:38:39.333041+00:00,B,llm_style,eval,llm_style_eval_116,16,3072,2048,bf16,NVIDIA GeForce RTX 4060,c11,32,128,32,4,2,8,0.0,0.0,204.67199385166168,276.83263570070255,0.9836548137890995,2,0,-1,llm8_m2_k0,0,
2026-03-02T12:38:39.346357+00:00,B,llm_style,eval,llm_style_eval_117,64,1024,1024,bf16,NVIDIA GeForce RTX 4060,c00,32,32,32,2,2,8,0.0,0.0,117.24800243973732,221.30623623728738,1.144733600634132,3,0,-1,llm8_m3_k0,0,
2026-03-02T12:38:39.398473+00:00,B,llm_style,eval,llm_style_eval_118,1,6144,1536,bf16,NVIDIA GeForce RTX 4060,c04,64,64,64,4,3,8,0.0,0.0,326.6560137271881,346.1286523938179,0.05778056183518858,0,0,-1,llm8_m0_k0,0,
2026-03-02T12:38:39.414936+00:00,B,llm_style,eval,llm_style_eval_119,1,1024,1536,bf16,NVIDIA GeForce RTX 4060,c04,64,64,64,4,3,8,0.0,0.0,107.91999846696854,137.3072046041488,0.029148703156837277,0,0,-1,llm8_m0_k0,0,
2026-03-02T12:38:39.510186+00:00,B,llm_style,eval,llm_style_eval_120,16,8192,2048,bf16,NVIDIA GeForce RTX 4060,c11,32,128,32,4,2,8,0.0,0.0,378.2240003347397,455.43424487113936,1.4194522598376966,2,0,-1,llm8_m2_k0,0,
2026-03-02T12:38:39.541387+00:00,B,llm_style,eval,llm_style_eval_121,64,4096,1024,bf16,NVIDIA GeForce RTX 4060,c00,32,32,32,2,2,8,0.0,0.0,222.62399643659592,289.9558413028717,2.411559043918712,3,0,-1,llm8_m3_k0,0,
2026-03-02T12:38:39.570135+00:00,B,llm_style,eval,llm_style_eval_122,4,6144,1024,bf16,NVIDIA GeForce RTX 4060,c02,32,64,32,2,2,8,0.0,0.0,133.5199996829033,182.94815778732283,0.37695961743208994,1,0,-1,llm8_m1_k0,0,
2026-03-02T12:38:39.755548+00:00,B,llm_style,eval,llm_style_eval_123,4,8192,4096,bf16,NVIDIA GeForce RTX 4060,c11,32,128,32,4,2,8,0.0,0.0,745.4720139503479,863.1584233045578,0.36008790534942753,1,1,-1,llm8_m1_k1,0,
2026-03-02T12:38:39.915383+00:00,B,llm_style,eval,llm_style_eval_124,4,3072,8192,bf16,NVIDIA GeForce RTX 4060,c11,32,128,32,4,2,8,0.0,0.0,847.3600149154663,884.7974419593811,0.23759274506253944,1,1,-1,llm8_m1_k1,0,
2026-03-02T12:38:40.042464+00:00,B,llm_style,eval,llm_style_eval_125,64,8192,2048,bf16,NVIDIA GeForce RTX 4060,c00,32,32,32,2,2,8,0.0,0.0,859.0239882469177,1006.9920003414154,2.4999111519371535,3,0,-1,llm8_m3_k0,0,
2026-03-02T12:38:40.065632+00:00,B,llm_style,eval,llm_style_eval_126,8,1536,1536,bf16,NVIDIA GeForce RTX 4060,c02,32,64,32,2,2,8,0.0,0.0,162.30399906635284,992.9136180877656,0.2325804429782881,1,0,-1,llm8_m1_k0,0,
2026-03-02T12:38:40.084677+00:00,B,llm_style,eval,llm_style_eval_127,64,2048,1024,bf16,NVIDIA GeForce RTX 4060,c00,32,32,32,2,2,8,0.0,0.0,141.05600118637085,198.20543974637974,1.9030417262809578,3,0,-1,llm8_m3_k0,0,
2026-03-02T12:38:40.186980+00:00,B,llm_style,eval,llm_style_eval_128,64,6144,2048,bf16,NVIDIA GeForce RTX 4060,c00,32,32,32,2,2,8,0.0,0.0,603.4879982471466,767.5129657983779,2.6688397129322947,3,0,-1,llm8_m3_k0,0,
2026-03-02T12:38:40.216756+00:00,B,llm_style,eval,llm_style_eval_129,32,6144,1024,bf16,NVIDIA GeForce RTX 4060,c11,32,128,32,4,2,8,0.0,0.0,125.44000148773193,201.20608046650887,3.2099264925421704,2,0,-1,llm8_m2_k0,0,
2026-03-02T12:38:40.340012+00:00,B,llm_style,eval,llm_style_eval_130,64,8192,2048,bf16,NVIDIA GeForce RTX 4060,c00,32,32,32,2,2,8,0.0,0.0,732.6079905033112,771.2768000364304,2.9312861391597043,3,0,-1,llm8_m3_k0,0,
2026-03-02T12:38:40.512254+00:00,B,llm_style,eval,llm_style_eval_131,64,4096,6144,bf16,NVIDIA GeForce RTX 4060,c04,64,64,64,4,3,8,0.0,0.0,849.9199748039246,986.6956830024719,3.790033847296191,3,1,-1,llm8_m3_k1,0,
2026-03-02T12:38:40.584574+00:00,B,llm_style,eval,llm_style_eval_132,16,8192,1536,bf16,NVIDIA GeForce RTX 4060,c11,32,128,32,4,2,8,0.0,0.0,274.4320034980774,354.306240081787,1.4672238618948863,2,0,-1,llm8_m2_k0,0,
2026-03-02T12:38:40.906959+00:00,B,llm_style,eval,llm_style_eval_133,32,8192,6144,bf16,NVIDIA GeForce RTX 4060,c06,64,128,32,4,3,8,0.0,0.0,1579.0079832077026,1726.8572795391083,2.0400311500998156,2,1,-1,llm8_m2_k1,0,
2026-03-02T12:38:41.229777+00:00,B,llm_style,eval,llm_style_eval_134,64,8192,6144,bf16,NVIDIA GeForce RTX 4060,c04,64,64,64,4,3,8,0.0,0.0,1553.4080266952515,1710.6492877006528,4.1473011812007865,3,1,-1,llm8_m3_k1,0,
2026-03-02T12:38:41.269566+00:00,B,llm_style,eval,llm_style_eval_135,4,3072,2048,bf16,NVIDIA GeForce RTX 4060,c02,32,64,32,2,2,8,0.0,0.0,181.2479943037033,733.3171001076679,0.27769492398168627,1,0,-1,llm8_m1_k0,0,
2026-03-02T12:38:41.323308+00:00,B,llm_style,eval,llm_style_eval_136,64,3072,3072,bf16,NVIDIA GeForce RTX 4060,c04,64,64,64,4,3,8,0.0,0.0,228.86399924755096,253.17375615239138,5.278067131446958,3,1,-1,llm8_m3_k1,0,
2026-03-02T12:38:41.430481+00:00,B,llm_style,eval,llm_style_eval_137,1,3072,6144,bf16,NVIDIA GeForce RTX 4060,c11,32,128,32,4,2,8,0.0,0.0,390.1439905166626,409.66624051332474,0.09675590786368347,0,1,-1,llm8_m0_k1,0,
2026-03-02T12:38:41.472485+00:00,B,llm_style,eval,llm_style_eval_138,1,2048,3072,bf16,NVIDIA GeForce RTX 4060,c11,32,128,32,4,2,8,0.0,0.0,182.27200210094452,277.96286940574635,0.0690337070694567,0,1,-1,llm8_m0_k1,0,
2026-03-02T12:38:41.606216+00:00,B,llm_style,eval,llm_style_eval_139,4,8192,3072,bf16,NVIDIA GeForce RTX 4060,c11,32,128,32,4,2,8,0.0,0.0,366.5439933538437,393.62175434827805,0.5492562847855732,1,1,-1,llm8_m1_k1,0,
2026-03-02T12:38:41.625359+00:00,B,llm_style,eval,llm_style_eval_140,64,1024,2048,bf16,NVIDIA GeForce RTX 4060,c00,32,32,32,2,2,8,0.0,0.0,104.95999827980995,181.24416127800941,2.557502480939313,3,0,-1,llm8_m3_k0,0,
2026-03-02T12:38:41.755752+00:00,B,llm_style,eval,llm_style_eval_141,1,6144,4096,bf16,NVIDIA GeForce RTX 4060,c11,32,128,32,4,2,8,0.0,0.0,366.5919899940491,436.9100823998451,0.13729609313290517,0,1,-1,llm8_m0_k1,0,
2026-03-02T12:38:41.848552+00:00,B,llm_style,eval,llm_style_eval_142,4,4096,4096,bf16,NVIDIA GeForce RTX 4060,c11,32,128,32,4,2,8,0.0,0.0,286.0479950904846,310.87615698575974,0.46921401409418495,1,1,-1,llm8_m1_k1,0,
2026-03-02T12:38:41.898581+00:00,B,llm_style,eval,llm_style_eval_143,64,1536,6144,bf16,NVIDIA GeForce RTX 4060,c04,64,64,64,4,3,8,0.0,0.0,247.80799448490143,344.57601219415653,4.874578620883028,3,1,-1,llm8_m3_k1,0,
2026-03-02T12:38:41.936751+00:00,B,llm_style,eval,llm_style_eval_144,1,6144,1024,bf16,NVIDIA GeForce RTX 4060,c04,64,64,64,4,3,8,0.0,0.0,156.15999698638916,243.18016260862345,0.08057705073532194,0,0,-1,llm8_m0_k0,0,
2026-03-02T12:38:42.045435+00:00,B,llm_style,eval,llm_style_eval_145,8,3072,6144,bf16,NVIDIA GeForce RTX 4060,c11,32,128,32,4,2,8,0.0,0.0,404.4800102710724,429.8240074515342,0.7466126392689071,1,1,-1,llm8_m1_k1,0,
2026-03-02T12:38:42.471512+00:00,B,llm_style,eval,llm_style_eval_146,64,8192,8192,bf16,NVIDIA GeForce RTX 4060,c04,64,64,64,4,3,8,0.0,0.0,1473.5360145568848,1596.5071833133698,5.829470408012476,3,1,-1,llm8_m3_k1,0,
2026-03-02T12:38:42.527641+00:00,B,llm_style,eval,llm_style_eval_147,1,1024,8192,bf16,NVIDIA GeForce RTX 4060,c11,32,128,32,4,2,8,0.0,0.0,354.19200360774994,397.1993714570998,0.047367574166298616,0,1,-1,llm8_m0_k1,0,
2026-03-02T12:38:42.556288+00:00,B,llm_style,eval,llm_style_eval_148,32,4096,1024,bf16,NVIDIA GeForce RTX 4060,c11,32,128,32,4,2,8,0.0,0.0,80.81599697470665,86.88767820596695,3.3215633791415513,2,0,-1,llm8_m2_k0,0,
2026-03-02T12:38:42.628585+00:00,B,llm_style,eval,llm_style_eval_149,64,3072,4096,bf16,NVIDIA GeForce RTX 4060,c04,64,64,64,4,3,8,0.0,0.0,237.56800591945648,370.37503421306604,6.779586037970331,3,1,-1,llm8_m3_k1,0,
2026-03-02T12:38:42.719586+00:00,B,llm_style,eval,llm_style_eval_150,2,4096,4096,bf16,NVIDIA GeForce RTX 4060,c11,32,128,32,4,2,8,0.0,0.0,257.02399015426636,393.73824268579483,0.2610996115954823,0,1,-1,llm8_m0_k1,0,
2026-03-02T12:38:42.754290+00:00,B,llm_style,eval,llm_style_eval_151,64,2048,3072,bf16,NVIDIA GeForce RTX 4060,c04,64,64,64,4,3,8,0.0,0.0,164.62399810552597,301.2096086144446,4.891792067179591,3,1,-1,llm8_m3_k1,0,
2026-03-02T12:38:42.800748+00:00,B,llm_style,eval,llm_style_eval_152,64,1024,8192,bf16,NVIDIA GeForce RTX 4060,c04,64,64,64,4,3,8,0.0,0.0,258.0000013113022,406.4278385043142,4.1617899943513015,3,1,-1,llm8_m3_k1,0,
2026-03-02T12:38:42.827423+00:00,B,llm_style,eval,llm_style_eval_153,64,4096,1024,bf16,NVIDIA GeForce RTX 4060,c00,32,32,32,2,2,8,0.0,0.0,119.80800330638885,133.68319675326347,4.481093893427493,3,0,-1,llm8_m3_k0,0,
2026-03-02T12:38:42.883459+00:00,B,llm_style,eval,llm_style_eval_154,64,4096,2048,bf16,NVIDIA GeForce RTX 4060,c00,32,32,32,2,2,8,0.0,0.0,217.0879989862442,267.5814370810984,4.946113230644489,3,0,-1,llm8_m3_k0,0,
2026-03-02T12:38:43.053601+00:00,B,llm_style,eval,llm_style_eval_155,8,4096,8192,bf16,NVIDIA GeForce RTX 4060,c11,32,128,32,4,2,8,0.0,0.0,480.76799511909485,581.9721668958664,1.1166943670345764,1,1,-1,llm8_m1_k1,0,
2026-03-02T12:38:43.131492+00:00,B,llm_style,eval,llm_style_eval_156,64,6144,2048,bf16,NVIDIA GeForce RTX 4060,c00,32,32,32,2,2,8,0.0,0.0,343.03998947143555,471.3062354922294,4.695116562012702,3,0,-1,llm8_m3_k0,0,
2026-03-02T12:38:43.280658+00:00,B,llm_style,eval,llm_style_eval_157,16,4096,6144,bf16,NVIDIA GeForce RTX 4060,c06,64,128,32,4,3,8,0.0,0.0,606.2080264091492,740.9356886148453,1.3284323745599385,2,1,-1,llm8_m2_k1,0,
2026-03-02T12:38:43.317016+00:00,B,llm_style,eval,llm_style_eval_158,64,2048,3072,bf16,NVIDIA GeForce RTX 4060,c04,64,64,64,4,3,8,0.0,0.0,182.67200142145157,281.9891184568404,4.408482754519331,3,1,-1,llm8_m3_k1,0,
2026-03-02T12:38:43.336171+00:00,B,llm_style,eval,llm_style_eval_159,64,1536,2048,bf16,NVIDIA GeForce RTX 4060,c00,32,32,32,2,2,8,0.0,0.0,119.80800330638885,302.4335974454876,3.3608204200706195,3,0,-1,llm8_m3_k0,0,
2026-03-02T12:38:43.364497+00:00,B,llm_style,eval,llm_style_eval_160,16,1536,3072,bf16,NVIDIA GeForce RTX 4060,c06,64,128,32,4,3,8,0.0,0.0,180.2240014076233,188.36896017193794,0.8378181752744785,2,1,-1,llm8_m2_k1,0,
2026-03-02T12:38:43.376481+00:00,B,llm_style,eval,llm_style_eval_161,64,1536,1024,bf16,NVIDIA GeForce RTX 4060,c00,32,32,32,2,2,8,0.0,0.0,61.43999844789505,194.62143883109093,3.276800082778933,3,0,-1,llm8_m3_k0,0,
2026-03-02T12:38:43.411249+00:00,B,llm_style,eval,llm_style_eval_162,64,6144,1024,bf16,NVIDIA GeForce RTX 4060,c00,32,32,32,2,2,8,0.0,0.0,188.4160041809082,223.39584112167356,4.274086861680724,3,0,-1,llm8_m3_k0,0,
2026-03-02T12:38:43.451009+00:00,B,llm_style,eval,llm_style_eval_163,32,6144,1536,bf16,NVIDIA GeForce RTX 4060,c11,32,128,32,4,2,8,0.0,0.0,110.59200018644333,191.36736050248146,5.461333324126256,2,0,-1,llm8_m2_k0,0,
2026-03-02T12:38:43.530651+00:00,B,llm_style,eval,llm_style_eval_164,16,1536,8192,bf16,NVIDIA GeForce RTX 4060,c06,64,128,32,4,3,8,0.0,0.0,429.05598878860474,464.9984082579613,0.9384630316822978,2,1,-1,llm8_m2_k1,0,
2026-03-02T12:38:43.610147+00:00,B,llm_style,eval,llm_style_eval_165,8,1536,8192,bf16,NVIDIA GeForce RTX 4060,c11,32,128,32,4,2,8,0.0,0.0,391.64799451828003,532.6514983177185,0.5140498478681809,1,1,-1,llm8_m1_k1,0,
2026-03-02T12:38:43.650325+00:00,B,llm_style,eval,llm_style_eval_166,2,1024,6144,bf16,NVIDIA GeForce RTX 4060,c11,32,128,32,4,2,8,0.0,0.0,291.3279980421066,448.2316786050796,0.08638312887579963,0,1,-1,llm8_m0_k1,0,
2026-03-02T12:38:43.723254+00:00,B,llm_style,eval,llm_style_eval_167,64,4096,3072,bf16,NVIDIA GeForce RTX 4060,c04,64,64,64,4,3,8,0.0,0.0,257.9679936170578,374.72127228975296,6.243459560300664,3,1,-1,llm8_m3_k1,0,
2026-03-02T12:38:43.859638+00:00,B,llm_style,eval,llm_style_eval_168,64,8192,3072,bf16,NVIDIA GeForce RTX 4060,c04,64,64,64,4,3,8,0.0,0.0,472.463995218277,590.3075104951859,6.817927936523085,3,1,-1,llm8_m3_k1,0,
2026-03-02T12:38:43.899454+00:00,B,llm_style,eval,llm_style_eval_169,2,1024,6144,bf16,NVIDIA GeForce RTX 4060,c11,32,128,32,4,2,8,0.0,0.0,290.8160090446472,351.7939305305481,0.08653520857628043,0,1,-1,llm8_m0_k1,0,
2026-03-02T12:38:43.996688+00:00,B,llm_style,eval,llm_style_eval_170,16,2048,8192,bf16,NVIDIA GeForce RTX 4060,c06,64,128,32,4,3,8,0.0,0.0,425.9839951992035,433.1519901752472,1.2603077065112325,2,1,-1,llm8_m2_k1,0,
2026-03-02T12:38:44.032652+00:00,B,llm_style,eval,llm_style_eval_171,2,4096,1536,bf16,NVIDIA GeForce RTX 4060,c04,64,64,64,4,3,8,0.0,0.0,146.43199741840363,183.122557401657,0.17186014289003443,0,0,-1,llm8_m0_k0,0,
2026-03-02T12:38:44.047209+00:00,B,llm_style,eval,llm_style_eval_172,1,1536,1024,bf16,NVIDIA GeForce RTX 4060,c04,64,64,64,4,3,8,0.0,0.0,60.416001826524734,155.1340837776661,0.05206779503603159,0,0,-1,llm8_m0_k0,0,
2026-03-02T12:38:44.084898+00:00,B,llm_style,eval,llm_style_eval_173,32,1536,4096,bf16,NVIDIA GeForce RTX 4060,c06,64,128,32,4,3,8,0.0,0.0,230.3999960422516,327.1884790062903,1.7476266966869218,2,1,-1,llm8_m2_k1,0,
2026-03-02T12:38:44.119674+00:00,B,llm_style,eval,llm_style_eval_174,64,2048,3072,bf16,NVIDIA GeForce RTX 4060,c04,64,64,64,4,3,8,0.0,0.0,182.27200210094452,306.51392281055433,4.418157252445229,3,1,-1,llm8_m3_k1,0,
2026-03-02T12:38:44.135810+00:00,B,llm_style,eval,llm_style_eval_175,2,3072,1024,bf16,NVIDIA GeForce RTX 4060,c04,64,64,64,4,3,8,0.0,0.0,78.84799689054489,92.23584108054635,0.15958442187779773,0,0,-1,llm8_m0_k0,0,
2026-03-02T12:38:44.342218+00:00,B,llm_style,eval,llm_style_eval_176,64,6144,6144,bf16,NVIDIA GeForce RTX 4060,c04,64,64,64,4,3,8,0.0,0.0,765.392005443573,840.2358627319336,6.312893489395373,3,1,-1,llm8_m3_k1,0,
2026-03-02T12:38:44.515970+00:00,B,llm_style,eval,llm_style_eval_177,2,6144,4096,bf16,NVIDIA GeForce RTX 4060,c11,32,128,32,4,2,8,0.0,0.0,368.6400055885315,463.6115166544912,0.2730666625270138,0,1,-1,llm8_m0_k1,0,
2026-03-02T12:38:44.565210+00:00,B,llm_style,eval,llm_style_eval_178,64,4096,2048,bf16,NVIDIA GeForce RTX 4060,c00,32,32,32,2,2,8,0.0,0.0,265.0719881057739,277.39808708429337,4.050755538799278,3,0,-1,llm8_m3_k0,0,
2026-03-02T12:38:44.629640+00:00,B,llm_style,eval,llm_style_eval_179,16,6144,2048,bf16,NVIDIA GeForce RTX 4060,c11,32,128,32,4,2,8,0.0,0.0,162.7039983868599,222.19776421785343,2.474758997886549,2,0,-1,llm8_m2_k0,0,
2026-03-02T12:38:44.660936+00:00,B,llm_style,eval,llm_style_eval_180,1,3072,2048,bf16,NVIDIA GeForce RTX 4060,c04,64,64,64,4,3,8,0.0,0.0,162.30399906635284,278.11297208070755,0.07752681432609602,0,0,-1,llm8_m0_k0,0,
2026-03-02T12:38:44.803094+00:00,B,llm_style,eval,llm_style_eval_181,32,3072,8192,bf16,NVIDIA GeForce RTX 4060,c06,64,128,32,4,3,8,0.0,0.0,557.0560097694397,682.1887993812559,2.8912940669406253,2,1,-1,llm8_m2_k1,0,
2026-03-02T12:38:44.855759+00:00,B,llm_style,eval,llm_style_eval_182,64,1024,8192,bf16,NVIDIA GeForce RTX 4060,c04,64,64,64,4,3,8,0.0,0.0,333.8240087032318,397.89566934108734,3.216490713687859,3,1,-1,llm8_m3_k1,0,
2026-03-02T12:38:44.895851+00:00,B,llm_style,eval,llm_style_eval_183,32,4096,1536,bf16,NVIDIA GeForce RTX 4060,c11,32,128,32,4,2,8,0.0,0.0,129.02399897575378,190.09951323270786,3.1207619295358113,2,0,-1,llm8_m2_k0,0,
2026-03-02T12:38:44.929244+00:00,B,llm_style,eval,llm_style_eval_184,2,2048,3072,bf16,NVIDIA GeForce RTX 4060,c11,32,128,32,4,2,8,0.0,0.0,199.16800409555435,288.9318335056305,0.12635475318578906,0,1,-1,llm8_m0_k1,0,
2026-03-02T12:38:44.944823+00:00,B,llm_style,eval,llm_style_eval_185,64,1536,1536,bf16,NVIDIA GeForce RTX 4060,c00,32,32,32,2,2,8,0.0,0.0,100.35199671983719,162.38591521978367,3.0093062208128822,3,0,-1,llm8_m3_k0,0,
2026-03-02T12:38:44.990188+00:00,B,llm_style,eval,llm_style_eval_186,64,8192,1024,bf16,NVIDIA GeForce RTX 4060,c00,32,32,32,2,2,8,0.0,0.0,282.6080024242401,303.7695872783661,3.7994034662477127,3,0,-1,llm8_m3_k0,0,
2026-03-02T12:38:45.035644+00:00,B,llm_style,eval,llm_style_eval_187,4,8192,1024,bf16,NVIDIA GeForce RTX 4060,c02,32,64,32,2,2,8,0.0,0.0,148.40000122785568,161.28767773509023,0.4522160609484093,1,0,-1,llm8_m1_k0,0,
2026-03-02T12:38:45.065111+00:00,B,llm_style,eval,llm_style_eval_188,32,6144,1024,bf16,NVIDIA GeForce RTX 4060,c11,32,128,32,4,2,8,0.0,0.0,102.39999741315842,199.68000054359436,3.932160099334719,2,0,-1,llm8_m2_k0,0,
2026-03-02T12:38:45.075766+00:00,B,llm_style,eval,llm_style_eval_189,4,1024,1024,bf16,NVIDIA GeForce RTX 4060,c02,32,64,32,2,2,8,0.0,0.0,85.35999804735184,143.62624377012247,0.09827329184504642,1,0,-1,llm8_m1_k0,0,
2026-03-02T12:38:45.098679+00:00,B,llm_style,eval,llm_style_eval_190,16,2048,2048,bf16,NVIDIA GeForce RTX 4060,c11,32,128,32,4,2,8,0.0,0.0,150.52799880504608,177.87296026945108,0.8916462655816605,2,0,-1,llm8_m2_k0,0,
2026-03-02T12:38:45.116678+00:00,B,llm_style,eval,llm_style_eval_191,4,2048,1536,bf16,NVIDIA GeForce RTX 4060,c02,32,64,32,2,2,8,0.0,0.0,115.56800082325935,206.4486391842365,0.21775771684833972,1,0,-1,llm8_m1_k0,0,
2026-03-02T12:38:45.163767+00:00,B,llm_style,eval,llm_style_eval_192,64,8192,1024,bf16,NVIDIA GeForce RTX 4060,c00,32,32,32,2,2,8,0.0,0.0,286.5920066833496,372.9244682192802,3.746586781767288,3,0,-1,llm8_m3_k0,0,
2026-03-02T12:38:45.531598+00:00,B,llm_style,eval,llm_style_eval_193,4,8192,8192,bf16,NVIDIA GeForce RTX 4060,c11,32,128,32,4,2,8,0.0,0.0,965.5359983444214,1984.716831445694,0.5560340711486242,1,1,-1,llm8_m1_k1,0,
2026-03-02T12:38:45.552068+00:00,B,llm_style,eval,llm_style_eval_194,64,1024,1024,bf16,NVIDIA GeForce RTX 4060,c00,32,32,32,2,2,8,0.0,0.0,83.96799862384796,146.10591813921928,1.5984390505870707,3,0,-1,llm8_m3_k0,0,
2026-03-02T12:38:45.597220+00:00,B,llm_style,eval,llm_style_eval_195,32,4096,1536,bf16,NVIDIA GeForce RTX 4060,c11,32,128,32,4,2,8,0.0,0.0,143.20000261068344,220.71039572358129,2.811823859352081,2,0,-1,llm8_m2_k0,0,
2026-03-02T12:38:45.617913+00:00,B,llm_style,eval,llm_style_eval_196,8,4096,1024,bf16,NVIDIA GeForce RTX 4060,c02,32,64,32,2,2,8,0.0,0.0,106.49599879980087,192.94016122817993,0.6301538532556162,1,0,-1,llm8_m1_k0,0,
2026-03-02T12:38:45.696382+00:00,B,llm_style,eval,llm_style_eval_197,2,6144,2048,bf16,NVIDIA GeForce RTX 4060,c04,64,64,64,4,3,8,0.0,0.0,337.40800619125366,410.6239974498749,0.14917146918994686,0,0,-1,llm8_m0_k0,0,
2026-03-02T12:38:45.759631+00:00,B,llm_style,eval,llm_style_eval_198,32,1536,6144,bf16,NVIDIA GeForce RTX 4060,c06,64,128,32,4,3,8,0.0,0.0,484.76800322532654,562.3305660486221,1.2459151016187475,2,1,-1,llm8_m2_k1,0,
2026-03-02T12:38:45.792940+00:00,B,llm_style,eval,llm_style_eval_199,32,3072,1536,bf16,NVIDIA GeForce RTX 4060,c11,32,128,32,4,2,8,0.0,0.0,142.2720029950142,225.64863428473467,2.1226234370973396,2,0,-1,llm8_m2_k0,0,
2026-03-02T12:38:45.832968+00:00,B,llm_style,eval,llm_style_eval_200,64,2048,3072,bf16,NVIDIA GeForce RTX 4060,c04,64,64,64,4,3,8,0.0,0.0,267.2000080347061,333.0889603495596,3.013871047097424,3,1,-1,llm8_m3_k1,0,
2026-03-02T12:38:45.902102+00:00,B,llm_style,eval,llm_style_eval_201,4,6144,2048,bf16,NVIDIA GeForce RTX 4060,c02,32,64,32,2,2,8,0.0,0.0,190.15999883413315,300.5952087044716,0.5293610465774321,1,0,-1,llm8_m1_k0,0,
2026-03-02T12:38:45.931247+00:00,B,llm_style,eval,llm_style_eval_202,4,6144,1024,bf16,NVIDIA GeForce RTX 4060,c02,32,64,32,2,2,8,0.0,0.0,110.59200018644333,191.08864143490788,0.4551111103438546,1,0,-1,llm8_m1_k0,0,
2026-03-02T12:38:46.182634+00:00,B,llm_style,eval,llm_style_eval_203,1,6144,8192,bf16,NVIDIA GeForce RTX 4060,c11,32,128,32,4,2,8,0.0,0.0,715.6639993190765,839.7209459543228,0.1406572023963435,0,1,-1,llm8_m0_k1,0,
2026-03-02T12:38:46.218666+00:00,B,llm_style,eval,llm_style_eval_204,1,2048,3072,bf16,NVIDIA GeForce RTX 4060,c11,32,128,32,4,2,8,0.0,0.0,229.88799959421158,243.69183614850044,0.054734966689043436,0,1,-1,llm8_m0_k1,0,
2026-03-02T12:38:46.270690+00:00,B,llm_style,eval,llm_style_eval_205,2,6144,1536,bf16,NVIDIA GeForce RTX 4060,c04,64,64,64,4,3,8,0.0,0.0,284.67199206352234,432.042879462242,0.13260432024368826,0,0,-1,llm8_m0_k0,0,
2026-03-02T12:38:46.286536+00:00,B,llm_style,eval,llm_style_eval_206,16,1024,1024,bf16,NVIDIA GeForce RTX 4060,c11,32,128,32,4,2,8,0.0,0.0,128.4640058875084,269.96319502592087,0.2611971483232625,2,0,-1,llm8_m2_k0,0,
2026-03-02T12:38:46.375512+00:00,B,llm_style,eval,llm_style_eval_207,64,6144,2048,bf16,NVIDIA GeForce RTX 4060,c00,32,32,32,2,2,8,0.0,0.0,505.72800636291504,605.2556651830672,3.1847410381386103,3,0,-1,llm8_m3_k0,0,
2026-03-02T12:38:46.553703+00:00,B,llm_style,eval,llm_style_eval_208,4,4096,6144,bf16,NVIDIA GeForce RTX 4060,c11,32,128,32,4,2,8,0.0,0.0,499.7119903564453,632.9270339012146,0.40288525367660966,1,1,-1,llm8_m1_k1,0,
2026-03-02T12:38:46.781144+00:00,B,llm_style,eval,llm_style_eval_209,32,6144,6144,bf16,NVIDIA GeForce RTX 4060,c06,64,128,32,4,3,8,0.0,0.0,927.1200001239777,1049.194519519806,2.6058321508293805,2,1,-1,llm8_m2_k1,0,
2026-03-02T12:38:46.797854+00:00,B,llm_style,eval,llm_style_eval_210,64,2048,1024,bf16,NVIDIA GeForce RTX 4060,c00,32,32,32,2,2,8,0.0,0.0,117.76000261306763,150.4153622686862,2.2795129928963855,3,0,-1,llm8_m3_k0,0,
2026-03-02T12:38:46.825933+00:00,B,llm_style,eval,llm_style_eval_211,4,1024,3072,bf16,NVIDIA GeForce RTX 4060,c11,32,128,32,4,2,8,0.0,0.0,219.13599967956543,292.15262562036514,0.11484112166325508,1,1,-1,llm8_m1_k1,0,
2026-03-02T12:38:47.046015+00:00,B,llm_style,eval,llm_style_eval_212,64,6144,6144,bf16,NVIDIA GeForce RTX 4060,c04,64,64,64,4,3,8,0.0,0.0,936.4479780197144,1117.9417431354523,5.159750804543121,3,1,-1,llm8_m3_k1,0,
2026-03-02T12:38:47.066269+00:00,B,llm_style,eval,llm_style_eval_213,4,1024,2048,bf16,NVIDIA GeForce RTX 4060,c02,32,64,32,2,2,8,0.0,0.0,170.352004468441,291.25983357429504,0.09848558020993586,1,0,-1,llm8_m1_k0,0,
2026-03-02T12:38:47.286827+00:00,B,llm_style,eval,llm_style_eval_214,32,6144,6144,bf16,NVIDIA GeForce RTX 4060,c06,64,128,32,4,3,8,0.0,0.0,902.5759994983673,1081.1535704135895,2.6766932705309214,2,1,-1,llm8_m2_k1,0,
2026-03-02T12:38:47.326819+00:00,B,llm_style,eval,llm_style_eval_215,16,2048,3072,bf16,NVIDIA GeForce RTX 4060,c06,64,128,32,4,3,8,0.0,0.0,265.7279968261719,283.16671520471573,0.757641627546304,2,1,-1,llm8_m2_k1,0,
2026-03-02T12:38:47.345880+00:00,B,llm_style,eval,llm_style_eval_216,2,1536,2048,bf16,NVIDIA GeForce RTX 4060,c04,64,64,64,4,3,8,0.0,0.0,121.85599654912949,165.70464298129073,0.10326050712594079,0,0,-1,llm8_m0_k0,0,
2026-03-02T12:38:47.500068+00:00,B,llm_style,eval,llm_style_eval_217,64,8192,3072,bf16,NVIDIA GeForce RTX 4060,c04,64,64,64,4,3,8,0.0,0.0,721.4080095291138,884.1667282581327,4.465192276008409,3,1,-1,llm8_m3_k1,0,
2026-03-02T12:38:47.579652+00:00,B,llm_style,eval,llm_style_eval_218,64,4096,3072,bf16,NVIDIA GeForce RTX 4060,c04,64,64,64,4,3,8,0.0,0.0,388.4640038013458,521.1955171823499,4.146105482719683,3,1,-1,llm8_m3_k1,0,
2026-03-02T12:38:47.606660+00:00,B,llm_style,eval,llm_style_eval_219,64,1536,3072,bf16,NVIDIA GeForce RTX 4060,c04,64,64,64,4,3,8,0.0,0.0,164.86400365829468,244.30623978376383,3.6635030242977633,3,1,-1,llm8_m3_k1,0,
2026-03-02T12:38:47.802225+00:00,B,llm_style,eval,llm_style_eval_220,1,6144,6144,bf16,NVIDIA GeForce RTX 4060,c11,32,128,32,4,2,8,0.0,0.0,545.7920134067535,607.2694391012192,0.13832645063594073,0,1,-1,llm8_m0_k1,0,
2026-03-02T12:38:47.984340+00:00,B,llm_style,eval,llm_style_eval_221,8,4096,8192,bf16,NVIDIA GeForce RTX 4060,c11,32,128,32,4,2,8,0.0,0.0,653.8240015506744,725.6976062059402,0.8211245086241913,1,1,-1,llm8_m1_k1,0,
2026-03-02T12:38:48.378755+00:00,B,llm_style,eval,llm_style_eval_222,8,8192,8192,bf16,NVIDIA GeForce RTX 4060,c11,32,128,32,4,2,8,0.0,0.0,1363.2479906082153,1417.9558753967285,0.787634994804539,1,1,-1,llm8_m1_k1,0,
2026-03-02T12:38:48.421797+00:00,B,llm_style,eval,llm_style_eval_223,1,4096,1536,bf16,NVIDIA GeForce RTX 4060,c04,64,64,64,4,3,8,0.0,0.0,264.70398902893066,376.222083568573,0.04753578533576522,0,0,-1,llm8_m0_k0,0,
2026-03-02T12:38:48.476115+00:00,B,llm_style,eval,llm_style_eval_224,4,3072,3072,bf16,NVIDIA GeForce RTX 4060,c11,32,128,32,4,2,8,0.0,0.0,295.9359884262085,387.0441597700119,0.25511419682849845,1,1,-1,llm8_m1_k1,0,
2026-03-02T12:38:48.608352+00:00,B,llm_style,eval,llm_style_eval_225,64,8192,2048,bf16,NVIDIA GeForce RTX 4060,c00,32,32,32,2,2,8,0.0,0.0,586.0799849033356,693.8637012243271,3.6641477329313554,3,0,-1,llm8_m3_k0,0,
2026-03-02T12:38:48.647334+00:00,B,llm_style,eval,llm_style_eval_226,4,4096,1536,bf16,NVIDIA GeForce RTX 4060,c02,32,64,32,2,2,8,0.0,0.0,161.21599823236465,248.27712506055832,0.31220008281966993,1,0,-1,llm8_m1_k0,0,
2026-03-02T12:38:48.716642+00:00,B,llm_style,eval,llm_style_eval_227,16,8192,1536,bf16,NVIDIA GeForce RTX 4060,c11,32,128,32,4,2,8,0.0,0.0,217.0879989862442,272.60735854506476,1.8547924614916835,2,0,-1,llm8_m2_k0,0,
2026-03-02T12:38:48.767913+00:00,B,llm_style,eval,llm_style_eval_228,16,2048,4096,bf16,NVIDIA GeForce RTX 4060,c06,64,128,32,4,3,8,0.0,0.0,314.7680014371872,455.2336013317107,0.8528041439230188,2,1,-1,llm8_m2_k1,0,
2026-03-02T12:38:48.782208+00:00,B,llm_style,eval,llm_style_eval_229,8,1536,1024,bf16,NVIDIA GeForce RTX 4060,c02,32,64,32,2,2,8,0.0,0.0,82.31999725103378,98.16032238304615,0.3057072988384237,1,0,-1,llm8_m1_k0,0,
2026-03-02T12:38:48.932299+00:00,B,llm_style,eval,llm_style_eval_230,64,4096,6144,bf16,NVIDIA GeForce RTX 4060,c04,64,64,64,4,3,8,0.0,0.0,674.1600036621094,728.2175970077512,4.778131978316658,3,1,-1,llm8_m3_k1,0,
2026-03-02T12:38:48.990166+00:00,B,llm_style,eval,llm_style_eval_231,64,4096,2048,bf16,NVIDIA GeForce RTX 4060,c00,32,32,32,2,2,8,0.0,0.0,295.9359884262085,327.9052716493606,3.628290799338645,3,0,-1,llm8_m3_k0,0,
2026-03-02T12:38:49.068690+00:00,B,llm_style,eval,llm_style_eval_232,16,3072,4096,bf16,NVIDIA GeForce RTX 4060,c06,64,128,32,4,3,8,0.0,0.0,319.88799571990967,406.98719918727863,1.2587317729564276,2,1,-1,llm8_m2_k1,0,
2026-03-02T12:38:49.150576+00:00,B,llm_style,eval,llm_style_eval_233,64,8192,1536,bf16,NVIDIA GeForce RTX 4060,c00,32,32,32,2,2,8,0.0,0.0,448.95999133586884,571.8835198879241,3.5874304327378117,3,0,-1,llm8_m3_k0,0,
2026-03-02T12:38:49.181007+00:00,B,llm_style,eval,llm_style_eval_234,64,1024,4096,bf16,NVIDIA GeForce RTX 4060,c04,64,64,64,4,3,8,0.0,0.0,175.10400712490082,245.62752351164806,3.0660115711518388,3,1,-1,llm8_m3_k1,0,
2026-03-02T12:38:49.202736+00:00,B,llm_style,eval,llm_style_eval_235,64,3072,1024,bf16,NVIDIA GeForce RTX 4060,c00,32,32,32,2,2,8,0.0,0.0,125.95200538635254,158.44351768493647,3.1968779120656166,3,0,-1,llm8_m3_k0,0,
2026-03-02T12:38:49.316953+00:00,B,llm_style,eval,llm_style_eval_236,32,3072,6144,bf16,NVIDIA GeForce RTX 4060,c06,64,128,32,4,3,8,0.0,0.0,475.13601183891296,593.008950948715,2.542344764238874,2,1,-1,llm8_m2_k1,0,
2026-03-02T12:38:49.591754+00:00,B,llm_style,eval,llm_style_eval_237,2,8192,6144,bf16,NVIDIA GeForce RTX 4060,c11,32,128,32,4,2,8,0.0,0.0,699.3920207023621,722.4099105596542,0.2878594351102526,0,1,-1,llm8_m0_k1,0,
2026-03-02T12:38:49.647022+00:00,B,llm_style,eval,llm_style_eval_238,4,2048,4096,bf16,NVIDIA GeForce RTX 4060,c11,32,128,32,4,2,8,0.0,0.0,276.4799892902374,305.4758384823798,0.24272593532818695,1,1,-1,llm8_m1_k1,0,
2026-03-02T12:38:49.693165+00:00,B,llm_style,eval,llm_style_eval_239,4,8192,1024,bf16,NVIDIA GeForce RTX 4060,c02,32,64,32,2,2,8,0.0,0.0,153.96800637245178,162.83647552132607,0.4358623949293873,1,0,-1,llm8_m1_k0,0,
2026-03-02T12:38:49.724457+00:00,B,llm_style,eval,llm_style_eval_240,2,1024,4096,bf16,NVIDIA GeForce RTX 4060,c11,32,128,32,4,2,8,0.0,0.0,271.36000990867615,341.7865550518035,0.06182641283675596,0,1,-1,llm8_m0_k1,0,
2026-03-02T12:38:49.754723+00:00,B,llm_style,eval,llm_style_eval_241,8,3072,2048,bf16,NVIDIA GeForce RTX 4060,c02,32,64,32,2,2,8,0.0,0.0,145.4080045223236,196.24960303306574,0.6922816686102434,1,0,-1,llm8_m1_k0,0,
2026-03-02T12:38:49.917326+00:00,B,llm_style,eval,llm_style_eval_242,32,4096,6144,bf16,NVIDIA GeForce RTX 4060,c06,64,128,32,4,3,8,0.0,0.0,855.5520176887512,1317.7638590335835,1.8825421513831773,2,1,-1,llm8_m2_k1,0,
2026-03-02T12:38:49.944347+00:00,B,llm_style,eval,llm_style_eval_243,64,2048,2048,bf16,NVIDIA GeForce RTX 4060,c00,32,32,32,2,2,8,0.0,0.0,171.52000218629837,229.62176322937006,3.130077572042423,3,0,-1,llm8_m3_k0,0,
2026-03-02T12:38:49.963932+00:00,B,llm_style,eval,llm_style_eval_244,8,2048,1536,bf16,NVIDIA GeForce RTX 4060,c02,32,64,32,2,2,8,0.0,0.0,120.2240027487278,238.10463443398464,0.41864891244051183,1,0,-1,llm8_m1_k0,0,
2026-03-02T12:38:50.007351+00:00,B,llm_style,eval,llm_style_eval_245,1,1024,6144,bf16,NVIDIA GeForce RTX 4060,c11,32,128,32,4,2,8,0.0,0.0,367.6159977912903,445.28223663568497,0.03422841246191849,0,1,-1,llm8_m0_k1,0,
2026-03-02T12:38:50.019765+00:00,B,llm_style,eval,llm_style_eval_246,2,1536,1024,bf16,NVIDIA GeForce RTX 4060,c04,64,64,64,4,3,8,0.0,0.0,72.1920020878315,156.21120437979698,0.0871489336498187,0,0,-1,llm8_m0_k0,0,
2026-03-02T12:38:50.113496+00:00,B,llm_style,eval,llm_style_eval_247,64,2048,6144,bf16,NVIDIA GeForce RTX 4060,c04,64,64,64,4,3,8,0.0,0.0,471.3760018348694,571.1564755439758,3.41683227345168,3,1,-1,llm8_m3_k1,0,
2026-03-02T12:38:50.128534+00:00,B,llm_style,eval,llm_style_eval_248,64,1536,1024,bf16,NVIDIA GeForce RTX 4060,c00,32,32,32,2,2,8,0.0,0.0,78.84799689054489,188.4544032812118,2.5533507500447636,3,0,-1,llm8_m3_k0,0,
2026-03-02T12:38:50.149184+00:00,B,llm_style,eval,llm_style_eval_249,8,2048,1536,bf16,NVIDIA GeForce RTX 4060,c02,32,64,32,2,2,8,0.0,0.0,121.71200290322304,222.78144031763046,0.41353068554808226,1,0,-1,llm8_m1_k0,0,
2026-03-02T12:38:50.194465+00:00,B,llm_style,eval,llm_style_eval_250,32,6144,1536,bf16,NVIDIA GeForce RTX 4060,c11,32,128,32,4,2,8,0.0,0.0,116.73600226640701,170.73375701904288,5.173894636391935,2,0,-1,llm8_m2_k0,0,
2026-03-02T12:38:50.252083+00:00,B,llm_style,eval,llm_style_eval_251,64,8192,1024,bf16,NVIDIA GeForce RTX 4060,c00,32,32,32,2,2,8,0.0,0.0,297.92000353336334,387.40384787321085,3.6041279916262963,3,0,-1,llm8_m3_k0,0,
2026-03-02T12:38:50.289254+00:00,B,llm_style,eval,llm_style_eval_252,1,3072,2048,bf16,NVIDIA GeForce RTX 4060,c04,64,64,64,4,3,8,0.0,0.0,177.08799988031387,264.83167618513096,0.0710545717863675,0,0,-1,llm8_m0_k0,0,
2026-03-02T12:38:50.308910+00:00,B,llm_style,eval,llm_style_eval_253,8,3072,1024,bf16,NVIDIA GeForce RTX 4060,c02,32,64,32,2,2,8,0.0,0.0,93.18400174379349,125.99296174943447,0.5401318580241413,1,0,-1,llm8_m1_k0,0,
2026-03-02T12:38:50.321308+00:00,B,llm_style,eval,llm_style_eval_254,2,1024,1536,bf16,NVIDIA GeForce RTX 4060,c04,64,64,64,4,3,8,0.0,0.0,95.12000158429146,114.78431746363637,0.06614230335588009,0,0,-1,llm8_m0_k0,0,
2026-03-02T12:38:50.423725+00:00,B,llm_style,eval,llm_style_eval_255,64,4096,4096,bf16,NVIDIA GeForce RTX 4060,c04,64,64,64,4,3,8,0.0,0.0,492.41599440574646,620.0422525405884,4.361116763868747,3,1,-1,llm8_m3_k1,0,
2026-03-02T12:38:50.626574+00:00,A,llm_style,tune,llm_style_tune_000,4,2048,2048,bf16,NVIDIA GeForce RTX 4060,c00,32,32,32,2,2,8,0.0,200.445,124.41600114107132,291.9555249810219,0.2696954707775385,1,0,-1,4x2048x2048,0,
2026-03-02T12:38:50.834655+00:00,A,llm_style,tune,llm_style_tune_001,32,6144,1536,bf16,NVIDIA GeForce RTX 4060,c11,32,128,32,4,2,8,0.0,208.035,100.35199671983719,106.51647880673409,6.0186124416257645,2,0,-1,32x6144x1536,0,
2026-03-02T12:38:51.367784+00:00,A,llm_style,tune,llm_style_tune_002,4,8192,4096,bf16,NVIDIA GeForce RTX 4060,c11,32,128,32,4,2,8,0.0,533.086,294.3519949913025,325.4784017801284,0.9119539210458951,1,1,-1,4x8192x4096,0,
2026-03-02T12:38:51.437231+00:00,A,llm_style,tune,llm_style_tune_003,2,1536,1536,bf16,NVIDIA GeForce RTX 4060,c00,32,32,32,2,2,8,0.0,69.406,40.95999896526337,56.3814404606819,0.23040000582039372,0,0,-1,2x1536x1536,0,
2026-03-02T12:38:51.493624+00:00,A,llm_style,tune,llm_style_tune_004,16,1536,1536,bf16,NVIDIA GeForce RTX 4060,c04,64,64,64,4,3,8,0.0,56.351,38.91199827194214,45.941119492053986,1.940210612479343,2,0,-1,16x1536x1536,0,
2026-03-02T12:38:51.718930+00:00,A,llm_style,tune,llm_style_tune_005,16,3072,6144,bf16,NVIDIA GeForce RTX 4060,c04,64,64,64,4,3,8,0.0,225.265,179.19999361038208,192.37759664654732,3.370422977319839,2,1,-1,16x3072x6144,0,
2026-03-02T12:38:51.777505+00:00,A,llm_style,tune,llm_style_tune_006,16,1536,1024,bf16,NVIDIA GeForce RTX 4060,c00,32,32,32,2,2,8,0.0,58.534,15.359999611973763,566.8761667609199,3.276800082778933,2,0,-1,16x1536x1024,0,
2026-03-02T12:38:51.840900+00:00,A,llm_style,tune,llm_style_tune_007,64,2048,1536,bf16,NVIDIA GeForce RTX 4060,c03,64,64,32,4,2,8,0.0,63.357,46.08000069856644,58.98463908582923,8.738133200864441,3,0,-1,64x2048x1536,0,
2026-03-02T12:38:52.226407+00:00,A,llm_style,tune,llm_style_tune_008,2,8192,4096,bf16,NVIDIA GeForce RTX 4060,c11,32,128,32,4,2,8,0.0,385.467,293.5999929904938,396.4201664924618,0.45714486105027163,0,1,-1,2x8192x4096,0,
2026-03-02T12:38:52.786536+00:00,A,llm_style,tune,llm_style_tune_009,4,8192,6144,bf16,NVIDIA GeForce RTX 4060,c10,64,128,64,8,3,8,0.0,560.087,426.62400007247925,472.912634909153,0.9438127811177832,1,1,-1,4x8192x6144,0,
2026-03-02T12:38:53.023596+00:00,A,llm_style,tune,llm_style_tune_010,2,3072,6144,bf16,NVIDIA GeForce RTX 4060,c06,64,128,32,4,3,8,0.0,237.017,178.17600071430206,256.12287685275055,0.4237241362323375,0,1,-1,2x3072x6144,0,
2026-03-02T12:38:53.263497+00:00,A,llm_style,tune,llm_style_tune_011,32,6144,3072,bf16,NVIDIA GeForce RTX 4060,c11,32,128,32,4,2,8,0.0,239.857,180.91200292110443,297.67679587006535,6.67705587520796,2,1,-1,32x6144x3072,0,
2026-03-02T12:38:53.352686+00:00,A,llm_style,tune,llm_style_tune_012,8,6144,1024,bf16,NVIDIA GeForce RTX 4060,c11,32,128,32,4,2,8,0.0,89.144,42.89599880576134,63.67680151015517,2.3466826464588575,1,0,-1,8x6144x1024,0,
2026-03-02T12:38:53.457576+00:00,A,llm_style,tune,llm_style_tune_013,16,4096,2048,bf16,NVIDIA GeForce RTX 4060,c00,32,32,32,2,2,8,0.0,104.843,49.087999388575554,116.84864215552794,5.468453783889062,2,0,-1,16x4096x2048,0,
2026-03-02T12:38:53.673172+00:00,A,llm_style,tune,llm_style_tune_014,8,8192,2048,bf16,NVIDIA GeForce RTX 4060,c11,32,128,32,4,2,8,0.0,215.552,162.81600296497345,170.91424122452736,1.6487043724918637,1,0,-1,8x8192x2048,0,
2026-03-02T12:38:53.813607+00:00,A,llm_style,tune,llm_style_tune_015,16,1536,6144,bf16,NVIDIA GeForce RTX 4060,c04,64,64,64,4,3,8,0.0,140.393,71.72800227999687,100.24352021515361,4.2102091010586715,2,1,-1,16x1536x6144,0,
2026-03-02T12:38:53.878275+00:00,A,llm_style,tune,llm_style_tune_016,64,1536,1024,bf16,NVIDIA GeForce RTX 4060,c04,64,64,64,4,3,8,0.0,64.625,39.93599861860275,43.98527950048447,5.041230943608337,3,0,-1,64x1536x1024,0,
2026-03-02T12:38:53.936305+00:00,A,llm_style,tune,llm_style_tune_017,64,1536,1536,bf16,NVIDIA GeForce RTX 4060,c04,64,64,64,4,3,8,0.0,57.993,39.64800015091896,55.873599871993044,7.616774789408905,3,0,-1,64x1536x1536,0,
2026-03-02T12:38:54.046042+00:00,A,llm_style,tune,llm_style_tune_018,2,8192,1024,bf16,NVIDIA GeForce RTX 4060,c11,32,128,32,4,2,8,0.0,109.693,51.16799846291542,55.83872027695178,0.6557698758593996,0,0,-1,2x8192x1024,0,
2026-03-02T12:38:54.195211+00:00,A,llm_style,tune,llm_style_tune_019,64,1024,8192,bf16,NVIDIA GeForce RTX 4060,c04,64,64,64,4,3,8,0.0,149.125,86.01599931716919,100.52000030875203,12.483047718143249,3,1,-1,64x1024x8192,0,
2026-03-02T12:38:55.944861+00:00,A,llm_style,tune,llm_style_tune_020,1,2048,2048,bf16,NVIDIA GeForce RTX 4060,c00,32,32,32,2,2,8,0.0,1749.605,44.73600164055824,145.71520447731012,0.1875135839675663,0,0,-1,1x2048x2048,0,
2026-03-02T12:38:56.688276+00:00,A,llm_style,tune,llm_style_tune_021,64,6144,8192,bf16,NVIDIA GeForce RTX 4060,c11,32,128,32,4,2,8,0.0,743.369,436.2240135669708,491.2198373675345,14.768675597018525,3,1,-1,64x6144x8192,0,
2026-03-02T12:38:57.007429+00:00,A,llm_style,tune,llm_style_tune_022,2,4096,6144,bf16,NVIDIA GeForce RTX 4060,c11,32,128,32,4,2,8,0.0,319.108,227.183997631073,295.0761565566062,0.44309148993613723,0,1,-1,2x4096x6144,0,
2026-03-02T12:38:57.124792+00:00,A,llm_style,tune,llm_style_tune_023,64,8192,1024,bf16,NVIDIA GeForce RTX 4060,c06,64,128,32,4,3,8,0.0,117.317,65.31199812889099,97.41119913756845,16.440192533705787,3,0,-1,64x8192x1024,0,
2026-03-02T12:38:57.193089+00:00,A,llm_style,tune,llm_style_tune_024,8,1024,2048,bf16,NVIDIA GeForce RTX 4060,c04,64,64,64,4,3,8,0.0,68.255,46.08000069856644,59.05407946556803,0.7281777667387034,1,0,-1,8x1024x2048,0,
2026-03-02T12:38:57.210401+00:00,A,llm_style,tune,llm_style_tune_025,4,2048,2048,bf16,NVIDIA GeForce RTX 4060,c00,32,32,32,2,2,8,0.0,0.0,43.79200004041195,145.07967293262476,0.7662228710503161,1,0,-1,4x2048x2048,0,
2026-03-02T12:38:57.267264+00:00,A,llm_style,tune,llm_style_tune_026,4,3072,1024,bf16,NVIDIA GeForce RTX 4060,c00,32,32,32,2,2,8,0.0,56.816,31.74399957060814,127.71327823400483,0.7927742042720133,1,0,-1,4x3072x1024,0,
2026-03-02T12:38:57.332979+00:00,A,llm_style,tune,llm_style_tune_027,16,3072,1536,bf16,NVIDIA GeForce RTX 4060,c00,32,32,32,2,2,8,0.0,65.671,41.74400120973587,64.27647743374104,3.617165092568648,2,0,-1,16x3072x1536,0,
2026-03-02T12:38:57.426722+00:00,A,llm_style,tune,llm_style_tune_028,64,6144,1024,bf16,NVIDIA GeForce RTX 4060,c06,64,128,32,4,3,8,0.0,93.699,55.23199960589409,60.87296150624752,14.580431158499312,3,0,-1,64x6144x1024,0,
2026-03-02T12:38:57.537556+00:00,A,llm_style,tune,llm_style_tune_029,64,2048,4096,bf16,NVIDIA GeForce RTX 4060,c03,64,64,32,4,2,8,0.0,110.787,75.77600330114365,80.39423741400242,14.169945328639345,3,1,-1,64x2048x4096,0,
2026-03-02T12:38:57.764315+00:00,A,llm_style,tune,llm_style_tune_030,1,8192,2048,bf16,NVIDIA GeForce RTX 4060,c11,32,128,32,4,2,8,0.0,226.716,159.55200046300888,247.64031365513785,0.21030405073347472,0,0,-1,1x8192x2048,0,
2026-03-02T12:38:57.817106+00:00,A,llm_style,tune,llm_style_tune_031,64,1024,8192,bf16,NVIDIA GeForce RTX 4060,c04,64,64,64,4,3,8,0.0,0.0,83.96799862384796,144.9519968032837,12.787512404696566,3,1,-1,64x1024x8192,0,
2026-03-02T12:38:58.108562+00:00,A,llm_style,tune,llm_style_tune_032,4,6144,4096,bf16,NVIDIA GeForce RTX 4060,c11,32,128,32,4,2,8,0.0,291.401,227.32800245285034,263.1782357394694,0.8856216120658376,1,1,-1,4x6144x4096,0,
2026-03-02T12:38:58.186120+00:00,A,llm_style,tune,llm_style_tune_033,1,4096,1024,bf16,NVIDIA GeForce RTX 4060,c11,32,128,32,4,2,8,0.0,77.516,40.95999896526337,47.19200141727923,0.2048000051736833,0,0,-1,1x4096x1024,0,
2026-03-02T12:38:58.579758+00:00,A,llm_style,tune,llm_style_tune_034,4,4096,8192,bf16,NVIDIA GeForce RTX 4060,c00,32,32,32,2,2,8,0.0,393.594,292.86399483680725,308.216010928154,0.9165874287468502,1,1,-1,4x4096x8192,0,
2026-03-02T12:38:58.670293+00:00,A,llm_style,tune,llm_style_tune_035,32,1024,3072,bf16,NVIDIA GeForce RTX 4060,c04,64,64,64,4,3,8,0.0,90.484,50.9600006043911,62.97407872974872,3.950678760051902,2,1,-1,32x1024x3072,0,
2026-03-02T12:38:58.735222+00:00,A,llm_style,tune,llm_style_tune_036,16,2048,1536,bf16,NVIDIA GeForce RTX 4060,c11,32,128,32,4,2,8,0.0,64.885,44.943999499082565,52.15136002749204,2.2397494019653243,2,0,-1,16x2048x1536,0,
2026-03-02T12:38:58.971237+00:00,A,llm_style,tune,llm_style_tune_037,1,2048,8192,bf16,NVIDIA GeForce RTX 4060,c10,64,128,64,8,3,8,0.0,235.968,161.1199975013733,223.6505565047262,0.20825740144213944,0,1,-1,1x2048x8192,0,
2026-03-02T12:38:59.071012+00:00,A,llm_style,tune,llm_style_tune_038,64,3072,2048,bf16,NVIDIA GeForce RTX 4060,c10,64,128,64,8,3,8,0.0,99.732,56.49599991738796,66.59968156367538,14.254219222202812,3,0,-1,64x3072x2048,0,
2026-03-02T12:38:59.153603+00:00,A,llm_style,tune,llm_style_tune_039,64,1536,3072,bf16,NVIDIA GeForce RTX 4060,c04,64,64,64,4,3,8,0.0,82.548,49.855999648571014,68.25312245637176,12.114485322877512,3,1,-1,64x1536x3072,0,
2026-03-02T12:38:59.455947+00:00,A,llm_style,tune,llm_style_tune_040,8,8192,3072,bf16,NVIDIA GeForce RTX 4060,c10,64,128,64,8,3,8,0.0,302.297,228.30399870872498,234.27487939596176,1.7636711852503002,1,1,-1,8x8192x3072,0,
2026-03-02T12:38:59.552426+00:00,A,llm_style,tune,llm_style_tune_041,2,1024,4096,bf16,NVIDIA GeForce RTX 4060,c04,64,64,64,4,3,8,0.0,96.427,60.416001826524734,67.12320037186146,0.27769490685883513,0,1,-1,2x1024x4096,0,
2026-03-02T12:38:59.678306+00:00,A,llm_style,tune,llm_style_tune_042,64,1536,6144,bf16,NVIDIA GeForce RTX 4060,c04,64,64,64,4,3,8,0.0,125.835,72.49600067734718,81.39648094773291,16.662430212891056,3,1,-1,64x1536x6144,0,
2026-03-02T12:38:59.711225+00:00,A,llm_style,tune,llm_style_tune_043,16,3072,1536,bf16,NVIDIA GeForce RTX 4060,c00,32,32,32,2,2,8,0.0,0.0,51.58399976789951,109.23007972538468,2.927166266272424,2,0,-1,16x3072x1536,0,
2026-03-02T12:38:59.782570+00:00,A,llm_style,tune,llm_style_tune_044,8,4096,1024,bf16,NVIDIA GeForce RTX 4060,c02,32,64,32,2,2,8,0.0,71.285,40.95999896526337,84.73439998924721,1.6384000413894664,1,0,-1,8x4096x1024,0,
2026-03-02T12:38:59.934011+00:00,A,llm_style,tune,llm_style_tune_045,32,3072,4096,bf16,NVIDIA GeForce RTX 4060,c04,64,64,64,4,3,8,0.0,151.389,81.69599995017052,90.08544035255909,9.857353707539989,2,1,-1,32x3072x4096,0,
2026-03-02T12:39:00.163918+00:00,A,llm_style,tune,llm_style_tune_046,64,4096,4096,bf16,NVIDIA GeForce RTX 4060,c03,64,64,32,4,2,8,0.0,229.859,165.8879965543747,281.1318373680115,12.945382984935252,3,1,-1,64x4096x4096,0,
2026-03-02T12:39:00.326903+00:00,A,llm_style,tune,llm_style_tune_047,4,4096,8192,bf16,NVIDIA GeForce RTX 4060,c00,32,32,32,2,2,8,0.0,0.0,291.3279980421066,317.00800597667694,0.9214200413418628,1,1,-1,4x4096x8192,0,
2026-03-02T12:39:00.541827+00:00,A,llm_style,tune,llm_style_tune_048,2,4096,4096,bf16,NVIDIA GeForce RTX 4060,c02,32,64,32,2,2,8,0.0,214.87,160.73600202798843,175.16543969511986,0.41750984940084895,0,1,-1,2x4096x4096,0,
2026-03-02T12:39:00.628519+00:00,A,llm_style,tune,llm_style_tune_049,2,3072,2048,bf16,NVIDIA GeForce RTX 4060,c11,32,128,32,4,2,8,0.0,86.638,52.97600105404854,57.41887915879487,0.4750419718227632,0,0,-1,2x3072x2048,0,
2026-03-02T12:39:00.725090+00:00,A,llm_style,tune,llm_style_tune_050,4,8192,1024,bf16,NVIDIA GeForce RTX 4060,c00,32,32,32,2,2,8,0.0,96.529,49.00800064206123,173.88416171073902,1.3693450685764899,1,0,-1,4x8192x1024,0,
2026-03-02T12:39:01.152389+00:00,A,llm_style,tune,llm_style_tune_051,1,8192,4096,bf16,NVIDIA GeForce RTX 4060,c10,64,128,64,8,3,8,0.0,427.255,292.7680015563965,353.90463680028915,0.22922199025590126,0,1,-1,1x8192x4096,0,
2026-03-02T12:39:01.548788+00:00,A,llm_style,tune,llm_style_tune_052,8,4096,8192,bf16,NVIDIA GeForce RTX 4060,c11,32,128,32,4,2,8,0.0,396.355,292.7680015563965,319.56990897655487,1.83377592204721,1,1,-1,8x4096x8192,0,
2026-03-02T12:39:01.635896+00:00,A,llm_style,tune,llm_style_tune_053,64,4096,1024,bf16,NVIDIA GeForce RTX 4060,c04,64,64,64,4,3,8,0.0,87.055,49.12000149488449,53.247999399900436,10.92978207779394,3,0,-1,64x4096x1024,0,
2026-03-02T12:39:01.701017+00:00,A,llm_style,tune,llm_style_tune_054,1,2048,1536,bf16,NVIDIA GeForce RTX 4060,c00,32,32,32,2,2,8,0.0,65.08,40.81599973142147,97.04992104321703,0.15414190614952974,0,0,-1,1x2048x1536,0,
2026-03-02T12:39:01.861932+00:00,A,llm_style,tune,llm_style_tune_055,64,6144,2048,bf16,NVIDIA GeForce RTX 4060,c10,64,128,64,8,3,8,0.0,160.873,104.84800115227699,115.27168177068232,15.361406209936337,3,0,-1,64x6144x2048,0,
2026-03-02T12:39:01.972568+00:00,A,llm_style,tune,llm_style_tune_056,16,1536,4096,bf16,NVIDIA GeForce RTX 4060,c04,64,64,64,4,3,8,0.0,110.59,58.36800113320351,79.4691176712513,3.4492630909279565,2,1,-1,16x1536x4096,0,
2026-03-02T12:39:02.191150+00:00,A,llm_style,tune,llm_style_tune_057,16,4096,4096,bf16,NVIDIA GeForce RTX 4060,c11,32,128,32,4,2,8,0.0,218.535,161.79199516773224,211.93664446473122,3.3182785801202197,2,1,-1,16x4096x4096,0,
2026-03-02T12:39:02.479017+00:00,A,llm_style,tune,llm_style_tune_058,1,3072,8192,bf16,NVIDIA GeForce RTX 4060,c06,64,128,32,4,3,8,0.0,287.821,226.01599991321564,276.3721564412116,0.22269064145602996,0,1,-1,1x3072x8192,0,
2026-03-02T12:39:02.526690+00:00,A,llm_style,tune,llm_style_tune_059,64,1024,8192,bf16,NVIDIA GeForce RTX 4060,c04,64,64,64,4,3,8,0.0,0.0,84.99199897050858,157.85984113812444,12.633445936158983,3,1,-1,64x1024x8192,0,
2026-03-02T12:39:02.635211+00:00,A,llm_style,tune,llm_style_tune_060,16,3072,3072,bf16,NVIDIA GeForce RTX 4060,c00,32,32,32,2,2,8,0.0,108.47,57.34400078654289,142.27296248078335,5.266285642052185,2,1,-1,16x3072x3072,0,
2026-03-02T12:39:02.695840+00:00,A,llm_style,tune,llm_style_tune_061,1,1024,1536,bf16,NVIDIA GeForce RTX 4060,c04,64,64,64,4,3,8,0.0,60.587,40.04799947142601,49.694720022380345,0.07854894230720455,0,0,-1,1x1024x1536,0,
2026-03-02T12:39:02.773018+00:00,A,llm_style,tune,llm_style_tune_062,32,6144,1024,bf16,NVIDIA GeForce RTX 4060,c11,32,128,32,4,2,8,0.0,77.139,40.95999896526337,63.472960405051694,9.8304002483368,2,0,-1,32x6144x1024,0,
2026-03-02T12:39:02.856441+00:00,A,llm_style,tune,llm_style_tune_063,4,1536,3072,bf16,NVIDIA GeForce RTX 4060,c04,64,64,64,4,3,8,0.0,83.374,52.22399905323982,60.214079990983,0.722823542515712,1,1,-1,4x1536x3072,0,
2026-03-02T12:39:02.949316+00:00,A,llm_style,eval,llm_style_eval_000,32,8192,1024,bf16,NVIDIA GeForce RTX 4060,c11,32,128,32,4,2,8,0.0,92.827,48.128001391887665,62.08992037922141,11.155063507176793,2,0,-1,32x8192x1024,0,
2026-03-02T12:39:02.981522+00:00,A,llm_style,eval,llm_style_eval_001,2,3072,2048,bf16,NVIDIA GeForce RTX 4060,c11,32,128,32,4,2,8,0.0,0.0,62.44800053536892,180.837440341711,0.4029884669525445,0,0,-1,2x3072x2048,0,
2026-03-02T12:39:03.039833+00:00,A,llm_style,eval,llm_style_eval_002,32,1536,1536,bf16,NVIDIA GeForce RTX 4060,c04,64,64,64,4,3,8,0.0,58.264,38.91199827194214,56.015039905905674,3.880421224958686,2,0,-1,32x1536x1536,0,
2026-03-02T12:39:03.631811+00:00,A,llm_style,eval,llm_style_eval_003,16,8192,6144,bf16,NVIDIA GeForce RTX 4060,c11,32,128,32,4,2,8,0.0,591.938,427.0080029964447,500.3878453373908,3.771856088639655,2,1,-1,16x8192x6144,0,
2026-03-02T12:39:03.712818+00:00,A,llm_style,eval,llm_style_eval_004,2,3072,1536,bf16,NVIDIA GeForce RTX 4060,c00,32,32,32,2,2,8,0.0,80.947,41.7919997125864,173.99039834737778,0.4516263430753147,0,0,-1,2x3072x1536,0,
2026-03-02T12:39:04.010627+00:00,A,llm_style,eval,llm_style_eval_005,8,3072,8192,bf16,NVIDIA GeForce RTX 4060,c06,64,128,32,4,3,8,0.0,297.767,227.60000079870224,263.33184719085693,1.7691264612785356,1,1,-1,8x3072x8192,0,
2026-03-02T12:39:04.193694+00:00,A,llm_style,eval,llm_style_eval_006,64,2048,6144,bf16,NVIDIA GeForce RTX 4060,c04,64,64,64,4,3,8,0.0,183.024,112.30399832129478,128.50240506231782,14.341544024034983,3,1,-1,64x2048x6144,0,
2026-03-02T12:39:04.281791+00:00,A,llm_style,eval,llm_style_eval_007,8,3072,2048,bf16,NVIDIA GeForce RTX 4060,c11,32,128,32,4,2,8,0.0,88.049,52.352000027894974,60.87103966623545,1.9228166248923266,1,0,-1,8x3072x2048,0,
2026-03-02T12:39:04.363319+00:00,A,llm_style,eval,llm_style_eval_008,16,3072,2048,bf16,NVIDIA GeForce RTX 4060,c00,32,32,32,2,2,8,0.0,81.484,48.46400022506714,123.84287662804127,4.154147224022738,2,0,-1,16x3072x2048,0,
2026-03-02T12:39:04.807854+00:00,A,llm_style,eval,llm_style_eval_009,64,6144,6144,bf16,NVIDIA GeForce RTX 4060,c10,64,128,64,8,3,8,0.0,444.494,333.42400193214417,408.23936253786064,14.491572832190222,3,1,-1,64x6144x6144,0,
2026-03-02T12:39:04.865140+00:00,A,llm_style,eval,llm_style_eval_010,64,1536,6144,bf16,NVIDIA GeForce RTX 4060,c04,64,64,64,4,3,8,0.0,0.0,78.12799885869026,198.92159909009925,15.461288777981254,3,1,-1,64x1536x6144,0,
2026-03-02T12:39:05.275459+00:00,A,llm_style,eval,llm_style_eval_011,32,4096,8192,bf16,NVIDIA GeForce RTX 4060,c02,32,64,32,2,2,8,0.0,410.262,296.9599962234497,365.3715163469313,7.231558712656065,2,1,-1,32x4096x8192,0,
2026-03-02T12:39:05.340312+00:00,A,llm_style,eval,llm_style_eval_012,32,1536,1024,bf16,NVIDIA GeForce RTX 4060,c00,32,32,32,2,2,8,0.0,64.811,24.063999764621258,125.99424116313456,4.183148977087115,2,0,-1,32x1536x1024,0,
2026-03-02T12:39:05.506041+00:00,A,llm_style,eval,llm_style_eval_013,32,2048,6144,bf16,NVIDIA GeForce RTX 4060,c06,64,128,32,4,3,8,0.0,165.687,105.16800358891487,111.57855994999409,7.657332463472593,2,1,-1,32x2048x6144,0,
2026-03-02T12:39:05.551370+00:00,A,llm_style,eval,llm_style_eval_014,2,8192,1024,bf16,NVIDIA GeForce RTX 4060,c11,32,128,32,4,2,8,0.0,0.0,55.296000093221664,85.73984228074545,0.6068148137918061,0,0,-1,2x8192x1024,0,
2026-03-02T12:39:05.630900+00:00,A,llm_style,eval,llm_style_eval_015,32,2048,2048,bf16,NVIDIA GeForce RTX 4060,c00,32,32,32,2,2,8,0.0,79.462,51.632000133395195,129.77152287960047,5.199013311637677,2,0,-1,32x2048x2048,0,
2026-03-02T12:39:05.847371+00:00,A,llm_style,eval,llm_style_eval_016,32,4096,4096,bf16,NVIDIA GeForce RTX 4060,c03,64,64,32,4,2,8,0.0,216.423,161.79199516773224,180.83647757768628,6.636557160240439,2,1,-1,32x4096x4096,0,
2026-03-02T12:39:06.432277+00:00,A,llm_style,eval,llm_style_eval_017,8,8192,6144,bf16,NVIDIA GeForce RTX 4060,c11,32,128,32,4,2,8,0.0,584.864,428.0320107936859,452.17152059078217,1.881416220498898,1,1,-1,8x8192x6144,0,
2026-03-02T12:39:06.527271+00:00,A,llm_style,eval,llm_style_eval_018,8,2048,2048,bf16,NVIDIA GeForce RTX 4060,c00,32,32,32,2,2,8,0.0,94.948,51.19999870657921,193.60863894224156,1.310720033111573,1,0,-1,8x2048x2048,0,
2026-03-02T12:39:06.583916+00:00,A,llm_style,eval,llm_style_eval_019,32,3072,1024,bf16,NVIDIA GeForce RTX 4060,c00,32,32,32,2,2,8,0.0,56.596,37.88800165057182,133.05311627686015,5.313729498239754,2,0,-1,32x3072x1024,0,
2026-03-02T12:39:06.603658+00:00,A,llm_style,eval,llm_style_eval_020,64,1536,3072,bf16,NVIDIA GeForce RTX 4060,c04,64,64,64,4,3,8,0.0,0.0,51.183998584747314,71.62208132445812,11.800167878638232,3,1,-1,64x1536x3072,0,
2026-03-02T12:39:06.632894+00:00,A,llm_style,eval,llm_style_eval_021,64,6144,1024,bf16,NVIDIA GeForce RTX 4060,c06,64,128,32,4,3,8,0.0,0.0,59.1839998960495,83.25536191463465,13.60682565244722,3,0,-1,64x6144x1024,0,
2026-03-02T12:39:06.674246+00:00,A,llm_style,eval,llm_style_eval_022,32,6144,1536,bf16,NVIDIA GeForce RTX 4060,c11,32,128,32,4,2,8,0.0,0.0,49.96800050139427,106.39103785157204,12.087331290815747,2,0,-1,32x6144x1536,0,
2026-03-02T12:39:06.765181+00:00,A,llm_style,eval,llm_style_eval_023,8,1024,4096,bf16,NVIDIA GeForce RTX 4060,c04,64,64,64,4,3,8,0.0,90.882,56.09599873423576,57.34400078654289,1.196321761164099,1,1,-1,8x1024x4096,0,
2026-03-02T12:39:07.567020+00:00,A,llm_style,eval,llm_style_eval_024,64,8192,8192,bf16,NVIDIA GeForce RTX 4060,c06,64,128,32,4,3,8,0.0,801.792,575.408011674881,645.552000403404,14.928423688430522,3,1,-1,64x8192x8192,0,
2026-03-02T12:39:07.786061+00:00,A,llm_style,eval,llm_style_eval_025,2,8192,2048,bf16,NVIDIA GeForce RTX 4060,c02,32,64,32,2,2,8,0.0,218.992,160.76800227165222,171.00415781140327,0.4174267456941158,0,0,-1,2x8192x2048,0,
2026-03-02T12:39:07.868626+00:00,A,llm_style,eval,llm_style_eval_026,32,4096,1024,bf16,NVIDIA GeForce RTX 4060,c11,32,128,32,4,2,8,0.0,82.523,41.98399931192398,48.73215969651936,6.393756202348283,2,0,-1,32x4096x1024,0,
2026-03-02T12:39:07.957708+00:00,A,llm_style,eval,llm_style_eval_027,8,4096,1536,bf16,NVIDIA GeForce RTX 4060,c11,32,128,32,4,2,8,0.0,89.037,46.720001846551895,55.83872027695178,2.154608134019783,1,0,-1,8x4096x1536,0,
2026-03-02T12:39:07.977587+00:00,A,llm_style,eval,llm_style_eval_028,2,1536,1536,bf16,NVIDIA GeForce RTX 4060,c00,32,32,32,2,2,8,0.0,0.0,44.99199986457825,103.97344149649142,0.20975248996277224,0,0,-1,2x1536x1536,0,
2026-03-02T12:39:08.278216+00:00,A,llm_style,eval,llm_style_eval_029,16,3072,8192,bf16,NVIDIA GeForce RTX 4060,c10,64,128,64,8,3,8,0.0,300.581,229.0079966187477,249.16607722640038,3.51649889912217,2,1,-1,16x3072x8192,0,
2026-03-02T12:39:08.301657+00:00,A,llm_style,eval,llm_style_eval_030,2,1536,1536,bf16,NVIDIA GeForce RTX 4060,c00,32,32,32,2,2,8,0.0,0.0,57.69599974155426,325.9231975674628,0.16356738841987822,0,0,-1,2x1536x1536,0,
2026-03-02T12:39:08.414062+00:00,A,llm_style,eval,llm_style_eval_031,64,4096,2048,bf16,NVIDIA GeForce RTX 4060,c04,64,64,64,4,3,8,0.0,112.354,69.63200122117996,80.2217597514391,15.420235023683334,3,0,-1,64x4096x2048,0,
2026-03-02T12:39:08.816402+00:00,A,llm_style,eval,llm_style_eval_032,64,8192,4096,bf16,NVIDIA GeForce RTX 4060,c00,32,32,32,2,2,8,0.0,402.299,303.52000892162323,425.7292866706848,14.150524412738378,3,1,-1,64x8192x4096,0,
2026-03-02T12:39:08.981235+00:00,A,llm_style,eval,llm_style_eval_033,32,4096,3072,bf16,NVIDIA GeForce RTX 4060,c00,32,32,32,2,2,8,0.0,164.785,83.93599838018417,201.7020797729491,9.594290692205773,2,1,-1,32x4096x3072,0,
2026-03-02T12:39:09.282020+00:00,A,llm_style,eval,llm_style_eval_034,64,6144,4096,bf16,NVIDIA GeForce RTX 4060,c06,64,128,32,4,3,8,0.0,300.734,232.44799673557281,365.028152167797,13.857832793734023,3,1,-1,64x6144x4096,0,
2026-03-02T12:39:09.564569+00:00,A,llm_style,eval,llm_style_eval_035,64,6144,8192,bf16,NVIDIA GeForce RTX 4060,c11,32,128,32,4,2,8,0.0,0.0,433.83999168872833,533.8930994272232,14.849831890607108,3,1,-1,64x6144x8192,0,
2026-03-02T12:39:09.780590+00:00,A,llm_style,eval,llm_style_eval_036,4,8192,2048,bf16,NVIDIA GeForce RTX 4060,c11,32,128,32,4,2,8,0.0,215.969,161.79199516773224,209.30399879813183,0.8295696450300549,1,0,-1,4x8192x2048,0,
2026-03-02T12:39:09.833756+00:00,A,llm_style,eval,llm_style_eval_037,64,2048,4096,bf16,NVIDIA GeForce RTX 4060,c03,64,64,32,4,2,8,0.0,0.0,78.52800190448761,180.22432051599003,13.673362341575627,3,1,-1,64x2048x4096,0,
2026-03-02T12:39:09.879422+00:00,A,llm_style,eval,llm_style_eval_038,64,4096,2048,bf16,NVIDIA GeForce RTX 4060,c04,64,64,64,4,3,8,0.0,0.0,73.72800260782242,160.11391699314117,14.563555040430158,3,0,-1,64x4096x2048,0,
2026-03-02T12:39:09.950089+00:00,A,llm_style,eval,llm_style_eval_039,64,6144,2048,bf16,NVIDIA GeForce RTX 4060,c10,64,128,64,8,3,8,0.0,0.0,112.64000087976456,167.14560404419893,14.298763524684434,3,0,-1,64x6144x2048,0,
2026-03-02T12:39:10.178124+00:00,A,llm_style,eval,llm_style_eval_040,8,6144,3072,bf16,NVIDIA GeForce RTX 4060,c11,32,128,32,4,2,8,0.0,227.983,177.15199291706085,192.95296072959897,1.704693709776022,1,1,-1,8x6144x3072,0,
2026-03-02T12:39:10.325779+00:00,A,llm_style,eval,llm_style_eval_041,2,8192,1536,bf16,NVIDIA GeForce RTX 4060,c11,32,128,32,4,2,8,0.0,147.613,60.816001147031784,77.35583923757073,0.8276053513994731,0,0,-1,2x8192x1536,0,
2026-03-02T12:39:10.342810+00:00,A,llm_style,eval,llm_style_eval_042,32,1536,1536,bf16,NVIDIA GeForce RTX 4060,c04,64,64,64,4,3,8,0.0,0.0,34.56000052392483,95.65696187317371,4.3690666004322205,2,0,-1,32x1536x1536,0,
2026-03-02T12:39:10.362271+00:00,A,llm_style,eval,llm_style_eval_043,64,1536,3072,bf16,NVIDIA GeForce RTX 4060,c04,64,64,64,4,3,8,0.0,0.0,54.19199913740158,99.23551879823196,11.145183525498554,3,1,-1,64x1536x3072,0,
2026-03-02T12:39:10.414238+00:00,A,llm_style,eval,llm_style_eval_044,2,1536,1024,bf16,NVIDIA GeForce RTX 4060,c00,32,32,32,2,2,8,0.0,51.923,31.74399957060814,90.05503997206688,0.19819355106800332,0,0,-1,2x1536x1024,0,
2026-03-02T12:39:10.571017+00:00,A,llm_style,eval,llm_style_eval_045,64,4096,3072,bf16,NVIDIA GeForce RTX 4060,c04,64,64,64,4,3,8,0.0,156.735,95.23200243711472,110.755840241909,16.91251569621828,3,1,-1,64x4096x3072,0,
2026-03-02T12:39:10.620180+00:00,A,llm_style,eval,llm_style_eval_046,64,2048,4096,bf16,NVIDIA GeForce RTX 4060,c03,64,64,32,4,2,8,0.0,0.0,78.84799689054489,144.46591675281525,13.617870666905405,3,1,-1,64x2048x4096,0,
2026-03-02T12:39:10.855823+00:00,A,llm_style,eval,llm_style_eval_047,2,6144,3072,bf16,NVIDIA GeForce RTX 4060,c10,64,128,64,8,3,8,0.0,235.589,177.15199291706085,232.59136423468587,0.4261734274440055,0,1,-1,2x6144x3072,0,
2026-03-02T12:39:11.258495+00:00,A,llm_style,eval,llm_style_eval_048,16,4096,8192,bf16,NVIDIA GeForce RTX 4060,c02,32,64,32,2,2,8,0.0,402.629,294.9120104312897,324.25760567188263,3.6408887601075395,2,1,-1,16x4096x8192,0,
2026-03-02T12:39:11.359537+00:00,A,llm_style,eval,llm_style_eval_049,16,2048,3072,bf16,NVIDIA GeForce RTX 4060,c02,32,64,32,2,2,8,0.0,100.996,63.19999694824219,72.1084812283516,3.1855474955936627,2,1,-1,16x2048x3072,0,
2026-03-02T12:39:11.426252+00:00,A,llm_style,eval,llm_style_eval_050,16,1024,1536,bf16,NVIDIA GeForce RTX 4060,c04,64,64,64,4,3,8,0.0,66.673,44.97599974274635,88.78079812973724,1.119077914618616,2,0,-1,16x1024x1536,0,
2026-03-02T12:39:11.537036+00:00,A,llm_style,eval,llm_style_eval_051,4,2048,4096,bf16,NVIDIA GeForce RTX 4060,c00,32,32,32,2,2,8,0.0,110.744,59.39200147986412,140.9740793704986,1.1299310063283885,1,1,-1,4x2048x4096,0,
2026-03-02T12:39:11.659137+00:00,A,llm_style,eval,llm_style_eval_052,4,1024,6144,bf16,NVIDIA GeForce RTX 4060,c04,64,64,64,4,3,8,0.0,122.055,71.407999843359,112.07840293645846,0.7048460692136427,1,1,-1,4x1024x6144,0,
2026-03-02T12:39:11.733789+00:00,A,llm_style,eval,llm_style_eval_053,64,6144,2048,bf16,NVIDIA GeForce RTX 4060,c10,64,128,64,8,3,8,0.0,0.0,117.71200224757195,217.64479443430895,13.682655168948349,3,0,-1,64x6144x2048,0,
2026-03-02T12:39:11.759862+00:00,A,llm_style,eval,llm_style_eval_054,2,3072,2048,bf16,NVIDIA GeForce RTX 4060,c11,32,128,32,4,2,8,0.0,0.0,59.23200026154518,106.61184109747404,0.4248687177349682,0,0,-1,2x3072x2048,0,
2026-03-02T12:39:11.813469+00:00,A,llm_style,eval,llm_style_eval_055,4,1024,1024,bf16,NVIDIA GeForce RTX 4060,c04,64,64,64,4,3,8,0.0,53.542,41.98399931192398,66.71359941363329,0.19980488132338384,1,0,-1,4x1024x1024,0,
2026-03-02T12:39:11.881608+00:00,A,llm_style,eval,llm_style_eval_056,2,1024,1024,bf16,NVIDIA GeForce RTX 4060,c00,32,32,32,2,2,8,0.0,68.097,38.72000053524971,97.24607817828652,0.10832396544472182,0,0,-1,2x1024x1024,0,
2026-03-02T12:39:11.996932+00:00,A,llm_style,eval,llm_style_eval_057,2,1024,6144,bf16,NVIDIA GeForce RTX 4060,c04,64,64,64,4,3,8,0.0,115.287,70.65600156784058,78.3872003853321,0.35617390514006025,0,1,-1,2x1024x6144,0,
2026-03-02T12:39:12.060221+00:00,A,llm_style,eval,llm_style_eval_058,2,2048,1536,bf16,NVIDIA GeForce RTX 4060,c00,32,32,32,2,2,8,0.0,63.244,39.93599861860275,114.27615951746681,0.31507693397552106,0,0,-1,2x2048x1536,0,
2026-03-02T12:39:12.330490+00:00,A,llm_style,eval,llm_style_eval_059,8,8192,6144,bf16,NVIDIA GeForce RTX 4060,c11,32,128,32,4,2,8,0.0,0.0,425.6479889154434,558.2316744327545,1.891953889062018,1,1,-1,8x8192x6144,0,
2026-03-02T12:39:12.720231+00:00,A,llm_style,eval,llm_style_eval_060,1,4096,8192,bf16,NVIDIA GeForce RTX 4060,c11,32,128,32,4,2,8,0.0,389.688,291.83998703956604,346.3251250982284,0.2299508874049592,0,1,-1,1x4096x8192,0,
2026-03-02T12:39:12.807678+00:00,A,llm_style,eval,llm_style_eval_061,32,1536,3072,bf16,NVIDIA GeForce RTX 4060,c04,64,64,64,4,3,8,0.0,87.401,50.83199962973595,61.22272036969662,5.9409405531892645,2,1,-1,32x1536x3072,0,
2026-03-02T12:39:12.830304+00:00,A,llm_style,eval,llm_style_eval_062,8,6144,1024,bf16,NVIDIA GeForce RTX 4060,c11,32,128,32,4,2,8,0.0,0.0,40.303999558091164,138.02271455526346,2.4976006625573595,1,0,-1,8x6144x1024,0,
2026-03-02T12:39:12.997719+00:00,A,llm_style,eval,llm_style_eval_063,64,8192,4096,bf16,NVIDIA GeForce RTX 4060,c00,32,32,32,2,2,8,0.0,0.0,329.1199952363968,356.311357319355,13.049852206381617,3,1,-1,64x8192x4096,0,
2026-03-02T12:39:13.091900+00:00,A,llm_style,eval,llm_style_eval_064,16,6144,1024,bf16,NVIDIA GeForce RTX 4060,c11,32,128,32,4,2,8,0.0,94.125,39.93599861860275,68.99712085723868,5.041230943608337,2,0,-1,16x6144x1024,0,
2026-03-02T12:39:13.500329+00:00,A,llm_style,eval,llm_style_eval_065,8,8192,4096,bf16,NVIDIA GeForce RTX 4060,c11,32,128,32,4,2,8,0.0,408.385,294.94400322437286,311.4393612742424,1.8202469151121745,1,1,-1,8x8192x4096,0,
2026-03-02T12:39:13.529881+00:00,A,llm_style,eval,llm_style_eval_066,32,1536,3072,bf16,NVIDIA GeForce RTX 4060,c04,64,64,64,4,3,8,0.0,0.0,52.73599922657013,106.63487955927849,5.7264466859262155,2,1,-1,32x1536x3072,0,
2026-03-02T12:39:13.651758+00:00,A,llm_style,eval,llm_style_eval_067,8,8192,3072,bf16,NVIDIA GeForce RTX 4060,c10,64,128,64,8,3,8,0.0,0.0,229.312002658844,295.12640297412867,1.7559184836872326,1,1,-1,8x8192x3072,0,
2026-03-02T12:39:13.672358+00:00,A,llm_style,eval,llm_style_eval_068,64,1536,3072,bf16,NVIDIA GeForce RTX 4060,c04,64,64,64,4,3,8,0.0,0.0,44.03200000524521,118.75615835189818,13.71683720766834,3,1,-1,64x1536x3072,0,
2026-03-02T12:39:14.246406+00:00,A,llm_style,eval,llm_style_eval_069,64,8192,6144,bf16,NVIDIA GeForce RTX 4060,c04,64,64,64,4,3,8,0.0,574.0,443.0080056190491,493.62944304943085,14.542515851372638,3,1,-1,64x8192x6144,0,
2026-03-02T12:39:14.351342+00:00,A,llm_style,eval,llm_style_eval_070,8,8192,1024,bf16,NVIDIA GeForce RTX 4060,c00,32,32,32,2,2,8,0.0,104.89,46.99200019240379,155.11231541633603,2.8561824874544532,1,0,-1,8x8192x1024,0,
2026-03-02T12:39:14.444488+00:00,A,llm_style,eval,llm_style_eval_071,2,6144,3072,bf16,NVIDIA GeForce RTX 4060,c10,64,128,64,8,3,8,0.0,0.0,180.2240014076233,236.15776553750035,0.4189090876372393,0,1,-1,2x6144x3072,0,
2026-03-02T12:39:14.495314+00:00,A,llm_style,eval,llm_style_eval_072,64,1024,1024,bf16,NVIDIA GeForce RTX 4060,c04,64,64,64,4,3,8,0.0,50.776,35.840000957250595,60.95263976603745,3.7449141856913686,3,0,-1,64x1024x1024,0,
2026-03-02T12:39:14.579685+00:00,A,llm_style,eval,llm_style_eval_073,1,8192,2048,bf16,NVIDIA GeForce RTX 4060,c11,32,128,32,4,2,8,0.0,0.0,163.7759953737259,250.15872329473493,0.2048800370495751,0,0,-1,1x8192x2048,0,
2026-03-02T12:39:14.635867+00:00,A,llm_style,eval,llm_style_eval_074,64,1024,1536,bf16,NVIDIA GeForce RTX 4060,c00,32,32,32,2,2,8,0.0,56.132,36.86400130391121,74.09632135182613,5.46133314016131,3,0,-1,64x1024x1536,0,
2026-03-02T12:39:14.699289+00:00,A,llm_style,eval,llm_style_eval_075,2,1536,2048,bf16,NVIDIA GeForce RTX 4060,c04,64,64,64,4,3,8,0.0,63.379,40.97599908709526,57.02592059969898,0.30708005369813635,0,0,-1,2x1536x2048,0,
2026-03-02T12:39:14.802401+00:00,A,llm_style,eval,llm_style_eval_076,64,2048,3072,bf16,NVIDIA GeForce RTX 4060,c11,32,128,32,4,2,8,0.0,103.075,66.3519985973835,71.7004819214344,12.136881857719297,3,1,-1,64x2048x3072,0,
2026-03-02T12:39:14.922302+00:00,A,llm_style,eval,llm_style_eval_077,1,3072,8192,bf16,NVIDIA GeForce RTX 4060,c06,64,128,32,4,3,8,0.0,0.0,227.32800245285034,236.54399812221527,0.2214054030164594,0,1,-1,1x3072x8192,0,
2026-03-02T12:39:14.983861+00:00,A,llm_style,eval,llm_style_eval_078,1,1024,2048,bf16,NVIDIA GeForce RTX 4060,c04,64,64,64,4,3,8,0.0,61.505,43.36000047624111,118.04672043770525,0.09673210225858385,0,0,-1,1x1024x2048,0,
2026-03-02T12:39:15.054397+00:00,A,llm_style,eval,llm_style_eval_079,64,1536,2048,bf16,NVIDIA GeForce RTX 4060,c04,64,64,64,4,3,8,0.0,70.489,48.128001391887665,65.07136102765796,8.366297630382595,3,0,-1,64x1536x2048,0,
2026-03-02T12:39:15.108619+00:00,A,llm_style,eval,llm_style_eval_080,4,1536,1024,bf16,NVIDIA GeForce RTX 4060,c04,64,64,64,4,3,8,0.0,54.178,36.59199923276901,52.32640091329811,0.3438705800127942,1,0,-1,4x1536x1024,0,
2026-03-02T12:39:15.415172+00:00,A,llm_style,eval,llm_style_eval_081,4,4096,6144,bf16,NVIDIA GeForce RTX 4060,c00,32,32,32,2,2,8,0.0,306.51,226.3839989900589,310.5884763598441,0.8893145845031246,1,1,-1,4x4096x6144,0,
2026-03-02T12:39:15.500561+00:00,A,llm_style,eval,llm_style_eval_082,64,1024,2048,bf16,NVIDIA GeForce RTX 4060,c04,64,64,64,4,3,8,0.0,85.342,44.80000026524067,66.70336205512282,5.9918628216677305,3,0,-1,64x1024x2048,0,
2026-03-02T12:39:15.732251+00:00,A,llm_style,eval,llm_style_eval_083,8,4096,4096,bf16,NVIDIA GeForce RTX 4060,c00,32,32,32,2,2,8,0.0,231.643,160.76800227165222,294.5120099186896,1.6697069827764632,1,1,-1,8x4096x4096,0,
2026-03-02T12:39:15.845626+00:00,A,llm_style,eval,llm_style_eval_084,64,3072,3072,bf16,NVIDIA GeForce RTX 4060,c03,64,64,32,4,2,8,0.0,113.327,64.51199948787689,111.42144031822676,18.72457157721487,3,1,-1,64x3072x3072,0,
2026-03-02T12:39:15.974118+00:00,A,llm_style,eval,llm_style_eval_085,1,3072,8192,bf16,NVIDIA GeForce RTX 4060,c06,64,128,32,4,3,8,0.0,0.0,231.4240038394928,366.1171168088912,0.2174867220554536,0,1,-1,1x3072x8192,0,
2026-03-02T12:39:16.036364+00:00,A,llm_style,eval,llm_style_eval_086,8,1536,1024,bf16,NVIDIA GeForce RTX 4060,c04,64,64,64,4,3,8,0.0,62.195,40.04799947142601,141.07711706310477,0.6283915384576364,1,0,-1,8x1536x1024,0,
2026-03-02T12:39:16.112635+00:00,A,llm_style,eval,llm_style_eval_087,16,1024,3072,bf16,NVIDIA GeForce RTX 4060,c00,32,32,32,2,2,8,0.0,76.225,44.03200000524521,53.169598802924156,2.28613953461139,2,1,-1,16x1024x3072,0,
2026-03-02T12:39:16.201774+00:00,A,llm_style,eval,llm_style_eval_088,8,8192,2048,bf16,NVIDIA GeForce RTX 4060,c11,32,128,32,4,2,8,0.0,0.0,167.2319993376732,216.1343942582606,1.605168012480541,1,0,-1,8x8192x2048,0,
2026-03-02T12:39:16.328683+00:00,A,llm_style,eval,llm_style_eval_089,64,6144,4096,bf16,NVIDIA GeForce RTX 4060,c06,64,128,32,4,3,8,0.0,0.0,220.49599885940552,326.9356715679168,14.608997390714306,3,1,-1,64x6144x4096,0,
2026-03-02T12:39:16.462641+00:00,A,llm_style,eval,llm_style_eval_090,2,1536,6144,bf16,NVIDIA GeForce RTX 4060,c04,64,64,64,4,3,8,0.0,133.902,70.65600156784058,80.88416039943692,0.5342608577100904,0,1,-1,2x1536x6144,0,
2026-03-02T12:39:16.480353+00:00,A,llm_style,eval,llm_style_eval_091,2,1024,1024,bf16,NVIDIA GeForce RTX 4060,c00,32,32,32,2,2,8,0.0,0.0,77.82399654388428,180.44928133487696,0.05389473923553731,0,0,-1,2x1024x1024,0,
2026-03-02T12:39:16.696402+00:00,A,llm_style,eval,llm_style_eval_092,4,4096,4096,bf16,NVIDIA GeForce RTX 4060,c11,32,128,32,4,2,8,0.0,216.004,161.79199516773224,178.2374405860901,0.8295696450300549,1,1,-1,4x4096x4096,0,
2026-03-02T12:39:16.772867+00:00,A,llm_style,eval,llm_style_eval_093,32,2048,1536,bf16,NVIDIA GeForce RTX 4060,c00,32,32,32,2,2,8,0.0,76.412,40.95999896526337,245.91360479593266,4.9152001241684,2,0,-1,32x2048x1536,0,
2026-03-02T12:39:16.848555+00:00,A,llm_style,eval,llm_style_eval_094,2,2048,2048,bf16,NVIDIA GeForce RTX 4060,c03,64,64,32,4,2,8,0.0,75.632,53.23199927806854,64.96895916759968,0.3151716303639224,0,0,-1,2x2048x2048,0,
2026-03-02T12:39:17.267559+00:00,A,llm_style,eval,llm_style_eval_095,1,6144,6144,bf16,NVIDIA GeForce RTX 4060,c00,32,32,32,2,2,8,0.0,418.955,325.3760039806366,344.8998436331749,0.23203146844379133,0,1,-1,1x6144x6144,0,
2026-03-02T12:39:17.401134+00:00,A,llm_style,eval,llm_style_eval_096,64,1024,6144,bf16,NVIDIA GeForce RTX 4060,c04,64,64,64,4,3,8,0.0,133.528,72.59200140833855,90.59391967952249,11.093596434544587,3,1,-1,64x1024x6144,0,
2026-03-02T12:39:17.429361+00:00,A,llm_style,eval,llm_style_eval_097,64,1536,2048,bf16,NVIDIA GeForce RTX 4060,c04,64,64,64,4,3,8,0.0,0.0,45.05600035190582,133.44768412411207,8.936727202927772,3,0,-1,64x1536x2048,0,
2026-03-02T12:39:17.494577+00:00,A,llm_style,eval,llm_style_eval_098,32,1024,2048,bf16,NVIDIA GeForce RTX 4060,c00,32,32,32,2,2,8,0.0,65.169,43.007999658584595,109.74239900708183,3.120761929535812,2,0,-1,32x1024x2048,0,
2026-03-02T12:39:17.598907+00:00,A,llm_style,eval,llm_style_eval_099,1,6144,1536,bf16,NVIDIA GeForce RTX 4060,c11,32,128,32,4,2,8,0.0,104.288,46.831998974084854,50.175998359918594,0.40302289916013184,0,0,-1,1x6144x1536,0,
2026-03-02T12:39:17.639232+00:00,A,llm_style,eval,llm_style_eval_100,64,6144,1024,bf16,NVIDIA GeForce RTX 4060,c06,64,128,32,4,3,8,0.0,0.0,57.152001187205315,158.4844776988029,14.090606650188217,3,0,-1,64x6144x1024,0,
2026-03-02T12:39:17.808948+00:00,A,llm_style,eval,llm_style_eval_101,64,8192,1536,bf16,NVIDIA GeForce RTX 4060,c04,64,64,64,4,3,8,0.0,169.66,114.68800157308578,124.8348805308342,14.043428378805825,3,0,-1,64x8192x1536,0,
2026-03-02T12:39:17.858303+00:00,A,llm_style,eval,llm_style_eval_102,32,6144,1536,bf16,NVIDIA GeForce RTX 4060,c11,32,128,32,4,2,8,0.0,0.0,39.904000237584114,152.51328155398357,15.135820278768284,2,0,-1,32x6144x1536,0,
2026-03-02T12:39:18.173463+00:00,A,llm_style,eval,llm_style_eval_103,64,4096,6144,bf16,NVIDIA GeForce RTX 4060,c03,64,64,32,4,2,8,0.0,315.106,233.2480028271675,262.1728065609932,13.81030248043268,3,1,-1,64x4096x6144,0,
2026-03-02T12:39:18.267615+00:00,A,llm_style,eval,llm_style_eval_104,2,6144,3072,bf16,NVIDIA GeForce RTX 4060,c10,64,128,64,8,3,8,0.0,0.0,183.23199450969696,305.5116805434227,0.41203214647103864,0,1,-1,2x6144x3072,0,
2026-03-02T12:39:18.413509+00:00,A,llm_style,eval,llm_style_eval_105,1,4096,3072,bf16,NVIDIA GeForce RTX 4060,c00,32,32,32,2,2,8,0.0,145.839,64.51199948787689,149.88128140568725,0.3900952411919764,0,1,-1,1x4096x3072,0,
2026-03-02T12:39:18.512576+00:00,A,llm_style,eval,llm_style_eval_106,64,4096,1536,bf16,NVIDIA GeForce RTX 4060,c04,64,64,64,4,3,8,0.0,99.021,58.36800113320351,78.44127960503097,13.797052363711826,3,0,-1,64x4096x1536,0,
2026-03-02T12:39:18.619222+00:00,A,llm_style,eval,llm_style_eval_107,64,6144,1536,bf16,NVIDIA GeForce RTX 4060,c06,64,128,32,4,3,8,0.0,106.594,64.51199948787689,70.57056047022341,18.72457157721487,3,0,-1,64x6144x1536,0,
2026-03-02T12:39:18.715932+00:00,A,llm_style,eval,llm_style_eval_108,16,3072,6144,bf16,NVIDIA GeForce RTX 4060,c04,64,64,64,4,3,8,0.0,0.0,178.49600315093994,221.98527589440337,3.383715967518119,2,1,-1,16x3072x6144,0,
2026-03-02T12:39:18.730991+00:00,A,llm_style,eval,llm_style_eval_109,64,1024,2048,bf16,NVIDIA GeForce RTX 4060,c04,64,64,64,4,3,8,0.0,0.0,65.58400020003319,131.29248261451716,4.093002183173697,3,0,-1,64x1024x2048,0,
2026-03-02T12:39:18.809498+00:00,A,llm_style,eval,llm_style_eval_110,16,1536,3072,bf16,NVIDIA GeForce RTX 4060,c04,64,64,64,4,3,8,0.0,78.46,49.15200173854828,53.981440812349305,3.0719998913407363,2,1,-1,16x1536x3072,0,
2026-03-02T12:39:18.995144+00:00,A,llm_style,eval,llm_style_eval_111,64,6144,6144,bf16,NVIDIA GeForce RTX 4060,c10,64,128,64,8,3,8,0.0,0.0,336.38399839401245,443.22431206703186,14.364054863098403,3,1,-1,64x6144x6144,0,
2026-03-02T12:39:19.415007+00:00,A,llm_style,eval,llm_style_eval_112,16,6144,6144,bf16,NVIDIA GeForce RTX 4060,c06,64,128,32,4,3,8,0.0,419.812,328.015998005867,347.1152001619339,3.682623894394304,2,1,-1,16x6144x6144,0,
2026-03-02T12:39:19.727644+00:00,A,llm_style,eval,llm_style_eval_113,1,8192,3072,bf16,NVIDIA GeForce RTX 4060,c11,32,128,32,4,2,8,0.0,312.594,226.17600113153458,245.36064475774765,0.22253310584764122,0,1,-1,1x8192x3072,0,
2026-03-02T12:39:19.794925+00:00,A,llm_style,eval,llm_style_eval_114,64,3072,1024,bf16,NVIDIA GeForce RTX 4060,c03,64,64,32,4,2,8,0.0,67.229,41.85599833726883,57.425918914377675,9.619963684905713,3,0,-1,64x3072x1024,0,
2026-03-02T12:39:19.903053+00:00,A,llm_style,eval,llm_style_eval_115,8,3072,3072,bf16,NVIDIA GeForce RTX 4060,c00,32,32,32,2,2,8,0.0,108.082,54.27199974656105,126.34943962097165,2.782188692237525,1,1,-1,8x3072x3072,0,
2026-03-02T12:39:19.926954+00:00,A,llm_style,eval,llm_style_eval_116,16,3072,2048,bf16,NVIDIA GeForce RTX 4060,c00,32,32,32,2,2,8,0.0,0.0,46.22399993240833,127.05791831016539,4.355455873450859,2,0,-1,16x3072x2048,0,
2026-03-02T12:39:19.934356+00:00,A,llm_style,eval,llm_style_eval_117,64,1024,1024,bf16,NVIDIA GeForce RTX 4060,c04,64,64,64,4,3,8,0.0,0.0,40.76800122857094,67.8207984194159,3.292232239875862,3,0,-1,64x1024x1024,0,
2026-03-02T12:39:19.971314+00:00,A,llm_style,eval,llm_style_eval_118,1,6144,1536,bf16,NVIDIA GeForce RTX 4060,c11,32,128,32,4,2,8,0.0,0.0,43.71200129389763,76.78975787013759,0.43178915266537876,0,0,-1,1x6144x1536,0,
2026-03-02T12:39:19.985383+00:00,A,llm_style,eval,llm_style_eval_119,1,1024,1536,bf16,NVIDIA GeForce RTX 4060,c04,64,64,64,4,3,8,0.0,0.0,36.86400130391121,381.7046318948256,0.08533333031502047,0,0,-1,1x1024x1536,0,
2026-03-02T12:39:20.195381+00:00,A,llm_style,eval,llm_style_eval_120,16,8192,2048,bf16,NVIDIA GeForce RTX 4060,c11,32,128,32,4,2,8,0.0,209.955,160.76800227165222,179.84512493014333,3.3394139655529265,2,0,-1,16x8192x2048,0,
2026-03-02T12:39:20.227337+00:00,A,llm_style,eval,llm_style_eval_121,64,4096,1024,bf16,NVIDIA GeForce RTX 4060,c04,64,64,64,4,3,8,0.0,0.0,27.59999968111515,122.87871979176975,19.45184486242386,3,0,-1,64x4096x1024,0,
2026-03-02T12:39:20.305767+00:00,A,llm_style,eval,llm_style_eval_122,4,6144,1024,bf16,NVIDIA GeForce RTX 4060,c11,32,128,32,4,2,8,0.0,78.367,40.95999896526337,47.41983965039253,1.2288000310421,1,0,-1,4x6144x1024,0,
2026-03-02T12:39:20.464749+00:00,A,llm_style,eval,llm_style_eval_123,4,8192,4096,bf16,NVIDIA GeForce RTX 4060,c11,32,128,32,4,2,8,0.0,0.0,292.1440005302429,368.80160897970194,0.9188463754613758,1,1,-1,4x8192x4096,0,
2026-03-02T12:39:20.755962+00:00,A,llm_style,eval,llm_style_eval_124,4,3072,8192,bf16,NVIDIA GeForce RTX 4060,c10,64,128,64,8,3,8,0.0,291.16,226.30399465560913,233.49247708916664,0.8896289802854788,1,1,-1,4x3072x8192,0,
2026-03-02T12:39:20.977860+00:00,A,llm_style,eval,llm_style_eval_125,64,8192,2048,bf16,NVIDIA GeForce RTX 4060,c04,64,64,64,4,3,8,0.0,221.852,168.96000504493713,172.3904012143612,12.710011741706852,3,0,-1,64x8192x2048,0,
2026-03-02T12:39:21.039591+00:00,A,llm_style,eval,llm_style_eval_126,8,1536,1536,bf16,NVIDIA GeForce RTX 4060,c00,32,32,32,2,2,8,0.0,61.689,38.91199827194214,584.366074912248,0.9701053062396715,1,0,-1,8x1536x1536,0,
2026-03-02T12:39:21.101263+00:00,A,llm_style,eval,llm_style_eval_127,64,2048,1024,bf16,NVIDIA GeForce RTX 4060,c11,32,128,32,4,2,8,0.0,61.632,43.007999658584595,49.05280053615569,6.241523859071624,3,0,-1,64x2048x1024,0,
2026-03-02T12:39:21.170658+00:00,A,llm_style,eval,llm_style_eval_128,64,6144,2048,bf16,NVIDIA GeForce RTX 4060,c10,64,128,64,8,3,8,0.0,0.0,107.4719987809658,189.85248386859894,14.986347646539286,3,0,-1,64x6144x2048,0,
2026-03-02T12:39:21.198185+00:00,A,llm_style,eval,llm_style_eval_129,32,6144,1024,bf16,NVIDIA GeForce RTX 4060,c11,32,128,32,4,2,8,0.0,0.0,43.95199939608574,53.247999399900436,9.161202892532332,2,0,-1,32x6144x1024,0,
2026-03-02T12:39:21.281306+00:00,A,llm_style,eval,llm_style_eval_130,64,8192,2048,bf16,NVIDIA GeForce RTX 4060,c04,64,64,64,4,3,8,0.0,0.0,167.93599724769592,211.30111545324314,12.787512404696566,3,0,-1,64x8192x2048,0,
2026-03-02T12:39:21.404831+00:00,A,llm_style,eval,llm_style_eval_131,64,4096,6144,bf16,NVIDIA GeForce RTX 4060,c03,64,64,32,4,2,8,0.0,0.0,233.47200453281403,296.2739196419714,13.797052363711826,3,1,-1,64x4096x6144,0,
2026-03-02T12:39:21.553903+00:00,A,llm_style,eval,llm_style_eval_132,16,8192,1536,bf16,NVIDIA GeForce RTX 4060,c11,32,128,32,4,2,8,0.0,149.016,62.463998794555664,67.45759941637516,6.4461640588257545,2,0,-1,16x8192x1536,0,
2026-03-02T12:39:22.149307+00:00,A,llm_style,eval,llm_style_eval_133,32,8192,6144,bf16,NVIDIA GeForce RTX 4060,c11,32,128,32,4,2,8,0.0,595.36,427.0399957895279,447.488009929657,7.543147020794797,2,1,-1,32x8192x6144,0,
2026-03-02T12:39:22.408901+00:00,A,llm_style,eval,llm_style_eval_134,64,8192,6144,bf16,NVIDIA GeForce RTX 4060,c04,64,64,64,4,3,8,0.0,0.0,444.2399889230728,555.6531178951263,14.50218599099509,3,1,-1,64x8192x6144,0,
2026-03-02T12:39:22.488548+00:00,A,llm_style,eval,llm_style_eval_135,4,3072,2048,bf16,NVIDIA GeForce RTX 4060,c00,32,32,32,2,2,8,0.0,79.59,24.272000417113304,137.55071550607678,2.0736505906003933,1,0,-1,4x3072x2048,0,
2026-03-02T12:39:22.531735+00:00,A,llm_style,eval,llm_style_eval_136,64,3072,3072,bf16,NVIDIA GeForce RTX 4060,c03,64,64,32,4,2,8,0.0,0.0,69.63200122117996,83.02591830492018,17.34776440164375,3,1,-1,64x3072x3072,0,
2026-03-02T12:39:22.756524+00:00,A,llm_style,eval,llm_style_eval_137,1,3072,6144,bf16,NVIDIA GeForce RTX 4060,c10,64,128,64,8,3,8,0.0,224.73,177.15199291706085,200.2611234784126,0.21308671372200275,0,1,-1,1x3072x6144,0,
2026-03-02T12:39:22.860960+00:00,A,llm_style,eval,llm_style_eval_138,1,2048,3072,bf16,NVIDIA GeForce RTX 4060,c00,32,32,32,2,2,8,0.0,104.389,59.34400111436844,222.09951251745196,0.21203342821037746,0,1,-1,1x2048x3072,0,
2026-03-02T12:39:23.154140+00:00,A,llm_style,eval,llm_style_eval_139,4,8192,3072,bf16,NVIDIA GeForce RTX 4060,c11,32,128,32,4,2,8,0.0,293.133,227.32800245285034,234.5008011162281,0.8856216120658376,1,1,-1,4x8192x3072,0,
2026-03-02T12:39:23.171938+00:00,A,llm_style,eval,llm_style_eval_140,64,1024,2048,bf16,NVIDIA GeForce RTX 4060,c04,64,64,64,4,3,8,0.0,0.0,39.712000638246536,66.2991996109485,6.759555088782669,3,0,-1,64x1024x2048,0,
2026-03-02T12:39:23.462958+00:00,A,llm_style,eval,llm_style_eval_141,1,6144,4096,bf16,NVIDIA GeForce RTX 4060,c00,32,32,32,2,2,8,0.0,290.978,227.32800245285034,248.39168593287465,0.2214054030164594,0,1,-1,1x6144x4096,0,
2026-03-02T12:39:23.558741+00:00,A,llm_style,eval,llm_style_eval_142,4,4096,4096,bf16,NVIDIA GeForce RTX 4060,c11,32,128,32,4,2,8,0.0,0.0,167.28000342845917,295.7708825170992,0.8023536899160877,1,1,-1,4x4096x4096,0,
2026-03-02T12:39:23.599004+00:00,A,llm_style,eval,llm_style_eval_143,64,1536,6144,bf16,NVIDIA GeForce RTX 4060,c04,64,64,64,4,3,8,0.0,0.0,70.65600156784058,87.4406386166811,17.09634744672289,3,1,-1,64x1536x6144,0,
2026-03-02T12:39:23.683237+00:00,A,llm_style,eval,llm_style_eval_144,1,6144,1024,bf16,NVIDIA GeForce RTX 4060,c11,32,128,32,4,2,8,0.0,84.179,40.031999349594116,43.02847966551781,0.31432134803248535,0,0,-1,1x6144x1024,0,
2026-03-02T12:39:23.922124+00:00,A,llm_style,eval,llm_style_eval_145,8,3072,6144,bf16,NVIDIA GeForce RTX 4060,c06,64,128,32,4,3,8,0.0,238.841,178.17600071430206,197.6159991323948,1.69489654492935,1,1,-1,8x3072x6144,0,
2026-03-02T12:39:24.276687+00:00,A,llm_style,eval,llm_style_eval_146,64,8192,8192,bf16,NVIDIA GeForce RTX 4060,c06,64,128,32,4,3,8,0.0,0.0,575.2639770507812,716.4313560724257,14.932161467919842,3,1,-1,64x8192x8192,0,
2026-03-02T12:39:24.417677+00:00,A,llm_style,eval,llm_style_eval_147,1,1024,8192,bf16,NVIDIA GeForce RTX 4060,c04,64,64,64,4,3,8,0.0,140.93,84.99199897050858,119.86528351902952,0.1973975927524841,0,1,-1,1x1024x8192,0,
2026-03-02T12:39:24.444456+00:00,A,llm_style,eval,llm_style_eval_148,32,4096,1024,bf16,NVIDIA GeForce RTX 4060,c11,32,128,32,4,2,8,0.0,0.0,43.775999918580055,113.44896480441088,6.13202340321795,2,0,-1,32x4096x1024,0,
2026-03-02T12:39:24.597403+00:00,A,llm_style,eval,llm_style_eval_149,64,3072,4096,bf16,NVIDIA GeForce RTX 4060,c04,64,64,64,4,3,8,0.0,152.9,97.07200154662132,113.67712043225762,16.591939079637314,3,1,-1,64x3072x4096,0,
2026-03-02T12:39:24.682917+00:00,A,llm_style,eval,llm_style_eval_150,2,4096,4096,bf16,NVIDIA GeForce RTX 4060,c02,32,64,32,2,2,8,0.0,0.0,162.6880019903183,366.2278509140011,0.4125003883445179,0,1,-1,2x4096x4096,0,
2026-03-02T12:39:24.717553+00:00,A,llm_style,eval,llm_style_eval_151,64,2048,3072,bf16,NVIDIA GeForce RTX 4060,c11,32,128,32,4,2,8,0.0,0.0,74.73600283265114,372.30111554264954,10.775347054661754,3,1,-1,64x2048x3072,0,
2026-03-02T12:39:24.759742+00:00,A,llm_style,eval,llm_style_eval_152,64,1024,8192,bf16,NVIDIA GeForce RTX 4060,c04,64,64,64,4,3,8,0.0,0.0,87.55199983716011,159.64639693498611,12.2640468064359,3,1,-1,64x1024x8192,0,
2026-03-02T12:39:24.784985+00:00,A,llm_style,eval,llm_style_eval_153,64,4096,1024,bf16,NVIDIA GeForce RTX 4060,c04,64,64,64,4,3,8,0.0,0.0,64.27199766039848,116.35711833834645,8.353107598066703,3,0,-1,64x4096x1024,0,
2026-03-02T12:39:24.827086+00:00,A,llm_style,eval,llm_style_eval_154,64,4096,2048,bf16,NVIDIA GeForce RTX 4060,c04,64,64,64,4,3,8,0.0,0.0,66.19199737906456,117.66592152416695,16.22162597467722,3,0,-1,64x4096x2048,0,
2026-03-02T12:39:24.990590+00:00,A,llm_style,eval,llm_style_eval_155,8,4096,8192,bf16,NVIDIA GeForce RTX 4060,c11,32,128,32,4,2,8,0.0,0.0,294.20800507068634,381.27615481615055,1.8248004906291095,1,1,-1,8x4096x8192,0,
2026-03-02T12:39:25.056752+00:00,A,llm_style,eval,llm_style_eval_156,64,6144,2048,bf16,NVIDIA GeForce RTX 4060,c10,64,128,64,8,3,8,0.0,0.0,106.84799775481224,202.08159923553464,15.073869139746803,3,0,-1,64x6144x2048,0,
2026-03-02T12:39:25.366845+00:00,A,llm_style,eval,llm_style_eval_157,16,4096,6144,bf16,NVIDIA GeForce RTX 4060,c11,32,128,32,4,2,8,0.0,310.04,228.11200469732285,247.71455287933347,3.5303112129874297,2,1,-1,16x4096x6144,0,
2026-03-02T12:39:25.410020+00:00,A,llm_style,eval,llm_style_eval_158,64,2048,3072,bf16,NVIDIA GeForce RTX 4060,c11,32,128,32,4,2,8,0.0,0.0,69.63200122117996,143.5193571448326,11.565176267762501,3,1,-1,64x2048x3072,0,
2026-03-02T12:39:25.429633+00:00,A,llm_style,eval,llm_style_eval_159,64,1536,2048,bf16,NVIDIA GeForce RTX 4060,c04,64,64,64,4,3,8,0.0,0.0,41.98399931192398,95.05856048315746,9.590634303522425,3,0,-1,64x1536x2048,0,
2026-03-02T12:39:25.449528+00:00,A,llm_style,eval,llm_style_eval_160,16,1536,3072,bf16,NVIDIA GeForce RTX 4060,c04,64,64,64,4,3,8,0.0,0.0,34.304000437259674,80.79104028642178,4.401671585684658,2,1,-1,16x1536x3072,0,
2026-03-02T12:39:25.458802+00:00,A,llm_style,eval,llm_style_eval_161,64,1536,1024,bf16,NVIDIA GeForce RTX 4060,c04,64,64,64,4,3,8,0.0,0.0,28.672000393271446,55.00736065208909,7.021714189402912,3,0,-1,64x1536x1024,0,
2026-03-02T12:39:25.484054+00:00,A,llm_style,eval,llm_style_eval_162,64,6144,1024,bf16,NVIDIA GeForce RTX 4060,c06,64,128,32,4,3,8,0.0,0.0,70.14400139451027,147.61632218956947,11.480758895842323,3,0,-1,64x6144x1024,0,
2026-03-02T12:39:25.552622+00:00,A,llm_style,eval,llm_style_eval_163,32,6144,1536,bf16,NVIDIA GeForce RTX 4060,c11,32,128,32,4,2,8,0.0,0.0,58.35200101137161,185.4694423079486,10.35062663716188,2,0,-1,32x6144x1536,0,
2026-03-02T12:39:25.725698+00:00,A,llm_style,eval,llm_style_eval_164,16,1536,8192,bf16,NVIDIA GeForce RTX 4060,c04,64,64,64,4,3,8,0.0,173.024,88.73599767684937,94.065280854702,4.537653202101199,2,1,-1,16x1536x8192,0,
2026-03-02T12:39:25.907956+00:00,A,llm_style,eval,llm_style_eval_165,8,1536,8192,bf16,NVIDIA GeForce RTX 4060,c04,64,64,64,4,3,8,0.0,182.21,87.0399996638298,149.52447846531868,2.3130353030511666,1,1,-1,8x1536x8192,0,
2026-03-02T12:39:25.940525+00:00,A,llm_style,eval,llm_style_eval_166,2,1024,6144,bf16,NVIDIA GeForce RTX 4060,c04,64,64,64,4,3,8,0.0,0.0,72.7040022611618,459.7759899497022,0.3461408343051217,0,1,-1,2x1024x6144,0,
2026-03-02T12:39:26.007592+00:00,A,llm_style,eval,llm_style_eval_167,64,4096,3072,bf16,NVIDIA GeForce RTX 4060,c04,64,64,64,4,3,8,0.0,0.0,99.32799637317657,190.9699249267578,16.215093375576682,3,1,-1,64x4096x3072,0,
2026-03-02T12:39:26.326855+00:00,A,llm_style,eval,llm_style_eval_168,64,8192,3072,bf16,NVIDIA GeForce RTX 4060,c00,32,32,32,2,2,8,0.0,319.208,235.3920042514801,283.3919951319694,13.684515250393199,3,1,-1,64x8192x3072,0,
2026-03-02T12:39:26.357788+00:00,A,llm_style,eval,llm_style_eval_169,2,1024,6144,bf16,NVIDIA GeForce RTX 4060,c04,64,64,64,4,3,8,0.0,0.0,69.63200122117996,147.36000090837467,0.36141175836757816,0,1,-1,2x1024x6144,0,
2026-03-02T12:39:26.587051+00:00,A,llm_style,eval,llm_style_eval_170,16,2048,8192,bf16,NVIDIA GeForce RTX 4060,c10,64,128,64,8,3,8,0.0,229.192,162.79999911785126,173.4803220629692,3.2977328925619833,2,1,-1,16x2048x8192,0,
2026-03-02T12:39:26.681210+00:00,A,llm_style,eval,llm_style_eval_171,2,4096,1536,bf16,NVIDIA GeForce RTX 4060,c11,32,128,32,4,2,8,0.0,94.111,49.15200173854828,56.32000043988228,0.5119999818901227,0,0,-1,2x4096x1536,0,
2026-03-02T12:39:26.734536+00:00,A,llm_style,eval,llm_style_eval_172,1,1536,1024,bf16,NVIDIA GeForce RTX 4060,c04,64,64,64,4,3,8,0.0,53.28,35.80800071358681,39.402880035340786,0.08784986420105831,0,0,-1,1x1536x1024,0,
2026-03-02T12:39:26.835598+00:00,A,llm_style,eval,llm_style_eval_173,32,1536,4096,bf16,NVIDIA GeForce RTX 4060,c04,64,64,64,4,3,8,0.0,101.022,57.328000664711,69.06752057373524,7.02367393474893,2,1,-1,32x1536x4096,0,
2026-03-02T12:39:26.860987+00:00,A,llm_style,eval,llm_style_eval_174,64,2048,3072,bf16,NVIDIA GeForce RTX 4060,c11,32,128,32,4,2,8,0.0,0.0,69.5200003683567,96.72863788902757,11.583808454157458,3,1,-1,64x2048x3072,0,
2026-03-02T12:39:26.918204+00:00,A,llm_style,eval,llm_style_eval_175,2,3072,1024,bf16,NVIDIA GeForce RTX 4060,c11,32,128,32,4,2,8,0.0,57.159,38.91199827194214,47.03040033578873,0.3233684354132238,0,0,-1,2x3072x1024,0,
2026-03-02T12:39:27.099003+00:00,A,llm_style,eval,llm_style_eval_176,64,6144,6144,bf16,NVIDIA GeForce RTX 4060,c10,64,128,64,8,3,8,0.0,0.0,334.84798669815063,357.7241542935371,14.429945527358568,3,1,-1,64x6144x6144,0,
2026-03-02T12:39:27.393269+00:00,A,llm_style,eval,llm_style_eval_177,2,6144,4096,bf16,NVIDIA GeForce RTX 4060,c03,64,64,32,4,2,8,0.0,294.203,227.2000014781952,334.86848145723343,0.44306027880752824,0,1,-1,2x6144x4096,0,
2026-03-02T12:39:27.439478+00:00,A,llm_style,eval,llm_style_eval_178,64,4096,2048,bf16,NVIDIA GeForce RTX 4060,c04,64,64,64,4,3,8,0.0,0.0,63.32799792289734,114.99520167708391,16.955246639997913,3,0,-1,64x4096x2048,0,
2026-03-02T12:39:27.579290+00:00,A,llm_style,eval,llm_style_eval_179,16,6144,2048,bf16,NVIDIA GeForce RTX 4060,c00,32,32,32,2,2,8,0.0,139.749,65.5359998345375,142.37759888172138,6.144000015512108,2,0,-1,16x6144x2048,0,
2026-03-02T12:39:27.664236+00:00,A,llm_style,eval,llm_style_eval_180,1,3072,2048,bf16,NVIDIA GeForce RTX 4060,c00,32,32,32,2,2,8,0.0,84.9,49.216000363230705,128.54272201657292,0.25566709824312944,0,0,-1,1x3072x2048,0,
2026-03-02T12:39:27.968344+00:00,A,llm_style,eval,llm_style_eval_181,32,3072,8192,bf16,NVIDIA GeForce RTX 4060,c10,64,128,64,8,3,8,0.0,304.057,230.3999960422516,266.36385172605515,6.990506786747687,2,1,-1,32x3072x8192,0,
2026-03-02T12:39:28.015999+00:00,A,llm_style,eval,llm_style_eval_182,64,1024,8192,bf16,NVIDIA GeForce RTX 4060,c04,64,64,64,4,3,8,0.0,0.0,92.16000139713287,216.1235208809374,11.650844267819254,3,1,-1,64x1024x8192,0,
2026-03-02T12:39:28.112820+00:00,A,llm_style,eval,llm_style_eval_183,32,4096,1536,bf16,NVIDIA GeForce RTX 4060,c11,32,128,32,4,2,8,0.0,96.768,47.85599932074547,118.36831890046594,8.41384966806974,2,0,-1,32x4096x1536,0,
2026-03-02T12:39:28.210985+00:00,A,llm_style,eval,llm_style_eval_184,2,2048,3072,bf16,NVIDIA GeForce RTX 4060,c00,32,32,32,2,2,8,0.0,98.119,54.27199974656105,220.30144348740563,0.4636981153729209,0,1,-1,2x2048x3072,0,
2026-03-02T12:39:28.224564+00:00,A,llm_style,eval,llm_style_eval_185,64,1536,1536,bf16,NVIDIA GeForce RTX 4060,c04,64,64,64,4,3,8,0.0,0.0,34.7680002450943,57.43007879704235,8.685857278852563,3,0,-1,64x1536x1536,0,
2026-03-02T12:39:28.264271+00:00,A,llm_style,eval,llm_style_eval_186,64,8192,1024,bf16,NVIDIA GeForce RTX 4060,c06,64,128,32,4,3,8,0.0,0.0,72.7040022611618,136.83008477091786,14.768675597018525,3,0,-1,64x8192x1024,0,
2026-03-02T12:39:28.309005+00:00,A,llm_style,eval,llm_style_eval_187,4,8192,1024,bf16,NVIDIA GeForce RTX 4060,c00,32,32,32,2,2,8,0.0,0.0,49.15200173854828,68.20127796381708,1.3653332850403275,1,0,-1,4x8192x1024,0,
2026-03-02T12:39:28.334929+00:00,A,llm_style,eval,llm_style_eval_188,32,6144,1024,bf16,NVIDIA GeForce RTX 4060,c11,32,128,32,4,2,8,0.0,0.0,39.29599933326244,81.76991898566476,10.246671183627864,2,0,-1,32x6144x1024,0,
2026-03-02T12:39:28.343435+00:00,A,llm_style,eval,llm_style_eval_189,4,1024,1024,bf16,NVIDIA GeForce RTX 4060,c04,64,64,64,4,3,8,0.0,0.0,29.680000618100166,74.17856078594914,0.28263503454525735,1,0,-1,4x1024x1024,0,
2026-03-02T12:39:28.413243+00:00,A,llm_style,eval,llm_style_eval_190,16,2048,2048,bf16,NVIDIA GeForce RTX 4060,c00,32,32,32,2,2,8,0.0,69.756,48.128001391887665,79.64480057358736,2.7887658767941983,2,0,-1,16x2048x2048,0,
2026-03-02T12:39:28.473445+00:00,A,llm_style,eval,llm_style_eval_191,4,2048,1536,bf16,NVIDIA GeForce RTX 4060,c00,32,32,32,2,2,8,0.0,60.156,40.94399884343147,55.96160024404523,0.6146401111487253,1,0,-1,4x2048x1536,0,
2026-03-02T12:39:28.505551+00:00,A,llm_style,eval,llm_style_eval_192,64,8192,1024,bf16,NVIDIA GeForce RTX 4060,c06,64,128,32,4,3,8,0.0,0.0,72.04800099134445,79.7782401740551,14.90314525352334,3,0,-1,64x8192x1024,0,
2026-03-02T12:39:29.251669+00:00,A,llm_style,eval,llm_style_eval_193,4,8192,8192,bf16,NVIDIA GeForce RTX 4060,c11,32,128,32,4,2,8,0.0,746.059,557.0560097694397,612.9916900396345,0.9637646889802084,1,1,-1,4x8192x8192,0,
2026-03-02T12:39:29.272011+00:00,A,llm_style,eval,llm_style_eval_194,64,1024,1024,bf16,NVIDIA GeForce RTX 4060,c04,64,64,64,4,3,8,0.0,0.0,48.14400151371956,88.2483200728893,2.7878390615651685,3,0,-1,64x1024x1024,0,
2026-03-02T12:39:29.304492+00:00,A,llm_style,eval,llm_style_eval_195,32,4096,1536,bf16,NVIDIA GeForce RTX 4060,c11,32,128,32,4,2,8,0.0,0.0,53.247999399900436,144.50911924242968,7.561846239067394,2,0,-1,32x4096x1536,0,
2026-03-02T12:39:29.321073+00:00,A,llm_style,eval,llm_style_eval_196,8,4096,1024,bf16,NVIDIA GeForce RTX 4060,c02,32,64,32,2,2,8,0.0,0.0,45.77599838376045,57.711359485983834,1.4660273149565564,1,0,-1,8x4096x1024,0,
2026-03-02T12:39:29.461320+00:00,A,llm_style,eval,llm_style_eval_197,2,6144,2048,bf16,NVIDIA GeForce RTX 4060,c00,32,32,32,2,2,8,0.0,140.199,60.416001826524734,75.27424313127995,0.8330847205765054,0,0,-1,2x6144x2048,0,
2026-03-02T12:39:29.585424+00:00,A,llm_style,eval,llm_style_eval_198,32,1536,6144,bf16,NVIDIA GeForce RTX 4060,c04,64,64,64,4,3,8,0.0,124.06,71.68000191450119,86.1091189831495,8.42605691780558,2,1,-1,32x1536x6144,0,
2026-03-02T12:39:29.674748+00:00,A,llm_style,eval,llm_style_eval_199,32,3072,1536,bf16,NVIDIA GeForce RTX 4060,c11,32,128,32,4,2,8,0.0,89.27,47.00800031423569,53.26847940683365,6.424223238199451,2,0,-1,32x3072x1536,0,
2026-03-02T12:39:29.703658+00:00,A,llm_style,eval,llm_style_eval_200,64,2048,3072,bf16,NVIDIA GeForce RTX 4060,c11,32,128,32,4,2,8,0.0,0.0,72.48000055551529,230.38527160882938,11.110738987690597,3,1,-1,64x2048x3072,0,
2026-03-02T12:39:29.842743+00:00,A,llm_style,eval,llm_style_eval_201,4,6144,2048,bf16,NVIDIA GeForce RTX 4060,c00,32,32,32,2,2,8,0.0,139.033,59.39200147986412,107.99168072640882,1.6948965094925827,1,0,-1,4x6144x2048,0,
2026-03-02T12:39:29.873376+00:00,A,llm_style,eval,llm_style_eval_202,4,6144,1024,bf16,NVIDIA GeForce RTX 4060,c11,32,128,32,4,2,8,0.0,0.0,46.78399860858917,151.8470458686351,1.0758304013534985,1,0,-1,4x6144x1024,0,
2026-03-02T12:39:30.449050+00:00,A,llm_style,eval,llm_style_eval_203,1,6144,8192,bf16,NVIDIA GeForce RTX 4060,c06,64,128,32,4,3,8,0.0,575.62,423.3600050210953,450.1811194419861,0.2377723327809015,0,1,-1,1x6144x8192,0,
2026-03-02T12:39:30.484570+00:00,A,llm_style,eval,llm_style_eval_204,1,2048,3072,bf16,NVIDIA GeForce RTX 4060,c00,32,32,32,2,2,8,0.0,0.0,46.4479997754097,199.86432045698163,0.2709032048924008,0,1,-1,1x2048x3072,0,
2026-03-02T12:39:30.583743+00:00,A,llm_style,eval,llm_style_eval_205,2,6144,1536,bf16,NVIDIA GeForce RTX 4060,c11,32,128,32,4,2,8,0.0,99.12,47.040000557899475,52.771520949900136,0.8024816231355426,0,0,-1,2x6144x1536,0,
2026-03-02T12:39:30.635442+00:00,A,llm_style,eval,llm_style_eval_206,16,1024,1024,bf16,NVIDIA GeForce RTX 4060,c04,64,64,64,4,3,8,0.0,51.656,35.840000957250595,43.665280565619454,0.9362285464228421,2,0,-1,16x1024x1024,0,
2026-03-02T12:39:30.697423+00:00,A,llm_style,eval,llm_style_eval_207,64,6144,2048,bf16,NVIDIA GeForce RTX 4060,c10,64,128,64,8,3,8,0.0,0.0,108.36799815297127,237.95328557491294,14.86243875914801,3,0,-1,64x6144x2048,0,
2026-03-02T12:39:30.819681+00:00,A,llm_style,eval,llm_style_eval_208,4,4096,6144,bf16,NVIDIA GeForce RTX 4060,c00,32,32,32,2,2,8,0.0,0.0,231.4240038394928,269.5414304733276,0.8699468882218144,1,1,-1,4x4096x6144,0,
2026-03-02T12:39:31.243476+00:00,A,llm_style,eval,llm_style_eval_209,32,6144,6144,bf16,NVIDIA GeForce RTX 4060,c06,64,128,32,4,3,8,0.0,423.741,329.72800731658936,354.8262298107147,7.327006048595527,2,1,-1,32x6144x6144,0,
2026-03-02T12:39:31.265358+00:00,A,llm_style,eval,llm_style_eval_210,64,2048,1024,bf16,NVIDIA GeForce RTX 4060,c11,32,128,32,4,2,8,0.0,0.0,36.86400130391121,119.355838522315,7.281777520215079,3,0,-1,64x2048x1024,0,
2026-03-02T12:39:31.349299+00:00,A,llm_style,eval,llm_style_eval_211,4,1024,3072,bf16,NVIDIA GeForce RTX 4060,c04,64,64,64,4,3,8,0.0,83.904,57.34400078654289,65.0342396646738,0.438857136837682,1,1,-1,4x1024x3072,0,
2026-03-02T12:39:31.531165+00:00,A,llm_style,eval,llm_style_eval_212,64,6144,6144,bf16,NVIDIA GeForce RTX 4060,c10,64,128,64,8,3,8,0.0,0.0,336.68801188468933,404.93728935718536,14.351084794949081,3,1,-1,64x6144x6144,0,
2026-03-02T12:39:31.594397+00:00,A,llm_style,eval,llm_style_eval_213,4,1024,2048,bf16,NVIDIA GeForce RTX 4060,c00,32,32,32,2,2,8,0.0,63.179,22.367999888956547,128.99263873696327,0.7500543670998134,1,0,-1,4x1024x2048,0,
2026-03-02T12:39:31.795447+00:00,A,llm_style,eval,llm_style_eval_214,32,6144,6144,bf16,NVIDIA GeForce RTX 4060,c06,64,128,32,4,3,8,0.0,0.0,334.76799726486206,449.66495245695114,7.216696708582244,2,1,-1,32x6144x6144,0,
2026-03-02T12:39:31.821789+00:00,A,llm_style,eval,llm_style_eval_215,16,2048,3072,bf16,NVIDIA GeForce RTX 4060,c02,32,64,32,2,2,8,0.0,0.0,59.39200147986412,111.94368429481978,3.3897930189851655,2,1,-1,16x2048x3072,0,
2026-03-02T12:39:31.835985+00:00,A,llm_style,eval,llm_style_eval_216,2,1536,2048,bf16,NVIDIA GeForce RTX 4060,c04,64,64,64,4,3,8,0.0,0.0,45.05600035190582,141.4182436466217,0.27927272509149287,0,0,-1,2x1536x2048,0,
2026-03-02T12:39:31.957210+00:00,A,llm_style,eval,llm_style_eval_217,64,8192,3072,bf16,NVIDIA GeForce RTX 4060,c00,32,32,32,2,2,8,0.0,0.0,236.52800172567368,329.6358436346053,13.618791214986853,3,1,-1,64x8192x3072,0,
2026-03-02T12:39:32.018114+00:00,A,llm_style,eval,llm_style_eval_218,64,4096,3072,bf16,NVIDIA GeForce RTX 4060,c04,64,64,64,4,3,8,0.0,0.0,91.96799993515015,99.85023654997349,17.51275157811086,3,1,-1,64x4096x3072,0,
2026-03-02T12:39:32.039891+00:00,A,llm_style,eval,llm_style_eval_219,64,1536,3072,bf16,NVIDIA GeForce RTX 4060,c04,64,64,64,4,3,8,0.0,0.0,59.39200147986412,121.8969602137804,10.169379056955496,3,1,-1,64x1536x3072,0,
2026-03-02T12:39:32.227635+00:00,A,llm_style,eval,llm_style_eval_220,1,6144,6144,bf16,NVIDIA GeForce RTX 4060,c00,32,32,32,2,2,8,0.0,0.0,326.9280046224594,449.7177547216414,0.23092996296596074,0,1,-1,1x6144x6144,0,
2026-03-02T12:39:32.395695+00:00,A,llm_style,eval,llm_style_eval_221,8,4096,8192,bf16,NVIDIA GeForce RTX 4060,c11,32,128,32,4,2,8,0.0,0.0,295.8879917860031,376.9900816679001,1.8144396761740993,1,1,-1,8x4096x8192,0,
2026-03-02T12:39:33.128040+00:00,A,llm_style,eval,llm_style_eval_222,8,8192,8192,bf16,NVIDIA GeForce RTX 4060,c11,32,128,32,4,2,8,0.0,732.293,555.8079779148102,618.4348917007446,1.9318575239389144,1,1,-1,8x8192x8192,0,
2026-03-02T12:39:33.219555+00:00,A,llm_style,eval,llm_style_eval_223,1,4096,1536,bf16,NVIDIA GeForce RTX 4060,c00,32,32,32,2,2,8,0.0,91.468,47.07200080156326,196.69312149286253,0.2673120280789535,0,0,-1,1x4096x1536,0,
2026-03-02T12:39:33.319676+00:00,A,llm_style,eval,llm_style_eval_224,4,3072,3072,bf16,NVIDIA GeForce RTX 4060,c00,32,32,32,2,2,8,0.0,100.075,56.20799958705902,141.59519404172897,1.3431801977414985,1,1,-1,4x3072x3072,0,
2026-03-02T12:39:33.406036+00:00,A,llm_style,eval,llm_style_eval_225,64,8192,2048,bf16,NVIDIA GeForce RTX 4060,c04,64,64,64,4,3,8,0.0,0.0,169.98399794101715,237.0867219567299,12.633445936158983,3,0,-1,64x8192x2048,0,
2026-03-02T12:39:33.499577+00:00,A,llm_style,eval,llm_style_eval_226,4,4096,1536,bf16,NVIDIA GeForce RTX 4060,c02,32,64,32,2,2,8,0.0,93.484,47.10400104522705,56.572480387985706,1.068521715420181,1,0,-1,4x4096x1536,0,
2026-03-02T12:39:33.561807+00:00,A,llm_style,eval,llm_style_eval_227,16,8192,1536,bf16,NVIDIA GeForce RTX 4060,c11,32,128,32,4,2,8,0.0,0.0,68.60800087451935,202.21951335668535,5.868895447579545,2,0,-1,16x8192x1536,0,
2026-03-02T12:39:33.674942+00:00,A,llm_style,eval,llm_style_eval_228,16,2048,4096,bf16,NVIDIA GeForce RTX 4060,c00,32,32,32,2,2,8,0.0,113.08,61.32799945771694,75.23776240646838,4.377045694847341,2,1,-1,16x2048x4096,0,
2026-03-02T12:39:33.695476+00:00,A,llm_style,eval,llm_style_eval_229,8,1536,1024,bf16,NVIDIA GeForce RTX 4060,c04,64,64,64,4,3,8,0.0,0.0,49.02400076389313,238.7679913640018,0.5133368066225836,1,0,-1,8x1536x1024,0,
2026-03-02T12:39:33.839729+00:00,A,llm_style,eval,llm_style_eval_230,64,4096,6144,bf16,NVIDIA GeForce RTX 4060,c03,64,64,32,4,2,8,0.0,0.0,233.47200453281403,372.4761563539505,13.797052363711826,3,1,-1,64x4096x6144,0,
2026-03-02T12:39:33.886814+00:00,A,llm_style,eval,llm_style_eval_231,64,4096,2048,bf16,NVIDIA GeForce RTX 4060,c04,64,64,64,4,3,8,0.0,0.0,68.60800087451935,217.29759514331812,15.650387860212119,3,0,-1,64x4096x2048,0,
2026-03-02T12:39:34.030242+00:00,A,llm_style,eval,llm_style_eval_232,16,3072,4096,bf16,NVIDIA GeForce RTX 4060,c06,64,128,32,4,3,8,0.0,143.372,80.60800284147263,84.49023880064487,4.995201094262019,2,1,-1,16x3072x4096,0,
2026-03-02T12:39:34.092891+00:00,A,llm_style,eval,llm_style_eval_233,64,8192,1536,bf16,NVIDIA GeForce RTX 4060,c04,64,64,64,4,3,8,0.0,0.0,117.76000261306763,203.8988819718361,13.677077957378314,3,0,-1,64x8192x1536,0,
2026-03-02T12:39:34.181058+00:00,A,llm_style,eval,llm_style_eval_234,64,1024,4096,bf16,NVIDIA GeForce RTX 4060,c04,64,64,64,4,3,8,0.0,88.113,56.32000043988228,81.41823776066303,9.53250901645629,3,1,-1,64x1024x4096,0,
2026-03-02T12:39:34.196640+00:00,A,llm_style,eval,llm_style_eval_235,64,3072,1024,bf16,NVIDIA GeForce RTX 4060,c03,64,64,32,4,2,8,0.0,0.0,49.15200173854828,190.56768536567688,8.191999710241964,3,0,-1,64x3072x1024,0,
2026-03-02T12:39:34.428651+00:00,A,llm_style,eval,llm_style_eval_236,32,3072,6144,bf16,NVIDIA GeForce RTX 4060,c06,64,128,32,4,3,8,0.0,231.965,179.24799770116806,239.82848167419417,6.739040700548525,2,1,-1,32x3072x6144,0,
2026-03-02T12:39:35.009434+00:00,A,llm_style,eval,llm_style_eval_237,2,8192,6144,bf16,NVIDIA GeForce RTX 4060,c11,32,128,32,4,2,8,0.0,580.739,424.3680089712143,456.25279396772385,0.4744151013835173,0,1,-1,2x8192x6144,0,
2026-03-02T12:39:35.056920+00:00,A,llm_style,eval,llm_style_eval_238,4,2048,4096,bf16,NVIDIA GeForce RTX 4060,c00,32,32,32,2,2,8,0.0,0.0,61.43999844789505,164.08576324582094,1.0922666942596442,1,1,-1,4x2048x4096,0,
2026-03-02T12:39:35.098105+00:00,A,llm_style,eval,llm_style_eval_239,4,8192,1024,bf16,NVIDIA GeForce RTX 4060,c00,32,32,32,2,2,8,0.0,0.0,49.15200173854828,143.37183877825734,1.3653332850403275,1,0,-1,4x8192x1024,0,
2026-03-02T12:39:35.118327+00:00,A,llm_style,eval,llm_style_eval_240,2,1024,4096,bf16,NVIDIA GeForce RTX 4060,c04,64,64,64,4,3,8,0.0,0.0,79.8719972372055,146.38303987681854,0.21005128931701406,0,1,-1,2x1024x4096,0,
2026-03-02T12:39:35.143542+00:00,A,llm_style,eval,llm_style_eval_241,8,3072,2048,bf16,NVIDIA GeForce RTX 4060,c11,32,128,32,4,2,8,0.0,0.0,51.93600058555603,67.58816041052341,1.9382180927500137,1,0,-1,8x3072x2048,0,
2026-03-02T12:39:35.448884+00:00,A,llm_style,eval,llm_style_eval_242,32,4096,6144,bf16,NVIDIA GeForce RTX 4060,c11,32,128,32,4,2,8,0.0,305.294,229.37600314617157,245.17664045095444,7.021714189402912,2,1,-1,32x4096x6144,0,
2026-03-02T12:39:35.538925+00:00,A,llm_style,eval,llm_style_eval_243,64,2048,2048,bf16,NVIDIA GeForce RTX 4060,c03,64,64,32,4,2,8,0.0,89.992,54.27199974656105,157.09984160959695,9.892226461288978,3,0,-1,64x2048x2048,0,
2026-03-02T12:39:35.600669+00:00,A,llm_style,eval,llm_style_eval_244,8,2048,1536,bf16,NVIDIA GeForce RTX 4060,c00,32,32,32,2,2,8,0.0,61.698,38.91199827194214,54.8761599510908,1.2934737416528952,1,0,-1,8x2048x1536,0,
2026-03-02T12:39:35.719445+00:00,A,llm_style,eval,llm_style_eval_245,1,1024,6144,bf16,NVIDIA GeForce RTX 4060,c04,64,64,64,4,3,8,0.0,118.732,72.64000177383423,169.49247762560833,0.17322290325896594,0,1,-1,1x1024x6144,0,
2026-03-02T12:39:35.737254+00:00,A,llm_style,eval,llm_style_eval_246,2,1536,1024,bf16,NVIDIA GeForce RTX 4060,c00,32,32,32,2,2,8,0.0,0.0,50.6879985332489,115.04959903657432,0.12412121571288924,0,0,-1,2x1536x1024,0,
2026-03-02T12:39:35.811757+00:00,A,llm_style,eval,llm_style_eval_247,64,2048,6144,bf16,NVIDIA GeForce RTX 4060,c04,64,64,64,4,3,8,0.0,0.0,115.20000174641609,197.25312337279317,13.981013121383105,3,1,-1,64x2048x6144,0,
2026-03-02T12:39:35.821807+00:00,A,llm_style,eval,llm_style_eval_248,64,1536,1024,bf16,NVIDIA GeForce RTX 4060,c04,64,64,64,4,3,8,0.0,0.0,34.60800088942051,80.82015935331574,5.817342430245502,3,0,-1,64x1536x1024,0,
2026-03-02T12:39:35.835363+00:00,A,llm_style,eval,llm_style_eval_249,8,2048,1536,bf16,NVIDIA GeForce RTX 4060,c00,32,32,32,2,2,8,0.0,0.0,43.007999658584595,57.398400530219064,1.1702857235759294,1,0,-1,8x2048x1536,0,
2026-03-02T12:39:35.876029+00:00,A,llm_style,eval,llm_style_eval_250,32,6144,1536,bf16,NVIDIA GeForce RTX 4060,c11,32,128,32,4,2,8,0.0,0.0,78.84799689054489,186.10815912485117,7.660052250134291,2,0,-1,32x6144x1536,0,
2026-03-02T12:39:35.919957+00:00,A,llm_style,eval,llm_style_eval_251,64,8192,1024,bf16,NVIDIA GeForce RTX 4060,c06,64,128,32,4,3,8,0.0,0.0,73.64800199866295,101.59744031727308,14.579374794437646,3,0,-1,64x8192x1024,0,
2026-03-02T12:39:35.946597+00:00,A,llm_style,eval,llm_style_eval_252,1,3072,2048,bf16,NVIDIA GeForce RTX 4060,c00,32,32,32,2,2,8,0.0,0.0,48.51200059056282,149.84032139182082,0.2593773055495837,0,0,-1,1x3072x2048,0,
2026-03-02T12:39:36.010140+00:00,A,llm_style,eval,llm_style_eval_253,8,3072,1024,bf16,NVIDIA GeForce RTX 4060,c00,32,32,32,2,2,8,0.0,63.491,16.176000237464905,153.58304291963577,3.111501438002448,1,0,-1,8x3072x1024,0,
2026-03-02T12:39:36.065360+00:00,A,llm_style,eval,llm_style_eval_254,2,1024,1536,bf16,NVIDIA GeForce RTX 4060,c00,32,32,32,2,2,8,0.0,55.173,39.88800011575222,120.85727974772453,0.15772803805010605,0,0,-1,2x1024x1536,0,
2026-03-02T12:39:36.156858+00:00,A,llm_style,eval,llm_style_eval_255,64,4096,4096,bf16,NVIDIA GeForce RTX 4060,c03,64,64,32,4,2,8,0.0,0.0,168.06400567293167,232.44799673557281,12.77777260753385,3,1,-1,64x4096x4096,0,
