results/llm_clean_ab_run1.csv
timestamp,method,workload,split,shape_id,M,N,K,dtype,gpu,config_id,BLOCK_M,BLOCK_N,BLOCK_K,num_warps,num_stages,GROUP_M,compile_time_ms,tune_time_ms,runtime_cost_us,p99_us,runtime_perf_tflops,bucket_m,bucket_n,bucket_k,cache_key,invalid_config,notes
2026-03-02T12:37:05.209373+00:00,A,llm_style,tune,llm_style_tune_000,4,2048,2048,bf16,NVIDIA GeForce RTX 4060,c03,64,64,32,4,2,8,122.89137102197856,3585.43,56.32000043988228,107.84703738987444,0.5957818135285181,1,0,-1,4x2048x2048,0,
2026-03-02T12:37:07.352865+00:00,A,llm_style,tune,llm_style_tune_001,32,6144,1536,bf16,NVIDIA GeForce RTX 4060,c11,32,128,32,4,2,8,0.0,2143.451,52.000001072883606,58.38848114013672,11.614995452662727,2,0,-1,32x6144x1536,0,
2026-03-02T12:37:07.775902+00:00,A,llm_style,tune,llm_style_tune_002,4,8192,4096,bf16,NVIDIA GeForce RTX 4060,c11,32,128,32,4,2,8,0.0,422.985,293.88800263404846,386.96095913648605,0.9133937200364651,1,1,-1,4x8192x4096,0,
2026-03-02T12:37:07.842822+00:00,A,llm_style,tune,llm_style_tune_003,2,1536,1536,bf16,NVIDIA GeForce RTX 4060,c04,64,64,64,4,3,8,0.0,66.87,40.672000497579575,53.654400222003446,0.23203146844379133,0,0,-1,2x1536x1536,0,
2026-03-02T12:37:07.904559+00:00,A,llm_style,tune,llm_style_tune_004,16,1536,1536,bf16,NVIDIA GeForce RTX 4060,c04,64,64,64,4,3,8,0.0,61.693,40.84799997508526,50.21696019917726,1.8482538201637477,2,0,-1,16x1536x1536,0,
2026-03-02T12:37:08.141269+00:00,A,llm_style,tune,llm_style_tune_005,16,3072,6144,bf16,NVIDIA GeForce RTX 4060,c11,32,128,32,4,2,8,0.0,236.666,179.19999361038208,190.93568041920662,3.370422977319839,2,1,-1,16x3072x6144,0,
2026-03-02T12:37:08.206654+00:00,A,llm_style,tune,llm_style_tune_006,16,1536,1024,bf16,NVIDIA GeForce RTX 4060,c04,64,64,64,4,3,8,0.0,65.341,39.664000272750854,50.05088098347186,1.2689503744930593,2,0,-1,16x1536x1024,0,
2026-03-02T12:37:08.273310+00:00,A,llm_style,tune,llm_style_tune_007,64,2048,1536,bf16,NVIDIA GeForce RTX 4060,c03,64,64,32,4,2,8,0.0,66.616,45.93599960207939,51.72223888337612,8.765525676767313,3,0,-1,64x2048x1536,0,
2026-03-02T12:37:08.655941+00:00,A,llm_style,tune,llm_style_tune_008,2,8192,4096,bf16,NVIDIA GeForce RTX 4060,c11,32,128,32,4,2,8,0.0,382.59,292.4000024795532,317.02015936374664,0.4590209536998396,0,1,-1,2x8192x4096,0,
2026-03-02T12:37:09.229749+00:00,A,llm_style,tune,llm_style_tune_009,4,8192,6144,bf16,NVIDIA GeForce RTX 4060,c11,32,128,32,4,2,8,0.0,573.766,425.9839951992035,458.81344616413116,0.9452307798834243,1,1,-1,4x8192x6144,0,
2026-03-02T12:37:09.459506+00:00,A,llm_style,tune,llm_style_tune_010,2,3072,6144,bf16,NVIDIA GeForce RTX 4060,c06,64,128,32,4,3,8,0.0,229.71,176.9919991493225,189.90528032183647,0.42655867136855824,0,1,-1,2x3072x6144,0,
2026-03-02T12:37:09.705060+00:00,A,llm_style,tune,llm_style_tune_011,32,6144,3072,bf16,NVIDIA GeForce RTX 4060,c11,32,128,32,4,2,8,0.0,245.505,178.00000309944153,262.1788789331912,6.786289499810632,2,1,-1,32x6144x3072,0,
2026-03-02T12:37:09.797805+00:00,A,llm_style,tune,llm_style_tune_012,8,6144,1024,bf16,NVIDIA GeForce RTX 4060,c11,32,128,32,4,2,8,0.0,92.703,40.65600037574768,49.694720022380345,2.475976364365841,1,0,-1,8x6144x1024,0,
2026-03-02T12:37:09.907816+00:00,A,llm_style,tune,llm_style_tune_013,16,4096,2048,bf16,NVIDIA GeForce RTX 4060,c11,32,128,32,4,2,8,0.0,109.963,52.22399905323982,59.90624129772185,5.140078524556174,2,0,-1,16x4096x2048,0,
2026-03-02T12:37:10.116363+00:00,A,llm_style,tune,llm_style_tune_014,8,8192,2048,bf16,NVIDIA GeForce RTX 4060,c11,32,128,32,4,2,8,0.0,208.498,160.5599969625473,169.4447971880436,1.671870086436387,1,0,-1,8x8192x2048,0,
2026-03-02T12:37:10.258479+00:00,A,llm_style,tune,llm_style_tune_015,16,1536,6144,bf16,NVIDIA GeForce RTX 4060,c04,64,64,64,4,3,8,0.0,142.063,69.68000158667564,77.22048260271548,4.333953517844741,2,1,-1,16x1536x6144,0,
2026-03-02T12:37:10.316688+00:00,A,llm_style,tune,llm_style_tune_016,64,1536,1024,bf16,NVIDIA GeForce RTX 4060,c04,64,64,64,4,3,8,0.0,58.164,36.607999354600906,50.80064039677379,5.499524572481102,3,0,-1,64x1536x1024,0,
2026-03-02T12:37:10.375113+00:00,A,llm_style,tune,llm_style_tune_017,64,1536,1536,bf16,NVIDIA GeForce RTX 4060,c04,64,64,64,4,3,8,0.0,58.387,38.91199827194214,50.081919468939304,7.760842449917372,3,0,-1,64x1536x1536,0,
2026-03-02T12:37:10.478451+00:00,A,llm_style,tune,llm_style_tune_018,2,8192,1024,bf16,NVIDIA GeForce RTX 4060,c11,32,128,32,4,2,8,0.0,103.288,48.128001391887665,104.60640035569651,0.6971914691985496,0,0,-1,2x8192x1024,0,
2026-03-02T12:37:10.628561+00:00,A,llm_style,tune,llm_style_tune_019,64,1024,8192,bf16,NVIDIA GeForce RTX 4060,c04,64,64,64,4,3,8,0.0,150.062,84.84799787402153,97.73728221654889,12.65488698500869,3,1,-1,64x1024x8192,0,
2026-03-02T12:37:12.795083+00:00,A,llm_style,tune,llm_style_tune_020,1,2048,2048,bf16,NVIDIA GeForce RTX 4060,c00,32,32,32,2,2,8,0.0,2166.473,43.36000047624111,107.39455819129944,0.1934642045171677,0,0,-1,1x2048x2048,0,
2026-03-02T12:37:13.585738+00:00,A,llm_style,tune,llm_style_tune_021,64,6144,8192,bf16,NVIDIA GeForce RTX 4060,c06,64,128,32,4,3,8,0.0,790.607,433.50400030612946,504.6988755464553,14.861341393506185,3,1,-1,64x6144x8192,0,
2026-03-02T12:37:13.904274+00:00,A,llm_style,tune,llm_style_tune_022,2,4096,6144,bf16,NVIDIA GeForce RTX 4060,c11,32,128,32,4,2,8,0.0,318.494,226.27199441194534,281.95295453071583,0.44487739749504673,0,1,-1,2x4096x6144,0,
2026-03-02T12:37:14.024602+00:00,A,llm_style,tune,llm_style_tune_023,64,8192,1024,bf16,NVIDIA GeForce RTX 4060,c06,64,128,32,4,3,8,0.0,120.281,65.51999971270561,80.61664171516892,16.388001048659657,3,0,-1,64x8192x1024,0,
2026-03-02T12:37:14.097658+00:00,A,llm_style,tune,llm_style_tune_024,8,1024,2048,bf16,NVIDIA GeForce RTX 4060,c04,64,64,64,4,3,8,0.0,73.011,47.26399853825569,120.1356796920298,0.7099363794377425,1,0,-1,8x1024x2048,0,
2026-03-02T12:37:14.115648+00:00,A,llm_style,tune,llm_style_tune_025,4,2048,2048,bf16,NVIDIA GeForce RTX 4060,c03,64,64,32,4,2,8,0.0,0.0,49.15200173854828,108.94272305071345,0.6826666425201637,1,0,-1,4x2048x2048,0,
2026-03-02T12:37:14.178580+00:00,A,llm_style,tune,llm_style_tune_026,4,3072,1024,bf16,NVIDIA GeForce RTX 4060,c00,32,32,32,2,2,8,0.0,62.886,32.76799991726875,197.4419227242469,0.7680000019390135,1,0,-1,4x3072x1024,0,
2026-03-02T12:37:14.256139+00:00,A,llm_style,tune,llm_style_tune_027,16,3072,1536,bf16,NVIDIA GeForce RTX 4060,c11,32,128,32,4,2,8,0.0,77.513,46.08000069856644,50.4396802932024,3.2767999503241656,2,0,-1,16x3072x1536,0,
2026-03-02T12:37:14.338289+00:00,A,llm_style,tune,llm_style_tune_028,64,6144,1024,bf16,NVIDIA GeForce RTX 4060,c06,64,128,32,4,3,8,0.0,82.104,52.22399905323982,99.12608116865147,15.420235573668524,3,0,-1,64x6144x1024,0,
2026-03-02T12:37:14.453242+00:00,A,llm_style,tune,llm_style_tune_029,64,2048,4096,bf16,NVIDIA GeForce RTX 4060,c11,32,128,32,4,2,8,0.0,114.907,76.83200016617775,109.12351988255966,13.975190307132891,3,1,-1,64x2048x4096,0,
2026-03-02T12:37:14.666144+00:00,A,llm_style,tune,llm_style_tune_030,1,8192,2048,bf16,NVIDIA GeForce RTX 4060,c11,32,128,32,4,2,8,0.0,212.854,159.45599973201752,221.2169592082499,0.2104306646121296,0,0,-1,1x8192x2048,0,
2026-03-02T12:37:14.716291+00:00,A,llm_style,tune,llm_style_tune_031,64,1024,8192,bf16,NVIDIA GeForce RTX 4060,c04,64,64,64,4,3,8,0.0,0.0,81.91999793052673,146.91456004977226,13.107200331115731,3,1,-1,64x1024x8192,0,
2026-03-02T12:37:15.011390+00:00,A,llm_style,tune,llm_style_tune_032,4,6144,4096,bf16,NVIDIA GeForce RTX 4060,c00,32,32,32,2,2,8,0.0,295.047,227.13599354028702,289.2166441679001,0.8863702703477103,1,1,-1,4x6144x4096,0,
2026-03-02T12:37:15.090133+00:00,A,llm_style,tune,llm_style_tune_033,1,4096,1024,bf16,NVIDIA GeForce RTX 4060,c11,32,128,32,4,2,8,0.0,78.687,40.720000863075256,52.15072009712457,0.2060070683251571,0,0,-1,1x4096x1024,0,
2026-03-02T12:37:15.479808+00:00,A,llm_style,tune,llm_style_tune_034,4,4096,8192,bf16,NVIDIA GeForce RTX 4060,c11,32,128,32,4,2,8,0.0,389.628,292.62399673461914,312.3206403851509,0.9173391758552333,1,1,-1,4x4096x8192,0,
2026-03-02T12:37:15.557684+00:00,A,llm_style,tune,llm_style_tune_035,32,1024,3072,bf16,NVIDIA GeForce RTX 4060,c00,32,32,32,2,2,8,0.0,77.82,49.00800064206123,98.53952143341289,4.108035205729469,2,1,-1,32x1024x3072,0,
2026-03-02T12:37:15.622341+00:00,A,llm_style,tune,llm_style_tune_036,16,2048,1536,bf16,NVIDIA GeForce RTX 4060,c00,32,32,32,2,2,8,0.0,64.612,41.98399931192398,236.96384131908377,2.397658575880606,2,0,-1,16x2048x1536,0,
2026-03-02T12:37:15.846167+00:00,A,llm_style,tune,llm_style_tune_037,1,2048,8192,bf16,NVIDIA GeForce RTX 4060,c04,64,64,64,4,3,8,0.0,223.776,162.55999356508255,183.25728505849838,0.2064126065960143,0,1,-1,1x2048x8192,0,
2026-03-02T12:37:15.934473+00:00,A,llm_style,tune,llm_style_tune_038,64,3072,2048,bf16,NVIDIA GeForce RTX 4060,c06,64,128,32,4,3,8,0.0,88.257,53.247999399900436,59.934719763696194,15.123692478134789,3,0,-1,64x3072x2048,0,
2026-03-02T12:37:16.018081+00:00,A,llm_style,tune,llm_style_tune_039,64,1536,3072,bf16,NVIDIA GeForce RTX 4060,c04,64,64,64,4,3,8,0.0,83.561,50.175998359918594,59.73408028483391,12.037224883251529,3,1,-1,64x1536x3072,0,
2026-03-02T12:37:16.338172+00:00,A,llm_style,tune,llm_style_tune_040,8,8192,3072,bf16,NVIDIA GeForce RTX 4060,c11,32,128,32,4,2,8,0.0,320.04,225.37600249052048,249.5276860892772,1.786584106339964,1,1,-1,8x8192x3072,0,
2026-03-02T12:37:16.434268+00:00,A,llm_style,tune,llm_style_tune_041,2,1024,4096,bf16,NVIDIA GeForce RTX 4060,c00,32,32,32,2,2,8,0.0,96.053,56.6560011357069,238.47328215837462,0.29612425274798154,0,1,-1,2x1024x4096,0,
2026-03-02T12:37:16.564598+00:00,A,llm_style,tune,llm_style_tune_042,64,1536,6144,bf16,NVIDIA GeForce RTX 4060,c04,64,64,64,4,3,8,0.0,130.282,72.65600189566612,82.00159855186939,16.62573662853934,3,1,-1,64x1536x6144,0,
2026-03-02T12:37:16.593651+00:00,A,llm_style,tune,llm_style_tune_043,16,3072,1536,bf16,NVIDIA GeForce RTX 4060,c11,32,128,32,4,2,8,0.0,0.0,56.70400150120258,92.73344144225109,2.6628622319854744,2,0,-1,16x3072x1536,0,
2026-03-02T12:37:16.670832+00:00,A,llm_style,tune,llm_style_tune_044,8,4096,1024,bf16,NVIDIA GeForce RTX 4060,c11,32,128,32,4,2,8,0.0,77.129,40.95999896526337,68.40127859264605,1.6384000413894664,1,0,-1,8x4096x1024,0,
2026-03-02T12:37:16.812777+00:00,A,llm_style,tune,llm_style_tune_045,32,3072,4096,bf16,NVIDIA GeForce RTX 4060,c04,64,64,64,4,3,8,0.0,141.896,80.89599758386612,90.63424088060856,9.95483574036066,2,1,-1,32x3072x4096,0,
2026-03-02T12:37:17.030806+00:00,A,llm_style,tune,llm_style_tune_046,64,4096,4096,bf16,NVIDIA GeForce RTX 4060,c00,32,32,32,2,2,8,0.0,217.986,144.3839967250824,265.5731157958506,14.873418777075168,3,1,-1,64x4096x4096,0,
2026-03-02T12:37:17.192623+00:00,A,llm_style,tune,llm_style_tune_047,4,4096,8192,bf16,NVIDIA GeForce RTX 4060,c11,32,128,32,4,2,8,0.0,0.0,294.9120104312897,317.28510677814484,0.9102221900268849,1,1,-1,4x4096x8192,0,
2026-03-02T12:37:17.406526+00:00,A,llm_style,tune,llm_style_tune_048,2,4096,4096,bf16,NVIDIA GeForce RTX 4060,c03,64,64,32,4,2,8,0.0,213.85,160.75199842453003,179.87040117383,0.41746830308617483,0,1,-1,2x4096x4096,0,
2026-03-02T12:37:17.493418+00:00,A,llm_style,tune,llm_style_tune_049,2,3072,2048,bf16,NVIDIA GeForce RTX 4060,c11,32,128,32,4,2,8,0.0,86.842,52.22399905323982,63.51200040429829,0.4818823616771414,0,0,-1,2x3072x2048,0,
2026-03-02T12:37:17.587308+00:00,A,llm_style,tune,llm_style_tune_050,4,8192,1024,bf16,NVIDIA GeForce RTX 4060,c00,32,32,32,2,2,8,0.0,93.836,48.128001391887665,103.90463992953296,1.3943829383970991,1,0,-1,4x8192x1024,0,
2026-03-02T12:37:17.970588+00:00,A,llm_style,tune,llm_style_tune_051,1,8192,4096,bf16,NVIDIA GeForce RTX 4060,c11,32,128,32,4,2,8,0.0,383.233,290.8160090446472,358.154249191284,0.23076055620341446,0,1,-1,1x8192x4096,0,
2026-03-02T12:37:18.386484+00:00,A,llm_style,tune,llm_style_tune_052,8,4096,8192,bf16,NVIDIA GeForce RTX 4060,c11,32,128,32,4,2,8,0.0,415.85,291.83998703956604,323.96672040224075,1.8396070992396736,1,1,-1,8x4096x8192,0,
2026-03-02T12:37:18.470789+00:00,A,llm_style,tune,llm_style_tune_053,64,4096,1024,bf16,NVIDIA GeForce RTX 4060,c11,32,128,32,4,2,8,0.0,84.258,49.15200173854828,52.746239230036736,10.92266628032262,3,0,-1,64x4096x1024,0,
2026-03-02T12:37:18.532745+00:00,A,llm_style,tune,llm_style_tune_054,1,2048,1536,bf16,NVIDIA GeForce RTX 4060,c00,32,32,32,2,2,8,0.0,61.91,41.440000757575035,124.36576001346108,0.15182084664537446,0,0,-1,1x2048x1536,0,
2026-03-02T12:37:18.686582+00:00,A,llm_style,tune,llm_style_tune_055,64,6144,2048,bf16,NVIDIA GeForce RTX 4060,c10,64,128,64,8,3,8,0.0,153.785,104.16000336408615,109.53823946416378,15.462871389992015,3,0,-1,64x6144x2048,0,
2026-03-02T12:37:18.787347+00:00,A,llm_style,tune,llm_style_tune_056,16,1536,4096,bf16,NVIDIA GeForce RTX 4060,c04,64,64,64,4,3,8,0.0,100.722,57.34400078654289,66.56000018119812,3.510857094701456,2,1,-1,16x1536x4096,0,
2026-03-02T12:37:19.001541+00:00,A,llm_style,tune,llm_style_tune_057,16,4096,4096,bf16,NVIDIA GeForce RTX 4060,c11,32,128,32,4,2,8,0.0,214.151,160.800002515316,192.53247812390327,3.338749400509889,2,1,-1,16x4096x4096,0,
2026-03-02T12:37:19.291742+00:00,A,llm_style,tune,llm_style_tune_058,1,3072,8192,bf16,NVIDIA GeForce RTX 4060,c06,64,128,32,4,3,8,0.0,290.155,226.30399465560913,259.5254376530647,0.2224072450713697,0,1,-1,1x3072x8192,0,
2026-03-02T12:37:19.335195+00:00,A,llm_style,tune,llm_style_tune_059,64,1024,8192,bf16,NVIDIA GeForce RTX 4060,c04,64,64,64,4,3,8,0.0,0.0,86.87999844551086,140.08320242166502,12.358907035126458,3,1,-1,64x1024x8192,0,
2026-03-02T12:37:19.445959+00:00,A,llm_style,tune,llm_style_tune_060,16,3072,3072,bf16,NVIDIA GeForce RTX 4060,c00,32,32,32,2,2,8,0.0,110.713,59.776000678539276,70.61856098473072,5.052025638584084,2,1,-1,16x3072x3072,0,
2026-03-02T12:37:19.506698+00:00,A,llm_style,tune,llm_style_tune_061,1,1024,1536,bf16,NVIDIA GeForce RTX 4060,c00,32,32,32,2,2,8,0.0,60.693,40.95999896526337,243.56703415513033,0.07680000194013124,0,0,-1,1x1024x1536,0,
2026-03-02T12:37:19.586089+00:00,A,llm_style,tune,llm_style_tune_062,32,6144,1024,bf16,NVIDIA GeForce RTX 4060,c11,32,128,32,4,2,8,0.0,79.347,41.9359989464283,48.15807927399872,9.60161183985088,2,0,-1,32x6144x1024,0,
2026-03-02T12:37:19.662541+00:00,A,llm_style,tune,llm_style_tune_063,4,1536,3072,bf16,NVIDIA GeForce RTX 4060,c04,64,64,64,4,3,8,0.0,76.406,48.96000027656555,64.696321375668,0.7710117603505863,1,1,-1,4x1536x3072,0,
2026-03-02T12:37:19.762759+00:00,A,llm_style,eval,llm_style_eval_000,32,8192,1024,bf16,NVIDIA GeForce RTX 4060,c11,32,128,32,4,2,8,0.0,100.173,50.08000135421753,53.59072010964155,10.720265524808877,2,0,-1,32x8192x1024,0,
2026-03-02T12:37:19.796105+00:00,A,llm_style,eval,llm_style_eval_001,2,3072,2048,bf16,NVIDIA GeForce RTX 4060,c11,32,128,32,4,2,8,0.0,0.0,51.231998950242996,149.5158367604015,0.4912130019451571,0,0,-1,2x3072x2048,0,
2026-03-02T12:37:19.861592+00:00,A,llm_style,eval,llm_style_eval_002,32,1536,1536,bf16,NVIDIA GeForce RTX 4060,c04,64,64,64,4,3,8,0.0,65.423,43.68000105023384,51.11040145158767,3.4568438729282414,2,0,-1,32x1536x1536,0,
2026-03-02T12:37:20.470234+00:00,A,llm_style,eval,llm_style_eval_003,16,8192,6144,bf16,NVIDIA GeForce RTX 4060,c11,32,128,32,4,2,8,0.0,608.595,428.0160069465637,531.2169688940048,3.762973136191795,2,1,-1,16x8192x6144,0,
2026-03-02T12:37:20.543667+00:00,A,llm_style,eval,llm_style_eval_004,2,3072,1536,bf16,NVIDIA GeForce RTX 4060,c00,32,32,32,2,2,8,0.0,73.386,45.05600035190582,826.2041372060753,0.4189090876372393,0,0,-1,2x3072x1536,0,
2026-03-02T12:37:20.834108+00:00,A,llm_style,eval,llm_style_eval_005,8,3072,8192,bf16,NVIDIA GeForce RTX 4060,c07,128,128,32,8,3,8,0.0,290.389,227.32800245285034,264.79999512434,1.7712432241316751,1,1,-1,8x3072x8192,0,
2026-03-02T12:37:21.009198+00:00,A,llm_style,eval,llm_style_eval_006,64,2048,6144,bf16,NVIDIA GeForce RTX 4060,c04,64,64,64,4,3,8,0.0,175.046,110.4159988462925,128.53055797517297,14.58676960611565,3,1,-1,64x2048x6144,0,
2026-03-02T12:37:21.093493+00:00,A,llm_style,eval,llm_style_eval_007,8,3072,2048,bf16,NVIDIA GeForce RTX 4060,c11,32,128,32,4,2,8,0.0,84.251,51.263999193906784,70.23264218121763,1.9636254990415336,1,0,-1,8x3072x2048,0,
2026-03-02T12:37:21.169664+00:00,A,llm_style,eval,llm_style_eval_008,16,3072,2048,bf16,NVIDIA GeForce RTX 4060,c00,32,32,32,2,2,8,0.0,76.124,45.05600035190582,128.22528235614297,4.468363601463886,2,0,-1,16x3072x2048,0,
2026-03-02T12:37:21.602878+00:00,A,llm_style,eval,llm_style_eval_009,64,6144,6144,bf16,NVIDIA GeForce RTX 4060,c06,64,128,32,4,3,8,0.0,433.166,332.751989364624,398.13055664300913,14.520839431271899,3,1,-1,64x6144x6144,0,
2026-03-02T12:37:21.652281+00:00,A,llm_style,eval,llm_style_eval_010,64,1536,6144,bf16,NVIDIA GeForce RTX 4060,c04,64,64,64,4,3,8,0.0,0.0,72.78400287032127,128.0636817216873,16.596497916612428,3,1,-1,64x1536x6144,0,
2026-03-02T12:37:22.045782+00:00,A,llm_style,eval,llm_style_eval_011,32,4096,8192,bf16,NVIDIA GeForce RTX 4060,c11,32,128,32,4,2,8,0.0,393.447,295.9039956331253,312.40191400051117,7.257366171771956,2,1,-1,32x4096x8192,0,
2026-03-02T12:37:22.106857+00:00,A,llm_style,eval,llm_style_eval_012,32,1536,1024,bf16,NVIDIA GeForce RTX 4060,c04,64,64,64,4,3,8,0.0,61.03,38.99199888110161,51.90655887126919,2.581639795050078,2,0,-1,32x1536x1024,0,
2026-03-02T12:37:22.279055+00:00,A,llm_style,eval,llm_style_eval_013,32,2048,6144,bf16,NVIDIA GeForce RTX 4060,c06,64,128,32,4,3,8,0.0,172.153,104.86400127410889,114.98880006372929,7.679531185301353,2,1,-1,32x2048x6144,0,
2026-03-02T12:37:22.324840+00:00,A,llm_style,eval,llm_style_eval_014,2,8192,1024,bf16,NVIDIA GeForce RTX 4060,c11,32,128,32,4,2,8,0.0,0.0,46.41599953174591,129.38720248639567,0.7229065912294029,0,0,-1,2x8192x1024,0,
2026-03-02T12:37:22.398061+00:00,A,llm_style,eval,llm_style_eval_015,32,2048,2048,bf16,NVIDIA GeForce RTX 4060,c00,32,32,32,2,2,8,0.0,73.165,47.10400104522705,117.34975844621655,5.698782482240965,2,0,-1,32x2048x2048,0,
2026-03-02T12:37:22.616051+00:00,A,llm_style,eval,llm_style_eval_016,32,4096,4096,bf16,NVIDIA GeForce RTX 4060,c00,32,32,32,2,2,8,0.0,217.942,162.60799765586853,246.15872114896763,6.603253465259361,2,1,-1,32x4096x4096,0,
2026-03-02T12:37:23.203389+00:00,A,llm_style,eval,llm_style_eval_017,8,8192,6144,bf16,NVIDIA GeForce RTX 4060,c11,32,128,32,4,2,8,0.0,587.279,425.9359985589981,444.9839928746223,1.8906745866150447,1,1,-1,8x8192x6144,0,
2026-03-02T12:37:23.284224+00:00,A,llm_style,eval,llm_style_eval_018,8,2048,2048,bf16,NVIDIA GeForce RTX 4060,c00,32,32,32,2,2,8,0.0,80.787,47.519998624920845,236.79935976862907,1.412223609888873,1,0,-1,8x2048x2048,0,
2026-03-02T12:37:23.340167+00:00,A,llm_style,eval,llm_style_eval_019,32,3072,1024,bf16,NVIDIA GeForce RTX 4060,c02,32,64,32,2,2,8,0.0,55.899,38.91199827194214,44.42880105227232,5.173894966611581,2,0,-1,32x3072x1024,0,
2026-03-02T12:37:23.362996+00:00,A,llm_style,eval,llm_style_eval_020,64,1536,3072,bf16,NVIDIA GeForce RTX 4060,c04,64,64,64,4,3,8,0.0,0.0,45.05600035190582,205.88544234633423,13.405090804391657,3,1,-1,64x1536x3072,0,
2026-03-02T12:37:23.386338+00:00,A,llm_style,eval,llm_style_eval_021,64,6144,1024,bf16,NVIDIA GeForce RTX 4060,c06,64,128,32,4,3,8,0.0,0.0,49.96800050139427,57.364480793476105,16.116441721087664,3,0,-1,64x6144x1024,0,
2026-03-02T12:37:23.423424+00:00,A,llm_style,eval,llm_style_eval_022,32,6144,1536,bf16,NVIDIA GeForce RTX 4060,c11,32,128,32,4,2,8,0.0,0.0,50.175998359918594,126.8432006239891,12.037224883251529,2,0,-1,32x6144x1536,0,
2026-03-02T12:37:23.514411+00:00,A,llm_style,eval,llm_style_eval_023,8,1024,4096,bf16,NVIDIA GeForce RTX 4060,c04,64,64,64,4,3,8,0.0,90.932,55.93600124120712,60.98720047622919,1.199743680471782,1,1,-1,8x1024x4096,0,
2026-03-02T12:37:24.274125+00:00,A,llm_style,eval,llm_style_eval_024,64,8192,8192,bf16,NVIDIA GeForce RTX 4060,c06,64,128,32,4,3,8,0.0,759.668,573.4080076217651,767.2713541984556,14.980492908752932,3,1,-1,64x8192x8192,0,
2026-03-02T12:37:24.499707+00:00,A,llm_style,eval,llm_style_eval_025,2,8192,2048,bf16,NVIDIA GeForce RTX 4060,c11,32,128,32,4,2,8,0.0,225.534,159.743994474411,164.36223983764648,0.4201025786340281,0,0,-1,2x8192x2048,0,
2026-03-02T12:37:24.580653+00:00,A,llm_style,eval,llm_style_eval_026,32,4096,1024,bf16,NVIDIA GeForce RTX 4060,c11,32,128,32,4,2,8,0.0,80.894,40.95999896526337,46.52768023312092,6.5536001655578655,2,0,-1,32x4096x1024,0,
2026-03-02T12:37:24.663692+00:00,A,llm_style,eval,llm_style_eval_027,8,4096,1536,bf16,NVIDIA GeForce RTX 4060,c00,32,32,32,2,2,8,0.0,82.992,44.015999883413315,97.04447925090784,2.2869705622189733,1,0,-1,8x4096x1536,0,
2026-03-02T12:37:24.683797+00:00,A,llm_style,eval,llm_style_eval_028,2,1536,1536,bf16,NVIDIA GeForce RTX 4060,c04,64,64,64,4,3,8,0.0,0.0,62.17600032687187,126.115837842226,0.15178177995346767,0,0,-1,2x1536x1536,0,
2026-03-02T12:37:24.990346+00:00,A,llm_style,eval,llm_style_eval_029,16,3072,8192,bf16,NVIDIA GeForce RTX 4060,c10,64,128,64,8,3,8,0.0,306.5,227.32800245285034,275.84991246461857,3.5424864482633502,2,1,-1,16x3072x8192,0,
2026-03-02T12:37:25.006128+00:00,A,llm_style,eval,llm_style_eval_030,2,1536,1536,bf16,NVIDIA GeForce RTX 4060,c04,64,64,64,4,3,8,0.0,0.0,39.51999917626381,58.42943925410508,0.23879514667773796,0,0,-1,2x1536x1536,0,
2026-03-02T12:37:25.119057+00:00,A,llm_style,eval,llm_style_eval_031,64,4096,2048,bf16,NVIDIA GeForce RTX 4060,c04,64,64,64,4,3,8,0.0,112.886,67.58400052785873,83.43584083020684,15.88751502742715,3,0,-1,64x4096x2048,0,
2026-03-02T12:37:25.527409+00:00,A,llm_style,eval,llm_style_eval_032,64,8192,4096,bf16,NVIDIA GeForce RTX 4060,c10,64,128,64,8,3,8,0.0,408.301,301.56800150871277,400.52736103534676,14.242118774249038,3,1,-1,64x8192x4096,0,
2026-03-02T12:37:25.683934+00:00,A,llm_style,eval,llm_style_eval_033,32,4096,3072,bf16,NVIDIA GeForce RTX 4060,c00,32,32,32,2,2,8,0.0,156.477,79.85599711537361,131.8195235729217,10.084482031280842,2,1,-1,32x4096x3072,0,
2026-03-02T12:37:25.982104+00:00,A,llm_style,eval,llm_style_eval_034,64,6144,4096,bf16,NVIDIA GeForce RTX 4060,c01,64,32,32,2,2,8,0.0,298.114,233.47200453281403,248.8527904450893,13.797052363711826,3,1,-1,64x6144x4096,0,
2026-03-02T12:37:26.259545+00:00,A,llm_style,eval,llm_style_eval_035,64,6144,8192,bf16,NVIDIA GeForce RTX 4060,c06,64,128,32,4,3,8,0.0,0.0,434.60799753665924,464.5171245932579,14.823590409094068,3,1,-1,64x6144x8192,0,
2026-03-02T12:37:26.472822+00:00,A,llm_style,eval,llm_style_eval_036,4,8192,2048,bf16,NVIDIA GeForce RTX 4060,c11,32,128,32,4,2,8,0.0,213.225,159.743994474411,173.63967537879944,0.8402051572680562,1,0,-1,4x8192x2048,0,
2026-03-02T12:37:26.520119+00:00,A,llm_style,eval,llm_style_eval_037,64,2048,4096,bf16,NVIDIA GeForce RTX 4060,c11,32,128,32,4,2,8,0.0,0.0,78.32000032067299,182.05055475234968,13.709675939781373,3,1,-1,64x2048x4096,0,
2026-03-02T12:37:26.562830+00:00,A,llm_style,eval,llm_style_eval_038,64,4096,2048,bf16,NVIDIA GeForce RTX 4060,c04,64,64,64,4,3,8,0.0,0.0,70.46400010585785,157.74208165705176,15.23816164831575,3,0,-1,64x4096x2048,0,
2026-03-02T12:37:26.624297+00:00,A,llm_style,eval,llm_style_eval_039,64,6144,2048,bf16,NVIDIA GeForce RTX 4060,c10,64,128,64,8,3,8,0.0,0.0,104.44799810647964,227.3123186826706,15.420235573668524,3,0,-1,64x6144x2048,0,
2026-03-02T12:37:26.854990+00:00,A,llm_style,eval,llm_style_eval_040,8,6144,3072,bf16,NVIDIA GeForce RTX 4060,c02,32,64,32,2,2,8,0.0,230.635,178.17600071430206,251.22592285275442,1.69489654492935,1,1,-1,8x6144x3072,0,
2026-03-02T12:37:26.993029+00:00,A,llm_style,eval,llm_style_eval_041,2,8192,1536,bf16,NVIDIA GeForce RTX 4060,c02,32,64,32,2,2,8,0.0,137.982,61.43999844789505,65.55647984147072,0.8192000206947333,0,0,-1,2x8192x1536,0,
2026-03-02T12:37:27.004820+00:00,A,llm_style,eval,llm_style_eval_042,32,1536,1536,bf16,NVIDIA GeForce RTX 4060,c04,64,64,64,4,3,8,0.0,0.0,33.79200026392937,55.259519368410096,4.468363601463886,2,0,-1,32x1536x1536,0,
2026-03-02T12:37:27.023839+00:00,A,llm_style,eval,llm_style_eval_043,64,1536,3072,bf16,NVIDIA GeForce RTX 4060,c04,64,64,64,4,3,8,0.0,0.0,45.05600035190582,96.6192016005516,13.405090804391657,3,1,-1,64x1536x3072,0,
2026-03-02T12:37:27.074451+00:00,A,llm_style,eval,llm_style_eval_044,2,1536,1024,bf16,NVIDIA GeForce RTX 4060,c00,32,32,32,2,2,8,0.0,50.561,31.74399957060814,41.544959619641304,0.19819355106800332,0,0,-1,2x1536x1024,0,
2026-03-02T12:37:27.234414+00:00,A,llm_style,eval,llm_style_eval_045,64,4096,3072,bf16,NVIDIA GeForce RTX 4060,c04,64,64,64,4,3,8,0.0,159.908,95.16800194978714,99.2835196852684,16.923889364093164,3,1,-1,64x4096x3072,0,
2026-03-02T12:37:27.288209+00:00,A,llm_style,eval,llm_style_eval_046,64,2048,4096,bf16,NVIDIA GeForce RTX 4060,c11,32,128,32,4,2,8,0.0,0.0,81.31199702620506,117.67007805407037,13.205207881611328,3,1,-1,64x2048x4096,0,
2026-03-02T12:37:27.512170+00:00,A,llm_style,eval,llm_style_eval_047,2,6144,3072,bf16,NVIDIA GeForce RTX 4060,c11,32,128,32,4,2,8,0.0,223.882,176.4639988541603,222.78815969824785,0.42783498328401426,0,1,-1,2x6144x3072,0,
2026-03-02T12:37:27.908129+00:00,A,llm_style,eval,llm_style_eval_048,16,4096,8192,bf16,NVIDIA GeForce RTX 4060,c11,32,128,32,4,2,8,0.0,395.897,292.84799098968506,373.4857660531997,3.6665500772987043,2,1,-1,16x4096x8192,0,
2026-03-02T12:37:28.008488+00:00,A,llm_style,eval,llm_style_eval_049,16,2048,3072,bf16,NVIDIA GeForce RTX 4060,c00,32,32,32,2,2,8,0.0,100.302,53.247999399900436,75.93983955681321,3.780923119533697,2,1,-1,16x2048x3072,0,
2026-03-02T12:37:28.075067+00:00,A,llm_style,eval,llm_style_eval_050,16,1024,1536,bf16,NVIDIA GeForce RTX 4060,c04,64,64,64,4,3,8,0.0,66.531,43.007999658584595,120.36639980971813,1.1702857235759294,2,0,-1,16x1024x1536,0,
2026-03-02T12:37:28.180738+00:00,A,llm_style,eval,llm_style_eval_051,4,2048,4096,bf16,NVIDIA GeForce RTX 4060,c00,32,32,32,2,2,8,0.0,105.627,59.29600074887276,71.04768075048923,1.1317603742656417,1,1,-1,4x2048x4096,0,
2026-03-02T12:37:28.298829+00:00,A,llm_style,eval,llm_style_eval_052,4,1024,6144,bf16,NVIDIA GeForce RTX 4060,c04,64,64,64,4,3,8,0.0,118.04,70.65600156784058,76.1305582523346,0.7123478102801205,1,1,-1,4x1024x6144,0,
2026-03-02T12:37:28.367449+00:00,A,llm_style,eval,llm_style_eval_053,64,6144,2048,bf16,NVIDIA GeForce RTX 4060,c10,64,128,64,8,3,8,0.0,0.0,103.43999788165092,162.09919512271875,15.57050240703557,3,0,-1,64x6144x2048,0,
2026-03-02T12:37:28.391482+00:00,A,llm_style,eval,llm_style_eval_054,2,3072,2048,bf16,NVIDIA GeForce RTX 4060,c11,32,128,32,4,2,8,0.0,0.0,51.67999863624573,182.22079813480366,0.4869548116115848,0,0,-1,2x3072x2048,0,
2026-03-02T12:37:28.440524+00:00,A,llm_style,eval,llm_style_eval_055,4,1024,1024,bf16,NVIDIA GeForce RTX 4060,c04,64,64,64,4,3,8,0.0,48.992,34.73600000143051,50.10336026549336,0.24149608474362438,1,0,-1,4x1024x1024,0,
2026-03-02T12:37:28.490154+00:00,A,llm_style,eval,llm_style_eval_056,2,1024,1024,bf16,NVIDIA GeForce RTX 4060,c00,32,32,32,2,2,8,0.0,49.588,36.86400130391121,120.62175586819643,0.11377777375336061,0,0,-1,2x1024x1024,0,
2026-03-02T12:37:28.600611+00:00,A,llm_style,eval,llm_style_eval_057,2,1024,6144,bf16,NVIDIA GeForce RTX 4060,c04,64,64,64,4,3,8,0.0,110.419,70.48000022768974,143.52384388446805,0.35706333596339873,0,1,-1,2x1024x6144,0,
2026-03-02T12:37:28.675566+00:00,A,llm_style,eval,llm_style_eval_058,2,2048,1536,bf16,NVIDIA GeForce RTX 4060,c11,32,128,32,4,2,8,0.0,74.909,47.10400104522705,55.17344038933514,0.26713042885504523,0,0,-1,2x2048x1536,0,
2026-03-02T12:37:28.946715+00:00,A,llm_style,eval,llm_style_eval_059,8,8192,6144,bf16,NVIDIA GeForce RTX 4060,c11,32,128,32,4,2,8,0.0,0.0,429.05598878860474,532.1215975284576,1.8769260633645957,1,1,-1,8x8192x6144,0,
2026-03-02T12:37:29.344233+00:00,A,llm_style,eval,llm_style_eval_060,1,4096,8192,bf16,NVIDIA GeForce RTX 4060,c11,32,128,32,4,2,8,0.0,397.467,291.6480004787445,324.35008913278574,0.230102259881226,0,1,-1,1x4096x8192,0,
2026-03-02T12:37:29.438615+00:00,A,llm_style,eval,llm_style_eval_061,32,1536,3072,bf16,NVIDIA GeForce RTX 4060,c04,64,64,64,4,3,8,0.0,94.335,54.09600026905537,59.88160140812397,5.582480895038516,2,1,-1,32x1536x3072,0,
2026-03-02T12:37:29.470015+00:00,A,llm_style,eval,llm_style_eval_062,8,6144,1024,bf16,NVIDIA GeForce RTX 4060,c11,32,128,32,4,2,8,0.0,0.0,43.007999658584595,106.51647880673409,2.340571447151859,1,0,-1,8x6144x1024,0,
2026-03-02T12:37:29.639342+00:00,A,llm_style,eval,llm_style_eval_063,64,8192,4096,bf16,NVIDIA GeForce RTX 4060,c10,64,128,64,8,3,8,0.0,0.0,306.11200630664825,355.8659213781357,14.030705125945007,3,1,-1,64x8192x4096,0,
2026-03-02T12:37:29.716136+00:00,A,llm_style,eval,llm_style_eval_064,16,6144,1024,bf16,NVIDIA GeForce RTX 4060,c11,32,128,32,4,2,8,0.0,76.742,41.808001697063446,50.19648019224405,4.815503822899553,2,0,-1,16x6144x1024,0,
2026-03-02T12:37:30.098641+00:00,A,llm_style,eval,llm_style_eval_065,8,8192,4096,bf16,NVIDIA GeForce RTX 4060,c11,32,128,32,4,2,8,0.0,382.46,293.88800263404846,345.74335008859623,1.8267874400729303,1,1,-1,8x8192x4096,0,
2026-03-02T12:37:30.128287+00:00,A,llm_style,eval,llm_style_eval_066,32,1536,3072,bf16,NVIDIA GeForce RTX 4060,c04,64,64,64,4,3,8,0.0,0.0,64.51199948787689,202.37792000174517,4.681142894303718,2,1,-1,32x1536x3072,0,
2026-03-02T12:37:30.267065+00:00,A,llm_style,eval,llm_style_eval_067,8,8192,3072,bf16,NVIDIA GeForce RTX 4060,c11,32,128,32,4,2,8,0.0,0.0,231.31199926137924,344.0233677625656,1.740736257892993,1,1,-1,8x8192x3072,0,
2026-03-02T12:37:30.289339+00:00,A,llm_style,eval,llm_style_eval_068,64,1536,3072,bf16,NVIDIA GeForce RTX 4060,c04,64,64,64,4,3,8,0.0,0.0,62.463998794555664,157.75744125247002,9.669246088238634,3,1,-1,64x1536x3072,0,
2026-03-02T12:37:30.878704+00:00,A,llm_style,eval,llm_style_eval_069,64,8192,6144,bf16,NVIDIA GeForce RTX 4060,c06,64,128,32,4,3,8,0.0,589.312,441.23199582099915,463.85631650686264,14.601051159067802,3,1,-1,64x8192x6144,0,
2026-03-02T12:37:30.982595+00:00,A,llm_style,eval,llm_style_eval_070,8,8192,1024,bf16,NVIDIA GeForce RTX 4060,c11,32,128,32,4,2,8,0.0,103.834,49.535999074578285,57.88672097027302,2.709498758628653,1,0,-1,8x8192x1024,0,
2026-03-02T12:37:31.082524+00:00,A,llm_style,eval,llm_style_eval_071,2,6144,3072,bf16,NVIDIA GeForce RTX 4060,c11,32,128,32,4,2,8,0.0,0.0,182.27200210094452,202.27071776986122,0.41420224241674025,0,1,-1,2x6144x3072,0,
2026-03-02T12:37:31.140645+00:00,A,llm_style,eval,llm_style_eval_072,64,1024,1024,bf16,NVIDIA GeForce RTX 4060,c04,64,64,64,4,3,8,0.0,58.068,41.96799919009209,52.6774402335286,3.198096897401925,3,0,-1,64x1024x1024,0,
2026-03-02T12:37:31.225154+00:00,A,llm_style,eval,llm_style_eval_073,1,8192,2048,bf16,NVIDIA GeForce RTX 4060,c11,32,128,32,4,2,8,0.0,0.0,165.8879965543747,326.6662350296973,0.2022716091396133,0,0,-1,1x8192x2048,0,
2026-03-02T12:37:31.287357+00:00,A,llm_style,eval,llm_style_eval_074,64,1024,1536,bf16,NVIDIA GeForce RTX 4060,c04,64,64,64,4,3,8,0.0,62.152,44.384000822901726,55.7593597471714,4.53601721943276,3,0,-1,64x1024x1536,0,
2026-03-02T12:37:31.351108+00:00,A,llm_style,eval,llm_style_eval_075,2,1536,2048,bf16,NVIDIA GeForce RTX 4060,c04,64,64,64,4,3,8,0.0,63.708,41.760001331567764,47.957439795136445,0.301314932920947,0,0,-1,2x1536x2048,0,
2026-03-02T12:37:31.452431+00:00,A,llm_style,eval,llm_style_eval_076,64,2048,3072,bf16,NVIDIA GeForce RTX 4060,c03,64,64,32,4,2,8,0.0,101.281,64.51199948787689,74.79296296834944,12.483047718143245,3,1,-1,64x2048x3072,0,
2026-03-02T12:37:31.575344+00:00,A,llm_style,eval,llm_style_eval_077,1,3072,8192,bf16,NVIDIA GeForce RTX 4060,c06,64,128,32,4,3,8,0.0,0.0,229.23199832439423,237.9433649778366,0.21956641467119228,0,1,-1,1x3072x8192,0,
2026-03-02T12:37:31.638830+00:00,A,llm_style,eval,llm_style_eval_078,1,1024,2048,bf16,NVIDIA GeForce RTX 4060,c04,64,64,64,4,3,8,0.0,63.436,43.935999274253845,59.934719763696194,0.09546394913698548,0,0,-1,1x1024x2048,0,
2026-03-02T12:37:31.703997+00:00,A,llm_style,eval,llm_style_eval_079,64,1536,2048,bf16,NVIDIA GeForce RTX 4060,c04,64,64,64,4,3,8,0.0,65.123,41.98399931192398,66.4076786115765,9.590634303522425,3,0,-1,64x1536x2048,0,
2026-03-02T12:37:31.767773+00:00,A,llm_style,eval,llm_style_eval_080,4,1536,1024,bf16,NVIDIA GeForce RTX 4060,c04,64,64,64,4,3,8,0.0,63.73,41.98399931192398,84.887999780476,0.29970732198507577,1,0,-1,4x1536x1024,0,
2026-03-02T12:37:32.074018+00:00,A,llm_style,eval,llm_style_eval_081,4,4096,6144,bf16,NVIDIA GeForce RTX 4060,c11,32,128,32,4,2,8,0.0,306.201,226.30399465560913,313.1644701957701,0.8896289802854788,1,1,-1,4x4096x6144,0,
2026-03-02T12:37:32.153628+00:00,A,llm_style,eval,llm_style_eval_082,64,1024,2048,bf16,NVIDIA GeForce RTX 4060,c11,32,128,32,4,2,8,0.0,79.564,52.36800014972687,58.80864068865776,5.125944378867025,3,0,-1,64x1024x2048,0,
2026-03-02T12:37:32.375687+00:00,A,llm_style,eval,llm_style_eval_083,8,4096,4096,bf16,NVIDIA GeForce RTX 4060,c02,32,64,32,2,2,8,0.0,222.011,160.76800227165222,179.23360392451283,1.6697069827764632,1,1,-1,8x4096x4096,0,
2026-03-02T12:37:32.488642+00:00,A,llm_style,eval,llm_style_eval_084,64,3072,3072,bf16,NVIDIA GeForce RTX 4060,c03,64,64,32,4,2,8,0.0,112.908,64.51199948787689,85.69856286048885,18.72457157721487,3,1,-1,64x3072x3072,0,
2026-03-02T12:37:32.613904+00:00,A,llm_style,eval,llm_style_eval_085,1,3072,8192,bf16,NVIDIA GeForce RTX 4060,c06,64,128,32,4,3,8,0.0,0.0,234.25599932670593,380.89439779520035,0.21485745570940445,0,1,-1,1x3072x8192,0,
2026-03-02T12:37:32.669441+00:00,A,llm_style,eval,llm_style_eval_086,8,1536,1024,bf16,NVIDIA GeForce RTX 4060,c04,64,64,64,4,3,8,0.0,55.49,36.848001182079315,43.3939204737544,0.6829630697102552,1,0,-1,8x1536x1024,0,
2026-03-02T12:37:32.747369+00:00,A,llm_style,eval,llm_style_eval_087,16,1024,3072,bf16,NVIDIA GeForce RTX 4060,c00,32,32,32,2,2,8,0.0,77.885,51.98400095105171,114.0895964950322,1.9364284040927295,2,1,-1,16x1024x3072,0,
2026-03-02T12:37:32.831502+00:00,A,llm_style,eval,llm_style_eval_088,8,8192,2048,bf16,NVIDIA GeForce RTX 4060,c11,32,128,32,4,2,8,0.0,0.0,164.86400365829468,295.21120920777304,1.6282235663545612,1,0,-1,8x8192x2048,0,
2026-03-02T12:37:32.953068+00:00,A,llm_style,eval,llm_style_eval_089,64,6144,4096,bf16,NVIDIA GeForce RTX 4060,c01,64,32,32,2,2,8,0.0,0.0,234.30399596691132,273.1283164024352,13.74806032951698,3,1,-1,64x6144x4096,0,
2026-03-02T12:37:33.085648+00:00,A,llm_style,eval,llm_style_eval_090,2,1536,6144,bf16,NVIDIA GeForce RTX 4060,c04,64,64,64,4,3,8,0.0,132.526,71.68000191450119,149.5449659228325,0.5266285573628487,0,1,-1,2x1536x6144,0,
2026-03-02T12:37:33.100208+00:00,A,llm_style,eval,llm_style_eval_091,2,1024,1024,bf16,NVIDIA GeForce RTX 4060,c00,32,32,32,2,2,8,0.0,0.0,34.81600061058998,132.5465600192546,0.12047058612252605,0,0,-1,2x1024x1024,0,
2026-03-02T12:37:33.310403+00:00,A,llm_style,eval,llm_style_eval_092,4,4096,4096,bf16,NVIDIA GeForce RTX 4060,c00,32,32,32,2,2,8,0.0,210.151,160.73599457740784,235.86816504597635,0.8350197375072883,1,1,-1,4x4096x4096,0,
2026-03-02T12:37:33.379062+00:00,A,llm_style,eval,llm_style_eval_093,32,2048,1536,bf16,NVIDIA GeForce RTX 4060,c02,32,64,32,2,2,8,0.0,68.59,44.92799937725067,93.69343888014542,4.481094079206693,2,0,-1,32x2048x1536,0,
2026-03-02T12:37:33.447972+00:00,A,llm_style,eval,llm_style_eval_094,2,2048,2048,bf16,NVIDIA GeForce RTX 4060,c00,32,32,32,2,2,8,0.0,68.865,50.175998359918594,131.72896228730673,0.334367357868098,0,0,-1,2x2048x2048,0,
2026-03-02T12:37:33.867591+00:00,A,llm_style,eval,llm_style_eval_095,1,6144,6144,bf16,NVIDIA GeForce RTX 4060,c11,32,128,32,4,2,8,0.0,419.571,324.6079981327057,428.03679198026657,0.2325804429782881,0,1,-1,1x6144x6144,0,
2026-03-02T12:37:33.989101+00:00,A,llm_style,eval,llm_style_eval_096,64,1024,6144,bf16,NVIDIA GeForce RTX 4060,c04,64,64,64,4,3,8,0.0,121.451,72.7040022611618,79.79711972177026,11.076506697763895,3,1,-1,64x1024x6144,0,
2026-03-02T12:37:34.015553+00:00,A,llm_style,eval,llm_style_eval_097,64,1536,2048,bf16,NVIDIA GeForce RTX 4060,c04,64,64,64,4,3,8,0.0,0.0,51.663998514413834,171.946241557598,7.793689911315382,3,0,-1,64x1536x2048,0,
2026-03-02T12:37:34.078489+00:00,A,llm_style,eval,llm_style_eval_098,32,1024,2048,bf16,NVIDIA GeForce RTX 4060,c04,64,64,64,4,3,8,0.0,62.885,43.80800016224384,53.77023957669735,3.063772085074001,2,0,-1,32x1024x2048,0,
2026-03-02T12:37:34.177894+00:00,A,llm_style,eval,llm_style_eval_099,1,6144,1536,bf16,NVIDIA GeForce RTX 4060,c11,32,128,32,4,2,8,0.0,99.356,47.10400104522705,61.76320109516378,0.4006956432825678,0,0,-1,1x6144x1536,0,
2026-03-02T12:37:34.211742+00:00,A,llm_style,eval,llm_style_eval_100,64,6144,1024,bf16,NVIDIA GeForce RTX 4060,c06,64,128,32,4,3,8,0.0,0.0,52.400000393390656,235.22783257067138,15.36844202202669,3,0,-1,64x6144x1024,0,
2026-03-02T12:37:34.381717+00:00,A,llm_style,eval,llm_style_eval_101,64,8192,1536,bf16,NVIDIA GeForce RTX 4060,c06,64,128,32,4,3,8,0.0,169.919,113.61600086092949,125.2745634317398,14.17593229646812,3,0,-1,64x8192x1536,0,
2026-03-02T12:37:34.438675+00:00,A,llm_style,eval,llm_style_eval_102,32,6144,1536,bf16,NVIDIA GeForce RTX 4060,c11,32,128,32,4,2,8,0.0,0.0,53.567999973893166,206.02047547697998,11.275010758183148,2,0,-1,32x6144x1536,0,
2026-03-02T12:37:34.749986+00:00,A,llm_style,eval,llm_style_eval_103,64,4096,6144,bf16,NVIDIA GeForce RTX 4060,c11,32,128,32,4,2,8,0.0,311.258,232.79999941587448,279.1526338458061,13.836879209976264,3,1,-1,64x4096x6144,0,
2026-03-02T12:37:34.842336+00:00,A,llm_style,eval,llm_style_eval_104,2,6144,3072,bf16,NVIDIA GeForce RTX 4060,c11,32,128,32,4,2,8,0.0,0.0,178.81600558757782,311.4393612742424,0.4222075744949128,0,1,-1,2x6144x3072,0,
2026-03-02T12:37:34.988981+00:00,A,llm_style,eval,llm_style_eval_105,1,4096,3072,bf16,NVIDIA GeForce RTX 4060,c00,32,32,32,2,2,8,0.0,146.589,65.5359998345375,126.96384124457835,0.38400000096950676,0,1,-1,1x4096x3072,0,
2026-03-02T12:37:35.076309+00:00,A,llm_style,eval,llm_style_eval_106,64,4096,1536,bf16,NVIDIA GeForce RTX 4060,c04,64,64,64,4,3,8,0.0,87.281,57.34400078654289,68.62848088145256,14.043428378805825,3,0,-1,64x4096x1536,0,
2026-03-02T12:37:35.182954+00:00,A,llm_style,eval,llm_style_eval_107,64,6144,1536,bf16,NVIDIA GeForce RTX 4060,c06,64,128,32,4,3,8,0.0,106.597,66.44799932837486,72.7040022611618,18.179020650877188,3,0,-1,64x6144x1536,0,
2026-03-02T12:37:35.284044+00:00,A,llm_style,eval,llm_style_eval_108,16,3072,6144,bf16,NVIDIA GeForce RTX 4060,c11,32,128,32,4,2,8,0.0,0.0,184.30399894714355,276.1625602841377,3.277084487858644,2,1,-1,16x3072x6144,0,
2026-03-02T12:37:35.302666+00:00,A,llm_style,eval,llm_style_eval_109,64,1024,2048,bf16,NVIDIA GeForce RTX 4060,c11,32,128,32,4,2,8,0.0,0.0,53.247999399900436,133.70368421077728,5.04123082604493,3,0,-1,64x1024x2048,0,
2026-03-02T12:37:35.389105+00:00,A,llm_style,eval,llm_style_eval_110,16,1536,3072,bf16,NVIDIA GeForce RTX 4060,c04,64,64,64,4,3,8,0.0,86.396,53.247999399900436,62.3823995515704,2.835692339650273,2,1,-1,16x1536x3072,0,
2026-03-02T12:37:35.582234+00:00,A,llm_style,eval,llm_style_eval_111,64,6144,6144,bf16,NVIDIA GeForce RTX 4060,c06,64,128,32,4,3,8,0.0,0.0,333.6640000343323,383.12960654497135,14.481149322380686,3,1,-1,64x6144x6144,0,
2026-03-02T12:37:36.003483+00:00,A,llm_style,eval,llm_style_eval_112,16,6144,6144,bf16,NVIDIA GeForce RTX 4060,c11,32,128,32,4,2,8,0.0,421.193,327.67999172210693,360.3654313087462,3.6864000931262995,2,1,-1,16x6144x6144,0,
2026-03-02T12:37:36.300731+00:00,A,llm_style,eval,llm_style_eval_113,1,8192,3072,bf16,NVIDIA GeForce RTX 4060,c10,64,128,64,8,3,8,0.0,297.197,226.30399465560913,245.83327621221537,0.2224072450713697,0,1,-1,1x8192x3072,0,
2026-03-02T12:37:36.376009+00:00,A,llm_style,eval,llm_style_eval_114,64,3072,1024,bf16,NVIDIA GeForce RTX 4060,c11,32,128,32,4,2,8,0.0,75.233,44.464001432061195,52.746239230036736,9.055711835005093,3,0,-1,64x3072x1024,0,
2026-03-02T12:37:36.498872+00:00,A,llm_style,eval,llm_style_eval_115,8,3072,3072,bf16,NVIDIA GeForce RTX 4060,c00,32,32,32,2,2,8,0.0,122.818,54.15999889373779,203.95679712295527,2.787942154434916,1,1,-1,8x3072x3072,0,
2026-03-02T12:37:36.522337+00:00,A,llm_style,eval,llm_style_eval_116,16,3072,2048,bf16,NVIDIA GeForce RTX 4060,c00,32,32,32,2,2,8,0.0,0.0,46.01600021123886,106.01471863687038,4.375143234435843,2,0,-1,16x3072x2048,0,
2026-03-02T12:37:36.530049+00:00,A,llm_style,eval,llm_style_eval_117,64,1024,1024,bf16,NVIDIA GeForce RTX 4060,c04,64,64,64,4,3,8,0.0,0.0,34.84800085425377,62.4560004472732,3.8515187301947202,3,0,-1,64x1024x1024,0,
2026-03-02T12:37:36.565500+00:00,A,llm_style,eval,llm_style_eval_118,1,6144,1536,bf16,NVIDIA GeForce RTX 4060,c11,32,128,32,4,2,8,0.0,0.0,57.312000542879105,129.72031891345964,0.32932663004633334,0,0,-1,1x6144x1536,0,
2026-03-02T12:37:36.580646+00:00,A,llm_style,eval,llm_style_eval_119,1,1024,1536,bf16,NVIDIA GeForce RTX 4060,c00,32,32,32,2,2,8,0.0,0.0,39.93599861860275,101.60672113299367,0.07876923349388026,0,0,-1,1x1024x1536,0,
2026-03-02T12:37:36.792990+00:00,A,llm_style,eval,llm_style_eval_120,16,8192,2048,bf16,NVIDIA GeForce RTX 4060,c11,32,128,32,4,2,8,0.0,212.299,161.43999993801117,188.372483253479,3.325513579076714,2,0,-1,16x8192x2048,0,
2026-03-02T12:37:36.823163+00:00,A,llm_style,eval,llm_style_eval_121,64,4096,1024,bf16,NVIDIA GeForce RTX 4060,c11,32,128,32,4,2,8,0.0,0.0,50.0319991260767,134.29087817668915,10.730550874993574,3,0,-1,64x4096x1024,0,
2026-03-02T12:37:36.902644+00:00,A,llm_style,eval,llm_style_eval_122,4,6144,1024,bf16,NVIDIA GeForce RTX 4060,c02,32,64,32,2,2,8,0.0,79.429,40.95999896526337,115.43551802635187,1.2288000310421,1,0,-1,4x6144x1024,0,
2026-03-02T12:37:37.080238+00:00,A,llm_style,eval,llm_style_eval_123,4,8192,4096,bf16,NVIDIA GeForce RTX 4060,c11,32,128,32,4,2,8,0.0,0.0,289.8720055818558,396.3699275255203,0.9260482241504263,1,1,-1,4x8192x4096,0,
2026-03-02T12:37:37.367903+00:00,A,llm_style,eval,llm_style_eval_124,4,3072,8192,bf16,NVIDIA GeForce RTX 4060,c06,64,128,32,4,3,8,0.0,287.605,226.30399465560913,248.3875223994255,0.8896289802854788,1,1,-1,4x3072x8192,0,
2026-03-02T12:37:37.587827+00:00,A,llm_style,eval,llm_style_eval_125,64,8192,2048,bf16,NVIDIA GeForce RTX 4060,c10,64,128,64,8,3,8,0.0,219.879,166.4000004529953,219.30400326848024,12.905550734097632,3,0,-1,64x8192x2048,0,
2026-03-02T12:37:37.658779+00:00,A,llm_style,eval,llm_style_eval_126,8,1536,1536,bf16,NVIDIA GeForce RTX 4060,c04,64,64,64,4,3,8,0.0,70.904,46.08000069856644,55.28031997382641,0.8191999875810414,1,0,-1,8x1536x1536,0,
2026-03-02T12:37:37.713213+00:00,A,llm_style,eval,llm_style_eval_127,64,2048,1024,bf16,NVIDIA GeForce RTX 4060,c00,32,32,32,2,2,8,0.0,54.39,37.28000074625015,114.75392088294026,7.200521744276008,3,0,-1,64x2048x1024,0,
2026-03-02T12:37:37.780733+00:00,A,llm_style,eval,llm_style_eval_128,64,6144,2048,bf16,NVIDIA GeForce RTX 4060,c10,64,128,64,8,3,8,0.0,0.0,103.91999781131744,118.1078414618969,15.498583236349871,3,0,-1,64x6144x2048,0,
2026-03-02T12:37:37.803883+00:00,A,llm_style,eval,llm_style_eval_129,32,6144,1024,bf16,NVIDIA GeForce RTX 4060,c11,32,128,32,4,2,8,0.0,0.0,46.08000069856644,118.01856160163872,8.738133200864441,2,0,-1,32x6144x1024,0,
2026-03-02T12:37:37.888334+00:00,A,llm_style,eval,llm_style_eval_130,64,8192,2048,bf16,NVIDIA GeForce RTX 4060,c10,64,128,64,8,3,8,0.0,0.0,172.73599654436111,285.7692822813987,12.432172164233846,3,0,-1,64x8192x2048,0,
2026-03-02T12:37:38.011347+00:00,A,llm_style,eval,llm_style_eval_131,64,4096,6144,bf16,NVIDIA GeForce RTX 4060,c11,32,128,32,4,2,8,0.0,0.0,232.44799673557281,319.20799523591984,13.857832793734023,3,1,-1,64x4096x6144,0,
2026-03-02T12:37:38.158768+00:00,A,llm_style,eval,llm_style_eval_132,16,8192,1536,bf16,NVIDIA GeForce RTX 4060,c11,32,128,32,4,2,8,0.0,147.366,65.45599922537804,90.39808019995682,6.151509239261399,2,0,-1,16x8192x1536,0,
2026-03-02T12:37:38.752129+00:00,A,llm_style,eval,llm_style_eval_133,32,8192,6144,bf16,NVIDIA GeForce RTX 4060,c11,32,128,32,4,2,8,0.0,593.309,430.89599907398224,562.7161520719528,7.475644886289453,2,1,-1,32x8192x6144,0,
2026-03-02T12:37:39.004406+00:00,A,llm_style,eval,llm_style_eval_134,64,8192,6144,bf16,NVIDIA GeForce RTX 4060,c06,64,128,32,4,3,8,0.0,0.0,442.83199310302734,564.7136008739471,14.548296067897532,3,1,-1,64x8192x6144,0,
2026-03-02T12:37:39.084303+00:00,A,llm_style,eval,llm_style_eval_135,4,3072,2048,bf16,NVIDIA GeForce RTX 4060,c00,32,32,32,2,2,8,0.0,79.844,50.19200034439564,298.74176383018477,1.0027822691792747,1,0,-1,4x3072x2048,0,
2026-03-02T12:37:39.128547+00:00,A,llm_style,eval,llm_style_eval_136,64,3072,3072,bf16,NVIDIA GeForce RTX 4060,c03,64,64,32,4,2,8,0.0,0.0,68.60800087451935,115.05312047898758,17.606686342738634,3,1,-1,64x3072x3072,0,
2026-03-02T12:37:39.351226+00:00,A,llm_style,eval,llm_style_eval_137,1,3072,6144,bf16,NVIDIA GeForce RTX 4060,c06,64,128,32,4,3,8,0.0,222.624,176.94400250911713,198.0441626906395,0.2133371884026133,0,1,-1,1x3072x6144,0,
2026-03-02T12:37:39.455006+00:00,A,llm_style,eval,llm_style_eval_138,1,2048,3072,bf16,NVIDIA GeForce RTX 4060,c00,32,32,32,2,2,8,0.0,103.735,56.32000043988228,112.10143640637388,0.22341818007319428,0,1,-1,1x2048x3072,0,
2026-03-02T12:37:39.756226+00:00,A,llm_style,eval,llm_style_eval_139,4,8192,3072,bf16,NVIDIA GeForce RTX 4060,c11,32,128,32,4,2,8,0.0,301.174,225.2800017595291,308.8383924961089,0.8936727202927771,1,1,-1,4x8192x3072,0,
2026-03-02T12:37:39.774055+00:00,A,llm_style,eval,llm_style_eval_140,64,1024,2048,bf16,NVIDIA GeForce RTX 4060,c11,32,128,32,4,2,8,0.0,0.0,56.32000043988228,133.0956785380838,4.766254508228145,3,0,-1,64x1024x2048,0,
2026-03-02T12:37:40.061324+00:00,A,llm_style,eval,llm_style_eval_141,1,6144,4096,bf16,NVIDIA GeForce RTX 4060,c11,32,128,32,4,2,8,0.0,287.227,226.30399465560913,268.6239936947822,0.2224072450713697,0,1,-1,1x6144x4096,0,
2026-03-02T12:37:40.145607+00:00,A,llm_style,eval,llm_style_eval_142,4,4096,4096,bf16,NVIDIA GeForce RTX 4060,c00,32,32,32,2,2,8,0.0,0.0,162.76799887418747,201.78943380713463,0.824595306991176,1,1,-1,4x4096x4096,0,
2026-03-02T12:37:40.184642+00:00,A,llm_style,eval,llm_style_eval_143,64,1536,6144,bf16,NVIDIA GeForce RTX 4060,c04,64,64,64,4,3,8,0.0,0.0,71.42399996519089,84.30944122374058,16.91251613727472,3,1,-1,64x1536x6144,0,
2026-03-02T12:37:40.266656+00:00,A,llm_style,eval,llm_style_eval_144,1,6144,1024,bf16,NVIDIA GeForce RTX 4060,c02,32,64,32,2,2,8,0.0,81.957,40.65600037574768,99.75808016955844,0.3094970455457301,0,0,-1,1x6144x1024,0,
2026-03-02T12:37:40.492688+00:00,A,llm_style,eval,llm_style_eval_145,8,3072,6144,bf16,NVIDIA GeForce RTX 4060,c10,64,128,64,8,3,8,0.0,225.979,177.15199291706085,296.9161692261695,1.704693709776022,1,1,-1,8x3072x6144,0,
2026-03-02T12:37:40.865157+00:00,A,llm_style,eval,llm_style_eval_146,64,8192,8192,bf16,NVIDIA GeForce RTX 4060,c06,64,128,32,4,3,8,0.0,0.0,574.4640231132507,611.0966378450394,14.952954835096032,3,1,-1,64x8192x8192,0,
2026-03-02T12:37:41.008274+00:00,A,llm_style,eval,llm_style_eval_147,1,1024,8192,bf16,NVIDIA GeForce RTX 4060,c00,32,32,32,2,2,8,0.0,143.062,89.82399851083755,197.66207948327065,0.18677877046383964,0,1,-1,1x1024x8192,0,
2026-03-02T12:37:41.036521+00:00,A,llm_style,eval,llm_style_eval_148,32,4096,1024,bf16,NVIDIA GeForce RTX 4060,c11,32,128,32,4,2,8,0.0,0.0,63.26399743556976,199.02719885110844,4.243099817923835,2,0,-1,32x4096x1024,0,
2026-03-02T12:37:41.191544+00:00,A,llm_style,eval,llm_style_eval_149,64,3072,4096,bf16,NVIDIA GeForce RTX 4060,c04,64,64,64,4,3,8,0.0,154.976,96.25600278377533,103.44447776675224,16.73259526076519,3,1,-1,64x3072x4096,0,
2026-03-02T12:37:41.278097+00:00,A,llm_style,eval,llm_style_eval_150,2,4096,4096,bf16,NVIDIA GeForce RTX 4060,c03,64,64,32,4,2,8,0.0,0.0,163.83999586105347,310.40383130311955,0.4096000103473666,0,1,-1,2x4096x4096,0,
2026-03-02T12:37:41.304759+00:00,A,llm_style,eval,llm_style_eval_151,64,2048,3072,bf16,NVIDIA GeForce RTX 4060,c03,64,64,32,4,2,8,0.0,0.0,53.98400127887726,66.9231989979744,14.917500535757778,3,1,-1,64x2048x3072,0,
2026-03-02T12:37:41.341742+00:00,A,llm_style,eval,llm_style_eval_152,64,1024,8192,bf16,NVIDIA GeForce RTX 4060,c04,64,64,64,4,3,8,0.0,0.0,83.96799862384796,163.3900797367096,12.787512404696566,3,1,-1,64x1024x8192,0,
2026-03-02T12:37:41.362803+00:00,A,llm_style,eval,llm_style_eval_153,64,4096,1024,bf16,NVIDIA GeForce RTX 4060,c11,32,128,32,4,2,8,0.0,0.0,49.456000328063965,99.93216022849082,10.855526294861956,3,0,-1,64x4096x1024,0,
2026-03-02T12:37:41.404563+00:00,A,llm_style,eval,llm_style_eval_154,64,4096,2048,bf16,NVIDIA GeForce RTX 4060,c04,64,64,64,4,3,8,0.0,0.0,70.65600156784058,269.348155111074,15.196753285975904,3,0,-1,64x4096x2048,0,
2026-03-02T12:37:41.566083+00:00,A,llm_style,eval,llm_style_eval_155,8,4096,8192,bf16,NVIDIA GeForce RTX 4060,c11,32,128,32,4,2,8,0.0,0.0,295.9359884262085,326.2243178486824,1.8141453996693224,1,1,-1,8x4096x8192,0,
2026-03-02T12:37:41.629523+00:00,A,llm_style,eval,llm_style_eval_156,64,6144,2048,bf16,NVIDIA GeForce RTX 4060,c10,64,128,64,8,3,8,0.0,0.0,103.91999781131744,205.1536004245281,15.498583236349871,3,0,-1,64x6144x2048,0,
2026-03-02T12:37:41.930321+00:00,A,llm_style,eval,llm_style_eval_157,16,4096,6144,bf16,NVIDIA GeForce RTX 4060,c11,32,128,32,4,2,8,0.0,300.748,227.2000014781952,352.61727809905983,3.544482230460226,2,1,-1,16x4096x6144,0,
2026-03-02T12:37:41.969001+00:00,A,llm_style,eval,llm_style_eval_158,64,2048,3072,bf16,NVIDIA GeForce RTX 4060,c03,64,64,32,4,2,8,0.0,0.0,76.28799974918365,144.24831554293633,10.556134262893917,3,1,-1,64x2048x3072,0,
2026-03-02T12:37:41.986093+00:00,A,llm_style,eval,llm_style_eval_159,64,1536,2048,bf16,NVIDIA GeForce RTX 4060,c04,64,64,64,4,3,8,0.0,0.0,52.22399905323982,205.3193604946136,7.710117786834262,3,0,-1,64x1536x2048,0,
2026-03-02T12:37:42.008157+00:00,A,llm_style,eval,llm_style_eval_160,16,1536,3072,bf16,NVIDIA GeForce RTX 4060,c04,64,64,64,4,3,8,0.0,0.0,51.19999870657921,208.1008006632328,2.9491200745010397,2,1,-1,16x1536x3072,0,
2026-03-02T12:37:42.019269+00:00,A,llm_style,eval,llm_style_eval_161,64,1536,1024,bf16,NVIDIA GeForce RTX 4060,c04,64,64,64,4,3,8,0.0,0.0,63.00799921154976,125.87072178721421,3.1952544838639407,3,0,-1,64x1536x1024,0,
2026-03-02T12:37:42.047307+00:00,A,llm_style,eval,llm_style_eval_162,64,6144,1024,bf16,NVIDIA GeForce RTX 4060,c06,64,128,32,4,3,8,0.0,0.0,54.59200032055378,64.93439890444279,14.751362164262074,3,0,-1,64x6144x1024,0,
2026-03-02T12:37:42.083378+00:00,A,llm_style,eval,llm_style_eval_163,32,6144,1536,bf16,NVIDIA GeForce RTX 4060,c11,32,128,32,4,2,8,0.0,0.0,51.311999559402466,83.67072276771066,11.770731625860527,2,0,-1,32x6144x1536,0,
2026-03-02T12:37:42.257702+00:00,A,llm_style,eval,llm_style_eval_164,16,1536,8192,bf16,NVIDIA GeForce RTX 4060,c04,64,64,64,4,3,8,0.0,174.27,88.20800110697746,148.0191975086925,4.56481474409184,2,1,-1,16x1536x8192,0,
2026-03-02T12:37:42.443686+00:00,A,llm_style,eval,llm_style_eval_165,8,1536,8192,bf16,NVIDIA GeForce RTX 4060,c04,64,64,64,4,3,8,0.0,185.939,88.06400001049042,96.10112130641937,2.28613953461139,1,1,-1,8x1536x8192,0,
2026-03-02T12:37:42.479307+00:00,A,llm_style,eval,llm_style_eval_166,2,1024,6144,bf16,NVIDIA GeForce RTX 4060,c04,64,64,64,4,3,8,0.0,0.0,82.75200054049492,164.13791373372075,0.3041113669232085,0,1,-1,2x1024x6144,0,
2026-03-02T12:37:42.556064+00:00,A,llm_style,eval,llm_style_eval_167,64,4096,3072,bf16,NVIDIA GeForce RTX 4060,c04,64,64,64,4,3,8,0.0,0.0,93.07200089097023,209.5433627068996,17.305018916341577,3,1,-1,64x4096x3072,0,
2026-03-02T12:37:42.874389+00:00,A,llm_style,eval,llm_style_eval_168,64,8192,3072,bf16,NVIDIA GeForce RTX 4060,c00,32,32,32,2,2,8,0.0,318.272,233.47200453281403,334.3756881356238,13.797052363711826,3,1,-1,64x8192x3072,0,
2026-03-02T12:37:42.908934+00:00,A,llm_style,eval,llm_style_eval_169,2,1024,6144,bf16,NVIDIA GeForce RTX 4060,c04,64,64,64,4,3,8,0.0,0.0,67.50399991869926,237.4246379733084,0.37280493052721786,0,1,-1,2x1024x6144,0,
2026-03-02T12:37:43.137767+00:00,A,llm_style,eval,llm_style_eval_170,16,2048,8192,bf16,NVIDIA GeForce RTX 4060,c10,64,128,64,8,3,8,0.0,228.781,162.60799765586853,251.81023091077785,3.3016267326296806,2,1,-1,16x2048x8192,0,
2026-03-02T12:37:43.228697+00:00,A,llm_style,eval,llm_style_eval_171,2,4096,1536,bf16,NVIDIA GeForce RTX 4060,c00,32,32,32,2,2,8,0.0,90.882,46.15999944508076,57.75200009346008,0.5451868349769209,0,0,-1,2x4096x1536,0,
2026-03-02T12:37:43.281091+00:00,A,llm_style,eval,llm_style_eval_172,1,1536,1024,bf16,NVIDIA GeForce RTX 4060,c00,32,32,32,2,2,8,0.0,52.347,34.703999757766724,53.67968011647461,0.09064453728553261,0,0,-1,1x1536x1024,0,
2026-03-02T12:37:43.390313+00:00,A,llm_style,eval,llm_style_eval_173,32,1536,4096,bf16,NVIDIA GeForce RTX 4060,c04,64,64,64,4,3,8,0.0,109.177,60.416001826524734,74.0060797333717,6.664677764612043,2,1,-1,32x1536x4096,0,
2026-03-02T12:37:43.417121+00:00,A,llm_style,eval,llm_style_eval_174,64,2048,3072,bf16,NVIDIA GeForce RTX 4060,c03,64,64,32,4,2,8,0.0,0.0,61.88799999654293,580.0652681291085,13.012318511585196,3,1,-1,64x2048x3072,0,
2026-03-02T12:37:43.473202+00:00,A,llm_style,eval,llm_style_eval_175,2,3072,1024,bf16,NVIDIA GeForce RTX 4060,c00,32,32,32,2,2,8,0.0,56.031,34.81600061058998,80.39423741400242,0.36141175836757816,0,0,-1,2x3072x1024,0,
2026-03-02T12:37:43.656148+00:00,A,llm_style,eval,llm_style_eval_176,64,6144,6144,bf16,NVIDIA GeForce RTX 4060,c06,64,128,32,4,3,8,0.0,0.0,334.6879929304123,360.9859150648117,14.436843597806114,3,1,-1,64x6144x6144,0,
2026-03-02T12:37:43.949686+00:00,A,llm_style,eval,llm_style_eval_177,2,6144,4096,bf16,NVIDIA GeForce RTX 4060,c06,64,128,32,4,3,8,0.0,293.484,225.600004196167,307.2451192140578,0.4462025448921082,0,1,-1,2x6144x4096,0,
2026-03-02T12:37:43.985155+00:00,A,llm_style,eval,llm_style_eval_178,64,4096,2048,bf16,NVIDIA GeForce RTX 4060,c04,64,64,64,4,3,8,0.0,0.0,72.65600189566612,166.22207909822464,14.778432558701637,3,0,-1,64x4096x2048,0,
2026-03-02T12:37:44.123437+00:00,A,llm_style,eval,llm_style_eval_179,16,6144,2048,bf16,NVIDIA GeForce RTX 4060,c00,32,32,32,2,2,8,0.0,138.228,65.96799939870834,175.57439416646952,6.103765275135568,2,0,-1,16x6144x2048,0,
2026-03-02T12:37:44.201251+00:00,A,llm_style,eval,llm_style_eval_180,1,3072,2048,bf16,NVIDIA GeForce RTX 4060,c11,32,128,32,4,2,8,0.0,77.762,50.175998359918594,56.3814404606819,0.25077551840107354,0,0,-1,1x3072x2048,0,
2026-03-02T12:37:44.501499+00:00,A,llm_style,eval,llm_style_eval_181,32,3072,8192,bf16,NVIDIA GeForce RTX 4060,c06,64,128,32,4,3,8,0.0,300.2,228.35199534893036,252.13407188653943,7.05320193738147,2,1,-1,32x3072x8192,0,
2026-03-02T12:37:44.547854+00:00,A,llm_style,eval,llm_style_eval_182,64,1024,8192,bf16,NVIDIA GeForce RTX 4060,c04,64,64,64,4,3,8,0.0,0.0,108.5439994931221,180.30592143535614,9.892226461288978,3,1,-1,64x1024x8192,0,
2026-03-02T12:37:44.660677+00:00,A,llm_style,eval,llm_style_eval_183,32,4096,1536,bf16,NVIDIA GeForce RTX 4060,c11,32,128,32,4,2,8,0.0,112.736,45.88799923658371,54.14528016000985,8.774694706649774,2,0,-1,32x4096x1536,0,
2026-03-02T12:37:44.760437+00:00,A,llm_style,eval,llm_style_eval_184,2,2048,3072,bf16,NVIDIA GeForce RTX 4060,c11,32,128,32,4,2,8,0.0,99.712,62.12799996137619,85.18208011984825,0.4050641259278444,0,1,-1,2x2048x3072,0,
2026-03-02T12:37:44.773829+00:00,A,llm_style,eval,llm_style_eval_185,64,1536,1536,bf16,NVIDIA GeForce RTX 4060,c04,64,64,64,4,3,8,0.0,0.0,34.28800031542778,138.67295399308205,8.807451155561282,3,0,-1,64x1536x1536,0,
2026-03-02T12:37:44.810578+00:00,A,llm_style,eval,llm_style_eval_186,64,8192,1024,bf16,NVIDIA GeForce RTX 4060,c06,64,128,32,4,3,8,0.0,0.0,89.00799974799156,193.74079853296274,12.06343055725425,3,0,-1,64x8192x1024,0,
2026-03-02T12:37:44.852219+00:00,A,llm_style,eval,llm_style_eval_187,4,8192,1024,bf16,NVIDIA GeForce RTX 4060,c00,32,32,32,2,2,8,0.0,0.0,49.15200173854828,139.37887832522387,1.3653332850403275,1,0,-1,4x8192x1024,0,
2026-03-02T12:37:44.881632+00:00,A,llm_style,eval,llm_style_eval_188,32,6144,1024,bf16,NVIDIA GeForce RTX 4060,c11,32,128,32,4,2,8,0.0,0.0,42.3360001295805,55.13696063309908,9.51089339492568,2,0,-1,32x6144x1024,0,
2026-03-02T12:37:44.889837+00:00,A,llm_style,eval,llm_style_eval_189,4,1024,1024,bf16,NVIDIA GeForce RTX 4060,c04,64,64,64,4,3,8,0.0,0.0,40.86400009691715,121.01632371544835,0.20528112715604782,1,0,-1,4x1024x1024,0,
2026-03-02T12:37:44.961746+00:00,A,llm_style,eval,llm_style_eval_190,16,2048,2048,bf16,NVIDIA GeForce RTX 4060,c00,32,32,32,2,2,8,0.0,71.859,49.15200173854828,142.22879901528339,2.730666570080655,2,0,-1,16x2048x2048,0,
2026-03-02T12:37:45.027583+00:00,A,llm_style,eval,llm_style_eval_191,4,2048,1536,bf16,NVIDIA GeForce RTX 4060,c02,32,64,32,2,2,8,0.0,65.789,45.152001082897186,50.72288025170563,0.5573578888297022,1,0,-1,4x2048x1536,0,
2026-03-02T12:37:45.072351+00:00,A,llm_style,eval,llm_style_eval_192,64,8192,1024,bf16,NVIDIA GeForce RTX 4060,c06,64,128,32,4,3,8,0.0,0.0,65.87199866771698,118.27200263738622,16.300428797012152,3,0,-1,64x8192x1024,0,
2026-03-02T12:37:45.840001+00:00,A,llm_style,eval,llm_style_eval_193,4,8192,8192,bf16,NVIDIA GeForce RTX 4060,c02,32,64,32,2,2,8,0.0,767.593,560.1279735565186,627.8825569152831,0.9584790214835219,1,1,-1,4x8192x8192,0,
2026-03-02T12:37:45.858699+00:00,A,llm_style,eval,llm_style_eval_194,64,1024,1024,bf16,NVIDIA GeForce RTX 4060,c04,64,64,64,4,3,8,0.0,0.0,38.91199827194214,112.64383725821953,3.4492633110743878,3,0,-1,64x1024x1024,0,
2026-03-02T12:37:45.892256+00:00,A,llm_style,eval,llm_style_eval_195,32,4096,1536,bf16,NVIDIA GeForce RTX 4060,c11,32,128,32,4,2,8,0.0,0.0,26.623999699950218,192.0457538962363,15.123692478134789,2,0,-1,32x4096x1536,0,
2026-03-02T12:37:45.911065+00:00,A,llm_style,eval,llm_style_eval_196,8,4096,1024,bf16,NVIDIA GeForce RTX 4060,c11,32,128,32,4,2,8,0.0,0.0,63.50399926304817,140.91263920068738,1.056765948267599,1,0,-1,8x4096x1024,0,
2026-03-02T12:37:46.053731+00:00,A,llm_style,eval,llm_style_eval_197,2,6144,2048,bf16,NVIDIA GeForce RTX 4060,c02,32,64,32,2,2,8,0.0,142.619,61.535999178886414,70.65600156784058,0.8179220077939234,0,0,-1,2x6144x2048,0,
2026-03-02T12:37:46.177592+00:00,A,llm_style,eval,llm_style_eval_198,32,1536,6144,bf16,NVIDIA GeForce RTX 4060,c04,64,64,64,4,3,8,0.0,123.81,70.65600156784058,91.27968050539488,8.548173723361446,2,1,-1,32x1536x6144,0,
2026-03-02T12:37:46.265032+00:00,A,llm_style,eval,llm_style_eval_199,32,3072,1536,bf16,NVIDIA GeForce RTX 4060,c11,32,128,32,4,2,8,0.0,87.388,46.08000069856644,53.36448013782501,6.553599900648331,2,0,-1,32x3072x1536,0,
2026-03-02T12:37:46.292365+00:00,A,llm_style,eval,llm_style_eval_200,64,2048,3072,bf16,NVIDIA GeForce RTX 4060,c03,64,64,32,4,2,8,0.0,0.0,63.48799914121628,188.62048059701897,12.684387268352213,3,1,-1,64x2048x3072,0,
2026-03-02T12:37:46.428721+00:00,A,llm_style,eval,llm_style_eval_201,4,6144,2048,bf16,NVIDIA GeForce RTX 4060,c11,32,128,32,4,2,8,0.0,136.306,61.11999973654747,119.6748756617307,1.6469780175703619,1,0,-1,4x6144x2048,0,
2026-03-02T12:37:46.460102+00:00,A,llm_style,eval,llm_style_eval_202,4,6144,1024,bf16,NVIDIA GeForce RTX 4060,c02,32,64,32,2,2,8,0.0,0.0,48.128001391887665,621.3353691995126,1.0457872037978244,1,0,-1,4x6144x1024,0,
2026-03-02T12:37:47.058271+00:00,A,llm_style,eval,llm_style_eval_203,1,6144,8192,bf16,NVIDIA GeForce RTX 4060,c10,64,128,64,8,3,8,0.0,598.117,424.8799979686737,566.7903780937195,0.23692171079190666,0,1,-1,1x6144x8192,0,
2026-03-02T12:37:47.091507+00:00,A,llm_style,eval,llm_style_eval_204,1,2048,3072,bf16,NVIDIA GeForce RTX 4060,c00,32,32,32,2,2,8,0.0,0.0,57.34400078654289,245.85439711809153,0.219428568418841,0,1,-1,1x2048x3072,0,
2026-03-02T12:37:47.207720+00:00,A,llm_style,eval,llm_style_eval_205,2,6144,1536,bf16,NVIDIA GeForce RTX 4060,c11,32,128,32,4,2,8,0.0,116.157,47.10400104522705,53.288959413766854,0.8013912865651356,0,0,-1,2x6144x1536,0,
2026-03-02T12:37:47.264045+00:00,A,llm_style,eval,llm_style_eval_206,16,1024,1024,bf16,NVIDIA GeForce RTX 4060,c00,32,32,32,2,2,8,0.0,56.281,36.639999598264694,119.74304221570489,0.915786909604365,2,0,-1,16x1024x1024,0,
2026-03-02T12:37:47.328577+00:00,A,llm_style,eval,llm_style_eval_207,64,6144,2048,bf16,NVIDIA GeForce RTX 4060,c10,64,128,64,8,3,8,0.0,0.0,106.97599872946739,213.4947171807289,15.055832664606326,3,0,-1,64x6144x2048,0,
2026-03-02T12:37:47.451123+00:00,A,llm_style,eval,llm_style_eval_208,4,4096,6144,bf16,NVIDIA GeForce RTX 4060,c11,32,128,32,4,2,8,0.0,0.0,231.23199492692947,300.00896364450455,0.8706692690326884,1,1,-1,4x4096x6144,0,
2026-03-02T12:37:47.878792+00:00,A,llm_style,eval,llm_style_eval_209,32,6144,6144,bf16,NVIDIA GeForce RTX 4060,c11,32,128,32,4,2,8,0.0,427.618,330.03200590610504,491.92384570837,7.320257007701656,2,1,-1,32x6144x6144,0,
2026-03-02T12:37:47.898576+00:00,A,llm_style,eval,llm_style_eval_210,64,2048,1024,bf16,NVIDIA GeForce RTX 4060,c00,32,32,32,2,2,8,0.0,0.0,47.10400104522705,204.62591841816896,5.698782482240965,3,0,-1,64x2048x1024,0,
2026-03-02T12:37:47.972638+00:00,A,llm_style,eval,llm_style_eval_211,4,1024,3072,bf16,NVIDIA GeForce RTX 4060,c00,32,32,32,2,2,8,0.0,74.017,35.26400029659271,147.0937597751617,0.7136406473553591,1,1,-1,4x1024x3072,0,
2026-03-02T12:37:48.167609+00:00,A,llm_style,eval,llm_style_eval_212,64,6144,6144,bf16,NVIDIA GeForce RTX 4060,c06,64,128,32,4,3,8,0.0,0.0,357.87199437618256,499.03680860996207,13.501582364449956,3,1,-1,64x6144x6144,0,
2026-03-02T12:37:48.253351+00:00,A,llm_style,eval,llm_style_eval_213,4,1024,2048,bf16,NVIDIA GeForce RTX 4060,c10,64,128,64,8,3,8,0.0,85.688,51.920000463724136,232.0729563385244,0.3231358985006565,1,0,-1,4x1024x2048,0,
2026-03-02T12:37:48.446804+00:00,A,llm_style,eval,llm_style_eval_214,32,6144,6144,bf16,NVIDIA GeForce RTX 4060,c11,32,128,32,4,2,8,0.0,0.0,353.13600301742554,382.67904669046396,6.8413276566444745,2,1,-1,32x6144x6144,0,
2026-03-02T12:37:48.474785+00:00,A,llm_style,eval,llm_style_eval_215,16,2048,3072,bf16,NVIDIA GeForce RTX 4060,c00,32,32,32,2,2,8,0.0,0.0,74.75200295448303,205.88863983750335,2.693260167524729,2,1,-1,16x2048x3072,0,
2026-03-02T12:37:48.490450+00:00,A,llm_style,eval,llm_style_eval_216,2,1536,2048,bf16,NVIDIA GeForce RTX 4060,c04,64,64,64,4,3,8,0.0,0.0,64.57599997520447,160.2713580429554,0.1948543112740262,0,0,-1,2x1536x2048,0,
2026-03-02T12:37:48.614134+00:00,A,llm_style,eval,llm_style_eval_217,64,8192,3072,bf16,NVIDIA GeForce RTX 4060,c00,32,32,32,2,2,8,0.0,0.0,234.3199998140335,298.74176383018477,13.74712134925104,3,1,-1,64x8192x3072,0,
2026-03-02T12:37:48.677542+00:00,A,llm_style,eval,llm_style_eval_218,64,4096,3072,bf16,NVIDIA GeForce RTX 4060,c04,64,64,64,4,3,8,0.0,0.0,94.2080020904541,103.42399775981903,17.096347446722895,3,1,-1,64x4096x3072,0,
2026-03-02T12:37:48.700622+00:00,A,llm_style,eval,llm_style_eval_219,64,1536,3072,bf16,NVIDIA GeForce RTX 4060,c04,64,64,64,4,3,8,0.0,0.0,58.27200040221214,154.52384278178215,10.364836831259211,3,1,-1,64x1536x3072,0,
2026-03-02T12:37:48.930971+00:00,A,llm_style,eval,llm_style_eval_220,1,6144,6144,bf16,NVIDIA GeForce RTX 4060,c11,32,128,32,4,2,8,0.0,0.0,324.6079981327057,336.333429813385,0.2325804429782881,0,1,-1,1x6144x6144,0,
2026-03-02T12:37:49.091607+00:00,A,llm_style,eval,llm_style_eval_221,8,4096,8192,bf16,NVIDIA GeForce RTX 4060,c11,32,128,32,4,2,8,0.0,0.0,299.00801181793213,311.2675243616104,1.7955067783498193,1,1,-1,8x4096x8192,0,
2026-03-02T12:37:49.847263+00:00,A,llm_style,eval,llm_style_eval_222,8,8192,8192,bf16,NVIDIA GeForce RTX 4060,c02,32,64,32,2,2,8,0.0,755.575,559.5040023326874,576.6553390026093,1.9190958769255435,1,1,-1,8x8192x8192,0,
2026-03-02T12:37:49.962597+00:00,A,llm_style,eval,llm_style_eval_223,1,4096,1536,bf16,NVIDIA GeForce RTX 4060,c00,32,32,32,2,2,8,0.0,115.285,49.18400011956692,156.4003206789493,0.2558334411477469,0,0,-1,1x4096x1536,0,
2026-03-02T12:37:50.099557+00:00,A,llm_style,eval,llm_style_eval_224,4,3072,3072,bf16,NVIDIA GeForce RTX 4060,c00,32,32,32,2,2,8,0.0,136.915,78.84799689054489,98.95743921399111,0.9575065312667864,1,1,-1,4x3072x3072,0,
2026-03-02T12:37:50.198488+00:00,A,llm_style,eval,llm_style_eval_225,64,8192,2048,bf16,NVIDIA GeForce RTX 4060,c10,64,128,64,8,3,8,0.0,0.0,194.5120021700859,362.70238757133467,11.040365756567502,3,0,-1,64x8192x2048,0,
2026-03-02T12:37:50.298483+00:00,A,llm_style,eval,llm_style_eval_226,4,4096,1536,bf16,NVIDIA GeForce RTX 4060,c11,32,128,32,4,2,8,0.0,99.942,47.00800031423569,55.283839851617806,1.0707038730332419,1,0,-1,4x4096x1536,0,
2026-03-02T12:37:50.361855+00:00,A,llm_style,eval,llm_style_eval_227,16,8192,1536,bf16,NVIDIA GeForce RTX 4060,c11,32,128,32,4,2,8,0.0,0.0,66.3679987192154,82.98495829105377,6.066977937718358,2,0,-1,16x8192x1536,0,
2026-03-02T12:37:50.496089+00:00,A,llm_style,eval,llm_style_eval_228,16,2048,4096,bf16,NVIDIA GeForce RTX 4060,c11,32,128,32,4,2,8,0.0,134.178,72.75200262665749,168.2489598542449,3.689732877561242,2,1,-1,16x2048x4096,0,
2026-03-02T12:37:50.515819+00:00,A,llm_style,eval,llm_style_eval_229,8,1536,1024,bf16,NVIDIA GeForce RTX 4060,c04,64,64,64,4,3,8,0.0,0.0,14.336000196635723,103.53920325636857,1.755428547350728,1,0,-1,8x1536x1024,0,
2026-03-02T12:37:50.648635+00:00,A,llm_style,eval,llm_style_eval_230,64,4096,6144,bf16,NVIDIA GeForce RTX 4060,c11,32,128,32,4,2,8,0.0,0.0,262.60800659656525,296.2227234244346,12.266288121780867,3,1,-1,64x4096x6144,0,
2026-03-02T12:37:50.692503+00:00,A,llm_style,eval,llm_style_eval_231,64,4096,2048,bf16,NVIDIA GeForce RTX 4060,c04,64,64,64,4,3,8,0.0,0.0,71.68000191450119,150.4752016067505,14.979656742765474,3,0,-1,64x4096x2048,0,
2026-03-02T12:37:50.832914+00:00,A,llm_style,eval,llm_style_eval_232,16,3072,4096,bf16,NVIDIA GeForce RTX 4060,c00,32,32,32,2,2,8,0.0,140.354,77.18400284647942,157.32864141464222,5.2167958275095625,2,1,-1,16x3072x4096,0,
2026-03-02T12:37:50.899724+00:00,A,llm_style,eval,llm_style_eval_233,64,8192,1536,bf16,NVIDIA GeForce RTX 4060,c06,64,128,32,4,3,8,0.0,0.0,115.1680015027523,224.3116800487041,13.984897844749954,3,0,-1,64x8192x1536,0,
2026-03-02T12:37:50.991063+00:00,A,llm_style,eval,llm_style_eval_234,64,1024,4096,bf16,NVIDIA GeForce RTX 4060,c04,64,64,64,4,3,8,0.0,91.285,57.023998349905014,69.13024105131626,9.41482406592582,3,1,-1,64x1024x4096,0,
2026-03-02T12:37:51.009610+00:00,A,llm_style,eval,llm_style_eval_235,64,3072,1024,bf16,NVIDIA GeForce RTX 4060,c11,32,128,32,4,2,8,0.0,0.0,37.99999877810478,126.67904183268543,10.596136761772863,3,0,-1,64x3072x1024,0,
2026-03-02T12:37:51.264373+00:00,A,llm_style,eval,llm_style_eval_236,32,3072,6144,bf16,NVIDIA GeForce RTX 4060,c04,64,64,64,4,3,8,0.0,254.72,179.19999361038208,207.30495899915695,6.740845954639678,2,1,-1,32x3072x6144,0,
2026-03-02T12:37:51.845894+00:00,A,llm_style,eval,llm_style_eval_237,2,8192,6144,bf16,NVIDIA GeForce RTX 4060,c11,32,128,32,4,2,8,0.0,581.46,425.9039908647537,528.4073498845098,0.47270416882271354,0,1,-1,2x8192x6144,0,
2026-03-02T12:37:51.896878+00:00,A,llm_style,eval,llm_style_eval_238,4,2048,4096,bf16,NVIDIA GeForce RTX 4060,c00,32,32,32,2,2,8,0.0,0.0,65.5359998345375,141.57695516943926,1.0240000025853515,1,1,-1,4x2048x4096,0,
2026-03-02T12:37:51.945616+00:00,A,llm_style,eval,llm_style_eval_239,4,8192,1024,bf16,NVIDIA GeForce RTX 4060,c00,32,32,32,2,2,8,0.0,0.0,75.77600330114365,134.44096051156504,0.8856215830399591,1,0,-1,4x8192x1024,0,
2026-03-02T12:37:51.970524+00:00,A,llm_style,eval,llm_style_eval_240,2,1024,4096,bf16,NVIDIA GeForce RTX 4060,c00,32,32,32,2,2,8,0.0,0.0,82.94399827718735,134.8828795552253,0.2022716091396133,0,1,-1,2x1024x4096,0,
2026-03-02T12:37:51.998694+00:00,A,llm_style,eval,llm_style_eval_241,8,3072,2048,bf16,NVIDIA GeForce RTX 4060,c11,32,128,32,4,2,8,0.0,0.0,72.7040022611618,225.89119702577585,1.3845633372204869,1,0,-1,8x3072x2048,0,
2026-03-02T12:37:52.310679+00:00,A,llm_style,eval,llm_style_eval_242,32,4096,6144,bf16,NVIDIA GeForce RTX 4060,c02,32,64,32,2,2,8,0.0,311.935,230.46399652957916,243.6592034995556,6.988565503737084,2,1,-1,32x4096x6144,0,
2026-03-02T12:37:52.423323+00:00,A,llm_style,eval,llm_style_eval_243,64,2048,2048,bf16,NVIDIA GeForce RTX 4060,c00,32,32,32,2,2,8,0.0,112.587,36.848001182079315,615.4035094380363,14.569878820485444,3,0,-1,64x2048x2048,0,
2026-03-02T12:37:52.496756+00:00,A,llm_style,eval,llm_style_eval_244,8,2048,1536,bf16,NVIDIA GeForce RTX 4060,c11,32,128,32,4,2,8,0.0,73.385,46.879999339580536,64.4870417565107,1.073627318878933,1,0,-1,8x2048x1536,0,
2026-03-02T12:37:52.612468+00:00,A,llm_style,eval,llm_style_eval_245,1,1024,6144,bf16,NVIDIA GeForce RTX 4060,c04,64,64,64,4,3,8,0.0,115.665,81.91999793052673,109.7523199021816,0.1536000038802625,0,1,-1,1x1024x6144,0,
2026-03-02T12:37:52.629576+00:00,A,llm_style,eval,llm_style_eval_246,2,1536,1024,bf16,NVIDIA GeForce RTX 4060,c00,32,32,32,2,2,8,0.0,0.0,36.159999668598175,78.74015904963005,0.1739893821255641,0,0,-1,2x1536x1024,0,
2026-03-02T12:37:52.699425+00:00,A,llm_style,eval,llm_style_eval_247,64,2048,6144,bf16,NVIDIA GeForce RTX 4060,c04,64,64,64,4,3,8,0.0,0.0,111.61600053310394,201.39008477330205,14.429944885207671,3,1,-1,64x2048x6144,0,
2026-03-02T12:37:52.713690+00:00,A,llm_style,eval,llm_style_eval_248,64,1536,1024,bf16,NVIDIA GeForce RTX 4060,c04,64,64,64,4,3,8,0.0,0.0,21.296000108122826,111.56735956668852,9.453727976044151,3,0,-1,64x1536x1024,0,
2026-03-02T12:37:52.727997+00:00,A,llm_style,eval,llm_style_eval_249,8,2048,1536,bf16,NVIDIA GeForce RTX 4060,c11,32,128,32,4,2,8,0.0,0.0,46.879999339580536,65.61791986227034,1.073627318878933,1,0,-1,8x2048x1536,0,
2026-03-02T12:37:52.765656+00:00,A,llm_style,eval,llm_style_eval_250,32,6144,1536,bf16,NVIDIA GeForce RTX 4060,c11,32,128,32,4,2,8,0.0,0.0,52.22399905323982,103.01088005304321,11.565176680251392,2,0,-1,32x6144x1536,0,
2026-03-02T12:37:52.808117+00:00,A,llm_style,eval,llm_style_eval_251,64,8192,1024,bf16,NVIDIA GeForce RTX 4060,c06,64,128,32,4,3,8,0.0,0.0,65.5359998345375,97.86367952823637,16.384000041365624,3,0,-1,64x8192x1024,0,
2026-03-02T12:37:52.838269+00:00,A,llm_style,eval,llm_style_eval_252,1,3072,2048,bf16,NVIDIA GeForce RTX 4060,c11,32,128,32,4,2,8,0.0,0.0,90.11200070381165,170.18271721899484,0.13963636254574643,0,0,-1,1x3072x2048,0,
2026-03-02T12:37:52.896318+00:00,A,llm_style,eval,llm_style_eval_253,8,3072,1024,bf16,NVIDIA GeForce RTX 4060,c11,32,128,32,4,2,8,0.0,57.995,39.583999663591385,44.39744081348181,1.271514966343689,1,0,-1,8x3072x1024,0,
2026-03-02T12:37:52.953155+00:00,A,llm_style,eval,llm_style_eval_254,2,1024,1536,bf16,NVIDIA GeForce RTX 4060,c04,64,64,64,4,3,8,0.0,56.79,38.864001631736755,45.55967979133128,0.16188389604384767,0,0,-1,2x1024x1536,0,
2026-03-02T12:37:53.051045+00:00,A,llm_style,eval,llm_style_eval_255,64,4096,4096,bf16,NVIDIA GeForce RTX 4060,c00,32,32,32,2,2,8,0.0,0.0,167.66399890184402,210.59583649039257,12.808257360348462,3,1,-1,64x4096x4096,0,
2026-03-02T12:37:53.122297+00:00,B,llm_style,tune,llm_style_tune_000,4,2048,2048,bf16,NVIDIA GeForce RTX 4060,c00,32,32,32,2,2,8,0.0,68.854,43.007999658584595,111.17568038403986,0.780190482383953,1,0,-1,llm8_m1_k0,0,
2026-03-02T12:37:53.220933+00:00,B,llm_style,tune,llm_style_tune_001,32,6144,1536,bf16,NVIDIA GeForce RTX 4060,c11,32,128,32,4,2,8,0.0,98.587,48.87999966740608,70.84031783044335,12.356378480148452,2,0,-1,llm8_m2_k0,0,
2026-03-02T12:37:53.619516+00:00,B,llm_style,tune,llm_style_tune_002,4,8192,4096,bf16,NVIDIA GeForce RTX 4060,c10,64,128,64,8,3,8,0.0,398.529,291.75999760627747,435.4316726326938,0.9200557245762205,1,1,-1,llm8_m1_k1,0,
2026-03-02T12:37:53.713628+00:00,B,llm_style,tune,llm_style_tune_003,2,1536,1536,bf16,NVIDIA GeForce RTX 4060,c04,64,64,64,4,3,8,0.0,94.064,61.43999844789505,70.61376109719276,0.1536000038802625,0,0,-1,llm8_m0_k0,0,
2026-03-02T12:37:53.729689+00:00,B,llm_style,tune,llm_style_tune_004,16,1536,1536,bf16,NVIDIA GeForce RTX 4060,c11,32,128,32,4,2,8,0.0,0.0,40.95999989658594,99.61472012102598,1.8432000046536328,2,0,-1,llm8_m2_k0,0,
2026-03-02T12:37:53.980535+00:00,B,llm_style,tune,llm_style_tune_005,16,3072,6144,bf16,NVIDIA GeForce RTX 4060,c08,128,128,64,8,4,8,0.0,250.805,178.68799716234207,191.00672140717506,3.3800802829037853,2,1,-1,llm8_m2_k1,0,
2026-03-02T12:37:53.996580+00:00,B,llm_style,tune,llm_style_tune_006,16,1536,1024,bf16,NVIDIA GeForce RTX 4060,c11,32,128,32,4,2,8,0.0,0.0,45.552000403404236,103.14047880470751,1.1049272821010636,2,0,-1,llm8_m2_k0,0,
2026-03-02T12:37:54.066925+00:00,B,llm_style,tune,llm_style_tune_007,64,2048,1536,bf16,NVIDIA GeForce RTX 4060,c11,32,128,32,4,2,8,0.0,70.306,49.15200173854828,57.66816098242997,8.191999710241964,3,0,-1,llm8_m3_k0,0,
2026-03-02T12:37:54.467747+00:00,B,llm_style,tune,llm_style_tune_008,2,8192,4096,bf16,NVIDIA GeForce RTX 4060,c11,32,128,32,4,2,8,0.0,400.777,293.2959944009781,362.3820671439171,0.4576186874768734,0,1,-1,llm8_m0_k1,0,
2026-03-02T12:37:54.706118+00:00,B,llm_style,tune,llm_style_tune_009,4,8192,6144,bf16,NVIDIA GeForce RTX 4060,c10,64,128,64,8,3,8,0.0,0.0,449.535995721817,487.4857568740845,0.895708436770369,1,1,-1,llm8_m1_k1,0,
2026-03-02T12:37:54.799936+00:00,B,llm_style,tune,llm_style_tune_010,2,3072,6144,bf16,NVIDIA GeForce RTX 4060,c11,32,128,32,4,2,8,0.0,0.0,179.9039989709854,225.93536168336857,0.419654217981981,0,1,-1,llm8_m0_k1,0,
2026-03-02T12:37:54.910275+00:00,B,llm_style,tune,llm_style_tune_011,32,6144,3072,bf16,NVIDIA GeForce RTX 4060,c08,128,128,64,8,4,8,0.0,0.0,190.46400487422943,272.71295547485323,6.3421933860818545,2,1,-1,llm8_m2_k1,0,
2026-03-02T12:37:54.941410+00:00,B,llm_style,tune,llm_style_tune_012,8,6144,1024,bf16,NVIDIA GeForce RTX 4060,c00,32,32,32,2,2,8,0.0,0.0,47.93599992990494,452.8688102960577,2.0999519389852357,1,0,-1,llm8_m1_k0,0,
2026-03-02T12:37:54.975106+00:00,B,llm_style,tune,llm_style_tune_013,16,4096,2048,bf16,NVIDIA GeForce RTX 4060,c11,32,128,32,4,2,8,0.0,0.0,57.34400078654289,122.50112041831014,4.681142792935274,2,0,-1,llm8_m2_k0,0,
2026-03-02T12:37:55.059877+00:00,B,llm_style,tune,llm_style_tune_014,8,8192,2048,bf16,NVIDIA GeForce RTX 4060,c00,32,32,32,2,2,8,0.0,0.0,161.6000011563301,207.34912276267994,1.6611104831634156,1,0,-1,llm8_m1_k0,0,
2026-03-02T12:37:55.111911+00:00,B,llm_style,tune,llm_style_tune_015,16,1536,6144,bf16,NVIDIA GeForce RTX 4060,c08,128,128,64,8,4,8,0.0,0.0,173.10399562120438,205.63775852322573,1.7445575817951122,2,1,-1,llm8_m2_k1,0,
2026-03-02T12:37:55.125602+00:00,B,llm_style,tune,llm_style_tune_016,64,1536,1024,bf16,NVIDIA GeForce RTX 4060,c11,32,128,32,4,2,8,0.0,0.0,39.343999698758125,137.4089609831571,5.117085033079511,3,0,-1,llm8_m3_k0,0,
2026-03-02T12:37:55.140229+00:00,B,llm_style,tune,llm_style_tune_017,64,1536,1536,bf16,NVIDIA GeForce RTX 4060,c11,32,128,32,4,2,8,0.0,0.0,72.60800153017044,196.60800695419312,4.15918193085807,3,0,-1,llm8_m3_k0,0,
2026-03-02T12:37:55.187849+00:00,B,llm_style,tune,llm_style_tune_018,2,8192,1024,bf16,NVIDIA GeForce RTX 4060,c04,64,64,64,4,3,8,0.0,0.0,69.63200122117996,106.17088139057154,0.4818823444901042,0,0,-1,llm8_m0_k0,0,
2026-03-02T12:37:55.344391+00:00,B,llm_style,tune,llm_style_tune_019,64,1024,8192,bf16,NVIDIA GeForce RTX 4060,c04,64,64,64,4,3,8,0.0,156.484,86.41599863767624,90.477439686656,12.425266628023007,3,1,-1,llm8_m3_k1,0,
2026-03-02T12:37:55.371950+00:00,B,llm_style,tune,llm_style_tune_020,1,2048,2048,bf16,NVIDIA GeForce RTX 4060,c04,64,64,64,4,3,8,0.0,0.0,56.32000043988228,214.7846406698226,0.14894545338212953,0,0,-1,llm8_m0_k0,0,
2026-03-02T12:37:55.651095+00:00,B,llm_style,tune,llm_style_tune_021,64,6144,8192,bf16,NVIDIA GeForce RTX 4060,c04,64,64,64,4,3,8,0.0,0.0,449.0400105714798,488.1647953391075,14.34716460076884,3,1,-1,llm8_m3_k1,0,
2026-03-02T12:37:55.776903+00:00,B,llm_style,tune,llm_style_tune_022,2,4096,6144,bf16,NVIDIA GeForce RTX 4060,c11,32,128,32,4,2,8,0.0,0.0,233.19999873638153,306.60607188940037,0.43166079136129737,0,1,-1,llm8_m0_k1,0,
2026-03-02T12:37:55.819196+00:00,B,llm_style,tune,llm_style_tune_023,64,8192,1024,bf16,NVIDIA GeForce RTX 4060,c11,32,128,32,4,2,8,0.0,0.0,74.06400144100189,85.51423914730549,14.497486000068797,3,0,-1,llm8_m3_k0,0,
2026-03-02T12:37:55.831302+00:00,B,llm_style,tune,llm_style_tune_024,8,1024,2048,bf16,NVIDIA GeForce RTX 4060,c00,32,32,32,2,2,8,0.0,0.0,50.175998359918594,65.5606397241354,0.668734715736196,1,0,-1,llm8_m1_k0,0,
2026-03-02T12:37:55.850227+00:00,B,llm_style,tune,llm_style_tune_025,4,2048,2048,bf16,NVIDIA GeForce RTX 4060,c00,32,32,32,2,2,8,0.0,0.0,37.87199966609478,132.38271996378893,0.8859957830544629,1,0,-1,llm8_m1_k0,0,
2026-03-02T12:37:55.863957+00:00,B,llm_style,tune,llm_style_tune_026,4,3072,1024,bf16,NVIDIA GeForce RTX 4060,c00,32,32,32,2,2,8,0.0,0.0,36.86400130391121,125.30015617609023,0.6826666425201637,1,0,-1,llm8_m1_k0,0,
2026-03-02T12:37:55.883920+00:00,B,llm_style,tune,llm_style_tune_027,16,3072,1536,bf16,NVIDIA GeForce RTX 4060,c11,32,128,32,4,2,8,0.0,0.0,68.94399970769882,155.96959650516504,2.1901100116061114,2,0,-1,llm8_m2_k0,0,
2026-03-02T12:37:55.909604+00:00,B,llm_style,tune,llm_style_tune_028,64,6144,1024,bf16,NVIDIA GeForce RTX 4060,c11,32,128,32,4,2,8,0.0,0.0,58.73599834740162,150.00224500894544,13.710610028911262,3,0,-1,llm8_m3_k0,0,
2026-03-02T12:37:55.946573+00:00,B,llm_style,tune,llm_style_tune_029,64,2048,4096,bf16,NVIDIA GeForce RTX 4060,c04,64,64,64,4,3,8,0.0,0.0,80.89599758386612,172.15840175747866,13.273114320480879,3,1,-1,llm8_m3_k1,0,
2026-03-02T12:37:56.030674+00:00,B,llm_style,tune,llm_style_tune_030,1,8192,2048,bf16,NVIDIA GeForce RTX 4060,c04,64,64,64,4,3,8,0.0,0.0,167.93599724769592,259.5328094065187,0.19980488132338384,0,0,-1,llm8_m0_k0,0,
2026-03-02T12:37:56.075437+00:00,B,llm_style,tune,llm_style_tune_031,64,1024,8192,bf16,NVIDIA GeForce RTX 4060,c04,64,64,64,4,3,8,0.0,0.0,82.73599669337273,93.2044817507267,12.97792819224003,3,1,-1,llm8_m3_k1,0,
2026-03-02T12:37:56.199973+00:00,B,llm_style,tune,llm_style_tune_032,4,6144,4096,bf16,NVIDIA GeForce RTX 4060,c10,64,128,64,8,3,8,0.0,0.0,255.93601167201996,281.7168018221855,0.7866286212899125,1,1,-1,llm8_m1_k1,0,
2026-03-02T12:37:56.220637+00:00,B,llm_style,tune,llm_style_tune_033,1,4096,1024,bf16,NVIDIA GeForce RTX 4060,c04,64,64,64,4,3,8,0.0,0.0,70.46400010585785,154.62655939161746,0.11904813787746679,0,0,-1,llm8_m0_k0,0,
2026-03-02T12:37:56.392238+00:00,B,llm_style,tune,llm_style_tune_034,4,4096,8192,bf16,NVIDIA GeForce RTX 4060,c10,64,128,64,8,3,8,0.0,0.0,336.89600229263306,385.2902361750602,0.7967902681339414,1,1,-1,llm8_m1_k1,0,
2026-03-02T12:37:56.414456+00:00,B,llm_style,tune,llm_style_tune_035,32,1024,3072,bf16,NVIDIA GeForce RTX 4060,c08,128,128,64,8,4,8,0.0,0.0,122.8799968957901,152.95712605118752,1.6384000413894666,2,1,-1,llm8_m2_k1,0,
2026-03-02T12:37:56.429186+00:00,B,llm_style,tune,llm_style_tune_036,16,2048,1536,bf16,NVIDIA GeForce RTX 4060,c11,32,128,32,4,2,8,0.0,0.0,52.22399905323982,112.13824070990086,1.9275294467085655,2,0,-1,llm8_m2_k0,0,
2026-03-02T12:37:56.529737+00:00,B,llm_style,tune,llm_style_tune_037,1,2048,8192,bf16,NVIDIA GeForce RTX 4060,c11,32,128,32,4,2,8,0.0,0.0,247.80799448490143,274.33151483535767,0.13540496169119523,0,1,-1,llm8_m0_k1,0,
2026-03-02T12:37:56.559691+00:00,B,llm_style,tune,llm_style_tune_038,64,3072,2048,bf16,NVIDIA GeForce RTX 4060,c11,32,128,32,4,2,8,0.0,0.0,80.87999746203423,228.724475800991,9.956805060213037,3,0,-1,llm8_m3_k0,0,
2026-03-02T12:37:56.581788+00:00,B,llm_style,tune,llm_style_tune_039,64,1536,3072,bf16,NVIDIA GeForce RTX 4060,c04,64,64,64,4,3,8,0.0,0.0,82.94399827718735,250.28608277440063,7.281777929026079,3,1,-1,llm8_m3_k1,0,
2026-03-02T12:37:56.709623+00:00,B,llm_style,tune,llm_style_tune_040,8,8192,3072,bf16,NVIDIA GeForce RTX 4060,c10,64,128,64,8,3,8,0.0,0.0,272.38398790359497,397.0969635248182,1.4782557047461662,1,1,-1,llm8_m1_k1,0,
2026-03-02T12:37:56.737436+00:00,B,llm_style,tune,llm_style_tune_041,2,1024,4096,bf16,NVIDIA GeForce RTX 4060,c11,32,128,32,4,2,8,0.0,0.0,131.071999669075,167.43392348289487,0.12800000032316894,0,1,-1,llm8_m0_k1,0,
2026-03-02T12:37:56.787025+00:00,B,llm_style,tune,llm_style_tune_042,64,1536,6144,bf16,NVIDIA GeForce RTX 4060,c04,64,64,64,4,3,8,0.0,0.0,104.35199737548828,167.86527961492538,11.57581629849802,3,1,-1,llm8_m3_k1,0,
2026-03-02T12:37:56.815026+00:00,B,llm_style,tune,llm_style_tune_043,16,3072,1536,bf16,NVIDIA GeForce RTX 4060,c11,32,128,32,4,2,8,0.0,0.0,59.119999408721924,111.37791939079753,2.5540417034869565,2,0,-1,llm8_m2_k0,0,
2026-03-02T12:37:56.837983+00:00,B,llm_style,tune,llm_style_tune_044,8,4096,1024,bf16,NVIDIA GeForce RTX 4060,c00,32,32,32,2,2,8,0.0,0.0,78.80000025033951,160.0352013111114,0.8516353272436805,1,0,-1,llm8_m1_k0,0,
2026-03-02T12:37:56.907428+00:00,B,llm_style,tune,llm_style_tune_045,32,3072,4096,bf16,NVIDIA GeForce RTX 4060,c08,128,128,64,8,4,8,0.0,0.0,202.11200416088104,268.1187210977077,3.9844559027724875,2,1,-1,llm8_m2_k1,0,
2026-03-02T12:37:57.026942+00:00,B,llm_style,tune,llm_style_tune_046,64,4096,4096,bf16,NVIDIA GeForce RTX 4060,c04,64,64,64,4,3,8,0.0,0.0,175.10400712490082,331.95263206958765,12.264046284607355,3,1,-1,llm8_m3_k1,0,
2026-03-02T12:37:57.202725+00:00,B,llm_style,tune,llm_style_tune_047,4,4096,8192,bf16,NVIDIA GeForce RTX 4060,c10,64,128,64,8,3,8,0.0,0.0,412.447988986969,469.07391488552094,0.6508346825967456,1,1,-1,llm8_m1_k1,0,
2026-03-02T12:37:57.294424+00:00,B,llm_style,tune,llm_style_tune_048,2,4096,4096,bf16,NVIDIA GeForce RTX 4060,c11,32,128,32,4,2,8,0.0,0.0,179.20000106096268,330.77695190906525,0.37449142635423316,0,1,-1,llm8_m0_k1,0,
2026-03-02T12:37:57.325838+00:00,B,llm_style,tune,llm_style_tune_049,2,3072,2048,bf16,NVIDIA GeForce RTX 4060,c04,64,64,64,4,3,8,0.0,0.0,104.44799810647964,254.67903256416298,0.2409411808385707,0,0,-1,llm8_m0_k0,0,
2026-03-02T12:37:57.360423+00:00,B,llm_style,tune,llm_style_tune_050,4,8192,1024,bf16,NVIDIA GeForce RTX 4060,c00,32,32,32,2,2,8,0.0,0.0,93.18400174379349,119.66400288045399,0.7201758106988551,1,0,-1,llm8_m1_k0,0,
2026-03-02T12:37:57.533312+00:00,B,llm_style,tune,llm_style_tune_051,1,8192,4096,bf16,NVIDIA GeForce RTX 4060,c11,32,128,32,4,2,8,0.0,0.0,466.43200516700745,490.7007947564125,0.14387705658399547,0,1,-1,llm8_m0_k1,0,
2026-03-02T12:37:57.714136+00:00,B,llm_style,tune,llm_style_tune_052,8,4096,8192,bf16,NVIDIA GeForce RTX 4060,c10,64,128,64,8,3,8,0.0,0.0,501.6320049762726,607.2927850484845,1.070248522171934,1,1,-1,llm8_m1_k1,0,
2026-03-02T12:37:57.738633+00:00,B,llm_style,tune,llm_style_tune_053,64,4096,1024,bf16,NVIDIA GeForce RTX 4060,c11,32,128,32,4,2,8,0.0,0.0,77.82399654388428,112.22144119441509,6.8985266221487755,3,0,-1,llm8_m3_k0,0,
2026-03-02T12:37:57.753872+00:00,B,llm_style,tune,llm_style_tune_054,1,2048,1536,bf16,NVIDIA GeForce RTX 4060,c04,64,64,64,4,3,8,0.0,0.0,72.1920020878315,187.8009596467016,0.0871489336498187,0,0,-1,llm8_m0_k0,0,
2026-03-02T12:37:57.823114+00:00,B,llm_style,tune,llm_style_tune_055,64,6144,2048,bf16,NVIDIA GeForce RTX 4060,c11,32,128,32,4,2,8,0.0,0.0,163.83999586105347,204.81983810663212,9.8304002483368,3,0,-1,llm8_m3_k0,0,
2026-03-02T12:37:57.866581+00:00,B,llm_style,tune,llm_style_tune_056,16,1536,4096,bf16,NVIDIA GeForce RTX 4060,c08,128,128,64,8,4,8,0.0,0.0,240.12800306081772,348.14175039529766,0.8384136353685063,2,1,-1,llm8_m2_k1,0,
2026-03-02T12:37:57.973093+00:00,B,llm_style,tune,llm_style_tune_057,16,4096,4096,bf16,NVIDIA GeForce RTX 4060,c08,128,128,64,8,4,8,0.0,0.0,502.78401374816895,543.9763092994689,1.067796304814306,2,1,-1,llm8_m2_k1,0,
2026-03-02T12:37:58.108825+00:00,B,llm_style,tune,llm_style_tune_058,1,3072,8192,bf16,NVIDIA GeForce RTX 4060,c11,32,128,32,4,2,8,0.0,0.0,366.4799928665161,431.55200362205494,0.1373380511343014,0,1,-1,llm8_m0_k1,0,
2026-03-02T12:37:58.158037+00:00,B,llm_style,tune,llm_style_tune_059,64,1024,8192,bf16,NVIDIA GeForce RTX 4060,c04,64,64,64,4,3,8,0.0,0.0,151.5520066022873,286.8428723514078,7.084972664319673,3,1,-1,llm8_m3_k1,0,
2026-03-02T12:37:58.216418+00:00,B,llm_style,tune,llm_style_tune_060,16,3072,3072,bf16,NVIDIA GeForce RTX 4060,c08,128,128,64,8,4,8,0.0,0.0,211.96800470352173,264.9996834993362,1.424695620560241,2,1,-1,llm8_m2_k1,0,
2026-03-02T12:37:58.227456+00:00,B,llm_style,tune,llm_style_tune_061,1,1024,1536,bf16,NVIDIA GeForce RTX 4060,c04,64,64,64,4,3,8,0.0,0.0,60.416001826524734,122.3628834635019,0.05206779503603159,0,0,-1,llm8_m0_k0,0,
2026-03-02T12:37:58.257926+00:00,B,llm_style,tune,llm_style_tune_062,32,6144,1024,bf16,NVIDIA GeForce RTX 4060,c11,32,128,32,4,2,8,0.0,0.0,84.99199897050858,143.91520366072652,4.7375422260596185,2,0,-1,llm8_m2_k0,0,
2026-03-02T12:37:58.283592+00:00,B,llm_style,tune,llm_style_tune_063,4,1536,3072,bf16,NVIDIA GeForce RTX 4060,c10,64,128,64,8,3,8,0.0,0.0,125.95200538635254,265.35199537873245,0.2997073042561516,1,1,-1,llm8_m1_k1,0,
2026-03-02T12:37:58.319500+00:00,B,llm_style,eval,llm_style_eval_000,32,8192,1024,bf16,NVIDIA GeForce RTX 4060,c11,32,128,32,4,2,8,0.0,0.0,84.41599830985069,99.32831943035124,6.35982423650792,2,0,-1,llm8_m2_k0,0,
2026-03-02T12:37:58.358019+00:00,B,llm_style,eval,llm_style_eval_001,2,3072,2048,bf16,NVIDIA GeForce RTX 4060,c04,64,64,64,4,3,8,0.0,0.0,98.30400347709656,218.33535522222502,0.2559999909450614,0,0,-1,llm8_m0_k0,0,
2026-03-02T12:37:58.378402+00:00,B,llm_style,eval,llm_style_eval_002,32,1536,1536,bf16,NVIDIA GeForce RTX 4060,c11,32,128,32,4,2,8,0.0,0.0,83.80799740552902,189.58336457610127,1.8016770317201074,2,0,-1,llm8_m2_k0,0,
2026-03-02T12:37:58.672970+00:00,B,llm_style,eval,llm_style_eval_003,16,8192,6144,bf16,NVIDIA GeForce RTX 4060,c08,128,128,64,8,4,8,0.0,0.0,1246.2079524993896,1308.7219107151031,1.2924108956051528,2,1,-1,llm8_m2_k1,0,
2026-03-02T12:37:58.702838+00:00,B,llm_style,eval,llm_style_eval_004,2,3072,1536,bf16,NVIDIA GeForce RTX 4060,c04,64,64,64,4,3,8,0.0,0.0,82.43199810385704,225.67935794591887,0.2289689493662396,0,0,-1,llm8_m0_k0,0,
2026-03-02T12:37:58.834062+00:00,B,llm_style,eval,llm_style_eval_005,8,3072,8192,bf16,NVIDIA GeForce RTX 4060,c10,64,128,64,8,3,8,0.0,0.0,362.4959886074066,438.21887105703354,1.110779695926745,1,1,-1,llm8_m1_k1,0,
2026-03-02T12:37:58.910796+00:00,B,llm_style,eval,llm_style_eval_006,64,2048,6144,bf16,NVIDIA GeForce RTX 4060,c04,64,64,64,4,3,8,0.0,0.0,227.32800245285034,284.66944605112076,7.0849728965267005,3,1,-1,llm8_m3_k1,0,
2026-03-02T12:37:58.935495+00:00,B,llm_style,eval,llm_style_eval_007,8,3072,2048,bf16,NVIDIA GeForce RTX 4060,c00,32,32,32,2,2,8,0.0,0.0,68.43199953436852,82.48319812119006,1.470997438112911,1,0,-1,llm8_m1_k0,0,
2026-03-02T12:37:58.960935+00:00,B,llm_style,eval,llm_style_eval_008,16,3072,2048,bf16,NVIDIA GeForce RTX 4060,c11,32,128,32,4,2,8,0.0,0.0,88.06400001049042,101.39647707343102,2.28613953461139,2,0,-1,llm8_m2_k0,0,
2026-03-02T12:37:59.208658+00:00,B,llm_style,eval,llm_style_eval_009,64,6144,6144,bf16,NVIDIA GeForce RTX 4060,c04,64,64,64,4,3,8,0.0,0.0,613.3440136909485,761.361930966377,7.877859896150653,3,1,-1,llm8_m3_k1,0,
2026-03-02T12:37:59.253740+00:00,B,llm_style,eval,llm_style_eval_010,64,1536,6144,bf16,NVIDIA GeForce RTX 4060,c04,64,64,64,4,3,8,0.0,0.0,160.76800227165222,274.97472718358017,7.513681422494084,3,1,-1,llm8_m3_k1,0,
2026-03-02T12:37:59.461164+00:00,B,llm_style,eval,llm_style_eval_011,32,4096,8192,bf16,NVIDIA GeForce RTX 4060,c08,128,128,64,8,4,8,0.0,0.0,1037.2000336647034,1146.3421249389646,2.070462377842748,2,1,-1,llm8_m2_k1,0,
2026-03-02T12:37:59.474167+00:00,B,llm_style,eval,llm_style_eval_012,32,1536,1024,bf16,NVIDIA GeForce RTX 4060,c11,32,128,32,4,2,8,0.0,0.0,57.312000542879105,103.03487733006465,1.7564086935804444,2,0,-1,llm8_m2_k0,0,
2026-03-02T12:37:59.558095+00:00,B,llm_style,eval,llm_style_eval_013,32,2048,6144,bf16,NVIDIA GeForce RTX 4060,c08,128,128,64,8,4,8,0.0,0.0,412.0800048112869,473.75807195901865,1.9542476184176711,2,1,-1,llm8_m2_k1,0,
2026-03-02T12:37:59.607230+00:00,B,llm_style,eval,llm_style_eval_014,2,8192,1024,bf16,NVIDIA GeForce RTX 4060,c04,64,64,64,4,3,8,0.0,0.0,142.73599535226822,203.19040089845646,0.23508037981021293,0,0,-1,llm8_m0_k0,0,
2026-03-02T12:37:59.628692+00:00,B,llm_style,eval,llm_style_eval_015,32,2048,2048,bf16,NVIDIA GeForce RTX 4060,c11,32,128,32,4,2,8,0.0,0.0,84.86399799585342,102.92223758995533,3.1631252632372577,2,0,-1,llm8_m2_k0,0,
2026-03-02T12:37:59.732643+00:00,B,llm_style,eval,llm_style_eval_016,32,4096,4096,bf16,NVIDIA GeForce RTX 4060,c08,128,128,64,8,4,8,0.0,0.0,534.5280170440674,561.6703993082047,2.0087662194729803,2,1,-1,llm8_m2_k1,0,
2026-03-02T12:37:59.990090+00:00,B,llm_style,eval,llm_style_eval_017,8,8192,6144,bf16,NVIDIA GeForce RTX 4060,c10,64,128,64,8,3,8,0.0,0.0,727.0399928092957,838.257275223732,1.1076507151804424,1,1,-1,llm8_m1_k1,0,
2026-03-02T12:38:00.010426+00:00,B,llm_style,eval,llm_style_eval_018,8,2048,2048,bf16,NVIDIA GeForce RTX 4060,c00,32,32,32,2,2,8,0.0,0.0,66.56000018119812,133.14047291874886,1.0082461511013776,1,0,-1,llm8_m1_k0,0,
2026-03-02T12:38:00.026892+00:00,B,llm_style,eval,llm_style_eval_019,32,3072,1024,bf16,NVIDIA GeForce RTX 4060,c11,32,128,32,4,2,8,0.0,0.0,60.416001826524734,151.46591708064065,3.3323388823060216,2,0,-1,llm8_m2_k0,0,
2026-03-02T12:38:00.053910+00:00,B,llm_style,eval,llm_style_eval_020,64,1536,3072,bf16,NVIDIA GeForce RTX 4060,c04,64,64,64,4,3,8,0.0,0.0,88.06400001049042,195.14367520809174,6.85841860383417,3,1,-1,llm8_m3_k1,0,
2026-03-02T12:38:00.084539+00:00,B,llm_style,eval,llm_style_eval_021,64,6144,1024,bf16,NVIDIA GeForce RTX 4060,c11,32,128,32,4,2,8,0.0,0.0,106.91199824213982,186.27583950757972,7.5324227518047175,3,0,-1,llm8_m3_k0,0,
2026-03-02T12:38:00.126460+00:00,B,llm_style,eval,llm_style_eval_022,32,6144,1536,bf16,NVIDIA GeForce RTX 4060,c11,32,128,32,4,2,8,0.0,0.0,70.36799937486649,99.96096000075337,8.58315969425905,2,0,-1,llm8_m2_k0,0,
2026-03-02T12:38:00.155194+00:00,B,llm_style,eval,llm_style_eval_023,8,1024,4096,bf16,NVIDIA GeForce RTX 4060,c10,64,128,64,8,3,8,0.0,0.0,158.720001578331,170.48608496785164,0.42281289902130353,1,1,-1,llm8_m1_k1,0,
2026-03-02T12:38:00.496241+00:00,B,llm_style,eval,llm_style_eval_024,64,8192,8192,bf16,NVIDIA GeForce RTX 4060,c04,64,64,64,4,3,8,0.0,0.0,954.367995262146,1010.7177102565765,9.000652405197762,3,1,-1,llm8_m3_k1,0,
2026-03-02T12:38:00.587586+00:00,B,llm_style,eval,llm_style_eval_025,2,8192,2048,bf16,NVIDIA GeForce RTX 4060,c04,64,64,64,4,3,8,0.0,0.0,294.8960065841675,333.40032428503036,0.22756789682347286,0,0,-1,llm8_m0_k0,0,
2026-03-02T12:38:00.611693+00:00,B,llm_style,eval,llm_style_eval_026,32,4096,1024,bf16,NVIDIA GeForce RTX 4060,c11,32,128,32,4,2,8,0.0,0.0,68.60800087451935,176.98623627424234,3.9125969650530297,2,0,-1,llm8_m2_k0,0,
2026-03-02T12:38:00.640267+00:00,B,llm_style,eval,llm_style_eval_027,8,4096,1536,bf16,NVIDIA GeForce RTX 4060,c00,32,32,32,2,2,8,0.0,0.0,62.46400065720081,163.24896231293678,1.6115409666510943,1,0,-1,llm8_m1_k0,0,
2026-03-02T12:38:00.656668+00:00,B,llm_style,eval,llm_style_eval_028,2,1536,1536,bf16,NVIDIA GeForce RTX 4060,c04,64,64,64,4,3,8,0.0,0.0,60.912000015378,97.70560018718237,0.15493144204126386,0,0,-1,llm8_m0_k0,0,
2026-03-02T12:38:00.804045+00:00,B,llm_style,eval,llm_style_eval_029,16,3072,8192,bf16,NVIDIA GeForce RTX 4060,c08,128,128,64,8,4,8,0.0,0.0,655.3599834442139,884.8793458938594,1.2288000310421,2,1,-1,llm8_m2_k1,0,
2026-03-02T12:38:00.820728+00:00,B,llm_style,eval,llm_style_eval_030,2,1536,1536,bf16,NVIDIA GeForce RTX 4060,c04,64,64,64,4,3,8,0.0,0.0,84.99199897050858,240.98143845796545,0.1110361459232723,0,0,-1,llm8_m0_k0,0,
2026-03-02T12:38:00.865379+00:00,B,llm_style,eval,llm_style_eval_031,64,4096,2048,bf16,NVIDIA GeForce RTX 4060,c11,32,128,32,4,2,8,0.0,0.0,182.27200210094452,484.2681464552868,5.890876336593639,3,0,-1,llm8_m3_k0,0,
2026-03-02T12:38:01.044182+00:00,B,llm_style,eval,llm_style_eval_032,64,8192,4096,bf16,NVIDIA GeForce RTX 4060,c04,64,64,64,4,3,8,0.0,0.0,551.9359707832336,957.5526088476176,7.781640486133124,3,1,-1,llm8_m3_k1,0,
2026-03-02T12:38:01.142624+00:00,B,llm_style,eval,llm_style_eval_033,32,4096,3072,bf16,NVIDIA GeForce RTX 4060,c08,128,128,64,8,4,8,0.0,0.0,538.6239886283875,701.5881681442261,1.4951179022878696,2,1,-1,llm8_m2_k1,0,
2026-03-02T12:38:01.291845+00:00,B,llm_style,eval,llm_style_eval_034,64,6144,4096,bf16,NVIDIA GeForce RTX 4060,c04,64,64,64,4,3,8,0.0,0.0,395.61599493026733,508.32832396030426,8.142303428777657,3,1,-1,llm8_m3_k1,0,
2026-03-02T12:38:01.562920+00:00,B,llm_style,eval,llm_style_eval_035,64,6144,8192,bf16,NVIDIA GeForce RTX 4060,c04,64,64,64,4,3,8,0.0,0.0,786.2080037593842,900.782083272934,8.194333958945153,3,1,-1,llm8_m3_k1,0,
2026-03-02T12:38:01.660799+00:00,B,llm_style,eval,llm_style_eval_036,4,8192,2048,bf16,NVIDIA GeForce RTX 4060,c00,32,32,32,2,2,8,0.0,0.0,255.48800826072693,382.5356715917587,0.5253386603688659,1,0,-1,llm8_m1_k0,0,
2026-03-02T12:38:01.713715+00:00,B,llm_style,eval,llm_style_eval_037,64,2048,4096,bf16,NVIDIA GeForce RTX 4060,c04,64,64,64,4,3,8,0.0,0.0,219.13599967956543,308.4067264199256,4.8998878576322165,3,1,-1,llm8_m3_k1,0,
2026-03-02T12:38:01.763432+00:00,B,llm_style,eval,llm_style_eval_038,64,4096,2048,bf16,NVIDIA GeForce RTX 4060,c11,32,128,32,4,2,8,0.0,0.0,177.12000012397766,257.0940801501272,6.062227999370027,3,0,-1,llm8_m3_k0,0,
2026-03-02T12:38:01.838179+00:00,B,llm_style,eval,llm_style_eval_039,64,6144,2048,bf16,NVIDIA GeForce RTX 4060,c11,32,128,32,4,2,8,0.0,0.0,234.49599742889404,242.18624368309975,6.868401822032737,3,0,-1,llm8_m3_k0,0,
2026-03-02T12:38:01.941240+00:00,B,llm_style,eval,llm_style_eval_040,8,6144,3072,bf16,NVIDIA GeForce RTX 4060,c10,64,128,64,8,3,8,0.0,0.0,326.35200023651123,450.78528344631195,0.925350197887999,1,1,-1,llm8_m1_k1,0,
2026-03-02T12:38:02.012425+00:00,B,llm_style,eval,llm_style_eval_041,2,8192,1536,bf16,NVIDIA GeForce RTX 4060,c04,64,64,64,4,3,8,0.0,0.0,248.60799312591553,363.62047910690296,0.20245386066291085,0,0,-1,llm8_m0_k0,0,
2026-03-02T12:38:02.028150+00:00,B,llm_style,eval,llm_style_eval_042,32,1536,1536,bf16,NVIDIA GeForce RTX 4060,c11,32,128,32,4,2,8,0.0,0.0,91.12000092864037,150.3334349393844,1.6570998953155196,2,0,-1,llm8_m2_k0,0,
2026-03-02T12:38:02.054057+00:00,B,llm_style,eval,llm_style_eval_043,64,1536,3072,bf16,NVIDIA GeForce RTX 4060,c04,64,64,64,4,3,8,0.0,0.0,112.64000087976456,204.17279735207558,5.362036321756663,3,1,-1,llm8_m3_k1,0,
2026-03-02T12:38:02.063937+00:00,B,llm_style,eval,llm_style_eval_044,2,1536,1024,bf16,NVIDIA GeForce RTX 4060,c04,64,64,64,4,3,8,0.0,0.0,62.97599896788597,77.4246400594711,0.0999024406616919,0,0,-1,llm8_m0_k0,0,
2026-03-02T12:38:02.136098+00:00,B,llm_style,eval,llm_style_eval_045,64,4096,3072,bf16,NVIDIA GeForce RTX 4060,c04,64,64,64,4,3,8,0.0,0.0,258.432000875473,374.8028829693794,6.232249607416393,3,1,-1,llm8_m3_k1,0,
2026-03-02T12:38:02.195591+00:00,B,llm_style,eval,llm_style_eval_046,64,2048,4096,bf16,NVIDIA GeForce RTX 4060,c04,64,64,64,4,3,8,0.0,0.0,236.52800172567368,369.47904169559473,4.539597071662284,3,1,-1,llm8_m3_k1,0,
2026-03-02T12:38:02.299270+00:00,B,llm_style,eval,llm_style_eval_047,2,6144,3072,bf16,NVIDIA GeForce RTX 4060,c11,32,128,32,4,2,8,0.0,0.0,307.5520098209381,446.43330037593813,0.2454787144585915,0,1,-1,llm8_m0_k1,0,
2026-03-02T12:38:02.564048+00:00,B,llm_style,eval,llm_style_eval_048,16,4096,8192,bf16,NVIDIA GeForce RTX 4060,c08,128,128,64,8,4,8,0.0,0.0,1682.4320554733276,1690.6854391098022,0.6382081347694711,2,1,-1,llm8_m2_k1,0,
2026-03-02T12:38:02.615789+00:00,B,llm_style,eval,llm_style_eval_049,16,2048,3072,bf16,NVIDIA GeForce RTX 4060,c08,128,128,64,8,4,8,0.0,0.0,378.2559931278229,466.4416083693503,0.5322495761011414,2,1,-1,llm8_m2_k1,0,
2026-03-02T12:38:02.632104+00:00,B,llm_style,eval,llm_style_eval_050,16,1024,1536,bf16,NVIDIA GeForce RTX 4060,c11,32,128,32,4,2,8,0.0,0.0,123.90399724245071,263.40095311403275,0.4062148850735857,2,0,-1,llm8_m2_k0,0,
2026-03-02T12:38:02.678383+00:00,B,llm_style,eval,llm_style_eval_051,4,2048,4096,bf16,NVIDIA GeForce RTX 4060,c10,64,128,64,8,3,8,0.0,0.0,274.4159996509552,335.9481573104857,0.2445515716480069,1,1,-1,llm8_m1_k1,0,
2026-03-02T12:38:02.731796+00:00,B,llm_style,eval,llm_style_eval_052,4,1024,6144,bf16,NVIDIA GeForce RTX 4060,c10,64,128,64,8,3,8,0.0,0.0,297.9840040206909,411.7401611804961,0.16890721421578442,1,1,-1,llm8_m1_k1,0,
2026-03-02T12:38:02.804864+00:00,B,llm_style,eval,llm_style_eval_053,64,6144,2048,bf16,NVIDIA GeForce RTX 4060,c11,32,128,32,4,2,8,0.0,0.0,223.23200106620789,291.2614440917969,7.214972442603836,3,0,-1,llm8_m3_k0,0,
2026-03-02T12:38:02.834162+00:00,B,llm_style,eval,llm_style_eval_054,2,3072,2048,bf16,NVIDIA GeForce RTX 4060,c04,64,64,64,4,3,8,0.0,0.0,120.25600299239159,168.86784106492988,0.20926875477137058,0,0,-1,llm8_m0_k0,0,
2026-03-02T12:38:02.843550+00:00,B,llm_style,eval,llm_style_eval_055,4,1024,1024,bf16,NVIDIA GeForce RTX 4060,c00,32,32,32,2,2,8,0.0,0.0,59.20000001788139,125.38144439458846,0.14169945941665907,1,0,-1,llm8_m1_k0,0,
2026-03-02T12:38:02.852382+00:00,B,llm_style,eval,llm_style_eval_056,2,1024,1024,bf16,NVIDIA GeForce RTX 4060,c04,64,64,64,4,3,8,0.0,0.0,59.39200147986412,70.1952014118433,0.07062068789552428,0,0,-1,llm8_m0_k0,0,
2026-03-02T12:38:02.889694+00:00,B,llm_style,eval,llm_style_eval_057,2,1024,6144,bf16,NVIDIA GeForce RTX 4060,c11,32,128,32,4,2,8,0.0,0.0,250.7839947938919,309.90336060523975,0.10034860486484658,0,1,-1,llm8_m0_k1,0,
2026-03-02T12:38:02.907361+00:00,B,llm_style,eval,llm_style_eval_058,2,2048,1536,bf16,NVIDIA GeForce RTX 4060,c04,64,64,64,4,3,8,0.0,0.0,93.9360000193119,157.2966447472572,0.13395196726934436,0,0,-1,llm8_m0_k0,0,
2026-03-02T12:38:03.174715+00:00,B,llm_style,eval,llm_style_eval_059,8,8192,6144,bf16,NVIDIA GeForce RTX 4060,c10,64,128,64,8,3,8,0.0,0.0,812.0319843292236,901.7830276489256,0.9917175475116545,1,1,-1,llm8_m1_k1,0,
2026-03-02T12:38:03.357936+00:00,B,llm_style,eval,llm_style_eval_060,1,4096,8192,bf16,NVIDIA GeForce RTX 4060,c11,32,128,32,4,2,8,0.0,0.0,479.2320132255554,527.4448066949843,0.14003418416960917,0,1,-1,llm8_m0_k1,0,
2026-03-02T12:38:03.397041+00:00,B,llm_style,eval,llm_style_eval_061,32,1536,3072,bf16,NVIDIA GeForce RTX 4060,c08,128,128,64,8,4,8,0.0,0.0,289.792001247406,452.8502395749091,1.0420918683058482,2,1,-1,llm8_m2_k1,0,
2026-03-02T12:38:03.431413+00:00,B,llm_style,eval,llm_style_eval_062,8,6144,1024,bf16,NVIDIA GeForce RTX 4060,c00,32,32,32,2,2,8,0.0,0.0,84.99199897050858,209.0873628854751,1.1843855565149046,1,0,-1,llm8_m1_k0,0,
2026-03-02T12:38:03.617846+00:00,B,llm_style,eval,llm_style_eval_063,64,8192,4096,bf16,NVIDIA GeForce RTX 4060,c04,64,64,64,4,3,8,0.0,0.0,568.7359869480133,584.32512819767,7.551776913305455,3,1,-1,llm8_m3_k1,0,
2026-03-02T12:38:03.648271+00:00,B,llm_style,eval,llm_style_eval_064,16,6144,1024,bf16,NVIDIA GeForce RTX 4060,c11,32,128,32,4,2,8,0.0,0.0,96.16000205278397,153.43615949153883,2.0936625177013637,2,0,-1,llm8_m2_k0,0,
2026-03-02T12:38:03.825199+00:00,B,llm_style,eval,llm_style_eval_065,8,8192,4096,bf16,NVIDIA GeForce RTX 4060,c10,64,128,64,8,3,8,0.0,0.0,563.1999969482422,598.5056042671204,0.9532509142561983,1,1,-1,llm8_m1_k1,0,
2026-03-02T12:38:03.861590+00:00,B,llm_style,eval,llm_style_eval_066,32,1536,3072,bf16,NVIDIA GeForce RTX 4060,c08,128,128,64,8,4,8,0.0,0.0,307.16800689697266,414.12608593702305,0.9831423885928672,2,1,-1,llm8_m2_k1,0,
2026-03-02T12:38:03.992511+00:00,B,llm_style,eval,llm_style_eval_067,8,8192,3072,bf16,NVIDIA GeForce RTX 4060,c10,64,128,64,8,3,8,0.0,0.0,417.28000342845917,490.3875219821929,0.9649472313355967,1,1,-1,llm8_m1_k1,0,
2026-03-02T12:38:04.018385+00:00,B,llm_style,eval,llm_style_eval_068,64,1536,3072,bf16,NVIDIA GeForce RTX 4060,c04,64,64,64,4,3,8,0.0,0.0,109.3599982559681,179.7222375869751,5.522858317776528,3,1,-1,llm8_m3_k1,0,
2026-03-02T12:38:04.289954+00:00,B,llm_style,eval,llm_style_eval_069,64,8192,6144,bf16,NVIDIA GeForce RTX 4060,c04,64,64,64,4,3,8,0.0,0.0,799.7440099716187,869.068795442581,8.055641384833416,3,1,-1,llm8_m3_k1,0,
2026-03-02T12:38:04.335531+00:00,B,llm_style,eval,llm_style_eval_070,8,8192,1024,bf16,NVIDIA GeForce RTX 4060,c00,32,32,32,2,2,8,0.0,0.0,101.07200220227242,153.76383975148195,1.327941715564257,1,0,-1,llm8_m1_k0,0,
2026-03-02T12:38:04.437769+00:00,B,llm_style,eval,llm_style_eval_071,2,6144,3072,bf16,NVIDIA GeForce RTX 4060,c11,32,128,32,4,2,8,0.0,0.0,280.5759906768799,401.9718292355535,0.2690803009119382,0,1,-1,llm8_m0_k1,0,
2026-03-02T12:38:04.448934+00:00,B,llm_style,eval,llm_style_eval_072,64,1024,1024,bf16,NVIDIA GeForce RTX 4060,c11,32,128,32,4,2,8,0.0,0.0,69.63200122117996,164.887362718582,1.9275293779604168,3,0,-1,llm8_m3_k0,0,
2026-03-02T12:38:04.544927+00:00,B,llm_style,eval,llm_style_eval_073,1,8192,2048,bf16,NVIDIA GeForce RTX 4060,c04,64,64,64,4,3,8,0.0,0.0,377.85598635673523,512.7151861786842,0.08880217122806448,0,0,-1,llm8_m0_k0,0,
2026-03-02T12:38:04.566004+00:00,B,llm_style,eval,llm_style_eval_074,64,1024,1536,bf16,NVIDIA GeForce RTX 4060,c11,32,128,32,4,2,8,0.0,0.0,138.15999776124954,247.13215395808214,1.4571988655349204,3,0,-1,llm8_m3_k0,0,
2026-03-02T12:38:04.585696+00:00,B,llm_style,eval,llm_style_eval_075,2,1536,2048,bf16,NVIDIA GeForce RTX 4060,c04,64,64,64,4,3,8,0.0,0.0,100.35199671983719,186.2662348151207,0.12538775920053677,0,0,-1,llm8_m0_k0,0,
2026-03-02T12:38:04.625624+00:00,B,llm_style,eval,llm_style_eval_076,64,2048,3072,bf16,NVIDIA GeForce RTX 4060,c04,64,64,64,4,3,8,0.0,0.0,189.42400068044662,226.38591468334198,4.25134283463124,3,1,-1,llm8_m3_k1,0,
2026-03-02T12:38:04.769669+00:00,B,llm_style,eval,llm_style_eval_077,1,3072,8192,bf16,NVIDIA GeForce RTX 4060,c11,32,128,32,4,2,8,0.0,0.0,518.1440114974976,548.5302394628525,0.097138337765471,0,1,-1,llm8_m0_k1,0,
2026-03-02T12:38:04.787785+00:00,B,llm_style,eval,llm_style_eval_078,1,1024,2048,bf16,NVIDIA GeForce RTX 4060,c04,64,64,64,4,3,8,0.0,0.0,124.7359998524189,243.27167630195595,0.03362544898796242,0,0,-1,llm8_m0_k0,0,
2026-03-02T12:38:04.809727+00:00,B,llm_style,eval,llm_style_eval_079,64,1536,2048,bf16,NVIDIA GeForce RTX 4060,c11,32,128,32,4,2,8,0.0,0.0,158.720001578331,252.07039684057236,2.536877394127821,3,0,-1,llm8_m3_k0,0,
2026-03-02T12:38:04.821090+00:00,B,llm_style,eval,llm_style_eval_080,4,1536,1024,bf16,NVIDIA GeForce RTX 4060,c00,32,32,32,2,2,8,0.0,0.0,75.77600330114365,91.17696106433868,0.1660540468199923,1,0,-1,llm8_m1_k0,0,
2026-03-02T12:38:04.977174+00:00,B,llm_style,eval,llm_style_eval_081,4,4096,6144,bf16,NVIDIA GeForce RTX 4060,c10,64,128,64,8,3,8,0.0,0.0,779.263973236084,806.7174410820007,0.2583548051938577,1,1,-1,llm8_m1_k1,0,
2026-03-02T12:38:04.996719+00:00,B,llm_style,eval,llm_style_eval_082,64,1024,2048,bf16,NVIDIA GeForce RTX 4060,c11,32,128,32,4,2,8,0.0,0.0,138.2399946451187,162.91839554905889,1.9418074826254956,3,0,-1,llm8_m3_k0,0,
2026-03-02T12:38:05.104950+00:00,B,llm_style,eval,llm_style_eval_083,8,4096,4096,bf16,NVIDIA GeForce RTX 4060,c10,64,128,64,8,3,8,0.0,0.0,534.3040227890015,650.6396609544752,0.5024020867348141,1,1,-1,llm8_m1_k1,0,
2026-03-02T12:38:05.156389+00:00,B,llm_style,eval,llm_style_eval_084,64,3072,3072,bf16,NVIDIA GeForce RTX 4060,c04,64,64,64,4,3,8,0.0,0.0,223.7439975142479,272.3676824569701,5.398846741902329,3,1,-1,llm8_m3_k1,0,
2026-03-02T12:38:05.310886+00:00,B,llm_style,eval,llm_style_eval_085,1,3072,8192,bf16,NVIDIA GeForce RTX 4060,c11,32,128,32,4,2,8,0.0,0.0,498.6880123615265,523.8271951675415,0.10092812891502155,0,1,-1,llm8_m0_k1,0,
2026-03-02T12:38:05.325364+00:00,B,llm_style,eval,llm_style_eval_086,8,1536,1024,bf16,NVIDIA GeForce RTX 4060,c00,32,32,32,2,2,8,0.0,0.0,81.40799775719643,173.4393666684627,0.309132083988337,1,0,-1,llm8_m1_k0,0,
2026-03-02T12:38:05.362410+00:00,B,llm_style,eval,llm_style_eval_087,16,1024,3072,bf16,NVIDIA GeForce RTX 4060,c08,128,128,64,8,4,8,0.0,0.0,418.720006942749,503.948805630207,0.24040717981207796,2,1,-1,llm8_m2_k1,0,
2026-03-02T12:38:05.458569+00:00,B,llm_style,eval,llm_style_eval_088,8,8192,2048,bf16,NVIDIA GeForce RTX 4060,c00,32,32,32,2,2,8,0.0,0.0,263.16800713539124,374.3232038617134,1.020015536546199,1,0,-1,llm8_m1_k0,0,
2026-03-02T12:38:05.606985+00:00,B,llm_style,eval,llm_style_eval_089,64,6144,4096,bf16,NVIDIA GeForce RTX 4060,c04,64,64,64,4,3,8,0.0,0.0,536.9439721107483,568.0025619268417,5.999183600734419,3,1,-1,llm8_m3_k1,0,
2026-03-02T12:38:05.672242+00:00,B,llm_style,eval,llm_style_eval_090,2,1536,6144,bf16,NVIDIA GeForce RTX 4060,c11,32,128,32,4,2,8,0.0,0.0,363.5199964046478,408.2176077365875,0.10384225454816648,0,1,-1,llm8_m0_k1,0,
2026-03-02T12:38:05.685259+00:00,B,llm_style,eval,llm_style_eval_091,2,1024,1024,bf16,NVIDIA GeForce RTX 4060,c04,64,64,64,4,3,8,0.0,0.0,70.64000144600868,199.0956798195838,0.05937576322398261,0,0,-1,llm8_m0_k0,0,
2026-03-02T12:38:05.788961+00:00,B,llm_style,eval,llm_style_eval_092,4,4096,4096,bf16,NVIDIA GeForce RTX 4060,c10,64,128,64,8,3,8,0.0,0.0,506.75198435783386,577.418218255043,0.2648588109034903,1,1,-1,llm8_m1_k1,0,
2026-03-02T12:38:05.812204+00:00,B,llm_style,eval,llm_style_eval_093,32,2048,1536,bf16,NVIDIA GeForce RTX 4060,c11,32,128,32,4,2,8,0.0,0.0,118.78400295972824,227.28095844388008,1.6948965094925827,2,0,-1,llm8_m2_k0,0,
2026-03-02T12:38:05.838102+00:00,B,llm_style,eval,llm_style_eval_094,2,2048,2048,bf16,NVIDIA GeForce RTX 4060,c04,64,64,64,4,3,8,0.0,0.0,152.97599881887436,243.3782477676868,0.10967221086665006,0,0,-1,llm8_m0_k0,0,
2026-03-02T12:38:06.032917+00:00,B,llm_style,eval,llm_style_eval_095,1,6144,6144,bf16,NVIDIA GeForce RTX 4060,c11,32,128,32,4,2,8,0.0,0.0,530.4319858551025,646.6198313236234,0.1423320501275795,0,1,-1,llm8_m0_k1,0,
2026-03-02T12:38:06.078969+00:00,B,llm_style,eval,llm_style_eval_096,64,1024,6144,bf16,NVIDIA GeForce RTX 4060,c04,64,64,64,4,3,8,0.0,0.0,262.59200274944305,304.87551510334015,3.0667589247506437,3,1,-1,llm8_m3_k1,0,
2026-03-02T12:38:06.109750+00:00,B,llm_style,eval,llm_style_eval_097,64,1536,2048,bf16,NVIDIA GeForce RTX 4060,c11,32,128,32,4,2,8,0.0,0.0,161.79199516773224,231.4444763958454,2.488708935090165,3,0,-1,llm8_m3_k0,0,
2026-03-02T12:38:06.128393+00:00,B,llm_style,eval,llm_style_eval_098,32,1024,2048,bf16,NVIDIA GeForce RTX 4060,c11,32,128,32,4,2,8,0.0,0.0,144.28799599409103,233.59488457441327,0.9302071670986168,2,0,-1,llm8_m2_k0,0,
2026-03-02T12:38:06.177984+00:00,B,llm_style,eval,llm_style_eval_099,1,6144,1536,bf16,NVIDIA GeForce RTX 4060,c04,64,64,64,4,3,8,0.0,0.0,214.9920016527176,369.5999976992607,0.08779102410743762,0,0,-1,llm8_m0_k0,0,
2026-03-02T12:38:06.222484+00:00,B,llm_style,eval,llm_style_eval_100,64,6144,1024,bf16,NVIDIA GeForce RTX 4060,c11,32,128,32,4,2,8,0.0,0.0,157.69600123167038,234.51648488640785,5.10670125881587,3,0,-1,llm8_m3_k0,0,
2026-03-02T12:38:06.298369+00:00,B,llm_style,eval,llm_style_eval_101,64,8192,1536,bf16,NVIDIA GeForce RTX 4060,c11,32,128,32,4,2,8,0.0,0.0,315.39198756217957,447.50497251749016,5.106701500089527,3,0,-1,llm8_m3_k0,0,
2026-03-02T12:38:06.341417+00:00,B,llm_style,eval,llm_style_eval_102,32,6144,1536,bf16,NVIDIA GeForce RTX 4060,c11,32,128,32,4,2,8,0.0,0.0,124.41599741578102,222.09151640534392,4.85451861935072,2,0,-1,llm8_m2_k0,0,
2026-03-02T12:38:06.487997+00:00,B,llm_style,eval,llm_style_eval_103,64,4096,6144,bf16,NVIDIA GeForce RTX 4060,c04,64,64,64,4,3,8,0.0,0.0,578.4799754619598,708.7535971403122,5.568430384176408,3,1,-1,llm8_m3_k1,0,
2026-03-02T12:38:06.588341+00:00,B,llm_style,eval,llm_style_eval_104,2,6144,3072,bf16,NVIDIA GeForce RTX 4060,c11,32,128,32,4,2,8,0.0,0.0,285.69599986076355,364.8409605026244,0.2642580646449175,0,1,-1,llm8_m0_k1,0,
2026-03-02T12:38:06.657679+00:00,B,llm_style,eval,llm_style_eval_105,1,4096,3072,bf16,NVIDIA GeForce RTX 4060,c11,32,128,32,4,2,8,0.0,0.0,208.38399976491928,364.8332792520521,0.12076658490282312,0,1,-1,llm8_m0_k1,0,
2026-03-02T12:38:06.694720+00:00,B,llm_style,eval,llm_style_eval_106,64,4096,1536,bf16,NVIDIA GeForce RTX 4060,c11,32,128,32,4,2,8,0.0,0.0,185.2639988064766,246.82496160268784,4.346804415256136,3,0,-1,llm8_m3_k0,0,
2026-03-02T12:38:06.744956+00:00,B,llm_style,eval,llm_style_eval_107,64,6144,1536,bf16,NVIDIA GeForce RTX 4060,c11,32,128,32,4,2,8,0.0,0.0,221.5839996933937,294.15424242615677,5.451474626649291,3,0,-1,llm8_m3_k0,0,
2026-03-02T12:38:06.884613+00:00,B,llm_style,eval,llm_style_eval_108,16,3072,6144,bf16,NVIDIA GeForce RTX 4060,c08,128,128,64,8,4,8,0.0,0.0,751.6160011291504,783.5286408662796,0.8035749306729009,2,1,-1,llm8_m2_k1,0,
2026-03-02T12:38:06.907336+00:00,B,llm_style,eval,llm_style_eval_109,64,1024,2048,bf16,NVIDIA GeForce RTX 4060,c11,32,128,32,4,2,8,0.0,0.0,137.7120018005371,187.38176003098476,1.9492524434348395,3,0,-1,llm8_m3_k0,0,
2026-03-02T12:38:06.955890+00:00,B,llm_style,eval,llm_style_eval_110,16,1536,3072,bf16,NVIDIA GeForce RTX 4060,c08,128,128,64,8,4,8,0.0,0.0,469.82400119304657,622.6902520656586,0.3213861863518494,2,1,-1,llm8_m2_k1,0,
2026-03-02T12:38:07.177800+00:00,B,llm_style,eval,llm_style_eval_111,64,6144,6144,bf16,NVIDIA GeForce RTX 4060,c04,64,64,64,4,3,8,0.0,0.0,962.4960124492645,1077.1587002277374,5.020112442548636,3,1,-1,llm8_m3_k1,0,
2026-03-02T12:38:07.494382+00:00,B,llm_style,eval,llm_style_eval_112,16,6144,6144,bf16,NVIDIA GeForce RTX 4060,c08,128,128,64,8,4,8,0.0,0.0,1861.631989479065,1976.7337548732758,0.6488712907957818,2,1,-1,llm8_m2_k1,0,
2026-03-02T12:38:07.626456+00:00,B,llm_style,eval,llm_style_eval_113,1,8192,3072,bf16,NVIDIA GeForce RTX 4060,c11,32,128,32,4,2,8,0.0,0.0,364.52800035476685,452.45440781116463,0.13807347570287085,0,1,-1,llm8_m0_k1,0,
2026-03-02T12:38:07.643645+00:00,B,llm_style,eval,llm_style_eval_114,64,3072,1024,bf16,NVIDIA GeForce RTX 4060,c11,32,128,32,4,2,8,0.0,0.0,79.58400249481201,127.97344215214244,5.059473906533521,3,0,-1,llm8_m3_k0,0,
2026-03-02T12:38:07.697102+00:00,B,llm_style,eval,llm_style_eval_115,8,3072,3072,bf16,NVIDIA GeForce RTX 4060,c10,64,128,64,8,3,8,0.0,0.0,201.48800313472748,277.22751319408417,0.7493991783671375,1,1,-1,llm8_m1_k1,0,
2026-03-02T12:38:07.726514+00:00,B,llm_style,eval,llm_style_eval_116,16,3072,2048,bf16,NVIDIA GeForce RTX 4060,c11,32,128,32,4,2,8,0.0,0.0,111.10400035977364,208.61823931336397,1.8120552936714276,2,0,-1,llm8_m2_k0,0,
2026-03-02T12:38:07.739735+00:00,B,llm_style,eval,llm_style_eval_117,64,1024,1024,bf16,NVIDIA GeForce RTX 4060,c11,32,128,32,4,2,8,0.0,0.0,80.89599758386612,117.26175807416436,1.6591392900601099,3,0,-1,llm8_m3_k0,0,
2026-03-02T12:38:07.789583+00:00,B,llm_style,eval,llm_style_eval_118,1,6144,1536,bf16,NVIDIA GeForce RTX 4060,c04,64,64,64,4,3,8,0.0,0.0,189.40799683332443,240.50688311457628,0.0996492667445773,0,0,-1,llm8_m0_k0,0,
2026-03-02T12:38:07.803870+00:00,B,llm_style,eval,llm_style_eval_119,1,1024,1536,bf16,NVIDIA GeForce RTX 4060,c04,64,64,64,4,3,8,0.0,0.0,80.89599758386612,90.93311935663223,0.03888607711078383,0,0,-1,llm8_m0_k0,0,
2026-03-02T12:38:07.892791+00:00,B,llm_style,eval,llm_style_eval_120,16,8192,2048,bf16,NVIDIA GeForce RTX 4060,c11,32,128,32,4,2,8,0.0,0.0,253.9519965648651,304.5913651585578,2.1140645447253688,2,0,-1,llm8_m2_k0,0,
2026-03-02T12:38:07.917566+00:00,B,llm_style,eval,llm_style_eval_121,64,4096,1024,bf16,NVIDIA GeForce RTX 4060,c11,32,128,32,4,2,8,0.0,0.0,117.08800122141838,243.92704427242262,4.585191534568554,3,0,-1,llm8_m3_k0,0,
2026-03-02T12:38:07.943626+00:00,B,llm_style,eval,llm_style_eval_122,4,6144,1024,bf16,NVIDIA GeForce RTX 4060,c00,32,32,32,2,2,8,0.0,0.0,86.81599795818329,117.14560225605956,0.5797508429753152,1,0,-1,llm8_m1_k0,0,
2026-03-02T12:38:08.138167+00:00,B,llm_style,eval,llm_style_eval_123,4,8192,4096,bf16,NVIDIA GeForce RTX 4060,c10,64,128,64,8,3,8,0.0,0.0,643.0239975452423,712.598078250885,0.4174579129624369,1,1,-1,llm8_m1_k1,0,
2026-03-02T12:38:08.276475+00:00,B,llm_style,eval,llm_style_eval_124,4,3072,8192,bf16,NVIDIA GeForce RTX 4060,c10,64,128,64,8,3,8,0.0,0.0,463.8719856739044,582.7379161119461,0.434013258437059,1,1,-1,llm8_m1_k1,0,
2026-03-02T12:38:08.377739+00:00,B,llm_style,eval,llm_style_eval_125,64,8192,2048,bf16,NVIDIA GeForce RTX 4060,c11,32,128,32,4,2,8,0.0,0.0,368.49600076675415,489.84064161777485,5.827698654887944,3,0,-1,llm8_m3_k0,0,
2026-03-02T12:38:08.395307+00:00,B,llm_style,eval,llm_style_eval_126,8,1536,1536,bf16,NVIDIA GeForce RTX 4060,c00,32,32,32,2,2,8,0.0,0.0,73.72800260782242,106.79647944867607,0.5119999818901227,1,0,-1,llm8_m1_k0,0,
2026-03-02T12:38:08.409745+00:00,B,llm_style,eval,llm_style_eval_127,64,2048,1024,bf16,NVIDIA GeForce RTX 4060,c11,32,128,32,4,2,8,0.0,0.0,87.55199983716011,184.86271932721138,3.066011701608975,3,0,-1,llm8_m3_k0,0,
2026-03-02T12:38:08.488792+00:00,B,llm_style,eval,llm_style_eval_128,64,6144,2048,bf16,NVIDIA GeForce RTX 4060,c11,32,128,32,4,2,8,0.0,0.0,262.14399933815,305.41471421718586,6.144000015512108,3,0,-1,llm8_m3_k0,0,
2026-03-02T12:38:08.517013+00:00,B,llm_style,eval,llm_style_eval_129,32,6144,1024,bf16,NVIDIA GeForce RTX 4060,c11,32,128,32,4,2,8,0.0,0.0,82.94399827718735,137.3731176555156,4.85451861935072,2,0,-1,llm8_m2_k0,0,
2026-03-02T12:38:08.621513+00:00,B,llm_style,eval,llm_style_eval_130,64,8192,2048,bf16,NVIDIA GeForce RTX 4060,c11,32,128,32,4,2,8,0.0,0.0,371.68000638484955,483.2566466927527,5.777775535702142,3,0,-1,llm8_m3_k0,0,
2026-03-02T12:38:08.763381+00:00,B,llm_style,eval,llm_style_eval_131,64,4096,6144,bf16,NVIDIA GeForce RTX 4060,c04,64,64,64,4,3,8,0.0,0.0,503.80802154541016,543.7133038043975,6.393755824131233,3,1,-1,llm8_m3_k1,0,
2026-03-02T12:38:08.828013+00:00,B,llm_style,eval,llm_style_eval_132,16,8192,1536,bf16,NVIDIA GeForce RTX 4060,c11,32,128,32,4,2,8,0.0,0.0,167.93599724769592,242.87231996655441,2.397658575880606,2,0,-1,llm8_m2_k0,0,
2026-03-02T12:38:09.154012+00:00,B,llm_style,eval,llm_style_eval_133,32,8192,6144,bf16,NVIDIA GeForce RTX 4060,c08,128,128,64,8,4,8,0.0,0.0,1859.5839738845825,1994.2502856254578,1.7322290992167528,2,1,-1,llm8_m2_k1,0,
2026-03-02T12:38:09.470605+00:00,B,llm_style,eval,llm_style_eval_134,64,8192,6144,bf16,NVIDIA GeForce RTX 4060,c04,64,64,64,4,3,8,0.0,0.0,1084.879994392395,1211.5763056278229,5.938399617745925,3,1,-1,llm8_m3_k1,0,
2026-03-02T12:38:09.507182+00:00,B,llm_style,eval,llm_style_eval_135,4,3072,2048,bf16,NVIDIA GeForce RTX 4060,c00,32,32,32,2,2,8,0.0,0.0,109.56799983978271,218.54879841208458,0.4593644866530203,1,0,-1,llm8_m1_k0,0,
2026-03-02T12:38:09.556556+00:00,B,llm_style,eval,llm_style_eval_136,64,3072,3072,bf16,NVIDIA GeForce RTX 4060,c04,64,64,64,4,3,8,0.0,0.0,226.30399465560913,249.82752606272697,5.337773881712873,3,1,-1,llm8_m3_k1,0,
2026-03-02T12:38:09.670226+00:00,B,llm_style,eval,llm_style_eval_137,1,3072,6144,bf16,NVIDIA GeForce RTX 4060,c11,32,128,32,4,2,8,0.0,0.0,391.1519944667816,504.55777734518017,0.09650656658790423,0,1,-1,llm8_m0_k1,0,
2026-03-02T12:38:09.711424+00:00,B,llm_style,eval,llm_style_eval_138,1,2048,3072,bf16,NVIDIA GeForce RTX 4060,c11,32,128,32,4,2,8,0.0,0.0,179.63200062513351,238.9507178962229,0.07004827623257814,0,1,-1,llm8_m0_k1,0,
2026-03-02T12:38:09.856598+00:00,B,llm_style,eval,llm_style_eval_139,4,8192,3072,bf16,NVIDIA GeForce RTX 4060,c10,64,128,64,8,3,8,0.0,0.0,601.0879874229431,639.7113484144211,0.33493697464018807,1,1,-1,llm8_m1_k1,0,
2026-03-02T12:38:09.877167+00:00,B,llm_style,eval,llm_style_eval_140,64,1024,2048,bf16,NVIDIA GeForce RTX 4060,c11,32,128,32,4,2,8,0.0,0.0,148.47999811172485,277.43232816457737,1.8078896781640164,3,0,-1,llm8_m3_k0,0,
2026-03-02T12:38:10.011914+00:00,B,llm_style,eval,llm_style_eval_141,1,6144,4096,bf16,NVIDIA GeForce RTX 4060,c11,32,128,32,4,2,8,0.0,0.0,367.98399686813354,488.4889689087868,0.13677673058710826,0,1,-1,llm8_m0_k1,0,
2026-03-02T12:38:10.132441+00:00,B,llm_style,eval,llm_style_eval_142,4,4096,4096,bf16,NVIDIA GeForce RTX 4060,c10,64,128,64,8,3,8,0.0,0.0,580.5760025978088,726.2412947416306,0.23118028888455222,1,1,-1,llm8_m1_k1,0,
2026-03-02T12:38:10.184525+00:00,B,llm_style,eval,llm_style_eval_143,64,1536,6144,bf16,NVIDIA GeForce RTX 4060,c04,64,64,64,4,3,8,0.0,0.0,268.14399659633636,329.5635157823562,4.5048912798091125,3,1,-1,llm8_m3_k1,0,
2026-03-02T12:38:10.224743+00:00,B,llm_style,eval,llm_style_eval_144,1,6144,1024,bf16,NVIDIA GeForce RTX 4060,c04,64,64,64,4,3,8,0.0,0.0,168.96000504493713,265.82015693187714,0.07447272504906359,0,0,-1,llm8_m0_k0,0,
2026-03-02T12:38:10.339410+00:00,B,llm_style,eval,llm_style_eval_145,8,3072,6144,bf16,NVIDIA GeForce RTX 4060,c10,64,128,64,8,3,8,0.0,0.0,473.5039919614792,641.679353713989,0.6377768574854332,1,1,-1,llm8_m1_k1,0,
2026-03-02T12:38:10.740324+00:00,B,llm_style,eval,llm_style_eval_146,64,8192,8192,bf16,NVIDIA GeForce RTX 4060,c04,64,64,64,4,3,8,0.0,0.0,1800.704002380371,1871.9539272785187,4.7703201529206725,3,1,-1,llm8_m3_k1,0,
2026-03-02T12:38:10.810278+00:00,B,llm_style,eval,llm_style_eval_147,1,1024,8192,bf16,NVIDIA GeForce RTX 4060,c11,32,128,32,4,2,8,0.0,0.0,533.5040092468262,565.3852814435959,0.03144721634554391,0,1,-1,llm8_m0_k1,0,
2026-03-02T12:38:10.839934+00:00,B,llm_style,eval,llm_style_eval_148,32,4096,1024,bf16,NVIDIA GeForce RTX 4060,c11,32,128,32,4,2,8,0.0,0.0,87.0399996638298,175.37759676575655,3.0840470707348886,2,0,-1,llm8_m2_k0,0,
2026-03-02T12:38:10.918150+00:00,B,llm_style,eval,llm_style_eval_149,64,3072,4096,bf16,NVIDIA GeForce RTX 4060,c04,64,64,64,4,3,8,0.0,0.0,333.8240087032318,437.61471480131127,4.824736070531788,3,1,-1,llm8_m3_k1,0,
2026-03-02T12:38:11.009495+00:00,B,llm_style,eval,llm_style_eval_150,2,4096,4096,bf16,NVIDIA GeForce RTX 4060,c11,32,128,32,4,2,8,0.0,0.0,325.02399384975433,342.5356796383858,0.20647356893602675,0,1,-1,llm8_m0_k1,0,
2026-03-02T12:38:11.051067+00:00,B,llm_style,eval,llm_style_eval_151,64,2048,3072,bf16,NVIDIA GeForce RTX 4060,c04,64,64,64,4,3,8,0.0,0.0,259.5680058002472,334.97569262981415,3.102487016908126,3,1,-1,llm8_m3_k1,0,
2026-03-02T12:38:11.103487+00:00,B,llm_style,eval,llm_style_eval_152,64,1024,8192,bf16,NVIDIA GeForce RTX 4060,c04,64,64,64,4,3,8,0.0,0.0,366.4480000734329,379.8041534423828,2.9301342176375136,3,1,-1,llm8_m3_k1,0,
2026-03-02T12:38:11.134404+00:00,B,llm_style,eval,llm_style_eval_153,64,4096,1024,bf16,NVIDIA GeForce RTX 4060,c11,32,128,32,4,2,8,0.0,0.0,136.57599687576294,294.49472188949574,3.9309316738018576,3,0,-1,llm8_m3_k0,0,
2026-03-02T12:38:11.189235+00:00,B,llm_style,eval,llm_style_eval_154,64,4096,2048,bf16,NVIDIA GeForce RTX 4060,c11,32,128,32,4,2,8,0.0,0.0,283.4240049123764,349.23999845981587,3.788464651510231,3,0,-1,llm8_m3_k0,0,
2026-03-02T12:38:11.407986+00:00,B,llm_style,eval,llm_style_eval_155,8,4096,8192,bf16,NVIDIA GeForce RTX 4060,c10,64,128,64,8,3,8,0.0,0.0,1148.7679481506348,1193.5437083244324,0.4673449610639742,1,1,-1,llm8_m1_k1,0,
2026-03-02T12:38:11.521067+00:00,B,llm_style,eval,llm_style_eval_156,64,6144,2048,bf16,NVIDIA GeForce RTX 4060,c11,32,128,32,4,2,8,0.0,0.0,345.08800506591797,406.98495179414726,4.667252157003673,3,0,-1,llm8_m3_k0,0,
2026-03-02T12:38:11.753656+00:00,B,llm_style,eval,llm_style_eval_157,16,4096,6144,bf16,NVIDIA GeForce RTX 4060,c08,128,128,64,8,4,8,0.0,0.0,1744.2240118980408,1883.9859580993652,0.4616989346016837,2,1,-1,llm8_m2_k1,0,
2026-03-02T12:38:11.802598+00:00,B,llm_style,eval,llm_style_eval_158,64,2048,3072,bf16,NVIDIA GeForce RTX 4060,c04,64,64,64,4,3,8,0.0,0.0,285.47200560569763,384.36864316463465,2.8209644104729232,3,1,-1,llm8_m3_k1,0,
2026-03-02T12:38:11.828305+00:00,B,llm_style,eval,llm_style_eval_159,64,1536,2048,bf16,NVIDIA GeForce RTX 4060,c11,32,128,32,4,2,8,0.0,0.0,139.77599889039993,206.8771183490753,2.8807033195715186,3,0,-1,llm8_m3_k0,0,
2026-03-02T12:38:11.873692+00:00,B,llm_style,eval,llm_style_eval_160,16,1536,3072,bf16,NVIDIA GeForce RTX 4060,c08,128,128,64,8,4,8,0.0,0.0,447.29600846767426,503.3471876382828,0.33757275079934523,2,1,-1,llm8_m2_k1,0,
2026-03-02T12:38:11.891424+00:00,B,llm_style,eval,llm_style_eval_161,64,1536,1024,bf16,NVIDIA GeForce RTX 4060,c11,32,128,32,4,2,8,0.0,0.0,96.76800295710564,170.06591796875,2.0805078729302915,3,0,-1,llm8_m3_k0,0,
2026-03-02T12:38:11.925097+00:00,B,llm_style,eval,llm_style_eval_162,64,6144,1024,bf16,NVIDIA GeForce RTX 4060,c11,32,128,32,4,2,8,0.0,0.0,149.50400590896606,239.75967437028862,5.386520335049458,3,0,-1,llm8_m3_k0,0,
2026-03-02T12:38:11.966266+00:00,B,llm_style,eval,llm_style_eval_163,32,6144,1536,bf16,NVIDIA GeForce RTX 4060,c11,32,128,32,4,2,8,0.0,0.0,109.56799983978271,118.28224278986454,5.512373839836243,2,0,-1,llm8_m2_k0,0,
2026-03-02T12:38:12.074069+00:00,B,llm_style,eval,llm_style_eval_164,16,1536,8192,bf16,NVIDIA GeForce RTX 4060,c08,128,128,64,8,4,8,0.0,0.0,875.5199909210205,948.7497526407242,0.45990175915506054,2,1,-1,llm8_m2_k1,0,
2026-03-02T12:38:12.167636+00:00,B,llm_style,eval,llm_style_eval_165,8,1536,8192,bf16,NVIDIA GeForce RTX 4060,c10,64,128,64,8,3,8,0.0,0.0,467.45599806308746,546.2182384729384,0.43068565348225385,1,1,-1,llm8_m1_k1,0,
2026-03-02T12:38:12.207729+00:00,B,llm_style,eval,llm_style_eval_166,2,1024,6144,bf16,NVIDIA GeForce RTX 4060,c11,32,128,32,4,2,8,0.0,0.0,304.52799797058105,406.13888293504704,0.08263878581840986,0,1,-1,llm8_m0_k1,0,
2026-03-02T12:38:12.281187+00:00,B,llm_style,eval,llm_style_eval_167,64,4096,3072,bf16,NVIDIA GeForce RTX 4060,c04,64,64,64,4,3,8,0.0,0.0,274.31999146938324,355.9097608923911,5.871291871120373,3,1,-1,llm8_m3_k1,0,
2026-03-02T12:38:12.433680+00:00,B,llm_style,eval,llm_style_eval_168,64,8192,3072,bf16,NVIDIA GeForce RTX 4060,c04,64,64,64,4,3,8,0.0,0.0,529.3279886245728,554.0838551521301,6.085499994757811,3,1,-1,llm8_m3_k1,0,
2026-03-02T12:38:12.475229+00:00,B,llm_style,eval,llm_style_eval_169,2,1024,6144,bf16,NVIDIA GeForce RTX 4060,c11,32,128,32,4,2,8,0.0,0.0,330.7519853115082,353.88415664434433,0.07608669068546445,0,1,-1,llm8_m0_k1,0,
2026-03-02T12:38:12.603879+00:00,B,llm_style,eval,llm_style_eval_170,16,2048,8192,bf16,NVIDIA GeForce RTX 4060,c08,128,128,64,8,4,8,0.0,0.0,879.1040182113647,918.7983870506287,0.6107023752346438,2,1,-1,llm8_m2_k1,0,
2026-03-02T12:38:12.634951+00:00,B,llm_style,eval,llm_style_eval_171,2,4096,1536,bf16,NVIDIA GeForce RTX 4060,c04,64,64,64,4,3,8,0.0,0.0,154.62400019168854,240.00993028283114,0.16275496668564865,0,0,-1,llm8_m0_k0,0,
2026-03-02T12:38:12.646196+00:00,B,llm_style,eval,llm_style_eval_172,1,1536,1024,bf16,NVIDIA GeForce RTX 4060,c04,64,64,64,4,3,8,0.0,0.0,42.768001556396484,111.82079680263992,0.07355330820992073,0,0,-1,llm8_m0_k0,0,
2026-03-02T12:38:12.694055+00:00,B,llm_style,eval,llm_style_eval_173,32,1536,4096,bf16,NVIDIA GeForce RTX 4060,c08,128,128,64,8,4,8,0.0,0.0,454.0479928255081,484.55680757760996,0.8868075409701034,2,1,-1,llm8_m2_k1,0,
2026-03-02T12:38:12.726202+00:00,B,llm_style,eval,llm_style_eval_174,64,2048,3072,bf16,NVIDIA GeForce RTX 4060,c04,64,64,64,4,3,8,0.0,0.0,176.12800002098083,189.96224105358124,4.57227906922278,3,1,-1,llm8_m3_k1,0,
2026-03-02T12:38:12.742900+00:00,B,llm_style,eval,llm_style_eval_175,2,3072,1024,bf16,NVIDIA GeForce RTX 4060,c04,64,64,64,4,3,8,0.0,0.0,83.45599845051765,212.97151729464514,0.15077300893429013,0,0,-1,llm8_m0_k0,0,
2026-03-02T12:38:12.942236+00:00,B,llm_style,eval,llm_style_eval_176,64,6144,6144,bf16,NVIDIA GeForce RTX 4060,c04,64,64,64,4,3,8,0.0,0.0,582.6560258865356,611.635205745697,8.29277994790864,3,1,-1,llm8_m3_k1,0,
2026-03-02T12:38:13.083388+00:00,B,llm_style,eval,llm_style_eval_177,2,6144,4096,bf16,NVIDIA GeForce RTX 4060,c11,32,128,32,4,2,8,0.0,0.0,366.36799573898315,435.92703491449356,0.2747600695769207,0,1,-1,llm8_m0_k1,0,
2026-03-02T12:38:13.125857+00:00,B,llm_style,eval,llm_style_eval_178,64,4096,2048,bf16,NVIDIA GeForce RTX 4060,c11,32,128,32,4,2,8,0.0,0.0,187.9040002822876,300.410872995853,5.7143106181184065,3,0,-1,llm8_m3_k0,0,
2026-03-02T12:38:13.197598+00:00,B,llm_style,eval,llm_style_eval_179,16,6144,2048,bf16,NVIDIA GeForce RTX 4060,c11,32,128,32,4,2,8,0.0,0.0,157.6320007443428,271.5983977913856,2.554387320459426,2,0,-1,llm8_m2_k0,0,
2026-03-02T12:38:13.230396+00:00,B,llm_style,eval,llm_style_eval_180,1,3072,2048,bf16,NVIDIA GeForce RTX 4060,c04,64,64,64,4,3,8,0.0,0.0,129.02399897575378,250.71296542882908,0.0975238102979941,0,0,-1,llm8_m0_k0,0,
2026-03-02T12:38:13.388834+00:00,B,llm_style,eval,llm_style_eval_181,32,3072,8192,bf16,NVIDIA GeForce RTX 4060,c08,128,128,64,8,4,8,0.0,0.0,763.9039754867554,819.4048088788986,2.108396850499078,2,1,-1,llm8_m2_k1,0,
2026-03-02T12:38:13.435063+00:00,B,llm_style,eval,llm_style_eval_182,64,1024,8192,bf16,NVIDIA GeForce RTX 4060,c04,64,64,64,4,3,8,0.0,0.0,242.5280064344406,299.2582282423972,4.427290026359287,3,1,-1,llm8_m3_k1,0,
2026-03-02T12:38:13.473472+00:00,B,llm_style,eval,llm_style_eval_183,32,4096,1536,bf16,NVIDIA GeForce RTX 4060,c11,32,128,32,4,2,8,0.0,0.0,107.39199817180634,169.6255940198898,3.749377894578636,2,0,-1,llm8_m2_k0,0,
2026-03-02T12:38:13.504481+00:00,B,llm_style,eval,llm_style_eval_184,2,2048,3072,bf16,NVIDIA GeForce RTX 4060,c11,32,128,32,4,2,8,0.0,0.0,150.30400454998016,205.09695842862112,0.167432824397115,0,1,-1,llm8_m0_k1,0,
2026-03-02T12:38:13.519752+00:00,B,llm_style,eval,llm_style_eval_185,64,1536,1536,bf16,NVIDIA GeForce RTX 4060,c11,32,128,32,4,2,8,0.0,0.0,95.18400207161903,123.39040368795392,3.1726958462281782,3,0,-1,llm8_m3_k0,0,
2026-03-02T12:38:13.558830+00:00,B,llm_style,eval,llm_style_eval_186,64,8192,1024,bf16,NVIDIA GeForce RTX 4060,c11,32,128,32,4,2,8,0.0,0.0,172.03199863433838,223.51392686367035,6.241523859071624,3,0,-1,llm8_m3_k0,0,
2026-03-02T12:38:13.606459+00:00,B,llm_style,eval,llm_style_eval_187,4,8192,1024,bf16,NVIDIA GeForce RTX 4060,c00,32,32,32,2,2,8,0.0,0.0,82.94399827718735,242.46271982789023,0.8090864365584532,1,0,-1,llm8_m1_k0,0,
2026-03-02T12:38:13.635203+00:00,B,llm_style,eval,llm_style_eval_188,32,6144,1024,bf16,NVIDIA GeForce RTX 4060,c11,32,128,32,4,2,8,0.0,0.0,74.75200295448303,147.49696522951126,5.386520335049458,2,0,-1,llm8_m2_k0,0,
2026-03-02T12:38:13.644091+00:00,B,llm_style,eval,llm_style_eval_189,4,1024,1024,bf16,NVIDIA GeForce RTX 4060,c00,32,32,32,2,2,8,0.0,0.0,51.19999870657921,66.55232105404136,0.16384000413894662,1,0,-1,llm8_m1_k0,0,
2026-03-02T12:38:13.664429+00:00,B,llm_style,eval,llm_style_eval_190,16,2048,2048,bf16,NVIDIA GeForce RTX 4060,c11,32,128,32,4,2,8,0.0,0.0,107.51999914646149,126.88639730215073,1.2483047718143248,2,0,-1,llm8_m2_k0,0,
2026-03-02T12:38:13.679397+00:00,B,llm_style,eval,llm_style_eval_191,4,2048,1536,bf16,NVIDIA GeForce RTX 4060,c00,32,32,32,2,2,8,0.0,0.0,74.60800185799599,115.95776200294489,0.33730730448858537,1,0,-1,llm8_m1_k0,0,
2026-03-02T12:38:13.719239+00:00,B,llm_style,eval,llm_style_eval_192,64,8192,1024,bf16,NVIDIA GeForce RTX 4060,c11,32,128,32,4,2,8,0.0,0.0,169.47200149297714,177.49919921159744,6.335806590709884,3,0,-1,llm8_m3_k0,0,
2026-03-02T12:38:14.112858+00:00,B,llm_style,eval,llm_style_eval_193,4,8192,8192,bf16,NVIDIA GeForce RTX 4060,c10,64,128,64,8,3,8,0.0,0.0,1102.8480529785156,1197.4348723888395,0.4868040620374189,1,1,-1,llm8_m1_k1,0,
2026-03-02T12:38:14.125445+00:00,B,llm_style,eval,llm_style_eval_194,64,1024,1024,bf16,NVIDIA GeForce RTX 4060,c11,32,128,32,4,2,8,0.0,0.0,70.14400139451027,188.12927633523927,1.9134598159737204,3,0,-1,llm8_m3_k0,0,
2026-03-02T12:38:14.160562+00:00,B,llm_style,eval,llm_style_eval_195,32,4096,1536,bf16,NVIDIA GeForce RTX 4060,c11,32,128,32,4,2,8,0.0,0.0,98.76800328493118,189.38144013285637,4.076757356716068,2,0,-1,llm8_m2_k0,0,
2026-03-02T12:38:14.179789+00:00,B,llm_style,eval,llm_style_eval_196,8,4096,1024,bf16,NVIDIA GeForce RTX 4060,c00,32,32,32,2,2,8,0.0,0.0,72.54400104284286,152.74943932890886,0.9250780634551298,1,0,-1,llm8_m1_k0,0,
2026-03-02T12:38:14.246817+00:00,B,llm_style,eval,llm_style_eval_197,2,6144,2048,bf16,NVIDIA GeForce RTX 4060,c04,64,64,64,4,3,8,0.0,0.0,214.00000154972076,232.34752297401428,0.2351946151192244,0,0,-1,llm8_m0_k0,0,
2026-03-02T12:38:14.315453+00:00,B,llm_style,eval,llm_style_eval_198,32,1536,6144,bf16,NVIDIA GeForce RTX 4060,c08,128,128,64,8,4,8,0.0,0.0,581.6320180892944,609.9894148111343,1.038422502915365,2,1,-1,llm8_m2_k1,0,
2026-03-02T12:38:14.347426+00:00,B,llm_style,eval,llm_style_eval_199,32,3072,1536,bf16,NVIDIA GeForce RTX 4060,c11,32,128,32,4,2,8,0.0,0.0,92.0960009098053,105.47231785953042,3.2790771045070177,2,0,-1,llm8_m2_k0,0,
2026-03-02T12:38:14.383560+00:00,B,llm_style,eval,llm_style_eval_200,64,2048,3072,bf16,NVIDIA GeForce RTX 4060,c04,64,64,64,4,3,8,0.0,0.0,172.03199863433838,209.74816277623165,4.681142894303718,3,1,-1,llm8_m3_k1,0,
2026-03-02T12:38:14.451658+00:00,B,llm_style,eval,llm_style_eval_201,4,6144,2048,bf16,NVIDIA GeForce RTX 4060,c00,32,32,32,2,2,8,0.0,0.0,166.28799587488174,451.0003110766403,0.6053551579017225,1,0,-1,llm8_m1_k0,0,
2026-03-02T12:38:14.483114+00:00,B,llm_style,eval,llm_style_eval_202,4,6144,1024,bf16,NVIDIA GeForce RTX 4060,c00,32,32,32,2,2,8,0.0,0.0,85.4399986565113,204.36992198228825,0.5890876497124602,1,0,-1,llm8_m1_k0,0,
2026-03-02T12:38:14.736864+00:00,B,llm_style,eval,llm_style_eval_203,1,6144,8192,bf16,NVIDIA GeForce RTX 4060,c11,32,128,32,4,2,8,0.0,0.0,699.3920207023621,728.0627351999283,0.1439297175551263,0,1,-1,llm8_m0_k1,0,
2026-03-02T12:38:14.773862+00:00,B,llm_style,eval,llm_style_eval_204,1,2048,3072,bf16,NVIDIA GeForce RTX 4060,c11,32,128,32,4,2,8,0.0,0.0,189.80799615383148,238.15168246626854,0.06629284463759932,0,1,-1,llm8_m0_k1,0,
2026-03-02T12:38:14.819084+00:00,B,llm_style,eval,llm_style_eval_205,2,6144,1536,bf16,NVIDIA GeForce RTX 4060,c04,64,64,64,4,3,8,0.0,0.0,221.91999852657318,339.4275113940238,0.17010065001185498,0,0,-1,llm8_m0_k0,0,
2026-03-02T12:38:14.830925+00:00,B,llm_style,eval,llm_style_eval_206,16,1024,1024,bf16,NVIDIA GeForce RTX 4060,c11,32,128,32,4,2,8,0.0,0.0,84.99199897050858,123.24895627796641,0.3947951855049682,2,0,-1,llm8_m2_k0,0,
2026-03-02T12:38:14.911022+00:00,B,llm_style,eval,llm_style_eval_207,64,6144,2048,bf16,NVIDIA GeForce RTX 4060,c11,32,128,32,4,2,8,0.0,0.0,305.1519989967346,373.6063960194587,5.278067131446958,3,0,-1,llm8_m3_k0,0,
2026-03-02T12:38:15.070184+00:00,B,llm_style,eval,llm_style_eval_208,4,4096,6144,bf16,NVIDIA GeForce RTX 4060,c10,64,128,64,8,3,8,0.0,0.0,780.2879810333252,896.6246420145035,0.25801575430315593,1,1,-1,llm8_m1_k1,0,
2026-03-02T12:38:15.331454+00:00,B,llm_style,eval,llm_style_eval_209,32,6144,6144,bf16,NVIDIA GeForce RTX 4060,c08,128,128,64,8,4,8,0.0,0.0,1552.3840188980103,1638.5945737361908,1.5562638332975025,2,1,-1,llm8_m2_k1,0,
2026-03-02T12:38:15.355758+00:00,B,llm_style,eval,llm_style_eval_210,64,2048,1024,bf16,NVIDIA GeForce RTX 4060,c11,32,128,32,4,2,8,0.0,0.0,93.6960019171238,299.5712004601953,2.864961690013595,3,0,-1,llm8_m3_k0,0,
2026-03-02T12:38:15.383475+00:00,B,llm_style,eval,llm_style_eval_211,4,1024,3072,bf16,NVIDIA GeForce RTX 4060,c10,64,128,64,8,3,8,0.0,0.0,235.52000522613525,309.2889600992203,0.10685217154201808,1,1,-1,llm8_m1_k1,0,
2026-03-02T12:38:15.617396+00:00,B,llm_style,eval,llm_style_eval_212,64,6144,6144,bf16,NVIDIA GeForce RTX 4060,c04,64,64,64,4,3,8,0.0,0.0,832.4960172176361,882.5753718614577,5.804037626689128,3,1,-1,llm8_m3_k1,0,
2026-03-02T12:38:15.632705+00:00,B,llm_style,eval,llm_style_eval_213,4,1024,2048,bf16,NVIDIA GeForce RTX 4060,c00,32,32,32,2,2,8,0.0,0.0,100.3359965980053,146.57536491751665,0.16721033894961615,1,0,-1,llm8_m1_k0,0,
2026-03-02T12:38:15.897953+00:00,B,llm_style,eval,llm_style_eval_214,32,6144,6144,bf16,NVIDIA GeForce RTX 4060,c08,128,128,64,8,4,8,0.0,0.0,1677.1519780158997,1799.8732590675354,1.4404890765224956,2,1,-1,llm8_m2_k1,0,
2026-03-02T12:38:15.947267+00:00,B,llm_style,eval,llm_style_eval_215,16,2048,3072,bf16,NVIDIA GeForce RTX 4060,c08,128,128,64,8,4,8,0.0,0.0,351.74399614334106,419.14783656597126,0.5723668185027282,2,1,-1,llm8_m2_k1,0,
2026-03-02T12:38:15.966105+00:00,B,llm_style,eval,llm_style_eval_216,2,1536,2048,bf16,NVIDIA GeForce RTX 4060,c04,64,64,64,4,3,8,0.0,0.0,95.23200243711472,199.34208407998082,0.1321290288767053,0,0,-1,llm8_m0_k0,0,
2026-03-02T12:38:16.112122+00:00,B,llm_style,eval,llm_style_eval_217,64,8192,3072,bf16,NVIDIA GeForce RTX 4060,c04,64,64,64,4,3,8,0.0,0.0,505.2480101585388,627.1353584527969,6.375533217813624,3,1,-1,llm8_m3_k1,0,
2026-03-02T12:38:16.191619+00:00,B,llm_style,eval,llm_style_eval_218,64,4096,3072,bf16,NVIDIA GeForce RTX 4060,c04,64,64,64,4,3,8,0.0,0.0,280.5119901895523,405.5046346783638,5.741689454741843,3,1,-1,llm8_m3_k1,0,
2026-03-02T12:38:16.221534+00:00,B,llm_style,eval,llm_style_eval_219,64,1536,3072,bf16,NVIDIA GeForce RTX 4060,c04,64,64,64,4,3,8,0.0,0.0,123.90399724245071,216.74752160906786,4.874578620883028,3,1,-1,llm8_m3_k1,0,
2026-03-02T12:38:16.419388+00:00,B,llm_style,eval,llm_style_eval_220,1,6144,6144,bf16,NVIDIA GeForce RTX 4060,c11,32,128,32,4,2,8,0.0,0.0,527.3600220680237,692.776955962181,0.14316115905779003,0,1,-1,llm8_m0_k1,0,
2026-03-02T12:38:16.615279+00:00,B,llm_style,eval,llm_style_eval_221,8,4096,8192,bf16,NVIDIA GeForce RTX 4060,c10,64,128,64,8,3,8,0.0,0.0,868.1119978427887,976.8368130922318,0.6184350790382982,1,1,-1,llm8_m1_k1,0,
2026-03-02T12:38:16.991446+00:00,B,llm_style,eval,llm_style_eval_222,8,8192,8192,bf16,NVIDIA GeForce RTX 4060,c10,64,128,64,8,3,8,0.0,0.0,1272.8320360183716,1393.3260774612427,0.8435848514300767,1,1,-1,llm8_m1_k1,0,
2026-03-02T12:38:17.029244+00:00,B,llm_style,eval,llm_style_eval_223,1,4096,1536,bf16,NVIDIA GeForce RTX 4060,c04,64,64,64,4,3,8,0.0,0.0,155.64799308776855,269.94496554136276,0.08084210885330595,0,0,-1,llm8_m0_k0,0,
2026-03-02T12:38:17.074605+00:00,B,llm_style,eval,llm_style_eval_224,4,3072,3072,bf16,NVIDIA GeForce RTX 4060,c10,64,128,64,8,3,8,0.0,0.0,196.60800695419312,259.0611329674721,0.38399998641759203,1,1,-1,llm8_m1_k1,0,
2026-03-02T12:38:17.168331+00:00,B,llm_style,eval,llm_style_eval_225,64,8192,2048,bf16,NVIDIA GeForce RTX 4060,c11,32,128,32,4,2,8,0.0,0.0,333.8240087032318,376.1152005195617,6.432981427375718,3,0,-1,llm8_m3_k0,0,
2026-03-02T12:38:17.201539+00:00,B,llm_style,eval,llm_style_eval_226,4,4096,1536,bf16,NVIDIA GeForce RTX 4060,c00,32,32,32,2,2,8,0.0,0.0,80.89599758386612,135.8233573287724,0.6221772337725413,1,0,-1,llm8_m1_k0,0,
2026-03-02T12:38:17.274599+00:00,B,llm_style,eval,llm_style_eval_227,16,8192,1536,bf16,NVIDIA GeForce RTX 4060,c11,32,128,32,4,2,8,0.0,0.0,121.85600027441978,372.76672303676594,3.3043361270124145,2,0,-1,llm8_m2_k0,0,
2026-03-02T12:38:17.327371+00:00,B,llm_style,eval,llm_style_eval_228,16,2048,4096,bf16,NVIDIA GeForce RTX 4060,c08,128,128,64,8,4,8,0.0,0.0,363.5199964046478,437.9955223202703,0.738433810120295,2,1,-1,llm8_m2_k1,0,
2026-03-02T12:38:17.339768+00:00,B,llm_style,eval,llm_style_eval_229,8,1536,1024,bf16,NVIDIA GeForce RTX 4060,c00,32,32,32,2,2,8,0.0,0.0,54.27199974656105,99.9219200760125,0.4636981153729209,1,0,-1,llm8_m1_k0,0,
2026-03-02T12:38:17.473308+00:00,B,llm_style,eval,llm_style_eval_230,64,4096,6144,bf16,NVIDIA GeForce RTX 4060,c04,64,64,64,4,3,8,0.0,0.0,410.5439931154251,478.00321251153935,7.846237007526614,3,1,-1,llm8_m3_k1,0,
2026-03-02T12:38:17.525959+00:00,B,llm_style,eval,llm_style_eval_231,64,4096,2048,bf16,NVIDIA GeForce RTX 4060,c11,32,128,32,4,2,8,0.0,0.0,173.0560064315796,222.98016086220736,6.204591485384361,3,0,-1,llm8_m3_k0,0,
2026-03-02T12:38:17.606334+00:00,B,llm_style,eval,llm_style_eval_232,16,3072,4096,bf16,NVIDIA GeForce RTX 4060,c08,128,128,64,8,4,8,0.0,0.0,374.64000284671783,468.4492781758306,1.0747735984956834,2,1,-1,llm8_m2_k1,0,
2026-03-02T12:38:17.688739+00:00,B,llm_style,eval,llm_style_eval_233,64,8192,1536,bf16,NVIDIA GeForce RTX 4060,c11,32,128,32,4,2,8,0.0,0.0,231.87199980020523,245.17664045095444,6.946128628673579,3,0,-1,llm8_m3_k0,0,
2026-03-02T12:38:17.712749+00:00,B,llm_style,eval,llm_style_eval_234,64,1024,4096,bf16,NVIDIA GeForce RTX 4060,c04,64,64,64,4,3,8,0.0,0.0,122.78399989008904,172.0524860918522,4.372482672665688,3,1,-1,llm8_m3_k1,0,
2026-03-02T12:38:17.729619+00:00,B,llm_style,eval,llm_style_eval_235,64,3072,1024,bf16,NVIDIA GeForce RTX 4060,c11,32,128,32,4,2,8,0.0,0.0,68.60800087451935,124.10879716277118,5.868895447579545,3,0,-1,llm8_m3_k0,0,
2026-03-02T12:38:17.849707+00:00,B,llm_style,eval,llm_style_eval_236,32,3072,6144,bf16,NVIDIA GeForce RTX 4060,c08,128,128,64,8,4,8,0.0,0.0,533.5040092468262,660.999675989151,2.2641995768791614,2,1,-1,llm8_m2_k1,0,
2026-03-02T12:38:18.124945+00:00,B,llm_style,eval,llm_style_eval_237,2,8192,6144,bf16,NVIDIA GeForce RTX 4060,c11,32,128,32,4,2,8,0.0,0.0,693.615972995758,720.4147219657898,0.29025656824259904,0,1,-1,llm8_m0_k1,0,
2026-03-02T12:38:18.176681+00:00,B,llm_style,eval,llm_style_eval_238,4,2048,4096,bf16,NVIDIA GeForce RTX 4060,c10,64,128,64,8,3,8,0.0,0.0,192.51199811697006,343.6236733198166,0.34859574809059296,1,1,-1,llm8_m1_k1,0,
2026-03-02T12:38:18.225036+00:00,B,llm_style,eval,llm_style_eval_239,4,8192,1024,bf16,NVIDIA GeForce RTX 4060,c00,32,32,32,2,2,8,0.0,0.0,95.23200243711472,135.39327733218664,0.704688154009095,1,0,-1,llm8_m1_k0,0,
2026-03-02T12:38:18.255937+00:00,B,llm_style,eval,llm_style_eval_240,2,1024,4096,bf16,NVIDIA GeForce RTX 4060,c11,32,128,32,4,2,8,0.0,0.0,176.54400318861008,262.08255901932694,0.09503135590550833,0,1,-1,llm8_m0_k1,0,
2026-03-02T12:38:18.286765+00:00,B,llm_style,eval,llm_style_eval_241,8,3072,2048,bf16,NVIDIA GeForce RTX 4060,c00,32,32,32,2,2,8,0.0,0.0,82.92799815535545,165.51776304841036,1.2138638124535412,1,0,-1,llm8_m1_k0,0,
2026-03-02T12:38:18.461232+00:00,B,llm_style,eval,llm_style_eval_242,32,4096,6144,bf16,NVIDIA GeForce RTX 4060,c08,128,128,64,8,4,8,0.0,0.0,998.4000027179718,1111.9615960121155,1.613193841762204,2,1,-1,llm8_m2_k1,0,
2026-03-02T12:38:18.486433+00:00,B,llm_style,eval,llm_style_eval_243,64,2048,2048,bf16,NVIDIA GeForce RTX 4060,c11,32,128,32,4,2,8,0.0,0.0,105.43999820947647,210.13503588736023,5.091719661578565,3,0,-1,llm8_m3_k0,0,
2026-03-02T12:38:18.501416+00:00,B,llm_style,eval,llm_style_eval_244,8,2048,1536,bf16,NVIDIA GeForce RTX 4060,c00,32,32,32,2,2,8,0.0,0.0,68.9920000731945,96.89855828881258,0.7295287561833618,1,0,-1,llm8_m1_k0,0,
2026-03-02T12:38:18.536082+00:00,B,llm_style,eval,llm_style_eval_245,1,1024,6144,bf16,NVIDIA GeForce RTX 4060,c11,32,128,32,4,2,8,0.0,0.0,236.54399812221527,297.9840040206909,0.0531948056170877,0,1,-1,llm8_m0_k1,0,
2026-03-02T12:38:18.547158+00:00,B,llm_style,eval,llm_style_eval_246,2,1536,1024,bf16,NVIDIA GeForce RTX 4060,c04,64,64,64,4,3,8,0.0,0.0,53.247999399900436,242.6675270497795,0.11815384748542804,0,0,-1,llm8_m0_k0,0,
2026-03-02T12:38:18.626109+00:00,B,llm_style,eval,llm_style_eval_247,64,2048,6144,bf16,NVIDIA GeForce RTX 4060,c04,64,64,64,4,3,8,0.0,0.0,291.82399809360504,337.66400635242456,5.519123672218973,3,1,-1,llm8_m3_k1,0,
2026-03-02T12:38:18.640298+00:00,B,llm_style,eval,llm_style_eval_248,64,1536,1024,bf16,NVIDIA GeForce RTX 4060,c11,32,128,32,4,2,8,0.0,0.0,64.35199826955795,97.49727904796595,3.128521217891047,3,0,-1,llm8_m3_k0,0,
2026-03-02T12:38:18.658753+00:00,B,llm_style,eval,llm_style_eval_249,8,2048,1536,bf16,NVIDIA GeForce RTX 4060,c00,32,32,32,2,2,8,0.0,0.0,69.63200122117996,160.88576138019556,0.7228235167351563,1,0,-1,llm8_m1_k0,0,
2026-03-02T12:38:18.699416+00:00,B,llm_style,eval,llm_style_eval_250,32,6144,1536,bf16,NVIDIA GeForce RTX 4060,c11,32,128,32,4,2,8,0.0,0.0,96.25600278377533,111.21664039790627,6.274723222786946,2,0,-1,llm8_m2_k0,0,
2026-03-02T12:38:18.750374+00:00,B,llm_style,eval,llm_style_eval_251,64,8192,1024,bf16,NVIDIA GeForce RTX 4060,c11,32,128,32,4,2,8,0.0,0.0,161.23200207948685,248.21759432554236,6.659607336951933,3,0,-1,llm8_m3_k0,0,
2026-03-02T12:38:18.781413+00:00,B,llm_style,eval,llm_style_eval_252,1,3072,2048,bf16,NVIDIA GeForce RTX 4060,c04,64,64,64,4,3,8,0.0,0.0,113.66400122642517,168.78592103719706,0.1107027015082297,0,0,-1,llm8_m0_k0,0,
2026-03-02T12:38:18.798994+00:00,B,llm_style,eval,llm_style_eval_253,8,3072,1024,bf16,NVIDIA GeForce RTX 4060,c00,32,32,32,2,2,8,0.0,0.0,53.247999399900436,65.47327935695648,0.9452307798834243,1,0,-1,llm8_m1_k0,0,
2026-03-02T12:38:18.812084+00:00,B,llm_style,eval,llm_style_eval_254,2,1024,1536,bf16,NVIDIA GeForce RTX 4060,c04,64,64,64,4,3,8,0.0,0.0,72.7040022611618,175.66431686282147,0.08653520857628043,0,0,-1,llm8_m0_k0,0,
2026-03-02T12:38:18.907236+00:00,B,llm_style,eval,llm_style_eval_255,64,4096,4096,bf16,NVIDIA GeForce RTX 4060,c04,64,64,64,4,3,8,0.0,0.0,334.25600826740265,456.88832551240915,6.424667305552297,3,1,-1,llm8_m3_k1,0,
