results/phase2_b_compare.csv
timestamp,method,workload,split,shape_id,M,N,K,dtype,gpu,config_id,BLOCK_M,BLOCK_N,BLOCK_K,num_warps,num_stages,GROUP_M,compile_time_ms,tune_time_ms,runtime_cost_us,p99_us,runtime_perf_tflops,bucket_m,bucket_n,bucket_k,cache_key,invalid_config,notes
2026-03-02T09:22:01.001119+00:00,B,uniform,tune,uniform_tune_000,1536,512,1024,bf16,NVIDIA GeForce RTX 4060,c06,64,128,32,4,3,8,184.38213702756912,2733.078,85.35999804735184,149.329914599657,18.868472034248914,3,2,3,3_2_3,0,
2026-03-02T09:22:01.339334+00:00,B,uniform,tune,uniform_tune_001,1536,1536,2048,bf16,NVIDIA GeForce RTX 4060,c06,64,128,32,4,3,8,0.0,338.173,315.7599866390228,383.4355190396309,30.604499698840957,3,3,3,3_3_3,0,
2026-03-02T09:22:01.482090+00:00,B,uniform,tune,uniform_tune_002,384,2048,1536,bf16,NVIDIA GeForce RTX 4060,c10,64,128,64,8,3,8,0.0,142.712,105.98399862647057,150.24544030427933,22.795130730202512,2,3,3,2_3_3,0,
2026-03-02T09:22:01.586646+00:00,B,uniform,tune,uniform_tune_003,1536,64,3072,bf16,NVIDIA GeForce RTX 4060,c04,64,64,64,4,3,8,0.0,104.505,52.1440003067255,58.245759904384606,11.58291984595012,3,1,3,3_1_3,0,
2026-03-02T09:22:01.605254+00:00,B,uniform,tune,uniform_tune_004,768,128,2048,bf16,NVIDIA GeForce RTX 4060,c04,64,64,64,4,3,8,0.0,0.0,63.9679990708828,151.05791777372346,6.294603393078169,3,1,3,3_1_3,0,
2026-03-02T09:22:01.693179+00:00,B,uniform,tune,uniform_tune_005,512,128,4096,bf16,NVIDIA GeForce RTX 4060,c04,64,64,64,4,3,8,0.0,87.881,60.14399975538254,105.59007860720155,8.92642514936751,2,1,3,2_1_3,0,
2026-03-02T09:22:01.791149+00:00,B,uniform,tune,uniform_tune_006,2048,1024,4096,bf16,NVIDIA GeForce RTX 4060,c06,64,128,32,4,3,8,0.0,0.0,575.3919780254364,692.3161524534224,29.857679356177133,3,3,3,3_3_3,0,
2026-03-02T09:22:01.865757+00:00,B,uniform,tune,uniform_tune_007,128,768,512,bf16,NVIDIA GeForce RTX 4060,c11,32,128,32,4,2,8,0.0,74.555,47.071998938918114,214.4076785445211,2.138496309252203,1,3,2,1_3_2,0,
2026-03-02T09:22:01.933341+00:00,B,uniform,tune,uniform_tune_008,2048,256,64,bf16,NVIDIA GeForce RTX 4060,c04,64,64,64,4,3,8,0.0,67.55,32.76799991726875,46.60224087536335,2.048000005170703,3,2,1,3_2_1,0,
2026-03-02T09:22:01.948745+00:00,B,uniform,tune,uniform_tune_009,192,768,2048,bf16,NVIDIA GeForce RTX 4060,c10,64,128,64,8,3,8,0.0,0.0,76.80000364780426,172.49503985047323,7.864319626464861,2,3,3,2_3_3,0,
2026-03-02T09:22:01.973035+00:00,B,uniform,tune,uniform_tune_010,1024,1024,1536,bf16,NVIDIA GeForce RTX 4060,c06,64,128,32,4,3,8,0.0,0.0,144.3839967250824,239.13695782423014,22.31012816561275,3,3,3,3_3_3,0,
2026-03-02T09:22:02.029581+00:00,B,uniform,tune,uniform_tune_011,256,384,768,bf16,NVIDIA GeForce RTX 4060,c00,32,32,32,2,2,8,0.0,56.512,39.93599861860275,54.75519970059395,3.780923207706253,2,2,3,2_2_3,0,
2026-03-02T09:22:02.088110+00:00,B,uniform,tune,uniform_tune_012,64,192,2048,bf16,NVIDIA GeForce RTX 4060,c00,32,32,32,2,2,8,0.0,58.497,45.05600035190582,78.1433609873056,1.1170909003659715,1,2,3,1_2_3,0,
2026-03-02T09:22:02.134193+00:00,B,uniform,tune,uniform_tune_013,192,128,512,bf16,NVIDIA GeForce RTX 4060,c01,64,32,32,2,2,8,0.0,46.054,34.49600003659725,40.95999896526337,0.7295287561833618,2,1,2,2_1_2,0,
2026-03-02T09:22:02.198369+00:00,B,uniform,tune,uniform_tune_014,128,128,1024,bf16,NVIDIA GeForce RTX 4060,c04,64,64,64,4,3,8,0.0,64.143,39.93599861860275,51.5433594211936,0.8402051572680562,1,1,3,1_1_3,0,
2026-03-02T09:22:02.242311+00:00,B,uniform,tune,uniform_tune_015,3072,3072,768,bf16,NVIDIA GeForce RTX 4060,c06,64,128,32,4,3,8,0.0,0.0,456.12800121307373,594.227192401886,31.779488620407292,3,3,3,3_3_3,0,
2026-03-02T09:22:02.254361+00:00,B,uniform,tune,uniform_tune_016,256,128,3072,bf16,NVIDIA GeForce RTX 4060,c04,64,64,64,4,3,8,0.0,0.0,51.19999870657921,102.93855980038629,3.932160099334719,2,1,3,2_1_3,0,
2026-03-02T09:22:02.259212+00:00,B,uniform,tune,uniform_tune_017,96,1024,192,bf16,NVIDIA GeForce RTX 4060,c11,32,128,32,4,2,8,0.0,0.0,34.88000109791756,47.61760033667085,1.082245837493787,1,3,2,1_3_2,0,
2026-03-02T09:22:02.298437+00:00,B,uniform,tune,uniform_tune_018,64,64,192,bf16,NVIDIA GeForce RTX 4060,c02,32,64,32,2,2,8,0.0,39.205,29.743999242782593,115.45951910316941,0.052880044380099855,1,1,2,1_1_2,0,
2026-03-02T09:22:02.339237+00:00,B,uniform,tune,uniform_tune_019,4096,64,64,bf16,NVIDIA GeForce RTX 4060,c03,64,64,32,4,2,8,0.0,40.779,28.975999914109707,39.336640834808335,1.1580077339681678,3,1,1,3_1_1,0,
2026-03-02T09:22:02.539542+00:00,B,uniform,tune,uniform_tune_020,128,4096,3072,bf16,NVIDIA GeForce RTX 4060,c06,64,128,32,4,3,8,0.0,200.279,136.19199395179749,168.09951975941652,23.65209127593866,1,3,3,1_3_3,0,
2026-03-02T09:22:02.584324+00:00,B,uniform,tune,uniform_tune_021,192,2048,3072,bf16,NVIDIA GeForce RTX 4060,c10,64,128,64,8,3,8,0.0,0.0,104.44799810647964,228.9855977892875,23.130353360502784,2,3,3,2_3_3,0,
2026-03-02T09:22:02.638585+00:00,B,uniform,tune,uniform_tune_022,1536,2048,2048,bf16,NVIDIA GeForce RTX 4060,c06,64,128,32,4,3,8,0.0,0.0,382.9119950532913,553.9145743846891,33.64977345827664,3,3,3,3_3_3,0,
2026-03-02T09:22:02.650108+00:00,B,uniform,tune,uniform_tune_023,256,1024,1024,bf16,NVIDIA GeForce RTX 4060,c10,64,128,64,8,3,8,0.0,0.0,56.32000043988228,156.52256056666366,9.53250901645629,2,3,3,2_3_3,0,
2026-03-02T09:22:02.696203+00:00,B,uniform,tune,uniform_tune_024,768,128,384,bf16,NVIDIA GeForce RTX 4060,c02,32,64,32,2,2,8,0.0,46.062,34.80000048875809,69.12000089883794,2.169467555737218,3,1,2,3_1_2,0,
2026-03-02T09:22:02.707485+00:00,B,uniform,tune,uniform_tune_025,256,96,384,bf16,NVIDIA GeForce RTX 4060,c01,64,32,32,2,2,8,0.0,0.0,49.056001007556915,1851.5290012955606,0.3847514598079951,2,1,2,2_1_2,0,
2026-03-02T09:22:02.729322+00:00,B,uniform,tune,uniform_tune_026,96,1024,3072,bf16,NVIDIA GeForce RTX 4060,c06,64,128,32,4,3,8,0.0,0.0,73.64800199866295,149.5449659228325,8.200898321871176,1,3,3,1_3_3,0,
2026-03-02T09:22:02.779440+00:00,B,uniform,tune,uniform_tune_027,1536,512,4096,bf16,NVIDIA GeForce RTX 4060,c06,64,128,32,4,3,8,0.0,0.0,202.12800055742264,281.0268813371657,31.87312458557547,3,2,3,3_2_3,0,
2026-03-02T09:22:02.783754+00:00,B,uniform,tune,uniform_tune_028,128,64,192,bf16,NVIDIA GeForce RTX 4060,c02,32,64,32,2,2,8,0.0,0.0,34.81600061058998,79.09376062452787,0.09035293959189454,1,1,2,1_1_2,0,
2026-03-02T09:22:02.793192+00:00,B,uniform,tune,uniform_tune_029,192,256,1536,bf16,NVIDIA GeForce RTX 4060,c00,32,32,32,2,2,8,0.0,0.0,56.832000613212585,176.66719913482663,2.6568648361975127,2,2,3,2_2_3,0,
2026-03-02T09:22:02.862260+00:00,B,uniform,tune,uniform_tune_030,4096,64,3072,bf16,NVIDIA GeForce RTX 4060,c04,64,64,64,4,3,8,0.0,0.0,70.65600156784058,174.6515154838562,22.795129928963856,3,1,3,3_1_3,0,
2026-03-02T09:22:02.913296+00:00,B,uniform,tune,uniform_tune_031,384,128,96,bf16,NVIDIA GeForce RTX 4060,c11,32,128,32,4,2,8,0.0,50.987,33.64799916744232,40.441918671131134,0.28046790993538134,2,1,1,2_1_1,0,
2026-03-02T09:22:02.939260+00:00,B,uniform,eval,uniform_eval_000,512,4096,768,bf16,NVIDIA GeForce RTX 4060,c10,64,128,64,8,3,8,0.0,0.0,133.5040032863617,250.4806466400623,24.128306213339368,2,3,3,2_3_3,0,
2026-03-02T09:22:02.986400+00:00,B,uniform,eval,uniform_eval_001,384,512,64,bf16,NVIDIA GeForce RTX 4060,c08,128,128,64,8,4,8,0.0,47.096,38.495998829603195,119.97184336185452,0.6537257056608082,2,2,1,2_2_1,0,
2026-03-02T09:22:03.061193+00:00,B,uniform,eval,uniform_eval_002,256,4096,384,bf16,NVIDIA GeForce RTX 4060,c03,64,64,32,4,2,8,0.0,74.76,58.36800113320351,130.96959933638556,13.797052363711826,2,3,2,2_3_2,0,
2026-03-02T09:22:03.077177+00:00,B,uniform,eval,uniform_eval_003,384,768,512,bf16,NVIDIA GeForce RTX 4060,c03,64,64,32,4,2,8,0.0,0.0,46.76799848675728,527.6393756270404,6.457190766577509,2,3,2,2_3_2,0,
2026-03-02T09:22:03.128431+00:00,B,uniform,eval,uniform_eval_004,768,1024,96,bf16,NVIDIA GeForce RTX 4060,c11,32,128,32,4,2,8,0.0,51.225,38.68800029158592,62.09696132689714,3.9028883080534715,3,3,1,3_3_1,0,
2026-03-02T09:22:03.140243+00:00,B,uniform,eval,uniform_eval_005,3072,3072,128,bf16,NVIDIA GeForce RTX 4060,c11,32,128,32,4,2,8,0.0,0.0,112.46399953961372,184.25856247544272,21.481710715338995,3,3,1,3_3_1,0,
2026-03-02T09:22:03.144887+00:00,B,uniform,eval,uniform_eval_006,256,96,512,bf16,NVIDIA GeForce RTX 4060,c01,64,32,32,2,2,8,0.0,0.0,34.832000732421875,60.570559613406616,0.7224914868750411,2,1,2,2_1_2,0,
2026-03-02T09:22:03.551876+00:00,B,uniform,eval,uniform_eval_007,4096,4096,4096,bf16,NVIDIA GeForce RTX 4060,c06,64,128,32,4,3,8,0.0,0.0,4310.880184173584,4342.9869747161865,31.881877389349825,3,3,3,3_3_3,0,
2026-03-02T09:22:03.598065+00:00,B,uniform,eval,uniform_eval_008,128,96,64,bf16,NVIDIA GeForce RTX 4060,c03,64,64,32,4,2,8,0.0,46.113,30.016000382602215,109.18911971151826,0.052400852210531645,1,1,1,1_1_1,0,
2026-03-02T09:22:03.614390+00:00,B,uniform,eval,uniform_eval_009,3072,384,96,bf16,NVIDIA GeForce RTX 4060,c04,64,64,64,4,3,8,0.0,0.0,67.05600023269653,129.46240037679667,3.3776606897821235,3,2,1,3_2_1,0,
2026-03-02T09:22:03.637944+00:00,B,uniform,eval,uniform_eval_010,768,768,2048,bf16,NVIDIA GeForce RTX 4060,c06,64,128,32,4,3,8,0.0,0.0,105.40799796581268,200.63328370451927,22.91969443138046,3,3,3,3_3_3,0,
2026-03-02T09:22:03.651090+00:00,B,uniform,eval,uniform_eval_011,4096,96,512,bf16,NVIDIA GeForce RTX 4060,c02,32,64,32,2,2,8,0.0,0.0,57.34400078654289,133.9244800060987,7.021714189402912,3,1,2,3_1_2,0,
2026-03-02T09:22:03.700255+00:00,B,uniform,eval,uniform_eval_012,384,384,256,bf16,NVIDIA GeForce RTX 4060,c02,32,64,32,2,2,8,0.0,49.134,34.78400036692619,84.08960185945031,2.1704654784843425,2,2,2,2_2_2,0,
2026-03-02T09:22:03.741154+00:00,B,uniform,eval,uniform_eval_013,4096,2048,768,bf16,NVIDIA GeForce RTX 4060,c06,64,128,32,4,3,8,0.0,0.0,411.5519970655441,532.5500845909119,31.308077666667085,3,3,3,3_3_3,0,
2026-03-02T09:22:03.752524+00:00,B,uniform,eval,uniform_eval_014,192,384,3072,bf16,NVIDIA GeForce RTX 4060,c00,32,32,32,2,2,8,0.0,0.0,55.296000093221664,104.00767996907229,8.191999986189384,2,2,3,2_2_3,0,
2026-03-02T09:22:03.760097+00:00,B,uniform,eval,uniform_eval_015,128,96,4096,bf16,NVIDIA GeForce RTX 4060,c04,64,64,64,4,3,8,0.0,0.0,56.32000043988228,74.95679922401901,1.7873454405855542,1,1,3,1_1_3,0,
2026-03-02T09:22:03.803030+00:00,B,uniform,eval,uniform_eval_016,64,4096,2048,bf16,NVIDIA GeForce RTX 4060,c06,64,128,32,4,3,8,0.0,0.0,74.75200295448303,102.04160094261167,14.364054226798554,1,3,3,1_3_3,0,
2026-03-02T09:22:03.810777+00:00,B,uniform,eval,uniform_eval_017,96,128,3072,bf16,NVIDIA GeForce RTX 4060,c04,64,64,64,4,3,8,0.0,0.0,54.27199974656105,79.8719972372055,1.3910943461187626,1,1,3,1_1_3,0,
2026-03-02T09:22:03.854024+00:00,B,uniform,eval,uniform_eval_018,512,768,64,bf16,NVIDIA GeForce RTX 4060,c11,32,128,32,4,2,8,0.0,43.206,30.33600002527237,37.26464025676249,1.6591392391241304,2,3,1,2_3_1,0,
2026-03-02T09:22:03.861019+00:00,B,uniform,eval,uniform_eval_019,64,128,384,bf16,NVIDIA GeForce RTX 4060,c02,32,64,32,2,2,8,0.0,0.0,59.74400043487549,147.33376398682594,0.10530690871392286,1,1,2,1_1_2,0,
2026-03-02T09:22:03.865793+00:00,B,uniform,eval,uniform_eval_020,512,512,96,bf16,NVIDIA GeForce RTX 4060,c08,128,128,64,8,4,8,0.0,0.0,39.743999019265175,65.15008058398956,1.2663961665156709,2,2,1,2_2_1,0,
2026-03-02T09:22:03.890129+00:00,B,uniform,eval,uniform_eval_021,256,3072,1536,bf16,NVIDIA GeForce RTX 4060,c10,64,128,64,8,3,8,0.0,0.0,103.18400338292122,154.70016300678242,23.4136981004158,2,3,3,2_3_3,0,
2026-03-02T09:22:03.899728+00:00,B,uniform,eval,uniform_eval_022,2048,96,512,bf16,NVIDIA GeForce RTX 4060,c02,32,64,32,2,2,8,0.0,0.0,63.471999019384384,154.06015902757633,3.171896192185703,3,1,2,3_1_2,0,
2026-03-02T09:22:03.931440+00:00,B,uniform,eval,uniform_eval_023,1536,512,3072,bf16,NVIDIA GeForce RTX 4060,c06,64,128,32,4,3,8,0.0,0.0,172.03199863433838,182.11968064308167,28.086857365822308,3,2,3,3_2_3,0,
2026-03-02T09:22:03.970647+00:00,B,uniform,eval,uniform_eval_024,128,192,64,bf16,NVIDIA GeForce RTX 4060,c11,32,128,32,4,2,8,0.0,39.168,29.29599955677986,40.47871880233287,0.10737739102921294,1,2,1,1_2_1,0,
2026-03-02T09:22:03.985095+00:00,B,uniform,eval,uniform_eval_025,1536,96,384,bf16,NVIDIA GeForce RTX 4060,c02,32,64,32,2,2,8,0.0,0.0,65.05599990487099,333.90623614191963,1.7407496336324981,3,1,2,3_1_2,0,
2026-03-02T09:22:03.991142+00:00,B,uniform,eval,uniform_eval_026,1536,2048,64,bf16,NVIDIA GeForce RTX 4060,c11,32,128,32,4,2,8,0.0,0.0,51.19999870657921,157.34943561255906,7.864320198669438,3,3,1,3_3_1,0,
2026-03-02T09:22:03.999594+00:00,B,uniform,eval,uniform_eval_027,256,1024,96,bf16,NVIDIA GeForce RTX 4060,c11,32,128,32,4,2,8,0.0,0.0,35.840000957250595,154.22336325049395,1.404342819634263,2,3,1,2_3_1,0,
2026-03-02T09:22:04.006625+00:00,B,uniform,eval,uniform_eval_028,2048,256,64,bf16,NVIDIA GeForce RTX 4060,c04,64,64,64,4,3,8,0.0,0.0,70.56000083684921,136.54784172773356,0.9510893311236059,3,2,1,3_2_1,0,
2026-03-02T09:22:04.013616+00:00,B,uniform,eval,uniform_eval_029,192,768,192,bf16,NVIDIA GeForce RTX 4060,c03,64,64,32,4,2,8,0.0,0.0,40.78399948775768,131.99647761881346,1.3883656510195088,2,3,2,2_3_2,0,
2026-03-02T09:22:04.071369+00:00,B,uniform,eval,uniform_eval_030,1024,2048,3072,bf16,NVIDIA GeForce RTX 4060,c06,64,128,32,4,3,8,0.0,0.0,416.1120057106018,440.44288009405136,30.96498469443636,3,3,3,3_3_3,0,
2026-03-02T09:22:04.151579+00:00,B,uniform,eval,uniform_eval_031,1536,1024,512,bf16,NVIDIA GeForce RTX 4060,c06,64,128,32,4,3,8,0.0,80.154,76.54400169849396,88.62720020115374,21.041658395966635,3,3,2,3_3_2,0,
2026-03-02T09:22:04.169945+00:00,B,uniform,eval,uniform_eval_032,512,768,768,bf16,NVIDIA GeForce RTX 4060,c10,64,128,64,8,3,8,0.0,0.0,57.34400078654289,142.2671988606453,10.53257128410437,2,3,3,2_3_3,0,
2026-03-02T09:22:04.184681+00:00,B,uniform,eval,uniform_eval_033,64,512,4096,bf16,NVIDIA GeForce RTX 4060,c00,32,32,32,2,2,8,0.0,0.0,78.19199934601784,214.38463792204848,3.4330296992677023,1,2,3,1_2_3,0,
2026-03-02T09:22:04.240167+00:00,B,uniform,eval,uniform_eval_034,1024,256,512,bf16,NVIDIA GeForce RTX 4060,c11,32,128,32,4,2,8,0.0,55.446,41.8079998344183,103.42400308698394,6.420672049922164,3,2,2,3_2_2,0,
2026-03-02T09:22:04.248478+00:00,B,uniform,eval,uniform_eval_035,1024,768,96,bf16,NVIDIA GeForce RTX 4060,c11,32,128,32,4,2,8,0.0,0.0,67.60000064969063,201.42015710473055,2.233652996284269,3,3,1,3_3_1,0,
2026-03-02T09:22:04.257594+00:00,B,uniform,eval,uniform_eval_036,768,64,1536,bf16,NVIDIA GeForce RTX 4060,c04,64,64,64,4,3,8,0.0,0.0,41.311999782919884,115.740797445178,3.654989949492294,3,1,3,3_1_3,0,
2026-03-02T09:22:04.265102+00:00,B,uniform,eval,uniform_eval_037,512,256,512,bf16,NVIDIA GeForce RTX 4060,c02,32,64,32,2,2,8,0.0,0.0,69.48800012469292,159.76448193192482,1.9315238279868847,2,2,2,2_2_2,0,
2026-03-02T09:22:04.313264+00:00,B,uniform,eval,uniform_eval_038,64,1024,64,bf16,NVIDIA GeForce RTX 4060,c11,32,128,32,4,2,8,0.0,48.13,33.79200026392937,50.193921104073496,0.24824242230354923,1,3,1,1_3_1,0,
2026-03-02T09:22:04.324362+00:00,B,uniform,eval,uniform_eval_039,512,128,2048,bf16,NVIDIA GeForce RTX 4060,c04,64,64,64,4,3,8,0.0,0.0,50.5599994212389,159.64639693498611,5.309245630395271,2,1,3,2_1_3,0,
2026-03-02T09:22:04.333152+00:00,B,uniform,eval,uniform_eval_040,4096,768,96,bf16,NVIDIA GeForce RTX 4060,c11,32,128,32,4,2,8,0.0,0.0,75.77600330114365,102.20224052667609,7.970594247359632,3,3,1,3_3_1,0,
2026-03-02T09:22:04.340799+00:00,B,uniform,eval,uniform_eval_041,4096,192,64,bf16,NVIDIA GeForce RTX 4060,c04,64,64,64,4,3,8,0.0,0.0,61.43999844789505,178.75807821750632,1.6384000413894666,3,2,1,3_2_1,0,
2026-03-02T09:22:04.347877+00:00,B,uniform,eval,uniform_eval_042,96,1536,128,bf16,NVIDIA GeForce RTX 4060,c11,32,128,32,4,2,8,0.0,0.0,58.36800113320351,95.47520145773879,0.6467368295489919,1,3,1,1_3_1,0,
2026-03-02T09:22:04.353816+00:00,B,uniform,eval,uniform_eval_043,192,2048,192,bf16,NVIDIA GeForce RTX 4060,c03,64,64,32,4,2,8,0.0,0.0,39.68000039458275,49.649921432137475,3.805316091191732,2,3,2,2_3_2,0,
2026-03-02T09:22:04.432188+00:00,B,uniform,eval,uniform_eval_044,384,4096,3072,bf16,NVIDIA GeForce RTX 4060,c10,64,128,64,8,3,8,0.0,0.0,319.487988948822,395.9705486893654,30.247385661650025,2,3,3,2_3_3,0,
2026-03-02T09:22:04.450318+00:00,B,uniform,eval,uniform_eval_045,4096,96,768,bf16,NVIDIA GeForce RTX 4060,c04,64,64,64,4,3,8,0.0,0.0,82.86399766802788,192.5654415786266,7.288808083091539,3,1,3,3_1_3,0,
2026-03-02T09:22:04.455962+00:00,B,uniform,eval,uniform_eval_046,96,96,1536,bf16,NVIDIA GeForce RTX 4060,c04,64,64,64,4,3,8,0.0,0.0,38.76799903810024,88.44223976135245,0.7302814873725131,1,1,3,1_1_3,0,
2026-03-02T09:22:04.516410+00:00,B,uniform,eval,uniform_eval_047,2048,512,4096,bf16,NVIDIA GeForce RTX 4060,c06,64,128,32,4,3,8,0.0,0.0,317.440003156662,479.46751445531834,27.060025537363426,3,2,3,3_2_3,0,
2026-03-02T09:22:04.525274+00:00,B,uniform,eval,uniform_eval_048,96,256,768,bf16,NVIDIA GeForce RTX 4060,c00,32,32,32,2,2,8,0.0,0.0,72.16000184416771,222.7705679833888,0.5231254855220188,1,2,3,1_2_3,0,
2026-03-02T09:22:04.531043+00:00,B,uniform,eval,uniform_eval_049,64,768,384,bf16,NVIDIA GeForce RTX 4060,c11,32,128,32,4,2,8,0.0,0.0,35.840000957250595,123.96544091403483,1.0532571147256975,1,3,2,1_3_2,0,
2026-03-02T09:22:04.536380+00:00,B,uniform,eval,uniform_eval_050,128,1024,96,bf16,NVIDIA GeForce RTX 4060,c11,32,128,32,4,2,8,0.0,0.0,32.64000080525875,115.61888337135309,0.7710117456843151,1,3,1,1_3_1,0,
2026-03-02T09:22:04.544475+00:00,B,uniform,eval,uniform_eval_051,384,768,768,bf16,NVIDIA GeForce RTX 4060,c10,64,128,64,8,3,8,0.0,0.0,52.22399905323982,66.05023965239525,8.673882510188545,2,3,3,2_3_3,0,
2026-03-02T09:22:04.565572+00:00,B,uniform,eval,uniform_eval_052,768,64,4096,bf16,NVIDIA GeForce RTX 4060,c04,64,64,64,4,3,8,0.0,0.0,91.13600105047226,163.70368212461472,4.418157252445229,3,1,3,3_1_3,0,
2026-03-02T09:22:04.572396+00:00,B,uniform,eval,uniform_eval_053,384,96,512,bf16,NVIDIA GeForce RTX 4060,c01,64,32,32,2,2,8,0.0,0.0,41.37600027024746,146.23744085431093,0.9123341007696256,2,1,2,2_1_2,0,
2026-03-02T09:22:04.580337+00:00,B,uniform,eval,uniform_eval_054,768,192,768,bf16,NVIDIA GeForce RTX 4060,c06,64,128,32,4,3,8,0.0,0.0,50.89600011706352,129.16735522449014,4.450102473260282,3,2,3,3_2_3,0,
2026-03-02T09:22:04.590750+00:00,B,uniform,eval,uniform_eval_055,512,2048,512,bf16,NVIDIA GeForce RTX 4060,c03,64,64,32,4,2,8,0.0,0.0,66.56000018119812,147.75552421808234,16.13193841762204,2,3,2,2_3_2,0,
2026-03-02T09:22:04.599308+00:00,B,uniform,eval,uniform_eval_056,384,512,512,bf16,NVIDIA GeForce RTX 4060,c02,32,64,32,2,2,8,0.0,0.0,56.32000043988228,323.6390343308442,3.5746908811711084,2,2,2,2_2_2,0,
2026-03-02T09:22:04.611441+00:00,B,uniform,eval,uniform_eval_057,2048,512,512,bf16,NVIDIA GeForce RTX 4060,c11,32,128,32,4,2,8,0.0,0.0,80.79999685287476,202.61887773871416,13.288884477992376,3,2,2,3_2_2,0,
2026-03-02T09:22:04.632713+00:00,B,uniform,eval,uniform_eval_058,1024,512,2048,bf16,NVIDIA GeForce RTX 4060,c06,64,128,32,4,3,8,0.0,0.0,117.24800243973732,200.48895701766008,18.315737610146112,3,2,3,3_2_3,0,
2026-03-02T09:22:04.682805+00:00,B,uniform,eval,uniform_eval_059,2048,64,4096,bf16,NVIDIA GeForce RTX 4060,c04,64,64,64,4,3,8,0.0,0.0,80.56000247597694,197.49504283070556,13.328473075955909,3,1,3,3_1_3,0,
2026-03-02T09:22:04.691758+00:00,B,uniform,eval,uniform_eval_060,64,1536,1024,bf16,NVIDIA GeForce RTX 4060,c06,64,128,32,4,3,8,0.0,0.0,41.98399931192398,48.52480061352253,4.795317151761212,1,3,3,1_3_3,0,
2026-03-02T09:22:04.707015+00:00,B,uniform,eval,uniform_eval_061,768,1024,1536,bf16,NVIDIA GeForce RTX 4060,c06,64,128,32,4,3,8,0.0,0.0,95.23200243711472,107.56095916032791,25.368773544327418,3,3,3,3_3_3,0,
2026-03-02T09:22:04.712244+00:00,B,uniform,eval,uniform_eval_062,384,2048,192,bf16,NVIDIA GeForce RTX 4060,c03,64,64,32,4,2,8,0.0,0.0,35.840000957250595,53.975039571523624,8.42605691780558,2,3,2,2_3_2,0,
2026-03-02T09:22:04.717767+00:00,B,uniform,eval,uniform_eval_063,256,2048,192,bf16,NVIDIA GeForce RTX 4060,c03,64,64,32,4,2,8,0.0,0.0,33.79200026392937,84.45952046662559,5.957818135285181,2,3,2,2_3_2,0,
2026-03-02T09:22:06.785810+00:00,B,llm_style,tune,llm_style_tune_000,8,4096,1024,bf16,NVIDIA GeForce RTX 4060,c00,32,32,32,2,2,8,0.0,2067.346,39.93599861860275,89.17343981564042,1.6804103145361124,0,3,3,0_3_3,0,
2026-03-02T09:22:06.809578+00:00,B,llm_style,tune,llm_style_tune_001,32,1024,2048,bf16,NVIDIA GeForce RTX 4060,c00,32,32,32,2,2,8,0.0,0.0,72.06400111317635,183.7024050951004,1.8624795449424378,0,3,3,0_3_3,0,
2026-03-02T09:22:06.824342+00:00,B,llm_style,tune,llm_style_tune_002,16,2048,1024,bf16,NVIDIA GeForce RTX 4060,c00,32,32,32,2,2,8,0.0,0.0,74.09600168466568,151.67487904429433,0.9057015557411422,0,3,3,0_3_3,0,
2026-03-02T09:22:07.035353+00:00,B,llm_style,tune,llm_style_tune_003,1,1024,4096,bf16,NVIDIA GeForce RTX 4060,c00,32,32,32,2,2,8,0.0,0.0,144.3519964814186,208.90015810728067,0.05811217166698352,0,3,3,0_3_3,0,
2026-03-02T09:22:07.064137+00:00,B,llm_style,tune,llm_style_tune_004,64,2048,2048,bf16,NVIDIA GeForce RTX 4060,c06,64,128,32,4,3,8,0.0,0.0,128.83199751377106,227.35680177807805,4.167217169341902,1,3,3,1_3_3,0,
2026-03-02T09:22:07.448198+00:00,B,llm_style,tune,llm_style_tune_005,32,8192,8192,bf16,NVIDIA GeForce RTX 4060,c00,32,32,32,2,2,8,0.0,0.0,928.736001253128,1077.7395570278168,4.624529780481075,0,3,3,0_3_3,0,
2026-03-02T09:22:07.785637+00:00,B,llm_style,tune,llm_style_tune_006,16,8192,8192,bf16,NVIDIA GeForce RTX 4060,c00,32,32,32,2,2,8,0.0,0.0,921.5999841690063,977.8483116626738,2.3301689289158958,0,3,3,0_3_3,0,
2026-03-02T09:22:07.842862+00:00,B,llm_style,tune,llm_style_tune_007,2,1024,8192,bf16,NVIDIA GeForce RTX 4060,c00,32,32,32,2,2,8,0.0,0.0,256.9599896669388,344.69823360443115,0.13058232156489383,0,3,3,0_3_3,0,
2026-03-02T09:22:07.939006+00:00,B,llm_style,tune,llm_style_tune_008,16,2048,8192,bf16,NVIDIA GeForce RTX 4060,c00,32,32,32,2,2,8,0.0,0.0,363.5199964046478,503.73632282018656,1.47686762024059,0,3,3,0_3_3,0,
2026-03-02T09:22:07.983601+00:00,B,llm_style,tune,llm_style_tune_009,4,4096,2048,bf16,NVIDIA GeForce RTX 4060,c00,32,32,32,2,2,8,0.0,0.0,120.72000280022621,267.69407361745823,0.5559050898222333,0,3,3,0_3_3,0,
2026-03-02T09:22:08.165210+00:00,B,llm_style,tune,llm_style_tune_010,64,8192,4096,bf16,NVIDIA GeForce RTX 4060,c06,64,128,32,4,3,8,0.0,0.0,660.4800224304199,796.6924667358398,6.50279667838472,1,3,3,1_3_3,0,
2026-03-02T09:22:08.211264+00:00,B,llm_style,tune,llm_style_tune_011,16,8192,1024,bf16,NVIDIA GeForce RTX 4060,c00,32,32,32,2,2,8,0.0,0.0,135.67999750375748,186.6956759989261,1.9784453194183322,0,3,3,0_3_3,0,
2026-03-02T09:22:08.255983+00:00,B,llm_style,tune,llm_style_tune_012,2,8192,1024,bf16,NVIDIA GeForce RTX 4060,c00,32,32,32,2,2,8,0.0,0.0,120.83200365304947,183.7875224649905,0.27769490685883513,0,3,3,0_3_3,0,
2026-03-02T09:22:08.345329+00:00,B,llm_style,tune,llm_style_tune_013,16,8192,2048,bf16,NVIDIA GeForce RTX 4060,c00,32,32,32,2,2,8,0.0,0.0,262.65600323677063,352.65184253454197,2.0440077720821748,0,3,3,0_3_3,0,
2026-03-02T09:22:08.434116+00:00,B,llm_style,tune,llm_style_tune_014,8,4096,4096,bf16,NVIDIA GeForce RTX 4060,c00,32,32,32,2,2,8,0.0,0.0,262.14399933815,354.0684768557548,1.0240000025853515,0,3,3,0_3_3,0,
2026-03-02T09:22:08.446470+00:00,B,llm_style,tune,llm_style_tune_015,64,1024,1024,bf16,NVIDIA GeForce RTX 4060,c06,64,128,32,4,3,8,0.0,0.0,94.00000050663948,170.08640542626378,1.427848162516976,1,3,3,1_3_3,0,
2026-03-02T09:22:08.619810+00:00,B,llm_style,tune,llm_style_tune_016,16,4096,8192,bf16,NVIDIA GeForce RTX 4060,c00,32,32,32,2,2,8,0.0,0.0,498.1760084629059,560.8550471067429,2.155346314875681,0,3,3,0_3_3,0,
2026-03-02T09:22:08.719246+00:00,B,llm_style,tune,llm_style_tune_017,1,4096,4096,bf16,NVIDIA GeForce RTX 4060,c00,32,32,32,2,2,8,0.0,0.0,292.2080010175705,397.2198364138602,0.11483064078721913,0,3,3,0_3_3,0,
2026-03-02T09:22:08.850848+00:00,B,llm_style,tune,llm_style_tune_018,64,4096,4096,bf16,NVIDIA GeForce RTX 4060,c06,64,128,32,4,3,8,0.0,0.0,532.9920053482056,656.9267153739929,4.029110430271916,1,3,3,1_3_3,0,
2026-03-02T09:22:08.950945+00:00,B,llm_style,tune,llm_style_tune_019,64,8192,2048,bf16,NVIDIA GeForce RTX 4060,c06,64,128,32,4,3,8,0.0,0.0,408.06400775909424,539.15649831295,5.262614705455215,1,3,3,1_3_3,0,
2026-03-02T09:22:08.998773+00:00,B,llm_style,tune,llm_style_tune_020,8,2048,4096,bf16,NVIDIA GeForce RTX 4060,c00,32,32,32,2,2,8,0.0,0.0,159.61600095033646,246.82496160268784,0.8408789043760158,0,3,3,0_3_3,0,
2026-03-02T09:22:09.013252+00:00,B,llm_style,tune,llm_style_tune_021,8,1024,2048,bf16,NVIDIA GeForce RTX 4060,c00,32,32,32,2,2,8,0.0,0.0,101.77600011229515,179.6630401909351,0.32968904223959994,0,3,3,0_3_3,0,
2026-03-02T09:22:09.059583+00:00,B,llm_style,tune,llm_style_tune_022,8,8192,1024,bf16,NVIDIA GeForce RTX 4060,c00,32,32,32,2,2,8,0.0,0.0,158.57599675655365,240.63999950885773,0.8463937212770698,0,3,3,0_3_3,0,
2026-03-02T09:22:09.243331+00:00,B,llm_style,tune,llm_style_tune_023,1,4096,8192,bf16,NVIDIA GeForce RTX 4060,c00,32,32,32,2,2,8,0.0,0.0,519.1680192947388,611.9116598367691,0.1292623226121742,0,3,3,0_3_3,0,
2026-03-02T09:22:09.416876+00:00,B,llm_style,tune,llm_style_tune_024,2,8192,4096,bf16,NVIDIA GeForce RTX 4060,c00,32,32,32,2,2,8,0.0,0.0,505.8559775352478,673.9404940605161,0.26532794700572215,0,3,3,0_3_3,0,
2026-03-02T09:22:09.509972+00:00,B,llm_style,tune,llm_style_tune_025,2,4096,4096,bf16,NVIDIA GeForce RTX 4060,c00,32,32,32,2,2,8,0.0,0.0,285.18399596214294,526.523190438747,0.23531777711996307,0,3,3,0_3_3,0,
2026-03-02T09:22:09.523811+00:00,B,llm_style,tune,llm_style_tune_026,4,2048,1024,bf16,NVIDIA GeForce RTX 4060,c00,32,32,32,2,2,8,0.0,0.0,87.00799942016602,132.67775923013673,0.19282383357628968,0,3,3,0_3_3,0,
2026-03-02T09:22:09.583868+00:00,B,llm_style,tune,llm_style_tune_027,64,2048,4096,bf16,NVIDIA GeForce RTX 4060,c06,64,128,32,4,3,8,0.0,0.0,346.5760052204132,478.3024087548256,3.0981424213633266,1,3,3,1_3_3,0,
2026-03-02T09:22:09.613340+00:00,B,llm_style,tune,llm_style_tune_028,32,1024,4096,bf16,NVIDIA GeForce RTX 4060,c00,32,32,32,2,2,8,0.0,0.0,219.96799856424332,289.2473602294921,1.2203386754078294,0,3,3,0_3_3,0,
2026-03-02T09:22:09.628172+00:00,B,llm_style,tune,llm_style_tune_029,32,2048,1024,bf16,NVIDIA GeForce RTX 4060,c00,32,32,32,2,2,8,0.0,0.0,102.39999741315842,173.02271410822857,1.310720033111573,0,3,3,0_3_3,0,
2026-03-02T09:22:09.651352+00:00,B,llm_style,tune,llm_style_tune_030,4,2048,2048,bf16,NVIDIA GeForce RTX 4060,c00,32,32,32,2,2,8,0.0,0.0,112.64000087976456,200.97024098038668,0.29789090676425906,0,3,3,0_3_3,0,
2026-03-02T09:22:10.012256+00:00,B,llm_style,tune,llm_style_tune_031,1,8192,8192,bf16,NVIDIA GeForce RTX 4060,c00,32,32,32,2,2,8,0.0,0.0,1094.655990600586,1123.8911747932434,0.12261178776938049,0,3,3,0_3_3,0,
2026-03-02T09:22:10.049629+00:00,B,llm_style,eval,llm_style_eval_000,2,1024,4096,bf16,NVIDIA GeForce RTX 4060,c00,32,32,32,2,2,8,0.0,0.0,200.1120001077652,344.68544334173185,0.08383913004200177,0,3,3,0_3_3,0,
2026-03-02T09:22:10.404166+00:00,B,llm_style,eval,llm_style_eval_001,2,8192,8192,bf16,NVIDIA GeForce RTX 4060,c00,32,32,32,2,2,8,0.0,0.0,1143.775999546051,1282.3961472511292,0.23469233145872825,0,3,3,0_3_3,0,
2026-03-02T09:22:10.434862+00:00,B,llm_style,eval,llm_style_eval_002,2,2048,2048,bf16,NVIDIA GeForce RTX 4060,c00,32,32,32,2,2,8,0.0,0.0,143.26400309801102,312.1759971976279,0.1171069887564305,0,3,3,0_3_3,0,
2026-03-02T09:22:10.498315+00:00,B,llm_style,eval,llm_style_eval_003,8,1024,8192,bf16,NVIDIA GeForce RTX 4060,c00,32,32,32,2,2,8,0.0,0.0,403.4560024738312,483.3280146121979,0.3326700487216213,0,3,3,0_3_3,0,
2026-03-02T09:22:10.619646+00:00,B,llm_style,eval,llm_style_eval_004,64,2048,8192,bf16,NVIDIA GeForce RTX 4060,c06,64,128,32,4,3,8,0.0,0.0,759.8080039024353,853.5859107971188,2.8263503897963047,1,3,3,1_3_3,0,
2026-03-02T09:22:11.012008+00:00,B,llm_style,eval,llm_style_eval_005,1,8192,8192,bf16,NVIDIA GeForce RTX 4060,c00,32,32,32,2,2,8,0.0,0.0,1234.4319820404053,1380.3097653388977,0.10872833007627536,0,3,3,0_3_3,0,
2026-03-02T09:22:11.084259+00:00,B,llm_style,eval,llm_style_eval_006,1,1024,8192,bf16,NVIDIA GeForce RTX 4060,c00,32,32,32,2,2,8,0.0,0.0,457.72799849510193,565.1865419745441,0.036653243968381655,0,3,3,0_3_3,0,
2026-03-02T09:22:11.270585+00:00,B,llm_style,eval,llm_style_eval_007,2,8192,4096,bf16,NVIDIA GeForce RTX 4060,c00,32,32,32,2,2,8,0.0,0.0,646.6079950332642,753.7382256984711,0.20757202049921344,0,3,3,0_3_3,0,
2026-03-02T09:22:11.323537+00:00,B,llm_style,eval,llm_style_eval_008,16,2048,4096,bf16,NVIDIA GeForce RTX 4060,c00,32,32,32,2,2,8,0.0,0.0,246.7840015888214,358.5228821635246,1.0877344328310758,0,3,3,0_3_3,0,
2026-03-02T09:22:11.441422+00:00,B,llm_style,eval,llm_style_eval_009,32,2048,8192,bf16,NVIDIA GeForce RTX 4060,c00,32,32,32,2,2,8,0.0,0.0,592.8319990634918,716.8204838037491,1.8112076029907473,0,3,3,0_3_3,0,
2026-03-02T09:22:11.452207+00:00,B,llm_style,eval,llm_style_eval_010,1,1024,1024,bf16,NVIDIA GeForce RTX 4060,c00,32,32,32,2,2,8,0.0,0.0,81.91999793052673,102.1440009772777,0.025600000646710412,0,3,3,0_3_3,0,
2026-03-02T09:22:11.561954+00:00,B,llm_style,eval,llm_style_eval_011,16,2048,8192,bf16,NVIDIA GeForce RTX 4060,c00,32,32,32,2,2,8,0.0,0.0,570.0799822807312,684.984317421913,0.9417466472899628,0,3,3,0_3_3,0,
2026-03-02T09:22:11.928274+00:00,B,llm_style,eval,llm_style_eval_012,8,8192,8192,bf16,NVIDIA GeForce RTX 4060,c00,32,32,32,2,2,8,0.0,0.0,1420.7359552383423,1472.296962738037,0.7557645177072114,0,3,3,0_3_3,0,
2026-03-02T09:22:12.122757+00:00,B,llm_style,eval,llm_style_eval_013,32,4096,8192,bf16,NVIDIA GeForce RTX 4060,c00,32,32,32,2,2,8,0.0,0.0,781.3119888305664,845.292466878891,2.748560982936227,0,3,3,0_3_3,0,
2026-03-02T09:22:12.138938+00:00,B,llm_style,eval,llm_style_eval_014,64,1024,1024,bf16,NVIDIA GeForce RTX 4060,c06,64,128,32,4,3,8,0.0,0.0,151.76000446081161,236.43967345356933,0.8844077757961486,1,3,3,1_3_3,0,
2026-03-02T09:22:12.153648+00:00,B,llm_style,eval,llm_style_eval_015,16,2048,1024,bf16,NVIDIA GeForce RTX 4060,c00,32,32,32,2,2,8,0.0,0.0,94.2080020904541,141.75967454910275,0.7123478102801206,0,3,3,0_3_3,0,
2026-03-02T09:22:12.218181+00:00,B,llm_style,eval,llm_style_eval_016,2,1024,8192,bf16,NVIDIA GeForce RTX 4060,c00,32,32,32,2,2,8,0.0,0.0,416.76799952983856,601.8355035781858,0.08051105660188208,0,3,3,0_3_3,0,
2026-03-02T09:22:12.586578+00:00,B,llm_style,eval,llm_style_eval_017,4,8192,8192,bf16,NVIDIA GeForce RTX 4060,c00,32,32,32,2,2,8,0.0,0.0,1172.9919910430908,1265.7637906074524,0.45769358708287855,0,3,3,0_3_3,0,
2026-03-02T09:22:12.621495+00:00,B,llm_style,eval,llm_style_eval_018,4,1024,4096,bf16,NVIDIA GeForce RTX 4060,c00,32,32,32,2,2,8,0.0,0.0,228.35199534893036,269.68063414096827,0.14694170702878065,0,3,3,0_3_3,0,
2026-03-02T09:22:12.672107+00:00,B,llm_style,eval,llm_style_eval_019,8,4096,2048,bf16,NVIDIA GeForce RTX 4060,c00,32,32,32,2,2,8,0.0,0.0,170.43200135231018,198.15423622727394,0.7875148266466138,0,3,3,0_3_3,0,
2026-03-02T09:22:12.732804+00:00,B,llm_style,eval,llm_style_eval_020,64,4096,2048,bf16,NVIDIA GeForce RTX 4060,c06,64,128,32,4,3,8,0.0,0.0,395.1520025730133,428.57471972703934,2.7172880739775622,1,3,3,1_3_3,0,
2026-03-02T09:22:12.915499+00:00,B,llm_style,eval,llm_style_eval_021,1,4096,8192,bf16,NVIDIA GeForce RTX 4060,c00,32,32,32,2,2,8,0.0,0.0,689.1199946403503,716.8211454153061,0.09738342309313476,0,3,3,0_3_3,0,
2026-03-02T09:22:12.953390+00:00,B,llm_style,eval,llm_style_eval_022,32,1024,4096,bf16,NVIDIA GeForce RTX 4060,c00,32,32,32,2,2,8,0.0,0.0,276.8479883670807,354.1913717985152,0.9696131714133089,0,3,3,0_3_3,0,
2026-03-02T09:22:12.969157+00:00,B,llm_style,eval,llm_style_eval_023,4,1024,1024,bf16,NVIDIA GeForce RTX 4060,c00,32,32,32,2,2,8,0.0,0.0,86.38399839401245,185.90784579515454,0.09710835520414439,0,3,3,0_3_3,0,
2026-03-02T09:22:13.002003+00:00,B,llm_style,eval,llm_style_eval_024,64,2048,2048,bf16,NVIDIA GeForce RTX 4060,c06,64,128,32,4,3,8,0.0,0.0,201.7280012369156,313.4873616695404,2.6613603897729705,1,3,3,1_3_3,0,
2026-03-02T09:22:13.432206+00:00,B,llm_style,eval,llm_style_eval_025,32,8192,8192,bf16,NVIDIA GeForce RTX 4060,c00,32,32,32,2,2,8,0.0,0.0,1399.8080492019653,1449.9107360839844,3.06825446420927,0,3,3,0_3_3,0,
2026-03-02T09:22:13.492009+00:00,B,llm_style,eval,llm_style_eval_026,4,2048,4096,bf16,NVIDIA GeForce RTX 4060,c00,32,32,32,2,2,8,0.0,0.0,240.12800306081772,426.87711864709837,0.27947121178950207,0,3,3,0_3_3,0,
2026-03-02T09:22:13.586057+00:00,B,llm_style,eval,llm_style_eval_027,8,8192,2048,bf16,NVIDIA GeForce RTX 4060,c00,32,32,32,2,2,8,0.0,0.0,334.1439962387085,444.4412776827812,0.8033526234846156,0,3,3,0_3_3,0,
2026-03-02T09:22:13.768617+00:00,B,llm_style,eval,llm_style_eval_028,8,4096,8192,bf16,NVIDIA GeForce RTX 4060,c00,32,32,32,2,2,8,0.0,0.0,665.008008480072,792.8675311803818,0.8073149573447402,0,3,3,0_3_3,0,
2026-03-02T09:22:13.792371+00:00,B,llm_style,eval,llm_style_eval_029,8,2048,2048,bf16,NVIDIA GeForce RTX 4060,c00,32,32,32,2,2,8,0.0,0.0,132.9919993877411,268.9433535933491,0.5046082795126844,0,3,3,0_3_3,0,
2026-03-02T09:22:13.846074+00:00,B,llm_style,eval,llm_style_eval_030,1,4096,2048,bf16,NVIDIA GeForce RTX 4060,c00,32,32,32,2,2,8,0.0,0.0,195.5839991569519,282.97215133905405,0.08578010508178968,0,3,3,0_3_3,0,
2026-03-02T09:22:13.939315+00:00,B,llm_style,eval,llm_style_eval_031,16,8192,2048,bf16,NVIDIA GeForce RTX 4060,c00,32,32,32,2,2,8,0.0,0.0,329.72800731658936,422.96319782733906,1.6282235663545612,0,3,3,0_3_3,0,
2026-03-02T09:22:13.967634+00:00,B,llm_style,eval,llm_style_eval_032,1,2048,2048,bf16,NVIDIA GeForce RTX 4060,c00,32,32,32,2,2,8,0.0,0.0,135.16800105571747,259.112950861454,0.06206060557588731,0,3,3,0_3_3,0,
2026-03-02T09:22:14.157617+00:00,B,llm_style,eval,llm_style_eval_033,16,8192,4096,bf16,NVIDIA GeForce RTX 4060,c00,32,32,32,2,2,8,0.0,0.0,655.8080017566681,762.7657747268677,1.6372807607163091,0,3,3,0_3_3,0,
2026-03-02T09:22:14.189068+00:00,B,llm_style,eval,llm_style_eval_034,16,1024,4096,bf16,NVIDIA GeForce RTX 4060,c00,32,32,32,2,2,8,0.0,0.0,245.7599937915802,336.4147186279297,0.5461333471298221,0,3,3,0_3_3,0,
2026-03-02T09:22:14.297438+00:00,B,llm_style,eval,llm_style_eval_035,4,8192,2048,bf16,NVIDIA GeForce RTX 4060,c00,32,32,32,2,2,8,0.0,0.0,358.39998722076416,374.8249676823616,0.3744914419244265,0,3,3,0_3_3,0,
2026-03-02T09:22:14.352099+00:00,B,llm_style,eval,llm_style_eval_036,2,2048,4096,bf16,NVIDIA GeForce RTX 4060,c00,32,32,32,2,2,8,0.0,0.0,253.9519965648651,303.9641731977461,0.13212903404533555,0,3,3,0_3_3,0,
2026-03-02T09:22:14.364197+00:00,B,llm_style,eval,llm_style_eval_037,2,1024,1024,bf16,NVIDIA GeForce RTX 4060,c00,32,32,32,2,2,8,0.0,0.0,107.51999914646149,181.77023828029633,0.03900952411919765,0,3,3,0_3_3,0,
2026-03-02T09:22:14.611608+00:00,B,llm_style,eval,llm_style_eval_038,64,4096,8192,bf16,NVIDIA GeForce RTX 4060,c06,64,128,32,4,3,8,0.0,0.0,1617.2639727592468,1682.0579373836517,2.655699606460823,1,3,3,1_3_3,0,
2026-03-02T09:22:14.636731+00:00,B,llm_style,eval,llm_style_eval_039,4,1024,2048,bf16,NVIDIA GeForce RTX 4060,c00,32,32,32,2,2,8,0.0,0.0,142.33599603176117,372.82816290855396,0.11787050688327846,0,3,3,0_3_3,0,
2026-03-02T09:22:14.700863+00:00,B,llm_style,eval,llm_style_eval_040,64,8192,1024,bf16,NVIDIA GeForce RTX 4060,c06,64,128,32,4,3,8,0.0,0.0,349.96800124645233,737.7101123332966,3.0681142852367693,1,3,3,1_3_3,0,
2026-03-02T09:22:14.715804+00:00,B,llm_style,eval,llm_style_eval_041,2,2048,1024,bf16,NVIDIA GeForce RTX 4060,c00,32,32,32,2,2,8,0.0,0.0,93.18400174379349,163.7724755704402,0.09002197633735688,0,3,3,0_3_3,0,
2026-03-02T09:22:14.766181+00:00,B,llm_style,eval,llm_style_eval_042,2,4096,2048,bf16,NVIDIA GeForce RTX 4060,c00,32,32,32,2,2,8,0.0,0.0,215.03999829292297,284.69248682260513,0.1560380964767906,0,3,3,0_3_3,0,
2026-03-02T09:22:14.780194+00:00,B,llm_style,eval,llm_style_eval_043,1,2048,1024,bf16,NVIDIA GeForce RTX 4060,c00,32,32,32,2,2,8,0.0,0.0,82.84799754619598,154.68544006347656,0.050626498216342034,0,3,3,0_3_3,0,
2026-03-02T09:22:14.885642+00:00,B,llm_style,eval,llm_style_eval_044,8,2048,8192,bf16,NVIDIA GeForce RTX 4060,c00,32,32,32,2,2,8,0.0,0.0,525.3120064735413,572.1971082687377,0.5110019430205437,0,3,3,0_3_3,0,
2026-03-02T09:22:14.937956+00:00,B,llm_style,eval,llm_style_eval_045,1,8192,1024,bf16,NVIDIA GeForce RTX 4060,c00,32,32,32,2,2,8,0.0,0.0,181.05600029230118,294.5516899228095,0.0926631316991122,0,3,3,0_3_3,0,
2026-03-02T09:22:14.969972+00:00,B,llm_style,eval,llm_style_eval_046,64,4096,1024,bf16,NVIDIA GeForce RTX 4060,c06,64,128,32,4,3,8,0.0,0.0,196.60800695419312,235.20256131887433,2.730666570080655,1,3,3,1_3_3,0,
2026-03-02T09:22:14.992611+00:00,B,llm_style,eval,llm_style_eval_047,16,2048,2048,bf16,NVIDIA GeForce RTX 4060,c00,32,32,32,2,2,8,0.0,0.0,138.65599781274796,249.59999874234194,0.9679907837903864,0,3,3,0_3_3,0,
2026-03-02T09:22:15.229820+00:00,B,llm_style,eval,llm_style_eval_048,8,8192,4096,bf16,NVIDIA GeForce RTX 4060,c00,32,32,32,2,2,8,0.0,0.0,627.7120113372803,779.1961503028868,0.8552822031495748,0,3,3,0_3_3,0,
2026-03-02T09:22:15.411192+00:00,B,llm_style,eval,llm_style_eval_049,4,4096,8192,bf16,NVIDIA GeForce RTX 4060,c00,32,32,32,2,2,8,0.0,0.0,661.5039706230164,673.763512969017,0.40579568365581037,0,3,3,0_3_3,0,
2026-03-02T09:22:15.523184+00:00,B,llm_style,eval,llm_style_eval_050,4,2048,8192,bf16,NVIDIA GeForce RTX 4060,c00,32,32,32,2,2,8,0.0,0.0,523.7759947776794,618.7929570674894,0.25625024693422555,0,3,3,0_3_3,0,
2026-03-02T09:22:15.538273+00:00,B,llm_style,eval,llm_style_eval_051,16,1024,1024,bf16,NVIDIA GeForce RTX 4060,c00,32,32,32,2,2,8,0.0,0.0,84.99199897050858,174.8969617486,0.3947951855049682,0,3,3,0_3_3,0,
2026-03-02T09:22:15.727835+00:00,B,llm_style,eval,llm_style_eval_052,32,8192,4096,bf16,NVIDIA GeForce RTX 4060,c00,32,32,32,2,2,8,0.0,0.0,733.5839867591858,847.8563350439072,2.9273862117507705,0,3,3,0_3_3,0,
2026-03-02T09:22:15.749002+00:00,B,llm_style,eval,llm_style_eval_053,32,1024,2048,bf16,NVIDIA GeForce RTX 4060,c00,32,32,32,2,2,8,0.0,0.0,147.40800112485886,226.7996744811535,0.9105186080524468,0,3,3,0_3_3,0,
2026-03-02T09:22:15.863864+00:00,B,llm_style,eval,llm_style_eval_054,64,8192,2048,bf16,NVIDIA GeForce RTX 4060,c06,64,128,32,4,3,8,0.0,0.0,576.5119791030884,610.2118337154388,3.7249592824436353,1,3,3,1_3_3,0,
2026-03-02T09:22:15.885640+00:00,B,llm_style,eval,llm_style_eval_055,1,4096,1024,bf16,NVIDIA GeForce RTX 4060,c00,32,32,32,2,2,8,0.0,0.0,109.55199971795082,129.1046383976936,0.07657192950924721,0,3,3,0_3_3,0,
2026-03-02T09:22:15.909472+00:00,B,llm_style,eval,llm_style_eval_056,4,2048,2048,bf16,NVIDIA GeForce RTX 4060,c00,32,32,32,2,2,8,0.0,0.0,159.231998026371,257.3728069663048,0.21072669071478287,0,3,3,0_3_3,0,
2026-03-02T09:22:15.974801+00:00,B,llm_style,eval,llm_style_eval_057,16,1024,8192,bf16,NVIDIA GeForce RTX 4060,c00,32,32,32,2,2,8,0.0,0.0,421.88799381256104,433.694728910923,0.6362718539918018,0,3,3,0_3_3,0,
2026-03-02T09:22:16.155172+00:00,B,llm_style,eval,llm_style_eval_058,1,8192,4096,bf16,NVIDIA GeForce RTX 4060,c00,32,32,32,2,2,8,0.0,0.0,620.5120086669922,738.2755273580551,0.10815079009375798,0,3,3,0_3_3,0,
2026-03-02T09:22:16.178453+00:00,B,llm_style,eval,llm_style_eval_059,8,4096,1024,bf16,NVIDIA GeForce RTX 4060,c00,32,32,32,2,2,8,0.0,0.0,118.78400295972824,187.74015635251993,0.5649655031641942,0,3,3,0_3_3,0,
2026-03-02T09:22:16.364020+00:00,B,llm_style,eval,llm_style_eval_060,4,8192,4096,bf16,NVIDIA GeForce RTX 4060,c00,32,32,32,2,2,8,0.0,0.0,646.6559767723083,666.7878496646881,0.41511323739688843,0,3,3,0_3_3,0,
2026-03-02T09:22:16.393207+00:00,B,llm_style,eval,llm_style_eval_061,32,2048,2048,bf16,NVIDIA GeForce RTX 4060,c00,32,32,32,2,2,8,0.0,0.0,171.00800573825836,243.8358432054519,1.5697244982253187,0,3,3,0_3_3,0,
2026-03-02T09:22:16.408643+00:00,B,llm_style,eval,llm_style_eval_062,8,2048,1024,bf16,NVIDIA GeForce RTX 4060,c00,32,32,32,2,2,8,0.0,0.0,110.35199835896492,208.5254389047622,0.3040672801488426,0,3,3,0_3_3,0,
2026-03-02T09:22:16.596798+00:00,B,llm_style,eval,llm_style_eval_063,16,4096,8192,bf16,NVIDIA GeForce RTX 4060,c00,32,32,32,2,2,8,0.0,0.0,780.2879810333252,859.7606509923933,1.3760840229501647,0,3,3,0_3_3,0,
2026-03-02T09:22:16.791685+00:00,B,training_style,tune,training_style_tune_000,4096,2048,1024,bf16,NVIDIA GeForce RTX 4060,c06,64,128,32,4,3,8,0.0,0.0,673.7120151519775,4555.2162075042725,25.500315858437713,3,3,3,3_3_3,0,
2026-03-02T09:22:16.836065+00:00,B,training_style,tune,training_style_tune_001,1536,2048,1536,bf16,NVIDIA GeForce RTX 4060,c06,64,128,32,4,3,8,0.0,0.0,357.37600922584534,477.69438952207565,27.04064113574282,3,3,3,3_3_3,0,
2026-03-02T09:22:17.033740+00:00,B,training_style,tune,training_style_tune_002,3072,2048,4096,bf16,NVIDIA GeForce RTX 4060,c06,64,128,32,4,3,8,0.0,0.0,1709.0719938278198,1788.2009208202362,30.15648711004058,3,3,3,3_3_3,0,
2026-03-02T09:22:17.096787+00:00,B,training_style,tune,training_style_tune_003,2048,1536,2048,bf16,NVIDIA GeForce RTX 4060,c06,64,128,32,4,3,8,0.0,0.0,455.1680088043213,564.7375816106796,28.308012950750403,3,3,3,3_3_3,0,
2026-03-02T09:22:17.108508+00:00,B,training_style,tune,training_style_tune_004,512,512,1024,bf16,NVIDIA GeForce RTX 4060,c00,32,32,32,2,2,8,0.0,0.0,59.36000123620033,164.89888146519644,9.044321105448235,2,2,3,2_2_3,0,
2026-03-02T09:22:17.134187+00:00,B,training_style,tune,training_style_tune_005,1024,1536,1536,bf16,NVIDIA GeForce RTX 4060,c06,64,128,32,4,3,8,0.0,0.0,184.67199802398682,191.2332758307457,26.164433480447848,3,3,3,3_3_3,0,
2026-03-02T09:22:17.145203+00:00,B,training_style,tune,training_style_tune_006,1024,1536,512,bf16,NVIDIA GeForce RTX 4060,c06,64,128,32,4,3,8,0.0,0.0,83.80799740552902,94.28992211818692,19.217888338347812,3,3,2,3_3_2,0,
2026-03-02T09:22:17.160861+00:00,B,training_style,tune,training_style_tune_007,2048,1536,512,bf16,NVIDIA GeForce RTX 4060,c06,64,128,32,4,3,8,0.0,0.0,143.15199851989746,210.30912399291987,22.502134132289214,3,3,2,3_3_2,0,
2026-03-02T09:22:17.243924+00:00,B,training_style,tune,training_style_tune_008,3072,3072,1536,bf16,NVIDIA GeForce RTX 4060,c06,64,128,32,4,3,8,0.0,0.0,879.6160221099854,990.3037166595457,32.958732582493845,3,3,3,3_3_3,0,
2026-03-02T09:22:17.262715+00:00,B,training_style,tune,training_style_tune_009,1024,1536,1024,bf16,NVIDIA GeForce RTX 4060,c06,64,128,32,4,3,8,0.0,0.0,125.95200538635254,233.86111691594115,25.575023296524932,3,3,3,3_3_3,0,
2026-03-02T09:22:17.359407+00:00,B,training_style,tune,training_style_tune_010,1536,2048,4096,bf16,NVIDIA GeForce RTX 4060,c06,64,128,32,4,3,8,0.0,0.0,782.1599841117859,899.4713473320005,32.94697286932157,3,3,3,3_3_3,0,
2026-03-02T09:22:17.418324+00:00,B,training_style,tune,training_style_tune_011,1024,1024,4096,bf16,NVIDIA GeForce RTX 4060,c06,64,128,32,4,3,8,0.0,0.0,335.87199449539185,473.2908639311789,25.57502480939313,3,3,3,3_3_3,0,
2026-03-02T09:22:17.744834+00:00,B,training_style,tune,training_style_tune_012,3072,4096,4096,bf16,NVIDIA GeForce RTX 4060,c06,64,128,32,4,3,8,0.0,0.0,3184.432029724121,3236.259799003601,32.36973317120231,3,3,3,3_3_3,0,
2026-03-02T09:22:17.780415+00:00,B,training_style,tune,training_style_tune_013,512,1024,3072,bf16,NVIDIA GeForce RTX 4060,c10,64,128,64,8,3,8,0.0,0.0,144.3839967250824,419.37406837940154,22.31012816561275,2,3,3,2_3_3,0,
2026-03-02T09:22:17.803116+00:00,B,training_style,tune,training_style_tune_014,1536,1024,1024,bf16,NVIDIA GeForce RTX 4060,c06,64,128,32,4,3,8,0.0,0.0,132.06399977207184,289.6208037436006,24.391397182877135,3,3,3,3_3_3,0,
2026-03-02T09:22:17.866083+00:00,B,training_style,tune,training_style_tune_015,2048,3072,1536,bf16,NVIDIA GeForce RTX 4060,c06,64,128,32,4,3,8,0.0,0.0,595.3920185565948,736.2281364202499,32.4615584852064,3,3,3,3_3_3,0,
2026-03-02T09:22:17.982811+00:00,B,training_style,tune,training_style_tune_016,1536,3072,3072,bf16,NVIDIA GeForce RTX 4060,c06,64,128,32,4,3,8,0.0,0.0,876.0319948196411,943.9231985807418,33.093573544615474,3,3,3,3_3_3,0,
2026-03-02T09:22:18.007595+00:00,B,training_style,tune,training_style_tune_017,1024,1024,2048,bf16,NVIDIA GeForce RTX 4060,c06,64,128,32,4,3,8,0.0,0.0,172.04800248146057,186.84319585561752,24.96377309851542,3,3,3,3_3_3,0,
2026-03-02T09:22:18.040489+00:00,B,training_style,tune,training_style_tune_018,1536,1536,1536,bf16,NVIDIA GeForce RTX 4060,c06,64,128,32,4,3,8,0.0,0.0,220.15999257564545,291.33281141519535,32.92041041248546,3,3,3,3_3_3,0,
2026-03-02T09:22:18.081605+00:00,B,training_style,tune,training_style_tune_019,1536,1536,2048,bf16,NVIDIA GeForce RTX 4060,c06,64,128,32,4,3,8,0.0,0.0,289.792001247406,383.7644791603088,33.34693978578714,3,3,3,3_3_3,0,
2026-03-02T09:22:18.104859+00:00,B,training_style,tune,training_style_tune_020,1536,1536,1024,bf16,NVIDIA GeForce RTX 4060,c06,64,128,32,4,3,8,0.0,0.0,174.0799993276596,194.09920245409012,27.756423636614,3,3,3,3_3_3,0,
2026-03-02T09:22:18.134007+00:00,B,training_style,tune,training_style_tune_021,1024,2048,1536,bf16,NVIDIA GeForce RTX 4060,c06,64,128,32,4,3,8,0.0,0.0,227.79199481010437,249.2447970807552,28.282165707230668,3,3,3,3_3_3,0,
2026-03-02T09:22:18.148980+00:00,B,training_style,tune,training_style_tune_022,512,1024,1536,bf16,NVIDIA GeForce RTX 4060,c10,64,128,64,8,3,8,0.0,0.0,90.11200070381165,173.54623839259136,17.873454405855544,2,3,3,2_3_3,0,
2026-03-02T09:22:18.197240+00:00,B,training_style,tune,training_style_tune_023,1536,2048,2048,bf16,NVIDIA GeForce RTX 4060,c06,64,128,32,4,3,8,0.0,0.0,405.34399449825287,458.0579137802123,31.78757317953933,3,3,3,3_3_3,0,
2026-03-02T09:22:18.215720+00:00,B,training_style,tune,training_style_tune_024,1024,1024,1024,bf16,NVIDIA GeForce RTX 4060,c06,64,128,32,4,3,8,0.0,0.0,103.42399775981903,176.76096364855763,20.763881637867925,3,3,3,3_3_3,0,
2026-03-02T09:22:18.277158+00:00,B,training_style,tune,training_style_tune_025,1536,1024,4096,bf16,NVIDIA GeForce RTX 4060,c06,64,128,32,4,3,8,0.0,0.0,406.0159921646118,469.6063947677611,31.734961520372945,3,3,3,3_3_3,0,
2026-03-02T09:22:18.308792+00:00,B,training_style,tune,training_style_tune_026,2048,4096,512,bf16,NVIDIA GeForce RTX 4060,c06,64,128,32,4,3,8,0.0,0.0,285.0559949874878,383.20127546787256,30.13420079930978,3,3,2,3_3_2,0,
2026-03-02T09:22:18.458173+00:00,B,training_style,tune,training_style_tune_027,4096,4096,1536,bf16,NVIDIA GeForce RTX 4060,c06,64,128,32,4,3,8,0.0,0.0,1595.039963722229,1685.042564868927,32.3124239669367,3,3,3,3_3_3,0,
2026-03-02T09:22:18.542772+00:00,B,training_style,tune,training_style_tune_028,1536,1536,4096,bf16,NVIDIA GeForce RTX 4060,c06,64,128,32,4,3,8,0.0,0.0,568.3199763298035,686.9872164726256,34.00787168667829,3,3,3,3_3_3,0,
2026-03-02T09:22:18.654771+00:00,B,training_style,tune,training_style_tune_029,4096,2048,2048,bf16,NVIDIA GeForce RTX 4060,c06,64,128,32,4,3,8,0.0,0.0,1044.3519949913025,1184.9728214740753,32.90053404674748,3,3,3,3_3_3,0,
2026-03-02T09:22:18.682069+00:00,B,training_style,tune,training_style_tune_030,2048,2048,512,bf16,NVIDIA GeForce RTX 4060,c06,64,128,32,4,3,8,0.0,0.0,162.30399906635284,191.98176503181458,26.462485956640776,3,3,2,3_3_2,0,
2026-03-02T09:22:18.694137+00:00,B,training_style,tune,training_style_tune_031,512,512,1536,bf16,NVIDIA GeForce RTX 4060,c00,32,32,32,2,2,8,0.0,0.0,72.7040022611618,117.87263870239245,11.076506697763895,2,2,3,2_2_3,0,
2026-03-02T09:22:18.773103+00:00,B,training_style,eval,training_style_eval_000,2048,1536,3072,bf16,NVIDIA GeForce RTX 4060,c06,64,128,32,4,3,8,0.0,0.0,591.7919874191284,696.8569606542587,32.659030948169416,3,3,3,3_3_3,0,
2026-03-02T09:22:18.810906+00:00,B,training_style,eval,training_style_eval_001,1024,2048,2048,bf16,NVIDIA GeForce RTX 4060,c06,64,128,32,4,3,8,0.0,0.0,290.8160090446472,372.14209407567967,29.53735119403705,3,3,3,3_3_3,0,
2026-03-02T09:22:18.859127+00:00,B,training_style,eval,training_style_eval_002,1536,1024,3072,bf16,NVIDIA GeForce RTX 4060,c06,64,128,32,4,3,8,0.0,0.0,313.6640042066574,373.89728307724,30.809006728209372,3,3,3,3_3_3,0,
2026-03-02T09:22:18.871805+00:00,B,training_style,eval,training_style_eval_003,1024,512,1024,bf16,NVIDIA GeForce RTX 4060,c06,64,128,32,4,3,8,0.0,0.0,83.3280012011528,266.56639322638506,12.885726388756163,3,2,3,3_2_3,0,
2026-03-02T09:22:18.895435+00:00,B,training_style,eval,training_style_eval_004,1024,2048,1024,bf16,NVIDIA GeForce RTX 4060,c06,64,128,32,4,3,8,0.0,0.0,164.8159995675087,257.2383973002433,26.059164809668733,3,3,3,3_3_3,0,
2026-03-02T09:22:18.913693+00:00,B,training_style,eval,training_style_eval_005,1024,512,1536,bf16,NVIDIA GeForce RTX 4060,c06,64,128,32,4,3,8,0.0,0.0,88.41599896550179,203.6838379502296,18.21630423050957,3,2,3,3_2_3,0,
2026-03-02T09:22:18.963652+00:00,B,training_style,eval,training_style_eval_006,2048,1536,2048,bf16,NVIDIA GeForce RTX 4060,c06,64,128,32,4,3,8,0.0,0.0,411.5519970655441,592.7731260657305,31.308077666667085,3,3,3,3_3_3,0,
2026-03-02T09:22:18.990766+00:00,B,training_style,eval,training_style_eval_007,1536,2048,1024,bf16,NVIDIA GeForce RTX 4060,c06,64,128,32,4,3,8,0.0,0.0,220.47999501228333,278.12864124774933,29.220115610221598,3,3,3,3_3_3,0,
2026-03-02T09:22:19.008094+00:00,B,training_style,eval,training_style_eval_008,512,512,2048,bf16,NVIDIA GeForce RTX 4060,c00,32,32,32,2,2,8,0.0,0.0,81.69599995017052,163.27551886439323,13.143138276719984,2,2,3,2_2_3,0,
2026-03-02T09:22:19.024873+00:00,B,training_style,eval,training_style_eval_009,1024,512,2048,bf16,NVIDIA GeForce RTX 4060,c06,64,128,32,4,3,8,0.0,0.0,104.27199676632881,125.40895611047742,20.595017977956847,3,2,3,3_2_3,0,
2026-03-02T09:22:19.065813+00:00,B,training_style,eval,training_style_eval_010,2048,3072,1024,bf16,NVIDIA GeForce RTX 4060,c06,64,128,32,4,3,8,0.0,0.0,406.43200278282166,467.5584089756011,31.702478642866843,3,3,3,3_3_3,0,
2026-03-02T09:22:19.142349+00:00,B,training_style,eval,training_style_eval_011,2048,4096,1536,bf16,NVIDIA GeForce RTX 4060,c06,64,128,32,4,3,8,0.0,0.0,802.3039996623993,884.2153680324554,32.119749853975115,3,3,3,3_3_3,0,
2026-03-02T09:22:19.272939+00:00,B,training_style,eval,training_style_eval_012,2048,3072,3072,bf16,NVIDIA GeForce RTX 4060,c06,64,128,32,4,3,8,0.0,0.0,1162.7520322799683,1302.609944343567,33.24415231354564,3,3,3,3_3_3,0,
2026-03-02T09:22:19.339511+00:00,B,training_style,eval,training_style_eval_013,3072,1536,1536,bf16,NVIDIA GeForce RTX 4060,c06,64,128,32,4,3,8,0.0,0.0,453.6319971084595,680.8188968896864,31.954347833480202,3,3,3,3_3_3,0,
2026-03-02T09:22:19.377934+00:00,B,training_style,eval,training_style_eval_014,2048,1536,1536,bf16,NVIDIA GeForce RTX 4060,c06,64,128,32,4,3,8,0.0,0.0,313.85600566864014,397.8329488635063,30.790159313384695,3,3,3,3_3_3,0,
2026-03-02T09:22:19.434564+00:00,B,training_style,eval,training_style_eval_015,4096,2048,1024,bf16,NVIDIA GeForce RTX 4060,c06,64,128,32,4,3,8,0.0,0.0,521.15198969841,622.8444874286649,32.9651800695263,3,3,3,3_3_3,0,
2026-03-02T09:22:19.448774+00:00,B,training_style,eval,training_style_eval_016,2048,1024,512,bf16,NVIDIA GeForce RTX 4060,c06,64,128,32,4,3,8,0.0,0.0,101.6319990158081,198.0726394057274,21.12999516683692,3,3,2,3_3_2,0,
2026-03-02T09:22:19.566406+00:00,B,training_style,eval,training_style_eval_017,2048,4096,2048,bf16,NVIDIA GeForce RTX 4060,c06,64,128,32,4,3,8,0.0,0.0,1028.0959606170654,1221.0067677497864,33.42075028422173,3,3,3,3_3_3,0,
2026-03-02T09:22:19.640418+00:00,B,training_style,eval,training_style_eval_018,1536,2048,3072,bf16,NVIDIA GeForce RTX 4060,c06,64,128,32,4,3,8,0.0,0.0,600.383996963501,716.6329544782639,32.19165222549221,3,3,3,3_3_3,0,
2026-03-02T09:22:19.707901+00:00,B,training_style,eval,training_style_eval_019,1536,1536,3072,bf16,NVIDIA GeForce RTX 4060,c06,64,128,32,4,3,8,0.0,0.0,431.08800053596497,595.2927917242049,33.625418953851536,3,3,3,3_3_3,0,
2026-03-02T09:22:19.776816+00:00,B,training_style,eval,training_style_eval_020,3072,1536,2048,bf16,NVIDIA GeForce RTX 4060,c06,64,128,32,4,3,8,0.0,0.0,579.4560015201569,662.5014585256574,33.35430607551949,3,3,3,3_3_3,0,
2026-03-02T09:22:19.865942+00:00,B,training_style,eval,training_style_eval_021,2048,1024,4096,bf16,NVIDIA GeForce RTX 4060,c06,64,128,32,4,3,8,0.0,0.0,549.888014793396,688.2201504707335,31.242487055214,3,3,3,3_3_3,0,
2026-03-02T09:22:19.877902+00:00,B,training_style,eval,training_style_eval_022,512,512,1536,bf16,NVIDIA GeForce RTX 4060,c00,32,32,32,2,2,8,0.0,0.0,67.05600023269653,168.3382400870322,12.009460230336439,2,2,3,2_2_3,0,
2026-03-02T09:22:20.207411+00:00,B,training_style,eval,training_style_eval_023,3072,4096,4096,bf16,NVIDIA GeForce RTX 4060,c06,64,128,32,4,3,8,0.0,0.0,3215.8719301223755,3353.190417289734,32.05327119481324,3,3,3,3_3_3,0,
2026-03-02T09:22:20.278967+00:00,B,training_style,eval,training_style_eval_024,1536,1024,4096,bf16,NVIDIA GeForce RTX 4060,c06,64,128,32,4,3,8,0.0,0.0,396.64000272750854,473.3849519491194,32.485129587022314,3,3,3,3_3_3,0,
2026-03-02T09:22:20.430594+00:00,B,training_style,eval,training_style_eval_025,4096,3072,2048,bf16,NVIDIA GeForce RTX 4060,c06,64,128,32,4,3,8,0.0,0.0,1546.239972114563,1677.7216172218323,33.33221781966801,3,3,3,3_3_3,0,
2026-03-02T09:22:20.446599+00:00,B,training_style,eval,training_style_eval_026,1024,512,512,bf16,NVIDIA GeForce RTX 4060,c11,32,128,32,4,2,8,0.0,0.0,73.72800260782242,144.73696038126937,7.281777520215079,3,2,2,3_2_2,0,
2026-03-02T09:22:20.503563+00:00,B,training_style,eval,training_style_eval_027,2048,4096,1024,bf16,NVIDIA GeForce RTX 4060,c06,64,128,32,4,3,8,0.0,0.0,510.97601652145386,542.0223993062973,33.62167426360742,3,3,3,3_3_3,0,
2026-03-02T09:22:20.525871+00:00,B,training_style,eval,training_style_eval_028,1536,1536,1024,bf16,NVIDIA GeForce RTX 4060,c06,64,128,32,4,3,8,0.0,0.0,170.30400037765503,242.33984738588322,28.37184210168423,3,3,3,3_3_3,0,
2026-03-02T09:22:20.555732+00:00,B,training_style,eval,training_style_eval_029,1024,512,4096,bf16,NVIDIA GeForce RTX 4060,c06,64,128,32,4,3,8,0.0,0.0,170.75199633836746,183.81823897361755,25.15324791570202,3,2,3,3_2_3,0,
2026-03-02T09:22:20.590435+00:00,B,training_style,eval,training_style_eval_030,1024,1024,3072,bf16,NVIDIA GeForce RTX 4060,c06,64,128,32,4,3,8,0.0,0.0,219.13599967956543,242.68800020217896,29.3993271457933,3,3,3,3_3_3,0,
2026-03-02T09:22:20.599908+00:00,B,training_style,eval,training_style_eval_031,1024,1024,512,bf16,NVIDIA GeForce RTX 4060,c06,64,128,32,4,3,8,0.0,0.0,67.07200035452843,139.73311811685562,16.008793808510667,3,3,2,3_3_2,0,
2026-03-02T09:22:20.609860+00:00,B,training_style,eval,training_style_eval_032,512,1024,1024,bf16,NVIDIA GeForce RTX 4060,c10,64,128,64,8,3,8,0.0,0.0,60.75200065970421,123.44543971121307,17.674180477025757,2,3,3,2_3_3,0,
2026-03-02T09:22:20.691376+00:00,B,training_style,eval,training_style_eval_033,3072,2048,2048,bf16,NVIDIA GeForce RTX 4060,c06,64,128,32,4,3,8,0.0,0.0,803.3280074596405,930.1279932260513,32.07880658548393,3,3,3,3_3_3,0,
2026-03-02T09:22:20.703767+00:00,B,training_style,eval,training_style_eval_034,1536,1024,512,bf16,NVIDIA GeForce RTX 4060,c06,64,128,32,4,3,8,0.0,0.0,81.53599873185158,233.30816432833655,19.753394341766043,3,3,2,3_3_2,0,
2026-03-02T09:22:21.101914+00:00,B,training_style,eval,training_style_eval_035,4096,4096,4096,bf16,NVIDIA GeForce RTX 4060,c06,64,128,32,4,3,8,0.0,0.0,4221.823930740356,4324.927668571472,32.55440201360982,3,3,3,3_3_3,0,
2026-03-02T09:22:21.342045+00:00,B,training_style,eval,training_style_eval_036,2048,4096,4096,bf16,NVIDIA GeForce RTX 4060,c06,64,128,32,4,3,8,0.0,0.0,2129.90403175354,2234.431641101837,32.26411881075392,3,3,3,3_3_3,0,
2026-03-02T09:22:21.380155+00:00,B,training_style,eval,training_style_eval_037,4096,2048,512,bf16,NVIDIA GeForce RTX 4060,c06,64,128,32,4,3,8,0.0,0.0,291.6959971189499,372.1728101372717,29.448242954452112,3,3,2,3_3_2,0,
2026-03-02T09:22:21.401780+00:00,B,training_style,eval,training_style_eval_038,2048,1536,512,bf16,NVIDIA GeForce RTX 4060,c06,64,128,32,4,3,8,0.0,0.0,133.12000036239624,235.6374397873878,24.19790762643306,3,3,2,3_3_2,0,
2026-03-02T09:22:21.489790+00:00,B,training_style,eval,training_style_eval_039,3072,3072,1536,bf16,NVIDIA GeForce RTX 4060,c06,64,128,32,4,3,8,0.0,0.0,852.3359894752502,1067.3849326372144,34.01361623348632,3,3,3,3_3_3,0,
2026-03-02T09:22:21.503869+00:00,B,training_style,eval,training_style_eval_040,1536,1536,512,bf16,NVIDIA GeForce RTX 4060,c06,64,128,32,4,3,8,0.0,0.0,101.3759970664978,166.35903656482685,23.831273416874733,3,3,2,3_3_2,0,
2026-03-02T09:22:21.618555+00:00,B,training_style,eval,training_style_eval_041,3072,3072,2048,bf16,NVIDIA GeForce RTX 4060,c06,64,128,32,4,3,8,0.0,0.0,1133.936047554016,1285.1657962799072,34.08896449440959,3,3,3,3_3_3,0,
2026-03-02T09:22:21.730334+00:00,B,training_style,eval,training_style_eval_042,3072,4096,1536,bf16,NVIDIA GeForce RTX 4060,c06,64,128,32,4,3,8,0.0,0.0,1146.3679671287537,1308.851821422577,33.71928278911732,3,3,3,3_3_3,0,
2026-03-02T09:22:21.793968+00:00,B,training_style,eval,training_style_eval_043,2048,3072,1536,bf16,NVIDIA GeForce RTX 4060,c06,64,128,32,4,3,8,0.0,0.0,573.4400153160095,742.2054266929625,33.70422767122232,3,3,3,3_3_3,0,
2026-03-02T09:22:21.818068+00:00,B,training_style,eval,training_style_eval_044,512,512,4096,bf16,NVIDIA GeForce RTX 4060,c00,32,32,32,2,2,8,0.0,0.0,136.1599937081337,229.29728046059603,15.771766651247408,2,2,3,2_2_3,0,
2026-03-02T09:22:21.877787+00:00,B,training_style,eval,training_style_eval_045,2048,1024,3072,bf16,NVIDIA GeForce RTX 4060,c06,64,128,32,4,3,8,0.0,0.0,413.10401260852814,530.4524660110474,31.19045444908371,3,3,3,3_3_3,0,
2026-03-02T09:22:22.198718+00:00,B,training_style,eval,training_style_eval_046,4096,3072,4096,bf16,NVIDIA GeForce RTX 4060,c06,64,128,32,4,3,8,0.0,0.0,3188.7359619140625,3281.5494298934937,32.32604277530898,3,3,3,3_3_3,0,
2026-03-02T09:22:22.242736+00:00,B,training_style,eval,training_style_eval_047,1536,3072,1024,bf16,NVIDIA GeForce RTX 4060,c06,64,128,32,4,3,8,0.0,0.0,322.1279978752136,391.8595245480536,29.99949237490225,3,3,3,3_3_3,0,
2026-03-02T09:22:22.262117+00:00,B,training_style,eval,training_style_eval_048,512,512,3072,bf16,NVIDIA GeForce RTX 4060,c00,32,32,32,2,2,8,0.0,0.0,112.62400075793266,123.3779240399599,14.300794903048732,2,2,3,2_2_3,0,
2026-03-02T09:22:22.292833+00:00,B,training_style,eval,training_style_eval_049,512,1024,4096,bf16,NVIDIA GeForce RTX 4060,c10,64,128,64,8,3,8,0.0,0.0,153.60000729560852,209.9507200717925,27.962025338541725,2,3,3,2_3_3,0,
2026-03-02T09:22:22.315652+00:00,B,training_style,eval,training_style_eval_050,3072,2048,512,bf16,NVIDIA GeForce RTX 4060,c06,64,128,32,4,3,8,0.0,0.0,215.93599766492844,273.4864059090614,29.83500210093206,3,3,2,3_3_2,0,
2026-03-02T09:22:22.324134+00:00,B,training_style,eval,training_style_eval_051,512,512,1024,bf16,NVIDIA GeForce RTX 4060,c00,32,32,32,2,2,8,0.0,0.0,55.1999993622303,88.45311999320975,9.72592243121193,2,2,3,2_2_3,0,
2026-03-02T09:22:22.362434+00:00,B,training_style,eval,training_style_eval_052,1536,2048,1536,bf16,NVIDIA GeForce RTX 4060,c06,64,128,32,4,3,8,0.0,0.0,319.487988948822,396.3420760631561,30.247385661650025,3,3,3,3_3_3,0,
2026-03-02T09:22:22.475852+00:00,B,training_style,eval,training_style_eval_053,1536,3072,3072,bf16,NVIDIA GeForce RTX 4060,c06,64,128,32,4,3,8,0.0,0.0,874.4640052318573,940.0857645273209,33.152913184017514,3,3,3,3_3_3,0,
2026-03-02T09:22:22.526556+00:00,B,training_style,eval,training_style_eval_054,4096,3072,512,bf16,NVIDIA GeForce RTX 4060,c06,64,128,32,4,3,8,0.0,0.0,415.5520051717758,530.372810959816,31.006713305772152,3,3,2,3_3_2,0,
2026-03-02T09:22:22.542202+00:00,B,training_style,eval,training_style_eval_055,1024,1024,1024,bf16,NVIDIA GeForce RTX 4060,c06,64,128,32,4,3,8,0.0,0.0,103.42399775981903,245.8096040785312,20.763881637867925,3,3,3,3_3_3,0,
2026-03-02T09:22:22.569416+00:00,B,training_style,eval,training_style_eval_056,512,1024,3072,bf16,NVIDIA GeForce RTX 4060,c10,64,128,64,8,3,8,0.0,0.0,140.76799899339676,252.2486460208892,22.88322271421293,2,3,3,2_3_3,0,
2026-03-02T09:22:22.587636+00:00,B,training_style,eval,training_style_eval_057,1024,1536,1024,bf16,NVIDIA GeForce RTX 4060,c06,64,128,32,4,3,8,0.0,0.0,136.04800403118134,223.23200106620789,23.67712407792264,3,3,3,3_3_3,0,
2026-03-02T09:22:22.711197+00:00,B,training_style,eval,training_style_eval_058,4096,2048,2048,bf16,NVIDIA GeForce RTX 4060,c06,64,128,32,4,3,8,0.0,0.0,1018.3200240135193,1104.4290840625763,33.74159159964023,3,3,3,3_3_3,0,
2026-03-02T09:22:22.738050+00:00,B,training_style,eval,training_style_eval_059,2048,3072,512,bf16,NVIDIA GeForce RTX 4060,c06,64,128,32,4,3,8,0.0,0.0,225.19999742507935,338.9030352234838,28.60768657931849,3,3,2,3_3_2,0,
2026-03-02T09:22:22.770427+00:00,B,training_style,eval,training_style_eval_060,3072,3072,512,bf16,NVIDIA GeForce RTX 4060,c06,64,128,32,4,3,8,0.0,0.0,321.84000313282013,399.5404806733131,30.02633706789985,3,3,2,3_3_2,0,
2026-03-02T09:22:22.833610+00:00,B,training_style,eval,training_style_eval_061,2048,2048,2048,bf16,NVIDIA GeForce RTX 4060,c06,64,128,32,4,3,8,0.0,0.0,557.0560097694397,687.6390296220779,30.84047004736667,3,3,3,3_3_3,0,
2026-03-02T09:22:22.847862+00:00,B,training_style,eval,training_style_eval_062,1024,2048,512,bf16,NVIDIA GeForce RTX 4060,c06,64,128,32,4,3,8,0.0,0.0,92.6240012049675,158.27967762947083,23.184958758668145,3,3,2,3_3_2,0,
2026-03-02T09:22:22.961614+00:00,B,training_style,eval,training_style_eval_063,3072,1536,3072,bf16,NVIDIA GeForce RTX 4060,c06,64,128,32,4,3,8,0.0,0.0,851.8080115318298,992.3481720685958,34.034698964458705,3,3,3,3_3_3,0,
2026-03-02T09:22:22.970934+00:00,B,adversarial,tune,adversarial_tune_000,1,1024,1024,bf16,NVIDIA GeForce RTX 4060,c00,32,32,32,2,2,8,0.0,0.0,37.88800165057182,112.13824070990086,0.05535134893999744,0,3,3,0_3_3,0,
2026-03-02T09:22:22.989578+00:00,B,adversarial,tune,adversarial_tune_001,1,1024,4096,bf16,NVIDIA GeForce RTX 4060,c00,32,32,32,2,2,8,0.0,0.0,81.80800080299377,158.09183940291402,0.10254019066180403,0,3,3,0_3_3,0,
2026-03-02T09:22:23.008326+00:00,B,adversarial,tune,adversarial_tune_002,1,4096,1024,bf16,NVIDIA GeForce RTX 4060,c00,32,32,32,2,2,8,0.0,0.0,68.22400167584419,136.6367970407009,0.12295684500972508,0,3,3,0_3_3,0,
2026-03-02T09:22:23.103180+00:00,B,adversarial,tune,adversarial_tune_003,1,4096,4096,bf16,NVIDIA GeForce RTX 4060,c00,32,32,32,2,2,8,0.0,0.0,166.9120043516159,266.13984018564213,0.20103066960549118,0,3,3,0_3_3,0,
2026-03-02T09:22:23.143968+00:00,B,adversarial,tune,adversarial_tune_004,1,8192,1024,bf16,NVIDIA GeForce RTX 4060,c00,32,32,32,2,2,8,0.0,0.0,47.61600121855736,141.455355733633,0.3523440770045475,0,3,3,0_3_3,0,
2026-03-02T09:22:23.319240+00:00,B,adversarial,tune,adversarial_tune_005,1,8192,4096,bf16,NVIDIA GeForce RTX 4060,c00,32,32,32,2,2,8,0.0,0.0,294.8320060968399,407.39264965057373,0.2276172959931547,0,3,3,0_3_3,0,
2026-03-02T09:22:23.328693+00:00,B,adversarial,tune,adversarial_tune_006,2,1024,1024,bf16,NVIDIA GeForce RTX 4060,c00,32,32,32,2,2,8,0.0,0.0,15.264000277966261,79.82079889625302,0.2747840620819773,0,3,3,0_3_3,0,
2026-03-02T09:22:23.345992+00:00,B,adversarial,tune,adversarial_tune_007,2,1024,4096,bf16,NVIDIA GeForce RTX 4060,c00,32,32,32,2,2,8,0.0,0.0,55.15199899673462,70.20480118691918,0.3041995993833937,0,3,3,0_3_3,0,
2026-03-02T09:22:23.361573+00:00,B,adversarial,tune,adversarial_tune_008,2,4096,1024,bf16,NVIDIA GeForce RTX 4060,c00,32,32,32,2,2,8,0.0,0.0,39.8080013692379,78.6387173458933,0.42145336170945746,0,3,3,0_3_3,0,
2026-03-02T09:22:23.445118+00:00,B,adversarial,tune,adversarial_tune_009,2,4096,4096,bf16,NVIDIA GeForce RTX 4060,c00,32,32,32,2,2,8,0.0,0.0,166.23999923467636,301.8240012228486,0.40368662361014745,0,3,3,0_3_3,0,
2026-03-02T09:22:23.486886+00:00,B,adversarial,tune,adversarial_tune_010,2,8192,1024,bf16,NVIDIA GeForce RTX 4060,c00,32,32,32,2,2,8,0.0,0.0,47.10400104522705,134.93248082697386,0.7123478102801206,0,3,3,0_3_3,0,
2026-03-02T09:22:23.645415+00:00,B,adversarial,tune,adversarial_tune_011,2,8192,4096,bf16,NVIDIA GeForce RTX 4060,c00,32,32,32,2,2,8,0.0,0.0,294.9120104312897,418.22016298770905,0.45511109501344243,0,3,3,0_3_3,0,
2026-03-02T09:22:23.653675+00:00,B,adversarial,tune,adversarial_tune_012,4,1024,1024,bf16,NVIDIA GeForce RTX 4060,c00,32,32,32,2,2,8,0.0,0.0,35.472000017762184,99.20607849955557,0.23648534043187597,0,3,3,0_3_3,0,
2026-03-02T09:22:23.672514+00:00,B,adversarial,tune,adversarial_tune_013,4,1024,4096,bf16,NVIDIA GeForce RTX 4060,c00,32,32,32,2,2,8,0.0,0.0,56.304000318050385,167.6336005330084,0.5959511191115643,0,3,3,0_3_3,0,
2026-03-02T09:22:23.691927+00:00,B,adversarial,tune,adversarial_tune_014,4,4096,1024,bf16,NVIDIA GeForce RTX 4060,c00,32,32,32,2,2,8,0.0,0.0,69.2799985408783,207.94367939233769,0.48433072613593353,0,3,3,0_3_3,0,
2026-03-02T09:22:23.779297+00:00,B,adversarial,tune,adversarial_tune_015,4,4096,4096,bf16,NVIDIA GeForce RTX 4060,c00,32,32,32,2,2,8,0.0,0.0,161.79199516773224,243.16959977149963,0.8295696450300549,0,3,3,0_3_3,0,
2026-03-02T09:22:23.821135+00:00,B,adversarial,tune,adversarial_tune_016,4,8192,1024,bf16,NVIDIA GeForce RTX 4060,c00,32,32,32,2,2,8,0.0,0.0,44.22399960458279,104.64960090816015,1.5174761351310642,0,3,3,0_3_3,0,
2026-03-02T09:22:23.978933+00:00,B,adversarial,tune,adversarial_tune_017,4,8192,4096,bf16,NVIDIA GeForce RTX 4060,c00,32,32,32,2,2,8,0.0,0.0,297.8079915046692,384.1804751753805,0.9013708955348545,0,3,3,0_3_3,0,
2026-03-02T09:22:23.988966+00:00,B,adversarial,tune,adversarial_tune_018,8,1024,1024,bf16,NVIDIA GeForce RTX 4060,c00,32,32,32,2,2,8,0.0,0.0,51.023999229073524,176.9283206760881,0.32881029032393694,0,3,3,0_3_3,0,
2026-03-02T09:22:24.009711+00:00,B,adversarial,tune,adversarial_tune_019,8,1024,4096,bf16,NVIDIA GeForce RTX 4060,c00,32,32,32,2,2,8,0.0,0.0,81.87199756503105,198.17472368478775,0.8196803057931416,0,3,3,0_3_3,0,
2026-03-02T09:22:24.027788+00:00,B,adversarial,tune,adversarial_tune_020,8,4096,1024,bf16,NVIDIA GeForce RTX 4060,c00,32,32,32,2,2,8,0.0,0.0,53.247999399900436,168.15391734242428,1.2603077065112325,0,3,3,0_3_3,0,
2026-03-02T09:22:24.115094+00:00,B,adversarial,tune,adversarial_tune_021,8,4096,4096,bf16,NVIDIA GeForce RTX 4060,c00,32,32,32,2,2,8,0.0,0.0,161.79199516773224,255.10784298181528,1.6591392900601099,0,3,3,0_3_3,0,
2026-03-02T09:22:24.158920+00:00,B,adversarial,tune,adversarial_tune_022,8,8192,1024,bf16,NVIDIA GeForce RTX 4060,c00,32,32,32,2,2,8,0.0,0.0,54.9280010163784,65.99295951426029,2.4435210733407,0,3,3,0_3_3,0,
2026-03-02T09:22:24.321861+00:00,B,adversarial,tune,adversarial_tune_023,8,8192,4096,bf16,NVIDIA GeForce RTX 4060,c00,32,32,32,2,2,8,0.0,0.0,297.67999053001404,433.94527018070215,1.8035169614326805,0,3,3,0_3_3,0,
2026-03-02T09:22:24.332331+00:00,B,adversarial,tune,adversarial_tune_024,16,1024,1024,bf16,NVIDIA GeForce RTX 4060,c00,32,32,32,2,2,8,0.0,0.0,64.38399851322174,177.55551993846876,0.5211610458320531,0,3,3,0_3_3,0,
2026-03-02T09:22:24.350516+00:00,B,adversarial,tune,adversarial_tune_025,16,1024,4096,bf16,NVIDIA GeForce RTX 4060,c00,32,32,32,2,2,8,0.0,0.0,60.175999999046326,117.20352016389356,2.2304195692988418,0,3,3,0_3_3,0,
2026-03-02T09:22:24.370923+00:00,B,adversarial,tune,adversarial_tune_026,16,4096,1024,bf16,NVIDIA GeForce RTX 4060,c00,32,32,32,2,2,8,0.0,0.0,66.56000018119812,202.95712471008295,2.016492302202755,0,3,3,0_3_3,0,
2026-03-02T09:22:24.457628+00:00,B,adversarial,tune,adversarial_tune_027,16,4096,4096,bf16,NVIDIA GeForce RTX 4060,c00,32,32,32,2,2,8,0.0,0.0,163.13599795103073,273.98592233657826,3.290940802416613,0,3,3,0_3_3,0,
2026-03-02T09:22:24.498556+00:00,B,adversarial,tune,adversarial_tune_028,16,8192,1024,bf16,NVIDIA GeForce RTX 4060,c00,32,32,32,2,2,8,0.0,0.0,58.36800113320351,143.9539238810538,4.5990174545706095,0,3,3,0_3_3,0,
2026-03-02T09:22:24.658266+00:00,B,adversarial,tune,adversarial_tune_029,16,8192,4096,bf16,NVIDIA GeForce RTX 4060,c00,32,32,32,2,2,8,0.0,0.0,295.24800181388855,373.24959814548487,3.6367454390998377,0,3,3,0_3_3,0,
2026-03-02T09:22:24.669476+00:00,B,adversarial,tune,adversarial_tune_030,32,1024,1024,bf16,NVIDIA GeForce RTX 4060,c00,32,32,32,2,2,8,0.0,0.0,36.86400130391121,77.93920021504157,1.8204443800537697,0,3,3,0_3_3,0,
2026-03-02T09:22:24.687103+00:00,B,adversarial,tune,adversarial_tune_031,32,1024,4096,bf16,NVIDIA GeForce RTX 4060,c00,32,32,32,2,2,8,0.0,0.0,41.82399995625019,76.28192335367203,6.418215767999133,0,3,3,0_3_3,0,
2026-03-02T09:22:24.697387+00:00,B,adversarial,eval,adversarial_eval_000,1,1024,1024,bf16,NVIDIA GeForce RTX 4060,c00,32,32,32,2,2,8,0.0,0.0,70.65600156784058,180.36799773573864,0.029681158761671687,0,3,3,0_3_3,0,
2026-03-02T09:22:24.718952+00:00,B,adversarial,eval,adversarial_eval_001,1,1024,4096,bf16,NVIDIA GeForce RTX 4060,c00,32,32,32,2,2,8,0.0,0.0,68.4639997780323,234.6799948811529,0.12252582418784726,0,3,3,0_3_3,0,
2026-03-02T09:22:24.738940+00:00,B,adversarial,eval,adversarial_eval_002,1,4096,1024,bf16,NVIDIA GeForce RTX 4060,c00,32,32,32,2,2,8,0.0,0.0,43.376000598073006,179.38432112336156,0.19339284130249362,0,3,3,0_3_3,0,
2026-03-02T09:22:24.824134+00:00,B,adversarial,eval,adversarial_eval_003,1,4096,4096,bf16,NVIDIA GeForce RTX 4060,c00,32,32,32,2,2,8,0.0,0.0,164.73600268363953,250.15552178025237,0.20368608836793392,0,3,3,0_3_3,0,
2026-03-02T09:22:24.863564+00:00,B,adversarial,eval,adversarial_eval_004,1,8192,1024,bf16,NVIDIA GeForce RTX 4060,c00,32,32,32,2,2,8,0.0,0.0,64.51199948787689,117.34720498323435,0.2600634941279843,0,3,3,0_3_3,0,
2026-03-02T09:22:25.038529+00:00,B,adversarial,eval,adversarial_eval_005,1,8192,4096,bf16,NVIDIA GeForce RTX 4060,c00,32,32,32,2,2,8,0.0,0.0,470.92799842357635,543.8668781518936,0.14250344898720357,0,3,3,0_3_3,0,
2026-03-02T09:22:25.051816+00:00,B,adversarial,eval,adversarial_eval_006,2,1024,1024,bf16,NVIDIA GeForce RTX 4060,c00,32,32,32,2,2,8,0.0,0.0,46.08000069856644,119.70784276723853,0.09102222084233792,0,3,3,0_3_3,0,
2026-03-02T09:22:25.074377+00:00,B,adversarial,eval,adversarial_eval_007,2,1024,4096,bf16,NVIDIA GeForce RTX 4060,c00,32,32,32,2,2,8,0.0,0.0,96.19200229644775,228.12159776687614,0.174413834824806,0,3,3,0_3_3,0,
2026-03-02T09:22:25.093052+00:00,B,adversarial,eval,adversarial_eval_008,2,4096,1024,bf16,NVIDIA GeForce RTX 4060,c00,32,32,32,2,2,8,0.0,0.0,53.247999399900436,117.83648237586009,0.3150769266278081,0,3,3,0_3_3,0,
2026-03-02T09:22:25.181349+00:00,B,adversarial,eval,adversarial_eval_009,2,4096,4096,bf16,NVIDIA GeForce RTX 4060,c00,32,32,32,2,2,8,0.0,0.0,251.90401077270508,313.0163139104842,0.26640649267213473,0,3,3,0_3_3,0,
2026-03-02T09:22:25.226060+00:00,B,adversarial,eval,adversarial_eval_010,2,8192,1024,bf16,NVIDIA GeForce RTX 4060,c00,32,32,32,2,2,8,0.0,0.0,80.76800033450127,160.5161620676517,0.4154421535884766,0,3,3,0_3_3,0,
2026-03-02T09:22:25.415879+00:00,B,adversarial,eval,adversarial_eval_011,2,8192,4096,bf16,NVIDIA GeForce RTX 4060,c00,32,32,32,2,2,8,0.0,0.0,477.183997631073,601.7126309871674,0.28127038766243007,0,3,3,0_3_3,0,
2026-03-02T09:22:25.426544+00:00,B,adversarial,eval,adversarial_eval_012,4,1024,1024,bf16,NVIDIA GeForce RTX 4060,c00,32,32,32,2,2,8,0.0,0.0,68.60800087451935,181.36832073330874,0.12226865515790718,0,3,3,0_3_3,0,
2026-03-02T09:22:25.449178+00:00,B,adversarial,eval,adversarial_eval_013,4,1024,4096,bf16,NVIDIA GeForce RTX 4060,c00,32,32,32,2,2,8,0.0,0.0,106.49599879980087,248.3286371827124,0.3150769266278081,0,3,3,0_3_3,0,
2026-03-02T09:22:25.467451+00:00,B,adversarial,eval,adversarial_eval_014,4,4096,1024,bf16,NVIDIA GeForce RTX 4060,c00,32,32,32,2,2,8,0.0,0.0,59.39200147986412,111.66720040142525,0.5649655031641942,0,3,3,0_3_3,0,
2026-03-02T09:22:25.558004+00:00,B,adversarial,eval,adversarial_eval_015,4,4096,4096,bf16,NVIDIA GeForce RTX 4060,c00,32,32,32,2,2,8,0.0,0.0,253.9519965648651,327.67999172210693,0.5285161361813422,0,3,3,0_3_3,0,
2026-03-02T09:22:25.600217+00:00,B,adversarial,eval,adversarial_eval_016,4,8192,1024,bf16,NVIDIA GeForce RTX 4060,c00,32,32,32,2,2,8,0.0,0.0,79.8719972372055,117.2479984909295,0.8402051572680562,0,3,3,0_3_3,0,
2026-03-02T09:22:25.772141+00:00,B,adversarial,eval,adversarial_eval_017,4,8192,4096,bf16,NVIDIA GeForce RTX 4060,c00,32,32,32,2,2,8,0.0,0.0,472.06398844718933,647.8131264448164,0.5686420963458652,0,3,3,0_3_3,0,
2026-03-02T09:22:25.784225+00:00,B,adversarial,eval,adversarial_eval_018,8,1024,1024,bf16,NVIDIA GeForce RTX 4060,c00,32,32,32,2,2,8,0.0,0.0,52.191998809576035,144.80831995606422,0.3214518773502456,0,3,3,0_3_3,0,
2026-03-02T09:22:25.807483+00:00,B,adversarial,eval,adversarial_eval_019,8,1024,4096,bf16,NVIDIA GeForce RTX 4060,c00,32,32,32,2,2,8,0.0,0.0,102.78400033712387,244.72575694322575,0.6529115794276145,0,3,3,0_3_3,0,
2026-03-02T09:22:25.826113+00:00,B,adversarial,eval,adversarial_eval_020,8,4096,1024,bf16,NVIDIA GeForce RTX 4060,c00,32,32,32,2,2,8,0.0,0.0,58.36800113320351,151.96159914135924,1.1497543636426524,0,3,3,0_3_3,0,
2026-03-02T09:22:25.919948+00:00,B,adversarial,eval,adversarial_eval_021,8,4096,4096,bf16,NVIDIA GeForce RTX 4060,c00,32,32,32,2,2,8,0.0,0.0,253.9519965648651,312.5657540559768,1.0570322723626844,0,3,3,0_3_3,0,
2026-03-02T09:22:25.963447+00:00,B,adversarial,eval,adversarial_eval_022,8,8192,1024,bf16,NVIDIA GeForce RTX 4060,c00,32,32,32,2,2,8,0.0,0.0,59.39200147986412,139.3663950264454,2.259862012656777,0,3,3,0_3_3,0,
2026-03-02T09:22:26.134148+00:00,B,adversarial,eval,adversarial_eval_023,8,8192,4096,bf16,NVIDIA GeForce RTX 4060,c00,32,32,32,2,2,8,0.0,0.0,472.06398844718933,643.4303754568098,1.1372841926917303,0,3,3,0_3_3,0,
2026-03-02T09:22:26.143212+00:00,B,adversarial,eval,adversarial_eval_024,16,1024,1024,bf16,NVIDIA GeForce RTX 4060,c00,32,32,32,2,2,8,0.0,0.0,49.15200173854828,121.94816388189781,0.6826666425201637,0,3,3,0_3_3,0,
2026-03-02T09:22:26.163401+00:00,B,adversarial,eval,adversarial_eval_025,16,1024,4096,bf16,NVIDIA GeForce RTX 4060,c00,32,32,32,2,2,8,0.0,0.0,99.32799637317657,106.49599879980087,1.3512577812980566,0,3,3,0_3_3,0,
2026-03-02T09:22:26.180603+00:00,B,adversarial,eval,adversarial_eval_026,16,4096,1024,bf16,NVIDIA GeForce RTX 4060,c00,32,32,32,2,2,8,0.0,0.0,59.39200147986412,70.49792036414146,2.259862012656777,0,3,3,0_3_3,0,
2026-03-02T09:22:26.270510+00:00,B,adversarial,eval,adversarial_eval_027,16,4096,4096,bf16,NVIDIA GeForce RTX 4060,c00,32,32,32,2,2,8,0.0,0.0,252.9279887676239,341.58590883016575,2.1226235760457772,0,3,3,0_3_3,0,
2026-03-02T09:22:26.314592+00:00,B,adversarial,eval,adversarial_eval_028,16,8192,1024,bf16,NVIDIA GeForce RTX 4060,c00,32,32,32,2,2,8,0.0,0.0,95.23200243711472,186.89023986458778,2.81875261603638,0,3,3,0_3_3,0,
2026-03-02T09:22:26.486997+00:00,B,adversarial,eval,adversarial_eval_029,16,8192,4096,bf16,NVIDIA GeForce RTX 4060,c00,32,32,32,2,2,8,0.0,0.0,476.1599898338318,551.1065489053724,2.2550021986826523,0,3,3,0_3_3,0,
2026-03-02T09:22:26.496877+00:00,B,adversarial,eval,adversarial_eval_030,32,1024,1024,bf16,NVIDIA GeForce RTX 4060,c00,32,32,32,2,2,8,0.0,0.0,53.247999399900436,126.53568193316458,1.2603077065112325,0,3,3,0_3_3,0,
2026-03-02T09:22:26.519097+00:00,B,adversarial,eval,adversarial_eval_031,32,1024,4096,bf16,NVIDIA GeForce RTX 4060,c00,32,32,32,2,2,8,0.0,0.0,114.68800157308578,154.69567626714695,2.340571396467637,0,3,3,0_3_3,0,
2026-03-02T09:22:26.537160+00:00,B,adversarial,eval,adversarial_eval_032,32,4096,1024,bf16,NVIDIA GeForce RTX 4060,c00,32,32,32,2,2,8,0.0,0.0,62.352001667022705,135.33184111118314,4.305161804323799,0,3,3,0_3_3,0,
2026-03-02T09:22:26.634940+00:00,B,adversarial,eval,adversarial_eval_033,32,4096,4096,bf16,NVIDIA GeForce RTX 4060,c00,32,32,32,2,2,8,0.0,0.0,262.14399933815,320.07167279720306,4.096000010341406,0,3,3,0_3_3,0,
2026-03-02T09:22:26.683740+00:00,B,adversarial,eval,adversarial_eval_034,32,8192,1024,bf16,NVIDIA GeForce RTX 4060,c00,32,32,32,2,2,8,0.0,0.0,102.39999741315842,299.5695999264716,5.242880132446292,0,3,3,0_3_3,0,
2026-03-02T09:22:26.855556+00:00,B,adversarial,eval,adversarial_eval_035,32,8192,4096,bf16,NVIDIA GeForce RTX 4060,c00,32,32,32,2,2,8,0.0,0.0,481.79200291633606,601.2348783016205,4.457283713720989,0,3,3,0_3_3,0,
2026-03-02T09:22:29.137659+00:00,B,adversarial,eval,adversarial_eval_036,1024,1,512,bf16,NVIDIA GeForce RTX 4060,c00,32,32,32,2,2,8,0.0,2282.046,50.11200159788132,76.0470394790172,0.02092464811951021,3,0,2,3_0_2,0,
2026-03-02T09:22:29.399513+00:00,B,adversarial,eval,adversarial_eval_037,1024,1,2048,bf16,NVIDIA GeForce RTX 4060,c09,128,64,64,8,3,8,0.0,261.814,90.43199941515923,103.96671794354916,0.04638075047688157,3,0,3,3_0_3,0,
2026-03-02T09:22:29.416333+00:00,B,adversarial,eval,adversarial_eval_038,2048,1,512,bf16,NVIDIA GeForce RTX 4060,c00,32,32,32,2,2,8,0.0,0.0,73.72800260782242,339.8636856675141,0.028444443438340152,3,0,2,3_0_2,0,
2026-03-02T09:22:29.438170+00:00,B,adversarial,eval,adversarial_eval_039,2048,1,2048,bf16,NVIDIA GeForce RTX 4060,c09,128,64,64,8,3,8,0.0,0.0,78.33599671721458,240.61759516596783,0.10708497180781484,3,0,3,3_0_3,0,
2026-03-02T09:22:29.451270+00:00,B,adversarial,eval,adversarial_eval_040,4096,1,512,bf16,NVIDIA GeForce RTX 4060,c00,32,32,32,2,2,8,0.0,0.0,65.2799978852272,173.8687959313392,0.0642509824735942,3,0,2,3_0_2,0,
2026-03-02T09:22:29.500693+00:00,B,adversarial,eval,adversarial_eval_041,4096,1,2048,bf16,NVIDIA GeForce RTX 4060,c09,128,64,64,8,3,8,0.0,0.0,97.28000313043594,188.56352359056459,0.17246315234493367,3,0,3,3_0_3,0,
2026-03-02T09:22:29.631369+00:00,B,adversarial,eval,adversarial_eval_042,1024,2,512,bf16,NVIDIA GeForce RTX 4060,c00,32,32,32,2,2,8,0.0,0.0,39.93599861860275,55.78175954520701,0.052512822329253514,3,0,2,3_0_2,0,
2026-03-02T09:22:29.825526+00:00,B,adversarial,eval,adversarial_eval_043,1024,2,2048,bf16,NVIDIA GeForce RTX 4060,c09,128,64,64,8,3,8,0.0,0.0,93.18400174379349,295.65952658653237,0.09002197633735688,3,0,3,3_0_3,0,
2026-03-02T09:22:29.840136+00:00,B,adversarial,eval,adversarial_eval_044,2048,2,512,bf16,NVIDIA GeForce RTX 4060,c00,32,32,32,2,2,8,0.0,0.0,43.007999658584595,123.29919859766956,0.09752381029799413,3,0,2,3_0_2,0,
2026-03-02T09:22:29.866710+00:00,B,adversarial,eval,adversarial_eval_045,2048,2,2048,bf16,NVIDIA GeForce RTX 4060,c09,128,64,64,8,3,8,0.0,0.0,121.68000265955925,219.55359816551206,0.13787981289694665,3,0,3,3_0_3,0,
2026-03-02T09:22:29.880665+00:00,B,adversarial,eval,adversarial_eval_046,4096,2,512,bf16,NVIDIA GeForce RTX 4060,c00,32,32,32,2,2,8,0.0,0.0,65.5359998345375,120.83200365304947,0.12800000032316894,3,0,2,3_0_2,0,
2026-03-02T09:22:29.929439+00:00,B,adversarial,eval,adversarial_eval_047,4096,2,2048,bf16,NVIDIA GeForce RTX 4060,c09,128,64,64,8,3,8,0.0,0.0,155.64799308776855,241.56160697340948,0.21557895694214924,3,0,3,3_0_3,0,
2026-03-02T09:22:29.938267+00:00,B,adversarial,eval,adversarial_eval_048,1024,4,512,bf16,NVIDIA GeForce RTX 4060,c00,32,32,32,2,2,8,0.0,0.0,50.175998359918594,180.49759864807126,0.0835918394670245,3,0,2,3_0_2,0,
2026-03-02T09:22:29.954494+00:00,B,adversarial,eval,adversarial_eval_049,1024,4,2048,bf16,NVIDIA GeForce RTX 4060,c09,128,64,64,8,3,8,0.0,0.0,117.76000261306763,193.60319718718523,0.1424695620560241,3,0,3,3_0_3,0,
2026-03-02T09:22:29.964368+00:00,B,adversarial,eval,adversarial_eval_050,2048,4,512,bf16,NVIDIA GeForce RTX 4060,c00,32,32,32,2,2,8,0.0,0.0,72.59200140833855,90.49791969358921,0.11555829619317276,3,0,2,3_0_2,0,
2026-03-02T09:22:29.983991+00:00,B,adversarial,eval,adversarial_eval_051,2048,4,2048,bf16,NVIDIA GeForce RTX 4060,c09,128,64,64,8,3,8,0.0,0.0,87.93599903583527,96.29696279764174,0.3815778790018188,3,0,3,3_0_3,0,
2026-03-02T09:22:29.995743+00:00,B,adversarial,eval,adversarial_eval_052,4096,4,512,bf16,NVIDIA GeForce RTX 4060,c00,32,32,32,2,2,8,0.0,0.0,52.60800011456013,114.2272014170885,0.31890997497463563,3,0,2,3_0_2,0,
2026-03-02T09:22:30.047744+00:00,B,adversarial,eval,adversarial_eval_053,4096,4,2048,bf16,NVIDIA GeForce RTX 4060,c09,128,64,64,8,3,8,0.0,0.0,137.2160017490387,180.6768040359019,0.4890746206316287,3,0,3,3_0_3,0,
2026-03-02T09:22:30.058157+00:00,B,adversarial,eval,adversarial_eval_054,1024,8,512,bf16,NVIDIA GeForce RTX 4060,c00,32,32,32,2,2,8,0.0,0.0,67.951999604702,302.27520748972853,0.12344902355779304,3,0,2,3_0_2,0,
2026-03-02T09:22:30.074432+00:00,B,adversarial,eval,adversarial_eval_055,1024,8,2048,bf16,NVIDIA GeForce RTX 4060,c09,128,64,64,8,3,8,0.0,0.0,114.68800157308578,228.36223885416973,0.29257142455845464,3,0,3,3_0_3,0,
2026-03-02T09:22:30.082636+00:00,B,adversarial,eval,adversarial_eval_056,2048,8,512,bf16,NVIDIA GeForce RTX 4060,c00,32,32,32,2,2,8,0.0,0.0,44.03200000524521,55.3779201209545,0.381023255768565,3,0,2,3_0_2,0,
2026-03-02T09:22:30.103621+00:00,B,adversarial,eval,adversarial_eval_057,2048,8,2048,bf16,NVIDIA GeForce RTX 4060,c09,128,64,64,8,3,8,0.0,0.0,89.50399979948997,137.77343727648244,0.7497862011791613,3,0,3,3_0_3,0,
2026-03-02T09:22:30.114274+00:00,B,adversarial,eval,adversarial_eval_058,4096,8,512,bf16,NVIDIA GeForce RTX 4060,c00,32,32,32,2,2,8,0.0,0.0,38.863999769091606,78.75583853572599,0.8633808202799989,3,0,2,3_0_2,0,
2026-03-02T09:22:30.164291+00:00,B,adversarial,eval,adversarial_eval_059,4096,8,2048,bf16,NVIDIA GeForce RTX 4060,c09,128,64,64,8,3,8,0.0,0.0,159.19999778270721,193.02815794944763,0.8430761926466505,3,0,3,3_0_3,0,
2026-03-02T09:22:30.178804+00:00,B,adversarial,eval,adversarial_eval_060,64,64,8192,bf16,NVIDIA GeForce RTX 4060,c04,64,64,64,4,3,8,0.0,0.0,95.56800127029419,143.2268761843442,0.7022106050977936,1,1,3,1_1_3,0,
2026-03-02T09:22:30.193931+00:00,B,adversarial,eval,adversarial_eval_061,128,128,8192,bf16,NVIDIA GeForce RTX 4060,c04,64,64,64,4,3,8,0.0,0.0,98.30400347709656,134.34879697859284,2.730666570080655,1,1,3,1_1_3,0,
2026-03-02T09:22:30.290553+00:00,B,adversarial,eval,adversarial_eval_062,2048,128,8192,bf16,NVIDIA GeForce RTX 4060,c04,64,64,64,4,3,8,0.0,0.0,183.1360012292862,260.1164785027504,23.452337427760597,3,1,3,3_1_3,0,
2026-03-02T09:22:30.382510+00:00,B,adversarial,eval,adversarial_eval_063,128,2048,8192,bf16,NVIDIA GeForce RTX 4060,c06,64,128,32,4,3,8,0.0,0.0,250.71999430656433,269.89567816257477,17.130533637251084,1,3,3,1_3_3,0,
2026-03-02T09:22:34.699626+00:00,B2,uniform,tune,uniform_tune_000,1536,512,1024,bf16,NVIDIA GeForce RTX 4060,c09,128,64,64,8,3,8,160.96115892287344,3243.368,87.40799874067307,123.40832449495781,18.42637698156728,3,2,3,4_3_3_r2,0,
2026-03-02T09:22:40.559790+00:00,B2,uniform,tune,uniform_tune_001,1536,1536,2048,bf16,NVIDIA GeForce RTX 4060,c06,64,128,32,4,3,8,0.0,5860.102,297.0079928636551,363.52255165576923,32.53675540117946,3,3,3,4_4_4_r1,0,
2026-03-02T09:22:42.801333+00:00,B2,uniform,tune,uniform_tune_002,384,2048,1536,bf16,NVIDIA GeForce RTX 4060,c09,128,64,64,8,3,8,0.0,2241.462,97.10400179028511,169.96223747730255,24.87970690659737,2,3,3,3_4_4_r0,0,
2026-03-02T09:22:44.146142+00:00,B2,uniform,tune,uniform_tune_003,1536,64,3072,bf16,NVIDIA GeForce RTX 4060,c04,64,64,64,4,3,8,0.0,1344.742,34.304000437259674,289.2908788472408,17.606686342738634,3,1,3,4_1_4_r2,0,
2026-03-02T09:22:44.635380+00:00,B2,uniform,tune,uniform_tune_004,768,128,2048,bf16,NVIDIA GeForce RTX 4060,c01,64,32,32,2,2,8,0.0,489.181,67.07200035452843,282.6569570600983,6.0032976781915,3,1,3,3_2_4_r2,0,
2026-03-02T09:22:44.652498+00:00,B2,uniform,tune,uniform_tune_005,512,128,4096,bf16,NVIDIA GeForce RTX 4060,c01,64,32,32,2,2,8,0.0,0.0,94.97600048780441,115.02912007272242,5.652700779592609,2,1,3,3_2_4_r2,0,
2026-03-02T09:22:47.830215+00:00,B2,uniform,tune,uniform_tune_006,2048,1024,4096,bf16,NVIDIA GeForce RTX 4060,c10,64,128,64,8,3,8,0.0,3177.655,525.3120064735413,678.4748703241347,32.704124353314796,3,3,3,4_3_4_r2,0,
2026-03-02T09:22:48.009334+00:00,B2,uniform,tune,uniform_tune_007,128,768,512,bf16,NVIDIA GeForce RTX 4060,c11,32,128,32,4,2,8,0.0,179.067,31.168000772595406,40.1155199855566,3.2297001252806896,1,3,2,2_3_3_r0,0,
2026-03-02T09:22:48.141830+00:00,B2,uniform,tune,uniform_tune_008,2048,256,64,bf16,NVIDIA GeForce RTX 4060,c09,128,64,64,8,3,8,0.0,132.45,33.695999532938,45.62336042523383,1.9915973685363084,3,2,1,4_2_1_r2,0,
2026-03-02T09:22:48.595007+00:00,B2,uniform,tune,uniform_tune_009,192,768,2048,bf16,NVIDIA GeForce RTX 4060,c02,32,64,32,2,2,8,0.0,453.125,51.19999870657921,109.55775588750829,11.796480298004159,2,3,3,2_3_4_r0,0,
2026-03-02T09:22:49.410715+00:00,B2,uniform,tune,uniform_tune_010,1024,1024,1536,bf16,NVIDIA GeForce RTX 4060,c04,64,64,64,4,3,8,0.0,815.659,132.09599256515503,187.87552282214162,24.385489744597383,3,3,3,3_3_4_r1,0,
2026-03-02T09:22:49.597331+00:00,B2,uniform,tune,uniform_tune_011,256,384,768,bf16,NVIDIA GeForce RTX 4060,c11,32,128,32,4,2,8,0.0,186.562,34.7680002450943,47.43039973080158,4.342928639426281,2,2,3,2_3_3_r1,0,
2026-03-02T09:22:49.805189+00:00,B2,uniform,tune,uniform_tune_012,64,192,2048,bf16,NVIDIA GeForce RTX 4060,c00,32,32,32,2,2,8,0.0,207.811,39.93599861860275,49.694720022380345,1.2603077359020842,1,2,3,1_2_4_r0,0,
2026-03-02T09:22:49.937039+00:00,B2,uniform,tune,uniform_tune_013,192,128,512,bf16,NVIDIA GeForce RTX 4060,c06,64,128,32,4,3,8,0.0,131.793,31.74399957060814,43.9526392519474,0.7927742042720133,2,1,2,2_2_3_r1,0,
2026-03-02T09:22:49.943225+00:00,B2,uniform,tune,uniform_tune_014,128,128,1024,bf16,NVIDIA GeForce RTX 4060,c06,64,128,32,4,3,8,0.0,0.0,50.175998359918594,102.44159989058969,0.668734715736196,1,1,3,2_2_3_r1,0,
2026-03-02T09:22:51.840004+00:00,B2,uniform,tune,uniform_tune_015,3072,3072,768,bf16,NVIDIA GeForce RTX 4060,c10,64,128,64,8,3,8,0.0,1896.734,449.48799908161163,513.5564821958541,32.24894692097911,3,3,3,4_4_3_r1,0,
2026-03-02T09:22:52.123788+00:00,B2,uniform,tune,uniform_tune_016,256,128,3072,bf16,NVIDIA GeForce RTX 4060,c04,64,64,64,4,3,8,0.0,283.725,46.08000069856644,69.29407913237807,4.3690666004322205,2,1,3,2_2_4_r2,0,
2026-03-02T09:22:52.242978+00:00,B2,uniform,tune,uniform_tune_017,96,1024,192,bf16,NVIDIA GeForce RTX 4060,c11,32,128,32,4,2,8,0.0,119.144,30.719999223947525,88.3609636127947,1.2288000310421,1,3,2,2_3_2_r0,0,
2026-03-02T09:22:52.333754+00:00,B2,uniform,tune,uniform_tune_018,64,64,192,bf16,NVIDIA GeForce RTX 4060,c00,32,32,32,2,2,8,0.0,90.737,26.623999699950218,41.4991999045014,0.05907692374271402,1,1,2,1_1_2_r1,0,
2026-03-02T09:22:52.383308+00:00,B2,uniform,tune,uniform_tune_019,4096,64,64,bf16,NVIDIA GeForce RTX 4060,c10,64,128,64,8,3,8,0.0,49.518,32.76799991726875,50.17247911542651,1.0240000025853515,3,1,1,4_1_1_r2,0,
2026-03-02T09:22:54.458943+00:00,B2,uniform,tune,uniform_tune_020,128,4096,3072,bf16,NVIDIA GeForce RTX 4060,c04,64,64,64,4,3,8,0.0,2075.581,142.2399953007698,228.86399537324894,22.6464115468272,1,3,3,2_4_4_r0,0,
2026-03-02T09:22:54.498921+00:00,B2,uniform,tune,uniform_tune_021,192,2048,3072,bf16,NVIDIA GeForce RTX 4060,c04,64,64,64,4,3,8,0.0,0.0,126.46400183439255,263.8438396155833,19.103611058929644,2,3,3,2_4_4_r0,0,
2026-03-02T09:22:54.568821+00:00,B2,uniform,tune,uniform_tune_022,1536,2048,2048,bf16,NVIDIA GeForce RTX 4060,c06,64,128,32,4,3,8,0.0,0.0,635.888010263443,770.6153523921967,20.262847671340577,3,3,3,4_4_4_r1,0,
2026-03-02T09:22:54.583311+00:00,B2,uniform,tune,uniform_tune_023,256,1024,1024,bf16,NVIDIA GeForce RTX 4060,c11,32,128,32,4,2,8,0.0,0.0,60.92800013720989,147.47647777199745,8.81156300536644,2,3,3,2_3_3_r0,0,
2026-03-02T09:22:54.798695+00:00,B2,uniform,tune,uniform_tune_024,768,128,384,bf16,NVIDIA GeForce RTX 4060,c04,64,64,64,4,3,8,0.0,215.345,32.15999901294708,63.07648058980701,2.347558281006351,3,1,2,3_2_3_r2,0,
2026-03-02T09:22:54.941037+00:00,B2,uniform,tune,uniform_tune_025,256,96,384,bf16,NVIDIA GeForce RTX 4060,c04,64,64,64,4,3,8,0.0,142.295,32.67199918627739,41.54368098825215,0.5776924727620417,2,1,2,2_2_3_r2,0,
2026-03-02T09:22:54.960625+00:00,B2,uniform,tune,uniform_tune_026,96,1024,3072,bf16,NVIDIA GeForce RTX 4060,c02,32,64,32,2,2,8,0.0,0.0,94.2080020904541,125.7392041385173,6.411130292521085,1,3,3,2_3_4_r0,0,
2026-03-02T09:22:55.016723+00:00,B2,uniform,tune,uniform_tune_027,1536,512,4096,bf16,NVIDIA GeForce RTX 4060,c10,64,128,64,8,3,8,0.0,0.0,370.09601294994354,405.97502827644337,17.40751242535368,3,2,3,4_3_4_r2,0,
2026-03-02T09:22:55.123820+00:00,B2,uniform,tune,uniform_tune_028,128,64,192,bf16,NVIDIA GeForce RTX 4060,c04,64,64,64,4,3,8,0.0,107.039,31.120000407099724,77.68511861562718,0.1010838033049104,1,1,2,2_1_2_r2,0,
2026-03-02T09:22:55.404232+00:00,B2,uniform,tune,uniform_tune_029,192,256,1536,bf16,NVIDIA GeForce RTX 4060,c04,64,64,64,4,3,8,0.0,280.368,46.08000069856644,54.29247975349426,3.2767999503241656,2,2,3,2_2_4_r1,0,
2026-03-02T09:22:55.475887+00:00,B2,uniform,tune,uniform_tune_030,4096,64,3072,bf16,NVIDIA GeForce RTX 4060,c04,64,64,64,4,3,8,0.0,0.0,132.09599256515503,154.14271622896194,12.192744872298691,3,1,3,4_1_4_r2,0,
2026-03-02T09:22:55.603474+00:00,B2,uniform,tune,uniform_tune_031,384,128,96,bf16,NVIDIA GeForce RTX 4060,c02,32,64,32,2,2,8,0.0,127.528,34.81600061058998,46.16191882640122,0.2710588187756836,2,1,1,3_2_2_r2,0,
2026-03-02T09:22:56.424386+00:00,B2,uniform,eval,uniform_eval_000,512,4096,768,bf16,NVIDIA GeForce RTX 4060,c11,32,128,32,4,2,8,0.0,820.353,140.1439979672432,213.64064425230004,22.985111875807327,2,3,3,3_4_3_r0,0,
2026-03-02T09:22:56.557464+00:00,B2,uniform,eval,uniform_eval_001,384,512,64,bf16,NVIDIA GeForce RTX 4060,c11,32,128,32,4,2,8,0.0,133.029,32.607998698949814,47.088320925831795,0.7717684311858888,2,2,1,3_3_1_r1,0,
2026-03-02T09:22:56.919157+00:00,B2,uniform,eval,uniform_eval_002,256,4096,384,bf16,NVIDIA GeForce RTX 4060,c03,64,64,32,4,2,8,0.0,361.648,52.22399905323982,117.84512311220169,15.420235573668524,2,3,2,2_4_3_r0,0,
2026-03-02T09:22:57.180284+00:00,B2,uniform,eval,uniform_eval_003,384,768,512,bf16,NVIDIA GeForce RTX 4060,c03,64,64,32,4,2,8,0.0,261.076,37.567999213933945,166.4553640782833,8.038487391364514,2,3,2,3_3_3_r0,0,
2026-03-02T09:22:57.332171+00:00,B2,uniform,eval,uniform_eval_004,768,1024,96,bf16,NVIDIA GeForce RTX 4060,c05,128,64,32,4,3,8,0.0,151.834,36.86400130391121,46.93087972700596,4.095999855120982,3,3,1,3_3_2_r1,0,
2026-03-02T09:22:57.825844+00:00,B2,uniform,eval,uniform_eval_005,3072,3072,128,bf16,NVIDIA GeForce RTX 4060,c05,128,64,32,4,3,8,0.0,493.627,105.47199845314026,116.23424209654331,22.905786743704862,3,3,1,4_4_2_r1,0,
2026-03-02T09:22:57.831019+00:00,B2,uniform,eval,uniform_eval_006,256,96,512,bf16,NVIDIA GeForce RTX 4060,c04,64,64,64,4,3,8,0.0,0.0,37.88800165057182,64.19200073927637,0.6642161872799692,2,1,2,2_2_3_r2,0,
2026-03-02T09:22:58.245351+00:00,B2,uniform,eval,uniform_eval_007,4096,4096,4096,bf16,NVIDIA GeForce RTX 4060,c06,64,128,32,4,3,8,0.0,0.0,4325.90389251709,4506.6444635391235,31.771152777975647,3,3,3,4_4_4_r1,0,
2026-03-02T09:22:58.333431+00:00,B2,uniform,eval,uniform_eval_008,128,96,64,bf16,NVIDIA GeForce RTX 4060,c11,32,128,32,4,2,8,0.0,88.026,27.664000168442726,50.844160877168164,0.056855985772954844,1,1,1,2_2_1_r1,0,
2026-03-02T09:22:58.562472+00:00,B2,uniform,eval,uniform_eval_009,3072,384,96,bf16,NVIDIA GeForce RTX 4060,c06,64,128,32,4,3,8,0.0,229.001,39.99999910593033,61.124799624085426,5.662310526562503,3,2,1,4_3_2_r2,0,
2026-03-02T09:22:58.580287+00:00,B2,uniform,eval,uniform_eval_010,768,768,2048,bf16,NVIDIA GeForce RTX 4060,c04,64,64,64,4,3,8,0.0,0.0,107.51999914646149,132.36288256943217,22.469485892657843,3,3,3,3_3_4_r1,0,
2026-03-02T09:22:58.996620+00:00,B2,uniform,eval,uniform_eval_011,4096,96,512,bf16,NVIDIA GeForce RTX 4060,c06,64,128,32,4,3,8,0.0,416.289,51.19999870657921,91.16608090698708,7.864320198669438,3,1,2,4_2_3_r2,0,
2026-03-02T09:22:59.001506+00:00,B2,uniform,eval,uniform_eval_012,384,384,256,bf16,NVIDIA GeForce RTX 4060,c05,128,64,32,4,3,8,0.0,0.0,36.8800014257431,47.12512105703354,2.047111417606969,2,2,2,3_3_2_r1,0,
2026-03-02T09:23:00.857480+00:00,B2,uniform,eval,uniform_eval_013,4096,2048,768,bf16,NVIDIA GeForce RTX 4060,c03,64,64,32,4,2,8,0.0,1855.916,416.01599752902985,583.4448105096817,30.97213079432332,3,3,3,4_4_3_r2,0,
2026-03-02T09:23:00.872046+00:00,B2,uniform,eval,uniform_eval_014,192,384,3072,bf16,NVIDIA GeForce RTX 4060,c02,32,64,32,2,2,8,0.0,0.0,63.48799914121628,78.30399990081787,7.13496783844812,2,2,3,2_3_4_r0,0,
2026-03-02T09:23:00.881103+00:00,B2,uniform,eval,uniform_eval_015,128,96,4096,bf16,NVIDIA GeForce RTX 4060,c04,64,64,64,4,3,8,0.0,0.0,54.11200039088726,135.81344068050382,1.860276745875989,1,1,3,2_2_4_r1,0,
2026-03-02T09:23:02.476648+00:00,B2,uniform,eval,uniform_eval_016,64,4096,2048,bf16,NVIDIA GeForce RTX 4060,c02,32,64,32,2,2,8,0.0,1595.485,53.18400077521801,160.39423942565918,20.189188634720544,1,3,3,1_4_4_r0,0,
2026-03-02T09:23:02.486778+00:00,B2,uniform,eval,uniform_eval_017,96,128,3072,bf16,NVIDIA GeForce RTX 4060,c04,64,64,64,4,3,8,0.0,0.0,75.74399933218956,263.6595121026038,0.9967452559362707,1,1,3,2_2_4_r1,0,
2026-03-02T09:23:02.492342+00:00,B2,uniform,eval,uniform_eval_018,512,768,64,bf16,NVIDIA GeForce RTX 4060,c11,32,128,32,4,2,8,0.0,0.0,38.815999403595924,134.3849609047174,1.2966727322068452,2,3,1,3_3_1_r1,0,
2026-03-02T09:23:02.611507+00:00,B2,uniform,eval,uniform_eval_019,64,128,384,bf16,NVIDIA GeForce RTX 4060,c04,64,64,64,4,3,8,0.0,119.126,30.719999223947525,39.3692810833454,0.20480000517368332,1,1,2,1_2_3_r0,0,
2026-03-02T09:23:02.617125+00:00,B2,uniform,eval,uniform_eval_020,512,512,96,bf16,NVIDIA GeForce RTX 4060,c05,128,64,32,4,3,8,0.0,0.0,50.20799860358238,69.21184167265892,1.0024627429863098,2,2,1,3_3_2_r1,0,
2026-03-02T09:23:02.644735+00:00,B2,uniform,eval,uniform_eval_021,256,3072,1536,bf16,NVIDIA GeForce RTX 4060,c04,64,64,64,4,3,8,0.0,0.0,107.87199810147285,147.13856130838388,22.39616533038905,2,3,3,2_4_4_r0,0,
2026-03-02T09:23:02.653233+00:00,B2,uniform,eval,uniform_eval_022,2048,96,512,bf16,NVIDIA GeForce RTX 4060,c06,64,128,32,4,3,8,0.0,0.0,43.79200004041195,120.62976054847226,4.597337226301896,3,1,2,4_2_3_r2,0,
2026-03-02T09:23:02.688391+00:00,B2,uniform,eval,uniform_eval_023,1536,512,3072,bf16,NVIDIA GeForce RTX 4060,c10,64,128,64,8,3,8,0.0,0.0,178.99200320243835,218.60351935029018,26.994715526677656,3,2,3,4_3_4_r2,0,
2026-03-02T09:23:02.692773+00:00,B2,uniform,eval,uniform_eval_024,128,192,64,bf16,NVIDIA GeForce RTX 4060,c11,32,128,32,4,2,8,0.0,0.0,37.88800165057182,71.74144193530081,0.08302702340999615,1,2,1,2_2_1_r1,0,
2026-03-02T09:23:02.699808+00:00,B2,uniform,eval,uniform_eval_025,1536,96,384,bf16,NVIDIA GeForce RTX 4060,c06,64,128,32,4,3,8,0.0,0.0,38.8799998909235,81.65632054209702,2.9127111192826214,3,1,2,4_2_3_r2,0,
2026-03-02T09:23:02.949075+00:00,B2,uniform,eval,uniform_eval_026,1536,2048,64,bf16,NVIDIA GeForce RTX 4060,c06,64,128,32,4,3,8,0.0,249.232,47.10400104522705,64.5324794948101,8.548173723361447,3,3,1,4_4_1_r1,0,
2026-03-02T09:23:02.953953+00:00,B2,uniform,eval,uniform_eval_027,256,1024,96,bf16,NVIDIA GeForce RTX 4060,c11,32,128,32,4,2,8,0.0,0.0,35.151999443769455,126.18752151727662,1.4318288801896608,2,3,1,2_3_2_r0,0,
2026-03-02T09:23:02.961386+00:00,B2,uniform,eval,uniform_eval_028,2048,256,64,bf16,NVIDIA GeForce RTX 4060,c09,128,64,64,8,3,8,0.0,0.0,68.54400038719177,148.98720443248746,0.9790625528261414,3,2,1,4_2_1_r2,0,
2026-03-02T09:23:02.967251+00:00,B2,uniform,eval,uniform_eval_029,192,768,192,bf16,NVIDIA GeForce RTX 4060,c11,32,128,32,4,2,8,0.0,0.0,45.05600035190582,126.74943663179866,1.2567272629117179,2,3,2,2_3_2_r0,0,
2026-03-02T09:23:03.024123+00:00,B2,uniform,eval,uniform_eval_030,1024,2048,3072,bf16,NVIDIA GeForce RTX 4060,c09,128,64,64,8,3,8,0.0,0.0,423.93600940704346,485.7446554303168,30.393506571951807,3,3,3,3_4_4_r0,0,
2026-03-02T09:23:03.612436+00:00,B2,uniform,eval,uniform_eval_031,1536,1024,512,bf16,NVIDIA GeForce RTX 4060,c03,64,64,32,4,2,8,0.0,588.252,78.67200300097466,95.16928195953369,20.47250196464486,3,3,2,4_3_3_r1,0,
2026-03-02T09:23:03.872741+00:00,B2,uniform,eval,uniform_eval_032,512,768,768,bf16,NVIDIA GeForce RTX 4060,c04,64,64,64,4,3,8,0.0,260.251,46.08000069856644,107.27424256503568,13.107199801296662,2,3,3,3_3_3_r1,0,
2026-03-02T09:23:04.303732+00:00,B2,uniform,eval,uniform_eval_033,64,512,4096,bf16,NVIDIA GeForce RTX 4060,c04,64,64,64,4,3,8,0.0,430.937,53.58400009572506,71.7004819214344,5.00961957898727,1,2,3,1_3_4_r0,0,
2026-03-02T09:23:04.311438+00:00,B2,uniform,eval,uniform_eval_034,1024,256,512,bf16,NVIDIA GeForce RTX 4060,c04,64,64,64,4,3,8,0.0,0.0,43.007999658584595,93.89471951872096,6.241523859071624,3,2,2,3_2_3_r2,0,
2026-03-02T09:23:04.316342+00:00,B2,uniform,eval,uniform_eval_035,1024,768,96,bf16,NVIDIA GeForce RTX 4060,c05,128,64,32,4,3,8,0.0,0.0,37.90399990975857,47.16543916612862,3.9836150369218846,3,3,1,3_3_2_r1,0,
2026-03-02T09:23:04.659620+00:00,B2,uniform,eval,uniform_eval_036,768,64,1536,bf16,NVIDIA GeForce RTX 4060,c04,64,64,64,4,3,8,0.0,343.238,36.01599857211113,53.26847940683365,4.192440859238662,3,1,3,3_1_4_r2,0,
2026-03-02T09:23:04.664814+00:00,B2,uniform,eval,uniform_eval_037,512,256,512,bf16,NVIDIA GeForce RTX 4060,c04,64,64,64,4,3,8,0.0,0.0,39.93599861860275,51.22047871351242,3.360820629072225,2,2,2,3_2_3_r2,0,
2026-03-02T09:23:04.708067+00:00,B2,uniform,eval,uniform_eval_038,64,1024,64,bf16,NVIDIA GeForce RTX 4060,c03,64,64,32,4,2,8,0.0,43.221,29.69600073993206,83.7065630406141,0.2824827515820971,1,3,1,1_3_1_r0,0,
2026-03-02T09:23:04.717930+00:00,B2,uniform,eval,uniform_eval_039,512,128,2048,bf16,NVIDIA GeForce RTX 4060,c01,64,32,32,2,2,8,0.0,0.0,53.247999399900436,123.44320453703402,5.04123082604493,2,1,3,3_2_4_r2,0,
2026-03-02T09:23:04.724163+00:00,B2,uniform,eval,uniform_eval_040,4096,768,96,bf16,NVIDIA GeForce RTX 4060,c06,64,128,32,4,3,8,0.0,0.0,50.175998359918594,71.13376066088674,12.037224883251529,3,3,1,4_3_2_r2,0,
2026-03-02T09:23:04.731046+00:00,B2,uniform,eval,uniform_eval_041,4096,192,64,bf16,NVIDIA GeForce RTX 4060,c09,128,64,64,8,3,8,0.0,0.0,40.95999896526337,113.13215970993029,2.4576000620842,3,2,1,4_2_1_r2,0,
2026-03-02T09:23:04.881916+00:00,B2,uniform,eval,uniform_eval_042,96,1536,128,bf16,NVIDIA GeForce RTX 4060,c02,32,64,32,2,2,8,0.0,150.835,27.648000046610832,41.33311953395604,1.365333331031564,1,3,1,2_4_2_r0,0,
2026-03-02T09:23:04.888092+00:00,B2,uniform,eval,uniform_eval_043,192,2048,192,bf16,NVIDIA GeForce RTX 4060,c02,32,64,32,2,2,8,0.0,0.0,38.63999992609024,73.79967868328083,3.9077366534373676,2,3,2,2_4_2_r0,0,
2026-03-02T09:23:04.974358+00:00,B2,uniform,eval,uniform_eval_044,384,4096,3072,bf16,NVIDIA GeForce RTX 4060,c09,128,64,64,8,3,8,0.0,0.0,318.4640109539032,360.7635152339935,30.34464204308094,2,3,3,3_4_4_r0,0,
2026-03-02T09:23:04.989694+00:00,B2,uniform,eval,uniform_eval_045,4096,96,768,bf16,NVIDIA GeForce RTX 4060,c06,64,128,32,4,3,8,0.0,0.0,55.296000093221664,76.90687917172906,10.922666648252513,3,1,3,4_2_3_r2,0,
2026-03-02T09:23:04.996776+00:00,B2,uniform,eval,uniform_eval_046,96,96,1536,bf16,NVIDIA GeForce RTX 4060,c04,64,64,64,4,3,8,0.0,0.0,64.03199955821037,186.10111936926836,0.4421469295873302,1,1,3,2_2_4_r1,0,
2026-03-02T09:23:05.054139+00:00,B2,uniform,eval,uniform_eval_047,2048,512,4096,bf16,NVIDIA GeForce RTX 4060,c10,64,128,64,8,3,8,0.0,0.0,309.2000037431717,439.1017588973044,27.78115940494939,3,2,3,4_3_4_r2,0,
2026-03-02T09:23:05.204620+00:00,B2,uniform,eval,uniform_eval_048,96,256,768,bf16,NVIDIA GeForce RTX 4060,c00,32,32,32,2,2,8,0.0,150.42,36.86400130391121,82.16223858296868,1.0239999637802455,1,2,3,2_2_3_r0,0,
2026-03-02T09:23:05.364903+00:00,B2,uniform,eval,uniform_eval_049,64,768,384,bf16,NVIDIA GeForce RTX 4060,c04,64,64,64,4,3,8,0.0,160.231,28.672000393271446,104.83167693018913,1.3165714105130462,1,3,2,1_3_3_r0,0,
2026-03-02T09:23:05.369220+00:00,B2,uniform,eval,uniform_eval_050,128,1024,96,bf16,NVIDIA GeForce RTX 4060,c11,32,128,32,4,2,8,0.0,0.0,32.75199979543686,40.98047897219657,0.7683751879940535,1,3,1,2_3_2_r0,0,
2026-03-02T09:23:05.377153+00:00,B2,uniform,eval,uniform_eval_051,384,768,768,bf16,NVIDIA GeForce RTX 4060,c03,64,64,32,4,2,8,0.0,0.0,50.623999908566475,87.01951920986176,8.94802530061136,2,3,3,3_3_3_r0,0,
2026-03-02T09:23:05.393305+00:00,B2,uniform,eval,uniform_eval_052,768,64,4096,bf16,NVIDIA GeForce RTX 4060,c04,64,64,64,4,3,8,0.0,0.0,64.51199948787689,84.89184156060219,6.241523859071623,3,1,3,3_1_4_r2,0,
2026-03-02T09:23:05.398751+00:00,B2,uniform,eval,uniform_eval_053,384,96,512,bf16,NVIDIA GeForce RTX 4060,c04,64,64,64,4,3,8,0.0,0.0,40.95999896526337,68.77184275537726,0.9216000232815749,2,1,2,3_2_3_r2,0,
2026-03-02T09:23:05.408076+00:00,B2,uniform,eval,uniform_eval_054,768,192,768,bf16,NVIDIA GeForce RTX 4060,c04,64,64,64,4,3,8,0.0,0.0,68.64000111818314,120.59999704360959,3.2997146315605295,3,2,3,3_2_3_r2,0,
2026-03-02T09:23:05.418720+00:00,B2,uniform,eval,uniform_eval_055,512,2048,512,bf16,NVIDIA GeForce RTX 4060,c11,32,128,32,4,2,8,0.0,0.0,69.63200122117996,100.5164792388677,15.420235023683334,2,3,2,3_4_3_r0,0,
2026-03-02T09:23:05.424387+00:00,B2,uniform,eval,uniform_eval_056,384,512,512,bf16,NVIDIA GeForce RTX 4060,c04,64,64,64,4,3,8,0.0,0.0,38.59199956059456,86.19008105248199,5.216796079298523,2,2,2,3_3_3_r1,0,
2026-03-02T09:23:05.434417+00:00,B2,uniform,eval,uniform_eval_057,2048,512,512,bf16,NVIDIA GeForce RTX 4060,c09,128,64,64,8,3,8,0.0,0.0,69.63200122117996,75.27424313127995,15.420235023683334,3,2,2,4_3_3_r2,0,
2026-03-02T09:23:06.265100+00:00,B2,uniform,eval,uniform_eval_058,1024,512,2048,bf16,NVIDIA GeForce RTX 4060,c09,128,64,64,8,3,8,0.0,830.654,106.49599879980087,131.9830404222011,20.16492330417972,3,2,3,3_3_4_r2,0,
2026-03-02T09:23:06.318801+00:00,B2,uniform,eval,uniform_eval_059,2048,64,4096,bf16,NVIDIA GeForce RTX 4060,c04,64,64,64,4,3,8,0.0,0.0,77.13600248098373,717.5724685192084,13.920112391936678,3,1,3,4_1_4_r2,0,
2026-03-02T09:23:06.668752+00:00,B2,uniform,eval,uniform_eval_060,64,1536,1024,bf16,NVIDIA GeForce RTX 4060,c04,64,64,64,4,3,8,0.0,349.889,32.816000282764435,46.10048070549965,6.135013111446749,1,3,3,1_4_3_r0,0,
2026-03-02T09:23:06.687015+00:00,B2,uniform,eval,uniform_eval_061,768,1024,1536,bf16,NVIDIA GeForce RTX 4060,c04,64,64,64,4,3,8,0.0,0.0,110.36799848079681,172.15487867593762,21.889670350598514,3,3,3,3_3_4_r1,0,
2026-03-02T09:23:06.900745+00:00,B2,uniform,eval,uniform_eval_062,384,2048,192,bf16,NVIDIA GeForce RTX 4060,c06,64,128,32,4,3,8,0.0,213.683,31.600000336766243,77.27583792060604,9.5566419234698,2,3,2,3_4_2_r0,0,
2026-03-02T09:23:06.905941+00:00,B2,uniform,eval,uniform_eval_063,256,2048,192,bf16,NVIDIA GeForce RTX 4060,c02,32,64,32,2,2,8,0.0,0.0,35.840000957250595,49.13984149694443,5.617371278537052,2,3,2,2_4_2_r0,0,
2026-03-02T09:23:09.540955+00:00,B2,llm_style,tune,llm_style_tune_000,8,4096,1024,bf16,NVIDIA GeForce RTX 4060,c02,32,64,32,2,2,8,0.0,2634.42,38.975998759269714,155.5673568695782,1.721799726403147,0,3,3,0_4_3_r0,0,
2026-03-02T09:23:09.558790+00:00,B2,llm_style,tune,llm_style_tune_001,32,1024,2048,bf16,NVIDIA GeForce RTX 4060,c04,64,64,64,4,3,8,0.0,0.0,113.66400122642517,174.12095934152603,1.1808288160877833,0,3,3,1_3_4_r0,0,
2026-03-02T09:23:09.574998+00:00,B2,llm_style,tune,llm_style_tune_002,16,2048,1024,bf16,NVIDIA GeForce RTX 4060,c02,32,64,32,2,2,8,0.0,0.0,98.30400347709656,134.39936041831965,0.6826666425201637,0,3,3,0_4_3_r0,0,
2026-03-02T09:23:12.881981+00:00,B2,llm_style,tune,llm_style_tune_003,1,1024,4096,bf16,NVIDIA GeForce RTX 4060,c00,32,32,32,2,2,8,0.0,3306.939,151.5520066022873,158.2182377576828,0.05535134893999744,0,3,3,0_3_4_r0,0,
2026-03-02T09:23:12.920114+00:00,B2,llm_style,tune,llm_style_tune_004,64,2048,2048,bf16,NVIDIA GeForce RTX 4060,c02,32,64,32,2,2,8,0.0,0.0,251.90401077270508,382.5868824124335,2.131251941377078,1,3,3,1_4_4_r0,0,
2026-03-02T09:23:13.613512+00:00,B2,llm_style,tune,llm_style_tune_005,32,8192,8192,bf16,NVIDIA GeForce RTX 4060,c02,32,64,32,2,2,8,0.0,0.0,565.1360154151917,17509.91840362549,7.599882468726741,0,3,3,1_4_4_r0,0,
2026-03-02T09:23:18.892764+00:00,B2,llm_style,tune,llm_style_tune_006,16,8192,8192,bf16,NVIDIA GeForce RTX 4060,c11,32,128,32,4,2,8,0.0,5279.197,563.7120008468628,692.3263961076736,3.8095404120789373,0,3,3,0_4_4_r0,0,
2026-03-02T09:23:18.941245+00:00,B2,llm_style,tune,llm_style_tune_007,2,1024,8192,bf16,NVIDIA GeForce RTX 4060,c00,32,32,32,2,2,8,0.0,0.0,123.90399724245071,143.58527645468706,0.27080992338239046,0,3,3,0_3_4_r0,0,
2026-03-02T09:23:19.030290+00:00,B2,llm_style,tune,llm_style_tune_008,16,2048,8192,bf16,NVIDIA GeForce RTX 4060,c11,32,128,32,4,2,8,0.0,0.0,225.2800017595291,257.24927008152,2.3831272541140724,0,3,3,0_4_4_r0,0,
2026-03-02T09:23:19.076387+00:00,B2,llm_style,tune,llm_style_tune_009,4,4096,2048,bf16,NVIDIA GeForce RTX 4060,c11,32,128,32,4,2,8,0.0,0.0,71.68000191450119,181.41184166073793,0.9362285464228421,0,3,3,0_4_4_r0,0,
2026-03-02T09:23:19.244194+00:00,B2,llm_style,tune,llm_style_tune_010,64,8192,4096,bf16,NVIDIA GeForce RTX 4060,c02,32,64,32,2,2,8,0.0,0.0,377.85598635673523,480.30527859926224,11.366677917192254,1,3,3,1_4_4_r0,0,
2026-03-02T09:23:19.284425+00:00,B2,llm_style,tune,llm_style_tune_011,16,8192,1024,bf16,NVIDIA GeForce RTX 4060,c02,32,64,32,2,2,8,0.0,0.0,59.39200147986412,152.06143811345086,4.519724025313554,0,3,3,0_4_3_r0,0,
2026-03-02T09:23:19.328261+00:00,B2,llm_style,tune,llm_style_tune_012,2,8192,1024,bf16,NVIDIA GeForce RTX 4060,c02,32,64,32,2,2,8,0.0,0.0,67.391999065876,192.51840114593494,0.4978993421340771,0,3,3,0_4_3_r0,0,
2026-03-02T09:23:19.416323+00:00,B2,llm_style,tune,llm_style_tune_013,16,8192,2048,bf16,NVIDIA GeForce RTX 4060,c11,32,128,32,4,2,8,0.0,0.0,255.98400831222534,360.2534389495849,2.097283012090252,0,3,3,0_4_4_r0,0,
2026-03-02T09:23:19.503176+00:00,B2,llm_style,tune,llm_style_tune_014,8,4096,4096,bf16,NVIDIA GeForce RTX 4060,c11,32,128,32,4,2,8,0.0,0.0,251.90401077270508,361.3884851336479,1.065625970688539,0,3,3,0_4_4_r0,0,
2026-03-02T09:23:19.515118+00:00,B2,llm_style,tune,llm_style_tune_015,64,1024,1024,bf16,NVIDIA GeForce RTX 4060,c04,64,64,64,4,3,8,0.0,0.0,50.175998359918594,76.2224021553993,2.674938862944784,1,3,3,1_3_3_r0,0,
2026-03-02T09:23:19.687561+00:00,B2,llm_style,tune,llm_style_tune_016,16,4096,8192,bf16,NVIDIA GeForce RTX 4060,c11,32,128,32,4,2,8,0.0,0.0,472.49600291252136,586.8134379386902,2.2724886927748136,0,3,3,0_4_4_r0,0,
2026-03-02T09:23:19.777689+00:00,B2,llm_style,tune,llm_style_tune_017,1,4096,4096,bf16,NVIDIA GeForce RTX 4060,c11,32,128,32,4,2,8,0.0,0.0,254.73599135875702,321.5052807331084,0.1317223837158671,0,3,3,0_4_4_r0,0,
2026-03-02T09:23:19.868196+00:00,B2,llm_style,tune,llm_style_tune_018,64,4096,4096,bf16,NVIDIA GeForce RTX 4060,c02,32,64,32,2,2,8,0.0,0.0,265.1199996471405,341.6780877113342,8.10004394560266,1,3,3,1_4_4_r0,0,
2026-03-02T09:23:19.995451+00:00,B2,llm_style,tune,llm_style_tune_019,64,8192,2048,bf16,NVIDIA GeForce RTX 4060,c02,32,64,32,2,2,8,0.0,0.0,316.880002617836,462.35488653182983,6.776961721342546,1,3,3,1_4_4_r0,0,
2026-03-02T09:23:20.041852+00:00,B2,llm_style,tune,llm_style_tune_020,8,2048,4096,bf16,NVIDIA GeForce RTX 4060,c11,32,128,32,4,2,8,0.0,0.0,141.08799397945404,223.86688113212574,0.9513050984305971,0,3,3,0_4_4_r0,0,
2026-03-02T09:23:20.054505+00:00,B2,llm_style,tune,llm_style_tune_021,8,1024,2048,bf16,NVIDIA GeForce RTX 4060,c00,32,32,32,2,2,8,0.0,0.0,71.61600142717361,137.29792177677155,0.468532609072311,0,3,3,0_3_4_r0,0,
2026-03-02T09:23:20.098461+00:00,B2,llm_style,tune,llm_style_tune_022,8,8192,1024,bf16,NVIDIA GeForce RTX 4060,c02,32,64,32,2,2,8,0.0,0.0,85.95199882984161,172.21631854772565,1.561542835853179,0,3,3,0_4_3_r0,0,
2026-03-02T09:23:20.272561+00:00,B2,llm_style,tune,llm_style_tune_023,1,4096,8192,bf16,NVIDIA GeForce RTX 4060,c11,32,128,32,4,2,8,0.0,0.0,474.07999634742737,587.1958518028259,0.1415559916407432,0,3,3,0_4_4_r0,0,
2026-03-02T09:23:20.442533+00:00,B2,llm_style,tune,llm_style_tune_024,2,8192,4096,bf16,NVIDIA GeForce RTX 4060,c11,32,128,32,4,2,8,0.0,0.0,474.11200404167175,585.8304196596146,0.2830928701569071,0,3,3,0_4_4_r0,0,
2026-03-02T09:23:20.530390+00:00,B2,llm_style,tune,llm_style_tune_025,2,4096,4096,bf16,NVIDIA GeForce RTX 4060,c11,32,128,32,4,2,8,0.0,0.0,251.39200687408447,360.1100790500641,0.2669490762035765,0,3,3,0_4_4_r0,0,
2026-03-02T09:23:20.543926+00:00,B2,llm_style,tune,llm_style_tune_026,4,2048,1024,bf16,NVIDIA GeForce RTX 4060,c02,32,64,32,2,2,8,0.0,0.0,64.51199948787689,161.43935561180103,0.2600634941279843,0,3,3,0_4_3_r0,0,
2026-03-02T09:23:20.595467+00:00,B2,llm_style,tune,llm_style_tune_027,64,2048,4096,bf16,NVIDIA GeForce RTX 4060,c02,32,64,32,2,2,8,0.0,0.0,175.48800259828568,317.1404784917831,6.118605306927628,1,3,3,1_4_4_r0,0,
2026-03-02T09:23:20.617593+00:00,B2,llm_style,tune,llm_style_tune_028,32,1024,4096,bf16,NVIDIA GeForce RTX 4060,c04,64,64,64,4,3,8,0.0,0.0,109.51999947428703,179.8799972236155,2.4510176889018607,0,3,3,1_3_4_r0,0,
2026-03-02T09:23:20.631346+00:00,B2,llm_style,tune,llm_style_tune_029,32,2048,1024,bf16,NVIDIA GeForce RTX 4060,c04,64,64,64,4,3,8,0.0,0.0,93.18400174379349,163.6659194529056,1.4403516213977101,0,3,3,1_4_3_r0,0,
2026-03-02T09:23:20.655921+00:00,B2,llm_style,tune,llm_style_tune_030,4,2048,2048,bf16,NVIDIA GeForce RTX 4060,c11,32,128,32,4,2,8,0.0,0.0,121.83999642729759,199.70047309994698,0.27539751299994547,0,3,3,0_4_4_r0,0,
2026-03-02T09:23:21.002851+00:00,B2,llm_style,tune,llm_style_tune_031,1,8192,8192,bf16,NVIDIA GeForce RTX 4060,c11,32,128,32,4,2,8,0.0,0.0,910.8480215072632,1025.6691205501556,0.14735469016872615,0,3,3,0_4_4_r0,0,
2026-03-02T09:23:21.027259+00:00,B2,llm_style,eval,llm_style_eval_000,2,1024,4096,bf16,NVIDIA GeForce RTX 4060,c00,32,32,32,2,2,8,0.0,0.0,142.33599603176117,220.28031900525087,0.11787050688327846,0,3,3,0_3_4_r0,0,
2026-03-02T09:23:21.362834+00:00,B2,llm_style,eval,llm_style_eval_001,2,8192,8192,bf16,NVIDIA GeForce RTX 4060,c11,32,128,32,4,2,8,0.0,0.0,912.2559726238251,1047.7363085746765,0.29425453387597733,0,3,3,0_4_4_r0,0,
2026-03-02T09:23:21.384860+00:00,B2,llm_style,eval,llm_style_eval_002,2,2048,2048,bf16,NVIDIA GeForce RTX 4060,c11,32,128,32,4,2,8,0.0,0.0,106.38399794697762,196.5840020775795,0.15770431948197564,0,3,3,0_4_4_r0,0,
2026-03-02T09:23:21.436739+00:00,B2,llm_style,eval,llm_style_eval_003,8,1024,8192,bf16,NVIDIA GeForce RTX 4060,c00,32,32,32,2,2,8,0.0,0.0,195.95199823379517,325.3801602125168,0.6849520760684539,0,3,3,0_3_4_r0,0,
2026-03-02T09:23:21.537557+00:00,B2,llm_style,eval,llm_style_eval_004,64,2048,8192,bf16,NVIDIA GeForce RTX 4060,c02,32,64,32,2,2,8,0.0,0.0,417.7439957857132,494.6124681830404,5.140669093186865,1,3,3,1_4_4_r0,0,
2026-03-02T09:23:21.878340+00:00,B2,llm_style,eval,llm_style_eval_005,1,8192,8192,bf16,NVIDIA GeForce RTX 4060,c11,32,128,32,4,2,8,0.0,0.0,909.824013710022,1042.6777708530426,0.1475205380133852,0,3,3,0_4_4_r0,0,
2026-03-02T09:23:21.938433+00:00,B2,llm_style,eval,llm_style_eval_006,1,1024,8192,bf16,NVIDIA GeForce RTX 4060,c00,32,32,32,2,2,8,0.0,0.0,239.6160066127777,392.13408201932907,0.07001709208480458,0,3,3,0_3_4_r0,0,
2026-03-02T09:23:22.163858+00:00,B2,llm_style,eval,llm_style_eval_007,2,8192,4096,bf16,NVIDIA GeForce RTX 4060,c11,32,128,32,4,2,8,0.0,0.0,474.11200404167175,544.8499256372452,0.2830928701569071,0,3,3,0_4_4_r0,0,
2026-03-02T09:23:22.215694+00:00,B2,llm_style,eval,llm_style_eval_008,16,2048,4096,bf16,NVIDIA GeForce RTX 4060,c11,32,128,32,4,2,8,0.0,0.0,210.28800308704376,278.48576456308365,1.276513410462543,0,3,3,0_4_4_r0,0,
2026-03-02T09:23:22.319880+00:00,B2,llm_style,eval,llm_style_eval_009,32,2048,8192,bf16,NVIDIA GeForce RTX 4060,c02,32,64,32,2,2,8,0.0,0.0,445.43999433517456,559.2678654193878,2.410519570885355,0,3,3,1_4_4_r0,0,
2026-03-02T09:23:22.602287+00:00,B2,llm_style,eval,llm_style_eval_010,1,1024,1024,bf16,NVIDIA GeForce RTX 4060,c03,64,64,32,4,2,8,0.0,282.347,65.5359998345375,150.159362182021,0.032000000080792235,0,3,3,0_3_3_r0,0,
2026-03-02T09:23:22.709443+00:00,B2,llm_style,eval,llm_style_eval_011,16,2048,8192,bf16,NVIDIA GeForce RTX 4060,c11,32,128,32,4,2,8,0.0,0.0,460.656002163887,527.5955232977865,1.1654486416720955,0,3,3,0_4_4_r0,0,
2026-03-02T09:23:23.060149+00:00,B2,llm_style,eval,llm_style_eval_012,8,8192,8192,bf16,NVIDIA GeForce RTX 4060,c11,32,128,32,4,2,8,0.0,0.0,908.8000059127808,1011.3842970132827,1.1814940768200755,0,3,3,0_4_4_r0,0,
2026-03-02T09:23:23.238900+00:00,B2,llm_style,eval,llm_style_eval_013,32,4096,8192,bf16,NVIDIA GeForce RTX 4060,c02,32,64,32,2,2,8,0.0,0.0,534.4640016555786,656.7593502998352,4.0180136386133825,0,3,3,1_4_4_r0,0,
2026-03-02T09:23:23.249787+00:00,B2,llm_style,eval,llm_style_eval_014,64,1024,1024,bf16,NVIDIA GeForce RTX 4060,c04,64,64,64,4,3,8,0.0,0.0,68.09600070118904,124.27263721823685,1.971007498501397,1,3,3,1_3_3_r0,0,
2026-03-02T09:23:23.264020+00:00,B2,llm_style,eval,llm_style_eval_015,16,2048,1024,bf16,NVIDIA GeForce RTX 4060,c02,32,64,32,2,2,8,0.0,0.0,89.07200023531914,182.90976151823992,0.7534226673107737,0,3,3,0_4_3_r0,0,
2026-03-02T09:23:23.322908+00:00,B2,llm_style,eval,llm_style_eval_016,2,1024,8192,bf16,NVIDIA GeForce RTX 4060,c00,32,32,32,2,2,8,0.0,0.0,293.2640016078949,334.4678372144699,0.11441715251796758,0,3,3,0_3_4_r0,0,
2026-03-02T09:23:23.679269+00:00,B2,llm_style,eval,llm_style_eval_017,4,8192,8192,bf16,NVIDIA GeForce RTX 4060,c11,32,128,32,4,2,8,0.0,0.0,925.5520105361938,1078.2565903663635,0.5800548277011232,0,3,3,0_4_4_r0,0,
2026-03-02T09:23:23.706520+00:00,B2,llm_style,eval,llm_style_eval_018,4,1024,4096,bf16,NVIDIA GeForce RTX 4060,c00,32,32,32,2,2,8,0.0,0.0,176.12800002098083,352.02880352735514,0.1905116278842825,0,3,3,0_3_4_r0,0,
2026-03-02T09:23:23.758116+00:00,B2,llm_style,eval,llm_style_eval_019,8,4096,2048,bf16,NVIDIA GeForce RTX 4060,c11,32,128,32,4,2,8,0.0,0.0,167.93599724769592,286.68607890605927,0.7992195252935353,0,3,3,0_4_4_r0,0,
2026-03-02T09:23:23.814645+00:00,B2,llm_style,eval,llm_style_eval_020,64,4096,2048,bf16,NVIDIA GeForce RTX 4060,c02,32,64,32,2,2,8,0.0,0.0,257.02399015426636,269.3119943141937,4.1775937855277165,1,3,3,1_4_4_r0,0,
2026-03-02T09:23:23.996257+00:00,B2,llm_style,eval,llm_style_eval_021,1,4096,8192,bf16,NVIDIA GeForce RTX 4060,c11,32,128,32,4,2,8,0.0,0.0,593.9199924468994,607.2524839639664,0.11299310488525102,0,3,3,0_4_4_r0,0,
2026-03-02T09:23:24.027229+00:00,B2,llm_style,eval,llm_style_eval_022,32,1024,4096,bf16,NVIDIA GeForce RTX 4060,c04,64,64,64,4,3,8,0.0,0.0,203.5360038280487,333.4246519207952,1.3188598132582954,0,3,3,1_3_4_r0,0,
2026-03-02T09:23:24.040784+00:00,B2,llm_style,eval,llm_style_eval_023,4,1024,1024,bf16,NVIDIA GeForce RTX 4060,c03,64,64,32,4,2,8,0.0,0.0,102.39999741315842,238.63295882940292,0.08192000206947331,0,3,3,0_3_3_r0,0,
2026-03-02T09:23:24.069414+00:00,B2,llm_style,eval,llm_style_eval_024,64,2048,2048,bf16,NVIDIA GeForce RTX 4060,c02,32,64,32,2,2,8,0.0,0.0,189.39200043678284,262.3692792654037,2.834707436226707,1,3,3,1_4_4_r0,0,
2026-03-02T09:23:24.466343+00:00,B2,llm_style,eval,llm_style_eval_025,32,8192,8192,bf16,NVIDIA GeForce RTX 4060,c02,32,64,32,2,2,8,0.0,0.0,1069.0560340881348,1198.5494494438171,4.017532438945961,0,3,3,1_4_4_r0,0,
2026-03-02T09:23:24.527312+00:00,B2,llm_style,eval,llm_style_eval_026,4,2048,4096,bf16,NVIDIA GeForce RTX 4060,c11,32,128,32,4,2,8,0.0,0.0,309.02399122714996,320.51199674606323,0.21716392870827697,0,3,3,0_4_4_r0,0,
2026-03-02T09:23:24.617126+00:00,B2,llm_style,eval,llm_style_eval_027,8,8192,2048,bf16,NVIDIA GeForce RTX 4060,c11,32,128,32,4,2,8,0.0,0.0,264.19198513031006,312.3916849493979,1.0160620726915577,0,3,3,0_4_4_r0,0,
2026-03-02T09:23:24.795294+00:00,B2,llm_style,eval,llm_style_eval_028,8,4096,8192,bf16,NVIDIA GeForce RTX 4060,c11,32,128,32,4,2,8,0.0,0.0,590.800017118454,660.0192105770109,0.9087185112460122,0,3,3,0_4_4_r0,0,
2026-03-02T09:23:24.820777+00:00,B2,llm_style,eval,llm_style_eval_029,8,2048,2048,bf16,NVIDIA GeForce RTX 4060,c11,32,128,32,4,2,8,0.0,0.0,130.89600205421448,165.88191986083984,0.5126884163521273,0,3,3,0_4_4_r0,0,
2026-03-02T09:23:24.868733+00:00,B2,llm_style,eval,llm_style_eval_030,1,4096,2048,bf16,NVIDIA GeForce RTX 4060,c11,32,128,32,4,2,8,0.0,0.0,166.9120043516159,242.1068789064883,0.10051533480274559,0,3,3,0_4_4_r0,0,
2026-03-02T09:23:24.958061+00:00,B2,llm_style,eval,llm_style_eval_031,16,8192,2048,bf16,NVIDIA GeForce RTX 4060,c11,32,128,32,4,2,8,0.0,0.0,265.21599292755127,363.54047656059265,2.0242780462589085,0,3,3,0_4_4_r0,0,
2026-03-02T09:23:24.984165+00:00,B2,llm_style,eval,llm_style_eval_032,1,2048,2048,bf16,NVIDIA GeForce RTX 4060,c11,32,128,32,4,2,8,0.0,0.0,164.8319959640503,218.68415877223003,0.050891866903253105,0,3,3,0_4_4_r0,0,
2026-03-02T09:23:25.163774+00:00,B2,llm_style,eval,llm_style_eval_033,16,8192,4096,bf16,NVIDIA GeForce RTX 4060,c11,32,128,32,4,2,8,0.0,0.0,485.3760004043579,573.3478218317031,2.212185652165507,0,3,3,0_4_4_r0,0,
2026-03-02T09:23:25.194388+00:00,B2,llm_style,eval,llm_style_eval_034,16,1024,4096,bf16,NVIDIA GeForce RTX 4060,c00,32,32,32,2,2,8,0.0,0.0,158.720001578331,193.5974459350109,0.8456257980426071,0,3,3,0_3_4_r0,0,
2026-03-02T09:23:25.284034+00:00,B2,llm_style,eval,llm_style_eval_035,4,8192,2048,bf16,NVIDIA GeForce RTX 4060,c11,32,128,32,4,2,8,0.0,0.0,260.09601354599,273.51039588451385,0.5160314691876956,0,3,3,0_4_4_r0,0,
2026-03-02T09:23:25.337589+00:00,B2,llm_style,eval,llm_style_eval_036,2,2048,4096,bf16,NVIDIA GeForce RTX 4060,c11,32,128,32,4,2,8,0.0,0.0,268.19200813770294,380.4876857995987,0.12511346714989174,0,3,3,0_4_4_r0,0,
2026-03-02T09:23:25.348082+00:00,B2,llm_style,eval,llm_style_eval_037,2,1024,1024,bf16,NVIDIA GeForce RTX 4060,c03,64,64,32,4,2,8,0.0,0.0,79.8719972372055,90.55680014193058,0.052512822329253514,0,3,3,0_3_3_r0,0,
2026-03-02T09:23:25.555197+00:00,B2,llm_style,eval,llm_style_eval_038,64,4096,8192,bf16,NVIDIA GeForce RTX 4060,c02,32,64,32,2,2,8,0.0,0.0,935.3120028972626,1079.961656332016,4.592015586986721,1,3,3,1_4_4_r0,0,
2026-03-02T09:23:25.571778+00:00,B2,llm_style,eval,llm_style_eval_039,4,1024,2048,bf16,NVIDIA GeForce RTX 4060,c00,32,32,32,2,2,8,0.0,0.0,101.3759970664978,147.95583695173252,0.16549495428385233,0,3,3,0_3_4_r0,0,
2026-03-02T09:23:25.627303+00:00,B2,llm_style,eval,llm_style_eval_040,64,8192,1024,bf16,NVIDIA GeForce RTX 4060,c04,64,64,64,4,3,8,0.0,0.0,241.02400243282318,355.2358445525168,4.454916577444469,1,3,3,1_4_3_r0,0,
2026-03-02T09:23:25.645753+00:00,B2,llm_style,eval,llm_style_eval_041,2,2048,1024,bf16,NVIDIA GeForce RTX 4060,c02,32,64,32,2,2,8,0.0,0.0,94.2080020904541,147.78367772698397,0.08904347628501508,0,3,3,0_4_3_r0,0,
2026-03-02T09:23:25.695702+00:00,B2,llm_style,eval,llm_style_eval_042,2,4096,2048,bf16,NVIDIA GeForce RTX 4060,c11,32,128,32,4,2,8,0.0,0.0,144.81599628925323,280.6169655919075,0.23170390605868496,0,3,3,0_4_4_r0,0,
2026-03-02T09:23:25.710023+00:00,B2,llm_style,eval,llm_style_eval_043,1,2048,1024,bf16,NVIDIA GeForce RTX 4060,c02,32,64,32,2,2,8,0.0,0.0,88.06400001049042,134.19519677758205,0.047627906971070624,0,3,3,0_4_3_r0,0,
2026-03-02T09:23:25.816810+00:00,B2,llm_style,eval,llm_style_eval_044,8,2048,8192,bf16,NVIDIA GeForce RTX 4060,c11,32,128,32,4,2,8,0.0,0.0,564.2240047454834,650.7724845409392,0.47576043157023945,0,3,3,0_4_4_r0,0,
2026-03-02T09:23:25.866710+00:00,B2,llm_style,eval,llm_style_eval_045,1,8192,1024,bf16,NVIDIA GeForce RTX 4060,c02,32,64,32,2,2,8,0.0,0.0,155.64799308776855,255.06815299391735,0.10778947847107462,0,3,3,0_4_3_r0,0,
2026-03-02T09:23:25.893760+00:00,B2,llm_style,eval,llm_style_eval_046,64,4096,1024,bf16,NVIDIA GeForce RTX 4060,c04,64,64,64,4,3,8,0.0,0.0,144.1439986228943,258.2857538759708,3.724545712128796,1,3,3,1_4_3_r0,0,
2026-03-02T09:23:25.918607+00:00,B2,llm_style,eval,llm_style_eval_047,16,2048,2048,bf16,NVIDIA GeForce RTX 4060,c11,32,128,32,4,2,8,0.0,0.0,147.8240042924881,164.36095923185346,0.907956245958766,0,3,3,0_4_4_r0,0,
2026-03-02T09:23:26.089178+00:00,B2,llm_style,eval,llm_style_eval_048,8,8192,4096,bf16,NVIDIA GeForce RTX 4060,c11,32,128,32,4,2,8,0.0,0.0,477.183997631073,567.8313654661179,1.1250815506497203,0,3,3,0_4_4_r0,0,
2026-03-02T09:23:26.326653+00:00,B2,llm_style,eval,llm_style_eval_049,4,4096,8192,bf16,NVIDIA GeForce RTX 4060,c11,32,128,32,4,2,8,0.0,0.0,589.8240208625793,638.2387202978134,0.45511109501344243,0,3,3,0_4_4_r0,0,
2026-03-02T09:23:26.443895+00:00,B2,llm_style,eval,llm_style_eval_050,4,2048,8192,bf16,NVIDIA GeForce RTX 4060,c11,32,128,32,4,2,8,0.0,0.0,704.5120000839233,768.0614167451859,0.1905116278842825,0,3,3,0_4_4_r0,0,
2026-03-02T09:23:26.457551+00:00,B2,llm_style,eval,llm_style_eval_051,16,1024,1024,bf16,NVIDIA GeForce RTX 4060,c03,64,64,32,4,2,8,0.0,0.0,99.69599917531013,161.43360614776608,0.33656748793897245,0,3,3,0_3_3_r0,0,
2026-03-02T09:23:26.642950+00:00,B2,llm_style,eval,llm_style_eval_052,32,8192,4096,bf16,NVIDIA GeForce RTX 4060,c02,32,64,32,2,2,8,0.0,0.0,654.8479795455933,752.81214594841,3.279362103995746,0,3,3,1_4_4_r0,0,
2026-03-02T09:23:26.662276+00:00,B2,llm_style,eval,llm_style_eval_053,32,1024,2048,bf16,NVIDIA GeForce RTX 4060,c04,64,64,64,4,3,8,0.0,0.0,146.43199741840363,224.020484983921,0.9165874287468502,0,3,3,1_3_4_r0,0,
2026-03-02T09:23:26.778738+00:00,B2,llm_style,eval,llm_style_eval_054,64,8192,2048,bf16,NVIDIA GeForce RTX 4060,c02,32,64,32,2,2,8,0.0,0.0,627.7120113372803,742.3686230182648,3.4211288125982993,1,3,3,1_4_4_r0,0,
2026-03-02T09:23:26.801789+00:00,B2,llm_style,eval,llm_style_eval_055,1,4096,1024,bf16,NVIDIA GeForce RTX 4060,c02,32,64,32,2,2,8,0.0,0.0,128.00000607967377,141.3734357059002,0.06553599688720718,0,3,3,0_4_3_r0,0,
2026-03-02T09:23:26.829439+00:00,B2,llm_style,eval,llm_style_eval_056,4,2048,2048,bf16,NVIDIA GeForce RTX 4060,c11,32,128,32,4,2,8,0.0,0.0,197.05600291490555,337.7302274107932,0.17027865938440745,0,3,3,0_4_4_r0,0,
2026-03-02T09:23:26.895419+00:00,B2,llm_style,eval,llm_style_eval_057,16,1024,8192,bf16,NVIDIA GeForce RTX 4060,c00,32,32,32,2,2,8,0.0,0.0,425.8880019187927,541.6960120201111,0.6302958871595181,0,3,3,0_3_4_r0,0,
2026-03-02T09:23:27.080496+00:00,B2,llm_style,eval,llm_style_eval_058,1,8192,4096,bf16,NVIDIA GeForce RTX 4060,c11,32,128,32,4,2,8,0.0,0.0,656.7679941654205,677.4438267946243,0.10218047255070298,0,3,3,0_4_4_r0,0,
2026-03-02T09:23:27.110216+00:00,B2,llm_style,eval,llm_style_eval_059,8,4096,1024,bf16,NVIDIA GeForce RTX 4060,c02,32,64,32,2,2,8,0.0,0.0,131.48800283670425,203.77600193023682,0.5103801301426937,0,3,3,0_4_3_r0,0,
2026-03-02T09:23:27.294247+00:00,B2,llm_style,eval,llm_style_eval_060,4,8192,4096,bf16,NVIDIA GeForce RTX 4060,c11,32,128,32,4,2,8,0.0,0.0,663.0400121212006,753.9036852121353,0.40485559105433183,0,3,3,0_4_4_r0,0,
2026-03-02T09:23:27.321736+00:00,B2,llm_style,eval,llm_style_eval_061,32,2048,2048,bf16,NVIDIA GeForce RTX 4060,c02,32,64,32,2,2,8,0.0,0.0,191.48799777030945,198.66015627980232,1.401839588515565,0,3,3,1_4_4_r0,0,
2026-03-02T09:23:27.340776+00:00,B2,llm_style,eval,llm_style_eval_062,8,2048,1024,bf16,NVIDIA GeForce RTX 4060,c02,32,64,32,2,2,8,0.0,0.0,143.23200285434723,292.5798448920249,0.2342663045361555,0,3,3,0_4_3_r0,0,
2026-03-02T09:23:27.533182+00:00,B2,llm_style,eval,llm_style_eval_063,16,4096,8192,bf16,NVIDIA GeForce RTX 4060,c11,32,128,32,4,2,8,0.0,0.0,796.5280115604401,871.8121623992918,1.3480277007414763,0,3,3,0_4_4_r0,0,
2026-03-02T09:23:27.760237+00:00,B2,training_style,tune,training_style_tune_000,4096,2048,1024,bf16,NVIDIA GeForce RTX 4060,c03,64,64,32,4,2,8,0.0,0.0,4160.5119705200195,4258.908281326294,4.129268057808928,3,3,3,4_4_3_r2,0,
2026-03-02T09:23:27.807828+00:00,B2,training_style,tune,training_style_tune_001,1536,2048,1536,bf16,NVIDIA GeForce RTX 4060,c06,64,128,32,4,3,8,0.0,0.0,332.7520042657852,417.08543568849547,29.041677562011472,3,3,3,4_4_4_r1,0,
2026-03-02T09:23:28.007297+00:00,B2,training_style,tune,training_style_tune_002,3072,2048,4096,bf16,NVIDIA GeForce RTX 4060,c06,64,128,32,4,3,8,0.0,0.0,1724.4319915771484,1901.680691242218,29.8878748502354,3,3,3,4_4_4_r1,0,
2026-03-02T09:23:28.066835+00:00,B2,training_style,tune,training_style_tune_003,2048,1536,2048,bf16,NVIDIA GeForce RTX 4060,c06,64,128,32,4,3,8,0.0,0.0,458.24000239372253,575.6723207235336,28.118238959263135,3,3,3,4_4_4_r1,0,
2026-03-02T09:23:28.078163+00:00,B2,training_style,tune,training_style_tune_004,512,512,1024,bf16,NVIDIA GeForce RTX 4060,c04,64,64,64,4,3,8,0.0,0.0,53.13599854707718,95.89984398335204,10.103713615626244,2,2,3,3_3_3_r1,0,
2026-03-02T09:23:30.427172+00:00,B2,training_style,tune,training_style_tune_005,1024,1536,1536,bf16,NVIDIA GeForce RTX 4060,c04,64,64,64,4,3,8,0.0,2348.968,161.79199516773224,280.71935057640076,29.86450722108198,3,3,3,3_4_4_r1,0,
2026-03-02T09:23:31.034596+00:00,B2,training_style,tune,training_style_tune_006,1024,1536,512,bf16,NVIDIA GeForce RTX 4060,c05,128,64,32,4,3,8,0.0,607.374,82.43199810385704,183.33695501089096,19.538683679252447,3,3,2,3_4_3_r1,0,
2026-03-02T09:23:31.054565+00:00,B2,training_style,tune,training_style_tune_007,2048,1536,512,bf16,NVIDIA GeForce RTX 4060,c10,64,128,64,8,3,8,0.0,0.0,162.59199380874634,297.0012864470482,19.811710260402258,3,3,2,4_4_3_r1,0,
2026-03-02T09:23:31.139539+00:00,B2,training_style,tune,training_style_tune_008,3072,3072,1536,bf16,NVIDIA GeForce RTX 4060,c06,64,128,32,4,3,8,0.0,0.0,895.0560092926025,942.5772738456726,32.39018446556516,3,3,3,4_4_4_r1,0,
2026-03-02T09:23:31.160648+00:00,B2,training_style,tune,training_style_tune_009,1024,1536,1024,bf16,NVIDIA GeForce RTX 4060,c05,128,64,32,4,3,8,0.0,0.0,128.00000607967377,199.14624258875844,25.165822804687558,3,3,3,3_4_3_r1,0,
2026-03-02T09:23:31.263308+00:00,B2,training_style,tune,training_style_tune_010,1536,2048,4096,bf16,NVIDIA GeForce RTX 4060,c06,64,128,32,4,3,8,0.0,0.0,785.9200239181519,839.3913346529007,32.78934623338182,3,3,3,4_4_4_r1,0,
2026-03-02T09:23:31.319456+00:00,B2,training_style,tune,training_style_tune_011,1024,1024,4096,bf16,NVIDIA GeForce RTX 4060,c04,64,64,64,4,3,8,0.0,0.0,271.40800654888153,361.2876826524733,31.649525381458936,3,3,3,3_3_4_r1,0,
2026-03-02T09:23:31.640808+00:00,B2,training_style,tune,training_style_tune_012,3072,4096,4096,bf16,NVIDIA GeForce RTX 4060,c06,64,128,32,4,3,8,0.0,0.0,3157.5039625167847,3188.7359619140625,32.64579120966093,3,3,3,4_4_4_r1,0,
2026-03-02T09:23:32.545618+00:00,B2,training_style,tune,training_style_tune_013,512,1024,3072,bf16,NVIDIA GeForce RTX 4060,c04,64,64,64,4,3,8,0.0,904.752,136.19199395179749,203.529605269432,23.65209127593866,2,3,3,3_3_4_r0,0,
2026-03-02T09:23:32.563323+00:00,B2,training_style,tune,training_style_tune_014,1536,1024,1024,bf16,NVIDIA GeForce RTX 4060,c03,64,64,32,4,2,8,0.0,0.0,126.80000066757202,193.3824019134044,25.403986238493765,3,3,3,4_3_3_r1,0,
2026-03-02T09:23:32.622243+00:00,B2,training_style,tune,training_style_tune_015,2048,3072,1536,bf16,NVIDIA GeForce RTX 4060,c06,64,128,32,4,3,8,0.0,0.0,596.992015838623,622.612481713295,32.37455831775229,3,3,3,4_4_4_r1,0,
2026-03-02T09:23:39.480918+00:00,B2,training_style,tune,training_style_tune_016,1536,3072,3072,bf16,NVIDIA GeForce RTX 4060,c07,128,128,32,8,3,8,0.0,6858.616,870.9120154380798,936.2636834383011,33.28812639405043,3,3,3,4_4_4_r0,0,
2026-03-02T09:23:39.510538+00:00,B2,training_style,tune,training_style_tune_017,1024,1024,2048,bf16,NVIDIA GeForce RTX 4060,c04,64,64,64,4,3,8,0.0,0.0,172.54400253295898,237.98848122358322,24.89201150401959,3,3,3,3_3_4_r1,0,
2026-03-02T09:23:39.541911+00:00,B2,training_style,tune,training_style_tune_018,1536,1536,1536,bf16,NVIDIA GeForce RTX 4060,c06,64,128,32,4,3,8,0.0,0.0,241.20000004768372,274.40351784229273,30.04874506868642,3,3,3,4_4_4_r1,0,
2026-03-02T09:23:39.585857+00:00,B2,training_style,tune,training_style_tune_019,1536,1536,2048,bf16,NVIDIA GeForce RTX 4060,c06,64,128,32,4,3,8,0.0,0.0,290.8160090446472,471.8284869194028,33.22952009329168,3,3,3,4_4_4_r1,0,
2026-03-02T09:23:39.611460+00:00,B2,training_style,tune,training_style_tune_020,1536,1536,1024,bf16,NVIDIA GeForce RTX 4060,c10,64,128,64,8,3,8,0.0,0.0,177.96800285577774,256.52735069394106,27.150038942200414,3,3,3,4_4_3_r1,0,
2026-03-02T09:23:39.641988+00:00,B2,training_style,tune,training_style_tune_021,1024,2048,1536,bf16,NVIDIA GeForce RTX 4060,c09,128,64,64,8,3,8,0.0,0.0,232.2079986333847,317.06111907958984,27.744311056965305,3,3,3,3_4_4_r0,0,
2026-03-02T09:23:39.656851+00:00,B2,training_style,tune,training_style_tune_022,512,1024,1536,bf16,NVIDIA GeForce RTX 4060,c04,64,64,64,4,3,8,0.0,0.0,97.34399989247322,169.3027238547802,16.545577927546564,2,3,3,3_3_4_r0,0,
2026-03-02T09:23:39.707290+00:00,B2,training_style,tune,training_style_tune_023,1536,2048,2048,bf16,NVIDIA GeForce RTX 4060,c06,64,128,32,4,3,8,0.0,0.0,406.8959951400757,480.8601552248001,31.6663276166292,3,3,3,4_4_4_r1,0,
2026-03-02T09:23:39.722608+00:00,B2,training_style,tune,training_style_tune_024,1024,1024,1024,bf16,NVIDIA GeForce RTX 4060,c04,64,64,64,4,3,8,0.0,0.0,99.27999973297119,211.71199336647982,21.63057668992735,3,3,3,3_3_3_r1,0,
2026-03-02T09:23:42.520648+00:00,B2,training_style,tune,training_style_tune_025,1536,1024,4096,bf16,NVIDIA GeForce RTX 4060,c04,64,64,64,4,3,8,0.0,2797.997,394.0799981355667,584.2009747028349,32.69615801096175,3,3,3,4_3_4_r1,0,
2026-03-02T09:23:44.225606+00:00,B2,training_style,tune,training_style_tune_026,2048,4096,512,bf16,NVIDIA GeForce RTX 4060,c03,64,64,32,4,2,8,0.0,1704.907,272.831991314888,421.6281634569167,31.484337854228976,3,3,2,4_4_3_r0,0,
2026-03-02T09:23:44.375856+00:00,B2,training_style,tune,training_style_tune_027,4096,4096,1536,bf16,NVIDIA GeForce RTX 4060,c06,64,128,32,4,3,8,0.0,0.0,1567.4880146980286,1647.097910642624,32.88038381711578,3,3,3,4_4_4_r1,0,
2026-03-02T09:23:44.464703+00:00,B2,training_style,tune,training_style_tune_028,1536,1536,4096,bf16,NVIDIA GeForce RTX 4060,c06,64,128,32,4,3,8,0.0,0.0,597.5040197372437,807.1350395679474,32.346816412213144,3,3,3,4_4_4_r1,0,
2026-03-02T09:23:51.376795+00:00,B2,training_style,tune,training_style_tune_029,4096,2048,2048,bf16,NVIDIA GeForce RTX 4060,c06,64,128,32,4,3,8,0.0,6912.027,1015.7600045204163,1208.896995782852,33.82663051812392,3,3,3,4_4_4_r2,0,
2026-03-02T09:23:51.406321+00:00,B2,training_style,tune,training_style_tune_030,2048,2048,512,bf16,NVIDIA GeForce RTX 4060,c10,64,128,64,8,3,8,0.0,0.0,182.73600190877914,304.6249660849569,23.503673338240294,3,3,2,4_4_3_r1,0,
2026-03-02T09:23:51.422457+00:00,B2,training_style,tune,training_style_tune_031,512,512,1536,bf16,NVIDIA GeForce RTX 4060,c04,64,64,64,4,3,8,0.0,0.0,81.9999985396862,197.70208179950708,9.820809540749556,2,2,3,3_3_4_r1,0,
2026-03-02T09:23:51.496420+00:00,B2,training_style,eval,training_style_eval_000,2048,1536,3072,bf16,NVIDIA GeForce RTX 4060,c06,64,128,32,4,3,8,0.0,0.0,596.992015838623,679.6854555606842,32.37455831775229,3,3,3,4_4_4_r1,0,
2026-03-02T09:23:51.539214+00:00,B2,training_style,eval,training_style_eval_001,1024,2048,2048,bf16,NVIDIA GeForce RTX 4060,c09,128,64,64,8,3,8,0.0,0.0,294.8160022497177,424.71807479858387,29.136595457678297,3,3,3,3_4_4_r0,0,
2026-03-02T09:23:51.583335+00:00,B2,training_style,eval,training_style_eval_002,1536,1024,3072,bf16,NVIDIA GeForce RTX 4060,c04,64,64,64,4,3,8,0.0,0.0,316.4159953594208,437.57567167282093,30.541048991606484,3,3,3,4_3_4_r1,0,
2026-03-02T09:23:51.892726+00:00,B2,training_style,eval,training_style_eval_003,1024,512,1024,bf16,NVIDIA GeForce RTX 4060,c10,64,128,64,8,3,8,0.0,309.328,63.40799853205681,74.67872209846973,16.933854542927335,3,2,3,3_3_3_r2,0,
2026-03-02T09:23:51.912974+00:00,B2,training_style,eval,training_style_eval_004,1024,2048,1024,bf16,NVIDIA GeForce RTX 4060,c11,32,128,32,4,2,8,0.0,0.0,164.0319973230362,177.06240683794022,26.183716385173994,3,3,3,3_4_3_r0,0,
2026-03-02T09:23:51.928856+00:00,B2,training_style,eval,training_style_eval_005,1024,512,1536,bf16,NVIDIA GeForce RTX 4060,c09,128,64,64,8,3,8,0.0,0.0,93.18400174379349,127.54208154976365,17.284219456772522,3,2,3,3_3_4_r2,0,
2026-03-02T09:23:51.979151+00:00,B2,training_style,eval,training_style_eval_006,2048,1536,2048,bf16,NVIDIA GeForce RTX 4060,c06,64,128,32,4,3,8,0.0,0.0,408.57601165771484,431.6262483596802,31.536119400946,3,3,3,4_4_4_r1,0,
2026-03-02T09:23:52.008240+00:00,B2,training_style,eval,training_style_eval_007,1536,2048,1024,bf16,NVIDIA GeForce RTX 4060,c10,64,128,64,8,3,8,0.0,0.0,230.9119999408722,304.23040598630905,27.90002661468294,3,3,3,4_4_3_r1,0,
2026-03-02T09:23:52.023533+00:00,B2,training_style,eval,training_style_eval_008,512,512,2048,bf16,NVIDIA GeForce RTX 4060,c04,64,64,64,4,3,8,0.0,0.0,97.08800166845322,219.04576867818798,11.059469816535431,2,2,3,3_3_4_r1,0,
2026-03-02T09:23:52.044361+00:00,B2,training_style,eval,training_style_eval_009,1024,512,2048,bf16,NVIDIA GeForce RTX 4060,c09,128,64,64,8,3,8,0.0,0.0,135.16800105571747,205.9059226512909,15.88751502742715,3,2,3,3_3_4_r2,0,
2026-03-02T09:23:52.088775+00:00,B2,training_style,eval,training_style_eval_010,2048,3072,1024,bf16,NVIDIA GeForce RTX 4060,c10,64,128,64,8,3,8,0.0,0.0,424.8479902744293,476.6201415657996,30.32826371539862,3,3,3,4_4_3_r1,0,
2026-03-02T09:23:52.169832+00:00,B2,training_style,eval,training_style_eval_011,2048,4096,1536,bf16,NVIDIA GeForce RTX 4060,c07,128,128,32,8,3,8,0.0,0.0,849.4080007076263,887.7795177698135,30.33854608684124,3,3,3,4_4_4_r0,0,
2026-03-02T09:23:52.293189+00:00,B2,training_style,eval,training_style_eval_012,2048,3072,3072,bf16,NVIDIA GeForce RTX 4060,c06,64,128,32,4,3,8,0.0,0.0,1153.0399918556213,1298.9951968193054,33.52416736369381,3,3,3,4_4_4_r1,0,
2026-03-02T09:23:52.355437+00:00,B2,training_style,eval,training_style_eval_013,3072,1536,1536,bf16,NVIDIA GeForce RTX 4060,c06,64,128,32,4,3,8,0.0,0.0,458.6400091648102,539.0627413988112,31.605429823701016,3,3,3,4_4_4_r2,0,
2026-03-02T09:23:52.396792+00:00,B2,training_style,eval,training_style_eval_014,2048,1536,1536,bf16,NVIDIA GeForce RTX 4060,c06,64,128,32,4,3,8,0.0,0.0,311.75999343395233,359.90814924240095,30.997166472699746,3,3,3,4_4_4_r1,0,
2026-03-02T09:23:52.454142+00:00,B2,training_style,eval,training_style_eval_015,4096,2048,1024,bf16,NVIDIA GeForce RTX 4060,c03,64,64,32,4,2,8,0.0,0.0,545.7919836044312,555.4812663793564,31.476954041251183,3,3,3,4_4_3_r2,0,
2026-03-02T09:23:52.467412+00:00,B2,training_style,eval,training_style_eval_016,2048,1024,512,bf16,NVIDIA GeForce RTX 4060,c09,128,64,64,8,3,8,0.0,0.0,98.81599992513657,136.06047682464114,21.732145094184574,3,3,2,4_3_3_r2,0,
2026-03-02T09:23:52.584873+00:00,B2,training_style,eval,training_style_eval_017,2048,4096,2048,bf16,NVIDIA GeForce RTX 4060,c07,128,128,32,8,3,8,0.0,0.0,1103.808045387268,1129.4655871391296,31.12836376903285,3,3,3,4_4_4_r0,0,
2026-03-02T09:23:52.658278+00:00,B2,training_style,eval,training_style_eval_018,1536,2048,3072,bf16,NVIDIA GeForce RTX 4060,c06,64,128,32,4,3,8,0.0,0.0,600.5920171737671,628.4799855947495,32.180502369894285,3,3,3,4_4_4_r1,0,
2026-03-02T09:23:52.715012+00:00,B2,training_style,eval,training_style_eval_019,1536,1536,3072,bf16,NVIDIA GeForce RTX 4060,c06,64,128,32,4,3,8,0.0,0.0,452.89599895477295,535.7673645019529,32.00627662300799,3,3,3,4_4_4_r1,0,
2026-03-02T09:23:52.784739+00:00,B2,training_style,eval,training_style_eval_020,3072,1536,2048,bf16,NVIDIA GeForce RTX 4060,c06,64,128,32,4,3,8,0.0,0.0,603.520005941391,664.2140650749207,32.02437805164808,3,3,3,4_4_4_r2,0,
2026-03-02T09:23:52.877422+00:00,B2,training_style,eval,training_style_eval_021,2048,1024,4096,bf16,NVIDIA GeForce RTX 4060,c10,64,128,64,8,3,8,0.0,0.0,558.0800175666809,574.0803134441376,30.783881599823278,3,3,3,4_3_4_r2,0,
2026-03-02T09:23:52.893564+00:00,B2,training_style,eval,training_style_eval_022,512,512,1536,bf16,NVIDIA GeForce RTX 4060,c04,64,64,64,4,3,8,0.0,0.0,68.97599995136261,123.48063923418516,11.675167718740573,2,2,3,3_3_4_r1,0,
2026-03-02T09:23:53.223407+00:00,B2,training_style,eval,training_style_eval_023,3072,4096,4096,bf16,NVIDIA GeForce RTX 4060,c06,64,128,32,4,3,8,0.0,0.0,3134.239912033081,3172.320649623871,32.88810620662916,3,3,3,4_4_4_r1,0,
2026-03-02T09:23:53.290772+00:00,B2,training_style,eval,training_style_eval_024,1536,1024,4096,bf16,NVIDIA GeForce RTX 4060,c04,64,64,64,4,3,8,0.0,0.0,414.71999883651733,551.6799968481064,31.0689186056813,3,3,3,4_3_4_r1,0,
2026-03-02T09:23:53.444132+00:00,B2,training_style,eval,training_style_eval_025,4096,3072,2048,bf16,NVIDIA GeForce RTX 4060,c06,64,128,32,4,3,8,0.0,0.0,1550.063967704773,1701.9126319885254,33.24998750104247,3,3,3,4_4_4_r1,0,
2026-03-02T09:23:53.456046+00:00,B2,training_style,eval,training_style_eval_026,1024,512,512,bf16,NVIDIA GeForce RTX 4060,c10,64,128,64,8,3,8,0.0,0.0,52.112000063061714,108.3455988019704,10.30225113889934,3,2,2,3_3_3_r2,0,
2026-03-02T09:23:53.509261+00:00,B2,training_style,eval,training_style_eval_027,2048,4096,1024,bf16,NVIDIA GeForce RTX 4060,c03,64,64,32,4,2,8,0.0,0.0,518.5120105743408,556.0729622840881,33.133020708566335,3,3,3,4_4_3_r0,0,
2026-03-02T09:23:53.543700+00:00,B2,training_style,eval,training_style_eval_028,1536,1536,1024,bf16,NVIDIA GeForce RTX 4060,c10,64,128,64,8,3,8,0.0,0.0,187.77599930763245,326.75839871168137,25.731926475246844,3,3,3,4_4_3_r1,0,
2026-03-02T09:23:53.579721+00:00,B2,training_style,eval,training_style_eval_029,1024,512,4096,bf16,NVIDIA GeForce RTX 4060,c09,128,64,64,8,3,8,0.0,0.0,154.4800028204918,261.23327910900116,27.802739627023566,3,2,3,3_3_4_r2,0,
2026-03-02T09:23:53.616104+00:00,B2,training_style,eval,training_style_eval_030,1024,1024,3072,bf16,NVIDIA GeForce RTX 4060,c04,64,64,64,4,3,8,0.0,0.0,238.44800144433975,442.2841641306876,27.01826354163779,3,3,3,3_3_4_r1,0,
2026-03-02T09:23:53.628282+00:00,B2,training_style,eval,training_style_eval_031,1024,1024,512,bf16,NVIDIA GeForce RTX 4060,c04,64,64,64,4,3,8,0.0,0.0,79.21599969267845,426.38334333896603,13.554608010573912,3,3,2,3_3_3_r1,0,
2026-03-02T09:23:53.641895+00:00,B2,training_style,eval,training_style_eval_032,512,1024,1024,bf16,NVIDIA GeForce RTX 4060,c03,64,64,32,4,2,8,0.0,0.0,92.14400127530098,209.04384285211557,11.652867350441557,2,3,3,3_3_3_r0,0,
2026-03-02T09:23:53.721390+00:00,B2,training_style,eval,training_style_eval_033,3072,2048,2048,bf16,NVIDIA GeForce RTX 4060,c06,64,128,32,4,3,8,0.0,0.0,786.8160009384155,821.2553721666336,32.75200776962467,3,3,3,4_4_4_r1,0,
2026-03-02T09:23:53.733082+00:00,B2,training_style,eval,training_style_eval_034,1536,1024,512,bf16,NVIDIA GeForce RTX 4060,c03,64,64,32,4,2,8,0.0,0.0,81.91999793052673,128.16351927816865,19.6608004966736,3,3,2,4_3_3_r1,0,
2026-03-02T09:23:54.143582+00:00,B2,training_style,eval,training_style_eval_035,4096,4096,4096,bf16,NVIDIA GeForce RTX 4060,c06,64,128,32,4,3,8,0.0,0.0,4327.744007110596,4414.946103096008,31.757643993310197,3,3,3,4_4_4_r1,0,
2026-03-02T09:23:54.384024+00:00,B2,training_style,eval,training_style_eval_036,2048,4096,4096,bf16,NVIDIA GeForce RTX 4060,c07,128,128,32,8,3,8,0.0,0.0,2103.2639741897583,2149.4784331321716,32.67277792007675,3,3,3,4_4_4_r0,0,
2026-03-02T09:23:54.426679+00:00,B2,training_style,eval,training_style_eval_037,4096,2048,512,bf16,NVIDIA GeForce RTX 4060,c03,64,64,32,4,2,8,0.0,0.0,294.92799937725067,394.80448096990574,29.125531011426194,3,3,2,4_4_3_r2,0,
2026-03-02T09:23:54.445390+00:00,B2,training_style,eval,training_style_eval_038,2048,1536,512,bf16,NVIDIA GeForce RTX 4060,c10,64,128,64,8,3,8,0.0,0.0,132.54400342702866,208.61951962113375,24.30306455752581,3,3,2,4_4_3_r1,0,
2026-03-02T09:23:54.537103+00:00,B2,training_style,eval,training_style_eval_039,3072,3072,1536,bf16,NVIDIA GeForce RTX 4060,c06,64,128,32,4,3,8,0.0,0.0,857.0240139961243,1039.8563325405119,33.82755765829813,3,3,3,4_4_4_r1,0,
2026-03-02T09:23:54.566499+00:00,B2,training_style,eval,training_style_eval_040,1536,1536,512,bf16,NVIDIA GeForce RTX 4060,c10,64,128,64,8,3,8,0.0,0.0,110.59200018644333,249.46048036217653,21.845333296505025,3,3,2,4_4_3_r1,0,
2026-03-02T09:23:54.682833+00:00,B2,training_style,eval,training_style_eval_041,3072,3072,2048,bf16,NVIDIA GeForce RTX 4060,c06,64,128,32,4,3,8,0.0,0.0,1136.128008365631,1223.8847601413727,34.023195783727274,3,3,3,4_4_4_r1,0,
2026-03-02T09:23:54.798260+00:00,B2,training_style,eval,training_style_eval_042,3072,4096,1536,bf16,NVIDIA GeForce RTX 4060,c06,64,128,32,4,3,8,0.0,0.0,1188.368022441864,1347.9872345924377,32.52755454036211,3,3,3,4_4_4_r1,0,
2026-03-02T09:23:54.876946+00:00,B2,training_style,eval,training_style_eval_043,2048,3072,1536,bf16,NVIDIA GeForce RTX 4060,c06,64,128,32,4,3,8,0.0,0.0,602.9599905014038,767.5808238983154,32.0541215610806,3,3,3,4_4_4_r1,0,
2026-03-02T09:23:54.899992+00:00,B2,training_style,eval,training_style_eval_044,512,512,4096,bf16,NVIDIA GeForce RTX 4060,c04,64,64,64,4,3,8,0.0,0.0,109.56799983978271,230.8252809941768,19.599551430528866,2,2,3,3_3_4_r1,0,
2026-03-02T09:23:54.956599+00:00,B2,training_style,eval,training_style_eval_045,2048,1024,3072,bf16,NVIDIA GeForce RTX 4060,c10,64,128,64,8,3,8,0.0,0.0,423.93600940704346,450.13534903526306,30.393506571951807,3,3,3,4_3_4_r2,0,
2026-03-02T09:23:55.296231+00:00,B2,training_style,eval,training_style_eval_046,4096,3072,4096,bf16,NVIDIA GeForce RTX 4060,c06,64,128,32,4,3,8,0.0,0.0,3241.9838905334473,3295.1090502738953,31.795104042617247,3,3,3,4_4_4_r1,0,
2026-03-02T09:23:55.345874+00:00,B2,training_style,eval,training_style_eval_047,1536,3072,1024,bf16,NVIDIA GeForce RTX 4060,c03,64,64,32,4,2,8,0.0,0.0,324.6079981327057,532.4335813522339,29.770296701220875,3,3,3,4_4_3_r0,0,
2026-03-02T09:23:55.364958+00:00,B2,training_style,eval,training_style_eval_048,512,512,3072,bf16,NVIDIA GeForce RTX 4060,c04,64,64,64,4,3,8,0.0,0.0,64.51199948787689,143.75103838741768,24.96609543628649,2,2,3,3_3_4_r1,0,
2026-03-02T09:23:55.395556+00:00,B2,training_style,eval,training_style_eval_049,512,1024,4096,bf16,NVIDIA GeForce RTX 4060,c04,64,64,64,4,3,8,0.0,0.0,182.27200210094452,232.36319944262505,23.563505346374555,2,3,3,3_3_4_r0,0,
2026-03-02T09:23:55.420203+00:00,B2,training_style,eval,training_style_eval_050,3072,2048,512,bf16,NVIDIA GeForce RTX 4060,c10,64,128,64,8,3,8,0.0,0.0,236.52800172567368,307.4252799153328,27.237582429973706,3,3,2,4_4_3_r1,0,
2026-03-02T09:23:55.431074+00:00,B2,training_style,eval,training_style_eval_051,512,512,1024,bf16,NVIDIA GeForce RTX 4060,c04,64,64,64,4,3,8,0.0,0.0,53.247999399900436,116.22943997383112,10.08246165208986,2,2,3,3_3_3_r1,0,
2026-03-02T09:23:55.471922+00:00,B2,training_style,eval,training_style_eval_052,1536,2048,1536,bf16,NVIDIA GeForce RTX 4060,c06,64,128,32,4,3,8,0.0,0.0,323.5680013895035,411.4124664664268,29.86598296030854,3,3,3,4_4_4_r1,0,
2026-03-02T09:23:55.572395+00:00,B2,training_style,eval,training_style_eval_053,1536,3072,3072,bf16,NVIDIA GeForce RTX 4060,c07,128,128,32,8,3,8,0.0,0.0,904.0959775447845,974.4179147481917,32.06631814326806,3,3,3,4_4_4_r0,0,
2026-03-02T09:23:55.614659+00:00,B2,training_style,eval,training_style_eval_054,4096,3072,512,bf16,NVIDIA GeForce RTX 4060,c10,64,128,64,8,3,8,0.0,0.0,436.2240135669708,469.49855506420135,29.53735119403705,3,3,2,4_4_3_r1,0,
2026-03-02T09:23:55.632021+00:00,B2,training_style,eval,training_style_eval_055,1024,1024,1024,bf16,NVIDIA GeForce RTX 4060,c04,64,64,64,4,3,8,0.0,0.0,108.0319993197918,600.3913733363136,19.878218134639063,3,3,3,3_3_3_r1,0,
2026-03-02T09:23:55.663600+00:00,B2,training_style,eval,training_style_eval_056,512,1024,3072,bf16,NVIDIA GeForce RTX 4060,c04,64,64,64,4,3,8,0.0,0.0,117.76000261306763,299.7686436772346,27.354155914756628,2,3,3,3_3_4_r0,0,
2026-03-02T09:23:55.684454+00:00,B2,training_style,eval,training_style_eval_057,1024,1536,1024,bf16,NVIDIA GeForce RTX 4060,c05,128,64,32,4,3,8,0.0,0.0,127.96800583600998,206.75711944699282,25.1721158812772,3,3,3,3_4_3_r1,0,
2026-03-02T09:23:55.800032+00:00,B2,training_style,eval,training_style_eval_058,4096,2048,2048,bf16,NVIDIA GeForce RTX 4060,c06,64,128,32,4,3,8,0.0,0.0,1056.2559962272644,1163.6301028728485,32.52974514769727,3,3,3,4_4_4_r2,0,
2026-03-02T09:23:55.826604+00:00,B2,training_style,eval,training_style_eval_059,2048,3072,512,bf16,NVIDIA GeForce RTX 4060,c10,64,128,64,8,3,8,0.0,0.0,237.56800591945648,426.30146056413594,27.118344151881324,3,3,2,4_4_3_r1,0,
2026-03-02T09:23:55.859631+00:00,B2,training_style,eval,training_style_eval_060,3072,3072,512,bf16,NVIDIA GeForce RTX 4060,c10,64,128,64,8,3,8,0.0,0.0,336.8480056524277,463.9315089583396,28.688536829193342,3,3,2,4_4_3_r1,0,
2026-03-02T09:23:55.924551+00:00,B2,training_style,eval,training_style_eval_061,2048,2048,2048,bf16,NVIDIA GeForce RTX 4060,c06,64,128,32,4,3,8,0.0,0.0,551.6480207443237,616.7795145511625,31.142809432760526,3,3,3,4_4_4_r1,0,
2026-03-02T09:23:55.938614+00:00,B2,training_style,eval,training_style_eval_062,1024,2048,512,bf16,NVIDIA GeForce RTX 4060,c11,32,128,32,4,2,8,0.0,0.0,104.52799871563911,229.26208168268204,20.544578241109104,3,3,2,3_4_3_r0,0,
2026-03-02T09:23:56.049651+00:00,B2,training_style,eval,training_style_eval_063,3072,1536,3072,bf16,NVIDIA GeForce RTX 4060,c06,64,128,32,4,3,8,0.0,0.0,882.1759819984436,996.6012477874755,32.86309062997268,3,3,3,4_4_4_r2,0,
2026-03-02T09:23:56.065044+00:00,B2,adversarial,tune,adversarial_tune_000,1,1024,1024,bf16,NVIDIA GeForce RTX 4060,c03,64,64,32,4,2,8,0.0,0.0,37.21600025892258,331.9523185491556,0.056350816460917386,0,3,3,0_3_3_r0,0,
2026-03-02T09:23:56.084620+00:00,B2,adversarial,tune,adversarial_tune_001,1,1024,4096,bf16,NVIDIA GeForce RTX 4060,c00,32,32,32,2,2,8,0.0,0.0,62.30400130152702,73.60736154019833,0.13463995609852433,0,3,3,0_3_4_r0,0,
2026-03-02T09:23:56.101769+00:00,B2,adversarial,tune,adversarial_tune_002,1,4096,1024,bf16,NVIDIA GeForce RTX 4060,c02,32,64,32,2,2,8,0.0,0.0,41.40800051391125,139.8483251035213,0.20258423241619214,0,3,3,0_4_3_r0,0,
2026-03-02T09:23:56.191132+00:00,B2,adversarial,tune,adversarial_tune_003,1,4096,4096,bf16,NVIDIA GeForce RTX 4060,c11,32,128,32,4,2,8,0.0,0.0,193.02400201559067,293.9084827899933,0.17383554195135684,0,3,3,0_4_4_r0,0,
2026-03-02T09:23:56.230835+00:00,B2,adversarial,tune,adversarial_tune_004,1,8192,1024,bf16,NVIDIA GeForce RTX 4060,c02,32,64,32,2,2,8,0.0,0.0,50.175998359918594,99.56351615488515,0.334367357868098,0,3,3,0_4_3_r0,0,
2026-03-02T09:23:56.395557+00:00,B2,adversarial,tune,adversarial_tune_005,1,8192,4096,bf16,NVIDIA GeForce RTX 4060,c11,32,128,32,4,2,8,0.0,0.0,293.88800263404846,320.04705160856247,0.22834843000911628,0,3,3,0_4_4_r0,0,
2026-03-02T09:23:56.404196+00:00,B2,adversarial,tune,adversarial_tune_006,2,1024,1024,bf16,NVIDIA GeForce RTX 4060,c03,64,64,32,4,2,8,0.0,0.0,44.863998889923096,107.46335782110688,0.0934893033117938,0,3,3,0_3_3_r0,0,
2026-03-02T09:23:56.422966+00:00,B2,adversarial,tune,adversarial_tune_007,2,1024,4096,bf16,NVIDIA GeForce RTX 4060,c00,32,32,32,2,2,8,0.0,0.0,62.463998794555664,94.65087808668605,0.2685901691177398,0,3,3,0_3_4_r0,0,
2026-03-02T09:23:56.442974+00:00,B2,adversarial,tune,adversarial_tune_008,2,4096,1024,bf16,NVIDIA GeForce RTX 4060,c02,32,64,32,2,2,8,0.0,0.0,61.43999844789505,241.07007950544352,0.27306667356491104,0,3,3,0_4_3_r0,0,
2026-03-02T09:23:56.539319+00:00,B2,adversarial,tune,adversarial_tune_009,2,4096,4096,bf16,NVIDIA GeForce RTX 4060,c11,32,128,32,4,2,8,0.0,0.0,162.81600296497345,448.6553695797914,0.41217609312296594,0,3,3,0_4_4_r0,0,
2026-03-02T09:23:56.579812+00:00,B2,adversarial,tune,adversarial_tune_010,2,8192,1024,bf16,NVIDIA GeForce RTX 4060,c02,32,64,32,2,2,8,0.0,0.0,61.43999844789505,124.36384379863738,0.5461333471298221,0,3,3,0_4_3_r0,0,
2026-03-02T09:23:56.746249+00:00,B2,adversarial,tune,adversarial_tune_011,2,8192,4096,bf16,NVIDIA GeForce RTX 4060,c11,32,128,32,4,2,8,0.0,0.0,292.7519977092743,331.7577636241913,0.45846904222764256,0,3,3,0_4_4_r0,0,
2026-03-02T09:23:56.754919+00:00,B2,adversarial,tune,adversarial_tune_012,4,1024,1024,bf16,NVIDIA GeForce RTX 4060,c03,64,64,32,4,2,8,0.0,0.0,39.76000100374222,117.9238426685333,0.21098108119289188,0,3,3,0_3_3_r0,0,
2026-03-02T09:23:56.773467+00:00,B2,adversarial,tune,adversarial_tune_013,4,1024,4096,bf16,NVIDIA GeForce RTX 4060,c00,32,32,32,2,2,8,0.0,0.0,57.34400078654289,145.51039710640907,0.5851428491169093,0,3,3,0_3_4_r0,0,
2026-03-02T09:23:56.790294+00:00,B2,adversarial,tune,adversarial_tune_014,4,4096,1024,bf16,NVIDIA GeForce RTX 4060,c02,32,64,32,2,2,8,0.0,0.0,38.39999996125698,113.13439950346944,0.8738133342149522,0,3,3,0_4_3_r0,0,
2026-03-02T09:23:56.880042+00:00,B2,adversarial,tune,adversarial_tune_015,4,4096,4096,bf16,NVIDIA GeForce RTX 4060,c11,32,128,32,4,2,8,0.0,0.0,190.3040036559105,242.25984394550323,0.7052806321546429,0,3,3,0_4_4_r0,0,
2026-03-02T09:23:56.924621+00:00,B2,adversarial,tune,adversarial_tune_016,4,8192,1024,bf16,NVIDIA GeForce RTX 4060,c02,32,64,32,2,2,8,0.0,0.0,50.67200027406216,158.40255767107004,1.3243776372955125,0,3,3,0_4_3_r0,0,
2026-03-02T09:23:57.085896+00:00,B2,adversarial,tune,adversarial_tune_017,4,8192,4096,bf16,NVIDIA GeForce RTX 4060,c11,32,128,32,4,2,8,0.0,0.0,294.7999984025955,372.78496086597414,0.9105680374984582,0,3,3,0_4_4_r0,0,
2026-03-02T09:23:57.098765+00:00,B2,adversarial,tune,adversarial_tune_018,8,1024,1024,bf16,NVIDIA GeForce RTX 4060,c03,64,64,32,4,2,8,0.0,0.0,35.8240008354187,50.70304024964571,0.468323347720911,0,3,3,0_3_3_r0,0,
2026-03-02T09:23:57.121070+00:00,B2,adversarial,tune,adversarial_tune_019,8,1024,4096,bf16,NVIDIA GeForce RTX 4060,c00,32,32,32,2,2,8,0.0,0.0,60.30400097370148,100.29279932379721,1.1128426458679934,0,3,3,0_3_4_r0,0,
2026-03-02T09:23:57.141651+00:00,B2,adversarial,tune,adversarial_tune_020,8,4096,1024,bf16,NVIDIA GeForce RTX 4060,c02,32,64,32,2,2,8,0.0,0.0,41.98399931192398,126.05440162122248,1.5984390505870707,0,3,3,0_4_3_r0,0,
2026-03-02T09:23:57.226682+00:00,B2,adversarial,tune,adversarial_tune_021,8,4096,4096,bf16,NVIDIA GeForce RTX 4060,c11,32,128,32,4,2,8,0.0,0.0,164.70400243997574,268.2815980911254,1.629805299344974,0,3,3,0_4_4_r0,0,
2026-03-02T09:23:57.267504+00:00,B2,adversarial,tune,adversarial_tune_022,8,8192,1024,bf16,NVIDIA GeForce RTX 4060,c02,32,64,32,2,2,8,0.0,0.0,49.15200173854828,128.078081831336,2.730666570080655,0,3,3,0_4_3_r0,0,
2026-03-02T09:23:57.427644+00:00,B2,adversarial,tune,adversarial_tune_023,8,8192,4096,bf16,NVIDIA GeForce RTX 4060,c11,32,128,32,4,2,8,0.0,0.0,322.09600508213043,397.5679966807364,1.6668040072807009,0,3,3,0_4_4_r0,0,
2026-03-02T09:23:57.438324+00:00,B2,adversarial,tune,adversarial_tune_024,16,1024,1024,bf16,NVIDIA GeForce RTX 4060,c03,64,64,32,4,2,8,0.0,0.0,50.223998725414276,196.3929551839826,0.6680955887931089,0,3,3,0_3_3_r0,0,
2026-03-02T09:23:57.458877+00:00,B2,adversarial,tune,adversarial_tune_025,16,1024,4096,bf16,NVIDIA GeForce RTX 4060,c00,32,32,32,2,2,8,0.0,0.0,70.65600156784058,153.19455936551088,1.899594160746988,0,3,3,0_3_4_r0,0,
2026-03-02T09:23:57.475516+00:00,B2,adversarial,tune,adversarial_tune_026,16,4096,1024,bf16,NVIDIA GeForce RTX 4060,c02,32,64,32,2,2,8,0.0,0.0,49.51999895274639,138.58815826475615,2.7103742091770835,0,3,3,0_4_3_r0,0,
2026-03-02T09:23:57.559874+00:00,B2,adversarial,tune,adversarial_tune_027,16,4096,4096,bf16,NVIDIA GeForce RTX 4060,c11,32,128,32,4,2,8,0.0,0.0,162.1759980916977,233.55392456054688,3.3104215069879945,0,3,3,0_4_4_r0,0,
2026-03-02T09:23:57.599724+00:00,B2,adversarial,tune,adversarial_tune_028,16,8192,1024,bf16,NVIDIA GeForce RTX 4060,c02,32,64,32,2,2,8,0.0,0.0,55.296000093221664,111.58816017210484,4.854518510334449,0,3,3,0_4_3_r0,0,
2026-03-02T09:23:57.773832+00:00,B2,adversarial,tune,adversarial_tune_029,16,8192,4096,bf16,NVIDIA GeForce RTX 4060,c11,32,128,32,4,2,8,0.0,0.0,497.48799204826355,526.3769441843033,2.158327117764546,0,3,3,0_4_4_r0,0,
2026-03-02T09:23:57.782317+00:00,B2,adversarial,tune,adversarial_tune_030,32,1024,1024,bf16,NVIDIA GeForce RTX 4060,c04,64,64,64,4,3,8,0.0,0.0,44.943999499082565,139.26271453499794,1.493166267976883,0,3,3,1_3_3_r0,0,
2026-03-02T09:23:57.801758+00:00,B2,adversarial,tune,adversarial_tune_031,32,1024,4096,bf16,NVIDIA GeForce RTX 4060,c04,64,64,64,4,3,8,0.0,0.0,86.36799827218056,184.9651192128658,3.1080430410584614,0,3,3,1_3_4_r0,0,
2026-03-02T09:23:57.811537+00:00,B2,adversarial,eval,adversarial_eval_000,1,1024,1024,bf16,NVIDIA GeForce RTX 4060,c03,64,64,32,4,2,8,0.0,0.0,57.34400078654289,161.30495771765703,0.03657142806980683,0,3,3,0_3_3_r0,0,
2026-03-02T09:23:57.831353+00:00,B2,adversarial,eval,adversarial_eval_001,1,1024,4096,bf16,NVIDIA GeForce RTX 4060,c00,32,32,32,2,2,8,0.0,0.0,93.18400174379349,158.30016508698463,0.09002197633735688,0,3,3,0_3_4_r0,0,
2026-03-02T09:23:57.848693+00:00,B2,adversarial,eval,adversarial_eval_002,1,4096,1024,bf16,NVIDIA GeForce RTX 4060,c02,32,64,32,2,2,8,0.0,0.0,53.18399891257286,117.7961627393961,0.15772804173280974,0,3,3,0_4_3_r0,0,
2026-03-02T09:23:57.940852+00:00,B2,adversarial,eval,adversarial_eval_003,1,4096,4096,bf16,NVIDIA GeForce RTX 4060,c11,32,128,32,4,2,8,0.0,0.0,249.85599517822266,281.6083252429962,0.1342950845588699,0,3,3,0_4_4_r0,0,
2026-03-02T09:23:57.983809+00:00,B2,adversarial,eval,adversarial_eval_004,1,8192,1024,bf16,NVIDIA GeForce RTX 4060,c02,32,64,32,2,2,8,0.0,0.0,80.31999692320824,150.5791986733674,0.2088796892763858,0,3,3,0_4_3_r0,0,
2026-03-02T09:23:58.157961+00:00,B2,adversarial,eval,adversarial_eval_005,1,8192,4096,bf16,NVIDIA GeForce RTX 4060,c11,32,128,32,4,2,8,0.0,0.0,468.9919948577881,663.1254512071606,0.14309170462568205,0,3,3,0_4_4_r0,0,
2026-03-02T09:23:58.169874+00:00,B2,adversarial,eval,adversarial_eval_006,2,1024,1024,bf16,NVIDIA GeForce RTX 4060,c03,64,64,32,4,2,8,0.0,0.0,32.655999064445496,79.65696081519121,0.12843900416957646,0,3,3,0_3_3_r0,0,
2026-03-02T09:23:58.192692+00:00,B2,adversarial,eval,adversarial_eval_007,2,1024,4096,bf16,NVIDIA GeForce RTX 4060,c00,32,32,32,2,2,8,0.0,0.0,91.13600105047226,105.51295846700668,0.1840898855185512,0,3,3,0_3_4_r0,0,
2026-03-02T09:23:58.209998+00:00,B2,adversarial,eval,adversarial_eval_008,2,4096,1024,bf16,NVIDIA GeForce RTX 4060,c02,32,64,32,2,2,8,0.0,0.0,55.07199838757515,65.54079972207546,0.3046414964267054,0,3,3,0_4_3_r0,0,
2026-03-02T09:23:58.297400+00:00,B2,adversarial,eval,adversarial_eval_009,2,4096,4096,bf16,NVIDIA GeForce RTX 4060,c11,32,128,32,4,2,8,0.0,0.0,250.88000297546387,327.5264027714729,0.2674938743785142,0,3,3,0_4_4_r0,0,
2026-03-02T09:23:58.347769+00:00,B2,adversarial,eval,adversarial_eval_010,2,8192,1024,bf16,NVIDIA GeForce RTX 4060,c02,32,64,32,2,2,8,0.0,0.0,93.02400052547455,286.749130487442,0.3607072563043679,0,3,3,0_4_3_r0,0,
2026-03-02T09:23:58.525039+00:00,B2,adversarial,eval,adversarial_eval_011,2,8192,4096,bf16,NVIDIA GeForce RTX 4060,c11,32,128,32,4,2,8,0.0,0.0,476.5919893980026,570.040333867073,0.2816197732772101,0,3,3,0_4_4_r0,0,
2026-03-02T09:23:58.536806+00:00,B2,adversarial,eval,adversarial_eval_012,4,1024,1024,bf16,NVIDIA GeForce RTX 4060,c03,64,64,32,4,2,8,0.0,0.0,56.73599988222122,223.50239723920816,0.14785335620089518,0,3,3,0_3_3_r0,0,
2026-03-02T09:23:58.561503+00:00,B2,adversarial,eval,adversarial_eval_013,4,1024,4096,bf16,NVIDIA GeForce RTX 4060,c00,32,32,32,2,2,8,0.0,0.0,98.81599992513657,126.28319732844821,0.33956476709663397,0,3,3,0_3_4_r0,0,
2026-03-02T09:23:58.578620+00:00,B2,adversarial,eval,adversarial_eval_014,4,4096,1024,bf16,NVIDIA GeForce RTX 4060,c02,32,64,32,2,2,8,0.0,0.0,56.32000043988228,71.17824174463749,0.5957818135285181,0,3,3,0_4_3_r0,0,
2026-03-02T09:23:58.667129+00:00,B2,adversarial,eval,adversarial_eval_015,4,4096,4096,bf16,NVIDIA GeForce RTX 4060,c11,32,128,32,4,2,8,0.0,0.0,254.87999618053436,370.7904061675072,0.5265918471880865,0,3,3,0_4_4_r0,0,
2026-03-02T09:23:58.710239+00:00,B2,adversarial,eval,adversarial_eval_016,4,8192,1024,bf16,NVIDIA GeForce RTX 4060,c02,32,64,32,2,2,8,0.0,0.0,86.94399893283844,110.6556828320026,0.7718630937580814,0,3,3,0_4_3_r0,0,
2026-03-02T09:23:58.884489+00:00,B2,adversarial,eval,adversarial_eval_017,4,8192,4096,bf16,NVIDIA GeForce RTX 4060,c11,32,128,32,4,2,8,0.0,0.0,474.11200404167175,669.8803228139877,0.5661857403138142,0,3,3,0_4_4_r0,0,
2026-03-02T09:23:58.893530+00:00,B2,adversarial,eval,adversarial_eval_018,8,1024,1024,bf16,NVIDIA GeForce RTX 4060,c03,64,64,32,4,2,8,0.0,0.0,55.1999993622303,138.887361139059,0.30393507597537284,0,3,3,0_3_3_r0,0,
2026-03-02T09:23:58.914388+00:00,B2,adversarial,eval,adversarial_eval_019,8,1024,4096,bf16,NVIDIA GeForce RTX 4060,c00,32,32,32,2,2,8,0.0,0.0,100.35199671983719,134.0313643217086,0.668734715736196,0,3,3,0_3_4_r0,0,
2026-03-02T09:23:58.931480+00:00,B2,adversarial,eval,adversarial_eval_020,8,4096,1024,bf16,NVIDIA GeForce RTX 4060,c02,32,64,32,2,2,8,0.0,0.0,59.23200026154518,86.74655884504313,1.1329832472932486,0,3,3,0_4_3_r0,0,
2026-03-02T09:23:59.025837+00:00,B2,adversarial,eval,adversarial_eval_021,8,4096,4096,bf16,NVIDIA GeForce RTX 4060,c11,32,128,32,4,2,8,0.0,0.0,253.80799174308777,302.12031364440907,1.0576320081824633,0,3,3,0_4_4_r0,0,
2026-03-02T09:23:59.072308+00:00,B2,adversarial,eval,adversarial_eval_022,8,8192,1024,bf16,NVIDIA GeForce RTX 4060,c02,32,64,32,2,2,8,0.0,0.0,89.99999985098839,203.75551402568794,1.4913080913580246,0,3,3,0_4_3_r0,0,
2026-03-02T09:23:59.242281+00:00,B2,adversarial,eval,adversarial_eval_023,8,8192,4096,bf16,NVIDIA GeForce RTX 4060,c11,32,128,32,4,2,8,0.0,0.0,477.07200050354004,533.8607966899871,1.1253456740981307,0,3,3,0_4_4_r0,0,
2026-03-02T09:23:59.256375+00:00,B2,adversarial,eval,adversarial_eval_024,16,1024,1024,bf16,NVIDIA GeForce RTX 4060,c03,64,64,32,4,2,8,0.0,0.0,58.36800113320351,148.97152006626123,0.5748771818213262,0,3,3,0_3_3_r0,0,
2026-03-02T09:23:59.277866+00:00,B2,adversarial,eval,adversarial_eval_025,16,1024,4096,bf16,NVIDIA GeForce RTX 4060,c00,32,32,32,2,2,8,0.0,0.0,107.51999914646149,115.0691206753254,1.2483047718143248,0,3,3,0_3_4_r0,0,
2026-03-02T09:23:59.297354+00:00,B2,adversarial,eval,adversarial_eval_026,16,4096,1024,bf16,NVIDIA GeForce RTX 4060,c02,32,64,32,2,2,8,0.0,0.0,68.60800087451935,87.53567948937416,1.9562984825265148,0,3,3,0_4_3_r0,0,
2026-03-02T09:23:59.384975+00:00,B2,adversarial,eval,adversarial_eval_027,16,4096,4096,bf16,NVIDIA GeForce RTX 4060,c11,32,128,32,4,2,8,0.0,0.0,256.00001215934753,265.6118321418762,2.09715190039063,0,3,3,0_4_4_r0,0,
2026-03-02T09:23:59.428522+00:00,B2,adversarial,eval,adversarial_eval_028,16,8192,1024,bf16,NVIDIA GeForce RTX 4060,c02,32,64,32,2,2,8,0.0,0.0,95.58400139212608,180.30400097370145,2.8083722389771486,0,3,3,0_4_3_r0,0,
2026-03-02T09:23:59.599138+00:00,B2,adversarial,eval,adversarial_eval_029,16,8192,4096,bf16,NVIDIA GeForce RTX 4060,c11,32,128,32,4,2,8,0.0,0.0,479.2160093784332,549.0483272075653,2.2406217717824077,0,3,3,0_4_4_r0,0,
2026-03-02T09:23:59.611153+00:00,B2,adversarial,eval,adversarial_eval_030,32,1024,1024,bf16,NVIDIA GeForce RTX 4060,c04,64,64,64,4,3,8,0.0,0.0,76.72000303864479,152.00896248221397,0.8747244700472243,0,3,3,1_3_3_r0,0,
2026-03-02T09:23:59.635334+00:00,B2,adversarial,eval,adversarial_eval_031,32,1024,4096,bf16,NVIDIA GeForce RTX 4060,c04,64,64,64,4,3,8,0.0,0.0,120.75200304389,218.57919886708248,2.223031082162928,0,3,3,1_3_4_r0,0,
2026-03-02T09:23:59.656828+00:00,B2,adversarial,eval,adversarial_eval_032,32,4096,1024,bf16,NVIDIA GeForce RTX 4060,c04,64,64,64,4,3,8,0.0,0.0,93.18400174379349,109.58847984671593,2.8807032427954202,0,3,3,1_4_3_r0,0,
2026-03-02T09:23:59.745010+00:00,B2,adversarial,eval,adversarial_eval_033,32,4096,4096,bf16,NVIDIA GeForce RTX 4060,c02,32,64,32,2,2,8,0.0,0.0,258.04799795150757,332.47231304645527,4.161015906047749,0,3,3,1_4_4_r0,0,
2026-03-02T09:23:59.791316+00:00,B2,adversarial,eval,adversarial_eval_034,32,8192,1024,bf16,NVIDIA GeForce RTX 4060,c04,64,64,64,4,3,8,0.0,0.0,155.13599663972855,236.7487977445123,3.460646939644654,0,3,3,1_4_3_r0,0,
2026-03-02T09:23:59.962220+00:00,B2,adversarial,eval,adversarial_eval_035,32,8192,4096,bf16,NVIDIA GeForce RTX 4060,c02,32,64,32,2,2,8,0.0,0.0,483.3280146121979,566.220816373825,4.443118509741362,0,3,3,1_4_4_r0,0,
2026-03-02T09:24:02.614350+00:00,B2,adversarial,eval,adversarial_eval_036,1024,1,512,bf16,NVIDIA GeForce RTX 4060,c00,32,32,32,2,2,8,0.0,2652.071,54.27199974656105,66.64192020893096,0.019320754807205034,3,0,2,3_0_3_r2,0,
2026-03-02T09:24:03.419456+00:00,B2,adversarial,eval,adversarial_eval_037,1024,1,2048,bf16,NVIDIA GeForce RTX 4060,c11,32,128,32,4,2,8,0.0,805.054,181.2479943037033,262.8915232419967,0.023141243665140525,3,0,3,3_0_4_r2,0,
2026-03-02T09:24:03.866782+00:00,B2,adversarial,eval,adversarial_eval_038,2048,1,512,bf16,NVIDIA GeForce RTX 4060,c01,64,32,32,2,2,8,0.0,447.273,62.94399872422218,145.44288009405113,0.033317743430764456,3,0,2,4_0_3_r2,0,
2026-03-02T09:24:05.537795+00:00,B2,adversarial,eval,adversarial_eval_039,2048,1,2048,bf16,NVIDIA GeForce RTX 4060,c04,64,64,64,4,3,8,0.0,1670.959,96.25599905848503,169.03840035200113,0.08714893702264824,3,0,3,4_0_4_r2,0,
2026-03-02T09:24:05.551003+00:00,B2,adversarial,eval,adversarial_eval_040,4096,1,512,bf16,NVIDIA GeForce RTX 4060,c01,64,32,32,2,2,8,0.0,0.0,50.175998359918594,193.22272136807428,0.0835918394670245,3,0,2,4_0_3_r2,0,
2026-03-02T09:24:05.597495+00:00,B2,adversarial,eval,adversarial_eval_041,4096,1,2048,bf16,NVIDIA GeForce RTX 4060,c04,64,64,64,4,3,8,0.0,0.0,136.19199395179749,230.41024670004816,0.12318797539551384,3,0,3,4_0_4_r2,0,
2026-03-02T09:24:05.736249+00:00,B2,adversarial,eval,adversarial_eval_042,1024,2,512,bf16,NVIDIA GeForce RTX 4060,c00,32,32,32,2,2,8,0.0,0.0,72.67200201749802,117.0230454206466,0.02885777110550837,3,0,2,3_0_3_r2,0,
2026-03-02T09:24:05.925203+00:00,B2,adversarial,eval,adversarial_eval_043,1024,2,2048,bf16,NVIDIA GeForce RTX 4060,c11,32,128,32,4,2,8,0.0,0.0,167.34399646520615,233.96768435835838,0.050127929159049005,3,0,3,3_0_4_r2,0,
2026-03-02T09:24:06.099046+00:00,B2,adversarial,eval,adversarial_eval_044,2048,2,512,bf16,NVIDIA GeForce RTX 4060,c01,64,32,32,2,2,8,0.0,0.0,54.27199974656105,136.63231745362262,0.07728301922882014,3,0,2,4_0_3_r2,0,
2026-03-02T09:24:06.374092+00:00,B2,adversarial,eval,adversarial_eval_045,2048,2,2048,bf16,NVIDIA GeForce RTX 4060,c04,64,64,64,4,3,8,0.0,0.0,221.18400037288666,386.27328336238816,0.07585185172397577,3,0,3,4_0_4_r2,0,
2026-03-02T09:24:06.392472+00:00,B2,adversarial,eval,adversarial_eval_046,4096,2,512,bf16,NVIDIA GeForce RTX 4060,c01,64,32,32,2,2,8,0.0,0.0,78.33599671721458,177.1760034561157,0.10708497180781484,3,0,2,4_0_3_r2,0,
2026-03-02T09:24:06.458527+00:00,B2,adversarial,eval,adversarial_eval_047,4096,2,2048,bf16,NVIDIA GeForce RTX 4060,c04,64,64,64,4,3,8,0.0,0.0,375.8080005645752,432.3840081691741,0.0892861034081001,3,0,3,4_0_4_r2,0,
2026-03-02T09:24:06.468224+00:00,B2,adversarial,eval,adversarial_eval_048,1024,4,512,bf16,NVIDIA GeForce RTX 4060,c00,32,32,32,2,2,8,0.0,0.0,92.67200157046318,161.0896019637583,0.04525966774129573,3,0,2,3_0_3_r2,0,
2026-03-02T09:24:06.496120+00:00,B2,adversarial,eval,adversarial_eval_049,1024,4,2048,bf16,NVIDIA GeForce RTX 4060,c11,32,128,32,4,2,8,0.0,0.0,314.7840052843094,348.08895736932755,0.053297549171365956,3,0,3,3_0_4_r2,0,
2026-03-02T09:24:06.507180+00:00,B2,adversarial,eval,adversarial_eval_050,2048,4,512,bf16,NVIDIA GeForce RTX 4060,c01,64,32,32,2,2,8,0.0,0.0,83.96799862384796,138.90559852123255,0.09990244066169192,3,0,2,4_0_3_r2,0,
2026-03-02T09:24:06.538122+00:00,B2,adversarial,eval,adversarial_eval_051,2048,4,2048,bf16,NVIDIA GeForce RTX 4060,c04,64,64,64,4,3,8,0.0,0.0,243.71199309825897,288.84991347789764,0.137680676167921,3,0,3,4_0_4_r2,0,
2026-03-02T09:24:06.553012+00:00,B2,adversarial,eval,adversarial_eval_052,4096,4,512,bf16,NVIDIA GeForce RTX 4060,c01,64,32,32,2,2,8,0.0,0.0,100.35199671983719,217.31616541743261,0.167183678934049,3,0,2,4_0_3_r2,0,
2026-03-02T09:24:06.615350+00:00,B2,adversarial,eval,adversarial_eval_053,4096,4,2048,bf16,NVIDIA GeForce RTX 4060,c04,64,64,64,4,3,8,0.0,0.0,395.08800208568573,460.4089698195457,0.1698580155452192,3,0,3,4_0_4_r2,0,
2026-03-02T09:24:06.624176+00:00,B2,adversarial,eval,adversarial_eval_054,1024,8,512,bf16,NVIDIA GeForce RTX 4060,c00,32,32,32,2,2,8,0.0,0.0,65.5359998345375,204.99456584453569,0.12800000032316894,3,0,2,3_0_3_r2,0,
2026-03-02T09:24:06.655194+00:00,B2,adversarial,eval,adversarial_eval_055,1024,8,2048,bf16,NVIDIA GeForce RTX 4060,c11,32,128,32,4,2,8,0.0,0.0,354.8159897327423,385.10593116283417,0.09456854530505847,3,0,3,3_0_4_r2,0,
2026-03-02T09:24:06.669692+00:00,B2,adversarial,eval,adversarial_eval_056,2048,8,512,bf16,NVIDIA GeForce RTX 4060,c01,64,32,32,2,2,8,0.0,0.0,86.01599931716919,125.02016112208354,0.19504762059598826,3,0,2,4_0_3_r2,0,
2026-03-02T09:24:06.706730+00:00,B2,adversarial,eval,adversarial_eval_057,2048,8,2048,bf16,NVIDIA GeForce RTX 4060,c04,64,64,64,4,3,8,0.0,0.0,309.2480003833771,365.5577531456946,0.21700662224753156,3,0,3,4_0_4_r2,0,
2026-03-02T09:24:06.725608+00:00,B2,adversarial,eval,adversarial_eval_058,4096,8,512,bf16,NVIDIA GeForce RTX 4060,c01,64,32,32,2,2,8,0.0,0.0,83.96799862384796,161.84223800897593,0.3996097626467677,3,0,2,4_0_3_r2,0,
2026-03-02T09:24:06.788102+00:00,B2,adversarial,eval,adversarial_eval_059,4096,8,2048,bf16,NVIDIA GeForce RTX 4060,c04,64,64,64,4,3,8,0.0,0.0,412.6720130443573,522.8518521785734,0.3252406845083851,3,0,3,4_0_4_r2,0,
2026-03-02T09:24:07.227488+00:00,B2,adversarial,eval,adversarial_eval_060,64,64,8192,bf16,NVIDIA GeForce RTX 4060,c04,64,64,64,4,3,8,0.0,439.326,168.96000504493713,183.92063885927197,0.39718786692833913,1,1,3,1_1_4_r1,0,
2026-03-02T09:24:07.244566+00:00,B2,adversarial,eval,adversarial_eval_061,128,128,8192,bf16,NVIDIA GeForce RTX 4060,c04,64,64,64,4,3,8,0.0,0.0,124.67200309038162,202.9638403654098,2.153133416853793,1,1,3,2_2_4_r1,0,
2026-03-02T09:24:09.810254+00:00,B2,adversarial,eval,adversarial_eval_062,2048,128,8192,bf16,NVIDIA GeForce RTX 4060,c04,64,64,64,4,3,8,0.0,2565.635,250.86399912834167,369.6332767605781,17.120700104133718,3,1,3,4_2_4_r2,0,
2026-03-02T09:24:09.919283+00:00,B2,adversarial,eval,adversarial_eval_063,128,2048,8192,bf16,NVIDIA GeForce RTX 4060,c04,64,64,64,4,3,8,0.0,0.0,371.0400015115738,472.9366424679755,11.575483178371073,1,3,3,2_4_4_r0,0,
