results/phase1_raw.csv
timestamp,method,workload,split,shape_id,M,N,K,dtype,gpu,config_id,BLOCK_M,BLOCK_N,BLOCK_K,num_warps,num_stages,GROUP_M,compile_time_ms,tune_time_ms,runtime_cost_us,p99_us,runtime_perf_tflops,bucket_m,bucket_n,bucket_k,cache_key,invalid_config,notes
2026-03-02T08:38:06.013378+00:00,C,uniform,tune,uniform_tune_000,1536,512,1024,bf16,NVIDIA GeForce RTX 4060,c08,128,128,64,8,4,8,869.9305960908532,0.0,90.11200070381165,132.73087628185738,17.873454405855544,3,2,3,1536x512x1024,0,
2026-03-02T08:38:06.072075+00:00,C,uniform,tune,uniform_tune_001,1536,1536,2048,bf16,NVIDIA GeForce RTX 4060,c08,128,128,64,8,4,8,0.0,0.0,377.1999925374985,544.7081488370894,25.619503200385953,3,3,3,1536x1536x2048,0,
2026-03-02T08:38:06.095385+00:00,C,uniform,tune,uniform_tune_002,384,2048,1536,bf16,NVIDIA GeForce RTX 4060,c08,128,128,64,8,4,8,0.0,0.0,119.80800330638885,210.30912399291987,20.16492252042372,2,3,3,384x2048x1536,0,
2026-03-02T08:38:06.297203+00:00,C,uniform,tune,uniform_tune_003,1536,64,3072,bf16,NVIDIA GeForce RTX 4060,c05,128,64,32,4,3,8,179.25200297031552,0.0,73.7600028514862,121.24447919428349,8.188445670427877,3,1,3,1536x64x3072,0,
2026-03-02T08:38:06.318191+00:00,C,uniform,tune,uniform_tune_004,768,128,2048,bf16,NVIDIA GeForce RTX 4060,c08,128,128,64,8,4,8,0.0,0.0,92.17600151896477,780.0473807752109,4.368308207827349,3,1,3,768x128x2048,0,
2026-03-02T08:38:06.342912+00:00,C,uniform,tune,uniform_tune_005,512,128,4096,bf16,NVIDIA GeForce RTX 4060,c08,128,128,64,8,4,8,0.0,0.0,143.36000382900238,211.97824090719212,3.7449141856913686,2,1,3,512x128x4096,0,
2026-03-02T08:38:06.455198+00:00,C,uniform,tune,uniform_tune_006,2048,1024,4096,bf16,NVIDIA GeForce RTX 4060,c08,128,128,64,8,4,8,0.0,0.0,746.4960217475891,852.9811108112335,23.01401304695631,3,3,3,2048x1024x4096,0,
2026-03-02T08:38:06.469095+00:00,C,uniform,tune,uniform_tune_007,128,768,512,bf16,NVIDIA GeForce RTX 4060,c08,128,128,64,8,4,8,0.0,0.0,76.7040029168129,241.06623888015736,1.312360400658248,1,3,2,128x768x512,0,
2026-03-02T08:38:06.603196+00:00,C,uniform,tune,uniform_tune_008,2048,256,64,bf16,NVIDIA GeForce RTX 4060,c03,64,64,32,4,2,8,124.965765979141,0.0,56.352000683546066,142.37088322639454,1.1908869815796048,3,2,1,2048x256x64,0,
2026-03-02T08:38:06.630512+00:00,C,uniform,tune,uniform_tune_009,192,768,2048,bf16,NVIDIA GeForce RTX 4060,c08,128,128,64,8,4,8,0.0,0.0,96.20800241827965,668.874553143977,6.277853825236923,2,3,3,192x768x2048,0,
2026-03-02T08:38:06.653959+00:00,C,uniform,tune,uniform_tune_010,1024,1024,1536,bf16,NVIDIA GeForce RTX 4060,c08,128,128,64,8,4,8,0.0,0.0,163.83999586105347,223.8735944032669,19.6608004966736,3,3,3,1024x1024x1536,0,
2026-03-02T08:38:06.660635+00:00,C,uniform,tune,uniform_tune_011,256,384,768,bf16,NVIDIA GeForce RTX 4060,c08,128,128,64,8,4,8,0.0,0.0,56.703999638557434,103.11679735779748,2.6628623194566834,2,2,3,256x384x768,0,
2026-03-02T08:38:06.855880+00:00,C,uniform,tune,uniform_tune_012,64,192,2048,bf16,NVIDIA GeForce RTX 4060,c06,64,128,32,4,3,8,185.9984629554674,0.0,80.62400296330452,139.31263968348495,0.6242762223417276,1,2,3,64x192x2048,0,
2026-03-02T08:38:06.869655+00:00,C,uniform,tune,uniform_tune_013,192,128,512,bf16,NVIDIA GeForce RTX 4060,c08,128,128,64,8,4,8,0.0,0.0,56.143999099731445,150.75327873229975,0.44823711177567993,2,1,2,192x128x512,0,
2026-03-02T08:38:06.882880+00:00,C,uniform,tune,uniform_tune_014,128,128,1024,bf16,NVIDIA GeForce RTX 4060,c08,128,128,64,8,4,8,0.0,0.0,68.60800087451935,179.30080488324163,0.4890746206316287,1,1,3,128x128x1024,0,
2026-03-02T08:38:06.941109+00:00,C,uniform,tune,uniform_tune_015,3072,3072,768,bf16,NVIDIA GeForce RTX 4060,c08,128,128,64,8,4,8,0.0,0.0,621.5680241584778,635.3238606452942,23.320882124888968,3,3,3,3072x3072x768,0,
2026-03-02T08:38:06.956461+00:00,C,uniform,tune,uniform_tune_016,256,128,3072,bf16,NVIDIA GeForce RTX 4060,c08,128,128,64,8,4,8,0.0,0.0,141.31200313568115,178.0019243061542,1.424695620560241,2,1,3,256x128x3072,0,
2026-03-02T08:38:06.964026+00:00,C,uniform,tune,uniform_tune_017,96,1024,192,bf16,NVIDIA GeForce RTX 4060,c06,64,128,32,4,3,8,0.0,0.0,55.296000093221664,114.56512123346312,0.682666665515782,1,3,2,96x1024x192,0,
2026-03-02T08:38:06.970242+00:00,C,uniform,tune,uniform_tune_018,64,64,192,bf16,NVIDIA GeForce RTX 4060,c03,64,64,32,4,2,8,0.0,0.0,57.53600038588047,74.97727923095222,0.027337040973497807,1,1,2,64x64x192,0,
2026-03-02T08:38:06.977473+00:00,C,uniform,tune,uniform_tune_019,4096,64,64,bf16,NVIDIA GeForce RTX 4060,c05,128,64,32,4,3,8,0.0,0.0,54.27199974656105,79.53280150890349,0.6182641538305611,3,1,1,4096x64x64,0,
2026-03-02T08:38:07.054866+00:00,C,uniform,tune,uniform_tune_020,128,4096,3072,bf16,NVIDIA GeForce RTX 4060,c08,128,128,64,8,4,8,0.0,0.0,204.79999482631683,287.96928077936167,15.728640397338877,1,3,3,128x4096x3072,0,
2026-03-02T08:38:07.091910+00:00,C,uniform,tune,uniform_tune_021,192,2048,3072,bf16,NVIDIA GeForce RTX 4060,c08,128,128,64,8,4,8,0.0,0.0,206.16000145673752,300.5952087044716,11.718660685530594,2,3,3,192x2048x3072,0,
2026-03-02T08:38:07.152069+00:00,C,uniform,tune,uniform_tune_022,1536,2048,2048,bf16,NVIDIA GeForce RTX 4060,c08,128,128,64,8,4,8,0.0,0.0,494.9439913034439,563.5359990596769,26.033050434792386,3,3,3,1536x2048x2048,0,
2026-03-02T08:38:07.165962+00:00,C,uniform,tune,uniform_tune_023,256,1024,1024,bf16,NVIDIA GeForce RTX 4060,c08,128,128,64,8,4,8,0.0,0.0,64.19199705123901,154.2086355388164,8.36351783184844,2,3,3,256x1024x1024,0,
2026-03-02T08:38:07.331699+00:00,C,uniform,tune,uniform_tune_024,768,128,384,bf16,NVIDIA GeForce RTX 4060,c09,128,64,64,8,3,8,159.9431639770046,0.0,33.79200026392937,84.11999680101863,2.234181800731943,3,1,2,768x128x384,0,
2026-03-02T08:38:07.344621+00:00,C,uniform,tune,uniform_tune_025,256,96,384,bf16,NVIDIA GeForce RTX 4060,c05,128,64,32,4,3,8,0.0,0.0,143.77599954605103,193.6614456772804,0.13127620784826882,2,1,2,256x96x384,0,
2026-03-02T08:38:07.364332+00:00,C,uniform,tune,uniform_tune_026,96,1024,3072,bf16,NVIDIA GeForce RTX 4060,c06,64,128,32,4,3,8,0.0,0.0,69.2639984190464,107.42784276604644,8.719966935000333,1,3,3,96x1024x3072,0,
2026-03-02T08:38:07.408710+00:00,C,uniform,tune,uniform_tune_027,1536,512,4096,bf16,NVIDIA GeForce RTX 4060,c08,128,128,64,8,4,8,0.0,0.0,265.7279968261719,382.14335769414885,24.24453208148173,3,2,3,1536x512x4096,0,
2026-03-02T08:38:07.413869+00:00,C,uniform,tune,uniform_tune_028,128,64,192,bf16,NVIDIA GeForce RTX 4060,c05,128,64,32,4,3,8,0.0,0.0,38.99199888110161,160.47104582190508,0.08067624359531493,1,1,2,128x64x192,0,
2026-03-02T08:38:07.423286+00:00,C,uniform,tune,uniform_tune_029,192,256,1536,bf16,NVIDIA GeForce RTX 4060,c08,128,128,64,8,4,8,0.0,0.0,73.61600175499916,131.307843029499,2.0511157954832306,2,2,3,192x256x1536,0,
2026-03-02T08:38:07.487345+00:00,C,uniform,tune,uniform_tune_030,4096,64,3072,bf16,NVIDIA GeForce RTX 4060,c05,128,64,32,4,3,8,0.0,0.0,114.19200152158737,160.27423754334438,14.10442688225867,3,1,3,4096x64x3072,0,
2026-03-02T08:38:07.496012+00:00,C,uniform,tune,uniform_tune_031,384,128,96,bf16,NVIDIA GeForce RTX 4060,c03,64,64,32,4,2,8,0.0,0.0,32.76799991726875,336.9123151898383,0.28800000072713006,2,1,1,384x128x96,0,
2026-03-02T08:38:07.520933+00:00,C,uniform,eval,uniform_eval_000,512,4096,768,bf16,NVIDIA GeForce RTX 4060,c08,128,128,64,8,4,8,0.0,0.0,179.03999984264374,266.37567996978754,17.991652562729556,2,3,3,512x4096x768,0,
2026-03-02T08:38:07.526394+00:00,C,uniform,eval,uniform_eval_001,384,512,64,bf16,NVIDIA GeForce RTX 4060,c03,64,64,32,4,2,8,0.0,0.0,44.03200000524521,157.5839973241089,0.5715348836528475,2,2,1,384x512x64,0,
2026-03-02T08:38:07.709236+00:00,C,uniform,eval,uniform_eval_002,256,4096,384,bf16,NVIDIA GeForce RTX 4060,c10,64,128,64,8,3,8,170.20288296043873,0.0,63.48799914121628,101.5324799716472,12.684387268352213,2,3,2,256x4096x384,0,
2026-03-02T08:38:07.724801+00:00,C,uniform,eval,uniform_eval_003,384,768,512,bf16,NVIDIA GeForce RTX 4060,c08,128,128,64,8,4,8,0.0,0.0,44.03200000524521,84.63840238749978,6.85841860383417,2,3,2,384x768x512,0,
2026-03-02T08:38:07.730122+00:00,C,uniform,eval,uniform_eval_004,768,1024,96,bf16,NVIDIA GeForce RTX 4060,c03,64,64,32,4,2,8,0.0,0.0,32.51200169324875,45.05600035190582,4.6442832226892605,3,3,1,768x1024x96,0,
2026-03-02T08:38:07.745269+00:00,C,uniform,eval,uniform_eval_005,3072,3072,128,bf16,NVIDIA GeForce RTX 4060,c03,64,64,32,4,2,8,0.0,0.0,134.60799306631088,236.94816440343857,17.947813119907856,3,3,1,3072x3072x128,0,
2026-03-02T08:38:07.752124+00:00,C,uniform,eval,uniform_eval_006,256,96,512,bf16,NVIDIA GeForce RTX 4060,c05,128,64,32,4,3,8,0.0,0.0,47.98400029540062,159.667520970106,0.5244628177115989,2,1,2,256x96x512,0,
2026-03-02T08:38:08.185821+00:00,C,uniform,eval,uniform_eval_007,4096,4096,4096,bf16,NVIDIA GeForce RTX 4060,c08,128,128,64,8,4,8,0.0,0.0,4345.184087753296,4997.838234901428,31.630179687752573,3,3,3,4096x4096x4096,0,
2026-03-02T08:38:08.191652+00:00,C,uniform,eval,uniform_eval_008,128,96,64,bf16,NVIDIA GeForce RTX 4060,c05,128,64,32,4,3,8,0.0,0.0,58.73600021004677,184.3113651871681,0.026778534363512244,1,1,1,128x96x64,0,
2026-03-02T08:38:08.205251+00:00,C,uniform,eval,uniform_eval_009,3072,384,96,bf16,NVIDIA GeForce RTX 4060,c03,64,64,32,4,2,8,0.0,0.0,55.296000093221664,232.48895630240418,4.095999993094692,3,2,1,3072x384x96,0,
2026-03-02T08:38:08.229365+00:00,C,uniform,eval,uniform_eval_010,768,768,2048,bf16,NVIDIA GeForce RTX 4060,c08,128,128,64,8,4,8,0.0,0.0,140.3679996728897,165.73760256171227,17.211323874601057,3,3,3,768x768x2048,0,
2026-03-02T08:38:08.241153+00:00,C,uniform,eval,uniform_eval_011,4096,96,512,bf16,NVIDIA GeForce RTX 4060,c05,128,64,32,4,3,8,0.0,0.0,46.560000628232956,97.20991805195806,8.648049367848161,3,1,2,4096x96x512,0,
2026-03-02T08:38:08.246295+00:00,C,uniform,eval,uniform_eval_012,384,384,256,bf16,NVIDIA GeForce RTX 4060,c09,128,64,64,8,3,8,0.0,0.0,37.88800165057182,113.16448368132112,1.992648561839908,2,2,2,384x384x256,0,
2026-03-02T08:38:08.292266+00:00,C,uniform,eval,uniform_eval_013,4096,2048,768,bf16,NVIDIA GeForce RTX 4060,c08,128,128,64,8,4,8,0.0,0.0,453.6319971084595,631.9411212205883,28.403864740871292,3,3,3,4096x2048x768,0,
2026-03-02T08:38:08.306526+00:00,C,uniform,eval,uniform_eval_014,192,384,3072,bf16,NVIDIA GeForce RTX 4060,c08,128,128,64,8,4,8,0.0,0.0,102.32000052928925,184.1836741566658,4.42713867920996,2,2,3,192x384x3072,0,
2026-03-02T08:38:08.316884+00:00,C,uniform,eval,uniform_eval_015,128,96,4096,bf16,NVIDIA GeForce RTX 4060,c05,128,64,32,4,3,8,0.0,0.0,87.0399996638298,203.7862381339072,1.1565176515255833,1,1,3,128x96x4096,0,
2026-03-02T08:38:08.352500+00:00,C,uniform,eval,uniform_eval_016,64,4096,2048,bf16,NVIDIA GeForce RTX 4060,c06,64,128,32,4,3,8,0.0,0.0,77.82399654388428,112.10016340017307,13.797053244297551,1,3,3,64x4096x2048,0,
2026-03-02T08:38:08.361075+00:00,C,uniform,eval,uniform_eval_017,96,128,3072,bf16,NVIDIA GeForce RTX 4060,c06,64,128,32,4,3,8,0.0,0.0,72.81600311398506,110.4262397438287,1.0368252687780377,1,1,3,96x128x3072,0,
2026-03-02T08:38:08.367440+00:00,C,uniform,eval,uniform_eval_018,512,768,64,bf16,NVIDIA GeForce RTX 4060,c03,64,64,32,4,2,8,0.0,0.0,66.6080005466938,209.24415573477717,0.7556396767189597,2,3,1,512x768x64,0,
2026-03-02T08:38:08.372334+00:00,C,uniform,eval,uniform_eval_019,64,128,384,bf16,NVIDIA GeForce RTX 4060,c06,64,128,32,4,3,8,0.0,0.0,36.896001547575,56.34048044681549,0.1705186398555295,1,1,2,64x128x384,0,
2026-03-02T08:38:08.376673+00:00,C,uniform,eval,uniform_eval_020,512,512,96,bf16,NVIDIA GeForce RTX 4060,c03,64,64,32,4,2,8,0.0,0.0,34.81600061058998,63.94751917570825,1.4456470334703126,2,2,1,512x512x96,0,
2026-03-02T08:38:08.405147+00:00,C,uniform,eval,uniform_eval_021,256,3072,1536,bf16,NVIDIA GeForce RTX 4060,c08,128,128,64,8,4,8,0.0,0.0,106.20799660682678,201.35936096310604,22.747054658638678,2,3,3,256x3072x1536,0,
2026-03-02T08:38:08.413803+00:00,C,uniform,eval,uniform_eval_022,2048,96,512,bf16,NVIDIA GeForce RTX 4060,c05,128,64,32,4,3,8,0.0,0.0,50.175998359918594,98.34975793957705,4.012408294417177,3,1,2,2048x96x512,0,
2026-03-02T08:38:08.448629+00:00,C,uniform,eval,uniform_eval_023,1536,512,3072,bf16,NVIDIA GeForce RTX 4060,c08,128,128,64,8,4,8,0.0,0.0,189.43999707698822,251.0403180122375,25.505903096252407,3,2,3,1536x512x3072,0,
2026-03-02T08:38:08.452741+00:00,C,uniform,eval,uniform_eval_024,128,192,64,bf16,NVIDIA GeForce RTX 4060,c03,64,64,32,4,2,8,0.0,0.0,39.93599861860275,54.43455908447504,0.07876923349388026,1,2,1,128x192x64,0,
2026-03-02T08:38:08.459095+00:00,C,uniform,eval,uniform_eval_025,1536,96,384,bf16,NVIDIA GeForce RTX 4060,c05,128,64,32,4,3,8,0.0,0.0,39.904000237584114,49.17247984558344,2.837966302269053,3,1,2,1536x96x384,0,
2026-03-02T08:38:08.464599+00:00,C,uniform,eval,uniform_eval_026,1536,2048,64,bf16,NVIDIA GeForce RTX 4060,c03,64,64,32,4,2,8,0.0,0.0,51.19999870657921,58.78016032278537,7.864320198669438,3,3,1,1536x2048x64,0,
2026-03-02T08:38:08.468805+00:00,C,uniform,eval,uniform_eval_027,256,1024,96,bf16,NVIDIA GeForce RTX 4060,c03,64,64,32,4,2,8,0.0,0.0,32.76799991726875,43.98495964705944,1.536000003878027,2,3,1,256x1024x96,0,
2026-03-02T08:38:08.472901+00:00,C,uniform,eval,uniform_eval_028,2048,256,64,bf16,NVIDIA GeForce RTX 4060,c03,64,64,32,4,2,8,0.0,0.0,32.76799991726875,43.53023983538151,2.048000005170703,3,2,1,2048x256x64,0,
2026-03-02T08:38:08.477295+00:00,C,uniform,eval,uniform_eval_029,192,768,192,bf16,NVIDIA GeForce RTX 4060,c03,64,64,32,4,2,8,0.0,0.0,31.71199932694435,51.400641165673704,1.7855419147883789,2,3,2,192x768x192,0,
2026-03-02T08:38:08.537270+00:00,C,uniform,eval,uniform_eval_030,1024,2048,3072,bf16,NVIDIA GeForce RTX 4060,c08,128,128,64,8,4,8,0.0,0.0,490.1600033044815,546.0713762044905,26.287134407407073,3,3,3,1024x2048x3072,0,
2026-03-02T08:38:08.550018+00:00,C,uniform,eval,uniform_eval_031,1536,1024,512,bf16,NVIDIA GeForce RTX 4060,c08,128,128,64,8,4,8,0.0,0.0,92.01600030064583,129.00128297507754,17.503616009581062,3,3,2,1536x1024x512,0,
2026-03-02T08:38:08.558662+00:00,C,uniform,eval,uniform_eval_032,512,768,768,bf16,NVIDIA GeForce RTX 4060,c08,128,128,64,8,4,8,0.0,0.0,53.247999399900436,114.28864143788812,11.342769358601092,2,3,3,512x768x768,0,
2026-03-02T08:38:08.573243+00:00,C,uniform,eval,uniform_eval_033,64,512,4096,bf16,NVIDIA GeForce RTX 4060,c06,64,128,32,4,3,8,0.0,0.0,81.63200318813324,97.15327791869639,3.288360514458405,1,2,3,64x512x4096,0,
2026-03-02T08:38:08.580089+00:00,C,uniform,eval,uniform_eval_034,1024,256,512,bf16,NVIDIA GeForce RTX 4060,c08,128,128,64,8,4,8,0.0,0.0,46.08000069856644,49.453440234065056,5.825422133909627,3,2,2,1024x256x512,0,
2026-03-02T08:38:08.584832+00:00,C,uniform,eval,uniform_eval_035,1024,768,96,bf16,NVIDIA GeForce RTX 4060,c03,64,64,32,4,2,8,0.0,0.0,38.84800150990486,48.76479856669902,3.8868136874814945,3,3,1,1024x768x96,0,
2026-03-02T08:38:08.593923+00:00,C,uniform,eval,uniform_eval_036,768,64,1536,bf16,NVIDIA GeForce RTX 4060,c05,128,64,32,4,3,8,0.0,0.0,52.22399905323982,62.98623897135258,2.891294170062848,3,1,3,768x64x1536,0,
2026-03-02T08:38:08.599935+00:00,C,uniform,eval,uniform_eval_037,512,256,512,bf16,NVIDIA GeForce RTX 4060,c08,128,128,64,8,4,8,0.0,0.0,46.08000069856644,55.83872027695178,2.9127110669548135,2,2,2,512x256x512,0,
2026-03-02T08:38:08.604516+00:00,C,uniform,eval,uniform_eval_038,64,1024,64,bf16,NVIDIA GeForce RTX 4060,c06,64,128,32,4,3,8,0.0,0.0,33.72799977660179,47.12319869548081,0.2487134741331281,1,3,1,64x1024x64,0,
2026-03-02T08:38:08.615677+00:00,C,uniform,eval,uniform_eval_039,512,128,2048,bf16,NVIDIA GeForce RTX 4060,c08,128,128,64,8,4,8,0.0,0.0,81.91999793052673,90.12832082808018,3.2768000827789328,2,1,3,512x128x2048,0,
2026-03-02T08:38:08.623271+00:00,C,uniform,eval,uniform_eval_040,4096,768,96,bf16,NVIDIA GeForce RTX 4060,c03,64,64,32,4,2,8,0.0,0.0,63.311997801065445,127.81023830175394,9.539736495091866,3,3,1,4096x768x96,0,
2026-03-02T08:38:08.628991+00:00,C,uniform,eval,uniform_eval_041,4096,192,64,bf16,NVIDIA GeForce RTX 4060,c03,64,64,32,4,2,8,0.0,0.0,42.83200018107891,67.18112114816898,2.3501890076211787,3,2,1,4096x192x64,0,
2026-03-02T08:38:08.634096+00:00,C,uniform,eval,uniform_eval_042,96,1536,128,bf16,NVIDIA GeForce RTX 4060,c06,64,128,32,4,3,8,0.0,0.0,37.88800165057182,54.71583932638168,0.996324280919954,1,3,1,96x1536x128,0,
2026-03-02T08:38:08.642238+00:00,C,uniform,eval,uniform_eval_043,192,2048,192,bf16,NVIDIA GeForce RTX 4060,c03,64,64,32,4,2,8,0.0,0.0,44.544000178575516,92.89983734488482,3.3897930898587,2,3,2,192x2048x192,0,
2026-03-02T08:38:08.721134+00:00,C,uniform,eval,uniform_eval_044,384,4096,3072,bf16,NVIDIA GeForce RTX 4060,c08,128,128,64,8,4,8,0.0,0.0,334.84798669815063,427.41376131772984,28.859891054717135,2,3,3,384x4096x3072,0,
2026-03-02T08:38:08.736372+00:00,C,uniform,eval,uniform_eval_045,4096,96,768,bf16,NVIDIA GeForce RTX 4060,c05,128,64,32,4,3,8,0.0,0.0,55.296000093221664,61.880639903247356,10.922666648252513,3,1,3,4096x96x768,0,
2026-03-02T08:38:08.743618+00:00,C,uniform,eval,uniform_eval_046,96,96,1536,bf16,NVIDIA GeForce RTX 4060,c09,128,64,64,8,3,8,0.0,0.0,49.15200173854828,168.43423634767532,0.575999979626388,1,1,3,96x96x1536,0,
2026-03-02T08:38:08.801724+00:00,C,uniform,eval,uniform_eval_047,2048,512,4096,bf16,NVIDIA GeForce RTX 4060,c08,128,128,64,8,4,8,0.0,0.0,305.1519989967346,387.9920035600661,28.14969136771711,3,2,3,2048x512x4096,0,
2026-03-02T08:38:08.808858+00:00,C,uniform,eval,uniform_eval_048,96,256,768,bf16,NVIDIA GeForce RTX 4060,c06,64,128,32,4,3,8,0.0,0.0,48.128001391887665,246.4057639241218,0.7843404028483683,1,2,3,96x256x768,0,
2026-03-02T08:38:08.815515+00:00,C,uniform,eval,uniform_eval_049,64,768,384,bf16,NVIDIA GeForce RTX 4060,c06,64,128,32,4,3,8,0.0,0.0,40.95999896526337,122.3987203836441,0.9216000232815749,1,3,2,64x768x384,0,
2026-03-02T08:38:08.819970+00:00,C,uniform,eval,uniform_eval_050,128,1024,96,bf16,NVIDIA GeForce RTX 4060,c03,64,64,32,4,2,8,0.0,0.0,36.3520011305809,100.30496001243591,0.6922816686102434,1,3,1,128x1024x96,0,
2026-03-02T08:38:08.828126+00:00,C,uniform,eval,uniform_eval_051,384,768,768,bf16,NVIDIA GeForce RTX 4060,c08,128,128,64,8,4,8,0.0,0.0,58.768000453710556,127.26272203028196,7.708018453967986,2,3,3,384x768x768,0,
2026-03-02T08:38:08.847549+00:00,C,uniform,eval,uniform_eval_052,768,64,4096,bf16,NVIDIA GeForce RTX 4060,c05,128,64,32,4,3,8,0.0,0.0,83.96799862384796,93.14272113144398,4.795317151761212,3,1,3,768x64x4096,0,
2026-03-02T08:38:08.853014+00:00,C,uniform,eval,uniform_eval_053,384,96,512,bf16,NVIDIA GeForce RTX 4060,c05,128,64,32,4,3,8,0.0,0.0,35.840000957250595,95.6108804419635,1.0532571147256975,2,1,2,384x96x512,0,
2026-03-02T08:38:08.859917+00:00,C,uniform,eval,uniform_eval_054,768,192,768,bf16,NVIDIA GeForce RTX 4060,c08,128,128,64,8,4,8,0.0,0.0,50.175998359918594,78.59808079898353,4.513959331219323,3,2,3,768x192x768,0,
2026-03-02T08:38:08.872997+00:00,C,uniform,eval,uniform_eval_055,512,2048,512,bf16,NVIDIA GeForce RTX 4060,c08,128,128,64,8,4,8,0.0,0.0,106.49599879980087,193.8895970582962,10.08246165208986,2,3,2,512x2048x512,0,
2026-03-02T08:38:08.881476+00:00,C,uniform,eval,uniform_eval_056,384,512,512,bf16,NVIDIA GeForce RTX 4060,c08,128,128,64,8,4,8,0.0,0.0,73.16800206899643,146.63647428154945,2.7515660713292647,2,2,2,384x512x512,0,
2026-03-02T08:38:08.893834+00:00,C,uniform,eval,uniform_eval_057,2048,512,512,bf16,NVIDIA GeForce RTX 4060,c08,128,128,64,8,4,8,0.0,0.0,79.6000026166439,145.46943709254265,13.489218451049231,3,2,2,2048x512x512,0,
2026-03-02T08:38:08.915094+00:00,C,uniform,eval,uniform_eval_058,1024,512,2048,bf16,NVIDIA GeForce RTX 4060,c08,128,128,64,8,4,8,0.0,0.0,140.1599943637848,152.40928158164024,15.321659063614213,3,2,3,1024x512x2048,0,
2026-03-02T08:38:08.960412+00:00,C,uniform,eval,uniform_eval_059,2048,64,4096,bf16,NVIDIA GeForce RTX 4060,c05,128,64,32,4,3,8,0.0,0.0,89.79199826717377,171.78207755088798,11.958101442459371,3,1,3,2048x64x4096,0,
2026-03-02T08:38:08.976490+00:00,C,uniform,eval,uniform_eval_060,64,1536,1024,bf16,NVIDIA GeForce RTX 4060,c06,64,128,32,4,3,8,0.0,0.0,55.296000093221664,104.98655840754509,3.6408888827508368,1,3,3,64x1536x1024,0,
2026-03-02T08:38:08.995095+00:00,C,uniform,eval,uniform_eval_061,768,1024,1536,bf16,NVIDIA GeForce RTX 4060,c08,128,128,64,8,4,8,0.0,0.0,119.74400281906128,185.12895926833147,20.175700219831178,3,3,3,768x1024x1536,0,
2026-03-02T08:38:09.004534+00:00,C,uniform,eval,uniform_eval_062,384,2048,192,bf16,NVIDIA GeForce RTX 4060,c03,64,64,32,4,2,8,0.0,0.0,67.58400052785873,133.6067178845405,4.468363601463886,2,3,2,384x2048x192,0,
2026-03-02T08:38:09.010636+00:00,C,uniform,eval,uniform_eval_063,256,2048,192,bf16,NVIDIA GeForce RTX 4060,c03,64,64,32,4,2,8,0.0,0.0,40.95999896526337,53.996799401938915,4.9152001241684,2,3,2,256x2048x192,0,
2026-03-02T08:38:09.165054+00:00,C,llm_style,tune,llm_style_tune_000,8,4096,1024,bf16,NVIDIA GeForce RTX 4060,c11,32,128,32,4,2,8,136.0531150130555,0.0,41.471999138593674,155.5625632405281,1.6181728731169065,0,3,3,8x4096x1024,0,
2026-03-02T08:38:09.311587+00:00,C,llm_style,tune,llm_style_tune_001,32,1024,2048,bf16,NVIDIA GeForce RTX 4060,c11,32,128,32,4,2,8,0.0,0.0,49.15200173854828,99.29535932838915,2.730666570080655,0,3,3,32x1024x2048,0,
2026-03-02T08:38:09.335815+00:00,C,llm_style,tune,llm_style_tune_002,16,2048,1024,bf16,NVIDIA GeForce RTX 4060,c11,32,128,32,4,2,8,0.0,0.0,51.19999870657921,132.3007962852716,1.310720033111573,0,3,3,16x2048x1024,0,
2026-03-02T08:38:09.573385+00:00,C,llm_style,tune,llm_style_tune_003,1,1024,4096,bf16,NVIDIA GeForce RTX 4060,c11,32,128,32,4,2,8,0.0,0.0,98.70400279760361,221.92511349916444,0.08498751582751074,0,3,3,1x1024x4096,0,
2026-03-02T08:38:09.601286+00:00,C,llm_style,tune,llm_style_tune_004,64,2048,2048,bf16,NVIDIA GeForce RTX 4060,c06,64,128,32,4,3,8,0.0,0.0,59.39200147986412,664.2195039987549,9.039448050627108,1,3,3,64x2048x2048,0,
2026-03-02T08:38:09.966996+00:00,C,llm_style,tune,llm_style_tune_005,32,8192,8192,bf16,NVIDIA GeForce RTX 4060,c11,32,128,32,4,2,8,0.0,0.0,583.6799740791321,667.1702563762663,7.358428396958694,0,3,3,32x8192x8192,0,
2026-03-02T08:38:10.295030+00:00,C,llm_style,tune,llm_style_tune_006,16,8192,8192,bf16,NVIDIA GeForce RTX 4060,c11,32,128,32,4,2,8,0.0,0.0,561.0399842262268,627.445763349533,3.827683780794624,0,3,3,16x8192x8192,0,
2026-03-02T08:38:10.340166+00:00,C,llm_style,tune,llm_style_tune_007,2,1024,8192,bf16,NVIDIA GeForce RTX 4060,c11,32,128,32,4,2,8,0.0,0.0,132.9919993877411,197.10208252072334,0.2523041397563422,0,3,3,2x1024x8192,0,
2026-03-02T08:38:10.428816+00:00,C,llm_style,tune,llm_style_tune_008,16,2048,8192,bf16,NVIDIA GeForce RTX 4060,c11,32,128,32,4,2,8,0.0,0.0,186.20800226926804,294.3043068051338,2.883178517879442,0,3,3,16x2048x8192,0,
2026-03-02T08:38:10.471423+00:00,C,llm_style,tune,llm_style_tune_009,4,4096,2048,bf16,NVIDIA GeForce RTX 4060,c11,32,128,32,4,2,8,0.0,0.0,56.04800023138523,119.82848331332207,1.1973462696786996,0,3,3,4x4096x2048,0,
2026-03-02T08:38:10.633993+00:00,C,llm_style,tune,llm_style_tune_010,64,8192,4096,bf16,NVIDIA GeForce RTX 4060,c06,64,128,32,4,3,8,0.0,0.0,307.20001459121704,454.8720097541809,13.981012669270863,1,3,3,64x8192x4096,0,
2026-03-02T08:38:10.675865+00:00,C,llm_style,tune,llm_style_tune_011,16,8192,1024,bf16,NVIDIA GeForce RTX 4060,c11,32,128,32,4,2,8,0.0,0.0,58.36800113320351,186.30656316876392,4.5990174545706095,0,3,3,16x8192x1024,0,
2026-03-02T08:38:10.715009+00:00,C,llm_style,tune,llm_style_tune_012,2,8192,1024,bf16,NVIDIA GeForce RTX 4060,c11,32,128,32,4,2,8,0.0,0.0,52.57599987089634,69.65696051716802,0.6382081573796982,0,3,3,2x8192x1024,0,
2026-03-02T08:38:10.800062+00:00,C,llm_style,tune,llm_style_tune_013,16,8192,2048,bf16,NVIDIA GeForce RTX 4060,c11,32,128,32,4,2,8,0.0,0.0,166.9120043516159,364.87648606300303,3.216490713687859,0,3,3,16x8192x2048,0,
2026-03-02T08:38:10.882122+00:00,C,llm_style,tune,llm_style_tune_014,8,4096,4096,bf16,NVIDIA GeForce RTX 4060,c11,32,128,32,4,2,8,0.0,0.0,160.76800227165222,180.82815781235695,1.6697069827764632,0,3,3,8x4096x4096,0,
2026-03-02T08:38:10.891428+00:00,C,llm_style,tune,llm_style_tune_015,64,1024,1024,bf16,NVIDIA GeForce RTX 4060,c06,64,128,32,4,3,8,0.0,0.0,22.52800017595291,53.093119822442524,5.957818135285181,1,3,3,64x1024x1024,0,
2026-03-02T08:38:11.056074+00:00,C,llm_style,tune,llm_style_tune_016,16,4096,8192,bf16,NVIDIA GeForce RTX 4060,c11,32,128,32,4,2,8,0.0,0.0,295.74400186538696,335.12863010168064,3.6306461575803395,0,3,3,16x4096x8192,0,
2026-03-02T08:38:11.141262+00:00,C,llm_style,tune,llm_style_tune_017,1,4096,4096,bf16,NVIDIA GeForce RTX 4060,c11,32,128,32,4,2,8,0.0,0.0,190.46400487422943,260.6531110405922,0.17617203850227375,0,3,3,1x4096x4096,0,
2026-03-02T08:38:11.251334+00:00,C,llm_style,tune,llm_style_tune_018,64,4096,4096,bf16,NVIDIA GeForce RTX 4060,c06,64,128,32,4,3,8,0.0,0.0,171.4560016989708,272.07488596439356,12.524983825123751,1,3,3,64x4096x4096,0,
2026-03-02T08:38:11.335548+00:00,C,llm_style,tune,llm_style_tune_019,64,8192,2048,bf16,NVIDIA GeForce RTX 4060,c06,64,128,32,4,3,8,0.0,0.0,175.10400712490082,214.9520054459571,12.264046284607355,1,3,3,64x8192x2048,0,
2026-03-02T08:38:11.380432+00:00,C,llm_style,tune,llm_style_tune_020,8,2048,4096,bf16,NVIDIA GeForce RTX 4060,c11,32,128,32,4,2,8,0.0,0.0,110.08000001311302,264.8576037585733,1.219274418459408,0,3,3,8x2048x4096,0,
2026-03-02T08:38:11.398997+00:00,C,llm_style,tune,llm_style_tune_021,8,1024,2048,bf16,NVIDIA GeForce RTX 4060,c11,32,128,32,4,2,8,0.0,0.0,89.08800035715103,172.1439982950687,0.37664367665096665,0,3,3,8x1024x2048,0,
2026-03-02T08:38:11.442287+00:00,C,llm_style,tune,llm_style_tune_022,8,8192,1024,bf16,NVIDIA GeForce RTX 4060,c11,32,128,32,4,2,8,0.0,0.0,54.27199974656105,143.17343652248377,2.4730566153222444,0,3,3,8x8192x1024,0,
2026-03-02T08:38:11.610786+00:00,C,llm_style,tune,llm_style_tune_023,1,4096,8192,bf16,NVIDIA GeForce RTX 4060,c11,32,128,32,4,2,8,0.0,0.0,300.03198981285095,409.00448352098465,0.22367236254327436,0,3,3,1x4096x8192,0,
2026-03-02T08:38:11.771040+00:00,C,llm_style,tune,llm_style_tune_024,2,8192,4096,bf16,NVIDIA GeForce RTX 4060,c11,32,128,32,4,2,8,0.0,0.0,295.9359884262085,318.4601557254791,0.4535363499173306,0,3,3,2x8192x4096,0,
2026-03-02T08:38:11.854523+00:00,C,llm_style,tune,llm_style_tune_025,2,4096,4096,bf16,NVIDIA GeForce RTX 4060,c11,32,128,32,4,2,8,0.0,0.0,173.5680028796196,307.6915195584296,0.38664306143191757,0,3,3,2x4096x4096,0,
2026-03-02T08:38:11.866584+00:00,C,llm_style,tune,llm_style_tune_026,4,2048,1024,bf16,NVIDIA GeForce RTX 4060,c11,32,128,32,4,2,8,0.0,0.0,52.22399905323982,114.7212806344032,0.3212549077847609,0,3,3,4x2048x1024,0,
2026-03-02T08:38:11.915313+00:00,C,llm_style,tune,llm_style_tune_027,64,2048,4096,bf16,NVIDIA GeForce RTX 4060,c06,64,128,32,4,3,8,0.0,0.0,113.53600025177002,164.38912287354458,9.45728070056141,1,3,3,64x2048x4096,0,
2026-03-02T08:38:11.940313+00:00,C,llm_style,tune,llm_style_tune_028,32,1024,4096,bf16,NVIDIA GeForce RTX 4060,c11,32,128,32,4,2,8,0.0,0.0,122.8799968957901,230.87103605270374,2.1845333885192884,0,3,3,32x1024x4096,0,
2026-03-02T08:38:11.952393+00:00,C,llm_style,tune,llm_style_tune_029,32,2048,1024,bf16,NVIDIA GeForce RTX 4060,c11,32,128,32,4,2,8,0.0,0.0,68.60800087451935,180.16256108880023,1.9562984825265148,0,3,3,32x2048x1024,0,
2026-03-02T08:38:11.975420+00:00,C,llm_style,tune,llm_style_tune_030,4,2048,2048,bf16,NVIDIA GeForce RTX 4060,c11,32,128,32,4,2,8,0.0,0.0,77.31200009584427,120.04287935793394,0.4340132444950631,0,3,3,4x2048x2048,0,
2026-03-02T08:38:12.331466+00:00,C,llm_style,tune,llm_style_tune_031,1,8192,8192,bf16,NVIDIA GeForce RTX 4060,c11,32,128,32,4,2,8,0.0,0.0,906.607985496521,1018.2354867458344,0.14804384049903677,0,3,3,1x8192x8192,0,
2026-03-02T08:38:12.367773+00:00,C,llm_style,eval,llm_style_eval_000,2,1024,4096,bf16,NVIDIA GeForce RTX 4060,c11,32,128,32,4,2,8,0.0,0.0,145.4080045223236,241.16224348545074,0.11538027810170723,0,3,3,2x1024x4096,0,
2026-03-02T08:38:12.713818+00:00,C,llm_style,eval,llm_style_eval_001,2,8192,8192,bf16,NVIDIA GeForce RTX 4060,c11,32,128,32,4,2,8,0.0,0.0,906.7040085792542,1022.9516303539276,0.29605632429112205,0,3,3,2x8192x8192,0,
2026-03-02T08:38:12.743729+00:00,C,llm_style,eval,llm_style_eval_002,2,2048,2048,bf16,NVIDIA GeForce RTX 4060,c11,32,128,32,4,2,8,0.0,0.0,93.6960019171238,694.5078179240211,0.17906010562584967,0,3,3,2x2048x2048,0,
2026-03-02T08:38:12.801400+00:00,C,llm_style,eval,llm_style_eval_003,8,1024,8192,bf16,NVIDIA GeForce RTX 4060,c11,32,128,32,4,2,8,0.0,0.0,252.70400941371918,265.82015693187714,0.531126230689371,0,3,3,8x1024x8192,0,
2026-03-02T08:38:12.897722+00:00,C,llm_style,eval,llm_style_eval_004,64,2048,8192,bf16,NVIDIA GeForce RTX 4060,c06,64,128,32,4,3,8,0.0,0.0,283.4559977054596,394.2230275273323,7.576074118676648,1,3,3,64x2048x8192,0,
2026-03-02T08:38:13.246641+00:00,C,llm_style,eval,llm_style_eval_005,1,8192,8192,bf16,NVIDIA GeForce RTX 4060,c11,32,128,32,4,2,8,0.0,0.0,908.1760048866272,998.6765086650847,0.1477882340843779,0,3,3,1x8192x8192,0,
2026-03-02T08:38:13.351326+00:00,C,llm_style,eval,llm_style_eval_006,1,1024,8192,bf16,NVIDIA GeForce RTX 4060,c11,32,128,32,4,2,8,0.0,0.0,264.6079957485199,409.6409645676613,0.06340404020120713,0,3,3,1x1024x8192,0,
2026-03-02T08:38:13.547023+00:00,C,llm_style,eval,llm_style_eval_007,2,8192,4096,bf16,NVIDIA GeForce RTX 4060,c11,32,128,32,4,2,8,0.0,0.0,478.2080054283142,564.8179244995116,0.2806680910324491,0,3,3,2x8192x4096,0,
2026-03-02T08:38:13.594820+00:00,C,llm_style,eval,llm_style_eval_008,16,2048,4096,bf16,NVIDIA GeForce RTX 4060,c11,32,128,32,4,2,8,0.0,0.0,165.74399918317795,206.95679858326898,1.619578731796672,0,3,3,16x2048x4096,0,
2026-03-02T08:38:13.690818+00:00,C,llm_style,eval,llm_style_eval_009,32,2048,8192,bf16,NVIDIA GeForce RTX 4060,c11,32,128,32,4,2,8,0.0,0.0,367.1039938926697,410.6956884264945,2.9248982355499247,0,3,3,32x2048x8192,0,
2026-03-02T08:38:13.701960+00:00,C,llm_style,eval,llm_style_eval_010,1,1024,1024,bf16,NVIDIA GeForce RTX 4060,c11,32,128,32,4,2,8,0.0,0.0,84.95999872684479,160.67423775792122,0.024683992836941546,0,3,3,1x1024x1024,0,
2026-03-02T08:38:13.798452+00:00,C,llm_style,eval,llm_style_eval_011,16,2048,8192,bf16,NVIDIA GeForce RTX 4060,c11,32,128,32,4,2,8,0.0,0.0,368.6400055885315,417.43999898433674,1.4563555334774068,0,3,3,16x2048x8192,0,
2026-03-02T08:38:14.150060+00:00,C,llm_style,eval,llm_style_eval_012,8,8192,8192,bf16,NVIDIA GeForce RTX 4060,c11,32,128,32,4,2,8,0.0,0.0,912.3839735984802,990.2860647439957,1.1768530082407276,0,3,3,8x8192x8192,0,
2026-03-02T08:38:14.323030+00:00,C,llm_style,eval,llm_style_eval_013,32,4096,8192,bf16,NVIDIA GeForce RTX 4060,c11,32,128,32,4,2,8,0.0,0.0,489.47200179100037,523.6448156833649,4.387347264281224,0,3,3,32x4096x8192,0,
2026-03-02T08:38:14.334936+00:00,C,llm_style,eval,llm_style_eval_014,64,1024,1024,bf16,NVIDIA GeForce RTX 4060,c06,64,128,32,4,3,8,0.0,0.0,84.99199897050858,121.90720386803139,1.579180742019873,1,3,3,64x1024x1024,0,
2026-03-02T08:38:14.349103+00:00,C,llm_style,eval,llm_style_eval_015,16,2048,1024,bf16,NVIDIA GeForce RTX 4060,c11,32,128,32,4,2,8,0.0,0.0,79.85599711537361,126.08927756547915,0.8403735026067369,0,3,3,16x2048x1024,0,
2026-03-02T08:38:14.406642+00:00,C,llm_style,eval,llm_style_eval_016,2,1024,8192,bf16,NVIDIA GeForce RTX 4060,c11,32,128,32,4,2,8,0.0,0.0,340.91199934482574,438.31295907497406,0.098425494158275,0,3,3,2x1024x8192,0,
2026-03-02T08:38:14.742365+00:00,C,llm_style,eval,llm_style_eval_017,4,8192,8192,bf16,NVIDIA GeForce RTX 4060,c11,32,128,32,4,2,8,0.0,0.0,911.3600254058838,974.523201584816,0.5890876240275065,0,3,3,4x8192x8192,0,
2026-03-02T08:38:14.771043+00:00,C,llm_style,eval,llm_style_eval_018,4,1024,4096,bf16,NVIDIA GeForce RTX 4060,c11,32,128,32,4,2,8,0.0,0.0,201.58399641513824,312.944652736187,0.16645384850342307,0,3,3,4x1024x4096,0,
2026-03-02T08:38:14.818675+00:00,C,llm_style,eval,llm_style_eval_019,8,4096,2048,bf16,NVIDIA GeForce RTX 4060,c11,32,128,32,4,2,8,0.0,0.0,130.048006772995,269.8364734649658,1.0320629383753912,0,3,3,8x4096x2048,0,
2026-03-02T08:38:14.868407+00:00,C,llm_style,eval,llm_style_eval_020,64,4096,2048,bf16,NVIDIA GeForce RTX 4060,c06,64,128,32,4,3,8,0.0,0.0,211.71199530363083,276.87135621905304,5.071709906942553,1,3,3,64x4096x2048,0,
2026-03-02T08:38:15.041945+00:00,C,llm_style,eval,llm_style_eval_021,1,4096,8192,bf16,NVIDIA GeForce RTX 4060,c11,32,128,32,4,2,8,0.0,0.0,504.83202934265137,555.1897531747818,0.13293305515377732,0,3,3,1x4096x8192,0,
2026-03-02T08:38:15.071111+00:00,C,llm_style,eval,llm_style_eval_022,32,1024,4096,bf16,NVIDIA GeForce RTX 4060,c11,32,128,32,4,2,8,0.0,0.0,200.70399343967438,289.6588772535323,1.337469431472392,0,3,3,32x1024x4096,0,
2026-03-02T08:38:15.081567+00:00,C,llm_style,eval,llm_style_eval_023,4,1024,1024,bf16,NVIDIA GeForce RTX 4060,c11,32,128,32,4,2,8,0.0,0.0,79.8719972372055,115.28320357203478,0.10502564465850703,0,3,3,4x1024x1024,0,
2026-03-02T08:38:15.104685+00:00,C,llm_style,eval,llm_style_eval_024,64,2048,2048,bf16,NVIDIA GeForce RTX 4060,c06,64,128,32,4,3,8,0.0,0.0,121.68000265955925,188.71296018362028,4.412154012702293,1,3,3,64x2048x2048,0,
2026-03-02T08:38:15.453086+00:00,C,llm_style,eval,llm_style_eval_025,32,8192,8192,bf16,NVIDIA GeForce RTX 4060,c11,32,128,32,4,2,8,0.0,0.0,937.4400079250336,1043.2204341888428,4.581591632201242,0,3,3,32x8192x8192,0,
2026-03-02T08:38:15.510516+00:00,C,llm_style,eval,llm_style_eval_026,4,2048,4096,bf16,NVIDIA GeForce RTX 4060,c11,32,128,32,4,2,8,0.0,0.0,195.3440010547638,379.60703790187836,0.3435419753749507,0,3,3,4x2048x4096,0,
2026-03-02T08:38:15.601450+00:00,C,llm_style,eval,llm_style_eval_027,8,8192,2048,bf16,NVIDIA GeForce RTX 4060,c11,32,128,32,4,2,8,0.0,0.0,277.43999660015106,324.2700743675232,0.967544187173818,0,3,3,8x8192x2048,0,
2026-03-02T08:38:15.775967+00:00,C,llm_style,eval,llm_style_eval_028,8,4096,8192,bf16,NVIDIA GeForce RTX 4060,c11,32,128,32,4,2,8,0.0,0.0,480.73600232601166,509.0508806705475,1.1167686826082985,0,3,3,8x4096x8192,0,
2026-03-02T08:38:15.798264+00:00,C,llm_style,eval,llm_style_eval_029,8,2048,2048,bf16,NVIDIA GeForce RTX 4060,c11,32,128,32,4,2,8,0.0,0.0,112.64000087976456,240.1471985876559,0.5957818135285181,0,3,3,8x2048x2048,0,
2026-03-02T08:38:15.844551+00:00,C,llm_style,eval,llm_style_eval_030,1,4096,2048,bf16,NVIDIA GeForce RTX 4060,c11,32,128,32,4,2,8,0.0,0.0,126.3360008597374,258.6931216716766,0.13279837802232355,0,3,3,1x4096x2048,0,
2026-03-02T08:38:15.931433+00:00,C,llm_style,eval,llm_style_eval_031,16,8192,2048,bf16,NVIDIA GeForce RTX 4060,c11,32,128,32,4,2,8,0.0,0.0,254.8159956932068,279.698888361454,2.1068964314405974,0,3,3,16x8192x2048,0,
2026-03-02T08:38:15.953257+00:00,C,llm_style,eval,llm_style_eval_032,1,2048,2048,bf16,NVIDIA GeForce RTX 4060,c11,32,128,32,4,2,8,0.0,0.0,105.47199845314026,203.8403210043906,0.07953398174897522,0,3,3,1x2048x2048,0,
2026-03-02T08:38:16.125539+00:00,C,llm_style,eval,llm_style_eval_033,16,8192,4096,bf16,NVIDIA GeForce RTX 4060,c11,32,128,32,4,2,8,0.0,0.0,474.11200404167175,501.17054611444473,2.2647429612552568,0,3,3,16x8192x4096,0,
2026-03-02T08:38:16.153336+00:00,C,llm_style,eval,llm_style_eval_034,16,1024,4096,bf16,NVIDIA GeForce RTX 4060,c11,32,128,32,4,2,8,0.0,0.0,187.80799955129623,296.120323240757,0.7146539461613345,0,3,3,16x1024x4096,0,
2026-03-02T08:38:16.242956+00:00,C,llm_style,eval,llm_style_eval_035,4,8192,2048,bf16,NVIDIA GeForce RTX 4060,c11,32,128,32,4,2,8,0.0,0.0,253.82399559020996,303.7423938512801,0.5287826617334078,0,3,3,4x8192x2048,0,
2026-03-02T08:38:16.291139+00:00,C,llm_style,eval,llm_style_eval_036,2,2048,4096,bf16,NVIDIA GeForce RTX 4060,c11,32,128,32,4,2,8,0.0,0.0,196.04800641536713,301.1481535434722,0.1711541607258591,0,3,3,2x2048x4096,0,
2026-03-02T08:38:16.301044+00:00,C,llm_style,eval,llm_style_eval_037,2,1024,1024,bf16,NVIDIA GeForce RTX 4060,c11,32,128,32,4,2,8,0.0,0.0,70.14400139451027,140.85119932889938,0.05979561924917876,0,3,3,2x1024x1024,0,
2026-03-02T08:38:16.496332+00:00,C,llm_style,eval,llm_style_eval_038,64,4096,8192,bf16,NVIDIA GeForce RTX 4060,c06,64,128,32,4,3,8,0.0,0.0,749.567985534668,883.5510325431823,5.729923607845115,1,3,3,64x4096x8192,0,
2026-03-02T08:38:16.511963+00:00,C,llm_style,eval,llm_style_eval_039,4,1024,2048,bf16,NVIDIA GeForce RTX 4060,c11,32,128,32,4,2,8,0.0,0.0,110.36799848079681,174.62751924991608,0.15201159965693414,0,3,3,4x1024x2048,0,
2026-03-02T08:38:16.559802+00:00,C,llm_style,eval,llm_style_eval_040,64,8192,1024,bf16,NVIDIA GeForce RTX 4060,c06,64,128,32,4,3,8,0.0,0.0,167.93599724769592,311.5548835694787,6.393756202348283,1,3,3,64x8192x1024,0,
2026-03-02T08:38:16.572846+00:00,C,llm_style,eval,llm_style_eval_041,2,2048,1024,bf16,NVIDIA GeForce RTX 4060,c11,32,128,32,4,2,8,0.0,0.0,68.60800087451935,121.17471955716593,0.12226865515790718,0,3,3,2x2048x1024,0,
2026-03-02T08:38:16.618243+00:00,C,llm_style,eval,llm_style_eval_042,2,4096,2048,bf16,NVIDIA GeForce RTX 4060,c11,32,128,32,4,2,8,0.0,0.0,118.78400295972824,163.8019223511218,0.2824827515820971,0,3,3,2x4096x2048,0,
2026-03-02T08:38:16.632016+00:00,C,llm_style,eval,llm_style_eval_043,1,2048,1024,bf16,NVIDIA GeForce RTX 4060,c11,32,128,32,4,2,8,0.0,0.0,72.56000116467476,143.4419238567352,0.05780462972266272,0,3,3,1x2048x1024,0,
2026-03-02T08:38:16.735132+00:00,C,llm_style,eval,llm_style_eval_044,8,2048,8192,bf16,NVIDIA GeForce RTX 4060,c11,32,128,32,4,2,8,0.0,0.0,449.9039947986603,477.9929614067077,0.5966505278979117,0,3,3,8x2048x8192,0,
2026-03-02T08:38:16.781165+00:00,C,llm_style,eval,llm_style_eval_045,1,8192,1024,bf16,NVIDIA GeForce RTX 4060,c11,32,128,32,4,2,8,0.0,0.0,137.02399283647537,225.34143432974815,0.12243998771822359,0,3,3,1x8192x1024,0,
2026-03-02T08:38:16.805075+00:00,C,llm_style,eval,llm_style_eval_046,64,4096,1024,bf16,NVIDIA GeForce RTX 4060,c06,64,128,32,4,3,8,0.0,0.0,116.73600226640701,151.0707226395607,4.5990174545706095,1,3,3,64x4096x1024,0,
2026-03-02T08:38:16.826800+00:00,C,llm_style,eval,llm_style_eval_047,16,2048,2048,bf16,NVIDIA GeForce RTX 4060,c11,32,128,32,4,2,8,0.0,0.0,120.17600238323212,252.04736337065694,1.1168430080740237,0,3,3,16x2048x2048,0,
2026-03-02T08:38:16.998917+00:00,C,llm_style,eval,llm_style_eval_048,8,8192,4096,bf16,NVIDIA GeForce RTX 4060,c11,32,128,32,4,2,8,0.0,0.0,476.1599898338318,546.129929423332,1.1275010993413261,0,3,3,8x8192x4096,0,
2026-03-02T08:38:17.176711+00:00,C,llm_style,eval,llm_style_eval_049,4,4096,8192,bf16,NVIDIA GeForce RTX 4060,c11,32,128,32,4,2,8,0.0,0.0,486.4000082015991,545.4643255472182,0.5518820959574101,0,3,3,4x4096x8192,0,
2026-03-02T08:38:17.276086+00:00,C,llm_style,eval,llm_style_eval_050,4,2048,8192,bf16,NVIDIA GeForce RTX 4060,c11,32,128,32,4,2,8,0.0,0.0,465.87200462818146,560.0972789525986,0.28810000744114456,0,3,3,4x2048x8192,0,
2026-03-02T08:38:17.288797+00:00,C,llm_style,eval,llm_style_eval_051,16,1024,1024,bf16,NVIDIA GeForce RTX 4060,c11,32,128,32,4,2,8,0.0,0.0,100.35199671983719,203.87839451432228,0.334367357868098,0,3,3,16x1024x1024,0,
2026-03-02T08:38:17.477267+00:00,C,llm_style,eval,llm_style_eval_052,32,8192,4096,bf16,NVIDIA GeForce RTX 4060,c11,32,128,32,4,2,8,0.0,0.0,487.2639924287796,622.1273428201675,4.407228281523151,0,3,3,32x8192x4096,0,
2026-03-02T08:38:17.496810+00:00,C,llm_style,eval,llm_style_eval_053,32,1024,2048,bf16,NVIDIA GeForce RTX 4060,c11,32,128,32,4,2,8,0.0,0.0,131.071999669075,159.41856130957598,1.0240000025853515,0,3,3,32x1024x2048,0,
2026-03-02T08:38:17.598425+00:00,C,llm_style,eval,llm_style_eval_054,64,8192,2048,bf16,NVIDIA GeForce RTX 4060,c06,64,128,32,4,3,8,0.0,0.0,363.5199964046478,447.50848233699776,5.90747048096236,1,3,3,64x8192x2048,0,
2026-03-02T08:38:17.627926+00:00,C,llm_style,eval,llm_style_eval_055,1,4096,1024,bf16,NVIDIA GeForce RTX 4060,c11,32,128,32,4,2,8,0.0,0.0,115.04000052809715,206.92320227622972,0.07291905390726404,0,3,3,1x4096x1024,0,
2026-03-02T08:38:17.654767+00:00,C,llm_style,eval,llm_style_eval_056,4,2048,2048,bf16,NVIDIA GeForce RTX 4060,c11,32,128,32,4,2,8,0.0,0.0,132.09599256515503,136.7142379283905,0.2540155181728894,0,3,3,4x2048x2048,0,
2026-03-02T08:38:17.721598+00:00,C,llm_style,eval,llm_style_eval_057,16,1024,8192,bf16,NVIDIA GeForce RTX 4060,c11,32,128,32,4,2,8,0.0,0.0,433.119997382164,496.1587199568746,0.6197715589731722,0,3,3,16x1024x8192,0,
2026-03-02T08:38:17.894278+00:00,C,llm_style,eval,llm_style_eval_058,1,8192,4096,bf16,NVIDIA GeForce RTX 4060,c11,32,128,32,4,2,8,0.0,0.0,481.1359941959381,602.501145005226,0.13948003227684216,0,3,3,1x8192x4096,0,
2026-03-02T08:38:17.915025+00:00,C,llm_style,eval,llm_style_eval_059,8,4096,1024,bf16,NVIDIA GeForce RTX 4060,c11,32,128,32,4,2,8,0.0,0.0,90.5120000243187,148.2607999444008,0.7414360966719246,0,3,3,8x4096x1024,0,
2026-03-02T08:38:18.084498+00:00,C,llm_style,eval,llm_style_eval_060,4,8192,4096,bf16,NVIDIA GeForce RTX 4060,c11,32,128,32,4,2,8,0.0,0.0,480.1599979400635,558.5817438364027,0.5590541843377544,0,3,3,4x8192x4096,0,
2026-03-02T08:38:18.109303+00:00,C,llm_style,eval,llm_style_eval_061,32,2048,2048,bf16,NVIDIA GeForce RTX 4060,c11,32,128,32,4,2,8,0.0,0.0,148.3360007405281,217.13855877518654,1.809644689488103,0,3,3,32x2048x2048,0,
2026-03-02T08:38:18.124645+00:00,C,llm_style,eval,llm_style_eval_062,8,2048,1024,bf16,NVIDIA GeForce RTX 4060,c11,32,128,32,4,2,8,0.0,0.0,102.38399729132652,160.32767832279205,0.32773121667171484,0,3,3,8x2048x1024,0,
2026-03-02T08:38:18.307070+00:00,C,llm_style,eval,llm_style_eval_063,16,4096,8192,bf16,NVIDIA GeForce RTX 4060,c11,32,128,32,4,2,8,0.0,0.0,581.6320180892944,682.4959993362423,1.8460844496273157,0,3,3,16x4096x8192,0,
2026-03-02T08:38:18.488662+00:00,C,training_style,tune,training_style_tune_000,4096,2048,1024,bf16,NVIDIA GeForce RTX 4060,c08,128,128,64,8,4,8,0.0,0.0,2800.6399869918823,3271.387858390808,6.134265476389413,3,3,3,4096x2048x1024,0,
2026-03-02T08:38:18.574263+00:00,C,training_style,tune,training_style_tune_001,1536,2048,1536,bf16,NVIDIA GeForce RTX 4060,c08,128,128,64,8,4,8,0.0,0.0,957.4400186538696,1120.255947113037,10.093244723138714,3,3,3,1536x2048x1536,0,
2026-03-02T08:38:18.867678+00:00,C,training_style,tune,training_style_tune_002,3072,2048,4096,bf16,NVIDIA GeForce RTX 4060,c08,128,128,64,8,4,8,0.0,0.0,3532.7999591827393,3548.8665199279785,14.588883646817896,3,3,3,3072x2048x4096,0,
2026-03-02T08:38:18.930369+00:00,C,training_style,tune,training_style_tune_003,2048,1536,2048,bf16,NVIDIA GeForce RTX 4060,c08,128,128,64,8,4,8,0.0,0.0,484.8639965057373,495.4688024520874,26.57425995919979,3,3,3,2048x1536x2048,0,
2026-03-02T08:38:18.943194+00:00,C,training_style,tune,training_style_tune_004,512,512,1024,bf16,NVIDIA GeForce RTX 4060,c08,128,128,64,8,4,8,0.0,0.0,59.39200147986412,181.03519260883303,9.039448050627108,2,2,3,512x512x1024,0,
2026-03-02T08:38:18.972938+00:00,C,training_style,tune,training_style_tune_005,1024,1536,1536,bf16,NVIDIA GeForce RTX 4060,c08,128,128,64,8,4,8,0.0,0.0,225.21600127220154,319.52896386384964,21.454240288016315,3,3,3,1024x1536x1536,0,
2026-03-02T08:38:18.986409+00:00,C,training_style,tune,training_style_tune_006,1024,1536,512,bf16,NVIDIA GeForce RTX 4060,c08,128,128,64,8,4,8,0.0,0.0,104.33599725365639,209.60256010293955,15.436788628994076,3,3,2,1024x1536x512,0,
2026-03-02T08:38:19.004579+00:00,C,training_style,tune,training_style_tune_007,2048,1536,512,bf16,NVIDIA GeForce RTX 4060,c08,128,128,64,8,4,8,0.0,0.0,160.11199355125427,170.85055708885193,20.11857700696755,3,3,2,2048x1536x512,0,
2026-03-02T08:38:19.093628+00:00,C,training_style,tune,training_style_tune_008,3072,3072,1536,bf16,NVIDIA GeForce RTX 4060,c08,128,128,64,8,4,8,0.0,0.0,945.5040097236633,1028.3008205890656,30.661984454696317,3,3,3,3072x3072x1536,0,
2026-03-02T08:38:19.115030+00:00,C,training_style,tune,training_style_tune_009,1024,1536,1024,bf16,NVIDIA GeForce RTX 4060,c08,128,128,64,8,4,8,0.0,0.0,136.19199395179749,291.3785567879672,23.65209127593866,3,3,3,1024x1536x1024,0,
2026-03-02T08:38:19.215651+00:00,C,training_style,tune,training_style_tune_010,1536,2048,4096,bf16,NVIDIA GeForce RTX 4060,c08,128,128,64,8,4,8,0.0,0.0,829.3119966983795,983.5725152492521,31.07371396843843,3,3,3,1536x2048x4096,0,
2026-03-02T08:38:19.276760+00:00,C,training_style,tune,training_style_tune_011,1024,1024,4096,bf16,NVIDIA GeForce RTX 4060,c08,128,128,64,8,4,8,0.0,0.0,335.32799780368805,436.17280960082996,25.616514720696923,3,3,3,1024x1024x4096,0,
2026-03-02T08:38:19.605207+00:00,C,training_style,tune,training_style_tune_012,3072,4096,4096,bf16,NVIDIA GeForce RTX 4060,c08,128,128,64,8,4,8,0.0,0.0,3208.1921100616455,3272.996563911438,32.13000081283141,3,3,3,3072x4096x4096,0,
2026-03-02T08:38:19.638549+00:00,C,training_style,tune,training_style_tune_013,512,1024,3072,bf16,NVIDIA GeForce RTX 4060,c08,128,128,64,8,4,8,0.0,0.0,184.32000279426575,286.18880242109293,17.476266401728882,2,3,3,512x1024x3072,0,
2026-03-02T08:38:19.662758+00:00,C,training_style,tune,training_style_tune_014,1536,1024,1024,bf16,NVIDIA GeForce RTX 4060,c08,128,128,64,8,4,8,0.0,0.0,138.19199800491333,150.57184234261513,23.309782899914882,3,3,3,1536x1024x1024,0,
2026-03-02T08:38:19.728717+00:00,C,training_style,tune,training_style_tune_015,2048,3072,1536,bf16,NVIDIA GeForce RTX 4060,c08,128,128,64,8,4,8,0.0,0.0,651.199996471405,712.2921591997145,29.67959603305785,3,3,3,2048x3072x1536,0,
2026-03-02T08:38:19.859211+00:00,C,training_style,tune,training_style_tune_016,1536,3072,3072,bf16,NVIDIA GeForce RTX 4060,c08,128,128,64,8,4,8,0.0,0.0,936.959981918335,1004.7795051336287,30.941587482363627,3,3,3,1536x3072x3072,0,
2026-03-02T08:38:19.892148+00:00,C,training_style,tune,training_style_tune_017,1024,1024,2048,bf16,NVIDIA GeForce RTX 4060,c08,128,128,64,8,4,8,0.0,0.0,190.46400487422943,406.016003191471,22.55002092829104,3,3,3,1024x1024x2048,0,
2026-03-02T08:38:19.927255+00:00,C,training_style,tune,training_style_tune_018,1536,1536,1536,bf16,NVIDIA GeForce RTX 4060,c08,128,128,64,8,4,8,0.0,0.0,257.02399015426636,268.78176867961884,28.198758052312083,3,3,3,1536x1536x1536,0,
2026-03-02T08:38:19.971650+00:00,C,training_style,tune,training_style_tune_019,1536,1536,2048,bf16,NVIDIA GeForce RTX 4060,c08,128,128,64,8,4,8,0.0,0.0,334.22400057315826,373.6796784400939,28.913771600566786,3,3,3,1536x1536x2048,0,
2026-03-02T08:38:19.997794+00:00,C,training_style,tune,training_style_tune_020,1536,1536,1024,bf16,NVIDIA GeForce RTX 4060,c08,128,128,64,8,4,8,0.0,0.0,184.32000279426575,224.16032016277302,26.214399602593325,3,3,3,1536x1536x1024,0,
2026-03-02T08:38:20.030996+00:00,C,training_style,tune,training_style_tune_021,1024,2048,1536,bf16,NVIDIA GeForce RTX 4060,c08,128,128,64,8,4,8,0.0,0.0,256.00001215934753,308.5804787278174,25.165822804687558,3,3,3,1024x2048x1536,0,
2026-03-02T08:38:20.052906+00:00,C,training_style,tune,training_style_tune_022,512,1024,1536,bf16,NVIDIA GeForce RTX 4060,c08,128,128,64,8,4,8,0.0,0.0,108.57599973678589,190.50720006227488,14.833966437375748,2,3,3,512x1024x1536,0,
2026-03-02T08:38:20.109375+00:00,C,training_style,tune,training_style_tune_023,1536,2048,2048,bf16,NVIDIA GeForce RTX 4060,c08,128,128,64,8,4,8,0.0,0.0,442.3680007457733,488.66559267044056,29.127111062006694,3,3,3,1536x2048x2048,0,
2026-03-02T08:38:20.124970+00:00,C,training_style,tune,training_style_tune_024,1024,1024,1024,bf16,NVIDIA GeForce RTX 4060,c08,128,128,64,8,4,8,0.0,0.0,109.37599837779999,202.87967652082438,19.633956991023673,3,3,3,1024x1024x1024,0,
2026-03-02T08:38:20.182012+00:00,C,training_style,tune,training_style_tune_025,1536,1024,4096,bf16,NVIDIA GeForce RTX 4060,c08,128,128,64,8,4,8,0.0,0.0,427.90400981903076,462.46912360191345,30.111664280615848,3,3,3,1536x1024x4096,0,
2026-03-02T08:38:20.213892+00:00,C,training_style,tune,training_style_tune_026,2048,4096,512,bf16,NVIDIA GeForce RTX 4060,c08,128,128,64,8,4,8,0.0,0.0,335.87199449539185,390.0518414378165,25.57502480939313,3,3,2,2048x4096x512,0,
2026-03-02T08:38:20.361024+00:00,C,training_style,tune,training_style_tune_027,4096,4096,1536,bf16,NVIDIA GeForce RTX 4060,c08,128,128,64,8,4,8,0.0,0.0,1678.272008895874,1879.4476711750028,30.70992501740384,3,3,3,4096x4096x1536,0,
2026-03-02T08:38:20.445999+00:00,C,training_style,tune,training_style_tune_028,1536,1536,4096,bf16,NVIDIA GeForce RTX 4060,c08,128,128,64,8,4,8,0.0,0.0,631.1679780483246,738.7971156835556,30.62156748154962,3,3,3,1536x1536x4096,0,
2026-03-02T08:38:20.567650+00:00,C,training_style,tune,training_style_tune_029,4096,2048,2048,bf16,NVIDIA GeForce RTX 4060,c08,128,128,64,8,4,8,0.0,0.0,1134.0800523757935,1276.1088001728058,30.29745413123131,3,3,3,4096x2048x2048,0,
2026-03-02T08:38:20.587992+00:00,C,training_style,tune,training_style_tune_030,2048,2048,512,bf16,NVIDIA GeForce RTX 4060,c08,128,128,64,8,4,8,0.0,0.0,185.34399569034576,261.5808025002477,23.17295081506499,3,3,2,2048x2048x512,0,
2026-03-02T08:38:20.600945+00:00,C,training_style,tune,training_style_tune_031,512,512,1536,bf16,NVIDIA GeForce RTX 4060,c08,128,128,64,8,4,8,0.0,0.0,71.60000130534172,157.73311987519259,11.247295437408324,2,2,3,512x512x1536,0,
2026-03-02T08:38:20.675645+00:00,C,training_style,eval,training_style_eval_000,2048,1536,3072,bf16,NVIDIA GeForce RTX 4060,c08,128,128,64,8,4,8,0.0,0.0,634.880006313324,665.562572479248,30.442528729533855,3,3,3,2048x1536x3072,0,
2026-03-02T08:38:20.719316+00:00,C,training_style,eval,training_style_eval_001,1024,2048,2048,bf16,NVIDIA GeForce RTX 4060,c08,128,128,64,8,4,8,0.0,0.0,334.78400111198425,398.44862937927235,25.65813946744335,3,3,3,1024x2048x2048,0,
2026-03-02T08:38:20.768870+00:00,C,training_style,eval,training_style_eval_002,1536,1024,3072,bf16,NVIDIA GeForce RTX 4060,c08,128,128,64,8,4,8,0.0,0.0,308.9280128479004,453.5590475797652,31.28132125964853,3,3,3,1536x1024x3072,0,
2026-03-02T08:38:20.782537+00:00,C,training_style,eval,training_style_eval_003,1024,512,1024,bf16,NVIDIA GeForce RTX 4060,c08,128,128,64,8,4,8,0.0,0.0,82.94399827718735,237.73183837532994,12.945382984935252,3,2,3,1024x512x1024,0,
2026-03-02T08:38:20.805792+00:00,C,training_style,eval,training_style_eval_004,1024,2048,1024,bf16,NVIDIA GeForce RTX 4060,c08,128,128,64,8,4,8,0.0,0.0,185.69599837064743,246.7680002748966,23.12902450071803,3,3,3,1024x2048x1024,0,
2026-03-02T08:38:20.820867+00:00,C,training_style,eval,training_style_eval_005,1024,512,1536,bf16,NVIDIA GeForce RTX 4060,c08,128,128,64,8,4,8,0.0,0.0,105.80800101161003,169.47200506925572,15.222031610097916,3,2,3,1024x512x1536,0,
2026-03-02T08:38:20.871329+00:00,C,training_style,eval,training_style_eval_006,2048,1536,2048,bf16,NVIDIA GeForce RTX 4060,c08,128,128,64,8,4,8,0.0,0.0,443.2000070810318,612.505609989166,29.072431593269823,3,3,3,2048x1536x2048,0,
2026-03-02T08:38:20.899211+00:00,C,training_style,eval,training_style_eval_007,1536,2048,1024,bf16,NVIDIA GeForce RTX 4060,c08,128,128,64,8,4,8,0.0,0.0,243.087999522686,258.6931216716766,26.502546224618396,3,3,3,1536x2048x1024,0,
2026-03-02T08:38:20.913529+00:00,C,training_style,eval,training_style_eval_008,512,512,2048,bf16,NVIDIA GeForce RTX 4060,c08,128,128,64,8,4,8,0.0,0.0,75.77600330114365,109.65855903923509,14.169945328639345,2,2,3,512x512x2048,0,
2026-03-02T08:38:20.932381+00:00,C,training_style,eval,training_style_eval_009,1024,512,2048,bf16,NVIDIA GeForce RTX 4060,c08,128,128,64,8,4,8,0.0,0.0,133.10399651527405,149.62271481752393,16.13387805191537,3,2,3,1024x512x2048,0,
2026-03-02T08:38:20.975435+00:00,C,training_style,eval,training_style_eval_010,2048,3072,1024,bf16,NVIDIA GeForce RTX 4060,c08,128,128,64,8,4,8,0.0,0.0,455.6800127029419,497.79552757740015,28.276205953320307,3,3,3,2048x3072x1024,0,
2026-03-02T08:38:21.061355+00:00,C,training_style,eval,training_style_eval_011,2048,4096,1536,bf16,NVIDIA GeForce RTX 4060,c08,128,128,64,8,4,8,0.0,0.0,875.359982252121,905.2364587783813,29.4390928286436,3,3,3,2048x4096x1536,0,
2026-03-02T08:38:21.196840+00:00,C,training_style,eval,training_style_eval_012,2048,3072,3072,bf16,NVIDIA GeForce RTX 4060,c08,128,128,64,8,4,8,0.0,0.0,1237.824022769928,1356.9024193286896,31.227949169624956,3,3,3,2048x3072x3072,0,
2026-03-02T08:38:21.270375+00:00,C,training_style,eval,training_style_eval_013,3072,1536,1536,bf16,NVIDIA GeForce RTX 4060,c08,128,128,64,8,4,8,0.0,0.0,498.1760084629059,637.7164822816848,29.09717525082169,3,3,3,3072x1536x1536,0,
2026-03-02T08:38:21.314514+00:00,C,training_style,eval,training_style_eval_014,2048,1536,1536,bf16,NVIDIA GeForce RTX 4060,c08,128,128,64,8,4,8,0.0,0.0,352.6720106601715,437.41631776094425,27.401313752997957,3,3,3,2048x1536x1536,0,
2026-03-02T08:38:21.372730+00:00,C,training_style,eval,training_style_eval_015,4096,2048,1024,bf16,NVIDIA GeForce RTX 4060,c08,128,128,64,8,4,8,0.0,0.0,606.2080264091492,716.8307203054427,28.33989065727869,3,3,3,4096x2048x1024,0,
2026-03-02T08:38:21.387350+00:00,C,training_style,eval,training_style_eval_016,2048,1024,512,bf16,NVIDIA GeForce RTX 4060,c08,128,128,64,8,4,8,0.0,0.0,117.76000261306763,156.0576005280017,18.236103943171084,3,3,2,2048x1024x512,0,
2026-03-02T08:38:21.515039+00:00,C,training_style,eval,training_style_eval_017,2048,4096,2048,bf16,NVIDIA GeForce RTX 4060,c08,128,128,64,8,4,8,0.0,0.0,1115.0559782981873,1163.4032106399536,30.814361822838954,3,3,3,2048x4096x2048,0,
2026-03-02T08:38:21.590346+00:00,C,training_style,eval,training_style_eval_018,1536,2048,3072,bf16,NVIDIA GeForce RTX 4060,c08,128,128,64,8,4,8,0.0,0.0,635.7119977474213,764.5859092473984,30.40268690929925,3,3,3,1536x2048x3072,0,
2026-03-02T08:38:21.649319+00:00,C,training_style,eval,training_style_eval_019,1536,1536,3072,bf16,NVIDIA GeForce RTX 4060,c08,128,128,64,8,4,8,0.0,0.0,482.1600019931793,543.426553606987,30.063702016089373,3,3,3,1536x1536x3072,0,
2026-03-02T08:38:21.716733+00:00,C,training_style,eval,training_style_eval_020,3072,1536,2048,bf16,NVIDIA GeForce RTX 4060,c08,128,128,64,8,4,8,0.0,0.0,643.4879899024963,720.5011206865308,30.035296905741085,3,3,3,3072x1536x2048,0,
2026-03-02T08:38:21.802999+00:00,C,training_style,eval,training_style_eval_021,2048,1024,4096,bf16,NVIDIA GeForce RTX 4060,c08,128,128,64,8,4,8,0.0,0.0,627.2000074386597,795.0950109958648,27.391372736359855,3,3,3,2048x1024x4096,0,
2026-03-02T08:38:21.815035+00:00,C,training_style,eval,training_style_eval_022,512,512,1536,bf16,NVIDIA GeForce RTX 4060,c08,128,128,64,8,4,8,0.0,0.0,61.43999844789505,112.01759964227676,13.107200331115733,2,2,3,512x512x1536,0,
2026-03-02T08:38:22.143483+00:00,C,training_style,eval,training_style_eval_023,3072,4096,4096,bf16,NVIDIA GeForce RTX 4060,c08,128,128,64,8,4,8,0.0,0.0,3206.144094467163,3261.7991042137146,32.15052476333912,3,3,3,3072x4096x4096,0,
2026-03-02T08:38:22.211353+00:00,C,training_style,eval,training_style_eval_024,1536,1024,4096,bf16,NVIDIA GeForce RTX 4060,c08,128,128,64,8,4,8,0.0,0.0,426.2240082025528,492.02175885438896,30.23035220924664,3,3,3,1536x1024x4096,0,
2026-03-02T08:38:22.371115+00:00,C,training_style,eval,training_style_eval_025,4096,3072,2048,bf16,NVIDIA GeForce RTX 4060,c08,128,128,64,8,4,8,0.0,0.0,1641.8240070343018,1786.3065087795258,31.391676166983473,3,3,3,4096x3072x2048,0,
2026-03-02T08:38:22.387477+00:00,C,training_style,eval,training_style_eval_026,1024,512,512,bf16,NVIDIA GeForce RTX 4060,c08,128,128,64,8,4,8,0.0,0.0,67.32799857854843,117.54559740424146,7.973962145535304,3,2,2,1024x512x512,0,
2026-03-02T08:38:22.454393+00:00,C,training_style,eval,training_style_eval_027,2048,4096,1024,bf16,NVIDIA GeForce RTX 4060,c08,128,128,64,8,4,8,0.0,0.0,614.3520176410675,875.2483397722237,27.964210567689978,3,3,3,2048x4096x1024,0,
2026-03-02T08:38:22.478467+00:00,C,training_style,eval,training_style_eval_028,1536,1536,1024,bf16,NVIDIA GeForce RTX 4060,c08,128,128,64,8,4,8,0.0,0.0,190.46400487422943,290.7772693037987,25.368773544327418,3,3,3,1536x1536x1024,0,
2026-03-02T08:38:22.516340+00:00,C,training_style,eval,training_style_eval_029,1024,512,4096,bf16,NVIDIA GeForce RTX 4060,c08,128,128,64,8,4,8,0.0,0.0,206.7679986357689,267.7862372994423,20.771915017496386,3,2,3,1024x512x4096,0,
2026-03-02T08:38:22.552679+00:00,C,training_style,eval,training_style_eval_030,1024,1024,3072,bf16,NVIDIA GeForce RTX 4060,c08,128,128,64,8,4,8,0.0,0.0,257.87200033664703,324.15135353803623,24.98313479396562,3,3,3,1024x1024x3072,0,
2026-03-02T08:38:22.564181+00:00,C,training_style,eval,training_style_eval_031,1024,1024,512,bf16,NVIDIA GeForce RTX 4060,c08,128,128,64,8,4,8,0.0,0.0,77.82399654388428,151.08287379145617,13.797053244297551,3,3,2,1024x1024x512,0,
2026-03-02T08:38:22.576924+00:00,C,training_style,eval,training_style_eval_032,512,1024,1024,bf16,NVIDIA GeForce RTX 4060,c08,128,128,64,8,4,8,0.0,0.0,82.94399827718735,113.98688130080694,12.945382984935252,2,3,3,512x1024x1024,0,
2026-03-02T08:38:22.663082+00:00,C,training_style,eval,training_style_eval_033,3072,2048,2048,bf16,NVIDIA GeForce RTX 4060,c08,128,128,64,8,4,8,0.0,0.0,848.3840227127075,1000.007694363594,30.375163942386685,3,3,3,3072x2048x2048,0,
2026-03-02T08:38:22.682227+00:00,C,training_style,eval,training_style_eval_034,1536,1024,512,bf16,NVIDIA GeForce RTX 4060,c08,128,128,64,8,4,8,0.0,0.0,89.08800035715103,139.68864127993584,18.078896479246403,3,3,2,1536x1024x512,0,
2026-03-02T08:38:23.084524+00:00,C,training_style,eval,training_style_eval_035,4096,4096,4096,bf16,NVIDIA GeForce RTX 4060,c08,128,128,64,8,4,8,0.0,0.0,4309.839963912964,4384.015064239502,31.88957237920669,3,3,3,4096x4096x4096,0,
2026-03-02T08:38:23.329472+00:00,C,training_style,eval,training_style_eval_036,2048,4096,4096,bf16,NVIDIA GeForce RTX 4060,c08,128,128,64,8,4,8,0.0,0.0,2185.59992313385,2319.1449666023254,31.441928602132137,3,3,3,2048x4096x4096,0,
2026-03-02T08:38:23.366099+00:00,C,training_style,eval,training_style_eval_037,4096,2048,512,bf16,NVIDIA GeForce RTX 4060,c08,128,128,64,8,4,8,0.0,0.0,335.80799400806427,465.167044699192,25.57989906515959,3,3,2,4096x2048x512,0,
2026-03-02T08:38:23.384363+00:00,C,training_style,eval,training_style_eval_038,2048,1536,512,bf16,NVIDIA GeForce RTX 4060,c08,128,128,64,8,4,8,0.0,0.0,151.92000567913055,192.6041541993617,21.203431750809262,3,3,2,2048x1536x512,0,
2026-03-02T08:38:23.480114+00:00,C,training_style,eval,training_style_eval_039,3072,3072,1536,bf16,NVIDIA GeForce RTX 4060,c08,128,128,64,8,4,8,0.0,0.0,961.0239863395691,1093.2000303268433,30.166811297211765,3,3,3,3072x3072x1536,0,
2026-03-02T08:38:23.494778+00:00,C,training_style,eval,training_style_eval_040,1536,1536,512,bf16,NVIDIA GeForce RTX 4060,c08,128,128,64,8,4,8,0.0,0.0,115.7120019197464,171.01824194192875,20.878725317323546,3,3,2,1536x1536x512,0,
2026-03-02T08:38:23.627731+00:00,C,training_style,eval,training_style_eval_041,3072,3072,2048,bf16,NVIDIA GeForce RTX 4060,c08,128,128,64,8,4,8,0.0,0.0,1246.2079524993896,1358.847975730896,31.017861494523668,3,3,3,3072x3072x2048,0,
2026-03-02T08:38:23.753729+00:00,C,training_style,eval,training_style_eval_042,3072,4096,1536,bf16,NVIDIA GeForce RTX 4060,c08,128,128,64,8,4,8,0.0,0.0,1270.6400156021118,1428.6336255073545,30.421445247561238,3,3,3,3072x4096x1536,0,
2026-03-02T08:38:23.819617+00:00,C,training_style,eval,training_style_eval_043,2048,3072,1536,bf16,NVIDIA GeForce RTX 4060,c08,128,128,64,8,4,8,0.0,0.0,657.4079990386963,740.0038367509841,29.3993271457933,3,3,3,2048x3072x1536,0,
2026-03-02T08:38:23.846559+00:00,C,training_style,eval,training_style_eval_044,512,512,4096,bf16,NVIDIA GeForce RTX 4060,c08,128,128,64,8,4,8,0.0,0.0,132.91200250387192,197.04479858279228,16.15718375725654,2,2,3,512x512x4096,0,
2026-03-02T08:38:23.911556+00:00,C,training_style,eval,training_style_eval_045,2048,1024,3072,bf16,NVIDIA GeForce RTX 4060,c08,128,128,64,8,4,8,0.0,0.0,487.42398619651794,555.9260773658752,26.43468982424084,3,3,3,2048x1024x3072,0,
2026-03-02T08:38:24.248983+00:00,C,training_style,eval,training_style_eval_046,4096,3072,4096,bf16,NVIDIA GeForce RTX 4060,c08,128,128,64,8,4,8,0.0,0.0,3179.5198917388916,3311.5672731399536,32.419742166678375,3,3,3,4096x3072x4096,0,
2026-03-02T08:38:24.301385+00:00,C,training_style,eval,training_style_eval_047,1536,3072,1024,bf16,NVIDIA GeForce RTX 4060,c08,128,128,64,8,4,8,0.0,0.0,325.6160020828247,508.3308982849121,29.678137297263163,3,3,3,1536x3072x1024,0,
2026-03-02T08:38:24.323833+00:00,C,training_style,eval,training_style_eval_048,512,512,3072,bf16,NVIDIA GeForce RTX 4060,c08,128,128,64,8,4,8,0.0,0.0,99.32799637317657,115.81440195441243,16.215093375576682,2,2,3,512x512x3072,0,
2026-03-02T08:38:24.363847+00:00,C,training_style,eval,training_style_eval_049,512,1024,4096,bf16,NVIDIA GeForce RTX 4060,c08,128,128,64,8,4,8,0.0,0.0,231.4240038394928,319.3494462966919,18.55886694873204,2,3,3,512x1024x4096,0,
2026-03-02T08:38:24.389984+00:00,C,training_style,eval,training_style_eval_050,3072,2048,512,bf16,NVIDIA GeForce RTX 4060,c08,128,128,64,8,4,8,0.0,0.0,260.5280131101608,313.82399022579193,24.728438478037656,3,3,2,3072x2048x512,0,
2026-03-02T08:38:24.398664+00:00,C,training_style,eval,training_style_eval_051,512,512,1024,bf16,NVIDIA GeForce RTX 4060,c08,128,128,64,8,4,8,0.0,0.0,54.6719990670681,116.30592197179783,9.81985149914495,2,2,3,512x512x1024,0,
2026-03-02T08:38:24.437558+00:00,C,training_style,eval,training_style_eval_052,1536,2048,1536,bf16,NVIDIA GeForce RTX 4060,c08,128,128,64,8,4,8,0.0,0.0,341.74399077892303,414.9651220440863,28.277531358997653,3,3,3,1536x2048x1536,0,
2026-03-02T08:38:24.545761+00:00,C,training_style,eval,training_style_eval_053,1536,3072,3072,bf16,NVIDIA GeForce RTX 4060,c08,128,128,64,8,4,8,0.0,0.0,935.9039962291718,982.274586558342,30.976499047773125,3,3,3,1536x3072x3072,0,
2026-03-02T08:38:24.592183+00:00,C,training_style,eval,training_style_eval_054,4096,3072,512,bf16,NVIDIA GeForce RTX 4060,c08,128,128,64,8,4,8,0.0,0.0,478.192001581192,621.341113448143,26.94503848954964,3,3,2,4096x3072x512,0,
2026-03-02T08:38:24.607298+00:00,C,training_style,eval,training_style_eval_055,1024,1024,1024,bf16,NVIDIA GeForce RTX 4060,c08,128,128,64,8,4,8,0.0,0.0,108.35199803113937,136.41440086066717,19.81951128748759,3,3,3,1024x1024x1024,0,
2026-03-02T08:38:24.633967+00:00,C,training_style,eval,training_style_eval_056,512,1024,3072,bf16,NVIDIA GeForce RTX 4060,c08,128,128,64,8,4,8,0.0,0.0,177.13599652051926,335.21279990673054,18.185041636225847,2,3,3,512x1024x3072,0,
2026-03-02T08:38:24.651988+00:00,C,training_style,eval,training_style_eval_057,1024,1536,1024,bf16,NVIDIA GeForce RTX 4060,c08,128,128,64,8,4,8,0.0,0.0,133.44000279903412,197.04831555485708,24.139878630333158,3,3,3,1024x1536x1024,0,
2026-03-02T08:38:24.768633+00:00,C,training_style,eval,training_style_eval_058,4096,2048,2048,bf16,NVIDIA GeForce RTX 4060,c08,128,128,64,8,4,8,0.0,0.0,1144.703984260559,1261.533762216568,30.016265200819806,3,3,3,4096x2048x2048,0,
2026-03-02T08:38:24.799776+00:00,C,training_style,eval,training_style_eval_059,2048,3072,512,bf16,NVIDIA GeForce RTX 4060,c08,128,128,64,8,4,8,0.0,0.0,262.84800469875336,424.6937546133994,24.510176333214357,3,3,2,2048x3072x512,0,
2026-03-02T08:38:24.837404+00:00,C,training_style,eval,training_style_eval_060,3072,3072,512,bf16,NVIDIA GeForce RTX 4060,c08,128,128,64,8,4,8,0.0,0.0,375.8080005645752,505.7827299833298,25.714397781532828,3,3,2,3072x3072x512,0,
2026-03-02T08:38:24.901107+00:00,C,training_style,eval,training_style_eval_061,2048,2048,2048,bf16,NVIDIA GeForce RTX 4060,c08,128,128,64,8,4,8,0.0,0.0,581.1199843883514,688.1382310390471,29.56337700566673,3,3,3,2048x2048x2048,0,
2026-03-02T08:38:24.916461+00:00,C,training_style,eval,training_style_eval_062,1024,2048,512,bf16,NVIDIA GeForce RTX 4060,c08,128,128,64,8,4,8,0.0,0.0,110.99199950695038,208.76928225159645,19.348094074704218,3,3,2,1024x2048x512,0,
2026-03-02T08:38:25.029108+00:00,C,training_style,eval,training_style_eval_063,3072,1536,3072,bf16,NVIDIA GeForce RTX 4060,c08,128,128,64,8,4,8,0.0,0.0,908.2399904727936,1064.0304458141327,31.92000963633899,3,3,3,3072x1536x3072,0,
2026-03-02T08:38:25.042021+00:00,C,adversarial,tune,adversarial_tune_000,1,1024,1024,bf16,NVIDIA GeForce RTX 4060,c11,32,128,32,4,2,8,0.0,0.0,40.95999896526337,630.2719935774782,0.051200001293420824,0,3,3,1x1024x1024,0,
2026-03-02T08:38:25.060683+00:00,C,adversarial,tune,adversarial_tune_001,1,1024,4096,bf16,NVIDIA GeForce RTX 4060,c11,32,128,32,4,2,8,0.0,0.0,71.68000191450119,123.57631683349595,0.11702856830285527,0,3,3,1x1024x4096,0,
2026-03-02T08:38:25.079125+00:00,C,adversarial,tune,adversarial_tune_002,1,4096,1024,bf16,NVIDIA GeForce RTX 4060,c11,32,128,32,4,2,8,0.0,0.0,44.03200000524521,96.81919917464255,0.1905116278842825,0,3,3,1x4096x1024,0,
2026-03-02T08:38:25.162600+00:00,C,adversarial,tune,adversarial_tune_003,1,4096,4096,bf16,NVIDIA GeForce RTX 4060,c11,32,128,32,4,2,8,0.0,0.0,164.67199474573135,276.6028842329979,0.20376526106828982,0,3,3,1x4096x4096,0,
2026-03-02T08:38:25.202877+00:00,C,adversarial,tune,adversarial_tune_004,1,8192,1024,bf16,NVIDIA GeForce RTX 4060,c11,32,128,32,4,2,8,0.0,0.0,52.22399905323982,118.3196786791086,0.3212549077847609,0,3,3,1x8192x1024,0,
2026-03-02T08:38:25.370426+00:00,C,adversarial,tune,adversarial_tune_005,1,8192,4096,bf16,NVIDIA GeForce RTX 4060,c11,32,128,32,4,2,8,0.0,0.0,318.86400282382965,432.12801218032837,0.2104623394478217,0,3,3,1x8192x4096,0,
2026-03-02T08:38:25.381136+00:00,C,adversarial,tune,adversarial_tune_006,2,1024,1024,bf16,NVIDIA GeForce RTX 4060,c11,32,128,32,4,2,8,0.0,0.0,63.9519989490509,138.4652821719646,0.06558518996945673,0,3,3,2x1024x1024,0,
2026-03-02T08:38:25.401646+00:00,C,adversarial,tune,adversarial_tune_007,2,1024,4096,bf16,NVIDIA GeForce RTX 4060,c11,32,128,32,4,2,8,0.0,0.0,97.15200215578079,170.9775993227958,0.1726903782497262,0,3,3,2x1024x4096,0,
2026-03-02T08:38:25.420367+00:00,C,adversarial,tune,adversarial_tune_008,2,4096,1024,bf16,NVIDIA GeForce RTX 4060,c11,32,128,32,4,2,8,0.0,0.0,70.01600041985512,151.59776270389557,0.23961974262160687,0,3,3,2x4096x1024,0,
2026-03-02T08:38:25.505833+00:00,C,adversarial,tune,adversarial_tune_009,2,4096,4096,bf16,NVIDIA GeForce RTX 4060,c11,32,128,32,4,2,8,0.0,0.0,186.36800348758698,306.7609682679175,0.36008790534942753,0,3,3,2x4096x4096,0,
2026-03-02T08:38:25.566222+00:00,C,adversarial,tune,adversarial_tune_010,2,8192,1024,bf16,NVIDIA GeForce RTX 4060,c11,32,128,32,4,2,8,0.0,0.0,48.99200052022934,137.16767713427544,0.6848961390369229,0,3,3,2x8192x1024,0,
2026-03-02T08:38:25.746164+00:00,C,adversarial,tune,adversarial_tune_011,2,8192,4096,bf16,NVIDIA GeForce RTX 4060,c11,32,128,32,4,2,8,0.0,0.0,294.8960065841675,350.5126383900641,0.45513579364694573,0,3,3,2x8192x4096,0,
2026-03-02T08:38:25.755009+00:00,C,adversarial,tune,adversarial_tune_012,4,1024,1024,bf16,NVIDIA GeForce RTX 4060,c11,32,128,32,4,2,8,0.0,0.0,38.91199827194214,154.62400019168854,0.21557895694214924,0,3,3,4x1024x1024,0,
2026-03-02T08:38:25.774044+00:00,C,adversarial,tune,adversarial_tune_013,4,1024,4096,bf16,NVIDIA GeForce RTX 4060,c11,32,128,32,4,2,8,0.0,0.0,66.0640001296997,177.3084825277328,0.5079079670338534,0,3,3,4x1024x4096,0,
2026-03-02T08:38:25.789954+00:00,C,adversarial,tune,adversarial_tune_014,4,4096,1024,bf16,NVIDIA GeForce RTX 4060,c11,32,128,32,4,2,8,0.0,0.0,39.983998984098434,113.7695984542369,0.8391964999134913,0,3,3,4x4096x1024,0,
2026-03-02T08:38:25.873097+00:00,C,adversarial,tune,adversarial_tune_015,4,4096,4096,bf16,NVIDIA GeForce RTX 4060,c11,32,128,32,4,2,8,0.0,0.0,161.71199828386307,169.37728062272072,0.8299800226597864,0,3,3,4x4096x4096,0,
2026-03-02T08:38:25.913321+00:00,C,adversarial,tune,adversarial_tune_016,4,8192,1024,bf16,NVIDIA GeForce RTX 4060,c11,32,128,32,4,2,8,0.0,0.0,54.60800044238567,121.85599990189056,1.2289200017642725,0,3,3,4x8192x1024,0,
2026-03-02T08:38:26.072979+00:00,C,adversarial,tune,adversarial_tune_017,4,8192,4096,bf16,NVIDIA GeForce RTX 4060,c11,32,128,32,4,2,8,0.0,0.0,296.9599962234497,420.28288275003433,0.9039448390820082,0,3,3,4x8192x4096,0,
2026-03-02T08:38:26.085461+00:00,C,adversarial,tune,adversarial_tune_018,8,1024,1024,bf16,NVIDIA GeForce RTX 4060,c11,32,128,32,4,2,8,0.0,0.0,41.98399931192398,54.76287968456745,0.3996097626467677,0,3,3,8x1024x1024,0,
2026-03-02T08:38:26.108770+00:00,C,adversarial,tune,adversarial_tune_019,8,1024,4096,bf16,NVIDIA GeForce RTX 4060,c11,32,128,32,4,2,8,0.0,0.0,74.52800124883652,349.11743938922865,0.9004516809183536,0,3,3,8x1024x4096,0,
2026-03-02T08:38:26.128138+00:00,C,adversarial,tune,adversarial_tune_020,8,4096,1024,bf16,NVIDIA GeForce RTX 4060,c11,32,128,32,4,2,8,0.0,0.0,40.95999896526337,129.02399897575378,1.6384000413894664,0,3,3,8x4096x1024,0,
2026-03-02T08:38:26.210249+00:00,C,adversarial,tune,adversarial_tune_021,8,4096,4096,bf16,NVIDIA GeForce RTX 4060,c11,32,128,32,4,2,8,0.0,0.0,166.9120043516159,289.4432047009468,1.6082453568439294,0,3,3,8x4096x4096,0,
2026-03-02T08:38:26.249237+00:00,C,adversarial,tune,adversarial_tune_022,8,8192,1024,bf16,NVIDIA GeForce RTX 4060,c11,32,128,32,4,2,8,0.0,0.0,48.91199991106987,137.77919813990593,2.7440654286070925,0,3,3,8x8192x1024,0,
2026-03-02T08:38:26.408349+00:00,C,adversarial,tune,adversarial_tune_023,8,8192,4096,bf16,NVIDIA GeForce RTX 4060,c11,32,128,32,4,2,8,0.0,0.0,292.86399483680725,308.7462365627289,1.8331748574937003,0,3,3,8x8192x4096,0,
2026-03-02T08:38:26.418239+00:00,C,adversarial,tune,adversarial_tune_024,16,1024,1024,bf16,NVIDIA GeForce RTX 4060,c11,32,128,32,4,2,8,0.0,0.0,49.0880012512207,162.78783455491066,0.6835566970485599,0,3,3,16x1024x1024,0,
2026-03-02T08:38:26.440676+00:00,C,adversarial,tune,adversarial_tune_025,16,1024,4096,bf16,NVIDIA GeForce RTX 4060,c11,32,128,32,4,2,8,0.0,0.0,108.59199985861778,288.43295589089377,1.235981731386712,0,3,3,16x1024x4096,0,
2026-03-02T08:38:26.459495+00:00,C,adversarial,tune,adversarial_tune_026,16,4096,1024,bf16,NVIDIA GeForce RTX 4060,c11,32,128,32,4,2,8,0.0,0.0,41.74399934709072,172.43136212229712,3.215258003527975,0,3,3,16x4096x1024,0,
2026-03-02T08:38:26.541335+00:00,C,adversarial,tune,adversarial_tune_027,16,4096,4096,bf16,NVIDIA GeForce RTX 4060,c11,32,128,32,4,2,8,0.0,0.0,161.79199516773224,179.24736022949216,3.3182785801202197,0,3,3,16x4096x4096,0,
2026-03-02T08:38:26.579951+00:00,C,adversarial,tune,adversarial_tune_028,16,8192,1024,bf16,NVIDIA GeForce RTX 4060,c11,32,128,32,4,2,8,0.0,0.0,49.904000014066696,145.0719968974589,5.379036869275703,0,3,3,16x8192x1024,0,
2026-03-02T08:38:26.738703+00:00,C,adversarial,tune,adversarial_tune_029,16,8192,4096,bf16,NVIDIA GeForce RTX 4060,c11,32,128,32,4,2,8,0.0,0.0,293.69600117206573,309.85216438770294,3.6559633761269157,0,3,3,16x8192x4096,0,
2026-03-02T08:38:26.747803+00:00,C,adversarial,tune,adversarial_tune_030,32,1024,1024,bf16,NVIDIA GeForce RTX 4060,c11,32,128,32,4,2,8,0.0,0.0,37.88800165057182,68.04864089936015,1.7712431660799182,0,3,3,32x1024x1024,0,
2026-03-02T08:38:26.768961+00:00,C,adversarial,tune,adversarial_tune_031,32,1024,4096,bf16,NVIDIA GeForce RTX 4060,c11,32,128,32,4,2,8,0.0,0.0,99.32800009846687,234.75327402353273,2.70251546123844,0,3,3,32x1024x4096,0,
2026-03-02T08:38:26.777924+00:00,C,adversarial,eval,adversarial_eval_000,1,1024,1024,bf16,NVIDIA GeForce RTX 4060,c11,32,128,32,4,2,8,0.0,0.0,38.91199827194214,98.26720215380189,0.05389473923553731,0,3,3,1x1024x1024,0,
2026-03-02T08:38:26.796432+00:00,C,adversarial,eval,adversarial_eval_001,1,1024,4096,bf16,NVIDIA GeForce RTX 4060,c11,32,128,32,4,2,8,0.0,0.0,68.64000111818314,161.36192232370365,0.12221165302076036,0,3,3,1x1024x4096,0,
2026-03-02T08:38:26.812509+00:00,C,adversarial,eval,adversarial_eval_002,1,4096,1024,bf16,NVIDIA GeForce RTX 4060,c11,32,128,32,4,2,8,0.0,0.0,38.39999996125698,54.421440139412866,0.21845333355373805,0,3,3,1x4096x1024,0,
2026-03-02T08:38:26.898925+00:00,C,adversarial,eval,adversarial_eval_003,1,4096,4096,bf16,NVIDIA GeForce RTX 4060,c11,32,128,32,4,2,8,0.0,0.0,168.2879999279976,333.82400095462776,0.1993869557803072,0,3,3,1x4096x4096,0,
2026-03-02T08:38:26.941838+00:00,C,adversarial,eval,adversarial_eval_004,1,8192,1024,bf16,NVIDIA GeForce RTX 4060,c11,32,128,32,4,2,8,0.0,0.0,73.53600114583969,174.64319571852684,0.22814969183225944,0,3,3,1x8192x1024,0,
2026-03-02T08:38:27.100779+00:00,C,adversarial,eval,adversarial_eval_005,1,8192,4096,bf16,NVIDIA GeForce RTX 4060,c11,32,128,32,4,2,8,0.0,0.0,298.4960079193115,367.052800953388,0.2248233216510576,0,3,3,1x8192x4096,0,
2026-03-02T08:38:27.109322+00:00,C,adversarial,eval,adversarial_eval_006,2,1024,1024,bf16,NVIDIA GeForce RTX 4060,c11,32,128,32,4,2,8,0.0,0.0,52.06399969756603,127.6006384938955,0.08056054134073917,0,3,3,2x1024x1024,0,
2026-03-02T08:38:27.130100+00:00,C,adversarial,eval,adversarial_eval_007,2,1024,4096,bf16,NVIDIA GeForce RTX 4060,c11,32,128,32,4,2,8,0.0,0.0,117.76000261306763,129.0444864332676,0.1424695620560241,0,3,3,2x1024x4096,0,
2026-03-02T08:38:27.147478+00:00,C,adversarial,eval,adversarial_eval_008,2,4096,1024,bf16,NVIDIA GeForce RTX 4060,c11,32,128,32,4,2,8,0.0,0.0,55.15199899673462,129.1059190034866,0.3041995993833937,0,3,3,2x4096x1024,0,
2026-03-02T08:38:27.235744+00:00,C,adversarial,eval,adversarial_eval_009,2,4096,4096,bf16,NVIDIA GeForce RTX 4060,c11,32,128,32,4,2,8,0.0,0.0,167.93599724769592,279.8899209499356,0.3996097626467677,0,3,3,2x4096x4096,0,
2026-03-02T08:38:27.281123+00:00,C,adversarial,eval,adversarial_eval_010,2,8192,1024,bf16,NVIDIA GeForce RTX 4060,c11,32,128,32,4,2,8,0.0,0.0,78.84799689054489,128.8601624220608,0.4255584583407939,0,3,3,2x8192x1024,0,
2026-03-02T08:38:27.443275+00:00,C,adversarial,eval,adversarial_eval_011,2,8192,4096,bf16,NVIDIA GeForce RTX 4060,c11,32,128,32,4,2,8,0.0,0.0,297.87200689315796,535.8387070894239,0.4505885913883201,0,3,3,2x8192x4096,0,
2026-03-02T08:38:27.452595+00:00,C,adversarial,eval,adversarial_eval_012,4,1024,1024,bf16,NVIDIA GeForce RTX 4060,c11,32,128,32,4,2,8,0.0,0.0,51.152000203728676,135.14016389846802,0.16399374348197082,0,3,3,4x1024x1024,0,
2026-03-02T08:38:27.474971+00:00,C,adversarial,eval,adversarial_eval_013,4,1024,4096,bf16,NVIDIA GeForce RTX 4060,c11,32,128,32,4,2,8,0.0,0.0,129.45599853992462,196.16768300533295,0.25919565241043435,0,3,3,4x1024x4096,0,
2026-03-02T08:38:27.492765+00:00,C,adversarial,eval,adversarial_eval_014,4,4096,1024,bf16,NVIDIA GeForce RTX 4060,c11,32,128,32,4,2,8,0.0,0.0,54.25599962472916,135.9865609556436,0.618446480243382,0,3,3,4x4096x1024,0,
2026-03-02T08:38:27.589096+00:00,C,adversarial,eval,adversarial_eval_015,4,4096,4096,bf16,NVIDIA GeForce RTX 4060,c11,32,128,32,4,2,8,0.0,0.0,257.7600032091141,415.4988852143286,0.5207081251124621,0,3,3,4x4096x4096,0,
2026-03-02T08:38:27.636327+00:00,C,adversarial,eval,adversarial_eval_016,4,8192,1024,bf16,NVIDIA GeForce RTX 4060,c11,32,128,32,4,2,8,0.0,0.0,79.3599970638752,224.44384455680841,0.845625837737689,0,3,3,4x8192x1024,0,
2026-03-02T08:38:27.826178+00:00,C,adversarial,eval,adversarial_eval_017,4,8192,4096,bf16,NVIDIA GeForce RTX 4060,c11,32,128,32,4,2,8,0.0,0.0,494.59201097488403,531.4764738082886,0.5427411887848538,0,3,3,4x8192x4096,0,
2026-03-02T08:38:27.836755+00:00,C,adversarial,eval,adversarial_eval_018,8,1024,1024,bf16,NVIDIA GeForce RTX 4060,c11,32,128,32,4,2,8,0.0,0.0,77.31200009584427,134.47775736451143,0.21700662224753156,0,3,3,8x1024x1024,0,
2026-03-02T08:38:27.859555+00:00,C,adversarial,eval,adversarial_eval_019,8,1024,4096,bf16,NVIDIA GeForce RTX 4060,c11,32,128,32,4,2,8,0.0,0.0,134.14399325847626,164.31103587150565,0.5002748343020536,0,3,3,8x1024x4096,0,
2026-03-02T08:38:27.877165+00:00,C,adversarial,eval,adversarial_eval_020,8,4096,1024,bf16,NVIDIA GeForce RTX 4060,c11,32,128,32,4,2,8,0.0,0.0,55.27999997138977,131.80159866809828,1.2139808978786593,0,3,3,8x4096x1024,0,
2026-03-02T08:38:27.965629+00:00,C,adversarial,eval,adversarial_eval_021,8,4096,4096,bf16,NVIDIA GeForce RTX 4060,c11,32,128,32,4,2,8,0.0,0.0,254.97600436210632,294.73791152238834,1.0527871305833905,0,3,3,8x4096x4096,0,
2026-03-02T08:38:28.013423+00:00,C,adversarial,eval,adversarial_eval_022,8,8192,1024,bf16,NVIDIA GeForce RTX 4060,c11,32,128,32,4,2,8,0.0,0.0,88.49599957466125,178.94400432705854,1.5166530537548737,0,3,3,8x8192x1024,0,
2026-03-02T08:38:28.182188+00:00,C,adversarial,eval,adversarial_eval_023,8,8192,4096,bf16,NVIDIA GeForce RTX 4060,c11,32,128,32,4,2,8,0.0,0.0,474.06400740146637,548.1984251737592,1.1324861276493088,0,3,3,8x8192x4096,0,
2026-03-02T08:38:28.191841+00:00,C,adversarial,eval,adversarial_eval_024,16,1024,1024,bf16,NVIDIA GeForce RTX 4060,c11,32,128,32,4,2,8,0.0,0.0,43.52000169456005,77.40416005253789,0.771011734684612,0,3,3,16x1024x1024,0,
2026-03-02T08:38:28.215150+00:00,C,adversarial,eval,adversarial_eval_025,16,1024,4096,bf16,NVIDIA GeForce RTX 4060,c11,32,128,32,4,2,8,0.0,0.0,136.19199395179749,148.50048556923866,0.9855038031641107,0,3,3,16x1024x4096,0,
2026-03-02T08:38:28.236697+00:00,C,adversarial,eval,adversarial_eval_026,16,4096,1024,bf16,NVIDIA GeForce RTX 4060,c11,32,128,32,4,2,8,0.0,0.0,71.68000191450119,289.617277085781,1.8724570928456843,0,3,3,16x4096x1024,0,
2026-03-02T08:38:28.336661+00:00,C,adversarial,eval,adversarial_eval_027,16,4096,4096,bf16,NVIDIA GeForce RTX 4060,c11,32,128,32,4,2,8,0.0,0.0,280.92800080776215,345.20671397447586,1.911062302284985,0,3,3,16x4096x4096,0,
2026-03-02T08:38:28.380167+00:00,C,adversarial,eval,adversarial_eval_028,16,8192,1024,bf16,NVIDIA GeForce RTX 4060,c11,32,128,32,4,2,8,0.0,0.0,108.5439994931221,177.27488026022908,2.4730566153222444,0,3,3,16x8192x1024,0,
2026-03-02T08:38:28.549238+00:00,C,adversarial,eval,adversarial_eval_029,16,8192,4096,bf16,NVIDIA GeForce RTX 4060,c11,32,128,32,4,2,8,0.0,0.0,476.03198885917664,499.85535025596613,2.255608549696946,0,3,3,16x8192x4096,0,
2026-03-02T08:38:28.559724+00:00,C,adversarial,eval,adversarial_eval_030,32,1024,1024,bf16,NVIDIA GeForce RTX 4060,c11,32,128,32,4,2,8,0.0,0.0,40.95999896526337,109.58847984671593,1.6384000413894664,0,3,3,32x1024x1024,0,
2026-03-02T08:38:28.587411+00:00,C,adversarial,eval,adversarial_eval_031,32,1024,4096,bf16,NVIDIA GeForce RTX 4060,c11,32,128,32,4,2,8,0.0,0.0,154.62400019168854,210.39327919483173,1.7360529779802525,0,3,3,32x1024x4096,0,
2026-03-02T08:38:28.605676+00:00,C,adversarial,eval,adversarial_eval_032,32,4096,1024,bf16,NVIDIA GeForce RTX 4060,c11,32,128,32,4,2,8,0.0,0.0,66.56000018119812,119.82848331332207,4.03298460440551,0,3,3,32x4096x1024,0,
2026-03-02T08:38:28.698151+00:00,C,adversarial,eval,adversarial_eval_033,32,4096,4096,bf16,NVIDIA GeForce RTX 4060,c11,32,128,32,4,2,8,0.0,0.0,260.5760097503662,355.6604847311973,4.120647273049629,0,3,3,32x4096x4096,0,
2026-03-02T08:38:28.741888+00:00,C,adversarial,eval,adversarial_eval_034,32,8192,1024,bf16,NVIDIA GeForce RTX 4060,c11,32,128,32,4,2,8,0.0,0.0,91.52000024914742,172.60831788182256,5.866159424589833,0,3,3,32x8192x1024,0,
2026-03-02T08:38:28.913346+00:00,C,adversarial,eval,adversarial_eval_035,32,8192,4096,bf16,NVIDIA GeForce RTX 4060,c11,32,128,32,4,2,8,0.0,0.0,480.76799511909485,572.9343992471694,4.4667774681383055,0,3,3,32x8192x4096,0,
2026-03-02T08:38:29.177659+00:00,C,adversarial,eval,adversarial_eval_036,1024,1,512,bf16,NVIDIA GeForce RTX 4060,c05,128,64,32,4,3,8,0.0,0.0,70.65600156784058,84.5311988145113,0.014840579380835843,3,0,2,1024x1x512,0,
2026-03-02T08:38:29.204012+00:00,C,adversarial,eval,adversarial_eval_037,1024,1,2048,bf16,NVIDIA GeForce RTX 4060,c05,128,64,32,4,3,8,0.0,0.0,189.37599658966064,410.14910817146244,0.02214802337958493,3,0,3,1024x1x2048,0,
2026-03-02T08:38:29.217852+00:00,C,adversarial,eval,adversarial_eval_038,2048,1,512,bf16,NVIDIA GeForce RTX 4060,c05,128,64,32,4,3,8,0.0,0.0,74.75200295448303,127.539202272892,0.028054793411715927,3,0,2,2048x1x512,0,
2026-03-02T08:38:29.244920+00:00,C,adversarial,eval,adversarial_eval_039,2048,1,2048,bf16,NVIDIA GeForce RTX 4060,c05,128,64,32,4,3,8,0.0,0.0,186.8159994482994,204.33919832110405,0.044903049121986546,3,0,3,2048x1x2048,0,
2026-03-02T08:38:29.258257+00:00,C,adversarial,eval,adversarial_eval_040,4096,1,512,bf16,NVIDIA GeForce RTX 4060,c05,128,64,32,4,3,8,0.0,0.0,76.80000364780426,105.9577579051256,0.05461333073933931,3,0,2,4096x1x512,0,
2026-03-02T08:38:29.309017+00:00,C,adversarial,eval,adversarial_eval_041,4096,1,2048,bf16,NVIDIA GeForce RTX 4060,c05,128,64,32,4,3,8,0.0,0.0,240.59200286865234,319.02751564979553,0.06973305762436034,3,0,3,4096x1x2048,0,
2026-03-02T08:38:29.532692+00:00,C,adversarial,eval,adversarial_eval_042,1024,2,512,bf16,NVIDIA GeForce RTX 4060,c05,128,64,32,4,3,8,0.0,0.0,79.72799986600876,272.02559828758194,0.0263038330765162,3,0,2,1024x2x512,0,
2026-03-02T08:38:29.563274+00:00,C,adversarial,eval,adversarial_eval_043,1024,2,2048,bf16,NVIDIA GeForce RTX 4060,c05,128,64,32,4,3,8,0.0,0.0,198.14399629831314,311.78751319646807,0.042335918103572706,3,0,3,1024x2x2048,0,
2026-03-02T08:38:29.579504+00:00,C,adversarial,eval,adversarial_eval_044,2048,2,512,bf16,NVIDIA GeForce RTX 4060,c05,128,64,32,4,3,8,0.0,0.0,84.76799726486206,232.23296031355852,0.04947980529603262,3,0,2,2048x2x512,0,
2026-03-02T08:38:29.609059+00:00,C,adversarial,eval,adversarial_eval_045,2048,2,2048,bf16,NVIDIA GeForce RTX 4060,c05,128,64,32,4,3,8,0.0,0.0,218.86400133371353,288.9318335056305,0.07665589543169728,3,0,3,2048x2x2048,0,
2026-03-02T08:38:29.623435+00:00,C,adversarial,eval,adversarial_eval_046,4096,2,512,bf16,NVIDIA GeForce RTX 4060,c05,128,64,32,4,3,8,0.0,0.0,88.81599828600883,133.35360340774054,0.0944492902392052,3,0,2,4096x2x512,0,
2026-03-02T08:38:29.700085+00:00,C,adversarial,eval,adversarial_eval_047,4096,2,2048,bf16,NVIDIA GeForce RTX 4060,c05,128,64,32,4,3,8,0.0,0.0,256.00001215934753,412.57984161376925,0.13107199377441436,3,0,3,4096x2x2048,0,
2026-03-02T08:38:29.714441+00:00,C,adversarial,eval,adversarial_eval_048,1024,4,512,bf16,NVIDIA GeForce RTX 4060,c05,128,64,32,4,3,8,0.0,0.0,97.18400239944458,101.89823724329472,0.04315837891467589,3,0,2,1024x4x512,0,
2026-03-02T08:38:29.740455+00:00,C,adversarial,eval,adversarial_eval_049,1024,4,2048,bf16,NVIDIA GeForce RTX 4060,c05,128,64,32,4,3,8,0.0,0.0,281.39200806617737,354.8262298107147,0.05962221924957569,3,0,3,1024x4x2048,0,
2026-03-02T08:38:29.752671+00:00,C,adversarial,eval,adversarial_eval_050,2048,4,512,bf16,NVIDIA GeForce RTX 4060,c05,128,64,32,4,3,8,0.0,0.0,99.32799637317657,146.56736075878138,0.08445361133112854,3,0,2,2048x4x512,0,
2026-03-02T08:38:29.784937+00:00,C,adversarial,eval,adversarial_eval_051,2048,4,2048,bf16,NVIDIA GeForce RTX 4060,c05,128,64,32,4,3,8,0.0,0.0,279.55201268196106,319.6006402373313,0.12002929858413858,3,0,3,2048x4x2048,0,
2026-03-02T08:38:29.798866+00:00,C,adversarial,eval,adversarial_eval_052,4096,4,512,bf16,NVIDIA GeForce RTX 4060,c05,128,64,32,4,3,8,0.0,0.0,99.32799637317657,148.90880510210982,0.16890722266225708,3,0,2,4096x4x512,0,
2026-03-02T08:38:29.854901+00:00,C,adversarial,eval,adversarial_eval_053,4096,4,2048,bf16,NVIDIA GeForce RTX 4060,c05,128,64,32,4,3,8,0.0,0.0,299.3760108947754,455.9974408149716,0.2241624631159489,3,0,3,4096x4x2048,0,
2026-03-02T08:38:29.865584+00:00,C,adversarial,eval,adversarial_eval_054,1024,8,512,bf16,NVIDIA GeForce RTX 4060,c05,128,64,32,4,3,8,0.0,0.0,96.25600278377533,170.3798444569111,0.0871489336498187,3,0,2,1024x8x512,0,
2026-03-02T08:38:29.891430+00:00,C,adversarial,eval,adversarial_eval_055,1024,8,2048,bf16,NVIDIA GeForce RTX 4060,c05,128,64,32,4,3,8,0.0,0.0,285.69599986076355,342.8351965546606,0.11744802873107445,3,0,3,1024x8x2048,0,
2026-03-02T08:38:29.903572+00:00,C,adversarial,eval,adversarial_eval_056,2048,8,512,bf16,NVIDIA GeForce RTX 4060,c05,128,64,32,4,3,8,0.0,0.0,101.3759970664978,188.49792420864105,0.16549495428385233,3,0,2,2048x8x512,0,
2026-03-02T08:38:29.935219+00:00,C,adversarial,eval,adversarial_eval_057,2048,8,2048,bf16,NVIDIA GeForce RTX 4060,c05,128,64,32,4,3,8,0.0,0.0,285.69599986076355,381.52959793806076,0.2348960574621489,3,0,3,2048x8x2048,0,
2026-03-02T08:38:29.951976+00:00,C,adversarial,eval,adversarial_eval_058,4096,8,512,bf16,NVIDIA GeForce RTX 4060,c05,128,64,32,4,3,8,0.0,0.0,100.27200356125832,517.6831980049598,0.3346341033217799,3,0,2,4096x8x512,0,
2026-03-02T08:38:30.007572+00:00,C,adversarial,eval,adversarial_eval_059,4096,8,2048,bf16,NVIDIA GeForce RTX 4060,c05,128,64,32,4,3,8,0.0,0.0,299.00801181793213,412.7382493019104,0.4488766945874548,3,0,3,4096x8x2048,0,
2026-03-02T08:38:30.040503+00:00,C,adversarial,eval,adversarial_eval_060,64,64,8192,bf16,NVIDIA GeForce RTX 4060,c09,128,64,64,8,3,8,0.0,0.0,431.4880073070526,542.8223901987076,0.15552892053438797,1,1,3,64x64x8192,0,
2026-03-02T08:38:30.090722+00:00,C,adversarial,eval,adversarial_eval_061,128,128,8192,bf16,NVIDIA GeForce RTX 4060,c08,128,128,64,8,4,8,0.0,0.0,649.2159962654114,774.8915475606918,0.41347634307251213,1,1,3,128x128x8192,0,
2026-03-02T08:38:30.218488+00:00,C,adversarial,eval,adversarial_eval_062,2048,128,8192,bf16,NVIDIA GeForce RTX 4060,c08,128,128,64,8,4,8,0.0,0.0,655.3599834442139,684.5276653766632,6.5536001655578655,3,1,3,2048x128x8192,0,
2026-03-02T08:38:30.339365+00:00,C,adversarial,eval,adversarial_eval_063,128,2048,8192,bf16,NVIDIA GeForce RTX 4060,c08,128,128,64,8,4,8,0.0,0.0,613.215982913971,793.9481747150419,7.004004161128572,1,3,3,128x2048x8192,0,
2026-03-02T08:38:38.113463+00:00,D,uniform,tune,uniform_tune_000,1536,512,1024,bf16,NVIDIA GeForce RTX 4060,c04,64,64,64,4,3,8,0.0,0.0,90.89599922299385,609.3702492117865,17.719291825470854,3,2,3,3_2_3,0,
2026-03-02T08:38:38.166038+00:00,D,uniform,tune,uniform_tune_001,1536,1536,2048,bf16,NVIDIA GeForce RTX 4060,c10,64,128,64,8,3,8,0.0,0.0,322.04800844192505,460.92288702726364,30.00694356954128,3,3,3,3_3_3,0,
2026-03-02T08:38:38.186163+00:00,D,uniform,tune,uniform_tune_002,384,2048,1536,bf16,NVIDIA GeForce RTX 4060,c06,64,128,32,4,3,8,0.0,0.0,100.35199671983719,209.74816277623165,24.074449766503058,2,3,3,2_3_3,0,
2026-03-02T08:38:38.205398+00:00,D,uniform,tune,uniform_tune_003,1536,64,3072,bf16,NVIDIA GeForce RTX 4060,c04,64,64,64,4,3,8,0.0,0.0,50.175998359918594,167.6409575343131,12.037224883251529,3,1,3,3_1_3,0,
2026-03-02T08:38:38.216221+00:00,D,uniform,tune,uniform_tune_004,768,128,2048,bf16,NVIDIA GeForce RTX 4060,c04,64,64,64,4,3,8,0.0,0.0,50.6879985332489,176.02624624967575,7.943757805624911,3,1,3,3_1_3,0,
2026-03-02T08:38:38.229694+00:00,D,uniform,tune,uniform_tune_005,512,128,4096,bf16,NVIDIA GeForce RTX 4060,c04,64,64,64,4,3,8,0.0,0.0,59.26400050520897,142.10047945380205,9.058971845021027,2,1,3,2_1_3,0,
2026-03-02T08:38:38.320461+00:00,D,uniform,tune,uniform_tune_006,2048,1024,4096,bf16,NVIDIA GeForce RTX 4060,c10,64,128,64,8,3,8,0.0,0.0,558.0800175666809,672.0432060956955,30.783881599823278,3,3,3,3_3_3,0,
2026-03-02T08:38:38.330279+00:00,D,uniform,tune,uniform_tune_007,128,768,512,bf16,NVIDIA GeForce RTX 4060,c04,64,64,64,4,3,8,0.0,0.0,67.29599833488464,105.55264167487618,1.4958288529887005,1,3,2,1_3_2,0,
2026-03-02T08:38:38.334777+00:00,D,uniform,tune,uniform_tune_008,2048,256,64,bf16,NVIDIA GeForce RTX 4060,c04,64,64,64,4,3,8,0.0,0.0,32.32000023126602,64.52384188771244,2.076388103954269,3,2,1,3_2_1,0,
2026-03-02T08:38:38.346727+00:00,D,uniform,tune,uniform_tune_009,192,768,2048,bf16,NVIDIA GeForce RTX 4060,c06,64,128,32,4,3,8,0.0,0.0,66.56000018119812,202.23167449235908,9.0742153599124,2,3,3,2_3_3,0,
2026-03-02T08:38:38.368695+00:00,D,uniform,tune,uniform_tune_010,1024,1024,1536,bf16,NVIDIA GeForce RTX 4060,c10,64,128,64,8,3,8,0.0,0.0,174.0799993276596,251.0748794674873,18.504282424409332,3,3,3,3_3_3,0,
2026-03-02T08:38:38.375653+00:00,D,uniform,tune,uniform_tune_011,256,384,768,bf16,NVIDIA GeForce RTX 4060,c04,64,64,64,4,3,8,0.0,0.0,43.007999658584595,103.17632302641869,3.5108571707277885,2,2,3,2_2_3,0,
2026-03-02T08:38:38.383998+00:00,D,uniform,tune,uniform_tune_012,64,192,2048,bf16,NVIDIA GeForce RTX 4060,c04,64,64,64,4,3,8,0.0,0.0,64.51199948787689,91.03839971125123,0.7801904823839528,1,2,3,1_2_3,0,
2026-03-02T08:38:38.390081+00:00,D,uniform,tune,uniform_tune_013,192,128,512,bf16,NVIDIA GeForce RTX 4060,c04,64,64,64,4,3,8,0.0,0.0,49.15200173854828,67.49855943024157,0.5119999818901227,2,1,2,2_1_2,0,
2026-03-02T08:38:38.396447+00:00,D,uniform,tune,uniform_tune_014,128,128,1024,bf16,NVIDIA GeForce RTX 4060,c04,64,64,64,4,3,8,0.0,0.0,50.20799860358238,108.85024107992646,0.6683084953242064,1,1,3,1_1_3,0,
2026-03-02T08:38:38.442352+00:00,D,uniform,tune,uniform_tune_015,3072,3072,768,bf16,NVIDIA GeForce RTX 4060,c10,64,128,64,8,3,8,0.0,0.0,482.30400681495667,518.3116775751114,30.054725689976337,3,3,3,3_3_3,0,
2026-03-02T08:38:38.454518+00:00,D,uniform,tune,uniform_tune_016,256,128,3072,bf16,NVIDIA GeForce RTX 4060,c04,64,64,64,4,3,8,0.0,0.0,78.59200239181519,145.98400011658663,2.5616676744829543,2,1,3,2_1_3,0,
2026-03-02T08:38:38.461888+00:00,D,uniform,tune,uniform_tune_017,96,1024,192,bf16,NVIDIA GeForce RTX 4060,c04,64,64,64,4,3,8,0.0,0.0,61.83999963104725,72.17088185250759,0.610425876863168,1,3,2,1_3_2,0,
2026-03-02T08:38:38.468399+00:00,D,uniform,tune,uniform_tune_018,64,64,192,bf16,NVIDIA GeForce RTX 4060,c04,64,64,64,4,3,8,0.0,0.0,56.144000962376595,164.00960028171528,0.028014818556554473,1,1,2,1_1_2,0,
2026-03-02T08:38:38.474349+00:00,D,uniform,tune,uniform_tune_019,4096,64,64,bf16,NVIDIA GeForce RTX 4060,c02,32,64,32,2,2,8,0.0,0.0,34.81600061058998,102.64448069036001,0.9637646889802084,3,1,1,3_1_1,0,
2026-03-02T08:38:38.545388+00:00,D,uniform,tune,uniform_tune_020,128,4096,3072,bf16,NVIDIA GeForce RTX 4060,c04,64,64,64,4,3,8,0.0,0.0,140.28799533843994,204.339197874069,22.96151901115206,1,3,3,1_3_3,0,
2026-03-02T08:38:38.575755+00:00,D,uniform,tune,uniform_tune_021,192,2048,3072,bf16,NVIDIA GeForce RTX 4060,c06,64,128,32,4,3,8,0.0,0.0,105.47199845314026,168.51008132100105,22.905786743704862,2,3,3,2_3_3,0,
2026-03-02T08:38:38.627755+00:00,D,uniform,tune,uniform_tune_022,1536,2048,2048,bf16,NVIDIA GeForce RTX 4060,c10,64,128,64,8,3,8,0.0,0.0,416.20801389217377,428.467198908329,30.95784189138191,3,3,3,3_3_3,0,
2026-03-02T08:38:38.640333+00:00,D,uniform,tune,uniform_tune_023,256,1024,1024,bf16,NVIDIA GeForce RTX 4060,c06,64,128,32,4,3,8,0.0,0.0,56.32000043988228,77.96288095414639,9.53250901645629,2,3,3,2_3_3,0,
2026-03-02T08:38:38.645851+00:00,D,uniform,tune,uniform_tune_024,768,128,384,bf16,NVIDIA GeForce RTX 4060,c11,32,128,32,4,2,8,0.0,0.0,36.86400130391121,70.98367970436806,2.047999927560491,3,1,2,3_1_2,0,
2026-03-02T08:38:38.653027+00:00,D,uniform,tune,uniform_tune_025,256,96,384,bf16,NVIDIA GeForce RTX 4060,c04,64,64,64,4,3,8,0.0,0.0,66.56000018119812,135.71232110261917,0.2835692299972625,2,1,2,2_1_2,0,
2026-03-02T08:38:38.671483+00:00,D,uniform,tune,uniform_tune_026,96,1024,3072,bf16,NVIDIA GeForce RTX 4060,c04,64,64,64,4,3,8,0.0,0.0,81.216000020504,186.33056342601768,7.436709217980665,1,3,3,1_3_3,0,
2026-03-02T08:38:38.716357+00:00,D,uniform,tune,uniform_tune_027,1536,512,4096,bf16,NVIDIA GeForce RTX 4060,c04,64,64,64,4,3,8,0.0,0.0,222.6559966802597,240.71423858404154,28.934549439741975,3,2,3,3_2_3,0,
2026-03-02T08:38:38.719985+00:00,D,uniform,tune,uniform_tune_028,128,64,192,bf16,NVIDIA GeForce RTX 4060,c04,64,64,64,4,3,8,0.0,0.0,30.352000147104263,35.69887988269329,0.10364153877022561,1,1,2,1_1_2,0,
2026-03-02T08:38:38.726290+00:00,D,uniform,tune,uniform_tune_029,192,256,1536,bf16,NVIDIA GeForce RTX 4060,c04,64,64,64,4,3,8,0.0,0.0,40.463998913764954,47.129280939698205,3.7315872887846204,2,2,3,2_2_3,0,
2026-03-02T08:38:38.795500+00:00,D,uniform,tune,uniform_tune_030,4096,64,3072,bf16,NVIDIA GeForce RTX 4060,c04,64,64,64,4,3,8,0.0,0.0,117.66400188207626,281.71263456344593,13.688236930902352,3,1,3,3_1_3,0,
2026-03-02T08:38:38.803153+00:00,D,uniform,tune,uniform_tune_031,384,128,96,bf16,NVIDIA GeForce RTX 4060,c01,64,32,32,2,2,8,0.0,0.0,46.592000871896744,159.8115186393261,0.202549446759053,2,1,1,2_1_1,0,
2026-03-02T08:38:38.826368+00:00,D,uniform,eval,uniform_eval_000,512,4096,768,bf16,NVIDIA GeForce RTX 4060,c06,64,128,32,4,3,8,0.0,0.0,141.32799953222275,226.38591468334198,22.792549832034954,2,3,3,2_3_3,0,
2026-03-02T08:38:38.830925+00:00,D,uniform,eval,uniform_eval_001,384,512,64,bf16,NVIDIA GeForce RTX 4060,c11,32,128,32,4,2,8,0.0,0.0,40.95999896526337,111.26336097717274,0.61440001552105,2,2,1,2_2_1,0,
2026-03-02T08:38:38.843146+00:00,D,uniform,eval,uniform_eval_002,256,4096,384,bf16,NVIDIA GeForce RTX 4060,c04,64,64,64,4,3,8,0.0,0.0,61.43999844789505,129.11423876881597,13.107200331115733,2,3,2,2_3_2,0,
2026-03-02T08:38:38.849918+00:00,D,uniform,eval,uniform_eval_003,384,768,512,bf16,NVIDIA GeForce RTX 4060,c04,64,64,64,4,3,8,0.0,0.0,46.89600132405758,118.54847528040403,6.439565836609606,2,3,2,2_3_2,0,
2026-03-02T08:38:38.855864+00:00,D,uniform,eval,uniform_eval_004,768,1024,96,bf16,NVIDIA GeForce RTX 4060,c00,32,32,32,2,2,8,0.0,0.0,49.15200173854828,114.42176498472676,3.0719998913407363,3,3,1,3_3_1,0,
2026-03-02T08:38:38.870004+00:00,D,uniform,eval,uniform_eval_005,3072,3072,128,bf16,NVIDIA GeForce RTX 4060,c00,32,32,32,2,2,8,0.0,0.0,152.8960019350052,222.21728309988973,15.80106133204835,3,3,1,3_3_1,0,
2026-03-02T08:38:38.875544+00:00,D,uniform,eval,uniform_eval_006,256,96,512,bf16,NVIDIA GeForce RTX 4060,c04,64,64,64,4,3,8,0.0,0.0,42.70400106906891,88.99039901793002,0.5893083404362303,2,1,2,2_1_2,0,
2026-03-02T08:38:39.284933+00:00,D,uniform,eval,uniform_eval_007,4096,4096,4096,bf16,NVIDIA GeForce RTX 4060,c10,64,128,64,8,3,8,0.0,0.0,4369.760036468506,4441.231322288513,31.452288529571888,3,3,3,3_3_3,0,
2026-03-02T08:38:39.289491+00:00,D,uniform,eval,uniform_eval_008,128,96,64,bf16,NVIDIA GeForce RTX 4060,c00,32,32,32,2,2,8,0.0,0.0,52.960000932216644,65.9030383825302,0.02969909313281743,1,1,1,1_1_1,0,
2026-03-02T08:38:39.303772+00:00,D,uniform,eval,uniform_eval_009,3072,384,96,bf16,NVIDIA GeForce RTX 4060,c04,64,64,64,4,3,8,0.0,0.0,53.37600037455559,100.70016048848622,4.243338099719612,3,2,1,3_2_1,0,
2026-03-02T08:38:39.323685+00:00,D,uniform,eval,uniform_eval_010,768,768,2048,bf16,NVIDIA GeForce RTX 4060,c10,64,128,64,8,3,8,0.0,0.0,114.73600193858147,127.85888135433197,21.05632986316927,3,3,3,3_3_3,0,
2026-03-02T08:38:39.336411+00:00,D,uniform,eval,uniform_eval_011,4096,96,512,bf16,NVIDIA GeForce RTX 4060,c11,32,128,32,4,2,8,0.0,0.0,58.079998940229416,165.14047980308516,6.932734010797307,3,1,2,3_1_2,0,
2026-03-02T08:38:39.342004+00:00,D,uniform,eval,uniform_eval_012,384,384,256,bf16,NVIDIA GeForce RTX 4060,c02,32,64,32,2,2,8,0.0,0.0,37.88800165057182,58.412480503320666,1.992648561839908,2,2,2,2_2_2,0,
2026-03-02T08:38:39.384107+00:00,D,uniform,eval,uniform_eval_013,4096,2048,768,bf16,NVIDIA GeForce RTX 4060,c10,64,128,64,8,3,8,0.0,0.0,425.9839951992035,575.5023896694183,30.247384956269578,3,3,3,3_3_3,0,
2026-03-02T08:38:39.395447+00:00,D,uniform,eval,uniform_eval_014,192,384,3072,bf16,NVIDIA GeForce RTX 4060,c04,64,64,64,4,3,8,0.0,0.0,51.19999870657921,122.94496379792687,8.847360223503117,2,2,3,2_2_3,0,
2026-03-02T08:38:39.403823+00:00,D,uniform,eval,uniform_eval_015,128,96,4096,bf16,NVIDIA GeForce RTX 4060,c04,64,64,64,4,3,8,0.0,0.0,62.463998794555664,100.37695966660974,1.6115410147064386,1,1,3,1_1_3,0,
2026-03-02T08:38:39.446178+00:00,D,uniform,eval,uniform_eval_016,64,4096,2048,bf16,NVIDIA GeForce RTX 4060,c04,64,64,64,4,3,8,0.0,0.0,67.58400052785873,140.38688614964482,15.88751502742715,1,3,3,1_3_3,0,
2026-03-02T08:38:39.453128+00:00,D,uniform,eval,uniform_eval_017,96,128,3072,bf16,NVIDIA GeForce RTX 4060,c04,64,64,64,4,3,8,0.0,0.0,48.94399829208851,53.26847940683365,1.5425276772331797,1,1,3,1_1_3,0,
2026-03-02T08:38:39.457486+00:00,D,uniform,eval,uniform_eval_018,512,768,64,bf16,NVIDIA GeForce RTX 4060,c11,32,128,32,4,2,8,0.0,0.0,27.648000046610832,60.82336015999314,1.8204444413754184,2,3,1,2_3_1,0,
2026-03-02T08:38:39.461390+00:00,D,uniform,eval,uniform_eval_019,64,128,384,bf16,NVIDIA GeForce RTX 4060,c04,64,64,64,4,3,8,0.0,0.0,32.60800056159496,49.67424001544714,0.19294209677516835,1,1,2,1_1_2,0,
2026-03-02T08:38:39.465532+00:00,D,uniform,eval,uniform_eval_020,512,512,96,bf16,NVIDIA GeForce RTX 4060,c11,32,128,32,4,2,8,0.0,0.0,34.81600061058998,70.37119973450896,1.4456470334703126,2,2,1,2_2_1,0,
2026-03-02T08:38:39.490466+00:00,D,uniform,eval,uniform_eval_021,256,3072,1536,bf16,NVIDIA GeForce RTX 4060,c06,64,128,32,4,3,8,0.0,0.0,97.20000252127647,155.5625632405281,24.85513417009604,2,3,3,2_3_3,0,
2026-03-02T08:38:39.499365+00:00,D,uniform,eval,uniform_eval_022,2048,96,512,bf16,NVIDIA GeForce RTX 4060,c11,32,128,32,4,2,8,0.0,0.0,53.567999973893166,111.67744055390357,3.7583369193943827,3,1,2,3_1_2,0,
2026-03-02T08:38:39.531127+00:00,D,uniform,eval,uniform_eval_023,1536,512,3072,bf16,NVIDIA GeForce RTX 4060,c04,64,64,64,4,3,8,0.0,0.0,173.0560064315796,183.31648245453835,27.920661684229625,3,2,3,3_2_3,0,
2026-03-02T08:38:39.534699+00:00,D,uniform,eval,uniform_eval_024,128,192,64,bf16,NVIDIA GeForce RTX 4060,c04,64,64,64,4,3,8,0.0,0.0,30.62400035560131,38.83872114121913,0.10272100194201532,1,2,1,1_2_1,0,
2026-03-02T08:38:39.540880+00:00,D,uniform,eval,uniform_eval_025,1536,96,384,bf16,NVIDIA GeForce RTX 4060,c11,32,128,32,4,2,8,0.0,0.0,36.78400069475174,66.82623829692596,3.078681107576146,3,1,2,3_1_2,0,
2026-03-02T08:38:39.546730+00:00,D,uniform,eval,uniform_eval_026,1536,2048,64,bf16,NVIDIA GeForce RTX 4060,c00,32,32,32,2,2,8,0.0,0.0,50.175998359918594,117.25824244320393,8.024816588834353,3,3,1,3_3_1,0,
2026-03-02T08:38:39.551489+00:00,D,uniform,eval,uniform_eval_027,256,1024,96,bf16,NVIDIA GeForce RTX 4060,c11,32,128,32,4,2,8,0.0,0.0,36.25600039958954,56.26528095453975,1.3882294639584627,2,3,1,2_3_1,0,
2026-03-02T08:38:39.556185+00:00,D,uniform,eval,uniform_eval_028,2048,256,64,bf16,NVIDIA GeForce RTX 4060,c04,64,64,64,4,3,8,0.0,0.0,37.53599897027016,45.38240093737841,1.7878534164803395,3,2,1,3_2_1,0,
2026-03-02T08:38:39.560811+00:00,D,uniform,eval,uniform_eval_029,192,768,192,bf16,NVIDIA GeForce RTX 4060,c04,64,64,64,4,3,8,0.0,0.0,36.86400130391121,48.65024156868458,1.5359999456703681,2,3,2,2_3_2,0,
2026-03-02T08:38:39.616730+00:00,D,uniform,eval,uniform_eval_030,1024,2048,3072,bf16,NVIDIA GeForce RTX 4060,c10,64,128,64,8,3,8,0.0,0.0,433.1519901752472,543.1321600079534,29.746837554150336,3,3,3,3_3_3,0,
2026-03-02T08:38:39.630963+00:00,D,uniform,eval,uniform_eval_031,1536,1024,512,bf16,NVIDIA GeForce RTX 4060,c03,64,64,32,4,2,8,0.0,0.0,79.80799674987793,125.50944164395322,20.181094647040663,3,3,2,3_3_2,0,
2026-03-02T08:38:39.639781+00:00,D,uniform,eval,uniform_eval_032,512,768,768,bf16,NVIDIA GeForce RTX 4060,c06,64,128,32,4,3,8,0.0,0.0,54.83200028538704,158.0646412074565,11.01509652860436,2,3,3,2_3_3,0,
2026-03-02T08:38:39.657187+00:00,D,uniform,eval,uniform_eval_033,64,512,4096,bf16,NVIDIA GeForce RTX 4060,c04,64,64,64,4,3,8,0.0,0.0,90.06400033831596,146.00032433867455,2.9804967022522915,1,2,3,1_2_3,0,
2026-03-02T08:38:39.665494+00:00,D,uniform,eval,uniform_eval_034,1024,256,512,bf16,NVIDIA GeForce RTX 4060,c04,64,64,64,4,3,8,0.0,0.0,61.02399900555611,145.25023706257326,4.39885062228648,3,2,2,3_2_2,0,
2026-03-02T08:38:39.670929+00:00,D,uniform,eval,uniform_eval_035,1024,768,96,bf16,NVIDIA GeForce RTX 4060,c00,32,32,32,2,2,8,0.0,0.0,46.112000942230225,73.35775967687363,3.2745259566846525,3,3,1,3_3_1,0,
2026-03-02T08:38:39.679805+00:00,D,uniform,eval,uniform_eval_036,768,64,1536,bf16,NVIDIA GeForce RTX 4060,c04,64,64,64,4,3,8,0.0,0.0,43.007999658584595,52.00287859886883,3.5108571707277885,3,1,3,3_1_3,0,
2026-03-02T08:38:39.686367+00:00,D,uniform,eval,uniform_eval_037,512,256,512,bf16,NVIDIA GeForce RTX 4060,c02,32,64,32,2,2,8,0.0,0.0,45.85599899291992,127.04800069332119,2.926939352487402,2,2,2,2_2_2,0,
2026-03-02T08:38:39.691383+00:00,D,uniform,eval,uniform_eval_038,64,1024,64,bf16,NVIDIA GeForce RTX 4060,c11,32,128,32,4,2,8,0.0,0.0,37.88800165057182,107.02271826565263,0.22140539575998977,1,3,1,1_3_1,0,
2026-03-02T08:38:39.700388+00:00,D,uniform,eval,uniform_eval_039,512,128,2048,bf16,NVIDIA GeForce RTX 4060,c04,64,64,64,4,3,8,0.0,0.0,45.791998505592346,59.792000427842126,5.862060289140194,2,1,3,2_1_3,0,
2026-03-02T08:38:39.707282+00:00,D,uniform,eval,uniform_eval_040,4096,768,96,bf16,NVIDIA GeForce RTX 4060,c00,32,32,32,2,2,8,0.0,0.0,62.192000448703766,72.96224012970924,9.711534789722116,3,3,1,3_3_1,0,
2026-03-02T08:38:39.711999+00:00,D,uniform,eval,uniform_eval_041,4096,192,64,bf16,NVIDIA GeForce RTX 4060,c04,64,64,64,4,3,8,0.0,0.0,34.81600061058998,46.991041563451276,2.8912940669406253,3,2,1,3_2_1,0,
2026-03-02T08:38:39.717023+00:00,D,uniform,eval,uniform_eval_042,96,1536,128,bf16,NVIDIA GeForce RTX 4060,c11,32,128,32,4,2,8,0.0,0.0,32.416000962257385,152.637442871928,1.1645093435168523,1,3,1,1_3_1,0,
2026-03-02T08:38:39.724323+00:00,D,uniform,eval,uniform_eval_043,192,2048,192,bf16,NVIDIA GeForce RTX 4060,c04,64,64,64,4,3,8,0.0,0.0,47.775998711586,94.12287697195995,3.160476977394566,2,3,2,2_3_2,0,
2026-03-02T08:38:39.802951+00:00,D,uniform,eval,uniform_eval_044,384,4096,3072,bf16,NVIDIA GeForce RTX 4060,c06,64,128,32,4,3,8,0.0,0.0,316.49599969387054,379.99808967113495,30.53332877934366,2,3,3,2_3_3,0,
2026-03-02T08:38:39.818849+00:00,D,uniform,eval,uniform_eval_045,4096,96,768,bf16,NVIDIA GeForce RTX 4060,c04,64,64,64,4,3,8,0.0,0.0,56.17599934339523,71.25184200704096,10.751562643469226,3,1,3,3_1_3,0,
2026-03-02T08:38:39.823969+00:00,D,uniform,eval,uniform_eval_046,96,96,1536,bf16,NVIDIA GeForce RTX 4060,c04,64,64,64,4,3,8,0.0,0.0,36.3520011305809,53.27263928949832,0.7788168771865238,1,1,3,1_1_3,0,
2026-03-02T08:38:39.877532+00:00,D,uniform,eval,uniform_eval_047,2048,512,4096,bf16,NVIDIA GeForce RTX 4060,c04,64,64,64,4,3,8,0.0,0.0,298.6239939928055,385.9763202071189,28.765051585931676,3,2,3,3_2_3,0,
2026-03-02T08:38:39.885630+00:00,D,uniform,eval,uniform_eval_048,96,256,768,bf16,NVIDIA GeForce RTX 4060,c04,64,64,64,4,3,8,0.0,0.0,66.03199988603592,147.43295684456825,0.5716733714736829,1,2,3,1_2_3,0,
2026-03-02T08:38:39.893272+00:00,D,uniform,eval,uniform_eval_049,64,768,384,bf16,NVIDIA GeForce RTX 4060,c04,64,64,64,4,3,8,0.0,0.0,60.127999633550644,99.42751705646505,0.627806283762294,1,3,2,1_3_2,0,
2026-03-02T08:38:39.899175+00:00,D,uniform,eval,uniform_eval_050,128,1024,96,bf16,NVIDIA GeForce RTX 4060,c11,32,128,32,4,2,8,0.0,0.0,37.04000078141689,152.26559586822972,0.6794228798349752,1,3,1,1_3_1,0,
2026-03-02T08:38:39.908515+00:00,D,uniform,eval,uniform_eval_051,384,768,768,bf16,NVIDIA GeForce RTX 4060,c06,64,128,32,4,3,8,0.0,0.0,55.7279996573925,133.47167976200572,8.1284961740038,2,3,3,2_3_3,0,
2026-03-02T08:38:39.926087+00:00,D,uniform,eval,uniform_eval_052,768,64,4096,bf16,NVIDIA GeForce RTX 4060,c04,64,64,64,4,3,8,0.0,0.0,61.263998970389366,104.6374388784169,6.572427376061653,3,1,3,3_1_3,0,
2026-03-02T08:38:39.931582+00:00,D,uniform,eval,uniform_eval_053,384,96,512,bf16,NVIDIA GeForce RTX 4060,c04,64,64,64,4,3,8,0.0,0.0,35.8240008354187,89.92735922336568,1.0537275323720499,2,1,2,2_1_2,0,
2026-03-02T08:38:39.940533+00:00,D,uniform,eval,uniform_eval_054,768,192,768,bf16,NVIDIA GeForce RTX 4060,c04,64,64,64,4,3,8,0.0,0.0,51.80799961090088,99.27423931658268,4.371765320048063,3,2,3,3_2_3,0,
2026-03-02T08:38:39.952341+00:00,D,uniform,eval,uniform_eval_055,512,2048,512,bf16,NVIDIA GeForce RTX 4060,c04,64,64,64,4,3,8,0.0,0.0,76.84800028800964,104.71936114132397,13.972280605557055,2,3,2,2_3_2,0,
2026-03-02T08:38:39.958892+00:00,D,uniform,eval,uniform_eval_056,384,512,512,bf16,NVIDIA GeForce RTX 4060,c02,32,64,32,2,2,8,0.0,0.0,49.15200173854828,52.66463860869408,4.095999855120982,2,2,2,2_2_2,0,
2026-03-02T08:38:39.969021+00:00,D,uniform,eval,uniform_eval_057,2048,512,512,bf16,NVIDIA GeForce RTX 4060,c04,64,64,64,4,3,8,0.0,0.0,68.60800087451935,79.79360029101372,15.650387860212119,3,2,2,3_2_2,0,
2026-03-02T08:38:39.985765+00:00,D,uniform,eval,uniform_eval_058,1024,512,2048,bf16,NVIDIA GeForce RTX 4060,c04,64,64,64,4,3,8,0.0,0.0,100.35199671983719,109.48351889848709,21.399510903558273,3,2,3,3_2_3,0,
2026-03-02T08:38:40.026415+00:00,D,uniform,eval,uniform_eval_059,2048,64,4096,bf16,NVIDIA GeForce RTX 4060,c04,64,64,64,4,3,8,0.0,0.0,83.75999704003334,148.55167783796776,12.819267692748388,3,1,3,3_1_3,0,
2026-03-02T08:38:40.036224+00:00,D,uniform,eval,uniform_eval_060,64,1536,1024,bf16,NVIDIA GeForce RTX 4060,c04,64,64,64,4,3,8,0.0,0.0,37.88800165057182,71.80287815630433,5.313729498239754,1,3,3,1_3_3,0,
2026-03-02T08:38:40.051765+00:00,D,uniform,eval,uniform_eval_061,768,1024,1536,bf16,NVIDIA GeForce RTX 4060,c10,64,128,64,8,3,8,0.0,0.0,103.05600240826607,123.92447724938393,23.442779144771297,3,3,3,3_3_3,0,
2026-03-02T08:38:40.057970+00:00,D,uniform,eval,uniform_eval_062,384,2048,192,bf16,NVIDIA GeForce RTX 4060,c04,64,64,64,4,3,8,0.0,0.0,51.29599943757057,145.05696356296534,5.887201561742346,2,3,2,2_3_2,0,
2026-03-02T08:38:40.065137+00:00,D,uniform,eval,uniform_eval_063,256,2048,192,bf16,NVIDIA GeForce RTX 4060,c04,64,64,64,4,3,8,0.0,0.0,51.071999594569206,118.9014415442942,3.942015068887341,2,3,2,2_3_2,0,
2026-03-02T08:38:40.215133+00:00,D,llm_style,tune,llm_style_tune_000,8,4096,1024,bf16,NVIDIA GeForce RTX 4060,c11,32,128,32,4,2,8,0.0,0.0,64.51199948787689,176.56159475445716,1.0402539765119372,0,3,3,0_3_3,0,
2026-03-02T08:38:40.234163+00:00,D,llm_style,tune,llm_style_tune_001,32,1024,2048,bf16,NVIDIA GeForce RTX 4060,c11,32,128,32,4,2,8,0.0,0.0,61.43999844789505,208.6134356260299,2.1845333885192884,0,3,3,0_3_3,0,
2026-03-02T08:38:40.248066+00:00,D,llm_style,tune,llm_style_tune_002,16,2048,1024,bf16,NVIDIA GeForce RTX 4060,c11,32,128,32,4,2,8,0.0,0.0,42.080000042915344,102.44960024952886,1.5947923938108113,0,3,3,0_3_3,0,
2026-03-02T08:38:40.476502+00:00,D,llm_style,tune,llm_style_tune_003,1,1024,4096,bf16,NVIDIA GeForce RTX 4060,c11,32,128,32,4,2,8,0.0,0.0,72.08000123500824,122.32960276305673,0.11637913230120439,0,3,3,0_3_3,0,
2026-03-02T08:38:40.504393+00:00,D,llm_style,tune,llm_style_tune_004,64,2048,2048,bf16,NVIDIA GeForce RTX 4060,c04,64,64,64,4,3,8,0.0,0.0,65.5359998345375,177.08703681826574,8.192000020682812,1,3,3,1_3_3,0,
2026-03-02T08:38:40.874756+00:00,D,llm_style,tune,llm_style_tune_005,32,8192,8192,bf16,NVIDIA GeForce RTX 4060,c11,32,128,32,4,2,8,0.0,0.0,561.1519813537598,681.2467193603516,7.65383967038402,0,3,3,0_3_3,0,
2026-03-02T08:38:41.196260+00:00,D,llm_style,tune,llm_style_tune_006,16,8192,8192,bf16,NVIDIA GeForce RTX 4060,c11,32,128,32,4,2,8,0.0,0.0,582.4640095233917,690.0256127119063,3.6868950061948116,0,3,3,0_3_3,0,
2026-03-02T08:38:41.248869+00:00,D,llm_style,tune,llm_style_tune_007,2,1024,8192,bf16,NVIDIA GeForce RTX 4060,c11,32,128,32,4,2,8,0.0,0.0,177.50399559736252,341.8713627755638,0.18903479827075267,0,3,3,0_3_3,0,
2026-03-02T08:38:41.335265+00:00,D,llm_style,tune,llm_style_tune_008,16,2048,8192,bf16,NVIDIA GeForce RTX 4060,c11,32,128,32,4,2,8,0.0,0.0,219.52000260353088,306.06336295604694,2.44565828003213,0,3,3,0_3_3,0,
2026-03-02T08:38:41.375336+00:00,D,llm_style,tune,llm_style_tune_009,4,4096,2048,bf16,NVIDIA GeForce RTX 4060,c11,32,128,32,4,2,8,0.0,0.0,65.2959980070591,80.95743760466574,1.0277638147554606,0,3,3,0_3_3,0,
2026-03-02T08:38:41.538570+00:00,D,llm_style,tune,llm_style_tune_010,64,8192,4096,bf16,NVIDIA GeForce RTX 4060,c04,64,64,64,4,3,8,0.0,0.0,321.53600454330444,459.3523296713829,13.357655862211706,1,3,3,1_3_3,0,
2026-03-02T08:38:41.579095+00:00,D,llm_style,tune,llm_style_tune_011,16,8192,1024,bf16,NVIDIA GeForce RTX 4060,c11,32,128,32,4,2,8,0.0,0.0,62.463998794555664,108.54335911571968,4.297442705883837,0,3,3,0_3_3,0,
2026-03-02T08:38:41.622410+00:00,D,llm_style,tune,llm_style_tune_012,2,8192,1024,bf16,NVIDIA GeForce RTX 4060,c11,32,128,32,4,2,8,0.0,0.0,66.04800000786781,172.50303864479056,0.50803100769142,0,3,3,0_3_3,0,
2026-03-02T08:38:41.705400+00:00,D,llm_style,tune,llm_style_tune_013,16,8192,2048,bf16,NVIDIA GeForce RTX 4060,c11,32,128,32,4,2,8,0.0,0.0,168.36799681186676,233.7875166535377,3.1886755331531074,0,3,3,0_3_3,0,
2026-03-02T08:38:41.787818+00:00,D,llm_style,tune,llm_style_tune_014,8,4096,4096,bf16,NVIDIA GeForce RTX 4060,c11,32,128,32,4,2,8,0.0,0.0,164.8159995675087,269.09087747335417,1.6286978006042958,0,3,3,0_3_3,0,
2026-03-02T08:38:41.798827+00:00,D,llm_style,tune,llm_style_tune_015,64,1024,1024,bf16,NVIDIA GeForce RTX 4060,c04,64,64,64,4,3,8,0.0,0.0,65.5359998345375,189.6652770042419,2.048000005170703,1,3,3,1_3_3,0,
2026-03-02T08:38:41.967461+00:00,D,llm_style,tune,llm_style_tune_016,16,4096,8192,bf16,NVIDIA GeForce RTX 4060,c11,32,128,32,4,2,8,0.0,0.0,327.04000174999237,415.5494350194928,3.283212506893356,0,3,3,0_3_3,0,
2026-03-02T08:38:42.051005+00:00,D,llm_style,tune,llm_style_tune_017,1,4096,4096,bf16,NVIDIA GeForce RTX 4060,c11,32,128,32,4,2,8,0.0,0.0,167.93599724769592,279.55424785614014,0.19980488132338384,0,3,3,0_3_3,0,
2026-03-02T08:38:42.139144+00:00,D,llm_style,tune,llm_style_tune_018,64,4096,4096,bf16,NVIDIA GeForce RTX 4060,c04,64,64,64,4,3,8,0.0,0.0,185.12000143527985,301.5769609808922,11.600494983524436,1,3,3,1_3_3,0,
2026-03-02T08:38:42.228079+00:00,D,llm_style,tune,llm_style_tune_019,64,8192,2048,bf16,NVIDIA GeForce RTX 4060,c04,64,64,64,4,3,8,0.0,0.0,186.319999396801,232.65503928065294,11.52578174620191,1,3,3,1_3_3,0,
2026-03-02T08:38:42.275467+00:00,D,llm_style,tune,llm_style_tune_020,8,2048,4096,bf16,NVIDIA GeForce RTX 4060,c11,32,128,32,4,2,8,0.0,0.0,117.68000200390816,217.84383431076975,1.140531319803535,0,3,3,0_3_3,0,
2026-03-02T08:38:42.288463+00:00,D,llm_style,tune,llm_style_tune_021,8,1024,2048,bf16,NVIDIA GeForce RTX 4060,c11,32,128,32,4,2,8,0.0,0.0,77.82399654388428,123.06912049651142,0.43115791388429847,0,3,3,0_3_3,0,
2026-03-02T08:38:42.328934+00:00,D,llm_style,tune,llm_style_tune_022,8,8192,1024,bf16,NVIDIA GeForce RTX 4060,c11,32,128,32,4,2,8,0.0,0.0,70.65600156784058,169.5641614496708,1.899594160746988,0,3,3,0_3_3,0,
2026-03-02T08:38:42.550538+00:00,D,llm_style,tune,llm_style_tune_023,1,4096,8192,bf16,NVIDIA GeForce RTX 4060,c11,32,128,32,4,2,8,0.0,0.0,470.5280065536499,578.7340629100796,0.14262458996125285,0,3,3,0_3_3,0,
2026-03-02T08:38:42.723639+00:00,D,llm_style,tune,llm_style_tune_024,2,8192,4096,bf16,NVIDIA GeForce RTX 4060,c11,32,128,32,4,2,8,0.0,0.0,475.0720113515854,532.7462410926819,0.28252080693650844,0,3,3,0_3_3,0,
2026-03-02T08:38:42.816330+00:00,D,llm_style,tune,llm_style_tune_025,2,4096,4096,bf16,NVIDIA GeForce RTX 4060,c11,32,128,32,4,2,8,0.0,0.0,255.45600056648254,350.35135954618454,0.26270224168226136,0,3,3,0_3_3,0,
2026-03-02T08:38:42.831524+00:00,D,llm_style,tune,llm_style_tune_026,4,2048,1024,bf16,NVIDIA GeForce RTX 4060,c11,32,128,32,4,2,8,0.0,0.0,57.231999933719635,176.05631574988337,0.2931439757378685,0,3,3,0_3_3,0,
2026-03-02T08:38:42.883980+00:00,D,llm_style,tune,llm_style_tune_027,64,2048,4096,bf16,NVIDIA GeForce RTX 4060,c04,64,64,64,4,3,8,0.0,0.0,157.69599378108978,285.47935485839827,6.808935333452703,1,3,3,1_3_3,0,
2026-03-02T08:38:42.908687+00:00,D,llm_style,tune,llm_style_tune_028,32,1024,4096,bf16,NVIDIA GeForce RTX 4060,c11,32,128,32,4,2,8,0.0,0.0,142.08000153303146,187.98463582992542,1.8893261057404536,0,3,3,0_3_3,0,
2026-03-02T08:38:42.921886+00:00,D,llm_style,tune,llm_style_tune_029,32,2048,1024,bf16,NVIDIA GeForce RTX 4060,c11,32,128,32,4,2,8,0.0,0.0,60.416001826524734,128.3340817689894,2.221559254870681,0,3,3,0_3_3,0,
2026-03-02T08:38:42.942691+00:00,D,llm_style,tune,llm_style_tune_030,4,2048,2048,bf16,NVIDIA GeForce RTX 4060,c11,32,128,32,4,2,8,0.0,0.0,83.29600095748901,95.67264199256897,0.4028336488461776,0,3,3,0_3_3,0,
2026-03-02T08:38:43.294529+00:00,D,llm_style,tune,llm_style_tune_031,1,8192,8192,bf16,NVIDIA GeForce RTX 4060,c11,32,128,32,4,2,8,0.0,0.0,907.263994216919,977.4166613817213,0.1479367955253713,0,3,3,0_3_3,0,
2026-03-02T08:38:43.319444+00:00,D,llm_style,eval,llm_style_eval_000,2,1024,4096,bf16,NVIDIA GeForce RTX 4060,c11,32,128,32,4,2,8,0.0,0.0,152.3040011525154,211.37440010905254,0.11015610800138792,0,3,3,0_3_3,0,
2026-03-02T08:38:43.660471+00:00,D,llm_style,eval,llm_style_eval_001,2,8192,8192,bf16,NVIDIA GeForce RTX 4060,c11,32,128,32,4,2,8,0.0,0.0,909.3120098114014,1064.529914855957,0.29520720402194583,0,3,3,0_3_3,0,
2026-03-02T08:38:43.683773+00:00,D,llm_style,eval,llm_style_eval_002,2,2048,2048,bf16,NVIDIA GeForce RTX 4060,c11,32,128,32,4,2,8,0.0,0.0,123.6800029873848,219.6956786513328,0.1356501907726446,0,3,3,0_3_3,0,
2026-03-02T08:38:43.742410+00:00,D,llm_style,eval,llm_style_eval_003,8,1024,8192,bf16,NVIDIA GeForce RTX 4060,c11,32,128,32,4,2,8,0.0,0.0,299.8879998922348,342.0774367451668,0.4475595157133041,0,3,3,0_3_3,0,
2026-03-02T08:38:43.843500+00:00,D,llm_style,eval,llm_style_eval_004,64,2048,8192,bf16,NVIDIA GeForce RTX 4060,c04,64,64,64,4,3,8,0.0,0.0,348.1599986553192,473.8198363780975,6.168094141469777,1,3,3,1_3_3,0,
2026-03-02T08:38:44.181714+00:00,D,llm_style,eval,llm_style_eval_005,1,8192,8192,bf16,NVIDIA GeForce RTX 4060,c11,32,128,32,4,2,8,0.0,0.0,911.2319946289062,955.1251113414764,0.14729259814308798,0,3,3,0_3_3,0,
2026-03-02T08:38:44.240678+00:00,D,llm_style,eval,llm_style_eval_006,1,1024,8192,bf16,NVIDIA GeForce RTX 4060,c11,32,128,32,4,2,8,0.0,0.0,304.52799797058105,355.74048042297363,0.05509252387893991,0,3,3,0_3_3,0,
2026-03-02T08:38:44.415980+00:00,D,llm_style,eval,llm_style_eval_007,2,8192,4096,bf16,NVIDIA GeForce RTX 4060,c11,32,128,32,4,2,8,0.0,0.0,501.24800205230713,863.778241276741,0.26776710819885496,0,3,3,0_3_3,0,
2026-03-02T08:38:44.464832+00:00,D,llm_style,eval,llm_style_eval_008,16,2048,4096,bf16,NVIDIA GeForce RTX 4060,c11,32,128,32,4,2,8,0.0,0.0,179.19999361038208,253.59359264373776,1.497965767697706,0,3,3,0_3_3,0,
2026-03-02T08:38:44.566044+00:00,D,llm_style,eval,llm_style_eval_009,32,2048,8192,bf16,NVIDIA GeForce RTX 4060,c11,32,128,32,4,2,8,0.0,0.0,399.23200011253357,440.62751591205586,2.6895184346378516,0,3,3,0_3_3,0,
2026-03-02T08:38:44.576253+00:00,D,llm_style,eval,llm_style_eval_010,1,1024,1024,bf16,NVIDIA GeForce RTX 4060,c11,32,128,32,4,2,8,0.0,0.0,64.30399790406227,129.65407773852343,0.03261308889579192,0,3,3,0_3_3,0,
2026-03-02T08:38:44.674805+00:00,D,llm_style,eval,llm_style_eval_011,16,2048,8192,bf16,NVIDIA GeForce RTX 4060,c11,32,128,32,4,2,8,0.0,0.0,408.51201117038727,498.7596887350081,1.3142108366945304,0,3,3,0_3_3,0,
2026-03-02T08:38:45.049653+00:00,D,llm_style,eval,llm_style_eval_012,8,8192,8192,bf16,NVIDIA GeForce RTX 4060,c11,32,128,32,4,2,8,0.0,0.0,913.8239920139313,1048.2176530361176,1.1749985045081097,0,3,3,0_3_3,0,
2026-03-02T08:38:45.222239+00:00,D,llm_style,eval,llm_style_eval_013,32,4096,8192,bf16,NVIDIA GeForce RTX 4060,c11,32,128,32,4,2,8,0.0,0.0,495.4560101032257,519.5648223161697,4.334357852582277,0,3,3,0_3_3,0,
2026-03-02T08:38:45.232557+00:00,D,llm_style,eval,llm_style_eval_014,64,1024,1024,bf16,NVIDIA GeForce RTX 4060,c04,64,64,64,4,3,8,0.0,0.0,54.78399991989136,125.57311765849587,2.4499439288161082,1,3,3,1_3_3,0,
2026-03-02T08:38:45.248143+00:00,D,llm_style,eval,llm_style_eval_015,16,2048,1024,bf16,NVIDIA GeForce RTX 4060,c11,32,128,32,4,2,8,0.0,0.0,101.3759970664978,161.47456616163248,0.6619798171354093,0,3,3,0_3_3,0,
2026-03-02T08:38:45.311605+00:00,D,llm_style,eval,llm_style_eval_016,2,1024,8192,bf16,NVIDIA GeForce RTX 4060,c11,32,128,32,4,2,8,0.0,0.0,386.04798913002014,516.6924709081648,0.08691777433063883,0,3,3,0_3_3,0,
2026-03-02T08:38:45.649160+00:00,D,llm_style,eval,llm_style_eval_017,4,8192,8192,bf16,NVIDIA GeForce RTX 4060,c11,32,128,32,4,2,8,0.0,0.0,909.7279906272888,1048.1561541557312,0.5901444360635854,0,3,3,0_3_3,0,
2026-03-02T08:38:45.683405+00:00,D,llm_style,eval,llm_style_eval_018,4,1024,4096,bf16,NVIDIA GeForce RTX 4060,c11,32,128,32,4,2,8,0.0,0.0,230.79999536275864,334.33406949043274,0.1453831571671438,0,3,3,0_3_3,0,
2026-03-02T08:38:45.732002+00:00,D,llm_style,eval,llm_style_eval_019,8,4096,2048,bf16,NVIDIA GeForce RTX 4060,c11,32,128,32,4,2,8,0.0,0.0,133.58400017023087,219.19743955135345,1.0047440399221579,0,3,3,0_3_3,0,
2026-03-02T08:38:45.785849+00:00,D,llm_style,eval,llm_style_eval_020,64,4096,2048,bf16,NVIDIA GeForce RTX 4060,c04,64,64,64,4,3,8,0.0,0.0,207.35999941825867,294.0102460980414,5.178153100946884,1,3,3,1_3_3,0,
2026-03-02T08:38:45.961053+00:00,D,llm_style,eval,llm_style_eval_021,1,4096,8192,bf16,NVIDIA GeForce RTX 4060,c11,32,128,32,4,2,8,0.0,0.0,502.78401374816895,577.0649689435958,0.13347453810178825,0,3,3,0_3_3,0,
2026-03-02T08:38:45.992987+00:00,D,llm_style,eval,llm_style_eval_022,32,1024,4096,bf16,NVIDIA GeForce RTX 4060,c11,32,128,32,4,2,8,0.0,0.0,225.26399791240692,340.58239579200733,1.1916482815171388,0,3,3,0_3_3,0,
2026-03-02T08:38:46.003350+00:00,D,llm_style,eval,llm_style_eval_023,4,1024,1024,bf16,NVIDIA GeForce RTX 4060,c11,32,128,32,4,2,8,0.0,0.0,78.84799689054489,96.71552248299122,0.10638961458519848,0,3,3,0_3_3,0,
2026-03-02T08:38:46.026788+00:00,D,llm_style,eval,llm_style_eval_024,64,2048,2048,bf16,NVIDIA GeForce RTX 4060,c04,64,64,64,4,3,8,0.0,0.0,150.52799880504608,164.8806431889534,3.566585062326642,1,3,3,1_3_3,0,
2026-03-02T08:38:46.369939+00:00,D,llm_style,eval,llm_style_eval_025,32,8192,8192,bf16,NVIDIA GeForce RTX 4060,c11,32,128,32,4,2,8,0.0,0.0,926.7200231552124,1047.8387093544006,4.634589939447822,0,3,3,0_3_3,0,
2026-03-02T08:38:46.431736+00:00,D,llm_style,eval,llm_style_eval_026,4,2048,4096,bf16,NVIDIA GeForce RTX 4060,c11,32,128,32,4,2,8,0.0,0.0,260.09601354599,356.8399965763091,0.2580157345938478,0,3,3,0_3_3,0,
2026-03-02T08:38:46.520431+00:00,D,llm_style,eval,llm_style_eval_027,8,8192,2048,bf16,NVIDIA GeForce RTX 4060,c11,32,128,32,4,2,8,0.0,0.0,256.00001215934753,324.1513654589653,1.048575950195315,0,3,3,0_3_3,0,
2026-03-02T08:38:46.746904+00:00,D,llm_style,eval,llm_style_eval_028,8,4096,8192,bf16,NVIDIA GeForce RTX 4060,c11,32,128,32,4,2,8,0.0,0.0,586.2079858779907,618.3315390348434,0.9158369127228857,0,3,3,0_3_3,0,
2026-03-02T08:38:46.772798+00:00,D,llm_style,eval,llm_style_eval_029,8,2048,2048,bf16,NVIDIA GeForce RTX 4060,c11,32,128,32,4,2,8,0.0,0.0,149.4080051779747,256.2848080694674,0.44916511615331434,0,3,3,0_3_3,0,
2026-03-02T08:38:46.829241+00:00,D,llm_style,eval,llm_style_eval_030,1,4096,2048,bf16,NVIDIA GeForce RTX 4060,c11,32,128,32,4,2,8,0.0,0.0,170.48000544309616,361.5356823801991,0.09841163458667299,0,3,3,0_3_3,0,
2026-03-02T08:38:46.922150+00:00,D,llm_style,eval,llm_style_eval_031,16,8192,2048,bf16,NVIDIA GeForce RTX 4060,c11,32,128,32,4,2,8,0.0,0.0,267.2640085220337,363.74527633190155,2.0087662194729803,0,3,3,0_3_3,0,
2026-03-02T08:38:46.946964+00:00,D,llm_style,eval,llm_style_eval_032,1,2048,2048,bf16,NVIDIA GeForce RTX 4060,c11,32,128,32,4,2,8,0.0,0.0,147.40800112485886,264.2713591456413,0.056907413003277924,0,3,3,0_3_3,0,
2026-03-02T08:38:47.121090+00:00,D,llm_style,eval,llm_style_eval_033,16,8192,4096,bf16,NVIDIA GeForce RTX 4060,c11,32,128,32,4,2,8,0.0,0.0,501.76000595092773,621.0662603378296,2.1399509950281135,0,3,3,0_3_3,0,
2026-03-02T08:38:47.154755+00:00,D,llm_style,eval,llm_style_eval_034,16,1024,4096,bf16,NVIDIA GeForce RTX 4060,c11,32,128,32,4,2,8,0.0,0.0,287.7439856529236,371.8351942300796,0.4664484218338911,0,3,3,0_3_3,0,
2026-03-02T08:38:47.245322+00:00,D,llm_style,eval,llm_style_eval_035,4,8192,2048,bf16,NVIDIA GeForce RTX 4060,c11,32,128,32,4,2,8,0.0,0.0,279.4880121946335,397.89566934108734,0.48022713727890315,0,3,3,0_3_3,0,
2026-03-02T08:38:47.303737+00:00,D,llm_style,eval,llm_style_eval_036,2,2048,4096,bf16,NVIDIA GeForce RTX 4060,c11,32,128,32,4,2,8,0.0,0.0,299.8239994049072,422.45119750499725,0.11191376296293515,0,3,3,0_3_3,0,
2026-03-02T08:38:47.318425+00:00,D,llm_style,eval,llm_style_eval_037,2,1024,1024,bf16,NVIDIA GeForce RTX 4060,c11,32,128,32,4,2,8,0.0,0.0,100.23999959230423,199.74144041538239,0.041842617887660194,0,3,3,0_3_3,0,
2026-03-02T08:38:47.533065+00:00,D,llm_style,eval,llm_style_eval_038,64,4096,8192,bf16,NVIDIA GeForce RTX 4060,c04,64,64,64,4,3,8,0.0,0.0,972.8000164031982,1025.0649559497833,4.415056767659281,1,3,3,1_3_3,0,
2026-03-02T08:38:47.552997+00:00,D,llm_style,eval,llm_style_eval_039,4,1024,2048,bf16,NVIDIA GeForce RTX 4060,c11,32,128,32,4,2,8,0.0,0.0,164.86400365829468,264.83712404966354,0.10176397289716008,0,3,3,0_3_3,0,
2026-03-02T08:38:47.610528+00:00,D,llm_style,eval,llm_style_eval_040,64,8192,1024,bf16,NVIDIA GeForce RTX 4060,c04,64,64,64,4,3,8,0.0,0.0,275.4560112953186,279.40928399562836,3.898051884766576,1,3,3,1_3_3,0,
2026-03-02T08:38:47.630205+00:00,D,llm_style,eval,llm_style_eval_041,2,2048,1024,bf16,NVIDIA GeForce RTX 4060,c11,32,128,32,4,2,8,0.0,0.0,100.35199671983719,155.83232060074803,0.0835918394670245,0,3,3,0_3_3,0,
2026-03-02T08:38:47.680241+00:00,D,llm_style,eval,llm_style_eval_042,2,4096,2048,bf16,NVIDIA GeForce RTX 4060,c11,32,128,32,4,2,8,0.0,0.0,167.93599724769592,312.8079891204833,0.19980488132338384,0,3,3,0_3_3,0,
2026-03-02T08:38:47.694585+00:00,D,llm_style,eval,llm_style_eval_043,1,2048,1024,bf16,NVIDIA GeForce RTX 4060,c11,32,128,32,4,2,8,0.0,0.0,86.01599931716919,112.15872071683407,0.048761905148997066,0,3,3,0_3_3,0,
2026-03-02T08:38:47.803773+00:00,D,llm_style,eval,llm_style_eval_044,8,2048,8192,bf16,NVIDIA GeForce RTX 4060,c11,32,128,32,4,2,8,0.0,0.0,562.175989151001,602.7161586284637,0.47749363398709294,0,3,3,0_3_3,0,
2026-03-02T08:38:47.850703+00:00,D,llm_style,eval,llm_style_eval_045,1,8192,1024,bf16,NVIDIA GeForce RTX 4060,c11,32,128,32,4,2,8,0.0,0.0,156.67200088500977,249.00096058845492,0.1070849667153592,0,3,3,0_3_3,0,
2026-03-02T08:38:47.875053+00:00,D,llm_style,eval,llm_style_eval_046,64,4096,1024,bf16,NVIDIA GeForce RTX 4060,c04,64,64,64,4,3,8,0.0,0.0,136.19199395179749,157.24351704120633,3.9420152126564427,1,3,3,1_3_3,0,
2026-03-02T08:38:47.898949+00:00,D,llm_style,eval,llm_style_eval_047,16,2048,2048,bf16,NVIDIA GeForce RTX 4060,c11,32,128,32,4,2,8,0.0,0.0,146.43199741840363,162.19199791550636,0.9165874287468502,0,3,3,0_3_3,0,
2026-03-02T08:38:48.070780+00:00,D,llm_style,eval,llm_style_eval_048,8,8192,4096,bf16,NVIDIA GeForce RTX 4060,c11,32,128,32,4,2,8,0.0,0.0,483.69601368904114,520.6095963716507,1.1099345390618496,0,3,3,0_3_3,0,
2026-03-02T08:38:48.252174+00:00,D,llm_style,eval,llm_style_eval_049,4,4096,8192,bf16,NVIDIA GeForce RTX 4060,c11,32,128,32,4,2,8,0.0,0.0,591.6320085525513,669.6141052246091,0.4537203060678493,0,3,3,0_3_3,0,
2026-03-02T08:38:48.368805+00:00,D,llm_style,eval,llm_style_eval_050,4,2048,8192,bf16,NVIDIA GeForce RTX 4060,c11,32,128,32,4,2,8,0.0,0.0,564.655989408493,602.400950193405,0.2376982278016747,0,3,3,0_3_3,0,
2026-03-02T08:38:48.383593+00:00,D,llm_style,eval,llm_style_eval_051,16,1024,1024,bf16,NVIDIA GeForce RTX 4060,c11,32,128,32,4,2,8,0.0,0.0,91.13600105047226,132.01215535402287,0.3681797710371024,0,3,3,0_3_3,0,
2026-03-02T08:38:48.555192+00:00,D,llm_style,eval,llm_style_eval_052,32,8192,4096,bf16,NVIDIA GeForce RTX 4060,c11,32,128,32,4,2,8,0.0,0.0,490.86400866508484,639.9536001682279,4.37490549335676,0,3,3,0_3_3,0,
2026-03-02T08:38:48.576727+00:00,D,llm_style,eval,llm_style_eval_053,32,1024,2048,bf16,NVIDIA GeForce RTX 4060,c11,32,128,32,4,2,8,0.0,0.0,152.96000242233276,220.72320386767387,0.8774694421710056,0,3,3,0_3_3,0,
2026-03-02T08:38:48.686200+00:00,D,llm_style,eval,llm_style_eval_054,64,8192,2048,bf16,NVIDIA GeForce RTX 4060,c04,64,64,64,4,3,8,0.0,0.0,444.3359971046448,561.7152076959608,4.833017495753895,1,3,3,1_3_3,0,
2026-03-02T08:38:48.710017+00:00,D,llm_style,eval,llm_style_eval_055,1,4096,1024,bf16,NVIDIA GeForce RTX 4060,c11,32,128,32,4,2,8,0.0,0.0,121.34400010108948,232.77567863464355,0.0691308016301721,0,3,3,0_3_3,0,
2026-03-02T08:38:48.735245+00:00,D,llm_style,eval,llm_style_eval_056,4,2048,2048,bf16,NVIDIA GeForce RTX 4060,c11,32,128,32,4,2,8,0.0,0.0,151.5520066022873,262.1318459510803,0.22140539575998977,0,3,3,0_3_3,0,
2026-03-02T08:38:48.809099+00:00,D,llm_style,eval,llm_style_eval_057,16,1024,8192,bf16,NVIDIA GeForce RTX 4060,c11,32,128,32,4,2,8,0.0,0.0,500.2239942550659,557.475845813751,0.536630507698365,0,3,3,0_3_3,0,
2026-03-02T08:38:48.989940+00:00,D,llm_style,eval,llm_style_eval_058,1,8192,4096,bf16,NVIDIA GeForce RTX 4060,c11,32,128,32,4,2,8,0.0,0.0,481.6479980945587,584.0192133188248,0.13933176150526627,0,3,3,0_3_3,0,
2026-03-02T08:38:49.011162+00:00,D,llm_style,eval,llm_style_eval_059,8,4096,1024,bf16,NVIDIA GeForce RTX 4060,c11,32,128,32,4,2,8,0.0,0.0,98.30400347709656,206.36671915650368,0.6826666425201637,0,3,3,0_3_3,0,
2026-03-02T08:38:49.183815+00:00,D,llm_style,eval,llm_style_eval_060,4,8192,4096,bf16,NVIDIA GeForce RTX 4060,c11,32,128,32,4,2,8,0.0,0.0,482.30400681495667,624.8079842329025,0.556568994258821,0,3,3,0_3_3,0,
2026-03-02T08:38:49.209017+00:00,D,llm_style,eval,llm_style_eval_061,32,2048,2048,bf16,NVIDIA GeForce RTX 4060,c11,32,128,32,4,2,8,0.0,0.0,153.02400290966034,211.33311688899988,1.7542049018184047,0,3,3,0_3_3,0,
2026-03-02T08:38:49.223999+00:00,D,llm_style,eval,llm_style_eval_062,8,2048,1024,bf16,NVIDIA GeForce RTX 4060,c11,32,128,32,4,2,8,0.0,0.0,92.16000139713287,151.01695775985706,0.3640888833693517,0,3,3,0_3_3,0,
2026-03-02T08:38:49.403733+00:00,D,llm_style,eval,llm_style_eval_063,16,4096,8192,bf16,NVIDIA GeForce RTX 4060,c11,32,128,32,4,2,8,0.0,0.0,595.9680080413818,610.7120048999786,1.8016769516350337,0,3,3,0_3_3,0,
2026-03-02T08:38:49.635305+00:00,D,training_style,tune,training_style_tune_000,4096,2048,1024,bf16,NVIDIA GeForce RTX 4060,c10,64,128,64,8,3,8,0.0,0.0,3482.0799827575684,3593.3593034744263,4.933795107829408,3,3,3,3_3_3,0,
2026-03-02T08:38:49.685469+00:00,D,training_style,tune,training_style_tune_001,1536,2048,1536,bf16,NVIDIA GeForce RTX 4060,c10,64,128,64,8,3,8,0.0,0.0,364.54400420188904,440.9651240706444,26.508943514671376,3,3,3,3_3_3,0,
2026-03-02T08:38:49.887414+00:00,D,training_style,tune,training_style_tune_002,3072,2048,4096,bf16,NVIDIA GeForce RTX 4060,c10,64,128,64,8,3,8,0.0,0.0,1773.0560302734375,1939.0463781356812,29.068233982460022,3,3,3,3_3_3,0,
2026-03-02T08:38:49.948480+00:00,D,training_style,tune,training_style_tune_003,2048,1536,2048,bf16,NVIDIA GeForce RTX 4060,c10,64,128,64,8,3,8,0.0,0.0,497.1040040254593,630.1049447059629,25.919931812378035,3,3,3,3_3_3,0,
2026-03-02T08:38:49.960240+00:00,D,training_style,tune,training_style_tune_004,512,512,1024,bf16,NVIDIA GeForce RTX 4060,c04,64,64,64,4,3,8,0.0,0.0,65.42399898171425,183.43808189034456,8.206024094461931,2,2,3,2_2_3,0,
2026-03-02T08:38:49.987293+00:00,D,training_style,tune,training_style_tune_005,1024,1536,1536,bf16,NVIDIA GeForce RTX 4060,c10,64,128,64,8,3,8,0.0,0.0,206.84799551963806,323.76992136240005,23.359366842601418,3,3,3,3_3_3,0,
2026-03-02T08:38:50.001976+00:00,D,training_style,tune,training_style_tune_006,1024,1536,512,bf16,NVIDIA GeForce RTX 4060,c03,64,64,32,4,2,8,0.0,0.0,87.90399879217148,658.0537736415844,18.322405785064664,3,3,2,3_3_2,0,
2026-03-02T08:38:50.019825+00:00,D,training_style,tune,training_style_tune_007,2048,1536,512,bf16,NVIDIA GeForce RTX 4060,c03,64,64,32,4,2,8,0.0,0.0,152.5759994983673,214.18047666549677,21.112268525787833,3,3,2,3_3_2,0,
2026-03-02T08:38:50.108341+00:00,D,training_style,tune,training_style_tune_008,3072,3072,1536,bf16,NVIDIA GeForce RTX 4060,c10,64,128,64,8,3,8,0.0,0.0,880.0639808177948,1016.1814737319946,32.94195635760509,3,3,3,3_3_3,0,
2026-03-02T08:38:50.136085+00:00,D,training_style,tune,training_style_tune_009,1024,1536,1024,bf16,NVIDIA GeForce RTX 4060,c10,64,128,64,8,3,8,0.0,0.0,135.67999750375748,211.60191982984537,23.74134383301999,3,3,3,3_3_3,0,
2026-03-02T08:38:50.230009+00:00,D,training_style,tune,training_style_tune_010,1536,2048,4096,bf16,NVIDIA GeForce RTX 4060,c10,64,128,64,8,3,8,0.0,0.0,790.4959917068481,896.6076773405075,32.599537564203885,3,3,3,3_3_3,0,
2026-03-02T08:38:50.285237+00:00,D,training_style,tune,training_style_tune_011,1024,1024,4096,bf16,NVIDIA GeForce RTX 4060,c10,64,128,64,8,3,8,0.0,0.0,292.7840054035187,350.7929489016533,29.33881097828839,3,3,3,3_3_3,0,
2026-03-02T08:38:50.616815+00:00,D,training_style,tune,training_style_tune_012,3072,4096,4096,bf16,NVIDIA GeForce RTX 4060,c10,64,128,64,8,3,8,0.0,0.0,3211.2479209899902,3339.444830417633,32.09942603005933,3,3,3,3_3_3,0,
2026-03-02T08:38:50.651335+00:00,D,training_style,tune,training_style_tune_013,512,1024,3072,bf16,NVIDIA GeForce RTX 4060,c06,64,128,32,4,3,8,0.0,0.0,142.33599603176117,156.2534373998642,22.631137321589463,2,3,3,2_3_3,0,
2026-03-02T08:38:50.669803+00:00,D,training_style,tune,training_style_tune_014,1536,1024,1024,bf16,NVIDIA GeForce RTX 4060,c10,64,128,64,8,3,8,0.0,0.0,133.91999900341034,180.87104156613339,24.0533564513988,3,3,3,3_3_3,0,
2026-03-02T08:38:50.730744+00:00,D,training_style,tune,training_style_tune_015,2048,3072,1536,bf16,NVIDIA GeForce RTX 4060,c10,64,128,64,8,3,8,0.0,0.0,603.4560203552246,683.7350291013718,32.02777365718043,3,3,3,3_3_3,0,
2026-03-02T08:38:50.843631+00:00,D,training_style,tune,training_style_tune_016,1536,3072,3072,bf16,NVIDIA GeForce RTX 4060,c10,64,128,64,8,3,8,0.0,0.0,877.0560026168823,995.2499204874039,33.05493510277465,3,3,3,3_3_3,0,
2026-03-02T08:38:50.872397+00:00,D,training_style,tune,training_style_tune_017,1024,1024,2048,bf16,NVIDIA GeForce RTX 4060,c10,64,128,64,8,3,8,0.0,0.0,179.1359931230545,267.35296010971064,23.976015211245926,3,3,3,3_3_3,0,
2026-03-02T08:38:50.905641+00:00,D,training_style,tune,training_style_tune_018,1536,1536,1536,bf16,NVIDIA GeForce RTX 4060,c10,64,128,64,8,3,8,0.0,0.0,258.432000875473,378.43231320381165,28.045123233373772,3,3,3,3_3_3,0,
2026-03-02T08:38:50.948074+00:00,D,training_style,tune,training_style_tune_019,1536,1536,2048,bf16,NVIDIA GeForce RTX 4060,c10,64,128,64,8,3,8,0.0,0.0,320.3199952840805,429.9264076352119,30.16882042418122,3,3,3,3_3_3,0,
2026-03-02T08:38:50.970844+00:00,D,training_style,tune,training_style_tune_020,1536,1536,1024,bf16,NVIDIA GeForce RTX 4060,c10,64,128,64,8,3,8,0.0,0.0,173.47200214862823,233.2563239336012,27.853706351184858,3,3,3,3_3_3,0,
2026-03-02T08:38:51.004576+00:00,D,training_style,tune,training_style_tune_021,1024,2048,1536,bf16,NVIDIA GeForce RTX 4060,c10,64,128,64,8,3,8,0.0,0.0,225.2800017595291,254.76096034049982,28.597527049368868,3,3,3,3_3_3,0,
2026-03-02T08:38:51.019947+00:00,D,training_style,tune,training_style_tune_022,512,1024,1536,bf16,NVIDIA GeForce RTX 4060,c06,64,128,32,4,3,8,0.0,0.0,97.23200276494026,159.16064113378525,16.564636027231476,2,3,3,2_3_3,0,
2026-03-02T08:38:51.075404+00:00,D,training_style,tune,training_style_tune_023,1536,2048,2048,bf16,NVIDIA GeForce RTX 4060,c10,64,128,64,8,3,8,0.0,0.0,419.6000099182129,457.93887525796885,30.707582420008723,3,3,3,3_3_3,0,
2026-03-02T08:38:51.091401+00:00,D,training_style,tune,training_style_tune_024,1024,1024,1024,bf16,NVIDIA GeForce RTX 4060,c10,64,128,64,8,3,8,0.0,0.0,109.79199782013893,183.82911801338193,19.559564363861966,3,3,3,3_3_3,0,
2026-03-02T08:38:51.150547+00:00,D,training_style,tune,training_style_tune_025,1536,1024,4096,bf16,NVIDIA GeForce RTX 4060,c10,64,128,64,8,3,8,0.0,0.0,410.6239974498749,475.33056795597065,31.378833112579763,3,3,3,3_3_3,0,
2026-03-02T08:38:51.181378+00:00,D,training_style,tune,training_style_tune_026,2048,4096,512,bf16,NVIDIA GeForce RTX 4060,c03,64,64,32,4,2,8,0.0,0.0,290.51201045513153,355.9804835915564,29.568259771919767,3,3,2,3_3_2,0,
2026-03-02T08:38:51.323051+00:00,D,training_style,tune,training_style_tune_027,4096,4096,1536,bf16,NVIDIA GeForce RTX 4060,c10,64,128,64,8,3,8,0.0,0.0,1609.7279787063599,1682.4499440193176,32.01758820979134,3,3,3,3_3_3,0,
2026-03-02T08:38:51.410765+00:00,D,training_style,tune,training_style_tune_028,1536,1536,4096,bf16,NVIDIA GeForce RTX 4060,c10,64,128,64,8,3,8,0.0,0.0,603.1360030174255,725.6211376190186,32.04476724206034,3,3,3,3_3_3,0,
2026-03-02T08:38:51.530173+00:00,D,training_style,tune,training_style_tune_029,4096,2048,2048,bf16,NVIDIA GeForce RTX 4060,c10,64,128,64,8,3,8,0.0,0.0,1046.8479990959167,1116.54909491539,32.82208916449561,3,3,3,3_3_3,0,
2026-03-02T08:38:51.559796+00:00,D,training_style,tune,training_style_tune_030,2048,2048,512,bf16,NVIDIA GeForce RTX 4060,c03,64,64,32,4,2,8,0.0,0.0,188.83199989795685,281.6127973794937,22.74491240002204,3,3,2,3_3_2,0,
2026-03-02T08:38:51.574736+00:00,D,training_style,tune,training_style_tune_031,512,512,1536,bf16,NVIDIA GeForce RTX 4060,c04,64,64,64,4,3,8,0.0,0.0,68.60800087451935,191.17471739649767,11.73779089515909,2,2,3,2_2_3,0,
2026-03-02T08:38:51.650999+00:00,D,training_style,eval,training_style_eval_000,2048,1536,3072,bf16,NVIDIA GeForce RTX 4060,c10,64,128,64,8,3,8,0.0,0.0,605.3920090198517,734.8988974094391,31.92535174570867,3,3,3,3_3_3,0,
2026-03-02T08:38:51.691975+00:00,D,training_style,eval,training_style_eval_001,1024,2048,2048,bf16,NVIDIA GeForce RTX 4060,c10,64,128,64,8,3,8,0.0,0.0,290.815994143486,485.44001072645176,29.5373527075055,3,3,3,3_3_3,0,
2026-03-02T08:38:51.742760+00:00,D,training_style,eval,training_style_eval_002,1536,1024,3072,bf16,NVIDIA GeForce RTX 4060,c10,64,128,64,8,3,8,0.0,0.0,309.7440004348755,324.53472077846527,31.198913949688638,3,3,3,3_3_3,0,
2026-03-02T08:38:51.757940+00:00,D,training_style,eval,training_style_eval_003,1024,512,1024,bf16,NVIDIA GeForce RTX 4060,c04,64,64,64,4,3,8,0.0,0.0,71.68000191450119,699.0015791356543,14.979656742765474,3,2,3,3_2_3,0,
2026-03-02T08:38:51.781615+00:00,D,training_style,eval,training_style_eval_004,1024,2048,1024,bf16,NVIDIA GeForce RTX 4060,c10,64,128,64,8,3,8,0.0,0.0,160.76800227165222,175.68767607212067,26.71531172442341,3,3,3,3_3_3,0,
2026-03-02T08:38:51.797720+00:00,D,training_style,eval,training_style_eval_005,1024,512,1536,bf16,NVIDIA GeForce RTX 4060,c04,64,64,64,4,3,8,0.0,0.0,86.31999790668488,136.99072137474997,18.658628070648614,3,2,3,3_2_3,0,
2026-03-02T08:38:51.845008+00:00,D,training_style,eval,training_style_eval_006,2048,1536,2048,bf16,NVIDIA GeForce RTX 4060,c10,64,128,64,8,3,8,0.0,0.0,412.7520024776459,454.3270394206046,31.21705481900801,3,3,3,3_3_3,0,
2026-03-02T08:38:51.871296+00:00,D,training_style,eval,training_style_eval_007,1536,2048,1024,bf16,NVIDIA GeForce RTX 4060,c10,64,128,64,8,3,8,0.0,0.0,223.23200106620789,266.18079259991634,28.859889770415343,3,3,3,3_3_3,0,
2026-03-02T08:38:51.886100+00:00,D,training_style,eval,training_style_eval_008,512,512,2048,bf16,NVIDIA GeForce RTX 4060,c04,64,64,64,4,3,8,0.0,0.0,74.75200295448303,168.43231663107872,14.364054226798554,2,2,3,2_2_3,0,
2026-03-02T08:38:51.904643+00:00,D,training_style,eval,training_style_eval_009,1024,512,2048,bf16,NVIDIA GeForce RTX 4060,c04,64,64,64,4,3,8,0.0,0.0,114.68800157308578,149.33215826749796,18.724571171741097,3,2,3,3_2_3,0,
2026-03-02T08:38:51.949393+00:00,D,training_style,eval,training_style_eval_010,2048,3072,1024,bf16,NVIDIA GeForce RTX 4060,c10,64,128,64,8,3,8,0.0,0.0,414.2560064792633,456.05696499347675,31.103717716752016,3,3,3,3_3_3,0,
2026-03-02T08:38:52.031832+00:00,D,training_style,eval,training_style_eval_011,2048,4096,1536,bf16,NVIDIA GeForce RTX 4060,c10,64,128,64,8,3,8,0.0,0.0,802.8159737586975,860.805116891861,32.09926635533741,3,3,3,3_3_3,0,
2026-03-02T08:38:52.159102+00:00,D,training_style,eval,training_style_eval_012,2048,3072,3072,bf16,NVIDIA GeForce RTX 4060,c10,64,128,64,8,3,8,0.0,0.0,1168.3839559555054,1237.863997220993,33.083906593349404,3,3,3,3_3_3,0,
2026-03-02T08:38:52.227961+00:00,D,training_style,eval,training_style_eval_013,3072,1536,1536,bf16,NVIDIA GeForce RTX 4060,c10,64,128,64,8,3,8,0.0,0.0,465.40799736976624,500.33312469720835,31.145821958197523,3,3,3,3_3_3,0,
2026-03-02T08:38:52.270179+00:00,D,training_style,eval,training_style_eval_014,2048,1536,1536,bf16,NVIDIA GeForce RTX 4060,c10,64,128,64,8,3,8,0.0,0.0,318.89599561691284,478.8588938117026,30.30353641570619,3,3,3,3_3_3,0,
2026-03-02T08:38:52.327150+00:00,D,training_style,eval,training_style_eval_015,4096,2048,1024,bf16,NVIDIA GeForce RTX 4060,c10,64,128,64,8,3,8,0.0,0.0,548.8640069961548,558.8889533281326,31.300775720424237,3,3,3,3_3_3,0,
2026-03-02T08:38:52.344476+00:00,D,training_style,eval,training_style_eval_016,2048,1024,512,bf16,NVIDIA GeForce RTX 4060,c03,64,64,32,4,2,8,0.0,0.0,97.28000313043594,167.96608448028564,22.07528350015151,3,3,2,3_3_2,0,
2026-03-02T08:38:52.469710+00:00,D,training_style,eval,training_style_eval_017,2048,4096,2048,bf16,NVIDIA GeForce RTX 4060,c10,64,128,64,8,3,8,0.0,0.0,1063.2799863815308,1187.3791813850403,32.31485479655298,3,3,3,3_3_3,0,
2026-03-02T08:38:52.540709+00:00,D,training_style,eval,training_style_eval_018,1536,2048,3072,bf16,NVIDIA GeForce RTX 4060,c10,64,128,64,8,3,8,0.0,0.0,603.056013584137,668.464016318321,32.049017664432085,3,3,3,3_3_3,0,
2026-03-02T08:38:52.603721+00:00,D,training_style,eval,training_style_eval_019,1536,1536,3072,bf16,NVIDIA GeForce RTX 4060,c10,64,128,64,8,3,8,0.0,0.0,460.1280093193054,552.2547191381453,31.50322156098272,3,3,3,3_3_3,0,
2026-03-02T08:38:52.679343+00:00,D,training_style,eval,training_style_eval_020,3072,1536,2048,bf16,NVIDIA GeForce RTX 4060,c10,64,128,64,8,3,8,0.0,0.0,607.7439785003662,744.6201723814006,31.8018006195488,3,3,3,3_3_3,0,
2026-03-02T08:38:52.769821+00:00,D,training_style,eval,training_style_eval_021,2048,1024,4096,bf16,NVIDIA GeForce RTX 4060,c10,64,128,64,8,3,8,0.0,0.0,557.6800107955933,749.7116756439209,30.805961934140306,3,3,3,3_3_3,0,
2026-03-02T08:38:52.780634+00:00,D,training_style,eval,training_style_eval_022,512,512,1536,bf16,NVIDIA GeForce RTX 4060,c04,64,64,64,4,3,8,0.0,0.0,58.36800113320351,152.88319945335382,13.797052363711826,2,2,3,2_2_3,0,
2026-03-02T08:38:53.121242+00:00,D,training_style,eval,training_style_eval_023,3072,4096,4096,bf16,NVIDIA GeForce RTX 4060,c10,64,128,64,8,3,8,0.0,0.0,3192.8160190582275,3234.3347907066345,32.284733755001916,3,3,3,3_3_3,0,
2026-03-02T08:38:53.193115+00:00,D,training_style,eval,training_style_eval_024,1536,1024,4096,bf16,NVIDIA GeForce RTX 4060,c10,64,128,64,8,3,8,0.0,0.0,414.20799493789673,437.26848632097244,31.107323000686808,3,3,3,3_3_3,0,
2026-03-02T08:38:53.349778+00:00,D,training_style,eval,training_style_eval_025,4096,3072,2048,bf16,NVIDIA GeForce RTX 4060,c10,64,128,64,8,3,8,0.0,0.0,1525.7600545883179,1575.4998815059662,33.779628321640956,3,3,3,3_3_3,0,
2026-03-02T08:38:53.363545+00:00,D,training_style,eval,training_style_eval_026,1024,512,512,bf16,NVIDIA GeForce RTX 4060,c04,64,64,64,4,3,8,0.0,0.0,47.10400104522705,155.6924833357332,11.39756496448193,3,2,2,3_2_2,0,
2026-03-02T08:38:53.419960+00:00,D,training_style,eval,training_style_eval_027,2048,4096,1024,bf16,NVIDIA GeForce RTX 4060,c10,64,128,64,8,3,8,0.0,0.0,555.0079941749573,663.6915200948715,30.954273387608765,3,3,3,3_3_3,0,
2026-03-02T08:38:53.443628+00:00,D,training_style,eval,training_style_eval_028,1536,1536,1024,bf16,NVIDIA GeForce RTX 4060,c10,64,128,64,8,3,8,0.0,0.0,157.02400356531143,207.8985652327537,30.771334944279907,3,3,3,3_3_3,0,
2026-03-02T08:38:53.476438+00:00,D,training_style,eval,training_style_eval_029,1024,512,4096,bf16,NVIDIA GeForce RTX 4060,c04,64,64,64,4,3,8,0.0,0.0,150.89599788188934,258.83647426962847,28.463096147598257,3,2,3,3_2_3,0,
2026-03-02T08:38:53.513960+00:00,D,training_style,eval,training_style_eval_030,1024,1024,3072,bf16,NVIDIA GeForce RTX 4060,c10,64,128,64,8,3,8,0.0,0.0,220.15999257564545,322.8467175364494,29.26258703332041,3,3,3,3_3_3,0,
2026-03-02T08:38:53.523926+00:00,D,training_style,eval,training_style_eval_031,1024,1024,512,bf16,NVIDIA GeForce RTX 4060,c03,64,64,32,4,2,8,0.0,0.0,66.56000018119812,114.51743952929972,16.13193841762204,3,3,2,3_3_2,0,
2026-03-02T08:38:53.534392+00:00,D,training_style,eval,training_style_eval_032,512,1024,1024,bf16,NVIDIA GeForce RTX 4060,c06,64,128,32,4,3,8,0.0,0.0,68.60800087451935,96.10239893198006,15.650387860212119,2,3,3,2_3_3,0,
2026-03-02T08:38:53.620169+00:00,D,training_style,eval,training_style_eval_033,3072,2048,2048,bf16,NVIDIA GeForce RTX 4060,c10,64,128,64,8,3,8,0.0,0.0,796.671986579895,847.0985668897629,32.34681802560865,3,3,3,3_3_3,0,
2026-03-02T08:38:53.635926+00:00,D,training_style,eval,training_style_eval_034,1536,1024,512,bf16,NVIDIA GeForce RTX 4060,c03,64,64,32,4,2,8,0.0,0.0,80.27200028300285,147.45215728878975,20.064440032909438,3,3,2,3_3_2,0,
2026-03-02T08:38:54.045313+00:00,D,training_style,eval,training_style_eval_035,4096,4096,4096,bf16,NVIDIA GeForce RTX 4060,c10,64,128,64,8,3,8,0.0,0.0,4255.680084228516,4307.936596870422,32.29541477550124,3,3,3,3_3_3,0,
2026-03-02T08:38:54.278814+00:00,D,training_style,eval,training_style_eval_036,2048,4096,4096,bf16,NVIDIA GeForce RTX 4060,c10,64,128,64,8,3,8,0.0,0.0,2033.6639881134033,2150.399923324585,33.79096897897569,3,3,3,3_3_3,0,
2026-03-02T08:38:54.321141+00:00,D,training_style,eval,training_style_eval_037,4096,2048,512,bf16,NVIDIA GeForce RTX 4060,c03,64,64,32,4,2,8,0.0,0.0,284.67199206352234,311.8387249112129,30.174849762119287,3,3,2,3_3_2,0,
2026-03-02T08:38:54.342140+00:00,D,training_style,eval,training_style_eval_038,2048,1536,512,bf16,NVIDIA GeForce RTX 4060,c03,64,64,32,4,2,8,0.0,0.0,128.09599936008453,137.7382381260395,25.146963902791118,3,3,2,3_3_2,0,
2026-03-02T08:38:54.430421+00:00,D,training_style,eval,training_style_eval_039,3072,3072,1536,bf16,NVIDIA GeForce RTX 4060,c10,64,128,64,8,3,8,0.0,0.0,882.5759887695312,1028.011509180069,32.84819620848589,3,3,3,3_3_3,0,
2026-03-02T08:38:54.446131+00:00,D,training_style,eval,training_style_eval_040,1536,1536,512,bf16,NVIDIA GeForce RTX 4060,c03,64,64,32,4,2,8,0.0,0.0,125.91999769210815,238.256317526102,19.186143172486844,3,3,2,3_3_2,0,
2026-03-02T08:38:54.562607+00:00,D,training_style,eval,training_style_eval_041,3072,3072,2048,bf16,NVIDIA GeForce RTX 4060,c10,64,128,64,8,3,8,0.0,0.0,1184.5920085906982,1306.075210571289,32.63123960289692,3,3,3,3_3_3,0,
2026-03-02T08:38:54.673399+00:00,D,training_style,eval,training_style_eval_042,3072,4096,1536,bf16,NVIDIA GeForce RTX 4060,c10,64,128,64,8,3,8,0.0,0.0,1211.9199633598328,1274.6188807487488,31.89542777795053,3,3,3,3_3_3,0,
2026-03-02T08:38:54.748863+00:00,D,training_style,eval,training_style_eval_043,2048,3072,1536,bf16,NVIDIA GeForce RTX 4060,c10,64,128,64,8,3,8,0.0,0.0,611.376017332077,846.2131154537199,31.612873721054207,3,3,3,3_3_3,0,
2026-03-02T08:38:54.775322+00:00,D,training_style,eval,training_style_eval_044,512,512,4096,bf16,NVIDIA GeForce RTX 4060,c04,64,64,64,4,3,8,0.0,0.0,83.95199850201607,117.1929619461298,25.57989906515959,2,2,3,2_2_3,0,
2026-03-02T08:38:54.835311+00:00,D,training_style,eval,training_style_eval_045,2048,1024,3072,bf16,NVIDIA GeForce RTX 4060,c10,64,128,64,8,3,8,0.0,0.0,405.2959978580475,437.13823437690735,31.791337580670756,3,3,3,3_3_3,0,
2026-03-02T08:38:55.171656+00:00,D,training_style,eval,training_style_eval_046,4096,3072,4096,bf16,NVIDIA GeForce RTX 4060,c10,64,128,64,8,3,8,0.0,0.0,3230.4641008377075,3322.927370071411,31.90848493789794,3,3,3,3_3_3,0,
2026-03-02T08:38:55.217100+00:00,D,training_style,eval,training_style_eval_047,1536,3072,1024,bf16,NVIDIA GeForce RTX 4060,c10,64,128,64,8,3,8,0.0,0.0,301.4559894800186,511.28320187330246,32.05667411906087,3,3,3,3_3_3,0,
2026-03-02T08:38:55.234719+00:00,D,training_style,eval,training_style_eval_048,512,512,3072,bf16,NVIDIA GeForce RTX 4060,c04,64,64,64,4,3,8,0.0,0.0,88.46399933099747,109.99263867735861,18.206420105129105,2,2,3,2_2_3,0,
2026-03-02T08:38:55.264478+00:00,D,training_style,eval,training_style_eval_049,512,1024,4096,bf16,NVIDIA GeForce RTX 4060,c06,64,128,32,4,3,8,0.0,0.0,174.0799993276596,186.8060751259327,24.67237656587911,2,3,3,2_3_3,0,
2026-03-02T08:38:55.287313+00:00,D,training_style,eval,training_style_eval_050,3072,2048,512,bf16,NVIDIA GeForce RTX 4060,c03,64,64,32,4,2,8,0.0,0.0,226.19199752807617,268.2124836742877,28.482223130817562,3,3,2,3_3_2,0,
2026-03-02T08:38:55.295692+00:00,D,training_style,eval,training_style_eval_051,512,512,1024,bf16,NVIDIA GeForce RTX 4060,c04,64,64,64,4,3,8,0.0,0.0,54.27199974656105,118.72703753411767,9.892226461288978,2,2,3,2_2_3,0,
2026-03-02T08:38:55.331921+00:00,D,training_style,eval,training_style_eval_052,1536,2048,1536,bf16,NVIDIA GeForce RTX 4060,c10,64,128,64,8,3,8,0.0,0.0,319.98398900032043,352.0697632431983,30.200499863105097,3,3,3,3_3_3,0,
2026-03-02T08:38:55.432836+00:00,D,training_style,eval,training_style_eval_053,1536,3072,3072,bf16,NVIDIA GeForce RTX 4060,c10,64,128,64,8,3,8,0.0,0.0,876.0640025138855,997.6831942796706,33.09236444461773,3,3,3,3_3_3,0,
2026-03-02T08:38:55.487607+00:00,D,training_style,eval,training_style_eval_054,4096,3072,512,bf16,NVIDIA GeForce RTX 4060,c03,64,64,32,4,2,8,0.0,0.0,418.8160002231598,563.7942397594448,30.765065998277226,3,3,2,3_3_2,0,
2026-03-02T08:38:55.505438+00:00,D,training_style,eval,training_style_eval_055,1024,1024,1024,bf16,NVIDIA GeForce RTX 4060,c10,64,128,64,8,3,8,0.0,0.0,109.51999947428703,223.77471759915352,19.608141511214885,3,3,3,3_3_3,0,
2026-03-02T08:38:55.530183+00:00,D,training_style,eval,training_style_eval_056,512,1024,3072,bf16,NVIDIA GeForce RTX 4060,c06,64,128,32,4,3,8,0.0,0.0,142.33599603176117,157.55487635731697,22.631137321589463,2,3,3,2_3_3,0,
2026-03-02T08:38:55.548326+00:00,D,training_style,eval,training_style_eval_057,1024,1536,1024,bf16,NVIDIA GeForce RTX 4060,c10,64,128,64,8,3,8,0.0,0.0,126.71999633312225,136.2124814093113,25.420024977999716,3,3,3,3_3_3,0,
2026-03-02T08:38:55.661477+00:00,D,training_style,eval,training_style_eval_058,4096,2048,2048,bf16,NVIDIA GeForce RTX 4060,c10,64,128,64,8,3,8,0.0,0.0,1059.8399639129639,1197.4054527282715,32.41974216667837,3,3,3,3_3_3,0,
2026-03-02T08:38:55.688819+00:00,D,training_style,eval,training_style_eval_059,2048,3072,512,bf16,NVIDIA GeForce RTX 4060,c03,64,64,32,4,2,8,0.0,0.0,224.11200404167175,315.942401587963,28.746567911650462,3,3,2,3_3_2,0,
2026-03-02T08:38:55.724765+00:00,D,training_style,eval,training_style_eval_060,3072,3072,512,bf16,NVIDIA GeForce RTX 4060,c03,64,64,32,4,2,8,0.0,0.0,320.46400010585785,396.0332691669464,30.15526365772077,3,3,2,3_3_2,0,
2026-03-02T08:38:55.788908+00:00,D,training_style,eval,training_style_eval_061,2048,2048,2048,bf16,NVIDIA GeForce RTX 4060,c10,64,128,64,8,3,8,0.0,0.0,556.0320019721985,685.4281747341156,30.8972669254008,3,3,3,3_3_3,0,
2026-03-02T08:38:55.802369+00:00,D,training_style,eval,training_style_eval_062,1024,2048,512,bf16,NVIDIA GeForce RTX 4060,c03,64,64,32,4,2,8,0.0,0.0,96.25600278377533,112.67712041735646,22.310127014353586,3,3,2,3_3_2,0,
2026-03-02T08:38:55.922497+00:00,D,training_style,eval,training_style_eval_063,3072,1536,3072,bf16,NVIDIA GeForce RTX 4060,c10,64,128,64,8,3,8,0.0,0.0,882.064014673233,955.961917042732,32.86726220062377,3,3,3,3_3_3,0,
2026-03-02T08:38:55.933781+00:00,D,adversarial,tune,adversarial_tune_000,1,1024,1024,bf16,NVIDIA GeForce RTX 4060,c11,32,128,32,4,2,8,0.0,0.0,18.432000651955605,129.20831888914105,0.11377777375336061,0,3,3,0_3_3,0,
2026-03-02T08:38:55.953151+00:00,D,adversarial,tune,adversarial_tune_001,1,1024,4096,bf16,NVIDIA GeForce RTX 4060,c11,32,128,32,4,2,8,0.0,0.0,77.63200253248215,84.82143737375736,0.10805605583200184,0,3,3,0_3_3,0,
2026-03-02T08:38:55.969538+00:00,D,adversarial,tune,adversarial_tune_002,1,4096,1024,bf16,NVIDIA GeForce RTX 4060,c11,32,128,32,4,2,8,0.0,0.0,40.36800004541874,112.0051205158233,0.2078034084067041,0,3,3,0_3_3,0,
2026-03-02T08:38:56.051028+00:00,D,adversarial,tune,adversarial_tune_003,1,4096,4096,bf16,NVIDIA GeForce RTX 4060,c11,32,128,32,4,2,8,0.0,0.0,160.5599969625473,226.06174990534765,0.20898376080454836,0,3,3,0_3_3,0,
2026-03-02T08:38:56.092354+00:00,D,adversarial,tune,adversarial_tune_004,1,8192,1024,bf16,NVIDIA GeForce RTX 4060,c11,32,128,32,4,2,8,0.0,0.0,56.33600056171417,256.69888734817476,0.2978063020576182,0,3,3,0_3_3,0,
2026-03-02T08:38:56.259098+00:00,D,adversarial,tune,adversarial_tune_005,1,8192,4096,bf16,NVIDIA GeForce RTX 4060,c11,32,128,32,4,2,8,0.0,0.0,314.4160062074661,412.34016567468643,0.21343971895539723,0,3,3,0_3_3,0,
2026-03-02T08:38:56.271635+00:00,D,adversarial,tune,adversarial_tune_006,2,1024,1024,bf16,NVIDIA GeForce RTX 4060,c11,32,128,32,4,2,8,0.0,0.0,62.47999891638756,143.14495980739588,0.06713034687489243,0,3,3,0_3_3,0,
2026-03-02T08:38:56.295415+00:00,D,adversarial,tune,adversarial_tune_007,2,1024,4096,bf16,NVIDIA GeForce RTX 4060,c11,32,128,32,4,2,8,0.0,0.0,79.8719972372055,126.90047658979881,0.21005128931701406,0,3,3,0_3_3,0,
2026-03-02T08:38:56.316094+00:00,D,adversarial,tune,adversarial_tune_008,2,4096,1024,bf16,NVIDIA GeForce RTX 4060,c11,32,128,32,4,2,8,0.0,0.0,65.5359998345375,152.32351988553995,0.2560000006463379,0,3,3,0_3_3,0,
2026-03-02T08:38:56.403809+00:00,D,adversarial,tune,adversarial_tune_009,2,4096,4096,bf16,NVIDIA GeForce RTX 4060,c11,32,128,32,4,2,8,0.0,0.0,165.55199772119522,262.9324756562709,0.4053642657518244,0,3,3,0_3_3,0,
2026-03-02T08:38:56.445710+00:00,D,adversarial,tune,adversarial_tune_010,2,8192,1024,bf16,NVIDIA GeForce RTX 4060,c11,32,128,32,4,2,8,0.0,0.0,50.175998359918594,100.03679595887647,0.668734715736196,0,3,3,0_3_3,0,
2026-03-02T08:38:56.606280+00:00,D,adversarial,tune,adversarial_tune_011,2,8192,4096,bf16,NVIDIA GeForce RTX 4060,c11,32,128,32,4,2,8,0.0,0.0,294.9120104312897,377.3849684000014,0.45511109501344243,0,3,3,0_3_3,0,
2026-03-02T08:38:56.615028+00:00,D,adversarial,tune,adversarial_tune_012,4,1024,1024,bf16,NVIDIA GeForce RTX 4060,c11,32,128,32,4,2,8,0.0,0.0,45.04000023007393,137.58559733629218,0.18624795641983127,0,3,3,0_3_3,0,
2026-03-02T08:38:56.634918+00:00,D,adversarial,tune,adversarial_tune_013,4,1024,4096,bf16,NVIDIA GeForce RTX 4060,c11,32,128,32,4,2,8,0.0,0.0,78.59200239181519,119.31648299098005,0.42694461241382575,0,3,3,0_3_3,0,
2026-03-02T08:38:56.652994+00:00,D,adversarial,tune,adversarial_tune_014,4,4096,1024,bf16,NVIDIA GeForce RTX 4060,c11,32,128,32,4,2,8,0.0,0.0,47.600001096725464,169.70751404762262,0.7049250257750163,0,3,3,0_3_3,0,
2026-03-02T08:38:56.738644+00:00,D,adversarial,tune,adversarial_tune_015,4,4096,4096,bf16,NVIDIA GeForce RTX 4060,c11,32,128,32,4,2,8,0.0,0.0,163.34400326013565,308.7174439430233,0.8216875142104225,0,3,3,0_3_3,0,
2026-03-02T08:38:56.798348+00:00,D,adversarial,tune,adversarial_tune_016,4,8192,1024,bf16,NVIDIA GeForce RTX 4060,c11,32,128,32,4,2,8,0.0,0.0,53.247999399900436,176.44223883748043,1.2603077065112325,0,3,3,0_3_3,0,
2026-03-02T08:38:56.975185+00:00,D,adversarial,tune,adversarial_tune_017,4,8192,4096,bf16,NVIDIA GeForce RTX 4060,c11,32,128,32,4,2,8,0.0,0.0,294.9120104312897,322.21120059490204,0.9102221900268849,0,3,3,0_3_3,0,
2026-03-02T08:38:56.985867+00:00,D,adversarial,tune,adversarial_tune_018,8,1024,1024,bf16,NVIDIA GeForce RTX 4060,c11,32,128,32,4,2,8,0.0,0.0,68.79999861121178,172.0972791314125,0.2438548886433546,0,3,3,0_3_3,0,
2026-03-02T08:38:57.006877+00:00,D,adversarial,tune,adversarial_tune_019,8,1024,4096,bf16,NVIDIA GeForce RTX 4060,c11,32,128,32,4,2,8,0.0,0.0,86.60800009965897,175.65919935703278,0.7748575642293841,0,3,3,0_3_3,0,
2026-03-02T08:38:57.025784+00:00,D,adversarial,tune,adversarial_tune_020,8,4096,1024,bf16,NVIDIA GeForce RTX 4060,c11,32,128,32,4,2,8,0.0,0.0,47.34399914741516,158.73760417103765,1.4174734962934354,0,3,3,0_3_3,0,
2026-03-02T08:38:57.110517+00:00,D,adversarial,tune,adversarial_tune_021,8,4096,4096,bf16,NVIDIA GeForce RTX 4060,c11,32,128,32,4,2,8,0.0,0.0,161.79199516773224,233.27360391616804,1.6591392900601099,0,3,3,0_3_3,0,
2026-03-02T08:38:57.154462+00:00,D,adversarial,tune,adversarial_tune_022,8,8192,1024,bf16,NVIDIA GeForce RTX 4060,c11,32,128,32,4,2,8,0.0,0.0,50.52799917757511,54.33952011168003,2.656304033102647,0,3,3,0_3_3,0,
2026-03-02T08:38:57.315752+00:00,D,adversarial,tune,adversarial_tune_023,8,8192,4096,bf16,NVIDIA GeForce RTX 4060,c11,32,128,32,4,2,8,0.0,0.0,295.6800013780594,451.08607918024063,1.8157160088536104,0,3,3,0_3_3,0,
2026-03-02T08:38:57.328935+00:00,D,adversarial,tune,adversarial_tune_024,16,1024,1024,bf16,NVIDIA GeForce RTX 4060,c11,32,128,32,4,2,8,0.0,0.0,41.87199845910072,139.3126409500834,0.8013573088176084,0,3,3,0_3_3,0,
2026-03-02T08:38:57.351361+00:00,D,adversarial,tune,adversarial_tune_025,16,1024,4096,bf16,NVIDIA GeForce RTX 4060,c11,32,128,32,4,2,8,0.0,0.0,84.99199897050858,99.87072020769119,1.579180742019873,0,3,3,0_3_3,0,
2026-03-02T08:38:57.369693+00:00,D,adversarial,tune,adversarial_tune_026,16,4096,1024,bf16,NVIDIA GeForce RTX 4060,c11,32,128,32,4,2,8,0.0,0.0,40.94399884343147,375.21407902240685,3.2780805927932017,0,3,3,0_3_3,0,
2026-03-02T08:38:57.452717+00:00,D,adversarial,tune,adversarial_tune_027,16,4096,4096,bf16,NVIDIA GeForce RTX 4060,c11,32,128,32,4,2,8,0.0,0.0,165.8879965543747,317.99968242645264,3.236345746233813,0,3,3,0_3_3,0,
2026-03-02T08:38:57.495857+00:00,D,adversarial,tune,adversarial_tune_028,16,8192,1024,bf16,NVIDIA GeForce RTX 4060,c11,32,128,32,4,2,8,0.0,0.0,49.96800050139427,66.20160188525912,5.372147240362555,0,3,3,0_3_3,0,
2026-03-02T08:38:57.676195+00:00,D,adversarial,tune,adversarial_tune_029,16,8192,4096,bf16,NVIDIA GeForce RTX 4060,c11,32,128,32,4,2,8,0.0,0.0,494.59201097488403,590.4969424009323,2.170964755139415,0,3,3,0_3_3,0,
2026-03-02T08:38:57.687590+00:00,D,adversarial,tune,adversarial_tune_030,32,1024,1024,bf16,NVIDIA GeForce RTX 4060,c11,32,128,32,4,2,8,0.0,0.0,75.77600330114365,156.14431664347637,0.8856215830399591,0,3,3,0_3_3,0,
2026-03-02T08:38:57.711392+00:00,D,adversarial,tune,adversarial_tune_031,32,1024,4096,bf16,NVIDIA GeForce RTX 4060,c11,32,128,32,4,2,8,0.0,0.0,126.97599828243256,289.7129601240157,2.1140645447253688,0,3,3,0_3_3,0,
2026-03-02T08:38:57.722685+00:00,D,adversarial,eval,adversarial_eval_000,1,1024,1024,bf16,NVIDIA GeForce RTX 4060,c11,32,128,32,4,2,8,0.0,0.0,74.08000156283379,119.69824247062206,0.028309286659790635,0,3,3,0_3_3,0,
2026-03-02T08:38:57.750442+00:00,D,adversarial,eval,adversarial_eval_001,1,1024,4096,bf16,NVIDIA GeForce RTX 4060,c11,32,128,32,4,2,8,0.0,0.0,120.83200365304947,292.6163247227666,0.06942372671470878,0,3,3,0_3_3,0,
2026-03-02T08:38:57.769895+00:00,D,adversarial,eval,adversarial_eval_002,1,4096,1024,bf16,NVIDIA GeForce RTX 4060,c11,32,128,32,4,2,8,0.0,0.0,61.93599849939346,364.4579115509979,0.13543994128200176,0,3,3,0_3_3,0,
2026-03-02T08:38:57.858120+00:00,D,adversarial,eval,adversarial_eval_003,1,4096,4096,bf16,NVIDIA GeForce RTX 4060,c11,32,128,32,4,2,8,0.0,0.0,251.90401077270508,328.89855563640583,0.13320324633606737,0,3,3,0_3_3,0,
2026-03-02T08:38:57.901335+00:00,D,adversarial,eval,adversarial_eval_004,1,8192,1024,bf16,NVIDIA GeForce RTX 4060,c11,32,128,32,4,2,8,0.0,0.0,105.45599833130836,173.40480521321285,0.1590920977988512,0,3,3,0_3_3,0,
2026-03-02T08:38:58.072939+00:00,D,adversarial,eval,adversarial_eval_005,1,8192,4096,bf16,NVIDIA GeForce RTX 4060,c11,32,128,32,4,2,8,0.0,0.0,472.79998660087585,600.6476932764053,0.14193922568075573,0,3,3,0_3_3,0,
2026-03-02T08:38:58.083641+00:00,D,adversarial,eval,adversarial_eval_006,2,1024,1024,bf16,NVIDIA GeForce RTX 4060,c11,32,128,32,4,2,8,0.0,0.0,50.6879985332489,175.39071962237352,0.08274747714192617,0,3,3,0_3_3,0,
2026-03-02T08:38:58.106164+00:00,D,adversarial,eval,adversarial_eval_007,2,1024,4096,bf16,NVIDIA GeForce RTX 4060,c11,32,128,32,4,2,8,0.0,0.0,124.92799758911133,143.36000382900238,0.1342950845588699,0,3,3,0_3_3,0,
2026-03-02T08:38:58.123051+00:00,D,adversarial,eval,adversarial_eval_008,2,4096,1024,bf16,NVIDIA GeForce RTX 4060,c11,32,128,32,4,2,8,0.0,0.0,54.06400002539158,108.63615557551373,0.31032139671723236,0,3,3,0_3_3,0,
2026-03-02T08:38:58.220284+00:00,D,adversarial,eval,adversarial_eval_009,2,4096,4096,bf16,NVIDIA GeForce RTX 4060,c11,32,128,32,4,2,8,0.0,0.0,279.55201268196106,393.89599859714485,0.24005859716827715,0,3,3,0_3_3,0,
2026-03-02T08:38:58.264134+00:00,D,adversarial,eval,adversarial_eval_010,2,8192,1024,bf16,NVIDIA GeForce RTX 4060,c11,32,128,32,4,2,8,0.0,0.0,103.42399775981903,197.13024333119392,0.32443565059168633,0,3,3,0_3_3,0,
2026-03-02T08:38:58.433670+00:00,D,adversarial,eval,adversarial_eval_011,2,8192,4096,bf16,NVIDIA GeForce RTX 4060,c11,32,128,32,4,2,8,0.0,0.0,470.4640060663223,558.3792090415952,0.2852879843502396,0,3,3,0_3_3,0,
2026-03-02T08:38:58.443174+00:00,D,adversarial,eval,adversarial_eval_012,4,1024,1024,bf16,NVIDIA GeForce RTX 4060,c11,32,128,32,4,2,8,0.0,0.0,54.27199974656105,85.98527915775766,0.15456603845764028,0,3,3,0_3_3,0,
2026-03-02T08:38:58.467466+00:00,D,adversarial,eval,adversarial_eval_013,4,1024,4096,bf16,NVIDIA GeForce RTX 4060,c11,32,128,32,4,2,8,0.0,0.0,141.1679983139038,206.90559506416318,0.23769149099491896,0,3,3,0_3_3,0,
2026-03-02T08:38:58.485475+00:00,D,adversarial,eval,adversarial_eval_014,4,4096,1024,bf16,NVIDIA GeForce RTX 4060,c11,32,128,32,4,2,8,0.0,0.0,57.34400078654289,71.68000191450119,0.5851428491169093,0,3,3,0_3_3,0,
2026-03-02T08:38:58.573257+00:00,D,adversarial,eval,adversarial_eval_015,4,4096,4096,bf16,NVIDIA GeForce RTX 4060,c11,32,128,32,4,2,8,0.0,0.0,252.9279887676239,301.23232096433634,0.5306558940114443,0,3,3,0_3_3,0,
2026-03-02T08:38:58.622674+00:00,D,adversarial,eval,adversarial_eval_016,4,8192,1024,bf16,NVIDIA GeForce RTX 4060,c11,32,128,32,4,2,8,0.0,0.0,60.15999987721443,176.4400036633014,1.1155063852554536,0,3,3,0_3_3,0,
2026-03-02T08:38:58.795818+00:00,D,adversarial,eval,adversarial_eval_017,4,8192,4096,bf16,NVIDIA GeForce RTX 4060,c11,32,128,32,4,2,8,0.0,0.0,476.1599898338318,526.9299194216727,0.5637505496706631,0,3,3,0_3_3,0,
2026-03-02T08:38:58.807131+00:00,D,adversarial,eval,adversarial_eval_018,8,1024,1024,bf16,NVIDIA GeForce RTX 4060,c11,32,128,32,4,2,8,0.0,0.0,80.73600009083748,108.67136202752584,0.2078034084067041,0,3,3,0_3_3,0,
2026-03-02T08:38:58.832554+00:00,D,adversarial,eval,adversarial_eval_019,8,1024,4096,bf16,NVIDIA GeForce RTX 4060,c11,32,128,32,4,2,8,0.0,0.0,145.37600427865982,179.40480098128313,0.4616227026804527,0,3,3,0_3_3,0,
2026-03-02T08:38:58.850870+00:00,D,adversarial,eval,adversarial_eval_020,8,4096,1024,bf16,NVIDIA GeForce RTX 4060,c11,32,128,32,4,2,8,0.0,0.0,62.463998794555664,110.80544307827942,1.0743606764709592,0,3,3,0_3_3,0,
2026-03-02T08:38:58.952248+00:00,D,adversarial,eval,adversarial_eval_021,8,4096,4096,bf16,NVIDIA GeForce RTX 4060,c11,32,128,32,4,2,8,0.0,0.0,256.8800002336502,395.8438429236412,1.044983867003423,0,3,3,0_3_3,0,
2026-03-02T08:38:58.999731+00:00,D,adversarial,eval,adversarial_eval_022,8,8192,1024,bf16,NVIDIA GeForce RTX 4060,c11,32,128,32,4,2,8,0.0,0.0,94.57600116729736,183.56191933155054,1.4191520718092068,0,3,3,0_3_3,0,
2026-03-02T08:38:59.179296+00:00,D,adversarial,eval,adversarial_eval_023,8,8192,4096,bf16,NVIDIA GeForce RTX 4060,c11,32,128,32,4,2,8,0.0,0.0,475.13601183891296,632.6614671945571,1.1299310063283885,0,3,3,0_3_3,0,
2026-03-02T08:38:59.188651+00:00,D,adversarial,eval,adversarial_eval_024,16,1024,1024,bf16,NVIDIA GeForce RTX 4060,c11,32,128,32,4,2,8,0.0,0.0,61.43999844789505,129.89024303853506,0.5461333471298221,0,3,3,0_3_3,0,
2026-03-02T08:38:59.214232+00:00,D,adversarial,eval,adversarial_eval_025,16,1024,4096,bf16,NVIDIA GeForce RTX 4060,c11,32,128,32,4,2,8,0.0,0.0,150.01600235700607,220.03711208701117,0.8946894057381322,0,3,3,0_3_3,0,
2026-03-02T08:38:59.234787+00:00,D,adversarial,eval,adversarial_eval_026,16,4096,1024,bf16,NVIDIA GeForce RTX 4060,c11,32,128,32,4,2,8,0.0,0.0,72.7040022611618,151.11168265342712,1.8460844496273157,0,3,3,0_3_3,0,
2026-03-02T08:38:59.326313+00:00,D,adversarial,eval,adversarial_eval_027,16,4096,4096,bf16,NVIDIA GeForce RTX 4060,c11,32,128,32,4,2,8,0.0,0.0,255.92000782489777,271.90271884202957,2.0978075007223773,0,3,3,0_3_3,0,
2026-03-02T08:38:59.368910+00:00,D,adversarial,eval,adversarial_eval_028,16,8192,1024,bf16,NVIDIA GeForce RTX 4060,c11,32,128,32,4,2,8,0.0,0.0,92.16000139713287,245.64735725522033,2.9127110669548135,0,3,3,0_3_3,0,
2026-03-02T08:38:59.539825+00:00,D,adversarial,eval,adversarial_eval_029,16,8192,4096,bf16,NVIDIA GeForce RTX 4060,c11,32,128,32,4,2,8,0.0,0.0,475.13601183891296,551.2812942266463,2.259862012656777,0,3,3,0_3_3,0,
2026-03-02T08:38:59.553720+00:00,D,adversarial,eval,adversarial_eval_030,32,1024,1024,bf16,NVIDIA GeForce RTX 4060,c11,32,128,32,4,2,8,0.0,0.0,65.5359998345375,95.05791857838625,1.0240000025853515,0,3,3,0_3_3,0,
2026-03-02T08:38:59.580782+00:00,D,adversarial,eval,adversarial_eval_031,32,1024,4096,bf16,NVIDIA GeForce RTX 4060,c11,32,128,32,4,2,8,0.0,0.0,172.46399819850922,230.49567505717266,1.5564724162954051,0,3,3,0_3_3,0,
2026-03-02T08:38:59.600242+00:00,D,adversarial,eval,adversarial_eval_032,32,4096,1024,bf16,NVIDIA GeForce RTX 4060,c11,32,128,32,4,2,8,0.0,0.0,73.72800260782242,137.56416171789164,3.6408887601075395,0,3,3,0_3_3,0,
2026-03-02T08:38:59.692357+00:00,D,adversarial,eval,adversarial_eval_033,32,4096,4096,bf16,NVIDIA GeForce RTX 4060,c11,32,128,32,4,2,8,0.0,0.0,260.09601354599,281.1596745252609,4.128251753501565,0,3,3,0_3_3,0,
2026-03-02T08:38:59.741885+00:00,D,adversarial,eval,adversarial_eval_034,32,8192,1024,bf16,NVIDIA GeForce RTX 4060,c11,32,128,32,4,2,8,0.0,0.0,102.86399722099304,201.5129648149013,5.219230503424695,0,3,3,0_3_3,0,
2026-03-02T08:38:59.917023+00:00,D,adversarial,eval,adversarial_eval_035,32,8192,4096,bf16,NVIDIA GeForce RTX 4060,c11,32,128,32,4,2,8,0.0,0.0,475.0880002975464,574.6892952919004,4.520180780518633,0,3,3,0_3_3,0,
2026-03-02T08:39:00.135509+00:00,D,adversarial,eval,adversarial_eval_036,1024,1,512,bf16,NVIDIA GeForce RTX 4060,c00,32,32,32,2,2,8,0.0,0.0,51.19999870657921,63.89119993895291,0.020480000517368327,3,0,2,3_0_2,0,
2026-03-02T08:39:00.156209+00:00,D,adversarial,eval,adversarial_eval_037,1024,1,2048,bf16,NVIDIA GeForce RTX 4060,c00,32,32,32,2,2,8,0.0,0.0,117.76000261306763,1043.2211008667916,0.035617390514006024,3,0,3,3_0_3,0,
2026-03-02T08:39:00.165240+00:00,D,adversarial,eval,adversarial_eval_038,2048,1,512,bf16,NVIDIA GeForce RTX 4060,c00,32,32,32,2,2,8,0.0,0.0,54.06400002539158,165.89824005961407,0.038790174589654045,3,0,2,3_0_2,0,
2026-03-02T08:39:00.187202+00:00,D,adversarial,eval,adversarial_eval_039,2048,1,2048,bf16,NVIDIA GeForce RTX 4060,c00,32,32,32,2,2,8,0.0,0.0,118.76800283789635,174.5996747910976,0.07063020173412711,3,0,3,3_0_3,0,
2026-03-02T08:39:00.200471+00:00,D,adversarial,eval,adversarial_eval_040,4096,1,512,bf16,NVIDIA GeForce RTX 4060,c00,32,32,32,2,2,8,0.0,0.0,62.33599781990051,160.8905591070652,0.06728542329775598,3,0,2,3_0_2,0,
2026-03-02T08:39:00.247715+00:00,D,adversarial,eval,adversarial_eval_041,4096,1,2048,bf16,NVIDIA GeForce RTX 4060,c00,32,32,32,2,2,8,0.0,0.0,155.008003115654,177.2953604161739,0.10823451475264956,3,0,3,3_0_3,0,
2026-03-02T08:39:00.394176+00:00,D,adversarial,eval,adversarial_eval_042,1024,2,512,bf16,NVIDIA GeForce RTX 4060,c00,32,32,32,2,2,8,0.0,0.0,63.48799914121628,139.83135506510735,0.03303225851133389,3,0,2,3_0_2,0,
2026-03-02T08:39:00.419129+00:00,D,adversarial,eval,adversarial_eval_043,1024,2,2048,bf16,NVIDIA GeForce RTX 4060,c00,32,32,32,2,2,8,0.0,0.0,163.82399946451187,324.45792496204365,0.05120500065570167,3,0,3,3_0_3,0,
2026-03-02T08:39:00.429476+00:00,D,adversarial,eval,adversarial_eval_044,2048,2,512,bf16,NVIDIA GeForce RTX 4060,c00,32,32,32,2,2,8,0.0,0.0,65.95199927687645,130.27328304946417,0.0635963131669698,3,0,2,3_0_2,0,
2026-03-02T08:39:00.455240+00:00,D,adversarial,eval,adversarial_eval_045,2048,2,2048,bf16,NVIDIA GeForce RTX 4060,c00,32,32,32,2,2,8,0.0,0.0,171.00800573825836,262.53311932086933,0.09810778113908242,3,0,3,3_0_3,0,
2026-03-02T08:39:00.468979+00:00,D,adversarial,eval,adversarial_eval_046,4096,2,512,bf16,NVIDIA GeForce RTX 4060,c00,32,32,32,2,2,8,0.0,0.0,76.80000364780426,137.20575779676426,0.10922666147867861,3,0,2,3_0_2,0,
2026-03-02T08:39:00.518491+00:00,D,adversarial,eval,adversarial_eval_047,4096,2,2048,bf16,NVIDIA GeForce RTX 4060,c00,32,32,32,2,2,8,0.0,0.0,183.20000171661377,265.5846479535102,0.18315737819644937,3,0,3,3_0_3,0,
2026-03-02T08:39:00.530999+00:00,D,adversarial,eval,adversarial_eval_048,1024,4,512,bf16,NVIDIA GeForce RTX 4060,c00,32,32,32,2,2,8,0.0,0.0,67.53600016236305,78.84799689054489,0.06210471437331925,3,0,2,3_0_2,0,
2026-03-02T08:39:00.549476+00:00,D,adversarial,eval,adversarial_eval_049,1024,4,2048,bf16,NVIDIA GeForce RTX 4060,c00,32,32,32,2,2,8,0.0,0.0,164.86400365829468,204.3017613887787,0.10176397289716008,3,0,3,3_0_3,0,
2026-03-02T08:39:00.558537+00:00,D,adversarial,eval,adversarial_eval_050,2048,4,512,bf16,NVIDIA GeForce RTX 4060,c00,32,32,32,2,2,8,0.0,0.0,62.463998794555664,90.42336054146284,0.1342950845588699,3,0,2,3_0_2,0,
2026-03-02T08:39:00.584597+00:00,D,adversarial,eval,adversarial_eval_051,2048,4,2048,bf16,NVIDIA GeForce RTX 4060,c00,32,32,32,2,2,8,0.0,0.0,165.8879965543747,266.15200385451294,0.2022716091396133,3,0,3,3_0_3,0,
2026-03-02T08:39:00.599786+00:00,D,adversarial,eval,adversarial_eval_052,4096,4,512,bf16,NVIDIA GeForce RTX 4060,c00,32,32,32,2,2,8,0.0,0.0,86.01599931716919,152.48607881367187,0.19504762059598826,3,0,2,3_0_2,0,
2026-03-02T08:39:00.650707+00:00,D,adversarial,eval,adversarial_eval_053,4096,4,2048,bf16,NVIDIA GeForce RTX 4060,c00,32,32,32,2,2,8,0.0,0.0,197.40799814462662,261.16096645593643,0.3399500761404519,3,0,3,3_0_3,0,
2026-03-02T08:39:00.659750+00:00,D,adversarial,eval,adversarial_eval_054,1024,8,512,bf16,NVIDIA GeForce RTX 4060,c00,32,32,32,2,2,8,0.0,0.0,48.99200052022934,136.83712527155873,0.17122403475923073,3,0,2,3_0_2,0,
2026-03-02T08:39:00.678968+00:00,D,adversarial,eval,adversarial_eval_055,1024,8,2048,bf16,NVIDIA GeForce RTX 4060,c00,32,32,32,2,2,8,0.0,0.0,177.12000012397766,184.17887806892395,0.18944462498031334,3,0,3,3_0_3,0,
2026-03-02T08:39:00.689982+00:00,D,adversarial,eval,adversarial_eval_056,2048,8,512,bf16,NVIDIA GeForce RTX 4060,c00,32,32,32,2,2,8,0.0,0.0,89.08800035715103,173.06271761655793,0.18832183832548333,3,0,2,3_0_2,0,
2026-03-02T08:39:00.716367+00:00,D,adversarial,eval,adversarial_eval_057,2048,8,2048,bf16,NVIDIA GeForce RTX 4060,c00,32,32,32,2,2,8,0.0,0.0,184.31999534368515,214.36159953474996,0.3640888980865481,3,0,3,3_0_3,0,
2026-03-02T08:39:00.731030+00:00,D,adversarial,eval,adversarial_eval_058,4096,8,512,bf16,NVIDIA GeForce RTX 4060,c00,32,32,32,2,2,8,0.0,0.0,79.8719972372055,185.97728252410883,0.4201025786340281,3,0,2,3_0_2,0,
2026-03-02T08:39:00.781597+00:00,D,adversarial,eval,adversarial_eval_059,4096,8,2048,bf16,NVIDIA GeForce RTX 4060,c00,32,32,32,2,2,8,0.0,0.0,205.1519975066185,226.48832216858858,0.6542355406296736,3,0,3,3_0_3,0,
2026-03-02T08:39:00.810214+00:00,D,adversarial,eval,adversarial_eval_060,64,64,8192,bf16,NVIDIA GeForce RTX 4060,c04,64,64,64,4,3,8,0.0,0.0,279.5040011405945,338.0633553862572,0.24009983301184762,1,1,3,1_1_3,0,
2026-03-02T08:39:00.839187+00:00,D,adversarial,eval,adversarial_eval_061,128,128,8192,bf16,NVIDIA GeForce RTX 4060,c04,64,64,64,4,3,8,0.0,0.0,279.55201268196106,362.2604796290397,0.9602343886731086,1,1,3,1_1_3,0,
2026-03-02T08:39:00.989788+00:00,D,adversarial,eval,adversarial_eval_062,2048,128,8192,bf16,NVIDIA GeForce RTX 4060,c04,64,64,64,4,3,8,0.0,0.0,658.4320068359375,741.9289726018905,6.523023260426316,3,1,3,3_1_3,0,
2026-03-02T08:39:01.114975+00:00,D,adversarial,eval,adversarial_eval_063,128,2048,8192,bf16,NVIDIA GeForce RTX 4060,c04,64,64,64,4,3,8,0.0,0.0,689.0240013599396,768.1023991107938,6.233407381343672,1,3,3,1_3_3,0,
2026-03-02T08:39:04.757029+00:00,B,uniform,tune,uniform_tune_000,1536,512,1024,bf16,NVIDIA GeForce RTX 4060,c06,64,128,32,4,3,8,185.26293500326574,2568.556,85.32799780368805,155.28959996998287,18.875548207582412,3,2,3,3_2_3,0,
2026-03-02T08:39:05.091301+00:00,B,uniform,tune,uniform_tune_001,1536,1536,2048,bf16,NVIDIA GeForce RTX 4060,c10,64,128,64,8,3,8,0.0,334.232,320.25599479675293,326.6764786839485,30.174849411118593,3,3,3,3_3_3,0,
2026-03-02T08:39:05.227055+00:00,B,uniform,tune,uniform_tune_002,384,2048,1536,bf16,NVIDIA GeForce RTX 4060,c11,32,128,32,4,2,8,0.0,135.711,112.64000087976456,118.28224278986454,21.44814528702665,2,3,3,2_3_3,0,
2026-03-02T08:39:05.320290+00:00,B,uniform,tune,uniform_tune_003,1536,64,3072,bf16,NVIDIA GeForce RTX 4060,c04,64,64,64,4,3,8,0.0,93.189,56.17599934339523,67.88959890604019,10.751562643469226,3,1,3,3_1_3,0,
2026-03-02T08:39:05.332812+00:00,B,uniform,tune,uniform_tune_004,768,128,2048,bf16,NVIDIA GeForce RTX 4060,c04,64,64,64,4,3,8,0.0,0.0,44.88000087440014,126.38879701495169,8.97177308723441,3,1,3,3_1_3,0,
2026-03-02T08:39:05.416568+00:00,B,uniform,tune,uniform_tune_005,512,128,4096,bf16,NVIDIA GeForce RTX 4060,c04,64,64,64,4,3,8,0.0,83.716,59.39200147986412,127.19104185700402,9.039448050627108,2,1,3,2_1_3,0,
2026-03-02T08:39:05.507533+00:00,B,uniform,tune,uniform_tune_006,2048,1024,4096,bf16,NVIDIA GeForce RTX 4060,c10,64,128,64,8,3,8,0.0,0.0,553.9839863777161,681.8617588281631,31.01149059620374,3,3,3,3_3_3,0,
2026-03-02T08:39:05.554432+00:00,B,uniform,tune,uniform_tune_007,128,768,512,bf16,NVIDIA GeForce RTX 4060,c04,64,64,64,4,3,8,0.0,46.841,34.591998904943466,44.072960019111626,2.9100167433693587,1,3,2,1_3_2,0,
2026-03-02T08:39:05.613093+00:00,B,uniform,tune,uniform_tune_008,2048,256,64,bf16,NVIDIA GeForce RTX 4060,c11,32,128,32,4,2,8,0.0,58.626,35.840000957250595,87.67136186361296,1.8724570928456843,3,2,1,3_2_1,0,
2026-03-02T08:39:05.627512+00:00,B,uniform,tune,uniform_tune_009,192,768,2048,bf16,NVIDIA GeForce RTX 4060,c11,32,128,32,4,2,8,0.0,0.0,76.80000364780426,128.21823984384537,7.864319626464861,2,3,3,2_3_3,0,
2026-03-02T08:39:05.649684+00:00,B,uniform,tune,uniform_tune_010,1024,1024,1536,bf16,NVIDIA GeForce RTX 4060,c10,64,128,64,8,3,8,0.0,0.0,141.31200313568115,213.53695720434186,22.795129928963856,3,3,3,3_3_3,0,
2026-03-02T08:39:05.708056+00:00,B,uniform,tune,uniform_tune_011,256,384,768,bf16,NVIDIA GeForce RTX 4060,c04,64,64,64,4,3,8,0.0,58.323,38.91199827194214,67.04000189900393,3.880421224958686,2,2,3,2_2_3,0,
2026-03-02T08:39:05.765416+00:00,B,uniform,tune,uniform_tune_012,64,192,2048,bf16,NVIDIA GeForce RTX 4060,c00,32,32,32,2,2,8,0.0,57.317,44.03200000524521,100.9871998429297,1.143069767305695,1,2,3,1_2_3,0,
2026-03-02T08:39:05.821440+00:00,B,uniform,tune,uniform_tune_013,192,128,512,bf16,NVIDIA GeForce RTX 4060,c00,32,32,32,2,2,8,0.0,55.989,34.81600061058998,66.72127917408937,0.7228235167351563,2,1,2,2_1_2,0,
2026-03-02T08:39:05.874888+00:00,B,uniform,tune,uniform_tune_014,128,128,1024,bf16,NVIDIA GeForce RTX 4060,c04,64,64,64,4,3,8,0.0,53.418,36.86400130391121,63.03072024136779,0.9102221900268849,1,1,3,1_1_3,0,
2026-03-02T08:39:05.920024+00:00,B,uniform,tune,uniform_tune_015,3072,3072,768,bf16,NVIDIA GeForce RTX 4060,c10,64,128,64,8,3,8,0.0,0.0,473.80800545215607,609.7129637002945,30.593646492247206,3,3,3,3_3_3,0,
2026-03-02T08:39:05.929065+00:00,B,uniform,tune,uniform_tune_016,256,128,3072,bf16,NVIDIA GeForce RTX 4060,c04,64,64,64,4,3,8,0.0,0.0,50.175998359918594,73.4310387074947,4.012408294417177,2,1,3,2_1_3,0,
2026-03-02T08:39:05.934920+00:00,B,uniform,tune,uniform_tune_017,96,1024,192,bf16,NVIDIA GeForce RTX 4060,c04,64,64,64,4,3,8,0.0,0.0,32.76799991726875,116.47871837019915,1.1520000029085202,1,3,2,1_3_2,0,
2026-03-02T08:39:05.973970+00:00,B,uniform,tune,uniform_tune_018,64,64,192,bf16,NVIDIA GeForce RTX 4060,c11,32,128,32,4,2,8,0.0,39.026,29.69600073993206,41.742079220712185,0.05296551592164321,1,1,2,1_1_2,0,
2026-03-02T08:39:06.024621+00:00,B,uniform,tune,uniform_tune_019,4096,64,64,bf16,NVIDIA GeForce RTX 4060,c09,128,64,64,8,3,8,0.0,50.625,33.79200026392937,60.403518974780965,0.9929696892141969,3,1,1,3_1_1,0,
2026-03-02T08:39:06.209670+00:00,B,uniform,tune,uniform_tune_020,128,4096,3072,bf16,NVIDIA GeForce RTX 4060,c06,64,128,32,4,3,8,0.0,185.016,138.11199367046356,181.64127781987185,23.323285591589332,1,3,3,1_3_3,0,
2026-03-02T08:39:06.251426+00:00,B,uniform,tune,uniform_tune_021,192,2048,3072,bf16,NVIDIA GeForce RTX 4060,c11,32,128,32,4,2,8,0.0,0.0,114.6400012075901,202.91999772191042,21.07396265309919,2,3,3,2_3_3,0,
2026-03-02T08:39:06.304676+00:00,B,uniform,tune,uniform_tune_022,1536,2048,2048,bf16,NVIDIA GeForce RTX 4060,c10,64,128,64,8,3,8,0.0,0.0,415.0879979133606,508.3833712339401,31.04137424539412,3,3,3,3_3_3,0,
2026-03-02T08:39:06.317224+00:00,B,uniform,tune,uniform_tune_023,256,1024,1024,bf16,NVIDIA GeForce RTX 4060,c11,32,128,32,4,2,8,0.0,0.0,56.2720000743866,138.9958377182483,9.540640305841345,2,3,3,2_3_3,0,
2026-03-02T08:39:06.365678+00:00,B,uniform,tune,uniform_tune_024,768,128,384,bf16,NVIDIA GeForce RTX 4060,c00,32,32,32,2,2,8,0.0,48.416,35.69599986076355,81.6390387713908,2.115012110446178,3,1,2,3_1_2,0,
2026-03-02T08:39:06.377586+00:00,B,uniform,tune,uniform_tune_025,256,96,384,bf16,NVIDIA GeForce RTX 4060,c00,32,32,32,2,2,8,0.0,0.0,120.35199999809265,318.23423564434034,0.1568263759663248,2,1,2,2_1_2,0,
2026-03-02T08:39:06.398022+00:00,B,uniform,tune,uniform_tune_026,96,1024,3072,bf16,NVIDIA GeForce RTX 4060,c06,64,128,32,4,3,8,0.0,0.0,67.58400052785873,123.15391942858676,8.936727202927772,1,3,3,1_3_3,0,
2026-03-02T08:39:06.442843+00:00,B,uniform,tune,uniform_tune_027,1536,512,4096,bf16,NVIDIA GeForce RTX 4060,c06,64,128,32,4,3,8,0.0,0.0,222.71999716758728,285.0179332494736,28.92623485062426,3,2,3,3_2_3,0,
2026-03-02T08:39:06.447178+00:00,B,uniform,tune,uniform_tune_028,128,64,192,bf16,NVIDIA GeForce RTX 4060,c11,32,128,32,4,2,8,0.0,0.0,35.64799949526787,126.74463994801035,0.08824416641998614,1,1,2,1_1_2,0,
2026-03-02T08:39:06.455581+00:00,B,uniform,tune,uniform_tune_029,192,256,1536,bf16,NVIDIA GeForce RTX 4060,c04,64,64,64,4,3,8,0.0,0.0,59.47200022637844,161.27839416265488,2.538924929802968,2,2,3,2_2_3,0,
2026-03-02T08:39:06.519675+00:00,B,uniform,tune,uniform_tune_030,4096,64,3072,bf16,NVIDIA GeForce RTX 4060,c04,64,64,64,4,3,8,0.0,0.0,116.73600226640701,219.21791970729828,13.797052363711826,3,1,3,3_1_3,0,
2026-03-02T08:39:06.570116+00:00,B,uniform,tune,uniform_tune_031,384,128,96,bf16,NVIDIA GeForce RTX 4060,c11,32,128,32,4,2,8,0.0,50.388,32.76799991726875,46.00671984255313,0.28800000072713006,2,1,1,2_1_1,0,
2026-03-02T08:39:06.592184+00:00,B,uniform,eval,uniform_eval_000,512,4096,768,bf16,NVIDIA GeForce RTX 4060,c11,32,128,32,4,2,8,0.0,0.0,132.4479952454567,209.94047656655312,24.32068123062434,2,3,3,2_3_3,0,
2026-03-02T08:39:06.630825+00:00,B,uniform,eval,uniform_eval_001,384,512,64,bf16,NVIDIA GeForce RTX 4060,c05,128,64,32,4,3,8,0.0,38.599,29.583999887108803,52.15168196707958,0.8506565743655908,2,2,1,2_2_1,0,
2026-03-02T08:39:06.703597+00:00,B,uniform,eval,uniform_eval_002,256,4096,384,bf16,NVIDIA GeForce RTX 4060,c11,32,128,32,4,2,8,0.0,72.734,58.36800113320351,67.60448053479195,13.797052363711826,2,3,2,2_3_2,0,
2026-03-02T08:39:06.714248+00:00,B,uniform,eval,uniform_eval_003,384,768,512,bf16,NVIDIA GeForce RTX 4060,c11,32,128,32,4,2,8,0.0,0.0,40.44799879193306,111.67744055390357,7.466126805270495,2,3,2,2_3_2,0,
2026-03-02T08:39:06.755841+00:00,B,uniform,eval,uniform_eval_004,768,1024,96,bf16,NVIDIA GeForce RTX 4060,c06,64,128,32,4,3,8,0.0,41.563,34.57599878311157,41.86175998300313,4.367045040322957,3,3,1,3_3_1,0,
2026-03-02T08:39:06.766837+00:00,B,uniform,eval,uniform_eval_005,3072,3072,128,bf16,NVIDIA GeForce RTX 4060,c06,64,128,32,4,3,8,0.0,0.0,103.79200056195259,186.2223961949348,23.276544347538206,3,3,1,3_3_1,0,
2026-03-02T08:39:06.770922+00:00,B,uniform,eval,uniform_eval_006,256,96,512,bf16,NVIDIA GeForce RTX 4060,c00,32,32,32,2,2,8,0.0,0.0,36.86400130391121,43.53023983538151,0.6826666425201637,2,1,2,2_1_2,0,
2026-03-02T08:39:07.179668+00:00,B,uniform,eval,uniform_eval_007,4096,4096,4096,bf16,NVIDIA GeForce RTX 4060,c10,64,128,64,8,3,8,0.0,0.0,4282.320022583008,4363.346004486084,32.09450782454592,3,3,3,3_3_3,0,
2026-03-02T08:39:07.234960+00:00,B,uniform,eval,uniform_eval_008,128,96,64,bf16,NVIDIA GeForce RTX 4060,c04,64,64,64,4,3,8,0.0,55.242,30.687999911606312,69.93247807025905,0.05125338909444982,1,1,1,1_1_1,0,
2026-03-02T08:39:07.249933+00:00,B,uniform,eval,uniform_eval_009,3072,384,96,bf16,NVIDIA GeForce RTX 4060,c11,32,128,32,4,2,8,0.0,0.0,69.35999915003777,280.32544165849674,3.2654616317116356,3,2,1,3_2_1,0,
2026-03-02T08:39:07.275502+00:00,B,uniform,eval,uniform_eval_010,768,768,2048,bf16,NVIDIA GeForce RTX 4060,c10,64,128,64,8,3,8,0.0,0.0,107.4879989027977,205.36319881677628,22.476175281528274,3,3,3,3_3_3,0,
2026-03-02T08:39:07.290535+00:00,B,uniform,eval,uniform_eval_011,4096,96,512,bf16,NVIDIA GeForce RTX 4060,c00,32,32,32,2,2,8,0.0,0.0,62.97599896788597,176.00160226225853,6.393756202348282,3,1,2,3_1_2,0,
2026-03-02T08:39:07.341123+00:00,B,uniform,eval,uniform_eval_012,384,384,256,bf16,NVIDIA GeForce RTX 4060,c11,32,128,32,4,2,8,0.0,50.536,36.159999668598175,47.15359952300787,2.0878725855067697,2,2,2,2_2_2,0,
2026-03-02T08:39:07.383004+00:00,B,uniform,eval,uniform_eval_013,4096,2048,768,bf16,NVIDIA GeForce RTX 4060,c10,64,128,64,8,3,8,0.0,0.0,423.8560050725937,445.54239451885223,30.39924345484549,3,3,3,3_3_3,0,
2026-03-02T08:39:07.396563+00:00,B,uniform,eval,uniform_eval_014,192,384,3072,bf16,NVIDIA GeForce RTX 4060,c04,64,64,64,4,3,8,0.0,0.0,64.51199948787689,145.9200045466422,7.021714341455576,2,2,3,2_2_3,0,
2026-03-02T08:39:07.406145+00:00,B,uniform,eval,uniform_eval_015,128,96,4096,bf16,NVIDIA GeForce RTX 4060,c04,64,64,64,4,3,8,0.0,0.0,75.66400244832039,149.15487855672833,1.3303987727685234,1,1,3,1_1_3,0,
2026-03-02T08:39:07.460482+00:00,B,uniform,eval,uniform_eval_016,64,4096,2048,bf16,NVIDIA GeForce RTX 4060,c06,64,128,32,4,3,8,0.0,0.0,102.39999741315842,154.0854381769894,10.485760264892583,1,3,3,1_3_3,0,
2026-03-02T08:39:07.469148+00:00,B,uniform,eval,uniform_eval_017,96,128,3072,bf16,NVIDIA GeForce RTX 4060,c04,64,64,64,4,3,8,0.0,0.0,67.58400052785873,172.16927841305719,1.1170909003659715,1,1,3,1_1_3,0,
2026-03-02T08:39:07.515700+00:00,B,uniform,eval,uniform_eval_018,512,768,64,bf16,NVIDIA GeForce RTX 4060,c11,32,128,32,4,2,8,0.0,46.507,33.76000002026558,42.51871913671492,1.4908663498159578,2,3,1,2_3_1,0,
2026-03-02T08:39:07.520820+00:00,B,uniform,eval,uniform_eval_019,64,128,384,bf16,NVIDIA GeForce RTX 4060,c11,32,128,32,4,2,8,0.0,0.0,34.97599996626377,114.1430431604384,0.1798792316465132,1,1,2,1_1_2,0,
2026-03-02T08:39:07.526998+00:00,B,uniform,eval,uniform_eval_020,512,512,96,bf16,NVIDIA GeForce RTX 4060,c05,128,64,32,4,3,8,0.0,0.0,56.47999979555607,119.99487683176994,0.8911410797129672,2,2,1,2_2_1,0,
2026-03-02T08:39:07.551876+00:00,B,uniform,eval,uniform_eval_021,256,3072,1536,bf16,NVIDIA GeForce RTX 4060,c11,32,128,32,4,2,8,0.0,0.0,120.08000165224075,180.59712231159205,20.11924609225651,2,3,3,2_3_3,0,
2026-03-02T08:39:07.561017+00:00,B,uniform,eval,uniform_eval_022,2048,96,512,bf16,NVIDIA GeForce RTX 4060,c00,32,32,32,2,2,8,0.0,0.0,50.51199905574322,65.98943918943404,3.9857181612991255,3,1,2,3_1_2,0,
2026-03-02T08:39:07.594864+00:00,B,uniform,eval,uniform_eval_023,1536,512,3072,bf16,NVIDIA GeForce RTX 4060,c06,64,128,32,4,3,8,0.0,0.0,169.98400539159775,234.81792032718639,28.425252110448483,3,2,3,3_2_3,0,
2026-03-02T08:39:07.636319+00:00,B,uniform,eval,uniform_eval_024,128,192,64,bf16,NVIDIA GeForce RTX 4060,c11,32,128,32,4,2,8,0.0,41.406,30.719999223947525,39.61183927953242,0.10240000258684166,1,2,1,1_2_1,0,
2026-03-02T08:39:07.645351+00:00,B,uniform,eval,uniform_eval_025,1536,96,384,bf16,NVIDIA GeForce RTX 4060,c00,32,32,32,2,2,8,0.0,0.0,63.48799914121628,137.65279337763786,1.78374195961203,3,1,2,3_1_2,0,
2026-03-02T08:39:07.651996+00:00,B,uniform,eval,uniform_eval_026,1536,2048,64,bf16,NVIDIA GeForce RTX 4060,c06,64,128,32,4,3,8,0.0,0.0,50.16000010073185,120.4988834261894,8.027376060434362,3,3,1,3_3_1,0,
2026-03-02T08:39:07.656509+00:00,B,uniform,eval,uniform_eval_027,256,1024,96,bf16,NVIDIA GeForce RTX 4060,c11,32,128,32,4,2,8,0.0,0.0,33.77600014209747,103.33215698599805,1.4901601074210096,2,3,1,2_3_1,0,
2026-03-02T08:39:07.660817+00:00,B,uniform,eval,uniform_eval_028,2048,256,64,bf16,NVIDIA GeForce RTX 4060,c11,32,128,32,4,2,8,0.0,0.0,34.81600061058998,55.876159146428066,1.9275293779604168,3,2,1,3_2_1,0,
2026-03-02T08:39:07.665581+00:00,B,uniform,eval,uniform_eval_029,192,768,192,bf16,NVIDIA GeForce RTX 4060,c11,32,128,32,4,2,8,0.0,0.0,33.79200026392937,100.54111912846558,1.6756363505489573,2,3,2,2_3_2,0,
2026-03-02T08:39:07.721406+00:00,B,uniform,eval,uniform_eval_030,1024,2048,3072,bf16,NVIDIA GeForce RTX 4060,c10,64,128,64,8,3,8,0.0,0.0,428.9119988679886,500.2787098288536,30.04089865055452,3,3,3,3_3_3,0,
2026-03-02T08:39:07.802533+00:00,B,uniform,eval,uniform_eval_031,1536,1024,512,bf16,NVIDIA GeForce RTX 4060,c06,64,128,32,4,3,8,0.0,81.072,77.82399654388428,85.44095829129218,20.695579866446323,3,3,2,3_3_2,0,
2026-03-02T08:39:07.824062+00:00,B,uniform,eval,uniform_eval_032,512,768,768,bf16,NVIDIA GeForce RTX 4060,c11,32,128,32,4,2,8,0.0,0.0,83.96799862384796,634.9382688105088,7.1929757276418185,2,3,3,2_3_3,0,
2026-03-02T08:39:07.843601+00:00,B,uniform,eval,uniform_eval_033,64,512,4096,bf16,NVIDIA GeForce RTX 4060,c00,32,32,32,2,2,8,0.0,0.0,73.07200133800507,164.38271969556808,3.673574708297821,1,2,3,1_2_3,0,
2026-03-02T08:39:07.899915+00:00,B,uniform,eval,uniform_eval_034,1024,256,512,bf16,NVIDIA GeForce RTX 4060,c02,32,64,32,2,2,8,0.0,56.276,43.856000527739525,64.26815766841169,6.120837576837652,3,2,2,3_2_2,0,
2026-03-02T08:39:07.905827+00:00,B,uniform,eval,uniform_eval_035,1024,768,96,bf16,NVIDIA GeForce RTX 4060,c06,64,128,32,4,3,8,0.0,0.0,35.439999774098396,109.05023895204064,4.260579711130694,3,3,1,3_3_1,0,
2026-03-02T08:39:07.914926+00:00,B,uniform,eval,uniform_eval_036,768,64,1536,bf16,NVIDIA GeForce RTX 4060,c04,64,64,64,4,3,8,0.0,0.0,46.08000069856644,126.39072448015212,3.2767999503241656,3,1,3,3_1_3,0,
2026-03-02T08:39:07.920794+00:00,B,uniform,eval,uniform_eval_037,512,256,512,bf16,NVIDIA GeForce RTX 4060,c11,32,128,32,4,2,8,0.0,0.0,40.95999896526337,55.62560018151997,3.2768000827789328,2,2,2,2_2_2,0,
2026-03-02T08:39:07.961069+00:00,B,uniform,eval,uniform_eval_038,64,1024,64,bf16,NVIDIA GeForce RTX 4060,c03,64,64,32,4,2,8,0.0,40.249,28.511999174952507,135.81792116165158,0.2942132520601819,1,3,1,1_3_1,0,
2026-03-02T08:39:07.971874+00:00,B,uniform,eval,uniform_eval_039,512,128,2048,bf16,NVIDIA GeForce RTX 4060,c04,64,64,64,4,3,8,0.0,0.0,67.58400052785873,192.6860742270945,3.9718787568567877,2,1,3,2_1_3,0,
2026-03-02T08:39:07.981101+00:00,B,uniform,eval,uniform_eval_040,4096,768,96,bf16,NVIDIA GeForce RTX 4060,c06,64,128,32,4,3,8,0.0,0.0,78.84799689054489,159.52895805239672,7.660052250134291,3,3,1,3_3_1,0,
2026-03-02T08:39:07.988744+00:00,B,uniform,eval,uniform_eval_041,4096,192,64,bf16,NVIDIA GeForce RTX 4060,c11,32,128,32,4,2,8,0.0,0.0,66.56000018119812,151.70431777834887,1.5123692266520663,3,2,1,3_2_1,0,
2026-03-02T08:39:07.994100+00:00,B,uniform,eval,uniform_eval_042,96,1536,128,bf16,NVIDIA GeForce RTX 4060,c03,64,64,32,4,2,8,0.0,0.0,37.88800165057182,58.99263944476841,0.996324280919954,1,3,1,1_3_1,0,
2026-03-02T08:39:08.000260+00:00,B,uniform,eval,uniform_eval_043,192,2048,192,bf16,NVIDIA GeForce RTX 4060,c11,32,128,32,4,2,8,0.0,0.0,45.16799934208393,121.8515177816152,3.342962854219558,2,3,2,2_3_2,0,
2026-03-02T08:39:08.086584+00:00,B,uniform,eval,uniform_eval_044,384,4096,3072,bf16,NVIDIA GeForce RTX 4060,c11,32,128,32,4,2,8,0.0,0.0,358.39998722076416,388.5104006528853,26.96338381855871,2,3,3,2_3_3,0,
2026-03-02T08:39:08.105125+00:00,B,uniform,eval,uniform_eval_045,4096,96,768,bf16,NVIDIA GeForce RTX 4060,c04,64,64,64,4,3,8,0.0,0.0,54.27199974656105,112.31167674064632,11.1287547689501,3,1,3,3_1_3,0,
2026-03-02T08:39:08.110590+00:00,B,uniform,eval,uniform_eval_046,96,96,1536,bf16,NVIDIA GeForce RTX 4060,c04,64,64,64,4,3,8,0.0,0.0,35.840000957250595,57.78047949075696,0.7899428360442731,1,1,3,1_1_3,0,
2026-03-02T08:39:08.171081+00:00,B,uniform,eval,uniform_eval_047,2048,512,4096,bf16,NVIDIA GeForce RTX 4060,c06,64,128,32,4,3,8,0.0,0.0,316.4159953594208,429.43360209465015,27.14759910365021,3,2,3,3_2_3,0,
2026-03-02T08:39:08.179473+00:00,B,uniform,eval,uniform_eval_048,96,256,768,bf16,NVIDIA GeForce RTX 4060,c00,32,32,32,2,2,8,0.0,0.0,44.544000178575516,334.1315157711501,0.847448272464675,1,2,3,1_2_3,0,
2026-03-02T08:39:08.184914+00:00,B,uniform,eval,uniform_eval_049,64,768,384,bf16,NVIDIA GeForce RTX 4060,c04,64,64,64,4,3,8,0.0,0.0,34.832000732421875,83.36639914661635,1.0837372303125614,1,3,2,1_3_2,0,
2026-03-02T08:39:08.189390+00:00,B,uniform,eval,uniform_eval_050,128,1024,96,bf16,NVIDIA GeForce RTX 4060,c03,64,64,32,4,2,8,0.0,0.0,31.74399957060814,87.01503917574883,0.7927742042720133,1,3,1,1_3_1,0,
2026-03-02T08:39:08.198343+00:00,B,uniform,eval,uniform_eval_051,384,768,768,bf16,NVIDIA GeForce RTX 4060,c11,32,128,32,4,2,8,0.0,0.0,58.44799987971783,204.6387228369711,7.750219561528423,2,3,3,2_3_3,0,
2026-03-02T08:39:08.218557+00:00,B,uniform,eval,uniform_eval_052,768,64,4096,bf16,NVIDIA GeForce RTX 4060,c04,64,64,64,4,3,8,0.0,0.0,62.92800046503544,153.8457597792148,6.3986330572147345,3,1,3,3_1_3,0,
2026-03-02T08:39:08.224923+00:00,B,uniform,eval,uniform_eval_053,384,96,512,bf16,NVIDIA GeForce RTX 4060,c00,32,32,32,2,2,8,0.0,0.0,40.33599980175495,131.58687904477117,0.9358572041235884,2,1,2,2_1_2,0,
2026-03-02T08:39:08.232636+00:00,B,uniform,eval,uniform_eval_054,768,192,768,bf16,NVIDIA GeForce RTX 4060,c06,64,128,32,4,3,8,0.0,0.0,47.10400104522705,117.44319751858704,4.808347719390813,3,2,3,3_2_3,0,
2026-03-02T08:39:08.243589+00:00,B,uniform,eval,uniform_eval_055,512,2048,512,bf16,NVIDIA GeForce RTX 4060,c11,32,128,32,4,2,8,0.0,0.0,78.84799689054489,80.34527704119682,13.617870666905405,2,3,2,2_3_2,0,
2026-03-02T08:39:08.249535+00:00,B,uniform,eval,uniform_eval_056,384,512,512,bf16,NVIDIA GeForce RTX 4060,c11,32,128,32,4,2,8,0.0,0.0,40.95999896526337,69.95967935770744,4.9152001241684,2,2,2,2_2_2,0,
2026-03-02T08:39:08.259133+00:00,B,uniform,eval,uniform_eval_057,2048,512,512,bf16,NVIDIA GeForce RTX 4060,c02,32,64,32,2,2,8,0.0,0.0,69.63200122117996,82.3577608168125,15.420235023683334,3,2,2,3_2_2,0,
2026-03-02T08:39:08.275021+00:00,B,uniform,eval,uniform_eval_058,1024,512,2048,bf16,NVIDIA GeForce RTX 4060,c06,64,128,32,4,3,8,0.0,0.0,98.68800267577171,121.85599654912949,21.76033144631891,3,2,3,3_2_3,0,
2026-03-02T08:39:08.320832+00:00,B,uniform,eval,uniform_eval_059,2048,64,4096,bf16,NVIDIA GeForce RTX 4060,c04,64,64,64,4,3,8,0.0,0.0,91.08800068497658,163.83999586105347,11.787961267406493,3,1,3,3_1_3,0,
2026-03-02T08:39:08.334056+00:00,B,uniform,eval,uniform_eval_060,64,1536,1024,bf16,NVIDIA GeForce RTX 4060,c06,64,128,32,4,3,8,0.0,0.0,53.247999399900436,170.37663623690602,3.780923119533697,1,3,3,1_3_3,0,
2026-03-02T08:39:08.351245+00:00,B,uniform,eval,uniform_eval_061,768,1024,1536,bf16,NVIDIA GeForce RTX 4060,c10,64,128,64,8,3,8,0.0,0.0,92.6080010831356,154.29632358252988,26.08758504387966,3,3,3,3_3_3,0,
2026-03-02T08:39:08.357560+00:00,B,uniform,eval,uniform_eval_062,384,2048,192,bf16,NVIDIA GeForce RTX 4060,c11,32,128,32,4,2,8,0.0,0.0,46.08000069856644,57.44191963225603,6.553599900648331,2,3,2,2_3_2,0,
2026-03-02T08:39:08.363508+00:00,B,uniform,eval,uniform_eval_063,256,2048,192,bf16,NVIDIA GeForce RTX 4060,c11,32,128,32,4,2,8,0.0,0.0,43.5199998319149,55.22239938378333,4.626070606102333,2,3,2,2_3_2,0,
2026-03-02T08:39:10.431243+00:00,B,llm_style,tune,llm_style_tune_000,8,4096,1024,bf16,NVIDIA GeForce RTX 4060,c02,32,64,32,2,2,8,0.0,2067.114,41.760001331567764,86.1820781975984,1.6070129755783842,0,3,3,0_3_3,0,
2026-03-02T08:39:10.452966+00:00,B,llm_style,tune,llm_style_tune_001,32,1024,2048,bf16,NVIDIA GeForce RTX 4060,c02,32,64,32,2,2,8,0.0,0.0,118.70400235056877,218.53407844901085,1.1306925237753525,0,3,3,0_3_3,0,
2026-03-02T08:39:10.468607+00:00,B,llm_style,tune,llm_style_tune_002,16,2048,1024,bf16,NVIDIA GeForce RTX 4060,c02,32,64,32,2,2,8,0.0,0.0,75.16800239682198,961.0070431232423,0.8927849864324356,0,3,3,0_3_3,0,
2026-03-02T08:39:10.732346+00:00,B,llm_style,tune,llm_style_tune_003,1,1024,4096,bf16,NVIDIA GeForce RTX 4060,c02,32,64,32,2,2,8,0.0,0.0,162.81600296497345,283.8243174552914,0.05152201164037074,0,3,3,0_3_3,0,
2026-03-02T08:39:10.758013+00:00,B,llm_style,tune,llm_style_tune_004,64,2048,2048,bf16,NVIDIA GeForce RTX 4060,c06,64,128,32,4,3,8,0.0,0.0,120.32000347971916,253.31711605191225,4.462025402870718,1,3,3,1_3_3,0,
2026-03-02T08:39:11.153094+00:00,B,llm_style,tune,llm_style_tune_005,32,8192,8192,bf16,NVIDIA GeForce RTX 4060,c02,32,64,32,2,2,8,0.0,0.0,926.7200231552124,1081.5574514865875,4.634589939447822,0,3,3,0_3_3,0,
2026-03-02T08:39:11.519076+00:00,B,llm_style,tune,llm_style_tune_006,16,8192,8192,bf16,NVIDIA GeForce RTX 4060,c02,32,64,32,2,2,8,0.0,0.0,924.5119988918304,1054.1555452346802,2.322829396020916,0,3,3,0_3_3,0,
2026-03-02T08:39:11.580663+00:00,B,llm_style,tune,llm_style_tune_007,2,1024,8192,bf16,NVIDIA GeForce RTX 4060,c02,32,64,32,2,2,8,0.0,0.0,363.5199964046478,444.42559391260147,0.09230422626503687,0,3,3,0_3_3,0,
2026-03-02T08:39:11.682038+00:00,B,llm_style,tune,llm_style_tune_008,16,2048,8192,bf16,NVIDIA GeForce RTX 4060,c02,32,64,32,2,2,8,0.0,0.0,421.88799381256104,526.852136850357,1.2725437079836035,0,3,3,0_3_3,0,
2026-03-02T08:39:11.733586+00:00,B,llm_style,tune,llm_style_tune_009,4,4096,2048,bf16,NVIDIA GeForce RTX 4060,c02,32,64,32,2,2,8,0.0,0.0,135.13600081205368,242.20671623945236,0.49660241236037905,0,3,3,0_3_3,0,
2026-03-02T08:39:11.916947+00:00,B,llm_style,tune,llm_style_tune_010,64,8192,4096,bf16,NVIDIA GeForce RTX 4060,c06,64,128,32,4,3,8,0.0,0.0,610.1920008659363,751.0428833961486,7.03871451920858,1,3,3,1_3_3,0,
2026-03-02T08:39:11.962888+00:00,B,llm_style,tune,llm_style_tune_011,16,8192,1024,bf16,NVIDIA GeForce RTX 4060,c02,32,64,32,2,2,8,0.0,0.0,120.70400267839432,279.21822994947433,2.2239151150208643,0,3,3,0_3_3,0,
2026-03-02T08:39:12.011109+00:00,B,llm_style,tune,llm_style_tune_012,2,8192,1024,bf16,NVIDIA GeForce RTX 4060,c02,32,64,32,2,2,8,0.0,0.0,119.80800330638885,173.27103510498986,0.28006836833921833,0,3,3,0_3_3,0,
2026-03-02T08:39:12.103073+00:00,B,llm_style,tune,llm_style_tune_013,16,8192,2048,bf16,NVIDIA GeForce RTX 4060,c02,32,64,32,2,2,8,0.0,0.0,260.09601354599,318.9759960770606,2.0641258767507824,0,3,3,0_3_3,0,
2026-03-02T08:39:12.193517+00:00,B,llm_style,tune,llm_style_tune_014,8,4096,4096,bf16,NVIDIA GeForce RTX 4060,c02,32,64,32,2,2,8,0.0,0.0,262.14399933815,370.94815462827677,1.0240000025853515,0,3,3,0_3_3,0,
2026-03-02T08:39:12.204812+00:00,B,llm_style,tune,llm_style_tune_015,64,1024,1024,bf16,NVIDIA GeForce RTX 4060,c06,64,128,32,4,3,8,0.0,0.0,82.92799815535545,128.1331183761357,1.6184850832713884,1,3,3,1_3_3,0,
2026-03-02T08:39:12.383159+00:00,B,llm_style,tune,llm_style_tune_016,16,4096,8192,bf16,NVIDIA GeForce RTX 4060,c02,32,64,32,2,2,8,0.0,0.0,489.8719936609268,536.6579228639603,2.1918824466279014,0,3,3,0_3_3,0,
2026-03-02T08:39:12.470540+00:00,B,llm_style,tune,llm_style_tune_017,1,4096,4096,bf16,NVIDIA GeForce RTX 4060,c02,32,64,32,2,2,8,0.0,0.0,258.04799795150757,277.66783714294434,0.13003174706399215,0,3,3,0_3_3,0,
2026-03-02T08:39:12.571807+00:00,B,llm_style,tune,llm_style_tune_018,64,4096,4096,bf16,NVIDIA GeForce RTX 4060,c06,64,128,32,4,3,8,0.0,0.0,418.7840074300766,507.4435272812841,5.127902713330237,1,3,3,1_3_3,0,
2026-03-02T08:39:12.667489+00:00,B,llm_style,tune,llm_style_tune_019,64,8192,2048,bf16,NVIDIA GeForce RTX 4060,c06,64,128,32,4,3,8,0.0,0.0,326.6560137271881,432.57855743169773,6.574143924359233,1,3,3,1_3_3,0,
2026-03-02T08:39:12.720676+00:00,B,llm_style,tune,llm_style_tune_020,8,2048,4096,bf16,NVIDIA GeForce RTX 4060,c02,32,64,32,2,2,8,0.0,0.0,201.7280012369156,275.64480334520334,0.6653400974432426,0,3,3,0_3_3,0,
2026-03-02T08:39:12.735908+00:00,B,llm_style,tune,llm_style_tune_021,8,1024,2048,bf16,NVIDIA GeForce RTX 4060,c02,32,64,32,2,2,8,0.0,0.0,106.49599879980087,198.6438399553299,0.3150769266278081,0,3,3,0_3_3,0,
2026-03-02T08:39:12.780999+00:00,B,llm_style,tune,llm_style_tune_022,8,8192,1024,bf16,NVIDIA GeForce RTX 4060,c02,32,64,32,2,2,8,0.0,0.0,103.88799756765366,192.36927688121796,1.2919464340680462,0,3,3,0_3_3,0,
2026-03-02T08:39:12.952223+00:00,B,llm_style,tune,llm_style_tune_023,1,4096,8192,bf16,NVIDIA GeForce RTX 4060,c02,32,64,32,2,2,8,0.0,0.0,483.2800030708313,504.01279151439667,0.13886124725538102,0,3,3,0_3_3,0,
2026-03-02T08:39:13.124235+00:00,B,llm_style,tune,llm_style_tune_024,2,8192,4096,bf16,NVIDIA GeForce RTX 4060,c02,32,64,32,2,2,8,0.0,0.0,471.9519913196564,600.1254421472547,0.2843885193167739,0,3,3,0_3_3,0,
2026-03-02T08:39:13.213184+00:00,B,llm_style,tune,llm_style_tune_025,2,4096,4096,bf16,NVIDIA GeForce RTX 4060,c02,32,64,32,2,2,8,0.0,0.0,261.07199490070343,344.7091209888458,0.2570511786433635,0,3,3,0_3_3,0,
2026-03-02T08:39:13.231529+00:00,B,llm_style,tune,llm_style_tune_026,4,2048,1024,bf16,NVIDIA GeForce RTX 4060,c02,32,64,32,2,2,8,0.0,0.0,74.75200295448303,177.79743984341616,0.2244383472937274,0,3,3,0_3_3,0,
2026-03-02T08:39:13.286874+00:00,B,llm_style,tune,llm_style_tune_027,64,2048,4096,bf16,NVIDIA GeForce RTX 4060,c06,64,128,32,4,3,8,0.0,0.0,235.3920042514801,329.7459262609482,4.561505083464399,1,3,3,1_3_3,0,
2026-03-02T08:39:13.315501+00:00,B,llm_style,tune,llm_style_tune_028,32,1024,4096,bf16,NVIDIA GeForce RTX 4060,c02,32,64,32,2,2,8,0.0,0.0,175.61599612236023,248.7680087983608,1.5285364768991085,0,3,3,0_3_3,0,
2026-03-02T08:39:13.329184+00:00,B,llm_style,tune,llm_style_tune_029,32,2048,1024,bf16,NVIDIA GeForce RTX 4060,c02,32,64,32,2,2,8,0.0,0.0,72.51200079917908,85.57567916810511,1.8509726186112836,0,3,3,0_3_3,0,
2026-03-02T08:39:13.350670+00:00,B,llm_style,tune,llm_style_tune_030,4,2048,2048,bf16,NVIDIA GeForce RTX 4060,c02,32,64,32,2,2,8,0.0,0.0,111.61600053310394,153.47167968749994,0.3006238517751599,0,3,3,0_3_3,0,
2026-03-02T08:39:13.729399+00:00,B,llm_style,tune,llm_style_tune_031,1,8192,8192,bf16,NVIDIA GeForce RTX 4060,c02,32,64,32,2,2,8,0.0,0.0,1009.1520547866821,1130.6393253803253,0.13300050013609832,0,3,3,0_3_3,0,
2026-03-02T08:39:13.769435+00:00,B,llm_style,eval,llm_style_eval_000,2,1024,4096,bf16,NVIDIA GeForce RTX 4060,c02,32,64,32,2,2,8,0.0,0.0,269.3119943141937,372.4691152572631,0.06229657926199456,0,3,3,0_3_3,0,
2026-03-02T08:39:14.106007+00:00,B,llm_style,eval,llm_style_eval_001,2,8192,8192,bf16,NVIDIA GeForce RTX 4060,c02,32,64,32,2,2,8,0.0,0.0,933.8400065898895,1055.686023235321,0.28745336899866575,0,3,3,0_3_3,0,
2026-03-02T08:39:14.130450+00:00,B,llm_style,eval,llm_style_eval_002,2,2048,2048,bf16,NVIDIA GeForce RTX 4060,c02,32,64,32,2,2,8,0.0,0.0,149.50400590896606,273.8585555553435,0.1122191736468637,0,3,3,0_3_3,0,
2026-03-02T08:39:14.195678+00:00,B,llm_style,eval,llm_style_eval_003,8,1024,8192,bf16,NVIDIA GeForce RTX 4060,c02,32,64,32,2,2,8,0.0,0.0,454.6560049057007,572.477417588234,0.29520720402194583,0,3,3,0_3_3,0,
2026-03-02T08:39:14.298955+00:00,B,llm_style,eval,llm_style_eval_004,64,2048,8192,bf16,NVIDIA GeForce RTX 4060,c06,64,128,32,4,3,8,0.0,0.0,465.8080041408539,526.2425455451009,4.610233462949749,1,3,3,1_3_3,0,
2026-03-02T08:39:14.633771+00:00,B,llm_style,eval,llm_style_eval_005,1,8192,8192,bf16,NVIDIA GeForce RTX 4060,c02,32,64,32,2,2,8,0.0,0.0,914.9439930915833,1041.6128027439117,0.1466950206935401,0,3,3,0_3_3,0,
2026-03-02T08:39:14.696575+00:00,B,llm_style,eval,llm_style_eval_006,1,1024,8192,bf16,NVIDIA GeForce RTX 4060,c02,32,64,32,2,2,8,0.0,0.0,371.4880049228668,391.2665578722954,0.045162201141551,0,3,3,0_3_3,0,
2026-03-02T08:39:14.869553+00:00,B,llm_style,eval,llm_style_eval_007,2,8192,4096,bf16,NVIDIA GeForce RTX 4060,c02,32,64,32,2,2,8,0.0,0.0,478.0320078134537,513.5667258501053,0.28077142493850926,0,3,3,0_3_3,0,
2026-03-02T08:39:14.922020+00:00,B,llm_style,eval,llm_style_eval_008,16,2048,4096,bf16,NVIDIA GeForce RTX 4060,c02,32,64,32,2,2,8,0.0,0.0,212.99199759960175,269.26495760679245,1.2603077065112325,0,3,3,0_3_3,0,
2026-03-02T08:39:15.023217+00:00,B,llm_style,eval,llm_style_eval_009,32,2048,8192,bf16,NVIDIA GeForce RTX 4060,c02,32,64,32,2,2,8,0.0,0.0,456.7039906978607,501.1455830931663,2.3510673124604904,0,3,3,0_3_3,0,
2026-03-02T08:39:15.034329+00:00,B,llm_style,eval,llm_style_eval_010,1,1024,1024,bf16,NVIDIA GeForce RTX 4060,c02,32,64,32,2,2,8,0.0,0.0,79.8719972372055,158.54559645056725,0.026256411164626757,0,3,3,0_3_3,0,
2026-03-02T08:39:15.137750+00:00,B,llm_style,eval,llm_style_eval_011,16,2048,8192,bf16,NVIDIA GeForce RTX 4060,c02,32,64,32,2,2,8,0.0,0.0,455.6800127029419,530.6572955846786,1.178175248055013,0,3,3,0_3_3,0,
2026-03-02T08:39:15.484084+00:00,B,llm_style,eval,llm_style_eval_012,8,8192,8192,bf16,NVIDIA GeForce RTX 4060,c02,32,64,32,2,2,8,0.0,0.0,923.119992017746,1056.07173204422,1.1631660383099562,0,3,3,0_3_3,0,
2026-03-02T08:39:15.655507+00:00,B,llm_style,eval,llm_style_eval_013,32,4096,8192,bf16,NVIDIA GeForce RTX 4060,c02,32,64,32,2,2,8,0.0,0.0,494.59201097488403,571.1257517337798,4.34192951027883,0,3,3,0_3_3,0,
2026-03-02T08:39:15.666666+00:00,B,llm_style,eval,llm_style_eval_014,64,1024,1024,bf16,NVIDIA GeForce RTX 4060,c06,64,128,32,4,3,8,0.0,0.0,83.96799862384796,92.2009614109993,1.5984390505870707,1,3,3,1_3_3,0,
2026-03-02T08:39:15.683132+00:00,B,llm_style,eval,llm_style_eval_015,16,2048,1024,bf16,NVIDIA GeForce RTX 4060,c02,32,64,32,2,2,8,0.0,0.0,97.76000306010246,156.10112354159355,0.6864654449605708,0,3,3,0_3_3,0,
2026-03-02T08:39:15.764991+00:00,B,llm_style,eval,llm_style_eval_016,2,1024,8192,bf16,NVIDIA GeForce RTX 4060,c02,32,64,32,2,2,8,0.0,0.0,363.9039993286133,519.7107204794881,0.09220682394781711,0,3,3,0_3_3,0,
2026-03-02T08:39:16.143207+00:00,B,llm_style,eval,llm_style_eval_017,4,8192,8192,bf16,NVIDIA GeForce RTX 4060,c02,32,64,32,2,2,8,0.0,0.0,942.0639872550964,1069.1583740711212,0.5698879473827331,0,3,3,0_3_3,0,
2026-03-02T08:39:16.175409+00:00,B,llm_style,eval,llm_style_eval_018,4,1024,4096,bf16,NVIDIA GeForce RTX 4060,c02,32,64,32,2,2,8,0.0,0.0,250.36799907684326,370.35423845052713,0.13402045039191063,0,3,3,0_3_3,0,
2026-03-02T08:39:16.225746+00:00,B,llm_style,eval,llm_style_eval_019,8,4096,2048,bf16,NVIDIA GeForce RTX 4060,c02,32,64,32,2,2,8,0.0,0.0,175.00799894332886,279.1001644730567,0.7669233909900451,0,3,3,0_3_3,0,
2026-03-02T08:39:16.289313+00:00,B,llm_style,eval,llm_style_eval_020,64,4096,2048,bf16,NVIDIA GeForce RTX 4060,c06,64,128,32,4,3,8,0.0,0.0,291.7439937591553,440.51457107067097,3.6804247798376646,1,3,3,1_3_3,0,
2026-03-02T08:39:16.466350+00:00,B,llm_style,eval,llm_style_eval_021,1,4096,8192,bf16,NVIDIA GeForce RTX 4060,c02,32,64,32,2,2,8,0.0,0.0,555.0079941749573,592.566402554512,0.12091513042034674,0,3,3,0_3_3,0,
2026-03-02T08:39:16.498466+00:00,B,llm_style,eval,llm_style_eval_022,32,1024,4096,bf16,NVIDIA GeForce RTX 4060,c02,32,64,32,2,2,8,0.0,0.0,237.56799846887589,308.2649675011635,1.1299310417651565,0,3,3,0_3_3,0,
2026-03-02T08:39:16.509935+00:00,B,llm_style,eval,llm_style_eval_023,4,1024,1024,bf16,NVIDIA GeForce RTX 4060,c02,32,64,32,2,2,8,0.0,0.0,62.463998794555664,121.67456299066535,0.1342950845588699,0,3,3,0_3_3,0,
2026-03-02T08:39:16.536335+00:00,B,llm_style,eval,llm_style_eval_024,64,2048,2048,bf16,NVIDIA GeForce RTX 4060,c06,64,128,32,4,3,8,0.0,0.0,174.46400225162506,258.0889636278152,3.0772589478125383,1,3,3,1_3_3,0,
2026-03-02T08:39:16.883959+00:00,B,llm_style,eval,llm_style_eval_025,32,8192,8192,bf16,NVIDIA GeForce RTX 4060,c02,32,64,32,2,2,8,0.0,0.0,938.4959936141968,1035.1078200340269,4.576436474129057,0,3,3,0_3_3,0,
2026-03-02T08:39:16.942884+00:00,B,llm_style,eval,llm_style_eval_026,4,2048,4096,bf16,NVIDIA GeForce RTX 4060,c02,32,64,32,2,2,8,0.0,0.0,254.97600436210632,368.2303977012633,0.2631967826458476,0,3,3,0_3_3,0,
2026-03-02T08:39:17.030277+00:00,B,llm_style,eval,llm_style_eval_027,8,8192,2048,bf16,NVIDIA GeForce RTX 4060,c02,32,64,32,2,2,8,0.0,0.0,259.5840096473694,314.0428847074508,1.0340985808973937,0,3,3,0_3_3,0,
2026-03-02T08:39:17.216799+00:00,B,llm_style,eval,llm_style_eval_028,8,4096,8192,bf16,NVIDIA GeForce RTX 4060,c02,32,64,32,2,2,8,0.0,0.0,557.0560097694397,718.0134475231168,0.9637646889802084,0,3,3,0_3_3,0,
2026-03-02T08:39:17.240204+00:00,B,llm_style,eval,llm_style_eval_029,8,2048,2048,bf16,NVIDIA GeForce RTX 4060,c02,32,64,32,2,2,8,0.0,0.0,140.28799533843994,217.0096020400524,0.47836497939900124,0,3,3,0_3_3,0,
2026-03-02T08:39:17.285499+00:00,B,llm_style,eval,llm_style_eval_030,1,4096,2048,bf16,NVIDIA GeForce RTX 4060,c02,32,64,32,2,2,8,0.0,0.0,159.743994474411,231.10655993223185,0.10502564465850703,0,3,3,0_3_3,0,
2026-03-02T08:39:17.374485+00:00,B,llm_style,eval,llm_style_eval_031,16,8192,2048,bf16,NVIDIA GeForce RTX 4060,c02,32,64,32,2,2,8,0.0,0.0,269.21600103378296,368.1551969051361,1.9942013473880773,0,3,3,0_3_3,0,
2026-03-02T08:39:17.400837+00:00,B,llm_style,eval,llm_style_eval_032,1,2048,2048,bf16,NVIDIA GeForce RTX 4060,c02,32,64,32,2,2,8,0.0,0.0,172.495998442173,288.8547244668007,0.048630739702707766,0,3,3,0_3_3,0,
2026-03-02T08:39:17.577365+00:00,B,llm_style,eval,llm_style_eval_033,16,8192,4096,bf16,NVIDIA GeForce RTX 4060,c02,32,64,32,2,2,8,0.0,0.0,490.432009100914,604.8223876953124,2.1893795757100776,0,3,3,0_3_3,0,
2026-03-02T08:39:17.607706+00:00,B,llm_style,eval,llm_style_eval_034,16,1024,4096,bf16,NVIDIA GeForce RTX 4060,c02,32,64,32,2,2,8,0.0,0.0,227.83999890089035,293.5193696618079,0.5890876432912215,0,3,3,0_3_3,0,
2026-03-02T08:39:17.699699+00:00,B,llm_style,eval,llm_style_eval_035,4,8192,2048,bf16,NVIDIA GeForce RTX 4060,c02,32,64,32,2,2,8,0.0,0.0,265.21599292755127,360.57086795568466,0.5060695115647271,0,3,3,0_3_3,0,
2026-03-02T08:39:17.795860+00:00,B,llm_style,eval,llm_style_eval_036,2,2048,4096,bf16,NVIDIA GeForce RTX 4060,c02,32,64,32,2,2,8,0.0,0.0,256.00001215934753,272.9267266392708,0.13107199377441436,0,3,3,0_3_3,0,
2026-03-02T08:39:17.809690+00:00,B,llm_style,eval,llm_style_eval_037,2,1024,1024,bf16,NVIDIA GeForce RTX 4060,c02,32,64,32,2,2,8,0.0,0.0,83.67999643087387,149.70912158489222,0.05012313789311426,0,3,3,0_3_3,0,
2026-03-02T08:39:18.040457+00:00,B,llm_style,eval,llm_style_eval_038,64,4096,8192,bf16,NVIDIA GeForce RTX 4060,c06,64,128,32,4,3,8,0.0,0.0,1053.6960363388062,1427.0448195934296,4.076097041157507,1,3,3,1_3_3,0,
2026-03-02T08:39:18.060039+00:00,B,llm_style,eval,llm_style_eval_039,4,1024,2048,bf16,NVIDIA GeForce RTX 4060,c02,32,64,32,2,2,8,0.0,0.0,155.64799308776855,252.4569635093211,0.10778947847107462,0,3,3,0_3_3,0,
2026-03-02T08:39:18.114185+00:00,B,llm_style,eval,llm_style_eval_040,64,8192,1024,bf16,NVIDIA GeForce RTX 4060,c06,64,128,32,4,3,8,0.0,0.0,275.83999931812286,281.9936013221741,3.8926255316643426,1,3,3,1_3_3,0,
2026-03-02T08:39:18.129712+00:00,B,llm_style,eval,llm_style_eval_041,2,2048,1024,bf16,NVIDIA GeForce RTX 4060,c02,32,64,32,2,2,8,0.0,0.0,93.18399801850319,185.9276795387268,0.09002197993623655,0,3,3,0_3_3,0,
2026-03-02T08:39:18.178255+00:00,B,llm_style,eval,llm_style_eval_042,2,4096,2048,bf16,NVIDIA GeForce RTX 4060,c02,32,64,32,2,2,8,0.0,0.0,198.11200350522995,234.465280920267,0.16937101945523556,0,3,3,0_3_3,0,
2026-03-02T08:39:18.194775+00:00,B,llm_style,eval,llm_style_eval_043,1,2048,1024,bf16,NVIDIA GeForce RTX 4060,c02,32,64,32,2,2,8,0.0,0.0,104.39999774098396,180.35936474800104,0.040175326539815204,0,3,3,0_3_3,0,
2026-03-02T08:39:18.313532+00:00,B,llm_style,eval,llm_style_eval_044,8,2048,8192,bf16,NVIDIA GeForce RTX 4060,c02,32,64,32,2,2,8,0.0,0.0,648.1119990348816,733.9244771003723,0.4141806607495825,0,3,3,0_3_3,0,
2026-03-02T08:39:18.361773+00:00,B,llm_style,eval,llm_style_eval_045,1,8192,1024,bf16,NVIDIA GeForce RTX 4060,c02,32,64,32,2,2,8,0.0,0.0,181.07199668884277,291.04128897190094,0.09265494558404996,0,3,3,0_3_3,0,
2026-03-02T08:39:18.390460+00:00,B,llm_style,eval,llm_style_eval_046,64,4096,1024,bf16,NVIDIA GeForce RTX 4060,c06,64,128,32,4,3,8,0.0,0.0,172.03199863433838,203.73855769634247,3.120761929535812,1,3,3,1_3_3,0,
2026-03-02T08:39:18.415310+00:00,B,llm_style,eval,llm_style_eval_047,16,2048,2048,bf16,NVIDIA GeForce RTX 4060,c02,32,64,32,2,2,8,0.0,0.0,162.30399906635284,192.58048430085177,0.8269526861450243,0,3,3,0_3_3,0,
2026-03-02T08:39:18.592489+00:00,B,llm_style,eval,llm_style_eval_048,8,8192,4096,bf16,NVIDIA GeForce RTX 4060,c02,32,64,32,2,2,8,0.0,0.0,597.9680120944977,718.9587324857712,0.8978254708299641,0,3,3,0_3_3,0,
2026-03-02T08:39:18.777174+00:00,B,llm_style,eval,llm_style_eval_049,4,4096,8192,bf16,NVIDIA GeForce RTX 4060,c02,32,64,32,2,2,8,0.0,0.0,695.8079934120178,773.9631962776182,0.38578955479324,0,3,3,0_3_3,0,
2026-03-02T08:39:18.891816+00:00,B,llm_style,eval,llm_style_eval_050,4,2048,8192,bf16,NVIDIA GeForce RTX 4060,c02,32,64,32,2,2,8,0.0,0.0,684.831976890564,739.131501317024,0.1959863623912643,0,3,3,0_3_3,0,
2026-03-02T08:39:18.905428+00:00,B,llm_style,eval,llm_style_eval_051,16,1024,1024,bf16,NVIDIA GeForce RTX 4060,c02,32,64,32,2,2,8,0.0,0.0,101.3759970664978,243.27168405056,0.33098990856770466,0,3,3,0_3_3,0,
2026-03-02T08:39:19.089373+00:00,B,llm_style,eval,llm_style_eval_052,32,8192,4096,bf16,NVIDIA GeForce RTX 4060,c02,32,64,32,2,2,8,0.0,0.0,657.4079990386963,749.117447733879,3.2665919050881445,0,3,3,0_3_3,0,
2026-03-02T08:39:19.109612+00:00,B,llm_style,eval,llm_style_eval_053,32,1024,2048,bf16,NVIDIA GeForce RTX 4060,c02,32,64,32,2,2,8,0.0,0.0,161.79199516773224,245.82144126296043,0.8295696450300549,0,3,3,0_3_3,0,
2026-03-02T08:39:19.217812+00:00,B,llm_style,eval,llm_style_eval_054,64,8192,2048,bf16,NVIDIA GeForce RTX 4060,c06,64,128,32,4,3,8,0.0,0.0,575.4879713058472,649.8816221952436,3.731587374671129,1,3,3,1_3_3,0,
2026-03-02T08:39:19.247064+00:00,B,llm_style,eval,llm_style_eval_055,1,4096,1024,bf16,NVIDIA GeForce RTX 4060,c02,32,64,32,2,2,8,0.0,0.0,115.20000174641609,188.07808041572565,0.07281777667387035,0,3,3,0_3_3,0,
2026-03-02T08:39:19.273779+00:00,B,llm_style,eval,llm_style_eval_056,4,2048,2048,bf16,NVIDIA GeForce RTX 4060,c02,32,64,32,2,2,8,0.0,0.0,170.8799973130226,227.80703410506246,0.1963625499041534,0,3,3,0_3_3,0,
2026-03-02T08:39:19.345163+00:00,B,llm_style,eval,llm_style_eval_057,16,1024,8192,bf16,NVIDIA GeForce RTX 4060,c02,32,64,32,2,2,8,0.0,0.0,531.1999917030334,572.4077010154724,0.5053378392183192,0,3,3,0_3_3,0,
2026-03-02T08:39:19.523390+00:00,B,llm_style,eval,llm_style_eval_058,1,8192,4096,bf16,NVIDIA GeForce RTX 4060,c02,32,64,32,2,2,8,0.0,0.0,591.871976852417,727.1180874109268,0.11338408747933265,0,3,3,0_3_3,0,
2026-03-02T08:39:19.546158+00:00,B,llm_style,eval,llm_style_eval_059,8,4096,1024,bf16,NVIDIA GeForce RTX 4060,c02,32,64,32,2,2,8,0.0,0.0,114.97600004076958,213.94272074103355,0.5836771498069487,0,3,3,0_3_3,0,
2026-03-02T08:39:19.728901+00:00,B,llm_style,eval,llm_style_eval_060,4,8192,4096,bf16,NVIDIA GeForce RTX 4060,c02,32,64,32,2,2,8,0.0,0.0,594.3839848041534,674.7718399763105,0.45161959753752134,0,3,3,0_3_3,0,
2026-03-02T08:39:19.756484+00:00,B,llm_style,eval,llm_style_eval_061,32,2048,2048,bf16,NVIDIA GeForce RTX 4060,c02,32,64,32,2,2,8,0.0,0.0,166.4000004529953,183.29599499702454,1.613193841762204,0,3,3,0_3_3,0,
2026-03-02T08:39:19.771663+00:00,B,llm_style,eval,llm_style_eval_062,8,2048,1024,bf16,NVIDIA GeForce RTX 4060,c02,32,64,32,2,2,8,0.0,0.0,108.5439994931221,123.94496105611323,0.30913207691528055,0,3,3,0_3_3,0,
2026-03-02T08:39:19.980624+00:00,B,llm_style,eval,llm_style_eval_063,16,4096,8192,bf16,NVIDIA GeForce RTX 4060,c02,32,64,32,2,2,8,0.0,0.0,681.984007358551,725.486730337143,1.574438421450378,0,3,3,0_3_3,0,
2026-03-02T08:39:20.215602+00:00,B,training_style,tune,training_style_tune_000,4096,2048,1024,bf16,NVIDIA GeForce RTX 4060,c10,64,128,64,8,3,8,0.0,0.0,3488.6720180511475,3608.8831400871277,4.92447243395413,3,3,3,3_3_3,0,
2026-03-02T08:39:20.274226+00:00,B,training_style,tune,training_style_tune_001,1536,2048,1536,bf16,NVIDIA GeForce RTX 4060,c10,64,128,64,8,3,8,0.0,0.0,366.5919899940491,462.53536611795414,26.360849881517794,3,3,3,3_3_3,0,
2026-03-02T08:39:20.477139+00:00,B,training_style,tune,training_style_tune_002,3072,2048,4096,bf16,NVIDIA GeForce RTX 4060,c10,64,128,64,8,3,8,0.0,0.0,1774.8000025749207,1895.3426897525787,29.039670654285075,3,3,3,3_3_3,0,
2026-03-02T08:39:20.538082+00:00,B,training_style,tune,training_style_tune_003,2048,1536,2048,bf16,NVIDIA GeForce RTX 4060,c10,64,128,64,8,3,8,0.0,0.0,475.0080108642578,600.0812739133835,27.12565176439118,3,3,3,3_3_3,0,
2026-03-02T08:39:20.548299+00:00,B,training_style,tune,training_style_tune_004,512,512,1024,bf16,NVIDIA GeForce RTX 4060,c04,64,64,64,4,3,8,0.0,0.0,56.32000043988228,84.5721588283777,9.53250901645629,2,2,3,2_2_3,0,
2026-03-02T08:39:20.575348+00:00,B,training_style,tune,training_style_tune_005,1024,1536,1536,bf16,NVIDIA GeForce RTX 4060,c10,64,128,64,8,3,8,0.0,0.0,177.05600708723068,297.6095950603484,27.289885768289604,3,3,3,3_3_3,0,
2026-03-02T08:39:20.588337+00:00,B,training_style,tune,training_style_tune_006,1024,1536,512,bf16,NVIDIA GeForce RTX 4060,c06,64,128,32,4,3,8,0.0,0.0,91.13600105047226,165.4899240285156,17.672629009780916,3,3,2,3_3_2,0,
2026-03-02T08:39:20.605647+00:00,B,training_style,tune,training_style_tune_007,2048,1536,512,bf16,NVIDIA GeForce RTX 4060,c06,64,128,32,4,3,8,0.0,0.0,137.7120018005371,172.1343985199928,23.391029321218078,3,3,2,3_3_2,0,
2026-03-02T08:39:20.689309+00:00,B,training_style,tune,training_style_tune_008,3072,3072,1536,bf16,NVIDIA GeForce RTX 4060,c10,64,128,64,8,3,8,0.0,0.0,895.7920074462891,1018.5779094696045,32.36357213171304,3,3,3,3_3_3,0,
2026-03-02T08:39:20.708824+00:00,B,training_style,tune,training_style_tune_009,1024,1536,1024,bf16,NVIDIA GeForce RTX 4060,c10,64,128,64,8,3,8,0.0,0.0,129.85600531101227,465.4182508587829,24.806134027340423,3,3,3,3_3_3,0,
2026-03-02T08:39:20.809736+00:00,B,training_style,tune,training_style_tune_010,1536,2048,4096,bf16,NVIDIA GeForce RTX 4060,c10,64,128,64,8,3,8,0.0,0.0,784.8000228404999,863.6972993612287,32.83614045107816,3,3,3,3_3_3,0,
2026-03-02T08:39:20.865332+00:00,B,training_style,tune,training_style_tune_011,1024,1024,4096,bf16,NVIDIA GeForce RTX 4060,c10,64,128,64,8,3,8,0.0,0.0,317.440003156662,399.93184030055977,27.060025537363426,3,3,3,3_3_3,0,
2026-03-02T08:39:21.189303+00:00,B,training_style,tune,training_style_tune_012,3072,4096,4096,bf16,NVIDIA GeForce RTX 4060,c10,64,128,64,8,3,8,0.0,0.0,3288.416028022766,3336.5776467323303,31.34616004349629,3,3,3,3_3_3,0,
2026-03-02T08:39:21.223141+00:00,B,training_style,tune,training_style_tune_013,512,1024,3072,bf16,NVIDIA GeForce RTX 4060,c11,32,128,32,4,2,8,0.0,0.0,162.81600296497345,197.21216335892677,19.784452469902362,2,3,3,2_3_3,0,
2026-03-02T08:39:21.244274+00:00,B,training_style,tune,training_style_tune_014,1536,1024,1024,bf16,NVIDIA GeForce RTX 4060,c10,64,128,64,8,3,8,0.0,0.0,170.30400037765503,267.19040006399155,18.91456140112282,3,3,3,3_3_3,0,
2026-03-02T08:39:21.307058+00:00,B,training_style,tune,training_style_tune_015,2048,3072,1536,bf16,NVIDIA GeForce RTX 4060,c10,64,128,64,8,3,8,0.0,0.0,602.0799875259399,648.181744813919,32.10097201772099,3,3,3,3_3_3,0,
2026-03-02T08:39:21.417117+00:00,B,training_style,tune,training_style_tune_016,1536,3072,3072,bf16,NVIDIA GeForce RTX 4060,c10,64,128,64,8,3,8,0.0,0.0,887.2960209846497,1016.8524742126465,32.67345796933485,3,3,3,3_3_3,0,
2026-03-02T08:39:21.454470+00:00,B,training_style,tune,training_style_tune_017,1024,1024,2048,bf16,NVIDIA GeForce RTX 4060,c10,64,128,64,8,3,8,0.0,0.0,176.04800313711166,734.6099016070355,24.396569228081194,3,3,3,3_3_3,0,
2026-03-02T08:39:21.486938+00:00,B,training_style,tune,training_style_tune_018,1536,1536,1536,bf16,NVIDIA GeForce RTX 4060,c10,64,128,64,8,3,8,0.0,0.0,250.88000297546387,257.9695937037468,28.88933843287953,3,3,3,3_3_3,0,
2026-03-02T08:39:21.530999+00:00,B,training_style,tune,training_style_tune_019,1536,1536,2048,bf16,NVIDIA GeForce RTX 4060,c10,64,128,64,8,3,8,0.0,0.0,296.9599962234497,428.7283077836033,32.542014206952295,3,3,3,3_3_3,0,
2026-03-02T08:39:21.553062+00:00,B,training_style,tune,training_style_tune_020,1536,1536,1024,bf16,NVIDIA GeForce RTX 4060,c10,64,128,64,8,3,8,0.0,0.0,176.95999890565872,203.8790406286716,27.304691669759556,3,3,3,3_3_3,0,
2026-03-02T08:39:21.583823+00:00,B,training_style,tune,training_style_tune_021,1024,2048,1536,bf16,NVIDIA GeForce RTX 4060,c10,64,128,64,8,3,8,0.0,0.0,206.84799551963806,322.7587264776229,31.14582245680189,3,3,3,3_3_3,0,
2026-03-02T08:39:21.599074+00:00,B,training_style,tune,training_style_tune_022,512,1024,1536,bf16,NVIDIA GeForce RTX 4060,c11,32,128,32,4,2,8,0.0,0.0,88.04799988865852,189.69824045896524,18.292439783262623,2,3,3,2_3_3,0,
2026-03-02T08:39:21.647847+00:00,B,training_style,tune,training_style_tune_023,1536,2048,2048,bf16,NVIDIA GeForce RTX 4060,c10,64,128,64,8,3,8,0.0,0.0,418.8160002231598,525.2780851721761,30.765065998277226,3,3,3,3_3_3,0,
2026-03-02T08:39:21.665278+00:00,B,training_style,tune,training_style_tune_024,1024,1024,1024,bf16,NVIDIA GeForce RTX 4060,c10,64,128,64,8,3,8,0.0,0.0,101.34399682283401,153.8457597792148,21.1900429756501,3,3,3,3_3_3,0,
2026-03-02T08:39:21.722028+00:00,B,training_style,tune,training_style_tune_025,1536,1024,4096,bf16,NVIDIA GeForce RTX 4060,c10,64,128,64,8,3,8,0.0,0.0,408.57601165771484,450.6851229071616,31.536119400946,3,3,3,3_3_3,0,
2026-03-02T08:39:21.751445+00:00,B,training_style,tune,training_style_tune_026,2048,4096,512,bf16,NVIDIA GeForce RTX 4060,c06,64,128,32,4,3,8,0.0,0.0,287.58399188518524,332.81503319740284,29.86930717419569,3,3,2,3_3_2,0,
2026-03-02T08:39:21.885851+00:00,B,training_style,tune,training_style_tune_027,4096,4096,1536,bf16,NVIDIA GeForce RTX 4060,c10,64,128,64,8,3,8,0.0,0.0,1606.0959696769714,1680.63906788826,32.089992456905286,3,3,3,3_3_3,0,
2026-03-02T08:39:21.970835+00:00,B,training_style,tune,training_style_tune_028,1536,1536,4096,bf16,NVIDIA GeForce RTX 4060,c10,64,128,64,8,3,8,0.0,0.0,611.3280057907104,758.1696182489395,31.615356484447997,3,3,3,3_3_3,0,
2026-03-02T08:39:22.083806+00:00,B,training_style,tune,training_style_tune_029,4096,2048,2048,bf16,NVIDIA GeForce RTX 4060,c10,64,128,64,8,3,8,0.0,0.0,1062.399983406067,1206.118402481079,32.34162170997243,3,3,3,3_3_3,0,
2026-03-02T08:39:22.112712+00:00,B,training_style,tune,training_style_tune_030,2048,2048,512,bf16,NVIDIA GeForce RTX 4060,c06,64,128,32,4,3,8,0.0,0.0,143.35999637842178,220.60480326414108,29.95931504255024,3,3,2,3_3_2,0,
2026-03-02T08:39:22.122752+00:00,B,training_style,tune,training_style_tune_031,512,512,1536,bf16,NVIDIA GeForce RTX 4060,c04,64,64,64,4,3,8,0.0,0.0,52.22399905323982,65.89407846331595,15.420235573668524,2,2,3,2_2_3,0,
2026-03-02T08:39:22.194707+00:00,B,training_style,eval,training_style_eval_000,2048,1536,3072,bf16,NVIDIA GeForce RTX 4060,c10,64,128,64,8,3,8,0.0,0.0,606.0640215873718,627.8883200883865,31.889952453172835,3,3,3,3_3_3,0,
2026-03-02T08:39:22.250255+00:00,B,training_style,eval,training_style_eval_001,1024,2048,2048,bf16,NVIDIA GeForce RTX 4060,c10,64,128,64,8,3,8,0.0,0.0,294.9120104312897,395.53311735391617,29.127110080860316,3,3,3,3_3_3,0,
2026-03-02T08:39:22.296927+00:00,B,training_style,eval,training_style_eval_002,1536,1024,3072,bf16,NVIDIA GeForce RTX 4060,c10,64,128,64,8,3,8,0.0,0.0,320.51199674606323,344.0601706504821,30.150747909933568,3,3,3,3_3_3,0,
2026-03-02T08:39:22.308719+00:00,B,training_style,eval,training_style_eval_003,1024,512,1024,bf16,NVIDIA GeForce RTX 4060,c06,64,128,32,4,3,8,0.0,0.0,70.65600156784058,90.13248071074486,15.196753285975904,3,2,3,3_2_3,0,
2026-03-02T08:39:22.332266+00:00,B,training_style,eval,training_style_eval_004,1024,2048,1024,bf16,NVIDIA GeForce RTX 4060,c10,64,128,64,8,3,8,0.0,0.0,174.0799993276596,295.83360299468023,24.67237656587911,3,3,3,3_3_3,0,
2026-03-02T08:39:22.348847+00:00,B,training_style,eval,training_style_eval_005,1024,512,1536,bf16,NVIDIA GeForce RTX 4060,c06,64,128,32,4,3,8,0.0,0.0,77.82400026917458,123.72127942740906,20.695578875787373,3,2,3,3_2_3,0,
2026-03-02T08:39:22.396238+00:00,B,training_style,eval,training_style_eval_006,2048,1536,2048,bf16,NVIDIA GeForce RTX 4060,c10,64,128,64,8,3,8,0.0,0.0,411.6480052471161,428.57471972703934,31.300775720424237,3,3,3,3_3_3,0,
2026-03-02T08:39:22.426567+00:00,B,training_style,eval,training_style_eval_007,1536,2048,1024,bf16,NVIDIA GeForce RTX 4060,c10,64,128,64,8,3,8,0.0,0.0,223.05600345134735,239.96704518795013,28.882661055142677,3,3,3,3_3_3,0,
2026-03-02T08:39:22.440058+00:00,B,training_style,eval,training_style_eval_008,512,512,2048,bf16,NVIDIA GeForce RTX 4060,c04,64,64,64,4,3,8,0.0,0.0,68.43199953436852,82.92384043335912,15.69063933987105,2,2,3,2_2_3,0,
2026-03-02T08:39:22.456148+00:00,B,training_style,eval,training_style_eval_009,1024,512,2048,bf16,NVIDIA GeForce RTX 4060,c06,64,128,32,4,3,8,0.0,0.0,79.64800298213959,118.42527963221072,26.962178178925033,3,2,3,3_2_3,0,
2026-03-02T08:39:22.499354+00:00,B,training_style,eval,training_style_eval_010,2048,3072,1024,bf16,NVIDIA GeForce RTX 4060,c10,64,128,64,8,3,8,0.0,0.0,420.8639860153198,511.5391904115677,30.615358681536073,3,3,3,3_3_3,0,
2026-03-02T08:39:22.576708+00:00,B,training_style,eval,training_style_eval_011,2048,4096,1536,bf16,NVIDIA GeForce RTX 4060,c10,64,128,64,8,3,8,0.0,0.0,807.5680136680603,848.3942627906799,31.910381961453368,3,3,3,3_3_3,0,
2026-03-02T08:39:22.700378+00:00,B,training_style,eval,training_style_eval_012,2048,3072,3072,bf16,NVIDIA GeForce RTX 4060,c10,64,128,64,8,3,8,0.0,0.0,1188.86399269104,1353.6249446868896,32.51398469601519,3,3,3,3_3_3,0,
2026-03-02T08:39:22.764413+00:00,B,training_style,eval,training_style_eval_013,3072,1536,1536,bf16,NVIDIA GeForce RTX 4060,c10,64,128,64,8,3,8,0.0,0.0,465.92000126838684,583.3113557100294,31.11159551969965,3,3,3,3_3_3,0,
2026-03-02T08:39:22.807448+00:00,B,training_style,eval,training_style_eval_014,2048,1536,1536,bf16,NVIDIA GeForce RTX 4060,c10,64,128,64,8,3,8,0.0,0.0,321.52000069618225,427.1740782260894,30.05622168162289,3,3,3,3_3_3,0,
2026-03-02T08:39:22.864882+00:00,B,training_style,eval,training_style_eval_015,4096,2048,1024,bf16,NVIDIA GeForce RTX 4060,c10,64,128,64,8,3,8,0.0,0.0,526.3360142707825,655.9846270084381,32.640497169478365,3,3,3,3_3_3,0,
2026-03-02T08:39:22.882557+00:00,B,training_style,eval,training_style_eval_016,2048,1024,512,bf16,NVIDIA GeForce RTX 4060,c06,64,128,32,4,3,8,0.0,0.0,98.25600311160088,192.67583802342412,21.856004518735112,3,3,2,3_3_2,0,
2026-03-02T08:39:23.001231+00:00,B,training_style,eval,training_style_eval_017,2048,4096,2048,bf16,NVIDIA GeForce RTX 4060,c10,64,128,64,8,3,8,0.0,0.0,1068.5440301895142,1165.5577528476715,32.15565984857549,3,3,3,3_3_3,0,
2026-03-02T08:39:23.072366+00:00,B,training_style,eval,training_style_eval_018,1536,2048,3072,bf16,NVIDIA GeForce RTX 4060,c10,64,128,64,8,3,8,0.0,0.0,604.1119992733002,675.0742405653,31.99299609219699,3,3,3,3_3_3,0,
2026-03-02T08:39:23.137414+00:00,B,training_style,eval,training_style_eval_019,1536,1536,3072,bf16,NVIDIA GeForce RTX 4060,c10,64,128,64,8,3,8,0.0,0.0,461.8239998817444,486.9222369790077,31.38752994151831,3,3,3,3_3_3,0,
2026-03-02T08:39:23.204700+00:00,B,training_style,eval,training_style_eval_020,3072,1536,2048,bf16,NVIDIA GeForce RTX 4060,c10,64,128,64,8,3,8,0.0,0.0,607.2319746017456,690.4755288362502,31.82861515926576,3,3,3,3_3_3,0,
2026-03-02T08:39:23.283864+00:00,B,training_style,eval,training_style_eval_021,2048,1024,4096,bf16,NVIDIA GeForce RTX 4060,c10,64,128,64,8,3,8,0.0,0.0,553.3280074596405,630.0019311904907,31.048255198347412,3,3,3,3_3_3,0,
2026-03-02T08:39:23.298779+00:00,B,training_style,eval,training_style_eval_022,512,512,1536,bf16,NVIDIA GeForce RTX 4060,c04,64,64,64,4,3,8,0.0,0.0,59.29600074887276,85.38111895322791,13.581124491187701,2,2,3,2_2_3,0,
2026-03-02T08:39:23.622799+00:00,B,training_style,eval,training_style_eval_023,3072,4096,4096,bf16,NVIDIA GeForce RTX 4060,c10,64,128,64,8,3,8,0.0,0.0,3180.543899536133,3349.749755859375,32.409304307679456,3,3,3,3_3_3,0,
2026-03-02T08:39:23.691354+00:00,B,training_style,eval,training_style_eval_024,1536,1024,4096,bf16,NVIDIA GeForce RTX 4060,c10,64,128,64,8,3,8,0.0,0.0,416.25601053237915,454.63615387678135,30.954272279505563,3,3,3,3_3_3,0,
2026-03-02T08:39:23.840862+00:00,B,training_style,eval,training_style_eval_025,4096,3072,2048,bf16,NVIDIA GeForce RTX 4060,c10,64,128,64,8,3,8,0.0,0.0,1534.9760055541992,1649.0156674385069,33.57681642286764,3,3,3,3_3_3,0,
2026-03-02T08:39:23.850775+00:00,B,training_style,eval,training_style_eval_026,1024,512,512,bf16,NVIDIA GeForce RTX 4060,c02,32,64,32,2,2,8,0.0,0.0,57.42399953305721,79.36159946024415,9.349242762008243,3,2,2,3_2_2,0,
2026-03-02T08:39:23.908548+00:00,B,training_style,eval,training_style_eval_027,2048,4096,1024,bf16,NVIDIA GeForce RTX 4060,c10,64,128,64,8,3,8,0.0,0.0,558.9280128479004,648.8431924581527,30.73717686194253,3,3,3,3_3_3,0,
2026-03-02T08:39:23.932618+00:00,B,training_style,eval,training_style_eval_028,1536,1536,1024,bf16,NVIDIA GeForce RTX 4060,c10,64,128,64,8,3,8,0.0,0.0,181.2319979071617,220.74719950556752,26.661065726788312,3,3,3,3_3_3,0,
2026-03-02T08:39:23.965353+00:00,B,training_style,eval,training_style_eval_029,1024,512,4096,bf16,NVIDIA GeForce RTX 4060,c06,64,128,32,4,3,8,0.0,0.0,185.10399758815765,215.53152576088894,23.202995893994554,3,2,3,3_2_3,0,
2026-03-02T08:39:24.001731+00:00,B,training_style,eval,training_style_eval_030,1024,1024,3072,bf16,NVIDIA GeForce RTX 4060,c10,64,128,64,8,3,8,0.0,0.0,223.93600642681122,294.8608064651488,28.76916064905167,3,3,3,3_3_3,0,
2026-03-02T08:39:24.012389+00:00,B,training_style,eval,training_style_eval_031,1024,1024,512,bf16,NVIDIA GeForce RTX 4060,c06,64,128,32,4,3,8,0.0,0.0,72.7040022611618,151.5724791586399,14.768675597018525,3,3,2,3_3_2,0,
2026-03-02T08:39:24.024921+00:00,B,training_style,eval,training_style_eval_032,512,1024,1024,bf16,NVIDIA GeForce RTX 4060,c11,32,128,32,4,2,8,0.0,0.0,76.80000364780426,100.97727939486498,13.981012669270863,2,3,3,2_3_3,0,
2026-03-02T08:39:24.104620+00:00,B,training_style,eval,training_style_eval_033,3072,2048,2048,bf16,NVIDIA GeForce RTX 4060,c10,64,128,64,8,3,8,0.0,0.0,797.3280251026154,821.2889552116394,32.32020318448414,3,3,3,3_3_3,0,
2026-03-02T08:39:24.120590+00:00,B,training_style,eval,training_style_eval_034,1536,1024,512,bf16,NVIDIA GeForce RTX 4060,c06,64,128,32,4,3,8,0.0,0.0,83.8559977710247,173.72255757451052,19.206887745798493,3,3,2,3_3_2,0,
2026-03-02T08:39:24.539299+00:00,B,training_style,eval,training_style_eval_035,4096,4096,4096,bf16,NVIDIA GeForce RTX 4060,c10,64,128,64,8,3,8,0.0,0.0,4309.920072555542,4509.223427772522,31.88897964655441,3,3,3,3_3_3,0,
2026-03-02T08:39:24.775835+00:00,B,training_style,eval,training_style_eval_036,2048,4096,4096,bf16,NVIDIA GeForce RTX 4060,c10,64,128,64,8,3,8,0.0,0.0,2208.7199687957764,2250.4140496253967,31.112806379645665,3,3,3,3_3_3,0,
2026-03-02T08:39:24.821731+00:00,B,training_style,eval,training_style_eval_037,4096,2048,512,bf16,NVIDIA GeForce RTX 4060,c06,64,128,32,4,3,8,0.0,0.0,299.9200075864792,1149.3651187419864,28.64075211628944,3,3,2,3_3_2,0,
2026-03-02T08:39:24.837943+00:00,B,training_style,eval,training_style_eval_038,2048,1536,512,bf16,NVIDIA GeForce RTX 4060,c06,64,128,32,4,3,8,0.0,0.0,125.95200538635254,206.84447810053823,25.575023296524932,3,3,2,3_3_2,0,
2026-03-02T08:39:24.923927+00:00,B,training_style,eval,training_style_eval_039,3072,3072,1536,bf16,NVIDIA GeForce RTX 4060,c10,64,128,64,8,3,8,0.0,0.0,907.0879817008972,1019.4841742515564,31.960548296140352,3,3,3,3_3_3,0,
2026-03-02T08:39:24.942260+00:00,B,training_style,eval,training_style_eval_040,1536,1536,512,bf16,NVIDIA GeForce RTX 4060,c06,64,128,32,4,3,8,0.0,0.0,102.39999741315842,188.5027202963829,23.592960596008318,3,3,2,3_3_2,0,
2026-03-02T08:39:25.055532+00:00,B,training_style,eval,training_style_eval_041,3072,3072,2048,bf16,NVIDIA GeForce RTX 4060,c10,64,128,64,8,3,8,0.0,0.0,1180.4800033569336,1330.1478934288025,32.74490508443813,3,3,3,3_3_3,0,
2026-03-02T08:39:25.174893+00:00,B,training_style,eval,training_style_eval_042,3072,4096,1536,bf16,NVIDIA GeForce RTX 4060,c10,64,128,64,8,3,8,0.0,0.0,1189.903974533081,1364.6272206306455,32.48556731577279,3,3,3,3_3_3,0,
2026-03-02T08:39:25.242168+00:00,B,training_style,eval,training_style_eval_043,2048,3072,1536,bf16,NVIDIA GeForce RTX 4060,c10,64,128,64,8,3,8,0.0,0.0,612.8640174865723,851.6988879442213,31.536119400946,3,3,3,3_3_3,0,
2026-03-02T08:39:25.266068+00:00,B,training_style,eval,training_style_eval_044,512,512,4096,bf16,NVIDIA GeForce RTX 4060,c04,64,64,64,4,3,8,0.0,0.0,107.82399773597717,243.57662931084616,19.916564893637386,2,2,3,2_2_3,0,
2026-03-02T08:39:25.324840+00:00,B,training_style,eval,training_style_eval_045,2048,1024,3072,bf16,NVIDIA GeForce RTX 4060,c10,64,128,64,8,3,8,0.0,0.0,425.7600009441376,524.2377460002899,30.263298241796512,3,3,3,3_3_3,0,
2026-03-02T08:39:25.647873+00:00,B,training_style,eval,training_style_eval_046,4096,3072,4096,bf16,NVIDIA GeForce RTX 4060,c10,64,128,64,8,3,8,0.0,0.0,3218.4319496154785,3311.656904220581,32.027775238906436,3,3,3,3_3_3,0,
2026-03-02T08:39:25.701745+00:00,B,training_style,eval,training_style_eval_047,1536,3072,1024,bf16,NVIDIA GeForce RTX 4060,c10,64,128,64,8,3,8,0.0,0.0,333.8240087032318,491.19712591171253,28.948416423190725,3,3,3,3_3_3,0,
2026-03-02T08:39:25.719138+00:00,B,training_style,eval,training_style_eval_048,512,512,3072,bf16,NVIDIA GeForce RTX 4060,c04,64,64,64,4,3,8,0.0,0.0,82.7999971807003,177.47968032956118,19.451845300007022,2,2,3,2_2_3,0,
2026-03-02T08:39:25.749404+00:00,B,training_style,eval,training_style_eval_049,512,1024,4096,bf16,NVIDIA GeForce RTX 4060,c11,32,128,32,4,2,8,0.0,0.0,197.39200174808502,207.9129633307457,21.758568016759405,2,3,3,2_3_3,0,
2026-03-02T08:39:25.772275+00:00,B,training_style,eval,training_style_eval_050,3072,2048,512,bf16,NVIDIA GeForce RTX 4060,c06,64,128,32,4,3,8,0.0,0.0,221.0400030016899,228.3964790403843,29.146086031996415,3,3,2,3_3_2,0,
2026-03-02T08:39:25.780614+00:00,B,training_style,eval,training_style_eval_051,512,512,1024,bf16,NVIDIA GeForce RTX 4060,c04,64,64,64,4,3,8,0.0,0.0,44.03200000524521,82.41375774145126,12.19274418459408,2,2,3,2_2_3,0,
2026-03-02T08:39:25.819117+00:00,B,training_style,eval,training_style_eval_052,1536,2048,1536,bf16,NVIDIA GeForce RTX 4060,c10,64,128,64,8,3,8,0.0,0.0,319.487988948822,331.3152042031288,30.247385661650025,3,3,3,3_3_3,0,
2026-03-02T08:39:25.919426+00:00,B,training_style,eval,training_style_eval_053,1536,3072,3072,bf16,NVIDIA GeForce RTX 4060,c10,64,128,64,8,3,8,0.0,0.0,890.2400135993958,1001.3506996631621,32.565407985633236,3,3,3,3_3_3,0,
2026-03-02T08:39:25.961029+00:00,B,training_style,eval,training_style_eval_054,4096,3072,512,bf16,NVIDIA GeForce RTX 4060,c06,64,128,32,4,3,8,0.0,0.0,415.6640022993088,469.20863717794407,30.99835881078275,3,3,2,3_3_2,0,
2026-03-02T08:39:25.977126+00:00,B,training_style,eval,training_style_eval_055,1024,1024,1024,bf16,NVIDIA GeForce RTX 4060,c10,64,128,64,8,3,8,0.0,0.0,103.7600003182888,219.32287320494652,20.696642650467332,3,3,3,3_3_3,0,
2026-03-02T08:39:26.004123+00:00,B,training_style,eval,training_style_eval_056,512,1024,3072,bf16,NVIDIA GeForce RTX 4060,c11,32,128,32,4,2,8,0.0,0.0,157.69599378108978,182.57920205593103,20.42680600035811,2,3,3,2_3_3,0,
2026-03-02T08:39:26.024305+00:00,B,training_style,eval,training_style_eval_057,1024,1536,1024,bf16,NVIDIA GeForce RTX 4060,c10,64,128,64,8,3,8,0.0,0.0,166.75199568271637,235.47871977090833,19.317462791444573,3,3,3,3_3_3,0,
2026-03-02T08:39:26.146963+00:00,B,training_style,eval,training_style_eval_058,4096,2048,2048,bf16,NVIDIA GeForce RTX 4060,c10,64,128,64,8,3,8,0.0,0.0,1058.8159561157227,1226.04541182518,32.45109612254905,3,3,3,3_3_3,0,
2026-03-02T08:39:26.174452+00:00,B,training_style,eval,training_style_eval_059,2048,3072,512,bf16,NVIDIA GeForce RTX 4060,c06,64,128,32,4,3,8,0.0,0.0,215.03999829292297,296.81280970573425,29.959314523543792,3,3,2,3_3_2,0,
2026-03-02T08:39:26.212040+00:00,B,training_style,eval,training_style_eval_060,3072,3072,512,bf16,NVIDIA GeForce RTX 4060,c06,64,128,32,4,3,8,0.0,0.0,313.34400177001953,407.63486742973316,30.840470414023454,3,3,2,3_3_2,0,
2026-03-02T08:39:26.271518+00:00,B,training_style,eval,training_style_eval_061,2048,2048,2048,bf16,NVIDIA GeForce RTX 4060,c10,64,128,64,8,3,8,0.0,0.0,555.8879971504211,582.8163409233093,30.90527097556883,3,3,3,3_3_3,0,
2026-03-02T08:39:26.286043+00:00,B,training_style,eval,training_style_eval_062,1024,2048,512,bf16,NVIDIA GeForce RTX 4060,c06,64,128,32,4,3,8,0.0,0.0,100.81599652767181,189.72672447562212,21.301020889185597,3,3,2,3_3_2,0,
2026-03-02T08:39:26.404898+00:00,B,training_style,eval,training_style_eval_063,3072,1536,3072,bf16,NVIDIA GeForce RTX 4060,c10,64,128,64,8,3,8,0.0,0.0,898.8800048828125,1045.4675590991974,32.25239085363744,3,3,3,3_3_3,0,
2026-03-02T08:39:26.422325+00:00,B,adversarial,tune,adversarial_tune_000,1,1024,1024,bf16,NVIDIA GeForce RTX 4060,c02,32,64,32,2,2,8,0.0,0.0,34.112000837922096,92.90624104440207,0.06147842250486254,0,3,3,0_3_3,0,
2026-03-02T08:39:26.446713+00:00,B,adversarial,tune,adversarial_tune_001,1,1024,4096,bf16,NVIDIA GeForce RTX 4060,c02,32,64,32,2,2,8,0.0,0.0,74.75200295448303,80.39423741400242,0.1122191736468637,0,3,3,0_3_3,0,
2026-03-02T08:39:26.467327+00:00,B,adversarial,tune,adversarial_tune_002,1,4096,1024,bf16,NVIDIA GeForce RTX 4060,c02,32,64,32,2,2,8,0.0,0.0,43.007999658584595,126.03392176330088,0.19504762059598826,0,3,3,0_3_3,0,
2026-03-02T08:39:26.555962+00:00,B,adversarial,tune,adversarial_tune_003,1,4096,4096,bf16,NVIDIA GeForce RTX 4060,c02,32,64,32,2,2,8,0.0,0.0,162.81600296497345,228.454402834177,0.20608804656148297,0,3,3,0_3_3,0,
2026-03-02T08:39:26.602665+00:00,B,adversarial,tune,adversarial_tune_004,1,8192,1024,bf16,NVIDIA GeForce RTX 4060,c02,32,64,32,2,2,8,0.0,0.0,55.296000093221664,88.08448001742363,0.30340740689590306,0,3,3,0_3_3,0,
2026-03-02T08:39:26.771283+00:00,B,adversarial,tune,adversarial_tune_005,1,8192,4096,bf16,NVIDIA GeForce RTX 4060,c02,32,64,32,2,2,8,0.0,0.0,295.8879917860031,393.2262352108954,0.2268049595217624,0,3,3,0_3_3,0,
2026-03-02T08:39:26.779521+00:00,B,adversarial,tune,adversarial_tune_006,2,1024,1024,bf16,NVIDIA GeForce RTX 4060,c02,32,64,32,2,2,8,0.0,0.0,38.415998220443726,111.11424036324024,0.1091811795682542,0,3,3,0_3_3,0,
2026-03-02T08:39:26.797256+00:00,B,adversarial,tune,adversarial_tune_007,2,1024,4096,bf16,NVIDIA GeForce RTX 4060,c02,32,64,32,2,2,8,0.0,0.0,69.63200122117996,78.8684768974781,0.2409411722450521,0,3,3,0_3_3,0,
2026-03-02T08:39:26.813426+00:00,B,adversarial,tune,adversarial_tune_008,2,4096,1024,bf16,NVIDIA GeForce RTX 4060,c02,32,64,32,2,2,8,0.0,0.0,36.86400130391121,93.31711966544377,0.45511109501344243,0,3,3,0_3_3,0,
2026-03-02T08:39:26.898472+00:00,B,adversarial,tune,adversarial_tune_009,2,4096,4096,bf16,NVIDIA GeForce RTX 4060,c02,32,64,32,2,2,8,0.0,0.0,159.743994474411,179.38432112336156,0.4201025786340281,0,3,3,0_3_3,0,
2026-03-02T08:39:26.938035+00:00,B,adversarial,tune,adversarial_tune_010,2,8192,1024,bf16,NVIDIA GeForce RTX 4060,c02,32,64,32,2,2,8,0.0,0.0,50.52799917757511,110.827523767948,0.6640760082756617,0,3,3,0_3_3,0,
2026-03-02T08:39:27.100320+00:00,B,adversarial,tune,adversarial_tune_011,2,8192,4096,bf16,NVIDIA GeForce RTX 4060,c02,32,64,32,2,2,8,0.0,0.0,295.9359884262085,418.1568068265914,0.4535363499173306,0,3,3,0_3_3,0,
2026-03-02T08:39:27.109113+00:00,B,adversarial,tune,adversarial_tune_012,4,1024,1024,bf16,NVIDIA GeForce RTX 4060,c02,32,64,32,2,2,8,0.0,0.0,41.7919997125864,186.5727994590995,0.2007228191445843,0,3,3,0_3_3,0,
2026-03-02T08:39:27.129390+00:00,B,adversarial,tune,adversarial_tune_013,4,1024,4096,bf16,NVIDIA GeForce RTX 4060,c02,32,64,32,2,2,8,0.0,0.0,69.63200122117996,239.73375901579834,0.4818823444901042,0,3,3,0_3_3,0,
2026-03-02T08:39:27.147591+00:00,B,adversarial,tune,adversarial_tune_014,4,4096,1024,bf16,NVIDIA GeForce RTX 4060,c02,32,64,32,2,2,8,0.0,0.0,46.08000069856644,131.8502378463745,0.7281777667387034,0,3,3,0_3_3,0,
2026-03-02T08:39:27.234821+00:00,B,adversarial,tune,adversarial_tune_015,4,4096,4096,bf16,NVIDIA GeForce RTX 4060,c02,32,64,32,2,2,8,0.0,0.0,161.79199516773224,344.7910332679746,0.8295696450300549,0,3,3,0_3_3,0,
2026-03-02T08:39:27.277022+00:00,B,adversarial,tune,adversarial_tune_016,4,8192,1024,bf16,NVIDIA GeForce RTX 4060,c02,32,64,32,2,2,8,0.0,0.0,50.175998359918594,135.1235236227512,1.337469431472392,0,3,3,0_3_3,0,
2026-03-02T08:39:27.442178+00:00,B,adversarial,tune,adversarial_tune_017,4,8192,4096,bf16,NVIDIA GeForce RTX 4060,c02,32,64,32,2,2,8,0.0,0.0,298.68799448013306,406.6816070675849,0.8987152512346951,0,3,3,0_3_3,0,
2026-03-02T08:39:27.450423+00:00,B,adversarial,tune,adversarial_tune_018,8,1024,1024,bf16,NVIDIA GeForce RTX 4060,c02,32,64,32,2,2,8,0.0,0.0,38.656000047922134,78.29503837972871,0.4340132444950631,0,3,3,0_3_3,0,
2026-03-02T08:39:27.470054+00:00,B,adversarial,tune,adversarial_tune_019,8,1024,4096,bf16,NVIDIA GeForce RTX 4060,c02,32,64,32,2,2,8,0.0,0.0,48.46400022506714,106.08767896890629,1.3847157413409126,0,3,3,0_3_3,0,
2026-03-02T08:39:27.486154+00:00,B,adversarial,tune,adversarial_tune_020,8,4096,1024,bf16,NVIDIA GeForce RTX 4060,c02,32,64,32,2,2,8,0.0,0.0,37.88800165057182,55.95359988510605,1.7712431660799182,0,3,3,0_3_3,0,
2026-03-02T08:39:27.570650+00:00,B,adversarial,tune,adversarial_tune_021,8,4096,4096,bf16,NVIDIA GeForce RTX 4060,c02,32,64,32,2,2,8,0.0,0.0,165.80799967050552,305.8483189344405,1.618953588086439,0,3,3,0_3_3,0,
2026-03-02T08:39:27.613501+00:00,B,adversarial,tune,adversarial_tune_022,8,8192,1024,bf16,NVIDIA GeForce RTX 4060,c02,32,64,32,2,2,8,0.0,0.0,76.59200206398964,222.79936596751196,1.7523726287748205,0,3,3,0_3_3,0,
2026-03-02T08:39:27.777101+00:00,B,adversarial,tune,adversarial_tune_023,8,8192,4096,bf16,NVIDIA GeForce RTX 4060,c02,32,64,32,2,2,8,0.0,0.0,299.3279993534088,425.4278376698494,1.7935873461878533,0,3,3,0_3_3,0,
2026-03-02T08:39:27.786038+00:00,B,adversarial,tune,adversarial_tune_024,16,1024,1024,bf16,NVIDIA GeForce RTX 4060,c02,32,64,32,2,2,8,0.0,0.0,40.92799872159958,116.3305579870939,0.8198405259989365,0,3,3,0_3_3,0,
2026-03-02T08:39:27.806053+00:00,B,adversarial,tune,adversarial_tune_025,16,1024,4096,bf16,NVIDIA GeForce RTX 4060,c02,32,64,32,2,2,8,0.0,0.0,71.68000191450119,128.75775858759866,1.8724570928456843,0,3,3,0_3_3,0,
2026-03-02T08:39:27.824104+00:00,B,adversarial,tune,adversarial_tune_026,16,4096,1024,bf16,NVIDIA GeForce RTX 4060,c02,32,64,32,2,2,8,0.0,0.0,42.55999997258186,79.41536061465739,3.153612032106818,0,3,3,0_3_3,0,
2026-03-02T08:39:27.912432+00:00,B,adversarial,tune,adversarial_tune_027,16,4096,4096,bf16,NVIDIA GeForce RTX 4060,c02,32,64,32,2,2,8,0.0,0.0,167.88800060749054,278.19008111953735,3.1977920402731086,0,3,3,0_3_3,0,
2026-03-02T08:39:27.979257+00:00,B,adversarial,tune,adversarial_tune_028,16,8192,1024,bf16,NVIDIA GeForce RTX 4060,c02,32,64,32,2,2,8,0.0,0.0,78.14399898052216,133.22591967880723,3.435138455953721,0,3,3,0_3_3,0,
2026-03-02T08:39:28.161921+00:00,B,adversarial,tune,adversarial_tune_029,16,8192,4096,bf16,NVIDIA GeForce RTX 4060,c02,32,64,32,2,2,8,0.0,0.0,299.50399696826935,438.0339145660399,3.585066759939623,0,3,3,0_3_3,0,
2026-03-02T08:39:28.170930+00:00,B,adversarial,tune,adversarial_tune_030,32,1024,1024,bf16,NVIDIA GeForce RTX 4060,c02,32,64,32,2,2,8,0.0,0.0,37.88800165057182,143.3007991313934,1.7712431660799182,0,3,3,0_3_3,0,
2026-03-02T08:39:28.190462+00:00,B,adversarial,tune,adversarial_tune_031,32,1024,4096,bf16,NVIDIA GeForce RTX 4060,c02,32,64,32,2,2,8,0.0,0.0,72.7040022611618,111.16416260600084,3.6921688992546313,0,3,3,0_3_3,0,
2026-03-02T08:39:28.199044+00:00,B,adversarial,eval,adversarial_eval_000,1,1024,1024,bf16,NVIDIA GeForce RTX 4060,c02,32,64,32,2,2,8,0.0,0.0,36.687999963760376,54.353919774293885,0.05716179682924995,0,3,3,0_3_3,0,
2026-03-02T08:39:28.219497+00:00,B,adversarial,eval,adversarial_eval_001,1,1024,4096,bf16,NVIDIA GeForce RTX 4060,c02,32,64,32,2,2,8,0.0,0.0,73.72800260782242,89.09216023981571,0.11377777375336061,0,3,3,0_3_3,0,
2026-03-02T08:39:28.238811+00:00,B,adversarial,eval,adversarial_eval_002,1,4096,1024,bf16,NVIDIA GeForce RTX 4060,c02,32,64,32,2,2,8,0.0,0.0,56.832000613212585,175.88831990957254,0.14760360201097292,0,3,3,0_3_3,0,
2026-03-02T08:39:28.325824+00:00,B,adversarial,eval,adversarial_eval_003,1,4096,4096,bf16,NVIDIA GeForce RTX 4060,c02,32,64,32,2,2,8,0.0,0.0,168.75199973583221,231.41599968075752,0.19883872222271018,0,3,3,0_3_3,0,
2026-03-02T08:39:28.372919+00:00,B,adversarial,eval,adversarial_eval_004,1,8192,1024,bf16,NVIDIA GeForce RTX 4060,c02,32,64,32,2,2,8,0.0,0.0,80.89599758386612,174.19071868062014,0.20739241125751373,0,3,3,0_3_3,0,
2026-03-02T08:39:28.535110+00:00,B,adversarial,eval,adversarial_eval_005,1,8192,4096,bf16,NVIDIA GeForce RTX 4060,c02,32,64,32,2,2,8,0.0,0.0,306.17600679397583,433.82400006055826,0.2191839416246525,0,3,3,0_3_3,0,
2026-03-02T08:39:28.544175+00:00,B,adversarial,eval,adversarial_eval_006,2,1024,1024,bf16,NVIDIA GeForce RTX 4060,c02,32,64,32,2,2,8,0.0,0.0,50.16000010073185,118.69184277951709,0.0836185006295246,0,3,3,0_3_3,0,
2026-03-02T08:39:28.565341+00:00,B,adversarial,eval,adversarial_eval_007,2,1024,4096,bf16,NVIDIA GeForce RTX 4060,c02,32,64,32,2,2,8,0.0,0.0,103.93599793314934,198.0006399750709,0.16141872242176333,0,3,3,0_3_3,0,
2026-03-02T08:39:28.582419+00:00,B,adversarial,eval,adversarial_eval_008,2,4096,1024,bf16,NVIDIA GeForce RTX 4060,c02,32,64,32,2,2,8,0.0,0.0,51.952000707387924,146.4627206325528,0.32293686040110803,0,3,3,0_3_3,0,
2026-03-02T08:39:28.675572+00:00,B,adversarial,eval,adversarial_eval_009,2,4096,4096,bf16,NVIDIA GeForce RTX 4060,c02,32,64,32,2,2,8,0.0,0.0,251.72799825668335,341.1888071894645,0.2665927686421678,0,3,3,0_3_3,0,
2026-03-02T08:39:28.719343+00:00,B,adversarial,eval,adversarial_eval_010,2,8192,1024,bf16,NVIDIA GeForce RTX 4060,c02,32,64,32,2,2,8,0.0,0.0,73.72800260782242,173.5782428085804,0.45511109501344243,0,3,3,0_3_3,0,
2026-03-02T08:39:28.888648+00:00,B,adversarial,eval,adversarial_eval_011,2,8192,4096,bf16,NVIDIA GeForce RTX 4060,c02,32,64,32,2,2,8,0.0,0.0,470.0160026550293,560.6400030851363,0.28555991124095786,0,3,3,0_3_3,0,
2026-03-02T08:39:28.900518+00:00,B,adversarial,eval,adversarial_eval_012,4,1024,1024,bf16,NVIDIA GeForce RTX 4060,c02,32,64,32,2,2,8,0.0,0.0,76.80000364780426,180.93056529760355,0.10922666147867861,0,3,3,0_3_3,0,
2026-03-02T08:39:28.924176+00:00,B,adversarial,eval,adversarial_eval_013,4,1024,4096,bf16,NVIDIA GeForce RTX 4060,c02,32,64,32,2,2,8,0.0,0.0,144.4000005722046,210.2275195717811,0.232371411821579,0,3,3,0_3_3,0,
2026-03-02T08:39:28.942148+00:00,B,adversarial,eval,adversarial_eval_014,4,4096,1024,bf16,NVIDIA GeForce RTX 4060,c02,32,64,32,2,2,8,0.0,0.0,58.30400064587593,87.87039920687667,0.5755082263359819,0,3,3,0_3_3,0,
2026-03-02T08:39:29.029326+00:00,B,adversarial,eval,adversarial_eval_015,4,4096,4096,bf16,NVIDIA GeForce RTX 4060,c02,32,64,32,2,2,8,0.0,0.0,251.3439953327179,277.6473569869995,0.5340001372315603,0,3,3,0_3_3,0,
2026-03-02T08:39:29.071185+00:00,B,adversarial,eval,adversarial_eval_016,4,8192,1024,bf16,NVIDIA GeForce RTX 4060,c02,32,64,32,2,2,8,0.0,0.0,80.38399741053581,107.42623828351498,0.834853530078415,0,3,3,0_3_3,0,
2026-03-02T08:39:29.242398+00:00,B,adversarial,eval,adversarial_eval_017,4,8192,4096,bf16,NVIDIA GeForce RTX 4060,c02,32,64,32,2,2,8,0.0,0.0,477.183997631073,603.98592710495,0.5625407753248601,0,3,3,0_3_3,0,
2026-03-02T08:39:29.251426+00:00,B,adversarial,eval,adversarial_eval_018,8,1024,1024,bf16,NVIDIA GeForce RTX 4060,c02,32,64,32,2,2,8,0.0,0.0,54.27199974656105,161.38720087707026,0.30913207691528055,0,3,3,0_3_3,0,
2026-03-02T08:39:29.275141+00:00,B,adversarial,eval,adversarial_eval_019,8,1024,4096,bf16,NVIDIA GeForce RTX 4060,c02,32,64,32,2,2,8,0.0,0.0,130.0479993224144,236.41855716705322,0.5160314987516572,0,3,3,0_3_3,0,
2026-03-02T08:39:29.293933+00:00,B,adversarial,eval,adversarial_eval_020,8,4096,1024,bf16,NVIDIA GeForce RTX 4060,c02,32,64,32,2,2,8,0.0,0.0,63.35999816656113,107.18208268284795,1.0591677074166548,0,3,3,0_3_3,0,
2026-03-02T08:39:29.391534+00:00,B,adversarial,eval,adversarial_eval_021,8,4096,4096,bf16,NVIDIA GeForce RTX 4060,c02,32,64,32,2,2,8,0.0,0.0,252.9279887676239,365.01407593488693,1.0613117880228886,0,3,3,0_3_3,0,
2026-03-02T08:39:29.437006+00:00,B,adversarial,eval,adversarial_eval_022,8,8192,1024,bf16,NVIDIA GeForce RTX 4060,c02,32,64,32,2,2,8,0.0,0.0,87.8559984266758,188.2051163911819,1.5277013568062456,0,3,3,0_3_3,0,
2026-03-02T08:39:29.607237+00:00,B,adversarial,eval,adversarial_eval_023,8,8192,4096,bf16,NVIDIA GeForce RTX 4060,c02,32,64,32,2,2,8,0.0,0.0,477.07200050354004,593.6947047710416,1.1253456740981307,0,3,3,0_3_3,0,
2026-03-02T08:39:29.617576+00:00,B,adversarial,eval,adversarial_eval_024,16,1024,1024,bf16,NVIDIA GeForce RTX 4060,c02,32,64,32,2,2,8,0.0,0.0,51.59999988973141,119.27552297711362,0.6502796913121206,0,3,3,0_3_3,0,
2026-03-02T08:39:29.641920+00:00,B,adversarial,eval,adversarial_eval_025,16,1024,4096,bf16,NVIDIA GeForce RTX 4060,c02,32,64,32,2,2,8,0.0,0.0,142.83199608325958,211.0102404654026,0.9396895071168917,0,3,3,0_3_3,0,
2026-03-02T08:39:29.660083+00:00,B,adversarial,eval,adversarial_eval_026,16,4096,1024,bf16,NVIDIA GeForce RTX 4060,c02,32,64,32,2,2,8,0.0,0.0,67.58400052785873,142.98112004995343,1.9859393784283939,0,3,3,0_3_3,0,
2026-03-02T08:39:29.753309+00:00,B,adversarial,eval,adversarial_eval_027,16,4096,4096,bf16,NVIDIA GeForce RTX 4060,c02,32,64,32,2,2,8,0.0,0.0,253.66398692131042,266.80318981409073,2.11646484988247,0,3,3,0_3_3,0,
2026-03-02T08:39:29.798786+00:00,B,adversarial,eval,adversarial_eval_028,16,8192,1024,bf16,NVIDIA GeForce RTX 4060,c02,32,64,32,2,2,8,0.0,0.0,86.94399893283844,132.05951929092407,3.0874523750323255,0,3,3,0_3_3,0,
2026-03-02T08:39:29.969113+00:00,B,adversarial,eval,adversarial_eval_029,16,8192,4096,bf16,NVIDIA GeForce RTX 4060,c02,32,64,32,2,2,8,0.0,0.0,475.5040109157562,549.9590542912481,2.258113074445195,0,3,3,0_3_3,0,
2026-03-02T08:39:29.979559+00:00,B,adversarial,eval,adversarial_eval_030,32,1024,1024,bf16,NVIDIA GeForce RTX 4060,c02,32,64,32,2,2,8,0.0,0.0,63.919998705387115,120.63743598759169,1.049888381714628,0,3,3,0_3_3,0,
2026-03-02T08:39:30.002602+00:00,B,adversarial,eval,adversarial_eval_031,32,1024,4096,bf16,NVIDIA GeForce RTX 4060,c02,32,64,32,2,2,8,0.0,0.0,135.16800105571747,170.36543697118748,1.9859393784283939,0,3,3,0_3_3,0,
2026-03-02T08:39:30.020447+00:00,B,adversarial,eval,adversarial_eval_032,32,4096,1024,bf16,NVIDIA GeForce RTX 4060,c02,32,64,32,2,2,8,0.0,0.0,61.375999823212624,93.09184156358234,4.373622536059718,0,3,3,0_3_3,0,
2026-03-02T08:39:30.114840+00:00,B,adversarial,eval,adversarial_eval_033,32,4096,4096,bf16,NVIDIA GeForce RTX 4060,c02,32,64,32,2,2,8,0.0,0.0,259.0560019016266,305.57152211666096,4.14482511934906,0,3,3,0_3_3,0,
2026-03-02T08:39:30.160370+00:00,B,adversarial,eval,adversarial_eval_034,32,8192,1024,bf16,NVIDIA GeForce RTX 4060,c02,32,64,32,2,2,8,0.0,0.0,91.95199981331825,151.6851188987492,5.838599629045154,0,3,3,0_3_3,0,
2026-03-02T08:39:30.344789+00:00,B,adversarial,eval,adversarial_eval_035,32,8192,4096,bf16,NVIDIA GeForce RTX 4060,c02,32,64,32,2,2,8,0.0,0.0,479.13600504398346,542.5443351268766,4.481991804817229,0,3,3,0_3_3,0,
2026-03-02T08:39:32.610768+00:00,B,adversarial,eval,adversarial_eval_036,1024,1,512,bf16,NVIDIA GeForce RTX 4060,c00,32,32,32,2,2,8,0.0,2265.922,49.15200173854828,61.9295983761549,0.021333332578755117,3,0,2,3_0_2,0,
2026-03-02T08:39:32.846730+00:00,B,adversarial,eval,adversarial_eval_037,1024,1,2048,bf16,NVIDIA GeForce RTX 4060,c09,128,64,64,8,3,8,0.0,235.922,68.60800087451935,125.41952140629282,0.06113432757895359,3,0,3,3_0_3,0,
2026-03-02T08:39:32.863024+00:00,B,adversarial,eval,adversarial_eval_038,2048,1,512,bf16,NVIDIA GeForce RTX 4060,c00,32,32,32,2,2,8,0.0,0.0,43.007999658584595,83.95103804767132,0.048761905148997066,3,0,2,3_0_2,0,
2026-03-02T08:39:32.890229+00:00,B,adversarial,eval,adversarial_eval_039,2048,1,2048,bf16,NVIDIA GeForce RTX 4060,c09,128,64,64,8,3,8,0.0,0.0,75.77600330114365,158.38208511471746,0.11070269787999489,3,0,3,3_0_3,0,
2026-03-02T08:39:32.903397+00:00,B,adversarial,eval,adversarial_eval_040,4096,1,512,bf16,NVIDIA GeForce RTX 4060,c00,32,32,32,2,2,8,0.0,0.0,41.95199906826019,96.10239893198006,0.09997864447831052,3,0,2,3_0_2,0,
2026-03-02T08:39:32.948733+00:00,B,adversarial,eval,adversarial_eval_041,4096,1,2048,bf16,NVIDIA GeForce RTX 4060,c09,128,64,64,8,3,8,0.0,0.0,97.28000313043594,110.46655923128128,0.17246315234493367,3,0,3,3_0_3,0,
2026-03-02T08:39:33.081089+00:00,B,adversarial,eval,adversarial_eval_042,1024,2,512,bf16,NVIDIA GeForce RTX 4060,c00,32,32,32,2,2,8,0.0,0.0,41.98399931192398,128.8806386291979,0.04995122033084596,3,0,2,3_0_2,0,
2026-03-02T08:39:33.269675+00:00,B,adversarial,eval,adversarial_eval_043,1024,2,2048,bf16,NVIDIA GeForce RTX 4060,c09,128,64,64,8,3,8,0.0,0.0,89.53600004315376,240.14432296156872,0.0936897783679965,3,0,3,3_0_3,0,
2026-03-02T08:39:33.285298+00:00,B,adversarial,eval,adversarial_eval_044,2048,2,512,bf16,NVIDIA GeForce RTX 4060,c00,32,32,32,2,2,8,0.0,0.0,54.27199974656105,662.2208005189894,0.07728301922882014,3,0,2,3_0_2,0,
2026-03-02T08:39:33.309797+00:00,B,adversarial,eval,adversarial_eval_045,2048,2,2048,bf16,NVIDIA GeForce RTX 4060,c09,128,64,64,8,3,8,0.0,0.0,95.0080007314682,195.53696244955063,0.1765874018064998,3,0,3,3_0_3,0,
2026-03-02T08:39:33.321306+00:00,B,adversarial,eval,adversarial_eval_046,4096,2,512,bf16,NVIDIA GeForce RTX 4060,c00,32,32,32,2,2,8,0.0,0.0,45.9199994802475,74.98688083142036,0.1826787477122765,3,0,2,3_0_2,0,
2026-03-02T08:39:33.367350+00:00,B,adversarial,eval,adversarial_eval_047,4096,2,2048,bf16,NVIDIA GeForce RTX 4060,c09,128,64,64,8,3,8,0.0,0.0,129.85599786043167,143.94368037581444,0.2583972442771883,3,0,3,3_0_3,0,
2026-03-02T08:39:33.373634+00:00,B,adversarial,eval,adversarial_eval_048,1024,4,512,bf16,NVIDIA GeForce RTX 4060,c00,32,32,32,2,2,8,0.0,0.0,41.98399931192398,94.33504346758113,0.09990244066169192,3,0,2,3_0_2,0,
2026-03-02T08:39:33.386942+00:00,B,adversarial,eval,adversarial_eval_049,1024,4,2048,bf16,NVIDIA GeForce RTX 4060,c09,128,64,64,8,3,8,0.0,0.0,91.13600105047226,172.9398451745509,0.1840898855185512,3,0,3,3_0_3,0,
2026-03-02T08:39:33.394164+00:00,B,adversarial,eval,adversarial_eval_050,2048,4,512,bf16,NVIDIA GeForce RTX 4060,c00,32,32,32,2,2,8,0.0,0.0,35.840000957250595,63.12960084527728,0.23405713660571054,3,0,2,3_0_2,0,
2026-03-02T08:39:33.412774+00:00,B,adversarial,eval,adversarial_eval_051,2048,4,2048,bf16,NVIDIA GeForce RTX 4060,c09,128,64,64,8,3,8,0.0,0.0,88.04799988865852,129.3606413155793,0.3810924954846379,3,0,3,3_0_3,0,
2026-03-02T08:39:33.427129+00:00,B,adversarial,eval,adversarial_eval_052,4096,4,512,bf16,NVIDIA GeForce RTX 4060,c00,32,32,32,2,2,8,0.0,0.0,53.247999399900436,100.32991938292969,0.3150769266278081,3,0,2,3_0_2,0,
2026-03-02T08:39:33.473430+00:00,B,adversarial,eval,adversarial_eval_053,4096,4,2048,bf16,NVIDIA GeForce RTX 4060,c09,128,64,64,8,3,8,0.0,0.0,133.4559991955757,149.0841621160507,0.5028538574849228,3,0,3,3_0_3,0,
2026-03-02T08:39:33.480148+00:00,B,adversarial,eval,adversarial_eval_054,1024,8,512,bf16,NVIDIA GeForce RTX 4060,c00,32,32,32,2,2,8,0.0,0.0,47.10400104522705,107.16159902513024,0.17808695257003015,3,0,2,3_0_2,0,
2026-03-02T08:39:33.495079+00:00,B,adversarial,eval,adversarial_eval_055,1024,8,2048,bf16,NVIDIA GeForce RTX 4060,c09,128,64,64,8,3,8,0.0,0.0,91.00800007581711,100.75616300106047,0.36869760869425117,3,0,3,3_0_3,0,
2026-03-02T08:39:33.503346+00:00,B,adversarial,eval,adversarial_eval_056,2048,8,512,bf16,NVIDIA GeForce RTX 4060,c00,32,32,32,2,2,8,0.0,0.0,49.15200173854828,156.28959968686098,0.34133332126008187,3,0,2,3_0_2,0,
2026-03-02T08:39:33.525184+00:00,B,adversarial,eval,adversarial_eval_057,2048,8,2048,bf16,NVIDIA GeForce RTX 4060,c09,128,64,64,8,3,8,0.0,0.0,97.23200276494026,180.11135756969443,0.6901931678013116,3,0,3,3_0_3,0,
2026-03-02T08:39:33.535972+00:00,B,adversarial,eval,adversarial_eval_058,4096,8,512,bf16,NVIDIA GeForce RTX 4060,c00,32,32,32,2,2,8,0.0,0.0,49.535999074578285,63.02720081061124,0.6773746896571633,3,0,2,3_0_2,0,
2026-03-02T08:39:33.579718+00:00,B,adversarial,eval,adversarial_eval_059,4096,8,2048,bf16,NVIDIA GeForce RTX 4060,c09,128,64,64,8,3,8,0.0,0.0,132.09599256515503,138.76223862171173,1.0160620726915577,3,0,3,3_0_3,0,
2026-03-02T08:39:33.590269+00:00,B,adversarial,eval,adversarial_eval_060,64,64,8192,bf16,NVIDIA GeForce RTX 4060,c04,64,64,64,4,3,8,0.0,0.0,93.18400174379349,121.80480003356925,0.7201758106988551,1,1,3,1_1_3,0,
2026-03-02T08:39:33.603166+00:00,B,adversarial,eval,adversarial_eval_061,128,128,8192,bf16,NVIDIA GeForce RTX 4060,c04,64,64,64,4,3,8,0.0,0.0,91.13600105047226,102.21055962145329,2.9454381682968194,1,1,3,1_1_3,0,
2026-03-02T08:39:33.697330+00:00,B,adversarial,eval,adversarial_eval_062,2048,128,8192,bf16,NVIDIA GeForce RTX 4060,c04,64,64,64,4,3,8,0.0,0.0,205.76000213623047,273.62976580858225,20.873674433364215,3,1,3,3_1_3,0,
2026-03-02T08:39:33.789816+00:00,B,adversarial,eval,adversarial_eval_063,128,2048,8192,bf16,NVIDIA GeForce RTX 4060,c06,64,128,32,4,3,8,0.0,0.0,251.3120025396347,366.04800045490265,17.090179747076093,1,3,3,1_3_3,0,
2026-03-02T08:39:37.442267+00:00,A,uniform,tune,uniform_tune_000,1536,512,1024,bf16,NVIDIA GeForce RTX 4060,c06,64,128,32,4,3,8,182.06388608086854,2568.67,84.99199897050858,236.7414484918117,18.950168904238474,3,2,3,1536x512x1024,0,
2026-03-02T08:39:37.759546+00:00,A,uniform,tune,uniform_tune_001,1536,1536,2048,bf16,NVIDIA GeForce RTX 4060,c06,64,128,32,4,3,8,0.0,317.24,316.4159953594208,350.35135954618454,30.541048991606484,3,3,3,1536x1536x2048,0,
2026-03-02T08:39:37.875122+00:00,A,uniform,tune,uniform_tune_002,384,2048,1536,bf16,NVIDIA GeForce RTX 4060,c06,64,128,32,4,3,8,0.0,115.534,100.35199671983719,109.08255979418755,24.074449766503058,2,3,3,384x2048x1536,0,
2026-03-02T08:39:37.958044+00:00,A,uniform,tune,uniform_tune_003,1536,64,3072,bf16,NVIDIA GeForce RTX 4060,c00,32,32,32,2,2,8,0.0,82.879,39.93599861860275,124.34656381607054,15.123692830825012,3,1,3,1536x64x3072,0,
2026-03-02T08:39:38.020272+00:00,A,uniform,tune,uniform_tune_004,768,128,2048,bf16,NVIDIA GeForce RTX 4060,c04,64,64,64,4,3,8,0.0,62.188,41.74400120973587,66.66208080947399,9.64577358018306,3,1,3,768x128x2048,0,
2026-03-02T08:39:38.104836+00:00,A,uniform,tune,uniform_tune_005,512,128,4096,bf16,NVIDIA GeForce RTX 4060,c04,64,64,64,4,3,8,0.0,84.526,58.36800113320351,67.51039981842041,9.198034909141219,2,1,3,512x128x4096,0,
2026-03-02T08:39:38.651247+00:00,A,uniform,tune,uniform_tune_006,2048,1024,4096,bf16,NVIDIA GeForce RTX 4060,c10,64,128,64,8,3,8,0.0,546.37,549.2640137672424,656.1689472198486,31.277980631150882,3,3,3,2048x1024x4096,0,
2026-03-02T08:39:38.704135+00:00,A,uniform,tune,uniform_tune_007,128,768,512,bf16,NVIDIA GeForce RTX 4060,c11,32,128,32,4,2,8,0.0,52.842,35.74400022625923,79.56288147717707,2.8162291674911075,1,3,2,128x768x512,0,
2026-03-02T08:39:38.748404+00:00,A,uniform,tune,uniform_tune_008,2048,256,64,bf16,NVIDIA GeForce RTX 4060,c06,64,128,32,4,3,8,0.0,44.242,31.695999205112457,40.3635198995471,2.117266080356778,3,2,1,2048x256x64,0,
2026-03-02T08:39:38.820738+00:00,A,uniform,tune,uniform_tune_009,192,768,2048,bf16,NVIDIA GeForce RTX 4060,c00,32,32,32,2,2,8,0.0,72.309,46.4479997754097,128.54272037744516,13.003353834835238,2,3,3,192x768x2048,0,
2026-03-02T08:39:38.962022+00:00,A,uniform,tune,uniform_tune_010,1024,1024,1536,bf16,NVIDIA GeForce RTX 4060,c04,64,64,64,4,3,8,0.0,141.248,128.00000607967377,196.27872183918936,25.165822804687558,3,3,3,1024x1024x1536,0,
2026-03-02T08:39:39.017120+00:00,A,uniform,tune,uniform_tune_011,256,384,768,bf16,NVIDIA GeForce RTX 4060,c04,64,64,64,4,3,8,0.0,55.062,35.840000957250595,51.89216110855338,4.21302845890279,2,2,3,256x384x768,0,
2026-03-02T08:39:39.076678+00:00,A,uniform,tune,uniform_tune_012,64,192,2048,bf16,NVIDIA GeForce RTX 4060,c04,64,64,64,4,3,8,0.0,59.529,43.66400092840195,49.96352016925811,1.1527035299062798,1,2,3,64x192x2048,0,
2026-03-02T08:39:39.119894+00:00,A,uniform,tune,uniform_tune_013,192,128,512,bf16,NVIDIA GeForce RTX 4060,c04,64,64,64,4,3,8,0.0,43.182,31.74399957060814,121.48063771426669,0.7927742042720133,2,1,2,192x128x512,0,
2026-03-02T08:39:39.179298+00:00,A,uniform,tune,uniform_tune_014,128,128,1024,bf16,NVIDIA GeForce RTX 4060,c04,64,64,64,4,3,8,0.0,59.375,37.79200091958046,126.24608084559434,0.8878712739079945,1,1,3,128x128x1024,0,
2026-03-02T08:39:39.599570+00:00,A,uniform,tune,uniform_tune_015,3072,3072,768,bf16,NVIDIA GeForce RTX 4060,c09,128,64,64,8,3,8,0.0,420.24,471.5839922428131,609.1468960046768,30.737927627824202,3,3,3,3072x3072x768,0,
2026-03-02T08:39:39.676653+00:00,A,uniform,tune,uniform_tune_016,256,128,3072,bf16,NVIDIA GeForce RTX 4060,c04,64,64,64,4,3,8,0.0,77.041,52.30399966239929,166.44703969359387,3.8491624598401644,2,1,3,256x128x3072,0,
2026-03-02T08:39:39.722049+00:00,A,uniform,tune,uniform_tune_017,96,1024,192,bf16,NVIDIA GeForce RTX 4060,c11,32,128,32,4,2,8,0.0,45.361,30.608000233769417,41.66816025972365,1.2332963836805093,1,3,2,96x1024x192,0,
2026-03-02T08:39:39.760223+00:00,A,uniform,tune,uniform_tune_018,64,64,192,bf16,NVIDIA GeForce RTX 4060,c00,32,32,32,2,2,8,0.0,38.145,28.84799987077713,35.844800844788544,0.05452246280662608,1,1,2,64x64x192,0,
2026-03-02T08:39:39.812754+00:00,A,uniform,tune,uniform_tune_019,4096,64,64,bf16,NVIDIA GeForce RTX 4060,c05,128,64,32,4,3,8,0.0,52.505,32.76799991726875,45.187199227511876,1.0240000025853515,3,1,1,4096x64x64,0,
2026-03-02T08:39:40.005940+00:00,A,uniform,tune,uniform_tune_020,128,4096,3072,bf16,NVIDIA GeForce RTX 4060,c10,64,128,64,8,3,8,0.0,193.154,138.2399946451187,155.20607978105542,23.30168979150595,1,3,3,128x4096x3072,0,
2026-03-02T08:39:40.155267+00:00,A,uniform,tune,uniform_tune_021,192,2048,3072,bf16,NVIDIA GeForce RTX 4060,c06,64,128,32,4,3,8,0.0,149.288,100.41599720716476,123.72223921120165,24.059105831671435,2,3,3,192x2048x3072,0,
2026-03-02T08:39:40.543322+00:00,A,uniform,tune,uniform_tune_022,1536,2048,2048,bf16,NVIDIA GeForce RTX 4060,c09,128,64,64,8,3,8,0.0,388.018,414.71999883651733,529.029124379158,31.0689186056813,3,3,3,1536x2048x2048,0,
2026-03-02T08:39:40.617331+00:00,A,uniform,tune,uniform_tune_023,256,1024,1024,bf16,NVIDIA GeForce RTX 4060,c11,32,128,32,4,2,8,0.0,73.968,49.984000623226166,59.914241656661034,10.74085517977789,2,3,3,256x1024x1024,0,
2026-03-02T08:39:40.660364+00:00,A,uniform,tune,uniform_tune_024,768,128,384,bf16,NVIDIA GeForce RTX 4060,c04,64,64,64,4,3,8,0.0,42.996,30.719999223947525,72.40064155310381,2.4576000620842,3,1,2,768x128x384,0,
2026-03-02T08:39:40.701531+00:00,A,uniform,tune,uniform_tune_025,256,96,384,bf16,NVIDIA GeForce RTX 4060,c00,32,32,32,2,2,8,0.0,41.14,29.69600073993206,114.15360115468502,0.6355861910597185,2,1,2,256x96x384,0,
2026-03-02T08:39:40.779526+00:00,A,uniform,tune,uniform_tune_026,96,1024,3072,bf16,NVIDIA GeForce RTX 4060,c02,32,64,32,2,2,8,0.0,77.967,63.439998775720596,84.09536160528654,9.520488456111885,1,3,3,96x1024x3072,0,
2026-03-02T08:39:41.010741+00:00,A,uniform,tune,uniform_tune_027,1536,512,4096,bf16,NVIDIA GeForce RTX 4060,c07,128,128,32,8,3,8,0.0,231.172,219.96799856424332,243.3126440644264,29.288128209787907,3,2,3,1536x512x4096,0,
2026-03-02T08:39:41.048517+00:00,A,uniform,tune,uniform_tune_028,128,64,192,bf16,NVIDIA GeForce RTX 4060,c11,32,128,32,4,2,8,0.0,37.741,29.360000044107437,47.23424006253481,0.1071433240897201,1,1,2,128x64x192,0,
2026-03-02T08:39:41.109949+00:00,A,uniform,tune,uniform_tune_029,192,256,1536,bf16,NVIDIA GeForce RTX 4060,c04,64,64,64,4,3,8,0.0,61.408,43.935999274253845,50.75488049536942,3.4367021689314776,2,2,3,192x256x1536,0,
2026-03-02T08:39:41.276441+00:00,A,uniform,tune,uniform_tune_030,4096,64,3072,bf16,NVIDIA GeForce RTX 4060,c04,64,64,64,4,3,8,0.0,166.46,87.00799942016602,101.74079850316045,18.511088023323808,3,1,3,4096x64x3072,0,
2026-03-02T08:39:41.319692+00:00,A,uniform,tune,uniform_tune_031,384,128,96,bf16,NVIDIA GeForce RTX 4060,c00,32,32,32,2,2,8,0.0,43.205,27.00799982994795,174.4761607050895,0.3494218031479523,2,1,1,384x128x96,0,
2026-03-02T08:39:41.451626+00:00,A,uniform,eval,uniform_eval_000,512,4096,768,bf16,NVIDIA GeForce RTX 4060,c06,64,128,32,4,3,8,0.0,131.416,128.00000607967377,132.58879616856575,25.165822804687558,2,3,3,512x4096x768,0,
2026-03-02T08:39:41.489802+00:00,A,uniform,eval,uniform_eval_001,384,512,64,bf16,NVIDIA GeForce RTX 4060,c05,128,64,32,4,3,8,0.0,38.136,28.4000001847744,42.00447931885719,0.8861205576150565,2,2,1,384x512x64,0,
2026-03-02T08:39:41.562839+00:00,A,uniform,eval,uniform_eval_002,256,4096,384,bf16,NVIDIA GeForce RTX 4060,c11,32,128,32,4,2,8,0.0,73.007,59.29600074887276,63.903360180556774,13.581124491187701,2,3,2,256x4096x384,0,
2026-03-02T08:39:41.610918+00:00,A,uniform,eval,uniform_eval_003,384,768,512,bf16,NVIDIA GeForce RTX 4060,c11,32,128,32,4,2,8,0.0,48.044,37.88800165057182,60.265282131731496,7.970594247359632,2,3,2,384x768x512,0,
2026-03-02T08:39:41.655190+00:00,A,uniform,eval,uniform_eval_004,768,1024,96,bf16,NVIDIA GeForce RTX 4060,c06,64,128,32,4,3,8,0.0,44.245,33.695999532938,41.64095990359782,4.481094079206694,3,3,1,768x1024x96,0,
2026-03-02T08:39:41.759968+00:00,A,uniform,eval,uniform_eval_005,3072,3072,128,bf16,NVIDIA GeForce RTX 4060,c06,64,128,32,4,3,8,0.0,104.752,106.49599879980087,113.7254412472248,22.685538717202185,3,3,1,3072x3072x128,0,
2026-03-02T08:39:41.825665+00:00,A,uniform,eval,uniform_eval_006,256,96,512,bf16,NVIDIA GeForce RTX 4060,c11,32,128,32,4,2,8,0.0,65.668,37.728000432252884,130.8364794403314,0.6670330712381529,2,1,2,256x96x512,0,
2026-03-02T08:39:45.560361+00:00,A,uniform,eval,uniform_eval_007,4096,4096,4096,bf16,NVIDIA GeForce RTX 4060,c07,128,128,32,8,3,8,0.0,3734.663,4211.712121963501,4466.698274612427,32.6325611751275,3,3,3,4096x4096x4096,0,
2026-03-02T08:39:45.628159+00:00,A,uniform,eval,uniform_eval_008,128,96,64,bf16,NVIDIA GeForce RTX 4060,c00,32,32,32,2,2,8,0.0,67.749,32.607998698949814,194.86368298530553,0.04823552694911805,1,1,1,128x96x64,0,
