results/phase2_group4.csv
timestamp,method,workload,split,shape_id,M,N,K,dtype,gpu,config_id,BLOCK_M,BLOCK_N,BLOCK_K,num_warps,num_stages,GROUP_M,compile_time_ms,tune_time_ms,runtime_cost_us,p99_us,runtime_perf_tflops,bucket_m,bucket_n,bucket_k,cache_key,invalid_config,notes
2026-03-02T09:56:23.625607+00:00,A,uniform,tune,uniform_tune_000,1536,512,1024,bf16,NVIDIA GeForce RTX 4060,c06,64,128,32,4,3,8,184.85356797464192,3664.292,86.73599734902382,180.3776046633717,18.569138364996583,3,2,3,1536x512x1024,0,
2026-03-02T09:56:23.956320+00:00,A,uniform,tune,uniform_tune_001,1536,1536,2048,bf16,NVIDIA GeForce RTX 4060,c10,64,128,64,8,3,8,0.0,330.674,317.440003156662,359.64544951915735,30.442528729533855,3,3,3,1536x1536x2048,0,
2026-03-02T09:56:24.079561+00:00,A,uniform,tune,uniform_tune_002,384,2048,1536,bf16,NVIDIA GeForce RTX 4060,c06,64,128,32,4,3,8,0.0,123.196,103.42399775981903,110.49791947007179,23.359366842601418,2,3,3,384x2048x1536,0,
2026-03-02T09:56:24.170885+00:00,A,uniform,tune,uniform_tune_003,1536,64,3072,bf16,NVIDIA GeForce RTX 4060,c04,64,64,64,4,3,8,0.0,91.281,51.19999870657921,163.8809558749199,11.796480298004159,3,1,3,1536x64x3072,0,
2026-03-02T09:56:24.237745+00:00,A,uniform,tune,uniform_tune_004,768,128,2048,bf16,NVIDIA GeForce RTX 4060,c04,64,64,64,4,3,8,0.0,66.809,43.007999658584595,99.59712207317332,9.362285788607435,3,1,3,768x128x2048,0,
2026-03-02T09:56:24.320436+00:00,A,uniform,tune,uniform_tune_005,512,128,4096,bf16,NVIDIA GeForce RTX 4060,c04,64,64,64,4,3,8,0.0,82.647,56.32000043988228,62.30495743453502,9.53250901645629,2,1,3,512x128x4096,0,
2026-03-02T09:56:24.871154+00:00,A,uniform,tune,uniform_tune_006,2048,1024,4096,bf16,NVIDIA GeForce RTX 4060,c09,128,64,64,8,3,8,0.0,550.675,555.0079941749573,634.4643110036848,30.954273387608765,3,3,3,2048x1024x4096,0,
2026-03-02T09:56:24.924143+00:00,A,uniform,tune,uniform_tune_007,128,768,512,bf16,NVIDIA GeForce RTX 4060,c04,64,64,64,4,3,8,0.0,52.948,35.840000957250595,45.17919909209012,2.808685639268526,1,3,2,128x768x512,0,
2026-03-02T09:56:24.970368+00:00,A,uniform,tune,uniform_tune_008,2048,256,64,bf16,NVIDIA GeForce RTX 4060,c09,128,64,64,8,3,8,0.0,46.189,32.76799991726875,63.96319895982742,2.048000005170703,3,2,1,2048x256x64,0,
2026-03-02T09:56:25.041286+00:00,A,uniform,tune,uniform_tune_009,192,768,2048,bf16,NVIDIA GeForce RTX 4060,c11,32,128,32,4,2,8,0.0,70.879,56.32000043988228,68.78752104938027,10.724072643513326,2,3,3,192x768x2048,0,
2026-03-02T09:56:25.182791+00:00,A,uniform,tune,uniform_tune_010,1024,1024,1536,bf16,NVIDIA GeForce RTX 4060,c04,64,64,64,4,3,8,0.0,141.456,132.09599256515503,204.7180819511412,24.385489744597383,3,3,3,1024x1024x1536,0,
2026-03-02T09:56:25.251269+00:00,A,uniform,tune,uniform_tune_011,256,384,768,bf16,NVIDIA GeForce RTX 4060,c11,32,128,32,4,2,8,0.0,68.438,40.95999896526337,51.13728005439043,3.6864000931262995,2,2,3,256x384x768,0,
2026-03-02T09:56:25.311117+00:00,A,uniform,tune,uniform_tune_012,64,192,2048,bf16,NVIDIA GeForce RTX 4060,c00,32,32,32,2,2,8,0.0,59.814,44.89599913358688,215.24479836225504,1.1210720102305662,1,2,3,64x192x2048,0,
2026-03-02T09:56:25.356253+00:00,A,uniform,tune,uniform_tune_013,192,128,512,bf16,NVIDIA GeForce RTX 4060,c04,64,64,64,4,3,8,0.0,45.103,33.79200026392937,46.80608060210943,0.7447272669106476,2,1,2,192x128x512,0,
2026-03-02T09:56:25.407236+00:00,A,uniform,tune,uniform_tune_014,128,128,1024,bf16,NVIDIA GeForce RTX 4060,c04,64,64,64,4,3,8,0.0,50.953,37.6800000667572,42.790401428937905,0.8905104018193212,1,1,3,128x128x1024,0,
2026-03-02T09:56:25.836162+00:00,A,uniform,tune,uniform_tune_015,3072,3072,768,bf16,NVIDIA GeForce RTX 4060,c06,64,128,32,4,3,8,0.0,428.893,466.8959975242615,542.0150399208068,31.046560049482466,3,3,3,3072x3072x768,0,
2026-03-02T09:56:25.914559+00:00,A,uniform,tune,uniform_tune_016,256,128,3072,bf16,NVIDIA GeForce RTX 4060,c04,64,64,64,4,3,8,0.0,78.354,52.271999418735504,64.30687792599201,3.851518867438613,2,1,3,256x128x3072,0,
2026-03-02T09:56:25.958929+00:00,A,uniform,tune,uniform_tune_017,96,1024,192,bf16,NVIDIA GeForce RTX 4060,c00,32,32,32,2,2,8,0.0,44.331,10.112000163644552,121.99936024844644,3.7330632307263194,1,3,2,96x1024x192,0,
2026-03-02T09:56:25.996661+00:00,A,uniform,tune,uniform_tune_018,64,64,192,bf16,NVIDIA GeForce RTX 4060,c11,32,128,32,4,2,8,0.0,37.704,29.40800040960312,153.22240382432938,0.05348422123546981,1,1,2,64x64x192,0,
2026-03-02T09:56:26.054489+00:00,A,uniform,tune,uniform_tune_019,4096,64,64,bf16,NVIDIA GeForce RTX 4060,c00,32,32,32,2,2,8,0.0,57.804,33.76000002026558,72.59904131293297,0.9939108998773052,3,1,1,4096x64x64,0,
2026-03-02T09:56:26.245057+00:00,A,uniform,tune,uniform_tune_020,128,4096,3072,bf16,NVIDIA GeForce RTX 4060,c06,64,128,32,4,3,8,0.0,190.534,137.2160017490387,161.89087957143784,23.47558179031818,1,3,3,128x4096x3072,0,
2026-03-02T09:56:26.387268+00:00,A,uniform,tune,uniform_tune_021,192,2048,3072,bf16,NVIDIA GeForce RTX 4060,c06,64,128,32,4,3,8,0.0,142.164,100.20800307393074,107.01823897659779,24.109043488448727,2,3,3,192x2048x3072,0,
2026-03-02T09:56:26.785109+00:00,A,uniform,tune,uniform_tune_022,1536,2048,2048,bf16,NVIDIA GeForce RTX 4060,c09,128,64,64,8,3,8,0.0,397.798,412.6080125570297,539.7833624482154,31.227948793696967,3,3,3,1536x2048x2048,0,
2026-03-02T09:56:26.853207+00:00,A,uniform,tune,uniform_tune_023,256,1024,1024,bf16,NVIDIA GeForce RTX 4060,c11,32,128,32,4,2,8,0.0,68.058,51.263999193906784,113.5647991299627,10.472669328221514,2,3,3,256x1024x1024,0,
2026-03-02T09:56:26.902372+00:00,A,uniform,tune,uniform_tune_024,768,128,384,bf16,NVIDIA GeForce RTX 4060,c11,32,128,32,4,2,8,0.0,49.128,34.463999792933464,38.755198903381824,2.1906183975627833,3,1,2,768x128x384,0,
2026-03-02T09:56:26.944155+00:00,A,uniform,tune,uniform_tune_025,256,96,384,bf16,NVIDIA GeForce RTX 4060,c04,64,64,64,4,3,8,0.0,41.749,31.74399957060814,46.55744038522243,0.59458065320401,2,1,2,256x96x384,0,
2026-03-02T09:56:27.030529+00:00,A,uniform,tune,uniform_tune_026,96,1024,3072,bf16,NVIDIA GeForce RTX 4060,c11,32,128,32,4,2,8,0.0,86.341,64.51199948787689,71.1987217515707,9.362285788607435,1,3,3,96x1024x3072,0,
2026-03-02T09:56:27.259769+00:00,A,uniform,tune,uniform_tune_027,1536,512,4096,bf16,NVIDIA GeForce RTX 4060,c06,64,128,32,4,3,8,0.0,229.196,219.13599967956543,230.4652765393257,29.3993271457933,3,2,3,1536x512x4096,0,
2026-03-02T09:56:27.299694+00:00,A,uniform,tune,uniform_tune_028,128,64,192,bf16,NVIDIA GeForce RTX 4060,c00,32,32,32,2,2,8,0.0,39.885,29.455999843776226,41.98399931192398,0.10679413418942772,1,1,2,128x64x192,0,
2026-03-02T09:56:27.363425+00:00,A,uniform,tune,uniform_tune_029,192,256,1536,bf16,NVIDIA GeForce RTX 4060,c04,64,64,64,4,3,8,0.0,63.702,42.848000302910805,51.058239452540874,3.523967114744032,2,2,3,192x256x1536,0,
2026-03-02T09:56:27.536209+00:00,A,uniform,tune,uniform_tune_030,4096,64,3072,bf16,NVIDIA GeForce RTX 4060,c04,64,64,64,4,3,8,0.0,172.746,87.0399996638298,95.24832256138325,18.504282424409332,3,1,3,4096x64x3072,0,
2026-03-02T09:56:27.588923+00:00,A,uniform,tune,uniform_tune_031,384,128,96,bf16,NVIDIA GeForce RTX 4060,c03,64,64,32,4,2,8,0.0,52.662,29.69600073993206,92.6870402693748,0.31779309552985924,2,1,1,384x128x96,0,
2026-03-02T09:56:27.720964+00:00,A,uniform,eval,uniform_eval_000,512,4096,768,bf16,NVIDIA GeForce RTX 4060,c06,64,128,32,4,3,8,0.0,131.542,128.00000607967377,155.51072046160692,25.165822804687558,2,3,3,512x4096x768,0,
2026-03-02T09:56:27.758594+00:00,A,uniform,eval,uniform_eval_001,384,512,64,bf16,NVIDIA GeForce RTX 4060,c01,64,32,32,2,2,8,0.0,37.592,28.816000558435917,39.96608022600411,0.8733281341026583,2,2,1,384x512x64,0,
2026-03-02T09:56:27.826050+00:00,A,uniform,eval,uniform_eval_002,256,4096,384,bf16,NVIDIA GeForce RTX 4060,c03,64,64,32,4,2,8,0.0,67.429,55.296000093221664,145.23040279746044,14.563555531003347,2,3,2,256x4096x384,0,
2026-03-02T09:56:27.878779+00:00,A,uniform,eval,uniform_eval_003,384,768,512,bf16,NVIDIA GeForce RTX 4060,c11,32,128,32,4,2,8,0.0,52.695,40.95999896526337,51.72223888337612,7.372800186252599,2,3,2,384x768x512,0,
2026-03-02T09:56:27.926292+00:00,A,uniform,eval,uniform_eval_004,768,1024,96,bf16,NVIDIA GeForce RTX 4060,c06,64,128,32,4,3,8,0.0,47.48,34.912001341581345,39.43423844873905,4.325015415835242,3,3,1,768x1024x96,0,
2026-03-02T09:56:28.033103+00:00,A,uniform,eval,uniform_eval_005,3072,3072,128,bf16,NVIDIA GeForce RTX 4060,c06,64,128,32,4,3,8,0.0,106.779,104.44799810647964,113.61920073628426,23.130353360502784,3,3,1,3072x3072x128,0,
2026-03-02T09:56:28.085935+00:00,A,uniform,eval,uniform_eval_006,256,96,512,bf16,NVIDIA GeForce RTX 4060,c11,32,128,32,4,2,8,0.0,52.796,34.81600061058998,117.82720319926729,0.7228235167351563,2,1,2,256x96x512,0,
2026-03-02T09:56:31.786505+00:00,A,uniform,eval,uniform_eval_007,4096,4096,4096,bf16,NVIDIA GeForce RTX 4060,c07,128,128,32,8,3,8,0.0,3700.531,4147.616147994995,4240.9062242507935,33.13685465769043,3,3,3,4096x4096x4096,0,
2026-03-02T09:56:31.826514+00:00,A,uniform,eval,uniform_eval_008,128,96,64,bf16,NVIDIA GeForce RTX 4060,c06,64,128,32,4,3,8,0.0,39.963,28.672000393271446,42.41568002849816,0.05485714210471025,1,1,1,128x96x64,0,
2026-03-02T09:56:31.884481+00:00,A,uniform,eval,uniform_eval_009,3072,384,96,bf16,NVIDIA GeForce RTX 4060,c06,64,128,32,4,3,8,0.0,57.935,38.864001631736755,48.70079945772885,5.827820257578517,3,2,1,3072x384x96,0,
2026-03-02T09:56:31.997968+00:00,A,uniform,eval,uniform_eval_010,768,768,2048,bf16,NVIDIA GeForce RTX 4060,c06,64,128,32,4,3,8,0.0,113.452,101.3759970664978,291.7171284556383,23.831273416874733,3,3,3,768x768x2048,0,
2026-03-02T09:56:32.064630+00:00,A,uniform,eval,uniform_eval_011,4096,96,512,bf16,NVIDIA GeForce RTX 4060,c01,64,32,32,2,2,8,0.0,66.62,48.128001391887665,86.95520028471941,8.366297630382595,3,1,2,4096x96x512,0,
2026-03-02T09:56:32.105956+00:00,A,uniform,eval,uniform_eval_012,384,384,256,bf16,NVIDIA GeForce RTX 4060,c02,32,64,32,2,2,8,0.0,41.287,31.74399957060814,84.72575858235345,2.37832261281604,2,2,2,384x384x256,0,
2026-03-02T09:56:32.487770+00:00,A,uniform,eval,uniform_eval_013,4096,2048,768,bf16,NVIDIA GeForce RTX 4060,c10,64,128,64,8,3,8,0.0,381.78,426.41599476337433,443.43295365571976,30.21674150649545,3,3,3,4096x2048x768,0,
2026-03-02T09:56:32.571331+00:00,A,uniform,eval,uniform_eval_014,192,384,3072,bf16,NVIDIA GeForce RTX 4060,c04,64,64,64,4,3,8,0.0,83.518,51.29599943757057,59.407359100878224,8.83080234261352,2,2,3,192x384x3072,0,
2026-03-02T09:56:32.648934+00:00,A,uniform,eval,uniform_eval_015,128,96,4096,bf16,NVIDIA GeForce RTX 4060,c04,64,64,64,4,3,8,0.0,77.561,57.34400078654289,60.824001133441925,1.755428547350728,1,1,3,128x96x4096,0,
2026-03-02T09:56:32.781364+00:00,A,uniform,eval,uniform_eval_016,64,4096,2048,bf16,NVIDIA GeForce RTX 4060,c11,32,128,32,4,2,8,0.0,132.39,68.44799965620041,105.48031821846962,15.686971560793223,1,3,3,64x4096x2048,0,
2026-03-02T09:56:32.854569+00:00,A,uniform,eval,uniform_eval_017,96,128,3072,bf16,NVIDIA GeForce RTX 4060,c00,32,32,32,2,2,8,0.0,73.166,52.22399905323982,71.63968071341512,1.445647085031424,1,1,3,96x128x3072,0,
2026-03-02T09:56:32.896947+00:00,A,uniform,eval,uniform_eval_018,512,768,64,bf16,NVIDIA GeForce RTX 4060,c09,128,64,64,8,3,8,0.0,42.349,31.71199932694435,40.459200032055364,1.5871483687007812,2,3,1,512x768x64,0,
2026-03-02T09:56:32.938437+00:00,A,uniform,eval,uniform_eval_019,64,128,384,bf16,NVIDIA GeForce RTX 4060,c04,64,64,64,4,3,8,0.0,41.462,30.719999223947525,54.99903991818424,0.20480000517368332,1,1,2,64x128x384,0,
2026-03-02T09:56:32.979448+00:00,A,uniform,eval,uniform_eval_020,512,512,96,bf16,NVIDIA GeForce RTX 4060,c00,32,32,32,2,2,8,0.0,40.989,10.239999741315842,328.403193652629,4.9152001241684,2,2,1,512x512x96,0,
2026-03-02T09:56:33.098483+00:00,A,uniform,eval,uniform_eval_021,256,3072,1536,bf16,NVIDIA GeForce RTX 4060,c06,64,128,32,4,3,8,0.0,119.005,101.3759970664978,125.45024156570435,23.831273416874733,2,3,3,256x3072x1536,0,
2026-03-02T09:56:33.147037+00:00,A,uniform,eval,uniform_eval_022,2048,96,512,bf16,NVIDIA GeForce RTX 4060,c01,64,32,32,2,2,8,0.0,48.51,36.639999598264694,48.77311971038577,5.49472145762619,3,1,2,2048x96x512,0,
2026-03-02T09:56:33.330379+00:00,A,uniform,eval,uniform_eval_023,1536,512,3072,bf16,NVIDIA GeForce RTX 4060,c06,64,128,32,4,3,8,0.0,183.302,172.95999825000763,217.04352155327797,27.93616013464424,3,2,3,1536x512x3072,0,
2026-03-02T09:56:33.368581+00:00,A,uniform,eval,uniform_eval_024,128,192,64,bf16,NVIDIA GeForce RTX 4060,c03,64,64,32,4,2,8,0.0,38.167,28.495999984443188,45.076480358839035,0.11039191471495459,1,2,1,128x192x64,0,
2026-03-02T09:56:33.424412+00:00,A,uniform,eval,uniform_eval_025,1536,96,384,bf16,NVIDIA GeForce RTX 4060,c11,32,128,32,4,2,8,0.0,55.804,36.70400008559227,43.06943967938422,3.085391448777091,3,1,2,1536x96x384,0,
2026-03-02T09:56:33.480325+00:00,A,uniform,eval,uniform_eval_026,1536,2048,64,bf16,NVIDIA GeForce RTX 4060,c11,32,128,32,4,2,8,0.0,55.881,45.05600035190582,94.6115217357873,8.936727202927772,3,3,1,1536x2048x64,0,
2026-03-02T09:56:33.534892+00:00,A,uniform,eval,uniform_eval_027,256,1024,96,bf16,NVIDIA GeForce RTX 4060,c06,64,128,32,4,3,8,0.0,54.538,35.80800071358681,45.673601254820824,1.405597827216933,2,3,1,256x1024x96,0,
2026-03-02T09:56:33.541249+00:00,A,uniform,eval,uniform_eval_028,2048,256,64,bf16,NVIDIA GeForce RTX 4060,c09,128,64,64,8,3,8,0.0,0.0,12.80000014230609,42.986241020262234,5.242879941711426,3,2,1,2048x256x64,0,
2026-03-02T09:56:33.586465+00:00,A,uniform,eval,uniform_eval_029,192,768,192,bf16,NVIDIA GeForce RTX 4060,c08,128,128,64,8,4,8,0.0,45.194,35.64799949526787,46.06432057917118,1.5883949955597507,2,3,2,192x768x192,0,
2026-03-02T09:56:33.986000+00:00,A,uniform,eval,uniform_eval_030,1024,2048,3072,bf16,NVIDIA GeForce RTX 4060,c06,64,128,32,4,3,8,0.0,399.504,421.7759966850281,440.88543921709055,30.54915876974888,3,3,3,1024x2048x3072,0,
2026-03-02T09:56:34.075750+00:00,A,uniform,eval,uniform_eval_031,1536,1024,512,bf16,NVIDIA GeForce RTX 4060,c06,64,128,32,4,3,8,0.0,89.705,80.89599758386612,91.9718399643898,19.90967148072132,3,3,2,1536x1024x512,0,
2026-03-02T09:56:34.133973+00:00,A,uniform,eval,uniform_eval_032,512,768,768,bf16,NVIDIA GeForce RTX 4060,c00,32,32,32,2,2,8,0.0,58.184,41.6640006005764,218.17568168044068,14.496442187350686,2,3,3,512x768x768,0,
2026-03-02T09:56:34.220735+00:00,A,uniform,eval,uniform_eval_033,64,512,4096,bf16,NVIDIA GeForce RTX 4060,c04,64,64,64,4,3,8,0.0,86.724,58.36800113320351,67.11104013025759,4.5990174545706095,1,2,3,64x512x4096,0,
2026-03-02T09:56:34.279071+00:00,A,uniform,eval,uniform_eval_034,1024,256,512,bf16,NVIDIA GeForce RTX 4060,c11,32,128,32,4,2,8,0.0,58.299,39.93599861860275,45.619200542569146,6.72164125814445,3,2,2,1024x256x512,0,
2026-03-02T09:56:34.325168+00:00,A,uniform,eval,uniform_eval_035,1024,768,96,bf16,NVIDIA GeForce RTX 4060,c09,128,64,64,8,3,8,0.0,46.062,35.8240008354187,44.09024000167845,4.214910129488199,3,3,1,1024x768x96,0,
2026-03-02T09:56:34.379379+00:00,A,uniform,eval,uniform_eval_036,768,64,1536,bf16,NVIDIA GeForce RTX 4060,c00,32,32,32,2,2,8,0.0,54.179,32.76799991726875,91.50335974991322,4.608000011634081,3,1,3,768x64x1536,0,
2026-03-02T09:56:34.425172+00:00,A,uniform,eval,uniform_eval_037,512,256,512,bf16,NVIDIA GeForce RTX 4060,c09,128,64,64,8,3,8,0.0,45.759,34.192001447081566,42.5267194956541,3.925413029937037,2,2,2,512x256x512,0,
2026-03-02T09:56:34.466521+00:00,A,uniform,eval,uniform_eval_038,64,1024,64,bf16,NVIDIA GeForce RTX 4060,c11,32,128,32,4,2,8,0.0,41.321,28.31999957561493,35.77087998390196,0.29620791404329866,1,3,1,64x1024x64,0,
2026-03-02T09:56:34.534109+00:00,A,uniform,eval,uniform_eval_039,512,128,2048,bf16,NVIDIA GeForce RTX 4060,c04,64,64,64,4,3,8,0.0,67.56,45.05600035190582,52.76671923696995,5.957818135285181,2,1,3,512x128x2048,0,
2026-03-02T09:56:34.591172+00:00,A,uniform,eval,uniform_eval_040,4096,768,96,bf16,NVIDIA GeForce RTX 4060,c06,64,128,32,4,3,8,0.0,57.032,49.15200173854828,52.81151972711086,12.287999565362945,3,3,1,4096x768x96,0,
2026-03-02T09:56:34.640082+00:00,A,uniform,eval,uniform_eval_041,4096,192,64,bf16,NVIDIA GeForce RTX 4060,c09,128,64,64,8,3,8,0.0,48.881,33.20000134408474,35.256640166044235,3.0320268652017757,3,2,1,4096x192x64,0,
2026-03-02T09:56:34.688654+00:00,A,uniform,eval,uniform_eval_042,96,1536,128,bf16,NVIDIA GeForce RTX 4060,c00,32,32,32,2,2,8,0.0,48.543,34.81600061058998,115.13056069612502,1.0842352751027344,1,3,1,96x1536x128,0,
2026-03-02T09:56:34.743743+00:00,A,uniform,eval,uniform_eval_043,192,2048,192,bf16,NVIDIA GeForce RTX 4060,c11,32,128,32,4,2,8,0.0,55.05,35.72800010442734,42.00447931885719,4.226235545193279,2,3,2,192x2048x192,0,
2026-03-02T09:56:35.102163+00:00,A,uniform,eval,uniform_eval_044,384,4096,3072,bf16,NVIDIA GeForce RTX 4060,c05,128,64,32,4,3,8,0.0,358.376,319.5199966430664,339.2102429270744,30.24435565075205,2,3,3,384x4096x3072,0,
2026-03-02T09:56:35.179895+00:00,A,uniform,eval,uniform_eval_045,4096,96,768,bf16,NVIDIA GeForce RTX 4060,c01,64,32,32,2,2,8,0.0,77.679,57.04000033438206,116.51647694408874,10.58870568827712,3,1,3,4096x96x768,0,
2026-03-02T09:56:35.235979+00:00,A,uniform,eval,uniform_eval_046,96,96,1536,bf16,NVIDIA GeForce RTX 4060,c04,64,64,64,4,3,8,0.0,56.043,40.79999960958958,47.14496105909346,0.6939105948752434,1,1,3,96x96x1536,0,
2026-03-02T09:56:35.539616+00:00,A,uniform,eval,uniform_eval_047,2048,512,4096,bf16,NVIDIA GeForce RTX 4060,c04,64,64,64,4,3,8,0.0,303.602,299.9039888381958,345.40351748466486,28.64228190254062,3,2,3,2048x512x4096,0,
2026-03-02T09:56:35.598919+00:00,A,uniform,eval,uniform_eval_048,96,256,768,bf16,NVIDIA GeForce RTX 4060,c02,32,64,32,2,2,8,0.0,59.264,37.936000153422356,55.179838761687265,0.9950636821840727,1,2,3,96x256x768,0,
2026-03-02T09:56:35.646306+00:00,A,uniform,eval,uniform_eval_049,64,768,384,bf16,NVIDIA GeForce RTX 4060,c04,64,64,64,4,3,8,0.0,47.357,32.76799991726875,54.83999982476233,1.1520000029085202,1,3,2,64x768x384,0,
2026-03-02T09:56:35.695221+00:00,A,uniform,eval,uniform_eval_050,128,1024,96,bf16,NVIDIA GeForce RTX 4060,c00,32,32,32,2,2,8,0.0,48.89,34.60799902677536,97.03007958829399,0.727167842917755,1,3,1,128x1024x96,0,
2026-03-02T09:56:35.763327+00:00,A,uniform,eval,uniform_eval_051,384,768,768,bf16,NVIDIA GeForce RTX 4060,c11,32,128,32,4,2,8,0.0,68.075,47.968000173568726,54.794239923357964,9.443479618931523,2,3,3,384x768x768,0,
2026-03-02T09:56:35.849268+00:00,A,uniform,eval,uniform_eval_052,768,64,4096,bf16,NVIDIA GeForce RTX 4060,c04,64,64,64,4,3,8,0.0,85.898,57.74400010704994,74.37311902642247,6.973073968785204,3,1,3,768x64x4096,0,
2026-03-02T09:56:35.902552+00:00,A,uniform,eval,uniform_eval_053,384,96,512,bf16,NVIDIA GeForce RTX 4060,c00,32,32,32,2,2,8,0.0,53.244,35.8240008354187,141.70271873474113,1.0537275323720499,2,1,2,384x96x512,0,
2026-03-02T09:56:35.953683+00:00,A,uniform,eval,uniform_eval_054,768,192,768,bf16,NVIDIA GeForce RTX 4060,c11,32,128,32,4,2,8,0.0,51.097,37.88800165057182,43.99999976158142,5.977945685519724,3,2,3,768x192x768,0,
2026-03-02T09:56:36.021852+00:00,A,uniform,eval,uniform_eval_055,512,2048,512,bf16,NVIDIA GeForce RTX 4060,c03,64,64,32,4,2,8,0.0,68.133,63.391998410224915,66.8073582649231,16.938128642854224,2,3,2,512x2048x512,0,
2026-03-02T09:56:36.082257+00:00,A,uniform,eval,uniform_eval_056,384,512,512,bf16,NVIDIA GeForce RTX 4060,c11,32,128,32,4,2,8,0.0,60.37,39.03999924659729,60.90559940785168,5.156931247060604,2,2,2,384x512x512,0,
2026-03-02T09:56:36.161858+00:00,A,uniform,eval,uniform_eval_057,2048,512,512,bf16,NVIDIA GeForce RTX 4060,c11,32,128,32,4,2,8,0.0,79.568,66.56000018119812,71.53888083994389,16.13193841762204,3,2,2,2048x512x512,0,
2026-03-02T09:56:36.280712+00:00,A,uniform,eval,uniform_eval_058,1024,512,2048,bf16,NVIDIA GeForce RTX 4060,c06,64,128,32,4,3,8,0.0,118.817,101.3759970664978,114.86079759895797,21.1833541483331,3,2,3,1024x512x2048,0,
2026-03-02T09:56:36.408667+00:00,A,uniform,eval,uniform_eval_059,2048,64,4096,bf16,NVIDIA GeForce RTX 4060,c03,64,64,32,4,2,8,0.0,127.91,76.4160007238388,101.36799670755863,14.051269548643555,3,1,3,2048x64x4096,0,
2026-03-02T09:56:36.462311+00:00,A,uniform,eval,uniform_eval_060,64,1536,1024,bf16,NVIDIA GeForce RTX 4060,c04,64,64,64,4,3,8,0.0,53.602,35.840000957250595,53.1667200103402,5.617371278537052,1,3,3,64x1536x1024,0,
2026-03-02T09:56:36.573803+00:00,A,uniform,eval,uniform_eval_061,768,1024,1536,bf16,NVIDIA GeForce RTX 4060,c06,64,128,32,4,3,8,0.0,111.454,101.07200220227242,172.86432072520236,23.902950880156624,3,3,3,768x1024x1536,0,
2026-03-02T09:56:36.631584+00:00,A,uniform,eval,uniform_eval_062,384,2048,192,bf16,NVIDIA GeForce RTX 4060,c06,64,128,32,4,3,8,0.0,57.741,41.77600145339966,99.60095692425948,7.228788718251651,2,3,2,384x2048x192,0,
2026-03-02T09:56:36.687047+00:00,A,uniform,eval,uniform_eval_063,256,2048,192,bf16,NVIDIA GeForce RTX 4060,c10,64,128,64,8,3,8,0.0,55.43,39.903998374938965,50.33919960260391,5.045273661760166,2,3,2,256x2048x192,0,
2026-03-02T09:56:38.763642+00:00,A,llm_style,tune,llm_style_tune_000,8,4096,1024,bf16,NVIDIA GeForce RTX 4060,c00,32,32,32,2,2,8,0.0,2075.964,39.85600173473358,66.25215787440533,1.6837831463038146,0,3,3,8x4096x1024,0,
2026-03-02T09:56:38.904639+00:00,A,llm_style,tune,llm_style_tune_001,32,1024,2048,bf16,NVIDIA GeForce RTX 4060,c00,32,32,32,2,2,8,0.0,140.951,96.09600156545639,254.60736408829678,1.3967046059515469,0,3,3,32x1024x2048,0,
2026-03-02T09:56:38.998786+00:00,A,llm_style,tune,llm_style_tune_002,16,2048,1024,bf16,NVIDIA GeForce RTX 4060,c11,32,128,32,4,2,8,0.0,94.102,67.58400052785873,172.55520269274703,0.9929696892141969,0,3,3,16x2048x1024,0,
2026-03-02T09:56:41.367461+00:00,A,llm_style,tune,llm_style_tune_003,1,1024,4096,bf16,NVIDIA GeForce RTX 4060,c00,32,32,32,2,2,8,0.0,2368.628,121.85599654912949,129.9257655441761,0.0688403380839605,0,3,3,1x1024x4096,0,
2026-03-02T09:56:41.687108+00:00,A,llm_style,tune,llm_style_tune_004,64,2048,2048,bf16,NVIDIA GeForce RTX 4060,c04,64,64,64,4,3,8,0.0,319.605,268.2879865169525,328.44799578189844,2.001099337208214,1,3,3,64x2048x2048,0,
2026-03-02T09:56:42.488800+00:00,A,llm_style,tune,llm_style_tune_005,32,8192,8192,bf16,NVIDIA GeForce RTX 4060,c00,32,32,32,2,2,8,0.0,801.643,563.0239844322205,673.3420795202255,7.6283913558873415,0,3,3,32x8192x8192,0,
2026-03-02T09:56:43.236219+00:00,A,llm_style,tune,llm_style_tune_006,16,8192,8192,bf16,NVIDIA GeForce RTX 4060,c11,32,128,32,4,2,8,0.0,747.365,564.0639960765839,697.978876829147,3.8071631285405294,0,3,3,16x8192x8192,0,
2026-03-02T09:56:43.389599+00:00,A,llm_style,tune,llm_style_tune_007,2,1024,8192,bf16,NVIDIA GeForce RTX 4060,c04,64,64,64,4,3,8,0.0,153.329,83.96799862384796,117.52447873353952,0.3996097626467677,0,3,3,2x1024x8192,0,
2026-03-02T09:56:43.634702+00:00,A,llm_style,tune,llm_style_tune_008,16,2048,8192,bf16,NVIDIA GeForce RTX 4060,c10,64,128,64,8,3,8,0.0,245.057,164.86400365829468,212.2179134190082,3.2564471327091224,0,3,3,16x2048x8192,0,
2026-03-02T09:56:43.746755+00:00,A,llm_style,tune,llm_style_tune_009,4,4096,2048,bf16,NVIDIA GeForce RTX 4060,c11,32,128,32,4,2,8,0.0,112.007,52.22399905323982,62.77408115565777,1.2850196311390436,0,3,3,4x4096x2048,0,
2026-03-02T09:56:44.151429+00:00,A,llm_style,tune,llm_style_tune_010,64,8192,4096,bf16,NVIDIA GeForce RTX 4060,c10,64,128,64,8,3,8,0.0,404.628,302.91201174259186,332.8204810619354,14.178926980451907,1,3,3,64x8192x4096,0,
2026-03-02T09:56:44.261197+00:00,A,llm_style,tune,llm_style_tune_011,16,8192,1024,bf16,NVIDIA GeForce RTX 4060,c11,32,128,32,4,2,8,0.0,109.722,48.51199872791767,61.91743995994329,5.533382730848417,0,3,3,16x8192x1024,0,
2026-03-02T09:56:44.364045+00:00,A,llm_style,tune,llm_style_tune_012,2,8192,1024,bf16,NVIDIA GeForce RTX 4060,c11,32,128,32,4,2,8,0.0,102.793,49.15200173854828,57.83360071480274,0.6826666425201637,0,3,3,2x8192x1024,0,
2026-03-02T09:56:44.577730+00:00,A,llm_style,tune,llm_style_tune_013,16,8192,2048,bf16,NVIDIA GeForce RTX 4060,c11,32,128,32,4,2,8,0.0,213.632,162.22400218248367,237.8390417993066,3.3094419122768337,0,3,3,16x8192x2048,0,
2026-03-02T09:56:44.814391+00:00,A,llm_style,tune,llm_style_tune_014,8,4096,4096,bf16,NVIDIA GeForce RTX 4060,c11,32,128,32,4,2,8,0.0,236.613,160.60800105333328,178.5779233276844,1.6713703815469338,0,3,3,8x4096x4096,0,
2026-03-02T09:56:44.892702+00:00,A,llm_style,tune,llm_style_tune_015,64,1024,1024,bf16,NVIDIA GeForce RTX 4060,c02,32,64,32,2,2,8,0.0,78.263,41.98399931192398,52.26495906710624,3.1968781011741414,1,3,3,64x1024x1024,0,
2026-03-02T09:56:45.284637+00:00,A,llm_style,tune,llm_style_tune_016,16,4096,8192,bf16,NVIDIA GeForce RTX 4060,c11,32,128,32,4,2,8,0.0,391.88,295.8879917860031,326.50239497423166,3.6288793523481986,0,3,3,16x4096x8192,0,
2026-03-02T09:56:45.526392+00:00,A,llm_style,tune,llm_style_tune_017,1,4096,4096,bf16,NVIDIA GeForce RTX 4060,c02,32,64,32,2,2,8,0.0,241.708,160.76800227165222,177.61311993002892,0.2087133728470579,0,3,3,1x4096x4096,0,
2026-03-02T09:56:45.754589+00:00,A,llm_style,tune,llm_style_tune_018,64,4096,4096,bf16,NVIDIA GeForce RTX 4060,c11,32,128,32,4,2,8,0.0,228.145,164.86400365829468,179.2409536242485,13.02578853083649,1,3,3,64x4096x4096,0,
2026-03-02T09:56:45.972632+00:00,A,llm_style,tune,llm_style_tune_019,64,8192,2048,bf16,NVIDIA GeForce RTX 4060,c04,64,64,64,4,3,8,0.0,217.988,167.77600347995758,182.85567864775658,12.799706772467834,1,3,3,64x8192x2048,0,
2026-03-02T09:56:46.091488+00:00,A,llm_style,tune,llm_style_tune_020,8,2048,4096,bf16,NVIDIA GeForce RTX 4060,c00,32,32,32,2,2,8,0.0,118.796,60.416001826524734,141.53856366872785,2.221559254870681,0,3,3,8x2048x4096,0,
2026-03-02T09:56:46.153851+00:00,A,llm_style,tune,llm_style_tune_021,8,1024,2048,bf16,NVIDIA GeForce RTX 4060,c04,64,64,64,4,3,8,0.0,62.312,42.86399856209755,48.67071967571973,0.7828115230871269,0,3,3,8x1024x2048,0,
2026-03-02T09:56:46.258971+00:00,A,llm_style,tune,llm_style_tune_022,8,8192,1024,bf16,NVIDIA GeForce RTX 4060,c11,32,128,32,4,2,8,0.0,105.076,50.03200098872185,55.7123191654682,2.682637618876271,0,3,3,8x8192x1024,0,
2026-03-02T09:56:46.651058+00:00,A,llm_style,tune,llm_style_tune_023,1,4096,8192,bf16,NVIDIA GeForce RTX 4060,c11,32,128,32,4,2,8,0.0,392.04,292.86399483680725,316.8607911467552,0.22914685718671254,0,3,3,1x4096x8192,0,
2026-03-02T09:56:47.046796+00:00,A,llm_style,tune,llm_style_tune_024,2,8192,4096,bf16,NVIDIA GeForce RTX 4060,c11,32,128,32,4,2,8,0.0,395.689,294.8480099439621,328.2310274243355,0.4552098826290501,0,3,3,2x8192x4096,0,
2026-03-02T09:56:47.264145+00:00,A,llm_style,tune,llm_style_tune_025,2,4096,4096,bf16,NVIDIA GeForce RTX 4060,c11,32,128,32,4,2,8,0.0,217.296,159.71199423074722,165.31263947486877,0.42018675130336847,0,3,3,2x4096x4096,0,
2026-03-02T09:56:47.326898+00:00,A,llm_style,tune,llm_style_tune_026,4,2048,1024,bf16,NVIDIA GeForce RTX 4060,c11,32,128,32,4,2,8,0.0,62.708,39.93599861860275,51.23296070843935,0.4201025786340281,0,3,3,4x2048x1024,0,
2026-03-02T09:56:47.450269+00:00,A,llm_style,tune,llm_style_tune_027,64,2048,4096,bf16,NVIDIA GeForce RTX 4060,c03,64,64,32,4,2,8,0.0,123.326,75.72800293564796,90.39423771202561,14.178926980451907,1,3,3,64x2048x4096,0,
2026-03-02T09:56:47.539334+00:00,A,llm_style,tune,llm_style_tune_028,32,1024,4096,bf16,NVIDIA GeForce RTX 4060,c04,64,64,64,4,3,8,0.0,89.017,60.256000608205795,65.11744014918804,4.454916577444469,0,3,3,32x1024x4096,0,
2026-03-02T09:56:47.593523+00:00,A,llm_style,tune,llm_style_tune_029,32,2048,1024,bf16,NVIDIA GeForce RTX 4060,c00,32,32,32,2,2,8,0.0,54.143,38.896000012755394,180.27455955743784,3.4506820227268915,0,3,3,32x2048x1024,0,
2026-03-02T09:56:47.671022+00:00,A,llm_style,tune,llm_style_tune_030,4,2048,2048,bf16,NVIDIA GeForce RTX 4060,c00,32,32,32,2,2,8,0.0,77.458,50.175998359918594,106.36256344616407,0.668734715736196,0,3,3,4x2048x2048,0,
2026-03-02T09:56:48.459871+00:00,A,llm_style,tune,llm_style_tune_031,1,8192,8192,bf16,NVIDIA GeForce RTX 4060,c02,32,64,32,2,2,8,0.0,788.799,559.7920119762421,607.220167517662,0.23976356419622558,0,3,3,1x8192x8192,0,
2026-03-02T09:56:48.555378+00:00,A,llm_style,eval,llm_style_eval_000,2,1024,4096,bf16,NVIDIA GeForce RTX 4060,c04,64,64,64,4,3,8,0.0,95.005,60.30400097370148,69.1132804751396,0.27821066146699835,0,3,3,2x1024x4096,0,
2026-03-02T09:56:49.285837+00:00,A,llm_style,eval,llm_style_eval_001,2,8192,8192,bf16,NVIDIA GeForce RTX 4060,c02,32,64,32,2,2,8,0.0,730.411,558.4799945354462,596.6336119174957,0.4806536646371541,0,3,3,2x8192x8192,0,
2026-03-02T09:56:49.365850+00:00,A,llm_style,eval,llm_style_eval_002,2,2048,2048,bf16,NVIDIA GeForce RTX 4060,c00,32,32,32,2,2,8,0.0,79.962,47.10400104522705,245.61087623238535,0.3561739051400603,0,3,3,2x2048x2048,0,
2026-03-02T09:56:49.514656+00:00,A,llm_style,eval,llm_style_eval_003,8,1024,8192,bf16,NVIDIA GeForce RTX 4060,c04,64,64,64,4,3,8,0.0,148.76,85.03999933600426,105.25696203112597,1.5782893820317194,0,3,3,8x1024x8192,0,
2026-03-02T09:56:49.751587+00:00,A,llm_style,eval,llm_style_eval_004,64,2048,8192,bf16,NVIDIA GeForce RTX 4060,c06,64,128,32,4,3,8,0.0,236.881,167.93599724769592,215.19424423575396,12.787512404696566,1,3,3,64x2048x8192,0,
2026-03-02T09:56:50.089976+00:00,A,llm_style,eval,llm_style_eval_005,1,8192,8192,bf16,NVIDIA GeForce RTX 4060,c02,32,64,32,2,2,8,0.0,0.0,581.9680094718933,696.4508885145187,0.23062732970802954,0,3,3,1x8192x8192,0,
2026-03-02T09:56:50.242788+00:00,A,llm_style,eval,llm_style_eval_006,1,1024,8192,bf16,NVIDIA GeForce RTX 4060,c04,64,64,64,4,3,8,0.0,152.753,85.93599870800972,88.5673600435257,0.19522919675379613,0,3,3,1x1024x8192,0,
2026-03-02T09:56:50.403419+00:00,A,llm_style,eval,llm_style_eval_007,2,8192,4096,bf16,NVIDIA GeForce RTX 4060,c11,32,128,32,4,2,8,0.0,0.0,296.9280034303665,318.5084718465805,0.4520211177437018,0,3,3,2x8192x4096,0,
2026-03-02T09:56:50.519295+00:00,A,llm_style,eval,llm_style_eval_008,16,2048,4096,bf16,NVIDIA GeForce RTX 4060,c00,32,32,32,2,2,8,0.0,115.82,60.2400004863739,144.80575755238527,4.4560998312196105,0,3,3,16x2048x4096,0,
2026-03-02T09:56:50.745047+00:00,A,llm_style,eval,llm_style_eval_009,32,2048,8192,bf16,NVIDIA GeForce RTX 4060,c04,64,64,64,4,3,8,0.0,225.703,163.87199610471725,204.19359862804407,6.552320405701649,0,3,3,32x2048x8192,0,
2026-03-02T09:56:50.796489+00:00,A,llm_style,eval,llm_style_eval_010,1,1024,1024,bf16,NVIDIA GeForce RTX 4060,c00,32,32,32,2,2,8,0.0,51.394,33.79200026392937,706.8511745333655,0.06206060557588731,0,3,3,1x1024x1024,0,
2026-03-02T09:56:50.884935+00:00,A,llm_style,eval,llm_style_eval_011,16,2048,8192,bf16,NVIDIA GeForce RTX 4060,c10,64,128,64,8,3,8,0.0,0.0,162.35200315713882,175.80799758434296,3.306832694145253,0,3,3,16x2048x8192,0,
2026-03-02T09:56:51.626640+00:00,A,llm_style,eval,llm_style_eval_012,8,8192,8192,bf16,NVIDIA GeForce RTX 4060,c06,64,128,32,4,3,8,0.0,741.65,555.0560057163239,631.9692867994306,1.93447474298434,0,3,3,8x8192x8192,0,
2026-03-02T09:56:52.049265+00:00,A,llm_style,eval,llm_style_eval_013,32,4096,8192,bf16,NVIDIA GeForce RTX 4060,c11,32,128,32,4,2,8,0.0,422.573,295.77599465847015,343.746568262577,7.260506892994071,0,3,3,32x4096x8192,0,
2026-03-02T09:56:52.061400+00:00,A,llm_style,eval,llm_style_eval_014,64,1024,1024,bf16,NVIDIA GeForce RTX 4060,c02,32,64,32,2,2,8,0.0,0.0,44.03200000524521,57.62400049716233,3.04818604614852,1,3,3,64x1024x1024,0,
2026-03-02T09:56:52.073818+00:00,A,llm_style,eval,llm_style_eval_015,16,2048,1024,bf16,NVIDIA GeForce RTX 4060,c11,32,128,32,4,2,8,0.0,0.0,40.95999896526337,117.81887792050834,1.6384000413894664,0,3,3,16x2048x1024,0,
2026-03-02T09:56:52.140286+00:00,A,llm_style,eval,llm_style_eval_016,2,1024,8192,bf16,NVIDIA GeForce RTX 4060,c04,64,64,64,4,3,8,0.0,0.0,85.83999797701836,177.65055462718004,0.39089506978999944,0,3,3,2x1024x8192,0,
2026-03-02T09:56:52.917395+00:00,A,llm_style,eval,llm_style_eval_017,4,8192,8192,bf16,NVIDIA GeForce RTX 4060,c11,32,128,32,4,2,8,0.0,777.057,559.1040253639221,607.2777605056763,0.9602343886731086,0,3,3,4x8192x8192,0,
2026-03-02T09:56:53.013098+00:00,A,llm_style,eval,llm_style_eval_018,4,1024,4096,bf16,NVIDIA GeForce RTX 4060,c04,64,64,64,4,3,8,0.0,95.654,60.416001826524734,68.48575964570045,0.5553898137176703,0,3,3,4x1024x4096,0,
2026-03-02T09:56:53.130165+00:00,A,llm_style,eval,llm_style_eval_019,8,4096,2048,bf16,NVIDIA GeForce RTX 4060,c11,32,128,32,4,2,8,0.0,117.015,52.91200056672096,57.27040007710456,2.5366216843521943,0,3,3,8x4096x2048,0,
2026-03-02T09:56:53.180328+00:00,A,llm_style,eval,llm_style_eval_020,64,4096,2048,bf16,NVIDIA GeForce RTX 4060,c11,32,128,32,4,2,8,0.0,0.0,70.14400139451027,94.86943863332269,15.307678527789763,1,3,3,64x4096x2048,0,
2026-03-02T09:56:53.340530+00:00,A,llm_style,eval,llm_style_eval_021,1,4096,8192,bf16,NVIDIA GeForce RTX 4060,c11,32,128,32,4,2,8,0.0,0.0,295.75999081134796,439.9692863225935,0.22690311767965174,0,3,3,1x4096x8192,0,
2026-03-02T09:56:53.359350+00:00,A,llm_style,eval,llm_style_eval_022,32,1024,4096,bf16,NVIDIA GeForce RTX 4060,c04,64,64,64,4,3,8,0.0,0.0,52.22399905323982,61.36256143450737,5.140078524556174,0,3,3,32x1024x4096,0,
2026-03-02T09:56:53.410345+00:00,A,llm_style,eval,llm_style_eval_023,4,1024,1024,bf16,NVIDIA GeForce RTX 4060,c04,64,64,64,4,3,8,0.0,50.947,35.5679988861084,47.00800169259308,0.23584706091734314,0,3,3,4x1024x1024,0,
2026-03-02T09:56:53.428285+00:00,A,llm_style,eval,llm_style_eval_024,64,2048,2048,bf16,NVIDIA GeForce RTX 4060,c04,64,64,64,4,3,8,0.0,0.0,58.36800113320351,72.7014375478029,9.198034909141219,1,3,3,64x2048x2048,0,
2026-03-02T09:56:53.745494+00:00,A,llm_style,eval,llm_style_eval_025,32,8192,8192,bf16,NVIDIA GeForce RTX 4060,c00,32,32,32,2,2,8,0.0,0.0,567.1840012073517,605.573108792305,7.5724408425791285,0,3,3,32x8192x8192,0,
2026-03-02T09:56:53.860686+00:00,A,llm_style,eval,llm_style_eval_026,4,2048,4096,bf16,NVIDIA GeForce RTX 4060,c00,32,32,32,2,2,8,0.0,115.135,58.17599967122078,132.47455850243568,1.1535489614147232,0,3,3,4x2048x4096,0,
2026-03-02T09:56:54.075836+00:00,A,llm_style,eval,llm_style_eval_027,8,8192,2048,bf16,NVIDIA GeForce RTX 4060,c00,32,32,32,2,2,8,0.0,215.104,160.68799793720245,183.92703816294664,1.6705383068180717,0,3,3,8x8192x2048,0,
2026-03-02T09:56:54.546352+00:00,A,llm_style,eval,llm_style_eval_028,8,4096,8192,bf16,NVIDIA GeForce RTX 4060,c11,32,128,32,4,2,8,0.0,470.465,293.61599683761597,361.1135989427564,1.828479775565212,0,3,3,8x4096x8192,0,
2026-03-02T09:56:54.626218+00:00,A,llm_style,eval,llm_style_eval_029,8,2048,2048,bf16,NVIDIA GeForce RTX 4060,c00,32,32,32,2,2,8,0.0,79.817,47.040000557899475,189.91103708744038,1.4266339966854091,0,3,3,8x2048x2048,0,
2026-03-02T09:56:54.740043+00:00,A,llm_style,eval,llm_style_eval_030,1,4096,2048,bf16,NVIDIA GeForce RTX 4060,c11,32,128,32,4,2,8,0.0,113.778,52.09600180387497,62.59071763604879,0.32204421489313,0,3,3,1x4096x2048,0,
2026-03-02T09:56:54.823249+00:00,A,llm_style,eval,llm_style_eval_031,16,8192,2048,bf16,NVIDIA GeForce RTX 4060,c11,32,128,32,4,2,8,0.0,0.0,166.9120043516159,198.7299235165119,3.216490713687859,0,3,3,16x8192x2048,0,
2026-03-02T09:56:54.894309+00:00,A,llm_style,eval,llm_style_eval_032,1,2048,2048,bf16,NVIDIA GeForce RTX 4060,c00,32,32,32,2,2,8,0.0,70.996,47.5040003657341,157.62847676873187,0.1765874018064998,0,3,3,1x2048x2048,0,
2026-03-02T09:56:55.292392+00:00,A,llm_style,eval,llm_style_eval_033,16,8192,4096,bf16,NVIDIA GeForce RTX 4060,c11,32,128,32,4,2,8,0.0,398.025,295.6319898366928,308.7507230043411,3.6320217733985265,0,3,3,16x8192x4096,0,
2026-03-02T09:56:55.391922+00:00,A,llm_style,eval,llm_style_eval_034,16,1024,4096,bf16,NVIDIA GeForce RTX 4060,c00,32,32,32,2,2,8,0.0,99.48,58.33600088953972,242.3910361528396,2.300770123995022,0,3,3,16x1024x4096,0,
2026-03-02T09:56:55.607425+00:00,A,llm_style,eval,llm_style_eval_035,4,8192,2048,bf16,NVIDIA GeForce RTX 4060,c02,32,64,32,2,2,8,0.0,215.457,162.54399716854095,174.59008291363716,0.8257316808865626,0,3,3,4x8192x2048,0,
2026-03-02T09:56:55.727424+00:00,A,llm_style,eval,llm_style_eval_036,2,2048,4096,bf16,NVIDIA GeForce RTX 4060,c00,32,32,32,2,2,8,0.0,119.949,61.83999963104725,162.5308836996555,0.542600779433927,0,3,3,2x2048x4096,0,
2026-03-02T09:56:55.788087+00:00,A,llm_style,eval,llm_style_eval_037,2,1024,1024,bf16,NVIDIA GeForce RTX 4060,c04,64,64,64,4,3,8,0.0,60.614,39.72800076007843,69.86079875379795,0.10557551147186696,0,3,3,2x1024x1024,0,
2026-03-02T09:56:56.194970+00:00,A,llm_style,eval,llm_style_eval_038,64,4096,8192,bf16,NVIDIA GeForce RTX 4060,c03,64,64,32,4,2,8,0.0,406.833,301.9839972257614,359.7769507765769,14.222499653811484,1,3,3,64x4096x8192,0,
2026-03-02T09:56:56.262789+00:00,A,llm_style,eval,llm_style_eval_039,4,1024,2048,bf16,NVIDIA GeForce RTX 4060,c04,64,64,64,4,3,8,0.0,67.767,43.007999658584595,47.711999826133244,0.3900952411919765,0,3,3,4x1024x2048,0,
2026-03-02T09:56:56.375100+00:00,A,llm_style,eval,llm_style_eval_040,64,8192,1024,bf16,NVIDIA GeForce RTX 4060,c06,64,128,32,4,3,8,0.0,112.266,66.56000018119812,72.55840070545672,16.13193841762204,1,3,3,64x8192x1024,0,
2026-03-02T09:56:56.431083+00:00,A,llm_style,eval,llm_style_eval_041,2,2048,1024,bf16,NVIDIA GeForce RTX 4060,c11,32,128,32,4,2,8,0.0,55.937,39.744000881910324,45.076480358839035,0.21106601786077647,0,3,3,2x2048x1024,0,
2026-03-02T09:56:56.548921+00:00,A,llm_style,eval,llm_style_eval_042,2,4096,2048,bf16,NVIDIA GeForce RTX 4060,c11,32,128,32,4,2,8,0.0,117.793,52.2879995405674,58.931199423968785,0.6417233838515269,0,3,3,2x4096x2048,0,
2026-03-02T09:56:56.602096+00:00,A,llm_style,eval,llm_style_eval_043,1,2048,1024,bf16,NVIDIA GeForce RTX 4060,c11,32,128,32,4,2,8,0.0,53.128,38.54399919509888,52.807681076228604,0.10881859920060744,0,3,3,1x2048x1024,0,
2026-03-02T09:56:56.838816+00:00,A,llm_style,eval,llm_style_eval_044,8,2048,8192,bf16,NVIDIA GeForce RTX 4060,c10,64,128,64,8,3,8,0.0,236.677,162.81600296497345,251.91423892974822,1.6487043724918637,0,3,3,8x2048x8192,0,
2026-03-02T09:56:56.953426+00:00,A,llm_style,eval,llm_style_eval_045,1,8192,1024,bf16,NVIDIA GeForce RTX 4060,c11,32,128,32,4,2,8,0.0,114.564,49.92000013589859,81.02720104157922,0.33608205036712585,0,3,3,1x8192x1024,0,
2026-03-02T09:56:57.024557+00:00,A,llm_style,eval,llm_style_eval_046,64,4096,1024,bf16,NVIDIA GeForce RTX 4060,c04,64,64,64,4,3,8,0.0,71.083,47.488000243902206,75.20256113260976,11.305401559185219,1,3,3,64x4096x1024,0,
2026-03-02T09:56:57.095535+00:00,A,llm_style,eval,llm_style_eval_047,16,2048,2048,bf16,NVIDIA GeForce RTX 4060,c00,32,32,32,2,2,8,0.0,70.914,48.81599918007851,111.09215982258308,2.7494618619785087,0,3,3,16x2048x2048,0,
2026-03-02T09:56:57.501238+00:00,A,llm_style,eval,llm_style_eval_048,8,8192,4096,bf16,NVIDIA GeForce RTX 4060,c11,32,128,32,4,2,8,0.0,405.648,293.87199878692627,359.5011261105535,1.8268869242940755,0,3,3,8x8192x4096,0,
2026-03-02T09:56:57.900289+00:00,A,llm_style,eval,llm_style_eval_049,4,4096,8192,bf16,NVIDIA GeForce RTX 4060,c03,64,64,32,4,2,8,0.0,399.005,294.9120104312897,316.4774352312088,0.9102221900268849,0,3,3,4x4096x8192,0,
2026-03-02T09:56:58.133955+00:00,A,llm_style,eval,llm_style_eval_050,4,2048,8192,bf16,NVIDIA GeForce RTX 4060,c10,64,128,64,8,3,8,0.0,233.619,163.13599795103073,222.37471222877485,0.8227352006041533,0,3,3,4x2048x8192,0,
2026-03-02T09:56:58.193139+00:00,A,llm_style,eval,llm_style_eval_051,16,1024,1024,bf16,NVIDIA GeForce RTX 4060,c04,64,64,64,4,3,8,0.0,59.133,38.91199827194214,46.622720882296555,0.8623158277685969,0,3,3,16x1024x1024,0,
2026-03-02T09:56:58.583402+00:00,A,llm_style,eval,llm_style_eval_052,32,8192,4096,bf16,NVIDIA GeForce RTX 4060,c11,32,128,32,4,2,8,0.0,390.222,296.9599962234497,337.1212822198868,7.231558712656065,0,3,3,32x8192x4096,0,
2026-03-02T09:56:58.607234+00:00,A,llm_style,eval,llm_style_eval_053,32,1024,2048,bf16,NVIDIA GeForce RTX 4060,c00,32,32,32,2,2,8,0.0,0.0,70.92799991369247,304.8953488469124,1.8923094992572826,0,3,3,32x1024x2048,0,
2026-03-02T09:56:58.703843+00:00,A,llm_style,eval,llm_style_eval_054,64,8192,2048,bf16,NVIDIA GeForce RTX 4060,c04,64,64,64,4,3,8,0.0,0.0,172.38400131464005,212.6335936784744,12.457557729387853,1,3,3,64x8192x2048,0,
2026-03-02T09:56:58.774638+00:00,A,llm_style,eval,llm_style_eval_055,1,4096,1024,bf16,NVIDIA GeForce RTX 4060,c11,32,128,32,4,2,8,0.0,70.74,40.94399884343147,82.34207939356556,0.2048800370495751,0,3,3,1x4096x1024,0,
2026-03-02T09:56:58.798954+00:00,A,llm_style,eval,llm_style_eval_056,4,2048,2048,bf16,NVIDIA GeForce RTX 4060,c00,32,32,32,2,2,8,0.0,0.0,47.10400104522705,130.83999887108794,0.7123478102801206,0,3,3,4x2048x2048,0,
2026-03-02T09:56:58.953037+00:00,A,llm_style,eval,llm_style_eval_057,16,1024,8192,bf16,NVIDIA GeForce RTX 4060,c04,64,64,64,4,3,8,0.0,154.026,86.01599931716919,91.1974410712719,3.120761929535812,0,3,3,16x1024x8192,0,
2026-03-02T09:56:59.368171+00:00,A,llm_style,eval,llm_style_eval_058,1,8192,4096,bf16,NVIDIA GeForce RTX 4060,c11,32,128,32,4,2,8,0.0,415.081,292.33600199222565,307.0991948246956,0.22956072308119166,0,3,3,1x8192x4096,0,
2026-03-02T09:56:59.393693+00:00,A,llm_style,eval,llm_style_eval_059,8,4096,1024,bf16,NVIDIA GeForce RTX 4060,c00,32,32,32,2,2,8,0.0,0.0,43.007999658584595,499.9980638921247,1.560380964767906,0,3,3,8x4096x1024,0,
2026-03-02T09:56:59.777591+00:00,A,llm_style,eval,llm_style_eval_060,4,8192,4096,bf16,NVIDIA GeForce RTX 4060,c11,32,128,32,4,2,8,0.0,383.844,294.5759892463684,331.37664407491684,0.9112604753929697,0,3,3,4x8192x4096,0,
2026-03-02T09:56:59.863161+00:00,A,llm_style,eval,llm_style_eval_061,32,2048,2048,bf16,NVIDIA GeForce RTX 4060,c01,64,32,32,2,2,8,0.0,85.522,51.20000056922436,70.2156814187765,5.242879941711426,0,3,3,32x2048x2048,0,
2026-03-02T09:56:59.918228+00:00,A,llm_style,eval,llm_style_eval_062,8,2048,1024,bf16,NVIDIA GeForce RTX 4060,c11,32,128,32,4,2,8,0.0,55.024,39.583999663591385,50.543998442590215,0.8476766442291261,0,3,3,8x2048x1024,0,
2026-03-02T09:57:00.084318+00:00,A,llm_style,eval,llm_style_eval_063,16,4096,8192,bf16,NVIDIA GeForce RTX 4060,c11,32,128,32,4,2,8,0.0,0.0,292.86399483680725,310.2720081806183,3.6663497149874007,0,3,3,16x4096x8192,0,
2026-03-02T09:57:00.581059+00:00,A,training_style,tune,training_style_tune_000,4096,2048,1024,bf16,NVIDIA GeForce RTX 4060,c09,128,64,64,8,3,8,0.0,496.053,555.9360086917877,594.011504650116,30.902601945909502,3,3,3,4096x2048x1024,0,
2026-03-02T09:57:00.889233+00:00,A,training_style,tune,training_style_tune_001,1536,2048,1536,bf16,NVIDIA GeForce RTX 4060,c06,64,128,32,4,3,8,0.0,308.123,316.4159953594208,335.87199449539185,30.541048991606484,3,3,3,1536x2048x1536,0,
2026-03-02T09:57:02.362560+00:00,A,training_style,tune,training_style_tune_002,3072,2048,4096,bf16,NVIDIA GeForce RTX 4060,c06,64,128,32,4,3,8,0.0,1473.278,1555.5199980735779,1648.027160167694,33.133362229883794,3,3,3,3072x2048x4096,0,
2026-03-02T09:57:02.749751+00:00,A,training_style,tune,training_style_tune_003,2048,1536,2048,bf16,NVIDIA GeForce RTX 4060,c09,128,64,64,8,3,8,0.0,387.133,415.76001048088074,440.37536323070526,30.99120060415846,3,3,3,2048x1536x2048,0,
2026-03-02T09:57:02.828137+00:00,A,training_style,tune,training_style_tune_004,512,512,1024,bf16,NVIDIA GeForce RTX 4060,c11,32,128,32,4,2,8,0.0,78.34,52.000001072883606,100.1779203116893,10.324440402366868,2,2,3,512x512x1024,0,
2026-03-02T09:57:03.011820+00:00,A,training_style,tune,training_style_tune_005,1024,1536,1536,bf16,NVIDIA GeForce RTX 4060,c06,64,128,32,4,3,8,0.0,183.643,171.9520017504692,178.93311887979507,28.099924157974016,3,3,3,1024x1536x1536,0,
2026-03-02T09:57:03.100462+00:00,A,training_style,tune,training_style_tune_006,1024,1536,512,bf16,NVIDIA GeForce RTX 4060,c06,64,128,32,4,3,8,0.0,88.596,79.8719972372055,158.12416434288025,20.164923774433348,3,3,2,1024x1536x512,0,
2026-03-02T09:57:03.225030+00:00,A,training_style,tune,training_style_tune_007,2048,1536,512,bf16,NVIDIA GeForce RTX 4060,c03,64,64,32,4,2,8,0.0,124.522,125.95200538635254,169.57919612526888,25.575023296524932,3,3,2,2048x1536x512,0,
2026-03-02T09:57:04.051377+00:00,A,training_style,tune,training_style_tune_008,3072,3072,1536,bf16,NVIDIA GeForce RTX 4060,c09,128,64,64,8,3,8,0.0,826.294,887.8080248832703,982.2416073083878,32.65461500171928,3,3,3,3072x3072x1536,0,
2026-03-02T09:57:04.186952+00:00,A,training_style,tune,training_style_tune_009,1024,1536,1024,bf16,NVIDIA GeForce RTX 4060,c06,64,128,32,4,3,8,0.0,135.515,124.92799758911133,154.46431964635843,25.784656235303018,3,3,3,1024x1536x1024,0,
2026-03-02T09:57:04.942835+00:00,A,training_style,tune,training_style_tune_010,1536,2048,4096,bf16,NVIDIA GeForce RTX 4060,c06,64,128,32,4,3,8,0.0,755.835,796.671986579895,899.5593553781509,32.34681802560865,3,3,3,1536x2048x4096,0,
2026-03-02T09:57:05.254315+00:00,A,training_style,tune,training_style_tune_011,1024,1024,4096,bf16,NVIDIA GeForce RTX 4060,c04,64,64,64,4,3,8,0.0,311.429,296.9599962234497,542.8947275876995,28.92623485062426,3,3,3,1024x1024x4096,0,
2026-03-02T09:57:08.089598+00:00,A,training_style,tune,training_style_tune_012,3072,4096,4096,bf16,NVIDIA GeForce RTX 4060,c07,128,128,32,8,3,8,0.0,2835.228,3106.800079345703,3193.8722944259644,33.17858004101399,3,3,3,3072x4096x4096,0,
2026-03-02T09:57:08.257658+00:00,A,training_style,tune,training_style_tune_013,512,1024,3072,bf16,NVIDIA GeForce RTX 4060,c06,64,128,32,4,3,8,0.0,168.009,137.10399717092514,152.18623533844945,23.494759733256753,2,3,3,512x1024x3072,0,
2026-03-02T09:57:08.385133+00:00,A,training_style,tune,training_style_tune_014,1536,1024,1024,bf16,NVIDIA GeForce RTX 4060,c06,64,128,32,4,3,8,0.0,127.43,124.92799758911133,143.10048431158063,25.784656235303018,3,3,3,1536x1024x1024,0,
2026-03-02T09:57:08.946976+00:00,A,training_style,tune,training_style_tune_015,2048,3072,1536,bf16,NVIDIA GeForce RTX 4060,c06,64,128,32,4,3,8,0.0,561.792,621.1200058460236,714.9971270561217,31.116938192442113,3,3,3,2048x3072x1536,0,
2026-03-02T09:57:09.810286+00:00,A,training_style,tune,training_style_tune_016,1536,3072,3072,bf16,NVIDIA GeForce RTX 4060,c06,64,128,32,4,3,8,0.0,863.263,874.4959831237793,964.331491589546,33.151700873961026,3,3,3,1536x3072x3072,0,
2026-03-02T09:57:09.982468+00:00,A,training_style,tune,training_style_tune_017,1024,1024,2048,bf16,NVIDIA GeForce RTX 4060,c04,64,64,64,4,3,8,0.0,172.131,164.23999518156052,190.88128045201302,26.150556636659,3,3,3,1024x1024x2048,0,
2026-03-02T09:57:10.220884+00:00,A,training_style,tune,training_style_tune_018,1536,1536,1536,bf16,NVIDIA GeForce RTX 4060,c09,128,64,64,8,3,8,0.0,238.371,248.59199672937393,268.34944158792496,29.15523189545867,3,3,3,1536x1536x1536,0,
2026-03-02T09:57:10.265565+00:00,A,training_style,tune,training_style_tune_019,1536,1536,2048,bf16,NVIDIA GeForce RTX 4060,c10,64,128,64,8,3,8,0.0,0.0,312.7199858427048,366.0864007472992,30.902010915479956,3,3,3,1536x1536x2048,0,
2026-03-02T09:57:10.434549+00:00,A,training_style,tune,training_style_tune_020,1536,1536,1024,bf16,NVIDIA GeForce RTX 4060,c06,64,128,32,4,3,8,0.0,168.931,174.0799993276596,295.59839412569977,27.756423636614,3,3,3,1536x1536x1024,0,
2026-03-02T09:57:10.664803+00:00,A,training_style,tune,training_style_tune_021,1024,2048,1536,bf16,NVIDIA GeForce RTX 4060,c06,64,128,32,4,3,8,0.0,230.21,226.33599489927292,307.496955692768,28.464102437029986,3,3,3,1024x2048x1536,0,
2026-03-02T09:57:10.762159+00:00,A,training_style,tune,training_style_tune_022,512,1024,1536,bf16,NVIDIA GeForce RTX 4060,c06,64,128,32,4,3,8,0.0,97.3,84.75199714303017,90.555200278759,19.003832243408716,2,3,3,512x1024x1536,0,
2026-03-02T09:57:10.820372+00:00,A,training_style,tune,training_style_tune_023,1536,2048,2048,bf16,NVIDIA GeForce RTX 4060,c09,128,64,64,8,3,8,0.0,0.0,391.08799397945404,573.7711960077285,32.94629875208317,3,3,3,1536x2048x2048,0,
2026-03-02T09:57:10.920926+00:00,A,training_style,tune,training_style_tune_024,1024,1024,1024,bf16,NVIDIA GeForce RTX 4060,c04,64,64,64,4,3,8,0.0,100.502,97.16800227761269,103.42399775981903,22.100728610891448,3,3,3,1024x1024x1024,0,
2026-03-02T09:57:11.322461+00:00,A,training_style,tune,training_style_tune_025,1536,1024,4096,bf16,NVIDIA GeForce RTX 4060,c10,64,128,64,8,3,8,0.0,401.492,414.5280122756958,430.64320027828217,31.083308018832902,3,3,3,1536x1024x4096,0,
2026-03-02T09:57:11.600995+00:00,A,training_style,tune,training_style_tune_026,2048,4096,512,bf16,NVIDIA GeForce RTX 4060,c10,64,128,64,8,3,8,0.0,278.481,299.45600032806396,372.6857542991638,28.68513097947426,3,3,2,2048x4096x512,0,
2026-03-02T09:57:13.031154+00:00,A,training_style,tune,training_style_tune_027,4096,4096,1536,bf16,NVIDIA GeForce RTX 4060,c06,64,128,32,4,3,8,0.0,1430.102,1576.4479637145996,1623.1014597415924,32.693503837929875,3,3,3,4096x4096x1536,0,
2026-03-02T09:57:13.605211+00:00,A,training_style,tune,training_style_tune_028,1536,1536,4096,bf16,NVIDIA GeForce RTX 4060,c09,128,64,64,8,3,8,0.0,573.999,604.5919954776764,634.4649583101273,31.967596290668443,3,3,3,1536x1536x4096,0,
2026-03-02T09:57:14.587098+00:00,A,training_style,tune,training_style_tune_029,4096,2048,2048,bf16,NVIDIA GeForce RTX 4060,c06,64,128,32,4,3,8,0.0,981.821,1057.536005973816,1117.3891735076904,32.49037212341565,3,3,3,4096x2048x2048,0,
2026-03-02T09:57:14.750602+00:00,A,training_style,tune,training_style_tune_030,2048,2048,512,bf16,NVIDIA GeForce RTX 4060,c06,64,128,32,4,3,8,0.0,163.444,164.8320034146309,190.52543744444847,26.056634676678133,3,3,2,2048x2048x512,0,
2026-03-02T09:57:14.832563+00:00,A,training_style,tune,training_style_tune_031,512,512,1536,bf16,NVIDIA GeForce RTX 4060,c11,32,128,32,4,2,8,0.0,81.916,61.43999844789505,81.42656072974202,13.107200331115733,2,2,3,512x512x1536,0,
2026-03-02T09:57:15.398609+00:00,A,training_style,eval,training_style_eval_000,2048,1536,3072,bf16,NVIDIA GeForce RTX 4060,c06,64,128,32,4,3,8,0.0,565.602,608.8640093803406,646.9324868917465,31.743299873595806,3,3,3,2048x1536x3072,0,
2026-03-02T09:57:15.690603+00:00,A,training_style,eval,training_style_eval_001,1024,2048,2048,bf16,NVIDIA GeForce RTX 4060,c06,64,128,32,4,3,8,0.0,291.941,296.80000245571136,355.233610868454,28.941827900698197,3,3,3,1024x2048x2048,0,
2026-03-02T09:57:16.001306+00:00,A,training_style,eval,training_style_eval_002,1536,1024,3072,bf16,NVIDIA GeForce RTX 4060,c09,128,64,64,8,3,8,0.0,310.651,318.28799843788147,388.03455710411055,30.36142255890307,3,3,3,1536x1024x3072,0,
2026-03-02T09:57:16.086686+00:00,A,training_style,eval,training_style_eval_003,1024,512,1024,bf16,NVIDIA GeForce RTX 4060,c10,64,128,64,8,3,8,0.0,85.333,67.391999065876,71.11296124756336,15.932778948290467,3,2,3,1024x512x1024,0,
2026-03-02T09:57:16.241411+00:00,A,training_style,eval,training_style_eval_004,1024,2048,1024,bf16,NVIDIA GeForce RTX 4060,c06,64,128,32,4,3,8,0.0,154.683,162.7199947834015,166.2470392882824,26.394834277846932,3,3,3,1024x2048x1024,0,
2026-03-02T09:57:16.338769+00:00,A,training_style,eval,training_style_eval_005,1024,512,1536,bf16,NVIDIA GeForce RTX 4060,c06,64,128,32,4,3,8,0.0,97.308,84.99199897050858,101.41695708036423,18.950168904238474,3,2,3,1024x512x1536,0,
2026-03-02T09:57:16.389046+00:00,A,training_style,eval,training_style_eval_006,2048,1536,2048,bf16,NVIDIA GeForce RTX 4060,c09,128,64,64,8,3,8,0.0,0.0,403.9199948310852,529.0905636548996,31.899638673218742,3,3,3,2048x1536x2048,0,
2026-03-02T09:57:16.597924+00:00,A,training_style,eval,training_style_eval_007,1536,2048,1024,bf16,NVIDIA GeForce RTX 4060,c06,64,128,32,4,3,8,0.0,208.822,222.20799326896667,243.95776808261866,28.99288567086729,3,3,3,1536x2048x1024,0,
2026-03-02T09:57:16.683233+00:00,A,training_style,eval,training_style_eval_008,512,512,2048,bf16,NVIDIA GeForce RTX 4060,c11,32,128,32,4,2,8,0.0,85.254,69.98400017619133,86.66527941823003,15.342675772987448,2,2,3,512x512x2048,0,
2026-03-02T09:57:16.701638+00:00,A,training_style,eval,training_style_eval_009,1024,512,2048,bf16,NVIDIA GeForce RTX 4060,c06,64,128,32,4,3,8,0.0,0.0,106.92799836397171,251.62623524665818,20.083455043179526,3,2,3,1024x512x2048,0,
2026-03-02T09:57:17.080057+00:00,A,training_style,eval,training_style_eval_010,2048,3072,1024,bf16,NVIDIA GeForce RTX 4060,c10,64,128,64,8,3,8,0.0,378.372,419.840008020401,461.1481669545173,30.69002868200663,3,3,3,2048x3072x1024,0,
2026-03-02T09:57:17.828006+00:00,A,training_style,eval,training_style_eval_011,2048,4096,1536,bf16,NVIDIA GeForce RTX 4060,c03,64,64,32,4,2,8,0.0,747.896,805.8879971504211,885.7497656345366,31.976904814466415,3,3,3,2048x4096x1536,0,
2026-03-02T09:57:18.944352+00:00,A,training_style,eval,training_style_eval_012,2048,3072,3072,bf16,NVIDIA GeForce RTX 4060,c06,64,128,32,4,3,8,0.0,1116.293,1166.3359999656677,1284.0099596977234,33.14199824504932,3,3,3,2048x3072x3072,0,
2026-03-02T09:57:19.378634+00:00,A,training_style,eval,training_style_eval_013,3072,1536,1536,bf16,NVIDIA GeForce RTX 4060,c09,128,64,64,8,3,8,0.0,434.23,465.40799736976624,959.3088185787187,31.145821958197523,3,3,3,3072x1536x1536,0,
2026-03-02T09:57:19.682874+00:00,A,training_style,eval,training_style_eval_014,2048,1536,1536,bf16,NVIDIA GeForce RTX 4060,c09,128,64,64,8,3,8,0.0,304.188,321.3279992341995,341.04511618614197,30.07418102073527,3,3,3,2048x1536x1536,0,
2026-03-02T09:57:19.742790+00:00,A,training_style,eval,training_style_eval_015,4096,2048,1024,bf16,NVIDIA GeForce RTX 4060,c09,128,64,64,8,3,8,0.0,0.0,528.3519923686981,560.42305290699,32.515954197465064,3,3,3,4096x2048x1024,0,
2026-03-02T09:57:19.843142+00:00,A,training_style,eval,training_style_eval_016,2048,1024,512,bf16,NVIDIA GeForce RTX 4060,c06,64,128,32,4,3,8,0.0,100.297,94.96000036597252,102.32255667448044,22.614612886727812,3,3,2,2048x1024x512,0,
2026-03-02T09:57:20.837596+00:00,A,training_style,eval,training_style_eval_017,2048,4096,2048,bf16,NVIDIA GeForce RTX 4060,c03,64,64,32,4,2,8,0.0,994.406,1047.2480058670044,1065.4979014396667,32.80955244173894,3,3,3,2048x4096x2048,0,
2026-03-02T09:57:21.403862+00:00,A,training_style,eval,training_style_eval_018,1536,2048,3072,bf16,NVIDIA GeForce RTX 4060,c09,128,64,64,8,3,8,0.0,566.212,609.3120276927948,651.9091355800629,31.719959484772453,3,3,3,1536x2048x3072,0,
2026-03-02T09:57:21.845055+00:00,A,training_style,eval,training_style_eval_019,1536,1536,3072,bf16,NVIDIA GeForce RTX 4060,c10,64,128,64,8,3,8,0.0,441.121,462.8480076789856,477.8086417913437,31.31808797598532,3,3,3,1536x1536x3072,0,
2026-03-02T09:57:22.411656+00:00,A,training_style,eval,training_style_eval_020,3072,1536,2048,bf16,NVIDIA GeForce RTX 4060,c06,64,128,32,4,3,8,0.0,566.548,607.6159775257111,665.8492922782898,31.80850001789522,3,3,3,3072x1536x2048,0,
2026-03-02T09:57:22.500257+00:00,A,training_style,eval,training_style_eval_021,2048,1024,4096,bf16,NVIDIA GeForce RTX 4060,c09,128,64,64,8,3,8,0.0,0.0,570.3040063381195,613.887991309166,30.1240548778724,3,3,3,2048x1024x4096,0,
2026-03-02T09:57:22.515500+00:00,A,training_style,eval,training_style_eval_022,512,512,1536,bf16,NVIDIA GeForce RTX 4060,c11,32,128,32,4,2,8,0.0,0.0,75.77599957585335,161.1657613515854,10.62745951894533,2,2,3,512x512x1536,0,
2026-03-02T09:57:22.842758+00:00,A,training_style,eval,training_style_eval_023,3072,4096,4096,bf16,NVIDIA GeForce RTX 4060,c07,128,128,32,8,3,8,0.0,0.0,3171.1199283599854,3236.589722633362,32.50561865609091,3,3,3,3072x4096x4096,0,
2026-03-02T09:57:22.921653+00:00,A,training_style,eval,training_style_eval_024,1536,1024,4096,bf16,NVIDIA GeForce RTX 4060,c10,64,128,64,8,3,8,0.0,0.0,415.74400663375854,493.2083138823507,30.99239359414434,3,3,3,1536x1024x4096,0,
2026-03-02T09:57:24.345974+00:00,A,training_style,eval,training_style_eval_025,4096,3072,2048,bf16,NVIDIA GeForce RTX 4060,c06,64,128,32,4,3,8,0.0,1424.257,1557.5040578842163,1650.7802081108093,33.0911545887166,3,3,3,4096x3072x2048,0,
2026-03-02T09:57:24.407383+00:00,A,training_style,eval,training_style_eval_026,1024,512,512,bf16,NVIDIA GeForce RTX 4060,c09,128,64,64,8,3,8,0.0,61.359,48.128001391887665,56.52352001518011,11.155063507176793,3,2,2,1024x512x512,0,
2026-03-02T09:57:24.901222+00:00,A,training_style,eval,training_style_eval_027,2048,4096,1024,bf16,NVIDIA GeForce RTX 4060,c09,128,64,64,8,3,8,0.0,493.793,551.9359707832336,569.8044788837433,31.126561944532497,3,3,3,2048x4096x1024,0,
2026-03-02T09:57:24.925890+00:00,A,training_style,eval,training_style_eval_028,1536,1536,1024,bf16,NVIDIA GeForce RTX 4060,c06,64,128,32,4,3,8,0.0,0.0,188.25599551200867,233.01120072603226,25.666317796990327,3,3,3,1536x1536x1024,0,
2026-03-02T09:57:25.106873+00:00,A,training_style,eval,training_style_eval_029,1024,512,4096,bf16,NVIDIA GeForce RTX 4060,c06,64,128,32,4,3,8,0.0,180.932,172.03199863433838,288.80896016955336,24.966095436286498,3,2,3,1024x512x4096,0,
2026-03-02T09:57:25.339696+00:00,A,training_style,eval,training_style_eval_030,1024,1024,3072,bf16,NVIDIA GeForce RTX 4060,c04,64,64,64,4,3,8,0.0,232.767,231.4240038394928,245.29919728636742,27.83830042309806,3,3,3,1024x1024x3072,0,
2026-03-02T09:57:25.416814+00:00,A,training_style,eval,training_style_eval_031,1024,1024,512,bf16,NVIDIA GeForce RTX 4060,c10,64,128,64,8,3,8,0.0,77.07,66.56000018119812,89.14559990167615,16.13193841762204,3,3,2,1024x1024x512,0,
2026-03-02T09:57:25.494281+00:00,A,training_style,eval,training_style_eval_032,512,1024,1024,bf16,NVIDIA GeForce RTX 4060,c06,64,128,32,4,3,8,0.0,77.426,65.50399959087372,81.91264078021047,16.392004010539807,2,3,3,512x1024x1024,0,
2026-03-02T09:57:26.224329+00:00,A,training_style,eval,training_style_eval_033,3072,2048,2048,bf16,NVIDIA GeForce RTX 4060,c09,128,64,64,8,3,8,0.0,730.002,795.6479787826538,875.7542413473127,32.388448740142536,3,3,3,3072x2048x2048,0,
2026-03-02T09:57:26.248192+00:00,A,training_style,eval,training_style_eval_034,1536,1024,512,bf16,NVIDIA GeForce RTX 4060,c06,64,128,32,4,3,8,0.0,0.0,84.78399738669395,146.47295743227005,18.996659577798702,3,3,2,1536x1024x512,0,
2026-03-02T09:57:26.660035+00:00,A,training_style,eval,training_style_eval_035,4096,4096,4096,bf16,NVIDIA GeForce RTX 4060,c07,128,128,32,8,3,8,0.0,0.0,4225.856065750122,4281.384897232056,32.52333996558009,3,3,3,4096x4096x4096,0,
2026-03-02T09:57:28.601054+00:00,A,training_style,eval,training_style_eval_036,2048,4096,4096,bf16,NVIDIA GeForce RTX 4060,c10,64,128,64,8,3,8,0.0,1940.957,2091.7279720306396,2257.427203655243,32.852970202089644,3,3,3,2048x4096x4096,0,
2026-03-02T09:57:28.884293+00:00,A,training_style,eval,training_style_eval_037,4096,2048,512,bf16,NVIDIA GeForce RTX 4060,c10,64,128,64,8,3,8,0.0,283.186,297.9840040206909,369.33248430490477,28.82683122616054,3,3,2,4096x2048x512,0,
2026-03-02T09:57:28.910848+00:00,A,training_style,eval,training_style_eval_038,2048,1536,512,bf16,NVIDIA GeForce RTX 4060,c03,64,64,32,4,2,8,0.0,0.0,147.39200472831726,251.86655893921852,21.854818230728167,3,3,2,2048x1536x512,0,
2026-03-02T09:57:29.004392+00:00,A,training_style,eval,training_style_eval_039,3072,3072,1536,bf16,NVIDIA GeForce RTX 4060,c09,128,64,64,8,3,8,0.0,0.0,899.9679982662201,1027.6556956768036,32.21340014739518,3,3,3,3072x3072x1536,0,
2026-03-02T09:57:29.114569+00:00,A,training_style,eval,training_style_eval_040,1536,1536,512,bf16,NVIDIA GeForce RTX 4060,c06,64,128,32,4,3,8,0.0,110.124,103.32799702882767,229.53247860074038,23.381069733946145,3,3,2,1536x1536x512,0,
2026-03-02T09:57:30.190350+00:00,A,training_style,eval,training_style_eval_041,3072,3072,2048,bf16,NVIDIA GeForce RTX 4060,c06,64,128,32,4,3,8,0.0,1075.731,1200.0319957733154,1283.46111536026,32.211395862899835,3,3,3,3072x3072x2048,0,
2026-03-02T09:57:31.301143+00:00,A,training_style,eval,training_style_eval_042,3072,4096,1536,bf16,NVIDIA GeForce RTX 4060,c06,64,128,32,4,3,8,0.0,1110.742,1178.592026233673,1327.7385866641998,32.79735888552172,3,3,3,3072x4096x1536,0,
2026-03-02T09:57:31.383125+00:00,A,training_style,eval,training_style_eval_043,2048,3072,1536,bf16,NVIDIA GeForce RTX 4060,c06,64,128,32,4,3,8,0.0,0.0,612.3520135879517,760.8342468738556,31.562487593949957,3,3,3,2048x3072x1536,0,
2026-03-02T09:57:31.499389+00:00,A,training_style,eval,training_style_eval_044,512,512,4096,bf16,NVIDIA GeForce RTX 4060,c04,64,64,64,4,3,8,0.0,116.201,103.42399775981903,204.12416189908976,20.763881637867925,2,2,3,512x512x4096,0,
2026-03-02T09:57:31.908012+00:00,A,training_style,eval,training_style_eval_045,2048,1024,3072,bf16,NVIDIA GeForce RTX 4060,c06,64,128,32,4,3,8,0.0,408.576,423.92000555992126,455.74143797159195,30.39465398897933,3,3,3,2048x1024x3072,0,
2026-03-02T09:57:34.757711+00:00,A,training_style,eval,training_style_eval_046,4096,3072,4096,bf16,NVIDIA GeForce RTX 4060,c07,128,128,32,8,3,8,0.0,2849.643,3132.223963737488,3257.889552116394,32.90927350578149,3,3,3,4096x3072x4096,0,
2026-03-02T09:57:35.057194+00:00,A,training_style,eval,training_style_eval_047,1536,3072,1024,bf16,NVIDIA GeForce RTX 4060,c03,64,64,32,4,2,8,0.0,299.415,324.6079981327057,386.59456074237806,29.770296701220875,3,3,3,1536x3072x1024,0,
2026-03-02T09:57:35.168782+00:00,A,training_style,eval,training_style_eval_048,512,512,3072,bf16,NVIDIA GeForce RTX 4060,c04,64,64,64,4,3,8,0.0,111.531,86.06399968266487,153.73951926827425,18.714128345634066,2,2,3,512x512x3072,0,
2026-03-02T09:57:35.351308+00:00,A,training_style,eval,training_style_eval_049,512,1024,4096,bf16,NVIDIA GeForce RTX 4060,c06,64,128,32,4,3,8,0.0,182.478,172.73599654436111,268.0003207921981,24.86434432846769,2,3,3,512x1024x4096,0,
2026-03-02T09:57:35.561895+00:00,A,training_style,eval,training_style_eval_050,3072,2048,512,bf16,NVIDIA GeForce RTX 4060,c03,64,64,32,4,2,8,0.0,210.538,229.0559932589531,302.09632158279396,28.12609638516055,3,3,2,3072x2048x512,0,
2026-03-02T09:57:35.577764+00:00,A,training_style,eval,training_style_eval_051,512,512,1024,bf16,NVIDIA GeForce RTX 4060,c11,32,128,32,4,2,8,0.0,0.0,54.27199974656105,117.52832300961013,9.892226461288978,2,2,3,512x512x1024,0,
2026-03-02T09:57:35.627244+00:00,A,training_style,eval,training_style_eval_052,1536,2048,1536,bf16,NVIDIA GeForce RTX 4060,c06,64,128,32,4,3,8,0.0,0.0,316.8319910764694,395.46879947185516,30.50094904610693,3,3,3,1536x2048x1536,0,
2026-03-02T09:57:35.727944+00:00,A,training_style,eval,training_style_eval_053,1536,3072,3072,bf16,NVIDIA GeForce RTX 4060,c06,64,128,32,4,3,8,0.0,0.0,880.623996257782,1051.320333480835,32.92100757099237,3,3,3,1536x3072x3072,0,
2026-03-02T09:57:36.119715+00:00,A,training_style,eval,training_style_eval_054,4096,3072,512,bf16,NVIDIA GeForce RTX 4060,c06,64,128,32,4,3,8,0.0,391.715,424.9599874019623,467.5603112578392,30.32027077836953,3,3,2,4096x3072x512,0,
2026-03-02T09:57:36.142864+00:00,A,training_style,eval,training_style_eval_055,1024,1024,1024,bf16,NVIDIA GeForce RTX 4060,c04,64,64,64,4,3,8,0.0,0.0,99.29599985480309,180.0019197165966,21.62709123368703,3,3,3,1024x1024x1024,0,
2026-03-02T09:57:36.166753+00:00,A,training_style,eval,training_style_eval_056,512,1024,3072,bf16,NVIDIA GeForce RTX 4060,c06,64,128,32,4,3,8,0.0,0.0,134.46399569511414,144.4044841825962,23.95604455562855,2,3,3,512x1024x3072,0,
2026-03-02T09:57:36.185314+00:00,A,training_style,eval,training_style_eval_057,1024,1536,1024,bf16,NVIDIA GeForce RTX 4060,c06,64,128,32,4,3,8,0.0,0.0,143.8079997897148,255.04768803715695,22.399487349175853,3,3,3,1024x1536x1024,0,
2026-03-02T09:57:36.303149+00:00,A,training_style,eval,training_style_eval_058,4096,2048,2048,bf16,NVIDIA GeForce RTX 4060,c06,64,128,32,4,3,8,0.0,0.0,1040.8639907836914,1080.265622138977,33.01078591654394,3,3,3,4096x2048x2048,0,
2026-03-02T09:57:36.514571+00:00,A,training_style,eval,training_style_eval_059,2048,3072,512,bf16,NVIDIA GeForce RTX 4060,c06,64,128,32,4,3,8,0.0,211.362,229.34399545192719,255.12095198035234,28.090776613989892,3,3,2,2048x3072x512,0,
2026-03-02T09:57:36.816532+00:00,A,training_style,eval,training_style_eval_060,3072,3072,512,bf16,NVIDIA GeForce RTX 4060,c06,64,128,32,4,3,8,0.0,301.911,329.74399626255035,465.9679925441742,29.306603078545642,3,3,2,3072x3072x512,0,
2026-03-02T09:57:37.325812+00:00,A,training_style,eval,training_style_eval_061,2048,2048,2048,bf16,NVIDIA GeForce RTX 4060,c09,128,64,64,8,3,8,0.0,509.228,562.0479881763458,639.2831778526306,30.566552225803388,3,3,3,2048x2048x2048,0,
2026-03-02T09:57:37.432015+00:00,A,training_style,eval,training_style_eval_062,1024,2048,512,bf16,NVIDIA GeForce RTX 4060,c06,64,128,32,4,3,8,0.0,106.153,96.25600278377533,123.25696043670169,22.310127014353586,3,3,2,1024x2048x512,0,
2026-03-02T09:57:38.274780+00:00,A,training_style,eval,training_style_eval_063,3072,1536,3072,bf16,NVIDIA GeForce RTX 4060,c06,64,128,32,4,3,8,0.0,842.719,873.4719753265381,950.2617496252059,33.19056600203116,3,3,3,3072x1536x3072,0,
2026-03-02T09:57:38.291093+00:00,A,adversarial,tune,adversarial_tune_000,1,1024,1024,bf16,NVIDIA GeForce RTX 4060,c00,32,32,32,2,2,8,0.0,0.0,21.85599971562624,392.0486527681345,0.09595314912548306,0,3,3,1x1024x1024,0,
2026-03-02T09:57:38.313687+00:00,A,adversarial,tune,adversarial_tune_001,1,1024,4096,bf16,NVIDIA GeForce RTX 4060,c00,32,32,32,2,2,8,0.0,0.0,59.39200147986412,65.5504013225436,0.14124137579104856,0,3,3,1x1024x4096,0,
2026-03-02T09:57:38.337564+00:00,A,adversarial,tune,adversarial_tune_002,1,4096,1024,bf16,NVIDIA GeForce RTX 4060,c11,32,128,32,4,2,8,0.0,0.0,76.688002794981,206.2767982482909,0.1093861842044087,0,3,3,1x4096x1024,0,
2026-03-02T09:57:38.434343+00:00,A,adversarial,tune,adversarial_tune_003,1,4096,4096,bf16,NVIDIA GeForce RTX 4060,c02,32,64,32,2,2,8,0.0,0.0,160.62399744987488,213.77088174223894,0.20890049141300424,0,3,3,1x4096x4096,0,
2026-03-02T09:57:38.477166+00:00,A,adversarial,tune,adversarial_tune_004,1,8192,1024,bf16,NVIDIA GeForce RTX 4060,c11,32,128,32,4,2,8,0.0,0.0,51.19999870657921,100.62848214060054,0.32768000827789323,0,3,3,1x8192x1024,0,
2026-03-02T09:57:38.642313+00:00,A,adversarial,tune,adversarial_tune_005,1,8192,4096,bf16,NVIDIA GeForce RTX 4060,c11,32,128,32,4,2,8,0.0,0.0,294.92799937725067,306.1808031797409,0.22754321102676714,0,3,3,1x8192x4096,0,
2026-03-02T09:57:38.653622+00:00,A,adversarial,tune,adversarial_tune_006,2,1024,1024,bf16,NVIDIA GeForce RTX 4060,c04,64,64,64,4,3,8,0.0,0.0,36.848001182079315,196.3532835245132,0.11382717828504253,0,3,3,2x1024x1024,0,
2026-03-02T09:57:38.672591+00:00,A,adversarial,tune,adversarial_tune_007,2,1024,4096,bf16,NVIDIA GeForce RTX 4060,c04,64,64,64,4,3,8,0.0,0.0,81.7280001938343,129.6038376539945,0.20528112715604782,0,3,3,2x1024x4096,0,
2026-03-02T09:57:38.743234+00:00,A,adversarial,tune,adversarial_tune_008,2,4096,1024,bf16,NVIDIA GeForce RTX 4060,c11,32,128,32,4,2,8,0.0,70.599,40.95999896526337,45.578240528702736,0.4096000103473666,0,3,3,2x4096x1024,0,
2026-03-02T09:57:38.827719+00:00,A,adversarial,tune,adversarial_tune_009,2,4096,4096,bf16,NVIDIA GeForce RTX 4060,c11,32,128,32,4,2,8,0.0,0.0,161.48800402879715,265.13823971152294,0.4155656291846476,0,3,3,2x4096x4096,0,
2026-03-02T09:57:38.868535+00:00,A,adversarial,tune,adversarial_tune_010,2,8192,1024,bf16,NVIDIA GeForce RTX 4060,c11,32,128,32,4,2,8,0.0,0.0,48.46400022506714,178.72896075248707,0.6923578706704563,0,3,3,2x8192x1024,0,
2026-03-02T09:57:39.030006+00:00,A,adversarial,tune,adversarial_tune_011,2,8192,4096,bf16,NVIDIA GeForce RTX 4060,c11,32,128,32,4,2,8,0.0,0.0,296.9599962234497,513.2960209250444,0.4519724195410041,0,3,3,2x8192x4096,0,
2026-03-02T09:57:39.042916+00:00,A,adversarial,tune,adversarial_tune_012,4,1024,1024,bf16,NVIDIA GeForce RTX 4060,c04,64,64,64,4,3,8,0.0,0.0,66.51199981570244,172.21631854772565,0.1261217227454283,0,3,3,4x1024x1024,0,
2026-03-02T09:57:39.063362+00:00,A,adversarial,tune,adversarial_tune_013,4,1024,4096,bf16,NVIDIA GeForce RTX 4060,c04,64,64,64,4,3,8,0.0,0.0,63.4239986538887,121.82783924043176,0.5290494562335938,0,3,3,4x1024x4096,0,
2026-03-02T09:57:39.141522+00:00,A,adversarial,tune,adversarial_tune_014,4,4096,1024,bf16,NVIDIA GeForce RTX 4060,c11,32,128,32,4,2,8,0.0,78.112,41.98399931192398,64.82399933040135,0.7992195252935353,0,3,3,4x4096x1024,0,
2026-03-02T09:57:39.357845+00:00,A,adversarial,tune,adversarial_tune_015,4,4096,4096,bf16,NVIDIA GeForce RTX 4060,c03,64,64,32,4,2,8,0.0,216.277,161.0720008611679,175.96992507576937,0.8332778340270679,0,3,3,4x4096x4096,0,
2026-03-02T09:57:39.466286+00:00,A,adversarial,tune,adversarial_tune_016,4,8192,1024,bf16,NVIDIA GeForce RTX 4060,c00,32,32,32,2,2,8,0.0,108.392,48.928000032901764,301.29695683717694,1.371584040935098,0,3,3,4x8192x1024,0,
2026-03-02T09:57:39.628108+00:00,A,adversarial,tune,adversarial_tune_017,4,8192,4096,bf16,NVIDIA GeForce RTX 4060,c11,32,128,32,4,2,8,0.0,0.0,294.46399211883545,369.1337579488754,0.9116070663460569,0,3,3,4x8192x4096,0,
2026-03-02T09:57:39.682322+00:00,A,adversarial,tune,adversarial_tune_018,8,1024,1024,bf16,NVIDIA GeForce RTX 4060,c04,64,64,64,4,3,8,0.0,54.161,36.86400130391121,44.98175963759422,0.45511109501344243,0,3,3,8x1024x1024,0,
2026-03-02T09:57:39.769779+00:00,A,adversarial,tune,adversarial_tune_019,8,1024,4096,bf16,NVIDIA GeForce RTX 4060,c00,32,32,32,2,2,8,0.0,87.415,57.312000542879105,157.72672474384296,1.1709391290536293,0,3,3,8x1024x4096,0,
2026-03-02T09:57:39.797294+00:00,A,adversarial,tune,adversarial_tune_020,8,4096,1024,bf16,NVIDIA GeForce RTX 4060,c00,32,32,32,2,2,8,0.0,0.0,47.61600121855736,174.4697618484497,1.40937630801819,0,3,3,8x4096x1024,0,
2026-03-02T09:57:39.882467+00:00,A,adversarial,tune,adversarial_tune_021,8,4096,4096,bf16,NVIDIA GeForce RTX 4060,c11,32,128,32,4,2,8,0.0,0.0,159.743994474411,225.25343760848045,1.6804103145361124,0,3,3,8x4096x4096,0,
2026-03-02T09:57:39.922080+00:00,A,adversarial,tune,adversarial_tune_022,8,8192,1024,bf16,NVIDIA GeForce RTX 4060,c11,32,128,32,4,2,8,0.0,0.0,48.128001391887665,203.24351564049692,2.7887658767941983,0,3,3,8x8192x1024,0,
2026-03-02T09:57:40.081211+00:00,A,adversarial,tune,adversarial_tune_023,8,8192,4096,bf16,NVIDIA GeForce RTX 4060,c11,32,128,32,4,2,8,0.0,0.0,294.9120104312897,425.85855424404144,1.8204443800537697,0,3,3,8x8192x4096,0,
2026-03-02T09:57:40.091214+00:00,A,adversarial,tune,adversarial_tune_024,16,1024,1024,bf16,NVIDIA GeForce RTX 4060,c04,64,64,64,4,3,8,0.0,0.0,36.22400015592575,162.10751488804812,0.9263038829385316,0,3,3,16x1024x1024,0,
2026-03-02T09:57:40.110941+00:00,A,adversarial,tune,adversarial_tune_025,16,1024,4096,bf16,NVIDIA GeForce RTX 4060,c00,32,32,32,2,2,8,0.0,0.0,66.49599969387054,180.25471746921528,2.0184331180507376,0,3,3,16x1024x4096,0,
2026-03-02T09:57:40.182324+00:00,A,adversarial,tune,adversarial_tune_026,16,4096,1024,bf16,NVIDIA GeForce RTX 4060,c11,32,128,32,4,2,8,0.0,71.325,41.85599833726883,48.036160022020326,3.2066545616352373,0,3,3,16x4096x1024,0,
2026-03-02T09:57:40.401699+00:00,A,adversarial,tune,adversarial_tune_027,16,4096,4096,bf16,NVIDIA GeForce RTX 4060,c02,32,64,32,2,2,8,0.0,219.329,161.72800213098526,181.49535939097404,3.31959156686535,0,3,3,16x4096x4096,0,
2026-03-02T09:57:40.449164+00:00,A,adversarial,tune,adversarial_tune_028,16,8192,1024,bf16,NVIDIA GeForce RTX 4060,c11,32,128,32,4,2,8,0.0,0.0,84.83199775218964,177.99840688705436,3.1643184542718292,0,3,3,16x8192x1024,0,
2026-03-02T09:57:40.621061+00:00,A,adversarial,tune,adversarial_tune_029,16,8192,4096,bf16,NVIDIA GeForce RTX 4060,c11,32,128,32,4,2,8,0.0,0.0,297.0400005578995,312.9241579771042,3.6148054874202193,0,3,3,16x8192x4096,0,
2026-03-02T09:57:40.676995+00:00,A,adversarial,tune,adversarial_tune_030,32,1024,1024,bf16,NVIDIA GeForce RTX 4060,c04,64,64,64,4,3,8,0.0,55.877,37.87200152873993,48.47072020173073,1.7719914789576963,0,3,3,32x1024x1024,0,
2026-03-02T09:57:40.696312+00:00,A,adversarial,tune,adversarial_tune_031,32,1024,4096,bf16,NVIDIA GeForce RTX 4060,c04,64,64,64,4,3,8,0.0,0.0,61.184000223875046,83.52895893156528,4.387347264281224,0,3,3,32x1024x4096,0,
2026-03-02T09:57:40.705710+00:00,A,adversarial,eval,adversarial_eval_000,1,1024,1024,bf16,NVIDIA GeForce RTX 4060,c00,32,32,32,2,2,8,0.0,0.0,53.120000287890434,122.51007601618753,0.039479517858325014,0,3,3,1x1024x1024,0,
2026-03-02T09:57:40.728986+00:00,A,adversarial,eval,adversarial_eval_001,1,1024,4096,bf16,NVIDIA GeForce RTX 4060,c00,32,32,32,2,2,8,0.0,0.0,77.7600035071373,179.2396806180477,0.10787818443488162,0,3,3,1x1024x4096,0,
2026-03-02T09:57:40.748142+00:00,A,adversarial,eval,adversarial_eval_002,1,4096,1024,bf16,NVIDIA GeForce RTX 4060,c11,32,128,32,4,2,8,0.0,0.0,48.08000102639198,118.48703905940052,0.17447187647511364,0,3,3,1x4096x1024,0,
2026-03-02T09:57:40.832103+00:00,A,adversarial,eval,adversarial_eval_003,1,4096,4096,bf16,NVIDIA GeForce RTX 4060,c02,32,64,32,2,2,8,0.0,0.0,160.76800227165222,196.95359840989101,0.2087133728470579,0,3,3,1x4096x4096,0,
2026-03-02T09:57:40.871796+00:00,A,adversarial,eval,adversarial_eval_004,1,8192,1024,bf16,NVIDIA GeForce RTX 4060,c11,32,128,32,4,2,8,0.0,0.0,54.27199974656105,149.9123208224773,0.30913207691528055,0,3,3,1x8192x1024,0,
2026-03-02T09:57:41.033730+00:00,A,adversarial,eval,adversarial_eval_005,1,8192,4096,bf16,NVIDIA GeForce RTX 4060,c11,32,128,32,4,2,8,0.0,0.0,296.88000679016113,344.77535724639887,0.22604709803659317,0,3,3,1x8192x4096,0,
2026-03-02T09:57:41.046325+00:00,A,adversarial,eval,adversarial_eval_006,2,1024,1024,bf16,NVIDIA GeForce RTX 4060,c04,64,64,64,4,3,8,0.0,0.0,38.72000053524971,46.6188808530569,0.10832396544472182,0,3,3,2x1024x1024,0,
2026-03-02T09:57:41.067723+00:00,A,adversarial,eval,adversarial_eval_007,2,1024,4096,bf16,NVIDIA GeForce RTX 4060,c04,64,64,64,4,3,8,0.0,0.0,59.1839998960495,65.58175973594187,0.2834755344259838,0,3,3,2x1024x4096,0,
2026-03-02T09:57:41.088559+00:00,A,adversarial,eval,adversarial_eval_008,2,4096,1024,bf16,NVIDIA GeForce RTX 4060,c11,32,128,32,4,2,8,0.0,0.0,48.06400090456009,59.41248148679733,0.34905991353724897,0,3,3,2x4096x1024,0,
2026-03-02T09:57:41.174732+00:00,A,adversarial,eval,adversarial_eval_009,2,4096,4096,bf16,NVIDIA GeForce RTX 4060,c11,32,128,32,4,2,8,0.0,0.0,166.79999977350235,235.37888005375842,0.4023313194911697,0,3,3,2x4096x4096,0,
2026-03-02T09:57:41.218481+00:00,A,adversarial,eval,adversarial_eval_010,2,8192,1024,bf16,NVIDIA GeForce RTX 4060,c11,32,128,32,4,2,8,0.0,0.0,52.22399905323982,90.07744006812561,0.6425098155695218,0,3,3,2x8192x1024,0,
2026-03-02T09:57:41.381861+00:00,A,adversarial,eval,adversarial_eval_011,2,8192,4096,bf16,NVIDIA GeForce RTX 4060,c11,32,128,32,4,2,8,0.0,0.0,295.80800235271454,360.8918425440788,0.4537325796885032,0,3,3,2x8192x4096,0,
2026-03-02T09:57:41.395516+00:00,A,adversarial,eval,adversarial_eval_012,4,1024,1024,bf16,NVIDIA GeForce RTX 4060,c04,64,64,64,4,3,8,0.0,0.0,61.43999844789505,194.68895867466915,0.13653333678245552,0,3,3,4x1024x1024,0,
2026-03-02T09:57:41.413816+00:00,A,adversarial,eval,adversarial_eval_013,4,1024,4096,bf16,NVIDIA GeForce RTX 4060,c04,64,64,64,4,3,8,0.0,0.0,58.22400003671646,91.2729576230048,0.5762989828737348,0,3,3,4x1024x4096,0,
2026-03-02T09:57:41.432720+00:00,A,adversarial,eval,adversarial_eval_014,4,4096,1024,bf16,NVIDIA GeForce RTX 4060,c11,32,128,32,4,2,8,0.0,0.0,71.00800052285194,228.1177587807178,0.472544385885101,0,3,3,4x4096x1024,0,
2026-03-02T09:57:41.518585+00:00,A,adversarial,eval,adversarial_eval_015,4,4096,4096,bf16,NVIDIA GeForce RTX 4060,c03,64,64,32,4,2,8,0.0,0.0,165.21599888801575,254.8633605241775,0.812377305487064,0,3,3,4x4096x4096,0,
2026-03-02T09:57:41.564434+00:00,A,adversarial,eval,adversarial_eval_016,4,8192,1024,bf16,NVIDIA GeForce RTX 4060,c00,32,32,32,2,2,8,0.0,0.0,54.27199974656105,230.3862439095973,1.2365283076611222,0,3,3,4x8192x1024,0,
2026-03-02T09:57:41.727080+00:00,A,adversarial,eval,adversarial_eval_017,4,8192,4096,bf16,NVIDIA GeForce RTX 4060,c11,32,128,32,4,2,8,0.0,0.0,296.9599962234497,437.7734410762787,0.9039448390820082,0,3,3,4x8192x4096,0,
2026-03-02T09:57:41.737311+00:00,A,adversarial,eval,adversarial_eval_018,8,1024,1024,bf16,NVIDIA GeForce RTX 4060,c04,64,64,64,4,3,8,0.0,0.0,38.52799907326698,177.8342379629612,0.43545515997587914,0,3,3,8x1024x1024,0,
2026-03-02T09:57:41.757735+00:00,A,adversarial,eval,adversarial_eval_019,8,1024,4096,bf16,NVIDIA GeForce RTX 4060,c00,32,32,32,2,2,8,0.0,0.0,85.61599999666214,203.284481614828,0.7838355447885481,0,3,3,8x1024x4096,0,
2026-03-02T09:57:41.775171+00:00,A,adversarial,eval,adversarial_eval_020,8,4096,1024,bf16,NVIDIA GeForce RTX 4060,c00,32,32,32,2,2,8,0.0,0.0,41.98399931192398,118.35551865398881,1.5984390505870707,0,3,3,8x4096x1024,0,
2026-03-02T09:57:41.858258+00:00,A,adversarial,eval,adversarial_eval_021,8,4096,4096,bf16,NVIDIA GeForce RTX 4060,c11,32,128,32,4,2,8,0.0,0.0,161.79199516773224,227.01439917087552,1.6591392900601099,0,3,3,8x4096x4096,0,
2026-03-02T09:57:41.898184+00:00,A,adversarial,eval,adversarial_eval_022,8,8192,1024,bf16,NVIDIA GeForce RTX 4060,c11,32,128,32,4,2,8,0.0,0.0,54.99200150370598,118.16000126302221,2.440677268146985,0,3,3,8x8192x1024,0,
2026-03-02T09:57:42.057764+00:00,A,adversarial,eval,adversarial_eval_023,8,8192,4096,bf16,NVIDIA GeForce RTX 4060,c11,32,128,32,4,2,8,0.0,0.0,294.8160022497177,343.8217622041701,1.8210372161048936,0,3,3,8x8192x4096,0,
2026-03-02T09:57:42.068794+00:00,A,adversarial,eval,adversarial_eval_024,16,1024,1024,bf16,NVIDIA GeForce RTX 4060,c04,64,64,64,4,3,8,0.0,0.0,69.63200122117996,236.94944918155642,0.4818823444901042,0,3,3,16x1024x1024,0,
2026-03-02T09:57:42.089813+00:00,A,adversarial,eval,adversarial_eval_025,16,1024,4096,bf16,NVIDIA GeForce RTX 4060,c00,32,32,32,2,2,8,0.0,0.0,62.95999884605408,105.72736196219915,2.131793685831872,0,3,3,16x1024x4096,0,
2026-03-02T09:57:42.108959+00:00,A,adversarial,eval,adversarial_eval_026,16,4096,1024,bf16,NVIDIA GeForce RTX 4060,c11,32,128,32,4,2,8,0.0,0.0,45.37600092589855,207.12831959128366,2.957901209037455,0,3,3,16x4096x1024,0,
2026-03-02T09:57:42.207316+00:00,A,adversarial,eval,adversarial_eval_027,16,4096,4096,bf16,NVIDIA GeForce RTX 4060,c02,32,64,32,2,2,8,0.0,0.0,164.73600268363953,168.45824122428894,3.2589774138869427,0,3,3,16x4096x4096,0,
2026-03-02T09:57:42.249232+00:00,A,adversarial,eval,adversarial_eval_028,16,8192,1024,bf16,NVIDIA GeForce RTX 4060,c11,32,128,32,4,2,8,0.0,0.0,52.22399905323982,674.580777585504,5.140078524556174,0,3,3,16x8192x1024,0,
2026-03-02T09:57:42.424309+00:00,A,adversarial,eval,adversarial_eval_029,16,8192,4096,bf16,NVIDIA GeForce RTX 4060,c11,32,128,32,4,2,8,0.0,0.0,301.05599761009216,411.5078365802765,3.566585062326642,0,3,3,16x8192x4096,0,
2026-03-02T09:57:42.433238+00:00,A,adversarial,eval,adversarial_eval_030,32,1024,1024,bf16,NVIDIA GeForce RTX 4060,c04,64,64,64,4,3,8,0.0,0.0,43.376000598073006,123.84480364620683,1.547142730419949,0,3,3,32x1024x1024,0,
2026-03-02T09:57:42.452948+00:00,A,adversarial,eval,adversarial_eval_031,32,1024,4096,bf16,NVIDIA GeForce RTX 4060,c04,64,64,64,4,3,8,0.0,0.0,78.84799689054489,123.52512456476686,3.4044676667263514,0,3,3,32x1024x4096,0,
2026-03-02T09:57:42.539732+00:00,A,adversarial,eval,adversarial_eval_032,32,4096,1024,bf16,NVIDIA GeForce RTX 4060,c02,32,64,32,2,2,8,0.0,86.737,53.119998425245285,61.41983967274426,5.0533784630615886,0,3,3,32x4096x1024,0,
2026-03-02T09:57:42.817065+00:00,A,adversarial,eval,adversarial_eval_033,32,4096,4096,bf16,NVIDIA GeForce RTX 4060,c11,32,128,32,4,2,8,0.0,277.288,165.8879965543747,176.67072385549545,6.472691492467626,0,3,3,32x4096x4096,0,
2026-03-02T09:57:42.934382+00:00,A,adversarial,eval,adversarial_eval_034,32,8192,1024,bf16,NVIDIA GeForce RTX 4060,c11,32,128,32,4,2,8,0.0,117.271,53.247999399900436,76.33919969201088,10.08246165208986,0,3,3,32x8192x1024,0,
2026-03-02T09:57:43.093185+00:00,A,adversarial,eval,adversarial_eval_035,32,8192,4096,bf16,NVIDIA GeForce RTX 4060,c11,32,128,32,4,2,8,0.0,0.0,304.064005613327,348.9280027151108,7.062603952968106,0,3,3,32x8192x4096,0,
2026-03-02T09:57:45.402014+00:00,A,adversarial,eval,adversarial_eval_036,1024,1,512,bf16,NVIDIA GeForce RTX 4060,c00,32,32,32,2,2,8,0.0,2308.774,35.840000957250595,67.5148803740739,0.029257142075713817,3,0,2,1024x1x512,0,
2026-03-02T09:57:45.631510+00:00,A,adversarial,eval,adversarial_eval_037,1024,1,2048,bf16,NVIDIA GeForce RTX 4060,c00,32,32,32,2,2,8,0.0,229.452,155.13599663972855,325.92799693346,0.02703630421597386,3,0,3,1024x1x2048,0,
2026-03-02T09:57:45.704183+00:00,A,adversarial,eval,adversarial_eval_038,2048,1,512,bf16,NVIDIA GeForce RTX 4060,c09,128,64,64,8,3,8,0.0,72.629,38.76800090074539,53.358718678355174,0.05409492239151485,3,0,2,2048x1x512,0,
2026-03-02T09:57:45.800154+00:00,A,adversarial,eval,adversarial_eval_039,2048,1,2048,bf16,NVIDIA GeForce RTX 4060,c00,32,32,32,2,2,8,0.0,95.921,58.36800113320351,352.8601554036134,0.14371929545533155,3,0,3,2048x1x2048,0,
2026-03-02T09:57:45.860449+00:00,A,adversarial,eval,adversarial_eval_040,4096,1,512,bf16,NVIDIA GeForce RTX 4060,c00,32,32,32,2,2,8,0.0,60.249,37.88800165057182,114.2067214101553,0.11070269787999489,3,0,2,4096x1x512,0,
2026-03-02T09:57:46.006975+00:00,A,adversarial,eval,adversarial_eval_041,4096,1,2048,bf16,NVIDIA GeForce RTX 4060,c00,32,32,32,2,2,8,0.0,146.481,67.47199967503548,105.9324812889098,0.2486544949135032,3,0,3,4096x1x2048,0,
2026-03-02T09:57:48.498207+00:00,A,adversarial,eval,adversarial_eval_042,1024,2,512,bf16,NVIDIA GeForce RTX 4060,c03,64,64,32,4,2,8,0.0,2491.189,40.800001472234726,67.65887901186937,0.05140078245897017,3,0,2,1024x2x512,0,
2026-03-02T09:57:48.738830+00:00,A,adversarial,eval,adversarial_eval_043,1024,2,2048,bf16,NVIDIA GeForce RTX 4060,c00,32,32,32,2,2,8,0.0,240.582,203.75999808311462,354.4268807768822,0.04116906202844706,3,0,3,1024x2x2048,0,
2026-03-02T09:57:48.859619+00:00,A,adversarial,eval,adversarial_eval_044,2048,2,512,bf16,NVIDIA GeForce RTX 4060,c01,64,32,32,2,2,8,0.0,120.743,91.11999720335007,127.80544221401209,0.04603055452953629,3,0,2,2048x2x512,0,
2026-03-02T09:57:49.058020+00:00,A,adversarial,eval,adversarial_eval_045,2048,2,2048,bf16,NVIDIA GeForce RTX 4060,c00,32,32,32,2,2,8,0.0,198.354,128.00000607967377,245.82144126296043,0.13107199377441436,3,0,3,2048x2x2048,0,
2026-03-02T09:57:49.147308+00:00,A,adversarial,eval,adversarial_eval_046,4096,2,512,bf16,NVIDIA GeForce RTX 4060,c00,32,32,32,2,2,8,0.0,89.244,54.00000140070915,149.14560198783872,0.15534458856310024,3,0,2,4096x2x512,0,
2026-03-02T09:57:49.356315+00:00,A,adversarial,eval,adversarial_eval_047,4096,2,2048,bf16,NVIDIA GeForce RTX 4060,c00,32,32,32,2,2,8,0.0,208.96,109.56799983978271,215.33696189522726,0.30624299110201353,3,0,3,4096x2x2048,0,
2026-03-02T09:57:49.426479+00:00,A,adversarial,eval,adversarial_eval_048,1024,4,512,bf16,NVIDIA GeForce RTX 4060,c03,64,64,32,4,2,8,0.0,70.117,50.175998359918594,69.16512072086331,0.0835918394670245,3,0,2,1024x4x512,0,
2026-03-02T09:57:49.530204+00:00,A,adversarial,eval,adversarial_eval_049,1024,4,2048,bf16,NVIDIA GeForce RTX 4060,c09,128,64,64,8,3,8,0.0,103.684,83.96799862384796,92.68224157392979,0.19980488132338384,3,0,3,1024x4x2048,0,
2026-03-02T09:57:49.587450+00:00,A,adversarial,eval,adversarial_eval_050,2048,4,512,bf16,NVIDIA GeForce RTX 4060,c03,64,64,32,4,2,8,0.0,57.208,42.95999929308891,82.68800184130663,0.1952655525613451,3,0,2,2048x4x512,0,
2026-03-02T09:57:49.699005+00:00,A,adversarial,eval,adversarial_eval_051,2048,4,2048,bf16,NVIDIA GeForce RTX 4060,c00,32,32,32,2,2,8,0.0,111.517,70.65600156784058,236.43967300653426,0.474898540186747,3,0,3,2048x4x2048,0,
2026-03-02T09:57:49.775937+00:00,A,adversarial,eval,adversarial_eval_052,4096,4,512,bf16,NVIDIA GeForce RTX 4060,c03,64,64,32,4,2,8,0.0,76.889,46.08000069856644,129.03423883020866,0.3640888833693517,3,0,2,4096x4x512,0,
2026-03-02T09:57:49.937425+00:00,A,adversarial,eval,adversarial_eval_053,4096,4,2048,bf16,NVIDIA GeForce RTX 4060,c00,32,32,32,2,2,8,0.0,161.445,80.57600259780884,109.39392343163483,0.8328641510670441,3,0,3,4096x4x2048,0,
2026-03-02T09:57:50.007484+00:00,A,adversarial,eval,adversarial_eval_054,1024,8,512,bf16,NVIDIA GeForce RTX 4060,c03,64,64,32,4,2,8,0.0,70.014,43.007999658584595,102.86304019391534,0.19504762059598826,3,0,2,1024x8x512,0,
2026-03-02T09:57:50.135237+00:00,A,adversarial,eval,adversarial_eval_055,1024,8,2048,bf16,NVIDIA GeForce RTX 4060,c09,128,64,64,8,3,8,0.0,127.714,88.06400001049042,237.28127807378755,0.381023255768565,3,0,3,1024x8x2048,0,
2026-03-02T09:57:50.204767+00:00,A,adversarial,eval,adversarial_eval_056,2048,8,512,bf16,NVIDIA GeForce RTX 4060,c00,32,32,32,2,2,8,0.0,69.487,44.735999777913094,141.78047895431519,0.3750271835499067,3,0,2,2048x8x512,0,
2026-03-02T09:57:50.319448+00:00,A,adversarial,eval,adversarial_eval_057,2048,8,2048,bf16,NVIDIA GeForce RTX 4060,c00,32,32,32,2,2,8,0.0,114.64,71.6640017926693,142.80575841665265,0.9364375742531412,3,0,3,2048x8x2048,0,
2026-03-02T09:57:50.387739+00:00,A,adversarial,eval,adversarial_eval_058,4096,8,512,bf16,NVIDIA GeForce RTX 4060,c03,64,64,32,4,2,8,0.0,68.237,44.36800070106983,57.80512034893036,0.7562755019337825,3,0,2,4096x8x512,0,
2026-03-02T09:57:50.573728+00:00,A,adversarial,eval,adversarial_eval_059,4096,8,2048,bf16,NVIDIA GeForce RTX 4060,c00,32,32,32,2,2,8,0.0,185.946,84.76800099015236,497.1007990837089,1.5833536998895645,3,0,3,4096x8x2048,0,
2026-03-02T09:57:50.720729+00:00,A,adversarial,eval,adversarial_eval_060,64,64,8192,bf16,NVIDIA GeForce RTX 4060,c00,32,32,32,2,2,8,0.0,146.956,108.5439994931221,227.4796813726423,0.6182641538305611,1,1,3,64x64x8192,0,
2026-03-02T09:57:50.848156+00:00,A,adversarial,eval,adversarial_eval_061,128,128,8192,bf16,NVIDIA GeForce RTX 4060,c04,64,64,64,4,3,8,0.0,127.388,83.96799862384796,110.04319965839386,3.1968781011741414,1,1,3,128x128x8192,0,
2026-03-02T09:57:51.120179+00:00,A,adversarial,eval,adversarial_eval_062,2048,128,8192,bf16,NVIDIA GeForce RTX 4060,c04,64,64,64,4,3,8,0.0,271.979,183.23199450969696,205.82400262355804,23.440050999241308,3,1,3,2048x128x8192,0,
2026-03-02T09:57:51.388408+00:00,A,adversarial,eval,adversarial_eval_063,128,2048,8192,bf16,NVIDIA GeForce RTX 4060,c04,64,64,64,4,3,8,0.0,268.186,185.15200167894363,190.96192076802254,23.1969800869209,1,3,3,128x2048x8192,0,
2026-03-02T09:57:55.689983+00:00,U,uniform,tune,uniform_tune_000,1536,512,1024,bf16,NVIDIA GeForce RTX 4060,c03,64,64,32,4,2,8,0.0,3055.207,95.05600109696388,146.2963224947452,16.943830136059063,3,2,3,fixed_c03,0,fixed_static_cfg;ref_shape=2048x2048x2048;pick=
2026-03-02T09:57:55.737521+00:00,U,uniform,tune,uniform_tune_001,1536,1536,2048,bf16,NVIDIA GeForce RTX 4060,c03,64,64,32,4,2,8,0.0,0.0,339.4559919834137,516.4617615938187,28.46812736913532,3,3,3,fixed_c03,0,fixed_static_cfg;ref_shape=2048x2048x2048;pick=
2026-03-02T09:57:55.759348+00:00,U,uniform,tune,uniform_tune_002,384,2048,1536,bf16,NVIDIA GeForce RTX 4060,c03,64,64,32,4,2,8,0.0,0.0,127.96799838542938,205.8287987112999,18.879088010140194,2,3,3,fixed_c03,0,fixed_static_cfg;ref_shape=2048x2048x2048;pick=
2026-03-02T09:57:55.781336+00:00,U,uniform,tune,uniform_tune_003,1536,64,3072,bf16,NVIDIA GeForce RTX 4060,c03,64,64,32,4,2,8,0.0,0.0,59.1839998960495,124.70080047845832,10.205119239335415,3,1,3,fixed_c03,0,fixed_static_cfg;ref_shape=2048x2048x2048;pick=
2026-03-02T09:57:55.792803+00:00,U,uniform,tune,uniform_tune_004,768,128,2048,bf16,NVIDIA GeForce RTX 4060,c03,64,64,32,4,2,8,0.0,0.0,60.416001826524734,185.90175941586483,6.664677764612043,3,1,3,fixed_c03,0,fixed_static_cfg;ref_shape=2048x2048x2048;pick=
2026-03-02T09:57:55.809414+00:00,U,uniform,tune,uniform_tune_005,512,128,4096,bf16,NVIDIA GeForce RTX 4060,c03,64,64,32,4,2,8,0.0,0.0,83.96799862384796,191.1500813066959,6.393756202348283,2,1,3,fixed_c03,0,fixed_static_cfg;ref_shape=2048x2048x2048;pick=
2026-03-02T09:57:55.905349+00:00,U,uniform,tune,uniform_tune_006,2048,1024,4096,bf16,NVIDIA GeForce RTX 4060,c03,64,64,32,4,2,8,0.0,0.0,639.9999856948853,703.3881741762159,26.843546200000016,3,3,3,fixed_c03,0,fixed_static_cfg;ref_shape=2048x2048x2048;pick=
2026-03-02T09:57:55.913465+00:00,U,uniform,tune,uniform_tune_007,128,768,512,bf16,NVIDIA GeForce RTX 4060,c03,64,64,32,4,2,8,0.0,0.0,38.91199827194214,172.27871626615524,2.5869474833057904,1,3,2,fixed_c03,0,fixed_static_cfg;ref_shape=2048x2048x2048;pick=
2026-03-02T09:57:55.920982+00:00,U,uniform,tune,uniform_tune_008,2048,256,64,bf16,NVIDIA GeForce RTX 4060,c03,64,64,32,4,2,8,0.0,0.0,60.416001826524734,156.27871930599207,1.1107796274353405,3,2,1,fixed_c03,0,fixed_static_cfg;ref_shape=2048x2048x2048;pick=
2026-03-02T09:57:55.933396+00:00,U,uniform,tune,uniform_tune_009,192,768,2048,bf16,NVIDIA GeForce RTX 4060,c03,64,64,32,4,2,8,0.0,0.0,79.8719972372055,146.42368465662003,7.561846415412506,2,3,3,fixed_c03,0,fixed_static_cfg;ref_shape=2048x2048x2048;pick=
2026-03-02T09:57:55.955378+00:00,U,uniform,tune,uniform_tune_010,1024,1024,1536,bf16,NVIDIA GeForce RTX 4060,c03,64,64,32,4,2,8,0.0,0.0,149.9200016260147,261.94943547248835,21.486295604742313,3,3,3,fixed_c03,0,fixed_static_cfg;ref_shape=2048x2048x2048;pick=
2026-03-02T09:57:55.962272+00:00,U,uniform,tune,uniform_tune_011,256,384,768,bf16,NVIDIA GeForce RTX 4060,c03,64,64,32,4,2,8,0.0,0.0,44.36800070106983,147.6326368749141,3.4032397587020213,2,2,3,fixed_c03,0,fixed_static_cfg;ref_shape=2048x2048x2048;pick=
2026-03-02T09:57:55.970423+00:00,U,uniform,tune,uniform_tune_012,64,192,2048,bf16,NVIDIA GeForce RTX 4060,c03,64,64,32,4,2,8,0.0,0.0,63.999999314546585,229.05855923891065,0.7864320084228517,1,2,3,fixed_c03,0,fixed_static_cfg;ref_shape=2048x2048x2048;pick=
2026-03-02T09:57:55.976885+00:00,U,uniform,tune,uniform_tune_013,192,128,512,bf16,NVIDIA GeForce RTX 4060,c03,64,64,32,4,2,8,0.0,0.0,52.2879995405674,95.07840223610394,0.4812925378886453,2,1,2,fixed_c03,0,fixed_static_cfg;ref_shape=2048x2048x2048;pick=
2026-03-02T09:57:55.984899+00:00,U,uniform,tune,uniform_tune_014,128,128,1024,bf16,NVIDIA GeForce RTX 4060,c03,64,64,32,4,2,8,0.0,0.0,68.51200014352798,295.98720669746365,0.4897599242425524,1,1,3,fixed_c03,0,fixed_static_cfg;ref_shape=2048x2048x2048;pick=
2026-03-02T09:57:56.034897+00:00,U,uniform,tune,uniform_tune_015,3072,3072,768,bf16,NVIDIA GeForce RTX 4060,c03,64,64,32,4,2,8,0.0,0.0,539.135992527008,592.9574543237686,26.886564475240164,3,3,3,fixed_c03,0,fixed_static_cfg;ref_shape=2048x2048x2048;pick=
2026-03-02T09:57:56.046611+00:00,U,uniform,tune,uniform_tune_016,256,128,3072,bf16,NVIDIA GeForce RTX 4060,c03,64,64,32,4,2,8,0.0,0.0,70.14400139451027,126.40863828361026,2.8701897239605807,2,1,3,fixed_c03,0,fixed_static_cfg;ref_shape=2048x2048x2048;pick=
2026-03-02T09:57:56.051914+00:00,U,uniform,tune,uniform_tune_017,96,1024,192,bf16,NVIDIA GeForce RTX 4060,c03,64,64,32,4,2,8,0.0,0.0,43.18400099873543,110.42463563382617,0.8741370675937463,1,3,2,fixed_c03,0,fixed_static_cfg;ref_shape=2048x2048x2048;pick=
2026-03-02T09:57:56.056501+00:00,U,uniform,tune,uniform_tune_018,64,64,192,bf16,NVIDIA GeForce RTX 4060,c03,64,64,32,4,2,8,0.0,0.0,41.32799990475178,65.74016109108925,0.03805807209700358,1,1,2,fixed_c03,0,fixed_static_cfg;ref_shape=2048x2048x2048;pick=
2026-03-02T09:57:56.063880+00:00,U,uniform,tune,uniform_tune_019,4096,64,64,bf16,NVIDIA GeForce RTX 4060,c03,64,64,32,4,2,8,0.0,0.0,66.27199798822403,164.17504057288164,0.5063138734094351,3,1,1,fixed_c03,0,fixed_static_cfg;ref_shape=2048x2048x2048;pick=
2026-03-02T09:57:56.135955+00:00,U,uniform,tune,uniform_tune_020,128,4096,3072,bf16,NVIDIA GeForce RTX 4060,c03,64,64,32,4,2,8,0.0,0.0,172.03199863433838,289.06912058591826,18.72457157721487,1,3,3,fixed_c03,0,fixed_static_cfg;ref_shape=2048x2048x2048;pick=
2026-03-02T09:57:56.170532+00:00,U,uniform,tune,uniform_tune_021,192,2048,3072,bf16,NVIDIA GeForce RTX 4060,c03,64,64,32,4,2,8,0.0,0.0,112.70400136709213,212.12799683213228,21.435965668432885,2,3,3,fixed_c03,0,fixed_static_cfg;ref_shape=2048x2048x2048;pick=
2026-03-02T09:57:56.225383+00:00,U,uniform,tune,uniform_tune_022,1536,2048,2048,bf16,NVIDIA GeForce RTX 4060,c03,64,64,32,4,2,8,0.0,0.0,427.0080029964447,507.1219199895858,30.17484870911724,3,3,3,fixed_c03,0,fixed_static_cfg;ref_shape=2048x2048x2048;pick=
2026-03-02T09:57:56.238480+00:00,U,uniform,tune,uniform_tune_023,256,1024,1024,bf16,NVIDIA GeForce RTX 4060,c03,64,64,32,4,2,8,0.0,0.0,55.296000093221664,98.59295740723599,9.709037020668898,2,3,3,fixed_c03,0,fixed_static_cfg;ref_shape=2048x2048x2048;pick=
2026-03-02T09:57:56.247702+00:00,U,uniform,tune,uniform_tune_024,768,128,384,bf16,NVIDIA GeForce RTX 4060,c03,64,64,32,4,2,8,0.0,0.0,71.16800174117088,128.43776151537895,1.0608345064201024,3,1,2,fixed_c03,0,fixed_static_cfg;ref_shape=2048x2048x2048;pick=
2026-03-02T09:57:56.253083+00:00,U,uniform,tune,uniform_tune_025,256,96,384,bf16,NVIDIA GeForce RTX 4060,c03,64,64,32,4,2,8,0.0,0.0,40.831999853253365,65.7952010631561,0.4622445157678494,2,1,2,fixed_c03,0,fixed_static_cfg;ref_shape=2048x2048x2048;pick=
2026-03-02T09:57:56.270272+00:00,U,uniform,tune,uniform_tune_026,96,1024,3072,bf16,NVIDIA GeForce RTX 4060,c03,64,64,32,4,2,8,0.0,0.0,78.84799689054489,158.64831775426856,7.660052250134291,1,3,3,fixed_c03,0,fixed_static_cfg;ref_shape=2048x2048x2048;pick=
2026-03-02T09:57:56.317310+00:00,U,uniform,tune,uniform_tune_027,1536,512,4096,bf16,NVIDIA GeForce RTX 4060,c03,64,64,32,4,2,8,0.0,0.0,241.95200204849243,290.3523290157318,26.62697927462817,3,2,3,fixed_c03,0,fixed_static_cfg;ref_shape=2048x2048x2048;pick=
2026-03-02T09:57:56.321004+00:00,U,uniform,tune,uniform_tune_028,128,64,192,bf16,NVIDIA GeForce RTX 4060,c03,64,64,32,4,2,8,0.0,0.0,31.63199871778488,62.009281739592524,0.09944765198258987,1,1,2,fixed_c03,0,fixed_static_cfg;ref_shape=2048x2048x2048;pick=
2026-03-02T09:57:56.328506+00:00,U,uniform,tune,uniform_tune_029,192,256,1536,bf16,NVIDIA GeForce RTX 4060,c03,64,64,32,4,2,8,0.0,0.0,41.98399931192398,181.84192165732372,3.5964878638209092,2,2,3,fixed_c03,0,fixed_static_cfg;ref_shape=2048x2048x2048;pick=
2026-03-02T09:57:56.398992+00:00,U,uniform,tune,uniform_tune_030,4096,64,3072,bf16,NVIDIA GeForce RTX 4060,c03,64,64,32,4,2,8,0.0,0.0,120.28800323605537,145.86943984031677,13.389637309377429,3,1,3,fixed_c03,0,fixed_static_cfg;ref_shape=2048x2048x2048;pick=
2026-03-02T09:57:56.404277+00:00,U,uniform,tune,uniform_tune_031,384,128,96,bf16,NVIDIA GeForce RTX 4060,c03,64,64,32,4,2,8,0.0,0.0,43.007999658584595,79.62048009037964,0.21942857317048678,2,1,1,fixed_c03,0,fixed_static_cfg;ref_shape=2048x2048x2048;pick=
2026-03-02T09:57:56.428079+00:00,U,uniform,eval,uniform_eval_000,512,4096,768,bf16,NVIDIA GeForce RTX 4060,c03,64,64,32,4,2,8,0.0,0.0,136.57599687576294,207.93023809790597,23.585590042811145,2,3,3,fixed_c03,0,fixed_static_cfg;ref_shape=2048x2048x2048;pick=
2026-03-02T09:57:56.432790+00:00,U,uniform,eval,uniform_eval_001,384,512,64,bf16,NVIDIA GeForce RTX 4060,c03,64,64,32,4,2,8,0.0,0.0,29.69600073993206,98.09440139681085,0.8474482547462914,2,2,1,fixed_c03,0,fixed_static_cfg;ref_shape=2048x2048x2048;pick=
2026-03-02T09:57:56.447451+00:00,U,uniform,eval,uniform_eval_002,256,4096,384,bf16,NVIDIA GeForce RTX 4060,c03,64,64,32,4,2,8,0.0,0.0,64.55999985337257,137.66464486718178,12.473766571081107,2,3,2,fixed_c03,0,fixed_static_cfg;ref_shape=2048x2048x2048;pick=
2026-03-02T09:57:56.454865+00:00,U,uniform,eval,uniform_eval_003,384,768,512,bf16,NVIDIA GeForce RTX 4060,c03,64,64,32,4,2,8,0.0,0.0,44.95999962091446,116.22816182672966,6.716856996135751,2,3,2,fixed_c03,0,fixed_static_cfg;ref_shape=2048x2048x2048;pick=
2026-03-02T09:57:56.462041+00:00,U,uniform,eval,uniform_eval_004,768,1024,96,bf16,NVIDIA GeForce RTX 4060,c03,64,64,32,4,2,8,0.0,0.0,68.01600009202957,146.30880504846567,2.219991528400599,3,3,1,fixed_c03,0,fixed_static_cfg;ref_shape=2048x2048x2048;pick=
2026-03-02T09:57:56.475262+00:00,U,uniform,eval,uniform_eval_005,3072,3072,128,bf16,NVIDIA GeForce RTX 4060,c03,64,64,32,4,2,8,0.0,0.0,139.26400244235992,179.757759720087,17.34776440164375,3,3,1,fixed_c03,0,fixed_static_cfg;ref_shape=2048x2048x2048;pick=
2026-03-02T09:57:56.482653+00:00,U,uniform,eval,uniform_eval_006,256,96,512,bf16,NVIDIA GeForce RTX 4060,c03,64,64,32,4,2,8,0.0,0.0,63.35999816656113,164.75487880408735,0.39718789028124557,2,1,2,fixed_c03,0,fixed_static_cfg;ref_shape=2048x2048x2048;pick=
2026-03-02T09:57:56.919631+00:00,U,uniform,eval,uniform_eval_007,4096,4096,4096,bf16,NVIDIA GeForce RTX 4060,c03,64,64,32,4,2,8,0.0,0.0,4446.2080001831055,4455.004105567932,30.91149884718392,3,3,3,fixed_c03,0,fixed_static_cfg;ref_shape=2048x2048x2048;pick=
2026-03-02T09:57:56.925817+00:00,U,uniform,eval,uniform_eval_008,128,96,64,bf16,NVIDIA GeForce RTX 4060,c03,64,64,32,4,2,8,0.0,0.0,54.336000233888626,279.4393610954282,0.028946996341829113,1,1,1,fixed_c03,0,fixed_static_cfg;ref_shape=2048x2048x2048;pick=
2026-03-02T09:57:56.941989+00:00,U,uniform,eval,uniform_eval_009,3072,384,96,bf16,NVIDIA GeForce RTX 4060,c03,64,64,32,4,2,8,0.0,0.0,42.49599948525429,160.39872556924814,5.329735004317071,3,2,1,fixed_c03,0,fixed_static_cfg;ref_shape=2048x2048x2048;pick=
2026-03-02T09:57:56.967566+00:00,U,uniform,eval,uniform_eval_010,768,768,2048,bf16,NVIDIA GeForce RTX 4060,c03,64,64,32,4,2,8,0.0,0.0,112.01599985361099,184.6681627631187,21.56762522458634,3,3,3,fixed_c03,0,fixed_static_cfg;ref_shape=2048x2048x2048;pick=
2026-03-02T09:57:56.982829+00:00,U,uniform,eval,uniform_eval_011,4096,96,512,bf16,NVIDIA GeForce RTX 4060,c03,64,64,32,4,2,8,0.0,0.0,74.11200180649757,156.60703599452972,5.433036136998508,3,1,2,fixed_c03,0,fixed_static_cfg;ref_shape=2048x2048x2048;pick=
2026-03-02T09:57:56.989485+00:00,U,uniform,eval,uniform_eval_012,384,384,256,bf16,NVIDIA GeForce RTX 4060,c03,64,64,32,4,2,8,0.0,0.0,57.93599970638752,196.1164790391921,1.303118482163281,2,2,2,fixed_c03,0,fixed_static_cfg;ref_shape=2048x2048x2048;pick=
2026-03-02T09:57:57.033856+00:00,U,uniform,eval,uniform_eval_013,4096,2048,768,bf16,NVIDIA GeForce RTX 4060,c03,64,64,32,4,2,8,0.0,0.0,423.8879978656769,590.8787149190902,30.396949082958024,3,3,3,fixed_c03,0,fixed_static_cfg;ref_shape=2048x2048x2048;pick=
2026-03-02T09:57:57.047302+00:00,U,uniform,eval,uniform_eval_014,192,384,3072,bf16,NVIDIA GeForce RTX 4060,c03,64,64,32,4,2,8,0.0,0.0,83.77600088715553,117.31327898800363,5.407095435483496,2,2,3,fixed_c03,0,fixed_static_cfg;ref_shape=2048x2048x2048;pick=
2026-03-02T09:57:57.057061+00:00,U,uniform,eval,uniform_eval_015,128,96,4096,bf16,NVIDIA GeForce RTX 4060,c03,64,64,32,4,2,8,0.0,0.0,73.72800260782242,109.87359993159765,1.3653332850403275,1,1,3,fixed_c03,0,fixed_static_cfg;ref_shape=2048x2048x2048;pick=
2026-03-02T09:57:57.100792+00:00,U,uniform,eval,uniform_eval_016,64,4096,2048,bf16,NVIDIA GeForce RTX 4060,c03,64,64,32,4,2,8,0.0,0.0,69.61600109934807,81.43871776759624,15.423779117500263,1,3,3,fixed_c03,0,fixed_static_cfg;ref_shape=2048x2048x2048;pick=
2026-03-02T09:57:57.110527+00:00,U,uniform,eval,uniform_eval_017,96,128,3072,bf16,NVIDIA GeForce RTX 4060,c03,64,64,32,4,2,8,0.0,0.0,61.43999844789505,116.33663833141324,1.2288000310421,1,1,3,fixed_c03,0,fixed_static_cfg;ref_shape=2048x2048x2048;pick=
2026-03-02T09:57:57.115266+00:00,U,uniform,eval,uniform_eval_018,512,768,64,bf16,NVIDIA GeForce RTX 4060,c03,64,64,32,4,2,8,0.0,0.0,32.75199979543686,80.44352039694783,1.536750375988107,2,3,1,fixed_c03,0,fixed_static_cfg;ref_shape=2048x2048x2048;pick=
2026-03-02T09:57:57.122869+00:00,U,uniform,eval,uniform_eval_019,64,128,384,bf16,NVIDIA GeForce RTX 4060,c03,64,64,32,4,2,8,0.0,0.0,67.4079991877079,106.35039895772928,0.0933339674195117,1,1,2,fixed_c03,0,fixed_static_cfg;ref_shape=2048x2048x2048;pick=
2026-03-02T09:57:57.129331+00:00,U,uniform,eval,uniform_eval_020,512,512,96,bf16,NVIDIA GeForce RTX 4060,c03,64,64,32,4,2,8,0.0,0.0,63.871998339891434,156.58335998654354,0.7880080365133219,2,2,1,fixed_c03,0,fixed_static_cfg;ref_shape=2048x2048x2048;pick=
2026-03-02T09:57:57.153759+00:00,U,uniform,eval,uniform_eval_021,256,3072,1536,bf16,NVIDIA GeForce RTX 4060,c03,64,64,32,4,2,8,0.0,0.0,109.56799983978271,152.94336199760437,22.049495359344974,2,3,3,fixed_c03,0,fixed_static_cfg;ref_shape=2048x2048x2048;pick=
2026-03-02T09:57:57.162375+00:00,U,uniform,eval,uniform_eval_022,2048,96,512,bf16,NVIDIA GeForce RTX 4060,c03,64,64,32,4,2,8,0.0,0.0,61.904000118374825,125.59967815876006,3.2522388151818427,3,1,2,fixed_c03,0,fixed_static_cfg;ref_shape=2048x2048x2048;pick=
2026-03-02T09:57:57.196870+00:00,U,uniform,eval,uniform_eval_023,1536,512,3072,bf16,NVIDIA GeForce RTX 4060,c03,64,64,32,4,2,8,0.0,0.0,183.26399475336075,256.10720083117485,26.36545282395899,3,2,3,fixed_c03,0,fixed_static_cfg;ref_shape=2048x2048x2048;pick=
2026-03-02T09:57:57.200211+00:00,U,uniform,eval,uniform_eval_024,128,192,64,bf16,NVIDIA GeForce RTX 4060,c03,64,64,32,4,2,8,0.0,0.0,28.543999418616295,35.379200801253305,0.11020628027158547,1,2,1,fixed_c03,0,fixed_static_cfg;ref_shape=2048x2048x2048;pick=
2026-03-02T09:57:57.206567+00:00,U,uniform,eval,uniform_eval_025,1536,96,384,bf16,NVIDIA GeForce RTX 4060,c03,64,64,32,4,2,8,0.0,0.0,35.840000957250595,99.01407934725279,3.1597713441770923,3,1,2,fixed_c03,0,fixed_static_cfg;ref_shape=2048x2048x2048;pick=
2026-03-02T09:57:57.212253+00:00,U,uniform,eval,uniform_eval_026,1536,2048,64,bf16,NVIDIA GeForce RTX 4060,c03,64,64,32,4,2,8,0.0,0.0,48.99200052022934,85.3519995138048,8.218753668443076,3,3,1,fixed_c03,0,fixed_static_cfg;ref_shape=2048x2048x2048;pick=
2026-03-02T09:57:57.216773+00:00,U,uniform,eval,uniform_eval_027,256,1024,96,bf16,NVIDIA GeForce RTX 4060,c03,64,64,32,4,2,8,0.0,0.0,35.29599867761135,91.09760176390398,1.4259873607691949,2,3,1,fixed_c03,0,fixed_static_cfg;ref_shape=2048x2048x2048;pick=
2026-03-02T09:57:57.221148+00:00,U,uniform,eval,uniform_eval_028,2048,256,64,bf16,NVIDIA GeForce RTX 4060,c03,64,64,32,4,2,8,0.0,0.0,36.159999668598175,45.076480358839035,1.8558867426726842,3,2,1,fixed_c03,0,fixed_static_cfg;ref_shape=2048x2048x2048;pick=
2026-03-02T09:57:57.229020+00:00,U,uniform,eval,uniform_eval_029,192,768,192,bf16,NVIDIA GeForce RTX 4060,c03,64,64,32,4,2,8,0.0,0.0,67.64800101518631,180.30208081007,0.8370255314312787,2,3,2,fixed_c03,0,fixed_static_cfg;ref_shape=2048x2048x2048;pick=
2026-03-02T09:57:57.284071+00:00,U,uniform,eval,uniform_eval_030,1024,2048,3072,bf16,NVIDIA GeForce RTX 4060,c03,64,64,32,4,2,8,0.0,0.0,428.0320107936859,476.7027285695076,30.102659527982368,3,3,3,fixed_c03,0,fixed_static_cfg;ref_shape=2048x2048x2048;pick=
2026-03-02T09:57:57.295762+00:00,U,uniform,eval,uniform_eval_031,1536,1024,512,bf16,NVIDIA GeForce RTX 4060,c03,64,64,32,4,2,8,0.0,0.0,79.6000026166439,88.12544003129004,20.23382767657385,3,3,2,fixed_c03,0,fixed_static_cfg;ref_shape=2048x2048x2048;pick=
2026-03-02T09:57:57.303217+00:00,U,uniform,eval,uniform_eval_032,512,768,768,bf16,NVIDIA GeForce RTX 4060,c03,64,64,32,4,2,8,0.0,0.0,49.15200173854828,64.96768008917567,12.287999565362945,2,3,3,fixed_c03,0,fixed_static_cfg;ref_shape=2048x2048x2048;pick=
2026-03-02T09:57:57.315423+00:00,U,uniform,eval,uniform_eval_033,64,512,4096,bf16,NVIDIA GeForce RTX 4060,c03,64,64,32,4,2,8,0.0,0.0,66.56000018119812,104.0521598607301,4.03298460440551,1,2,3,fixed_c03,0,fixed_static_cfg;ref_shape=2048x2048x2048;pick=
2026-03-02T09:57:57.322466+00:00,U,uniform,eval,uniform_eval_034,1024,256,512,bf16,NVIDIA GeForce RTX 4060,c03,64,64,32,4,2,8,0.0,0.0,51.19999870657921,124.92063499987118,5.242880132446292,3,2,2,fixed_c03,0,fixed_static_cfg;ref_shape=2048x2048x2048;pick=
2026-03-02T09:57:57.328553+00:00,U,uniform,eval,uniform_eval_035,1024,768,96,bf16,NVIDIA GeForce RTX 4060,c03,64,64,32,4,2,8,0.0,0.0,45.05600035190582,81.41823776066303,3.351272701097914,3,3,1,fixed_c03,0,fixed_static_cfg;ref_shape=2048x2048x2048;pick=
2026-03-02T09:57:57.338468+00:00,U,uniform,eval,uniform_eval_036,768,64,1536,bf16,NVIDIA GeForce RTX 4060,c03,64,64,32,4,2,8,0.0,0.0,57.10400082170963,162.74239972233767,2.6442095444667197,3,1,3,fixed_c03,0,fixed_static_cfg;ref_shape=2048x2048x2048;pick=
2026-03-02T09:57:57.347125+00:00,U,uniform,eval,uniform_eval_037,512,256,512,bf16,NVIDIA GeForce RTX 4060,c03,64,64,32,4,2,8,0.0,0.0,69.61600109934807,132.15648226439936,1.927972389687533,2,2,2,fixed_c03,0,fixed_static_cfg;ref_shape=2048x2048x2048;pick=
2026-03-02T09:57:57.353534+00:00,U,uniform,eval,uniform_eval_038,64,1024,64,bf16,NVIDIA GeForce RTX 4060,c03,64,64,32,4,2,8,0.0,0.0,63.391998410224915,130.0991953909396,0.13232913002229862,1,3,1,fixed_c03,0,fixed_static_cfg;ref_shape=2048x2048x2048;pick=
2026-03-02T09:57:57.363515+00:00,U,uniform,eval,uniform_eval_039,512,128,2048,bf16,NVIDIA GeForce RTX 4060,c03,64,64,32,4,2,8,0.0,0.0,63.34399804472923,115.99872201681131,4.2377409744558445,2,1,3,fixed_c03,0,fixed_static_cfg;ref_shape=2048x2048x2048;pick=
2026-03-02T09:57:57.372151+00:00,U,uniform,eval,uniform_eval_040,4096,768,96,bf16,NVIDIA GeForce RTX 4060,c03,64,64,32,4,2,8,0.0,0.0,63.88799846172333,145.02912074327466,9.453728251666192,3,3,1,fixed_c03,0,fixed_static_cfg;ref_shape=2048x2048x2048;pick=
2026-03-02T09:57:57.379350+00:00,U,uniform,eval,uniform_eval_041,4096,192,64,bf16,NVIDIA GeForce RTX 4060,c03,64,64,32,4,2,8,0.0,0.0,65.76000154018402,136.75519794225693,1.5307678473591215,3,2,1,fixed_c03,0,fixed_static_cfg;ref_shape=2048x2048x2048;pick=
2026-03-02T09:57:57.384990+00:00,U,uniform,eval,uniform_eval_042,96,1536,128,bf16,NVIDIA GeForce RTX 4060,c03,64,64,32,4,2,8,0.0,0.0,44.03200000524521,69.12511706352234,0.8573023254792712,1,3,1,fixed_c03,0,fixed_static_cfg;ref_shape=2048x2048x2048;pick=
2026-03-02T09:57:57.392040+00:00,U,uniform,eval,uniform_eval_043,192,2048,192,bf16,NVIDIA GeForce RTX 4060,c03,64,64,32,4,2,8,0.0,0.0,50.704000517725945,141.19327798485756,2.977969045010811,2,3,2,fixed_c03,0,fixed_static_cfg;ref_shape=2048x2048x2048;pick=
2026-03-02T09:57:57.474737+00:00,U,uniform,eval,uniform_eval_044,384,4096,3072,bf16,NVIDIA GeForce RTX 4060,c03,64,64,32,4,2,8,0.0,0.0,359.3599945306778,450.20447850227345,26.891352858074,2,3,3,fixed_c03,0,fixed_static_cfg;ref_shape=2048x2048x2048;pick=
2026-03-02T09:57:57.493948+00:00,U,uniform,eval,uniform_eval_045,4096,96,768,bf16,NVIDIA GeForce RTX 4060,c03,64,64,32,4,2,8,0.0,0.0,63.48799914121628,158.38208511471746,9.51329045126416,3,1,3,fixed_c03,0,fixed_static_cfg;ref_shape=2048x2048x2048;pick=
2026-03-02T09:57:57.500401+00:00,U,uniform,eval,uniform_eval_046,96,96,1536,bf16,NVIDIA GeForce RTX 4060,c03,64,64,32,4,2,8,0.0,0.0,47.90399968624115,68.80799908190961,0.5910060158949851,1,1,3,fixed_c03,0,fixed_static_cfg;ref_shape=2048x2048x2048;pick=
2026-03-02T09:57:57.561483+00:00,U,uniform,eval,uniform_eval_047,2048,512,4096,bf16,NVIDIA GeForce RTX 4060,c03,64,64,32,4,2,8,0.0,0.0,304.1920065879822,506.95521414279904,28.23852831752669,3,2,3,fixed_c03,0,fixed_static_cfg;ref_shape=2048x2048x2048;pick=
2026-03-02T09:57:57.569516+00:00,U,uniform,eval,uniform_eval_048,96,256,768,bf16,NVIDIA GeForce RTX 4060,c03,64,64,32,4,2,8,0.0,0.0,64.51199948787689,167.85760179162008,0.5851428617879647,1,2,3,fixed_c03,0,fixed_static_cfg;ref_shape=2048x2048x2048;pick=
2026-03-02T09:57:57.575605+00:00,U,uniform,eval,uniform_eval_049,64,768,384,bf16,NVIDIA GeForce RTX 4060,c03,64,64,32,4,2,8,0.0,0.0,37.248000502586365,114.2067214101553,1.0134432852947064,1,3,2,fixed_c03,0,fixed_static_cfg;ref_shape=2048x2048x2048;pick=
2026-03-02T09:57:57.581226+00:00,U,uniform,eval,uniform_eval_050,128,1024,96,bf16,NVIDIA GeForce RTX 4060,c03,64,64,32,4,2,8,0.0,0.0,36.73600032925606,127.64191776514049,0.6850452900273489,1,3,1,fixed_c03,0,fixed_static_cfg;ref_shape=2048x2048x2048;pick=
2026-03-02T09:57:57.590840+00:00,U,uniform,eval,uniform_eval_051,384,768,768,bf16,NVIDIA GeForce RTX 4060,c03,64,64,32,4,2,8,0.0,0.0,59.28000062704086,160.1481607556343,7.641444453584718,2,3,3,fixed_c03,0,fixed_static_cfg;ref_shape=2048x2048x2048;pick=
2026-03-02T09:57:57.610303+00:00,U,uniform,eval,uniform_eval_052,768,64,4096,bf16,NVIDIA GeForce RTX 4060,c03,64,64,32,4,2,8,0.0,0.0,72.67200201749802,136.2144014984368,5.540692052257606,3,1,3,fixed_c03,0,fixed_static_cfg;ref_shape=2048x2048x2048;pick=
2026-03-02T09:57:57.616005+00:00,U,uniform,eval,uniform_eval_053,384,96,512,bf16,NVIDIA GeForce RTX 4060,c03,64,64,32,4,2,8,0.0,0.0,34.81600061058998,136.6819132864475,1.0842352751027344,2,1,2,fixed_c03,0,fixed_static_cfg;ref_shape=2048x2048x2048;pick=
2026-03-02T09:57:57.622259+00:00,U,uniform,eval,uniform_eval_054,768,192,768,bf16,NVIDIA GeForce RTX 4060,c03,64,64,32,4,2,8,0.0,0.0,38.91199827194214,44.485441185533986,5.82063183743803,3,2,3,fixed_c03,0,fixed_static_cfg;ref_shape=2048x2048x2048;pick=
2026-03-02T09:57:57.631307+00:00,U,uniform,eval,uniform_eval_055,512,2048,512,bf16,NVIDIA GeForce RTX 4060,c03,64,64,32,4,2,8,0.0,0.0,61.32800132036209,66.48159958422184,17.50818224763338,2,3,2,fixed_c03,0,fixed_static_cfg;ref_shape=2048x2048x2048;pick=
2026-03-02T09:57:57.636311+00:00,U,uniform,eval,uniform_eval_056,384,512,512,bf16,NVIDIA GeForce RTX 4060,c03,64,64,32,4,2,8,0.0,0.0,31.74399957060814,45.94016145914793,6.342193634176106,2,2,2,fixed_c03,0,fixed_static_cfg;ref_shape=2048x2048x2048;pick=
2026-03-02T09:57:57.645047+00:00,U,uniform,eval,uniform_eval_057,2048,512,512,bf16,NVIDIA GeForce RTX 4060,c03,64,64,32,4,2,8,0.0,0.0,60.416001826524734,71.2192017585039,17.77247403896545,3,2,2,fixed_c03,0,fixed_static_cfg;ref_shape=2048x2048x2048;pick=
2026-03-02T09:57:57.664397+00:00,U,uniform,eval,uniform_eval_058,1024,512,2048,bf16,NVIDIA GeForce RTX 4060,c03,64,64,32,4,2,8,0.0,0.0,114.00000005960464,166.85119569301605,18.837575849799936,3,2,3,fixed_c03,0,fixed_static_cfg;ref_shape=2048x2048x2048;pick=
2026-03-02T09:57:57.710338+00:00,U,uniform,eval,uniform_eval_059,2048,64,4096,bf16,NVIDIA GeForce RTX 4060,c03,64,64,32,4,2,8,0.0,0.0,78.84799689054489,156.5264011919498,13.617870666905405,3,1,3,fixed_c03,0,fixed_static_cfg;ref_shape=2048x2048x2048;pick=
2026-03-02T09:57:57.723638+00:00,U,uniform,eval,uniform_eval_060,64,1536,1024,bf16,NVIDIA GeForce RTX 4060,c03,64,64,32,4,2,8,0.0,0.0,78.80000025033951,158.86336147785184,2.554905981731042,1,3,3,fixed_c03,0,fixed_static_cfg;ref_shape=2048x2048x2048;pick=
2026-03-02T09:57:57.741497+00:00,U,uniform,eval,uniform_eval_061,768,1024,1536,bf16,NVIDIA GeForce RTX 4060,c03,64,64,32,4,2,8,0.0,0.0,118.6240017414093,180.09087741374964,20.36619123056148,3,3,3,fixed_c03,0,fixed_static_cfg;ref_shape=2048x2048x2048;pick=
2026-03-02T09:57:57.748201+00:00,U,uniform,eval,uniform_eval_062,384,2048,192,bf16,NVIDIA GeForce RTX 4060,c03,64,64,32,4,2,8,0.0,0.0,46.08000069856644,133.78016397356976,6.553599900648331,2,3,2,fixed_c03,0,fixed_static_cfg;ref_shape=2048x2048x2048;pick=
2026-03-02T09:57:57.757093+00:00,U,uniform,eval,uniform_eval_063,256,2048,192,bf16,NVIDIA GeForce RTX 4060,c03,64,64,32,4,2,8,0.0,0.0,64.83200192451477,133.494722098112,3.105358249378273,2,3,2,fixed_c03,0,fixed_static_cfg;ref_shape=2048x2048x2048;pick=
2026-03-02T09:57:57.898119+00:00,U,llm_style,tune,llm_style_tune_000,8,4096,1024,bf16,NVIDIA GeForce RTX 4060,c03,64,64,32,4,2,8,0.0,0.0,73.44000041484833,86.41279853880405,0.9137917159710652,0,3,3,fixed_c03,0,fixed_static_cfg;ref_shape=2048x2048x2048;pick=
2026-03-02T09:57:57.918709+00:00,U,llm_style,tune,llm_style_tune_001,32,1024,2048,bf16,NVIDIA GeForce RTX 4060,c03,64,64,32,4,2,8,0.0,0.0,47.05600067973137,135.68479977548108,2.8522978166695787,0,3,3,fixed_c03,0,fixed_static_cfg;ref_shape=2048x2048x2048;pick=
2026-03-02T09:57:57.930966+00:00,U,llm_style,tune,llm_style_tune_002,16,2048,1024,bf16,NVIDIA GeForce RTX 4060,c03,64,64,32,4,2,8,0.0,0.0,44.03200000524521,111.00192338228216,1.52409302307426,0,3,3,fixed_c03,0,fixed_static_cfg;ref_shape=2048x2048x2048;pick=
2026-03-02T09:57:58.156054+00:00,U,llm_style,tune,llm_style_tune_003,1,1024,4096,bf16,NVIDIA GeForce RTX 4060,c03,64,64,32,4,2,8,0.0,0.0,67.58400052785873,101.24992318451393,0.12412121115177462,0,3,3,fixed_c03,0,fixed_static_cfg;ref_shape=2048x2048x2048;pick=
2026-03-02T09:57:58.186661+00:00,U,llm_style,tune,llm_style_tune_004,64,2048,2048,bf16,NVIDIA GeForce RTX 4060,c03,64,64,32,4,2,8,0.0,0.0,56.59199878573418,198.2406429946422,9.486692880961389,1,3,3,fixed_c03,0,fixed_static_cfg;ref_shape=2048x2048x2048;pick=
2026-03-02T09:57:58.541566+00:00,U,llm_style,tune,llm_style_tune_005,32,8192,8192,bf16,NVIDIA GeForce RTX 4060,c03,64,64,32,4,2,8,0.0,0.0,620.8960115909576,757.011194229126,6.917369762119679,0,3,3,fixed_c03,0,fixed_static_cfg;ref_shape=2048x2048x2048;pick=
2026-03-02T09:57:58.860345+00:00,U,llm_style,tune,llm_style_tune_006,16,8192,8192,bf16,NVIDIA GeForce RTX 4060,c03,64,64,32,4,2,8,0.0,0.0,646.2559998035431,707.9644709825516,3.3229612547548006,0,3,3,fixed_c03,0,fixed_static_cfg;ref_shape=2048x2048x2048;pick=
2026-03-02T09:57:58.906905+00:00,U,llm_style,tune,llm_style_tune_007,2,1024,8192,bf16,NVIDIA GeForce RTX 4060,c03,64,64,32,4,2,8,0.0,0.0,147.45600521564484,255.63134938478458,0.22755554750672122,0,3,3,fixed_c03,0,fixed_static_cfg;ref_shape=2048x2048x2048;pick=
2026-03-02T09:57:58.996289+00:00,U,llm_style,tune,llm_style_tune_008,16,2048,8192,bf16,NVIDIA GeForce RTX 4060,c03,64,64,32,4,2,8,0.0,0.0,206.84799551963806,300.16927331686014,2.5954852047334906,0,3,3,fixed_c03,0,fixed_static_cfg;ref_shape=2048x2048x2048;pick=
2026-03-02T09:57:59.039021+00:00,U,llm_style,tune,llm_style_tune_009,4,4096,2048,bf16,NVIDIA GeForce RTX 4060,c03,64,64,32,4,2,8,0.0,0.0,100.8639968931675,139.26400244235992,0.6653401220167782,0,3,3,fixed_c03,0,fixed_static_cfg;ref_shape=2048x2048x2048;pick=
2026-03-02T09:57:59.212415+00:00,U,llm_style,tune,llm_style_tune_010,64,8192,4096,bf16,NVIDIA GeForce RTX 4060,c03,64,64,32,4,2,8,0.0,0.0,368.6400055885315,433.3568051457405,11.650844267819254,1,3,3,fixed_c03,0,fixed_static_cfg;ref_shape=2048x2048x2048;pick=
2026-03-02T09:57:59.255533+00:00,U,llm_style,tune,llm_style_tune_011,16,8192,1024,bf16,NVIDIA GeForce RTX 4060,c03,64,64,32,4,2,8,0.0,0.0,90.62400087714195,101.26015953719616,2.962079067375488,0,3,3,fixed_c03,0,fixed_static_cfg;ref_shape=2048x2048x2048;pick=
2026-03-02T09:57:59.297792+00:00,U,llm_style,tune,llm_style_tune_012,2,8192,1024,bf16,NVIDIA GeForce RTX 4060,c03,64,64,32,4,2,8,0.0,0.0,88.06400001049042,173.04576247930515,0.381023255768565,0,3,3,fixed_c03,0,fixed_static_cfg;ref_shape=2048x2048x2048;pick=
2026-03-02T09:57:59.381100+00:00,U,llm_style,tune,llm_style_tune_013,16,8192,2048,bf16,NVIDIA GeForce RTX 4060,c03,64,64,32,4,2,8,0.0,0.0,198.46399873495102,234.01472106575966,2.705129975321076,0,3,3,fixed_c03,0,fixed_static_cfg;ref_shape=2048x2048x2048;pick=
2026-03-02T09:57:59.463859+00:00,U,llm_style,tune,llm_style_tune_014,8,4096,4096,bf16,NVIDIA GeForce RTX 4060,c03,64,64,32,4,2,8,0.0,0.0,168.96000504493713,239.89248275756822,1.5887514677133565,0,3,3,fixed_c03,0,fixed_static_cfg;ref_shape=2048x2048x2048;pick=
2026-03-02T09:57:59.475056+00:00,U,llm_style,tune,llm_style_tune_015,64,1024,1024,bf16,NVIDIA GeForce RTX 4060,c03,64,64,32,4,2,8,0.0,0.0,56.32000043988228,182.3478417098521,2.3831272541140724,1,3,3,fixed_c03,0,fixed_static_cfg;ref_shape=2048x2048x2048;pick=
2026-03-02T09:57:59.637973+00:00,U,llm_style,tune,llm_style_tune_016,16,4096,8192,bf16,NVIDIA GeForce RTX 4060,c03,64,64,32,4,2,8,0.0,0.0,308.73599648475647,362.0249706506728,3.4778640528656823,0,3,3,fixed_c03,0,fixed_static_cfg;ref_shape=2048x2048x2048;pick=
2026-03-02T09:57:59.720659+00:00,U,llm_style,tune,llm_style_tune_017,1,4096,4096,bf16,NVIDIA GeForce RTX 4060,c03,64,64,32,4,2,8,0.0,0.0,174.00000244379044,235.48735707998276,0.19284156050997495,0,3,3,fixed_c03,0,fixed_static_cfg;ref_shape=2048x2048x2048;pick=
2026-03-02T09:57:59.805319+00:00,U,llm_style,tune,llm_style_tune_018,64,4096,4096,bf16,NVIDIA GeForce RTX 4060,c03,64,64,32,4,2,8,0.0,0.0,180.09600043296814,272.3411180078982,11.924105159677296,1,3,3,fixed_c03,0,fixed_static_cfg;ref_shape=2048x2048x2048;pick=
2026-03-02T09:57:59.893027+00:00,U,llm_style,tune,llm_style_tune_019,64,8192,2048,bf16,NVIDIA GeForce RTX 4060,c03,64,64,32,4,2,8,0.0,0.0,210.94399690628052,282.1734386682509,10.180349663868828,1,3,3,fixed_c03,0,fixed_static_cfg;ref_shape=2048x2048x2048;pick=
2026-03-02T09:57:59.943035+00:00,U,llm_style,tune,llm_style_tune_020,8,2048,4096,bf16,NVIDIA GeForce RTX 4060,c03,64,64,32,4,2,8,0.0,0.0,121.83999642729759,164.55680325627313,1.1015900519997819,0,3,3,fixed_c03,0,fixed_static_cfg;ref_shape=2048x2048x2048;pick=
2026-03-02T09:57:59.959471+00:00,U,llm_style,tune,llm_style_tune_021,8,1024,2048,bf16,NVIDIA GeForce RTX 4060,c03,64,64,32,4,2,8,0.0,0.0,65.5359998345375,77.84448020160198,0.5120000012926758,0,3,3,fixed_c03,0,fixed_static_cfg;ref_shape=2048x2048x2048;pick=
2026-03-02T09:58:00.005652+00:00,U,llm_style,tune,llm_style_tune_022,8,8192,1024,bf16,NVIDIA GeForce RTX 4060,c03,64,64,32,4,2,8,0.0,0.0,99.32799637317657,198.90047982335085,1.3512577812980566,0,3,3,fixed_c03,0,fixed_static_cfg;ref_shape=2048x2048x2048;pick=
2026-03-02T09:58:00.182677+00:00,U,llm_style,tune,llm_style_tune_023,1,4096,8192,bf16,NVIDIA GeForce RTX 4060,c03,64,64,32,4,2,8,0.0,0.0,472.06398844718933,509.9049574136734,0.1421605240864663,0,3,3,fixed_c03,0,fixed_static_cfg;ref_shape=2048x2048x2048;pick=
2026-03-02T09:58:00.364767+00:00,U,llm_style,tune,llm_style_tune_024,2,8192,4096,bf16,NVIDIA GeForce RTX 4060,c03,64,64,32,4,2,8,0.0,0.0,576.5119791030884,695.0115239620209,0.2328099551527272,0,3,3,fixed_c03,0,fixed_static_cfg;ref_shape=2048x2048x2048;pick=
2026-03-02T09:58:00.455863+00:00,U,llm_style,tune,llm_style_tune_025,2,4096,4096,bf16,NVIDIA GeForce RTX 4060,c03,64,64,32,4,2,8,0.0,0.0,244.7040006518364,285.69215923547745,0.27424506269303767,0,3,3,fixed_c03,0,fixed_static_cfg;ref_shape=2048x2048x2048;pick=
2026-03-02T09:58:00.472802+00:00,U,llm_style,tune,llm_style_tune_026,4,2048,1024,bf16,NVIDIA GeForce RTX 4060,c03,64,64,32,4,2,8,0.0,0.0,55.695999413728714,150.0672022998333,0.3012283858194763,0,3,3,fixed_c03,0,fixed_static_cfg;ref_shape=2048x2048x2048;pick=
2026-03-02T09:58:00.522943+00:00,U,llm_style,tune,llm_style_tune_027,64,2048,4096,bf16,NVIDIA GeForce RTX 4060,c03,64,64,32,4,2,8,0.0,0.0,136.19199767708778,257.4156731367111,7.884030209659232,1,3,3,fixed_c03,0,fixed_static_cfg;ref_shape=2048x2048x2048;pick=
2026-03-02T09:58:00.547176+00:00,U,llm_style,tune,llm_style_tune_028,32,1024,4096,bf16,NVIDIA GeForce RTX 4060,c03,64,64,32,4,2,8,0.0,0.0,128.40000540018082,212.51072123646736,2.090618728273215,0,3,3,fixed_c03,0,fixed_static_cfg;ref_shape=2048x2048x2048;pick=
2026-03-02T09:58:00.560827+00:00,U,llm_style,tune,llm_style_tune_029,32,2048,1024,bf16,NVIDIA GeForce RTX 4060,c03,64,64,32,4,2,8,0.0,0.0,56.32000043988228,131.64767935872075,2.3831272541140724,0,3,3,fixed_c03,0,fixed_static_cfg;ref_shape=2048x2048x2048;pick=
2026-03-02T09:58:00.579672+00:00,U,llm_style,tune,llm_style_tune_030,4,2048,2048,bf16,NVIDIA GeForce RTX 4060,c03,64,64,32,4,2,8,0.0,0.0,82.91199803352356,120.49407973885533,0.40469935348118175,0,3,3,fixed_c03,0,fixed_static_cfg;ref_shape=2048x2048x2048;pick=
2026-03-02T09:58:00.974828+00:00,U,llm_style,tune,llm_style_tune_031,1,8192,8192,bf16,NVIDIA GeForce RTX 4060,c03,64,64,32,4,2,8,0.0,0.0,1093.6319828033447,1136.7302441596985,0.12272659369009586,0,3,3,fixed_c03,0,fixed_static_cfg;ref_shape=2048x2048x2048;pick=
2026-03-02T09:58:01.003696+00:00,U,llm_style,eval,llm_style_eval_000,2,1024,4096,bf16,NVIDIA GeForce RTX 4060,c03,64,64,32,4,2,8,0.0,0.0,130.43200224637985,664.719693660735,0.1286280645167789,0,3,3,fixed_c03,0,fixed_static_cfg;ref_shape=2048x2048x2048;pick=
2026-03-02T09:58:01.352332+00:00,U,llm_style,eval,llm_style_eval_001,2,8192,8192,bf16,NVIDIA GeForce RTX 4060,c03,64,64,32,4,2,8,0.0,0.0,1097.711980342865,1234.0429174900055,0.24454088213208303,0,3,3,fixed_c03,0,fixed_static_cfg;ref_shape=2048x2048x2048;pick=
2026-03-02T09:58:01.378601+00:00,U,llm_style,eval,llm_style_eval_002,2,2048,2048,bf16,NVIDIA GeForce RTX 4060,c03,64,64,32,4,2,8,0.0,0.0,92.16000139713287,150.21760106086722,0.18204444168467585,0,3,3,fixed_c03,0,fixed_static_cfg;ref_shape=2048x2048x2048;pick=
2026-03-02T09:58:01.434034+00:00,U,llm_style,eval,llm_style_eval_003,8,1024,8192,bf16,NVIDIA GeForce RTX 4060,c03,64,64,32,4,2,8,0.0,0.0,223.23200106620789,266.5145525336265,0.6012477035503198,0,3,3,fixed_c03,0,fixed_static_cfg;ref_shape=2048x2048x2048;pick=
2026-03-02T09:58:01.535538+00:00,U,llm_style,eval,llm_style_eval_004,64,2048,8192,bf16,NVIDIA GeForce RTX 4060,c03,64,64,32,4,2,8,0.0,0.0,292.7839905023575,407.05983221530914,7.334703117869788,1,3,3,fixed_c03,0,fixed_static_cfg;ref_shape=2048x2048x2048;pick=
2026-03-02T09:58:01.880667+00:00,U,llm_style,eval,llm_style_eval_005,1,8192,8192,bf16,NVIDIA GeForce RTX 4060,c03,64,64,32,4,2,8,0.0,0.0,1061.8879795074463,1137.6335668563843,0.12639537370246579,0,3,3,fixed_c03,0,fixed_static_cfg;ref_shape=2048x2048x2048;pick=
2026-03-02T09:58:01.932599+00:00,U,llm_style,eval,llm_style_eval_006,1,1024,8192,bf16,NVIDIA GeForce RTX 4060,c03,64,64,32,4,2,8,0.0,0.0,194.5600062608719,280.0127938389776,0.08623157617246684,0,3,3,fixed_c03,0,fixed_static_cfg;ref_shape=2048x2048x2048;pick=
2026-03-02T09:58:02.108798+00:00,U,llm_style,eval,llm_style_eval_007,2,8192,4096,bf16,NVIDIA GeForce RTX 4060,c03,64,64,32,4,2,8,0.0,0.0,577.9359936714172,656.8409699201584,0.23223631936706968,0,3,3,fixed_c03,0,fixed_static_cfg;ref_shape=2048x2048x2048;pick=
2026-03-02T09:58:02.157422+00:00,U,llm_style,eval,llm_style_eval_008,16,2048,4096,bf16,NVIDIA GeForce RTX 4060,c03,64,64,32,4,2,8,0.0,0.0,111.61600053310394,234.6803173422813,2.404990814201279,0,3,3,fixed_c03,0,fixed_static_cfg;ref_shape=2048x2048x2048;pick=
2026-03-02T09:58:02.250215+00:00,U,llm_style,eval,llm_style_eval_009,32,2048,8192,bf16,NVIDIA GeForce RTX 4060,c03,64,64,32,4,2,8,0.0,0.0,285.18399596214294,480.1331183314322,3.765084433919409,0,3,3,fixed_c03,0,fixed_static_cfg;ref_shape=2048x2048x2048;pick=
2026-03-02T09:58:02.263372+00:00,U,llm_style,eval,llm_style_eval_010,1,1024,1024,bf16,NVIDIA GeForce RTX 4060,c03,64,64,32,4,2,8,0.0,0.0,73.08800145983696,166.45343661308289,0.02869351956698965,0,3,3,fixed_c03,0,fixed_static_cfg;ref_shape=2048x2048x2048;pick=
2026-03-02T09:58:02.363597+00:00,U,llm_style,eval,llm_style_eval_011,16,2048,8192,bf16,NVIDIA GeForce RTX 4060,c03,64,64,32,4,2,8,0.0,0.0,296.28799855709076,427.0694428682327,1.8119900725460945,0,3,3,fixed_c03,0,fixed_static_cfg;ref_shape=2048x2048x2048;pick=
2026-03-02T09:58:02.709046+00:00,U,llm_style,eval,llm_style_eval_012,8,8192,8192,bf16,NVIDIA GeForce RTX 4060,c03,64,64,32,4,2,8,0.0,0.0,1072.6400017738342,1177.3235344886775,1.001027205981824,0,3,3,fixed_c03,0,fixed_static_cfg;ref_shape=2048x2048x2048;pick=
2026-03-02T09:58:02.881033+00:00,U,llm_style,eval,llm_style_eval_013,32,4096,8192,bf16,NVIDIA GeForce RTX 4060,c03,64,64,32,4,2,8,0.0,0.0,479.48800027370453,571.3407957553862,4.478701545761644,0,3,3,fixed_c03,0,fixed_static_cfg;ref_shape=2048x2048x2048;pick=
2026-03-02T09:58:02.894079+00:00,U,llm_style,eval,llm_style_eval_014,64,1024,1024,bf16,NVIDIA GeForce RTX 4060,c03,64,64,32,4,2,8,0.0,0.0,55.16799911856651,71.22368104755876,2.432890990147034,1,3,3,fixed_c03,0,fixed_static_cfg;ref_shape=2048x2048x2048;pick=
2026-03-02T09:58:02.907165+00:00,U,llm_style,eval,llm_style_eval_015,16,2048,1024,bf16,NVIDIA GeForce RTX 4060,c03,64,64,32,4,2,8,0.0,0.0,52.68799886107445,124.88383710384369,1.2737030339100541,0,3,3,fixed_c03,0,fixed_static_cfg;ref_shape=2048x2048x2048;pick=
2026-03-02T09:58:02.961585+00:00,U,llm_style,eval,llm_style_eval_016,2,1024,8192,bf16,NVIDIA GeForce RTX 4060,c03,64,64,32,4,2,8,0.0,0.0,200.70399343967438,261.6320064663886,0.167183678934049,0,3,3,fixed_c03,0,fixed_static_cfg;ref_shape=2048x2048x2048;pick=
2026-03-02T09:58:03.308773+00:00,U,llm_style,eval,llm_style_eval_017,4,8192,8192,bf16,NVIDIA GeForce RTX 4060,c03,64,64,32,4,2,8,0.0,0.0,1111.0399961471558,1206.0224425792692,0.4832147482194621,0,3,3,fixed_c03,0,fixed_static_cfg;ref_shape=2048x2048x2048;pick=
2026-03-02T09:58:03.339152+00:00,U,llm_style,eval,llm_style_eval_018,4,1024,4096,bf16,NVIDIA GeForce RTX 4060,c03,64,64,32,4,2,8,0.0,0.0,144.896000623703,281.73312202095974,0.2315759707346329,0,3,3,fixed_c03,0,fixed_static_cfg;ref_shape=2048x2048x2048;pick=
2026-03-02T09:58:03.387052+00:00,U,llm_style,eval,llm_style_eval_019,8,4096,2048,bf16,NVIDIA GeForce RTX 4060,c03,64,64,32,4,2,8,0.0,0.0,150.52799880504608,167.8937642276287,0.8916462655816605,0,3,3,fixed_c03,0,fixed_static_cfg;ref_shape=2048x2048x2048;pick=
2026-03-02T09:58:03.433554+00:00,U,llm_style,eval,llm_style_eval_020,64,4096,2048,bf16,NVIDIA GeForce RTX 4060,c03,64,64,32,4,2,8,0.0,0.0,151.5520066022873,203.9235213398932,7.084972664319673,1,3,3,fixed_c03,0,fixed_static_cfg;ref_shape=2048x2048x2048;pick=
2026-03-02T09:58:03.613503+00:00,U,llm_style,eval,llm_style_eval_021,1,4096,8192,bf16,NVIDIA GeForce RTX 4060,c03,64,64,32,4,2,8,0.0,0.0,474.09600019454956,606.9145601987839,0.14155121319830008,0,3,3,fixed_c03,0,fixed_static_cfg;ref_shape=2048x2048x2048;pick=
2026-03-02T09:58:03.643328+00:00,U,llm_style,eval,llm_style_eval_022,32,1024,4096,bf16,NVIDIA GeForce RTX 4060,c03,64,64,32,4,2,8,0.0,0.0,174.0799993276596,215.96096202731124,1.5420235353674443,0,3,3,fixed_c03,0,fixed_static_cfg;ref_shape=2048x2048x2048;pick=
2026-03-02T09:58:03.654726+00:00,U,llm_style,eval,llm_style_eval_023,4,1024,1024,bf16,NVIDIA GeForce RTX 4060,c03,64,64,32,4,2,8,0.0,0.0,81.91999793052673,146.27840086817736,0.10240000258684165,0,3,3,fixed_c03,0,fixed_static_cfg;ref_shape=2048x2048x2048;pick=
2026-03-02T09:58:03.676722+00:00,U,llm_style,eval,llm_style_eval_024,64,2048,2048,bf16,NVIDIA GeForce RTX 4060,c03,64,64,32,4,2,8,0.0,0.0,110.59200018644333,182.79423847794533,4.854518510334449,1,3,3,fixed_c03,0,fixed_static_cfg;ref_shape=2048x2048x2048;pick=
2026-03-02T09:58:04.039149+00:00,U,llm_style,eval,llm_style_eval_025,32,8192,8192,bf16,NVIDIA GeForce RTX 4060,c03,64,64,32,4,2,8,0.0,0.0,1165.824055671692,1279.9693071842194,3.68406130848402,0,3,3,fixed_c03,0,fixed_static_cfg;ref_shape=2048x2048x2048;pick=
2026-03-02T09:58:04.095029+00:00,U,llm_style,eval,llm_style_eval_026,4,2048,4096,bf16,NVIDIA GeForce RTX 4060,c03,64,64,32,4,2,8,0.0,0.0,192.3839971423149,258.1340742111206,0.3488276831588888,0,3,3,fixed_c03,0,fixed_static_cfg;ref_shape=2048x2048x2048;pick=
2026-03-02T09:58:04.189663+00:00,U,llm_style,eval,llm_style_eval_027,8,8192,2048,bf16,NVIDIA GeForce RTX 4060,c03,64,64,32,4,2,8,0.0,0.0,338.4000062942505,355.7769602537155,0.7932489686970813,0,3,3,fixed_c03,0,fixed_static_cfg;ref_shape=2048x2048x2048;pick=
2026-03-02T09:58:04.368939+00:00,U,llm_style,eval,llm_style_eval_028,8,4096,8192,bf16,NVIDIA GeForce RTX 4060,c03,64,64,32,4,2,8,0.0,0.0,591.2160277366638,661.0022288560865,0.9080790892210555,0,3,3,fixed_c03,0,fixed_static_cfg;ref_shape=2048x2048x2048;pick=
2026-03-02T09:58:04.399771+00:00,U,llm_style,eval,llm_style_eval_029,8,2048,2048,bf16,NVIDIA GeForce RTX 4060,c03,64,64,32,4,2,8,0.0,0.0,123.32800030708313,311.4764690399168,0.544149453756656,0,3,3,fixed_c03,0,fixed_static_cfg;ref_shape=2048x2048x2048;pick=
2026-03-02T09:58:04.449190+00:00,U,llm_style,eval,llm_style_eval_030,1,4096,2048,bf16,NVIDIA GeForce RTX 4060,c03,64,64,32,4,2,8,0.0,0.0,175.10400712490082,260.8230426907539,0.09581286159849496,0,3,3,fixed_c03,0,fixed_static_cfg;ref_shape=2048x2048x2048;pick=
2026-03-02T09:58:04.545290+00:00,U,llm_style,eval,llm_style_eval_031,16,8192,2048,bf16,NVIDIA GeForce RTX 4060,c03,64,64,32,4,2,8,0.0,0.0,306.17600679397583,419.92192804813385,1.75347153299722,0,3,3,fixed_c03,0,fixed_static_cfg;ref_shape=2048x2048x2048;pick=
2026-03-02T09:58:04.570817+00:00,U,llm_style,eval,llm_style_eval_032,1,2048,2048,bf16,NVIDIA GeForce RTX 4060,c03,64,64,32,4,2,8,0.0,0.0,117.5680011510849,169.5561648905277,0.07135111525133377,0,3,3,fixed_c03,0,fixed_static_cfg;ref_shape=2048x2048x2048;pick=
2026-03-02T09:58:04.781073+00:00,U,llm_style,eval,llm_style_eval_033,16,8192,4096,bf16,NVIDIA GeForce RTX 4060,c03,64,64,32,4,2,8,0.0,0.0,596.992015838623,800.5145686864851,1.7985865732084607,0,3,3,fixed_c03,0,fixed_static_cfg;ref_shape=2048x2048x2048;pick=
2026-03-02T09:58:04.808991+00:00,U,llm_style,eval,llm_style_eval_034,16,1024,4096,bf16,NVIDIA GeForce RTX 4060,c03,64,64,32,4,2,8,0.0,0.0,169.98399794101715,255.5222363770008,0.7895903710099365,0,3,3,fixed_c03,0,fixed_static_cfg;ref_shape=2048x2048x2048;pick=
2026-03-02T09:58:04.902649+00:00,U,llm_style,eval,llm_style_eval_035,4,8192,2048,bf16,NVIDIA GeForce RTX 4060,c03,64,64,32,4,2,8,0.0,0.0,327.67999172210693,350.85312336683273,0.4096000103473666,0,3,3,fixed_c03,0,fixed_static_cfg;ref_shape=2048x2048x2048;pick=
2026-03-02T09:58:04.957041+00:00,U,llm_style,eval,llm_style_eval_036,2,2048,4096,bf16,NVIDIA GeForce RTX 4060,c03,64,64,32,4,2,8,0.0,0.0,220.15999257564545,247.257604598999,0.15240930746521048,0,3,3,fixed_c03,0,fixed_static_cfg;ref_shape=2048x2048x2048;pick=
2026-03-02T09:58:04.969169+00:00,U,llm_style,eval,llm_style_eval_037,2,1024,1024,bf16,NVIDIA GeForce RTX 4060,c03,64,64,32,4,2,8,0.0,0.0,70.65600156784058,137.87904471158976,0.05936231752334337,0,3,3,fixed_c03,0,fixed_static_cfg;ref_shape=2048x2048x2048;pick=
2026-03-02T09:58:05.157190+00:00,U,llm_style,eval,llm_style_eval_038,64,4096,8192,bf16,NVIDIA GeForce RTX 4060,c03,64,64,32,4,2,8,0.0,0.0,720.8960056304932,840.6243312358854,5.957818135285181,1,3,3,fixed_c03,0,fixed_static_cfg;ref_shape=2048x2048x2048;pick=
2026-03-02T09:58:05.173613+00:00,U,llm_style,eval,llm_style_eval_039,4,1024,2048,bf16,NVIDIA GeForce RTX 4060,c03,64,64,32,4,2,8,0.0,0.0,111.39199882745743,202.2502376139164,0.15061419290973815,0,3,3,fixed_c03,0,fixed_static_cfg;ref_shape=2048x2048x2048;pick=
2026-03-02T09:58:05.222166+00:00,U,llm_style,eval,llm_style_eval_040,64,8192,1024,bf16,NVIDIA GeForce RTX 4060,c03,64,64,32,4,2,8,0.0,0.0,175.47199875116348,221.15328386425963,6.119163351656302,1,3,3,fixed_c03,0,fixed_static_cfg;ref_shape=2048x2048x2048;pick=
2026-03-02T09:58:05.235070+00:00,U,llm_style,eval,llm_style_eval_041,2,2048,1024,bf16,NVIDIA GeForce RTX 4060,c03,64,64,32,4,2,8,0.0,0.0,76.80000364780426,119.81824316084375,0.10922666147867861,0,3,3,fixed_c03,0,fixed_static_cfg;ref_shape=2048x2048x2048;pick=
2026-03-02T09:58:05.285101+00:00,U,llm_style,eval,llm_style_eval_042,2,4096,2048,bf16,NVIDIA GeForce RTX 4060,c03,64,64,32,4,2,8,0.0,0.0,206.7679986357689,298.9923280477524,0.16228058607419052,0,3,3,fixed_c03,0,fixed_static_cfg;ref_shape=2048x2048x2048;pick=
2026-03-02T09:58:05.303752+00:00,U,llm_style,eval,llm_style_eval_043,1,2048,1024,bf16,NVIDIA GeForce RTX 4060,c03,64,64,32,4,2,8,0.0,0.0,82.75199681520462,94.69151742756364,0.050685230102258394,0,3,3,fixed_c03,0,fixed_static_cfg;ref_shape=2048x2048x2048;pick=
2026-03-02T09:58:05.410152+00:00,U,llm_style,eval,llm_style_eval_044,8,2048,8192,bf16,NVIDIA GeForce RTX 4060,c03,64,64,32,4,2,8,0.0,0.0,432.12801218032837,452.5139158964157,0.6211942952866963,0,3,3,fixed_c03,0,fixed_static_cfg;ref_shape=2048x2048x2048;pick=
2026-03-02T09:58:05.463713+00:00,U,llm_style,eval,llm_style_eval_045,1,8192,1024,bf16,NVIDIA GeForce RTX 4060,c03,64,64,32,4,2,8,0.0,0.0,188.4160041809082,298.00927996635437,0.08904347628501508,0,3,3,fixed_c03,0,fixed_static_cfg;ref_shape=2048x2048x2048;pick=
2026-03-02T09:58:05.490711+00:00,U,llm_style,eval,llm_style_eval_046,64,4096,1024,bf16,NVIDIA GeForce RTX 4060,c03,64,64,32,4,2,8,0.0,0.0,119.64800208806992,226.27519652247395,4.487086308426803,1,3,3,fixed_c03,0,fixed_static_cfg;ref_shape=2048x2048x2048;pick=
2026-03-02T09:58:05.516369+00:00,U,llm_style,eval,llm_style_eval_047,16,2048,2048,bf16,NVIDIA GeForce RTX 4060,c03,64,64,32,4,2,8,0.0,0.0,146.81600034236908,267.7548697590828,0.9141900588969157,0,3,3,fixed_c03,0,fixed_static_cfg;ref_shape=2048x2048x2048;pick=
2026-03-02T09:58:05.704491+00:00,U,llm_style,eval,llm_style_eval_048,8,8192,4096,bf16,NVIDIA GeForce RTX 4060,c03,64,64,32,4,2,8,0.0,0.0,722.432017326355,811.5737682580946,0.7431438517729362,0,3,3,fixed_c03,0,fixed_static_cfg;ref_shape=2048x2048x2048;pick=
2026-03-02T09:58:05.901526+00:00,U,llm_style,eval,llm_style_eval_049,4,4096,8192,bf16,NVIDIA GeForce RTX 4060,c03,64,64,32,4,2,8,0.0,0.0,826.367974281311,918.2796913385389,0.3248376804939195,0,3,3,fixed_c03,0,fixed_static_cfg;ref_shape=2048x2048x2048;pick=
2026-03-02T09:58:06.012626+00:00,U,llm_style,eval,llm_style_eval_050,4,2048,8192,bf16,NVIDIA GeForce RTX 4060,c03,64,64,32,4,2,8,0.0,0.0,502.27200984954834,728.7091243267059,0.26722119761402563,0,3,3,fixed_c03,0,fixed_static_cfg;ref_shape=2048x2048x2048;pick=
2026-03-02T09:58:06.024051+00:00,U,llm_style,eval,llm_style_eval_051,16,1024,1024,bf16,NVIDIA GeForce RTX 4060,c03,64,64,32,4,2,8,0.0,0.0,82.43199810385704,174.30879503488535,0.407055909984426,0,3,3,fixed_c03,0,fixed_static_cfg;ref_shape=2048x2048x2048;pick=
2026-03-02T09:58:06.221792+00:00,U,llm_style,eval,llm_style_eval_052,32,8192,4096,bf16,NVIDIA GeForce RTX 4060,c03,64,64,32,4,2,8,0.0,0.0,761.1840069293976,891.1667084693909,2.821241156475305,0,3,3,fixed_c03,0,fixed_static_cfg;ref_shape=2048x2048x2048;pick=
2026-03-02T09:58:06.239845+00:00,U,llm_style,eval,llm_style_eval_053,32,1024,2048,bf16,NVIDIA GeForce RTX 4060,c03,64,64,32,4,2,8,0.0,0.0,124.92799758911133,266.75679951906204,1.0743606764709592,0,3,3,fixed_c03,0,fixed_static_cfg;ref_shape=2048x2048x2048;pick=
2026-03-02T09:58:06.344230+00:00,U,llm_style,eval,llm_style_eval_054,64,8192,2048,bf16,NVIDIA GeForce RTX 4060,c03,64,64,32,4,2,8,0.0,0.0,403.24799716472626,540.623687505722,5.325466370816854,1,3,3,fixed_c03,0,fixed_static_cfg;ref_shape=2048x2048x2048;pick=
2026-03-02T09:58:06.376788+00:00,U,llm_style,eval,llm_style_eval_055,1,4096,1024,bf16,NVIDIA GeForce RTX 4060,c03,64,64,32,4,2,8,0.0,0.0,135.16800105571747,249.50720593333241,0.06206060557588731,0,3,3,fixed_c03,0,fixed_static_cfg;ref_shape=2048x2048x2048;pick=
2026-03-02T09:58:06.402491+00:00,U,llm_style,eval,llm_style_eval_056,4,2048,2048,bf16,NVIDIA GeForce RTX 4060,c03,64,64,32,4,2,8,0.0,0.0,147.45600521564484,229.1385626792906,0.22755554750672122,0,3,3,fixed_c03,0,fixed_static_cfg;ref_shape=2048x2048x2048;pick=
2026-03-02T09:58:06.467620+00:00,U,llm_style,eval,llm_style_eval_057,16,1024,8192,bf16,NVIDIA GeForce RTX 4060,c03,64,64,32,4,2,8,0.0,0.0,367.1040087938309,447.3836785554885,0.7312245292062607,0,3,3,fixed_c03,0,fixed_static_cfg;ref_shape=2048x2048x2048;pick=
2026-03-02T09:58:06.656574+00:00,U,llm_style,eval,llm_style_eval_058,1,8192,4096,bf16,NVIDIA GeForce RTX 4060,c03,64,64,32,4,2,8,0.0,0.0,764.9279832839966,823.8716715574263,0.08773226430008162,0,3,3,fixed_c03,0,fixed_static_cfg;ref_shape=2048x2048x2048;pick=
2026-03-02T09:58:06.683623+00:00,U,llm_style,eval,llm_style_eval_059,8,4096,1024,bf16,NVIDIA GeForce RTX 4060,c03,64,64,32,4,2,8,0.0,0.0,136.57599687576294,300.5516877770424,0.4913664592252322,0,3,3,fixed_c03,0,fixed_static_cfg;ref_shape=2048x2048x2048;pick=
2026-03-02T09:58:06.898407+00:00,U,llm_style,eval,llm_style_eval_060,4,8192,4096,bf16,NVIDIA GeForce RTX 4060,c03,64,64,32,4,2,8,0.0,0.0,813.0559921264648,964.4953399896622,0.3301561744818269,0,3,3,fixed_c03,0,fixed_static_cfg;ref_shape=2048x2048x2048;pick=
2026-03-02T09:58:06.926707+00:00,U,llm_style,eval,llm_style_eval_061,32,2048,2048,bf16,NVIDIA GeForce RTX 4060,c03,64,64,32,4,2,8,0.0,0.0,160.60799360275269,248.75232502818105,1.6713704590815537,0,3,3,fixed_c03,0,fixed_static_cfg;ref_shape=2048x2048x2048;pick=
2026-03-02T09:58:06.943204+00:00,U,llm_style,eval,llm_style_eval_062,8,2048,1024,bf16,NVIDIA GeForce RTX 4060,c03,64,64,32,4,2,8,0.0,0.0,97.28000313043594,103.28512020409107,0.34492630468986735,0,3,3,fixed_c03,0,fixed_static_cfg;ref_shape=2048x2048x2048;pick=
2026-03-02T09:58:07.149559+00:00,U,llm_style,eval,llm_style_eval_063,16,4096,8192,bf16,NVIDIA GeForce RTX 4060,c03,64,64,32,4,2,8,0.0,0.0,990.7039999961853,1109.555184841156,1.0838169867126148,0,3,3,fixed_c03,0,fixed_static_cfg;ref_shape=2048x2048x2048;pick=
2026-03-02T09:58:07.311968+00:00,U,training_style,tune,training_style_tune_000,4096,2048,1024,bf16,NVIDIA GeForce RTX 4060,c03,64,64,32,4,2,8,0.0,0.0,1584.608018398285,3024.9779438972473,10.841715417649684,3,3,3,fixed_c03,0,fixed_static_cfg;ref_shape=2048x2048x2048;pick=
2026-03-02T09:58:07.395376+00:00,U,training_style,tune,training_style_tune_001,1536,2048,1536,bf16,NVIDIA GeForce RTX 4060,c03,64,64,32,4,2,8,0.0,0.0,887.8079950809479,1046.3437139987943,10.884872032627834,3,3,3,fixed_c03,0,fixed_static_cfg;ref_shape=2048x2048x2048;pick=
2026-03-02T09:58:07.691325+00:00,U,training_style,tune,training_style_tune_002,3072,2048,4096,bf16,NVIDIA GeForce RTX 4060,c03,64,64,32,4,2,8,0.0,0.0,3500.0319480895996,3590.1849913597107,14.725467743267753,3,3,3,fixed_c03,0,fixed_static_cfg;ref_shape=2048x2048x2048;pick=
2026-03-02T09:58:07.755784+00:00,U,training_style,tune,training_style_tune_003,2048,1536,2048,bf16,NVIDIA GeForce RTX 4060,c03,64,64,32,4,2,8,0.0,0.0,471.5519994497299,569.2723304033278,27.32445605794447,3,3,3,fixed_c03,0,fixed_static_cfg;ref_shape=2048x2048x2048;pick=
2026-03-02T09:58:07.771264+00:00,U,training_style,tune,training_style_tune_004,512,512,1024,bf16,NVIDIA GeForce RTX 4060,c03,64,64,32,4,2,8,0.0,0.0,59.39200147986412,142.4384035170078,9.039448050627108,2,2,3,fixed_c03,0,fixed_static_cfg;ref_shape=2048x2048x2048;pick=
2026-03-02T09:58:07.804042+00:00,U,training_style,tune,training_style_tune_005,1024,1536,1536,bf16,NVIDIA GeForce RTX 4060,c03,64,64,32,4,2,8,0.0,0.0,177.15199291706085,259.3484801054001,27.27509935641635,3,3,3,fixed_c03,0,fixed_static_cfg;ref_shape=2048x2048x2048;pick=
2026-03-02T09:58:07.815905+00:00,U,training_style,tune,training_style_tune_006,1024,1536,512,bf16,NVIDIA GeForce RTX 4060,c03,64,64,32,4,2,8,0.0,0.0,89.03999999165535,136.25344142317772,18.088642589296313,3,3,2,fixed_c03,0,fixed_static_cfg;ref_shape=2048x2048x2048;pick=
2026-03-02T09:58:07.832511+00:00,U,training_style,tune,training_style_tune_007,2048,1536,512,bf16,NVIDIA GeForce RTX 4060,c03,64,64,32,4,2,8,0.0,0.0,146.38400077819824,178.94432038068766,22.00531106456652,3,3,2,fixed_c03,0,fixed_static_cfg;ref_shape=2048x2048x2048;pick=
2026-03-02T09:58:07.921372+00:00,U,training_style,tune,training_style_tune_008,3072,3072,1536,bf16,NVIDIA GeForce RTX 4060,c03,64,64,32,4,2,8,0.0,0.0,967.5680100917816,1031.3011002540586,29.962781887807523,3,3,3,fixed_c03,0,fixed_static_cfg;ref_shape=2048x2048x2048;pick=
2026-03-02T09:58:07.947057+00:00,U,training_style,tune,training_style_tune_009,1024,1536,1024,bf16,NVIDIA GeForce RTX 4060,c03,64,64,32,4,2,8,0.0,0.0,137.1999979019165,221.99519619345648,23.47832012579793,3,3,3,fixed_c03,0,fixed_static_cfg;ref_shape=2048x2048x2048;pick=
2026-03-02T09:58:08.047952+00:00,U,training_style,tune,training_style_tune_010,1536,2048,4096,bf16,NVIDIA GeForce RTX 4060,c03,64,64,32,4,2,8,0.0,0.0,856.6559851169586,964.6470415592192,30.081858089722758,3,3,3,fixed_c03,0,fixed_static_cfg;ref_shape=2048x2048x2048;pick=
2026-03-02T09:58:08.112489+00:00,U,training_style,tune,training_style_tune_011,1024,1024,4096,bf16,NVIDIA GeForce RTX 4060,c03,64,64,32,4,2,8,0.0,0.0,312.6560002565384,353.36192786693573,27.474075613299743,3,3,3,fixed_c03,0,fixed_static_cfg;ref_shape=2048x2048x2048;pick=
2026-03-02T09:58:08.451405+00:00,U,training_style,tune,training_style_tune_012,3072,4096,4096,bf16,NVIDIA GeForce RTX 4060,c03,64,64,32,4,2,8,0.0,0.0,3414.944052696228,3511.8778371810913,30.18474490749418,3,3,3,fixed_c03,0,fixed_static_cfg;ref_shape=2048x2048x2048;pick=
2026-03-02T09:58:08.493327+00:00,U,training_style,tune,training_style_tune_013,512,1024,3072,bf16,NVIDIA GeForce RTX 4060,c03,64,64,32,4,2,8,0.0,0.0,148.8640010356903,298.34240019321425,21.638713520992276,2,3,3,fixed_c03,0,fixed_static_cfg;ref_shape=2048x2048x2048;pick=
2026-03-02T09:58:08.514220+00:00,U,training_style,tune,training_style_tune_014,1536,1024,1024,bf16,NVIDIA GeForce RTX 4060,c03,64,64,32,4,2,8,0.0,0.0,138.2399946451187,239.46336165070534,23.30168979150595,3,3,3,fixed_c03,0,fixed_static_cfg;ref_shape=2048x2048x2048;pick=
2026-03-02T09:58:08.576533+00:00,U,training_style,tune,training_style_tune_015,2048,3072,1536,bf16,NVIDIA GeForce RTX 4060,c03,64,64,32,4,2,8,0.0,0.0,603.9679944515228,622.612481713295,32.00062422107584,3,3,3,fixed_c03,0,fixed_static_cfg;ref_shape=2048x2048x2048;pick=
2026-03-02T09:58:08.687414+00:00,U,training_style,tune,training_style_tune_016,1536,3072,3072,bf16,NVIDIA GeForce RTX 4060,c03,64,64,32,4,2,8,0.0,0.0,896.8639969825745,1040.3327906131744,32.324889108647405,3,3,3,fixed_c03,0,fixed_static_cfg;ref_shape=2048x2048x2048;pick=
2026-03-02T09:58:08.723652+00:00,U,training_style,tune,training_style_tune_017,1024,1024,2048,bf16,NVIDIA GeForce RTX 4060,c03,64,64,32,4,2,8,0.0,0.0,162.6560017466545,294.9939304590225,26.40521868162998,3,3,3,fixed_c03,0,fixed_static_cfg;ref_shape=2048x2048x2048;pick=
2026-03-02T09:58:08.757391+00:00,U,training_style,tune,training_style_tune_018,1536,1536,1536,bf16,NVIDIA GeForce RTX 4060,c03,64,64,32,4,2,8,0.0,0.0,248.87999892234802,327.14207023382187,29.12149366515122,3,3,3,fixed_c03,0,fixed_static_cfg;ref_shape=2048x2048x2048;pick=
2026-03-02T09:58:08.797130+00:00,U,training_style,tune,training_style_tune_019,1536,1536,2048,bf16,NVIDIA GeForce RTX 4060,c03,64,64,32,4,2,8,0.0,0.0,302.7840107679367,376.33023679256416,31.916072422353068,3,3,3,fixed_c03,0,fixed_static_cfg;ref_shape=2048x2048x2048;pick=
2026-03-02T09:58:08.819937+00:00,U,training_style,tune,training_style_tune_020,1536,1536,1024,bf16,NVIDIA GeForce RTX 4060,c03,64,64,32,4,2,8,0.0,0.0,172.03199863433838,177.6620765030384,28.086857365822308,3,3,3,fixed_c03,0,fixed_static_cfg;ref_shape=2048x2048x2048;pick=
2026-03-02T09:58:08.851370+00:00,U,training_style,tune,training_style_tune_021,1024,2048,1536,bf16,NVIDIA GeForce RTX 4060,c03,64,64,32,4,2,8,0.0,0.0,249.85599517822266,335.5340853333473,25.784656235303018,3,3,3,fixed_c03,0,fixed_static_cfg;ref_shape=2048x2048x2048;pick=
2026-03-02T09:58:08.869380+00:00,U,training_style,tune,training_style_tune_022,512,1024,1536,bf16,NVIDIA GeForce RTX 4060,c03,64,64,32,4,2,8,0.0,0.0,94.72000226378441,208.88575986027706,17.00393472874533,2,3,3,fixed_c03,0,fixed_static_cfg;ref_shape=2048x2048x2048;pick=
2026-03-02T09:58:08.918162+00:00,U,training_style,tune,training_style_tune_023,1536,2048,2048,bf16,NVIDIA GeForce RTX 4060,c03,64,64,32,4,2,8,0.0,0.0,416.6239947080612,436.2854388356209,30.92693184181283,3,3,3,fixed_c03,0,fixed_static_cfg;ref_shape=2048x2048x2048;pick=
2026-03-02T09:58:08.938324+00:00,U,training_style,tune,training_style_tune_024,1024,1024,1024,bf16,NVIDIA GeForce RTX 4060,c03,64,64,32,4,2,8,0.0,0.0,105.53599894046783,182.73343741893768,20.34835193260815,3,3,3,fixed_c03,0,fixed_static_cfg;ref_shape=2048x2048x2048;pick=
2026-03-02T09:58:08.998226+00:00,U,training_style,tune,training_style_tune_025,1536,1024,4096,bf16,NVIDIA GeForce RTX 4060,c03,64,64,32,4,2,8,0.0,0.0,416.76801443099976,427.57119208574295,30.91624462974048,3,3,3,fixed_c03,0,fixed_static_cfg;ref_shape=2048x2048x2048;pick=
2026-03-02T09:58:09.028824+00:00,U,training_style,tune,training_style_tune_026,2048,4096,512,bf16,NVIDIA GeForce RTX 4060,c03,64,64,32,4,2,8,0.0,0.0,292.06399619579315,355.205759704113,29.41113832545625,3,3,2,fixed_c03,0,fixed_static_cfg;ref_shape=2048x2048x2048;pick=
2026-03-02T09:58:09.167566+00:00,U,training_style,tune,training_style_tune_027,4096,4096,1536,bf16,NVIDIA GeForce RTX 4060,c03,64,64,32,4,2,8,0.0,0.0,1702.8639912605286,1770.6153655052185,30.26642633616811,3,3,3,fixed_c03,0,fixed_static_cfg;ref_shape=2048x2048x2048;pick=
2026-03-02T09:58:09.257034+00:00,U,training_style,tune,training_style_tune_028,1536,1536,4096,bf16,NVIDIA GeForce RTX 4060,c03,64,64,32,4,2,8,0.0,0.0,635.9040141105652,704.2147356271744,30.393506571951807,3,3,3,fixed_c03,0,fixed_static_cfg;ref_shape=2048x2048x2048;pick=
2026-03-02T09:58:09.372468+00:00,U,training_style,tune,training_style_tune_029,4096,2048,2048,bf16,NVIDIA GeForce RTX 4060,c03,64,64,32,4,2,8,0.0,0.0,1093.07199716568,1141.7804718017578,31.434103569659005,3,3,3,fixed_c03,0,fixed_static_cfg;ref_shape=2048x2048x2048;pick=
2026-03-02T09:58:09.392955+00:00,U,training_style,tune,training_style_tune_030,2048,2048,512,bf16,NVIDIA GeForce RTX 4060,c03,64,64,32,4,2,8,0.0,0.0,153.60000729560852,259.112950861454,27.962025338541725,3,3,2,fixed_c03,0,fixed_static_cfg;ref_shape=2048x2048x2048;pick=
2026-03-02T09:58:09.406290+00:00,U,training_style,tune,training_style_tune_031,512,512,1536,bf16,NVIDIA GeForce RTX 4060,c03,64,64,32,4,2,8,0.0,0.0,64.41599875688553,451.85408219694966,12.501651508025708,2,2,3,fixed_c03,0,fixed_static_cfg;ref_shape=2048x2048x2048;pick=
2026-03-02T09:58:09.477584+00:00,U,training_style,eval,training_style_eval_000,2048,1536,3072,bf16,NVIDIA GeForce RTX 4060,c03,64,64,32,4,2,8,0.0,0.0,604.0799915790558,689.3625545501709,31.994691268417277,3,3,3,fixed_c03,0,fixed_static_cfg;ref_shape=2048x2048x2048;pick=
2026-03-02T09:58:09.517852+00:00,U,training_style,eval,training_style_eval_001,1024,2048,2048,bf16,NVIDIA GeForce RTX 4060,c03,64,64,32,4,2,8,0.0,0.0,294.3200021982193,371.3331151008606,29.18569763469501,3,3,3,fixed_c03,0,fixed_static_cfg;ref_shape=2048x2048x2048;pick=
2026-03-02T09:58:09.569325+00:00,U,training_style,eval,training_style_eval_002,1536,1024,3072,bf16,NVIDIA GeForce RTX 4060,c03,64,64,32,4,2,8,0.0,0.0,329.69599962234497,503.4656029939649,29.310869489072953,3,3,3,fixed_c03,0,fixed_static_cfg;ref_shape=2048x2048x2048;pick=
2026-03-02T09:58:09.583667+00:00,U,training_style,eval,training_style_eval_003,1024,512,1024,bf16,NVIDIA GeForce RTX 4060,c03,64,64,32,4,2,8,0.0,0.0,70.39999961853027,188.4262403845786,15.252014628099174,3,2,3,fixed_c03,0,fixed_static_cfg;ref_shape=2048x2048x2048;pick=
2026-03-02T09:58:09.604727+00:00,U,training_style,eval,training_style_eval_004,1024,2048,1024,bf16,NVIDIA GeForce RTX 4060,c03,64,64,32,4,2,8,0.0,0.0,160.40000319480896,180.88960528373715,26.776603556445554,3,3,3,fixed_c03,0,fixed_static_cfg;ref_shape=2048x2048x2048;pick=
2026-03-02T09:58:09.618770+00:00,U,training_style,eval,training_style_eval_005,1024,512,1536,bf16,NVIDIA GeForce RTX 4060,c03,64,64,32,4,2,8,0.0,0.0,85.82399785518646,97.2380820661783,18.766461319101417,3,2,3,fixed_c03,0,fixed_static_cfg;ref_shape=2048x2048x2048;pick=
2026-03-02T09:58:09.666040+00:00,U,training_style,eval,training_style_eval_006,2048,1536,2048,bf16,NVIDIA GeForce RTX 4060,c03,64,64,32,4,2,8,0.0,0.0,411.98399662971497,426.56767904758453,31.27524853733762,3,3,3,fixed_c03,0,fixed_static_cfg;ref_shape=2048x2048x2048;pick=
2026-03-02T09:58:09.698208+00:00,U,training_style,eval,training_style_eval_007,1536,2048,1024,bf16,NVIDIA GeForce RTX 4060,c03,64,64,32,4,2,8,0.0,0.0,228.5279929637909,317.26591944694513,28.191080053027786,3,3,3,fixed_c03,0,fixed_static_cfg;ref_shape=2048x2048x2048;pick=
2026-03-02T09:58:09.711147+00:00,U,training_style,eval,training_style_eval_008,512,512,2048,bf16,NVIDIA GeForce RTX 4060,c03,64,64,32,4,2,8,0.0,0.0,76.80000364780426,102.11616016924376,13.981012669270863,2,2,3,fixed_c03,0,fixed_static_cfg;ref_shape=2048x2048x2048;pick=
2026-03-02T09:58:09.728829+00:00,U,training_style,eval,training_style_eval_009,1024,512,2048,bf16,NVIDIA GeForce RTX 4060,c03,64,64,32,4,2,8,0.0,0.0,100.39999708533287,163.1056019663809,21.389279983492344,3,2,3,fixed_c03,0,fixed_static_cfg;ref_shape=2048x2048x2048;pick=
2026-03-02T09:58:09.769543+00:00,U,training_style,eval,training_style_eval_010,2048,3072,1024,bf16,NVIDIA GeForce RTX 4060,c03,64,64,32,4,2,8,0.0,0.0,417.7919924259186,467.35359400510777,30.84047114733705,3,3,3,fixed_c03,0,fixed_static_cfg;ref_shape=2048x2048x2048;pick=
2026-03-02T09:58:09.849030+00:00,U,training_style,eval,training_style_eval_011,2048,4096,1536,bf16,NVIDIA GeForce RTX 4060,c03,64,64,32,4,2,8,0.0,0.0,800.1759946346283,862.2150403261185,32.20516979863518,3,3,3,fixed_c03,0,fixed_static_cfg;ref_shape=2048x2048x2048;pick=
2026-03-02T09:58:09.977221+00:00,U,training_style,eval,training_style_eval_012,2048,3072,3072,bf16,NVIDIA GeForce RTX 4060,c03,64,64,32,4,2,8,0.0,0.0,1200.6399631500244,1312.067528963089,32.19508499665853,3,3,3,fixed_c03,0,fixed_static_cfg;ref_shape=2048x2048x2048;pick=
2026-03-02T09:58:10.039214+00:00,U,training_style,eval,training_style_eval_013,3072,1536,1536,bf16,NVIDIA GeForce RTX 4060,c03,64,64,32,4,2,8,0.0,0.0,460.7999920845032,550.8780938386917,31.457280540364593,3,3,3,fixed_c03,0,fixed_static_cfg;ref_shape=2048x2048x2048;pick=
2026-03-02T09:58:10.077683+00:00,U,training_style,eval,training_style_eval_014,2048,1536,1536,bf16,NVIDIA GeForce RTX 4060,c03,64,64,32,4,2,8,0.0,0.0,302.0160049200058,330.43680876493454,31.99723279088998,3,3,3,fixed_c03,0,fixed_static_cfg;ref_shape=2048x2048x2048;pick=
2026-03-02T09:58:10.131936+00:00,U,training_style,eval,training_style_eval_015,4096,2048,1024,bf16,NVIDIA GeForce RTX 4060,c03,64,64,32,4,2,8,0.0,0.0,543.4080064296722,582.7139258384705,31.61504611769723,3,3,3,fixed_c03,0,fixed_static_cfg;ref_shape=2048x2048x2048;pick=
2026-03-02T09:58:10.147635+00:00,U,training_style,eval,training_style_eval_016,2048,1024,512,bf16,NVIDIA GeForce RTX 4060,c03,64,64,32,4,2,8,0.0,0.0,100.35199671983719,182.70496144890785,21.399510903558273,3,3,2,fixed_c03,0,fixed_static_cfg;ref_shape=2048x2048x2048;pick=
2026-03-02T09:58:10.263300+00:00,U,training_style,eval,training_style_eval_017,2048,4096,2048,bf16,NVIDIA GeForce RTX 4060,c03,64,64,32,4,2,8,0.0,0.0,1094.0799713134766,1145.3107678890228,31.405143379738576,3,3,3,fixed_c03,0,fixed_static_cfg;ref_shape=2048x2048x2048;pick=
2026-03-02T09:58:10.334387+00:00,U,training_style,eval,training_style_eval_018,1536,2048,3072,bf16,NVIDIA GeForce RTX 4060,c03,64,64,32,4,2,8,0.0,0.0,584.496021270752,660.5209523439407,33.066696998177044,3,3,3,fixed_c03,0,fixed_static_cfg;ref_shape=2048x2048x2048;pick=
2026-03-02T09:58:10.401767+00:00,U,training_style,eval,training_style_eval_019,1536,1536,3072,bf16,NVIDIA GeForce RTX 4060,c03,64,64,32,4,2,8,0.0,0.0,487.8399968147278,632.5216007232664,29.713665789287706,3,3,3,fixed_c03,0,fixed_static_cfg;ref_shape=2048x2048x2048;pick=
2026-03-02T09:58:10.472005+00:00,U,training_style,eval,training_style_eval_020,3072,1536,2048,bf16,NVIDIA GeForce RTX 4060,c03,64,64,32,4,2,8,0.0,0.0,576.5119791030884,732.4876815080643,33.52463354199271,3,3,3,fixed_c03,0,fixed_static_cfg;ref_shape=2048x2048x2048;pick=
2026-03-02T09:58:10.558605+00:00,U,training_style,eval,training_style_eval_021,2048,1024,4096,bf16,NVIDIA GeForce RTX 4060,c03,64,64,32,4,2,8,0.0,0.0,560.912013053894,714.5062506198882,30.628456485472544,3,3,3,fixed_c03,0,fixed_static_cfg;ref_shape=2048x2048x2048;pick=
2026-03-02T09:58:10.569601+00:00,U,training_style,eval,training_style_eval_022,512,512,1536,bf16,NVIDIA GeForce RTX 4060,c03,64,64,32,4,2,8,0.0,0.0,62.463998794555664,117.70527757704245,12.892328117651509,2,2,3,fixed_c03,0,fixed_static_cfg;ref_shape=2048x2048x2048;pick=
2026-03-02T09:58:10.907177+00:00,U,training_style,eval,training_style_eval_023,3072,4096,4096,bf16,NVIDIA GeForce RTX 4060,c03,64,64,32,4,2,8,0.0,0.0,3315.7119750976562,3450.9210109710693,31.088108942564006,3,3,3,fixed_c03,0,fixed_static_cfg;ref_shape=2048x2048x2048;pick=
2026-03-02T09:58:10.981607+00:00,U,training_style,eval,training_style_eval_024,1536,1024,4096,bf16,NVIDIA GeForce RTX 4060,c03,64,64,32,4,2,8,0.0,0.0,418.09599101543427,594.9849605560303,30.818046967411238,3,3,3,fixed_c03,0,fixed_static_cfg;ref_shape=2048x2048x2048;pick=
2026-03-02T09:58:11.139367+00:00,U,training_style,eval,training_style_eval_025,4096,3072,2048,bf16,NVIDIA GeForce RTX 4060,c03,64,64,32,4,2,8,0.0,0.0,1615.8720254898071,1720.7091069221497,31.89584740559958,3,3,3,fixed_c03,0,fixed_static_cfg;ref_shape=2048x2048x2048;pick=
2026-03-02T09:58:11.154917+00:00,U,training_style,eval,training_style_eval_026,1024,512,512,bf16,NVIDIA GeForce RTX 4060,c03,64,64,32,4,2,8,0.0,0.0,53.29599976539612,110.96768267452705,10.07338101101873,3,2,2,fixed_c03,0,fixed_static_cfg;ref_shape=2048x2048x2048;pick=
2026-03-02T09:58:11.211003+00:00,U,training_style,eval,training_style_eval_027,2048,4096,1024,bf16,NVIDIA GeForce RTX 4060,c03,64,64,32,4,2,8,0.0,0.0,584.7039818763733,741.9331252574921,29.382165534204315,3,3,3,fixed_c03,0,fixed_static_cfg;ref_shape=2048x2048x2048;pick=
2026-03-02T09:58:11.234295+00:00,U,training_style,eval,training_style_eval_028,1536,1536,1024,bf16,NVIDIA GeForce RTX 4060,c03,64,64,32,4,2,8,0.0,0.0,185.13599783182144,195.64543902873993,26.09885848558349,3,3,3,fixed_c03,0,fixed_static_cfg;ref_shape=2048x2048x2048;pick=
2026-03-02T09:58:11.269250+00:00,U,training_style,eval,training_style_eval_029,1024,512,4096,bf16,NVIDIA GeForce RTX 4060,c03,64,64,32,4,2,8,0.0,0.0,204.81599867343903,313.0185613036155,20.969881863808624,3,2,3,fixed_c03,0,fixed_static_cfg;ref_shape=2048x2048x2048;pick=
2026-03-02T09:58:11.304103+00:00,U,training_style,eval,training_style_eval_030,1024,1024,3072,bf16,NVIDIA GeForce RTX 4060,c03,64,64,32,4,2,8,0.0,0.0,237.42400109767914,306.69856637716293,27.134792246001687,3,3,3,fixed_c03,0,fixed_static_cfg;ref_shape=2048x2048x2048;pick=
2026-03-02T09:58:11.314248+00:00,U,training_style,eval,training_style_eval_031,1024,1024,512,bf16,NVIDIA GeForce RTX 4060,c03,64,64,32,4,2,8,0.0,0.0,66.64000079035759,126.5833647549152,16.112572197858736,3,3,2,fixed_c03,0,fixed_static_cfg;ref_shape=2048x2048x2048;pick=
2026-03-02T09:58:11.324856+00:00,U,training_style,eval,training_style_eval_032,512,1024,1024,bf16,NVIDIA GeForce RTX 4060,c03,64,64,32,4,2,8,0.0,0.0,63.48799914121628,83.68415996432304,16.91251635780295,2,3,3,fixed_c03,0,fixed_static_cfg;ref_shape=2048x2048x2048;pick=
2026-03-02T09:58:11.404246+00:00,U,training_style,eval,training_style_eval_033,3072,2048,2048,bf16,NVIDIA GeForce RTX 4060,c03,64,64,32,4,2,8,0.0,0.0,793.9999997615814,843.9238339662552,32.45567227171037,3,3,3,fixed_c03,0,fixed_static_cfg;ref_shape=2048x2048x2048;pick=
2026-03-02T09:58:11.421289+00:00,U,training_style,eval,training_style_eval_034,1536,1024,512,bf16,NVIDIA GeForce RTX 4060,c03,64,64,32,4,2,8,0.0,0.0,86.01599931716919,183.5705623030662,18.72457157721487,3,3,2,fixed_c03,0,fixed_static_cfg;ref_shape=2048x2048x2048;pick=
2026-03-02T09:58:11.845503+00:00,U,training_style,eval,training_style_eval_035,4096,4096,4096,bf16,NVIDIA GeForce RTX 4060,c03,64,64,32,4,2,8,0.0,0.0,4387.920141220093,4603.576316833496,31.322118235676026,3,3,3,fixed_c03,0,fixed_static_cfg;ref_shape=2048x2048x2048;pick=
2026-03-02T09:58:12.089283+00:00,U,training_style,eval,training_style_eval_036,2048,4096,4096,bf16,NVIDIA GeForce RTX 4060,c03,64,64,32,4,2,8,0.0,0.0,2084.7039222717285,2210.836386680603,32.96366261023556,3,3,3,fixed_c03,0,fixed_static_cfg;ref_shape=2048x2048x2048;pick=
2026-03-02T09:58:12.128356+00:00,U,training_style,eval,training_style_eval_037,4096,2048,512,bf16,NVIDIA GeForce RTX 4060,c03,64,64,32,4,2,8,0.0,0.0,313.29600512981415,336.4147186279297,27.417951238927426,3,3,2,fixed_c03,0,fixed_static_cfg;ref_shape=2048x2048x2048;pick=
2026-03-02T09:58:12.147098+00:00,U,training_style,eval,training_style_eval_038,2048,1536,512,bf16,NVIDIA GeForce RTX 4060,c03,64,64,32,4,2,8,0.0,0.0,152.41600573062897,168.49920123815536,21.134430446189512,3,3,2,fixed_c03,0,fixed_static_cfg;ref_shape=2048x2048x2048;pick=
2026-03-02T09:58:12.238304+00:00,U,training_style,eval,training_style_eval_039,3072,3072,1536,bf16,NVIDIA GeForce RTX 4060,c03,64,64,32,4,2,8,0.0,0.0,900.9760022163391,1055.5801451206205,32.177360081382915,3,3,3,fixed_c03,0,fixed_static_cfg;ref_shape=2048x2048x2048;pick=
2026-03-02T09:58:12.260916+00:00,U,training_style,eval,training_style_eval_040,1536,1536,512,bf16,NVIDIA GeForce RTX 4060,c03,64,64,32,4,2,8,0.0,0.0,114.17600139975548,323.46048325300194,21.159605121756996,3,3,2,fixed_c03,0,fixed_static_cfg;ref_shape=2048x2048x2048;pick=
2026-03-02T09:58:12.375663+00:00,U,training_style,eval,training_style_eval_041,3072,3072,2048,bf16,NVIDIA GeForce RTX 4060,c03,64,64,32,4,2,8,0.0,0.0,1185.2800250053406,1342.9276454448695,32.612298232078814,3,3,3,fixed_c03,0,fixed_static_cfg;ref_shape=2048x2048x2048;pick=
2026-03-02T09:58:12.501729+00:00,U,training_style,eval,training_style_eval_042,3072,4096,1536,bf16,NVIDIA GeForce RTX 4060,c03,64,64,32,4,2,8,0.0,0.0,1210.3360295295715,1258.6393463611603,31.93716845645267,3,3,3,fixed_c03,0,fixed_static_cfg;ref_shape=2048x2048x2048;pick=
2026-03-02T09:58:12.566529+00:00,U,training_style,eval,training_style_eval_043,2048,3072,1536,bf16,NVIDIA GeForce RTX 4060,c03,64,64,32,4,2,8,0.0,0.0,612.8800213336945,666.6624087095261,31.535295913124315,3,3,3,fixed_c03,0,fixed_static_cfg;ref_shape=2048x2048x2048;pick=
2026-03-02T09:58:12.588893+00:00,U,training_style,eval,training_style_eval_044,512,512,4096,bf16,NVIDIA GeForce RTX 4060,c03,64,64,32,4,2,8,0.0,0.0,119.02400106191635,133.66688042879105,18.042442102772853,2,2,3,fixed_c03,0,fixed_static_cfg;ref_shape=2048x2048x2048;pick=
2026-03-02T09:58:12.646841+00:00,U,training_style,eval,training_style_eval_045,2048,1024,3072,bf16,NVIDIA GeForce RTX 4060,c03,64,64,32,4,2,8,0.0,0.0,422.35198616981506,534.9248200654984,30.50749685078873,3,3,3,fixed_c03,0,fixed_static_cfg;ref_shape=2048x2048x2048;pick=
2026-03-02T09:58:12.975487+00:00,U,training_style,eval,training_style_eval_046,4096,3072,4096,bf16,NVIDIA GeForce RTX 4060,c03,64,64,32,4,2,8,0.0,0.0,3332.6081037521362,3446.219274997711,30.93049404397252,3,3,3,fixed_c03,0,fixed_static_cfg;ref_shape=2048x2048x2048;pick=
2026-03-02T09:58:13.023798+00:00,U,training_style,eval,training_style_eval_047,1536,3072,1024,bf16,NVIDIA GeForce RTX 4060,c03,64,64,32,4,2,8,0.0,0.0,329.71200346946716,378.1881681084632,29.309446772673837,3,3,3,fixed_c03,0,fixed_static_cfg;ref_shape=2048x2048x2048;pick=
2026-03-02T09:58:13.043059+00:00,U,training_style,eval,training_style_eval_048,512,512,3072,bf16,NVIDIA GeForce RTX 4060,c03,64,64,32,4,2,8,0.0,0.0,101.32799670100212,190.6278373301029,15.895041730200033,2,2,3,fixed_c03,0,fixed_static_cfg;ref_shape=2048x2048x2048;pick=
2026-03-02T09:58:13.076653+00:00,U,training_style,eval,training_style_eval_049,512,1024,4096,bf16,NVIDIA GeForce RTX 4060,c03,64,64,32,4,2,8,0.0,0.0,183.18399786949158,300.68352043628687,23.446192603897234,2,3,3,fixed_c03,0,fixed_static_cfg;ref_shape=2048x2048x2048;pick=
2026-03-02T09:58:13.100935+00:00,U,training_style,eval,training_style_eval_050,3072,2048,512,bf16,NVIDIA GeForce RTX 4060,c03,64,64,32,4,2,8,0.0,0.0,223.07199984788895,264.04544234275807,28.880589892021664,3,3,2,fixed_c03,0,fixed_static_cfg;ref_shape=2048x2048x2048;pick=
2026-03-02T09:58:13.109228+00:00,U,training_style,eval,training_style_eval_051,512,512,1024,bf16,NVIDIA GeForce RTX 4060,c03,64,64,32,4,2,8,0.0,0.0,52.032001316547394,81.59359764307729,10.318090759835188,2,2,3,fixed_c03,0,fixed_static_cfg;ref_shape=2048x2048x2048;pick=
2026-03-02T09:58:13.147179+00:00,U,training_style,eval,training_style_eval_052,1536,2048,1536,bf16,NVIDIA GeForce RTX 4060,c03,64,64,32,4,2,8,0.0,0.0,321.8879997730255,425.0208085775375,30.021859848190044,3,3,3,fixed_c03,0,fixed_static_cfg;ref_shape=2048x2048x2048;pick=
2026-03-02T09:58:13.254545+00:00,U,training_style,eval,training_style_eval_053,1536,3072,3072,bf16,NVIDIA GeForce RTX 4060,c03,64,64,32,4,2,8,0.0,0.0,904.1439890861511,1059.274184703827,32.064615368733705,3,3,3,fixed_c03,0,fixed_static_cfg;ref_shape=2048x2048x2048;pick=
2026-03-02T09:58:13.302224+00:00,U,training_style,eval,training_style_eval_054,4096,3072,512,bf16,NVIDIA GeForce RTX 4060,c03,64,64,32,4,2,8,0.0,0.0,422.84800112247467,494.7763311862945,30.471710529070204,3,3,2,fixed_c03,0,fixed_static_cfg;ref_shape=2048x2048x2048;pick=
2026-03-02T09:58:13.321711+00:00,U,training_style,eval,training_style_eval_055,1024,1024,1024,bf16,NVIDIA GeForce RTX 4060,c03,64,64,32,4,2,8,0.0,0.0,104.8320010304451,169.04576376080507,20.48500101964411,3,3,3,fixed_c03,0,fixed_static_cfg;ref_shape=2048x2048x2048;pick=
2026-03-02T09:58:13.350577+00:00,U,training_style,eval,training_style_eval_056,512,1024,3072,bf16,NVIDIA GeForce RTX 4060,c03,64,64,32,4,2,8,0.0,0.0,141.31200313568115,174.74560320377344,22.795129928963856,2,3,3,fixed_c03,0,fixed_static_cfg;ref_shape=2048x2048x2048;pick=
2026-03-02T09:58:13.369463+00:00,U,training_style,eval,training_style_eval_057,1024,1536,1024,bf16,NVIDIA GeForce RTX 4060,c03,64,64,32,4,2,8,0.0,0.0,123.90399724245071,136.42912596464154,25.997752644709486,3,3,3,fixed_c03,0,fixed_static_cfg;ref_shape=2048x2048x2048;pick=
2026-03-02T09:58:13.484811+00:00,U,training_style,eval,training_style_eval_058,4096,2048,2048,bf16,NVIDIA GeForce RTX 4060,c03,64,64,32,4,2,8,0.0,0.0,1028.0799865722656,1193.1203389167786,33.421269567321545,3,3,3,fixed_c03,0,fixed_static_cfg;ref_shape=2048x2048x2048;pick=
2026-03-02T09:58:13.509123+00:00,U,training_style,eval,training_style_eval_059,2048,3072,512,bf16,NVIDIA GeForce RTX 4060,c03,64,64,32,4,2,8,0.0,0.0,223.66400063037872,313.62047791481,28.80414785500786,3,3,2,fixed_c03,0,fixed_static_cfg;ref_shape=2048x2048x2048;pick=
2026-03-02T09:58:13.541939+00:00,U,training_style,eval,training_style_eval_060,3072,3072,512,bf16,NVIDIA GeForce RTX 4060,c03,64,64,32,4,2,8,0.0,0.0,321.8560069799423,447.9020819067954,30.024844049600816,3,3,2,fixed_c03,0,fixed_static_cfg;ref_shape=2048x2048x2048;pick=
2026-03-02T09:58:13.604340+00:00,U,training_style,eval,training_style_eval_061,2048,2048,2048,bf16,NVIDIA GeForce RTX 4060,c03,64,64,32,4,2,8,0.0,0.0,548.6719906330109,579.4771271944046,31.311729917503776,3,3,3,fixed_c03,0,fixed_static_cfg;ref_shape=2048x2048x2048;pick=
2026-03-02T09:58:13.618602+00:00,U,training_style,eval,training_style_eval_062,1024,2048,512,bf16,NVIDIA GeForce RTX 4060,c03,64,64,32,4,2,8,0.0,0.0,103.42399775981903,156.64127707481373,20.763881637867925,3,3,2,fixed_c03,0,fixed_static_cfg;ref_shape=2048x2048x2048;pick=
2026-03-02T09:58:13.729892+00:00,U,training_style,eval,training_style_eval_063,3072,1536,3072,bf16,NVIDIA GeForce RTX 4060,c03,64,64,32,4,2,8,0.0,0.0,889.3119990825653,950.2924734354019,32.5993906277075,3,3,3,fixed_c03,0,fixed_static_cfg;ref_shape=2048x2048x2048;pick=
2026-03-02T09:58:13.741488+00:00,U,adversarial,tune,adversarial_tune_000,1,1024,1024,bf16,NVIDIA GeForce RTX 4060,c03,64,64,32,4,2,8,0.0,0.0,67.20000132918358,295.096322000026,0.03120761843034741,0,3,3,fixed_c03,0,fixed_static_cfg;ref_shape=2048x2048x2048;pick=
2026-03-02T09:58:13.761471+00:00,U,adversarial,tune,adversarial_tune_001,1,1024,4096,bf16,NVIDIA GeForce RTX 4060,c03,64,64,32,4,2,8,0.0,0.0,69.07200068235397,147.94432044029233,0.12144730016692658,0,3,3,fixed_c03,0,fixed_static_cfg;ref_shape=2048x2048x2048;pick=
2026-03-02T09:58:13.780071+00:00,U,adversarial,tune,adversarial_tune_002,1,4096,1024,bf16,NVIDIA GeForce RTX 4060,c03,64,64,32,4,2,8,0.0,0.0,76.11200213432312,155.16672402620316,0.11021399732982601,0,3,3,fixed_c03,0,fixed_static_cfg;ref_shape=2048x2048x2048;pick=
2026-03-02T09:58:13.873464+00:00,U,adversarial,tune,adversarial_tune_003,1,4096,4096,bf16,NVIDIA GeForce RTX 4060,c03,64,64,32,4,2,8,0.0,0.0,188.4160041809082,265.781446993351,0.17808695257003015,0,3,3,fixed_c03,0,fixed_static_cfg;ref_shape=2048x2048x2048;pick=
2026-03-02T09:58:13.918290+00:00,U,adversarial,tune,adversarial_tune_004,1,8192,1024,bf16,NVIDIA GeForce RTX 4060,c03,64,64,32,4,2,8,0.0,0.0,94.2080020904541,167.99680292606348,0.17808695257003015,0,3,3,fixed_c03,0,fixed_static_cfg;ref_shape=2048x2048x2048;pick=
2026-03-02T09:58:14.089738+00:00,U,adversarial,tune,adversarial_tune_005,1,8192,4096,bf16,NVIDIA GeForce RTX 4060,c03,64,64,32,4,2,8,0.0,0.0,359.21598970890045,418.6566540598867,0.1868203697012021,0,3,3,fixed_c03,0,fixed_static_cfg;ref_shape=2048x2048x2048;pick=
2026-03-02T09:58:14.100624+00:00,U,adversarial,tune,adversarial_tune_006,2,1024,1024,bf16,NVIDIA GeForce RTX 4060,c03,64,64,32,4,2,8,0.0,0.0,61.99999898672104,164.25248265266418,0.0676500656217482,0,3,3,fixed_c03,0,fixed_static_cfg;ref_shape=2048x2048x2048;pick=
2026-03-02T09:58:14.121810+00:00,U,adversarial,tune,adversarial_tune_007,2,1024,4096,bf16,NVIDIA GeForce RTX 4060,c03,64,64,32,4,2,8,0.0,0.0,73.64800199866295,215.5827221274376,0.22780273116308822,0,3,3,fixed_c03,0,fixed_static_cfg;ref_shape=2048x2048x2048;pick=
2026-03-02T09:58:14.140525+00:00,U,adversarial,tune,adversarial_tune_008,2,4096,1024,bf16,NVIDIA GeForce RTX 4060,c03,64,64,32,4,2,8,0.0,0.0,55.63200078904629,179.31487977504716,0.3015749166314968,0,3,3,fixed_c03,0,fixed_static_cfg;ref_shape=2048x2048x2048;pick=
2026-03-02T09:58:14.224689+00:00,U,adversarial,tune,adversarial_tune_009,2,4096,4096,bf16,NVIDIA GeForce RTX 4060,c03,64,64,32,4,2,8,0.0,0.0,165.8879965543747,282.32704222202295,0.4045432182792266,0,3,3,fixed_c03,0,fixed_static_cfg;ref_shape=2048x2048x2048;pick=
2026-03-02T09:58:14.268880+00:00,U,adversarial,tune,adversarial_tune_010,2,8192,1024,bf16,NVIDIA GeForce RTX 4060,c03,64,64,32,4,2,8,0.0,0.0,65.23199751973152,144.5801591873168,0.5143860877455175,0,3,3,fixed_c03,0,fixed_static_cfg;ref_shape=2048x2048x2048;pick=
2026-03-02T09:58:14.441116+00:00,U,adversarial,tune,adversarial_tune_011,2,8192,4096,bf16,NVIDIA GeForce RTX 4060,c03,64,64,32,4,2,8,0.0,0.0,338.25598657131195,475.8016011118889,0.3967933557081447,0,3,3,fixed_c03,0,fixed_static_cfg;ref_shape=2048x2048x2048;pick=
2026-03-02T09:58:14.449069+00:00,U,adversarial,tune,adversarial_tune_012,4,1024,1024,bf16,NVIDIA GeForce RTX 4060,c03,64,64,32,4,2,8,0.0,0.0,38.91199827194214,48.01824055612087,0.21557895694214924,0,3,3,fixed_c03,0,fixed_static_cfg;ref_shape=2048x2048x2048;pick=
2026-03-02T09:58:14.467802+00:00,U,adversarial,tune,adversarial_tune_013,4,1024,4096,bf16,NVIDIA GeForce RTX 4060,c03,64,64,32,4,2,8,0.0,0.0,67.58400052785873,110.27648381888852,0.49648484460709846,0,3,3,fixed_c03,0,fixed_static_cfg;ref_shape=2048x2048x2048;pick=
2026-03-02T09:58:14.486047+00:00,U,adversarial,tune,adversarial_tune_014,4,4096,1024,bf16,NVIDIA GeForce RTX 4060,c03,64,64,32,4,2,8,0.0,0.0,45.21600157022476,158.033921048045,0.742091977060085,0,3,3,fixed_c03,0,fixed_static_cfg;ref_shape=2048x2048x2048;pick=
2026-03-02T09:58:14.566184+00:00,U,adversarial,tune,adversarial_tune_015,4,4096,4096,bf16,NVIDIA GeForce RTX 4060,c03,64,64,32,4,2,8,0.0,0.0,160.65599769353867,208.0911992490291,0.8354355263849451,0,3,3,fixed_c03,0,fixed_static_cfg;ref_shape=2048x2048x2048;pick=
2026-03-02T09:58:14.605619+00:00,U,adversarial,tune,adversarial_tune_016,4,8192,1024,bf16,NVIDIA GeForce RTX 4060,c03,64,64,32,4,2,8,0.0,0.0,64.4799992442131,107.76576288044447,1.0407702355242012,0,3,3,fixed_c03,0,fixed_static_cfg;ref_shape=2048x2048x2048;pick=
2026-03-02T09:58:14.768120+00:00,U,adversarial,tune,adversarial_tune_017,4,8192,4096,bf16,NVIDIA GeForce RTX 4060,c03,64,64,32,4,2,8,0.0,0.0,342.00000762939453,446.9862461090088,0.7848989766423861,0,3,3,fixed_c03,0,fixed_static_cfg;ref_shape=2048x2048x2048;pick=
2026-03-02T09:58:14.776702+00:00,U,adversarial,tune,adversarial_tune_018,8,1024,1024,bf16,NVIDIA GeForce RTX 4060,c03,64,64,32,4,2,8,0.0,0.0,47.10400104522705,206.58176228404008,0.3561739051400603,0,3,3,fixed_c03,0,fixed_static_cfg;ref_shape=2048x2048x2048;pick=
2026-03-02T09:58:14.795646+00:00,U,adversarial,tune,adversarial_tune_019,8,1024,4096,bf16,NVIDIA GeForce RTX 4060,c03,64,64,32,4,2,8,0.0,0.0,68.54400038719177,147.86847710609436,0.9790625528261414,0,3,3,fixed_c03,0,fixed_static_cfg;ref_shape=2048x2048x2048;pick=
2026-03-02T09:58:14.811950+00:00,U,adversarial,tune,adversarial_tune_020,8,4096,1024,bf16,NVIDIA GeForce RTX 4060,c03,64,64,32,4,2,8,0.0,0.0,48.86399954557419,120.82176350057117,1.3733804973825219,0,3,3,fixed_c03,0,fixed_static_cfg;ref_shape=2048x2048x2048;pick=
2026-03-02T09:58:14.896676+00:00,U,adversarial,tune,adversarial_tune_021,8,4096,4096,bf16,NVIDIA GeForce RTX 4060,c03,64,64,32,4,2,8,0.0,0.0,164.15999829769135,201.99839740991587,1.6352062547735486,0,3,3,fixed_c03,0,fixed_static_cfg;ref_shape=2048x2048x2048;pick=
2026-03-02T09:58:14.940724+00:00,U,adversarial,tune,adversarial_tune_022,8,8192,1024,bf16,NVIDIA GeForce RTX 4060,c03,64,64,32,4,2,8,0.0,0.0,74.75200295448303,167.04768329858774,1.7955067783498193,0,3,3,fixed_c03,0,fixed_static_cfg;ref_shape=2048x2048x2048;pick=
2026-03-02T09:58:15.123806+00:00,U,adversarial,tune,adversarial_tune_023,8,8192,4096,bf16,NVIDIA GeForce RTX 4060,c03,64,64,32,4,2,8,0.0,0.0,336.89600229263306,364.6572771668434,1.5935805362678828,0,3,3,fixed_c03,0,fixed_static_cfg;ref_shape=2048x2048x2048;pick=
2026-03-02T09:58:15.132436+00:00,U,adversarial,tune,adversarial_tune_024,16,1024,1024,bf16,NVIDIA GeForce RTX 4060,c03,64,64,32,4,2,8,0.0,0.0,37.88800165057182,123.81472006440163,0.8856215830399591,0,3,3,fixed_c03,0,fixed_static_cfg;ref_shape=2048x2048x2048;pick=
2026-03-02T09:58:15.154801+00:00,U,adversarial,tune,adversarial_tune_025,16,1024,4096,bf16,NVIDIA GeForce RTX 4060,c03,64,64,32,4,2,8,0.0,0.0,93.18400174379349,151.8524751067161,1.4403516213977101,0,3,3,fixed_c03,0,fixed_static_cfg;ref_shape=2048x2048x2048;pick=
2026-03-02T09:58:15.174978+00:00,U,adversarial,tune,adversarial_tune_026,16,4096,1024,bf16,NVIDIA GeForce RTX 4060,c03,64,64,32,4,2,8,0.0,0.0,67.90399923920631,203.26464027166355,1.9765806064999123,0,3,3,fixed_c03,0,fixed_static_cfg;ref_shape=2048x2048x2048;pick=
2026-03-02T09:58:15.262604+00:00,U,adversarial,tune,adversarial_tune_027,16,4096,4096,bf16,NVIDIA GeForce RTX 4060,c03,64,64,32,4,2,8,0.0,0.0,162.09600120782852,268.41856807470316,3.3120552512067247,0,3,3,fixed_c03,0,fixed_static_cfg;ref_shape=2048x2048x2048;pick=
2026-03-02T09:58:15.302522+00:00,U,adversarial,tune,adversarial_tune_028,16,8192,1024,bf16,NVIDIA GeForce RTX 4060,c03,64,64,32,4,2,8,0.0,0.0,68.59200075268745,72.5520009547472,3.913509637484698,0,3,3,fixed_c03,0,fixed_static_cfg;ref_shape=2048x2048x2048;pick=
2026-03-02T09:58:15.473828+00:00,U,adversarial,tune,adversarial_tune_029,16,8192,4096,bf16,NVIDIA GeForce RTX 4060,c03,64,64,32,4,2,8,0.0,0.0,397.3119854927063,442.2479999065398,2.7025155625961133,0,3,3,fixed_c03,0,fixed_static_cfg;ref_shape=2048x2048x2048;pick=
2026-03-02T09:58:15.491910+00:00,U,adversarial,tune,adversarial_tune_030,32,1024,1024,bf16,NVIDIA GeForce RTX 4060,c03,64,64,32,4,2,8,0.0,0.0,76.80000364780426,188.78912344574917,0.8738132918294289,0,3,3,fixed_c03,0,fixed_static_cfg;ref_shape=2048x2048x2048;pick=
2026-03-02T09:58:15.515079+00:00,U,adversarial,tune,adversarial_tune_031,32,1024,4096,bf16,NVIDIA GeForce RTX 4060,c03,64,64,32,4,2,8,0.0,0.0,110.59200018644333,255.86016759276373,2.4272592551672245,0,3,3,fixed_c03,0,fixed_static_cfg;ref_shape=2048x2048x2048;pick=
2026-03-02T09:58:15.525554+00:00,U,adversarial,eval,adversarial_eval_000,1,1024,1024,bf16,NVIDIA GeForce RTX 4060,c03,64,64,32,4,2,8,0.0,0.0,55.296000093221664,115.31103700399385,0.03792592586198788,0,3,3,fixed_c03,0,fixed_static_cfg;ref_shape=2048x2048x2048;pick=
2026-03-02T09:58:15.548406+00:00,U,adversarial,eval,adversarial_eval_001,1,1024,4096,bf16,NVIDIA GeForce RTX 4060,c03,64,64,32,4,2,8,0.0,0.0,104.44799810647964,166.79616317152977,0.08031372694619023,0,3,3,fixed_c03,0,fixed_static_cfg;ref_shape=2048x2048x2048;pick=
2026-03-02T09:58:15.567536+00:00,U,adversarial,eval,adversarial_eval_002,1,4096,1024,bf16,NVIDIA GeForce RTX 4060,c03,64,64,32,4,2,8,0.0,0.0,71.53600081801414,84.11871947348118,0.11726414538241264,0,3,3,fixed_c03,0,fixed_static_cfg;ref_shape=2048x2048x2048;pick=
2026-03-02T09:58:15.652410+00:00,U,adversarial,eval,adversarial_eval_003,1,4096,4096,bf16,NVIDIA GeForce RTX 4060,c03,64,64,32,4,2,8,0.0,0.0,175.50400644540787,226.9008013606071,0.19118898012415128,0,3,3,fixed_c03,0,fixed_static_cfg;ref_shape=2048x2048x2048;pick=
2026-03-02T09:58:15.696448+00:00,U,adversarial,eval,adversarial_eval_004,1,8192,1024,bf16,NVIDIA GeForce RTX 4060,c03,64,64,32,4,2,8,0.0,0.0,98.7360030412674,176.5580800175666,0.16991994291067108,0,3,3,fixed_c03,0,fixed_static_cfg;ref_shape=2048x2048x2048;pick=
2026-03-02T09:58:15.862479+00:00,U,adversarial,eval,adversarial_eval_005,1,8192,4096,bf16,NVIDIA GeForce RTX 4060,c03,64,64,32,4,2,8,0.0,0.0,372.73600697517395,617.6854580640791,0.18004395267471376,0,3,3,fixed_c03,0,fixed_static_cfg;ref_shape=2048x2048x2048;pick=
2026-03-02T09:58:15.872869+00:00,U,adversarial,eval,adversarial_eval_006,2,1024,1024,bf16,NVIDIA GeForce RTX 4060,c03,64,64,32,4,2,8,0.0,0.0,50.11200159788132,193.6915189027784,0.08369859247804085,0,3,3,fixed_c03,0,fixed_static_cfg;ref_shape=2048x2048x2048;pick=
2026-03-02T09:58:15.895830+00:00,U,adversarial,eval,adversarial_eval_007,2,1024,4096,bf16,NVIDIA GeForce RTX 4060,c03,64,64,32,4,2,8,0.0,0.0,105.39199784398079,193.55648592114449,0.15918870828159548,0,3,3,fixed_c03,0,fixed_static_cfg;ref_shape=2048x2048x2048;pick=
2026-03-02T09:58:15.913644+00:00,U,adversarial,eval,adversarial_eval_008,2,4096,1024,bf16,NVIDIA GeForce RTX 4060,c03,64,64,32,4,2,8,0.0,0.0,71.68000191450119,86.57919950783253,0.23405713660571054,0,3,3,fixed_c03,0,fixed_static_cfg;ref_shape=2048x2048x2048;pick=
2026-03-02T09:58:16.000777+00:00,U,adversarial,eval,adversarial_eval_009,2,4096,4096,bf16,NVIDIA GeForce RTX 4060,c03,64,64,32,4,2,8,0.0,0.0,253.42398881912231,331.85791313648224,0.26480864859205566,0,3,3,fixed_c03,0,fixed_static_cfg;ref_shape=2048x2048x2048;pick=
2026-03-02T09:58:16.047145+00:00,U,adversarial,eval,adversarial_eval_010,2,8192,1024,bf16,NVIDIA GeForce RTX 4060,c03,64,64,32,4,2,8,0.0,0.0,102.33599692583084,218.58976170420635,0.3278849379296998,0,3,3,fixed_c03,0,fixed_static_cfg;ref_shape=2048x2048x2048;pick=
2026-03-02T09:58:16.224356+00:00,U,adversarial,eval,adversarial_eval_011,2,8192,4096,bf16,NVIDIA GeForce RTX 4060,c03,64,64,32,4,2,8,0.0,0.0,574.975997209549,611.8912100791931,0.23343188002869728,0,3,3,fixed_c03,0,fixed_static_cfg;ref_shape=2048x2048x2048;pick=
2026-03-02T09:58:16.236483+00:00,U,adversarial,eval,adversarial_eval_012,4,1024,1024,bf16,NVIDIA GeForce RTX 4060,c03,64,64,32,4,2,8,0.0,0.0,59.39200147986412,132.7615964412689,0.14124137579104856,0,3,3,fixed_c03,0,fixed_static_cfg;ref_shape=2048x2048x2048;pick=
2026-03-02T09:58:16.259378+00:00,U,adversarial,eval,adversarial_eval_013,4,1024,4096,bf16,NVIDIA GeForce RTX 4060,c03,64,64,32,4,2,8,0.0,0.0,114.68800157308578,224.2342408001423,0.29257142455845464,0,3,3,fixed_c03,0,fixed_static_cfg;ref_shape=2048x2048x2048;pick=
2026-03-02T09:58:16.281150+00:00,U,adversarial,eval,adversarial_eval_014,4,4096,1024,bf16,NVIDIA GeForce RTX 4060,c03,64,64,32,4,2,8,0.0,0.0,99.32799637317657,188.43647673726082,0.33781444532451416,0,3,3,fixed_c03,0,fixed_static_cfg;ref_shape=2048x2048x2048;pick=
2026-03-02T09:58:16.369059+00:00,U,adversarial,eval,adversarial_eval_015,4,4096,4096,bf16,NVIDIA GeForce RTX 4060,c03,64,64,32,4,2,8,0.0,0.0,251.79199874401093,265.16895622015,0.5330500121906375,0,3,3,fixed_c03,0,fixed_static_cfg;ref_shape=2048x2048x2048;pick=
2026-03-02T09:58:16.413883+00:00,U,adversarial,eval,adversarial_eval_016,4,8192,1024,bf16,NVIDIA GeForce RTX 4060,c03,64,64,32,4,2,8,0.0,0.0,112.62400075793266,212.09920391440386,0.5958664542936971,0,3,3,fixed_c03,0,fixed_static_cfg;ref_shape=2048x2048x2048;pick=
2026-03-02T09:58:16.589720+00:00,U,adversarial,eval,adversarial_eval_017,4,8192,4096,bf16,NVIDIA GeForce RTX 4060,c03,64,64,32,4,2,8,0.0,0.0,557.0560097694397,586.2995356321335,0.4818823444901042,0,3,3,fixed_c03,0,fixed_static_cfg;ref_shape=2048x2048x2048;pick=
2026-03-02T09:58:16.599861+00:00,U,adversarial,eval,adversarial_eval_018,8,1024,1024,bf16,NVIDIA GeForce RTX 4060,c03,64,64,32,4,2,8,0.0,0.0,60.84799952805042,149.70879837870592,0.2757233784204498,0,3,3,fixed_c03,0,fixed_static_cfg;ref_shape=2048x2048x2048;pick=
2026-03-02T09:58:16.622071+00:00,U,adversarial,eval,adversarial_eval_019,8,1024,4096,bf16,NVIDIA GeForce RTX 4060,c03,64,64,32,4,2,8,0.0,0.0,123.29600006341934,152.73983955383295,0.5442906823050339,0,3,3,fixed_c03,0,fixed_static_cfg;ref_shape=2048x2048x2048;pick=
2026-03-02T09:58:16.641432+00:00,U,adversarial,eval,adversarial_eval_020,8,4096,1024,bf16,NVIDIA GeForce RTX 4060,c03,64,64,32,4,2,8,0.0,0.0,89.60000053048134,196.16768300533295,0.7489828527084663,0,3,3,fixed_c03,0,fixed_static_cfg;ref_shape=2048x2048x2048;pick=
2026-03-02T09:58:16.732364+00:00,U,adversarial,eval,adversarial_eval_021,8,4096,4096,bf16,NVIDIA GeForce RTX 4060,c03,64,64,32,4,2,8,0.0,0.0,262.4959945678711,406.7635193467137,1.0226268650000034,0,3,3,fixed_c03,0,fixed_static_cfg;ref_shape=2048x2048x2048;pick=
2026-03-02T09:58:16.780732+00:00,U,adversarial,eval,adversarial_eval_022,8,8192,1024,bf16,NVIDIA GeForce RTX 4060,c03,64,64,32,4,2,8,0.0,0.0,120.78400328755379,218.60639870166779,1.1112210586402256,0,3,3,fixed_c03,0,fixed_static_cfg;ref_shape=2048x2048x2048;pick=
2026-03-02T09:58:16.960574+00:00,U,adversarial,eval,adversarial_eval_023,8,8192,4096,bf16,NVIDIA GeForce RTX 4060,c03,64,64,32,4,2,8,0.0,0.0,592.7839875221252,625.6931185722351,0.9056771493510724,0,3,3,fixed_c03,0,fixed_static_cfg;ref_shape=2048x2048x2048;pick=
2026-03-02T09:58:16.972553+00:00,U,adversarial,eval,adversarial_eval_024,16,1024,1024,bf16,NVIDIA GeForce RTX 4060,c03,64,64,32,4,2,8,0.0,0.0,78.79999652504921,163.78879949450484,0.42581768375248097,0,3,3,fixed_c03,0,fixed_static_cfg;ref_shape=2048x2048x2048;pick=
2026-03-02T09:58:17.000785+00:00,U,adversarial,eval,adversarial_eval_025,16,1024,4096,bf16,NVIDIA GeForce RTX 4060,c03,64,64,32,4,2,8,0.0,0.0,140.27199894189835,224.1827169060707,0.95683906276686,0,3,3,fixed_c03,0,fixed_static_cfg;ref_shape=2048x2048x2048;pick=
2026-03-02T09:58:17.024916+00:00,U,adversarial,eval,adversarial_eval_026,16,4096,1024,bf16,NVIDIA GeForce RTX 4060,c03,64,64,32,4,2,8,0.0,0.0,108.5439994931221,207.11423546075815,1.2365283076611222,0,3,3,fixed_c03,0,fixed_static_cfg;ref_shape=2048x2048x2048;pick=
2026-03-02T09:58:17.126350+00:00,U,adversarial,eval,adversarial_eval_027,16,4096,4096,bf16,NVIDIA GeForce RTX 4060,c03,64,64,32,4,2,8,0.0,0.0,262.09600269794464,448.8703987002371,2.048375047591713,0,3,3,fixed_c03,0,fixed_static_cfg;ref_shape=2048x2048x2048;pick=
2026-03-02T09:58:17.172944+00:00,U,adversarial,eval,adversarial_eval_028,16,8192,1024,bf16,NVIDIA GeForce RTX 4060,c03,64,64,32,4,2,8,0.0,0.0,129.02399897575378,287.3516827821731,2.0805079530238744,0,3,3,fixed_c03,0,fixed_static_cfg;ref_shape=2048x2048x2048;pick=
2026-03-02T09:58:17.359115+00:00,U,adversarial,eval,adversarial_eval_029,16,8192,4096,bf16,NVIDIA GeForce RTX 4060,c03,64,64,32,4,2,8,0.0,0.0,585.5839848518372,696.4019471406937,1.8336256656193821,0,3,3,fixed_c03,0,fixed_static_cfg;ref_shape=2048x2048x2048;pick=
2026-03-02T09:58:17.368912+00:00,U,adversarial,eval,adversarial_eval_030,32,1024,1024,bf16,NVIDIA GeForce RTX 4060,c03,64,64,32,4,2,8,0.0,0.0,57.34400078654289,101.93760372698293,1.1702856982338186,0,3,3,fixed_c03,0,fixed_static_cfg;ref_shape=2048x2048x2048;pick=
2026-03-02T09:58:17.393829+00:00,U,adversarial,eval,adversarial_eval_031,32,1024,4096,bf16,NVIDIA GeForce RTX 4060,c03,64,64,32,4,2,8,0.0,0.0,142.2879993915558,231.51615247130383,1.8865642720951106,0,3,3,fixed_c03,0,fixed_static_cfg;ref_shape=2048x2048x2048;pick=
2026-03-02T09:58:17.416189+00:00,U,adversarial,eval,adversarial_eval_032,32,4096,1024,bf16,NVIDIA GeForce RTX 4060,c03,64,64,32,4,2,8,0.0,0.0,94.72000226378441,181.874880939722,2.833989121457555,0,3,3,fixed_c03,0,fixed_static_cfg;ref_shape=2048x2048x2048;pick=
2026-03-02T09:58:17.509188+00:00,U,adversarial,eval,adversarial_eval_033,32,4096,4096,bf16,NVIDIA GeForce RTX 4060,c03,64,64,32,4,2,8,0.0,0.0,260.0959986448288,299.02847677469254,4.128251990013258,0,3,3,fixed_c03,0,fixed_static_cfg;ref_shape=2048x2048x2048;pick=
2026-03-02T09:58:17.555383+00:00,U,adversarial,eval,adversarial_eval_034,32,8192,1024,bf16,NVIDIA GeForce RTX 4060,c03,64,64,32,4,2,8,0.0,0.0,136.19199395179749,161.8944026529789,3.9420152126564427,0,3,3,fixed_c03,0,fixed_static_cfg;ref_shape=2048x2048x2048;pick=
2026-03-02T09:58:17.734741+00:00,U,adversarial,eval,adversarial_eval_035,32,8192,4096,bf16,NVIDIA GeForce RTX 4060,c03,64,64,32,4,2,8,0.0,0.0,591.728001832962,717.7139455080032,3.629173609070151,0,3,3,fixed_c03,0,fixed_static_cfg;ref_shape=2048x2048x2048;pick=
2026-03-02T09:58:17.979507+00:00,U,adversarial,eval,adversarial_eval_036,1024,1,512,bf16,NVIDIA GeForce RTX 4060,c03,64,64,32,4,2,8,0.0,0.0,57.34400078654289,79.89951975643632,0.018285714034903415,3,0,2,fixed_c03,0,fixed_static_cfg;ref_shape=2048x2048x2048;pick=
2026-03-02T09:58:18.000135+00:00,U,adversarial,eval,adversarial_eval_037,1024,1,2048,bf16,NVIDIA GeForce RTX 4060,c03,64,64,32,4,2,8,0.0,0.0,137.2160017490387,318.61504614353163,0.030567163789476794,3,0,3,fixed_c03,0,fixed_static_cfg;ref_shape=2048x2048x2048;pick=
2026-03-02T09:58:18.011293+00:00,U,adversarial,eval,adversarial_eval_038,2048,1,512,bf16,NVIDIA GeForce RTX 4060,c03,64,64,32,4,2,8,0.0,0.0,86.01599931716919,177.4435240030288,0.024380952574498533,3,0,2,fixed_c03,0,fixed_static_cfg;ref_shape=2048x2048x2048;pick=
2026-03-02T09:58:18.036744+00:00,U,adversarial,eval,adversarial_eval_039,2048,1,2048,bf16,NVIDIA GeForce RTX 4060,c03,64,64,32,4,2,8,0.0,0.0,155.64799308776855,248.62719446420653,0.05389473923553731,3,0,3,fixed_c03,0,fixed_static_cfg;ref_shape=2048x2048x2048;pick=
2026-03-02T09:58:18.049777+00:00,U,adversarial,eval,adversarial_eval_040,4096,1,512,bf16,NVIDIA GeForce RTX 4060,c03,64,64,32,4,2,8,0.0,0.0,68.4639997780323,123.50464075803754,0.06126291209392363,3,0,2,fixed_c03,0,fixed_static_cfg;ref_shape=2048x2048x2048;pick=
2026-03-02T09:58:18.096980+00:00,U,adversarial,eval,adversarial_eval_041,4096,1,2048,bf16,NVIDIA GeForce RTX 4060,c03,64,64,32,4,2,8,0.0,0.0,184.32000279426575,257.0041564106941,0.09102222084233792,3,0,3,fixed_c03,0,fixed_static_cfg;ref_shape=2048x2048x2048;pick=
2026-03-02T09:58:18.298804+00:00,U,adversarial,eval,adversarial_eval_042,1024,2,512,bf16,NVIDIA GeForce RTX 4060,c03,64,64,32,4,2,8,0.0,0.0,64.51199948787689,75.31519934535025,0.03250793676599804,3,0,2,fixed_c03,0,fixed_static_cfg;ref_shape=2048x2048x2048;pick=
2026-03-02T09:58:18.325494+00:00,U,adversarial,eval,adversarial_eval_043,1024,2,2048,bf16,NVIDIA GeForce RTX 4060,c03,64,64,32,4,2,8,0.0,0.0,171.00800573825836,267.97407329082483,0.04905389056954121,3,0,3,fixed_c03,0,fixed_static_cfg;ref_shape=2048x2048x2048;pick=
2026-03-02T09:58:18.336669+00:00,U,adversarial,eval,adversarial_eval_044,2048,2,512,bf16,NVIDIA GeForce RTX 4060,c03,64,64,32,4,2,8,0.0,0.0,91.13600105047226,172.61599808931348,0.0460224713796378,3,0,2,fixed_c03,0,fixed_static_cfg;ref_shape=2048x2048x2048;pick=
2026-03-02T09:58:18.364848+00:00,U,adversarial,eval,adversarial_eval_045,2048,2,2048,bf16,NVIDIA GeForce RTX 4060,c03,64,64,32,4,2,8,0.0,0.0,188.9280006289482,367.68927425146063,0.08880216772605455,3,0,3,fixed_c03,0,fixed_static_cfg;ref_shape=2048x2048x2048;pick=
2026-03-02T09:58:18.380630+00:00,U,adversarial,eval,adversarial_eval_046,4096,2,512,bf16,NVIDIA GeForce RTX 4060,c03,64,64,32,4,2,8,0.0,0.0,87.93599903583527,170.8230416476726,0.0953944697504547,3,0,2,fixed_c03,0,fixed_static_cfg;ref_shape=2048x2048x2048;pick=
2026-03-02T09:58:18.432752+00:00,U,adversarial,eval,adversarial_eval_047,4096,2,2048,bf16,NVIDIA GeForce RTX 4060,c03,64,64,32,4,2,8,0.0,0.0,209.9199965596199,322.5219163298606,0.15984390505870708,3,0,3,fixed_c03,0,fixed_static_cfg;ref_shape=2048x2048x2048;pick=
2026-03-02T09:58:18.442683+00:00,U,adversarial,eval,adversarial_eval_048,1024,4,512,bf16,NVIDIA GeForce RTX 4060,c03,64,64,32,4,2,8,0.0,0.0,74.75200295448303,359.91008937358816,0.05610958682343185,3,0,2,fixed_c03,0,fixed_static_cfg;ref_shape=2048x2048x2048;pick=
2026-03-02T09:58:18.464264+00:00,U,adversarial,eval,adversarial_eval_049,1024,4,2048,bf16,NVIDIA GeForce RTX 4060,c03,64,64,32,4,2,8,0.0,0.0,192.00000166893005,292.1472021937369,0.08738133257378473,3,0,3,fixed_c03,0,fixed_static_cfg;ref_shape=2048x2048x2048;pick=
2026-03-02T09:58:18.474966+00:00,U,adversarial,eval,adversarial_eval_050,2048,4,512,bf16,NVIDIA GeForce RTX 4060,c03,64,64,32,4,2,8,0.0,0.0,76.72000303864479,136.0140845179557,0.10934055875590304,3,0,2,fixed_c03,0,fixed_static_cfg;ref_shape=2048x2048x2048;pick=
2026-03-02T09:58:18.502502+00:00,U,adversarial,eval,adversarial_eval_051,2048,4,2048,bf16,NVIDIA GeForce RTX 4060,c03,64,64,32,4,2,8,0.0,0.0,186.36799603700638,207.49311953783032,0.1800439598724731,3,0,3,fixed_c03,0,fixed_static_cfg;ref_shape=2048x2048x2048;pick=
2026-03-02T09:58:18.519421+00:00,U,adversarial,eval,adversarial_eval_052,4096,4,512,bf16,NVIDIA GeForce RTX 4060,c03,64,64,32,4,2,8,0.0,0.0,110.59200018644333,305.8380825817583,0.15170370344795153,3,0,2,fixed_c03,0,fixed_static_cfg;ref_shape=2048x2048x2048;pick=
2026-03-02T09:58:18.571960+00:00,U,adversarial,eval,adversarial_eval_053,4096,4,2048,bf16,NVIDIA GeForce RTX 4060,c03,64,64,32,4,2,8,0.0,0.0,225.79199820756912,329.26720321178436,0.29721542186055355,3,0,3,fixed_c03,0,fixed_static_cfg;ref_shape=2048x2048x2048;pick=
2026-03-02T09:58:18.580853+00:00,U,adversarial,eval,adversarial_eval_054,1024,8,512,bf16,NVIDIA GeForce RTX 4060,c03,64,64,32,4,2,8,0.0,0.0,68.01600009202957,94.89055745303625,0.12333286268892217,3,0,2,fixed_c03,0,fixed_static_cfg;ref_shape=2048x2048x2048;pick=
2026-03-02T09:58:18.599972+00:00,U,adversarial,eval,adversarial_eval_055,1024,8,2048,bf16,NVIDIA GeForce RTX 4060,c03,64,64,32,4,2,8,0.0,0.0,168.96000504493713,206.60895422101012,0.19859393346416956,3,0,3,fixed_c03,0,fixed_static_cfg;ref_shape=2048x2048x2048;pick=
2026-03-02T09:58:18.611824+00:00,U,adversarial,eval,adversarial_eval_056,2048,8,512,bf16,NVIDIA GeForce RTX 4060,c03,64,64,32,4,2,8,0.0,0.0,102.76800021529198,176.51519581675512,0.16325330808085076,3,0,2,fixed_c03,0,fixed_static_cfg;ref_shape=2048x2048x2048;pick=
2026-03-02T09:58:18.639751+00:00,U,adversarial,eval,adversarial_eval_057,2048,8,2048,bf16,NVIDIA GeForce RTX 4060,c03,64,64,32,4,2,8,0.0,0.0,190.3200000524521,256.69439345598215,0.35261067665775975,3,0,3,fixed_c03,0,fixed_static_cfg;ref_shape=2048x2048x2048;pick=
2026-03-02T09:58:18.654078+00:00,U,adversarial,eval,adversarial_eval_058,4096,8,512,bf16,NVIDIA GeForce RTX 4060,c03,64,64,32,4,2,8,0.0,0.0,80.75199648737907,98.40639971196649,0.4155244880570142,3,0,2,fixed_c03,0,fixed_static_cfg;ref_shape=2048x2048x2048;pick=
2026-03-02T09:58:18.710528+00:00,U,adversarial,eval,adversarial_eval_059,4096,8,2048,bf16,NVIDIA GeForce RTX 4060,c03,64,64,32,4,2,8,0.0,0.0,231.1679944396019,266.88512444496155,0.580606879967839,3,0,3,fixed_c03,0,fixed_static_cfg;ref_shape=2048x2048x2048;pick=
2026-03-02T09:58:18.736256+00:00,U,adversarial,eval,adversarial_eval_060,64,64,8192,bf16,NVIDIA GeForce RTX 4060,c03,64,64,32,4,2,8,0.0,0.0,324.6079981327057,421.8982449173926,0.20673817153625607,1,1,3,fixed_c03,0,fixed_static_cfg;ref_shape=2048x2048x2048;pick=
2026-03-02T09:58:18.767602+00:00,U,adversarial,eval,adversarial_eval_061,128,128,8192,bf16,NVIDIA GeForce RTX 4060,c03,64,64,32,4,2,8,0.0,0.0,332.19200372695923,390.7311901450157,0.808073201607336,1,1,3,fixed_c03,0,fixed_static_cfg;ref_shape=2048x2048x2048;pick=
2026-03-02T09:58:18.892234+00:00,U,adversarial,eval,adversarial_eval_062,2048,128,8192,bf16,NVIDIA GeForce RTX 4060,c03,64,64,32,4,2,8,0.0,0.0,730.1120162010193,807.5980889797211,5.88261417521648,3,1,3,fixed_c03,0,fixed_static_cfg;ref_shape=2048x2048x2048;pick=
2026-03-02T09:58:19.014877+00:00,U,adversarial,eval,adversarial_eval_063,128,2048,8192,bf16,NVIDIA GeForce RTX 4060,c03,64,64,32,4,2,8,0.0,0.0,708.6079716682434,777.106260061264,6.061133190314744,1,3,3,fixed_c03,0,fixed_static_cfg;ref_shape=2048x2048x2048;pick=
2026-03-02T09:58:22.632774+00:00,B,uniform,tune,uniform_tune_000,1536,512,1024,bf16,NVIDIA GeForce RTX 4060,c06,64,128,32,4,3,8,186.98870204389095,2557.434,85.96799895167351,204.22655448317516,18.73502647078476,3,2,3,3_2_3,0,
2026-03-02T09:58:22.957708+00:00,B,uniform,tune,uniform_tune_001,1536,1536,2048,bf16,NVIDIA GeForce RTX 4060,c10,64,128,64,8,3,8,0.0,324.897,320.51199674606323,371.68576180934895,30.150747909933568,3,3,3,3_3_3,0,
2026-03-02T09:58:23.081207+00:00,B,uniform,tune,uniform_tune_002,384,2048,1536,bf16,NVIDIA GeForce RTX 4060,c09,128,64,64,8,3,8,0.0,123.455,103.58399897813797,134.76415798068047,23.32328475279174,2,3,3,2_3_3,0,
2026-03-02T09:58:23.182258+00:00,B,uniform,tune,uniform_tune_003,1536,64,3072,bf16,NVIDIA GeForce RTX 4060,c04,64,64,64,4,3,8,0.0,101.008,55.23199960589409,61.90527971833943,10.935323368874485,3,1,3,3_1_3,0,
2026-03-02T09:58:23.194677+00:00,B,uniform,tune,uniform_tune_004,768,128,2048,bf16,NVIDIA GeForce RTX 4060,c04,64,64,64,4,3,8,0.0,0.0,42.78400167822838,55.8796802908182,9.411302547814252,3,1,3,3_1_3,0,
2026-03-02T09:58:23.277828+00:00,B,uniform,tune,uniform_tune_005,512,128,4096,bf16,NVIDIA GeForce RTX 4060,c04,64,64,64,4,3,8,0.0,83.11,57.34400078654289,73.30431818962094,9.362285585870548,2,1,3,2_1_3,0,
2026-03-02T09:58:23.374084+00:00,B,uniform,tune,uniform_tune_006,2048,1024,4096,bf16,NVIDIA GeForce RTX 4060,c10,64,128,64,8,3,8,0.0,0.0,555.9999942779541,711.6847825050354,30.899045612959995,3,3,3,3_3_3,0,
2026-03-02T09:58:23.419843+00:00,B,uniform,tune,uniform_tune_007,128,768,512,bf16,NVIDIA GeForce RTX 4060,c04,64,64,64,4,3,8,0.0,45.707,33.84000062942505,46.56000040471553,2.9746836326140547,1,3,2,1_3_2,0,
2026-03-02T09:58:23.479278+00:00,B,uniform,tune,uniform_tune_008,2048,256,64,bf16,NVIDIA GeForce RTX 4060,c00,32,32,32,2,2,8,0.0,59.406,38.24000060558319,163.48255559802053,1.7549388843420113,3,2,1,3_2_1,0,
2026-03-02T09:58:23.497238+00:00,B,uniform,tune,uniform_tune_009,192,768,2048,bf16,NVIDIA GeForce RTX 4060,c09,128,64,64,8,3,8,0.0,0.0,55.296000093221664,130.67648366093636,10.922666648252513,2,3,3,2_3_3,0,
2026-03-02T09:58:23.517699+00:00,B,uniform,tune,uniform_tune_010,1024,1024,1536,bf16,NVIDIA GeForce RTX 4060,c10,64,128,64,8,3,8,0.0,0.0,139.0720009803772,189.12224322557444,23.16228607694017,3,3,3,3_3_3,0,
2026-03-02T09:58:23.567127+00:00,B,uniform,tune,uniform_tune_011,256,384,768,bf16,NVIDIA GeForce RTX 4060,c04,64,64,64,4,3,8,0.0,49.397,34.81600061058998,56.38976022601126,4.336941100410938,2,2,3,2_2_3,0,
2026-03-02T09:58:23.625980+00:00,B,uniform,tune,uniform_tune_012,64,192,2048,bf16,NVIDIA GeForce RTX 4060,c04,64,64,64,4,3,8,0.0,58.819,42.7360013127327,53.711680807173245,1.1777341457775619,1,2,3,1_2_3,0,
2026-03-02T09:58:23.667592+00:00,B,uniform,tune,uniform_tune_013,192,128,512,bf16,NVIDIA GeForce RTX 4060,c00,32,32,32,2,2,8,0.0,41.587,31.47200122475624,52.630720250308514,0.7996257950131329,2,1,2,2_1_2,0,
2026-03-02T09:58:23.714679+00:00,B,uniform,tune,uniform_tune_014,128,128,1024,bf16,NVIDIA GeForce RTX 4060,c04,64,64,64,4,3,8,0.0,47.064,35.19999980926514,51.33503943681716,0.9532509142561983,1,1,3,1_1_3,0,
2026-03-02T09:58:23.770917+00:00,B,uniform,tune,uniform_tune_015,3072,3072,768,bf16,NVIDIA GeForce RTX 4060,c10,64,128,64,8,3,8,0.0,0.0,477.9680073261261,688.189435005188,30.32737422132409,3,3,3,3_3_3,0,
2026-03-02T09:58:23.784374+00:00,B,uniform,tune,uniform_tune_016,256,128,3072,bf16,NVIDIA GeForce RTX 4060,c04,64,64,64,4,3,8,0.0,0.0,52.22399905323982,90.97663991153232,3.855058893417131,2,1,3,2_1_3,0,
2026-03-02T09:58:23.791089+00:00,B,uniform,tune,uniform_tune_017,96,1024,192,bf16,NVIDIA GeForce RTX 4060,c04,64,64,64,4,3,8,0.0,0.0,49.63199980556965,123.37919831275934,0.7605725368286265,1,3,2,1_3_2,0,
2026-03-02T09:58:23.833851+00:00,B,uniform,tune,uniform_tune_018,64,64,192,bf16,NVIDIA GeForce RTX 4060,c11,32,128,32,4,2,8,0.0,42.727,32.76799991726875,43.220159374177456,0.048000000121188345,1,1,2,1_1_2,0,
2026-03-02T09:58:23.875237+00:00,B,uniform,tune,uniform_tune_019,4096,64,64,bf16,NVIDIA GeForce RTX 4060,c03,64,64,32,4,2,8,0.0,41.361,30.719999223947525,50.35072047263381,1.0922666942596442,3,1,1,3_1_1,0,
2026-03-02T09:58:24.071917+00:00,B,uniform,tune,uniform_tune_020,128,4096,3072,bf16,NVIDIA GeForce RTX 4060,c06,64,128,32,4,3,8,0.0,196.648,137.2160017490387,143.8822402060032,23.47558179031818,1,3,3,1_3_3,0,
2026-03-02T09:58:24.115777+00:00,B,uniform,tune,uniform_tune_021,192,2048,3072,bf16,NVIDIA GeForce RTX 4060,c09,128,64,64,8,3,8,0.0,0.0,143.36000382900238,200.92127948999388,16.85211383561116,2,3,3,2_3_3,0,
2026-03-02T09:58:24.168220+00:00,B,uniform,tune,uniform_tune_022,1536,2048,2048,bf16,NVIDIA GeForce RTX 4060,c10,64,128,64,8,3,8,0.0,0.0,414.20799493789673,533.3862441778182,31.107323000686808,3,3,3,3_3_3,0,
2026-03-02T09:58:24.179963+00:00,B,uniform,tune,uniform_tune_023,256,1024,1024,bf16,NVIDIA GeForce RTX 4060,c09,128,64,64,8,3,8,0.0,0.0,55.16799911856651,141.91007554531095,9.731563960588137,2,3,3,2_3_3,0,
2026-03-02T09:58:24.222904+00:00,B,uniform,tune,uniform_tune_024,768,128,384,bf16,NVIDIA GeForce RTX 4060,c04,64,64,64,4,3,8,0.0,42.9,31.74399957060814,69.26847755908963,2.37832261281604,3,1,2,3_1_2,0,
2026-03-02T09:58:24.227615+00:00,B,uniform,tune,uniform_tune_025,256,96,384,bf16,NVIDIA GeForce RTX 4060,c00,32,32,32,2,2,8,0.0,0.0,31.63199871778488,39.47520028799771,0.5966859118955393,2,1,2,2_1_2,0,
2026-03-02T09:58:24.243479+00:00,B,uniform,tune,uniform_tune_026,96,1024,3072,bf16,NVIDIA GeForce RTX 4060,c06,64,128,32,4,3,8,0.0,0.0,72.7040022611618,85.42911820113657,8.30738002332292,1,3,3,1_3_3,0,
2026-03-02T09:58:24.289487+00:00,B,uniform,tune,uniform_tune_027,1536,512,4096,bf16,NVIDIA GeForce RTX 4060,c06,64,128,32,4,3,8,0.0,0.0,219.13599967956543,287.8755232691764,29.3993271457933,3,2,3,3_2_3,0,
2026-03-02T09:58:24.293965+00:00,B,uniform,tune,uniform_tune_028,128,64,192,bf16,NVIDIA GeForce RTX 4060,c11,32,128,32,4,2,8,0.0,0.0,42.01599955558777,91.95263847708699,0.0748697646913804,1,1,2,1_1_2,0,
2026-03-02T09:58:24.301668+00:00,B,uniform,tune,uniform_tune_029,192,256,1536,bf16,NVIDIA GeForce RTX 4060,c04,64,64,64,4,3,8,0.0,0.0,44.03200000524521,134.2054407298565,3.429209301917085,2,2,3,2_2_3,0,
2026-03-02T09:58:24.362435+00:00,B,uniform,tune,uniform_tune_030,4096,64,3072,bf16,NVIDIA GeForce RTX 4060,c04,64,64,64,4,3,8,0.0,0.0,97.71200269460678,153.42655643820757,16.483263996070953,3,1,3,3_1_3,0,
2026-03-02T09:58:24.406036+00:00,B,uniform,tune,uniform_tune_031,384,128,96,bf16,NVIDIA GeForce RTX 4060,c11,32,128,32,4,2,8,0.0,43.548,30.719999223947525,69.8777593299746,0.307200007760525,2,1,1,2_1_1,0,
2026-03-02T09:58:24.428284+00:00,B,uniform,eval,uniform_eval_000,512,4096,768,bf16,NVIDIA GeForce RTX 4060,c09,128,64,64,8,3,8,0.0,0.0,136.19199395179749,188.56960028409947,23.65209127593866,2,3,3,2_3_3,0,
2026-03-02T09:58:24.465982+00:00,B,uniform,eval,uniform_eval_001,384,512,64,bf16,NVIDIA GeForce RTX 4060,c04,64,64,64,4,3,8,0.0,37.66,28.672000393271446,36.876480951905236,0.877714273675364,2,2,1,2_2_1,0,
2026-03-02T09:58:24.529159+00:00,B,uniform,eval,uniform_eval_002,256,4096,384,bf16,NVIDIA GeForce RTX 4060,c03,64,64,32,4,2,8,0.0,63.147,54.207999259233475,57.866240963339806,14.855858526503887,2,3,2,2_3_2,0,
2026-03-02T09:58:24.537416+00:00,B,uniform,eval,uniform_eval_003,384,768,512,bf16,NVIDIA GeForce RTX 4060,c03,64,64,32,4,2,8,0.0,0.0,57.19999969005585,141.26720160245893,5.279543525111253,2,3,2,2_3_2,0,
2026-03-02T09:58:24.581227+00:00,B,uniform,eval,uniform_eval_004,768,1024,96,bf16,NVIDIA GeForce RTX 4060,c11,32,128,32,4,2,8,0.0,43.779,34.81600061058998,47.64672122895717,4.336941100410938,3,3,1,3_3_1,0,
2026-03-02T09:58:24.592639+00:00,B,uniform,eval,uniform_eval_005,3072,3072,128,bf16,NVIDIA GeForce RTX 4060,c11,32,128,32,4,2,8,0.0,0.0,111.61600053310394,142.26431950926772,21.64491732781151,3,3,1,3_3_1,0,
2026-03-02T09:58:24.597007+00:00,B,uniform,eval,uniform_eval_006,256,96,512,bf16,NVIDIA GeForce RTX 4060,c00,32,32,32,2,2,8,0.0,0.0,29.536000452935696,43.92191901803017,0.8520389901842202,2,1,2,2_1_2,0,
2026-03-02T09:58:25.009308+00:00,B,uniform,eval,uniform_eval_007,4096,4096,4096,bf16,NVIDIA GeForce RTX 4060,c10,64,128,64,8,3,8,0.0,0.0,4249.104022979736,4409.844427108765,32.345396283242614,3,3,3,3_3_3,0,
2026-03-02T09:58:25.056049+00:00,B,uniform,eval,uniform_eval_008,128,96,64,bf16,NVIDIA GeForce RTX 4060,c11,32,128,32,4,2,8,0.0,46.693,29.08799983561039,127.46496334671959,0.05407260756631514,1,1,1,1_1_1,0,
2026-03-02T09:58:25.070622+00:00,B,uniform,eval,uniform_eval_009,3072,384,96,bf16,NVIDIA GeForce RTX 4060,c00,32,32,32,2,2,8,0.0,0.0,45.40799930691719,63.39423827826977,4.9879408795158575,3,2,1,3_2_1,0,
2026-03-02T09:58:25.089368+00:00,B,uniform,eval,uniform_eval_010,768,768,2048,bf16,NVIDIA GeForce RTX 4060,c10,64,128,64,8,3,8,0.0,0.0,102.41599753499031,205.82400262355804,23.58927474367082,3,3,3,3_3_3,0,
2026-03-02T09:58:25.102289+00:00,B,uniform,eval,uniform_eval_011,4096,96,512,bf16,NVIDIA GeForce RTX 4060,c04,64,64,64,4,3,8,0.0,0.0,54.207999259233475,316.48032933473576,7.427929263251944,3,1,2,3_1_2,0,
2026-03-02T09:58:25.146172+00:00,B,uniform,eval,uniform_eval_012,384,384,256,bf16,NVIDIA GeForce RTX 4060,c11,32,128,32,4,2,8,0.0,43.838,32.76799991726875,44.58303995430468,2.3040000058170405,2,2,2,2_2_2,0,
2026-03-02T09:58:25.187089+00:00,B,uniform,eval,uniform_eval_013,4096,2048,768,bf16,NVIDIA GeForce RTX 4060,c10,64,128,64,8,3,8,0.0,0.0,428.49600315093994,461.4294320344925,30.070063182039124,3,3,3,3_3_3,0,
2026-03-02T09:58:25.198838+00:00,B,uniform,eval,uniform_eval_014,192,384,3072,bf16,NVIDIA GeForce RTX 4060,c04,64,64,64,4,3,8,0.0,0.0,55.16799911856651,141.2748815119266,8.21100709174624,2,2,3,2_2_3,0,
2026-03-02T09:58:25.208235+00:00,B,uniform,eval,uniform_eval_015,128,96,4096,bf16,NVIDIA GeForce RTX 4060,c04,64,64,64,4,3,8,0.0,0.0,56.223999708890915,192.11231827735878,1.7903972773406538,1,1,3,1_1_3,0,
2026-03-02T09:58:25.251256+00:00,B,uniform,eval,uniform_eval_016,64,4096,2048,bf16,NVIDIA GeForce RTX 4060,c06,64,128,32,4,3,8,0.0,0.0,74.68800246715546,167.350404113531,14.37636284987251,1,3,3,1_3_3,0,
2026-03-02T09:58:25.258859+00:00,B,uniform,eval,uniform_eval_017,96,128,3072,bf16,NVIDIA GeForce RTX 4060,c04,64,64,64,4,3,8,0.0,0.0,59.39200147986412,96.0854420065879,1.271172382119437,1,1,3,1_1_3,0,
2026-03-02T09:58:25.300317+00:00,B,uniform,eval,uniform_eval_018,512,768,64,bf16,NVIDIA GeForce RTX 4060,c11,32,128,32,4,2,8,0.0,41.417,30.62400035560131,52.99199923872943,1.643536031072245,2,3,1,2_3_1,0,
2026-03-02T09:58:25.305071+00:00,B,uniform,eval,uniform_eval_019,64,128,384,bf16,NVIDIA GeForce RTX 4060,c11,32,128,32,4,2,8,0.0,0.0,31.74399957060814,116.85887850821015,0.19819355106800332,1,1,2,1_1_2,0,
2026-03-02T09:58:25.308961+00:00,B,uniform,eval,uniform_eval_020,512,512,96,bf16,NVIDIA GeForce RTX 4060,c04,64,64,64,4,3,8,0.0,0.0,31.66399896144867,43.06111991405487,1.5895543724998045,2,2,1,2_2_1,0,
2026-03-02T09:58:25.331192+00:00,B,uniform,eval,uniform_eval_021,256,3072,1536,bf16,NVIDIA GeForce RTX 4060,c09,128,64,64,8,3,8,0.0,0.0,99.32799637317657,105.79040072858334,24.322640063365018,2,3,3,2_3_3,0,
2026-03-02T09:58:25.340055+00:00,B,uniform,eval,uniform_eval_022,2048,96,512,bf16,NVIDIA GeForce RTX 4060,c04,64,64,64,4,3,8,0.0,0.0,66.39999896287918,188.07808041572565,3.0320270353099152,3,1,2,3_1_2,0,
2026-03-02T09:58:25.373259+00:00,B,uniform,eval,uniform_eval_023,1536,512,3072,bf16,NVIDIA GeForce RTX 4060,c06,64,128,32,4,3,8,0.0,0.0,169.98399794101715,183.32063868641853,28.425253356357707,3,2,3,3_2_3,0,
2026-03-02T09:58:25.411910+00:00,B,uniform,eval,uniform_eval_024,128,192,64,bf16,NVIDIA GeForce RTX 4060,c10,64,128,64,8,3,8,0.0,38.607,28.672000393271446,45.15839848667381,0.1097142842094205,1,2,1,1_2_1,0,
2026-03-02T09:58:25.425335+00:00,B,uniform,eval,uniform_eval_025,1536,96,384,bf16,NVIDIA GeForce RTX 4060,c04,64,64,64,4,3,8,0.0,0.0,43.007999658584595,86.93503923714152,2.6331428780458412,3,1,2,3_1_2,0,
2026-03-02T09:58:25.433469+00:00,B,uniform,eval,uniform_eval_026,1536,2048,64,bf16,NVIDIA GeForce RTX 4060,c11,32,128,32,4,2,8,0.0,0.0,51.024001091718674,95.29344245791434,7.8914466796950515,3,3,1,3_3_1,0,
2026-03-02T09:58:25.439543+00:00,B,uniform,eval,uniform_eval_027,256,1024,96,bf16,NVIDIA GeForce RTX 4060,c11,32,128,32,4,2,8,0.0,0.0,38.91200013458729,117.6704016327858,1.2934736797367108,2,3,1,2_3_1,0,
2026-03-02T09:58:25.445786+00:00,B,uniform,eval,uniform_eval_028,2048,256,64,bf16,NVIDIA GeForce RTX 4060,c00,32,32,32,2,2,8,0.0,0.0,43.775999918580055,125.45024156570435,1.5330058508044875,3,2,1,3_2_1,0,
2026-03-02T09:58:25.451109+00:00,B,uniform,eval,uniform_eval_029,192,768,192,bf16,NVIDIA GeForce RTX 4060,c03,64,64,32,4,2,8,0.0,0.0,38.83200138807297,54.85760040581226,1.4581556957141917,2,3,2,2_3_2,0,
2026-03-02T09:58:25.506457+00:00,B,uniform,eval,uniform_eval_030,1024,2048,3072,bf16,NVIDIA GeForce RTX 4060,c10,64,128,64,8,3,8,0.0,0.0,427.0240068435669,586.2403231859205,30.173717827344934,3,3,3,3_3_3,0,
2026-03-02T09:58:25.587155+00:00,B,uniform,eval,uniform_eval_031,1536,1024,512,bf16,NVIDIA GeForce RTX 4060,c05,128,64,32,4,3,8,0.0,80.647,78.5600021481514,122.49696053564546,20.50168905243467,3,3,2,3_3_2,0,
2026-03-02T09:58:25.602416+00:00,B,uniform,eval,uniform_eval_032,512,768,768,bf16,NVIDIA GeForce RTX 4060,c09,128,64,64,8,3,8,0.0,0.0,55.32800033688545,83.53120155632493,10.91634926840733,2,3,3,2_3_3,0,
2026-03-02T09:58:25.621355+00:00,B,uniform,eval,uniform_eval_033,64,512,4096,bf16,NVIDIA GeForce RTX 4060,c04,64,64,64,4,3,8,0.0,0.0,61.455998569726944,101.94944456219662,4.367929286763401,1,2,3,1_2_3,0,
2026-03-02T09:58:25.669069+00:00,B,uniform,eval,uniform_eval_034,1024,256,512,bf16,NVIDIA GeForce RTX 4060,c04,64,64,64,4,3,8,0.0,47.678,37.88800165057182,41.433278769254684,7.084972664319673,3,2,2,3_2_2,0,
2026-03-02T09:58:25.674403+00:00,B,uniform,eval,uniform_eval_035,1024,768,96,bf16,NVIDIA GeForce RTX 4060,c11,32,128,32,4,2,8,0.0,0.0,36.86400130391121,47.23744001239538,4.095999855120982,3,3,1,3_3_1,0,
2026-03-02T09:58:25.682744+00:00,B,uniform,eval,uniform_eval_036,768,64,1536,bf16,NVIDIA GeForce RTX 4060,c04,64,64,64,4,3,8,0.0,0.0,35.32800078392029,89.3916772305965,4.274086861680723,3,1,3,3_1_3,0,
2026-03-02T09:58:25.687558+00:00,B,uniform,eval,uniform_eval_037,512,256,512,bf16,NVIDIA GeForce RTX 4060,c11,32,128,32,4,2,8,0.0,0.0,36.86400130391121,50.52064090967178,3.6408887601075395,2,2,2,2_2_2,0,
2026-03-02T09:58:25.725394+00:00,B,uniform,eval,uniform_eval_038,64,1024,64,bf16,NVIDIA GeForce RTX 4060,c11,32,128,32,4,2,8,0.0,37.816,28.55999954044819,35.8604809641838,0.29371877223315807,1,3,1,1_3_1,0,
2026-03-02T09:58:25.737297+00:00,B,uniform,eval,uniform_eval_039,512,128,2048,bf16,NVIDIA GeForce RTX 4060,c04,64,64,64,4,3,8,0.0,0.0,36.3520011305809,85.70911832153782,7.384337798509263,2,1,3,2_1_3,0,
2026-03-02T09:58:25.743588+00:00,B,uniform,eval,uniform_eval_040,4096,768,96,bf16,NVIDIA GeForce RTX 4060,c11,32,128,32,4,2,8,0.0,0.0,47.10400104522705,61.34591955691576,12.82226058504217,3,3,1,3_3_1,0,
2026-03-02T09:58:25.748552+00:00,B,uniform,eval,uniform_eval_041,4096,192,64,bf16,NVIDIA GeForce RTX 4060,c00,32,32,32,2,2,8,0.0,0.0,32.15999901294708,62.195842117071095,3.1300777080084683,3,2,1,3_2_1,0,
2026-03-02T09:58:25.752828+00:00,B,uniform,eval,uniform_eval_042,96,1536,128,bf16,NVIDIA GeForce RTX 4060,c11,32,128,32,4,2,8,0.0,0.0,27.535999193787575,43.95487941801548,1.3708867339201742,1,3,1,1_3_1,0,
2026-03-02T09:58:25.757736+00:00,B,uniform,eval,uniform_eval_043,192,2048,192,bf16,NVIDIA GeForce RTX 4060,c03,64,64,32,4,2,8,0.0,0.0,30.41600063443184,48.674879558384404,4.964326040586319,2,3,2,2_3_2,0,
2026-03-02T09:58:25.834178+00:00,B,uniform,eval,uniform_eval_044,384,4096,3072,bf16,NVIDIA GeForce RTX 4060,c09,128,64,64,8,3,8,0.0,0.0,328.5920023918152,368.74240577220917,29.40934759719736,2,3,3,2_3_3,0,
2026-03-02T09:58:25.849208+00:00,B,uniform,eval,uniform_eval_045,4096,96,768,bf16,NVIDIA GeForce RTX 4060,c04,64,64,64,4,3,8,0.0,0.0,56.32000043988228,64.59360010921955,10.724072643513326,3,1,3,3_1_3,0,
2026-03-02T09:58:25.855900+00:00,B,uniform,eval,uniform_eval_046,96,96,1536,bf16,NVIDIA GeForce RTX 4060,c04,64,64,64,4,3,8,0.0,0.0,33.28000009059906,142.70688101649282,0.8507076899917875,1,1,3,1_1_3,0,
2026-03-02T09:58:25.910839+00:00,B,uniform,eval,uniform_eval_047,2048,512,4096,bf16,NVIDIA GeForce RTX 4060,c06,64,128,32,4,3,8,0.0,0.0,312.3199939727783,335.9743946790695,27.503633317656554,3,2,3,3_2_3,0,
2026-03-02T09:58:25.917324+00:00,B,uniform,eval,uniform_eval_048,96,256,768,bf16,NVIDIA GeForce RTX 4060,c04,64,64,64,4,3,8,0.0,0.0,34.20799970626831,124.78079982101916,1.1035060899244242,1,2,3,1_2_3,0,
2026-03-02T09:58:25.922657+00:00,B,uniform,eval,uniform_eval_049,64,768,384,bf16,NVIDIA GeForce RTX 4060,c04,64,64,64,4,3,8,0.0,0.0,33.104000613093376,105.86272098124027,1.140307373758008,1,3,2,1_3_2,0,
2026-03-02T09:58:25.927148+00:00,B,uniform,eval,uniform_eval_050,128,1024,96,bf16,NVIDIA GeForce RTX 4060,c11,32,128,32,4,2,8,0.0,0.0,28.67199946194887,145.66399686038477,0.8777143021852389,1,3,1,1_3_1,0,
2026-03-02T09:58:25.936063+00:00,B,uniform,eval,uniform_eval_051,384,768,768,bf16,NVIDIA GeForce RTX 4060,c09,128,64,64,8,3,8,0.0,0.0,59.82400104403496,70.02368040382862,7.571958145470229,2,3,3,2_3_3,0,
2026-03-02T09:58:25.953034+00:00,B,uniform,eval,uniform_eval_052,768,64,4096,bf16,NVIDIA GeForce RTX 4060,c04,64,64,64,4,3,8,0.0,0.0,54.976001381874084,63.287359140813344,7.324162796109743,3,1,3,3_1_3,0,
2026-03-02T09:58:25.957957+00:00,B,uniform,eval,uniform_eval_053,384,96,512,bf16,NVIDIA GeForce RTX 4060,c00,32,32,32,2,2,8,0.0,0.0,30.672000721096992,41.98399931192398,1.230722975760608,2,1,2,2_1_2,0,
2026-03-02T09:58:25.964326+00:00,B,uniform,eval,uniform_eval_054,768,192,768,bf16,NVIDIA GeForce RTX 4060,c06,64,128,32,4,3,8,0.0,0.0,35.840000957250595,63.545601442456196,6.3195426883541845,3,2,3,3_2_3,0,
2026-03-02T09:58:25.973213+00:00,B,uniform,eval,uniform_eval_055,512,2048,512,bf16,NVIDIA GeForce RTX 4060,c03,64,64,32,4,2,8,0.0,0.0,61.344001442193985,82.4976014345884,17.503615655261978,2,3,2,2_3_2,0,
2026-03-02T09:58:25.979270+00:00,B,uniform,eval,uniform_eval_056,384,512,512,bf16,NVIDIA GeForce RTX 4060,c11,32,128,32,4,2,8,0.0,0.0,44.39999908208847,101.74656275659783,4.534382796445096,2,2,2,2_2_2,0,
2026-03-02T09:58:25.989431+00:00,B,uniform,eval,uniform_eval_057,2048,512,512,bf16,NVIDIA GeForce RTX 4060,c04,64,64,64,4,3,8,0.0,0.0,67.58400052785873,80.39423741400242,15.88751502742715,3,2,2,3_2_2,0,
2026-03-02T09:58:26.005982+00:00,B,uniform,eval,uniform_eval_058,1024,512,2048,bf16,NVIDIA GeForce RTX 4060,c06,64,128,32,4,3,8,0.0,0.0,98.30400347709656,109.09503944218157,21.84533256064524,3,2,3,3_2_3,0,
2026-03-02T09:58:26.050464+00:00,B,uniform,eval,uniform_eval_059,2048,64,4096,bf16,NVIDIA GeForce RTX 4060,c04,64,64,64,4,3,8,0.0,0.0,84.81599763035774,133.38816039264188,12.659661549694267,3,1,3,3_1_3,0,
2026-03-02T09:58:26.064110+00:00,B,uniform,eval,uniform_eval_060,64,1536,1024,bf16,NVIDIA GeForce RTX 4060,c06,64,128,32,4,3,8,0.0,0.0,75.77600330114365,180.00447839498517,2.656864749119877,1,3,3,1_3_3,0,
2026-03-02T09:58:26.082715+00:00,B,uniform,eval,uniform_eval_061,768,1024,1536,bf16,NVIDIA GeForce RTX 4060,c10,64,128,64,8,3,8,0.0,0.0,132.9919993877411,137.18751773238182,18.165898062456638,3,3,3,3_3_3,0,
2026-03-02T09:58:26.091211+00:00,B,uniform,eval,uniform_eval_062,384,2048,192,bf16,NVIDIA GeForce RTX 4060,c03,64,64,32,4,2,8,0.0,0.0,62.463998794555664,99.24672260880469,4.834623044119317,2,3,2,2_3_2,0,
2026-03-02T09:58:26.099097+00:00,B,uniform,eval,uniform_eval_063,256,2048,192,bf16,NVIDIA GeForce RTX 4060,c03,64,64,32,4,2,8,0.0,0.0,59.55199897289276,86.44575990736477,3.3806857111822732,2,3,2,2_3_2,0,
2026-03-02T09:58:28.153538+00:00,B,llm_style,tune,llm_style_tune_000,8,4096,1024,bf16,NVIDIA GeForce RTX 4060,c00,32,32,32,2,2,8,0.0,2053.849,40.84799997508526,113.33023503422719,1.642892284589998,0,3,3,0_3_3,0,
2026-03-02T09:58:28.170411+00:00,B,llm_style,tune,llm_style_tune_001,32,1024,2048,bf16,NVIDIA GeForce RTX 4060,c00,32,32,32,2,2,8,0.0,0.0,95.23200243711472,182.8476744890213,1.40937630801819,0,3,3,0_3_3,0,
2026-03-02T09:58:28.183443+00:00,B,llm_style,tune,llm_style_tune_002,16,2048,1024,bf16,NVIDIA GeForce RTX 4060,c00,32,32,32,2,2,8,0.0,0.0,58.17599967122078,893.6367928981762,1.1535489614147232,0,3,3,0_3_3,0,
2026-03-02T09:58:28.385993+00:00,B,llm_style,tune,llm_style_tune_003,1,1024,4096,bf16,NVIDIA GeForce RTX 4060,c00,32,32,32,2,2,8,0.0,0.0,142.255999147892,247.73631751537295,0.05896839535940447,0,3,3,0_3_3,0,
2026-03-02T09:58:28.416570+00:00,B,llm_style,tune,llm_style_tune_004,64,2048,2048,bf16,NVIDIA GeForce RTX 4060,c06,64,128,32,4,3,8,0.0,0.0,140.28799533843994,221.63743942975975,3.82691983519201,1,3,3,1_3_3,0,
2026-03-02T09:58:28.802699+00:00,B,llm_style,tune,llm_style_tune_005,32,8192,8192,bf16,NVIDIA GeForce RTX 4060,c00,32,32,32,2,2,8,0.0,0.0,962.5599980354309,991.163210272789,4.462025541021815,0,3,3,0_3_3,0,
2026-03-02T09:58:29.141128+00:00,B,llm_style,tune,llm_style_tune_006,16,8192,8192,bf16,NVIDIA GeForce RTX 4060,c00,32,32,32,2,2,8,0.0,0.0,936.959981918335,973.3222603797913,2.291969443138046,0,3,3,0_3_3,0,
2026-03-02T09:58:29.232656+00:00,B,llm_style,tune,llm_style_tune_007,2,1024,8192,bf16,NVIDIA GeForce RTX 4060,c00,32,32,32,2,2,8,0.0,0.0,325.5840092897415,379.67487365007383,0.10305921372858169,0,3,3,0_3_3,0,
2026-03-02T09:58:29.341958+00:00,B,llm_style,tune,llm_style_tune_008,16,2048,8192,bf16,NVIDIA GeForce RTX 4060,c00,32,32,32,2,2,8,0.0,0.0,384.0000033378601,466.69441580772383,1.3981013211805557,0,3,3,0_3_3,0,
2026-03-02T09:58:29.386752+00:00,B,llm_style,tune,llm_style_tune_009,4,4096,2048,bf16,NVIDIA GeForce RTX 4060,c00,32,32,32,2,2,8,0.0,0.0,138.2399946451187,199.03711616992942,0.4854518706563739,0,3,3,0_3_3,0,
2026-03-02T09:58:29.590397+00:00,B,llm_style,tune,llm_style_tune_010,64,8192,4096,bf16,NVIDIA GeForce RTX 4060,c06,64,128,32,4,3,8,0.0,0.0,763.9039754867554,882.6594942808151,5.622391601330875,1,3,3,1_3_3,0,
2026-03-02T09:58:29.636275+00:00,B,llm_style,tune,llm_style_tune_011,16,8192,1024,bf16,NVIDIA GeForce RTX 4060,c00,32,32,32,2,2,8,0.0,0.0,148.96000176668167,187.14912280440322,1.8020639958131481,0,3,3,0_3_3,0,
2026-03-02T09:58:29.684148+00:00,B,llm_style,tune,llm_style_tune_012,2,8192,1024,bf16,NVIDIA GeForce RTX 4060,c00,32,32,32,2,2,8,0.0,0.0,136.19199395179749,260.4851262271403,0.24637595079102767,0,3,3,0_3_3,0,
2026-03-02T09:58:29.773657+00:00,B,llm_style,tune,llm_style_tune_013,16,8192,2048,bf16,NVIDIA GeForce RTX 4060,c00,32,32,32,2,2,8,0.0,0.0,264.19198513031006,332.31871724128723,2.0321241453831154,0,3,3,0_3_3,0,
2026-03-02T09:58:29.864422+00:00,B,llm_style,tune,llm_style_tune_014,8,4096,4096,bf16,NVIDIA GeForce RTX 4060,c00,32,32,32,2,2,8,0.0,0.0,268.2879865169525,397.01503664255137,1.000549668604107,0,3,3,0_3_3,0,
2026-03-02T09:58:29.877415+00:00,B,llm_style,tune,llm_style_tune_015,64,1024,1024,bf16,NVIDIA GeForce RTX 4060,c06,64,128,32,4,3,8,0.0,0.0,100.71999952197075,258.3859139680861,1.3325826909949712,1,3,3,1_3_3,0,
2026-03-02T09:58:30.054179+00:00,B,llm_style,tune,llm_style_tune_016,16,4096,8192,bf16,NVIDIA GeForce RTX 4060,c00,32,32,32,2,2,8,0.0,0.0,498.54400753974915,634.6444821357727,2.1537553511048673,0,3,3,0_3_3,0,
2026-03-02T09:58:30.143436+00:00,B,llm_style,tune,llm_style_tune_017,1,4096,4096,bf16,NVIDIA GeForce RTX 4060,c00,32,32,32,2,2,8,0.0,0.0,266.7360007762909,359.5289650559424,0.12579641256652793,0,3,3,0_3_3,0,
2026-03-02T09:58:30.250774+00:00,B,llm_style,tune,llm_style_tune_018,64,4096,4096,bf16,NVIDIA GeForce RTX 4060,c06,64,128,32,4,3,8,0.0,0.0,544.7679758071899,605.5408215522765,3.9420152126564427,1,3,3,1_3_3,0,
2026-03-02T09:58:30.352394+00:00,B,llm_style,tune,llm_style_tune_019,64,8192,2048,bf16,NVIDIA GeForce RTX 4060,c06,64,128,32,4,3,8,0.0,0.0,400.33599734306335,540.2652686834335,5.364203224921935,1,3,3,1_3_3,0,
2026-03-02T09:58:30.399141+00:00,B,llm_style,tune,llm_style_tune_020,8,2048,4096,bf16,NVIDIA GeForce RTX 4060,c00,32,32,32,2,2,8,0.0,0.0,169.98399794101715,261.0278424620627,0.7895903710099365,0,3,3,0_3_3,0,
2026-03-02T09:58:30.414017+00:00,B,llm_style,tune,llm_style_tune_021,8,1024,2048,bf16,NVIDIA GeForce RTX 4060,c00,32,32,32,2,2,8,0.0,0.0,95.23200243711472,178.4553635120391,0.3523440770045475,0,3,3,0_3_3,0,
2026-03-02T09:58:30.458216+00:00,B,llm_style,tune,llm_style_tune_022,8,8192,1024,bf16,NVIDIA GeForce RTX 4060,c00,32,32,32,2,2,8,0.0,0.0,129.02399897575378,179.9884775280952,1.0402539765119372,0,3,3,0_3_3,0,
2026-03-02T09:58:30.635602+00:00,B,llm_style,tune,llm_style_tune_023,1,4096,8192,bf16,NVIDIA GeForce RTX 4060,c00,32,32,32,2,2,8,0.0,0.0,512.3680233955383,526.422730088234,0.1309778536827097,0,3,3,0_3_3,0,
2026-03-02T09:58:30.809204+00:00,B,llm_style,tune,llm_style_tune_024,2,8192,4096,bf16,NVIDIA GeForce RTX 4060,c00,32,32,32,2,2,8,0.0,0.0,483.3280146121979,625.1622319221497,0.27769490685883513,0,3,3,0_3_3,0,
2026-03-02T09:58:30.900728+00:00,B,llm_style,tune,llm_style_tune_025,2,4096,4096,bf16,NVIDIA GeForce RTX 4060,c00,32,32,32,2,2,8,0.0,0.0,264.6079957485199,368.89023751020426,0.2536161608048285,0,3,3,0_3_3,0,
2026-03-02T09:58:30.914137+00:00,B,llm_style,tune,llm_style_tune_026,4,2048,1024,bf16,NVIDIA GeForce RTX 4060,c00,32,32,32,2,2,8,0.0,0.0,68.44799965620041,103.2464019209146,0.2451089306373941,0,3,3,0_3_3,0,
2026-03-02T09:58:30.970498+00:00,B,llm_style,tune,llm_style_tune_027,64,2048,4096,bf16,NVIDIA GeForce RTX 4060,c06,64,128,32,4,3,8,0.0,0.0,283.6480140686035,360.4684829711914,3.785472736432779,1,3,3,1_3_3,0,
2026-03-02T09:58:30.996759+00:00,B,llm_style,tune,llm_style_tune_028,32,1024,4096,bf16,NVIDIA GeForce RTX 4060,c00,32,32,32,2,2,8,0.0,0.0,185.10399758815765,190.38560062646866,1.4501872433746597,0,3,3,0_3_3,0,
2026-03-02T09:58:31.010427+00:00,B,llm_style,tune,llm_style_tune_029,32,2048,1024,bf16,NVIDIA GeForce RTX 4060,c00,32,32,32,2,2,8,0.0,0.0,68.60800087451935,728.5827457904792,1.9562984825265148,0,3,3,0_3_3,0,
2026-03-02T09:58:31.030390+00:00,B,llm_style,tune,llm_style_tune_030,4,2048,2048,bf16,NVIDIA GeForce RTX 4060,c00,32,32,32,2,2,8,0.0,0.0,99.32799637317657,187.61727631092066,0.33781444532451416,0,3,3,0_3_3,0,
2026-03-02T09:58:31.414011+00:00,B,llm_style,tune,llm_style_tune_031,1,8192,8192,bf16,NVIDIA GeForce RTX 4060,c00,32,32,32,2,2,8,0.0,0.0,1160.0800156593323,1310.3001821041107,0.11569695726869088,0,3,3,0_3_3,0,
2026-03-02T09:58:31.446799+00:00,B,llm_style,eval,llm_style_eval_000,2,1024,4096,bf16,NVIDIA GeForce RTX 4060,c00,32,32,32,2,2,8,0.0,0.0,194.44800168275833,315.8835223317145,0.08628124668193816,0,3,3,0_3_3,0,
2026-03-02T09:58:31.789092+00:00,B,llm_style,eval,llm_style_eval_001,2,8192,8192,bf16,NVIDIA GeForce RTX 4060,c00,32,32,32,2,2,8,0.0,0.0,1001.3599991798401,1088.741409778595,0.2680708798233013,0,3,3,0_3_3,0,
2026-03-02T09:58:31.816112+00:00,B,llm_style,eval,llm_style_eval_002,2,2048,2048,bf16,NVIDIA GeForce RTX 4060,c00,32,32,32,2,2,8,0.0,0.0,119.80800330638885,143.98464038968083,0.14003418416960917,0,3,3,0_3_3,0,
2026-03-02T09:58:31.878024+00:00,B,llm_style,eval,llm_style_eval_003,8,1024,8192,bf16,NVIDIA GeForce RTX 4060,c00,32,32,32,2,2,8,0.0,0.0,366.5919899940491,473.5523307323456,0.36612291502108046,0,3,3,0_3_3,0,
2026-03-02T09:58:31.994190+00:00,B,llm_style,eval,llm_style_eval_004,64,2048,8192,bf16,NVIDIA GeForce RTX 4060,c06,64,128,32,4,3,8,0.0,0.0,657.4079990386963,849.7916990518568,3.2665919050881445,1,3,3,1_3_3,0,
2026-03-02T09:58:32.337212+00:00,B,llm_style,eval,llm_style_eval_005,1,8192,8192,bf16,NVIDIA GeForce RTX 4060,c00,32,32,32,2,2,8,0.0,0.0,988.0959987640381,1098.4345185756683,0.13583470449013713,0,3,3,0_3_3,0,
2026-03-02T09:58:32.401467+00:00,B,llm_style,eval,llm_style_eval_006,1,1024,8192,bf16,NVIDIA GeForce RTX 4060,c00,32,32,32,2,2,8,0.0,0.0,354.3039858341217,501.76000595092773,0.04735260304933394,0,3,3,0_3_3,0,
2026-03-02T09:58:32.574565+00:00,B,llm_style,eval,llm_style_eval_007,2,8192,4096,bf16,NVIDIA GeForce RTX 4060,c00,32,32,32,2,2,8,0.0,0.0,485.3760004043579,597.6371395587921,0.2765232065206884,0,3,3,0_3_3,0,
2026-03-02T09:58:32.623157+00:00,B,llm_style,eval,llm_style_eval_008,16,2048,4096,bf16,NVIDIA GeForce RTX 4060,c00,32,32,32,2,2,8,0.0,0.0,185.08799374103546,282.6675139367579,1.4503126354893638,0,3,3,0_3_3,0,
2026-03-02T09:58:32.726406+00:00,B,llm_style,eval,llm_style_eval_009,32,2048,8192,bf16,NVIDIA GeForce RTX 4060,c00,32,32,32,2,2,8,0.0,0.0,447.488009929657,471.7055997252464,2.399487360943564,0,3,3,0_3_3,0,
2026-03-02T09:58:32.736771+00:00,B,llm_style,eval,llm_style_eval_010,1,1024,1024,bf16,NVIDIA GeForce RTX 4060,c00,32,32,32,2,2,8,0.0,0.0,65.88799878954887,144.4044841825962,0.03182904380960876,0,3,3,0_3_3,0,
2026-03-02T09:58:32.838255+00:00,B,llm_style,eval,llm_style_eval_011,16,2048,8192,bf16,NVIDIA GeForce RTX 4060,c00,32,32,32,2,2,8,0.0,0.0,430.4959923028946,555.3356742858887,1.247098513340539,0,3,3,0_3_3,0,
2026-03-02T09:58:33.178270+00:00,B,llm_style,eval,llm_style_eval_012,8,8192,8192,bf16,NVIDIA GeForce RTX 4060,c00,32,32,32,2,2,8,0.0,0.0,937.9839897155762,973.7280011177063,1.1447336370054564,0,3,3,0_3_3,0,
2026-03-02T09:58:33.356873+00:00,B,llm_style,eval,llm_style_eval_013,32,4096,8192,bf16,NVIDIA GeForce RTX 4060,c00,32,32,32,2,2,8,0.0,0.0,572.7840065956116,587.3152017593384,3.749203230662365,0,3,3,0_3_3,0,
2026-03-02T09:58:33.375203+00:00,B,llm_style,eval,llm_style_eval_014,64,1024,1024,bf16,NVIDIA GeForce RTX 4060,c06,64,128,32,4,3,8,0.0,0.0,103.91999781131744,147.72928401827804,1.291548603029156,1,3,3,1_3_3,0,
2026-03-02T09:58:33.389660+00:00,B,llm_style,eval,llm_style_eval_015,16,2048,1024,bf16,NVIDIA GeForce RTX 4060,c00,32,32,32,2,2,8,0.0,0.0,85.37599816918373,160.83903461694717,0.7860389973656882,0,3,3,0_3_3,0,
2026-03-02T09:58:33.448658+00:00,B,llm_style,eval,llm_style_eval_016,2,1024,8192,bf16,NVIDIA GeForce RTX 4060,c00,32,32,32,2,2,8,0.0,0.0,315.2479976415634,425.55199801921844,0.10643820817587347,0,3,3,0_3_3,0,
2026-03-02T09:58:33.828997+00:00,B,llm_style,eval,llm_style_eval_017,4,8192,8192,bf16,NVIDIA GeForce RTX 4060,c00,32,32,32,2,2,8,0.0,0.0,935.8079731464386,1048.4966623783112,0.5736977322333504,0,3,3,0_3_3,0,
2026-03-02T09:58:33.865009+00:00,B,llm_style,eval,llm_style_eval_018,4,1024,4096,bf16,NVIDIA GeForce RTX 4060,c00,32,32,32,2,2,8,0.0,0.0,182.27200210094452,339.7632029652594,0.1840898855185512,0,3,3,0_3_3,0,
2026-03-02T09:58:33.911772+00:00,B,llm_style,eval,llm_style_eval_019,8,4096,2048,bf16,NVIDIA GeForce RTX 4060,c00,32,32,32,2,2,8,0.0,0.0,146.43199741840363,154.0569631755352,0.9165874287468502,0,3,3,0_3_3,0,
2026-03-02T09:58:33.967579+00:00,B,llm_style,eval,llm_style_eval_020,64,4096,2048,bf16,NVIDIA GeForce RTX 4060,c06,64,128,32,4,3,8,0.0,0.0,326.1440098285675,363.40735256671894,3.292232239875862,1,3,3,1_3_3,0,
2026-03-02T09:58:34.138693+00:00,B,llm_style,eval,llm_style_eval_021,1,4096,8192,bf16,NVIDIA GeForce RTX 4060,c00,32,32,32,2,2,8,0.0,0.0,492.40000545978546,573.0508875846862,0.13628932424023055,0,3,3,0_3_3,0,
2026-03-02T09:58:34.168618+00:00,B,llm_style,eval,llm_style_eval_022,32,1024,4096,bf16,NVIDIA GeForce RTX 4060,c00,32,32,32,2,2,8,0.0,0.0,219.64799612760544,246.36416509747505,1.2221165716624671,0,3,3,0_3_3,0,
2026-03-02T09:58:34.178765+00:00,B,llm_style,eval,llm_style_eval_023,4,1024,1024,bf16,NVIDIA GeForce RTX 4060,c00,32,32,32,2,2,8,0.0,0.0,71.68000191450119,83.37215773761272,0.11702856830285527,0,3,3,0_3_3,0,
2026-03-02T09:58:34.204201+00:00,B,llm_style,eval,llm_style_eval_024,64,2048,2048,bf16,NVIDIA GeForce RTX 4060,c06,64,128,32,4,3,8,0.0,0.0,173.0560064315796,253.52831214666364,3.1022957426921804,1,3,3,1_3_3,0,
2026-03-02T09:58:34.579458+00:00,B,llm_style,eval,llm_style_eval_025,32,8192,8192,bf16,NVIDIA GeForce RTX 4060,c00,32,32,32,2,2,8,0.0,0.0,1381.3120126724243,1462.7948772907257,3.1093389882931133,0,3,3,0_3_3,0,
2026-03-02T09:58:34.641033+00:00,B,llm_style,eval,llm_style_eval_026,4,2048,4096,bf16,NVIDIA GeForce RTX 4060,c00,32,32,32,2,2,8,0.0,0.0,233.47200453281403,358.2259181141853,0.2874385909106631,0,3,3,0_3_3,0,
2026-03-02T09:58:34.729133+00:00,B,llm_style,eval,llm_style_eval_027,8,8192,2048,bf16,NVIDIA GeForce RTX 4060,c00,32,32,32,2,2,8,0.0,0.0,261.1199915409088,314.11200582981104,1.0280157195775073,0,3,3,0_3_3,0,
2026-03-02T09:58:34.904304+00:00,B,llm_style,eval,llm_style_eval_028,8,4096,8192,bf16,NVIDIA GeForce RTX 4060,c00,32,32,32,2,2,8,0.0,0.0,495.5519884824753,525.8547306060791,1.0833795938223463,0,3,3,0_3_3,0,
2026-03-02T09:58:34.927105+00:00,B,llm_style,eval,llm_style_eval_029,8,2048,2048,bf16,NVIDIA GeForce RTX 4060,c00,32,32,32,2,2,8,0.0,0.0,107.40799829363823,225.48928096890444,0.6248032275634994,0,3,3,0_3_3,0,
2026-03-02T09:58:34.972979+00:00,B,llm_style,eval,llm_style_eval_030,1,4096,2048,bf16,NVIDIA GeForce RTX 4060,c00,32,32,32,2,2,8,0.0,0.0,127.48800218105316,176.537600159645,0.1315983913229238,0,3,3,0_3_3,0,
2026-03-02T09:58:35.062981+00:00,B,llm_style,eval,llm_style_eval_031,16,8192,2048,bf16,NVIDIA GeForce RTX 4060,c00,32,32,32,2,2,8,0.0,0.0,265.6960040330887,371.54144585132593,2.0206209496968586,0,3,3,0_3_3,0,
2026-03-02T09:58:35.088190+00:00,B,llm_style,eval,llm_style_eval_032,1,2048,2048,bf16,NVIDIA GeForce RTX 4060,c00,32,32,32,2,2,8,0.0,0.0,106.49599879980087,146.50368474423874,0.07876923165695203,0,3,3,0_3_3,0,
2026-03-02T09:58:35.268608+00:00,B,llm_style,eval,llm_style_eval_033,16,8192,4096,bf16,NVIDIA GeForce RTX 4060,c00,32,32,32,2,2,8,0.0,0.0,510.97601652145386,608.1024080514908,2.1013546414754636,0,3,3,0_3_3,0,
2026-03-02T09:58:35.294683+00:00,B,llm_style,eval,llm_style_eval_034,16,1024,4096,bf16,NVIDIA GeForce RTX 4060,c00,32,32,32,2,2,8,0.0,0.0,169.98399794101715,246.710716933012,0.7895903710099365,0,3,3,0_3_3,0,
2026-03-02T09:58:35.383213+00:00,B,llm_style,eval,llm_style_eval_035,4,8192,2048,bf16,NVIDIA GeForce RTX 4060,c00,32,32,32,2,2,8,0.0,0.0,261.85600459575653,333.5680049657821,0.5125631096647957,0,3,3,0_3_3,0,
2026-03-02T09:58:35.458722+00:00,B,llm_style,eval,llm_style_eval_036,2,2048,4096,bf16,NVIDIA GeForce RTX 4060,c00,32,32,32,2,2,8,0.0,0.0,179.1519969701767,194.0787222981453,0.18729588599330982,0,3,3,0_3_3,0,
2026-03-02T09:58:35.468586+00:00,B,llm_style,eval,llm_style_eval_037,2,1024,1024,bf16,NVIDIA GeForce RTX 4060,c00,32,32,32,2,2,8,0.0,0.0,69.34399902820587,78.84799689054489,0.06048546462245356,0,3,3,0_3_3,0,
2026-03-02T09:58:35.695131+00:00,B,llm_style,eval,llm_style_eval_038,64,4096,8192,bf16,NVIDIA GeForce RTX 4060,c06,64,128,32,4,3,8,0.0,0.0,1056.7679405212402,1077.9341208934784,4.064248290766231,1,3,3,1_3_3,0,
2026-03-02T09:58:35.712048+00:00,B,llm_style,eval,llm_style_eval_039,4,1024,2048,bf16,NVIDIA GeForce RTX 4060,c00,32,32,32,2,2,8,0.0,0.0,100.35199671983719,489.6755138039575,0.167183678934049,0,3,3,0_3_3,0,
2026-03-02T09:58:35.765754+00:00,B,llm_style,eval,llm_style_eval_040,64,8192,1024,bf16,NVIDIA GeForce RTX 4060,c06,64,128,32,4,3,8,0.0,0.0,228.35199534893036,355.7971093058586,4.702134624920981,1,3,3,1_3_3,0,
2026-03-02T09:58:35.778794+00:00,B,llm_style,eval,llm_style_eval_041,2,2048,1024,bf16,NVIDIA GeForce RTX 4060,c00,32,32,32,2,2,8,0.0,0.0,67.58400052785873,90.39872065186495,0.12412121115177462,0,3,3,0_3_3,0,
2026-03-02T09:58:35.824777+00:00,B,llm_style,eval,llm_style_eval_042,2,4096,2048,bf16,NVIDIA GeForce RTX 4060,c00,32,32,32,2,2,8,0.0,0.0,138.65599781274796,225.44128045439695,0.2419976959475966,0,3,3,0_3_3,0,
2026-03-02T09:58:35.838950+00:00,B,llm_style,eval,llm_style_eval_043,1,2048,1024,bf16,NVIDIA GeForce RTX 4060,c00,32,32,32,2,2,8,0.0,0.0,67.37599894404411,106.40383861958972,0.06225219760353204,0,3,3,0_3_3,0,
2026-03-02T09:58:35.936963+00:00,B,llm_style,eval,llm_style_eval_044,8,2048,8192,bf16,NVIDIA GeForce RTX 4060,c00,32,32,32,2,2,8,0.0,0.0,408.57601165771484,437.3545625805855,0.6570024875197084,0,3,3,0_3_3,0,
2026-03-02T09:58:35.988999+00:00,B,llm_style,eval,llm_style_eval_045,1,8192,1024,bf16,NVIDIA GeForce RTX 4060,c00,32,32,32,2,2,8,0.0,0.0,141.31200313568115,244.0192006528377,0.11872463504668675,0,3,3,0_3_3,0,
2026-03-02T09:58:36.019450+00:00,B,llm_style,eval,llm_style_eval_046,64,4096,1024,bf16,NVIDIA GeForce RTX 4060,c06,64,128,32,4,3,8,0.0,0.0,169.47200149297714,299.6310397982596,3.167903295354942,1,3,3,1_3_3,0,
2026-03-02T09:58:36.043984+00:00,B,llm_style,eval,llm_style_eval_047,16,2048,2048,bf16,NVIDIA GeForce RTX 4060,c00,32,32,32,2,2,8,0.0,0.0,131.00800663232803,159.36511799693105,1.0245001923941945,0,3,3,0_3_3,0,
2026-03-02T09:58:36.220985+00:00,B,llm_style,eval,llm_style_eval_048,8,8192,4096,bf16,NVIDIA GeForce RTX 4060,c00,32,32,32,2,2,8,0.0,0.0,486.4000082015991,518.6662554740906,1.1037641919148202,0,3,3,0_3_3,0,
2026-03-02T09:58:36.395087+00:00,B,llm_style,eval,llm_style_eval_049,4,4096,8192,bf16,NVIDIA GeForce RTX 4060,c00,32,32,32,2,2,8,0.0,0.0,494.0800070762634,557.0499187707901,0.5433036191617561,0,3,3,0_3_3,0,
2026-03-02T09:58:36.501040+00:00,B,llm_style,eval,llm_style_eval_050,4,2048,8192,bf16,NVIDIA GeForce RTX 4060,c00,32,32,32,2,2,8,0.0,0.0,451.00800693035126,546.2527945637701,0.2975950003937006,0,3,3,0_3_3,0,
2026-03-02T09:58:36.511311+00:00,B,llm_style,eval,llm_style_eval_051,16,1024,1024,bf16,NVIDIA GeForce RTX 4060,c00,32,32,32,2,2,8,0.0,0.0,71.68000191450119,90.6159998476505,0.4681142732114211,0,3,3,0_3_3,0,
2026-03-02T09:58:36.694604+00:00,B,llm_style,eval,llm_style_eval_052,32,8192,4096,bf16,NVIDIA GeForce RTX 4060,c00,32,32,32,2,2,8,0.0,0.0,639.9360001087189,654.8381000757217,3.3557787773076737,0,3,3,0_3_3,0,
2026-03-02T09:58:36.717205+00:00,B,llm_style,eval,llm_style_eval_053,32,1024,2048,bf16,NVIDIA GeForce RTX 4060,c00,32,32,32,2,2,8,0.0,0.0,157.69599378108978,260.5055984854697,0.8511169166815878,0,3,3,0_3_3,0,
2026-03-02T09:58:36.826102+00:00,B,llm_style,eval,llm_style_eval_054,64,8192,2048,bf16,NVIDIA GeForce RTX 4060,c06,64,128,32,4,3,8,0.0,0.0,500.7359981536865,512.9967904090881,4.28865441254114,1,3,3,1_3_3,0,
2026-03-02T09:58:36.853802+00:00,B,llm_style,eval,llm_style_eval_055,1,4096,1024,bf16,NVIDIA GeForce RTX 4060,c00,32,32,32,2,2,8,0.0,0.0,106.44799843430519,206.17920145392407,0.0788047508960637,0,3,3,0_3_3,0,
2026-03-02T09:58:36.879271+00:00,B,llm_style,eval,llm_style_eval_056,4,2048,2048,bf16,NVIDIA GeForce RTX 4060,c00,32,32,32,2,2,8,0.0,0.0,121.85599654912949,197.35007569193823,0.275361352335842,0,3,3,0_3_3,0,
2026-03-02T09:58:36.943492+00:00,B,llm_style,eval,llm_style_eval_057,16,1024,8192,bf16,NVIDIA GeForce RTX 4060,c00,32,32,32,2,2,8,0.0,0.0,372.73600697517395,384.58368718624115,0.7201758106988551,0,3,3,0_3_3,0,
2026-03-02T09:58:37.120257+00:00,B,llm_style,eval,llm_style_eval_058,1,8192,4096,bf16,NVIDIA GeForce RTX 4060,c00,32,32,32,2,2,8,0.0,0.0,570.3040063381195,616.2172573804855,0.11767208936668906,0,3,3,0_3_3,0,
2026-03-02T09:58:37.141966+00:00,B,llm_style,eval,llm_style_eval_059,8,4096,1024,bf16,NVIDIA GeForce RTX 4060,c00,32,32,32,2,2,8,0.0,0.0,112.12800070643425,154.088962599635,0.5985022793343098,0,3,3,0_3_3,0,
2026-03-02T09:58:37.329887+00:00,B,llm_style,eval,llm_style_eval_060,4,8192,4096,bf16,NVIDIA GeForce RTX 4060,c00,32,32,32,2,2,8,0.0,0.0,608.6239814758301,735.9078359603881,0.44105303795141404,0,3,3,0_3_3,0,
2026-03-02T09:58:37.358098+00:00,B,llm_style,eval,llm_style_eval_061,32,2048,2048,bf16,NVIDIA GeForce RTX 4060,c00,32,32,32,2,2,8,0.0,0.0,163.7599989771843,225.38080066442475,1.639200401053981,0,3,3,0_3_3,0,
2026-03-02T09:58:37.373742+00:00,B,llm_style,eval,llm_style_eval_062,8,2048,1024,bf16,NVIDIA GeForce RTX 4060,c00,32,32,32,2,2,8,0.0,0.0,105.47199845314026,190.69440409541124,0.3181359269959009,0,3,3,0_3_3,0,
2026-03-02T09:58:37.577907+00:00,B,llm_style,eval,llm_style_eval_063,16,4096,8192,bf16,NVIDIA GeForce RTX 4060,c00,32,32,32,2,2,8,0.0,0.0,665.583997964859,707.6454335451126,1.6132326307170182,0,3,3,0_3_3,0,
2026-03-02T09:58:37.810161+00:00,B,training_style,tune,training_style_tune_000,4096,2048,1024,bf16,NVIDIA GeForce RTX 4060,c10,64,128,64,8,3,8,0.0,0.0,3246.079921722412,3759.349775314331,5.292497288509193,3,3,3,3_3_3,0,
2026-03-02T09:58:37.873263+00:00,B,training_style,tune,training_style_tune_001,1536,2048,1536,bf16,NVIDIA GeForce RTX 4060,c10,64,128,64,8,3,8,0.0,0.0,365.90398848056793,1809.8047816753387,26.41041562877965,3,3,3,3_3_3,0,
2026-03-02T09:58:38.074404+00:00,B,training_style,tune,training_style_tune_002,3072,2048,4096,bf16,NVIDIA GeForce RTX 4060,c10,64,128,64,8,3,8,0.0,0.0,1742.784023284912,1864.1305661201477,29.573146679905186,3,3,3,3_3_3,0,
2026-03-02T09:58:38.124697+00:00,B,training_style,tune,training_style_tune_003,2048,1536,2048,bf16,NVIDIA GeForce RTX 4060,c10,64,128,64,8,3,8,0.0,0.0,391.2480026483536,429.0281516313553,32.93282470653457,3,3,3,3_3_3,0,
2026-03-02T09:58:38.136366+00:00,B,training_style,tune,training_style_tune_004,512,512,1024,bf16,NVIDIA GeForce RTX 4060,c04,64,64,64,4,3,8,0.0,0.0,52.22399905323982,192.59263724088646,10.280157049112349,2,2,3,2_2_3,0,
2026-03-02T09:58:38.163808+00:00,B,training_style,tune,training_style_tune_005,1024,1536,1536,bf16,NVIDIA GeForce RTX 4060,c10,64,128,64,8,3,8,0.0,0.0,174.0799993276596,236.43488496541968,27.756423636614,3,3,3,3_3_3,0,
2026-03-02T09:58:38.177249+00:00,B,training_style,tune,training_style_tune_006,1024,1536,512,bf16,NVIDIA GeForce RTX 4060,c05,128,64,32,4,3,8,0.0,0.0,93.10400113463402,235.8476853370666,17.299071107276653,3,3,2,3_3_2,0,
2026-03-02T09:58:38.193057+00:00,B,training_style,tune,training_style_tune_007,2048,1536,512,bf16,NVIDIA GeForce RTX 4060,c05,128,64,32,4,3,8,0.0,0.0,130.048006772995,202.13759377598754,24.76951052100939,3,3,2,3_3_2,0,
2026-03-02T09:58:38.279708+00:00,B,training_style,tune,training_style_tune_008,3072,3072,1536,bf16,NVIDIA GeForce RTX 4060,c10,64,128,64,8,3,8,0.0,0.0,908.3999991416931,1038.0803048610687,31.91438713715581,3,3,3,3_3_3,0,
2026-03-02T09:58:38.298493+00:00,B,training_style,tune,training_style_tune_009,1024,1536,1024,bf16,NVIDIA GeForce RTX 4060,c10,64,128,64,8,3,8,0.0,0.0,137.2160017490387,226.78272500634193,23.47558179031818,3,3,3,3_3_3,0,
2026-03-02T09:58:38.397547+00:00,B,training_style,tune,training_style_tune_010,1536,2048,4096,bf16,NVIDIA GeForce RTX 4060,c10,64,128,64,8,3,8,0.0,0.0,794.975996017456,924.6003234386444,32.41582627034961,3,3,3,3_3_3,0,
2026-03-02T09:58:38.454756+00:00,B,training_style,tune,training_style_tune_011,1024,1024,4096,bf16,NVIDIA GeForce RTX 4060,c10,64,128,64,8,3,8,0.0,0.0,321.0560083389282,356.7001616954803,26.75525256930214,3,3,3,3_3_3,0,
2026-03-02T09:58:38.779487+00:00,B,training_style,tune,training_style_tune_012,3072,4096,4096,bf16,NVIDIA GeForce RTX 4060,c10,64,128,64,8,3,8,0.0,0.0,3214.2239809036255,3297.9149532318115,32.06970507233319,3,3,3,3_3_3,0,
2026-03-02T09:58:38.810930+00:00,B,training_style,tune,training_style_tune_013,512,1024,3072,bf16,NVIDIA GeForce RTX 4060,c09,128,64,64,8,3,8,0.0,0.0,147.45600521564484,286.4569646120069,21.84533256064524,2,3,3,2_3_3,0,
2026-03-02T09:58:38.829913+00:00,B,training_style,tune,training_style_tune_014,1536,1024,1024,bf16,NVIDIA GeForce RTX 4060,c10,64,128,64,8,3,8,0.0,0.0,142.83199608325958,254.01727706193924,22.5525481708054,3,3,3,3_3_3,0,
2026-03-02T09:58:38.891843+00:00,B,training_style,tune,training_style_tune_015,2048,3072,1536,bf16,NVIDIA GeForce RTX 4060,c10,64,128,64,8,3,8,0.0,0.0,621.5520203113556,726.05697453022,31.09531012757114,3,3,3,3_3_3,0,
2026-03-02T09:58:39.003841+00:00,B,training_style,tune,training_style_tune_016,1536,3072,3072,bf16,NVIDIA GeForce RTX 4060,c10,64,128,64,8,3,8,0.0,0.0,892.8639888763428,1006.233571767807,32.469703794958534,3,3,3,3_3_3,0,
2026-03-02T09:58:39.032282+00:00,B,training_style,tune,training_style_tune_017,1024,1024,2048,bf16,NVIDIA GeForce RTX 4060,c10,64,128,64,8,3,8,0.0,0.0,189.13599848747253,267.11904764175404,22.708354466347018,3,3,3,3_3_3,0,
2026-03-02T09:58:39.064182+00:00,B,training_style,tune,training_style_tune_018,1536,1536,1536,bf16,NVIDIA GeForce RTX 4060,c10,64,128,64,8,3,8,0.0,0.0,236.54399812221527,301.78753346204746,30.640208035442516,3,3,3,3_3_3,0,
2026-03-02T09:58:39.106453+00:00,B,training_style,tune,training_style_tune_019,1536,1536,2048,bf16,NVIDIA GeForce RTX 4060,c10,64,128,64,8,3,8,0.0,0.0,320.51199674606323,429.5065638422965,30.150747909933568,3,3,3,3_3_3,0,
2026-03-02T09:58:39.128884+00:00,B,training_style,tune,training_style_tune_020,1536,1536,1024,bf16,NVIDIA GeForce RTX 4060,c10,64,128,64,8,3,8,0.0,0.0,181.15199357271194,259.5020781457423,26.672840374017554,3,3,3,3_3_3,0,
2026-03-02T09:58:39.162552+00:00,B,training_style,tune,training_style_tune_021,1024,2048,1536,bf16,NVIDIA GeForce RTX 4060,c10,64,128,64,8,3,8,0.0,0.0,235.4400008916855,318.3103922009467,27.363451068639176,3,3,3,3_3_3,0,
2026-03-02T09:58:39.179954+00:00,B,training_style,tune,training_style_tune_022,512,1024,1536,bf16,NVIDIA GeForce RTX 4060,c09,128,64,64,8,3,8,0.0,0.0,94.67200189828873,335.24672240018776,17.012556021899364,2,3,3,2_3_3,0,
2026-03-02T09:58:39.236020+00:00,B,training_style,tune,training_style_tune_023,1536,2048,2048,bf16,NVIDIA GeForce RTX 4060,c10,64,128,64,8,3,8,0.0,0.0,415.568009018898,430.5744034051895,31.00551921313572,3,3,3,3_3_3,0,
2026-03-02T09:58:39.254838+00:00,B,training_style,tune,training_style_tune_024,1024,1024,1024,bf16,NVIDIA GeForce RTX 4060,c10,64,128,64,8,3,8,0.0,0.0,104.44799810647964,174.47775840759277,20.560314098224698,3,3,3,3_3_3,0,
2026-03-02T09:58:39.313171+00:00,B,training_style,tune,training_style_tune_025,1536,1024,4096,bf16,NVIDIA GeForce RTX 4060,c10,64,128,64,8,3,8,0.0,0.0,418.68799924850464,443.4768041968345,30.77447147070581,3,3,3,3_3_3,0,
2026-03-02T09:58:39.343544+00:00,B,training_style,tune,training_style_tune_026,2048,4096,512,bf16,NVIDIA GeForce RTX 4060,c05,128,64,32,4,3,8,0.0,0.0,294.3520098924637,348.7132743000983,29.18252399614387,3,3,2,3_3_2,0,
2026-03-02T09:58:39.478937+00:00,B,training_style,tune,training_style_tune_027,4096,4096,1536,bf16,NVIDIA GeForce RTX 4060,c10,64,128,64,8,3,8,0.0,0.0,1600.5600094795227,1701.0166549682617,32.20098418475411,3,3,3,3_3_3,0,
2026-03-02T09:58:39.565140+00:00,B,training_style,tune,training_style_tune_028,1536,1536,4096,bf16,NVIDIA GeForce RTX 4060,c10,64,128,64,8,3,8,0.0,0.0,608.6559891700745,634.2681616544724,31.75414877351914,3,3,3,3_3_3,0,
2026-03-02T09:58:39.677121+00:00,B,training_style,tune,training_style_tune_029,4096,2048,2048,bf16,NVIDIA GeForce RTX 4060,c10,64,128,64,8,3,8,0.0,0.0,1068.127989768982,1266.762543916702,32.1681846156203,3,3,3,3_3_3,0,
2026-03-02T09:58:39.706374+00:00,B,training_style,tune,training_style_tune_030,2048,2048,512,bf16,NVIDIA GeForce RTX 4060,c05,128,64,32,4,3,8,0.0,0.0,199.40800219774246,277.47168004512787,21.53859047111312,3,3,2,3_3_2,0,
2026-03-02T09:58:39.722630+00:00,B,training_style,tune,training_style_tune_031,512,512,1536,bf16,NVIDIA GeForce RTX 4060,c04,64,64,64,4,3,8,0.0,0.0,61.43999844789505,159.74815800786018,13.107200331115733,2,2,3,2_2_3,0,
2026-03-02T09:58:39.794811+00:00,B,training_style,eval,training_style_eval_000,2048,1536,3072,bf16,NVIDIA GeForce RTX 4060,c10,64,128,64,8,3,8,0.0,0.0,605.184018611908,723.5072171688078,31.936323890922562,3,3,3,3_3_3,0,
2026-03-02T09:58:39.835390+00:00,B,training_style,eval,training_style_eval_001,1024,2048,2048,bf16,NVIDIA GeForce RTX 4060,c10,64,128,64,8,3,8,0.0,0.0,298.3520030975342,382.0879906415939,28.791275080502366,3,3,3,3_3_3,0,
2026-03-02T09:58:39.880428+00:00,B,training_style,eval,training_style_eval_002,1536,1024,3072,bf16,NVIDIA GeForce RTX 4060,c10,64,128,64,8,3,8,0.0,0.0,324.6079981327057,375.8694404363632,29.770296701220875,3,3,3,3_3_3,0,
2026-03-02T09:58:39.893113+00:00,B,training_style,eval,training_style_eval_003,1024,512,1024,bf16,NVIDIA GeForce RTX 4060,c06,64,128,32,4,3,8,0.0,0.0,68.60800087451935,79.86399687826633,15.650387860212119,3,2,3,3_2_3,0,
2026-03-02T09:58:39.913542+00:00,B,training_style,eval,training_style_eval_004,1024,2048,1024,bf16,NVIDIA GeForce RTX 4060,c10,64,128,64,8,3,8,0.0,0.0,144.30399984121323,181.28895431756973,29.76332811790403,3,3,3,3_3_3,0,
2026-03-02T09:58:39.929035+00:00,B,training_style,eval,training_style_eval_005,1024,512,1536,bf16,NVIDIA GeForce RTX 4060,c06,64,128,32,4,3,8,0.0,0.0,89.08800035715103,100.19295915961266,18.078896479246403,3,2,3,3_2_3,0,
2026-03-02T09:58:39.977259+00:00,B,training_style,eval,training_style_eval_006,2048,1536,2048,bf16,NVIDIA GeForce RTX 4060,c10,64,128,64,8,3,8,0.0,0.0,421.32799327373505,455.5878338217734,30.58164207861862,3,3,3,3_3_3,0,
2026-03-02T09:58:40.005953+00:00,B,training_style,eval,training_style_eval_007,1536,2048,1024,bf16,NVIDIA GeForce RTX 4060,c10,64,128,64,8,3,8,0.0,0.0,226.30399465560913,246.2182366847992,28.46812736913532,3,3,3,3_3_3,0,
2026-03-02T09:58:40.019382+00:00,B,training_style,eval,training_style_eval_008,512,512,2048,bf16,NVIDIA GeForce RTX 4060,c04,64,64,64,4,3,8,0.0,0.0,64.94399905204773,82.48319812119006,16.53334934209205,2,2,3,2_2_3,0,
2026-03-02T09:58:40.035570+00:00,B,training_style,eval,training_style_eval_009,1024,512,2048,bf16,NVIDIA GeForce RTX 4060,c06,64,128,32,4,3,8,0.0,0.0,96.27200290560722,110.33407777547835,22.30641913730168,3,2,3,3_2_3,0,
2026-03-02T09:58:40.076507+00:00,B,training_style,eval,training_style_eval_010,2048,3072,1024,bf16,NVIDIA GeForce RTX 4060,c10,64,128,64,8,3,8,0.0,0.0,420.8639860153198,435.0739246606827,30.615358681536073,3,3,3,3_3_3,0,
2026-03-02T09:58:40.154100+00:00,B,training_style,eval,training_style_eval_011,2048,4096,1536,bf16,NVIDIA GeForce RTX 4060,c10,64,128,64,8,3,8,0.0,0.0,805.5839836597443,844.3699073791502,31.988972346407063,3,3,3,3_3_3,0,
2026-03-02T09:58:40.288393+00:00,B,training_style,eval,training_style_eval_012,2048,3072,3072,bf16,NVIDIA GeForce RTX 4060,c10,64,128,64,8,3,8,0.0,0.0,1193.2960152626038,1307.003539800644,32.393224455286074,3,3,3,3_3_3,0,
2026-03-02T09:58:40.349416+00:00,B,training_style,eval,training_style_eval_013,3072,1536,1536,bf16,NVIDIA GeForce RTX 4060,c10,64,128,64,8,3,8,0.0,0.0,467.9679870605469,578.208983540535,30.975440681425358,3,3,3,3_3_3,0,
2026-03-02T09:58:40.387293+00:00,B,training_style,eval,training_style_eval_014,2048,1536,1536,bf16,NVIDIA GeForce RTX 4060,c10,64,128,64,8,3,8,0.0,0.0,319.472000002861,368.1907331943511,30.248899483877953,3,3,3,3_3_3,0,
2026-03-02T09:58:40.441552+00:00,B,training_style,eval,training_style_eval_015,4096,2048,1024,bf16,NVIDIA GeForce RTX 4060,c10,64,128,64,8,3,8,0.0,0.0,551.4239966869354,568.9241701364517,31.15546165422625,3,3,3,3_3_3,0,
2026-03-02T09:58:40.458919+00:00,B,training_style,eval,training_style_eval_016,2048,1024,512,bf16,NVIDIA GeForce RTX 4060,c05,128,64,32,4,3,8,0.0,0.0,87.47200295329094,186.91424310207364,24.55052560242312,3,3,2,3_3_2,0,
2026-03-02T09:58:40.577367+00:00,B,training_style,eval,training_style_eval_017,2048,4096,2048,bf16,NVIDIA GeForce RTX 4060,c10,64,128,64,8,3,8,0.0,0.0,1057.7919483184814,1171.1862432956696,32.48251078354297,3,3,3,3_3_3,0,
2026-03-02T09:58:40.660306+00:00,B,training_style,eval,training_style_eval_018,1536,2048,3072,bf16,NVIDIA GeForce RTX 4060,c10,64,128,64,8,3,8,0.0,0.0,604.447990655899,710.8611178398132,31.975212310702677,3,3,3,3_3_3,0,
2026-03-02T09:58:40.717439+00:00,B,training_style,eval,training_style_eval_019,1536,1536,3072,bf16,NVIDIA GeForce RTX 4060,c10,64,128,64,8,3,8,0.0,0.0,461.5679979324341,506.45695984363545,31.404938576616622,3,3,3,3_3_3,0,
2026-03-02T09:58:40.790720+00:00,B,training_style,eval,training_style_eval_020,3072,1536,2048,bf16,NVIDIA GeForce RTX 4060,c10,64,128,64,8,3,8,0.0,0.0,605.6160032749176,779.611511826515,31.913543776065648,3,3,3,3_3_3,0,
2026-03-02T09:58:40.871320+00:00,B,training_style,eval,training_style_eval_021,2048,1024,4096,bf16,NVIDIA GeForce RTX 4060,c10,64,128,64,8,3,8,0.0,0.0,553.8239777088165,570.4089522361755,31.020450315411665,3,3,3,3_3_3,0,
2026-03-02T09:58:40.882544+00:00,B,training_style,eval,training_style_eval_022,512,512,1536,bf16,NVIDIA GeForce RTX 4060,c04,64,64,64,4,3,8,0.0,0.0,58.14399942755699,71.29695810377595,13.850205970150894,2,2,3,2_2_3,0,
2026-03-02T09:58:41.214463+00:00,B,training_style,eval,training_style_eval_023,3072,4096,4096,bf16,NVIDIA GeForce RTX 4060,c10,64,128,64,8,3,8,0.0,0.0,3254.7839879989624,3310.1720929145813,31.67006335414996,3,3,3,3_3_3,0,
2026-03-02T09:58:41.275869+00:00,B,training_style,eval,training_style_eval_024,1536,1024,4096,bf16,NVIDIA GeForce RTX 4060,c10,64,128,64,8,3,8,0.0,0.0,420.864000916481,520.3865534067153,30.61535759756502,3,3,3,3_3_3,0,
2026-03-02T09:58:41.430071+00:00,B,training_style,eval,training_style_eval_025,4096,3072,2048,bf16,NVIDIA GeForce RTX 4060,c10,64,128,64,8,3,8,0.0,0.0,1569.7920322418213,1661.8566799163818,32.83212457028224,3,3,3,3_3_3,0,
2026-03-02T09:58:41.445486+00:00,B,training_style,eval,training_style_eval_026,1024,512,512,bf16,NVIDIA GeForce RTX 4060,c04,64,64,64,4,3,8,0.0,0.0,55.296000093221664,136.62976428866386,9.709037020668898,3,2,2,3_2_2,0,
2026-03-02T09:58:41.503804+00:00,B,training_style,eval,training_style_eval_027,2048,4096,1024,bf16,NVIDIA GeForce RTX 4060,c10,64,128,64,8,3,8,0.0,0.0,566.8160021305084,626.4838528633117,30.309428667196247,3,3,3,3_3_3,0,
2026-03-02T09:58:41.527228+00:00,B,training_style,eval,training_style_eval_028,1536,1536,1024,bf16,NVIDIA GeForce RTX 4060,c10,64,128,64,8,3,8,0.0,0.0,155.64799308776855,242.8819198906421,31.043369799669488,3,3,3,3_3_3,0,
2026-03-02T09:58:41.557766+00:00,B,training_style,eval,training_style_eval_029,1024,512,4096,bf16,NVIDIA GeForce RTX 4060,c06,64,128,32,4,3,8,0.0,0.0,170.78399658203125,179.011839479208,25.148534885919677,3,2,3,3_2_3,0,
2026-03-02T09:58:41.592835+00:00,B,training_style,eval,training_style_eval_030,1024,1024,3072,bf16,NVIDIA GeForce RTX 4060,c10,64,128,64,8,3,8,0.0,0.0,250.30400604009628,315.09503871202463,25.738505131907402,3,3,3,3_3_3,0,
2026-03-02T09:58:41.608068+00:00,B,training_style,eval,training_style_eval_031,1024,1024,512,bf16,NVIDIA GeForce RTX 4060,c05,128,64,32,4,3,8,0.0,0.0,90.62399715185165,183.3286352455616,11.848316756551949,3,3,2,3_3_2,0,
2026-03-02T09:58:41.620837+00:00,B,training_style,eval,training_style_eval_032,512,1024,1024,bf16,NVIDIA GeForce RTX 4060,c09,128,64,64,8,3,8,0.0,0.0,70.65600156784058,156.41952022910112,15.196753285975904,2,3,3,2_3_3,0,
2026-03-02T09:58:41.707140+00:00,B,training_style,eval,training_style_eval_033,3072,2048,2048,bf16,NVIDIA GeForce RTX 4060,c10,64,128,64,8,3,8,0.0,0.0,809.9839985370636,868.7654215097427,31.81520106884039,3,3,3,3_3_3,0,
2026-03-02T09:58:41.725157+00:00,B,training_style,eval,training_style_eval_034,1536,1024,512,bf16,NVIDIA GeForce RTX 4060,c05,128,64,32,4,3,8,0.0,0.0,88.44799920916557,259.1232019662856,18.20971362157277,3,3,2,3_3_2,0,
2026-03-02T09:58:42.149192+00:00,B,training_style,eval,training_style_eval_035,4096,4096,4096,bf16,NVIDIA GeForce RTX 4060,c10,64,128,64,8,3,8,0.0,0.0,4358.1438064575195,4419.787082672119,31.536121701251542,3,3,3,3_3_3,0,
2026-03-02T09:58:42.390422+00:00,B,training_style,eval,training_style_eval_036,2048,4096,4096,bf16,NVIDIA GeForce RTX 4060,c10,64,128,64,8,3,8,0.0,0.0,2194.223999977112,2268.1178498268127,31.318350695606657,3,3,3,3_3_3,0,
2026-03-02T09:58:42.427832+00:00,B,training_style,eval,training_style_eval_037,4096,2048,512,bf16,NVIDIA GeForce RTX 4060,c05,128,64,32,4,3,8,0.0,0.0,276.4799892902374,332.6873570680617,31.06891972200793,3,3,2,3_3_2,0,
2026-03-02T09:58:42.443187+00:00,B,training_style,eval,training_style_eval_038,2048,1536,512,bf16,NVIDIA GeForce RTX 4060,c05,128,64,32,4,3,8,0.0,0.0,126.97599828243256,175.25344610214216,25.368774536704425,3,3,2,3_3_2,0,
2026-03-02T09:58:42.530774+00:00,B,training_style,eval,training_style_eval_039,3072,3072,1536,bf16,NVIDIA GeForce RTX 4060,c10,64,128,64,8,3,8,0.0,0.0,898.8800048828125,992.63709962368,32.25239085363744,3,3,3,3_3_3,0,
2026-03-02T09:58:42.550124+00:00,B,training_style,eval,training_style_eval_040,1536,1536,512,bf16,NVIDIA GeForce RTX 4060,c05,128,64,32,4,3,8,0.0,0.0,117.71200224757195,212.3049597442149,20.523982753422523,3,3,2,3_3_2,0,
2026-03-02T09:58:42.667572+00:00,B,training_style,eval,training_style_eval_041,3072,3072,2048,bf16,NVIDIA GeForce RTX 4060,c10,64,128,64,8,3,8,0.0,0.0,1183.791995048523,1311.9574403762817,32.65329198514775,3,3,3,3_3_3,0,
2026-03-02T09:58:42.787596+00:00,B,training_style,eval,training_style_eval_042,3072,4096,1536,bf16,NVIDIA GeForce RTX 4060,c10,64,128,64,8,3,8,0.0,0.0,1184.5600008964539,1332.3673117160797,32.63212132331567,3,3,3,3_3_3,0,
2026-03-02T09:58:42.854558+00:00,B,training_style,eval,training_style_eval_043,2048,3072,1536,bf16,NVIDIA GeForce RTX 4060,c10,64,128,64,8,3,8,0.0,0.0,609.7919940948486,744.0896242856977,31.694992750255384,3,3,3,3_3_3,0,
2026-03-02T09:58:42.876356+00:00,B,training_style,eval,training_style_eval_044,512,512,4096,bf16,NVIDIA GeForce RTX 4060,c04,64,64,64,4,3,8,0.0,0.0,111.9999997317791,168.93152371048916,19.17396118877551,2,2,3,2_2_3,0,
2026-03-02T09:58:42.932344+00:00,B,training_style,eval,training_style_eval_045,2048,1024,3072,bf16,NVIDIA GeForce RTX 4060,c10,64,128,64,8,3,8,0.0,0.0,424.9599874019623,485.81889390945423,30.32027077836953,3,3,3,3_3_3,0,
2026-03-02T09:58:43.260252+00:00,B,training_style,eval,training_style_eval_046,4096,3072,4096,bf16,NVIDIA GeForce RTX 4060,c10,64,128,64,8,3,8,0.0,0.0,3254.8160552978516,3348.53497505188,31.669751332404285,3,3,3,3_3_3,0,
2026-03-02T09:58:43.307367+00:00,B,training_style,eval,training_style_eval_047,1536,3072,1024,bf16,NVIDIA GeForce RTX 4060,c10,64,128,64,8,3,8,0.0,0.0,344.9440002441406,450.18943190574646,28.015203653811493,3,3,3,3_3_3,0,
2026-03-02T09:58:43.328641+00:00,B,training_style,eval,training_style_eval_048,512,512,3072,bf16,NVIDIA GeForce RTX 4060,c04,64,64,64,4,3,8,0.0,0.0,94.17600184679031,179.50592055916778,17.102156647297644,2,2,3,2_2_3,0,
2026-03-02T09:58:43.362910+00:00,B,training_style,eval,training_style_eval_049,512,1024,4096,bf16,NVIDIA GeForce RTX 4060,c09,128,64,64,8,3,8,0.0,0.0,176.12800002098083,215.38464084267605,24.38548836918816,2,3,3,2_3_3,0,
2026-03-02T09:58:43.387063+00:00,B,training_style,eval,training_style_eval_050,3072,2048,512,bf16,NVIDIA GeForce RTX 4060,c05,128,64,32,4,3,8,0.0,0.0,228.35199534893036,262.0339173078537,28.21280774952588,3,3,2,3_3_2,0,
2026-03-02T09:58:43.395059+00:00,B,training_style,eval,training_style_eval_051,512,512,1024,bf16,NVIDIA GeForce RTX 4060,c04,64,64,64,4,3,8,0.0,0.0,49.136001616716385,112.08927936851967,10.926223020502203,2,2,3,2_2_3,0,
2026-03-02T09:58:43.436176+00:00,B,training_style,eval,training_style_eval_052,1536,2048,1536,bf16,NVIDIA GeForce RTX 4060,c10,64,128,64,8,3,8,0.0,0.0,346.6240018606186,449.8467144370079,27.879420825237233,3,3,3,3_3_3,0,
2026-03-02T09:58:43.540694+00:00,B,training_style,eval,training_style_eval_053,1536,3072,3072,bf16,NVIDIA GeForce RTX 4060,c10,64,128,64,8,3,8,0.0,0.0,881.1519742012024,1038.3004915714264,32.90128161408418,3,3,3,3_3_3,0,
2026-03-02T09:58:43.586323+00:00,B,training_style,eval,training_style_eval_054,4096,3072,512,bf16,NVIDIA GeForce RTX 4060,c05,128,64,32,4,3,8,0.0,0.0,431.08800053596497,553.8659232854843,29.88926129231248,3,3,2,3_3_2,0,
2026-03-02T09:58:43.601839+00:00,B,training_style,eval,training_style_eval_055,1024,1024,1024,bf16,NVIDIA GeForce RTX 4060,c10,64,128,64,8,3,8,0.0,0.0,109.63200032711029,118.79360273480415,19.588109690533123,3,3,3,3_3_3,0,
2026-03-02T09:58:43.626377+00:00,B,training_style,eval,training_style_eval_056,512,1024,3072,bf16,NVIDIA GeForce RTX 4060,c09,128,64,64,8,3,8,0.0,0.0,147.2960039973259,241.98144346475584,21.869062191656468,2,3,3,2_3_3,0,
2026-03-02T09:58:43.644621+00:00,B,training_style,eval,training_style_eval_057,1024,1536,1024,bf16,NVIDIA GeForce RTX 4060,c10,64,128,64,8,3,8,0.0,0.0,131.1039999127388,202.63935759663576,24.5700014808397,3,3,3,3_3_3,0,
2026-03-02T09:58:43.762971+00:00,B,training_style,eval,training_style_eval_058,4096,2048,2048,bf16,NVIDIA GeForce RTX 4060,c10,64,128,64,8,3,8,0.0,0.0,1065.8720135688782,1120.3299450874329,32.23627033132494,3,3,3,3_3_3,0,
2026-03-02T09:58:43.798056+00:00,B,training_style,eval,training_style_eval_059,2048,3072,512,bf16,NVIDIA GeForce RTX 4060,c05,128,64,32,4,3,8,0.0,0.0,234.44800078868866,407.9001489281653,27.479231737218665,3,3,2,3_3_2,0,
2026-03-02T09:58:43.833897+00:00,B,training_style,eval,training_style_eval_060,3072,3072,512,bf16,NVIDIA GeForce RTX 4060,c05,128,64,32,4,3,8,0.0,0.0,299.99999701976776,376.1971205472945,32.21225504,3,3,2,3_3_2,0,
2026-03-02T09:58:43.897055+00:00,B,training_style,eval,training_style_eval_061,2048,2048,2048,bf16,NVIDIA GeForce RTX 4060,c10,64,128,64,8,3,8,0.0,0.0,558.3840012550354,672.2662329673767,30.767122885659635,3,3,3,3_3_3,0,
2026-03-02T09:58:43.910566+00:00,B,training_style,eval,training_style_eval_062,1024,2048,512,bf16,NVIDIA GeForce RTX 4060,c05,128,64,32,4,3,8,0.0,0.0,97.28000313043594,107.23839990794657,22.07528350015151,3,3,2,3_3_2,0,
2026-03-02T09:58:44.029378+00:00,B,training_style,eval,training_style_eval_063,3072,1536,3072,bf16,NVIDIA GeForce RTX 4060,c10,64,128,64,8,3,8,0.0,0.0,891.103982925415,958.759338259697,32.53383421407795,3,3,3,3_3_3,0,
2026-03-02T09:58:44.038664+00:00,B,adversarial,tune,adversarial_tune_000,1,1024,1024,bf16,NVIDIA GeForce RTX 4060,c00,32,32,32,2,2,8,0.0,0.0,36.86400130391121,222.77952432632446,0.056888886876680304,0,3,3,0_3_3,0,
2026-03-02T09:58:44.056973+00:00,B,adversarial,tune,adversarial_tune_001,1,1024,4096,bf16,NVIDIA GeForce RTX 4060,c00,32,32,32,2,2,8,0.0,0.0,64.51199948787689,115.01920096576205,0.13003174706399215,0,3,3,0_3_3,0,
2026-03-02T09:58:44.073328+00:00,B,adversarial,tune,adversarial_tune_002,1,4096,1024,bf16,NVIDIA GeForce RTX 4060,c00,32,32,32,2,2,8,0.0,0.0,38.91199827194214,82.86463897675264,0.21557895694214924,0,3,3,0_3_3,0,
2026-03-02T09:58:44.159561+00:00,B,adversarial,tune,adversarial_tune_003,1,4096,4096,bf16,NVIDIA GeForce RTX 4060,c00,32,32,32,2,2,8,0.0,0.0,160.76800227165222,295.2822417020798,0.2087133728470579,0,3,3,0_3_3,0,
2026-03-02T09:58:44.198746+00:00,B,adversarial,tune,adversarial_tune_004,1,8192,1024,bf16,NVIDIA GeForce RTX 4060,c00,32,32,32,2,2,8,0.0,0.0,50.04800111055374,92.65983875840891,0.3352224989553509,0,3,3,0_3_3,0,
2026-03-02T09:58:44.369833+00:00,B,adversarial,tune,adversarial_tune_005,1,8192,4096,bf16,NVIDIA GeForce RTX 4060,c00,32,32,32,2,2,8,0.0,0.0,322.52800464630127,480.55840402841545,0.2080714326608463,0,3,3,0_3_3,0,
2026-03-02T09:58:44.380507+00:00,B,adversarial,tune,adversarial_tune_006,2,1024,1024,bf16,NVIDIA GeForce RTX 4060,c00,32,32,32,2,2,8,0.0,0.0,53.13600040972233,185.6716831028461,0.07893525985505988,0,3,3,0_3_3,0,
2026-03-02T09:58:44.399208+00:00,B,adversarial,tune,adversarial_tune_007,2,1024,4096,bf16,NVIDIA GeForce RTX 4060,c00,32,32,32,2,2,8,0.0,0.0,59.328000992536545,71.06816075742245,0.2827874817847069,0,3,3,0_3_3,0,
2026-03-02T09:58:44.416932+00:00,B,adversarial,tune,adversarial_tune_008,2,4096,1024,bf16,NVIDIA GeForce RTX 4060,c00,32,32,32,2,2,8,0.0,0.0,65.5359998345375,143.65472048521036,0.2560000006463379,0,3,3,0_3_3,0,
2026-03-02T09:58:44.504279+00:00,B,adversarial,tune,adversarial_tune_009,2,4096,4096,bf16,NVIDIA GeForce RTX 4060,c00,32,32,32,2,2,8,0.0,0.0,164.62399810552597,174.46592196822166,0.40764933893163263,0,3,3,0_3_3,0,
2026-03-02T09:58:44.546721+00:00,B,adversarial,tune,adversarial_tune_010,2,8192,1024,bf16,NVIDIA GeForce RTX 4060,c00,32,32,32,2,2,8,0.0,0.0,56.12799897789955,68.12672071158886,0.5978198512512816,0,3,3,0_3_3,0,
2026-03-02T09:58:44.720261+00:00,B,adversarial,tune,adversarial_tune_011,2,8192,4096,bf16,NVIDIA GeForce RTX 4060,c00,32,32,32,2,2,8,0.0,0.0,296.7039942741394,335.4198479652405,0.4523623900930354,0,3,3,0_3_3,0,
2026-03-02T09:58:44.730938+00:00,B,adversarial,tune,adversarial_tune_012,4,1024,1024,bf16,NVIDIA GeForce RTX 4060,c00,32,32,32,2,2,8,0.0,0.0,59.39200147986412,124.32543806731694,0.14124137579104856,0,3,3,0_3_3,0,
2026-03-02T09:58:44.752328+00:00,B,adversarial,tune,adversarial_tune_013,4,1024,4096,bf16,NVIDIA GeForce RTX 4060,c00,32,32,32,2,2,8,0.0,0.0,65.5359998345375,103.88351745903492,0.5120000012926758,0,3,3,0_3_3,0,
2026-03-02T09:58:44.771265+00:00,B,adversarial,tune,adversarial_tune_014,4,4096,1024,bf16,NVIDIA GeForce RTX 4060,c00,32,32,32,2,2,8,0.0,0.0,62.352001667022705,166.48191660642613,0.5381452255404748,0,3,3,0_3_3,0,
2026-03-02T09:58:44.854312+00:00,B,adversarial,tune,adversarial_tune_015,4,4096,4096,bf16,NVIDIA GeForce RTX 4060,c00,32,32,32,2,2,8,0.0,0.0,164.65599834918976,255.18079683184618,0.8151402277818108,0,3,3,0_3_3,0,
2026-03-02T09:58:44.898148+00:00,B,adversarial,tune,adversarial_tune_016,4,8192,1024,bf16,NVIDIA GeForce RTX 4060,c00,32,32,32,2,2,8,0.0,0.0,52.22399905323982,259.6966342628,1.2850196311390436,0,3,3,0_3_3,0,
2026-03-02T09:58:45.060432+00:00,B,adversarial,tune,adversarial_tune_017,4,8192,4096,bf16,NVIDIA GeForce RTX 4060,c00,32,32,32,2,2,8,0.0,0.0,319.90399956703186,377.00062960386276,0.8391125348958093,0,3,3,0_3_3,0,
2026-03-02T09:58:45.071105+00:00,B,adversarial,tune,adversarial_tune_018,8,1024,1024,bf16,NVIDIA GeForce RTX 4060,c00,32,32,32,2,2,8,0.0,0.0,60.40000170469284,138.06464061141014,0.27776846898162383,0,3,3,0_3_3,0,
2026-03-02T09:58:45.091559+00:00,B,adversarial,tune,adversarial_tune_019,8,1024,4096,bf16,NVIDIA GeForce RTX 4060,c00,32,32,32,2,2,8,0.0,0.0,81.91999793052673,189.7062370181083,0.8192000206947332,0,3,3,0_3_3,0,
2026-03-02T09:58:45.108954+00:00,B,adversarial,tune,adversarial_tune_020,8,4096,1024,bf16,NVIDIA GeForce RTX 4060,c00,32,32,32,2,2,8,0.0,0.0,65.5359998345375,92.79072195291518,1.0240000025853515,0,3,3,0_3_3,0,
2026-03-02T09:58:45.193722+00:00,B,adversarial,tune,adversarial_tune_021,8,4096,4096,bf16,NVIDIA GeForce RTX 4060,c00,32,32,32,2,2,8,0.0,0.0,164.86400365829468,279.75583285093296,1.6282235663545612,0,3,3,0_3_3,0,
2026-03-02T09:58:45.235115+00:00,B,adversarial,tune,adversarial_tune_022,8,8192,1024,bf16,NVIDIA GeForce RTX 4060,c00,32,32,32,2,2,8,0.0,0.0,52.22399905323982,138.34240213036537,2.570039262278087,0,3,3,0_3_3,0,
2026-03-02T09:58:45.395976+00:00,B,adversarial,tune,adversarial_tune_023,8,8192,4096,bf16,NVIDIA GeForce RTX 4060,c00,32,32,32,2,2,8,0.0,0.0,316.4159953594208,402.35041230916954,1.6967249439781382,0,3,3,0_3_3,0,
2026-03-02T09:58:45.405661+00:00,B,adversarial,tune,adversarial_tune_024,16,1024,1024,bf16,NVIDIA GeForce RTX 4060,c00,32,32,32,2,2,8,0.0,0.0,51.19999870657921,159.9548781663178,0.6553600165557865,0,3,3,0_3_3,0,
2026-03-02T09:58:45.425328+00:00,B,adversarial,tune,adversarial_tune_025,16,1024,4096,bf16,NVIDIA GeForce RTX 4060,c00,32,32,32,2,2,8,0.0,0.0,73.21600243449211,202.54527747631067,1.833174764220259,0,3,3,0_3_3,0,
2026-03-02T09:58:45.444121+00:00,B,adversarial,tune,adversarial_tune_026,16,4096,1024,bf16,NVIDIA GeForce RTX 4060,c00,32,32,32,2,2,8,0.0,0.0,59.37600135803223,114.54815782606596,2.2604709803659317,0,3,3,0_3_3,0,
2026-03-02T09:58:45.531257+00:00,B,adversarial,tune,adversarial_tune_027,16,4096,4096,bf16,NVIDIA GeForce RTX 4060,c00,32,32,32,2,2,8,0.0,0.0,174.0799993276596,295.9593620896338,3.0840470707348886,0,3,3,0_3_3,0,
2026-03-02T09:58:45.579565+00:00,B,adversarial,tune,adversarial_tune_028,16,8192,1024,bf16,NVIDIA GeForce RTX 4060,c00,32,32,32,2,2,8,0.0,0.0,61.43999844789505,204.03615787625307,4.369066777038577,0,3,3,0_3_3,0,
2026-03-02T09:58:45.756491+00:00,B,adversarial,tune,adversarial_tune_029,16,8192,4096,bf16,NVIDIA GeForce RTX 4060,c00,32,32,32,2,2,8,0.0,0.0,298.73600602149963,416.8643230199814,3.594283254636283,0,3,3,0_3_3,0,
2026-03-02T09:58:45.765546+00:00,B,adversarial,tune,adversarial_tune_030,32,1024,1024,bf16,NVIDIA GeForce RTX 4060,c00,32,32,32,2,2,8,0.0,0.0,37.247998639941216,247.37631306052185,1.8016770417307424,0,3,3,0_3_3,0,
2026-03-02T09:58:45.784855+00:00,B,adversarial,tune,adversarial_tune_031,32,1024,4096,bf16,NVIDIA GeForce RTX 4060,c00,32,32,32,2,2,8,0.0,0.0,70.5760009586811,135.16800105571747,3.8034948474504273,0,3,3,0_3_3,0,
2026-03-02T09:58:45.795258+00:00,B,adversarial,eval,adversarial_eval_000,1,1024,1024,bf16,NVIDIA GeForce RTX 4060,c00,32,32,32,2,2,8,0.0,0.0,36.19199991226196,153.80479976534838,0.05794518139599902,0,3,3,0_3_3,0,
2026-03-02T09:58:45.817786+00:00,B,adversarial,eval,adversarial_eval_001,1,1024,4096,bf16,NVIDIA GeForce RTX 4060,c00,32,32,32,2,2,8,0.0,0.0,79.74399998784065,220.28832316398615,0.10519422152486825,0,3,3,0_3_3,0,
2026-03-02T09:58:45.836515+00:00,B,adversarial,eval,adversarial_eval_002,1,4096,1024,bf16,NVIDIA GeForce RTX 4060,c00,32,32,32,2,2,8,0.0,0.0,39.91999849677086,210.94271585345248,0.2101354788547539,0,3,3,0_3_3,0,
2026-03-02T09:58:45.925653+00:00,B,adversarial,eval,adversarial_eval_003,1,4096,4096,bf16,NVIDIA GeForce RTX 4060,c00,32,32,32,2,2,8,0.0,0.0,163.83999586105347,251.31327852606773,0.2048000051736833,0,3,3,0_3_3,0,
2026-03-02T09:58:45.966329+00:00,B,adversarial,eval,adversarial_eval_004,1,8192,1024,bf16,NVIDIA GeForce RTX 4060,c00,32,32,32,2,2,8,0.0,0.0,68.44799965620041,106.91648058593259,0.2451089306373941,0,3,3,0_3_3,0,
2026-03-02T09:58:46.141539+00:00,B,adversarial,eval,adversarial_eval_005,1,8192,4096,bf16,NVIDIA GeForce RTX 4060,c00,32,32,32,2,2,8,0.0,0.0,498.6880123615265,525.3324866294861,0.13457083855336205,0,3,3,0_3_3,0,
2026-03-02T09:58:46.152999+00:00,B,adversarial,eval,adversarial_eval_006,2,1024,1024,bf16,NVIDIA GeForce RTX 4060,c00,32,32,32,2,2,8,0.0,0.0,68.97599995136261,108.48896265029896,0.06080816520177381,0,3,3,0_3_3,0,
2026-03-02T09:58:46.173643+00:00,B,adversarial,eval,adversarial_eval_007,2,1024,4096,bf16,NVIDIA GeForce RTX 4060,c00,32,32,32,2,2,8,0.0,0.0,89.08800035715103,181.2787252664565,0.18832183832548333,0,3,3,0_3_3,0,
2026-03-02T09:58:46.193126+00:00,B,adversarial,eval,adversarial_eval_008,2,4096,1024,bf16,NVIDIA GeForce RTX 4060,c00,32,32,32,2,2,8,0.0,0.0,69.63200122117996,186.69856250286082,0.2409411722450521,0,3,3,0_3_3,0,
2026-03-02T09:58:46.284876+00:00,B,adversarial,eval,adversarial_eval_009,2,4096,4096,bf16,NVIDIA GeForce RTX 4060,c00,32,32,32,2,2,8,0.0,0.0,250.88000297546387,267.8396809101105,0.2674938743785142,0,3,3,0_3_3,0,
2026-03-02T09:58:46.327873+00:00,B,adversarial,eval,adversarial_eval_010,2,8192,1024,bf16,NVIDIA GeForce RTX 4060,c00,32,32,32,2,2,8,0.0,0.0,74.75200295448303,207.39072650670985,0.4488766945874548,0,3,3,0_3_3,0,
2026-03-02T09:58:46.500771+00:00,B,adversarial,eval,adversarial_eval_011,2,8192,4096,bf16,NVIDIA GeForce RTX 4060,c00,32,32,32,2,2,8,0.0,0.0,472.06398844718933,669.6470236778257,0.2843210481729326,0,3,3,0_3_3,0,
