results/phase2_llm_group4.csv
timestamp,method,workload,split,shape_id,M,N,K,dtype,gpu,config_id,BLOCK_M,BLOCK_N,BLOCK_K,num_warps,num_stages,GROUP_M,compile_time_ms,tune_time_ms,runtime_cost_us,p99_us,runtime_perf_tflops,bucket_m,bucket_n,bucket_k,cache_key,invalid_config,notes
2026-03-02T10:14:37.935376+00:00,A,llm_style,tune,llm_style_tune_000,8,4096,1024,bf16,NVIDIA GeForce RTX 4060,c02,32,64,32,2,2,8,125.56813599076122,3607.406,42.70400106906891,107.01823897659779,1.5714889078299472,0,3,3,8x4096x1024,0,
2026-03-02T10:14:40.025239+00:00,A,llm_style,tune,llm_style_tune_001,32,1024,2048,bf16,NVIDIA GeForce RTX 4060,c04,64,64,64,4,3,8,0.0,2089.822,46.08000069856644,58.44991926103829,2.9127110669548135,0,3,3,32x1024x2048,0,
2026-03-02T10:14:40.114292+00:00,A,llm_style,tune,llm_style_tune_002,16,2048,1024,bf16,NVIDIA GeForce RTX 4060,c00,32,32,32,2,2,8,0.0,89.011,17.71199982613325,268.5577562451358,3.7888925394513566,0,3,3,16x2048x1024,0,
2026-03-02T10:14:42.385252+00:00,A,llm_style,tune,llm_style_tune_003,1,1024,4096,bf16,NVIDIA GeForce RTX 4060,c04,64,64,64,4,3,8,0.0,2270.911,60.35200133919716,124.68895792961116,0.13899469468880402,0,3,3,1x1024x4096,0,
2026-03-02T10:14:42.616082+00:00,A,llm_style,tune,llm_style_tune_004,64,2048,2048,bf16,NVIDIA GeForce RTX 4060,c11,32,128,32,4,2,8,0.0,230.793,180.7200014591217,252.93439924716938,2.9707332208130737,1,3,3,64x2048x2048,0,
2026-03-02T10:14:43.596745+00:00,A,llm_style,tune,llm_style_tune_005,32,8192,8192,bf16,NVIDIA GeForce RTX 4060,c11,32,128,32,4,2,8,0.0,980.606,563.1999969482422,593.8588833808899,7.626007314049587,0,3,3,32x8192x8192,0,
2026-03-02T10:14:44.345065+00:00,A,llm_style,tune,llm_style_tune_006,16,8192,8192,bf16,NVIDIA GeForce RTX 4060,c11,32,128,32,4,2,8,0.0,748.258,563.5199844837189,731.7709040641782,3.8108384922097556,0,3,3,16x8192x8192,0,
2026-03-02T10:14:44.497544+00:00,A,llm_style,tune,llm_style_tune_007,2,1024,8192,bf16,NVIDIA GeForce RTX 4060,c04,64,64,64,4,3,8,0.0,152.424,88.06400001049042,103.98719795048235,0.381023255768565,0,3,3,2x1024x8192,0,
2026-03-02T10:14:44.729484+00:00,A,llm_style,tune,llm_style_tune_008,16,2048,8192,bf16,NVIDIA GeForce RTX 4060,c10,64,128,64,8,3,8,0.0,231.89,163.85599970817566,215.29599428176863,3.2764800370822953,0,3,3,16x2048x8192,0,
2026-03-02T10:14:44.848323+00:00,A,llm_style,tune,llm_style_tune_009,4,4096,2048,bf16,NVIDIA GeForce RTX 4060,c11,32,128,32,4,2,8,0.0,118.787,53.088000044226646,75.39327982813113,1.2641060869517184,0,3,3,4x4096x2048,0,
2026-03-02T10:14:45.251921+00:00,A,llm_style,tune,llm_style_tune_010,64,8192,4096,bf16,NVIDIA GeForce RTX 4060,c10,64,128,64,8,3,8,0.0,403.551,304.1279911994934,364.1433599591255,14.122236098888731,1,3,3,64x8192x4096,0,
2026-03-02T10:14:45.362887+00:00,A,llm_style,tune,llm_style_tune_011,16,8192,1024,bf16,NVIDIA GeForce RTX 4060,c11,32,128,32,4,2,8,0.0,110.919,49.95200037956238,54.19488098472357,5.373867992478417,0,3,3,16x8192x1024,0,
2026-03-02T10:14:45.473909+00:00,A,llm_style,tune,llm_style_tune_012,2,8192,1024,bf16,NVIDIA GeForce RTX 4060,c11,32,128,32,4,2,8,0.0,110.981,49.95200037956238,59.26560036838055,0.6717334990598022,0,3,3,2x8192x1024,0,
2026-03-02T10:14:45.689549+00:00,A,llm_style,tune,llm_style_tune_013,16,8192,2048,bf16,NVIDIA GeForce RTX 4060,c11,32,128,32,4,2,8,0.0,215.595,161.79199516773224,172.46080100536344,3.3182785801202197,0,3,3,16x8192x2048,0,
2026-03-02T10:14:45.906499+00:00,A,llm_style,tune,llm_style_tune_014,8,4096,4096,bf16,NVIDIA GeForce RTX 4060,c11,32,128,32,4,2,8,0.0,216.9,160.800002515316,249.30495873093585,1.6693747002549446,0,3,3,8x4096x4096,0,
2026-03-02T10:14:45.972274+00:00,A,llm_style,tune,llm_style_tune_015,64,1024,1024,bf16,NVIDIA GeForce RTX 4060,c00,32,32,32,2,2,8,0.0,65.73,39.93599861860275,139.81504015624517,3.360820629072225,1,3,3,64x1024x1024,0,
2026-03-02T10:14:46.372211+00:00,A,llm_style,tune,llm_style_tune_016,16,4096,8192,bf16,NVIDIA GeForce RTX 4060,c11,32,128,32,4,2,8,0.0,399.895,293.88800263404846,323.6214402318001,3.6535748801458605,0,3,3,16x4096x8192,0,
2026-03-02T10:14:46.605044+00:00,A,llm_style,tune,llm_style_tune_017,1,4096,4096,bf16,NVIDIA GeForce RTX 4060,c11,32,128,32,4,2,8,0.0,232.786,161.75999492406845,201.82912081480023,0.20743343875443826,0,3,3,1x4096x4096,0,
2026-03-02T10:14:46.824915+00:00,A,llm_style,tune,llm_style_tune_018,64,4096,4096,bf16,NVIDIA GeForce RTX 4060,c03,64,64,32,4,2,8,0.0,219.822,165.8879965543747,179.04096350073814,12.945382984935252,1,3,3,64x4096x4096,0,
2026-03-02T10:14:47.048455+00:00,A,llm_style,tune,llm_style_tune_019,64,8192,2048,bf16,NVIDIA GeForce RTX 4060,c00,32,32,32,2,2,8,0.0,223.492,168.96000504493713,208.07680338621134,12.710011741706852,1,3,3,64x8192x2048,0,
2026-03-02T10:14:47.175313+00:00,A,llm_style,tune,llm_style_tune_020,8,2048,4096,bf16,NVIDIA GeForce RTX 4060,c00,32,32,32,2,2,8,0.0,126.796,62.17600032687187,160.61439841985697,2.158674203782651,0,3,3,8x2048x4096,0,
2026-03-02T10:14:47.249835+00:00,A,llm_style,tune,llm_style_tune_021,8,1024,2048,bf16,NVIDIA GeForce RTX 4060,c04,64,64,64,4,3,8,0.0,74.469,48.00000041723251,146.07360109686846,0.6990506605902779,0,3,3,8x1024x2048,0,
2026-03-02T10:14:47.354133+00:00,A,llm_style,tune,llm_style_tune_022,8,8192,1024,bf16,NVIDIA GeForce RTX 4060,c00,32,32,32,2,2,8,0.0,104.255,30.655999667942524,90.61568140983573,4.378187938863845,0,3,3,8x8192x1024,0,
2026-03-02T10:14:47.774285+00:00,A,llm_style,tune,llm_style_tune_023,1,4096,8192,bf16,NVIDIA GeForce RTX 4060,c11,32,128,32,4,2,8,0.0,420.107,293.8079982995987,336.4246407151222,0.22841060961032272,0,3,3,1x4096x8192,0,
2026-03-02T10:14:48.162261+00:00,A,llm_style,tune,llm_style_tune_024,2,8192,4096,bf16,NVIDIA GeForce RTX 4060,c11,32,128,32,4,2,8,0.0,387.928,294.3200021982193,379.75742936134327,0.45602652554210954,0,3,3,2x8192x4096,0,
2026-03-02T10:14:48.400190+00:00,A,llm_style,tune,llm_style_tune_025,2,4096,4096,bf16,NVIDIA GeForce RTX 4060,c11,32,128,32,4,2,8,0.0,237.88,162.1280014514923,173.93279790878296,0.41392519120195626,0,3,3,2x4096x4096,0,
2026-03-02T10:14:48.466544+00:00,A,llm_style,tune,llm_style_tune_026,4,2048,1024,bf16,NVIDIA GeForce RTX 4060,c11,32,128,32,4,2,8,0.0,66.289,39.93599861860275,49.968640357255936,0.4201025786340281,0,3,3,4x2048x1024,0,
2026-03-02T10:14:48.596977+00:00,A,llm_style,tune,llm_style_tune_027,64,2048,4096,bf16,NVIDIA GeForce RTX 4060,c11,32,128,32,4,2,8,0.0,130.389,76.80000364780426,80.89599758386612,13.981012669270863,1,3,3,64x2048x4096,0,
2026-03-02T10:14:48.690646+00:00,A,llm_style,tune,llm_style_tune_028,32,1024,4096,bf16,NVIDIA GeForce RTX 4060,c04,64,64,64,4,3,8,0.0,93.621,60.11199951171875,76.79743893444535,4.465588537737276,0,3,3,32x1024x4096,0,
2026-03-02T10:14:48.746901+00:00,A,llm_style,tune,llm_style_tune_029,32,2048,1024,bf16,NVIDIA GeForce RTX 4060,c11,32,128,32,4,2,8,0.0,56.211,39.93599861860275,136.91007941961288,3.360820629072225,0,3,3,32x2048x1024,0,
2026-03-02T10:14:48.824009+00:00,A,llm_style,tune,llm_style_tune_030,4,2048,2048,bf16,NVIDIA GeForce RTX 4060,c00,32,32,32,2,2,8,0.0,77.063,48.128001391887665,491.3107211887825,0.6971914691985496,0,3,3,4x2048x2048,0,
2026-03-02T10:14:49.580977+00:00,A,llm_style,tune,llm_style_tune_031,1,8192,8192,bf16,NVIDIA GeForce RTX 4060,c10,64,128,64,8,3,8,0.0,756.914,558.0800175666809,620.0748699903488,0.24049907499861936,0,3,3,1x8192x8192,0,
2026-03-02T10:14:49.682207+00:00,A,llm_style,eval,llm_style_eval_000,2,1024,4096,bf16,NVIDIA GeForce RTX 4060,c00,32,32,32,2,2,8,0.0,100.739,59.90400165319443,200.09375661611548,0.28006836833921833,0,3,3,2x1024x4096,0,
2026-03-02T10:14:50.416161+00:00,A,llm_style,eval,llm_style_eval_001,2,8192,8192,bf16,NVIDIA GeForce RTX 4060,c02,32,64,32,2,2,8,0.0,733.908,560.511976480484,681.36959195137,0.4789111870285727,0,3,3,2x8192x8192,0,
2026-03-02T10:14:50.501351+00:00,A,llm_style,eval,llm_style_eval_002,2,2048,2048,bf16,NVIDIA GeForce RTX 4060,c11,32,128,32,4,2,8,0.0,85.134,53.10399830341339,56.34048044681549,0.315931314703315,0,3,3,2x2048x2048,0,
2026-03-02T10:14:50.655181+00:00,A,llm_style,eval,llm_style_eval_003,8,1024,8192,bf16,NVIDIA GeForce RTX 4060,c04,64,64,64,4,3,8,0.0,153.785,84.86399799585342,96.29696279764174,1.5815626316186289,0,3,3,8x1024x8192,0,
2026-03-02T10:14:50.895648+00:00,A,llm_style,eval,llm_style_eval_004,64,2048,8192,bf16,NVIDIA GeForce RTX 4060,c10,64,128,64,8,3,8,0.0,240.42,167.79199987649918,172.5542426109314,12.79848651652417,1,3,3,64x2048x8192,0,
2026-03-02T10:14:51.227212+00:00,A,llm_style,eval,llm_style_eval_005,1,8192,8192,bf16,NVIDIA GeForce RTX 4060,c10,64,128,64,8,3,8,0.0,0.0,583.4240019321442,707.7683061361311,0.23005177633334728,0,3,3,1x8192x8192,0,
2026-03-02T10:14:51.372622+00:00,A,llm_style,eval,llm_style_eval_006,1,1024,8192,bf16,NVIDIA GeForce RTX 4060,c00,32,32,32,2,2,8,0.0,145.358,84.99199897050858,175.26783958077425,0.1973975927524841,0,3,3,1x1024x8192,0,
2026-03-02T10:14:51.541975+00:00,A,llm_style,eval,llm_style_eval_007,2,8192,4096,bf16,NVIDIA GeForce RTX 4060,c11,32,128,32,4,2,8,0.0,0.0,295.0560003519058,409.4224107265471,0.4548889968003427,0,3,3,2x8192x4096,0,
2026-03-02T10:14:51.669038+00:00,A,llm_style,eval,llm_style_eval_008,16,2048,4096,bf16,NVIDIA GeForce RTX 4060,c00,32,32,32,2,2,8,0.0,127.008,64.97599929571152,145.4457594454287,4.131301694619986,0,3,3,16x2048x4096,0,
2026-03-02T10:14:51.900972+00:00,A,llm_style,eval,llm_style_eval_009,32,2048,8192,bf16,NVIDIA GeForce RTX 4060,c10,64,128,64,8,3,8,0.0,231.887,163.68000209331512,204.54399839043612,6.560006172213098,0,3,3,32x2048x8192,0,
2026-03-02T10:14:51.960991+00:00,A,llm_style,eval,llm_style_eval_010,1,1024,1024,bf16,NVIDIA GeForce RTX 4060,c00,32,32,32,2,2,8,0.0,59.967,37.776000797748566,178.30367684364316,0.0555154583786696,0,3,3,1x1024x1024,0,
2026-03-02T10:14:52.048841+00:00,A,llm_style,eval,llm_style_eval_011,16,2048,8192,bf16,NVIDIA GeForce RTX 4060,c10,64,128,64,8,3,8,0.0,0.0,171.37600481510162,309.6057528257369,3.1327075956708907,0,3,3,16x2048x8192,0,
2026-03-02T10:14:52.793795+00:00,A,llm_style,eval,llm_style_eval_012,8,8192,8192,bf16,NVIDIA GeForce RTX 4060,c02,32,64,32,2,2,8,0.0,744.896,562.175989151001,712.0691448450087,1.9099745359483717,0,3,3,8x8192x8192,0,
2026-03-02T10:14:53.195981+00:00,A,llm_style,eval,llm_style_eval_013,32,4096,8192,bf16,NVIDIA GeForce RTX 4060,c11,32,128,32,4,2,8,0.0,402.133,296.79998755455017,353.5449674725532,7.235457338438414,0,3,3,32x4096x8192,0,
2026-03-02T10:14:53.215062+00:00,A,llm_style,eval,llm_style_eval_014,64,1024,1024,bf16,NVIDIA GeForce RTX 4060,c00,32,32,32,2,2,8,0.0,0.0,76.27199962735176,196.81279942393297,1.759724783088923,1,3,3,64x1024x1024,0,
2026-03-02T10:14:53.229821+00:00,A,llm_style,eval,llm_style_eval_015,16,2048,1024,bf16,NVIDIA GeForce RTX 4060,c00,32,32,32,2,2,8,0.0,0.0,45.96799984574318,140.43039977550507,1.4599039380699645,0,3,3,16x2048x1024,0,
2026-03-02T10:14:53.278952+00:00,A,llm_style,eval,llm_style_eval_016,2,1024,8192,bf16,NVIDIA GeForce RTX 4060,c04,64,64,64,4,3,8,0.0,0.0,83.80799740552902,173.61920282244682,0.40037267371557944,0,3,3,2x1024x8192,0,
2026-03-02T10:14:54.055406+00:00,A,llm_style,eval,llm_style_eval_017,4,8192,8192,bf16,NVIDIA GeForce RTX 4060,c10,64,128,64,8,3,8,0.0,776.399,559.0720176696777,621.0867100954056,0.9602893635023689,0,3,3,4x8192x8192,0,
2026-03-02T10:14:54.149735+00:00,A,llm_style,eval,llm_style_eval_018,4,1024,4096,bf16,NVIDIA GeForce RTX 4060,c04,64,64,64,4,3,8,0.0,94.28,57.231999933719635,65.63840169459579,0.586287951475737,0,3,3,4x1024x4096,0,
2026-03-02T10:14:54.265580+00:00,A,llm_style,eval,llm_style_eval_019,8,4096,2048,bf16,NVIDIA GeForce RTX 4060,c11,32,128,32,4,2,8,0.0,115.798,53.247999399900436,128.24576206505273,2.520615413022465,0,3,3,8x4096x2048,0,
2026-03-02T10:14:54.389325+00:00,A,llm_style,eval,llm_style_eval_020,64,4096,2048,bf16,NVIDIA GeForce RTX 4060,c04,64,64,64,4,3,8,0.0,123.699,66.56000018119812,76.31871968507767,16.13193841762204,1,3,3,64x4096x2048,0,
2026-03-02T10:14:54.557256+00:00,A,llm_style,eval,llm_style_eval_021,1,4096,8192,bf16,NVIDIA GeForce RTX 4060,c11,32,128,32,4,2,8,0.0,0.0,295.9359884262085,358.7072023749351,0.2267681749586653,0,3,3,1x4096x8192,0,
2026-03-02T10:14:54.576649+00:00,A,llm_style,eval,llm_style_eval_022,32,1024,4096,bf16,NVIDIA GeForce RTX 4060,c04,64,64,64,4,3,8,0.0,0.0,39.32799957692623,112.47616052627546,6.825555809797438,0,3,3,32x1024x4096,0,
2026-03-02T10:14:54.630183+00:00,A,llm_style,eval,llm_style_eval_023,4,1024,1024,bf16,NVIDIA GeForce RTX 4060,c04,64,64,64,4,3,8,0.0,53.484,35.760000348091125,42.55935974419116,0.23458075834296757,0,3,3,4x1024x1024,0,
2026-03-02T10:14:54.651346+00:00,A,llm_style,eval,llm_style_eval_024,64,2048,2048,bf16,NVIDIA GeForce RTX 4060,c11,32,128,32,4,2,8,0.0,0.0,64.46399912238121,160.81759765744204,8.328228457883622,1,3,3,64x2048x2048,0,
2026-03-02T10:14:54.979709+00:00,A,llm_style,eval,llm_style_eval_025,32,8192,8192,bf16,NVIDIA GeForce RTX 4060,c11,32,128,32,4,2,8,0.0,0.0,585.7279896736145,684.4217443466185,7.332699429974801,0,3,3,32x8192x8192,0,
2026-03-02T10:14:55.097818+00:00,A,llm_style,eval,llm_style_eval_026,4,2048,4096,bf16,NVIDIA GeForce RTX 4060,c01,64,32,32,2,2,8,0.0,118.018,52.12800018489361,112.06655673682681,1.2873861218917,0,3,3,4x2048x4096,0,
2026-03-02T10:14:55.308568+00:00,A,llm_style,eval,llm_style_eval_027,8,8192,2048,bf16,NVIDIA GeForce RTX 4060,c00,32,32,32,2,2,8,0.0,210.699,161.23199462890625,251.2531180679798,1.6649019111736147,0,3,3,8x8192x2048,0,
2026-03-02T10:14:55.745264+00:00,A,llm_style,eval,llm_style_eval_028,8,4096,8192,bf16,NVIDIA GeForce RTX 4060,c11,32,128,32,4,2,8,0.0,436.644,293.88800263404846,417.3564857244491,1.8267874400729303,0,3,3,8x4096x8192,0,
2026-03-02T10:14:55.856000+00:00,A,llm_style,eval,llm_style_eval_029,8,2048,2048,bf16,NVIDIA GeForce RTX 4060,c00,32,32,32,2,2,8,0.0,110.685,46.92799970507622,152.80640572309488,1.4300388770404127,0,3,3,8x2048x2048,0,
2026-03-02T10:14:55.978392+00:00,A,llm_style,eval,llm_style_eval_030,1,4096,2048,bf16,NVIDIA GeForce RTX 4060,c11,32,128,32,4,2,8,0.0,122.342,53.247999399900436,56.668479293584824,0.3150769266278081,0,3,3,1x4096x2048,0,
2026-03-02T10:14:56.069110+00:00,A,llm_style,eval,llm_style_eval_031,16,8192,2048,bf16,NVIDIA GeForce RTX 4060,c11,32,128,32,4,2,8,0.0,0.0,167.93599724769592,261.2428864836693,3.1968781011741414,0,3,3,16x8192x2048,0,
2026-03-02T10:14:56.143481+00:00,A,llm_style,eval,llm_style_eval_032,1,2048,2048,bf16,NVIDIA GeForce RTX 4060,c00,32,32,32,2,2,8,0.0,74.317,45.791998505592346,185.9158422052858,0.18318938403563106,0,3,3,1x2048x2048,0,
2026-03-02T10:14:56.533117+00:00,A,llm_style,eval,llm_style_eval_033,16,8192,4096,bf16,NVIDIA GeForce RTX 4060,c11,32,128,32,4,2,8,0.0,389.592,294.9120104312897,361.3398441672325,3.6408887601075395,0,3,3,16x8192x4096,0,
2026-03-02T10:14:56.630733+00:00,A,llm_style,eval,llm_style_eval_034,16,1024,4096,bf16,NVIDIA GeForce RTX 4060,c04,64,64,64,4,3,8,0.0,97.568,57.34400078654289,76.87007904052732,2.340571396467637,0,3,3,16x1024x4096,0,
2026-03-02T10:14:56.841882+00:00,A,llm_style,eval,llm_style_eval_035,4,8192,2048,bf16,NVIDIA GeForce RTX 4060,c02,32,64,32,2,2,8,0.0,211.101,161.79199516773224,186.29439532756805,0.8295696450300549,0,3,3,4x8192x2048,0,
2026-03-02T10:14:56.968988+00:00,A,llm_style,eval,llm_style_eval_036,2,2048,4096,bf16,NVIDIA GeForce RTX 4060,c11,32,128,32,4,2,8,0.0,127.058,76.14399865269661,79.3702370673418,0.44067073694207265,0,3,3,2x2048x4096,0,
2026-03-02T10:14:57.022676+00:00,A,llm_style,eval,llm_style_eval_037,2,1024,1024,bf16,NVIDIA GeForce RTX 4060,c04,64,64,64,4,3,8,0.0,53.641,37.88800165057182,40.98047897219657,0.11070269787999489,0,3,3,2x1024x1024,0,
2026-03-02T10:14:57.436301+00:00,A,llm_style,eval,llm_style_eval_038,64,4096,8192,bf16,NVIDIA GeForce RTX 4060,c03,64,64,32,4,2,8,0.0,413.581,300.33598840236664,315.9347262978554,14.300541599583262,1,3,3,64x4096x8192,0,
2026-03-02T10:14:57.506129+00:00,A,llm_style,eval,llm_style_eval_039,4,1024,2048,bf16,NVIDIA GeForce RTX 4060,c04,64,64,64,4,3,8,0.0,69.777,44.87999901175499,123.28832305967805,0.37382389414950085,0,3,3,4x1024x2048,0,
2026-03-02T10:14:57.618340+00:00,A,llm_style,eval,llm_style_eval_040,64,8192,1024,bf16,NVIDIA GeForce RTX 4060,c06,64,128,32,4,3,8,0.0,112.165,64.51199948787689,85.14496244490144,16.644063624190995,1,3,3,64x8192x1024,0,
2026-03-02T10:14:57.673214+00:00,A,llm_style,eval,llm_style_eval_041,2,2048,1024,bf16,NVIDIA GeForce RTX 4060,c11,32,128,32,4,2,8,0.0,54.827,38.88000175356865,45.99552158266305,0.21575636886976324,0,3,3,2x2048x1024,0,
2026-03-02T10:14:57.787183+00:00,A,llm_style,eval,llm_style_eval_042,2,4096,2048,bf16,NVIDIA GeForce RTX 4060,c02,32,64,32,2,2,8,0.0,113.922,52.59199999272823,59.81632091104984,0.6380139946120985,0,3,3,2x4096x2048,0,
2026-03-02T10:14:57.841198+00:00,A,llm_style,eval,llm_style_eval_043,1,2048,1024,bf16,NVIDIA GeForce RTX 4060,c00,32,32,32,2,2,8,0.0,53.969,34.591998904943466,107.28383719921112,0.12125069764038995,0,3,3,1x2048x1024,0,
2026-03-02T10:14:58.089621+00:00,A,llm_style,eval,llm_style_eval_044,8,2048,8192,bf16,NVIDIA GeForce RTX 4060,c10,64,128,64,8,3,8,0.0,248.378,163.64800184965134,262.50240281224234,1.6403222340998715,0,3,3,8x2048x8192,0,
2026-03-02T10:14:58.201017+00:00,A,llm_style,eval,llm_style_eval_045,1,8192,1024,bf16,NVIDIA GeForce RTX 4060,c00,32,32,32,2,2,8,0.0,111.349,49.15200173854828,133.93855899572372,0.34133332126008187,0,3,3,1x8192x1024,0,
2026-03-02T10:14:58.276944+00:00,A,llm_style,eval,llm_style_eval_046,64,4096,1024,bf16,NVIDIA GeForce RTX 4060,c04,64,64,64,4,3,8,0.0,75.883,47.10400104522705,91.43295902758821,11.39756496448193,1,3,3,64x4096x1024,0,
2026-03-02T10:14:58.348726+00:00,A,llm_style,eval,llm_style_eval_047,16,2048,2048,bf16,NVIDIA GeForce RTX 4060,c11,32,128,32,4,2,8,0.0,71.733,51.2159988284111,75.37055902183053,2.620621115867905,0,3,3,16x2048x2048,0,
2026-03-02T10:14:58.739213+00:00,A,llm_style,eval,llm_style_eval_048,8,8192,4096,bf16,NVIDIA GeForce RTX 4060,c11,32,128,32,4,2,8,0.0,390.442,292.59200394153595,320.05120784044266,1.8348789603535252,0,3,3,8x8192x4096,0,
2026-03-02T10:14:59.148633+00:00,A,llm_style,eval,llm_style_eval_049,4,4096,8192,bf16,NVIDIA GeForce RTX 4060,c11,32,128,32,4,2,8,0.0,409.376,293.2479977607727,323.22558641433716,0.9153871741657571,0,3,3,4x4096x8192,0,
2026-03-02T10:14:59.383932+00:00,A,llm_style,eval,llm_style_eval_050,4,2048,8192,bf16,NVIDIA GeForce RTX 4060,c04,64,64,64,4,3,8,0.0,235.125,162.76799887418747,186.85887962579727,0.824595306991176,0,3,3,4x2048x8192,0,
2026-03-02T10:14:59.442973+00:00,A,llm_style,eval,llm_style_eval_051,16,1024,1024,bf16,NVIDIA GeForce RTX 4060,c04,64,64,64,4,3,8,0.0,58.969,38.91199827194214,49.14111960679293,0.8623158277685969,0,3,3,16x1024x1024,0,
2026-03-02T10:14:59.859544+00:00,A,llm_style,eval,llm_style_eval_052,32,8192,4096,bf16,NVIDIA GeForce RTX 4060,c00,32,32,32,2,2,8,0.0,416.513,297.775998711586,398.13727915287006,7.2117419042894975,0,3,3,32x8192x4096,0,
2026-03-02T10:14:59.879793+00:00,A,llm_style,eval,llm_style_eval_053,32,1024,2048,bf16,NVIDIA GeForce RTX 4060,c04,64,64,64,4,3,8,0.0,0.0,50.175998359918594,168.09664234518993,2.674938862944784,0,3,3,32x1024x2048,0,
2026-03-02T10:14:59.967798+00:00,A,llm_style,eval,llm_style_eval_054,64,8192,2048,bf16,NVIDIA GeForce RTX 4060,c00,32,32,32,2,2,8,0.0,0.0,169.98399794101715,270.86847469210613,12.633445936158983,1,3,3,64x8192x2048,0,
2026-03-02T10:15:00.039095+00:00,A,llm_style,eval,llm_style_eval_055,1,4096,1024,bf16,NVIDIA GeForce RTX 4060,c11,32,128,32,4,2,8,0.0,71.233,41.00799933075905,48.128001391887665,0.20456028425917183,0,3,3,1x4096x1024,0,
2026-03-02T10:15:00.062646+00:00,A,llm_style,eval,llm_style_eval_056,4,2048,2048,bf16,NVIDIA GeForce RTX 4060,c00,32,32,32,2,2,8,0.0,0.0,72.7040022611618,218.26848149299616,0.4615211124068289,0,3,3,4x2048x2048,0,
2026-03-02T10:15:00.218965+00:00,A,llm_style,eval,llm_style_eval_057,16,1024,8192,bf16,NVIDIA GeForce RTX 4060,c04,64,64,64,4,3,8,0.0,156.255,85.83999797701836,104.26560193300242,3.1271605583199955,0,3,3,16x1024x8192,0,
2026-03-02T10:15:00.604113+00:00,A,llm_style,eval,llm_style_eval_058,1,8192,4096,bf16,NVIDIA GeForce RTX 4060,c10,64,128,64,8,3,8,0.0,385.103,293.90400648117065,323.126717209816,0.22833599583576764,0,3,3,1x8192x4096,0,
2026-03-02T10:15:00.628839+00:00,A,llm_style,eval,llm_style_eval_059,8,4096,1024,bf16,NVIDIA GeForce RTX 4060,c02,32,64,32,2,2,8,0.0,0.0,44.99199986457825,154.5670361071823,1.4915732619574917,0,3,3,8x4096x1024,0,
2026-03-02T10:15:01.024052+00:00,A,llm_style,eval,llm_style_eval_060,4,8192,4096,bf16,NVIDIA GeForce RTX 4060,c00,32,32,32,2,2,8,0.0,395.159,295.77599465847015,381.982725858688,0.9075633616242589,0,3,3,4x8192x4096,0,
2026-03-02T10:15:01.112296+00:00,A,llm_style,eval,llm_style_eval_061,32,2048,2048,bf16,NVIDIA GeForce RTX 4060,c11,32,128,32,4,2,8,0.0,88.188,52.22399905323982,58.7225617095828,5.140078524556174,0,3,3,32x2048x2048,0,
2026-03-02T10:15:01.167632+00:00,A,llm_style,eval,llm_style_eval_062,8,2048,1024,bf16,NVIDIA GeForce RTX 4060,c00,32,32,32,2,2,8,0.0,55.293,27.135999873280525,118.17023761570442,1.2365283076611222,0,3,3,8x2048x1024,0,
2026-03-02T10:15:01.336789+00:00,A,llm_style,eval,llm_style_eval_063,16,4096,8192,bf16,NVIDIA GeForce RTX 4060,c11,32,128,32,4,2,8,0.0,0.0,318.84799897670746,402.8415948152541,3.3675664499887272,0,3,3,16x4096x8192,0,
2026-03-02T10:15:05.824264+00:00,U,llm_style,tune,llm_style_tune_000,8,4096,1024,bf16,NVIDIA GeForce RTX 4060,c05,128,64,32,4,3,8,0.0,3077.019,71.04000076651573,153.44640344381327,0.9446630528702268,0,3,3,fixed_c05,0,fixed_static_cfg;ref_shape=2048x2048x2048;pick=
2026-03-02T10:15:05.849658+00:00,U,llm_style,tune,llm_style_tune_001,32,1024,2048,bf16,NVIDIA GeForce RTX 4060,c05,128,64,32,4,3,8,0.0,0.0,59.119999408721924,230.91423586010933,2.2702592919884057,0,3,3,fixed_c05,0,fixed_static_cfg;ref_shape=2048x2048x2048;pick=
2026-03-02T10:15:05.862370+00:00,U,llm_style,tune,llm_style_tune_002,16,2048,1024,bf16,NVIDIA GeForce RTX 4060,c05,128,64,32,4,3,8,0.0,0.0,61.43999844789505,205.9571261703967,1.0922666942596442,0,3,3,fixed_c05,0,fixed_static_cfg;ref_shape=2048x2048x2048;pick=
2026-03-02T10:15:06.162068+00:00,U,llm_style,tune,llm_style_tune_003,1,1024,4096,bf16,NVIDIA GeForce RTX 4060,c05,128,64,32,4,3,8,0.0,0.0,83.45599845051765,126.82591915130611,0.10051533928952675,0,3,3,fixed_c05,0,fixed_static_cfg;ref_shape=2048x2048x2048;pick=
2026-03-02T10:15:06.195528+00:00,U,llm_style,tune,llm_style_tune_004,64,2048,2048,bf16,NVIDIA GeForce RTX 4060,c05,128,64,32,4,3,8,0.0,0.0,116.73600226640701,184.1433608531952,4.5990174545706095,1,3,3,fixed_c05,0,fixed_static_cfg;ref_shape=2048x2048x2048;pick=
2026-03-02T10:15:06.586489+00:00,U,llm_style,tune,llm_style_tune_005,32,8192,8192,bf16,NVIDIA GeForce RTX 4060,c05,128,64,32,4,3,8,0.0,0.0,690.6079947948456,798.2182383537292,6.219110303343474,0,3,3,fixed_c05,0,fixed_static_cfg;ref_shape=2048x2048x2048;pick=
2026-03-02T10:15:06.927804+00:00,U,llm_style,tune,llm_style_tune_006,16,8192,8192,bf16,NVIDIA GeForce RTX 4060,c05,128,64,32,4,3,8,0.0,0.0,714.7360146045685,731.5087777376175,3.004582956671222,0,3,3,fixed_c05,0,fixed_static_cfg;ref_shape=2048x2048x2048;pick=
2026-03-02T10:15:06.985518+00:00,U,llm_style,tune,llm_style_tune_007,2,1024,8192,bf16,NVIDIA GeForce RTX 4060,c05,128,64,32,4,3,8,0.0,0.0,160.5280041694641,325.0019207596778,0.20902541069767297,0,3,3,fixed_c05,0,fixed_static_cfg;ref_shape=2048x2048x2048;pick=
2026-03-02T10:15:07.074058+00:00,U,llm_style,tune,llm_style_tune_008,16,2048,8192,bf16,NVIDIA GeForce RTX 4060,c05,128,64,32,4,3,8,0.0,0.0,256.72000646591187,361.55393064022064,2.0912702496028004,0,3,3,fixed_c05,0,fixed_static_cfg;ref_shape=2048x2048x2048;pick=
2026-03-02T10:15:07.116904+00:00,U,llm_style,tune,llm_style_tune_009,4,4096,2048,bf16,NVIDIA GeForce RTX 4060,c05,128,64,32,4,3,8,0.0,0.0,108.5439994931221,167.59808078408236,0.6182641538305611,0,3,3,fixed_c05,0,fixed_static_cfg;ref_shape=2048x2048x2048;pick=
2026-03-02T10:15:07.283086+00:00,U,llm_style,tune,llm_style_tune_010,64,8192,4096,bf16,NVIDIA GeForce RTX 4060,c05,128,64,32,4,3,8,0.0,0.0,365.05600810050964,444.79712039232254,11.76522835043296,1,3,3,fixed_c05,0,fixed_static_cfg;ref_shape=2048x2048x2048;pick=
2026-03-02T10:15:07.331978+00:00,U,llm_style,tune,llm_style_tune_011,16,8192,1024,bf16,NVIDIA GeForce RTX 4060,c05,128,64,32,4,3,8,0.0,0.0,113.74400183558464,194.4470413029194,2.359996585912457,0,3,3,fixed_c05,0,fixed_static_cfg;ref_shape=2048x2048x2048;pick=
2026-03-02T10:15:07.378324+00:00,U,llm_style,tune,llm_style_tune_012,2,8192,1024,bf16,NVIDIA GeForce RTX 4060,c05,128,64,32,4,3,8,0.0,0.0,115.1680015027523,265.9244805574416,0.2913520384322907,0,3,3,fixed_c05,0,fixed_static_cfg;ref_shape=2048x2048x2048;pick=
2026-03-02T10:15:07.470793+00:00,U,llm_style,tune,llm_style_tune_013,16,8192,2048,bf16,NVIDIA GeForce RTX 4060,c05,128,64,32,4,3,8,0.0,0.0,226.25599801540375,297.5158429145813,2.372847202766528,0,3,3,fixed_c05,0,fixed_static_cfg;ref_shape=2048x2048x2048;pick=
2026-03-02T10:15:07.559501+00:00,U,llm_style,tune,llm_style_tune_014,8,4096,4096,bf16,NVIDIA GeForce RTX 4060,c05,128,64,32,4,3,8,0.0,0.0,197.63199985027313,312.78784424066544,1.3582590683865359,0,3,3,fixed_c05,0,fixed_static_cfg;ref_shape=2048x2048x2048;pick=
2026-03-02T10:15:07.568828+00:00,U,llm_style,tune,llm_style_tune_015,64,1024,1024,bf16,NVIDIA GeForce RTX 4060,c05,128,64,32,4,3,8,0.0,0.0,52.73599922657013,122.4396841973066,2.545087415967207,1,3,3,fixed_c05,0,fixed_static_cfg;ref_shape=2048x2048x2048;pick=
2026-03-02T10:15:07.798485+00:00,U,llm_style,tune,llm_style_tune_016,16,4096,8192,bf16,NVIDIA GeForce RTX 4060,c05,128,64,32,4,3,8,0.0,0.0,367.6159977912903,457.7040085196495,2.920824530083711,0,3,3,fixed_c05,0,fixed_static_cfg;ref_shape=2048x2048x2048;pick=
2026-03-02T10:15:07.886377+00:00,U,llm_style,tune,llm_style_tune_017,1,4096,4096,bf16,NVIDIA GeForce RTX 4060,c05,128,64,32,4,3,8,0.0,0.0,199.5360031723976,336.1663895845411,0.1681622938543538,0,3,3,fixed_c05,0,fixed_static_cfg;ref_shape=2048x2048x2048;pick=
2026-03-02T10:15:07.974956+00:00,U,llm_style,tune,llm_style_tune_018,64,4096,4096,bf16,NVIDIA GeForce RTX 4060,c05,128,64,32,4,3,8,0.0,0.0,200.6400004029274,261.48544162511826,10.703168080579148,1,3,3,fixed_c05,0,fixed_static_cfg;ref_shape=2048x2048x2048;pick=
2026-03-02T10:15:08.059846+00:00,U,llm_style,tune,llm_style_tune_019,64,8192,2048,bf16,NVIDIA GeForce RTX 4060,c05,128,64,32,4,3,8,0.0,0.0,202.65599340200424,307.62175261974323,10.596694486800024,1,3,3,fixed_c05,0,fixed_static_cfg;ref_shape=2048x2048x2048;pick=
2026-03-02T10:15:08.109869+00:00,U,llm_style,tune,llm_style_tune_020,8,2048,4096,bf16,NVIDIA GeForce RTX 4060,c05,128,64,32,4,3,8,0.0,0.0,148.40000122785568,287.1919897198674,0.9044321218968187,0,3,3,fixed_c05,0,fixed_static_cfg;ref_shape=2048x2048x2048;pick=
2026-03-02T10:15:08.123475+00:00,U,llm_style,tune,llm_style_tune_021,8,1024,2048,bf16,NVIDIA GeForce RTX 4060,c05,128,64,32,4,3,8,0.0,0.0,60.416001826524734,133.53887647390357,0.5553898137176703,0,3,3,fixed_c05,0,fixed_static_cfg;ref_shape=2048x2048x2048;pick=
2026-03-02T10:15:08.167608+00:00,U,llm_style,tune,llm_style_tune_022,8,8192,1024,bf16,NVIDIA GeForce RTX 4060,c05,128,64,32,4,3,8,0.0,0.0,112.08000034093857,201.29375398159027,1.197517198355819,0,3,3,fixed_c05,0,fixed_static_cfg;ref_shape=2048x2048x2048;pick=
2026-03-02T10:15:08.331745+00:00,U,llm_style,tune,llm_style_tune_023,1,4096,8192,bf16,NVIDIA GeForce RTX 4060,c05,128,64,32,4,3,8,0.0,0.0,361.1839860677719,467.0873689651489,0.18580243473864264,0,3,3,fixed_c05,0,fixed_static_cfg;ref_shape=2048x2048x2048;pick=
2026-03-02T10:15:08.503526+00:00,U,llm_style,tune,llm_style_tune_024,2,8192,4096,bf16,NVIDIA GeForce RTX 4060,c05,128,64,32,4,3,8,0.0,0.0,389.1200125217438,412.7478414773941,0.34492630468986735,0,3,3,fixed_c05,0,fixed_static_cfg;ref_shape=2048x2048x2048;pick=
2026-03-02T10:15:08.595095+00:00,U,llm_style,tune,llm_style_tune_025,2,4096,4096,bf16,NVIDIA GeForce RTX 4060,c05,128,64,32,4,3,8,0.0,0.0,228.7679985165596,356.20864063501324,0.2933490017623346,0,3,3,fixed_c05,0,fixed_static_cfg;ref_shape=2048x2048x2048;pick=
2026-03-02T10:15:08.609133+00:00,U,llm_style,tune,llm_style_tune_026,4,2048,1024,bf16,NVIDIA GeForce RTX 4060,c05,128,64,32,4,3,8,0.0,0.0,59.39200147986412,183.5212820768354,0.2824827515820971,0,3,3,fixed_c05,0,fixed_static_cfg;ref_shape=2048x2048x2048;pick=
2026-03-02T10:15:08.660019+00:00,U,llm_style,tune,llm_style_tune_027,64,2048,4096,bf16,NVIDIA GeForce RTX 4060,c05,128,64,32,4,3,8,0.0,0.0,121.23200297355652,227.27519795298576,8.85691729628692,1,3,3,fixed_c05,0,fixed_static_cfg;ref_shape=2048x2048x2048;pick=
2026-03-02T10:15:08.682024+00:00,U,llm_style,tune,llm_style_tune_028,32,1024,4096,bf16,NVIDIA GeForce RTX 4060,c05,128,64,32,4,3,8,0.0,0.0,114.72000181674957,261.7855954170227,2.3399185124560153,0,3,3,fixed_c05,0,fixed_static_cfg;ref_shape=2048x2048x2048;pick=
2026-03-02T10:15:08.697037+00:00,U,llm_style,tune,llm_style_tune_029,32,2048,1024,bf16,NVIDIA GeForce RTX 4060,c05,128,64,32,4,3,8,0.0,0.0,81.91999793052673,165.693439990282,1.6384000413894664,0,3,3,fixed_c05,0,fixed_static_cfg;ref_shape=2048x2048x2048;pick=
2026-03-02T10:15:08.718522+00:00,U,llm_style,tune,llm_style_tune_030,4,2048,2048,bf16,NVIDIA GeForce RTX 4060,c05,128,64,32,4,3,8,0.0,0.0,105.83999752998352,150.30432477593413,0.3170297881998186,0,3,3,fixed_c05,0,fixed_static_cfg;ref_shape=2048x2048x2048;pick=
2026-03-02T10:15:09.089668+00:00,U,llm_style,tune,llm_style_tune_031,1,8192,8192,bf16,NVIDIA GeForce RTX 4060,c05,128,64,32,4,3,8,0.0,0.0,1253.2640099525452,1298.0268824100494,0.10709453629413819,0,3,3,fixed_c05,0,fixed_static_cfg;ref_shape=2048x2048x2048;pick=
2026-03-02T10:15:09.123431+00:00,U,llm_style,eval,llm_style_eval_000,2,1024,4096,bf16,NVIDIA GeForce RTX 4060,c05,128,64,32,4,3,8,0.0,0.0,124.86399710178375,293.8185688853263,0.134363919059262,0,3,3,fixed_c05,0,fixed_static_cfg;ref_shape=2048x2048x2048;pick=
2026-03-02T10:15:09.469328+00:00,U,llm_style,eval,llm_style_eval_001,2,8192,8192,bf16,NVIDIA GeForce RTX 4060,c05,128,64,32,4,3,8,0.0,0.0,1011.5839838981628,1155.5945491790771,0.2653615125118704,0,3,3,fixed_c05,0,fixed_static_cfg;ref_shape=2048x2048x2048;pick=
2026-03-02T10:15:09.499170+00:00,U,llm_style,eval,llm_style_eval_002,2,2048,2048,bf16,NVIDIA GeForce RTX 4060,c05,128,64,32,4,3,8,0.0,0.0,119.29600313305855,297.17312365770334,0.14063518943955972,0,3,3,fixed_c05,0,fixed_static_cfg;ref_shape=2048x2048x2048;pick=
2026-03-02T10:15:09.557518+00:00,U,llm_style,eval,llm_style_eval_003,8,1024,8192,bf16,NVIDIA GeForce RTX 4060,c05,128,64,32,4,3,8,0.0,0.0,208.73599499464035,314.1209611296652,0.6430023149742154,0,3,3,fixed_c05,0,fixed_static_cfg;ref_shape=2048x2048x2048;pick=
2026-03-02T10:15:09.655734+00:00,U,llm_style,eval,llm_style_eval_004,64,2048,8192,bf16,NVIDIA GeForce RTX 4060,c05,128,64,32,4,3,8,0.0,0.0,370.08000910282135,491.4240130782126,5.802755066954597,1,3,3,fixed_c05,0,fixed_static_cfg;ref_shape=2048x2048x2048;pick=
2026-03-02T10:15:10.033907+00:00,U,llm_style,eval,llm_style_eval_005,1,8192,8192,bf16,NVIDIA GeForce RTX 4060,c05,128,64,32,4,3,8,0.0,0.0,1000.4479885101318,1127.2541058063507,0.13415762692459124,0,3,3,fixed_c05,0,fixed_static_cfg;ref_shape=2048x2048x2048;pick=
2026-03-02T10:15:10.088456+00:00,U,llm_style,eval,llm_style_eval_006,1,1024,8192,bf16,NVIDIA GeForce RTX 4060,c05,128,64,32,4,3,8,0.0,0.0,191.48799777030945,265.2774327993393,0.08761497428222281,0,3,3,fixed_c05,0,fixed_static_cfg;ref_shape=2048x2048x2048;pick=
2026-03-02T10:15:10.264076+00:00,U,llm_style,eval,llm_style_eval_007,2,8192,4096,bf16,NVIDIA GeForce RTX 4060,c05,128,64,32,4,3,8,0.0,0.0,484.8639965057373,529.9427199363708,0.27681520790833114,0,3,3,fixed_c05,0,fixed_static_cfg;ref_shape=2048x2048x2048;pick=
2026-03-02T10:15:10.313543+00:00,U,llm_style,eval,llm_style_eval_008,16,2048,4096,bf16,NVIDIA GeForce RTX 4060,c05,128,64,32,4,3,8,0.0,0.0,192.51200556755066,233.9225646853446,1.3943829383970991,0,3,3,fixed_c05,0,fixed_static_cfg;ref_shape=2048x2048x2048;pick=
2026-03-02T10:15:10.409026+00:00,U,llm_style,eval,llm_style_eval_009,32,2048,8192,bf16,NVIDIA GeForce RTX 4060,c05,128,64,32,4,3,8,0.0,0.0,358.271986246109,478.018239736557,2.9970019014057407,0,3,3,fixed_c05,0,fixed_static_cfg;ref_shape=2048x2048x2048;pick=
2026-03-02T10:15:10.419770+00:00,U,llm_style,eval,llm_style_eval_010,1,1024,1024,bf16,NVIDIA GeForce RTX 4060,c05,128,64,32,4,3,8,0.0,0.0,50.175998359918594,110.80095633864399,0.04179591973351225,0,3,3,fixed_c05,0,fixed_static_cfg;ref_shape=2048x2048x2048;pick=
2026-03-02T10:15:10.514350+00:00,U,llm_style,eval,llm_style_eval_011,16,2048,8192,bf16,NVIDIA GeForce RTX 4060,c05,128,64,32,4,3,8,0.0,0.0,365.56801199913025,479.9215978384018,1.4685937893309915,0,3,3,fixed_c05,0,fixed_static_cfg;ref_shape=2048x2048x2048;pick=
2026-03-02T10:15:10.856292+00:00,U,llm_style,eval,llm_style_eval_012,8,8192,8192,bf16,NVIDIA GeForce RTX 4060,c05,128,64,32,4,3,8,0.0,0.0,993.6479926109314,1119.7952020168304,1.0806058402821428,0,3,3,fixed_c05,0,fixed_static_cfg;ref_shape=2048x2048x2048;pick=
2026-03-02T10:15:11.042445+00:00,U,llm_style,eval,llm_style_eval_013,32,4096,8192,bf16,NVIDIA GeForce RTX 4060,c05,128,64,32,4,3,8,0.0,0.0,548.1919944286346,582.8691232204437,3.917393303487153,0,3,3,fixed_c05,0,fixed_static_cfg;ref_shape=2048x2048x2048;pick=
2026-03-02T10:15:11.055802+00:00,U,llm_style,eval,llm_style_eval_014,64,1024,1024,bf16,NVIDIA GeForce RTX 4060,c05,128,64,32,4,3,8,0.0,0.0,62.463998794555664,188.21375936269752,2.1487213529419185,1,3,3,fixed_c05,0,fixed_static_cfg;ref_shape=2048x2048x2048;pick=
2026-03-02T10:15:11.072005+00:00,U,llm_style,eval,llm_style_eval_015,16,2048,1024,bf16,NVIDIA GeForce RTX 4060,c05,128,64,32,4,3,8,0.0,0.0,97.07200154662132,164.08576324582094,0.691330794984888,0,3,3,fixed_c05,0,fixed_static_cfg;ref_shape=2048x2048x2048;pick=
2026-03-02T10:15:11.125325+00:00,U,llm_style,eval,llm_style_eval_016,2,1024,8192,bf16,NVIDIA GeForce RTX 4060,c05,128,64,32,4,3,8,0.0,0.0,207.87200331687927,279.9104088544844,0.1614187166361684,0,3,3,fixed_c05,0,fixed_static_cfg;ref_shape=2048x2048x2048;pick=
2026-03-02T10:15:11.476538+00:00,U,llm_style,eval,llm_style_eval_017,4,8192,8192,bf16,NVIDIA GeForce RTX 4060,c05,128,64,32,4,3,8,0.0,0.0,988.6080026626587,1056.9728004932404,0.54305742069053,0,3,3,fixed_c05,0,fixed_static_cfg;ref_shape=2048x2048x2048;pick=
2026-03-02T10:15:11.510369+00:00,U,llm_style,eval,llm_style_eval_018,4,1024,4096,bf16,NVIDIA GeForce RTX 4060,c05,128,64,32,4,3,8,0.0,0.0,135.04000008106232,306.83616042137146,0.2484777249693263,0,3,3,fixed_c05,0,fixed_static_cfg;ref_shape=2048x2048x2048;pick=
2026-03-02T10:15:11.560855+00:00,U,llm_style,eval,llm_style_eval_019,8,4096,2048,bf16,NVIDIA GeForce RTX 4060,c05,128,64,32,4,3,8,0.0,0.0,154.51200306415558,213.45696091651905,0.8686556729464628,0,3,3,fixed_c05,0,fixed_static_cfg;ref_shape=2048x2048x2048;pick=
2026-03-02T10:15:11.611429+00:00,U,llm_style,eval,llm_style_eval_020,64,4096,2048,bf16,NVIDIA GeForce RTX 4060,c05,128,64,32,4,3,8,0.0,0.0,132.51199573278427,163.78687515854836,8.10297828556777,1,3,3,fixed_c05,0,fixed_static_cfg;ref_shape=2048x2048x2048;pick=
2026-03-02T10:15:11.821855+00:00,U,llm_style,eval,llm_style_eval_021,1,4096,8192,bf16,NVIDIA GeForce RTX 4060,c05,128,64,32,4,3,8,0.0,0.0,531.4559936523438,558.8275116682053,0.12627360459105066,0,3,3,fixed_c05,0,fixed_static_cfg;ref_shape=2048x2048x2048;pick=
2026-03-02T10:15:11.846884+00:00,U,llm_style,eval,llm_style_eval_022,32,1024,4096,bf16,NVIDIA GeForce RTX 4060,c05,128,64,32,4,3,8,0.0,0.0,140.687994658947,151.4108818769455,1.908019633450145,0,3,3,fixed_c05,0,fixed_static_cfg;ref_shape=2048x2048x2048;pick=
2026-03-02T10:15:11.857633+00:00,U,llm_style,eval,llm_style_eval_023,4,1024,1024,bf16,NVIDIA GeForce RTX 4060,c05,128,64,32,4,3,8,0.0,0.0,73.72800260782242,99.03103992342945,0.11377777375336061,0,3,3,fixed_c05,0,fixed_static_cfg;ref_shape=2048x2048x2048;pick=
2026-03-02T10:15:11.881334+00:00,U,llm_style,eval,llm_style_eval_024,64,2048,2048,bf16,NVIDIA GeForce RTX 4060,c05,128,64,32,4,3,8,0.0,0.0,114.43199962377548,146.20544075965876,4.691615227952852,1,3,3,fixed_c05,0,fixed_static_cfg;ref_shape=2048x2048x2048;pick=
2026-03-02T10:15:12.266578+00:00,U,llm_style,eval,llm_style_eval_025,32,8192,8192,bf16,NVIDIA GeForce RTX 4060,c05,128,64,32,4,3,8,0.0,0.0,1241.0880327224731,1309.5711922645569,3.460646773443204,0,3,3,fixed_c05,0,fixed_static_cfg;ref_shape=2048x2048x2048;pick=
2026-03-02T10:15:12.324782+00:00,U,llm_style,eval,llm_style_eval_026,4,2048,4096,bf16,NVIDIA GeForce RTX 4060,c05,128,64,32,4,3,8,0.0,0.0,238.5919988155365,352.51967906951893,0.28127038766243007,0,3,3,fixed_c05,0,fixed_static_cfg;ref_shape=2048x2048x2048;pick=
2026-03-02T10:15:12.416960+00:00,U,llm_style,eval,llm_style_eval_027,8,8192,2048,bf16,NVIDIA GeForce RTX 4060,c05,128,64,32,4,3,8,0.0,0.0,290.73600471019745,401.3216009736061,0.923296226305282,0,3,3,fixed_c05,0,fixed_static_cfg;ref_shape=2048x2048x2048;pick=
2026-03-02T10:15:12.593404+00:00,U,llm_style,eval,llm_style_eval_028,8,4096,8192,bf16,NVIDIA GeForce RTX 4060,c05,128,64,32,4,3,8,0.0,0.0,574.3520259857178,624.3430536985397,0.9347419138612914,0,3,3,fixed_c05,0,fixed_static_cfg;ref_shape=2048x2048x2048;pick=
2026-03-02T10:15:12.617600+00:00,U,llm_style,eval,llm_style_eval_029,8,2048,2048,bf16,NVIDIA GeForce RTX 4060,c05,128,64,32,4,3,8,0.0,0.0,140.28799533843994,280.7734334468841,0.47836497939900124,0,3,3,fixed_c05,0,fixed_static_cfg;ref_shape=2048x2048x2048;pick=
2026-03-02T10:15:12.668095+00:00,U,llm_style,eval,llm_style_eval_030,1,4096,2048,bf16,NVIDIA GeForce RTX 4060,c05,128,64,32,4,3,8,0.0,0.0,158.720001578331,241.16224348545074,0.10570322475532588,0,3,3,fixed_c05,0,fixed_static_cfg;ref_shape=2048x2048x2048;pick=
2026-03-02T10:15:12.767586+00:00,U,llm_style,eval,llm_style_eval_031,16,8192,2048,bf16,NVIDIA GeForce RTX 4060,c05,128,64,32,4,3,8,0.0,0.0,297.90399968624115,364.04224038124084,1.8021608053783902,0,3,3,fixed_c05,0,fixed_static_cfg;ref_shape=2048x2048x2048;pick=
2026-03-02T10:15:12.789967+00:00,U,llm_style,eval,llm_style_eval_032,1,2048,2048,bf16,NVIDIA GeForce RTX 4060,c05,128,64,32,4,3,8,0.0,0.0,118.27200278639793,181.80928111076344,0.07092640525543502,0,3,3,fixed_c05,0,fixed_static_cfg;ref_shape=2048x2048x2048;pick=
2026-03-02T10:15:12.964327+00:00,U,llm_style,eval,llm_style_eval_033,16,8192,4096,bf16,NVIDIA GeForce RTX 4060,c05,128,64,32,4,3,8,0.0,0.0,541.7120158672333,631.3907241821288,1.98212665133712,0,3,3,fixed_c05,0,fixed_static_cfg;ref_shape=2048x2048x2048;pick=
2026-03-02T10:15:12.990452+00:00,U,llm_style,eval,llm_style_eval_034,16,1024,4096,bf16,NVIDIA GeForce RTX 4060,c05,128,64,32,4,3,8,0.0,0.0,131.071999669075,218.7286391854286,1.0240000025853515,0,3,3,fixed_c05,0,fixed_static_cfg;ref_shape=2048x2048x2048;pick=
2026-03-02T10:15:13.083346+00:00,U,llm_style,eval,llm_style_eval_035,4,8192,2048,bf16,NVIDIA GeForce RTX 4060,c05,128,64,32,4,3,8,0.0,0.0,291.83998703956604,398.77632409334166,0.4599017748099184,0,3,3,fixed_c05,0,fixed_static_cfg;ref_shape=2048x2048x2048;pick=
2026-03-02T10:15:13.140488+00:00,U,llm_style,eval,llm_style_eval_036,2,2048,4096,bf16,NVIDIA GeForce RTX 4060,c05,128,64,32,4,3,8,0.0,0.0,208.8959962129593,354.3039858341217,0.16062745389238045,0,3,3,fixed_c05,0,fixed_static_cfg;ref_shape=2048x2048x2048;pick=
2026-03-02T10:15:13.153390+00:00,U,llm_style,eval,llm_style_eval_037,2,1024,1024,bf16,NVIDIA GeForce RTX 4060,c05,128,64,32,4,3,8,0.0,0.0,55.296000093221664,128.00031803548336,0.07585185172397577,0,3,3,fixed_c05,0,fixed_static_cfg;ref_shape=2048x2048x2048;pick=
2026-03-02T10:15:13.331238+00:00,U,llm_style,eval,llm_style_eval_038,64,4096,8192,bf16,NVIDIA GeForce RTX 4060,c05,128,64,32,4,3,8,0.0,0.0,565.7600164413452,638.4521329402922,7.591500231874865,1,3,3,fixed_c05,0,fixed_static_cfg;ref_shape=2048x2048x2048;pick=
2026-03-02T10:15:13.345312+00:00,U,llm_style,eval,llm_style_eval_039,4,1024,2048,bf16,NVIDIA GeForce RTX 4060,c05,128,64,32,4,3,8,0.0,0.0,87.0399996638298,104.84383717179298,0.19275294192093054,0,3,3,fixed_c05,0,fixed_static_cfg;ref_shape=2048x2048x2048;pick=
2026-03-02T10:15:13.392791+00:00,U,llm_style,eval,llm_style_eval_040,64,8192,1024,bf16,NVIDIA GeForce RTX 4060,c05,128,64,32,4,3,8,0.0,0.0,156.67200088500977,194.30399492382998,6.853437869782989,1,3,3,fixed_c05,0,fixed_static_cfg;ref_shape=2048x2048x2048;pick=
2026-03-02T10:15:13.406553+00:00,U,llm_style,eval,llm_style_eval_041,2,2048,1024,bf16,NVIDIA GeForce RTX 4060,c05,128,64,32,4,3,8,0.0,0.0,80.35199716687202,145.69471701979631,0.10439825139104947,0,3,3,fixed_c05,0,fixed_static_cfg;ref_shape=2048x2048x2048;pick=
2026-03-02T10:15:13.455587+00:00,U,llm_style,eval,llm_style_eval_042,2,4096,2048,bf16,NVIDIA GeForce RTX 4060,c05,128,64,32,4,3,8,0.0,0.0,162.6880019903183,306.6879919171332,0.20625019417225895,0,3,3,fixed_c05,0,fixed_static_cfg;ref_shape=2048x2048x2048;pick=
2026-03-02T10:15:13.470012+00:00,U,llm_style,eval,llm_style_eval_043,1,2048,1024,bf16,NVIDIA GeForce RTX 4060,c05,128,64,32,4,3,8,0.0,0.0,95.23200243711472,203.30495372414555,0.04404300962556844,0,3,3,fixed_c05,0,fixed_static_cfg;ref_shape=2048x2048x2048;pick=
2026-03-02T10:15:13.577624+00:00,U,llm_style,eval,llm_style_eval_044,8,2048,8192,bf16,NVIDIA GeForce RTX 4060,c05,128,64,32,4,3,8,0.0,0.0,400.38400888442993,427.0284831523895,0.6704449979107018,0,3,3,fixed_c05,0,fixed_static_cfg;ref_shape=2048x2048x2048;pick=
2026-03-02T10:15:13.628243+00:00,U,llm_style,eval,llm_style_eval_045,1,8192,1024,bf16,NVIDIA GeForce RTX 4060,c05,128,64,32,4,3,8,0.0,0.0,184.25600230693817,228.39360147714612,0.0910538369982222,0,3,3,fixed_c05,0,fixed_static_cfg;ref_shape=2048x2048x2048;pick=
2026-03-02T10:15:13.651317+00:00,U,llm_style,eval,llm_style_eval_046,64,4096,1024,bf16,NVIDIA GeForce RTX 4060,c05,128,64,32,4,3,8,0.0,0.0,118.22400242090225,167.030720859766,4.541132942603541,1,3,3,fixed_c05,0,fixed_static_cfg;ref_shape=2048x2048x2048;pick=
2026-03-02T10:15:13.674348+00:00,U,llm_style,eval,llm_style_eval_047,16,2048,2048,bf16,NVIDIA GeForce RTX 4060,c05,128,64,32,4,3,8,0.0,0.0,121.24800309538841,218.8800032436847,1.1069685650361436,0,3,3,fixed_c05,0,fixed_static_cfg;ref_shape=2048x2048x2048;pick=
2026-03-02T10:15:13.856678+00:00,U,llm_style,eval,llm_style_eval_048,8,8192,4096,bf16,NVIDIA GeForce RTX 4060,c05,128,64,32,4,3,8,0.0,0.0,568.7359869480133,663.633936047554,0.9439721141631818,0,3,3,fixed_c05,0,fixed_static_cfg;ref_shape=2048x2048x2048;pick=
2026-03-02T10:15:14.034918+00:00,U,llm_style,eval,llm_style_eval_049,4,4096,8192,bf16,NVIDIA GeForce RTX 4060,c05,128,64,32,4,3,8,0.0,0.0,547.8239953517914,579.8297619819641,0.49000310004241626,0,3,3,fixed_c05,0,fixed_static_cfg;ref_shape=2048x2048x2048;pick=
2026-03-02T10:15:14.145541+00:00,U,llm_style,eval,llm_style_eval_050,4,2048,8192,bf16,NVIDIA GeForce RTX 4060,c05,128,64,32,4,3,8,0.0,0.0,526.8480181694031,556.4313417673111,0.25475606507234416,0,3,3,fixed_c05,0,fixed_static_cfg;ref_shape=2048x2048x2048;pick=
2026-03-02T10:15:14.158678+00:00,U,llm_style,eval,llm_style_eval_051,16,1024,1024,bf16,NVIDIA GeForce RTX 4060,c05,128,64,32,4,3,8,0.0,0.0,67.58400052785873,197.01088055968268,0.49648484460709846,0,3,3,fixed_c05,0,fixed_static_cfg;ref_shape=2048x2048x2048;pick=
2026-03-02T10:15:14.352371+00:00,U,llm_style,eval,llm_style_eval_052,32,8192,4096,bf16,NVIDIA GeForce RTX 4060,c05,128,64,32,4,3,8,0.0,0.0,793.5520112514496,901.5644758939743,2.706166221686426,0,3,3,fixed_c05,0,fixed_static_cfg;ref_shape=2048x2048x2048;pick=
2026-03-02T10:15:14.368921+00:00,U,llm_style,eval,llm_style_eval_053,32,1024,2048,bf16,NVIDIA GeForce RTX 4060,c05,128,64,32,4,3,8,0.0,0.0,103.42399775981903,188.81183579564095,1.2977426023667453,0,3,3,fixed_c05,0,fixed_static_cfg;ref_shape=2048x2048x2048;pick=
2026-03-02T10:15:14.468697+00:00,U,llm_style,eval,llm_style_eval_054,64,8192,2048,bf16,NVIDIA GeForce RTX 4060,c05,128,64,32,4,3,8,0.0,0.0,413.6959910392761,448.6758279800415,5.190970409466981,1,3,3,fixed_c05,0,fixed_static_cfg;ref_shape=2048x2048x2048;pick=
2026-03-02T10:15:14.491254+00:00,U,llm_style,eval,llm_style_eval_055,1,4096,1024,bf16,NVIDIA GeForce RTX 4060,c05,128,64,32,4,3,8,0.0,0.0,121.74400314688683,178.03776279091824,0.06890366492942539,0,3,3,fixed_c05,0,fixed_static_cfg;ref_shape=2048x2048x2048;pick=
2026-03-02T10:15:14.514865+00:00,U,llm_style,eval,llm_style_eval_056,4,2048,2048,bf16,NVIDIA GeForce RTX 4060,c05,128,64,32,4,3,8,0.0,0.0,159.12000089883804,194.3654423952102,0.21087501137793818,0,3,3,fixed_c05,0,fixed_static_cfg;ref_shape=2048x2048x2048;pick=
2026-03-02T10:15:14.574341+00:00,U,llm_style,eval,llm_style_eval_057,16,1024,8192,bf16,NVIDIA GeForce RTX 4060,c05,128,64,32,4,3,8,0.0,0.0,312.3199939727783,413.50142717361445,0.8594885411767673,0,3,3,fixed_c05,0,fixed_static_cfg;ref_shape=2048x2048x2048;pick=
2026-03-02T10:15:14.779120+00:00,U,llm_style,eval,llm_style_eval_058,1,8192,4096,bf16,NVIDIA GeForce RTX 4060,c05,128,64,32,4,3,8,0.0,0.0,829.4399976730347,918.440331816673,0.08090864220229506,0,3,3,fixed_c05,0,fixed_static_cfg;ref_shape=2048x2048x2048;pick=
2026-03-02T10:15:14.802660+00:00,U,llm_style,eval,llm_style_eval_059,8,4096,1024,bf16,NVIDIA GeForce RTX 4060,c05,128,64,32,4,3,8,0.0,0.0,134.0479999780655,154.62400019168854,0.5006330867374459,0,3,3,fixed_c05,0,fixed_static_cfg;ref_shape=2048x2048x2048;pick=
2026-03-02T10:15:14.996720+00:00,U,llm_style,eval,llm_style_eval_060,4,8192,4096,bf16,NVIDIA GeForce RTX 4060,c05,128,64,32,4,3,8,0.0,0.0,865.2799725532532,1013.1660729646683,0.31022959563932273,0,3,3,fixed_c05,0,fixed_static_cfg;ref_shape=2048x2048x2048;pick=
2026-03-02T10:15:15.023725+00:00,U,llm_style,eval,llm_style_eval_061,32,2048,2048,bf16,NVIDIA GeForce RTX 4060,c05,128,64,32,4,3,8,0.0,0.0,167.77600347995758,266.0044917464256,1.5999633465584793,0,3,3,fixed_c05,0,fixed_static_cfg;ref_shape=2048x2048x2048;pick=
2026-03-02T10:15:15.038798+00:00,U,llm_style,eval,llm_style_eval_062,8,2048,1024,bf16,NVIDIA GeForce RTX 4060,c05,128,64,32,4,3,8,0.0,0.0,99.32799637317657,125.6236774474382,0.33781444532451416,0,3,3,fixed_c05,0,fixed_static_cfg;ref_shape=2048x2048x2048;pick=
2026-03-02T10:15:15.233928+00:00,U,llm_style,eval,llm_style_eval_063,16,4096,8192,bf16,NVIDIA GeForce RTX 4060,c05,128,64,32,4,3,8,0.0,0.0,859.6480190753937,997.2591823339462,1.249048215285691,0,3,3,fixed_c05,0,fixed_static_cfg;ref_shape=2048x2048x2048;pick=
2026-03-02T10:15:18.862507+00:00,B,llm_style,tune,llm_style_tune_000,8,4096,1024,bf16,NVIDIA GeForce RTX 4060,c00,32,32,32,2,2,8,577.016394934617,2526.614,41.98399931192398,217.0403181016444,1.5984390505870707,0,3,3,0_3_3,0,
2026-03-02T10:15:18.988561+00:00,B,llm_style,tune,llm_style_tune_001,32,1024,2048,bf16,NVIDIA GeForce RTX 4060,c00,32,32,32,2,2,8,0.0,0.0,50.175998359918594,174.5334379374977,2.674938862944784,0,3,3,0_3_3,0,
2026-03-02T10:15:19.009057+00:00,B,llm_style,tune,llm_style_tune_002,16,2048,1024,bf16,NVIDIA GeForce RTX 4060,c00,32,32,32,2,2,8,0.0,0.0,43.856000527739525,175.13663977384567,1.530209394209413,0,3,3,0_3_3,0,
2026-03-02T10:15:19.220753+00:00,B,llm_style,tune,llm_style_tune_003,1,1024,4096,bf16,NVIDIA GeForce RTX 4060,c00,32,32,32,2,2,8,0.0,0.0,63.48799914121628,105.94336166977871,0.13212903404533555,0,3,3,0_3_3,0,
2026-03-02T10:15:21.209375+00:00,B,llm_style,tune,llm_style_tune_004,64,2048,2048,bf16,NVIDIA GeForce RTX 4060,c03,64,64,32,4,2,8,0.0,1988.572,56.32000043988228,63.50847914814949,9.53250901645629,1,3,3,1_3_3,0,
2026-03-02T10:15:21.575200+00:00,B,llm_style,tune,llm_style_tune_005,32,8192,8192,bf16,NVIDIA GeForce RTX 4060,c00,32,32,32,2,2,8,0.0,0.0,567.296028137207,600.0831854343414,7.570945472865558,0,3,3,0_3_3,0,
2026-03-02T10:15:21.896306+00:00,B,llm_style,tune,llm_style_tune_006,16,8192,8192,bf16,NVIDIA GeForce RTX 4060,c00,32,32,32,2,2,8,0.0,0.0,566.6240155696869,593.9199924468994,3.7899622836157207,0,3,3,0_3_3,0,
2026-03-02T10:15:21.947506+00:00,B,llm_style,tune,llm_style_tune_007,2,1024,8192,bf16,NVIDIA GeForce RTX 4060,c00,32,32,32,2,2,8,0.0,0.0,105.40799796581268,258.8777570426461,0.31832908932472864,0,3,3,0_3_3,0,
2026-03-02T10:15:22.037431+00:00,B,llm_style,tune,llm_style_tune_008,16,2048,8192,bf16,NVIDIA GeForce RTX 4060,c00,32,32,32,2,2,8,0.0,0.0,171.00800573825836,268.85120540857315,3.1394489964506374,0,3,3,0_3_3,0,
2026-03-02T10:15:22.078578+00:00,B,llm_style,tune,llm_style_tune_009,4,4096,2048,bf16,NVIDIA GeForce RTX 4060,c00,32,32,32,2,2,8,0.0,0.0,57.16799944639206,181.063673943281,1.173888620379829,0,3,3,0_3_3,0,
2026-03-02T10:15:22.278135+00:00,B,llm_style,tune,llm_style_tune_010,64,8192,4096,bf16,NVIDIA GeForce RTX 4060,c03,64,64,32,4,2,8,0.0,0.0,353.2640039920807,467.339531481266,12.157953393112427,1,3,3,1_3_3,0,
2026-03-02T10:15:22.321175+00:00,B,llm_style,tune,llm_style_tune_011,16,8192,1024,bf16,NVIDIA GeForce RTX 4060,c00,32,32,32,2,2,8,0.0,0.0,62.40000016987324,143.41599978506554,4.301850244699211,0,3,3,0_3_3,0,
2026-03-02T10:15:22.366269+00:00,B,llm_style,tune,llm_style_tune_012,2,8192,1024,bf16,NVIDIA GeForce RTX 4060,c00,32,32,32,2,2,8,0.0,0.0,54.207999259233475,116.18943691253659,0.6189941052709952,0,3,3,0_3_3,0,
2026-03-02T10:15:22.450016+00:00,B,llm_style,tune,llm_style_tune_013,16,8192,2048,bf16,NVIDIA GeForce RTX 4060,c00,32,32,32,2,2,8,0.0,0.0,164.86400365829468,189.99552115797997,3.2564471327091224,0,3,3,0_3_3,0,
2026-03-02T10:15:22.534251+00:00,B,llm_style,tune,llm_style_tune_014,8,4096,4096,bf16,NVIDIA GeForce RTX 4060,c00,32,32,32,2,2,8,0.0,0.0,164.86400365829468,237.14015796780583,1.6282235663545612,0,3,3,0_3_3,0,
2026-03-02T10:15:22.547626+00:00,B,llm_style,tune,llm_style_tune_015,64,1024,1024,bf16,NVIDIA GeForce RTX 4060,c03,64,64,32,4,2,8,0.0,0.0,64.51199948787689,178.75967681407906,2.0805079530238744,1,3,3,1_3_3,0,
2026-03-02T10:15:22.711911+00:00,B,llm_style,tune,llm_style_tune_016,16,4096,8192,bf16,NVIDIA GeForce RTX 4060,c00,32,32,32,2,2,8,0.0,0.0,296.9599962234497,397.24031656980503,3.6157793563280327,0,3,3,0_3_3,0,
2026-03-02T10:15:22.793310+00:00,B,llm_style,tune,llm_style_tune_017,1,4096,4096,bf16,NVIDIA GeForce RTX 4060,c00,32,32,32,2,2,8,0.0,0.0,161.15199774503708,251.7299118638038,0.20821604739326513,0,3,3,0_3_3,0,
2026-03-02T10:15:22.883961+00:00,B,llm_style,tune,llm_style_tune_018,64,4096,4096,bf16,NVIDIA GeForce RTX 4060,c03,64,64,32,4,2,8,0.0,0.0,173.0560064315796,298.97983580827713,12.409182970768722,1,3,3,1_3_3,0,
2026-03-02T10:15:22.982576+00:00,B,llm_style,tune,llm_style_tune_019,64,8192,2048,bf16,NVIDIA GeForce RTX 4060,c03,64,64,32,4,2,8,0.0,0.0,299.00801181793213,430.141436457634,7.182027113399277,1,3,3,1_3_3,0,
2026-03-02T10:15:23.026170+00:00,B,llm_style,tune,llm_style_tune_020,8,2048,4096,bf16,NVIDIA GeForce RTX 4060,c00,32,32,32,2,2,8,0.0,0.0,93.18400174379349,153.84064272046072,1.4403516213977101,0,3,3,0_3_3,0,
2026-03-02T10:15:23.040394+00:00,B,llm_style,tune,llm_style_tune_021,8,1024,2048,bf16,NVIDIA GeForce RTX 4060,c00,32,32,32,2,2,8,0.0,0.0,83.74399691820145,169.20223444700238,0.4006786544088042,0,3,3,0_3_3,0,
2026-03-02T10:15:23.085841+00:00,B,llm_style,tune,llm_style_tune_022,8,8192,1024,bf16,NVIDIA GeForce RTX 4060,c00,32,32,32,2,2,8,0.0,0.0,70.14400139451027,214.1286414861678,1.9134598159737204,0,3,3,0_3_3,0,
2026-03-02T10:15:23.256819+00:00,B,llm_style,tune,llm_style_tune_023,1,4096,8192,bf16,NVIDIA GeForce RTX 4060,c00,32,32,32,2,2,8,0.0,0.0,472.55998849868774,533.5142457485198,0.1420113120732107,0,3,3,0_3_3,0,
2026-03-02T10:15:23.430855+00:00,B,llm_style,tune,llm_style_tune_024,2,8192,4096,bf16,NVIDIA GeForce RTX 4060,c00,32,32,32,2,2,8,0.0,0.0,469.5039987564087,584.8473417758942,0.28587132027737167,0,3,3,0_3_3,0,
2026-03-02T10:15:23.527790+00:00,B,llm_style,tune,llm_style_tune_025,2,4096,4096,bf16,NVIDIA GeForce RTX 4060,c00,32,32,32,2,2,8,0.0,0.0,252.9279887676239,286.3001638650894,0.26532794700572215,0,3,3,0_3_3,0,
2026-03-02T10:15:23.543310+00:00,B,llm_style,tune,llm_style_tune_026,4,2048,1024,bf16,NVIDIA GeForce RTX 4060,c00,32,32,32,2,2,8,0.0,0.0,72.7040022611618,706.8761381506902,0.23076055620341446,0,3,3,0_3_3,0,
2026-03-02T10:15:23.591427+00:00,B,llm_style,tune,llm_style_tune_027,64,2048,4096,bf16,NVIDIA GeForce RTX 4060,c03,64,64,32,4,2,8,0.0,0.0,143.824003636837,237.97759845852843,7.465664957507741,1,3,3,1_3_3,0,
2026-03-02T10:15:23.613255+00:00,B,llm_style,tune,llm_style_tune_028,32,1024,4096,bf16,NVIDIA GeForce RTX 4060,c00,32,32,32,2,2,8,0.0,0.0,110.59200018644333,172.65664249658582,2.4272592551672245,0,3,3,0_3_3,0,
2026-03-02T10:15:23.624728+00:00,B,llm_style,tune,llm_style_tune_029,32,2048,1024,bf16,NVIDIA GeForce RTX 4060,c00,32,32,32,2,2,8,0.0,0.0,53.247999399900436,74.25024278461933,2.520615413022465,0,3,3,0_3_3,0,
2026-03-02T10:15:23.641701+00:00,B,llm_style,tune,llm_style_tune_030,4,2048,2048,bf16,NVIDIA GeForce RTX 4060,c00,32,32,32,2,2,8,0.0,0.0,62.31999956071377,79.95392091572282,0.5384215699056673,0,3,3,0_3_3,0,
2026-03-02T10:15:23.992041+00:00,B,llm_style,tune,llm_style_tune_031,1,8192,8192,bf16,NVIDIA GeForce RTX 4060,c00,32,32,32,2,2,8,0.0,0.0,912.3199880123138,992.3974740505217,0.14711694335714634,0,3,3,0_3_3,0,
2026-03-02T10:15:24.019159+00:00,B,llm_style,eval,llm_style_eval_000,2,1024,4096,bf16,NVIDIA GeForce RTX 4060,c00,32,32,32,2,2,8,0.0,0.0,115.15200138092041,251.63457050919519,0.14569626058431515,0,3,3,0_3_3,0,
2026-03-02T10:15:24.381121+00:00,B,llm_style,eval,llm_style_eval_001,2,8192,8192,bf16,NVIDIA GeForce RTX 4060,c00,32,32,32,2,2,8,0.0,0.0,915.8239960670471,1051.1382150650024,0.2931081268374496,0,3,3,0_3_3,0,
2026-03-02T10:15:24.408961+00:00,B,llm_style,eval,llm_style_eval_002,2,2048,2048,bf16,NVIDIA GeForce RTX 4060,c00,32,32,32,2,2,8,0.0,0.0,77.82399654388428,202.02495314180817,0.21557895694214924,0,3,3,0_3_3,0,
2026-03-02T10:15:24.465607+00:00,B,llm_style,eval,llm_style_eval_003,8,1024,8192,bf16,NVIDIA GeForce RTX 4060,c00,32,32,32,2,2,8,0.0,0.0,199.68000054359436,321.03424072265625,0.6721641007342517,0,3,3,0_3_3,0,
2026-03-02T10:15:24.563192+00:00,B,llm_style,eval,llm_style_eval_004,64,2048,8192,bf16,NVIDIA GeForce RTX 4060,c03,64,64,32,4,2,8,0.0,0.0,351.23199224472046,502.80449390411377,6.114145907596434,1,3,3,1_3_3,0,
2026-03-02T10:15:24.907625+00:00,B,llm_style,eval,llm_style_eval_005,1,8192,8192,bf16,NVIDIA GeForce RTX 4060,c00,32,32,32,2,2,8,0.0,0.0,918.5280203819275,1036.9126069545746,0.1461226277497683,0,3,3,0_3_3,0,
2026-03-02T10:15:24.962882+00:00,B,llm_style,eval,llm_style_eval_006,1,1024,8192,bf16,NVIDIA GeForce RTX 4060,c00,32,32,32,2,2,8,0.0,0.0,187.9040002822876,317.4911993741988,0.0892861034081001,0,3,3,0_3_3,0,
2026-03-02T10:15:25.133722+00:00,B,llm_style,eval,llm_style_eval_007,2,8192,4096,bf16,NVIDIA GeForce RTX 4060,c00,32,32,32,2,2,8,0.0,0.0,477.183997631073,585.8099395036697,0.28127038766243007,0,3,3,0_3_3,0,
2026-03-02T10:15:25.185698+00:00,B,llm_style,eval,llm_style_eval_008,16,2048,4096,bf16,NVIDIA GeForce RTX 4060,c00,32,32,32,2,2,8,0.0,0.0,134.47999954223633,242.92352393269522,1.9960994713990323,0,3,3,0_3_3,0,
2026-03-02T10:15:25.281832+00:00,B,llm_style,eval,llm_style_eval_009,32,2048,8192,bf16,NVIDIA GeForce RTX 4060,c00,32,32,32,2,2,8,0.0,0.0,327.4880051612854,384.11263942718494,3.278721073986176,0,3,3,0_3_3,0,
2026-03-02T10:15:25.293774+00:00,B,llm_style,eval,llm_style_eval_010,1,1024,1024,bf16,NVIDIA GeForce RTX 4060,c00,32,32,32,2,2,8,0.0,0.0,81.91999793052673,143.42495948076245,0.025600000646710412,0,3,3,0_3_3,0,
2026-03-02T10:15:25.388130+00:00,B,llm_style,eval,llm_style_eval_011,16,2048,8192,bf16,NVIDIA GeForce RTX 4060,c00,32,32,32,2,2,8,0.0,0.0,328.0960023403168,405.55263847112644,1.6363226256049654,0,3,3,0_3_3,0,
2026-03-02T10:15:25.727913+00:00,B,llm_style,eval,llm_style_eval_012,8,8192,8192,bf16,NVIDIA GeForce RTX 4060,c00,32,32,32,2,2,8,0.0,0.0,922.0159947872162,1035.757737159729,1.1645587821367451,0,3,3,0_3_3,0,
2026-03-02T10:15:25.901511+00:00,B,llm_style,eval,llm_style_eval_013,32,4096,8192,bf16,NVIDIA GeForce RTX 4060,c00,32,32,32,2,2,8,0.0,0.0,492.031991481781,586.5574556589124,4.364520366923168,0,3,3,0_3_3,0,
2026-03-02T10:15:25.912269+00:00,B,llm_style,eval,llm_style_eval_014,64,1024,1024,bf16,NVIDIA GeForce RTX 4060,c03,64,64,32,4,2,8,0.0,0.0,70.65600156784058,99.85023654997349,1.899594160746988,1,3,3,1_3_3,0,
2026-03-02T10:15:25.925273+00:00,B,llm_style,eval,llm_style_eval_015,16,2048,1024,bf16,NVIDIA GeForce RTX 4060,c00,32,32,32,2,2,8,0.0,0.0,64.51199948787689,164.75391522049904,1.0402539765119372,0,3,3,0_3_3,0,
2026-03-02T10:15:25.978580+00:00,B,llm_style,eval,llm_style_eval_016,2,1024,8192,bf16,NVIDIA GeForce RTX 4060,c00,32,32,32,2,2,8,0.0,0.0,244.6880042552948,320.7724797725676,0.13713149568620062,0,3,3,0_3_3,0,
2026-03-02T10:15:26.330143+00:00,B,llm_style,eval,llm_style_eval_017,4,8192,8192,bf16,NVIDIA GeForce RTX 4060,c00,32,32,32,2,2,8,0.0,0.0,918.912023305893,1028.377275466919,0.5842462590363596,0,3,3,0_3_3,0,
2026-03-02T10:15:26.360963+00:00,B,llm_style,eval,llm_style_eval_018,4,1024,4096,bf16,NVIDIA GeForce RTX 4060,c00,32,32,32,2,2,8,0.0,0.0,159.59999710321426,272.1616089344022,0.2102408058209434,0,3,3,0_3_3,0,
2026-03-02T10:15:26.411710+00:00,B,llm_style,eval,llm_style_eval_019,8,4096,2048,bf16,NVIDIA GeForce RTX 4060,c00,32,32,32,2,2,8,0.0,0.0,129.02400642633438,270.3564813733097,1.040253916441751,0,3,3,0_3_3,0,
2026-03-02T10:15:26.463602+00:00,B,llm_style,eval,llm_style_eval_020,64,4096,2048,bf16,NVIDIA GeForce RTX 4060,c03,64,64,32,4,2,8,0.0,0.0,214.00000154972076,293.25569212436676,5.017485122543454,1,3,3,1_3_3,0,
2026-03-02T10:15:26.643508+00:00,B,llm_style,eval,llm_style_eval_021,1,4096,8192,bf16,NVIDIA GeForce RTX 4060,c00,32,32,32,2,2,8,0.0,0.0,486.32000386714935,614.021115899086,0.13799322147219856,0,3,3,0_3_3,0,
2026-03-02T10:15:26.669792+00:00,B,llm_style,eval,llm_style_eval_022,32,1024,4096,bf16,NVIDIA GeForce RTX 4060,c00,32,32,32,2,2,8,0.0,0.0,176.55999958515167,234.07616093754768,1.520363936512916,0,3,3,0_3_3,0,
2026-03-02T10:15:26.679989+00:00,B,llm_style,eval,llm_style_eval_023,4,1024,1024,bf16,NVIDIA GeForce RTX 4060,c00,32,32,32,2,2,8,0.0,0.0,59.856001287698746,157.22496092319477,0.14014648188207618,0,3,3,0_3_3,0,
2026-03-02T10:15:26.705784+00:00,B,llm_style,eval,llm_style_eval_024,64,2048,2048,bf16,NVIDIA GeForce RTX 4060,c03,64,64,32,4,2,8,0.0,0.0,149.50400590896606,321.2214398384093,3.5910135566996386,1,3,3,1_3_3,0,
2026-03-02T10:15:27.069670+00:00,B,llm_style,eval,llm_style_eval_025,32,8192,8192,bf16,NVIDIA GeForce RTX 4060,c00,32,32,32,2,2,8,0.0,0.0,1048.0639934539795,1167.424978017807,4.098001002634952,0,3,3,0_3_3,0,
2026-03-02T10:15:27.121149+00:00,B,llm_style,eval,llm_style_eval_026,4,2048,4096,bf16,NVIDIA GeForce RTX 4060,c00,32,32,32,2,2,8,0.0,0.0,183.29599499702454,313.19039762020105,0.36612291502108046,0,3,3,0_3_3,0,
2026-03-02T10:15:27.210835+00:00,B,llm_style,eval,llm_style_eval_027,8,8192,2048,bf16,NVIDIA GeForce RTX 4060,c00,32,32,32,2,2,8,0.0,0.0,263.0719989538193,406.1081522703171,1.0203877914316615,0,3,3,0_3_3,0,
2026-03-02T10:15:27.384999+00:00,B,llm_style,eval,llm_style_eval_028,8,4096,8192,bf16,NVIDIA GeForce RTX 4060,c00,32,32,32,2,2,8,0.0,0.0,503.80802154541016,612.4492770433426,1.065625970688539,0,3,3,0_3_3,0,
2026-03-02T10:15:27.406931+00:00,B,llm_style,eval,llm_style_eval_029,8,2048,2048,bf16,NVIDIA GeForce RTX 4060,c00,32,32,32,2,2,8,0.0,0.0,111.61600053310394,197.71391987800598,0.6012477035503198,0,3,3,0_3_3,0,
2026-03-02T10:15:27.453874+00:00,B,llm_style,eval,llm_style_eval_030,1,4096,2048,bf16,NVIDIA GeForce RTX 4060,c00,32,32,32,2,2,8,0.0,0.0,152.5759994983673,229.33216527104375,0.10995973190514496,0,3,3,0_3_3,0,
2026-03-02T10:15:27.543064+00:00,B,llm_style,eval,llm_style_eval_031,16,8192,2048,bf16,NVIDIA GeForce RTX 4060,c00,32,32,32,2,2,8,0.0,0.0,270.7200050354004,391.0348743200301,1.983122421742703,0,3,3,0_3_3,0,
2026-03-02T10:15:27.565123+00:00,B,llm_style,eval,llm_style_eval_032,1,2048,2048,bf16,NVIDIA GeForce RTX 4060,c00,32,32,32,2,2,8,0.0,0.0,111.9839996099472,215.30623823404306,0.07490898725905898,0,3,3,0_3_3,0,
2026-03-02T10:15:27.746193+00:00,B,llm_style,eval,llm_style_eval_033,16,8192,4096,bf16,NVIDIA GeForce RTX 4060,c00,32,32,32,2,2,8,0.0,0.0,528.3199846744537,667.0130997896194,2.032370258834011,0,3,3,0_3_3,0,
2026-03-02T10:15:27.775756+00:00,B,llm_style,eval,llm_style_eval_034,16,1024,4096,bf16,NVIDIA GeForce RTX 4060,c00,32,32,32,2,2,8,0.0,0.0,204.79999482631683,270.8991912007332,0.6553600165557865,0,3,3,0_3_3,0,
2026-03-02T10:15:27.870906+00:00,B,llm_style,eval,llm_style_eval_035,4,8192,2048,bf16,NVIDIA GeForce RTX 4060,c00,32,32,32,2,2,8,0.0,0.0,283.5040092468262,353.36192786693573,0.473424444178306,0,3,3,0_3_3,0,
2026-03-02T10:15:27.924838+00:00,B,llm_style,eval,llm_style_eval_036,2,2048,4096,bf16,NVIDIA GeForce RTX 4060,c00,32,32,32,2,2,8,0.0,0.0,210.94399690628052,301.0806372761725,0.15906796349795044,0,3,3,0_3_3,0,
2026-03-02T10:15:27.935638+00:00,B,llm_style,eval,llm_style_eval_037,2,1024,1024,bf16,NVIDIA GeForce RTX 4060,c00,32,32,32,2,2,8,0.0,0.0,78.33599671721458,133.1324790418147,0.05354248590390742,0,3,3,0_3_3,0,
2026-03-02T10:15:28.151368+00:00,B,llm_style,eval,llm_style_eval_038,64,4096,8192,bf16,NVIDIA GeForce RTX 4060,c03,64,64,32,4,2,8,0.0,0.0,1134.335994720459,1279.4643092155457,3.7863272575234057,1,3,3,1_3_3,0,
2026-03-02T10:15:28.167565+00:00,B,llm_style,eval,llm_style_eval_039,4,1024,2048,bf16,NVIDIA GeForce RTX 4060,c00,32,32,32,2,2,8,0.0,0.0,116.57600104808807,191.67231768369672,0.14391655099817097,0,3,3,0_3_3,0,
2026-03-02T10:15:28.226391+00:00,B,llm_style,eval,llm_style_eval_040,64,8192,1024,bf16,NVIDIA GeForce RTX 4060,c03,64,64,32,4,2,8,0.0,0.0,284.67199206352234,371.42528623342497,3.771856220264911,1,3,3,1_3_3,0,
2026-03-02T10:15:28.241729+00:00,B,llm_style,eval,llm_style_eval_041,2,2048,1024,bf16,NVIDIA GeForce RTX 4060,c00,32,32,32,2,2,8,0.0,0.0,99.32799637317657,196.47487565875048,0.08445361133112854,0,3,3,0_3_3,0,
2026-03-02T10:15:28.290584+00:00,B,llm_style,eval,llm_style_eval_042,2,4096,2048,bf16,NVIDIA GeForce RTX 4060,c00,32,32,32,2,2,8,0.0,0.0,172.89600521326065,240.17920300364494,0.19407291659869114,0,3,3,0_3_3,0,
2026-03-02T10:15:28.305021+00:00,B,llm_style,eval,llm_style_eval_043,1,2048,1024,bf16,NVIDIA GeForce RTX 4060,c00,32,32,32,2,2,8,0.0,0.0,81.91999793052673,225.26975780725468,0.051200001293420824,0,3,3,0_3_3,0,
2026-03-02T10:15:28.408264+00:00,B,llm_style,eval,llm_style_eval_044,8,2048,8192,bf16,NVIDIA GeForce RTX 4060,c00,32,32,32,2,2,8,0.0,0.0,475.6320118904114,615.1680034399033,0.5643763440839412,0,3,3,0_3_3,0,
2026-03-02T10:15:28.455575+00:00,B,llm_style,eval,llm_style_eval_045,1,8192,1024,bf16,NVIDIA GeForce RTX 4060,c00,32,32,32,2,2,8,0.0,0.0,163.83999586105347,285.19423604011536,0.10240000258684165,0,3,3,0_3_3,0,
2026-03-02T10:15:28.480384+00:00,B,llm_style,eval,llm_style_eval_046,64,4096,1024,bf16,NVIDIA GeForce RTX 4060,c03,64,64,32,4,2,8,0.0,0.0,171.4400053024292,183.3984024822712,3.131538120597532,1,3,3,1_3_3,0,
2026-03-02T10:15:28.501688+00:00,B,llm_style,eval,llm_style_eval_047,16,2048,2048,bf16,NVIDIA GeForce RTX 4060,c00,32,32,32,2,2,8,0.0,0.0,124.84799697995186,163.12320291995997,1.0750491096909847,0,3,3,0_3_3,0,
2026-03-02T10:15:28.687727+00:00,B,llm_style,eval,llm_style_eval_048,8,8192,4096,bf16,NVIDIA GeForce RTX 4060,c00,32,32,32,2,2,8,0.0,0.0,572.4160075187683,690.8131223917007,0.9379033866071559,0,3,3,0_3_3,0,
2026-03-02T10:15:28.867421+00:00,B,llm_style,eval,llm_style_eval_049,4,4096,8192,bf16,NVIDIA GeForce RTX 4060,c00,32,32,32,2,2,8,0.0,0.0,622.5119829177856,645.6384134292603,0.43121331535147644,0,3,3,0_3_3,0,
2026-03-02T10:15:28.974365+00:00,B,llm_style,eval,llm_style_eval_050,4,2048,8192,bf16,NVIDIA GeForce RTX 4060,c00,32,32,32,2,2,8,0.0,0.0,509.95200872421265,655.4214531183243,0.2631967826458476,0,3,3,0_3_3,0,
2026-03-02T10:15:28.985747+00:00,B,llm_style,eval,llm_style_eval_051,16,1024,1024,bf16,NVIDIA GeForce RTX 4060,c00,32,32,32,2,2,8,0.0,0.0,78.84799689054489,132.7615964412689,0.4255584583407939,0,3,3,0_3_3,0,
2026-03-02T10:15:29.177732+00:00,B,llm_style,eval,llm_style_eval_052,32,8192,4096,bf16,NVIDIA GeForce RTX 4060,c00,32,32,32,2,2,8,0.0,0.0,757.6159834861755,773.5686367750168,2.834527907025322,0,3,3,0_3_3,0,
2026-03-02T10:15:29.196442+00:00,B,llm_style,eval,llm_style_eval_053,32,1024,2048,bf16,NVIDIA GeForce RTX 4060,c00,32,32,32,2,2,8,0.0,0.0,154.62400019168854,202.98752516508085,0.8680264889901262,0,3,3,0_3_3,0,
2026-03-02T10:15:29.309553+00:00,B,llm_style,eval,llm_style_eval_054,64,8192,2048,bf16,NVIDIA GeForce RTX 4060,c03,64,64,32,4,2,8,0.0,0.0,601.5839874744415,620.503357052803,3.569715439095254,1,3,3,1_3_3,0,
2026-03-02T10:15:29.335396+00:00,B,llm_style,eval,llm_style_eval_055,1,4096,1024,bf16,NVIDIA GeForce RTX 4060,c00,32,32,32,2,2,8,0.0,0.0,100.8639968931675,238.03392499685276,0.08316751525209727,0,3,3,0_3_3,0,
2026-03-02T10:15:29.361491+00:00,B,llm_style,eval,llm_style_eval_056,4,2048,2048,bf16,NVIDIA GeForce RTX 4060,c00,32,32,32,2,2,8,0.0,0.0,120.83200365304947,134.4096027314663,0.27769490685883513,0,3,3,0_3_3,0,
2026-03-02T10:15:29.422390+00:00,B,llm_style,eval,llm_style_eval_057,16,1024,8192,bf16,NVIDIA GeForce RTX 4060,c00,32,32,32,2,2,8,0.0,0.0,378.36799025535583,458.63136559724796,0.7094560399225005,0,3,3,0_3_3,0,
2026-03-02T10:15:29.604765+00:00,B,llm_style,eval,llm_style_eval_058,1,8192,4096,bf16,NVIDIA GeForce RTX 4060,c00,32,32,32,2,2,8,0.0,0.0,545.2799797058105,637.0515036582947,0.12307230504997922,0,3,3,0_3_3,0,
2026-03-02T10:15:29.630113+00:00,B,llm_style,eval,llm_style_eval_059,8,4096,1024,bf16,NVIDIA GeForce RTX 4060,c00,32,32,32,2,2,8,0.0,0.0,100.35199671983719,115.6022410839796,0.668734715736196,0,3,3,0_3_3,0,
2026-03-02T10:15:29.806297+00:00,B,llm_style,eval,llm_style_eval_060,4,8192,4096,bf16,NVIDIA GeForce RTX 4060,c00,32,32,32,2,2,8,0.0,0.0,545.775979757309,639.0579277276993,0.49184182880193006,0,3,3,0_3_3,0,
2026-03-02T10:15:29.833426+00:00,B,llm_style,eval,llm_style_eval_061,32,2048,2048,bf16,NVIDIA GeForce RTX 4060,c00,32,32,32,2,2,8,0.0,0.0,127.99999862909317,305.6377696990967,2.097152022460938,0,3,3,0_3_3,0,
2026-03-02T10:15:29.848194+00:00,B,llm_style,eval,llm_style_eval_062,8,2048,1024,bf16,NVIDIA GeForce RTX 4060,c00,32,32,32,2,2,8,0.0,0.0,81.69600367546082,183.4700785577296,0.4107230524187661,0,3,3,0_3_3,0,
2026-03-02T10:15:30.030887+00:00,B,llm_style,eval,llm_style_eval_063,16,4096,8192,bf16,NVIDIA GeForce RTX 4060,c00,32,32,32,2,2,8,0.0,0.0,572.4160075187683,677.845750451088,1.8758067732143118,0,3,3,0_3_3,0,
2026-03-02T10:15:32.569152+00:00,B2,llm_style,tune,llm_style_tune_000,8,4096,1024,bf16,NVIDIA GeForce RTX 4060,c00,32,32,32,2,2,8,99.32881803251803,1416.09,42.70400106906891,102.22496185451726,1.5714889078299472,0,3,3,llm_8_4096_1024,0,llm_specialized
2026-03-02T10:15:33.427678+00:00,B2,llm_style,tune,llm_style_tune_001,32,1024,2048,bf16,NVIDIA GeForce RTX 4060,c04,64,64,64,4,3,8,0.0,858.485,44.72000151872635,113.81152268499113,3.0012907746391018,0,3,3,llm_32_1024_2048,0,llm_specialized
2026-03-02T10:15:33.465099+00:00,B2,llm_style,tune,llm_style_tune_002,16,2048,1024,bf16,NVIDIA GeForce RTX 4060,c00,32,32,32,2,2,8,0.0,37.379,40.81599973142147,85.77023893594726,1.6441803322616508,0,3,3,llm_16_2048_1024,0,llm_specialized
2026-03-02T10:15:34.481399+00:00,B2,llm_style,tune,llm_style_tune_003,1,1024,4096,bf16,NVIDIA GeForce RTX 4060,c00,32,32,32,2,2,8,0.0,1016.259,63.391998410224915,124.50944170355795,0.13232913002229862,0,3,3,llm_1_1024_4096,0,llm_specialized
2026-03-02T10:15:34.532701+00:00,B2,llm_style,tune,llm_style_tune_004,64,2048,2048,bf16,NVIDIA GeForce RTX 4060,c02,32,64,32,2,2,8,0.0,51.261,57.28000029921532,105.42080208659164,9.372746319754377,1,3,3,llm_64_2048_2048,0,llm_specialized
2026-03-02T10:15:35.090104+00:00,B2,llm_style,tune,llm_style_tune_005,32,8192,8192,bf16,NVIDIA GeForce RTX 4060,c02,32,64,32,2,2,8,0.0,557.358,563.7120008468628,669.528306722641,7.619080824157875,0,3,3,llm_32_8192_8192,0,llm_specialized
2026-03-02T10:15:35.586281+00:00,B2,llm_style,tune,llm_style_tune_006,16,8192,8192,bf16,NVIDIA GeForce RTX 4060,c11,32,128,32,4,2,8,0.0,496.132,558.0960214138031,613.3391761779785,3.8478748559430014,0,3,3,llm_16_8192_8192,0,llm_specialized
2026-03-02T10:15:35.676636+00:00,B2,llm_style,tune,llm_style_tune_007,2,1024,8192,bf16,NVIDIA GeForce RTX 4060,c04,64,64,64,4,3,8,0.0,90.312,88.06400001049042,164.7820795327423,0.381023255768565,0,3,3,llm_2_1024_8192,0,llm_specialized
2026-03-02T10:15:35.821680+00:00,B2,llm_style,tune,llm_style_tune_008,16,2048,8192,bf16,NVIDIA GeForce RTX 4060,c10,64,128,64,8,3,8,0.0,144.996,163.83999586105347,189.62431699037546,3.2768000827789328,0,3,3,llm_16_2048_8192,0,llm_specialized
2026-03-02T10:15:35.891816+00:00,B2,llm_style,tune,llm_style_tune_009,4,4096,2048,bf16,NVIDIA GeForce RTX 4060,c11,32,128,32,4,2,8,0.0,70.088,44.88000087440014,113.64448018372056,1.4952955145390685,0,3,3,llm_4_4096_2048,0,llm_specialized
2026-03-02T10:15:36.163911+00:00,B2,llm_style,tune,llm_style_tune_010,64,8192,4096,bf16,NVIDIA GeForce RTX 4060,c10,64,128,64,8,3,8,0.0,272.029,304.1279911994934,349.15264517068863,14.122236098888731,1,3,3,llm_64_8192_4096,0,llm_specialized
2026-03-02T10:15:36.236499+00:00,B2,llm_style,tune,llm_style_tune_011,16,8192,1024,bf16,NVIDIA GeForce RTX 4060,c11,32,128,32,4,2,8,0.0,72.544,53.247999399900436,120.20544305443755,5.04123082604493,0,3,3,llm_16_8192_1024,0,llm_specialized
2026-03-02T10:15:36.300385+00:00,B2,llm_style,tune,llm_style_tune_012,2,8192,1024,bf16,NVIDIA GeForce RTX 4060,c11,32,128,32,4,2,8,0.0,63.839,50.175998359918594,135.13728089630595,0.668734715736196,0,3,3,llm_2_8192_1024,0,llm_specialized
2026-03-02T10:15:36.444910+00:00,B2,llm_style,tune,llm_style_tune_013,16,8192,2048,bf16,NVIDIA GeForce RTX 4060,c02,32,64,32,2,2,8,0.0,144.477,160.76800227165222,178.83360043168065,3.3394139655529265,0,3,3,llm_16_8192_2048,0,llm_specialized
2026-03-02T10:15:36.589338+00:00,B2,llm_style,tune,llm_style_tune_014,8,4096,4096,bf16,NVIDIA GeForce RTX 4060,c02,32,64,32,2,2,8,0.0,144.373,161.48800402879715,226.42911180853827,1.6622625167385905,0,3,3,llm_8_4096_4096,0,llm_specialized
2026-03-02T10:15:36.616755+00:00,B2,llm_style,tune,llm_style_tune_015,64,1024,1024,bf16,NVIDIA GeForce RTX 4060,c04,64,64,64,4,3,8,0.0,27.373,35.50399839878082,101.82495638728142,3.780355285409458,1,3,3,llm_64_1024_1024,0,llm_specialized
2026-03-02T10:15:36.889799+00:00,B2,llm_style,tune,llm_style_tune_016,16,4096,8192,bf16,NVIDIA GeForce RTX 4060,c01,64,32,32,2,2,8,0.0,273.009,295.9359884262085,306.71871572732925,3.628290799338645,0,3,3,llm_16_4096_8192,0,llm_specialized
2026-03-02T10:15:37.052432+00:00,B2,llm_style,tune,llm_style_tune_017,1,4096,4096,bf16,NVIDIA GeForce RTX 4060,c00,32,32,32,2,2,8,0.0,162.584,160.76800227165222,258.3020778000354,0.2087133728470579,0,3,3,llm_1_4096_4096,0,llm_specialized
2026-03-02T10:15:37.198758+00:00,B2,llm_style,tune,llm_style_tune_018,64,4096,4096,bf16,NVIDIA GeForce RTX 4060,c02,32,64,32,2,2,8,0.0,146.267,164.88000005483627,243.94175931811304,13.024524789457688,1,3,3,llm_64_4096_4096,0,llm_specialized
2026-03-02T10:15:37.349054+00:00,B2,llm_style,tune,llm_style_tune_019,64,8192,2048,bf16,NVIDIA GeForce RTX 4060,c00,32,32,32,2,2,8,0.0,150.243,166.73599928617477,331.7350402474401,12.879544052836481,1,3,3,llm_64_8192_2048,0,llm_specialized
2026-03-02T10:15:37.426407+00:00,B2,llm_style,tune,llm_style_tune_020,8,2048,4096,bf16,NVIDIA GeForce RTX 4060,c00,32,32,32,2,2,8,0.0,77.306,64.51199948787689,104.99071829020977,2.0805079530238744,0,3,3,llm_8_2048_4096,0,llm_specialized
2026-03-02T10:15:37.463578+00:00,B2,llm_style,tune,llm_style_tune_021,8,1024,2048,bf16,NVIDIA GeForce RTX 4060,c04,64,64,64,4,3,8,0.0,37.127,42.86399856209755,47.53216050565243,0.7828115230871269,0,3,3,llm_8_1024_2048,0,llm_specialized
2026-03-02T10:15:37.541458+00:00,B2,llm_style,tune,llm_style_tune_022,8,8192,1024,bf16,NVIDIA GeForce RTX 4060,c02,32,64,32,2,2,8,0.0,77.842,53.60000021755695,160.46783663332423,2.5040620793885053,0,3,3,llm_8_8192_1024,0,llm_specialized
2026-03-02T10:15:37.802324+00:00,B2,llm_style,tune,llm_style_tune_023,1,4096,8192,bf16,NVIDIA GeForce RTX 4060,c02,32,64,32,2,2,8,0.0,260.821,293.5680001974106,402.4729695916176,0.22859734015584965,0,3,3,llm_1_4096_8192,0,llm_specialized
2026-03-02T10:15:38.060310+00:00,B2,llm_style,tune,llm_style_tune_024,2,8192,4096,bf16,NVIDIA GeForce RTX 4060,c02,32,64,32,2,2,8,0.0,257.944,295.3120023012161,419.72351908683777,0.45449465972974196,0,3,3,llm_2_8192_4096,0,llm_specialized
2026-03-02T10:15:38.209591+00:00,B2,llm_style,tune,llm_style_tune_025,2,4096,4096,bf16,NVIDIA GeForce RTX 4060,c02,32,64,32,2,2,8,0.0,149.233,160.76800227165222,231.67999982833845,0.4174267456941158,0,3,3,llm_2_4096_4096,0,llm_specialized
2026-03-02T10:15:38.245961+00:00,B2,llm_style,tune,llm_style_tune_026,4,2048,1024,bf16,NVIDIA GeForce RTX 4060,c00,32,32,32,2,2,8,0.0,36.326,37.88800165057182,109.83487859368316,0.44281079151997954,0,3,3,llm_4_2048_1024,0,llm_specialized
2026-03-02T10:15:38.319924+00:00,B2,llm_style,tune,llm_style_tune_027,64,2048,4096,bf16,NVIDIA GeForce RTX 4060,c02,32,64,32,2,2,8,0.0,73.918,76.80000364780426,139.61280085146404,13.981012669270863,1,3,3,llm_64_2048_4096,0,llm_specialized
2026-03-02T10:15:38.367352+00:00,B2,llm_style,tune,llm_style_tune_028,32,1024,4096,bf16,NVIDIA GeForce RTX 4060,c04,64,64,64,4,3,8,0.0,47.383,56.09599873423576,59.26528051495552,4.785287044656396,0,3,3,llm_32_1024_4096,0,llm_specialized
2026-03-02T10:15:38.397350+00:00,B2,llm_style,tune,llm_style_tune_029,32,2048,1024,bf16,NVIDIA GeForce RTX 4060,c11,32,128,32,4,2,8,0.0,29.953,39.72800076007843,141.1648017168045,3.3784163670997427,0,3,3,llm_32_2048_1024,0,llm_specialized
2026-03-02T10:15:38.435249+00:00,B2,llm_style,tune,llm_style_tune_030,4,2048,2048,bf16,NVIDIA GeForce RTX 4060,c00,32,32,32,2,2,8,0.0,37.859,48.448000103235245,101.16255752742276,0.6925865242837818,0,3,3,llm_4_2048_2048,0,llm_specialized
2026-03-02T10:15:38.946454+00:00,B2,llm_style,tune,llm_style_tune_031,1,8192,8192,bf16,NVIDIA GeForce RTX 4060,c10,64,128,64,8,3,8,0.0,511.164,556.3519895076752,697.5529718399044,0.24124606459801,0,3,3,llm_1_8192_8192,0,llm_specialized
2026-03-02T10:15:39.001356+00:00,B2,llm_style,eval,llm_style_eval_000,2,1024,4096,bf16,NVIDIA GeForce RTX 4060,c04,64,64,64,4,3,8,0.0,54.416,61.43999844789505,73.62048164010048,0.27306667356491104,0,3,3,llm_2_1024_4096,0,llm_specialized
2026-03-02T10:15:39.532600+00:00,B2,llm_style,eval,llm_style_eval_001,2,8192,8192,bf16,NVIDIA GeForce RTX 4060,c10,64,128,64,8,3,8,0.0,531.2,558.0800175666809,643.7136077880859,0.4809981499972387,0,3,3,llm_2_8192_8192,0,llm_specialized
2026-03-02T10:15:39.582477+00:00,B2,llm_style,eval,llm_style_eval_002,2,2048,2048,bf16,NVIDIA GeForce RTX 4060,c00,32,32,32,2,2,8,0.0,49.836,48.128001391887665,186.95968076586715,0.3485957345992748,0,3,3,llm_2_2048_2048,0,llm_specialized
2026-03-02T10:15:39.673335+00:00,B2,llm_style,eval,llm_style_eval_003,8,1024,8192,bf16,NVIDIA GeForce RTX 4060,c04,64,64,64,4,3,8,0.0,90.813,89.02399986982346,99.7609593719244,1.5076578023483742,0,3,3,llm_8_1024_8192,0,llm_specialized
2026-03-02T10:15:39.824299+00:00,B2,llm_style,eval,llm_style_eval_004,64,2048,8192,bf16,NVIDIA GeForce RTX 4060,c10,64,128,64,8,3,8,0.0,150.917,168.67200285196304,179.0652833878994,12.731713691007535,1,3,3,llm_64_2048_8192,0,llm_specialized
2026-03-02T10:15:40.141520+00:00,B2,llm_style,eval,llm_style_eval_005,1,8192,8192,bf16,NVIDIA GeForce RTX 4060,c10,64,128,64,8,3,8,0.0,0.0,560.1119995117188,619.0182447433472,0.2396265891768167,0,3,3,llm_1_8192_8192,0,
2026-03-02T10:15:40.230931+00:00,B2,llm_style,eval,llm_style_eval_006,1,1024,8192,bf16,NVIDIA GeForce RTX 4060,c04,64,64,64,4,3,8,0.0,89.36,87.98399940133095,95.12704148888588,0.19068485308871067,0,3,3,llm_1_1024_8192,0,llm_specialized
2026-03-02T10:15:40.391612+00:00,B2,llm_style,eval,llm_style_eval_007,2,8192,4096,bf16,NVIDIA GeForce RTX 4060,c02,32,64,32,2,2,8,0.0,0.0,295.29599845409393,371.7654275894165,0.45451929149952636,0,3,3,llm_2_8192_4096,0,
2026-03-02T10:15:40.469996+00:00,B2,llm_style,eval,llm_style_eval_008,16,2048,4096,bf16,NVIDIA GeForce RTX 4060,c00,32,32,32,2,2,8,0.0,78.329,62.79999762773514,110.89535966515534,4.2744500977727355,0,3,3,llm_16_2048_4096,0,llm_specialized
2026-03-02T10:15:40.616068+00:00,B2,llm_style,eval,llm_style_eval_009,32,2048,8192,bf16,NVIDIA GeForce RTX 4060,c10,64,128,64,8,3,8,0.0,146.026,165.8879965543747,238.19615796208376,6.472691492467626,0,3,3,llm_32_2048_8192,0,llm_specialized
2026-03-02T10:15:40.650004+00:00,B2,llm_style,eval,llm_style_eval_010,1,1024,1024,bf16,NVIDIA GeForce RTX 4060,c04,64,64,64,4,3,8,0.0,33.892,36.86400130391121,72.99072038382286,0.056888886876680304,0,3,3,llm_1_1024_1024,0,llm_specialized
2026-03-02T10:15:40.734914+00:00,B2,llm_style,eval,llm_style_eval_011,16,2048,8192,bf16,NVIDIA GeForce RTX 4060,c10,64,128,64,8,3,8,0.0,0.0,164.86400365829468,272.41151422262186,3.2564471327091224,0,3,3,llm_16_2048_8192,0,
2026-03-02T10:15:41.233364+00:00,B2,llm_style,eval,llm_style_eval_012,8,8192,8192,bf16,NVIDIA GeForce RTX 4060,c11,32,128,32,4,2,8,0.0,498.398,558.4959983825684,583.0575948953629,1.9225595655288645,0,3,3,llm_8_8192_8192,0,llm_specialized
2026-03-02T10:15:41.501457+00:00,B2,llm_style,eval,llm_style_eval_013,32,4096,8192,bf16,NVIDIA GeForce RTX 4060,c02,32,64,32,2,2,8,0.0,268.045,297.9840040206909,329.84255999326706,7.206707806540135,0,3,3,llm_32_4096_8192,0,llm_specialized
2026-03-02T10:15:41.514224+00:00,B2,llm_style,eval,llm_style_eval_014,64,1024,1024,bf16,NVIDIA GeForce RTX 4060,c04,64,64,64,4,3,8,0.0,0.0,32.44800120592117,107.06943884491909,4.136394323589575,1,3,3,llm_64_1024_1024,0,
2026-03-02T10:15:41.526473+00:00,B2,llm_style,eval,llm_style_eval_015,16,2048,1024,bf16,NVIDIA GeForce RTX 4060,c00,32,32,32,2,2,8,0.0,0.0,68.64000111818314,212.4742403626442,0.9776932241660828,0,3,3,llm_16_2048_1024,0,
2026-03-02T10:15:41.571880+00:00,B2,llm_style,eval,llm_style_eval_016,2,1024,8192,bf16,NVIDIA GeForce RTX 4060,c04,64,64,64,4,3,8,0.0,0.0,84.99199897050858,180.80767795443535,0.3947951855049682,0,3,3,llm_2_1024_8192,0,
2026-03-02T10:15:42.067815+00:00,B2,llm_style,eval,llm_style_eval_017,4,8192,8192,bf16,NVIDIA GeForce RTX 4060,c11,32,128,32,4,2,8,0.0,495.864,557.0079982280731,614.6873611211777,0.9638477610875746,0,3,3,llm_4_8192_8192,0,llm_specialized
2026-03-02T10:15:42.125465+00:00,B2,llm_style,eval,llm_style_eval_018,4,1024,4096,bf16,NVIDIA GeForce RTX 4060,c04,64,64,64,4,3,8,0.0,57.595,59.26400050520897,85.3401589393615,0.5661857403138142,0,3,3,llm_4_1024_4096,0,llm_specialized
2026-03-02T10:15:42.195035+00:00,B2,llm_style,eval,llm_style_eval_019,8,4096,2048,bf16,NVIDIA GeForce RTX 4060,c00,32,32,32,2,2,8,0.0,69.513,53.247999399900436,112.25087836384755,2.520615413022465,0,3,3,llm_8_4096_2048,0,llm_specialized
2026-03-02T10:15:42.266900+00:00,B2,llm_style,eval,llm_style_eval_020,64,4096,2048,bf16,NVIDIA GeForce RTX 4060,c04,64,64,64,4,3,8,0.0,71.812,68.4639997780323,90.17535954713817,15.683305496044449,1,3,3,llm_64_4096_2048,0,llm_specialized
2026-03-02T10:15:42.428229+00:00,B2,llm_style,eval,llm_style_eval_021,1,4096,8192,bf16,NVIDIA GeForce RTX 4060,c02,32,64,32,2,2,8,0.0,0.0,292.6720082759857,401.0604855418205,0.22929717261077207,0,3,3,llm_1_4096_8192,0,
2026-03-02T10:15:42.446949+00:00,B2,llm_style,eval,llm_style_eval_022,32,1024,4096,bf16,NVIDIA GeForce RTX 4060,c04,64,64,64,4,3,8,0.0,0.0,49.15200173854828,58.44991926103829,5.46133314016131,0,3,3,llm_32_1024_4096,0,
2026-03-02T10:15:42.474372+00:00,B2,llm_style,eval,llm_style_eval_023,4,1024,1024,bf16,NVIDIA GeForce RTX 4060,c02,32,64,32,2,2,8,0.0,27.375,37.88800165057182,49.148161262273774,0.22140539575998977,0,3,3,llm_4_1024_1024,0,llm_specialized
2026-03-02T10:15:42.493695+00:00,B2,llm_style,eval,llm_style_eval_024,64,2048,2048,bf16,NVIDIA GeForce RTX 4060,c02,32,64,32,2,2,8,0.0,0.0,50.175998359918594,138.86463850736618,10.699755451779136,1,3,3,llm_64_2048_2048,0,
2026-03-02T10:15:42.816752+00:00,B2,llm_style,eval,llm_style_eval_025,32,8192,8192,bf16,NVIDIA GeForce RTX 4060,c02,32,64,32,2,2,8,0.0,0.0,564.2240047454834,585.9327900409698,7.612166905123831,0,3,3,llm_32_8192_8192,0,
2026-03-02T10:15:42.886728+00:00,B2,llm_style,eval,llm_style_eval_026,4,2048,4096,bf16,NVIDIA GeForce RTX 4060,c00,32,32,32,2,2,8,0.0,69.923,60.20800024271011,70.15424139797688,1.1146170563624629,0,3,3,llm_4_2048_4096,0,llm_specialized
2026-03-02T10:15:43.030865+00:00,B2,llm_style,eval,llm_style_eval_027,8,8192,2048,bf16,NVIDIA GeForce RTX 4060,c02,32,64,32,2,2,8,0.0,144.088,163.83999586105347,170.4796777665615,1.6384000413894664,0,3,3,llm_8_8192_2048,0,llm_specialized
2026-03-02T10:15:43.293353+00:00,B2,llm_style,eval,llm_style_eval_028,8,4096,8192,bf16,NVIDIA GeForce RTX 4060,c11,32,128,32,4,2,8,0.0,262.442,293.7759906053543,304.4707176089287,1.8274839645463357,0,3,3,llm_8_4096_8192,0,llm_specialized
2026-03-02T10:15:43.341237+00:00,B2,llm_style,eval,llm_style_eval_029,8,2048,2048,bf16,NVIDIA GeForce RTX 4060,c00,32,32,32,2,2,8,0.0,47.839,44.544000178575516,127.39040054380891,1.5065747066038666,0,3,3,llm_8_2048_2048,0,llm_specialized
2026-03-02T10:15:43.408236+00:00,B2,llm_style,eval,llm_style_eval_030,1,4096,2048,bf16,NVIDIA GeForce RTX 4060,c00,32,32,32,2,2,8,0.0,66.947,51.19999870657921,68.18208221346137,0.32768000827789323,0,3,3,llm_1_4096_2048,0,llm_specialized
2026-03-02T10:15:43.496101+00:00,B2,llm_style,eval,llm_style_eval_031,16,8192,2048,bf16,NVIDIA GeForce RTX 4060,c02,32,64,32,2,2,8,0.0,0.0,165.8879965543747,272.4003118276596,3.236345746233813,0,3,3,llm_16_8192_2048,0,
2026-03-02T10:15:43.535762+00:00,B2,llm_style,eval,llm_style_eval_032,1,2048,2048,bf16,NVIDIA GeForce RTX 4060,c00,32,32,32,2,2,8,0.0,39.607,43.007999658584595,58.42943925410508,0.19504762059598826,0,3,3,llm_1_2048_2048,0,llm_specialized
2026-03-02T10:15:43.795498+00:00,B2,llm_style,eval,llm_style_eval_033,16,8192,4096,bf16,NVIDIA GeForce RTX 4060,c11,32,128,32,4,2,8,0.0,259.695,294.75200176239014,405.1769670844078,3.642865248004594,0,3,3,llm_16_8192_4096,0,llm_specialized
2026-03-02T10:15:43.855702+00:00,B2,llm_style,eval,llm_style_eval_034,16,1024,4096,bf16,NVIDIA GeForce RTX 4060,c04,64,64,64,4,3,8,0.0,60.16,58.43200162053108,66.09920002520084,2.296990078683875,0,3,3,llm_16_1024_4096,0,llm_specialized
2026-03-02T10:15:43.995182+00:00,B2,llm_style,eval,llm_style_eval_035,4,8192,2048,bf16,NVIDIA GeForce RTX 4060,c11,32,128,32,4,2,8,0.0,139.436,159.743994474411,200.17152041196815,0.8402051572680562,0,3,3,llm_4_8192_2048,0,llm_specialized
2026-03-02T10:15:44.069762+00:00,B2,llm_style,eval,llm_style_eval_036,2,2048,4096,bf16,NVIDIA GeForce RTX 4060,c00,32,32,32,2,2,8,0.0,74.525,64.51199948787689,101.36576436460007,0.5201269882559686,0,3,3,llm_2_2048_4096,0,llm_specialized
2026-03-02T10:15:44.096162+00:00,B2,llm_style,eval,llm_style_eval_037,2,1024,1024,bf16,NVIDIA GeForce RTX 4060,c04,64,64,64,4,3,8,0.0,26.356,35.48799827694893,48.2147194072604,0.11818936552204445,0,3,3,llm_2_1024_1024,0,llm_specialized
2026-03-02T10:15:44.362387+00:00,B2,llm_style,eval,llm_style_eval_038,64,4096,8192,bf16,NVIDIA GeForce RTX 4060,c02,32,64,32,2,2,8,0.0,266.187,302.40000784397125,374.6745592355726,14.20293381148345,1,3,3,llm_64_4096_8192,0,llm_specialized
2026-03-02T10:15:44.400399+00:00,B2,llm_style,eval,llm_style_eval_039,4,1024,2048,bf16,NVIDIA GeForce RTX 4060,c00,32,32,32,2,2,8,0.0,37.957,45.13600096106529,83.7241624295711,0.3717036432729646,0,3,3,llm_4_1024_2048,0,llm_specialized
2026-03-02T10:15:44.474276+00:00,B2,llm_style,eval,llm_style_eval_040,64,8192,1024,bf16,NVIDIA GeForce RTX 4060,c10,64,128,64,8,3,8,0.0,73.824,66.15999713540077,79.90367963910099,16.22947204490528,1,3,3,llm_64_8192_1024,0,llm_specialized
2026-03-02T10:15:44.504657+00:00,B2,llm_style,eval,llm_style_eval_041,2,2048,1024,bf16,NVIDIA GeForce RTX 4060,c02,32,64,32,2,2,8,0.0,30.336,38.91199827194214,71.6099206358194,0.21557895694214924,0,3,3,llm_2_2048_1024,0,llm_specialized
2026-03-02T10:15:44.570579+00:00,B2,llm_style,eval,llm_style_eval_042,2,4096,2048,bf16,NVIDIA GeForce RTX 4060,c00,32,32,32,2,2,8,0.0,65.882,51.024001091718674,61.905599124729605,0.6576205566412543,0,3,3,llm_2_4096_2048,0,llm_specialized
2026-03-02T10:15:44.600840+00:00,B2,llm_style,eval,llm_style_eval_043,1,2048,1024,bf16,NVIDIA GeForce RTX 4060,c01,64,32,32,2,2,8,0.0,30.216,39.56799954175949,72.13695816695682,0.10600242743061582,0,3,3,llm_1_2048_1024,0,llm_specialized
2026-03-02T10:15:44.749958+00:00,B2,llm_style,eval,llm_style_eval_044,8,2048,8192,bf16,NVIDIA GeForce RTX 4060,c04,64,64,64,4,3,8,0.0,149.079,164.65599834918976,196.62847951054573,1.6302804555636217,0,3,3,llm_8_2048_8192,0,llm_specialized
2026-03-02T10:15:44.822311+00:00,B2,llm_style,eval,llm_style_eval_045,1,8192,1024,bf16,NVIDIA GeForce RTX 4060,c11,32,128,32,4,2,8,0.0,72.308,53.247999399900436,139.3820822983978,0.3150769266278081,0,3,3,llm_1_8192_1024,0,llm_specialized
2026-03-02T10:15:44.868491+00:00,B2,llm_style,eval,llm_style_eval_046,64,4096,1024,bf16,NVIDIA GeForce RTX 4060,c01,64,32,32,2,2,8,0.0,46.135,52.09600180387497,67.22560223191974,10.30541487658016,1,3,3,llm_64_4096_1024,0,llm_specialized
2026-03-02T10:15:44.912093+00:00,B2,llm_style,eval,llm_style_eval_047,16,2048,2048,bf16,NVIDIA GeForce RTX 4060,c00,32,32,32,2,2,8,0.0,43.557,55.296000093221664,70.17760127782822,2.4272592551672245,0,3,3,llm_16_2048_2048,0,llm_specialized
2026-03-02T10:15:45.178431+00:00,B2,llm_style,eval,llm_style_eval_048,8,8192,4096,bf16,NVIDIA GeForce RTX 4060,c00,32,32,32,2,2,8,0.0,266.291,293.60000789165497,322.40799963474274,1.8285793513946957,0,3,3,llm_8_8192_4096,0,llm_specialized
2026-03-02T10:15:45.446524+00:00,B2,llm_style,eval,llm_style_eval_049,4,4096,8192,bf16,NVIDIA GeForce RTX 4060,c01,64,32,32,2,2,8,0.0,268.051,295.9359884262085,318.4844759106636,0.9070726998346612,0,3,3,llm_4_4096_8192,0,llm_specialized
2026-03-02T10:15:45.594036+00:00,B2,llm_style,eval,llm_style_eval_050,4,2048,8192,bf16,NVIDIA GeForce RTX 4060,c10,64,128,64,8,3,8,0.0,147.461,161.85599565505981,248.71295318007446,0.8292416197299157,0,3,3,llm_4_2048_8192,0,llm_specialized
2026-03-02T10:15:45.620427+00:00,B2,llm_style,eval,llm_style_eval_051,16,1024,1024,bf16,NVIDIA GeForce RTX 4060,c04,64,64,64,4,3,8,0.0,26.34,34.7680002450943,117.17280410230155,0.9650952532058403,0,3,3,llm_16_1024_1024,0,llm_specialized
2026-03-02T10:15:45.891493+00:00,B2,llm_style,eval,llm_style_eval_052,32,8192,4096,bf16,NVIDIA GeForce RTX 4060,c00,32,32,32,2,2,8,0.0,271.023,299.3279993534088,339.78303939104075,7.174349384751413,0,3,3,llm_32_8192_4096,0,llm_specialized
2026-03-02T10:15:45.908373+00:00,B2,llm_style,eval,llm_style_eval_053,32,1024,2048,bf16,NVIDIA GeForce RTX 4060,c04,64,64,64,4,3,8,0.0,0.0,47.82399907708168,87.86687888205043,2.80649319567924,0,3,3,llm_32_1024_2048,0,
2026-03-02T10:15:46.000356+00:00,B2,llm_style,eval,llm_style_eval_054,64,8192,2048,bf16,NVIDIA GeForce RTX 4060,c00,32,32,32,2,2,8,0.0,0.0,195.50400227308273,210.55680125951767,10.9843462181422,1,3,3,llm_64_8192_2048,0,
2026-03-02T10:15:46.049107+00:00,B2,llm_style,eval,llm_style_eval_055,1,4096,1024,bf16,NVIDIA GeForce RTX 4060,c00,32,32,32,2,2,8,0.0,48.696,43.007999658584595,146.14527493715286,0.19504762059598826,0,3,3,llm_1_4096_1024,0,llm_specialized
2026-03-02T10:15:46.067483+00:00,B2,llm_style,eval,llm_style_eval_056,4,2048,2048,bf16,NVIDIA GeForce RTX 4060,c00,32,32,32,2,2,8,0.0,0.0,23.312000557780266,122.94144436717032,1.4393630403719844,0,3,3,llm_4_2048_2048,0,
2026-03-02T10:15:46.153736+00:00,B2,llm_style,eval,llm_style_eval_057,16,1024,8192,bf16,NVIDIA GeForce RTX 4060,c04,64,64,64,4,3,8,0.0,86.202,84.99199897050858,159.2422379553318,3.158361484039746,0,3,3,llm_16_1024_8192,0,llm_specialized
2026-03-02T10:15:46.417205+00:00,B2,llm_style,eval,llm_style_eval_058,1,8192,4096,bf16,NVIDIA GeForce RTX 4060,c11,32,128,32,4,2,8,0.0,263.422,292.86399483680725,372.85887897014595,0.22914685718671254,0,3,3,llm_1_8192_4096,0,llm_specialized
2026-03-02T10:15:46.443861+00:00,B2,llm_style,eval,llm_style_eval_059,8,4096,1024,bf16,NVIDIA GeForce RTX 4060,c00,32,32,32,2,2,8,0.0,0.0,45.85599899291992,171.65312215685842,1.463469676243701,0,3,3,llm_8_4096_1024,0,
2026-03-02T10:15:46.712120+00:00,B2,llm_style,eval,llm_style_eval_060,4,8192,4096,bf16,NVIDIA GeForce RTX 4060,c02,32,64,32,2,2,8,0.0,268.184,294.5439964532852,321.5769496560097,0.9113594547243606,0,3,3,llm_4_8192_4096,0,llm_specialized
2026-03-02T10:15:46.762857+00:00,B2,llm_style,eval,llm_style_eval_061,32,2048,2048,bf16,NVIDIA GeForce RTX 4060,c00,32,32,32,2,2,8,0.0,50.694,47.759998589754105,61.862079389393315,5.620508038657839,0,3,3,llm_32_2048_2048,0,llm_specialized
2026-03-02T10:15:46.793337+00:00,B2,llm_style,eval,llm_style_eval_062,8,2048,1024,bf16,NVIDIA GeForce RTX 4060,c00,32,32,32,2,2,8,0.0,30.435,37.696000188589096,117.76000261306763,0.8901324233905649,0,3,3,llm_8_2048_1024,0,llm_specialized
2026-03-02T10:15:46.956832+00:00,B2,llm_style,eval,llm_style_eval_063,16,4096,8192,bf16,NVIDIA GeForce RTX 4060,c01,64,32,32,2,2,8,0.0,0.0,272.2239941358566,393.0140823125838,3.944332046880983,0,3,3,llm_16_4096_8192,0,
