results/phase2_b_compare_round2.csv
timestamp,method,workload,split,shape_id,M,N,K,dtype,gpu,config_id,BLOCK_M,BLOCK_N,BLOCK_K,num_warps,num_stages,GROUP_M,compile_time_ms,tune_time_ms,runtime_cost_us,p99_us,runtime_perf_tflops,bucket_m,bucket_n,bucket_k,cache_key,invalid_config,notes
2026-03-02T09:26:05.278603+00:00,B,uniform,tune,uniform_tune_000,1536,512,1024,bf16,NVIDIA GeForce RTX 4060,c06,64,128,32,4,3,8,185.79348106868565,2591.065,85.34399792551994,205.69568231701842,18.87200945760226,3,2,3,3_2_3,0,
2026-03-02T09:26:05.608172+00:00,B,uniform,tune,uniform_tune_001,1536,1536,2048,bf16,NVIDIA GeForce RTX 4060,c09,128,64,64,8,3,8,0.0,329.53,318.4640109539032,372.21247762441624,30.34464204308094,3,3,3,3_3_3,0,
2026-03-02T09:26:05.725080+00:00,B,uniform,tune,uniform_tune_002,384,2048,1536,bf16,NVIDIA GeForce RTX 4060,c06,64,128,32,4,3,8,0.0,116.866,101.3759970664978,127.54336215555668,23.831273416874733,2,3,3,2_3_3,0,
2026-03-02T09:26:05.811610+00:00,B,uniform,tune,uniform_tune_003,1536,64,3072,bf16,NVIDIA GeForce RTX 4060,c04,64,64,64,4,3,8,0.0,86.483,51.19999870657921,58.26784007251261,11.796480298004159,3,1,3,3_1_3,0,
2026-03-02T09:26:05.830905+00:00,B,uniform,tune,uniform_tune_004,768,128,2048,bf16,NVIDIA GeForce RTX 4060,c04,64,64,64,4,3,8,0.0,0.0,45.05600035190582,1009.7699394822088,8.936727202927772,3,1,3,3_1_3,0,
2026-03-02T09:26:05.918618+00:00,B,uniform,tune,uniform_tune_005,512,128,4096,bf16,NVIDIA GeForce RTX 4060,c04,64,64,64,4,3,8,0.0,87.671,61.83999963104725,76.98431991040704,8.681612470942833,2,1,3,2_1_3,0,
2026-03-02T09:26:06.014434+00:00,B,uniform,tune,uniform_tune_006,2048,1024,4096,bf16,NVIDIA GeForce RTX 4060,c09,128,64,64,8,3,8,0.0,0.0,563.1040036678314,699.2092758417127,30.50922932903565,3,3,3,3_3_3,0,
2026-03-02T09:26:06.065470+00:00,B,uniform,tune,uniform_tune_007,128,768,512,bf16,NVIDIA GeForce RTX 4060,c11,32,128,32,4,2,8,0.0,50.973,36.57599911093712,62.96448033303022,2.7521680459003295,1,3,2,1_3_2,0,
2026-03-02T09:26:06.107418+00:00,B,uniform,tune,uniform_tune_008,2048,256,64,bf16,NVIDIA GeForce RTX 4060,c11,32,128,32,4,2,8,0.0,41.909,32.76799991726875,42.506239488720894,2.048000005170703,3,2,1,3_2_1,0,
2026-03-02T09:26:06.122084+00:00,B,uniform,tune,uniform_tune_009,192,768,2048,bf16,NVIDIA GeForce RTX 4060,c06,64,128,32,4,3,8,0.0,0.0,58.70399996638298,75.79648330807686,10.288562556995618,2,3,3,2_3_3,0,
2026-03-02T09:26:06.142355+00:00,B,uniform,tune,uniform_tune_010,1024,1024,1536,bf16,NVIDIA GeForce RTX 4060,c09,128,64,64,8,3,8,0.0,0.0,149.31200444698334,210.16607969999308,21.573787612929475,3,3,3,3_3_3,0,
2026-03-02T09:26:06.197288+00:00,B,uniform,tune,uniform_tune_011,256,384,768,bf16,NVIDIA GeForce RTX 4060,c11,32,128,32,4,2,8,0.0,54.897,41.95199906826019,63.047680817544446,3.5992312012191787,2,2,3,2_2_3,0,
2026-03-02T09:26:06.256156+00:00,B,uniform,tune,uniform_tune_012,64,192,2048,bf16,NVIDIA GeForce RTX 4060,c04,64,64,64,4,3,8,0.0,58.838,46.879999339580536,77.46560007333753,1.073627318878933,1,2,3,1_2_3,0,
2026-03-02T09:26:06.307117+00:00,B,uniform,tune,uniform_tune_013,192,128,512,bf16,NVIDIA GeForce RTX 4060,c00,32,32,32,2,2,8,0.0,50.933,34.81600061058998,674.3401676416377,0.7228235167351563,2,1,2,2_1_2,0,
2026-03-02T09:26:06.359206+00:00,B,uniform,tune,uniform_tune_014,128,128,1024,bf16,NVIDIA GeForce RTX 4060,c04,64,64,64,4,3,8,0.0,52.051,37.88800165057182,41.53535939753055,0.8856215830399591,1,1,3,1_1_3,0,
2026-03-02T09:26:06.403810+00:00,B,uniform,tune,uniform_tune_015,3072,3072,768,bf16,NVIDIA GeForce RTX 4060,c09,128,64,64,8,3,8,0.0,0.0,472.06398844718933,600.9753733873366,30.70667320267672,3,3,3,3_3_3,0,
2026-03-02T09:26:06.413097+00:00,B,uniform,tune,uniform_tune_016,256,128,3072,bf16,NVIDIA GeForce RTX 4060,c04,64,64,64,4,3,8,0.0,0.0,49.55200105905533,67.94176038354632,4.062935657433128,2,1,3,2_1_3,0,
2026-03-02T09:26:06.420990+00:00,B,uniform,tune,uniform_tune_017,96,1024,192,bf16,NVIDIA GeForce RTX 4060,c11,32,128,32,4,2,8,0.0,0.0,66.56000018119812,126.2121594697237,0.567138459994525,1,3,2,1_3_2,0,
2026-03-02T09:26:06.463263+00:00,B,uniform,tune,uniform_tune_018,64,64,192,bf16,NVIDIA GeForce RTX 4060,c04,64,64,64,4,3,8,0.0,42.248,32.52799995243549,44.003519639372826,0.04835415648979161,1,1,2,1_1_2,0,
2026-03-02T09:26:06.504940+00:00,B,uniform,tune,uniform_tune_019,4096,64,64,bf16,NVIDIA GeForce RTX 4060,c00,32,32,32,2,2,8,0.0,41.654,29.519999399781227,61.24927975237367,1.1366677737889341,3,1,1,3_1_1,0,
2026-03-02T09:26:06.705103+00:00,B,uniform,tune,uniform_tune_020,128,4096,3072,bf16,NVIDIA GeForce RTX 4060,c06,64,128,32,4,3,8,0.0,200.135,136.19199395179749,141.1865621805191,23.65209127593866,1,3,3,1_3_3,0,
2026-03-02T09:26:06.751789+00:00,B,uniform,tune,uniform_tune_021,192,2048,3072,bf16,NVIDIA GeForce RTX 4060,c06,64,128,32,4,3,8,0.0,0.0,88.41599896550179,158.83487746119496,27.324456345764357,2,3,3,2_3_3,0,
2026-03-02T09:26:06.803725+00:00,B,uniform,tune,uniform_tune_022,1536,2048,2048,bf16,NVIDIA GeForce RTX 4060,c09,128,64,64,8,3,8,0.0,0.0,410.6239974498749,490.59839457273483,31.378833112579763,3,3,3,3_3_3,0,
2026-03-02T09:26:06.814297+00:00,B,uniform,tune,uniform_tune_023,256,1024,1024,bf16,NVIDIA GeForce RTX 4060,c06,64,128,32,4,3,8,0.0,0.0,59.808000922203064,135.24992108345032,8.976573430340029,2,3,3,2_3_3,0,
2026-03-02T09:26:06.861324+00:00,B,uniform,tune,uniform_tune_024,768,128,384,bf16,NVIDIA GeForce RTX 4060,c10,64,128,64,8,3,8,0.0,46.994,33.79200026392937,62.07008134573698,2.234181800731943,3,1,2,3_1_2,0,
2026-03-02T09:26:06.871447+00:00,B,uniform,tune,uniform_tune_025,256,96,384,bf16,NVIDIA GeForce RTX 4060,c00,32,32,32,2,2,8,0.0,0.0,67.71200150251389,668.1382349133477,0.27874479532700375,2,1,2,2_1_2,0,
2026-03-02T09:26:06.894383+00:00,B,uniform,tune,uniform_tune_026,96,1024,3072,bf16,NVIDIA GeForce RTX 4060,c06,64,128,32,4,3,8,0.0,0.0,92.16000139713287,148.53951811790466,6.553599900648331,1,3,3,1_3_3,0,
2026-03-02T09:26:06.940972+00:00,B,uniform,tune,uniform_tune_027,1536,512,4096,bf16,NVIDIA GeForce RTX 4060,c06,64,128,32,4,3,8,0.0,0.0,218.1120067834854,226.30399465560913,29.53735119403705,3,2,3,3_2_3,0,
2026-03-02T09:26:06.945112+00:00,B,uniform,tune,uniform_tune_028,128,64,192,bf16,NVIDIA GeForce RTX 4060,c04,64,64,64,4,3,8,0.0,0.0,29.69600073993206,117.08767786622039,0.10593103184328642,1,1,2,1_1_2,0,
2026-03-02T09:26:06.953881+00:00,B,uniform,tune,uniform_tune_029,192,256,1536,bf16,NVIDIA GeForce RTX 4060,c11,32,128,32,4,2,8,0.0,0.0,53.247999399900436,175.0883220136165,2.835692339650273,2,2,3,2_2_3,0,
2026-03-02T09:26:07.026346+00:00,B,uniform,tune,uniform_tune_030,4096,64,3072,bf16,NVIDIA GeForce RTX 4060,c04,64,64,64,4,3,8,0.0,0.0,95.05600109696388,196.01216241717339,16.943830136059063,3,1,3,3_1_3,0,
2026-03-02T09:26:07.076567+00:00,B,uniform,tune,uniform_tune_031,384,128,96,bf16,NVIDIA GeForce RTX 4060,c10,64,128,64,8,3,8,0.0,50.158,37.6800000667572,47.173439525067806,0.25045605051168407,2,1,1,2_1_1,0,
2026-03-02T09:26:07.098374+00:00,B,uniform,eval,uniform_eval_000,512,4096,768,bf16,NVIDIA GeForce RTX 4060,c06,64,128,32,4,3,8,0.0,0.0,125.85600465536118,194.82751920819277,25.594531471270432,2,3,3,2_3_3,0,
2026-03-02T09:26:07.137229+00:00,B,uniform,eval,uniform_eval_001,384,512,64,bf16,NVIDIA GeForce RTX 4060,c11,32,128,32,4,2,8,0.0,38.797,29.600000008940697,41.849599741399274,0.8501967564999543,2,2,1,2_2_1,0,
2026-03-02T09:26:07.215136+00:00,B,uniform,eval,uniform_eval_002,256,4096,384,bf16,NVIDIA GeForce RTX 4060,c11,32,128,32,4,2,8,0.0,77.867,60.15999987721443,62.98623897135258,13.386076623065444,2,3,2,2_3_2,0,
2026-03-02T09:26:07.224282+00:00,B,uniform,eval,uniform_eval_003,384,768,512,bf16,NVIDIA GeForce RTX 4060,c11,32,128,32,4,2,8,0.0,0.0,45.392001047730446,487.6697666943061,6.6529318168294145,2,3,2,2_3_2,0,
2026-03-02T09:26:07.272183+00:00,B,uniform,eval,uniform_eval_004,768,1024,96,bf16,NVIDIA GeForce RTX 4060,c06,64,128,32,4,3,8,0.0,47.864,37.59999945759773,75.85759997367859,4.015823036654029,3,3,1,3_3_1,0,
2026-03-02T09:26:07.284410+00:00,B,uniform,eval,uniform_eval_005,3072,3072,128,bf16,NVIDIA GeForce RTX 4060,c06,64,128,32,4,3,8,0.0,0.0,110.59200018644333,222.99647718667978,21.845333296505025,3,3,1,3_3_1,0,
2026-03-02T09:26:07.290669+00:00,B,uniform,eval,uniform_eval_006,256,96,512,bf16,NVIDIA GeForce RTX 4060,c00,32,32,32,2,2,8,0.0,0.0,37.88800165057182,119.54112045466889,0.6642161872799692,2,1,2,2_1_2,0,
2026-03-02T09:26:07.696885+00:00,B,uniform,eval,uniform_eval_007,4096,4096,4096,bf16,NVIDIA GeForce RTX 4060,c09,128,64,64,8,3,8,0.0,0.0,4242.8319454193115,4350.927610397339,32.39321171331879,3,3,3,3_3_3,0,
2026-03-02T09:26:07.753504+00:00,B,uniform,eval,uniform_eval_008,128,96,64,bf16,NVIDIA GeForce RTX 4060,c11,32,128,32,4,2,8,0.0,56.566,32.75199979543686,120.57599976658815,0.04802344924962834,1,1,1,1_1_1,0,
2026-03-02T09:26:07.767702+00:00,B,uniform,eval,uniform_eval_009,3072,384,96,bf16,NVIDIA GeForce RTX 4060,c11,32,128,32,4,2,8,0.0,0.0,40.28799943625927,124.44672122597693,5.621833279618159,3,2,1,3_2_1,0,
2026-03-02T09:26:07.788353+00:00,B,uniform,eval,uniform_eval_010,768,768,2048,bf16,NVIDIA GeForce RTX 4060,c09,128,64,64,8,3,8,0.0,0.0,116.20800197124481,181.86592489480958,20.789610551929194,3,3,3,3_3_3,0,
2026-03-02T09:26:07.801771+00:00,B,uniform,eval,uniform_eval_011,4096,96,512,bf16,NVIDIA GeForce RTX 4060,c10,64,128,64,8,3,8,0.0,0.0,49.136001616716385,141.49248272180552,8.194667265376653,3,1,2,3_1_2,0,
2026-03-02T09:26:07.847788+00:00,B,uniform,eval,uniform_eval_012,384,384,256,bf16,NVIDIA GeForce RTX 4060,c09,128,64,64,8,3,8,0.0,45.982,33.79200026392937,43.293119855225086,2.234181800731943,2,2,2,2_2_2,0,
2026-03-02T09:26:07.889043+00:00,B,uniform,eval,uniform_eval_013,4096,2048,768,bf16,NVIDIA GeForce RTX 4060,c09,128,64,64,8,3,8,0.0,0.0,422.91200160980225,480.29982984066,30.46709915763562,3,3,3,3_3_3,0,
2026-03-02T09:26:07.900979+00:00,B,uniform,eval,uniform_eval_014,192,384,3072,bf16,NVIDIA GeForce RTX 4060,c11,32,128,32,4,2,8,0.0,0.0,62.40000016987324,139.32895809411997,7.259372287929918,2,2,3,2_2_3,0,
2026-03-02T09:26:07.908702+00:00,B,uniform,eval,uniform_eval_015,128,96,4096,bf16,NVIDIA GeForce RTX 4060,c04,64,64,64,4,3,8,0.0,0.0,60.83200126886368,74.79296296834944,1.6547753468621065,1,1,3,1_1_3,0,
2026-03-02T09:26:07.954466+00:00,B,uniform,eval,uniform_eval_016,64,4096,2048,bf16,NVIDIA GeForce RTX 4060,c06,64,128,32,4,3,8,0.0,0.0,80.81599697470665,91.61600075662136,13.286253516566205,1,3,3,1_3_3,0,
2026-03-02T09:26:07.962779+00:00,B,uniform,eval,uniform_eval_017,96,128,3072,bf16,NVIDIA GeForce RTX 4060,c04,64,64,64,4,3,8,0.0,0.0,53.247999399900436,66.10720038414001,1.4178461698251366,1,1,3,1_1_3,0,
2026-03-02T09:26:08.003463+00:00,B,uniform,eval,uniform_eval_018,512,768,64,bf16,NVIDIA GeForce RTX 4060,c03,64,64,32,4,2,8,0.0,40.649,29.69600073993206,83.14720101654513,1.6948965094925827,2,3,1,2_3_1,0,
2026-03-02T09:26:08.008876+00:00,B,uniform,eval,uniform_eval_019,64,128,384,bf16,NVIDIA GeForce RTX 4060,c04,64,64,64,4,3,8,0.0,0.0,33.80800038576126,127.28671766817561,0.186093703508408,1,1,2,1_1_2,0,
2026-03-02T09:26:08.014498+00:00,B,uniform,eval,uniform_eval_020,512,512,96,bf16,NVIDIA GeForce RTX 4060,c11,32,128,32,4,2,8,0.0,0.0,38.256000727415085,136.77567780017853,1.3156536763638038,2,2,1,2_2_1,0,
2026-03-02T09:26:08.040778+00:00,B,uniform,eval,uniform_eval_021,256,3072,1536,bf16,NVIDIA GeForce RTX 4060,c06,64,128,32,4,3,8,0.0,0.0,103.10400277376175,171.35584458708763,23.4318652914105,2,3,3,2_3_3,0,
2026-03-02T09:26:08.051265+00:00,B,uniform,eval,uniform_eval_022,2048,96,512,bf16,NVIDIA GeForce RTX 4060,c10,64,128,64,8,3,8,0.0,0.0,65.5359998345375,206.86016097664827,3.072000007756054,3,1,2,3_1_2,0,
2026-03-02T09:26:08.083809+00:00,B,uniform,eval,uniform_eval_023,1536,512,3072,bf16,NVIDIA GeForce RTX 4060,c06,64,128,32,4,3,8,0.0,0.0,169.90400105714798,233.23648065328592,28.438636982861805,3,2,3,3_2_3,0,
2026-03-02T09:26:08.122021+00:00,B,uniform,eval,uniform_eval_024,128,192,64,bf16,NVIDIA GeForce RTX 4060,c11,32,128,32,4,2,8,0.0,38.164,28.79999950528145,55.52128009498115,0.10922666854293261,1,2,1,1_2_1,0,
2026-03-02T09:26:08.128901+00:00,B,uniform,eval,uniform_eval_025,1536,96,384,bf16,NVIDIA GeForce RTX 4060,c10,64,128,64,8,3,8,0.0,0.0,34.81600061058998,108.41119818389416,3.2527058253082037,3,1,2,3_1_2,0,
2026-03-02T09:26:08.134650+00:00,B,uniform,eval,uniform_eval_026,1536,2048,64,bf16,NVIDIA GeForce RTX 4060,c06,64,128,32,4,3,8,0.0,0.0,40.23999907076359,51.18783984333275,10.00629207997542,3,3,1,3_3_1,0,
2026-03-02T09:26:08.139420+00:00,B,uniform,eval,uniform_eval_027,256,1024,96,bf16,NVIDIA GeForce RTX 4060,c03,64,64,32,4,2,8,0.0,0.0,35.599999129772186,62.618240900337675,1.413810371638683,2,3,1,2_3_1,0,
2026-03-02T09:26:08.143976+00:00,B,uniform,eval,uniform_eval_028,2048,256,64,bf16,NVIDIA GeForce RTX 4060,c11,32,128,32,4,2,8,0.0,0.0,36.73600032925606,47.82784055918454,1.8267874400729303,3,2,1,3_2_1,0,
2026-03-02T09:26:08.148855+00:00,B,uniform,eval,uniform_eval_029,192,768,192,bf16,NVIDIA GeForce RTX 4060,c11,32,128,32,4,2,8,0.0,0.0,35.840000957250595,114.43199768662447,1.5798856720885461,2,3,2,2_3_2,0,
2026-03-02T09:26:08.205112+00:00,B,uniform,eval,uniform_eval_030,1024,2048,3072,bf16,NVIDIA GeForce RTX 4060,c09,128,64,64,8,3,8,0.0,0.0,425.9359985589981,522.3619425296782,30.250793385840716,3,3,3,3_3_3,0,
2026-03-02T09:26:08.287217+00:00,B,uniform,eval,uniform_eval_031,1536,1024,512,bf16,NVIDIA GeForce RTX 4060,c06,64,128,32,4,3,8,0.0,82.057,78.84799689054489,136.69376127421836,20.42680600035811,3,3,2,3_3_2,0,
2026-03-02T09:26:08.297340+00:00,B,uniform,eval,uniform_eval_032,512,768,768,bf16,NVIDIA GeForce RTX 4060,c06,64,128,32,4,3,8,0.0,0.0,47.10400104522705,105.04352070391172,12.82226058504217,2,3,3,2_3_3,0,
2026-03-02T09:26:08.309328+00:00,B,uniform,eval,uniform_eval_033,64,512,4096,bf16,NVIDIA GeForce RTX 4060,c04,64,64,64,4,3,8,0.0,0.0,59.1839998960495,69.00480009615421,4.53560855081574,1,2,3,1_2_3,0,
2026-03-02T09:26:08.364055+00:00,B,uniform,eval,uniform_eval_034,1024,256,512,bf16,NVIDIA GeForce RTX 4060,c11,32,128,32,4,2,8,0.0,54.692,43.007999658584595,119.97184336185452,6.241523859071624,3,2,2,3_2_2,0,
2026-03-02T09:26:08.368969+00:00,B,uniform,eval,uniform_eval_035,1024,768,96,bf16,NVIDIA GeForce RTX 4060,c06,64,128,32,4,3,8,0.0,0.0,34.60799902677536,52.81599849462506,4.36300705750653,3,3,1,3_3_1,0,
2026-03-02T09:26:08.378086+00:00,B,uniform,eval,uniform_eval_036,768,64,1536,bf16,NVIDIA GeForce RTX 4060,c04,64,64,64,4,3,8,0.0,0.0,50.064001232385635,159.91936005651934,3.016038276667421,3,1,3,3_1_3,0,
2026-03-02T09:26:08.383688+00:00,B,uniform,eval,uniform_eval_037,512,256,512,bf16,NVIDIA GeForce RTX 4060,c09,128,64,64,8,3,8,0.0,0.0,39.5359992980957,71.50591988116496,3.394823208793024,2,2,2,2_2_2,0,
2026-03-02T09:26:08.425362+00:00,B,uniform,eval,uniform_eval_038,64,1024,64,bf16,NVIDIA GeForce RTX 4060,c11,32,128,32,4,2,8,0.0,41.652,29.551999643445015,126.15071751177307,0.2838592346105652,1,3,1,1_3_1,0,
2026-03-02T09:26:08.439843+00:00,B,uniform,eval,uniform_eval_039,512,128,2048,bf16,NVIDIA GeForce RTX 4060,c04,64,64,64,4,3,8,0.0,0.0,51.59999988973141,195.7321541011333,5.202237530496965,2,1,3,2_1_3,0,
2026-03-02T09:26:08.449440+00:00,B,uniform,eval,uniform_eval_040,4096,768,96,bf16,NVIDIA GeForce RTX 4060,c06,64,128,32,4,3,8,0.0,0.0,73.04000109434128,179.34336110949513,8.269164388700878,3,3,1,3_3_1,0,
2026-03-02T09:26:08.457666+00:00,B,uniform,eval,uniform_eval_041,4096,192,64,bf16,NVIDIA GeForce RTX 4060,c11,32,128,32,4,2,8,0.0,0.0,38.91199827194214,277.7779190242284,2.5869474833057904,3,2,1,3_2_1,0,
2026-03-02T09:26:08.462522+00:00,B,uniform,eval,uniform_eval_042,96,1536,128,bf16,NVIDIA GeForce RTX 4060,c11,32,128,32,4,2,8,0.0,0.0,42.7360013127327,107.50207975506765,0.8833006093331712,1,3,1,1_3_1,0,
2026-03-02T09:26:08.467757+00:00,B,uniform,eval,uniform_eval_043,192,2048,192,bf16,NVIDIA GeForce RTX 4060,c11,32,128,32,4,2,8,0.0,0.0,39.63200002908707,46.78528044372797,3.809924906368098,2,3,2,2_3_2,0,
2026-03-02T09:26:08.547119+00:00,B,uniform,eval,uniform_eval_044,384,4096,3072,bf16,NVIDIA GeForce RTX 4060,c06,64,128,32,4,3,8,0.0,0.0,314.14398550987244,340.26751071214676,30.761933577417814,2,3,3,2_3_3,0,
2026-03-02T09:26:08.562386+00:00,B,uniform,eval,uniform_eval_045,4096,96,768,bf16,NVIDIA GeForce RTX 4060,c04,64,64,64,4,3,8,0.0,0.0,60.84800139069557,67.91807927191257,9.926041319285732,3,1,3,3_1_3,0,
2026-03-02T09:26:08.568092+00:00,B,uniform,eval,uniform_eval_046,96,96,1536,bf16,NVIDIA GeForce RTX 4060,c04,64,64,64,4,3,8,0.0,0.0,43.007999658584595,47.70783994346857,0.6582857195114603,1,1,3,1_1_3,0,
2026-03-02T09:26:08.625274+00:00,B,uniform,eval,uniform_eval_047,2048,512,4096,bf16,NVIDIA GeForce RTX 4060,c06,64,128,32,4,3,8,0.0,0.0,315.2640014886856,423.19904446601845,27.246798084900544,3,2,3,3_2_3,0,
2026-03-02T09:26:08.633210+00:00,B,uniform,eval,uniform_eval_048,96,256,768,bf16,NVIDIA GeForce RTX 4060,c04,64,64,64,4,3,8,0.0,0.0,36.86400130391121,205.60959696769686,1.0239999637802455,1,2,3,1_2_3,0,
2026-03-02T09:26:08.638721+00:00,B,uniform,eval,uniform_eval_049,64,768,384,bf16,NVIDIA GeForce RTX 4060,c11,32,128,32,4,2,8,0.0,0.0,34.81600061058998,72.05728106200685,1.0842352751027344,1,3,2,1_3_2,0,
2026-03-02T09:26:08.642950+00:00,B,uniform,eval,uniform_eval_050,128,1024,96,bf16,NVIDIA GeForce RTX 4060,c11,32,128,32,4,2,8,0.0,0.0,29.56799976527691,56.55391994863747,0.8511168898734032,1,3,1,1_3_1,0,
2026-03-02T09:26:08.649941+00:00,B,uniform,eval,uniform_eval_051,384,768,768,bf16,NVIDIA GeForce RTX 4060,c06,64,128,32,4,3,8,0.0,0.0,48.00000041723251,54.63744055479765,9.43718391796875,2,3,3,2_3_3,0,
2026-03-02T09:26:08.665127+00:00,B,uniform,eval,uniform_eval_052,768,64,4096,bf16,NVIDIA GeForce RTX 4060,c04,64,64,64,4,3,8,0.0,0.0,53.247999399900436,105.13408198952672,7.561846239067394,3,1,3,3_1_3,0,
2026-03-02T09:26:08.669398+00:00,B,uniform,eval,uniform_eval_053,384,96,512,bf16,NVIDIA GeForce RTX 4060,c00,32,32,32,2,2,8,0.0,0.0,31.10400028526783,47.87872117012739,1.2136296184989233,2,1,2,2_1_2,0,
2026-03-02T09:26:08.675453+00:00,B,uniform,eval,uniform_eval_054,768,192,768,bf16,NVIDIA GeForce RTX 4060,c06,64,128,32,4,3,8,0.0,0.0,39.91999849677086,54.78623956441878,5.673657929078355,3,2,3,3_2_3,0,
2026-03-02T09:26:08.684383+00:00,B,uniform,eval,uniform_eval_055,512,2048,512,bf16,NVIDIA GeForce RTX 4060,c11,32,128,32,4,2,8,0.0,0.0,62.79999762773514,89.19104285538191,17.097800391090942,2,3,2,2_3_2,0,
2026-03-02T09:26:08.689374+00:00,B,uniform,eval,uniform_eval_056,384,512,512,bf16,NVIDIA GeForce RTX 4060,c09,128,64,64,8,3,8,0.0,0.0,32.5119998306036,43.718400299549074,6.192377985019887,2,2,2,2_2_2,0,
2026-03-02T09:26:08.698930+00:00,B,uniform,eval,uniform_eval_057,2048,512,512,bf16,NVIDIA GeForce RTX 4060,c11,32,128,32,4,2,8,0.0,0.0,70.64000144600868,77.24064320325851,15.200195385339548,3,2,2,3_2_2,0,
2026-03-02T09:26:08.715738+00:00,B,uniform,eval,uniform_eval_058,1024,512,2048,bf16,NVIDIA GeForce RTX 4060,c06,64,128,32,4,3,8,0.0,0.0,97.08800166845322,135.5366448312997,22.118939633070863,3,2,3,3_2_3,0,
2026-03-02T09:26:08.758244+00:00,B,uniform,eval,uniform_eval_059,2048,64,4096,bf16,NVIDIA GeForce RTX 4060,c04,64,64,64,4,3,8,0.0,0.0,78.84799689054489,156.36960238218307,13.617870666905405,3,1,3,3_1_3,0,
2026-03-02T09:26:08.767074+00:00,B,uniform,eval,uniform_eval_060,64,1536,1024,bf16,NVIDIA GeForce RTX 4060,c06,64,128,32,4,3,8,0.0,0.0,38.255998864769936,52.346880920231314,5.2626149616865,1,3,3,1_3_3,0,
2026-03-02T09:26:08.782427+00:00,B,uniform,eval,uniform_eval_061,768,1024,1536,bf16,NVIDIA GeForce RTX 4060,c09,128,64,64,8,3,8,0.0,0.0,99.10400211811066,134.47168067097658,24.377613944598764,3,3,3,3_3_3,0,
2026-03-02T09:26:08.789783+00:00,B,uniform,eval,uniform_eval_062,384,2048,192,bf16,NVIDIA GeForce RTX 4060,c11,32,128,32,4,2,8,0.0,0.0,49.19999837875366,116.27360105514522,6.138006055919103,2,3,2,2_3_2,0,
2026-03-02T09:26:08.795836+00:00,B,uniform,eval,uniform_eval_063,256,2048,192,bf16,NVIDIA GeForce RTX 4060,c11,32,128,32,4,2,8,0.0,0.0,43.007999658584595,54.855679944157586,4.681142894303718,2,3,2,2_3_2,0,
2026-03-02T09:26:10.848728+00:00,B,llm_style,tune,llm_style_tune_000,8,4096,1024,bf16,NVIDIA GeForce RTX 4060,c00,32,32,32,2,2,8,0.0,2052.185,39.93599861860275,145.5327970534562,1.6804103145361124,0,3,3,0_3_3,0,
2026-03-02T09:26:10.870012+00:00,B,llm_style,tune,llm_style_tune_001,32,1024,2048,bf16,NVIDIA GeForce RTX 4060,c00,32,32,32,2,2,8,0.0,0.0,109.47199910879135,188.03712040185926,1.2260461953071378,0,3,3,0_3_3,0,
2026-03-02T09:26:10.884184+00:00,B,llm_style,tune,llm_style_tune_002,16,2048,1024,bf16,NVIDIA GeForce RTX 4060,c00,32,32,32,2,2,8,0.0,0.0,76.80000364780426,114.59839865565294,0.8738132918294289,0,3,3,0_3_3,0,
2026-03-02T09:26:11.092478+00:00,B,llm_style,tune,llm_style_tune_003,1,1024,4096,bf16,NVIDIA GeForce RTX 4060,c00,32,32,32,2,2,8,0.0,0.0,111.61600053310394,248.90367835760105,0.07515596294378997,0,3,3,0_3_3,0,
2026-03-02T09:26:11.131390+00:00,B,llm_style,tune,llm_style_tune_004,64,2048,2048,bf16,NVIDIA GeForce RTX 4060,c06,64,128,32,4,3,8,0.0,0.0,117.15200170874596,195.0822426378727,4.582686630781828,1,3,3,1_3_3,0,
2026-03-02T09:26:11.724677+00:00,B,llm_style,tune,llm_style_tune_005,32,8192,8192,bf16,NVIDIA GeForce RTX 4060,c00,32,32,32,2,2,8,0.0,0.0,600.5280017852783,7341.977005004883,7.151985058534683,0,3,3,0_3_3,0,
2026-03-02T09:26:12.036026+00:00,B,llm_style,tune,llm_style_tune_006,16,8192,8192,bf16,NVIDIA GeForce RTX 4060,c00,32,32,32,2,2,8,0.0,0.0,565.2480125427246,638.7916797399519,3.799188321493976,0,3,3,0_3_3,0,
2026-03-02T09:26:12.088295+00:00,B,llm_style,tune,llm_style_tune_007,2,1024,8192,bf16,NVIDIA GeForce RTX 4060,c00,32,32,32,2,2,8,0.0,0.0,113.64800110459328,214.75071981549254,0.29524876525649546,0,3,3,0_3_3,0,
2026-03-02T09:26:12.179571+00:00,B,llm_style,tune,llm_style_tune_008,16,2048,8192,bf16,NVIDIA GeForce RTX 4060,c00,32,32,32,2,2,8,0.0,0.0,171.424001455307,222.16640397906292,3.131830475558995,0,3,3,0_3_3,0,
2026-03-02T09:26:12.227546+00:00,B,llm_style,tune,llm_style_tune_009,4,4096,2048,bf16,NVIDIA GeForce RTX 4060,c00,32,32,32,2,2,8,0.0,0.0,57.26400017738342,167.3385608941315,1.1719206445955699,0,3,3,0_3_3,0,
2026-03-02T09:26:12.391975+00:00,B,llm_style,tune,llm_style_tune_010,64,8192,4096,bf16,NVIDIA GeForce RTX 4060,c06,64,128,32,4,3,8,0.0,0.0,307.5520098209381,434.58559811115254,13.965011311422096,1,3,3,1_3_3,0,
2026-03-02T09:26:12.432243+00:00,B,llm_style,tune,llm_style_tune_011,16,8192,1024,bf16,NVIDIA GeForce RTX 4060,c00,32,32,32,2,2,8,0.0,0.0,58.94399993121624,122.4396841973066,4.554076009657412,0,3,3,0_3_3,0,
2026-03-02T09:26:12.471942+00:00,B,llm_style,tune,llm_style_tune_012,2,8192,1024,bf16,NVIDIA GeForce RTX 4060,c00,32,32,32,2,2,8,0.0,0.0,56.28800019621849,134.3296010792255,0.5961205209463852,0,3,3,0_3_3,0,
2026-03-02T09:26:12.554784+00:00,B,llm_style,tune,llm_style_tune_013,16,8192,2048,bf16,NVIDIA GeForce RTX 4060,c00,32,32,32,2,2,8,0.0,0.0,166.22399538755417,296.0076794028281,3.2298039205968796,0,3,3,0_3_3,0,
2026-03-02T09:26:12.643259+00:00,B,llm_style,tune,llm_style_tune_014,8,4096,4096,bf16,NVIDIA GeForce RTX 4060,c00,32,32,32,2,2,8,0.0,0.0,162.81600296497345,185.52095860242838,1.6487043724918637,0,3,3,0_3_3,0,
2026-03-02T09:26:12.652393+00:00,B,llm_style,tune,llm_style_tune_015,64,1024,1024,bf16,NVIDIA GeForce RTX 4060,c06,64,128,32,4,3,8,0.0,0.0,42.38400049507618,118.01535487174982,3.166707399779129,1,3,3,1_3_3,0,
2026-03-02T09:26:12.814052+00:00,B,llm_style,tune,llm_style_tune_016,16,4096,8192,bf16,NVIDIA GeForce RTX 4060,c00,32,32,32,2,2,8,0.0,0.0,299.0560084581375,307.074573636055,3.590437221228092,0,3,3,0_3_3,0,
2026-03-02T09:26:12.898481+00:00,B,llm_style,tune,llm_style_tune_017,1,4096,4096,bf16,NVIDIA GeForce RTX 4060,c00,32,32,32,2,2,8,0.0,0.0,165.20000249147415,209.94047656655312,0.20311399209410858,0,3,3,0_3_3,0,
2026-03-02T09:26:12.981811+00:00,B,llm_style,tune,llm_style_tune_018,64,4096,4096,bf16,NVIDIA GeForce RTX 4060,c06,64,128,32,4,3,8,0.0,0.0,166.9120043516159,178.17600071430206,12.865962854751436,1,3,3,1_3_3,0,
2026-03-02T09:26:13.065241+00:00,B,llm_style,tune,llm_style_tune_019,64,8192,2048,bf16,NVIDIA GeForce RTX 4060,c06,64,128,32,4,3,8,0.0,0.0,173.90400171279907,230.69695964455588,12.348672985378164,1,3,3,1_3_3,0,
2026-03-02T09:26:13.155826+00:00,B,llm_style,tune,llm_style_tune_020,8,2048,4096,bf16,NVIDIA GeForce RTX 4060,c00,32,32,32,2,2,8,0.0,0.0,68.57600063085556,158.41088309884063,1.9572113679025072,0,3,3,0_3_3,0,
2026-03-02T09:26:13.170307+00:00,B,llm_style,tune,llm_style_tune_021,8,1024,2048,bf16,NVIDIA GeForce RTX 4060,c00,32,32,32,2,2,8,0.0,0.0,72.38399982452393,122.4288001656532,0.46356145116799213,0,3,3,0_3_3,0,
2026-03-02T09:26:13.212594+00:00,B,llm_style,tune,llm_style_tune_022,8,8192,1024,bf16,NVIDIA GeForce RTX 4060,c00,32,32,32,2,2,8,0.0,0.0,55.296000093221664,122.68543668091291,2.4272592551672245,0,3,3,0_3_3,0,
2026-03-02T09:26:13.389247+00:00,B,llm_style,tune,llm_style_tune_023,1,4096,8192,bf16,NVIDIA GeForce RTX 4060,c00,32,32,32,2,2,8,0.0,0.0,294.76799070835114,320.66592156887054,0.22766672812313174,0,3,3,0_3_3,0,
2026-03-02T09:26:13.560092+00:00,B,llm_style,tune,llm_style_tune_024,2,8192,4096,bf16,NVIDIA GeForce RTX 4060,c00,32,32,32,2,2,8,0.0,0.0,476.1599898338318,504.82177317142487,0.28187527483533154,0,3,3,0_3_3,0,
2026-03-02T09:26:13.649719+00:00,B,llm_style,tune,llm_style_tune_025,2,4096,4096,bf16,NVIDIA GeForce RTX 4060,c00,32,32,32,2,2,8,0.0,0.0,253.88799607753754,310.6611281633376,0.26432468268214193,0,3,3,0_3_3,0,
2026-03-02T09:26:13.664029+00:00,B,llm_style,tune,llm_style_tune_026,4,2048,1024,bf16,NVIDIA GeForce RTX 4060,c00,32,32,32,2,2,8,0.0,0.0,57.26400017738342,396.55422389507225,0.29298016114889247,0,3,3,0_3_3,0,
2026-03-02T09:26:13.711580+00:00,B,llm_style,tune,llm_style_tune_027,64,2048,4096,bf16,NVIDIA GeForce RTX 4060,c06,64,128,32,4,3,8,0.0,0.0,150.89599788188934,208.59903976321215,7.115774036899564,1,3,3,1_3_3,0,
2026-03-02T09:26:13.739153+00:00,B,llm_style,tune,llm_style_tune_028,32,1024,4096,bf16,NVIDIA GeForce RTX 4060,c00,32,32,32,2,2,8,0.0,0.0,129.02399897575378,240.30208304524416,2.0805079530238744,0,3,3,0_3_3,0,
2026-03-02T09:26:13.753020+00:00,B,llm_style,tune,llm_style_tune_029,32,2048,1024,bf16,NVIDIA GeForce RTX 4060,c00,32,32,32,2,2,8,0.0,0.0,63.48800100386143,146.53440490365028,2.1140644827018056,0,3,3,0_3_3,0,
2026-03-02T09:26:13.771766+00:00,B,llm_style,tune,llm_style_tune_030,4,2048,2048,bf16,NVIDIA GeForce RTX 4060,c00,32,32,32,2,2,8,0.0,0.0,66.54400005936623,85.13152219355102,0.5042442890428126,0,3,3,0_3_3,0,
2026-03-02T09:26:14.114477+00:00,B,llm_style,tune,llm_style_tune_031,1,8192,8192,bf16,NVIDIA GeForce RTX 4060,c00,32,32,32,2,2,8,0.0,0.0,909.2000126838684,947.8246438503265,0.14762178412624805,0,3,3,0_3_3,0,
2026-03-02T09:26:14.139921+00:00,B,llm_style,eval,llm_style_eval_000,2,1024,4096,bf16,NVIDIA GeForce RTX 4060,c00,32,32,32,2,2,8,0.0,0.0,83.96799862384796,510.06465137004784,0.19980488132338384,0,3,3,0_3_3,0,
2026-03-02T09:26:14.470722+00:00,B,llm_style,eval,llm_style_eval_001,2,8192,8192,bf16,NVIDIA GeForce RTX 4060,c00,32,32,32,2,2,8,0.0,0.0,911.6959869861603,959.6329599618912,0.29443527209917936,0,3,3,0_3_3,0,
2026-03-02T09:26:14.494399+00:00,B,llm_style,eval,llm_style_eval_002,2,2048,2048,bf16,NVIDIA GeForce RTX 4060,c00,32,32,32,2,2,8,0.0,0.0,81.85599744319916,193.03424194455147,0.20496013149973413,0,3,3,0_3_3,0,
2026-03-02T09:26:14.549921+00:00,B,llm_style,eval,llm_style_eval_003,8,1024,8192,bf16,NVIDIA GeForce RTX 4060,c00,32,32,32,2,2,8,0.0,0.0,190.36799669265747,302.9094493389129,0.7050435489778772,0,3,3,0_3_3,0,
2026-03-02T09:26:14.647713+00:00,B,llm_style,eval,llm_style_eval_004,64,2048,8192,bf16,NVIDIA GeForce RTX 4060,c06,64,128,32,4,3,8,0.0,0.0,328.14399898052216,400.8639895915983,6.544333142375916,1,3,3,1_3_3,0,
2026-03-02T09:26:14.986678+00:00,B,llm_style,eval,llm_style_eval_005,1,8192,8192,bf16,NVIDIA GeForce RTX 4060,c00,32,32,32,2,2,8,0.0,0.0,913.4079813957214,1025.8826041221619,0.14694170702878065,0,3,3,0_3_3,0,
2026-03-02T09:26:15.041445+00:00,B,llm_style,eval,llm_style_eval_006,1,1024,8192,bf16,NVIDIA GeForce RTX 4060,c00,32,32,32,2,2,8,0.0,0.0,234.49599742889404,275.1795274019241,0.07154585231284102,0,3,3,0_3_3,0,
2026-03-02T09:26:15.245148+00:00,B,llm_style,eval,llm_style_eval_007,2,8192,4096,bf16,NVIDIA GeForce RTX 4060,c00,32,32,32,2,2,8,0.0,0.0,477.183997631073,597.1353757381439,0.28127038766243007,0,3,3,0_3_3,0,
2026-03-02T09:26:15.293857+00:00,B,llm_style,eval,llm_style_eval_008,16,2048,4096,bf16,NVIDIA GeForce RTX 4060,c00,32,32,32,2,2,8,0.0,0.0,122.3679967224598,232.08960041403765,2.1936736989233605,0,3,3,0_3_3,0,
2026-03-02T09:26:15.390375+00:00,B,llm_style,eval,llm_style_eval_009,32,2048,8192,bf16,NVIDIA GeForce RTX 4060,c00,32,32,32,2,2,8,0.0,0.0,335.35999059677124,444.4979065656662,3.201758868400737,0,3,3,0_3_3,0,
2026-03-02T09:26:15.403225+00:00,B,llm_style,eval,llm_style_eval_010,1,1024,1024,bf16,NVIDIA GeForce RTX 4060,c00,32,32,32,2,2,8,0.0,0.0,71.68000191450119,238.12095060944526,0.029257142075713817,0,3,3,0_3_3,0,
2026-03-02T09:26:15.500676+00:00,B,llm_style,eval,llm_style_eval_011,16,2048,8192,bf16,NVIDIA GeForce RTX 4060,c00,32,32,32,2,2,8,0.0,0.0,330.1760107278824,371.31007432937616,1.6260142910336,0,3,3,0_3_3,0,
2026-03-02T09:26:15.865281+00:00,B,llm_style,eval,llm_style_eval_012,8,8192,8192,bf16,NVIDIA GeForce RTX 4060,c00,32,32,32,2,2,8,0.0,0.0,918.5280203819275,1042.5958502292633,1.1689810219981465,0,3,3,0_3_3,0,
2026-03-02T09:26:16.048829+00:00,B,llm_style,eval,llm_style_eval_013,32,4096,8192,bf16,NVIDIA GeForce RTX 4060,c00,32,32,32,2,2,8,0.0,0.0,494.59201097488403,510.5561429262161,4.34192951027883,0,3,3,0_3_3,0,
2026-03-02T09:26:16.063735+00:00,B,llm_style,eval,llm_style_eval_014,64,1024,1024,bf16,NVIDIA GeForce RTX 4060,c06,64,128,32,4,3,8,0.0,0.0,89.08800035715103,164.36576291918752,1.5065747066038666,1,3,3,1_3_3,0,
2026-03-02T09:26:16.076709+00:00,B,llm_style,eval,llm_style_eval_015,16,2048,1024,bf16,NVIDIA GeForce RTX 4060,c00,32,32,32,2,2,8,0.0,0.0,63.26399743556976,99.93216022849082,1.0607749544809588,0,3,3,0_3_3,0,
2026-03-02T09:26:16.128772+00:00,B,llm_style,eval,llm_style_eval_016,2,1024,8192,bf16,NVIDIA GeForce RTX 4060,c00,32,32,32,2,2,8,0.0,0.0,256.00001215934753,326.581110060215,0.13107199377441436,0,3,3,0_3_3,0,
2026-03-02T09:26:16.462530+00:00,B,llm_style,eval,llm_style_eval_017,4,8192,8192,bf16,NVIDIA GeForce RTX 4060,c00,32,32,32,2,2,8,0.0,0.0,926.5120029449463,1044.1216218471527,0.579453812032159,0,3,3,0_3_3,0,
2026-03-02T09:26:16.494499+00:00,B,llm_style,eval,llm_style_eval_018,4,1024,4096,bf16,NVIDIA GeForce RTX 4060,c00,32,32,32,2,2,8,0.0,0.0,152.92800217866898,220.1683196425438,0.21941326324787566,0,3,3,0_3_3,0,
2026-03-02T09:26:16.543840+00:00,B,llm_style,eval,llm_style_eval_019,8,4096,2048,bf16,NVIDIA GeForce RTX 4060,c00,32,32,32,2,2,8,0.0,0.0,130.41600584983826,233.86111691594115,1.0291507328827343,0,3,3,0_3_3,0,
2026-03-02T09:26:16.599809+00:00,B,llm_style,eval,llm_style_eval_020,64,4096,2048,bf16,NVIDIA GeForce RTX 4060,c06,64,128,32,4,3,8,0.0,0.0,254.38399612903595,319.69280391931534,4.220948803144621,1,3,3,1_3_3,0,
2026-03-02T09:26:16.769891+00:00,B,llm_style,eval,llm_style_eval_021,1,4096,8192,bf16,NVIDIA GeForce RTX 4060,c00,32,32,32,2,2,8,0.0,0.0,486.36800050735474,546.3654536008834,0.1379796037773772,0,3,3,0_3_3,0,
2026-03-02T09:26:16.801340+00:00,B,llm_style,eval,llm_style_eval_022,32,1024,4096,bf16,NVIDIA GeForce RTX 4060,c00,32,32,32,2,2,8,0.0,0.0,176.09599977731705,195.1110419631004,1.5243699819385517,0,3,3,0_3_3,0,
2026-03-02T09:26:16.811208+00:00,B,llm_style,eval,llm_style_eval_023,4,1024,1024,bf16,NVIDIA GeForce RTX 4060,c00,32,32,32,2,2,8,0.0,0.0,61.43999844789505,172.52288237214088,0.13653333678245552,0,3,3,0_3_3,0,
2026-03-02T09:26:16.836804+00:00,B,llm_style,eval,llm_style_eval_024,64,2048,2048,bf16,NVIDIA GeForce RTX 4060,c06,64,128,32,4,3,8,0.0,0.0,160.14399379491806,213.31968501210207,3.35242614648116,1,3,3,1_3_3,0,
2026-03-02T09:26:17.189337+00:00,B,llm_style,eval,llm_style_eval_025,32,8192,8192,bf16,NVIDIA GeForce RTX 4060,c00,32,32,32,2,2,8,0.0,0.0,1067.0080184936523,1184.7967982292175,4.025243692229621,0,3,3,0_3_3,0,
2026-03-02T09:26:17.244277+00:00,B,llm_style,eval,llm_style_eval_026,4,2048,4096,bf16,NVIDIA GeForce RTX 4060,c00,32,32,32,2,2,8,0.0,0.0,196.60800695419312,259.0051124989986,0.34133332126008187,0,3,3,0_3_3,0,
2026-03-02T09:26:17.377350+00:00,B,llm_style,eval,llm_style_eval_027,8,8192,2048,bf16,NVIDIA GeForce RTX 4060,c00,32,32,32,2,2,8,0.0,0.0,286.72000765800476,360.31711399555195,0.9362285464228421,0,3,3,0_3_3,0,
2026-03-02T09:26:17.572994+00:00,B,llm_style,eval,llm_style_eval_028,8,4096,8192,bf16,NVIDIA GeForce RTX 4060,c00,32,32,32,2,2,8,0.0,0.0,495.61598896980286,595.6445062160491,1.0832396935295618,0,3,3,0_3_3,0,
2026-03-02T09:26:17.594138+00:00,B,llm_style,eval,llm_style_eval_029,8,2048,2048,bf16,NVIDIA GeForce RTX 4060,c00,32,32,32,2,2,8,0.0,0.0,104.35199737548828,136.1635172367096,0.6431009054721123,0,3,3,0_3_3,0,
2026-03-02T09:26:17.640193+00:00,B,llm_style,eval,llm_style_eval_030,1,4096,2048,bf16,NVIDIA GeForce RTX 4060,c00,32,32,32,2,2,8,0.0,0.0,143.21599900722504,251.4147180318831,0.11714624145556263,0,3,3,0_3_3,0,
2026-03-02T09:26:17.729506+00:00,B,llm_style,eval,llm_style_eval_031,16,8192,2048,bf16,NVIDIA GeForce RTX 4060,c00,32,32,32,2,2,8,0.0,0.0,267.2000080347061,298.04575949907303,2.0092473647316162,0,3,3,0_3_3,0,
2026-03-02T09:26:17.753841+00:00,B,llm_style,eval,llm_style_eval_032,1,2048,2048,bf16,NVIDIA GeForce RTX 4060,c00,32,32,32,2,2,8,0.0,0.0,101.3759970664978,473.82752910256255,0.08274747714192617,0,3,3,0_3_3,0,
2026-03-02T09:26:17.928561+00:00,B,llm_style,eval,llm_style_eval_033,16,8192,4096,bf16,NVIDIA GeForce RTX 4060,c00,32,32,32,2,2,8,0.0,0.0,490.4960095882416,606.8326407670975,2.189093902927728,0,3,3,0_3_3,0,
2026-03-02T09:26:17.954151+00:00,B,llm_style,eval,llm_style_eval_034,16,1024,4096,bf16,NVIDIA GeForce RTX 4060,c00,32,32,32,2,2,8,0.0,0.0,166.9120043516159,212.52096474170673,0.8041226784219647,0,3,3,0_3_3,0,
2026-03-02T09:26:18.042059+00:00,B,llm_style,eval,llm_style_eval_035,4,8192,2048,bf16,NVIDIA GeForce RTX 4060,c00,32,32,32,2,2,8,0.0,0.0,260.6080025434494,345.9379214048383,0.515017676702475,0,3,3,0_3_3,0,
2026-03-02T09:26:18.089752+00:00,B,llm_style,eval,llm_style_eval_036,2,2048,4096,bf16,NVIDIA GeForce RTX 4060,c00,32,32,32,2,2,8,0.0,0.0,175.9520024061203,215.17536163330075,0.19070218889894738,0,3,3,0_3_3,0,
2026-03-02T09:26:18.100781+00:00,B,llm_style,eval,llm_style_eval_037,2,1024,1024,bf16,NVIDIA GeForce RTX 4060,c00,32,32,32,2,2,8,0.0,0.0,66.56000018119812,158.07712033391,0.0630153844438361,0,3,3,0_3_3,0,
2026-03-02T09:26:18.305799+00:00,B,llm_style,eval,llm_style_eval_038,64,4096,8192,bf16,NVIDIA GeForce RTX 4060,c06,64,128,32,4,3,8,0.0,0.0,1003.5200119018555,1116.1600351333618,4.279901990056227,1,3,3,1_3_3,0,
2026-03-02T09:26:18.321293+00:00,B,llm_style,eval,llm_style_eval_039,4,1024,2048,bf16,NVIDIA GeForce RTX 4060,c00,32,32,32,2,2,8,0.0,0.0,97.28000313043594,172.15487867593762,0.17246315234493367,0,3,3,0_3_3,0,
2026-03-02T09:26:18.379186+00:00,B,llm_style,eval,llm_style_eval_040,64,8192,1024,bf16,NVIDIA GeForce RTX 4060,c06,64,128,32,4,3,8,0.0,0.0,219.13599967956543,348.3199980854988,4.8998878576322165,1,3,3,1_3_3,0,
2026-03-02T09:26:18.395610+00:00,B,llm_style,eval,llm_style_eval_041,2,2048,1024,bf16,NVIDIA GeForce RTX 4060,c00,32,32,32,2,2,8,0.0,0.0,95.23200243711472,175.13407945632935,0.08808601925113688,0,3,3,0_3_3,0,
2026-03-02T09:26:18.443865+00:00,B,llm_style,eval,llm_style_eval_042,2,4096,2048,bf16,NVIDIA GeForce RTX 4060,c00,32,32,32,2,2,8,0.0,0.0,125.39200112223625,204.27520483732224,0.26759627168953176,0,3,3,0_3_3,0,
2026-03-02T09:26:18.456514+00:00,B,llm_style,eval,llm_style_eval_043,1,2048,1024,bf16,NVIDIA GeForce RTX 4060,c00,32,32,32,2,2,8,0.0,0.0,66.56000018119812,76.29824347794056,0.0630153844438361,0,3,3,0_3_3,0,
2026-03-02T09:26:18.562391+00:00,B,llm_style,eval,llm_style_eval_044,8,2048,8192,bf16,NVIDIA GeForce RTX 4060,c00,32,32,32,2,2,8,0.0,0.0,401.871994137764,663.9820879697797,0.6679625848920908,0,3,3,0_3_3,0,
2026-03-02T09:26:18.611925+00:00,B,llm_style,eval,llm_style_eval_045,1,8192,1024,bf16,NVIDIA GeForce RTX 4060,c00,32,32,32,2,2,8,0.0,0.0,132.4479952454567,154.35711607336992,0.1266702147428351,0,3,3,0_3_3,0,
2026-03-02T09:26:18.636218+00:00,B,llm_style,eval,llm_style_eval_046,64,4096,1024,bf16,NVIDIA GeForce RTX 4060,c06,64,128,32,4,3,8,0.0,0.0,152.5759994983673,231.72031611204142,3.518711420964639,1,3,3,1_3_3,0,
2026-03-02T09:26:18.656277+00:00,B,llm_style,eval,llm_style_eval_047,16,2048,2048,bf16,NVIDIA GeForce RTX 4060,c00,32,32,32,2,2,8,0.0,0.0,100.27199983596802,162.52927511930451,1.3385364630162235,0,3,3,0_3_3,0,
2026-03-02T09:26:18.825815+00:00,B,llm_style,eval,llm_style_eval_048,8,8192,4096,bf16,NVIDIA GeForce RTX 4060,c00,32,32,32,2,2,8,0.0,0.0,487.296000123024,610.4316741228104,1.1017346989600987,0,3,3,0_3_3,0,
2026-03-02T09:26:18.998717+00:00,B,llm_style,eval,llm_style_eval_049,4,4096,8192,bf16,NVIDIA GeForce RTX 4060,c00,32,32,32,2,2,8,0.0,0.0,487.3279929161072,517.4812740087509,0.5508311853659734,0,3,3,0_3_3,0,
2026-03-02T09:26:19.099846+00:00,B,llm_style,eval,llm_style_eval_050,4,2048,8192,bf16,NVIDIA GeForce RTX 4060,c00,32,32,32,2,2,8,0.0,0.0,397.2479999065399,599.0809613466263,0.3378688578207499,0,3,3,0_3_3,0,
2026-03-02T09:26:19.110336+00:00,B,llm_style,eval,llm_style_eval_051,16,1024,1024,bf16,NVIDIA GeForce RTX 4060,c00,32,32,32,2,2,8,0.0,0.0,76.80000364780426,133.17056015133858,0.43690664591471445,0,3,3,0_3_3,0,
2026-03-02T09:26:19.290673+00:00,B,llm_style,eval,llm_style_eval_052,32,8192,4096,bf16,NVIDIA GeForce RTX 4060,c00,32,32,32,2,2,8,0.0,0.0,655.8719873428345,779.1132897138594,3.27424206162578,0,3,3,0_3_3,0,
2026-03-02T09:26:19.314501+00:00,B,llm_style,eval,llm_style_eval_053,32,1024,2048,bf16,NVIDIA GeForce RTX 4060,c00,32,32,32,2,2,8,0.0,0.0,138.11200112104416,244.7769609093666,0.9718035138913732,0,3,3,0_3_3,0,
2026-03-02T09:26:19.441909+00:00,B,llm_style,eval,llm_style_eval_054,64,8192,2048,bf16,NVIDIA GeForce RTX 4060,c06,64,128,32,4,3,8,0.0,0.0,543.2320237159729,664.6457761526108,3.9531609961249354,1,3,3,1_3_3,0,
2026-03-02T09:26:19.467974+00:00,B,llm_style,eval,llm_style_eval_055,1,4096,1024,bf16,NVIDIA GeForce RTX 4060,c00,32,32,32,2,2,8,0.0,0.0,108.5279993712902,246.53823375701887,0.07729441294961442,0,3,3,0_3_3,0,
2026-03-02T09:26:19.492153+00:00,B,llm_style,eval,llm_style_eval_056,4,2048,2048,bf16,NVIDIA GeForce RTX 4060,c00,32,32,32,2,2,8,0.0,0.0,131.47199898958206,286.10559999942774,0.25522112889345266,0,3,3,0_3_3,0,
2026-03-02T09:26:19.557039+00:00,B,llm_style,eval,llm_style_eval_057,16,1024,8192,bf16,NVIDIA GeForce RTX 4060,c00,32,32,32,2,2,8,0.0,0.0,400.38399398326874,534.1491329669952,0.6704450228627706,0,3,3,0_3_3,0,
2026-03-02T09:26:19.752305+00:00,B,llm_style,eval,llm_style_eval_058,1,8192,4096,bf16,NVIDIA GeForce RTX 4060,c00,32,32,32,2,2,8,0.0,0.0,601.0880172252655,792.442861199379,0.11164565267793398,0,3,3,0_3_3,0,
2026-03-02T09:26:19.775097+00:00,B,llm_style,eval,llm_style_eval_059,8,4096,1024,bf16,NVIDIA GeForce RTX 4060,c00,32,32,32,2,2,8,0.0,0.0,114.68800157308578,209.3180790543555,0.5851428491169093,0,3,3,0_3_3,0,
2026-03-02T09:26:19.956149+00:00,B,llm_style,eval,llm_style_eval_060,4,8192,4096,bf16,NVIDIA GeForce RTX 4060,c00,32,32,32,2,2,8,0.0,0.0,648.1919884681702,784.5068919658661,0.4141295492318194,0,3,3,0_3_3,0,
2026-03-02T09:26:19.980811+00:00,B,llm_style,eval,llm_style_eval_061,32,2048,2048,bf16,NVIDIA GeForce RTX 4060,c00,32,32,32,2,2,8,0.0,0.0,151.48800611495972,259.04128193855274,1.7719914789576963,0,3,3,0_3_3,0,
2026-03-02T09:26:19.994376+00:00,B,llm_style,eval,llm_style_eval_062,8,2048,1024,bf16,NVIDIA GeForce RTX 4060,c00,32,32,32,2,2,8,0.0,0.0,84.76799726486206,112.7014409005642,0.39583844236826093,0,3,3,0_3_3,0,
2026-03-02T09:26:20.178015+00:00,B,llm_style,eval,llm_style_eval_063,16,4096,8192,bf16,NVIDIA GeForce RTX 4060,c00,32,32,32,2,2,8,0.0,0.0,692.7359998226166,751.452183127403,1.5500014785934966,0,3,3,0_3_3,0,
2026-03-02T09:26:20.390299+00:00,B,training_style,tune,training_style_tune_000,4096,2048,1024,bf16,NVIDIA GeForce RTX 4060,c09,128,64,64,8,3,8,0.0,0.0,2549.1679906845093,4203.571133613586,6.73940252144262,3,3,3,3_3_3,0,
2026-03-02T09:26:20.496635+00:00,B,training_style,tune,training_style_tune_001,1536,2048,1536,bf16,NVIDIA GeForce RTX 4060,c09,128,64,64,8,3,8,0.0,0.0,1400.704026222229,1566.2902522087097,6.899156592034245,3,3,3,3_3_3,0,
2026-03-02T09:26:20.703829+00:00,B,training_style,tune,training_style_tune_002,3072,2048,4096,bf16,NVIDIA GeForce RTX 4060,c09,128,64,64,8,3,8,0.0,0.0,1741.8240308761597,1862.397462129593,29.58944568360038,3,3,3,3_3_3,0,
2026-03-02T09:26:20.764268+00:00,B,training_style,tune,training_style_tune_003,2048,1536,2048,bf16,NVIDIA GeForce RTX 4060,c09,128,64,64,8,3,8,0.0,0.0,412.1600091457367,540.647668838501,31.261892474007578,3,3,3,3_3_3,0,
2026-03-02T09:26:20.782469+00:00,B,training_style,tune,training_style_tune_004,512,512,1024,bf16,NVIDIA GeForce RTX 4060,c11,32,128,32,4,2,8,0.0,0.0,80.97599819302559,680.8172674477082,6.630000543126868,2,2,3,2_2_3,0,
2026-03-02T09:26:20.814972+00:00,B,training_style,tune,training_style_tune_005,1024,1536,1536,bf16,NVIDIA GeForce RTX 4060,c09,128,64,64,8,3,8,0.0,0.0,153.60000729560852,264.2739197611809,31.457278505859446,3,3,3,3_3_3,0,
2026-03-02T09:26:20.828799+00:00,B,training_style,tune,training_style_tune_006,1024,1536,512,bf16,NVIDIA GeForce RTX 4060,c06,64,128,32,4,3,8,0.0,0.0,103.21599990129471,194.0582424402237,15.604293302784708,3,3,2,3_3_2,0,
2026-03-02T09:26:20.844899+00:00,B,training_style,tune,training_style_tune_007,2048,1536,512,bf16,NVIDIA GeForce RTX 4060,c06,64,128,32,4,3,8,0.0,0.0,134.0319961309433,215.60064166784284,24.033257468261578,3,3,2,3_3_2,0,
2026-03-02T09:26:20.930200+00:00,B,training_style,tune,training_style_tune_008,3072,3072,1536,bf16,NVIDIA GeForce RTX 4060,c09,128,64,64,8,3,8,0.0,0.0,898.5599875450134,959.8771244287491,32.26387737028819,3,3,3,3_3_3,0,
2026-03-02T09:26:20.951381+00:00,B,training_style,tune,training_style_tune_009,1024,1536,1024,bf16,NVIDIA GeForce RTX 4060,c09,128,64,64,8,3,8,0.0,0.0,135.16800105571747,185.3763180971145,23.831272541140724,3,3,3,3_3_3,0,
2026-03-02T09:26:21.050403+00:00,B,training_style,tune,training_style_tune_010,1536,2048,4096,bf16,NVIDIA GeForce RTX 4060,c09,128,64,64,8,3,8,0.0,0.0,789.3920242786407,812.9216051101685,32.64512812825651,3,3,3,3_3_3,0,
2026-03-02T09:26:21.110995+00:00,B,training_style,tune,training_style_tune_011,1024,1024,4096,bf16,NVIDIA GeForce RTX 4060,c09,128,64,64,8,3,8,0.0,0.0,320.3999996185303,392.24385380744934,26.810033090596804,3,3,3,3_3_3,0,
2026-03-02T09:26:21.429473+00:00,B,training_style,tune,training_style_tune_012,3072,4096,4096,bf16,NVIDIA GeForce RTX 4060,c09,128,64,64,8,3,8,0.0,0.0,3169.792056083679,3327.927062511444,32.51923573540523,3,3,3,3_3_3,0,
2026-03-02T09:26:21.464615+00:00,B,training_style,tune,training_style_tune_013,512,1024,3072,bf16,NVIDIA GeForce RTX 4060,c06,64,128,32,4,3,8,0.0,0.0,119.12000179290771,258.8569544255733,27.041852111454457,2,3,3,2_3_3,0,
2026-03-02T09:26:21.482730+00:00,B,training_style,tune,training_style_tune_014,1536,1024,1024,bf16,NVIDIA GeForce RTX 4060,c09,128,64,64,8,3,8,0.0,0.0,127.96800583600998,252.04991117119775,25.1721158812772,3,3,3,3_3_3,0,
2026-03-02T09:26:21.545938+00:00,B,training_style,tune,training_style_tune_015,2048,3072,1536,bf16,NVIDIA GeForce RTX 4060,c09,128,64,64,8,3,8,0.0,0.0,609.7280085086823,647.5366503000259,31.698318860687184,3,3,3,3_3_3,0,
2026-03-02T09:26:21.671206+00:00,B,training_style,tune,training_style_tune_016,1536,3072,3072,bf16,NVIDIA GeForce RTX 4060,c09,128,64,64,8,3,8,0.0,0.0,891.9039964675903,1031.690227985382,32.504652252730956,3,3,3,3_3_3,0,
2026-03-02T09:26:21.699115+00:00,B,training_style,tune,training_style_tune_017,1024,1024,2048,bf16,NVIDIA GeForce RTX 4060,c09,128,64,64,8,3,8,0.0,0.0,168.86400431394577,312.18686997890467,25.43447499927192,3,3,3,3_3_3,0,
2026-03-02T09:26:21.734706+00:00,B,training_style,tune,training_style_tune_018,1536,1536,1536,bf16,NVIDIA GeForce RTX 4060,c09,128,64,64,8,3,8,0.0,0.0,253.27999889850616,361.9759953022003,28.61559279658836,3,3,3,3_3_3,0,
2026-03-02T09:26:21.777768+00:00,B,training_style,tune,training_style_tune_019,1536,1536,2048,bf16,NVIDIA GeForce RTX 4060,c09,128,64,64,8,3,8,0.0,0.0,316.46399199962616,441.9071966409683,30.536416970975374,3,3,3,3_3_3,0,
2026-03-02T09:26:21.799792+00:00,B,training_style,tune,training_style_tune_020,1536,1536,1024,bf16,NVIDIA GeForce RTX 4060,c09,128,64,64,8,3,8,0.0,0.0,175.07200688123703,260.6252738833427,27.599147882492467,3,3,3,3_3_3,0,
2026-03-02T09:26:21.829239+00:00,B,training_style,tune,training_style_tune_021,1024,2048,1536,bf16,NVIDIA GeForce RTX 4060,c09,128,64,64,8,3,8,0.0,0.0,236.28799617290497,294.80703443288803,27.265248545616778,3,3,3,3_3_3,0,
2026-03-02T09:26:21.843488+00:00,B,training_style,tune,training_style_tune_022,512,1024,1536,bf16,NVIDIA GeForce RTX 4060,c06,64,128,32,4,3,8,0.0,0.0,92.16000139713287,159.56991806626314,17.476266401728882,2,3,3,2_3_3,0,
2026-03-02T09:26:21.890383+00:00,B,training_style,tune,training_style_tune_023,1536,2048,2048,bf16,NVIDIA GeForce RTX 4060,c09,128,64,64,8,3,8,0.0,0.0,422.35200107097626,463.7180811166763,30.507495774442162,3,3,3,3_3_3,0,
2026-03-02T09:26:21.905204+00:00,B,training_style,tune,training_style_tune_024,1024,1024,1024,bf16,NVIDIA GeForce RTX 4060,c09,128,64,64,8,3,8,0.0,0.0,102.39999741315842,137.54847660660732,20.971520529785167,3,3,3,3_3_3,0,
2026-03-02T09:26:21.960908+00:00,B,training_style,tune,training_style_tune_025,1536,1024,4096,bf16,NVIDIA GeForce RTX 4060,c09,128,64,64,8,3,8,0.0,0.0,409.61599349975586,422.4137681722641,31.456051747177884,3,3,3,3_3_3,0,
2026-03-02T09:26:21.990845+00:00,B,training_style,tune,training_style_tune_026,2048,4096,512,bf16,NVIDIA GeForce RTX 4060,c06,64,128,32,4,3,8,0.0,0.0,293.96800696849823,351.73727184534073,29.22064438434112,3,3,2,3_3_2,0,
2026-03-02T09:26:22.130008+00:00,B,training_style,tune,training_style_tune_027,4096,4096,1536,bf16,NVIDIA GeForce RTX 4060,c09,128,64,64,8,3,8,0.0,0.0,1603.4560203552246,1749.7465515136719,32.14282580733463,3,3,3,3_3_3,0,
2026-03-02T09:26:22.217446+00:00,B,training_style,tune,training_style_tune_028,1536,1536,4096,bf16,NVIDIA GeForce RTX 4060,c09,128,64,64,8,3,8,0.0,0.0,605.103999376297,630.2079838514328,31.940547165316076,3,3,3,3_3_3,0,
2026-03-02T09:26:22.333323+00:00,B,training_style,tune,training_style_tune_029,4096,2048,2048,bf16,NVIDIA GeForce RTX 4060,c09,128,64,64,8,3,8,0.0,0.0,1059.2479705810547,1107.8963482379913,32.43786093746475,3,3,3,3_3_3,0,
2026-03-02T09:26:22.359173+00:00,B,training_style,tune,training_style_tune_030,2048,2048,512,bf16,NVIDIA GeForce RTX 4060,c06,64,128,32,4,3,8,0.0,0.0,166.55999422073364,211.96927875280363,25.78630790721627,3,3,2,3_3_2,0,
2026-03-02T09:26:22.372649+00:00,B,training_style,tune,training_style_tune_031,512,512,1536,bf16,NVIDIA GeForce RTX 4060,c11,32,128,32,4,2,8,0.0,0.0,63.48799914121628,134.170237481594,12.684387268352213,2,2,3,2_2_3,0,
2026-03-02T09:26:22.449082+00:00,B,training_style,eval,training_style_eval_000,2048,1536,3072,bf16,NVIDIA GeForce RTX 4060,c09,128,64,64,8,3,8,0.0,0.0,605.0240099430084,701.2147182226179,31.944769983294684,3,3,3,3_3_3,0,
2026-03-02T09:26:22.487523+00:00,B,training_style,eval,training_style_eval_001,1024,2048,2048,bf16,NVIDIA GeForce RTX 4060,c09,128,64,64,8,3,8,0.0,0.0,292.86399483680725,352.52447932958586,29.330797719899206,3,3,3,3_3_3,0,
2026-03-02T09:26:22.535419+00:00,B,training_style,eval,training_style_eval_002,1536,1024,3072,bf16,NVIDIA GeForce RTX 4060,c09,128,64,64,8,3,8,0.0,0.0,313.31199407577515,374.01631206274016,30.843621050979685,3,3,3,3_3_3,0,
2026-03-02T09:26:22.551053+00:00,B,training_style,eval,training_style_eval_003,1024,512,1024,bf16,NVIDIA GeForce RTX 4060,c06,64,128,32,4,3,8,0.0,0.0,44.03200000524521,134.61503691971294,24.38548836918816,3,2,3,3_2_3,0,
2026-03-02T09:26:22.574884+00:00,B,training_style,eval,training_style_eval_004,1024,2048,1024,bf16,NVIDIA GeForce RTX 4060,c09,128,64,64,8,3,8,0.0,0.0,170.3840047121048,182.64736115932465,25.207573347375767,3,3,3,3_3_3,0,
2026-03-02T09:26:22.590074+00:00,B,training_style,eval,training_style_eval_005,1024,512,1536,bf16,NVIDIA GeForce RTX 4060,c06,64,128,32,4,3,8,0.0,0.0,89.10400047898293,175.9369622170925,18.075650109333726,3,2,3,3_2_3,0,
2026-03-02T09:26:22.637878+00:00,B,training_style,eval,training_style_eval_006,2048,1536,2048,bf16,NVIDIA GeForce RTX 4060,c09,128,64,64,8,3,8,0.0,0.0,411.96800768375397,456.3967975974082,31.276462365230692,3,3,3,3_3_3,0,
2026-03-02T09:26:22.667921+00:00,B,training_style,eval,training_style_eval_007,1536,2048,1024,bf16,NVIDIA GeForce RTX 4060,c09,128,64,64,8,3,8,0.0,0.0,230.3999960422516,302.03520506620407,27.96202714699075,3,3,3,3_3_3,0,
2026-03-02T09:26:22.683170+00:00,B,training_style,eval,training_style_eval_008,512,512,2048,bf16,NVIDIA GeForce RTX 4060,c11,32,128,32,4,2,8,0.0,0.0,67.58400052785873,93.27776037156576,15.88751502742715,2,2,3,2_2_3,0,
2026-03-02T09:26:22.700785+00:00,B,training_style,eval,training_style_eval_009,1024,512,2048,bf16,NVIDIA GeForce RTX 4060,c06,64,128,32,4,3,8,0.0,0.0,103.42399775981903,138.34240213036537,20.763881637867925,3,2,3,3_2_3,0,
2026-03-02T09:26:22.743533+00:00,B,training_style,eval,training_style_eval_010,2048,3072,1024,bf16,NVIDIA GeForce RTX 4060,c09,128,64,64,8,3,8,0.0,0.0,420.9279865026474,477.3055920004843,30.61070373356836,3,3,3,3_3_3,0,
2026-03-02T09:26:22.820536+00:00,B,training_style,eval,training_style_eval_011,2048,4096,1536,bf16,NVIDIA GeForce RTX 4060,c09,128,64,64,8,3,8,0.0,0.0,803.8399815559387,839.1215991973877,32.05837525787052,3,3,3,3_3_3,0,
2026-03-02T09:26:22.950767+00:00,B,training_style,eval,training_style_eval_012,2048,3072,3072,bf16,NVIDIA GeForce RTX 4060,c09,128,64,64,8,3,8,0.0,0.0,1168.3679819107056,1222.0431959629059,33.08435891985462,3,3,3,3_3_3,0,
2026-03-02T09:26:23.019071+00:00,B,training_style,eval,training_style_eval_013,3072,1536,1536,bf16,NVIDIA GeForce RTX 4060,c09,128,64,64,8,3,8,0.0,0.0,465.92000126838684,663.4496003389354,31.11159551969965,3,3,3,3_3_3,0,
2026-03-02T09:26:23.060036+00:00,B,training_style,eval,training_style_eval_014,2048,1536,1536,bf16,NVIDIA GeForce RTX 4060,c09,128,64,64,8,3,8,0.0,0.0,318.4640109539032,421.57056480646133,30.34464204308094,3,3,3,3_3_3,0,
2026-03-02T09:26:23.114363+00:00,B,training_style,eval,training_style_eval_015,4096,2048,1024,bf16,NVIDIA GeForce RTX 4060,c09,128,64,64,8,3,8,0.0,0.0,551.4079928398132,674.1855776309967,31.15636589800184,3,3,3,3_3_3,0,
2026-03-02T09:26:23.128927+00:00,B,training_style,eval,training_style_eval_016,2048,1024,512,bf16,NVIDIA GeForce RTX 4060,c06,64,128,32,4,3,8,0.0,0.0,123.79200011491776,168.9049595594405,17.34751555840816,3,3,2,3_3_2,0,
2026-03-02T09:26:23.249136+00:00,B,training_style,eval,training_style_eval_017,2048,4096,2048,bf16,NVIDIA GeForce RTX 4060,c09,128,64,64,8,3,8,0.0,0.0,1071.1039900779724,1212.5840198993683,32.07880718052291,3,3,3,3_3_3,0,
2026-03-02T09:26:23.320716+00:00,B,training_style,eval,training_style_eval_018,1536,2048,3072,bf16,NVIDIA GeForce RTX 4060,c09,128,64,64,8,3,8,0.0,0.0,603.6480069160461,629.7154968976974,32.01758741943134,3,3,3,3_3_3,0,
2026-03-02T09:26:23.386963+00:00,B,training_style,eval,training_style_eval_019,1536,1536,3072,bf16,NVIDIA GeForce RTX 4060,c09,128,64,64,8,3,8,0.0,0.0,464.89599347114563,496.1184132099151,31.18012378590155,3,3,3,3_3_3,0,
2026-03-02T09:26:23.461613+00:00,B,training_style,eval,training_style_eval_020,3072,1536,2048,bf16,NVIDIA GeForce RTX 4060,c09,128,64,64,8,3,8,0.0,0.0,606.2079966068268,726.5007996559143,31.88237855683599,3,3,3,3_3_3,0,
2026-03-02T09:26:23.545011+00:00,B,training_style,eval,training_style_eval_021,2048,1024,4096,bf16,NVIDIA GeForce RTX 4060,c09,128,64,64,8,3,8,0.0,0.0,555.0239980220795,655.5136090517043,30.953380836186053,3,3,3,3_3_3,0,
2026-03-02T09:26:23.556281+00:00,B,training_style,eval,training_style_eval_022,512,512,1536,bf16,NVIDIA GeForce RTX 4060,c11,32,128,32,4,2,8,0.0,0.0,62.03199923038483,122.28895954787731,12.982112103289117,2,2,3,2_2_3,0,
2026-03-02T09:26:23.886457+00:00,B,training_style,eval,training_style_eval_023,3072,4096,4096,bf16,NVIDIA GeForce RTX 4060,c09,128,64,64,8,3,8,0.0,0.0,3181.567907333374,3339.776027202606,32.39887316766269,3,3,3,3_3_3,0,
2026-03-02T09:26:23.961096+00:00,B,training_style,eval,training_style_eval_024,1536,1024,4096,bf16,NVIDIA GeForce RTX 4060,c09,128,64,64,8,3,8,0.0,0.0,404.27200496196747,561.1295992136,31.871862829611878,3,3,3,3_3_3,0,
2026-03-02T09:26:24.114119+00:00,B,training_style,eval,training_style_eval_025,4096,3072,2048,bf16,NVIDIA GeForce RTX 4060,c09,128,64,64,8,3,8,0.0,0.0,1560.9280467033386,1674.8659324645996,33.01856716640529,3,3,3,3_3_3,0,
2026-03-02T09:26:24.130889+00:00,B,training_style,eval,training_style_eval_026,1024,512,512,bf16,NVIDIA GeForce RTX 4060,c11,32,128,32,4,2,8,0.0,0.0,53.05599980056286,128.56352202594277,10.1189481683145,3,2,2,3_2_2,0,
2026-03-02T09:26:24.196349+00:00,B,training_style,eval,training_style_eval_027,2048,4096,1024,bf16,NVIDIA GeForce RTX 4060,c09,128,64,64,8,3,8,0.0,0.0,555.0079941749573,696.2931162118912,30.954273387608765,3,3,3,3_3_3,0,
2026-03-02T09:26:24.219340+00:00,B,training_style,eval,training_style_eval_028,1536,1536,1024,bf16,NVIDIA GeForce RTX 4060,c09,128,64,64,8,3,8,0.0,0.0,175.1680001616478,272.59839504957193,27.584023357811375,3,3,3,3_3_3,0,
2026-03-02T09:26:24.252450+00:00,B,training_style,eval,training_style_eval_029,1024,512,4096,bf16,NVIDIA GeForce RTX 4060,c06,64,128,32,4,3,8,0.0,0.0,167.36000031232834,235.4995173215864,25.663045458799616,3,2,3,3_2_3,0,
2026-03-02T09:26:24.288377+00:00,B,training_style,eval,training_style_eval_030,1024,1024,3072,bf16,NVIDIA GeForce RTX 4060,c09,128,64,64,8,3,8,0.0,0.0,247.80799448490143,334.6979135274886,25.997752644709486,3,3,3,3_3_3,0,
2026-03-02T09:26:24.298217+00:00,B,training_style,eval,training_style_eval_031,1024,1024,512,bf16,NVIDIA GeForce RTX 4060,c06,64,128,32,4,3,8,0.0,0.0,66.97599962353706,117.35040232539164,16.031740176113175,3,3,2,3_3_2,0,
2026-03-02T09:26:24.309498+00:00,B,training_style,eval,training_style_eval_032,512,1024,1024,bf16,NVIDIA GeForce RTX 4060,c06,64,128,32,4,3,8,0.0,0.0,69.63200122117996,150.72191849350924,15.420235023683334,2,3,3,2_3_3,0,
2026-03-02T09:26:24.391006+00:00,B,training_style,eval,training_style_eval_033,3072,2048,2048,bf16,NVIDIA GeForce RTX 4060,c09,128,64,64,8,3,8,0.0,0.0,798.1759905815125,928.0348777770996,32.285866876583654,3,3,3,3_3_3,0,
2026-03-02T09:26:24.404759+00:00,B,training_style,eval,training_style_eval_034,1536,1024,512,bf16,NVIDIA GeForce RTX 4060,c06,64,128,32,4,3,8,0.0,0.0,100.832000374794,159.28319796919823,15.973230026314358,3,3,2,3_3_2,0,
2026-03-02T09:26:24.804014+00:00,B,training_style,eval,training_style_eval_035,4096,4096,4096,bf16,NVIDIA GeForce RTX 4060,c09,128,64,64,8,3,8,0.0,0.0,4275.200128555298,4450.937371253967,32.14795783570586,3,3,3,3_3_3,0,
2026-03-02T09:26:25.036522+00:00,B,training_style,eval,training_style_eval_036,2048,4096,4096,bf16,NVIDIA GeForce RTX 4060,c09,128,64,64,8,3,8,0.0,0.0,2156.543970108032,2398.8854980468745,31.865557896580935,3,3,3,3_3_3,0,
2026-03-02T09:26:25.080764+00:00,B,training_style,eval,training_style_eval_037,4096,2048,512,bf16,NVIDIA GeForce RTX 4060,c06,64,128,32,4,3,8,0.0,0.0,312.25599348545074,546.3014447689053,27.5092705062849,3,3,2,3_3_2,0,
2026-03-02T09:26:25.100034+00:00,B,training_style,eval,training_style_eval_038,2048,1536,512,bf16,NVIDIA GeForce RTX 4060,c06,64,128,32,4,3,8,0.0,0.0,135.1199969649315,217.1577586233616,23.839739079005636,3,3,2,3_3_2,0,
2026-03-02T09:26:25.186522+00:00,B,training_style,eval,training_style_eval_039,3072,3072,1536,bf16,NVIDIA GeForce RTX 4060,c09,128,64,64,8,3,8,0.0,0.0,893.9520120620728,998.4438413381575,32.430185129430605,3,3,3,3_3_3,0,
2026-03-02T09:26:25.201594+00:00,B,training_style,eval,training_style_eval_040,1536,1536,512,bf16,NVIDIA GeForce RTX 4060,c06,64,128,32,4,3,8,0.0,0.0,95.5520011484623,218.65471571683884,25.28381483341523,3,3,2,3_3_2,0,
2026-03-02T09:26:25.312971+00:00,B,training_style,eval,training_style_eval_041,3072,3072,2048,bf16,NVIDIA GeForce RTX 4060,c09,128,64,64,8,3,8,0.0,0.0,1202.1439671516418,1346.0557067394257,32.15480568071094,3,3,3,3_3_3,0,
2026-03-02T09:26:25.427067+00:00,B,training_style,eval,training_style_eval_042,3072,4096,1536,bf16,NVIDIA GeForce RTX 4060,c09,128,64,64,8,3,8,0.0,0.0,1198.6079812049866,1288.9190185070038,32.24966483632087,3,3,3,3_3_3,0,
2026-03-02T09:26:25.501148+00:00,B,training_style,eval,training_style_eval_043,2048,3072,1536,bf16,NVIDIA GeForce RTX 4060,c09,128,64,64,8,3,8,0.0,0.0,614.4000291824341,742.9631948471069,31.457278505859446,3,3,3,3_3_3,0,
2026-03-02T09:26:25.524542+00:00,B,training_style,eval,training_style_eval_044,512,512,4096,bf16,NVIDIA GeForce RTX 4060,c11,32,128,32,4,2,8,0.0,0.0,116.54400080442429,232.44799673557281,18.426376588905267,2,2,3,2_2_3,0,
2026-03-02T09:26:25.582695+00:00,B,training_style,eval,training_style_eval_045,2048,1024,3072,bf16,NVIDIA GeForce RTX 4060,c09,128,64,64,8,3,8,0.0,0.0,422.8000044822693,498.67584466934204,30.47516970530294,3,3,3,3_3_3,0,
2026-03-02T09:26:25.914420+00:00,B,training_style,eval,training_style_eval_046,4096,3072,4096,bf16,NVIDIA GeForce RTX 4060,c09,128,64,64,8,3,8,0.0,0.0,3200.33597946167,3294.7468852996826,32.208872995059416,3,3,3,3_3_3,0,
2026-03-02T09:26:25.970580+00:00,B,training_style,eval,training_style_eval_047,1536,3072,1024,bf16,NVIDIA GeForce RTX 4060,c09,128,64,64,8,3,8,0.0,0.0,327.61600613594055,455.95103412866587,29.49696057276935,3,3,3,3_3_3,0,
2026-03-02T09:26:25.992467+00:00,B,training_style,eval,training_style_eval_048,512,512,3072,bf16,NVIDIA GeForce RTX 4060,c11,32,128,32,4,2,8,0.0,0.0,87.3280018568039,177.2953604161739,18.443256478500476,2,2,3,2_2_3,0,
2026-03-02T09:26:26.024561+00:00,B,training_style,eval,training_style_eval_049,512,1024,4096,bf16,NVIDIA GeForce RTX 4060,c06,64,128,32,4,3,8,0.0,0.0,168.39999705553055,225.5251100659369,25.504556835495183,2,3,3,2_3_3,0,
2026-03-02T09:26:26.047619+00:00,B,training_style,eval,training_style_eval_050,3072,2048,512,bf16,NVIDIA GeForce RTX 4060,c06,64,128,32,4,3,8,0.0,0.0,223.23200106620789,313.12895774841303,28.859889770415343,3,3,2,3_3_2,0,
2026-03-02T09:26:26.058117+00:00,B,training_style,eval,training_style_eval_051,512,512,1024,bf16,NVIDIA GeForce RTX 4060,c11,32,128,32,4,2,8,0.0,0.0,78.73599976301193,153.4495984017849,6.81862062609139,2,2,3,2_2_3,0,
2026-03-02T09:26:26.095658+00:00,B,training_style,eval,training_style_eval_052,1536,2048,1536,bf16,NVIDIA GeForce RTX 4060,c09,128,64,64,8,3,8,0.0,0.0,329.6319991350174,384.08192336559296,29.31656041087733,3,3,3,3_3_3,0,
2026-03-02T09:26:26.199286+00:00,B,training_style,eval,training_style_eval_053,1536,3072,3072,bf16,NVIDIA GeForce RTX 4060,c09,128,64,64,8,3,8,0.0,0.0,889.2319798469543,999.4748812913894,32.60232414604527,3,3,3,3_3_3,0,
2026-03-02T09:26:26.245183+00:00,B,training_style,eval,training_style_eval_054,4096,3072,512,bf16,NVIDIA GeForce RTX 4060,c06,64,128,32,4,3,8,0.0,0.0,403.4080058336258,547.3997050523758,31.94012439434336,3,3,2,3_3_2,0,
2026-03-02T09:26:26.263503+00:00,B,training_style,eval,training_style_eval_055,1024,1024,1024,bf16,NVIDIA GeForce RTX 4060,c09,128,64,64,8,3,8,0.0,0.0,104.44799810647964,225.0719965994357,20.560314098224698,3,3,3,3_3_3,0,
2026-03-02T09:26:26.291596+00:00,B,training_style,eval,training_style_eval_056,512,1024,3072,bf16,NVIDIA GeForce RTX 4060,c06,64,128,32,4,3,8,0.0,0.0,122.20799922943115,183.69696483016003,26.358548477277072,2,3,3,2_3_3,0,
2026-03-02T09:26:26.310932+00:00,B,training_style,eval,training_style_eval_057,1024,1536,1024,bf16,NVIDIA GeForce RTX 4060,c09,128,64,64,8,3,8,0.0,0.0,131.071999669075,195.44351816177357,24.576000062048433,3,3,3,3_3_3,0,
2026-03-02T09:26:26.426745+00:00,B,training_style,eval,training_style_eval_058,4096,2048,2048,bf16,NVIDIA GeForce RTX 4060,c09,128,64,64,8,3,8,0.0,0.0,1053.4719824790955,1193.9056420326233,32.61571160833583,3,3,3,3_3_3,0,
2026-03-02T09:26:26.458089+00:00,B,training_style,eval,training_style_eval_059,2048,3072,512,bf16,NVIDIA GeForce RTX 4060,c06,64,128,32,4,3,8,0.0,0.0,222.6720005273819,241.16224348545074,28.9324698603396,3,3,2,3_3_2,0,
2026-03-02T09:26:26.489180+00:00,B,training_style,eval,training_style_eval_060,3072,3072,512,bf16,NVIDIA GeForce RTX 4060,c06,64,128,32,4,3,8,0.0,0.0,321.53600454330444,342.50943273305893,30.054725689976337,3,3,2,3_3_2,0,
2026-03-02T09:26:26.550860+00:00,B,training_style,eval,training_style_eval_061,2048,2048,2048,bf16,NVIDIA GeForce RTX 4060,c09,128,64,64,8,3,8,0.0,0.0,552.9919862747192,581.6320180892944,31.067121423827047,3,3,3,3_3_3,0,
2026-03-02T09:26:26.565169+00:00,B,training_style,eval,training_style_eval_062,1024,2048,512,bf16,NVIDIA GeForce RTX 4060,c06,64,128,32,4,3,8,0.0,0.0,96.25600278377533,235.59167370200146,22.310127014353586,3,3,2,3_3_2,0,
2026-03-02T09:26:26.676983+00:00,B,training_style,eval,training_style_eval_063,3072,1536,3072,bf16,NVIDIA GeForce RTX 4060,c09,128,64,64,8,3,8,0.0,0.0,896.9759941101074,1100.4927694797516,32.32085299759007,3,3,3,3_3_3,0,
2026-03-02T09:26:26.697714+00:00,B,adversarial,tune,adversarial_tune_000,1,1024,1024,bf16,NVIDIA GeForce RTX 4060,c00,32,32,32,2,2,8,0.0,0.0,46.01600021123886,290.16480386257103,0.04557440869204003,0,3,3,0_3_3,0,
2026-03-02T09:26:26.718944+00:00,B,adversarial,tune,adversarial_tune_001,1,1024,4096,bf16,NVIDIA GeForce RTX 4060,c00,32,32,32,2,2,8,0.0,0.0,64.51199948787689,161.7503985762595,0.13003174706399215,0,3,3,0_3_3,0,
2026-03-02T09:26:26.738670+00:00,B,adversarial,tune,adversarial_tune_002,1,4096,1024,bf16,NVIDIA GeForce RTX 4060,c00,32,32,32,2,2,8,0.0,0.0,44.03200000524521,373.6595326662058,0.1905116278842825,0,3,3,0_3_3,0,
2026-03-02T09:26:26.822462+00:00,B,adversarial,tune,adversarial_tune_003,1,4096,4096,bf16,NVIDIA GeForce RTX 4060,c00,32,32,32,2,2,8,0.0,0.0,166.62399470806122,233.32224786281577,0.20137815120079247,0,3,3,0_3_3,0,
2026-03-02T09:26:26.864919+00:00,B,adversarial,tune,adversarial_tune_004,1,8192,1024,bf16,NVIDIA GeForce RTX 4060,c00,32,32,32,2,2,8,0.0,0.0,51.16799846291542,165.4374362528323,0.3278849379296998,0,3,3,0_3_3,0,
2026-03-02T09:26:27.029899+00:00,B,adversarial,tune,adversarial_tune_005,1,8192,4096,bf16,NVIDIA GeForce RTX 4060,c00,32,32,32,2,2,8,0.0,0.0,297.7439910173416,317.04063951969147,0.22539116161740225,0,3,3,0_3_3,0,
2026-03-02T09:26:27.040326+00:00,B,adversarial,tune,adversarial_tune_006,2,1024,1024,bf16,NVIDIA GeForce RTX 4060,c00,32,32,32,2,2,8,0.0,0.0,60.496000573039055,116.87935851514337,0.06933192211501753,0,3,3,0_3_3,0,
2026-03-02T09:26:27.059946+00:00,B,adversarial,tune,adversarial_tune_007,2,1024,4096,bf16,NVIDIA GeForce RTX 4060,c00,32,32,32,2,2,8,0.0,0.0,62.463998794555664,207.592002749443,0.2685901691177398,0,3,3,0_3_3,0,
2026-03-02T09:26:27.077138+00:00,B,adversarial,tune,adversarial_tune_008,2,4096,1024,bf16,NVIDIA GeForce RTX 4060,c00,32,32,32,2,2,8,0.0,0.0,42.447999119758606,77.32224002480507,0.3952416214640981,0,3,3,0_3_3,0,
2026-03-02T09:26:27.161716+00:00,B,adversarial,tune,adversarial_tune_009,2,4096,4096,bf16,NVIDIA GeForce RTX 4060,c00,32,32,32,2,2,8,0.0,0.0,164.17599469423294,259.807361960411,0.40876173234086915,0,3,3,0_3_3,0,
2026-03-02T09:26:27.202129+00:00,B,adversarial,tune,adversarial_tune_010,2,8192,1024,bf16,NVIDIA GeForce RTX 4060,c00,32,32,32,2,2,8,0.0,0.0,27.648000046610832,76.20608147233716,1.2136296275836123,0,3,3,0_3_3,0,
2026-03-02T09:26:27.362970+00:00,B,adversarial,tune,adversarial_tune_011,2,8192,4096,bf16,NVIDIA GeForce RTX 4060,c00,32,32,32,2,2,8,0.0,0.0,296.9599962234497,345.69216907024384,0.4519724195410041,0,3,3,0_3_3,0,
2026-03-02T09:26:27.373613+00:00,B,adversarial,tune,adversarial_tune_012,4,1024,1024,bf16,NVIDIA GeForce RTX 4060,c00,32,32,32,2,2,8,0.0,0.0,64.62400034070015,198.99264261126498,0.12980638703538847,0,3,3,0_3_3,0,
2026-03-02T09:26:27.393304+00:00,B,adversarial,tune,adversarial_tune_013,4,1024,4096,bf16,NVIDIA GeForce RTX 4060,c00,32,32,32,2,2,8,0.0,0.0,61.15199998021126,246.46751984953872,0.5487053900258076,0,3,3,0_3_3,0,
2026-03-02T09:26:27.411449+00:00,B,adversarial,tune,adversarial_tune_014,4,4096,1024,bf16,NVIDIA GeForce RTX 4060,c00,32,32,32,2,2,8,0.0,0.0,44.75199989974499,95.77472262084484,0.7497862011791613,0,3,3,0_3_3,0,
2026-03-02T09:26:27.522498+00:00,B,adversarial,tune,adversarial_tune_015,4,4096,4096,bf16,NVIDIA GeForce RTX 4060,c00,32,32,32,2,2,8,0.0,0.0,165.29600322246552,247.3769587278365,0.8119841096179534,0,3,3,0_3_3,0,
2026-03-02T09:26:27.562949+00:00,B,adversarial,tune,adversarial_tune_016,4,8192,1024,bf16,NVIDIA GeForce RTX 4060,c00,32,32,32,2,2,8,0.0,0.0,43.96799951791763,128.38784113526344,1.526311516007275,0,3,3,0_3_3,0,
2026-03-02T09:26:27.734586+00:00,B,adversarial,tune,adversarial_tune_017,4,8192,4096,bf16,NVIDIA GeForce RTX 4060,c00,32,32,32,2,2,8,0.0,0.0,299.45600032806396,442.81759977340676,0.8964103431085706,0,3,3,0_3_3,0,
2026-03-02T09:26:27.745142+00:00,B,adversarial,tune,adversarial_tune_018,8,1024,1024,bf16,NVIDIA GeForce RTX 4060,c00,32,32,32,2,2,8,0.0,0.0,64.57599997520447,187.04608336091036,0.25980574836536824,0,3,3,0_3_3,0,
2026-03-02T09:26:27.767137+00:00,B,adversarial,tune,adversarial_tune_019,8,1024,4096,bf16,NVIDIA GeForce RTX 4060,c00,32,32,32,2,2,8,0.0,0.0,72.25600257515907,237.29664549231495,0.9287652459073538,0,3,3,0_3_3,0,
2026-03-02T09:26:27.786061+00:00,B,adversarial,tune,adversarial_tune_020,8,4096,1024,bf16,NVIDIA GeForce RTX 4060,c00,32,32,32,2,2,8,0.0,0.0,63.90399858355522,165.75967624783507,1.0501512501170702,0,3,3,0_3_3,0,
2026-03-02T09:26:27.869402+00:00,B,adversarial,tune,adversarial_tune_021,8,4096,4096,bf16,NVIDIA GeForce RTX 4060,c00,32,32,32,2,2,8,0.0,0.0,160.17600148916245,289.5564922690391,1.6758781184718388,0,3,3,0_3_3,0,
2026-03-02T09:26:27.909453+00:00,B,adversarial,tune,adversarial_tune_022,8,8192,1024,bf16,NVIDIA GeForce RTX 4060,c00,32,32,32,2,2,8,0.0,0.0,54.23999950289726,202.13760808110186,2.474515656896912,0,3,3,0_3_3,0,
2026-03-02T09:26:28.070685+00:00,B,adversarial,tune,adversarial_tune_023,8,8192,4096,bf16,NVIDIA GeForce RTX 4060,c00,32,32,32,2,2,8,0.0,0.0,297.8239953517914,392.25344598293304,1.8026449190766012,0,3,3,0_3_3,0,
2026-03-02T09:26:28.078910+00:00,B,adversarial,tune,adversarial_tune_024,16,1024,1024,bf16,NVIDIA GeForce RTX 4060,c00,32,32,32,2,2,8,0.0,0.0,38.80000114440918,109.33183789253235,0.8648049229461162,0,3,3,0_3_3,0,
2026-03-02T09:26:28.100870+00:00,B,adversarial,tune,adversarial_tune_025,16,1024,4096,bf16,NVIDIA GeForce RTX 4060,c00,32,32,32,2,2,8,0.0,0.0,94.59200128912926,204.9433623254299,1.4189120239643838,0,3,3,0_3_3,0,
2026-03-02T09:26:28.120922+00:00,B,adversarial,tune,adversarial_tune_026,16,4096,1024,bf16,NVIDIA GeForce RTX 4060,c00,32,32,32,2,2,8,0.0,0.0,66.56000018119812,145.7401575148105,2.016492302202755,0,3,3,0_3_3,0,
2026-03-02T09:26:28.211347+00:00,B,adversarial,tune,adversarial_tune_027,16,4096,4096,bf16,NVIDIA GeForce RTX 4060,c00,32,32,32,2,2,8,0.0,0.0,138.06400448083878,209.37951952218998,3.8885654086218375,0,3,3,0_3_3,0,
2026-03-02T09:26:28.255696+00:00,B,adversarial,tune,adversarial_tune_028,16,8192,1024,bf16,NVIDIA GeForce RTX 4060,c00,32,32,32,2,2,8,0.0,0.0,57.34400078654289,155.10720089077944,4.681142792935274,0,3,3,0_3_3,0,
2026-03-02T09:26:28.418319+00:00,B,adversarial,tune,adversarial_tune_029,16,8192,4096,bf16,NVIDIA GeForce RTX 4060,c00,32,32,32,2,2,8,0.0,0.0,300.03198981285095,347.5212854146956,3.5787578006923897,0,3,3,0_3_3,0,
2026-03-02T09:26:28.428209+00:00,B,adversarial,tune,adversarial_tune_030,32,1024,1024,bf16,NVIDIA GeForce RTX 4060,c00,32,32,32,2,2,8,0.0,0.0,54.27199974656105,108.1606400758028,1.2365283076611222,0,3,3,0_3_3,0,
2026-03-02T09:26:28.448345+00:00,B,adversarial,tune,adversarial_tune_031,32,1024,4096,bf16,NVIDIA GeForce RTX 4060,c00,32,32,32,2,2,8,0.0,0.0,74.16000217199326,252.89343833923328,3.6196797213872713,0,3,3,0_3_3,0,
2026-03-02T09:26:28.458119+00:00,B,adversarial,eval,adversarial_eval_000,1,1024,1024,bf16,NVIDIA GeForce RTX 4060,c00,32,32,32,2,2,8,0.0,0.0,40.94399884343147,149.77023854851717,0.05122000926239378,0,3,3,0_3_3,0,
2026-03-02T09:26:28.476984+00:00,B,adversarial,eval,adversarial_eval_001,1,1024,4096,bf16,NVIDIA GeForce RTX 4060,c00,32,32,32,2,2,8,0.0,0.0,70.65600156784058,160.87456539273256,0.11872463504668675,0,3,3,0_3_3,0,
2026-03-02T09:26:28.497201+00:00,B,adversarial,eval,adversarial_eval_002,1,4096,1024,bf16,NVIDIA GeForce RTX 4060,c00,32,32,32,2,2,8,0.0,0.0,51.103999838232994,168.62432062625868,0.1641477776016299,0,3,3,0_3_3,0,
2026-03-02T09:26:28.580987+00:00,B,adversarial,eval,adversarial_eval_003,1,4096,4096,bf16,NVIDIA GeForce RTX 4060,c00,32,32,32,2,2,8,0.0,0.0,165.8879965543747,254.28831934928886,0.2022716091396133,0,3,3,0_3_3,0,
2026-03-02T09:26:28.621968+00:00,B,adversarial,eval,adversarial_eval_004,1,8192,1024,bf16,NVIDIA GeForce RTX 4060,c00,32,32,32,2,2,8,0.0,0.0,66.56000018119812,149.377601146698,0.2520615377753444,0,3,3,0_3_3,0,
2026-03-02T09:26:28.784783+00:00,B,adversarial,eval,adversarial_eval_005,1,8192,4096,bf16,NVIDIA GeForce RTX 4060,c00,32,32,32,2,2,8,0.0,0.0,300.03198981285095,320.5939167737961,0.22367236254327436,0,3,3,0_3_3,0,
2026-03-02T09:26:28.797318+00:00,B,adversarial,eval,adversarial_eval_006,2,1024,1024,bf16,NVIDIA GeForce RTX 4060,c00,32,32,32,2,2,8,0.0,0.0,46.08000069856644,86.58944118767965,0.09102222084233792,0,3,3,0_3_3,0,
2026-03-02T09:26:28.819659+00:00,B,adversarial,eval,adversarial_eval_007,2,1024,4096,bf16,NVIDIA GeForce RTX 4060,c00,32,32,32,2,2,8,0.0,0.0,86.01599931716919,124.91776123642912,0.19504762059598826,0,3,3,0_3_3,0,
2026-03-02T09:26:28.836712+00:00,B,adversarial,eval,adversarial_eval_008,2,4096,1024,bf16,NVIDIA GeForce RTX 4060,c00,32,32,32,2,2,8,0.0,0.0,51.05600133538246,86.14367924630639,0.3286041907158361,0,3,3,0_3_3,0,
2026-03-02T09:26:28.923931+00:00,B,adversarial,eval,adversarial_eval_009,2,4096,4096,bf16,NVIDIA GeForce RTX 4060,c00,32,32,32,2,2,8,0.0,0.0,250.86399912834167,358.8719940185547,0.26751093912708934,0,3,3,0_3_3,0,
2026-03-02T09:26:28.976497+00:00,B,adversarial,eval,adversarial_eval_010,2,8192,1024,bf16,NVIDIA GeForce RTX 4060,c00,32,32,32,2,2,8,0.0,0.0,105.47199845314026,186.07104703783983,0.3181359269959009,0,3,3,0_3_3,0,
2026-03-02T09:26:29.151616+00:00,B,adversarial,eval,adversarial_eval_011,2,8192,4096,bf16,NVIDIA GeForce RTX 4060,c00,32,32,32,2,2,8,0.0,0.0,496.63999676704407,607.8975784778595,0.2702515481509974,0,3,3,0_3_3,0,
2026-03-02T09:26:29.162226+00:00,B,adversarial,eval,adversarial_eval_012,4,1024,1024,bf16,NVIDIA GeForce RTX 4060,c00,32,32,32,2,2,8,0.0,0.0,47.10400104522705,143.5225638747215,0.17808695257003015,0,3,3,0_3_3,0,
2026-03-02T09:26:29.182493+00:00,B,adversarial,eval,adversarial_eval_013,4,1024,4096,bf16,NVIDIA GeForce RTX 4060,c00,32,32,32,2,2,8,0.0,0.0,93.1360013782978,146.60608097910867,0.36027348719545443,0,3,3,0_3_3,0,
2026-03-02T09:26:29.199554+00:00,B,adversarial,eval,adversarial_eval_014,4,4096,1024,bf16,NVIDIA GeForce RTX 4060,c00,32,32,32,2,2,8,0.0,0.0,50.175998359918594,97.84319952130318,0.668734715736196,0,3,3,0_3_3,0,
2026-03-02T09:26:29.292819+00:00,B,adversarial,eval,adversarial_eval_015,4,4096,4096,bf16,NVIDIA GeForce RTX 4060,c00,32,32,32,2,2,8,0.0,0.0,255.34400343894958,340.3411227464675,0.525634932453349,0,3,3,0_3_3,0,
2026-03-02T09:26:29.334490+00:00,B,adversarial,eval,adversarial_eval_016,4,8192,1024,bf16,NVIDIA GeForce RTX 4060,c00,32,32,32,2,2,8,0.0,0.0,75.20000264048576,86.09791934490202,0.8924050750480997,0,3,3,0_3_3,0,
2026-03-02T09:26:29.503810+00:00,B,adversarial,eval,adversarial_eval_017,4,8192,4096,bf16,NVIDIA GeForce RTX 4060,c00,32,32,32,2,2,8,0.0,0.0,474.9920070171356,504.85247910022736,0.5651367855339848,0,3,3,0_3_3,0,
2026-03-02T09:26:29.513994+00:00,B,adversarial,eval,adversarial_eval_018,8,1024,1024,bf16,NVIDIA GeForce RTX 4060,c00,32,32,32,2,2,8,0.0,0.0,48.128001391887665,170.95935538411135,0.3485957345992748,0,3,3,0_3_3,0,
2026-03-02T09:26:29.534489+00:00,B,adversarial,eval,adversarial_eval_019,8,1024,4096,bf16,NVIDIA GeForce RTX 4060,c00,32,32,32,2,2,8,0.0,0.0,103.42399775981903,121.53856009244916,0.6488713011833727,0,3,3,0_3_3,0,
2026-03-02T09:26:29.553229+00:00,B,adversarial,eval,adversarial_eval_020,8,4096,1024,bf16,NVIDIA GeForce RTX 4060,c00,32,32,32,2,2,8,0.0,0.0,74.75199922919273,205.5475258827207,0.897753433914743,0,3,3,0_3_3,0,
2026-03-02T09:26:29.644160+00:00,B,adversarial,eval,adversarial_eval_021,8,4096,4096,bf16,NVIDIA GeForce RTX 4060,c00,32,32,32,2,2,8,0.0,0.0,257.9679936170578,387.0924770832062,1.0405765933834439,0,3,3,0_3_3,0,
2026-03-02T09:26:29.687881+00:00,B,adversarial,eval,adversarial_eval_022,8,8192,1024,bf16,NVIDIA GeForce RTX 4060,c00,32,32,32,2,2,8,0.0,0.0,80.89599758386612,92.18048140406609,1.6591392900601099,0,3,3,0_3_3,0,
2026-03-02T09:26:29.861834+00:00,B,adversarial,eval,adversarial_eval_023,8,8192,4096,bf16,NVIDIA GeForce RTX 4060,c00,32,32,32,2,2,8,0.0,0.0,497.6640045642853,584.2928105592728,1.078781883110154,0,3,3,0_3_3,0,
2026-03-02T09:26:29.873977+00:00,B,adversarial,eval,adversarial_eval_024,16,1024,1024,bf16,NVIDIA GeForce RTX 4060,c00,32,32,32,2,2,8,0.0,0.0,73.53600114583969,166.61503300070757,0.4562993836645189,0,3,3,0_3_3,0,
2026-03-02T09:26:29.896801+00:00,B,adversarial,eval,adversarial_eval_025,16,1024,4096,bf16,NVIDIA GeForce RTX 4060,c00,32,32,32,2,2,8,0.0,0.0,124.70399960875511,256.7372772097586,1.076290483233041,0,3,3,0_3_3,0,
2026-03-02T09:26:29.916667+00:00,B,adversarial,eval,adversarial_eval_026,16,4096,1024,bf16,NVIDIA GeForce RTX 4060,c00,32,32,32,2,2,8,0.0,0.0,65.90399891138077,107.56095916032791,2.03656424825569,0,3,3,0_3_3,0,
2026-03-02T09:26:30.009911+00:00,B,adversarial,eval,adversarial_eval_027,16,4096,4096,bf16,NVIDIA GeForce RTX 4060,c00,32,32,32,2,2,8,0.0,0.0,257.3919892311096,380.4671910405159,2.0858104931849653,0,3,3,0_3_3,0,
2026-03-02T09:26:30.060150+00:00,B,adversarial,eval,adversarial_eval_028,16,8192,1024,bf16,NVIDIA GeForce RTX 4060,c00,32,32,32,2,2,8,0.0,0.0,93.18400174379349,168.72448116540903,2.8807032427954202,0,3,3,0_3_3,0,
2026-03-02T09:26:30.230867+00:00,B,adversarial,eval,adversarial_eval_029,16,8192,4096,bf16,NVIDIA GeForce RTX 4060,c00,32,32,32,2,2,8,0.0,0.0,477.183997631073,625.7459455728531,2.2501631012994405,0,3,3,0_3_3,0,
2026-03-02T09:26:30.244405+00:00,B,adversarial,eval,adversarial_eval_030,32,1024,1024,bf16,NVIDIA GeForce RTX 4060,c00,32,32,32,2,2,8,0.0,0.0,65.43999910354614,190.13824179768562,1.025502214537216,0,3,3,0_3_3,0,
2026-03-02T09:26:30.266586+00:00,B,adversarial,eval,adversarial_eval_031,32,1024,4096,bf16,NVIDIA GeForce RTX 4060,c00,32,32,32,2,2,8,0.0,0.0,119.6960024535656,184.26879882812491,2.24264345088831,0,3,3,0_3_3,0,
2026-03-02T09:26:30.284291+00:00,B,adversarial,eval,adversarial_eval_032,32,4096,1024,bf16,NVIDIA GeForce RTX 4060,c00,32,32,32,2,2,8,0.0,0.0,63.37600015103817,135.89152008295054,4.2356011007362815,0,3,3,0_3_3,0,
2026-03-02T09:26:30.373029+00:00,B,adversarial,eval,adversarial_eval_033,32,4096,4096,bf16,NVIDIA GeForce RTX 4060,c00,32,32,32,2,2,8,0.0,0.0,255.92000782489777,272.9929628968239,4.195615001444755,0,3,3,0_3_3,0,
2026-03-02T09:26:30.420251+00:00,B,adversarial,eval,adversarial_eval_034,32,8192,1024,bf16,NVIDIA GeForce RTX 4060,c00,32,32,32,2,2,8,0.0,0.0,99.29599985480309,221.91103681921953,5.406772808421757,0,3,3,0_3_3,0,
2026-03-02T09:26:30.591930+00:00,B,adversarial,eval,adversarial_eval_035,32,8192,4096,bf16,NVIDIA GeForce RTX 4060,c00,32,32,32,2,2,8,0.0,0.0,477.05599665641785,592.8368097543716,4.501533704745874,0,3,3,0_3_3,0,
2026-03-02T09:26:32.885015+00:00,B,adversarial,eval,adversarial_eval_036,1024,1,512,bf16,NVIDIA GeForce RTX 4060,c00,32,32,32,2,2,8,0.0,2293.027,49.15200173854828,182.86592215299595,0.021333332578755117,3,0,2,3_0_2,0,
2026-03-02T09:26:33.116547+00:00,B,adversarial,eval,adversarial_eval_037,1024,1,2048,bf16,NVIDIA GeForce RTX 4060,c09,128,64,64,8,3,8,0.0,231.491,68.60800087451935,115.6976038217544,0.06113432757895359,3,0,3,3_0_3,0,
2026-03-02T09:26:33.132757+00:00,B,adversarial,eval,adversarial_eval_038,2048,1,512,bf16,NVIDIA GeForce RTX 4060,c00,32,32,32,2,2,8,0.0,0.0,49.66400004923344,891.1462159454794,0.04222680408185062,3,0,2,3_0_2,0,
2026-03-02T09:26:33.153761+00:00,B,adversarial,eval,adversarial_eval_039,2048,1,2048,bf16,NVIDIA GeForce RTX 4060,c09,128,64,64,8,3,8,0.0,0.0,77.82399654388428,163.70304092764852,0.10778947847107462,3,0,3,3_0_3,0,
2026-03-02T09:26:33.165061+00:00,B,adversarial,eval,adversarial_eval_040,4096,1,512,bf16,NVIDIA GeForce RTX 4060,c00,32,32,32,2,2,8,0.0,0.0,44.03200000524521,111.90272428095335,0.09525581394214125,3,0,2,3_0_2,0,
2026-03-02T09:26:33.211272+00:00,B,adversarial,eval,adversarial_eval_041,4096,1,2048,bf16,NVIDIA GeForce RTX 4060,c09,128,64,64,8,3,8,0.0,0.0,99.02400150895119,213.51424157619476,0.16942575279068517,3,0,3,3_0_3,0,
2026-03-02T09:26:33.344573+00:00,B,adversarial,eval,adversarial_eval_042,1024,2,512,bf16,NVIDIA GeForce RTX 4060,c00,32,32,32,2,2,8,0.0,0.0,41.82399995625019,102.6492819190023,0.050142310687493225,3,0,2,3_0_2,0,
2026-03-02T09:26:33.533907+00:00,B,adversarial,eval,adversarial_eval_043,1024,2,2048,bf16,NVIDIA GeForce RTX 4060,c09,128,64,64,8,3,8,0.0,0.0,90.11200070381165,158.1507207453249,0.09309090836383095,3,0,3,3_0_3,0,
2026-03-02T09:26:33.554807+00:00,B,adversarial,eval,adversarial_eval_044,2048,2,512,bf16,NVIDIA GeForce RTX 4060,c00,32,32,32,2,2,8,0.0,0.0,74.75200295448303,189.1596792638301,0.05610958682343185,3,0,2,3_0_2,0,
2026-03-02T09:26:33.582968+00:00,B,adversarial,eval,adversarial_eval_045,2048,2,2048,bf16,NVIDIA GeForce RTX 4060,c09,128,64,64,8,3,8,0.0,0.0,94.89599987864494,194.81279760599128,0.1767958188064309,3,0,3,3_0_3,0,
2026-03-02T09:26:33.596660+00:00,B,adversarial,eval,adversarial_eval_046,4096,2,512,bf16,NVIDIA GeForce RTX 4060,c00,32,32,32,2,2,8,0.0,0.0,66.56000018119812,378.65152686834256,0.1260307688876722,3,0,2,3_0_2,0,
2026-03-02T09:26:33.648942+00:00,B,adversarial,eval,adversarial_eval_047,4096,2,2048,bf16,NVIDIA GeForce RTX 4060,c09,128,64,64,8,3,8,0.0,0.0,131.071999669075,199.68000054359436,0.2560000006463379,3,0,3,3_0_3,0,
2026-03-02T09:26:33.655914+00:00,B,adversarial,eval,adversarial_eval_048,1024,4,512,bf16,NVIDIA GeForce RTX 4060,c00,32,32,32,2,2,8,0.0,0.0,37.21600025892258,137.64223746955383,0.11270163292183477,3,0,2,3_0_2,0,
2026-03-02T09:26:33.669699+00:00,B,adversarial,eval,adversarial_eval_049,1024,4,2048,bf16,NVIDIA GeForce RTX 4060,c09,128,64,64,8,3,8,0.0,0.0,99.32799637317657,146.38688504695884,0.16890722266225708,3,0,3,3_0_3,0,
2026-03-02T09:26:33.678563+00:00,B,adversarial,eval,adversarial_eval_050,2048,4,512,bf16,NVIDIA GeForce RTX 4060,c00,32,32,32,2,2,8,0.0,0.0,50.175998359918594,120.59647597372526,0.167183678934049,3,0,2,3_0_2,0,
2026-03-02T09:26:33.700222+00:00,B,adversarial,eval,adversarial_eval_051,2048,4,2048,bf16,NVIDIA GeForce RTX 4060,c09,128,64,64,8,3,8,0.0,0.0,97.21600264310837,191.17887362837786,0.34515338100438414,3,0,3,3_0_3,0,
2026-03-02T09:26:33.711411+00:00,B,adversarial,eval,adversarial_eval_052,4096,4,512,bf16,NVIDIA GeForce RTX 4060,c00,32,32,32,2,2,8,0.0,0.0,44.03200000524521,60.86495924741028,0.381023255768565,3,0,2,3_0_2,0,
2026-03-02T09:26:33.755936+00:00,B,adversarial,eval,adversarial_eval_053,4096,4,2048,bf16,NVIDIA GeForce RTX 4060,c09,128,64,64,8,3,8,0.0,0.0,129.7919973731041,175.82079961895926,0.5170493201293974,3,0,3,3_0_3,0,
2026-03-02T09:26:33.764917+00:00,B,adversarial,eval,adversarial_eval_054,1024,8,512,bf16,NVIDIA GeForce RTX 4060,c00,32,32,32,2,2,8,0.0,0.0,65.5359998345375,175.3804832696913,0.12800000032316894,3,0,2,3_0_2,0,
2026-03-02T09:26:33.782139+00:00,B,adversarial,eval,adversarial_eval_055,1024,8,2048,bf16,NVIDIA GeForce RTX 4060,c09,128,64,64,8,3,8,0.0,0.0,122.25599959492683,207.78848230838764,0.2744604118503513,3,0,3,3_0_3,0,
2026-03-02T09:26:33.790592+00:00,B,adversarial,eval,adversarial_eval_056,2048,8,512,bf16,NVIDIA GeForce RTX 4060,c00,32,32,32,2,2,8,0.0,0.0,45.98399996757507,106.46879792213429,0.36484899121064285,3,0,2,3_0_2,0,
2026-03-02T09:26:33.813560+00:00,B,adversarial,eval,adversarial_eval_057,2048,8,2048,bf16,NVIDIA GeForce RTX 4060,c09,128,64,64,8,3,8,0.0,0.0,99.34400022029877,205.37472471594805,0.6755200500401007,3,0,3,3_0_3,0,
2026-03-02T09:26:33.826561+00:00,B,adversarial,eval,adversarial_eval_058,4096,8,512,bf16,NVIDIA GeForce RTX 4060,c00,32,32,32,2,2,8,0.0,0.0,51.6160000115633,307.98847496509484,0.6500781151674472,3,0,2,3_0_2,0,
2026-03-02T09:26:33.872361+00:00,B,adversarial,eval,adversarial_eval_059,4096,8,2048,bf16,NVIDIA GeForce RTX 4060,c09,128,64,64,8,3,8,0.0,0.0,133.12000036239624,197.05855950713146,1.0082461511013776,3,0,3,3_0_3,0,
2026-03-02T09:26:33.884483+00:00,B,adversarial,eval,adversarial_eval_060,64,64,8192,bf16,NVIDIA GeForce RTX 4060,c04,64,64,64,4,3,8,0.0,0.0,97.15200215578079,245.81951707601536,0.6907615129989048,1,1,3,1_1_3,0,
2026-03-02T09:26:33.898513+00:00,B,adversarial,eval,adversarial_eval_061,128,128,8192,bf16,NVIDIA GeForce RTX 4060,c04,64,64,64,4,3,8,0.0,0.0,94.09600123763084,160.78847482800484,2.8527828225355805,1,1,3,1_1_3,0,
2026-03-02T09:26:33.998162+00:00,B,adversarial,eval,adversarial_eval_062,2048,128,8192,bf16,NVIDIA GeForce RTX 4060,c04,64,64,64,4,3,8,0.0,0.0,201.60000026226044,567.9513719677916,21.30440124212648,3,1,3,3_1_3,0,
2026-03-02T09:26:34.088985+00:00,B,adversarial,eval,adversarial_eval_063,128,2048,8192,bf16,NVIDIA GeForce RTX 4060,c06,64,128,32,4,3,8,0.0,0.0,252.9279887676239,349.15039777755726,16.980988608366218,1,3,3,1_3_3,0,
2026-03-02T09:26:37.810731+00:00,B2,uniform,tune,uniform_tune_000,1536,512,1024,bf16,NVIDIA GeForce RTX 4060,c05,128,64,32,4,3,8,178.87554701883346,2646.999,87.35999837517738,193.8739220798014,18.436501441804538,3,2,3,4_3_3_r2,0,
2026-03-02T09:26:39.331196+00:00,B2,uniform,tune,uniform_tune_001,1536,1536,2048,bf16,NVIDIA GeForce RTX 4060,c03,64,64,32,4,2,8,0.0,1520.409,320.51199674606323,354.97376054525375,30.150747909933568,3,3,3,4_4_4_r1,0,
2026-03-02T09:26:39.816090+00:00,B2,uniform,tune,uniform_tune_002,384,2048,1536,bf16,NVIDIA GeForce RTX 4060,c09,128,64,64,8,3,8,0.0,484.839,102.4319976568222,119.24960136413571,23.58559004281114,2,3,3,3_4_4_r0,0,
2026-03-02T09:26:39.915100+00:00,B2,uniform,tune,uniform_tune_003,1536,64,3072,bf16,NVIDIA GeForce RTX 4060,c00,32,32,32,2,2,8,0.0,98.961,64.2399974167347,74.0912014245987,9.401927152672355,3,1,3,4_1_4_r2,0,anchor_skipped
2026-03-02T09:26:40.034568+00:00,B2,uniform,tune,uniform_tune_004,768,128,2048,bf16,NVIDIA GeForce RTX 4060,c06,64,128,32,4,3,8,0.0,119.422,54.22399938106537,90.16320057213295,7.425737470419852,3,1,3,3_2_4_r2,0,
2026-03-02T09:26:40.052164+00:00,B2,uniform,tune,uniform_tune_005,512,128,4096,bf16,NVIDIA GeForce RTX 4060,c06,64,128,32,4,3,8,0.0,0.0,74.17599856853485,93.70272085070607,7.237798241488567,2,1,3,3_2_4_r2,0,
2026-03-02T09:26:40.962122+00:00,B2,uniform,tune,uniform_tune_006,2048,1024,4096,bf16,NVIDIA GeForce RTX 4060,c04,64,64,64,4,3,8,0.0,909.904,581.6320180892944,653.6889499425887,29.53735119403705,3,3,3,4_3_4_r2,0,
2026-03-02T09:26:41.044186+00:00,B2,uniform,tune,uniform_tune_007,128,768,512,bf16,NVIDIA GeForce RTX 4060,c09,128,64,64,8,3,8,0.0,82.012,38.91199827194214,44.52287994325161,2.5869474833057904,1,3,2,2_3_3_r0,0,
2026-03-02T09:26:41.094423+00:00,B2,uniform,tune,uniform_tune_008,2048,256,64,bf16,NVIDIA GeForce RTX 4060,c11,32,128,32,4,2,8,0.0,50.197,33.79200026392937,56.625919826328726,1.9859393784283939,3,2,1,4_2_1_r2,0,anchor_skipped
2026-03-02T09:26:41.211307+00:00,B2,uniform,tune,uniform_tune_009,192,768,2048,bf16,NVIDIA GeForce RTX 4060,c10,64,128,64,8,3,8,0.0,116.838,54.25599962472916,59.914241656661034,11.132036644380875,2,3,3,2_3_4_r0,0,
2026-03-02T09:26:41.452371+00:00,B2,uniform,tune,uniform_tune_010,1024,1024,1536,bf16,NVIDIA GeForce RTX 4060,c09,128,64,64,8,3,8,0.0,241.013,137.90400326251984,154.2246362566948,23.35846237812212,3,3,3,3_3_4_r1,0,
2026-03-02T09:26:41.533249+00:00,B2,uniform,tune,uniform_tune_011,256,384,768,bf16,NVIDIA GeForce RTX 4060,c09,128,64,64,8,3,8,0.0,80.831,38.91199827194214,106.0399980843065,3.880421224958686,2,2,3,2_3_3_r1,0,
2026-03-02T09:26:41.615816+00:00,B2,uniform,tune,uniform_tune_012,64,192,2048,bf16,NVIDIA GeForce RTX 4060,c04,64,64,64,4,3,8,0.0,82.528,42.89599880576134,67.08224035799503,1.1733413232294287,1,2,3,1_2_4_r0,0,
2026-03-02T09:26:41.694306+00:00,B2,uniform,tune,uniform_tune_013,192,128,512,bf16,NVIDIA GeForce RTX 4060,c09,128,64,64,8,3,8,0.0,78.452,36.86400130391121,50.784320272505255,0.6826666425201637,2,1,2,2_2_3_r1,0,
2026-03-02T09:26:41.700512+00:00,B2,uniform,tune,uniform_tune_014,128,128,1024,bf16,NVIDIA GeForce RTX 4060,c09,128,64,64,8,3,8,0.0,0.0,44.11200061440468,93.4460781514644,0.7606644797933484,1,1,3,2_2_3_r1,0,
2026-03-02T09:26:42.436513+00:00,B2,uniform,tune,uniform_tune_015,3072,3072,768,bf16,NVIDIA GeForce RTX 4060,c03,64,64,32,4,2,8,0.0,735.962,496.5119957923889,520.9683275222777,29.194691662718945,3,3,3,4_4_3_r1,0,
2026-03-02T09:26:42.545786+00:00,B2,uniform,tune,uniform_tune_016,256,128,3072,bf16,NVIDIA GeForce RTX 4060,c04,64,64,64,4,3,8,0.0,109.227,54.27199974656105,113.68448123335838,3.709584922983367,2,1,3,2_2_4_r2,0,
2026-03-02T09:26:42.592535+00:00,B2,uniform,tune,uniform_tune_017,96,1024,192,bf16,NVIDIA GeForce RTX 4060,c11,32,128,32,4,2,8,0.0,46.709,30.719999223947525,77.19040043652052,1.2288000310421,1,3,2,2_3_2_r0,0,anchor_skipped
2026-03-02T09:26:42.644211+00:00,B2,uniform,tune,uniform_tune_018,64,64,192,bf16,NVIDIA GeForce RTX 4060,c04,64,64,64,4,3,8,0.0,51.643,29.69600073993206,40.005760230123975,0.05296551592164321,1,1,2,1_1_2_r1,0,
2026-03-02T09:26:42.695627+00:00,B2,uniform,tune,uniform_tune_019,4096,64,64,bf16,NVIDIA GeForce RTX 4060,c11,32,128,32,4,2,8,0.0,51.386,32.76799991726875,47.47936010360718,1.0240000025853515,3,1,1,4_1_1_r2,0,anchor_skipped
2026-03-02T09:26:42.899597+00:00,B2,uniform,tune,uniform_tune_020,128,4096,3072,bf16,NVIDIA GeForce RTX 4060,c06,64,128,32,4,3,8,0.0,203.935,138.0319967865944,161.75455823540688,23.33680267612302,1,3,3,2_4_4_r0,0,anchor_skipped
2026-03-02T09:26:42.939160+00:00,B2,uniform,tune,uniform_tune_021,192,2048,3072,bf16,NVIDIA GeForce RTX 4060,c06,64,128,32,4,3,8,0.0,0.0,104.3039970099926,189.2742404341697,23.162286904197433,2,3,3,2_4_4_r0,0,
2026-03-02T09:26:42.991536+00:00,B2,uniform,tune,uniform_tune_022,1536,2048,2048,bf16,NVIDIA GeForce RTX 4060,c03,64,64,32,4,2,8,0.0,0.0,389.1200125217438,537.8752046823502,33.11292525022727,3,3,3,4_4_4_r1,0,
2026-03-02T09:26:43.005038+00:00,B2,uniform,tune,uniform_tune_023,256,1024,1024,bf16,NVIDIA GeForce RTX 4060,c09,128,64,64,8,3,8,0.0,0.0,80.89599758386612,199.42400410771364,6.636557160240439,2,3,3,2_3_3_r0,0,
2026-03-02T09:26:43.087687+00:00,B2,uniform,tune,uniform_tune_024,768,128,384,bf16,NVIDIA GeForce RTX 4060,c06,64,128,32,4,3,8,0.0,82.603,37.71200031042099,49.611519537866116,2.001948222808476,3,1,2,3_2_3_r2,0,
2026-03-02T09:26:43.163943+00:00,B2,uniform,tune,uniform_tune_025,256,96,384,bf16,NVIDIA GeForce RTX 4060,c04,64,64,64,4,3,8,0.0,76.204,37.88800165057182,66.64192020893096,0.498162140459977,2,1,2,2_2_3_r2,0,
2026-03-02T09:26:43.181096+00:00,B2,uniform,tune,uniform_tune_026,96,1024,3072,bf16,NVIDIA GeForce RTX 4060,c10,64,128,64,8,3,8,0.0,0.0,71.16800174117088,169.5846416056156,8.486676051360819,1,3,3,2_3_4_r0,0,
2026-03-02T09:26:43.229030+00:00,B2,uniform,tune,uniform_tune_027,1536,512,4096,bf16,NVIDIA GeForce RTX 4060,c04,64,64,64,4,3,8,0.0,0.0,221.53600305318832,312.8764668107033,29.08083045288688,3,2,3,4_3_4_r2,0,
2026-03-02T09:26:43.296200+00:00,B2,uniform,tune,uniform_tune_028,128,64,192,bf16,NVIDIA GeForce RTX 4060,c04,64,64,64,4,3,8,0.0,67.114,34.81600061058998,140.86144283413876,0.09035293959189454,1,1,2,2_1_2_r2,0,
2026-03-02T09:26:43.385417+00:00,B2,uniform,tune,uniform_tune_029,192,256,1536,bf16,NVIDIA GeForce RTX 4060,c04,64,64,64,4,3,8,0.0,89.181,45.48799991607666,55.96160024404523,3.3194456621214155,2,2,3,2_2_4_r1,0,
2026-03-02T09:26:43.457094+00:00,B2,uniform,tune,uniform_tune_030,4096,64,3072,bf16,NVIDIA GeForce RTX 4060,c00,32,32,32,2,2,8,0.0,0.0,140.60799777507782,237.65216112136835,11.454631041517287,3,1,3,4_1_4_r2,0,
2026-03-02T09:26:43.530791+00:00,B2,uniform,tune,uniform_tune_031,384,128,96,bf16,NVIDIA GeForce RTX 4060,c02,32,64,32,2,2,8,0.0,73.643,35.80800071358681,210.0105606019491,0.2635495926031749,2,1,1,3_2_2_r2,0,
2026-03-02T09:26:43.665494+00:00,B2,uniform,eval,uniform_eval_000,512,4096,768,bf16,NVIDIA GeForce RTX 4060,c06,64,128,32,4,3,8,0.0,134.237,128.00000607967377,168.04863333702076,25.165822804687558,2,3,3,3_4_3_r0,0,anchor_skipped
2026-03-02T09:26:43.727212+00:00,B2,uniform,eval,uniform_eval_001,384,512,64,bf16,NVIDIA GeForce RTX 4060,c06,64,128,32,4,3,8,0.0,61.672,28.672000393271446,37.67231896519658,0.877714273675364,2,2,1,3_3_1_r1,0,
2026-03-02T09:26:43.791014+00:00,B2,uniform,eval,uniform_eval_002,256,4096,384,bf16,NVIDIA GeForce RTX 4060,c04,64,64,64,4,3,8,0.0,63.764,55.00799976289272,63.48799914121628,14.639804600625439,2,3,2,2_4_3_r0,0,anchor_skipped
2026-03-02T09:26:43.873968+00:00,B2,uniform,eval,uniform_eval_003,384,768,512,bf16,NVIDIA GeForce RTX 4060,c02,32,64,32,2,2,8,0.0,82.909,39.32799957692623,51.22047871351242,7.678750286022117,2,3,2,3_3_3_r0,0,
2026-03-02T09:26:43.947114+00:00,B2,uniform,eval,uniform_eval_004,768,1024,96,bf16,NVIDIA GeForce RTX 4060,c10,64,128,64,8,3,8,0.0,73.102,35.840000957250595,53.37312113493678,4.21302845890279,3,3,1,3_3_2_r1,0,
2026-03-02T09:26:44.144358+00:00,B2,uniform,eval,uniform_eval_005,3072,3072,128,bf16,NVIDIA GeForce RTX 4060,c09,128,64,64,8,3,8,0.0,197.203,112.64000087976456,169.68704149127,21.44814528702665,3,3,1,4_4_2_r1,0,
2026-03-02T09:26:44.151928+00:00,B2,uniform,eval,uniform_eval_006,256,96,512,bf16,NVIDIA GeForce RTX 4060,c04,64,64,64,4,3,8,0.0,0.0,66.8959990143776,147.41152048110962,0.3761932607448054,2,1,2,2_2_3_r2,0,
2026-03-02T09:26:44.578782+00:00,B2,uniform,eval,uniform_eval_007,4096,4096,4096,bf16,NVIDIA GeForce RTX 4060,c03,64,64,32,4,2,8,0.0,0.0,4463.4881019592285,4694.460291862488,30.79182700446133,3,3,3,4_4_4_r1,0,
2026-03-02T09:26:44.661455+00:00,B2,uniform,eval,uniform_eval_008,128,96,64,bf16,NVIDIA GeForce RTX 4060,c03,64,64,32,4,2,8,0.0,82.609,37.776000797748566,92.13951859623182,0.041636593784002196,1,1,1,2_2_1_r1,0,
2026-03-02T09:26:44.719726+00:00,B2,uniform,eval,uniform_eval_009,3072,384,96,bf16,NVIDIA GeForce RTX 4060,c06,64,128,32,4,3,8,0.0,58.236,35.840000957250595,98.18335860967636,6.3195426883541845,3,2,1,4_3_2_r2,0,anchor_skipped
2026-03-02T09:26:44.737168+00:00,B2,uniform,eval,uniform_eval_010,768,768,2048,bf16,NVIDIA GeForce RTX 4060,c09,128,64,64,8,3,8,0.0,0.0,101.3759970664978,135.36704339087,23.831273416874733,3,3,3,3_3_4_r1,0,
2026-03-02T09:26:44.796896+00:00,B2,uniform,eval,uniform_eval_011,4096,96,512,bf16,NVIDIA GeForce RTX 4060,c03,64,64,32,4,2,8,0.0,59.69,46.879999339580536,63.63136101514098,8.589018551031463,3,1,2,4_2_3_r2,0,anchor_skipped
2026-03-02T09:26:44.803790+00:00,B2,uniform,eval,uniform_eval_012,384,384,256,bf16,NVIDIA GeForce RTX 4060,c10,64,128,64,8,3,8,0.0,0.0,51.023999229073524,180.18943607807145,1.4796463064577163,2,2,2,3_3_2_r1,0,
2026-03-02T09:26:45.506195+00:00,B2,uniform,eval,uniform_eval_013,4096,2048,768,bf16,NVIDIA GeForce RTX 4060,c06,64,128,32,4,3,8,0.0,702.359,444.41598653793335,533.113280534744,28.99288567086729,3,3,3,4_4_3_r2,0,
2026-03-02T09:26:45.523312+00:00,B2,uniform,eval,uniform_eval_014,192,384,3072,bf16,NVIDIA GeForce RTX 4060,c10,64,128,64,8,3,8,0.0,0.0,72.7040022611618,380.05824074149047,6.2305350174921905,2,2,3,2_3_4_r0,0,
2026-03-02T09:26:45.537249+00:00,B2,uniform,eval,uniform_eval_015,128,96,4096,bf16,NVIDIA GeForce RTX 4060,c04,64,64,64,4,3,8,0.0,0.0,59.26400050520897,114.02240104973299,1.6985572209414426,1,1,3,2_2_4_r1,0,
2026-03-02T09:26:45.656483+00:00,B2,uniform,eval,uniform_eval_016,64,4096,2048,bf16,NVIDIA GeForce RTX 4060,c04,64,64,64,4,3,8,0.0,119.201,68.60800087451935,74.81343917548655,15.650387860212119,1,3,3,1_4_4_r0,0,anchor_skipped
2026-03-02T09:26:45.670795+00:00,B2,uniform,eval,uniform_eval_017,96,128,3072,bf16,NVIDIA GeForce RTX 4060,c04,64,64,64,4,3,8,0.0,0.0,70.65600156784058,229.39583152532566,1.0685217154201807,1,1,3,2_2_4_r1,0,
2026-03-02T09:26:45.678283+00:00,B2,uniform,eval,uniform_eval_018,512,768,64,bf16,NVIDIA GeForce RTX 4060,c06,64,128,32,4,3,8,0.0,0.0,35.711999982595444,86.09791934490202,1.4093763447728933,2,3,1,3_3_1_r1,0,
2026-03-02T09:26:45.749110+00:00,B2,uniform,eval,uniform_eval_019,64,128,384,bf16,NVIDIA GeForce RTX 4060,c11,32,128,32,4,2,8,0.0,70.791,36.559998989105225,66.19680199772117,0.1720857815634742,1,1,2,1_2_3_r0,0,
2026-03-02T09:26:45.753581+00:00,B2,uniform,eval,uniform_eval_020,512,512,96,bf16,NVIDIA GeForce RTX 4060,c10,64,128,64,8,3,8,0.0,0.0,34.86400097608566,48.65024156868458,1.44365668284957,2,2,1,3_3_2_r1,0,
2026-03-02T09:26:45.778567+00:00,B2,uniform,eval,uniform_eval_021,256,3072,1536,bf16,NVIDIA GeForce RTX 4060,c06,64,128,32,4,3,8,0.0,0.0,100.35199671983719,165.3862400352955,24.074449766503058,2,3,3,2_4_4_r0,0,
2026-03-02T09:26:45.788251+00:00,B2,uniform,eval,uniform_eval_022,2048,96,512,bf16,NVIDIA GeForce RTX 4060,c03,64,64,32,4,2,8,0.0,0.0,59.31200087070465,129.39039781689644,3.39436520509358,3,1,2,4_2_3_r2,0,
2026-03-02T09:26:45.821654+00:00,B2,uniform,eval,uniform_eval_023,1536,512,3072,bf16,NVIDIA GeForce RTX 4060,c04,64,64,64,4,3,8,0.0,0.0,178.17600071430206,225.9763292968272,27.1183447188696,3,2,3,4_3_4_r2,0,
2026-03-02T09:26:45.826375+00:00,B2,uniform,eval,uniform_eval_024,128,192,64,bf16,NVIDIA GeForce RTX 4060,c03,64,64,32,4,2,8,0.0,0.0,31.536001712083817,51.59775916486977,0.09975037510207373,1,2,1,2_2_1_r1,0,
2026-03-02T09:26:45.832740+00:00,B2,uniform,eval,uniform_eval_025,1536,96,384,bf16,NVIDIA GeForce RTX 4060,c03,64,64,32,4,2,8,0.0,0.0,34.81600061058998,83.750399313867,3.2527058253082037,3,1,2,4_2_3_r2,0,
2026-03-02T09:26:45.939856+00:00,B2,uniform,eval,uniform_eval_026,1536,2048,64,bf16,NVIDIA GeForce RTX 4060,c09,128,64,64,8,3,8,0.0,107.081,51.19999870657921,72.25023899227376,7.864320198669438,3,3,1,4_4_1_r1,0,
2026-03-02T09:26:45.950112+00:00,B2,uniform,eval,uniform_eval_027,256,1024,96,bf16,NVIDIA GeForce RTX 4060,c11,32,128,32,4,2,8,0.0,0.0,31.74399957060814,129.0649589896202,1.5855484085440266,2,3,1,2_3_2_r0,0,
2026-03-02T09:26:45.954739+00:00,B2,uniform,eval,uniform_eval_028,2048,256,64,bf16,NVIDIA GeForce RTX 4060,c11,32,128,32,4,2,8,0.0,0.0,32.54400007426739,75.10432098060839,2.062096357142745,3,2,1,4_2_1_r2,0,
2026-03-02T09:26:45.958820+00:00,B2,uniform,eval,uniform_eval_029,192,768,192,bf16,NVIDIA GeForce RTX 4060,c11,32,128,32,4,2,8,0.0,0.0,31.74399957060814,41.642559766769395,1.78374195961203,2,3,2,2_3_2_r0,0,
2026-03-02T09:26:46.012680+00:00,B2,uniform,eval,uniform_eval_030,1024,2048,3072,bf16,NVIDIA GeForce RTX 4060,c09,128,64,64,8,3,8,0.0,0.0,423.93600940704346,440.8422291278839,30.393506571951807,3,3,3,3_4_4_r0,0,
2026-03-02T09:26:46.196531+00:00,B2,uniform,eval,uniform_eval_031,1536,1024,512,bf16,NVIDIA GeForce RTX 4060,c10,64,128,64,8,3,8,0.0,183.784,79.8719972372055,86.5382394939661,20.164923774433348,3,3,2,4_3_3_r1,0,
2026-03-02T09:26:46.299179+00:00,B2,uniform,eval,uniform_eval_032,512,768,768,bf16,NVIDIA GeForce RTX 4060,c11,32,128,32,4,2,8,0.0,102.595,51.51999928057194,62.41919830441474,11.723210101591738,2,3,3,3_3_3_r1,0,
2026-03-02T09:26:46.380850+00:00,B2,uniform,eval,uniform_eval_033,64,512,4096,bf16,NVIDIA GeForce RTX 4060,c04,64,64,64,4,3,8,0.0,81.628,56.32000043988228,68.66560041904447,4.766254508228145,1,2,3,1_3_4_r0,0,anchor_skipped
2026-03-02T09:26:46.396216+00:00,B2,uniform,eval,uniform_eval_034,1024,256,512,bf16,NVIDIA GeForce RTX 4060,c06,64,128,32,4,3,8,0.0,0.0,38.39999996125698,131.200959086418,6.990506673719618,3,2,2,3_2_3_r2,0,
2026-03-02T09:26:46.403548+00:00,B2,uniform,eval,uniform_eval_035,1024,768,96,bf16,NVIDIA GeForce RTX 4060,c10,64,128,64,8,3,8,0.0,0.0,58.240000158548355,205.64383462071413,2.5926329599749707,3,3,1,3_3_2_r1,0,
2026-03-02T09:26:46.466636+00:00,B2,uniform,eval,uniform_eval_036,768,64,1536,bf16,NVIDIA GeForce RTX 4060,c02,32,64,32,2,2,8,0.0,63.059,44.863998889923096,398.5369452834119,3.3656149192245763,3,1,3,3_1_4_r2,0,anchor_skipped
2026-03-02T09:26:46.478314+00:00,B2,uniform,eval,uniform_eval_037,512,256,512,bf16,NVIDIA GeForce RTX 4060,c06,64,128,32,4,3,8,0.0,0.0,44.99199986457825,256.8896007537841,2.9831465239149835,2,2,2,3_2_3_r2,0,
2026-03-02T09:26:46.523527+00:00,B2,uniform,eval,uniform_eval_038,64,1024,64,bf16,NVIDIA GeForce RTX 4060,c02,32,64,32,2,2,8,0.0,45.181,31.74399957060814,74.96767945587631,0.2642580680906711,1,3,1,1_3_1_r0,0,anchor_skipped
2026-03-02T09:26:46.533275+00:00,B2,uniform,eval,uniform_eval_039,512,128,2048,bf16,NVIDIA GeForce RTX 4060,c06,64,128,32,4,3,8,0.0,0.0,53.247999399900436,90.51839970052242,5.04123082604493,2,1,3,3_2_4_r2,0,
2026-03-02T09:26:46.539659+00:00,B2,uniform,eval,uniform_eval_040,4096,768,96,bf16,NVIDIA GeForce RTX 4060,c06,64,128,32,4,3,8,0.0,0.0,49.15200173854828,86.47487908601751,12.287999565362945,3,3,1,4_3_2_r2,0,
2026-03-02T09:26:46.544696+00:00,B2,uniform,eval,uniform_eval_041,4096,192,64,bf16,NVIDIA GeForce RTX 4060,c11,32,128,32,4,2,8,0.0,0.0,33.23199972510338,83.67776077240693,3.0291073914507516,3,2,1,4_2_1_r2,0,
2026-03-02T09:26:46.584731+00:00,B2,uniform,eval,uniform_eval_042,96,1536,128,bf16,NVIDIA GeForce RTX 4060,c03,64,64,32,4,2,8,0.0,40.011,29.69600073993206,57.43103940039873,1.271172382119437,1,3,1,2_4_2_r0,0,anchor_skipped
2026-03-02T09:26:46.602750+00:00,B2,uniform,eval,uniform_eval_043,192,2048,192,bf16,NVIDIA GeForce RTX 4060,c03,64,64,32,4,2,8,0.0,0.0,77.31200009584427,172.93279819190482,1.953059600227784,2,3,2,2_4_2_r0,0,
2026-03-02T09:26:46.691930+00:00,B2,uniform,eval,uniform_eval_044,384,4096,3072,bf16,NVIDIA GeForce RTX 4060,c09,128,64,64,8,3,8,0.0,0.0,295.79199850559235,385.6691202521324,32.67051328238446,2,3,3,3_4_4_r0,0,
2026-03-02T09:26:46.707649+00:00,B2,uniform,eval,uniform_eval_045,4096,96,768,bf16,NVIDIA GeForce RTX 4060,c03,64,64,32,4,2,8,0.0,0.0,61.43999844789505,90.40160007774823,9.8304002483368,3,1,3,4_2_3_r2,0,
2026-03-02T09:26:46.713161+00:00,B2,uniform,eval,uniform_eval_046,96,96,1536,bf16,NVIDIA GeForce RTX 4060,c04,64,64,64,4,3,8,0.0,0.0,42.95999929308891,47.49568022787571,0.6590212398945396,1,1,3,2_2_4_r1,0,
2026-03-02T09:26:46.772508+00:00,B2,uniform,eval,uniform_eval_047,2048,512,4096,bf16,NVIDIA GeForce RTX 4060,c04,64,64,64,4,3,8,0.0,0.0,271.36000990867615,411.34689092636097,31.65512337241905,3,2,3,4_3_4_r2,0,
2026-03-02T09:26:46.847599+00:00,B2,uniform,eval,uniform_eval_048,96,256,768,bf16,NVIDIA GeForce RTX 4060,c04,64,64,64,4,3,8,0.0,75.026,39.263999089598656,118.76832164824006,0.9614083352502913,1,2,3,2_2_3_r0,0,
2026-03-02T09:26:46.901470+00:00,B2,uniform,eval,uniform_eval_049,64,768,384,bf16,NVIDIA GeForce RTX 4060,c04,64,64,64,4,3,8,0.0,53.828,34.81600061058998,54.58240006119013,1.0842352751027344,1,3,2,1_3_3_r0,0,anchor_skipped
2026-03-02T09:26:46.909158+00:00,B2,uniform,eval,uniform_eval_050,128,1024,96,bf16,NVIDIA GeForce RTX 4060,c11,32,128,32,4,2,8,0.0,0.0,66.3519985973835,141.97759971022603,0.37927755805372804,1,3,1,2_3_2_r0,0,
2026-03-02T09:26:46.920202+00:00,B2,uniform,eval,uniform_eval_051,384,768,768,bf16,NVIDIA GeForce RTX 4060,c02,32,64,32,2,2,8,0.0,0.0,74.49600100517273,81.83455683290957,6.080659711768238,2,3,3,3_3_3_r0,0,
2026-03-02T09:26:46.937269+00:00,B2,uniform,eval,uniform_eval_052,768,64,4096,bf16,NVIDIA GeForce RTX 4060,c02,32,64,32,2,2,8,0.0,0.0,70.65600156784058,152.00896248221397,5.698782482240964,3,1,3,3_1_4_r2,0,
2026-03-02T09:26:46.943822+00:00,B2,uniform,eval,uniform_eval_053,384,96,512,bf16,NVIDIA GeForce RTX 4060,c06,64,128,32,4,3,8,0.0,0.0,46.032000333070755,200.72864040732372,0.8200542172155006,2,1,2,3_2_3_r2,0,
2026-03-02T09:26:46.952173+00:00,B2,uniform,eval,uniform_eval_054,768,192,768,bf16,NVIDIA GeForce RTX 4060,c06,64,128,32,4,3,8,0.0,0.0,43.007999658584595,139.59807738661766,5.2662857560916825,3,2,3,3_2_3_r2,0,
2026-03-02T09:26:46.962113+00:00,B2,uniform,eval,uniform_eval_055,512,2048,512,bf16,NVIDIA GeForce RTX 4060,c06,64,128,32,4,3,8,0.0,0.0,65.5359998345375,125.01279652118669,16.384000041365624,2,3,2,3_4_3_r0,0,
2026-03-02T09:26:46.967393+00:00,B2,uniform,eval,uniform_eval_056,384,512,512,bf16,NVIDIA GeForce RTX 4060,c11,32,128,32,4,2,8,0.0,0.0,34.84800085425377,43.12255993485449,5.77727809529208,2,2,2,3_3_3_r1,0,
2026-03-02T09:26:46.978062+00:00,B2,uniform,eval,uniform_eval_057,2048,512,512,bf16,NVIDIA GeForce RTX 4060,c05,128,64,32,4,3,8,0.0,0.0,72.01600074768066,145.6048004329204,14.90976745240301,3,2,2,4_3_3_r2,0,
2026-03-02T09:26:47.211778+00:00,B2,uniform,eval,uniform_eval_058,1024,512,2048,bf16,NVIDIA GeForce RTX 4060,c04,64,64,64,4,3,8,0.0,233.677,106.4159981906414,115.5897606909275,20.180082736740772,3,2,3,3_3_4_r2,0,
2026-03-02T09:26:47.256604+00:00,B2,uniform,eval,uniform_eval_059,2048,64,4096,bf16,NVIDIA GeForce RTX 4060,c00,32,32,32,2,2,8,0.0,0.0,87.77599781751633,135.7107175886631,12.232749848452617,3,1,3,4_1_4_r2,0,
2026-03-02T09:26:47.314768+00:00,B2,uniform,eval,uniform_eval_060,64,1536,1024,bf16,NVIDIA GeForce RTX 4060,c04,64,64,64,4,3,8,0.0,58.114,36.86400130391121,99.70304030925014,5.46133314016131,1,3,3,1_4_3_r0,0,anchor_skipped
2026-03-02T09:26:47.331103+00:00,B2,uniform,eval,uniform_eval_061,768,1024,1536,bf16,NVIDIA GeForce RTX 4060,c09,128,64,64,8,3,8,0.0,0.0,102.91199758648872,116.65023706853387,23.475582640105948,3,3,3,3_3_4_r1,0,
2026-03-02T09:26:47.412327+00:00,B2,uniform,eval,uniform_eval_062,384,2048,192,bf16,NVIDIA GeForce RTX 4060,c09,128,64,64,8,3,8,0.0,81.187,38.91199827194214,59.81663841754197,7.760842449917372,2,3,2,3_4_2_r0,0,
2026-03-02T09:26:47.418774+00:00,B2,uniform,eval,uniform_eval_063,256,2048,192,bf16,NVIDIA GeForce RTX 4060,c03,64,64,32,4,2,8,0.0,0.0,34.81600061058998,615.1209848374107,5.782588133881251,2,3,2,2_4_2_r0,0,
2026-03-02T09:26:49.474073+00:00,B2,llm_style,tune,llm_style_tune_000,8,4096,1024,bf16,NVIDIA GeForce RTX 4060,c00,32,32,32,2,2,8,0.0,2054.686,39.93599861860275,140.46848133206362,1.6804103145361124,0,3,3,0_4_3_r0,0,anchor_skipped
2026-03-02T09:26:49.497215+00:00,B2,llm_style,tune,llm_style_tune_001,32,1024,2048,bf16,NVIDIA GeForce RTX 4060,c04,64,64,64,4,3,8,0.0,0.0,95.23200243711472,225.36192178726196,1.40937630801819,0,3,3,1_3_4_r0,0,
2026-03-02T09:26:49.511148+00:00,B2,llm_style,tune,llm_style_tune_002,16,2048,1024,bf16,NVIDIA GeForce RTX 4060,c00,32,32,32,2,2,8,0.0,0.0,73.72800260782242,217.61024296283722,0.9102221900268849,0,3,3,0_4_3_r0,0,
2026-03-02T09:26:51.877369+00:00,B2,llm_style,tune,llm_style_tune_003,1,1024,4096,bf16,NVIDIA GeForce RTX 4060,c00,32,32,32,2,2,8,0.0,2366.176,150.52799880504608,245.6393638253212,0.05572789159885378,0,3,3,0_3_4_r0,0,anchor_skipped
2026-03-02T09:26:51.920346+00:00,B2,llm_style,tune,llm_style_tune_004,64,2048,2048,bf16,NVIDIA GeForce RTX 4060,c04,64,64,64,4,3,8,0.0,0.0,308.6880147457123,409.73311275243725,1.739202321937435,1,3,3,1_4_4_r0,0,
2026-03-02T09:26:52.569165+00:00,B2,llm_style,tune,llm_style_tune_005,32,8192,8192,bf16,NVIDIA GeForce RTX 4060,c04,64,64,64,4,3,8,0.0,0.0,571.9040036201477,17897.728023529053,7.509944446642953,0,3,3,1_4_4_r0,0,
2026-03-02T09:26:53.326147+00:00,B2,llm_style,tune,llm_style_tune_006,16,8192,8192,bf16,NVIDIA GeForce RTX 4060,c11,32,128,32,4,2,8,0.0,756.926,558.0800175666809,704.1228723526,3.8479851999779098,0,3,3,0_4_4_r0,0,anchor_skipped
2026-03-02T09:26:53.377939+00:00,B2,llm_style,tune,llm_style_tune_007,2,1024,8192,bf16,NVIDIA GeForce RTX 4060,c00,32,32,32,2,2,8,0.0,0.0,65.5359998345375,229.88127842545498,0.5120000012926758,0,3,3,0_3_4_r0,0,
2026-03-02T09:26:53.468614+00:00,B2,llm_style,tune,llm_style_tune_008,16,2048,8192,bf16,NVIDIA GeForce RTX 4060,c11,32,128,32,4,2,8,0.0,0.0,177.24799364805222,272.6911878585815,3.028925185274726,0,3,3,0_4_4_r0,0,
2026-03-02T09:26:53.509122+00:00,B2,llm_style,tune,llm_style_tune_009,4,4096,2048,bf16,NVIDIA GeForce RTX 4060,c11,32,128,32,4,2,8,0.0,0.0,56.223999708890915,140.88671848177898,1.1935981848937693,0,3,3,0_4_4_r0,0,
2026-03-02T09:26:53.669143+00:00,B2,llm_style,tune,llm_style_tune_010,64,8192,4096,bf16,NVIDIA GeForce RTX 4060,c04,64,64,64,4,3,8,0.0,0.0,303.79199981689453,350.24895936250687,14.137855172580972,1,3,3,1_4_4_r0,0,
2026-03-02T09:26:53.710962+00:00,B2,llm_style,tune,llm_style_tune_011,16,8192,1024,bf16,NVIDIA GeForce RTX 4060,c00,32,32,32,2,2,8,0.0,0.0,81.64800330996513,159.30367812514305,3.287716112063667,0,3,3,0_4_3_r0,0,
2026-03-02T09:26:53.754629+00:00,B2,llm_style,tune,llm_style_tune_012,2,8192,1024,bf16,NVIDIA GeForce RTX 4060,c00,32,32,32,2,2,8,0.0,0.0,49.15200173854828,147.72223785519594,0.6826666425201637,0,3,3,0_4_3_r0,0,
2026-03-02T09:26:53.836047+00:00,B2,llm_style,tune,llm_style_tune_013,16,8192,2048,bf16,NVIDIA GeForce RTX 4060,c11,32,128,32,4,2,8,0.0,0.0,163.1999984383583,283.8000020384788,3.2896502275567094,0,3,3,0_4_4_r0,0,
2026-03-02T09:26:53.952308+00:00,B2,llm_style,tune,llm_style_tune_014,8,4096,4096,bf16,NVIDIA GeForce RTX 4060,c11,32,128,32,4,2,8,0.0,0.0,165.8879965543747,222.095364332199,1.6181728731169065,0,3,3,0_4_4_r0,0,
2026-03-02T09:26:53.964780+00:00,B2,llm_style,tune,llm_style_tune_015,64,1024,1024,bf16,NVIDIA GeForce RTX 4060,c04,64,64,64,4,3,8,0.0,0.0,42.67200082540512,108.48352164030072,3.1453347723056,1,3,3,1_3_3_r0,0,
2026-03-02T09:26:54.131052+00:00,B2,llm_style,tune,llm_style_tune_016,16,4096,8192,bf16,NVIDIA GeForce RTX 4060,c11,32,128,32,4,2,8,0.0,0.0,296.9599962234497,324.7231972217559,3.6157793563280327,0,3,3,0_4_4_r0,0,
2026-03-02T09:26:54.213841+00:00,B2,llm_style,tune,llm_style_tune_017,1,4096,4096,bf16,NVIDIA GeForce RTX 4060,c11,32,128,32,4,2,8,0.0,0.0,160.76800227165222,218.89152497053146,0.2087133728470579,0,3,3,0_4_4_r0,0,
2026-03-02T09:26:54.297949+00:00,B2,llm_style,tune,llm_style_tune_018,64,4096,4096,bf16,NVIDIA GeForce RTX 4060,c04,64,64,64,4,3,8,0.0,0.0,167.92000085115433,236.95646956562976,12.788730568811438,1,3,3,1_4_4_r0,0,
2026-03-02T09:26:54.381117+00:00,B2,llm_style,tune,llm_style_tune_019,64,8192,2048,bf16,NVIDIA GeForce RTX 4060,c04,64,64,64,4,3,8,0.0,0.0,166.9120043516159,179.7139172255993,12.865962854751436,1,3,3,1_4_4_r0,0,
2026-03-02T09:26:54.422703+00:00,B2,llm_style,tune,llm_style_tune_020,8,2048,4096,bf16,NVIDIA GeForce RTX 4060,c11,32,128,32,4,2,8,0.0,0.0,79.80800047516823,100.67968048155302,1.6817578087520315,0,3,3,0_4_4_r0,0,
2026-03-02T09:26:54.435117+00:00,B2,llm_style,tune,llm_style_tune_021,8,1024,2048,bf16,NVIDIA GeForce RTX 4060,c00,32,32,32,2,2,8,0.0,0.0,63.759997487068176,143.6876763403415,0.526261501293276,0,3,3,0_3_4_r0,0,
2026-03-02T09:26:54.474537+00:00,B2,llm_style,tune,llm_style_tune_022,8,8192,1024,bf16,NVIDIA GeForce RTX 4060,c00,32,32,32,2,2,8,0.0,0.0,53.05599980056286,84.69248086214057,2.529737042078625,0,3,3,0_4_3_r0,0,
2026-03-02T09:26:54.635282+00:00,B2,llm_style,tune,llm_style_tune_023,1,4096,8192,bf16,NVIDIA GeForce RTX 4060,c11,32,128,32,4,2,8,0.0,0.0,295.6959903240204,415.4934483766554,0.22695222862664743,0,3,3,0_4_4_r0,0,
2026-03-02T09:26:54.795533+00:00,B2,llm_style,tune,llm_style_tune_024,2,8192,4096,bf16,NVIDIA GeForce RTX 4060,c11,32,128,32,4,2,8,0.0,0.0,291.83998703956604,323.38944107294077,0.4599017748099184,0,3,3,0_4_4_r0,0,
2026-03-02T09:26:54.882393+00:00,B2,llm_style,tune,llm_style_tune_025,2,4096,4096,bf16,NVIDIA GeForce RTX 4060,c11,32,128,32,4,2,8,0.0,0.0,159.743994474411,179.68480065464973,0.4201025786340281,0,3,3,0_4_4_r0,0,
2026-03-02T09:26:54.898080+00:00,B2,llm_style,tune,llm_style_tune_026,4,2048,1024,bf16,NVIDIA GeForce RTX 4060,c00,32,32,32,2,2,8,0.0,0.0,50.175998359918594,57.88672097027302,0.334367357868098,0,3,3,0_4_3_r0,0,
2026-03-02T09:26:54.945338+00:00,B2,llm_style,tune,llm_style_tune_027,64,2048,4096,bf16,NVIDIA GeForce RTX 4060,c04,64,64,64,4,3,8,0.0,0.0,102.91199758648872,192.0512017607689,10.433592284491533,1,3,3,1_4_4_r0,0,
2026-03-02T09:26:54.966311+00:00,B2,llm_style,tune,llm_style_tune_028,32,1024,4096,bf16,NVIDIA GeForce RTX 4060,c04,64,64,64,4,3,8,0.0,0.0,63.920000568032265,143.6863978207111,4.19955340448245,0,3,3,1_3_4_r0,0,
2026-03-02T09:26:54.979942+00:00,B2,llm_style,tune,llm_style_tune_029,32,2048,1024,bf16,NVIDIA GeForce RTX 4060,c04,64,64,64,4,3,8,0.0,0.0,74.16000217199326,257.72383466362925,1.8098398606936357,0,3,3,1_4_3_r0,0,
2026-03-02T09:26:55.001470+00:00,B2,llm_style,tune,llm_style_tune_030,4,2048,2048,bf16,NVIDIA GeForce RTX 4060,c11,32,128,32,4,2,8,0.0,0.0,76.59200206398964,174.76703792810434,0.4380931571937051,0,3,3,0_4_4_r0,0,
2026-03-02T09:26:55.329634+00:00,B2,llm_style,tune,llm_style_tune_031,1,8192,8192,bf16,NVIDIA GeForce RTX 4060,c11,32,128,32,4,2,8,0.0,0.0,582.6560258865356,598.505619764328,0.23035499855301775,0,3,3,0_4_4_r0,0,
2026-03-02T09:26:55.352620+00:00,B2,llm_style,eval,llm_style_eval_000,2,1024,4096,bf16,NVIDIA GeForce RTX 4060,c00,32,32,32,2,2,8,0.0,0.0,108.0319993197918,202.5497642159461,0.15529857917686768,0,3,3,0_3_4_r0,0,
2026-03-02T09:26:55.673053+00:00,B2,llm_style,eval,llm_style_eval_001,2,8192,8192,bf16,NVIDIA GeForce RTX 4060,c11,32,128,32,4,2,8,0.0,0.0,573.3599960803986,608.802552819252,0.4681796041493607,0,3,3,0_4_4_r0,0,
2026-03-02T09:26:55.693105+00:00,B2,llm_style,eval,llm_style_eval_002,2,2048,2048,bf16,NVIDIA GeForce RTX 4060,c11,32,128,32,4,2,8,0.0,0.0,95.69600224494934,148.06431785225868,0.175317835713304,0,3,3,0_4_4_r0,0,
2026-03-02T09:26:55.744841+00:00,B2,llm_style,eval,llm_style_eval_003,8,1024,8192,bf16,NVIDIA GeForce RTX 4060,c00,32,32,32,2,2,8,0.0,0.0,140.28799533843994,208.72191980481142,0.9567299587980025,0,3,3,0_3_4_r0,0,
2026-03-02T09:26:55.835491+00:00,B2,llm_style,eval,llm_style_eval_004,64,2048,8192,bf16,NVIDIA GeForce RTX 4060,c04,64,64,64,4,3,8,0.0,0.0,282.0480018854141,376.5350443124771,7.6138942082363865,1,3,3,1_4_4_r0,0,
2026-03-02T09:26:56.221904+00:00,B2,llm_style,eval,llm_style_eval_005,1,8192,8192,bf16,NVIDIA GeForce RTX 4060,c11,32,128,32,4,2,8,0.0,0.0,906.2239825725555,1093.365794420242,0.14810657252635007,0,3,3,0_4_4_r0,0,
2026-03-02T09:26:56.277699+00:00,B2,llm_style,eval,llm_style_eval_006,1,1024,8192,bf16,NVIDIA GeForce RTX 4060,c00,32,32,32,2,2,8,0.0,0.0,181.2479943037033,253.50624173879618,0.0925649746605621,0,3,3,0_3_4_r0,0,
2026-03-02T09:26:56.448880+00:00,B2,llm_style,eval,llm_style_eval_007,2,8192,4096,bf16,NVIDIA GeForce RTX 4060,c11,32,128,32,4,2,8,0.0,0.0,472.06398844718933,685.3119891881939,0.2843210481729326,0,3,3,0_4_4_r0,0,
2026-03-02T09:26:56.496140+00:00,B2,llm_style,eval,llm_style_eval_008,16,2048,4096,bf16,NVIDIA GeForce RTX 4060,c11,32,128,32,4,2,8,0.0,0.0,159.69599783420563,220.38528010249132,1.6809153619409192,0,3,3,0_4_4_r0,0,
2026-03-02T09:26:56.594569+00:00,B2,llm_style,eval,llm_style_eval_009,32,2048,8192,bf16,NVIDIA GeForce RTX 4060,c04,64,64,64,4,3,8,0.0,0.0,325.6320059299469,364.9126440286635,3.2974087449837275,0,3,3,1_4_4_r0,0,
2026-03-02T09:26:56.662663+00:00,B2,llm_style,eval,llm_style_eval_010,1,1024,1024,bf16,NVIDIA GeForce RTX 4060,c00,32,32,32,2,2,8,0.0,68.029,50.175998359918594,120.89343987405299,0.04179591973351225,0,3,3,0_3_3_r0,0,anchor_skipped
2026-03-02T09:26:56.757024+00:00,B2,llm_style,eval,llm_style_eval_011,16,2048,8192,bf16,NVIDIA GeForce RTX 4060,c11,32,128,32,4,2,8,0.0,0.0,351.23199224472046,448.384009003639,1.5285364768991085,0,3,3,0_4_4_r0,0,
2026-03-02T09:26:57.100441+00:00,B2,llm_style,eval,llm_style_eval_012,8,8192,8192,bf16,NVIDIA GeForce RTX 4060,c11,32,128,32,4,2,8,0.0,0.0,926.71999335289,1063.9769554138184,1.1586475221228176,0,3,3,0_4_4_r0,0,
2026-03-02T09:26:57.281754+00:00,B2,llm_style,eval,llm_style_eval_013,32,4096,8192,bf16,NVIDIA GeForce RTX 4060,c04,64,64,64,4,3,8,0.0,0.0,551.9359707832336,662.5529450178146,3.890820243066562,0,3,3,1_4_4_r0,0,
2026-03-02T09:26:57.292937+00:00,B2,llm_style,eval,llm_style_eval_014,64,1024,1024,bf16,NVIDIA GeForce RTX 4060,c04,64,64,64,4,3,8,0.0,0.0,78.84799689054489,157.5833572447299,1.7022338333631757,1,3,3,1_3_3_r0,0,
2026-03-02T09:26:57.307103+00:00,B2,llm_style,eval,llm_style_eval_015,16,2048,1024,bf16,NVIDIA GeForce RTX 4060,c00,32,32,32,2,2,8,0.0,0.0,78.84799689054489,160.94720125198359,0.8511169166815878,0,3,3,0_4_3_r0,0,
2026-03-02T09:26:57.357750+00:00,B2,llm_style,eval,llm_style_eval_016,2,1024,8192,bf16,NVIDIA GeForce RTX 4060,c00,32,32,32,2,2,8,0.0,0.0,211.96800470352173,272.967671751976,0.15829951339558235,0,3,3,0_3_4_r0,0,
2026-03-02T09:26:57.693426+00:00,B2,llm_style,eval,llm_style_eval_017,4,8192,8192,bf16,NVIDIA GeForce RTX 4060,c11,32,128,32,4,2,8,0.0,0.0,912.1280014514923,1066.772494316101,0.5885916353249365,0,3,3,0_4_4_r0,0,
2026-03-02T09:26:57.717080+00:00,B2,llm_style,eval,llm_style_eval_018,4,1024,4096,bf16,NVIDIA GeForce RTX 4060,c00,32,32,32,2,2,8,0.0,0.0,129.02399897575378,265.0537613034248,0.2600634941279843,0,3,3,0_3_4_r0,0,
2026-03-02T09:26:57.766004+00:00,B2,llm_style,eval,llm_style_eval_019,8,4096,2048,bf16,NVIDIA GeForce RTX 4060,c11,32,128,32,4,2,8,0.0,0.0,125.95200538635254,227.04128220677364,1.065625970688539,0,3,3,0_4_4_r0,0,
2026-03-02T09:26:57.825225+00:00,B2,llm_style,eval,llm_style_eval_020,64,4096,2048,bf16,NVIDIA GeForce RTX 4060,c04,64,64,64,4,3,8,0.0,0.0,174.5920032262802,276.98879927396774,6.150005751456871,1,3,3,1_4_4_r0,0,
2026-03-02T09:26:57.996050+00:00,B2,llm_style,eval,llm_style_eval_021,1,4096,8192,bf16,NVIDIA GeForce RTX 4060,c11,32,128,32,4,2,8,0.0,0.0,474.62400794029236,490.85504472255707,0.14139374089235346,0,3,3,0_4_4_r0,0,
2026-03-02T09:26:58.021257+00:00,B2,llm_style,eval,llm_style_eval_022,32,1024,4096,bf16,NVIDIA GeForce RTX 4060,c04,64,64,64,4,3,8,0.0,0.0,145.92000097036362,252.38495498895645,1.8396070053105282,0,3,3,1_3_4_r0,0,
2026-03-02T09:26:58.032231+00:00,B2,llm_style,eval,llm_style_eval_023,4,1024,1024,bf16,NVIDIA GeForce RTX 4060,c00,32,32,32,2,2,8,0.0,0.0,81.7440003156662,156.65855959057805,0.10262047327762508,0,3,3,0_3_3_r0,0,
2026-03-02T09:26:58.056580+00:00,B2,llm_style,eval,llm_style_eval_024,64,2048,2048,bf16,NVIDIA GeForce RTX 4060,c04,64,64,64,4,3,8,0.0,0.0,112.64000087976456,175.71647539734835,4.766254508228145,1,3,3,1_4_4_r0,0,
2026-03-02T09:26:58.468847+00:00,B2,llm_style,eval,llm_style_eval_025,32,8192,8192,bf16,NVIDIA GeForce RTX 4060,c04,64,64,64,4,3,8,0.0,0.0,1310.7199668884277,1413.0525219440458,3.2768000827789328,0,3,3,1_4_4_r0,0,
2026-03-02T09:26:58.528349+00:00,B2,llm_style,eval,llm_style_eval_026,4,2048,4096,bf16,NVIDIA GeForce RTX 4060,c11,32,128,32,4,2,8,0.0,0.0,202.7519941329956,315.01311868429184,0.33098990856770466,0,3,3,0_4_4_r0,0,
2026-03-02T09:26:58.617716+00:00,B2,llm_style,eval,llm_style_eval_027,8,8192,2048,bf16,NVIDIA GeForce RTX 4060,c11,32,128,32,4,2,8,0.0,0.0,257.00800120830536,351.41632705926895,1.0444634203525542,0,3,3,0_4_4_r0,0,
2026-03-02T09:26:58.797555+00:00,B2,llm_style,eval,llm_style_eval_028,8,4096,8192,bf16,NVIDIA GeForce RTX 4060,c11,32,128,32,4,2,8,0.0,0.0,481.27999901771545,502.08095610141754,1.1155063852554536,0,3,3,0_4_4_r0,0,
2026-03-02T09:26:58.822932+00:00,B2,llm_style,eval,llm_style_eval_029,8,2048,2048,bf16,NVIDIA GeForce RTX 4060,c11,32,128,32,4,2,8,0.0,0.0,115.7120019197464,161.9660787284373,0.5799645921478762,0,3,3,0_4_4_r0,0,
2026-03-02T09:26:58.872638+00:00,B2,llm_style,eval,llm_style_eval_030,1,4096,2048,bf16,NVIDIA GeForce RTX 4060,c11,32,128,32,4,2,8,0.0,0.0,128.4320056438446,281.54624849557865,0.13063111422961796,0,3,3,0_4_4_r0,0,
2026-03-02T09:26:58.962399+00:00,B2,llm_style,eval,llm_style_eval_031,16,8192,2048,bf16,NVIDIA GeForce RTX 4060,c11,32,128,32,4,2,8,0.0,0.0,256.400004029274,275.1180875301361,2.0938802791075766,0,3,3,0_4_4_r0,0,
2026-03-02T09:26:58.992004+00:00,B2,llm_style,eval,llm_style_eval_032,1,2048,2048,bf16,NVIDIA GeForce RTX 4060,c11,32,128,32,4,2,8,0.0,0.0,115.7120019197464,222.14304327964783,0.07249557401848453,0,3,3,0_4_4_r0,0,
2026-03-02T09:26:59.171339+00:00,B2,llm_style,eval,llm_style_eval_033,16,8192,4096,bf16,NVIDIA GeForce RTX 4060,c11,32,128,32,4,2,8,0.0,0.0,486.3999933004379,748.3903962373731,2.207528451458622,0,3,3,0_4_4_r0,0,
2026-03-02T09:26:59.194682+00:00,B2,llm_style,eval,llm_style_eval_034,16,1024,4096,bf16,NVIDIA GeForce RTX 4060,c00,32,32,32,2,2,8,0.0,0.0,134.09599661827087,201.16480439901332,1.0009077928111132,0,3,3,0_3_4_r0,0,
2026-03-02T09:26:59.285946+00:00,B2,llm_style,eval,llm_style_eval_035,4,8192,2048,bf16,NVIDIA GeForce RTX 4060,c11,32,128,32,4,2,8,0.0,0.0,252.86400318145752,384.97696340084065,0.5307901730231017,0,3,3,0_4_4_r0,0,
2026-03-02T09:26:59.341656+00:00,B2,llm_style,eval,llm_style_eval_036,2,2048,4096,bf16,NVIDIA GeForce RTX 4060,c11,32,128,32,4,2,8,0.0,0.0,206.1759978532791,357.3337611556051,0.16274654833429406,0,3,3,0_4_4_r0,0,
2026-03-02T09:26:59.355732+00:00,B2,llm_style,eval,llm_style_eval_037,2,1024,1024,bf16,NVIDIA GeForce RTX 4060,c00,32,32,32,2,2,8,0.0,0.0,67.98399984836578,147.3948809504509,0.06169545789237383,0,3,3,0_3_3_r0,0,
2026-03-02T09:26:59.545601+00:00,B2,llm_style,eval,llm_style_eval_038,64,4096,8192,bf16,NVIDIA GeForce RTX 4060,c04,64,64,64,4,3,8,0.0,0.0,621.5680241584778,748.7897676229477,6.909890999967102,1,3,3,1_4_4_r0,0,
2026-03-02T09:26:59.559955+00:00,B2,llm_style,eval,llm_style_eval_039,4,1024,2048,bf16,NVIDIA GeForce RTX 4060,c00,32,32,32,2,2,8,0.0,0.0,77.82400026917458,124.31359723210326,0.2155789466227851,0,3,3,0_3_4_r0,0,
2026-03-02T09:26:59.610996+00:00,B2,llm_style,eval,llm_style_eval_040,64,8192,1024,bf16,NVIDIA GeForce RTX 4060,c04,64,64,64,4,3,8,0.0,0.0,177.15199291706085,256.99263721704483,6.061133190314744,1,3,3,1_4_3_r0,0,
2026-03-02T09:26:59.623325+00:00,B2,llm_style,eval,llm_style_eval_041,2,2048,1024,bf16,NVIDIA GeForce RTX 4060,c00,32,32,32,2,2,8,0.0,0.0,57.8560009598732,67.58400052785873,0.14499114803696905,0,3,3,0_4_3_r0,0,
2026-03-02T09:26:59.666756+00:00,B2,llm_style,eval,llm_style_eval_042,2,4096,2048,bf16,NVIDIA GeForce RTX 4060,c11,32,128,32,4,2,8,0.0,0.0,119.80800330638885,168.09791311621652,0.28006836833921833,0,3,3,0_4_4_r0,0,
2026-03-02T09:26:59.680268+00:00,B2,llm_style,eval,llm_style_eval_043,1,2048,1024,bf16,NVIDIA GeForce RTX 4060,c00,32,32,32,2,2,8,0.0,0.0,56.832000613212585,151.17311522364614,0.07380180100548646,0,3,3,0_4_3_r0,0,
2026-03-02T09:26:59.782835+00:00,B2,llm_style,eval,llm_style_eval_044,8,2048,8192,bf16,NVIDIA GeForce RTX 4060,c11,32,128,32,4,2,8,0.0,0.0,432.12801218032837,549.6115010976791,0.6211942952866963,0,3,3,0_4_4_r0,0,
2026-03-02T09:26:59.829230+00:00,B2,llm_style,eval,llm_style_eval_045,1,8192,1024,bf16,NVIDIA GeForce RTX 4060,c00,32,32,32,2,2,8,0.0,0.0,93.6960019171238,300.00223636627186,0.17906010562584967,0,3,3,0_4_3_r0,0,
2026-03-02T09:26:59.858512+00:00,B2,llm_style,eval,llm_style_eval_046,64,4096,1024,bf16,NVIDIA GeForce RTX 4060,c04,64,64,64,4,3,8,0.0,0.0,110.49599945545197,185.54687857627852,4.858736195390016,1,3,3,1_4_3_r0,0,
2026-03-02T09:26:59.882049+00:00,B2,llm_style,eval,llm_style_eval_047,16,2048,2048,bf16,NVIDIA GeForce RTX 4060,c11,32,128,32,4,2,8,0.0,0.0,116.54400080442429,200.2431969344616,1.1516485368065792,0,3,3,0_4_4_r0,0,
2026-03-02T09:27:00.061629+00:00,B2,llm_style,eval,llm_style_eval_048,8,8192,4096,bf16,NVIDIA GeForce RTX 4060,c11,32,128,32,4,2,8,0.0,0.0,475.5520075559616,571.4329600334167,1.1289425835024416,0,3,3,0_4_4_r0,0,
2026-03-02T09:27:00.235940+00:00,B2,llm_style,eval,llm_style_eval_049,4,4096,8192,bf16,NVIDIA GeForce RTX 4060,c11,32,128,32,4,2,8,0.0,0.0,482.81601071357727,607.0767921209335,0.5559787787552161,0,3,3,0_4_4_r0,0,
2026-03-02T09:27:00.344608+00:00,B2,llm_style,eval,llm_style_eval_050,4,2048,8192,bf16,NVIDIA GeForce RTX 4060,c11,32,128,32,4,2,8,0.0,0.0,523.7759947776794,632.0947027206421,0.25625024693422555,0,3,3,0_4_4_r0,0,
2026-03-02T09:27:00.355110+00:00,B2,llm_style,eval,llm_style_eval_051,16,1024,1024,bf16,NVIDIA GeForce RTX 4060,c00,32,32,32,2,2,8,0.0,0.0,70.43199986219406,157.235197275877,0.476408905975295,0,3,3,0_3_3_r0,0,
2026-03-02T09:27:00.592722+00:00,B2,llm_style,eval,llm_style_eval_052,32,8192,4096,bf16,NVIDIA GeForce RTX 4060,c04,64,64,64,4,3,8,0.0,0.0,796.4960038661957,938.1955307722089,2.6961637441695916,0,3,3,1_4_4_r0,0,
2026-03-02T09:27:00.614479+00:00,B2,llm_style,eval,llm_style_eval_053,32,1024,2048,bf16,NVIDIA GeForce RTX 4060,c04,64,64,64,4,3,8,0.0,0.0,131.95200264453888,158.76895815134048,1.0171708296202575,0,3,3,1_3_4_r0,0,
2026-03-02T09:27:00.717784+00:00,B2,llm_style,eval,llm_style_eval_054,64,8192,2048,bf16,NVIDIA GeForce RTX 4060,c04,64,64,64,4,3,8,0.0,0.0,432.12801218032837,488.10849905014027,4.969554362293571,1,3,3,1_4_4_r0,0,
2026-03-02T09:27:00.737860+00:00,B2,llm_style,eval,llm_style_eval_055,1,4096,1024,bf16,NVIDIA GeForce RTX 4060,c00,32,32,32,2,2,8,0.0,0.0,89.08800035715103,149.52447846531868,0.09416091916274166,0,3,3,0_4_3_r0,0,
2026-03-02T09:27:00.762275+00:00,B2,llm_style,eval,llm_style_eval_056,4,2048,2048,bf16,NVIDIA GeForce RTX 4060,c11,32,128,32,4,2,8,0.0,0.0,154.11200374364853,275.034235715866,0.2177275694618492,0,3,3,0_4_4_r0,0,
2026-03-02T09:27:00.823217+00:00,B2,llm_style,eval,llm_style_eval_057,16,1024,8192,bf16,NVIDIA GeForce RTX 4060,c00,32,32,32,2,2,8,0.0,0.0,313.32799792289734,338.04287523031235,0.8567234903344184,0,3,3,0_3_4_r0,0,
2026-03-02T09:27:00.995526+00:00,B2,llm_style,eval,llm_style_eval_058,1,8192,4096,bf16,NVIDIA GeForce RTX 4060,c11,32,128,32,4,2,8,0.0,0.0,480.25599122047424,568.3916825056075,0.13973561023040293,0,3,3,0_4_4_r0,0,
2026-03-02T09:27:01.017724+00:00,B2,llm_style,eval,llm_style_eval_059,8,4096,1024,bf16,NVIDIA GeForce RTX 4060,c00,32,32,32,2,2,8,0.0,0.0,91.0400003194809,185.31328268349142,0.7371360255327232,0,3,3,0_4_3_r0,0,
2026-03-02T09:27:01.197609+00:00,B2,llm_style,eval,llm_style_eval_060,4,8192,4096,bf16,NVIDIA GeForce RTX 4060,c11,32,128,32,4,2,8,0.0,0.0,484.3519926071167,518.6588686704636,0.5542156532795398,0,3,3,0_4_4_r0,0,
2026-03-02T09:27:01.225691+00:00,B2,llm_style,eval,llm_style_eval_061,32,2048,2048,bf16,NVIDIA GeForce RTX 4060,c04,64,64,64,4,3,8,0.0,0.0,185.2639988064766,247.07071408629412,1.4489348050853788,0,3,3,1_4_4_r0,0,
2026-03-02T09:27:01.239544+00:00,B2,llm_style,eval,llm_style_eval_062,8,2048,1024,bf16,NVIDIA GeForce RTX 4060,c00,32,32,32,2,2,8,0.0,0.0,73.05600121617317,169.3967966735363,0.4592974080351349,0,3,3,0_4_3_r0,0,
2026-03-02T09:27:01.424304+00:00,B2,llm_style,eval,llm_style_eval_063,16,4096,8192,bf16,NVIDIA GeForce RTX 4060,c11,32,128,32,4,2,8,0.0,0.0,624.127984046936,724.6745628118515,1.7203872465991719,0,3,3,0_4_4_r0,0,
2026-03-02T09:27:01.639229+00:00,B2,training_style,tune,training_style_tune_000,4096,2048,1024,bf16,NVIDIA GeForce RTX 4060,c06,64,128,32,4,3,8,0.0,0.0,3084.2559337615967,3161.8757677078247,5.570182745193658,3,3,3,4_4_3_r2,0,
2026-03-02T09:27:01.699572+00:00,B2,training_style,tune,training_style_tune_001,1536,2048,1536,bf16,NVIDIA GeForce RTX 4060,c03,64,64,32,4,2,8,0.0,0.0,366.4959967136383,445.7267215847967,26.367754361995704,3,3,3,4_4_4_r1,0,
2026-03-02T09:27:01.897010+00:00,B2,training_style,tune,training_style_tune_002,3072,2048,4096,bf16,NVIDIA GeForce RTX 4060,c03,64,64,32,4,2,8,0.0,0.0,1771.4880108833313,1910.5075216293335,29.093963512798705,3,3,3,4_4_4_r1,0,
2026-03-02T09:27:01.956536+00:00,B2,training_style,tune,training_style_tune_003,2048,1536,2048,bf16,NVIDIA GeForce RTX 4060,c03,64,64,32,4,2,8,0.0,0.0,422.2400039434433,562.7577435970306,30.51558774077186,3,3,3,4_4_4_r1,0,
2026-03-02T09:27:01.967572+00:00,B2,training_style,tune,training_style_tune_004,512,512,1024,bf16,NVIDIA GeForce RTX 4060,c11,32,128,32,4,2,8,0.0,0.0,54.99199964106083,169.62751775979984,9.762709403262635,2,2,3,3_3_3_r1,0,
2026-03-02T09:27:02.502847+00:00,B2,training_style,tune,training_style_tune_005,1024,1536,1536,bf16,NVIDIA GeForce RTX 4060,c07,128,128,32,8,3,8,0.0,535.226,176.12800002098083,195.28704270720476,27.43367441533668,3,3,3,3_4_4_r1,0,
2026-03-02T09:27:02.692378+00:00,B2,training_style,tune,training_style_tune_006,1024,1536,512,bf16,NVIDIA GeForce RTX 4060,c11,32,128,32,4,2,8,0.0,189.435,83.8559977710247,132.05311961472023,19.206887745798493,3,3,2,3_4_3_r1,0,
2026-03-02T09:27:02.708598+00:00,B2,training_style,tune,training_style_tune_007,2048,1536,512,bf16,NVIDIA GeForce RTX 4060,c03,64,64,32,4,2,8,0.0,0.0,132.09599256515503,144.42495673894882,24.385489744597383,3,3,2,4_4_3_r1,0,
2026-03-02T09:27:02.795132+00:00,B2,training_style,tune,training_style_tune_008,3072,3072,1536,bf16,NVIDIA GeForce RTX 4060,c03,64,64,32,4,2,8,0.0,0.0,885.1519823074341,1048.5059642791748,32.752600488365324,3,3,3,4_4_4_r1,0,
2026-03-02T09:27:02.816386+00:00,B2,training_style,tune,training_style_tune_009,1024,1536,1024,bf16,NVIDIA GeForce RTX 4060,c11,32,128,32,4,2,8,0.0,0.0,139.26400244235992,211.83488070964808,23.130352535525002,3,3,3,3_4_3_r1,0,
2026-03-02T09:27:02.914931+00:00,B2,training_style,tune,training_style_tune_010,1536,2048,4096,bf16,NVIDIA GeForce RTX 4060,c03,64,64,32,4,2,8,0.0,0.0,799.7440099716187,962.4208045005796,32.222565539333665,3,3,3,4_4_4_r1,0,
2026-03-02T09:27:02.966221+00:00,B2,training_style,tune,training_style_tune_011,1024,1024,4096,bf16,NVIDIA GeForce RTX 4060,c09,128,64,64,8,3,8,0.0,0.0,295.3120023012161,357.44800120592106,29.087658222703485,3,3,3,3_3_4_r1,0,
2026-03-02T09:27:03.303515+00:00,B2,training_style,tune,training_style_tune_012,3072,4096,4096,bf16,NVIDIA GeForce RTX 4060,c03,64,64,32,4,2,8,0.0,0.0,3368.9279556274414,3397.1302366256714,30.59703753290923,3,3,3,4_4_4_r1,0,
2026-03-02T09:27:03.578526+00:00,B2,training_style,tune,training_style_tune_013,512,1024,3072,bf16,NVIDIA GeForce RTX 4060,c03,64,64,32,4,2,8,0.0,274.954,142.33599603176117,203.8499177992344,22.631137321589463,2,3,3,3_3_4_r0,0,
2026-03-02T09:27:03.596478+00:00,B2,training_style,tune,training_style_tune_014,1536,1024,1024,bf16,NVIDIA GeForce RTX 4060,c10,64,128,64,8,3,8,0.0,0.0,134.49599593877792,179.33311715722073,23.95034476317265,3,3,3,4_3_3_r1,0,
2026-03-02T09:27:03.659262+00:00,B2,training_style,tune,training_style_tune_015,2048,3072,1536,bf16,NVIDIA GeForce RTX 4060,c03,64,64,32,4,2,8,0.0,0.0,600.9119749069214,684.4518589973447,32.1633677461557,3,3,3,4_4_4_r1,0,
2026-03-02T09:27:05.737404+00:00,B2,training_style,tune,training_style_tune_016,1536,3072,3072,bf16,NVIDIA GeForce RTX 4060,c05,128,64,32,4,3,8,0.0,2078.079,930.7679831981659,1093.5084533691406,31.147428544313865,3,3,3,4_4_4_r0,0,
2026-03-02T09:27:05.770631+00:00,B2,training_style,tune,training_style_tune_017,1024,1024,2048,bf16,NVIDIA GeForce RTX 4060,c09,128,64,64,8,3,8,0.0,0.0,188.1759986281395,197.84864515066147,22.824203550461394,3,3,3,3_3_4_r1,0,
2026-03-02T09:27:05.806886+00:00,B2,training_style,tune,training_style_tune_018,1536,1536,1536,bf16,NVIDIA GeForce RTX 4060,c03,64,64,32,4,2,8,0.0,0.0,255.93601167201996,350.96575945615757,28.318630366436846,3,3,3,4_4_4_r1,0,
2026-03-02T09:27:05.847120+00:00,B2,training_style,tune,training_style_tune_019,1536,1536,2048,bf16,NVIDIA GeForce RTX 4060,c03,64,64,32,4,2,8,0.0,0.0,314.7680014371872,417.17983454465855,30.700949181228676,3,3,3,4_4_4_r1,0,
2026-03-02T09:27:05.874991+00:00,B2,training_style,tune,training_style_tune_020,1536,1536,1024,bf16,NVIDIA GeForce RTX 4060,c03,64,64,32,4,2,8,0.0,0.0,178.56000363826752,190.00320106744766,27.060025255087304,3,3,3,4_4_3_r1,0,
2026-03-02T09:27:05.909418+00:00,B2,training_style,tune,training_style_tune_021,1024,2048,1536,bf16,NVIDIA GeForce RTX 4060,c09,128,64,64,8,3,8,0.0,0.0,230.3999960422516,295.75838893651957,27.96202714699075,3,3,3,3_4_4_r0,0,
2026-03-02T09:27:05.924719+00:00,B2,training_style,tune,training_style_tune_022,512,1024,1536,bf16,NVIDIA GeForce RTX 4060,c03,64,64,32,4,2,8,0.0,0.0,83.50399881601334,98.69568265974522,19.287851585990598,2,3,3,3_3_4_r0,0,
2026-03-02T09:27:05.973850+00:00,B2,training_style,tune,training_style_tune_023,1536,2048,2048,bf16,NVIDIA GeForce RTX 4060,c03,64,64,32,4,2,8,0.0,0.0,411.6480052471161,519.9955135583876,31.300775720424237,3,3,3,4_4_4_r1,0,
2026-03-02T09:27:05.990236+00:00,B2,training_style,tune,training_style_tune_024,1024,1024,1024,bf16,NVIDIA GeForce RTX 4060,c11,32,128,32,4,2,8,0.0,0.0,100.87999701499939,149.70879837870592,21.287507053362624,3,3,3,3_3_3_r1,0,
2026-03-02T09:27:06.755448+00:00,B2,training_style,tune,training_style_tune_025,1536,1024,4096,bf16,NVIDIA GeForce RTX 4060,c04,64,64,64,4,3,8,0.0,765.164,425.26400089263916,490.1139250397682,30.298595368886826,3,3,3,4_3_4_r1,0,
2026-03-02T09:27:07.352083+00:00,B2,training_style,tune,training_style_tune_026,2048,4096,512,bf16,NVIDIA GeForce RTX 4060,c05,128,64,32,4,3,8,0.0,596.574,300.9600043296814,343.10496032238,28.541781194920194,3,3,2,4_4_3_r0,0,
2026-03-02T09:27:07.502224+00:00,B2,training_style,tune,training_style_tune_027,4096,4096,1536,bf16,NVIDIA GeForce RTX 4060,c03,64,64,32,4,2,8,0.0,0.0,1611.7759943008423,1623.121610879898,31.976904814466415,3,3,3,4_4_4_r1,0,
2026-03-02T09:27:07.592726+00:00,B2,training_style,tune,training_style_tune_028,1536,1536,4096,bf16,NVIDIA GeForce RTX 4060,c03,64,64,32,4,2,8,0.0,0.0,608.2240045070648,734.1260600090025,31.776701821664954,3,3,3,4_4_4_r1,0,
2026-03-02T09:27:09.793214+00:00,B2,training_style,tune,training_style_tune_029,4096,2048,2048,bf16,NVIDIA GeForce RTX 4060,c04,64,64,64,4,3,8,0.0,2200.424,1098.7520217895508,1256.6976118087766,31.271604226072665,3,3,3,4_4_4_r2,0,
2026-03-02T09:27:09.821246+00:00,B2,training_style,tune,training_style_tune_030,2048,2048,512,bf16,NVIDIA GeForce RTX 4060,c03,64,64,32,4,2,8,0.0,0.0,166.703999042511,225.3107254207133,25.764032780669798,3,3,2,4_4_3_r1,0,
2026-03-02T09:27:09.836343+00:00,B2,training_style,tune,training_style_tune_031,512,512,1536,bf16,NVIDIA GeForce RTX 4060,c09,128,64,64,8,3,8,0.0,0.0,70.65600156784058,83.84159751236439,11.397564964481928,2,2,3,3_3_4_r1,0,
2026-03-02T09:27:09.911271+00:00,B2,training_style,eval,training_style_eval_000,2048,1536,3072,bf16,NVIDIA GeForce RTX 4060,c03,64,64,32,4,2,8,0.0,0.0,604.0320098400116,698.8902193307874,31.99723279088998,3,3,3,4_4_4_r1,0,
2026-03-02T09:27:09.949901+00:00,B2,training_style,eval,training_style_eval_001,1024,2048,2048,bf16,NVIDIA GeForce RTX 4060,c09,128,64,64,8,3,8,0.0,0.0,294.0160036087036,367.7267250418663,29.215874260477555,3,3,3,3_4_4_r0,0,
2026-03-02T09:27:09.996760+00:00,B2,training_style,eval,training_style_eval_002,1536,1024,3072,bf16,NVIDIA GeForce RTX 4060,c04,64,64,64,4,3,8,0.0,0.0,323.5839903354645,437.1731176972389,29.86450722108198,3,3,3,4_3_4_r1,0,
2026-03-02T09:27:10.115033+00:00,B2,training_style,eval,training_style_eval_003,1024,512,1024,bf16,NVIDIA GeForce RTX 4060,c04,64,64,64,4,3,8,0.0,118.215,66.56000018119812,73.62624138593674,16.13193841762204,3,2,3,3_3_3_r2,0,
2026-03-02T09:27:10.138092+00:00,B2,training_style,eval,training_style_eval_004,1024,2048,1024,bf16,NVIDIA GeForce RTX 4060,c06,64,128,32,4,3,8,0.0,0.0,156.67200088500977,167.82592371106148,27.413751479131957,3,3,3,3_4_3_r0,0,
2026-03-02T09:27:10.157279+00:00,B2,training_style,eval,training_style_eval_005,1024,512,1536,bf16,NVIDIA GeForce RTX 4060,c04,64,64,64,4,3,8,0.0,0.0,69.66400146484375,156.2931244075298,23.119727580001314,3,2,3,3_3_4_r2,0,
2026-03-02T09:27:10.205375+00:00,B2,training_style,eval,training_style_eval_006,2048,1536,2048,bf16,NVIDIA GeForce RTX 4060,c03,64,64,32,4,2,8,0.0,0.0,413.1840020418167,435.74143409729004,31.184416202774397,3,3,3,4_4_4_r1,0,
2026-03-02T09:27:10.234064+00:00,B2,training_style,eval,training_style_eval_007,1536,2048,1024,bf16,NVIDIA GeForce RTX 4060,c03,64,64,32,4,2,8,0.0,0.0,246.2719976902008,301.9785639643668,26.159900453255414,3,3,3,4_4_3_r1,0,
2026-03-02T09:27:10.247539+00:00,B2,training_style,eval,training_style_eval_008,512,512,2048,bf16,NVIDIA GeForce RTX 4060,c09,128,64,64,8,3,8,0.0,0.0,78.73599976301193,151.15392327308655,13.63724125218278,2,2,3,3_3_4_r1,0,
2026-03-02T09:27:10.263788+00:00,B2,training_style,eval,training_style_eval_009,1024,512,2048,bf16,NVIDIA GeForce RTX 4060,c04,64,64,64,4,3,8,0.0,0.0,99.64799880981445,119.99231956899163,21.550695183539318,3,2,3,3_3_4_r2,0,
2026-03-02T09:27:10.304416+00:00,B2,training_style,eval,training_style_eval_010,2048,3072,1024,bf16,NVIDIA GeForce RTX 4060,c03,64,64,32,4,2,8,0.0,0.0,410.5599969625473,439.08160328865046,31.38372462813372,3,3,3,4_4_3_r1,0,
2026-03-02T09:27:10.392193+00:00,B2,training_style,eval,training_style_eval_011,2048,4096,1536,bf16,NVIDIA GeForce RTX 4060,c05,128,64,32,4,3,8,0.0,0.0,795.5040037631989,818.1151926517487,32.39431059315071,3,3,3,4_4_4_r0,0,
2026-03-02T09:27:10.520575+00:00,B2,training_style,eval,training_style_eval_012,2048,3072,3072,bf16,NVIDIA GeForce RTX 4060,c03,64,64,32,4,2,8,0.0,0.0,1264.079988002777,1310.8633863925934,30.579319371295263,3,3,3,4_4_4_r1,0,
2026-03-02T09:27:10.589476+00:00,B2,training_style,eval,training_style_eval_013,3072,1536,1536,bf16,NVIDIA GeForce RTX 4060,c04,64,64,64,4,3,8,0.0,0.0,484.68799889087677,629.1542321443557,29.90689816370621,3,3,3,4_4_4_r2,0,
2026-03-02T09:27:10.631436+00:00,B2,training_style,eval,training_style_eval_014,2048,1536,1536,bf16,NVIDIA GeForce RTX 4060,c03,64,64,32,4,2,8,0.0,0.0,326.06400549411774,424.4319930672642,29.6373603132172,3,3,3,4_4_4_r1,0,
2026-03-02T09:27:10.690632+00:00,B2,training_style,eval,training_style_eval_015,4096,2048,1024,bf16,NVIDIA GeForce RTX 4060,c06,64,128,32,4,3,8,0.0,0.0,538.1119847297668,615.5449700355528,31.92619690978917,3,3,3,4_4_3_r2,0,
2026-03-02T09:27:10.708759+00:00,B2,training_style,eval,training_style_eval_016,2048,1024,512,bf16,NVIDIA GeForce RTX 4060,c05,128,64,32,4,3,8,0.0,0.0,100.35199671983719,195.55168211460114,21.399510903558273,3,3,2,4_3_3_r2,0,
2026-03-02T09:27:10.833466+00:00,B2,training_style,eval,training_style_eval_017,2048,4096,2048,bf16,NVIDIA GeForce RTX 4060,c05,128,64,32,4,3,8,0.0,0.0,1048.0639934539795,1262.7763307094572,32.784008021079615,3,3,3,4_4_4_r0,0,
2026-03-02T09:27:10.906843+00:00,B2,training_style,eval,training_style_eval_018,1536,2048,3072,bf16,NVIDIA GeForce RTX 4060,c03,64,64,32,4,2,8,0.0,0.0,605.184018611908,655.8886373043059,31.936323890922562,3,3,3,4_4_4_r1,0,
2026-03-02T09:27:10.965552+00:00,B2,training_style,eval,training_style_eval_019,1536,1536,3072,bf16,NVIDIA GeForce RTX 4060,c03,64,64,32,4,2,8,0.0,0.0,464.7039920091629,478.29056590795517,31.193006458429952,3,3,3,4_4_4_r1,0,
2026-03-02T09:27:11.044211+00:00,B2,training_style,eval,training_style_eval_020,3072,1536,2048,bf16,NVIDIA GeForce RTX 4060,c04,64,64,64,4,3,8,0.0,0.0,608.1919968128204,663.1321722269058,31.778374153693875,3,3,3,4_4_4_r2,0,
2026-03-02T09:27:11.122396+00:00,B2,training_style,eval,training_style_eval_021,2048,1024,4096,bf16,NVIDIA GeForce RTX 4060,c04,64,64,64,4,3,8,0.0,0.0,555.9200048446655,643.2156920433042,30.90349157123852,3,3,3,4_3_4_r2,0,
2026-03-02T09:27:11.139179+00:00,B2,training_style,eval,training_style_eval_022,512,512,1536,bf16,NVIDIA GeForce RTX 4060,c09,128,64,64,8,3,8,0.0,0.0,77.31200009584427,145.27167588472366,10.416317867881514,2,2,3,3_3_4_r1,0,
2026-03-02T09:27:11.477541+00:00,B2,training_style,eval,training_style_eval_023,3072,4096,4096,bf16,NVIDIA GeForce RTX 4060,c03,64,64,32,4,2,8,0.0,0.0,3432.7999353408813,3500.7635068893433,30.02773742879487,3,3,3,4_4_4_r1,0,
2026-03-02T09:27:11.545356+00:00,B2,training_style,eval,training_style_eval_024,1536,1024,4096,bf16,NVIDIA GeForce RTX 4060,c04,64,64,64,4,3,8,0.0,0.0,393.21601390838623,511.3305342197418,32.767998840967856,3,3,3,4_3_4_r1,0,
2026-03-02T09:27:11.698846+00:00,B2,training_style,eval,training_style_eval_025,4096,3072,2048,bf16,NVIDIA GeForce RTX 4060,c03,64,64,32,4,2,8,0.0,0.0,1611.0879778862,1783.7260580062862,31.99056057734454,3,3,3,4_4_4_r1,0,
2026-03-02T09:27:11.716760+00:00,B2,training_style,eval,training_style_eval_026,1024,512,512,bf16,NVIDIA GeForce RTX 4060,c04,64,64,64,4,3,8,0.0,0.0,56.32000043988228,84.75648254156107,9.53250901645629,3,2,2,3_3_3_r2,0,
2026-03-02T09:27:11.774078+00:00,B2,training_style,eval,training_style_eval_027,2048,4096,1024,bf16,NVIDIA GeForce RTX 4060,c05,128,64,32,4,3,8,0.0,0.0,559.1040253639221,656.5730994939802,30.727500437539476,3,3,3,4_4_3_r0,0,
2026-03-02T09:27:11.798865+00:00,B2,training_style,eval,training_style_eval_028,1536,1536,1024,bf16,NVIDIA GeForce RTX 4060,c03,64,64,32,4,2,8,0.0,0.0,173.0400025844574,304.5001620054244,27.923243965751073,3,3,3,4_4_3_r1,0,
2026-03-02T09:27:11.834672+00:00,B2,training_style,eval,training_style_eval_029,1024,512,4096,bf16,NVIDIA GeForce RTX 4060,c04,64,64,64,4,3,8,0.0,0.0,178.17600071430206,241.0495920479297,24.105195305661866,3,2,3,3_3_4_r2,0,
2026-03-02T09:27:11.871849+00:00,B2,training_style,eval,training_style_eval_030,1024,1024,3072,bf16,NVIDIA GeForce RTX 4060,c09,128,64,64,8,3,8,0.0,0.0,245.18399685621262,291.74783796071995,26.275984675207642,3,3,3,3_3_4_r1,0,
2026-03-02T09:27:11.881095+00:00,B2,training_style,eval,training_style_eval_031,1024,1024,512,bf16,NVIDIA GeForce RTX 4060,c11,32,128,32,4,2,8,0.0,0.0,70.96000015735626,140.4460781812666,15.131649120898256,3,3,2,3_3_3_r1,0,
2026-03-02T09:27:11.892846+00:00,B2,training_style,eval,training_style_eval_032,512,1024,1024,bf16,NVIDIA GeForce RTX 4060,c02,32,64,32,2,2,8,0.0,0.0,89.9839997291565,98.60320180654526,11.932586095659934,2,3,3,3_3_3_r0,0,
2026-03-02T09:27:11.975710+00:00,B2,training_style,eval,training_style_eval_033,3072,2048,2048,bf16,NVIDIA GeForce RTX 4060,c03,64,64,32,4,2,8,0.0,0.0,796.671986579895,924.7247874736784,32.34681802560865,3,3,3,4_4_4_r1,0,
2026-03-02T09:27:11.987462+00:00,B2,training_style,eval,training_style_eval_034,1536,1024,512,bf16,NVIDIA GeForce RTX 4060,c10,64,128,64,8,3,8,0.0,0.0,84.99199897050858,127.05408528447148,18.950168904238474,3,3,2,4_3_3_r1,0,
2026-03-02T09:27:12.402036+00:00,B2,training_style,eval,training_style_eval_035,4096,4096,4096,bf16,NVIDIA GeForce RTX 4060,c03,64,64,32,4,2,8,0.0,0.0,4404.7839641571045,4597.760200500488,31.202200741370568,3,3,3,4_4_4_r1,0,
2026-03-02T09:27:12.635083+00:00,B2,training_style,eval,training_style_eval_036,2048,4096,4096,bf16,NVIDIA GeForce RTX 4060,c05,128,64,32,4,3,8,0.0,0.0,2081.712007522583,2162.739806175232,33.011039225249085,3,3,3,4_4_4_r0,0,
2026-03-02T09:27:12.673337+00:00,B2,training_style,eval,training_style_eval_037,4096,2048,512,bf16,NVIDIA GeForce RTX 4060,c06,64,128,32,4,3,8,0.0,0.0,295.9359884262085,359.41791862249374,29.02632639470916,3,3,2,4_4_3_r2,0,
2026-03-02T09:27:12.694525+00:00,B2,training_style,eval,training_style_eval_038,2048,1536,512,bf16,NVIDIA GeForce RTX 4060,c03,64,64,32,4,2,8,0.0,0.0,130.048006772995,211.96032375097275,24.76951052100939,3,3,2,4_4_3_r1,0,
2026-03-02T09:27:12.789858+00:00,B2,training_style,eval,training_style_eval_039,3072,3072,1536,bf16,NVIDIA GeForce RTX 4060,c03,64,64,32,4,2,8,0.0,0.0,893.1999802589417,972.4214178323746,32.45748979931169,3,3,3,4_4_4_r1,0,
2026-03-02T09:27:12.803561+00:00,B2,training_style,eval,training_style_eval_040,1536,1536,512,bf16,NVIDIA GeForce RTX 4060,c03,64,64,32,4,2,8,0.0,0.0,106.49599879980087,165.1692827790974,22.685538717202185,3,3,2,4_4_3_r1,0,
2026-03-02T09:27:12.923011+00:00,B2,training_style,eval,training_style_eval_041,3072,3072,2048,bf16,NVIDIA GeForce RTX 4060,c03,64,64,32,4,2,8,0.0,0.0,1180.512011051178,1370.104283094406,32.74401725873183,3,3,3,4_4_4_r1,0,
2026-03-02T09:27:13.048186+00:00,B2,training_style,eval,training_style_eval_042,3072,4096,1536,bf16,NVIDIA GeForce RTX 4060,c03,64,64,32,4,2,8,0.0,0.0,1158.0640077590942,1323.9587306976318,33.37872985000077,3,3,3,4_4_4_r1,0,
2026-03-02T09:27:13.123487+00:00,B2,training_style,eval,training_style_eval_043,2048,3072,1536,bf16,NVIDIA GeForce RTX 4060,c03,64,64,32,4,2,8,0.0,0.0,629.6319961547852,667.0524662733078,30.696268534689704,3,3,3,4_4_4_r1,0,
2026-03-02T09:27:13.149308+00:00,B2,training_style,eval,training_style_eval_044,512,512,4096,bf16,NVIDIA GeForce RTX 4060,c09,128,64,64,8,3,8,0.0,0.0,132.09599256515503,201.20576441287974,16.256993163064923,2,2,3,3_3_4_r1,0,
2026-03-02T09:27:13.208181+00:00,B2,training_style,eval,training_style_eval_045,2048,1024,3072,bf16,NVIDIA GeForce RTX 4060,c04,64,64,64,4,3,8,0.0,0.0,429.05598878860474,512.4403259158132,30.03081701383353,3,3,3,4_3_4_r2,0,
2026-03-02T09:27:13.546113+00:00,B2,training_style,eval,training_style_eval_046,4096,3072,4096,bf16,NVIDIA GeForce RTX 4060,c03,64,64,32,4,2,8,0.0,0.0,3315.6639337539673,3430.32986164093,31.088559384634184,3,3,3,4_4_4_r1,0,
2026-03-02T09:27:13.591908+00:00,B2,training_style,eval,training_style_eval_047,1536,3072,1024,bf16,NVIDIA GeForce RTX 4060,c05,128,64,32,4,3,8,0.0,0.0,328.70399951934814,510.17630904912943,29.3993271457933,3,3,3,4_4_3_r0,0,
2026-03-02T09:27:13.614298+00:00,B2,training_style,eval,training_style_eval_048,512,512,3072,bf16,NVIDIA GeForce RTX 4060,c09,128,64,64,8,3,8,0.0,0.0,106.71999678015709,191.02720126509666,15.091948881125418,2,2,3,3_3_4_r1,0,
2026-03-02T09:27:13.648595+00:00,B2,training_style,eval,training_style_eval_049,512,1024,4096,bf16,NVIDIA GeForce RTX 4060,c03,64,64,32,4,2,8,0.0,0.0,182.15999752283096,276.4268761873245,23.577993820853514,2,3,3,3_3_4_r0,0,
2026-03-02T09:27:13.672115+00:00,B2,training_style,eval,training_style_eval_050,3072,2048,512,bf16,NVIDIA GeForce RTX 4060,c03,64,64,32,4,2,8,0.0,0.0,223.60000014305115,238.63295882940292,28.812392396593715,3,3,2,4_4_3_r1,0,
2026-03-02T09:27:13.680521+00:00,B2,training_style,eval,training_style_eval_051,512,512,1024,bf16,NVIDIA GeForce RTX 4060,c11,32,128,32,4,2,8,0.0,0.0,52.22399905323982,65.32927948981522,10.280157049112349,2,2,3,3_3_3_r1,0,
2026-03-02T09:27:13.718033+00:00,B2,training_style,eval,training_style_eval_052,1536,2048,1536,bf16,NVIDIA GeForce RTX 4060,c03,64,64,32,4,2,8,0.0,0.0,317.440003156662,387.2153568267822,30.442528729533855,3,3,3,4_4_4_r1,0,
2026-03-02T09:27:13.819892+00:00,B2,training_style,eval,training_style_eval_053,1536,3072,3072,bf16,NVIDIA GeForce RTX 4060,c05,128,64,32,4,3,8,0.0,0.0,886.2720131874084,1007.2249466180801,32.71120921864159,3,3,3,4_4_4_r0,0,
2026-03-02T09:27:13.867203+00:00,B2,training_style,eval,training_style_eval_054,4096,3072,512,bf16,NVIDIA GeForce RTX 4060,c03,64,64,32,4,2,8,0.0,0.0,434.688001871109,588.5974377393723,29.64172425403301,3,3,2,4_4_3_r1,0,
2026-03-02T09:27:13.884187+00:00,B2,training_style,eval,training_style_eval_055,1024,1024,1024,bf16,NVIDIA GeForce RTX 4060,c11,32,128,32,4,2,8,0.0,0.0,104.44799810647964,171.82879716157905,20.560314098224698,3,3,3,3_3_3_r1,0,
2026-03-02T09:27:13.914050+00:00,B2,training_style,eval,training_style_eval_056,512,1024,3072,bf16,NVIDIA GeForce RTX 4060,c03,64,64,32,4,2,8,0.0,0.0,142.33599603176117,225.54464071989042,22.631137321589463,2,3,3,3_3_4_r0,0,
2026-03-02T09:27:13.932968+00:00,B2,training_style,eval,training_style_eval_057,1024,1536,1024,bf16,NVIDIA GeForce RTX 4060,c11,32,128,32,4,2,8,0.0,0.0,144.3839967250824,265.5027279257774,22.31012816561275,3,3,3,3_4_3_r1,0,
2026-03-02T09:27:14.050117+00:00,B2,training_style,eval,training_style_eval_058,4096,2048,2048,bf16,NVIDIA GeForce RTX 4060,c04,64,64,64,4,3,8,0.0,0.0,1046.3839769363403,1118.1574475765228,32.836644219840124,3,3,3,4_4_4_r2,0,
2026-03-02T09:27:14.082703+00:00,B2,training_style,eval,training_style_eval_059,2048,3072,512,bf16,NVIDIA GeForce RTX 4060,c03,64,64,32,4,2,8,0.0,0.0,222.20799326896667,266.85695707798004,28.99288567086729,3,3,2,4_4_3_r1,0,
2026-03-02T09:27:14.115330+00:00,B2,training_style,eval,training_style_eval_060,3072,3072,512,bf16,NVIDIA GeForce RTX 4060,c03,64,64,32,4,2,8,0.0,0.0,296.9599962234497,438.9753451943394,32.542014206952295,3,3,2,4_4_3_r1,0,
2026-03-02T09:27:14.177635+00:00,B2,training_style,eval,training_style_eval_061,2048,2048,2048,bf16,NVIDIA GeForce RTX 4060,c03,64,64,32,4,2,8,0.0,0.0,541.1520004272461,842.6252567768089,31.746845933187505,3,3,3,4_4_4_r1,0,
2026-03-02T09:27:14.191096+00:00,B2,training_style,eval,training_style_eval_062,1024,2048,512,bf16,NVIDIA GeForce RTX 4060,c06,64,128,32,4,3,8,0.0,0.0,97.28000313043594,138.89536216855038,22.07528350015151,3,3,2,3_4_3_r0,0,
2026-03-02T09:27:14.302508+00:00,B2,training_style,eval,training_style_eval_063,3072,1536,3072,bf16,NVIDIA GeForce RTX 4060,c04,64,64,64,4,3,8,0.0,0.0,880.5759847164154,1043.4764385223389,32.92280251923564,3,3,3,4_4_4_r2,0,
2026-03-02T09:27:14.311552+00:00,B2,adversarial,tune,adversarial_tune_000,1,1024,1024,bf16,NVIDIA GeForce RTX 4060,c00,32,32,32,2,2,8,0.0,0.0,41.71200096607208,47.66719933599232,0.050276945517569206,0,3,3,0_3_3_r0,0,
2026-03-02T09:27:14.329674+00:00,B2,adversarial,tune,adversarial_tune_001,1,1024,4096,bf16,NVIDIA GeForce RTX 4060,c00,32,32,32,2,2,8,0.0,0.0,60.416001826524734,126.6902394592762,0.13884745342941757,0,3,3,0_3_4_r0,0,
2026-03-02T09:27:14.347236+00:00,B2,adversarial,tune,adversarial_tune_002,1,4096,1024,bf16,NVIDIA GeForce RTX 4060,c00,32,32,32,2,2,8,0.0,0.0,46.08000069856644,144.55808028578744,0.18204444168467585,0,3,3,0_4_3_r0,0,
2026-03-02T09:27:14.435128+00:00,B2,adversarial,tune,adversarial_tune_003,1,4096,4096,bf16,NVIDIA GeForce RTX 4060,c11,32,128,32,4,2,8,0.0,0.0,165.75999557971954,259.38400939106936,0.20242780462589086,0,3,3,0_4_4_r0,0,
2026-03-02T09:27:14.478962+00:00,B2,adversarial,tune,adversarial_tune_004,1,8192,1024,bf16,NVIDIA GeForce RTX 4060,c00,32,32,32,2,2,8,0.0,0.0,55.18399924039841,111.26911848783475,0.3040231993138683,0,3,3,0_4_3_r0,0,
2026-03-02T09:27:14.645904+00:00,B2,adversarial,tune,adversarial_tune_005,1,8192,4096,bf16,NVIDIA GeForce RTX 4060,c11,32,128,32,4,2,8,0.0,0.0,293.88800263404846,372.2223910689354,0.22834843000911628,0,3,3,0_4_4_r0,0,
2026-03-02T09:27:14.654520+00:00,B2,adversarial,tune,adversarial_tune_006,2,1024,1024,bf16,NVIDIA GeForce RTX 4060,c00,32,32,32,2,2,8,0.0,0.0,37.84000128507614,131.44064344465727,0.11084312519973955,0,3,3,0_3_3_r0,0,
2026-03-02T09:27:14.672882+00:00,B2,adversarial,tune,adversarial_tune_007,2,1024,4096,bf16,NVIDIA GeForce RTX 4060,c00,32,32,32,2,2,8,0.0,0.0,55.36000058054924,91.33055910468093,0.30305664422074957,0,3,3,0_3_4_r0,0,
2026-03-02T09:27:14.690493+00:00,B2,adversarial,tune,adversarial_tune_008,2,4096,1024,bf16,NVIDIA GeForce RTX 4060,c00,32,32,32,2,2,8,0.0,0.0,65.0399997830391,147.40224145352823,0.25795227638323426,0,3,3,0_4_3_r0,0,
2026-03-02T09:27:14.802702+00:00,B2,adversarial,tune,adversarial_tune_009,2,4096,4096,bf16,NVIDIA GeForce RTX 4060,c11,32,128,32,4,2,8,0.0,0.0,163.83999586105347,205.5849613249301,0.4096000103473666,0,3,3,0_4_4_r0,0,
2026-03-02T09:27:14.844297+00:00,B2,adversarial,tune,adversarial_tune_010,2,8192,1024,bf16,NVIDIA GeForce RTX 4060,c00,32,32,32,2,2,8,0.0,0.0,50.064001232385635,134.1279998421669,0.6702307281483157,0,3,3,0_4_3_r0,0,
2026-03-02T09:27:15.015061+00:00,B2,adversarial,tune,adversarial_tune_011,2,8192,4096,bf16,NVIDIA GeForce RTX 4060,c11,32,128,32,4,2,8,0.0,0.0,293.7279939651489,407.94112384319294,0.4569456461678795,0,3,3,0_4_4_r0,0,
2026-03-02T09:27:15.025962+00:00,B2,adversarial,tune,adversarial_tune_012,4,1024,1024,bf16,NVIDIA GeForce RTX 4060,c00,32,32,32,2,2,8,0.0,0.0,64.67200070619583,109.73663978278634,0.12971004311602097,0,3,3,0_3_3_r0,0,
2026-03-02T09:27:15.049684+00:00,B2,adversarial,tune,adversarial_tune_013,4,1024,4096,bf16,NVIDIA GeForce RTX 4060,c00,32,32,32,2,2,8,0.0,0.0,86.95999905467033,170.57824522256848,0.3858605377732913,0,3,3,0_3_4_r0,0,
2026-03-02T09:27:15.070089+00:00,B2,adversarial,tune,adversarial_tune_014,4,4096,1024,bf16,NVIDIA GeForce RTX 4060,c00,32,32,32,2,2,8,0.0,0.0,66.56000018119812,137.00960069894782,0.5041230755506888,0,3,3,0_4_3_r0,0,
2026-03-02T09:27:15.153981+00:00,B2,adversarial,tune,adversarial_tune_015,4,4096,4096,bf16,NVIDIA GeForce RTX 4060,c11,32,128,32,4,2,8,0.0,0.0,163.55199366807938,237.58240178227425,0.8206425674784997,0,3,3,0_4_4_r0,0,
2026-03-02T09:27:15.199052+00:00,B2,adversarial,tune,adversarial_tune_016,4,8192,1024,bf16,NVIDIA GeForce RTX 4060,c00,32,32,32,2,2,8,0.0,0.0,71.16800174117088,207.45503842830644,0.9429640057067576,0,3,3,0_4_3_r0,0,
2026-03-02T09:27:15.359946+00:00,B2,adversarial,tune,adversarial_tune_017,4,8192,4096,bf16,NVIDIA GeForce RTX 4060,c11,32,128,32,4,2,8,0.0,0.0,293.88800263404846,412.0495894551277,0.9133937200364651,0,3,3,0_4_4_r0,0,
2026-03-02T09:27:15.369958+00:00,B2,adversarial,tune,adversarial_tune_018,8,1024,1024,bf16,NVIDIA GeForce RTX 4060,c00,32,32,32,2,2,8,0.0,0.0,36.86400130391121,184.46975737810118,0.45511109501344243,0,3,3,0_3_3_r0,0,
2026-03-02T09:27:15.390850+00:00,B2,adversarial,tune,adversarial_tune_019,8,1024,4096,bf16,NVIDIA GeForce RTX 4060,c00,32,32,32,2,2,8,0.0,0.0,91.64800122380257,175.5856066942215,0.7322458002779734,0,3,3,0_3_4_r0,0,
2026-03-02T09:27:15.409156+00:00,B2,adversarial,tune,adversarial_tune_020,8,4096,1024,bf16,NVIDIA GeForce RTX 4060,c00,32,32,32,2,2,8,0.0,0.0,65.5359998345375,151.85088127851486,1.0240000025853515,0,3,3,0_4_3_r0,0,
2026-03-02T09:27:15.497964+00:00,B2,adversarial,tune,adversarial_tune_021,8,4096,4096,bf16,NVIDIA GeForce RTX 4060,c11,32,128,32,4,2,8,0.0,0.0,163.82399946451187,337.58656501769997,1.6385600209824533,0,3,3,0_4_4_r0,0,
2026-03-02T09:27:15.537546+00:00,B2,adversarial,tune,adversarial_tune_022,8,8192,1024,bf16,NVIDIA GeForce RTX 4060,c00,32,32,32,2,2,8,0.0,0.0,51.19999870657921,65.41791848838328,2.621440066223146,0,3,3,0_4_3_r0,0,
2026-03-02T09:27:15.696011+00:00,B2,adversarial,tune,adversarial_tune_023,8,8192,4096,bf16,NVIDIA GeForce RTX 4060,c11,32,128,32,4,2,8,0.0,0.0,294.23999786376953,380.43648183345783,1.8246020795873115,0,3,3,0_4_4_r0,0,
2026-03-02T09:27:15.704948+00:00,B2,adversarial,tune,adversarial_tune_024,16,1024,1024,bf16,NVIDIA GeForce RTX 4060,c00,32,32,32,2,2,8,0.0,0.0,37.80800104141235,123.55871997773642,0.8874955320501267,0,3,3,0_3_3_r0,0,
2026-03-02T09:27:15.725395+00:00,B2,adversarial,tune,adversarial_tune_025,16,1024,4096,bf16,NVIDIA GeForce RTX 4060,c00,32,32,32,2,2,8,0.0,0.0,82.87999778985977,142.76863902807236,1.6194224370071268,0,3,3,0_3_4_r0,0,
2026-03-02T09:27:15.744198+00:00,B2,adversarial,tune,adversarial_tune_026,16,4096,1024,bf16,NVIDIA GeForce RTX 4060,c00,32,32,32,2,2,8,0.0,0.0,67.58400052785873,177.2979213297367,1.9859393784283939,0,3,3,0_4_3_r0,0,
2026-03-02T09:27:15.831192+00:00,B2,adversarial,tune,adversarial_tune_027,16,4096,4096,bf16,NVIDIA GeForce RTX 4060,c11,32,128,32,4,2,8,0.0,0.0,166.6560024023056,233.53823885321611,3.221431597189041,0,3,3,0_4_4_r0,0,
2026-03-02T09:27:15.871696+00:00,B2,adversarial,tune,adversarial_tune_028,16,8192,1024,bf16,NVIDIA GeForce RTX 4060,c00,32,32,32,2,2,8,0.0,0.0,53.360000252723694,110.55967934429644,5.030649451436201,0,3,3,0_4_3_r0,0,
2026-03-02T09:27:16.034093+00:00,B2,adversarial,tune,adversarial_tune_029,16,8192,4096,bf16,NVIDIA GeForce RTX 4060,c11,32,128,32,4,2,8,0.0,0.0,301.39200389385223,377.7292799949646,3.5626088619728704,0,3,3,0_4_4_r0,0,
2026-03-02T09:27:16.042855+00:00,B2,adversarial,tune,adversarial_tune_030,32,1024,1024,bf16,NVIDIA GeForce RTX 4060,c04,64,64,64,4,3,8,0.0,0.0,34.81600061058998,49.666239656507955,1.9275293779604168,0,3,3,1_3_3_r0,0,
2026-03-02T09:27:16.061043+00:00,B2,adversarial,tune,adversarial_tune_031,32,1024,4096,bf16,NVIDIA GeForce RTX 4060,c04,64,64,64,4,3,8,0.0,0.0,60.416001826524734,103.73760402202596,4.443118509741362,0,3,3,1_3_4_r0,0,
2026-03-02T09:27:16.068877+00:00,B2,adversarial,eval,adversarial_eval_000,1,1024,1024,bf16,NVIDIA GeForce RTX 4060,c00,32,32,32,2,2,8,0.0,0.0,39.11999985575676,64.16736084967847,0.05360818015676425,0,3,3,0_3_3_r0,0,
2026-03-02T09:27:16.090582+00:00,B2,adversarial,eval,adversarial_eval_001,1,1024,4096,bf16,NVIDIA GeForce RTX 4060,c00,32,32,32,2,2,8,0.0,0.0,99.32799637317657,225.9558418393134,0.08445361133112854,0,3,3,0_3_4_r0,0,
2026-03-02T09:27:16.109815+00:00,B2,adversarial,eval,adversarial_eval_002,1,4096,1024,bf16,NVIDIA GeForce RTX 4060,c00,32,32,32,2,2,8,0.0,0.0,52.22399905323982,103.70720043778411,0.16062745389238045,0,3,3,0_4_3_r0,0,
2026-03-02T09:27:16.191181+00:00,B2,adversarial,eval,adversarial_eval_003,1,4096,4096,bf16,NVIDIA GeForce RTX 4060,c11,32,128,32,4,2,8,0.0,0.0,168.96000504493713,258.6112016439438,0.19859393346416956,0,3,3,0_4_4_r0,0,
2026-03-02T09:27:16.235146+00:00,B2,adversarial,eval,adversarial_eval_004,1,8192,1024,bf16,NVIDIA GeForce RTX 4060,c00,32,32,32,2,2,8,0.0,0.0,65.5359998345375,130.8435221761463,0.2560000006463379,0,3,3,0_4_3_r0,0,
2026-03-02T09:27:16.392811+00:00,B2,adversarial,eval,adversarial_eval_005,1,8192,4096,bf16,NVIDIA GeForce RTX 4060,c11,32,128,32,4,2,8,0.0,0.0,294.9120104312897,353.5564839839934,0.22755554750672122,0,3,3,0_4_4_r0,0,
2026-03-02T09:27:16.401486+00:00,B2,adversarial,eval,adversarial_eval_006,2,1024,1024,bf16,NVIDIA GeForce RTX 4060,c00,32,32,32,2,2,8,0.0,0.0,49.15200173854828,81.04768060147757,0.08533333031502047,0,3,3,0_3_3_r0,0,
2026-03-02T09:27:16.422373+00:00,B2,adversarial,eval,adversarial_eval_007,2,1024,4096,bf16,NVIDIA GeForce RTX 4060,c00,32,32,32,2,2,8,0.0,0.0,86.01599931716919,128.3276785910129,0.19504762059598826,0,3,3,0_3_4_r0,0,
2026-03-02T09:27:16.441227+00:00,B2,adversarial,eval,adversarial_eval_008,2,4096,1024,bf16,NVIDIA GeForce RTX 4060,c00,32,32,32,2,2,8,0.0,0.0,51.16799846291542,135.2908810973167,0.3278849379296998,0,3,3,0_4_3_r0,0,
2026-03-02T09:27:16.527034+00:00,B2,adversarial,eval,adversarial_eval_009,2,4096,4096,bf16,NVIDIA GeForce RTX 4060,c11,32,128,32,4,2,8,0.0,0.0,169.3280041217804,309.8009604215621,0.39632466199587063,0,3,3,0_4_4_r0,0,
2026-03-02T09:27:16.570552+00:00,B2,adversarial,eval,adversarial_eval_010,2,8192,1024,bf16,NVIDIA GeForce RTX 4060,c00,32,32,32,2,2,8,0.0,0.0,71.68000191450119,125.20447738468631,0.4681142732114211,0,3,3,0_4_3_r0,0,
2026-03-02T09:27:16.744540+00:00,B2,adversarial,eval,adversarial_eval_011,2,8192,4096,bf16,NVIDIA GeForce RTX 4060,c11,32,128,32,4,2,8,0.0,0.0,452.60798931121826,581.6524982452393,0.29654299342849294,0,3,3,0_4_4_r0,0,
2026-03-02T09:27:16.753147+00:00,B2,adversarial,eval,adversarial_eval_012,4,1024,1024,bf16,NVIDIA GeForce RTX 4060,c00,32,32,32,2,2,8,0.0,0.0,44.03200000524521,55.17536085098981,0.1905116278842825,0,3,3,0_3_3_r0,0,
2026-03-02T09:27:16.774916+00:00,B2,adversarial,eval,adversarial_eval_013,4,1024,4096,bf16,NVIDIA GeForce RTX 4060,c00,32,32,32,2,2,8,0.0,0.0,101.3759970664978,195.18463522195816,0.33098990856770466,0,3,3,0_3_4_r0,0,
2026-03-02T09:27:16.793079+00:00,B2,adversarial,eval,adversarial_eval_014,4,4096,1024,bf16,NVIDIA GeForce RTX 4060,c00,32,32,32,2,2,8,0.0,0.0,52.22399905323982,85.821439102292,0.6425098155695218,0,3,3,0_4_3_r0,0,
2026-03-02T09:27:16.890318+00:00,B2,adversarial,eval,adversarial_eval_015,4,4096,4096,bf16,NVIDIA GeForce RTX 4060,c11,32,128,32,4,2,8,0.0,0.0,251.76000595092773,377.59999722242355,0.5331177503473736,0,3,3,0_4_4_r0,0,
2026-03-02T09:27:16.931621+00:00,B2,adversarial,eval,adversarial_eval_016,4,8192,1024,bf16,NVIDIA GeForce RTX 4060,c00,32,32,32,2,2,8,0.0,0.0,67.07200035452843,127.92768418788907,1.0005496130319167,0,3,3,0_4_3_r0,0,
2026-03-02T09:27:17.107752+00:00,B2,adversarial,eval,adversarial_eval_017,4,8192,4096,bf16,NVIDIA GeForce RTX 4060,c11,32,128,32,4,2,8,0.0,0.0,475.13601183891296,548.5363197326659,0.5649655031641942,0,3,3,0_4_4_r0,0,
2026-03-02T09:27:17.116867+00:00,B2,adversarial,eval,adversarial_eval_018,8,1024,1024,bf16,NVIDIA GeForce RTX 4060,c00,32,32,32,2,2,8,0.0,0.0,48.51200059056282,108.18559937179086,0.345836407399445,0,3,3,0_3_3_r0,0,
2026-03-02T09:27:17.139791+00:00,B2,adversarial,eval,adversarial_eval_019,8,1024,4096,bf16,NVIDIA GeForce RTX 4060,c00,32,32,32,2,2,8,0.0,0.0,99.83999654650688,175.6159995496272,0.672164125814445,0,3,3,0_3_4_r0,0,
2026-03-02T09:27:17.157404+00:00,B2,adversarial,eval,adversarial_eval_020,8,4096,1024,bf16,NVIDIA GeForce RTX 4060,c00,32,32,32,2,2,8,0.0,0.0,60.416001826524734,94.10816095769394,1.1107796274353405,0,3,3,0_4_3_r0,0,
2026-03-02T09:27:17.245070+00:00,B2,adversarial,eval,adversarial_eval_021,8,4096,4096,bf16,NVIDIA GeForce RTX 4060,c11,32,128,32,4,2,8,0.0,0.0,250.88000297546387,331.98080033063866,1.0699754975140567,0,3,3,0_4_4_r0,0,
2026-03-02T09:27:17.289095+00:00,B2,adversarial,eval,adversarial_eval_022,8,8192,1024,bf16,NVIDIA GeForce RTX 4060,c00,32,32,32,2,2,8,0.0,0.0,77.80799642205238,83.52767847478388,1.724986301818716,0,3,3,0_4_3_r0,0,
2026-03-02T09:27:17.461309+00:00,B2,adversarial,eval,adversarial_eval_023,8,8192,4096,bf16,NVIDIA GeForce RTX 4060,c11,32,128,32,4,2,8,0.0,0.0,478.5600006580353,638.0537480115889,1.1218466049435503,0,3,3,0_4_4_r0,0,
2026-03-02T09:27:17.471467+00:00,B2,adversarial,eval,adversarial_eval_024,16,1024,1024,bf16,NVIDIA GeForce RTX 4060,c00,32,32,32,2,2,8,0.0,0.0,45.93599960207939,127.46976554393768,0.7304604730639428,0,3,3,0_3_3_r0,0,
2026-03-02T09:27:17.496048+00:00,B2,adversarial,eval,adversarial_eval_025,16,1024,4096,bf16,NVIDIA GeForce RTX 4060,c00,32,32,32,2,2,8,0.0,0.0,99.32799637317657,115.66848099231717,1.3512577812980566,0,3,3,0_3_4_r0,0,
2026-03-02T09:27:17.513789+00:00,B2,adversarial,eval,adversarial_eval_026,16,4096,1024,bf16,NVIDIA GeForce RTX 4060,c00,32,32,32,2,2,8,0.0,0.0,64.51199948787689,84.71552252769465,2.0805079530238744,0,3,3,0_4_3_r0,0,
2026-03-02T09:27:17.602783+00:00,B2,adversarial,eval,adversarial_eval_027,16,4096,4096,bf16,NVIDIA GeForce RTX 4060,c11,32,128,32,4,2,8,0.0,0.0,255.48800826072693,547.665936648845,2.1013546414754636,0,3,3,0_4_4_r0,0,
2026-03-02T09:27:17.649325+00:00,B2,adversarial,eval,adversarial_eval_028,16,8192,1024,bf16,NVIDIA GeForce RTX 4060,c00,32,32,32,2,2,8,0.0,0.0,91.13600105047226,191.60512059926972,2.9454381682968194,0,3,3,0_4_3_r0,0,
2026-03-02T09:27:17.822193+00:00,B2,adversarial,eval,adversarial_eval_029,16,8192,4096,bf16,NVIDIA GeForce RTX 4060,c11,32,128,32,4,2,8,0.0,0.0,471.3120013475418,587.2995179891586,2.278197501718678,0,3,3,0_4_4_r0,0,
2026-03-02T09:27:17.834117+00:00,B2,adversarial,eval,adversarial_eval_030,32,1024,1024,bf16,NVIDIA GeForce RTX 4060,c04,64,64,64,4,3,8,0.0,0.0,39.2800010740757,133.2940839231013,1.7084740877028894,0,3,3,1_3_3_r0,0,
2026-03-02T09:27:17.855370+00:00,B2,adversarial,eval,adversarial_eval_031,32,1024,4096,bf16,NVIDIA GeForce RTX 4060,c04,64,64,64,4,3,8,0.0,0.0,103.42399775981903,197.17120334506035,2.5954852047334906,0,3,3,1_3_4_r0,0,
2026-03-02T09:27:17.875195+00:00,B2,adversarial,eval,adversarial_eval_032,32,4096,1024,bf16,NVIDIA GeForce RTX 4060,c04,64,64,64,4,3,8,0.0,0.0,80.89599758386612,125.75744152069086,3.3182785801202197,0,3,3,1_4_3_r0,0,
2026-03-02T09:27:17.968892+00:00,B2,adversarial,eval,adversarial_eval_033,32,4096,4096,bf16,NVIDIA GeForce RTX 4060,c04,64,64,64,4,3,8,0.0,0.0,267.63200759887695,316.4287942647934,4.0120082557887065,0,3,3,1_4_4_r0,0,
2026-03-02T09:27:18.013713+00:00,B2,adversarial,eval,adversarial_eval_034,32,8192,1024,bf16,NVIDIA GeForce RTX 4060,c04,64,64,64,4,3,8,0.0,0.0,134.49599593877792,155.18463566899294,3.991724127195442,0,3,3,1_4_3_r0,0,
2026-03-02T09:27:18.189673+00:00,B2,adversarial,eval,adversarial_eval_035,32,8192,4096,bf16,NVIDIA GeForce RTX 4060,c04,64,64,64,4,3,8,0.0,0.0,509.90399718284607,529.9916917085648,4.211545035662734,0,3,3,1_4_4_r0,0,
2026-03-02T09:27:20.479116+00:00,B2,adversarial,eval,adversarial_eval_036,1024,1,512,bf16,NVIDIA GeForce RTX 4060,c00,32,32,32,2,2,8,0.0,2289.383,48.128001391887665,66.67072135955091,0.021787233412454674,3,0,2,3_0_3_r2,0,anchor_skipped
2026-03-02T09:27:20.700881+00:00,B2,adversarial,eval,adversarial_eval_037,1024,1,2048,bf16,NVIDIA GeForce RTX 4060,c09,128,64,64,8,3,8,0.0,221.724,66.56000018119812,73.03424097597599,0.0630153844438361,3,0,3,3_0_4_r2,0,anchor_skipped
2026-03-02T09:27:20.763347+00:00,B2,adversarial,eval,adversarial_eval_038,2048,1,512,bf16,NVIDIA GeForce RTX 4060,c04,64,64,64,4,3,8,0.0,62.42,38.27200084924698,43.53023983538151,0.05479598540616312,3,0,2,4_0_3_r2,0,anchor_skipped
2026-03-02T09:27:20.856124+00:00,B2,adversarial,eval,adversarial_eval_039,2048,1,2048,bf16,NVIDIA GeForce RTX 4060,c04,64,64,64,4,3,8,0.0,92.734,61.43999844789505,70.71264170110226,0.13653333678245552,3,0,3,4_0_4_r2,0,anchor_skipped
2026-03-02T09:27:20.868678+00:00,B2,adversarial,eval,adversarial_eval_040,4096,1,512,bf16,NVIDIA GeForce RTX 4060,c04,64,64,64,4,3,8,0.0,0.0,68.09600070118904,163.37344214320171,0.061593984328168656,3,0,2,4_0_3_r2,0,
2026-03-02T09:27:20.925443+00:00,B2,adversarial,eval,adversarial_eval_041,4096,1,2048,bf16,NVIDIA GeForce RTX 4060,c04,64,64,64,4,3,8,0.0,0.0,92.16000139713287,171.79647475481028,0.18204444168467585,3,0,3,4_0_4_r2,0,
2026-03-02T09:27:21.061723+00:00,B2,adversarial,eval,adversarial_eval_042,1024,2,512,bf16,NVIDIA GeForce RTX 4060,c00,32,32,32,2,2,8,0.0,0.0,40.672000497579575,138.09439860284323,0.05156254854306474,3,0,2,3_0_3_r2,0,
2026-03-02T09:27:21.249795+00:00,B2,adversarial,eval,adversarial_eval_043,1024,2,2048,bf16,NVIDIA GeForce RTX 4060,c09,128,64,64,8,3,8,0.0,0.0,83.96799862384796,116.19488276541225,0.09990244066169192,3,0,3,3_0_4_r2,0,
2026-03-02T09:27:21.469390+00:00,B2,adversarial,eval,adversarial_eval_044,2048,2,512,bf16,NVIDIA GeForce RTX 4060,c04,64,64,64,4,3,8,0.0,0.0,45.85599899291992,65.06303943693636,0.09146685476523131,3,0,2,4_0_3_r2,0,
2026-03-02T09:27:21.496942+00:00,B2,adversarial,eval,adversarial_eval_045,2048,2,2048,bf16,NVIDIA GeForce RTX 4060,c04,64,64,64,4,3,8,0.0,0.0,94.2080020904541,143.23456287384033,0.17808695257003015,3,0,3,4_0_4_r2,0,
2026-03-02T09:27:21.513743+00:00,B2,adversarial,eval,adversarial_eval_046,4096,2,512,bf16,NVIDIA GeForce RTX 4060,c04,64,64,64,4,3,8,0.0,0.0,57.34400078654289,64.26079742610455,0.14628571227922732,3,0,2,4_0_3_r2,0,
2026-03-02T09:27:21.561066+00:00,B2,adversarial,eval,adversarial_eval_047,4096,2,2048,bf16,NVIDIA GeForce RTX 4060,c04,64,64,64,4,3,8,0.0,0.0,129.84000146389008,154.64511886239046,0.2584290790333351,3,0,3,4_0_4_r2,0,
2026-03-02T09:27:21.567980+00:00,B2,adversarial,eval,adversarial_eval_048,1024,4,512,bf16,NVIDIA GeForce RTX 4060,c00,32,32,32,2,2,8,0.0,0.0,39.93599861860275,126.33152194321148,0.10502564465850703,3,0,2,3_0_3_r2,0,
2026-03-02T09:27:21.581009+00:00,B2,adversarial,eval,adversarial_eval_049,1024,4,2048,bf16,NVIDIA GeForce RTX 4060,c09,128,64,64,8,3,8,0.0,0.0,87.0399996638298,167.63904079794878,0.19275294192093054,3,0,3,3_0_4_r2,0,
2026-03-02T09:27:21.588415+00:00,B2,adversarial,eval,adversarial_eval_050,2048,4,512,bf16,NVIDIA GeForce RTX 4060,c04,64,64,64,4,3,8,0.0,0.0,47.10400104522705,55.218559354543686,0.17808695257003015,3,0,2,4_0_3_r2,0,
2026-03-02T09:27:21.609393+00:00,B2,adversarial,eval,adversarial_eval_051,2048,4,2048,bf16,NVIDIA GeForce RTX 4060,c04,64,64,64,4,3,8,0.0,0.0,121.31199985742569,198.67648020386696,0.2765961490984858,3,0,3,4_0_4_r2,0,
2026-03-02T09:27:21.621696+00:00,B2,adversarial,eval,adversarial_eval_052,4096,4,512,bf16,NVIDIA GeForce RTX 4060,c04,64,64,64,4,3,8,0.0,0.0,62.463998794555664,72.24320210516451,0.2685901691177398,3,0,2,4_0_3_r2,0,
2026-03-02T09:27:21.668762+00:00,B2,adversarial,eval,adversarial_eval_053,4096,4,2048,bf16,NVIDIA GeForce RTX 4060,c04,64,64,64,4,3,8,0.0,0.0,123.99999797344208,203.90912547707546,0.5412005249739856,3,0,3,4_0_4_r2,0,
2026-03-02T09:27:21.677712+00:00,B2,adversarial,eval,adversarial_eval_054,1024,8,512,bf16,NVIDIA GeForce RTX 4060,c00,32,32,32,2,2,8,0.0,0.0,66.56000018119812,192.67519921064377,0.1260307688876722,3,0,2,3_0_3_r2,0,
2026-03-02T09:27:21.692760+00:00,B2,adversarial,eval,adversarial_eval_055,1024,8,2048,bf16,NVIDIA GeForce RTX 4060,c09,128,64,64,8,3,8,0.0,0.0,92.06400066614151,193.12543690204615,0.3644685409846669,3,0,3,3_0_4_r2,0,
2026-03-02T09:27:21.702067+00:00,B2,adversarial,eval,adversarial_eval_056,2048,8,512,bf16,NVIDIA GeForce RTX 4060,c04,64,64,64,4,3,8,0.0,0.0,63.48799914121628,75.79648330807686,0.2642580680906711,3,0,2,4_0_3_r2,0,
2026-03-02T09:27:21.725479+00:00,B2,adversarial,eval,adversarial_eval_057,2048,8,2048,bf16,NVIDIA GeForce RTX 4060,c04,64,64,64,4,3,8,0.0,0.0,134.09599661827087,184.8307172954082,0.5004538964055566,3,0,3,4_0_4_r2,0,
2026-03-02T09:27:21.738633+00:00,B2,adversarial,eval,adversarial_eval_058,4096,8,512,bf16,NVIDIA GeForce RTX 4060,c04,64,64,64,4,3,8,0.0,0.0,70.65600156784058,110.890878662467,0.474898540186747,3,0,2,4_0_3_r2,0,
2026-03-02T09:27:21.786470+00:00,B2,adversarial,eval,adversarial_eval_059,4096,8,2048,bf16,NVIDIA GeForce RTX 4060,c04,64,64,64,4,3,8,0.0,0.0,159.743994474411,227.8127945959568,0.8402051572680562,3,0,3,4_0_4_r2,0,
2026-03-02T09:27:21.935264+00:00,B2,adversarial,eval,adversarial_eval_060,64,64,8192,bf16,NVIDIA GeForce RTX 4060,c00,32,32,32,2,2,8,0.0,148.734,89.40799906849861,138.5827200859784,0.7505912748207859,1,1,3,1_1_4_r1,0,
2026-03-02T09:27:21.953163+00:00,B2,adversarial,eval,adversarial_eval_061,128,128,8192,bf16,NVIDIA GeForce RTX 4060,c04,64,64,64,4,3,8,0.0,0.0,90.04800021648407,194.98592272400847,2.981026289919324,1,1,3,2_2_4_r1,0,
2026-03-02T09:27:22.215147+00:00,B2,adversarial,eval,adversarial_eval_062,2048,128,8192,bf16,NVIDIA GeForce RTX 4060,c04,64,64,64,4,3,8,0.0,261.932,184.28800255060196,192.08864599466324,23.305734700883114,3,1,3,4_2_4_r2,0,anchor_skipped
2026-03-02T09:27:22.310687+00:00,B2,adversarial,eval,adversarial_eval_063,128,2048,8192,bf16,NVIDIA GeForce RTX 4060,c06,64,128,32,4,3,8,0.0,0.0,224.96000677347183,337.0831999182701,19.09213712073234,1,3,3,2_4_4_r0,0,
