results/pipeline_repro_20260303T142236Z/bucket_torch.csv
timestamp,method,workload,split,shape_id,M,N,K,dtype,gpu,config_id,BLOCK_M,BLOCK_N,BLOCK_K,num_warps,num_stages,GROUP_M,compile_time_ms,tune_time_ms,runtime_cost_us,p99_us,runtime_perf_tflops,bucket_m,bucket_n,bucket_k,cache_key,invalid_config,notes
2026-03-03T14:23:34.566228+00:00,BUCKET,llm_style,tune,llm_style_tune_000,8,2048,4096,fp16,Ascend910B2,c24,16,128,128,4,2,4,161.97402030229568,5994.804,17.22,18.1432,7.794293147502905,2,-1,-1,llm8_g2,0,"batch_tune;path_reordered;launch=fixed_cores(16),swizzle2d_g=4,dir=1;timing=npu_profiler_batch_offline_kernel_step"
2026-03-03T14:23:39.326902+00:00,BUCKET,llm_style,tune,llm_style_tune_001,32,2048,8192,fp16,Ascend910B2,c24,16,128,128,4,2,4,0.0,0.0,61.202,61.4888,17.54422770497696,2,-1,-1,llm8_g2,0,"path_reordered;launch=fixed_cores(24),swizzle2d_g=4,dir=1;timing=npu_profiler_offline_kernel_details"
2026-03-03T14:23:45.448172+00:00,BUCKET,llm_style,tune,llm_style_tune_002,64,8192,8192,fp16,Ascend910B2,c18,64,128,128,4,2,4,0.0,6121.113,104.662,105.01664,82.07309808717586,0,-1,-1,llm8_g0,0,"batch_tune;path_reordered;launch=fixed_cores(24),swizzle2d_g=4,dir=1;timing=npu_profiler_batch_offline_kernel_step"
2026-03-03T14:23:49.943888+00:00,BUCKET,llm_style,tune,llm_style_tune_003,1,3072,1536,fp16,Ascend910B2,c18,64,128,128,4,2,4,0.0,4495.571,8.34,8.5376,1.131556834532374,5,-1,-1,llm8_g5,0,"batch_tune;path_reordered;launch=fixed_cores(24),swizzle2d_g=4,dir=1;timing=npu_profiler_batch_offline_kernel_step"
2026-03-03T14:23:55.060475+00:00,BUCKET,llm_style,tune,llm_style_tune_004,8,1024,1536,fp16,Ascend910B2,c24,16,128,128,4,2,4,0.0,5116.429,7.08,8.068,3.5544949152542373,3,-1,-1,llm8_g3,0,"batch_tune;path_reordered;launch=fixed_cores(8),swizzle2d_g=4,dir=1;timing=npu_profiler_batch_offline_kernel_step"
2026-03-03T14:24:00.242358+00:00,BUCKET,llm_style,tune,llm_style_tune_005,1,4096,8192,fp16,Ascend910B2,c29,16,256,128,4,2,4,0.0,5181.722,39.14,39.632000000000005,1.714585181400102,4,-1,-1,llm8_g4,0,"batch_tune;path_reordered;launch=fixed_cores(16),swizzle2d_g=4,dir=1;timing=npu_profiler_batch_offline_kernel_step"
2026-03-03T14:24:04.744210+00:00,BUCKET,llm_style,tune,llm_style_tune_006,4,6144,1024,fp16,Ascend910B2,c18,64,128,128,4,2,4,0.0,0.0,11.3,11.6544,4.45412814159292,5,-1,-1,llm8_g5,0,"path_reordered;launch=fixed_cores(24),swizzle2d_g=4,dir=1;timing=npu_profiler_offline_kernel_details"
2026-03-03T14:24:09.251083+00:00,BUCKET,llm_style,tune,llm_style_tune_007,64,6144,1024,fp16,Ascend910B2,c12,128,128,128,4,2,4,0.0,4506.703,13.18,13.414399999999999,61.10063490136571,1,-1,-1,llm8_g1,0,"batch_tune;path_reordered;launch=fixed_cores(24),swizzle2d_g=4,dir=1;timing=npu_profiler_batch_offline_kernel_step"
2026-03-03T14:24:13.717455+00:00,BUCKET,llm_style,tune,llm_style_tune_008,64,1536,3072,fp16,Ascend910B2,c24,16,128,128,4,2,4,0.0,0.0,25.18,25.29952,23.98648832406672,3,-1,-1,llm8_g3,0,"path_reordered;launch=fixed_cores(24),swizzle2d_g=4,dir=1;timing=npu_profiler_offline_kernel_details"
2026-03-03T14:24:18.352619+00:00,BUCKET,llm_style,tune,llm_style_tune_009,2,4096,3072,fp16,Ascend910B2,c18,64,128,128,4,2,4,0.0,0.0,24.44,24.652,2.0593963993453355,5,-1,-1,llm8_g5,0,"path_reordered;launch=fixed_cores(24),swizzle2d_g=4,dir=1;timing=npu_profiler_offline_kernel_details"
2026-03-03T14:24:23.801877+00:00,BUCKET,llm_style,tune,llm_style_tune_010,32,3072,1536,fp16,Ascend910B2,c12,128,128,128,4,2,4,0.0,0.0,10.16,10.360399999999998,29.723414173228345,1,-1,-1,llm8_g1,0,"path_reordered;launch=fixed_cores(24),swizzle2d_g=4,dir=1;timing=npu_profiler_offline_kernel_details"
2026-03-03T14:24:29.315592+00:00,BUCKET,llm_style,tune,llm_style_tune_011,2,1536,1024,fp16,Ascend910B2,c24,16,128,128,4,2,4,0.0,5512.18,5.54,5.75312,1.1356418772563177,7,-1,-1,llm8_g7,0,"batch_tune;path_reordered;launch=fixed_cores(12),swizzle2d_g=4,dir=1;timing=npu_profiler_batch_offline_kernel_step"
2026-03-03T14:24:34.929053+00:00,BUCKET,llm_style,tune,llm_style_tune_012,4,1536,4096,fp16,Ascend910B2,c24,16,128,128,4,2,4,0.0,5612.268,15.96,16.6096,3.153612030075188,6,-1,-1,llm8_g6,0,"batch_tune;path_reordered;launch=fixed_cores(12),swizzle2d_g=4,dir=1;timing=npu_profiler_batch_offline_kernel_step"
2026-03-03T14:24:40.470497+00:00,BUCKET,llm_style,tune,llm_style_tune_013,64,6144,1024,fp16,Ascend910B2,c12,128,128,128,4,2,4,0.0,0.0,13.502,13.9112,59.6434874833358,1,-1,-1,llm8_g1,0,"path_reordered;launch=fixed_cores(24),swizzle2d_g=4,dir=1;timing=npu_profiler_offline_kernel_details"
2026-03-03T14:24:46.135827+00:00,BUCKET,llm_style,tune,llm_style_tune_014,32,4096,2048,fp16,Ascend910B2,c12,128,128,128,4,2,4,0.0,0.0,18.92,19.5168,28.375841014799153,1,-1,-1,llm8_g1,0,"path_reordered;launch=fixed_cores(24),swizzle2d_g=4,dir=1;timing=npu_profiler_offline_kernel_details"
2026-03-03T14:24:51.722958+00:00,BUCKET,llm_style,tune,llm_style_tune_015,32,1536,3072,fp16,Ascend910B2,c24,16,128,128,4,2,4,0.0,0.0,14.24,14.34,21.207155056179772,3,-1,-1,llm8_g3,0,"path_reordered;launch=fixed_cores(24),swizzle2d_g=4,dir=1;timing=npu_profiler_offline_kernel_details"
2026-03-03T14:24:51.723117+00:00,BUCKET,llm_style,eval,llm_style_eval_000,32,1536,1024,fp16,Ascend910B2,c24,16,128,128,4,2,4,0.0,0.0,6.44,6.6328,15.630946583850932,3,-1,-1,llm8_g3,0,"path_reordered;launch=fixed_cores(24),swizzle2d_g=4,dir=1;timing=npu_profiler_batch_offline_kernel_step"
2026-03-03T14:24:51.723154+00:00,BUCKET,llm_style,eval,llm_style_eval_001,32,2048,8192,fp16,Ascend910B2,c24,16,128,128,4,2,4,0.0,0.0,61.042,113.88999999999999,17.590213688935485,2,-1,-1,llm8_g2,0,"path_reordered;launch=fixed_cores(24),swizzle2d_g=4,dir=1;timing=npu_profiler_batch_offline_kernel_step"
2026-03-03T14:24:51.723182+00:00,BUCKET,llm_style,eval,llm_style_eval_002,16,2048,4096,fp16,Ascend910B2,c24,16,128,128,4,2,4,0.0,0.0,17.74,32.08512,15.131649154453212,2,-1,-1,llm8_g2,0,"path_reordered;launch=fixed_cores(16),swizzle2d_g=4,dir=1;timing=npu_profiler_batch_offline_kernel_step"
2026-03-03T14:24:51.723204+00:00,BUCKET,llm_style,eval,llm_style_eval_003,16,2048,1536,fp16,Ascend910B2,c24,16,128,128,4,2,4,0.0,0.0,8.12,13.42,12.396957635467983,3,-1,-1,llm8_g3,0,"path_reordered;launch=fixed_cores(16),swizzle2d_g=4,dir=1;timing=npu_profiler_batch_offline_kernel_step"
2026-03-03T14:24:51.723231+00:00,BUCKET,llm_style,eval,llm_style_eval_004,64,8192,2048,fp16,Ascend910B2,c12,128,128,128,4,2,4,0.0,0.0,29.8,51.3472,72.06320966442954,1,-1,-1,llm8_g1,0,"path_reordered;launch=fixed_cores(24),swizzle2d_g=4,dir=1;timing=npu_profiler_batch_offline_kernel_step"
2026-03-03T14:24:51.723255+00:00,BUCKET,llm_style,eval,llm_style_eval_005,64,3072,8192,fp16,Ascend910B2,c18,64,128,128,4,2,4,0.0,0.0,40.802,73.9344,78.94773471888632,0,-1,-1,llm8_g0,0,"path_reordered;launch=fixed_cores(24),swizzle2d_g=4,dir=1;timing=npu_profiler_batch_offline_kernel_step"
2026-03-03T14:24:51.723288+00:00,BUCKET,llm_style,eval,llm_style_eval_006,32,2048,2048,fp16,Ascend910B2,c24,16,128,128,4,2,4,0.0,0.0,16.702,30.0912,16.072054604239014,3,-1,-1,llm8_g3,0,"path_reordered;launch=fixed_cores(24),swizzle2d_g=4,dir=1;timing=npu_profiler_batch_offline_kernel_step"
2026-03-03T14:24:51.723314+00:00,BUCKET,llm_style,eval,llm_style_eval_007,8,8192,2048,fp16,Ascend910B2,c12,128,128,128,4,2,4,0.0,0.0,26.602,48.288880000000006,10.090799789489513,1,-1,-1,llm8_g1,0,"path_reordered;launch=fixed_cores(24),swizzle2d_g=4,dir=1;timing=npu_profiler_batch_offline_kernel_step"
2026-03-03T14:24:51.723335+00:00,BUCKET,llm_style,eval,llm_style_eval_008,64,1536,8192,fp16,Ascend910B2,c24,16,128,128,4,2,4,0.0,0.0,64.102,119.70792,25.125779788462136,2,-1,-1,llm8_g2,0,"path_reordered;launch=fixed_cores(24),swizzle2d_g=4,dir=1;timing=npu_profiler_batch_offline_kernel_step"
2026-03-03T14:24:51.723358+00:00,BUCKET,llm_style,eval,llm_style_eval_009,64,4096,6144,fp16,Ascend910B2,c18,64,128,128,4,2,4,0.0,0.0,53.302,100.00704,60.43348227083412,0,-1,-1,llm8_g0,0,"path_reordered;launch=fixed_cores(24),swizzle2d_g=4,dir=1;timing=npu_profiler_batch_offline_kernel_step"
2026-03-03T14:24:51.723379+00:00,BUCKET,llm_style,eval,llm_style_eval_010,64,2048,4096,fp16,Ascend910B2,c24,16,128,128,4,2,4,0.0,0.0,47.8,72.70031999999999,22.463218075313808,2,-1,-1,llm8_g2,0,"path_reordered;launch=fixed_cores(24),swizzle2d_g=4,dir=1;timing=npu_profiler_batch_offline_kernel_step"
2026-03-03T14:24:51.723398+00:00,BUCKET,llm_style,eval,llm_style_eval_011,32,3072,6144,fp16,Ascend910B2,c18,64,128,128,4,2,4,0.0,0.0,27.502,54.130799999999994,43.92260751945313,0,-1,-1,llm8_g0,0,"path_reordered;launch=fixed_cores(24),swizzle2d_g=4,dir=1;timing=npu_profiler_batch_offline_kernel_step"
2026-03-03T14:24:51.723417+00:00,BUCKET,llm_style,eval,llm_style_eval_012,16,1536,1536,fp16,Ascend910B2,c24,16,128,128,4,2,4,0.0,0.0,7.7,13.749919999999998,9.804866493506491,3,-1,-1,llm8_g3,0,"path_reordered;launch=fixed_cores(12),swizzle2d_g=4,dir=1;timing=npu_profiler_batch_offline_kernel_step"
2026-03-03T14:24:51.723437+00:00,BUCKET,llm_style,eval,llm_style_eval_013,64,2048,3072,fp16,Ascend910B2,c24,16,128,128,4,2,4,0.0,0.0,36.2,54.376,22.246032265193367,3,-1,-1,llm8_g3,0,"path_reordered;launch=fixed_cores(24),swizzle2d_g=4,dir=1;timing=npu_profiler_batch_offline_kernel_step"
2026-03-03T14:24:51.723456+00:00,BUCKET,llm_style,eval,llm_style_eval_014,16,8192,6144,fp16,Ascend910B2,c18,64,128,128,4,2,4,0.0,0.0,71.684,140.86687999999998,22.468231906701636,0,-1,-1,llm8_g0,0,"path_reordered;launch=fixed_cores(24),swizzle2d_g=4,dir=1;timing=npu_profiler_batch_offline_kernel_step"
2026-03-03T14:24:51.723475+00:00,BUCKET,llm_style,eval,llm_style_eval_015,64,6144,1536,fp16,Ascend910B2,c12,128,128,128,4,2,4,0.0,0.0,17.52,29.1408,68.94746301369864,1,-1,-1,llm8_g1,0,"path_reordered;launch=fixed_cores(24),swizzle2d_g=4,dir=1;timing=npu_profiler_batch_offline_kernel_step"
2026-03-03T14:25:12.475696+00:00,TORCH,llm_style,tune,llm_style_tune_000,8,2048,4096,fp16,Ascend910B2,torch_mm_npu,-1,-1,-1,-1,-1,-1,536.5082081407309,0.0,10.98,11.2384,12.22383679417122,2,-1,-1,torch_mm_npu,0,torch_mm_npu;timing=npu_profiler_batch_offline_kernel_step
2026-03-03T14:25:12.475821+00:00,TORCH,llm_style,tune,llm_style_tune_001,32,2048,8192,fp16,Ascend910B2,torch_mm_npu,-1,-1,-1,-1,-1,-1,0.0,0.0,21.3,37.7392,50.41041427230047,2,-1,-1,torch_mm_npu,0,torch_mm_npu;timing=npu_profiler_batch_offline_kernel_step
2026-03-03T14:25:12.475840+00:00,TORCH,llm_style,tune,llm_style_tune_002,64,8192,8192,fp16,Ascend910B2,torch_mm_npu,-1,-1,-1,-1,-1,-1,0.0,0.0,78.24,117.23479999999999,109.78955255623723,0,-1,-1,torch_mm_npu,0,torch_mm_npu;timing=npu_profiler_batch_offline_kernel_step
2026-03-03T14:25:12.475858+00:00,TORCH,llm_style,tune,llm_style_tune_003,1,3072,1536,fp16,Ascend910B2,torch_mm_npu,-1,-1,-1,-1,-1,-1,0.0,0.0,6.96,11.474400000000001,1.3559172413793104,5,-1,-1,torch_mm_npu,0,torch_mm_npu;timing=npu_profiler_batch_offline_kernel_step
2026-03-03T14:25:12.475876+00:00,TORCH,llm_style,tune,llm_style_tune_004,8,1024,1536,fp16,Ascend910B2,torch_mm_npu,-1,-1,-1,-1,-1,-1,0.0,0.0,9.64,10.999199999999998,2.6105626556016595,3,-1,-1,torch_mm_npu,0,torch_mm_npu;timing=npu_profiler_batch_offline_kernel_step
2026-03-03T14:25:12.475894+00:00,TORCH,llm_style,tune,llm_style_tune_005,1,4096,8192,fp16,Ascend910B2,torch_mm_npu,-1,-1,-1,-1,-1,-1,0.0,0.0,35.72,58.22992,1.8787475923852186,4,-1,-1,torch_mm_npu,0,torch_mm_npu;timing=npu_profiler_batch_offline_kernel_step
2026-03-03T14:25:12.475906+00:00,TORCH,llm_style,tune,llm_style_tune_006,4,6144,1024,fp16,Ascend910B2,torch_mm_npu,-1,-1,-1,-1,-1,-1,0.0,0.0,8.22,12.56488,6.123071532846715,5,-1,-1,torch_mm_npu,0,torch_mm_npu;timing=npu_profiler_batch_offline_kernel_step
2026-03-03T14:25:12.475919+00:00,TORCH,llm_style,tune,llm_style_tune_007,64,6144,1024,fp16,Ascend910B2,torch_mm_npu,-1,-1,-1,-1,-1,-1,0.0,0.0,8.68,14.0032,92.77723133640553,1,-1,-1,torch_mm_npu,0,torch_mm_npu;timing=npu_profiler_batch_offline_kernel_step
2026-03-03T14:25:12.475932+00:00,TORCH,llm_style,tune,llm_style_tune_008,64,1536,3072,fp16,Ascend910B2,torch_mm_npu,-1,-1,-1,-1,-1,-1,0.0,0.0,12.68,22.147999999999996,47.632474447949534,3,-1,-1,torch_mm_npu,0,torch_mm_npu;timing=npu_profiler_batch_offline_kernel_step
2026-03-03T14:25:12.475944+00:00,TORCH,llm_style,tune,llm_style_tune_009,2,4096,3072,fp16,Ascend910B2,torch_mm_npu,-1,-1,-1,-1,-1,-1,0.0,0.0,14.74,21.9424,3.4146301221166895,5,-1,-1,torch_mm_npu,0,torch_mm_npu;timing=npu_profiler_batch_offline_kernel_step
2026-03-03T14:25:12.475956+00:00,TORCH,llm_style,tune,llm_style_tune_010,32,3072,1536,fp16,Ascend910B2,torch_mm_npu,-1,-1,-1,-1,-1,-1,0.0,0.0,7.2,12.108,41.94304,1,-1,-1,torch_mm_npu,0,torch_mm_npu;timing=npu_profiler_batch_offline_kernel_step
2026-03-03T14:25:12.475968+00:00,TORCH,llm_style,tune,llm_style_tune_011,2,1536,1024,fp16,Ascend910B2,torch_mm_npu,-1,-1,-1,-1,-1,-1,0.0,0.0,5.82,8.548879999999999,1.0810061855670103,7,-1,-1,torch_mm_npu,0,torch_mm_npu;timing=npu_profiler_batch_offline_kernel_step
2026-03-03T14:25:12.475979+00:00,TORCH,llm_style,tune,llm_style_tune_012,4,1536,4096,fp16,Ascend910B2,torch_mm_npu,-1,-1,-1,-1,-1,-1,0.0,0.0,12.0,19.0856,4.194304,6,-1,-1,torch_mm_npu,0,torch_mm_npu;timing=npu_profiler_batch_offline_kernel_step
2026-03-03T14:25:12.475990+00:00,TORCH,llm_style,tune,llm_style_tune_013,64,6144,1024,fp16,Ascend910B2,torch_mm_npu,-1,-1,-1,-1,-1,-1,0.0,0.0,8.7,9.031199999999998,92.56395034482759,1,-1,-1,torch_mm_npu,0,torch_mm_npu;timing=npu_profiler_batch_offline_kernel_step
2026-03-03T14:25:12.476001+00:00,TORCH,llm_style,tune,llm_style_tune_014,32,4096,2048,fp16,Ascend910B2,torch_mm_npu,-1,-1,-1,-1,-1,-1,0.0,0.0,11.5,17.74432,46.684427130434784,1,-1,-1,torch_mm_npu,0,torch_mm_npu;timing=npu_profiler_batch_offline_kernel_step
2026-03-03T14:25:12.476013+00:00,TORCH,llm_style,tune,llm_style_tune_015,32,1536,3072,fp16,Ascend910B2,torch_mm_npu,-1,-1,-1,-1,-1,-1,0.0,0.0,10.52,19.877119999999998,28.706263117870723,3,-1,-1,torch_mm_npu,0,torch_mm_npu;timing=npu_profiler_batch_offline_kernel_step
2026-03-03T14:25:22.659084+00:00,TORCH,llm_style,eval,llm_style_eval_000,32,1536,1024,fp16,Ascend910B2,torch_mm_npu,-1,-1,-1,-1,-1,-1,0.0,0.0,6.34,6.5527999999999995,15.877491482649845,3,-1,-1,torch_mm_npu,0,torch_mm_npu;timing=npu_profiler_batch_offline_kernel_step
2026-03-03T14:25:22.659202+00:00,TORCH,llm_style,eval,llm_style_eval_001,32,2048,8192,fp16,Ascend910B2,torch_mm_npu,-1,-1,-1,-1,-1,-1,0.0,0.0,21.66,39.0184,49.57256805170822,2,-1,-1,torch_mm_npu,0,torch_mm_npu;timing=npu_profiler_batch_offline_kernel_step
2026-03-03T14:25:22.659221+00:00,TORCH,llm_style,eval,llm_style_eval_002,16,2048,4096,fp16,Ascend910B2,torch_mm_npu,-1,-1,-1,-1,-1,-1,0.0,0.0,11.32,23.422,23.713379505300352,2,-1,-1,torch_mm_npu,0,torch_mm_npu;timing=npu_profiler_batch_offline_kernel_step
2026-03-03T14:25:22.659235+00:00,TORCH,llm_style,eval,llm_style_eval_003,16,2048,1536,fp16,Ascend910B2,torch_mm_npu,-1,-1,-1,-1,-1,-1,0.0,0.0,6.06,10.0984,16.61110495049505,3,-1,-1,torch_mm_npu,0,torch_mm_npu;timing=npu_profiler_batch_offline_kernel_step
2026-03-03T14:25:22.659247+00:00,TORCH,llm_style,eval,llm_style_eval_004,64,8192,2048,fp16,Ascend910B2,torch_mm_npu,-1,-1,-1,-1,-1,-1,0.0,0.0,21.66,32.184,99.14513610341643,1,-1,-1,torch_mm_npu,0,torch_mm_npu;timing=npu_profiler_batch_offline_kernel_step
2026-03-03T14:25:22.659259+00:00,TORCH,llm_style,eval,llm_style_eval_005,64,3072,8192,fp16,Ascend910B2,torch_mm_npu,-1,-1,-1,-1,-1,-1,0.0,0.0,26.18,53.56752,123.04146187929717,0,-1,-1,torch_mm_npu,0,torch_mm_npu;timing=npu_profiler_batch_offline_kernel_step
2026-03-03T14:25:22.659271+00:00,TORCH,llm_style,eval,llm_style_eval_006,32,2048,2048,fp16,Ascend910B2,torch_mm_npu,-1,-1,-1,-1,-1,-1,0.0,0.0,7.54,13.2304,35.60151936339523,3,-1,-1,torch_mm_npu,0,torch_mm_npu;timing=npu_profiler_batch_offline_kernel_step
2026-03-03T14:25:22.659285+00:00,TORCH,llm_style,eval,llm_style_eval_007,8,8192,2048,fp16,Ascend910B2,torch_mm_npu,-1,-1,-1,-1,-1,-1,0.0,0.0,20.6,29.723999999999997,13.030847378640775,1,-1,-1,torch_mm_npu,0,torch_mm_npu;timing=npu_profiler_batch_offline_kernel_step
2026-03-03T14:25:22.659301+00:00,TORCH,llm_style,eval,llm_style_eval_008,64,1536,8192,fp16,Ascend910B2,torch_mm_npu,-1,-1,-1,-1,-1,-1,0.0,0.0,25.002,40.72991999999999,64.41935589152868,2,-1,-1,torch_mm_npu,0,torch_mm_npu;timing=npu_profiler_batch_offline_kernel_step
2026-03-03T14:25:22.659313+00:00,TORCH,llm_style,eval,llm_style_eval_009,64,4096,6144,fp16,Ascend910B2,torch_mm_npu,-1,-1,-1,-1,-1,-1,0.0,0.0,28.58,46.092,112.70907879636111,0,-1,-1,torch_mm_npu,0,torch_mm_npu;timing=npu_profiler_batch_offline_kernel_step
2026-03-03T14:25:22.659325+00:00,TORCH,llm_style,eval,llm_style_eval_010,64,2048,4096,fp16,Ascend910B2,torch_mm_npu,-1,-1,-1,-1,-1,-1,0.0,0.0,13.46,21.4,79.77279524517087,2,-1,-1,torch_mm_npu,0,torch_mm_npu;timing=npu_profiler_batch_offline_kernel_step
2026-03-03T14:25:22.659336+00:00,TORCH,llm_style,eval,llm_style_eval_011,32,3072,6144,fp16,Ascend910B2,torch_mm_npu,-1,-1,-1,-1,-1,-1,0.0,0.0,17.88,41.63792,67.55925906040268,0,-1,-1,torch_mm_npu,0,torch_mm_npu;timing=npu_profiler_batch_offline_kernel_step
2026-03-03T14:25:22.659347+00:00,TORCH,llm_style,eval,llm_style_eval_012,16,1536,1536,fp16,Ascend910B2,torch_mm_npu,-1,-1,-1,-1,-1,-1,0.0,0.0,6.96,11.1376,10.847337931034483,3,-1,-1,torch_mm_npu,0,torch_mm_npu;timing=npu_profiler_batch_offline_kernel_step
2026-03-03T14:25:22.659358+00:00,TORCH,llm_style,eval,llm_style_eval_013,64,2048,3072,fp16,Ascend910B2,torch_mm_npu,-1,-1,-1,-1,-1,-1,0.0,0.0,10.88,21.144,74.0171294117647,3,-1,-1,torch_mm_npu,0,torch_mm_npu;timing=npu_profiler_batch_offline_kernel_step
2026-03-03T14:25:22.659370+00:00,TORCH,llm_style,eval,llm_style_eval_014,16,8192,6144,fp16,Ascend910B2,torch_mm_npu,-1,-1,-1,-1,-1,-1,0.0,0.0,57.662,92.94991999999999,27.931961014186122,0,-1,-1,torch_mm_npu,0,torch_mm_npu;timing=npu_profiler_batch_offline_kernel_step
2026-03-03T14:25:22.659381+00:00,TORCH,llm_style,eval,llm_style_eval_015,64,6144,1536,fp16,Ascend910B2,torch_mm_npu,-1,-1,-1,-1,-1,-1,0.0,0.0,11.1,20.240000000000002,108.82518486486487,1,-1,-1,torch_mm_npu,0,torch_mm_npu;timing=npu_profiler_batch_offline_kernel_step
