results/pipeline_repro_20260303T142236Z/prototype_best.csv
shape,picked_config_id,BLOCK_M,BLOCK_N,BLOCK_K,runtime_cost_us,invalid_config,score,notes
8x2048x4096,c24,16,128,128,17.22,0,17.22,"path_reordered;launch=fixed_cores(16),swizzle2d_g=4,dir=1;timing=npu_profiler_batch_offline_kernel_step"
64x6144x1024,c12,128,128,128,13.48,0,13.48,"path_reordered;launch=fixed_cores(24),swizzle2d_g=4,dir=1;timing=npu_profiler_batch_offline_kernel_step"
4x6144x1024,c29,16,256,128,8.5,0,8.5,"path_reordered;launch=fixed_cores(24),swizzle2d_g=4,dir=1;timing=npu_profiler_batch_offline_kernel_step"
64x8192x8192,c18,64,128,128,104.722,0,104.722,"path_reordered;launch=fixed_cores(24),swizzle2d_g=4,dir=1;timing=npu_profiler_batch_offline_kernel_step"
