results/pipeline_repro_20260304T095728Z/bucket_torch_case_compare_eval.csv
workload,shape_id,M,N,K,dtype,gpu,BLOCK_M,BLOCK_N,BLOCK_K,bucket_key,shape,runtime_cost_us_TORCH,runtime_cost_us_BUCKET,config_id_BUCKET,config_desc_BUCKET,invalid_config_TORCH,invalid_config_BUCKET,timing_source_TORCH,timing_source_BUCKET,speedup_BUCKET_vs_TORCH
bucket_torch_npu,bucket_torch_eval_000,32,1536,1024,fp16,Ascend910B2,64,128,256,7,32x1536x1024,5.96,5.38,c4,"c4 BM=64,BN=128,BK=256",0,0,npu_profiler_batch_offline_kernel_step,npu_profiler_batch_offline_kernel_step,1.107807
bucket_torch_npu,bucket_torch_eval_001,32,2048,8192,fp16,Ascend910B2,64,128,256,6,32x2048x8192,21.8,27.26,c4,"c4 BM=64,BN=128,BK=256",0,0,npu_profiler_batch_offline_kernel_step,npu_profiler_batch_offline_kernel_step,0.799707
bucket_torch_npu,bucket_torch_eval_002,16,2048,4096,fp16,Ascend910B2,64,128,256,6,16x2048x4096,11.62,14.46,c4,"c4 BM=64,BN=128,BK=256",0,0,npu_profiler_batch_offline_kernel_step,npu_profiler_batch_offline_kernel_step,0.803596
bucket_torch_npu,bucket_torch_eval_003,16,2048,1536,fp16,Ascend910B2,64,128,256,7,16x2048x1536,6.08,7.18,c4,"c4 BM=64,BN=128,BK=256",0,0,npu_profiler_batch_offline_kernel_step,npu_profiler_batch_offline_kernel_step,0.846797
