results/pipeline_repro_20260304T042244Z/bucket_torch_case_compare_eval.csv
workload,shape_id,M,N,K,dtype,gpu,BLOCK_M,BLOCK_N,BLOCK_K,bucket_key,shape,runtime_cost_us_TORCH,runtime_cost_us_BUCKET,runtime_cost_us_FULL_TUNE,config_id_TORCH,config_id_BUCKET,config_id_FULL_TUNE,config_desc_TORCH,config_desc_BUCKET,config_desc_FULL_TUNE,invalid_config_TORCH,invalid_config_BUCKET,invalid_config_FULL_TUNE,timing_source_TORCH,timing_source_BUCKET,timing_source_FULL_TUNE,ratio_BUCKET_over_TORCH,ratio_FULL_TUNE_over_TORCH,delta_us_BUCKET_minus_TORCH,delta_us_FULL_TUNE_minus_TORCH
bucket_torch_npu,bucket_torch_eval_000,32,1536,1024,fp16,Ascend910B2,16,256,128,7,32x1536x1024,6.44,7.46,6.9,torch_mm_npu,c29,c18,"torch.mm(dtype=fp16,device=npu)","BM=16,BN=256,BK=128","BM=64,BN=128,BK=128",0,0,0,npu_profiler_batch_offline_kernel_step,npu_profiler_batch_offline_kernel_step,npu_profiler_batch_offline_kernel_step,1.158385,1.071429,1.020000,0.460000
bucket_torch_npu,bucket_torch_eval_001,32,2048,8192,fp16,Ascend910B2,16,256,128,6,32x2048x8192,21.48,41.04,33.8,torch_mm_npu,c29,c16,"torch.mm(dtype=fp16,device=npu)","BM=16,BN=256,BK=128","BM=96,BN=128,BK=128",0,0,0,npu_profiler_batch_offline_kernel_step,npu_profiler_batch_offline_kernel_step,npu_profiler_batch_offline_kernel_step,1.910615,1.573557,19.560000,12.320000
bucket_torch_npu,bucket_torch_eval_002,16,2048,4096,fp16,Ascend910B2,16,256,128,6,16x2048x4096,11.4,20.802,18.16,torch_mm_npu,c29,c23,"torch.mm(dtype=fp16,device=npu)","BM=16,BN=256,BK=128","BM=128,BN=128,BK=128",0,0,0,npu_profiler_batch_offline_kernel_step,npu_profiler_batch_offline_kernel_step,npu_profiler_batch_offline_kernel_step,1.824737,1.592982,9.402000,6.760000
bucket_torch_npu,bucket_torch_eval_003,16,2048,1536,fp16,Ascend910B2,16,256,128,7,16x2048x1536,5.92,9.182,8.62,torch_mm_npu,c29,c23,"torch.mm(dtype=fp16,device=npu)","BM=16,BN=256,BK=128","BM=128,BN=128,BK=128",0,0,0,npu_profiler_batch_offline_kernel_step,npu_profiler_batch_offline_kernel_step,npu_profiler_batch_offline_kernel_step,1.551014,1.456081,3.262000,2.700000
