results/pipeline_smoke/bucket_torch.csv
timestamp,method,workload,split,shape_id,M,N,K,dtype,gpu,config_id,BLOCK_M,BLOCK_N,BLOCK_K,num_warps,num_stages,GROUP_M,compile_time_ms,tune_time_ms,runtime_cost_us,p99_us,runtime_perf_tflops,bucket_m,bucket_n,bucket_k,cache_key,invalid_config,notes
2026-03-03T13:51:49.142968+00:00,BUCKET,llm_style,tune,llm_style_tune_000,1,3072,1536,fp16,Ascend910B2,c18,64,128,128,4,2,4,192.75493174791336,4665.55,8.23,8.259400000000001,1.1466809234507898,5,-1,-1,llm8_g5,0,"batch_tune;path_reordered,ASCEND_HOME_PATH_set,ASCEND_TOOLKIT_HOME_set;launch=fixed_cores(24),swizzle2d_g=4,dir=1;timing=npu_profiler_batch_offline_kernel_step"
2026-03-03T13:51:54.120261+00:00,BUCKET,llm_style,tune,llm_style_tune_001,16,6144,4096,fp16,Ascend910B2,c18,64,128,128,4,2,4,0.0,4977.127,34.05,34.2166,23.650700969163,0,-1,-1,llm8_g0,0,"batch_tune;path_reordered,ASCEND_HOME_PATH_set,ASCEND_TOOLKIT_HOME_set;launch=fixed_cores(24),swizzle2d_g=4,dir=1;timing=npu_profiler_batch_offline_kernel_flat_fallback"
2026-03-03T13:51:58.614858+00:00,BUCKET,llm_style,tune,llm_style_tune_002,2,1536,4096,fp16,Ascend910B2,c18,64,128,128,4,2,4,0.0,4494.431,15.83,15.9966,1.5897551484523058,6,-1,-1,llm8_g6,0,"batch_tune;path_reordered,ASCEND_HOME_PATH_set,ASCEND_TOOLKIT_HOME_set;launch=fixed_cores(12),swizzle2d_g=4,dir=1;timing=npu_profiler_batch_offline_kernel_flat_fallback"
2026-03-03T13:52:03.972551+00:00,BUCKET,llm_style,tune,llm_style_tune_003,8,4096,3072,fp16,Ascend910B2,c18,64,128,128,4,2,4,0.0,5357.551,25.55,25.6382,7.879710058708415,1,-1,-1,llm8_g1,0,"batch_tune;path_reordered,ASCEND_HOME_PATH_set,ASCEND_TOOLKIT_HOME_set;launch=fixed_cores(24),swizzle2d_g=4,dir=1;timing=npu_profiler_batch_offline_kernel_flat_fallback"
2026-03-03T13:52:08.733893+00:00,BUCKET,llm_style,tune,llm_style_tune_004,4,3072,6144,fp16,Ascend910B2,c18,64,128,128,4,2,4,0.0,4761.198,25.661,25.89522,5.884219009391684,4,-1,-1,llm8_g4,0,"batch_tune;path_reordered,ASCEND_HOME_PATH_set,ASCEND_TOOLKIT_HOME_set;launch=fixed_cores(24),swizzle2d_g=4,dir=1;timing=npu_profiler_batch_offline_kernel_flat_fallback"
2026-03-03T13:52:13.105868+00:00,BUCKET,llm_style,tune,llm_style_tune_005,32,1024,1536,fp16,Ascend910B2,c18,64,128,128,4,2,4,0.0,4371.817,7.971,8.45218,12.628691004892737,3,-1,-1,llm8_g3,0,"batch_tune;path_reordered,ASCEND_HOME_PATH_set,ASCEND_TOOLKIT_HOME_set;launch=fixed_cores(8),swizzle2d_g=4,dir=1;timing=npu_profiler_batch_offline_kernel_flat_fallback"
2026-03-03T13:52:17.539204+00:00,BUCKET,llm_style,tune,llm_style_tune_006,4,1536,3072,fp16,Ascend910B2,c18,64,128,128,4,2,4,0.0,4433.167,13.11,13.158999999999999,2.879384897025172,7,-1,-1,llm8_g7,0,"batch_tune;path_reordered,ASCEND_HOME_PATH_set,ASCEND_TOOLKIT_HOME_set;launch=fixed_cores(12),swizzle2d_g=4,dir=1;timing=npu_profiler_batch_offline_kernel_flat_fallback"
2026-03-03T13:52:22.045854+00:00,BUCKET,llm_style,tune,llm_style_tune_007,64,1536,4096,fp16,Ascend910B2,c18,64,128,128,4,2,4,0.0,4506.499,18.391,18.42138,43.78806851177207,2,-1,-1,llm8_g2,0,"batch_tune;path_reordered,ASCEND_HOME_PATH_set,ASCEND_TOOLKIT_HOME_set;launch=fixed_cores(12),swizzle2d_g=4,dir=1;timing=npu_profiler_batch_offline_kernel_flat_fallback"
2026-03-03T13:52:22.045968+00:00,BUCKET,llm_style,eval,llm_style_eval_000,32,1536,1024,fp16,Ascend910B2,c18,64,128,128,4,2,4,0.0,0.0,6.029999999999999,6.0398,16.693747263681594,3,-1,-1,llm8_g3,0,"path_reordered,ASCEND_HOME_PATH_set,ASCEND_TOOLKIT_HOME_set;launch=fixed_cores(12),swizzle2d_g=4,dir=1;timing=npu_profiler_batch_offline_kernel_flat_fallback"
2026-03-03T13:52:22.046001+00:00,BUCKET,llm_style,eval,llm_style_eval_001,32,2048,8192,fp16,Ascend910B2,c18,64,128,128,4,2,4,0.0,0.0,33.501,34.050779999999996,32.05103799886571,2,-1,-1,llm8_g2,0,"path_reordered,ASCEND_HOME_PATH_set,ASCEND_TOOLKIT_HOME_set;launch=fixed_cores(16),swizzle2d_g=4,dir=1;timing=npu_profiler_batch_offline_kernel_flat_fallback"
2026-03-03T13:52:22.046030+00:00,BUCKET,llm_style,eval,llm_style_eval_002,16,2048,4096,fp16,Ascend910B2,c18,64,128,128,4,2,4,0.0,0.0,17.92,18.018,14.979657142857143,2,-1,-1,llm8_g2,0,"path_reordered,ASCEND_HOME_PATH_set,ASCEND_TOOLKIT_HOME_set;launch=fixed_cores(16),swizzle2d_g=4,dir=1;timing=npu_profiler_batch_offline_kernel_flat_fallback"
2026-03-03T13:52:22.046056+00:00,BUCKET,llm_style,eval,llm_style_eval_003,16,2048,1536,fp16,Ascend910B2,c18,64,128,128,4,2,4,0.0,0.0,8.17,8.219000000000001,12.321088861689107,3,-1,-1,llm8_g3,0,"path_reordered,ASCEND_HOME_PATH_set,ASCEND_TOOLKIT_HOME_set;launch=fixed_cores(16),swizzle2d_g=4,dir=1;timing=npu_profiler_batch_offline_kernel_flat_fallback"
2026-03-03T13:52:34.684781+00:00,TORCH,llm_style,tune,llm_style_tune_000,1,3072,1536,fp16,Ascend910B2,torch_mm_npu,-1,-1,-1,-1,-1,-1,491.57245829701424,0.0,7.07,7.2562,1.3348209335219237,5,-1,-1,torch_mm_npu,0,torch_mm_npu;timing=npu_profiler_batch_offline_kernel_step
2026-03-03T13:52:34.684858+00:00,TORCH,llm_style,tune,llm_style_tune_001,16,6144,4096,fp16,Ascend910B2,torch_mm_npu,-1,-1,-1,-1,-1,-1,0.0,0.0,20.43,20.616200000000003,39.41783494860499,0,-1,-1,torch_mm_npu,0,torch_mm_npu;timing=npu_profiler_batch_offline_kernel_step
2026-03-03T13:52:34.684875+00:00,TORCH,llm_style,tune,llm_style_tune_002,2,1536,4096,fp16,Ascend910B2,torch_mm_npu,-1,-1,-1,-1,-1,-1,0.0,0.0,11.69,11.837,2.152765098374679,6,-1,-1,torch_mm_npu,0,torch_mm_npu;timing=npu_profiler_batch_offline_kernel_step
2026-03-03T13:52:34.684889+00:00,TORCH,llm_style,tune,llm_style_tune_003,8,4096,3072,fp16,Ascend910B2,torch_mm_npu,-1,-1,-1,-1,-1,-1,0.0,0.0,14.92,15.1552,13.493739410187668,1,-1,-1,torch_mm_npu,0,torch_mm_npu;timing=npu_profiler_batch_offline_kernel_step
2026-03-03T13:52:34.684903+00:00,TORCH,llm_style,tune,llm_style_tune_004,4,3072,6144,fp16,Ascend910B2,torch_mm_npu,-1,-1,-1,-1,-1,-1,0.0,0.0,15.951,15.99902,9.466174158359976,4,-1,-1,torch_mm_npu,0,torch_mm_npu;timing=npu_profiler_batch_offline_kernel_step
2026-03-03T13:52:34.684916+00:00,TORCH,llm_style,tune,llm_style_tune_005,32,1024,1536,fp16,Ascend910B2,torch_mm_npu,-1,-1,-1,-1,-1,-1,0.0,0.0,9.96,10.2148,10.106756626506023,3,-1,-1,torch_mm_npu,0,torch_mm_npu;timing=npu_profiler_batch_offline_kernel_step
2026-03-03T13:52:34.684931+00:00,TORCH,llm_style,tune,llm_style_tune_006,4,1536,3072,fp16,Ascend910B2,torch_mm_npu,-1,-1,-1,-1,-1,-1,0.0,0.0,9.241,9.457579999999998,4.084918948165782,7,-1,-1,torch_mm_npu,0,torch_mm_npu;timing=npu_profiler_batch_offline_kernel_step
2026-03-03T13:52:34.684943+00:00,TORCH,llm_style,tune,llm_style_tune_007,64,1536,4096,fp16,Ascend910B2,torch_mm_npu,-1,-1,-1,-1,-1,-1,0.0,0.0,13.821,13.859219999999999,58.266866941610594,2,-1,-1,torch_mm_npu,0,torch_mm_npu;timing=npu_profiler_batch_offline_kernel_step
2026-03-03T13:52:39.735470+00:00,TORCH,llm_style,eval,llm_style_eval_000,32,1536,1024,fp16,Ascend910B2,torch_mm_npu,-1,-1,-1,-1,-1,-1,0.0,0.0,5.92,6.037599999999999,17.003935135135134,3,-1,-1,torch_mm_npu,0,torch_mm_npu;timing=npu_profiler_batch_offline_kernel_step
2026-03-03T13:52:39.735574+00:00,TORCH,llm_style,eval,llm_style_eval_001,32,2048,8192,fp16,Ascend910B2,torch_mm_npu,-1,-1,-1,-1,-1,-1,0.0,0.0,21.231,21.729819999999997,50.574246337902125,2,-1,-1,torch_mm_npu,0,torch_mm_npu;timing=npu_profiler_batch_offline_kernel_step
2026-03-03T13:52:39.735592+00:00,TORCH,llm_style,eval,llm_style_eval_002,16,2048,4096,fp16,Ascend910B2,torch_mm_npu,-1,-1,-1,-1,-1,-1,0.0,0.0,11.52,11.5984,23.30168888888889,2,-1,-1,torch_mm_npu,0,torch_mm_npu;timing=npu_profiler_batch_offline_kernel_step
2026-03-03T13:52:39.735607+00:00,TORCH,llm_style,eval,llm_style_eval_003,16,2048,1536,fp16,Ascend910B2,torch_mm_npu,-1,-1,-1,-1,-1,-1,0.0,0.0,6.1,6.1,16.502179672131145,3,-1,-1,torch_mm_npu,0,torch_mm_npu;timing=npu_profiler_batch_offline_kernel_step
